Sheet: Лист1
G1: Отчёт о теплопотреблении за октябрь 2018 | M1: з.н д. №02/147-2783 от 04.10.18 с 23.09.18г по 25.09.18г некорректная работа приборов
A4: =EOMONTH(R[9]C,0)-R[9]C -> 8 | B4: Потребитель: ЗАО "Сити Сервис"
A5: =MAX(R[9]C:R[78]C) -> 2018-10-22T00:00:00.000 | B5: Адрес: г. СПб, Наличная ул., д.55 ИТП 1
A6: =EOMONTH(R[-1]C,0)-R[-1]C -> 9 | B6: Телефон: 8-911-021-19-79
A7: =R[-2]C-R[6]C -> 30 | B7: Договор 10023-3 (.) 360, 361, 85874
A8: 7 | B8: Тепловычислитель: ВКТ-7 № 50025 | L8: М2 мах= | M8: 137.04 | O8: Мгвс мах= | P8: 11.76
L9: Qотоп мах= | M9: 10.958 | O9: Qгвс мах= | P9: 0.775
B10: Расчётная формула: Q=M1*(h1-hхв)-M2*(h2-hхв)
D12: Учет | L12: Контроль
A13: =R[1]C[1]-1 -> 2018-09-22T00:00:00.000 | B13: Дата | C13: N, ч | D13: M1, т | E13: T1, С | F13: P1, кг/см2 | G13: M2, т | H13: T2, С | I13: P2, кг/см2 | J13: dT, С | K13: M1-М2, т | L13: V3, м3 | M13: T3, С | N13: V4, м3 | O13: =IF(R[-12]C[-14]="м.куб","","T4, С") -> T4, С | P13: dT, С | Q13: V3-V4, м3 | R13: Qгвс, Гкал | S13: Qобщ., Гкал | T13: Q | U13: M3 | V13: M4 | W13: си2 | X13: си3 | Y13: Разб. | Z13: dM2 | AC13: Дата | AD13: НС | AE13: n, ч | AF13: М1, т | AG13: t1, гр. С | AH13: Р1, кгс/см2 | AI13: М2, т | AJ13: t2, гр. С | AK13: Р2, кгс/см2 | AL13: t1-t2, гр. С | AM13: М1-М2, т | AN13: М1гвс, т | AO13: t1гвс, гр. С | AP13: Р1гвс, кгс/см2 | AQ13: М2гвс, т | AR13: t2гвс, гр. С | AS13: Р2гвс, кгс/см2 | AT13: t1гвс-t2гвс | AU13: М1гвс-М2гвс, т | AV13: Wгвс, Гкал | AW13: Wсумм, Гкал | AY13: NS_TV1 | AZ13: НС | BA13: NS_TV2
A14: =IF(RC[1]="","",DATEVALUE(RC[1])) -> 43366 | B14: 23.09.18 | C14: 24 | D14: 0 | E14: 31.91 | F14: 3.87 | G14: 7.01 | H14: 52.67 | I14: 5.01 | J14: =RC[-5]-RC[-2] -> -20.76 | K14: -7.01 | L14: 46.466666666666669 | M14: 66.213333333333324 | N14: 38.119999999999997 | O14: 51.370000000000005 | P14: 14.843333333333328 | Q14: 8.3466666666666658 | R14: 1.0846666666666667 | S14: =RC[-1] -> 1.0846666666666667 | T14: =(RC[-16]*RC[-15]-RC[-13]*RC[-12])/1000 -> -0.36921670000000001 | U14: 0.66 | V14: 6.71 | W14: =RC[-2]*RC[-10]/1000 -> 4.3700799999999991E-2 | X14: =ABS((RC[-3]*RC[-11]-RC[-2]*RC[-9])/1000) -> 0.30099189999999998 | Y14: =(RC[-14]-RC[1])/RC[-18]*100 -> -13.69472182596291 | Z14: -6.05 | AC14: =VALUE(RC[-27]) -> 2018-09-23T00:00:00.000 | AD14: =IF(RC[21]=42,"*",IF(RC[21]=32,"",RC[21])) -> - | AE14: =RC[-28] -> 24 | AF14: =RC[-28] -> 0 | AG14: =RC[-28] -> 31.91 | AH14: =RC[-28] -> 3.87 | AI14: =RC[-28] -> 7.01 | AJ14: =RC[-28] -> 52.67 | AK14: =RC[-28] -> 5.01 | AL14: =RC[-28] -> -20.76 | AM14: =RC[-28] -> -7.01 | AN14: =RC[-28] -> 46.466666666666669 | AO14: =RC[-28] -> 66.213333333333324 | AP14: - | AQ14: =RC[-29] -> 38.119999999999997 | AR14: =RC[-29] -> 51.370000000000005 | AS14: - | AT14: =RC[-30] -> 14.843333333333328 | AU14: =RC[-30] -> 8.3466666666666658 | AV14: =RC[-30] -> 1.0846666666666667 | AW14: =RC[-30] -> 1.0846666666666667 | AY14: - | AZ14: - | BA14: -
A15: =IF(RC[1]="","",DATEVALUE(RC[1])) -> 43367 | B15: 24.09.18 | C15: 24 | D15: 76.52 | E15: 69.55 | F15: 5.31 | G15: 75.27 | H15: 65.19 | I15: 5.05 | J15: =RC[-5]-RC[-2] -> 4.3599999999999994 | K15: 1.25 | L15: 46.466666666666669 | M15: 66.213333333333324 | N15: 38.119999999999997 | O15: 51.370000000000005 | P15: 14.843333333333328 | Q15: 8.3466666666666658 | R15: 1.0846666666666667 | S15: =RC[-1] -> 1.0846666666666667 | T15: =(RC[-16]*RC[-15]-RC[-13]*RC[-12])/1000 -> 0.41511470000000006 | U15: 18.97 | V15: 17.72 | W15: =RC[-2]*RC[-10]/1000 -> 1.256066933333333 | X15: =ABS((RC[-3]*RC[-11]-RC[-2]*RC[-9])/1000) -> 0.34579053333333309 | Y15: =(RC[-14]-RC[1])/RC[-18]*100 -> 0 | Z15: 1.25 | AC15: =VALUE(RC[-27]) -> 2018-09-24T00:00:00.000 | AD15: =IF(RC[21]=42,"*",IF(RC[21]=32,"",RC[21])) -> - | AE15: =RC[-28] -> 24 | AF15: =RC[-28] -> 76.52 | AG15: =RC[-28] -> 69.55 | AH15: =RC[-28] -> 5.31 | AI15: =RC[-28] -> 75.27 | AJ15: =RC[-28] -> 65.19 | AK15: =RC[-28] -> 5.05 | AL15: =RC[-28] -> 4.3599999999999994 | AM15: =RC[-28] -> 1.25 | AN15: =RC[-28] -> 46.466666666666669 | AO15: =RC[-28] -> 66.213333333333324 | AP15: - | AQ15: =RC[-29] -> 38.119999999999997 | AR15: =RC[-29] -> 51.370000000000005 | AS15: - | AT15: =RC[-30] -> 14.843333333333328 | AU15: =RC[-30] -> 8.3466666666666658 | AV15: =RC[-30] -> 1.0846666666666667 | AW15: =RC[-30] -> 1.0846666666666667 | AY15: - | AZ15: - | BA15: -
A16: =IF(RC[1]="","",DATEVALUE(RC[1])) -> 43368 | B16: 25.09.18 | C16: 24 | D16: 175.63 | E16: 68.569999999999993 | F16: 8.7899999999999991 | G16: 167.04 | H16: 65.13 | I16: 4.95 | J16: =RC[-5]-RC[-2] -> 3.4399999999999977 | K16: 8.59 | L16: =AVERAGE(R[1]C:R[3]C) -> 46.466666666666669 | M16: =AVERAGE(R[1]C:R[3]C) -> 66.213333333333324 | N16: =AVERAGE(R[1]C:R[3]C) -> 38.119999999999997 | O16: =AVERAGE(R[1]C:R[3]C) -> 51.370000000000005 | P16: =AVERAGE(R[1]C:R[3]C) -> 14.843333333333328 | Q16: =AVERAGE(R[1]C:R[3]C) -> 8.3466666666666658 | R16: =AVERAGE(R[1]C:R[3]C) -> 1.0846666666666667 | S16: =RC[-1] -> 1.0846666666666667 | T16: =(RC[-16]*RC[-15]-RC[-13]*RC[-12])/1000 -> 1.1636338999999989 | U16: 41.79 | V16: 33.42 | W16: =RC[-2]*RC[-10]/1000 -> 2.7670551999999993 | X16: =ABS((RC[-3]*RC[-11]-RC[-2]*RC[-9])/1000) -> 1.050269799999999 | Y16: =(RC[-14]-RC[1])/RC[-18]*100 -> 0.13170498084291227 | Z16: 8.3699999999999992 | AC16: =VALUE(RC[-27]) -> 2018-09-25T00:00:00.000 | AD16: =IF(RC[21]=42,"*",IF(RC[21]=32,"",RC[21])) -> - | AE16: =RC[-28] -> 24 | AF16: =RC[-28] -> 175.63 | AG16: =RC[-28] -> 68.569999999999993 | AH16: =RC[-28] -> 8.7899999999999991 | AI16: =RC[-28] -> 167.04 | AJ16: =RC[-28] -> 65.13 | AK16: =RC[-28] -> 4.95 | AL16: =RC[-28] -> 3.4399999999999977 | AM16: =RC[-28] -> 8.59 | AN16: =RC[-28] -> 46.466666666666669 | AO16: =RC[-28] -> 66.213333333333324 | AP16: - | AQ16: =RC[-29] -> 38.119999999999997 | AR16: =RC[-29] -> 51.370000000000005 | AS16: - | AT16: =RC[-30] -> 14.843333333333328 | AU16: =RC[-30] -> 8.3466666666666658 | AV16: =RC[-30] -> 1.0846666666666667 | AW16: =RC[-30] -> 1.0846666666666667 | AY16: - | AZ16: - | BA16: -
A17: =IF(RC[1]="","",DATEVALUE(RC[1])) -> 43369 | B17: 26.09.18 | C17: 24 | D17: 175.36 | E17: 68.08 | F17: 8.7899999999999991 | G17: 167.24 | H17: 64.7 | I17: 4.92 | J17: =RC[-5]-RC[-2] -> 3.3799999999999955 | K17: 8.1199999999999992 | L17: 42.22 | M17: 67.709999999999994 | N17: 34.07 | O17: 51.14 | P17: =IF(AND(ISNUMBER(RC[-3]),ISNUMBER(RC[-1])),RC[-3]-RC[-1],"-") -> 16.569999999999993 | Q17: 8.15 | R17: 1.0840000000000001 | S17: 1.129 | T17: =(RC[-16]*RC[-15]-RC[-13]*RC[-12])/1000 -> 1.1180807999999998 | U17: 41.34 | V17: 33.590000000000003 | W17: =RC[-2]*RC[-10]/1000 -> 2.7991313999999998 | X17: =ABS((RC[-3]*RC[-11]-RC[-2]*RC[-9])/1000) -> 1.0813387999999995 | Y17: =(RC[-14]-RC[1])/RC[-18]*100 -> 0.22123893805309686 | Z17: 7.75 | AC17: =VALUE(RC[-27]) -> 2018-09-26T00:00:00.000 | AD17: =IF(RC[21]=42,"*",IF(RC[21]=32,"",RC[21])) -> - | AE17: =RC[-28] -> 24 | AF17: =RC[-28] -> 175.36 | AG17: =RC[-28] -> 68.08 | AH17: =RC[-28] -> 8.7899999999999991 | AI17: =RC[-28] -> 167.24 | AJ17: =RC[-28] -> 64.7 | AK17: =RC[-28] -> 4.92 | AL17: =RC[-28] -> 3.3799999999999955 | AM17: =RC[-28] -> 8.1199999999999992 | AN17: =RC[-28] -> 42.22 | AO17: =RC[-28] -> 67.709999999999994 | AP17: - | AQ17: =RC[-29] -> 34.07 | AR17: =RC[-29] -> 51.14 | AS17: - | AT17: =RC[-30] -> 16.569999999999993 | AU17: =RC[-30] -> 8.15 | AV17: =RC[-30] -> 1.0840000000000001 | AW17: =RC[-30] -> 1.129 | AY17: - | AZ17: - | BA17: -
A18: =IF(RC[1]="","",DATEVALUE(RC[1])) -> 43370 | B18: 27.09.18 | C18: 24 | D18: 176.24 | E18: 63.43 | F18: 8.5 | G18: 166.16 | H18: 56.24 | I18: 5.0599999999999996 | J18: =RC[-5]-RC[-2] -> 7.1899999999999977 | K18: 10.08 | L18: 45.89 | M18: 63.19 | N18: 35.97 | O18: 49.26 | P18: =IF(AND(ISNUMBER(RC[-3]),ISNUMBER(RC[-1])),RC[-3]-RC[-1],"-") -> 13.93 | Q18: 9.92 | R18: 1.101 | S18: 1.8480000000000001 | T18: =(RC[-16]*RC[-15]-RC[-13]*RC[-12])/1000 -> 1.8340648000000002 | U18: 45.06 | V18: 35.590000000000003 | W18: =RC[-2]*RC[-10]/1000 -> 2.8473414000000004 | X18: =ABS((RC[-3]*RC[-11]-RC[-2]*RC[-9])/1000) -> 1.0941780000000001 | Y18: =(RC[-14]-RC[1])/RC[-18]*100 -> 0.36711603273952781 | Z18: 9.4700000000000006 | AC18: =VALUE(RC[-27]) -> 2018-09-27T00:00:00.000 | AD18: =IF(RC[21]=42,"*",IF(RC[21]=32,"",RC[21])) -> - | AE18: =RC[-28] -> 24 | AF18: =RC[-28] -> 176.24 | AG18: =RC[-28] -> 63.43 | AH18: =RC[-28] -> 8.5 | AI18: =RC[-28] -> 166.16 | AJ18: =RC[-28] -> 56.24 | AK18: =RC[-28] -> 5.0599999999999996 | AL18: =RC[-28] -> 7.1899999999999977 | AM18: =RC[-28] -> 10.08 | AN18: =RC[-28] -> 45.89 | AO18: =RC[-28] -> 63.19 | AP18: - | AQ18: =RC[-29] -> 35.97 | AR18: =RC[-29] -> 49.26 | AS18: - | AT18: =RC[-30] -> 13.93 | AU18: =RC[-30] -> 9.92 | AV18: =RC[-30] -> 1.101 | AW18: =RC[-30] -> 1.8480000000000001 | AY18: - | AZ18: - | BA18: -
A19: =IF(RC[1]="","",DATEVALUE(RC[1])) -> 43371 | B19: 28.09.18 | C19: 24 | D19: 188.47 | E19: 67.94 | F19: 8.3000000000000007 | G19: 181.1 | H19: 48.96 | I19: 5.17 | J19: =RC[-5]-RC[-2] -> 18.979999999999997 | K19: 7.37 | L19: 51.29 | M19: 67.739999999999995 | N19: 44.32 | O19: 53.71 | P19: =IF(AND(ISNUMBER(RC[-3]),ISNUMBER(RC[-1])),RC[-3]-RC[-1],"-") -> 14.029999999999994 | Q19: 6.97 | R19: 1.069 | S19: 3.9449999999999998 | T19: =(RC[-16]*RC[-15]-RC[-13]*RC[-12])/1000 -> 3.9379958000000004 | U19: 50.23 | V19: 43.74 | W19: =RC[-2]*RC[-10]/1000 -> 3.4025801999999996 | X19: =ABS((RC[-3]*RC[-11]-RC[-2]*RC[-9])/1000) -> 1.0533047999999994 | Y19: =(RC[-14]-RC[1])/RC[-18]*100 -> 0.48591938155715075 | Z19: 6.49 | AC19: =VALUE(RC[-27]) -> 2018-09-28T00:00:00.000 | AD19: =IF(RC[21]=42,"*",IF(RC[21]=32,"",RC[21])) -> - | AE19: =RC[-28] -> 24 | AF19: =RC[-28] -> 188.47 | AG19: =RC[-28] -> 67.94 | AH19: =RC[-28] -> 8.3000000000000007 | AI19: =RC[-28] -> 181.1 | AJ19: =RC[-28] -> 48.96 | AK19: =RC[-28] -> 5.17 | AL19: =RC[-28] -> 18.979999999999997 | AM19: =RC[-28] -> 7.37 | AN19: =RC[-28] -> 51.29 | AO19: =RC[-28] -> 67.739999999999995 | AP19: - | AQ19: =RC[-29] -> 44.32 | AR19: =RC[-29] -> 53.71 | AS19: - | AT19: =RC[-30] -> 14.029999999999994 | AU19: =RC[-30] -> 6.97 | AV19: =RC[-30] -> 1.069 | AW19: =RC[-30] -> 3.9449999999999998 | AY19: - | AZ19: - | BA19: -
A20: =IF(RC[1]="","",DATEVALUE(RC[1])) -> 43372 | B20: 29.09.18 | C20: 24 | D20: 184.52 | E20: 67.69 | F20: 8.3000000000000007 | G20: 177.64 | H20: 48.59 | I20: 5.3 | J20: =RC[-5]-RC[-2] -> 19.099999999999994 | K20: 6.88 | L20: 50.1 | M20: 67.45 | N20: 43.51 | O20: 53.53 | P20: =IF(AND(ISNUMBER(RC[-3]),ISNUMBER(RC[-1])),RC[-3]-RC[-1],"-") -> 13.920000000000002 | Q20: 6.59 | R20: 1.024 | S20: 3.8650000000000002 | T20: =(RC[-16]*RC[-15]-RC[-13]*RC[-12])/1000 -> 3.8586312000000018 | U20: 49.07 | V20: 42.98 | W20: =RC[-2]*RC[-10]/1000 -> 3.3097715000000001 | X20: =ABS((RC[-3]*RC[-11]-RC[-2]*RC[-9])/1000) -> 1.0090521000000003 | Y20: =(RC[-14]-RC[1])/RC[-18]*100 -> 0.44471965773474448 | Z20: 6.09 | AC20: =VALUE(RC[-27]) -> 2018-09-29T00:00:00.000 | AD20: =IF(RC[21]=42,"*",IF(RC[21]=32,"",RC[21])) -> - | AE20: =RC[-28] -> 24 | AF20: =RC[-28] -> 184.52 | AG20: =RC[-28] -> 67.69 | AH20: =RC[-28] -> 8.3000000000000007 | AI20: =RC[-28] -> 177.64 | AJ20: =RC[-28] -> 48.59 | AK20: =RC[-28] -> 5.3 | AL20: =RC[-28] -> 19.099999999999994 | AM20: =RC[-28] -> 6.88 | AN20: =RC[-28] -> 50.1 | AO20: =RC[-28] -> 67.45 | AP20: - | AQ20: =RC[-29] -> 43.51 | AR20: =RC[-29] -> 53.53 | AS20: - | AT20: =RC[-30] -> 13.920000000000002 | AU20: =RC[-30] -> 6.59 | AV20: =RC[-30] -> 1.024 | AW20: =RC[-30] -> 3.8650000000000002 | AY20: - | AZ20: - | BA20: -
A21: =IF(RC[1]="","",DATEVALUE(RC[1])) -> 43373 | B21: 30.09.18 | C21: 24 | D21: 183.57 | E21: 69.8 | F21: 8.2100000000000009 | G21: 175.79 | H21: 49.91 | I21: 5.27 | J21: =RC[-5]-RC[-2] -> 19.89 | K21: 7.78 | L21: 50.62 | M21: 69.599999999999994 | N21: 43.16 | O21: 54.84 | P21: =IF(AND(ISNUMBER(RC[-3]),ISNUMBER(RC[-1])),RC[-3]-RC[-1],"-") -> 14.759999999999991 | Q21: 7.46 | R21: 1.1259999999999999 | S21: 4.0490000000000004 | T21: =(RC[-16]*RC[-15]-RC[-13]*RC[-12])/1000 -> 4.0395071000000007 | U21: 49.49 | V21: 42.53 | W21: =RC[-2]*RC[-10]/1000 -> 3.4445039999999998 | X21: =ABS((RC[-3]*RC[-11]-RC[-2]*RC[-9])/1000) -> 1.1121587999999998 | Y21: =(RC[-14]-RC[1])/RC[-18]*100 -> 0.46646566926446348 | Z21: 6.96 | AC21: =VALUE(RC[-27]) -> 2018-09-30T00:00:00.000 | AD21: =IF(RC[21]=42,"*",IF(RC[21]=32,"",RC[21])) -> - | AE21: =RC[-28] -> 24 | AF21: =RC[-28] -> 183.57 | AG21: =RC[-28] -> 69.8 | AH21: =RC[-28] -> 8.2100000000000009 | AI21: =RC[-28] -> 175.79 | AJ21: =RC[-28] -> 49.91 | AK21: =RC[-28] -> 5.27 | AL21: =RC[-28] -> 19.89 | AM21: =RC[-28] -> 7.78 | AN21: =RC[-28] -> 50.62 | AO21: =RC[-28] -> 69.599999999999994 | AP21: - | AQ21: =RC[-29] -> 43.16 | AR21: =RC[-29] -> 54.84 | AS21: - | AT21: =RC[-30] -> 14.759999999999991 | AU21: =RC[-30] -> 7.46 | AV21: =RC[-30] -> 1.1259999999999999 | AW21: =RC[-30] -> 4.0490000000000004 | AY21: - | AZ21: - | BA21: -
A22: =IF(RC[1]="","",DATEVALUE(RC[1])) -> 43374 | B22: 01.10.18 | C22: 24 | D22: 184.41 | E22: 68.73 | F22: 8.31 | G22: 177.02 | H22: 49.99 | I22: 5.32 | J22: =RC[-5]-RC[-2] -> 18.740000000000002 | K22: 7.39 | L22: 50.6 | M22: 68.489999999999995 | N22: 43.52 | O22: 54.46 | P22: =IF(AND(ISNUMBER(RC[-3]),ISNUMBER(RC[-1])),RC[-3]-RC[-1],"-") -> 14.029999999999994 | Q22: 7.08 | R22: 1.0669999999999999 | S22: 3.8330000000000002 | T22: =(RC[-16]*RC[-15]-RC[-13]*RC[-12])/1000 -> 3.8252695000000005 | U22: 49.52 | V22: 42.88 | W22: =RC[-2]*RC[-10]/1000 -> 3.3916248000000002 | X22: =ABS((RC[-3]*RC[-11]-RC[-2]*RC[-9])/1000) -> 1.0563799999999997 | Y22: =(RC[-14]-RC[1])/RC[-18]*100 -> 0.42368094000677892 | Z22: 6.64 | AC22: =VALUE(RC[-27]) -> 2018-10-01T00:00:00.000 | AD22: =IF(RC[21]=42,"*",IF(RC[21]=32,"",RC[21])) -> - | AE22: =RC[-28] -> 24 | AF22: =RC[-28] -> 184.41 | AG22: =RC[-28] -> 68.73 | AH22: =RC[-28] -> 8.31 | AI22: =RC[-28] -> 177.02 | AJ22: =RC[-28] -> 49.99 | AK22: =RC[-28] -> 5.32 | AL22: =RC[-28] -> 18.740000000000002 | AM22: =RC[-28] -> 7.39 | AN22: =RC[-28] -> 50.6 | AO22: =RC[-28] -> 68.489999999999995 | AP22: - | AQ22: =RC[-29] -> 43.52 | AR22: =RC[-29] -> 54.46 | AS22: - | AT22: =RC[-30] -> 14.029999999999994 | AU22: =RC[-30] -> 7.08 | AV22: =RC[-30] -> 1.0669999999999999 | AW22: =RC[-30] -> 3.8330000000000002 | AY22: - | AZ22: - | BA22: -
A23: =IF(RC[1]="","",DATEVALUE(RC[1])) -> 43375 | B23: 02.10.18 | C23: 24 | D23: 177.29 | E23: 67.41 | F23: 8.0500000000000007 | G23: 169.09 | H23: 49.08 | I23: 5.32 | J23: =RC[-5]-RC[-2] -> 18.329999999999998 | K23: 8.1999999999999993 | L23: 49.31 | M23: 67.19 | N23: 41.61 | O23: 53.22 | P23: =IF(AND(ISNUMBER(RC[-3]),ISNUMBER(RC[-1])),RC[-3]-RC[-1],"-") -> 13.969999999999999 | Q23: 7.7 | R23: 1.0669999999999999 | S23: 3.66 | T23: =(RC[-16]*RC[-15]-RC[-13]*RC[-12])/1000 -> 3.652181699999999 | U23: 48.3 | V23: 41.11 | W23: =RC[-2]*RC[-10]/1000 -> 3.2452769999999997 | X23: =ABS((RC[-3]*RC[-11]-RC[-2]*RC[-9])/1000) -> 1.0574027999999998 | Y23: =(RC[-14]-RC[1])/RC[-18]*100 -> 0.59731503932816776 | Z23: 7.19 | AC23: =VALUE(RC[-27]) -> 2018-10-02T00:00:00.000 | AD23: =IF(RC[21]=42,"*",IF(RC[21]=32,"",RC[21])) -> - | AE23: =RC[-28] -> 24 | AF23: =RC[-28] -> 177.29 | AG23: =RC[-28] -> 67.41 | AH23: =RC[-28] -> 8.0500000000000007 | AI23: =RC[-28] -> 169.09 | AJ23: =RC[-28] -> 49.08 | AK23: =RC[-28] -> 5.32 | AL23: =RC[-28] -> 18.329999999999998 | AM23: =RC[-28] -> 8.1999999999999993 | AN23: =RC[-28] -> 49.31 | AO23: =RC[-28] -> 67.19 | AP23: - | AQ23: =RC[-29] -> 41.61 | AR23: =RC[-29] -> 53.22 | AS23: - | AT23: =RC[-30] -> 13.969999999999999 | AU23: =RC[-30] -> 7.7 | AV23: =RC[-30] -> 1.0669999999999999 | AW23: =RC[-30] -> 3.66 | AY23: - | AZ23: - | BA23: -
A24: =IF(RC[1]="","",DATEVALUE(RC[1])) -> 43376 | B24: 03.10.18 | C24: 24 | D24: 172.32 | E24: 67.540000000000006 | F24: 8.02 | G24: 164.16 | H24: 48.89 | I24: 5.45 | J24: =RC[-5]-RC[-2] -> 18.650000000000006 | K24: 8.16 | L24: 47.98 | M24: 67.319999999999993 | N24: 40.47 | O24: 52.96 | P24: =IF(AND(ISNUMBER(RC[-3]),ISNUMBER(RC[-1])),RC[-3]-RC[-1],"-") -> 14.359999999999992 | Q24: 7.51 | R24: 1.0629999999999999 | S24: 3.6179999999999999 | T24: =(RC[-16]*RC[-15]-RC[-13]*RC[-12])/1000 -> 3.6127104000000001 | U24: 47.03 | V24: 39.979999999999997 | W24: =RC[-2]*RC[-10]/1000 -> 3.1660595999999996 | X24: =ABS((RC[-3]*RC[-11]-RC[-2]*RC[-9])/1000) -> 1.0487187999999996 | Y24: =(RC[-14]-RC[1])/RC[-18]*100 -> 0.67616959064327509 | Z24: 7.05 | AC24: =VALUE(RC[-27]) -> 2018-10-03T00:00:00.000 | AD24: =IF(RC[21]=42,"*",IF(RC[21]=32,"",RC[21])) -> - | AE24: =RC[-28] -> 24 | AF24: =RC[-28] -> 172.32 | AG24: =RC[-28] -> 67.540000000000006 | AH24: =RC[-28] -> 8.02 | AI24: =RC[-28] -> 164.16 | AJ24: =RC[-28] -> 48.89 | AK24: =RC[-28] -> 5.45 | AL24: =RC[-28] -> 18.650000000000006 | AM24: =RC[-28] -> 8.16 | AN24: =RC[-28] -> 47.98 | AO24: =RC[-28] -> 67.319999999999993 | AP24: - | AQ24: =RC[-29] -> 40.47 | AR24: =RC[-29] -> 52.96 | AS24: - | AT24: =RC[-30] -> 14.359999999999992 | AU24: =RC[-30] -> 7.51 | AV24: =RC[-30] -> 1.0629999999999999 | AW24: =RC[-30] -> 3.6179999999999999 | AY24: - | AZ24: - | BA24: -
A25: =IF(RC[1]="","",DATEVALUE(RC[1])) -> 43377 | B25: 04.10.18 | C25: 24 | D25: 162.91 | E25: 66.91 | F25: 7.84 | G25: 155.76 | H25: 47.73 | I25: 5.53 | J25: =RC[-5]-RC[-2] -> 19.18 | K25: 7.15 | L25: 44.89 | M25: 66.680000000000007 | N25: 38.49 | O25: 51.95 | P25: =IF(AND(ISNUMBER(RC[-3]),ISNUMBER(RC[-1])),RC[-3]-RC[-1],"-") -> 14.730000000000004 | Q25: 6.4 | R25: 0.97399999999999998 | S25: 3.4689999999999999 | T25: =(RC[-16]*RC[-15]-RC[-13]*RC[-12])/1000 -> 3.4658832999999993 | U25: 43.98 | V25: 38 | W25: =RC[-2]*RC[-10]/1000 -> 2.9325863999999999 | X25: =ABS((RC[-3]*RC[-11]-RC[-2]*RC[-9])/1000) -> 0.95848639999999996 | Y25: =(RC[-14]-RC[1])/RC[-18]*100 -> 0.75115562403698 | Z25: 5.98 | AC25: =VALUE(RC[-27]) -> 2018-10-04T00:00:00.000 | AD25: =IF(RC[21]=42,"*",IF(RC[21]=32,"",RC[21])) -> - | AE25: =RC[-28] -> 24 | AF25: =RC[-28] -> 162.91 | AG25: =RC[-28] -> 66.91 | AH25: =RC[-28] -> 7.84 | AI25: =RC[-28] -> 155.76 | AJ25: =RC[-28] -> 47.73 | AK25: =RC[-28] -> 5.53 | AL25: =RC[-28] -> 19.18 | AM25: =RC[-28] -> 7.15 | AN25: =RC[-28] -> 44.89 | AO25: =RC[-28] -> 66.680000000000007 | AP25: - | AQ25: =RC[-29] -> 38.49 | AR25: =RC[-29] -> 51.95 | AS25: - | AT25: =RC[-30] -> 14.730000000000004 | AU25: =RC[-30] -> 6.4 | AV25: =RC[-30] -> 0.97399999999999998 | AW25: =RC[-30] -> 3.4689999999999999 | AY25: - | AZ25: - | BA25: -
A26: =IF(RC[1]="","",DATEVALUE(RC[1])) -> 43378 | B26: 05.10.18 | C26: 24 | D26: 154.05000000000001 | E26: 66.23 | F26: 7.52 | G26: 146.02000000000001 | H26: 46.24 | I26: 5.66 | J26: =RC[-5]-RC[-2] -> 19.990000000000002 | K26: 8.0299999999999994 | L26: 42.2 | M26: 66.010000000000005 | N26: 34.770000000000003 | O26: 50.52 | P26: =IF(AND(ISNUMBER(RC[-3]),ISNUMBER(RC[-1])),RC[-3]-RC[-1],"-") -> 15.490000000000002 | Q26: 7.43 | R26: 1.0169999999999999 | S26: 3.4510000000000001 | T26: =(RC[-16]*RC[-15]-RC[-13]*RC[-12])/1000 -> 3.4507667000000009 | U26: 41.36 | V26: 34.29 | W26: =RC[-2]*RC[-10]/1000 -> 2.7301736000000001 | X26: =ABS((RC[-3]*RC[-11]-RC[-2]*RC[-9])/1000) -> 0.99784280000000014 | Y26: =(RC[-14]-RC[1])/RC[-18]*100 -> 0.6574441857279818 | Z26: 7.07 | AC26: =VALUE(RC[-27]) -> 2018-10-05T00:00:00.000 | AD26: =IF(RC[21]=42,"*",IF(RC[21]=32,"",RC[21])) -> - | AE26: =RC[-28] -> 24 | AF26: =RC[-28] -> 154.05000000000001 | AG26: =RC[-28] -> 66.23 | AH26: =RC[-28] -> 7.52 | AI26: =RC[-28] -> 146.02000000000001 | AJ26: =RC[-28] -> 46.24 | AK26: =RC[-28] -> 5.66 | AL26: =RC[-28] -> 19.990000000000002 | AM26: =RC[-28] -> 8.0299999999999994 | AN26: =RC[-28] -> 42.2 | AO26: =RC[-28] -> 66.010000000000005 | AP26: - | AQ26: =RC[-29] -> 34.770000000000003 | AR26: =RC[-29] -> 50.52 | AS26: - | AT26: =RC[-30] -> 15.490000000000002 | AU26: =RC[-30] -> 7.43 | AV26: =RC[-30] -> 1.0169999999999999 | AW26: =RC[-30] -> 3.4510000000000001 | AY26: - | AZ26: - | BA26: -
A27: =IF(RC[1]="","",DATEVALUE(RC[1])) -> 43379 | B27: 06.10.18 | C27: 24 | D27: 163.95 | E27: 66.86 | F27: 7.47 | G27: 155.33000000000001 | H27: 47.36 | I27: 5.59 | J27: =RC[-5]-RC[-2] -> 19.5 | K27: 8.6199999999999992 | L27: 43.03 | M27: 66.66 | N27: 34.909999999999997 | O27: 51.43 | P27: =IF(AND(ISNUMBER(RC[-3]),ISNUMBER(RC[-1])),RC[-3]-RC[-1],"-") -> 15.229999999999997 | Q27: 8.1199999999999992 | R27: 1.048 | S27: 3.6080000000000001 | T27: =(RC[-16]*RC[-15]-RC[-13]*RC[-12])/1000 -> 3.6052681999999976 | U27: 42.15 | V27: 34.43 | W27: =RC[-2]*RC[-10]/1000 -> 2.8097189999999994 | X27: =ABS((RC[-3]*RC[-11]-RC[-2]*RC[-9])/1000) -> 1.0389840999999997 | Y27: =(RC[-14]-RC[1])/RC[-18]*100 -> 0.57941157535569399 | Z27: 7.72 | AC27: =VALUE(RC[-27]) -> 2018-10-06T00:00:00.000 | AD27: =IF(RC[21]=42,"*",IF(RC[21]=32,"",RC[21])) -> - | AE27: =RC[-28] -> 24 | AF27: =RC[-28] -> 163.95 | AG27: =RC[-28] -> 66.86 | AH27: =RC[-28] -> 7.47 | AI27: =RC[-28] -> 155.33000000000001 | AJ27: =RC[-28] -> 47.36 | AK27: =RC[-28] -> 5.59 | AL27: =RC[-28] -> 19.5 | AM27: =RC[-28] -> 8.6199999999999992 | AN27: =RC[-28] -> 43.03 | AO27: =RC[-28] -> 66.66 | AP27: - | AQ27: =RC[-29] -> 34.909999999999997 | AR27: =RC[-29] -> 51.43 | AS27: - | AT27: =RC[-30] -> 15.229999999999997 | AU27: =RC[-30] -> 8.1199999999999992 | AV27: =RC[-30] -> 1.048 | AW27: =RC[-30] -> 3.6080000000000001 | AY27: - | AZ27: - | BA27: -
A28: =IF(RC[1]="","",DATEVALUE(RC[1])) -> 43380 | B28: 07.10.18 | C28: 24 | D28: 164.98 | E28: 67.150000000000006 | F28: 7.48 | G28: 154.93 | H28: 47.59 | I28: 5.61 | J28: =RC[-5]-RC[-2] -> 19.560000000000002 | K28: 10.050000000000001 | L28: 44.44 | M28: 66.94 | N28: 34.86 | O28: 52.04 | P28: =IF(AND(ISNUMBER(RC[-3]),ISNUMBER(RC[-1])),RC[-3]-RC[-1],"-") -> 14.899999999999999 | Q28: 9.58 | R28: 1.141 | S28: 3.7080000000000002 | T28: =(RC[-16]*RC[-15]-RC[-13]*RC[-12])/1000 -> 3.7052883000000003 | U28: 43.56 | V28: 34.369999999999997 | W28: =RC[-2]*RC[-10]/1000 -> 2.9159063999999999 | X28: =ABS((RC[-3]*RC[-11]-RC[-2]*RC[-9])/1000) -> 1.1272915999999999 | Y28: =(RC[-14]-RC[1])/RC[-18]*100 -> 0.55508939521074108 | Z28: 9.19 | AC28: =VALUE(RC[-27]) -> 2018-10-07T00:00:00.000 | AD28: =IF(RC[21]=42,"*",IF(RC[21]=32,"",RC[21])) -> - | AE28: =RC[-28] -> 24 | AF28: =RC[-28] -> 164.98 | AG28: =RC[-28] -> 67.150000000000006 | AH28: =RC[-28] -> 7.48 | AI28: =RC[-28] -> 154.93 | AJ28: =RC[-28] -> 47.59 | AK28: =RC[-28] -> 5.61 | AL28: =RC[-28] -> 19.560000000000002 | AM28: =RC[-28] -> 10.050000000000001 | AN28: =RC[-28] -> 44.44 | AO28: =RC[-28] -> 66.94 | AP28: - | AQ28: =RC[-29] -> 34.86 | AR28: =RC[-29] -> 52.04 | AS28: - | AT28: =RC[-30] -> 14.899999999999999 | AU28: =RC[-30] -> 9.58 | AV28: =RC[-30] -> 1.141 | AW28: =RC[-30] -> 3.7080000000000002 | AY28: - | AZ28: - | BA28: -
A29: =IF(RC[1]="","",DATEVALUE(RC[1])) -> 43381 | B29: 08.10.18 | C29: 24 | D29: 160.74 | E29: 67.12 | F29: 7.44 | G29: 152.44999999999999 | H29: 46.86 | I29: 5.62 | J29: =RC[-5]-RC[-2] -> 20.260000000000005 | K29: 8.2899999999999991 | L29: 42.15 | M29: 66.88 | N29: 34.33 | O29: 51.23 | P29: =IF(AND(ISNUMBER(RC[-3]),ISNUMBER(RC[-1])),RC[-3]-RC[-1],"-") -> 15.649999999999999 | Q29: 7.82 | R29: 1.038 | S29: 3.649 | T29: =(RC[-16]*RC[-15]-RC[-13]*RC[-12])/1000 -> 3.6450618000000023 | U29: 41.29 | V29: 33.85 | W29: =RC[-2]*RC[-10]/1000 -> 2.7614752 | X29: =ABS((RC[-3]*RC[-11]-RC[-2]*RC[-9])/1000) -> 1.0273397 | Y29: =(RC[-14]-RC[1])/RC[-18]*100 -> 0.55755985569038957 | Z29: 7.44 | AC29: =VALUE(RC[-27]) -> 2018-10-08T00:00:00.000 | AD29: =IF(RC[21]=42,"*",IF(RC[21]=32,"",RC[21])) -> - | AE29: =RC[-28] -> 24 | AF29: =RC[-28] -> 160.74 | AG29: =RC[-28] -> 67.12 | AH29: =RC[-28] -> 7.44 | AI29: =RC[-28] -> 152.44999999999999 | AJ29: =RC[-28] -> 46.86 | AK29: =RC[-28] -> 5.62 | AL29: =RC[-28] -> 20.260000000000005 | AM29: =RC[-28] -> 8.2899999999999991 | AN29: =RC[-28] -> 42.15 | AO29: =RC[-28] -> 66.88 | AP29: - | AQ29: =RC[-29] -> 34.33 | AR29: =RC[-29] -> 51.23 | AS29: - | AT29: =RC[-30] -> 15.649999999999999 | AU29: =RC[-30] -> 7.82 | AV29: =RC[-30] -> 1.038 | AW29: =RC[-30] -> 3.649 | AY29: - | AZ29: - | BA29: -
A30: =IF(RC[1]="","",DATEVALUE(RC[1])) -> 43382 | B30: 09.10.18 | C30: 24 | D30: 166.91 | E30: 66.98 | F30: 7.58 | G30: 158.22 | H30: 47.21 | I30: 5.63 | J30: =RC[-5]-RC[-2] -> 19.770000000000003 | K30: 8.69 | L30: 43.91 | M30: 66.81 | N30: 35.619999999999997 | O30: 51.37 | P30: =IF(AND(ISNUMBER(RC[-3]),ISNUMBER(RC[-1])),RC[-3]-RC[-1],"-") -> 15.440000000000005 | Q30: 8.2899999999999991 | R30: 1.081 | S30: 3.7109999999999999 | T30: =(RC[-16]*RC[-15]-RC[-13]*RC[-12])/1000 -> 3.710065600000001 | U30: 43.05 | V30: 35.130000000000003 | W30: =RC[-2]*RC[-10]/1000 -> 2.8761704999999997 | X30: =ABS((RC[-3]*RC[-11]-RC[-2]*RC[-9])/1000) -> 1.0715423999999996 | Y30: =(RC[-14]-RC[1])/RC[-18]*100 -> 0.48666413854127133 | Z30: 7.92 | AC30: =VALUE(RC[-27]) -> 2018-10-09T00:00:00.000 | AD30: =IF(RC[21]=42,"*",IF(RC[21]=32,"",RC[21])) -> - | AE30: =RC[-28] -> 24 | AF30: =RC[-28] -> 166.91 | AG30: =RC[-28] -> 66.98 | AH30: =RC[-28] -> 7.58 | AI30: =RC[-28] -> 158.22 | AJ30: =RC[-28] -> 47.21 | AK30: =RC[-28] -> 5.63 | AL30: =RC[-28] -> 19.770000000000003 | AM30: =RC[-28] -> 8.69 | AN30: =RC[-28] -> 43.91 | AO30: =RC[-28] -> 66.81 | AP30: - | AQ30: =RC[-29] -> 35.619999999999997 | AR30: =RC[-29] -> 51.37 | AS30: - | AT30: =RC[-30] -> 15.440000000000005 | AU30: =RC[-30] -> 8.2899999999999991 | AV30: =RC[-30] -> 1.081 | AW30: =RC[-30] -> 3.7109999999999999 | AY30: - | AZ30: - | BA30: -
A31: =IF(RC[1]="","",DATEVALUE(RC[1])) -> 43383 | B31: 10.10.18 | C31: 24 | D31: 166.48 | E31: 68.010000000000005 | F31: 7.52 | G31: 158.79 | H31: 48.06 | I31: 5.55 | J31: =RC[-5]-RC[-2] -> 19.950000000000003 | K31: 7.69 | L31: 43.15 | M31: 67.83 | N31: 35.799999999999997 | O31: 51.94 | P31: =IF(AND(ISNUMBER(RC[-3]),ISNUMBER(RC[-1])),RC[-3]-RC[-1],"-") -> 15.89 | Q31: 7.35 | R31: 1.042 | S31: 3.694 | T31: =(RC[-16]*RC[-15]-RC[-13]*RC[-12])/1000 -> 3.6908574000000001 | U31: 42.24 | V31: 35.32 | W31: =RC[-2]*RC[-10]/1000 -> 2.8651392000000002 | X31: =ABS((RC[-3]*RC[-11]-RC[-2]*RC[-9])/1000) -> 1.0306184 | Y31: =(RC[-14]-RC[1])/RC[-18]*100 -> 0.4849171862207951 | Z31: 6.92 | AC31: =VALUE(RC[-27]) -> 2018-10-10T00:00:00.000 | AD31: =IF(RC[21]=42,"*",IF(RC[21]=32,"",RC[21])) -> - | AE31: =RC[-28] -> 24 | AF31: =RC[-28] -> 166.48 | AG31: =RC[-28] -> 68.010000000000005 | AH31: =RC[-28] -> 7.52 | AI31: =RC[-28] -> 158.79 | AJ31: =RC[-28] -> 48.06 | AK31: =RC[-28] -> 5.55 | AL31: =RC[-28] -> 19.950000000000003 | AM31: =RC[-28] -> 7.69 | AN31: =RC[-28] -> 43.15 | AO31: =RC[-28] -> 67.83 | AP31: - | AQ31: =RC[-29] -> 35.799999999999997 | AR31: =RC[-29] -> 51.94 | AS31: - | AT31: =RC[-30] -> 15.89 | AU31: =RC[-30] -> 7.35 | AV31: =RC[-30] -> 1.042 | AW31: =RC[-30] -> 3.694 | AY31: - | AZ31: - | BA31: -
A32: =IF(RC[1]="","",DATEVALUE(RC[1])) -> 43384 | B32: 11.10.18 | C32: 24 | D32: 171.21 | E32: 69.11 | F32: 7.54 | G32: 163.34 | H32: 49.07 | I32: 5.46 | J32: =RC[-5]-RC[-2] -> 20.04 | K32: 7.87 | L32: 44.36 | M32: 68.88 | N32: 36.869999999999997 | O32: 53 | P32: =IF(AND(ISNUMBER(RC[-3]),ISNUMBER(RC[-1])),RC[-3]-RC[-1],"-") -> 15.879999999999995 | Q32: 7.49 | R32: 1.071 | S32: 3.8220000000000001 | T32: =(RC[-16]*RC[-15]-RC[-13]*RC[-12])/1000 -> 3.8172292999999993 | U32: 43.41 | V32: 36.380000000000003 | W32: =RC[-2]*RC[-10]/1000 -> 2.9900807999999999 | X32: =ABS((RC[-3]*RC[-11]-RC[-2]*RC[-9])/1000) -> 1.0619407999999997 | Y32: =(RC[-14]-RC[1])/RC[-18]*100 -> 0.51426472388882083 | Z32: 7.03 | AC32: =VALUE(RC[-27]) -> 2018-10-11T00:00:00.000 | AD32: =IF(RC[21]=42,"*",IF(RC[21]=32,"",RC[21])) -> - | AE32: =RC[-28] -> 24 | AF32: =RC[-28] -> 171.21 | AG32: =RC[-28] -> 69.11 | AH32: =RC[-28] -> 7.54 | AI32: =RC[-28] -> 163.34 | AJ32: =RC[-28] -> 49.07 | AK32: =RC[-28] -> 5.46 | AL32: =RC[-28] -> 20.04 | AM32: =RC[-28] -> 7.87 | AN32: =RC[-28] -> 44.36 | AO32: =RC[-28] -> 68.88 | AP32: - | AQ32: =RC[-29] -> 36.869999999999997 | AR32: =RC[-29] -> 53 | AS32: - | AT32: =RC[-30] -> 15.879999999999995 | AU32: =RC[-30] -> 7.49 | AV32: =RC[-30] -> 1.071 | AW32: =RC[-30] -> 3.8220000000000001 | AY32: - | AZ32: - | BA32: -
A33: =IF(RC[1]="","",DATEVALUE(RC[1])) -> 43385 | B33: 12.10.18 | C33: 24 | D33: 169.53 | E33: 68.97 | F33: 7.53 | G33: 161.29 | H33: 48.88 | I33: 5.49 | J33: =RC[-5]-RC[-2] -> 20.089999999999996 | K33: 8.24 | L33: 44.22 | M33: 68.75 | N33: 36.43 | O33: 52.82 | P33: =IF(AND(ISNUMBER(RC[-3]),ISNUMBER(RC[-1])),RC[-3]-RC[-1],"-") -> 15.93 | Q33: 7.79 | R33: 1.0880000000000001 | S33: 3.8130000000000002 | T33: =(RC[-16]*RC[-15]-RC[-13]*RC[-12])/1000 -> 3.8086288999999995 | U33: 43.27 | V33: 35.94 | W33: =RC[-2]*RC[-10]/1000 -> 2.9748125000000001 | X33: =ABS((RC[-3]*RC[-11]-RC[-2]*RC[-9])/1000) -> 1.0764617000000001 | Y33: =(RC[-14]-RC[1])/RC[-18]*100 -> 0.56420112840225689 | Z33: 7.33 | AC33: =VALUE(RC[-27]) -> 2018-10-12T00:00:00.000 | AD33: =IF(RC[21]=42,"*",IF(RC[21]=32,"",RC[21])) -> - | AE33: =RC[-28] -> 24 | AF33: =RC[-28] -> 169.53 | AG33: =RC[-28] -> 68.97 | AH33: =RC[-28] -> 7.53 | AI33: =RC[-28] -> 161.29 | AJ33: =RC[-28] -> 48.88 | AK33: =RC[-28] -> 5.49 | AL33: =RC[-28] -> 20.089999999999996 | AM33: =RC[-28] -> 8.24 | AN33: =RC[-28] -> 44.22 | AO33: =RC[-28] -> 68.75 | AP33: - | AQ33: =RC[-29] -> 36.43 | AR33: =RC[-29] -> 52.82 | AS33: - | AT33: =RC[-30] -> 15.93 | AU33: =RC[-30] -> 7.79 | AV33: =RC[-30] -> 1.0880000000000001 | AW33: =RC[-30] -> 3.8130000000000002 | AY33: - | AZ33: - | BA33: -
A34: =IF(RC[1]="","",DATEVALUE(RC[1])) -> 43386 | B34: 13.10.18 | C34: 24 | D34: 175.67 | E34: 70.069999999999993 | F34: 7.72 | G34: 168.4 | H34: 50.28 | I34: 5.49 | J34: =RC[-5]-RC[-2] -> 19.789999999999992 | K34: 7.27 | L34: 44.92 | M34: 69.86 | N34: 38.119999999999997 | O34: 54.03 | P34: =IF(AND(ISNUMBER(RC[-3]),ISNUMBER(RC[-1])),RC[-3]-RC[-1],"-") -> 15.829999999999998 | Q34: 6.8 | R34: 1.0489999999999999 | S34: 3.8460000000000001 | T34: =(RC[-16]*RC[-15]-RC[-13]*RC[-12])/1000 -> 3.8420448999999972 | U34: 43.96 | V34: 37.630000000000003 | W34: =RC[-2]*RC[-10]/1000 -> 3.0710455999999997 | X34: =ABS((RC[-3]*RC[-11]-RC[-2]*RC[-9])/1000) -> 1.0378966999999997 | Y34: =(RC[-14]-RC[1])/RC[-18]*100 -> 0.5581947743467931 | Z34: 6.33 | AC34: =VALUE(RC[-27]) -> 2018-10-13T00:00:00.000 | AD34: =IF(RC[21]=42,"*",IF(RC[21]=32,"",RC[21])) -> - | AE34: =RC[-28] -> 24 | AF34: =RC[-28] -> 175.67 | AG34: =RC[-28] -> 70.069999999999993 | AH34: =RC[-28] -> 7.72 | AI34: =RC[-28] -> 168.4 | AJ34: =RC[-28] -> 50.28 | AK34: =RC[-28] -> 5.49 | AL34: =RC[-28] -> 19.789999999999992 | AM34: =RC[-28] -> 7.27 | AN34: =RC[-28] -> 44.92 | AO34: =RC[-28] -> 69.86 | AP34: - | AQ34: =RC[-29] -> 38.119999999999997 | AR34: =RC[-29] -> 54.03 | AS34: - | AT34: =RC[-30] -> 15.829999999999998 | AU34: =RC[-30] -> 6.8 | AV34: =RC[-30] -> 1.0489999999999999 | AW34: =RC[-30] -> 3.8460000000000001 | AY34: - | AZ34: - | BA34: -
A35: =IF(RC[1]="","",DATEVALUE(RC[1])) -> 43387 | B35: 14.10.18 | C35: 24 | D35: 178.24 | E35: 70.849999999999994 | F35: 7.69 | G35: 170.77 | H35: 51.28 | I35: 5.4 | J35: =RC[-5]-RC[-2] -> 19.569999999999993 | K35: 7.47 | L35: 45.68 | M35: 70.650000000000006 | N35: 38.71 | O35: 54.73 | P35: =IF(AND(ISNUMBER(RC[-3]),ISNUMBER(RC[-1])),RC[-3]-RC[-1],"-") -> 15.920000000000009 | Q35: 6.97 | R35: 1.083 | S35: 3.8759999999999999 | T35: =(RC[-16]*RC[-15]-RC[-13]*RC[-12])/1000 -> 3.8712183999999996 | U35: 44.66 | V35: 38.22 | W35: =RC[-2]*RC[-10]/1000 -> 3.1552289999999998 | X35: =ABS((RC[-3]*RC[-11]-RC[-2]*RC[-9])/1000) -> 1.0634484000000002 | Y35: =(RC[-14]-RC[1])/RC[-18]*100 -> 0.60315043625929576 | Z35: 6.44 | AC35: =VALUE(RC[-27]) -> 2018-10-14T00:00:00.000 | AD35: =IF(RC[21]=42,"*",IF(RC[21]=32,"",RC[21])) -> - | AE35: =RC[-28] -> 24 | AF35: =RC[-28] -> 178.24 | AG35: =RC[-28] -> 70.849999999999994 | AH35: =RC[-28] -> 7.69 | AI35: =RC[-28] -> 170.77 | AJ35: =RC[-28] -> 51.28 | AK35: =RC[-28] -> 5.4 | AL35: =RC[-28] -> 19.569999999999993 | AM35: =RC[-28] -> 7.47 | AN35: =RC[-28] -> 45.68 | AO35: =RC[-28] -> 70.650000000000006 | AP35: - | AQ35: =RC[-29] -> 38.71 | AR35: =RC[-29] -> 54.73 | AS35: - | AT35: =RC[-30] -> 15.920000000000009 | AU35: =RC[-30] -> 6.97 | AV35: =RC[-30] -> 1.083 | AW35: =RC[-30] -> 3.8759999999999999 | AY35: - | AZ35: - | BA35: -
A36: =IF(RC[1]="","",DATEVALUE(RC[1])) -> 43388 | B36: 15.10.18 | C36: 24 | D36: 181.92 | E36: 70.31 | F36: 7.79 | G36: 175.25 | H36: 51.44 | I36: 5.38 | J36: =RC[-5]-RC[-2] -> 18.870000000000005 | K36: 6.67 | L36: 45.94 | M36: 70.09 | N36: 39.72 | O36: 54.75 | P36: =IF(AND(ISNUMBER(RC[-3]),ISNUMBER(RC[-1])),RC[-3]-RC[-1],"-") -> 15.340000000000003 | Q36: 6.22 | R36: 1.018 | S36: 3.7810000000000001 | T36: =(RC[-16]*RC[-15]-RC[-13]*RC[-12])/1000 -> 3.7759351999999997 | U36: 44.94 | V36: 39.24 | W36: =RC[-2]*RC[-10]/1000 -> 3.1498445999999998 | X36: =ABS((RC[-3]*RC[-11]-RC[-2]*RC[-9])/1000) -> 1.0014545999999995 | Y36: =(RC[-14]-RC[1])/RC[-18]*100 -> 0.55349500713266753 | Z36: 5.7 | AC36: =VALUE(RC[-27]) -> 2018-10-15T00:00:00.000 | AD36: =IF(RC[21]=42,"*",IF(RC[21]=32,"",RC[21])) -> - | AE36: =RC[-28] -> 24 | AF36: =RC[-28] -> 181.92 | AG36: =RC[-28] -> 70.31 | AH36: =RC[-28] -> 7.79 | AI36: =RC[-28] -> 175.25 | AJ36: =RC[-28] -> 51.44 | AK36: =RC[-28] -> 5.38 | AL36: =RC[-28] -> 18.870000000000005 | AM36: =RC[-28] -> 6.67 | AN36: =RC[-28] -> 45.94 | AO36: =RC[-28] -> 70.09 | AP36: - | AQ36: =RC[-29] -> 39.72 | AR36: =RC[-29] -> 54.75 | AS36: - | AT36: =RC[-30] -> 15.340000000000003 | AU36: =RC[-30] -> 6.22 | AV36: =RC[-30] -> 1.018 | AW36: =RC[-30] -> 3.7810000000000001 | AY36: - | AZ36: - | BA36: -
A37: =IF(RC[1]="","",DATEVALUE(RC[1])) -> 43389 | B37: 16.10.18 | C37: 24 | D37: 182.43 | E37: 70.31 | F37: 7.76 | G37: 176.15 | H37: 51.59 | I37: 5.32 | J37: =RC[-5]-RC[-2] -> 18.72 | K37: 6.28 | L37: 45.78 | M37: 70.09 | N37: 39.93 | O37: 54.85 | P37: =IF(AND(ISNUMBER(RC[-3]),ISNUMBER(RC[-1])),RC[-3]-RC[-1],"-") -> 15.240000000000002 | Q37: 5.85 | R37: 0.99299999999999999 | S37: 3.7469999999999999 | T37: =(RC[-16]*RC[-15]-RC[-13]*RC[-12])/1000 -> 3.7390748000000005 | U37: 44.79 | V37: 39.43 | W37: =RC[-2]*RC[-10]/1000 -> 3.1393310999999997 | X37: =ABS((RC[-3]*RC[-11]-RC[-2]*RC[-9])/1000) -> 0.97659559999999968 | Y37: =(RC[-14]-RC[1])/RC[-18]*100 -> 0.52228214589838207 | Z37: 5.36 | AC37: =VALUE(RC[-27]) -> 2018-10-16T00:00:00.000 | AD37: =IF(RC[21]=42,"*",IF(RC[21]=32,"",RC[21])) -> - | AE37: =RC[-28] -> 24 | AF37: =RC[-28] -> 182.43 | AG37: =RC[-28] -> 70.31 | AH37: =RC[-28] -> 7.76 | AI37: =RC[-28] -> 176.15 | AJ37: =RC[-28] -> 51.59 | AK37: =RC[-28] -> 5.32 | AL37: =RC[-28] -> 18.72 | AM37: =RC[-28] -> 6.28 | AN37: =RC[-28] -> 45.78 | AO37: =RC[-28] -> 70.09 | AP37: - | AQ37: =RC[-29] -> 39.93 | AR37: =RC[-29] -> 54.85 | AS37: - | AT37: =RC[-30] -> 15.240000000000002 | AU37: =RC[-30] -> 5.85 | AV37: =RC[-30] -> 0.99299999999999999 | AW37: =RC[-30] -> 3.7469999999999999 | AY37: - | AZ37: - | BA37: -
A38: =IF(RC[1]="","",DATEVALUE(RC[1])) -> 43390 | B38: 17.10.18 | C38: 24 | D38: 186.24 | E38: 70.489999999999995 | F38: 7.83 | G38: 179.36 | H38: 52.01 | I38: 5.3 | J38: =RC[-5]-RC[-2] -> 18.479999999999997 | K38: 6.88 | L38: 47.1 | M38: 70.27 | N38: 40.68 | O38: 55.24 | P38: =IF(AND(ISNUMBER(RC[-3]),ISNUMBER(RC[-1])),RC[-3]-RC[-1],"-") -> 15.029999999999994 | Q38: 6.42 | R38: 1.036 | S38: 3.8050000000000002 | T38: =(RC[-16]*RC[-15]-RC[-13]*RC[-12])/1000 -> 3.799544 | U38: 46.04 | V38: 40.19 | W38: =RC[-2]*RC[-10]/1000 -> 3.2352307999999996 | X38: =ABS((RC[-3]*RC[-11]-RC[-2]*RC[-9])/1000) -> 1.0151351999999998 | Y38: =(RC[-14]-RC[1])/RC[-18]*100 -> 0.57426404995539704 | Z38: 5.85 | AC38: =VALUE(RC[-27]) -> 2018-10-17T00:00:00.000 | AD38: =IF(RC[21]=42,"*",IF(RC[21]=32,"",RC[21])) -> - | AE38: =RC[-28] -> 24 | AF38: =RC[-28] -> 186.24 | AG38: =RC[-28] -> 70.489999999999995 | AH38: =RC[-28] -> 7.83 | AI38: =RC[-28] -> 179.36 | AJ38: =RC[-28] -> 52.01 | AK38: =RC[-28] -> 5.3 | AL38: =RC[-28] -> 18.479999999999997 | AM38: =RC[-28] -> 6.88 | AN38: =RC[-28] -> 47.1 | AO38: =RC[-28] -> 70.27 | AP38: - | AQ38: =RC[-29] -> 40.68 | AR38: =RC[-29] -> 55.24 | AS38: - | AT38: =RC[-30] -> 15.029999999999994 | AU38: =RC[-30] -> 6.42 | AV38: =RC[-30] -> 1.036 | AW38: =RC[-30] -> 3.8050000000000002 | AY38: - | AZ38: - | BA38: -
A39: =IF(RC[1]="","",DATEVALUE(RC[1])) -> 43391 | B39: 18.10.18 | C39: 24 | D39: 184.76 | E39: 71 | F39: 7.86 | G39: 178.81 | H39: 52.47 | I39: 5.34 | J39: =RC[-5]-RC[-2] -> 18.53 | K39: 5.95 | L39: 46 | M39: 70.78 | N39: 40.590000000000003 | O39: 55.43 | P39: =IF(AND(ISNUMBER(RC[-3]),ISNUMBER(RC[-1])),RC[-3]-RC[-1],"-") -> 15.350000000000001 | Q39: 5.41 | R39: 0.98299999999999998 | S39: 3.742 | T39: =(RC[-16]*RC[-15]-RC[-13]*RC[-12])/1000 -> 3.7357992999999987 | U39: 44.95 | V39: 40.049999999999997 | W39: =RC[-2]*RC[-10]/1000 -> 3.1815610000000003 | X39: =ABS((RC[-3]*RC[-11]-RC[-2]*RC[-9])/1000) -> 0.96158950000000054 | Y39: =(RC[-14]-RC[1])/RC[-18]*100 -> 0.58721548011856151 | Z39: 4.9000000000000004 | AC39: =VALUE(RC[-27]) -> 2018-10-18T00:00:00.000 | AD39: =IF(RC[21]=42,"*",IF(RC[21]=32,"",RC[21])) -> - | AE39: =RC[-28] -> 24 | AF39: =RC[-28] -> 184.76 | AG39: =RC[-28] -> 71 | AH39: =RC[-28] -> 7.86 | AI39: =RC[-28] -> 178.81 | AJ39: =RC[-28] -> 52.47 | AK39: =RC[-28] -> 5.34 | AL39: =RC[-28] -> 18.53 | AM39: =RC[-28] -> 5.95 | AN39: =RC[-28] -> 46 | AO39: =RC[-28] -> 70.78 | AP39: - | AQ39: =RC[-29] -> 40.590000000000003 | AR39: =RC[-29] -> 55.43 | AS39: - | AT39: =RC[-30] -> 15.350000000000001 | AU39: =RC[-30] -> 5.41 | AV39: =RC[-30] -> 0.98299999999999998 | AW39: =RC[-30] -> 3.742 | AY39: - | AZ39: - | BA39: -
A40: =IF(RC[1]="","",DATEVALUE(RC[1])) -> 43392 | B40: 19.10.18 | C40: 24 | D40: 184.95 | E40: 70.86 | F40: 7.89 | G40: 179.51 | H40: 52.39 | I40: 5.35 | J40: =RC[-5]-RC[-2] -> 18.47 | K40: 5.44 | L40: 45.76 | M40: 70.64 | N40: 40.74 | O40: 55.4 | P40: =IF(AND(ISNUMBER(RC[-3]),ISNUMBER(RC[-1])),RC[-3]-RC[-1],"-") -> 15.240000000000002 | Q40: 5.0199999999999996 | R40: 0.94899999999999995 | S40: 3.7069999999999999 | T40: =(RC[-16]*RC[-15]-RC[-13]*RC[-12])/1000 -> 3.7010280999999994 | U40: 44.76 | V40: 40.22 | W40: =RC[-2]*RC[-10]/1000 -> 3.1618463999999999 | X40: =ABS((RC[-3]*RC[-11]-RC[-2]*RC[-9])/1000) -> 0.93365839999999978 | Y40: =(RC[-14]-RC[1])/RC[-18]*100 -> 0.50136482647206304 | Z40: 4.54 | AC40: =VALUE(RC[-27]) -> 2018-10-19T00:00:00.000 | AD40: =IF(RC[21]=42,"*",IF(RC[21]=32,"",RC[21])) -> - | AE40: =RC[-28] -> 24 | AF40: =RC[-28] -> 184.95 | AG40: =RC[-28] -> 70.86 | AH40: =RC[-28] -> 7.89 | AI40: =RC[-28] -> 179.51 | AJ40: =RC[-28] -> 52.39 | AK40: =RC[-28] -> 5.35 | AL40: =RC[-28] -> 18.47 | AM40: =RC[-28] -> 5.44 | AN40: =RC[-28] -> 45.76 | AO40: =RC[-28] -> 70.64 | AP40: - | AQ40: =RC[-29] -> 40.74 | AR40: =RC[-29] -> 55.4 | AS40: - | AT40: =RC[-30] -> 15.240000000000002 | AU40: =RC[-30] -> 5.0199999999999996 | AV40: =RC[-30] -> 0.94899999999999995 | AW40: =RC[-30] -> 3.7069999999999999 | AY40: - | AZ40: - | BA40: -
A41: =IF(RC[1]="","",DATEVALUE(RC[1])) -> 43393 | B41: 20.10.18 | C41: 24 | D41: 178.3 | E41: 70.180000000000007 | F41: 7.71 | G41: 171.29 | H41: 51.25 | I41: 5.41 | J41: =RC[-5]-RC[-2] -> 18.930000000000007 | K41: 7.01 | L41: 45.41 | M41: 69.959999999999994 | N41: 38.79 | O41: 54.49 | P41: =IF(AND(ISNUMBER(RC[-3]),ISNUMBER(RC[-1])),RC[-3]-RC[-1],"-") -> 15.469999999999992 | Q41: 6.62 | R41: 1.04 | S41: 3.74 | T41: =(RC[-16]*RC[-15]-RC[-13]*RC[-12])/1000 -> 3.7344815000000033 | U41: 44.47 | V41: 38.28 | W41: =RC[-2]*RC[-10]/1000 -> 3.1111211999999995 | X41: =ABS((RC[-3]*RC[-11]-RC[-2]*RC[-9])/1000) -> 1.0252439999999992 | Y41: =(RC[-14]-RC[1])/RC[-18]*100 -> 0.47872029890828388 | Z41: 6.19 | AC41: =VALUE(RC[-27]) -> 2018-10-20T00:00:00.000 | AD41: =IF(RC[21]=42,"*",IF(RC[21]=32,"",RC[21])) -> - | AE41: =RC[-28] -> 24 | AF41: =RC[-28] -> 178.3 | AG41: =RC[-28] -> 70.180000000000007 | AH41: =RC[-28] -> 7.71 | AI41: =RC[-28] -> 171.29 | AJ41: =RC[-28] -> 51.25 | AK41: =RC[-28] -> 5.41 | AL41: =RC[-28] -> 18.930000000000007 | AM41: =RC[-28] -> 7.01 | AN41: =RC[-28] -> 45.41 | AO41: =RC[-28] -> 69.959999999999994 | AP41: - | AQ41: =RC[-29] -> 38.79 | AR41: =RC[-29] -> 54.49 | AS41: - | AT41: =RC[-30] -> 15.469999999999992 | AU41: =RC[-30] -> 6.62 | AV41: =RC[-30] -> 1.04 | AW41: =RC[-30] -> 3.74 | AY41: - | AZ41: - | BA41: -
A42: =IF(RC[1]="","",DATEVALUE(RC[1])) -> 43394 | B42: 21.10.18 | C42: 24 | D42: 179.06 | E42: 69.28 | F42: 7.73 | G42: 170.86 | H42: 50.66 | I42: 5.44 | J42: =RC[-5]-RC[-2] -> 18.620000000000005 | K42: 8.1999999999999993 | L42: 46.53 | M42: 69.06 | N42: 38.64 | O42: 54.13 | P42: =IF(AND(ISNUMBER(RC[-3]),ISNUMBER(RC[-1])),RC[-3]-RC[-1],"-") -> 14.93 | Q42: 7.89 | R42: 1.0940000000000001 | S42: 3.7559999999999998 | T42: =(RC[-16]*RC[-15]-RC[-13]*RC[-12])/1000 -> 3.7495092000000003 | U42: 45.53 | V42: 38.159999999999997 | W42: =RC[-2]*RC[-10]/1000 -> 3.1443018 | X42: =ABS((RC[-3]*RC[-11]-RC[-2]*RC[-9])/1000) -> 1.0787010000000006 | Y42: =(RC[-14]-RC[1])/RC[-18]*100 -> 0.48577782980217671 | Z42: 7.37 | AC42: =VALUE(RC[-27]) -> 2018-10-21T00:00:00.000 | AD42: =IF(RC[21]=42,"*",IF(RC[21]=32,"",RC[21])) -> - | AE42: =RC[-28] -> 24 | AF42: =RC[-28] -> 179.06 | AG42: =RC[-28] -> 69.28 | AH42: =RC[-28] -> 7.73 | AI42: =RC[-28] -> 170.86 | AJ42: =RC[-28] -> 50.66 | AK42: =RC[-28] -> 5.44 | AL42: =RC[-28] -> 18.620000000000005 | AM42: =RC[-28] -> 8.1999999999999993 | AN42: =RC[-28] -> 46.53 | AO42: =RC[-28] -> 69.06 | AP42: - | AQ42: =RC[-29] -> 38.64 | AR42: =RC[-29] -> 54.13 | AS42: - | AT42: =RC[-30] -> 14.93 | AU42: =RC[-30] -> 7.89 | AV42: =RC[-30] -> 1.0940000000000001 | AW42: =RC[-30] -> 3.7559999999999998 | AY42: - | AZ42: - | BA42: -
A43: =IF(RC[1]="","",DATEVALUE(RC[1])) -> 43395 | B43: 22.10.18 | C43: 24 | D43: 176.47 | E43: 69.73 | F43: 7.71 | G43: 169.09 | H43: 50.61 | I43: 5.47 | J43: =RC[-5]-RC[-2] -> 19.120000000000005 | K43: 7.38 | L43: 45.32 | M43: 69.55 | N43: 38.19 | O43: 54.02 | P43: =IF(AND(ISNUMBER(RC[-3]),ISNUMBER(RC[-1])),RC[-3]-RC[-1],"-") -> 15.529999999999994 | Q43: 7.13 | R43: 1.06 | S43: 3.7519999999999998 | T43: =(RC[-16]*RC[-15]-RC[-13]*RC[-12])/1000 -> 3.7476082000000006 | U43: 44.35 | V43: 37.71 | W43: =RC[-2]*RC[-10]/1000 -> 3.0845425 | X43: =ABS((RC[-3]*RC[-11]-RC[-2]*RC[-9])/1000) -> 1.0474482999999999 | Y43: =(RC[-14]-RC[1])/RC[-18]*100 -> 0.43763676148796515 | Z43: 6.64 | AC43: =VALUE(RC[-27]) -> 2018-10-22T00:00:00.000 | AD43: =IF(RC[21]=42,"*",IF(RC[21]=32,"",RC[21])) -> - | AE43: =RC[-28] -> 24 | AF43: =RC[-28] -> 176.47 | AG43: =RC[-28] -> 69.73 | AH43: =RC[-28] -> 7.71 | AI43: =RC[-28] -> 169.09 | AJ43: =RC[-28] -> 50.61 | AK43: =RC[-28] -> 5.47 | AL43: =RC[-28] -> 19.120000000000005 | AM43: =RC[-28] -> 7.38 | AN43: =RC[-28] -> 45.32 | AO43: =RC[-28] -> 69.55 | AP43: - | AQ43: =RC[-29] -> 38.19 | AR43: =RC[-29] -> 54.02 | AS43: - | AT43: =RC[-30] -> 15.529999999999994 | AU43: =RC[-30] -> 7.13 | AV43: =RC[-30] -> 1.06 | AW43: =RC[-30] -> 3.7519999999999998 | AY43: - | AZ43: - | BA43: -
A44: =IF(RC[1]="","",DATEVALUE(RC[1])) ->  | C44: 24 | J44: =RC[-5]-RC[-2] -> #VALUE! | P44: =IF(AND(ISNUMBER(RC[-3]),ISNUMBER(RC[-1])),RC[-3]-RC[-1],"-") -> - | T44: =(RC[-16]*RC[-15]-RC[-13]*RC[-12])/1000 -> #VALUE! | W44: =RC[-2]*RC[-10]/1000 -> #VALUE! | X44: =ABS((RC[-3]*RC[-11]-RC[-2]*RC[-9])/1000) -> #VALUE! | Y44: =(RC[-14]-RC[1])/RC[-18]*100 -> #VALUE! | AC44: =VALUE(RC[-27]) -> #VALUE! | AD44: =IF(RC[21]=42,"*",IF(RC[21]=32,"",RC[21])) ->  | AE44: =RC[-28] -> 24 | AF44: =RC[-28] ->  | AG44: =RC[-28] ->  | AH44: =RC[-28] ->  | AI44: =RC[-28] ->  | AJ44: =RC[-28] ->  | AK44: =RC[-28] ->  | AL44: =RC[-28] -> #VALUE! | AM44: =RC[-28] ->  | AN44: =RC[-28] ->  | AO44: =RC[-28] ->  | AP44: - | AQ44: =RC[-29] ->  | AR44: =RC[-29] ->  | AS44: - | AT44: =RC[-30] -> - | AU44: =RC[-30] ->  | AV44: =RC[-30] ->  | AW44: =RC[-30] -> 
A45: =IF(RC[1]="","",DATEVALUE(RC[1])) ->  | C45: 24 | P45: =IF(AND(ISNUMBER(RC[-3]),ISNUMBER(RC[-1])),RC[-3]-RC[-1],"-") -> - | T45: =(RC[-16]*RC[-15]-RC[-13]*RC[-12])/1000 -> #VALUE! | W45: =RC[-2]*RC[-10]/1000 -> #VALUE! | X45: =ABS((RC[-3]*RC[-11]-RC[-2]*RC[-9])/1000) -> #VALUE! | Y45: =(RC[-14]-RC[1])/RC[-18]*100 -> #VALUE! | AC45: =VALUE(RC[-27]) -> #VALUE! | AD45: =IF(RC[21]=42,"*",IF(RC[21]=32,"",RC[21])) ->  | AE45: =RC[-28] -> 24 | AF45: =RC[-28] ->  | AG45: =RC[-28] ->  | AH45: =RC[-28] ->  | AI45: =RC[-28] ->  | AJ45: =RC[-28] ->  | AK45: =RC[-28] ->  | AL45: =RC[-28] -> 0 | AM45: =RC[-28] ->  | AN45: =RC[-28] ->  | AO45: =RC[-28] ->  | AP45: - | AQ45: =RC[-29] ->  | AR45: =RC[-29] ->  | AS45: - | AT45: =RC[-30] -> - | AU45: =RC[-30] ->  | AV45: =RC[-30] ->  | AW45: =RC[-30] -> 
A46: =IF(RC[1]="","",DATEVALUE(RC[1])) ->  | C46: 24 | P46: =IF(AND(ISNUMBER(RC[-3]),ISNUMBER(RC[-1])),RC[-3]-RC[-1],"-") -> - | T46: =(RC[-16]*RC[-15]-RC[-13]*RC[-12])/1000 -> #VALUE! | W46: =RC[-2]*RC[-10]/1000 -> #VALUE! | X46: =ABS((RC[-3]*RC[-11]-RC[-2]*RC[-9])/1000) -> #VALUE! | Y46: =(RC[-14]-RC[1])/RC[-18]*100 -> #VALUE! | AC46: =VALUE(RC[-27]) -> #VALUE! | AD46: =IF(RC[21]=42,"*",IF(RC[21]=32,"",RC[21])) ->  | AE46: =RC[-28] -> 24 | AF46: =RC[-28] ->  | AG46: =RC[-28] ->  | AH46: =RC[-28] ->  | AI46: =RC[-28] ->  | AJ46: =RC[-28] ->  | AK46: =RC[-28] ->  | AL46: =RC[-28] -> 0 | AM46: =RC[-28] ->  | AN46: =RC[-28] ->  | AO46: =RC[-28] ->  | AP46: - | AQ46: =RC[-29] ->  | AR46: =RC[-29] ->  | AS46: - | AT46: =RC[-30] -> - | AU46: =RC[-30] ->  | AV46: =RC[-30] ->  | AW46: =RC[-30] -> 
A47: =IF(RC[1]="","",DATEVALUE(RC[1])) ->  | C47: 24 | P47: =IF(AND(ISNUMBER(RC[-3]),ISNUMBER(RC[-1])),RC[-3]-RC[-1],"-") -> - | T47: =(RC[-16]*RC[-15]-RC[-13]*RC[-12])/1000 -> #VALUE! | W47: =RC[-2]*RC[-10]/1000 -> #VALUE! | X47: =ABS((RC[-3]*RC[-11]-RC[-2]*RC[-9])/1000) -> #VALUE! | Y47: =(RC[-14]-RC[1])/RC[-18]*100 -> #VALUE! | AC47: =VALUE(RC[-27]) -> #VALUE! | AD47: =IF(RC[21]=42,"*",IF(RC[21]=32,"",RC[21])) ->  | AE47: =RC[-28] -> 24 | AF47: =RC[-28] ->  | AG47: =RC[-28] ->  | AH47: =RC[-28] ->  | AI47: =RC[-28] ->  | AJ47: =RC[-28] ->  | AK47: =RC[-28] ->  | AL47: =RC[-28] -> 0 | AM47: =RC[-28] ->  | AN47: =RC[-28] ->  | AO47: =RC[-28] ->  | AP47: - | AQ47: =RC[-29] ->  | AR47: =RC[-29] ->  | AS47: - | AT47: =RC[-30] -> - | AU47: =RC[-30] ->  | AV47: =RC[-30] ->  | AW47: =RC[-30] -> 
A48: =IF(RC[1]="","",DATEVALUE(RC[1])) ->  | C48: 24 | P48: =IF(AND(ISNUMBER(RC[-3]),ISNUMBER(RC[-1])),RC[-3]-RC[-1],"-") -> - | T48: =(RC[-16]*RC[-15]-RC[-13]*RC[-12])/1000 -> #VALUE! | W48: =RC[-2]*RC[-10]/1000 -> #VALUE! | X48: =ABS((RC[-3]*RC[-11]-RC[-2]*RC[-9])/1000) -> #VALUE! | Y48: =(RC[-14]-RC[1])/RC[-18]*100 -> #VALUE! | AC48: =VALUE(RC[-27]) -> #VALUE! | AD48: =IF(RC[21]=42,"*",IF(RC[21]=32,"",RC[21])) ->  | AE48: =RC[-28] -> 24 | AF48: =RC[-28] ->  | AG48: =RC[-28] ->  | AH48: =RC[-28] ->  | AI48: =RC[-28] ->  | AJ48: =RC[-28] ->  | AK48: =RC[-28] ->  | AL48: =RC[-28] -> 0 | AM48: =RC[-28] ->  | AN48: =RC[-28] ->  | AO48: =RC[-28] ->  | AP48: - | AQ48: =RC[-29] ->  | AR48: =RC[-29] ->  | AS48: - | AT48: =RC[-30] -> - | AU48: =RC[-30] ->  | AV48: =RC[-30] ->  | AW48: =RC[-30] -> 
A49: =IF(RC[1]="","",DATEVALUE(RC[1])) ->  | C49: 24 | P49: =IF(AND(ISNUMBER(RC[-3]),ISNUMBER(RC[-1])),RC[-3]-RC[-1],"-") -> - | T49: =(RC[-16]*RC[-15]-RC[-13]*RC[-12])/1000 -> #VALUE! | W49: =RC[-2]*RC[-10]/1000 -> #VALUE! | X49: =ABS((RC[-3]*RC[-11]-RC[-2]*RC[-9])/1000) -> #VALUE! | Y49: =(RC[-14]-RC[1])/RC[-18]*100 -> #VALUE! | AC49: =VALUE(RC[-27]) -> #VALUE! | AD49: =IF(RC[21]=42,"*",IF(RC[21]=32,"",RC[21])) ->  | AE49: =RC[-28] -> 24 | AF49: =RC[-28] ->  | AG49: =RC[-28] ->  | AH49: =RC[-28] ->  | AI49: =RC[-28] ->  | AJ49: =RC[-28] ->  | AK49: =RC[-28] ->  | AL49: =RC[-28] -> 0 | AM49: =RC[-28] ->  | AN49: =RC[-28] ->  | AO49: =RC[-28] ->  | AP49: - | AQ49: =RC[-29] ->  | AR49: =RC[-29] ->  | AS49: - | AT49: =RC[-30] -> - | AU49: =RC[-30] ->  | AV49: =RC[-30] ->  | AW49: =RC[-30] -> 
A50: =IF(RC[1]="","",DATEVALUE(RC[1])) ->  | P50: =IF(AND(ISNUMBER(RC[-3]),ISNUMBER(RC[-1])),RC[-3]-RC[-1],"-") -> - | T50: =(RC[-16]*RC[-15]-RC[-13]*RC[-12])/1000 -> #VALUE! | W50: =RC[-2]*RC[-10]/1000 -> #VALUE! | X50: =ABS((RC[-3]*RC[-11]-RC[-2]*RC[-9])/1000) -> #VALUE! | Y50: =(RC[-14]-RC[1])/RC[-18]*100 -> #VALUE! | AC50: =VALUE(RC[-27]) -> #VALUE! | AD50: =IF(RC[21]=42,"*",IF(RC[21]=32,"",RC[21])) ->  | AE50: =RC[-28] ->  | AF50: =RC[-28] ->  | AG50: =RC[-28] ->  | AH50: =RC[-28] ->  | AI50: =RC[-28] ->  | AJ50: =RC[-28] ->  | AK50: =RC[-28] ->  | AL50: =RC[-28] -> 0 | AM50: =RC[-28] ->  | AN50: =RC[-28] ->  | AO50: =RC[-28] ->  | AP50: - | AQ50: =RC[-29] ->  | AR50: =RC[-29] ->  | AS50: - | AT50: =RC[-30] -> - | AU50: =RC[-30] ->  | AV50: =RC[-30] ->  | AW50: =RC[-30] -> 
A51: =IF(RC[1]="","",DATEVALUE(RC[1])) ->  | P51: =IF(AND(ISNUMBER(RC[-3]),ISNUMBER(RC[-1])),RC[-3]-RC[-1],"-") -> - | T51: =(RC[-16]*RC[-15]-RC[-13]*RC[-12])/1000 -> #VALUE! | W51: =RC[-2]*RC[-10]/1000 -> #VALUE! | X51: =ABS((RC[-3]*RC[-11]-RC[-2]*RC[-9])/1000) -> #VALUE! | Y51: =(RC[-14]-RC[1])/RC[-18]*100 -> #VALUE! | AC51: =VALUE(RC[-27]) -> #VALUE! | AD51: =IF(RC[21]=42,"*",IF(RC[21]=32,"",RC[21])) ->  | AE51: =RC[-28] ->  | AF51: =RC[-28] ->  | AG51: =RC[-28] ->  | AH51: =RC[-28] ->  | AI51: =RC[-28] ->  | AJ51: =RC[-28] ->  | AK51: =RC[-28] ->  | AL51: =RC[-28] -> 0 | AM51: =RC[-28] ->  | AN51: =RC[-28] ->  | AO51: =RC[-28] ->  | AP51: - | AQ51: =RC[-29] ->  | AR51: =RC[-29] ->  | AS51: - | AT51: =RC[-30] -> - | AU51: =RC[-30] ->  | AV51: =RC[-30] ->  | AW51: =RC[-30] -> 
A52: =IF(RC[1]="","",DATEVALUE(RC[1])) ->  | P52: =IF(AND(ISNUMBER(RC[-3]),ISNUMBER(RC[-1])),RC[-3]-RC[-1],"-") -> - | T52: =(RC[-16]*RC[-15]-RC[-13]*RC[-12])/1000 -> #VALUE! | W52: =RC[-2]*RC[-10]/1000 -> #VALUE! | X52: =ABS((RC[-3]*RC[-11]-RC[-2]*RC[-9])/1000) -> #VALUE! | Y52: =(RC[-14]-RC[1])/RC[-18]*100 -> #VALUE! | AC52: =VALUE(RC[-27]) -> #VALUE! | AD52: =IF(RC[21]=42,"*",IF(RC[21]=32,"",RC[21])) ->  | AE52: =RC[-28] ->  | AF52: =RC[-28] ->  | AG52: =RC[-28] ->  | AH52: =RC[-28] ->  | AI52: =RC[-28] ->  | AJ52: =RC[-28] ->  | AK52: =RC[-28] ->  | AL52: =RC[-28] -> 0 | AM52: =RC[-28] ->  | AN52: =RC[-28] ->  | AO52: =RC[-28] ->  | AP52: - | AQ52: =RC[-29] ->  | AR52: =RC[-29] ->  | AS52: - | AT52: =RC[-30] -> - | AU52: =RC[-30] ->  | AV52: =RC[-30] ->  | AW52: =RC[-30] -> 
A53: =IF(RC[1]="","",DATEVALUE(RC[1])) ->  | P53: =IF(AND(ISNUMBER(RC[-3]),ISNUMBER(RC[-1])),RC[-3]-RC[-1],"-") -> - | T53: =(RC[-16]*RC[-15]-RC[-13]*RC[-12])/1000 -> #VALUE! | W53: =RC[-2]*RC[-10]/1000 -> #VALUE! | X53: =ABS((RC[-3]*RC[-11]-RC[-2]*RC[-9])/1000) -> #VALUE! | Y53: =(RC[-14]-RC[1])/RC[-18]*100 -> #VALUE! | AC53: =VALUE(RC[-27]) -> #VALUE! | AD53: =IF(RC[21]=42,"*",IF(RC[21]=32,"",RC[21])) ->  | AE53: =RC[-28] ->  | AF53: =RC[-28] ->  | AG53: =RC[-28] ->  | AH53: =RC[-28] ->  | AI53: =RC[-28] ->  | AJ53: =RC[-28] ->  | AK53: =RC[-28] ->  | AL53: =RC[-28] -> 0 | AM53: =RC[-28] ->  | AN53: =RC[-28] ->  | AO53: =RC[-28] ->  | AP53: - | AQ53: =RC[-29] ->  | AR53: =RC[-29] ->  | AS53: - | AT53: =RC[-30] -> - | AU53: =RC[-30] ->  | AV53: =RC[-30] ->  | AW53: =RC[-30] -> 
A54: =IF(RC[1]="","",DATEVALUE(RC[1])) ->  | P54: =IF(AND(ISNUMBER(RC[-3]),ISNUMBER(RC[-1])),RC[-3]-RC[-1],"-") -> - | T54: =(RC[-16]*RC[-15]-RC[-13]*RC[-12])/1000 -> #VALUE! | W54: =RC[-2]*RC[-10]/1000 -> #VALUE! | X54: =ABS((RC[-3]*RC[-11]-RC[-2]*RC[-9])/1000) -> #VALUE! | Y54: =(RC[-14]-RC[1])/RC[-18]*100 -> #VALUE! | AC54: =VALUE(RC[-27]) -> #VALUE! | AD54: =IF(RC[21]=42,"*",IF(RC[21]=32,"",RC[21])) ->  | AE54: =RC[-28] ->  | AF54: =RC[-28] ->  | AG54: =RC[-28] ->  | AH54: =RC[-28] ->  | AI54: =RC[-28] ->  | AJ54: =RC[-28] ->  | AK54: =RC[-28] ->  | AL54: =RC[-28] -> 0 | AM54: =RC[-28] ->  | AN54: =RC[-28] ->  | AO54: =RC[-28] ->  | AP54: - | AQ54: =RC[-29] ->  | AR54: =RC[-29] ->  | AS54: - | AT54: =RC[-30] -> - | AU54: =RC[-30] ->  | AV54: =RC[-30] ->  | AW54: =RC[-30] -> 
A55: =IF(RC[1]="","",DATEVALUE(RC[1])) ->  | P55: =IF(AND(ISNUMBER(RC[-3]),ISNUMBER(RC[-1])),RC[-3]-RC[-1],"-") -> - | T55: =(RC[-16]*RC[-15]-RC[-13]*RC[-12])/1000 -> #VALUE! | W55: =RC[-2]*RC[-10]/1000 -> #VALUE! | X55: =ABS((RC[-3]*RC[-11]-RC[-2]*RC[-9])/1000) -> #VALUE! | Y55: =(RC[-14]-RC[1])/RC[-18]*100 -> #VALUE! | AC55: =VALUE(RC[-27]) -> #VALUE! | AD55: =IF(RC[21]=42,"*",IF(RC[21]=32,"",RC[21])) ->  | AE55: =RC[-28] ->  | AF55: =RC[-28] ->  | AG55: =RC[-28] ->  | AH55: =RC[-28] ->  | AI55: =RC[-28] ->  | AJ55: =RC[-28] ->  | AK55: =RC[-28] ->  | AL55: =RC[-28] -> 0 | AM55: =RC[-28] ->  | AN55: =RC[-28] ->  | AO55: =RC[-28] ->  | AP55: - | AQ55: =RC[-29] ->  | AR55: =RC[-29] ->  | AS55: - | AT55: =RC[-30] -> - | AU55: =RC[-30] ->  | AV55: =RC[-30] ->  | AW55: =RC[-30] -> 
A56: =IF(RC[1]="","",DATEVALUE(RC[1])) ->  | P56: =IF(AND(ISNUMBER(RC[-3]),ISNUMBER(RC[-1])),RC[-3]-RC[-1],"-") -> - | T56: =(RC[-16]*RC[-15]-RC[-13]*RC[-12])/1000 -> #VALUE! | W56: =RC[-2]*RC[-10]/1000 -> #VALUE! | X56: =ABS((RC[-3]*RC[-11]-RC[-2]*RC[-9])/1000) -> #VALUE! | Y56: =(RC[-14]-RC[1])/RC[-18]*100 -> #VALUE! | AC56: =VALUE(RC[-27]) -> #VALUE! | AD56: =IF(RC[21]=42,"*",IF(RC[21]=32,"",RC[21])) ->  | AE56: =RC[-28] ->  | AF56: =RC[-28] ->  | AG56: =RC[-28] ->  | AH56: =RC[-28] ->  | AI56: =RC[-28] ->  | AJ56: =RC[-28] ->  | AK56: =RC[-28] ->  | AL56: =RC[-28] -> 0 | AM56: =RC[-28] ->  | AN56: =RC[-28] ->  | AO56: =RC[-28] ->  | AP56: - | AQ56: =RC[-29] ->  | AR56: =RC[-29] ->  | AS56: - | AT56: =RC[-30] -> - | AU56: =RC[-30] ->  | AV56: =RC[-30] ->  | AW56: =RC[-30] -> 
A57: =IF(RC[1]="","",DATEVALUE(RC[1])) ->  | P57: =IF(AND(ISNUMBER(RC[-3]),ISNUMBER(RC[-1])),RC[-3]-RC[-1],"-") -> - | T57: =(RC[-16]*RC[-15]-RC[-13]*RC[-12])/1000 -> #VALUE! | W57: =RC[-2]*RC[-10]/1000 -> #VALUE! | X57: =ABS((RC[-3]*RC[-11]-RC[-2]*RC[-9])/1000) -> #VALUE! | Y57: =(RC[-14]-RC[1])/RC[-18]*100 -> #VALUE! | AC57: =VALUE(RC[-27]) -> #VALUE! | AD57: =IF(RC[21]=42,"*",IF(RC[21]=32,"",RC[21])) ->  | AE57: =RC[-28] ->  | AF57: =RC[-28] ->  | AG57: =RC[-28] ->  | AH57: =RC[-28] ->  | AI57: =RC[-28] ->  | AJ57: =RC[-28] ->  | AK57: =RC[-28] ->  | AL57: =RC[-28] -> 0 | AM57: =RC[-28] ->  | AN57: =RC[-28] ->  | AO57: =RC[-28] ->  | AP57: - | AQ57: =RC[-29] ->  | AR57: =RC[-29] ->  | AS57: - | AT57: =RC[-30] -> - | AU57: =RC[-30] ->  | AV57: =RC[-30] ->  | AW57: =RC[-30] -> 
A58: =IF(RC[1]="","",DATEVALUE(RC[1])) ->  | P58: =IF(AND(ISNUMBER(RC[-3]),ISNUMBER(RC[-1])),RC[-3]-RC[-1],"-") -> - | T58: =(RC[-16]*RC[-15]-RC[-13]*RC[-12])/1000 -> #VALUE! | W58: =RC[-2]*RC[-10]/1000 -> #VALUE! | X58: =ABS((RC[-3]*RC[-11]-RC[-2]*RC[-9])/1000) -> #VALUE! | Y58: =(RC[-14]-RC[1])/RC[-18]*100 -> #VALUE! | AC58: =VALUE(RC[-27]) -> #VALUE! | AD58: =IF(RC[21]=42,"*",IF(RC[21]=32,"",RC[21])) ->  | AE58: =RC[-28] ->  | AF58: =RC[-28] ->  | AG58: =RC[-28] ->  | AH58: =RC[-28] ->  | AI58: =RC[-28] ->  | AJ58: =RC[-28] ->  | AK58: =RC[-28] ->  | AL58: =RC[-28] -> 0 | AM58: =RC[-28] ->  | AN58: =RC[-28] ->  | AO58: =RC[-28] ->  | AP58: - | AQ58: =RC[-29] ->  | AR58: =RC[-29] ->  | AS58: - | AT58: =RC[-30] -> - | AU58: =RC[-30] ->  | AV58: =RC[-30] ->  | AW58: =RC[-30] -> 
A59: =IF(RC[1]="","",DATEVALUE(RC[1])) ->  | P59: =IF(AND(ISNUMBER(RC[-3]),ISNUMBER(RC[-1])),RC[-3]-RC[-1],"-") -> - | T59: =(RC[-16]*RC[-15]-RC[-13]*RC[-12])/1000 -> #VALUE! | W59: =RC[-2]*RC[-10]/1000 -> #VALUE! | X59: =ABS((RC[-3]*RC[-11]-RC[-2]*RC[-9])/1000) -> #VALUE! | Y59: =(RC[-14]-RC[1])/RC[-18]*100 -> #VALUE! | AC59: =VALUE(RC[-27]) -> #VALUE! | AD59: =IF(RC[21]=42,"*",IF(RC[21]=32,"",RC[21])) ->  | AE59: =RC[-28] ->  | AF59: =RC[-28] ->  | AG59: =RC[-28] ->  | AH59: =RC[-28] ->  | AI59: =RC[-28] ->  | AJ59: =RC[-28] ->  | AK59: =RC[-28] ->  | AL59: =RC[-28] -> 0 | AM59: =RC[-28] ->  | AN59: =RC[-28] ->  | AO59: =RC[-28] ->  | AP59: - | AQ59: =RC[-29] ->  | AR59: =RC[-29] ->  | AS59: - | AT59: =RC[-30] -> - | AU59: =RC[-30] ->  | AV59: =RC[-30] ->  | AW59: =RC[-30] -> 
A60: =IF(RC[1]="","",DATEVALUE(RC[1])) ->  | P60: =IF(AND(ISNUMBER(RC[-3]),ISNUMBER(RC[-1])),RC[-3]-RC[-1],"-") -> - | T60: =(RC[-16]*RC[-15]-RC[-13]*RC[-12])/1000 -> #VALUE! | W60: =RC[-2]*RC[-10]/1000 -> #VALUE! | X60: =ABS((RC[-3]*RC[-11]-RC[-2]*RC[-9])/1000) -> #VALUE! | Y60: =(RC[-14]-RC[1])/RC[-18]*100 -> #VALUE! | AC60: =VALUE(RC[-27]) -> #VALUE! | AD60: =IF(RC[21]=42,"*",IF(RC[21]=32,"",RC[21])) ->  | AE60: =RC[-28] ->  | AF60: =RC[-28] ->  | AG60: =RC[-28] ->  | AH60: =RC[-28] ->  | AI60: =RC[-28] ->  | AJ60: =RC[-28] ->  | AK60: =RC[-28] ->  | AL60: =RC[-28] -> 0 | AM60: =RC[-28] ->  | AN60: =RC[-28] ->  | AO60: =RC[-28] ->  | AP60: - | AQ60: =RC[-29] ->  | AR60: =RC[-29] ->  | AS60: - | AT60: =RC[-30] -> - | AU60: =RC[-30] ->  | AV60: =RC[-30] ->  | AW60: =RC[-30] -> 
A61: =IF(RC[1]="","",DATEVALUE(RC[1])) ->  | P61: =IF(AND(ISNUMBER(RC[-3]),ISNUMBER(RC[-1])),RC[-3]-RC[-1],"-") -> - | T61: =(RC[-16]*RC[-15]-RC[-13]*RC[-12])/1000 -> #VALUE! | W61: =RC[-2]*RC[-10]/1000 -> #VALUE! | X61: =ABS((RC[-3]*RC[-11]-RC[-2]*RC[-9])/1000) -> #VALUE! | Y61: =(RC[-14]-RC[1])/RC[-18]*100 -> #VALUE! | AC61: =VALUE(RC[-27]) -> #VALUE! | AD61: =IF(RC[21]=42,"*",IF(RC[21]=32,"",RC[21])) ->  | AE61: =RC[-28] ->  | AF61: =RC[-28] ->  | AG61: =RC[-28] ->  | AH61: =RC[-28] ->  | AI61: =RC[-28] ->  | AJ61: =RC[-28] ->  | AK61: =RC[-28] ->  | AL61: =RC[-28] -> 0 | AM61: =RC[-28] ->  | AN61: =RC[-28] ->  | AO61: =RC[-28] ->  | AP61: - | AQ61: =RC[-29] ->  | AR61: =RC[-29] ->  | AS61: - | AT61: =RC[-30] -> - | AU61: =RC[-30] ->  | AV61: =RC[-30] ->  | AW61: =RC[-30] -> 
A62: =IF(RC[1]="","",DATEVALUE(RC[1])) ->  | P62: =IF(AND(ISNUMBER(RC[-3]),ISNUMBER(RC[-1])),RC[-3]-RC[-1],"-") -> - | T62: =(RC[-16]*RC[-15]-RC[-13]*RC[-12])/1000 -> #VALUE! | W62: =RC[-2]*RC[-10]/1000 -> #VALUE! | X62: =ABS((RC[-3]*RC[-11]-RC[-2]*RC[-9])/1000) -> #VALUE! | Y62: =(RC[-14]-RC[1])/RC[-18]*100 -> #VALUE! | AC62: =VALUE(RC[-27]) -> #VALUE! | AD62: =IF(RC[21]=42,"*",IF(RC[21]=32,"",RC[21])) ->  | AE62: =RC[-28] ->  | AF62: =RC[-28] ->  | AG62: =RC[-28] ->  | AH62: =RC[-28] ->  | AI62: =RC[-28] ->  | AJ62: =RC[-28] ->  | AK62: =RC[-28] ->  | AL62: =RC[-28] -> 0 | AM62: =RC[-28] ->  | AN62: =RC[-28] ->  | AO62: =RC[-28] ->  | AP62: - | AQ62: =RC[-29] ->  | AR62: =RC[-29] ->  | AS62: - | AT62: =RC[-30] -> - | AU62: =RC[-30] ->  | AV62: =RC[-30] ->  | AW62: =RC[-30] -> 
A63: =IF(RC[1]="","",DATEVALUE(RC[1])) ->  | P63: =IF(AND(ISNUMBER(RC[-3]),ISNUMBER(RC[-1])),RC[-3]-RC[-1],"-") -> - | T63: =(RC[-16]*RC[-15]-RC[-13]*RC[-12])/1000 -> #VALUE! | W63: =RC[-2]*RC[-10]/1000 -> #VALUE! | X63: =ABS((RC[-3]*RC[-11]-RC[-2]*RC[-9])/1000) -> #VALUE! | Y63: =(RC[-14]-RC[1])/RC[-18]*100 -> #VALUE! | AC63: =VALUE(RC[-27]) -> #VALUE! | AD63: =IF(RC[21]=42,"*",IF(RC[21]=32,"",RC[21])) ->  | AE63: =RC[-28] ->  | AF63: =RC[-28] ->  | AG63: =RC[-28] ->  | AH63: =RC[-28] ->  | AI63: =RC[-28] ->  | AJ63: =RC[-28] ->  | AK63: =RC[-28] ->  | AL63: =RC[-28] -> 0 | AM63: =RC[-28] ->  | AN63: =RC[-28] ->  | AO63: =RC[-28] ->  | AP63: - | AQ63: =RC[-29] ->  | AR63: =RC[-29] ->  | AS63: - | AT63: =RC[-30] -> - | AU63: =RC[-30] ->  | AV63: =RC[-30] ->  | AW63: =RC[-30] -> 
A64: =IF(RC[1]="","",DATEVALUE(RC[1])) ->  | P64: =IF(AND(ISNUMBER(RC[-3]),ISNUMBER(RC[-1])),RC[-3]-RC[-1],"-") -> - | T64: =(RC[-16]*RC[-15]-RC[-13]*RC[-12])/1000 -> #VALUE! | W64: =RC[-2]*RC[-10]/1000 -> #VALUE! | X64: =ABS((RC[-3]*RC[-11]-RC[-2]*RC[-9])/1000) -> #VALUE! | Y64: =(RC[-14]-RC[1])/RC[-18]*100 -> #VALUE! | AC64: =VALUE(RC[-27]) -> #VALUE! | AD64: =IF(RC[21]=42,"*",IF(RC[21]=32,"",RC[21])) ->  | AE64: =RC[-28] ->  | AF64: =RC[-28] ->  | AG64: =RC[-28] ->  | AH64: =RC[-28] ->  | AI64: =RC[-28] ->  | AJ64: =RC[-28] ->  | AK64: =RC[-28] ->  | AL64: =RC[-28] -> 0 | AM64: =RC[-28] ->  | AN64: =RC[-28] ->  | AO64: =RC[-28] ->  | AP64: - | AQ64: =RC[-29] ->  | AR64: =RC[-29] ->  | AS64: - | AT64: =RC[-30] -> - | AU64: =RC[-30] ->  | AV64: =RC[-30] ->  | AW64: =RC[-30] -> 
A65: =IF(RC[1]="","",DATEVALUE(RC[1])) ->  | P65: =IF(AND(ISNUMBER(RC[-3]),ISNUMBER(RC[-1])),RC[-3]-RC[-1],"-") -> - | T65: =(RC[-16]*RC[-15]-RC[-13]*RC[-12])/1000 -> #VALUE! | W65: =RC[-2]*RC[-10]/1000 -> #VALUE! | X65: =ABS((RC[-3]*RC[-11]-RC[-2]*RC[-9])/1000) -> #VALUE! | Y65: =(RC[-14]-RC[1])/RC[-18]*100 -> #VALUE! | AC65: =VALUE(RC[-27]) -> #VALUE! | AD65: =IF(RC[21]=42,"*",IF(RC[21]=32,"",RC[21])) ->  | AE65: =RC[-28] ->  | AF65: =RC[-28] ->  | AG65: =RC[-28] ->  | AH65: =RC[-28] ->  | AI65: =RC[-28] ->  | AJ65: =RC[-28] ->  | AK65: =RC[-28] ->  | AL65: =RC[-28] -> 0 | AM65: =RC[-28] ->  | AN65: =RC[-28] ->  | AO65: =RC[-28] ->  | AP65: - | AQ65: =RC[-29] ->  | AR65: =RC[-29] ->  | AS65: - | AT65: =RC[-30] -> - | AU65: =RC[-30] ->  | AV65: =RC[-30] ->  | AW65: =RC[-30] -> 
A66: =IF(RC[1]="","",DATEVALUE(RC[1])) ->  | P66: =IF(AND(ISNUMBER(RC[-3]),ISNUMBER(RC[-1])),RC[-3]-RC[-1],"-") -> - | T66: =(RC[-16]*RC[-15]-RC[-13]*RC[-12])/1000 -> #VALUE! | W66: =RC[-2]*RC[-10]/1000 -> #VALUE! | X66: =ABS((RC[-3]*RC[-11]-RC[-2]*RC[-9])/1000) -> #VALUE! | Y66: =(RC[-14]-RC[1])/RC[-18]*100 -> #VALUE! | AC66: =VALUE(RC[-27]) -> #VALUE! | AD66: =IF(RC[21]=42,"*",IF(RC[21]=32,"",RC[21])) ->  | AE66: =RC[-28] ->  | AF66: =RC[-28] ->  | AG66: =RC[-28] ->  | AH66: =RC[-28] ->  | AI66: =RC[-28] ->  | AJ66: =RC[-28] ->  | AK66: =RC[-28] ->  | AL66: =RC[-28] -> 0 | AM66: =RC[-28] ->  | AN66: =RC[-28] ->  | AO66: =RC[-28] ->  | AP66: - | AQ66: =RC[-29] ->  | AR66: =RC[-29] ->  | AS66: - | AT66: =RC[-30] -> - | AU66: =RC[-30] ->  | AV66: =RC[-30] ->  | AW66: =RC[-30] -> 
A67: =IF(RC[1]="","",DATEVALUE(RC[1])) ->  | P67: =IF(AND(ISNUMBER(RC[-3]),ISNUMBER(RC[-1])),RC[-3]-RC[-1],"-") -> - | T67: =(RC[-16]*RC[-15]-RC[-13]*RC[-12])/1000 -> #VALUE! | W67: =RC[-2]*RC[-10]/1000 -> #VALUE! | X67: =ABS((RC[-3]*RC[-11]-RC[-2]*RC[-9])/1000) -> #VALUE! | Y67: =(RC[-14]-RC[1])/RC[-18]*100 -> #VALUE! | AC67: =VALUE(RC[-27]) -> #VALUE! | AD67: =IF(RC[21]=42,"*",IF(RC[21]=32,"",RC[21])) ->  | AE67: =RC[-28] ->  | AF67: =RC[-28] ->  | AG67: =RC[-28] ->  | AH67: =RC[-28] ->  | AI67: =RC[-28] ->  | AJ67: =RC[-28] ->  | AK67: =RC[-28] ->  | AL67: =RC[-28] -> 0 | AM67: =RC[-28] ->  | AN67: =RC[-28] ->  | AO67: =RC[-28] ->  | AP67: - | AQ67: =RC[-29] ->  | AR67: =RC[-29] ->  | AS67: - | AT67: =RC[-30] -> - | AU67: =RC[-30] ->  | AV67: =RC[-30] ->  | AW67: =RC[-30] -> 
A68: =IF(RC[1]="","",DATEVALUE(RC[1])) ->  | P68: =IF(AND(ISNUMBER(RC[-3]),ISNUMBER(RC[-1])),RC[-3]-RC[-1],"-") -> - | T68: =(RC[-16]*RC[-15]-RC[-13]*RC[-12])/1000 -> #VALUE! | W68: =RC[-2]*RC[-10]/1000 -> #VALUE! | X68: =ABS((RC[-3]*RC[-11]-RC[-2]*RC[-9])/1000) -> #VALUE! | Y68: =(RC[-14]-RC[1])/RC[-18]*100 -> #VALUE! | AC68: =VALUE(RC[-27]) -> #VALUE! | AD68: =IF(RC[21]=42,"*",IF(RC[21]=32,"",RC[21])) ->  | AE68: =RC[-28] ->  | AF68: =RC[-28] ->  | AG68: =RC[-28] ->  | AH68: =RC[-28] ->  | AI68: =RC[-28] ->  | AJ68: =RC[-28] ->  | AK68: =RC[-28] ->  | AL68: =RC[-28] -> 0 | AM68: =RC[-28] ->  | AN68: =RC[-28] ->  | AO68: =RC[-28] ->  | AP68: - | AQ68: =RC[-29] ->  | AR68: =RC[-29] ->  | AS68: - | AT68: =RC[-30] -> - | AU68: =RC[-30] ->  | AV68: =RC[-30] ->  | AW68: =RC[-30] -> 
A69: =IF(RC[1]="","",DATEVALUE(RC[1])) ->  | P69: =IF(AND(ISNUMBER(RC[-3]),ISNUMBER(RC[-1])),RC[-3]-RC[-1],"-") -> - | T69: =(RC[-16]*RC[-15]-RC[-13]*RC[-12])/1000 -> #VALUE! | W69: =RC[-2]*RC[-10]/1000 -> #VALUE! | X69: =ABS((RC[-3]*RC[-11]-RC[-2]*RC[-9])/1000) -> #VALUE! | Y69: =(RC[-14]-RC[1])/RC[-18]*100 -> #VALUE! | AC69: =VALUE(RC[-27]) -> #VALUE! | AD69: =IF(RC[21]=42,"*",IF(RC[21]=32,"",RC[21])) ->  | AE69: =RC[-28] ->  | AF69: =RC[-28] ->  | AG69: =RC[-28] ->  | AH69: =RC[-28] ->  | AI69: =RC[-28] ->  | AJ69: =RC[-28] ->  | AK69: =RC[-28] ->  | AL69: =RC[-28] -> 0 | AM69: =RC[-28] ->  | AN69: =RC[-28] ->  | AO69: =RC[-28] ->  | AP69: - | AQ69: =RC[-29] ->  | AR69: =RC[-29] ->  | AS69: - | AT69: =RC[-30] -> - | AU69: =RC[-30] ->  | AV69: =RC[-30] ->  | AW69: =RC[-30] -> 
A70: =IF(RC[1]="","",DATEVALUE(RC[1])) ->  | P70: =IF(AND(ISNUMBER(RC[-3]),ISNUMBER(RC[-1])),RC[-3]-RC[-1],"-") -> - | T70: =(RC[-16]*RC[-15]-RC[-13]*RC[-12])/1000 -> #VALUE! | W70: =RC[-2]*RC[-10]/1000 -> #VALUE! | X70: =ABS((RC[-3]*RC[-11]-RC[-2]*RC[-9])/1000) -> #VALUE! | Y70: =(RC[-14]-RC[1])/RC[-18]*100 -> #VALUE! | AC70: =VALUE(RC[-27]) -> #VALUE! | AD70: =IF(RC[21]=42,"*",IF(RC[21]=32,"",RC[21])) ->  | AE70: =RC[-28] ->  | AF70: =RC[-28] ->  | AG70: =RC[-28] ->  | AH70: =RC[-28] ->  | AI70: =RC[-28] ->  | AJ70: =RC[-28] ->  | AK70: =RC[-28] ->  | AL70: =RC[-28] -> 0 | AM70: =RC[-28] ->  | AN70: =RC[-28] ->  | AO70: =RC[-28] ->  | AP70: - | AQ70: =RC[-29] ->  | AR70: =RC[-29] ->  | AS70: - | AT70: =RC[-30] -> - | AU70: =RC[-30] ->  | AV70: =RC[-30] ->  | AW70: =RC[-30] -> 
A71: =IF(RC[1]="","",DATEVALUE(RC[1])) ->  | P71: =IF(AND(ISNUMBER(RC[-3]),ISNUMBER(RC[-1])),RC[-3]-RC[-1],"-") -> - | T71: =(RC[-16]*RC[-15]-RC[-13]*RC[-12])/1000 -> #VALUE! | W71: =RC[-2]*RC[-10]/1000 -> #VALUE! | X71: =ABS((RC[-3]*RC[-11]-RC[-2]*RC[-9])/1000) -> #VALUE! | Y71: =(RC[-14]-RC[1])/RC[-18]*100 -> #VALUE! | AC71: =VALUE(RC[-27]) -> #VALUE! | AD71: =IF(RC[21]=42,"*",IF(RC[21]=32,"",RC[21])) ->  | AE71: =RC[-28] ->  | AF71: =RC[-28] ->  | AG71: =RC[-28] ->  | AH71: =RC[-28] ->  | AI71: =RC[-28] ->  | AJ71: =RC[-28] ->  | AK71: =RC[-28] ->  | AL71: =RC[-28] -> 0 | AM71: =RC[-28] ->  | AN71: =RC[-28] ->  | AO71: =RC[-28] ->  | AP71: - | AQ71: =RC[-29] ->  | AR71: =RC[-29] ->  | AS71: - | AT71: =RC[-30] -> - | AU71: =RC[-30] ->  | AV71: =RC[-30] ->  | AW71: =RC[-30] -> 
A72: =IF(RC[1]="","",DATEVALUE(RC[1])) ->  | P72: =IF(AND(ISNUMBER(RC[-3]),ISNUMBER(RC[-1])),RC[-3]-RC[-1],"-") -> - | T72: =(RC[-16]*RC[-15]-RC[-13]*RC[-12])/1000 -> #VALUE! | W72: =RC[-2]*RC[-10]/1000 -> #VALUE! | X72: =ABS((RC[-3]*RC[-11]-RC[-2]*RC[-9])/1000) -> #VALUE! | Y72: =(RC[-14]-RC[1])/RC[-18]*100 -> #VALUE! | AC72: =VALUE(RC[-27]) -> #VALUE! | AD72: =IF(RC[21]=42,"*",IF(RC[21]=32,"",RC[21])) ->  | AE72: =RC[-28] ->  | AF72: =RC[-28] ->  | AG72: =RC[-28] ->  | AH72: =RC[-28] ->  | AI72: =RC[-28] ->  | AJ72: =RC[-28] ->  | AK72: =RC[-28] ->  | AL72: =RC[-28] -> 0 | AM72: =RC[-28] ->  | AN72: =RC[-28] ->  | AO72: =RC[-28] ->  | AP72: - | AQ72: =RC[-29] ->  | AR72: =RC[-29] ->  | AS72: - | AT72: =RC[-30] -> - | AU72: =RC[-30] ->  | AV72: =RC[-30] ->  | AW72: =RC[-30] -> 
A73: =IF(RC[1]="","",DATEVALUE(RC[1])) ->  | P73: =IF(AND(ISNUMBER(RC[-3]),ISNUMBER(RC[-1])),RC[-3]-RC[-1],"-") -> - | T73: =(RC[-16]*RC[-15]-RC[-13]*RC[-12])/1000 -> #VALUE! | W73: =RC[-2]*RC[-10]/1000 -> #VALUE! | X73: =ABS((RC[-3]*RC[-11]-RC[-2]*RC[-9])/1000) -> #VALUE! | Y73: =(RC[-14]-RC[1])/RC[-18]*100 -> #VALUE! | AC73: =VALUE(RC[-27]) -> #VALUE! | AD73: =IF(RC[21]=42,"*",IF(RC[21]=32,"",RC[21])) ->  | AE73: =RC[-28] ->  | AF73: =RC[-28] ->  | AG73: =RC[-28] ->  | AH73: =RC[-28] ->  | AI73: =RC[-28] ->  | AJ73: =RC[-28] ->  | AK73: =RC[-28] ->  | AL73: =RC[-28] -> 0 | AM73: =RC[-28] ->  | AN73: =RC[-28] ->  | AO73: =RC[-28] ->  | AP73: - | AQ73: =RC[-29] ->  | AR73: =RC[-29] ->  | AS73: - | AT73: =RC[-30] -> - | AU73: =RC[-30] ->  | AV73: =RC[-30] ->  | AW73: =RC[-30] -> 
A74: =IF(RC[1]="","",DATEVALUE(RC[1])) ->  | P74: =IF(AND(ISNUMBER(RC[-3]),ISNUMBER(RC[-1])),RC[-3]-RC[-1],"-") -> - | T74: =(RC[-16]*RC[-15]-RC[-13]*RC[-12])/1000 -> #VALUE! | W74: =RC[-2]*RC[-10]/1000 -> #VALUE! | X74: =ABS((RC[-3]*RC[-11]-RC[-2]*RC[-9])/1000) -> #VALUE! | Y74: =(RC[-14]-RC[1])/RC[-18]*100 -> #VALUE! | AC74: =VALUE(RC[-27]) -> #VALUE! | AD74: =IF(RC[21]=42,"*",IF(RC[21]=32,"",RC[21])) ->  | AE74: =RC[-28] ->  | AF74: =RC[-28] ->  | AG74: =RC[-28] ->  | AH74: =RC[-28] ->  | AI74: =RC[-28] ->  | AJ74: =RC[-28] ->  | AK74: =RC[-28] ->  | AL74: =RC[-28] -> 0 | AM74: =RC[-28] ->  | AN74: =RC[-28] ->  | AO74: =RC[-28] ->  | AP74: - | AQ74: =RC[-29] ->  | AR74: =RC[-29] ->  | AS74: - | AT74: =RC[-30] -> - | AU74: =RC[-30] ->  | AV74: =RC[-30] ->  | AW74: =RC[-30] -> 
A75: =IF(RC[1]="","",DATEVALUE(RC[1])) ->  | P75: =IF(AND(ISNUMBER(RC[-3]),ISNUMBER(RC[-1])),RC[-3]-RC[-1],"-") -> - | T75: =(RC[-16]*RC[-15]-RC[-13]*RC[-12])/1000 -> #VALUE! | W75: =RC[-2]*RC[-10]/1000 -> #VALUE! | X75: =ABS((RC[-3]*RC[-11]-RC[-2]*RC[-9])/1000) -> #VALUE! | Y75: =(RC[-14]-RC[1])/RC[-18]*100 -> #VALUE! | AC75: =VALUE(RC[-27]) -> #VALUE! | AD75: =IF(RC[21]=42,"*",IF(RC[21]=32,"",RC[21])) ->  | AE75: =RC[-28] ->  | AF75: =RC[-28] ->  | AG75: =RC[-28] ->  | AH75: =RC[-28] ->  | AI75: =RC[-28] ->  | AJ75: =RC[-28] ->  | AK75: =RC[-28] ->  | AL75: =RC[-28] -> 0 | AM75: =RC[-28] ->  | AN75: =RC[-28] ->  | AO75: =RC[-28] ->  | AP75: - | AQ75: =RC[-29] ->  | AR75: =RC[-29] ->  | AS75: - | AT75: =RC[-30] -> - | AU75: =RC[-30] ->  | AV75: =RC[-30] ->  | AW75: =RC[-30] -> 
A76: =IF(RC[1]="","",DATEVALUE(RC[1])) ->  | P76: =IF(AND(ISNUMBER(RC[-3]),ISNUMBER(RC[-1])),RC[-3]-RC[-1],"-") -> - | T76: =(RC[-16]*RC[-15]-RC[-13]*RC[-12])/1000 -> #VALUE! | W76: =RC[-2]*RC[-10]/1000 -> #VALUE! | X76: =ABS((RC[-3]*RC[-11]-RC[-2]*RC[-9])/1000) -> #VALUE! | Y76: =(RC[-14]-RC[1])/RC[-18]*100 -> #VALUE! | AC76: =VALUE(RC[-27]) -> #VALUE! | AD76: =IF(RC[21]=42,"*",IF(RC[21]=32,"",RC[21])) ->  | AE76: =RC[-28] ->  | AF76: =RC[-28] ->  | AG76: =RC[-28] ->  | AH76: =RC[-28] ->  | AI76: =RC[-28] ->  | AJ76: =RC[-28] ->  | AK76: =RC[-28] ->  | AL76: =RC[-28] -> 0 | AM76: =RC[-28] ->  | AN76: =RC[-28] ->  | AO76: =RC[-28] ->  | AP76: - | AQ76: =RC[-29] ->  | AR76: =RC[-29] ->  | AS76: - | AT76: =RC[-30] -> - | AU76: =RC[-30] ->  | AV76: =RC[-30] ->  | AW76: =RC[-30] -> 
A77: =IF(RC[1]="","",DATEVALUE(RC[1])) ->  | P77: =IF(AND(ISNUMBER(RC[-3]),ISNUMBER(RC[-1])),RC[-3]-RC[-1],"-") -> - | T77: =(RC[-16]*RC[-15]-RC[-13]*RC[-12])/1000 -> #VALUE! | W77: =RC[-2]*RC[-10]/1000 -> #VALUE! | X77: =ABS((RC[-3]*RC[-11]-RC[-2]*RC[-9])/1000) -> #VALUE! | Y77: =(RC[-14]-RC[1])/RC[-18]*100 -> #VALUE! | AC77: =VALUE(RC[-27]) -> #VALUE! | AD77: =IF(RC[21]=42,"*",IF(RC[21]=32,"",RC[21])) ->  | AE77: =RC[-28] ->  | AF77: =RC[-28] ->  | AG77: =RC[-28] ->  | AH77: =RC[-28] ->  | AI77: =RC[-28] ->  | AJ77: =RC[-28] ->  | AK77: =RC[-28] ->  | AL77: =RC[-28] -> 0 | AM77: =RC[-28] ->  | AN77: =RC[-28] ->  | AO77: =RC[-28] ->  | AP77: - | AQ77: =RC[-29] ->  | AR77: =RC[-29] ->  | AS77: - | AT77: =RC[-30] -> - | AU77: =RC[-30] ->  | AV77: =RC[-30] ->  | AW77: =RC[-30] -> 
A78: =IF(RC[1]="","",DATEVALUE(RC[1])) ->  | P78: =IF(AND(ISNUMBER(RC[-3]),ISNUMBER(RC[-1])),RC[-3]-RC[-1],"-") -> - | T78: =(RC[-16]*RC[-15]-RC[-13]*RC[-12])/1000 -> #VALUE! | W78: =RC[-2]*RC[-10]/1000 -> #VALUE! | X78: =ABS((RC[-3]*RC[-11]-RC[-2]*RC[-9])/1000) -> #VALUE! | Y78: =(RC[-14]-RC[1])/RC[-18]*100 -> #VALUE! | AC78: =VALUE(RC[-27]) -> #VALUE! | AD78: =IF(RC[21]=42,"*",IF(RC[21]=32,"",RC[21])) ->  | AE78: =RC[-28] ->  | AF78: =RC[-28] ->  | AG78: =RC[-28] ->  | AH78: =RC[-28] ->  | AI78: =RC[-28] ->  | AJ78: =RC[-28] ->  | AK78: =RC[-28] ->  | AL78: =RC[-28] -> 0 | AM78: =RC[-28] ->  | AN78: =RC[-28] ->  | AO78: =RC[-28] ->  | AP78: - | AQ78: =RC[-29] ->  | AR78: =RC[-29] ->  | AS78: - | AT78: =RC[-30] -> - | AU78: =RC[-30] ->  | AV78: =RC[-30] ->  | AW78: =RC[-30] -> 
A79: =IF(RC[1]="","",DATEVALUE(RC[1])) ->  | P79: =IF(AND(ISNUMBER(RC[-3]),ISNUMBER(RC[-1])),RC[-3]-RC[-1],"-") -> - | T79: =(RC[-16]*RC[-15]-RC[-13]*RC[-12])/1000 -> #VALUE! | W79: =RC[-2]*RC[-10]/1000 -> #VALUE! | X79: =ABS((RC[-3]*RC[-11]-RC[-2]*RC[-9])/1000) -> #VALUE! | Y79: =(RC[-14]-RC[1])/RC[-18]*100 -> #VALUE! | AC79: =VALUE(RC[-27]) -> #VALUE! | AD79: =IF(RC[21]=42,"*",IF(RC[21]=32,"",RC[21])) ->  | AE79: =RC[-28] ->  | AF79: =RC[-28] ->  | AG79: =RC[-28] ->  | AH79: =RC[-28] ->  | AI79: =RC[-28] ->  | AJ79: =RC[-28] ->  | AK79: =RC[-28] ->  | AL79: =RC[-28] -> 0 | AM79: =RC[-28] ->  | AN79: =RC[-28] ->  | AO79: =RC[-28] ->  | AP79: - | AQ79: =RC[-29] ->  | AR79: =RC[-29] ->  | AS79: - | AT79: =RC[-30] -> - | AU79: =RC[-30] ->  | AV79: =RC[-30] ->  | AW79: =RC[-30] -> 
A80: =IF(RC[1]="","",DATEVALUE(RC[1])) ->  | P80: =IF(AND(ISNUMBER(RC[-3]),ISNUMBER(RC[-1])),RC[-3]-RC[-1],"-") -> - | T80: =(RC[-16]*RC[-15]-RC[-13]*RC[-12])/1000 -> #VALUE! | W80: =RC[-2]*RC[-10]/1000 -> #VALUE! | X80: =ABS((RC[-3]*RC[-11]-RC[-2]*RC[-9])/1000) -> #VALUE! | Y80: =(RC[-14]-RC[1])/RC[-18]*100 -> #VALUE! | AC80: =VALUE(RC[-27]) -> #VALUE! | AD80: =IF(RC[21]=42,"*",IF(RC[21]=32,"",RC[21])) ->  | AE80: =RC[-28] ->  | AF80: =RC[-28] ->  | AG80: =RC[-28] ->  | AH80: =RC[-28] ->  | AI80: =RC[-28] ->  | AJ80: =RC[-28] ->  | AK80: =RC[-28] ->  | AL80: =RC[-28] -> 0 | AM80: =RC[-28] ->  | AN80: =RC[-28] ->  | AO80: =RC[-28] ->  | AP80: - | AQ80: =RC[-29] ->  | AR80: =RC[-29] ->  | AS80: - | AT80: =RC[-30] -> - | AU80: =RC[-30] ->  | AV80: =RC[-30] ->  | AW80: =RC[-30] -> 
A81: =IF(RC[1]="","",DATEVALUE(RC[1])) ->  | P81: =IF(AND(ISNUMBER(RC[-3]),ISNUMBER(RC[-1])),RC[-3]-RC[-1],"-") -> - | T81: =(RC[-16]*RC[-15]-RC[-13]*RC[-12])/1000 -> #VALUE! | W81: =RC[-2]*RC[-10]/1000 -> #VALUE! | X81: =ABS((RC[-3]*RC[-11]-RC[-2]*RC[-9])/1000) -> #VALUE! | Y81: =(RC[-14]-RC[1])/RC[-18]*100 -> #VALUE! | AC81: =VALUE(RC[-27]) -> #VALUE! | AD81: =IF(RC[21]=42,"*",IF(RC[21]=32,"",RC[21])) ->  | AE81: =RC[-28] ->  | AF81: =RC[-28] ->  | AG81: =RC[-28] ->  | AH81: =RC[-28] ->  | AI81: =RC[-28] ->  | AJ81: =RC[-28] ->  | AK81: =RC[-28] ->  | AL81: =RC[-28] -> 0 | AM81: =RC[-28] ->  | AN81: =RC[-28] ->  | AO81: =RC[-28] ->  | AP81: - | AQ81: =RC[-29] ->  | AR81: =RC[-29] ->  | AS81: - | AT81: =RC[-30] -> - | AU81: =RC[-30] ->  | AV81: =RC[-30] ->  | AW81: =RC[-30] -> 
A82: =IF(RC[1]="","",DATEVALUE(RC[1])) ->  | P82: =IF(AND(ISNUMBER(RC[-3]),ISNUMBER(RC[-1])),RC[-3]-RC[-1],"-") -> - | T82: =(RC[-16]*RC[-15]-RC[-13]*RC[-12])/1000 -> #VALUE! | W82: =RC[-2]*RC[-10]/1000 -> #VALUE! | X82: =ABS((RC[-3]*RC[-11]-RC[-2]*RC[-9])/1000) -> #VALUE! | Y82: =(RC[-14]-RC[1])/RC[-18]*100 -> #VALUE! | AC82: =VALUE(RC[-27]) -> #VALUE! | AD82: =IF(RC[21]=42,"*",IF(RC[21]=32,"",RC[21])) ->  | AE82: =RC[-28] ->  | AF82: =RC[-28] ->  | AG82: =RC[-28] ->  | AH82: =RC[-28] ->  | AI82: =RC[-28] ->  | AJ82: =RC[-28] ->  | AK82: =RC[-28] ->  | AL82: =RC[-28] -> 0 | AM82: =RC[-28] ->  | AN82: =RC[-28] ->  | AO82: =RC[-28] ->  | AP82: - | AQ82: =RC[-29] ->  | AR82: =RC[-29] ->  | AS82: - | AT82: =RC[-30] -> - | AU82: =RC[-30] ->  | AV82: =RC[-30] ->  | AW82: =RC[-30] -> 
A83: =IF(RC[1]="","",DATEVALUE(RC[1])) ->  | P83: =IF(AND(ISNUMBER(RC[-3]),ISNUMBER(RC[-1])),RC[-3]-RC[-1],"-") -> - | T83: =(RC[-16]*RC[-15]-RC[-13]*RC[-12])/1000 -> #VALUE! | W83: =RC[-2]*RC[-10]/1000 -> #VALUE! | X83: =ABS((RC[-3]*RC[-11]-RC[-2]*RC[-9])/1000) -> #VALUE! | Y83: =(RC[-14]-RC[1])/RC[-18]*100 -> #VALUE! | AC83: =VALUE(RC[-27]) -> #VALUE! | AD83: =IF(RC[21]=42,"*",IF(RC[21]=32,"",RC[21])) ->  | AE83: =RC[-28] ->  | AF83: =RC[-28] ->  | AG83: =RC[-28] ->  | AH83: =RC[-28] ->  | AI83: =RC[-28] ->  | AJ83: =RC[-28] ->  | AK83: =RC[-28] ->  | AL83: =RC[-28] -> 0 | AM83: =RC[-28] ->  | AN83: =RC[-28] ->  | AO83: =RC[-28] ->  | AP83: - | AQ83: =RC[-29] ->  | AR83: =RC[-29] ->  | AS83: - | AT83: =RC[-30] -> - | AU83: =RC[-30] ->  | AV83: =RC[-30] ->  | AW83: =RC[-30] -> 
AC84: Среднее | AF84: =R[1]C[-28] -> 166.10433333333336 | AG84: =R[1]C[-28] -> 67.368999999999986 | AH84: =R[1]C[-28] -> 7.6686666666666667 | AI84: =R[1]C[-28] -> 159.10466666666665 | AJ84: =R[1]C[-28] -> 51.411000000000008 | AK84: =R[1]C[-28] -> 5.3619999999999992 | AL84: =R[1]C[-28] -> 15.958000000000002 | AM84: =R[1]C[-28] -> 6.9996666666666663 | AN84: =R[1]C[-28] -> 45.939999999999991 | AO84: =R[1]C[-28] -> 68.123999999999995 | AP84: - | AQ84: =R[1]C[-29] -> 38.57266666666667 | AR84: =R[1]C[-29] -> 53.02 | AS84: - | AT84: =R[1]C[-30] -> 15.103999999999996 | AU84: =R[1]C[-30] -> 7.3673333333333328
B85: Среднее | D85: =AVERAGE(OFFSET(R[-74]C,3,0,R7C1,1)) -> 166.10433333333336 | E85: =AVERAGE(OFFSET(R[-74]C,3,0,R7C1,1)) -> 67.368999999999986 | F85: =AVERAGE(OFFSET(R[-74]C,3,0,R7C1,1)) -> 7.6686666666666667 | G85: =AVERAGE(OFFSET(R[-74]C,3,0,R7C1,1)) -> 159.10466666666665 | H85: =AVERAGE(OFFSET(R[-74]C,3,0,R7C1,1)) -> 51.411000000000008 | I85: =AVERAGE(OFFSET(R[-74]C,3,0,R7C1,1)) -> 5.3619999999999992 | J85: =AVERAGE(OFFSET(R[-74]C,3,0,R7C1,1)) -> 15.958000000000002 | K85: =AVERAGE(OFFSET(R[-74]C,3,0,R7C1,1)) -> 6.9996666666666663 | L85: =IF(SUM(OFFSET(R[-74]C,3,0,R7C1,1))=0,"",AVERAGE(OFFSET(R[-74]C,3,0,R7C1,1))) -> 45.939999999999991 | M85: =IF(SUM(OFFSET(R[-74]C,3,0,R7C1,1))=0,"",AVERAGE(OFFSET(R[-74]C,3,0,R7C1,1))) -> 68.123999999999995 | N85: =IF(SUM(OFFSET(R[-74]C,3,0,R7C1,1))=0,"",AVERAGE(OFFSET(R[-74]C,3,0,R7C1,1))) -> 38.57266666666667 | O85: =IF(SUM(OFFSET(R[-74]C,3,0,R7C1,1))=0,"",AVERAGE(OFFSET(R[-74]C,3,0,R7C1,1))) -> 53.02 | P85: =IF(SUM(OFFSET(R[-74]C,3,0,R7C1,1))=0,"",AVERAGE(OFFSET(R[-74]C,3,0,R7C1,1))) -> 15.103999999999996 | Q85: =IF(SUM(OFFSET(R[-74]C,3,0,R7C1,1))=0,"",AVERAGE(OFFSET(R[-74]C,3,0,R7C1,1))) -> 7.3673333333333328 | R85: =IF(SUM(OFFSET(R[-74]C,3,0,R7C1,1))=0,"",AVERAGE(OFFSET(R[-74]C,3,0,R7C1,1))) -> 1.0553333333333335 | S85: =AVERAGE(OFFSET(R[-74]C,3,0,R7C1,1)) -> 3.3292666666666673 | T85: =AVERAGE(OFFSET(R[-74]C,3,0,R7C1,1)) -> 3.256108876666667 | W85: =AVERAGE(OFFSET(R[-74]C,3,0,R7C1,1)) -> 2.8987743477777772 | X85: =AVERAGE(OFFSET(R[-74]C,3,0,R7C1,1)) -> 0.99137553111111099 | AC85: Итого | AE85: =R[1]C[-28] -> 720 | AF85: =R[1]C[-28] -> 4983.130000000001 | AI85: =R[1]C[-28] -> 4773.1399999999994 | AM85: =R[1]C[-28] -> 209.98999999999998 | AN85: =R[1]C[-28] -> 1378.1999999999998 | AQ85: =R[1]C[-29] -> 1157.18 | AU85: =R[1]C[-30] -> 221.01999999999998 | AV85: =R[1]C[-30] -> 31.660000000000004 | AW85: =R[1]C[-30] -> 99.878000000000014
B86: ИТОГО: | C86: =SUM(OFFSET(R[-75]C,3,0,R7C1,1)) -> 720 | D86: =SUM(OFFSET(R[-75]C,3,0,R7C1,1)) -> 4983.130000000001 | G86: =SUM(OFFSET(R[-75]C,3,0,R7C1,1)) -> 4773.1399999999994 | K86: =SUM(OFFSET(R[-75]C,3,0,R7C1,1)) -> 209.98999999999998 | L86: =IF(SUM(OFFSET(R[-75]C,3,0,R7C1,1))=0,"",SUM(OFFSET(R[-75]C,3,0,R7C1,1))) -> 1378.1999999999998 | N86: =IF(SUM(OFFSET(R[-75]C,3,0,R7C1,1))=0,"",SUM(OFFSET(R[-75]C,3,0,R7C1,1))) -> 1157.18 | Q86: =IF(SUM(OFFSET(R[-75]C,3,0,R7C1,1))=0,"",SUM(OFFSET(R[-75]C,3,0,R7C1,1))) -> 221.01999999999998 | R86: =IF(SUM(OFFSET(R[-75]C,3,0,R7C1,1))=0,"",SUM(OFFSET(R[-75]C,3,0,R7C1,1))) -> 31.660000000000004 | S86: =SUM(OFFSET(R[-75]C,3,0,R7C1,1)) -> 99.878000000000014 | T86: =SUM(OFFSET(R[-75]C,3,0,R7C1,1)) -> 97.683266300000014 | W86: =SUM(OFFSET(R[-75]C,3,0,R7C1,1)) -> 86.963230433333322 | X86: =SUM(OFFSET(R[-75]C,3,0,R7C1,1)) -> 29.741265933333331
AC87: Досчёт | AF87: =R[1]C[-28] -> 0 | AI87: =R[1]C[-28] -> 0 | AM87: =R[1]C[-28] -> 0 | AN87: =R[1]C[-28] -> 0 | AQ87: =R[1]C[-29] -> 0 | AU87: =R[1]C[-30] -> 0 | AV87: =R[1]C[-30] -> 0 | AW87: =R[1]C[-30] -> 0
A88: 11дн=264ч 4дн=96ч | B88: Досчёт до конца м-ца (+) | C88: =R6C1*24 -> 216 | T88: № 50025 | AC88: Снятие | AF88: =-R[1]C[-28] -> 0 | AI88: =-R[1]C[-28] -> 0 | AM88: =-R[1]C[-28] -> 0 | AN88: =-R[1]C[-28] -> 0 | AQ88: =-R[1]C[-29] -> 0 | AU88: =-R[1]C[-30] -> 0 | AV88: =-R[1]C[-30] -> 0 | AW88: =-R[1]C[-30] -> 0
A89: 9дн=216ч 7дн=168ч | B89: Вычет с предыдущего (-) | C89: =R4C1*24 -> 192 | AC89: Сумма | AF89: =R[1]C[-28] -> 4983.130000000001 | AI89: =R[1]C[-28] -> 4773.1399999999994 | AM89: =R[1]C[-28] -> 209.98999999999998 | AN89: =R[1]C[-28] -> 1378.1999999999998 | AQ89: =R[1]C[-29] -> 1157.18 | AU89: =R[1]C[-30] -> 221.01999999999998 | AV89: =R[1]C[-30] -> 31.660000000000004 | AW89: =R[1]C[-30] -> 99.878000000000014
B90: СУММА: | C90: =R[-4]C+R[-2]C-R[-1]C -> 744 | D90: =R[-4]C+R[-2]C-R[-1]C -> 4983.130000000001 | G90: =R[-4]C+R[-2]C-R[-1]C -> 4773.1399999999994 | K90: =R[-4]C+R[-2]C-R[-1]C -> 209.98999999999998 | L90: =IF(SUM(OFFSET(R[-79]C,3,0,R7C1,1))=0,"",(R[-4]C+R[-2]C-R[-1]C)) -> 1378.1999999999998 | N90: =IF(SUM(OFFSET(R[-79]C,3,0,R7C1,1))=0,"",(R[-4]C+R[-2]C-R[-1]C)) -> 1157.18 | Q90: =IF(SUM(OFFSET(R[-79]C,3,0,R7C1,1))=0,"",(R[-4]C+R[-2]C-R[-1]C)) -> 221.01999999999998 | R90: =IF(SUM(OFFSET(R[-79]C,3,0,R7C1,1))=0,"",(R[-4]C+R[-2]C-R[-1]C)) -> 31.660000000000004 | S90: =R[-4]C+R[-2]C-R[-1]C -> 99.878000000000014
AC91: Тхв на источнике | AE91: V гвс (м3) | AF91: =R[-2]C[15] -> 221.01999999999998 | AG91: W гвс (Гкал) | AH91: =RC[-2]*0.06 -> 13.261199999999999 | AI91: W без гвс (Гкал) | AJ91: =R[-2]C[13]-RC[-2] -> 86.616800000000012
B92: Показания счетчиков на момент снятия данных:
B93: Дата, время | D93: М1, т | F93: М2, т | H93: М3, т | J93: М4, т | L93: Qо, Гкал | N93: Qг, Гкал | P93: время, час
B94: 23.09.18 08:00 | D94: 30515.14 | F94: 29075.41 | H94: 8860.81 | J94: 7578.54 | L94: 614.94100000000003 | N94: 231.309 | P94: -
B95: 23.10.18 04:00 | D95: 35527.18 | F95: 33875.74 | H95: 10141.42 | J95: 8670.9 | L95: 713.91200000000003 | N95: 261.572 | P95: -
AC97: =ZAYAVKA_N -> з.н д. №02/147-2783 от 04.10.18 с 23.09.18г по 25.09.18г некорректная работа приборов
B98: Представитель потребителя:_______________________________________________________________________ В.О. Топорков
I101: Рекомендуемые значения по параметрам теплопотребления (не являются официально утверждёнными)
I102: М, т | J102: V, м3 | K102: Qгвс, Гкал | L102: Qотоп, Гкал | M102: Qо, Гкал
I103: =R[-13]C[-3] -> 0 | J103: =RC[-1]/0.98 -> 0 | K103: =RC[-1]*0.06 -> 0 | L103: =RC[1]-RC[-1] -> 31.660000000000004 | M103: =R[-13]C[5] -> 31.660000000000004
O105: ДЛЯ САМОКОНТРОЛЯ
B106: В строке выбора дат указать период с 16.7.13 по 23.8.13 - жильё | N106: Q | O106: Qг
B107: В строке выбора дат указать период с 18.7.13 по 25.8.13 - не жилое | N107: =(R[-21]C[-10]*R[-22]C[-7]-R[-21]C[-9]*R[-22]C[-6])/1000 -> 792.83923760666676 | O107: =IF(R[-22]C[-2]="",R[-21]C[-3]*R[-22]C/1000,"") ->  | P107: Си2
O108: =IF(R[-23]C[-2]="","",((R[-22]C[-3]*R[-23]C)-(R[-22]C[-2]*R[-23]C[2]))/1000) -> 73.072163999999987 | P108: Си3