Sheet: Лист1
G1: Отчёт о теплопотреблении за октябрь 2018 | M1: з.н д. №02/147-2783 от 04.10.18
A4: =EOMONTH(R[9]C,0)-R[9]C -> 8 | B4: Потребитель: ЗАО "Сити Сервис"
A5: =MAX(R[9]C:R[78]C) -> 2018-10-22T00:00:00.000 | B5: Адрес: г. СПб, Наличная ул., д.55 ИТП 5
A6: =EOMONTH(R[-1]C,0)-R[-1]C -> 9 | B6: Телефон: 8-911-021-19-79
A7: =R[-2]C-R[6]C -> 30 | B7: Договор 10023-3 (.) 85884, 85885, 85886
A8: 7 | B8: Тепловычислитель: ВКТ-7 № 50011 | L8: М2 мах= | M8: 218.4 | O8: Мгвс мах= | P8: 22.08
L9: Qотоп мах= | M9: 17.479 | O9: Qгвс мах= | P9: 1.464
B10: Расчётная формула: Q=M1*(h1-hхв)-M2*(h2-hхв)
D12: Учет | L12: Контроль
A13: =R[1]C[1]-1 -> 2018-09-22T00:00:00.000 | B13: Дата | C13: N, ч | D13: M1, т | E13: T1, С | F13: P1, кг/см2 | G13: M2, т | H13: T2, С | I13: P2, кг/см2 | J13: dT, С | K13: M1-М2, т | L13: V3, м3 | M13: T3, С | N13: V4, м3 | O13: =IF(R[-12]C[-14]="м.куб","","T4, С") -> T4, С | P13: dT, С | Q13: V3-V4, м3 | R13: Qгвс, Гкал | S13: Qобщ., Гкал | T13: Q | U13: M3 | V13: M4 | W13: си2 | X13: си3 | Y13: Разб. | Z13: dM2 | AC13: Дата | AD13: НС | AE13: n, ч | AF13: М1, т | AG13: t1, гр. С | AH13: Р1, кгс/см2 | AI13: М2, т | AJ13: t2, гр. С | AK13: Р2, кгс/см2 | AL13: t1-t2, гр. С | AM13: М1-М2, т | AN13: М1гвс, т | AO13: t1гвс, гр. С | AP13: Р1гвс, кгс/см2 | AQ13: М2гвс, т | AR13: t2гвс, гр. С | AS13: Р2гвс, кгс/см2 | AT13: t1гвс-t2гвс | AU13: М1гвс-М2гвс, т | AV13: Wгвс, Гкал | AW13: Wсумм, Гкал | AY13: NS_TV1 | AZ13: НС | BA13: NS_TV2
A14: =IF(RC[1]="","",DATEVALUE(RC[1])) -> 43366 | B14: 23.09.18 | C14: 24 | D14: 0 | E14: 36.18 | F14: 4.95 | G14: 2.58 | H14: 47.42 | I14: 5.43 | J14: =RC[-5]-RC[-2] -> -11.240000000000002 | K14: -2.58 | L14: 3.33 | M14: 38.86 | N14: 1.1000000000000001 | O14: 29.96 | P14: =IF(AND(ISNUMBER(RC[-3]),ISNUMBER(RC[-1])),RC[-3]-RC[-1],"-") -> 8.8999999999999986 | Q14: 2.23 | R14: 9.7000000000000003E-2 | S14: =RC[-1] -> 9.7000000000000003E-2 | T14: =(RC[-16]*RC[-15]-RC[-13]*RC[-12])/1000 -> -0.12234360000000001 | U14: 3.33 | V14: 1.1000000000000001 | W14: =RC[-2]*RC[-10]/1000 -> 0.12940379999999999 | X14: =ABS((RC[-3]*RC[-11]-RC[-2]*RC[-9])/1000) -> 9.6447799999999986E-2 | Y14: =(RC[-14]-RC[1])/RC[-18]*100 -> -186.4341085271318 | Z14: 2.23 | AC14: =VALUE(RC[-27]) -> 2018-09-23T00:00:00.000 | AD14: =IF(RC[21]=42,"*",IF(RC[21]=32,"",RC[21])) -> - | AE14: =RC[-28] -> 24 | AF14: =RC[-28] -> 0 | AG14: =RC[-28] -> 36.18 | AH14: =RC[-28] -> 4.95 | AI14: =RC[-28] -> 2.58 | AJ14: =RC[-28] -> 47.42 | AK14: =RC[-28] -> 5.43 | AL14: =RC[-28] -> -11.240000000000002 | AM14: =RC[-28] -> -2.58 | AN14: =RC[-28] -> 3.33 | AO14: =RC[-28] -> 38.86 | AP14: - | AQ14: =RC[-29] -> 1.1000000000000001 | AR14: =RC[-29] -> 29.96 | AS14: - | AT14: =RC[-30] -> 8.8999999999999986 | AU14: =RC[-30] -> 2.23 | AV14: =RC[-30] -> 9.7000000000000003E-2 | AW14: =RC[-30] -> 9.7000000000000003E-2 | AY14: - | AZ14: - | BA14: -
A15: =IF(RC[1]="","",DATEVALUE(RC[1])) -> 43367 | B15: 24.09.18 | C15: 24 | D15: 65.13 | E15: 68.34 | F15: 6.92 | G15: 64.39 | H15: 46.84 | I15: 3.6 | J15: =RC[-5]-RC[-2] -> 21.5 | K15: 0.74 | L15: 20.16 | M15: 65.56 | N15: 16.239999999999998 | O15: 53.43 | P15: =IF(AND(ISNUMBER(RC[-3]),ISNUMBER(RC[-1])),RC[-3]-RC[-1],"-") -> 12.130000000000003 | Q15: 3.92 | R15: 0.443 | S15: 1.506 | T15: =(RC[-16]*RC[-15]-RC[-13]*RC[-12])/1000 -> 1.4349565999999996 | U15: 19.8 | V15: 16.010000000000002 | W15: =RC[-2]*RC[-10]/1000 -> 1.2980880000000001 | X15: =ABS((RC[-3]*RC[-11]-RC[-2]*RC[-9])/1000) -> 0.44267370000000017 | Y15: =(RC[-14]-RC[1])/RC[-18]*100 -> -4.7367603665165392 | Z15: 3.79 | AC15: =VALUE(RC[-27]) -> 2018-09-24T00:00:00.000 | AD15: =IF(RC[21]=42,"*",IF(RC[21]=32,"",RC[21])) -> - | AE15: =RC[-28] -> 24 | AF15: =RC[-28] -> 65.13 | AG15: =RC[-28] -> 68.34 | AH15: =RC[-28] -> 6.92 | AI15: =RC[-28] -> 64.39 | AJ15: =RC[-28] -> 46.84 | AK15: =RC[-28] -> 3.6 | AL15: =RC[-28] -> 21.5 | AM15: =RC[-28] -> 0.74 | AN15: =RC[-28] -> 20.16 | AO15: =RC[-28] -> 65.56 | AP15: - | AQ15: =RC[-29] -> 16.239999999999998 | AR15: =RC[-29] -> 53.43 | AS15: - | AT15: =RC[-30] -> 12.130000000000003 | AU15: =RC[-30] -> 3.92 | AV15: =RC[-30] -> 0.443 | AW15: =RC[-30] -> 1.506 | AY15: - | AZ15: - | BA15: -
A16: =IF(RC[1]="","",DATEVALUE(RC[1])) -> 43368 | B16: 25.09.18 | C16: 24 | D16: 132.63999999999999 | E16: 68.17 | F16: 8.98 | G16: 128.78 | H16: 47.74 | I16: 4.51 | J16: =RC[-5]-RC[-2] -> 20.43 | K16: 3.86 | L16: 36.9 | M16: 68.12 | N16: 31.99 | O16: 55.97 | P16: =IF(AND(ISNUMBER(RC[-3]),ISNUMBER(RC[-1])),RC[-3]-RC[-1],"-") -> 12.150000000000006 | Q16: 4.91 | R16: 0.7 | S16: 2.903 | T16: =(RC[-16]*RC[-15]-RC[-13]*RC[-12])/1000 -> 2.8941115999999982 | U16: 36.15 | V16: 31.51 | W16: =RC[-2]*RC[-10]/1000 -> 2.4625379999999999 | X16: =ABS((RC[-3]*RC[-11]-RC[-2]*RC[-9])/1000) -> 0.69892329999999991 | Y16: =(RC[-14]-RC[1])/RC[-18]*100 -> -0.60568411243981968 | Z16: 4.6399999999999997 | AC16: =VALUE(RC[-27]) -> 2018-09-25T00:00:00.000 | AD16: =IF(RC[21]=42,"*",IF(RC[21]=32,"",RC[21])) -> - | AE16: =RC[-28] -> 24 | AF16: =RC[-28] -> 132.63999999999999 | AG16: =RC[-28] -> 68.17 | AH16: =RC[-28] -> 8.98 | AI16: =RC[-28] -> 128.78 | AJ16: =RC[-28] -> 47.74 | AK16: =RC[-28] -> 4.51 | AL16: =RC[-28] -> 20.43 | AM16: =RC[-28] -> 3.86 | AN16: =RC[-28] -> 36.9 | AO16: =RC[-28] -> 68.12 | AP16: - | AQ16: =RC[-29] -> 31.99 | AR16: =RC[-29] -> 55.97 | AS16: - | AT16: =RC[-30] -> 12.150000000000006 | AU16: =RC[-30] -> 4.91 | AV16: =RC[-30] -> 0.7 | AW16: =RC[-30] -> 2.903 | AY16: - | AZ16: - | BA16: -
A17: =IF(RC[1]="","",DATEVALUE(RC[1])) -> 43369 | B17: 26.09.18 | C17: 24 | D17: 132.4 | E17: 67.739999999999995 | F17: 8.98 | G17: 128.6 | H17: 47.28 | I17: 5.0599999999999996 | J17: =RC[-5]-RC[-2] -> 20.459999999999994 | K17: 3.8 | L17: 36.93 | M17: 67.62 | N17: 32.07 | O17: 55.77 | P17: =IF(AND(ISNUMBER(RC[-3]),ISNUMBER(RC[-1])),RC[-3]-RC[-1],"-") -> 11.850000000000001 | Q17: 4.8600000000000003 | R17: 0.68700000000000006 | S17: 2.899 | T17: =(RC[-16]*RC[-15]-RC[-13]*RC[-12])/1000 -> 2.8885680000000002 | U17: 36.18 | V17: 31.59 | W17: =RC[-2]*RC[-10]/1000 -> 2.4464916000000003 | X17: =ABS((RC[-3]*RC[-11]-RC[-2]*RC[-9])/1000) -> 0.6847173000000002 | Y17: =(RC[-14]-RC[1])/RC[-18]*100 -> -0.61430793157076202 | Z17: 4.59 | AC17: =VALUE(RC[-27]) -> 2018-09-26T00:00:00.000 | AD17: =IF(RC[21]=42,"*",IF(RC[21]=32,"",RC[21])) -> - | AE17: =RC[-28] -> 24 | AF17: =RC[-28] -> 132.4 | AG17: =RC[-28] -> 67.739999999999995 | AH17: =RC[-28] -> 8.98 | AI17: =RC[-28] -> 128.6 | AJ17: =RC[-28] -> 47.28 | AK17: =RC[-28] -> 5.0599999999999996 | AL17: =RC[-28] -> 20.459999999999994 | AM17: =RC[-28] -> 3.8 | AN17: =RC[-28] -> 36.93 | AO17: =RC[-28] -> 67.62 | AP17: - | AQ17: =RC[-29] -> 32.07 | AR17: =RC[-29] -> 55.77 | AS17: - | AT17: =RC[-30] -> 11.850000000000001 | AU17: =RC[-30] -> 4.8600000000000003 | AV17: =RC[-30] -> 0.68700000000000006 | AW17: =RC[-30] -> 2.899 | AY17: - | AZ17: - | BA17: -
A18: =IF(RC[1]="","",DATEVALUE(RC[1])) -> 43370 | B18: 27.09.18 | C18: 24 | D18: 125.3 | E18: 63.06 | F18: 8.6999999999999993 | G18: 121.3 | H18: 44.42 | I18: 4.6900000000000004 | J18: =RC[-5]-RC[-2] -> 18.64 | K18: 4 | L18: 35.31 | M18: 63.02 | N18: 30.27 | O18: 52.28 | P18: =IF(AND(ISNUMBER(RC[-3]),ISNUMBER(RC[-1])),RC[-3]-RC[-1],"-") -> 10.740000000000002 | Q18: 5.04 | R18: 0.625 | S18: 2.5209999999999999 | T18: =(RC[-16]*RC[-15]-RC[-13]*RC[-12])/1000 -> 2.5132719999999997 | U18: 34.619999999999997 | V18: 29.79 | W18: =RC[-2]*RC[-10]/1000 -> 2.1817523999999997 | X18: =ABS((RC[-3]*RC[-11]-RC[-2]*RC[-9])/1000) -> 0.62433119999999986 | Y18: =(RC[-14]-RC[1])/RC[-18]*100 -> -0.68425391591096463 | Z18: 4.83 | AC18: =VALUE(RC[-27]) -> 2018-09-27T00:00:00.000 | AD18: =IF(RC[21]=42,"*",IF(RC[21]=32,"",RC[21])) -> - | AE18: =RC[-28] -> 24 | AF18: =RC[-28] -> 125.3 | AG18: =RC[-28] -> 63.06 | AH18: =RC[-28] -> 8.6999999999999993 | AI18: =RC[-28] -> 121.3 | AJ18: =RC[-28] -> 44.42 | AK18: =RC[-28] -> 4.6900000000000004 | AL18: =RC[-28] -> 18.64 | AM18: =RC[-28] -> 4 | AN18: =RC[-28] -> 35.31 | AO18: =RC[-28] -> 63.02 | AP18: - | AQ18: =RC[-29] -> 30.27 | AR18: =RC[-29] -> 52.28 | AS18: - | AT18: =RC[-30] -> 10.740000000000002 | AU18: =RC[-30] -> 5.04 | AV18: =RC[-30] -> 0.625 | AW18: =RC[-30] -> 2.5209999999999999 | AY18: - | AZ18: - | BA18: -
A19: =IF(RC[1]="","",DATEVALUE(RC[1])) -> 43371 | B19: 28.09.18 | C19: 24 | D19: 121.27 | E19: 67.63 | F19: 8.5500000000000007 | G19: 117.06 | H19: 46.07 | I19: 5.43 | J19: =RC[-5]-RC[-2] -> 21.559999999999995 | K19: 4.21 | L19: 34.4 | M19: 67.59 | N19: 29.34 | O19: 54.96 | P19: =IF(AND(ISNUMBER(RC[-3]),ISNUMBER(RC[-1])),RC[-3]-RC[-1],"-") -> 12.630000000000003 | Q19: 5.0599999999999996 | R19: 0.69199999999999995 | S19: 2.8140000000000001 | T19: =(RC[-16]*RC[-15]-RC[-13]*RC[-12])/1000 -> 2.808535899999999 | U19: 33.68 | V19: 28.86 | W19: =RC[-2]*RC[-10]/1000 -> 2.2764312000000002 | X19: =ABS((RC[-3]*RC[-11]-RC[-2]*RC[-9])/1000) -> 0.69028559999999994 | Y19: =(RC[-14]-RC[1])/RC[-18]*100 -> -0.52110029044934247 | Z19: 4.82 | AC19: =VALUE(RC[-27]) -> 2018-09-28T00:00:00.000 | AD19: =IF(RC[21]=42,"*",IF(RC[21]=32,"",RC[21])) -> - | AE19: =RC[-28] -> 24 | AF19: =RC[-28] -> 121.27 | AG19: =RC[-28] -> 67.63 | AH19: =RC[-28] -> 8.5500000000000007 | AI19: =RC[-28] -> 117.06 | AJ19: =RC[-28] -> 46.07 | AK19: =RC[-28] -> 5.43 | AL19: =RC[-28] -> 21.559999999999995 | AM19: =RC[-28] -> 4.21 | AN19: =RC[-28] -> 34.4 | AO19: =RC[-28] -> 67.59 | AP19: - | AQ19: =RC[-29] -> 29.34 | AR19: =RC[-29] -> 54.96 | AS19: - | AT19: =RC[-30] -> 12.630000000000003 | AU19: =RC[-30] -> 5.0599999999999996 | AV19: =RC[-30] -> 0.69199999999999995 | AW19: =RC[-30] -> 2.8140000000000001 | AY19: - | AZ19: - | BA19: -
A20: =IF(RC[1]="","",DATEVALUE(RC[1])) -> 43372 | B20: 29.09.18 | C20: 24 | D20: 119.76 | E20: 67.239999999999995 | F20: 8.5299999999999994 | G20: 114.02 | H20: 45.4 | I20: 5.43 | J20: =RC[-5]-RC[-2] -> 21.839999999999996 | K20: 5.74 | L20: 35.31 | M20: 67.150000000000006 | N20: 28.78 | O20: 54.86 | P20: =IF(AND(ISNUMBER(RC[-3]),ISNUMBER(RC[-1])),RC[-3]-RC[-1],"-") -> 12.290000000000006 | Q20: 6.53 | R20: 0.76800000000000002 | S20: 2.8820000000000001 | T20: =(RC[-16]*RC[-15]-RC[-13]*RC[-12])/1000 -> 2.8761544000000003 | U20: 34.58 | V20: 28.3 | W20: =RC[-2]*RC[-10]/1000 -> 2.322047 | X20: =ABS((RC[-3]*RC[-11]-RC[-2]*RC[-9])/1000) -> 0.769509 | Y20: =(RC[-14]-RC[1])/RC[-18]*100 -> -0.47360112261006843 | Z20: 6.28 | AC20: =VALUE(RC[-27]) -> 2018-09-29T00:00:00.000 | AD20: =IF(RC[21]=42,"*",IF(RC[21]=32,"",RC[21])) -> - | AE20: =RC[-28] -> 24 | AF20: =RC[-28] -> 119.76 | AG20: =RC[-28] -> 67.239999999999995 | AH20: =RC[-28] -> 8.5299999999999994 | AI20: =RC[-28] -> 114.02 | AJ20: =RC[-28] -> 45.4 | AK20: =RC[-28] -> 5.43 | AL20: =RC[-28] -> 21.839999999999996 | AM20: =RC[-28] -> 5.74 | AN20: =RC[-28] -> 35.31 | AO20: =RC[-28] -> 67.150000000000006 | AP20: - | AQ20: =RC[-29] -> 28.78 | AR20: =RC[-29] -> 54.86 | AS20: - | AT20: =RC[-30] -> 12.290000000000006 | AU20: =RC[-30] -> 6.53 | AV20: =RC[-30] -> 0.76800000000000002 | AW20: =RC[-30] -> 2.8820000000000001 | AY20: - | AZ20: - | BA20: -
A21: =IF(RC[1]="","",DATEVALUE(RC[1])) -> 43373 | B21: 30.09.18 | C21: 24 | D21: 118.89 | E21: 69.44 | F21: 8.4499999999999993 | G21: 112.62 | H21: 46.1 | I21: 5.43 | J21: =RC[-5]-RC[-2] -> 23.339999999999996 | K21: 6.27 | L21: 35.64 | M21: 69.42 | N21: 28.68 | O21: 56.14 | P21: =IF(AND(ISNUMBER(RC[-3]),ISNUMBER(RC[-1])),RC[-3]-RC[-1],"-") -> 13.280000000000001 | Q21: 6.96 | R21: 0.83899999999999997 | S21: 3.0710000000000002 | T21: =(RC[-16]*RC[-15]-RC[-13]*RC[-12])/1000 -> 3.063939599999999 | U21: 34.86 | V21: 28.2 | W21: =RC[-2]*RC[-10]/1000 -> 2.4199812000000001 | X21: =ABS((RC[-3]*RC[-11]-RC[-2]*RC[-9])/1000) -> 0.83683320000000028 | Y21: =(RC[-14]-RC[1])/RC[-18]*100 -> -0.34629728289824241 | Z21: 6.66 | AC21: =VALUE(RC[-27]) -> 2018-09-30T00:00:00.000 | AD21: =IF(RC[21]=42,"*",IF(RC[21]=32,"",RC[21])) -> - | AE21: =RC[-28] -> 24 | AF21: =RC[-28] -> 118.89 | AG21: =RC[-28] -> 69.44 | AH21: =RC[-28] -> 8.4499999999999993 | AI21: =RC[-28] -> 112.62 | AJ21: =RC[-28] -> 46.1 | AK21: =RC[-28] -> 5.43 | AL21: =RC[-28] -> 23.339999999999996 | AM21: =RC[-28] -> 6.27 | AN21: =RC[-28] -> 35.64 | AO21: =RC[-28] -> 69.42 | AP21: - | AQ21: =RC[-29] -> 28.68 | AR21: =RC[-29] -> 56.14 | AS21: - | AT21: =RC[-30] -> 13.280000000000001 | AU21: =RC[-30] -> 6.96 | AV21: =RC[-30] -> 0.83899999999999997 | AW21: =RC[-30] -> 3.0710000000000002 | AY21: - | AZ21: - | BA21: -
A22: =IF(RC[1]="","",DATEVALUE(RC[1])) -> 43374 | B22: 01.10.18 | C22: 24 | D22: 117.71 | E22: 68.25 | F22: 8.5500000000000007 | G22: 113.33 | H22: 45.91 | I22: 5.43 | J22: =RC[-5]-RC[-2] -> 22.340000000000003 | K22: 4.38 | L22: 33.9 | M22: 68.17 | N22: 28.88 | O22: 55.39 | P22: =IF(AND(ISNUMBER(RC[-3]),ISNUMBER(RC[-1])),RC[-3]-RC[-1],"-") -> 12.780000000000001 | Q22: 5.0199999999999996 | R22: 0.68700000000000006 | S22: 2.8330000000000002 | T22: =(RC[-16]*RC[-15]-RC[-13]*RC[-12])/1000 -> 2.8307272000000001 | U22: 33.17 | V22: 28.4 | W22: =RC[-2]*RC[-10]/1000 -> 2.2611989000000001 | X22: =ABS((RC[-3]*RC[-11]-RC[-2]*RC[-9])/1000) -> 0.68812290000000031 | Y22: =(RC[-14]-RC[1])/RC[-18]*100 -> -0.34412776846377807 | Z22: 4.7699999999999996 | AC22: =VALUE(RC[-27]) -> 2018-10-01T00:00:00.000 | AD22: =IF(RC[21]=42,"*",IF(RC[21]=32,"",RC[21])) -> - | AE22: =RC[-28] -> 24 | AF22: =RC[-28] -> 117.71 | AG22: =RC[-28] -> 68.25 | AH22: =RC[-28] -> 8.5500000000000007 | AI22: =RC[-28] -> 113.33 | AJ22: =RC[-28] -> 45.91 | AK22: =RC[-28] -> 5.43 | AL22: =RC[-28] -> 22.340000000000003 | AM22: =RC[-28] -> 4.38 | AN22: =RC[-28] -> 33.9 | AO22: =RC[-28] -> 68.17 | AP22: - | AQ22: =RC[-29] -> 28.88 | AR22: =RC[-29] -> 55.39 | AS22: - | AT22: =RC[-30] -> 12.780000000000001 | AU22: =RC[-30] -> 5.0199999999999996 | AV22: =RC[-30] -> 0.68700000000000006 | AW22: =RC[-30] -> 2.8330000000000002 | AY22: - | AZ22: - | BA22: -
A23: =IF(RC[1]="","",DATEVALUE(RC[1])) -> 43375 | B23: 02.10.18 | C23: 24 | D23: 113.27 | E23: 66.97 | F23: 8.26 | G23: 108.16 | H23: 44.88 | I23: 5.43 | J23: =RC[-5]-RC[-2] -> 22.089999999999996 | K23: 5.1100000000000003 | L23: 33.270000000000003 | M23: 66.91 | N23: 27.62 | O23: 54.22 | P23: =IF(AND(ISNUMBER(RC[-3]),ISNUMBER(RC[-1])),RC[-3]-RC[-1],"-") -> 12.689999999999998 | Q23: 5.65 | R23: 0.71 | S23: 2.7360000000000002 | T23: =(RC[-16]*RC[-15]-RC[-13]*RC[-12])/1000 -> 2.7314710999999998 | U23: 32.590000000000003 | V23: 27.16 | W23: =RC[-2]*RC[-10]/1000 -> 2.1805968999999998 | X23: =ABS((RC[-3]*RC[-11]-RC[-2]*RC[-9])/1000) -> 0.70798170000000005 | Y23: =(RC[-14]-RC[1])/RC[-18]*100 -> -0.29585798816567987 | Z23: 5.43 | AC23: =VALUE(RC[-27]) -> 2018-10-02T00:00:00.000 | AD23: =IF(RC[21]=42,"*",IF(RC[21]=32,"",RC[21])) -> - | AE23: =RC[-28] -> 24 | AF23: =RC[-28] -> 113.27 | AG23: =RC[-28] -> 66.97 | AH23: =RC[-28] -> 8.26 | AI23: =RC[-28] -> 108.16 | AJ23: =RC[-28] -> 44.88 | AK23: =RC[-28] -> 5.43 | AL23: =RC[-28] -> 22.089999999999996 | AM23: =RC[-28] -> 5.1100000000000003 | AN23: =RC[-28] -> 33.270000000000003 | AO23: =RC[-28] -> 66.91 | AP23: - | AQ23: =RC[-29] -> 27.62 | AR23: =RC[-29] -> 54.22 | AS23: - | AT23: =RC[-30] -> 12.689999999999998 | AU23: =RC[-30] -> 5.65 | AV23: =RC[-30] -> 0.71 | AW23: =RC[-30] -> 2.7360000000000002 | AY23: - | AZ23: - | BA23: -
A24: =IF(RC[1]="","",DATEVALUE(RC[1])) -> 43376 | B24: 03.10.18 | C24: 24 | D24: 110.29 | E24: 67.099999999999994 | F24: 8.2200000000000006 | G24: 105.02 | H24: 44.51 | I24: 5.43 | J24: =RC[-5]-RC[-2] -> 22.589999999999996 | K24: 5.27 | L24: 32.6 | M24: 67.05 | N24: 26.92 | O24: 54.16 | P24: =IF(AND(ISNUMBER(RC[-3]),ISNUMBER(RC[-1])),RC[-3]-RC[-1],"-") -> 12.89 | Q24: 5.68 | R24: 0.71 | S24: 2.7280000000000002 | T24: =(RC[-16]*RC[-15]-RC[-13]*RC[-12])/1000 -> 2.7260187999999999 | U24: 31.93 | V24: 26.48 | W24: =RC[-2]*RC[-10]/1000 -> 2.1409065000000003 | X24: =ABS((RC[-3]*RC[-11]-RC[-2]*RC[-9])/1000) -> 0.70674970000000004 | Y24: =(RC[-14]-RC[1])/RC[-18]*100 -> -0.17139592458579378 | Z24: 5.45 | AC24: =VALUE(RC[-27]) -> 2018-10-03T00:00:00.000 | AD24: =IF(RC[21]=42,"*",IF(RC[21]=32,"",RC[21])) -> - | AE24: =RC[-28] -> 24 | AF24: =RC[-28] -> 110.29 | AG24: =RC[-28] -> 67.099999999999994 | AH24: =RC[-28] -> 8.2200000000000006 | AI24: =RC[-28] -> 105.02 | AJ24: =RC[-28] -> 44.51 | AK24: =RC[-28] -> 5.43 | AL24: =RC[-28] -> 22.589999999999996 | AM24: =RC[-28] -> 5.27 | AN24: =RC[-28] -> 32.6 | AO24: =RC[-28] -> 67.05 | AP24: - | AQ24: =RC[-29] -> 26.92 | AR24: =RC[-29] -> 54.16 | AS24: - | AT24: =RC[-30] -> 12.89 | AU24: =RC[-30] -> 5.68 | AV24: =RC[-30] -> 0.71 | AW24: =RC[-30] -> 2.7280000000000002 | AY24: - | AZ24: - | BA24: -
A25: =IF(RC[1]="","",DATEVALUE(RC[1])) -> 43377 | B25: 04.10.18 | C25: 24 | D25: 104.49 | E25: 66.430000000000007 | F25: 8.02 | G25: 99.05 | H25: 42.82 | I25: 5.43 | J25: =RC[-5]-RC[-2] -> 23.610000000000007 | K25: 5.44 | L25: 31.18 | M25: 66.37 | N25: 25.44 | O25: 53.27 | P25: =IF(AND(ISNUMBER(RC[-3]),ISNUMBER(RC[-1])),RC[-3]-RC[-1],"-") -> 13.100000000000001 | Q25: 5.74 | R25: 0.69 | S25: 2.7010000000000001 | T25: =(RC[-16]*RC[-15]-RC[-13]*RC[-12])/1000 -> 2.6999497000000003 | U25: 30.57 | V25: 25.13 | W25: =RC[-2]*RC[-10]/1000 -> 2.0289309000000002 | X25: =ABS((RC[-3]*RC[-11]-RC[-2]*RC[-9])/1000) -> 0.69025580000000009 | Y25: =(RC[-14]-RC[1])/RC[-18]*100 -> 0 | Z25: 5.44 | AC25: =VALUE(RC[-27]) -> 2018-10-04T00:00:00.000 | AD25: =IF(RC[21]=42,"*",IF(RC[21]=32,"",RC[21])) -> - | AE25: =RC[-28] -> 24 | AF25: =RC[-28] -> 104.49 | AG25: =RC[-28] -> 66.430000000000007 | AH25: =RC[-28] -> 8.02 | AI25: =RC[-28] -> 99.05 | AJ25: =RC[-28] -> 42.82 | AK25: =RC[-28] -> 5.43 | AL25: =RC[-28] -> 23.610000000000007 | AM25: =RC[-28] -> 5.44 | AN25: =RC[-28] -> 31.18 | AO25: =RC[-28] -> 66.37 | AP25: - | AQ25: =RC[-29] -> 25.44 | AR25: =RC[-29] -> 53.27 | AS25: - | AT25: =RC[-30] -> 13.100000000000001 | AU25: =RC[-30] -> 5.74 | AV25: =RC[-30] -> 0.69 | AW25: =RC[-30] -> 2.7010000000000001 | AY25: - | AZ25: - | BA25: -
A26: =IF(RC[1]="","",DATEVALUE(RC[1])) -> 43378 | B26: 05.10.18 | C26: 24 | D26: 95.36 | E26: 65.69 | F26: 7.71 | G26: 90 | H26: 40.82 | I26: 5.43 | J26: =RC[-5]-RC[-2] -> 24.869999999999997 | K26: 5.36 | L26: 28.78 | M26: 65.62 | N26: 23.12 | O26: 51.69 | P26: =IF(AND(ISNUMBER(RC[-3]),ISNUMBER(RC[-1])),RC[-3]-RC[-1],"-") -> 13.930000000000007 | Q26: 5.66 | R26: 0.67100000000000004 | S26: 2.5950000000000002 | T26: =(RC[-16]*RC[-15]-RC[-13]*RC[-12])/1000 -> 2.5903983999999993 | U26: 28.25 | V26: 22.88 | W26: =RC[-2]*RC[-10]/1000 -> 1.8537650000000001 | X26: =ABS((RC[-3]*RC[-11]-RC[-2]*RC[-9])/1000) -> 0.67109780000000019 | Y26: =(RC[-14]-RC[1])/RC[-18]*100 -> -1.1111111111110874E-2 | Z26: 5.37 | AC26: =VALUE(RC[-27]) -> 2018-10-05T00:00:00.000 | AD26: =IF(RC[21]=42,"*",IF(RC[21]=32,"",RC[21])) -> - | AE26: =RC[-28] -> 24 | AF26: =RC[-28] -> 95.36 | AG26: =RC[-28] -> 65.69 | AH26: =RC[-28] -> 7.71 | AI26: =RC[-28] -> 90 | AJ26: =RC[-28] -> 40.82 | AK26: =RC[-28] -> 5.43 | AL26: =RC[-28] -> 24.869999999999997 | AM26: =RC[-28] -> 5.36 | AN26: =RC[-28] -> 28.78 | AO26: =RC[-28] -> 65.62 | AP26: - | AQ26: =RC[-29] -> 23.12 | AR26: =RC[-29] -> 51.69 | AS26: - | AT26: =RC[-30] -> 13.930000000000007 | AU26: =RC[-30] -> 5.66 | AV26: =RC[-30] -> 0.67100000000000004 | AW26: =RC[-30] -> 2.5950000000000002 | AY26: - | AZ26: - | BA26: -
A27: =IF(RC[1]="","",DATEVALUE(RC[1])) -> 43379 | B27: 06.10.18 | C27: 24 | D27: 95.79 | E27: 66.349999999999994 | F27: 7.67 | G27: 90.94 | H27: 41.21 | I27: 5.43 | J27: =RC[-5]-RC[-2] -> 25.139999999999993 | K27: 4.8499999999999996 | L27: 28.5 | M27: 66.290000000000006 | N27: 23.39 | O27: 52.02 | P27: =IF(AND(ISNUMBER(RC[-3]),ISNUMBER(RC[-1])),RC[-3]-RC[-1],"-") -> 14.270000000000003 | Q27: 5.1100000000000003 | R27: 0.64700000000000002 | S27: 2.6080000000000001 | T27: =(RC[-16]*RC[-15]-RC[-13]*RC[-12])/1000 -> 2.6080291 | U27: 27.92 | V27: 23.15 | W27: =RC[-2]*RC[-10]/1000 -> 1.8508168000000003 | X27: =ABS((RC[-3]*RC[-11]-RC[-2]*RC[-9])/1000) -> 0.6465538000000004 | Y27: =(RC[-14]-RC[1])/RC[-18]*100 -> 8.7970090169342513E-2 | Z27: 4.7699999999999996 | AC27: =VALUE(RC[-27]) -> 2018-10-06T00:00:00.000 | AD27: =IF(RC[21]=42,"*",IF(RC[21]=32,"",RC[21])) -> - | AE27: =RC[-28] -> 24 | AF27: =RC[-28] -> 95.79 | AG27: =RC[-28] -> 66.349999999999994 | AH27: =RC[-28] -> 7.67 | AI27: =RC[-28] -> 90.94 | AJ27: =RC[-28] -> 41.21 | AK27: =RC[-28] -> 5.43 | AL27: =RC[-28] -> 25.139999999999993 | AM27: =RC[-28] -> 4.8499999999999996 | AN27: =RC[-28] -> 28.5 | AO27: =RC[-28] -> 66.290000000000006 | AP27: - | AQ27: =RC[-29] -> 23.39 | AR27: =RC[-29] -> 52.02 | AS27: - | AT27: =RC[-30] -> 14.270000000000003 | AU27: =RC[-30] -> 5.1100000000000003 | AV27: =RC[-30] -> 0.64700000000000002 | AW27: =RC[-30] -> 2.6080000000000001 | AY27: - | AZ27: - | BA27: -
A28: =IF(RC[1]="","",DATEVALUE(RC[1])) -> 43380 | B28: 07.10.18 | C28: 24 | D28: 96.49 | E28: 66.599999999999994 | F28: 7.68 | G28: 90.58 | H28: 41.25 | I28: 5.43 | J28: =RC[-5]-RC[-2] -> 25.349999999999994 | K28: 5.91 | L28: 29.4 | M28: 66.540000000000006 | N28: 23.35 | O28: 52.5 | P28: =IF(AND(ISNUMBER(RC[-3]),ISNUMBER(RC[-1])),RC[-3]-RC[-1],"-") -> 14.040000000000006 | Q28: 6.05 | R28: 0.70799999999999996 | S28: 2.6909999999999998 | T28: =(RC[-16]*RC[-15]-RC[-13]*RC[-12])/1000 -> 2.6898089999999999 | U28: 28.83 | V28: 23.11 | W28: =RC[-2]*RC[-10]/1000 -> 1.9183482000000001 | X28: =ABS((RC[-3]*RC[-11]-RC[-2]*RC[-9])/1000) -> 0.70507320000000029 | Y28: =(RC[-14]-RC[1])/RC[-18]*100 -> 0.20975932877014838 | Z28: 5.72 | AC28: =VALUE(RC[-27]) -> 2018-10-07T00:00:00.000 | AD28: =IF(RC[21]=42,"*",IF(RC[21]=32,"",RC[21])) -> - | AE28: =RC[-28] -> 24 | AF28: =RC[-28] -> 96.49 | AG28: =RC[-28] -> 66.599999999999994 | AH28: =RC[-28] -> 7.68 | AI28: =RC[-28] -> 90.58 | AJ28: =RC[-28] -> 41.25 | AK28: =RC[-28] -> 5.43 | AL28: =RC[-28] -> 25.349999999999994 | AM28: =RC[-28] -> 5.91 | AN28: =RC[-28] -> 29.4 | AO28: =RC[-28] -> 66.540000000000006 | AP28: - | AQ28: =RC[-29] -> 23.35 | AR28: =RC[-29] -> 52.5 | AS28: - | AT28: =RC[-30] -> 14.040000000000006 | AU28: =RC[-30] -> 6.05 | AV28: =RC[-30] -> 0.70799999999999996 | AW28: =RC[-30] -> 2.6909999999999998 | AY28: - | AZ28: - | BA28: -
A29: =IF(RC[1]="","",DATEVALUE(RC[1])) -> 43381 | B29: 08.10.18 | C29: 24 | D29: 94.89 | E29: 66.569999999999993 | F29: 7.63 | G29: 89.27 | H29: 40.630000000000003 | I29: 5.43 | J29: =RC[-5]-RC[-2] -> 25.939999999999991 | K29: 5.62 | L29: 28.75 | M29: 66.48 | N29: 23.04 | O29: 51.91 | P29: =IF(AND(ISNUMBER(RC[-3]),ISNUMBER(RC[-1])),RC[-3]-RC[-1],"-") -> 14.570000000000007 | Q29: 5.71 | R29: 0.68799999999999994 | S29: 2.69 | T29: =(RC[-16]*RC[-15]-RC[-13]*RC[-12])/1000 -> 2.6897871999999987 | U29: 28.18 | V29: 22.8 | W29: =RC[-2]*RC[-10]/1000 -> 1.8734064000000001 | X29: =ABS((RC[-3]*RC[-11]-RC[-2]*RC[-9])/1000) -> 0.68985840000000009 | Y29: =(RC[-14]-RC[1])/RC[-18]*100 -> 0.26884731712781473 | Z29: 5.38 | AC29: =VALUE(RC[-27]) -> 2018-10-08T00:00:00.000 | AD29: =IF(RC[21]=42,"*",IF(RC[21]=32,"",RC[21])) -> - | AE29: =RC[-28] -> 24 | AF29: =RC[-28] -> 94.89 | AG29: =RC[-28] -> 66.569999999999993 | AH29: =RC[-28] -> 7.63 | AI29: =RC[-28] -> 89.27 | AJ29: =RC[-28] -> 40.630000000000003 | AK29: =RC[-28] -> 5.43 | AL29: =RC[-28] -> 25.939999999999991 | AM29: =RC[-28] -> 5.62 | AN29: =RC[-28] -> 28.75 | AO29: =RC[-28] -> 66.48 | AP29: - | AQ29: =RC[-29] -> 23.04 | AR29: =RC[-29] -> 51.91 | AS29: - | AT29: =RC[-30] -> 14.570000000000007 | AU29: =RC[-30] -> 5.71 | AV29: =RC[-30] -> 0.68799999999999994 | AW29: =RC[-30] -> 2.69 | AY29: - | AZ29: - | BA29: -
A30: =IF(RC[1]="","",DATEVALUE(RC[1])) -> 43382 | B30: 09.10.18 | C30: 24 | D30: 98.21 | E30: 66.45 | F30: 7.8 | G30: 92.62 | H30: 41.05 | I30: 5.43 | J30: =RC[-5]-RC[-2] -> 25.400000000000006 | K30: 5.59 | L30: 29.65 | M30: 66.38 | N30: 23.94 | O30: 52.23 | P30: =IF(AND(ISNUMBER(RC[-3]),ISNUMBER(RC[-1])),RC[-3]-RC[-1],"-") -> 14.149999999999999 | Q30: 5.71 | R30: 0.69299999999999995 | S30: 2.7250000000000001 | T30: =(RC[-16]*RC[-15]-RC[-13]*RC[-12])/1000 -> 2.7240035000000002 | U30: 29.09 | V30: 23.7 | W30: =RC[-2]*RC[-10]/1000 -> 1.9309941999999998 | X30: =ABS((RC[-3]*RC[-11]-RC[-2]*RC[-9])/1000) -> 0.69314319999999996 | Y30: =(RC[-14]-RC[1])/RC[-18]*100 -> 0.21593608291945601 | Z30: 5.39 | AC30: =VALUE(RC[-27]) -> 2018-10-09T00:00:00.000 | AD30: =IF(RC[21]=42,"*",IF(RC[21]=32,"",RC[21])) -> - | AE30: =RC[-28] -> 24 | AF30: =RC[-28] -> 98.21 | AG30: =RC[-28] -> 66.45 | AH30: =RC[-28] -> 7.8 | AI30: =RC[-28] -> 92.62 | AJ30: =RC[-28] -> 41.05 | AK30: =RC[-28] -> 5.43 | AL30: =RC[-28] -> 25.400000000000006 | AM30: =RC[-28] -> 5.59 | AN30: =RC[-28] -> 29.65 | AO30: =RC[-28] -> 66.38 | AP30: - | AQ30: =RC[-29] -> 23.94 | AR30: =RC[-29] -> 52.23 | AS30: - | AT30: =RC[-30] -> 14.149999999999999 | AU30: =RC[-30] -> 5.71 | AV30: =RC[-30] -> 0.69299999999999995 | AW30: =RC[-30] -> 2.7250000000000001 | AY30: - | AZ30: - | BA30: -
A31: =IF(RC[1]="","",DATEVALUE(RC[1])) -> 43383 | B31: 10.10.18 | C31: 24 | D31: 97.81 | E31: 67.47 | F31: 7.71 | G31: 92.53 | H31: 41.74 | I31: 5.43 | J31: =RC[-5]-RC[-2] -> 25.729999999999997 | K31: 5.28 | L31: 29.43 | M31: 67.42 | N31: 24.07 | O31: 53.07 | P31: =IF(AND(ISNUMBER(RC[-3]),ISNUMBER(RC[-1])),RC[-3]-RC[-1],"-") -> 14.350000000000001 | Q31: 5.36 | R31: 0.67900000000000005 | S31: 2.7370000000000001 | T31: =(RC[-16]*RC[-15]-RC[-13]*RC[-12])/1000 -> 2.7370385000000002 | U31: 28.84 | V31: 23.82 | W31: =RC[-2]*RC[-10]/1000 -> 1.9443928000000001 | X31: =ABS((RC[-3]*RC[-11]-RC[-2]*RC[-9])/1000) -> 0.68026540000000002 | Y31: =(RC[-14]-RC[1])/RC[-18]*100 -> 0.28098994920566372 | Z31: 5.0199999999999996 | AC31: =VALUE(RC[-27]) -> 2018-10-10T00:00:00.000 | AD31: =IF(RC[21]=42,"*",IF(RC[21]=32,"",RC[21])) -> - | AE31: =RC[-28] -> 24 | AF31: =RC[-28] -> 97.81 | AG31: =RC[-28] -> 67.47 | AH31: =RC[-28] -> 7.71 | AI31: =RC[-28] -> 92.53 | AJ31: =RC[-28] -> 41.74 | AK31: =RC[-28] -> 5.43 | AL31: =RC[-28] -> 25.729999999999997 | AM31: =RC[-28] -> 5.28 | AN31: =RC[-28] -> 29.43 | AO31: =RC[-28] -> 67.42 | AP31: - | AQ31: =RC[-29] -> 24.07 | AR31: =RC[-29] -> 53.07 | AS31: - | AT31: =RC[-30] -> 14.350000000000001 | AU31: =RC[-30] -> 5.36 | AV31: =RC[-30] -> 0.67900000000000005 | AW31: =RC[-30] -> 2.7370000000000001 | AY31: - | AZ31: - | BA31: -
A32: =IF(RC[1]="","",DATEVALUE(RC[1])) -> 43384 | B32: 11.10.18 | C32: 24 | D32: 100.13 | E32: 68.569999999999993 | F32: 7.76 | G32: 95.11 | H32: 42.61 | I32: 5.43 | J32: =RC[-5]-RC[-2] -> 25.959999999999994 | K32: 5.0199999999999996 | L32: 29.84 | M32: 68.47 | N32: 24.85 | O32: 54.03 | P32: =IF(AND(ISNUMBER(RC[-3]),ISNUMBER(RC[-1])),RC[-3]-RC[-1],"-") -> 14.439999999999998 | Q32: 4.99 | R32: 0.66700000000000004 | S32: 2.8140000000000001 | T32: =(RC[-16]*RC[-15]-RC[-13]*RC[-12])/1000 -> 2.8132769999999989 | U32: 29.19 | V32: 24.6 | W32: =RC[-2]*RC[-10]/1000 -> 1.9986393 | X32: =ABS((RC[-3]*RC[-11]-RC[-2]*RC[-9])/1000) -> 0.66950129999999985 | Y32: =(RC[-14]-RC[1])/RC[-18]*100 -> 0.45210808537482883 | Z32: 4.59 | AC32: =VALUE(RC[-27]) -> 2018-10-11T00:00:00.000 | AD32: =IF(RC[21]=42,"*",IF(RC[21]=32,"",RC[21])) -> - | AE32: =RC[-28] -> 24 | AF32: =RC[-28] -> 100.13 | AG32: =RC[-28] -> 68.569999999999993 | AH32: =RC[-28] -> 7.76 | AI32: =RC[-28] -> 95.11 | AJ32: =RC[-28] -> 42.61 | AK32: =RC[-28] -> 5.43 | AL32: =RC[-28] -> 25.959999999999994 | AM32: =RC[-28] -> 5.0199999999999996 | AN32: =RC[-28] -> 29.84 | AO32: =RC[-28] -> 68.47 | AP32: - | AQ32: =RC[-29] -> 24.85 | AR32: =RC[-29] -> 54.03 | AS32: - | AT32: =RC[-30] -> 14.439999999999998 | AU32: =RC[-30] -> 4.99 | AV32: =RC[-30] -> 0.66700000000000004 | AW32: =RC[-30] -> 2.8140000000000001 | AY32: - | AZ32: - | BA32: -
A33: =IF(RC[1]="","",DATEVALUE(RC[1])) -> 43385 | B33: 12.10.18 | C33: 24 | D33: 98.52 | E33: 68.41 | F33: 7.74 | G33: 93.4 | H33: 42.19 | I33: 5.43 | J33: =RC[-5]-RC[-2] -> 26.22 | K33: 5.12 | L33: 29.35 | M33: 68.31 | N33: 24.58 | O33: 53.83 | P33: =IF(AND(ISNUMBER(RC[-3]),ISNUMBER(RC[-1])),RC[-3]-RC[-1],"-") -> 14.480000000000004 | Q33: 4.7699999999999996 | R33: 0.65300000000000002 | S33: 2.7989999999999999 | T33: =(RC[-16]*RC[-15]-RC[-13]*RC[-12])/1000 -> 2.7992071999999992 | U33: 28.71 | V33: 24.32 | W33: =RC[-2]*RC[-10]/1000 -> 1.9611801 | X33: =ABS((RC[-3]*RC[-11]-RC[-2]*RC[-9])/1000) -> 0.65203449999999996 | Y33: =(RC[-14]-RC[1])/RC[-18]*100 -> 0.78158458244111384 | Z33: 4.3899999999999997 | AC33: =VALUE(RC[-27]) -> 2018-10-12T00:00:00.000 | AD33: =IF(RC[21]=42,"*",IF(RC[21]=32,"",RC[21])) -> - | AE33: =RC[-28] -> 24 | AF33: =RC[-28] -> 98.52 | AG33: =RC[-28] -> 68.41 | AH33: =RC[-28] -> 7.74 | AI33: =RC[-28] -> 93.4 | AJ33: =RC[-28] -> 42.19 | AK33: =RC[-28] -> 5.43 | AL33: =RC[-28] -> 26.22 | AM33: =RC[-28] -> 5.12 | AN33: =RC[-28] -> 29.35 | AO33: =RC[-28] -> 68.31 | AP33: - | AQ33: =RC[-29] -> 24.58 | AR33: =RC[-29] -> 53.83 | AS33: - | AT33: =RC[-30] -> 14.480000000000004 | AU33: =RC[-30] -> 4.7699999999999996 | AV33: =RC[-30] -> 0.65300000000000002 | AW33: =RC[-30] -> 2.7989999999999999 | AY33: - | AZ33: - | BA33: -
A34: =IF(RC[1]="","",DATEVALUE(RC[1])) -> 43386 | B34: 13.10.18 | C34: 24 | D34: 102.61 | E34: 69.56 | F34: 7.94 | G34: 97.86 | H34: 43.49 | I34: 5.43 | J34: =RC[-5]-RC[-2] -> 26.07 | K34: 4.75 | L34: 30.27 | M34: 69.48 | N34: 25.78 | O34: 55.03 | P34: =IF(AND(ISNUMBER(RC[-3]),ISNUMBER(RC[-1])),RC[-3]-RC[-1],"-") -> 14.450000000000003 | Q34: 4.49 | R34: 0.65800000000000003 | S34: 2.883 | T34: =(RC[-16]*RC[-15]-RC[-13]*RC[-12])/1000 -> 2.8816201999999995 | U34: 29.6 | V34: 25.39 | W34: =RC[-2]*RC[-10]/1000 -> 2.0566080000000002 | X34: =ABS((RC[-3]*RC[-11]-RC[-2]*RC[-9])/1000) -> 0.65939630000000016 | Y34: =(RC[-14]-RC[1])/RC[-18]*100 -> 0.55180870631514412 | Z34: 4.21 | AC34: =VALUE(RC[-27]) -> 2018-10-13T00:00:00.000 | AD34: =IF(RC[21]=42,"*",IF(RC[21]=32,"",RC[21])) -> - | AE34: =RC[-28] -> 24 | AF34: =RC[-28] -> 102.61 | AG34: =RC[-28] -> 69.56 | AH34: =RC[-28] -> 7.94 | AI34: =RC[-28] -> 97.86 | AJ34: =RC[-28] -> 43.49 | AK34: =RC[-28] -> 5.43 | AL34: =RC[-28] -> 26.07 | AM34: =RC[-28] -> 4.75 | AN34: =RC[-28] -> 30.27 | AO34: =RC[-28] -> 69.48 | AP34: - | AQ34: =RC[-29] -> 25.78 | AR34: =RC[-29] -> 55.03 | AS34: - | AT34: =RC[-30] -> 14.450000000000003 | AU34: =RC[-30] -> 4.49 | AV34: =RC[-30] -> 0.65800000000000003 | AW34: =RC[-30] -> 2.883 | AY34: - | AZ34: - | BA34: -
A35: =IF(RC[1]="","",DATEVALUE(RC[1])) -> 43387 | B35: 14.10.18 | C35: 24 | D35: 103.77 | E35: 70.33 | F35: 7.92 | G35: 99.01 | H35: 44.32 | I35: 4.88 | J35: =RC[-5]-RC[-2] -> 26.009999999999998 | K35: 4.76 | L35: 30.63 | M35: 70.27 | N35: 26.15 | O35: 55.76 | P35: =IF(AND(ISNUMBER(RC[-3]),ISNUMBER(RC[-1])),RC[-3]-RC[-1],"-") -> 14.509999999999998 | Q35: 4.4800000000000004 | R35: 0.67400000000000004 | S35: 2.915 | T35: =(RC[-16]*RC[-15]-RC[-13]*RC[-12])/1000 -> 2.9100208999999997 | U35: 29.97 | V35: 25.69 | W35: =RC[-2]*RC[-10]/1000 -> 2.1059918999999998 | X35: =ABS((RC[-3]*RC[-11]-RC[-2]*RC[-9])/1000) -> 0.67351749999999988 | Y35: =(RC[-14]-RC[1])/RC[-18]*100 -> 0.48479951520048425 | Z35: 4.28 | AC35: =VALUE(RC[-27]) -> 2018-10-14T00:00:00.000 | AD35: =IF(RC[21]=42,"*",IF(RC[21]=32,"",RC[21])) -> - | AE35: =RC[-28] -> 24 | AF35: =RC[-28] -> 103.77 | AG35: =RC[-28] -> 70.33 | AH35: =RC[-28] -> 7.92 | AI35: =RC[-28] -> 99.01 | AJ35: =RC[-28] -> 44.32 | AK35: =RC[-28] -> 4.88 | AL35: =RC[-28] -> 26.009999999999998 | AM35: =RC[-28] -> 4.76 | AN35: =RC[-28] -> 30.63 | AO35: =RC[-28] -> 70.27 | AP35: - | AQ35: =RC[-29] -> 26.15 | AR35: =RC[-29] -> 55.76 | AS35: - | AT35: =RC[-30] -> 14.509999999999998 | AU35: =RC[-30] -> 4.4800000000000004 | AV35: =RC[-30] -> 0.67400000000000004 | AW35: =RC[-30] -> 2.915 | AY35: - | AZ35: - | BA35: -
A36: =IF(RC[1]="","",DATEVALUE(RC[1])) -> 43388 | B36: 15.10.18 | C36: 24 | D36: 106.49 | E36: 69.790000000000006 | F36: 8.02 | G36: 101.36 | H36: 44.66 | I36: 4.6900000000000004 | J36: =RC[-5]-RC[-2] -> 25.13000000000001 | K36: 5.13 | L36: 31.72 | M36: 69.72 | N36: 26.83 | O36: 55.86 | P36: =IF(AND(ISNUMBER(RC[-3]),ISNUMBER(RC[-1])),RC[-3]-RC[-1],"-") -> 13.86 | Q36: 4.8899999999999997 | R36: 0.69299999999999995 | S36: 2.91 | T36: =(RC[-16]*RC[-15]-RC[-13]*RC[-12])/1000 -> 2.9051995000000006 | U36: 31.04 | V36: 26.34 | W36: =RC[-2]*RC[-10]/1000 -> 2.1641088000000002 | X36: =ABS((RC[-3]*RC[-11]-RC[-2]*RC[-9])/1000) -> 0.69275639999999994 | Y36: =(RC[-14]-RC[1])/RC[-18]*100 -> 0.42423046566692951 | Z36: 4.7 | AC36: =VALUE(RC[-27]) -> 2018-10-15T00:00:00.000 | AD36: =IF(RC[21]=42,"*",IF(RC[21]=32,"",RC[21])) -> - | AE36: =RC[-28] -> 24 | AF36: =RC[-28] -> 106.49 | AG36: =RC[-28] -> 69.790000000000006 | AH36: =RC[-28] -> 8.02 | AI36: =RC[-28] -> 101.36 | AJ36: =RC[-28] -> 44.66 | AK36: =RC[-28] -> 4.6900000000000004 | AL36: =RC[-28] -> 25.13000000000001 | AM36: =RC[-28] -> 5.13 | AN36: =RC[-28] -> 31.72 | AO36: =RC[-28] -> 69.72 | AP36: - | AQ36: =RC[-29] -> 26.83 | AR36: =RC[-29] -> 55.86 | AS36: - | AT36: =RC[-30] -> 13.86 | AU36: =RC[-30] -> 4.8899999999999997 | AV36: =RC[-30] -> 0.69299999999999995 | AW36: =RC[-30] -> 2.91 | AY36: - | AZ36: - | BA36: -
A37: =IF(RC[1]="","",DATEVALUE(RC[1])) -> 43389 | B37: 16.10.18 | C37: 24 | D37: 107.63 | E37: 69.78 | F37: 7.99 | G37: 102.14 | H37: 44.86 | I37: 4.33 | J37: =RC[-5]-RC[-2] -> 24.92 | K37: 5.49 | L37: 32.26 | M37: 69.72 | N37: 26.99 | O37: 56.06 | P37: =IF(AND(ISNUMBER(RC[-3]),ISNUMBER(RC[-1])),RC[-3]-RC[-1],"-") -> 13.659999999999997 | Q37: 5.27 | R37: 0.71399999999999997 | S37: 2.9350000000000001 | T37: =(RC[-16]*RC[-15]-RC[-13]*RC[-12])/1000 -> 2.9284210000000002 | U37: 31.57 | V37: 26.51 | W37: =RC[-2]*RC[-10]/1000 -> 2.2010603999999998 | X37: =ABS((RC[-3]*RC[-11]-RC[-2]*RC[-9])/1000) -> 0.71490979999999971 | Y37: =(RC[-14]-RC[1])/RC[-18]*100 -> 0.42099079694536967 | Z37: 5.0599999999999996 | AC37: =VALUE(RC[-27]) -> 2018-10-16T00:00:00.000 | AD37: =IF(RC[21]=42,"*",IF(RC[21]=32,"",RC[21])) -> - | AE37: =RC[-28] -> 24 | AF37: =RC[-28] -> 107.63 | AG37: =RC[-28] -> 69.78 | AH37: =RC[-28] -> 7.99 | AI37: =RC[-28] -> 102.14 | AJ37: =RC[-28] -> 44.86 | AK37: =RC[-28] -> 4.33 | AL37: =RC[-28] -> 24.92 | AM37: =RC[-28] -> 5.49 | AN37: =RC[-28] -> 32.26 | AO37: =RC[-28] -> 69.72 | AP37: - | AQ37: =RC[-29] -> 26.99 | AR37: =RC[-29] -> 56.06 | AS37: - | AT37: =RC[-30] -> 13.659999999999997 | AU37: =RC[-30] -> 5.27 | AV37: =RC[-30] -> 0.71399999999999997 | AW37: =RC[-30] -> 2.9350000000000001 | AY37: - | AZ37: - | BA37: -
A38: =IF(RC[1]="","",DATEVALUE(RC[1])) -> 43390 | B38: 17.10.18 | C38: 24 | D38: 109.77 | E38: 70.010000000000005 | F38: 8.08 | G38: 104.46 | H38: 45.41 | I38: 3.96 | J38: =RC[-5]-RC[-2] -> 24.600000000000009 | K38: 5.31 | L38: 32.67 | M38: 69.95 | N38: 27.52 | O38: 56.4 | P38: =IF(AND(ISNUMBER(RC[-3]),ISNUMBER(RC[-1])),RC[-3]-RC[-1],"-") -> 13.550000000000004 | Q38: 5.15 | R38: 0.71 | S38: 2.9470000000000001 | T38: =(RC[-16]*RC[-15]-RC[-13]*RC[-12])/1000 -> 2.9414691000000004 | U38: 31.94 | V38: 27.02 | W38: =RC[-2]*RC[-10]/1000 -> 2.2342029999999999 | X38: =ABS((RC[-3]*RC[-11]-RC[-2]*RC[-9])/1000) -> 0.7102750000000001 | Y38: =(RC[-14]-RC[1])/RC[-18]*100 -> 0.37334865020103358 | Z38: 4.92 | AC38: =VALUE(RC[-27]) -> 2018-10-17T00:00:00.000 | AD38: =IF(RC[21]=42,"*",IF(RC[21]=32,"",RC[21])) -> - | AE38: =RC[-28] -> 24 | AF38: =RC[-28] -> 109.77 | AG38: =RC[-28] -> 70.010000000000005 | AH38: =RC[-28] -> 8.08 | AI38: =RC[-28] -> 104.46 | AJ38: =RC[-28] -> 45.41 | AK38: =RC[-28] -> 3.96 | AL38: =RC[-28] -> 24.600000000000009 | AM38: =RC[-28] -> 5.31 | AN38: =RC[-28] -> 32.67 | AO38: =RC[-28] -> 69.95 | AP38: - | AQ38: =RC[-29] -> 27.52 | AR38: =RC[-29] -> 56.4 | AS38: - | AT38: =RC[-30] -> 13.550000000000004 | AU38: =RC[-30] -> 5.15 | AV38: =RC[-30] -> 0.71 | AW38: =RC[-30] -> 2.9470000000000001 | AY38: - | AZ38: - | BA38: -
A39: =IF(RC[1]="","",DATEVALUE(RC[1])) -> 43391 | B39: 18.10.18 | C39: 24 | D39: 108.98 | E39: 70.5 | F39: 8.1 | G39: 104.22 | H39: 45.63 | I39: 1.77 | J39: =RC[-5]-RC[-2] -> 24.869999999999997 | K39: 4.76 | L39: 31.98 | M39: 70.44 | N39: 27.5 | O39: 56.59 | P39: =IF(AND(ISNUMBER(RC[-3]),ISNUMBER(RC[-1])),RC[-3]-RC[-1],"-") -> 13.849999999999994 | Q39: 4.4800000000000004 | R39: 0.67500000000000004 | S39: 2.9380000000000002 | T39: =(RC[-16]*RC[-15]-RC[-13]*RC[-12])/1000 -> 2.9275313999999999 | U39: 31.27 | V39: 26.99 | W39: =RC[-2]*RC[-10]/1000 -> 2.2026587999999996 | X39: =ABS((RC[-3]*RC[-11]-RC[-2]*RC[-9])/1000) -> 0.67529469999999969 | Y39: =(RC[-14]-RC[1])/RC[-18]*100 -> 0.46056419113413893 | Z39: 4.28 | AC39: =VALUE(RC[-27]) -> 2018-10-18T00:00:00.000 | AD39: =IF(RC[21]=42,"*",IF(RC[21]=32,"",RC[21])) -> - | AE39: =RC[-28] -> 24 | AF39: =RC[-28] -> 108.98 | AG39: =RC[-28] -> 70.5 | AH39: =RC[-28] -> 8.1 | AI39: =RC[-28] -> 104.22 | AJ39: =RC[-28] -> 45.63 | AK39: =RC[-28] -> 1.77 | AL39: =RC[-28] -> 24.869999999999997 | AM39: =RC[-28] -> 4.76 | AN39: =RC[-28] -> 31.98 | AO39: =RC[-28] -> 70.44 | AP39: - | AQ39: =RC[-29] -> 27.5 | AR39: =RC[-29] -> 56.59 | AS39: - | AT39: =RC[-30] -> 13.849999999999994 | AU39: =RC[-30] -> 4.4800000000000004 | AV39: =RC[-30] -> 0.67500000000000004 | AW39: =RC[-30] -> 2.9380000000000002 | AY39: - | AZ39: - | BA39: -
A40: =IF(RC[1]="","",DATEVALUE(RC[1])) -> 43392 | B40: 19.10.18 | C40: 24 | D40: 109.35 | E40: 70.319999999999993 | F40: 8.11 | G40: 104.25 | H40: 45.53 | I40: 3.05 | J40: =RC[-5]-RC[-2] -> 24.789999999999992 | K40: 5.0999999999999996 | L40: 32.42 | M40: 70.260000000000005 | N40: 27.5 | O40: 56.54 | P40: =IF(AND(ISNUMBER(RC[-3]),ISNUMBER(RC[-1])),RC[-3]-RC[-1],"-") -> 13.720000000000006 | Q40: 4.92 | R40: 0.70399999999999996 | S40: 2.9510000000000001 | T40: =(RC[-16]*RC[-15]-RC[-13]*RC[-12])/1000 -> 2.9429894999999986 | U40: 31.72 | V40: 27.01 | W40: =RC[-2]*RC[-10]/1000 -> 2.2286471999999997 | X40: =ABS((RC[-3]*RC[-11]-RC[-2]*RC[-9])/1000) -> 0.70150179999999973 | Y40: =(RC[-14]-RC[1])/RC[-18]*100 -> 0.3741007194244601 | Z40: 4.71 | AC40: =VALUE(RC[-27]) -> 2018-10-19T00:00:00.000 | AD40: =IF(RC[21]=42,"*",IF(RC[21]=32,"",RC[21])) -> - | AE40: =RC[-28] -> 24 | AF40: =RC[-28] -> 109.35 | AG40: =RC[-28] -> 70.319999999999993 | AH40: =RC[-28] -> 8.11 | AI40: =RC[-28] -> 104.25 | AJ40: =RC[-28] -> 45.53 | AK40: =RC[-28] -> 3.05 | AL40: =RC[-28] -> 24.789999999999992 | AM40: =RC[-28] -> 5.0999999999999996 | AN40: =RC[-28] -> 32.42 | AO40: =RC[-28] -> 70.260000000000005 | AP40: - | AQ40: =RC[-29] -> 27.5 | AR40: =RC[-29] -> 56.54 | AS40: - | AT40: =RC[-30] -> 13.720000000000006 | AU40: =RC[-30] -> 4.92 | AV40: =RC[-30] -> 0.70399999999999996 | AW40: =RC[-30] -> 2.9510000000000001 | AY40: - | AZ40: - | BA40: -
A41: =IF(RC[1]="","",DATEVALUE(RC[1])) -> 43393 | B41: 20.10.18 | C41: 24 | D41: 103.53 | E41: 69.59 | F41: 7.94 | G41: 99.67 | H41: 44.44 | I41: 5.24 | J41: =RC[-5]-RC[-2] -> 25.150000000000006 | K41: 3.86 | L41: 29.88 | M41: 69.510000000000005 | N41: 26.31 | O41: 55.28 | P41: =IF(AND(ISNUMBER(RC[-3]),ISNUMBER(RC[-1])),RC[-3]-RC[-1],"-") -> 14.230000000000004 | Q41: 3.57 | R41: 0.60099999999999998 | S41: 2.7759999999999998 | T41: =(RC[-16]*RC[-15]-RC[-13]*RC[-12])/1000 -> 2.775317900000001 | U41: 29.23 | V41: 25.89 | W41: =RC[-2]*RC[-10]/1000 -> 2.0317773000000003 | X41: =ABS((RC[-3]*RC[-11]-RC[-2]*RC[-9])/1000) -> 0.60057810000000023 | Y41: =(RC[-14]-RC[1])/RC[-18]*100 -> 0.52172168154911214 | Z41: 3.34 | AC41: =VALUE(RC[-27]) -> 2018-10-20T00:00:00.000 | AD41: =IF(RC[21]=42,"*",IF(RC[21]=32,"",RC[21])) -> - | AE41: =RC[-28] -> 24 | AF41: =RC[-28] -> 103.53 | AG41: =RC[-28] -> 69.59 | AH41: =RC[-28] -> 7.94 | AI41: =RC[-28] -> 99.67 | AJ41: =RC[-28] -> 44.44 | AK41: =RC[-28] -> 5.24 | AL41: =RC[-28] -> 25.150000000000006 | AM41: =RC[-28] -> 3.86 | AN41: =RC[-28] -> 29.88 | AO41: =RC[-28] -> 69.510000000000005 | AP41: - | AQ41: =RC[-29] -> 26.31 | AR41: =RC[-29] -> 55.28 | AS41: - | AT41: =RC[-30] -> 14.230000000000004 | AU41: =RC[-30] -> 3.57 | AV41: =RC[-30] -> 0.60099999999999998 | AW41: =RC[-30] -> 2.7759999999999998 | AY41: - | AZ41: - | BA41: -
A42: =IF(RC[1]="","",DATEVALUE(RC[1])) -> 43394 | B42: 21.10.18 | C42: 24 | D42: 105.22 | E42: 68.75 | F42: 7.95 | G42: 99.29 | H42: 44.09 | I42: 5.43 | J42: =RC[-5]-RC[-2] -> 24.659999999999997 | K42: 5.93 | L42: 31.92 | M42: 68.680000000000007 | N42: 26.18 | O42: 55.03 | P42: =IF(AND(ISNUMBER(RC[-3]),ISNUMBER(RC[-1])),RC[-3]-RC[-1],"-") -> 13.650000000000006 | Q42: 5.74 | R42: 0.72799999999999998 | S42: 2.859 | T42: =(RC[-16]*RC[-15]-RC[-13]*RC[-12])/1000 -> 2.8561788999999989 | U42: 31.23 | V42: 25.78 | W42: =RC[-2]*RC[-10]/1000 -> 2.1448764000000002 | X42: =ABS((RC[-3]*RC[-11]-RC[-2]*RC[-9])/1000) -> 0.72620299999999993 | Y42: =(RC[-14]-RC[1])/RC[-18]*100 -> 0.48343236982576243 | Z42: 5.45 | AC42: =VALUE(RC[-27]) -> 2018-10-21T00:00:00.000 | AD42: =IF(RC[21]=42,"*",IF(RC[21]=32,"",RC[21])) -> - | AE42: =RC[-28] -> 24 | AF42: =RC[-28] -> 105.22 | AG42: =RC[-28] -> 68.75 | AH42: =RC[-28] -> 7.95 | AI42: =RC[-28] -> 99.29 | AJ42: =RC[-28] -> 44.09 | AK42: =RC[-28] -> 5.43 | AL42: =RC[-28] -> 24.659999999999997 | AM42: =RC[-28] -> 5.93 | AN42: =RC[-28] -> 31.92 | AO42: =RC[-28] -> 68.680000000000007 | AP42: - | AQ42: =RC[-29] -> 26.18 | AR42: =RC[-29] -> 55.03 | AS42: - | AT42: =RC[-30] -> 13.650000000000006 | AU42: =RC[-30] -> 5.74 | AV42: =RC[-30] -> 0.72799999999999998 | AW42: =RC[-30] -> 2.859 | AY42: - | AZ42: - | BA42: -
A43: =IF(RC[1]="","",DATEVALUE(RC[1])) -> 43395 | B43: 22.10.18 | C43: 24 | D43: 103.55 | E43: 69.209999999999994 | F43: 7.94 | G43: 98.33 | H43: 43.96 | I43: 4.88 | J43: =RC[-5]-RC[-2] -> 25.249999999999993 | K43: 5.22 | L43: 30.95 | M43: 69.17 | N43: 25.94 | O43: 54.96 | P43: =IF(AND(ISNUMBER(RC[-3]),ISNUMBER(RC[-1])),RC[-3]-RC[-1],"-") -> 14.21 | Q43: 5.01 | R43: 0.69199999999999995 | S43: 2.8479999999999999 | T43: =(RC[-16]*RC[-15]-RC[-13]*RC[-12])/1000 -> 2.8441086999999987 | U43: 30.28 | V43: 25.51 | W43: =RC[-2]*RC[-10]/1000 -> 2.0944675999999998 | X43: =ABS((RC[-3]*RC[-11]-RC[-2]*RC[-9])/1000) -> 0.69243799999999989 | Y43: =(RC[-14]-RC[1])/RC[-18]*100 -> 0.45764263195362576 | Z43: 4.7699999999999996 | AC43: =VALUE(RC[-27]) -> 2018-10-22T00:00:00.000 | AD43: =IF(RC[21]=42,"*",IF(RC[21]=32,"",RC[21])) -> - | AE43: =RC[-28] -> 24 | AF43: =RC[-28] -> 103.55 | AG43: =RC[-28] -> 69.209999999999994 | AH43: =RC[-28] -> 7.94 | AI43: =RC[-28] -> 98.33 | AJ43: =RC[-28] -> 43.96 | AK43: =RC[-28] -> 4.88 | AL43: =RC[-28] -> 25.249999999999993 | AM43: =RC[-28] -> 5.22 | AN43: =RC[-28] -> 30.95 | AO43: =RC[-28] -> 69.17 | AP43: - | AQ43: =RC[-29] -> 25.94 | AR43: =RC[-29] -> 54.96 | AS43: - | AT43: =RC[-30] -> 14.21 | AU43: =RC[-30] -> 5.01 | AV43: =RC[-30] -> 0.69199999999999995 | AW43: =RC[-30] -> 2.8479999999999999 | AY43: - | AZ43: - | BA43: -
A44: =IF(RC[1]="","",DATEVALUE(RC[1])) ->  | C44: 24 | J44: =RC[-5]-RC[-2] -> #VALUE! | P44: =IF(AND(ISNUMBER(RC[-3]),ISNUMBER(RC[-1])),RC[-3]-RC[-1],"-") -> - | T44: =(RC[-16]*RC[-15]-RC[-13]*RC[-12])/1000 -> #VALUE! | W44: =RC[-2]*RC[-10]/1000 -> #VALUE! | X44: =ABS((RC[-3]*RC[-11]-RC[-2]*RC[-9])/1000) -> #VALUE! | Y44: =(RC[-14]-RC[1])/RC[-18]*100 -> #VALUE! | AC44: =VALUE(RC[-27]) -> #VALUE! | AD44: =IF(RC[21]=42,"*",IF(RC[21]=32,"",RC[21])) ->  | AE44: =RC[-28] -> 24 | AF44: =RC[-28] ->  | AG44: =RC[-28] ->  | AH44: =RC[-28] ->  | AI44: =RC[-28] ->  | AJ44: =RC[-28] ->  | AK44: =RC[-28] ->  | AL44: =RC[-28] -> #VALUE! | AM44: =RC[-28] ->  | AN44: =RC[-28] ->  | AO44: =RC[-28] ->  | AP44: - | AQ44: =RC[-29] ->  | AR44: =RC[-29] ->  | AS44: - | AT44: =RC[-30] -> - | AU44: =RC[-30] ->  | AV44: =RC[-30] ->  | AW44: =RC[-30] -> 
A45: =IF(RC[1]="","",DATEVALUE(RC[1])) ->  | C45: 24 | P45: =IF(AND(ISNUMBER(RC[-3]),ISNUMBER(RC[-1])),RC[-3]-RC[-1],"-") -> - | T45: =(RC[-16]*RC[-15]-RC[-13]*RC[-12])/1000 -> #VALUE! | W45: =RC[-2]*RC[-10]/1000 -> #VALUE! | X45: =ABS((RC[-3]*RC[-11]-RC[-2]*RC[-9])/1000) -> #VALUE! | Y45: =(RC[-14]-RC[1])/RC[-18]*100 -> #VALUE! | AC45: =VALUE(RC[-27]) -> #VALUE! | AD45: =IF(RC[21]=42,"*",IF(RC[21]=32,"",RC[21])) ->  | AE45: =RC[-28] -> 24 | AF45: =RC[-28] ->  | AG45: =RC[-28] ->  | AH45: =RC[-28] ->  | AI45: =RC[-28] ->  | AJ45: =RC[-28] ->  | AK45: =RC[-28] ->  | AL45: =RC[-28] -> 0 | AM45: =RC[-28] ->  | AN45: =RC[-28] ->  | AO45: =RC[-28] ->  | AP45: - | AQ45: =RC[-29] ->  | AR45: =RC[-29] ->  | AS45: - | AT45: =RC[-30] -> - | AU45: =RC[-30] ->  | AV45: =RC[-30] ->  | AW45: =RC[-30] -> 
A46: =IF(RC[1]="","",DATEVALUE(RC[1])) ->  | C46: 24 | P46: =IF(AND(ISNUMBER(RC[-3]),ISNUMBER(RC[-1])),RC[-3]-RC[-1],"-") -> - | T46: =(RC[-16]*RC[-15]-RC[-13]*RC[-12])/1000 -> #VALUE! | W46: =RC[-2]*RC[-10]/1000 -> #VALUE! | X46: =ABS((RC[-3]*RC[-11]-RC[-2]*RC[-9])/1000) -> #VALUE! | Y46: =(RC[-14]-RC[1])/RC[-18]*100 -> #VALUE! | AC46: =VALUE(RC[-27]) -> #VALUE! | AD46: =IF(RC[21]=42,"*",IF(RC[21]=32,"",RC[21])) ->  | AE46: =RC[-28] -> 24 | AF46: =RC[-28] ->  | AG46: =RC[-28] ->  | AH46: =RC[-28] ->  | AI46: =RC[-28] ->  | AJ46: =RC[-28] ->  | AK46: =RC[-28] ->  | AL46: =RC[-28] -> 0 | AM46: =RC[-28] ->  | AN46: =RC[-28] ->  | AO46: =RC[-28] ->  | AP46: - | AQ46: =RC[-29] ->  | AR46: =RC[-29] ->  | AS46: - | AT46: =RC[-30] -> - | AU46: =RC[-30] ->  | AV46: =RC[-30] ->  | AW46: =RC[-30] -> 
A47: =IF(RC[1]="","",DATEVALUE(RC[1])) ->  | C47: 24 | P47: =IF(AND(ISNUMBER(RC[-3]),ISNUMBER(RC[-1])),RC[-3]-RC[-1],"-") -> - | T47: =(RC[-16]*RC[-15]-RC[-13]*RC[-12])/1000 -> #VALUE! | W47: =RC[-2]*RC[-10]/1000 -> #VALUE! | X47: =ABS((RC[-3]*RC[-11]-RC[-2]*RC[-9])/1000) -> #VALUE! | Y47: =(RC[-14]-RC[1])/RC[-18]*100 -> #VALUE! | AC47: =VALUE(RC[-27]) -> #VALUE! | AD47: =IF(RC[21]=42,"*",IF(RC[21]=32,"",RC[21])) ->  | AE47: =RC[-28] -> 24 | AF47: =RC[-28] ->  | AG47: =RC[-28] ->  | AH47: =RC[-28] ->  | AI47: =RC[-28] ->  | AJ47: =RC[-28] ->  | AK47: =RC[-28] ->  | AL47: =RC[-28] -> 0 | AM47: =RC[-28] ->  | AN47: =RC[-28] ->  | AO47: =RC[-28] ->  | AP47: - | AQ47: =RC[-29] ->  | AR47: =RC[-29] ->  | AS47: - | AT47: =RC[-30] -> - | AU47: =RC[-30] ->  | AV47: =RC[-30] ->  | AW47: =RC[-30] -> 
A48: =IF(RC[1]="","",DATEVALUE(RC[1])) ->  | C48: 24 | P48: =IF(AND(ISNUMBER(RC[-3]),ISNUMBER(RC[-1])),RC[-3]-RC[-1],"-") -> - | T48: =(RC[-16]*RC[-15]-RC[-13]*RC[-12])/1000 -> #VALUE! | W48: =RC[-2]*RC[-10]/1000 -> #VALUE! | X48: =ABS((RC[-3]*RC[-11]-RC[-2]*RC[-9])/1000) -> #VALUE! | Y48: =(RC[-14]-RC[1])/RC[-18]*100 -> #VALUE! | AC48: =VALUE(RC[-27]) -> #VALUE! | AD48: =IF(RC[21]=42,"*",IF(RC[21]=32,"",RC[21])) ->  | AE48: =RC[-28] -> 24 | AF48: =RC[-28] ->  | AG48: =RC[-28] ->  | AH48: =RC[-28] ->  | AI48: =RC[-28] ->  | AJ48: =RC[-28] ->  | AK48: =RC[-28] ->  | AL48: =RC[-28] -> 0 | AM48: =RC[-28] ->  | AN48: =RC[-28] ->  | AO48: =RC[-28] ->  | AP48: - | AQ48: =RC[-29] ->  | AR48: =RC[-29] ->  | AS48: - | AT48: =RC[-30] -> - | AU48: =RC[-30] ->  | AV48: =RC[-30] ->  | AW48: =RC[-30] -> 
A49: =IF(RC[1]="","",DATEVALUE(RC[1])) ->  | C49: 24 | P49: =IF(AND(ISNUMBER(RC[-3]),ISNUMBER(RC[-1])),RC[-3]-RC[-1],"-") -> - | T49: =(RC[-16]*RC[-15]-RC[-13]*RC[-12])/1000 -> #VALUE! | W49: =RC[-2]*RC[-10]/1000 -> #VALUE! | X49: =ABS((RC[-3]*RC[-11]-RC[-2]*RC[-9])/1000) -> #VALUE! | Y49: =(RC[-14]-RC[1])/RC[-18]*100 -> #VALUE! | AC49: =VALUE(RC[-27]) -> #VALUE! | AD49: =IF(RC[21]=42,"*",IF(RC[21]=32,"",RC[21])) ->  | AE49: =RC[-28] -> 24 | AF49: =RC[-28] ->  | AG49: =RC[-28] ->  | AH49: =RC[-28] ->  | AI49: =RC[-28] ->  | AJ49: =RC[-28] ->  | AK49: =RC[-28] ->  | AL49: =RC[-28] -> 0 | AM49: =RC[-28] ->  | AN49: =RC[-28] ->  | AO49: =RC[-28] ->  | AP49: - | AQ49: =RC[-29] ->  | AR49: =RC[-29] ->  | AS49: - | AT49: =RC[-30] -> - | AU49: =RC[-30] ->  | AV49: =RC[-30] ->  | AW49: =RC[-30] -> 
A50: =IF(RC[1]="","",DATEVALUE(RC[1])) ->  | P50: =IF(AND(ISNUMBER(RC[-3]),ISNUMBER(RC[-1])),RC[-3]-RC[-1],"-") -> - | T50: =(RC[-16]*RC[-15]-RC[-13]*RC[-12])/1000 -> #VALUE! | W50: =RC[-2]*RC[-10]/1000 -> #VALUE! | X50: =ABS((RC[-3]*RC[-11]-RC[-2]*RC[-9])/1000) -> #VALUE! | Y50: =(RC[-14]-RC[1])/RC[-18]*100 -> #VALUE! | AC50: =VALUE(RC[-27]) -> #VALUE! | AD50: =IF(RC[21]=42,"*",IF(RC[21]=32,"",RC[21])) ->  | AE50: =RC[-28] ->  | AF50: =RC[-28] ->  | AG50: =RC[-28] ->  | AH50: =RC[-28] ->  | AI50: =RC[-28] ->  | AJ50: =RC[-28] ->  | AK50: =RC[-28] ->  | AL50: =RC[-28] -> 0 | AM50: =RC[-28] ->  | AN50: =RC[-28] ->  | AO50: =RC[-28] ->  | AP50: - | AQ50: =RC[-29] ->  | AR50: =RC[-29] ->  | AS50: - | AT50: =RC[-30] -> - | AU50: =RC[-30] ->  | AV50: =RC[-30] ->  | AW50: =RC[-30] -> 
A51: =IF(RC[1]="","",DATEVALUE(RC[1])) ->  | P51: =IF(AND(ISNUMBER(RC[-3]),ISNUMBER(RC[-1])),RC[-3]-RC[-1],"-") -> - | T51: =(RC[-16]*RC[-15]-RC[-13]*RC[-12])/1000 -> #VALUE! | W51: =RC[-2]*RC[-10]/1000 -> #VALUE! | X51: =ABS((RC[-3]*RC[-11]-RC[-2]*RC[-9])/1000) -> #VALUE! | Y51: =(RC[-14]-RC[1])/RC[-18]*100 -> #VALUE! | AC51: =VALUE(RC[-27]) -> #VALUE! | AD51: =IF(RC[21]=42,"*",IF(RC[21]=32,"",RC[21])) ->  | AE51: =RC[-28] ->  | AF51: =RC[-28] ->  | AG51: =RC[-28] ->  | AH51: =RC[-28] ->  | AI51: =RC[-28] ->  | AJ51: =RC[-28] ->  | AK51: =RC[-28] ->  | AL51: =RC[-28] -> 0 | AM51: =RC[-28] ->  | AN51: =RC[-28] ->  | AO51: =RC[-28] ->  | AP51: - | AQ51: =RC[-29] ->  | AR51: =RC[-29] ->  | AS51: - | AT51: =RC[-30] -> - | AU51: =RC[-30] ->  | AV51: =RC[-30] ->  | AW51: =RC[-30] -> 
A52: =IF(RC[1]="","",DATEVALUE(RC[1])) ->  | P52: =IF(AND(ISNUMBER(RC[-3]),ISNUMBER(RC[-1])),RC[-3]-RC[-1],"-") -> - | T52: =(RC[-16]*RC[-15]-RC[-13]*RC[-12])/1000 -> #VALUE! | W52: =RC[-2]*RC[-10]/1000 -> #VALUE! | X52: =ABS((RC[-3]*RC[-11]-RC[-2]*RC[-9])/1000) -> #VALUE! | Y52: =(RC[-14]-RC[1])/RC[-18]*100 -> #VALUE! | AC52: =VALUE(RC[-27]) -> #VALUE! | AD52: =IF(RC[21]=42,"*",IF(RC[21]=32,"",RC[21])) ->  | AE52: =RC[-28] ->  | AF52: =RC[-28] ->  | AG52: =RC[-28] ->  | AH52: =RC[-28] ->  | AI52: =RC[-28] ->  | AJ52: =RC[-28] ->  | AK52: =RC[-28] ->  | AL52: =RC[-28] -> 0 | AM52: =RC[-28] ->  | AN52: =RC[-28] ->  | AO52: =RC[-28] ->  | AP52: - | AQ52: =RC[-29] ->  | AR52: =RC[-29] ->  | AS52: - | AT52: =RC[-30] -> - | AU52: =RC[-30] ->  | AV52: =RC[-30] ->  | AW52: =RC[-30] -> 
A53: =IF(RC[1]="","",DATEVALUE(RC[1])) ->  | P53: =IF(AND(ISNUMBER(RC[-3]),ISNUMBER(RC[-1])),RC[-3]-RC[-1],"-") -> - | T53: =(RC[-16]*RC[-15]-RC[-13]*RC[-12])/1000 -> #VALUE! | W53: =RC[-2]*RC[-10]/1000 -> #VALUE! | X53: =ABS((RC[-3]*RC[-11]-RC[-2]*RC[-9])/1000) -> #VALUE! | Y53: =(RC[-14]-RC[1])/RC[-18]*100 -> #VALUE! | AC53: =VALUE(RC[-27]) -> #VALUE! | AD53: =IF(RC[21]=42,"*",IF(RC[21]=32,"",RC[21])) ->  | AE53: =RC[-28] ->  | AF53: =RC[-28] ->  | AG53: =RC[-28] ->  | AH53: =RC[-28] ->  | AI53: =RC[-28] ->  | AJ53: =RC[-28] ->  | AK53: =RC[-28] ->  | AL53: =RC[-28] -> 0 | AM53: =RC[-28] ->  | AN53: =RC[-28] ->  | AO53: =RC[-28] ->  | AP53: - | AQ53: =RC[-29] ->  | AR53: =RC[-29] ->  | AS53: - | AT53: =RC[-30] -> - | AU53: =RC[-30] ->  | AV53: =RC[-30] ->  | AW53: =RC[-30] -> 
A54: =IF(RC[1]="","",DATEVALUE(RC[1])) ->  | P54: =IF(AND(ISNUMBER(RC[-3]),ISNUMBER(RC[-1])),RC[-3]-RC[-1],"-") -> - | T54: =(RC[-16]*RC[-15]-RC[-13]*RC[-12])/1000 -> #VALUE! | W54: =RC[-2]*RC[-10]/1000 -> #VALUE! | X54: =ABS((RC[-3]*RC[-11]-RC[-2]*RC[-9])/1000) -> #VALUE! | Y54: =(RC[-14]-RC[1])/RC[-18]*100 -> #VALUE! | AC54: =VALUE(RC[-27]) -> #VALUE! | AD54: =IF(RC[21]=42,"*",IF(RC[21]=32,"",RC[21])) ->  | AE54: =RC[-28] ->  | AF54: =RC[-28] ->  | AG54: =RC[-28] ->  | AH54: =RC[-28] ->  | AI54: =RC[-28] ->  | AJ54: =RC[-28] ->  | AK54: =RC[-28] ->  | AL54: =RC[-28] -> 0 | AM54: =RC[-28] ->  | AN54: =RC[-28] ->  | AO54: =RC[-28] ->  | AP54: - | AQ54: =RC[-29] ->  | AR54: =RC[-29] ->  | AS54: - | AT54: =RC[-30] -> - | AU54: =RC[-30] ->  | AV54: =RC[-30] ->  | AW54: =RC[-30] -> 
A55: =IF(RC[1]="","",DATEVALUE(RC[1])) ->  | P55: =IF(AND(ISNUMBER(RC[-3]),ISNUMBER(RC[-1])),RC[-3]-RC[-1],"-") -> - | T55: =(RC[-16]*RC[-15]-RC[-13]*RC[-12])/1000 -> #VALUE! | W55: =RC[-2]*RC[-10]/1000 -> #VALUE! | X55: =ABS((RC[-3]*RC[-11]-RC[-2]*RC[-9])/1000) -> #VALUE! | Y55: =(RC[-14]-RC[1])/RC[-18]*100 -> #VALUE! | AC55: =VALUE(RC[-27]) -> #VALUE! | AD55: =IF(RC[21]=42,"*",IF(RC[21]=32,"",RC[21])) ->  | AE55: =RC[-28] ->  | AF55: =RC[-28] ->  | AG55: =RC[-28] ->  | AH55: =RC[-28] ->  | AI55: =RC[-28] ->  | AJ55: =RC[-28] ->  | AK55: =RC[-28] ->  | AL55: =RC[-28] -> 0 | AM55: =RC[-28] ->  | AN55: =RC[-28] ->  | AO55: =RC[-28] ->  | AP55: - | AQ55: =RC[-29] ->  | AR55: =RC[-29] ->  | AS55: - | AT55: =RC[-30] -> - | AU55: =RC[-30] ->  | AV55: =RC[-30] ->  | AW55: =RC[-30] -> 
A56: =IF(RC[1]="","",DATEVALUE(RC[1])) ->  | P56: =IF(AND(ISNUMBER(RC[-3]),ISNUMBER(RC[-1])),RC[-3]-RC[-1],"-") -> - | T56: =(RC[-16]*RC[-15]-RC[-13]*RC[-12])/1000 -> #VALUE! | W56: =RC[-2]*RC[-10]/1000 -> #VALUE! | X56: =ABS((RC[-3]*RC[-11]-RC[-2]*RC[-9])/1000) -> #VALUE! | Y56: =(RC[-14]-RC[1])/RC[-18]*100 -> #VALUE! | AC56: =VALUE(RC[-27]) -> #VALUE! | AD56: =IF(RC[21]=42,"*",IF(RC[21]=32,"",RC[21])) ->  | AE56: =RC[-28] ->  | AF56: =RC[-28] ->  | AG56: =RC[-28] ->  | AH56: =RC[-28] ->  | AI56: =RC[-28] ->  | AJ56: =RC[-28] ->  | AK56: =RC[-28] ->  | AL56: =RC[-28] -> 0 | AM56: =RC[-28] ->  | AN56: =RC[-28] ->  | AO56: =RC[-28] ->  | AP56: - | AQ56: =RC[-29] ->  | AR56: =RC[-29] ->  | AS56: - | AT56: =RC[-30] -> - | AU56: =RC[-30] ->  | AV56: =RC[-30] ->  | AW56: =RC[-30] -> 
A57: =IF(RC[1]="","",DATEVALUE(RC[1])) ->  | P57: =IF(AND(ISNUMBER(RC[-3]),ISNUMBER(RC[-1])),RC[-3]-RC[-1],"-") -> - | T57: =(RC[-16]*RC[-15]-RC[-13]*RC[-12])/1000 -> #VALUE! | W57: =RC[-2]*RC[-10]/1000 -> #VALUE! | X57: =ABS((RC[-3]*RC[-11]-RC[-2]*RC[-9])/1000) -> #VALUE! | Y57: =(RC[-14]-RC[1])/RC[-18]*100 -> #VALUE! | AC57: =VALUE(RC[-27]) -> #VALUE! | AD57: =IF(RC[21]=42,"*",IF(RC[21]=32,"",RC[21])) ->  | AE57: =RC[-28] ->  | AF57: =RC[-28] ->  | AG57: =RC[-28] ->  | AH57: =RC[-28] ->  | AI57: =RC[-28] ->  | AJ57: =RC[-28] ->  | AK57: =RC[-28] ->  | AL57: =RC[-28] -> 0 | AM57: =RC[-28] ->  | AN57: =RC[-28] ->  | AO57: =RC[-28] ->  | AP57: - | AQ57: =RC[-29] ->  | AR57: =RC[-29] ->  | AS57: - | AT57: =RC[-30] -> - | AU57: =RC[-30] ->  | AV57: =RC[-30] ->  | AW57: =RC[-30] -> 
A58: =IF(RC[1]="","",DATEVALUE(RC[1])) ->  | P58: =IF(AND(ISNUMBER(RC[-3]),ISNUMBER(RC[-1])),RC[-3]-RC[-1],"-") -> - | T58: =(RC[-16]*RC[-15]-RC[-13]*RC[-12])/1000 -> #VALUE! | W58: =RC[-2]*RC[-10]/1000 -> #VALUE! | X58: =ABS((RC[-3]*RC[-11]-RC[-2]*RC[-9])/1000) -> #VALUE! | Y58: =(RC[-14]-RC[1])/RC[-18]*100 -> #VALUE! | AC58: =VALUE(RC[-27]) -> #VALUE! | AD58: =IF(RC[21]=42,"*",IF(RC[21]=32,"",RC[21])) ->  | AE58: =RC[-28] ->  | AF58: =RC[-28] ->  | AG58: =RC[-28] ->  | AH58: =RC[-28] ->  | AI58: =RC[-28] ->  | AJ58: =RC[-28] ->  | AK58: =RC[-28] ->  | AL58: =RC[-28] -> 0 | AM58: =RC[-28] ->  | AN58: =RC[-28] ->  | AO58: =RC[-28] ->  | AP58: - | AQ58: =RC[-29] ->  | AR58: =RC[-29] ->  | AS58: - | AT58: =RC[-30] -> - | AU58: =RC[-30] ->  | AV58: =RC[-30] ->  | AW58: =RC[-30] -> 
A59: =IF(RC[1]="","",DATEVALUE(RC[1])) ->  | P59: =IF(AND(ISNUMBER(RC[-3]),ISNUMBER(RC[-1])),RC[-3]-RC[-1],"-") -> - | T59: =(RC[-16]*RC[-15]-RC[-13]*RC[-12])/1000 -> #VALUE! | W59: =RC[-2]*RC[-10]/1000 -> #VALUE! | X59: =ABS((RC[-3]*RC[-11]-RC[-2]*RC[-9])/1000) -> #VALUE! | Y59: =(RC[-14]-RC[1])/RC[-18]*100 -> #VALUE! | AC59: =VALUE(RC[-27]) -> #VALUE! | AD59: =IF(RC[21]=42,"*",IF(RC[21]=32,"",RC[21])) ->  | AE59: =RC[-28] ->  | AF59: =RC[-28] ->  | AG59: =RC[-28] ->  | AH59: =RC[-28] ->  | AI59: =RC[-28] ->  | AJ59: =RC[-28] ->  | AK59: =RC[-28] ->  | AL59: =RC[-28] -> 0 | AM59: =RC[-28] ->  | AN59: =RC[-28] ->  | AO59: =RC[-28] ->  | AP59: - | AQ59: =RC[-29] ->  | AR59: =RC[-29] ->  | AS59: - | AT59: =RC[-30] -> - | AU59: =RC[-30] ->  | AV59: =RC[-30] ->  | AW59: =RC[-30] -> 
A60: =IF(RC[1]="","",DATEVALUE(RC[1])) ->  | P60: =IF(AND(ISNUMBER(RC[-3]),ISNUMBER(RC[-1])),RC[-3]-RC[-1],"-") -> - | T60: =(RC[-16]*RC[-15]-RC[-13]*RC[-12])/1000 -> #VALUE! | W60: =RC[-2]*RC[-10]/1000 -> #VALUE! | X60: =ABS((RC[-3]*RC[-11]-RC[-2]*RC[-9])/1000) -> #VALUE! | Y60: =(RC[-14]-RC[1])/RC[-18]*100 -> #VALUE! | AC60: =VALUE(RC[-27]) -> #VALUE! | AD60: =IF(RC[21]=42,"*",IF(RC[21]=32,"",RC[21])) ->  | AE60: =RC[-28] ->  | AF60: =RC[-28] ->  | AG60: =RC[-28] ->  | AH60: =RC[-28] ->  | AI60: =RC[-28] ->  | AJ60: =RC[-28] ->  | AK60: =RC[-28] ->  | AL60: =RC[-28] -> 0 | AM60: =RC[-28] ->  | AN60: =RC[-28] ->  | AO60: =RC[-28] ->  | AP60: - | AQ60: =RC[-29] ->  | AR60: =RC[-29] ->  | AS60: - | AT60: =RC[-30] -> - | AU60: =RC[-30] ->  | AV60: =RC[-30] ->  | AW60: =RC[-30] -> 
A61: =IF(RC[1]="","",DATEVALUE(RC[1])) ->  | P61: =IF(AND(ISNUMBER(RC[-3]),ISNUMBER(RC[-1])),RC[-3]-RC[-1],"-") -> - | T61: =(RC[-16]*RC[-15]-RC[-13]*RC[-12])/1000 -> #VALUE! | W61: =RC[-2]*RC[-10]/1000 -> #VALUE! | X61: =ABS((RC[-3]*RC[-11]-RC[-2]*RC[-9])/1000) -> #VALUE! | Y61: =(RC[-14]-RC[1])/RC[-18]*100 -> #VALUE! | AC61: =VALUE(RC[-27]) -> #VALUE! | AD61: =IF(RC[21]=42,"*",IF(RC[21]=32,"",RC[21])) ->  | AE61: =RC[-28] ->  | AF61: =RC[-28] ->  | AG61: =RC[-28] ->  | AH61: =RC[-28] ->  | AI61: =RC[-28] ->  | AJ61: =RC[-28] ->  | AK61: =RC[-28] ->  | AL61: =RC[-28] -> 0 | AM61: =RC[-28] ->  | AN61: =RC[-28] ->  | AO61: =RC[-28] ->  | AP61: - | AQ61: =RC[-29] ->  | AR61: =RC[-29] ->  | AS61: - | AT61: =RC[-30] -> - | AU61: =RC[-30] ->  | AV61: =RC[-30] ->  | AW61: =RC[-30] -> 
A62: =IF(RC[1]="","",DATEVALUE(RC[1])) ->  | P62: =IF(AND(ISNUMBER(RC[-3]),ISNUMBER(RC[-1])),RC[-3]-RC[-1],"-") -> - | T62: =(RC[-16]*RC[-15]-RC[-13]*RC[-12])/1000 -> #VALUE! | W62: =RC[-2]*RC[-10]/1000 -> #VALUE! | X62: =ABS((RC[-3]*RC[-11]-RC[-2]*RC[-9])/1000) -> #VALUE! | Y62: =(RC[-14]-RC[1])/RC[-18]*100 -> #VALUE! | AC62: =VALUE(RC[-27]) -> #VALUE! | AD62: =IF(RC[21]=42,"*",IF(RC[21]=32,"",RC[21])) ->  | AE62: =RC[-28] ->  | AF62: =RC[-28] ->  | AG62: =RC[-28] ->  | AH62: =RC[-28] ->  | AI62: =RC[-28] ->  | AJ62: =RC[-28] ->  | AK62: =RC[-28] ->  | AL62: =RC[-28] -> 0 | AM62: =RC[-28] ->  | AN62: =RC[-28] ->  | AO62: =RC[-28] ->  | AP62: - | AQ62: =RC[-29] ->  | AR62: =RC[-29] ->  | AS62: - | AT62: =RC[-30] -> - | AU62: =RC[-30] ->  | AV62: =RC[-30] ->  | AW62: =RC[-30] -> 
A63: =IF(RC[1]="","",DATEVALUE(RC[1])) ->  | P63: =IF(AND(ISNUMBER(RC[-3]),ISNUMBER(RC[-1])),RC[-3]-RC[-1],"-") -> - | T63: =(RC[-16]*RC[-15]-RC[-13]*RC[-12])/1000 -> #VALUE! | W63: =RC[-2]*RC[-10]/1000 -> #VALUE! | X63: =ABS((RC[-3]*RC[-11]-RC[-2]*RC[-9])/1000) -> #VALUE! | Y63: =(RC[-14]-RC[1])/RC[-18]*100 -> #VALUE! | AC63: =VALUE(RC[-27]) -> #VALUE! | AD63: =IF(RC[21]=42,"*",IF(RC[21]=32,"",RC[21])) ->  | AE63: =RC[-28] ->  | AF63: =RC[-28] ->  | AG63: =RC[-28] ->  | AH63: =RC[-28] ->  | AI63: =RC[-28] ->  | AJ63: =RC[-28] ->  | AK63: =RC[-28] ->  | AL63: =RC[-28] -> 0 | AM63: =RC[-28] ->  | AN63: =RC[-28] ->  | AO63: =RC[-28] ->  | AP63: - | AQ63: =RC[-29] ->  | AR63: =RC[-29] ->  | AS63: - | AT63: =RC[-30] -> - | AU63: =RC[-30] ->  | AV63: =RC[-30] ->  | AW63: =RC[-30] -> 
A64: =IF(RC[1]="","",DATEVALUE(RC[1])) ->  | P64: =IF(AND(ISNUMBER(RC[-3]),ISNUMBER(RC[-1])),RC[-3]-RC[-1],"-") -> - | T64: =(RC[-16]*RC[-15]-RC[-13]*RC[-12])/1000 -> #VALUE! | W64: =RC[-2]*RC[-10]/1000 -> #VALUE! | X64: =ABS((RC[-3]*RC[-11]-RC[-2]*RC[-9])/1000) -> #VALUE! | Y64: =(RC[-14]-RC[1])/RC[-18]*100 -> #VALUE! | AC64: =VALUE(RC[-27]) -> #VALUE! | AD64: =IF(RC[21]=42,"*",IF(RC[21]=32,"",RC[21])) ->  | AE64: =RC[-28] ->  | AF64: =RC[-28] ->  | AG64: =RC[-28] ->  | AH64: =RC[-28] ->  | AI64: =RC[-28] ->  | AJ64: =RC[-28] ->  | AK64: =RC[-28] ->  | AL64: =RC[-28] -> 0 | AM64: =RC[-28] ->  | AN64: =RC[-28] ->  | AO64: =RC[-28] ->  | AP64: - | AQ64: =RC[-29] ->  | AR64: =RC[-29] ->  | AS64: - | AT64: =RC[-30] -> - | AU64: =RC[-30] ->  | AV64: =RC[-30] ->  | AW64: =RC[-30] -> 
A65: =IF(RC[1]="","",DATEVALUE(RC[1])) ->  | P65: =IF(AND(ISNUMBER(RC[-3]),ISNUMBER(RC[-1])),RC[-3]-RC[-1],"-") -> - | T65: =(RC[-16]*RC[-15]-RC[-13]*RC[-12])/1000 -> #VALUE! | W65: =RC[-2]*RC[-10]/1000 -> #VALUE! | X65: =ABS((RC[-3]*RC[-11]-RC[-2]*RC[-9])/1000) -> #VALUE! | Y65: =(RC[-14]-RC[1])/RC[-18]*100 -> #VALUE! | AC65: =VALUE(RC[-27]) -> #VALUE! | AD65: =IF(RC[21]=42,"*",IF(RC[21]=32,"",RC[21])) ->  | AE65: =RC[-28] ->  | AF65: =RC[-28] ->  | AG65: =RC[-28] ->  | AH65: =RC[-28] ->  | AI65: =RC[-28] ->  | AJ65: =RC[-28] ->  | AK65: =RC[-28] ->  | AL65: =RC[-28] -> 0 | AM65: =RC[-28] ->  | AN65: =RC[-28] ->  | AO65: =RC[-28] ->  | AP65: - | AQ65: =RC[-29] ->  | AR65: =RC[-29] ->  | AS65: - | AT65: =RC[-30] -> - | AU65: =RC[-30] ->  | AV65: =RC[-30] ->  | AW65: =RC[-30] -> 
A66: =IF(RC[1]="","",DATEVALUE(RC[1])) ->  | P66: =IF(AND(ISNUMBER(RC[-3]),ISNUMBER(RC[-1])),RC[-3]-RC[-1],"-") -> - | T66: =(RC[-16]*RC[-15]-RC[-13]*RC[-12])/1000 -> #VALUE! | W66: =RC[-2]*RC[-10]/1000 -> #VALUE! | X66: =ABS((RC[-3]*RC[-11]-RC[-2]*RC[-9])/1000) -> #VALUE! | Y66: =(RC[-14]-RC[1])/RC[-18]*100 -> #VALUE! | AC66: =VALUE(RC[-27]) -> #VALUE! | AD66: =IF(RC[21]=42,"*",IF(RC[21]=32,"",RC[21])) ->  | AE66: =RC[-28] ->  | AF66: =RC[-28] ->  | AG66: =RC[-28] ->  | AH66: =RC[-28] ->  | AI66: =RC[-28] ->  | AJ66: =RC[-28] ->  | AK66: =RC[-28] ->  | AL66: =RC[-28] -> 0 | AM66: =RC[-28] ->  | AN66: =RC[-28] ->  | AO66: =RC[-28] ->  | AP66: - | AQ66: =RC[-29] ->  | AR66: =RC[-29] ->  | AS66: - | AT66: =RC[-30] -> - | AU66: =RC[-30] ->  | AV66: =RC[-30] ->  | AW66: =RC[-30] -> 
A67: =IF(RC[1]="","",DATEVALUE(RC[1])) ->  | P67: =IF(AND(ISNUMBER(RC[-3]),ISNUMBER(RC[-1])),RC[-3]-RC[-1],"-") -> - | T67: =(RC[-16]*RC[-15]-RC[-13]*RC[-12])/1000 -> #VALUE! | W67: =RC[-2]*RC[-10]/1000 -> #VALUE! | X67: =ABS((RC[-3]*RC[-11]-RC[-2]*RC[-9])/1000) -> #VALUE! | Y67: =(RC[-14]-RC[1])/RC[-18]*100 -> #VALUE! | AC67: =VALUE(RC[-27]) -> #VALUE! | AD67: =IF(RC[21]=42,"*",IF(RC[21]=32,"",RC[21])) ->  | AE67: =RC[-28] ->  | AF67: =RC[-28] ->  | AG67: =RC[-28] ->  | AH67: =RC[-28] ->  | AI67: =RC[-28] ->  | AJ67: =RC[-28] ->  | AK67: =RC[-28] ->  | AL67: =RC[-28] -> 0 | AM67: =RC[-28] ->  | AN67: =RC[-28] ->  | AO67: =RC[-28] ->  | AP67: - | AQ67: =RC[-29] ->  | AR67: =RC[-29] ->  | AS67: - | AT67: =RC[-30] -> - | AU67: =RC[-30] ->  | AV67: =RC[-30] ->  | AW67: =RC[-30] -> 
A68: =IF(RC[1]="","",DATEVALUE(RC[1])) ->  | P68: =IF(AND(ISNUMBER(RC[-3]),ISNUMBER(RC[-1])),RC[-3]-RC[-1],"-") -> - | T68: =(RC[-16]*RC[-15]-RC[-13]*RC[-12])/1000 -> #VALUE! | W68: =RC[-2]*RC[-10]/1000 -> #VALUE! | X68: =ABS((RC[-3]*RC[-11]-RC[-2]*RC[-9])/1000) -> #VALUE! | Y68: =(RC[-14]-RC[1])/RC[-18]*100 -> #VALUE! | AC68: =VALUE(RC[-27]) -> #VALUE! | AD68: =IF(RC[21]=42,"*",IF(RC[21]=32,"",RC[21])) ->  | AE68: =RC[-28] ->  | AF68: =RC[-28] ->  | AG68: =RC[-28] ->  | AH68: =RC[-28] ->  | AI68: =RC[-28] ->  | AJ68: =RC[-28] ->  | AK68: =RC[-28] ->  | AL68: =RC[-28] -> 0 | AM68: =RC[-28] ->  | AN68: =RC[-28] ->  | AO68: =RC[-28] ->  | AP68: - | AQ68: =RC[-29] ->  | AR68: =RC[-29] ->  | AS68: - | AT68: =RC[-30] -> - | AU68: =RC[-30] ->  | AV68: =RC[-30] ->  | AW68: =RC[-30] -> 
A69: =IF(RC[1]="","",DATEVALUE(RC[1])) ->  | P69: =IF(AND(ISNUMBER(RC[-3]),ISNUMBER(RC[-1])),RC[-3]-RC[-1],"-") -> - | T69: =(RC[-16]*RC[-15]-RC[-13]*RC[-12])/1000 -> #VALUE! | W69: =RC[-2]*RC[-10]/1000 -> #VALUE! | X69: =ABS((RC[-3]*RC[-11]-RC[-2]*RC[-9])/1000) -> #VALUE! | Y69: =(RC[-14]-RC[1])/RC[-18]*100 -> #VALUE! | AC69: =VALUE(RC[-27]) -> #VALUE! | AD69: =IF(RC[21]=42,"*",IF(RC[21]=32,"",RC[21])) ->  | AE69: =RC[-28] ->  | AF69: =RC[-28] ->  | AG69: =RC[-28] ->  | AH69: =RC[-28] ->  | AI69: =RC[-28] ->  | AJ69: =RC[-28] ->  | AK69: =RC[-28] ->  | AL69: =RC[-28] -> 0 | AM69: =RC[-28] ->  | AN69: =RC[-28] ->  | AO69: =RC[-28] ->  | AP69: - | AQ69: =RC[-29] ->  | AR69: =RC[-29] ->  | AS69: - | AT69: =RC[-30] -> - | AU69: =RC[-30] ->  | AV69: =RC[-30] ->  | AW69: =RC[-30] -> 
A70: =IF(RC[1]="","",DATEVALUE(RC[1])) ->  | P70: =IF(AND(ISNUMBER(RC[-3]),ISNUMBER(RC[-1])),RC[-3]-RC[-1],"-") -> - | T70: =(RC[-16]*RC[-15]-RC[-13]*RC[-12])/1000 -> #VALUE! | W70: =RC[-2]*RC[-10]/1000 -> #VALUE! | X70: =ABS((RC[-3]*RC[-11]-RC[-2]*RC[-9])/1000) -> #VALUE! | Y70: =(RC[-14]-RC[1])/RC[-18]*100 -> #VALUE! | AC70: =VALUE(RC[-27]) -> #VALUE! | AD70: =IF(RC[21]=42,"*",IF(RC[21]=32,"",RC[21])) ->  | AE70: =RC[-28] ->  | AF70: =RC[-28] ->  | AG70: =RC[-28] ->  | AH70: =RC[-28] ->  | AI70: =RC[-28] ->  | AJ70: =RC[-28] ->  | AK70: =RC[-28] ->  | AL70: =RC[-28] -> 0 | AM70: =RC[-28] ->  | AN70: =RC[-28] ->  | AO70: =RC[-28] ->  | AP70: - | AQ70: =RC[-29] ->  | AR70: =RC[-29] ->  | AS70: - | AT70: =RC[-30] -> - | AU70: =RC[-30] ->  | AV70: =RC[-30] ->  | AW70: =RC[-30] -> 
A71: =IF(RC[1]="","",DATEVALUE(RC[1])) ->  | P71: =IF(AND(ISNUMBER(RC[-3]),ISNUMBER(RC[-1])),RC[-3]-RC[-1],"-") -> - | T71: =(RC[-16]*RC[-15]-RC[-13]*RC[-12])/1000 -> #VALUE! | W71: =RC[-2]*RC[-10]/1000 -> #VALUE! | X71: =ABS((RC[-3]*RC[-11]-RC[-2]*RC[-9])/1000) -> #VALUE! | Y71: =(RC[-14]-RC[1])/RC[-18]*100 -> #VALUE! | AC71: =VALUE(RC[-27]) -> #VALUE! | AD71: =IF(RC[21]=42,"*",IF(RC[21]=32,"",RC[21])) ->  | AE71: =RC[-28] ->  | AF71: =RC[-28] ->  | AG71: =RC[-28] ->  | AH71: =RC[-28] ->  | AI71: =RC[-28] ->  | AJ71: =RC[-28] ->  | AK71: =RC[-28] ->  | AL71: =RC[-28] -> 0 | AM71: =RC[-28] ->  | AN71: =RC[-28] ->  | AO71: =RC[-28] ->  | AP71: - | AQ71: =RC[-29] ->  | AR71: =RC[-29] ->  | AS71: - | AT71: =RC[-30] -> - | AU71: =RC[-30] ->  | AV71: =RC[-30] ->  | AW71: =RC[-30] -> 
A72: =IF(RC[1]="","",DATEVALUE(RC[1])) ->  | P72: =IF(AND(ISNUMBER(RC[-3]),ISNUMBER(RC[-1])),RC[-3]-RC[-1],"-") -> - | T72: =(RC[-16]*RC[-15]-RC[-13]*RC[-12])/1000 -> #VALUE! | W72: =RC[-2]*RC[-10]/1000 -> #VALUE! | X72: =ABS((RC[-3]*RC[-11]-RC[-2]*RC[-9])/1000) -> #VALUE! | Y72: =(RC[-14]-RC[1])/RC[-18]*100 -> #VALUE! | AC72: =VALUE(RC[-27]) -> #VALUE! | AD72: =IF(RC[21]=42,"*",IF(RC[21]=32,"",RC[21])) ->  | AE72: =RC[-28] ->  | AF72: =RC[-28] ->  | AG72: =RC[-28] ->  | AH72: =RC[-28] ->  | AI72: =RC[-28] ->  | AJ72: =RC[-28] ->  | AK72: =RC[-28] ->  | AL72: =RC[-28] -> 0 | AM72: =RC[-28] ->  | AN72: =RC[-28] ->  | AO72: =RC[-28] ->  | AP72: - | AQ72: =RC[-29] ->  | AR72: =RC[-29] ->  | AS72: - | AT72: =RC[-30] -> - | AU72: =RC[-30] ->  | AV72: =RC[-30] ->  | AW72: =RC[-30] -> 
A73: =IF(RC[1]="","",DATEVALUE(RC[1])) ->  | P73: =IF(AND(ISNUMBER(RC[-3]),ISNUMBER(RC[-1])),RC[-3]-RC[-1],"-") -> - | T73: =(RC[-16]*RC[-15]-RC[-13]*RC[-12])/1000 -> #VALUE! | W73: =RC[-2]*RC[-10]/1000 -> #VALUE! | X73: =ABS((RC[-3]*RC[-11]-RC[-2]*RC[-9])/1000) -> #VALUE! | Y73: =(RC[-14]-RC[1])/RC[-18]*100 -> #VALUE! | AC73: =VALUE(RC[-27]) -> #VALUE! | AD73: =IF(RC[21]=42,"*",IF(RC[21]=32,"",RC[21])) ->  | AE73: =RC[-28] ->  | AF73: =RC[-28] ->  | AG73: =RC[-28] ->  | AH73: =RC[-28] ->  | AI73: =RC[-28] ->  | AJ73: =RC[-28] ->  | AK73: =RC[-28] ->  | AL73: =RC[-28] -> 0 | AM73: =RC[-28] ->  | AN73: =RC[-28] ->  | AO73: =RC[-28] ->  | AP73: - | AQ73: =RC[-29] ->  | AR73: =RC[-29] ->  | AS73: - | AT73: =RC[-30] -> - | AU73: =RC[-30] ->  | AV73: =RC[-30] ->  | AW73: =RC[-30] -> 
A74: =IF(RC[1]="","",DATEVALUE(RC[1])) ->  | P74: =IF(AND(ISNUMBER(RC[-3]),ISNUMBER(RC[-1])),RC[-3]-RC[-1],"-") -> - | T74: =(RC[-16]*RC[-15]-RC[-13]*RC[-12])/1000 -> #VALUE! | W74: =RC[-2]*RC[-10]/1000 -> #VALUE! | X74: =ABS((RC[-3]*RC[-11]-RC[-2]*RC[-9])/1000) -> #VALUE! | Y74: =(RC[-14]-RC[1])/RC[-18]*100 -> #VALUE! | AC74: =VALUE(RC[-27]) -> #VALUE! | AD74: =IF(RC[21]=42,"*",IF(RC[21]=32,"",RC[21])) ->  | AE74: =RC[-28] ->  | AF74: =RC[-28] ->  | AG74: =RC[-28] ->  | AH74: =RC[-28] ->  | AI74: =RC[-28] ->  | AJ74: =RC[-28] ->  | AK74: =RC[-28] ->  | AL74: =RC[-28] -> 0 | AM74: =RC[-28] ->  | AN74: =RC[-28] ->  | AO74: =RC[-28] ->  | AP74: - | AQ74: =RC[-29] ->  | AR74: =RC[-29] ->  | AS74: - | AT74: =RC[-30] -> - | AU74: =RC[-30] ->  | AV74: =RC[-30] ->  | AW74: =RC[-30] -> 
A75: =IF(RC[1]="","",DATEVALUE(RC[1])) ->  | P75: =IF(AND(ISNUMBER(RC[-3]),ISNUMBER(RC[-1])),RC[-3]-RC[-1],"-") -> - | T75: =(RC[-16]*RC[-15]-RC[-13]*RC[-12])/1000 -> #VALUE! | W75: =RC[-2]*RC[-10]/1000 -> #VALUE! | X75: =ABS((RC[-3]*RC[-11]-RC[-2]*RC[-9])/1000) -> #VALUE! | Y75: =(RC[-14]-RC[1])/RC[-18]*100 -> #VALUE! | AC75: =VALUE(RC[-27]) -> #VALUE! | AD75: =IF(RC[21]=42,"*",IF(RC[21]=32,"",RC[21])) ->  | AE75: =RC[-28] ->  | AF75: =RC[-28] ->  | AG75: =RC[-28] ->  | AH75: =RC[-28] ->  | AI75: =RC[-28] ->  | AJ75: =RC[-28] ->  | AK75: =RC[-28] ->  | AL75: =RC[-28] -> 0 | AM75: =RC[-28] ->  | AN75: =RC[-28] ->  | AO75: =RC[-28] ->  | AP75: - | AQ75: =RC[-29] ->  | AR75: =RC[-29] ->  | AS75: - | AT75: =RC[-30] -> - | AU75: =RC[-30] ->  | AV75: =RC[-30] ->  | AW75: =RC[-30] -> 
A76: =IF(RC[1]="","",DATEVALUE(RC[1])) ->  | P76: =IF(AND(ISNUMBER(RC[-3]),ISNUMBER(RC[-1])),RC[-3]-RC[-1],"-") -> - | T76: =(RC[-16]*RC[-15]-RC[-13]*RC[-12])/1000 -> #VALUE! | W76: =RC[-2]*RC[-10]/1000 -> #VALUE! | X76: =ABS((RC[-3]*RC[-11]-RC[-2]*RC[-9])/1000) -> #VALUE! | Y76: =(RC[-14]-RC[1])/RC[-18]*100 -> #VALUE! | AC76: =VALUE(RC[-27]) -> #VALUE! | AD76: =IF(RC[21]=42,"*",IF(RC[21]=32,"",RC[21])) ->  | AE76: =RC[-28] ->  | AF76: =RC[-28] ->  | AG76: =RC[-28] ->  | AH76: =RC[-28] ->  | AI76: =RC[-28] ->  | AJ76: =RC[-28] ->  | AK76: =RC[-28] ->  | AL76: =RC[-28] -> 0 | AM76: =RC[-28] ->  | AN76: =RC[-28] ->  | AO76: =RC[-28] ->  | AP76: - | AQ76: =RC[-29] ->  | AR76: =RC[-29] ->  | AS76: - | AT76: =RC[-30] -> - | AU76: =RC[-30] ->  | AV76: =RC[-30] ->  | AW76: =RC[-30] -> 
A77: =IF(RC[1]="","",DATEVALUE(RC[1])) ->  | P77: =IF(AND(ISNUMBER(RC[-3]),ISNUMBER(RC[-1])),RC[-3]-RC[-1],"-") -> - | T77: =(RC[-16]*RC[-15]-RC[-13]*RC[-12])/1000 -> #VALUE! | W77: =RC[-2]*RC[-10]/1000 -> #VALUE! | X77: =ABS((RC[-3]*RC[-11]-RC[-2]*RC[-9])/1000) -> #VALUE! | Y77: =(RC[-14]-RC[1])/RC[-18]*100 -> #VALUE! | AC77: =VALUE(RC[-27]) -> #VALUE! | AD77: =IF(RC[21]=42,"*",IF(RC[21]=32,"",RC[21])) ->  | AE77: =RC[-28] ->  | AF77: =RC[-28] ->  | AG77: =RC[-28] ->  | AH77: =RC[-28] ->  | AI77: =RC[-28] ->  | AJ77: =RC[-28] ->  | AK77: =RC[-28] ->  | AL77: =RC[-28] -> 0 | AM77: =RC[-28] ->  | AN77: =RC[-28] ->  | AO77: =RC[-28] ->  | AP77: - | AQ77: =RC[-29] ->  | AR77: =RC[-29] ->  | AS77: - | AT77: =RC[-30] -> - | AU77: =RC[-30] ->  | AV77: =RC[-30] ->  | AW77: =RC[-30] -> 
A78: =IF(RC[1]="","",DATEVALUE(RC[1])) ->  | P78: =IF(AND(ISNUMBER(RC[-3]),ISNUMBER(RC[-1])),RC[-3]-RC[-1],"-") -> - | T78: =(RC[-16]*RC[-15]-RC[-13]*RC[-12])/1000 -> #VALUE! | W78: =RC[-2]*RC[-10]/1000 -> #VALUE! | X78: =ABS((RC[-3]*RC[-11]-RC[-2]*RC[-9])/1000) -> #VALUE! | Y78: =(RC[-14]-RC[1])/RC[-18]*100 -> #VALUE! | AC78: =VALUE(RC[-27]) -> #VALUE! | AD78: =IF(RC[21]=42,"*",IF(RC[21]=32,"",RC[21])) ->  | AE78: =RC[-28] ->  | AF78: =RC[-28] ->  | AG78: =RC[-28] ->  | AH78: =RC[-28] ->  | AI78: =RC[-28] ->  | AJ78: =RC[-28] ->  | AK78: =RC[-28] ->  | AL78: =RC[-28] -> 0 | AM78: =RC[-28] ->  | AN78: =RC[-28] ->  | AO78: =RC[-28] ->  | AP78: - | AQ78: =RC[-29] ->  | AR78: =RC[-29] ->  | AS78: - | AT78: =RC[-30] -> - | AU78: =RC[-30] ->  | AV78: =RC[-30] ->  | AW78: =RC[-30] -> 
A79: =IF(RC[1]="","",DATEVALUE(RC[1])) ->  | P79: =IF(AND(ISNUMBER(RC[-3]),ISNUMBER(RC[-1])),RC[-3]-RC[-1],"-") -> - | T79: =(RC[-16]*RC[-15]-RC[-13]*RC[-12])/1000 -> #VALUE! | W79: =RC[-2]*RC[-10]/1000 -> #VALUE! | X79: =ABS((RC[-3]*RC[-11]-RC[-2]*RC[-9])/1000) -> #VALUE! | Y79: =(RC[-14]-RC[1])/RC[-18]*100 -> #VALUE! | AC79: =VALUE(RC[-27]) -> #VALUE! | AD79: =IF(RC[21]=42,"*",IF(RC[21]=32,"",RC[21])) ->  | AE79: =RC[-28] ->  | AF79: =RC[-28] ->  | AG79: =RC[-28] ->  | AH79: =RC[-28] ->  | AI79: =RC[-28] ->  | AJ79: =RC[-28] ->  | AK79: =RC[-28] ->  | AL79: =RC[-28] -> 0 | AM79: =RC[-28] ->  | AN79: =RC[-28] ->  | AO79: =RC[-28] ->  | AP79: - | AQ79: =RC[-29] ->  | AR79: =RC[-29] ->  | AS79: - | AT79: =RC[-30] -> - | AU79: =RC[-30] ->  | AV79: =RC[-30] ->  | AW79: =RC[-30] -> 
A80: =IF(RC[1]="","",DATEVALUE(RC[1])) ->  | P80: =IF(AND(ISNUMBER(RC[-3]),ISNUMBER(RC[-1])),RC[-3]-RC[-1],"-") -> - | T80: =(RC[-16]*RC[-15]-RC[-13]*RC[-12])/1000 -> #VALUE! | W80: =RC[-2]*RC[-10]/1000 -> #VALUE! | X80: =ABS((RC[-3]*RC[-11]-RC[-2]*RC[-9])/1000) -> #VALUE! | Y80: =(RC[-14]-RC[1])/RC[-18]*100 -> #VALUE! | AC80: =VALUE(RC[-27]) -> #VALUE! | AD80: =IF(RC[21]=42,"*",IF(RC[21]=32,"",RC[21])) ->  | AE80: =RC[-28] ->  | AF80: =RC[-28] ->  | AG80: =RC[-28] ->  | AH80: =RC[-28] ->  | AI80: =RC[-28] ->  | AJ80: =RC[-28] ->  | AK80: =RC[-28] ->  | AL80: =RC[-28] -> 0 | AM80: =RC[-28] ->  | AN80: =RC[-28] ->  | AO80: =RC[-28] ->  | AP80: - | AQ80: =RC[-29] ->  | AR80: =RC[-29] ->  | AS80: - | AT80: =RC[-30] -> - | AU80: =RC[-30] ->  | AV80: =RC[-30] ->  | AW80: =RC[-30] -> 
A81: =IF(RC[1]="","",DATEVALUE(RC[1])) ->  | P81: =IF(AND(ISNUMBER(RC[-3]),ISNUMBER(RC[-1])),RC[-3]-RC[-1],"-") -> - | T81: =(RC[-16]*RC[-15]-RC[-13]*RC[-12])/1000 -> #VALUE! | W81: =RC[-2]*RC[-10]/1000 -> #VALUE! | X81: =ABS((RC[-3]*RC[-11]-RC[-2]*RC[-9])/1000) -> #VALUE! | Y81: =(RC[-14]-RC[1])/RC[-18]*100 -> #VALUE! | AC81: =VALUE(RC[-27]) -> #VALUE! | AD81: =IF(RC[21]=42,"*",IF(RC[21]=32,"",RC[21])) ->  | AE81: =RC[-28] ->  | AF81: =RC[-28] ->  | AG81: =RC[-28] ->  | AH81: =RC[-28] ->  | AI81: =RC[-28] ->  | AJ81: =RC[-28] ->  | AK81: =RC[-28] ->  | AL81: =RC[-28] -> 0 | AM81: =RC[-28] ->  | AN81: =RC[-28] ->  | AO81: =RC[-28] ->  | AP81: - | AQ81: =RC[-29] ->  | AR81: =RC[-29] ->  | AS81: - | AT81: =RC[-30] -> - | AU81: =RC[-30] ->  | AV81: =RC[-30] ->  | AW81: =RC[-30] -> 
A82: =IF(RC[1]="","",DATEVALUE(RC[1])) ->  | P82: =IF(AND(ISNUMBER(RC[-3]),ISNUMBER(RC[-1])),RC[-3]-RC[-1],"-") -> - | T82: =(RC[-16]*RC[-15]-RC[-13]*RC[-12])/1000 -> #VALUE! | W82: =RC[-2]*RC[-10]/1000 -> #VALUE! | X82: =ABS((RC[-3]*RC[-11]-RC[-2]*RC[-9])/1000) -> #VALUE! | Y82: =(RC[-14]-RC[1])/RC[-18]*100 -> #VALUE! | AC82: =VALUE(RC[-27]) -> #VALUE! | AD82: =IF(RC[21]=42,"*",IF(RC[21]=32,"",RC[21])) ->  | AE82: =RC[-28] ->  | AF82: =RC[-28] ->  | AG82: =RC[-28] ->  | AH82: =RC[-28] ->  | AI82: =RC[-28] ->  | AJ82: =RC[-28] ->  | AK82: =RC[-28] ->  | AL82: =RC[-28] -> 0 | AM82: =RC[-28] ->  | AN82: =RC[-28] ->  | AO82: =RC[-28] ->  | AP82: - | AQ82: =RC[-29] ->  | AR82: =RC[-29] ->  | AS82: - | AT82: =RC[-30] -> - | AU82: =RC[-30] ->  | AV82: =RC[-30] ->  | AW82: =RC[-30] -> 
A83: =IF(RC[1]="","",DATEVALUE(RC[1])) ->  | P83: =IF(AND(ISNUMBER(RC[-3]),ISNUMBER(RC[-1])),RC[-3]-RC[-1],"-") -> - | T83: =(RC[-16]*RC[-15]-RC[-13]*RC[-12])/1000 -> #VALUE! | W83: =RC[-2]*RC[-10]/1000 -> #VALUE! | X83: =ABS((RC[-3]*RC[-11]-RC[-2]*RC[-9])/1000) -> #VALUE! | Y83: =(RC[-14]-RC[1])/RC[-18]*100 -> #VALUE! | AC83: =VALUE(RC[-27]) -> #VALUE! | AD83: =IF(RC[21]=42,"*",IF(RC[21]=32,"",RC[21])) ->  | AE83: =RC[-28] ->  | AF83: =RC[-28] ->  | AG83: =RC[-28] ->  | AH83: =RC[-28] ->  | AI83: =RC[-28] ->  | AJ83: =RC[-28] ->  | AK83: =RC[-28] ->  | AL83: =RC[-28] -> 0 | AM83: =RC[-28] ->  | AN83: =RC[-28] ->  | AO83: =RC[-28] ->  | AP83: - | AQ83: =RC[-29] ->  | AR83: =RC[-29] ->  | AS83: - | AT83: =RC[-30] -> - | AU83: =RC[-30] ->  | AV83: =RC[-30] ->  | AW83: =RC[-30] -> 
AC84: Среднее | AF84: =R[1]C[-28] -> 103.30833333333334 | AG84: =R[1]C[-28] -> 67.016666666666666 | AH84: =R[1]C[-28] -> 7.96 | AI84: =R[1]C[-28] -> 98.664999999999992 | AJ84: =R[1]C[-28] -> 44.242666666666672 | AK84: =R[1]C[-28] -> 4.946666666666669 | AL84: =R[1]C[-28] -> 22.773999999999997 | AM84: =R[1]C[-28] -> 4.6433333333333335 | AN84: =R[1]C[-28] -> 30.577666666666666 | AO84: =R[1]C[-28] -> 66.951666666666668 | AP84: - | AQ84: =R[1]C[-29] -> 25.478999999999999 | AR84: =R[1]C[-29] -> 53.639999999999986 | AS84: - | AT84: =R[1]C[-30] -> 13.311666666666666 | AU84: =R[1]C[-30] -> 5.0986666666666647
B85: Среднее | D85: =AVERAGE(OFFSET(R[-74]C,3,0,R7C1,1)) -> 103.30833333333334 | E85: =AVERAGE(OFFSET(R[-74]C,3,0,R7C1,1)) -> 67.016666666666666 | F85: =AVERAGE(OFFSET(R[-74]C,3,0,R7C1,1)) -> 7.96 | G85: =AVERAGE(OFFSET(R[-74]C,3,0,R7C1,1)) -> 98.664999999999992 | H85: =AVERAGE(OFFSET(R[-74]C,3,0,R7C1,1)) -> 44.242666666666672 | I85: =AVERAGE(OFFSET(R[-74]C,3,0,R7C1,1)) -> 4.946666666666669 | J85: =AVERAGE(OFFSET(R[-74]C,3,0,R7C1,1)) -> 22.773999999999997 | K85: =AVERAGE(OFFSET(R[-74]C,3,0,R7C1,1)) -> 4.6433333333333335 | L85: =IF(SUM(OFFSET(R[-74]C,3,0,R7C1,1))=0,"",AVERAGE(OFFSET(R[-74]C,3,0,R7C1,1))) -> 30.577666666666666 | M85: =IF(SUM(OFFSET(R[-74]C,3,0,R7C1,1))=0,"",AVERAGE(OFFSET(R[-74]C,3,0,R7C1,1))) -> 66.951666666666668 | N85: =IF(SUM(OFFSET(R[-74]C,3,0,R7C1,1))=0,"",AVERAGE(OFFSET(R[-74]C,3,0,R7C1,1))) -> 25.478999999999999 | O85: =IF(SUM(OFFSET(R[-74]C,3,0,R7C1,1))=0,"",AVERAGE(OFFSET(R[-74]C,3,0,R7C1,1))) -> 53.639999999999986 | P85: =IF(SUM(OFFSET(R[-74]C,3,0,R7C1,1))=0,"",AVERAGE(OFFSET(R[-74]C,3,0,R7C1,1))) -> 13.311666666666666 | Q85: =IF(SUM(OFFSET(R[-74]C,3,0,R7C1,1))=0,"",AVERAGE(OFFSET(R[-74]C,3,0,R7C1,1))) -> 5.0986666666666647 | R85: =IF(SUM(OFFSET(R[-74]C,3,0,R7C1,1))=0,"",AVERAGE(OFFSET(R[-74]C,3,0,R7C1,1))) -> 0.66343333333333343 | S85: =AVERAGE(OFFSET(R[-74]C,3,0,R7C1,1)) -> 2.6770666666666667 | T85: =AVERAGE(OFFSET(R[-74]C,3,0,R7C1,1)) -> 2.6636589433333331 | W85: =AVERAGE(OFFSET(R[-74]C,3,0,R7C1,1)) -> 2.0314769533333337 | X85: =AVERAGE(OFFSET(R[-74]C,3,0,R7C1,1)) -> 0.66304098000000011 | AC85: Итого | AE85: =R[1]C[-28] -> 720 | AF85: =R[1]C[-28] -> 3099.25 | AI85: =R[1]C[-28] -> 2959.95 | AM85: =R[1]C[-28] -> 139.30000000000001 | AN85: =R[1]C[-28] -> 917.32999999999993 | AQ85: =R[1]C[-29] -> 764.37 | AU85: =R[1]C[-30] -> 152.95999999999995 | AV85: =R[1]C[-30] -> 19.903000000000002 | AW85: =R[1]C[-30] -> 80.311999999999998
B86: ИТОГО: | C86: =SUM(OFFSET(R[-75]C,3,0,R7C1,1)) -> 720 | D86: =SUM(OFFSET(R[-75]C,3,0,R7C1,1)) -> 3099.25 | G86: =SUM(OFFSET(R[-75]C,3,0,R7C1,1)) -> 2959.95 | K86: =SUM(OFFSET(R[-75]C,3,0,R7C1,1)) -> 139.30000000000001 | L86: =IF(SUM(OFFSET(R[-75]C,3,0,R7C1,1))=0,"",SUM(OFFSET(R[-75]C,3,0,R7C1,1))) -> 917.32999999999993 | N86: =IF(SUM(OFFSET(R[-75]C,3,0,R7C1,1))=0,"",SUM(OFFSET(R[-75]C,3,0,R7C1,1))) -> 764.37 | Q86: =IF(SUM(OFFSET(R[-75]C,3,0,R7C1,1))=0,"",SUM(OFFSET(R[-75]C,3,0,R7C1,1))) -> 152.95999999999995 | R86: =IF(SUM(OFFSET(R[-75]C,3,0,R7C1,1))=0,"",SUM(OFFSET(R[-75]C,3,0,R7C1,1))) -> 19.903000000000002 | S86: =SUM(OFFSET(R[-75]C,3,0,R7C1,1)) -> 80.311999999999998 | T86: =SUM(OFFSET(R[-75]C,3,0,R7C1,1)) -> 79.909768299999996 | W86: =SUM(OFFSET(R[-75]C,3,0,R7C1,1)) -> 60.944308600000006 | X86: =SUM(OFFSET(R[-75]C,3,0,R7C1,1)) -> 19.891229400000004
AC87: Досчёт | AF87: =R[1]C[-28] -> 0 | AI87: =R[1]C[-28] -> 0 | AM87: =R[1]C[-28] -> 0 | AN87: =R[1]C[-28] -> 0 | AQ87: =R[1]C[-29] -> 0 | AU87: =R[1]C[-30] -> 0 | AV87: =R[1]C[-30] -> 0 | AW87: =R[1]C[-30] -> 0
A88: 11дн=264ч 4дн=96ч | B88: Досчёт до конца м-ца (+) | C88: =R6C1*24 -> 216 | T88: № 50011 | AC88: Снятие | AF88: =-R[1]C[-28] -> 0 | AI88: =-R[1]C[-28] -> 0 | AM88: =-R[1]C[-28] -> 0 | AN88: =-R[1]C[-28] -> 0 | AQ88: =-R[1]C[-29] -> 0 | AU88: =-R[1]C[-30] -> 0 | AV88: =-R[1]C[-30] -> 0 | AW88: =-R[1]C[-30] -> 0
A89: 9дн=216ч 7дн=168ч | B89: Вычет с предыдущего (-) | C89: =R4C1*24 -> 192 | AC89: Сумма | AF89: =R[1]C[-28] -> 3099.25 | AI89: =R[1]C[-28] -> 2959.95 | AM89: =R[1]C[-28] -> 139.30000000000001 | AN89: =R[1]C[-28] -> 917.32999999999993 | AQ89: =R[1]C[-29] -> 764.37 | AU89: =R[1]C[-30] -> 152.95999999999995 | AV89: =R[1]C[-30] -> 19.903000000000002 | AW89: =R[1]C[-30] -> 80.311999999999998
B90: СУММА: | C90: =R[-4]C+R[-2]C-R[-1]C -> 744 | D90: =R[-4]C+R[-2]C-R[-1]C -> 3099.25 | G90: =R[-4]C+R[-2]C-R[-1]C -> 2959.95 | K90: =R[-4]C+R[-2]C-R[-1]C -> 139.30000000000001 | L90: =IF(SUM(OFFSET(R[-79]C,3,0,R7C1,1))=0,"",(R[-4]C+R[-2]C-R[-1]C)) -> 917.32999999999993 | N90: =IF(SUM(OFFSET(R[-79]C,3,0,R7C1,1))=0,"",(R[-4]C+R[-2]C-R[-1]C)) -> 764.37 | Q90: =IF(SUM(OFFSET(R[-79]C,3,0,R7C1,1))=0,"",(R[-4]C+R[-2]C-R[-1]C)) -> 152.95999999999995 | R90: =IF(SUM(OFFSET(R[-79]C,3,0,R7C1,1))=0,"",(R[-4]C+R[-2]C-R[-1]C)) -> 19.903000000000002 | S90: =R[-4]C+R[-2]C-R[-1]C -> 80.311999999999998
AC91: Тхв на источнике | AE91: V гвс (м3) | AF91: =R[-2]C[15] -> 152.95999999999995 | AG91: W гвс (Гкал) | AH91: =RC[-2]*0.06 -> 9.1775999999999964 | AI91: W без гвс (Гкал) | AJ91: =R[-2]C[13]-RC[-2] -> 71.134399999999999
B92: Показания счетчиков на момент снятия данных:
B93: Дата, время | D93: М1, т | F93: М2, т | H93: М3, т | J93: М4, т | L93: Qо, Гкал | N93: Qг, Гкал | P93: время, час
B94: 23.09.18 03:00 | D94: 148132.44 | F94: 142341.04 | H94: 69498.3 | J94: 60776 | L94: 3292.125 | N94: 1167.4469999999999 | P94: -
B95: 23.10.18 03:00 | D95: 151244.51999999999 | F95: 145313.1 | H95: 70399.839999999997 | J95: 61532.06 | L95: 3372.681 | N95: 1187.413 | P95: -
AC97: =ZAYAVKA_N -> з.н д. №02/147-2783 от 04.10.18
B98: Представитель потребителя:_______________________________________________________________________ В.О. Топорков
I101: Рекомендуемые значения по параметрам теплопотребления (не являются официально утверждёнными)
I102: М, т | J102: V, м3 | K102: Qгвс, Гкал | L102: Qотоп, Гкал | M102: Qо, Гкал
I103: =R[-13]C[-3] -> 0 | J103: =RC[-1]/0.98 -> 0 | K103: =RC[-1]*0.06 -> 0 | L103: =RC[1]-RC[-1] -> 19.903000000000002 | M103: =R[-13]C[5] -> 19.903000000000002
O105: ДЛЯ САМОКОНТРОЛЯ
B106: В строке выбора дат указать период с 16.7.13 по 23.8.13 - жильё | N106: Q | O106: Qг
B107: В строке выбора дат указать период с 18.7.13 по 25.8.13 - не жилое | N107: =(R[-21]C[-10]*R[-22]C[-7]-R[-21]C[-9]*R[-22]C[-6])/1000 -> 305.78750124999999 | O107: =IF(R[-22]C[-2]="",R[-21]C[-3]*R[-22]C/1000,"") ->  | P107: Си2
O108: =IF(R[-23]C[-2]="","",((R[-22]C[-3]*R[-23]C)-(R[-22]C[-2]*R[-23]C[2]))/1000) -> 49.205581199999983 | P108: Си3