Sheet: Лист1
G1: Отчёт о теплопотреблении за октябрь 2018 | M1: з.н д. №02/147-2783 от 04.10.18 В данном отчете ГВС суммируется 24.09.18г, 25.09.18г некорректная работа М3
A4: =EOMONTH(R[9]C,0)-R[9]C -> 8 | B4: Потребитель: ЗАО "Сити Сервис"
A5: =MAX(R[9]C:R[78]C) -> 2018-10-22T00:00:00.000 | B5: Адрес: г. СПб, Наличная ул., д.51 ГВС+отопление
A6: =EOMONTH(R[-1]C,0)-R[-1]C -> 9 | B6: Телефон: 8-911-021-19-79
A7: =R[-2]C-R[6]C -> 30 | B7: Договор 10023-6(.)67487-67489
A8: 7 | B8: Тепловычислитель: ВКТ-7 № 181931 | L8: М2 мах= | M8: 843.36 | O8: Мгвс мах= | P8: 129.6
L9: Qотоп мах= | M9: 29.52 | O9: Qгвс мах= | P9: 7.776
B10: Расчётная формула: Q=M1*(h1-hхв)-M2*(h2-hхв)
D12: Учёт - ОТОПЛЕНИЕ | M12: Учёт - ГВС
A13: =R[1]C-1 -> 43365 | B13: Дата | C13: N, ч | D13: M1, т | E13: T1, С | F13: P1, кг/см2 | G13: M2, т | H13: T2, С | I13: P2, кг/см2 | J13: dT, гр.C | K13: M1-М2, т | L13: Qотоп, Гкал | M13: V3, м3 | N13: T3, С | O13: V4, м3 | P13: T4, С | Q13: dT, гр.C | R13: V3-V4, м3 | S13: Qгвс, Гкал | T13: Qобщ. | U13: Qo | V13: M3 | W13: M4 | X13: си4 | Y13: си5 | Z13: ТСО | AA13: Внутр. | AD13: Дата | AE13: НС | AF13: n, ч | AG13: М1, т | AH13: t1, гр. С | AI13: Р1, кгс/см2 | AJ13: М2, т | AK13: t2, гр. С | AL13: Р2, кгс/см2 | AM13: t1-t2, гр. С | AN13: М1-М2, т | AO13: Wотоп, Гкал | AP13: М1гвс, т | AQ13: t1гвс, гр. С | AR13: Р1гвс, кгс/см2 | AS13: М2гвс, т | AT13: t2гвс, гр. С | AU13: Р2гвс, кгс/см2 | AV13: t1гвс-t2гвс | AW13: М1гвс-М2гвс, т | AX13: Wгвс, Гкал | AY13: Wсумм, Гкал | BA13: NS_TV1 | BB13: НС | BC13: NS_TV2
A14: =IF(RC[1]="","",DATEVALUE(RC[1])) -> 43366 | B14: 23.09.18 | C14: 24 | D14: 0 | E14: 30.03 | F14: 7.4 | G14: 0 | H14: 28.53 | I14: 5.5 | J14: =RC[-5]-RC[-2] -> 1.5 | K14: 0 | L14: 0 | M14: 46.47 | N14: 63.09 | O14: 22.65 | P14: 62.57 | Q14: =RC[-3]-RC[-1] -> 0.52000000000000313 | R14: 69.12 | S14: 4.2729999999999997 | T14: =RC[-8]+RC[-1] -> 4.2729999999999997 | U14: =(RC[-17]*RC[-16]-RC[-14]*RC[-13])/1000 -> 0 | V14: 45.61 | W14: 22.26 | X14: =RC[-2]*RC[-10]/1000 -> 2.8775349000000001 | Y14: =(RC[-3]*RC[-11]-RC[-2]*RC[-9])/1000 -> 1.4847267 | Z14: 2013-11-23T00:00:00.000 | AA14: 2013-11-21T00:00:00.000 | AD14: =VALUE(RC[-28]) -> 2018-09-23T00:00:00.000 | AE14: =IF(RC[22]=42,"*",IF(RC[22]=32,"",RC[22])) -> - | AF14: =RC[-29] -> 24 | AG14: =RC[-29] -> 0 | AH14: =RC[-29] -> 30.03 | AI14: =RC[-29] -> 7.4 | AJ14: =RC[-29] -> 0 | AK14: =RC[-29] -> 28.53 | AL14: =RC[-29] -> 5.5 | AM14: =RC[-29] -> 1.5 | AN14: =RC[-29] -> 0 | AO14: =RC[-29] -> 0 | AP14: =RC[-29] -> 46.47 | AQ14: =RC[-29] -> 63.09 | AR14: - | AS14: =RC[-30] -> 22.65 | AT14: =RC[-30] -> 62.57 | AU14: - | AV14: =RC[-31] -> 0.52000000000000313 | AW14: =RC[-31] -> 69.12 | AX14: =RC[-31] -> 4.2729999999999997 | AY14: =RC[-31] -> 4.2729999999999997 | BA14: - | BB14: - | BC14: -
A15: =IF(RC[1]="","",DATEVALUE(RC[1])) -> 43367 | B15: 24.09.18 | C15: 24 | D15: 0 | E15: 27.62 | F15: 7.4 | G15: 0 | H15: 26.11 | I15: 5.5 | J15: =RC[-5]-RC[-2] -> 1.5100000000000016 | K15: 0 | L15: 0 | M15: 51.976666666666667 | N15: 62.556666666666672 | O15: 21.733333333333334 | P15: 63.266666666666673 | Q15: -0.71000000000000318 | R15: 73.709999999999994 | S15: 4.5436666666666667 | T15: 5.5330000000000004 | U15: =(RC[-17]*RC[-16]-RC[-14]*RC[-13])/1000 -> 0 | V15: 51.976666666666667 | W15: 22.03 | X15: =RC[-2]*RC[-10]/1000 -> 3.2514870111111112 | Y15: =(RC[-3]*RC[-11]-RC[-2]*RC[-9])/1000 -> 1.8577223444444444 | Z15: 2013-11-24T00:00:00.000 | AA15: 2013-11-22T00:00:00.000 | AD15: =VALUE(RC[-28]) -> 2018-09-24T00:00:00.000 | AE15: =IF(RC[22]=42,"*",IF(RC[22]=32,"",RC[22])) -> - | AF15: =RC[-29] -> 24 | AG15: =RC[-29] -> 0 | AH15: =RC[-29] -> 27.62 | AI15: =RC[-29] -> 7.4 | AJ15: =RC[-29] -> 0 | AK15: =RC[-29] -> 26.11 | AL15: =RC[-29] -> 5.5 | AM15: =RC[-29] -> 1.5100000000000016 | AN15: =RC[-29] -> 0 | AO15: =RC[-29] -> 0 | AP15: =RC[-29] -> 51.976666666666667 | AQ15: =RC[-29] -> 62.556666666666672 | AR15: - | AS15: =RC[-30] -> 21.733333333333334 | AT15: =RC[-30] -> 63.266666666666673 | AU15: - | AV15: =RC[-31] -> -0.71000000000000318 | AW15: =RC[-31] -> 73.709999999999994 | AX15: =RC[-31] -> 4.5436666666666667 | AY15: =RC[-31] -> 5.5330000000000004 | BA15: - | BB15: - | BC15: -
A16: =IF(RC[1]="","",DATEVALUE(RC[1])) -> 43368 | B16: 25.09.18 | C16: 24 | D16: 0 | E16: 25.4 | F16: 7.4 | G16: 0 | H16: 24.71 | I16: 5.5 | J16: =RC[-5]-RC[-2] -> 0.68999999999999773 | K16: 0 | L16: 0 | M16: =AVERAGE(R[1]C:R[3]C) -> 51.976666666666667 | N16: =AVERAGE(R[1]C:R[3]C) -> 62.556666666666672 | O16: =AVERAGE(R[1]C:R[3]C) -> 21.733333333333334 | P16: =AVERAGE(R[1]C:R[3]C) -> 63.266666666666673 | Q16: =AVERAGE(R[1]C:R[3]C) -> -0.71000000000000318 | R16: =AVERAGE(R[1]C:R[3]C) -> 73.709999999999994 | S16: =AVERAGE(R[1]C:R[3]C) -> 4.5436666666666667 | T16: =AVERAGE(R[1]C:R[3]C) -> 5.5330000000000004 | U16: =(RC[-17]*RC[-16]-RC[-14]*RC[-13])/1000 -> 0 | V16: 51.976666666666667 | W16: 24.54 | X16: =RC[-2]*RC[-10]/1000 -> 3.2514870111111112 | Y16: =(RC[-3]*RC[-11]-RC[-2]*RC[-9])/1000 -> 1.6989230111111113 | Z16: 2013-11-25T00:00:00.000 | AA16: 2013-11-23T00:00:00.000 | AD16: =VALUE(RC[-28]) -> 2018-09-25T00:00:00.000 | AE16: =IF(RC[22]=42,"*",IF(RC[22]=32,"",RC[22])) -> - | AF16: =RC[-29] -> 24 | AG16: =RC[-29] -> 0 | AH16: =RC[-29] -> 25.4 | AI16: =RC[-29] -> 7.4 | AJ16: =RC[-29] -> 0 | AK16: =RC[-29] -> 24.71 | AL16: =RC[-29] -> 5.5 | AM16: =RC[-29] -> 0.68999999999999773 | AN16: =RC[-29] -> 0 | AO16: =RC[-29] -> 0 | AP16: =RC[-29] -> 51.976666666666667 | AQ16: =RC[-29] -> 62.556666666666672 | AR16: - | AS16: =RC[-30] -> 21.733333333333334 | AT16: =RC[-30] -> 63.266666666666673 | AU16: - | AV16: =RC[-31] -> -0.71000000000000318 | AW16: =RC[-31] -> 73.709999999999994 | AX16: =RC[-31] -> 4.5436666666666667 | AY16: =RC[-31] -> 5.5330000000000004 | BA16: - | BB16: - | BC16: -
A17: =IF(RC[1]="","",DATEVALUE(RC[1])) -> 43369 | B17: 26.09.18 | C17: 24 | D17: 0 | E17: 25.84 | F17: 7.4 | G17: 0 | H17: 24.18 | I17: 5.5 | J17: =RC[-5]-RC[-2] -> 1.6600000000000001 | K17: 0 | L17: 0 | M17: 52.38 | N17: 62.96 | O17: 20.190000000000001 | P17: 63.88 | Q17: =RC[-3]-RC[-1] -> -0.92000000000000171 | R17: 72.569999999999993 | S17: 4.5090000000000003 | T17: =RC[-8]+RC[-1] -> 4.5090000000000003 | U17: =(RC[-17]*RC[-16]-RC[-14]*RC[-13])/1000 -> 0 | V17: 51.42 | W17: 19.829999999999998 | X17: =RC[-2]*RC[-10]/1000 -> 3.2374032000000001 | Y17: =(RC[-3]*RC[-11]-RC[-2]*RC[-9])/1000 -> 1.9706628000000004 | Z17: 2013-11-26T00:00:00.000 | AA17: 2013-11-24T00:00:00.000 | AD17: =VALUE(RC[-28]) -> 2018-09-26T00:00:00.000 | AE17: =IF(RC[22]=42,"*",IF(RC[22]=32,"",RC[22])) -> - | AF17: =RC[-29] -> 24 | AG17: =RC[-29] -> 0 | AH17: =RC[-29] -> 25.84 | AI17: =RC[-29] -> 7.4 | AJ17: =RC[-29] -> 0 | AK17: =RC[-29] -> 24.18 | AL17: =RC[-29] -> 5.5 | AM17: =RC[-29] -> 1.6600000000000001 | AN17: =RC[-29] -> 0 | AO17: =RC[-29] -> 0 | AP17: =RC[-29] -> 52.38 | AQ17: =RC[-29] -> 62.96 | AR17: - | AS17: =RC[-30] -> 20.190000000000001 | AT17: =RC[-30] -> 63.88 | AU17: - | AV17: =RC[-31] -> -0.92000000000000171 | AW17: =RC[-31] -> 72.569999999999993 | AX17: =RC[-31] -> 4.5090000000000003 | AY17: =RC[-31] -> 4.5090000000000003 | BA17: - | BB17: - | BC17: -
A18: =IF(RC[1]="","",DATEVALUE(RC[1])) -> 43370 | B18: 27.09.18 | C18: 24 | D18: 1.2 | E18: 24.43 | F18: 7.4 | G18: 8.66 | H18: 49.14 | I18: 5.5 | J18: =RC[-5]-RC[-2] -> -24.71 | K18: -7.46 | L18: 5.3999999999999999E-2 | M18: 53.47 | N18: 60.12 | O18: 22.9 | P18: 60.52 | Q18: =RC[-3]-RC[-1] -> -0.40000000000000568 | R18: 76.37 | S18: 4.5270000000000001 | T18: =RC[-8]+RC[-1] -> 4.5810000000000004 | U18: =(RC[-17]*RC[-16]-RC[-14]*RC[-13])/1000 -> -0.39623640000000004 | V18: 52.6 | W18: 22.52 | X18: =RC[-2]*RC[-10]/1000 -> 3.162312 | Y18: =(RC[-3]*RC[-11]-RC[-2]*RC[-9])/1000 -> 1.7994015999999999 | Z18: 2013-11-27T00:00:00.000 | AA18: 2013-11-25T00:00:00.000 | AD18: =VALUE(RC[-28]) -> 2018-09-27T00:00:00.000 | AE18: =IF(RC[22]=42,"*",IF(RC[22]=32,"",RC[22])) -> - | AF18: =RC[-29] -> 24 | AG18: =RC[-29] -> 1.2 | AH18: =RC[-29] -> 24.43 | AI18: =RC[-29] -> 7.4 | AJ18: =RC[-29] -> 8.66 | AK18: =RC[-29] -> 49.14 | AL18: =RC[-29] -> 5.5 | AM18: =RC[-29] -> -24.71 | AN18: =RC[-29] -> -7.46 | AO18: =RC[-29] -> 5.3999999999999999E-2 | AP18: =RC[-29] -> 53.47 | AQ18: =RC[-29] -> 60.12 | AR18: - | AS18: =RC[-30] -> 22.9 | AT18: =RC[-30] -> 60.52 | AU18: - | AV18: =RC[-31] -> -0.40000000000000568 | AW18: =RC[-31] -> 76.37 | AX18: =RC[-31] -> 4.5270000000000001 | AY18: =RC[-31] -> 4.5810000000000004 | BA18: - | BB18: - | BC18: -
A19: =IF(RC[1]="","",DATEVALUE(RC[1])) -> 43371 | B19: 28.09.18 | C19: 24 | D19: 252.38 | E19: 49.27 | F19: 7.4 | G19: 248.79 | H19: 38.28 | I19: 5.5 | J19: =RC[-5]-RC[-2] -> 10.990000000000002 | K19: 3.59 | L19: 2.9140000000000001 | M19: 50.08 | N19: 64.59 | O19: 22.11 | P19: 65.400000000000006 | Q19: =RC[-3]-RC[-1] -> -0.81000000000000227 | R19: 72.19 | S19: 4.5949999999999998 | T19: =RC[-8]+RC[-1] -> 7.5090000000000003 | U19: =(RC[-17]*RC[-16]-RC[-14]*RC[-13])/1000 -> 2.9110814000000009 | V19: 49.15 | W19: 21.68 | X19: =RC[-2]*RC[-10]/1000 -> 3.1745985000000001 | Y19: =(RC[-3]*RC[-11]-RC[-2]*RC[-9])/1000 -> 1.7567265000000001 | Z19: 2013-11-28T00:00:00.000 | AA19: 2013-11-26T00:00:00.000 | AD19: =VALUE(RC[-28]) -> 2018-09-28T00:00:00.000 | AE19: =IF(RC[22]=42,"*",IF(RC[22]=32,"",RC[22])) -> - | AF19: =RC[-29] -> 24 | AG19: =RC[-29] -> 252.38 | AH19: =RC[-29] -> 49.27 | AI19: =RC[-29] -> 7.4 | AJ19: =RC[-29] -> 248.79 | AK19: =RC[-29] -> 38.28 | AL19: =RC[-29] -> 5.5 | AM19: =RC[-29] -> 10.990000000000002 | AN19: =RC[-29] -> 3.59 | AO19: =RC[-29] -> 2.9140000000000001 | AP19: =RC[-29] -> 50.08 | AQ19: =RC[-29] -> 64.59 | AR19: - | AS19: =RC[-30] -> 22.11 | AT19: =RC[-30] -> 65.400000000000006 | AU19: - | AV19: =RC[-31] -> -0.81000000000000227 | AW19: =RC[-31] -> 72.19 | AX19: =RC[-31] -> 4.5949999999999998 | AY19: =RC[-31] -> 7.5090000000000003 | BA19: - | BB19: - | BC19: -
A20: =IF(RC[1]="","",DATEVALUE(RC[1])) -> 43372 | B20: 29.09.18 | C20: 24 | D20: 643.91999999999996 | E20: 47.17 | F20: 7.4 | G20: 637.52 | H20: 37.799999999999997 | I20: 5.5 | J20: =RC[-5]-RC[-2] -> 9.3700000000000045 | K20: 6.3999999999999799 | L20: 6.2869999999999999 | M20: 52.52 | N20: 64.459999999999994 | O20: 23.49 | P20: 65.56 | Q20: =RC[-3]-RC[-1] -> -1.1000000000000085 | R20: 76.010000000000005 | S20: 4.8369999999999997 | T20: =RC[-8]+RC[-1] -> 11.123999999999999 | U20: =(RC[-17]*RC[-16]-RC[-14]*RC[-13])/1000 -> 6.2754504000000013 | V20: 51.54 | W20: 23.05 | X20: =RC[-2]*RC[-10]/1000 -> 3.3222683999999996 | Y20: =(RC[-3]*RC[-11]-RC[-2]*RC[-9])/1000 -> 1.8111103999999993 | Z20: 2013-11-29T00:00:00.000 | AA20: 2013-11-27T00:00:00.000 | AD20: =VALUE(RC[-28]) -> 2018-09-29T00:00:00.000 | AE20: =IF(RC[22]=42,"*",IF(RC[22]=32,"",RC[22])) -> - | AF20: =RC[-29] -> 24 | AG20: =RC[-29] -> 643.91999999999996 | AH20: =RC[-29] -> 47.17 | AI20: =RC[-29] -> 7.4 | AJ20: =RC[-29] -> 637.52 | AK20: =RC[-29] -> 37.799999999999997 | AL20: =RC[-29] -> 5.5 | AM20: =RC[-29] -> 9.3700000000000045 | AN20: =RC[-29] -> 6.3999999999999799 | AO20: =RC[-29] -> 6.2869999999999999 | AP20: =RC[-29] -> 52.52 | AQ20: =RC[-29] -> 64.459999999999994 | AR20: - | AS20: =RC[-30] -> 23.49 | AT20: =RC[-30] -> 65.56 | AU20: - | AV20: =RC[-31] -> -1.1000000000000085 | AW20: =RC[-31] -> 76.010000000000005 | AX20: =RC[-31] -> 4.8369999999999997 | AY20: =RC[-31] -> 11.123999999999999 | BA20: - | BB20: - | BC20: -
A21: =IF(RC[1]="","",DATEVALUE(RC[1])) -> 43373 | B21: 30.09.18 | C21: 24 | D21: 658.56 | E21: 48.3 | F21: 7.4 | G21: 652.54 | H21: 38.770000000000003 | I21: 5.5 | J21: =RC[-5]-RC[-2] -> 9.529999999999994 | K21: 6.01999999999998 | L21: 6.5229999999999997 | M21: 58.44 | N21: 67.05 | O21: 22.17 | P21: 68.400000000000006 | Q21: =RC[-3]-RC[-1] -> -1.3500000000000085 | R21: 80.61 | S21: 5.327 | T21: =RC[-8]+RC[-1] -> 11.85 | U21: =(RC[-17]*RC[-16]-RC[-14]*RC[-13])/1000 -> 6.5094721999999967 | V21: 57.26 | W21: 21.71 | X21: =RC[-2]*RC[-10]/1000 -> 3.839283 | Y21: =(RC[-3]*RC[-11]-RC[-2]*RC[-9])/1000 -> 2.3543189999999994 | Z21: 2013-11-30T00:00:00.000 | AA21: 2013-11-28T00:00:00.000 | AD21: =VALUE(RC[-28]) -> 2018-09-30T00:00:00.000 | AE21: =IF(RC[22]=42,"*",IF(RC[22]=32,"",RC[22])) -> - | AF21: =RC[-29] -> 24 | AG21: =RC[-29] -> 658.56 | AH21: =RC[-29] -> 48.3 | AI21: =RC[-29] -> 7.4 | AJ21: =RC[-29] -> 652.54 | AK21: =RC[-29] -> 38.770000000000003 | AL21: =RC[-29] -> 5.5 | AM21: =RC[-29] -> 9.529999999999994 | AN21: =RC[-29] -> 6.01999999999998 | AO21: =RC[-29] -> 6.5229999999999997 | AP21: =RC[-29] -> 58.44 | AQ21: =RC[-29] -> 67.05 | AR21: - | AS21: =RC[-30] -> 22.17 | AT21: =RC[-30] -> 68.400000000000006 | AU21: - | AV21: =RC[-31] -> -1.3500000000000085 | AW21: =RC[-31] -> 80.61 | AX21: =RC[-31] -> 5.327 | AY21: =RC[-31] -> 11.85 | BA21: - | BB21: - | BC21: -
A22: =IF(RC[1]="","",DATEVALUE(RC[1])) -> 43374 | B22: 01.10.18 | C22: 24 | D22: 621.91 | E22: 47.29 | F22: 7.4 | G22: 615.74 | H22: 38.44 | I22: 5.5 | J22: =RC[-5]-RC[-2] -> 8.8500000000000014 | K22: 6.16999999999996 | L22: 5.7569999999999997 | M22: 49.74 | N22: 65.28 | O22: 20.329999999999998 | P22: 66.22 | Q22: =RC[-3]-RC[-1] -> -0.93999999999999773 | R22: 70.069999999999993 | S22: 4.508 | T22: =RC[-8]+RC[-1] -> 10.265000000000001 | U22: =(RC[-17]*RC[-16]-RC[-14]*RC[-13])/1000 -> 5.7410783000000007 | V22: 48.79 | W22: 19.95 | X22: =RC[-2]*RC[-10]/1000 -> 3.1850111999999999 | Y22: =(RC[-3]*RC[-11]-RC[-2]*RC[-9])/1000 -> 1.8639222 | Z22: 2013-12-01T00:00:00.000 | AA22: 2013-11-29T00:00:00.000 | AD22: =VALUE(RC[-28]) -> 2018-10-01T00:00:00.000 | AE22: =IF(RC[22]=42,"*",IF(RC[22]=32,"",RC[22])) -> - | AF22: =RC[-29] -> 24 | AG22: =RC[-29] -> 621.91 | AH22: =RC[-29] -> 47.29 | AI22: =RC[-29] -> 7.4 | AJ22: =RC[-29] -> 615.74 | AK22: =RC[-29] -> 38.44 | AL22: =RC[-29] -> 5.5 | AM22: =RC[-29] -> 8.8500000000000014 | AN22: =RC[-29] -> 6.16999999999996 | AO22: =RC[-29] -> 5.7569999999999997 | AP22: =RC[-29] -> 49.74 | AQ22: =RC[-29] -> 65.28 | AR22: - | AS22: =RC[-30] -> 20.329999999999998 | AT22: =RC[-30] -> 66.22 | AU22: - | AV22: =RC[-31] -> -0.93999999999999773 | AW22: =RC[-31] -> 70.069999999999993 | AX22: =RC[-31] -> 4.508 | AY22: =RC[-31] -> 10.265000000000001 | BA22: - | BB22: - | BC22: -
A23: =IF(RC[1]="","",DATEVALUE(RC[1])) -> 43375 | B23: 02.10.18 | C23: 24 | D23: 691.26 | E23: 46.37 | F23: 7.4 | G23: 684.29 | H23: 38.26 | I23: 5.5 | J23: =RC[-5]-RC[-2] -> 8.11 | K23: 6.9700000000000299 | L23: 5.8890000000000002 | M23: 49.42 | N23: 64.39 | O23: 20 | P23: 65.25 | Q23: =RC[-3]-RC[-1] -> -0.85999999999999943 | R23: 69.42 | S23: 4.4059999999999997 | T23: =RC[-8]+RC[-1] -> 10.295 | U23: =(RC[-17]*RC[-16]-RC[-14]*RC[-13])/1000 -> 5.8727907999999989 | V23: 48.52 | W23: 19.62 | X23: =RC[-2]*RC[-10]/1000 -> 3.1242027999999999 | Y23: =(RC[-3]*RC[-11]-RC[-2]*RC[-9])/1000 -> 1.8439977999999999 | Z23: 2013-12-02T00:00:00.000 | AA23: 2013-11-30T00:00:00.000 | AD23: =VALUE(RC[-28]) -> 2018-10-02T00:00:00.000 | AE23: =IF(RC[22]=42,"*",IF(RC[22]=32,"",RC[22])) -> - | AF23: =RC[-29] -> 24 | AG23: =RC[-29] -> 691.26 | AH23: =RC[-29] -> 46.37 | AI23: =RC[-29] -> 7.4 | AJ23: =RC[-29] -> 684.29 | AK23: =RC[-29] -> 38.26 | AL23: =RC[-29] -> 5.5 | AM23: =RC[-29] -> 8.11 | AN23: =RC[-29] -> 6.9700000000000299 | AO23: =RC[-29] -> 5.8890000000000002 | AP23: =RC[-29] -> 49.42 | AQ23: =RC[-29] -> 64.39 | AR23: - | AS23: =RC[-30] -> 20 | AT23: =RC[-30] -> 65.25 | AU23: - | AV23: =RC[-31] -> -0.85999999999999943 | AW23: =RC[-31] -> 69.42 | AX23: =RC[-31] -> 4.4059999999999997 | AY23: =RC[-31] -> 10.295 | BA23: - | BB23: - | BC23: -
A24: =IF(RC[1]="","",DATEVALUE(RC[1])) -> 43376 | B24: 03.10.18 | C24: 24 | D24: 695.66 | E24: 47.74 | F24: 7.4 | G24: 687.53 | H24: 39 | I24: 5.5 | J24: =RC[-5]-RC[-2] -> 8.740000000000002 | K24: 8.1300000000000008 | L24: 6.41 | M24: 51.01 | N24: 64.599999999999994 | O24: 19.079999999999998 | P24: 65.290000000000006 | Q24: =RC[-3]-RC[-1] -> -0.69000000000001194 | R24: 70.09 | S24: 4.46 | T24: =RC[-8]+RC[-1] -> 10.870000000000001 | U24: =(RC[-17]*RC[-16]-RC[-14]*RC[-13])/1000 -> 6.3971384000000038 | V24: 50.06 | W24: 18.71 | X24: =RC[-2]*RC[-10]/1000 -> 3.2338759999999995 | Y24: =(RC[-3]*RC[-11]-RC[-2]*RC[-9])/1000 -> 2.0123000999999996 | Z24: 2013-12-03T00:00:00.000 | AA24: 2013-12-01T00:00:00.000 | AD24: =VALUE(RC[-28]) -> 2018-10-03T00:00:00.000 | AE24: =IF(RC[22]=42,"*",IF(RC[22]=32,"",RC[22])) -> - | AF24: =RC[-29] -> 24 | AG24: =RC[-29] -> 695.66 | AH24: =RC[-29] -> 47.74 | AI24: =RC[-29] -> 7.4 | AJ24: =RC[-29] -> 687.53 | AK24: =RC[-29] -> 39 | AL24: =RC[-29] -> 5.5 | AM24: =RC[-29] -> 8.740000000000002 | AN24: =RC[-29] -> 8.1300000000000008 | AO24: =RC[-29] -> 6.41 | AP24: =RC[-29] -> 51.01 | AQ24: =RC[-29] -> 64.599999999999994 | AR24: - | AS24: =RC[-30] -> 19.079999999999998 | AT24: =RC[-30] -> 65.290000000000006 | AU24: - | AV24: =RC[-31] -> -0.69000000000001194 | AW24: =RC[-31] -> 70.09 | AX24: =RC[-31] -> 4.46 | AY24: =RC[-31] -> 10.870000000000001 | BA24: - | BB24: - | BC24: -
A25: =IF(RC[1]="","",DATEVALUE(RC[1])) -> 43377 | B25: 04.10.18 | C25: 24 | D25: 704.38 | E25: 47.74 | F25: 7.4 | G25: 695.93 | H25: 38.92 | I25: 5.5 | J25: =RC[-5]-RC[-2] -> 8.82 | K25: 8.4500000000000508 | L25: 6.5579999999999998 | M25: 51.02 | N25: 64.13 | O25: 20.440000000000001 | P25: 64.7 | Q25: =RC[-3]-RC[-1] -> -0.57000000000000739 | R25: 71.459999999999994 | S25: 4.5110000000000001 | T25: =RC[-8]+RC[-1] -> 11.068999999999999 | U25: =(RC[-17]*RC[-16]-RC[-14]*RC[-13])/1000 -> 6.5415056000000043 | V25: 50.06 | W25: 20.059999999999999 | X25: =RC[-2]*RC[-10]/1000 -> 3.2103478000000001 | Y25: =(RC[-3]*RC[-11]-RC[-2]*RC[-9])/1000 -> 1.9124657999999999 | Z25: 2013-12-04T00:00:00.000 | AA25: 2013-12-02T00:00:00.000 | AD25: =VALUE(RC[-28]) -> 2018-10-04T00:00:00.000 | AE25: =IF(RC[22]=42,"*",IF(RC[22]=32,"",RC[22])) -> - | AF25: =RC[-29] -> 24 | AG25: =RC[-29] -> 704.38 | AH25: =RC[-29] -> 47.74 | AI25: =RC[-29] -> 7.4 | AJ25: =RC[-29] -> 695.93 | AK25: =RC[-29] -> 38.92 | AL25: =RC[-29] -> 5.5 | AM25: =RC[-29] -> 8.82 | AN25: =RC[-29] -> 8.4500000000000508 | AO25: =RC[-29] -> 6.5579999999999998 | AP25: =RC[-29] -> 51.02 | AQ25: =RC[-29] -> 64.13 | AR25: - | AS25: =RC[-30] -> 20.440000000000001 | AT25: =RC[-30] -> 64.7 | AU25: - | AV25: =RC[-31] -> -0.57000000000000739 | AW25: =RC[-31] -> 71.459999999999994 | AX25: =RC[-31] -> 4.5110000000000001 | AY25: =RC[-31] -> 11.068999999999999 | BA25: - | BB25: - | BC25: -
A26: =IF(RC[1]="","",DATEVALUE(RC[1])) -> 43378 | B26: 05.10.18 | C26: 24 | D26: 676.62 | E26: 48.98 | F26: 7.4 | G26: 668.2 | H26: 39.369999999999997 | I26: 5.5 | J26: =RC[-5]-RC[-2] -> 9.61 | K26: 8.4199999999999608 | L26: 6.8520000000000003 | M26: 48.32 | N26: 63.4 | O26: 20.399999999999999 | P26: 64.239999999999995 | Q26: =RC[-3]-RC[-1] -> -0.83999999999999631 | R26: 68.72 | S26: 4.2969999999999997 | T26: =RC[-8]+RC[-1] -> 11.149000000000001 | U26: =(RC[-17]*RC[-16]-RC[-14]*RC[-13])/1000 -> 6.8338136000000009 | V26: 47.44 | W26: 20 | X26: =RC[-2]*RC[-10]/1000 -> 3.0076959999999997 | Y26: =(RC[-3]*RC[-11]-RC[-2]*RC[-9])/1000 -> 1.722896 | Z26: 2013-12-05T00:00:00.000 | AA26: 2013-12-03T00:00:00.000 | AD26: =VALUE(RC[-28]) -> 2018-10-05T00:00:00.000 | AE26: =IF(RC[22]=42,"*",IF(RC[22]=32,"",RC[22])) -> - | AF26: =RC[-29] -> 24 | AG26: =RC[-29] -> 676.62 | AH26: =RC[-29] -> 48.98 | AI26: =RC[-29] -> 7.4 | AJ26: =RC[-29] -> 668.2 | AK26: =RC[-29] -> 39.369999999999997 | AL26: =RC[-29] -> 5.5 | AM26: =RC[-29] -> 9.61 | AN26: =RC[-29] -> 8.4199999999999608 | AO26: =RC[-29] -> 6.8520000000000003 | AP26: =RC[-29] -> 48.32 | AQ26: =RC[-29] -> 63.4 | AR26: - | AS26: =RC[-30] -> 20.399999999999999 | AT26: =RC[-30] -> 64.239999999999995 | AU26: - | AV26: =RC[-31] -> -0.83999999999999631 | AW26: =RC[-31] -> 68.72 | AX26: =RC[-31] -> 4.2969999999999997 | AY26: =RC[-31] -> 11.149000000000001 | BA26: - | BB26: - | BC26: -
A27: =IF(RC[1]="","",DATEVALUE(RC[1])) -> 43379 | B27: 06.10.18 | C27: 24 | D27: 697.59 | E27: 47.49 | F27: 7.4 | G27: 688.78 | H27: 38.950000000000003 | I27: 5.5 | J27: =RC[-5]-RC[-2] -> 8.5399999999999991 | K27: 8.8100000000000591 | L27: 6.3109999999999999 | M27: 56.83 | N27: 64.7 | O27: 24.08 | P27: 65.34 | Q27: =RC[-3]-RC[-1] -> -0.64000000000000057 | R27: 80.91 | S27: 5.1550000000000002 | T27: =RC[-8]+RC[-1] -> 11.466000000000001 | U27: =(RC[-17]*RC[-16]-RC[-14]*RC[-13])/1000 -> 6.300568100000004 | V27: 55.74 | W27: 23.62 | X27: =RC[-2]*RC[-10]/1000 -> 3.6063780000000003 | Y27: =(RC[-3]*RC[-11]-RC[-2]*RC[-9])/1000 -> 2.0630472000000002 | Z27: 2013-12-06T00:00:00.000 | AA27: 2013-12-04T00:00:00.000 | AD27: =VALUE(RC[-28]) -> 2018-10-06T00:00:00.000 | AE27: =IF(RC[22]=42,"*",IF(RC[22]=32,"",RC[22])) -> - | AF27: =RC[-29] -> 24 | AG27: =RC[-29] -> 697.59 | AH27: =RC[-29] -> 47.49 | AI27: =RC[-29] -> 7.4 | AJ27: =RC[-29] -> 688.78 | AK27: =RC[-29] -> 38.950000000000003 | AL27: =RC[-29] -> 5.5 | AM27: =RC[-29] -> 8.5399999999999991 | AN27: =RC[-29] -> 8.8100000000000591 | AO27: =RC[-29] -> 6.3109999999999999 | AP27: =RC[-29] -> 56.83 | AQ27: =RC[-29] -> 64.7 | AR27: - | AS27: =RC[-30] -> 24.08 | AT27: =RC[-30] -> 65.34 | AU27: - | AV27: =RC[-31] -> -0.64000000000000057 | AW27: =RC[-31] -> 80.91 | AX27: =RC[-31] -> 5.1550000000000002 | AY27: =RC[-31] -> 11.466000000000001 | BA27: - | BB27: - | BC27: -
A28: =IF(RC[1]="","",DATEVALUE(RC[1])) -> 43380 | B28: 07.10.18 | C28: 24 | D28: 695.1 | E28: 47.82 | F28: 7.4 | G28: 686.35 | H28: 39.020000000000003 | I28: 5.5 | J28: =RC[-5]-RC[-2] -> 8.7999999999999972 | K28: 8.75 | L28: 6.4770000000000003 | M28: 59.38 | N28: 64.78 | O28: 24.11 | P28: 65.62 | Q28: =RC[-3]-RC[-1] -> -0.84000000000000341 | R28: 83.49 | S28: 5.3259999999999996 | T28: =RC[-8]+RC[-1] -> 11.803000000000001 | U28: =(RC[-17]*RC[-16]-RC[-14]*RC[-13])/1000 -> 6.4583049999999966 | V28: 58.25 | W28: 23.64 | X28: =RC[-2]*RC[-10]/1000 -> 3.7734350000000001 | Y28: =(RC[-3]*RC[-11]-RC[-2]*RC[-9])/1000 -> 2.2221781999999997 | Z28: 2013-12-07T00:00:00.000 | AA28: 2013-12-05T00:00:00.000 | AD28: =VALUE(RC[-28]) -> 2018-10-07T00:00:00.000 | AE28: =IF(RC[22]=42,"*",IF(RC[22]=32,"",RC[22])) -> - | AF28: =RC[-29] -> 24 | AG28: =RC[-29] -> 695.1 | AH28: =RC[-29] -> 47.82 | AI28: =RC[-29] -> 7.4 | AJ28: =RC[-29] -> 686.35 | AK28: =RC[-29] -> 39.020000000000003 | AL28: =RC[-29] -> 5.5 | AM28: =RC[-29] -> 8.7999999999999972 | AN28: =RC[-29] -> 8.75 | AO28: =RC[-29] -> 6.4770000000000003 | AP28: =RC[-29] -> 59.38 | AQ28: =RC[-29] -> 64.78 | AR28: - | AS28: =RC[-30] -> 24.11 | AT28: =RC[-30] -> 65.62 | AU28: - | AV28: =RC[-31] -> -0.84000000000000341 | AW28: =RC[-31] -> 83.49 | AX28: =RC[-31] -> 5.3259999999999996 | AY28: =RC[-31] -> 11.803000000000001 | BA28: - | BB28: - | BC28: -
A29: =IF(RC[1]="","",DATEVALUE(RC[1])) -> 43381 | B29: 08.10.18 | C29: 24 | D29: 705.52 | E29: 46.62 | F29: 7.4 | G29: 696.73 | H29: 38.270000000000003 | I29: 5.5 | J29: =RC[-5]-RC[-2] -> 8.3499999999999943 | K29: 8.7899999999999601 | L29: 6.2409999999999997 | M29: 53.82 | N29: 64.36 | O29: 20.86 | P29: 65.33 | Q29: =RC[-3]-RC[-1] -> -0.96999999999999886 | R29: 74.680000000000007 | S29: 4.7380000000000004 | T29: =RC[-8]+RC[-1] -> 10.978999999999999 | U29: =(RC[-17]*RC[-16]-RC[-14]*RC[-13])/1000 -> 6.2274852999999926 | V29: 52.81 | W29: 20.46 | X29: =RC[-2]*RC[-10]/1000 -> 3.3988516 | Y29: =(RC[-3]*RC[-11]-RC[-2]*RC[-9])/1000 -> 2.0621997999999997 | Z29: 2013-12-08T00:00:00.000 | AA29: 2013-12-06T00:00:00.000 | AD29: =VALUE(RC[-28]) -> 2018-10-08T00:00:00.000 | AE29: =IF(RC[22]=42,"*",IF(RC[22]=32,"",RC[22])) -> - | AF29: =RC[-29] -> 24 | AG29: =RC[-29] -> 705.52 | AH29: =RC[-29] -> 46.62 | AI29: =RC[-29] -> 7.4 | AJ29: =RC[-29] -> 696.73 | AK29: =RC[-29] -> 38.270000000000003 | AL29: =RC[-29] -> 5.5 | AM29: =RC[-29] -> 8.3499999999999943 | AN29: =RC[-29] -> 8.7899999999999601 | AO29: =RC[-29] -> 6.2409999999999997 | AP29: =RC[-29] -> 53.82 | AQ29: =RC[-29] -> 64.36 | AR29: - | AS29: =RC[-30] -> 20.86 | AT29: =RC[-30] -> 65.33 | AU29: - | AV29: =RC[-31] -> -0.96999999999999886 | AW29: =RC[-31] -> 74.680000000000007 | AX29: =RC[-31] -> 4.7380000000000004 | AY29: =RC[-31] -> 10.978999999999999 | BA29: - | BB29: - | BC29: -
A30: =IF(RC[1]="","",DATEVALUE(RC[1])) -> 43382 | B30: 09.10.18 | C30: 24 | D30: 695.45 | E30: 46.49 | F30: 7.4 | G30: 686.82 | H30: 38.19 | I30: 5.5 | J30: =RC[-5]-RC[-2] -> 8.3000000000000043 | K30: 8.6300000000000008 | L30: 6.117 | M30: 49.42 | N30: 64.36 | O30: 20.22 | P30: 65.150000000000006 | Q30: =RC[-3]-RC[-1] -> -0.79000000000000625 | R30: 69.64 | S30: 4.4160000000000004 | T30: =RC[-8]+RC[-1] -> 10.533000000000001 | U30: =(RC[-17]*RC[-16]-RC[-14]*RC[-13])/1000 -> 6.1018147000000029 | V30: 48.51 | W30: 19.829999999999998 | X30: =RC[-2]*RC[-10]/1000 -> 3.1221036 | Y30: =(RC[-3]*RC[-11]-RC[-2]*RC[-9])/1000 -> 1.8301790999999998 | Z30: 2013-12-09T00:00:00.000 | AA30: 2013-12-07T00:00:00.000 | AD30: =VALUE(RC[-28]) -> 2018-10-09T00:00:00.000 | AE30: =IF(RC[22]=42,"*",IF(RC[22]=32,"",RC[22])) -> - | AF30: =RC[-29] -> 24 | AG30: =RC[-29] -> 695.45 | AH30: =RC[-29] -> 46.49 | AI30: =RC[-29] -> 7.4 | AJ30: =RC[-29] -> 686.82 | AK30: =RC[-29] -> 38.19 | AL30: =RC[-29] -> 5.5 | AM30: =RC[-29] -> 8.3000000000000043 | AN30: =RC[-29] -> 8.6300000000000008 | AO30: =RC[-29] -> 6.117 | AP30: =RC[-29] -> 49.42 | AQ30: =RC[-29] -> 64.36 | AR30: - | AS30: =RC[-30] -> 20.22 | AT30: =RC[-30] -> 65.150000000000006 | AU30: - | AV30: =RC[-31] -> -0.79000000000000625 | AW30: =RC[-31] -> 69.64 | AX30: =RC[-31] -> 4.4160000000000004 | AY30: =RC[-31] -> 10.533000000000001 | BA30: - | BB30: - | BC30: -
A31: =IF(RC[1]="","",DATEVALUE(RC[1])) -> 43383 | B31: 10.10.18 | C31: 24 | D31: 705.36 | E31: 46.6 | F31: 7.4 | G31: 696.46 | H31: 38.53 | I31: 5.5 | J31: =RC[-5]-RC[-2] -> 8.07 | K31: 8.8999999999999808 | L31: 6.0529999999999999 | M31: 47.44 | N31: 65.319999999999993 | O31: 20.37 | P31: 66.05 | Q31: =RC[-3]-RC[-1] -> -0.73000000000000398 | R31: 67.81 | S31: 4.3620000000000001 | T31: =RC[-8]+RC[-1] -> 10.414999999999999 | U31: =(RC[-17]*RC[-16]-RC[-14]*RC[-13])/1000 -> 6.0351721999999972 | V31: 46.52 | W31: 19.98 | X31: =RC[-2]*RC[-10]/1000 -> 3.0386864 | Y31: =(RC[-3]*RC[-11]-RC[-2]*RC[-9])/1000 -> 1.7190074000000002 | Z31: 2013-12-10T00:00:00.000 | AA31: 2013-12-08T00:00:00.000 | AD31: =VALUE(RC[-28]) -> 2018-10-10T00:00:00.000 | AE31: =IF(RC[22]=42,"*",IF(RC[22]=32,"",RC[22])) -> - | AF31: =RC[-29] -> 24 | AG31: =RC[-29] -> 705.36 | AH31: =RC[-29] -> 46.6 | AI31: =RC[-29] -> 7.4 | AJ31: =RC[-29] -> 696.46 | AK31: =RC[-29] -> 38.53 | AL31: =RC[-29] -> 5.5 | AM31: =RC[-29] -> 8.07 | AN31: =RC[-29] -> 8.8999999999999808 | AO31: =RC[-29] -> 6.0529999999999999 | AP31: =RC[-29] -> 47.44 | AQ31: =RC[-29] -> 65.319999999999993 | AR31: - | AS31: =RC[-30] -> 20.37 | AT31: =RC[-30] -> 66.05 | AU31: - | AV31: =RC[-31] -> -0.73000000000000398 | AW31: =RC[-31] -> 67.81 | AX31: =RC[-31] -> 4.3620000000000001 | AY31: =RC[-31] -> 10.414999999999999 | BA31: - | BB31: - | BC31: -
A32: =IF(RC[1]="","",DATEVALUE(RC[1])) -> 43384 | B32: 11.10.18 | C32: 24 | D32: 701.21 | E32: 46.16 | F32: 7.4 | G32: 692.13 | H32: 38.21 | I32: 5.5 | J32: =RC[-5]-RC[-2] -> 7.9499999999999957 | K32: 9.0800000000000392 | L32: 5.9359999999999999 | M32: 50.27 | N32: 65.959999999999994 | O32: 18.739999999999998 | P32: 66.95 | Q32: =RC[-3]-RC[-1] -> -0.99000000000000909 | R32: 69.010000000000005 | S32: 4.484 | T32: =RC[-8]+RC[-1] -> 10.42 | U32: =(RC[-17]*RC[-16]-RC[-14]*RC[-13])/1000 -> 5.9215662999999985 | V32: 49.29 | W32: 18.37 | X32: =RC[-2]*RC[-10]/1000 -> 3.2511683999999996 | Y32: =(RC[-3]*RC[-11]-RC[-2]*RC[-9])/1000 -> 2.0212968999999994 | Z32: 2013-12-11T00:00:00.000 | AA32: 2013-12-09T00:00:00.000 | AD32: =VALUE(RC[-28]) -> 2018-10-11T00:00:00.000 | AE32: =IF(RC[22]=42,"*",IF(RC[22]=32,"",RC[22])) -> - | AF32: =RC[-29] -> 24 | AG32: =RC[-29] -> 701.21 | AH32: =RC[-29] -> 46.16 | AI32: =RC[-29] -> 7.4 | AJ32: =RC[-29] -> 692.13 | AK32: =RC[-29] -> 38.21 | AL32: =RC[-29] -> 5.5 | AM32: =RC[-29] -> 7.9499999999999957 | AN32: =RC[-29] -> 9.0800000000000392 | AO32: =RC[-29] -> 5.9359999999999999 | AP32: =RC[-29] -> 50.27 | AQ32: =RC[-29] -> 65.959999999999994 | AR32: - | AS32: =RC[-30] -> 18.739999999999998 | AT32: =RC[-30] -> 66.95 | AU32: - | AV32: =RC[-31] -> -0.99000000000000909 | AW32: =RC[-31] -> 69.010000000000005 | AX32: =RC[-31] -> 4.484 | AY32: =RC[-31] -> 10.42 | BA32: - | BB32: - | BC32: -
A33: =IF(RC[1]="","",DATEVALUE(RC[1])) -> 43385 | B33: 12.10.18 | C33: 24 | D33: 706.15 | E33: 45.73 | F33: 7.4 | G33: 695.11 | H33: 37.909999999999997 | I33: 5.5 | J33: =RC[-5]-RC[-2] -> 7.82 | K33: 11.04 | L33: 5.9550000000000001 | M33: 50.14 | N33: 65.77 | O33: 19.72 | P33: 66.91 | Q33: =RC[-3]-RC[-1] -> -1.1400000000000006 | R33: 69.86 | S33: 4.532 | T33: =RC[-8]+RC[-1] -> 10.487 | U33: =(RC[-17]*RC[-16]-RC[-14]*RC[-13])/1000 -> 5.9406193999999992 | V33: 49.18 | W33: 19.34 | X33: =RC[-2]*RC[-10]/1000 -> 3.2345685999999998 | Y33: =(RC[-3]*RC[-11]-RC[-2]*RC[-9])/1000 -> 1.9405291999999996 | Z33: 2013-12-12T00:00:00.000 | AA33: 2013-12-10T00:00:00.000 | AD33: =VALUE(RC[-28]) -> 2018-10-12T00:00:00.000 | AE33: =IF(RC[22]=42,"*",IF(RC[22]=32,"",RC[22])) -> - | AF33: =RC[-29] -> 24 | AG33: =RC[-29] -> 706.15 | AH33: =RC[-29] -> 45.73 | AI33: =RC[-29] -> 7.4 | AJ33: =RC[-29] -> 695.11 | AK33: =RC[-29] -> 37.909999999999997 | AL33: =RC[-29] -> 5.5 | AM33: =RC[-29] -> 7.82 | AN33: =RC[-29] -> 11.04 | AO33: =RC[-29] -> 5.9550000000000001 | AP33: =RC[-29] -> 50.14 | AQ33: =RC[-29] -> 65.77 | AR33: - | AS33: =RC[-30] -> 19.72 | AT33: =RC[-30] -> 66.91 | AU33: - | AV33: =RC[-31] -> -1.1400000000000006 | AW33: =RC[-31] -> 69.86 | AX33: =RC[-31] -> 4.532 | AY33: =RC[-31] -> 10.487 | BA33: - | BB33: - | BC33: -
A34: =IF(RC[1]="","",DATEVALUE(RC[1])) -> 43386 | B34: 13.10.18 | C34: 24 | D34: 712.98 | E34: 46.36 | F34: 7.4 | G34: 701.75 | H34: 38.6 | I34: 5.5 | J34: =RC[-5]-RC[-2] -> 7.759999999999998 | K34: 11.23 | L34: 5.9859999999999998 | M34: 54.54 | N34: 67.77 | O34: 27.42 | P34: 68.239999999999995 | Q34: =RC[-3]-RC[-1] -> -0.46999999999999886 | R34: 81.96 | S34: 5.4560000000000004 | T34: =RC[-8]+RC[-1] -> 11.442 | U34: =(RC[-17]*RC[-16]-RC[-14]*RC[-13])/1000 -> 5.9662028000000031 | V34: 53.42 | W34: 26.82 | X34: =RC[-2]*RC[-10]/1000 -> 3.6202733999999999 | Y34: =(RC[-3]*RC[-11]-RC[-2]*RC[-9])/1000 -> 1.7900766000000001 | Z34: 2013-12-13T00:00:00.000 | AA34: 2013-12-11T00:00:00.000 | AD34: =VALUE(RC[-28]) -> 2018-10-13T00:00:00.000 | AE34: =IF(RC[22]=42,"*",IF(RC[22]=32,"",RC[22])) -> - | AF34: =RC[-29] -> 24 | AG34: =RC[-29] -> 712.98 | AH34: =RC[-29] -> 46.36 | AI34: =RC[-29] -> 7.4 | AJ34: =RC[-29] -> 701.75 | AK34: =RC[-29] -> 38.6 | AL34: =RC[-29] -> 5.5 | AM34: =RC[-29] -> 7.759999999999998 | AN34: =RC[-29] -> 11.23 | AO34: =RC[-29] -> 5.9859999999999998 | AP34: =RC[-29] -> 54.54 | AQ34: =RC[-29] -> 67.77 | AR34: - | AS34: =RC[-30] -> 27.42 | AT34: =RC[-30] -> 68.239999999999995 | AU34: - | AV34: =RC[-31] -> -0.46999999999999886 | AW34: =RC[-31] -> 81.96 | AX34: =RC[-31] -> 5.4560000000000004 | AY34: =RC[-31] -> 11.442 | BA34: - | BB34: - | BC34: -
A35: =IF(RC[1]="","",DATEVALUE(RC[1])) -> 43387 | B35: 14.10.18 | C35: 24 | D35: 710.42 | E35: 46.26 | F35: 7.4 | G35: 700.88 | H35: 38.68 | I35: 5.5 | J35: =RC[-5]-RC[-2] -> 7.5799999999999983 | K35: 9.5399999999999601 | L35: 5.77 | M35: 57.76 | N35: 68.14 | O35: 21.54 | P35: 68.900000000000006 | Q35: =RC[-3]-RC[-1] -> -0.76000000000000512 | R35: 79.3 | S35: 5.3079999999999998 | T35: =RC[-8]+RC[-1] -> 11.077999999999999 | U35: =(RC[-17]*RC[-16]-RC[-14]*RC[-13])/1000 -> 5.753990799999996 | V35: 56.54 | W35: 21.07 | X35: =RC[-2]*RC[-10]/1000 -> 3.8526356000000002 | Y35: =(RC[-3]*RC[-11]-RC[-2]*RC[-9])/1000 -> 2.4009125999999998 | Z35: 2013-12-14T00:00:00.000 | AA35: 2013-12-12T00:00:00.000 | AD35: =VALUE(RC[-28]) -> 2018-10-14T00:00:00.000 | AE35: =IF(RC[22]=42,"*",IF(RC[22]=32,"",RC[22])) -> - | AF35: =RC[-29] -> 24 | AG35: =RC[-29] -> 710.42 | AH35: =RC[-29] -> 46.26 | AI35: =RC[-29] -> 7.4 | AJ35: =RC[-29] -> 700.88 | AK35: =RC[-29] -> 38.68 | AL35: =RC[-29] -> 5.5 | AM35: =RC[-29] -> 7.5799999999999983 | AN35: =RC[-29] -> 9.5399999999999601 | AO35: =RC[-29] -> 5.77 | AP35: =RC[-29] -> 57.76 | AQ35: =RC[-29] -> 68.14 | AR35: - | AS35: =RC[-30] -> 21.54 | AT35: =RC[-30] -> 68.900000000000006 | AU35: - | AV35: =RC[-31] -> -0.76000000000000512 | AW35: =RC[-31] -> 79.3 | AX35: =RC[-31] -> 5.3079999999999998 | AY35: =RC[-31] -> 11.077999999999999 | BA35: - | BB35: - | BC35: -
A36: =IF(RC[1]="","",DATEVALUE(RC[1])) -> 43388 | B36: 15.10.18 | C36: 24 | D36: 700.35 | E36: 45.76 | F36: 7.4 | G36: 691.12 | H36: 38.39 | I36: 5.5 | J36: =RC[-5]-RC[-2] -> 7.3699999999999974 | K36: 9.23000000000002 | L36: 5.5279999999999996 | M36: 50.36 | N36: 67.14 | O36: 19.47 | P36: 68.17 | Q36: =RC[-3]-RC[-1] -> -1.0300000000000011 | R36: 69.83 | S36: 4.6150000000000002 | T36: =RC[-8]+RC[-1] -> 10.143000000000001 | U36: =(RC[-17]*RC[-16]-RC[-14]*RC[-13])/1000 -> 5.5159191999999999 | V36: 49.35 | W36: 19.059999999999999 | X36: =RC[-2]*RC[-10]/1000 -> 3.3133589999999997 | Y36: =(RC[-3]*RC[-11]-RC[-2]*RC[-9])/1000 -> 2.0140388000000002 | Z36: 2013-12-15T00:00:00.000 | AA36: 2013-12-13T00:00:00.000 | AD36: =VALUE(RC[-28]) -> 2018-10-15T00:00:00.000 | AE36: =IF(RC[22]=42,"*",IF(RC[22]=32,"",RC[22])) -> - | AF36: =RC[-29] -> 24 | AG36: =RC[-29] -> 700.35 | AH36: =RC[-29] -> 45.76 | AI36: =RC[-29] -> 7.4 | AJ36: =RC[-29] -> 691.12 | AK36: =RC[-29] -> 38.39 | AL36: =RC[-29] -> 5.5 | AM36: =RC[-29] -> 7.3699999999999974 | AN36: =RC[-29] -> 9.23000000000002 | AO36: =RC[-29] -> 5.5279999999999996 | AP36: =RC[-29] -> 50.36 | AQ36: =RC[-29] -> 67.14 | AR36: - | AS36: =RC[-30] -> 19.47 | AT36: =RC[-30] -> 68.17 | AU36: - | AV36: =RC[-31] -> -1.0300000000000011 | AW36: =RC[-31] -> 69.83 | AX36: =RC[-31] -> 4.6150000000000002 | AY36: =RC[-31] -> 10.143000000000001 | BA36: - | BB36: - | BC36: -
A37: =IF(RC[1]="","",DATEVALUE(RC[1])) -> 43389 | B37: 16.10.18 | C37: 24 | D37: 728.11 | E37: 45.51 | F37: 7.4 | G37: 718.61 | H37: 38.35 | I37: 5.5 | J37: =RC[-5]-RC[-2] -> 7.1599999999999966 | K37: 9.5 | L37: 5.5890000000000004 | M37: 49.08 | N37: 67.16 | O37: 18.77 | P37: 67.94 | Q37: =RC[-3]-RC[-1] -> -0.78000000000000114 | R37: 67.849999999999994 | S37: 4.4809999999999999 | T37: =RC[-8]+RC[-1] -> 10.07 | U37: =(RC[-17]*RC[-16]-RC[-14]*RC[-13])/1000 -> 5.5775925999999965 | V37: 48.09 | W37: 18.36 | X37: =RC[-2]*RC[-10]/1000 -> 3.2297244000000003 | Y37: =(RC[-3]*RC[-11]-RC[-2]*RC[-9])/1000 -> 1.9823460000000002 | Z37: 2013-12-16T00:00:00.000 | AA37: 2013-12-14T00:00:00.000 | AD37: =VALUE(RC[-28]) -> 2018-10-16T00:00:00.000 | AE37: =IF(RC[22]=42,"*",IF(RC[22]=32,"",RC[22])) -> - | AF37: =RC[-29] -> 24 | AG37: =RC[-29] -> 728.11 | AH37: =RC[-29] -> 45.51 | AI37: =RC[-29] -> 7.4 | AJ37: =RC[-29] -> 718.61 | AK37: =RC[-29] -> 38.35 | AL37: =RC[-29] -> 5.5 | AM37: =RC[-29] -> 7.1599999999999966 | AN37: =RC[-29] -> 9.5 | AO37: =RC[-29] -> 5.5890000000000004 | AP37: =RC[-29] -> 49.08 | AQ37: =RC[-29] -> 67.16 | AR37: - | AS37: =RC[-30] -> 18.77 | AT37: =RC[-30] -> 67.94 | AU37: - | AV37: =RC[-31] -> -0.78000000000000114 | AW37: =RC[-31] -> 67.849999999999994 | AX37: =RC[-31] -> 4.4809999999999999 | AY37: =RC[-31] -> 10.07 | BA37: - | BB37: - | BC37: -
A38: =IF(RC[1]="","",DATEVALUE(RC[1])) -> 43390 | B38: 17.10.18 | C38: 24 | D38: 727.13 | E38: 46.23 | F38: 7.4 | G38: 717.36 | H38: 38.82 | I38: 5.5 | J38: =RC[-5]-RC[-2] -> 7.4099999999999966 | K38: 9.76999999999998 | L38: 5.7830000000000004 | M38: 49.74 | N38: 67.59 | O38: 19.23 | P38: 68.400000000000006 | Q38: =RC[-3]-RC[-1] -> -0.81000000000000227 | R38: 68.97 | S38: 4.5839999999999996 | T38: =RC[-8]+RC[-1] -> 10.367000000000001 | U38: =(RC[-17]*RC[-16]-RC[-14]*RC[-13])/1000 -> 5.7673046999999968 | V38: 48.72 | W38: 18.84 | X38: =RC[-2]*RC[-10]/1000 -> 3.2929848000000002 | Y38: =(RC[-3]*RC[-11]-RC[-2]*RC[-9])/1000 -> 2.0043288000000001 | Z38: 2013-12-17T00:00:00.000 | AA38: 2013-12-15T00:00:00.000 | AD38: =VALUE(RC[-28]) -> 2018-10-17T00:00:00.000 | AE38: =IF(RC[22]=42,"*",IF(RC[22]=32,"",RC[22])) -> - | AF38: =RC[-29] -> 24 | AG38: =RC[-29] -> 727.13 | AH38: =RC[-29] -> 46.23 | AI38: =RC[-29] -> 7.4 | AJ38: =RC[-29] -> 717.36 | AK38: =RC[-29] -> 38.82 | AL38: =RC[-29] -> 5.5 | AM38: =RC[-29] -> 7.4099999999999966 | AN38: =RC[-29] -> 9.76999999999998 | AO38: =RC[-29] -> 5.7830000000000004 | AP38: =RC[-29] -> 49.74 | AQ38: =RC[-29] -> 67.59 | AR38: - | AS38: =RC[-30] -> 19.23 | AT38: =RC[-30] -> 68.400000000000006 | AU38: - | AV38: =RC[-31] -> -0.81000000000000227 | AW38: =RC[-31] -> 68.97 | AX38: =RC[-31] -> 4.5839999999999996 | AY38: =RC[-31] -> 10.367000000000001 | BA38: - | BB38: - | BC38: -
A39: =IF(RC[1]="","",DATEVALUE(RC[1])) -> 43391 | B39: 18.10.18 | C39: 24 | D39: 718.89 | E39: 46.53 | F39: 7.4 | G39: 709.46 | H39: 38.96 | I39: 5.5 | J39: =RC[-5]-RC[-2] -> 7.57 | K39: 9.42999999999995 | L39: 5.8230000000000004 | M39: 50.09 | N39: 67.819999999999993 | O39: 18.47 | P39: 69.02 | Q39: =RC[-3]-RC[-1] -> -1.2000000000000028 | R39: 68.56 | S39: 4.5750000000000002 | T39: =RC[-8]+RC[-1] -> 10.398 | U39: =(RC[-17]*RC[-16]-RC[-14]*RC[-13])/1000 -> 5.8093900999999972 | V39: 49.06 | W39: 18.079999999999998 | X39: =RC[-2]*RC[-10]/1000 -> 3.3272491999999998 | Y39: =(RC[-3]*RC[-11]-RC[-2]*RC[-9])/1000 -> 2.0793675999999999 | Z39: 2013-12-18T00:00:00.000 | AA39: 2013-12-16T00:00:00.000 | AD39: =VALUE(RC[-28]) -> 2018-10-18T00:00:00.000 | AE39: =IF(RC[22]=42,"*",IF(RC[22]=32,"",RC[22])) -> - | AF39: =RC[-29] -> 24 | AG39: =RC[-29] -> 718.89 | AH39: =RC[-29] -> 46.53 | AI39: =RC[-29] -> 7.4 | AJ39: =RC[-29] -> 709.46 | AK39: =RC[-29] -> 38.96 | AL39: =RC[-29] -> 5.5 | AM39: =RC[-29] -> 7.57 | AN39: =RC[-29] -> 9.42999999999995 | AO39: =RC[-29] -> 5.8230000000000004 | AP39: =RC[-29] -> 50.09 | AQ39: =RC[-29] -> 67.819999999999993 | AR39: - | AS39: =RC[-30] -> 18.47 | AT39: =RC[-30] -> 69.02 | AU39: - | AV39: =RC[-31] -> -1.2000000000000028 | AW39: =RC[-31] -> 68.56 | AX39: =RC[-31] -> 4.5750000000000002 | AY39: =RC[-31] -> 10.398 | BA39: - | BB39: - | BC39: -
A40: =IF(RC[1]="","",DATEVALUE(RC[1])) -> 43392 | B40: 19.10.18 | C40: 24 | D40: 717.79 | E40: 46.12 | F40: 7.4 | G40: 708.28 | H40: 38.5 | I40: 5.5 | J40: =RC[-5]-RC[-2] -> 7.6199999999999974 | K40: 9.5099999999999891 | L40: 5.85 | M40: 49.79 | N40: 67.540000000000006 | O40: 18.760000000000002 | P40: 68.61 | Q40: =RC[-3]-RC[-1] -> -1.0699999999999932 | R40: 68.55 | S40: 4.5549999999999997 | T40: =RC[-8]+RC[-1] -> 10.404999999999999 | U40: =(RC[-17]*RC[-16]-RC[-14]*RC[-13])/1000 -> 5.8356947999999971 | V40: 48.76 | W40: 18.37 | X40: =RC[-2]*RC[-10]/1000 -> 3.2932504000000002 | Y40: =(RC[-3]*RC[-11]-RC[-2]*RC[-9])/1000 -> 2.0328847000000003 | Z40: 2013-12-19T00:00:00.000 | AA40: 2013-12-17T00:00:00.000 | AD40: =VALUE(RC[-28]) -> 2018-10-19T00:00:00.000 | AE40: =IF(RC[22]=42,"*",IF(RC[22]=32,"",RC[22])) -> - | AF40: =RC[-29] -> 24 | AG40: =RC[-29] -> 717.79 | AH40: =RC[-29] -> 46.12 | AI40: =RC[-29] -> 7.4 | AJ40: =RC[-29] -> 708.28 | AK40: =RC[-29] -> 38.5 | AL40: =RC[-29] -> 5.5 | AM40: =RC[-29] -> 7.6199999999999974 | AN40: =RC[-29] -> 9.5099999999999891 | AO40: =RC[-29] -> 5.85 | AP40: =RC[-29] -> 49.79 | AQ40: =RC[-29] -> 67.540000000000006 | AR40: - | AS40: =RC[-30] -> 18.760000000000002 | AT40: =RC[-30] -> 68.61 | AU40: - | AV40: =RC[-31] -> -1.0699999999999932 | AW40: =RC[-31] -> 68.55 | AX40: =RC[-31] -> 4.5549999999999997 | AY40: =RC[-31] -> 10.404999999999999 | BA40: - | BB40: - | BC40: -
A41: =IF(RC[1]="","",DATEVALUE(RC[1])) -> 43393 | B41: 20.10.18 | C41: 24 | D41: 711.26 | E41: 46.75 | F41: 7.4 | G41: 701.84 | H41: 38.630000000000003 | I41: 5.5 | J41: =RC[-5]-RC[-2] -> 8.1199999999999974 | K41: 9.4199999999999608 | L41: 6.1550000000000002 | M41: 55.59 | N41: 67.38 | O41: 22.06 | P41: 68.400000000000006 | Q41: =RC[-3]-RC[-1] -> -1.0200000000000102 | R41: 77.650000000000006 | S41: 5.15 | T41: =RC[-8]+RC[-1] -> 11.305 | U41: =(RC[-17]*RC[-16]-RC[-14]*RC[-13])/1000 -> 6.1393257999999955 | V41: 54.46 | W41: 21.61 | X41: =RC[-2]*RC[-10]/1000 -> 3.6695148 | Y41: =(RC[-3]*RC[-11]-RC[-2]*RC[-9])/1000 -> 2.1913908000000002 | Z41: 2013-12-20T00:00:00.000 | AA41: 2013-12-18T00:00:00.000 | AD41: =VALUE(RC[-28]) -> 2018-10-20T00:00:00.000 | AE41: =IF(RC[22]=42,"*",IF(RC[22]=32,"",RC[22])) -> - | AF41: =RC[-29] -> 24 | AG41: =RC[-29] -> 711.26 | AH41: =RC[-29] -> 46.75 | AI41: =RC[-29] -> 7.4 | AJ41: =RC[-29] -> 701.84 | AK41: =RC[-29] -> 38.630000000000003 | AL41: =RC[-29] -> 5.5 | AM41: =RC[-29] -> 8.1199999999999974 | AN41: =RC[-29] -> 9.4199999999999608 | AO41: =RC[-29] -> 6.1550000000000002 | AP41: =RC[-29] -> 55.59 | AQ41: =RC[-29] -> 67.38 | AR41: - | AS41: =RC[-30] -> 22.06 | AT41: =RC[-30] -> 68.400000000000006 | AU41: - | AV41: =RC[-31] -> -1.0200000000000102 | AW41: =RC[-31] -> 77.650000000000006 | AX41: =RC[-31] -> 5.15 | AY41: =RC[-31] -> 11.305 | BA41: - | BB41: - | BC41: -
A42: =IF(RC[1]="","",DATEVALUE(RC[1])) -> 43394 | B42: 21.10.18 | C42: 24 | D42: 706.22 | E42: 48.12 | F42: 7.4 | G42: 696.95 | H42: 39.5 | I42: 5.5 | J42: =RC[-5]-RC[-2] -> 8.6199999999999974 | K42: 9.26999999999998 | L42: 6.4710000000000001 | M42: 59.49 | N42: 66.81 | O42: 22.61 | P42: 67.63 | Q42: =RC[-3]-RC[-1] -> -0.81999999999999318 | R42: 82.1 | S42: 5.3949999999999996 | T42: =RC[-8]+RC[-1] -> 11.866 | U42: =(RC[-17]*RC[-16]-RC[-14]*RC[-13])/1000 -> 6.4537813999999996 | V42: 58.28 | W42: 22.16 | X42: =RC[-2]*RC[-10]/1000 -> 3.8936868000000002 | Y42: =(RC[-3]*RC[-11]-RC[-2]*RC[-9])/1000 -> 2.3950060000000004 | Z42: 2013-12-21T00:00:00.000 | AA42: 2013-12-19T00:00:00.000 | AD42: =VALUE(RC[-28]) -> 2018-10-21T00:00:00.000 | AE42: =IF(RC[22]=42,"*",IF(RC[22]=32,"",RC[22])) -> - | AF42: =RC[-29] -> 24 | AG42: =RC[-29] -> 706.22 | AH42: =RC[-29] -> 48.12 | AI42: =RC[-29] -> 7.4 | AJ42: =RC[-29] -> 696.95 | AK42: =RC[-29] -> 39.5 | AL42: =RC[-29] -> 5.5 | AM42: =RC[-29] -> 8.6199999999999974 | AN42: =RC[-29] -> 9.26999999999998 | AO42: =RC[-29] -> 6.4710000000000001 | AP42: =RC[-29] -> 59.49 | AQ42: =RC[-29] -> 66.81 | AR42: - | AS42: =RC[-30] -> 22.61 | AT42: =RC[-30] -> 67.63 | AU42: - | AV42: =RC[-31] -> -0.81999999999999318 | AW42: =RC[-31] -> 82.1 | AX42: =RC[-31] -> 5.3949999999999996 | AY42: =RC[-31] -> 11.866 | BA42: - | BB42: - | BC42: -
A43: =IF(RC[1]="","",DATEVALUE(RC[1])) -> 43395 | B43: 22.10.18 | C43: 24 | D43: 716.75 | E43: 48.44 | F43: 7.4 | G43: 707.37 | H43: 39.770000000000003 | I43: 5.5 | J43: =RC[-5]-RC[-2] -> 8.6699999999999946 | K43: 9.3800000000000008 | L43: 6.6040000000000001 | M43: 52.63 | N43: 67.19 | O43: 20.71 | P43: 68.010000000000005 | Q43: =RC[-3]-RC[-1] -> -0.82000000000000739 | R43: 73.34 | S43: 4.8449999999999998 | T43: =RC[-8]+RC[-1] -> 11.449 | U43: =(RC[-17]*RC[-16]-RC[-14]*RC[-13])/1000 -> 6.5872650999999935 | V43: 51.57 | W43: 20.28 | X43: =RC[-2]*RC[-10]/1000 -> 3.4649882999999999 | Y43: =(RC[-3]*RC[-11]-RC[-2]*RC[-9])/1000 -> 2.0857454999999998 | Z43: 2013-12-22T00:00:00.000 | AA43: 2013-12-20T00:00:00.000 | AD43: =VALUE(RC[-28]) -> 2018-10-22T00:00:00.000 | AE43: =IF(RC[22]=42,"*",IF(RC[22]=32,"",RC[22])) -> - | AF43: =RC[-29] -> 24 | AG43: =RC[-29] -> 716.75 | AH43: =RC[-29] -> 48.44 | AI43: =RC[-29] -> 7.4 | AJ43: =RC[-29] -> 707.37 | AK43: =RC[-29] -> 39.770000000000003 | AL43: =RC[-29] -> 5.5 | AM43: =RC[-29] -> 8.6699999999999946 | AN43: =RC[-29] -> 9.3800000000000008 | AO43: =RC[-29] -> 6.6040000000000001 | AP43: =RC[-29] -> 52.63 | AQ43: =RC[-29] -> 67.19 | AR43: - | AS43: =RC[-30] -> 20.71 | AT43: =RC[-30] -> 68.010000000000005 | AU43: - | AV43: =RC[-31] -> -0.82000000000000739 | AW43: =RC[-31] -> 73.34 | AX43: =RC[-31] -> 4.8449999999999998 | AY43: =RC[-31] -> 11.449 | BA43: - | BB43: - | BC43: -
A44: =IF(RC[1]="","",DATEVALUE(RC[1])) ->  | C44: 24 | J44: =RC[-5]-RC[-2] -> #VALUE! | Q44: =RC[-3]-RC[-1] -> #VALUE! | T44: =RC[-8]+RC[-1] -> #VALUE! | U44: =(RC[-17]*RC[-16]-RC[-14]*RC[-13])/1000 -> #VALUE! | X44: =RC[-2]*RC[-10]/1000 -> #VALUE! | Y44: =(RC[-3]*RC[-11]-RC[-2]*RC[-9])/1000 -> #VALUE! | AD44: =VALUE(RC[-28]) -> #VALUE! | AE44: =IF(RC[22]=42,"*",IF(RC[22]=32,"",RC[22])) ->  | AF44: =RC[-29] -> 24 | AG44: =RC[-29] ->  | AH44: =RC[-29] ->  | AI44: =RC[-29] ->  | AJ44: =RC[-29] ->  | AK44: =RC[-29] ->  | AL44: =RC[-29] ->  | AM44: =RC[-29] -> #VALUE! | AN44: =RC[-29] ->  | AO44: =RC[-29] ->  | AP44: =RC[-29] ->  | AQ44: =RC[-29] ->  | AR44: - | AS44: =RC[-30] ->  | AT44: =RC[-30] ->  | AU44: - | AV44: =RC[-31] -> #VALUE! | AW44: =RC[-31] ->  | AX44: =RC[-31] ->  | AY44: =RC[-31] -> #VALUE!
A45: =IF(RC[1]="","",DATEVALUE(RC[1])) ->  | C45: 24 | J45: =RC[-5]-RC[-2] -> #VALUE! | Q45: =RC[-3]-RC[-1] -> #VALUE! | T45: =RC[-8]+RC[-1] -> #VALUE! | U45: =(RC[-17]*RC[-16]-RC[-14]*RC[-13])/1000 -> #VALUE! | X45: =RC[-2]*RC[-10]/1000 -> #VALUE! | Y45: =(RC[-3]*RC[-11]-RC[-2]*RC[-9])/1000 -> #VALUE! | AD45: =VALUE(RC[-28]) -> #VALUE! | AE45: =IF(RC[22]=42,"*",IF(RC[22]=32,"",RC[22])) ->  | AF45: =RC[-29] -> 24 | AG45: =RC[-29] ->  | AH45: =RC[-29] ->  | AI45: =RC[-29] ->  | AJ45: =RC[-29] ->  | AK45: =RC[-29] ->  | AL45: =RC[-29] ->  | AM45: =RC[-29] -> #VALUE! | AN45: =RC[-29] ->  | AO45: =RC[-29] ->  | AP45: =RC[-29] ->  | AQ45: =RC[-29] ->  | AR45: - | AS45: =RC[-30] ->  | AT45: =RC[-30] ->  | AU45: - | AV45: =RC[-31] -> #VALUE! | AW45: =RC[-31] ->  | AX45: =RC[-31] ->  | AY45: =RC[-31] -> #VALUE!
A46: =IF(RC[1]="","",DATEVALUE(RC[1])) ->  | C46: 24 | J46: =RC[-5]-RC[-2] -> #VALUE! | Q46: =RC[-3]-RC[-1] -> #VALUE! | T46: =RC[-8]+RC[-1] -> #VALUE! | U46: =(RC[-17]*RC[-16]-RC[-14]*RC[-13])/1000 -> #VALUE! | X46: =RC[-2]*RC[-10]/1000 -> #VALUE! | Y46: =(RC[-3]*RC[-11]-RC[-2]*RC[-9])/1000 -> #VALUE! | AD46: =VALUE(RC[-28]) -> #VALUE! | AE46: =IF(RC[22]=42,"*",IF(RC[22]=32,"",RC[22])) ->  | AF46: =RC[-29] -> 24 | AG46: =RC[-29] ->  | AH46: =RC[-29] ->  | AI46: =RC[-29] ->  | AJ46: =RC[-29] ->  | AK46: =RC[-29] ->  | AL46: =RC[-29] ->  | AM46: =RC[-29] -> #VALUE! | AN46: =RC[-29] ->  | AO46: =RC[-29] ->  | AP46: =RC[-29] ->  | AQ46: =RC[-29] ->  | AR46: - | AS46: =RC[-30] ->  | AT46: =RC[-30] ->  | AU46: - | AV46: =RC[-31] -> #VALUE! | AW46: =RC[-31] ->  | AX46: =RC[-31] ->  | AY46: =RC[-31] -> #VALUE!
A47: =IF(RC[1]="","",DATEVALUE(RC[1])) ->  | C47: 24 | J47: =RC[-5]-RC[-2] -> #VALUE! | Q47: =RC[-3]-RC[-1] -> #VALUE! | T47: =RC[-8]+RC[-1] -> #VALUE! | U47: =(RC[-17]*RC[-16]-RC[-14]*RC[-13])/1000 -> #VALUE! | X47: =RC[-2]*RC[-10]/1000 -> #VALUE! | Y47: =(RC[-3]*RC[-11]-RC[-2]*RC[-9])/1000 -> #VALUE! | AD47: =VALUE(RC[-28]) -> #VALUE! | AE47: =IF(RC[22]=42,"*",IF(RC[22]=32,"",RC[22])) ->  | AF47: =RC[-29] -> 24 | AG47: =RC[-29] ->  | AH47: =RC[-29] ->  | AI47: =RC[-29] ->  | AJ47: =RC[-29] ->  | AK47: =RC[-29] ->  | AL47: =RC[-29] ->  | AM47: =RC[-29] -> #VALUE! | AN47: =RC[-29] ->  | AO47: =RC[-29] ->  | AP47: =RC[-29] ->  | AQ47: =RC[-29] ->  | AR47: - | AS47: =RC[-30] ->  | AT47: =RC[-30] ->  | AU47: - | AV47: =RC[-31] -> #VALUE! | AW47: =RC[-31] ->  | AX47: =RC[-31] ->  | AY47: =RC[-31] -> #VALUE!
A48: =IF(RC[1]="","",DATEVALUE(RC[1])) ->  | C48: 24 | J48: =RC[-5]-RC[-2] -> #VALUE! | Q48: =RC[-3]-RC[-1] -> #VALUE! | T48: =RC[-8]+RC[-1] -> #VALUE! | U48: =(RC[-17]*RC[-16]-RC[-14]*RC[-13])/1000 -> #VALUE! | X48: =RC[-2]*RC[-10]/1000 -> #VALUE! | Y48: =(RC[-3]*RC[-11]-RC[-2]*RC[-9])/1000 -> #VALUE! | AD48: =VALUE(RC[-28]) -> #VALUE! | AE48: =IF(RC[22]=42,"*",IF(RC[22]=32,"",RC[22])) ->  | AF48: =RC[-29] -> 24 | AG48: =RC[-29] ->  | AH48: =RC[-29] ->  | AI48: =RC[-29] ->  | AJ48: =RC[-29] ->  | AK48: =RC[-29] ->  | AL48: =RC[-29] ->  | AM48: =RC[-29] -> #VALUE! | AN48: =RC[-29] ->  | AO48: =RC[-29] ->  | AP48: =RC[-29] ->  | AQ48: =RC[-29] ->  | AR48: - | AS48: =RC[-30] ->  | AT48: =RC[-30] ->  | AU48: - | AV48: =RC[-31] -> #VALUE! | AW48: =RC[-31] ->  | AX48: =RC[-31] ->  | AY48: =RC[-31] -> #VALUE!
A49: =IF(RC[1]="","",DATEVALUE(RC[1])) ->  | C49: 24 | J49: =RC[-5]-RC[-2] -> #VALUE! | Q49: =RC[-3]-RC[-1] -> #VALUE! | T49: =RC[-8]+RC[-1] -> #VALUE! | U49: =(RC[-17]*RC[-16]-RC[-14]*RC[-13])/1000 -> #VALUE! | X49: =RC[-2]*RC[-10]/1000 -> #VALUE! | Y49: =(RC[-3]*RC[-11]-RC[-2]*RC[-9])/1000 -> #VALUE! | AD49: =VALUE(RC[-28]) -> #VALUE! | AE49: =IF(RC[22]=42,"*",IF(RC[22]=32,"",RC[22])) ->  | AF49: =RC[-29] -> 24 | AG49: =RC[-29] ->  | AH49: =RC[-29] ->  | AI49: =RC[-29] ->  | AJ49: =RC[-29] ->  | AK49: =RC[-29] ->  | AL49: =RC[-29] ->  | AM49: =RC[-29] -> #VALUE! | AN49: =RC[-29] ->  | AO49: =RC[-29] ->  | AP49: =RC[-29] ->  | AQ49: =RC[-29] ->  | AR49: - | AS49: =RC[-30] ->  | AT49: =RC[-30] ->  | AU49: - | AV49: =RC[-31] -> #VALUE! | AW49: =RC[-31] ->  | AX49: =RC[-31] ->  | AY49: =RC[-31] -> #VALUE!
A50: =IF(RC[1]="","",DATEVALUE(RC[1])) ->  | C50: 24 | J50: =RC[-5]-RC[-2] -> #VALUE! | Q50: =RC[-3]-RC[-1] -> #VALUE! | T50: =RC[-8]+RC[-1] -> #VALUE! | U50: =(RC[-17]*RC[-16]-RC[-14]*RC[-13])/1000 -> #VALUE! | X50: =RC[-2]*RC[-10]/1000 -> #VALUE! | Y50: =(RC[-3]*RC[-11]-RC[-2]*RC[-9])/1000 -> #VALUE! | AD50: =VALUE(RC[-28]) -> #VALUE! | AE50: =IF(RC[22]=42,"*",IF(RC[22]=32,"",RC[22])) ->  | AF50: =RC[-29] -> 24 | AG50: =RC[-29] ->  | AH50: =RC[-29] ->  | AI50: =RC[-29] ->  | AJ50: =RC[-29] ->  | AK50: =RC[-29] ->  | AL50: =RC[-29] ->  | AM50: =RC[-29] -> #VALUE! | AN50: =RC[-29] ->  | AO50: =RC[-29] ->  | AP50: =RC[-29] ->  | AQ50: =RC[-29] ->  | AR50: - | AS50: =RC[-30] ->  | AT50: =RC[-30] ->  | AU50: - | AV50: =RC[-31] -> #VALUE! | AW50: =RC[-31] ->  | AX50: =RC[-31] ->  | AY50: =RC[-31] -> #VALUE!
A51: =IF(RC[1]="","",DATEVALUE(RC[1])) ->  | C51: 24 | J51: =RC[-5]-RC[-2] -> #VALUE! | Q51: =RC[-3]-RC[-1] -> #VALUE! | T51: =RC[-8]+RC[-1] -> #VALUE! | U51: =(RC[-17]*RC[-16]-RC[-14]*RC[-13])/1000 -> #VALUE! | X51: =RC[-2]*RC[-10]/1000 -> #VALUE! | Y51: =(RC[-3]*RC[-11]-RC[-2]*RC[-9])/1000 -> #VALUE! | AD51: =VALUE(RC[-28]) -> #VALUE! | AE51: =IF(RC[22]=42,"*",IF(RC[22]=32,"",RC[22])) ->  | AF51: =RC[-29] -> 24 | AG51: =RC[-29] ->  | AH51: =RC[-29] ->  | AI51: =RC[-29] ->  | AJ51: =RC[-29] ->  | AK51: =RC[-29] ->  | AL51: =RC[-29] ->  | AM51: =RC[-29] -> #VALUE! | AN51: =RC[-29] ->  | AO51: =RC[-29] ->  | AP51: =RC[-29] ->  | AQ51: =RC[-29] ->  | AR51: - | AS51: =RC[-30] ->  | AT51: =RC[-30] ->  | AU51: - | AV51: =RC[-31] -> #VALUE! | AW51: =RC[-31] ->  | AX51: =RC[-31] ->  | AY51: =RC[-31] -> #VALUE!
A52: =IF(RC[1]="","",DATEVALUE(RC[1])) ->  | C52: 24 | J52: =RC[-5]-RC[-2] -> #VALUE! | Q52: =RC[-3]-RC[-1] -> #VALUE! | T52: =RC[-8]+RC[-1] -> #VALUE! | U52: =(RC[-17]*RC[-16]-RC[-14]*RC[-13])/1000 -> #VALUE! | X52: =RC[-2]*RC[-10]/1000 -> #VALUE! | Y52: =(RC[-3]*RC[-11]-RC[-2]*RC[-9])/1000 -> #VALUE! | AD52: =VALUE(RC[-28]) -> #VALUE! | AE52: =IF(RC[22]=42,"*",IF(RC[22]=32,"",RC[22])) ->  | AF52: =RC[-29] -> 24 | AG52: =RC[-29] ->  | AH52: =RC[-29] ->  | AI52: =RC[-29] ->  | AJ52: =RC[-29] ->  | AK52: =RC[-29] ->  | AL52: =RC[-29] ->  | AM52: =RC[-29] -> #VALUE! | AN52: =RC[-29] ->  | AO52: =RC[-29] ->  | AP52: =RC[-29] ->  | AQ52: =RC[-29] ->  | AR52: - | AS52: =RC[-30] ->  | AT52: =RC[-30] ->  | AU52: - | AV52: =RC[-31] -> #VALUE! | AW52: =RC[-31] ->  | AX52: =RC[-31] ->  | AY52: =RC[-31] -> #VALUE!
A53: =IF(RC[1]="","",DATEVALUE(RC[1])) ->  | C53: 24 | J53: =RC[-5]-RC[-2] -> #VALUE! | Q53: =RC[-3]-RC[-1] -> #VALUE! | T53: =RC[-8]+RC[-1] -> #VALUE! | U53: =(RC[-17]*RC[-16]-RC[-14]*RC[-13])/1000 -> #VALUE! | X53: =RC[-2]*RC[-10]/1000 -> #VALUE! | Y53: =(RC[-3]*RC[-11]-RC[-2]*RC[-9])/1000 -> #VALUE! | AD53: =VALUE(RC[-28]) -> #VALUE! | AE53: =IF(RC[22]=42,"*",IF(RC[22]=32,"",RC[22])) ->  | AF53: =RC[-29] -> 24 | AG53: =RC[-29] ->  | AH53: =RC[-29] ->  | AI53: =RC[-29] ->  | AJ53: =RC[-29] ->  | AK53: =RC[-29] ->  | AL53: =RC[-29] ->  | AM53: =RC[-29] -> #VALUE! | AN53: =RC[-29] ->  | AO53: =RC[-29] ->  | AP53: =RC[-29] ->  | AQ53: =RC[-29] ->  | AR53: - | AS53: =RC[-30] ->  | AT53: =RC[-30] ->  | AU53: - | AV53: =RC[-31] -> #VALUE! | AW53: =RC[-31] ->  | AX53: =RC[-31] ->  | AY53: =RC[-31] -> #VALUE!
A54: =IF(RC[1]="","",DATEVALUE(RC[1])) ->  | C54: 24 | J54: =RC[-5]-RC[-2] -> #VALUE! | Q54: =RC[-3]-RC[-1] -> #VALUE! | T54: =RC[-8]+RC[-1] -> #VALUE! | U54: =(RC[-17]*RC[-16]-RC[-14]*RC[-13])/1000 -> #VALUE! | X54: =RC[-2]*RC[-10]/1000 -> #VALUE! | Y54: =(RC[-3]*RC[-11]-RC[-2]*RC[-9])/1000 -> #VALUE! | AD54: =VALUE(RC[-28]) -> #VALUE! | AE54: =IF(RC[22]=42,"*",IF(RC[22]=32,"",RC[22])) ->  | AF54: =RC[-29] -> 24 | AG54: =RC[-29] ->  | AH54: =RC[-29] ->  | AI54: =RC[-29] ->  | AJ54: =RC[-29] ->  | AK54: =RC[-29] ->  | AL54: =RC[-29] ->  | AM54: =RC[-29] -> #VALUE! | AN54: =RC[-29] ->  | AO54: =RC[-29] ->  | AP54: =RC[-29] ->  | AQ54: =RC[-29] ->  | AR54: - | AS54: =RC[-30] ->  | AT54: =RC[-30] ->  | AU54: - | AV54: =RC[-31] -> #VALUE! | AW54: =RC[-31] ->  | AX54: =RC[-31] ->  | AY54: =RC[-31] -> #VALUE!
A55: =IF(RC[1]="","",DATEVALUE(RC[1])) ->  | C55: 24 | J55: =RC[-5]-RC[-2] -> #VALUE! | Q55: =RC[-3]-RC[-1] -> #VALUE! | T55: =RC[-8]+RC[-1] -> #VALUE! | U55: =(RC[-17]*RC[-16]-RC[-14]*RC[-13])/1000 -> #VALUE! | X55: =RC[-2]*RC[-10]/1000 -> #VALUE! | Y55: =(RC[-3]*RC[-11]-RC[-2]*RC[-9])/1000 -> #VALUE! | AD55: =VALUE(RC[-28]) -> #VALUE! | AE55: =IF(RC[22]=42,"*",IF(RC[22]=32,"",RC[22])) ->  | AF55: =RC[-29] -> 24 | AG55: =RC[-29] ->  | AH55: =RC[-29] ->  | AI55: =RC[-29] ->  | AJ55: =RC[-29] ->  | AK55: =RC[-29] ->  | AL55: =RC[-29] ->  | AM55: =RC[-29] -> #VALUE! | AN55: =RC[-29] ->  | AO55: =RC[-29] ->  | AP55: =RC[-29] ->  | AQ55: =RC[-29] ->  | AR55: - | AS55: =RC[-30] ->  | AT55: =RC[-30] ->  | AU55: - | AV55: =RC[-31] -> #VALUE! | AW55: =RC[-31] ->  | AX55: =RC[-31] ->  | AY55: =RC[-31] -> #VALUE!
A56: =IF(RC[1]="","",DATEVALUE(RC[1])) ->  | C56: 24 | J56: =RC[-5]-RC[-2] -> #VALUE! | Q56: =RC[-3]-RC[-1] -> #VALUE! | T56: =RC[-8]+RC[-1] -> #VALUE! | U56: =(RC[-17]*RC[-16]-RC[-14]*RC[-13])/1000 -> #VALUE! | X56: =RC[-2]*RC[-10]/1000 -> #VALUE! | Y56: =(RC[-3]*RC[-11]-RC[-2]*RC[-9])/1000 -> #VALUE! | AD56: =VALUE(RC[-28]) -> #VALUE! | AE56: =IF(RC[22]=42,"*",IF(RC[22]=32,"",RC[22])) ->  | AF56: =RC[-29] -> 24 | AG56: =RC[-29] ->  | AH56: =RC[-29] ->  | AI56: =RC[-29] ->  | AJ56: =RC[-29] ->  | AK56: =RC[-29] ->  | AL56: =RC[-29] ->  | AM56: =RC[-29] -> #VALUE! | AN56: =RC[-29] ->  | AO56: =RC[-29] ->  | AP56: =RC[-29] ->  | AQ56: =RC[-29] ->  | AR56: - | AS56: =RC[-30] ->  | AT56: =RC[-30] ->  | AU56: - | AV56: =RC[-31] -> #VALUE! | AW56: =RC[-31] ->  | AX56: =RC[-31] ->  | AY56: =RC[-31] -> #VALUE!
A57: =IF(RC[1]="","",DATEVALUE(RC[1])) ->  | C57: 24 | J57: =RC[-5]-RC[-2] -> #VALUE! | Q57: =RC[-3]-RC[-1] -> #VALUE! | T57: =RC[-8]+RC[-1] -> #VALUE! | U57: =(RC[-17]*RC[-16]-RC[-14]*RC[-13])/1000 -> #VALUE! | X57: =RC[-2]*RC[-10]/1000 -> #VALUE! | Y57: =(RC[-3]*RC[-11]-RC[-2]*RC[-9])/1000 -> #VALUE! | AD57: =VALUE(RC[-28]) -> #VALUE! | AE57: =IF(RC[22]=42,"*",IF(RC[22]=32,"",RC[22])) ->  | AF57: =RC[-29] -> 24 | AG57: =RC[-29] ->  | AH57: =RC[-29] ->  | AI57: =RC[-29] ->  | AJ57: =RC[-29] ->  | AK57: =RC[-29] ->  | AL57: =RC[-29] ->  | AM57: =RC[-29] -> #VALUE! | AN57: =RC[-29] ->  | AO57: =RC[-29] ->  | AP57: =RC[-29] ->  | AQ57: =RC[-29] ->  | AR57: - | AS57: =RC[-30] ->  | AT57: =RC[-30] ->  | AU57: - | AV57: =RC[-31] -> #VALUE! | AW57: =RC[-31] ->  | AX57: =RC[-31] ->  | AY57: =RC[-31] -> #VALUE!
A58: =IF(RC[1]="","",DATEVALUE(RC[1])) ->  | C58: 24 | J58: =RC[-5]-RC[-2] -> #VALUE! | Q58: =RC[-3]-RC[-1] -> #VALUE! | T58: =RC[-8]+RC[-1] -> #VALUE! | U58: =(RC[-17]*RC[-16]-RC[-14]*RC[-13])/1000 -> #VALUE! | X58: =RC[-2]*RC[-10]/1000 -> #VALUE! | Y58: =(RC[-3]*RC[-11]-RC[-2]*RC[-9])/1000 -> #VALUE! | AD58: =VALUE(RC[-28]) -> #VALUE! | AE58: =IF(RC[22]=42,"*",IF(RC[22]=32,"",RC[22])) ->  | AF58: =RC[-29] -> 24 | AG58: =RC[-29] ->  | AH58: =RC[-29] ->  | AI58: =RC[-29] ->  | AJ58: =RC[-29] ->  | AK58: =RC[-29] ->  | AL58: =RC[-29] ->  | AM58: =RC[-29] -> #VALUE! | AN58: =RC[-29] ->  | AO58: =RC[-29] ->  | AP58: =RC[-29] ->  | AQ58: =RC[-29] ->  | AR58: - | AS58: =RC[-30] ->  | AT58: =RC[-30] ->  | AU58: - | AV58: =RC[-31] -> #VALUE! | AW58: =RC[-31] ->  | AX58: =RC[-31] ->  | AY58: =RC[-31] -> #VALUE!
A59: =IF(RC[1]="","",DATEVALUE(RC[1])) ->  | C59: 24 | J59: =RC[-5]-RC[-2] -> #VALUE! | Q59: =RC[-3]-RC[-1] -> #VALUE! | T59: =RC[-8]+RC[-1] -> #VALUE! | U59: =(RC[-17]*RC[-16]-RC[-14]*RC[-13])/1000 -> #VALUE! | X59: =RC[-2]*RC[-10]/1000 -> #VALUE! | Y59: =(RC[-3]*RC[-11]-RC[-2]*RC[-9])/1000 -> #VALUE! | AD59: =VALUE(RC[-28]) -> #VALUE! | AE59: =IF(RC[22]=42,"*",IF(RC[22]=32,"",RC[22])) ->  | AF59: =RC[-29] -> 24 | AG59: =RC[-29] ->  | AH59: =RC[-29] ->  | AI59: =RC[-29] ->  | AJ59: =RC[-29] ->  | AK59: =RC[-29] ->  | AL59: =RC[-29] ->  | AM59: =RC[-29] -> #VALUE! | AN59: =RC[-29] ->  | AO59: =RC[-29] ->  | AP59: =RC[-29] ->  | AQ59: =RC[-29] ->  | AR59: - | AS59: =RC[-30] ->  | AT59: =RC[-30] ->  | AU59: - | AV59: =RC[-31] -> #VALUE! | AW59: =RC[-31] ->  | AX59: =RC[-31] ->  | AY59: =RC[-31] -> #VALUE!
A60: =IF(RC[1]="","",DATEVALUE(RC[1])) ->  | C60: 24 | J60: =RC[-5]-RC[-2] -> #VALUE! | Q60: =RC[-3]-RC[-1] -> #VALUE! | T60: =RC[-8]+RC[-1] -> #VALUE! | U60: =(RC[-17]*RC[-16]-RC[-14]*RC[-13])/1000 -> #VALUE! | X60: =RC[-2]*RC[-10]/1000 -> #VALUE! | Y60: =(RC[-3]*RC[-11]-RC[-2]*RC[-9])/1000 -> #VALUE! | AD60: =VALUE(RC[-28]) -> #VALUE! | AE60: =IF(RC[22]=42,"*",IF(RC[22]=32,"",RC[22])) ->  | AF60: =RC[-29] -> 24 | AG60: =RC[-29] ->  | AH60: =RC[-29] ->  | AI60: =RC[-29] ->  | AJ60: =RC[-29] ->  | AK60: =RC[-29] ->  | AL60: =RC[-29] ->  | AM60: =RC[-29] -> #VALUE! | AN60: =RC[-29] ->  | AO60: =RC[-29] ->  | AP60: =RC[-29] ->  | AQ60: =RC[-29] ->  | AR60: - | AS60: =RC[-30] ->  | AT60: =RC[-30] ->  | AU60: - | AV60: =RC[-31] -> #VALUE! | AW60: =RC[-31] ->  | AX60: =RC[-31] ->  | AY60: =RC[-31] -> #VALUE!
A61: =IF(RC[1]="","",DATEVALUE(RC[1])) ->  | C61: 24 | J61: =RC[-5]-RC[-2] -> #VALUE! | Q61: =RC[-3]-RC[-1] -> #VALUE! | T61: =RC[-8]+RC[-1] -> #VALUE! | U61: =(RC[-17]*RC[-16]-RC[-14]*RC[-13])/1000 -> #VALUE! | X61: =RC[-2]*RC[-10]/1000 -> #VALUE! | Y61: =(RC[-3]*RC[-11]-RC[-2]*RC[-9])/1000 -> #VALUE! | AD61: =VALUE(RC[-28]) -> #VALUE! | AE61: =IF(RC[22]=42,"*",IF(RC[22]=32,"",RC[22])) ->  | AF61: =RC[-29] -> 24 | AG61: =RC[-29] ->  | AH61: =RC[-29] ->  | AI61: =RC[-29] ->  | AJ61: =RC[-29] ->  | AK61: =RC[-29] ->  | AL61: =RC[-29] ->  | AM61: =RC[-29] -> #VALUE! | AN61: =RC[-29] ->  | AO61: =RC[-29] ->  | AP61: =RC[-29] ->  | AQ61: =RC[-29] ->  | AR61: - | AS61: =RC[-30] ->  | AT61: =RC[-30] ->  | AU61: - | AV61: =RC[-31] -> #VALUE! | AW61: =RC[-31] ->  | AX61: =RC[-31] ->  | AY61: =RC[-31] -> #VALUE!
A62: =IF(RC[1]="","",DATEVALUE(RC[1])) ->  | C62: 24 | J62: =RC[-5]-RC[-2] -> #VALUE! | Q62: =RC[-3]-RC[-1] -> #VALUE! | T62: =RC[-8]+RC[-1] -> #VALUE! | U62: =(RC[-17]*RC[-16]-RC[-14]*RC[-13])/1000 -> #VALUE! | X62: =RC[-2]*RC[-10]/1000 -> #VALUE! | Y62: =(RC[-3]*RC[-11]-RC[-2]*RC[-9])/1000 -> #VALUE! | AD62: =VALUE(RC[-28]) -> #VALUE! | AE62: =IF(RC[22]=42,"*",IF(RC[22]=32,"",RC[22])) ->  | AF62: =RC[-29] -> 24 | AG62: =RC[-29] ->  | AH62: =RC[-29] ->  | AI62: =RC[-29] ->  | AJ62: =RC[-29] ->  | AK62: =RC[-29] ->  | AL62: =RC[-29] ->  | AM62: =RC[-29] -> #VALUE! | AN62: =RC[-29] ->  | AO62: =RC[-29] ->  | AP62: =RC[-29] ->  | AQ62: =RC[-29] ->  | AR62: - | AS62: =RC[-30] ->  | AT62: =RC[-30] ->  | AU62: - | AV62: =RC[-31] -> #VALUE! | AW62: =RC[-31] ->  | AX62: =RC[-31] ->  | AY62: =RC[-31] -> #VALUE!
A63: =IF(RC[1]="","",DATEVALUE(RC[1])) ->  | C63: 24 | J63: =RC[-5]-RC[-2] -> #VALUE! | Q63: =RC[-3]-RC[-1] -> #VALUE! | T63: =RC[-8]+RC[-1] -> #VALUE! | U63: =(RC[-17]*RC[-16]-RC[-14]*RC[-13])/1000 -> #VALUE! | X63: =RC[-2]*RC[-10]/1000 -> #VALUE! | Y63: =(RC[-3]*RC[-11]-RC[-2]*RC[-9])/1000 -> #VALUE! | AD63: =VALUE(RC[-28]) -> #VALUE! | AE63: =IF(RC[22]=42,"*",IF(RC[22]=32,"",RC[22])) ->  | AF63: =RC[-29] -> 24 | AG63: =RC[-29] ->  | AH63: =RC[-29] ->  | AI63: =RC[-29] ->  | AJ63: =RC[-29] ->  | AK63: =RC[-29] ->  | AL63: =RC[-29] ->  | AM63: =RC[-29] -> #VALUE! | AN63: =RC[-29] ->  | AO63: =RC[-29] ->  | AP63: =RC[-29] ->  | AQ63: =RC[-29] ->  | AR63: - | AS63: =RC[-30] ->  | AT63: =RC[-30] ->  | AU63: - | AV63: =RC[-31] -> #VALUE! | AW63: =RC[-31] ->  | AX63: =RC[-31] ->  | AY63: =RC[-31] -> #VALUE!
A64: =IF(RC[1]="","",DATEVALUE(RC[1])) ->  | C64: 24 | J64: =RC[-5]-RC[-2] -> #VALUE! | Q64: =RC[-3]-RC[-1] -> #VALUE! | T64: =RC[-8]+RC[-1] -> #VALUE! | U64: =(RC[-17]*RC[-16]-RC[-14]*RC[-13])/1000 -> #VALUE! | X64: =RC[-2]*RC[-10]/1000 -> #VALUE! | Y64: =(RC[-3]*RC[-11]-RC[-2]*RC[-9])/1000 -> #VALUE! | AD64: =VALUE(RC[-28]) -> #VALUE! | AE64: =IF(RC[22]=42,"*",IF(RC[22]=32,"",RC[22])) ->  | AF64: =RC[-29] -> 24 | AG64: =RC[-29] ->  | AH64: =RC[-29] ->  | AI64: =RC[-29] ->  | AJ64: =RC[-29] ->  | AK64: =RC[-29] ->  | AL64: =RC[-29] ->  | AM64: =RC[-29] -> #VALUE! | AN64: =RC[-29] ->  | AO64: =RC[-29] ->  | AP64: =RC[-29] ->  | AQ64: =RC[-29] ->  | AR64: - | AS64: =RC[-30] ->  | AT64: =RC[-30] ->  | AU64: - | AV64: =RC[-31] -> #VALUE! | AW64: =RC[-31] ->  | AX64: =RC[-31] ->  | AY64: =RC[-31] -> #VALUE!
A65: =IF(RC[1]="","",DATEVALUE(RC[1])) ->  | C65: 24 | J65: =RC[-5]-RC[-2] -> #VALUE! | Q65: =RC[-3]-RC[-1] -> #VALUE! | T65: =RC[-8]+RC[-1] -> #VALUE! | U65: =(RC[-17]*RC[-16]-RC[-14]*RC[-13])/1000 -> #VALUE! | X65: =RC[-2]*RC[-10]/1000 -> #VALUE! | Y65: =(RC[-3]*RC[-11]-RC[-2]*RC[-9])/1000 -> #VALUE! | AD65: =VALUE(RC[-28]) -> #VALUE! | AE65: =IF(RC[22]=42,"*",IF(RC[22]=32,"",RC[22])) ->  | AF65: =RC[-29] -> 24 | AG65: =RC[-29] ->  | AH65: =RC[-29] ->  | AI65: =RC[-29] ->  | AJ65: =RC[-29] ->  | AK65: =RC[-29] ->  | AL65: =RC[-29] ->  | AM65: =RC[-29] -> #VALUE! | AN65: =RC[-29] ->  | AO65: =RC[-29] ->  | AP65: =RC[-29] ->  | AQ65: =RC[-29] ->  | AR65: - | AS65: =RC[-30] ->  | AT65: =RC[-30] ->  | AU65: - | AV65: =RC[-31] -> #VALUE! | AW65: =RC[-31] ->  | AX65: =RC[-31] ->  | AY65: =RC[-31] -> #VALUE!
A66: =IF(RC[1]="","",DATEVALUE(RC[1])) ->  | C66: 24 | J66: =RC[-5]-RC[-2] -> #VALUE! | Q66: =RC[-3]-RC[-1] -> #VALUE! | T66: =RC[-8]+RC[-1] -> #VALUE! | U66: =(RC[-17]*RC[-16]-RC[-14]*RC[-13])/1000 -> #VALUE! | X66: =RC[-2]*RC[-10]/1000 -> #VALUE! | Y66: =(RC[-3]*RC[-11]-RC[-2]*RC[-9])/1000 -> #VALUE! | AD66: =VALUE(RC[-28]) -> #VALUE! | AE66: =IF(RC[22]=42,"*",IF(RC[22]=32,"",RC[22])) ->  | AF66: =RC[-29] -> 24 | AG66: =RC[-29] ->  | AH66: =RC[-29] ->  | AI66: =RC[-29] ->  | AJ66: =RC[-29] ->  | AK66: =RC[-29] ->  | AL66: =RC[-29] ->  | AM66: =RC[-29] -> #VALUE! | AN66: =RC[-29] ->  | AO66: =RC[-29] ->  | AP66: =RC[-29] ->  | AQ66: =RC[-29] ->  | AR66: - | AS66: =RC[-30] ->  | AT66: =RC[-30] ->  | AU66: - | AV66: =RC[-31] -> #VALUE! | AW66: =RC[-31] ->  | AX66: =RC[-31] ->  | AY66: =RC[-31] -> #VALUE!
A67: =IF(RC[1]="","",DATEVALUE(RC[1])) ->  | C67: 24 | J67: =RC[-5]-RC[-2] -> #VALUE! | Q67: =RC[-3]-RC[-1] -> #VALUE! | T67: =RC[-8]+RC[-1] -> #VALUE! | U67: =(RC[-17]*RC[-16]-RC[-14]*RC[-13])/1000 -> #VALUE! | X67: =RC[-2]*RC[-10]/1000 -> #VALUE! | Y67: =(RC[-3]*RC[-11]-RC[-2]*RC[-9])/1000 -> #VALUE! | AD67: =VALUE(RC[-28]) -> #VALUE! | AE67: =IF(RC[22]=42,"*",IF(RC[22]=32,"",RC[22])) ->  | AF67: =RC[-29] -> 24 | AG67: =RC[-29] ->  | AH67: =RC[-29] ->  | AI67: =RC[-29] ->  | AJ67: =RC[-29] ->  | AK67: =RC[-29] ->  | AL67: =RC[-29] ->  | AM67: =RC[-29] -> #VALUE! | AN67: =RC[-29] ->  | AO67: =RC[-29] ->  | AP67: =RC[-29] ->  | AQ67: =RC[-29] ->  | AR67: - | AS67: =RC[-30] ->  | AT67: =RC[-30] ->  | AU67: - | AV67: =RC[-31] -> #VALUE! | AW67: =RC[-31] ->  | AX67: =RC[-31] ->  | AY67: =RC[-31] -> #VALUE!
A68: =IF(RC[1]="","",DATEVALUE(RC[1])) ->  | C68: 24 | J68: =RC[-5]-RC[-2] -> #VALUE! | Q68: =RC[-3]-RC[-1] -> #VALUE! | T68: =RC[-8]+RC[-1] -> #VALUE! | U68: =(RC[-17]*RC[-16]-RC[-14]*RC[-13])/1000 -> #VALUE! | X68: =RC[-2]*RC[-10]/1000 -> #VALUE! | Y68: =(RC[-3]*RC[-11]-RC[-2]*RC[-9])/1000 -> #VALUE! | AD68: =VALUE(RC[-28]) -> #VALUE! | AE68: =IF(RC[22]=42,"*",IF(RC[22]=32,"",RC[22])) ->  | AF68: =RC[-29] -> 24 | AG68: =RC[-29] ->  | AH68: =RC[-29] ->  | AI68: =RC[-29] ->  | AJ68: =RC[-29] ->  | AK68: =RC[-29] ->  | AL68: =RC[-29] ->  | AM68: =RC[-29] -> #VALUE! | AN68: =RC[-29] ->  | AO68: =RC[-29] ->  | AP68: =RC[-29] ->  | AQ68: =RC[-29] ->  | AR68: - | AS68: =RC[-30] ->  | AT68: =RC[-30] ->  | AU68: - | AV68: =RC[-31] -> #VALUE! | AW68: =RC[-31] ->  | AX68: =RC[-31] ->  | AY68: =RC[-31] -> #VALUE!
A69: =IF(RC[1]="","",DATEVALUE(RC[1])) ->  | C69: 24 | J69: =RC[-5]-RC[-2] -> #VALUE! | Q69: =RC[-3]-RC[-1] -> #VALUE! | T69: =RC[-8]+RC[-1] -> #VALUE! | U69: =(RC[-17]*RC[-16]-RC[-14]*RC[-13])/1000 -> #VALUE! | X69: =RC[-2]*RC[-10]/1000 -> #VALUE! | Y69: =(RC[-3]*RC[-11]-RC[-2]*RC[-9])/1000 -> #VALUE! | AD69: =VALUE(RC[-28]) -> #VALUE! | AE69: =IF(RC[22]=42,"*",IF(RC[22]=32,"",RC[22])) ->  | AF69: =RC[-29] -> 24 | AG69: =RC[-29] ->  | AH69: =RC[-29] ->  | AI69: =RC[-29] ->  | AJ69: =RC[-29] ->  | AK69: =RC[-29] ->  | AL69: =RC[-29] ->  | AM69: =RC[-29] -> #VALUE! | AN69: =RC[-29] ->  | AO69: =RC[-29] ->  | AP69: =RC[-29] ->  | AQ69: =RC[-29] ->  | AR69: - | AS69: =RC[-30] ->  | AT69: =RC[-30] ->  | AU69: - | AV69: =RC[-31] -> #VALUE! | AW69: =RC[-31] ->  | AX69: =RC[-31] ->  | AY69: =RC[-31] -> #VALUE!
A70: =IF(RC[1]="","",DATEVALUE(RC[1])) ->  | C70: 24 | J70: =RC[-5]-RC[-2] -> #VALUE! | Q70: =RC[-3]-RC[-1] -> #VALUE! | T70: =RC[-8]+RC[-1] -> #VALUE! | U70: =(RC[-17]*RC[-16]-RC[-14]*RC[-13])/1000 -> #VALUE! | X70: =RC[-2]*RC[-10]/1000 -> #VALUE! | Y70: =(RC[-3]*RC[-11]-RC[-2]*RC[-9])/1000 -> #VALUE! | AD70: =VALUE(RC[-28]) -> #VALUE! | AE70: =IF(RC[22]=42,"*",IF(RC[22]=32,"",RC[22])) ->  | AF70: =RC[-29] -> 24 | AG70: =RC[-29] ->  | AH70: =RC[-29] ->  | AI70: =RC[-29] ->  | AJ70: =RC[-29] ->  | AK70: =RC[-29] ->  | AL70: =RC[-29] ->  | AM70: =RC[-29] -> #VALUE! | AN70: =RC[-29] ->  | AO70: =RC[-29] ->  | AP70: =RC[-29] ->  | AQ70: =RC[-29] ->  | AR70: - | AS70: =RC[-30] ->  | AT70: =RC[-30] ->  | AU70: - | AV70: =RC[-31] -> #VALUE! | AW70: =RC[-31] ->  | AX70: =RC[-31] ->  | AY70: =RC[-31] -> #VALUE!
A71: =IF(RC[1]="","",DATEVALUE(RC[1])) ->  | C71: 24 | J71: =RC[-5]-RC[-2] -> #VALUE! | Q71: =RC[-3]-RC[-1] -> #VALUE! | T71: =RC[-8]+RC[-1] -> #VALUE! | U71: =(RC[-17]*RC[-16]-RC[-14]*RC[-13])/1000 -> #VALUE! | X71: =RC[-2]*RC[-10]/1000 -> #VALUE! | Y71: =(RC[-3]*RC[-11]-RC[-2]*RC[-9])/1000 -> #VALUE! | AD71: =VALUE(RC[-28]) -> #VALUE! | AE71: =IF(RC[22]=42,"*",IF(RC[22]=32,"",RC[22])) ->  | AF71: =RC[-29] -> 24 | AG71: =RC[-29] ->  | AH71: =RC[-29] ->  | AI71: =RC[-29] ->  | AJ71: =RC[-29] ->  | AK71: =RC[-29] ->  | AL71: =RC[-29] ->  | AM71: =RC[-29] -> #VALUE! | AN71: =RC[-29] ->  | AO71: =RC[-29] ->  | AP71: =RC[-29] ->  | AQ71: =RC[-29] ->  | AR71: - | AS71: =RC[-30] ->  | AT71: =RC[-30] ->  | AU71: - | AV71: =RC[-31] -> #VALUE! | AW71: =RC[-31] ->  | AX71: =RC[-31] ->  | AY71: =RC[-31] -> #VALUE!
A72: =IF(RC[1]="","",DATEVALUE(RC[1])) ->  | C72: 24 | J72: =RC[-5]-RC[-2] -> #VALUE! | Q72: =RC[-3]-RC[-1] -> #VALUE! | T72: =RC[-8]+RC[-1] -> #VALUE! | U72: =(RC[-17]*RC[-16]-RC[-14]*RC[-13])/1000 -> #VALUE! | X72: =RC[-2]*RC[-10]/1000 -> #VALUE! | Y72: =(RC[-3]*RC[-11]-RC[-2]*RC[-9])/1000 -> #VALUE! | AD72: =VALUE(RC[-28]) -> #VALUE! | AE72: =IF(RC[22]=42,"*",IF(RC[22]=32,"",RC[22])) ->  | AF72: =RC[-29] -> 24 | AG72: =RC[-29] ->  | AH72: =RC[-29] ->  | AI72: =RC[-29] ->  | AJ72: =RC[-29] ->  | AK72: =RC[-29] ->  | AL72: =RC[-29] ->  | AM72: =RC[-29] -> #VALUE! | AN72: =RC[-29] ->  | AO72: =RC[-29] ->  | AP72: =RC[-29] ->  | AQ72: =RC[-29] ->  | AR72: - | AS72: =RC[-30] ->  | AT72: =RC[-30] ->  | AU72: - | AV72: =RC[-31] -> #VALUE! | AW72: =RC[-31] ->  | AX72: =RC[-31] ->  | AY72: =RC[-31] -> #VALUE!
A73: =IF(RC[1]="","",DATEVALUE(RC[1])) ->  | C73: 24 | J73: =RC[-5]-RC[-2] -> #VALUE! | Q73: =RC[-3]-RC[-1] -> #VALUE! | T73: =RC[-8]+RC[-1] -> #VALUE! | U73: =(RC[-17]*RC[-16]-RC[-14]*RC[-13])/1000 -> #VALUE! | X73: =RC[-2]*RC[-10]/1000 -> #VALUE! | Y73: =(RC[-3]*RC[-11]-RC[-2]*RC[-9])/1000 -> #VALUE! | AD73: =VALUE(RC[-28]) -> #VALUE! | AE73: =IF(RC[22]=42,"*",IF(RC[22]=32,"",RC[22])) ->  | AF73: =RC[-29] -> 24 | AG73: =RC[-29] ->  | AH73: =RC[-29] ->  | AI73: =RC[-29] ->  | AJ73: =RC[-29] ->  | AK73: =RC[-29] ->  | AL73: =RC[-29] ->  | AM73: =RC[-29] -> #VALUE! | AN73: =RC[-29] ->  | AO73: =RC[-29] ->  | AP73: =RC[-29] ->  | AQ73: =RC[-29] ->  | AR73: - | AS73: =RC[-30] ->  | AT73: =RC[-30] ->  | AU73: - | AV73: =RC[-31] -> #VALUE! | AW73: =RC[-31] ->  | AX73: =RC[-31] ->  | AY73: =RC[-31] -> #VALUE!
A74: =IF(RC[1]="","",DATEVALUE(RC[1])) ->  | C74: 24 | J74: =RC[-5]-RC[-2] -> #VALUE! | Q74: =RC[-3]-RC[-1] -> #VALUE! | T74: =RC[-8]+RC[-1] -> #VALUE! | U74: =(RC[-17]*RC[-16]-RC[-14]*RC[-13])/1000 -> #VALUE! | X74: =RC[-2]*RC[-10]/1000 -> #VALUE! | Y74: =(RC[-3]*RC[-11]-RC[-2]*RC[-9])/1000 -> #VALUE! | AD74: =VALUE(RC[-28]) -> #VALUE! | AE74: =IF(RC[22]=42,"*",IF(RC[22]=32,"",RC[22])) ->  | AF74: =RC[-29] -> 24 | AG74: =RC[-29] ->  | AH74: =RC[-29] ->  | AI74: =RC[-29] ->  | AJ74: =RC[-29] ->  | AK74: =RC[-29] ->  | AL74: =RC[-29] ->  | AM74: =RC[-29] -> #VALUE! | AN74: =RC[-29] ->  | AO74: =RC[-29] ->  | AP74: =RC[-29] ->  | AQ74: =RC[-29] ->  | AR74: - | AS74: =RC[-30] ->  | AT74: =RC[-30] ->  | AU74: - | AV74: =RC[-31] -> #VALUE! | AW74: =RC[-31] ->  | AX74: =RC[-31] ->  | AY74: =RC[-31] -> #VALUE!
A75: =IF(RC[1]="","",DATEVALUE(RC[1])) ->  | C75: 24 | J75: =RC[-5]-RC[-2] -> #VALUE! | Q75: =RC[-3]-RC[-1] -> #VALUE! | T75: =RC[-8]+RC[-1] -> #VALUE! | U75: =(RC[-17]*RC[-16]-RC[-14]*RC[-13])/1000 -> #VALUE! | X75: =RC[-2]*RC[-10]/1000 -> #VALUE! | Y75: =(RC[-3]*RC[-11]-RC[-2]*RC[-9])/1000 -> #VALUE! | AD75: =VALUE(RC[-28]) -> #VALUE! | AE75: =IF(RC[22]=42,"*",IF(RC[22]=32,"",RC[22])) ->  | AF75: =RC[-29] -> 24 | AG75: =RC[-29] ->  | AH75: =RC[-29] ->  | AI75: =RC[-29] ->  | AJ75: =RC[-29] ->  | AK75: =RC[-29] ->  | AL75: =RC[-29] ->  | AM75: =RC[-29] -> #VALUE! | AN75: =RC[-29] ->  | AO75: =RC[-29] ->  | AP75: =RC[-29] ->  | AQ75: =RC[-29] ->  | AR75: - | AS75: =RC[-30] ->  | AT75: =RC[-30] ->  | AU75: - | AV75: =RC[-31] -> #VALUE! | AW75: =RC[-31] ->  | AX75: =RC[-31] ->  | AY75: =RC[-31] -> #VALUE!
A76: =IF(RC[1]="","",DATEVALUE(RC[1])) ->  | C76: 24 | J76: =RC[-5]-RC[-2] -> #VALUE! | Q76: =RC[-3]-RC[-1] -> #VALUE! | T76: =RC[-8]+RC[-1] -> #VALUE! | U76: =(RC[-17]*RC[-16]-RC[-14]*RC[-13])/1000 -> #VALUE! | X76: =RC[-2]*RC[-10]/1000 -> #VALUE! | Y76: =(RC[-3]*RC[-11]-RC[-2]*RC[-9])/1000 -> #VALUE! | AD76: =VALUE(RC[-28]) -> #VALUE! | AE76: =IF(RC[22]=42,"*",IF(RC[22]=32,"",RC[22])) ->  | AF76: =RC[-29] -> 24 | AG76: =RC[-29] ->  | AH76: =RC[-29] ->  | AI76: =RC[-29] ->  | AJ76: =RC[-29] ->  | AK76: =RC[-29] ->  | AL76: =RC[-29] ->  | AM76: =RC[-29] -> #VALUE! | AN76: =RC[-29] ->  | AO76: =RC[-29] ->  | AP76: =RC[-29] ->  | AQ76: =RC[-29] ->  | AR76: - | AS76: =RC[-30] ->  | AT76: =RC[-30] ->  | AU76: - | AV76: =RC[-31] -> #VALUE! | AW76: =RC[-31] ->  | AX76: =RC[-31] ->  | AY76: =RC[-31] -> #VALUE!
A77: =IF(RC[1]="","",DATEVALUE(RC[1])) ->  | C77: 24 | J77: =RC[-5]-RC[-2] -> #VALUE! | Q77: =RC[-3]-RC[-1] -> #VALUE! | T77: =RC[-8]+RC[-1] -> #VALUE! | U77: =(RC[-17]*RC[-16]-RC[-14]*RC[-13])/1000 -> #VALUE! | X77: =RC[-2]*RC[-10]/1000 -> #VALUE! | Y77: =(RC[-3]*RC[-11]-RC[-2]*RC[-9])/1000 -> #VALUE! | AD77: =VALUE(RC[-28]) -> #VALUE! | AE77: =IF(RC[22]=42,"*",IF(RC[22]=32,"",RC[22])) ->  | AF77: =RC[-29] -> 24 | AG77: =RC[-29] ->  | AH77: =RC[-29] ->  | AI77: =RC[-29] ->  | AJ77: =RC[-29] ->  | AK77: =RC[-29] ->  | AL77: =RC[-29] ->  | AM77: =RC[-29] -> #VALUE! | AN77: =RC[-29] ->  | AO77: =RC[-29] ->  | AP77: =RC[-29] ->  | AQ77: =RC[-29] ->  | AR77: - | AS77: =RC[-30] ->  | AT77: =RC[-30] ->  | AU77: - | AV77: =RC[-31] -> #VALUE! | AW77: =RC[-31] ->  | AX77: =RC[-31] ->  | AY77: =RC[-31] -> #VALUE!
A78: =IF(RC[1]="","",DATEVALUE(RC[1])) ->  | C78: 24 | J78: =RC[-5]-RC[-2] -> #VALUE! | Q78: =RC[-3]-RC[-1] -> #VALUE! | T78: =RC[-8]+RC[-1] -> #VALUE! | U78: =(RC[-17]*RC[-16]-RC[-14]*RC[-13])/1000 -> #VALUE! | X78: =RC[-2]*RC[-10]/1000 -> #VALUE! | Y78: =(RC[-3]*RC[-11]-RC[-2]*RC[-9])/1000 -> #VALUE! | AD78: =VALUE(RC[-28]) -> #VALUE! | AE78: =IF(RC[22]=42,"*",IF(RC[22]=32,"",RC[22])) ->  | AF78: =RC[-29] -> 24 | AG78: =RC[-29] ->  | AH78: =RC[-29] ->  | AI78: =RC[-29] ->  | AJ78: =RC[-29] ->  | AK78: =RC[-29] ->  | AL78: =RC[-29] ->  | AM78: =RC[-29] -> #VALUE! | AN78: =RC[-29] ->  | AO78: =RC[-29] ->  | AP78: =RC[-29] ->  | AQ78: =RC[-29] ->  | AR78: - | AS78: =RC[-30] ->  | AT78: =RC[-30] ->  | AU78: - | AV78: =RC[-31] -> #VALUE! | AW78: =RC[-31] ->  | AX78: =RC[-31] ->  | AY78: =RC[-31] -> #VALUE!
A79: =IF(RC[1]="","",DATEVALUE(RC[1])) ->  | C79: 24 | J79: =RC[-5]-RC[-2] -> #VALUE! | Q79: =RC[-3]-RC[-1] -> #VALUE! | T79: =RC[-8]+RC[-1] -> #VALUE! | U79: =(RC[-17]*RC[-16]-RC[-14]*RC[-13])/1000 -> #VALUE! | X79: =RC[-2]*RC[-10]/1000 -> #VALUE! | Y79: =(RC[-3]*RC[-11]-RC[-2]*RC[-9])/1000 -> #VALUE! | AD79: =VALUE(RC[-28]) -> #VALUE! | AE79: =IF(RC[22]=42,"*",IF(RC[22]=32,"",RC[22])) ->  | AF79: =RC[-29] -> 24 | AG79: =RC[-29] ->  | AH79: =RC[-29] ->  | AI79: =RC[-29] ->  | AJ79: =RC[-29] ->  | AK79: =RC[-29] ->  | AL79: =RC[-29] ->  | AM79: =RC[-29] -> #VALUE! | AN79: =RC[-29] ->  | AO79: =RC[-29] ->  | AP79: =RC[-29] ->  | AQ79: =RC[-29] ->  | AR79: - | AS79: =RC[-30] ->  | AT79: =RC[-30] ->  | AU79: - | AV79: =RC[-31] -> #VALUE! | AW79: =RC[-31] ->  | AX79: =RC[-31] ->  | AY79: =RC[-31] -> #VALUE!
A80: =IF(RC[1]="","",DATEVALUE(RC[1])) ->  | C80: 24 | J80: =RC[-5]-RC[-2] -> #VALUE! | Q80: =RC[-3]-RC[-1] -> #VALUE! | T80: =RC[-8]+RC[-1] -> #VALUE! | U80: =(RC[-17]*RC[-16]-RC[-14]*RC[-13])/1000 -> #VALUE! | X80: =RC[-2]*RC[-10]/1000 -> #VALUE! | Y80: =(RC[-3]*RC[-11]-RC[-2]*RC[-9])/1000 -> #VALUE! | AD80: =VALUE(RC[-28]) -> #VALUE! | AE80: =IF(RC[22]=42,"*",IF(RC[22]=32,"",RC[22])) ->  | AF80: =RC[-29] -> 24 | AG80: =RC[-29] ->  | AH80: =RC[-29] ->  | AI80: =RC[-29] ->  | AJ80: =RC[-29] ->  | AK80: =RC[-29] ->  | AL80: =RC[-29] ->  | AM80: =RC[-29] -> #VALUE! | AN80: =RC[-29] ->  | AO80: =RC[-29] ->  | AP80: =RC[-29] ->  | AQ80: =RC[-29] ->  | AR80: - | AS80: =RC[-30] ->  | AT80: =RC[-30] ->  | AU80: - | AV80: =RC[-31] -> #VALUE! | AW80: =RC[-31] ->  | AX80: =RC[-31] ->  | AY80: =RC[-31] -> #VALUE!
A81: =IF(RC[1]="","",DATEVALUE(RC[1])) ->  | C81: 24 | J81: =RC[-5]-RC[-2] -> #VALUE! | Q81: =RC[-3]-RC[-1] -> #VALUE! | T81: =RC[-8]+RC[-1] -> #VALUE! | U81: =(RC[-17]*RC[-16]-RC[-14]*RC[-13])/1000 -> #VALUE! | X81: =RC[-2]*RC[-10]/1000 -> #VALUE! | Y81: =(RC[-3]*RC[-11]-RC[-2]*RC[-9])/1000 -> #VALUE! | AD81: =VALUE(RC[-28]) -> #VALUE! | AE81: =IF(RC[22]=42,"*",IF(RC[22]=32,"",RC[22])) ->  | AF81: =RC[-29] -> 24 | AG81: =RC[-29] ->  | AH81: =RC[-29] ->  | AI81: =RC[-29] ->  | AJ81: =RC[-29] ->  | AK81: =RC[-29] ->  | AL81: =RC[-29] ->  | AM81: =RC[-29] -> #VALUE! | AN81: =RC[-29] ->  | AO81: =RC[-29] ->  | AP81: =RC[-29] ->  | AQ81: =RC[-29] ->  | AR81: - | AS81: =RC[-30] ->  | AT81: =RC[-30] ->  | AU81: - | AV81: =RC[-31] -> #VALUE! | AW81: =RC[-31] ->  | AX81: =RC[-31] ->  | AY81: =RC[-31] -> #VALUE!
A82: =IF(RC[1]="","",DATEVALUE(RC[1])) ->  | C82: 24 | J82: =RC[-5]-RC[-2] -> #VALUE! | Q82: =RC[-3]-RC[-1] -> #VALUE! | T82: =RC[-8]+RC[-1] -> #VALUE! | U82: =(RC[-17]*RC[-16]-RC[-14]*RC[-13])/1000 -> #VALUE! | X82: =RC[-2]*RC[-10]/1000 -> #VALUE! | Y82: =(RC[-3]*RC[-11]-RC[-2]*RC[-9])/1000 -> #VALUE! | AD82: =VALUE(RC[-28]) -> #VALUE! | AE82: =IF(RC[22]=42,"*",IF(RC[22]=32,"",RC[22])) ->  | AF82: =RC[-29] -> 24 | AG82: =RC[-29] ->  | AH82: =RC[-29] ->  | AI82: =RC[-29] ->  | AJ82: =RC[-29] ->  | AK82: =RC[-29] ->  | AL82: =RC[-29] ->  | AM82: =RC[-29] -> #VALUE! | AN82: =RC[-29] ->  | AO82: =RC[-29] ->  | AP82: =RC[-29] ->  | AQ82: =RC[-29] ->  | AR82: - | AS82: =RC[-30] ->  | AT82: =RC[-30] ->  | AU82: - | AV82: =RC[-31] -> #VALUE! | AW82: =RC[-31] ->  | AX82: =RC[-31] ->  | AY82: =RC[-31] -> #VALUE!
A83: =IF(RC[1]="","",DATEVALUE(RC[1])) ->  | C83: 24 | J83: =RC[-5]-RC[-2] -> #VALUE! | Q83: =RC[-3]-RC[-1] -> #VALUE! | T83: =RC[-8]+RC[-1] -> #VALUE! | U83: =(RC[-17]*RC[-16]-RC[-14]*RC[-13])/1000 -> #VALUE! | X83: =RC[-2]*RC[-10]/1000 -> #VALUE! | Y83: =(RC[-3]*RC[-11]-RC[-2]*RC[-9])/1000 -> #VALUE! | AD83: =VALUE(RC[-28]) -> #VALUE! | AE83: =IF(RC[22]=42,"*",IF(RC[22]=32,"",RC[22])) ->  | AF83: =RC[-29] -> 24 | AG83: =RC[-29] ->  | AH83: =RC[-29] ->  | AI83: =RC[-29] ->  | AJ83: =RC[-29] ->  | AK83: =RC[-29] ->  | AL83: =RC[-29] ->  | AM83: =RC[-29] -> #VALUE! | AN83: =RC[-29] ->  | AO83: =RC[-29] ->  | AP83: =RC[-29] ->  | AQ83: =RC[-29] ->  | AR83: - | AS83: =RC[-30] ->  | AT83: =RC[-30] ->  | AU83: - | AV83: =RC[-31] -> #VALUE! | AW83: =RC[-31] ->  | AX83: =RC[-31] ->  | AY83: =RC[-31] -> #VALUE!
AD84: Среднее | AG84: =R[1]C[-29] -> 566.73899999999992 | AH84: =R[1]C[-29] -> 43.639000000000003 | AI84: =R[1]C[-29] -> 7.4000000000000039 | AJ84: =R[1]C[-29] -> 559.84000000000015 | AK84: =R[1]C[-29] -> 37.293000000000006 | AL84: =R[1]C[-29] -> 5.5 | AM84: =R[1]C[-29] -> 6.3459999999999965 | AN84: =R[1]C[-29] -> 6.8989999999999947 | AP84: =R[1]C[-29] -> 52.106444444444442 | AQ84: =R[1]C[-29] -> 65.299111111111117 | AS84: =R[1]C[-30] -> 21.145555555555561 | AT84: =R[1]C[-30] -> 66.107777777777798 | AU84: - | AV84: =R[1]C[-31] -> -0.80866666666668152
B85: Среднее | D85: =AVERAGE(OFFSET(R[-74]C,3,0,R7C1,1)) -> 566.73899999999992 | E85: =IF(SUM(OFFSET(R[-74]C,3,0,R7C1,1))=0,0,AVERAGE(OFFSET(R[-74]C,3,0,R7C1,1))) -> 43.639000000000003 | F85: =IF(SUM(OFFSET(R[-74]C,3,0,R7C1,1))=0,0,AVERAGE(OFFSET(R[-74]C,3,0,R7C1,1))) -> 7.4000000000000039 | G85: =AVERAGE(OFFSET(R[-74]C,3,0,R7C1,1)) -> 559.84000000000015 | H85: =IF(SUM(OFFSET(R[-74]C,3,0,R7C1,1))=0,0,AVERAGE(OFFSET(R[-74]C,3,0,R7C1,1))) -> 37.293000000000006 | I85: =IF(SUM(OFFSET(R[-74]C,3,0,R7C1,1))=0,0,AVERAGE(OFFSET(R[-74]C,3,0,R7C1,1))) -> 5.5 | J85: =RC[-5]-RC[-2] -> 6.3459999999999965 | K85: =AVERAGE(OFFSET(R[-74]C,3,0,R7C1,1)) -> 6.8989999999999947 | L85: =AVERAGE(OFFSET(R[-74]C,3,0,R7C1,1)) -> 4.9964333333333331 | M85: =AVERAGE(OFFSET(R[-74]C,3,0,R7C1,1)) -> 52.106444444444442 | N85: =IF(SUM(OFFSET(R[-74]C,3,0,R7C1,1))=0,0,AVERAGE(OFFSET(R[-74]C,3,0,R7C1,1))) -> 65.299111111111117 | O85: =AVERAGE(OFFSET(R[-74]C,3,0,R7C1,1)) -> 21.145555555555561 | P85: =IF(SUM(OFFSET(R[-74]C,3,0,R7C1,1))=0,0,AVERAGE(OFFSET(R[-74]C,3,0,R7C1,1))) -> 66.107777777777798 | Q85: =RC[-3]-RC[-1] -> -0.80866666666668152 | R85: =AVERAGE(OFFSET(R[-74]C,3,0,R7C1,1)) -> 73.251999999999995 | S85: =AVERAGE(OFFSET(R[-74]C,3,0,R7C1,1)) -> 4.7104777777777782 | T85: =AVERAGE(OFFSET(R[-74]C,3,0,R7C1,1)) -> 9.7728666666666655 | U85: =AVERAGE(OFFSET(R[-74]C,3,0,R7C1,1)) -> 4.9692697533333332 | X85: =AVERAGE(OFFSET(R[-74]C,3,0,R7C1,1)) -> 3.3420122040740745 | Y85: =AVERAGE(OFFSET(R[-74]C,3,0,R7C1,1)) -> 1.9641236485185185 | AD85: Итого | AF85: =R[1]C[-29] -> 720 | AG85: =R[1]C[-29] -> 17002.169999999998 | AJ85: =R[1]C[-29] -> 16795.200000000004 | AN85: =R[1]C[-29] -> 206.96999999999983 | AO85: =R[1]C[-29] -> 149.893 | AP85: =R[1]C[-29] -> 1563.1933333333332 | AS85: =R[1]C[-30] -> 634.36666666666679 | AW85: =R[1]C[-31] -> 2197.56 | AX85: =R[1]C[-31] -> 141.31433333333334 | AY85: =R[1]C[-31] -> 293.18599999999998
B86: ИТОГО: | C86: =SUM(OFFSET(R[-75]C,3,0,R7C1,1)) -> 720 | D86: =SUM(OFFSET(R[-75]C,3,0,R7C1,1)) -> 17002.169999999998 | G86: =SUM(OFFSET(R[-75]C,3,0,R7C1,1)) -> 16795.200000000004 | K86: =SUM(OFFSET(R[-75]C,3,0,R7C1,1)) -> 206.96999999999983 | L86: =SUM(OFFSET(R[-75]C,3,0,R7C1,1)) -> 149.893 | M86: =SUM(OFFSET(R[-75]C,3,0,R7C1,1)) -> 1563.1933333333332 | O86: =SUM(OFFSET(R[-75]C,3,0,R7C1,1)) -> 634.36666666666679 | R86: =SUM(OFFSET(R[-75]C,3,0,R7C1,1)) -> 2197.56 | S86: =SUM(OFFSET(R[-75]C,3,0,R7C1,1)) -> 141.31433333333334 | T86: =SUM(OFFSET(R[-75]C,3,0,R7C1,1)) -> 293.18599999999998 | U86: =SUM(OFFSET(R[-75]C,3,0,R7C1,1)) -> 149.07809259999999 | X86: =SUM(OFFSET(R[-75]C,3,0,R7C1,1)) -> 100.26036612222224 | Y86: =SUM(OFFSET(R[-75]C,3,0,R7C1,1)) -> 58.923709455555553
AD87: Досчёт по среднему до конца месяца | AG87: =R[1]C[-29] -> 0 | AJ87: =R[1]C[-29] -> 0 | AN87: =R[1]C[-29] -> 0 | AO87: =R[1]C[-29] -> 0 | AP87: =R[1]C[-29] -> 0 | AS87: =R[1]C[-30] -> 0 | AW87: =R[1]C[-31] -> 0 | AX87: =R[1]C[-31] -> 0 | AY87: =R[1]C[-31] -> 0
A88: 11дн=264ч 4дн=96ч | B88: Досчёт до конца м-ца (+) | C88: =R[-82]C[-2]*24 -> 216 | U88: № 181931 | AD88: Снятие досчёта по среднему предыдущего отчёта | AG88: =-R[1]C[-29] -> 0 | AJ88: =-R[1]C[-29] -> 0 | AN88: =-R[1]C[-29] -> 0 | AO88: =-R[1]C[-29] -> 0 | AP88: =-R[1]C[-29] -> 0 | AS88: =-R[1]C[-30] -> 0 | AW88: =-R[1]C[-31] -> 0 | AX88: =-R[1]C[-31] -> 0 | AY88: =-R[1]C[-31] -> 0
A89: 9дн=216ч 7дн=168ч | B89: Вычет с предыдущего (-) | C89: =R[-85]C[-2]*24 -> 192 | AD89: Сумма: | AG89: =R[1]C[-29] -> 17002.169999999998 | AJ89: =R[1]C[-29] -> 16795.200000000004 | AN89: =R[1]C[-29] -> 206.96999999999983 | AO89: =R[1]C[-29] -> 149.893 | AP89: =R[1]C[-29] -> 1563.1933333333332 | AS89: =R[1]C[-30] -> 634.36666666666679 | AW89: =R[1]C[-31] -> 2197.56 | AX89: =R[1]C[-31] -> 141.31433333333334 | AY89: =R[1]C[-31] -> 293.18599999999998
B90: СУММА: | C90: =R[-4]C+R[-2]C-R[-1]C -> 744 | D90: =R[-4]C+R[-2]C-R[-1]C -> 17002.169999999998 | G90: =R[-4]C+R[-2]C-R[-1]C -> 16795.200000000004 | K90: =R[-4]C+R[-2]C-R[-1]C -> 206.96999999999983 | L90: =R[-4]C+R[-2]C-R[-1]C -> 149.893 | M90: =R[-4]C+R[-2]C-R[-1]C -> 1563.1933333333332 | O90: =R[-4]C+R[-2]C-R[-1]C -> 634.36666666666679 | R90: =R[-4]C+R[-2]C-R[-1]C -> 2197.56 | S90: =R[-4]C+R[-2]C-R[-1]C -> 141.31433333333334 | T90: =R[-4]C+R[-2]C-R[-1]C -> 293.18599999999998 | AD90: Тхв на источнике | AE90: 0 | AF90: V гвс (м3) | AG90: =R[-1]C[16] -> 2197.56 | AH90: W гвс (Гкал) | AI90: =RC[-2]*0.06 -> 131.8536 | AJ90: W без гвс (Гкал) | AK90: =R[-1]C[4] -> 149.893
AD91: =R[-90]C[-17] -> з.н д. №02/147-2783 от 04.10.18 В данном отчете ГВС суммируется 24.09.18г, 25.09.18г некорректная работа М3
B93: Дата, время | D93: М1, т | F93: М2, т | H93: М3, т | J93: М4, т | L93: Qо, Гкал | N93: Qг, Гкал | P93: время, час
B94: 23.09.18 02:00 | D94: 158377.21 | F94: 156724.72 | H94: 169483.36 | J94: 169352.31 | L94: 3000.5219999999999 | N94: 2886.9140000000002 | P94: -
B95: 23.10.18 00:00 | D95: 162249.04999999999 | F95: 160417.03 | H95: 176409.48 | J95: 175379.33 | L95: 3040.989 | N95: 2941.0749999999998 | P95: -
B98: Представитель потредителя:_______________________________________________________ В.О. Топорков
I101: Рекомендуемые значения по параметрам теплопотребления (не являются официально утверждёнными)
I102: М, т | J102: V, м3 | K102: Qгвс, Гкал | L102: Qотоп, Гкал | M102: Qо, Гкал
I103: =R[-13]C[6] -> 634.36666666666679 | J103: =RC[-1]/0.98 -> 647.31292517006818 | K103: =R[-13]C[8] -> 141.31433333333334 | L103: =R[-13]C -> 149.893 | M103: =R[-6]C[2] -> 0
P105: ДЛЯ САМОКОНТРОЛЯ
B106: В строке выбора дат указать период с 16.7.13 по 23.8.13 - жильё | O106: Qo | Q106: Qг
B107: В строке выбора дат указать период с 18.7.13 по 25.8.13 - не жилое | O107: =((R[-21]C[-11]*R[-22]C[-8])-(R[-21]C[-10]*R[-22]C[-7]))/1000 -> 9518.4948528000023 | Q107: =IF(R[-22]C[-3]="",R[-21]C[-4]*R[-22]C[-1]/1000,"") ->  | R107: Си4
Q108: =IF(R[-23]C[-3]="","",((R[-22]C[-4]*R[-23]C[-1])-(R[-22]C[-3]*R[-23]C[1]))/1000) -> 103.33923750370373 | R108: Си5