Sheet: Лист1
G1: Отчёт о теплопотреблении за октябрь 2018 | M1: з.н д. №02/147-2783 от 04.10.18 15.10.18г некорректная работа приборов В данном отчете ГВС суммируется
A4: =EOMONTH(R[9]C,0)-R[9]C -> 8 | B4: Потребитель: ЗАО "Сити Сервис"
A5: =MAX(R[9]C:R[78]C) -> 2018-10-22T00:00:00.000 | B5: Адрес: г. СПб, Кораблестроителей ул., д.29 к.2 ИТП 2
A6: =EOMONTH(R[-1]C,0)-R[-1]C -> 9 | B6: Телефон: 8-911-021-19-79
A7: =R[-2]C-R[6]C -> 30 | B7: Договор 10023-2 (.) 327
A8: 7 | B8: Тепловычислитель: СПТ-943 № 26505 | L8: М2 мах= | M8: 114 | O8: Мгвс мах= | P8: 70.56
L9: Qотоп мах= | M9: 9.12 | O9: Qгвс мах= | P9: 4.176
B10: Расчётная формула: Q=M1*(h1-h2)+(M1-M2)*(h2-hхв)
D12: Учет | L12: Контроль
A13: =R[1]C[1]-1 -> 2018-09-22T00:00:00.000 | B13: Дата | C13: N, ч | D13: M1, т | E13: T1, С | F13: P1, кг/см2 | G13: M2, т | H13: T2, С | I13: P2, кг/см2 | J13: dT, С | K13: M1-М2, т | L13: V3, м3 | M13: T3, С | N13: V4, м3 | O13: =IF(R[-12]C[-14]="м.куб","","T4, С") -> T4, С | P13: dT, С | Q13: V3+V4, м3 | R13: Qгвс, Гкал | S13: Qобщ., Гкал | T13: Q | U13: M3 | V13: M4 | W13: си2 | X13: си3 | Y13: Разб. | Z13: dM2 | AC13: Дата | AD13: НС | AE13: n, ч | AF13: М1, т | AG13: t1, гр. С | AH13: Р1, кгс/см2 | AI13: М2, т | AJ13: t2, гр. С | AK13: Р2, кгс/см2 | AL13: t1-t2, гр. С | AM13: М1-М2, т | AN13: М1гвс, т | AO13: t1гвс, гр. С | AP13: Р1гвс, кгс/см2 | AQ13: М2гвс, т | AR13: t2гвс, гр. С | AS13: Р2гвс, кгс/см2 | AT13: t1гвс-t2гвс | AU13: М1гвс-М2гвс, т | AV13: Wгвс, Гкал | AW13: Wсумм, Гкал | AY13: NS_TV1 | AZ13: НС | BA13: NS_TV2
A14: =IF(RC[1]="","",DATEVALUE(RC[1])) -> 43366 | B14: 23.09.18 | C14: 24 | D14: 14.837669999999999 | E14: 60.884762000000002 | F14: 7.5763809999999996 | G14: 0 | H14: 24.253052 | I14: 7.738645 | J14: =RC[-5]-RC[-2] -> 36.631709999999998 | K14: 14.837669999999999 | L14: 11.33461 | M14: 60.311515999999997 | N14: 3.4705219999999999 | O14: 59.879233999999997 | P14: =IF(AND(ISNUMBER(RC[-3]),ISNUMBER(RC[-1])),RC[-3]-RC[-1],"-") -> 0.43228200000000072 | Q14: 14.805132 | R14: 0.87716400000000005 | S14: =RC[-1] -> 0.87716400000000005 | T14: =(RC[-16]*RC[-15]-RC[-13]*RC[-12])/1000 -> 0.90338800658453999 | U14: 11.144890999999999 | V14: 3.4131740000000002 | W14: =RC[-2]*RC[-10]/1000 -> 0.67216527186475594 | X14: =ABS((RC[-3]*RC[-11]-RC[-2]*RC[-9])/1000) -> 0.46778702723603993 | Y14: =(RC[-14]-RC[1])/RC[-18]*100 -> #DIV/0! | Z14: =RC[-5]+RC[-4] -> 14.558064999999999 | AC14: =VALUE(RC[-27]) -> 2018-09-23T00:00:00.000 | AD14: =IF(RC[21]=42,"*",IF(RC[21]=32,"",RC[21])) -> - | AE14: =RC[-28] -> 24 | AF14: =RC[-28] -> 14.837669999999999 | AG14: =RC[-28] -> 60.884762000000002 | AH14: =RC[-28] -> 7.5763809999999996 | AI14: =RC[-28] -> 0 | AJ14: =RC[-28] -> 24.253052 | AK14: =RC[-28] -> 7.738645 | AL14: =RC[-28] -> 36.631709999999998 | AM14: =RC[-28] -> 14.837669999999999 | AN14: =RC[-28] -> 11.33461 | AO14: =RC[-28] -> 60.311515999999997 | AP14: - | AQ14: =RC[-29] -> 3.4705219999999999 | AR14: =RC[-29] -> 59.879233999999997 | AS14: - | AT14: =RC[-30] -> 0.43228200000000072 | AU14: =RC[-30] -> 14.805132 | AV14: =RC[-30] -> 0.87716400000000005 | AW14: =RC[-30] -> 0.87716400000000005 | AY14: - | AZ14: - | BA14: -
A15: =IF(RC[1]="","",DATEVALUE(RC[1])) -> 43367 | B15: 24.09.18 | C15: 24 | D15: 16.910533999999998 | E15: 63.404139999999998 | F15: 7.6667040000000002 | G15: 0 | H15: 58.157654000000001 | I15: 7.6528770000000002 | J15: =RC[-5]-RC[-2] -> 5.2464859999999973 | K15: 16.910533999999998 | L15: 11.163777 | M15: 62.870643999999999 | N15: 2.7078329999999999 | O15: 61.624080999999997 | P15: =IF(AND(ISNUMBER(RC[-3]),ISNUMBER(RC[-1])),RC[-3]-RC[-1],"-") -> 1.2465630000000019 | Q15: 13.87161 | R15: 0.85374700000000003 | S15: =RC[-1] -> 0.85374700000000003 | T15: =(RC[-16]*RC[-15]-RC[-13]*RC[-12])/1000 -> 1.0721978652107598 | U15: 10.962024 | V15: 2.6606339999999999 | W15: =RC[-2]*RC[-10]/1000 -> 0.68918950842345605 | X15: =ABS((RC[-3]*RC[-11]-RC[-2]*RC[-9])/1000) -> 0.52523038329610194 | Y15: =(RC[-14]-RC[1])/RC[-18]*100 -> #DIV/0! | Z15: =RC[-5]+RC[-4] -> 13.622657999999999 | AC15: =VALUE(RC[-27]) -> 2018-09-24T00:00:00.000 | AD15: =IF(RC[21]=42,"*",IF(RC[21]=32,"",RC[21])) -> - | AE15: =RC[-28] -> 24 | AF15: =RC[-28] -> 16.910533999999998 | AG15: =RC[-28] -> 63.404139999999998 | AH15: =RC[-28] -> 7.6667040000000002 | AI15: =RC[-28] -> 0 | AJ15: =RC[-28] -> 58.157654000000001 | AK15: =RC[-28] -> 7.6528770000000002 | AL15: =RC[-28] -> 5.2464859999999973 | AM15: =RC[-28] -> 16.910533999999998 | AN15: =RC[-28] -> 11.163777 | AO15: =RC[-28] -> 62.870643999999999 | AP15: - | AQ15: =RC[-29] -> 2.7078329999999999 | AR15: =RC[-29] -> 61.624080999999997 | AS15: - | AT15: =RC[-30] -> 1.2465630000000019 | AU15: =RC[-30] -> 13.87161 | AV15: =RC[-30] -> 0.85374700000000003 | AW15: =RC[-30] -> 0.85374700000000003 | AY15: - | AZ15: - | BA15: -
A16: =IF(RC[1]="","",DATEVALUE(RC[1])) -> 43368 | B16: 25.09.18 | C16: 24 | D16: 15.005115999999999 | E16: 64.060028000000003 | F16: 7.7217190000000002 | G16: 0 | H16: 25.340064999999999 | I16: 7.8875900000000003 | J16: =RC[-5]-RC[-2] -> 38.719963000000007 | K16: 15.005115999999999 | L16: 10.992787999999999 | M16: 63.622925000000002 | N16: 2.821844 | O16: 61.725101000000002 | P16: =IF(AND(ISNUMBER(RC[-3]),ISNUMBER(RC[-1])),RC[-3]-RC[-1],"-") -> 1.897824 | Q16: 13.814632 | R16: 0.85827699999999996 | S16: =RC[-1] -> 0.85827699999999996 | T16: =(RC[-16]*RC[-15]-RC[-13]*RC[-12])/1000 -> 0.961228151103248 | U16: 10.789947 | V16: 2.7725979999999999 | W16: =RC[-2]*RC[-10]/1000 -> 0.68648798873497507 | X16: =ABS((RC[-3]*RC[-11]-RC[-2]*RC[-9])/1000) -> 0.51534909715257704 | Y16: =(RC[-14]-RC[1])/RC[-18]*100 -> #DIV/0! | Z16: =RC[-5]+RC[-4] -> 13.562545 | AC16: =VALUE(RC[-27]) -> 2018-09-25T00:00:00.000 | AD16: =IF(RC[21]=42,"*",IF(RC[21]=32,"",RC[21])) -> - | AE16: =RC[-28] -> 24 | AF16: =RC[-28] -> 15.005115999999999 | AG16: =RC[-28] -> 64.060028000000003 | AH16: =RC[-28] -> 7.7217190000000002 | AI16: =RC[-28] -> 0 | AJ16: =RC[-28] -> 25.340064999999999 | AK16: =RC[-28] -> 7.8875900000000003 | AL16: =RC[-28] -> 38.719963000000007 | AM16: =RC[-28] -> 15.005115999999999 | AN16: =RC[-28] -> 10.992787999999999 | AO16: =RC[-28] -> 63.622925000000002 | AP16: - | AQ16: =RC[-29] -> 2.821844 | AR16: =RC[-29] -> 61.725101000000002 | AS16: - | AT16: =RC[-30] -> 1.897824 | AU16: =RC[-30] -> 13.814632 | AV16: =RC[-30] -> 0.85827699999999996 | AW16: =RC[-30] -> 0.85827699999999996 | AY16: - | AZ16: - | BA16: -
A17: =IF(RC[1]="","",DATEVALUE(RC[1])) -> 43369 | B17: 26.09.18 | C17: 24 | D17: 36.473846000000002 | E17: 63.615158000000001 | F17: 7.298133 | G17: 21.384325 | H17: 58.649169999999998 | I17: 5.4529490000000003 | J17: =RC[-5]-RC[-2] -> 4.965988000000003 | K17: 15.089525 | L17: 11.270466000000001 | M17: 62.257122000000003 | N17: 3.6383999999999999 | O17: 61.492119000000002 | P17: =IF(AND(ISNUMBER(RC[-3]),ISNUMBER(RC[-1])),RC[-3]-RC[-1],"-") -> 0.7650030000000001 | Q17: 14.908866 | R17: 0.90978400000000004 | S17: 1.068327 | T17: =(RC[-16]*RC[-15]-RC[-13]*RC[-12])/1000 -> 1.0661165638974179 | U17: 11.070694 | V17: 3.575358 | W17: =RC[-2]*RC[-10]/1000 -> 0.68922954698266803 | X17: =ABS((RC[-3]*RC[-11]-RC[-2]*RC[-9])/1000) -> 0.46937320737906602 | Y17: =(RC[-14]-RC[1])/RC[-18]*100 -> 2.0738227650393495 | Z17: =RC[-5]+RC[-4] -> 14.646051999999999 | AC17: =VALUE(RC[-27]) -> 2018-09-26T00:00:00.000 | AD17: =IF(RC[21]=42,"*",IF(RC[21]=32,"",RC[21])) -> - | AE17: =RC[-28] -> 24 | AF17: =RC[-28] -> 36.473846000000002 | AG17: =RC[-28] -> 63.615158000000001 | AH17: =RC[-28] -> 7.298133 | AI17: =RC[-28] -> 21.384325 | AJ17: =RC[-28] -> 58.649169999999998 | AK17: =RC[-28] -> 5.4529490000000003 | AL17: =RC[-28] -> 4.965988000000003 | AM17: =RC[-28] -> 15.089525 | AN17: =RC[-28] -> 11.270466000000001 | AO17: =RC[-28] -> 62.257122000000003 | AP17: - | AQ17: =RC[-29] -> 3.6383999999999999 | AR17: =RC[-29] -> 61.492119000000002 | AS17: - | AT17: =RC[-30] -> 0.7650030000000001 | AU17: =RC[-30] -> 14.908866 | AV17: =RC[-30] -> 0.90978400000000004 | AW17: =RC[-30] -> 1.068327 | AY17: - | AZ17: - | BA17: -
A18: =IF(RC[1]="","",DATEVALUE(RC[1])) -> 43370 | B18: 27.09.18 | C18: 24 | D18: 106.58110000000001 | E18: 62.124499999999998 | F18: 7.0934309999999998 | G18: 92.954635999999994 | H18: 43.409717999999998 | I18: 5.4933889999999996 | J18: =RC[-5]-RC[-2] -> 18.714782 | K18: 13.626443 | L18: 10.951521 | M18: 61.638767000000001 | N18: 3.4024450000000002 | O18: 60.618355000000001 | P18: =IF(AND(ISNUMBER(RC[-3]),ISNUMBER(RC[-1])),RC[-3]-RC[-1],"-") -> 1.0204120000000003 | Q18: 14.353966 | R18: 0.86673599999999995 | S18: 2.5896889999999999 | T18: =(RC[-16]*RC[-15]-RC[-13]*RC[-12])/1000 -> 2.5861630113973524 | U18: 10.760980999999999 | V18: 3.3450359999999999 | W18: =RC[-2]*RC[-10]/1000 -> 0.66329360055042696 | X18: =ABS((RC[-3]*RC[-11]-RC[-2]*RC[-9])/1000) -> 0.46052302081464702 | Y18: =(RC[-14]-RC[1])/RC[-18]*100 -> -0.51592262703282443 | Z18: =RC[-5]+RC[-4] -> 14.106017 | AC18: =VALUE(RC[-27]) -> 2018-09-27T00:00:00.000 | AD18: =IF(RC[21]=42,"*",IF(RC[21]=32,"",RC[21])) -> - | AE18: =RC[-28] -> 24 | AF18: =RC[-28] -> 106.58110000000001 | AG18: =RC[-28] -> 62.124499999999998 | AH18: =RC[-28] -> 7.0934309999999998 | AI18: =RC[-28] -> 92.954635999999994 | AJ18: =RC[-28] -> 43.409717999999998 | AK18: =RC[-28] -> 5.4933889999999996 | AL18: =RC[-28] -> 18.714782 | AM18: =RC[-28] -> 13.626443 | AN18: =RC[-28] -> 10.951521 | AO18: =RC[-28] -> 61.638767000000001 | AP18: - | AQ18: =RC[-29] -> 3.4024450000000002 | AR18: =RC[-29] -> 60.618355000000001 | AS18: - | AT18: =RC[-30] -> 1.0204120000000003 | AU18: =RC[-30] -> 14.353966 | AV18: =RC[-30] -> 0.86673599999999995 | AW18: =RC[-30] -> 2.5896889999999999 | AY18: - | AZ18: - | BA18: -
A19: =IF(RC[1]="","",DATEVALUE(RC[1])) -> 43371 | B19: 28.09.18 | C19: 24 | D19: 108.75221999999999 | E19: 66.355063999999999 | F19: 7.3177070000000004 | G19: 94.835494999999995 | H19: 41.176476000000001 | I19: 5.617013 | J19: =RC[-5]-RC[-2] -> 25.178587999999998 | K19: 13.916709000000001 | L19: 11.452465999999999 | M19: 66.012282999999996 | N19: 3.3788559999999999 | O19: 64.427398999999994 | P19: =IF(AND(ISNUMBER(RC[-3]),ISNUMBER(RC[-1])),RC[-3]-RC[-1],"-") -> 1.5848840000000024 | Q19: 14.831322 | R19: 0.95538500000000004 | S19: 3.314845 | T19: =(RC[-16]*RC[-15]-RC[-13]*RC[-12])/1000 -> 3.3112690344264593 | U19: 11.226347000000001 | V19: 3.3150499999999998 | W19: =RC[-2]*RC[-10]/1000 -> 0.74107679522020098 | X19: =ABS((RC[-3]*RC[-11]-RC[-2]*RC[-9])/1000) -> 0.527496746165251 | Y19: =(RC[-14]-RC[1])/RC[-18]*100 -> -0.65870695355151465 | Z19: =RC[-5]+RC[-4] -> 14.541397 | AC19: =VALUE(RC[-27]) -> 2018-09-28T00:00:00.000 | AD19: =IF(RC[21]=42,"*",IF(RC[21]=32,"",RC[21])) -> - | AE19: =RC[-28] -> 24 | AF19: =RC[-28] -> 108.75221999999999 | AG19: =RC[-28] -> 66.355063999999999 | AH19: =RC[-28] -> 7.3177070000000004 | AI19: =RC[-28] -> 94.835494999999995 | AJ19: =RC[-28] -> 41.176476000000001 | AK19: =RC[-28] -> 5.617013 | AL19: =RC[-28] -> 25.178587999999998 | AM19: =RC[-28] -> 13.916709000000001 | AN19: =RC[-28] -> 11.452465999999999 | AO19: =RC[-28] -> 66.012282999999996 | AP19: - | AQ19: =RC[-29] -> 3.3788559999999999 | AR19: =RC[-29] -> 64.427398999999994 | AS19: - | AT19: =RC[-30] -> 1.5848840000000024 | AU19: =RC[-30] -> 14.831322 | AV19: =RC[-30] -> 0.95538500000000004 | AW19: =RC[-30] -> 3.314845 | AY19: - | AZ19: - | BA19: -
A20: =IF(RC[1]="","",DATEVALUE(RC[1])) -> 43372 | B20: 29.09.18 | C20: 24 | D20: 122.796936 | E20: 66.464827999999997 | F20: 8.1432599999999997 | G20: 109.877075 | H20: 42.910502999999999 | I20: 5.9259510000000004 | J20: =RC[-5]-RC[-2] -> 23.554324999999999 | K20: 12.919860999999999 | L20: 11.060931999999999 | M20: 65.936950999999993 | N20: 2.9287890000000001 | O20: 64.489204000000001 | P20: =IF(AND(ISNUMBER(RC[-3]),ISNUMBER(RC[-1])),RC[-3]-RC[-1],"-") -> 1.4477469999999926 | Q20: 13.989720999999999 | R20: 0.900949 | S20: 3.4521269999999999 | T20: =(RC[-16]*RC[-15]-RC[-13]*RC[-12])/1000 -> 3.4467966737482829 | U20: 10.843023000000001 | V20: 2.8733849999999999 | W20: =RC[-2]*RC[-10]/1000 -> 0.71495587624287293 | X20: =ABS((RC[-3]*RC[-11]-RC[-2]*RC[-9])/1000) -> 0.52965356480733294 | Y20: =(RC[-14]-RC[1])/RC[-18]*100 -> -0.72494376101657432 | Z20: =RC[-5]+RC[-4] -> 13.716408000000001 | AC20: =VALUE(RC[-27]) -> 2018-09-29T00:00:00.000 | AD20: =IF(RC[21]=42,"*",IF(RC[21]=32,"",RC[21])) -> - | AE20: =RC[-28] -> 24 | AF20: =RC[-28] -> 122.796936 | AG20: =RC[-28] -> 66.464827999999997 | AH20: =RC[-28] -> 8.1432599999999997 | AI20: =RC[-28] -> 109.877075 | AJ20: =RC[-28] -> 42.910502999999999 | AK20: =RC[-28] -> 5.9259510000000004 | AL20: =RC[-28] -> 23.554324999999999 | AM20: =RC[-28] -> 12.919860999999999 | AN20: =RC[-28] -> 11.060931999999999 | AO20: =RC[-28] -> 65.936950999999993 | AP20: - | AQ20: =RC[-29] -> 2.9287890000000001 | AR20: =RC[-29] -> 64.489204000000001 | AS20: - | AT20: =RC[-30] -> 1.4477469999999926 | AU20: =RC[-30] -> 13.989720999999999 | AV20: =RC[-30] -> 0.900949 | AW20: =RC[-30] -> 3.4521269999999999 | AY20: - | AZ20: - | BA20: -
A21: =IF(RC[1]="","",DATEVALUE(RC[1])) -> 43373 | B21: 30.09.18 | C21: 24 | D21: 125.706131 | E21: 68.471114999999998 | F21: 8.1308150000000001 | G21: 111.23233 | H21: 44.232078999999999 | I21: 5.852652 | J21: =RC[-5]-RC[-2] -> 24.239035999999999 | K21: 14.473806 | L21: 12.419454 | M21: 68.273346000000004 | N21: 3.192733 | O21: 66.988692999999998 | P21: =IF(AND(ISNUMBER(RC[-3]),ISNUMBER(RC[-1])),RC[-3]-RC[-1],"-") -> 1.2846530000000058 | Q21: 15.612187 | R21: 1.040432 | S21: 3.6931609999999999 | T21: =(RC[-16]*RC[-15]-RC[-13]*RC[-12])/1000 -> 3.6872017439919955 | U21: 12.15864 | V21: 3.1279349999999999 | W21: =RC[-2]*RC[-10]/1000 -> 0.83011103560944 | X21: =ABS((RC[-3]*RC[-11]-RC[-2]*RC[-9])/1000) -> 0.62057475817048502 | Y21: =(RC[-14]-RC[1])/RC[-18]*100 -> -0.73069493374812822 | Z21: =RC[-5]+RC[-4] -> 15.286574999999999 | AC21: =VALUE(RC[-27]) -> 2018-09-30T00:00:00.000 | AD21: =IF(RC[21]=42,"*",IF(RC[21]=32,"",RC[21])) -> - | AE21: =RC[-28] -> 24 | AF21: =RC[-28] -> 125.706131 | AG21: =RC[-28] -> 68.471114999999998 | AH21: =RC[-28] -> 8.1308150000000001 | AI21: =RC[-28] -> 111.23233 | AJ21: =RC[-28] -> 44.232078999999999 | AK21: =RC[-28] -> 5.852652 | AL21: =RC[-28] -> 24.239035999999999 | AM21: =RC[-28] -> 14.473806 | AN21: =RC[-28] -> 12.419454 | AO21: =RC[-28] -> 68.273346000000004 | AP21: - | AQ21: =RC[-29] -> 3.192733 | AR21: =RC[-29] -> 66.988692999999998 | AS21: - | AT21: =RC[-30] -> 1.2846530000000058 | AU21: =RC[-30] -> 15.612187 | AV21: =RC[-30] -> 1.040432 | AW21: =RC[-30] -> 3.6931609999999999 | AY21: - | AZ21: - | BA21: -
A22: =IF(RC[1]="","",DATEVALUE(RC[1])) -> 43374 | B22: 01.10.18 | C22: 24 | D22: 120.731308 | E22: 67.468575000000001 | F22: 8.1507109999999994 | G22: 109.01520499999999 | H22: 44.169426000000001 | I22: 5.9619039999999996 | J22: =RC[-5]-RC[-2] -> 23.299149 | K22: 11.716106999999999 | L22: 9.9682449999999996 | M22: 66.895270999999994 | N22: 2.7651219999999999 | O22: 65.228897000000003 | P22: =IF(AND(ISNUMBER(RC[-3]),ISNUMBER(RC[-1])),RC[-3]-RC[-1],"-") -> 1.6663739999999905 | Q22: 12.733366999999999 | R22: 0.83085500000000001 | S22: 3.3357670000000001 | T22: =(RC[-16]*RC[-15]-RC[-13]*RC[-12])/1000 -> 3.3304302785237696 | U22: 9.7665830000000007 | V22: 2.7117119999999999 | W22: =RC[-2]*RC[-10]/1000 -> 0.65333821652899304 | X22: =ABS((RC[-3]*RC[-11]-RC[-2]*RC[-9])/1000) -> 0.47645623378732904 | Y22: =(RC[-14]-RC[1])/RC[-18]*100 -> -0.69915751660513958 | Z22: =RC[-5]+RC[-4] -> 12.478295000000001 | AC22: =VALUE(RC[-27]) -> 2018-10-01T00:00:00.000 | AD22: =IF(RC[21]=42,"*",IF(RC[21]=32,"",RC[21])) -> - | AE22: =RC[-28] -> 24 | AF22: =RC[-28] -> 120.731308 | AG22: =RC[-28] -> 67.468575000000001 | AH22: =RC[-28] -> 8.1507109999999994 | AI22: =RC[-28] -> 109.01520499999999 | AJ22: =RC[-28] -> 44.169426000000001 | AK22: =RC[-28] -> 5.9619039999999996 | AL22: =RC[-28] -> 23.299149 | AM22: =RC[-28] -> 11.716106999999999 | AN22: =RC[-28] -> 9.9682449999999996 | AO22: =RC[-28] -> 66.895270999999994 | AP22: - | AQ22: =RC[-29] -> 2.7651219999999999 | AR22: =RC[-29] -> 65.228897000000003 | AS22: - | AT22: =RC[-30] -> 1.6663739999999905 | AU22: =RC[-30] -> 12.733366999999999 | AV22: =RC[-30] -> 0.83085500000000001 | AW22: =RC[-30] -> 3.3357670000000001 | AY22: - | AZ22: - | BA22: -
A23: =IF(RC[1]="","",DATEVALUE(RC[1])) -> 43375 | B23: 02.10.18 | C23: 24 | D23: 123.577759 | E23: 66.247619999999998 | F23: 8.1256029999999999 | G23: 111.60527 | H23: 43.881999999999998 | I23: 5.8242929999999999 | J23: =RC[-5]-RC[-2] -> 22.36562 | K23: 11.972505999999999 | L23: 10.104699 | M23: 65.795394999999999 | N23: 2.9198659999999999 | O23: 64.402122000000006 | P23: =IF(AND(ISNUMBER(RC[-3]),ISNUMBER(RC[-1])),RC[-3]-RC[-1],"-") -> 1.3932729999999935 | Q23: 13.024565000000001 | R23: 0.83693799999999996 | S23: 3.2949009999999999 | T23: =(RC[-16]*RC[-15]-RC[-13]*RC[-12])/1000 -> 3.2892699605435793 | U23: 9.9064189999999996 | V23: 2.864773 | W23: =RC[-2]*RC[-10]/1000 -> 0.65179675114050495 | X23: =ABS((RC[-3]*RC[-11]-RC[-2]*RC[-9])/1000) -> 0.46729929089219896 | Y23: =(RC[-14]-RC[1])/RC[-18]*100 -> -0.71563466492218508 | Z23: =RC[-5]+RC[-4] -> 12.771191999999999 | AC23: =VALUE(RC[-27]) -> 2018-10-02T00:00:00.000 | AD23: =IF(RC[21]=42,"*",IF(RC[21]=32,"",RC[21])) -> - | AE23: =RC[-28] -> 24 | AF23: =RC[-28] -> 123.577759 | AG23: =RC[-28] -> 66.247619999999998 | AH23: =RC[-28] -> 8.1256029999999999 | AI23: =RC[-28] -> 111.60527 | AJ23: =RC[-28] -> 43.881999999999998 | AK23: =RC[-28] -> 5.8242929999999999 | AL23: =RC[-28] -> 22.36562 | AM23: =RC[-28] -> 11.972505999999999 | AN23: =RC[-28] -> 10.104699 | AO23: =RC[-28] -> 65.795394999999999 | AP23: - | AQ23: =RC[-29] -> 2.9198659999999999 | AR23: =RC[-29] -> 64.402122000000006 | AS23: - | AT23: =RC[-30] -> 1.3932729999999935 | AU23: =RC[-30] -> 13.024565000000001 | AV23: =RC[-30] -> 0.83693799999999996 | AW23: =RC[-30] -> 3.2949009999999999 | AY23: - | AZ23: - | BA23: -
A24: =IF(RC[1]="","",DATEVALUE(RC[1])) -> 43376 | B24: 03.10.18 | C24: 24 | D24: 124.307411 | E24: 66.360557999999997 | F24: 8.1110120000000006 | G24: 112.407639 | H24: 43.910389000000002 | I24: 5.7790299999999997 | J24: =RC[-5]-RC[-2] -> 22.450168999999995 | K24: 11.899778 | L24: 9.8161319999999996 | M24: 65.954109000000003 | N24: 3.1325780000000001 | O24: 64.734436000000002 | P24: =IF(AND(ISNUMBER(RC[-3]),ISNUMBER(RC[-1])),RC[-3]-RC[-1],"-") -> 1.2196730000000002 | Q24: 12.94871 | R24: 0.83421699999999999 | S24: 3.3189850000000001 | T24: =(RC[-16]*RC[-15]-RC[-13]*RC[-12])/1000 -> 3.313246002433766 | U24: 9.6226579999999995 | V24: 3.0729060000000001 | W24: =RC[-2]*RC[-10]/1000 -> 0.63465383460172198 | X24: =ABS((RC[-3]*RC[-11]-RC[-2]*RC[-9])/1000) -> 0.43573099781070596 | Y24: =(RC[-14]-RC[1])/RC[-18]*100 -> -0.70794654800996193 | Z24: =RC[-5]+RC[-4] -> 12.695563999999999 | AC24: =VALUE(RC[-27]) -> 2018-10-03T00:00:00.000 | AD24: =IF(RC[21]=42,"*",IF(RC[21]=32,"",RC[21])) -> - | AE24: =RC[-28] -> 24 | AF24: =RC[-28] -> 124.307411 | AG24: =RC[-28] -> 66.360557999999997 | AH24: =RC[-28] -> 8.1110120000000006 | AI24: =RC[-28] -> 112.407639 | AJ24: =RC[-28] -> 43.910389000000002 | AK24: =RC[-28] -> 5.7790299999999997 | AL24: =RC[-28] -> 22.450168999999995 | AM24: =RC[-28] -> 11.899778 | AN24: =RC[-28] -> 9.8161319999999996 | AO24: =RC[-28] -> 65.954109000000003 | AP24: - | AQ24: =RC[-29] -> 3.1325780000000001 | AR24: =RC[-29] -> 64.734436000000002 | AS24: - | AT24: =RC[-30] -> 1.2196730000000002 | AU24: =RC[-30] -> 12.94871 | AV24: =RC[-30] -> 0.83421699999999999 | AW24: =RC[-30] -> 3.3189850000000001 | AY24: - | AZ24: - | BA24: -
A25: =IF(RC[1]="","",DATEVALUE(RC[1])) -> 43377 | B25: 04.10.18 | C25: 24 | D25: 124.540009 | E25: 65.818077000000002 | F25: 8.0922040000000006 | G25: 111.536598 | H25: 43.298195 | I25: 5.797847 | J25: =RC[-5]-RC[-2] -> 22.519882000000003 | K25: 13.003413999999999 | L25: 11.103688 | M25: 65.458472999999998 | N25: 3.0030779999999999 | O25: 64.065535999999994 | P25: =IF(AND(ISNUMBER(RC[-3]),ISNUMBER(RC[-1])),RC[-3]-RC[-1],"-") -> 1.3929370000000034 | Q25: 14.106766 | R25: 0.90219300000000002 | S25: 3.3732609999999998 | T25: =(RC[-16]*RC[-15]-RC[-13]*RC[-12])/1000 -> 3.3676505321020831 | U25: 10.887853 | V25: 2.9469530000000002 | W25: =RC[-2]*RC[-10]/1000 -> 0.71270223162846902 | X25: =ABS((RC[-3]*RC[-11]-RC[-2]*RC[-9])/1000) -> 0.5239041081166611 | Y25: =(RC[-14]-RC[1])/RC[-18]*100 -> -0.74539838484225696 | Z25: =RC[-5]+RC[-4] -> 13.834806 | AC25: =VALUE(RC[-27]) -> 2018-10-04T00:00:00.000 | AD25: =IF(RC[21]=42,"*",IF(RC[21]=32,"",RC[21])) -> - | AE25: =RC[-28] -> 24 | AF25: =RC[-28] -> 124.540009 | AG25: =RC[-28] -> 65.818077000000002 | AH25: =RC[-28] -> 8.0922040000000006 | AI25: =RC[-28] -> 111.536598 | AJ25: =RC[-28] -> 43.298195 | AK25: =RC[-28] -> 5.797847 | AL25: =RC[-28] -> 22.519882000000003 | AM25: =RC[-28] -> 13.003413999999999 | AN25: =RC[-28] -> 11.103688 | AO25: =RC[-28] -> 65.458472999999998 | AP25: - | AQ25: =RC[-29] -> 3.0030779999999999 | AR25: =RC[-29] -> 64.065535999999994 | AS25: - | AT25: =RC[-30] -> 1.3929370000000034 | AU25: =RC[-30] -> 14.106766 | AV25: =RC[-30] -> 0.90219300000000002 | AW25: =RC[-30] -> 3.3732609999999998 | AY25: - | AZ25: - | BA25: -
A26: =IF(RC[1]="","",DATEVALUE(RC[1])) -> 43378 | B26: 05.10.18 | C26: 24 | D26: 125.710487 | E26: 65.219634999999997 | F26: 8.0700099999999999 | G26: 113.74245500000001 | H26: 43.036715999999998 | I26: 5.6892959999999997 | J26: =RC[-5]-RC[-2] -> 22.182918999999998 | K26: 11.975092 | L26: 10.060976 | M26: 64.846466000000007 | N26: 3.0416889999999999 | O26: 63.608803000000002 | P26: =IF(AND(ISNUMBER(RC[-3]),ISNUMBER(RC[-1])),RC[-3]-RC[-1],"-") -> 1.2376630000000048 | Q26: 13.102665 | R26: 0.83050400000000002 | S26: 3.3097259999999999 | T26: =(RC[-16]*RC[-15]-RC[-13]*RC[-12])/1000 -> 3.3036903448344637 | U26: 9.8687559999999994 | V26: 2.985595 | W26: =RC[-2]*RC[-10]/1000 -> 0.63995395041629599 | X26: =ABS((RC[-3]*RC[-11]-RC[-2]*RC[-9])/1000) -> 0.45004382622351102 | Y26: =(RC[-14]-RC[1])/RC[-18]*100 -> -0.77302621962924867 | Z26: =RC[-5]+RC[-4] -> 12.854350999999999 | AC26: =VALUE(RC[-27]) -> 2018-10-05T00:00:00.000 | AD26: =IF(RC[21]=42,"*",IF(RC[21]=32,"",RC[21])) -> - | AE26: =RC[-28] -> 24 | AF26: =RC[-28] -> 125.710487 | AG26: =RC[-28] -> 65.219634999999997 | AH26: =RC[-28] -> 8.0700099999999999 | AI26: =RC[-28] -> 113.74245500000001 | AJ26: =RC[-28] -> 43.036715999999998 | AK26: =RC[-28] -> 5.6892959999999997 | AL26: =RC[-28] -> 22.182918999999998 | AM26: =RC[-28] -> 11.975092 | AN26: =RC[-28] -> 10.060976 | AO26: =RC[-28] -> 64.846466000000007 | AP26: - | AQ26: =RC[-29] -> 3.0416889999999999 | AR26: =RC[-29] -> 63.608803000000002 | AS26: - | AT26: =RC[-30] -> 1.2376630000000048 | AU26: =RC[-30] -> 13.102665 | AV26: =RC[-30] -> 0.83050400000000002 | AW26: =RC[-30] -> 3.3097259999999999 | AY26: - | AZ26: - | BA26: -
A27: =IF(RC[1]="","",DATEVALUE(RC[1])) -> 43379 | B27: 06.10.18 | C27: 24 | D27: 125.374763 | E27: 65.728271000000007 | F27: 8.1127009999999995 | G27: 112.288826 | H27: 43.452660000000002 | I27: 5.7900929999999997 | J27: =RC[-5]-RC[-2] -> 22.275611000000005 | K27: 13.085926000000001 | L27: 10.887276999999999 | M27: 65.527450999999999 | N27: 3.3627660000000001 | O27: 64.489693000000003 | P27: =IF(AND(ISNUMBER(RC[-3]),ISNUMBER(RC[-1])),RC[-3]-RC[-1],"-") -> 1.0377579999999966 | Q27: 14.250043 | R27: 0.91297799999999996 | S27: 3.3671289999999998 | T27: =(RC[-16]*RC[-15]-RC[-13]*RC[-12])/1000 -> 3.3614182210476136 | U27: 10.675222 | V27: 3.2991450000000002 | W27: =RC[-2]*RC[-10]/1000 -> 0.6995200865191219 | X27: =ABS((RC[-3]*RC[-11]-RC[-2]*RC[-9])/1000) -> 0.48675923830663692 | Y27: =(RC[-14]-RC[1])/RC[-18]*100 -> -0.79121051635182316 | Z27: =RC[-5]+RC[-4] -> 13.974367000000001 | AC27: =VALUE(RC[-27]) -> 2018-10-06T00:00:00.000 | AD27: =IF(RC[21]=42,"*",IF(RC[21]=32,"",RC[21])) -> - | AE27: =RC[-28] -> 24 | AF27: =RC[-28] -> 125.374763 | AG27: =RC[-28] -> 65.728271000000007 | AH27: =RC[-28] -> 8.1127009999999995 | AI27: =RC[-28] -> 112.288826 | AJ27: =RC[-28] -> 43.452660000000002 | AK27: =RC[-28] -> 5.7900929999999997 | AL27: =RC[-28] -> 22.275611000000005 | AM27: =RC[-28] -> 13.085926000000001 | AN27: =RC[-28] -> 10.887276999999999 | AO27: =RC[-28] -> 65.527450999999999 | AP27: - | AQ27: =RC[-29] -> 3.3627660000000001 | AR27: =RC[-29] -> 64.489693000000003 | AS27: - | AT27: =RC[-30] -> 1.0377579999999966 | AU27: =RC[-30] -> 14.250043 | AV27: =RC[-30] -> 0.91297799999999996 | AW27: =RC[-30] -> 3.3671289999999998 | AY27: - | AZ27: - | BA27: -
A28: =IF(RC[1]="","",DATEVALUE(RC[1])) -> 43380 | B28: 07.10.18 | C28: 24 | D28: 128.211288 | E28: 66.012383 | F28: 8.0898079999999997 | G28: 113.077248 | H28: 43.624481000000003 | I28: 5.7339130000000003 | J28: =RC[-5]-RC[-2] -> 22.387901999999997 | K28: 15.134029 | L28: 12.256997999999999 | M28: 65.809334000000007 | N28: 4.0361219999999998 | O28: 64.771606000000006 | P28: =IF(AND(ISNUMBER(RC[-3]),ISNUMBER(RC[-1])),RC[-3]-RC[-1],"-") -> 1.0377280000000013 | Q28: 16.293119999999998 | R28: 1.048035 | S28: 3.5366420000000001 | T28: =(RC[-16]*RC[-15]-RC[-13]*RC[-12])/1000 -> 3.5305963914710148 | U28: 12.016384 | V28: 3.9591569999999998 | W28: =RC[-2]*RC[-10]/1000 -> 0.79079022812825606 | X28: =ABS((RC[-3]*RC[-11]-RC[-2]*RC[-9])/1000) -> 0.53434927083211414 | Y28: =(RC[-14]-RC[1])/RC[-18]*100 -> -0.74419214730093175 | Z28: =RC[-5]+RC[-4] -> 15.975541 | AC28: =VALUE(RC[-27]) -> 2018-10-07T00:00:00.000 | AD28: =IF(RC[21]=42,"*",IF(RC[21]=32,"",RC[21])) -> - | AE28: =RC[-28] -> 24 | AF28: =RC[-28] -> 128.211288 | AG28: =RC[-28] -> 66.012383 | AH28: =RC[-28] -> 8.0898079999999997 | AI28: =RC[-28] -> 113.077248 | AJ28: =RC[-28] -> 43.624481000000003 | AK28: =RC[-28] -> 5.7339130000000003 | AL28: =RC[-28] -> 22.387901999999997 | AM28: =RC[-28] -> 15.134029 | AN28: =RC[-28] -> 12.256997999999999 | AO28: =RC[-28] -> 65.809334000000007 | AP28: - | AQ28: =RC[-29] -> 4.0361219999999998 | AR28: =RC[-29] -> 64.771606000000006 | AS28: - | AT28: =RC[-30] -> 1.0377280000000013 | AU28: =RC[-30] -> 16.293119999999998 | AV28: =RC[-30] -> 1.048035 | AW28: =RC[-30] -> 3.5366420000000001 | AY28: - | AZ28: - | BA28: -
A29: =IF(RC[1]="","",DATEVALUE(RC[1])) -> 43381 | B29: 08.10.18 | C29: 24 | D29: 127.359764 | E29: 66.025047000000001 | F29: 8.0529530000000005 | G29: 113.899773 | H29: 43.274985999999998 | I29: 5.6669919999999996 | J29: =RC[-5]-RC[-2] -> 22.750061000000002 | K29: 13.459997 | L29: 12.035622 | M29: 65.732879999999994 | N29: 2.599278 | O29: 63.973647999999997 | P29: =IF(AND(ISNUMBER(RC[-3]),ISNUMBER(RC[-1])),RC[-3]-RC[-1],"-") -> 1.7592319999999972 | Q29: 14.6349 | R29: 0.93954700000000002 | S29: 3.4858820000000001 | T29: =(RC[-16]*RC[-15]-RC[-13]*RC[-12])/1000 -> 3.4799233220307295 | U29: 11.799859 | V29: 2.5508329999999999 | W29: =RC[-2]*RC[-10]/1000 -> 0.77563871566391995 | X29: =ABS((RC[-3]*RC[-11]-RC[-2]*RC[-9])/1000) -> 0.61245262321513583 | Y29: =(RC[-14]-RC[1])/RC[-18]*100 -> -0.781998924615942 | Z29: =RC[-5]+RC[-4] -> 14.350691999999999 | AC29: =VALUE(RC[-27]) -> 2018-10-08T00:00:00.000 | AD29: =IF(RC[21]=42,"*",IF(RC[21]=32,"",RC[21])) -> - | AE29: =RC[-28] -> 24 | AF29: =RC[-28] -> 127.359764 | AG29: =RC[-28] -> 66.025047000000001 | AH29: =RC[-28] -> 8.0529530000000005 | AI29: =RC[-28] -> 113.899773 | AJ29: =RC[-28] -> 43.274985999999998 | AK29: =RC[-28] -> 5.6669919999999996 | AL29: =RC[-28] -> 22.750061000000002 | AM29: =RC[-28] -> 13.459997 | AN29: =RC[-28] -> 12.035622 | AO29: =RC[-28] -> 65.732879999999994 | AP29: - | AQ29: =RC[-29] -> 2.599278 | AR29: =RC[-29] -> 63.973647999999997 | AS29: - | AT29: =RC[-30] -> 1.7592319999999972 | AU29: =RC[-30] -> 14.6349 | AV29: =RC[-30] -> 0.93954700000000002 | AW29: =RC[-30] -> 3.4858820000000001 | AY29: - | AZ29: - | BA29: -
A30: =IF(RC[1]="","",DATEVALUE(RC[1])) -> 43382 | B30: 09.10.18 | C30: 24 | D30: 124.989594 | E30: 65.901252999999997 | F30: 8.0429510000000004 | G30: 112.23822 | H30: 43.334147999999999 | I30: 5.7234210000000001 | J30: =RC[-5]-RC[-2] -> 22.567104999999998 | K30: 12.780319 | L30: 11.041499 | M30: 65.552406000000005 | N30: 2.850422 | O30: 64.175094999999999 | P30: =IF(AND(ISNUMBER(RC[-3]),ISNUMBER(RC[-1])),RC[-3]-RC[-1],"-") -> 1.3773110000000059 | Q30: 13.891921 | R30: 0.88986200000000004 | S30: 3.3801109999999999 | T30: =(RC[-16]*RC[-15]-RC[-13]*RC[-12])/1000 -> 3.3732232198247218 | U30: 10.826282000000001 | V30: 2.796967 | W30: =RC[-2]*RC[-10]/1000 -> 0.70968883313449216 | X30: =ABS((RC[-3]*RC[-11]-RC[-2]*RC[-9])/1000) -> 0.53019321019762722 | Y30: =(RC[-14]-RC[1])/RC[-18]*100 -> -0.75101868151508533 | Z30: =RC[-5]+RC[-4] -> 13.623249000000001 | AC30: =VALUE(RC[-27]) -> 2018-10-09T00:00:00.000 | AD30: =IF(RC[21]=42,"*",IF(RC[21]=32,"",RC[21])) -> - | AE30: =RC[-28] -> 24 | AF30: =RC[-28] -> 124.989594 | AG30: =RC[-28] -> 65.901252999999997 | AH30: =RC[-28] -> 8.0429510000000004 | AI30: =RC[-28] -> 112.23822 | AJ30: =RC[-28] -> 43.334147999999999 | AK30: =RC[-28] -> 5.7234210000000001 | AL30: =RC[-28] -> 22.567104999999998 | AM30: =RC[-28] -> 12.780319 | AN30: =RC[-28] -> 11.041499 | AO30: =RC[-28] -> 65.552406000000005 | AP30: - | AQ30: =RC[-29] -> 2.850422 | AR30: =RC[-29] -> 64.175094999999999 | AS30: - | AT30: =RC[-30] -> 1.3773110000000059 | AU30: =RC[-30] -> 13.891921 | AV30: =RC[-30] -> 0.88986200000000004 | AW30: =RC[-30] -> 3.3801109999999999 | AY30: - | AZ30: - | BA30: -
A31: =IF(RC[1]="","",DATEVALUE(RC[1])) -> 43383 | B31: 10.10.18 | C31: 24 | D31: 124.131844 | E31: 66.850646999999995 | F31: 8.0797670000000004 | G31: 110.836105 | H31: 46.357376000000002 | I31: 5.7948639999999996 | J31: =RC[-5]-RC[-2] -> 20.493270999999993 | K31: 13.295743999999999 | L31: 11.103289 | M31: 66.557456999999999 | N31: 2.8428 | O31: 65.331940000000003 | P31: =IF(AND(ISNUMBER(RC[-3]),ISNUMBER(RC[-1])),RC[-3]-RC[-1],"-") -> 1.2255169999999964 | Q31: 13.946089000000001 | R31: 0.90701100000000001 | S31: 3.167862 | T31: =(RC[-16]*RC[-15]-RC[-13]*RC[-12])/1000 -> 3.160223090842587 | U31: 10.880737999999999 | V31: 2.7877149999999999 | W31: =RC[-2]*RC[-10]/1000 -> 0.72419425156326589 | X31: =ABS((RC[-3]*RC[-11]-RC[-2]*RC[-9])/1000) -> 0.5420674224461659 | Y31: =(RC[-14]-RC[1])/RC[-18]*100 -> -0.33627038770444018 | Z31: =RC[-5]+RC[-4] -> 13.668453 | AC31: =VALUE(RC[-27]) -> 2018-10-10T00:00:00.000 | AD31: =IF(RC[21]=42,"*",IF(RC[21]=32,"",RC[21])) -> - | AE31: =RC[-28] -> 24 | AF31: =RC[-28] -> 124.131844 | AG31: =RC[-28] -> 66.850646999999995 | AH31: =RC[-28] -> 8.0797670000000004 | AI31: =RC[-28] -> 110.836105 | AJ31: =RC[-28] -> 46.357376000000002 | AK31: =RC[-28] -> 5.7948639999999996 | AL31: =RC[-28] -> 20.493270999999993 | AM31: =RC[-28] -> 13.295743999999999 | AN31: =RC[-28] -> 11.103289 | AO31: =RC[-28] -> 66.557456999999999 | AP31: - | AQ31: =RC[-29] -> 2.8428 | AR31: =RC[-29] -> 65.331940000000003 | AS31: - | AT31: =RC[-30] -> 1.2255169999999964 | AU31: =RC[-30] -> 13.946089000000001 | AV31: =RC[-30] -> 0.90701100000000001 | AW31: =RC[-30] -> 3.167862 | AY31: - | AZ31: - | BA31: -
A32: =IF(RC[1]="","",DATEVALUE(RC[1])) -> 43384 | B32: 11.10.18 | C32: 24 | D32: 126.265778 | E32: 67.939453 | F32: 8.0521159999999998 | G32: 114.750198 | H32: 45.658141999999998 | I32: 5.6196200000000003 | J32: =RC[-5]-RC[-2] -> 22.281311000000002 | K32: 11.544287000000001 | L32: 9.8325779999999998 | M32: 67.532248999999993 | N32: 2.7766440000000001 | O32: 66.049346999999997 | P32: =IF(AND(ISNUMBER(RC[-3]),ISNUMBER(RC[-1])),RC[-3]-RC[-1],"-") -> 1.4829019999999957 | Q32: 12.609222000000001 | R32: 0.83075200000000005 | S32: 3.346787 | T32: =(RC[-16]*RC[-15]-RC[-13]*RC[-12])/1000 -> 3.3391470551273188 | U32: 9.6301889999999997 | V32: 2.7217519999999999 | W32: =RC[-2]*RC[-10]/1000 -> 0.65034832146506094 | X32: =ABS((RC[-3]*RC[-11]-RC[-2]*RC[-9])/1000) -> 0.47057837916911693 | Y32: =(RC[-14]-RC[1])/RC[-18]*100 -> -0.70383669403341642 | Z32: =RC[-5]+RC[-4] -> 12.351941 | AC32: =VALUE(RC[-27]) -> 2018-10-11T00:00:00.000 | AD32: =IF(RC[21]=42,"*",IF(RC[21]=32,"",RC[21])) -> - | AE32: =RC[-28] -> 24 | AF32: =RC[-28] -> 126.265778 | AG32: =RC[-28] -> 67.939453 | AH32: =RC[-28] -> 8.0521159999999998 | AI32: =RC[-28] -> 114.750198 | AJ32: =RC[-28] -> 45.658141999999998 | AK32: =RC[-28] -> 5.6196200000000003 | AL32: =RC[-28] -> 22.281311000000002 | AM32: =RC[-28] -> 11.544287000000001 | AN32: =RC[-28] -> 9.8325779999999998 | AO32: =RC[-28] -> 67.532248999999993 | AP32: - | AQ32: =RC[-29] -> 2.7766440000000001 | AR32: =RC[-29] -> 66.049346999999997 | AS32: - | AT32: =RC[-30] -> 1.4829019999999957 | AU32: =RC[-30] -> 12.609222000000001 | AV32: =RC[-30] -> 0.83075200000000005 | AW32: =RC[-30] -> 3.346787 | AY32: - | AZ32: - | BA32: -
A33: =IF(RC[1]="","",DATEVALUE(RC[1])) -> 43385 | B33: 12.10.18 | C33: 24 | D33: 126.876953 | E33: 67.799949999999995 | F33: 8.0586289999999998 | G33: 114.620537 | H33: 45.042793000000003 | I33: 5.6307299999999998 | J33: =RC[-5]-RC[-2] -> 22.757156999999992 | K33: 12.256425999999999 | L33: 9.9958880000000008 | M33: 67.385872000000006 | N33: 3.2518440000000002 | O33: 66.028603000000004 | P33: =IF(AND(ISNUMBER(RC[-3]),ISNUMBER(RC[-1])),RC[-3]-RC[-1],"-") -> 1.3572690000000023 | Q33: 13.247731999999999 | R33: 0.87090999999999996 | S33: 3.4457300000000002 | T33: =(RC[-16]*RC[-15]-RC[-13]*RC[-12])/1000 -> 3.4394219479125079 | U33: 9.7909539999999993 | V33: 3.1876009999999999 | W33: =RC[-2]*RC[-10]/1000 -> 0.65977197300188795 | X33: =ABS((RC[-3]*RC[-11]-RC[-2]*RC[-9])/1000) -> 0.449299132050485 | Y33: =(RC[-14]-RC[1])/RC[-18]*100 -> -0.63001711464674148 | Z33: =RC[-5]+RC[-4] -> 12.978555 | AC33: =VALUE(RC[-27]) -> 2018-10-12T00:00:00.000 | AD33: =IF(RC[21]=42,"*",IF(RC[21]=32,"",RC[21])) -> - | AE33: =RC[-28] -> 24 | AF33: =RC[-28] -> 126.876953 | AG33: =RC[-28] -> 67.799949999999995 | AH33: =RC[-28] -> 8.0586289999999998 | AI33: =RC[-28] -> 114.620537 | AJ33: =RC[-28] -> 45.042793000000003 | AK33: =RC[-28] -> 5.6307299999999998 | AL33: =RC[-28] -> 22.757156999999992 | AM33: =RC[-28] -> 12.256425999999999 | AN33: =RC[-28] -> 9.9958880000000008 | AO33: =RC[-28] -> 67.385872000000006 | AP33: - | AQ33: =RC[-29] -> 3.2518440000000002 | AR33: =RC[-29] -> 66.028603000000004 | AS33: - | AT33: =RC[-30] -> 1.3572690000000023 | AU33: =RC[-30] -> 13.247731999999999 | AV33: =RC[-30] -> 0.87090999999999996 | AW33: =RC[-30] -> 3.4457300000000002 | AY33: - | AZ33: - | BA33: -
A34: =IF(RC[1]="","",DATEVALUE(RC[1])) -> 43386 | B34: 13.10.18 | C34: 24 | D34: 127.25412799999999 | E34: 68.803757000000004 | F34: 8.0582720000000005 | G34: 115.03789500000001 | H34: 45.947226999999998 | I34: 5.6138690000000002 | J34: =RC[-5]-RC[-2] -> 22.856530000000006 | K34: 12.216227999999999 | L34: 10.143376 | M34: 68.471016000000006 | N34: 3.1547670000000001 | O34: 67.143394000000001 | P34: =IF(AND(ISNUMBER(RC[-3]),ISNUMBER(RC[-1])),RC[-3]-RC[-1],"-") -> 1.3276220000000052 | Q34: 13.298143 | R34: 0.88804899999999998 | S34: 3.4764240000000002 | T34: =(RC[-16]*RC[-15]-RC[-13]*RC[-12])/1000 -> 3.469889824991732 | U34: 9.9292560000000005 | V34: 3.0904940000000001 | W34: =RC[-2]*RC[-10]/1000 -> 0.6798662464440961 | X34: =ABS((RC[-3]*RC[-11]-RC[-2]*RC[-9])/1000) -> 0.47235999014746005 | Y34: =(RC[-14]-RC[1])/RC[-18]*100 -> -0.69848461674303142 | Z34: =RC[-5]+RC[-4] -> 13.01975 | AC34: =VALUE(RC[-27]) -> 2018-10-13T00:00:00.000 | AD34: =IF(RC[21]=42,"*",IF(RC[21]=32,"",RC[21])) -> - | AE34: =RC[-28] -> 24 | AF34: =RC[-28] -> 127.25412799999999 | AG34: =RC[-28] -> 68.803757000000004 | AH34: =RC[-28] -> 8.0582720000000005 | AI34: =RC[-28] -> 115.03789500000001 | AJ34: =RC[-28] -> 45.947226999999998 | AK34: =RC[-28] -> 5.6138690000000002 | AL34: =RC[-28] -> 22.856530000000006 | AM34: =RC[-28] -> 12.216227999999999 | AN34: =RC[-28] -> 10.143376 | AO34: =RC[-28] -> 68.471016000000006 | AP34: - | AQ34: =RC[-29] -> 3.1547670000000001 | AR34: =RC[-29] -> 67.143394000000001 | AS34: - | AT34: =RC[-30] -> 1.3276220000000052 | AU34: =RC[-30] -> 13.298143 | AV34: =RC[-30] -> 0.88804899999999998 | AW34: =RC[-30] -> 3.4764240000000002 | AY34: - | AZ34: - | BA34: -
A35: =IF(RC[1]="","",DATEVALUE(RC[1])) -> 43387 | B35: 14.10.18 | C35: 24 | D35: 126.67894699999999 | E35: 69.587967000000006 | F35: 8.0500299999999996 | G35: 115.200806 | H35: 46.995789000000002 | I35: 5.5939040000000002 | J35: =RC[-5]-RC[-2] -> 22.592178000000004 | K35: 11.478156999999999 | L35: 10.006378 | M35: 69.287780999999995 | N35: 2.578633 | O35: 67.700339999999997 | P35: =IF(AND(ISNUMBER(RC[-3]),ISNUMBER(RC[-1])),RC[-3]-RC[-1],"-") -> 1.5874409999999983 | Q35: 12.585011 | R35: 0.84997199999999995 | S35: 3.408045 | T35: =(RC[-16]*RC[-15]-RC[-13]*RC[-12])/1000 -> 3.4013776120248158 | U35: 9.7905259999999998 | V35: 2.5252840000000001 | W35: =RC[-2]*RC[-10]/1000 -> 0.67836382136280604 | X35: =ABS((RC[-3]*RC[-11]-RC[-2]*RC[-9])/1000) -> 0.50740123596624598 | Y35: =(RC[-14]-RC[1])/RC[-18]*100 -> -0.72712425293274385 | Z35: =RC[-5]+RC[-4] -> 12.315809999999999 | AC35: =VALUE(RC[-27]) -> 2018-10-14T00:00:00.000 | AD35: =IF(RC[21]=42,"*",IF(RC[21]=32,"",RC[21])) -> - | AE35: =RC[-28] -> 24 | AF35: =RC[-28] -> 126.67894699999999 | AG35: =RC[-28] -> 69.587967000000006 | AH35: =RC[-28] -> 8.0500299999999996 | AI35: =RC[-28] -> 115.200806 | AJ35: =RC[-28] -> 46.995789000000002 | AK35: =RC[-28] -> 5.5939040000000002 | AL35: =RC[-28] -> 22.592178000000004 | AM35: =RC[-28] -> 11.478156999999999 | AN35: =RC[-28] -> 10.006378 | AO35: =RC[-28] -> 69.287780999999995 | AP35: - | AQ35: =RC[-29] -> 2.578633 | AR35: =RC[-29] -> 67.700339999999997 | AS35: - | AT35: =RC[-30] -> 1.5874409999999983 | AU35: =RC[-30] -> 12.585011 | AV35: =RC[-30] -> 0.84997199999999995 | AW35: =RC[-30] -> 3.408045 | AY35: - | AZ35: - | BA35: -
A36: =IF(RC[1]="","",DATEVALUE(RC[1])) -> 43388 | B36: 15.10.18 | C36: 24 | D36: =AVERAGE(R[-3]C:R[-1]C) -> 126.93667599999999 | E36: =AVERAGE(R[-3]C:R[-1]C) -> 68.730557999999988 | F36: =AVERAGE(R[-3]C:R[-1]C) -> 8.0556436666666666 | G36: =AVERAGE(R[-3]C:R[-1]C) -> 114.95307933333333 | H36: =AVERAGE(R[-3]C:R[-1]C) -> 45.995269666666672 | I36: =AVERAGE(R[-3]C:R[-1]C) -> 5.6128343333333346 | J36: =AVERAGE(R[-3]C:R[-1]C) -> 22.735288333333333 | K36: =AVERAGE(R[-3]C:R[-1]C) -> 11.983603666666667 | L36: =AVERAGE(R[-3]C:R[-1]C) -> 10.048547333333333 | M36: =AVERAGE(R[-3]C:R[-1]C) -> 68.381556333333336 | N36: =AVERAGE(R[-3]C:R[-1]C) -> 2.9950813333333333 | O36: =AVERAGE(R[-3]C:R[-1]C) -> 66.957445666666672 | P36: =AVERAGE(R[-3]C:R[-1]C) -> 1.4241106666666685 | Q36: =AVERAGE(R[-3]C:R[-1]C) -> 13.043628666666665 | R36: =AVERAGE(R[-3]C:R[-1]C) -> 0.8696436666666667 | S36: =AVERAGE(R[-3]C:R[-1]C) -> 3.4433996666666666 | T36: =(RC[-16]*RC[-15]-RC[-13]*RC[-12])/1000 -> 3.4371306891948108 | U36: 8.3625670000000003 | V36: 2.4684569999999999 | W36: =RC[-2]*RC[-10]/1000 -> 0.57184534640177431 | X36: =ABS((RC[-3]*RC[-11]-RC[-2]*RC[-9])/1000) -> 0.40656377094377139 | Y36: =(RC[-14]-RC[1])/RC[-18]*100 -> 1.0026522763470247 | Z36: =RC[-5]+RC[-4] -> 10.831023999999999 | AC36: =VALUE(RC[-27]) -> 2018-10-15T00:00:00.000 | AD36: =IF(RC[21]=42,"*",IF(RC[21]=32,"",RC[21])) -> - | AE36: =RC[-28] -> 24 | AF36: =RC[-28] -> 126.93667599999999 | AG36: =RC[-28] -> 68.730557999999988 | AH36: =RC[-28] -> 8.0556436666666666 | AI36: =RC[-28] -> 114.95307933333333 | AJ36: =RC[-28] -> 45.995269666666672 | AK36: =RC[-28] -> 5.6128343333333346 | AL36: =RC[-28] -> 22.735288333333333 | AM36: =RC[-28] -> 11.983603666666667 | AN36: =RC[-28] -> 10.048547333333333 | AO36: =RC[-28] -> 68.381556333333336 | AP36: - | AQ36: =RC[-29] -> 2.9950813333333333 | AR36: =RC[-29] -> 66.957445666666672 | AS36: - | AT36: =RC[-30] -> 1.4241106666666685 | AU36: =RC[-30] -> 13.043628666666665 | AV36: =RC[-30] -> 0.8696436666666667 | AW36: =RC[-30] -> 3.4433996666666666 | AY36: - | AZ36: - | BA36: -
A37: =IF(RC[1]="","",DATEVALUE(RC[1])) -> 43389 | B37: 16.10.18 | C37: 24 | D37: 126.943504 | E37: 69.167511000000005 | F37: 8.0488119999999999 | G37: 111.875603 | H37: 47.073647000000001 | I37: 5.5851179999999996 | J37: =RC[-5]-RC[-2] -> 22.093864000000004 | K37: 15.067919 | L37: 9.7913440000000005 | M37: 68.753592999999995 | N37: 2.795744 | O37: 67.381507999999997 | P37: =IF(AND(ISNUMBER(RC[-3]),ISNUMBER(RC[-1])),RC[-3]-RC[-1],"-") -> 1.3720849999999984 | Q37: 12.587088 | R37: 0.84403399999999995 | S37: 3.5207959999999998 | T37: =(RC[-16]*RC[-15]-RC[-13]*RC[-12])/1000 -> 3.5139735657644042 | U37: 9.5830970000000004 | V37: 2.7384110000000002 | W37: =RC[-2]*RC[-10]/1000 -> 0.65887235081752105 | X37: =ABS((RC[-3]*RC[-11]-RC[-2]*RC[-9])/1000) -> 0.47435408811373303 | Y37: =(RC[-14]-RC[1])/RC[-18]*100 -> 2.4548792823042915 | Z37: =RC[-5]+RC[-4] -> 12.321508000000001 | AC37: =VALUE(RC[-27]) -> 2018-10-16T00:00:00.000 | AD37: =IF(RC[21]=42,"*",IF(RC[21]=32,"",RC[21])) -> - | AE37: =RC[-28] -> 24 | AF37: =RC[-28] -> 126.943504 | AG37: =RC[-28] -> 69.167511000000005 | AH37: =RC[-28] -> 8.0488119999999999 | AI37: =RC[-28] -> 111.875603 | AJ37: =RC[-28] -> 47.073647000000001 | AK37: =RC[-28] -> 5.5851179999999996 | AL37: =RC[-28] -> 22.093864000000004 | AM37: =RC[-28] -> 15.067919 | AN37: =RC[-28] -> 9.7913440000000005 | AO37: =RC[-28] -> 68.753592999999995 | AP37: - | AQ37: =RC[-29] -> 2.795744 | AR37: =RC[-29] -> 67.381507999999997 | AS37: - | AT37: =RC[-30] -> 1.3720849999999984 | AU37: =RC[-30] -> 12.587088 | AV37: =RC[-30] -> 0.84403399999999995 | AW37: =RC[-30] -> 3.5207959999999998 | AY37: - | AZ37: - | BA37: -
A38: =IF(RC[1]="","",DATEVALUE(RC[1])) -> 43390 | B38: 17.10.18 | C38: 24 | D38: 126.46347 | E38: 69.293312 | F38: 8.0705620000000007 | G38: 115.75672900000001 | H38: 47.157184999999998 | I38: 5.5923170000000004 | J38: =RC[-5]-RC[-2] -> 22.136127000000002 | K38: 10.717326999999999 | L38: 9.4553200000000004 | M38: 68.900276000000005 | N38: 2.4037890000000002 | O38: 67.145308999999997 | P38: =IF(AND(ISNUMBER(RC[-3]),ISNUMBER(RC[-1])),RC[-3]-RC[-1],"-") -> 1.7549670000000077 | Q38: 11.859109 | R38: 0.79628299999999996 | S38: 3.3114560000000002 | T38: =(RC[-16]*RC[-15]-RC[-13]*RC[-12])/1000 -> 3.304311198864776 | U38: 9.2534360000000007 | V38: 2.3547989999999999 | W38: =RC[-2]*RC[-10]/1000 -> 0.63756429434833617 | X38: =ABS((RC[-3]*RC[-11]-RC[-2]*RC[-9])/1000) -> 0.47945058786044514 | Y38: =(RC[-14]-RC[1])/RC[-18]*100 -> -0.76963819528798305 | Z38: =RC[-5]+RC[-4] -> 11.608235000000001 | AC38: =VALUE(RC[-27]) -> 2018-10-17T00:00:00.000 | AD38: =IF(RC[21]=42,"*",IF(RC[21]=32,"",RC[21])) -> - | AE38: =RC[-28] -> 24 | AF38: =RC[-28] -> 126.46347 | AG38: =RC[-28] -> 69.293312 | AH38: =RC[-28] -> 8.0705620000000007 | AI38: =RC[-28] -> 115.75672900000001 | AJ38: =RC[-28] -> 47.157184999999998 | AK38: =RC[-28] -> 5.5923170000000004 | AL38: =RC[-28] -> 22.136127000000002 | AM38: =RC[-28] -> 10.717326999999999 | AN38: =RC[-28] -> 9.4553200000000004 | AO38: =RC[-28] -> 68.900276000000005 | AP38: - | AQ38: =RC[-29] -> 2.4037890000000002 | AR38: =RC[-29] -> 67.145308999999997 | AS38: - | AT38: =RC[-30] -> 1.7549670000000077 | AU38: =RC[-30] -> 11.859109 | AV38: =RC[-30] -> 0.79628299999999996 | AW38: =RC[-30] -> 3.3114560000000002 | AY38: - | AZ38: - | BA38: -
A39: =IF(RC[1]="","",DATEVALUE(RC[1])) -> 43391 | B39: 18.10.18 | C39: 24 | D39: 126.502144 | E39: 69.780349999999999 | F39: 8.0702800000000003 | G39: 115.88511699999999 | H39: 47.428576999999997 | I39: 5.5844649999999998 | J39: 22.351773000000001 | K39: 10.623664 | L39: 9.4612759999999998 | M39: 69.366646000000003 | N39: 2.3375110000000001 | O39: 67.469414 | P39: 1.8972320000000025 | Q39: 11.798787000000001 | R39: 0.797184 | S39: 3.3381349999999999 | T39: 3.3310976892818926 | U39: 9.2567550000000001 | V39: 2.2894589999999999 | W39: 0.64211004719372999 | X39: 0.48764159008670399 | Y39: -0.79609014848731552 | Z39: 11.546213999999999 | AC39: =VALUE(RC[-27]) -> 2018-10-18T00:00:00.000 | AD39: =IF(RC[21]=42,"*",IF(RC[21]=32,"",RC[21])) ->  | AE39: =RC[-28] -> 24 | AF39: =RC[-28] -> 126.502144 | AG39: =RC[-28] -> 69.780349999999999 | AH39: =RC[-28] -> 8.0702800000000003 | AI39: =RC[-28] -> 115.88511699999999 | AJ39: =RC[-28] -> 47.428576999999997 | AK39: =RC[-28] -> 5.5844649999999998 | AL39: =RC[-28] -> 22.351773000000001 | AM39: =RC[-28] -> 10.623664 | AN39: =RC[-28] -> 9.4612759999999998 | AO39: =RC[-28] -> 69.366646000000003 | AP39: - | AQ39: =RC[-29] -> 2.3375110000000001 | AR39: =RC[-29] -> 67.469414 | AS39: - | AT39: =RC[-30] -> 1.8972320000000025 | AU39: =RC[-30] -> 11.798787000000001 | AV39: =RC[-30] -> 0.797184 | AW39: =RC[-30] -> 3.3381349999999999
A40: =IF(RC[1]="","",DATEVALUE(RC[1])) -> 43392 | B40: 19.10.18 | C40: 24 | D40: 126.235626 | E40: 69.596778999999998 | F40: 8.0771639999999998 | G40: 115.57997899999999 | H40: 46.983856000000003 | I40: 5.6036060000000001 | J40: 22.612922999999995 | K40: 10.685898 | L40: 8.7712889999999994 | M40: 69.106361000000007 | N40: 3.013922 | O40: 67.779312000000004 | P40: 1.3270490000000024 | Q40: 11.785211 | R40: 0.79378599999999999 | S40: 3.3632399999999998 | T40: 3.355199874829629 | U40: 8.5829699999999995 | V40: 2.9514490000000002 | W40: 0.59313782327217002 | X40: 0.39309064064908206 | Y40: -0.73414185340871185 | Z40: 11.534419 | AC40: =VALUE(RC[-27]) -> 2018-10-19T00:00:00.000 | AD40: =IF(RC[21]=42,"*",IF(RC[21]=32,"",RC[21])) ->  | AE40: =RC[-28] -> 24 | AF40: =RC[-28] -> 126.235626 | AG40: =RC[-28] -> 69.596778999999998 | AH40: =RC[-28] -> 8.0771639999999998 | AI40: =RC[-28] -> 115.57997899999999 | AJ40: =RC[-28] -> 46.983856000000003 | AK40: =RC[-28] -> 5.6036060000000001 | AL40: =RC[-28] -> 22.612922999999995 | AM40: =RC[-28] -> 10.685898 | AN40: =RC[-28] -> 8.7712889999999994 | AO40: =RC[-28] -> 69.106361000000007 | AP40: - | AQ40: =RC[-29] -> 3.013922 | AR40: =RC[-29] -> 67.779312000000004 | AS40: - | AT40: =RC[-30] -> 1.3270490000000024 | AU40: =RC[-30] -> 11.785211 | AV40: =RC[-30] -> 0.79378599999999999 | AW40: =RC[-30] -> 3.3632399999999998
A41: =IF(RC[1]="","",DATEVALUE(RC[1])) -> 43393 | B41: 20.10.18 | C41: 24 | D41: 126.253372 | E41: 68.952774000000005 | F41: 8.0903729999999996 | G41: 115.59201 | H41: 46.394356000000002 | I41: 5.6041610000000004 | J41: 22.558418000000003 | K41: 10.735360999999999 | L41: 9.0471430000000002 | M41: 68.596237000000002 | N41: 2.474167 | O41: 66.579566999999997 | P41: 2.0166700000000048 | Q41: 11.52131 | R41: 0.76945399999999997 | S41: 3.3526639999999999 | T41: 3.3427033635583676 | U41: 8.8554870000000001 | V41: 2.4245220000000001 | W41: 0.60745308500241901 | X41: 0.44602946006044497 | Y41: -0.47118135587399201 | Z41: 11.280009 | AC41: =VALUE(RC[-27]) -> 2018-10-20T00:00:00.000 | AD41: =IF(RC[21]=42,"*",IF(RC[21]=32,"",RC[21])) ->  | AE41: =RC[-28] -> 24 | AF41: =RC[-28] -> 126.253372 | AG41: =RC[-28] -> 68.952774000000005 | AH41: =RC[-28] -> 8.0903729999999996 | AI41: =RC[-28] -> 115.59201 | AJ41: =RC[-28] -> 46.394356000000002 | AK41: =RC[-28] -> 5.6041610000000004 | AL41: =RC[-28] -> 22.558418000000003 | AM41: =RC[-28] -> 10.735360999999999 | AN41: =RC[-28] -> 9.0471430000000002 | AO41: =RC[-28] -> 68.596237000000002 | AP41: - | AQ41: =RC[-29] -> 2.474167 | AR41: =RC[-29] -> 66.579566999999997 | AS41: - | AT41: =RC[-30] -> 2.0166700000000048 | AU41: =RC[-30] -> 11.52131 | AV41: =RC[-30] -> 0.76945399999999997 | AW41: =RC[-30] -> 3.3526639999999999
A42: =IF(RC[1]="","",DATEVALUE(RC[1])) -> 43394 | B42: 21.10.18 | C42: 24 | D42: 127.942261 | E42: 68.147766000000004 | F42: 8.0682980000000004 | G42: 115.534531 | H42: 45.688628999999999 | I42: 5.5975859999999997 | J42: 22.459137000000005 | K42: 12.410674999999999 | L42: 10.444521 | M42: 67.768897999999993 | N42: 3.1100889999999999 | O42: 66.627487000000002 | P42: 1.1414109999999908 | Q42: 13.55461 | R42: 0.89688699999999999 | S42: 3.4470499999999999 | T42: 3.440364940590928 | U42: 10.228149 | V42: 3.047612 | W42: 0.69315038630980186 | X42: 0.49009565739875793 | Y42: -0.74876834874588249 | Z42: 13.275760999999999 | AC42: =VALUE(RC[-27]) -> 2018-10-21T00:00:00.000 | AD42: =IF(RC[21]=42,"*",IF(RC[21]=32,"",RC[21])) ->  | AE42: =RC[-28] -> 24 | AF42: =RC[-28] -> 127.942261 | AG42: =RC[-28] -> 68.147766000000004 | AH42: =RC[-28] -> 8.0682980000000004 | AI42: =RC[-28] -> 115.534531 | AJ42: =RC[-28] -> 45.688628999999999 | AK42: =RC[-28] -> 5.5975859999999997 | AL42: =RC[-28] -> 22.459137000000005 | AM42: =RC[-28] -> 12.410674999999999 | AN42: =RC[-28] -> 10.444521 | AO42: =RC[-28] -> 67.768897999999993 | AP42: - | AQ42: =RC[-29] -> 3.1100889999999999 | AR42: =RC[-29] -> 66.627487000000002 | AS42: - | AT42: =RC[-30] -> 1.1414109999999908 | AU42: =RC[-30] -> 13.55461 | AV42: =RC[-30] -> 0.89688699999999999 | AW42: =RC[-30] -> 3.4470499999999999
A43: =IF(RC[1]="","",DATEVALUE(RC[1])) -> 43395 | B43: 22.10.18 | C43: 24 | D43: 127.218109 | E43: 68.555931000000001 | F43: 8.0667139999999993 | G43: 114.717484 | H43: 45.691516999999997 | I43: 5.6125090000000002 | J43: 22.864414000000004 | K43: 12.518891999999999 | L43: 10.539400000000001 | M43: 68.292586999999997 | N43: 2.6149779999999998 | O43: 66.676636000000002 | P43: 1.6159509999999955 | Q43: 13.154377999999999 | R43: 0.87615200000000004 | S43: 3.487225 | T43: 3.479940032171251 | U43: 10.317947 | V43: 2.562376 | W43: 0.70463929315888907 | X43: 0.53378868131175294 | Y43: -0.31506182614674622 | Z43: 12.880323000000001 | AC43: =VALUE(RC[-27]) -> 2018-10-22T00:00:00.000 | AD43: =IF(RC[21]=42,"*",IF(RC[21]=32,"",RC[21])) ->  | AE43: =RC[-28] -> 24 | AF43: =RC[-28] -> 127.218109 | AG43: =RC[-28] -> 68.555931000000001 | AH43: =RC[-28] -> 8.0667139999999993 | AI43: =RC[-28] -> 114.717484 | AJ43: =RC[-28] -> 45.691516999999997 | AK43: =RC[-28] -> 5.6125090000000002 | AL43: =RC[-28] -> 22.864414000000004 | AM43: =RC[-28] -> 12.518891999999999 | AN43: =RC[-28] -> 10.539400000000001 | AO43: =RC[-28] -> 68.292586999999997 | AP43: - | AQ43: =RC[-29] -> 2.6149779999999998 | AR43: =RC[-29] -> 66.676636000000002 | AS43: - | AT43: =RC[-30] -> 1.6159509999999955 | AU43: =RC[-30] -> 13.154377999999999 | AV43: =RC[-30] -> 0.87615200000000004 | AW43: =RC[-30] -> 3.487225
A44: =IF(RC[1]="","",DATEVALUE(RC[1])) ->  | C44: 24 | J44: =RC[-5]-RC[-2] -> #VALUE! | P44: =IF(AND(ISNUMBER(RC[-3]),ISNUMBER(RC[-1])),RC[-3]-RC[-1],"-") -> - | T44: =(RC[-16]*RC[-15]-RC[-13]*RC[-12])/1000 -> #VALUE! | W44: =RC[-2]*RC[-10]/1000 -> #VALUE! | X44: =ABS((RC[-3]*RC[-11]-RC[-2]*RC[-9])/1000) -> #VALUE! | Y44: =(RC[-14]-RC[1])/RC[-18]*100 -> #VALUE! | Z44: =RC[-5]+RC[-4] -> #VALUE! | AC44: =VALUE(RC[-27]) -> #VALUE! | AD44: =IF(RC[21]=42,"*",IF(RC[21]=32,"",RC[21])) ->  | AE44: =RC[-28] -> 24 | AF44: =RC[-28] ->  | AG44: =RC[-28] ->  | AH44: =RC[-28] ->  | AI44: =RC[-28] ->  | AJ44: =RC[-28] ->  | AK44: =RC[-28] ->  | AL44: =RC[-28] -> #VALUE! | AM44: =RC[-28] ->  | AN44: =RC[-28] ->  | AO44: =RC[-28] ->  | AP44: - | AQ44: =RC[-29] ->  | AR44: =RC[-29] ->  | AS44: - | AT44: =RC[-30] -> - | AU44: =RC[-30] ->  | AV44: =RC[-30] ->  | AW44: =RC[-30] -> 
A45: =IF(RC[1]="","",DATEVALUE(RC[1])) ->  | C45: 24 | P45: =IF(AND(ISNUMBER(RC[-3]),ISNUMBER(RC[-1])),RC[-3]-RC[-1],"-") -> - | T45: =(RC[-16]*RC[-15]-RC[-13]*RC[-12])/1000 -> #VALUE! | W45: =RC[-2]*RC[-10]/1000 -> #VALUE! | X45: =ABS((RC[-3]*RC[-11]-RC[-2]*RC[-9])/1000) -> #VALUE! | Y45: =(RC[-14]-RC[1])/RC[-18]*100 -> #VALUE! | Z45: =RC[-5]+RC[-4] -> #VALUE! | AC45: =VALUE(RC[-27]) -> #VALUE! | AD45: =IF(RC[21]=42,"*",IF(RC[21]=32,"",RC[21])) ->  | AE45: =RC[-28] -> 24 | AF45: =RC[-28] ->  | AG45: =RC[-28] ->  | AH45: =RC[-28] ->  | AI45: =RC[-28] ->  | AJ45: =RC[-28] ->  | AK45: =RC[-28] ->  | AL45: =RC[-28] -> 0 | AM45: =RC[-28] ->  | AN45: =RC[-28] ->  | AO45: =RC[-28] ->  | AP45: - | AQ45: =RC[-29] ->  | AR45: =RC[-29] ->  | AS45: - | AT45: =RC[-30] -> - | AU45: =RC[-30] ->  | AV45: =RC[-30] ->  | AW45: =RC[-30] -> 
A46: =IF(RC[1]="","",DATEVALUE(RC[1])) ->  | C46: 24 | P46: =IF(AND(ISNUMBER(RC[-3]),ISNUMBER(RC[-1])),RC[-3]-RC[-1],"-") -> - | T46: =(RC[-16]*RC[-15]-RC[-13]*RC[-12])/1000 -> #VALUE! | W46: =RC[-2]*RC[-10]/1000 -> #VALUE! | X46: =ABS((RC[-3]*RC[-11]-RC[-2]*RC[-9])/1000) -> #VALUE! | Y46: =(RC[-14]-RC[1])/RC[-18]*100 -> #VALUE! | Z46: =RC[-5]+RC[-4] -> #VALUE! | AC46: =VALUE(RC[-27]) -> #VALUE! | AD46: =IF(RC[21]=42,"*",IF(RC[21]=32,"",RC[21])) ->  | AE46: =RC[-28] -> 24 | AF46: =RC[-28] ->  | AG46: =RC[-28] ->  | AH46: =RC[-28] ->  | AI46: =RC[-28] ->  | AJ46: =RC[-28] ->  | AK46: =RC[-28] ->  | AL46: =RC[-28] -> 0 | AM46: =RC[-28] ->  | AN46: =RC[-28] ->  | AO46: =RC[-28] ->  | AP46: - | AQ46: =RC[-29] ->  | AR46: =RC[-29] ->  | AS46: - | AT46: =RC[-30] -> - | AU46: =RC[-30] ->  | AV46: =RC[-30] ->  | AW46: =RC[-30] -> 
A47: =IF(RC[1]="","",DATEVALUE(RC[1])) ->  | C47: 24 | P47: =IF(AND(ISNUMBER(RC[-3]),ISNUMBER(RC[-1])),RC[-3]-RC[-1],"-") -> - | T47: =(RC[-16]*RC[-15]-RC[-13]*RC[-12])/1000 -> #VALUE! | W47: =RC[-2]*RC[-10]/1000 -> #VALUE! | X47: =ABS((RC[-3]*RC[-11]-RC[-2]*RC[-9])/1000) -> #VALUE! | Y47: =(RC[-14]-RC[1])/RC[-18]*100 -> #VALUE! | Z47: =RC[-5]+RC[-4] -> #VALUE! | AC47: =VALUE(RC[-27]) -> #VALUE! | AD47: =IF(RC[21]=42,"*",IF(RC[21]=32,"",RC[21])) ->  | AE47: =RC[-28] -> 24 | AF47: =RC[-28] ->  | AG47: =RC[-28] ->  | AH47: =RC[-28] ->  | AI47: =RC[-28] ->  | AJ47: =RC[-28] ->  | AK47: =RC[-28] ->  | AL47: =RC[-28] -> 0 | AM47: =RC[-28] ->  | AN47: =RC[-28] ->  | AO47: =RC[-28] ->  | AP47: - | AQ47: =RC[-29] ->  | AR47: =RC[-29] ->  | AS47: - | AT47: =RC[-30] -> - | AU47: =RC[-30] ->  | AV47: =RC[-30] ->  | AW47: =RC[-30] -> 
A48: =IF(RC[1]="","",DATEVALUE(RC[1])) ->  | C48: 24 | P48: =IF(AND(ISNUMBER(RC[-3]),ISNUMBER(RC[-1])),RC[-3]-RC[-1],"-") -> - | T48: =(RC[-16]*RC[-15]-RC[-13]*RC[-12])/1000 -> #VALUE! | W48: =RC[-2]*RC[-10]/1000 -> #VALUE! | X48: =ABS((RC[-3]*RC[-11]-RC[-2]*RC[-9])/1000) -> #VALUE! | Y48: =(RC[-14]-RC[1])/RC[-18]*100 -> #VALUE! | Z48: =RC[-5]+RC[-4] -> #VALUE! | AC48: =VALUE(RC[-27]) -> #VALUE! | AD48: =IF(RC[21]=42,"*",IF(RC[21]=32,"",RC[21])) ->  | AE48: =RC[-28] -> 24 | AF48: =RC[-28] ->  | AG48: =RC[-28] ->  | AH48: =RC[-28] ->  | AI48: =RC[-28] ->  | AJ48: =RC[-28] ->  | AK48: =RC[-28] ->  | AL48: =RC[-28] -> 0 | AM48: =RC[-28] ->  | AN48: =RC[-28] ->  | AO48: =RC[-28] ->  | AP48: - | AQ48: =RC[-29] ->  | AR48: =RC[-29] ->  | AS48: - | AT48: =RC[-30] -> - | AU48: =RC[-30] ->  | AV48: =RC[-30] ->  | AW48: =RC[-30] -> 
A49: =IF(RC[1]="","",DATEVALUE(RC[1])) ->  | C49: 24 | P49: =IF(AND(ISNUMBER(RC[-3]),ISNUMBER(RC[-1])),RC[-3]-RC[-1],"-") -> - | T49: =(RC[-16]*RC[-15]-RC[-13]*RC[-12])/1000 -> #VALUE! | W49: =RC[-2]*RC[-10]/1000 -> #VALUE! | X49: =ABS((RC[-3]*RC[-11]-RC[-2]*RC[-9])/1000) -> #VALUE! | Y49: =(RC[-14]-RC[1])/RC[-18]*100 -> #VALUE! | Z49: =RC[-5]+RC[-4] -> #VALUE! | AC49: =VALUE(RC[-27]) -> #VALUE! | AD49: =IF(RC[21]=42,"*",IF(RC[21]=32,"",RC[21])) ->  | AE49: =RC[-28] -> 24 | AF49: =RC[-28] ->  | AG49: =RC[-28] ->  | AH49: =RC[-28] ->  | AI49: =RC[-28] ->  | AJ49: =RC[-28] ->  | AK49: =RC[-28] ->  | AL49: =RC[-28] -> 0 | AM49: =RC[-28] ->  | AN49: =RC[-28] ->  | AO49: =RC[-28] ->  | AP49: - | AQ49: =RC[-29] ->  | AR49: =RC[-29] ->  | AS49: - | AT49: =RC[-30] -> - | AU49: =RC[-30] ->  | AV49: =RC[-30] ->  | AW49: =RC[-30] -> 
A50: =IF(RC[1]="","",DATEVALUE(RC[1])) ->  | P50: =IF(AND(ISNUMBER(RC[-3]),ISNUMBER(RC[-1])),RC[-3]-RC[-1],"-") -> - | T50: =(RC[-16]*RC[-15]-RC[-13]*RC[-12])/1000 -> #VALUE! | W50: =RC[-2]*RC[-10]/1000 -> #VALUE! | X50: =ABS((RC[-3]*RC[-11]-RC[-2]*RC[-9])/1000) -> #VALUE! | Y50: =(RC[-14]-RC[1])/RC[-18]*100 -> #VALUE! | Z50: =RC[-5]+RC[-4] -> #VALUE! | AC50: =VALUE(RC[-27]) -> #VALUE! | AD50: =IF(RC[21]=42,"*",IF(RC[21]=32,"",RC[21])) ->  | AE50: =RC[-28] ->  | AF50: =RC[-28] ->  | AG50: =RC[-28] ->  | AH50: =RC[-28] ->  | AI50: =RC[-28] ->  | AJ50: =RC[-28] ->  | AK50: =RC[-28] ->  | AL50: =RC[-28] -> 0 | AM50: =RC[-28] ->  | AN50: =RC[-28] ->  | AO50: =RC[-28] ->  | AP50: - | AQ50: =RC[-29] ->  | AR50: =RC[-29] ->  | AS50: - | AT50: =RC[-30] -> - | AU50: =RC[-30] ->  | AV50: =RC[-30] ->  | AW50: =RC[-30] -> 
A51: =IF(RC[1]="","",DATEVALUE(RC[1])) ->  | P51: =IF(AND(ISNUMBER(RC[-3]),ISNUMBER(RC[-1])),RC[-3]-RC[-1],"-") -> - | T51: =(RC[-16]*RC[-15]-RC[-13]*RC[-12])/1000 -> #VALUE! | W51: =RC[-2]*RC[-10]/1000 -> #VALUE! | X51: =ABS((RC[-3]*RC[-11]-RC[-2]*RC[-9])/1000) -> #VALUE! | Y51: =(RC[-14]-RC[1])/RC[-18]*100 -> #VALUE! | Z51: =RC[-5]+RC[-4] -> #VALUE! | AC51: =VALUE(RC[-27]) -> #VALUE! | AD51: =IF(RC[21]=42,"*",IF(RC[21]=32,"",RC[21])) ->  | AE51: =RC[-28] ->  | AF51: =RC[-28] ->  | AG51: =RC[-28] ->  | AH51: =RC[-28] ->  | AI51: =RC[-28] ->  | AJ51: =RC[-28] ->  | AK51: =RC[-28] ->  | AL51: =RC[-28] -> 0 | AM51: =RC[-28] ->  | AN51: =RC[-28] ->  | AO51: =RC[-28] ->  | AP51: - | AQ51: =RC[-29] ->  | AR51: =RC[-29] ->  | AS51: - | AT51: =RC[-30] -> - | AU51: =RC[-30] ->  | AV51: =RC[-30] ->  | AW51: =RC[-30] -> 
A52: =IF(RC[1]="","",DATEVALUE(RC[1])) ->  | P52: =IF(AND(ISNUMBER(RC[-3]),ISNUMBER(RC[-1])),RC[-3]-RC[-1],"-") -> - | T52: =(RC[-16]*RC[-15]-RC[-13]*RC[-12])/1000 -> #VALUE! | W52: =RC[-2]*RC[-10]/1000 -> #VALUE! | X52: =ABS((RC[-3]*RC[-11]-RC[-2]*RC[-9])/1000) -> #VALUE! | Y52: =(RC[-14]-RC[1])/RC[-18]*100 -> #VALUE! | Z52: =RC[-5]+RC[-4] -> #VALUE! | AC52: =VALUE(RC[-27]) -> #VALUE! | AD52: =IF(RC[21]=42,"*",IF(RC[21]=32,"",RC[21])) ->  | AE52: =RC[-28] ->  | AF52: =RC[-28] ->  | AG52: =RC[-28] ->  | AH52: =RC[-28] ->  | AI52: =RC[-28] ->  | AJ52: =RC[-28] ->  | AK52: =RC[-28] ->  | AL52: =RC[-28] -> 0 | AM52: =RC[-28] ->  | AN52: =RC[-28] ->  | AO52: =RC[-28] ->  | AP52: - | AQ52: =RC[-29] ->  | AR52: =RC[-29] ->  | AS52: - | AT52: =RC[-30] -> - | AU52: =RC[-30] ->  | AV52: =RC[-30] ->  | AW52: =RC[-30] -> 
A53: =IF(RC[1]="","",DATEVALUE(RC[1])) ->  | P53: =IF(AND(ISNUMBER(RC[-3]),ISNUMBER(RC[-1])),RC[-3]-RC[-1],"-") -> - | T53: =(RC[-16]*RC[-15]-RC[-13]*RC[-12])/1000 -> #VALUE! | W53: =RC[-2]*RC[-10]/1000 -> #VALUE! | X53: =ABS((RC[-3]*RC[-11]-RC[-2]*RC[-9])/1000) -> #VALUE! | Y53: =(RC[-14]-RC[1])/RC[-18]*100 -> #VALUE! | Z53: =RC[-5]+RC[-4] -> #VALUE! | AC53: =VALUE(RC[-27]) -> #VALUE! | AD53: =IF(RC[21]=42,"*",IF(RC[21]=32,"",RC[21])) ->  | AE53: =RC[-28] ->  | AF53: =RC[-28] ->  | AG53: =RC[-28] ->  | AH53: =RC[-28] ->  | AI53: =RC[-28] ->  | AJ53: =RC[-28] ->  | AK53: =RC[-28] ->  | AL53: =RC[-28] -> 0 | AM53: =RC[-28] ->  | AN53: =RC[-28] ->  | AO53: =RC[-28] ->  | AP53: - | AQ53: =RC[-29] ->  | AR53: =RC[-29] ->  | AS53: - | AT53: =RC[-30] -> - | AU53: =RC[-30] ->  | AV53: =RC[-30] ->  | AW53: =RC[-30] -> 
A54: =IF(RC[1]="","",DATEVALUE(RC[1])) ->  | P54: =IF(AND(ISNUMBER(RC[-3]),ISNUMBER(RC[-1])),RC[-3]-RC[-1],"-") -> - | T54: =(RC[-16]*RC[-15]-RC[-13]*RC[-12])/1000 -> #VALUE! | W54: =RC[-2]*RC[-10]/1000 -> #VALUE! | X54: =ABS((RC[-3]*RC[-11]-RC[-2]*RC[-9])/1000) -> #VALUE! | Y54: =(RC[-14]-RC[1])/RC[-18]*100 -> #VALUE! | Z54: =RC[-5]+RC[-4] -> #VALUE! | AC54: =VALUE(RC[-27]) -> #VALUE! | AD54: =IF(RC[21]=42,"*",IF(RC[21]=32,"",RC[21])) ->  | AE54: =RC[-28] ->  | AF54: =RC[-28] ->  | AG54: =RC[-28] ->  | AH54: =RC[-28] ->  | AI54: =RC[-28] ->  | AJ54: =RC[-28] ->  | AK54: =RC[-28] ->  | AL54: =RC[-28] -> 0 | AM54: =RC[-28] ->  | AN54: =RC[-28] ->  | AO54: =RC[-28] ->  | AP54: - | AQ54: =RC[-29] ->  | AR54: =RC[-29] ->  | AS54: - | AT54: =RC[-30] -> - | AU54: =RC[-30] ->  | AV54: =RC[-30] ->  | AW54: =RC[-30] -> 
A55: =IF(RC[1]="","",DATEVALUE(RC[1])) ->  | P55: =IF(AND(ISNUMBER(RC[-3]),ISNUMBER(RC[-1])),RC[-3]-RC[-1],"-") -> - | T55: =(RC[-16]*RC[-15]-RC[-13]*RC[-12])/1000 -> #VALUE! | W55: =RC[-2]*RC[-10]/1000 -> #VALUE! | X55: =ABS((RC[-3]*RC[-11]-RC[-2]*RC[-9])/1000) -> #VALUE! | Y55: =(RC[-14]-RC[1])/RC[-18]*100 -> #VALUE! | Z55: =RC[-5]+RC[-4] -> #VALUE! | AC55: =VALUE(RC[-27]) -> #VALUE! | AD55: =IF(RC[21]=42,"*",IF(RC[21]=32,"",RC[21])) ->  | AE55: =RC[-28] ->  | AF55: =RC[-28] ->  | AG55: =RC[-28] ->  | AH55: =RC[-28] ->  | AI55: =RC[-28] ->  | AJ55: =RC[-28] ->  | AK55: =RC[-28] ->  | AL55: =RC[-28] -> 0 | AM55: =RC[-28] ->  | AN55: =RC[-28] ->  | AO55: =RC[-28] ->  | AP55: - | AQ55: =RC[-29] ->  | AR55: =RC[-29] ->  | AS55: - | AT55: =RC[-30] -> - | AU55: =RC[-30] ->  | AV55: =RC[-30] ->  | AW55: =RC[-30] -> 
A56: =IF(RC[1]="","",DATEVALUE(RC[1])) ->  | P56: =IF(AND(ISNUMBER(RC[-3]),ISNUMBER(RC[-1])),RC[-3]-RC[-1],"-") -> - | T56: =(RC[-16]*RC[-15]-RC[-13]*RC[-12])/1000 -> #VALUE! | W56: =RC[-2]*RC[-10]/1000 -> #VALUE! | X56: =ABS((RC[-3]*RC[-11]-RC[-2]*RC[-9])/1000) -> #VALUE! | Y56: =(RC[-14]-RC[1])/RC[-18]*100 -> #VALUE! | Z56: =RC[-5]+RC[-4] -> #VALUE! | AC56: =VALUE(RC[-27]) -> #VALUE! | AD56: =IF(RC[21]=42,"*",IF(RC[21]=32,"",RC[21])) ->  | AE56: =RC[-28] ->  | AF56: =RC[-28] ->  | AG56: =RC[-28] ->  | AH56: =RC[-28] ->  | AI56: =RC[-28] ->  | AJ56: =RC[-28] ->  | AK56: =RC[-28] ->  | AL56: =RC[-28] -> 0 | AM56: =RC[-28] ->  | AN56: =RC[-28] ->  | AO56: =RC[-28] ->  | AP56: - | AQ56: =RC[-29] ->  | AR56: =RC[-29] ->  | AS56: - | AT56: =RC[-30] -> - | AU56: =RC[-30] ->  | AV56: =RC[-30] ->  | AW56: =RC[-30] -> 
A57: =IF(RC[1]="","",DATEVALUE(RC[1])) ->  | P57: =IF(AND(ISNUMBER(RC[-3]),ISNUMBER(RC[-1])),RC[-3]-RC[-1],"-") -> - | T57: =(RC[-16]*RC[-15]-RC[-13]*RC[-12])/1000 -> #VALUE! | W57: =RC[-2]*RC[-10]/1000 -> #VALUE! | X57: =ABS((RC[-3]*RC[-11]-RC[-2]*RC[-9])/1000) -> #VALUE! | Y57: =(RC[-14]-RC[1])/RC[-18]*100 -> #VALUE! | Z57: =RC[-5]+RC[-4] -> #VALUE! | AC57: =VALUE(RC[-27]) -> #VALUE! | AD57: =IF(RC[21]=42,"*",IF(RC[21]=32,"",RC[21])) ->  | AE57: =RC[-28] ->  | AF57: =RC[-28] ->  | AG57: =RC[-28] ->  | AH57: =RC[-28] ->  | AI57: =RC[-28] ->  | AJ57: =RC[-28] ->  | AK57: =RC[-28] ->  | AL57: =RC[-28] -> 0 | AM57: =RC[-28] ->  | AN57: =RC[-28] ->  | AO57: =RC[-28] ->  | AP57: - | AQ57: =RC[-29] ->  | AR57: =RC[-29] ->  | AS57: - | AT57: =RC[-30] -> - | AU57: =RC[-30] ->  | AV57: =RC[-30] ->  | AW57: =RC[-30] -> 
A58: =IF(RC[1]="","",DATEVALUE(RC[1])) ->  | P58: =IF(AND(ISNUMBER(RC[-3]),ISNUMBER(RC[-1])),RC[-3]-RC[-1],"-") -> - | T58: =(RC[-16]*RC[-15]-RC[-13]*RC[-12])/1000 -> #VALUE! | W58: =RC[-2]*RC[-10]/1000 -> #VALUE! | X58: =ABS((RC[-3]*RC[-11]-RC[-2]*RC[-9])/1000) -> #VALUE! | Y58: =(RC[-14]-RC[1])/RC[-18]*100 -> #VALUE! | Z58: =RC[-5]+RC[-4] -> #VALUE! | AC58: =VALUE(RC[-27]) -> #VALUE! | AD58: =IF(RC[21]=42,"*",IF(RC[21]=32,"",RC[21])) ->  | AE58: =RC[-28] ->  | AF58: =RC[-28] ->  | AG58: =RC[-28] ->  | AH58: =RC[-28] ->  | AI58: =RC[-28] ->  | AJ58: =RC[-28] ->  | AK58: =RC[-28] ->  | AL58: =RC[-28] -> 0 | AM58: =RC[-28] ->  | AN58: =RC[-28] ->  | AO58: =RC[-28] ->  | AP58: - | AQ58: =RC[-29] ->  | AR58: =RC[-29] ->  | AS58: - | AT58: =RC[-30] -> - | AU58: =RC[-30] ->  | AV58: =RC[-30] ->  | AW58: =RC[-30] -> 
A59: =IF(RC[1]="","",DATEVALUE(RC[1])) ->  | P59: =IF(AND(ISNUMBER(RC[-3]),ISNUMBER(RC[-1])),RC[-3]-RC[-1],"-") -> - | T59: =(RC[-16]*RC[-15]-RC[-13]*RC[-12])/1000 -> #VALUE! | W59: =RC[-2]*RC[-10]/1000 -> #VALUE! | X59: =ABS((RC[-3]*RC[-11]-RC[-2]*RC[-9])/1000) -> #VALUE! | Y59: =(RC[-14]-RC[1])/RC[-18]*100 -> #VALUE! | Z59: =RC[-5]+RC[-4] -> #VALUE! | AC59: =VALUE(RC[-27]) -> #VALUE! | AD59: =IF(RC[21]=42,"*",IF(RC[21]=32,"",RC[21])) ->  | AE59: =RC[-28] ->  | AF59: =RC[-28] ->  | AG59: =RC[-28] ->  | AH59: =RC[-28] ->  | AI59: =RC[-28] ->  | AJ59: =RC[-28] ->  | AK59: =RC[-28] ->  | AL59: =RC[-28] -> 0 | AM59: =RC[-28] ->  | AN59: =RC[-28] ->  | AO59: =RC[-28] ->  | AP59: - | AQ59: =RC[-29] ->  | AR59: =RC[-29] ->  | AS59: - | AT59: =RC[-30] -> - | AU59: =RC[-30] ->  | AV59: =RC[-30] ->  | AW59: =RC[-30] -> 
A60: =IF(RC[1]="","",DATEVALUE(RC[1])) ->  | P60: =IF(AND(ISNUMBER(RC[-3]),ISNUMBER(RC[-1])),RC[-3]-RC[-1],"-") -> - | T60: =(RC[-16]*RC[-15]-RC[-13]*RC[-12])/1000 -> #VALUE! | W60: =RC[-2]*RC[-10]/1000 -> #VALUE! | X60: =ABS((RC[-3]*RC[-11]-RC[-2]*RC[-9])/1000) -> #VALUE! | Y60: =(RC[-14]-RC[1])/RC[-18]*100 -> #VALUE! | Z60: =RC[-5]+RC[-4] -> #VALUE! | AC60: =VALUE(RC[-27]) -> #VALUE! | AD60: =IF(RC[21]=42,"*",IF(RC[21]=32,"",RC[21])) ->  | AE60: =RC[-28] ->  | AF60: =RC[-28] ->  | AG60: =RC[-28] ->  | AH60: =RC[-28] ->  | AI60: =RC[-28] ->  | AJ60: =RC[-28] ->  | AK60: =RC[-28] ->  | AL60: =RC[-28] -> 0 | AM60: =RC[-28] ->  | AN60: =RC[-28] ->  | AO60: =RC[-28] ->  | AP60: - | AQ60: =RC[-29] ->  | AR60: =RC[-29] ->  | AS60: - | AT60: =RC[-30] -> - | AU60: =RC[-30] ->  | AV60: =RC[-30] ->  | AW60: =RC[-30] -> 
A61: =IF(RC[1]="","",DATEVALUE(RC[1])) ->  | P61: =IF(AND(ISNUMBER(RC[-3]),ISNUMBER(RC[-1])),RC[-3]-RC[-1],"-") -> - | T61: =(RC[-16]*RC[-15]-RC[-13]*RC[-12])/1000 -> #VALUE! | W61: =RC[-2]*RC[-10]/1000 -> #VALUE! | X61: =ABS((RC[-3]*RC[-11]-RC[-2]*RC[-9])/1000) -> #VALUE! | Y61: =(RC[-14]-RC[1])/RC[-18]*100 -> #VALUE! | Z61: =RC[-5]+RC[-4] -> #VALUE! | AC61: =VALUE(RC[-27]) -> #VALUE! | AD61: =IF(RC[21]=42,"*",IF(RC[21]=32,"",RC[21])) ->  | AE61: =RC[-28] ->  | AF61: =RC[-28] ->  | AG61: =RC[-28] ->  | AH61: =RC[-28] ->  | AI61: =RC[-28] ->  | AJ61: =RC[-28] ->  | AK61: =RC[-28] ->  | AL61: =RC[-28] -> 0 | AM61: =RC[-28] ->  | AN61: =RC[-28] ->  | AO61: =RC[-28] ->  | AP61: - | AQ61: =RC[-29] ->  | AR61: =RC[-29] ->  | AS61: - | AT61: =RC[-30] -> - | AU61: =RC[-30] ->  | AV61: =RC[-30] ->  | AW61: =RC[-30] -> 
A62: =IF(RC[1]="","",DATEVALUE(RC[1])) ->  | P62: =IF(AND(ISNUMBER(RC[-3]),ISNUMBER(RC[-1])),RC[-3]-RC[-1],"-") -> - | T62: =(RC[-16]*RC[-15]-RC[-13]*RC[-12])/1000 -> #VALUE! | W62: =RC[-2]*RC[-10]/1000 -> #VALUE! | X62: =ABS((RC[-3]*RC[-11]-RC[-2]*RC[-9])/1000) -> #VALUE! | Y62: =(RC[-14]-RC[1])/RC[-18]*100 -> #VALUE! | Z62: =RC[-5]+RC[-4] -> #VALUE! | AC62: =VALUE(RC[-27]) -> #VALUE! | AD62: =IF(RC[21]=42,"*",IF(RC[21]=32,"",RC[21])) ->  | AE62: =RC[-28] ->  | AF62: =RC[-28] ->  | AG62: =RC[-28] ->  | AH62: =RC[-28] ->  | AI62: =RC[-28] ->  | AJ62: =RC[-28] ->  | AK62: =RC[-28] ->  | AL62: =RC[-28] -> 0 | AM62: =RC[-28] ->  | AN62: =RC[-28] ->  | AO62: =RC[-28] ->  | AP62: - | AQ62: =RC[-29] ->  | AR62: =RC[-29] ->  | AS62: - | AT62: =RC[-30] -> - | AU62: =RC[-30] ->  | AV62: =RC[-30] ->  | AW62: =RC[-30] -> 
A63: =IF(RC[1]="","",DATEVALUE(RC[1])) ->  | P63: =IF(AND(ISNUMBER(RC[-3]),ISNUMBER(RC[-1])),RC[-3]-RC[-1],"-") -> - | T63: =(RC[-16]*RC[-15]-RC[-13]*RC[-12])/1000 -> #VALUE! | W63: =RC[-2]*RC[-10]/1000 -> #VALUE! | X63: =ABS((RC[-3]*RC[-11]-RC[-2]*RC[-9])/1000) -> #VALUE! | Y63: =(RC[-14]-RC[1])/RC[-18]*100 -> #VALUE! | Z63: =RC[-5]+RC[-4] -> #VALUE! | AC63: =VALUE(RC[-27]) -> #VALUE! | AD63: =IF(RC[21]=42,"*",IF(RC[21]=32,"",RC[21])) ->  | AE63: =RC[-28] ->  | AF63: =RC[-28] ->  | AG63: =RC[-28] ->  | AH63: =RC[-28] ->  | AI63: =RC[-28] ->  | AJ63: =RC[-28] ->  | AK63: =RC[-28] ->  | AL63: =RC[-28] -> 0 | AM63: =RC[-28] ->  | AN63: =RC[-28] ->  | AO63: =RC[-28] ->  | AP63: - | AQ63: =RC[-29] ->  | AR63: =RC[-29] ->  | AS63: - | AT63: =RC[-30] -> - | AU63: =RC[-30] ->  | AV63: =RC[-30] ->  | AW63: =RC[-30] -> 
A64: =IF(RC[1]="","",DATEVALUE(RC[1])) ->  | P64: =IF(AND(ISNUMBER(RC[-3]),ISNUMBER(RC[-1])),RC[-3]-RC[-1],"-") -> - | T64: =(RC[-16]*RC[-15]-RC[-13]*RC[-12])/1000 -> #VALUE! | W64: =RC[-2]*RC[-10]/1000 -> #VALUE! | X64: =ABS((RC[-3]*RC[-11]-RC[-2]*RC[-9])/1000) -> #VALUE! | Y64: =(RC[-14]-RC[1])/RC[-18]*100 -> #VALUE! | Z64: =RC[-5]+RC[-4] -> #VALUE! | AC64: =VALUE(RC[-27]) -> #VALUE! | AD64: =IF(RC[21]=42,"*",IF(RC[21]=32,"",RC[21])) ->  | AE64: =RC[-28] ->  | AF64: =RC[-28] ->  | AG64: =RC[-28] ->  | AH64: =RC[-28] ->  | AI64: =RC[-28] ->  | AJ64: =RC[-28] ->  | AK64: =RC[-28] ->  | AL64: =RC[-28] -> 0 | AM64: =RC[-28] ->  | AN64: =RC[-28] ->  | AO64: =RC[-28] ->  | AP64: - | AQ64: =RC[-29] ->  | AR64: =RC[-29] ->  | AS64: - | AT64: =RC[-30] -> - | AU64: =RC[-30] ->  | AV64: =RC[-30] ->  | AW64: =RC[-30] -> 
A65: =IF(RC[1]="","",DATEVALUE(RC[1])) ->  | P65: =IF(AND(ISNUMBER(RC[-3]),ISNUMBER(RC[-1])),RC[-3]-RC[-1],"-") -> - | T65: =(RC[-16]*RC[-15]-RC[-13]*RC[-12])/1000 -> #VALUE! | W65: =RC[-2]*RC[-10]/1000 -> #VALUE! | X65: =ABS((RC[-3]*RC[-11]-RC[-2]*RC[-9])/1000) -> #VALUE! | Y65: =(RC[-14]-RC[1])/RC[-18]*100 -> #VALUE! | Z65: =RC[-5]+RC[-4] -> #VALUE! | AC65: =VALUE(RC[-27]) -> #VALUE! | AD65: =IF(RC[21]=42,"*",IF(RC[21]=32,"",RC[21])) ->  | AE65: =RC[-28] ->  | AF65: =RC[-28] ->  | AG65: =RC[-28] ->  | AH65: =RC[-28] ->  | AI65: =RC[-28] ->  | AJ65: =RC[-28] ->  | AK65: =RC[-28] ->  | AL65: =RC[-28] -> 0 | AM65: =RC[-28] ->  | AN65: =RC[-28] ->  | AO65: =RC[-28] ->  | AP65: - | AQ65: =RC[-29] ->  | AR65: =RC[-29] ->  | AS65: - | AT65: =RC[-30] -> - | AU65: =RC[-30] ->  | AV65: =RC[-30] ->  | AW65: =RC[-30] -> 
A66: =IF(RC[1]="","",DATEVALUE(RC[1])) ->  | P66: =IF(AND(ISNUMBER(RC[-3]),ISNUMBER(RC[-1])),RC[-3]-RC[-1],"-") -> - | T66: =(RC[-16]*RC[-15]-RC[-13]*RC[-12])/1000 -> #VALUE! | W66: =RC[-2]*RC[-10]/1000 -> #VALUE! | X66: =ABS((RC[-3]*RC[-11]-RC[-2]*RC[-9])/1000) -> #VALUE! | Y66: =(RC[-14]-RC[1])/RC[-18]*100 -> #VALUE! | Z66: =RC[-5]+RC[-4] -> #VALUE! | AC66: =VALUE(RC[-27]) -> #VALUE! | AD66: =IF(RC[21]=42,"*",IF(RC[21]=32,"",RC[21])) ->  | AE66: =RC[-28] ->  | AF66: =RC[-28] ->  | AG66: =RC[-28] ->  | AH66: =RC[-28] ->  | AI66: =RC[-28] ->  | AJ66: =RC[-28] ->  | AK66: =RC[-28] ->  | AL66: =RC[-28] -> 0 | AM66: =RC[-28] ->  | AN66: =RC[-28] ->  | AO66: =RC[-28] ->  | AP66: - | AQ66: =RC[-29] ->  | AR66: =RC[-29] ->  | AS66: - | AT66: =RC[-30] -> - | AU66: =RC[-30] ->  | AV66: =RC[-30] ->  | AW66: =RC[-30] -> 
A67: =IF(RC[1]="","",DATEVALUE(RC[1])) ->  | P67: =IF(AND(ISNUMBER(RC[-3]),ISNUMBER(RC[-1])),RC[-3]-RC[-1],"-") -> - | T67: =(RC[-16]*RC[-15]-RC[-13]*RC[-12])/1000 -> #VALUE! | W67: =RC[-2]*RC[-10]/1000 -> #VALUE! | X67: =ABS((RC[-3]*RC[-11]-RC[-2]*RC[-9])/1000) -> #VALUE! | Y67: =(RC[-14]-RC[1])/RC[-18]*100 -> #VALUE! | Z67: =RC[-5]+RC[-4] -> #VALUE! | AC67: =VALUE(RC[-27]) -> #VALUE! | AD67: =IF(RC[21]=42,"*",IF(RC[21]=32,"",RC[21])) ->  | AE67: =RC[-28] ->  | AF67: =RC[-28] ->  | AG67: =RC[-28] ->  | AH67: =RC[-28] ->  | AI67: =RC[-28] ->  | AJ67: =RC[-28] ->  | AK67: =RC[-28] ->  | AL67: =RC[-28] -> 0 | AM67: =RC[-28] ->  | AN67: =RC[-28] ->  | AO67: =RC[-28] ->  | AP67: - | AQ67: =RC[-29] ->  | AR67: =RC[-29] ->  | AS67: - | AT67: =RC[-30] -> - | AU67: =RC[-30] ->  | AV67: =RC[-30] ->  | AW67: =RC[-30] -> 
A68: =IF(RC[1]="","",DATEVALUE(RC[1])) ->  | P68: =IF(AND(ISNUMBER(RC[-3]),ISNUMBER(RC[-1])),RC[-3]-RC[-1],"-") -> - | T68: =(RC[-16]*RC[-15]-RC[-13]*RC[-12])/1000 -> #VALUE! | W68: =RC[-2]*RC[-10]/1000 -> #VALUE! | X68: =ABS((RC[-3]*RC[-11]-RC[-2]*RC[-9])/1000) -> #VALUE! | Y68: =(RC[-14]-RC[1])/RC[-18]*100 -> #VALUE! | Z68: =RC[-5]+RC[-4] -> #VALUE! | AC68: =VALUE(RC[-27]) -> #VALUE! | AD68: =IF(RC[21]=42,"*",IF(RC[21]=32,"",RC[21])) ->  | AE68: =RC[-28] ->  | AF68: =RC[-28] ->  | AG68: =RC[-28] ->  | AH68: =RC[-28] ->  | AI68: =RC[-28] ->  | AJ68: =RC[-28] ->  | AK68: =RC[-28] ->  | AL68: =RC[-28] -> 0 | AM68: =RC[-28] ->  | AN68: =RC[-28] ->  | AO68: =RC[-28] ->  | AP68: - | AQ68: =RC[-29] ->  | AR68: =RC[-29] ->  | AS68: - | AT68: =RC[-30] -> - | AU68: =RC[-30] ->  | AV68: =RC[-30] ->  | AW68: =RC[-30] -> 
A69: =IF(RC[1]="","",DATEVALUE(RC[1])) ->  | P69: =IF(AND(ISNUMBER(RC[-3]),ISNUMBER(RC[-1])),RC[-3]-RC[-1],"-") -> - | T69: =(RC[-16]*RC[-15]-RC[-13]*RC[-12])/1000 -> #VALUE! | W69: =RC[-2]*RC[-10]/1000 -> #VALUE! | X69: =ABS((RC[-3]*RC[-11]-RC[-2]*RC[-9])/1000) -> #VALUE! | Y69: =(RC[-14]-RC[1])/RC[-18]*100 -> #VALUE! | Z69: =RC[-5]+RC[-4] -> #VALUE! | AC69: =VALUE(RC[-27]) -> #VALUE! | AD69: =IF(RC[21]=42,"*",IF(RC[21]=32,"",RC[21])) ->  | AE69: =RC[-28] ->  | AF69: =RC[-28] ->  | AG69: =RC[-28] ->  | AH69: =RC[-28] ->  | AI69: =RC[-28] ->  | AJ69: =RC[-28] ->  | AK69: =RC[-28] ->  | AL69: =RC[-28] -> 0 | AM69: =RC[-28] ->  | AN69: =RC[-28] ->  | AO69: =RC[-28] ->  | AP69: - | AQ69: =RC[-29] ->  | AR69: =RC[-29] ->  | AS69: - | AT69: =RC[-30] -> - | AU69: =RC[-30] ->  | AV69: =RC[-30] ->  | AW69: =RC[-30] -> 
A70: =IF(RC[1]="","",DATEVALUE(RC[1])) ->  | P70: =IF(AND(ISNUMBER(RC[-3]),ISNUMBER(RC[-1])),RC[-3]-RC[-1],"-") -> - | T70: =(RC[-16]*RC[-15]-RC[-13]*RC[-12])/1000 -> #VALUE! | W70: =RC[-2]*RC[-10]/1000 -> #VALUE! | X70: =ABS((RC[-3]*RC[-11]-RC[-2]*RC[-9])/1000) -> #VALUE! | Y70: =(RC[-14]-RC[1])/RC[-18]*100 -> #VALUE! | Z70: =RC[-5]+RC[-4] -> #VALUE! | AC70: =VALUE(RC[-27]) -> #VALUE! | AD70: =IF(RC[21]=42,"*",IF(RC[21]=32,"",RC[21])) ->  | AE70: =RC[-28] ->  | AF70: =RC[-28] ->  | AG70: =RC[-28] ->  | AH70: =RC[-28] ->  | AI70: =RC[-28] ->  | AJ70: =RC[-28] ->  | AK70: =RC[-28] ->  | AL70: =RC[-28] -> 0 | AM70: =RC[-28] ->  | AN70: =RC[-28] ->  | AO70: =RC[-28] ->  | AP70: - | AQ70: =RC[-29] ->  | AR70: =RC[-29] ->  | AS70: - | AT70: =RC[-30] -> - | AU70: =RC[-30] ->  | AV70: =RC[-30] ->  | AW70: =RC[-30] -> 
A71: =IF(RC[1]="","",DATEVALUE(RC[1])) ->  | P71: =IF(AND(ISNUMBER(RC[-3]),ISNUMBER(RC[-1])),RC[-3]-RC[-1],"-") -> - | T71: =(RC[-16]*RC[-15]-RC[-13]*RC[-12])/1000 -> #VALUE! | W71: =RC[-2]*RC[-10]/1000 -> #VALUE! | X71: =ABS((RC[-3]*RC[-11]-RC[-2]*RC[-9])/1000) -> #VALUE! | Y71: =(RC[-14]-RC[1])/RC[-18]*100 -> #VALUE! | Z71: =RC[-5]+RC[-4] -> #VALUE! | AC71: =VALUE(RC[-27]) -> #VALUE! | AD71: =IF(RC[21]=42,"*",IF(RC[21]=32,"",RC[21])) ->  | AE71: =RC[-28] ->  | AF71: =RC[-28] ->  | AG71: =RC[-28] ->  | AH71: =RC[-28] ->  | AI71: =RC[-28] ->  | AJ71: =RC[-28] ->  | AK71: =RC[-28] ->  | AL71: =RC[-28] -> 0 | AM71: =RC[-28] ->  | AN71: =RC[-28] ->  | AO71: =RC[-28] ->  | AP71: - | AQ71: =RC[-29] ->  | AR71: =RC[-29] ->  | AS71: - | AT71: =RC[-30] -> - | AU71: =RC[-30] ->  | AV71: =RC[-30] ->  | AW71: =RC[-30] -> 
A72: =IF(RC[1]="","",DATEVALUE(RC[1])) ->  | P72: =IF(AND(ISNUMBER(RC[-3]),ISNUMBER(RC[-1])),RC[-3]-RC[-1],"-") -> - | T72: =(RC[-16]*RC[-15]-RC[-13]*RC[-12])/1000 -> #VALUE! | W72: =RC[-2]*RC[-10]/1000 -> #VALUE! | X72: =ABS((RC[-3]*RC[-11]-RC[-2]*RC[-9])/1000) -> #VALUE! | Y72: =(RC[-14]-RC[1])/RC[-18]*100 -> #VALUE! | Z72: =RC[-5]+RC[-4] -> #VALUE! | AC72: =VALUE(RC[-27]) -> #VALUE! | AD72: =IF(RC[21]=42,"*",IF(RC[21]=32,"",RC[21])) ->  | AE72: =RC[-28] ->  | AF72: =RC[-28] ->  | AG72: =RC[-28] ->  | AH72: =RC[-28] ->  | AI72: =RC[-28] ->  | AJ72: =RC[-28] ->  | AK72: =RC[-28] ->  | AL72: =RC[-28] -> 0 | AM72: =RC[-28] ->  | AN72: =RC[-28] ->  | AO72: =RC[-28] ->  | AP72: - | AQ72: =RC[-29] ->  | AR72: =RC[-29] ->  | AS72: - | AT72: =RC[-30] -> - | AU72: =RC[-30] ->  | AV72: =RC[-30] ->  | AW72: =RC[-30] -> 
A73: =IF(RC[1]="","",DATEVALUE(RC[1])) ->  | P73: =IF(AND(ISNUMBER(RC[-3]),ISNUMBER(RC[-1])),RC[-3]-RC[-1],"-") -> - | T73: =(RC[-16]*RC[-15]-RC[-13]*RC[-12])/1000 -> #VALUE! | W73: =RC[-2]*RC[-10]/1000 -> #VALUE! | X73: =ABS((RC[-3]*RC[-11]-RC[-2]*RC[-9])/1000) -> #VALUE! | Y73: =(RC[-14]-RC[1])/RC[-18]*100 -> #VALUE! | Z73: =RC[-5]+RC[-4] -> #VALUE! | AC73: =VALUE(RC[-27]) -> #VALUE! | AD73: =IF(RC[21]=42,"*",IF(RC[21]=32,"",RC[21])) ->  | AE73: =RC[-28] ->  | AF73: =RC[-28] ->  | AG73: =RC[-28] ->  | AH73: =RC[-28] ->  | AI73: =RC[-28] ->  | AJ73: =RC[-28] ->  | AK73: =RC[-28] ->  | AL73: =RC[-28] -> 0 | AM73: =RC[-28] ->  | AN73: =RC[-28] ->  | AO73: =RC[-28] ->  | AP73: - | AQ73: =RC[-29] ->  | AR73: =RC[-29] ->  | AS73: - | AT73: =RC[-30] -> - | AU73: =RC[-30] ->  | AV73: =RC[-30] ->  | AW73: =RC[-30] -> 
A74: =IF(RC[1]="","",DATEVALUE(RC[1])) ->  | P74: =IF(AND(ISNUMBER(RC[-3]),ISNUMBER(RC[-1])),RC[-3]-RC[-1],"-") -> - | T74: =(RC[-16]*RC[-15]-RC[-13]*RC[-12])/1000 -> #VALUE! | W74: =RC[-2]*RC[-10]/1000 -> #VALUE! | X74: =ABS((RC[-3]*RC[-11]-RC[-2]*RC[-9])/1000) -> #VALUE! | Y74: =(RC[-14]-RC[1])/RC[-18]*100 -> #VALUE! | Z74: =RC[-5]+RC[-4] -> #VALUE! | AC74: =VALUE(RC[-27]) -> #VALUE! | AD74: =IF(RC[21]=42,"*",IF(RC[21]=32,"",RC[21])) ->  | AE74: =RC[-28] ->  | AF74: =RC[-28] ->  | AG74: =RC[-28] ->  | AH74: =RC[-28] ->  | AI74: =RC[-28] ->  | AJ74: =RC[-28] ->  | AK74: =RC[-28] ->  | AL74: =RC[-28] -> 0 | AM74: =RC[-28] ->  | AN74: =RC[-28] ->  | AO74: =RC[-28] ->  | AP74: - | AQ74: =RC[-29] ->  | AR74: =RC[-29] ->  | AS74: - | AT74: =RC[-30] -> - | AU74: =RC[-30] ->  | AV74: =RC[-30] ->  | AW74: =RC[-30] -> 
A75: =IF(RC[1]="","",DATEVALUE(RC[1])) ->  | P75: =IF(AND(ISNUMBER(RC[-3]),ISNUMBER(RC[-1])),RC[-3]-RC[-1],"-") -> - | T75: =(RC[-16]*RC[-15]-RC[-13]*RC[-12])/1000 -> #VALUE! | W75: =RC[-2]*RC[-10]/1000 -> #VALUE! | X75: =ABS((RC[-3]*RC[-11]-RC[-2]*RC[-9])/1000) -> #VALUE! | Y75: =(RC[-14]-RC[1])/RC[-18]*100 -> #VALUE! | Z75: =RC[-5]+RC[-4] -> #VALUE! | AC75: =VALUE(RC[-27]) -> #VALUE! | AD75: =IF(RC[21]=42,"*",IF(RC[21]=32,"",RC[21])) ->  | AE75: =RC[-28] ->  | AF75: =RC[-28] ->  | AG75: =RC[-28] ->  | AH75: =RC[-28] ->  | AI75: =RC[-28] ->  | AJ75: =RC[-28] ->  | AK75: =RC[-28] ->  | AL75: =RC[-28] -> 0 | AM75: =RC[-28] ->  | AN75: =RC[-28] ->  | AO75: =RC[-28] ->  | AP75: - | AQ75: =RC[-29] ->  | AR75: =RC[-29] ->  | AS75: - | AT75: =RC[-30] -> - | AU75: =RC[-30] ->  | AV75: =RC[-30] ->  | AW75: =RC[-30] -> 
A76: =IF(RC[1]="","",DATEVALUE(RC[1])) ->  | P76: =IF(AND(ISNUMBER(RC[-3]),ISNUMBER(RC[-1])),RC[-3]-RC[-1],"-") -> - | T76: =(RC[-16]*RC[-15]-RC[-13]*RC[-12])/1000 -> #VALUE! | W76: =RC[-2]*RC[-10]/1000 -> #VALUE! | X76: =ABS((RC[-3]*RC[-11]-RC[-2]*RC[-9])/1000) -> #VALUE! | Y76: =(RC[-14]-RC[1])/RC[-18]*100 -> #VALUE! | Z76: =RC[-5]+RC[-4] -> #VALUE! | AC76: =VALUE(RC[-27]) -> #VALUE! | AD76: =IF(RC[21]=42,"*",IF(RC[21]=32,"",RC[21])) ->  | AE76: =RC[-28] ->  | AF76: =RC[-28] ->  | AG76: =RC[-28] ->  | AH76: =RC[-28] ->  | AI76: =RC[-28] ->  | AJ76: =RC[-28] ->  | AK76: =RC[-28] ->  | AL76: =RC[-28] -> 0 | AM76: =RC[-28] ->  | AN76: =RC[-28] ->  | AO76: =RC[-28] ->  | AP76: - | AQ76: =RC[-29] ->  | AR76: =RC[-29] ->  | AS76: - | AT76: =RC[-30] -> - | AU76: =RC[-30] ->  | AV76: =RC[-30] ->  | AW76: =RC[-30] -> 
A77: =IF(RC[1]="","",DATEVALUE(RC[1])) ->  | P77: =IF(AND(ISNUMBER(RC[-3]),ISNUMBER(RC[-1])),RC[-3]-RC[-1],"-") -> - | T77: =(RC[-16]*RC[-15]-RC[-13]*RC[-12])/1000 -> #VALUE! | W77: =RC[-2]*RC[-10]/1000 -> #VALUE! | X77: =ABS((RC[-3]*RC[-11]-RC[-2]*RC[-9])/1000) -> #VALUE! | Y77: =(RC[-14]-RC[1])/RC[-18]*100 -> #VALUE! | Z77: =RC[-5]+RC[-4] -> #VALUE! | AC77: =VALUE(RC[-27]) -> #VALUE! | AD77: =IF(RC[21]=42,"*",IF(RC[21]=32,"",RC[21])) ->  | AE77: =RC[-28] ->  | AF77: =RC[-28] ->  | AG77: =RC[-28] ->  | AH77: =RC[-28] ->  | AI77: =RC[-28] ->  | AJ77: =RC[-28] ->  | AK77: =RC[-28] ->  | AL77: =RC[-28] -> 0 | AM77: =RC[-28] ->  | AN77: =RC[-28] ->  | AO77: =RC[-28] ->  | AP77: - | AQ77: =RC[-29] ->  | AR77: =RC[-29] ->  | AS77: - | AT77: =RC[-30] -> - | AU77: =RC[-30] ->  | AV77: =RC[-30] ->  | AW77: =RC[-30] -> 
A78: =IF(RC[1]="","",DATEVALUE(RC[1])) ->  | P78: =IF(AND(ISNUMBER(RC[-3]),ISNUMBER(RC[-1])),RC[-3]-RC[-1],"-") -> - | T78: =(RC[-16]*RC[-15]-RC[-13]*RC[-12])/1000 -> #VALUE! | W78: =RC[-2]*RC[-10]/1000 -> #VALUE! | X78: =ABS((RC[-3]*RC[-11]-RC[-2]*RC[-9])/1000) -> #VALUE! | Y78: =(RC[-14]-RC[1])/RC[-18]*100 -> #VALUE! | Z78: =RC[-5]+RC[-4] -> #VALUE! | AC78: =VALUE(RC[-27]) -> #VALUE! | AD78: =IF(RC[21]=42,"*",IF(RC[21]=32,"",RC[21])) ->  | AE78: =RC[-28] ->  | AF78: =RC[-28] ->  | AG78: =RC[-28] ->  | AH78: =RC[-28] ->  | AI78: =RC[-28] ->  | AJ78: =RC[-28] ->  | AK78: =RC[-28] ->  | AL78: =RC[-28] -> 0 | AM78: =RC[-28] ->  | AN78: =RC[-28] ->  | AO78: =RC[-28] ->  | AP78: - | AQ78: =RC[-29] ->  | AR78: =RC[-29] ->  | AS78: - | AT78: =RC[-30] -> - | AU78: =RC[-30] ->  | AV78: =RC[-30] ->  | AW78: =RC[-30] -> 
A79: =IF(RC[1]="","",DATEVALUE(RC[1])) ->  | P79: =IF(AND(ISNUMBER(RC[-3]),ISNUMBER(RC[-1])),RC[-3]-RC[-1],"-") -> - | T79: =(RC[-16]*RC[-15]-RC[-13]*RC[-12])/1000 -> #VALUE! | W79: =RC[-2]*RC[-10]/1000 -> #VALUE! | X79: =ABS((RC[-3]*RC[-11]-RC[-2]*RC[-9])/1000) -> #VALUE! | Y79: =(RC[-14]-RC[1])/RC[-18]*100 -> #VALUE! | Z79: =RC[-5]+RC[-4] -> #VALUE! | AC79: =VALUE(RC[-27]) -> #VALUE! | AD79: =IF(RC[21]=42,"*",IF(RC[21]=32,"",RC[21])) ->  | AE79: =RC[-28] ->  | AF79: =RC[-28] ->  | AG79: =RC[-28] ->  | AH79: =RC[-28] ->  | AI79: =RC[-28] ->  | AJ79: =RC[-28] ->  | AK79: =RC[-28] ->  | AL79: =RC[-28] -> 0 | AM79: =RC[-28] ->  | AN79: =RC[-28] ->  | AO79: =RC[-28] ->  | AP79: - | AQ79: =RC[-29] ->  | AR79: =RC[-29] ->  | AS79: - | AT79: =RC[-30] -> - | AU79: =RC[-30] ->  | AV79: =RC[-30] ->  | AW79: =RC[-30] -> 
A80: =IF(RC[1]="","",DATEVALUE(RC[1])) ->  | P80: =IF(AND(ISNUMBER(RC[-3]),ISNUMBER(RC[-1])),RC[-3]-RC[-1],"-") -> - | T80: =(RC[-16]*RC[-15]-RC[-13]*RC[-12])/1000 -> #VALUE! | W80: =RC[-2]*RC[-10]/1000 -> #VALUE! | X80: =ABS((RC[-3]*RC[-11]-RC[-2]*RC[-9])/1000) -> #VALUE! | Y80: =(RC[-14]-RC[1])/RC[-18]*100 -> #VALUE! | Z80: =RC[-5]+RC[-4] -> #VALUE! | AC80: =VALUE(RC[-27]) -> #VALUE! | AD80: =IF(RC[21]=42,"*",IF(RC[21]=32,"",RC[21])) ->  | AE80: =RC[-28] ->  | AF80: =RC[-28] ->  | AG80: =RC[-28] ->  | AH80: =RC[-28] ->  | AI80: =RC[-28] ->  | AJ80: =RC[-28] ->  | AK80: =RC[-28] ->  | AL80: =RC[-28] -> 0 | AM80: =RC[-28] ->  | AN80: =RC[-28] ->  | AO80: =RC[-28] ->  | AP80: - | AQ80: =RC[-29] ->  | AR80: =RC[-29] ->  | AS80: - | AT80: =RC[-30] -> - | AU80: =RC[-30] ->  | AV80: =RC[-30] ->  | AW80: =RC[-30] -> 
A81: =IF(RC[1]="","",DATEVALUE(RC[1])) ->  | P81: =IF(AND(ISNUMBER(RC[-3]),ISNUMBER(RC[-1])),RC[-3]-RC[-1],"-") -> - | T81: =(RC[-16]*RC[-15]-RC[-13]*RC[-12])/1000 -> #VALUE! | W81: =RC[-2]*RC[-10]/1000 -> #VALUE! | X81: =ABS((RC[-3]*RC[-11]-RC[-2]*RC[-9])/1000) -> #VALUE! | Y81: =(RC[-14]-RC[1])/RC[-18]*100 -> #VALUE! | Z81: =RC[-5]+RC[-4] -> #VALUE! | AC81: =VALUE(RC[-27]) -> #VALUE! | AD81: =IF(RC[21]=42,"*",IF(RC[21]=32,"",RC[21])) ->  | AE81: =RC[-28] ->  | AF81: =RC[-28] ->  | AG81: =RC[-28] ->  | AH81: =RC[-28] ->  | AI81: =RC[-28] ->  | AJ81: =RC[-28] ->  | AK81: =RC[-28] ->  | AL81: =RC[-28] -> 0 | AM81: =RC[-28] ->  | AN81: =RC[-28] ->  | AO81: =RC[-28] ->  | AP81: - | AQ81: =RC[-29] ->  | AR81: =RC[-29] ->  | AS81: - | AT81: =RC[-30] -> - | AU81: =RC[-30] ->  | AV81: =RC[-30] ->  | AW81: =RC[-30] -> 
A82: =IF(RC[1]="","",DATEVALUE(RC[1])) ->  | P82: =IF(AND(ISNUMBER(RC[-3]),ISNUMBER(RC[-1])),RC[-3]-RC[-1],"-") -> - | T82: =(RC[-16]*RC[-15]-RC[-13]*RC[-12])/1000 -> #VALUE! | W82: =RC[-2]*RC[-10]/1000 -> #VALUE! | X82: =ABS((RC[-3]*RC[-11]-RC[-2]*RC[-9])/1000) -> #VALUE! | Y82: =(RC[-14]-RC[1])/RC[-18]*100 -> #VALUE! | Z82: =RC[-5]+RC[-4] -> #VALUE! | AC82: =VALUE(RC[-27]) -> #VALUE! | AD82: =IF(RC[21]=42,"*",IF(RC[21]=32,"",RC[21])) ->  | AE82: =RC[-28] ->  | AF82: =RC[-28] ->  | AG82: =RC[-28] ->  | AH82: =RC[-28] ->  | AI82: =RC[-28] ->  | AJ82: =RC[-28] ->  | AK82: =RC[-28] ->  | AL82: =RC[-28] -> 0 | AM82: =RC[-28] ->  | AN82: =RC[-28] ->  | AO82: =RC[-28] ->  | AP82: - | AQ82: =RC[-29] ->  | AR82: =RC[-29] ->  | AS82: - | AT82: =RC[-30] -> - | AU82: =RC[-30] ->  | AV82: =RC[-30] ->  | AW82: =RC[-30] -> 
A83: =IF(RC[1]="","",DATEVALUE(RC[1])) ->  | P83: =IF(AND(ISNUMBER(RC[-3]),ISNUMBER(RC[-1])),RC[-3]-RC[-1],"-") -> - | T83: =(RC[-16]*RC[-15]-RC[-13]*RC[-12])/1000 -> #VALUE! | W83: =RC[-2]*RC[-10]/1000 -> #VALUE! | X83: =ABS((RC[-3]*RC[-11]-RC[-2]*RC[-9])/1000) -> #VALUE! | Y83: =(RC[-14]-RC[1])/RC[-18]*100 -> #VALUE! | Z83: =RC[-5]+RC[-4] -> #VALUE! | AC83: =VALUE(RC[-27]) -> #VALUE! | AD83: =IF(RC[21]=42,"*",IF(RC[21]=32,"",RC[21])) ->  | AE83: =RC[-28] ->  | AF83: =RC[-28] ->  | AG83: =RC[-28] ->  | AH83: =RC[-28] ->  | AI83: =RC[-28] ->  | AJ83: =RC[-28] ->  | AK83: =RC[-28] ->  | AL83: =RC[-28] -> 0 | AM83: =RC[-28] ->  | AN83: =RC[-28] ->  | AO83: =RC[-28] ->  | AP83: - | AQ83: =RC[-29] ->  | AR83: =RC[-29] ->  | AS83: - | AT83: =RC[-30] -> - | AU83: =RC[-30] ->  | AV83: =RC[-30] ->  | AW83: =RC[-30] -> 
AC84: Среднее | AF84: =R[1]C[-28] -> 110.58562493333334 | AG84: =R[1]C[-28] -> 66.778925633333344 | AH84: =R[1]C[-28] -> 7.9547587888888875 | AI84: =R[1]C[-28] -> 97.681172277777762 | AJ84: =R[1]C[-28] -> 44.417536055555551 | AK84: =R[1]C[-28] -> 5.8877812777777772 | AL84: =R[1]C[-28] -> 22.361389577777782 | AM84: =R[1]C[-28] -> 12.911367122222224 | AN84: =R[1]C[-28] -> 10.552049977777779 | AO84: =R[1]C[-28] -> 66.363195611111109 | AP84: - | AQ84: =R[1]C[-29] -> 2.986743744444444 | AR84: =R[1]C[-29] -> 64.985477488888876 | AS84: - | AT84: =R[1]C[-30] -> 1.3777181222222221 | AU84: =R[1]C[-30] -> 13.53879372222222
B85: Среднее | D85: =AVERAGE(OFFSET(R[-74]C,3,0,R7C1,1)) -> 110.58562493333334 | E85: =AVERAGE(OFFSET(R[-74]C,3,0,R7C1,1)) -> 66.778925633333344 | F85: =AVERAGE(OFFSET(R[-74]C,3,0,R7C1,1)) -> 7.9547587888888875 | G85: =AVERAGE(OFFSET(R[-74]C,3,0,R7C1,1)) -> 97.681172277777762 | H85: =AVERAGE(OFFSET(R[-74]C,3,0,R7C1,1)) -> 44.417536055555551 | I85: =AVERAGE(OFFSET(R[-74]C,3,0,R7C1,1)) -> 5.8877812777777772 | J85: =AVERAGE(OFFSET(R[-74]C,3,0,R7C1,1)) -> 22.361389577777782 | K85: =AVERAGE(OFFSET(R[-74]C,3,0,R7C1,1)) -> 12.911367122222224 | L85: =IF(SUM(OFFSET(R[-74]C,3,0,R7C1,1))=0,"",AVERAGE(OFFSET(R[-74]C,3,0,R7C1,1))) -> 10.552049977777779 | M85: =IF(SUM(OFFSET(R[-74]C,3,0,R7C1,1))=0,"",AVERAGE(OFFSET(R[-74]C,3,0,R7C1,1))) -> 66.363195611111109 | N85: =IF(SUM(OFFSET(R[-74]C,3,0,R7C1,1))=0,"",AVERAGE(OFFSET(R[-74]C,3,0,R7C1,1))) -> 2.986743744444444 | O85: =IF(SUM(OFFSET(R[-74]C,3,0,R7C1,1))=0,"",AVERAGE(OFFSET(R[-74]C,3,0,R7C1,1))) -> 64.985477488888876 | P85: =IF(SUM(OFFSET(R[-74]C,3,0,R7C1,1))=0,"",AVERAGE(OFFSET(R[-74]C,3,0,R7C1,1))) -> 1.3777181222222221 | Q85: =IF(SUM(OFFSET(R[-74]C,3,0,R7C1,1))=0,"",AVERAGE(OFFSET(R[-74]C,3,0,R7C1,1))) -> 13.53879372222222 | R85: =IF(SUM(OFFSET(R[-74]C,3,0,R7C1,1))=0,"",AVERAGE(OFFSET(R[-74]C,3,0,R7C1,1))) -> 0.87592402222222221 | S85: =AVERAGE(OFFSET(R[-74]C,3,0,R7C1,1)) -> 3.0406184888888892 | T85: =AVERAGE(OFFSET(R[-74]C,3,0,R7C1,1)) -> 3.0466196736108939 | W85: =AVERAGE(OFFSET(R[-74]C,3,0,R7C1,1)) -> 0.68186365705774432 | X85: =AVERAGE(OFFSET(R[-74]C,3,0,R7C1,1)) -> 0.49286324135358611 | AC85: Итого | AE85: =R[1]C[-28] -> 720 | AF85: =R[1]C[-28] -> 3317.5687480000001 | AI85: =R[1]C[-28] -> 2930.435168333333 | AM85: =R[1]C[-28] -> 387.3410136666667 | AN85: =R[1]C[-28] -> 316.56149933333336 | AQ85: =R[1]C[-29] -> 89.602312333333316 | AU85: =R[1]C[-30] -> 406.16381166666662 | AV85: =R[1]C[-30] -> 26.277720666666667 | AW85: =R[1]C[-30] -> 91.218554666666677
B86: ИТОГО: | C86: =SUM(OFFSET(R[-75]C,3,0,R7C1,1)) -> 720 | D86: =SUM(OFFSET(R[-75]C,3,0,R7C1,1)) -> 3317.5687480000001 | G86: =SUM(OFFSET(R[-75]C,3,0,R7C1,1)) -> 2930.435168333333 | K86: =SUM(OFFSET(R[-75]C,3,0,R7C1,1)) -> 387.3410136666667 | L86: =IF(SUM(OFFSET(R[-75]C,3,0,R7C1,1))=0,"",SUM(OFFSET(R[-75]C,3,0,R7C1,1))) -> 316.56149933333336 | N86: =IF(SUM(OFFSET(R[-75]C,3,0,R7C1,1))=0,"",SUM(OFFSET(R[-75]C,3,0,R7C1,1))) -> 89.602312333333316 | Q86: =IF(SUM(OFFSET(R[-75]C,3,0,R7C1,1))=0,"",SUM(OFFSET(R[-75]C,3,0,R7C1,1))) -> 406.16381166666662 | R86: =IF(SUM(OFFSET(R[-75]C,3,0,R7C1,1))=0,"",SUM(OFFSET(R[-75]C,3,0,R7C1,1))) -> 26.277720666666667 | S86: =SUM(OFFSET(R[-75]C,3,0,R7C1,1)) -> 91.218554666666677 | T86: =SUM(OFFSET(R[-75]C,3,0,R7C1,1)) -> 91.398590208326823 | W86: =SUM(OFFSET(R[-75]C,3,0,R7C1,1)) -> 20.455909711732328 | X86: =SUM(OFFSET(R[-75]C,3,0,R7C1,1)) -> 14.785897240607584
AC87: Досчёт | AF87: =R[1]C[-28] -> 0 | AI87: =R[1]C[-28] -> 0 | AM87: =R[1]C[-28] -> 0 | AN87: =R[1]C[-28] -> 0 | AQ87: =R[1]C[-29] -> 0 | AU87: =R[1]C[-30] -> 0 | AV87: =R[1]C[-30] -> 0 | AW87: =R[1]C[-30] -> 0
A88: 11дн=264ч 4дн=96ч | B88: Досчёт до конца м-ца (+) | C88: =R6C1*24 -> 216 | T88: № 26505 | AC88: Снятие | AF88: =-R[1]C[-28] -> 0 | AI88: =-R[1]C[-28] -> 0 | AM88: =-R[1]C[-28] -> 0 | AN88: =-R[1]C[-28] -> 0 | AQ88: =-R[1]C[-29] -> 0 | AU88: =-R[1]C[-30] -> 0 | AV88: =-R[1]C[-30] -> 0 | AW88: =-R[1]C[-30] -> 0
A89: 9дн=216ч 7дн=168ч | B89: Вычет с предыдущего (-) | C89: =R4C1*24 -> 192 | AC89: Сумма | AF89: =R[1]C[-28] -> 3317.5687480000001 | AI89: =R[1]C[-28] -> 2930.435168333333 | AM89: =R[1]C[-28] -> 387.3410136666667 | AN89: =R[1]C[-28] -> 316.56149933333336 | AQ89: =R[1]C[-29] -> 89.602312333333316 | AU89: =R[1]C[-30] -> 406.16381166666662 | AV89: =R[1]C[-30] -> 26.277720666666667 | AW89: =R[1]C[-30] -> 91.218554666666677
B90: СУММА: | C90: =R[-4]C+R[-2]C-R[-1]C -> 744 | D90: =R[-4]C+R[-2]C-R[-1]C -> 3317.5687480000001 | G90: =R[-4]C+R[-2]C-R[-1]C -> 2930.435168333333 | K90: =R[-4]C+R[-2]C-R[-1]C -> 387.3410136666667 | L90: =IF(SUM(OFFSET(R[-79]C,3,0,R7C1,1))=0,"",(R[-4]C+R[-2]C-R[-1]C)) -> 316.56149933333336 | N90: =IF(SUM(OFFSET(R[-79]C,3,0,R7C1,1))=0,"",(R[-4]C+R[-2]C-R[-1]C)) -> 89.602312333333316 | Q90: =IF(SUM(OFFSET(R[-79]C,3,0,R7C1,1))=0,"",(R[-4]C+R[-2]C-R[-1]C)) -> 406.16381166666662 | R90: =IF(SUM(OFFSET(R[-79]C,3,0,R7C1,1))=0,"",(R[-4]C+R[-2]C-R[-1]C)) -> 26.277720666666667 | S90: =R[-4]C+R[-2]C-R[-1]C -> 91.218554666666677
AC91: Тхв на источнике | AE91: V гвс (м3) | AF91: =R[-2]C[15] -> 406.16381166666662 | AG91: W гвс (Гкал) | AH91: =RC[-2]*0.06 -> 24.369828699999996 | AI91: W без гвс (Гкал) | AJ91: =R[-2]C[13]-RC[-2] -> 66.848725966666677
B92: Показания счетчиков на момент снятия данных:
B93: Дата, время | D93: М1, т | F93: М2, т | H93: М3, т | J93: М4, т | L93: Qо, Гкал | N93: Qг, Гкал | P93: время, час
B94: 23.09.18 00:00 | D94: 892.71393 | F94: 6.2300000000000003E-3 | H94: 694.36805000000004 | J94: 190.94898000000001 | L94: 53.13982 | N94: 51.777740000000001 | P94: -
B95: 18.10.18 06:00 | D95: 48104635.230590001 | F95: 38978141.063479997 | H95: 956.70663999999999 | J95: 265.24988000000002 | L95: 38976343.695560001 | N95: 73.862679999999997 | P95: -
AC97: =ZAYAVKA_N -> з.н д. №02/147-2783 от 04.10.18 15.10.18г некорректная работа приборов В данном отчете ГВС суммируется
B98: Представитель потребителя:_______________________________________________________________________ В.О. Топорков
I101: Рекомендуемые значения по параметрам теплопотребления (не являются официально утверждёнными)
I102: М, т | J102: V, м3 | K102: Qгвс, Гкал | L102: Qотоп, Гкал | M102: Qо, Гкал
I103: =R[-13]C[-3] -> 0 | J103: =RC[-1]/0.98 -> 0 | K103: =RC[-1]*0.06 -> 0 | L103: =RC[1]-RC[-1] -> 26.277720666666667 | M103: =R[-13]C[5] -> 26.277720666666667
O105: ДЛЯ САМОКОНТРОЛЯ
B106: В строке выбора дат указать период с 16.7.13 по 23.8.13 - жильё | N106: Q | O106: Qг
B107: В строке выбора дат указать период с 18.7.13 по 25.8.13 - не жилое | N107: =(R[-21]C[-10]*R[-22]C[-7]-R[-21]C[-9]*R[-22]C[-6])/1000 -> 324.06400441675947 | O107: =IF(R[-22]C[-2]="",R[-21]C[-3]*R[-22]C/1000,"") ->  | P107: Си2
O108: =IF(R[-23]C[-2]="","",((R[-22]C[-3]*R[-23]C)-(R[-22]C[-2]*R[-23]C[2]))/1000) -> 20.571900188775246 | P108: Си3