Sheet: Лист1
G1: Отчёт о теплопотреблении за октябрь 2018 | M1: письмо 02.10.18г некорректная работа приборов
A4: =EOMONTH(R[9]C,0)-R[9]C -> 8 | B4: Потребитель: ЗАО "Сити Сервис"
A5: =MAX(R[9]C:R[78]C) -> 2018-10-22T00:00:00.000 | B5: Адрес: г. СПб, Кораблестроителей ул., д.35 к.1 ИТП 6
A6: =EOMONTH(R[-1]C,0)-R[-1]C -> 9 | B6: Телефон: 8-911-021-19-79
A7: =R[-2]C-R[6]C -> 30 | B7: Договор 10023-2(.)400
A8: 7 | B8: Тепловычислитель: ВТД-УВ № B021 | L8: М2 мах= | M8: 208.56 | O8: Мгвс мах= | P8: 124.08
L9: Qотоп мах= | M9: 16.68 | O9: Qгвс мах= | P9: 7.44
B10: Расчётная формула: Q=M1*(h1-h2)+(M1-M2)*(h2-hхв)
D12: Учет | L12: Контроль
A13: =R[1]C[1]-1 -> 2018-09-22T00:00:00.000 | B13: Дата | C13: N, ч | D13: M1, т | E13: T1, С | F13: P1, кг/см2 | G13: M2, т | H13: T2, С | I13: P2, кг/см2 | J13: dT, С | K13: M1-М2, т | L13: V3, м3 | M13: T3, С | N13: V4, м3 | O13: =IF(R[-12]C[-14]="м.куб","","T4, С") -> T4, С | P13: dT, С | Q13: V3-V4, м3 | R13: Qгвс, Гкал | S13: Qобщ., Гкал | T13: Q | U13: M3 | V13: M4 | W13: си2 | X13: си3 | Y13: Разб. | Z13: dM2 | AC13: Дата | AD13: НС | AE13: n, ч | AF13: М1, т | AG13: t1, гр. С | AH13: Р1, кгс/см2 | AI13: М2, т | AJ13: t2, гр. С | AK13: Р2, кгс/см2 | AL13: t1-t2, гр. С | AM13: М1-М2, т | AN13: М1гвс, т | AO13: t1гвс, гр. С | AP13: Р1гвс, кгс/см2 | AQ13: М2гвс, т | AR13: t2гвс, гр. С | AS13: Р2гвс, кгс/см2 | AT13: t1гвс-t2гвс | AU13: М1гвс-М2гвс, т | AV13: Wгвс, Гкал | AW13: Wсумм, Гкал | AY13: NS_TV1 | AZ13: НС | BA13: NS_TV2
A14: =IF(RC[1]="","",DATEVALUE(RC[1])) -> 43366 | B14: 23.09.18 | C14: 24 | D14: 20.748502729999998 | E14: 68.98 | F14: 7.40764063636 | G14: 0 | H14: 18.63 | I14: 4.3527755856799999 | J14: =RC[-5]-RC[-2] -> 50.350000000000009 | K14: 20.748502729999998 | L14: 21.366718290000001 | M14: 67.31 | R14: 1.44392345944397 | S14: =RC[-1] -> 1.44392345944397 | T14: =(RC[-16]*RC[-15]-RC[-13]*RC[-12])/1000 -> 1.4312317183154 | U14: 20.913091659999999 | V14: - | W14: =RC[-2]*RC[-10]/1000 -> 1.4076601996346001 | X14: =ABS((RC[-3]*RC[-11]-RC[-2]*RC[-9])/1000) -> #VALUE! | Y14: =(RC[-14]-RC[1])/RC[-18]*100 -> #DIV/0! | Z14: 20.913091659999999 | AC14: =VALUE(RC[-27]) -> 2018-09-23T00:00:00.000 | AD14: =IF(RC[21]=42,"*",IF(RC[21]=32,"",RC[21])) -> - | AE14: =RC[-28] -> 24 | AF14: =RC[-28] -> 20.748502729999998 | AG14: =RC[-28] -> 68.98 | AH14: =RC[-28] -> 7.40764063636 | AI14: =RC[-28] -> 0 | AJ14: =RC[-28] -> 18.63 | AK14: =RC[-28] -> 4.3527755856799999 | AL14: =RC[-28] -> 50.350000000000009 | AM14: =RC[-28] -> 20.748502729999998 | AN14: =RC[-28] -> 21.366718290000001 | AO14: =RC[-28] -> 67.31 | AP14: - | AQ14: =RC[-29] -> 0 | AR14: =RC[-29] -> 0 | AS14: - | AT14: =RC[-30] -> 0 | AU14: =RC[-30] -> 0 | AV14: =RC[-30] -> 1.44392345944397 | AW14: =RC[-30] -> 1.44392345944397 | AY14: - | AZ14: - | BA14: -
A15: =IF(RC[1]="","",DATEVALUE(RC[1])) -> 43367 | B15: 24.09.18 | C15: 24 | D15: 20.401384350000001 | E15: 67.569999999999993 | F15: 7.5402581468400003 | G15: 0 | H15: 17.18 | I15: 4.8861304004399999 | J15: =RC[-5]-RC[-2] -> 50.389999999999993 | K15: 20.401384350000001 | L15: 20.928846360000001 | M15: 65.8 | R15: 1.38891031336582 | S15: =RC[-1] -> 1.38891031336582 | T15: =(RC[-16]*RC[-15]-RC[-13]*RC[-12])/1000 -> 1.3785215405294997 | U15: 20.499711990000002 | V15: - | W15: =RC[-2]*RC[-10]/1000 -> 1.348881048942 | X15: =ABS((RC[-3]*RC[-11]-RC[-2]*RC[-9])/1000) -> #VALUE! | Y15: =(RC[-14]-RC[1])/RC[-18]*100 -> #DIV/0! | Z15: 20.499711990000002 | AC15: =VALUE(RC[-27]) -> 2018-09-24T00:00:00.000 | AD15: =IF(RC[21]=42,"*",IF(RC[21]=32,"",RC[21])) -> - | AE15: =RC[-28] -> 24 | AF15: =RC[-28] -> 20.401384350000001 | AG15: =RC[-28] -> 67.569999999999993 | AH15: =RC[-28] -> 7.5402581468400003 | AI15: =RC[-28] -> 0 | AJ15: =RC[-28] -> 17.18 | AK15: =RC[-28] -> 4.8861304004399999 | AL15: =RC[-28] -> 50.389999999999993 | AM15: =RC[-28] -> 20.401384350000001 | AN15: =RC[-28] -> 20.928846360000001 | AO15: =RC[-28] -> 65.8 | AP15: - | AQ15: =RC[-29] -> 0 | AR15: =RC[-29] -> 0 | AS15: - | AT15: =RC[-30] -> 0 | AU15: =RC[-30] -> 0 | AV15: =RC[-30] -> 1.38891031336582 | AW15: =RC[-30] -> 1.38891031336582 | AY15: - | AZ15: - | BA15: -
A16: =IF(RC[1]="","",DATEVALUE(RC[1])) -> 43368 | B16: 25.09.18 | C16: 24 | D16: 22.42410469 | E16: 66.02 | F16: 7.6859532057599997 | G16: 0 | H16: 15.03 | I16: 5.5377630444800001 | J16: =RC[-5]-RC[-2] -> 50.989999999999995 | K16: 22.42410469 | L16: 22.941823960000001 | M16: 58.1 | R16: 1.3427496560619101 | S16: =RC[-1] -> 1.3427496560619101 | T16: =(RC[-16]*RC[-15]-RC[-13]*RC[-12])/1000 -> 1.4804393916337999 | U16: 22.571634289999999 | V16: - | W16: =RC[-2]*RC[-10]/1000 -> 1.311411952249 | X16: =ABS((RC[-3]*RC[-11]-RC[-2]*RC[-9])/1000) -> #VALUE! | Y16: =(RC[-14]-RC[1])/RC[-18]*100 -> #DIV/0! | Z16: 22.571634289999999 | AC16: =VALUE(RC[-27]) -> 2018-09-25T00:00:00.000 | AD16: =IF(RC[21]=42,"*",IF(RC[21]=32,"",RC[21])) -> - | AE16: =RC[-28] -> 24 | AF16: =RC[-28] -> 22.42410469 | AG16: =RC[-28] -> 66.02 | AH16: =RC[-28] -> 7.6859532057599997 | AI16: =RC[-28] -> 0 | AJ16: =RC[-28] -> 15.03 | AK16: =RC[-28] -> 5.5377630444800001 | AL16: =RC[-28] -> 50.989999999999995 | AM16: =RC[-28] -> 22.42410469 | AN16: =RC[-28] -> 22.941823960000001 | AO16: =RC[-28] -> 58.1 | AP16: - | AQ16: =RC[-29] -> 0 | AR16: =RC[-29] -> 0 | AS16: - | AT16: =RC[-30] -> 0 | AU16: =RC[-30] -> 0 | AV16: =RC[-30] -> 1.3427496560619101 | AW16: =RC[-30] -> 1.3427496560619101 | AY16: - | AZ16: - | BA16: -
A17: =IF(RC[1]="","",DATEVALUE(RC[1])) -> 43369 | B17: 26.09.18 | C17: 24 | D17: 23.474517819999999 | E17: 65.42 | F17: 7.5830514779599998 | G17: 0 | H17: 15.82 | I17: 5.5453394124399997 | J17: =RC[-5]-RC[-2] -> 49.6 | K17: 23.474517819999999 | L17: 24.077913280000001 | M17: 56.58 | R17: 1.38499247635426 | S17: =RC[-1] -> 1.38499247635426 | T17: =(RC[-16]*RC[-15]-RC[-13]*RC[-12])/1000 -> 1.5357029557844 | U17: 23.702468870000001 | V17: - | W17: =RC[-2]*RC[-10]/1000 -> 1.3410856886645999 | X17: =ABS((RC[-3]*RC[-11]-RC[-2]*RC[-9])/1000) -> #VALUE! | Y17: =(RC[-14]-RC[1])/RC[-18]*100 -> #DIV/0! | Z17: 23.702468870000001 | AC17: =VALUE(RC[-27]) -> 2018-09-26T00:00:00.000 | AD17: =IF(RC[21]=42,"*",IF(RC[21]=32,"",RC[21])) -> - | AE17: =RC[-28] -> 24 | AF17: =RC[-28] -> 23.474517819999999 | AG17: =RC[-28] -> 65.42 | AH17: =RC[-28] -> 7.5830514779599998 | AI17: =RC[-28] -> 0 | AJ17: =RC[-28] -> 15.82 | AK17: =RC[-28] -> 5.5453394124399997 | AL17: =RC[-28] -> 49.6 | AM17: =RC[-28] -> 23.474517819999999 | AN17: =RC[-28] -> 24.077913280000001 | AO17: =RC[-28] -> 56.58 | AP17: - | AQ17: =RC[-29] -> 0 | AR17: =RC[-29] -> 0 | AS17: - | AT17: =RC[-30] -> 0 | AU17: =RC[-30] -> 0 | AV17: =RC[-30] -> 1.38499247635426 | AW17: =RC[-30] -> 1.38499247635426 | AY17: - | AZ17: - | BA17: -
A18: =IF(RC[1]="","",DATEVALUE(RC[1])) -> 43370 | B18: 27.09.18 | C18: 24 | D18: 23.30559731 | E18: 61.65 | F18: 7.2276123827200003 | G18: 0 | H18: 15.46 | I18: 5.57738456424 | J18: =RC[-5]-RC[-2] -> 46.19 | K18: 23.30559731 | L18: 23.77787781 | M18: 52.98 | R18: 1.26544516098213 | S18: =RC[-1] -> 1.26544516098213 | T18: =(RC[-16]*RC[-15]-RC[-13]*RC[-12])/1000 -> 1.4367900741614998 | U18: 23.458856579999999 | V18: - | W18: =RC[-2]*RC[-10]/1000 -> 1.2428502216083999 | X18: =ABS((RC[-3]*RC[-11]-RC[-2]*RC[-9])/1000) -> #VALUE! | Y18: =(RC[-14]-RC[1])/RC[-18]*100 -> #DIV/0! | Z18: 23.458856579999999 | AC18: =VALUE(RC[-27]) -> 2018-09-27T00:00:00.000 | AD18: =IF(RC[21]=42,"*",IF(RC[21]=32,"",RC[21])) -> - | AE18: =RC[-28] -> 24 | AF18: =RC[-28] -> 23.30559731 | AG18: =RC[-28] -> 61.65 | AH18: =RC[-28] -> 7.2276123827200003 | AI18: =RC[-28] -> 0 | AJ18: =RC[-28] -> 15.46 | AK18: =RC[-28] -> 5.57738456424 | AL18: =RC[-28] -> 46.19 | AM18: =RC[-28] -> 23.30559731 | AN18: =RC[-28] -> 23.77787781 | AO18: =RC[-28] -> 52.98 | AP18: - | AQ18: =RC[-29] -> 0 | AR18: =RC[-29] -> 0 | AS18: - | AT18: =RC[-30] -> 0 | AU18: =RC[-30] -> 0 | AV18: =RC[-30] -> 1.26544516098213 | AW18: =RC[-30] -> 1.26544516098213 | AY18: - | AZ18: - | BA18: -
A19: =IF(RC[1]="","",DATEVALUE(RC[1])) -> 43371 | B19: 28.09.18 | C19: 24 | D19: 24.397644039999999 | E19: 65.92 | F19: 7.3310419634399997 | G19: 0 | H19: 13.69 | I19: 5.7273967314799998 | J19: =RC[-5]-RC[-2] -> 52.230000000000004 | K19: 24.397644039999999 | L19: 24.999017720000001 | M19: 57.09 | R19: 1.4438694754944099 | S19: =RC[-1] -> 1.4438694754944099 | T19: =(RC[-16]*RC[-15]-RC[-13]*RC[-12])/1000 -> 1.6082926951168 | U19: 24.606580730000001 | V19: - | W19: =RC[-2]*RC[-10]/1000 -> 1.4047896938757001 | X19: =ABS((RC[-3]*RC[-11]-RC[-2]*RC[-9])/1000) -> #VALUE! | Y19: =(RC[-14]-RC[1])/RC[-18]*100 -> #DIV/0! | Z19: 24.606580730000001 | AC19: =VALUE(RC[-27]) -> 2018-09-28T00:00:00.000 | AD19: =IF(RC[21]=42,"*",IF(RC[21]=32,"",RC[21])) -> - | AE19: =RC[-28] -> 24 | AF19: =RC[-28] -> 24.397644039999999 | AG19: =RC[-28] -> 65.92 | AH19: =RC[-28] -> 7.3310419634399997 | AI19: =RC[-28] -> 0 | AJ19: =RC[-28] -> 13.69 | AK19: =RC[-28] -> 5.7273967314799998 | AL19: =RC[-28] -> 52.230000000000004 | AM19: =RC[-28] -> 24.397644039999999 | AN19: =RC[-28] -> 24.999017720000001 | AO19: =RC[-28] -> 57.09 | AP19: - | AQ19: =RC[-29] -> 0 | AR19: =RC[-29] -> 0 | AS19: - | AT19: =RC[-30] -> 0 | AU19: =RC[-30] -> 0 | AV19: =RC[-30] -> 1.4438694754944099 | AW19: =RC[-30] -> 1.4438694754944099 | AY19: - | AZ19: - | BA19: -
A20: =IF(RC[1]="","",DATEVALUE(RC[1])) -> 43372 | B20: 29.09.18 | C20: 24 | D20: 24.211584089999999 | E20: 66.03 | F20: 8.2001212352399993 | G20: 0 | H20: 11.47 | I20: 6.1074827724 | J20: =RC[-5]-RC[-2] -> 54.56 | K20: 24.211584089999999 | L20: 24.80873871 | M20: 56.39 | R20: 1.4066701872551799 | S20: =RC[-1] -> 1.4066701872551799 | T20: =(RC[-16]*RC[-15]-RC[-13]*RC[-12])/1000 -> 1.5986908974626999 | U20: 24.43312645 | V20: - | W20: =RC[-2]*RC[-10]/1000 -> 1.3777840005155 | X20: =ABS((RC[-3]*RC[-11]-RC[-2]*RC[-9])/1000) -> #VALUE! | Y20: =(RC[-14]-RC[1])/RC[-18]*100 -> #DIV/0! | Z20: 24.43312645 | AC20: =VALUE(RC[-27]) -> 2018-09-29T00:00:00.000 | AD20: =IF(RC[21]=42,"*",IF(RC[21]=32,"",RC[21])) -> - | AE20: =RC[-28] -> 24 | AF20: =RC[-28] -> 24.211584089999999 | AG20: =RC[-28] -> 66.03 | AH20: =RC[-28] -> 8.2001212352399993 | AI20: =RC[-28] -> 0 | AJ20: =RC[-28] -> 11.47 | AK20: =RC[-28] -> 6.1074827724 | AL20: =RC[-28] -> 54.56 | AM20: =RC[-28] -> 24.211584089999999 | AN20: =RC[-28] -> 24.80873871 | AO20: =RC[-28] -> 56.39 | AP20: - | AQ20: =RC[-29] -> 0 | AR20: =RC[-29] -> 0 | AS20: - | AT20: =RC[-30] -> 0 | AU20: =RC[-30] -> 0 | AV20: =RC[-30] -> 1.4066701872551799 | AW20: =RC[-30] -> 1.4066701872551799 | AY20: - | AZ20: - | BA20: -
A21: =IF(RC[1]="","",DATEVALUE(RC[1])) -> 43373 | B21: 30.09.18 | C21: 24 | D21: 25.746276859999998 | E21: 68.069999999999993 | F21: 8.2500403256800006 | G21: 0 | H21: 13.62 | I21: 5.9893862681999996 | J21: =RC[-5]-RC[-2] -> 54.449999999999996 | K21: 25.746276859999998 | L21: 26.491697309999999 | M21: 59.72 | R21: 1.60455521400592 | S21: =RC[-1] -> 1.60455521400592 | T21: =(RC[-16]*RC[-15]-RC[-13]*RC[-12])/1000 -> 1.7525490658601999 | U21: 26.035619740000001 | V21: - | W21: =RC[-2]*RC[-10]/1000 -> 1.5548472108728002 | X21: =ABS((RC[-3]*RC[-11]-RC[-2]*RC[-9])/1000) -> #VALUE! | Y21: =(RC[-14]-RC[1])/RC[-18]*100 -> #DIV/0! | Z21: 26.035619740000001 | AC21: =VALUE(RC[-27]) -> 2018-09-30T00:00:00.000 | AD21: =IF(RC[21]=42,"*",IF(RC[21]=32,"",RC[21])) -> - | AE21: =RC[-28] -> 24 | AF21: =RC[-28] -> 25.746276859999998 | AG21: =RC[-28] -> 68.069999999999993 | AH21: =RC[-28] -> 8.2500403256800006 | AI21: =RC[-28] -> 0 | AJ21: =RC[-28] -> 13.62 | AK21: =RC[-28] -> 5.9893862681999996 | AL21: =RC[-28] -> 54.449999999999996 | AM21: =RC[-28] -> 25.746276859999998 | AN21: =RC[-28] -> 26.491697309999999 | AO21: =RC[-28] -> 59.72 | AP21: - | AQ21: =RC[-29] -> 0 | AR21: =RC[-29] -> 0 | AS21: - | AT21: =RC[-30] -> 0 | AU21: =RC[-30] -> 0 | AV21: =RC[-30] -> 1.60455521400592 | AW21: =RC[-30] -> 1.60455521400592 | AY21: - | AZ21: - | BA21: -
A22: =IF(RC[1]="","",DATEVALUE(RC[1])) -> 43374 | B22: 01.10.18 | C22: 24 | D22: 113.21550750999999 | E22: 67.75 | F22: 8.0308672831599992 | G22: 47.535350800000003 | H22: 31.63 | I22: 6.0789646332 | J22: =RC[-5]-RC[-2] -> 36.120000000000005 | K22: 65.680156710000006 | L22: 24.729850769999999 | M22: 61.45 | R22: 1.5130145074997601 | S22: 5.3177073946689601 | T22: =(RC[-16]*RC[-15]-RC[-13]*RC[-12])/1000 -> 6.1668074879984998 | U22: 24.2957325 | V22: - | W22: =RC[-2]*RC[-10]/1000 -> 1.4929727621250002 | X22: =ABS((RC[-3]*RC[-11]-RC[-2]*RC[-9])/1000) -> #VALUE! | Y22: =(RC[-14]-RC[1])/RC[-18]*100 -> 87.060310933899757 | Z22: 24.2957325 | AC22: =VALUE(RC[-27]) -> 2018-10-01T00:00:00.000 | AD22: =IF(RC[21]=42,"*",IF(RC[21]=32,"",RC[21])) -> - | AE22: =RC[-28] -> 24 | AF22: =RC[-28] -> 113.21550750999999 | AG22: =RC[-28] -> 67.75 | AH22: =RC[-28] -> 8.0308672831599992 | AI22: =RC[-28] -> 47.535350800000003 | AJ22: =RC[-28] -> 31.63 | AK22: =RC[-28] -> 6.0789646332 | AL22: =RC[-28] -> 36.120000000000005 | AM22: =RC[-28] -> 65.680156710000006 | AN22: =RC[-28] -> 24.729850769999999 | AO22: =RC[-28] -> 61.45 | AP22: - | AQ22: =RC[-29] -> 0 | AR22: =RC[-29] -> 0 | AS22: - | AT22: =RC[-30] -> 0 | AU22: =RC[-30] -> 0 | AV22: =RC[-30] -> 1.5130145074997601 | AW22: =RC[-30] -> 5.3177073946689601 | AY22: - | AZ22: - | BA22: -
A23: =IF(RC[1]="","",DATEVALUE(RC[1])) -> 43375 | B23: 02.10.18 | C23: 24 | D23: =AVERAGE(R[1]C:R[3]C) -> 211.11672973666668 | E23: =AVERAGE(R[1]C:R[3]C) -> 66.773333333333341 | F23: =AVERAGE(R[1]C:R[3]C) -> 7.6428889584399995 | G23: =AVERAGE(R[1]C:R[3]C) -> 187.53817748999998 | H23: =AVERAGE(R[1]C:R[3]C) -> 40.706666666666671 | I23: =AVERAGE(R[1]C:R[3]C) -> 6.0211459120800006 | J23: =AVERAGE(R[1]C:R[3]C) -> 26.066666666666666 | K23: =AVERAGE(R[1]C:R[3]C) -> 23.578552246666664 | L23: 22.41458321 | M23: 60.94 | R23: 1.42458939046527 | S23: =RC[1] -> 6.4629136885900929 | T23: =(RC[-16]*RC[-15]-RC[-13]*RC[-12])/1000 -> 6.4629136885900929 | U23: 21.990083689999999 | V23: - | W23: =RC[-2]*RC[-10]/1000 -> 1.3400757000685999 | X23: =ABS((RC[-3]*RC[-11]-RC[-2]*RC[-9])/1000) -> #VALUE! | Y23: =(RC[-14]-RC[1])/RC[-18]*100 -> 0.84701076758163896 | Z23: 21.990083689999999 | AC23: =VALUE(RC[-27]) -> 2018-10-02T00:00:00.000 | AD23: =IF(RC[21]=42,"*",IF(RC[21]=32,"",RC[21])) -> - | AE23: =RC[-28] -> 24 | AF23: =RC[-28] -> 211.11672973666668 | AG23: =RC[-28] -> 66.773333333333341 | AH23: =RC[-28] -> 7.6428889584399995 | AI23: =RC[-28] -> 187.53817748999998 | AJ23: =RC[-28] -> 40.706666666666671 | AK23: =RC[-28] -> 6.0211459120800006 | AL23: =RC[-28] -> 26.066666666666666 | AM23: =RC[-28] -> 23.578552246666664 | AN23: =RC[-28] -> 22.41458321 | AO23: =RC[-28] -> 60.94 | AP23: - | AQ23: =RC[-29] -> 0 | AR23: =RC[-29] -> 0 | AS23: - | AT23: =RC[-30] -> 0 | AU23: =RC[-30] -> 0 | AV23: =RC[-30] -> 1.42458939046527 | AW23: =RC[-30] -> 6.4629136885900929 | AY23: - | AZ23: - | BA23: -
A24: =IF(RC[1]="","",DATEVALUE(RC[1])) -> 43376 | B24: 03.10.18 | C24: 24 | D24: 215.16693115000001 | E24: 67.37 | F24: 7.6893140972399996 | G24: 194.07261657999999 | H24: 41.52 | I24: 6.0216716221600004 | J24: =RC[-5]-RC[-2] -> 25.85 | K24: 21.094314570000002 | L24: 24.23401642 | M24: 66.94 | R24: 1.5995043947645 | S24: 6.4444598882201198 | T24: =(RC[-16]*RC[-15]-RC[-13]*RC[-12])/1000 -> 6.4379011111739013 | U24: 23.742347720000001 | V24: - | W24: =RC[-2]*RC[-10]/1000 -> 1.5893127563768001 | X24: =ABS((RC[-3]*RC[-11]-RC[-2]*RC[-9])/1000) -> #VALUE! | Y24: =(RC[-14]-RC[1])/RC[-18]*100 -> -1.3644548090628932 | Z24: 23.742347720000001 | AC24: =VALUE(RC[-27]) -> 2018-10-03T00:00:00.000 | AD24: =IF(RC[21]=42,"*",IF(RC[21]=32,"",RC[21])) -> - | AE24: =RC[-28] -> 24 | AF24: =RC[-28] -> 215.16693115000001 | AG24: =RC[-28] -> 67.37 | AH24: =RC[-28] -> 7.6893140972399996 | AI24: =RC[-28] -> 194.07261657999999 | AJ24: =RC[-28] -> 41.52 | AK24: =RC[-28] -> 6.0216716221600004 | AL24: =RC[-28] -> 25.85 | AM24: =RC[-28] -> 21.094314570000002 | AN24: =RC[-28] -> 24.23401642 | AO24: =RC[-28] -> 66.94 | AP24: - | AQ24: =RC[-29] -> 0 | AR24: =RC[-29] -> 0 | AS24: - | AT24: =RC[-30] -> 0 | AU24: =RC[-30] -> 0 | AV24: =RC[-30] -> 1.5995043947645 | AW24: =RC[-30] -> 6.4444598882201198 | AY24: - | AZ24: - | BA24: -
A25: =IF(RC[1]="","",DATEVALUE(RC[1])) -> 43377 | B25: 04.10.18 | C25: 24 | D25: 208.88531494 | E25: 66.790000000000006 | F25: 7.66197952 | G25: 180.77163696 | H25: 40.6 | I25: 6.0667426901599999 | J25: =RC[-5]-RC[-2] -> 26.190000000000005 | K25: 28.113677979999999 | L25: 23.03878593 | M25: 66.16 | R25: 1.5045518677749099 | S25: 6.6070136619852899 | T25: =(RC[-16]*RC[-15]-RC[-13]*RC[-12])/1000 -> 6.6121217242666006 | U25: 22.58156967 | V25: - | W25: =RC[-2]*RC[-10]/1000 -> 1.4939966493672001 | X25: =ABS((RC[-3]*RC[-11]-RC[-2]*RC[-9])/1000) -> #VALUE! | Y25: =(RC[-14]-RC[1])/RC[-18]*100 -> 3.0602745004871026 | Z25: 22.58156967 | AC25: =VALUE(RC[-27]) -> 2018-10-04T00:00:00.000 | AD25: =IF(RC[21]=42,"*",IF(RC[21]=32,"",RC[21])) -> - | AE25: =RC[-28] -> 24 | AF25: =RC[-28] -> 208.88531494 | AG25: =RC[-28] -> 66.790000000000006 | AH25: =RC[-28] -> 7.66197952 | AI25: =RC[-28] -> 180.77163696 | AJ25: =RC[-28] -> 40.6 | AK25: =RC[-28] -> 6.0667426901599999 | AL25: =RC[-28] -> 26.190000000000005 | AM25: =RC[-28] -> 28.113677979999999 | AN25: =RC[-28] -> 23.03878593 | AO25: =RC[-28] -> 66.16 | AP25: - | AQ25: =RC[-29] -> 0 | AR25: =RC[-29] -> 0 | AS25: - | AT25: =RC[-30] -> 0 | AU25: =RC[-30] -> 0 | AV25: =RC[-30] -> 1.5045518677749099 | AW25: =RC[-30] -> 6.6070136619852899 | AY25: - | AZ25: - | BA25: -
A26: =IF(RC[1]="","",DATEVALUE(RC[1])) -> 43378 | B26: 05.10.18 | C26: 24 | D26: 209.29794312000001 | E26: 66.16 | F26: 7.5773732580799997 | G26: 187.77027892999999 | H26: 40 | I26: 5.9750234239199997 | J26: =RC[-5]-RC[-2] -> 26.159999999999997 | K26: 21.527664189999999 | L26: 23.251297000000001 | M26: 65.48 | R26: 1.50565330323875 | S26: 6.3393479769752599 | T26: =(RC[-16]*RC[-15]-RC[-13]*RC[-12])/1000 -> 6.3363407596192012 | U26: 22.795316700000001 | V26: - | W26: =RC[-2]*RC[-10]/1000 -> 1.492637337516 | X26: =ABS((RC[-3]*RC[-11]-RC[-2]*RC[-9])/1000) -> #VALUE! | Y26: =(RC[-14]-RC[1])/RC[-18]*100 -> -0.67510817858058203 | Z26: 22.795316700000001 | AC26: =VALUE(RC[-27]) -> 2018-10-05T00:00:00.000 | AD26: =IF(RC[21]=42,"*",IF(RC[21]=32,"",RC[21])) -> - | AE26: =RC[-28] -> 24 | AF26: =RC[-28] -> 209.29794312000001 | AG26: =RC[-28] -> 66.16 | AH26: =RC[-28] -> 7.5773732580799997 | AI26: =RC[-28] -> 187.77027892999999 | AJ26: =RC[-28] -> 40 | AK26: =RC[-28] -> 5.9750234239199997 | AL26: =RC[-28] -> 26.159999999999997 | AM26: =RC[-28] -> 21.527664189999999 | AN26: =RC[-28] -> 23.251297000000001 | AO26: =RC[-28] -> 65.48 | AP26: - | AQ26: =RC[-29] -> 0 | AR26: =RC[-29] -> 0 | AS26: - | AT26: =RC[-30] -> 0 | AU26: =RC[-30] -> 0 | AV26: =RC[-30] -> 1.50565330323875 | AW26: =RC[-30] -> 6.3393479769752599 | AY26: - | AZ26: - | BA26: -
A27: =IF(RC[1]="","",DATEVALUE(RC[1])) -> 43379 | B27: 06.10.18 | C27: 24 | D27: 203.74615478999999 | E27: 66.760000000000005 | F27: 7.5582981045600004 | G27: 180.73469542999999 | H27: 40.22 | I27: 6.0972083648000002 | J27: =RC[-5]-RC[-2] -> 26.540000000000006 | K27: 23.01145936 | L27: 25.192897800000001 | M27: 66.349999999999994 | R27: 1.6488579750644901 | S27: 6.33911563962931 | T27: =(RC[-16]*RC[-15]-RC[-13]*RC[-12])/1000 -> 6.3329438435858023 | U27: 24.69060326 | V27: - | W27: =RC[-2]*RC[-10]/1000 -> 1.6382215263009998 | X27: =ABS((RC[-3]*RC[-11]-RC[-2]*RC[-9])/1000) -> #VALUE! | Y27: =(RC[-14]-RC[1])/RC[-18]*100 -> -0.92906560967998852 | Z27: 24.69060326 | AC27: =VALUE(RC[-27]) -> 2018-10-06T00:00:00.000 | AD27: =IF(RC[21]=42,"*",IF(RC[21]=32,"",RC[21])) -> - | AE27: =RC[-28] -> 24 | AF27: =RC[-28] -> 203.74615478999999 | AG27: =RC[-28] -> 66.760000000000005 | AH27: =RC[-28] -> 7.5582981045600004 | AI27: =RC[-28] -> 180.73469542999999 | AJ27: =RC[-28] -> 40.22 | AK27: =RC[-28] -> 6.0972083648000002 | AL27: =RC[-28] -> 26.540000000000006 | AM27: =RC[-28] -> 23.01145936 | AN27: =RC[-28] -> 25.192897800000001 | AO27: =RC[-28] -> 66.349999999999994 | AP27: - | AQ27: =RC[-29] -> 0 | AR27: =RC[-29] -> 0 | AS27: - | AT27: =RC[-30] -> 0 | AU27: =RC[-30] -> 0 | AV27: =RC[-30] -> 1.6488579750644901 | AW27: =RC[-30] -> 6.33911563962931 | AY27: - | AZ27: - | BA27: -
A28: =IF(RC[1]="","",DATEVALUE(RC[1])) -> 43380 | B28: 07.10.18 | C28: 24 | D28: 205.55535889000001 | E28: 67.069999999999993 | F28: 7.5195097414000003 | G28: 181.59230041999999 | H28: 40.64 | I28: 6.0423457424800002 | J28: =RC[-5]-RC[-2] -> 26.429999999999993 | K28: 23.96305847 | L28: 26.179353710000001 | M28: 66.58 | R28: 1.7195072752460101 | S28: 6.41088676077195 | T28: =(RC[-16]*RC[-15]-RC[-13]*RC[-12])/1000 -> 6.4066868316834995 | U28: 25.654338840000001 | V28: - | W28: =RC[-2]*RC[-10]/1000 -> 1.7080658799672002 | X28: =ABS((RC[-3]*RC[-11]-RC[-2]*RC[-9])/1000) -> #VALUE! | Y28: =(RC[-14]-RC[1])/RC[-18]*100 -> -0.93136127803231961 | Z28: 25.654338840000001 | AC28: =VALUE(RC[-27]) -> 2018-10-07T00:00:00.000 | AD28: =IF(RC[21]=42,"*",IF(RC[21]=32,"",RC[21])) -> - | AE28: =RC[-28] -> 24 | AF28: =RC[-28] -> 205.55535889000001 | AG28: =RC[-28] -> 67.069999999999993 | AH28: =RC[-28] -> 7.5195097414000003 | AI28: =RC[-28] -> 181.59230041999999 | AJ28: =RC[-28] -> 40.64 | AK28: =RC[-28] -> 6.0423457424800002 | AL28: =RC[-28] -> 26.429999999999993 | AM28: =RC[-28] -> 23.96305847 | AN28: =RC[-28] -> 26.179353710000001 | AO28: =RC[-28] -> 66.58 | AP28: - | AQ28: =RC[-29] -> 0 | AR28: =RC[-29] -> 0 | AS28: - | AT28: =RC[-30] -> 0 | AU28: =RC[-30] -> 0 | AV28: =RC[-30] -> 1.7195072752460101 | AW28: =RC[-30] -> 6.41088676077195 | AY28: - | AZ28: - | BA28: -
A29: =IF(RC[1]="","",DATEVALUE(RC[1])) -> 43381 | B29: 08.10.18 | C29: 24 | D29: 208.39569091999999 | E29: 67.05 | F29: 7.5140292750400004 | G29: 184.5553894 | H29: 40.5 | I29: 5.9780310529199996 | J29: =RC[-5]-RC[-2] -> 26.549999999999997 | K29: 23.840301520000001 | L29: 26.544639589999999 | M29: 66.59 | R29: 1.7416588826788999 | S29: 6.5022639223273098 | T29: =(RC[-16]*RC[-15]-RC[-13]*RC[-12])/1000 -> 6.4984378054859997 | U29: 26.013908390000001 | V29: - | W29: =RC[-2]*RC[-10]/1000 -> 1.7322661596901003 | X29: =ABS((RC[-3]*RC[-11]-RC[-2]*RC[-9])/1000) -> #VALUE! | Y29: =(RC[-14]-RC[1])/RC[-18]*100 -> -1.1777531271595585 | Z29: 26.013908390000001 | AC29: =VALUE(RC[-27]) -> 2018-10-08T00:00:00.000 | AD29: =IF(RC[21]=42,"*",IF(RC[21]=32,"",RC[21])) -> - | AE29: =RC[-28] -> 24 | AF29: =RC[-28] -> 208.39569091999999 | AG29: =RC[-28] -> 67.05 | AH29: =RC[-28] -> 7.5140292750400004 | AI29: =RC[-28] -> 184.5553894 | AJ29: =RC[-28] -> 40.5 | AK29: =RC[-28] -> 5.9780310529199996 | AL29: =RC[-28] -> 26.549999999999997 | AM29: =RC[-28] -> 23.840301520000001 | AN29: =RC[-28] -> 26.544639589999999 | AO29: =RC[-28] -> 66.59 | AP29: - | AQ29: =RC[-29] -> 0 | AR29: =RC[-29] -> 0 | AS29: - | AT29: =RC[-30] -> 0 | AU29: =RC[-30] -> 0 | AV29: =RC[-30] -> 1.7416588826788999 | AW29: =RC[-30] -> 6.5022639223273098 | AY29: - | AZ29: - | BA29: -
A30: =IF(RC[1]="","",DATEVALUE(RC[1])) -> 43382 | B30: 09.10.18 | C30: 24 | D30: 203.60493468999999 | E30: 66.89 | F30: 7.5139562144000003 | G30: 178.73822021000001 | H30: 40.42 | I30: 6.0199296973200003 | J30: =RC[-5]-RC[-2] -> 26.47 | K30: 24.866714479999999 | L30: 23.44311523 | M30: 66.260000000000005 | R30: 1.5389809950320099 | S30: 6.4026989395242202 | T30: =(RC[-16]*RC[-15]-RC[-13]*RC[-12])/1000 -> 6.3945352205258992 | U30: 22.972391129999998 | V30: - | W30: =RC[-2]*RC[-10]/1000 -> 1.5221506362738 | X30: =ABS((RC[-3]*RC[-11]-RC[-2]*RC[-9])/1000) -> #VALUE! | Y30: =(RC[-14]-RC[1])/RC[-18]*100 -> 1.0598311585369682 | Z30: 22.972391129999998 | AC30: =VALUE(RC[-27]) -> 2018-10-09T00:00:00.000 | AD30: =IF(RC[21]=42,"*",IF(RC[21]=32,"",RC[21])) -> - | AE30: =RC[-28] -> 24 | AF30: =RC[-28] -> 203.60493468999999 | AG30: =RC[-28] -> 66.89 | AH30: =RC[-28] -> 7.5139562144000003 | AI30: =RC[-28] -> 178.73822021000001 | AJ30: =RC[-28] -> 40.42 | AK30: =RC[-28] -> 6.0199296973200003 | AL30: =RC[-28] -> 26.47 | AM30: =RC[-28] -> 24.866714479999999 | AN30: =RC[-28] -> 23.44311523 | AO30: =RC[-28] -> 66.260000000000005 | AP30: - | AQ30: =RC[-29] -> 0 | AR30: =RC[-29] -> 0 | AS30: - | AT30: =RC[-30] -> 0 | AU30: =RC[-30] -> 0 | AV30: =RC[-30] -> 1.5389809950320099 | AW30: =RC[-30] -> 6.4026989395242202 | AY30: - | AZ30: - | BA30: -
A31: =IF(RC[1]="","",DATEVALUE(RC[1])) -> 43383 | B31: 10.10.18 | C31: 24 | D31: 203.04261779999999 | E31: 67.930000000000007 | F31: 7.5428344527600002 | G31: 179.02125548999999 | H31: 41.21 | I31: 6.0691128752800001 | J31: =RC[-5]-RC[-2] -> 26.720000000000006 | K31: 24.021362310000001 | L31: 22.985149379999999 | M31: 67.430000000000007 | R31: 1.5324195304289701 | S31: 6.42553035970192 | T31: =(RC[-16]*RC[-15]-RC[-13]*RC[-12])/1000 -> 6.4152190884111011 | U31: 22.50935364 | V31: - | W31: =RC[-2]*RC[-10]/1000 -> 1.5178057159452003 | X31: =ABS((RC[-3]*RC[-11]-RC[-2]*RC[-9])/1000) -> #VALUE! | Y31: =(RC[-14]-RC[1])/RC[-18]*100 -> 0.84459728866355754 | Z31: 22.50935364 | AC31: =VALUE(RC[-27]) -> 2018-10-10T00:00:00.000 | AD31: =IF(RC[21]=42,"*",IF(RC[21]=32,"",RC[21])) -> - | AE31: =RC[-28] -> 24 | AF31: =RC[-28] -> 203.04261779999999 | AG31: =RC[-28] -> 67.930000000000007 | AH31: =RC[-28] -> 7.5428344527600002 | AI31: =RC[-28] -> 179.02125548999999 | AJ31: =RC[-28] -> 41.21 | AK31: =RC[-28] -> 6.0691128752800001 | AL31: =RC[-28] -> 26.720000000000006 | AM31: =RC[-28] -> 24.021362310000001 | AN31: =RC[-28] -> 22.985149379999999 | AO31: =RC[-28] -> 67.430000000000007 | AP31: - | AQ31: =RC[-29] -> 0 | AR31: =RC[-29] -> 0 | AS31: - | AT31: =RC[-30] -> 0 | AU31: =RC[-30] -> 0 | AV31: =RC[-30] -> 1.5324195304289701 | AW31: =RC[-30] -> 6.42553035970192 | AY31: - | AZ31: - | BA31: -
A32: =IF(RC[1]="","",DATEVALUE(RC[1])) -> 43384 | B32: 11.10.18 | C32: 24 | D32: 204.0549469 | E32: 69.099999999999994 | F32: 7.4592317542400002 | G32: 181.47709656000001 | H32: 42.02 | I32: 5.92165762636 | J32: =RC[-5]-RC[-2] -> 27.079999999999991 | K32: 22.577850340000001 | L32: 21.060344700000002 | M32: 68.44 | R32: 1.4227928800038201 | S32: 6.4771642567115704 | T32: =(RC[-16]*RC[-15]-RC[-13]*RC[-12])/1000 -> 6.4745292333387976 | U32: 20.613201140000001 | V32: - | W32: =RC[-2]*RC[-10]/1000 -> 1.4107674860216 | X32: =ABS((RC[-3]*RC[-11]-RC[-2]*RC[-9])/1000) -> #VALUE! | Y32: =(RC[-14]-RC[1])/RC[-18]*100 -> 1.082587961368694 | Z32: 20.613201140000001 | AC32: =VALUE(RC[-27]) -> 2018-10-11T00:00:00.000 | AD32: =IF(RC[21]=42,"*",IF(RC[21]=32,"",RC[21])) -> - | AE32: =RC[-28] -> 24 | AF32: =RC[-28] -> 204.0549469 | AG32: =RC[-28] -> 69.099999999999994 | AH32: =RC[-28] -> 7.4592317542400002 | AI32: =RC[-28] -> 181.47709656000001 | AJ32: =RC[-28] -> 42.02 | AK32: =RC[-28] -> 5.92165762636 | AL32: =RC[-28] -> 27.079999999999991 | AM32: =RC[-28] -> 22.577850340000001 | AN32: =RC[-28] -> 21.060344700000002 | AO32: =RC[-28] -> 68.44 | AP32: - | AQ32: =RC[-29] -> 0 | AR32: =RC[-29] -> 0 | AS32: - | AT32: =RC[-30] -> 0 | AU32: =RC[-30] -> 0 | AV32: =RC[-30] -> 1.4227928800038201 | AW32: =RC[-30] -> 6.4771642567115704 | AY32: - | AZ32: - | BA32: -
A33: =IF(RC[1]="","",DATEVALUE(RC[1])) -> 43385 | B33: 12.10.18 | C33: 24 | D33: 203.59092712 | E33: 68.989999999999995 | F33: 7.4523821151599998 | G33: 183.01954651 | H33: 41.91 | I33: 5.9214581381600002 | J33: =RC[-5]-RC[-2] -> 27.08 | K33: 20.571380609999999 | L33: 20.917858119999998 | M33: 68.23 | R33: 1.41037174453043 | S33: 6.3786005995031996 | T33: =(RC[-16]*RC[-15]-RC[-13]*RC[-12])/1000 -> 6.3753888677747002 | U33: 20.47595596 | V33: - | W33: =RC[-2]*RC[-10]/1000 -> 1.3970744751508 | X33: =ABS((RC[-3]*RC[-11]-RC[-2]*RC[-9])/1000) -> #VALUE! | Y33: =(RC[-14]-RC[1])/RC[-18]*100 -> 5.2139048434798919E-2 | Z33: 20.47595596 | AC33: =VALUE(RC[-27]) -> 2018-10-12T00:00:00.000 | AD33: =IF(RC[21]=42,"*",IF(RC[21]=32,"",RC[21])) -> - | AE33: =RC[-28] -> 24 | AF33: =RC[-28] -> 203.59092712 | AG33: =RC[-28] -> 68.989999999999995 | AH33: =RC[-28] -> 7.4523821151599998 | AI33: =RC[-28] -> 183.01954651 | AJ33: =RC[-28] -> 41.91 | AK33: =RC[-28] -> 5.9214581381600002 | AL33: =RC[-28] -> 27.08 | AM33: =RC[-28] -> 20.571380609999999 | AN33: =RC[-28] -> 20.917858119999998 | AO33: =RC[-28] -> 68.23 | AP33: - | AQ33: =RC[-29] -> 0 | AR33: =RC[-29] -> 0 | AS33: - | AT33: =RC[-30] -> 0 | AU33: =RC[-30] -> 0 | AV33: =RC[-30] -> 1.41037174453043 | AW33: =RC[-30] -> 6.3786005995031996 | AY33: - | AZ33: - | BA33: -
A34: =IF(RC[1]="","",DATEVALUE(RC[1])) -> 43386 | B34: 13.10.18 | C34: 24 | D34: 203.86955261 | E34: 70.03 | F34: 7.4316897296800004 | G34: 184.94697571 | H34: 42.5 | I34: 5.9135557523999998 | J34: =RC[-5]-RC[-2] -> 27.53 | K34: 18.922576899999999 | L34: 21.874887470000001 | M34: 69.510000000000005 | R34: 1.49849470956339 | S34: 6.4227509721027998 | T34: =(RC[-16]*RC[-15]-RC[-13]*RC[-12])/1000 -> 6.4167383016033002 | U34: 21.399358750000001 | V34: - | W34: =RC[-2]*RC[-10]/1000 -> 1.4874694267125002 | X34: =ABS((RC[-3]*RC[-11]-RC[-2]*RC[-9])/1000) -> #VALUE! | Y34: =(RC[-14]-RC[1])/RC[-18]*100 -> -1.3391848341892532 | Z34: 21.399358750000001 | AC34: =VALUE(RC[-27]) -> 2018-10-13T00:00:00.000 | AD34: =IF(RC[21]=42,"*",IF(RC[21]=32,"",RC[21])) -> - | AE34: =RC[-28] -> 24 | AF34: =RC[-28] -> 203.86955261 | AG34: =RC[-28] -> 70.03 | AH34: =RC[-28] -> 7.4316897296800004 | AI34: =RC[-28] -> 184.94697571 | AJ34: =RC[-28] -> 42.5 | AK34: =RC[-28] -> 5.9135557523999998 | AL34: =RC[-28] -> 27.53 | AM34: =RC[-28] -> 18.922576899999999 | AN34: =RC[-28] -> 21.874887470000001 | AO34: =RC[-28] -> 69.510000000000005 | AP34: - | AQ34: =RC[-29] -> 0 | AR34: =RC[-29] -> 0 | AS34: - | AT34: =RC[-30] -> 0 | AU34: =RC[-30] -> 0 | AV34: =RC[-30] -> 1.49849470956339 | AW34: =RC[-30] -> 6.4227509721027998 | AY34: - | AZ34: - | BA34: -
A35: =IF(RC[1]="","",DATEVALUE(RC[1])) -> 43387 | B35: 14.10.18 | C35: 24 | D35: 205.42092896 | E35: 70.819999999999993 | F35: 7.4054565722000003 | G35: 184.61607361 | H35: 43.27 | I35: 5.8967382338799998 | J35: =RC[-5]-RC[-2] -> 27.54999999999999 | K35: 20.80485535 | L35: 23.643558500000001 | M35: 70.34 | R35: 1.63937851820006 | S35: 6.5660012013948599 | T35: =(RC[-16]*RC[-15]-RC[-13]*RC[-12])/1000 -> 6.5595726838424984 | U35: 23.117321010000001 | V35: - | W35: =RC[-2]*RC[-10]/1000 -> 1.6260723598434002 | X35: =ABS((RC[-3]*RC[-11]-RC[-2]*RC[-9])/1000) -> #VALUE! | Y35: =(RC[-14]-RC[1])/RC[-18]*100 -> -1.2525808911335998 | Z35: 23.117321010000001 | AC35: =VALUE(RC[-27]) -> 2018-10-14T00:00:00.000 | AD35: =IF(RC[21]=42,"*",IF(RC[21]=32,"",RC[21])) -> - | AE35: =RC[-28] -> 24 | AF35: =RC[-28] -> 205.42092896 | AG35: =RC[-28] -> 70.819999999999993 | AH35: =RC[-28] -> 7.4054565722000003 | AI35: =RC[-28] -> 184.61607361 | AJ35: =RC[-28] -> 43.27 | AK35: =RC[-28] -> 5.8967382338799998 | AL35: =RC[-28] -> 27.54999999999999 | AM35: =RC[-28] -> 20.80485535 | AN35: =RC[-28] -> 23.643558500000001 | AO35: =RC[-28] -> 70.34 | AP35: - | AQ35: =RC[-29] -> 0 | AR35: =RC[-29] -> 0 | AS35: - | AT35: =RC[-30] -> 0 | AU35: =RC[-30] -> 0 | AV35: =RC[-30] -> 1.63937851820006 | AW35: =RC[-30] -> 6.5660012013948599 | AY35: - | AZ35: - | BA35: -
A36: =IF(RC[1]="","",DATEVALUE(RC[1])) -> 43388 | B36: 15.10.18 | C36: 24 | D36: 205.93788147000001 | E36: 70.319999999999993 | F36: 7.4655886421600002 | G36: 188.08201599 | H36: 43.61 | I36: 5.8978075110399999 | J36: =RC[-5]-RC[-2] -> 26.709999999999994 | K36: 17.855865479999999 | L36: 20.1019249 | M36: 69.83 | R36: 1.3823324496035201 | S36: 6.2843857408999702 | T36: =(RC[-16]*RC[-15]-RC[-13]*RC[-12])/1000 -> 6.2792951076465 | U36: 19.660896300000001 | V36: - | W36: =RC[-2]*RC[-10]/1000 -> 1.372920388629 | X36: =ABS((RC[-3]*RC[-11]-RC[-2]*RC[-9])/1000) -> #VALUE! | Y36: =(RC[-14]-RC[1])/RC[-18]*100 -> -0.95970410062808598 | Z36: 19.660896300000001 | AC36: =VALUE(RC[-27]) -> 2018-10-15T00:00:00.000 | AD36: =IF(RC[21]=42,"*",IF(RC[21]=32,"",RC[21])) -> - | AE36: =RC[-28] -> 24 | AF36: =RC[-28] -> 205.93788147000001 | AG36: =RC[-28] -> 70.319999999999993 | AH36: =RC[-28] -> 7.4655886421600002 | AI36: =RC[-28] -> 188.08201599 | AJ36: =RC[-28] -> 43.61 | AK36: =RC[-28] -> 5.8978075110399999 | AL36: =RC[-28] -> 26.709999999999994 | AM36: =RC[-28] -> 17.855865479999999 | AN36: =RC[-28] -> 20.1019249 | AO36: =RC[-28] -> 69.83 | AP36: - | AQ36: =RC[-29] -> 0 | AR36: =RC[-29] -> 0 | AS36: - | AT36: =RC[-30] -> 0 | AU36: =RC[-30] -> 0 | AV36: =RC[-30] -> 1.3823324496035201 | AW36: =RC[-30] -> 6.2843857408999702 | AY36: - | AZ36: - | BA36: -
A37: =IF(RC[1]="","",DATEVALUE(RC[1])) -> 43389 | B37: 16.10.18 | C37: 24 | D37: 210.53166199 | E37: 70.37 | F37: 7.5013372337200002 | G37: 189.92507935 | H37: 43.53 | I37: 5.8968051721199997 | J37: =RC[-5]-RC[-2] -> 26.840000000000003 | K37: 20.606582639999999 | L37: 22.764039990000001 | M37: 69.760000000000005 | R37: 1.5662027849431499 | S37: 6.5528705264163598 | T37: =(RC[-16]*RC[-15]-RC[-13]*RC[-12])/1000 -> 6.5476743501308015 | U37: 22.26430702 | V37: - | W37: =RC[-2]*RC[-10]/1000 -> 1.5531580577152002 | X37: =ABS((RC[-3]*RC[-11]-RC[-2]*RC[-9])/1000) -> #VALUE! | Y37: =(RC[-14]-RC[1])/RC[-18]*100 -> -0.87283068969795907 | Z37: 22.26430702 | AC37: =VALUE(RC[-27]) -> 2018-10-16T00:00:00.000 | AD37: =IF(RC[21]=42,"*",IF(RC[21]=32,"",RC[21])) -> - | AE37: =RC[-28] -> 24 | AF37: =RC[-28] -> 210.53166199 | AG37: =RC[-28] -> 70.37 | AH37: =RC[-28] -> 7.5013372337200002 | AI37: =RC[-28] -> 189.92507935 | AJ37: =RC[-28] -> 43.53 | AK37: =RC[-28] -> 5.8968051721199997 | AL37: =RC[-28] -> 26.840000000000003 | AM37: =RC[-28] -> 20.606582639999999 | AN37: =RC[-28] -> 22.764039990000001 | AO37: =RC[-28] -> 69.760000000000005 | AP37: - | AQ37: =RC[-29] -> 0 | AR37: =RC[-29] -> 0 | AS37: - | AT37: =RC[-30] -> 0 | AU37: =RC[-30] -> 0 | AV37: =RC[-30] -> 1.5662027849431499 | AW37: =RC[-30] -> 6.5528705264163598 | AY37: - | AZ37: - | BA37: -
A38: =IF(RC[1]="","",DATEVALUE(RC[1])) -> 43390 | B38: 17.10.18 | C38: 24 | D38: 211.17613220000001 | E38: 70.5 | F38: 7.5325107598400001 | G38: 192.81182860999999 | H38: 43.86 | I38: 5.8754255472399999 | J38: =RC[-5]-RC[-2] -> 26.64 | K38: 18.364303589999999 | L38: 20.55308342 | M38: 69.84 | R38: 1.41696919843317 | S38: 6.4371184986146899 | T38: =(RC[-16]*RC[-15]-RC[-13]*RC[-12])/1000 -> 6.431190517265402 | U38: 20.100322720000001 | V38: - | W38: =RC[-2]*RC[-10]/1000 -> 1.4038065387648 | X38: =ABS((RC[-3]*RC[-11]-RC[-2]*RC[-9])/1000) -> #VALUE! | Y38: =(RC[-14]-RC[1])/RC[-18]*100 -> -0.90036962074118609 | Z38: 20.100322720000001 | AC38: =VALUE(RC[-27]) -> 2018-10-17T00:00:00.000 | AD38: =IF(RC[21]=42,"*",IF(RC[21]=32,"",RC[21])) -> - | AE38: =RC[-28] -> 24 | AF38: =RC[-28] -> 211.17613220000001 | AG38: =RC[-28] -> 70.5 | AH38: =RC[-28] -> 7.5325107598400001 | AI38: =RC[-28] -> 192.81182860999999 | AJ38: =RC[-28] -> 43.86 | AK38: =RC[-28] -> 5.8754255472399999 | AL38: =RC[-28] -> 26.64 | AM38: =RC[-28] -> 18.364303589999999 | AN38: =RC[-28] -> 20.55308342 | AO38: =RC[-28] -> 69.84 | AP38: - | AQ38: =RC[-29] -> 0 | AR38: =RC[-29] -> 0 | AS38: - | AT38: =RC[-30] -> 0 | AU38: =RC[-30] -> 0 | AV38: =RC[-30] -> 1.41696919843317 | AW38: =RC[-30] -> 6.4371184986146899 | AY38: - | AZ38: - | BA38: -
A39: =IF(RC[1]="","",DATEVALUE(RC[1])) -> 43391 | B39: 18.10.18 | C39: 24 | D39: 216.38800049 | E39: 70.98 | F39: 7.5612478768800004 | G39: 195.51126099000001 | H39: 44.39 | I39: 5.8390638993600001 | J39: =RC[-5]-RC[-2] -> 26.590000000000003 | K39: 20.876739499999999 | L39: 21.998348239999999 | M39: 70.56 | R39: 1.52677294831375 | S39: 6.6874154127257102 | T39: =(RC[-16]*RC[-15]-RC[-13]*RC[-12])/1000 -> 6.6804753994340986 | U39: 21.50669289 | V39: - | W39: =RC[-2]*RC[-10]/1000 -> 1.5175122503184 | X39: =ABS((RC[-3]*RC[-11]-RC[-2]*RC[-9])/1000) -> #VALUE! | Y39: =(RC[-14]-RC[1])/RC[-18]*100 -> -0.32220823844628649 | Z39: 21.50669289 | AC39: =VALUE(RC[-27]) -> 2018-10-18T00:00:00.000 | AD39: =IF(RC[21]=42,"*",IF(RC[21]=32,"",RC[21])) -> - | AE39: =RC[-28] -> 24 | AF39: =RC[-28] -> 216.38800049 | AG39: =RC[-28] -> 70.98 | AH39: =RC[-28] -> 7.5612478768800004 | AI39: =RC[-28] -> 195.51126099000001 | AJ39: =RC[-28] -> 44.39 | AK39: =RC[-28] -> 5.8390638993600001 | AL39: =RC[-28] -> 26.590000000000003 | AM39: =RC[-28] -> 20.876739499999999 | AN39: =RC[-28] -> 21.998348239999999 | AO39: =RC[-28] -> 70.56 | AP39: - | AQ39: =RC[-29] -> 0 | AR39: =RC[-29] -> 0 | AS39: - | AT39: =RC[-30] -> 0 | AU39: =RC[-30] -> 0 | AV39: =RC[-30] -> 1.52677294831375 | AW39: =RC[-30] -> 6.6874154127257102 | AY39: - | AZ39: - | BA39: -
A40: =IF(RC[1]="","",DATEVALUE(RC[1])) -> 43392 | B40: 19.10.18 | C40: 24 | D40: 214.07319641000001 | E40: 70.8 | F40: 7.5753722536800003 | G40: 196.08416747999999 | H40: 43.87 | I40: 5.8532862345599996 | J40: =RC[-5]-RC[-2] -> 26.93 | K40: 17.98902893 | L40: 20.319068909999999 | M40: 70.2 | R40: 1.4026241091048099 | S40: 6.5577732898633796 | T40: =(RC[-16]*RC[-15]-RC[-13]*RC[-12])/1000 -> 6.5541698784804012 | U40: 19.86970711 | V40: - | W40: =RC[-2]*RC[-10]/1000 -> 1.394853439122 | X40: =ABS((RC[-3]*RC[-11]-RC[-2]*RC[-9])/1000) -> #VALUE! | Y40: =(RC[-14]-RC[1])/RC[-18]*100 -> -0.95911781362553095 | Z40: 19.86970711 | AC40: =VALUE(RC[-27]) -> 2018-10-19T00:00:00.000 | AD40: =IF(RC[21]=42,"*",IF(RC[21]=32,"",RC[21])) -> - | AE40: =RC[-28] -> 24 | AF40: =RC[-28] -> 214.07319641000001 | AG40: =RC[-28] -> 70.8 | AH40: =RC[-28] -> 7.5753722536800003 | AI40: =RC[-28] -> 196.08416747999999 | AJ40: =RC[-28] -> 43.87 | AK40: =RC[-28] -> 5.8532862345599996 | AL40: =RC[-28] -> 26.93 | AM40: =RC[-28] -> 17.98902893 | AN40: =RC[-28] -> 20.319068909999999 | AO40: =RC[-28] -> 70.2 | AP40: - | AQ40: =RC[-29] -> 0 | AR40: =RC[-29] -> 0 | AS40: - | AT40: =RC[-30] -> 0 | AU40: =RC[-30] -> 0 | AV40: =RC[-30] -> 1.4026241091048099 | AW40: =RC[-30] -> 6.5577732898633796 | AY40: - | AZ40: - | BA40: -
A41: =IF(RC[1]="","",DATEVALUE(RC[1])) -> 43393 | B41: 20.10.18 | C41: 24 | D41: 216.47143555 | E41: 70.150000000000006 | F41: 7.5570087271200004 | G41: 195.19155884 | H41: 43.2 | I41: 5.8456575200799996 | J41: =RC[-5]-RC[-2] -> 26.950000000000003 | K41: 21.27987671 | L41: 23.518735889999999 | M41: 69.66 | R41: 1.6132988248781901 | S41: 6.7572248829655104 | T41: =(RC[-16]*RC[-15]-RC[-13]*RC[-12])/1000 -> 6.7531958619445014 | U41: 23.005603789999999 | V41: - | W41: =RC[-2]*RC[-10]/1000 -> 1.6025703600113999 | X41: =ABS((RC[-3]*RC[-11]-RC[-2]*RC[-9])/1000) -> #VALUE! | Y41: =(RC[-14]-RC[1])/RC[-18]*100 -> -0.88411972846356035 | Z41: 23.005603789999999 | AC41: =VALUE(RC[-27]) -> 2018-10-20T00:00:00.000 | AD41: =IF(RC[21]=42,"*",IF(RC[21]=32,"",RC[21])) -> - | AE41: =RC[-28] -> 24 | AF41: =RC[-28] -> 216.47143555 | AG41: =RC[-28] -> 70.150000000000006 | AH41: =RC[-28] -> 7.5570087271200004 | AI41: =RC[-28] -> 195.19155884 | AJ41: =RC[-28] -> 43.2 | AK41: =RC[-28] -> 5.8456575200799996 | AL41: =RC[-28] -> 26.950000000000003 | AM41: =RC[-28] -> 21.27987671 | AN41: =RC[-28] -> 23.518735889999999 | AO41: =RC[-28] -> 69.66 | AP41: - | AQ41: =RC[-29] -> 0 | AR41: =RC[-29] -> 0 | AS41: - | AT41: =RC[-30] -> 0 | AU41: =RC[-30] -> 0 | AV41: =RC[-30] -> 1.6132988248781901 | AW41: =RC[-30] -> 6.7572248829655104 | AY41: - | AZ41: - | BA41: -
A42: =IF(RC[1]="","",DATEVALUE(RC[1])) -> 43394 | B42: 21.10.18 | C42: 24 | D42: 218.41197205 | E42: 69.260000000000005 | F42: 7.5414131376000002 | G42: 194.5821991 | H42: 42.58 | I42: 5.8413027590000004 | J42: =RC[-5]-RC[-2] -> 26.680000000000007 | K42: 23.829772949999999 | L42: 26.005826949999999 | M42: 68.73 | R42: 1.7611916881628 | S42: 6.8450286113499601 | T42: =(RC[-16]*RC[-15]-RC[-13]*RC[-12])/1000 -> 6.8419031465050013 | U42: 25.45254898 | V42: - | W42: =RC[-2]*RC[-10]/1000 -> 1.7493536913954002 | X42: =ABS((RC[-3]*RC[-11]-RC[-2]*RC[-9])/1000) -> #VALUE! | Y42: =(RC[-14]-RC[1])/RC[-18]*100 -> -0.83397969470271083 | Z42: 25.45254898 | AC42: =VALUE(RC[-27]) -> 2018-10-21T00:00:00.000 | AD42: =IF(RC[21]=42,"*",IF(RC[21]=32,"",RC[21])) -> - | AE42: =RC[-28] -> 24 | AF42: =RC[-28] -> 218.41197205 | AG42: =RC[-28] -> 69.260000000000005 | AH42: =RC[-28] -> 7.5414131376000002 | AI42: =RC[-28] -> 194.5821991 | AJ42: =RC[-28] -> 42.58 | AK42: =RC[-28] -> 5.8413027590000004 | AL42: =RC[-28] -> 26.680000000000007 | AM42: =RC[-28] -> 23.829772949999999 | AN42: =RC[-28] -> 26.005826949999999 | AO42: =RC[-28] -> 68.73 | AP42: - | AQ42: =RC[-29] -> 0 | AR42: =RC[-29] -> 0 | AS42: - | AT42: =RC[-30] -> 0 | AU42: =RC[-30] -> 0 | AV42: =RC[-30] -> 1.7611916881628 | AW42: =RC[-30] -> 6.8450286113499601 | AY42: - | AZ42: - | BA42: -
A43: =IF(RC[1]="","",DATEVALUE(RC[1])) -> 43395 | B43: 22.10.18 | C43: 24 | D43: 216.6096344 | E43: 69.66 | F43: 7.5584690215599997 | G43: 194.74241638000001 | H43: 42.68 | I43: 5.8546461216400001 | J43: =RC[-5]-RC[-2] -> 26.979999999999997 | K43: 21.867218019999999 | L43: 24.090089800000001 | M43: 69.12 | R43: 1.6432752842266201 | S43: 6.7838957843699204 | T43: =(RC[-16]*RC[-15]-RC[-13]*RC[-12])/1000 -> 6.777420801205599 | U43: 23.569816589999999 | V43: - | W43: =RC[-2]*RC[-10]/1000 -> 1.6291457227007999 | X43: =ABS((RC[-3]*RC[-11]-RC[-2]*RC[-9])/1000) -> #VALUE! | Y43: =(RC[-14]-RC[1])/RC[-18]*100 -> -0.87428234775403335 | Z43: 23.569816589999999 | AC43: =VALUE(RC[-27]) -> 2018-10-22T00:00:00.000 | AD43: =IF(RC[21]=42,"*",IF(RC[21]=32,"",RC[21])) -> - | AE43: =RC[-28] -> 24 | AF43: =RC[-28] -> 216.6096344 | AG43: =RC[-28] -> 69.66 | AH43: =RC[-28] -> 7.5584690215599997 | AI43: =RC[-28] -> 194.74241638000001 | AJ43: =RC[-28] -> 42.68 | AK43: =RC[-28] -> 5.8546461216400001 | AL43: =RC[-28] -> 26.979999999999997 | AM43: =RC[-28] -> 21.867218019999999 | AN43: =RC[-28] -> 24.090089800000001 | AO43: =RC[-28] -> 69.12 | AP43: - | AQ43: =RC[-29] -> 0 | AR43: =RC[-29] -> 0 | AS43: - | AT43: =RC[-30] -> 0 | AU43: =RC[-30] -> 0 | AV43: =RC[-30] -> 1.6432752842266201 | AW43: =RC[-30] -> 6.7838957843699204 | AY43: - | AZ43: - | BA43: -
A44: =IF(RC[1]="","",DATEVALUE(RC[1])) ->  | C44: 24 | J44: =RC[-5]-RC[-2] -> #VALUE! | T44: =(RC[-16]*RC[-15]-RC[-13]*RC[-12])/1000 -> #VALUE! | W44: =RC[-2]*RC[-10]/1000 -> #VALUE! | X44: =ABS((RC[-3]*RC[-11]-RC[-2]*RC[-9])/1000) -> #VALUE! | Y44: =(RC[-14]-RC[1])/RC[-18]*100 -> #VALUE! | AC44: =VALUE(RC[-27]) -> #VALUE! | AD44: =IF(RC[21]=42,"*",IF(RC[21]=32,"",RC[21])) ->  | AE44: =RC[-28] -> 24 | AF44: =RC[-28] ->  | AG44: =RC[-28] ->  | AH44: =RC[-28] ->  | AI44: =RC[-28] ->  | AJ44: =RC[-28] ->  | AK44: =RC[-28] ->  | AL44: =RC[-28] -> #VALUE! | AM44: =RC[-28] ->  | AN44: =RC[-28] ->  | AO44: =RC[-28] ->  | AP44: - | AQ44: =RC[-29] -> 0 | AR44: =RC[-29] -> 0 | AS44: - | AT44: =RC[-30] -> 0 | AU44: =RC[-30] -> 0 | AV44: =RC[-30] ->  | AW44: =RC[-30] -> 
A45: =IF(RC[1]="","",DATEVALUE(RC[1])) ->  | C45: 24 | T45: =(RC[-16]*RC[-15]-RC[-13]*RC[-12])/1000 -> #VALUE! | W45: =RC[-2]*RC[-10]/1000 -> #VALUE! | X45: =ABS((RC[-3]*RC[-11]-RC[-2]*RC[-9])/1000) -> #VALUE! | Y45: =(RC[-14]-RC[1])/RC[-18]*100 -> #VALUE! | AC45: =VALUE(RC[-27]) -> #VALUE! | AD45: =IF(RC[21]=42,"*",IF(RC[21]=32,"",RC[21])) ->  | AE45: =RC[-28] -> 24 | AF45: =RC[-28] ->  | AG45: =RC[-28] ->  | AH45: =RC[-28] ->  | AI45: =RC[-28] ->  | AJ45: =RC[-28] ->  | AK45: =RC[-28] ->  | AL45: =RC[-28] -> 0 | AM45: =RC[-28] ->  | AN45: =RC[-28] ->  | AO45: =RC[-28] ->  | AP45: - | AQ45: =RC[-29] -> 0 | AR45: =RC[-29] -> 0 | AS45: - | AT45: =RC[-30] -> 0 | AU45: =RC[-30] -> 0 | AV45: =RC[-30] ->  | AW45: =RC[-30] -> 
A46: =IF(RC[1]="","",DATEVALUE(RC[1])) ->  | C46: 24 | T46: =(RC[-16]*RC[-15]-RC[-13]*RC[-12])/1000 -> #VALUE! | W46: =RC[-2]*RC[-10]/1000 -> #VALUE! | X46: =ABS((RC[-3]*RC[-11]-RC[-2]*RC[-9])/1000) -> #VALUE! | Y46: =(RC[-14]-RC[1])/RC[-18]*100 -> #VALUE! | AC46: =VALUE(RC[-27]) -> #VALUE! | AD46: =IF(RC[21]=42,"*",IF(RC[21]=32,"",RC[21])) ->  | AE46: =RC[-28] -> 24 | AF46: =RC[-28] ->  | AG46: =RC[-28] ->  | AH46: =RC[-28] ->  | AI46: =RC[-28] ->  | AJ46: =RC[-28] ->  | AK46: =RC[-28] ->  | AL46: =RC[-28] -> 0 | AM46: =RC[-28] ->  | AN46: =RC[-28] ->  | AO46: =RC[-28] ->  | AP46: - | AQ46: =RC[-29] -> 0 | AR46: =RC[-29] -> 0 | AS46: - | AT46: =RC[-30] -> 0 | AU46: =RC[-30] -> 0 | AV46: =RC[-30] ->  | AW46: =RC[-30] -> 
A47: =IF(RC[1]="","",DATEVALUE(RC[1])) ->  | C47: 24 | T47: =(RC[-16]*RC[-15]-RC[-13]*RC[-12])/1000 -> #VALUE! | W47: =RC[-2]*RC[-10]/1000 -> #VALUE! | X47: =ABS((RC[-3]*RC[-11]-RC[-2]*RC[-9])/1000) -> #VALUE! | Y47: =(RC[-14]-RC[1])/RC[-18]*100 -> #VALUE! | AC47: =VALUE(RC[-27]) -> #VALUE! | AD47: =IF(RC[21]=42,"*",IF(RC[21]=32,"",RC[21])) ->  | AE47: =RC[-28] -> 24 | AF47: =RC[-28] ->  | AG47: =RC[-28] ->  | AH47: =RC[-28] ->  | AI47: =RC[-28] ->  | AJ47: =RC[-28] ->  | AK47: =RC[-28] ->  | AL47: =RC[-28] -> 0 | AM47: =RC[-28] ->  | AN47: =RC[-28] ->  | AO47: =RC[-28] ->  | AP47: - | AQ47: =RC[-29] -> 0 | AR47: =RC[-29] -> 0 | AS47: - | AT47: =RC[-30] -> 0 | AU47: =RC[-30] -> 0 | AV47: =RC[-30] ->  | AW47: =RC[-30] -> 
A48: =IF(RC[1]="","",DATEVALUE(RC[1])) ->  | C48: 24 | T48: =(RC[-16]*RC[-15]-RC[-13]*RC[-12])/1000 -> #VALUE! | W48: =RC[-2]*RC[-10]/1000 -> #VALUE! | X48: =ABS((RC[-3]*RC[-11]-RC[-2]*RC[-9])/1000) -> #VALUE! | Y48: =(RC[-14]-RC[1])/RC[-18]*100 -> #VALUE! | AC48: =VALUE(RC[-27]) -> #VALUE! | AD48: =IF(RC[21]=42,"*",IF(RC[21]=32,"",RC[21])) ->  | AE48: =RC[-28] -> 24 | AF48: =RC[-28] ->  | AG48: =RC[-28] ->  | AH48: =RC[-28] ->  | AI48: =RC[-28] ->  | AJ48: =RC[-28] ->  | AK48: =RC[-28] ->  | AL48: =RC[-28] -> 0 | AM48: =RC[-28] ->  | AN48: =RC[-28] ->  | AO48: =RC[-28] ->  | AP48: - | AQ48: =RC[-29] -> 0 | AR48: =RC[-29] -> 0 | AS48: - | AT48: =RC[-30] -> 0 | AU48: =RC[-30] -> 0 | AV48: =RC[-30] ->  | AW48: =RC[-30] -> 
A49: =IF(RC[1]="","",DATEVALUE(RC[1])) ->  | C49: 24 | T49: =(RC[-16]*RC[-15]-RC[-13]*RC[-12])/1000 -> #VALUE! | W49: =RC[-2]*RC[-10]/1000 -> #VALUE! | X49: =ABS((RC[-3]*RC[-11]-RC[-2]*RC[-9])/1000) -> #VALUE! | Y49: =(RC[-14]-RC[1])/RC[-18]*100 -> #VALUE! | AC49: =VALUE(RC[-27]) -> #VALUE! | AD49: =IF(RC[21]=42,"*",IF(RC[21]=32,"",RC[21])) ->  | AE49: =RC[-28] -> 24 | AF49: =RC[-28] ->  | AG49: =RC[-28] ->  | AH49: =RC[-28] ->  | AI49: =RC[-28] ->  | AJ49: =RC[-28] ->  | AK49: =RC[-28] ->  | AL49: =RC[-28] -> 0 | AM49: =RC[-28] ->  | AN49: =RC[-28] ->  | AO49: =RC[-28] ->  | AP49: - | AQ49: =RC[-29] -> 0 | AR49: =RC[-29] -> 0 | AS49: - | AT49: =RC[-30] -> 0 | AU49: =RC[-30] -> 0 | AV49: =RC[-30] ->  | AW49: =RC[-30] -> 
A50: =IF(RC[1]="","",DATEVALUE(RC[1])) ->  | T50: =(RC[-16]*RC[-15]-RC[-13]*RC[-12])/1000 -> #VALUE! | W50: =RC[-2]*RC[-10]/1000 -> #VALUE! | X50: =ABS((RC[-3]*RC[-11]-RC[-2]*RC[-9])/1000) -> #VALUE! | Y50: =(RC[-14]-RC[1])/RC[-18]*100 -> #VALUE! | AC50: =VALUE(RC[-27]) -> #VALUE! | AD50: =IF(RC[21]=42,"*",IF(RC[21]=32,"",RC[21])) ->  | AE50: =RC[-28] ->  | AF50: =RC[-28] ->  | AG50: =RC[-28] ->  | AH50: =RC[-28] ->  | AI50: =RC[-28] ->  | AJ50: =RC[-28] ->  | AK50: =RC[-28] ->  | AL50: =RC[-28] -> 0 | AM50: =RC[-28] ->  | AN50: =RC[-28] ->  | AO50: =RC[-28] ->  | AP50: - | AQ50: =RC[-29] -> 0 | AR50: =RC[-29] -> 0 | AS50: - | AT50: =RC[-30] -> 0 | AU50: =RC[-30] -> 0 | AV50: =RC[-30] ->  | AW50: =RC[-30] -> 
A51: =IF(RC[1]="","",DATEVALUE(RC[1])) ->  | T51: =(RC[-16]*RC[-15]-RC[-13]*RC[-12])/1000 -> #VALUE! | W51: =RC[-2]*RC[-10]/1000 -> #VALUE! | X51: =ABS((RC[-3]*RC[-11]-RC[-2]*RC[-9])/1000) -> #VALUE! | Y51: =(RC[-14]-RC[1])/RC[-18]*100 -> #VALUE! | AC51: =VALUE(RC[-27]) -> #VALUE! | AD51: =IF(RC[21]=42,"*",IF(RC[21]=32,"",RC[21])) ->  | AE51: =RC[-28] ->  | AF51: =RC[-28] ->  | AG51: =RC[-28] ->  | AH51: =RC[-28] ->  | AI51: =RC[-28] ->  | AJ51: =RC[-28] ->  | AK51: =RC[-28] ->  | AL51: =RC[-28] -> 0 | AM51: =RC[-28] ->  | AN51: =RC[-28] ->  | AO51: =RC[-28] ->  | AP51: - | AQ51: =RC[-29] -> 0 | AR51: =RC[-29] -> 0 | AS51: - | AT51: =RC[-30] -> 0 | AU51: =RC[-30] -> 0 | AV51: =RC[-30] ->  | AW51: =RC[-30] -> 
A52: =IF(RC[1]="","",DATEVALUE(RC[1])) ->  | T52: =(RC[-16]*RC[-15]-RC[-13]*RC[-12])/1000 -> #VALUE! | W52: =RC[-2]*RC[-10]/1000 -> #VALUE! | X52: =ABS((RC[-3]*RC[-11]-RC[-2]*RC[-9])/1000) -> #VALUE! | Y52: =(RC[-14]-RC[1])/RC[-18]*100 -> #VALUE! | AC52: =VALUE(RC[-27]) -> #VALUE! | AD52: =IF(RC[21]=42,"*",IF(RC[21]=32,"",RC[21])) ->  | AE52: =RC[-28] ->  | AF52: =RC[-28] ->  | AG52: =RC[-28] ->  | AH52: =RC[-28] ->  | AI52: =RC[-28] ->  | AJ52: =RC[-28] ->  | AK52: =RC[-28] ->  | AL52: =RC[-28] -> 0 | AM52: =RC[-28] ->  | AN52: =RC[-28] ->  | AO52: =RC[-28] ->  | AP52: - | AQ52: =RC[-29] -> 0 | AR52: =RC[-29] -> 0 | AS52: - | AT52: =RC[-30] -> 0 | AU52: =RC[-30] -> 0 | AV52: =RC[-30] ->  | AW52: =RC[-30] -> 
A53: =IF(RC[1]="","",DATEVALUE(RC[1])) ->  | T53: =(RC[-16]*RC[-15]-RC[-13]*RC[-12])/1000 -> #VALUE! | W53: =RC[-2]*RC[-10]/1000 -> #VALUE! | X53: =ABS((RC[-3]*RC[-11]-RC[-2]*RC[-9])/1000) -> #VALUE! | Y53: =(RC[-14]-RC[1])/RC[-18]*100 -> #VALUE! | AC53: =VALUE(RC[-27]) -> #VALUE! | AD53: =IF(RC[21]=42,"*",IF(RC[21]=32,"",RC[21])) ->  | AE53: =RC[-28] ->  | AF53: =RC[-28] ->  | AG53: =RC[-28] ->  | AH53: =RC[-28] ->  | AI53: =RC[-28] ->  | AJ53: =RC[-28] ->  | AK53: =RC[-28] ->  | AL53: =RC[-28] -> 0 | AM53: =RC[-28] ->  | AN53: =RC[-28] ->  | AO53: =RC[-28] ->  | AP53: - | AQ53: =RC[-29] -> 0 | AR53: =RC[-29] -> 0 | AS53: - | AT53: =RC[-30] -> 0 | AU53: =RC[-30] -> 0 | AV53: =RC[-30] ->  | AW53: =RC[-30] -> 
A54: =IF(RC[1]="","",DATEVALUE(RC[1])) ->  | T54: =(RC[-16]*RC[-15]-RC[-13]*RC[-12])/1000 -> #VALUE! | W54: =RC[-2]*RC[-10]/1000 -> #VALUE! | X54: =ABS((RC[-3]*RC[-11]-RC[-2]*RC[-9])/1000) -> #VALUE! | Y54: =(RC[-14]-RC[1])/RC[-18]*100 -> #VALUE! | AC54: =VALUE(RC[-27]) -> #VALUE! | AD54: =IF(RC[21]=42,"*",IF(RC[21]=32,"",RC[21])) ->  | AE54: =RC[-28] ->  | AF54: =RC[-28] ->  | AG54: =RC[-28] ->  | AH54: =RC[-28] ->  | AI54: =RC[-28] ->  | AJ54: =RC[-28] ->  | AK54: =RC[-28] ->  | AL54: =RC[-28] -> 0 | AM54: =RC[-28] ->  | AN54: =RC[-28] ->  | AO54: =RC[-28] ->  | AP54: - | AQ54: =RC[-29] -> 0 | AR54: =RC[-29] -> 0 | AS54: - | AT54: =RC[-30] -> 0 | AU54: =RC[-30] -> 0 | AV54: =RC[-30] ->  | AW54: =RC[-30] -> 
A55: =IF(RC[1]="","",DATEVALUE(RC[1])) ->  | T55: =(RC[-16]*RC[-15]-RC[-13]*RC[-12])/1000 -> #VALUE! | W55: =RC[-2]*RC[-10]/1000 -> #VALUE! | X55: =ABS((RC[-3]*RC[-11]-RC[-2]*RC[-9])/1000) -> #VALUE! | Y55: =(RC[-14]-RC[1])/RC[-18]*100 -> #VALUE! | AC55: =VALUE(RC[-27]) -> #VALUE! | AD55: =IF(RC[21]=42,"*",IF(RC[21]=32,"",RC[21])) ->  | AE55: =RC[-28] ->  | AF55: =RC[-28] ->  | AG55: =RC[-28] ->  | AH55: =RC[-28] ->  | AI55: =RC[-28] ->  | AJ55: =RC[-28] ->  | AK55: =RC[-28] ->  | AL55: =RC[-28] -> 0 | AM55: =RC[-28] ->  | AN55: =RC[-28] ->  | AO55: =RC[-28] ->  | AP55: - | AQ55: =RC[-29] -> 0 | AR55: =RC[-29] -> 0 | AS55: - | AT55: =RC[-30] -> 0 | AU55: =RC[-30] -> 0 | AV55: =RC[-30] ->  | AW55: =RC[-30] -> 
A56: =IF(RC[1]="","",DATEVALUE(RC[1])) ->  | T56: =(RC[-16]*RC[-15]-RC[-13]*RC[-12])/1000 -> #VALUE! | W56: =RC[-2]*RC[-10]/1000 -> #VALUE! | X56: =ABS((RC[-3]*RC[-11]-RC[-2]*RC[-9])/1000) -> #VALUE! | Y56: =(RC[-14]-RC[1])/RC[-18]*100 -> #VALUE! | AC56: =VALUE(RC[-27]) -> #VALUE! | AD56: =IF(RC[21]=42,"*",IF(RC[21]=32,"",RC[21])) ->  | AE56: =RC[-28] ->  | AF56: =RC[-28] ->  | AG56: =RC[-28] ->  | AH56: =RC[-28] ->  | AI56: =RC[-28] ->  | AJ56: =RC[-28] ->  | AK56: =RC[-28] ->  | AL56: =RC[-28] -> 0 | AM56: =RC[-28] ->  | AN56: =RC[-28] ->  | AO56: =RC[-28] ->  | AP56: - | AQ56: =RC[-29] -> 0 | AR56: =RC[-29] -> 0 | AS56: - | AT56: =RC[-30] -> 0 | AU56: =RC[-30] -> 0 | AV56: =RC[-30] ->  | AW56: =RC[-30] -> 
A57: =IF(RC[1]="","",DATEVALUE(RC[1])) ->  | T57: =(RC[-16]*RC[-15]-RC[-13]*RC[-12])/1000 -> #VALUE! | W57: =RC[-2]*RC[-10]/1000 -> #VALUE! | X57: =ABS((RC[-3]*RC[-11]-RC[-2]*RC[-9])/1000) -> #VALUE! | Y57: =(RC[-14]-RC[1])/RC[-18]*100 -> #VALUE! | AC57: =VALUE(RC[-27]) -> #VALUE! | AD57: =IF(RC[21]=42,"*",IF(RC[21]=32,"",RC[21])) ->  | AE57: =RC[-28] ->  | AF57: =RC[-28] ->  | AG57: =RC[-28] ->  | AH57: =RC[-28] ->  | AI57: =RC[-28] ->  | AJ57: =RC[-28] ->  | AK57: =RC[-28] ->  | AL57: =RC[-28] -> 0 | AM57: =RC[-28] ->  | AN57: =RC[-28] ->  | AO57: =RC[-28] ->  | AP57: - | AQ57: =RC[-29] -> 0 | AR57: =RC[-29] -> 0 | AS57: - | AT57: =RC[-30] -> 0 | AU57: =RC[-30] -> 0 | AV57: =RC[-30] ->  | AW57: =RC[-30] -> 
A58: =IF(RC[1]="","",DATEVALUE(RC[1])) ->  | T58: =(RC[-16]*RC[-15]-RC[-13]*RC[-12])/1000 -> #VALUE! | W58: =RC[-2]*RC[-10]/1000 -> #VALUE! | X58: =ABS((RC[-3]*RC[-11]-RC[-2]*RC[-9])/1000) -> #VALUE! | Y58: =(RC[-14]-RC[1])/RC[-18]*100 -> #VALUE! | AC58: =VALUE(RC[-27]) -> #VALUE! | AD58: =IF(RC[21]=42,"*",IF(RC[21]=32,"",RC[21])) ->  | AE58: =RC[-28] ->  | AF58: =RC[-28] ->  | AG58: =RC[-28] ->  | AH58: =RC[-28] ->  | AI58: =RC[-28] ->  | AJ58: =RC[-28] ->  | AK58: =RC[-28] ->  | AL58: =RC[-28] -> 0 | AM58: =RC[-28] ->  | AN58: =RC[-28] ->  | AO58: =RC[-28] ->  | AP58: - | AQ58: =RC[-29] -> 0 | AR58: =RC[-29] -> 0 | AS58: - | AT58: =RC[-30] -> 0 | AU58: =RC[-30] -> 0 | AV58: =RC[-30] ->  | AW58: =RC[-30] -> 
A59: =IF(RC[1]="","",DATEVALUE(RC[1])) ->  | T59: =(RC[-16]*RC[-15]-RC[-13]*RC[-12])/1000 -> #VALUE! | W59: =RC[-2]*RC[-10]/1000 -> #VALUE! | X59: =ABS((RC[-3]*RC[-11]-RC[-2]*RC[-9])/1000) -> #VALUE! | Y59: =(RC[-14]-RC[1])/RC[-18]*100 -> #VALUE! | AC59: =VALUE(RC[-27]) -> #VALUE! | AD59: =IF(RC[21]=42,"*",IF(RC[21]=32,"",RC[21])) ->  | AE59: =RC[-28] ->  | AF59: =RC[-28] ->  | AG59: =RC[-28] ->  | AH59: =RC[-28] ->  | AI59: =RC[-28] ->  | AJ59: =RC[-28] ->  | AK59: =RC[-28] ->  | AL59: =RC[-28] -> 0 | AM59: =RC[-28] ->  | AN59: =RC[-28] ->  | AO59: =RC[-28] ->  | AP59: - | AQ59: =RC[-29] -> 0 | AR59: =RC[-29] -> 0 | AS59: - | AT59: =RC[-30] -> 0 | AU59: =RC[-30] -> 0 | AV59: =RC[-30] ->  | AW59: =RC[-30] -> 
A60: =IF(RC[1]="","",DATEVALUE(RC[1])) ->  | T60: =(RC[-16]*RC[-15]-RC[-13]*RC[-12])/1000 -> #VALUE! | W60: =RC[-2]*RC[-10]/1000 -> #VALUE! | X60: =ABS((RC[-3]*RC[-11]-RC[-2]*RC[-9])/1000) -> #VALUE! | Y60: =(RC[-14]-RC[1])/RC[-18]*100 -> #VALUE! | AC60: =VALUE(RC[-27]) -> #VALUE! | AD60: =IF(RC[21]=42,"*",IF(RC[21]=32,"",RC[21])) ->  | AE60: =RC[-28] ->  | AF60: =RC[-28] ->  | AG60: =RC[-28] ->  | AH60: =RC[-28] ->  | AI60: =RC[-28] ->  | AJ60: =RC[-28] ->  | AK60: =RC[-28] ->  | AL60: =RC[-28] -> 0 | AM60: =RC[-28] ->  | AN60: =RC[-28] ->  | AO60: =RC[-28] ->  | AP60: - | AQ60: =RC[-29] -> 0 | AR60: =RC[-29] -> 0 | AS60: - | AT60: =RC[-30] -> 0 | AU60: =RC[-30] -> 0 | AV60: =RC[-30] ->  | AW60: =RC[-30] -> 
A61: =IF(RC[1]="","",DATEVALUE(RC[1])) ->  | T61: =(RC[-16]*RC[-15]-RC[-13]*RC[-12])/1000 -> #VALUE! | W61: =RC[-2]*RC[-10]/1000 -> #VALUE! | X61: =ABS((RC[-3]*RC[-11]-RC[-2]*RC[-9])/1000) -> #VALUE! | Y61: =(RC[-14]-RC[1])/RC[-18]*100 -> #VALUE! | AC61: =VALUE(RC[-27]) -> #VALUE! | AD61: =IF(RC[21]=42,"*",IF(RC[21]=32,"",RC[21])) ->  | AE61: =RC[-28] ->  | AF61: =RC[-28] ->  | AG61: =RC[-28] ->  | AH61: =RC[-28] ->  | AI61: =RC[-28] ->  | AJ61: =RC[-28] ->  | AK61: =RC[-28] ->  | AL61: =RC[-28] -> 0 | AM61: =RC[-28] ->  | AN61: =RC[-28] ->  | AO61: =RC[-28] ->  | AP61: - | AQ61: =RC[-29] -> 0 | AR61: =RC[-29] -> 0 | AS61: - | AT61: =RC[-30] -> 0 | AU61: =RC[-30] -> 0 | AV61: =RC[-30] ->  | AW61: =RC[-30] -> 
A62: =IF(RC[1]="","",DATEVALUE(RC[1])) ->  | T62: =(RC[-16]*RC[-15]-RC[-13]*RC[-12])/1000 -> #VALUE! | W62: =RC[-2]*RC[-10]/1000 -> #VALUE! | X62: =ABS((RC[-3]*RC[-11]-RC[-2]*RC[-9])/1000) -> #VALUE! | Y62: =(RC[-14]-RC[1])/RC[-18]*100 -> #VALUE! | AC62: =VALUE(RC[-27]) -> #VALUE! | AD62: =IF(RC[21]=42,"*",IF(RC[21]=32,"",RC[21])) ->  | AE62: =RC[-28] ->  | AF62: =RC[-28] ->  | AG62: =RC[-28] ->  | AH62: =RC[-28] ->  | AI62: =RC[-28] ->  | AJ62: =RC[-28] ->  | AK62: =RC[-28] ->  | AL62: =RC[-28] -> 0 | AM62: =RC[-28] ->  | AN62: =RC[-28] ->  | AO62: =RC[-28] ->  | AP62: - | AQ62: =RC[-29] -> 0 | AR62: =RC[-29] -> 0 | AS62: - | AT62: =RC[-30] -> 0 | AU62: =RC[-30] -> 0 | AV62: =RC[-30] ->  | AW62: =RC[-30] -> 
A63: =IF(RC[1]="","",DATEVALUE(RC[1])) ->  | T63: =(RC[-16]*RC[-15]-RC[-13]*RC[-12])/1000 -> #VALUE! | W63: =RC[-2]*RC[-10]/1000 -> #VALUE! | X63: =ABS((RC[-3]*RC[-11]-RC[-2]*RC[-9])/1000) -> #VALUE! | Y63: =(RC[-14]-RC[1])/RC[-18]*100 -> #VALUE! | AC63: =VALUE(RC[-27]) -> #VALUE! | AD63: =IF(RC[21]=42,"*",IF(RC[21]=32,"",RC[21])) ->  | AE63: =RC[-28] ->  | AF63: =RC[-28] ->  | AG63: =RC[-28] ->  | AH63: =RC[-28] ->  | AI63: =RC[-28] ->  | AJ63: =RC[-28] ->  | AK63: =RC[-28] ->  | AL63: =RC[-28] -> 0 | AM63: =RC[-28] ->  | AN63: =RC[-28] ->  | AO63: =RC[-28] ->  | AP63: - | AQ63: =RC[-29] -> 0 | AR63: =RC[-29] -> 0 | AS63: - | AT63: =RC[-30] -> 0 | AU63: =RC[-30] -> 0 | AV63: =RC[-30] ->  | AW63: =RC[-30] -> 
A64: =IF(RC[1]="","",DATEVALUE(RC[1])) ->  | T64: =(RC[-16]*RC[-15]-RC[-13]*RC[-12])/1000 -> #VALUE! | W64: =RC[-2]*RC[-10]/1000 -> #VALUE! | X64: =ABS((RC[-3]*RC[-11]-RC[-2]*RC[-9])/1000) -> #VALUE! | Y64: =(RC[-14]-RC[1])/RC[-18]*100 -> #VALUE! | AC64: =VALUE(RC[-27]) -> #VALUE! | AD64: =IF(RC[21]=42,"*",IF(RC[21]=32,"",RC[21])) ->  | AE64: =RC[-28] ->  | AF64: =RC[-28] ->  | AG64: =RC[-28] ->  | AH64: =RC[-28] ->  | AI64: =RC[-28] ->  | AJ64: =RC[-28] ->  | AK64: =RC[-28] ->  | AL64: =RC[-28] -> 0 | AM64: =RC[-28] ->  | AN64: =RC[-28] ->  | AO64: =RC[-28] ->  | AP64: - | AQ64: =RC[-29] -> 0 | AR64: =RC[-29] -> 0 | AS64: - | AT64: =RC[-30] -> 0 | AU64: =RC[-30] -> 0 | AV64: =RC[-30] ->  | AW64: =RC[-30] -> 
A65: =IF(RC[1]="","",DATEVALUE(RC[1])) ->  | T65: =(RC[-16]*RC[-15]-RC[-13]*RC[-12])/1000 -> #VALUE! | W65: =RC[-2]*RC[-10]/1000 -> #VALUE! | X65: =ABS((RC[-3]*RC[-11]-RC[-2]*RC[-9])/1000) -> #VALUE! | Y65: =(RC[-14]-RC[1])/RC[-18]*100 -> #VALUE! | AC65: =VALUE(RC[-27]) -> #VALUE! | AD65: =IF(RC[21]=42,"*",IF(RC[21]=32,"",RC[21])) ->  | AE65: =RC[-28] ->  | AF65: =RC[-28] ->  | AG65: =RC[-28] ->  | AH65: =RC[-28] ->  | AI65: =RC[-28] ->  | AJ65: =RC[-28] ->  | AK65: =RC[-28] ->  | AL65: =RC[-28] -> 0 | AM65: =RC[-28] ->  | AN65: =RC[-28] ->  | AO65: =RC[-28] ->  | AP65: - | AQ65: =RC[-29] -> 0 | AR65: =RC[-29] -> 0 | AS65: - | AT65: =RC[-30] -> 0 | AU65: =RC[-30] -> 0 | AV65: =RC[-30] ->  | AW65: =RC[-30] -> 
A66: =IF(RC[1]="","",DATEVALUE(RC[1])) ->  | T66: =(RC[-16]*RC[-15]-RC[-13]*RC[-12])/1000 -> #VALUE! | W66: =RC[-2]*RC[-10]/1000 -> #VALUE! | X66: =ABS((RC[-3]*RC[-11]-RC[-2]*RC[-9])/1000) -> #VALUE! | Y66: =(RC[-14]-RC[1])/RC[-18]*100 -> #VALUE! | AC66: =VALUE(RC[-27]) -> #VALUE! | AD66: =IF(RC[21]=42,"*",IF(RC[21]=32,"",RC[21])) ->  | AE66: =RC[-28] ->  | AF66: =RC[-28] ->  | AG66: =RC[-28] ->  | AH66: =RC[-28] ->  | AI66: =RC[-28] ->  | AJ66: =RC[-28] ->  | AK66: =RC[-28] ->  | AL66: =RC[-28] -> 0 | AM66: =RC[-28] ->  | AN66: =RC[-28] ->  | AO66: =RC[-28] ->  | AP66: - | AQ66: =RC[-29] -> 0 | AR66: =RC[-29] -> 0 | AS66: - | AT66: =RC[-30] -> 0 | AU66: =RC[-30] -> 0 | AV66: =RC[-30] ->  | AW66: =RC[-30] -> 
A67: =IF(RC[1]="","",DATEVALUE(RC[1])) ->  | T67: =(RC[-16]*RC[-15]-RC[-13]*RC[-12])/1000 -> #VALUE! | W67: =RC[-2]*RC[-10]/1000 -> #VALUE! | X67: =ABS((RC[-3]*RC[-11]-RC[-2]*RC[-9])/1000) -> #VALUE! | Y67: =(RC[-14]-RC[1])/RC[-18]*100 -> #VALUE! | AC67: =VALUE(RC[-27]) -> #VALUE! | AD67: =IF(RC[21]=42,"*",IF(RC[21]=32,"",RC[21])) ->  | AE67: =RC[-28] ->  | AF67: =RC[-28] ->  | AG67: =RC[-28] ->  | AH67: =RC[-28] ->  | AI67: =RC[-28] ->  | AJ67: =RC[-28] ->  | AK67: =RC[-28] ->  | AL67: =RC[-28] -> 0 | AM67: =RC[-28] ->  | AN67: =RC[-28] ->  | AO67: =RC[-28] ->  | AP67: - | AQ67: =RC[-29] -> 0 | AR67: =RC[-29] -> 0 | AS67: - | AT67: =RC[-30] -> 0 | AU67: =RC[-30] -> 0 | AV67: =RC[-30] ->  | AW67: =RC[-30] -> 
A68: =IF(RC[1]="","",DATEVALUE(RC[1])) ->  | T68: =(RC[-16]*RC[-15]-RC[-13]*RC[-12])/1000 -> #VALUE! | W68: =RC[-2]*RC[-10]/1000 -> #VALUE! | X68: =ABS((RC[-3]*RC[-11]-RC[-2]*RC[-9])/1000) -> #VALUE! | Y68: =(RC[-14]-RC[1])/RC[-18]*100 -> #VALUE! | AC68: =VALUE(RC[-27]) -> #VALUE! | AD68: =IF(RC[21]=42,"*",IF(RC[21]=32,"",RC[21])) ->  | AE68: =RC[-28] ->  | AF68: =RC[-28] ->  | AG68: =RC[-28] ->  | AH68: =RC[-28] ->  | AI68: =RC[-28] ->  | AJ68: =RC[-28] ->  | AK68: =RC[-28] ->  | AL68: =RC[-28] -> 0 | AM68: =RC[-28] ->  | AN68: =RC[-28] ->  | AO68: =RC[-28] ->  | AP68: - | AQ68: =RC[-29] -> 0 | AR68: =RC[-29] -> 0 | AS68: - | AT68: =RC[-30] -> 0 | AU68: =RC[-30] -> 0 | AV68: =RC[-30] ->  | AW68: =RC[-30] -> 
A69: =IF(RC[1]="","",DATEVALUE(RC[1])) ->  | T69: =(RC[-16]*RC[-15]-RC[-13]*RC[-12])/1000 -> #VALUE! | W69: =RC[-2]*RC[-10]/1000 -> #VALUE! | X69: =ABS((RC[-3]*RC[-11]-RC[-2]*RC[-9])/1000) -> #VALUE! | Y69: =(RC[-14]-RC[1])/RC[-18]*100 -> #VALUE! | AC69: =VALUE(RC[-27]) -> #VALUE! | AD69: =IF(RC[21]=42,"*",IF(RC[21]=32,"",RC[21])) ->  | AE69: =RC[-28] ->  | AF69: =RC[-28] ->  | AG69: =RC[-28] ->  | AH69: =RC[-28] ->  | AI69: =RC[-28] ->  | AJ69: =RC[-28] ->  | AK69: =RC[-28] ->  | AL69: =RC[-28] -> 0 | AM69: =RC[-28] ->  | AN69: =RC[-28] ->  | AO69: =RC[-28] ->  | AP69: - | AQ69: =RC[-29] -> 0 | AR69: =RC[-29] -> 0 | AS69: - | AT69: =RC[-30] -> 0 | AU69: =RC[-30] -> 0 | AV69: =RC[-30] ->  | AW69: =RC[-30] -> 
A70: =IF(RC[1]="","",DATEVALUE(RC[1])) ->  | T70: =(RC[-16]*RC[-15]-RC[-13]*RC[-12])/1000 -> #VALUE! | W70: =RC[-2]*RC[-10]/1000 -> #VALUE! | X70: =ABS((RC[-3]*RC[-11]-RC[-2]*RC[-9])/1000) -> #VALUE! | Y70: =(RC[-14]-RC[1])/RC[-18]*100 -> #VALUE! | AC70: =VALUE(RC[-27]) -> #VALUE! | AD70: =IF(RC[21]=42,"*",IF(RC[21]=32,"",RC[21])) ->  | AE70: =RC[-28] ->  | AF70: =RC[-28] ->  | AG70: =RC[-28] ->  | AH70: =RC[-28] ->  | AI70: =RC[-28] ->  | AJ70: =RC[-28] ->  | AK70: =RC[-28] ->  | AL70: =RC[-28] -> 0 | AM70: =RC[-28] ->  | AN70: =RC[-28] ->  | AO70: =RC[-28] ->  | AP70: - | AQ70: =RC[-29] -> 0 | AR70: =RC[-29] -> 0 | AS70: - | AT70: =RC[-30] -> 0 | AU70: =RC[-30] -> 0 | AV70: =RC[-30] ->  | AW70: =RC[-30] -> 
A71: =IF(RC[1]="","",DATEVALUE(RC[1])) ->  | T71: =(RC[-16]*RC[-15]-RC[-13]*RC[-12])/1000 -> #VALUE! | W71: =RC[-2]*RC[-10]/1000 -> #VALUE! | X71: =ABS((RC[-3]*RC[-11]-RC[-2]*RC[-9])/1000) -> #VALUE! | Y71: =(RC[-14]-RC[1])/RC[-18]*100 -> #VALUE! | AC71: =VALUE(RC[-27]) -> #VALUE! | AD71: =IF(RC[21]=42,"*",IF(RC[21]=32,"",RC[21])) ->  | AE71: =RC[-28] ->  | AF71: =RC[-28] ->  | AG71: =RC[-28] ->  | AH71: =RC[-28] ->  | AI71: =RC[-28] ->  | AJ71: =RC[-28] ->  | AK71: =RC[-28] ->  | AL71: =RC[-28] -> 0 | AM71: =RC[-28] ->  | AN71: =RC[-28] ->  | AO71: =RC[-28] ->  | AP71: - | AQ71: =RC[-29] -> 0 | AR71: =RC[-29] -> 0 | AS71: - | AT71: =RC[-30] -> 0 | AU71: =RC[-30] -> 0 | AV71: =RC[-30] ->  | AW71: =RC[-30] -> 
A72: =IF(RC[1]="","",DATEVALUE(RC[1])) ->  | T72: =(RC[-16]*RC[-15]-RC[-13]*RC[-12])/1000 -> #VALUE! | W72: =RC[-2]*RC[-10]/1000 -> #VALUE! | X72: =ABS((RC[-3]*RC[-11]-RC[-2]*RC[-9])/1000) -> #VALUE! | Y72: =(RC[-14]-RC[1])/RC[-18]*100 -> #VALUE! | AC72: =VALUE(RC[-27]) -> #VALUE! | AD72: =IF(RC[21]=42,"*",IF(RC[21]=32,"",RC[21])) ->  | AE72: =RC[-28] ->  | AF72: =RC[-28] ->  | AG72: =RC[-28] ->  | AH72: =RC[-28] ->  | AI72: =RC[-28] ->  | AJ72: =RC[-28] ->  | AK72: =RC[-28] ->  | AL72: =RC[-28] -> 0 | AM72: =RC[-28] ->  | AN72: =RC[-28] ->  | AO72: =RC[-28] ->  | AP72: - | AQ72: =RC[-29] -> 0 | AR72: =RC[-29] -> 0 | AS72: - | AT72: =RC[-30] -> 0 | AU72: =RC[-30] -> 0 | AV72: =RC[-30] ->  | AW72: =RC[-30] -> 
A73: =IF(RC[1]="","",DATEVALUE(RC[1])) ->  | T73: =(RC[-16]*RC[-15]-RC[-13]*RC[-12])/1000 -> #VALUE! | W73: =RC[-2]*RC[-10]/1000 -> #VALUE! | X73: =ABS((RC[-3]*RC[-11]-RC[-2]*RC[-9])/1000) -> #VALUE! | Y73: =(RC[-14]-RC[1])/RC[-18]*100 -> #VALUE! | AC73: =VALUE(RC[-27]) -> #VALUE! | AD73: =IF(RC[21]=42,"*",IF(RC[21]=32,"",RC[21])) ->  | AE73: =RC[-28] ->  | AF73: =RC[-28] ->  | AG73: =RC[-28] ->  | AH73: =RC[-28] ->  | AI73: =RC[-28] ->  | AJ73: =RC[-28] ->  | AK73: =RC[-28] ->  | AL73: =RC[-28] -> 0 | AM73: =RC[-28] ->  | AN73: =RC[-28] ->  | AO73: =RC[-28] ->  | AP73: - | AQ73: =RC[-29] -> 0 | AR73: =RC[-29] -> 0 | AS73: - | AT73: =RC[-30] -> 0 | AU73: =RC[-30] -> 0 | AV73: =RC[-30] ->  | AW73: =RC[-30] -> 
A74: =IF(RC[1]="","",DATEVALUE(RC[1])) ->  | T74: =(RC[-16]*RC[-15]-RC[-13]*RC[-12])/1000 -> #VALUE! | W74: =RC[-2]*RC[-10]/1000 -> #VALUE! | X74: =ABS((RC[-3]*RC[-11]-RC[-2]*RC[-9])/1000) -> #VALUE! | Y74: =(RC[-14]-RC[1])/RC[-18]*100 -> #VALUE! | AC74: =VALUE(RC[-27]) -> #VALUE! | AD74: =IF(RC[21]=42,"*",IF(RC[21]=32,"",RC[21])) ->  | AE74: =RC[-28] ->  | AF74: =RC[-28] ->  | AG74: =RC[-28] ->  | AH74: =RC[-28] ->  | AI74: =RC[-28] ->  | AJ74: =RC[-28] ->  | AK74: =RC[-28] ->  | AL74: =RC[-28] -> 0 | AM74: =RC[-28] ->  | AN74: =RC[-28] ->  | AO74: =RC[-28] ->  | AP74: - | AQ74: =RC[-29] -> 0 | AR74: =RC[-29] -> 0 | AS74: - | AT74: =RC[-30] -> 0 | AU74: =RC[-30] -> 0 | AV74: =RC[-30] ->  | AW74: =RC[-30] -> 
A75: =IF(RC[1]="","",DATEVALUE(RC[1])) ->  | T75: =(RC[-16]*RC[-15]-RC[-13]*RC[-12])/1000 -> #VALUE! | W75: =RC[-2]*RC[-10]/1000 -> #VALUE! | X75: =ABS((RC[-3]*RC[-11]-RC[-2]*RC[-9])/1000) -> #VALUE! | Y75: =(RC[-14]-RC[1])/RC[-18]*100 -> #VALUE! | AC75: =VALUE(RC[-27]) -> #VALUE! | AD75: =IF(RC[21]=42,"*",IF(RC[21]=32,"",RC[21])) ->  | AE75: =RC[-28] ->  | AF75: =RC[-28] ->  | AG75: =RC[-28] ->  | AH75: =RC[-28] ->  | AI75: =RC[-28] ->  | AJ75: =RC[-28] ->  | AK75: =RC[-28] ->  | AL75: =RC[-28] -> 0 | AM75: =RC[-28] ->  | AN75: =RC[-28] ->  | AO75: =RC[-28] ->  | AP75: - | AQ75: =RC[-29] -> 0 | AR75: =RC[-29] -> 0 | AS75: - | AT75: =RC[-30] -> 0 | AU75: =RC[-30] -> 0 | AV75: =RC[-30] ->  | AW75: =RC[-30] -> 
A76: =IF(RC[1]="","",DATEVALUE(RC[1])) ->  | T76: =(RC[-16]*RC[-15]-RC[-13]*RC[-12])/1000 -> #VALUE! | W76: =RC[-2]*RC[-10]/1000 -> #VALUE! | X76: =ABS((RC[-3]*RC[-11]-RC[-2]*RC[-9])/1000) -> #VALUE! | Y76: =(RC[-14]-RC[1])/RC[-18]*100 -> #VALUE! | AC76: =VALUE(RC[-27]) -> #VALUE! | AD76: =IF(RC[21]=42,"*",IF(RC[21]=32,"",RC[21])) ->  | AE76: =RC[-28] ->  | AF76: =RC[-28] ->  | AG76: =RC[-28] ->  | AH76: =RC[-28] ->  | AI76: =RC[-28] ->  | AJ76: =RC[-28] ->  | AK76: =RC[-28] ->  | AL76: =RC[-28] -> 0 | AM76: =RC[-28] ->  | AN76: =RC[-28] ->  | AO76: =RC[-28] ->  | AP76: - | AQ76: =RC[-29] -> 0 | AR76: =RC[-29] -> 0 | AS76: - | AT76: =RC[-30] -> 0 | AU76: =RC[-30] -> 0 | AV76: =RC[-30] ->  | AW76: =RC[-30] -> 
A77: =IF(RC[1]="","",DATEVALUE(RC[1])) ->  | T77: =(RC[-16]*RC[-15]-RC[-13]*RC[-12])/1000 -> #VALUE! | W77: =RC[-2]*RC[-10]/1000 -> #VALUE! | X77: =ABS((RC[-3]*RC[-11]-RC[-2]*RC[-9])/1000) -> #VALUE! | Y77: =(RC[-14]-RC[1])/RC[-18]*100 -> #VALUE! | AC77: =VALUE(RC[-27]) -> #VALUE! | AD77: =IF(RC[21]=42,"*",IF(RC[21]=32,"",RC[21])) ->  | AE77: =RC[-28] ->  | AF77: =RC[-28] ->  | AG77: =RC[-28] ->  | AH77: =RC[-28] ->  | AI77: =RC[-28] ->  | AJ77: =RC[-28] ->  | AK77: =RC[-28] ->  | AL77: =RC[-28] -> 0 | AM77: =RC[-28] ->  | AN77: =RC[-28] ->  | AO77: =RC[-28] ->  | AP77: - | AQ77: =RC[-29] -> 0 | AR77: =RC[-29] -> 0 | AS77: - | AT77: =RC[-30] -> 0 | AU77: =RC[-30] -> 0 | AV77: =RC[-30] ->  | AW77: =RC[-30] -> 
A78: =IF(RC[1]="","",DATEVALUE(RC[1])) ->  | T78: =(RC[-16]*RC[-15]-RC[-13]*RC[-12])/1000 -> #VALUE! | W78: =RC[-2]*RC[-10]/1000 -> #VALUE! | X78: =ABS((RC[-3]*RC[-11]-RC[-2]*RC[-9])/1000) -> #VALUE! | Y78: =(RC[-14]-RC[1])/RC[-18]*100 -> #VALUE! | AC78: =VALUE(RC[-27]) -> #VALUE! | AD78: =IF(RC[21]=42,"*",IF(RC[21]=32,"",RC[21])) ->  | AE78: =RC[-28] ->  | AF78: =RC[-28] ->  | AG78: =RC[-28] ->  | AH78: =RC[-28] ->  | AI78: =RC[-28] ->  | AJ78: =RC[-28] ->  | AK78: =RC[-28] ->  | AL78: =RC[-28] -> 0 | AM78: =RC[-28] ->  | AN78: =RC[-28] ->  | AO78: =RC[-28] ->  | AP78: - | AQ78: =RC[-29] -> 0 | AR78: =RC[-29] -> 0 | AS78: - | AT78: =RC[-30] -> 0 | AU78: =RC[-30] -> 0 | AV78: =RC[-30] ->  | AW78: =RC[-30] -> 
A79: =IF(RC[1]="","",DATEVALUE(RC[1])) ->  | T79: =(RC[-16]*RC[-15]-RC[-13]*RC[-12])/1000 -> #VALUE! | W79: =RC[-2]*RC[-10]/1000 -> #VALUE! | X79: =ABS((RC[-3]*RC[-11]-RC[-2]*RC[-9])/1000) -> #VALUE! | Y79: =(RC[-14]-RC[1])/RC[-18]*100 -> #VALUE! | AC79: =VALUE(RC[-27]) -> #VALUE! | AD79: =IF(RC[21]=42,"*",IF(RC[21]=32,"",RC[21])) ->  | AE79: =RC[-28] ->  | AF79: =RC[-28] ->  | AG79: =RC[-28] ->  | AH79: =RC[-28] ->  | AI79: =RC[-28] ->  | AJ79: =RC[-28] ->  | AK79: =RC[-28] ->  | AL79: =RC[-28] -> 0 | AM79: =RC[-28] ->  | AN79: =RC[-28] ->  | AO79: =RC[-28] ->  | AP79: - | AQ79: =RC[-29] -> 0 | AR79: =RC[-29] -> 0 | AS79: - | AT79: =RC[-30] -> 0 | AU79: =RC[-30] -> 0 | AV79: =RC[-30] ->  | AW79: =RC[-30] -> 
A80: =IF(RC[1]="","",DATEVALUE(RC[1])) ->  | T80: =(RC[-16]*RC[-15]-RC[-13]*RC[-12])/1000 -> #VALUE! | W80: =RC[-2]*RC[-10]/1000 -> #VALUE! | X80: =ABS((RC[-3]*RC[-11]-RC[-2]*RC[-9])/1000) -> #VALUE! | Y80: =(RC[-14]-RC[1])/RC[-18]*100 -> #VALUE! | AC80: =VALUE(RC[-27]) -> #VALUE! | AD80: =IF(RC[21]=42,"*",IF(RC[21]=32,"",RC[21])) ->  | AE80: =RC[-28] ->  | AF80: =RC[-28] ->  | AG80: =RC[-28] ->  | AH80: =RC[-28] ->  | AI80: =RC[-28] ->  | AJ80: =RC[-28] ->  | AK80: =RC[-28] ->  | AL80: =RC[-28] -> 0 | AM80: =RC[-28] ->  | AN80: =RC[-28] ->  | AO80: =RC[-28] ->  | AP80: - | AQ80: =RC[-29] -> 0 | AR80: =RC[-29] -> 0 | AS80: - | AT80: =RC[-30] -> 0 | AU80: =RC[-30] -> 0 | AV80: =RC[-30] ->  | AW80: =RC[-30] -> 
A81: =IF(RC[1]="","",DATEVALUE(RC[1])) ->  | T81: =(RC[-16]*RC[-15]-RC[-13]*RC[-12])/1000 -> #VALUE! | W81: =RC[-2]*RC[-10]/1000 -> #VALUE! | X81: =ABS((RC[-3]*RC[-11]-RC[-2]*RC[-9])/1000) -> #VALUE! | Y81: =(RC[-14]-RC[1])/RC[-18]*100 -> #VALUE! | AC81: =VALUE(RC[-27]) -> #VALUE! | AD81: =IF(RC[21]=42,"*",IF(RC[21]=32,"",RC[21])) ->  | AE81: =RC[-28] ->  | AF81: =RC[-28] ->  | AG81: =RC[-28] ->  | AH81: =RC[-28] ->  | AI81: =RC[-28] ->  | AJ81: =RC[-28] ->  | AK81: =RC[-28] ->  | AL81: =RC[-28] -> 0 | AM81: =RC[-28] ->  | AN81: =RC[-28] ->  | AO81: =RC[-28] ->  | AP81: - | AQ81: =RC[-29] -> 0 | AR81: =RC[-29] -> 0 | AS81: - | AT81: =RC[-30] -> 0 | AU81: =RC[-30] -> 0 | AV81: =RC[-30] ->  | AW81: =RC[-30] -> 
A82: =IF(RC[1]="","",DATEVALUE(RC[1])) ->  | T82: =(RC[-16]*RC[-15]-RC[-13]*RC[-12])/1000 -> #VALUE! | W82: =RC[-2]*RC[-10]/1000 -> #VALUE! | X82: =ABS((RC[-3]*RC[-11]-RC[-2]*RC[-9])/1000) -> #VALUE! | Y82: =(RC[-14]-RC[1])/RC[-18]*100 -> #VALUE! | AC82: =VALUE(RC[-27]) -> #VALUE! | AD82: =IF(RC[21]=42,"*",IF(RC[21]=32,"",RC[21])) ->  | AE82: =RC[-28] ->  | AF82: =RC[-28] ->  | AG82: =RC[-28] ->  | AH82: =RC[-28] ->  | AI82: =RC[-28] ->  | AJ82: =RC[-28] ->  | AK82: =RC[-28] ->  | AL82: =RC[-28] -> 0 | AM82: =RC[-28] ->  | AN82: =RC[-28] ->  | AO82: =RC[-28] ->  | AP82: - | AQ82: =RC[-29] -> 0 | AR82: =RC[-29] -> 0 | AS82: - | AT82: =RC[-30] -> 0 | AU82: =RC[-30] -> 0 | AV82: =RC[-30] ->  | AW82: =RC[-30] -> 
A83: =IF(RC[1]="","",DATEVALUE(RC[1])) ->  | T83: =(RC[-16]*RC[-15]-RC[-13]*RC[-12])/1000 -> #VALUE! | W83: =RC[-2]*RC[-10]/1000 -> #VALUE! | X83: =ABS((RC[-3]*RC[-11]-RC[-2]*RC[-9])/1000) -> #VALUE! | Y83: =(RC[-14]-RC[1])/RC[-18]*100 -> #VALUE! | AC83: =VALUE(RC[-27]) -> #VALUE! | AD83: =IF(RC[21]=42,"*",IF(RC[21]=32,"",RC[21])) ->  | AE83: =RC[-28] ->  | AF83: =RC[-28] ->  | AG83: =RC[-28] ->  | AH83: =RC[-28] ->  | AI83: =RC[-28] ->  | AJ83: =RC[-28] ->  | AK83: =RC[-28] ->  | AL83: =RC[-28] -> 0 | AM83: =RC[-28] ->  | AN83: =RC[-28] ->  | AO83: =RC[-28] ->  | AP83: - | AQ83: =RC[-29] -> 0 | AR83: =RC[-29] -> 0 | AS83: - | AT83: =RC[-30] -> 0 | AU83: =RC[-30] -> 0 | AV83: =RC[-30] ->  | AW83: =RC[-30] -> 
AC84: Среднее | AF84: =R[1]C[-28] -> 156.44243551955554 | AG84: =R[1]C[-28] -> 68.039444444444442 | AH84: =R[1]C[-28] -> 7.5839492700973317 | AI84: =R[1]C[-28] -> 132.777338028 | AJ84: =R[1]C[-28] -> 34.525555555555556 | AK84: =R[1]C[-28] -> 5.8217079769840012 | AL84: =R[1]C[-28] -> 33.513888888888893 | AM84: =R[1]C[-28] -> 23.665097491555557 | AN84: =R[1]C[-28] -> 23.275136312333341 | AO84: =R[1]C[-28] -> 65.412333333333351 | AP84: - | AQ84: =R[1]C[-29] -> 0 | AR84: =R[1]C[-29] -> 0 | AS84: - | AT84: =R[1]C[-30] -> 0 | AU84: =R[1]C[-30] -> 0
B85: Среднее | D85: =AVERAGE(OFFSET(R[-74]C,3,0,R7C1,1)) -> 156.44243551955554 | E85: =AVERAGE(OFFSET(R[-74]C,3,0,R7C1,1)) -> 68.039444444444442 | F85: =AVERAGE(OFFSET(R[-74]C,3,0,R7C1,1)) -> 7.5839492700973317 | G85: =AVERAGE(OFFSET(R[-74]C,3,0,R7C1,1)) -> 132.777338028 | H85: =AVERAGE(OFFSET(R[-74]C,3,0,R7C1,1)) -> 34.525555555555556 | I85: =AVERAGE(OFFSET(R[-74]C,3,0,R7C1,1)) -> 5.8217079769840012 | J85: =AVERAGE(OFFSET(R[-74]C,3,0,R7C1,1)) -> 33.513888888888893 | K85: =AVERAGE(OFFSET(R[-74]C,3,0,R7C1,1)) -> 23.665097491555557 | L85: =IF(SUM(OFFSET(R[-74]C,3,0,R7C1,1))=0,"",AVERAGE(OFFSET(R[-74]C,3,0,R7C1,1))) -> 23.275136312333341 | M85: =IF(SUM(OFFSET(R[-74]C,3,0,R7C1,1))=0,"",AVERAGE(OFFSET(R[-74]C,3,0,R7C1,1))) -> 65.412333333333351 | R85: =IF(SUM(OFFSET(R[-74]C,3,0,R7C1,1))=0,"",AVERAGE(OFFSET(R[-74]C,3,0,R7C1,1))) -> 1.5097853068373628 | S85: =AVERAGE(OFFSET(R[-74]C,3,0,R7C1,1)) -> 5.1094427984091997 | T85: =AVERAGE(OFFSET(R[-74]C,3,0,R7C1,1)) -> 5.1659226683125503 | W85: =AVERAGE(OFFSET(R[-74]C,3,0,R7C1,1)) -> 1.4887173112126264 | X85: =AVERAGE(OFFSET(R[-74]C,3,0,R7C1,1)) -> #VALUE! | AC85: Итого | AE85: =R[1]C[-28] -> 720 | AF85: =R[1]C[-28] -> 4693.2730655866662 | AI85: =R[1]C[-28] -> 3983.32014084 | AM85: =R[1]C[-28] -> 709.95292474666667 | AN85: =R[1]C[-28] -> 698.2540893700002 | AQ85: =R[1]C[-29] -> 0 | AU85: =R[1]C[-30] -> 0 | AV85: =R[1]C[-30] -> 45.293559205120886 | AW85: =R[1]C[-30] -> 153.28328395227598
B86: ИТОГО: | C86: =SUM(OFFSET(R[-75]C,3,0,R7C1,1)) -> 720 | D86: =SUM(OFFSET(R[-75]C,3,0,R7C1,1)) -> 4693.2730655866662 | G86: =SUM(OFFSET(R[-75]C,3,0,R7C1,1)) -> 3983.32014084 | K86: =SUM(OFFSET(R[-75]C,3,0,R7C1,1)) -> 709.95292474666667 | L86: =IF(SUM(OFFSET(R[-75]C,3,0,R7C1,1))=0,"",SUM(OFFSET(R[-75]C,3,0,R7C1,1))) -> 698.2540893700002 | R86: =IF(SUM(OFFSET(R[-75]C,3,0,R7C1,1))=0,"",SUM(OFFSET(R[-75]C,3,0,R7C1,1))) -> 45.293559205120886 | S86: =SUM(OFFSET(R[-75]C,3,0,R7C1,1)) -> 153.28328395227598 | T86: =SUM(OFFSET(R[-75]C,3,0,R7C1,1)) -> 154.97768004937652 | W86: =SUM(OFFSET(R[-75]C,3,0,R7C1,1)) -> 44.661519336378795 | X86: =SUM(OFFSET(R[-75]C,3,0,R7C1,1)) -> #VALUE!
AC87: Досчёт | AF87: =R[1]C[-28] -> 0 | AI87: =R[1]C[-28] -> 0 | AM87: =R[1]C[-28] -> 0 | AN87: =R[1]C[-28] -> 0 | AQ87: =R[1]C[-29] -> 0 | AU87: =R[1]C[-30] -> 0 | AV87: =R[1]C[-30] -> 0 | AW87: =R[1]C[-30] -> 0
A88: 11дн=264ч 4дн=96ч | B88: Досчёт до конца м-ца (+) | C88: =R6C1*24 -> 216 | T88: № B021 | AC88: Снятие | AF88: =-R[1]C[-28] -> 0 | AI88: =-R[1]C[-28] -> 0 | AM88: =-R[1]C[-28] -> 0 | AN88: =-R[1]C[-28] -> 0 | AQ88: =-R[1]C[-29] -> 0 | AU88: =-R[1]C[-30] -> 0 | AV88: =-R[1]C[-30] -> 0 | AW88: =-R[1]C[-30] -> 0
A89: 9дн=216ч 7дн=168ч | B89: Вычет с предыдущего (-) | C89: =R4C1*24 -> 192 | AC89: Сумма | AF89: =R[1]C[-28] -> 4693.2730655866662 | AI89: =R[1]C[-28] -> 3983.32014084 | AM89: =R[1]C[-28] -> 709.95292474666667 | AN89: =R[1]C[-28] -> 698.2540893700002 | AQ89: =R[1]C[-29] -> 0 | AU89: =R[1]C[-30] -> 0 | AV89: =R[1]C[-30] -> 45.293559205120886 | AW89: =R[1]C[-30] -> 153.28328395227598
B90: СУММА: | C90: =R[-4]C+R[-2]C-R[-1]C -> 744 | D90: =R[-4]C+R[-2]C-R[-1]C -> 4693.2730655866662 | G90: =R[-4]C+R[-2]C-R[-1]C -> 3983.32014084 | K90: =R[-4]C+R[-2]C-R[-1]C -> 709.95292474666667 | L90: =IF(SUM(OFFSET(R[-79]C,3,0,R7C1,1))=0,"",(R[-4]C+R[-2]C-R[-1]C)) -> 698.2540893700002 | R90: =IF(SUM(OFFSET(R[-79]C,3,0,R7C1,1))=0,"",(R[-4]C+R[-2]C-R[-1]C)) -> 45.293559205120886 | S90: =R[-4]C+R[-2]C-R[-1]C -> 153.28328395227598
AC91: Тхв на источнике | AE91: V гвс (м3) | AF91: =R[-2]C[15] -> 0 | AG91: W гвс (Гкал) | AH91: =RC[-2]*0.06 -> 0 | AI91: W без гвс (Гкал) | AJ91: =R[-2]C[13]-RC[-2] -> 153.28328395227598
B92: Показания счетчиков на момент снятия данных:
B93: Дата, время | D93: М1, т | F93: М2, т | H93: М3, т | J93: М4, т | L93: Qо, Гкал | N93: Qг, Гкал | P93: время, час
B94: 23.09.18 08:06 | D94: 108800.203125 | F94: 91189.234375 | H94: 17396.48828125 | J94: - | L94: 4171.5410822418098 | N94: 1275.03730101271 | P94: -
B95: 23.10.18 02:25 | D95: 113491.890625 | F95: 95062.390625 | H95: 18081.1484375 | J95: - | L95: 4329.7839526917896 | N95: 1320.35201220264 | P95: -
AC97: =ZAYAVKA_N -> письмо 02.10.18г некорректная работа приборов
B98: Представитель потребителя:_______________________________________________________________________ В.О. Топорков
I101: Рекомендуемые значения по параметрам теплопотребления (не являются официально утверждёнными)
I102: М, т | J102: V, м3 | K102: Qгвс, Гкал | L102: Qотоп, Гкал | M102: Qо, Гкал
I103: =R[-13]C[-3] -> 0 | J103: =RC[-1]/0.98 -> 0 | K103: =RC[-1]*0.06 -> 0 | L103: =RC[1]-RC[-1] -> 45.293559205120886 | M103: =R[-13]C[5] -> 45.293559205120886
O105: ДЛЯ САМОКОНТРОЛЯ
B106: В строке выбора дат указать период с 16.7.13 по 23.8.13 - жильё | N106: Q | O106: Qг
B107: В строке выбора дат указать период с 18.7.13 по 25.8.13 - не жилое | N107: =(R[-21]C[-10]*R[-22]C[-7]-R[-21]C[-9]*R[-22]C[-6])/1000 -> 623.1603042871086 | O107: =IF(R[-22]C[-2]="",R[-21]C[-3]*R[-22]C/1000,"") ->  | P107: Си2
O108: =IF(R[-23]C[-2]="","",((R[-22]C[-3]*R[-23]C)-(R[-22]C[-2]*R[-23]C[2]))/1000) -> 0 | P108: Си3