Sheet: Лист1
G1: Отчёт о теплопотреблении за октябрь 2018 | M1: з. на доп.№ 02/147-2548 от 5.10.2017 с 23.09.18г по 24.09.18г некорректная работа приборов
A4: =EOMONTH(R[9]C,0)-R[9]C -> 8 | B4: Потребитель: ЗАО "Сити Сервис"
A5: =MAX(R[9]C:R[78]C) -> 2018-10-22T00:00:00.000 | B5: Адрес: г. СПб, Наличная ул., д.55 ИТП 2
A6: =EOMONTH(R[-1]C,0)-R[-1]C -> 9 | B6: Телефон: 8-911-021-19-79
A7: =R[-2]C-R[6]C -> 30 | B7: Договор 10023-3 (.) 85875, 85876
A8: 7 | B8: Тепловычислитель: ВКТ-7 № 21183 | L8: М2 мах= | M8: 138.24 | O8: Мгвс мах= | P8: 12
L9: Qотоп мах= | M9: 11.064 | O9: Qгвс мах= | P9: 0.792
B10: Расчётная формула: Q=M1*(h1-hхв)-M2*(h2-hхв)
D12: Учет | L12: Контроль
A13: =R[1]C[1]-1 -> 2018-09-22T00:00:00.000 | B13: Дата | C13: N, ч | D13: M1, т | E13: T1, С | F13: P1, кг/см2 | G13: M2, т | H13: T2, С | I13: P2, кг/см2 | J13: dT, С | K13: M1-М2, т | L13: V3, м3 | M13: T3, С | N13: V4, м3 | O13: =IF(R[-12]C[-14]="м.куб","","T4, С") -> T4, С | P13: dT, С | Q13: V3-V4, м3 | R13: Qгвс, Гкал | S13: Qобщ., Гкал | T13: Q | U13: M3 | V13: M4 | W13: си2 | X13: си3 | Y13: Разб. | Z13: dM2 | AC13: Дата | AD13: НС | AE13: n, ч | AF13: М1, т | AG13: t1, гр. С | AH13: Р1, кгс/см2 | AI13: М2, т | AJ13: t2, гр. С | AK13: Р2, кгс/см2 | AL13: t1-t2, гр. С | AM13: М1-М2, т | AN13: М1гвс, т | AO13: t1гвс, гр. С | AP13: Р1гвс, кгс/см2 | AQ13: М2гвс, т | AR13: t2гвс, гр. С | AS13: Р2гвс, кгс/см2 | AT13: t1гвс-t2гвс | AU13: М1гвс-М2гвс, т | AV13: Wгвс, Гкал | AW13: Wсумм, Гкал | AY13: NS_TV1 | AZ13: НС | BA13: NS_TV2
A14: =IF(RC[1]="","",DATEVALUE(RC[1])) -> 43366 | B14: 23.09.18 | C14: 24 | D14: 0 | E14: 50.9 | F14: 5 | G14: 9.84 | H14: 58.4 | I14: 5.15 | J14: =RC[-5]-RC[-2] -> -7.5 | K14: -9.84 | L14: 57.96 | M14: 68.556666666666658 | N14: 50.906666666666666 | O14: 57.393333333333338 | P14: 11.163333333333329 | Q14: 7.0533333333333337 | R14: 1.0169999999999999 | S14: =RC[-1] -> 1.0169999999999999 | T14: =(RC[-16]*RC[-15]-RC[-13]*RC[-12])/1000 -> -0.57465599999999994 | U14: 5.6 | V14: 5.33 | W14: =RC[-2]*RC[-10]/1000 -> 0.38391733333333328 | X14: =ABS((RC[-3]*RC[-11]-RC[-2]*RC[-9])/1000) -> 7.8010866666666567E-2 | Y14: =(RC[-14]-RC[1])/RC[-18]*100 -> -102.74390243902438 | Z14: 0.27 | AC14: =VALUE(RC[-27]) -> 2018-09-23T00:00:00.000 | AD14: =IF(RC[21]=42,"*",IF(RC[21]=32,"",RC[21])) -> - | AE14: =RC[-28] -> 24 | AF14: =RC[-28] -> 0 | AG14: =RC[-28] -> 50.9 | AH14: =RC[-28] -> 5 | AI14: =RC[-28] -> 9.84 | AJ14: =RC[-28] -> 58.4 | AK14: =RC[-28] -> 5.15 | AL14: =RC[-28] -> -7.5 | AM14: =RC[-28] -> -9.84 | AN14: =RC[-28] -> 57.96 | AO14: =RC[-28] -> 68.556666666666658 | AP14: - | AQ14: =RC[-29] -> 50.906666666666666 | AR14: =RC[-29] -> 57.393333333333338 | AS14: - | AT14: =RC[-30] -> 11.163333333333329 | AU14: =RC[-30] -> 7.0533333333333337 | AV14: =RC[-30] -> 1.0169999999999999 | AW14: =RC[-30] -> 1.0169999999999999 | AY14: - | AZ14: - | BA14: -
A15: =IF(RC[1]="","",DATEVALUE(RC[1])) -> 43367 | B15: 24.09.18 | C15: 24 | D15: 65.239999999999995 | E15: 69.930000000000007 | F15: 7.07 | G15: 63.99 | H15: 64.41 | I15: 5.18 | J15: =RC[-5]-RC[-2] -> 5.5200000000000102 | K15: 1.25 | L15: =AVERAGE(R[4]C:R[6]C) -> 57.96 | M15: =AVERAGE(R[4]C:R[6]C) -> 68.556666666666658 | N15: =AVERAGE(R[4]C:R[6]C) -> 50.906666666666666 | O15: =AVERAGE(R[4]C:R[6]C) -> 57.393333333333338 | P15: =AVERAGE(R[4]C:R[6]C) -> 11.163333333333329 | Q15: =AVERAGE(R[4]C:R[6]C) -> 7.0533333333333337 | R15: =AVERAGE(R[4]C:R[6]C) -> 1.0169999999999999 | S15: =RC[-1] -> 1.0169999999999999 | T15: =(RC[-16]*RC[-15]-RC[-13]*RC[-12])/1000 -> 0.4406372999999994 | U15: 34.450000000000003 | V15: 29.91 | W15: =RC[-2]*RC[-10]/1000 -> 2.3617771666666667 | X15: =ABS((RC[-3]*RC[-11]-RC[-2]*RC[-9])/1000) -> 0.64514256666666669 | Y15: =(RC[-14]-RC[1])/RC[-18]*100 -> -5.141428348179403 | Z15: 4.54 | AC15: =VALUE(RC[-27]) -> 2018-09-24T00:00:00.000 | AD15: =IF(RC[21]=42,"*",IF(RC[21]=32,"",RC[21])) -> - | AE15: =RC[-28] -> 24 | AF15: =RC[-28] -> 65.239999999999995 | AG15: =RC[-28] -> 69.930000000000007 | AH15: =RC[-28] -> 7.07 | AI15: =RC[-28] -> 63.99 | AJ15: =RC[-28] -> 64.41 | AK15: =RC[-28] -> 5.18 | AL15: =RC[-28] -> 5.5200000000000102 | AM15: =RC[-28] -> 1.25 | AN15: =RC[-28] -> 57.96 | AO15: =RC[-28] -> 68.556666666666658 | AP15: - | AQ15: =RC[-29] -> 50.906666666666666 | AR15: =RC[-29] -> 57.393333333333338 | AS15: - | AT15: =RC[-30] -> 11.163333333333329 | AU15: =RC[-30] -> 7.0533333333333337 | AV15: =RC[-30] -> 1.0169999999999999 | AW15: =RC[-30] -> 1.0169999999999999 | AY15: - | AZ15: - | BA15: -
A16: =IF(RC[1]="","",DATEVALUE(RC[1])) -> 43368 | B16: 25.09.18 | C16: 24 | D16: 130.05000000000001 | E16: 68.819999999999993 | F16: 9.1300000000000008 | G16: 123.51 | H16: 64.27 | I16: 5.0199999999999996 | J16: =RC[-5]-RC[-2] -> 4.5499999999999972 | K16: 6.54 | L16: 64.63 | M16: 68.62 | N16: 57.83 | O16: 58.76 | P16: =IF(AND(ISNUMBER(RC[-3]),ISNUMBER(RC[-1])),RC[-3]-RC[-1],"-") -> 9.8600000000000065 | Q16: 6.8 | R16: 1.008 | S16: =RC[-1] -> 1.008 | T16: =(RC[-16]*RC[-15]-RC[-13]*RC[-12])/1000 -> 1.0120532999999996 | U16: 63.3 | V16: 56.8 | W16: =RC[-2]*RC[-10]/1000 -> 4.3436459999999997 | X16: =ABS((RC[-3]*RC[-11]-RC[-2]*RC[-9])/1000) -> 1.006078 | Y16: =(RC[-14]-RC[1])/RC[-18]*100 -> 3.238604161606351E-2 | Z16: 6.5 | AC16: =VALUE(RC[-27]) -> 2018-09-25T00:00:00.000 | AD16: =IF(RC[21]=42,"*",IF(RC[21]=32,"",RC[21])) -> - | AE16: =RC[-28] -> 24 | AF16: =RC[-28] -> 130.05000000000001 | AG16: =RC[-28] -> 68.819999999999993 | AH16: =RC[-28] -> 9.1300000000000008 | AI16: =RC[-28] -> 123.51 | AJ16: =RC[-28] -> 64.27 | AK16: =RC[-28] -> 5.0199999999999996 | AL16: =RC[-28] -> 4.5499999999999972 | AM16: =RC[-28] -> 6.54 | AN16: =RC[-28] -> 64.63 | AO16: =RC[-28] -> 68.62 | AP16: - | AQ16: =RC[-29] -> 57.83 | AR16: =RC[-29] -> 58.76 | AS16: - | AT16: =RC[-30] -> 9.8600000000000065 | AU16: =RC[-30] -> 6.8 | AV16: =RC[-30] -> 1.008 | AW16: =RC[-30] -> 1.008 | AY16: - | AZ16: - | BA16: -
A17: =IF(RC[1]="","",DATEVALUE(RC[1])) -> 43369 | B17: 26.09.18 | C17: 24 | D17: 130.63999999999999 | E17: 68.239999999999995 | F17: 9.1199999999999992 | G17: 123.59 | H17: 63.83 | I17: 5.01 | J17: =RC[-5]-RC[-2] -> 4.4099999999999966 | K17: 7.05 | L17: 65.27 | M17: 68.02 | N17: 57.79 | O17: 58.43 | P17: =IF(AND(ISNUMBER(RC[-3]),ISNUMBER(RC[-1])),RC[-3]-RC[-1],"-") -> 9.5899999999999963 | Q17: 7.48 | R17: 1.032 | S17: =RC[-1] -> 1.032 | T17: =(RC[-16]*RC[-15]-RC[-13]*RC[-12])/1000 -> 1.0261238999999986 | U17: 63.97 | V17: 56.84 | W17: =RC[-2]*RC[-10]/1000 -> 4.3512393999999999 | X17: =ABS((RC[-3]*RC[-11]-RC[-2]*RC[-9])/1000) -> 1.0300781999999995 | Y17: =(RC[-14]-RC[1])/RC[-18]*100 -> -6.4730156161501795E-2 | Z17: 7.13 | AC17: =VALUE(RC[-27]) -> 2018-09-26T00:00:00.000 | AD17: =IF(RC[21]=42,"*",IF(RC[21]=32,"",RC[21])) -> - | AE17: =RC[-28] -> 24 | AF17: =RC[-28] -> 130.63999999999999 | AG17: =RC[-28] -> 68.239999999999995 | AH17: =RC[-28] -> 9.1199999999999992 | AI17: =RC[-28] -> 123.59 | AJ17: =RC[-28] -> 63.83 | AK17: =RC[-28] -> 5.01 | AL17: =RC[-28] -> 4.4099999999999966 | AM17: =RC[-28] -> 7.05 | AN17: =RC[-28] -> 65.27 | AO17: =RC[-28] -> 68.02 | AP17: - | AQ17: =RC[-29] -> 57.79 | AR17: =RC[-29] -> 58.43 | AS17: - | AT17: =RC[-30] -> 9.5899999999999963 | AU17: =RC[-30] -> 7.48 | AV17: =RC[-30] -> 1.032 | AW17: =RC[-30] -> 1.032 | AY17: - | AZ17: - | BA17: -
A18: =IF(RC[1]="","",DATEVALUE(RC[1])) -> 43370 | B18: 27.09.18 | C18: 24 | D18: 97.46 | E18: 63.42 | F18: 8.84 | G18: 95.18 | H18: 56.78 | I18: 5.14 | J18: =RC[-5]-RC[-2] -> 6.6400000000000006 | K18: 2.2799999999999998 | L18: 60.64 | M18: 63.44 | N18: 52.26 | O18: 54.18 | P18: =IF(AND(ISNUMBER(RC[-3]),ISNUMBER(RC[-1])),RC[-3]-RC[-1],"-") -> 9.259999999999998 | Q18: 8.3800000000000008 | R18: 0.99099999999999999 | S18: 1.0089999999999999 | T18: =(RC[-16]*RC[-15]-RC[-13]*RC[-12])/1000 -> 0.77659279999999942 | U18: 59.55 | V18: 51.5 | W18: =RC[-2]*RC[-10]/1000 -> 3.7778519999999998 | X18: =ABS((RC[-3]*RC[-11]-RC[-2]*RC[-9])/1000) -> 0.98758199999999985 | Y18: =(RC[-14]-RC[1])/RC[-18]*100 -> -6.0621979407438547 | Z18: 8.0500000000000007 | AC18: =VALUE(RC[-27]) -> 2018-09-27T00:00:00.000 | AD18: =IF(RC[21]=42,"*",IF(RC[21]=32,"",RC[21])) -> - | AE18: =RC[-28] -> 24 | AF18: =RC[-28] -> 97.46 | AG18: =RC[-28] -> 63.42 | AH18: =RC[-28] -> 8.84 | AI18: =RC[-28] -> 95.18 | AJ18: =RC[-28] -> 56.78 | AK18: =RC[-28] -> 5.14 | AL18: =RC[-28] -> 6.6400000000000006 | AM18: =RC[-28] -> 2.2799999999999998 | AN18: =RC[-28] -> 60.64 | AO18: =RC[-28] -> 63.44 | AP18: - | AQ18: =RC[-29] -> 52.26 | AR18: =RC[-29] -> 54.18 | AS18: - | AT18: =RC[-30] -> 9.259999999999998 | AU18: =RC[-30] -> 8.3800000000000008 | AV18: =RC[-30] -> 0.99099999999999999 | AW18: =RC[-30] -> 1.0089999999999999 | AY18: - | AZ18: - | BA18: -
A19: =IF(RC[1]="","",DATEVALUE(RC[1])) -> 43371 | B19: 28.09.18 | C19: 24 | D19: 56.7 | E19: 68.41 | F19: 8.7100000000000009 | G19: 49.58 | H19: 57.29 | I19: 5.24 | J19: =RC[-5]-RC[-2] -> 11.119999999999997 | K19: 7.12 | L19: 58.65 | M19: 68.16 | N19: 51.48 | O19: 57.3 | P19: =IF(AND(ISNUMBER(RC[-3]),ISNUMBER(RC[-1])),RC[-3]-RC[-1],"-") -> 10.86 | Q19: 7.17 | R19: 1.0109999999999999 | S19: 1.0409999999999999 | T19: =(RC[-16]*RC[-15]-RC[-13]*RC[-12])/1000 -> 1.0384088000000002 | U19: 57.44 | V19: 50.72 | W19: =RC[-2]*RC[-10]/1000 -> 3.9151103999999997 | X19: =ABS((RC[-3]*RC[-11]-RC[-2]*RC[-9])/1000) -> 1.0088543999999997 | Y19: =(RC[-14]-RC[1])/RC[-18]*100 -> 0.80677692617991192 | Z19: 6.72 | AC19: =VALUE(RC[-27]) -> 2018-09-28T00:00:00.000 | AD19: =IF(RC[21]=42,"*",IF(RC[21]=32,"",RC[21])) -> - | AE19: =RC[-28] -> 24 | AF19: =RC[-28] -> 56.7 | AG19: =RC[-28] -> 68.41 | AH19: =RC[-28] -> 8.7100000000000009 | AI19: =RC[-28] -> 49.58 | AJ19: =RC[-28] -> 57.29 | AK19: =RC[-28] -> 5.24 | AL19: =RC[-28] -> 11.119999999999997 | AM19: =RC[-28] -> 7.12 | AN19: =RC[-28] -> 58.65 | AO19: =RC[-28] -> 68.16 | AP19: - | AQ19: =RC[-29] -> 51.48 | AR19: =RC[-29] -> 57.3 | AS19: - | AT19: =RC[-30] -> 10.86 | AU19: =RC[-30] -> 7.17 | AV19: =RC[-30] -> 1.0109999999999999 | AW19: =RC[-30] -> 1.0409999999999999 | AY19: - | AZ19: - | BA19: -
A20: =IF(RC[1]="","",DATEVALUE(RC[1])) -> 43372 | B20: 29.09.18 | C20: 24 | D20: 56.22 | E20: 67.819999999999993 | F20: 8.69 | G20: 48.57 | H20: 56.65 | I20: 5.37 | J20: =RC[-5]-RC[-2] -> 11.169999999999995 | K20: 7.65 | L20: 58.13 | M20: 67.569999999999993 | N20: 50.59 | O20: 56.67 | P20: =IF(AND(ISNUMBER(RC[-3]),ISNUMBER(RC[-1])),RC[-3]-RC[-1],"-") -> 10.899999999999991 | Q20: 7.54 | R20: 1.0269999999999999 | S20: 1.0640000000000001 | T20: =(RC[-16]*RC[-15]-RC[-13]*RC[-12])/1000 -> 1.0613498999999997 | U20: 56.97 | V20: 49.82 | W20: =RC[-2]*RC[-10]/1000 -> 3.8494628999999994 | X20: =ABS((RC[-3]*RC[-11]-RC[-2]*RC[-9])/1000) -> 1.0261634999999996 | Y20: =(RC[-14]-RC[1])/RC[-18]*100 -> 1.0294420424130122 | Z20: 7.15 | AC20: =VALUE(RC[-27]) -> 2018-09-29T00:00:00.000 | AD20: =IF(RC[21]=42,"*",IF(RC[21]=32,"",RC[21])) -> - | AE20: =RC[-28] -> 24 | AF20: =RC[-28] -> 56.22 | AG20: =RC[-28] -> 67.819999999999993 | AH20: =RC[-28] -> 8.69 | AI20: =RC[-28] -> 48.57 | AJ20: =RC[-28] -> 56.65 | AK20: =RC[-28] -> 5.37 | AL20: =RC[-28] -> 11.169999999999995 | AM20: =RC[-28] -> 7.65 | AN20: =RC[-28] -> 58.13 | AO20: =RC[-28] -> 67.569999999999993 | AP20: - | AQ20: =RC[-29] -> 50.59 | AR20: =RC[-29] -> 56.67 | AS20: - | AT20: =RC[-30] -> 10.899999999999991 | AU20: =RC[-30] -> 7.54 | AV20: =RC[-30] -> 1.0269999999999999 | AW20: =RC[-30] -> 1.0640000000000001 | AY20: - | AZ20: - | BA20: -
A21: =IF(RC[1]="","",DATEVALUE(RC[1])) -> 43373 | B21: 30.09.18 | C21: 24 | D21: 55.14 | E21: 70.209999999999994 | F21: 8.6199999999999992 | G21: 48.37 | H21: 58.17 | I21: 5.34 | J21: =RC[-5]-RC[-2] -> 12.039999999999992 | K21: 6.77 | L21: 57.1 | M21: 69.94 | N21: 50.65 | O21: 58.21 | P21: =IF(AND(ISNUMBER(RC[-3]),ISNUMBER(RC[-1])),RC[-3]-RC[-1],"-") -> 11.729999999999997 | Q21: 6.45 | R21: 1.0129999999999999 | S21: 1.0589999999999999 | T21: =(RC[-16]*RC[-15]-RC[-13]*RC[-12])/1000 -> 1.0576965 | U21: 55.94 | V21: 49.79 | W21: =RC[-2]*RC[-10]/1000 -> 3.9124435999999996 | X21: =ABS((RC[-3]*RC[-11]-RC[-2]*RC[-9])/1000) -> 1.0141676999999996 | Y21: =(RC[-14]-RC[1])/RC[-18]*100 -> 1.2817862311349995 | Z21: 6.15 | AC21: =VALUE(RC[-27]) -> 2018-09-30T00:00:00.000 | AD21: =IF(RC[21]=42,"*",IF(RC[21]=32,"",RC[21])) -> - | AE21: =RC[-28] -> 24 | AF21: =RC[-28] -> 55.14 | AG21: =RC[-28] -> 70.209999999999994 | AH21: =RC[-28] -> 8.6199999999999992 | AI21: =RC[-28] -> 48.37 | AJ21: =RC[-28] -> 58.17 | AK21: =RC[-28] -> 5.34 | AL21: =RC[-28] -> 12.039999999999992 | AM21: =RC[-28] -> 6.77 | AN21: =RC[-28] -> 57.1 | AO21: =RC[-28] -> 69.94 | AP21: - | AQ21: =RC[-29] -> 50.65 | AR21: =RC[-29] -> 58.21 | AS21: - | AT21: =RC[-30] -> 11.729999999999997 | AU21: =RC[-30] -> 6.45 | AV21: =RC[-30] -> 1.0129999999999999 | AW21: =RC[-30] -> 1.0589999999999999 | AY21: - | AZ21: - | BA21: -
A22: =IF(RC[1]="","",DATEVALUE(RC[1])) -> 43374 | B22: 01.10.18 | C22: 24 | D22: 55.37 | E22: 68.819999999999993 | F22: 8.6999999999999993 | G22: 48.49 | H22: 57.5 | I22: 5.4 | J22: =RC[-5]-RC[-2] -> 11.319999999999993 | K22: 6.88 | L22: 57.32 | M22: 68.569999999999993 | N22: 50.94 | O22: 57.51 | P22: =IF(AND(ISNUMBER(RC[-3]),ISNUMBER(RC[-1])),RC[-3]-RC[-1],"-") -> 11.059999999999995 | Q22: 6.38 | R22: 0.97099999999999997 | S22: 1.026 | T22: =(RC[-16]*RC[-15]-RC[-13]*RC[-12])/1000 -> 1.0223883999999994 | U22: 56.13 | V22: 50.14 | W22: =RC[-2]*RC[-10]/1000 -> 3.8488340999999995 | X22: =ABS((RC[-3]*RC[-11]-RC[-2]*RC[-9])/1000) -> 0.96528269999999972 | Y22: =(RC[-14]-RC[1])/RC[-18]*100 -> 1.835429985564033 | Z22: 5.99 | AC22: =VALUE(RC[-27]) -> 2018-10-01T00:00:00.000 | AD22: =IF(RC[21]=42,"*",IF(RC[21]=32,"",RC[21])) -> - | AE22: =RC[-28] -> 24 | AF22: =RC[-28] -> 55.37 | AG22: =RC[-28] -> 68.819999999999993 | AH22: =RC[-28] -> 8.6999999999999993 | AI22: =RC[-28] -> 48.49 | AJ22: =RC[-28] -> 57.5 | AK22: =RC[-28] -> 5.4 | AL22: =RC[-28] -> 11.319999999999993 | AM22: =RC[-28] -> 6.88 | AN22: =RC[-28] -> 57.32 | AO22: =RC[-28] -> 68.569999999999993 | AP22: - | AQ22: =RC[-29] -> 50.94 | AR22: =RC[-29] -> 57.51 | AS22: - | AT22: =RC[-30] -> 11.059999999999995 | AU22: =RC[-30] -> 6.38 | AV22: =RC[-30] -> 0.97099999999999997 | AW22: =RC[-30] -> 1.026 | AY22: - | AZ22: - | BA22: -
A23: =IF(RC[1]="","",DATEVALUE(RC[1])) -> 43375 | B23: 02.10.18 | C23: 24 | D23: 78.84 | E23: 67.67 | F23: 8.4 | G23: 57.01 | H23: 50.22 | I23: 5.41 | J23: =RC[-5]-RC[-2] -> 17.450000000000003 | K23: 21.83 | L23: 51.65 | M23: 67.400000000000006 | N23: 45.41 | O23: 55.69 | P23: =IF(AND(ISNUMBER(RC[-3]),ISNUMBER(RC[-1])),RC[-3]-RC[-1],"-") -> 11.710000000000008 | Q23: 6.24 | R23: 0.93200000000000005 | S23: 2.4750000000000001 | T23: =(RC[-16]*RC[-15]-RC[-13]*RC[-12])/1000 -> 2.4720606000000007 | U23: 50.61 | V23: 44.79 | W23: =RC[-2]*RC[-10]/1000 -> 3.411114 | X23: =ABS((RC[-3]*RC[-11]-RC[-2]*RC[-9])/1000) -> 0.91675890000000027 | Y23: =(RC[-14]-RC[1])/RC[-18]*100 -> 28.082792492545167 | Z23: 5.82 | AC23: =VALUE(RC[-27]) -> 2018-10-02T00:00:00.000 | AD23: =IF(RC[21]=42,"*",IF(RC[21]=32,"",RC[21])) -> - | AE23: =RC[-28] -> 24 | AF23: =RC[-28] -> 78.84 | AG23: =RC[-28] -> 67.67 | AH23: =RC[-28] -> 8.4 | AI23: =RC[-28] -> 57.01 | AJ23: =RC[-28] -> 50.22 | AK23: =RC[-28] -> 5.41 | AL23: =RC[-28] -> 17.450000000000003 | AM23: =RC[-28] -> 21.83 | AN23: =RC[-28] -> 51.65 | AO23: =RC[-28] -> 67.400000000000006 | AP23: - | AQ23: =RC[-29] -> 45.41 | AR23: =RC[-29] -> 55.69 | AS23: - | AT23: =RC[-30] -> 11.710000000000008 | AU23: =RC[-30] -> 6.24 | AV23: =RC[-30] -> 0.93200000000000005 | AW23: =RC[-30] -> 2.4750000000000001 | AY23: - | AZ23: - | BA23: -
A24: =IF(RC[1]="","",DATEVALUE(RC[1])) -> 43376 | B24: 03.10.18 | C24: 24 | D24: 129.81 | E24: 67.86 | F24: 8.35 | G24: 107.71 | H24: 49.77 | I24: 5.54 | J24: =RC[-5]-RC[-2] -> 18.089999999999996 | K24: 22.1 | L24: 53.3 | M24: 67.69 | N24: 46.76 | O24: 56.27 | P24: =IF(AND(ISNUMBER(RC[-3]),ISNUMBER(RC[-1])),RC[-3]-RC[-1],"-") -> 11.419999999999995 | Q24: 6.54 | R24: 0.94099999999999995 | S24: 3.4540000000000002 | T24: =(RC[-16]*RC[-15]-RC[-13]*RC[-12])/1000 -> 3.4481799 | U24: 52.19 | V24: 46.14 | W24: =RC[-2]*RC[-10]/1000 -> 3.5327410999999995 | X24: =ABS((RC[-3]*RC[-11]-RC[-2]*RC[-9])/1000) -> 0.93644329999999942 | Y24: =(RC[-14]-RC[1])/RC[-18]*100 -> 14.901123386872159 | Z24: 6.05 | AC24: =VALUE(RC[-27]) -> 2018-10-03T00:00:00.000 | AD24: =IF(RC[21]=42,"*",IF(RC[21]=32,"",RC[21])) -> - | AE24: =RC[-28] -> 24 | AF24: =RC[-28] -> 129.81 | AG24: =RC[-28] -> 67.86 | AH24: =RC[-28] -> 8.35 | AI24: =RC[-28] -> 107.71 | AJ24: =RC[-28] -> 49.77 | AK24: =RC[-28] -> 5.54 | AL24: =RC[-28] -> 18.089999999999996 | AM24: =RC[-28] -> 22.1 | AN24: =RC[-28] -> 53.3 | AO24: =RC[-28] -> 67.69 | AP24: - | AQ24: =RC[-29] -> 46.76 | AR24: =RC[-29] -> 56.27 | AS24: - | AT24: =RC[-30] -> 11.419999999999995 | AU24: =RC[-30] -> 6.54 | AV24: =RC[-30] -> 0.94099999999999995 | AW24: =RC[-30] -> 3.4540000000000002 | AY24: - | AZ24: - | BA24: -
A25: =IF(RC[1]="","",DATEVALUE(RC[1])) -> 43377 | B25: 04.10.18 | C25: 24 | D25: 137.99 | E25: 67.209999999999994 | F25: 8.11 | G25: 131.57 | H25: 48.03 | I25: 5.63 | J25: =RC[-5]-RC[-2] -> 19.179999999999993 | K25: 6.42 | L25: 56.69 | M25: 67.02 | N25: 51.17 | O25: 56.57 | P25: =IF(AND(ISNUMBER(RC[-3]),ISNUMBER(RC[-1])),RC[-3]-RC[-1],"-") -> 10.449999999999996 | Q25: 5.52 | R25: 0.88500000000000001 | S25: 2.96 | T25: =(RC[-16]*RC[-15]-RC[-13]*RC[-12])/1000 -> 2.9550007999999996 | U25: 55.56 | V25: 50.43 | W25: =RC[-2]*RC[-10]/1000 -> 3.7236311999999998 | X25: =ABS((RC[-3]*RC[-11]-RC[-2]*RC[-9])/1000) -> 0.87080609999999981 | Y25: =(RC[-14]-RC[1])/RC[-18]*100 -> 0.98046667173367807 | Z25: 5.13 | AC25: =VALUE(RC[-27]) -> 2018-10-04T00:00:00.000 | AD25: =IF(RC[21]=42,"*",IF(RC[21]=32,"",RC[21])) -> - | AE25: =RC[-28] -> 24 | AF25: =RC[-28] -> 137.99 | AG25: =RC[-28] -> 67.209999999999994 | AH25: =RC[-28] -> 8.11 | AI25: =RC[-28] -> 131.57 | AJ25: =RC[-28] -> 48.03 | AK25: =RC[-28] -> 5.63 | AL25: =RC[-28] -> 19.179999999999993 | AM25: =RC[-28] -> 6.42 | AN25: =RC[-28] -> 56.69 | AO25: =RC[-28] -> 67.02 | AP25: - | AQ25: =RC[-29] -> 51.17 | AR25: =RC[-29] -> 56.57 | AS25: - | AT25: =RC[-30] -> 10.449999999999996 | AU25: =RC[-30] -> 5.52 | AV25: =RC[-30] -> 0.88500000000000001 | AW25: =RC[-30] -> 2.96 | AY25: - | AZ25: - | BA25: -
A26: =IF(RC[1]="","",DATEVALUE(RC[1])) -> 43378 | B26: 05.10.18 | C26: 24 | D26: 126.34 | E26: 66.540000000000006 | F26: 7.81 | G26: 119.68 | H26: 46.6 | I26: 5.75 | J26: =RC[-5]-RC[-2] -> 19.940000000000005 | K26: 6.66 | L26: 52.64 | M26: 66.34 | N26: 46.79 | O26: 55.47 | P26: =IF(AND(ISNUMBER(RC[-3]),ISNUMBER(RC[-1])),RC[-3]-RC[-1],"-") -> 10.870000000000005 | Q26: 5.85 | R26: 0.88900000000000001 | S26: 2.8319999999999999 | T26: =(RC[-16]*RC[-15]-RC[-13]*RC[-12])/1000 -> 2.829575600000001 | U26: 51.63 | V26: 46.03 | W26: =RC[-2]*RC[-10]/1000 -> 3.4251342000000005 | X26: =ABS((RC[-3]*RC[-11]-RC[-2]*RC[-9])/1000) -> 0.87185010000000052 | Y26: =(RC[-14]-RC[1])/RC[-18]*100 -> 0.88569518716577578 | Z26: 5.6 | AC26: =VALUE(RC[-27]) -> 2018-10-05T00:00:00.000 | AD26: =IF(RC[21]=42,"*",IF(RC[21]=32,"",RC[21])) -> - | AE26: =RC[-28] -> 24 | AF26: =RC[-28] -> 126.34 | AG26: =RC[-28] -> 66.540000000000006 | AH26: =RC[-28] -> 7.81 | AI26: =RC[-28] -> 119.68 | AJ26: =RC[-28] -> 46.6 | AK26: =RC[-28] -> 5.75 | AL26: =RC[-28] -> 19.940000000000005 | AM26: =RC[-28] -> 6.66 | AN26: =RC[-28] -> 52.64 | AO26: =RC[-28] -> 66.34 | AP26: - | AQ26: =RC[-29] -> 46.79 | AR26: =RC[-29] -> 55.47 | AS26: - | AT26: =RC[-30] -> 10.870000000000005 | AU26: =RC[-30] -> 5.85 | AV26: =RC[-30] -> 0.88900000000000001 | AW26: =RC[-30] -> 2.8319999999999999 | AY26: - | AZ26: - | BA26: -
A27: =IF(RC[1]="","",DATEVALUE(RC[1])) -> 43379 | B27: 06.10.18 | C27: 24 | D27: 127.43 | E27: 67.23 | F27: 7.77 | G27: 120.99 | H27: 47.3 | I27: 5.67 | J27: =RC[-5]-RC[-2] -> 19.930000000000007 | K27: 6.44 | L27: 53.08 | M27: 67.05 | N27: 47.37 | O27: 55.97 | P27: =IF(AND(ISNUMBER(RC[-3]),ISNUMBER(RC[-1])),RC[-3]-RC[-1],"-") -> 11.079999999999998 | Q27: 5.71 | R27: 0.88500000000000001 | S27: 2.847 | T27: =(RC[-16]*RC[-15]-RC[-13]*RC[-12])/1000 -> 2.8442919000000022 | U27: 52.03 | V27: 46.61 | W27: =RC[-2]*RC[-10]/1000 -> 3.4886115000000002 | X27: =ABS((RC[-3]*RC[-11]-RC[-2]*RC[-9])/1000) -> 0.8798497999999999 | Y27: =(RC[-14]-RC[1])/RC[-18]*100 -> 0.84304487974212783 | Z27: 5.42 | AC27: =VALUE(RC[-27]) -> 2018-10-06T00:00:00.000 | AD27: =IF(RC[21]=42,"*",IF(RC[21]=32,"",RC[21])) -> - | AE27: =RC[-28] -> 24 | AF27: =RC[-28] -> 127.43 | AG27: =RC[-28] -> 67.23 | AH27: =RC[-28] -> 7.77 | AI27: =RC[-28] -> 120.99 | AJ27: =RC[-28] -> 47.3 | AK27: =RC[-28] -> 5.67 | AL27: =RC[-28] -> 19.930000000000007 | AM27: =RC[-28] -> 6.44 | AN27: =RC[-28] -> 53.08 | AO27: =RC[-28] -> 67.05 | AP27: - | AQ27: =RC[-29] -> 47.37 | AR27: =RC[-29] -> 55.97 | AS27: - | AT27: =RC[-30] -> 11.079999999999998 | AU27: =RC[-30] -> 5.71 | AV27: =RC[-30] -> 0.88500000000000001 | AW27: =RC[-30] -> 2.847 | AY27: - | AZ27: - | BA27: -
A28: =IF(RC[1]="","",DATEVALUE(RC[1])) -> 43380 | B28: 07.10.18 | C28: 24 | D28: 127.01 | E28: 67.459999999999994 | F28: 7.78 | G28: 120.36 | H28: 47.46 | I28: 5.7 | J28: =RC[-5]-RC[-2] -> 19.999999999999993 | K28: 6.65 | L28: 53.08 | M28: 67.28 | N28: 47.13 | O28: 56.17 | P28: =IF(AND(ISNUMBER(RC[-3]),ISNUMBER(RC[-1])),RC[-3]-RC[-1],"-") -> 11.11 | Q28: 5.95 | R28: 0.90700000000000003 | S28: 2.8580000000000001 | T28: =(RC[-16]*RC[-15]-RC[-13]*RC[-12])/1000 -> 2.8558090000000003 | U28: 52.03 | V28: 46.38 | W28: =RC[-2]*RC[-10]/1000 -> 3.5005784000000002 | X28: =ABS((RC[-3]*RC[-11]-RC[-2]*RC[-9])/1000) -> 0.89541380000000026 | Y28: =(RC[-14]-RC[1])/RC[-18]*100 -> 0.83084081090063144 | Z28: 5.65 | AC28: =VALUE(RC[-27]) -> 2018-10-07T00:00:00.000 | AD28: =IF(RC[21]=42,"*",IF(RC[21]=32,"",RC[21])) -> - | AE28: =RC[-28] -> 24 | AF28: =RC[-28] -> 127.01 | AG28: =RC[-28] -> 67.459999999999994 | AH28: =RC[-28] -> 7.78 | AI28: =RC[-28] -> 120.36 | AJ28: =RC[-28] -> 47.46 | AK28: =RC[-28] -> 5.7 | AL28: =RC[-28] -> 19.999999999999993 | AM28: =RC[-28] -> 6.65 | AN28: =RC[-28] -> 53.08 | AO28: =RC[-28] -> 67.28 | AP28: - | AQ28: =RC[-29] -> 47.13 | AR28: =RC[-29] -> 56.17 | AS28: - | AT28: =RC[-30] -> 11.11 | AU28: =RC[-30] -> 5.95 | AV28: =RC[-30] -> 0.90700000000000003 | AW28: =RC[-30] -> 2.8580000000000001 | AY28: - | AZ28: - | BA28: -
A29: =IF(RC[1]="","",DATEVALUE(RC[1])) -> 43381 | B29: 08.10.18 | C29: 24 | D29: 125.53 | E29: 67.47 | F29: 7.75 | G29: 119.17 | H29: 47.07 | I29: 5.71 | J29: =RC[-5]-RC[-2] -> 20.399999999999999 | K29: 6.36 | L29: 52.37 | M29: 67.290000000000006 | N29: 46.61 | O29: 55.92 | P29: =IF(AND(ISNUMBER(RC[-3]),ISNUMBER(RC[-1])),RC[-3]-RC[-1],"-") -> 11.370000000000005 | Q29: 5.76 | R29: 0.89400000000000002 | S29: 2.863 | T29: =(RC[-16]*RC[-15]-RC[-13]*RC[-12])/1000 -> 2.860177199999999 | U29: 51.31 | V29: 45.86 | W29: =RC[-2]*RC[-10]/1000 -> 3.4526499000000004 | X29: =ABS((RC[-3]*RC[-11]-RC[-2]*RC[-9])/1000) -> 0.88815870000000041 | Y29: =(RC[-14]-RC[1])/RC[-18]*100 -> 0.76361500377611824 | Z29: 5.45 | AC29: =VALUE(RC[-27]) -> 2018-10-08T00:00:00.000 | AD29: =IF(RC[21]=42,"*",IF(RC[21]=32,"",RC[21])) -> - | AE29: =RC[-28] -> 24 | AF29: =RC[-28] -> 125.53 | AG29: =RC[-28] -> 67.47 | AH29: =RC[-28] -> 7.75 | AI29: =RC[-28] -> 119.17 | AJ29: =RC[-28] -> 47.07 | AK29: =RC[-28] -> 5.71 | AL29: =RC[-28] -> 20.399999999999999 | AM29: =RC[-28] -> 6.36 | AN29: =RC[-28] -> 52.37 | AO29: =RC[-28] -> 67.290000000000006 | AP29: - | AQ29: =RC[-29] -> 46.61 | AR29: =RC[-29] -> 55.92 | AS29: - | AT29: =RC[-30] -> 11.370000000000005 | AU29: =RC[-30] -> 5.76 | AV29: =RC[-30] -> 0.89400000000000002 | AW29: =RC[-30] -> 2.863 | AY29: - | AZ29: - | BA29: -
A30: =IF(RC[1]="","",DATEVALUE(RC[1])) -> 43382 | B30: 09.10.18 | C30: 24 | D30: 129.26 | E30: 67.319999999999993 | F30: 7.9 | G30: 123.36 | H30: 47.62 | I30: 5.72 | J30: =RC[-5]-RC[-2] -> 19.699999999999996 | K30: 5.9 | L30: 53.5 | M30: 67.14 | N30: 48.18 | O30: 56.21 | P30: =IF(AND(ISNUMBER(RC[-3]),ISNUMBER(RC[-1])),RC[-3]-RC[-1],"-") -> 10.93 | Q30: 5.32 | R30: 0.86899999999999999 | S30: 2.8290000000000002 | T30: =(RC[-16]*RC[-15]-RC[-13]*RC[-12])/1000 -> 2.8273799999999985 | U30: 52.44 | V30: 47.44 | W30: =RC[-2]*RC[-10]/1000 -> 3.5208215999999997 | X30: =ABS((RC[-3]*RC[-11]-RC[-2]*RC[-9])/1000) -> 0.85421919999999996 | Y30: =(RC[-14]-RC[1])/RC[-18]*100 -> 0.72957198443579796 | Z30: 5 | AC30: =VALUE(RC[-27]) -> 2018-10-09T00:00:00.000 | AD30: =IF(RC[21]=42,"*",IF(RC[21]=32,"",RC[21])) -> - | AE30: =RC[-28] -> 24 | AF30: =RC[-28] -> 129.26 | AG30: =RC[-28] -> 67.319999999999993 | AH30: =RC[-28] -> 7.9 | AI30: =RC[-28] -> 123.36 | AJ30: =RC[-28] -> 47.62 | AK30: =RC[-28] -> 5.72 | AL30: =RC[-28] -> 19.699999999999996 | AM30: =RC[-28] -> 5.9 | AN30: =RC[-28] -> 53.5 | AO30: =RC[-28] -> 67.14 | AP30: - | AQ30: =RC[-29] -> 48.18 | AR30: =RC[-29] -> 56.21 | AS30: - | AT30: =RC[-30] -> 10.93 | AU30: =RC[-30] -> 5.32 | AV30: =RC[-30] -> 0.86899999999999999 | AW30: =RC[-30] -> 2.8290000000000002 | AY30: - | AZ30: - | BA30: -
A31: =IF(RC[1]="","",DATEVALUE(RC[1])) -> 43383 | B31: 10.10.18 | C31: 24 | D31: 129.57 | E31: 68.39 | F31: 7.82 | G31: 123.74 | H31: 48.42 | I31: 5.62 | J31: =RC[-5]-RC[-2] -> 19.97 | K31: 5.83 | L31: 53.65 | M31: 68.2 | N31: 48.34 | O31: 57.09 | P31: =IF(AND(ISNUMBER(RC[-3]),ISNUMBER(RC[-1])),RC[-3]-RC[-1],"-") -> 11.11 | Q31: 5.31 | R31: 0.874 | S31: 2.871 | T31: =(RC[-16]*RC[-15]-RC[-13]*RC[-12])/1000 -> 2.8698014999999995 | U31: 52.53 | V31: 47.62 | W31: =RC[-2]*RC[-10]/1000 -> 3.5825460000000002 | X31: =ABS((RC[-3]*RC[-11]-RC[-2]*RC[-9])/1000) -> 0.86392020000000047 | Y31: =(RC[-14]-RC[1])/RC[-18]*100 -> 0.74349442379182151 | Z31: 4.91 | AC31: =VALUE(RC[-27]) -> 2018-10-10T00:00:00.000 | AD31: =IF(RC[21]=42,"*",IF(RC[21]=32,"",RC[21])) -> - | AE31: =RC[-28] -> 24 | AF31: =RC[-28] -> 129.57 | AG31: =RC[-28] -> 68.39 | AH31: =RC[-28] -> 7.82 | AI31: =RC[-28] -> 123.74 | AJ31: =RC[-28] -> 48.42 | AK31: =RC[-28] -> 5.62 | AL31: =RC[-28] -> 19.97 | AM31: =RC[-28] -> 5.83 | AN31: =RC[-28] -> 53.65 | AO31: =RC[-28] -> 68.2 | AP31: - | AQ31: =RC[-29] -> 48.34 | AR31: =RC[-29] -> 57.09 | AS31: - | AT31: =RC[-30] -> 11.11 | AU31: =RC[-30] -> 5.31 | AV31: =RC[-30] -> 0.874 | AW31: =RC[-30] -> 2.871 | AY31: - | AZ31: - | BA31: -
A32: =IF(RC[1]="","",DATEVALUE(RC[1])) -> 43384 | B32: 11.10.18 | C32: 24 | D32: 132.68 | E32: 69.47 | F32: 7.86 | G32: 127.34 | H32: 49.44 | I32: 5.54 | J32: =RC[-5]-RC[-2] -> 20.03 | K32: 5.34 | L32: 54.64 | M32: 69.28 | N32: 49.76 | O32: 58.1 | P32: =IF(AND(ISNUMBER(RC[-3]),ISNUMBER(RC[-1])),RC[-3]-RC[-1],"-") -> 11.18 | Q32: 4.88 | R32: 0.86899999999999999 | S32: 2.9249999999999998 | T32: =(RC[-16]*RC[-15]-RC[-13]*RC[-12])/1000 -> 2.9215900000000001 | U32: 53.49 | V32: 49.01 | W32: =RC[-2]*RC[-10]/1000 -> 3.7057872000000001 | X32: =ABS((RC[-3]*RC[-11]-RC[-2]*RC[-9])/1000) -> 0.85830620000000046 | Y32: =(RC[-14]-RC[1])/RC[-18]*100 -> 0.6753573111355422 | Z32: 4.4800000000000004 | AC32: =VALUE(RC[-27]) -> 2018-10-11T00:00:00.000 | AD32: =IF(RC[21]=42,"*",IF(RC[21]=32,"",RC[21])) -> - | AE32: =RC[-28] -> 24 | AF32: =RC[-28] -> 132.68 | AG32: =RC[-28] -> 69.47 | AH32: =RC[-28] -> 7.86 | AI32: =RC[-28] -> 127.34 | AJ32: =RC[-28] -> 49.44 | AK32: =RC[-28] -> 5.54 | AL32: =RC[-28] -> 20.03 | AM32: =RC[-28] -> 5.34 | AN32: =RC[-28] -> 54.64 | AO32: =RC[-28] -> 69.28 | AP32: - | AQ32: =RC[-29] -> 49.76 | AR32: =RC[-29] -> 58.1 | AS32: - | AT32: =RC[-30] -> 11.18 | AU32: =RC[-30] -> 4.88 | AV32: =RC[-30] -> 0.86899999999999999 | AW32: =RC[-30] -> 2.9249999999999998 | AY32: - | AZ32: - | BA32: -
A33: =IF(RC[1]="","",DATEVALUE(RC[1])) -> 43385 | B33: 12.10.18 | C33: 24 | D33: 130.91 | E33: 69.31 | F33: 7.86 | G33: 125.89 | H33: 49.25 | I33: 5.58 | J33: =RC[-5]-RC[-2] -> 20.060000000000002 | K33: 5.0199999999999996 | L33: 53.81 | M33: 69.11 | N33: 49.31 | O33: 57.9 | P33: =IF(AND(ISNUMBER(RC[-3]),ISNUMBER(RC[-1])),RC[-3]-RC[-1],"-") -> 11.21 | Q33: 4.5 | R33: 0.84299999999999997 | S33: 2.875 | T33: =(RC[-16]*RC[-15]-RC[-13]*RC[-12])/1000 -> 2.8732896000000001 | U33: 52.68 | V33: 48.53 | W33: =RC[-2]*RC[-10]/1000 -> 3.6407147999999996 | X33: =ABS((RC[-3]*RC[-11]-RC[-2]*RC[-9])/1000) -> 0.83082779999999956 | Y33: =(RC[-14]-RC[1])/RC[-18]*100 -> 0.69107951386130684 | Z33: 4.1500000000000004 | AC33: =VALUE(RC[-27]) -> 2018-10-12T00:00:00.000 | AD33: =IF(RC[21]=42,"*",IF(RC[21]=32,"",RC[21])) -> - | AE33: =RC[-28] -> 24 | AF33: =RC[-28] -> 130.91 | AG33: =RC[-28] -> 69.31 | AH33: =RC[-28] -> 7.86 | AI33: =RC[-28] -> 125.89 | AJ33: =RC[-28] -> 49.25 | AK33: =RC[-28] -> 5.58 | AL33: =RC[-28] -> 20.060000000000002 | AM33: =RC[-28] -> 5.0199999999999996 | AN33: =RC[-28] -> 53.81 | AO33: =RC[-28] -> 69.11 | AP33: - | AQ33: =RC[-29] -> 49.31 | AR33: =RC[-29] -> 57.9 | AS33: - | AT33: =RC[-30] -> 11.21 | AU33: =RC[-30] -> 4.5 | AV33: =RC[-30] -> 0.84299999999999997 | AW33: =RC[-30] -> 2.875 | AY33: - | AZ33: - | BA33: -
A34: =IF(RC[1]="","",DATEVALUE(RC[1])) -> 43386 | B34: 13.10.18 | C34: 24 | D34: 138.34 | E34: 70.47 | F34: 8.0500000000000007 | G34: 131.56 | H34: 50.77 | I34: 5.57 | J34: =RC[-5]-RC[-2] -> 19.699999999999996 | K34: 6.78 | L34: 57.76 | M34: 70.290000000000006 | N34: 51.63 | O34: 59.39 | P34: =IF(AND(ISNUMBER(RC[-3]),ISNUMBER(RC[-1])),RC[-3]-RC[-1],"-") -> 10.900000000000006 | Q34: 6.13 | R34: 0.97299999999999998 | S34: 3.0750000000000002 | T34: =(RC[-16]*RC[-15]-RC[-13]*RC[-12])/1000 -> 3.0695185999999985 | U34: 56.49 | V34: 50.73 | W34: =RC[-2]*RC[-10]/1000 -> 3.9706821000000003 | X34: =ABS((RC[-3]*RC[-11]-RC[-2]*RC[-9])/1000) -> 0.95782740000000055 | Y34: =(RC[-14]-RC[1])/RC[-18]*100 -> 0.77531164487686266 | Z34: 5.76 | AC34: =VALUE(RC[-27]) -> 2018-10-13T00:00:00.000 | AD34: =IF(RC[21]=42,"*",IF(RC[21]=32,"",RC[21])) -> - | AE34: =RC[-28] -> 24 | AF34: =RC[-28] -> 138.34 | AG34: =RC[-28] -> 70.47 | AH34: =RC[-28] -> 8.0500000000000007 | AI34: =RC[-28] -> 131.56 | AJ34: =RC[-28] -> 50.77 | AK34: =RC[-28] -> 5.57 | AL34: =RC[-28] -> 19.699999999999996 | AM34: =RC[-28] -> 6.78 | AN34: =RC[-28] -> 57.76 | AO34: =RC[-28] -> 70.290000000000006 | AP34: - | AQ34: =RC[-29] -> 51.63 | AR34: =RC[-29] -> 59.39 | AS34: - | AT34: =RC[-30] -> 10.900000000000006 | AU34: =RC[-30] -> 6.13 | AV34: =RC[-30] -> 0.97299999999999998 | AW34: =RC[-30] -> 3.0750000000000002 | AY34: - | AZ34: - | BA34: -
A35: =IF(RC[1]="","",DATEVALUE(RC[1])) -> 43387 | B35: 14.10.18 | C35: 24 | D35: 137.83000000000001 | E35: 71.22 | F35: 8.0299999999999994 | G35: 133.25 | H35: 51.59 | I35: 5.48 | J35: =RC[-5]-RC[-2] -> 19.629999999999995 | K35: 4.58 | L35: 56.32 | M35: 71.040000000000006 | N35: 52.37 | O35: 60.03 | P35: =IF(AND(ISNUMBER(RC[-3]),ISNUMBER(RC[-1])),RC[-3]-RC[-1],"-") -> 11.010000000000005 | Q35: 3.95 | R35: 0.85 | S35: 2.9460000000000002 | T35: =(RC[-16]*RC[-15]-RC[-13]*RC[-12])/1000 -> 2.9418851000000013 | U35: 55.08 | V35: 51.39 | W35: =RC[-2]*RC[-10]/1000 -> 3.9128832 | X35: =ABS((RC[-3]*RC[-11]-RC[-2]*RC[-9])/1000) -> 0.82794149999999989 | Y35: =(RC[-14]-RC[1])/RC[-18]*100 -> 0.66791744840525336 | Z35: 3.69 | AC35: =VALUE(RC[-27]) -> 2018-10-14T00:00:00.000 | AD35: =IF(RC[21]=42,"*",IF(RC[21]=32,"",RC[21])) -> - | AE35: =RC[-28] -> 24 | AF35: =RC[-28] -> 137.83000000000001 | AG35: =RC[-28] -> 71.22 | AH35: =RC[-28] -> 8.0299999999999994 | AI35: =RC[-28] -> 133.25 | AJ35: =RC[-28] -> 51.59 | AK35: =RC[-28] -> 5.48 | AL35: =RC[-28] -> 19.629999999999995 | AM35: =RC[-28] -> 4.58 | AN35: =RC[-28] -> 56.32 | AO35: =RC[-28] -> 71.040000000000006 | AP35: - | AQ35: =RC[-29] -> 52.37 | AR35: =RC[-29] -> 60.03 | AS35: - | AT35: =RC[-30] -> 11.010000000000005 | AU35: =RC[-30] -> 3.95 | AV35: =RC[-30] -> 0.85 | AW35: =RC[-30] -> 2.9460000000000002 | AY35: - | AZ35: - | BA35: -
A36: =IF(RC[1]="","",DATEVALUE(RC[1])) -> 43388 | B36: 15.10.18 | C36: 24 | D36: 141.21 | E36: 70.64 | F36: 8.14 | G36: 136.69999999999999 | H36: 51.77 | I36: 5.46 | J36: =RC[-5]-RC[-2] -> 18.869999999999997 | K36: 4.51 | L36: 57.57 | M36: 70.45 | N36: 53.74 | O36: 59.86 | P36: =IF(AND(ISNUMBER(RC[-3]),ISNUMBER(RC[-1])),RC[-3]-RC[-1],"-") -> 10.590000000000003 | Q36: 3.83 | R36: 0.83199999999999996 | S36: 2.903 | T36: =(RC[-16]*RC[-15]-RC[-13]*RC[-12])/1000 -> 2.8981154000000013 | U36: 56.29 | V36: 52.78 | W36: =RC[-2]*RC[-10]/1000 -> 3.9656305000000001 | X36: =ABS((RC[-3]*RC[-11]-RC[-2]*RC[-9])/1000) -> 0.80621970000000009 | Y36: =(RC[-14]-RC[1])/RC[-18]*100 -> 0.73152889539136801 | Z36: 3.51 | AC36: =VALUE(RC[-27]) -> 2018-10-15T00:00:00.000 | AD36: =IF(RC[21]=42,"*",IF(RC[21]=32,"",RC[21])) -> - | AE36: =RC[-28] -> 24 | AF36: =RC[-28] -> 141.21 | AG36: =RC[-28] -> 70.64 | AH36: =RC[-28] -> 8.14 | AI36: =RC[-28] -> 136.69999999999999 | AJ36: =RC[-28] -> 51.77 | AK36: =RC[-28] -> 5.46 | AL36: =RC[-28] -> 18.869999999999997 | AM36: =RC[-28] -> 4.51 | AN36: =RC[-28] -> 57.57 | AO36: =RC[-28] -> 70.45 | AP36: - | AQ36: =RC[-29] -> 53.74 | AR36: =RC[-29] -> 59.86 | AS36: - | AT36: =RC[-30] -> 10.590000000000003 | AU36: =RC[-30] -> 3.83 | AV36: =RC[-30] -> 0.83199999999999996 | AW36: =RC[-30] -> 2.903 | AY36: - | AZ36: - | BA36: -
A37: =IF(RC[1]="","",DATEVALUE(RC[1])) -> 43389 | B37: 16.10.18 | C37: 24 | D37: 142.33000000000001 | E37: 70.599999999999994 | F37: 8.11 | G37: 137.35 | H37: 51.84 | I37: 5.4 | J37: =RC[-5]-RC[-2] -> 18.759999999999991 | K37: 4.9800000000000004 | L37: 58.34 | M37: 70.42 | N37: 54 | O37: 59.92 | P37: =IF(AND(ISNUMBER(RC[-3]),ISNUMBER(RC[-1])),RC[-3]-RC[-1],"-") -> 10.5 | Q37: 4.34 | R37: 0.86399999999999999 | S37: 2.9329999999999998 | T37: =(RC[-16]*RC[-15]-RC[-13]*RC[-12])/1000 -> 2.9282739999999996 | U37: 57.06 | V37: 53.02 | W37: =RC[-2]*RC[-10]/1000 -> 4.0181652000000003 | X37: =ABS((RC[-3]*RC[-11]-RC[-2]*RC[-9])/1000) -> 0.84120679999999992 | Y37: =(RC[-14]-RC[1])/RC[-18]*100 -> 0.68438296323261771 | Z37: 4.04 | AC37: =VALUE(RC[-27]) -> 2018-10-16T00:00:00.000 | AD37: =IF(RC[21]=42,"*",IF(RC[21]=32,"",RC[21])) -> - | AE37: =RC[-28] -> 24 | AF37: =RC[-28] -> 142.33000000000001 | AG37: =RC[-28] -> 70.599999999999994 | AH37: =RC[-28] -> 8.11 | AI37: =RC[-28] -> 137.35 | AJ37: =RC[-28] -> 51.84 | AK37: =RC[-28] -> 5.4 | AL37: =RC[-28] -> 18.759999999999991 | AM37: =RC[-28] -> 4.9800000000000004 | AN37: =RC[-28] -> 58.34 | AO37: =RC[-28] -> 70.42 | AP37: - | AQ37: =RC[-29] -> 54 | AR37: =RC[-29] -> 59.92 | AS37: - | AT37: =RC[-30] -> 10.5 | AU37: =RC[-30] -> 4.34 | AV37: =RC[-30] -> 0.86399999999999999 | AW37: =RC[-30] -> 2.9329999999999998 | AY37: - | AZ37: - | BA37: -
A38: =IF(RC[1]="","",DATEVALUE(RC[1])) -> 43390 | B38: 17.10.18 | C38: 24 | D38: 144.38 | E38: 70.89 | F38: 8.19 | G38: 139.85 | H38: 52.26 | I38: 5.38 | J38: =RC[-5]-RC[-2] -> 18.630000000000003 | K38: 4.53 | L38: 58.84 | M38: 70.709999999999994 | N38: 55.01 | O38: 60.29 | P38: =IF(AND(ISNUMBER(RC[-3]),ISNUMBER(RC[-1])),RC[-3]-RC[-1],"-") -> 10.419999999999995 | Q38: 3.8300000000000098 | R38: 0.82899999999999996 | S38: 2.9359999999999999 | T38: =(RC[-16]*RC[-15]-RC[-13]*RC[-12])/1000 -> 2.9265372000000007 | U38: 57.51 | V38: 54.03 | W38: =RC[-2]*RC[-10]/1000 -> 4.0665320999999999 | X38: =ABS((RC[-3]*RC[-11]-RC[-2]*RC[-9])/1000) -> 0.80906339999999954 | Y38: =(RC[-14]-RC[1])/RC[-18]*100 -> 0.750804433321416 | Z38: 3.48 | AC38: =VALUE(RC[-27]) -> 2018-10-17T00:00:00.000 | AD38: =IF(RC[21]=42,"*",IF(RC[21]=32,"",RC[21])) -> - | AE38: =RC[-28] -> 24 | AF38: =RC[-28] -> 144.38 | AG38: =RC[-28] -> 70.89 | AH38: =RC[-28] -> 8.19 | AI38: =RC[-28] -> 139.85 | AJ38: =RC[-28] -> 52.26 | AK38: =RC[-28] -> 5.38 | AL38: =RC[-28] -> 18.630000000000003 | AM38: =RC[-28] -> 4.53 | AN38: =RC[-28] -> 58.84 | AO38: =RC[-28] -> 70.709999999999994 | AP38: - | AQ38: =RC[-29] -> 55.01 | AR38: =RC[-29] -> 60.29 | AS38: - | AT38: =RC[-30] -> 10.419999999999995 | AU38: =RC[-30] -> 3.8300000000000098 | AV38: =RC[-30] -> 0.82899999999999996 | AW38: =RC[-30] -> 2.9359999999999999 | AY38: - | AZ38: - | BA38: -
A39: =IF(RC[1]="","",DATEVALUE(RC[1])) -> 43391 | B39: 18.10.18 | C39: 24 | D39: 143.78 | E39: 71.33 | F39: 8.2100000000000009 | G39: 139.52000000000001 | H39: 52.69 | I39: 5.43 | J39: =RC[-5]-RC[-2] -> 18.64 | K39: 4.26 | L39: 58.59 | M39: 71.150000000000006 | N39: 54.91 | O39: 60.67 | P39: =IF(AND(ISNUMBER(RC[-3]),ISNUMBER(RC[-1])),RC[-3]-RC[-1],"-") -> 10.480000000000004 | Q39: 3.6800000000000099 | R39: 0.82299999999999995 | S39: 2.9079999999999999 | T39: =(RC[-16]*RC[-15]-RC[-13]*RC[-12])/1000 -> 2.9045186000000003 | U39: 57.28 | V39: 53.9 | W39: =RC[-2]*RC[-10]/1000 -> 4.0754720000000004 | X39: =ABS((RC[-3]*RC[-11]-RC[-2]*RC[-9])/1000) -> 0.80535900000000038 | Y39: =(RC[-14]-RC[1])/RC[-18]*100 -> 0.63073394495412827 | Z39: 3.38 | AC39: =VALUE(RC[-27]) -> 2018-10-18T00:00:00.000 | AD39: =IF(RC[21]=42,"*",IF(RC[21]=32,"",RC[21])) -> - | AE39: =RC[-28] -> 24 | AF39: =RC[-28] -> 143.78 | AG39: =RC[-28] -> 71.33 | AH39: =RC[-28] -> 8.2100000000000009 | AI39: =RC[-28] -> 139.52000000000001 | AJ39: =RC[-28] -> 52.69 | AK39: =RC[-28] -> 5.43 | AL39: =RC[-28] -> 18.64 | AM39: =RC[-28] -> 4.26 | AN39: =RC[-28] -> 58.59 | AO39: =RC[-28] -> 71.150000000000006 | AP39: - | AQ39: =RC[-29] -> 54.91 | AR39: =RC[-29] -> 60.67 | AS39: - | AT39: =RC[-30] -> 10.480000000000004 | AU39: =RC[-30] -> 3.6800000000000099 | AV39: =RC[-30] -> 0.82299999999999995 | AW39: =RC[-30] -> 2.9079999999999999 | AY39: - | AZ39: - | BA39: -
A40: =IF(RC[1]="","",DATEVALUE(RC[1])) -> 43392 | B40: 19.10.18 | C40: 24 | D40: 144.15 | E40: 71.180000000000007 | F40: 8.2100000000000009 | G40: 139.29 | H40: 52.36 | I40: 5.43 | J40: =RC[-5]-RC[-2] -> 18.820000000000007 | K40: 4.8600000000000003 | L40: 59.05 | M40: 70.989999999999995 | N40: 54.71 | O40: 60.45 | P40: =IF(AND(ISNUMBER(RC[-3]),ISNUMBER(RC[-1])),RC[-3]-RC[-1],"-") -> 10.539999999999992 | Q40: 4.34 | R40: 0.86499999999999999 | S40: 2.9710000000000001 | T40: =(RC[-16]*RC[-15]-RC[-13]*RC[-12])/1000 -> 2.9673726000000022 | U40: 57.71 | V40: 53.75 | W40: =RC[-2]*RC[-10]/1000 -> 4.096832899999999 | X40: =ABS((RC[-3]*RC[-11]-RC[-2]*RC[-9])/1000) -> 0.84764539999999944 | Y40: =(RC[-14]-RC[1])/RC[-18]*100 -> 0.6461339651087662 | Z40: 3.96 | AC40: =VALUE(RC[-27]) -> 2018-10-19T00:00:00.000 | AD40: =IF(RC[21]=42,"*",IF(RC[21]=32,"",RC[21])) -> - | AE40: =RC[-28] -> 24 | AF40: =RC[-28] -> 144.15 | AG40: =RC[-28] -> 71.180000000000007 | AH40: =RC[-28] -> 8.2100000000000009 | AI40: =RC[-28] -> 139.29 | AJ40: =RC[-28] -> 52.36 | AK40: =RC[-28] -> 5.43 | AL40: =RC[-28] -> 18.820000000000007 | AM40: =RC[-28] -> 4.8600000000000003 | AN40: =RC[-28] -> 59.05 | AO40: =RC[-28] -> 70.989999999999995 | AP40: - | AQ40: =RC[-29] -> 54.71 | AR40: =RC[-29] -> 60.45 | AS40: - | AT40: =RC[-30] -> 10.539999999999992 | AU40: =RC[-30] -> 4.34 | AV40: =RC[-30] -> 0.86499999999999999 | AW40: =RC[-30] -> 2.9710000000000001 | AY40: - | AZ40: - | BA40: -
A41: =IF(RC[1]="","",DATEVALUE(RC[1])) -> 43393 | B41: 20.10.18 | C41: 24 | D41: 138.76 | E41: 70.39 | F41: 8.06 | G41: 133.5 | H41: 51.3 | I41: 5.5 | J41: =RC[-5]-RC[-2] -> 19.090000000000003 | K41: 5.26 | L41: 57.19 | M41: 70.22 | N41: 52.31 | O41: 59.53 | P41: =IF(AND(ISNUMBER(RC[-3]),ISNUMBER(RC[-1])),RC[-3]-RC[-1],"-") -> 10.689999999999998 | Q41: 4.88 | R41: 0.88900000000000001 | S41: 2.9209999999999998 | T41: =(RC[-16]*RC[-15]-RC[-13]*RC[-12])/1000 -> 2.9187664000000004 | U41: 55.93 | V41: 51.39 | W41: =RC[-2]*RC[-10]/1000 -> 3.9274046 | X41: =ABS((RC[-3]*RC[-11]-RC[-2]*RC[-9])/1000) -> 0.8681578999999997 | Y41: =(RC[-14]-RC[1])/RC[-18]*100 -> 0.53932584269662898 | Z41: 4.54 | AC41: =VALUE(RC[-27]) -> 2018-10-20T00:00:00.000 | AD41: =IF(RC[21]=42,"*",IF(RC[21]=32,"",RC[21])) -> - | AE41: =RC[-28] -> 24 | AF41: =RC[-28] -> 138.76 | AG41: =RC[-28] -> 70.39 | AH41: =RC[-28] -> 8.06 | AI41: =RC[-28] -> 133.5 | AJ41: =RC[-28] -> 51.3 | AK41: =RC[-28] -> 5.5 | AL41: =RC[-28] -> 19.090000000000003 | AM41: =RC[-28] -> 5.26 | AN41: =RC[-28] -> 57.19 | AO41: =RC[-28] -> 70.22 | AP41: - | AQ41: =RC[-29] -> 52.31 | AR41: =RC[-29] -> 59.53 | AS41: - | AT41: =RC[-30] -> 10.689999999999998 | AU41: =RC[-30] -> 4.88 | AV41: =RC[-30] -> 0.88900000000000001 | AW41: =RC[-30] -> 2.9209999999999998 | AY41: - | AZ41: - | BA41: -
A42: =IF(RC[1]="","",DATEVALUE(RC[1])) -> 43394 | B42: 21.10.18 | C42: 24 | D42: 138.87 | E42: 69.58 | F42: 8.06 | G42: 133.01 | H42: 50.81 | I42: 5.53 | J42: =RC[-5]-RC[-2] -> 18.769999999999996 | K42: 5.86 | L42: 57.6 | M42: 69.39 | N42: 51.99 | O42: 58.93 | P42: =IF(AND(ISNUMBER(RC[-3]),ISNUMBER(RC[-1])),RC[-3]-RC[-1],"-") -> 10.46 | Q42: 5.61 | R42: 0.91300000000000003 | S42: 2.9089999999999998 | T42: =(RC[-16]*RC[-15]-RC[-13]*RC[-12])/1000 -> 2.9043365000000003 | U42: 56.41 | V42: 51.05 | W42: =RC[-2]*RC[-10]/1000 -> 3.9142898999999995 | X42: =ABS((RC[-3]*RC[-11]-RC[-2]*RC[-9])/1000) -> 0.90591339999999987 | Y42: =(RC[-14]-RC[1])/RC[-18]*100 -> 0.37591158559506804 | Z42: 5.36 | AC42: =VALUE(RC[-27]) -> 2018-10-21T00:00:00.000 | AD42: =IF(RC[21]=42,"*",IF(RC[21]=32,"",RC[21])) -> - | AE42: =RC[-28] -> 24 | AF42: =RC[-28] -> 138.87 | AG42: =RC[-28] -> 69.58 | AH42: =RC[-28] -> 8.06 | AI42: =RC[-28] -> 133.01 | AJ42: =RC[-28] -> 50.81 | AK42: =RC[-28] -> 5.53 | AL42: =RC[-28] -> 18.769999999999996 | AM42: =RC[-28] -> 5.86 | AN42: =RC[-28] -> 57.6 | AO42: =RC[-28] -> 69.39 | AP42: - | AQ42: =RC[-29] -> 51.99 | AR42: =RC[-29] -> 58.93 | AS42: - | AT42: =RC[-30] -> 10.46 | AU42: =RC[-30] -> 5.61 | AV42: =RC[-30] -> 0.91300000000000003 | AW42: =RC[-30] -> 2.9089999999999998 | AY42: - | AZ42: - | BA42: -
A43: =IF(RC[1]="","",DATEVALUE(RC[1])) -> 43395 | B43: 22.10.18 | C43: 24 | D43: 137.04 | E43: 70.11 | F43: 8.0399999999999991 | G43: 131.66999999999999 | H43: 50.76 | I43: 5.55 | J43: =RC[-5]-RC[-2] -> 19.350000000000001 | K43: 5.37 | L43: 56.65 | M43: 69.930000000000007 | N43: 51.46 | O43: 59.13 | P43: =IF(AND(ISNUMBER(RC[-3]),ISNUMBER(RC[-1])),RC[-3]-RC[-1],"-") -> 10.800000000000004 | Q43: 5.19 | R43: 0.89 | S43: 2.931 | T43: =(RC[-16]*RC[-15]-RC[-13]*RC[-12])/1000 -> 2.9243051999999996 | U43: 55.39 | V43: 50.65 | W43: =RC[-2]*RC[-10]/1000 -> 3.8734227000000003 | X43: =ABS((RC[-3]*RC[-11]-RC[-2]*RC[-9])/1000) -> 0.87848820000000072 | Y43: =(RC[-14]-RC[1])/RC[-18]*100 -> 0.4784688995215311 | Z43: 4.74 | AC43: =VALUE(RC[-27]) -> 2018-10-22T00:00:00.000 | AD43: =IF(RC[21]=42,"*",IF(RC[21]=32,"",RC[21])) -> - | AE43: =RC[-28] -> 24 | AF43: =RC[-28] -> 137.04 | AG43: =RC[-28] -> 70.11 | AH43: =RC[-28] -> 8.0399999999999991 | AI43: =RC[-28] -> 131.66999999999999 | AJ43: =RC[-28] -> 50.76 | AK43: =RC[-28] -> 5.55 | AL43: =RC[-28] -> 19.350000000000001 | AM43: =RC[-28] -> 5.37 | AN43: =RC[-28] -> 56.65 | AO43: =RC[-28] -> 69.930000000000007 | AP43: - | AQ43: =RC[-29] -> 51.46 | AR43: =RC[-29] -> 59.13 | AS43: - | AT43: =RC[-30] -> 10.800000000000004 | AU43: =RC[-30] -> 5.19 | AV43: =RC[-30] -> 0.89 | AW43: =RC[-30] -> 2.931 | AY43: - | AZ43: - | BA43: -
A44: =IF(RC[1]="","",DATEVALUE(RC[1])) ->  | C44: 24 | J44: =RC[-5]-RC[-2] -> #VALUE! | P44: =IF(AND(ISNUMBER(RC[-3]),ISNUMBER(RC[-1])),RC[-3]-RC[-1],"-") -> - | T44: =(RC[-16]*RC[-15]-RC[-13]*RC[-12])/1000 -> #VALUE! | W44: =RC[-2]*RC[-10]/1000 -> #VALUE! | X44: =ABS((RC[-3]*RC[-11]-RC[-2]*RC[-9])/1000) -> #VALUE! | Y44: =(RC[-14]-RC[1])/RC[-18]*100 -> #VALUE! | AC44: =VALUE(RC[-27]) -> #VALUE! | AD44: =IF(RC[21]=42,"*",IF(RC[21]=32,"",RC[21])) ->  | AE44: =RC[-28] -> 24 | AF44: =RC[-28] ->  | AG44: =RC[-28] ->  | AH44: =RC[-28] ->  | AI44: =RC[-28] ->  | AJ44: =RC[-28] ->  | AK44: =RC[-28] ->  | AL44: =RC[-28] -> #VALUE! | AM44: =RC[-28] ->  | AN44: =RC[-28] ->  | AO44: =RC[-28] ->  | AP44: - | AQ44: =RC[-29] ->  | AR44: =RC[-29] ->  | AS44: - | AT44: =RC[-30] -> - | AU44: =RC[-30] ->  | AV44: =RC[-30] ->  | AW44: =RC[-30] -> 
A45: =IF(RC[1]="","",DATEVALUE(RC[1])) ->  | C45: 24 | P45: =IF(AND(ISNUMBER(RC[-3]),ISNUMBER(RC[-1])),RC[-3]-RC[-1],"-") -> - | T45: =(RC[-16]*RC[-15]-RC[-13]*RC[-12])/1000 -> #VALUE! | W45: =RC[-2]*RC[-10]/1000 -> #VALUE! | X45: =ABS((RC[-3]*RC[-11]-RC[-2]*RC[-9])/1000) -> #VALUE! | Y45: =(RC[-14]-RC[1])/RC[-18]*100 -> #VALUE! | AC45: =VALUE(RC[-27]) -> #VALUE! | AD45: =IF(RC[21]=42,"*",IF(RC[21]=32,"",RC[21])) ->  | AE45: =RC[-28] -> 24 | AF45: =RC[-28] ->  | AG45: =RC[-28] ->  | AH45: =RC[-28] ->  | AI45: =RC[-28] ->  | AJ45: =RC[-28] ->  | AK45: =RC[-28] ->  | AL45: =RC[-28] -> 0 | AM45: =RC[-28] ->  | AN45: =RC[-28] ->  | AO45: =RC[-28] ->  | AP45: - | AQ45: =RC[-29] ->  | AR45: =RC[-29] ->  | AS45: - | AT45: =RC[-30] -> - | AU45: =RC[-30] ->  | AV45: =RC[-30] ->  | AW45: =RC[-30] -> 
A46: =IF(RC[1]="","",DATEVALUE(RC[1])) ->  | C46: 24 | P46: =IF(AND(ISNUMBER(RC[-3]),ISNUMBER(RC[-1])),RC[-3]-RC[-1],"-") -> - | T46: =(RC[-16]*RC[-15]-RC[-13]*RC[-12])/1000 -> #VALUE! | W46: =RC[-2]*RC[-10]/1000 -> #VALUE! | X46: =ABS((RC[-3]*RC[-11]-RC[-2]*RC[-9])/1000) -> #VALUE! | Y46: =(RC[-14]-RC[1])/RC[-18]*100 -> #VALUE! | AC46: =VALUE(RC[-27]) -> #VALUE! | AD46: =IF(RC[21]=42,"*",IF(RC[21]=32,"",RC[21])) ->  | AE46: =RC[-28] -> 24 | AF46: =RC[-28] ->  | AG46: =RC[-28] ->  | AH46: =RC[-28] ->  | AI46: =RC[-28] ->  | AJ46: =RC[-28] ->  | AK46: =RC[-28] ->  | AL46: =RC[-28] -> 0 | AM46: =RC[-28] ->  | AN46: =RC[-28] ->  | AO46: =RC[-28] ->  | AP46: - | AQ46: =RC[-29] ->  | AR46: =RC[-29] ->  | AS46: - | AT46: =RC[-30] -> - | AU46: =RC[-30] ->  | AV46: =RC[-30] ->  | AW46: =RC[-30] -> 
A47: =IF(RC[1]="","",DATEVALUE(RC[1])) ->  | C47: 24 | P47: =IF(AND(ISNUMBER(RC[-3]),ISNUMBER(RC[-1])),RC[-3]-RC[-1],"-") -> - | T47: =(RC[-16]*RC[-15]-RC[-13]*RC[-12])/1000 -> #VALUE! | W47: =RC[-2]*RC[-10]/1000 -> #VALUE! | X47: =ABS((RC[-3]*RC[-11]-RC[-2]*RC[-9])/1000) -> #VALUE! | Y47: =(RC[-14]-RC[1])/RC[-18]*100 -> #VALUE! | AC47: =VALUE(RC[-27]) -> #VALUE! | AD47: =IF(RC[21]=42,"*",IF(RC[21]=32,"",RC[21])) ->  | AE47: =RC[-28] -> 24 | AF47: =RC[-28] ->  | AG47: =RC[-28] ->  | AH47: =RC[-28] ->  | AI47: =RC[-28] ->  | AJ47: =RC[-28] ->  | AK47: =RC[-28] ->  | AL47: =RC[-28] -> 0 | AM47: =RC[-28] ->  | AN47: =RC[-28] ->  | AO47: =RC[-28] ->  | AP47: - | AQ47: =RC[-29] ->  | AR47: =RC[-29] ->  | AS47: - | AT47: =RC[-30] -> - | AU47: =RC[-30] ->  | AV47: =RC[-30] ->  | AW47: =RC[-30] -> 
A48: =IF(RC[1]="","",DATEVALUE(RC[1])) ->  | C48: 24 | P48: =IF(AND(ISNUMBER(RC[-3]),ISNUMBER(RC[-1])),RC[-3]-RC[-1],"-") -> - | T48: =(RC[-16]*RC[-15]-RC[-13]*RC[-12])/1000 -> #VALUE! | W48: =RC[-2]*RC[-10]/1000 -> #VALUE! | X48: =ABS((RC[-3]*RC[-11]-RC[-2]*RC[-9])/1000) -> #VALUE! | Y48: =(RC[-14]-RC[1])/RC[-18]*100 -> #VALUE! | AC48: =VALUE(RC[-27]) -> #VALUE! | AD48: =IF(RC[21]=42,"*",IF(RC[21]=32,"",RC[21])) ->  | AE48: =RC[-28] -> 24 | AF48: =RC[-28] ->  | AG48: =RC[-28] ->  | AH48: =RC[-28] ->  | AI48: =RC[-28] ->  | AJ48: =RC[-28] ->  | AK48: =RC[-28] ->  | AL48: =RC[-28] -> 0 | AM48: =RC[-28] ->  | AN48: =RC[-28] ->  | AO48: =RC[-28] ->  | AP48: - | AQ48: =RC[-29] ->  | AR48: =RC[-29] ->  | AS48: - | AT48: =RC[-30] -> - | AU48: =RC[-30] ->  | AV48: =RC[-30] ->  | AW48: =RC[-30] -> 
A49: =IF(RC[1]="","",DATEVALUE(RC[1])) ->  | C49: 24 | P49: =IF(AND(ISNUMBER(RC[-3]),ISNUMBER(RC[-1])),RC[-3]-RC[-1],"-") -> - | T49: =(RC[-16]*RC[-15]-RC[-13]*RC[-12])/1000 -> #VALUE! | W49: =RC[-2]*RC[-10]/1000 -> #VALUE! | X49: =ABS((RC[-3]*RC[-11]-RC[-2]*RC[-9])/1000) -> #VALUE! | Y49: =(RC[-14]-RC[1])/RC[-18]*100 -> #VALUE! | AC49: =VALUE(RC[-27]) -> #VALUE! | AD49: =IF(RC[21]=42,"*",IF(RC[21]=32,"",RC[21])) ->  | AE49: =RC[-28] -> 24 | AF49: =RC[-28] ->  | AG49: =RC[-28] ->  | AH49: =RC[-28] ->  | AI49: =RC[-28] ->  | AJ49: =RC[-28] ->  | AK49: =RC[-28] ->  | AL49: =RC[-28] -> 0 | AM49: =RC[-28] ->  | AN49: =RC[-28] ->  | AO49: =RC[-28] ->  | AP49: - | AQ49: =RC[-29] ->  | AR49: =RC[-29] ->  | AS49: - | AT49: =RC[-30] -> - | AU49: =RC[-30] ->  | AV49: =RC[-30] ->  | AW49: =RC[-30] -> 
A50: =IF(RC[1]="","",DATEVALUE(RC[1])) ->  | P50: =IF(AND(ISNUMBER(RC[-3]),ISNUMBER(RC[-1])),RC[-3]-RC[-1],"-") -> - | T50: =(RC[-16]*RC[-15]-RC[-13]*RC[-12])/1000 -> #VALUE! | W50: =RC[-2]*RC[-10]/1000 -> #VALUE! | X50: =ABS((RC[-3]*RC[-11]-RC[-2]*RC[-9])/1000) -> #VALUE! | Y50: =(RC[-14]-RC[1])/RC[-18]*100 -> #VALUE! | AC50: =VALUE(RC[-27]) -> #VALUE! | AD50: =IF(RC[21]=42,"*",IF(RC[21]=32,"",RC[21])) ->  | AE50: =RC[-28] ->  | AF50: =RC[-28] ->  | AG50: =RC[-28] ->  | AH50: =RC[-28] ->  | AI50: =RC[-28] ->  | AJ50: =RC[-28] ->  | AK50: =RC[-28] ->  | AL50: =RC[-28] -> 0 | AM50: =RC[-28] ->  | AN50: =RC[-28] ->  | AO50: =RC[-28] ->  | AP50: - | AQ50: =RC[-29] ->  | AR50: =RC[-29] ->  | AS50: - | AT50: =RC[-30] -> - | AU50: =RC[-30] ->  | AV50: =RC[-30] ->  | AW50: =RC[-30] -> 
A51: =IF(RC[1]="","",DATEVALUE(RC[1])) ->  | P51: =IF(AND(ISNUMBER(RC[-3]),ISNUMBER(RC[-1])),RC[-3]-RC[-1],"-") -> - | T51: =(RC[-16]*RC[-15]-RC[-13]*RC[-12])/1000 -> #VALUE! | W51: =RC[-2]*RC[-10]/1000 -> #VALUE! | X51: =ABS((RC[-3]*RC[-11]-RC[-2]*RC[-9])/1000) -> #VALUE! | Y51: =(RC[-14]-RC[1])/RC[-18]*100 -> #VALUE! | AC51: =VALUE(RC[-27]) -> #VALUE! | AD51: =IF(RC[21]=42,"*",IF(RC[21]=32,"",RC[21])) ->  | AE51: =RC[-28] ->  | AF51: =RC[-28] ->  | AG51: =RC[-28] ->  | AH51: =RC[-28] ->  | AI51: =RC[-28] ->  | AJ51: =RC[-28] ->  | AK51: =RC[-28] ->  | AL51: =RC[-28] -> 0 | AM51: =RC[-28] ->  | AN51: =RC[-28] ->  | AO51: =RC[-28] ->  | AP51: - | AQ51: =RC[-29] ->  | AR51: =RC[-29] ->  | AS51: - | AT51: =RC[-30] -> - | AU51: =RC[-30] ->  | AV51: =RC[-30] ->  | AW51: =RC[-30] -> 
A52: =IF(RC[1]="","",DATEVALUE(RC[1])) ->  | P52: =IF(AND(ISNUMBER(RC[-3]),ISNUMBER(RC[-1])),RC[-3]-RC[-1],"-") -> - | T52: =(RC[-16]*RC[-15]-RC[-13]*RC[-12])/1000 -> #VALUE! | W52: =RC[-2]*RC[-10]/1000 -> #VALUE! | X52: =ABS((RC[-3]*RC[-11]-RC[-2]*RC[-9])/1000) -> #VALUE! | Y52: =(RC[-14]-RC[1])/RC[-18]*100 -> #VALUE! | AC52: =VALUE(RC[-27]) -> #VALUE! | AD52: =IF(RC[21]=42,"*",IF(RC[21]=32,"",RC[21])) ->  | AE52: =RC[-28] ->  | AF52: =RC[-28] ->  | AG52: =RC[-28] ->  | AH52: =RC[-28] ->  | AI52: =RC[-28] ->  | AJ52: =RC[-28] ->  | AK52: =RC[-28] ->  | AL52: =RC[-28] -> 0 | AM52: =RC[-28] ->  | AN52: =RC[-28] ->  | AO52: =RC[-28] ->  | AP52: - | AQ52: =RC[-29] ->  | AR52: =RC[-29] ->  | AS52: - | AT52: =RC[-30] -> - | AU52: =RC[-30] ->  | AV52: =RC[-30] ->  | AW52: =RC[-30] -> 
A53: =IF(RC[1]="","",DATEVALUE(RC[1])) ->  | P53: =IF(AND(ISNUMBER(RC[-3]),ISNUMBER(RC[-1])),RC[-3]-RC[-1],"-") -> - | T53: =(RC[-16]*RC[-15]-RC[-13]*RC[-12])/1000 -> #VALUE! | W53: =RC[-2]*RC[-10]/1000 -> #VALUE! | X53: =ABS((RC[-3]*RC[-11]-RC[-2]*RC[-9])/1000) -> #VALUE! | Y53: =(RC[-14]-RC[1])/RC[-18]*100 -> #VALUE! | AC53: =VALUE(RC[-27]) -> #VALUE! | AD53: =IF(RC[21]=42,"*",IF(RC[21]=32,"",RC[21])) ->  | AE53: =RC[-28] ->  | AF53: =RC[-28] ->  | AG53: =RC[-28] ->  | AH53: =RC[-28] ->  | AI53: =RC[-28] ->  | AJ53: =RC[-28] ->  | AK53: =RC[-28] ->  | AL53: =RC[-28] -> 0 | AM53: =RC[-28] ->  | AN53: =RC[-28] ->  | AO53: =RC[-28] ->  | AP53: - | AQ53: =RC[-29] ->  | AR53: =RC[-29] ->  | AS53: - | AT53: =RC[-30] -> - | AU53: =RC[-30] ->  | AV53: =RC[-30] ->  | AW53: =RC[-30] -> 
A54: =IF(RC[1]="","",DATEVALUE(RC[1])) ->  | P54: =IF(AND(ISNUMBER(RC[-3]),ISNUMBER(RC[-1])),RC[-3]-RC[-1],"-") -> - | T54: =(RC[-16]*RC[-15]-RC[-13]*RC[-12])/1000 -> #VALUE! | W54: =RC[-2]*RC[-10]/1000 -> #VALUE! | X54: =ABS((RC[-3]*RC[-11]-RC[-2]*RC[-9])/1000) -> #VALUE! | Y54: =(RC[-14]-RC[1])/RC[-18]*100 -> #VALUE! | AC54: =VALUE(RC[-27]) -> #VALUE! | AD54: =IF(RC[21]=42,"*",IF(RC[21]=32,"",RC[21])) ->  | AE54: =RC[-28] ->  | AF54: =RC[-28] ->  | AG54: =RC[-28] ->  | AH54: =RC[-28] ->  | AI54: =RC[-28] ->  | AJ54: =RC[-28] ->  | AK54: =RC[-28] ->  | AL54: =RC[-28] -> 0 | AM54: =RC[-28] ->  | AN54: =RC[-28] ->  | AO54: =RC[-28] ->  | AP54: - | AQ54: =RC[-29] ->  | AR54: =RC[-29] ->  | AS54: - | AT54: =RC[-30] -> - | AU54: =RC[-30] ->  | AV54: =RC[-30] ->  | AW54: =RC[-30] -> 
A55: =IF(RC[1]="","",DATEVALUE(RC[1])) ->  | P55: =IF(AND(ISNUMBER(RC[-3]),ISNUMBER(RC[-1])),RC[-3]-RC[-1],"-") -> - | T55: =(RC[-16]*RC[-15]-RC[-13]*RC[-12])/1000 -> #VALUE! | W55: =RC[-2]*RC[-10]/1000 -> #VALUE! | X55: =ABS((RC[-3]*RC[-11]-RC[-2]*RC[-9])/1000) -> #VALUE! | Y55: =(RC[-14]-RC[1])/RC[-18]*100 -> #VALUE! | AC55: =VALUE(RC[-27]) -> #VALUE! | AD55: =IF(RC[21]=42,"*",IF(RC[21]=32,"",RC[21])) ->  | AE55: =RC[-28] ->  | AF55: =RC[-28] ->  | AG55: =RC[-28] ->  | AH55: =RC[-28] ->  | AI55: =RC[-28] ->  | AJ55: =RC[-28] ->  | AK55: =RC[-28] ->  | AL55: =RC[-28] -> 0 | AM55: =RC[-28] ->  | AN55: =RC[-28] ->  | AO55: =RC[-28] ->  | AP55: - | AQ55: =RC[-29] ->  | AR55: =RC[-29] ->  | AS55: - | AT55: =RC[-30] -> - | AU55: =RC[-30] ->  | AV55: =RC[-30] ->  | AW55: =RC[-30] -> 
A56: =IF(RC[1]="","",DATEVALUE(RC[1])) ->  | P56: =IF(AND(ISNUMBER(RC[-3]),ISNUMBER(RC[-1])),RC[-3]-RC[-1],"-") -> - | T56: =(RC[-16]*RC[-15]-RC[-13]*RC[-12])/1000 -> #VALUE! | W56: =RC[-2]*RC[-10]/1000 -> #VALUE! | X56: =ABS((RC[-3]*RC[-11]-RC[-2]*RC[-9])/1000) -> #VALUE! | Y56: =(RC[-14]-RC[1])/RC[-18]*100 -> #VALUE! | AC56: =VALUE(RC[-27]) -> #VALUE! | AD56: =IF(RC[21]=42,"*",IF(RC[21]=32,"",RC[21])) ->  | AE56: =RC[-28] ->  | AF56: =RC[-28] ->  | AG56: =RC[-28] ->  | AH56: =RC[-28] ->  | AI56: =RC[-28] ->  | AJ56: =RC[-28] ->  | AK56: =RC[-28] ->  | AL56: =RC[-28] -> 0 | AM56: =RC[-28] ->  | AN56: =RC[-28] ->  | AO56: =RC[-28] ->  | AP56: - | AQ56: =RC[-29] ->  | AR56: =RC[-29] ->  | AS56: - | AT56: =RC[-30] -> - | AU56: =RC[-30] ->  | AV56: =RC[-30] ->  | AW56: =RC[-30] -> 
A57: =IF(RC[1]="","",DATEVALUE(RC[1])) ->  | P57: =IF(AND(ISNUMBER(RC[-3]),ISNUMBER(RC[-1])),RC[-3]-RC[-1],"-") -> - | T57: =(RC[-16]*RC[-15]-RC[-13]*RC[-12])/1000 -> #VALUE! | W57: =RC[-2]*RC[-10]/1000 -> #VALUE! | X57: =ABS((RC[-3]*RC[-11]-RC[-2]*RC[-9])/1000) -> #VALUE! | Y57: =(RC[-14]-RC[1])/RC[-18]*100 -> #VALUE! | AC57: =VALUE(RC[-27]) -> #VALUE! | AD57: =IF(RC[21]=42,"*",IF(RC[21]=32,"",RC[21])) ->  | AE57: =RC[-28] ->  | AF57: =RC[-28] ->  | AG57: =RC[-28] ->  | AH57: =RC[-28] ->  | AI57: =RC[-28] ->  | AJ57: =RC[-28] ->  | AK57: =RC[-28] ->  | AL57: =RC[-28] -> 0 | AM57: =RC[-28] ->  | AN57: =RC[-28] ->  | AO57: =RC[-28] ->  | AP57: - | AQ57: =RC[-29] ->  | AR57: =RC[-29] ->  | AS57: - | AT57: =RC[-30] -> - | AU57: =RC[-30] ->  | AV57: =RC[-30] ->  | AW57: =RC[-30] -> 
A58: =IF(RC[1]="","",DATEVALUE(RC[1])) ->  | P58: =IF(AND(ISNUMBER(RC[-3]),ISNUMBER(RC[-1])),RC[-3]-RC[-1],"-") -> - | T58: =(RC[-16]*RC[-15]-RC[-13]*RC[-12])/1000 -> #VALUE! | W58: =RC[-2]*RC[-10]/1000 -> #VALUE! | X58: =ABS((RC[-3]*RC[-11]-RC[-2]*RC[-9])/1000) -> #VALUE! | Y58: =(RC[-14]-RC[1])/RC[-18]*100 -> #VALUE! | AC58: =VALUE(RC[-27]) -> #VALUE! | AD58: =IF(RC[21]=42,"*",IF(RC[21]=32,"",RC[21])) ->  | AE58: =RC[-28] ->  | AF58: =RC[-28] ->  | AG58: =RC[-28] ->  | AH58: =RC[-28] ->  | AI58: =RC[-28] ->  | AJ58: =RC[-28] ->  | AK58: =RC[-28] ->  | AL58: =RC[-28] -> 0 | AM58: =RC[-28] ->  | AN58: =RC[-28] ->  | AO58: =RC[-28] ->  | AP58: - | AQ58: =RC[-29] ->  | AR58: =RC[-29] ->  | AS58: - | AT58: =RC[-30] -> - | AU58: =RC[-30] ->  | AV58: =RC[-30] ->  | AW58: =RC[-30] -> 
A59: =IF(RC[1]="","",DATEVALUE(RC[1])) ->  | P59: =IF(AND(ISNUMBER(RC[-3]),ISNUMBER(RC[-1])),RC[-3]-RC[-1],"-") -> - | T59: =(RC[-16]*RC[-15]-RC[-13]*RC[-12])/1000 -> #VALUE! | W59: =RC[-2]*RC[-10]/1000 -> #VALUE! | X59: =ABS((RC[-3]*RC[-11]-RC[-2]*RC[-9])/1000) -> #VALUE! | Y59: =(RC[-14]-RC[1])/RC[-18]*100 -> #VALUE! | AC59: =VALUE(RC[-27]) -> #VALUE! | AD59: =IF(RC[21]=42,"*",IF(RC[21]=32,"",RC[21])) ->  | AE59: =RC[-28] ->  | AF59: =RC[-28] ->  | AG59: =RC[-28] ->  | AH59: =RC[-28] ->  | AI59: =RC[-28] ->  | AJ59: =RC[-28] ->  | AK59: =RC[-28] ->  | AL59: =RC[-28] -> 0 | AM59: =RC[-28] ->  | AN59: =RC[-28] ->  | AO59: =RC[-28] ->  | AP59: - | AQ59: =RC[-29] ->  | AR59: =RC[-29] ->  | AS59: - | AT59: =RC[-30] -> - | AU59: =RC[-30] ->  | AV59: =RC[-30] ->  | AW59: =RC[-30] -> 
A60: =IF(RC[1]="","",DATEVALUE(RC[1])) ->  | P60: =IF(AND(ISNUMBER(RC[-3]),ISNUMBER(RC[-1])),RC[-3]-RC[-1],"-") -> - | T60: =(RC[-16]*RC[-15]-RC[-13]*RC[-12])/1000 -> #VALUE! | W60: =RC[-2]*RC[-10]/1000 -> #VALUE! | X60: =ABS((RC[-3]*RC[-11]-RC[-2]*RC[-9])/1000) -> #VALUE! | Y60: =(RC[-14]-RC[1])/RC[-18]*100 -> #VALUE! | AC60: =VALUE(RC[-27]) -> #VALUE! | AD60: =IF(RC[21]=42,"*",IF(RC[21]=32,"",RC[21])) ->  | AE60: =RC[-28] ->  | AF60: =RC[-28] ->  | AG60: =RC[-28] ->  | AH60: =RC[-28] ->  | AI60: =RC[-28] ->  | AJ60: =RC[-28] ->  | AK60: =RC[-28] ->  | AL60: =RC[-28] -> 0 | AM60: =RC[-28] ->  | AN60: =RC[-28] ->  | AO60: =RC[-28] ->  | AP60: - | AQ60: =RC[-29] ->  | AR60: =RC[-29] ->  | AS60: - | AT60: =RC[-30] -> - | AU60: =RC[-30] ->  | AV60: =RC[-30] ->  | AW60: =RC[-30] -> 
A61: =IF(RC[1]="","",DATEVALUE(RC[1])) ->  | P61: =IF(AND(ISNUMBER(RC[-3]),ISNUMBER(RC[-1])),RC[-3]-RC[-1],"-") -> - | T61: =(RC[-16]*RC[-15]-RC[-13]*RC[-12])/1000 -> #VALUE! | W61: =RC[-2]*RC[-10]/1000 -> #VALUE! | X61: =ABS((RC[-3]*RC[-11]-RC[-2]*RC[-9])/1000) -> #VALUE! | Y61: =(RC[-14]-RC[1])/RC[-18]*100 -> #VALUE! | AC61: =VALUE(RC[-27]) -> #VALUE! | AD61: =IF(RC[21]=42,"*",IF(RC[21]=32,"",RC[21])) ->  | AE61: =RC[-28] ->  | AF61: =RC[-28] ->  | AG61: =RC[-28] ->  | AH61: =RC[-28] ->  | AI61: =RC[-28] ->  | AJ61: =RC[-28] ->  | AK61: =RC[-28] ->  | AL61: =RC[-28] -> 0 | AM61: =RC[-28] ->  | AN61: =RC[-28] ->  | AO61: =RC[-28] ->  | AP61: - | AQ61: =RC[-29] ->  | AR61: =RC[-29] ->  | AS61: - | AT61: =RC[-30] -> - | AU61: =RC[-30] ->  | AV61: =RC[-30] ->  | AW61: =RC[-30] -> 
A62: =IF(RC[1]="","",DATEVALUE(RC[1])) ->  | P62: =IF(AND(ISNUMBER(RC[-3]),ISNUMBER(RC[-1])),RC[-3]-RC[-1],"-") -> - | T62: =(RC[-16]*RC[-15]-RC[-13]*RC[-12])/1000 -> #VALUE! | W62: =RC[-2]*RC[-10]/1000 -> #VALUE! | X62: =ABS((RC[-3]*RC[-11]-RC[-2]*RC[-9])/1000) -> #VALUE! | Y62: =(RC[-14]-RC[1])/RC[-18]*100 -> #VALUE! | AC62: =VALUE(RC[-27]) -> #VALUE! | AD62: =IF(RC[21]=42,"*",IF(RC[21]=32,"",RC[21])) ->  | AE62: =RC[-28] ->  | AF62: =RC[-28] ->  | AG62: =RC[-28] ->  | AH62: =RC[-28] ->  | AI62: =RC[-28] ->  | AJ62: =RC[-28] ->  | AK62: =RC[-28] ->  | AL62: =RC[-28] -> 0 | AM62: =RC[-28] ->  | AN62: =RC[-28] ->  | AO62: =RC[-28] ->  | AP62: - | AQ62: =RC[-29] ->  | AR62: =RC[-29] ->  | AS62: - | AT62: =RC[-30] -> - | AU62: =RC[-30] ->  | AV62: =RC[-30] ->  | AW62: =RC[-30] -> 
A63: =IF(RC[1]="","",DATEVALUE(RC[1])) ->  | P63: =IF(AND(ISNUMBER(RC[-3]),ISNUMBER(RC[-1])),RC[-3]-RC[-1],"-") -> - | T63: =(RC[-16]*RC[-15]-RC[-13]*RC[-12])/1000 -> #VALUE! | W63: =RC[-2]*RC[-10]/1000 -> #VALUE! | X63: =ABS((RC[-3]*RC[-11]-RC[-2]*RC[-9])/1000) -> #VALUE! | Y63: =(RC[-14]-RC[1])/RC[-18]*100 -> #VALUE! | AC63: =VALUE(RC[-27]) -> #VALUE! | AD63: =IF(RC[21]=42,"*",IF(RC[21]=32,"",RC[21])) ->  | AE63: =RC[-28] ->  | AF63: =RC[-28] ->  | AG63: =RC[-28] ->  | AH63: =RC[-28] ->  | AI63: =RC[-28] ->  | AJ63: =RC[-28] ->  | AK63: =RC[-28] ->  | AL63: =RC[-28] -> 0 | AM63: =RC[-28] ->  | AN63: =RC[-28] ->  | AO63: =RC[-28] ->  | AP63: - | AQ63: =RC[-29] ->  | AR63: =RC[-29] ->  | AS63: - | AT63: =RC[-30] -> - | AU63: =RC[-30] ->  | AV63: =RC[-30] ->  | AW63: =RC[-30] -> 
A64: =IF(RC[1]="","",DATEVALUE(RC[1])) ->  | P64: =IF(AND(ISNUMBER(RC[-3]),ISNUMBER(RC[-1])),RC[-3]-RC[-1],"-") -> - | T64: =(RC[-16]*RC[-15]-RC[-13]*RC[-12])/1000 -> #VALUE! | W64: =RC[-2]*RC[-10]/1000 -> #VALUE! | X64: =ABS((RC[-3]*RC[-11]-RC[-2]*RC[-9])/1000) -> #VALUE! | Y64: =(RC[-14]-RC[1])/RC[-18]*100 -> #VALUE! | AC64: =VALUE(RC[-27]) -> #VALUE! | AD64: =IF(RC[21]=42,"*",IF(RC[21]=32,"",RC[21])) ->  | AE64: =RC[-28] ->  | AF64: =RC[-28] ->  | AG64: =RC[-28] ->  | AH64: =RC[-28] ->  | AI64: =RC[-28] ->  | AJ64: =RC[-28] ->  | AK64: =RC[-28] ->  | AL64: =RC[-28] -> 0 | AM64: =RC[-28] ->  | AN64: =RC[-28] ->  | AO64: =RC[-28] ->  | AP64: - | AQ64: =RC[-29] ->  | AR64: =RC[-29] ->  | AS64: - | AT64: =RC[-30] -> - | AU64: =RC[-30] ->  | AV64: =RC[-30] ->  | AW64: =RC[-30] -> 
A65: =IF(RC[1]="","",DATEVALUE(RC[1])) ->  | P65: =IF(AND(ISNUMBER(RC[-3]),ISNUMBER(RC[-1])),RC[-3]-RC[-1],"-") -> - | T65: =(RC[-16]*RC[-15]-RC[-13]*RC[-12])/1000 -> #VALUE! | W65: =RC[-2]*RC[-10]/1000 -> #VALUE! | X65: =ABS((RC[-3]*RC[-11]-RC[-2]*RC[-9])/1000) -> #VALUE! | Y65: =(RC[-14]-RC[1])/RC[-18]*100 -> #VALUE! | AC65: =VALUE(RC[-27]) -> #VALUE! | AD65: =IF(RC[21]=42,"*",IF(RC[21]=32,"",RC[21])) ->  | AE65: =RC[-28] ->  | AF65: =RC[-28] ->  | AG65: =RC[-28] ->  | AH65: =RC[-28] ->  | AI65: =RC[-28] ->  | AJ65: =RC[-28] ->  | AK65: =RC[-28] ->  | AL65: =RC[-28] -> 0 | AM65: =RC[-28] ->  | AN65: =RC[-28] ->  | AO65: =RC[-28] ->  | AP65: - | AQ65: =RC[-29] ->  | AR65: =RC[-29] ->  | AS65: - | AT65: =RC[-30] -> - | AU65: =RC[-30] ->  | AV65: =RC[-30] ->  | AW65: =RC[-30] -> 
A66: =IF(RC[1]="","",DATEVALUE(RC[1])) ->  | P66: =IF(AND(ISNUMBER(RC[-3]),ISNUMBER(RC[-1])),RC[-3]-RC[-1],"-") -> - | T66: =(RC[-16]*RC[-15]-RC[-13]*RC[-12])/1000 -> #VALUE! | W66: =RC[-2]*RC[-10]/1000 -> #VALUE! | X66: =ABS((RC[-3]*RC[-11]-RC[-2]*RC[-9])/1000) -> #VALUE! | Y66: =(RC[-14]-RC[1])/RC[-18]*100 -> #VALUE! | AC66: =VALUE(RC[-27]) -> #VALUE! | AD66: =IF(RC[21]=42,"*",IF(RC[21]=32,"",RC[21])) ->  | AE66: =RC[-28] ->  | AF66: =RC[-28] ->  | AG66: =RC[-28] ->  | AH66: =RC[-28] ->  | AI66: =RC[-28] ->  | AJ66: =RC[-28] ->  | AK66: =RC[-28] ->  | AL66: =RC[-28] -> 0 | AM66: =RC[-28] ->  | AN66: =RC[-28] ->  | AO66: =RC[-28] ->  | AP66: - | AQ66: =RC[-29] ->  | AR66: =RC[-29] ->  | AS66: - | AT66: =RC[-30] -> - | AU66: =RC[-30] ->  | AV66: =RC[-30] ->  | AW66: =RC[-30] -> 
A67: =IF(RC[1]="","",DATEVALUE(RC[1])) ->  | P67: =IF(AND(ISNUMBER(RC[-3]),ISNUMBER(RC[-1])),RC[-3]-RC[-1],"-") -> - | T67: =(RC[-16]*RC[-15]-RC[-13]*RC[-12])/1000 -> #VALUE! | W67: =RC[-2]*RC[-10]/1000 -> #VALUE! | X67: =ABS((RC[-3]*RC[-11]-RC[-2]*RC[-9])/1000) -> #VALUE! | Y67: =(RC[-14]-RC[1])/RC[-18]*100 -> #VALUE! | AC67: =VALUE(RC[-27]) -> #VALUE! | AD67: =IF(RC[21]=42,"*",IF(RC[21]=32,"",RC[21])) ->  | AE67: =RC[-28] ->  | AF67: =RC[-28] ->  | AG67: =RC[-28] ->  | AH67: =RC[-28] ->  | AI67: =RC[-28] ->  | AJ67: =RC[-28] ->  | AK67: =RC[-28] ->  | AL67: =RC[-28] -> 0 | AM67: =RC[-28] ->  | AN67: =RC[-28] ->  | AO67: =RC[-28] ->  | AP67: - | AQ67: =RC[-29] ->  | AR67: =RC[-29] ->  | AS67: - | AT67: =RC[-30] -> - | AU67: =RC[-30] ->  | AV67: =RC[-30] ->  | AW67: =RC[-30] -> 
A68: =IF(RC[1]="","",DATEVALUE(RC[1])) ->  | P68: =IF(AND(ISNUMBER(RC[-3]),ISNUMBER(RC[-1])),RC[-3]-RC[-1],"-") -> - | T68: =(RC[-16]*RC[-15]-RC[-13]*RC[-12])/1000 -> #VALUE! | W68: =RC[-2]*RC[-10]/1000 -> #VALUE! | X68: =ABS((RC[-3]*RC[-11]-RC[-2]*RC[-9])/1000) -> #VALUE! | Y68: =(RC[-14]-RC[1])/RC[-18]*100 -> #VALUE! | AC68: =VALUE(RC[-27]) -> #VALUE! | AD68: =IF(RC[21]=42,"*",IF(RC[21]=32,"",RC[21])) ->  | AE68: =RC[-28] ->  | AF68: =RC[-28] ->  | AG68: =RC[-28] ->  | AH68: =RC[-28] ->  | AI68: =RC[-28] ->  | AJ68: =RC[-28] ->  | AK68: =RC[-28] ->  | AL68: =RC[-28] -> 0 | AM68: =RC[-28] ->  | AN68: =RC[-28] ->  | AO68: =RC[-28] ->  | AP68: - | AQ68: =RC[-29] ->  | AR68: =RC[-29] ->  | AS68: - | AT68: =RC[-30] -> - | AU68: =RC[-30] ->  | AV68: =RC[-30] ->  | AW68: =RC[-30] -> 
A69: =IF(RC[1]="","",DATEVALUE(RC[1])) ->  | P69: =IF(AND(ISNUMBER(RC[-3]),ISNUMBER(RC[-1])),RC[-3]-RC[-1],"-") -> - | T69: =(RC[-16]*RC[-15]-RC[-13]*RC[-12])/1000 -> #VALUE! | W69: =RC[-2]*RC[-10]/1000 -> #VALUE! | X69: =ABS((RC[-3]*RC[-11]-RC[-2]*RC[-9])/1000) -> #VALUE! | Y69: =(RC[-14]-RC[1])/RC[-18]*100 -> #VALUE! | AC69: =VALUE(RC[-27]) -> #VALUE! | AD69: =IF(RC[21]=42,"*",IF(RC[21]=32,"",RC[21])) ->  | AE69: =RC[-28] ->  | AF69: =RC[-28] ->  | AG69: =RC[-28] ->  | AH69: =RC[-28] ->  | AI69: =RC[-28] ->  | AJ69: =RC[-28] ->  | AK69: =RC[-28] ->  | AL69: =RC[-28] -> 0 | AM69: =RC[-28] ->  | AN69: =RC[-28] ->  | AO69: =RC[-28] ->  | AP69: - | AQ69: =RC[-29] ->  | AR69: =RC[-29] ->  | AS69: - | AT69: =RC[-30] -> - | AU69: =RC[-30] ->  | AV69: =RC[-30] ->  | AW69: =RC[-30] -> 
A70: =IF(RC[1]="","",DATEVALUE(RC[1])) ->  | P70: =IF(AND(ISNUMBER(RC[-3]),ISNUMBER(RC[-1])),RC[-3]-RC[-1],"-") -> - | T70: =(RC[-16]*RC[-15]-RC[-13]*RC[-12])/1000 -> #VALUE! | W70: =RC[-2]*RC[-10]/1000 -> #VALUE! | X70: =ABS((RC[-3]*RC[-11]-RC[-2]*RC[-9])/1000) -> #VALUE! | Y70: =(RC[-14]-RC[1])/RC[-18]*100 -> #VALUE! | AC70: =VALUE(RC[-27]) -> #VALUE! | AD70: =IF(RC[21]=42,"*",IF(RC[21]=32,"",RC[21])) ->  | AE70: =RC[-28] ->  | AF70: =RC[-28] ->  | AG70: =RC[-28] ->  | AH70: =RC[-28] ->  | AI70: =RC[-28] ->  | AJ70: =RC[-28] ->  | AK70: =RC[-28] ->  | AL70: =RC[-28] -> 0 | AM70: =RC[-28] ->  | AN70: =RC[-28] ->  | AO70: =RC[-28] ->  | AP70: - | AQ70: =RC[-29] ->  | AR70: =RC[-29] ->  | AS70: - | AT70: =RC[-30] -> - | AU70: =RC[-30] ->  | AV70: =RC[-30] ->  | AW70: =RC[-30] -> 
A71: =IF(RC[1]="","",DATEVALUE(RC[1])) ->  | P71: =IF(AND(ISNUMBER(RC[-3]),ISNUMBER(RC[-1])),RC[-3]-RC[-1],"-") -> - | T71: =(RC[-16]*RC[-15]-RC[-13]*RC[-12])/1000 -> #VALUE! | W71: =RC[-2]*RC[-10]/1000 -> #VALUE! | X71: =ABS((RC[-3]*RC[-11]-RC[-2]*RC[-9])/1000) -> #VALUE! | Y71: =(RC[-14]-RC[1])/RC[-18]*100 -> #VALUE! | AC71: =VALUE(RC[-27]) -> #VALUE! | AD71: =IF(RC[21]=42,"*",IF(RC[21]=32,"",RC[21])) ->  | AE71: =RC[-28] ->  | AF71: =RC[-28] ->  | AG71: =RC[-28] ->  | AH71: =RC[-28] ->  | AI71: =RC[-28] ->  | AJ71: =RC[-28] ->  | AK71: =RC[-28] ->  | AL71: =RC[-28] -> 0 | AM71: =RC[-28] ->  | AN71: =RC[-28] ->  | AO71: =RC[-28] ->  | AP71: - | AQ71: =RC[-29] ->  | AR71: =RC[-29] ->  | AS71: - | AT71: =RC[-30] -> - | AU71: =RC[-30] ->  | AV71: =RC[-30] ->  | AW71: =RC[-30] -> 
A72: =IF(RC[1]="","",DATEVALUE(RC[1])) ->  | P72: =IF(AND(ISNUMBER(RC[-3]),ISNUMBER(RC[-1])),RC[-3]-RC[-1],"-") -> - | T72: =(RC[-16]*RC[-15]-RC[-13]*RC[-12])/1000 -> #VALUE! | W72: =RC[-2]*RC[-10]/1000 -> #VALUE! | X72: =ABS((RC[-3]*RC[-11]-RC[-2]*RC[-9])/1000) -> #VALUE! | Y72: =(RC[-14]-RC[1])/RC[-18]*100 -> #VALUE! | AC72: =VALUE(RC[-27]) -> #VALUE! | AD72: =IF(RC[21]=42,"*",IF(RC[21]=32,"",RC[21])) ->  | AE72: =RC[-28] ->  | AF72: =RC[-28] ->  | AG72: =RC[-28] ->  | AH72: =RC[-28] ->  | AI72: =RC[-28] ->  | AJ72: =RC[-28] ->  | AK72: =RC[-28] ->  | AL72: =RC[-28] -> 0 | AM72: =RC[-28] ->  | AN72: =RC[-28] ->  | AO72: =RC[-28] ->  | AP72: - | AQ72: =RC[-29] ->  | AR72: =RC[-29] ->  | AS72: - | AT72: =RC[-30] -> - | AU72: =RC[-30] ->  | AV72: =RC[-30] ->  | AW72: =RC[-30] -> 
A73: =IF(RC[1]="","",DATEVALUE(RC[1])) ->  | P73: =IF(AND(ISNUMBER(RC[-3]),ISNUMBER(RC[-1])),RC[-3]-RC[-1],"-") -> - | T73: =(RC[-16]*RC[-15]-RC[-13]*RC[-12])/1000 -> #VALUE! | W73: =RC[-2]*RC[-10]/1000 -> #VALUE! | X73: =ABS((RC[-3]*RC[-11]-RC[-2]*RC[-9])/1000) -> #VALUE! | Y73: =(RC[-14]-RC[1])/RC[-18]*100 -> #VALUE! | AC73: =VALUE(RC[-27]) -> #VALUE! | AD73: =IF(RC[21]=42,"*",IF(RC[21]=32,"",RC[21])) ->  | AE73: =RC[-28] ->  | AF73: =RC[-28] ->  | AG73: =RC[-28] ->  | AH73: =RC[-28] ->  | AI73: =RC[-28] ->  | AJ73: =RC[-28] ->  | AK73: =RC[-28] ->  | AL73: =RC[-28] -> 0 | AM73: =RC[-28] ->  | AN73: =RC[-28] ->  | AO73: =RC[-28] ->  | AP73: - | AQ73: =RC[-29] ->  | AR73: =RC[-29] ->  | AS73: - | AT73: =RC[-30] -> - | AU73: =RC[-30] ->  | AV73: =RC[-30] ->  | AW73: =RC[-30] -> 
A74: =IF(RC[1]="","",DATEVALUE(RC[1])) ->  | P74: =IF(AND(ISNUMBER(RC[-3]),ISNUMBER(RC[-1])),RC[-3]-RC[-1],"-") -> - | T74: =(RC[-16]*RC[-15]-RC[-13]*RC[-12])/1000 -> #VALUE! | W74: =RC[-2]*RC[-10]/1000 -> #VALUE! | X74: =ABS((RC[-3]*RC[-11]-RC[-2]*RC[-9])/1000) -> #VALUE! | Y74: =(RC[-14]-RC[1])/RC[-18]*100 -> #VALUE! | AC74: =VALUE(RC[-27]) -> #VALUE! | AD74: =IF(RC[21]=42,"*",IF(RC[21]=32,"",RC[21])) ->  | AE74: =RC[-28] ->  | AF74: =RC[-28] ->  | AG74: =RC[-28] ->  | AH74: =RC[-28] ->  | AI74: =RC[-28] ->  | AJ74: =RC[-28] ->  | AK74: =RC[-28] ->  | AL74: =RC[-28] -> 0 | AM74: =RC[-28] ->  | AN74: =RC[-28] ->  | AO74: =RC[-28] ->  | AP74: - | AQ74: =RC[-29] ->  | AR74: =RC[-29] ->  | AS74: - | AT74: =RC[-30] -> - | AU74: =RC[-30] ->  | AV74: =RC[-30] ->  | AW74: =RC[-30] -> 
A75: =IF(RC[1]="","",DATEVALUE(RC[1])) ->  | P75: =IF(AND(ISNUMBER(RC[-3]),ISNUMBER(RC[-1])),RC[-3]-RC[-1],"-") -> - | T75: =(RC[-16]*RC[-15]-RC[-13]*RC[-12])/1000 -> #VALUE! | W75: =RC[-2]*RC[-10]/1000 -> #VALUE! | X75: =ABS((RC[-3]*RC[-11]-RC[-2]*RC[-9])/1000) -> #VALUE! | Y75: =(RC[-14]-RC[1])/RC[-18]*100 -> #VALUE! | AC75: =VALUE(RC[-27]) -> #VALUE! | AD75: =IF(RC[21]=42,"*",IF(RC[21]=32,"",RC[21])) ->  | AE75: =RC[-28] ->  | AF75: =RC[-28] ->  | AG75: =RC[-28] ->  | AH75: =RC[-28] ->  | AI75: =RC[-28] ->  | AJ75: =RC[-28] ->  | AK75: =RC[-28] ->  | AL75: =RC[-28] -> 0 | AM75: =RC[-28] ->  | AN75: =RC[-28] ->  | AO75: =RC[-28] ->  | AP75: - | AQ75: =RC[-29] ->  | AR75: =RC[-29] ->  | AS75: - | AT75: =RC[-30] -> - | AU75: =RC[-30] ->  | AV75: =RC[-30] ->  | AW75: =RC[-30] -> 
A76: =IF(RC[1]="","",DATEVALUE(RC[1])) ->  | P76: =IF(AND(ISNUMBER(RC[-3]),ISNUMBER(RC[-1])),RC[-3]-RC[-1],"-") -> - | T76: =(RC[-16]*RC[-15]-RC[-13]*RC[-12])/1000 -> #VALUE! | W76: =RC[-2]*RC[-10]/1000 -> #VALUE! | X76: =ABS((RC[-3]*RC[-11]-RC[-2]*RC[-9])/1000) -> #VALUE! | Y76: =(RC[-14]-RC[1])/RC[-18]*100 -> #VALUE! | AC76: =VALUE(RC[-27]) -> #VALUE! | AD76: =IF(RC[21]=42,"*",IF(RC[21]=32,"",RC[21])) ->  | AE76: =RC[-28] ->  | AF76: =RC[-28] ->  | AG76: =RC[-28] ->  | AH76: =RC[-28] ->  | AI76: =RC[-28] ->  | AJ76: =RC[-28] ->  | AK76: =RC[-28] ->  | AL76: =RC[-28] -> 0 | AM76: =RC[-28] ->  | AN76: =RC[-28] ->  | AO76: =RC[-28] ->  | AP76: - | AQ76: =RC[-29] ->  | AR76: =RC[-29] ->  | AS76: - | AT76: =RC[-30] -> - | AU76: =RC[-30] ->  | AV76: =RC[-30] ->  | AW76: =RC[-30] -> 
A77: =IF(RC[1]="","",DATEVALUE(RC[1])) ->  | P77: =IF(AND(ISNUMBER(RC[-3]),ISNUMBER(RC[-1])),RC[-3]-RC[-1],"-") -> - | T77: =(RC[-16]*RC[-15]-RC[-13]*RC[-12])/1000 -> #VALUE! | W77: =RC[-2]*RC[-10]/1000 -> #VALUE! | X77: =ABS((RC[-3]*RC[-11]-RC[-2]*RC[-9])/1000) -> #VALUE! | Y77: =(RC[-14]-RC[1])/RC[-18]*100 -> #VALUE! | AC77: =VALUE(RC[-27]) -> #VALUE! | AD77: =IF(RC[21]=42,"*",IF(RC[21]=32,"",RC[21])) ->  | AE77: =RC[-28] ->  | AF77: =RC[-28] ->  | AG77: =RC[-28] ->  | AH77: =RC[-28] ->  | AI77: =RC[-28] ->  | AJ77: =RC[-28] ->  | AK77: =RC[-28] ->  | AL77: =RC[-28] -> 0 | AM77: =RC[-28] ->  | AN77: =RC[-28] ->  | AO77: =RC[-28] ->  | AP77: - | AQ77: =RC[-29] ->  | AR77: =RC[-29] ->  | AS77: - | AT77: =RC[-30] -> - | AU77: =RC[-30] ->  | AV77: =RC[-30] ->  | AW77: =RC[-30] -> 
A78: =IF(RC[1]="","",DATEVALUE(RC[1])) ->  | P78: =IF(AND(ISNUMBER(RC[-3]),ISNUMBER(RC[-1])),RC[-3]-RC[-1],"-") -> - | T78: =(RC[-16]*RC[-15]-RC[-13]*RC[-12])/1000 -> #VALUE! | W78: =RC[-2]*RC[-10]/1000 -> #VALUE! | X78: =ABS((RC[-3]*RC[-11]-RC[-2]*RC[-9])/1000) -> #VALUE! | Y78: =(RC[-14]-RC[1])/RC[-18]*100 -> #VALUE! | AC78: =VALUE(RC[-27]) -> #VALUE! | AD78: =IF(RC[21]=42,"*",IF(RC[21]=32,"",RC[21])) ->  | AE78: =RC[-28] ->  | AF78: =RC[-28] ->  | AG78: =RC[-28] ->  | AH78: =RC[-28] ->  | AI78: =RC[-28] ->  | AJ78: =RC[-28] ->  | AK78: =RC[-28] ->  | AL78: =RC[-28] -> 0 | AM78: =RC[-28] ->  | AN78: =RC[-28] ->  | AO78: =RC[-28] ->  | AP78: - | AQ78: =RC[-29] ->  | AR78: =RC[-29] ->  | AS78: - | AT78: =RC[-30] -> - | AU78: =RC[-30] ->  | AV78: =RC[-30] ->  | AW78: =RC[-30] -> 
A79: =IF(RC[1]="","",DATEVALUE(RC[1])) ->  | P79: =IF(AND(ISNUMBER(RC[-3]),ISNUMBER(RC[-1])),RC[-3]-RC[-1],"-") -> - | T79: =(RC[-16]*RC[-15]-RC[-13]*RC[-12])/1000 -> #VALUE! | W79: =RC[-2]*RC[-10]/1000 -> #VALUE! | X79: =ABS((RC[-3]*RC[-11]-RC[-2]*RC[-9])/1000) -> #VALUE! | Y79: =(RC[-14]-RC[1])/RC[-18]*100 -> #VALUE! | AC79: =VALUE(RC[-27]) -> #VALUE! | AD79: =IF(RC[21]=42,"*",IF(RC[21]=32,"",RC[21])) ->  | AE79: =RC[-28] ->  | AF79: =RC[-28] ->  | AG79: =RC[-28] ->  | AH79: =RC[-28] ->  | AI79: =RC[-28] ->  | AJ79: =RC[-28] ->  | AK79: =RC[-28] ->  | AL79: =RC[-28] -> 0 | AM79: =RC[-28] ->  | AN79: =RC[-28] ->  | AO79: =RC[-28] ->  | AP79: - | AQ79: =RC[-29] ->  | AR79: =RC[-29] ->  | AS79: - | AT79: =RC[-30] -> - | AU79: =RC[-30] ->  | AV79: =RC[-30] ->  | AW79: =RC[-30] -> 
A80: =IF(RC[1]="","",DATEVALUE(RC[1])) ->  | P80: =IF(AND(ISNUMBER(RC[-3]),ISNUMBER(RC[-1])),RC[-3]-RC[-1],"-") -> - | T80: =(RC[-16]*RC[-15]-RC[-13]*RC[-12])/1000 -> #VALUE! | W80: =RC[-2]*RC[-10]/1000 -> #VALUE! | X80: =ABS((RC[-3]*RC[-11]-RC[-2]*RC[-9])/1000) -> #VALUE! | Y80: =(RC[-14]-RC[1])/RC[-18]*100 -> #VALUE! | AC80: =VALUE(RC[-27]) -> #VALUE! | AD80: =IF(RC[21]=42,"*",IF(RC[21]=32,"",RC[21])) ->  | AE80: =RC[-28] ->  | AF80: =RC[-28] ->  | AG80: =RC[-28] ->  | AH80: =RC[-28] ->  | AI80: =RC[-28] ->  | AJ80: =RC[-28] ->  | AK80: =RC[-28] ->  | AL80: =RC[-28] -> 0 | AM80: =RC[-28] ->  | AN80: =RC[-28] ->  | AO80: =RC[-28] ->  | AP80: - | AQ80: =RC[-29] ->  | AR80: =RC[-29] ->  | AS80: - | AT80: =RC[-30] -> - | AU80: =RC[-30] ->  | AV80: =RC[-30] ->  | AW80: =RC[-30] -> 
A81: =IF(RC[1]="","",DATEVALUE(RC[1])) ->  | P81: =IF(AND(ISNUMBER(RC[-3]),ISNUMBER(RC[-1])),RC[-3]-RC[-1],"-") -> - | T81: =(RC[-16]*RC[-15]-RC[-13]*RC[-12])/1000 -> #VALUE! | W81: =RC[-2]*RC[-10]/1000 -> #VALUE! | X81: =ABS((RC[-3]*RC[-11]-RC[-2]*RC[-9])/1000) -> #VALUE! | Y81: =(RC[-14]-RC[1])/RC[-18]*100 -> #VALUE! | AC81: =VALUE(RC[-27]) -> #VALUE! | AD81: =IF(RC[21]=42,"*",IF(RC[21]=32,"",RC[21])) ->  | AE81: =RC[-28] ->  | AF81: =RC[-28] ->  | AG81: =RC[-28] ->  | AH81: =RC[-28] ->  | AI81: =RC[-28] ->  | AJ81: =RC[-28] ->  | AK81: =RC[-28] ->  | AL81: =RC[-28] -> 0 | AM81: =RC[-28] ->  | AN81: =RC[-28] ->  | AO81: =RC[-28] ->  | AP81: - | AQ81: =RC[-29] ->  | AR81: =RC[-29] ->  | AS81: - | AT81: =RC[-30] -> - | AU81: =RC[-30] ->  | AV81: =RC[-30] ->  | AW81: =RC[-30] -> 
A82: =IF(RC[1]="","",DATEVALUE(RC[1])) ->  | P82: =IF(AND(ISNUMBER(RC[-3]),ISNUMBER(RC[-1])),RC[-3]-RC[-1],"-") -> - | T82: =(RC[-16]*RC[-15]-RC[-13]*RC[-12])/1000 -> #VALUE! | W82: =RC[-2]*RC[-10]/1000 -> #VALUE! | X82: =ABS((RC[-3]*RC[-11]-RC[-2]*RC[-9])/1000) -> #VALUE! | Y82: =(RC[-14]-RC[1])/RC[-18]*100 -> #VALUE! | AC82: =VALUE(RC[-27]) -> #VALUE! | AD82: =IF(RC[21]=42,"*",IF(RC[21]=32,"",RC[21])) ->  | AE82: =RC[-28] ->  | AF82: =RC[-28] ->  | AG82: =RC[-28] ->  | AH82: =RC[-28] ->  | AI82: =RC[-28] ->  | AJ82: =RC[-28] ->  | AK82: =RC[-28] ->  | AL82: =RC[-28] -> 0 | AM82: =RC[-28] ->  | AN82: =RC[-28] ->  | AO82: =RC[-28] ->  | AP82: - | AQ82: =RC[-29] ->  | AR82: =RC[-29] ->  | AS82: - | AT82: =RC[-30] -> - | AU82: =RC[-30] ->  | AV82: =RC[-30] ->  | AW82: =RC[-30] -> 
A83: =IF(RC[1]="","",DATEVALUE(RC[1])) ->  | P83: =IF(AND(ISNUMBER(RC[-3]),ISNUMBER(RC[-1])),RC[-3]-RC[-1],"-") -> - | T83: =(RC[-16]*RC[-15]-RC[-13]*RC[-12])/1000 -> #VALUE! | W83: =RC[-2]*RC[-10]/1000 -> #VALUE! | X83: =ABS((RC[-3]*RC[-11]-RC[-2]*RC[-9])/1000) -> #VALUE! | Y83: =(RC[-14]-RC[1])/RC[-18]*100 -> #VALUE! | AC83: =VALUE(RC[-27]) -> #VALUE! | AD83: =IF(RC[21]=42,"*",IF(RC[21]=32,"",RC[21])) ->  | AE83: =RC[-28] ->  | AF83: =RC[-28] ->  | AG83: =RC[-28] ->  | AH83: =RC[-28] ->  | AI83: =RC[-28] ->  | AJ83: =RC[-28] ->  | AK83: =RC[-28] ->  | AL83: =RC[-28] -> 0 | AM83: =RC[-28] ->  | AN83: =RC[-28] ->  | AO83: =RC[-28] ->  | AP83: - | AQ83: =RC[-29] ->  | AR83: =RC[-29] ->  | AS83: - | AT83: =RC[-30] -> - | AU83: =RC[-30] ->  | AV83: =RC[-30] ->  | AW83: =RC[-30] -> 
AC84: Среднее | AF84: =R[1]C[-28] -> 114.29600000000001 | AG84: =R[1]C[-28] -> 68.297000000000011 | AH84: =R[1]C[-28] -> 8.0796666666666699 | AI84: =R[1]C[-28] -> 108.12133333333331 | AJ84: =R[1]C[-28] -> 52.820999999999991 | AK84: =R[1]C[-28] -> 5.448333333333335 | AL84: =R[1]C[-28] -> 15.475999999999999 | AM84: =R[1]C[-28] -> 6.174666666666667 | AN84: =R[1]C[-28] -> 56.799333333333315 | AO84: =R[1]C[-28] -> 68.660777777777795 | AP84: - | AQ84: =R[1]C[-29] -> 51.077111111111108 | AR84: =R[1]C[-29] -> 57.846888888888898 | AS84: - | AT84: =R[1]C[-30] -> 10.81388888888889 | AU84: =R[1]C[-30] -> 5.7222222222222232
B85: Среднее | D85: =AVERAGE(OFFSET(R[-74]C,3,0,R7C1,1)) -> 114.29600000000001 | E85: =AVERAGE(OFFSET(R[-74]C,3,0,R7C1,1)) -> 68.297000000000011 | F85: =AVERAGE(OFFSET(R[-74]C,3,0,R7C1,1)) -> 8.0796666666666699 | G85: =AVERAGE(OFFSET(R[-74]C,3,0,R7C1,1)) -> 108.12133333333331 | H85: =AVERAGE(OFFSET(R[-74]C,3,0,R7C1,1)) -> 52.820999999999991 | I85: =AVERAGE(OFFSET(R[-74]C,3,0,R7C1,1)) -> 5.448333333333335 | J85: =AVERAGE(OFFSET(R[-74]C,3,0,R7C1,1)) -> 15.475999999999999 | K85: =AVERAGE(OFFSET(R[-74]C,3,0,R7C1,1)) -> 6.174666666666667 | L85: =IF(SUM(OFFSET(R[-74]C,3,0,R7C1,1))=0,"",AVERAGE(OFFSET(R[-74]C,3,0,R7C1,1))) -> 56.799333333333315 | M85: =IF(SUM(OFFSET(R[-74]C,3,0,R7C1,1))=0,"",AVERAGE(OFFSET(R[-74]C,3,0,R7C1,1))) -> 68.660777777777795 | N85: =IF(SUM(OFFSET(R[-74]C,3,0,R7C1,1))=0,"",AVERAGE(OFFSET(R[-74]C,3,0,R7C1,1))) -> 51.077111111111108 | O85: =IF(SUM(OFFSET(R[-74]C,3,0,R7C1,1))=0,"",AVERAGE(OFFSET(R[-74]C,3,0,R7C1,1))) -> 57.846888888888898 | P85: =IF(SUM(OFFSET(R[-74]C,3,0,R7C1,1))=0,"",AVERAGE(OFFSET(R[-74]C,3,0,R7C1,1))) -> 10.81388888888889 | Q85: =IF(SUM(OFFSET(R[-74]C,3,0,R7C1,1))=0,"",AVERAGE(OFFSET(R[-74]C,3,0,R7C1,1))) -> 5.7222222222222232 | R85: =IF(SUM(OFFSET(R[-74]C,3,0,R7C1,1))=0,"",AVERAGE(OFFSET(R[-74]C,3,0,R7C1,1))) -> 0.92010000000000003 | S85: =AVERAGE(OFFSET(R[-74]C,3,0,R7C1,1)) -> 2.3498333333333337 | T85: =AVERAGE(OFFSET(R[-74]C,3,0,R7C1,1)) -> 2.2667126866666671 | W85: =AVERAGE(OFFSET(R[-74]C,3,0,R7C1,1)) -> 3.6516642666666668 | X85: =AVERAGE(OFFSET(R[-74]C,3,0,R7C1,1)) -> 0.86585789111111078 | AC85: Итого | AE85: =R[1]C[-28] -> 720 | AF85: =R[1]C[-28] -> 3428.88 | AI85: =R[1]C[-28] -> 3243.6399999999994 | AM85: =R[1]C[-28] -> 185.24 | AN85: =R[1]C[-28] -> 1703.9799999999996 | AQ85: =R[1]C[-29] -> 1532.3133333333333 | AU85: =R[1]C[-30] -> 171.66666666666669 | AV85: =R[1]C[-30] -> 27.603000000000002 | AW85: =R[1]C[-30] -> 70.495000000000005
B86: ИТОГО: | C86: =SUM(OFFSET(R[-75]C,3,0,R7C1,1)) -> 720 | D86: =SUM(OFFSET(R[-75]C,3,0,R7C1,1)) -> 3428.88 | G86: =SUM(OFFSET(R[-75]C,3,0,R7C1,1)) -> 3243.6399999999994 | K86: =SUM(OFFSET(R[-75]C,3,0,R7C1,1)) -> 185.24 | L86: =IF(SUM(OFFSET(R[-75]C,3,0,R7C1,1))=0,"",SUM(OFFSET(R[-75]C,3,0,R7C1,1))) -> 1703.9799999999996 | N86: =IF(SUM(OFFSET(R[-75]C,3,0,R7C1,1))=0,"",SUM(OFFSET(R[-75]C,3,0,R7C1,1))) -> 1532.3133333333333 | Q86: =IF(SUM(OFFSET(R[-75]C,3,0,R7C1,1))=0,"",SUM(OFFSET(R[-75]C,3,0,R7C1,1))) -> 171.66666666666669 | R86: =IF(SUM(OFFSET(R[-75]C,3,0,R7C1,1))=0,"",SUM(OFFSET(R[-75]C,3,0,R7C1,1))) -> 27.603000000000002 | S86: =SUM(OFFSET(R[-75]C,3,0,R7C1,1)) -> 70.495000000000005 | T86: =SUM(OFFSET(R[-75]C,3,0,R7C1,1)) -> 68.001380600000019 | W86: =SUM(OFFSET(R[-75]C,3,0,R7C1,1)) -> 109.54992800000001 | X86: =SUM(OFFSET(R[-75]C,3,0,R7C1,1)) -> 25.975736733333324
AC87: Досчёт | AF87: =R[1]C[-28] -> 0 | AI87: =R[1]C[-28] -> 0 | AM87: =R[1]C[-28] -> 0 | AN87: =R[1]C[-28] -> 0 | AQ87: =R[1]C[-29] -> 0 | AU87: =R[1]C[-30] -> 0 | AV87: =R[1]C[-30] -> 0 | AW87: =R[1]C[-30] -> 0
A88: 11дн=264ч 4дн=96ч | B88: Досчёт до конца м-ца (+) | C88: =R6C1*24 -> 216 | T88: № 21183 | AC88: Снятие | AF88: =-R[1]C[-28] -> 0 | AI88: =-R[1]C[-28] -> 0 | AM88: =-R[1]C[-28] -> 0 | AN88: =-R[1]C[-28] -> 0 | AQ88: =-R[1]C[-29] -> 0 | AU88: =-R[1]C[-30] -> 0 | AV88: =-R[1]C[-30] -> 0 | AW88: =-R[1]C[-30] -> 0
A89: 9дн=216ч 7дн=168ч | B89: Вычет с предыдущего (-) | C89: =R4C1*24 -> 192 | AC89: Сумма | AF89: =R[1]C[-28] -> 3428.88 | AI89: =R[1]C[-28] -> 3243.6399999999994 | AM89: =R[1]C[-28] -> 185.24 | AN89: =R[1]C[-28] -> 1703.9799999999996 | AQ89: =R[1]C[-29] -> 1532.3133333333333 | AU89: =R[1]C[-30] -> 171.66666666666669 | AV89: =R[1]C[-30] -> 27.603000000000002 | AW89: =R[1]C[-30] -> 70.495000000000005
B90: СУММА: | C90: =R[-4]C+R[-2]C-R[-1]C -> 744 | D90: =R[-4]C+R[-2]C-R[-1]C -> 3428.88 | G90: =R[-4]C+R[-2]C-R[-1]C -> 3243.6399999999994 | K90: =R[-4]C+R[-2]C-R[-1]C -> 185.24 | L90: =IF(SUM(OFFSET(R[-79]C,3,0,R7C1,1))=0,"",(R[-4]C+R[-2]C-R[-1]C)) -> 1703.9799999999996 | N90: =IF(SUM(OFFSET(R[-79]C,3,0,R7C1,1))=0,"",(R[-4]C+R[-2]C-R[-1]C)) -> 1532.3133333333333 | Q90: =IF(SUM(OFFSET(R[-79]C,3,0,R7C1,1))=0,"",(R[-4]C+R[-2]C-R[-1]C)) -> 171.66666666666669 | R90: =IF(SUM(OFFSET(R[-79]C,3,0,R7C1,1))=0,"",(R[-4]C+R[-2]C-R[-1]C)) -> 27.603000000000002 | S90: =R[-4]C+R[-2]C-R[-1]C -> 70.495000000000005
AC91: Тхв на источнике | AE91: V гвс (м3) | AF91: =R[-2]C[15] -> 171.66666666666669 | AG91: W гвс (Гкал) | AH91: =RC[-2]*0.06 -> 10.3 | AI91: W без гвс (Гкал) | AJ91: =R[-2]C[13]-RC[-2] -> 60.195000000000007
B92: Показания счетчиков на момент снятия данных:
B93: Дата, время | D93: М1, т | F93: М2, т | H93: М3, т | J93: М4, т | L93: Qо, Гкал | N93: Qг, Гкал | P93: время, час
B94: 23.09.18 02:00 | D94: 69436.399999999994 | F94: 65328.480000000003 | H94: 36252.43 | J94: 32841.03 | L94: 1568.13 | N94: 629.87900000000002 | P94: -
B95: 23.10.18 06:00 | D95: 72898.960000000006 | F95: 68605.37 | H95: 37860 | J95: 34296.07 | L95: 1637.856 | N95: 656.23800000000006 | P95: -
AC97: =ZAYAVKA_N -> з. на доп.№ 02/147-2548 от 5.10.2017 с 23.09.18г по 24.09.18г некорректная работа приборов
B98: Представитель потребителя:_______________________________________________________________________ В.О. Топорков
I101: Рекомендуемые значения по параметрам теплопотребления (не являются официально утверждёнными)
I102: М, т | J102: V, м3 | K102: Qгвс, Гкал | L102: Qотоп, Гкал | M102: Qо, Гкал
I103: =R[-13]C[-3] -> 0 | J103: =RC[-1]/0.98 -> 0 | K103: =RC[-1]*0.06 -> 0 | L103: =RC[1]-RC[-1] -> 27.603000000000002 | M103: =R[-13]C[5] -> 27.603000000000002
O105: ДЛЯ САМОКОНТРОЛЯ
B106: В строке выбора дат указать период с 16.7.13 по 23.8.13 - жильё | N106: Q | O106: Qг
B107: В строке выбора дат указать период с 18.7.13 по 25.8.13 - не жилое | N107: =(R[-21]C[-10]*R[-22]C[-7]-R[-21]C[-9]*R[-22]C[-6])/1000 -> 370.73507743999994 | O107: =IF(R[-22]C[-2]="",R[-21]C[-3]*R[-22]C/1000,"") ->  | P107: Си2
O108: =IF(R[-23]C[-2]="","",((R[-22]C[-3]*R[-23]C)-(R[-22]C[-2]*R[-23]C[2]))/1000) -> 98.569941728888878 | P108: Си3