Sheet: Лист1
G1: Отчёт о теплопотреблении за октябрь 2018 | M1: з. на доп.№ 02/147-2548 от 5.10.2017 с 28.09.18г по 04.10.18г некорректная работа приборов
A4: =EOMONTH(R[9]C,0)-R[9]C -> 8 | B4: Потребитель: ЗАО "Сити Сервис"
A5: =MAX(R[9]C:R[78]C) -> 2018-10-22T00:00:00.000 | B5: Адрес: г. СПб, Кораблестроителей ул., д.29 к.1 ИТП 2
A6: =EOMONTH(R[-1]C,0)-R[-1]C -> 9 | B6: Телефон: 8-911-021-19-79
A7: =R[-2]C-R[6]C -> 30 | B7: Договор 10023-2 (.) 14399
A8: 7 | B8: Тепловычислитель: ВКТ-7 № 107106 | L8: М2 мах= | M8: 256.8 | O8: Мгвс мах= | P8: 75.84
L9: Qотоп мах= | M9: 20.64 | O9: Qгвс мах= | P9: 4.55
B10: Расчётная формула: Q=M1*(h1-h2)+(M1-M2)*(h2-hхв)
D12: Учет | L12: Контроль
A13: =R[1]C[1]-1 -> 2018-09-22T00:00:00.000 | B13: Дата | C13: N, ч | D13: M1, т | E13: T1, С | F13: P1, кг/см2 | G13: M2, т | H13: T2, С | I13: P2, кг/см2 | J13: dT, С | K13: M1-М2, т | L13: V3, м3 | M13: T3, С | N13: V4, м3 | O13: =IF(R[-12]C[-14]="м.куб","","T4, С") -> T4, С | P13: dT, С | Q13: V3-V4, м3 | R13: Qгвс, Гкал | S13: Qобщ., Гкал | T13: Q | U13: M3 | V13: M4 | W13: си2 | X13: си3 | Y13: Разб. | Z13: dM2 | AC13: Дата | AD13: НС | AE13: n, ч | AF13: М1, т | AG13: t1, гр. С | AH13: Р1, кгс/см2 | AI13: М2, т | AJ13: t2, гр. С | AK13: Р2, кгс/см2 | AL13: t1-t2, гр. С | AM13: М1-М2, т | AN13: М1гвс, т | AO13: t1гвс, гр. С | AP13: Р1гвс, кгс/см2 | AQ13: М2гвс, т | AR13: t2гвс, гр. С | AS13: Р2гвс, кгс/см2 | AT13: t1гвс-t2гвс | AU13: М1гвс-М2гвс, т | AV13: Wгвс, Гкал | AW13: Wсумм, Гкал | AY13: NS_TV1 | AZ13: НС | BA13: NS_TV2
A14: =IF(RC[1]="","",DATEVALUE(RC[1])) -> 43366 | B14: 23.09.18 | C14: 24 | D14: 37.47 | E14: 66.22 | F14: 9.01 | G14: 0 | H14: 20.49 | I14: 1.04 | J14: =RC[-5]-RC[-2] -> 45.730000000000004 | K14: 37.47 | L14: 39.71 | M14: 66.349999999999994 | R14: 2.581 | S14: =RC[-1] -> 2.581 | T14: =(RC[-16]*RC[-15]-RC[-13]*RC[-12])/1000 -> 2.4812634 | U14: 38.92 | V14: - | W14: =RC[-2]*RC[-10]/1000 -> 2.5823420000000001 | X14: =ABS((RC[-3]*RC[-11]-RC[-2]*RC[-9])/1000) -> #VALUE! | Y14: =(RC[-14]-RC[1])/RC[-18]*100 -> #DIV/0! | Z14: 38.92 | AC14: =VALUE(RC[-27]) -> 2018-09-23T00:00:00.000 | AD14: =IF(RC[21]=42,"*",IF(RC[21]=32,"",RC[21])) -> - | AE14: =RC[-28] -> 24 | AF14: =RC[-28] -> 37.47 | AG14: =RC[-28] -> 66.22 | AH14: =RC[-28] -> 9.01 | AI14: =RC[-28] -> 0 | AJ14: =RC[-28] -> 20.49 | AK14: =RC[-28] -> 1.04 | AL14: =RC[-28] -> 45.730000000000004 | AM14: =RC[-28] -> 37.47 | AN14: =RC[-28] -> 39.71 | AO14: =RC[-28] -> 66.349999999999994 | AP14: - | AQ14: =RC[-29] -> 0 | AR14: =RC[-29] -> 0 | AS14: - | AT14: =RC[-30] -> 0 | AU14: =RC[-30] -> 0 | AV14: =RC[-30] -> 2.581 | AW14: =RC[-30] -> 2.581 | AY14: - | AZ14: - | BA14: -
A15: =IF(RC[1]="","",DATEVALUE(RC[1])) -> 43367 | B15: 24.09.18 | C15: 24 | D15: 36.979999999999997 | E15: 64.47 | F15: 8.9700000000000006 | G15: 0 | H15: 20.2 | I15: 1.04 | J15: =RC[-5]-RC[-2] -> 44.269999999999996 | K15: 36.979999999999997 | L15: 39.299999999999997 | M15: 64.41 | R15: 2.4830000000000001 | S15: =RC[-1] -> 2.4830000000000001 | T15: =(RC[-16]*RC[-15]-RC[-13]*RC[-12])/1000 -> 2.3841005999999996 | U15: 38.57 | V15: - | W15: =RC[-2]*RC[-10]/1000 -> 2.4842936999999998 | X15: =ABS((RC[-3]*RC[-11]-RC[-2]*RC[-9])/1000) -> #VALUE! | Y15: =(RC[-14]-RC[1])/RC[-18]*100 -> #DIV/0! | Z15: 38.57 | AC15: =VALUE(RC[-27]) -> 2018-09-24T00:00:00.000 | AD15: =IF(RC[21]=42,"*",IF(RC[21]=32,"",RC[21])) -> - | AE15: =RC[-28] -> 24 | AF15: =RC[-28] -> 36.979999999999997 | AG15: =RC[-28] -> 64.47 | AH15: =RC[-28] -> 8.9700000000000006 | AI15: =RC[-28] -> 0 | AJ15: =RC[-28] -> 20.2 | AK15: =RC[-28] -> 1.04 | AL15: =RC[-28] -> 44.269999999999996 | AM15: =RC[-28] -> 36.979999999999997 | AN15: =RC[-28] -> 39.299999999999997 | AO15: =RC[-28] -> 64.41 | AP15: - | AQ15: =RC[-29] -> 0 | AR15: =RC[-29] -> 0 | AS15: - | AT15: =RC[-30] -> 0 | AU15: =RC[-30] -> 0 | AV15: =RC[-30] -> 2.4830000000000001 | AW15: =RC[-30] -> 2.4830000000000001 | AY15: - | AZ15: - | BA15: -
A16: =IF(RC[1]="","",DATEVALUE(RC[1])) -> 43368 | B16: 25.09.18 | C16: 24 | D16: 36.5 | E16: 60.02 | F16: 9.01 | G16: 0 | H16: 19.91 | I16: 1.04 | J16: =RC[-5]-RC[-2] -> 40.11 | K16: 36.5 | L16: 38.89 | M16: 59.94 | R16: 2.2919999999999998 | S16: =RC[-1] -> 2.2919999999999998 | T16: =(RC[-16]*RC[-15]-RC[-13]*RC[-12])/1000 -> 2.1907299999999998 | U16: 38.229999999999997 | V16: - | W16: =RC[-2]*RC[-10]/1000 -> 2.2915061999999997 | X16: =ABS((RC[-3]*RC[-11]-RC[-2]*RC[-9])/1000) -> #VALUE! | Y16: =(RC[-14]-RC[1])/RC[-18]*100 -> #DIV/0! | Z16: 38.229999999999997 | AC16: =VALUE(RC[-27]) -> 2018-09-25T00:00:00.000 | AD16: =IF(RC[21]=42,"*",IF(RC[21]=32,"",RC[21])) -> - | AE16: =RC[-28] -> 24 | AF16: =RC[-28] -> 36.5 | AG16: =RC[-28] -> 60.02 | AH16: =RC[-28] -> 9.01 | AI16: =RC[-28] -> 0 | AJ16: =RC[-28] -> 19.91 | AK16: =RC[-28] -> 1.04 | AL16: =RC[-28] -> 40.11 | AM16: =RC[-28] -> 36.5 | AN16: =RC[-28] -> 38.89 | AO16: =RC[-28] -> 59.94 | AP16: - | AQ16: =RC[-29] -> 0 | AR16: =RC[-29] -> 0 | AS16: - | AT16: =RC[-30] -> 0 | AU16: =RC[-30] -> 0 | AV16: =RC[-30] -> 2.2919999999999998 | AW16: =RC[-30] -> 2.2919999999999998 | AY16: - | AZ16: - | BA16: -
A17: =IF(RC[1]="","",DATEVALUE(RC[1])) -> 43369 | B17: 26.09.18 | C17: 24 | D17: 129.88999999999999 | E17: 64.33 | F17: 8.66 | G17: 90.73 | H17: 59.16 | I17: 2.2400000000000002 | J17: =RC[-5]-RC[-2] -> 5.1700000000000017 | K17: 39.159999999999997 | L17: 41.42 | M17: 62.58 | R17: 2.5459999999999998 | S17: 2.992 | T17: =(RC[-16]*RC[-15]-RC[-13]*RC[-12])/1000 -> 2.9882368999999991 | U17: 40.67 | V17: - | W17: =RC[-2]*RC[-10]/1000 -> 2.5451286 | X17: =ABS((RC[-3]*RC[-11]-RC[-2]*RC[-9])/1000) -> #VALUE! | Y17: =(RC[-14]-RC[1])/RC[-18]*100 -> -1.6642786288989364 | Z17: 40.67 | AC17: =VALUE(RC[-27]) -> 2018-09-26T00:00:00.000 | AD17: =IF(RC[21]=42,"*",IF(RC[21]=32,"",RC[21])) -> - | AE17: =RC[-28] -> 24 | AF17: =RC[-28] -> 129.88999999999999 | AG17: =RC[-28] -> 64.33 | AH17: =RC[-28] -> 8.66 | AI17: =RC[-28] -> 90.73 | AJ17: =RC[-28] -> 59.16 | AK17: =RC[-28] -> 2.2400000000000002 | AL17: =RC[-28] -> 5.1700000000000017 | AM17: =RC[-28] -> 39.159999999999997 | AN17: =RC[-28] -> 41.42 | AO17: =RC[-28] -> 62.58 | AP17: - | AQ17: =RC[-29] -> 0 | AR17: =RC[-29] -> 0 | AS17: - | AT17: =RC[-30] -> 0 | AU17: =RC[-30] -> 0 | AV17: =RC[-30] -> 2.5459999999999998 | AW17: =RC[-30] -> 2.992 | AY17: - | AZ17: - | BA17: -
A18: =IF(RC[1]="","",DATEVALUE(RC[1])) -> 43370 | B18: 27.09.18 | C18: 24 | D18: 363.12 | E18: 62.61 | F18: 7.69 | G18: 318.77999999999997 | H18: 50.56 | I18: 5.41 | J18: =RC[-5]-RC[-2] -> 12.049999999999997 | K18: 44.34 | L18: 39.57 | M18: 62.39 | R18: 2.4279999999999999 | S18: 6.6319999999999997 | T18: =(RC[-16]*RC[-15]-RC[-13]*RC[-12])/1000 -> 6.617426400000002 | U18: 38.89 | V18: - | W18: =RC[-2]*RC[-10]/1000 -> 2.4263471000000001 | X18: =ABS((RC[-3]*RC[-11]-RC[-2]*RC[-9])/1000) -> #VALUE! | Y18: =(RC[-14]-RC[1])/RC[-18]*100 -> 1.709643013990841 | Z18: 38.89 | AC18: =VALUE(RC[-27]) -> 2018-09-27T00:00:00.000 | AD18: =IF(RC[21]=42,"*",IF(RC[21]=32,"",RC[21])) -> - | AE18: =RC[-28] -> 24 | AF18: =RC[-28] -> 363.12 | AG18: =RC[-28] -> 62.61 | AH18: =RC[-28] -> 7.69 | AI18: =RC[-28] -> 318.77999999999997 | AJ18: =RC[-28] -> 50.56 | AK18: =RC[-28] -> 5.41 | AL18: =RC[-28] -> 12.049999999999997 | AM18: =RC[-28] -> 44.34 | AN18: =RC[-28] -> 39.57 | AO18: =RC[-28] -> 62.39 | AP18: - | AQ18: =RC[-29] -> 0 | AR18: =RC[-29] -> 0 | AS18: - | AT18: =RC[-30] -> 0 | AU18: =RC[-30] -> 0 | AV18: =RC[-30] -> 2.4279999999999999 | AW18: =RC[-30] -> 6.6319999999999997 | AY18: - | AZ18: - | BA18: -
A19: =IF(RC[1]="","",DATEVALUE(RC[1])) -> 43371 | B19: 28.09.18 | C19: 24 | D19: 257.78999999999996 | E19: 65.350000000000009 | F19: 6.956666666666667 | G19: 223.15 | H19: 40.840000000000003 | I19: 5.9266666666666667 | J19: 24.509999999999991 | K19: 34.64 | L19: 36.89 | M19: 65.353333333333339 | R19: 2.3666666666666667 | S19: 7.730666666666667 | T19: =(RC[-16]*RC[-15]-RC[-13]*RC[-12])/1000 -> 7.7331304999999979 | U19: 141.1 | V19: - | W19: =RC[-2]*RC[-10]/1000 -> 9.2213553333333333 | X19: =ABS((RC[-3]*RC[-11]-RC[-2]*RC[-9])/1000) -> #VALUE! | Y19: =(RC[-14]-RC[1])/RC[-18]*100 -> -47.707819852117403 | Z19: 141.1 | AC19: =VALUE(RC[-27]) -> 2018-09-28T00:00:00.000 | AD19: =IF(RC[21]=42,"*",IF(RC[21]=32,"",RC[21])) -> - | AE19: =RC[-28] -> 24 | AF19: =RC[-28] -> 257.78999999999996 | AG19: =RC[-28] -> 65.350000000000009 | AH19: =RC[-28] -> 6.956666666666667 | AI19: =RC[-28] -> 223.15 | AJ19: =RC[-28] -> 40.840000000000003 | AK19: =RC[-28] -> 5.9266666666666667 | AL19: =RC[-28] -> 24.509999999999991 | AM19: =RC[-28] -> 34.64 | AN19: =RC[-28] -> 36.89 | AO19: =RC[-28] -> 65.353333333333339 | AP19: - | AQ19: =RC[-29] -> 0 | AR19: =RC[-29] -> 0 | AS19: - | AT19: =RC[-30] -> 0 | AU19: =RC[-30] -> 0 | AV19: =RC[-30] -> 2.3666666666666667 | AW19: =RC[-30] -> 7.730666666666667 | AY19: - | AZ19: - | BA19: -
A20: =IF(RC[1]="","",DATEVALUE(RC[1])) -> 43372 | B20: 29.09.18 | C20: 24 | D20: 257.78999999999996 | E20: 65.350000000000009 | F20: 6.956666666666667 | G20: 223.15 | H20: 40.840000000000003 | I20: 5.9266666666666667 | J20: 24.509999999999991 | K20: 34.64 | L20: 36.89 | M20: 65.353333333333339 | R20: 2.3666666666666667 | S20: 7.730666666666667 | T20: =(RC[-16]*RC[-15]-RC[-13]*RC[-12])/1000 -> 7.7331304999999979 | U20: 236.15 | V20: - | W20: =RC[-2]*RC[-10]/1000 -> 15.433189666666669 | X20: =ABS((RC[-3]*RC[-11]-RC[-2]*RC[-9])/1000) -> #VALUE! | Y20: =(RC[-14]-RC[1])/RC[-18]*100 -> -90.302487116289484 | Z20: 236.15 | AC20: =VALUE(RC[-27]) -> 2018-09-29T00:00:00.000 | AD20: =IF(RC[21]=42,"*",IF(RC[21]=32,"",RC[21])) -> - | AE20: =RC[-28] -> 24 | AF20: =RC[-28] -> 257.78999999999996 | AG20: =RC[-28] -> 65.350000000000009 | AH20: =RC[-28] -> 6.956666666666667 | AI20: =RC[-28] -> 223.15 | AJ20: =RC[-28] -> 40.840000000000003 | AK20: =RC[-28] -> 5.9266666666666667 | AL20: =RC[-28] -> 24.509999999999991 | AM20: =RC[-28] -> 34.64 | AN20: =RC[-28] -> 36.89 | AO20: =RC[-28] -> 65.353333333333339 | AP20: - | AQ20: =RC[-29] -> 0 | AR20: =RC[-29] -> 0 | AS20: - | AT20: =RC[-30] -> 0 | AU20: =RC[-30] -> 0 | AV20: =RC[-30] -> 2.3666666666666667 | AW20: =RC[-30] -> 7.730666666666667 | AY20: - | AZ20: - | BA20: -
A21: =IF(RC[1]="","",DATEVALUE(RC[1])) -> 43373 | B21: 30.09.18 | C21: 24 | D21: 257.78999999999996 | E21: 65.350000000000009 | F21: 6.956666666666667 | G21: 223.15 | H21: 40.840000000000003 | I21: 5.9266666666666667 | J21: 24.509999999999991 | K21: 34.64 | L21: 36.89 | M21: 65.353333333333339 | R21: 2.3666666666666667 | S21: 7.730666666666667 | T21: =(RC[-16]*RC[-15]-RC[-13]*RC[-12])/1000 -> 7.7331304999999979 | U21: 235.87 | V21: - | W21: =RC[-2]*RC[-10]/1000 -> 15.414890733333335 | X21: =ABS((RC[-3]*RC[-11]-RC[-2]*RC[-9])/1000) -> #VALUE! | Y21: =(RC[-14]-RC[1])/RC[-18]*100 -> -90.177010979162006 | Z21: 235.87 | AC21: =VALUE(RC[-27]) -> 2018-09-30T00:00:00.000 | AD21: =IF(RC[21]=42,"*",IF(RC[21]=32,"",RC[21])) -> - | AE21: =RC[-28] -> 24 | AF21: =RC[-28] -> 257.78999999999996 | AG21: =RC[-28] -> 65.350000000000009 | AH21: =RC[-28] -> 6.956666666666667 | AI21: =RC[-28] -> 223.15 | AJ21: =RC[-28] -> 40.840000000000003 | AK21: =RC[-28] -> 5.9266666666666667 | AL21: =RC[-28] -> 24.509999999999991 | AM21: =RC[-28] -> 34.64 | AN21: =RC[-28] -> 36.89 | AO21: =RC[-28] -> 65.353333333333339 | AP21: - | AQ21: =RC[-29] -> 0 | AR21: =RC[-29] -> 0 | AS21: - | AT21: =RC[-30] -> 0 | AU21: =RC[-30] -> 0 | AV21: =RC[-30] -> 2.3666666666666667 | AW21: =RC[-30] -> 7.730666666666667 | AY21: - | AZ21: - | BA21: -
A22: =IF(RC[1]="","",DATEVALUE(RC[1])) -> 43374 | B22: 01.10.18 | C22: 24 | D22: 257.78999999999996 | E22: 65.350000000000009 | F22: 6.956666666666667 | G22: 223.15 | H22: 40.840000000000003 | I22: 5.9266666666666667 | J22: 24.509999999999991 | K22: 34.64 | L22: 36.89 | M22: 65.353333333333339 | R22: 2.3666666666666667 | S22: 7.730666666666667 | T22: =(RC[-16]*RC[-15]-RC[-13]*RC[-12])/1000 -> 7.7331304999999979 | U22: 236.03 | V22: - | W22: =RC[-2]*RC[-10]/1000 -> 15.425347266666668 | X22: =ABS((RC[-3]*RC[-11]-RC[-2]*RC[-9])/1000) -> #VALUE! | Y22: =(RC[-14]-RC[1])/RC[-18]*100 -> -90.248711628949124 | Z22: 236.03 | AC22: =VALUE(RC[-27]) -> 2018-10-01T00:00:00.000 | AD22: =IF(RC[21]=42,"*",IF(RC[21]=32,"",RC[21])) -> - | AE22: =RC[-28] -> 24 | AF22: =RC[-28] -> 257.78999999999996 | AG22: =RC[-28] -> 65.350000000000009 | AH22: =RC[-28] -> 6.956666666666667 | AI22: =RC[-28] -> 223.15 | AJ22: =RC[-28] -> 40.840000000000003 | AK22: =RC[-28] -> 5.9266666666666667 | AL22: =RC[-28] -> 24.509999999999991 | AM22: =RC[-28] -> 34.64 | AN22: =RC[-28] -> 36.89 | AO22: =RC[-28] -> 65.353333333333339 | AP22: - | AQ22: =RC[-29] -> 0 | AR22: =RC[-29] -> 0 | AS22: - | AT22: =RC[-30] -> 0 | AU22: =RC[-30] -> 0 | AV22: =RC[-30] -> 2.3666666666666667 | AW22: =RC[-30] -> 7.730666666666667 | AY22: - | AZ22: - | BA22: -
A23: =IF(RC[1]="","",DATEVALUE(RC[1])) -> 43375 | B23: 02.10.18 | C23: 24 | D23: 257.78999999999996 | E23: 65.350000000000009 | F23: 6.956666666666667 | G23: 223.15 | H23: 40.840000000000003 | I23: 5.9266666666666667 | J23: 24.509999999999991 | K23: 34.64 | L23: 36.89 | M23: 65.353333333333339 | R23: 2.3666666666666667 | S23: 7.730666666666667 | T23: =(RC[-16]*RC[-15]-RC[-13]*RC[-12])/1000 -> 7.7331304999999979 | U23: 236.18 | V23: - | W23: =RC[-2]*RC[-10]/1000 -> 15.435150266666669 | X23: =ABS((RC[-3]*RC[-11]-RC[-2]*RC[-9])/1000) -> #VALUE! | Y23: =(RC[-14]-RC[1])/RC[-18]*100 -> -90.315930988124578 | Z23: 236.18 | AC23: =VALUE(RC[-27]) -> 2018-10-02T00:00:00.000 | AD23: =IF(RC[21]=42,"*",IF(RC[21]=32,"",RC[21])) -> - | AE23: =RC[-28] -> 24 | AF23: =RC[-28] -> 257.78999999999996 | AG23: =RC[-28] -> 65.350000000000009 | AH23: =RC[-28] -> 6.956666666666667 | AI23: =RC[-28] -> 223.15 | AJ23: =RC[-28] -> 40.840000000000003 | AK23: =RC[-28] -> 5.9266666666666667 | AL23: =RC[-28] -> 24.509999999999991 | AM23: =RC[-28] -> 34.64 | AN23: =RC[-28] -> 36.89 | AO23: =RC[-28] -> 65.353333333333339 | AP23: - | AQ23: =RC[-29] -> 0 | AR23: =RC[-29] -> 0 | AS23: - | AT23: =RC[-30] -> 0 | AU23: =RC[-30] -> 0 | AV23: =RC[-30] -> 2.3666666666666667 | AW23: =RC[-30] -> 7.730666666666667 | AY23: - | AZ23: - | BA23: -
A24: =IF(RC[1]="","",DATEVALUE(RC[1])) -> 43376 | B24: 03.10.18 | C24: 24 | D24: 257.78999999999996 | E24: 65.350000000000009 | F24: 6.956666666666667 | G24: 223.15 | H24: 40.840000000000003 | I24: 5.9266666666666667 | J24: 24.509999999999991 | K24: 34.64 | L24: 36.89 | M24: 65.353333333333339 | R24: 2.3666666666666667 | S24: 7.730666666666667 | T24: =(RC[-16]*RC[-15]-RC[-13]*RC[-12])/1000 -> 7.7331304999999979 | U24: 236.17 | V24: - | W24: =RC[-2]*RC[-10]/1000 -> 15.434496733333333 | X24: =ABS((RC[-3]*RC[-11]-RC[-2]*RC[-9])/1000) -> #VALUE! | Y24: =(RC[-14]-RC[1])/RC[-18]*100 -> -90.31144969751287 | Z24: 236.17 | AC24: =VALUE(RC[-27]) -> 2018-10-03T00:00:00.000 | AD24: =IF(RC[21]=42,"*",IF(RC[21]=32,"",RC[21])) -> - | AE24: =RC[-28] -> 24 | AF24: =RC[-28] -> 257.78999999999996 | AG24: =RC[-28] -> 65.350000000000009 | AH24: =RC[-28] -> 6.956666666666667 | AI24: =RC[-28] -> 223.15 | AJ24: =RC[-28] -> 40.840000000000003 | AK24: =RC[-28] -> 5.9266666666666667 | AL24: =RC[-28] -> 24.509999999999991 | AM24: =RC[-28] -> 34.64 | AN24: =RC[-28] -> 36.89 | AO24: =RC[-28] -> 65.353333333333339 | AP24: - | AQ24: =RC[-29] -> 0 | AR24: =RC[-29] -> 0 | AS24: - | AT24: =RC[-30] -> 0 | AU24: =RC[-30] -> 0 | AV24: =RC[-30] -> 2.3666666666666667 | AW24: =RC[-30] -> 7.730666666666667 | AY24: - | AZ24: - | BA24: -
A25: =IF(RC[1]="","",DATEVALUE(RC[1])) -> 43377 | B25: 04.10.18 | C25: 24 | D25: =AVERAGE(R[1]C:R[3]C) -> 257.78999999999996 | E25: =AVERAGE(R[1]C:R[3]C) -> 65.350000000000009 | F25: =AVERAGE(R[1]C:R[3]C) -> 6.956666666666667 | G25: =AVERAGE(R[1]C:R[3]C) -> 223.15 | H25: =AVERAGE(R[1]C:R[3]C) -> 40.840000000000003 | I25: =AVERAGE(R[1]C:R[3]C) -> 5.9266666666666667 | J25: =AVERAGE(R[1]C:R[3]C) -> 24.509999999999991 | K25: =AVERAGE(R[1]C:R[3]C) -> 34.64 | L25: =AVERAGE(R[1]C:R[3]C) -> 36.89 | M25: =AVERAGE(R[1]C:R[3]C) -> 65.353333333333339 | R25: =AVERAGE(R[1]C:R[3]C) -> 2.3666666666666667 | S25: =AVERAGE(R[1]C:R[3]C) -> 7.730666666666667 | T25: =(RC[-16]*RC[-15]-RC[-13]*RC[-12])/1000 -> 7.7331304999999979 | U25: 132.1 | V25: - | W25: =RC[-2]*RC[-10]/1000 -> 8.6331753333333339 | X25: =ABS((RC[-3]*RC[-11]-RC[-2]*RC[-9])/1000) -> #VALUE! | Y25: =(RC[-14]-RC[1])/RC[-18]*100 -> -43.674658301590853 | Z25: 132.1 | AC25: =VALUE(RC[-27]) -> 2018-10-04T00:00:00.000 | AD25: =IF(RC[21]=42,"*",IF(RC[21]=32,"",RC[21])) -> - | AE25: =RC[-28] -> 24 | AF25: =RC[-28] -> 257.78999999999996 | AG25: =RC[-28] -> 65.350000000000009 | AH25: =RC[-28] -> 6.956666666666667 | AI25: =RC[-28] -> 223.15 | AJ25: =RC[-28] -> 40.840000000000003 | AK25: =RC[-28] -> 5.9266666666666667 | AL25: =RC[-28] -> 24.509999999999991 | AM25: =RC[-28] -> 34.64 | AN25: =RC[-28] -> 36.89 | AO25: =RC[-28] -> 65.353333333333339 | AP25: - | AQ25: =RC[-29] -> 0 | AR25: =RC[-29] -> 0 | AS25: - | AT25: =RC[-30] -> 0 | AU25: =RC[-30] -> 0 | AV25: =RC[-30] -> 2.3666666666666667 | AW25: =RC[-30] -> 7.730666666666667 | AY25: - | AZ25: - | BA25: -
A26: =IF(RC[1]="","",DATEVALUE(RC[1])) -> 43378 | B26: 05.10.18 | C26: 24 | D26: 254.19 | E26: 64.849999999999994 | F26: 7 | G26: 222.87 | H26: 40.4 | I26: 5.97 | J26: =RC[-5]-RC[-2] -> 24.449999999999996 | K26: 31.32 | L26: 33.04 | M26: 64.77 | R26: 2.101 | S26: 7.4779999999999998 | T26: =(RC[-16]*RC[-15]-RC[-13]*RC[-12])/1000 -> 7.4802734999999991 | U26: 32.42 | V26: - | W26: =RC[-2]*RC[-10]/1000 -> 2.0998434000000001 | X26: =ABS((RC[-3]*RC[-11]-RC[-2]*RC[-9])/1000) -> #VALUE! | Y26: =(RC[-14]-RC[1])/RC[-18]*100 -> -0.49356126890115376 | Z26: 32.42 | AC26: =VALUE(RC[-27]) -> 2018-10-05T00:00:00.000 | AD26: =IF(RC[21]=42,"*",IF(RC[21]=32,"",RC[21])) -> - | AE26: =RC[-28] -> 24 | AF26: =RC[-28] -> 254.19 | AG26: =RC[-28] -> 64.849999999999994 | AH26: =RC[-28] -> 7 | AI26: =RC[-28] -> 222.87 | AJ26: =RC[-28] -> 40.4 | AK26: =RC[-28] -> 5.97 | AL26: =RC[-28] -> 24.449999999999996 | AM26: =RC[-28] -> 31.32 | AN26: =RC[-28] -> 33.04 | AO26: =RC[-28] -> 64.77 | AP26: - | AQ26: =RC[-29] -> 0 | AR26: =RC[-29] -> 0 | AS26: - | AT26: =RC[-30] -> 0 | AU26: =RC[-30] -> 0 | AV26: =RC[-30] -> 2.101 | AW26: =RC[-30] -> 7.4779999999999998 | AY26: - | AZ26: - | BA26: -
A27: =IF(RC[1]="","",DATEVALUE(RC[1])) -> 43379 | B27: 06.10.18 | C27: 24 | D27: 258.38 | E27: 65.459999999999994 | F27: 6.94 | G27: 224.81 | H27: 41.02 | I27: 5.9 | J27: =RC[-5]-RC[-2] -> 24.439999999999991 | K27: 33.57 | L27: 35.770000000000003 | M27: 65.53 | R27: 2.2989999999999999 | S27: 7.6890000000000001 | T27: =(RC[-16]*RC[-15]-RC[-13]*RC[-12])/1000 -> 7.6918485999999975 | U27: 35.08 | V27: - | W27: =RC[-2]*RC[-10]/1000 -> 2.2987924 | X27: =ABS((RC[-3]*RC[-11]-RC[-2]*RC[-9])/1000) -> #VALUE! | Y27: =(RC[-14]-RC[1])/RC[-18]*100 -> -0.67167830612517154 | Z27: 35.08 | AC27: =VALUE(RC[-27]) -> 2018-10-06T00:00:00.000 | AD27: =IF(RC[21]=42,"*",IF(RC[21]=32,"",RC[21])) -> - | AE27: =RC[-28] -> 24 | AF27: =RC[-28] -> 258.38 | AG27: =RC[-28] -> 65.459999999999994 | AH27: =RC[-28] -> 6.94 | AI27: =RC[-28] -> 224.81 | AJ27: =RC[-28] -> 41.02 | AK27: =RC[-28] -> 5.9 | AL27: =RC[-28] -> 24.439999999999991 | AM27: =RC[-28] -> 33.57 | AN27: =RC[-28] -> 35.770000000000003 | AO27: =RC[-28] -> 65.53 | AP27: - | AQ27: =RC[-29] -> 0 | AR27: =RC[-29] -> 0 | AS27: - | AT27: =RC[-30] -> 0 | AU27: =RC[-30] -> 0 | AV27: =RC[-30] -> 2.2989999999999999 | AW27: =RC[-30] -> 7.6890000000000001 | AY27: - | AZ27: - | BA27: -
A28: =IF(RC[1]="","",DATEVALUE(RC[1])) -> 43380 | B28: 07.10.18 | C28: 24 | D28: 260.8 | E28: 65.739999999999995 | F28: 6.93 | G28: 221.77 | H28: 41.1 | I28: 5.91 | J28: =RC[-5]-RC[-2] -> 24.639999999999993 | K28: 39.03 | L28: 41.86 | M28: 65.760000000000005 | R28: 2.7 | S28: 8.0250000000000004 | T28: =(RC[-16]*RC[-15]-RC[-13]*RC[-12])/1000 -> 8.0302449999999972 | U28: 41.05 | V28: - | W28: =RC[-2]*RC[-10]/1000 -> 2.6994479999999998 | X28: =ABS((RC[-3]*RC[-11]-RC[-2]*RC[-9])/1000) -> #VALUE! | Y28: =(RC[-14]-RC[1])/RC[-18]*100 -> -0.91085358704964414 | Z28: 41.05 | AC28: =VALUE(RC[-27]) -> 2018-10-07T00:00:00.000 | AD28: =IF(RC[21]=42,"*",IF(RC[21]=32,"",RC[21])) -> - | AE28: =RC[-28] -> 24 | AF28: =RC[-28] -> 260.8 | AG28: =RC[-28] -> 65.739999999999995 | AH28: =RC[-28] -> 6.93 | AI28: =RC[-28] -> 221.77 | AJ28: =RC[-28] -> 41.1 | AK28: =RC[-28] -> 5.91 | AL28: =RC[-28] -> 24.639999999999993 | AM28: =RC[-28] -> 39.03 | AN28: =RC[-28] -> 41.86 | AO28: =RC[-28] -> 65.760000000000005 | AP28: - | AQ28: =RC[-29] -> 0 | AR28: =RC[-29] -> 0 | AS28: - | AT28: =RC[-30] -> 0 | AU28: =RC[-30] -> 0 | AV28: =RC[-30] -> 2.7 | AW28: =RC[-30] -> 8.0250000000000004 | AY28: - | AZ28: - | BA28: -
A29: =IF(RC[1]="","",DATEVALUE(RC[1])) -> 43381 | B29: 08.10.18 | C29: 24 | D29: 254.93 | E29: 65.64 | F29: 6.91 | G29: 218.72 | H29: 40.53 | I29: 5.92 | J29: =RC[-5]-RC[-2] -> 25.11 | K29: 36.21 | L29: 38.159999999999997 | M29: 65.63 | R29: 2.46 | S29: 7.8680000000000003 | T29: =(RC[-16]*RC[-15]-RC[-13]*RC[-12])/1000 -> 7.8688836000000011 | U29: 37.42 | V29: - | W29: =RC[-2]*RC[-10]/1000 -> 2.4558746 | X29: =ABS((RC[-3]*RC[-11]-RC[-2]*RC[-9])/1000) -> #VALUE! | Y29: =(RC[-14]-RC[1])/RC[-18]*100 -> -0.55321872713972242 | Z29: 37.42 | AC29: =VALUE(RC[-27]) -> 2018-10-08T00:00:00.000 | AD29: =IF(RC[21]=42,"*",IF(RC[21]=32,"",RC[21])) -> - | AE29: =RC[-28] -> 24 | AF29: =RC[-28] -> 254.93 | AG29: =RC[-28] -> 65.64 | AH29: =RC[-28] -> 6.91 | AI29: =RC[-28] -> 218.72 | AJ29: =RC[-28] -> 40.53 | AK29: =RC[-28] -> 5.92 | AL29: =RC[-28] -> 25.11 | AM29: =RC[-28] -> 36.21 | AN29: =RC[-28] -> 38.159999999999997 | AO29: =RC[-28] -> 65.63 | AP29: - | AQ29: =RC[-29] -> 0 | AR29: =RC[-29] -> 0 | AS29: - | AT29: =RC[-30] -> 0 | AU29: =RC[-30] -> 0 | AV29: =RC[-30] -> 2.46 | AW29: =RC[-30] -> 7.8680000000000003 | AY29: - | AZ29: - | BA29: -
A30: =IF(RC[1]="","",DATEVALUE(RC[1])) -> 43382 | B30: 09.10.18 | C30: 24 | D30: 265.85000000000002 | E30: 65.58 | F30: 7.04 | G30: 230.64 | H30: 41.27 | I30: 5.94 | J30: =RC[-5]-RC[-2] -> 24.309999999999995 | K30: 35.21 | L30: 36.97 | M30: 65.66 | R30: 2.383 | S30: 7.915 | T30: =(RC[-16]*RC[-15]-RC[-13]*RC[-12])/1000 -> 7.9159301999999991 | U30: 36.25 | V30: - | W30: =RC[-2]*RC[-10]/1000 -> 2.3801749999999999 | X30: =ABS((RC[-3]*RC[-11]-RC[-2]*RC[-9])/1000) -> #VALUE! | Y30: =(RC[-14]-RC[1])/RC[-18]*100 -> -0.45091918140825499 | Z30: 36.25 | AC30: =VALUE(RC[-27]) -> 2018-10-09T00:00:00.000 | AD30: =IF(RC[21]=42,"*",IF(RC[21]=32,"",RC[21])) -> - | AE30: =RC[-28] -> 24 | AF30: =RC[-28] -> 265.85000000000002 | AG30: =RC[-28] -> 65.58 | AH30: =RC[-28] -> 7.04 | AI30: =RC[-28] -> 230.64 | AJ30: =RC[-28] -> 41.27 | AK30: =RC[-28] -> 5.94 | AL30: =RC[-28] -> 24.309999999999995 | AM30: =RC[-28] -> 35.21 | AN30: =RC[-28] -> 36.97 | AO30: =RC[-28] -> 65.66 | AP30: - | AQ30: =RC[-29] -> 0 | AR30: =RC[-29] -> 0 | AS30: - | AT30: =RC[-30] -> 0 | AU30: =RC[-30] -> 0 | AV30: =RC[-30] -> 2.383 | AW30: =RC[-30] -> 7.915 | AY30: - | AZ30: - | BA30: -
A31: =IF(RC[1]="","",DATEVALUE(RC[1])) -> 43383 | B31: 10.10.18 | C31: 24 | D31: 268.3 | E31: 66.58 | F31: 6.96 | G31: 232.62 | H31: 42.21 | I31: 5.84 | J31: =RC[-5]-RC[-2] -> 24.369999999999997 | K31: 35.68 | L31: 37.65 | M31: 66.739999999999995 | R31: 2.4620000000000002 | S31: 8.0440000000000005 | T31: =(RC[-16]*RC[-15]-RC[-13]*RC[-12])/1000 -> 8.0445238000000003 | U31: 36.909999999999997 | V31: - | W31: =RC[-2]*RC[-10]/1000 -> 2.4633733999999996 | X31: =ABS((RC[-3]*RC[-11]-RC[-2]*RC[-9])/1000) -> #VALUE! | Y31: =(RC[-14]-RC[1])/RC[-18]*100 -> -0.5287593500128952 | Z31: 36.909999999999997 | AC31: =VALUE(RC[-27]) -> 2018-10-10T00:00:00.000 | AD31: =IF(RC[21]=42,"*",IF(RC[21]=32,"",RC[21])) -> - | AE31: =RC[-28] -> 24 | AF31: =RC[-28] -> 268.3 | AG31: =RC[-28] -> 66.58 | AH31: =RC[-28] -> 6.96 | AI31: =RC[-28] -> 232.62 | AJ31: =RC[-28] -> 42.21 | AK31: =RC[-28] -> 5.84 | AL31: =RC[-28] -> 24.369999999999997 | AM31: =RC[-28] -> 35.68 | AN31: =RC[-28] -> 37.65 | AO31: =RC[-28] -> 66.739999999999995 | AP31: - | AQ31: =RC[-29] -> 0 | AR31: =RC[-29] -> 0 | AS31: - | AT31: =RC[-30] -> 0 | AU31: =RC[-30] -> 0 | AV31: =RC[-30] -> 2.4620000000000002 | AW31: =RC[-30] -> 8.0440000000000005 | AY31: - | AZ31: - | BA31: -
A32: =IF(RC[1]="","",DATEVALUE(RC[1])) -> 43384 | B32: 11.10.18 | C32: 24 | D32: 273.11 | E32: 67.680000000000007 | F32: 6.96 | G32: 239.73 | H32: 43.13 | I32: 5.77 | J32: =RC[-5]-RC[-2] -> 24.550000000000004 | K32: 33.380000000000003 | L32: 35.43 | M32: 67.7 | R32: 2.3519999999999999 | S32: 8.141 | T32: =(RC[-16]*RC[-15]-RC[-13]*RC[-12])/1000 -> 8.1445299000000038 | U32: 34.71 | V32: - | W32: =RC[-2]*RC[-10]/1000 -> 2.3498670000000002 | X32: =ABS((RC[-3]*RC[-11]-RC[-2]*RC[-9])/1000) -> #VALUE! | Y32: =(RC[-14]-RC[1])/RC[-18]*100 -> -0.55479080632378019 | Z32: 34.71 | AC32: =VALUE(RC[-27]) -> 2018-10-11T00:00:00.000 | AD32: =IF(RC[21]=42,"*",IF(RC[21]=32,"",RC[21])) -> - | AE32: =RC[-28] -> 24 | AF32: =RC[-28] -> 273.11 | AG32: =RC[-28] -> 67.680000000000007 | AH32: =RC[-28] -> 6.96 | AI32: =RC[-28] -> 239.73 | AJ32: =RC[-28] -> 43.13 | AK32: =RC[-28] -> 5.77 | AL32: =RC[-28] -> 24.550000000000004 | AM32: =RC[-28] -> 33.380000000000003 | AN32: =RC[-28] -> 35.43 | AO32: =RC[-28] -> 67.7 | AP32: - | AQ32: =RC[-29] -> 0 | AR32: =RC[-29] -> 0 | AS32: - | AT32: =RC[-30] -> 0 | AU32: =RC[-30] -> 0 | AV32: =RC[-30] -> 2.3519999999999999 | AW32: =RC[-30] -> 8.141 | AY32: - | AZ32: - | BA32: -
A33: =IF(RC[1]="","",DATEVALUE(RC[1])) -> 43385 | B33: 12.10.18 | C33: 24 | D33: 268.3 | E33: 67.540000000000006 | F33: 6.97 | G33: 236.46 | H33: 42.7 | I33: 5.81 | J33: =RC[-5]-RC[-2] -> 24.840000000000003 | K33: 31.84 | L33: 33.99 | M33: 67.459999999999994 | R33: 2.2469999999999999 | S33: 8.0190000000000001 | T33: =(RC[-16]*RC[-15]-RC[-13]*RC[-12])/1000 -> 8.0241400000000027 | U33: 33.32 | V33: - | W33: =RC[-2]*RC[-10]/1000 -> 2.2477671999999997 | X33: =ABS((RC[-3]*RC[-11]-RC[-2]*RC[-9])/1000) -> #VALUE! | Y33: =(RC[-14]-RC[1])/RC[-18]*100 -> -0.62589867207984451 | Z33: 33.32 | AC33: =VALUE(RC[-27]) -> 2018-10-12T00:00:00.000 | AD33: =IF(RC[21]=42,"*",IF(RC[21]=32,"",RC[21])) -> - | AE33: =RC[-28] -> 24 | AF33: =RC[-28] -> 268.3 | AG33: =RC[-28] -> 67.540000000000006 | AH33: =RC[-28] -> 6.97 | AI33: =RC[-28] -> 236.46 | AJ33: =RC[-28] -> 42.7 | AK33: =RC[-28] -> 5.81 | AL33: =RC[-28] -> 24.840000000000003 | AM33: =RC[-28] -> 31.84 | AN33: =RC[-28] -> 33.99 | AO33: =RC[-28] -> 67.459999999999994 | AP33: - | AQ33: =RC[-29] -> 0 | AR33: =RC[-29] -> 0 | AS33: - | AT33: =RC[-30] -> 0 | AU33: =RC[-30] -> 0 | AV33: =RC[-30] -> 2.2469999999999999 | AW33: =RC[-30] -> 8.0190000000000001 | AY33: - | AZ33: - | BA33: -
A34: =IF(RC[1]="","",DATEVALUE(RC[1])) -> 43386 | B34: 13.10.18 | C34: 24 | D34: 284.3 | E34: 68.66 | F34: 7.1 | G34: 249.22 | H34: 44.33 | I34: 5.81 | J34: =RC[-5]-RC[-2] -> 24.33 | K34: 35.08 | L34: 37.92 | M34: 68.73 | R34: 2.5529999999999999 | S34: 8.4719999999999995 | T34: =(RC[-16]*RC[-15]-RC[-13]*RC[-12])/1000 -> 8.4721153999999999 | U34: 37.119999999999997 | V34: - | W34: =RC[-2]*RC[-10]/1000 -> 2.5512576 | X34: =ABS((RC[-3]*RC[-11]-RC[-2]*RC[-9])/1000) -> #VALUE! | Y34: =(RC[-14]-RC[1])/RC[-18]*100 -> -0.81855388813096819 | Z34: 37.119999999999997 | AC34: =VALUE(RC[-27]) -> 2018-10-13T00:00:00.000 | AD34: =IF(RC[21]=42,"*",IF(RC[21]=32,"",RC[21])) -> - | AE34: =RC[-28] -> 24 | AF34: =RC[-28] -> 284.3 | AG34: =RC[-28] -> 68.66 | AH34: =RC[-28] -> 7.1 | AI34: =RC[-28] -> 249.22 | AJ34: =RC[-28] -> 44.33 | AK34: =RC[-28] -> 5.81 | AL34: =RC[-28] -> 24.33 | AM34: =RC[-28] -> 35.08 | AN34: =RC[-28] -> 37.92 | AO34: =RC[-28] -> 68.73 | AP34: - | AQ34: =RC[-29] -> 0 | AR34: =RC[-29] -> 0 | AS34: - | AT34: =RC[-30] -> 0 | AU34: =RC[-30] -> 0 | AV34: =RC[-30] -> 2.5529999999999999 | AW34: =RC[-30] -> 8.4719999999999995 | AY34: - | AZ34: - | BA34: -
A35: =IF(RC[1]="","",DATEVALUE(RC[1])) -> 43387 | B35: 14.10.18 | C35: 24 | D35: 287.24 | E35: 69.45 | F35: 7.06 | G35: 253.05 | H35: 45.46 | I35: 5.72 | J35: =RC[-5]-RC[-2] -> 23.990000000000002 | K35: 34.19 | L35: 36.92 | M35: 69.56 | R35: 2.516 | S35: 8.4440000000000008 | T35: =(RC[-16]*RC[-15]-RC[-13]*RC[-12])/1000 -> 8.4451650000000029 | U35: 36.130000000000003 | V35: - | W35: =RC[-2]*RC[-10]/1000 -> 2.5132028000000006 | X35: =ABS((RC[-3]*RC[-11]-RC[-2]*RC[-9])/1000) -> #VALUE! | Y35: =(RC[-14]-RC[1])/RC[-18]*100 -> -0.76664690772574773 | Z35: 36.130000000000003 | AC35: =VALUE(RC[-27]) -> 2018-10-14T00:00:00.000 | AD35: =IF(RC[21]=42,"*",IF(RC[21]=32,"",RC[21])) -> - | AE35: =RC[-28] -> 24 | AF35: =RC[-28] -> 287.24 | AG35: =RC[-28] -> 69.45 | AH35: =RC[-28] -> 7.06 | AI35: =RC[-28] -> 253.05 | AJ35: =RC[-28] -> 45.46 | AK35: =RC[-28] -> 5.72 | AL35: =RC[-28] -> 23.990000000000002 | AM35: =RC[-28] -> 34.19 | AN35: =RC[-28] -> 36.92 | AO35: =RC[-28] -> 69.56 | AP35: - | AQ35: =RC[-29] -> 0 | AR35: =RC[-29] -> 0 | AS35: - | AT35: =RC[-30] -> 0 | AU35: =RC[-30] -> 0 | AV35: =RC[-30] -> 2.516 | AW35: =RC[-30] -> 8.4440000000000008 | AY35: - | AZ35: - | BA35: -
A36: =IF(RC[1]="","",DATEVALUE(RC[1])) -> 43388 | B36: 15.10.18 | C36: 24 | D36: 293.95 | E36: 69.05 | F36: 7.14 | G36: 261.83 | H36: 46.1 | I36: 5.71 | J36: =RC[-5]-RC[-2] -> 22.949999999999996 | K36: 32.119999999999997 | L36: 34.630000000000003 | M36: 69.05 | R36: 2.3410000000000002 | S36: 8.2279999999999998 | T36: =(RC[-16]*RC[-15]-RC[-13]*RC[-12])/1000 -> 8.2268844999999988 | U36: 33.9 | V36: - | W36: =RC[-2]*RC[-10]/1000 -> 2.3407949999999995 | X36: =ABS((RC[-3]*RC[-11]-RC[-2]*RC[-9])/1000) -> #VALUE! | Y36: =(RC[-14]-RC[1])/RC[-18]*100 -> -0.67983042432112484 | Z36: 33.9 | AC36: =VALUE(RC[-27]) -> 2018-10-15T00:00:00.000 | AD36: =IF(RC[21]=42,"*",IF(RC[21]=32,"",RC[21])) -> - | AE36: =RC[-28] -> 24 | AF36: =RC[-28] -> 293.95 | AG36: =RC[-28] -> 69.05 | AH36: =RC[-28] -> 7.14 | AI36: =RC[-28] -> 261.83 | AJ36: =RC[-28] -> 46.1 | AK36: =RC[-28] -> 5.71 | AL36: =RC[-28] -> 22.949999999999996 | AM36: =RC[-28] -> 32.119999999999997 | AN36: =RC[-28] -> 34.630000000000003 | AO36: =RC[-28] -> 69.05 | AP36: - | AQ36: =RC[-29] -> 0 | AR36: =RC[-29] -> 0 | AS36: - | AT36: =RC[-30] -> 0 | AU36: =RC[-30] -> 0 | AV36: =RC[-30] -> 2.3410000000000002 | AW36: =RC[-30] -> 8.2279999999999998 | AY36: - | AZ36: - | BA36: -
A37: =IF(RC[1]="","",DATEVALUE(RC[1])) -> 43389 | B37: 16.10.18 | C37: 24 | D37: 295.01 | E37: 69.09 | F37: 7.11 | G37: 264.64999999999998 | H37: 46.2 | I37: 5.65 | J37: 22.89 | K37: 30.36 | L37: 32.880000000000003 | M37: 69.02 | R37: 2.222 | S37: 8.1560000000000006 | T37: 8.1554109000000015 | U37: 32.18 | V37: - | W37: 2.2210635999999999 | X37: #VALUE! | Y37: -0.68770073682221822 | Z37: 32.18 | AC37: =VALUE(RC[-27]) -> 2018-10-16T00:00:00.000 | AD37: =IF(RC[21]=42,"*",IF(RC[21]=32,"",RC[21])) ->  | AE37: =RC[-28] -> 24 | AF37: =RC[-28] -> 295.01 | AG37: =RC[-28] -> 69.09 | AH37: =RC[-28] -> 7.11 | AI37: =RC[-28] -> 264.64999999999998 | AJ37: =RC[-28] -> 46.2 | AK37: =RC[-28] -> 5.65 | AL37: =RC[-28] -> 22.89 | AM37: =RC[-28] -> 30.36 | AN37: =RC[-28] -> 32.880000000000003 | AO37: =RC[-28] -> 69.02 | AP37: - | AQ37: =RC[-29] -> 0 | AR37: =RC[-29] -> 0 | AS37: - | AT37: =RC[-30] -> 0 | AU37: =RC[-30] -> 0 | AV37: =RC[-30] -> 2.222 | AW37: =RC[-30] -> 8.1560000000000006
A38: =IF(RC[1]="","",DATEVALUE(RC[1])) -> 43390 | B38: 17.10.18 | C38: 24 | D38: 304.14999999999998 | E38: 69.290000000000006 | F38: 7.16 | G38: 270.55 | H38: 46.64 | I38: 5.63 | J38: 22.650000000000006 | K38: 33.6 | L38: 35.950000000000003 | M38: 69.34 | R38: 2.4409999999999998 | S38: 8.4600000000000009 | T38: 8.4561015000000008 | U38: 35.159999999999997 | V38: - | W38: 2.4379944 | X38: #VALUE! | Y38: -0.57660321567177797 | Z38: 35.159999999999997 | AC38: =VALUE(RC[-27]) -> 2018-10-17T00:00:00.000 | AD38: =IF(RC[21]=42,"*",IF(RC[21]=32,"",RC[21])) ->  | AE38: =RC[-28] -> 24 | AF38: =RC[-28] -> 304.14999999999998 | AG38: =RC[-28] -> 69.290000000000006 | AH38: =RC[-28] -> 7.16 | AI38: =RC[-28] -> 270.55 | AJ38: =RC[-28] -> 46.64 | AK38: =RC[-28] -> 5.63 | AL38: =RC[-28] -> 22.650000000000006 | AM38: =RC[-28] -> 33.6 | AN38: =RC[-28] -> 35.950000000000003 | AO38: =RC[-28] -> 69.34 | AP38: - | AQ38: =RC[-29] -> 0 | AR38: =RC[-29] -> 0 | AS38: - | AT38: =RC[-30] -> 0 | AU38: =RC[-30] -> 0 | AV38: =RC[-30] -> 2.4409999999999998 | AW38: =RC[-30] -> 8.4600000000000009
A39: =IF(RC[1]="","",DATEVALUE(RC[1])) -> 43391 | B39: 18.10.18 | C39: 24 | D39: 303.10000000000002 | E39: 69.739999999999995 | F39: 7.2 | G39: 270.93 | H39: 46.88 | I39: 5.66 | J39: 22.859999999999992 | K39: 32.17 | L39: 34.65 | M39: 69.75 | R39: 2.37 | S39: 8.4390000000000001 | T39: 8.4369955999999977 | U39: 33.92 | V39: - | W39: 2.36592 | X39: #VALUE! | Y39: -0.64592330122171782 | Z39: 33.92 | AC39: =VALUE(RC[-27]) -> 2018-10-18T00:00:00.000 | AD39: =IF(RC[21]=42,"*",IF(RC[21]=32,"",RC[21])) ->  | AE39: =RC[-28] -> 24 | AF39: =RC[-28] -> 303.10000000000002 | AG39: =RC[-28] -> 69.739999999999995 | AH39: =RC[-28] -> 7.2 | AI39: =RC[-28] -> 270.93 | AJ39: =RC[-28] -> 46.88 | AK39: =RC[-28] -> 5.66 | AL39: =RC[-28] -> 22.859999999999992 | AM39: =RC[-28] -> 32.17 | AN39: =RC[-28] -> 34.65 | AO39: =RC[-28] -> 69.75 | AP39: - | AQ39: =RC[-29] -> 0 | AR39: =RC[-29] -> 0 | AS39: - | AT39: =RC[-30] -> 0 | AU39: =RC[-30] -> 0 | AV39: =RC[-30] -> 2.37 | AW39: =RC[-30] -> 8.4390000000000001
A40: =IF(RC[1]="","",DATEVALUE(RC[1])) -> 43392 | B40: 19.10.18 | C40: 24 | D40: 301.33999999999997 | E40: 69.56 | F40: 7.22 | G40: 271.05 | H40: 46.57 | I40: 5.68 | J40: 22.990000000000002 | K40: 30.29 | L40: 32.880000000000003 | M40: 69.459999999999994 | R40: 2.2320000000000002 | S40: 8.3379999999999992 | T40: 8.3384118999999988 | U40: 32.159999999999997 | V40: - | W40: 2.2338335999999996 | X40: #VALUE! | Y40: -0.68990961077291912 | Z40: 32.159999999999997 | AC40: =VALUE(RC[-27]) -> 2018-10-19T00:00:00.000 | AD40: =IF(RC[21]=42,"*",IF(RC[21]=32,"",RC[21])) ->  | AE40: =RC[-28] -> 24 | AF40: =RC[-28] -> 301.33999999999997 | AG40: =RC[-28] -> 69.56 | AH40: =RC[-28] -> 7.22 | AI40: =RC[-28] -> 271.05 | AJ40: =RC[-28] -> 46.57 | AK40: =RC[-28] -> 5.68 | AL40: =RC[-28] -> 22.990000000000002 | AM40: =RC[-28] -> 30.29 | AN40: =RC[-28] -> 32.880000000000003 | AO40: =RC[-28] -> 69.459999999999994 | AP40: - | AQ40: =RC[-29] -> 0 | AR40: =RC[-29] -> 0 | AS40: - | AT40: =RC[-30] -> 0 | AU40: =RC[-30] -> 0 | AV40: =RC[-30] -> 2.2320000000000002 | AW40: =RC[-30] -> 8.3379999999999992
A41: =IF(RC[1]="","",DATEVALUE(RC[1])) -> 43393 | B41: 20.10.18 | C41: 24 | D41: 288.26 | E41: 68.849999999999994 | F41: 7.1 | G41: 256.43 | H41: 45.09 | I41: 5.73 | J41: 23.759999999999991 | K41: 31.83 | L41: 34.47 | M41: 68.91 | R41: 2.327 | S41: 8.2829999999999995 | T41: 8.284272299999996 | U41: 33.74 | V41: - | W41: 2.3250234000000001 | X41: #VALUE! | Y41: -0.74484264711617343 | Z41: 33.74 | AC41: =VALUE(RC[-27]) -> 2018-10-20T00:00:00.000 | AD41: =IF(RC[21]=42,"*",IF(RC[21]=32,"",RC[21])) ->  | AE41: =RC[-28] -> 24 | AF41: =RC[-28] -> 288.26 | AG41: =RC[-28] -> 68.849999999999994 | AH41: =RC[-28] -> 7.1 | AI41: =RC[-28] -> 256.43 | AJ41: =RC[-28] -> 45.09 | AK41: =RC[-28] -> 5.73 | AL41: =RC[-28] -> 23.759999999999991 | AM41: =RC[-28] -> 31.83 | AN41: =RC[-28] -> 34.47 | AO41: =RC[-28] -> 68.91 | AP41: - | AQ41: =RC[-29] -> 0 | AR41: =RC[-29] -> 0 | AS41: - | AT41: =RC[-30] -> 0 | AU41: =RC[-30] -> 0 | AV41: =RC[-30] -> 2.327 | AW41: =RC[-30] -> 8.2829999999999995
A42: =IF(RC[1]="","",DATEVALUE(RC[1])) -> 43394 | B42: 21.10.18 | C42: 24 | D42: 290.43 | E42: 68.03 | F42: 7.1 | G42: 253.77 | H42: 44.43 | I42: 5.75 | J42: 23.6 | K42: 36.659999999999997 | L42: 39.35 | M42: 67.97 | R42: 2.62 | S42: 8.4819999999999993 | T42: 8.4829518000000004 | U42: 38.54 | V42: - | W42: 2.6195637999999999 | X42: #VALUE! | Y42: -0.74082830909879127 | Z42: 38.54 | AC42: =VALUE(RC[-27]) -> 2018-10-21T00:00:00.000 | AD42: =IF(RC[21]=42,"*",IF(RC[21]=32,"",RC[21])) ->  | AE42: =RC[-28] -> 24 | AF42: =RC[-28] -> 290.43 | AG42: =RC[-28] -> 68.03 | AH42: =RC[-28] -> 7.1 | AI42: =RC[-28] -> 253.77 | AJ42: =RC[-28] -> 44.43 | AK42: =RC[-28] -> 5.75 | AL42: =RC[-28] -> 23.6 | AM42: =RC[-28] -> 36.659999999999997 | AN42: =RC[-28] -> 39.35 | AO42: =RC[-28] -> 67.97 | AP42: - | AQ42: =RC[-29] -> 0 | AR42: =RC[-29] -> 0 | AS42: - | AT42: =RC[-30] -> 0 | AU42: =RC[-30] -> 0 | AV42: =RC[-30] -> 2.62 | AW42: =RC[-30] -> 8.4819999999999993
A43: =IF(RC[1]="","",DATEVALUE(RC[1])) -> 43395 | B43: 22.10.18 | C43: 24 | D43: 286.39999999999998 | E43: 68.400000000000006 | F43: 7.11 | G43: 251.85 | H43: 44.31 | I43: 5.79 | J43: 24.090000000000003 | K43: 34.549999999999997 | L43: 36.619999999999997 | M43: 68.55 | R43: 2.4580000000000002 | S43: 8.4280000000000008 | T43: 8.4302864999999976 | U43: 35.86 | V43: - | W43: 2.4582030000000001 | X43: #VALUE! | Y43: -0.52015088346237937 | Z43: 35.86 | AC43: =VALUE(RC[-27]) -> 2018-10-22T00:00:00.000 | AD43: =IF(RC[21]=42,"*",IF(RC[21]=32,"",RC[21])) ->  | AE43: =RC[-28] -> 24 | AF43: =RC[-28] -> 286.39999999999998 | AG43: =RC[-28] -> 68.400000000000006 | AH43: =RC[-28] -> 7.11 | AI43: =RC[-28] -> 251.85 | AJ43: =RC[-28] -> 44.31 | AK43: =RC[-28] -> 5.79 | AL43: =RC[-28] -> 24.090000000000003 | AM43: =RC[-28] -> 34.549999999999997 | AN43: =RC[-28] -> 36.619999999999997 | AO43: =RC[-28] -> 68.55 | AP43: - | AQ43: =RC[-29] -> 0 | AR43: =RC[-29] -> 0 | AS43: - | AT43: =RC[-30] -> 0 | AU43: =RC[-30] -> 0 | AV43: =RC[-30] -> 2.4580000000000002 | AW43: =RC[-30] -> 8.4280000000000008
A44: =IF(RC[1]="","",DATEVALUE(RC[1])) ->  | C44: 24 | J44: =RC[-5]-RC[-2] -> #VALUE! | T44: =(RC[-16]*RC[-15]-RC[-13]*RC[-12])/1000 -> #VALUE! | W44: =RC[-2]*RC[-10]/1000 -> #VALUE! | X44: =ABS((RC[-3]*RC[-11]-RC[-2]*RC[-9])/1000) -> #VALUE! | Y44: =(RC[-14]-RC[1])/RC[-18]*100 -> #VALUE! | AC44: =VALUE(RC[-27]) -> #VALUE! | AD44: =IF(RC[21]=42,"*",IF(RC[21]=32,"",RC[21])) ->  | AE44: =RC[-28] -> 24 | AF44: =RC[-28] ->  | AG44: =RC[-28] ->  | AH44: =RC[-28] ->  | AI44: =RC[-28] ->  | AJ44: =RC[-28] ->  | AK44: =RC[-28] ->  | AL44: =RC[-28] -> #VALUE! | AM44: =RC[-28] ->  | AN44: =RC[-28] ->  | AO44: =RC[-28] ->  | AP44: - | AQ44: =RC[-29] -> 0 | AR44: =RC[-29] -> 0 | AS44: - | AT44: =RC[-30] -> 0 | AU44: =RC[-30] -> 0 | AV44: =RC[-30] ->  | AW44: =RC[-30] -> 
A45: =IF(RC[1]="","",DATEVALUE(RC[1])) ->  | C45: 24 | T45: =(RC[-16]*RC[-15]-RC[-13]*RC[-12])/1000 -> #VALUE! | W45: =RC[-2]*RC[-10]/1000 -> #VALUE! | X45: =ABS((RC[-3]*RC[-11]-RC[-2]*RC[-9])/1000) -> #VALUE! | Y45: =(RC[-14]-RC[1])/RC[-18]*100 -> #VALUE! | AC45: =VALUE(RC[-27]) -> #VALUE! | AD45: =IF(RC[21]=42,"*",IF(RC[21]=32,"",RC[21])) ->  | AE45: =RC[-28] -> 24 | AF45: =RC[-28] ->  | AG45: =RC[-28] ->  | AH45: =RC[-28] ->  | AI45: =RC[-28] ->  | AJ45: =RC[-28] ->  | AK45: =RC[-28] ->  | AL45: =RC[-28] -> 0 | AM45: =RC[-28] ->  | AN45: =RC[-28] ->  | AO45: =RC[-28] ->  | AP45: - | AQ45: =RC[-29] -> 0 | AR45: =RC[-29] -> 0 | AS45: - | AT45: =RC[-30] -> 0 | AU45: =RC[-30] -> 0 | AV45: =RC[-30] ->  | AW45: =RC[-30] -> 
A46: =IF(RC[1]="","",DATEVALUE(RC[1])) ->  | C46: 24 | T46: =(RC[-16]*RC[-15]-RC[-13]*RC[-12])/1000 -> #VALUE! | W46: =RC[-2]*RC[-10]/1000 -> #VALUE! | X46: =ABS((RC[-3]*RC[-11]-RC[-2]*RC[-9])/1000) -> #VALUE! | Y46: =(RC[-14]-RC[1])/RC[-18]*100 -> #VALUE! | AC46: =VALUE(RC[-27]) -> #VALUE! | AD46: =IF(RC[21]=42,"*",IF(RC[21]=32,"",RC[21])) ->  | AE46: =RC[-28] -> 24 | AF46: =RC[-28] ->  | AG46: =RC[-28] ->  | AH46: =RC[-28] ->  | AI46: =RC[-28] ->  | AJ46: =RC[-28] ->  | AK46: =RC[-28] ->  | AL46: =RC[-28] -> 0 | AM46: =RC[-28] ->  | AN46: =RC[-28] ->  | AO46: =RC[-28] ->  | AP46: - | AQ46: =RC[-29] -> 0 | AR46: =RC[-29] -> 0 | AS46: - | AT46: =RC[-30] -> 0 | AU46: =RC[-30] -> 0 | AV46: =RC[-30] ->  | AW46: =RC[-30] -> 
A47: =IF(RC[1]="","",DATEVALUE(RC[1])) ->  | C47: 24 | T47: =(RC[-16]*RC[-15]-RC[-13]*RC[-12])/1000 -> #VALUE! | W47: =RC[-2]*RC[-10]/1000 -> #VALUE! | X47: =ABS((RC[-3]*RC[-11]-RC[-2]*RC[-9])/1000) -> #VALUE! | Y47: =(RC[-14]-RC[1])/RC[-18]*100 -> #VALUE! | AC47: =VALUE(RC[-27]) -> #VALUE! | AD47: =IF(RC[21]=42,"*",IF(RC[21]=32,"",RC[21])) ->  | AE47: =RC[-28] -> 24 | AF47: =RC[-28] ->  | AG47: =RC[-28] ->  | AH47: =RC[-28] ->  | AI47: =RC[-28] ->  | AJ47: =RC[-28] ->  | AK47: =RC[-28] ->  | AL47: =RC[-28] -> 0 | AM47: =RC[-28] ->  | AN47: =RC[-28] ->  | AO47: =RC[-28] ->  | AP47: - | AQ47: =RC[-29] -> 0 | AR47: =RC[-29] -> 0 | AS47: - | AT47: =RC[-30] -> 0 | AU47: =RC[-30] -> 0 | AV47: =RC[-30] ->  | AW47: =RC[-30] -> 
A48: =IF(RC[1]="","",DATEVALUE(RC[1])) ->  | C48: 24 | T48: =(RC[-16]*RC[-15]-RC[-13]*RC[-12])/1000 -> #VALUE! | W48: =RC[-2]*RC[-10]/1000 -> #VALUE! | X48: =ABS((RC[-3]*RC[-11]-RC[-2]*RC[-9])/1000) -> #VALUE! | Y48: =(RC[-14]-RC[1])/RC[-18]*100 -> #VALUE! | AC48: =VALUE(RC[-27]) -> #VALUE! | AD48: =IF(RC[21]=42,"*",IF(RC[21]=32,"",RC[21])) ->  | AE48: =RC[-28] -> 24 | AF48: =RC[-28] ->  | AG48: =RC[-28] ->  | AH48: =RC[-28] ->  | AI48: =RC[-28] ->  | AJ48: =RC[-28] ->  | AK48: =RC[-28] ->  | AL48: =RC[-28] -> 0 | AM48: =RC[-28] ->  | AN48: =RC[-28] ->  | AO48: =RC[-28] ->  | AP48: - | AQ48: =RC[-29] -> 0 | AR48: =RC[-29] -> 0 | AS48: - | AT48: =RC[-30] -> 0 | AU48: =RC[-30] -> 0 | AV48: =RC[-30] ->  | AW48: =RC[-30] -> 
A49: =IF(RC[1]="","",DATEVALUE(RC[1])) ->  | C49: 24 | T49: =(RC[-16]*RC[-15]-RC[-13]*RC[-12])/1000 -> #VALUE! | W49: =RC[-2]*RC[-10]/1000 -> #VALUE! | X49: =ABS((RC[-3]*RC[-11]-RC[-2]*RC[-9])/1000) -> #VALUE! | Y49: =(RC[-14]-RC[1])/RC[-18]*100 -> #VALUE! | AC49: =VALUE(RC[-27]) -> #VALUE! | AD49: =IF(RC[21]=42,"*",IF(RC[21]=32,"",RC[21])) ->  | AE49: =RC[-28] -> 24 | AF49: =RC[-28] ->  | AG49: =RC[-28] ->  | AH49: =RC[-28] ->  | AI49: =RC[-28] ->  | AJ49: =RC[-28] ->  | AK49: =RC[-28] ->  | AL49: =RC[-28] -> 0 | AM49: =RC[-28] ->  | AN49: =RC[-28] ->  | AO49: =RC[-28] ->  | AP49: - | AQ49: =RC[-29] -> 0 | AR49: =RC[-29] -> 0 | AS49: - | AT49: =RC[-30] -> 0 | AU49: =RC[-30] -> 0 | AV49: =RC[-30] ->  | AW49: =RC[-30] -> 
A50: =IF(RC[1]="","",DATEVALUE(RC[1])) ->  | T50: =(RC[-16]*RC[-15]-RC[-13]*RC[-12])/1000 -> #VALUE! | W50: =RC[-2]*RC[-10]/1000 -> #VALUE! | X50: =ABS((RC[-3]*RC[-11]-RC[-2]*RC[-9])/1000) -> #VALUE! | Y50: =(RC[-14]-RC[1])/RC[-18]*100 -> #VALUE! | AC50: =VALUE(RC[-27]) -> #VALUE! | AD50: =IF(RC[21]=42,"*",IF(RC[21]=32,"",RC[21])) ->  | AE50: =RC[-28] ->  | AF50: =RC[-28] ->  | AG50: =RC[-28] ->  | AH50: =RC[-28] ->  | AI50: =RC[-28] ->  | AJ50: =RC[-28] ->  | AK50: =RC[-28] ->  | AL50: =RC[-28] -> 0 | AM50: =RC[-28] ->  | AN50: =RC[-28] ->  | AO50: =RC[-28] ->  | AP50: - | AQ50: =RC[-29] -> 0 | AR50: =RC[-29] -> 0 | AS50: - | AT50: =RC[-30] -> 0 | AU50: =RC[-30] -> 0 | AV50: =RC[-30] ->  | AW50: =RC[-30] -> 
A51: =IF(RC[1]="","",DATEVALUE(RC[1])) ->  | T51: =(RC[-16]*RC[-15]-RC[-13]*RC[-12])/1000 -> #VALUE! | W51: =RC[-2]*RC[-10]/1000 -> #VALUE! | X51: =ABS((RC[-3]*RC[-11]-RC[-2]*RC[-9])/1000) -> #VALUE! | Y51: =(RC[-14]-RC[1])/RC[-18]*100 -> #VALUE! | AC51: =VALUE(RC[-27]) -> #VALUE! | AD51: =IF(RC[21]=42,"*",IF(RC[21]=32,"",RC[21])) ->  | AE51: =RC[-28] ->  | AF51: =RC[-28] ->  | AG51: =RC[-28] ->  | AH51: =RC[-28] ->  | AI51: =RC[-28] ->  | AJ51: =RC[-28] ->  | AK51: =RC[-28] ->  | AL51: =RC[-28] -> 0 | AM51: =RC[-28] ->  | AN51: =RC[-28] ->  | AO51: =RC[-28] ->  | AP51: - | AQ51: =RC[-29] -> 0 | AR51: =RC[-29] -> 0 | AS51: - | AT51: =RC[-30] -> 0 | AU51: =RC[-30] -> 0 | AV51: =RC[-30] ->  | AW51: =RC[-30] -> 
A52: =IF(RC[1]="","",DATEVALUE(RC[1])) ->  | T52: =(RC[-16]*RC[-15]-RC[-13]*RC[-12])/1000 -> #VALUE! | W52: =RC[-2]*RC[-10]/1000 -> #VALUE! | X52: =ABS((RC[-3]*RC[-11]-RC[-2]*RC[-9])/1000) -> #VALUE! | Y52: =(RC[-14]-RC[1])/RC[-18]*100 -> #VALUE! | AC52: =VALUE(RC[-27]) -> #VALUE! | AD52: =IF(RC[21]=42,"*",IF(RC[21]=32,"",RC[21])) ->  | AE52: =RC[-28] ->  | AF52: =RC[-28] ->  | AG52: =RC[-28] ->  | AH52: =RC[-28] ->  | AI52: =RC[-28] ->  | AJ52: =RC[-28] ->  | AK52: =RC[-28] ->  | AL52: =RC[-28] -> 0 | AM52: =RC[-28] ->  | AN52: =RC[-28] ->  | AO52: =RC[-28] ->  | AP52: - | AQ52: =RC[-29] -> 0 | AR52: =RC[-29] -> 0 | AS52: - | AT52: =RC[-30] -> 0 | AU52: =RC[-30] -> 0 | AV52: =RC[-30] ->  | AW52: =RC[-30] -> 
A53: =IF(RC[1]="","",DATEVALUE(RC[1])) ->  | T53: =(RC[-16]*RC[-15]-RC[-13]*RC[-12])/1000 -> #VALUE! | W53: =RC[-2]*RC[-10]/1000 -> #VALUE! | X53: =ABS((RC[-3]*RC[-11]-RC[-2]*RC[-9])/1000) -> #VALUE! | Y53: =(RC[-14]-RC[1])/RC[-18]*100 -> #VALUE! | AC53: =VALUE(RC[-27]) -> #VALUE! | AD53: =IF(RC[21]=42,"*",IF(RC[21]=32,"",RC[21])) ->  | AE53: =RC[-28] ->  | AF53: =RC[-28] ->  | AG53: =RC[-28] ->  | AH53: =RC[-28] ->  | AI53: =RC[-28] ->  | AJ53: =RC[-28] ->  | AK53: =RC[-28] ->  | AL53: =RC[-28] -> 0 | AM53: =RC[-28] ->  | AN53: =RC[-28] ->  | AO53: =RC[-28] ->  | AP53: - | AQ53: =RC[-29] -> 0 | AR53: =RC[-29] -> 0 | AS53: - | AT53: =RC[-30] -> 0 | AU53: =RC[-30] -> 0 | AV53: =RC[-30] ->  | AW53: =RC[-30] -> 
A54: =IF(RC[1]="","",DATEVALUE(RC[1])) ->  | T54: =(RC[-16]*RC[-15]-RC[-13]*RC[-12])/1000 -> #VALUE! | W54: =RC[-2]*RC[-10]/1000 -> #VALUE! | X54: =ABS((RC[-3]*RC[-11]-RC[-2]*RC[-9])/1000) -> #VALUE! | Y54: =(RC[-14]-RC[1])/RC[-18]*100 -> #VALUE! | AC54: =VALUE(RC[-27]) -> #VALUE! | AD54: =IF(RC[21]=42,"*",IF(RC[21]=32,"",RC[21])) ->  | AE54: =RC[-28] ->  | AF54: =RC[-28] ->  | AG54: =RC[-28] ->  | AH54: =RC[-28] ->  | AI54: =RC[-28] ->  | AJ54: =RC[-28] ->  | AK54: =RC[-28] ->  | AL54: =RC[-28] -> 0 | AM54: =RC[-28] ->  | AN54: =RC[-28] ->  | AO54: =RC[-28] ->  | AP54: - | AQ54: =RC[-29] -> 0 | AR54: =RC[-29] -> 0 | AS54: - | AT54: =RC[-30] -> 0 | AU54: =RC[-30] -> 0 | AV54: =RC[-30] ->  | AW54: =RC[-30] -> 
A55: =IF(RC[1]="","",DATEVALUE(RC[1])) ->  | T55: =(RC[-16]*RC[-15]-RC[-13]*RC[-12])/1000 -> #VALUE! | W55: =RC[-2]*RC[-10]/1000 -> #VALUE! | X55: =ABS((RC[-3]*RC[-11]-RC[-2]*RC[-9])/1000) -> #VALUE! | Y55: =(RC[-14]-RC[1])/RC[-18]*100 -> #VALUE! | AC55: =VALUE(RC[-27]) -> #VALUE! | AD55: =IF(RC[21]=42,"*",IF(RC[21]=32,"",RC[21])) ->  | AE55: =RC[-28] ->  | AF55: =RC[-28] ->  | AG55: =RC[-28] ->  | AH55: =RC[-28] ->  | AI55: =RC[-28] ->  | AJ55: =RC[-28] ->  | AK55: =RC[-28] ->  | AL55: =RC[-28] -> 0 | AM55: =RC[-28] ->  | AN55: =RC[-28] ->  | AO55: =RC[-28] ->  | AP55: - | AQ55: =RC[-29] -> 0 | AR55: =RC[-29] -> 0 | AS55: - | AT55: =RC[-30] -> 0 | AU55: =RC[-30] -> 0 | AV55: =RC[-30] ->  | AW55: =RC[-30] -> 
A56: =IF(RC[1]="","",DATEVALUE(RC[1])) ->  | T56: =(RC[-16]*RC[-15]-RC[-13]*RC[-12])/1000 -> #VALUE! | W56: =RC[-2]*RC[-10]/1000 -> #VALUE! | X56: =ABS((RC[-3]*RC[-11]-RC[-2]*RC[-9])/1000) -> #VALUE! | Y56: =(RC[-14]-RC[1])/RC[-18]*100 -> #VALUE! | AC56: =VALUE(RC[-27]) -> #VALUE! | AD56: =IF(RC[21]=42,"*",IF(RC[21]=32,"",RC[21])) ->  | AE56: =RC[-28] ->  | AF56: =RC[-28] ->  | AG56: =RC[-28] ->  | AH56: =RC[-28] ->  | AI56: =RC[-28] ->  | AJ56: =RC[-28] ->  | AK56: =RC[-28] ->  | AL56: =RC[-28] -> 0 | AM56: =RC[-28] ->  | AN56: =RC[-28] ->  | AO56: =RC[-28] ->  | AP56: - | AQ56: =RC[-29] -> 0 | AR56: =RC[-29] -> 0 | AS56: - | AT56: =RC[-30] -> 0 | AU56: =RC[-30] -> 0 | AV56: =RC[-30] ->  | AW56: =RC[-30] -> 
A57: =IF(RC[1]="","",DATEVALUE(RC[1])) ->  | T57: =(RC[-16]*RC[-15]-RC[-13]*RC[-12])/1000 -> #VALUE! | W57: =RC[-2]*RC[-10]/1000 -> #VALUE! | X57: =ABS((RC[-3]*RC[-11]-RC[-2]*RC[-9])/1000) -> #VALUE! | Y57: =(RC[-14]-RC[1])/RC[-18]*100 -> #VALUE! | AC57: =VALUE(RC[-27]) -> #VALUE! | AD57: =IF(RC[21]=42,"*",IF(RC[21]=32,"",RC[21])) ->  | AE57: =RC[-28] ->  | AF57: =RC[-28] ->  | AG57: =RC[-28] ->  | AH57: =RC[-28] ->  | AI57: =RC[-28] ->  | AJ57: =RC[-28] ->  | AK57: =RC[-28] ->  | AL57: =RC[-28] -> 0 | AM57: =RC[-28] ->  | AN57: =RC[-28] ->  | AO57: =RC[-28] ->  | AP57: - | AQ57: =RC[-29] -> 0 | AR57: =RC[-29] -> 0 | AS57: - | AT57: =RC[-30] -> 0 | AU57: =RC[-30] -> 0 | AV57: =RC[-30] ->  | AW57: =RC[-30] -> 
A58: =IF(RC[1]="","",DATEVALUE(RC[1])) ->  | T58: =(RC[-16]*RC[-15]-RC[-13]*RC[-12])/1000 -> #VALUE! | W58: =RC[-2]*RC[-10]/1000 -> #VALUE! | X58: =ABS((RC[-3]*RC[-11]-RC[-2]*RC[-9])/1000) -> #VALUE! | Y58: =(RC[-14]-RC[1])/RC[-18]*100 -> #VALUE! | AC58: =VALUE(RC[-27]) -> #VALUE! | AD58: =IF(RC[21]=42,"*",IF(RC[21]=32,"",RC[21])) ->  | AE58: =RC[-28] ->  | AF58: =RC[-28] ->  | AG58: =RC[-28] ->  | AH58: =RC[-28] ->  | AI58: =RC[-28] ->  | AJ58: =RC[-28] ->  | AK58: =RC[-28] ->  | AL58: =RC[-28] -> 0 | AM58: =RC[-28] ->  | AN58: =RC[-28] ->  | AO58: =RC[-28] ->  | AP58: - | AQ58: =RC[-29] -> 0 | AR58: =RC[-29] -> 0 | AS58: - | AT58: =RC[-30] -> 0 | AU58: =RC[-30] -> 0 | AV58: =RC[-30] ->  | AW58: =RC[-30] -> 
A59: =IF(RC[1]="","",DATEVALUE(RC[1])) ->  | T59: =(RC[-16]*RC[-15]-RC[-13]*RC[-12])/1000 -> #VALUE! | W59: =RC[-2]*RC[-10]/1000 -> #VALUE! | X59: =ABS((RC[-3]*RC[-11]-RC[-2]*RC[-9])/1000) -> #VALUE! | Y59: =(RC[-14]-RC[1])/RC[-18]*100 -> #VALUE! | AC59: =VALUE(RC[-27]) -> #VALUE! | AD59: =IF(RC[21]=42,"*",IF(RC[21]=32,"",RC[21])) ->  | AE59: =RC[-28] ->  | AF59: =RC[-28] ->  | AG59: =RC[-28] ->  | AH59: =RC[-28] ->  | AI59: =RC[-28] ->  | AJ59: =RC[-28] ->  | AK59: =RC[-28] ->  | AL59: =RC[-28] -> 0 | AM59: =RC[-28] ->  | AN59: =RC[-28] ->  | AO59: =RC[-28] ->  | AP59: - | AQ59: =RC[-29] -> 0 | AR59: =RC[-29] -> 0 | AS59: - | AT59: =RC[-30] -> 0 | AU59: =RC[-30] -> 0 | AV59: =RC[-30] ->  | AW59: =RC[-30] -> 
A60: =IF(RC[1]="","",DATEVALUE(RC[1])) ->  | T60: =(RC[-16]*RC[-15]-RC[-13]*RC[-12])/1000 -> #VALUE! | W60: =RC[-2]*RC[-10]/1000 -> #VALUE! | X60: =ABS((RC[-3]*RC[-11]-RC[-2]*RC[-9])/1000) -> #VALUE! | Y60: =(RC[-14]-RC[1])/RC[-18]*100 -> #VALUE! | AC60: =VALUE(RC[-27]) -> #VALUE! | AD60: =IF(RC[21]=42,"*",IF(RC[21]=32,"",RC[21])) ->  | AE60: =RC[-28] ->  | AF60: =RC[-28] ->  | AG60: =RC[-28] ->  | AH60: =RC[-28] ->  | AI60: =RC[-28] ->  | AJ60: =RC[-28] ->  | AK60: =RC[-28] ->  | AL60: =RC[-28] -> 0 | AM60: =RC[-28] ->  | AN60: =RC[-28] ->  | AO60: =RC[-28] ->  | AP60: - | AQ60: =RC[-29] -> 0 | AR60: =RC[-29] -> 0 | AS60: - | AT60: =RC[-30] -> 0 | AU60: =RC[-30] -> 0 | AV60: =RC[-30] ->  | AW60: =RC[-30] -> 
A61: =IF(RC[1]="","",DATEVALUE(RC[1])) ->  | T61: =(RC[-16]*RC[-15]-RC[-13]*RC[-12])/1000 -> #VALUE! | W61: =RC[-2]*RC[-10]/1000 -> #VALUE! | X61: =ABS((RC[-3]*RC[-11]-RC[-2]*RC[-9])/1000) -> #VALUE! | Y61: =(RC[-14]-RC[1])/RC[-18]*100 -> #VALUE! | AC61: =VALUE(RC[-27]) -> #VALUE! | AD61: =IF(RC[21]=42,"*",IF(RC[21]=32,"",RC[21])) ->  | AE61: =RC[-28] ->  | AF61: =RC[-28] ->  | AG61: =RC[-28] ->  | AH61: =RC[-28] ->  | AI61: =RC[-28] ->  | AJ61: =RC[-28] ->  | AK61: =RC[-28] ->  | AL61: =RC[-28] -> 0 | AM61: =RC[-28] ->  | AN61: =RC[-28] ->  | AO61: =RC[-28] ->  | AP61: - | AQ61: =RC[-29] -> 0 | AR61: =RC[-29] -> 0 | AS61: - | AT61: =RC[-30] -> 0 | AU61: =RC[-30] -> 0 | AV61: =RC[-30] ->  | AW61: =RC[-30] -> 
A62: =IF(RC[1]="","",DATEVALUE(RC[1])) ->  | T62: =(RC[-16]*RC[-15]-RC[-13]*RC[-12])/1000 -> #VALUE! | W62: =RC[-2]*RC[-10]/1000 -> #VALUE! | X62: =ABS((RC[-3]*RC[-11]-RC[-2]*RC[-9])/1000) -> #VALUE! | Y62: =(RC[-14]-RC[1])/RC[-18]*100 -> #VALUE! | AC62: =VALUE(RC[-27]) -> #VALUE! | AD62: =IF(RC[21]=42,"*",IF(RC[21]=32,"",RC[21])) ->  | AE62: =RC[-28] ->  | AF62: =RC[-28] ->  | AG62: =RC[-28] ->  | AH62: =RC[-28] ->  | AI62: =RC[-28] ->  | AJ62: =RC[-28] ->  | AK62: =RC[-28] ->  | AL62: =RC[-28] -> 0 | AM62: =RC[-28] ->  | AN62: =RC[-28] ->  | AO62: =RC[-28] ->  | AP62: - | AQ62: =RC[-29] -> 0 | AR62: =RC[-29] -> 0 | AS62: - | AT62: =RC[-30] -> 0 | AU62: =RC[-30] -> 0 | AV62: =RC[-30] ->  | AW62: =RC[-30] -> 
A63: =IF(RC[1]="","",DATEVALUE(RC[1])) ->  | T63: =(RC[-16]*RC[-15]-RC[-13]*RC[-12])/1000 -> #VALUE! | W63: =RC[-2]*RC[-10]/1000 -> #VALUE! | X63: =ABS((RC[-3]*RC[-11]-RC[-2]*RC[-9])/1000) -> #VALUE! | Y63: =(RC[-14]-RC[1])/RC[-18]*100 -> #VALUE! | AC63: =VALUE(RC[-27]) -> #VALUE! | AD63: =IF(RC[21]=42,"*",IF(RC[21]=32,"",RC[21])) ->  | AE63: =RC[-28] ->  | AF63: =RC[-28] ->  | AG63: =RC[-28] ->  | AH63: =RC[-28] ->  | AI63: =RC[-28] ->  | AJ63: =RC[-28] ->  | AK63: =RC[-28] ->  | AL63: =RC[-28] -> 0 | AM63: =RC[-28] ->  | AN63: =RC[-28] ->  | AO63: =RC[-28] ->  | AP63: - | AQ63: =RC[-29] -> 0 | AR63: =RC[-29] -> 0 | AS63: - | AT63: =RC[-30] -> 0 | AU63: =RC[-30] -> 0 | AV63: =RC[-30] ->  | AW63: =RC[-30] -> 
A64: =IF(RC[1]="","",DATEVALUE(RC[1])) ->  | T64: =(RC[-16]*RC[-15]-RC[-13]*RC[-12])/1000 -> #VALUE! | W64: =RC[-2]*RC[-10]/1000 -> #VALUE! | X64: =ABS((RC[-3]*RC[-11]-RC[-2]*RC[-9])/1000) -> #VALUE! | Y64: =(RC[-14]-RC[1])/RC[-18]*100 -> #VALUE! | AC64: =VALUE(RC[-27]) -> #VALUE! | AD64: =IF(RC[21]=42,"*",IF(RC[21]=32,"",RC[21])) ->  | AE64: =RC[-28] ->  | AF64: =RC[-28] ->  | AG64: =RC[-28] ->  | AH64: =RC[-28] ->  | AI64: =RC[-28] ->  | AJ64: =RC[-28] ->  | AK64: =RC[-28] ->  | AL64: =RC[-28] -> 0 | AM64: =RC[-28] ->  | AN64: =RC[-28] ->  | AO64: =RC[-28] ->  | AP64: - | AQ64: =RC[-29] -> 0 | AR64: =RC[-29] -> 0 | AS64: - | AT64: =RC[-30] -> 0 | AU64: =RC[-30] -> 0 | AV64: =RC[-30] ->  | AW64: =RC[-30] -> 
A65: =IF(RC[1]="","",DATEVALUE(RC[1])) ->  | T65: =(RC[-16]*RC[-15]-RC[-13]*RC[-12])/1000 -> #VALUE! | W65: =RC[-2]*RC[-10]/1000 -> #VALUE! | X65: =ABS((RC[-3]*RC[-11]-RC[-2]*RC[-9])/1000) -> #VALUE! | Y65: =(RC[-14]-RC[1])/RC[-18]*100 -> #VALUE! | AC65: =VALUE(RC[-27]) -> #VALUE! | AD65: =IF(RC[21]=42,"*",IF(RC[21]=32,"",RC[21])) ->  | AE65: =RC[-28] ->  | AF65: =RC[-28] ->  | AG65: =RC[-28] ->  | AH65: =RC[-28] ->  | AI65: =RC[-28] ->  | AJ65: =RC[-28] ->  | AK65: =RC[-28] ->  | AL65: =RC[-28] -> 0 | AM65: =RC[-28] ->  | AN65: =RC[-28] ->  | AO65: =RC[-28] ->  | AP65: - | AQ65: =RC[-29] -> 0 | AR65: =RC[-29] -> 0 | AS65: - | AT65: =RC[-30] -> 0 | AU65: =RC[-30] -> 0 | AV65: =RC[-30] ->  | AW65: =RC[-30] -> 
A66: =IF(RC[1]="","",DATEVALUE(RC[1])) ->  | T66: =(RC[-16]*RC[-15]-RC[-13]*RC[-12])/1000 -> #VALUE! | W66: =RC[-2]*RC[-10]/1000 -> #VALUE! | X66: =ABS((RC[-3]*RC[-11]-RC[-2]*RC[-9])/1000) -> #VALUE! | Y66: =(RC[-14]-RC[1])/RC[-18]*100 -> #VALUE! | AC66: =VALUE(RC[-27]) -> #VALUE! | AD66: =IF(RC[21]=42,"*",IF(RC[21]=32,"",RC[21])) ->  | AE66: =RC[-28] ->  | AF66: =RC[-28] ->  | AG66: =RC[-28] ->  | AH66: =RC[-28] ->  | AI66: =RC[-28] ->  | AJ66: =RC[-28] ->  | AK66: =RC[-28] ->  | AL66: =RC[-28] -> 0 | AM66: =RC[-28] ->  | AN66: =RC[-28] ->  | AO66: =RC[-28] ->  | AP66: - | AQ66: =RC[-29] -> 0 | AR66: =RC[-29] -> 0 | AS66: - | AT66: =RC[-30] -> 0 | AU66: =RC[-30] -> 0 | AV66: =RC[-30] ->  | AW66: =RC[-30] -> 
A67: =IF(RC[1]="","",DATEVALUE(RC[1])) ->  | T67: =(RC[-16]*RC[-15]-RC[-13]*RC[-12])/1000 -> #VALUE! | W67: =RC[-2]*RC[-10]/1000 -> #VALUE! | X67: =ABS((RC[-3]*RC[-11]-RC[-2]*RC[-9])/1000) -> #VALUE! | Y67: =(RC[-14]-RC[1])/RC[-18]*100 -> #VALUE! | AC67: =VALUE(RC[-27]) -> #VALUE! | AD67: =IF(RC[21]=42,"*",IF(RC[21]=32,"",RC[21])) ->  | AE67: =RC[-28] ->  | AF67: =RC[-28] ->  | AG67: =RC[-28] ->  | AH67: =RC[-28] ->  | AI67: =RC[-28] ->  | AJ67: =RC[-28] ->  | AK67: =RC[-28] ->  | AL67: =RC[-28] -> 0 | AM67: =RC[-28] ->  | AN67: =RC[-28] ->  | AO67: =RC[-28] ->  | AP67: - | AQ67: =RC[-29] -> 0 | AR67: =RC[-29] -> 0 | AS67: - | AT67: =RC[-30] -> 0 | AU67: =RC[-30] -> 0 | AV67: =RC[-30] ->  | AW67: =RC[-30] -> 
A68: =IF(RC[1]="","",DATEVALUE(RC[1])) ->  | T68: =(RC[-16]*RC[-15]-RC[-13]*RC[-12])/1000 -> #VALUE! | W68: =RC[-2]*RC[-10]/1000 -> #VALUE! | X68: =ABS((RC[-3]*RC[-11]-RC[-2]*RC[-9])/1000) -> #VALUE! | Y68: =(RC[-14]-RC[1])/RC[-18]*100 -> #VALUE! | AC68: =VALUE(RC[-27]) -> #VALUE! | AD68: =IF(RC[21]=42,"*",IF(RC[21]=32,"",RC[21])) ->  | AE68: =RC[-28] ->  | AF68: =RC[-28] ->  | AG68: =RC[-28] ->  | AH68: =RC[-28] ->  | AI68: =RC[-28] ->  | AJ68: =RC[-28] ->  | AK68: =RC[-28] ->  | AL68: =RC[-28] -> 0 | AM68: =RC[-28] ->  | AN68: =RC[-28] ->  | AO68: =RC[-28] ->  | AP68: - | AQ68: =RC[-29] -> 0 | AR68: =RC[-29] -> 0 | AS68: - | AT68: =RC[-30] -> 0 | AU68: =RC[-30] -> 0 | AV68: =RC[-30] ->  | AW68: =RC[-30] -> 
A69: =IF(RC[1]="","",DATEVALUE(RC[1])) ->  | T69: =(RC[-16]*RC[-15]-RC[-13]*RC[-12])/1000 -> #VALUE! | W69: =RC[-2]*RC[-10]/1000 -> #VALUE! | X69: =ABS((RC[-3]*RC[-11]-RC[-2]*RC[-9])/1000) -> #VALUE! | Y69: =(RC[-14]-RC[1])/RC[-18]*100 -> #VALUE! | AC69: =VALUE(RC[-27]) -> #VALUE! | AD69: =IF(RC[21]=42,"*",IF(RC[21]=32,"",RC[21])) ->  | AE69: =RC[-28] ->  | AF69: =RC[-28] ->  | AG69: =RC[-28] ->  | AH69: =RC[-28] ->  | AI69: =RC[-28] ->  | AJ69: =RC[-28] ->  | AK69: =RC[-28] ->  | AL69: =RC[-28] -> 0 | AM69: =RC[-28] ->  | AN69: =RC[-28] ->  | AO69: =RC[-28] ->  | AP69: - | AQ69: =RC[-29] -> 0 | AR69: =RC[-29] -> 0 | AS69: - | AT69: =RC[-30] -> 0 | AU69: =RC[-30] -> 0 | AV69: =RC[-30] ->  | AW69: =RC[-30] -> 
A70: =IF(RC[1]="","",DATEVALUE(RC[1])) ->  | T70: =(RC[-16]*RC[-15]-RC[-13]*RC[-12])/1000 -> #VALUE! | W70: =RC[-2]*RC[-10]/1000 -> #VALUE! | X70: =ABS((RC[-3]*RC[-11]-RC[-2]*RC[-9])/1000) -> #VALUE! | Y70: =(RC[-14]-RC[1])/RC[-18]*100 -> #VALUE! | AC70: =VALUE(RC[-27]) -> #VALUE! | AD70: =IF(RC[21]=42,"*",IF(RC[21]=32,"",RC[21])) ->  | AE70: =RC[-28] ->  | AF70: =RC[-28] ->  | AG70: =RC[-28] ->  | AH70: =RC[-28] ->  | AI70: =RC[-28] ->  | AJ70: =RC[-28] ->  | AK70: =RC[-28] ->  | AL70: =RC[-28] -> 0 | AM70: =RC[-28] ->  | AN70: =RC[-28] ->  | AO70: =RC[-28] ->  | AP70: - | AQ70: =RC[-29] -> 0 | AR70: =RC[-29] -> 0 | AS70: - | AT70: =RC[-30] -> 0 | AU70: =RC[-30] -> 0 | AV70: =RC[-30] ->  | AW70: =RC[-30] -> 
A71: =IF(RC[1]="","",DATEVALUE(RC[1])) ->  | T71: =(RC[-16]*RC[-15]-RC[-13]*RC[-12])/1000 -> #VALUE! | W71: =RC[-2]*RC[-10]/1000 -> #VALUE! | X71: =ABS((RC[-3]*RC[-11]-RC[-2]*RC[-9])/1000) -> #VALUE! | Y71: =(RC[-14]-RC[1])/RC[-18]*100 -> #VALUE! | AC71: =VALUE(RC[-27]) -> #VALUE! | AD71: =IF(RC[21]=42,"*",IF(RC[21]=32,"",RC[21])) ->  | AE71: =RC[-28] ->  | AF71: =RC[-28] ->  | AG71: =RC[-28] ->  | AH71: =RC[-28] ->  | AI71: =RC[-28] ->  | AJ71: =RC[-28] ->  | AK71: =RC[-28] ->  | AL71: =RC[-28] -> 0 | AM71: =RC[-28] ->  | AN71: =RC[-28] ->  | AO71: =RC[-28] ->  | AP71: - | AQ71: =RC[-29] -> 0 | AR71: =RC[-29] -> 0 | AS71: - | AT71: =RC[-30] -> 0 | AU71: =RC[-30] -> 0 | AV71: =RC[-30] ->  | AW71: =RC[-30] -> 
A72: =IF(RC[1]="","",DATEVALUE(RC[1])) ->  | T72: =(RC[-16]*RC[-15]-RC[-13]*RC[-12])/1000 -> #VALUE! | W72: =RC[-2]*RC[-10]/1000 -> #VALUE! | X72: =ABS((RC[-3]*RC[-11]-RC[-2]*RC[-9])/1000) -> #VALUE! | Y72: =(RC[-14]-RC[1])/RC[-18]*100 -> #VALUE! | AC72: =VALUE(RC[-27]) -> #VALUE! | AD72: =IF(RC[21]=42,"*",IF(RC[21]=32,"",RC[21])) ->  | AE72: =RC[-28] ->  | AF72: =RC[-28] ->  | AG72: =RC[-28] ->  | AH72: =RC[-28] ->  | AI72: =RC[-28] ->  | AJ72: =RC[-28] ->  | AK72: =RC[-28] ->  | AL72: =RC[-28] -> 0 | AM72: =RC[-28] ->  | AN72: =RC[-28] ->  | AO72: =RC[-28] ->  | AP72: - | AQ72: =RC[-29] -> 0 | AR72: =RC[-29] -> 0 | AS72: - | AT72: =RC[-30] -> 0 | AU72: =RC[-30] -> 0 | AV72: =RC[-30] ->  | AW72: =RC[-30] -> 
A73: =IF(RC[1]="","",DATEVALUE(RC[1])) ->  | T73: =(RC[-16]*RC[-15]-RC[-13]*RC[-12])/1000 -> #VALUE! | W73: =RC[-2]*RC[-10]/1000 -> #VALUE! | X73: =ABS((RC[-3]*RC[-11]-RC[-2]*RC[-9])/1000) -> #VALUE! | Y73: =(RC[-14]-RC[1])/RC[-18]*100 -> #VALUE! | AC73: =VALUE(RC[-27]) -> #VALUE! | AD73: =IF(RC[21]=42,"*",IF(RC[21]=32,"",RC[21])) ->  | AE73: =RC[-28] ->  | AF73: =RC[-28] ->  | AG73: =RC[-28] ->  | AH73: =RC[-28] ->  | AI73: =RC[-28] ->  | AJ73: =RC[-28] ->  | AK73: =RC[-28] ->  | AL73: =RC[-28] -> 0 | AM73: =RC[-28] ->  | AN73: =RC[-28] ->  | AO73: =RC[-28] ->  | AP73: - | AQ73: =RC[-29] -> 0 | AR73: =RC[-29] -> 0 | AS73: - | AT73: =RC[-30] -> 0 | AU73: =RC[-30] -> 0 | AV73: =RC[-30] ->  | AW73: =RC[-30] -> 
A74: =IF(RC[1]="","",DATEVALUE(RC[1])) ->  | T74: =(RC[-16]*RC[-15]-RC[-13]*RC[-12])/1000 -> #VALUE! | W74: =RC[-2]*RC[-10]/1000 -> #VALUE! | X74: =ABS((RC[-3]*RC[-11]-RC[-2]*RC[-9])/1000) -> #VALUE! | Y74: =(RC[-14]-RC[1])/RC[-18]*100 -> #VALUE! | AC74: =VALUE(RC[-27]) -> #VALUE! | AD74: =IF(RC[21]=42,"*",IF(RC[21]=32,"",RC[21])) ->  | AE74: =RC[-28] ->  | AF74: =RC[-28] ->  | AG74: =RC[-28] ->  | AH74: =RC[-28] ->  | AI74: =RC[-28] ->  | AJ74: =RC[-28] ->  | AK74: =RC[-28] ->  | AL74: =RC[-28] -> 0 | AM74: =RC[-28] ->  | AN74: =RC[-28] ->  | AO74: =RC[-28] ->  | AP74: - | AQ74: =RC[-29] -> 0 | AR74: =RC[-29] -> 0 | AS74: - | AT74: =RC[-30] -> 0 | AU74: =RC[-30] -> 0 | AV74: =RC[-30] ->  | AW74: =RC[-30] -> 
A75: =IF(RC[1]="","",DATEVALUE(RC[1])) ->  | T75: =(RC[-16]*RC[-15]-RC[-13]*RC[-12])/1000 -> #VALUE! | W75: =RC[-2]*RC[-10]/1000 -> #VALUE! | X75: =ABS((RC[-3]*RC[-11]-RC[-2]*RC[-9])/1000) -> #VALUE! | Y75: =(RC[-14]-RC[1])/RC[-18]*100 -> #VALUE! | AC75: =VALUE(RC[-27]) -> #VALUE! | AD75: =IF(RC[21]=42,"*",IF(RC[21]=32,"",RC[21])) ->  | AE75: =RC[-28] ->  | AF75: =RC[-28] ->  | AG75: =RC[-28] ->  | AH75: =RC[-28] ->  | AI75: =RC[-28] ->  | AJ75: =RC[-28] ->  | AK75: =RC[-28] ->  | AL75: =RC[-28] -> 0 | AM75: =RC[-28] ->  | AN75: =RC[-28] ->  | AO75: =RC[-28] ->  | AP75: - | AQ75: =RC[-29] -> 0 | AR75: =RC[-29] -> 0 | AS75: - | AT75: =RC[-30] -> 0 | AU75: =RC[-30] -> 0 | AV75: =RC[-30] ->  | AW75: =RC[-30] -> 
A76: =IF(RC[1]="","",DATEVALUE(RC[1])) ->  | T76: =(RC[-16]*RC[-15]-RC[-13]*RC[-12])/1000 -> #VALUE! | W76: =RC[-2]*RC[-10]/1000 -> #VALUE! | X76: =ABS((RC[-3]*RC[-11]-RC[-2]*RC[-9])/1000) -> #VALUE! | Y76: =(RC[-14]-RC[1])/RC[-18]*100 -> #VALUE! | AC76: =VALUE(RC[-27]) -> #VALUE! | AD76: =IF(RC[21]=42,"*",IF(RC[21]=32,"",RC[21])) ->  | AE76: =RC[-28] ->  | AF76: =RC[-28] ->  | AG76: =RC[-28] ->  | AH76: =RC[-28] ->  | AI76: =RC[-28] ->  | AJ76: =RC[-28] ->  | AK76: =RC[-28] ->  | AL76: =RC[-28] -> 0 | AM76: =RC[-28] ->  | AN76: =RC[-28] ->  | AO76: =RC[-28] ->  | AP76: - | AQ76: =RC[-29] -> 0 | AR76: =RC[-29] -> 0 | AS76: - | AT76: =RC[-30] -> 0 | AU76: =RC[-30] -> 0 | AV76: =RC[-30] ->  | AW76: =RC[-30] -> 
A77: =IF(RC[1]="","",DATEVALUE(RC[1])) ->  | T77: =(RC[-16]*RC[-15]-RC[-13]*RC[-12])/1000 -> #VALUE! | W77: =RC[-2]*RC[-10]/1000 -> #VALUE! | X77: =ABS((RC[-3]*RC[-11]-RC[-2]*RC[-9])/1000) -> #VALUE! | Y77: =(RC[-14]-RC[1])/RC[-18]*100 -> #VALUE! | AC77: =VALUE(RC[-27]) -> #VALUE! | AD77: =IF(RC[21]=42,"*",IF(RC[21]=32,"",RC[21])) ->  | AE77: =RC[-28] ->  | AF77: =RC[-28] ->  | AG77: =RC[-28] ->  | AH77: =RC[-28] ->  | AI77: =RC[-28] ->  | AJ77: =RC[-28] ->  | AK77: =RC[-28] ->  | AL77: =RC[-28] -> 0 | AM77: =RC[-28] ->  | AN77: =RC[-28] ->  | AO77: =RC[-28] ->  | AP77: - | AQ77: =RC[-29] -> 0 | AR77: =RC[-29] -> 0 | AS77: - | AT77: =RC[-30] -> 0 | AU77: =RC[-30] -> 0 | AV77: =RC[-30] ->  | AW77: =RC[-30] -> 
A78: =IF(RC[1]="","",DATEVALUE(RC[1])) ->  | T78: =(RC[-16]*RC[-15]-RC[-13]*RC[-12])/1000 -> #VALUE! | W78: =RC[-2]*RC[-10]/1000 -> #VALUE! | X78: =ABS((RC[-3]*RC[-11]-RC[-2]*RC[-9])/1000) -> #VALUE! | Y78: =(RC[-14]-RC[1])/RC[-18]*100 -> #VALUE! | AC78: =VALUE(RC[-27]) -> #VALUE! | AD78: =IF(RC[21]=42,"*",IF(RC[21]=32,"",RC[21])) ->  | AE78: =RC[-28] ->  | AF78: =RC[-28] ->  | AG78: =RC[-28] ->  | AH78: =RC[-28] ->  | AI78: =RC[-28] ->  | AJ78: =RC[-28] ->  | AK78: =RC[-28] ->  | AL78: =RC[-28] -> 0 | AM78: =RC[-28] ->  | AN78: =RC[-28] ->  | AO78: =RC[-28] ->  | AP78: - | AQ78: =RC[-29] -> 0 | AR78: =RC[-29] -> 0 | AS78: - | AT78: =RC[-30] -> 0 | AU78: =RC[-30] -> 0 | AV78: =RC[-30] ->  | AW78: =RC[-30] -> 
A79: =IF(RC[1]="","",DATEVALUE(RC[1])) ->  | T79: =(RC[-16]*RC[-15]-RC[-13]*RC[-12])/1000 -> #VALUE! | W79: =RC[-2]*RC[-10]/1000 -> #VALUE! | X79: =ABS((RC[-3]*RC[-11]-RC[-2]*RC[-9])/1000) -> #VALUE! | Y79: =(RC[-14]-RC[1])/RC[-18]*100 -> #VALUE! | AC79: =VALUE(RC[-27]) -> #VALUE! | AD79: =IF(RC[21]=42,"*",IF(RC[21]=32,"",RC[21])) ->  | AE79: =RC[-28] ->  | AF79: =RC[-28] ->  | AG79: =RC[-28] ->  | AH79: =RC[-28] ->  | AI79: =RC[-28] ->  | AJ79: =RC[-28] ->  | AK79: =RC[-28] ->  | AL79: =RC[-28] -> 0 | AM79: =RC[-28] ->  | AN79: =RC[-28] ->  | AO79: =RC[-28] ->  | AP79: - | AQ79: =RC[-29] -> 0 | AR79: =RC[-29] -> 0 | AS79: - | AT79: =RC[-30] -> 0 | AU79: =RC[-30] -> 0 | AV79: =RC[-30] ->  | AW79: =RC[-30] -> 
A80: =IF(RC[1]="","",DATEVALUE(RC[1])) ->  | T80: =(RC[-16]*RC[-15]-RC[-13]*RC[-12])/1000 -> #VALUE! | W80: =RC[-2]*RC[-10]/1000 -> #VALUE! | X80: =ABS((RC[-3]*RC[-11]-RC[-2]*RC[-9])/1000) -> #VALUE! | Y80: =(RC[-14]-RC[1])/RC[-18]*100 -> #VALUE! | AC80: =VALUE(RC[-27]) -> #VALUE! | AD80: =IF(RC[21]=42,"*",IF(RC[21]=32,"",RC[21])) ->  | AE80: =RC[-28] ->  | AF80: =RC[-28] ->  | AG80: =RC[-28] ->  | AH80: =RC[-28] ->  | AI80: =RC[-28] ->  | AJ80: =RC[-28] ->  | AK80: =RC[-28] ->  | AL80: =RC[-28] -> 0 | AM80: =RC[-28] ->  | AN80: =RC[-28] ->  | AO80: =RC[-28] ->  | AP80: - | AQ80: =RC[-29] -> 0 | AR80: =RC[-29] -> 0 | AS80: - | AT80: =RC[-30] -> 0 | AU80: =RC[-30] -> 0 | AV80: =RC[-30] ->  | AW80: =RC[-30] -> 
A81: =IF(RC[1]="","",DATEVALUE(RC[1])) ->  | T81: =(RC[-16]*RC[-15]-RC[-13]*RC[-12])/1000 -> #VALUE! | W81: =RC[-2]*RC[-10]/1000 -> #VALUE! | X81: =ABS((RC[-3]*RC[-11]-RC[-2]*RC[-9])/1000) -> #VALUE! | Y81: =(RC[-14]-RC[1])/RC[-18]*100 -> #VALUE! | AC81: =VALUE(RC[-27]) -> #VALUE! | AD81: =IF(RC[21]=42,"*",IF(RC[21]=32,"",RC[21])) ->  | AE81: =RC[-28] ->  | AF81: =RC[-28] ->  | AG81: =RC[-28] ->  | AH81: =RC[-28] ->  | AI81: =RC[-28] ->  | AJ81: =RC[-28] ->  | AK81: =RC[-28] ->  | AL81: =RC[-28] -> 0 | AM81: =RC[-28] ->  | AN81: =RC[-28] ->  | AO81: =RC[-28] ->  | AP81: - | AQ81: =RC[-29] -> 0 | AR81: =RC[-29] -> 0 | AS81: - | AT81: =RC[-30] -> 0 | AU81: =RC[-30] -> 0 | AV81: =RC[-30] ->  | AW81: =RC[-30] -> 
A82: =IF(RC[1]="","",DATEVALUE(RC[1])) ->  | T82: =(RC[-16]*RC[-15]-RC[-13]*RC[-12])/1000 -> #VALUE! | W82: =RC[-2]*RC[-10]/1000 -> #VALUE! | X82: =ABS((RC[-3]*RC[-11]-RC[-2]*RC[-9])/1000) -> #VALUE! | Y82: =(RC[-14]-RC[1])/RC[-18]*100 -> #VALUE! | AC82: =VALUE(RC[-27]) -> #VALUE! | AD82: =IF(RC[21]=42,"*",IF(RC[21]=32,"",RC[21])) ->  | AE82: =RC[-28] ->  | AF82: =RC[-28] ->  | AG82: =RC[-28] ->  | AH82: =RC[-28] ->  | AI82: =RC[-28] ->  | AJ82: =RC[-28] ->  | AK82: =RC[-28] ->  | AL82: =RC[-28] -> 0 | AM82: =RC[-28] ->  | AN82: =RC[-28] ->  | AO82: =RC[-28] ->  | AP82: - | AQ82: =RC[-29] -> 0 | AR82: =RC[-29] -> 0 | AS82: - | AT82: =RC[-30] -> 0 | AU82: =RC[-30] -> 0 | AV82: =RC[-30] ->  | AW82: =RC[-30] -> 
A83: =IF(RC[1]="","",DATEVALUE(RC[1])) ->  | T83: =(RC[-16]*RC[-15]-RC[-13]*RC[-12])/1000 -> #VALUE! | W83: =RC[-2]*RC[-10]/1000 -> #VALUE! | X83: =ABS((RC[-3]*RC[-11]-RC[-2]*RC[-9])/1000) -> #VALUE! | Y83: =(RC[-14]-RC[1])/RC[-18]*100 -> #VALUE! | AC83: =VALUE(RC[-27]) -> #VALUE! | AD83: =IF(RC[21]=42,"*",IF(RC[21]=32,"",RC[21])) ->  | AE83: =RC[-28] ->  | AF83: =RC[-28] ->  | AG83: =RC[-28] ->  | AH83: =RC[-28] ->  | AI83: =RC[-28] ->  | AJ83: =RC[-28] ->  | AK83: =RC[-28] ->  | AL83: =RC[-28] -> 0 | AM83: =RC[-28] ->  | AN83: =RC[-28] ->  | AO83: =RC[-28] ->  | AP83: - | AQ83: =RC[-29] -> 0 | AR83: =RC[-29] -> 0 | AS83: - | AT83: =RC[-30] -> 0 | AU83: =RC[-30] -> 0 | AV83: =RC[-30] ->  | AW83: =RC[-30] -> 
AC84: Среднее | AF84: =R[1]C[-28] -> 248.2176666666667 | AG84: =R[1]C[-28] -> 66.476333333333329 | AH84: =R[1]C[-28] -> 7.301555555555554 | AI84: =R[1]C[-28] -> 213.41700000000003 | AJ84: =R[1]C[-28] -> 41.485666666666674 | AK84: =R[1]C[-28] -> 5.2148888888888889 | AL84: =R[1]C[-28] -> 24.990666666666673 | AM84: =R[1]C[-28] -> 34.800666666666665 | AN84: =R[1]C[-28] -> 36.875333333333316 | AO84: =R[1]C[-28] -> 66.424444444444447 | AP84: - | AQ84: =R[1]C[-29] -> 0 | AR84: =R[1]C[-29] -> 0 | AS84: - | AT84: =R[1]C[-30] -> 0 | AU84: =R[1]C[-30] -> 0
B85: Среднее | D85: =AVERAGE(OFFSET(R[-74]C,3,0,R7C1,1)) -> 248.2176666666667 | E85: =AVERAGE(OFFSET(R[-74]C,3,0,R7C1,1)) -> 66.476333333333329 | F85: =AVERAGE(OFFSET(R[-74]C,3,0,R7C1,1)) -> 7.301555555555554 | G85: =AVERAGE(OFFSET(R[-74]C,3,0,R7C1,1)) -> 213.41700000000003 | H85: =AVERAGE(OFFSET(R[-74]C,3,0,R7C1,1)) -> 41.485666666666674 | I85: =AVERAGE(OFFSET(R[-74]C,3,0,R7C1,1)) -> 5.2148888888888889 | J85: =AVERAGE(OFFSET(R[-74]C,3,0,R7C1,1)) -> 24.990666666666673 | K85: =AVERAGE(OFFSET(R[-74]C,3,0,R7C1,1)) -> 34.800666666666665 | L85: =IF(SUM(OFFSET(R[-74]C,3,0,R7C1,1))=0,"",AVERAGE(OFFSET(R[-74]C,3,0,R7C1,1))) -> 36.875333333333316 | M85: =IF(SUM(OFFSET(R[-74]C,3,0,R7C1,1))=0,"",AVERAGE(OFFSET(R[-74]C,3,0,R7C1,1))) -> 66.424444444444447 | R85: =IF(SUM(OFFSET(R[-74]C,3,0,R7C1,1))=0,"",AVERAGE(OFFSET(R[-74]C,3,0,R7C1,1))) -> 2.3993555555555561 | S85: =AVERAGE(OFFSET(R[-74]C,3,0,R7C1,1)) -> 7.2667888888888879 | T85: =AVERAGE(OFFSET(R[-74]C,3,0,R7C1,1)) -> 7.2574213599999995 | W85: =AVERAGE(OFFSET(R[-74]C,3,0,R7C1,1)) -> 5.0129740377777772 | X85: =AVERAGE(OFFSET(R[-74]C,3,0,R7C1,1)) -> #VALUE! | AC85: Итого | AE85: =R[1]C[-28] -> 720 | AF85: =R[1]C[-28] -> 7446.5300000000007 | AI85: =R[1]C[-28] -> 6402.5100000000011 | AM85: =R[1]C[-28] -> 1044.02 | AN85: =R[1]C[-28] -> 1106.2599999999995 | AQ85: =R[1]C[-29] -> 0 | AU85: =R[1]C[-30] -> 0 | AV85: =R[1]C[-30] -> 71.980666666666679 | AW85: =R[1]C[-30] -> 218.00366666666665
B86: ИТОГО: | C86: =SUM(OFFSET(R[-75]C,3,0,R7C1,1)) -> 720 | D86: =SUM(OFFSET(R[-75]C,3,0,R7C1,1)) -> 7446.5300000000007 | G86: =SUM(OFFSET(R[-75]C,3,0,R7C1,1)) -> 6402.5100000000011 | K86: =SUM(OFFSET(R[-75]C,3,0,R7C1,1)) -> 1044.02 | L86: =IF(SUM(OFFSET(R[-75]C,3,0,R7C1,1))=0,"",SUM(OFFSET(R[-75]C,3,0,R7C1,1))) -> 1106.2599999999995 | R86: =IF(SUM(OFFSET(R[-75]C,3,0,R7C1,1))=0,"",SUM(OFFSET(R[-75]C,3,0,R7C1,1))) -> 71.980666666666679 | S86: =SUM(OFFSET(R[-75]C,3,0,R7C1,1)) -> 218.00366666666665 | T86: =SUM(OFFSET(R[-75]C,3,0,R7C1,1)) -> 217.72264079999999 | W86: =SUM(OFFSET(R[-75]C,3,0,R7C1,1)) -> 150.38922113333331 | X86: =SUM(OFFSET(R[-75]C,3,0,R7C1,1)) -> #VALUE!
AC87: Досчёт | AF87: =R[1]C[-28] -> 0 | AI87: =R[1]C[-28] -> 0 | AM87: =R[1]C[-28] -> 0 | AN87: =R[1]C[-28] -> 0 | AQ87: =R[1]C[-29] -> 0 | AU87: =R[1]C[-30] -> 0 | AV87: =R[1]C[-30] -> 0 | AW87: =R[1]C[-30] -> 0
A88: 11дн=264ч 4дн=96ч | B88: Досчёт до конца м-ца (+) | C88: =R6C1*24 -> 216 | T88: № 107106 | AC88: Снятие | AF88: =-R[1]C[-28] -> 0 | AI88: =-R[1]C[-28] -> 0 | AM88: =-R[1]C[-28] -> 0 | AN88: =-R[1]C[-28] -> 0 | AQ88: =-R[1]C[-29] -> 0 | AU88: =-R[1]C[-30] -> 0 | AV88: =-R[1]C[-30] -> 0 | AW88: =-R[1]C[-30] -> 0
A89: 9дн=216ч 7дн=168ч | B89: Вычет с предыдущего (-) | C89: =R4C1*24 -> 192 | AC89: Сумма | AF89: =R[1]C[-28] -> 7446.5300000000007 | AI89: =R[1]C[-28] -> 6402.5100000000011 | AM89: =R[1]C[-28] -> 1044.02 | AN89: =R[1]C[-28] -> 1106.2599999999995 | AQ89: =R[1]C[-29] -> 0 | AU89: =R[1]C[-30] -> 0 | AV89: =R[1]C[-30] -> 71.980666666666679 | AW89: =R[1]C[-30] -> 218.00366666666665
B90: СУММА: | C90: =R[-4]C+R[-2]C-R[-1]C -> 744 | D90: =R[-4]C+R[-2]C-R[-1]C -> 7446.5300000000007 | G90: =R[-4]C+R[-2]C-R[-1]C -> 6402.5100000000011 | K90: =R[-4]C+R[-2]C-R[-1]C -> 1044.02 | L90: =IF(SUM(OFFSET(R[-79]C,3,0,R7C1,1))=0,"",(R[-4]C+R[-2]C-R[-1]C)) -> 1106.2599999999995 | R90: =IF(SUM(OFFSET(R[-79]C,3,0,R7C1,1))=0,"",(R[-4]C+R[-2]C-R[-1]C)) -> 71.980666666666679 | S90: =R[-4]C+R[-2]C-R[-1]C -> 218.00366666666665
AC91: Тхв на источнике | AE91: V гвс (м3) | AF91: =R[-2]C[15] -> 0 | AG91: W гвс (Гкал) | AH91: =RC[-2]*0.06 -> 0 | AI91: W без гвс (Гкал) | AJ91: =R[-2]C[13]-RC[-2] -> 218.00366666666665
B92: Показания счетчиков на момент снятия данных:
B93: Дата, время | D93: М1, т | F93: М2, т | H93: М3, т | J93: М4, т | L93: Qо, Гкал | N93: Qг, Гкал | P93: время, час
B94: 23.09.18 02:00 | D94: 66096.210000000006 | F94: 50489.88 | H94: 18121.79 | J94: - | L94: 2524.8710000000001 | N94: 1237.356 | P94: -
B95: 16.10.18 00:00 | D95: 69983.64 | F95: 53768.18 | H95: 20162.349999999999 | J95: - | L95: 2638.4279999999999 | N95: 1373.0809999999999 | P95: -
AC97: =ZAYAVKA_N -> з. на доп.№ 02/147-2548 от 5.10.2017 с 28.09.18г по 04.10.18г некорректная работа приборов
B98: Представитель потребителя:_______________________________________________________________________ В.О. Топорков
I101: Рекомендуемые значения по параметрам теплопотребления (не являются официально утверждёнными)
I102: М, т | J102: V, м3 | K102: Qгвс, Гкал | L102: Qотоп, Гкал | M102: Qо, Гкал
I103: =R[-13]C[-3] -> 0 | J103: =RC[-1]/0.98 -> 0 | K103: =RC[-1]*0.06 -> 0 | L103: =RC[1]-RC[-1] -> 71.980666666666679 | M103: =R[-13]C[5] -> 71.980666666666679
O105: ДЛЯ САМОКОНТРОЛЯ
B106: В строке выбора дат указать период с 16.7.13 по 23.8.13 - жильё | N106: Q | O106: Qг
B107: В строке выбора дат указать период с 18.7.13 по 25.8.13 - не жилое | N107: =(R[-21]C[-10]*R[-22]C[-7]-R[-21]C[-9]*R[-22]C[-6])/1000 -> 1589.2160930100003 | O107: =IF(R[-22]C[-2]="",R[-21]C[-3]*R[-22]C/1000,"") ->  | P107: Си2
O108: =IF(R[-23]C[-2]="","",((R[-22]C[-3]*R[-23]C)-(R[-22]C[-2]*R[-23]C[2]))/1000) -> 0 | P108: Си3