Sheet: Лист1
G1: Отчёт о теплопотреблении за октябрь 2018 | M1: з.н д. №02/147-2783 от 04.10.18 01.10.18г некорректная работа приборов
A4: =EOMONTH(R[9]C,0)-R[9]C -> 8 | B4: Потребитель: ЗАО "Сити Сервис"
A5: =MAX(R[9]C:R[78]C) -> 2018-10-22T00:00:00.000 | B5: Адрес: г. СПб, Кораблестроителей ул., д.35 к.1 ИТП 5
A6: =EOMONTH(R[-1]C,0)-R[-1]C -> 9 | B6: Телефон: 8-911-021-19-79
A7: =R[-2]C-R[6]C -> 30 | B7: Договор 10023-2(.)400
A8: 7 | B8: Тепловычислитель: ВТД-УВ № B011 | L8: М2 мах= | M8: 103.68 | O8: Мгвс мах= | P8: 61.92
L9: Qотоп мах= | M9: 8.304 | O9: Qгвс мах= | P9: 3.72
B10: Расчётная формула: Q=M1*(h1-h2)+(M1-M2)*(h2-hхв)
D12: Учет | L12: Контроль
A13: =R[1]C[1]-1 -> 2018-09-22T00:00:00.000 | B13: Дата | C13: N, ч | D13: M1, т | E13: T1, С | F13: P1, кг/см2 | G13: M2, т | H13: T2, С | I13: P2, кг/см2 | J13: dT, С | K13: M1-М2, т | L13: V3, м3 | M13: T3, С | N13: V4, м3 | O13: =IF(R[-12]C[-14]="м.куб","","T4, С") -> T4, С | P13: dT, С | Q13: V3-V4, м3 | R13: Qгвс, Гкал | S13: Qобщ., Гкал | T13: Q | U13: M3 | V13: M4 | W13: си2 | X13: си3 | Y13: Разб. | Z13: dM2 | AC13: Дата | AD13: НС | AE13: n, ч | AF13: М1, т | AG13: t1, гр. С | AH13: Р1, кгс/см2 | AI13: М2, т | AJ13: t2, гр. С | AK13: Р2, кгс/см2 | AL13: t1-t2, гр. С | AM13: М1-М2, т | AN13: М1гвс, т | AO13: t1гвс, гр. С | AP13: Р1гвс, кгс/см2 | AQ13: М2гвс, т | AR13: t2гвс, гр. С | AS13: Р2гвс, кгс/см2 | AT13: t1гвс-t2гвс | AU13: М1гвс-М2гвс, т | AV13: Wгвс, Гкал | AW13: Wсумм, Гкал | AY13: NS_TV1 | AZ13: НС | BA13: NS_TV2
A14: =IF(RC[1]="","",DATEVALUE(RC[1])) -> 43366 | B14: 23.09.18 | C14: 24 | D14: 133.53562926999999 | E14: 70.72 | F14: 6.7929465743600002 | G14: 126.8515625 | H14: 70.73 | I14: 4.2725766354400001 | J14: =RC[-5]-RC[-2] -> -1.0000000000005116E-2 | K14: 6.6840667699999896 | L14: 9.9217491100000004 | M14: 68.69 | R14: 0.68050936753606595 | S14: =RC[-1] -> 0.68050936753606595 | T14: =(RC[-16]*RC[-15]-RC[-13]*RC[-12])/1000 -> 0.47142868634939805 | U14: 9.7055673599999999 | V14: - | W14: =RC[-2]*RC[-10]/1000 -> 0.66667542195840002 | X14: =ABS((RC[-3]*RC[-11]-RC[-2]*RC[-9])/1000) -> #VALUE! | Y14: =(RC[-14]-RC[1])/RC[-18]*100 -> -2.3819183070764383 | Z14: 9.7055673599999999 | AC14: =VALUE(RC[-27]) -> 2018-09-23T00:00:00.000 | AD14: =IF(RC[21]=42,"*",IF(RC[21]=32,"",RC[21])) -> - | AE14: =RC[-28] -> 24 | AF14: =RC[-28] -> 133.53562926999999 | AG14: =RC[-28] -> 70.72 | AH14: =RC[-28] -> 6.7929465743600002 | AI14: =RC[-28] -> 126.8515625 | AJ14: =RC[-28] -> 70.73 | AK14: =RC[-28] -> 4.2725766354400001 | AL14: =RC[-28] -> -1.0000000000005116E-2 | AM14: =RC[-28] -> 6.6840667699999896 | AN14: =RC[-28] -> 9.9217491100000004 | AO14: =RC[-28] -> 68.69 | AP14: - | AQ14: =RC[-29] -> 0 | AR14: =RC[-29] -> 0 | AS14: - | AT14: =RC[-30] -> 0 | AU14: =RC[-30] -> 0 | AV14: =RC[-30] -> 0.68050936753606595 | AW14: =RC[-30] -> 0.68050936753606595 | AY14: - | AZ14: - | BA14: -
A15: =IF(RC[1]="","",DATEVALUE(RC[1])) -> 43367 | B15: 24.09.18 | C15: 24 | D15: 121.41874695 | E15: 69.55 | F15: 6.9164664025200002 | G15: 114.90483856 | H15: 69.53 | I15: 4.8209672482799997 | J15: =RC[-5]-RC[-2] -> 1.9999999999996021E-2 | K15: 6.5139083900000001 | L15: 9.4588155700000005 | M15: 67.41 | R15: 0.63647647129072304 | S15: =RC[-1] -> 0.63647647129072304 | T15: =(RC[-16]*RC[-15]-RC[-13]*RC[-12])/1000 -> 0.4553404252956989 | U15: 9.2599239299999994 | V15: - | W15: =RC[-2]*RC[-10]/1000 -> 0.6242114721212999 | X15: =ABS((RC[-3]*RC[-11]-RC[-2]*RC[-9])/1000) -> #VALUE! | Y15: =(RC[-14]-RC[1])/RC[-18]*100 -> -2.3898171516651225 | Z15: 9.2599239299999994 | AC15: =VALUE(RC[-27]) -> 2018-09-24T00:00:00.000 | AD15: =IF(RC[21]=42,"*",IF(RC[21]=32,"",RC[21])) -> - | AE15: =RC[-28] -> 24 | AF15: =RC[-28] -> 121.41874695 | AG15: =RC[-28] -> 69.55 | AH15: =RC[-28] -> 6.9164664025200002 | AI15: =RC[-28] -> 114.90483856 | AJ15: =RC[-28] -> 69.53 | AK15: =RC[-28] -> 4.8209672482799997 | AL15: =RC[-28] -> 1.9999999999996021E-2 | AM15: =RC[-28] -> 6.5139083900000001 | AN15: =RC[-28] -> 9.4588155700000005 | AO15: =RC[-28] -> 67.41 | AP15: - | AQ15: =RC[-29] -> 0 | AR15: =RC[-29] -> 0 | AS15: - | AT15: =RC[-30] -> 0 | AU15: =RC[-30] -> 0 | AV15: =RC[-30] -> 0.63647647129072304 | AW15: =RC[-30] -> 0.63647647129072304 | AY15: - | AZ15: - | BA15: -
A16: =IF(RC[1]="","",DATEVALUE(RC[1])) -> 43368 | B16: 25.09.18 | C16: 24 | D16: 105.31254577999999 | E16: 68.12 | F16: 6.9647622406399998 | G16: 98.189308170000004 | H16: 68.069999999999993 | I16: 5.4695271618000003 | J16: =RC[-5]-RC[-2] -> 5.0000000000011369E-2 | K16: 7.1232376099999897 | L16: 9.4806795099999999 | M16: 65.48 | R16: 0.62396445017674596 | S16: =RC[-1] -> 0.62396445017674596 | T16: =(RC[-16]*RC[-15]-RC[-13]*RC[-12])/1000 -> 0.4901444114017004 | U16: 9.2894973800000002 | V16: - | W16: =RC[-2]*RC[-10]/1000 -> 0.60827628844240011 | X16: =ABS((RC[-3]*RC[-11]-RC[-2]*RC[-9])/1000) -> #VALUE! | Y16: =(RC[-14]-RC[1])/RC[-18]*100 -> -2.2062073869076029 | Z16: 9.2894973800000002 | AC16: =VALUE(RC[-27]) -> 2018-09-25T00:00:00.000 | AD16: =IF(RC[21]=42,"*",IF(RC[21]=32,"",RC[21])) -> - | AE16: =RC[-28] -> 24 | AF16: =RC[-28] -> 105.31254577999999 | AG16: =RC[-28] -> 68.12 | AH16: =RC[-28] -> 6.9647622406399998 | AI16: =RC[-28] -> 98.189308170000004 | AJ16: =RC[-28] -> 68.069999999999993 | AK16: =RC[-28] -> 5.4695271618000003 | AL16: =RC[-28] -> 5.0000000000011369E-2 | AM16: =RC[-28] -> 7.1232376099999897 | AN16: =RC[-28] -> 9.4806795099999999 | AO16: =RC[-28] -> 65.48 | AP16: - | AQ16: =RC[-29] -> 0 | AR16: =RC[-29] -> 0 | AS16: - | AT16: =RC[-30] -> 0 | AU16: =RC[-30] -> 0 | AV16: =RC[-30] -> 0.62396445017674596 | AW16: =RC[-30] -> 0.62396445017674596 | AY16: - | AZ16: - | BA16: -
A17: =IF(RC[1]="","",DATEVALUE(RC[1])) -> 43369 | B17: 26.09.18 | C17: 24 | D17: 101.43817138999999 | E17: 67.56 | F17: 6.84748134216 | G17: 93.919677730000004 | H17: 67.48 | I17: 5.4800394246400002 | J17: =RC[-5]-RC[-2] -> 7.9999999999998295E-2 | K17: 7.5184936599999901 | L17: 9.7698259400000005 | M17: 65.209999999999994 | R17: 0.63504190551256301 | S17: =RC[-1] -> 0.63504190551256301 | T17: =(RC[-16]*RC[-15]-RC[-13]*RC[-12])/1000 -> 0.51546300588799931 | U17: 9.5775222800000002 | V17: - | W17: =RC[-2]*RC[-10]/1000 -> 0.62455022787879999 | X17: =ABS((RC[-3]*RC[-11]-RC[-2]*RC[-9])/1000) -> #VALUE! | Y17: =(RC[-14]-RC[1])/RC[-18]*100 -> -2.1923293070907879 | Z17: 9.5775222800000002 | AC17: =VALUE(RC[-27]) -> 2018-09-26T00:00:00.000 | AD17: =IF(RC[21]=42,"*",IF(RC[21]=32,"",RC[21])) -> - | AE17: =RC[-28] -> 24 | AF17: =RC[-28] -> 101.43817138999999 | AG17: =RC[-28] -> 67.56 | AH17: =RC[-28] -> 6.84748134216 | AI17: =RC[-28] -> 93.919677730000004 | AJ17: =RC[-28] -> 67.48 | AK17: =RC[-28] -> 5.4800394246400002 | AL17: =RC[-28] -> 7.9999999999998295E-2 | AM17: =RC[-28] -> 7.5184936599999901 | AN17: =RC[-28] -> 9.7698259400000005 | AO17: =RC[-28] -> 65.209999999999994 | AP17: - | AQ17: =RC[-29] -> 0 | AR17: =RC[-29] -> 0 | AS17: - | AT17: =RC[-30] -> 0 | AU17: =RC[-30] -> 0 | AV17: =RC[-30] -> 0.63504190551256301 | AW17: =RC[-30] -> 0.63504190551256301 | AY17: - | AZ17: - | BA17: -
A18: =IF(RC[1]="","",DATEVALUE(RC[1])) -> 43370 | B18: 27.09.18 | C18: 24 | D18: 90.561599729999998 | E18: 62.89 | F18: 6.5572284601200002 | G18: 81.863739010000003 | H18: 62.81 | I18: 5.5170225981599996 | J18: =RC[-5]-RC[-2] -> 7.9999999999998295E-2 | K18: 8.6978607199999907 | L18: 10.771906850000001 | M18: 61.2 | R18: 0.658658373937136 | S18: =RC[-1] -> 0.658658373937136 | T18: =(RC[-16]*RC[-15]-RC[-13]*RC[-12])/1000 -> 0.55355755980159937 | U18: 10.583018300000001 | V18: - | W18: =RC[-2]*RC[-10]/1000 -> 0.64768071995999998 | X18: =ABS((RC[-3]*RC[-11]-RC[-2]*RC[-9])/1000) -> #VALUE! | Y18: =(RC[-14]-RC[1])/RC[-18]*100 -> -2.3027992647266333 | Z18: 10.583018300000001 | AC18: =VALUE(RC[-27]) -> 2018-09-27T00:00:00.000 | AD18: =IF(RC[21]=42,"*",IF(RC[21]=32,"",RC[21])) -> - | AE18: =RC[-28] -> 24 | AF18: =RC[-28] -> 90.561599729999998 | AG18: =RC[-28] -> 62.89 | AH18: =RC[-28] -> 6.5572284601200002 | AI18: =RC[-28] -> 81.863739010000003 | AJ18: =RC[-28] -> 62.81 | AK18: =RC[-28] -> 5.5170225981599996 | AL18: =RC[-28] -> 7.9999999999998295E-2 | AM18: =RC[-28] -> 8.6978607199999907 | AN18: =RC[-28] -> 10.771906850000001 | AO18: =RC[-28] -> 61.2 | AP18: - | AQ18: =RC[-29] -> 0 | AR18: =RC[-29] -> 0 | AS18: - | AT18: =RC[-30] -> 0 | AU18: =RC[-30] -> 0 | AV18: =RC[-30] -> 0.658658373937136 | AW18: =RC[-30] -> 0.658658373937136 | AY18: - | AZ18: - | BA18: -
A19: =IF(RC[1]="","",DATEVALUE(RC[1])) -> 43371 | B19: 28.09.18 | C19: 24 | D19: 94.006134029999998 | E19: 67.41 | F19: 6.7306705419600004 | G19: 82.837066649999997 | H19: 67.31 | I19: 5.6636324456800002 | J19: =RC[-5]-RC[-2] -> 9.9999999999994316E-2 | K19: 11.16906738 | L19: 13.340815539999999 | M19: 65.83 | R19: 0.87782260915257504 | S19: =RC[-1] -> 0.87782260915257504 | T19: =(RC[-16]*RC[-15]-RC[-13]*RC[-12])/1000 -> 0.76119053875079956 | U19: 13.07209492 | V19: - | W19: =RC[-2]*RC[-10]/1000 -> 0.86053600858359991 | X19: =ABS((RC[-3]*RC[-11]-RC[-2]*RC[-9])/1000) -> #VALUE! | Y19: =(RC[-14]-RC[1])/RC[-18]*100 -> -2.2973140128688998 | Z19: 13.07209492 | AC19: =VALUE(RC[-27]) -> 2018-09-28T00:00:00.000 | AD19: =IF(RC[21]=42,"*",IF(RC[21]=32,"",RC[21])) -> - | AE19: =RC[-28] -> 24 | AF19: =RC[-28] -> 94.006134029999998 | AG19: =RC[-28] -> 67.41 | AH19: =RC[-28] -> 6.7306705419600004 | AI19: =RC[-28] -> 82.837066649999997 | AJ19: =RC[-28] -> 67.31 | AK19: =RC[-28] -> 5.6636324456800002 | AL19: =RC[-28] -> 9.9999999999994316E-2 | AM19: =RC[-28] -> 11.16906738 | AN19: =RC[-28] -> 13.340815539999999 | AO19: =RC[-28] -> 65.83 | AP19: - | AQ19: =RC[-29] -> 0 | AR19: =RC[-29] -> 0 | AS19: - | AT19: =RC[-30] -> 0 | AU19: =RC[-30] -> 0 | AV19: =RC[-30] -> 0.87782260915257504 | AW19: =RC[-30] -> 0.87782260915257504 | AY19: - | AZ19: - | BA19: -
A20: =IF(RC[1]="","",DATEVALUE(RC[1])) -> 43372 | B20: 29.09.18 | C20: 24 | D20: 106.11115264999999 | E20: 67.400000000000006 | F20: 7.4561596359599998 | G20: 95.943656919999995 | H20: 67.349999999999994 | I20: 6.0351665142000002 | J20: =RC[-5]-RC[-2] -> 5.0000000000011369E-2 | K20: 10.167495730000001 | L20: 12.628666880000001 | M20: 66.459999999999994 | R20: 0.826450943441292 | S20: =RC[-1] -> 0.826450943441292 | T20: =(RC[-16]*RC[-15]-RC[-13]*RC[-12])/1000 -> 0.69008639504800162 | U20: 12.376631740000001 | V20: - | W20: =RC[-2]*RC[-10]/1000 -> 0.82255094544039986 | X20: =ABS((RC[-3]*RC[-11]-RC[-2]*RC[-9])/1000) -> #VALUE! | Y20: =(RC[-14]-RC[1])/RC[-18]*100 -> -2.3025347176854307 | Z20: 12.376631740000001 | AC20: =VALUE(RC[-27]) -> 2018-09-29T00:00:00.000 | AD20: =IF(RC[21]=42,"*",IF(RC[21]=32,"",RC[21])) -> - | AE20: =RC[-28] -> 24 | AF20: =RC[-28] -> 106.11115264999999 | AG20: =RC[-28] -> 67.400000000000006 | AH20: =RC[-28] -> 7.4561596359599998 | AI20: =RC[-28] -> 95.943656919999995 | AJ20: =RC[-28] -> 67.349999999999994 | AK20: =RC[-28] -> 6.0351665142000002 | AL20: =RC[-28] -> 5.0000000000011369E-2 | AM20: =RC[-28] -> 10.167495730000001 | AN20: =RC[-28] -> 12.628666880000001 | AO20: =RC[-28] -> 66.459999999999994 | AP20: - | AQ20: =RC[-29] -> 0 | AR20: =RC[-29] -> 0 | AS20: - | AT20: =RC[-30] -> 0 | AU20: =RC[-30] -> 0 | AV20: =RC[-30] -> 0.826450943441292 | AW20: =RC[-30] -> 0.826450943441292 | AY20: - | AZ20: - | BA20: -
A21: =IF(RC[1]="","",DATEVALUE(RC[1])) -> 43373 | B21: 30.09.18 | C21: 24 | D21: 111.07442474 | E21: 69.41 | F21: 7.4272291531199999 | G21: 96.800140380000002 | H21: 66.680000000000007 | I21: 5.9197108052000003 | J21: =RC[-5]-RC[-2] -> 2.7299999999999898 | K21: 14.274284359999999 | L21: 14.88195705 | M21: 68.459999999999994 | R21: 1.01012350721315 | S21: 1.2303757404222799 | T21: =(RC[-16]*RC[-15]-RC[-13]*RC[-12])/1000 -> 1.2550424606649986 | U21: 14.564450259999999 | V21: - | W21: =RC[-2]*RC[-10]/1000 -> 0.99708226479959994 | X21: =ABS((RC[-3]*RC[-11]-RC[-2]*RC[-9])/1000) -> #VALUE! | Y21: =(RC[-14]-RC[1])/RC[-18]*100 -> -0.29975772644638787 | Z21: 14.564450259999999 | AC21: =VALUE(RC[-27]) -> 2018-09-30T00:00:00.000 | AD21: =IF(RC[21]=42,"*",IF(RC[21]=32,"",RC[21])) -> - | AE21: =RC[-28] -> 24 | AF21: =RC[-28] -> 111.07442474 | AG21: =RC[-28] -> 69.41 | AH21: =RC[-28] -> 7.4272291531199999 | AI21: =RC[-28] -> 96.800140380000002 | AJ21: =RC[-28] -> 66.680000000000007 | AK21: =RC[-28] -> 5.9197108052000003 | AL21: =RC[-28] -> 2.7299999999999898 | AM21: =RC[-28] -> 14.274284359999999 | AN21: =RC[-28] -> 14.88195705 | AO21: =RC[-28] -> 68.459999999999994 | AP21: - | AQ21: =RC[-29] -> 0 | AR21: =RC[-29] -> 0 | AS21: - | AT21: =RC[-30] -> 0 | AU21: =RC[-30] -> 0 | AV21: =RC[-30] -> 1.01012350721315 | AW21: =RC[-30] -> 1.2303757404222799 | AY21: - | AZ21: - | BA21: -
A22: =IF(RC[1]="","",DATEVALUE(RC[1])) -> 43374 | B22: 01.10.18 | C22: 24 | D22: 106.72109985 | E22: 68.44 | F22: 7.4584531890400001 | G22: 86.266159060000007 | H22: 44.44 | I22: 6.0132163836799997 | J22: =RC[-5]-RC[-2] -> 24 | K22: 20.454940789999998 | L22: 12.4467268 | M22: 67.489999999999995 | R22: 0.82887311311741696 | S22: 3.50236733304672 | T22: =(RC[-16]*RC[-15]-RC[-13]*RC[-12])/1000 -> 3.4703239651075997 | U22: 12.19042778 | V22: - | W22: =RC[-2]*RC[-10]/1000 -> 0.82273197087219996 | X22: =ABS((RC[-3]*RC[-11]-RC[-2]*RC[-9])/1000) -> #VALUE! | Y22: =(RC[-14]-RC[1])/RC[-18]*100 -> 9.5802491962715628 | Z22: 12.19042778 | AC22: =VALUE(RC[-27]) -> 2018-10-01T00:00:00.000 | AD22: =IF(RC[21]=42,"*",IF(RC[21]=32,"",RC[21])) -> - | AE22: =RC[-28] -> 24 | AF22: =RC[-28] -> 106.72109985 | AG22: =RC[-28] -> 68.44 | AH22: =RC[-28] -> 7.4584531890400001 | AI22: =RC[-28] -> 86.266159060000007 | AJ22: =RC[-28] -> 44.44 | AK22: =RC[-28] -> 6.0132163836799997 | AL22: =RC[-28] -> 24 | AM22: =RC[-28] -> 20.454940789999998 | AN22: =RC[-28] -> 12.4467268 | AO22: =RC[-28] -> 67.489999999999995 | AP22: - | AQ22: =RC[-29] -> 0 | AR22: =RC[-29] -> 0 | AS22: - | AT22: =RC[-30] -> 0 | AU22: =RC[-30] -> 0 | AV22: =RC[-30] -> 0.82887311311741696 | AW22: =RC[-30] -> 3.50236733304672 | AY22: - | AZ22: - | BA22: -
A23: =IF(RC[1]="","",DATEVALUE(RC[1])) -> 43375 | B23: 02.10.18 | C23: 24 | D23: 102.04367065 | E23: 67.239999999999995 | F23: 7.2982116138400004 | G23: 93.521675110000004 | H23: 41.38 | I23: 5.9439703049999997 | J23: =RC[-5]-RC[-2] -> 25.859999999999992 | K23: 8.52199553999999 | L23: 10.49135208 | M23: 64.930000000000007 | R23: 0.68618584599216603 | S23: 3.39544410528327 | T23: =(RC[-16]*RC[-15]-RC[-13]*RC[-12])/1000 -> 2.9914894984541989 | U23: 10.28245544 | V23: - | W23: =RC[-2]*RC[-10]/1000 -> 0.66763983171920005 | X23: =ABS((RC[-3]*RC[-11]-RC[-2]*RC[-9])/1000) -> #VALUE! | Y23: =(RC[-14]-RC[1])/RC[-18]*100 -> -1.8824084341190002 | Z23: 10.28245544 | AC23: =VALUE(RC[-27]) -> 2018-10-02T00:00:00.000 | AD23: =IF(RC[21]=42,"*",IF(RC[21]=32,"",RC[21])) -> - | AE23: =RC[-28] -> 24 | AF23: =RC[-28] -> 102.04367065 | AG23: =RC[-28] -> 67.239999999999995 | AH23: =RC[-28] -> 7.2982116138400004 | AI23: =RC[-28] -> 93.521675110000004 | AJ23: =RC[-28] -> 41.38 | AK23: =RC[-28] -> 5.9439703049999997 | AL23: =RC[-28] -> 25.859999999999992 | AM23: =RC[-28] -> 8.52199553999999 | AN23: =RC[-28] -> 10.49135208 | AO23: =RC[-28] -> 64.930000000000007 | AP23: - | AQ23: =RC[-29] -> 0 | AR23: =RC[-29] -> 0 | AS23: - | AT23: =RC[-30] -> 0 | AU23: =RC[-30] -> 0 | AV23: =RC[-30] -> 0.68618584599216603 | AW23: =RC[-30] -> 3.39544410528327 | AY23: - | AZ23: - | BA23: -
A24: =IF(RC[1]="","",DATEVALUE(RC[1])) -> 43376 | B24: 03.10.18 | C24: 24 | D24: 99.789466860000005 | E24: 67.349999999999994 | F24: 7.2695968427600004 | G24: 92.003875730000004 | H24: 41.53 | I24: 5.9608480271199999 | J24: =RC[-5]-RC[-2] -> 25.819999999999993 | K24: 7.7855911300000002 | L24: 9.7692985500000002 | M24: 65.319999999999993 | R24: 0.64029197716633202 | S24: 2.9003598500047798 | T24: =(RC[-16]*RC[-15]-RC[-13]*RC[-12])/1000 -> 2.8998996339540994 | U24: 9.5739707900000006 | V24: - | W24: =RC[-2]*RC[-10]/1000 -> 0.62537177200279992 | X24: =ABS((RC[-3]*RC[-11]-RC[-2]*RC[-9])/1000) -> #VALUE! | Y24: =(RC[-14]-RC[1])/RC[-18]*100 -> -1.9438090469669829 | Z24: 9.5739707900000006 | AC24: =VALUE(RC[-27]) -> 2018-10-03T00:00:00.000 | AD24: =IF(RC[21]=42,"*",IF(RC[21]=32,"",RC[21])) -> - | AE24: =RC[-28] -> 24 | AF24: =RC[-28] -> 99.789466860000005 | AG24: =RC[-28] -> 67.349999999999994 | AH24: =RC[-28] -> 7.2695968427600004 | AI24: =RC[-28] -> 92.003875730000004 | AJ24: =RC[-28] -> 41.53 | AK24: =RC[-28] -> 5.9608480271199999 | AL24: =RC[-28] -> 25.819999999999993 | AM24: =RC[-28] -> 7.7855911300000002 | AN24: =RC[-28] -> 9.7692985500000002 | AO24: =RC[-28] -> 65.319999999999993 | AP24: - | AQ24: =RC[-29] -> 0 | AR24: =RC[-29] -> 0 | AS24: - | AT24: =RC[-30] -> 0 | AU24: =RC[-30] -> 0 | AV24: =RC[-30] -> 0.64029197716633202 | AW24: =RC[-30] -> 2.9003598500047798 | AY24: - | AZ24: - | BA24: -
A25: =IF(RC[1]="","",DATEVALUE(RC[1])) -> 43377 | B25: 04.10.18 | C25: 24 | D25: 98.739799500000004 | E25: 66.760000000000005 | F25: 7.24506234516 | G25: 89.647796630000002 | H25: 40.909999999999997 | I25: 6.0027016718799997 | J25: =RC[-5]-RC[-2] -> 25.850000000000009 | K25: 9.09200287 | L25: 11.012248039999999 | M25: 64.209999999999994 | R25: 0.71523546383873104 | S25: 3.7399592934938402 | T25: =(RC[-16]*RC[-15]-RC[-13]*RC[-12])/1000 -> 2.9243776544867011 | U25: 10.795833590000001 | V25: - | W25: =RC[-2]*RC[-10]/1000 -> 0.69320047481390001 | X25: =ABS((RC[-3]*RC[-11]-RC[-2]*RC[-9])/1000) -> #VALUE! | Y25: =(RC[-14]-RC[1])/RC[-18]*100 -> -1.9005829301440142 | Z25: 10.795833590000001 | AC25: =VALUE(RC[-27]) -> 2018-10-04T00:00:00.000 | AD25: =IF(RC[21]=42,"*",IF(RC[21]=32,"",RC[21])) -> - | AE25: =RC[-28] -> 24 | AF25: =RC[-28] -> 98.739799500000004 | AG25: =RC[-28] -> 66.760000000000005 | AH25: =RC[-28] -> 7.24506234516 | AI25: =RC[-28] -> 89.647796630000002 | AJ25: =RC[-28] -> 40.909999999999997 | AK25: =RC[-28] -> 6.0027016718799997 | AL25: =RC[-28] -> 25.850000000000009 | AM25: =RC[-28] -> 9.09200287 | AN25: =RC[-28] -> 11.012248039999999 | AO25: =RC[-28] -> 64.209999999999994 | AP25: - | AQ25: =RC[-29] -> 0 | AR25: =RC[-29] -> 0 | AS25: - | AT25: =RC[-30] -> 0 | AU25: =RC[-30] -> 0 | AV25: =RC[-30] -> 0.71523546383873104 | AW25: =RC[-30] -> 3.7399592934938402 | AY25: - | AZ25: - | BA25: -
A26: =IF(RC[1]="","",DATEVALUE(RC[1])) -> 43378 | B26: 05.10.18 | C26: 24 | D26: 99.089164729999993 | E26: 66.13 | F26: 7.1771708474800002 | G26: 90.411483759999996 | H26: 40.450000000000003 | I26: 5.9126616779200001 | J26: =RC[-5]-RC[-2] -> 25.679999999999993 | K26: 8.6776809700000008 | L26: 10.469297409999999 | M26: 63.42 | R26: 0.67430392423808205 | S26: 3.7111807346899801 | T26: =(RC[-16]*RC[-15]-RC[-13]*RC[-12])/1000 -> 2.8956219455028993 | U26: 10.266471859999999 | V26: - | W26: =RC[-2]*RC[-10]/1000 -> 0.65109964536120002 | X26: =ABS((RC[-3]*RC[-11]-RC[-2]*RC[-9])/1000) -> #VALUE! | Y26: =(RC[-14]-RC[1])/RC[-18]*100 -> -1.7572888132413484 | Z26: 10.266471859999999 | AC26: =VALUE(RC[-27]) -> 2018-10-05T00:00:00.000 | AD26: =IF(RC[21]=42,"*",IF(RC[21]=32,"",RC[21])) -> - | AE26: =RC[-28] -> 24 | AF26: =RC[-28] -> 99.089164729999993 | AG26: =RC[-28] -> 66.13 | AH26: =RC[-28] -> 7.1771708474800002 | AI26: =RC[-28] -> 90.411483759999996 | AJ26: =RC[-28] -> 40.450000000000003 | AK26: =RC[-28] -> 5.9126616779200001 | AL26: =RC[-28] -> 25.679999999999993 | AM26: =RC[-28] -> 8.6776809700000008 | AN26: =RC[-28] -> 10.469297409999999 | AO26: =RC[-28] -> 63.42 | AP26: - | AQ26: =RC[-29] -> 0 | AR26: =RC[-29] -> 0 | AS26: - | AT26: =RC[-30] -> 0 | AU26: =RC[-30] -> 0 | AV26: =RC[-30] -> 0.67430392423808205 | AW26: =RC[-30] -> 3.7111807346899801 | AY26: - | AZ26: - | BA26: -
A27: =IF(RC[1]="","",DATEVALUE(RC[1])) -> 43379 | B27: 06.10.18 | C27: 24 | D27: 95.889556880000001 | E27: 66.75 | F27: 7.1916406296800002 | G27: 86.829216000000002 | H27: 40.549999999999997 | I27: 6.0306055302799999 | J27: =RC[-5]-RC[-2] -> 26.200000000000003 | K27: 9.06034088 | L27: 10.82125568 | M27: 64.13 | R27: 0.70578112162033102 | S27: 3.2925437207413801 | T27: =(RC[-16]*RC[-15]-RC[-13]*RC[-12])/1000 -> 2.87970321294 | U27: 10.60711384 | V27: - | W27: =RC[-2]*RC[-10]/1000 -> 0.68023421055919997 | X27: =ABS((RC[-3]*RC[-11]-RC[-2]*RC[-9])/1000) -> #VALUE! | Y27: =(RC[-14]-RC[1])/RC[-18]*100 -> -1.7813968975603789 | Z27: 10.60711384 | AC27: =VALUE(RC[-27]) -> 2018-10-06T00:00:00.000 | AD27: =IF(RC[21]=42,"*",IF(RC[21]=32,"",RC[21])) -> - | AE27: =RC[-28] -> 24 | AF27: =RC[-28] -> 95.889556880000001 | AG27: =RC[-28] -> 66.75 | AH27: =RC[-28] -> 7.1916406296800002 | AI27: =RC[-28] -> 86.829216000000002 | AJ27: =RC[-28] -> 40.549999999999997 | AK27: =RC[-28] -> 6.0306055302799999 | AL27: =RC[-28] -> 26.200000000000003 | AM27: =RC[-28] -> 9.06034088 | AN27: =RC[-28] -> 10.82125568 | AO27: =RC[-28] -> 64.13 | AP27: - | AQ27: =RC[-29] -> 0 | AR27: =RC[-29] -> 0 | AS27: - | AT27: =RC[-30] -> 0 | AU27: =RC[-30] -> 0 | AV27: =RC[-30] -> 0.70578112162033102 | AW27: =RC[-30] -> 3.2925437207413801 | AY27: - | AZ27: - | BA27: -
A28: =IF(RC[1]="","",DATEVALUE(RC[1])) -> 43380 | B28: 07.10.18 | C28: 24 | D28: 101.08483124 | E28: 67.05 | F28: 7.25388258072 | G28: 90.848197940000006 | H28: 41.43 | I28: 5.9749243430799996 | J28: =RC[-5]-RC[-2] -> 25.619999999999997 | K28: 10.236633299999999 | L28: 12.18516254 | M28: 65.010000000000005 | R28: 0.79725844797936396 | S28: 3.4250757045953999 | T28: =(RC[-16]*RC[-15]-RC[-13]*RC[-12])/1000 -> 3.0138970939877989 | U28: 11.942699429999999 | V28: - | W28: =RC[-2]*RC[-10]/1000 -> 0.77639488994429995 | X28: =ABS((RC[-3]*RC[-11]-RC[-2]*RC[-9])/1000) -> #VALUE! | Y28: =(RC[-14]-RC[1])/RC[-18]*100 -> -1.8779306234855182 | Z28: 11.942699429999999 | AC28: =VALUE(RC[-27]) -> 2018-10-07T00:00:00.000 | AD28: =IF(RC[21]=42,"*",IF(RC[21]=32,"",RC[21])) -> - | AE28: =RC[-28] -> 24 | AF28: =RC[-28] -> 101.08483124 | AG28: =RC[-28] -> 67.05 | AH28: =RC[-28] -> 7.25388258072 | AI28: =RC[-28] -> 90.848197940000006 | AJ28: =RC[-28] -> 41.43 | AK28: =RC[-28] -> 5.9749243430799996 | AL28: =RC[-28] -> 25.619999999999997 | AM28: =RC[-28] -> 10.236633299999999 | AN28: =RC[-28] -> 12.18516254 | AO28: =RC[-28] -> 65.010000000000005 | AP28: - | AQ28: =RC[-29] -> 0 | AR28: =RC[-29] -> 0 | AS28: - | AT28: =RC[-30] -> 0 | AU28: =RC[-30] -> 0 | AV28: =RC[-30] -> 0.79725844797936396 | AW28: =RC[-30] -> 3.4250757045953999 | AY28: - | AZ28: - | BA28: -
A29: =IF(RC[1]="","",DATEVALUE(RC[1])) -> 43381 | B29: 08.10.18 | C29: 24 | D29: 105.67967224 | E29: 67.040000000000006 | F29: 7.3880807928400003 | G29: 95.760314940000001 | H29: 41.86 | I29: 5.9143245217600002 | J29: =RC[-5]-RC[-2] -> 25.180000000000007 | K29: 9.9193572999999997 | L29: 10.206633569999999 | M29: 59.49 | R29: 0.66657018247826505 | S29: 5.0976930806343796 | T29: =(RC[-16]*RC[-15]-RC[-13]*RC[-12])/1000 -> 3.0762384435812011 | U29: 10.004060750000001 | V29: - | W29: =RC[-2]*RC[-10]/1000 -> 0.59514157401750001 | X29: =ABS((RC[-3]*RC[-11]-RC[-2]*RC[-9])/1000) -> #VALUE! | Y29: =(RC[-14]-RC[1])/RC[-18]*100 -> -8.8453604244172729E-2 | Z29: 10.004060750000001 | AC29: =VALUE(RC[-27]) -> 2018-10-08T00:00:00.000 | AD29: =IF(RC[21]=42,"*",IF(RC[21]=32,"",RC[21])) -> - | AE29: =RC[-28] -> 24 | AF29: =RC[-28] -> 105.67967224 | AG29: =RC[-28] -> 67.040000000000006 | AH29: =RC[-28] -> 7.3880807928400003 | AI29: =RC[-28] -> 95.760314940000001 | AJ29: =RC[-28] -> 41.86 | AK29: =RC[-28] -> 5.9143245217600002 | AL29: =RC[-28] -> 25.180000000000007 | AM29: =RC[-28] -> 9.9193572999999997 | AN29: =RC[-28] -> 10.206633569999999 | AO29: =RC[-28] -> 59.49 | AP29: - | AQ29: =RC[-29] -> 0 | AR29: =RC[-29] -> 0 | AS29: - | AT29: =RC[-30] -> 0 | AU29: =RC[-30] -> 0 | AV29: =RC[-30] -> 0.66657018247826505 | AW29: =RC[-30] -> 5.0976930806343796 | AY29: - | AZ29: - | BA29: -
A30: =IF(RC[1]="","",DATEVALUE(RC[1])) -> 43382 | B30: 09.10.18 | C30: 24 | D30: 111.46566009999999 | E30: 66.88 | F30: 7.6039877390399999 | G30: 102.58648682 | H30: 42.6 | I30: 5.9536967578000004 | J30: =RC[-5]-RC[-2] -> 24.279999999999994 | K30: 8.8791732799999892 | L30: 10.74527168 | M30: 65.010000000000005 | R30: 0.70225706267316301 | S30: 3.4950660337250401 | T30: =(RC[-16]*RC[-15]-RC[-13]*RC[-12])/1000 -> 3.0846390089559983 | U30: 10.53138828 | V30: - | W30: =RC[-2]*RC[-10]/1000 -> 0.68464555208279998 | X30: =ABS((RC[-3]*RC[-11]-RC[-2]*RC[-9])/1000) -> #VALUE! | Y30: =(RC[-14]-RC[1])/RC[-18]*100 -> -1.6105581263339441 | Z30: 10.53138828 | AC30: =VALUE(RC[-27]) -> 2018-10-09T00:00:00.000 | AD30: =IF(RC[21]=42,"*",IF(RC[21]=32,"",RC[21])) -> - | AE30: =RC[-28] -> 24 | AF30: =RC[-28] -> 111.46566009999999 | AG30: =RC[-28] -> 66.88 | AH30: =RC[-28] -> 7.6039877390399999 | AI30: =RC[-28] -> 102.58648682 | AJ30: =RC[-28] -> 42.6 | AK30: =RC[-28] -> 5.9536967578000004 | AL30: =RC[-28] -> 24.279999999999994 | AM30: =RC[-28] -> 8.8791732799999892 | AN30: =RC[-28] -> 10.74527168 | AO30: =RC[-28] -> 65.010000000000005 | AP30: - | AQ30: =RC[-29] -> 0 | AR30: =RC[-29] -> 0 | AS30: - | AT30: =RC[-30] -> 0 | AU30: =RC[-30] -> 0 | AV30: =RC[-30] -> 0.70225706267316301 | AW30: =RC[-30] -> 3.4950660337250401 | AY30: - | AZ30: - | BA30: -
A31: =IF(RC[1]="","",DATEVALUE(RC[1])) -> 43383 | B31: 10.10.18 | C31: 24 | D31: 110.39889526 | E31: 67.89 | F31: 7.64726096428 | G31: 102.90882111000001 | H31: 43.11 | I31: 6.0029680983200002 | J31: =RC[-5]-RC[-2] -> 24.78 | K31: 7.4900741499999999 | L31: 9.8268032099999996 | M31: 65.45 | R31: 0.65031133084933601 | S31: 3.8657033987771099 | T31: =(RC[-16]*RC[-15]-RC[-13]*RC[-12])/1000 -> 3.0585817211493005 | U31: 9.6265497199999999 | V31: - | W31: =RC[-2]*RC[-10]/1000 -> 0.63005767917400002 | X31: =ABS((RC[-3]*RC[-11]-RC[-2]*RC[-9])/1000) -> #VALUE! | Y31: =(RC[-14]-RC[1])/RC[-18]*100 -> -2.0760859438048613 | Z31: 9.6265497199999999 | AC31: =VALUE(RC[-27]) -> 2018-10-10T00:00:00.000 | AD31: =IF(RC[21]=42,"*",IF(RC[21]=32,"",RC[21])) -> - | AE31: =RC[-28] -> 24 | AF31: =RC[-28] -> 110.39889526 | AG31: =RC[-28] -> 67.89 | AH31: =RC[-28] -> 7.64726096428 | AI31: =RC[-28] -> 102.90882111000001 | AJ31: =RC[-28] -> 43.11 | AK31: =RC[-28] -> 6.0029680983200002 | AL31: =RC[-28] -> 24.78 | AM31: =RC[-28] -> 7.4900741499999999 | AN31: =RC[-28] -> 9.8268032099999996 | AO31: =RC[-28] -> 65.45 | AP31: - | AQ31: =RC[-29] -> 0 | AR31: =RC[-29] -> 0 | AS31: - | AT31: =RC[-30] -> 0 | AU31: =RC[-30] -> 0 | AV31: =RC[-30] -> 0.65031133084933601 | AW31: =RC[-30] -> 3.8657033987771099 | AY31: - | AZ31: - | BA31: -
A32: =IF(RC[1]="","",DATEVALUE(RC[1])) -> 43384 | B32: 11.10.18 | C32: 24 | D32: 112.25934601 | E32: 69.03 | F32: 7.5602875784399997 | G32: 104.82188416 | H32: 43.9 | I32: 5.8526713415199998 | J32: =RC[-5]-RC[-2] -> 25.130000000000003 | K32: 7.4374618500000098 | L32: 9.8379087399999996 | M32: 66.95 | R32: 0.66018718352918704 | S32: 3.5447952254705299 | T32: =(RC[-16]*RC[-15]-RC[-13]*RC[-12])/1000 -> 3.1475819404463001 | U32: 9.6318302199999994 | V32: - | W32: =RC[-2]*RC[-10]/1000 -> 0.64485103322899995 | X32: =ABS((RC[-3]*RC[-11]-RC[-2]*RC[-9])/1000) -> #VALUE! | Y32: =(RC[-14]-RC[1])/RC[-18]*100 -> -2.0934258028128063 | Z32: 9.6318302199999994 | AC32: =VALUE(RC[-27]) -> 2018-10-11T00:00:00.000 | AD32: =IF(RC[21]=42,"*",IF(RC[21]=32,"",RC[21])) -> - | AE32: =RC[-28] -> 24 | AF32: =RC[-28] -> 112.25934601 | AG32: =RC[-28] -> 69.03 | AH32: =RC[-28] -> 7.5602875784399997 | AI32: =RC[-28] -> 104.82188416 | AJ32: =RC[-28] -> 43.9 | AK32: =RC[-28] -> 5.8526713415199998 | AL32: =RC[-28] -> 25.130000000000003 | AM32: =RC[-28] -> 7.4374618500000098 | AN32: =RC[-28] -> 9.8379087399999996 | AO32: =RC[-28] -> 66.95 | AP32: - | AQ32: =RC[-29] -> 0 | AR32: =RC[-29] -> 0 | AS32: - | AT32: =RC[-30] -> 0 | AU32: =RC[-30] -> 0 | AV32: =RC[-30] -> 0.66018718352918704 | AW32: =RC[-30] -> 3.5447952254705299 | AY32: - | AZ32: - | BA32: -
A33: =IF(RC[1]="","",DATEVALUE(RC[1])) -> 43385 | B33: 12.10.18 | C33: 24 | D33: 111.67572020999999 | E33: 68.900000000000006 | F33: 7.5686972050400003 | G33: 103.19075012 | H33: 43.45 | I33: 5.8536420480400002 | J33: =RC[-5]-RC[-2] -> 25.450000000000003 | K33: 8.4849700899999903 | L33: 8.9562654500000001 | M33: 64.81 | R33: 0.59834356310308601 | S33: 4.7952775532626299 | T33: =(RC[-16]*RC[-15]-RC[-13]*RC[-12])/1000 -> 3.2108190297549992 | U33: 8.7703895599999999 | V33: - | W33: =RC[-2]*RC[-10]/1000 -> 0.56840894738359993 | X33: =ABS((RC[-3]*RC[-11]-RC[-2]*RC[-9])/1000) -> #VALUE! | Y33: =(RC[-14]-RC[1])/RC[-18]*100 -> -0.27659404517177827 | Z33: 8.7703895599999999 | AC33: =VALUE(RC[-27]) -> 2018-10-12T00:00:00.000 | AD33: =IF(RC[21]=42,"*",IF(RC[21]=32,"",RC[21])) -> - | AE33: =RC[-28] -> 24 | AF33: =RC[-28] -> 111.67572020999999 | AG33: =RC[-28] -> 68.900000000000006 | AH33: =RC[-28] -> 7.5686972050400003 | AI33: =RC[-28] -> 103.19075012 | AJ33: =RC[-28] -> 43.45 | AK33: =RC[-28] -> 5.8536420480400002 | AL33: =RC[-28] -> 25.450000000000003 | AM33: =RC[-28] -> 8.4849700899999903 | AN33: =RC[-28] -> 8.9562654500000001 | AO33: =RC[-28] -> 64.81 | AP33: - | AQ33: =RC[-29] -> 0 | AR33: =RC[-29] -> 0 | AS33: - | AT33: =RC[-30] -> 0 | AU33: =RC[-30] -> 0 | AV33: =RC[-30] -> 0.59834356310308601 | AW33: =RC[-30] -> 4.7952775532626299 | AY33: - | AZ33: - | BA33: -
A34: =IF(RC[1]="","",DATEVALUE(RC[1])) -> 43386 | B34: 13.10.18 | C34: 24 | D34: 112.70356750000001 | E34: 69.959999999999994 | F34: 7.5805352735999998 | G34: 105.51896667 | H34: 44.05 | I34: 5.8466884302000004 | J34: =RC[-5]-RC[-2] -> 25.909999999999997 | K34: 7.1846008300000097 | L34: 9.2067394300000007 | M34: 66.569999999999993 | R34: 0.62430623626636095 | S34: 4.0216383061048999 | T34: =(RC[-16]*RC[-15]-RC[-13]*RC[-12])/1000 -> 3.2366311004865 | U34: 9.0101747499999991 | V34: - | W34: =RC[-2]*RC[-10]/1000 -> 0.5998073331074999 | X34: =ABS((RC[-3]*RC[-11]-RC[-2]*RC[-9])/1000) -> #VALUE! | Y34: =(RC[-14]-RC[1])/RC[-18]*100 -> -1.7300907861515447 | Z34: 9.0101747499999991 | AC34: =VALUE(RC[-27]) -> 2018-10-13T00:00:00.000 | AD34: =IF(RC[21]=42,"*",IF(RC[21]=32,"",RC[21])) -> - | AE34: =RC[-28] -> 24 | AF34: =RC[-28] -> 112.70356750000001 | AG34: =RC[-28] -> 69.959999999999994 | AH34: =RC[-28] -> 7.5805352735999998 | AI34: =RC[-28] -> 105.51896667 | AJ34: =RC[-28] -> 44.05 | AK34: =RC[-28] -> 5.8466884302000004 | AL34: =RC[-28] -> 25.909999999999997 | AM34: =RC[-28] -> 7.1846008300000097 | AN34: =RC[-28] -> 9.2067394300000007 | AO34: =RC[-28] -> 66.569999999999993 | AP34: - | AQ34: =RC[-29] -> 0 | AR34: =RC[-29] -> 0 | AS34: - | AT34: =RC[-30] -> 0 | AU34: =RC[-30] -> 0 | AV34: =RC[-30] -> 0.62430623626636095 | AW34: =RC[-30] -> 4.0216383061048999 | AY34: - | AZ34: - | BA34: -
A35: =IF(RC[1]="","",DATEVALUE(RC[1])) -> 43387 | B35: 14.10.18 | C35: 24 | D35: 113.68804169000001 | E35: 70.75 | F35: 7.5530942686399998 | G35: 105.34620667 | H35: 44.93 | I35: 5.8267379775599997 | J35: =RC[-5]-RC[-2] -> 25.82 | K35: 8.3418350199999995 | L35: 10.69571114 | M35: 67.75 | R35: 0.73755175790579897 | S35: 4.1011571773191902 | T35: =(RC[-16]*RC[-15]-RC[-13]*RC[-12])/1000 -> 3.3102238838844005 | U35: 10.46009254 | V35: - | W35: =RC[-2]*RC[-10]/1000 -> 0.70867126958500004 | X35: =ABS((RC[-3]*RC[-11]-RC[-2]*RC[-9])/1000) -> #VALUE! | Y35: =(RC[-14]-RC[1])/RC[-18]*100 -> -2.0107582294211146 | Z35: 10.46009254 | AC35: =VALUE(RC[-27]) -> 2018-10-14T00:00:00.000 | AD35: =IF(RC[21]=42,"*",IF(RC[21]=32,"",RC[21])) -> - | AE35: =RC[-28] -> 24 | AF35: =RC[-28] -> 113.68804169000001 | AG35: =RC[-28] -> 70.75 | AH35: =RC[-28] -> 7.5530942686399998 | AI35: =RC[-28] -> 105.34620667 | AJ35: =RC[-28] -> 44.93 | AK35: =RC[-28] -> 5.8267379775599997 | AL35: =RC[-28] -> 25.82 | AM35: =RC[-28] -> 8.3418350199999995 | AN35: =RC[-28] -> 10.69571114 | AO35: =RC[-28] -> 67.75 | AP35: - | AQ35: =RC[-29] -> 0 | AR35: =RC[-29] -> 0 | AS35: - | AT35: =RC[-30] -> 0 | AU35: =RC[-30] -> 0 | AV35: =RC[-30] -> 0.73755175790579897 | AW35: =RC[-30] -> 4.1011571773191902 | AY35: - | AZ35: - | BA35: -
A36: =IF(RC[1]="","",DATEVALUE(RC[1])) -> 43388 | B36: 15.10.18 | C36: 24 | D36: 112.09204102 | E36: 70.25 | F36: 7.5494139919599998 | G36: 105.27470398 | H36: 44.87 | I36: 5.8274830736399998 | J36: =RC[-5]-RC[-2] -> 25.380000000000003 | K36: 6.81733704 | L36: 9.0437574400000003 | M36: 68.58 | R36: 0.61728465176268299 | S36: 3.1540563986815702 | T36: =(RC[-16]*RC[-15]-RC[-13]*RC[-12])/1000 -> 3.1507899140724005 | U36: 8.8483695999999998 | V36: - | W36: =RC[-2]*RC[-10]/1000 -> 0.60682118716799993 | X36: =ABS((RC[-3]*RC[-11]-RC[-2]*RC[-9])/1000) -> #VALUE! | Y36: =(RC[-14]-RC[1])/RC[-18]*100 -> -1.9292693146739732 | Z36: 8.8483695999999998 | AC36: =VALUE(RC[-27]) -> 2018-10-15T00:00:00.000 | AD36: =IF(RC[21]=42,"*",IF(RC[21]=32,"",RC[21])) -> - | AE36: =RC[-28] -> 24 | AF36: =RC[-28] -> 112.09204102 | AG36: =RC[-28] -> 70.25 | AH36: =RC[-28] -> 7.5494139919599998 | AI36: =RC[-28] -> 105.27470398 | AJ36: =RC[-28] -> 44.87 | AK36: =RC[-28] -> 5.8274830736399998 | AL36: =RC[-28] -> 25.380000000000003 | AM36: =RC[-28] -> 6.81733704 | AN36: =RC[-28] -> 9.0437574400000003 | AO36: =RC[-28] -> 68.58 | AP36: - | AQ36: =RC[-29] -> 0 | AR36: =RC[-29] -> 0 | AS36: - | AT36: =RC[-30] -> 0 | AU36: =RC[-30] -> 0 | AV36: =RC[-30] -> 0.61728465176268299 | AW36: =RC[-30] -> 3.1540563986815702 | AY36: - | AZ36: - | BA36: -
A37: =IF(RC[1]="","",DATEVALUE(RC[1])) -> 43389 | B37: 16.10.18 | C37: 24 | D37: 112.19647217000001 | E37: 70.290000000000006 | F37: 7.5381051028400003 | G37: 104.93791962 | H37: 44.8 | I37: 5.8274563391600003 | J37: =RC[-5]-RC[-2] -> 25.490000000000009 | K37: 7.2585525500000001 | L37: 9.3178167300000005 | M37: 68.16 | R37: 0.63567992022547004 | S37: 3.18810422040699 | T37: =(RC[-16]*RC[-15]-RC[-13]*RC[-12])/1000 -> 3.1850712298533015 | U37: 9.1165418599999999 | V37: - | W37: =RC[-2]*RC[-10]/1000 -> 0.62138349317759989 | X37: =ABS((RC[-3]*RC[-11]-RC[-2]*RC[-9])/1000) -> #VALUE! | Y37: =(RC[-14]-RC[1])/RC[-18]*100 -> -1.7705604577717278 | Z37: 9.1165418599999999 | AC37: =VALUE(RC[-27]) -> 2018-10-16T00:00:00.000 | AD37: =IF(RC[21]=42,"*",IF(RC[21]=32,"",RC[21])) -> - | AE37: =RC[-28] -> 24 | AF37: =RC[-28] -> 112.19647217000001 | AG37: =RC[-28] -> 70.290000000000006 | AH37: =RC[-28] -> 7.5381051028400003 | AI37: =RC[-28] -> 104.93791962 | AJ37: =RC[-28] -> 44.8 | AK37: =RC[-28] -> 5.8274563391600003 | AL37: =RC[-28] -> 25.490000000000009 | AM37: =RC[-28] -> 7.2585525500000001 | AN37: =RC[-28] -> 9.3178167300000005 | AO37: =RC[-28] -> 68.16 | AP37: - | AQ37: =RC[-29] -> 0 | AR37: =RC[-29] -> 0 | AS37: - | AT37: =RC[-30] -> 0 | AU37: =RC[-30] -> 0 | AV37: =RC[-30] -> 0.63567992022547004 | AW37: =RC[-30] -> 3.18810422040699 | AY37: - | AZ37: - | BA37: -
A38: =IF(RC[1]="","",DATEVALUE(RC[1])) -> 43390 | B38: 17.10.18 | C38: 24 | D38: 113.63648987000001 | E38: 70.44 | F38: 7.5605545150799998 | G38: 106.1890564 | H38: 44.96 | I38: 5.8079682297600002 | J38: =RC[-5]-RC[-2] -> 25.479999999999997 | K38: 7.4474334700000098 | L38: 9.6567945500000008 | M38: 67.680000000000007 | R38: 0.66131868730295196 | S38: 4.0231216155536504 | T38: =(RC[-16]*RC[-15]-RC[-13]*RC[-12])/1000 -> 3.2302943706987999 | U38: 9.4469070399999993 | V38: - | W38: =RC[-2]*RC[-10]/1000 -> 0.63936666846720003 | X38: =ABS((RC[-3]*RC[-11]-RC[-2]*RC[-9])/1000) -> #VALUE! | Y38: =(RC[-14]-RC[1])/RC[-18]*100 -> -1.8829375057898994 | Z38: 9.4469070399999993 | AC38: =VALUE(RC[-27]) -> 2018-10-17T00:00:00.000 | AD38: =IF(RC[21]=42,"*",IF(RC[21]=32,"",RC[21])) -> - | AE38: =RC[-28] -> 24 | AF38: =RC[-28] -> 113.63648987000001 | AG38: =RC[-28] -> 70.44 | AH38: =RC[-28] -> 7.5605545150799998 | AI38: =RC[-28] -> 106.1890564 | AJ38: =RC[-28] -> 44.96 | AK38: =RC[-28] -> 5.8079682297600002 | AL38: =RC[-28] -> 25.479999999999997 | AM38: =RC[-28] -> 7.4474334700000098 | AN38: =RC[-28] -> 9.6567945500000008 | AO38: =RC[-28] -> 67.680000000000007 | AP38: - | AQ38: =RC[-29] -> 0 | AR38: =RC[-29] -> 0 | AS38: - | AT38: =RC[-30] -> 0 | AU38: =RC[-30] -> 0 | AV38: =RC[-30] -> 0.66131868730295196 | AW38: =RC[-30] -> 4.0231216155536504 | AY38: - | AZ38: - | BA38: -
A39: =IF(RC[1]="","",DATEVALUE(RC[1])) -> 43391 | B39: 18.10.18 | C39: 24 | D39: 115.40489959999999 | E39: 70.92 | F39: 7.5913388606399996 | G39: 108.10355377 | H39: 45.51 | I39: 5.7733345272400003 | J39: =RC[-5]-RC[-2] -> 25.410000000000004 | K39: 7.30134582999999 | L39: 9.5913476899999992 | M39: 69.040000000000006 | R39: 0.66152767746250096 | S39: 3.66278110251266 | T39: =(RC[-16]*RC[-15]-RC[-13]*RC[-12])/1000 -> 3.2647227475592988 | U39: 9.3798875800000001 | V39: - | W39: =RC[-2]*RC[-10]/1000 -> 0.6475874385232 | X39: =ABS((RC[-3]*RC[-11]-RC[-2]*RC[-9])/1000) -> #VALUE! | Y39: =(RC[-14]-RC[1])/RC[-18]*100 -> -1.9227321188924962 | Z39: 9.3798875800000001 | AC39: =VALUE(RC[-27]) -> 2018-10-18T00:00:00.000 | AD39: =IF(RC[21]=42,"*",IF(RC[21]=32,"",RC[21])) -> - | AE39: =RC[-28] -> 24 | AF39: =RC[-28] -> 115.40489959999999 | AG39: =RC[-28] -> 70.92 | AH39: =RC[-28] -> 7.5913388606399996 | AI39: =RC[-28] -> 108.10355377 | AJ39: =RC[-28] -> 45.51 | AK39: =RC[-28] -> 5.7733345272400003 | AL39: =RC[-28] -> 25.410000000000004 | AM39: =RC[-28] -> 7.30134582999999 | AN39: =RC[-28] -> 9.5913476899999992 | AO39: =RC[-28] -> 69.040000000000006 | AP39: - | AQ39: =RC[-29] -> 0 | AR39: =RC[-29] -> 0 | AS39: - | AT39: =RC[-30] -> 0 | AU39: =RC[-30] -> 0 | AV39: =RC[-30] -> 0.66152767746250096 | AW39: =RC[-30] -> 3.66278110251266 | AY39: - | AZ39: - | BA39: -
A40: =IF(RC[1]="","",DATEVALUE(RC[1])) -> 43392 | B40: 19.10.18 | C40: 24 | D40: 115.16246796 | E40: 70.72 | F40: 7.5985965576799996 | G40: 107.71642303 | H40: 45.32 | I40: 5.7892056247600001 | J40: =RC[-5]-RC[-2] -> 25.4 | K40: 7.4460449300000002 | L40: 9.3838014600000008 | M40: 68.27 | R40: 0.64422245629120101 | S40: 3.6596550324830401 | T40: =(RC[-16]*RC[-15]-RC[-13]*RC[-12])/1000 -> 3.2625814424115998 | U40: 9.1787919999999996 | V40: - | W40: =RC[-2]*RC[-10]/1000 -> 0.62663612983999994 | X40: =ABS((RC[-3]*RC[-11]-RC[-2]*RC[-9])/1000) -> #VALUE! | Y40: =(RC[-14]-RC[1])/RC[-18]*100 -> -1.6086192070427492 | Z40: 9.1787919999999996 | AC40: =VALUE(RC[-27]) -> 2018-10-19T00:00:00.000 | AD40: =IF(RC[21]=42,"*",IF(RC[21]=32,"",RC[21])) -> - | AE40: =RC[-28] -> 24 | AF40: =RC[-28] -> 115.16246796 | AG40: =RC[-28] -> 70.72 | AH40: =RC[-28] -> 7.5985965576799996 | AI40: =RC[-28] -> 107.71642303 | AJ40: =RC[-28] -> 45.32 | AK40: =RC[-28] -> 5.7892056247600001 | AL40: =RC[-28] -> 25.4 | AM40: =RC[-28] -> 7.4460449300000002 | AN40: =RC[-28] -> 9.3838014600000008 | AO40: =RC[-28] -> 68.27 | AP40: - | AQ40: =RC[-29] -> 0 | AR40: =RC[-29] -> 0 | AS40: - | AT40: =RC[-30] -> 0 | AU40: =RC[-30] -> 0 | AV40: =RC[-30] -> 0.64422245629120101 | AW40: =RC[-30] -> 3.6596550324830401 | AY40: - | AZ40: - | BA40: -
A41: =IF(RC[1]="","",DATEVALUE(RC[1])) -> 43393 | B41: 20.10.18 | C41: 24 | D41: 115.3263855 | E41: 70.069999999999993 | F41: 7.5861386981600001 | G41: 107.56710815 | H41: 44.25 | I41: 5.7839051569600004 | J41: =RC[-5]-RC[-2] -> 25.819999999999993 | K41: 7.7592773499999996 | L41: 9.7233085599999995 | M41: 67.680000000000007 | R41: 0.661193921371931 | S41: 3.32315432549919 | T41: =(RC[-16]*RC[-15]-RC[-13]*RC[-12])/1000 -> 3.3210752963474999 | U41: 9.5145158799999994 | V41: - | W41: =RC[-2]*RC[-10]/1000 -> 0.64394243475840007 | X41: =ABS((RC[-3]*RC[-11]-RC[-2]*RC[-9])/1000) -> #VALUE! | Y41: =(RC[-14]-RC[1])/RC[-18]*100 -> -1.6317613815111192 | Z41: 9.5145158799999994 | AC41: =VALUE(RC[-27]) -> 2018-10-20T00:00:00.000 | AD41: =IF(RC[21]=42,"*",IF(RC[21]=32,"",RC[21])) -> - | AE41: =RC[-28] -> 24 | AF41: =RC[-28] -> 115.3263855 | AG41: =RC[-28] -> 70.069999999999993 | AH41: =RC[-28] -> 7.5861386981600001 | AI41: =RC[-28] -> 107.56710815 | AJ41: =RC[-28] -> 44.25 | AK41: =RC[-28] -> 5.7839051569600004 | AL41: =RC[-28] -> 25.819999999999993 | AM41: =RC[-28] -> 7.7592773499999996 | AN41: =RC[-28] -> 9.7233085599999995 | AO41: =RC[-28] -> 67.680000000000007 | AP41: - | AQ41: =RC[-29] -> 0 | AR41: =RC[-29] -> 0 | AS41: - | AT41: =RC[-30] -> 0 | AU41: =RC[-30] -> 0 | AV41: =RC[-30] -> 0.661193921371931 | AW41: =RC[-30] -> 3.32315432549919 | AY41: - | AZ41: - | BA41: -
A42: =IF(RC[1]="","",DATEVALUE(RC[1])) -> 43394 | B42: 21.10.18 | C42: 24 | D42: 115.91452026 | E42: 69.17 | F42: 7.5717862619599998 | G42: 107.25243378 | H42: 43.78 | I42: 5.7817289498799997 | J42: =RC[-5]-RC[-2] -> 25.39 | K42: 8.6620864799999993 | L42: 10.70029545 | M42: 67.05 | R42: 0.72051884971816205 | S42: 3.3252314631699602 | T42: =(RC[-16]*RC[-15]-RC[-13]*RC[-12])/1000 -> 3.3222958154958007 | U42: 10.47510147 | V42: - | W42: =RC[-2]*RC[-10]/1000 -> 0.70235555356349999 | X42: =ABS((RC[-3]*RC[-11]-RC[-2]*RC[-9])/1000) -> #VALUE! | Y42: =(RC[-14]-RC[1])/RC[-18]*100 -> -1.6904185071631304 | Z42: 10.47510147 | AC42: =VALUE(RC[-27]) -> 2018-10-21T00:00:00.000 | AD42: =IF(RC[21]=42,"*",IF(RC[21]=32,"",RC[21])) -> - | AE42: =RC[-28] -> 24 | AF42: =RC[-28] -> 115.91452026 | AG42: =RC[-28] -> 69.17 | AH42: =RC[-28] -> 7.5717862619599998 | AI42: =RC[-28] -> 107.25243378 | AJ42: =RC[-28] -> 43.78 | AK42: =RC[-28] -> 5.7817289498799997 | AL42: =RC[-28] -> 25.39 | AM42: =RC[-28] -> 8.6620864799999993 | AN42: =RC[-28] -> 10.70029545 | AO42: =RC[-28] -> 67.05 | AP42: - | AQ42: =RC[-29] -> 0 | AR42: =RC[-29] -> 0 | AS42: - | AT42: =RC[-30] -> 0 | AU42: =RC[-30] -> 0 | AV42: =RC[-30] -> 0.72051884971816205 | AW42: =RC[-30] -> 3.3252314631699602 | AY42: - | AZ42: - | BA42: -
A43: =IF(RC[1]="","",DATEVALUE(RC[1])) -> 43395 | B43: 22.10.18 | C43: 24 | D43: 115.51028442 | E43: 69.540000000000006 | F43: 7.6011820472 | G43: 107.18708801 | H43: 43.78 | I43: 5.8034029601599997 | J43: =RC[-5]-RC[-2] -> 25.760000000000005 | K43: 8.3231964100000102 | L43: 10.439363480000001 | M43: 67.8 | R43: 0.70481794926913199 | S43: 3.34301001241999 | T43: =(RC[-16]*RC[-15]-RC[-13]*RC[-12])/1000 -> 3.3399344654890011 | U43: 10.218259809999999 | V43: - | W43: =RC[-2]*RC[-10]/1000 -> 0.69279801511799999 | X43: =ABS((RC[-3]*RC[-11]-RC[-2]*RC[-9])/1000) -> #VALUE! | Y43: =(RC[-14]-RC[1])/RC[-18]*100 -> -1.7679959733799184 | Z43: 10.218259809999999 | AC43: =VALUE(RC[-27]) -> 2018-10-22T00:00:00.000 | AD43: =IF(RC[21]=42,"*",IF(RC[21]=32,"",RC[21])) -> - | AE43: =RC[-28] -> 24 | AF43: =RC[-28] -> 115.51028442 | AG43: =RC[-28] -> 69.540000000000006 | AH43: =RC[-28] -> 7.6011820472 | AI43: =RC[-28] -> 107.18708801 | AJ43: =RC[-28] -> 43.78 | AK43: =RC[-28] -> 5.8034029601599997 | AL43: =RC[-28] -> 25.760000000000005 | AM43: =RC[-28] -> 8.3231964100000102 | AN43: =RC[-28] -> 10.439363480000001 | AO43: =RC[-28] -> 67.8 | AP43: - | AQ43: =RC[-29] -> 0 | AR43: =RC[-29] -> 0 | AS43: - | AT43: =RC[-30] -> 0 | AU43: =RC[-30] -> 0 | AV43: =RC[-30] -> 0.70481794926913199 | AW43: =RC[-30] -> 3.34301001241999 | AY43: - | AZ43: - | BA43: -
A44: =IF(RC[1]="","",DATEVALUE(RC[1])) ->  | C44: 24 | J44: =RC[-5]-RC[-2] -> #VALUE! | T44: =(RC[-16]*RC[-15]-RC[-13]*RC[-12])/1000 -> #VALUE! | W44: =RC[-2]*RC[-10]/1000 -> #VALUE! | X44: =ABS((RC[-3]*RC[-11]-RC[-2]*RC[-9])/1000) -> #VALUE! | Y44: =(RC[-14]-RC[1])/RC[-18]*100 -> #VALUE! | AC44: =VALUE(RC[-27]) -> #VALUE! | AD44: =IF(RC[21]=42,"*",IF(RC[21]=32,"",RC[21])) ->  | AE44: =RC[-28] -> 24 | AF44: =RC[-28] ->  | AG44: =RC[-28] ->  | AH44: =RC[-28] ->  | AI44: =RC[-28] ->  | AJ44: =RC[-28] ->  | AK44: =RC[-28] ->  | AL44: =RC[-28] -> #VALUE! | AM44: =RC[-28] ->  | AN44: =RC[-28] ->  | AO44: =RC[-28] ->  | AP44: - | AQ44: =RC[-29] -> 0 | AR44: =RC[-29] -> 0 | AS44: - | AT44: =RC[-30] -> 0 | AU44: =RC[-30] -> 0 | AV44: =RC[-30] ->  | AW44: =RC[-30] -> 
A45: =IF(RC[1]="","",DATEVALUE(RC[1])) ->  | C45: 24 | T45: =(RC[-16]*RC[-15]-RC[-13]*RC[-12])/1000 -> #VALUE! | W45: =RC[-2]*RC[-10]/1000 -> #VALUE! | X45: =ABS((RC[-3]*RC[-11]-RC[-2]*RC[-9])/1000) -> #VALUE! | Y45: =(RC[-14]-RC[1])/RC[-18]*100 -> #VALUE! | AC45: =VALUE(RC[-27]) -> #VALUE! | AD45: =IF(RC[21]=42,"*",IF(RC[21]=32,"",RC[21])) ->  | AE45: =RC[-28] -> 24 | AF45: =RC[-28] ->  | AG45: =RC[-28] ->  | AH45: =RC[-28] ->  | AI45: =RC[-28] ->  | AJ45: =RC[-28] ->  | AK45: =RC[-28] ->  | AL45: =RC[-28] -> 0 | AM45: =RC[-28] ->  | AN45: =RC[-28] ->  | AO45: =RC[-28] ->  | AP45: - | AQ45: =RC[-29] -> 0 | AR45: =RC[-29] -> 0 | AS45: - | AT45: =RC[-30] -> 0 | AU45: =RC[-30] -> 0 | AV45: =RC[-30] ->  | AW45: =RC[-30] -> 
A46: =IF(RC[1]="","",DATEVALUE(RC[1])) ->  | C46: 24 | T46: =(RC[-16]*RC[-15]-RC[-13]*RC[-12])/1000 -> #VALUE! | W46: =RC[-2]*RC[-10]/1000 -> #VALUE! | X46: =ABS((RC[-3]*RC[-11]-RC[-2]*RC[-9])/1000) -> #VALUE! | Y46: =(RC[-14]-RC[1])/RC[-18]*100 -> #VALUE! | AC46: =VALUE(RC[-27]) -> #VALUE! | AD46: =IF(RC[21]=42,"*",IF(RC[21]=32,"",RC[21])) ->  | AE46: =RC[-28] -> 24 | AF46: =RC[-28] ->  | AG46: =RC[-28] ->  | AH46: =RC[-28] ->  | AI46: =RC[-28] ->  | AJ46: =RC[-28] ->  | AK46: =RC[-28] ->  | AL46: =RC[-28] -> 0 | AM46: =RC[-28] ->  | AN46: =RC[-28] ->  | AO46: =RC[-28] ->  | AP46: - | AQ46: =RC[-29] -> 0 | AR46: =RC[-29] -> 0 | AS46: - | AT46: =RC[-30] -> 0 | AU46: =RC[-30] -> 0 | AV46: =RC[-30] ->  | AW46: =RC[-30] -> 
A47: =IF(RC[1]="","",DATEVALUE(RC[1])) ->  | C47: 24 | T47: =(RC[-16]*RC[-15]-RC[-13]*RC[-12])/1000 -> #VALUE! | W47: =RC[-2]*RC[-10]/1000 -> #VALUE! | X47: =ABS((RC[-3]*RC[-11]-RC[-2]*RC[-9])/1000) -> #VALUE! | Y47: =(RC[-14]-RC[1])/RC[-18]*100 -> #VALUE! | AC47: =VALUE(RC[-27]) -> #VALUE! | AD47: =IF(RC[21]=42,"*",IF(RC[21]=32,"",RC[21])) ->  | AE47: =RC[-28] -> 24 | AF47: =RC[-28] ->  | AG47: =RC[-28] ->  | AH47: =RC[-28] ->  | AI47: =RC[-28] ->  | AJ47: =RC[-28] ->  | AK47: =RC[-28] ->  | AL47: =RC[-28] -> 0 | AM47: =RC[-28] ->  | AN47: =RC[-28] ->  | AO47: =RC[-28] ->  | AP47: - | AQ47: =RC[-29] -> 0 | AR47: =RC[-29] -> 0 | AS47: - | AT47: =RC[-30] -> 0 | AU47: =RC[-30] -> 0 | AV47: =RC[-30] ->  | AW47: =RC[-30] -> 
A48: =IF(RC[1]="","",DATEVALUE(RC[1])) ->  | C48: 24 | T48: =(RC[-16]*RC[-15]-RC[-13]*RC[-12])/1000 -> #VALUE! | W48: =RC[-2]*RC[-10]/1000 -> #VALUE! | X48: =ABS((RC[-3]*RC[-11]-RC[-2]*RC[-9])/1000) -> #VALUE! | Y48: =(RC[-14]-RC[1])/RC[-18]*100 -> #VALUE! | AC48: =VALUE(RC[-27]) -> #VALUE! | AD48: =IF(RC[21]=42,"*",IF(RC[21]=32,"",RC[21])) ->  | AE48: =RC[-28] -> 24 | AF48: =RC[-28] ->  | AG48: =RC[-28] ->  | AH48: =RC[-28] ->  | AI48: =RC[-28] ->  | AJ48: =RC[-28] ->  | AK48: =RC[-28] ->  | AL48: =RC[-28] -> 0 | AM48: =RC[-28] ->  | AN48: =RC[-28] ->  | AO48: =RC[-28] ->  | AP48: - | AQ48: =RC[-29] -> 0 | AR48: =RC[-29] -> 0 | AS48: - | AT48: =RC[-30] -> 0 | AU48: =RC[-30] -> 0 | AV48: =RC[-30] ->  | AW48: =RC[-30] -> 
A49: =IF(RC[1]="","",DATEVALUE(RC[1])) ->  | C49: 24 | T49: =(RC[-16]*RC[-15]-RC[-13]*RC[-12])/1000 -> #VALUE! | W49: =RC[-2]*RC[-10]/1000 -> #VALUE! | X49: =ABS((RC[-3]*RC[-11]-RC[-2]*RC[-9])/1000) -> #VALUE! | Y49: =(RC[-14]-RC[1])/RC[-18]*100 -> #VALUE! | AC49: =VALUE(RC[-27]) -> #VALUE! | AD49: =IF(RC[21]=42,"*",IF(RC[21]=32,"",RC[21])) ->  | AE49: =RC[-28] -> 24 | AF49: =RC[-28] ->  | AG49: =RC[-28] ->  | AH49: =RC[-28] ->  | AI49: =RC[-28] ->  | AJ49: =RC[-28] ->  | AK49: =RC[-28] ->  | AL49: =RC[-28] -> 0 | AM49: =RC[-28] ->  | AN49: =RC[-28] ->  | AO49: =RC[-28] ->  | AP49: - | AQ49: =RC[-29] -> 0 | AR49: =RC[-29] -> 0 | AS49: - | AT49: =RC[-30] -> 0 | AU49: =RC[-30] -> 0 | AV49: =RC[-30] ->  | AW49: =RC[-30] -> 
A50: =IF(RC[1]="","",DATEVALUE(RC[1])) ->  | T50: =(RC[-16]*RC[-15]-RC[-13]*RC[-12])/1000 -> #VALUE! | W50: =RC[-2]*RC[-10]/1000 -> #VALUE! | X50: =ABS((RC[-3]*RC[-11]-RC[-2]*RC[-9])/1000) -> #VALUE! | Y50: =(RC[-14]-RC[1])/RC[-18]*100 -> #VALUE! | AC50: =VALUE(RC[-27]) -> #VALUE! | AD50: =IF(RC[21]=42,"*",IF(RC[21]=32,"",RC[21])) ->  | AE50: =RC[-28] ->  | AF50: =RC[-28] ->  | AG50: =RC[-28] ->  | AH50: =RC[-28] ->  | AI50: =RC[-28] ->  | AJ50: =RC[-28] ->  | AK50: =RC[-28] ->  | AL50: =RC[-28] -> 0 | AM50: =RC[-28] ->  | AN50: =RC[-28] ->  | AO50: =RC[-28] ->  | AP50: - | AQ50: =RC[-29] -> 0 | AR50: =RC[-29] -> 0 | AS50: - | AT50: =RC[-30] -> 0 | AU50: =RC[-30] -> 0 | AV50: =RC[-30] ->  | AW50: =RC[-30] -> 
A51: =IF(RC[1]="","",DATEVALUE(RC[1])) ->  | T51: =(RC[-16]*RC[-15]-RC[-13]*RC[-12])/1000 -> #VALUE! | W51: =RC[-2]*RC[-10]/1000 -> #VALUE! | X51: =ABS((RC[-3]*RC[-11]-RC[-2]*RC[-9])/1000) -> #VALUE! | Y51: =(RC[-14]-RC[1])/RC[-18]*100 -> #VALUE! | AC51: =VALUE(RC[-27]) -> #VALUE! | AD51: =IF(RC[21]=42,"*",IF(RC[21]=32,"",RC[21])) ->  | AE51: =RC[-28] ->  | AF51: =RC[-28] ->  | AG51: =RC[-28] ->  | AH51: =RC[-28] ->  | AI51: =RC[-28] ->  | AJ51: =RC[-28] ->  | AK51: =RC[-28] ->  | AL51: =RC[-28] -> 0 | AM51: =RC[-28] ->  | AN51: =RC[-28] ->  | AO51: =RC[-28] ->  | AP51: - | AQ51: =RC[-29] -> 0 | AR51: =RC[-29] -> 0 | AS51: - | AT51: =RC[-30] -> 0 | AU51: =RC[-30] -> 0 | AV51: =RC[-30] ->  | AW51: =RC[-30] -> 
A52: =IF(RC[1]="","",DATEVALUE(RC[1])) ->  | T52: =(RC[-16]*RC[-15]-RC[-13]*RC[-12])/1000 -> #VALUE! | W52: =RC[-2]*RC[-10]/1000 -> #VALUE! | X52: =ABS((RC[-3]*RC[-11]-RC[-2]*RC[-9])/1000) -> #VALUE! | Y52: =(RC[-14]-RC[1])/RC[-18]*100 -> #VALUE! | AC52: =VALUE(RC[-27]) -> #VALUE! | AD52: =IF(RC[21]=42,"*",IF(RC[21]=32,"",RC[21])) ->  | AE52: =RC[-28] ->  | AF52: =RC[-28] ->  | AG52: =RC[-28] ->  | AH52: =RC[-28] ->  | AI52: =RC[-28] ->  | AJ52: =RC[-28] ->  | AK52: =RC[-28] ->  | AL52: =RC[-28] -> 0 | AM52: =RC[-28] ->  | AN52: =RC[-28] ->  | AO52: =RC[-28] ->  | AP52: - | AQ52: =RC[-29] -> 0 | AR52: =RC[-29] -> 0 | AS52: - | AT52: =RC[-30] -> 0 | AU52: =RC[-30] -> 0 | AV52: =RC[-30] ->  | AW52: =RC[-30] -> 
A53: =IF(RC[1]="","",DATEVALUE(RC[1])) ->  | T53: =(RC[-16]*RC[-15]-RC[-13]*RC[-12])/1000 -> #VALUE! | W53: =RC[-2]*RC[-10]/1000 -> #VALUE! | X53: =ABS((RC[-3]*RC[-11]-RC[-2]*RC[-9])/1000) -> #VALUE! | Y53: =(RC[-14]-RC[1])/RC[-18]*100 -> #VALUE! | AC53: =VALUE(RC[-27]) -> #VALUE! | AD53: =IF(RC[21]=42,"*",IF(RC[21]=32,"",RC[21])) ->  | AE53: =RC[-28] ->  | AF53: =RC[-28] ->  | AG53: =RC[-28] ->  | AH53: =RC[-28] ->  | AI53: =RC[-28] ->  | AJ53: =RC[-28] ->  | AK53: =RC[-28] ->  | AL53: =RC[-28] -> 0 | AM53: =RC[-28] ->  | AN53: =RC[-28] ->  | AO53: =RC[-28] ->  | AP53: - | AQ53: =RC[-29] -> 0 | AR53: =RC[-29] -> 0 | AS53: - | AT53: =RC[-30] -> 0 | AU53: =RC[-30] -> 0 | AV53: =RC[-30] ->  | AW53: =RC[-30] -> 
A54: =IF(RC[1]="","",DATEVALUE(RC[1])) ->  | T54: =(RC[-16]*RC[-15]-RC[-13]*RC[-12])/1000 -> #VALUE! | W54: =RC[-2]*RC[-10]/1000 -> #VALUE! | X54: =ABS((RC[-3]*RC[-11]-RC[-2]*RC[-9])/1000) -> #VALUE! | Y54: =(RC[-14]-RC[1])/RC[-18]*100 -> #VALUE! | AC54: =VALUE(RC[-27]) -> #VALUE! | AD54: =IF(RC[21]=42,"*",IF(RC[21]=32,"",RC[21])) ->  | AE54: =RC[-28] ->  | AF54: =RC[-28] ->  | AG54: =RC[-28] ->  | AH54: =RC[-28] ->  | AI54: =RC[-28] ->  | AJ54: =RC[-28] ->  | AK54: =RC[-28] ->  | AL54: =RC[-28] -> 0 | AM54: =RC[-28] ->  | AN54: =RC[-28] ->  | AO54: =RC[-28] ->  | AP54: - | AQ54: =RC[-29] -> 0 | AR54: =RC[-29] -> 0 | AS54: - | AT54: =RC[-30] -> 0 | AU54: =RC[-30] -> 0 | AV54: =RC[-30] ->  | AW54: =RC[-30] -> 
A55: =IF(RC[1]="","",DATEVALUE(RC[1])) ->  | T55: =(RC[-16]*RC[-15]-RC[-13]*RC[-12])/1000 -> #VALUE! | W55: =RC[-2]*RC[-10]/1000 -> #VALUE! | X55: =ABS((RC[-3]*RC[-11]-RC[-2]*RC[-9])/1000) -> #VALUE! | Y55: =(RC[-14]-RC[1])/RC[-18]*100 -> #VALUE! | AC55: =VALUE(RC[-27]) -> #VALUE! | AD55: =IF(RC[21]=42,"*",IF(RC[21]=32,"",RC[21])) ->  | AE55: =RC[-28] ->  | AF55: =RC[-28] ->  | AG55: =RC[-28] ->  | AH55: =RC[-28] ->  | AI55: =RC[-28] ->  | AJ55: =RC[-28] ->  | AK55: =RC[-28] ->  | AL55: =RC[-28] -> 0 | AM55: =RC[-28] ->  | AN55: =RC[-28] ->  | AO55: =RC[-28] ->  | AP55: - | AQ55: =RC[-29] -> 0 | AR55: =RC[-29] -> 0 | AS55: - | AT55: =RC[-30] -> 0 | AU55: =RC[-30] -> 0 | AV55: =RC[-30] ->  | AW55: =RC[-30] -> 
A56: =IF(RC[1]="","",DATEVALUE(RC[1])) ->  | T56: =(RC[-16]*RC[-15]-RC[-13]*RC[-12])/1000 -> #VALUE! | W56: =RC[-2]*RC[-10]/1000 -> #VALUE! | X56: =ABS((RC[-3]*RC[-11]-RC[-2]*RC[-9])/1000) -> #VALUE! | Y56: =(RC[-14]-RC[1])/RC[-18]*100 -> #VALUE! | AC56: =VALUE(RC[-27]) -> #VALUE! | AD56: =IF(RC[21]=42,"*",IF(RC[21]=32,"",RC[21])) ->  | AE56: =RC[-28] ->  | AF56: =RC[-28] ->  | AG56: =RC[-28] ->  | AH56: =RC[-28] ->  | AI56: =RC[-28] ->  | AJ56: =RC[-28] ->  | AK56: =RC[-28] ->  | AL56: =RC[-28] -> 0 | AM56: =RC[-28] ->  | AN56: =RC[-28] ->  | AO56: =RC[-28] ->  | AP56: - | AQ56: =RC[-29] -> 0 | AR56: =RC[-29] -> 0 | AS56: - | AT56: =RC[-30] -> 0 | AU56: =RC[-30] -> 0 | AV56: =RC[-30] ->  | AW56: =RC[-30] -> 
A57: =IF(RC[1]="","",DATEVALUE(RC[1])) ->  | T57: =(RC[-16]*RC[-15]-RC[-13]*RC[-12])/1000 -> #VALUE! | W57: =RC[-2]*RC[-10]/1000 -> #VALUE! | X57: =ABS((RC[-3]*RC[-11]-RC[-2]*RC[-9])/1000) -> #VALUE! | Y57: =(RC[-14]-RC[1])/RC[-18]*100 -> #VALUE! | AC57: =VALUE(RC[-27]) -> #VALUE! | AD57: =IF(RC[21]=42,"*",IF(RC[21]=32,"",RC[21])) ->  | AE57: =RC[-28] ->  | AF57: =RC[-28] ->  | AG57: =RC[-28] ->  | AH57: =RC[-28] ->  | AI57: =RC[-28] ->  | AJ57: =RC[-28] ->  | AK57: =RC[-28] ->  | AL57: =RC[-28] -> 0 | AM57: =RC[-28] ->  | AN57: =RC[-28] ->  | AO57: =RC[-28] ->  | AP57: - | AQ57: =RC[-29] -> 0 | AR57: =RC[-29] -> 0 | AS57: - | AT57: =RC[-30] -> 0 | AU57: =RC[-30] -> 0 | AV57: =RC[-30] ->  | AW57: =RC[-30] -> 
A58: =IF(RC[1]="","",DATEVALUE(RC[1])) ->  | T58: =(RC[-16]*RC[-15]-RC[-13]*RC[-12])/1000 -> #VALUE! | W58: =RC[-2]*RC[-10]/1000 -> #VALUE! | X58: =ABS((RC[-3]*RC[-11]-RC[-2]*RC[-9])/1000) -> #VALUE! | Y58: =(RC[-14]-RC[1])/RC[-18]*100 -> #VALUE! | AC58: =VALUE(RC[-27]) -> #VALUE! | AD58: =IF(RC[21]=42,"*",IF(RC[21]=32,"",RC[21])) ->  | AE58: =RC[-28] ->  | AF58: =RC[-28] ->  | AG58: =RC[-28] ->  | AH58: =RC[-28] ->  | AI58: =RC[-28] ->  | AJ58: =RC[-28] ->  | AK58: =RC[-28] ->  | AL58: =RC[-28] -> 0 | AM58: =RC[-28] ->  | AN58: =RC[-28] ->  | AO58: =RC[-28] ->  | AP58: - | AQ58: =RC[-29] -> 0 | AR58: =RC[-29] -> 0 | AS58: - | AT58: =RC[-30] -> 0 | AU58: =RC[-30] -> 0 | AV58: =RC[-30] ->  | AW58: =RC[-30] -> 
A59: =IF(RC[1]="","",DATEVALUE(RC[1])) ->  | T59: =(RC[-16]*RC[-15]-RC[-13]*RC[-12])/1000 -> #VALUE! | W59: =RC[-2]*RC[-10]/1000 -> #VALUE! | X59: =ABS((RC[-3]*RC[-11]-RC[-2]*RC[-9])/1000) -> #VALUE! | Y59: =(RC[-14]-RC[1])/RC[-18]*100 -> #VALUE! | AC59: =VALUE(RC[-27]) -> #VALUE! | AD59: =IF(RC[21]=42,"*",IF(RC[21]=32,"",RC[21])) ->  | AE59: =RC[-28] ->  | AF59: =RC[-28] ->  | AG59: =RC[-28] ->  | AH59: =RC[-28] ->  | AI59: =RC[-28] ->  | AJ59: =RC[-28] ->  | AK59: =RC[-28] ->  | AL59: =RC[-28] -> 0 | AM59: =RC[-28] ->  | AN59: =RC[-28] ->  | AO59: =RC[-28] ->  | AP59: - | AQ59: =RC[-29] -> 0 | AR59: =RC[-29] -> 0 | AS59: - | AT59: =RC[-30] -> 0 | AU59: =RC[-30] -> 0 | AV59: =RC[-30] ->  | AW59: =RC[-30] -> 
A60: =IF(RC[1]="","",DATEVALUE(RC[1])) ->  | T60: =(RC[-16]*RC[-15]-RC[-13]*RC[-12])/1000 -> #VALUE! | W60: =RC[-2]*RC[-10]/1000 -> #VALUE! | X60: =ABS((RC[-3]*RC[-11]-RC[-2]*RC[-9])/1000) -> #VALUE! | Y60: =(RC[-14]-RC[1])/RC[-18]*100 -> #VALUE! | AC60: =VALUE(RC[-27]) -> #VALUE! | AD60: =IF(RC[21]=42,"*",IF(RC[21]=32,"",RC[21])) ->  | AE60: =RC[-28] ->  | AF60: =RC[-28] ->  | AG60: =RC[-28] ->  | AH60: =RC[-28] ->  | AI60: =RC[-28] ->  | AJ60: =RC[-28] ->  | AK60: =RC[-28] ->  | AL60: =RC[-28] -> 0 | AM60: =RC[-28] ->  | AN60: =RC[-28] ->  | AO60: =RC[-28] ->  | AP60: - | AQ60: =RC[-29] -> 0 | AR60: =RC[-29] -> 0 | AS60: - | AT60: =RC[-30] -> 0 | AU60: =RC[-30] -> 0 | AV60: =RC[-30] ->  | AW60: =RC[-30] -> 
A61: =IF(RC[1]="","",DATEVALUE(RC[1])) ->  | T61: =(RC[-16]*RC[-15]-RC[-13]*RC[-12])/1000 -> #VALUE! | W61: =RC[-2]*RC[-10]/1000 -> #VALUE! | X61: =ABS((RC[-3]*RC[-11]-RC[-2]*RC[-9])/1000) -> #VALUE! | Y61: =(RC[-14]-RC[1])/RC[-18]*100 -> #VALUE! | AC61: =VALUE(RC[-27]) -> #VALUE! | AD61: =IF(RC[21]=42,"*",IF(RC[21]=32,"",RC[21])) ->  | AE61: =RC[-28] ->  | AF61: =RC[-28] ->  | AG61: =RC[-28] ->  | AH61: =RC[-28] ->  | AI61: =RC[-28] ->  | AJ61: =RC[-28] ->  | AK61: =RC[-28] ->  | AL61: =RC[-28] -> 0 | AM61: =RC[-28] ->  | AN61: =RC[-28] ->  | AO61: =RC[-28] ->  | AP61: - | AQ61: =RC[-29] -> 0 | AR61: =RC[-29] -> 0 | AS61: - | AT61: =RC[-30] -> 0 | AU61: =RC[-30] -> 0 | AV61: =RC[-30] ->  | AW61: =RC[-30] -> 
A62: =IF(RC[1]="","",DATEVALUE(RC[1])) ->  | T62: =(RC[-16]*RC[-15]-RC[-13]*RC[-12])/1000 -> #VALUE! | W62: =RC[-2]*RC[-10]/1000 -> #VALUE! | X62: =ABS((RC[-3]*RC[-11]-RC[-2]*RC[-9])/1000) -> #VALUE! | Y62: =(RC[-14]-RC[1])/RC[-18]*100 -> #VALUE! | AC62: =VALUE(RC[-27]) -> #VALUE! | AD62: =IF(RC[21]=42,"*",IF(RC[21]=32,"",RC[21])) ->  | AE62: =RC[-28] ->  | AF62: =RC[-28] ->  | AG62: =RC[-28] ->  | AH62: =RC[-28] ->  | AI62: =RC[-28] ->  | AJ62: =RC[-28] ->  | AK62: =RC[-28] ->  | AL62: =RC[-28] -> 0 | AM62: =RC[-28] ->  | AN62: =RC[-28] ->  | AO62: =RC[-28] ->  | AP62: - | AQ62: =RC[-29] -> 0 | AR62: =RC[-29] -> 0 | AS62: - | AT62: =RC[-30] -> 0 | AU62: =RC[-30] -> 0 | AV62: =RC[-30] ->  | AW62: =RC[-30] -> 
A63: =IF(RC[1]="","",DATEVALUE(RC[1])) ->  | T63: =(RC[-16]*RC[-15]-RC[-13]*RC[-12])/1000 -> #VALUE! | W63: =RC[-2]*RC[-10]/1000 -> #VALUE! | X63: =ABS((RC[-3]*RC[-11]-RC[-2]*RC[-9])/1000) -> #VALUE! | Y63: =(RC[-14]-RC[1])/RC[-18]*100 -> #VALUE! | AC63: =VALUE(RC[-27]) -> #VALUE! | AD63: =IF(RC[21]=42,"*",IF(RC[21]=32,"",RC[21])) ->  | AE63: =RC[-28] ->  | AF63: =RC[-28] ->  | AG63: =RC[-28] ->  | AH63: =RC[-28] ->  | AI63: =RC[-28] ->  | AJ63: =RC[-28] ->  | AK63: =RC[-28] ->  | AL63: =RC[-28] -> 0 | AM63: =RC[-28] ->  | AN63: =RC[-28] ->  | AO63: =RC[-28] ->  | AP63: - | AQ63: =RC[-29] -> 0 | AR63: =RC[-29] -> 0 | AS63: - | AT63: =RC[-30] -> 0 | AU63: =RC[-30] -> 0 | AV63: =RC[-30] ->  | AW63: =RC[-30] -> 
A64: =IF(RC[1]="","",DATEVALUE(RC[1])) ->  | T64: =(RC[-16]*RC[-15]-RC[-13]*RC[-12])/1000 -> #VALUE! | W64: =RC[-2]*RC[-10]/1000 -> #VALUE! | X64: =ABS((RC[-3]*RC[-11]-RC[-2]*RC[-9])/1000) -> #VALUE! | Y64: =(RC[-14]-RC[1])/RC[-18]*100 -> #VALUE! | AC64: =VALUE(RC[-27]) -> #VALUE! | AD64: =IF(RC[21]=42,"*",IF(RC[21]=32,"",RC[21])) ->  | AE64: =RC[-28] ->  | AF64: =RC[-28] ->  | AG64: =RC[-28] ->  | AH64: =RC[-28] ->  | AI64: =RC[-28] ->  | AJ64: =RC[-28] ->  | AK64: =RC[-28] ->  | AL64: =RC[-28] -> 0 | AM64: =RC[-28] ->  | AN64: =RC[-28] ->  | AO64: =RC[-28] ->  | AP64: - | AQ64: =RC[-29] -> 0 | AR64: =RC[-29] -> 0 | AS64: - | AT64: =RC[-30] -> 0 | AU64: =RC[-30] -> 0 | AV64: =RC[-30] ->  | AW64: =RC[-30] -> 
A65: =IF(RC[1]="","",DATEVALUE(RC[1])) ->  | T65: =(RC[-16]*RC[-15]-RC[-13]*RC[-12])/1000 -> #VALUE! | W65: =RC[-2]*RC[-10]/1000 -> #VALUE! | X65: =ABS((RC[-3]*RC[-11]-RC[-2]*RC[-9])/1000) -> #VALUE! | Y65: =(RC[-14]-RC[1])/RC[-18]*100 -> #VALUE! | AC65: =VALUE(RC[-27]) -> #VALUE! | AD65: =IF(RC[21]=42,"*",IF(RC[21]=32,"",RC[21])) ->  | AE65: =RC[-28] ->  | AF65: =RC[-28] ->  | AG65: =RC[-28] ->  | AH65: =RC[-28] ->  | AI65: =RC[-28] ->  | AJ65: =RC[-28] ->  | AK65: =RC[-28] ->  | AL65: =RC[-28] -> 0 | AM65: =RC[-28] ->  | AN65: =RC[-28] ->  | AO65: =RC[-28] ->  | AP65: - | AQ65: =RC[-29] -> 0 | AR65: =RC[-29] -> 0 | AS65: - | AT65: =RC[-30] -> 0 | AU65: =RC[-30] -> 0 | AV65: =RC[-30] ->  | AW65: =RC[-30] -> 
A66: =IF(RC[1]="","",DATEVALUE(RC[1])) ->  | T66: =(RC[-16]*RC[-15]-RC[-13]*RC[-12])/1000 -> #VALUE! | W66: =RC[-2]*RC[-10]/1000 -> #VALUE! | X66: =ABS((RC[-3]*RC[-11]-RC[-2]*RC[-9])/1000) -> #VALUE! | Y66: =(RC[-14]-RC[1])/RC[-18]*100 -> #VALUE! | AC66: =VALUE(RC[-27]) -> #VALUE! | AD66: =IF(RC[21]=42,"*",IF(RC[21]=32,"",RC[21])) ->  | AE66: =RC[-28] ->  | AF66: =RC[-28] ->  | AG66: =RC[-28] ->  | AH66: =RC[-28] ->  | AI66: =RC[-28] ->  | AJ66: =RC[-28] ->  | AK66: =RC[-28] ->  | AL66: =RC[-28] -> 0 | AM66: =RC[-28] ->  | AN66: =RC[-28] ->  | AO66: =RC[-28] ->  | AP66: - | AQ66: =RC[-29] -> 0 | AR66: =RC[-29] -> 0 | AS66: - | AT66: =RC[-30] -> 0 | AU66: =RC[-30] -> 0 | AV66: =RC[-30] ->  | AW66: =RC[-30] -> 
A67: =IF(RC[1]="","",DATEVALUE(RC[1])) ->  | T67: =(RC[-16]*RC[-15]-RC[-13]*RC[-12])/1000 -> #VALUE! | W67: =RC[-2]*RC[-10]/1000 -> #VALUE! | X67: =ABS((RC[-3]*RC[-11]-RC[-2]*RC[-9])/1000) -> #VALUE! | Y67: =(RC[-14]-RC[1])/RC[-18]*100 -> #VALUE! | AC67: =VALUE(RC[-27]) -> #VALUE! | AD67: =IF(RC[21]=42,"*",IF(RC[21]=32,"",RC[21])) ->  | AE67: =RC[-28] ->  | AF67: =RC[-28] ->  | AG67: =RC[-28] ->  | AH67: =RC[-28] ->  | AI67: =RC[-28] ->  | AJ67: =RC[-28] ->  | AK67: =RC[-28] ->  | AL67: =RC[-28] -> 0 | AM67: =RC[-28] ->  | AN67: =RC[-28] ->  | AO67: =RC[-28] ->  | AP67: - | AQ67: =RC[-29] -> 0 | AR67: =RC[-29] -> 0 | AS67: - | AT67: =RC[-30] -> 0 | AU67: =RC[-30] -> 0 | AV67: =RC[-30] ->  | AW67: =RC[-30] -> 
A68: =IF(RC[1]="","",DATEVALUE(RC[1])) ->  | T68: =(RC[-16]*RC[-15]-RC[-13]*RC[-12])/1000 -> #VALUE! | W68: =RC[-2]*RC[-10]/1000 -> #VALUE! | X68: =ABS((RC[-3]*RC[-11]-RC[-2]*RC[-9])/1000) -> #VALUE! | Y68: =(RC[-14]-RC[1])/RC[-18]*100 -> #VALUE! | AC68: =VALUE(RC[-27]) -> #VALUE! | AD68: =IF(RC[21]=42,"*",IF(RC[21]=32,"",RC[21])) ->  | AE68: =RC[-28] ->  | AF68: =RC[-28] ->  | AG68: =RC[-28] ->  | AH68: =RC[-28] ->  | AI68: =RC[-28] ->  | AJ68: =RC[-28] ->  | AK68: =RC[-28] ->  | AL68: =RC[-28] -> 0 | AM68: =RC[-28] ->  | AN68: =RC[-28] ->  | AO68: =RC[-28] ->  | AP68: - | AQ68: =RC[-29] -> 0 | AR68: =RC[-29] -> 0 | AS68: - | AT68: =RC[-30] -> 0 | AU68: =RC[-30] -> 0 | AV68: =RC[-30] ->  | AW68: =RC[-30] -> 
A69: =IF(RC[1]="","",DATEVALUE(RC[1])) ->  | T69: =(RC[-16]*RC[-15]-RC[-13]*RC[-12])/1000 -> #VALUE! | W69: =RC[-2]*RC[-10]/1000 -> #VALUE! | X69: =ABS((RC[-3]*RC[-11]-RC[-2]*RC[-9])/1000) -> #VALUE! | Y69: =(RC[-14]-RC[1])/RC[-18]*100 -> #VALUE! | AC69: =VALUE(RC[-27]) -> #VALUE! | AD69: =IF(RC[21]=42,"*",IF(RC[21]=32,"",RC[21])) ->  | AE69: =RC[-28] ->  | AF69: =RC[-28] ->  | AG69: =RC[-28] ->  | AH69: =RC[-28] ->  | AI69: =RC[-28] ->  | AJ69: =RC[-28] ->  | AK69: =RC[-28] ->  | AL69: =RC[-28] -> 0 | AM69: =RC[-28] ->  | AN69: =RC[-28] ->  | AO69: =RC[-28] ->  | AP69: - | AQ69: =RC[-29] -> 0 | AR69: =RC[-29] -> 0 | AS69: - | AT69: =RC[-30] -> 0 | AU69: =RC[-30] -> 0 | AV69: =RC[-30] ->  | AW69: =RC[-30] -> 
A70: =IF(RC[1]="","",DATEVALUE(RC[1])) ->  | T70: =(RC[-16]*RC[-15]-RC[-13]*RC[-12])/1000 -> #VALUE! | W70: =RC[-2]*RC[-10]/1000 -> #VALUE! | X70: =ABS((RC[-3]*RC[-11]-RC[-2]*RC[-9])/1000) -> #VALUE! | Y70: =(RC[-14]-RC[1])/RC[-18]*100 -> #VALUE! | AC70: =VALUE(RC[-27]) -> #VALUE! | AD70: =IF(RC[21]=42,"*",IF(RC[21]=32,"",RC[21])) ->  | AE70: =RC[-28] ->  | AF70: =RC[-28] ->  | AG70: =RC[-28] ->  | AH70: =RC[-28] ->  | AI70: =RC[-28] ->  | AJ70: =RC[-28] ->  | AK70: =RC[-28] ->  | AL70: =RC[-28] -> 0 | AM70: =RC[-28] ->  | AN70: =RC[-28] ->  | AO70: =RC[-28] ->  | AP70: - | AQ70: =RC[-29] -> 0 | AR70: =RC[-29] -> 0 | AS70: - | AT70: =RC[-30] -> 0 | AU70: =RC[-30] -> 0 | AV70: =RC[-30] ->  | AW70: =RC[-30] -> 
A71: =IF(RC[1]="","",DATEVALUE(RC[1])) ->  | T71: =(RC[-16]*RC[-15]-RC[-13]*RC[-12])/1000 -> #VALUE! | W71: =RC[-2]*RC[-10]/1000 -> #VALUE! | X71: =ABS((RC[-3]*RC[-11]-RC[-2]*RC[-9])/1000) -> #VALUE! | Y71: =(RC[-14]-RC[1])/RC[-18]*100 -> #VALUE! | AC71: =VALUE(RC[-27]) -> #VALUE! | AD71: =IF(RC[21]=42,"*",IF(RC[21]=32,"",RC[21])) ->  | AE71: =RC[-28] ->  | AF71: =RC[-28] ->  | AG71: =RC[-28] ->  | AH71: =RC[-28] ->  | AI71: =RC[-28] ->  | AJ71: =RC[-28] ->  | AK71: =RC[-28] ->  | AL71: =RC[-28] -> 0 | AM71: =RC[-28] ->  | AN71: =RC[-28] ->  | AO71: =RC[-28] ->  | AP71: - | AQ71: =RC[-29] -> 0 | AR71: =RC[-29] -> 0 | AS71: - | AT71: =RC[-30] -> 0 | AU71: =RC[-30] -> 0 | AV71: =RC[-30] ->  | AW71: =RC[-30] -> 
A72: =IF(RC[1]="","",DATEVALUE(RC[1])) ->  | T72: =(RC[-16]*RC[-15]-RC[-13]*RC[-12])/1000 -> #VALUE! | W72: =RC[-2]*RC[-10]/1000 -> #VALUE! | X72: =ABS((RC[-3]*RC[-11]-RC[-2]*RC[-9])/1000) -> #VALUE! | Y72: =(RC[-14]-RC[1])/RC[-18]*100 -> #VALUE! | AC72: =VALUE(RC[-27]) -> #VALUE! | AD72: =IF(RC[21]=42,"*",IF(RC[21]=32,"",RC[21])) ->  | AE72: =RC[-28] ->  | AF72: =RC[-28] ->  | AG72: =RC[-28] ->  | AH72: =RC[-28] ->  | AI72: =RC[-28] ->  | AJ72: =RC[-28] ->  | AK72: =RC[-28] ->  | AL72: =RC[-28] -> 0 | AM72: =RC[-28] ->  | AN72: =RC[-28] ->  | AO72: =RC[-28] ->  | AP72: - | AQ72: =RC[-29] -> 0 | AR72: =RC[-29] -> 0 | AS72: - | AT72: =RC[-30] -> 0 | AU72: =RC[-30] -> 0 | AV72: =RC[-30] ->  | AW72: =RC[-30] -> 
A73: =IF(RC[1]="","",DATEVALUE(RC[1])) ->  | T73: =(RC[-16]*RC[-15]-RC[-13]*RC[-12])/1000 -> #VALUE! | W73: =RC[-2]*RC[-10]/1000 -> #VALUE! | X73: =ABS((RC[-3]*RC[-11]-RC[-2]*RC[-9])/1000) -> #VALUE! | Y73: =(RC[-14]-RC[1])/RC[-18]*100 -> #VALUE! | AC73: =VALUE(RC[-27]) -> #VALUE! | AD73: =IF(RC[21]=42,"*",IF(RC[21]=32,"",RC[21])) ->  | AE73: =RC[-28] ->  | AF73: =RC[-28] ->  | AG73: =RC[-28] ->  | AH73: =RC[-28] ->  | AI73: =RC[-28] ->  | AJ73: =RC[-28] ->  | AK73: =RC[-28] ->  | AL73: =RC[-28] -> 0 | AM73: =RC[-28] ->  | AN73: =RC[-28] ->  | AO73: =RC[-28] ->  | AP73: - | AQ73: =RC[-29] -> 0 | AR73: =RC[-29] -> 0 | AS73: - | AT73: =RC[-30] -> 0 | AU73: =RC[-30] -> 0 | AV73: =RC[-30] ->  | AW73: =RC[-30] -> 
A74: =IF(RC[1]="","",DATEVALUE(RC[1])) ->  | T74: =(RC[-16]*RC[-15]-RC[-13]*RC[-12])/1000 -> #VALUE! | W74: =RC[-2]*RC[-10]/1000 -> #VALUE! | X74: =ABS((RC[-3]*RC[-11]-RC[-2]*RC[-9])/1000) -> #VALUE! | Y74: =(RC[-14]-RC[1])/RC[-18]*100 -> #VALUE! | AC74: =VALUE(RC[-27]) -> #VALUE! | AD74: =IF(RC[21]=42,"*",IF(RC[21]=32,"",RC[21])) ->  | AE74: =RC[-28] ->  | AF74: =RC[-28] ->  | AG74: =RC[-28] ->  | AH74: =RC[-28] ->  | AI74: =RC[-28] ->  | AJ74: =RC[-28] ->  | AK74: =RC[-28] ->  | AL74: =RC[-28] -> 0 | AM74: =RC[-28] ->  | AN74: =RC[-28] ->  | AO74: =RC[-28] ->  | AP74: - | AQ74: =RC[-29] -> 0 | AR74: =RC[-29] -> 0 | AS74: - | AT74: =RC[-30] -> 0 | AU74: =RC[-30] -> 0 | AV74: =RC[-30] ->  | AW74: =RC[-30] -> 
A75: =IF(RC[1]="","",DATEVALUE(RC[1])) ->  | T75: =(RC[-16]*RC[-15]-RC[-13]*RC[-12])/1000 -> #VALUE! | W75: =RC[-2]*RC[-10]/1000 -> #VALUE! | X75: =ABS((RC[-3]*RC[-11]-RC[-2]*RC[-9])/1000) -> #VALUE! | Y75: =(RC[-14]-RC[1])/RC[-18]*100 -> #VALUE! | AC75: =VALUE(RC[-27]) -> #VALUE! | AD75: =IF(RC[21]=42,"*",IF(RC[21]=32,"",RC[21])) ->  | AE75: =RC[-28] ->  | AF75: =RC[-28] ->  | AG75: =RC[-28] ->  | AH75: =RC[-28] ->  | AI75: =RC[-28] ->  | AJ75: =RC[-28] ->  | AK75: =RC[-28] ->  | AL75: =RC[-28] -> 0 | AM75: =RC[-28] ->  | AN75: =RC[-28] ->  | AO75: =RC[-28] ->  | AP75: - | AQ75: =RC[-29] -> 0 | AR75: =RC[-29] -> 0 | AS75: - | AT75: =RC[-30] -> 0 | AU75: =RC[-30] -> 0 | AV75: =RC[-30] ->  | AW75: =RC[-30] -> 
A76: =IF(RC[1]="","",DATEVALUE(RC[1])) ->  | T76: =(RC[-16]*RC[-15]-RC[-13]*RC[-12])/1000 -> #VALUE! | W76: =RC[-2]*RC[-10]/1000 -> #VALUE! | X76: =ABS((RC[-3]*RC[-11]-RC[-2]*RC[-9])/1000) -> #VALUE! | Y76: =(RC[-14]-RC[1])/RC[-18]*100 -> #VALUE! | AC76: =VALUE(RC[-27]) -> #VALUE! | AD76: =IF(RC[21]=42,"*",IF(RC[21]=32,"",RC[21])) ->  | AE76: =RC[-28] ->  | AF76: =RC[-28] ->  | AG76: =RC[-28] ->  | AH76: =RC[-28] ->  | AI76: =RC[-28] ->  | AJ76: =RC[-28] ->  | AK76: =RC[-28] ->  | AL76: =RC[-28] -> 0 | AM76: =RC[-28] ->  | AN76: =RC[-28] ->  | AO76: =RC[-28] ->  | AP76: - | AQ76: =RC[-29] -> 0 | AR76: =RC[-29] -> 0 | AS76: - | AT76: =RC[-30] -> 0 | AU76: =RC[-30] -> 0 | AV76: =RC[-30] ->  | AW76: =RC[-30] -> 
A77: =IF(RC[1]="","",DATEVALUE(RC[1])) ->  | T77: =(RC[-16]*RC[-15]-RC[-13]*RC[-12])/1000 -> #VALUE! | W77: =RC[-2]*RC[-10]/1000 -> #VALUE! | X77: =ABS((RC[-3]*RC[-11]-RC[-2]*RC[-9])/1000) -> #VALUE! | Y77: =(RC[-14]-RC[1])/RC[-18]*100 -> #VALUE! | AC77: =VALUE(RC[-27]) -> #VALUE! | AD77: =IF(RC[21]=42,"*",IF(RC[21]=32,"",RC[21])) ->  | AE77: =RC[-28] ->  | AF77: =RC[-28] ->  | AG77: =RC[-28] ->  | AH77: =RC[-28] ->  | AI77: =RC[-28] ->  | AJ77: =RC[-28] ->  | AK77: =RC[-28] ->  | AL77: =RC[-28] -> 0 | AM77: =RC[-28] ->  | AN77: =RC[-28] ->  | AO77: =RC[-28] ->  | AP77: - | AQ77: =RC[-29] -> 0 | AR77: =RC[-29] -> 0 | AS77: - | AT77: =RC[-30] -> 0 | AU77: =RC[-30] -> 0 | AV77: =RC[-30] ->  | AW77: =RC[-30] -> 
A78: =IF(RC[1]="","",DATEVALUE(RC[1])) ->  | T78: =(RC[-16]*RC[-15]-RC[-13]*RC[-12])/1000 -> #VALUE! | W78: =RC[-2]*RC[-10]/1000 -> #VALUE! | X78: =ABS((RC[-3]*RC[-11]-RC[-2]*RC[-9])/1000) -> #VALUE! | Y78: =(RC[-14]-RC[1])/RC[-18]*100 -> #VALUE! | AC78: =VALUE(RC[-27]) -> #VALUE! | AD78: =IF(RC[21]=42,"*",IF(RC[21]=32,"",RC[21])) ->  | AE78: =RC[-28] ->  | AF78: =RC[-28] ->  | AG78: =RC[-28] ->  | AH78: =RC[-28] ->  | AI78: =RC[-28] ->  | AJ78: =RC[-28] ->  | AK78: =RC[-28] ->  | AL78: =RC[-28] -> 0 | AM78: =RC[-28] ->  | AN78: =RC[-28] ->  | AO78: =RC[-28] ->  | AP78: - | AQ78: =RC[-29] -> 0 | AR78: =RC[-29] -> 0 | AS78: - | AT78: =RC[-30] -> 0 | AU78: =RC[-30] -> 0 | AV78: =RC[-30] ->  | AW78: =RC[-30] -> 
A79: =IF(RC[1]="","",DATEVALUE(RC[1])) ->  | T79: =(RC[-16]*RC[-15]-RC[-13]*RC[-12])/1000 -> #VALUE! | W79: =RC[-2]*RC[-10]/1000 -> #VALUE! | X79: =ABS((RC[-3]*RC[-11]-RC[-2]*RC[-9])/1000) -> #VALUE! | Y79: =(RC[-14]-RC[1])/RC[-18]*100 -> #VALUE! | AC79: =VALUE(RC[-27]) -> #VALUE! | AD79: =IF(RC[21]=42,"*",IF(RC[21]=32,"",RC[21])) ->  | AE79: =RC[-28] ->  | AF79: =RC[-28] ->  | AG79: =RC[-28] ->  | AH79: =RC[-28] ->  | AI79: =RC[-28] ->  | AJ79: =RC[-28] ->  | AK79: =RC[-28] ->  | AL79: =RC[-28] -> 0 | AM79: =RC[-28] ->  | AN79: =RC[-28] ->  | AO79: =RC[-28] ->  | AP79: - | AQ79: =RC[-29] -> 0 | AR79: =RC[-29] -> 0 | AS79: - | AT79: =RC[-30] -> 0 | AU79: =RC[-30] -> 0 | AV79: =RC[-30] ->  | AW79: =RC[-30] -> 
A80: =IF(RC[1]="","",DATEVALUE(RC[1])) ->  | T80: =(RC[-16]*RC[-15]-RC[-13]*RC[-12])/1000 -> #VALUE! | W80: =RC[-2]*RC[-10]/1000 -> #VALUE! | X80: =ABS((RC[-3]*RC[-11]-RC[-2]*RC[-9])/1000) -> #VALUE! | Y80: =(RC[-14]-RC[1])/RC[-18]*100 -> #VALUE! | AC80: =VALUE(RC[-27]) -> #VALUE! | AD80: =IF(RC[21]=42,"*",IF(RC[21]=32,"",RC[21])) ->  | AE80: =RC[-28] ->  | AF80: =RC[-28] ->  | AG80: =RC[-28] ->  | AH80: =RC[-28] ->  | AI80: =RC[-28] ->  | AJ80: =RC[-28] ->  | AK80: =RC[-28] ->  | AL80: =RC[-28] -> 0 | AM80: =RC[-28] ->  | AN80: =RC[-28] ->  | AO80: =RC[-28] ->  | AP80: - | AQ80: =RC[-29] -> 0 | AR80: =RC[-29] -> 0 | AS80: - | AT80: =RC[-30] -> 0 | AU80: =RC[-30] -> 0 | AV80: =RC[-30] ->  | AW80: =RC[-30] -> 
A81: =IF(RC[1]="","",DATEVALUE(RC[1])) ->  | T81: =(RC[-16]*RC[-15]-RC[-13]*RC[-12])/1000 -> #VALUE! | W81: =RC[-2]*RC[-10]/1000 -> #VALUE! | X81: =ABS((RC[-3]*RC[-11]-RC[-2]*RC[-9])/1000) -> #VALUE! | Y81: =(RC[-14]-RC[1])/RC[-18]*100 -> #VALUE! | AC81: =VALUE(RC[-27]) -> #VALUE! | AD81: =IF(RC[21]=42,"*",IF(RC[21]=32,"",RC[21])) ->  | AE81: =RC[-28] ->  | AF81: =RC[-28] ->  | AG81: =RC[-28] ->  | AH81: =RC[-28] ->  | AI81: =RC[-28] ->  | AJ81: =RC[-28] ->  | AK81: =RC[-28] ->  | AL81: =RC[-28] -> 0 | AM81: =RC[-28] ->  | AN81: =RC[-28] ->  | AO81: =RC[-28] ->  | AP81: - | AQ81: =RC[-29] -> 0 | AR81: =RC[-29] -> 0 | AS81: - | AT81: =RC[-30] -> 0 | AU81: =RC[-30] -> 0 | AV81: =RC[-30] ->  | AW81: =RC[-30] -> 
A82: =IF(RC[1]="","",DATEVALUE(RC[1])) ->  | T82: =(RC[-16]*RC[-15]-RC[-13]*RC[-12])/1000 -> #VALUE! | W82: =RC[-2]*RC[-10]/1000 -> #VALUE! | X82: =ABS((RC[-3]*RC[-11]-RC[-2]*RC[-9])/1000) -> #VALUE! | Y82: =(RC[-14]-RC[1])/RC[-18]*100 -> #VALUE! | AC82: =VALUE(RC[-27]) -> #VALUE! | AD82: =IF(RC[21]=42,"*",IF(RC[21]=32,"",RC[21])) ->  | AE82: =RC[-28] ->  | AF82: =RC[-28] ->  | AG82: =RC[-28] ->  | AH82: =RC[-28] ->  | AI82: =RC[-28] ->  | AJ82: =RC[-28] ->  | AK82: =RC[-28] ->  | AL82: =RC[-28] -> 0 | AM82: =RC[-28] ->  | AN82: =RC[-28] ->  | AO82: =RC[-28] ->  | AP82: - | AQ82: =RC[-29] -> 0 | AR82: =RC[-29] -> 0 | AS82: - | AT82: =RC[-30] -> 0 | AU82: =RC[-30] -> 0 | AV82: =RC[-30] ->  | AW82: =RC[-30] -> 
A83: =IF(RC[1]="","",DATEVALUE(RC[1])) ->  | T83: =(RC[-16]*RC[-15]-RC[-13]*RC[-12])/1000 -> #VALUE! | W83: =RC[-2]*RC[-10]/1000 -> #VALUE! | X83: =ABS((RC[-3]*RC[-11]-RC[-2]*RC[-9])/1000) -> #VALUE! | Y83: =(RC[-14]-RC[1])/RC[-18]*100 -> #VALUE! | AC83: =VALUE(RC[-27]) -> #VALUE! | AD83: =IF(RC[21]=42,"*",IF(RC[21]=32,"",RC[21])) ->  | AE83: =RC[-28] ->  | AF83: =RC[-28] ->  | AG83: =RC[-28] ->  | AH83: =RC[-28] ->  | AI83: =RC[-28] ->  | AJ83: =RC[-28] ->  | AK83: =RC[-28] ->  | AL83: =RC[-28] -> 0 | AM83: =RC[-28] ->  | AN83: =RC[-28] ->  | AO83: =RC[-28] ->  | AP83: - | AQ83: =RC[-29] -> 0 | AR83: =RC[-29] -> 0 | AS83: - | AT83: =RC[-30] -> 0 | AU83: =RC[-30] -> 0 | AV83: =RC[-30] ->  | AW83: =RC[-30] -> 
AC84: Среднее | AF84: =R[1]C[-28] -> 108.664348602 | AG84: =R[1]C[-28] -> 68.487666666666669 | AH84: =R[1]C[-28] -> 7.3362007418973327 | AI84: =R[1]C[-28] -> 99.840003712666672 | AJ84: =R[1]C[-28] -> 49.727333333333327 | AK84: =R[1]C[-28] -> 5.7554261603040002 | AL84: =R[1]C[-28] -> 18.760333333333335 | AM84: =R[1]C[-28] -> 8.8243448893333341 | AN84: =R[1]C[-28] -> 10.492719204333333 | AO84: =R[1]C[-28] -> 66.117999999999995 | AP84: - | AQ84: =R[1]C[-29] -> 0 | AR84: =R[1]C[-29] -> 0 | AS84: - | AT84: =R[1]C[-30] -> 0 | AU84: =R[1]C[-30] -> 0
B85: Среднее | D85: =AVERAGE(OFFSET(R[-74]C,3,0,R7C1,1)) -> 108.664348602 | E85: =AVERAGE(OFFSET(R[-74]C,3,0,R7C1,1)) -> 68.487666666666669 | F85: =AVERAGE(OFFSET(R[-74]C,3,0,R7C1,1)) -> 7.3362007418973327 | G85: =AVERAGE(OFFSET(R[-74]C,3,0,R7C1,1)) -> 99.840003712666672 | H85: =AVERAGE(OFFSET(R[-74]C,3,0,R7C1,1)) -> 49.727333333333327 | I85: =AVERAGE(OFFSET(R[-74]C,3,0,R7C1,1)) -> 5.7554261603040002 | J85: =AVERAGE(OFFSET(R[-74]C,3,0,R7C1,1)) -> 18.760333333333335 | K85: =AVERAGE(OFFSET(R[-74]C,3,0,R7C1,1)) -> 8.8243448893333341 | L85: =IF(SUM(OFFSET(R[-74]C,3,0,R7C1,1))=0,"",AVERAGE(OFFSET(R[-74]C,3,0,R7C1,1))) -> 10.492719204333333 | M85: =IF(SUM(OFFSET(R[-74]C,3,0,R7C1,1))=0,"",AVERAGE(OFFSET(R[-74]C,3,0,R7C1,1))) -> 66.117999999999995 | R85: =IF(SUM(OFFSET(R[-74]C,3,0,R7C1,1))=0,"",AVERAGE(OFFSET(R[-74]C,3,0,R7C1,1))) -> 0.69810229841406335 | S85: =AVERAGE(OFFSET(R[-74]C,3,0,R7C1,1)) -> 2.8912225183115186 | T85: =AVERAGE(OFFSET(R[-74]C,3,0,R7C1,1)) -> 2.4823015632606631 | W85: =AVERAGE(OFFSET(R[-74]C,3,0,R7C1,1)) -> 0.6793570151217535 | X85: =AVERAGE(OFFSET(R[-74]C,3,0,R7C1,1)) -> #VALUE! | AC85: Итого | AE85: =R[1]C[-28] -> 720 | AF85: =R[1]C[-28] -> 3259.9304580600001 | AI85: =R[1]C[-28] -> 2995.2001113800002 | AM85: =R[1]C[-28] -> 264.73034668000003 | AN85: =R[1]C[-28] -> 314.78157613000002 | AQ85: =R[1]C[-29] -> 0 | AU85: =R[1]C[-30] -> 0 | AV85: =R[1]C[-30] -> 20.9430689524219 | AW85: =R[1]C[-30] -> 86.736675549345563
B86: ИТОГО: | C86: =SUM(OFFSET(R[-75]C,3,0,R7C1,1)) -> 720 | D86: =SUM(OFFSET(R[-75]C,3,0,R7C1,1)) -> 3259.9304580600001 | G86: =SUM(OFFSET(R[-75]C,3,0,R7C1,1)) -> 2995.2001113800002 | K86: =SUM(OFFSET(R[-75]C,3,0,R7C1,1)) -> 264.73034668000003 | L86: =IF(SUM(OFFSET(R[-75]C,3,0,R7C1,1))=0,"",SUM(OFFSET(R[-75]C,3,0,R7C1,1))) -> 314.78157613000002 | R86: =IF(SUM(OFFSET(R[-75]C,3,0,R7C1,1))=0,"",SUM(OFFSET(R[-75]C,3,0,R7C1,1))) -> 20.9430689524219 | S86: =SUM(OFFSET(R[-75]C,3,0,R7C1,1)) -> 86.736675549345563 | T86: =SUM(OFFSET(R[-75]C,3,0,R7C1,1)) -> 74.469046897819894 | W86: =SUM(OFFSET(R[-75]C,3,0,R7C1,1)) -> 20.380710453652604 | X86: =SUM(OFFSET(R[-75]C,3,0,R7C1,1)) -> #VALUE!
AC87: Досчёт | AF87: =R[1]C[-28] -> 0 | AI87: =R[1]C[-28] -> 0 | AM87: =R[1]C[-28] -> 0 | AN87: =R[1]C[-28] -> 0 | AQ87: =R[1]C[-29] -> 0 | AU87: =R[1]C[-30] -> 0 | AV87: =R[1]C[-30] -> 0 | AW87: =R[1]C[-30] -> 0
A88: 11дн=264ч 4дн=96ч | B88: Досчёт до конца м-ца (+) | C88: =R6C1*24 -> 216 | T88: № B011 | AC88: Снятие | AF88: =-R[1]C[-28] -> 0 | AI88: =-R[1]C[-28] -> 0 | AM88: =-R[1]C[-28] -> 0 | AN88: =-R[1]C[-28] -> 0 | AQ88: =-R[1]C[-29] -> 0 | AU88: =-R[1]C[-30] -> 0 | AV88: =-R[1]C[-30] -> 0 | AW88: =-R[1]C[-30] -> 0
A89: 9дн=216ч 7дн=168ч | B89: Вычет с предыдущего (-) | C89: =R4C1*24 -> 192 | AC89: Сумма | AF89: =R[1]C[-28] -> 3259.9304580600001 | AI89: =R[1]C[-28] -> 2995.2001113800002 | AM89: =R[1]C[-28] -> 264.73034668000003 | AN89: =R[1]C[-28] -> 314.78157613000002 | AQ89: =R[1]C[-29] -> 0 | AU89: =R[1]C[-30] -> 0 | AV89: =R[1]C[-30] -> 20.9430689524219 | AW89: =R[1]C[-30] -> 86.736675549345563
B90: СУММА: | C90: =R[-4]C+R[-2]C-R[-1]C -> 744 | D90: =R[-4]C+R[-2]C-R[-1]C -> 3259.9304580600001 | G90: =R[-4]C+R[-2]C-R[-1]C -> 2995.2001113800002 | K90: =R[-4]C+R[-2]C-R[-1]C -> 264.73034668000003 | L90: =IF(SUM(OFFSET(R[-79]C,3,0,R7C1,1))=0,"",(R[-4]C+R[-2]C-R[-1]C)) -> 314.78157613000002 | R90: =IF(SUM(OFFSET(R[-79]C,3,0,R7C1,1))=0,"",(R[-4]C+R[-2]C-R[-1]C)) -> 20.9430689524219 | S90: =R[-4]C+R[-2]C-R[-1]C -> 86.736675549345563
AC91: Тхв на источнике | AE91: V гвс (м3) | AF91: =R[-2]C[15] -> 0 | AG91: W гвс (Гкал) | AH91: =RC[-2]*0.06 -> 0 | AI91: W без гвс (Гкал) | AJ91: =R[-2]C[13]-RC[-2] -> 86.736675549345563
B92: Показания счетчиков на момент снятия данных:
B93: Дата, время | D93: М1, т | F93: М2, т | H93: М3, т | J93: М4, т | L93: Qо, Гкал | N93: Qг, Гкал | P93: время, час
B94: 23.09.18 02:06 | D94: 62231.2890625 | F94: 54837.9921875 | H94: 7634.4375 | J94: - | L94: 2196.5147998614698 | N94: 554.07040757141499 | P94: -
B95: 23.10.18 02:10 | D95: 65490.2578125 | F95: 57832.05859375 | H95: 7942.8076171900002 | J95: - | L95: 2292.6297474347998 | N95: 575.01735598070104 | P95: -
AC97: =ZAYAVKA_N -> з.н д. №02/147-2783 от 04.10.18 01.10.18г некорректная работа приборов
B98: Представитель потребителя:_______________________________________________________________________ В.О. Топорков
I101: Рекомендуемые значения по параметрам теплопотребления (не являются официально утверждёнными)
I102: М, т | J102: V, м3 | K102: Qгвс, Гкал | L102: Qотоп, Гкал | M102: Qо, Гкал
I103: =R[-13]C[-3] -> 0 | J103: =RC[-1]/0.98 -> 0 | K103: =RC[-1]*0.06 -> 0 | L103: =RC[1]-RC[-1] -> 20.9430689524219 | M103: =R[-13]C[5] -> 20.9430689524219
O105: ДЛЯ САМОКОНТРОЛЯ
B106: В строке выбора дат указать период с 16.7.13 по 23.8.13 - жильё | N106: Q | O106: Qг
B107: В строке выбора дат указать период с 18.7.13 по 25.8.13 - не жилое | N107: =(R[-21]C[-10]*R[-22]C[-7]-R[-21]C[-9]*R[-22]C[-6])/1000 -> 325.4714690357456 | O107: =IF(R[-22]C[-2]="",R[-21]C[-3]*R[-22]C/1000,"") ->  | P107: Си2
O108: =IF(R[-23]C[-2]="","",((R[-22]C[-3]*R[-23]C)-(R[-22]C[-2]*R[-23]C[2]))/1000) -> 0 | P108: Си3