Sheet: Лист1
G1: Отчёт о теплопотреблении за октябрь 2018 | M1: з.н д. №02/147-2783 от 04.10.18 28.09.18г некорректная работа приборов
A4: =EOMONTH(R[9]C,0)-R[9]C -> 8 | B4: Потребитель: ЗАО "Сити Сервис"
A5: =MAX(R[9]C:R[78]C) -> 2018-10-22T00:00:00.000 | B5: Адрес: г. СПб, Морская наб., д.43 к.1 ИТП 4
A6: =EOMONTH(R[-1]C,0)-R[-1]C -> 9 | B6: Телефон: 8-911-021-19-79
A7: =R[-2]C-R[6]C -> 30 | B7: Договор 10023 (.) 85567
A8: 7 | B8: Тепловычислитель: ВКТ-7 № 44981 | L8: М2 мах= | M8: 130.8 | O8: Мгвс мах= | P8: 163.2
L9: Qотоп мах= | M9: 9.816 | O9: Qгвс мах= | P9: 9.84
B10: Расчётная формула: Q=M1*(h1-hхв)-M2*(h2-hхв)
D12: Учёт - ОТОПЛЕНИЕ | M12: Учёт - ГВС
A13: =R[1]C-1 -> 43365 | B13: Дата | C13: N, ч | D13: M1, т | E13: T1, С | F13: P1, кг/см2 | G13: M2, т | H13: T2, С | I13: P2, кг/см2 | J13: dT, гр.C | K13: M1-М2, т | L13: Qотоп, Гкал | M13: V3, м3 | N13: T3, С | O13: V4, м3 | P13: T4, С | Q13: dT, гр.C | R13: V3-V4, м3 | S13: Qгвс, Гкал | T13: Qобщ. | U13: Qo | V13: M3 | W13: M4 | X13: си4 | Y13: си5 | Z13: ТСО | AA13: Внутр. | AD13: Дата | AE13: НС | AF13: n, ч | AG13: М1, т | AH13: t1, гр. С | AI13: Р1, кгс/см2 | AJ13: М2, т | AK13: t2, гр. С | AL13: Р2, кгс/см2 | AM13: t1-t2, гр. С | AN13: М1-М2, т | AO13: Wотоп, Гкал | AP13: М1гвс, т | AQ13: t1гвс, гр. С | AR13: Р1гвс, кгс/см2 | AS13: М2гвс, т | AT13: t2гвс, гр. С | AU13: Р2гвс, кгс/см2 | AV13: t1гвс-t2гвс | AW13: М1гвс-М2гвс, т | AX13: Wгвс, Гкал | AY13: Wсумм, Гкал | BA13: NS_TV1 | BB13: НС | BC13: NS_TV2
A14: =IF(RC[1]="","",DATEVALUE(RC[1])) -> 43366 | B14: 23.09.18 | C14: 24 | D14: 0 | E14: 19.18 | F14: 7.53 | G14: 0 | H14: 18.3 | I14: 5.43 | J14: =RC[-5]-RC[-2] -> 0.87999999999999901 | K14: 0 | L14: 0 | M14: 36.83 | N14: 67.36 | O14: 0 | P14: 25.71 | Q14: =RC[-3]-RC[-1] -> 41.65 | R14: 36.83 | S14: 2.431 | T14: =RC[-1] -> 2.431 | U14: =(RC[-17]*RC[-16]-RC[-14]*RC[-13])/1000 -> 0 | V14: =RC[-11]/RC[-15]*100 -> #DIV/0! | W14: 0 | X14: =RC[-2]*RC[-10]/1000 -> #DIV/0! | Y14: =(RC[-3]*RC[-11]-RC[-2]*RC[-9])/1000 -> #DIV/0! | Z14: 2013-11-23T00:00:00.000 | AA14: 2013-11-21T00:00:00.000 | AD14: =VALUE(RC[-28]) -> 2018-09-23T00:00:00.000 | AE14: =IF(RC[22]=42,"*",IF(RC[22]=32,"",RC[22])) -> - | AF14: =RC[-29] -> 24 | AG14: =RC[-29] -> 0 | AH14: =RC[-29] -> 19.18 | AI14: =RC[-29] -> 7.53 | AJ14: =RC[-29] -> 0 | AK14: =RC[-29] -> 18.3 | AL14: =RC[-29] -> 5.43 | AM14: =RC[-29] -> 0.87999999999999901 | AN14: =RC[-29] -> 0 | AO14: =RC[-29] -> 0 | AP14: =RC[-29] -> 36.83 | AQ14: =RC[-29] -> 67.36 | AR14: - | AS14: =RC[-30] -> 0 | AT14: =RC[-30] -> 25.71 | AU14: - | AV14: =RC[-31] -> 41.65 | AW14: =RC[-31] -> 36.83 | AX14: =RC[-31] -> 2.431 | AY14: =RC[-31] -> 2.431 | BA14: - | BB14: - | BC14: -
A15: =IF(RC[1]="","",DATEVALUE(RC[1])) -> 43367 | B15: 24.09.18 | C15: 24 | D15: 0 | E15: 18.29 | F15: 7.53 | G15: 0 | H15: 17.690000000000001 | I15: 5.43 | J15: =RC[-5]-RC[-2] -> 0.59999999999999787 | K15: 0 | L15: 0 | M15: 35.99 | N15: 66.400000000000006 | O15: 0 | P15: 24.88 | Q15: =RC[-3]-RC[-1] -> 41.52000000000001 | R15: 35.99 | S15: 2.343 | T15: =RC[-1] -> 2.343 | U15: =(RC[-17]*RC[-16]-RC[-14]*RC[-13])/1000 -> 0 | V15: =RC[-11]/RC[-15]*100 -> #DIV/0! | W15: 0 | X15: =RC[-2]*RC[-10]/1000 -> #DIV/0! | Y15: =(RC[-3]*RC[-11]-RC[-2]*RC[-9])/1000 -> #DIV/0! | Z15: 2013-11-24T00:00:00.000 | AA15: 2013-11-22T00:00:00.000 | AD15: =VALUE(RC[-28]) -> 2018-09-24T00:00:00.000 | AE15: =IF(RC[22]=42,"*",IF(RC[22]=32,"",RC[22])) -> - | AF15: =RC[-29] -> 24 | AG15: =RC[-29] -> 0 | AH15: =RC[-29] -> 18.29 | AI15: =RC[-29] -> 7.53 | AJ15: =RC[-29] -> 0 | AK15: =RC[-29] -> 17.690000000000001 | AL15: =RC[-29] -> 5.43 | AM15: =RC[-29] -> 0.59999999999999787 | AN15: =RC[-29] -> 0 | AO15: =RC[-29] -> 0 | AP15: =RC[-29] -> 35.99 | AQ15: =RC[-29] -> 66.400000000000006 | AR15: - | AS15: =RC[-30] -> 0 | AT15: =RC[-30] -> 24.88 | AU15: - | AV15: =RC[-31] -> 41.52000000000001 | AW15: =RC[-31] -> 35.99 | AX15: =RC[-31] -> 2.343 | AY15: =RC[-31] -> 2.343 | BA15: - | BB15: - | BC15: -
A16: =IF(RC[1]="","",DATEVALUE(RC[1])) -> 43368 | B16: 25.09.18 | C16: 24 | D16: 0 | E16: 17.63 | F16: 7.53 | G16: 0 | H16: 17.149999999999999 | I16: 5.43 | J16: =RC[-5]-RC[-2] -> 0.48000000000000043 | K16: 0 | L16: 0 | M16: 33.840000000000003 | N16: 64.959999999999994 | O16: 0 | P16: 24.02 | Q16: =RC[-3]-RC[-1] -> 40.94 | R16: 33.840000000000003 | S16: 2.1579999999999999 | T16: =RC[-1] -> 2.1579999999999999 | U16: =(RC[-17]*RC[-16]-RC[-14]*RC[-13])/1000 -> 0 | V16: =RC[-11]/RC[-15]*100 -> #DIV/0! | W16: 0 | X16: =RC[-2]*RC[-10]/1000 -> #DIV/0! | Y16: =(RC[-3]*RC[-11]-RC[-2]*RC[-9])/1000 -> #DIV/0! | Z16: 2013-11-25T00:00:00.000 | AA16: 2013-11-23T00:00:00.000 | AD16: =VALUE(RC[-28]) -> 2018-09-25T00:00:00.000 | AE16: =IF(RC[22]=42,"*",IF(RC[22]=32,"",RC[22])) -> - | AF16: =RC[-29] -> 24 | AG16: =RC[-29] -> 0 | AH16: =RC[-29] -> 17.63 | AI16: =RC[-29] -> 7.53 | AJ16: =RC[-29] -> 0 | AK16: =RC[-29] -> 17.149999999999999 | AL16: =RC[-29] -> 5.43 | AM16: =RC[-29] -> 0.48000000000000043 | AN16: =RC[-29] -> 0 | AO16: =RC[-29] -> 0 | AP16: =RC[-29] -> 33.840000000000003 | AQ16: =RC[-29] -> 64.959999999999994 | AR16: - | AS16: =RC[-30] -> 0 | AT16: =RC[-30] -> 24.02 | AU16: - | AV16: =RC[-31] -> 40.94 | AW16: =RC[-31] -> 33.840000000000003 | AX16: =RC[-31] -> 2.1579999999999999 | AY16: =RC[-31] -> 2.1579999999999999 | BA16: - | BB16: - | BC16: -
A17: =IF(RC[1]="","",DATEVALUE(RC[1])) -> 43369 | B17: 26.09.18 | C17: 24 | D17: 48.31 | E17: 64.83 | F17: 7.53 | G17: 52.07 | H17: 49.21 | I17: 5.43 | J17: =RC[-5]-RC[-2] -> 15.619999999999997 | K17: -3.76 | L17: 0.80500000000000005 | M17: 37.130000000000003 | N17: 64.33 | O17: 0 | P17: 24.66 | Q17: =RC[-3]-RC[-1] -> 39.67 | R17: 37.130000000000003 | S17: 2.3439999999999999 | T17: =RC[-8]+RC[-1] -> 3.149 | U17: =(RC[-17]*RC[-16]-RC[-14]*RC[-13])/1000 -> 0.56957259999999998 | V17: =RC[-11]/RC[-15]*100 -> -7.2210485884386406 | W17: 0 | X17: =RC[-2]*RC[-10]/1000 -> -0.4645300556942577 | Y17: =(RC[-3]*RC[-11]-RC[-2]*RC[-9])/1000 -> -0.4645300556942577 | Z17: 2013-11-26T00:00:00.000 | AA17: 2013-11-24T00:00:00.000 | AD17: =VALUE(RC[-28]) -> 2018-09-26T00:00:00.000 | AE17: =IF(RC[22]=42,"*",IF(RC[22]=32,"",RC[22])) -> - | AF17: =RC[-29] -> 24 | AG17: =RC[-29] -> 48.31 | AH17: =RC[-29] -> 64.83 | AI17: =RC[-29] -> 7.53 | AJ17: =RC[-29] -> 52.07 | AK17: =RC[-29] -> 49.21 | AL17: =RC[-29] -> 5.43 | AM17: =RC[-29] -> 15.619999999999997 | AN17: =RC[-29] -> -3.76 | AO17: =RC[-29] -> 0.80500000000000005 | AP17: =RC[-29] -> 37.130000000000003 | AQ17: =RC[-29] -> 64.33 | AR17: - | AS17: =RC[-30] -> 0 | AT17: =RC[-30] -> 24.66 | AU17: - | AV17: =RC[-31] -> 39.67 | AW17: =RC[-31] -> 37.130000000000003 | AX17: =RC[-31] -> 2.3439999999999999 | AY17: =RC[-31] -> 3.149 | BA17: - | BB17: - | BC17: -
A18: =IF(RC[1]="","",DATEVALUE(RC[1])) -> 43370 | B18: 27.09.18 | C18: 24 | D18: 149.74 | E18: 56.97 | F18: 7.53 | G18: 149.18 | H18: 45 | I18: 5.43 | J18: =RC[-5]-RC[-2] -> 11.969999999999999 | K18: 0.56000000000000005 | L18: 1.8180000000000001 | M18: 35.82 | N18: 60.25 | O18: 0 | P18: 25.12 | Q18: =RC[-3]-RC[-1] -> 35.129999999999995 | R18: 35.82 | S18: 2.1179999999999999 | T18: =RC[-8]+RC[-1] -> 3.9359999999999999 | U18: =(RC[-17]*RC[-16]-RC[-14]*RC[-13])/1000 -> 1.8175877999999994 | V18: =RC[-11]/RC[-15]*100 -> 0.37538544040756139 | W18: 0 | X18: =RC[-2]*RC[-10]/1000 -> 2.2616972784555576E-2 | Y18: =(RC[-3]*RC[-11]-RC[-2]*RC[-9])/1000 -> 2.2616972784555576E-2 | Z18: 2013-11-27T00:00:00.000 | AA18: 2013-11-25T00:00:00.000 | AD18: =VALUE(RC[-28]) -> 2018-09-27T00:00:00.000 | AE18: =IF(RC[22]=42,"*",IF(RC[22]=32,"",RC[22])) -> - | AF18: =RC[-29] -> 24 | AG18: =RC[-29] -> 149.74 | AH18: =RC[-29] -> 56.97 | AI18: =RC[-29] -> 7.53 | AJ18: =RC[-29] -> 149.18 | AK18: =RC[-29] -> 45 | AL18: =RC[-29] -> 5.43 | AM18: =RC[-29] -> 11.969999999999999 | AN18: =RC[-29] -> 0.56000000000000005 | AO18: =RC[-29] -> 1.8180000000000001 | AP18: =RC[-29] -> 35.82 | AQ18: =RC[-29] -> 60.25 | AR18: - | AS18: =RC[-30] -> 0 | AT18: =RC[-30] -> 25.12 | AU18: - | AV18: =RC[-31] -> 35.129999999999995 | AW18: =RC[-31] -> 35.82 | AX18: =RC[-31] -> 2.1179999999999999 | AY18: =RC[-31] -> 3.9359999999999999 | BA18: - | BB18: - | BC18: -
A19: =IF(RC[1]="","",DATEVALUE(RC[1])) -> 43371 | B19: 28.09.18 | C19: 24 | D19: =AVERAGE(R[1]C:R[3]C) -> 175.75666666666666 | E19: =AVERAGE(R[1]C:R[3]C) -> 53.31 | F19: =AVERAGE(R[1]C:R[3]C) -> 7.53 | G19: =AVERAGE(R[1]C:R[3]C) -> 174.02333333333331 | H19: =AVERAGE(R[1]C:R[3]C) -> 40.493333333333339 | I19: =AVERAGE(R[1]C:R[3]C) -> 5.43 | J19: =AVERAGE(R[1]C:R[3]C) -> 12.816666666666665 | K19: =AVERAGE(R[1]C:R[3]C) -> 1.7333333333333332 | L19: =AVERAGE(R[1]C:R[3]C) -> 2.3249999999999997 | M19: 33.409999999999997 | N19: 63.84 | O19: 0 | P19: 25.05 | Q19: =RC[-3]-RC[-1] -> 38.790000000000006 | R19: 33.409999999999997 | S19: 2.0939999999999999 | T19: =RC[-8]+RC[-1] -> 4.4189999999999996 | U19: =(RC[-17]*RC[-16]-RC[-14]*RC[-13])/1000 -> 2.3228030555555561 | V19: =RC[-11]/RC[-15]*100 -> 0.9960350144616622 | W19: 0 | X19: =RC[-2]*RC[-10]/1000 -> 6.3586875323232525E-2 | Y19: =(RC[-3]*RC[-11]-RC[-2]*RC[-9])/1000 -> 6.3586875323232525E-2 | Z19: 2013-11-28T00:00:00.000 | AA19: 2013-11-26T00:00:00.000 | AD19: =VALUE(RC[-28]) -> 2018-09-28T00:00:00.000 | AE19: =IF(RC[22]=42,"*",IF(RC[22]=32,"",RC[22])) -> - | AF19: =RC[-29] -> 24 | AG19: =RC[-29] -> 175.75666666666666 | AH19: =RC[-29] -> 53.31 | AI19: =RC[-29] -> 7.53 | AJ19: =RC[-29] -> 174.02333333333331 | AK19: =RC[-29] -> 40.493333333333339 | AL19: =RC[-29] -> 5.43 | AM19: =RC[-29] -> 12.816666666666665 | AN19: =RC[-29] -> 1.7333333333333332 | AO19: =RC[-29] -> 2.3249999999999997 | AP19: =RC[-29] -> 33.409999999999997 | AQ19: =RC[-29] -> 63.84 | AR19: - | AS19: =RC[-30] -> 0 | AT19: =RC[-30] -> 25.05 | AU19: - | AV19: =RC[-31] -> 38.790000000000006 | AW19: =RC[-31] -> 33.409999999999997 | AX19: =RC[-31] -> 2.0939999999999999 | AY19: =RC[-31] -> 4.4189999999999996 | BA19: - | BB19: - | BC19: -
A20: =IF(RC[1]="","",DATEVALUE(RC[1])) -> 43372 | B20: 29.09.18 | C20: 24 | D20: 181.26 | E20: 51.85 | F20: 7.53 | G20: 180.86 | H20: 39.590000000000003 | I20: 5.43 | J20: =RC[-5]-RC[-2] -> 12.259999999999998 | K20: 0.4 | L20: 2.2410000000000001 | M20: 36.409999999999997 | N20: 63.82 | O20: 0 | P20: 24.64 | Q20: =RC[-3]-RC[-1] -> 39.18 | R20: 36.409999999999997 | S20: 2.2799999999999998 | T20: =RC[-8]+RC[-1] -> 4.5209999999999999 | U20: =(RC[-17]*RC[-16]-RC[-14]*RC[-13])/1000 -> 2.2380835999999991 | V20: =RC[-11]/RC[-15]*100 -> 0.22116554240849276 | W20: 0 | X20: =RC[-2]*RC[-10]/1000 -> 1.4114784916510009E-2 | Y20: =(RC[-3]*RC[-11]-RC[-2]*RC[-9])/1000 -> 1.4114784916510009E-2 | Z20: 2013-11-29T00:00:00.000 | AA20: 2013-11-27T00:00:00.000 | AD20: =VALUE(RC[-28]) -> 2018-09-29T00:00:00.000 | AE20: =IF(RC[22]=42,"*",IF(RC[22]=32,"",RC[22])) -> - | AF20: =RC[-29] -> 24 | AG20: =RC[-29] -> 181.26 | AH20: =RC[-29] -> 51.85 | AI20: =RC[-29] -> 7.53 | AJ20: =RC[-29] -> 180.86 | AK20: =RC[-29] -> 39.590000000000003 | AL20: =RC[-29] -> 5.43 | AM20: =RC[-29] -> 12.259999999999998 | AN20: =RC[-29] -> 0.4 | AO20: =RC[-29] -> 2.2410000000000001 | AP20: =RC[-29] -> 36.409999999999997 | AQ20: =RC[-29] -> 63.82 | AR20: - | AS20: =RC[-30] -> 0 | AT20: =RC[-30] -> 24.64 | AU20: - | AV20: =RC[-31] -> 39.18 | AW20: =RC[-31] -> 36.409999999999997 | AX20: =RC[-31] -> 2.2799999999999998 | AY20: =RC[-31] -> 4.5209999999999999 | BA20: - | BB20: - | BC20: -
A21: =IF(RC[1]="","",DATEVALUE(RC[1])) -> 43373 | B21: 30.09.18 | C21: 24 | D21: 175.08 | E21: 55.29 | F21: 7.53 | G21: 172.51 | H21: 41.71 | I21: 5.43 | J21: =RC[-5]-RC[-2] -> 13.579999999999998 | K21: 2.57 | L21: 2.4870000000000001 | M21: 35.090000000000003 | N21: 66.209999999999994 | O21: 0 | P21: 25.36 | Q21: =RC[-3]-RC[-1] -> 40.849999999999994 | R21: 35.090000000000003 | S21: 2.2749999999999999 | T21: =RC[-8]+RC[-1] -> 4.7620000000000005 | U21: =(RC[-17]*RC[-16]-RC[-14]*RC[-13])/1000 -> 2.4847811000000011 | V21: =RC[-11]/RC[-15]*100 -> 1.4897687090603442 | W21: 0 | X21: =RC[-2]*RC[-10]/1000 -> 9.8637586226885371E-2 | Y21: =(RC[-3]*RC[-11]-RC[-2]*RC[-9])/1000 -> 9.8637586226885371E-2 | Z21: 2013-11-30T00:00:00.000 | AA21: 2013-11-28T00:00:00.000 | AD21: =VALUE(RC[-28]) -> 2018-09-30T00:00:00.000 | AE21: =IF(RC[22]=42,"*",IF(RC[22]=32,"",RC[22])) -> - | AF21: =RC[-29] -> 24 | AG21: =RC[-29] -> 175.08 | AH21: =RC[-29] -> 55.29 | AI21: =RC[-29] -> 7.53 | AJ21: =RC[-29] -> 172.51 | AK21: =RC[-29] -> 41.71 | AL21: =RC[-29] -> 5.43 | AM21: =RC[-29] -> 13.579999999999998 | AN21: =RC[-29] -> 2.57 | AO21: =RC[-29] -> 2.4870000000000001 | AP21: =RC[-29] -> 35.090000000000003 | AQ21: =RC[-29] -> 66.209999999999994 | AR21: - | AS21: =RC[-30] -> 0 | AT21: =RC[-30] -> 25.36 | AU21: - | AV21: =RC[-31] -> 40.849999999999994 | AW21: =RC[-31] -> 35.090000000000003 | AX21: =RC[-31] -> 2.2749999999999999 | AY21: =RC[-31] -> 4.7620000000000005 | BA21: - | BB21: - | BC21: -
A22: =IF(RC[1]="","",DATEVALUE(RC[1])) -> 43374 | B22: 01.10.18 | C22: 24 | D22: 170.93 | E22: 52.79 | F22: 7.53 | G22: 168.7 | H22: 40.18 | I22: 5.43 | J22: =RC[-5]-RC[-2] -> 12.61 | K22: 2.23 | L22: 2.2469999999999999 | M22: 33.15 | N22: 64.78 | O22: 0 | P22: 26.03 | Q22: =RC[-3]-RC[-1] -> 38.75 | R22: 33.15 | S22: 2.11 | T22: =RC[-8]+RC[-1] -> 4.3569999999999993 | U22: =(RC[-17]*RC[-16]-RC[-14]*RC[-13])/1000 -> 2.2450287000000015 | V22: =RC[-11]/RC[-15]*100 -> 1.3218731475992889 | W22: 0 | X22: =RC[-2]*RC[-10]/1000 -> 8.5630942501481941E-2 | Y22: =(RC[-3]*RC[-11]-RC[-2]*RC[-9])/1000 -> 8.5630942501481941E-2 | Z22: 2013-12-01T00:00:00.000 | AA22: 2013-11-29T00:00:00.000 | AD22: =VALUE(RC[-28]) -> 2018-10-01T00:00:00.000 | AE22: =IF(RC[22]=42,"*",IF(RC[22]=32,"",RC[22])) -> - | AF22: =RC[-29] -> 24 | AG22: =RC[-29] -> 170.93 | AH22: =RC[-29] -> 52.79 | AI22: =RC[-29] -> 7.53 | AJ22: =RC[-29] -> 168.7 | AK22: =RC[-29] -> 40.18 | AL22: =RC[-29] -> 5.43 | AM22: =RC[-29] -> 12.61 | AN22: =RC[-29] -> 2.23 | AO22: =RC[-29] -> 2.2469999999999999 | AP22: =RC[-29] -> 33.15 | AQ22: =RC[-29] -> 64.78 | AR22: - | AS22: =RC[-30] -> 0 | AT22: =RC[-30] -> 26.03 | AU22: - | AV22: =RC[-31] -> 38.75 | AW22: =RC[-31] -> 33.15 | AX22: =RC[-31] -> 2.11 | AY22: =RC[-31] -> 4.3569999999999993 | BA22: - | BB22: - | BC22: -
A23: =IF(RC[1]="","",DATEVALUE(RC[1])) -> 43375 | B23: 02.10.18 | C23: 24 | D23: 167.05 | E23: 52.75 | F23: 7.53 | G23: 164.97 | H23: 39.67 | I23: 5.43 | J23: =RC[-5]-RC[-2] -> 13.079999999999998 | K23: 2.08 | L23: 2.2650000000000001 | M23: 33.47 | N23: 63.67 | O23: 0 | P23: 26.1 | Q23: =RC[-3]-RC[-1] -> 37.57 | R23: 33.47 | S23: 2.093 | T23: =RC[-8]+RC[-1] -> 4.3580000000000005 | U23: =(RC[-17]*RC[-16]-RC[-14]*RC[-13])/1000 -> 2.2675276000000002 | V23: =RC[-11]/RC[-15]*100 -> 1.2608353033884949 | W23: 0 | X23: =RC[-2]*RC[-10]/1000 -> 8.0277383766745466E-2 | Y23: =(RC[-3]*RC[-11]-RC[-2]*RC[-9])/1000 -> 8.0277383766745466E-2 | Z23: 2013-12-02T00:00:00.000 | AA23: 2013-11-30T00:00:00.000 | AD23: =VALUE(RC[-28]) -> 2018-10-02T00:00:00.000 | AE23: =IF(RC[22]=42,"*",IF(RC[22]=32,"",RC[22])) -> - | AF23: =RC[-29] -> 24 | AG23: =RC[-29] -> 167.05 | AH23: =RC[-29] -> 52.75 | AI23: =RC[-29] -> 7.53 | AJ23: =RC[-29] -> 164.97 | AK23: =RC[-29] -> 39.67 | AL23: =RC[-29] -> 5.43 | AM23: =RC[-29] -> 13.079999999999998 | AN23: =RC[-29] -> 2.08 | AO23: =RC[-29] -> 2.2650000000000001 | AP23: =RC[-29] -> 33.47 | AQ23: =RC[-29] -> 63.67 | AR23: - | AS23: =RC[-30] -> 0 | AT23: =RC[-30] -> 26.1 | AU23: - | AV23: =RC[-31] -> 37.57 | AW23: =RC[-31] -> 33.47 | AX23: =RC[-31] -> 2.093 | AY23: =RC[-31] -> 4.3580000000000005 | BA23: - | BB23: - | BC23: -
A24: =IF(RC[1]="","",DATEVALUE(RC[1])) -> 43376 | B24: 03.10.18 | C24: 24 | D24: 166.39 | E24: 54.41 | F24: 7.53 | G24: 165.58 | H24: 39.83 | I24: 5.43 | J24: =RC[-5]-RC[-2] -> 14.579999999999998 | K24: 0.81 | L24: 2.4609999999999999 | M24: 35.450000000000003 | N24: 63.84 | O24: 0 | P24: 26.18 | Q24: =RC[-3]-RC[-1] -> 37.660000000000004 | R24: 35.450000000000003 | S24: 2.222 | T24: =RC[-8]+RC[-1] -> 4.6829999999999998 | U24: =(RC[-17]*RC[-16]-RC[-14]*RC[-13])/1000 -> 2.4582284999999993 | V24: =RC[-11]/RC[-15]*100 -> 0.48918951564198576 | W24: 0 | X24: =RC[-2]*RC[-10]/1000 -> 3.1229858678584372E-2 | Y24: =(RC[-3]*RC[-11]-RC[-2]*RC[-9])/1000 -> 3.1229858678584372E-2 | Z24: 2013-12-03T00:00:00.000 | AA24: 2013-12-01T00:00:00.000 | AD24: =VALUE(RC[-28]) -> 2018-10-03T00:00:00.000 | AE24: =IF(RC[22]=42,"*",IF(RC[22]=32,"",RC[22])) -> - | AF24: =RC[-29] -> 24 | AG24: =RC[-29] -> 166.39 | AH24: =RC[-29] -> 54.41 | AI24: =RC[-29] -> 7.53 | AJ24: =RC[-29] -> 165.58 | AK24: =RC[-29] -> 39.83 | AL24: =RC[-29] -> 5.43 | AM24: =RC[-29] -> 14.579999999999998 | AN24: =RC[-29] -> 0.81 | AO24: =RC[-29] -> 2.4609999999999999 | AP24: =RC[-29] -> 35.450000000000003 | AQ24: =RC[-29] -> 63.84 | AR24: - | AS24: =RC[-30] -> 0 | AT24: =RC[-30] -> 26.18 | AU24: - | AV24: =RC[-31] -> 37.660000000000004 | AW24: =RC[-31] -> 35.450000000000003 | AX24: =RC[-31] -> 2.222 | AY24: =RC[-31] -> 4.6829999999999998 | BA24: - | BB24: - | BC24: -
A25: =IF(RC[1]="","",DATEVALUE(RC[1])) -> 43377 | B25: 04.10.18 | C25: 24 | D25: 165.44 | E25: 54.95 | F25: 7.53 | G25: 164.48 | H25: 39.799999999999997 | I25: 5.43 | J25: =RC[-5]-RC[-2] -> 15.150000000000006 | K25: 0.96 | L25: 2.548 | M25: 33.270000000000003 | N25: 63.35 | O25: 0 | P25: 25.81 | Q25: =RC[-3]-RC[-1] -> 37.540000000000006 | R25: 33.270000000000003 | S25: 2.0670000000000002 | T25: =RC[-8]+RC[-1] -> 4.6150000000000002 | U25: =(RC[-17]*RC[-16]-RC[-14]*RC[-13])/1000 -> 2.5446240000000007 | V25: =RC[-11]/RC[-15]*100 -> 0.58365758754863817 | W25: 0 | X25: =RC[-2]*RC[-10]/1000 -> 3.6974708171206232E-2 | Y25: =(RC[-3]*RC[-11]-RC[-2]*RC[-9])/1000 -> 3.6974708171206232E-2 | Z25: 2013-12-04T00:00:00.000 | AA25: 2013-12-02T00:00:00.000 | AD25: =VALUE(RC[-28]) -> 2018-10-04T00:00:00.000 | AE25: =IF(RC[22]=42,"*",IF(RC[22]=32,"",RC[22])) -> - | AF25: =RC[-29] -> 24 | AG25: =RC[-29] -> 165.44 | AH25: =RC[-29] -> 54.95 | AI25: =RC[-29] -> 7.53 | AJ25: =RC[-29] -> 164.48 | AK25: =RC[-29] -> 39.799999999999997 | AL25: =RC[-29] -> 5.43 | AM25: =RC[-29] -> 15.150000000000006 | AN25: =RC[-29] -> 0.96 | AO25: =RC[-29] -> 2.548 | AP25: =RC[-29] -> 33.270000000000003 | AQ25: =RC[-29] -> 63.35 | AR25: - | AS25: =RC[-30] -> 0 | AT25: =RC[-30] -> 25.81 | AU25: - | AV25: =RC[-31] -> 37.540000000000006 | AW25: =RC[-31] -> 33.270000000000003 | AX25: =RC[-31] -> 2.0670000000000002 | AY25: =RC[-31] -> 4.6150000000000002 | BA25: - | BB25: - | BC25: -
A26: =IF(RC[1]="","",DATEVALUE(RC[1])) -> 43378 | B26: 05.10.18 | C26: 24 | D26: 163.58000000000001 | E26: 55.43 | F26: 7.53 | G26: 162.63 | H26: 39.43 | I26: 5.43 | J26: =RC[-5]-RC[-2] -> 16 | K26: 0.95 | L26: 2.6589999999999998 | M26: 33.42 | N26: 62.68 | O26: 0 | P26: 25.63 | Q26: =RC[-3]-RC[-1] -> 37.049999999999997 | R26: 33.42 | S26: 2.0579999999999998 | T26: =RC[-8]+RC[-1] -> 4.7169999999999996 | U26: =(RC[-17]*RC[-16]-RC[-14]*RC[-13])/1000 -> 2.6547385000000006 | V26: =RC[-11]/RC[-15]*100 -> 0.58414806616245463 | W26: 0 | X26: =RC[-2]*RC[-10]/1000 -> 3.6614400787062656E-2 | Y26: =(RC[-3]*RC[-11]-RC[-2]*RC[-9])/1000 -> 3.6614400787062656E-2 | Z26: 2013-12-05T00:00:00.000 | AA26: 2013-12-03T00:00:00.000 | AD26: =VALUE(RC[-28]) -> 2018-10-05T00:00:00.000 | AE26: =IF(RC[22]=42,"*",IF(RC[22]=32,"",RC[22])) -> - | AF26: =RC[-29] -> 24 | AG26: =RC[-29] -> 163.58000000000001 | AH26: =RC[-29] -> 55.43 | AI26: =RC[-29] -> 7.53 | AJ26: =RC[-29] -> 162.63 | AK26: =RC[-29] -> 39.43 | AL26: =RC[-29] -> 5.43 | AM26: =RC[-29] -> 16 | AN26: =RC[-29] -> 0.95 | AO26: =RC[-29] -> 2.6589999999999998 | AP26: =RC[-29] -> 33.42 | AQ26: =RC[-29] -> 62.68 | AR26: - | AS26: =RC[-30] -> 0 | AT26: =RC[-30] -> 25.63 | AU26: - | AV26: =RC[-31] -> 37.049999999999997 | AW26: =RC[-31] -> 33.42 | AX26: =RC[-31] -> 2.0579999999999998 | AY26: =RC[-31] -> 4.7169999999999996 | BA26: - | BB26: - | BC26: -
A27: =IF(RC[1]="","",DATEVALUE(RC[1])) -> 43379 | B27: 06.10.18 | C27: 24 | D27: 163.44999999999999 | E27: 53.43 | F27: 7.53 | G27: 162.47 | H27: 38.9 | I27: 5.43 | J27: =RC[-5]-RC[-2] -> 14.530000000000001 | K27: 0.98 | L27: 2.4129999999999998 | M27: 34.69 | N27: 63.43 | O27: 0 | P27: 26.13 | Q27: =RC[-3]-RC[-1] -> 37.299999999999997 | R27: 34.69 | S27: 2.1560000000000001 | T27: =RC[-8]+RC[-1] -> 4.569 | U27: =(RC[-17]*RC[-16]-RC[-14]*RC[-13])/1000 -> 2.4130505000000002 | V27: =RC[-11]/RC[-15]*100 -> 0.60318828091339938 | W27: 0 | X27: =RC[-2]*RC[-10]/1000 -> 3.8260232658336925E-2 | Y27: =(RC[-3]*RC[-11]-RC[-2]*RC[-9])/1000 -> 3.8260232658336925E-2 | Z27: 2013-12-06T00:00:00.000 | AA27: 2013-12-04T00:00:00.000 | AD27: =VALUE(RC[-28]) -> 2018-10-06T00:00:00.000 | AE27: =IF(RC[22]=42,"*",IF(RC[22]=32,"",RC[22])) -> - | AF27: =RC[-29] -> 24 | AG27: =RC[-29] -> 163.44999999999999 | AH27: =RC[-29] -> 53.43 | AI27: =RC[-29] -> 7.53 | AJ27: =RC[-29] -> 162.47 | AK27: =RC[-29] -> 38.9 | AL27: =RC[-29] -> 5.43 | AM27: =RC[-29] -> 14.530000000000001 | AN27: =RC[-29] -> 0.98 | AO27: =RC[-29] -> 2.4129999999999998 | AP27: =RC[-29] -> 34.69 | AQ27: =RC[-29] -> 63.43 | AR27: - | AS27: =RC[-30] -> 0 | AT27: =RC[-30] -> 26.13 | AU27: - | AV27: =RC[-31] -> 37.299999999999997 | AW27: =RC[-31] -> 34.69 | AX27: =RC[-31] -> 2.1560000000000001 | AY27: =RC[-31] -> 4.569 | BA27: - | BB27: - | BC27: -
A28: =IF(RC[1]="","",DATEVALUE(RC[1])) -> 43380 | B28: 07.10.18 | C28: 24 | D28: 164.35 | E28: 56.32 | F28: 7.53 | G28: 163.08000000000001 | H28: 40.21 | I28: 5.43 | J28: =RC[-5]-RC[-2] -> 16.11 | K28: 1.27 | L28: 2.7 | M28: 38.57 | N28: 63.88 | O28: 0 | P28: 26.31 | Q28: =RC[-3]-RC[-1] -> 37.570000000000007 | R28: 38.57 | S28: 2.4180000000000001 | T28: =RC[-8]+RC[-1] -> 5.1180000000000003 | U28: =(RC[-17]*RC[-16]-RC[-14]*RC[-13])/1000 -> 2.6987451999999985 | V28: =RC[-11]/RC[-15]*100 -> 0.77875889134167275 | W28: 0 | X28: =RC[-2]*RC[-10]/1000 -> 4.9747117978906054E-2 | Y28: =(RC[-3]*RC[-11]-RC[-2]*RC[-9])/1000 -> 4.9747117978906054E-2 | Z28: 2013-12-07T00:00:00.000 | AA28: 2013-12-05T00:00:00.000 | AD28: =VALUE(RC[-28]) -> 2018-10-07T00:00:00.000 | AE28: =IF(RC[22]=42,"*",IF(RC[22]=32,"",RC[22])) -> - | AF28: =RC[-29] -> 24 | AG28: =RC[-29] -> 164.35 | AH28: =RC[-29] -> 56.32 | AI28: =RC[-29] -> 7.53 | AJ28: =RC[-29] -> 163.08000000000001 | AK28: =RC[-29] -> 40.21 | AL28: =RC[-29] -> 5.43 | AM28: =RC[-29] -> 16.11 | AN28: =RC[-29] -> 1.27 | AO28: =RC[-29] -> 2.7 | AP28: =RC[-29] -> 38.57 | AQ28: =RC[-29] -> 63.88 | AR28: - | AS28: =RC[-30] -> 0 | AT28: =RC[-30] -> 26.31 | AU28: - | AV28: =RC[-31] -> 37.570000000000007 | AW28: =RC[-31] -> 38.57 | AX28: =RC[-31] -> 2.4180000000000001 | AY28: =RC[-31] -> 5.1180000000000003 | BA28: - | BB28: - | BC28: -
A29: =IF(RC[1]="","",DATEVALUE(RC[1])) -> 43381 | B29: 08.10.18 | C29: 24 | D29: 165 | E29: 55.47 | F29: 7.53 | G29: 163.77000000000001 | H29: 39.81 | I29: 5.43 | J29: =RC[-5]-RC[-2] -> 15.659999999999997 | K29: 1.23 | L29: 2.6360000000000001 | M29: 34.83 | N29: 63.55 | O29: 0 | P29: 26.06 | Q29: =RC[-3]-RC[-1] -> 37.489999999999995 | R29: 34.83 | S29: 2.1709999999999998 | T29: =RC[-8]+RC[-1] -> 4.8070000000000004 | U29: =(RC[-17]*RC[-16]-RC[-14]*RC[-13])/1000 -> 2.632866299999999 | V29: =RC[-11]/RC[-15]*100 -> 0.75105330646638579 | W29: 0 | X29: =RC[-2]*RC[-10]/1000 -> 4.7729437625938814E-2 | Y29: =(RC[-3]*RC[-11]-RC[-2]*RC[-9])/1000 -> 4.7729437625938814E-2 | Z29: 2013-12-08T00:00:00.000 | AA29: 2013-12-06T00:00:00.000 | AD29: =VALUE(RC[-28]) -> 2018-10-08T00:00:00.000 | AE29: =IF(RC[22]=42,"*",IF(RC[22]=32,"",RC[22])) -> - | AF29: =RC[-29] -> 24 | AG29: =RC[-29] -> 165 | AH29: =RC[-29] -> 55.47 | AI29: =RC[-29] -> 7.53 | AJ29: =RC[-29] -> 163.77000000000001 | AK29: =RC[-29] -> 39.81 | AL29: =RC[-29] -> 5.43 | AM29: =RC[-29] -> 15.659999999999997 | AN29: =RC[-29] -> 1.23 | AO29: =RC[-29] -> 2.6360000000000001 | AP29: =RC[-29] -> 34.83 | AQ29: =RC[-29] -> 63.55 | AR29: - | AS29: =RC[-30] -> 0 | AT29: =RC[-30] -> 26.06 | AU29: - | AV29: =RC[-31] -> 37.489999999999995 | AW29: =RC[-31] -> 34.83 | AX29: =RC[-31] -> 2.1709999999999998 | AY29: =RC[-31] -> 4.8070000000000004 | BA29: - | BB29: - | BC29: -
A30: =IF(RC[1]="","",DATEVALUE(RC[1])) -> 43382 | B30: 09.10.18 | C30: 24 | D30: 167.96 | E30: 53.85 | F30: 7.53 | G30: 166.67 | H30: 39.340000000000003 | I30: 5.43 | J30: =RC[-5]-RC[-2] -> 14.509999999999998 | K30: 1.29 | L30: 2.4910000000000001 | M30: 31.62 | N30: 63.39 | O30: 0 | P30: 26.41 | Q30: =RC[-3]-RC[-1] -> 36.980000000000004 | R30: 31.62 | S30: 1.968 | T30: =RC[-8]+RC[-1] -> 4.4589999999999996 | U30: =(RC[-17]*RC[-16]-RC[-14]*RC[-13])/1000 -> 2.4878482000000002 | V30: =RC[-11]/RC[-15]*100 -> 0.77398452030959386 | W30: 0 | X30: =RC[-2]*RC[-10]/1000 -> 4.9062878742425153E-2 | Y30: =(RC[-3]*RC[-11]-RC[-2]*RC[-9])/1000 -> 4.9062878742425153E-2 | Z30: 2013-12-09T00:00:00.000 | AA30: 2013-12-07T00:00:00.000 | AD30: =VALUE(RC[-28]) -> 2018-10-09T00:00:00.000 | AE30: =IF(RC[22]=42,"*",IF(RC[22]=32,"",RC[22])) -> - | AF30: =RC[-29] -> 24 | AG30: =RC[-29] -> 167.96 | AH30: =RC[-29] -> 53.85 | AI30: =RC[-29] -> 7.53 | AJ30: =RC[-29] -> 166.67 | AK30: =RC[-29] -> 39.340000000000003 | AL30: =RC[-29] -> 5.43 | AM30: =RC[-29] -> 14.509999999999998 | AN30: =RC[-29] -> 1.29 | AO30: =RC[-29] -> 2.4910000000000001 | AP30: =RC[-29] -> 31.62 | AQ30: =RC[-29] -> 63.39 | AR30: - | AS30: =RC[-30] -> 0 | AT30: =RC[-30] -> 26.41 | AU30: - | AV30: =RC[-31] -> 36.980000000000004 | AW30: =RC[-31] -> 31.62 | AX30: =RC[-31] -> 1.968 | AY30: =RC[-31] -> 4.4589999999999996 | BA30: - | BB30: - | BC30: -
A31: =IF(RC[1]="","",DATEVALUE(RC[1])) -> 43383 | B31: 10.10.18 | C31: 24 | D31: 168.96 | E31: 53.45 | F31: 7.53 | G31: 167.61 | H31: 39.46 | I31: 5.43 | J31: =RC[-5]-RC[-2] -> 13.990000000000002 | K31: 1.35 | L31: 2.4209999999999998 | M31: 34.29 | N31: 64.209999999999994 | O31: 0 | P31: 26.94 | Q31: =RC[-3]-RC[-1] -> 37.269999999999996 | R31: 34.29 | S31: 2.161 | T31: =RC[-8]+RC[-1] -> 4.5819999999999999 | U31: =(RC[-17]*RC[-16]-RC[-14]*RC[-13])/1000 -> 2.4170213999999994 | V31: =RC[-11]/RC[-15]*100 -> 0.80544120279219622 | W31: 0 | X31: =RC[-2]*RC[-10]/1000 -> 5.1717379631286919E-2 | Y31: =(RC[-3]*RC[-11]-RC[-2]*RC[-9])/1000 -> 5.1717379631286919E-2 | Z31: 2013-12-10T00:00:00.000 | AA31: 2013-12-08T00:00:00.000 | AD31: =VALUE(RC[-28]) -> 2018-10-10T00:00:00.000 | AE31: =IF(RC[22]=42,"*",IF(RC[22]=32,"",RC[22])) -> - | AF31: =RC[-29] -> 24 | AG31: =RC[-29] -> 168.96 | AH31: =RC[-29] -> 53.45 | AI31: =RC[-29] -> 7.53 | AJ31: =RC[-29] -> 167.61 | AK31: =RC[-29] -> 39.46 | AL31: =RC[-29] -> 5.43 | AM31: =RC[-29] -> 13.990000000000002 | AN31: =RC[-29] -> 1.35 | AO31: =RC[-29] -> 2.4209999999999998 | AP31: =RC[-29] -> 34.29 | AQ31: =RC[-29] -> 64.209999999999994 | AR31: - | AS31: =RC[-30] -> 0 | AT31: =RC[-30] -> 26.94 | AU31: - | AV31: =RC[-31] -> 37.269999999999996 | AW31: =RC[-31] -> 34.29 | AX31: =RC[-31] -> 2.161 | AY31: =RC[-31] -> 4.5819999999999999 | BA31: - | BB31: - | BC31: -
A32: =IF(RC[1]="","",DATEVALUE(RC[1])) -> 43384 | B32: 11.10.18 | C32: 24 | D32: 168.08 | E32: 52.99 | F32: 7.53 | G32: 166.52 | H32: 39.36 | I32: 5.43 | J32: =RC[-5]-RC[-2] -> 13.630000000000003 | K32: 1.56 | L32: 2.351 | M32: 31.73 | N32: 65.08 | O32: 0 | P32: 27.01 | Q32: =RC[-3]-RC[-1] -> 38.069999999999993 | R32: 31.73 | S32: 2.0249999999999999 | T32: =RC[-8]+RC[-1] -> 4.3759999999999994 | U32: =(RC[-17]*RC[-16]-RC[-14]*RC[-13])/1000 -> 2.3523320000000014 | V32: =RC[-11]/RC[-15]*100 -> 0.93682440547681967 | W32: 0 | X32: =RC[-2]*RC[-10]/1000 -> 6.0968532308431418E-2 | Y32: =(RC[-3]*RC[-11]-RC[-2]*RC[-9])/1000 -> 6.0968532308431418E-2 | Z32: 2013-12-11T00:00:00.000 | AA32: 2013-12-09T00:00:00.000 | AD32: =VALUE(RC[-28]) -> 2018-10-11T00:00:00.000 | AE32: =IF(RC[22]=42,"*",IF(RC[22]=32,"",RC[22])) -> - | AF32: =RC[-29] -> 24 | AG32: =RC[-29] -> 168.08 | AH32: =RC[-29] -> 52.99 | AI32: =RC[-29] -> 7.53 | AJ32: =RC[-29] -> 166.52 | AK32: =RC[-29] -> 39.36 | AL32: =RC[-29] -> 5.43 | AM32: =RC[-29] -> 13.630000000000003 | AN32: =RC[-29] -> 1.56 | AO32: =RC[-29] -> 2.351 | AP32: =RC[-29] -> 31.73 | AQ32: =RC[-29] -> 65.08 | AR32: - | AS32: =RC[-30] -> 0 | AT32: =RC[-30] -> 27.01 | AU32: - | AV32: =RC[-31] -> 38.069999999999993 | AW32: =RC[-31] -> 31.73 | AX32: =RC[-31] -> 2.0249999999999999 | AY32: =RC[-31] -> 4.3759999999999994 | BA32: - | BB32: - | BC32: -
A33: =IF(RC[1]="","",DATEVALUE(RC[1])) -> 43385 | B33: 12.10.18 | C33: 24 | D33: 168.19 | E33: 52.91 | F33: 7.53 | G33: 166.51 | H33: 39.15 | I33: 5.43 | J33: =RC[-5]-RC[-2] -> 13.759999999999998 | K33: 1.68 | L33: 2.383 | M33: 33.33 | N33: 64.92 | O33: 0 | P33: 26.99 | Q33: =RC[-3]-RC[-1] -> 37.930000000000007 | R33: 33.33 | S33: 2.1259999999999999 | T33: =RC[-8]+RC[-1] -> 4.5090000000000003 | U33: =(RC[-17]*RC[-16]-RC[-14]*RC[-13])/1000 -> 2.3800664000000005 | V33: =RC[-11]/RC[-15]*100 -> 1.0089484115068164 | W33: 0 | X33: =RC[-2]*RC[-10]/1000 -> 6.5500930875022526E-2 | Y33: =(RC[-3]*RC[-11]-RC[-2]*RC[-9])/1000 -> 6.5500930875022526E-2 | Z33: 2013-12-12T00:00:00.000 | AA33: 2013-12-10T00:00:00.000 | AD33: =VALUE(RC[-28]) -> 2018-10-12T00:00:00.000 | AE33: =IF(RC[22]=42,"*",IF(RC[22]=32,"",RC[22])) -> - | AF33: =RC[-29] -> 24 | AG33: =RC[-29] -> 168.19 | AH33: =RC[-29] -> 52.91 | AI33: =RC[-29] -> 7.53 | AJ33: =RC[-29] -> 166.51 | AK33: =RC[-29] -> 39.15 | AL33: =RC[-29] -> 5.43 | AM33: =RC[-29] -> 13.759999999999998 | AN33: =RC[-29] -> 1.68 | AO33: =RC[-29] -> 2.383 | AP33: =RC[-29] -> 33.33 | AQ33: =RC[-29] -> 64.92 | AR33: - | AS33: =RC[-30] -> 0 | AT33: =RC[-30] -> 26.99 | AU33: - | AV33: =RC[-31] -> 37.930000000000007 | AW33: =RC[-31] -> 33.33 | AX33: =RC[-31] -> 2.1259999999999999 | AY33: =RC[-31] -> 4.5090000000000003 | BA33: - | BB33: - | BC33: -
A34: =IF(RC[1]="","",DATEVALUE(RC[1])) -> 43386 | B34: 13.10.18 | C34: 24 | D34: 168.39 | E34: 52.38 | F34: 7.53 | G34: 166.7 | H34: 39.22 | I34: 5.43 | J34: =RC[-5]-RC[-2] -> 13.160000000000004 | K34: 1.69 | L34: 2.2850000000000001 | M34: 30.65 | N34: 65.91 | O34: 0 | P34: 27.4 | Q34: =RC[-3]-RC[-1] -> 38.51 | R34: 30.65 | S34: 1.9810000000000001 | T34: =RC[-8]+RC[-1] -> 4.266 | U34: =(RC[-17]*RC[-16]-RC[-14]*RC[-13])/1000 -> 2.2822942000000013 | V34: =RC[-11]/RC[-15]*100 -> 1.0137972405518896 | W34: 0 | X34: =RC[-2]*RC[-10]/1000 -> 6.6819376124775037E-2 | Y34: =(RC[-3]*RC[-11]-RC[-2]*RC[-9])/1000 -> 6.6819376124775037E-2 | Z34: 2013-12-13T00:00:00.000 | AA34: 2013-12-11T00:00:00.000 | AD34: =VALUE(RC[-28]) -> 2018-10-13T00:00:00.000 | AE34: =IF(RC[22]=42,"*",IF(RC[22]=32,"",RC[22])) -> - | AF34: =RC[-29] -> 24 | AG34: =RC[-29] -> 168.39 | AH34: =RC[-29] -> 52.38 | AI34: =RC[-29] -> 7.53 | AJ34: =RC[-29] -> 166.7 | AK34: =RC[-29] -> 39.22 | AL34: =RC[-29] -> 5.43 | AM34: =RC[-29] -> 13.160000000000004 | AN34: =RC[-29] -> 1.69 | AO34: =RC[-29] -> 2.2850000000000001 | AP34: =RC[-29] -> 30.65 | AQ34: =RC[-29] -> 65.91 | AR34: - | AS34: =RC[-30] -> 0 | AT34: =RC[-30] -> 27.4 | AU34: - | AV34: =RC[-31] -> 38.51 | AW34: =RC[-31] -> 30.65 | AX34: =RC[-31] -> 1.9810000000000001 | AY34: =RC[-31] -> 4.266 | BA34: - | BB34: - | BC34: -
A35: =IF(RC[1]="","",DATEVALUE(RC[1])) -> 43387 | B35: 14.10.18 | C35: 24 | D35: 168.68 | E35: 51.33 | F35: 7.53 | G35: 166.98 | H35: 39.090000000000003 | I35: 5.43 | J35: =RC[-5]-RC[-2] -> 12.239999999999995 | K35: 1.7 | L35: 2.133 | M35: 34.799999999999997 | N35: 66.84 | O35: 0 | P35: 28.06 | Q35: =RC[-3]-RC[-1] -> 38.78 | R35: 34.799999999999997 | S35: 2.278 | T35: =RC[-8]+RC[-1] -> 4.4109999999999996 | U35: =(RC[-17]*RC[-16]-RC[-14]*RC[-13])/1000 -> 2.1310962 | V35: =RC[-11]/RC[-15]*100 -> 1.0180859983231525 | W35: 0 | X35: =RC[-2]*RC[-10]/1000 -> 6.8048868127919521E-2 | Y35: =(RC[-3]*RC[-11]-RC[-2]*RC[-9])/1000 -> 6.8048868127919521E-2 | Z35: 2013-12-14T00:00:00.000 | AA35: 2013-12-12T00:00:00.000 | AD35: =VALUE(RC[-28]) -> 2018-10-14T00:00:00.000 | AE35: =IF(RC[22]=42,"*",IF(RC[22]=32,"",RC[22])) -> - | AF35: =RC[-29] -> 24 | AG35: =RC[-29] -> 168.68 | AH35: =RC[-29] -> 51.33 | AI35: =RC[-29] -> 7.53 | AJ35: =RC[-29] -> 166.98 | AK35: =RC[-29] -> 39.090000000000003 | AL35: =RC[-29] -> 5.43 | AM35: =RC[-29] -> 12.239999999999995 | AN35: =RC[-29] -> 1.7 | AO35: =RC[-29] -> 2.133 | AP35: =RC[-29] -> 34.799999999999997 | AQ35: =RC[-29] -> 66.84 | AR35: - | AS35: =RC[-30] -> 0 | AT35: =RC[-30] -> 28.06 | AU35: - | AV35: =RC[-31] -> 38.78 | AW35: =RC[-31] -> 34.799999999999997 | AX35: =RC[-31] -> 2.278 | AY35: =RC[-31] -> 4.4109999999999996 | BA35: - | BB35: - | BC35: -
A36: =IF(RC[1]="","",DATEVALUE(RC[1])) -> 43388 | B36: 15.10.18 | C36: 24 | D36: 168.72 | E36: 51.15 | F36: 7.53 | G36: 166.95 | H36: 39.119999999999997 | I36: 5.43 | J36: =RC[-5]-RC[-2] -> 12.030000000000001 | K36: 1.77 | L36: 2.1019999999999999 | M36: 32.270000000000003 | N36: 66.28 | O36: 0 | P36: 28.32 | Q36: =RC[-3]-RC[-1] -> 37.96 | R36: 32.270000000000003 | S36: 2.097 | T36: =RC[-8]+RC[-1] -> 4.1989999999999998 | U36: =(RC[-17]*RC[-16]-RC[-14]*RC[-13])/1000 -> 2.0989440000000013 | V36: =RC[-11]/RC[-15]*100 -> 1.0601976639712491 | W36: 0 | X36: =RC[-2]*RC[-10]/1000 -> 7.0269901168014404E-2 | Y36: =(RC[-3]*RC[-11]-RC[-2]*RC[-9])/1000 -> 7.0269901168014404E-2 | Z36: 2013-12-15T00:00:00.000 | AA36: 2013-12-13T00:00:00.000 | AD36: =VALUE(RC[-28]) -> 2018-10-15T00:00:00.000 | AE36: =IF(RC[22]=42,"*",IF(RC[22]=32,"",RC[22])) -> - | AF36: =RC[-29] -> 24 | AG36: =RC[-29] -> 168.72 | AH36: =RC[-29] -> 51.15 | AI36: =RC[-29] -> 7.53 | AJ36: =RC[-29] -> 166.95 | AK36: =RC[-29] -> 39.119999999999997 | AL36: =RC[-29] -> 5.43 | AM36: =RC[-29] -> 12.030000000000001 | AN36: =RC[-29] -> 1.77 | AO36: =RC[-29] -> 2.1019999999999999 | AP36: =RC[-29] -> 32.270000000000003 | AQ36: =RC[-29] -> 66.28 | AR36: - | AS36: =RC[-30] -> 0 | AT36: =RC[-30] -> 28.32 | AU36: - | AV36: =RC[-31] -> 37.96 | AW36: =RC[-31] -> 32.270000000000003 | AX36: =RC[-31] -> 2.097 | AY36: =RC[-31] -> 4.1989999999999998 | BA36: - | BB36: - | BC36: -
A37: =IF(RC[1]="","",DATEVALUE(RC[1])) -> 43389 | B37: 16.10.18 | C37: 24 | D37: 168.92 | E37: 51.1 | F37: 7.53 | G37: 167.09 | H37: 38.979999999999997 | I37: 5.43 | J37: =RC[-5]-RC[-2] -> 12.120000000000005 | K37: 1.83 | L37: 2.121 | M37: 31.59 | N37: 66.290000000000006 | O37: 0 | P37: 28.27 | Q37: =RC[-3]-RC[-1] -> 38.02000000000001 | R37: 31.59 | S37: 2.0529999999999999 | T37: =RC[-8]+RC[-1] -> 4.1739999999999995 | U37: =(RC[-17]*RC[-16]-RC[-14]*RC[-13])/1000 -> 2.1186438000000005 | V37: =RC[-11]/RC[-15]*100 -> 1.0952181459093902 | W37: 0 | X37: =RC[-2]*RC[-10]/1000 -> 7.2602010892333479E-2 | Y37: =(RC[-3]*RC[-11]-RC[-2]*RC[-9])/1000 -> 7.2602010892333479E-2 | Z37: 2013-12-16T00:00:00.000 | AA37: 2013-12-14T00:00:00.000 | AD37: =VALUE(RC[-28]) -> 2018-10-16T00:00:00.000 | AE37: =IF(RC[22]=42,"*",IF(RC[22]=32,"",RC[22])) -> - | AF37: =RC[-29] -> 24 | AG37: =RC[-29] -> 168.92 | AH37: =RC[-29] -> 51.1 | AI37: =RC[-29] -> 7.53 | AJ37: =RC[-29] -> 167.09 | AK37: =RC[-29] -> 38.979999999999997 | AL37: =RC[-29] -> 5.43 | AM37: =RC[-29] -> 12.120000000000005 | AN37: =RC[-29] -> 1.83 | AO37: =RC[-29] -> 2.121 | AP37: =RC[-29] -> 31.59 | AQ37: =RC[-29] -> 66.290000000000006 | AR37: - | AS37: =RC[-30] -> 0 | AT37: =RC[-30] -> 28.27 | AU37: - | AV37: =RC[-31] -> 38.02000000000001 | AW37: =RC[-31] -> 31.59 | AX37: =RC[-31] -> 2.0529999999999999 | AY37: =RC[-31] -> 4.1739999999999995 | BA37: - | BB37: - | BC37: -
A38: =IF(RC[1]="","",DATEVALUE(RC[1])) -> 43390 | B38: 17.10.18 | C38: 24 | D38: 168.46 | E38: 51.05 | F38: 7.53 | G38: 166.53 | H38: 38.74 | I38: 5.43 | J38: =RC[-5]-RC[-2] -> 12.309999999999995 | K38: 1.93 | L38: 2.1539999999999999 | M38: 31.62 | N38: 66.33 | O38: 0 | P38: 28.13 | Q38: =RC[-3]-RC[-1] -> 38.200000000000003 | R38: 31.62 | S38: 2.056 | T38: =RC[-8]+RC[-1] -> 4.21 | U38: =(RC[-17]*RC[-16]-RC[-14]*RC[-13])/1000 -> 2.1485107999999991 | V38: =RC[-11]/RC[-15]*100 -> 1.1589503392782081 | W38: 0 | X38: =RC[-2]*RC[-10]/1000 -> 7.6873176004323543E-2 | Y38: =(RC[-3]*RC[-11]-RC[-2]*RC[-9])/1000 -> 7.6873176004323543E-2 | Z38: 2013-12-17T00:00:00.000 | AA38: 2013-12-15T00:00:00.000 | AD38: =VALUE(RC[-28]) -> 2018-10-17T00:00:00.000 | AE38: =IF(RC[22]=42,"*",IF(RC[22]=32,"",RC[22])) -> - | AF38: =RC[-29] -> 24 | AG38: =RC[-29] -> 168.46 | AH38: =RC[-29] -> 51.05 | AI38: =RC[-29] -> 7.53 | AJ38: =RC[-29] -> 166.53 | AK38: =RC[-29] -> 38.74 | AL38: =RC[-29] -> 5.43 | AM38: =RC[-29] -> 12.309999999999995 | AN38: =RC[-29] -> 1.93 | AO38: =RC[-29] -> 2.1539999999999999 | AP38: =RC[-29] -> 31.62 | AQ38: =RC[-29] -> 66.33 | AR38: - | AS38: =RC[-30] -> 0 | AT38: =RC[-30] -> 28.13 | AU38: - | AV38: =RC[-31] -> 38.200000000000003 | AW38: =RC[-31] -> 31.62 | AX38: =RC[-31] -> 2.056 | AY38: =RC[-31] -> 4.21 | BA38: - | BB38: - | BC38: -
A39: =IF(RC[1]="","",DATEVALUE(RC[1])) -> 43391 | B39: 18.10.18 | C39: 24 | D39: 169.59 | E39: 51.17 | F39: 7.53 | G39: 167.74 | H39: 38.619999999999997 | I39: 5.43 | J39: =RC[-5]-RC[-2] -> 12.550000000000004 | K39: 1.85 | L39: 2.2050000000000001 | M39: 31.44 | N39: 66.8 | O39: 0 | P39: 28.29 | Q39: =RC[-3]-RC[-1] -> 38.51 | R39: 31.44 | S39: 2.0590000000000002 | T39: =RC[-8]+RC[-1] -> 4.2640000000000002 | U39: =(RC[-17]*RC[-16]-RC[-14]*RC[-13])/1000 -> 2.1998014999999995 | V39: =RC[-11]/RC[-15]*100 -> 1.1028973411231668 | W39: 0 | X39: =RC[-2]*RC[-10]/1000 -> 7.3673542387027544E-2 | Y39: =(RC[-3]*RC[-11]-RC[-2]*RC[-9])/1000 -> 7.3673542387027544E-2 | Z39: 2013-12-18T00:00:00.000 | AA39: 2013-12-16T00:00:00.000 | AD39: =VALUE(RC[-28]) -> 2018-10-18T00:00:00.000 | AE39: =IF(RC[22]=42,"*",IF(RC[22]=32,"",RC[22])) -> - | AF39: =RC[-29] -> 24 | AG39: =RC[-29] -> 169.59 | AH39: =RC[-29] -> 51.17 | AI39: =RC[-29] -> 7.53 | AJ39: =RC[-29] -> 167.74 | AK39: =RC[-29] -> 38.619999999999997 | AL39: =RC[-29] -> 5.43 | AM39: =RC[-29] -> 12.550000000000004 | AN39: =RC[-29] -> 1.85 | AO39: =RC[-29] -> 2.2050000000000001 | AP39: =RC[-29] -> 31.44 | AQ39: =RC[-29] -> 66.8 | AR39: - | AS39: =RC[-30] -> 0 | AT39: =RC[-30] -> 28.29 | AU39: - | AV39: =RC[-31] -> 38.51 | AW39: =RC[-31] -> 31.44 | AX39: =RC[-31] -> 2.0590000000000002 | AY39: =RC[-31] -> 4.2640000000000002 | BA39: - | BB39: - | BC39: -
A40: =IF(RC[1]="","",DATEVALUE(RC[1])) -> 43392 | B40: 19.10.18 | C40: 24 | D40: 170.17 | E40: 50.85 | F40: 7.53 | G40: 168.36 | H40: 38.14 | I40: 5.43 | J40: =RC[-5]-RC[-2] -> 12.71 | K40: 1.81 | L40: 2.2330000000000001 | M40: 31.24 | N40: 66.650000000000006 | O40: 0 | P40: 27.9 | Q40: =RC[-3]-RC[-1] -> 38.750000000000007 | R40: 31.24 | S40: 2.0409999999999999 | T40: =RC[-8]+RC[-1] -> 4.274 | U40: =(RC[-17]*RC[-16]-RC[-14]*RC[-13])/1000 -> 2.2318940999999994 | V40: =RC[-11]/RC[-15]*100 -> 1.0750772154906152 | W40: 0 | X40: =RC[-2]*RC[-10]/1000 -> 7.1653896412449514E-2 | Y40: =(RC[-3]*RC[-11]-RC[-2]*RC[-9])/1000 -> 7.1653896412449514E-2 | Z40: 2013-12-19T00:00:00.000 | AA40: 2013-12-17T00:00:00.000 | AD40: =VALUE(RC[-28]) -> 2018-10-19T00:00:00.000 | AE40: =IF(RC[22]=42,"*",IF(RC[22]=32,"",RC[22])) -> - | AF40: =RC[-29] -> 24 | AG40: =RC[-29] -> 170.17 | AH40: =RC[-29] -> 50.85 | AI40: =RC[-29] -> 7.53 | AJ40: =RC[-29] -> 168.36 | AK40: =RC[-29] -> 38.14 | AL40: =RC[-29] -> 5.43 | AM40: =RC[-29] -> 12.71 | AN40: =RC[-29] -> 1.81 | AO40: =RC[-29] -> 2.2330000000000001 | AP40: =RC[-29] -> 31.24 | AQ40: =RC[-29] -> 66.650000000000006 | AR40: - | AS40: =RC[-30] -> 0 | AT40: =RC[-30] -> 27.9 | AU40: - | AV40: =RC[-31] -> 38.750000000000007 | AW40: =RC[-31] -> 31.24 | AX40: =RC[-31] -> 2.0409999999999999 | AY40: =RC[-31] -> 4.274 | BA40: - | BB40: - | BC40: -
A41: =IF(RC[1]="","",DATEVALUE(RC[1])) -> 43393 | B41: 20.10.18 | C41: 24 | D41: 170.69 | E41: 53.13 | F41: 7.53 | G41: 168.86 | H41: 38.880000000000003 | I41: 5.43 | J41: =RC[-5]-RC[-2] -> 14.25 | K41: 1.83 | L41: 2.504 | M41: 32.92 | N41: 66.36 | O41: 0 | P41: 27.28 | Q41: =RC[-3]-RC[-1] -> 39.08 | R41: 32.92 | S41: 2.1389999999999998 | T41: =RC[-8]+RC[-1] -> 4.6429999999999998 | U41: =(RC[-17]*RC[-16]-RC[-14]*RC[-13])/1000 -> 2.5034828999999998 | V41: =RC[-11]/RC[-15]*100 -> 1.0837380078171266 | W41: 0 | X41: =RC[-2]*RC[-10]/1000 -> 7.1916854198744523E-2 | Y41: =(RC[-3]*RC[-11]-RC[-2]*RC[-9])/1000 -> 7.1916854198744523E-2 | Z41: 2013-12-20T00:00:00.000 | AA41: 2013-12-18T00:00:00.000 | AD41: =VALUE(RC[-28]) -> 2018-10-20T00:00:00.000 | AE41: =IF(RC[22]=42,"*",IF(RC[22]=32,"",RC[22])) -> - | AF41: =RC[-29] -> 24 | AG41: =RC[-29] -> 170.69 | AH41: =RC[-29] -> 53.13 | AI41: =RC[-29] -> 7.53 | AJ41: =RC[-29] -> 168.86 | AK41: =RC[-29] -> 38.880000000000003 | AL41: =RC[-29] -> 5.43 | AM41: =RC[-29] -> 14.25 | AN41: =RC[-29] -> 1.83 | AO41: =RC[-29] -> 2.504 | AP41: =RC[-29] -> 32.92 | AQ41: =RC[-29] -> 66.36 | AR41: - | AS41: =RC[-30] -> 0 | AT41: =RC[-30] -> 27.28 | AU41: - | AV41: =RC[-31] -> 39.08 | AW41: =RC[-31] -> 32.92 | AX41: =RC[-31] -> 2.1389999999999998 | AY41: =RC[-31] -> 4.6429999999999998 | BA41: - | BB41: - | BC41: -
A42: =IF(RC[1]="","",DATEVALUE(RC[1])) -> 43394 | B42: 21.10.18 | C42: 24 | D42: 169.61 | E42: 52.83 | F42: 7.53 | G42: 167.81 | H42: 38.659999999999997 | I42: 5.43 | J42: =RC[-5]-RC[-2] -> 14.170000000000002 | K42: 1.8 | L42: 2.4750000000000001 | M42: 36.26 | N42: 65.819999999999993 | O42: 0 | P42: 27.21 | Q42: =RC[-3]-RC[-1] -> 38.609999999999992 | R42: 36.26 | S42: 2.3439999999999999 | T42: =RC[-8]+RC[-1] -> 4.819 | U42: =(RC[-17]*RC[-16]-RC[-14]*RC[-13])/1000 -> 2.4729617000000008 | V42: =RC[-11]/RC[-15]*100 -> 1.0726416780883141 | W42: 0 | X42: =RC[-2]*RC[-10]/1000 -> 7.060127525177283E-2 | Y42: =(RC[-3]*RC[-11]-RC[-2]*RC[-9])/1000 -> 7.060127525177283E-2 | Z42: 2013-12-21T00:00:00.000 | AA42: 2013-12-19T00:00:00.000 | AD42: =VALUE(RC[-28]) -> 2018-10-21T00:00:00.000 | AE42: =IF(RC[22]=42,"*",IF(RC[22]=32,"",RC[22])) -> - | AF42: =RC[-29] -> 24 | AG42: =RC[-29] -> 169.61 | AH42: =RC[-29] -> 52.83 | AI42: =RC[-29] -> 7.53 | AJ42: =RC[-29] -> 167.81 | AK42: =RC[-29] -> 38.659999999999997 | AL42: =RC[-29] -> 5.43 | AM42: =RC[-29] -> 14.170000000000002 | AN42: =RC[-29] -> 1.8 | AO42: =RC[-29] -> 2.4750000000000001 | AP42: =RC[-29] -> 36.26 | AQ42: =RC[-29] -> 65.819999999999993 | AR42: - | AS42: =RC[-30] -> 0 | AT42: =RC[-30] -> 27.21 | AU42: - | AV42: =RC[-31] -> 38.609999999999992 | AW42: =RC[-31] -> 36.26 | AX42: =RC[-31] -> 2.3439999999999999 | AY42: =RC[-31] -> 4.819 | BA42: - | BB42: - | BC42: -
A43: =IF(RC[1]="","",DATEVALUE(RC[1])) -> 43395 | B43: 22.10.18 | C43: 24 | D43: 170.02 | E43: 53.7 | F43: 7.53 | G43: 168.33 | H43: 39.090000000000003 | I43: 5.43 | J43: =RC[-5]-RC[-2] -> 14.61 | K43: 1.69 | L43: 2.5529999999999999 | M43: 32.19 | N43: 66.010000000000005 | O43: 0 | P43: 27.27 | Q43: =RC[-3]-RC[-1] -> 38.740000000000009 | R43: 32.19 | S43: 2.0819999999999999 | T43: =RC[-8]+RC[-1] -> 4.6349999999999998 | U43: =(RC[-17]*RC[-16]-RC[-14]*RC[-13])/1000 -> 2.5500542999999998 | V43: =RC[-11]/RC[-15]*100 -> 1.0039802768371651 | W43: 0 | X43: =RC[-2]*RC[-10]/1000 -> 6.6272738074021273E-2 | Y43: =(RC[-3]*RC[-11]-RC[-2]*RC[-9])/1000 -> 6.6272738074021273E-2 | Z43: 2013-12-22T00:00:00.000 | AA43: 2013-12-20T00:00:00.000 | AD43: =VALUE(RC[-28]) -> 2018-10-22T00:00:00.000 | AE43: =IF(RC[22]=42,"*",IF(RC[22]=32,"",RC[22])) -> - | AF43: =RC[-29] -> 24 | AG43: =RC[-29] -> 170.02 | AH43: =RC[-29] -> 53.7 | AI43: =RC[-29] -> 7.53 | AJ43: =RC[-29] -> 168.33 | AK43: =RC[-29] -> 39.090000000000003 | AL43: =RC[-29] -> 5.43 | AM43: =RC[-29] -> 14.61 | AN43: =RC[-29] -> 1.69 | AO43: =RC[-29] -> 2.5529999999999999 | AP43: =RC[-29] -> 32.19 | AQ43: =RC[-29] -> 66.010000000000005 | AR43: - | AS43: =RC[-30] -> 0 | AT43: =RC[-30] -> 27.27 | AU43: - | AV43: =RC[-31] -> 38.740000000000009 | AW43: =RC[-31] -> 32.19 | AX43: =RC[-31] -> 2.0819999999999999 | AY43: =RC[-31] -> 4.6349999999999998 | BA43: - | BB43: - | BC43: -
A44: =IF(RC[1]="","",DATEVALUE(RC[1])) ->  | C44: 24 | J44: =RC[-5]-RC[-2] -> #VALUE! | Q44: =RC[-3]-RC[-1] -> #VALUE! | T44: =RC[-8]+RC[-1] -> #VALUE! | U44: =(RC[-17]*RC[-16]-RC[-14]*RC[-13])/1000 -> #VALUE! | V44: =RC[-11]/RC[-15]*100 -> #VALUE! | X44: =RC[-2]*RC[-10]/1000 -> #VALUE! | Y44: =(RC[-3]*RC[-11]-RC[-2]*RC[-9])/1000 -> #VALUE! | AD44: =VALUE(RC[-28]) -> #VALUE! | AE44: =IF(RC[22]=42,"*",IF(RC[22]=32,"",RC[22])) ->  | AF44: =RC[-29] -> 24 | AG44: =RC[-29] ->  | AH44: =RC[-29] ->  | AI44: =RC[-29] ->  | AJ44: =RC[-29] ->  | AK44: =RC[-29] ->  | AL44: =RC[-29] ->  | AM44: =RC[-29] -> #VALUE! | AN44: =RC[-29] ->  | AO44: =RC[-29] ->  | AP44: =RC[-29] ->  | AQ44: =RC[-29] ->  | AR44: - | AS44: =RC[-30] ->  | AT44: =RC[-30] ->  | AU44: - | AV44: =RC[-31] -> #VALUE! | AW44: =RC[-31] ->  | AX44: =RC[-31] ->  | AY44: =RC[-31] -> #VALUE!
A45: =IF(RC[1]="","",DATEVALUE(RC[1])) ->  | C45: 24 | J45: =RC[-5]-RC[-2] -> #VALUE! | Q45: =RC[-3]-RC[-1] -> #VALUE! | T45: =RC[-8]+RC[-1] -> #VALUE! | U45: =(RC[-17]*RC[-16]-RC[-14]*RC[-13])/1000 -> #VALUE! | V45: =RC[-11]/RC[-15]*100 -> #VALUE! | X45: =RC[-2]*RC[-10]/1000 -> #VALUE! | Y45: =(RC[-3]*RC[-11]-RC[-2]*RC[-9])/1000 -> #VALUE! | AD45: =VALUE(RC[-28]) -> #VALUE! | AE45: =IF(RC[22]=42,"*",IF(RC[22]=32,"",RC[22])) ->  | AF45: =RC[-29] -> 24 | AG45: =RC[-29] ->  | AH45: =RC[-29] ->  | AI45: =RC[-29] ->  | AJ45: =RC[-29] ->  | AK45: =RC[-29] ->  | AL45: =RC[-29] ->  | AM45: =RC[-29] -> #VALUE! | AN45: =RC[-29] ->  | AO45: =RC[-29] ->  | AP45: =RC[-29] ->  | AQ45: =RC[-29] ->  | AR45: - | AS45: =RC[-30] ->  | AT45: =RC[-30] ->  | AU45: - | AV45: =RC[-31] -> #VALUE! | AW45: =RC[-31] ->  | AX45: =RC[-31] ->  | AY45: =RC[-31] -> #VALUE!
A46: =IF(RC[1]="","",DATEVALUE(RC[1])) ->  | C46: 24 | J46: =RC[-5]-RC[-2] -> #VALUE! | Q46: =RC[-3]-RC[-1] -> #VALUE! | T46: =RC[-8]+RC[-1] -> #VALUE! | U46: =(RC[-17]*RC[-16]-RC[-14]*RC[-13])/1000 -> #VALUE! | V46: =RC[-11]/RC[-15]*100 -> #VALUE! | X46: =RC[-2]*RC[-10]/1000 -> #VALUE! | Y46: =(RC[-3]*RC[-11]-RC[-2]*RC[-9])/1000 -> #VALUE! | AD46: =VALUE(RC[-28]) -> #VALUE! | AE46: =IF(RC[22]=42,"*",IF(RC[22]=32,"",RC[22])) ->  | AF46: =RC[-29] -> 24 | AG46: =RC[-29] ->  | AH46: =RC[-29] ->  | AI46: =RC[-29] ->  | AJ46: =RC[-29] ->  | AK46: =RC[-29] ->  | AL46: =RC[-29] ->  | AM46: =RC[-29] -> #VALUE! | AN46: =RC[-29] ->  | AO46: =RC[-29] ->  | AP46: =RC[-29] ->  | AQ46: =RC[-29] ->  | AR46: - | AS46: =RC[-30] ->  | AT46: =RC[-30] ->  | AU46: - | AV46: =RC[-31] -> #VALUE! | AW46: =RC[-31] ->  | AX46: =RC[-31] ->  | AY46: =RC[-31] -> #VALUE!
A47: =IF(RC[1]="","",DATEVALUE(RC[1])) ->  | C47: 24 | J47: =RC[-5]-RC[-2] -> #VALUE! | Q47: =RC[-3]-RC[-1] -> #VALUE! | T47: =RC[-8]+RC[-1] -> #VALUE! | U47: =(RC[-17]*RC[-16]-RC[-14]*RC[-13])/1000 -> #VALUE! | V47: =RC[-11]/RC[-15]*100 -> #VALUE! | X47: =RC[-2]*RC[-10]/1000 -> #VALUE! | Y47: =(RC[-3]*RC[-11]-RC[-2]*RC[-9])/1000 -> #VALUE! | AD47: =VALUE(RC[-28]) -> #VALUE! | AE47: =IF(RC[22]=42,"*",IF(RC[22]=32,"",RC[22])) ->  | AF47: =RC[-29] -> 24 | AG47: =RC[-29] ->  | AH47: =RC[-29] ->  | AI47: =RC[-29] ->  | AJ47: =RC[-29] ->  | AK47: =RC[-29] ->  | AL47: =RC[-29] ->  | AM47: =RC[-29] -> #VALUE! | AN47: =RC[-29] ->  | AO47: =RC[-29] ->  | AP47: =RC[-29] ->  | AQ47: =RC[-29] ->  | AR47: - | AS47: =RC[-30] ->  | AT47: =RC[-30] ->  | AU47: - | AV47: =RC[-31] -> #VALUE! | AW47: =RC[-31] ->  | AX47: =RC[-31] ->  | AY47: =RC[-31] -> #VALUE!
A48: =IF(RC[1]="","",DATEVALUE(RC[1])) ->  | C48: 24 | J48: =RC[-5]-RC[-2] -> #VALUE! | Q48: =RC[-3]-RC[-1] -> #VALUE! | T48: =RC[-8]+RC[-1] -> #VALUE! | U48: =(RC[-17]*RC[-16]-RC[-14]*RC[-13])/1000 -> #VALUE! | V48: =RC[-11]/RC[-15]*100 -> #VALUE! | X48: =RC[-2]*RC[-10]/1000 -> #VALUE! | Y48: =(RC[-3]*RC[-11]-RC[-2]*RC[-9])/1000 -> #VALUE! | AD48: =VALUE(RC[-28]) -> #VALUE! | AE48: =IF(RC[22]=42,"*",IF(RC[22]=32,"",RC[22])) ->  | AF48: =RC[-29] -> 24 | AG48: =RC[-29] ->  | AH48: =RC[-29] ->  | AI48: =RC[-29] ->  | AJ48: =RC[-29] ->  | AK48: =RC[-29] ->  | AL48: =RC[-29] ->  | AM48: =RC[-29] -> #VALUE! | AN48: =RC[-29] ->  | AO48: =RC[-29] ->  | AP48: =RC[-29] ->  | AQ48: =RC[-29] ->  | AR48: - | AS48: =RC[-30] ->  | AT48: =RC[-30] ->  | AU48: - | AV48: =RC[-31] -> #VALUE! | AW48: =RC[-31] ->  | AX48: =RC[-31] ->  | AY48: =RC[-31] -> #VALUE!
A49: =IF(RC[1]="","",DATEVALUE(RC[1])) ->  | C49: 24 | J49: =RC[-5]-RC[-2] -> #VALUE! | Q49: =RC[-3]-RC[-1] -> #VALUE! | T49: =RC[-8]+RC[-1] -> #VALUE! | U49: =(RC[-17]*RC[-16]-RC[-14]*RC[-13])/1000 -> #VALUE! | V49: =RC[-11]/RC[-15]*100 -> #VALUE! | X49: =RC[-2]*RC[-10]/1000 -> #VALUE! | Y49: =(RC[-3]*RC[-11]-RC[-2]*RC[-9])/1000 -> #VALUE! | AD49: =VALUE(RC[-28]) -> #VALUE! | AE49: =IF(RC[22]=42,"*",IF(RC[22]=32,"",RC[22])) ->  | AF49: =RC[-29] -> 24 | AG49: =RC[-29] ->  | AH49: =RC[-29] ->  | AI49: =RC[-29] ->  | AJ49: =RC[-29] ->  | AK49: =RC[-29] ->  | AL49: =RC[-29] ->  | AM49: =RC[-29] -> #VALUE! | AN49: =RC[-29] ->  | AO49: =RC[-29] ->  | AP49: =RC[-29] ->  | AQ49: =RC[-29] ->  | AR49: - | AS49: =RC[-30] ->  | AT49: =RC[-30] ->  | AU49: - | AV49: =RC[-31] -> #VALUE! | AW49: =RC[-31] ->  | AX49: =RC[-31] ->  | AY49: =RC[-31] -> #VALUE!
A50: =IF(RC[1]="","",DATEVALUE(RC[1])) ->  | C50: 24 | J50: =RC[-5]-RC[-2] -> #VALUE! | Q50: =RC[-3]-RC[-1] -> #VALUE! | T50: =RC[-8]+RC[-1] -> #VALUE! | U50: =(RC[-17]*RC[-16]-RC[-14]*RC[-13])/1000 -> #VALUE! | V50: =RC[-11]/RC[-15]*100 -> #VALUE! | X50: =RC[-2]*RC[-10]/1000 -> #VALUE! | Y50: =(RC[-3]*RC[-11]-RC[-2]*RC[-9])/1000 -> #VALUE! | AD50: =VALUE(RC[-28]) -> #VALUE! | AE50: =IF(RC[22]=42,"*",IF(RC[22]=32,"",RC[22])) ->  | AF50: =RC[-29] -> 24 | AG50: =RC[-29] ->  | AH50: =RC[-29] ->  | AI50: =RC[-29] ->  | AJ50: =RC[-29] ->  | AK50: =RC[-29] ->  | AL50: =RC[-29] ->  | AM50: =RC[-29] -> #VALUE! | AN50: =RC[-29] ->  | AO50: =RC[-29] ->  | AP50: =RC[-29] ->  | AQ50: =RC[-29] ->  | AR50: - | AS50: =RC[-30] ->  | AT50: =RC[-30] ->  | AU50: - | AV50: =RC[-31] -> #VALUE! | AW50: =RC[-31] ->  | AX50: =RC[-31] ->  | AY50: =RC[-31] -> #VALUE!
A51: =IF(RC[1]="","",DATEVALUE(RC[1])) ->  | C51: 24 | J51: =RC[-5]-RC[-2] -> #VALUE! | Q51: =RC[-3]-RC[-1] -> #VALUE! | T51: =RC[-8]+RC[-1] -> #VALUE! | U51: =(RC[-17]*RC[-16]-RC[-14]*RC[-13])/1000 -> #VALUE! | V51: =RC[-11]/RC[-15]*100 -> #VALUE! | X51: =RC[-2]*RC[-10]/1000 -> #VALUE! | Y51: =(RC[-3]*RC[-11]-RC[-2]*RC[-9])/1000 -> #VALUE! | AD51: =VALUE(RC[-28]) -> #VALUE! | AE51: =IF(RC[22]=42,"*",IF(RC[22]=32,"",RC[22])) ->  | AF51: =RC[-29] -> 24 | AG51: =RC[-29] ->  | AH51: =RC[-29] ->  | AI51: =RC[-29] ->  | AJ51: =RC[-29] ->  | AK51: =RC[-29] ->  | AL51: =RC[-29] ->  | AM51: =RC[-29] -> #VALUE! | AN51: =RC[-29] ->  | AO51: =RC[-29] ->  | AP51: =RC[-29] ->  | AQ51: =RC[-29] ->  | AR51: - | AS51: =RC[-30] ->  | AT51: =RC[-30] ->  | AU51: - | AV51: =RC[-31] -> #VALUE! | AW51: =RC[-31] ->  | AX51: =RC[-31] ->  | AY51: =RC[-31] -> #VALUE!
A52: =IF(RC[1]="","",DATEVALUE(RC[1])) ->  | C52: 24 | J52: =RC[-5]-RC[-2] -> #VALUE! | Q52: =RC[-3]-RC[-1] -> #VALUE! | T52: =RC[-8]+RC[-1] -> #VALUE! | U52: =(RC[-17]*RC[-16]-RC[-14]*RC[-13])/1000 -> #VALUE! | V52: =RC[-11]/RC[-15]*100 -> #VALUE! | X52: =RC[-2]*RC[-10]/1000 -> #VALUE! | Y52: =(RC[-3]*RC[-11]-RC[-2]*RC[-9])/1000 -> #VALUE! | AD52: =VALUE(RC[-28]) -> #VALUE! | AE52: =IF(RC[22]=42,"*",IF(RC[22]=32,"",RC[22])) ->  | AF52: =RC[-29] -> 24 | AG52: =RC[-29] ->  | AH52: =RC[-29] ->  | AI52: =RC[-29] ->  | AJ52: =RC[-29] ->  | AK52: =RC[-29] ->  | AL52: =RC[-29] ->  | AM52: =RC[-29] -> #VALUE! | AN52: =RC[-29] ->  | AO52: =RC[-29] ->  | AP52: =RC[-29] ->  | AQ52: =RC[-29] ->  | AR52: - | AS52: =RC[-30] ->  | AT52: =RC[-30] ->  | AU52: - | AV52: =RC[-31] -> #VALUE! | AW52: =RC[-31] ->  | AX52: =RC[-31] ->  | AY52: =RC[-31] -> #VALUE!
A53: =IF(RC[1]="","",DATEVALUE(RC[1])) ->  | C53: 24 | J53: =RC[-5]-RC[-2] -> #VALUE! | Q53: =RC[-3]-RC[-1] -> #VALUE! | T53: =RC[-8]+RC[-1] -> #VALUE! | U53: =(RC[-17]*RC[-16]-RC[-14]*RC[-13])/1000 -> #VALUE! | V53: =RC[-11]/RC[-15]*100 -> #VALUE! | X53: =RC[-2]*RC[-10]/1000 -> #VALUE! | Y53: =(RC[-3]*RC[-11]-RC[-2]*RC[-9])/1000 -> #VALUE! | AD53: =VALUE(RC[-28]) -> #VALUE! | AE53: =IF(RC[22]=42,"*",IF(RC[22]=32,"",RC[22])) ->  | AF53: =RC[-29] -> 24 | AG53: =RC[-29] ->  | AH53: =RC[-29] ->  | AI53: =RC[-29] ->  | AJ53: =RC[-29] ->  | AK53: =RC[-29] ->  | AL53: =RC[-29] ->  | AM53: =RC[-29] -> #VALUE! | AN53: =RC[-29] ->  | AO53: =RC[-29] ->  | AP53: =RC[-29] ->  | AQ53: =RC[-29] ->  | AR53: - | AS53: =RC[-30] ->  | AT53: =RC[-30] ->  | AU53: - | AV53: =RC[-31] -> #VALUE! | AW53: =RC[-31] ->  | AX53: =RC[-31] ->  | AY53: =RC[-31] -> #VALUE!
A54: =IF(RC[1]="","",DATEVALUE(RC[1])) ->  | C54: 24 | J54: =RC[-5]-RC[-2] -> #VALUE! | Q54: =RC[-3]-RC[-1] -> #VALUE! | T54: =RC[-8]+RC[-1] -> #VALUE! | U54: =(RC[-17]*RC[-16]-RC[-14]*RC[-13])/1000 -> #VALUE! | V54: =RC[-11]/RC[-15]*100 -> #VALUE! | X54: =RC[-2]*RC[-10]/1000 -> #VALUE! | Y54: =(RC[-3]*RC[-11]-RC[-2]*RC[-9])/1000 -> #VALUE! | AD54: =VALUE(RC[-28]) -> #VALUE! | AE54: =IF(RC[22]=42,"*",IF(RC[22]=32,"",RC[22])) ->  | AF54: =RC[-29] -> 24 | AG54: =RC[-29] ->  | AH54: =RC[-29] ->  | AI54: =RC[-29] ->  | AJ54: =RC[-29] ->  | AK54: =RC[-29] ->  | AL54: =RC[-29] ->  | AM54: =RC[-29] -> #VALUE! | AN54: =RC[-29] ->  | AO54: =RC[-29] ->  | AP54: =RC[-29] ->  | AQ54: =RC[-29] ->  | AR54: - | AS54: =RC[-30] ->  | AT54: =RC[-30] ->  | AU54: - | AV54: =RC[-31] -> #VALUE! | AW54: =RC[-31] ->  | AX54: =RC[-31] ->  | AY54: =RC[-31] -> #VALUE!
A55: =IF(RC[1]="","",DATEVALUE(RC[1])) ->  | C55: 24 | J55: =RC[-5]-RC[-2] -> #VALUE! | Q55: =RC[-3]-RC[-1] -> #VALUE! | T55: =RC[-8]+RC[-1] -> #VALUE! | U55: =(RC[-17]*RC[-16]-RC[-14]*RC[-13])/1000 -> #VALUE! | V55: =RC[-11]/RC[-15]*100 -> #VALUE! | X55: =RC[-2]*RC[-10]/1000 -> #VALUE! | Y55: =(RC[-3]*RC[-11]-RC[-2]*RC[-9])/1000 -> #VALUE! | AD55: =VALUE(RC[-28]) -> #VALUE! | AE55: =IF(RC[22]=42,"*",IF(RC[22]=32,"",RC[22])) ->  | AF55: =RC[-29] -> 24 | AG55: =RC[-29] ->  | AH55: =RC[-29] ->  | AI55: =RC[-29] ->  | AJ55: =RC[-29] ->  | AK55: =RC[-29] ->  | AL55: =RC[-29] ->  | AM55: =RC[-29] -> #VALUE! | AN55: =RC[-29] ->  | AO55: =RC[-29] ->  | AP55: =RC[-29] ->  | AQ55: =RC[-29] ->  | AR55: - | AS55: =RC[-30] ->  | AT55: =RC[-30] ->  | AU55: - | AV55: =RC[-31] -> #VALUE! | AW55: =RC[-31] ->  | AX55: =RC[-31] ->  | AY55: =RC[-31] -> #VALUE!
A56: =IF(RC[1]="","",DATEVALUE(RC[1])) ->  | C56: 24 | J56: =RC[-5]-RC[-2] -> #VALUE! | Q56: =RC[-3]-RC[-1] -> #VALUE! | T56: =RC[-8]+RC[-1] -> #VALUE! | U56: =(RC[-17]*RC[-16]-RC[-14]*RC[-13])/1000 -> #VALUE! | V56: =RC[-11]/RC[-15]*100 -> #VALUE! | X56: =RC[-2]*RC[-10]/1000 -> #VALUE! | Y56: =(RC[-3]*RC[-11]-RC[-2]*RC[-9])/1000 -> #VALUE! | AD56: =VALUE(RC[-28]) -> #VALUE! | AE56: =IF(RC[22]=42,"*",IF(RC[22]=32,"",RC[22])) ->  | AF56: =RC[-29] -> 24 | AG56: =RC[-29] ->  | AH56: =RC[-29] ->  | AI56: =RC[-29] ->  | AJ56: =RC[-29] ->  | AK56: =RC[-29] ->  | AL56: =RC[-29] ->  | AM56: =RC[-29] -> #VALUE! | AN56: =RC[-29] ->  | AO56: =RC[-29] ->  | AP56: =RC[-29] ->  | AQ56: =RC[-29] ->  | AR56: - | AS56: =RC[-30] ->  | AT56: =RC[-30] ->  | AU56: - | AV56: =RC[-31] -> #VALUE! | AW56: =RC[-31] ->  | AX56: =RC[-31] ->  | AY56: =RC[-31] -> #VALUE!
A57: =IF(RC[1]="","",DATEVALUE(RC[1])) ->  | C57: 24 | J57: =RC[-5]-RC[-2] -> #VALUE! | Q57: =RC[-3]-RC[-1] -> #VALUE! | T57: =RC[-8]+RC[-1] -> #VALUE! | U57: =(RC[-17]*RC[-16]-RC[-14]*RC[-13])/1000 -> #VALUE! | V57: =RC[-11]/RC[-15]*100 -> #VALUE! | X57: =RC[-2]*RC[-10]/1000 -> #VALUE! | Y57: =(RC[-3]*RC[-11]-RC[-2]*RC[-9])/1000 -> #VALUE! | AD57: =VALUE(RC[-28]) -> #VALUE! | AE57: =IF(RC[22]=42,"*",IF(RC[22]=32,"",RC[22])) ->  | AF57: =RC[-29] -> 24 | AG57: =RC[-29] ->  | AH57: =RC[-29] ->  | AI57: =RC[-29] ->  | AJ57: =RC[-29] ->  | AK57: =RC[-29] ->  | AL57: =RC[-29] ->  | AM57: =RC[-29] -> #VALUE! | AN57: =RC[-29] ->  | AO57: =RC[-29] ->  | AP57: =RC[-29] ->  | AQ57: =RC[-29] ->  | AR57: - | AS57: =RC[-30] ->  | AT57: =RC[-30] ->  | AU57: - | AV57: =RC[-31] -> #VALUE! | AW57: =RC[-31] ->  | AX57: =RC[-31] ->  | AY57: =RC[-31] -> #VALUE!
A58: =IF(RC[1]="","",DATEVALUE(RC[1])) ->  | C58: 24 | J58: =RC[-5]-RC[-2] -> #VALUE! | Q58: =RC[-3]-RC[-1] -> #VALUE! | T58: =RC[-8]+RC[-1] -> #VALUE! | U58: =(RC[-17]*RC[-16]-RC[-14]*RC[-13])/1000 -> #VALUE! | V58: =RC[-11]/RC[-15]*100 -> #VALUE! | X58: =RC[-2]*RC[-10]/1000 -> #VALUE! | Y58: =(RC[-3]*RC[-11]-RC[-2]*RC[-9])/1000 -> #VALUE! | AD58: =VALUE(RC[-28]) -> #VALUE! | AE58: =IF(RC[22]=42,"*",IF(RC[22]=32,"",RC[22])) ->  | AF58: =RC[-29] -> 24 | AG58: =RC[-29] ->  | AH58: =RC[-29] ->  | AI58: =RC[-29] ->  | AJ58: =RC[-29] ->  | AK58: =RC[-29] ->  | AL58: =RC[-29] ->  | AM58: =RC[-29] -> #VALUE! | AN58: =RC[-29] ->  | AO58: =RC[-29] ->  | AP58: =RC[-29] ->  | AQ58: =RC[-29] ->  | AR58: - | AS58: =RC[-30] ->  | AT58: =RC[-30] ->  | AU58: - | AV58: =RC[-31] -> #VALUE! | AW58: =RC[-31] ->  | AX58: =RC[-31] ->  | AY58: =RC[-31] -> #VALUE!
A59: =IF(RC[1]="","",DATEVALUE(RC[1])) ->  | C59: 24 | J59: =RC[-5]-RC[-2] -> #VALUE! | Q59: =RC[-3]-RC[-1] -> #VALUE! | T59: =RC[-8]+RC[-1] -> #VALUE! | U59: =(RC[-17]*RC[-16]-RC[-14]*RC[-13])/1000 -> #VALUE! | V59: =RC[-11]/RC[-15]*100 -> #VALUE! | X59: =RC[-2]*RC[-10]/1000 -> #VALUE! | Y59: =(RC[-3]*RC[-11]-RC[-2]*RC[-9])/1000 -> #VALUE! | AD59: =VALUE(RC[-28]) -> #VALUE! | AE59: =IF(RC[22]=42,"*",IF(RC[22]=32,"",RC[22])) ->  | AF59: =RC[-29] -> 24 | AG59: =RC[-29] ->  | AH59: =RC[-29] ->  | AI59: =RC[-29] ->  | AJ59: =RC[-29] ->  | AK59: =RC[-29] ->  | AL59: =RC[-29] ->  | AM59: =RC[-29] -> #VALUE! | AN59: =RC[-29] ->  | AO59: =RC[-29] ->  | AP59: =RC[-29] ->  | AQ59: =RC[-29] ->  | AR59: - | AS59: =RC[-30] ->  | AT59: =RC[-30] ->  | AU59: - | AV59: =RC[-31] -> #VALUE! | AW59: =RC[-31] ->  | AX59: =RC[-31] ->  | AY59: =RC[-31] -> #VALUE!
A60: =IF(RC[1]="","",DATEVALUE(RC[1])) ->  | C60: 24 | J60: =RC[-5]-RC[-2] -> #VALUE! | Q60: =RC[-3]-RC[-1] -> #VALUE! | T60: =RC[-8]+RC[-1] -> #VALUE! | U60: =(RC[-17]*RC[-16]-RC[-14]*RC[-13])/1000 -> #VALUE! | V60: =RC[-11]/RC[-15]*100 -> #VALUE! | X60: =RC[-2]*RC[-10]/1000 -> #VALUE! | Y60: =(RC[-3]*RC[-11]-RC[-2]*RC[-9])/1000 -> #VALUE! | AD60: =VALUE(RC[-28]) -> #VALUE! | AE60: =IF(RC[22]=42,"*",IF(RC[22]=32,"",RC[22])) ->  | AF60: =RC[-29] -> 24 | AG60: =RC[-29] ->  | AH60: =RC[-29] ->  | AI60: =RC[-29] ->  | AJ60: =RC[-29] ->  | AK60: =RC[-29] ->  | AL60: =RC[-29] ->  | AM60: =RC[-29] -> #VALUE! | AN60: =RC[-29] ->  | AO60: =RC[-29] ->  | AP60: =RC[-29] ->  | AQ60: =RC[-29] ->  | AR60: - | AS60: =RC[-30] ->  | AT60: =RC[-30] ->  | AU60: - | AV60: =RC[-31] -> #VALUE! | AW60: =RC[-31] ->  | AX60: =RC[-31] ->  | AY60: =RC[-31] -> #VALUE!
A61: =IF(RC[1]="","",DATEVALUE(RC[1])) ->  | C61: 24 | J61: =RC[-5]-RC[-2] -> #VALUE! | Q61: =RC[-3]-RC[-1] -> #VALUE! | T61: =RC[-8]+RC[-1] -> #VALUE! | U61: =(RC[-17]*RC[-16]-RC[-14]*RC[-13])/1000 -> #VALUE! | V61: =RC[-11]/RC[-15]*100 -> #VALUE! | X61: =RC[-2]*RC[-10]/1000 -> #VALUE! | Y61: =(RC[-3]*RC[-11]-RC[-2]*RC[-9])/1000 -> #VALUE! | AD61: =VALUE(RC[-28]) -> #VALUE! | AE61: =IF(RC[22]=42,"*",IF(RC[22]=32,"",RC[22])) ->  | AF61: =RC[-29] -> 24 | AG61: =RC[-29] ->  | AH61: =RC[-29] ->  | AI61: =RC[-29] ->  | AJ61: =RC[-29] ->  | AK61: =RC[-29] ->  | AL61: =RC[-29] ->  | AM61: =RC[-29] -> #VALUE! | AN61: =RC[-29] ->  | AO61: =RC[-29] ->  | AP61: =RC[-29] ->  | AQ61: =RC[-29] ->  | AR61: - | AS61: =RC[-30] ->  | AT61: =RC[-30] ->  | AU61: - | AV61: =RC[-31] -> #VALUE! | AW61: =RC[-31] ->  | AX61: =RC[-31] ->  | AY61: =RC[-31] -> #VALUE!
A62: =IF(RC[1]="","",DATEVALUE(RC[1])) ->  | C62: 24 | J62: =RC[-5]-RC[-2] -> #VALUE! | Q62: =RC[-3]-RC[-1] -> #VALUE! | T62: =RC[-8]+RC[-1] -> #VALUE! | U62: =(RC[-17]*RC[-16]-RC[-14]*RC[-13])/1000 -> #VALUE! | V62: =RC[-11]/RC[-15]*100 -> #VALUE! | X62: =RC[-2]*RC[-10]/1000 -> #VALUE! | Y62: =(RC[-3]*RC[-11]-RC[-2]*RC[-9])/1000 -> #VALUE! | AD62: =VALUE(RC[-28]) -> #VALUE! | AE62: =IF(RC[22]=42,"*",IF(RC[22]=32,"",RC[22])) ->  | AF62: =RC[-29] -> 24 | AG62: =RC[-29] ->  | AH62: =RC[-29] ->  | AI62: =RC[-29] ->  | AJ62: =RC[-29] ->  | AK62: =RC[-29] ->  | AL62: =RC[-29] ->  | AM62: =RC[-29] -> #VALUE! | AN62: =RC[-29] ->  | AO62: =RC[-29] ->  | AP62: =RC[-29] ->  | AQ62: =RC[-29] ->  | AR62: - | AS62: =RC[-30] ->  | AT62: =RC[-30] ->  | AU62: - | AV62: =RC[-31] -> #VALUE! | AW62: =RC[-31] ->  | AX62: =RC[-31] ->  | AY62: =RC[-31] -> #VALUE!
A63: =IF(RC[1]="","",DATEVALUE(RC[1])) ->  | C63: 24 | J63: =RC[-5]-RC[-2] -> #VALUE! | Q63: =RC[-3]-RC[-1] -> #VALUE! | T63: =RC[-8]+RC[-1] -> #VALUE! | U63: =(RC[-17]*RC[-16]-RC[-14]*RC[-13])/1000 -> #VALUE! | V63: =RC[-11]/RC[-15]*100 -> #VALUE! | X63: =RC[-2]*RC[-10]/1000 -> #VALUE! | Y63: =(RC[-3]*RC[-11]-RC[-2]*RC[-9])/1000 -> #VALUE! | AD63: =VALUE(RC[-28]) -> #VALUE! | AE63: =IF(RC[22]=42,"*",IF(RC[22]=32,"",RC[22])) ->  | AF63: =RC[-29] -> 24 | AG63: =RC[-29] ->  | AH63: =RC[-29] ->  | AI63: =RC[-29] ->  | AJ63: =RC[-29] ->  | AK63: =RC[-29] ->  | AL63: =RC[-29] ->  | AM63: =RC[-29] -> #VALUE! | AN63: =RC[-29] ->  | AO63: =RC[-29] ->  | AP63: =RC[-29] ->  | AQ63: =RC[-29] ->  | AR63: - | AS63: =RC[-30] ->  | AT63: =RC[-30] ->  | AU63: - | AV63: =RC[-31] -> #VALUE! | AW63: =RC[-31] ->  | AX63: =RC[-31] ->  | AY63: =RC[-31] -> #VALUE!
A64: =IF(RC[1]="","",DATEVALUE(RC[1])) ->  | C64: 24 | J64: =RC[-5]-RC[-2] -> #VALUE! | Q64: =RC[-3]-RC[-1] -> #VALUE! | T64: =RC[-8]+RC[-1] -> #VALUE! | U64: =(RC[-17]*RC[-16]-RC[-14]*RC[-13])/1000 -> #VALUE! | V64: =RC[-11]/RC[-15]*100 -> #VALUE! | X64: =RC[-2]*RC[-10]/1000 -> #VALUE! | Y64: =(RC[-3]*RC[-11]-RC[-2]*RC[-9])/1000 -> #VALUE! | AD64: =VALUE(RC[-28]) -> #VALUE! | AE64: =IF(RC[22]=42,"*",IF(RC[22]=32,"",RC[22])) ->  | AF64: =RC[-29] -> 24 | AG64: =RC[-29] ->  | AH64: =RC[-29] ->  | AI64: =RC[-29] ->  | AJ64: =RC[-29] ->  | AK64: =RC[-29] ->  | AL64: =RC[-29] ->  | AM64: =RC[-29] -> #VALUE! | AN64: =RC[-29] ->  | AO64: =RC[-29] ->  | AP64: =RC[-29] ->  | AQ64: =RC[-29] ->  | AR64: - | AS64: =RC[-30] ->  | AT64: =RC[-30] ->  | AU64: - | AV64: =RC[-31] -> #VALUE! | AW64: =RC[-31] ->  | AX64: =RC[-31] ->  | AY64: =RC[-31] -> #VALUE!
A65: =IF(RC[1]="","",DATEVALUE(RC[1])) ->  | C65: 24 | J65: =RC[-5]-RC[-2] -> #VALUE! | Q65: =RC[-3]-RC[-1] -> #VALUE! | T65: =RC[-8]+RC[-1] -> #VALUE! | U65: =(RC[-17]*RC[-16]-RC[-14]*RC[-13])/1000 -> #VALUE! | V65: =RC[-11]/RC[-15]*100 -> #VALUE! | X65: =RC[-2]*RC[-10]/1000 -> #VALUE! | Y65: =(RC[-3]*RC[-11]-RC[-2]*RC[-9])/1000 -> #VALUE! | AD65: =VALUE(RC[-28]) -> #VALUE! | AE65: =IF(RC[22]=42,"*",IF(RC[22]=32,"",RC[22])) ->  | AF65: =RC[-29] -> 24 | AG65: =RC[-29] ->  | AH65: =RC[-29] ->  | AI65: =RC[-29] ->  | AJ65: =RC[-29] ->  | AK65: =RC[-29] ->  | AL65: =RC[-29] ->  | AM65: =RC[-29] -> #VALUE! | AN65: =RC[-29] ->  | AO65: =RC[-29] ->  | AP65: =RC[-29] ->  | AQ65: =RC[-29] ->  | AR65: - | AS65: =RC[-30] ->  | AT65: =RC[-30] ->  | AU65: - | AV65: =RC[-31] -> #VALUE! | AW65: =RC[-31] ->  | AX65: =RC[-31] ->  | AY65: =RC[-31] -> #VALUE!
A66: =IF(RC[1]="","",DATEVALUE(RC[1])) ->  | C66: 24 | J66: =RC[-5]-RC[-2] -> #VALUE! | Q66: =RC[-3]-RC[-1] -> #VALUE! | T66: =RC[-8]+RC[-1] -> #VALUE! | U66: =(RC[-17]*RC[-16]-RC[-14]*RC[-13])/1000 -> #VALUE! | V66: =RC[-11]/RC[-15]*100 -> #VALUE! | X66: =RC[-2]*RC[-10]/1000 -> #VALUE! | Y66: =(RC[-3]*RC[-11]-RC[-2]*RC[-9])/1000 -> #VALUE! | AD66: =VALUE(RC[-28]) -> #VALUE! | AE66: =IF(RC[22]=42,"*",IF(RC[22]=32,"",RC[22])) ->  | AF66: =RC[-29] -> 24 | AG66: =RC[-29] ->  | AH66: =RC[-29] ->  | AI66: =RC[-29] ->  | AJ66: =RC[-29] ->  | AK66: =RC[-29] ->  | AL66: =RC[-29] ->  | AM66: =RC[-29] -> #VALUE! | AN66: =RC[-29] ->  | AO66: =RC[-29] ->  | AP66: =RC[-29] ->  | AQ66: =RC[-29] ->  | AR66: - | AS66: =RC[-30] ->  | AT66: =RC[-30] ->  | AU66: - | AV66: =RC[-31] -> #VALUE! | AW66: =RC[-31] ->  | AX66: =RC[-31] ->  | AY66: =RC[-31] -> #VALUE!
A67: =IF(RC[1]="","",DATEVALUE(RC[1])) ->  | C67: 24 | J67: =RC[-5]-RC[-2] -> #VALUE! | Q67: =RC[-3]-RC[-1] -> #VALUE! | T67: =RC[-8]+RC[-1] -> #VALUE! | U67: =(RC[-17]*RC[-16]-RC[-14]*RC[-13])/1000 -> #VALUE! | V67: =RC[-11]/RC[-15]*100 -> #VALUE! | X67: =RC[-2]*RC[-10]/1000 -> #VALUE! | Y67: =(RC[-3]*RC[-11]-RC[-2]*RC[-9])/1000 -> #VALUE! | AD67: =VALUE(RC[-28]) -> #VALUE! | AE67: =IF(RC[22]=42,"*",IF(RC[22]=32,"",RC[22])) ->  | AF67: =RC[-29] -> 24 | AG67: =RC[-29] ->  | AH67: =RC[-29] ->  | AI67: =RC[-29] ->  | AJ67: =RC[-29] ->  | AK67: =RC[-29] ->  | AL67: =RC[-29] ->  | AM67: =RC[-29] -> #VALUE! | AN67: =RC[-29] ->  | AO67: =RC[-29] ->  | AP67: =RC[-29] ->  | AQ67: =RC[-29] ->  | AR67: - | AS67: =RC[-30] ->  | AT67: =RC[-30] ->  | AU67: - | AV67: =RC[-31] -> #VALUE! | AW67: =RC[-31] ->  | AX67: =RC[-31] ->  | AY67: =RC[-31] -> #VALUE!
A68: =IF(RC[1]="","",DATEVALUE(RC[1])) ->  | C68: 24 | J68: =RC[-5]-RC[-2] -> #VALUE! | Q68: =RC[-3]-RC[-1] -> #VALUE! | T68: =RC[-8]+RC[-1] -> #VALUE! | U68: =(RC[-17]*RC[-16]-RC[-14]*RC[-13])/1000 -> #VALUE! | V68: =RC[-11]/RC[-15]*100 -> #VALUE! | X68: =RC[-2]*RC[-10]/1000 -> #VALUE! | Y68: =(RC[-3]*RC[-11]-RC[-2]*RC[-9])/1000 -> #VALUE! | AD68: =VALUE(RC[-28]) -> #VALUE! | AE68: =IF(RC[22]=42,"*",IF(RC[22]=32,"",RC[22])) ->  | AF68: =RC[-29] -> 24 | AG68: =RC[-29] ->  | AH68: =RC[-29] ->  | AI68: =RC[-29] ->  | AJ68: =RC[-29] ->  | AK68: =RC[-29] ->  | AL68: =RC[-29] ->  | AM68: =RC[-29] -> #VALUE! | AN68: =RC[-29] ->  | AO68: =RC[-29] ->  | AP68: =RC[-29] ->  | AQ68: =RC[-29] ->  | AR68: - | AS68: =RC[-30] ->  | AT68: =RC[-30] ->  | AU68: - | AV68: =RC[-31] -> #VALUE! | AW68: =RC[-31] ->  | AX68: =RC[-31] ->  | AY68: =RC[-31] -> #VALUE!
A69: =IF(RC[1]="","",DATEVALUE(RC[1])) ->  | C69: 24 | J69: =RC[-5]-RC[-2] -> #VALUE! | Q69: =RC[-3]-RC[-1] -> #VALUE! | T69: =RC[-8]+RC[-1] -> #VALUE! | U69: =(RC[-17]*RC[-16]-RC[-14]*RC[-13])/1000 -> #VALUE! | V69: =RC[-11]/RC[-15]*100 -> #VALUE! | X69: =RC[-2]*RC[-10]/1000 -> #VALUE! | Y69: =(RC[-3]*RC[-11]-RC[-2]*RC[-9])/1000 -> #VALUE! | AD69: =VALUE(RC[-28]) -> #VALUE! | AE69: =IF(RC[22]=42,"*",IF(RC[22]=32,"",RC[22])) ->  | AF69: =RC[-29] -> 24 | AG69: =RC[-29] ->  | AH69: =RC[-29] ->  | AI69: =RC[-29] ->  | AJ69: =RC[-29] ->  | AK69: =RC[-29] ->  | AL69: =RC[-29] ->  | AM69: =RC[-29] -> #VALUE! | AN69: =RC[-29] ->  | AO69: =RC[-29] ->  | AP69: =RC[-29] ->  | AQ69: =RC[-29] ->  | AR69: - | AS69: =RC[-30] ->  | AT69: =RC[-30] ->  | AU69: - | AV69: =RC[-31] -> #VALUE! | AW69: =RC[-31] ->  | AX69: =RC[-31] ->  | AY69: =RC[-31] -> #VALUE!
A70: =IF(RC[1]="","",DATEVALUE(RC[1])) ->  | C70: 24 | J70: =RC[-5]-RC[-2] -> #VALUE! | Q70: =RC[-3]-RC[-1] -> #VALUE! | T70: =RC[-8]+RC[-1] -> #VALUE! | U70: =(RC[-17]*RC[-16]-RC[-14]*RC[-13])/1000 -> #VALUE! | V70: =RC[-11]/RC[-15]*100 -> #VALUE! | X70: =RC[-2]*RC[-10]/1000 -> #VALUE! | Y70: =(RC[-3]*RC[-11]-RC[-2]*RC[-9])/1000 -> #VALUE! | AD70: =VALUE(RC[-28]) -> #VALUE! | AE70: =IF(RC[22]=42,"*",IF(RC[22]=32,"",RC[22])) ->  | AF70: =RC[-29] -> 24 | AG70: =RC[-29] ->  | AH70: =RC[-29] ->  | AI70: =RC[-29] ->  | AJ70: =RC[-29] ->  | AK70: =RC[-29] ->  | AL70: =RC[-29] ->  | AM70: =RC[-29] -> #VALUE! | AN70: =RC[-29] ->  | AO70: =RC[-29] ->  | AP70: =RC[-29] ->  | AQ70: =RC[-29] ->  | AR70: - | AS70: =RC[-30] ->  | AT70: =RC[-30] ->  | AU70: - | AV70: =RC[-31] -> #VALUE! | AW70: =RC[-31] ->  | AX70: =RC[-31] ->  | AY70: =RC[-31] -> #VALUE!
A71: =IF(RC[1]="","",DATEVALUE(RC[1])) ->  | C71: 24 | J71: =RC[-5]-RC[-2] -> #VALUE! | Q71: =RC[-3]-RC[-1] -> #VALUE! | T71: =RC[-8]+RC[-1] -> #VALUE! | U71: =(RC[-17]*RC[-16]-RC[-14]*RC[-13])/1000 -> #VALUE! | V71: =RC[-11]/RC[-15]*100 -> #VALUE! | X71: =RC[-2]*RC[-10]/1000 -> #VALUE! | Y71: =(RC[-3]*RC[-11]-RC[-2]*RC[-9])/1000 -> #VALUE! | AD71: =VALUE(RC[-28]) -> #VALUE! | AE71: =IF(RC[22]=42,"*",IF(RC[22]=32,"",RC[22])) ->  | AF71: =RC[-29] -> 24 | AG71: =RC[-29] ->  | AH71: =RC[-29] ->  | AI71: =RC[-29] ->  | AJ71: =RC[-29] ->  | AK71: =RC[-29] ->  | AL71: =RC[-29] ->  | AM71: =RC[-29] -> #VALUE! | AN71: =RC[-29] ->  | AO71: =RC[-29] ->  | AP71: =RC[-29] ->  | AQ71: =RC[-29] ->  | AR71: - | AS71: =RC[-30] ->  | AT71: =RC[-30] ->  | AU71: - | AV71: =RC[-31] -> #VALUE! | AW71: =RC[-31] ->  | AX71: =RC[-31] ->  | AY71: =RC[-31] -> #VALUE!
A72: =IF(RC[1]="","",DATEVALUE(RC[1])) ->  | C72: 24 | J72: =RC[-5]-RC[-2] -> #VALUE! | Q72: =RC[-3]-RC[-1] -> #VALUE! | T72: =RC[-8]+RC[-1] -> #VALUE! | U72: =(RC[-17]*RC[-16]-RC[-14]*RC[-13])/1000 -> #VALUE! | V72: =RC[-11]/RC[-15]*100 -> #VALUE! | X72: =RC[-2]*RC[-10]/1000 -> #VALUE! | Y72: =(RC[-3]*RC[-11]-RC[-2]*RC[-9])/1000 -> #VALUE! | AD72: =VALUE(RC[-28]) -> #VALUE! | AE72: =IF(RC[22]=42,"*",IF(RC[22]=32,"",RC[22])) ->  | AF72: =RC[-29] -> 24 | AG72: =RC[-29] ->  | AH72: =RC[-29] ->  | AI72: =RC[-29] ->  | AJ72: =RC[-29] ->  | AK72: =RC[-29] ->  | AL72: =RC[-29] ->  | AM72: =RC[-29] -> #VALUE! | AN72: =RC[-29] ->  | AO72: =RC[-29] ->  | AP72: =RC[-29] ->  | AQ72: =RC[-29] ->  | AR72: - | AS72: =RC[-30] ->  | AT72: =RC[-30] ->  | AU72: - | AV72: =RC[-31] -> #VALUE! | AW72: =RC[-31] ->  | AX72: =RC[-31] ->  | AY72: =RC[-31] -> #VALUE!
A73: =IF(RC[1]="","",DATEVALUE(RC[1])) ->  | C73: 24 | J73: =RC[-5]-RC[-2] -> #VALUE! | Q73: =RC[-3]-RC[-1] -> #VALUE! | T73: =RC[-8]+RC[-1] -> #VALUE! | U73: =(RC[-17]*RC[-16]-RC[-14]*RC[-13])/1000 -> #VALUE! | V73: =RC[-11]/RC[-15]*100 -> #VALUE! | X73: =RC[-2]*RC[-10]/1000 -> #VALUE! | Y73: =(RC[-3]*RC[-11]-RC[-2]*RC[-9])/1000 -> #VALUE! | AD73: =VALUE(RC[-28]) -> #VALUE! | AE73: =IF(RC[22]=42,"*",IF(RC[22]=32,"",RC[22])) ->  | AF73: =RC[-29] -> 24 | AG73: =RC[-29] ->  | AH73: =RC[-29] ->  | AI73: =RC[-29] ->  | AJ73: =RC[-29] ->  | AK73: =RC[-29] ->  | AL73: =RC[-29] ->  | AM73: =RC[-29] -> #VALUE! | AN73: =RC[-29] ->  | AO73: =RC[-29] ->  | AP73: =RC[-29] ->  | AQ73: =RC[-29] ->  | AR73: - | AS73: =RC[-30] ->  | AT73: =RC[-30] ->  | AU73: - | AV73: =RC[-31] -> #VALUE! | AW73: =RC[-31] ->  | AX73: =RC[-31] ->  | AY73: =RC[-31] -> #VALUE!
A74: =IF(RC[1]="","",DATEVALUE(RC[1])) ->  | C74: 24 | J74: =RC[-5]-RC[-2] -> #VALUE! | Q74: =RC[-3]-RC[-1] -> #VALUE! | T74: =RC[-8]+RC[-1] -> #VALUE! | U74: =(RC[-17]*RC[-16]-RC[-14]*RC[-13])/1000 -> #VALUE! | V74: =RC[-11]/RC[-15]*100 -> #VALUE! | X74: =RC[-2]*RC[-10]/1000 -> #VALUE! | Y74: =(RC[-3]*RC[-11]-RC[-2]*RC[-9])/1000 -> #VALUE! | AD74: =VALUE(RC[-28]) -> #VALUE! | AE74: =IF(RC[22]=42,"*",IF(RC[22]=32,"",RC[22])) ->  | AF74: =RC[-29] -> 24 | AG74: =RC[-29] ->  | AH74: =RC[-29] ->  | AI74: =RC[-29] ->  | AJ74: =RC[-29] ->  | AK74: =RC[-29] ->  | AL74: =RC[-29] ->  | AM74: =RC[-29] -> #VALUE! | AN74: =RC[-29] ->  | AO74: =RC[-29] ->  | AP74: =RC[-29] ->  | AQ74: =RC[-29] ->  | AR74: - | AS74: =RC[-30] ->  | AT74: =RC[-30] ->  | AU74: - | AV74: =RC[-31] -> #VALUE! | AW74: =RC[-31] ->  | AX74: =RC[-31] ->  | AY74: =RC[-31] -> #VALUE!
A75: =IF(RC[1]="","",DATEVALUE(RC[1])) ->  | C75: 24 | J75: =RC[-5]-RC[-2] -> #VALUE! | Q75: =RC[-3]-RC[-1] -> #VALUE! | T75: =RC[-8]+RC[-1] -> #VALUE! | U75: =(RC[-17]*RC[-16]-RC[-14]*RC[-13])/1000 -> #VALUE! | V75: =RC[-11]/RC[-15]*100 -> #VALUE! | X75: =RC[-2]*RC[-10]/1000 -> #VALUE! | Y75: =(RC[-3]*RC[-11]-RC[-2]*RC[-9])/1000 -> #VALUE! | AD75: =VALUE(RC[-28]) -> #VALUE! | AE75: =IF(RC[22]=42,"*",IF(RC[22]=32,"",RC[22])) ->  | AF75: =RC[-29] -> 24 | AG75: =RC[-29] ->  | AH75: =RC[-29] ->  | AI75: =RC[-29] ->  | AJ75: =RC[-29] ->  | AK75: =RC[-29] ->  | AL75: =RC[-29] ->  | AM75: =RC[-29] -> #VALUE! | AN75: =RC[-29] ->  | AO75: =RC[-29] ->  | AP75: =RC[-29] ->  | AQ75: =RC[-29] ->  | AR75: - | AS75: =RC[-30] ->  | AT75: =RC[-30] ->  | AU75: - | AV75: =RC[-31] -> #VALUE! | AW75: =RC[-31] ->  | AX75: =RC[-31] ->  | AY75: =RC[-31] -> #VALUE!
A76: =IF(RC[1]="","",DATEVALUE(RC[1])) ->  | C76: 24 | J76: =RC[-5]-RC[-2] -> #VALUE! | Q76: =RC[-3]-RC[-1] -> #VALUE! | T76: =RC[-8]+RC[-1] -> #VALUE! | U76: =(RC[-17]*RC[-16]-RC[-14]*RC[-13])/1000 -> #VALUE! | V76: =RC[-11]/RC[-15]*100 -> #VALUE! | X76: =RC[-2]*RC[-10]/1000 -> #VALUE! | Y76: =(RC[-3]*RC[-11]-RC[-2]*RC[-9])/1000 -> #VALUE! | AD76: =VALUE(RC[-28]) -> #VALUE! | AE76: =IF(RC[22]=42,"*",IF(RC[22]=32,"",RC[22])) ->  | AF76: =RC[-29] -> 24 | AG76: =RC[-29] ->  | AH76: =RC[-29] ->  | AI76: =RC[-29] ->  | AJ76: =RC[-29] ->  | AK76: =RC[-29] ->  | AL76: =RC[-29] ->  | AM76: =RC[-29] -> #VALUE! | AN76: =RC[-29] ->  | AO76: =RC[-29] ->  | AP76: =RC[-29] ->  | AQ76: =RC[-29] ->  | AR76: - | AS76: =RC[-30] ->  | AT76: =RC[-30] ->  | AU76: - | AV76: =RC[-31] -> #VALUE! | AW76: =RC[-31] ->  | AX76: =RC[-31] ->  | AY76: =RC[-31] -> #VALUE!
A77: =IF(RC[1]="","",DATEVALUE(RC[1])) ->  | C77: 24 | J77: =RC[-5]-RC[-2] -> #VALUE! | Q77: =RC[-3]-RC[-1] -> #VALUE! | T77: =RC[-8]+RC[-1] -> #VALUE! | U77: =(RC[-17]*RC[-16]-RC[-14]*RC[-13])/1000 -> #VALUE! | V77: =RC[-11]/RC[-15]*100 -> #VALUE! | X77: =RC[-2]*RC[-10]/1000 -> #VALUE! | Y77: =(RC[-3]*RC[-11]-RC[-2]*RC[-9])/1000 -> #VALUE! | AD77: =VALUE(RC[-28]) -> #VALUE! | AE77: =IF(RC[22]=42,"*",IF(RC[22]=32,"",RC[22])) ->  | AF77: =RC[-29] -> 24 | AG77: =RC[-29] ->  | AH77: =RC[-29] ->  | AI77: =RC[-29] ->  | AJ77: =RC[-29] ->  | AK77: =RC[-29] ->  | AL77: =RC[-29] ->  | AM77: =RC[-29] -> #VALUE! | AN77: =RC[-29] ->  | AO77: =RC[-29] ->  | AP77: =RC[-29] ->  | AQ77: =RC[-29] ->  | AR77: - | AS77: =RC[-30] ->  | AT77: =RC[-30] ->  | AU77: - | AV77: =RC[-31] -> #VALUE! | AW77: =RC[-31] ->  | AX77: =RC[-31] ->  | AY77: =RC[-31] -> #VALUE!
A78: =IF(RC[1]="","",DATEVALUE(RC[1])) ->  | C78: 24 | J78: =RC[-5]-RC[-2] -> #VALUE! | Q78: =RC[-3]-RC[-1] -> #VALUE! | T78: =RC[-8]+RC[-1] -> #VALUE! | U78: =(RC[-17]*RC[-16]-RC[-14]*RC[-13])/1000 -> #VALUE! | V78: =RC[-11]/RC[-15]*100 -> #VALUE! | X78: =RC[-2]*RC[-10]/1000 -> #VALUE! | Y78: =(RC[-3]*RC[-11]-RC[-2]*RC[-9])/1000 -> #VALUE! | AD78: =VALUE(RC[-28]) -> #VALUE! | AE78: =IF(RC[22]=42,"*",IF(RC[22]=32,"",RC[22])) ->  | AF78: =RC[-29] -> 24 | AG78: =RC[-29] ->  | AH78: =RC[-29] ->  | AI78: =RC[-29] ->  | AJ78: =RC[-29] ->  | AK78: =RC[-29] ->  | AL78: =RC[-29] ->  | AM78: =RC[-29] -> #VALUE! | AN78: =RC[-29] ->  | AO78: =RC[-29] ->  | AP78: =RC[-29] ->  | AQ78: =RC[-29] ->  | AR78: - | AS78: =RC[-30] ->  | AT78: =RC[-30] ->  | AU78: - | AV78: =RC[-31] -> #VALUE! | AW78: =RC[-31] ->  | AX78: =RC[-31] ->  | AY78: =RC[-31] -> #VALUE!
A79: =IF(RC[1]="","",DATEVALUE(RC[1])) ->  | C79: 24 | J79: =RC[-5]-RC[-2] -> #VALUE! | Q79: =RC[-3]-RC[-1] -> #VALUE! | T79: =RC[-8]+RC[-1] -> #VALUE! | U79: =(RC[-17]*RC[-16]-RC[-14]*RC[-13])/1000 -> #VALUE! | V79: =RC[-11]/RC[-15]*100 -> #VALUE! | X79: =RC[-2]*RC[-10]/1000 -> #VALUE! | Y79: =(RC[-3]*RC[-11]-RC[-2]*RC[-9])/1000 -> #VALUE! | AD79: =VALUE(RC[-28]) -> #VALUE! | AE79: =IF(RC[22]=42,"*",IF(RC[22]=32,"",RC[22])) ->  | AF79: =RC[-29] -> 24 | AG79: =RC[-29] ->  | AH79: =RC[-29] ->  | AI79: =RC[-29] ->  | AJ79: =RC[-29] ->  | AK79: =RC[-29] ->  | AL79: =RC[-29] ->  | AM79: =RC[-29] -> #VALUE! | AN79: =RC[-29] ->  | AO79: =RC[-29] ->  | AP79: =RC[-29] ->  | AQ79: =RC[-29] ->  | AR79: - | AS79: =RC[-30] ->  | AT79: =RC[-30] ->  | AU79: - | AV79: =RC[-31] -> #VALUE! | AW79: =RC[-31] ->  | AX79: =RC[-31] ->  | AY79: =RC[-31] -> #VALUE!
A80: =IF(RC[1]="","",DATEVALUE(RC[1])) ->  | C80: 24 | J80: =RC[-5]-RC[-2] -> #VALUE! | Q80: =RC[-3]-RC[-1] -> #VALUE! | T80: =RC[-8]+RC[-1] -> #VALUE! | U80: =(RC[-17]*RC[-16]-RC[-14]*RC[-13])/1000 -> #VALUE! | V80: =RC[-11]/RC[-15]*100 -> #VALUE! | X80: =RC[-2]*RC[-10]/1000 -> #VALUE! | Y80: =(RC[-3]*RC[-11]-RC[-2]*RC[-9])/1000 -> #VALUE! | AD80: =VALUE(RC[-28]) -> #VALUE! | AE80: =IF(RC[22]=42,"*",IF(RC[22]=32,"",RC[22])) ->  | AF80: =RC[-29] -> 24 | AG80: =RC[-29] ->  | AH80: =RC[-29] ->  | AI80: =RC[-29] ->  | AJ80: =RC[-29] ->  | AK80: =RC[-29] ->  | AL80: =RC[-29] ->  | AM80: =RC[-29] -> #VALUE! | AN80: =RC[-29] ->  | AO80: =RC[-29] ->  | AP80: =RC[-29] ->  | AQ80: =RC[-29] ->  | AR80: - | AS80: =RC[-30] ->  | AT80: =RC[-30] ->  | AU80: - | AV80: =RC[-31] -> #VALUE! | AW80: =RC[-31] ->  | AX80: =RC[-31] ->  | AY80: =RC[-31] -> #VALUE!
A81: =IF(RC[1]="","",DATEVALUE(RC[1])) ->  | C81: 24 | J81: =RC[-5]-RC[-2] -> #VALUE! | Q81: =RC[-3]-RC[-1] -> #VALUE! | T81: =RC[-8]+RC[-1] -> #VALUE! | U81: =(RC[-17]*RC[-16]-RC[-14]*RC[-13])/1000 -> #VALUE! | V81: =RC[-11]/RC[-15]*100 -> #VALUE! | X81: =RC[-2]*RC[-10]/1000 -> #VALUE! | Y81: =(RC[-3]*RC[-11]-RC[-2]*RC[-9])/1000 -> #VALUE! | AD81: =VALUE(RC[-28]) -> #VALUE! | AE81: =IF(RC[22]=42,"*",IF(RC[22]=32,"",RC[22])) ->  | AF81: =RC[-29] -> 24 | AG81: =RC[-29] ->  | AH81: =RC[-29] ->  | AI81: =RC[-29] ->  | AJ81: =RC[-29] ->  | AK81: =RC[-29] ->  | AL81: =RC[-29] ->  | AM81: =RC[-29] -> #VALUE! | AN81: =RC[-29] ->  | AO81: =RC[-29] ->  | AP81: =RC[-29] ->  | AQ81: =RC[-29] ->  | AR81: - | AS81: =RC[-30] ->  | AT81: =RC[-30] ->  | AU81: - | AV81: =RC[-31] -> #VALUE! | AW81: =RC[-31] ->  | AX81: =RC[-31] ->  | AY81: =RC[-31] -> #VALUE!
A82: =IF(RC[1]="","",DATEVALUE(RC[1])) ->  | C82: 24 | J82: =RC[-5]-RC[-2] -> #VALUE! | Q82: =RC[-3]-RC[-1] -> #VALUE! | T82: =RC[-8]+RC[-1] -> #VALUE! | U82: =(RC[-17]*RC[-16]-RC[-14]*RC[-13])/1000 -> #VALUE! | V82: =RC[-11]/RC[-15]*100 -> #VALUE! | X82: =RC[-2]*RC[-10]/1000 -> #VALUE! | Y82: =(RC[-3]*RC[-11]-RC[-2]*RC[-9])/1000 -> #VALUE! | AD82: =VALUE(RC[-28]) -> #VALUE! | AE82: =IF(RC[22]=42,"*",IF(RC[22]=32,"",RC[22])) ->  | AF82: =RC[-29] -> 24 | AG82: =RC[-29] ->  | AH82: =RC[-29] ->  | AI82: =RC[-29] ->  | AJ82: =RC[-29] ->  | AK82: =RC[-29] ->  | AL82: =RC[-29] ->  | AM82: =RC[-29] -> #VALUE! | AN82: =RC[-29] ->  | AO82: =RC[-29] ->  | AP82: =RC[-29] ->  | AQ82: =RC[-29] ->  | AR82: - | AS82: =RC[-30] ->  | AT82: =RC[-30] ->  | AU82: - | AV82: =RC[-31] -> #VALUE! | AW82: =RC[-31] ->  | AX82: =RC[-31] ->  | AY82: =RC[-31] -> #VALUE!
A83: =IF(RC[1]="","",DATEVALUE(RC[1])) ->  | C83: 24 | J83: =RC[-5]-RC[-2] -> #VALUE! | Q83: =RC[-3]-RC[-1] -> #VALUE! | T83: =RC[-8]+RC[-1] -> #VALUE! | U83: =(RC[-17]*RC[-16]-RC[-14]*RC[-13])/1000 -> #VALUE! | V83: =RC[-11]/RC[-15]*100 -> #VALUE! | X83: =RC[-2]*RC[-10]/1000 -> #VALUE! | Y83: =(RC[-3]*RC[-11]-RC[-2]*RC[-9])/1000 -> #VALUE! | AD83: =VALUE(RC[-28]) -> #VALUE! | AE83: =IF(RC[22]=42,"*",IF(RC[22]=32,"",RC[22])) ->  | AF83: =RC[-29] -> 24 | AG83: =RC[-29] ->  | AH83: =RC[-29] ->  | AI83: =RC[-29] ->  | AJ83: =RC[-29] ->  | AK83: =RC[-29] ->  | AL83: =RC[-29] ->  | AM83: =RC[-29] -> #VALUE! | AN83: =RC[-29] ->  | AO83: =RC[-29] ->  | AP83: =RC[-29] ->  | AQ83: =RC[-29] ->  | AR83: - | AS83: =RC[-30] ->  | AT83: =RC[-30] ->  | AU83: - | AV83: =RC[-31] -> #VALUE! | AW83: =RC[-31] ->  | AX83: =RC[-31] ->  | AY83: =RC[-31] -> #VALUE!
AD84: Среднее | AG84: =R[1]C[-29] -> 147.42588888888889 | AH84: =R[1]C[-29] -> 50.159666666666674 | AI84: =R[1]C[-29] -> 7.53 | AJ84: =R[1]C[-29] -> 146.23277777777778 | AK84: =R[1]C[-29] -> 37.760777777777783 | AL84: =R[1]C[-29] -> 5.4300000000000042 | AM84: =R[1]C[-29] -> 12.398888888888891 | AN84: =R[1]C[-29] -> 1.193111111111111 | AP84: =R[1]C[-29] -> 33.910666666666664 | AQ84: =R[1]C[-29] -> 64.907999999999987 | AS84: =R[1]C[-30] -> 0 | AT84: =R[1]C[-30] -> 26.438999999999997 | AU84: - | AV84: =R[1]C[-31] -> 38.468999999999994
B85: Среднее | D85: =AVERAGE(OFFSET(R[-74]C,3,0,R7C1,1)) -> 147.42588888888889 | E85: =IF(SUM(OFFSET(R[-74]C,3,0,R7C1,1))=0,0,AVERAGE(OFFSET(R[-74]C,3,0,R7C1,1))) -> 50.159666666666674 | F85: =IF(SUM(OFFSET(R[-74]C,3,0,R7C1,1))=0,0,AVERAGE(OFFSET(R[-74]C,3,0,R7C1,1))) -> 7.53 | G85: =AVERAGE(OFFSET(R[-74]C,3,0,R7C1,1)) -> 146.23277777777778 | H85: =IF(SUM(OFFSET(R[-74]C,3,0,R7C1,1))=0,0,AVERAGE(OFFSET(R[-74]C,3,0,R7C1,1))) -> 37.760777777777783 | I85: =IF(SUM(OFFSET(R[-74]C,3,0,R7C1,1))=0,0,AVERAGE(OFFSET(R[-74]C,3,0,R7C1,1))) -> 5.4300000000000042 | J85: =RC[-5]-RC[-2] -> 12.398888888888891 | K85: =AVERAGE(OFFSET(R[-74]C,3,0,R7C1,1)) -> 1.193111111111111 | L85: =AVERAGE(OFFSET(R[-74]C,3,0,R7C1,1)) -> 2.0672000000000001 | M85: =AVERAGE(OFFSET(R[-74]C,3,0,R7C1,1)) -> 33.910666666666664 | N85: =IF(SUM(OFFSET(R[-74]C,3,0,R7C1,1))=0,0,AVERAGE(OFFSET(R[-74]C,3,0,R7C1,1))) -> 64.907999999999987 | O85: =AVERAGE(OFFSET(R[-74]C,3,0,R7C1,1)) -> 0 | P85: =IF(SUM(OFFSET(R[-74]C,3,0,R7C1,1))=0,0,AVERAGE(OFFSET(R[-74]C,3,0,R7C1,1))) -> 26.438999999999997 | Q85: =RC[-3]-RC[-1] -> 38.468999999999994 | R85: =AVERAGE(OFFSET(R[-74]C,3,0,R7C1,1)) -> 33.910666666666664 | S85: =AVERAGE(OFFSET(R[-74]C,3,0,R7C1,1)) -> 2.1582666666666666 | T85: =AVERAGE(OFFSET(R[-74]C,3,0,R7C1,1)) -> 4.2254666666666667 | U85: =AVERAGE(OFFSET(R[-74]C,3,0,R7C1,1)) -> 2.0574196318518521 | X85: =AVERAGE(OFFSET(R[-74]C,3,0,R7C1,1)) -> #DIV/0! | Y85: =AVERAGE(OFFSET(R[-74]C,3,0,R7C1,1)) -> #DIV/0! | AD85: Итого | AF85: =R[1]C[-29] -> 720 | AG85: =R[1]C[-29] -> 4422.7766666666666 | AJ85: =R[1]C[-29] -> 4386.9833333333336 | AN85: =R[1]C[-29] -> 35.793333333333329 | AO85: =R[1]C[-29] -> 62.015999999999998 | AP85: =R[1]C[-29] -> 1017.3199999999999 | AS85: =R[1]C[-30] -> 0 | AW85: =R[1]C[-31] -> 1017.3199999999999 | AX85: =R[1]C[-31] -> 64.74799999999999 | AY85: =R[1]C[-31] -> 126.76400000000001
B86: ИТОГО: | C86: =SUM(OFFSET(R[-75]C,3,0,R7C1,1)) -> 720 | D86: =SUM(OFFSET(R[-75]C,3,0,R7C1,1)) -> 4422.7766666666666 | G86: =SUM(OFFSET(R[-75]C,3,0,R7C1,1)) -> 4386.9833333333336 | K86: =SUM(OFFSET(R[-75]C,3,0,R7C1,1)) -> 35.793333333333329 | L86: =SUM(OFFSET(R[-75]C,3,0,R7C1,1)) -> 62.015999999999998 | M86: =SUM(OFFSET(R[-75]C,3,0,R7C1,1)) -> 1017.3199999999999 | O86: =SUM(OFFSET(R[-75]C,3,0,R7C1,1)) -> 0 | R86: =SUM(OFFSET(R[-75]C,3,0,R7C1,1)) -> 1017.3199999999999 | S86: =SUM(OFFSET(R[-75]C,3,0,R7C1,1)) -> 64.74799999999999 | T86: =SUM(OFFSET(R[-75]C,3,0,R7C1,1)) -> 126.76400000000001 | U86: =SUM(OFFSET(R[-75]C,3,0,R7C1,1)) -> 61.722588955555565 | X86: =SUM(OFFSET(R[-75]C,3,0,R7C1,1)) -> #DIV/0! | Y86: =SUM(OFFSET(R[-75]C,3,0,R7C1,1)) -> #DIV/0!
AD87: Досчёт по среднему до конца месяца | AG87: =R[1]C[-29] -> 0 | AJ87: =R[1]C[-29] -> 0 | AN87: =R[1]C[-29] -> 0 | AO87: =R[1]C[-29] -> 0 | AP87: =R[1]C[-29] -> 0 | AS87: =R[1]C[-30] -> 0 | AW87: =R[1]C[-31] -> 0 | AX87: =R[1]C[-31] -> 0 | AY87: =R[1]C[-31] -> 0
A88: 11дн=264ч 4дн=96ч | B88: Досчёт до конца м-ца (+) | C88: =R[-82]C[-2]*24 -> 216 | U88: № 44981 | AD88: Снятие досчёта по среднему предыдущего отчёта | AG88: =-R[1]C[-29] -> 0 | AJ88: =-R[1]C[-29] -> 0 | AN88: =-R[1]C[-29] -> 0 | AO88: =-R[1]C[-29] -> 0 | AP88: =-R[1]C[-29] -> 0 | AS88: =-R[1]C[-30] -> 0 | AW88: =-R[1]C[-31] -> 0 | AX88: =-R[1]C[-31] -> 0 | AY88: =-R[1]C[-31] -> 0
A89: 9дн=216ч 7дн=168ч | B89: Вычет с предыдущего (-) | C89: =R[-85]C[-2]*24 -> 192 | AD89: Сумма: | AG89: =R[1]C[-29] -> 4422.7766666666666 | AJ89: =R[1]C[-29] -> 4386.9833333333336 | AN89: =R[1]C[-29] -> 35.793333333333329 | AO89: =R[1]C[-29] -> 62.015999999999998 | AP89: =R[1]C[-29] -> 1017.3199999999999 | AS89: =R[1]C[-30] -> 0 | AW89: =R[1]C[-31] -> 1017.3199999999999 | AX89: =R[1]C[-31] -> 64.74799999999999 | AY89: =R[1]C[-31] -> 126.76400000000001
B90: СУММА: | C90: =R[-4]C+R[-2]C-R[-1]C -> 744 | D90: =R[-4]C+R[-2]C-R[-1]C -> 4422.7766666666666 | G90: =R[-4]C+R[-2]C-R[-1]C -> 4386.9833333333336 | K90: =R[-4]C+R[-2]C-R[-1]C -> 35.793333333333329 | L90: =R[-4]C+R[-2]C-R[-1]C -> 62.015999999999998 | M90: =R[-4]C+R[-2]C-R[-1]C -> 1017.3199999999999 | O90: =R[-4]C+R[-2]C-R[-1]C -> 0 | R90: =R[-4]C+R[-2]C-R[-1]C -> 1017.3199999999999 | S90: =R[-4]C+R[-2]C-R[-1]C -> 64.74799999999999 | T90: =R[-4]C+R[-2]C-R[-1]C -> 126.76400000000001 | AD90: Тхв на источнике | AE90: 0 | AF90: V гвс (м3) | AG90: =R[-1]C[16] -> 1017.3199999999999 | AH90: W гвс (Гкал) | AI90: =RC[-2]*0.06 -> 61.039199999999994 | AJ90: W без гвс (Гкал) | AK90: =R[-1]C[4] -> 62.015999999999998
AD91: =R[-90]C[-17] -> з.н д. №02/147-2783 от 04.10.18 28.09.18г некорректная работа приборов
B93: Дата, время | D93: М1, т | F93: М2, т | H93: М3, т | J93: М4, т | L93: Qо, Гкал | N93: Qг, Гкал | P93: время, час
B94: 23.09.18 02:00 | D94: 158377.21 | F94: 156724.72 | H94: 169483.36 | J94: 169352.31 | L94: 3000.5219999999999 | N94: 2886.9140000000002 | P94: -
B95: 24.10.18 02:00 | D95: 162249.04999999999 | F95: 160417.03 | H95: 176409.48 | J95: 175379.33 | L95: 3040.989 | N95: 2941.0749999999998 | P95: -
B98: Представитель потредителя:_______________________________________________________ В.О. Топорков
I101: Рекомендуемые значения по параметрам теплопотребления (не являются официально утверждёнными)
I102: М, т | J102: V, м3 | K102: Qгвс, Гкал | L102: Qотоп, Гкал | M102: Qо, Гкал
I103: =R[-13]C[6] -> 0 | J103: =RC[-1]/0.98 -> 0 | K103: =R[-13]C[8] -> 64.74799999999999 | L103: =R[-13]C -> 62.015999999999998 | M103: =R[-6]C[2] -> 0
P105: ДЛЯ САМОКОНТРОЛЯ
B106: В строке выбора дат указать период с 16.7.13 по 23.8.13 - жильё | O106: Qo | Q106: Qг
B107: В строке выбора дат указать период с 18.7.13 по 25.8.13 - не жилое | O107: =((R[-21]C[-11]*R[-22]C[-8])-(R[-21]C[-10]*R[-22]C[-7]))/1000 -> 646.75491745740749 | Q107: =IF(R[-22]C[-3]="",R[-21]C[-4]*R[-22]C[-1]/1000,"") ->  | R107: Си4
Q108: =IF(R[-23]C[-3]="","",((R[-22]C[-4]*R[-23]C[-1])-(R[-22]C[-3]*R[-23]C[1]))/1000) -> 26.896923479999995 | R108: Си5