Sheet: Лист1
G1: Отчёт о теплопотреблении за октябрь 2018 | M1: з.н д. №02/147-2783 от 04.10.18 с 26.09.18г по 28.09.18г некорректная работа приборов
A4: =EOMONTH(R[9]C,0)-R[9]C -> 8 | B4: Потребитель: ЗАО "Сити Сервис"
A5: =MAX(R[9]C:R[78]C) -> 2018-10-22T00:00:00.000 | B5: Адрес: г. СПб, Наличная ул., д.49 ИТП 1
A6: =EOMONTH(R[-1]C,0)-R[-1]C -> 9 | B6: Телефон: 8-911-021-19-79
A7: =R[-2]C-R[6]C -> 30 | B7: Договор 10023-1 (.) 317, 85898
A8: 7 | B8: Тепловычислитель: ВКТ-7 № 54148 | L8: М2 мах= | M8: 223.2 | O8: Мгвс мах= | P8: 57.36
L9: Qотоп мах= | M9: 17.76 | O9: Qгвс мах= | P9: 3.36
B10: Расчётная формула: Q=M1*(h1-hхв)-M2*(h2-hхв)
D12: Учет | L12: Контроль
A13: =R[1]C[1]-1 -> 2018-09-22T00:00:00.000 | B13: Дата | C13: N, ч | D13: M1, т | E13: T1, С | F13: P1, кг/см2 | G13: M2, т | H13: T2, С | I13: P2, кг/см2 | J13: dT, С | K13: M1-М2, т | L13: V3, м3 | M13: T3, С | N13: V4, м3 | O13: =IF(R[-12]C[-14]="м.куб","","T4, С") -> T4, С | P13: dT, С | Q13: V3-V4, м3 | R13: Qгвс, Гкал | S13: Qобщ., Гкал | T13: Q | U13: M3 | V13: M4 | W13: си2 | X13: си3 | Y13: Разб. | Z13: dM2 | AC13: Дата | AD13: НС | AE13: n, ч | AF13: М1, т | AG13: t1, гр. С | AH13: Р1, кгс/см2 | AI13: М2, т | AJ13: t2, гр. С | AK13: Р2, кгс/см2 | AL13: t1-t2, гр. С | AM13: М1-М2, т | AN13: М1гвс, т | AO13: t1гвс, гр. С | AP13: Р1гвс, кгс/см2 | AQ13: М2гвс, т | AR13: t2гвс, гр. С | AS13: Р2гвс, кгс/см2 | AT13: t1гвс-t2гвс | AU13: М1гвс-М2гвс, т | AV13: Wгвс, Гкал | AW13: Wсумм, Гкал | AY13: NS_TV1 | AZ13: НС | BA13: NS_TV2
A14: =IF(RC[1]="","",DATEVALUE(RC[1])) -> 43366 | B14: 23.09.18 | C14: 24 | D14: 45.86 | E14: 66.87 | F14: 5.37 | G14: 47.83 | H14: 68.48 | I14: 5.07 | J14: =RC[-5]-RC[-2] -> -1.6099999999999994 | K14: -1.97 | L14: 25.12 | M14: 61.02 | R14: 1.508 | S14: =RC[-1] -> 1.508 | T14: =(RC[-16]*RC[-15]-RC[-13]*RC[-12])/1000 -> -0.20874019999999974 | U14: 24.7 | V14: - | W14: =RC[-2]*RC[-10]/1000 -> 1.5071939999999999 | X14: =ABS((RC[-3]*RC[-11]-RC[-2]*RC[-9])/1000) -> #VALUE! | Y14: =(RC[-14]-RC[1])/RC[-18]*100 -> -55.759983274095759 | Z14: 24.7 | AC14: =VALUE(RC[-27]) -> 2018-09-23T00:00:00.000 | AD14: =IF(RC[21]=42,"*",IF(RC[21]=32,"",RC[21])) -> - | AE14: =RC[-28] -> 24 | AF14: =RC[-28] -> 45.86 | AG14: =RC[-28] -> 66.87 | AH14: =RC[-28] -> 5.37 | AI14: =RC[-28] -> 47.83 | AJ14: =RC[-28] -> 68.48 | AK14: =RC[-28] -> 5.07 | AL14: =RC[-28] -> -1.6099999999999994 | AM14: =RC[-28] -> -1.97 | AN14: =RC[-28] -> 25.12 | AO14: =RC[-28] -> 61.02 | AP14: - | AQ14: =RC[-29] -> 0 | AR14: =RC[-29] -> 0 | AS14: - | AT14: =RC[-30] -> 0 | AU14: =RC[-30] -> 0 | AV14: =RC[-30] -> 1.508 | AW14: =RC[-30] -> 1.508 | AY14: - | AZ14: - | BA14: -
A15: =IF(RC[1]="","",DATEVALUE(RC[1])) -> 43367 | B15: 24.09.18 | C15: 24 | D15: 126.32 | E15: 69.81 | F15: 6.38 | G15: 113.46 | H15: 69.89 | I15: 5.18 | J15: =RC[-5]-RC[-2] -> -7.9999999999998295E-2 | K15: 12.86 | L15: 22.91 | M15: 64.13 | R15: 1.44 | S15: =RC[-1] -> 1.44 | T15: =(RC[-16]*RC[-15]-RC[-13]*RC[-12])/1000 -> 0.88867979999999991 | U15: 22.49 | V15: - | W15: =RC[-2]*RC[-10]/1000 -> 1.4422836999999997 | X15: =ABS((RC[-3]*RC[-11]-RC[-2]*RC[-9])/1000) -> #VALUE! | Y15: =(RC[-14]-RC[1])/RC[-18]*100 -> -8.4875727128503424 | Z15: 22.49 | AC15: =VALUE(RC[-27]) -> 2018-09-24T00:00:00.000 | AD15: =IF(RC[21]=42,"*",IF(RC[21]=32,"",RC[21])) -> - | AE15: =RC[-28] -> 24 | AF15: =RC[-28] -> 126.32 | AG15: =RC[-28] -> 69.81 | AH15: =RC[-28] -> 6.38 | AI15: =RC[-28] -> 113.46 | AJ15: =RC[-28] -> 69.89 | AK15: =RC[-28] -> 5.18 | AL15: =RC[-28] -> -7.9999999999998295E-2 | AM15: =RC[-28] -> 12.86 | AN15: =RC[-28] -> 22.91 | AO15: =RC[-28] -> 64.13 | AP15: - | AQ15: =RC[-29] -> 0 | AR15: =RC[-29] -> 0 | AS15: - | AT15: =RC[-30] -> 0 | AU15: =RC[-30] -> 0 | AV15: =RC[-30] -> 1.44 | AW15: =RC[-30] -> 1.44 | AY15: - | AZ15: - | BA15: -
A16: =IF(RC[1]="","",DATEVALUE(RC[1])) -> 43368 | B16: 25.09.18 | C16: 24 | D16: 205.11 | E16: 69.040000000000006 | F16: 7.33 | G16: 186.42 | H16: 57.34 | I16: 5.1100000000000003 | J16: =RC[-5]-RC[-2] -> 11.700000000000003 | K16: 18.690000000000001 | L16: 21.4 | M16: 68.8 | R16: 1.44 | S16: 3.4940000000000002 | T16: =(RC[-16]*RC[-15]-RC[-13]*RC[-12])/1000 -> 3.4714716000000028 | U16: 20.93 | V16: - | W16: =RC[-2]*RC[-10]/1000 -> 1.4399839999999999 | X16: =ABS((RC[-3]*RC[-11]-RC[-2]*RC[-9])/1000) -> #VALUE! | Y16: =(RC[-14]-RC[1])/RC[-18]*100 -> -1.2015878124664727 | Z16: 20.93 | AC16: =VALUE(RC[-27]) -> 2018-09-25T00:00:00.000 | AD16: =IF(RC[21]=42,"*",IF(RC[21]=32,"",RC[21])) -> - | AE16: =RC[-28] -> 24 | AF16: =RC[-28] -> 205.11 | AG16: =RC[-28] -> 69.040000000000006 | AH16: =RC[-28] -> 7.33 | AI16: =RC[-28] -> 186.42 | AJ16: =RC[-28] -> 57.34 | AK16: =RC[-28] -> 5.1100000000000003 | AL16: =RC[-28] -> 11.700000000000003 | AM16: =RC[-28] -> 18.690000000000001 | AN16: =RC[-28] -> 21.4 | AO16: =RC[-28] -> 68.8 | AP16: - | AQ16: =RC[-29] -> 0 | AR16: =RC[-29] -> 0 | AS16: - | AT16: =RC[-30] -> 0 | AU16: =RC[-30] -> 0 | AV16: =RC[-30] -> 1.44 | AW16: =RC[-30] -> 3.4940000000000002 | AY16: - | AZ16: - | BA16: -
A17: =IF(RC[1]="","",DATEVALUE(RC[1])) -> 43369 | B17: 26.09.18 | C17: 24 | D17: 183.79999999999998 | E17: 69.166666666666671 | F17: 7.0733333333333333 | G17: 162.38666666666666 | H17: 42.70333333333334 | I17: 5.3999999999999995 | J17: 26.463333333333338 | K17: 21.41333333333333 | L17: 22.27 | M17: 67.87 | R17: 1.48 | S17: =RC[1] -> 5.7783813777777757 | T17: =(RC[-16]*RC[-15]-RC[-13]*RC[-12])/1000 -> 5.7783813777777757 | U17: 21.8 | V17: - | W17: =RC[-2]*RC[-10]/1000 -> 1.4795660000000002 | X17: =ABS((RC[-3]*RC[-11]-RC[-2]*RC[-9])/1000) -> #VALUE! | Y17: =(RC[-14]-RC[1])/RC[-18]*100 -> -0.23811478774940692 | Z17: 21.8 | AC17: =VALUE(RC[-27]) -> 2018-09-26T00:00:00.000 | AD17: =IF(RC[21]=42,"*",IF(RC[21]=32,"",RC[21])) -> - | AE17: =RC[-28] -> 24 | AF17: =RC[-28] -> 183.79999999999998 | AG17: =RC[-28] -> 69.166666666666671 | AH17: =RC[-28] -> 7.0733333333333333 | AI17: =RC[-28] -> 162.38666666666666 | AJ17: =RC[-28] -> 42.70333333333334 | AK17: =RC[-28] -> 5.3999999999999995 | AL17: =RC[-28] -> 26.463333333333338 | AM17: =RC[-28] -> 21.41333333333333 | AN17: =RC[-28] -> 22.27 | AO17: =RC[-28] -> 67.87 | AP17: - | AQ17: =RC[-29] -> 0 | AR17: =RC[-29] -> 0 | AS17: - | AT17: =RC[-30] -> 0 | AU17: =RC[-30] -> 0 | AV17: =RC[-30] -> 1.48 | AW17: =RC[-30] -> 5.7783813777777757 | AY17: - | AZ17: - | BA17: -
A18: =IF(RC[1]="","",DATEVALUE(RC[1])) -> 43370 | B18: 27.09.18 | C18: 24 | D18: 183.79999999999998 | E18: 69.166666666666671 | F18: 7.0733333333333333 | G18: 162.38666666666666 | H18: 42.70333333333334 | I18: 5.3999999999999995 | J18: 26.463333333333338 | K18: 21.41333333333333 | L18: 23.19 | M18: 63.7 | R18: 1.45 | S18: =RC[1] -> 5.7783813777777757 | T18: =(RC[-16]*RC[-15]-RC[-13]*RC[-12])/1000 -> 5.7783813777777757 | U18: 22.78 | V18: - | W18: =RC[-2]*RC[-10]/1000 -> 1.4510860000000003 | X18: =ABS((RC[-3]*RC[-11]-RC[-2]*RC[-9])/1000) -> #VALUE! | Y18: =(RC[-14]-RC[1])/RC[-18]*100 -> -0.84161261187289849 | Z18: 22.78 | AC18: =VALUE(RC[-27]) -> 2018-09-27T00:00:00.000 | AD18: =IF(RC[21]=42,"*",IF(RC[21]=32,"",RC[21])) -> - | AE18: =RC[-28] -> 24 | AF18: =RC[-28] -> 183.79999999999998 | AG18: =RC[-28] -> 69.166666666666671 | AH18: =RC[-28] -> 7.0733333333333333 | AI18: =RC[-28] -> 162.38666666666666 | AJ18: =RC[-28] -> 42.70333333333334 | AK18: =RC[-28] -> 5.3999999999999995 | AL18: =RC[-28] -> 26.463333333333338 | AM18: =RC[-28] -> 21.41333333333333 | AN18: =RC[-28] -> 23.19 | AO18: =RC[-28] -> 63.7 | AP18: - | AQ18: =RC[-29] -> 0 | AR18: =RC[-29] -> 0 | AS18: - | AT18: =RC[-30] -> 0 | AU18: =RC[-30] -> 0 | AV18: =RC[-30] -> 1.45 | AW18: =RC[-30] -> 5.7783813777777757 | AY18: - | AZ18: - | BA18: -
A19: =IF(RC[1]="","",DATEVALUE(RC[1])) -> 43371 | B19: 28.09.18 | C19: 24 | D19: =AVERAGE(R[1]C:R[3]C) -> 183.79999999999998 | E19: =AVERAGE(R[1]C:R[3]C) -> 69.166666666666671 | F19: =AVERAGE(R[1]C:R[3]C) -> 7.0733333333333333 | G19: =AVERAGE(R[1]C:R[3]C) -> 162.38666666666666 | H19: =AVERAGE(R[1]C:R[3]C) -> 42.70333333333334 | I19: =AVERAGE(R[1]C:R[3]C) -> 5.3999999999999995 | J19: =AVERAGE(R[1]C:R[3]C) -> 26.463333333333338 | K19: =AVERAGE(R[1]C:R[3]C) -> 21.41333333333333 | L19: 20.22 | M19: 68.55 | R19: 1.3560000000000001 | S19: =RC[1] -> 5.7783813777777757 | T19: =(RC[-16]*RC[-15]-RC[-13]*RC[-12])/1000 -> 5.7783813777777757 | U19: 19.79 | V19: - | W19: =RC[-2]*RC[-10]/1000 -> 1.3566045 | X19: =ABS((RC[-3]*RC[-11]-RC[-2]*RC[-9])/1000) -> #VALUE! | Y19: =(RC[-14]-RC[1])/RC[-18]*100 -> 0.99967156580999961 | Z19: 19.79 | AC19: =VALUE(RC[-27]) -> 2018-09-28T00:00:00.000 | AD19: =IF(RC[21]=42,"*",IF(RC[21]=32,"",RC[21])) -> - | AE19: =RC[-28] -> 24 | AF19: =RC[-28] -> 183.79999999999998 | AG19: =RC[-28] -> 69.166666666666671 | AH19: =RC[-28] -> 7.0733333333333333 | AI19: =RC[-28] -> 162.38666666666666 | AJ19: =RC[-28] -> 42.70333333333334 | AK19: =RC[-28] -> 5.3999999999999995 | AL19: =RC[-28] -> 26.463333333333338 | AM19: =RC[-28] -> 21.41333333333333 | AN19: =RC[-28] -> 20.22 | AO19: =RC[-28] -> 68.55 | AP19: - | AQ19: =RC[-29] -> 0 | AR19: =RC[-29] -> 0 | AS19: - | AT19: =RC[-30] -> 0 | AU19: =RC[-30] -> 0 | AV19: =RC[-30] -> 1.3560000000000001 | AW19: =RC[-30] -> 5.7783813777777757 | AY19: - | AZ19: - | BA19: -
A20: =IF(RC[1]="","",DATEVALUE(RC[1])) -> 43372 | B20: 29.09.18 | C20: 24 | D20: 185.2 | E20: 68.040000000000006 | F20: 7.09 | G20: 162.46 | H20: 42.03 | I20: 5.4 | J20: =RC[-5]-RC[-2] -> 26.010000000000005 | K20: 22.74 | L20: 24.82 | M20: 67.75 | R20: 1.649 | S20: 5.774 | T20: =(RC[-16]*RC[-15]-RC[-13]*RC[-12])/1000 -> 5.7728141999999991 | U20: 24.31 | V20: - | W20: =RC[-2]*RC[-10]/1000 -> 1.6470024999999999 | X20: =ABS((RC[-3]*RC[-11]-RC[-2]*RC[-9])/1000) -> #VALUE! | Y20: =(RC[-14]-RC[1])/RC[-18]*100 -> -0.96639172719438649 | Z20: 24.31 | AC20: =VALUE(RC[-27]) -> 2018-09-29T00:00:00.000 | AD20: =IF(RC[21]=42,"*",IF(RC[21]=32,"",RC[21])) -> - | AE20: =RC[-28] -> 24 | AF20: =RC[-28] -> 185.2 | AG20: =RC[-28] -> 68.040000000000006 | AH20: =RC[-28] -> 7.09 | AI20: =RC[-28] -> 162.46 | AJ20: =RC[-28] -> 42.03 | AK20: =RC[-28] -> 5.4 | AL20: =RC[-28] -> 26.010000000000005 | AM20: =RC[-28] -> 22.74 | AN20: =RC[-28] -> 24.82 | AO20: =RC[-28] -> 67.75 | AP20: - | AQ20: =RC[-29] -> 0 | AR20: =RC[-29] -> 0 | AS20: - | AT20: =RC[-30] -> 0 | AU20: =RC[-30] -> 0 | AV20: =RC[-30] -> 1.649 | AW20: =RC[-30] -> 5.774 | AY20: - | AZ20: - | BA20: -
A21: =IF(RC[1]="","",DATEVALUE(RC[1])) -> 43373 | B21: 30.09.18 | C21: 24 | D21: 182.71 | E21: 70.430000000000007 | F21: 7.03 | G21: 161.94999999999999 | H21: 42.95 | I21: 5.37 | J21: =RC[-5]-RC[-2] -> 27.480000000000004 | K21: 20.76 | L21: 23.1 | M21: 70.59 | R21: 1.5980000000000001 | S21: 5.9109999999999996 | T21: =(RC[-16]*RC[-15]-RC[-13]*RC[-12])/1000 -> 5.9125128000000009 | U21: 22.58 | V21: - | W21: =RC[-2]*RC[-10]/1000 -> 1.5939222 | X21: =ABS((RC[-3]*RC[-11]-RC[-2]*RC[-9])/1000) -> #VALUE! | Y21: =(RC[-14]-RC[1])/RC[-18]*100 -> -1.12380364309972 | Z21: 22.58 | AC21: =VALUE(RC[-27]) -> 2018-09-30T00:00:00.000 | AD21: =IF(RC[21]=42,"*",IF(RC[21]=32,"",RC[21])) -> - | AE21: =RC[-28] -> 24 | AF21: =RC[-28] -> 182.71 | AG21: =RC[-28] -> 70.430000000000007 | AH21: =RC[-28] -> 7.03 | AI21: =RC[-28] -> 161.94999999999999 | AJ21: =RC[-28] -> 42.95 | AK21: =RC[-28] -> 5.37 | AL21: =RC[-28] -> 27.480000000000004 | AM21: =RC[-28] -> 20.76 | AN21: =RC[-28] -> 23.1 | AO21: =RC[-28] -> 70.59 | AP21: - | AQ21: =RC[-29] -> 0 | AR21: =RC[-29] -> 0 | AS21: - | AT21: =RC[-30] -> 0 | AU21: =RC[-30] -> 0 | AV21: =RC[-30] -> 1.5980000000000001 | AW21: =RC[-30] -> 5.9109999999999996 | AY21: - | AZ21: - | BA21: -
A22: =IF(RC[1]="","",DATEVALUE(RC[1])) -> 43374 | B22: 01.10.18 | C22: 24 | D22: 183.49 | E22: 69.03 | F22: 7.1 | G22: 162.75 | H22: 43.13 | I22: 5.43 | J22: =RC[-5]-RC[-2] -> 25.9 | K22: 20.74 | L22: 23.11 | M22: 68.78 | R22: 1.5580000000000001 | S22: 5.6470000000000002 | T22: =(RC[-16]*RC[-15]-RC[-13]*RC[-12])/1000 -> 5.6469072000000002 | U22: 22.63 | V22: - | W22: =RC[-2]*RC[-10]/1000 -> 1.5564913999999999 | X22: =ABS((RC[-3]*RC[-11]-RC[-2]*RC[-9])/1000) -> #VALUE! | Y22: =(RC[-14]-RC[1])/RC[-18]*100 -> -1.1612903225806457 | Z22: 22.63 | AC22: =VALUE(RC[-27]) -> 2018-10-01T00:00:00.000 | AD22: =IF(RC[21]=42,"*",IF(RC[21]=32,"",RC[21])) -> - | AE22: =RC[-28] -> 24 | AF22: =RC[-28] -> 183.49 | AG22: =RC[-28] -> 69.03 | AH22: =RC[-28] -> 7.1 | AI22: =RC[-28] -> 162.75 | AJ22: =RC[-28] -> 43.13 | AK22: =RC[-28] -> 5.43 | AL22: =RC[-28] -> 25.9 | AM22: =RC[-28] -> 20.74 | AN22: =RC[-28] -> 23.11 | AO22: =RC[-28] -> 68.78 | AP22: - | AQ22: =RC[-29] -> 0 | AR22: =RC[-29] -> 0 | AS22: - | AT22: =RC[-30] -> 0 | AU22: =RC[-30] -> 0 | AV22: =RC[-30] -> 1.5580000000000001 | AW22: =RC[-30] -> 5.6470000000000002 | AY22: - | AZ22: - | BA22: -
A23: =IF(RC[1]="","",DATEVALUE(RC[1])) -> 43375 | B23: 02.10.18 | C23: 24 | D23: 175.08 | E23: 67.8 | F23: 6.96 | G23: 155.78 | H23: 42.17 | I23: 5.43 | J23: =RC[-5]-RC[-2] -> 25.629999999999995 | K23: 19.3 | L23: 21.49 | M23: 67.7 | R23: 1.4239999999999999 | S23: 5.3019999999999996 | T23: =(RC[-16]*RC[-15]-RC[-13]*RC[-12])/1000 -> 5.3011814000000008 | U23: 21.05 | V23: - | W23: =RC[-2]*RC[-10]/1000 -> 1.4250849999999999 | X23: =ABS((RC[-3]*RC[-11]-RC[-2]*RC[-9])/1000) -> #VALUE! | Y23: =(RC[-14]-RC[1])/RC[-18]*100 -> -1.1233791244062139 | Z23: 21.05 | AC23: =VALUE(RC[-27]) -> 2018-10-02T00:00:00.000 | AD23: =IF(RC[21]=42,"*",IF(RC[21]=32,"",RC[21])) -> - | AE23: =RC[-28] -> 24 | AF23: =RC[-28] -> 175.08 | AG23: =RC[-28] -> 67.8 | AH23: =RC[-28] -> 6.96 | AI23: =RC[-28] -> 155.78 | AJ23: =RC[-28] -> 42.17 | AK23: =RC[-28] -> 5.43 | AL23: =RC[-28] -> 25.629999999999995 | AM23: =RC[-28] -> 19.3 | AN23: =RC[-28] -> 21.49 | AO23: =RC[-28] -> 67.7 | AP23: - | AQ23: =RC[-29] -> 0 | AR23: =RC[-29] -> 0 | AS23: - | AT23: =RC[-30] -> 0 | AU23: =RC[-30] -> 0 | AV23: =RC[-30] -> 1.4239999999999999 | AW23: =RC[-30] -> 5.3019999999999996 | AY23: - | AZ23: - | BA23: -
A24: =IF(RC[1]="","",DATEVALUE(RC[1])) -> 43376 | B24: 03.10.18 | C24: 24 | D24: 171.59 | E24: 67.94 | F24: 6.96 | G24: 150.66999999999999 | H24: 41.72 | I24: 5.53 | J24: =RC[-5]-RC[-2] -> 26.22 | K24: 20.92 | L24: 22.95 | M24: 67.930000000000007 | R24: 1.526 | S24: 5.3730000000000002 | T24: =(RC[-16]*RC[-15]-RC[-13]*RC[-12])/1000 -> 5.3718722000000003 | U24: 22.46 | V24: - | W24: =RC[-2]*RC[-10]/1000 -> 1.5257078000000002 | X24: =ABS((RC[-3]*RC[-11]-RC[-2]*RC[-9])/1000) -> #VALUE! | Y24: =(RC[-14]-RC[1])/RC[-18]*100 -> -1.0221012809451113 | Z24: 22.46 | AC24: =VALUE(RC[-27]) -> 2018-10-03T00:00:00.000 | AD24: =IF(RC[21]=42,"*",IF(RC[21]=32,"",RC[21])) -> - | AE24: =RC[-28] -> 24 | AF24: =RC[-28] -> 171.59 | AG24: =RC[-28] -> 67.94 | AH24: =RC[-28] -> 6.96 | AI24: =RC[-28] -> 150.66999999999999 | AJ24: =RC[-28] -> 41.72 | AK24: =RC[-28] -> 5.53 | AL24: =RC[-28] -> 26.22 | AM24: =RC[-28] -> 20.92 | AN24: =RC[-28] -> 22.95 | AO24: =RC[-28] -> 67.930000000000007 | AP24: - | AQ24: =RC[-29] -> 0 | AR24: =RC[-29] -> 0 | AS24: - | AT24: =RC[-30] -> 0 | AU24: =RC[-30] -> 0 | AV24: =RC[-30] -> 1.526 | AW24: =RC[-30] -> 5.3730000000000002 | AY24: - | AZ24: - | BA24: -
A25: =IF(RC[1]="","",DATEVALUE(RC[1])) -> 43377 | B25: 04.10.18 | C25: 24 | D25: 162.63 | E25: 67.290000000000006 | F25: 6.89 | G25: 142.53 | H25: 40.450000000000003 | I25: 5.62 | J25: =RC[-5]-RC[-2] -> 26.840000000000003 | K25: 20.100000000000001 | L25: 22.14 | M25: 67.22 | R25: 1.4590000000000001 | S25: 5.1779999999999999 | T25: =(RC[-16]*RC[-15]-RC[-13]*RC[-12])/1000 -> 5.178034199999999 | U25: 21.68 | V25: - | W25: =RC[-2]*RC[-10]/1000 -> 1.4573296 | X25: =ABS((RC[-3]*RC[-11]-RC[-2]*RC[-9])/1000) -> #VALUE! | Y25: =(RC[-14]-RC[1])/RC[-18]*100 -> -1.1085385532870262 | Z25: 21.68 | AC25: =VALUE(RC[-27]) -> 2018-10-04T00:00:00.000 | AD25: =IF(RC[21]=42,"*",IF(RC[21]=32,"",RC[21])) -> - | AE25: =RC[-28] -> 24 | AF25: =RC[-28] -> 162.63 | AG25: =RC[-28] -> 67.290000000000006 | AH25: =RC[-28] -> 6.89 | AI25: =RC[-28] -> 142.53 | AJ25: =RC[-28] -> 40.450000000000003 | AK25: =RC[-28] -> 5.62 | AL25: =RC[-28] -> 26.840000000000003 | AM25: =RC[-28] -> 20.100000000000001 | AN25: =RC[-28] -> 22.14 | AO25: =RC[-28] -> 67.22 | AP25: - | AQ25: =RC[-29] -> 0 | AR25: =RC[-29] -> 0 | AS25: - | AT25: =RC[-30] -> 0 | AU25: =RC[-30] -> 0 | AV25: =RC[-30] -> 1.4590000000000001 | AW25: =RC[-30] -> 5.1779999999999999 | AY25: - | AZ25: - | BA25: -
A26: =IF(RC[1]="","",DATEVALUE(RC[1])) -> 43378 | B26: 05.10.18 | C26: 24 | D26: 149.43 | E26: 66.63 | F26: 6.77 | G26: 129.18 | H26: 38.450000000000003 | I26: 5.73 | J26: =RC[-5]-RC[-2] -> 28.179999999999993 | K26: 20.25 | L26: 22.31 | M26: 66.66 | R26: 1.4590000000000001 | S26: 4.9870000000000001 | T26: =(RC[-16]*RC[-15]-RC[-13]*RC[-12])/1000 -> 4.9895498999999992 | U26: 21.89 | V26: - | W26: =RC[-2]*RC[-10]/1000 -> 1.4591874 | X26: =ABS((RC[-3]*RC[-11]-RC[-2]*RC[-9])/1000) -> #VALUE! | Y26: =(RC[-14]-RC[1])/RC[-18]*100 -> -1.2695463694070293 | Z26: 21.89 | AC26: =VALUE(RC[-27]) -> 2018-10-05T00:00:00.000 | AD26: =IF(RC[21]=42,"*",IF(RC[21]=32,"",RC[21])) -> - | AE26: =RC[-28] -> 24 | AF26: =RC[-28] -> 149.43 | AG26: =RC[-28] -> 66.63 | AH26: =RC[-28] -> 6.77 | AI26: =RC[-28] -> 129.18 | AJ26: =RC[-28] -> 38.450000000000003 | AK26: =RC[-28] -> 5.73 | AL26: =RC[-28] -> 28.179999999999993 | AM26: =RC[-28] -> 20.25 | AN26: =RC[-28] -> 22.31 | AO26: =RC[-28] -> 66.66 | AP26: - | AQ26: =RC[-29] -> 0 | AR26: =RC[-29] -> 0 | AS26: - | AT26: =RC[-30] -> 0 | AU26: =RC[-30] -> 0 | AV26: =RC[-30] -> 1.4590000000000001 | AW26: =RC[-30] -> 4.9870000000000001 | AY26: - | AZ26: - | BA26: -
A27: =IF(RC[1]="","",DATEVALUE(RC[1])) -> 43379 | B27: 06.10.18 | C27: 24 | D27: 150.1 | E27: 67.34 | F27: 6.72 | G27: 130.77000000000001 | H27: 39.130000000000003 | I27: 5.65 | J27: =RC[-5]-RC[-2] -> 28.21 | K27: 19.329999999999998 | L27: 21.32 | M27: 67.41 | R27: 1.409 | S27: 4.9880000000000004 | T27: =(RC[-16]*RC[-15]-RC[-13]*RC[-12])/1000 -> 4.9907038999999997 | U27: 20.91 | V27: - | W27: =RC[-2]*RC[-10]/1000 -> 1.4095430999999998 | X27: =ABS((RC[-3]*RC[-11]-RC[-2]*RC[-9])/1000) -> #VALUE! | Y27: =(RC[-14]-RC[1])/RC[-18]*100 -> -1.2082281868930196 | Z27: 20.91 | AC27: =VALUE(RC[-27]) -> 2018-10-06T00:00:00.000 | AD27: =IF(RC[21]=42,"*",IF(RC[21]=32,"",RC[21])) -> - | AE27: =RC[-28] -> 24 | AF27: =RC[-28] -> 150.1 | AG27: =RC[-28] -> 67.34 | AH27: =RC[-28] -> 6.72 | AI27: =RC[-28] -> 130.77000000000001 | AJ27: =RC[-28] -> 39.130000000000003 | AK27: =RC[-28] -> 5.65 | AL27: =RC[-28] -> 28.21 | AM27: =RC[-28] -> 19.329999999999998 | AN27: =RC[-28] -> 21.32 | AO27: =RC[-28] -> 67.41 | AP27: - | AQ27: =RC[-29] -> 0 | AR27: =RC[-29] -> 0 | AS27: - | AT27: =RC[-30] -> 0 | AU27: =RC[-30] -> 0 | AV27: =RC[-30] -> 1.409 | AW27: =RC[-30] -> 4.9880000000000004 | AY27: - | AZ27: - | BA27: -
A28: =IF(RC[1]="","",DATEVALUE(RC[1])) -> 43380 | B28: 07.10.18 | C28: 24 | D28: 151.94999999999999 | E28: 67.569999999999993 | F28: 6.71 | G28: 128.81 | H28: 39.1 | I28: 5.67 | J28: =RC[-5]-RC[-2] -> 28.469999999999992 | K28: 23.14 | L28: 25.28 | M28: 67.599999999999994 | R28: 1.675 | S28: 5.226 | T28: =(RC[-16]*RC[-15]-RC[-13]*RC[-12])/1000 -> 5.2307904999999986 | U28: 24.77 | V28: - | W28: =RC[-2]*RC[-10]/1000 -> 1.6744519999999998 | X28: =ABS((RC[-3]*RC[-11]-RC[-2]*RC[-9])/1000) -> #VALUE! | Y28: =(RC[-14]-RC[1])/RC[-18]*100 -> -1.2654297026628358 | Z28: 24.77 | AC28: =VALUE(RC[-27]) -> 2018-10-07T00:00:00.000 | AD28: =IF(RC[21]=42,"*",IF(RC[21]=32,"",RC[21])) -> - | AE28: =RC[-28] -> 24 | AF28: =RC[-28] -> 151.94999999999999 | AG28: =RC[-28] -> 67.569999999999993 | AH28: =RC[-28] -> 6.71 | AI28: =RC[-28] -> 128.81 | AJ28: =RC[-28] -> 39.1 | AK28: =RC[-28] -> 5.67 | AL28: =RC[-28] -> 28.469999999999992 | AM28: =RC[-28] -> 23.14 | AN28: =RC[-28] -> 25.28 | AO28: =RC[-28] -> 67.599999999999994 | AP28: - | AQ28: =RC[-29] -> 0 | AR28: =RC[-29] -> 0 | AS28: - | AT28: =RC[-30] -> 0 | AU28: =RC[-30] -> 0 | AV28: =RC[-30] -> 1.675 | AW28: =RC[-30] -> 5.226 | AY28: - | AZ28: - | BA28: -
A29: =IF(RC[1]="","",DATEVALUE(RC[1])) -> 43381 | B29: 08.10.18 | C29: 24 | D29: 149.41 | E29: 67.56 | F29: 6.67 | G29: 127.58 | H29: 38.409999999999997 | I29: 5.67 | J29: =RC[-5]-RC[-2] -> 29.150000000000006 | K29: 21.83 | L29: 23.94 | M29: 67.58 | R29: 1.585 | S29: 5.19 | T29: =(RC[-16]*RC[-15]-RC[-13]*RC[-12])/1000 -> 5.1937918000000005 | U29: 23.45 | V29: - | W29: =RC[-2]*RC[-10]/1000 -> 1.584751 | X29: =ABS((RC[-3]*RC[-11]-RC[-2]*RC[-9])/1000) -> #VALUE! | Y29: =(RC[-14]-RC[1])/RC[-18]*100 -> -1.269791503370435 | Z29: 23.45 | AC29: =VALUE(RC[-27]) -> 2018-10-08T00:00:00.000 | AD29: =IF(RC[21]=42,"*",IF(RC[21]=32,"",RC[21])) -> - | AE29: =RC[-28] -> 24 | AF29: =RC[-28] -> 149.41 | AG29: =RC[-28] -> 67.56 | AH29: =RC[-28] -> 6.67 | AI29: =RC[-28] -> 127.58 | AJ29: =RC[-28] -> 38.409999999999997 | AK29: =RC[-28] -> 5.67 | AL29: =RC[-28] -> 29.150000000000006 | AM29: =RC[-28] -> 21.83 | AN29: =RC[-28] -> 23.94 | AO29: =RC[-28] -> 67.58 | AP29: - | AQ29: =RC[-29] -> 0 | AR29: =RC[-29] -> 0 | AS29: - | AT29: =RC[-30] -> 0 | AU29: =RC[-30] -> 0 | AV29: =RC[-30] -> 1.585 | AW29: =RC[-30] -> 5.19 | AY29: - | AZ29: - | BA29: -
A30: =IF(RC[1]="","",DATEVALUE(RC[1])) -> 43382 | B30: 09.10.18 | C30: 24 | D30: 152.12 | E30: 67.430000000000007 | F30: 6.82 | G30: 133.81 | H30: 39.21 | I30: 5.69 | J30: =RC[-5]-RC[-2] -> 28.220000000000006 | K30: 18.309999999999999 | L30: 20.37 | M30: 67.489999999999995 | R30: 1.3460000000000001 | S30: 5.0090000000000003 | T30: =(RC[-16]*RC[-15]-RC[-13]*RC[-12])/1000 -> 5.0107615000000028 | U30: 19.96 | V30: - | W30: =RC[-2]*RC[-10]/1000 -> 1.3471004 | X30: =ABS((RC[-3]*RC[-11]-RC[-2]*RC[-9])/1000) -> #VALUE! | Y30: =(RC[-14]-RC[1])/RC[-18]*100 -> -1.2330916971825738 | Z30: 19.96 | AC30: =VALUE(RC[-27]) -> 2018-10-09T00:00:00.000 | AD30: =IF(RC[21]=42,"*",IF(RC[21]=32,"",RC[21])) -> - | AE30: =RC[-28] -> 24 | AF30: =RC[-28] -> 152.12 | AG30: =RC[-28] -> 67.430000000000007 | AH30: =RC[-28] -> 6.82 | AI30: =RC[-28] -> 133.81 | AJ30: =RC[-28] -> 39.21 | AK30: =RC[-28] -> 5.69 | AL30: =RC[-28] -> 28.220000000000006 | AM30: =RC[-28] -> 18.309999999999999 | AN30: =RC[-28] -> 20.37 | AO30: =RC[-28] -> 67.489999999999995 | AP30: - | AQ30: =RC[-29] -> 0 | AR30: =RC[-29] -> 0 | AS30: - | AT30: =RC[-30] -> 0 | AU30: =RC[-30] -> 0 | AV30: =RC[-30] -> 1.3460000000000001 | AW30: =RC[-30] -> 5.0090000000000003 | AY30: - | AZ30: - | BA30: -
A31: =IF(RC[1]="","",DATEVALUE(RC[1])) -> 43383 | B31: 10.10.18 | C31: 24 | D31: 152.6 | E31: 68.510000000000005 | F31: 6.73 | G31: 133.85 | H31: 40 | I31: 5.62 | J31: =RC[-5]-RC[-2] -> 28.510000000000005 | K31: 18.75 | L31: 20.82 | M31: 68.66 | R31: 1.4019999999999999 | S31: 5.0990000000000002 | T31: =(RC[-16]*RC[-15]-RC[-13]*RC[-12])/1000 -> 5.1006260000000001 | U31: 20.39 | V31: - | W31: =RC[-2]*RC[-10]/1000 -> 1.3999774 | X31: =ABS((RC[-3]*RC[-11]-RC[-2]*RC[-9])/1000) -> #VALUE! | Y31: =(RC[-14]-RC[1])/RC[-18]*100 -> -1.2252521479267842 | Z31: 20.39 | AC31: =VALUE(RC[-27]) -> 2018-10-10T00:00:00.000 | AD31: =IF(RC[21]=42,"*",IF(RC[21]=32,"",RC[21])) -> - | AE31: =RC[-28] -> 24 | AF31: =RC[-28] -> 152.6 | AG31: =RC[-28] -> 68.510000000000005 | AH31: =RC[-28] -> 6.73 | AI31: =RC[-28] -> 133.85 | AJ31: =RC[-28] -> 40 | AK31: =RC[-28] -> 5.62 | AL31: =RC[-28] -> 28.510000000000005 | AM31: =RC[-28] -> 18.75 | AN31: =RC[-28] -> 20.82 | AO31: =RC[-28] -> 68.66 | AP31: - | AQ31: =RC[-29] -> 0 | AR31: =RC[-29] -> 0 | AS31: - | AT31: =RC[-30] -> 0 | AU31: =RC[-30] -> 0 | AV31: =RC[-30] -> 1.4019999999999999 | AW31: =RC[-30] -> 5.0990000000000002 | AY31: - | AZ31: - | BA31: -
A32: =IF(RC[1]="","",DATEVALUE(RC[1])) -> 43384 | B32: 11.10.18 | C32: 24 | D32: 156.63999999999999 | E32: 69.599999999999994 | F32: 6.7 | G32: 137.91 | H32: 40.94 | I32: 5.52 | J32: =RC[-5]-RC[-2] -> 28.659999999999997 | K32: 18.73 | L32: 20.89 | M32: 69.540000000000006 | R32: 1.421 | S32: 5.2549999999999999 | T32: =(RC[-16]*RC[-15]-RC[-13]*RC[-12])/1000 -> 5.2561085999999984 | U32: 20.440000000000001 | V32: - | W32: =RC[-2]*RC[-10]/1000 -> 1.4213976000000001 | X32: =ABS((RC[-3]*RC[-11]-RC[-2]*RC[-9])/1000) -> #VALUE! | Y32: =(RC[-14]-RC[1])/RC[-18]*100 -> -1.2399390907113341 | Z32: 20.440000000000001 | AC32: =VALUE(RC[-27]) -> 2018-10-11T00:00:00.000 | AD32: =IF(RC[21]=42,"*",IF(RC[21]=32,"",RC[21])) -> - | AE32: =RC[-28] -> 24 | AF32: =RC[-28] -> 156.63999999999999 | AG32: =RC[-28] -> 69.599999999999994 | AH32: =RC[-28] -> 6.7 | AI32: =RC[-28] -> 137.91 | AJ32: =RC[-28] -> 40.94 | AK32: =RC[-28] -> 5.52 | AL32: =RC[-28] -> 28.659999999999997 | AM32: =RC[-28] -> 18.73 | AN32: =RC[-28] -> 20.89 | AO32: =RC[-28] -> 69.540000000000006 | AP32: - | AQ32: =RC[-29] -> 0 | AR32: =RC[-29] -> 0 | AS32: - | AT32: =RC[-30] -> 0 | AU32: =RC[-30] -> 0 | AV32: =RC[-30] -> 1.421 | AW32: =RC[-30] -> 5.2549999999999999 | AY32: - | AZ32: - | BA32: -
A33: =IF(RC[1]="","",DATEVALUE(RC[1])) -> 43385 | B33: 12.10.18 | C33: 24 | D33: 154.91999999999999 | E33: 69.44 | F33: 6.71 | G33: 136 | H33: 40.630000000000003 | I33: 5.58 | J33: =RC[-5]-RC[-2] -> 28.809999999999995 | K33: 18.920000000000002 | L33: 21.11 | M33: 69.41 | R33: 1.4339999999999999 | S33: 5.2270000000000003 | T33: =(RC[-16]*RC[-15]-RC[-13]*RC[-12])/1000 -> 5.2319647999999983 | U33: 20.66 | V33: - | W33: =RC[-2]*RC[-10]/1000 -> 1.4340105999999999 | X33: =ABS((RC[-3]*RC[-11]-RC[-2]*RC[-9])/1000) -> #VALUE! | Y33: =(RC[-14]-RC[1])/RC[-18]*100 -> -1.2794117647058811 | Z33: 20.66 | AC33: =VALUE(RC[-27]) -> 2018-10-12T00:00:00.000 | AD33: =IF(RC[21]=42,"*",IF(RC[21]=32,"",RC[21])) -> - | AE33: =RC[-28] -> 24 | AF33: =RC[-28] -> 154.91999999999999 | AG33: =RC[-28] -> 69.44 | AH33: =RC[-28] -> 6.71 | AI33: =RC[-28] -> 136 | AJ33: =RC[-28] -> 40.630000000000003 | AK33: =RC[-28] -> 5.58 | AL33: =RC[-28] -> 28.809999999999995 | AM33: =RC[-28] -> 18.920000000000002 | AN33: =RC[-28] -> 21.11 | AO33: =RC[-28] -> 69.41 | AP33: - | AQ33: =RC[-29] -> 0 | AR33: =RC[-29] -> 0 | AS33: - | AT33: =RC[-30] -> 0 | AU33: =RC[-30] -> 0 | AV33: =RC[-30] -> 1.4339999999999999 | AW33: =RC[-30] -> 5.2270000000000003 | AY33: - | AZ33: - | BA33: -
A34: =IF(RC[1]="","",DATEVALUE(RC[1])) -> 43386 | B34: 13.10.18 | C34: 24 | D34: 161.74 | E34: 70.599999999999994 | F34: 6.83 | G34: 142.4 | H34: 42.01 | I34: 5.56 | J34: =RC[-5]-RC[-2] -> 28.589999999999996 | K34: 19.34 | L34: 21.71 | M34: 70.61 | R34: 1.4990000000000001 | S34: 5.4349999999999996 | T34: =(RC[-16]*RC[-15]-RC[-13]*RC[-12])/1000 -> 5.4366199999999987 | U34: 21.22 | V34: - | W34: =RC[-2]*RC[-10]/1000 -> 1.4983442 | X34: =ABS((RC[-3]*RC[-11]-RC[-2]*RC[-9])/1000) -> #VALUE! | Y34: =(RC[-14]-RC[1])/RC[-18]*100 -> -1.3202247191011227 | Z34: 21.22 | AC34: =VALUE(RC[-27]) -> 2018-10-13T00:00:00.000 | AD34: =IF(RC[21]=42,"*",IF(RC[21]=32,"",RC[21])) -> - | AE34: =RC[-28] -> 24 | AF34: =RC[-28] -> 161.74 | AG34: =RC[-28] -> 70.599999999999994 | AH34: =RC[-28] -> 6.83 | AI34: =RC[-28] -> 142.4 | AJ34: =RC[-28] -> 42.01 | AK34: =RC[-28] -> 5.56 | AL34: =RC[-28] -> 28.589999999999996 | AM34: =RC[-28] -> 19.34 | AN34: =RC[-28] -> 21.71 | AO34: =RC[-28] -> 70.61 | AP34: - | AQ34: =RC[-29] -> 0 | AR34: =RC[-29] -> 0 | AS34: - | AT34: =RC[-30] -> 0 | AU34: =RC[-30] -> 0 | AV34: =RC[-30] -> 1.4990000000000001 | AW34: =RC[-30] -> 5.4349999999999996 | AY34: - | AZ34: - | BA34: -
A35: =IF(RC[1]="","",DATEVALUE(RC[1])) -> 43387 | B35: 14.10.18 | C35: 24 | D35: 164.7 | E35: 71.36 | F35: 6.77 | G35: 144.09 | H35: 43.14 | I35: 5.48 | J35: =RC[-5]-RC[-2] -> 28.22 | K35: 20.61 | L35: 22.96 | M35: 71.48 | R35: 1.6040000000000001 | S35: 5.5359999999999996 | T35: =(RC[-16]*RC[-15]-RC[-13]*RC[-12])/1000 -> 5.5369493999999975 | U35: 22.44 | V35: - | W35: =RC[-2]*RC[-10]/1000 -> 1.6040112000000002 | X35: =ABS((RC[-3]*RC[-11]-RC[-2]*RC[-9])/1000) -> #VALUE! | Y35: =(RC[-14]-RC[1])/RC[-18]*100 -> -1.2700395586092037 | Z35: 22.44 | AC35: =VALUE(RC[-27]) -> 2018-10-14T00:00:00.000 | AD35: =IF(RC[21]=42,"*",IF(RC[21]=32,"",RC[21])) -> - | AE35: =RC[-28] -> 24 | AF35: =RC[-28] -> 164.7 | AG35: =RC[-28] -> 71.36 | AH35: =RC[-28] -> 6.77 | AI35: =RC[-28] -> 144.09 | AJ35: =RC[-28] -> 43.14 | AK35: =RC[-28] -> 5.48 | AL35: =RC[-28] -> 28.22 | AM35: =RC[-28] -> 20.61 | AN35: =RC[-28] -> 22.96 | AO35: =RC[-28] -> 71.48 | AP35: - | AQ35: =RC[-29] -> 0 | AR35: =RC[-29] -> 0 | AS35: - | AT35: =RC[-30] -> 0 | AU35: =RC[-30] -> 0 | AV35: =RC[-30] -> 1.6040000000000001 | AW35: =RC[-30] -> 5.5359999999999996 | AY35: - | AZ35: - | BA35: -
A36: =IF(RC[1]="","",DATEVALUE(RC[1])) -> 43388 | B36: 15.10.18 | C36: 24 | D36: 167.95 | E36: 70.81 | F36: 6.85 | G36: 149.19 | H36: 43.66 | I36: 5.46 | J36: =RC[-5]-RC[-2] -> 27.150000000000006 | K36: 18.760000000000002 | L36: 21.01 | M36: 70.77 | R36: 1.4550000000000001 | S36: 5.3769999999999998 | T36: =(RC[-16]*RC[-15]-RC[-13]*RC[-12])/1000 -> 5.3789040999999997 | U36: 20.55 | V36: - | W36: =RC[-2]*RC[-10]/1000 -> 1.4543234999999999 | X36: =ABS((RC[-3]*RC[-11]-RC[-2]*RC[-9])/1000) -> #VALUE! | Y36: =(RC[-14]-RC[1])/RC[-18]*100 -> -1.1998123198605799 | Z36: 20.55 | AC36: =VALUE(RC[-27]) -> 2018-10-15T00:00:00.000 | AD36: =IF(RC[21]=42,"*",IF(RC[21]=32,"",RC[21])) -> - | AE36: =RC[-28] -> 24 | AF36: =RC[-28] -> 167.95 | AG36: =RC[-28] -> 70.81 | AH36: =RC[-28] -> 6.85 | AI36: =RC[-28] -> 149.19 | AJ36: =RC[-28] -> 43.66 | AK36: =RC[-28] -> 5.46 | AL36: =RC[-28] -> 27.150000000000006 | AM36: =RC[-28] -> 18.760000000000002 | AN36: =RC[-28] -> 21.01 | AO36: =RC[-28] -> 70.77 | AP36: - | AQ36: =RC[-29] -> 0 | AR36: =RC[-29] -> 0 | AS36: - | AT36: =RC[-30] -> 0 | AU36: =RC[-30] -> 0 | AV36: =RC[-30] -> 1.4550000000000001 | AW36: =RC[-30] -> 5.3769999999999998 | AY36: - | AZ36: - | BA36: -
A37: =IF(RC[1]="","",DATEVALUE(RC[1])) -> 43389 | B37: 16.10.18 | C37: 24 | D37: 168.32 | E37: 70.83 | F37: 6.81 | G37: 150 | H37: 43.68 | I37: 5.4 | J37: =RC[-5]-RC[-2] -> 27.15 | K37: 18.32 | L37: 20.6 | M37: 70.790000000000006 | R37: 1.4279999999999999 | S37: 5.3680000000000003 | T37: =(RC[-16]*RC[-15]-RC[-13]*RC[-12])/1000 -> 5.3701055999999987 | U37: 20.16 | V37: - | W37: =RC[-2]*RC[-10]/1000 -> 1.4271264000000001 | X37: =ABS((RC[-3]*RC[-11]-RC[-2]*RC[-9])/1000) -> #VALUE! | Y37: =(RC[-14]-RC[1])/RC[-18]*100 -> -1.2266666666666666 | Z37: 20.16 | AC37: =VALUE(RC[-27]) -> 2018-10-16T00:00:00.000 | AD37: =IF(RC[21]=42,"*",IF(RC[21]=32,"",RC[21])) -> - | AE37: =RC[-28] -> 24 | AF37: =RC[-28] -> 168.32 | AG37: =RC[-28] -> 70.83 | AH37: =RC[-28] -> 6.81 | AI37: =RC[-28] -> 150 | AJ37: =RC[-28] -> 43.68 | AK37: =RC[-28] -> 5.4 | AL37: =RC[-28] -> 27.15 | AM37: =RC[-28] -> 18.32 | AN37: =RC[-28] -> 20.6 | AO37: =RC[-28] -> 70.790000000000006 | AP37: - | AQ37: =RC[-29] -> 0 | AR37: =RC[-29] -> 0 | AS37: - | AT37: =RC[-30] -> 0 | AU37: =RC[-30] -> 0 | AV37: =RC[-30] -> 1.4279999999999999 | AW37: =RC[-30] -> 5.3680000000000003 | AY37: - | AZ37: - | BA37: -
A38: =IF(RC[1]="","",DATEVALUE(RC[1])) -> 43390 | B38: 17.10.18 | C38: 24 | D38: 171.93 | E38: 71.12 | F38: 6.85 | G38: 152.86000000000001 | H38: 44.06 | I38: 5.39 | J38: =RC[-5]-RC[-2] -> 27.060000000000002 | K38: 19.07 | L38: 21.8 | M38: 71.2 | R38: 1.516 | S38: 5.4930000000000003 | T38: =(RC[-16]*RC[-15]-RC[-13]*RC[-12])/1000 -> 5.4926500000000003 | U38: 21.31 | V38: - | W38: =RC[-2]*RC[-10]/1000 -> 1.517272 | X38: =ABS((RC[-3]*RC[-11]-RC[-2]*RC[-9])/1000) -> #VALUE! | Y38: =(RC[-14]-RC[1])/RC[-18]*100 -> -1.4653931702211163 | Z38: 21.31 | AC38: =VALUE(RC[-27]) -> 2018-10-17T00:00:00.000 | AD38: =IF(RC[21]=42,"*",IF(RC[21]=32,"",RC[21])) -> - | AE38: =RC[-28] -> 24 | AF38: =RC[-28] -> 171.93 | AG38: =RC[-28] -> 71.12 | AH38: =RC[-28] -> 6.85 | AI38: =RC[-28] -> 152.86000000000001 | AJ38: =RC[-28] -> 44.06 | AK38: =RC[-28] -> 5.39 | AL38: =RC[-28] -> 27.060000000000002 | AM38: =RC[-28] -> 19.07 | AN38: =RC[-28] -> 21.8 | AO38: =RC[-28] -> 71.2 | AP38: - | AQ38: =RC[-29] -> 0 | AR38: =RC[-29] -> 0 | AS38: - | AT38: =RC[-30] -> 0 | AU38: =RC[-30] -> 0 | AV38: =RC[-30] -> 1.516 | AW38: =RC[-30] -> 5.4930000000000003 | AY38: - | AZ38: - | BA38: -
A39: =IF(RC[1]="","",DATEVALUE(RC[1])) -> 43391 | B39: 18.10.18 | C39: 24 | D39: 169.58 | E39: 71.53 | F39: 6.9 | G39: 153.84 | H39: 44.23 | I39: 5.43 | J39: =RC[-5]-RC[-2] -> 27.300000000000004 | K39: 15.74 | L39: 18.38 | M39: 71.55 | R39: 1.2869999999999999 | S39: 5.327 | T39: =(RC[-16]*RC[-15]-RC[-13]*RC[-12])/1000 -> 5.325714200000002 | U39: 17.96 | V39: - | W39: =RC[-2]*RC[-10]/1000 -> 1.2850379999999999 | X39: =ABS((RC[-3]*RC[-11]-RC[-2]*RC[-9])/1000) -> #VALUE! | Y39: =(RC[-14]-RC[1])/RC[-18]*100 -> -1.4430577223088927 | Z39: 17.96 | AC39: =VALUE(RC[-27]) -> 2018-10-18T00:00:00.000 | AD39: =IF(RC[21]=42,"*",IF(RC[21]=32,"",RC[21])) -> - | AE39: =RC[-28] -> 24 | AF39: =RC[-28] -> 169.58 | AG39: =RC[-28] -> 71.53 | AH39: =RC[-28] -> 6.9 | AI39: =RC[-28] -> 153.84 | AJ39: =RC[-28] -> 44.23 | AK39: =RC[-28] -> 5.43 | AL39: =RC[-28] -> 27.300000000000004 | AM39: =RC[-28] -> 15.74 | AN39: =RC[-28] -> 18.38 | AO39: =RC[-28] -> 71.55 | AP39: - | AQ39: =RC[-29] -> 0 | AR39: =RC[-29] -> 0 | AS39: - | AT39: =RC[-30] -> 0 | AU39: =RC[-30] -> 0 | AV39: =RC[-30] -> 1.2869999999999999 | AW39: =RC[-30] -> 5.327 | AY39: - | AZ39: - | BA39: -
A40: =IF(RC[1]="","",DATEVALUE(RC[1])) -> 43392 | B40: 19.10.18 | C40: 24 | D40: 170.02 | E40: 71.34 | F40: 6.9 | G40: 153.66 | H40: 43.54 | I40: 5.44 | J40: =RC[-5]-RC[-2] -> 27.800000000000004 | K40: 16.36 | L40: 19.05 | M40: 71.27 | R40: 1.3280000000000001 | S40: 5.4429999999999996 | T40: =(RC[-16]*RC[-15]-RC[-13]*RC[-12])/1000 -> 5.4388704000000025 | U40: 18.64 | V40: - | W40: =RC[-2]*RC[-10]/1000 -> 1.3284727999999999 | X40: =ABS((RC[-3]*RC[-11]-RC[-2]*RC[-9])/1000) -> #VALUE! | Y40: =(RC[-14]-RC[1])/RC[-18]*100 -> -1.4837953924248348 | Z40: 18.64 | AC40: =VALUE(RC[-27]) -> 2018-10-19T00:00:00.000 | AD40: =IF(RC[21]=42,"*",IF(RC[21]=32,"",RC[21])) -> - | AE40: =RC[-28] -> 24 | AF40: =RC[-28] -> 170.02 | AG40: =RC[-28] -> 71.34 | AH40: =RC[-28] -> 6.9 | AI40: =RC[-28] -> 153.66 | AJ40: =RC[-28] -> 43.54 | AK40: =RC[-28] -> 5.44 | AL40: =RC[-28] -> 27.800000000000004 | AM40: =RC[-28] -> 16.36 | AN40: =RC[-28] -> 19.05 | AO40: =RC[-28] -> 71.27 | AP40: - | AQ40: =RC[-29] -> 0 | AR40: =RC[-29] -> 0 | AS40: - | AT40: =RC[-30] -> 0 | AU40: =RC[-30] -> 0 | AV40: =RC[-30] -> 1.3280000000000001 | AW40: =RC[-30] -> 5.4429999999999996 | AY40: - | AZ40: - | BA40: -
A41: =IF(RC[1]="","",DATEVALUE(RC[1])) -> 43393 | B41: 20.10.18 | C41: 24 | D41: 163.53 | E41: 70.540000000000006 | F41: 6.82 | G41: 146.41 | H41: 42.49 | I41: 5.5 | J41: =RC[-5]-RC[-2] -> 28.050000000000004 | K41: 17.12 | L41: 19.63 | M41: 70.62 | R41: 1.357 | S41: 5.3129999999999997 | T41: =(RC[-16]*RC[-15]-RC[-13]*RC[-12])/1000 -> 5.3144453000000009 | U41: 19.21 | V41: - | W41: =RC[-2]*RC[-10]/1000 -> 1.3566102 | X41: =ABS((RC[-3]*RC[-11]-RC[-2]*RC[-9])/1000) -> #VALUE! | Y41: =(RC[-14]-RC[1])/RC[-18]*100 -> -1.4274981217129976 | Z41: 19.21 | AC41: =VALUE(RC[-27]) -> 2018-10-20T00:00:00.000 | AD41: =IF(RC[21]=42,"*",IF(RC[21]=32,"",RC[21])) -> - | AE41: =RC[-28] -> 24 | AF41: =RC[-28] -> 163.53 | AG41: =RC[-28] -> 70.540000000000006 | AH41: =RC[-28] -> 6.82 | AI41: =RC[-28] -> 146.41 | AJ41: =RC[-28] -> 42.49 | AK41: =RC[-28] -> 5.5 | AL41: =RC[-28] -> 28.050000000000004 | AM41: =RC[-28] -> 17.12 | AN41: =RC[-28] -> 19.63 | AO41: =RC[-28] -> 70.62 | AP41: - | AQ41: =RC[-29] -> 0 | AR41: =RC[-29] -> 0 | AS41: - | AT41: =RC[-30] -> 0 | AU41: =RC[-30] -> 0 | AV41: =RC[-30] -> 1.357 | AW41: =RC[-30] -> 5.3129999999999997 | AY41: - | AZ41: - | BA41: -
A42: =IF(RC[1]="","",DATEVALUE(RC[1])) -> 43394 | B42: 21.10.18 | C42: 24 | D42: 165.47 | E42: 69.72 | F42: 6.82 | G42: 144.13999999999999 | H42: 41.87 | I42: 5.52 | J42: =RC[-5]-RC[-2] -> 27.85 | K42: 21.33 | L42: 23.84 | M42: 69.739999999999995 | R42: 1.631 | S42: 5.4989999999999997 | T42: =(RC[-16]*RC[-15]-RC[-13]*RC[-12])/1000 -> 5.5014266000000003 | U42: 23.34 | V42: - | W42: =RC[-2]*RC[-10]/1000 -> 1.6277315999999999 | X42: =ABS((RC[-3]*RC[-11]-RC[-2]*RC[-9])/1000) -> #VALUE! | Y42: =(RC[-14]-RC[1])/RC[-18]*100 -> -1.3944775912307492 | Z42: 23.34 | AC42: =VALUE(RC[-27]) -> 2018-10-21T00:00:00.000 | AD42: =IF(RC[21]=42,"*",IF(RC[21]=32,"",RC[21])) -> - | AE42: =RC[-28] -> 24 | AF42: =RC[-28] -> 165.47 | AG42: =RC[-28] -> 69.72 | AH42: =RC[-28] -> 6.82 | AI42: =RC[-28] -> 144.13999999999999 | AJ42: =RC[-28] -> 41.87 | AK42: =RC[-28] -> 5.52 | AL42: =RC[-28] -> 27.85 | AM42: =RC[-28] -> 21.33 | AN42: =RC[-28] -> 23.84 | AO42: =RC[-28] -> 69.739999999999995 | AP42: - | AQ42: =RC[-29] -> 0 | AR42: =RC[-29] -> 0 | AS42: - | AT42: =RC[-30] -> 0 | AU42: =RC[-30] -> 0 | AV42: =RC[-30] -> 1.631 | AW42: =RC[-30] -> 5.4989999999999997 | AY42: - | AZ42: - | BA42: -
A43: =IF(RC[1]="","",DATEVALUE(RC[1])) -> 43395 | B43: 22.10.18 | C43: 24 | D43: 161.91999999999999 | E43: 70.260000000000005 | F43: 6.84 | G43: 144.19999999999999 | H43: 41.74 | I43: 5.55 | J43: =RC[-5]-RC[-2] -> 28.520000000000003 | K43: 17.72 | L43: 20.05 | M43: 70.31 | R43: 1.379 | S43: 5.3540000000000001 | T43: =(RC[-16]*RC[-15]-RC[-13]*RC[-12])/1000 -> 5.3575912000000008 | U43: 19.61 | V43: - | W43: =RC[-2]*RC[-10]/1000 -> 1.3787791 | X43: =ABS((RC[-3]*RC[-11]-RC[-2]*RC[-9])/1000) -> #VALUE! | Y43: =(RC[-14]-RC[1])/RC[-18]*100 -> -1.310679611650486 | Z43: 19.61 | AC43: =VALUE(RC[-27]) -> 2018-10-22T00:00:00.000 | AD43: =IF(RC[21]=42,"*",IF(RC[21]=32,"",RC[21])) -> - | AE43: =RC[-28] -> 24 | AF43: =RC[-28] -> 161.91999999999999 | AG43: =RC[-28] -> 70.260000000000005 | AH43: =RC[-28] -> 6.84 | AI43: =RC[-28] -> 144.19999999999999 | AJ43: =RC[-28] -> 41.74 | AK43: =RC[-28] -> 5.55 | AL43: =RC[-28] -> 28.520000000000003 | AM43: =RC[-28] -> 17.72 | AN43: =RC[-28] -> 20.05 | AO43: =RC[-28] -> 70.31 | AP43: - | AQ43: =RC[-29] -> 0 | AR43: =RC[-29] -> 0 | AS43: - | AT43: =RC[-30] -> 0 | AU43: =RC[-30] -> 0 | AV43: =RC[-30] -> 1.379 | AW43: =RC[-30] -> 5.3540000000000001 | AY43: - | AZ43: - | BA43: -
A44: =IF(RC[1]="","",DATEVALUE(RC[1])) ->  | C44: 24 | J44: =RC[-5]-RC[-2] -> #VALUE! | T44: =(RC[-16]*RC[-15]-RC[-13]*RC[-12])/1000 -> #VALUE! | W44: =RC[-2]*RC[-10]/1000 -> #VALUE! | X44: =ABS((RC[-3]*RC[-11]-RC[-2]*RC[-9])/1000) -> #VALUE! | Y44: =(RC[-14]-RC[1])/RC[-18]*100 -> #VALUE! | AC44: =VALUE(RC[-27]) -> #VALUE! | AD44: =IF(RC[21]=42,"*",IF(RC[21]=32,"",RC[21])) ->  | AE44: =RC[-28] -> 24 | AF44: =RC[-28] ->  | AG44: =RC[-28] ->  | AH44: =RC[-28] ->  | AI44: =RC[-28] ->  | AJ44: =RC[-28] ->  | AK44: =RC[-28] ->  | AL44: =RC[-28] -> #VALUE! | AM44: =RC[-28] ->  | AN44: =RC[-28] ->  | AO44: =RC[-28] ->  | AP44: - | AQ44: =RC[-29] -> 0 | AR44: =RC[-29] -> 0 | AS44: - | AT44: =RC[-30] -> 0 | AU44: =RC[-30] -> 0 | AV44: =RC[-30] ->  | AW44: =RC[-30] -> 
A45: =IF(RC[1]="","",DATEVALUE(RC[1])) ->  | C45: 24 | T45: =(RC[-16]*RC[-15]-RC[-13]*RC[-12])/1000 -> #VALUE! | W45: =RC[-2]*RC[-10]/1000 -> #VALUE! | X45: =ABS((RC[-3]*RC[-11]-RC[-2]*RC[-9])/1000) -> #VALUE! | Y45: =(RC[-14]-RC[1])/RC[-18]*100 -> #VALUE! | AC45: =VALUE(RC[-27]) -> #VALUE! | AD45: =IF(RC[21]=42,"*",IF(RC[21]=32,"",RC[21])) ->  | AE45: =RC[-28] -> 24 | AF45: =RC[-28] ->  | AG45: =RC[-28] ->  | AH45: =RC[-28] ->  | AI45: =RC[-28] ->  | AJ45: =RC[-28] ->  | AK45: =RC[-28] ->  | AL45: =RC[-28] -> 0 | AM45: =RC[-28] ->  | AN45: =RC[-28] ->  | AO45: =RC[-28] ->  | AP45: - | AQ45: =RC[-29] -> 0 | AR45: =RC[-29] -> 0 | AS45: - | AT45: =RC[-30] -> 0 | AU45: =RC[-30] -> 0 | AV45: =RC[-30] ->  | AW45: =RC[-30] -> 
A46: =IF(RC[1]="","",DATEVALUE(RC[1])) ->  | C46: 24 | T46: =(RC[-16]*RC[-15]-RC[-13]*RC[-12])/1000 -> #VALUE! | W46: =RC[-2]*RC[-10]/1000 -> #VALUE! | X46: =ABS((RC[-3]*RC[-11]-RC[-2]*RC[-9])/1000) -> #VALUE! | Y46: =(RC[-14]-RC[1])/RC[-18]*100 -> #VALUE! | AC46: =VALUE(RC[-27]) -> #VALUE! | AD46: =IF(RC[21]=42,"*",IF(RC[21]=32,"",RC[21])) ->  | AE46: =RC[-28] -> 24 | AF46: =RC[-28] ->  | AG46: =RC[-28] ->  | AH46: =RC[-28] ->  | AI46: =RC[-28] ->  | AJ46: =RC[-28] ->  | AK46: =RC[-28] ->  | AL46: =RC[-28] -> 0 | AM46: =RC[-28] ->  | AN46: =RC[-28] ->  | AO46: =RC[-28] ->  | AP46: - | AQ46: =RC[-29] -> 0 | AR46: =RC[-29] -> 0 | AS46: - | AT46: =RC[-30] -> 0 | AU46: =RC[-30] -> 0 | AV46: =RC[-30] ->  | AW46: =RC[-30] -> 
A47: =IF(RC[1]="","",DATEVALUE(RC[1])) ->  | C47: 24 | T47: =(RC[-16]*RC[-15]-RC[-13]*RC[-12])/1000 -> #VALUE! | W47: =RC[-2]*RC[-10]/1000 -> #VALUE! | X47: =ABS((RC[-3]*RC[-11]-RC[-2]*RC[-9])/1000) -> #VALUE! | Y47: =(RC[-14]-RC[1])/RC[-18]*100 -> #VALUE! | AC47: =VALUE(RC[-27]) -> #VALUE! | AD47: =IF(RC[21]=42,"*",IF(RC[21]=32,"",RC[21])) ->  | AE47: =RC[-28] -> 24 | AF47: =RC[-28] ->  | AG47: =RC[-28] ->  | AH47: =RC[-28] ->  | AI47: =RC[-28] ->  | AJ47: =RC[-28] ->  | AK47: =RC[-28] ->  | AL47: =RC[-28] -> 0 | AM47: =RC[-28] ->  | AN47: =RC[-28] ->  | AO47: =RC[-28] ->  | AP47: - | AQ47: =RC[-29] -> 0 | AR47: =RC[-29] -> 0 | AS47: - | AT47: =RC[-30] -> 0 | AU47: =RC[-30] -> 0 | AV47: =RC[-30] ->  | AW47: =RC[-30] -> 
A48: =IF(RC[1]="","",DATEVALUE(RC[1])) ->  | C48: 24 | T48: =(RC[-16]*RC[-15]-RC[-13]*RC[-12])/1000 -> #VALUE! | W48: =RC[-2]*RC[-10]/1000 -> #VALUE! | X48: =ABS((RC[-3]*RC[-11]-RC[-2]*RC[-9])/1000) -> #VALUE! | Y48: =(RC[-14]-RC[1])/RC[-18]*100 -> #VALUE! | AC48: =VALUE(RC[-27]) -> #VALUE! | AD48: =IF(RC[21]=42,"*",IF(RC[21]=32,"",RC[21])) ->  | AE48: =RC[-28] -> 24 | AF48: =RC[-28] ->  | AG48: =RC[-28] ->  | AH48: =RC[-28] ->  | AI48: =RC[-28] ->  | AJ48: =RC[-28] ->  | AK48: =RC[-28] ->  | AL48: =RC[-28] -> 0 | AM48: =RC[-28] ->  | AN48: =RC[-28] ->  | AO48: =RC[-28] ->  | AP48: - | AQ48: =RC[-29] -> 0 | AR48: =RC[-29] -> 0 | AS48: - | AT48: =RC[-30] -> 0 | AU48: =RC[-30] -> 0 | AV48: =RC[-30] ->  | AW48: =RC[-30] -> 
A49: =IF(RC[1]="","",DATEVALUE(RC[1])) ->  | C49: 24 | T49: =(RC[-16]*RC[-15]-RC[-13]*RC[-12])/1000 -> #VALUE! | W49: =RC[-2]*RC[-10]/1000 -> #VALUE! | X49: =ABS((RC[-3]*RC[-11]-RC[-2]*RC[-9])/1000) -> #VALUE! | Y49: =(RC[-14]-RC[1])/RC[-18]*100 -> #VALUE! | AC49: =VALUE(RC[-27]) -> #VALUE! | AD49: =IF(RC[21]=42,"*",IF(RC[21]=32,"",RC[21])) ->  | AE49: =RC[-28] -> 24 | AF49: =RC[-28] ->  | AG49: =RC[-28] ->  | AH49: =RC[-28] ->  | AI49: =RC[-28] ->  | AJ49: =RC[-28] ->  | AK49: =RC[-28] ->  | AL49: =RC[-28] -> 0 | AM49: =RC[-28] ->  | AN49: =RC[-28] ->  | AO49: =RC[-28] ->  | AP49: - | AQ49: =RC[-29] -> 0 | AR49: =RC[-29] -> 0 | AS49: - | AT49: =RC[-30] -> 0 | AU49: =RC[-30] -> 0 | AV49: =RC[-30] ->  | AW49: =RC[-30] -> 
A50: =IF(RC[1]="","",DATEVALUE(RC[1])) ->  | T50: =(RC[-16]*RC[-15]-RC[-13]*RC[-12])/1000 -> #VALUE! | W50: =RC[-2]*RC[-10]/1000 -> #VALUE! | X50: =ABS((RC[-3]*RC[-11]-RC[-2]*RC[-9])/1000) -> #VALUE! | Y50: =(RC[-14]-RC[1])/RC[-18]*100 -> #VALUE! | AC50: =VALUE(RC[-27]) -> #VALUE! | AD50: =IF(RC[21]=42,"*",IF(RC[21]=32,"",RC[21])) ->  | AE50: =RC[-28] ->  | AF50: =RC[-28] ->  | AG50: =RC[-28] ->  | AH50: =RC[-28] ->  | AI50: =RC[-28] ->  | AJ50: =RC[-28] ->  | AK50: =RC[-28] ->  | AL50: =RC[-28] -> 0 | AM50: =RC[-28] ->  | AN50: =RC[-28] ->  | AO50: =RC[-28] ->  | AP50: - | AQ50: =RC[-29] -> 0 | AR50: =RC[-29] -> 0 | AS50: - | AT50: =RC[-30] -> 0 | AU50: =RC[-30] -> 0 | AV50: =RC[-30] ->  | AW50: =RC[-30] -> 
A51: =IF(RC[1]="","",DATEVALUE(RC[1])) ->  | T51: =(RC[-16]*RC[-15]-RC[-13]*RC[-12])/1000 -> #VALUE! | W51: =RC[-2]*RC[-10]/1000 -> #VALUE! | X51: =ABS((RC[-3]*RC[-11]-RC[-2]*RC[-9])/1000) -> #VALUE! | Y51: =(RC[-14]-RC[1])/RC[-18]*100 -> #VALUE! | AC51: =VALUE(RC[-27]) -> #VALUE! | AD51: =IF(RC[21]=42,"*",IF(RC[21]=32,"",RC[21])) ->  | AE51: =RC[-28] ->  | AF51: =RC[-28] ->  | AG51: =RC[-28] ->  | AH51: =RC[-28] ->  | AI51: =RC[-28] ->  | AJ51: =RC[-28] ->  | AK51: =RC[-28] ->  | AL51: =RC[-28] -> 0 | AM51: =RC[-28] ->  | AN51: =RC[-28] ->  | AO51: =RC[-28] ->  | AP51: - | AQ51: =RC[-29] -> 0 | AR51: =RC[-29] -> 0 | AS51: - | AT51: =RC[-30] -> 0 | AU51: =RC[-30] -> 0 | AV51: =RC[-30] ->  | AW51: =RC[-30] -> 
A52: =IF(RC[1]="","",DATEVALUE(RC[1])) ->  | T52: =(RC[-16]*RC[-15]-RC[-13]*RC[-12])/1000 -> #VALUE! | W52: =RC[-2]*RC[-10]/1000 -> #VALUE! | X52: =ABS((RC[-3]*RC[-11]-RC[-2]*RC[-9])/1000) -> #VALUE! | Y52: =(RC[-14]-RC[1])/RC[-18]*100 -> #VALUE! | AC52: =VALUE(RC[-27]) -> #VALUE! | AD52: =IF(RC[21]=42,"*",IF(RC[21]=32,"",RC[21])) ->  | AE52: =RC[-28] ->  | AF52: =RC[-28] ->  | AG52: =RC[-28] ->  | AH52: =RC[-28] ->  | AI52: =RC[-28] ->  | AJ52: =RC[-28] ->  | AK52: =RC[-28] ->  | AL52: =RC[-28] -> 0 | AM52: =RC[-28] ->  | AN52: =RC[-28] ->  | AO52: =RC[-28] ->  | AP52: - | AQ52: =RC[-29] -> 0 | AR52: =RC[-29] -> 0 | AS52: - | AT52: =RC[-30] -> 0 | AU52: =RC[-30] -> 0 | AV52: =RC[-30] ->  | AW52: =RC[-30] -> 
A53: =IF(RC[1]="","",DATEVALUE(RC[1])) ->  | T53: =(RC[-16]*RC[-15]-RC[-13]*RC[-12])/1000 -> #VALUE! | W53: =RC[-2]*RC[-10]/1000 -> #VALUE! | X53: =ABS((RC[-3]*RC[-11]-RC[-2]*RC[-9])/1000) -> #VALUE! | Y53: =(RC[-14]-RC[1])/RC[-18]*100 -> #VALUE! | AC53: =VALUE(RC[-27]) -> #VALUE! | AD53: =IF(RC[21]=42,"*",IF(RC[21]=32,"",RC[21])) ->  | AE53: =RC[-28] ->  | AF53: =RC[-28] ->  | AG53: =RC[-28] ->  | AH53: =RC[-28] ->  | AI53: =RC[-28] ->  | AJ53: =RC[-28] ->  | AK53: =RC[-28] ->  | AL53: =RC[-28] -> 0 | AM53: =RC[-28] ->  | AN53: =RC[-28] ->  | AO53: =RC[-28] ->  | AP53: - | AQ53: =RC[-29] -> 0 | AR53: =RC[-29] -> 0 | AS53: - | AT53: =RC[-30] -> 0 | AU53: =RC[-30] -> 0 | AV53: =RC[-30] ->  | AW53: =RC[-30] -> 
A54: =IF(RC[1]="","",DATEVALUE(RC[1])) ->  | T54: =(RC[-16]*RC[-15]-RC[-13]*RC[-12])/1000 -> #VALUE! | W54: =RC[-2]*RC[-10]/1000 -> #VALUE! | X54: =ABS((RC[-3]*RC[-11]-RC[-2]*RC[-9])/1000) -> #VALUE! | Y54: =(RC[-14]-RC[1])/RC[-18]*100 -> #VALUE! | AC54: =VALUE(RC[-27]) -> #VALUE! | AD54: =IF(RC[21]=42,"*",IF(RC[21]=32,"",RC[21])) ->  | AE54: =RC[-28] ->  | AF54: =RC[-28] ->  | AG54: =RC[-28] ->  | AH54: =RC[-28] ->  | AI54: =RC[-28] ->  | AJ54: =RC[-28] ->  | AK54: =RC[-28] ->  | AL54: =RC[-28] -> 0 | AM54: =RC[-28] ->  | AN54: =RC[-28] ->  | AO54: =RC[-28] ->  | AP54: - | AQ54: =RC[-29] -> 0 | AR54: =RC[-29] -> 0 | AS54: - | AT54: =RC[-30] -> 0 | AU54: =RC[-30] -> 0 | AV54: =RC[-30] ->  | AW54: =RC[-30] -> 
A55: =IF(RC[1]="","",DATEVALUE(RC[1])) ->  | T55: =(RC[-16]*RC[-15]-RC[-13]*RC[-12])/1000 -> #VALUE! | W55: =RC[-2]*RC[-10]/1000 -> #VALUE! | X55: =ABS((RC[-3]*RC[-11]-RC[-2]*RC[-9])/1000) -> #VALUE! | Y55: =(RC[-14]-RC[1])/RC[-18]*100 -> #VALUE! | AC55: =VALUE(RC[-27]) -> #VALUE! | AD55: =IF(RC[21]=42,"*",IF(RC[21]=32,"",RC[21])) ->  | AE55: =RC[-28] ->  | AF55: =RC[-28] ->  | AG55: =RC[-28] ->  | AH55: =RC[-28] ->  | AI55: =RC[-28] ->  | AJ55: =RC[-28] ->  | AK55: =RC[-28] ->  | AL55: =RC[-28] -> 0 | AM55: =RC[-28] ->  | AN55: =RC[-28] ->  | AO55: =RC[-28] ->  | AP55: - | AQ55: =RC[-29] -> 0 | AR55: =RC[-29] -> 0 | AS55: - | AT55: =RC[-30] -> 0 | AU55: =RC[-30] -> 0 | AV55: =RC[-30] ->  | AW55: =RC[-30] -> 
A56: =IF(RC[1]="","",DATEVALUE(RC[1])) ->  | T56: =(RC[-16]*RC[-15]-RC[-13]*RC[-12])/1000 -> #VALUE! | W56: =RC[-2]*RC[-10]/1000 -> #VALUE! | X56: =ABS((RC[-3]*RC[-11]-RC[-2]*RC[-9])/1000) -> #VALUE! | Y56: =(RC[-14]-RC[1])/RC[-18]*100 -> #VALUE! | AC56: =VALUE(RC[-27]) -> #VALUE! | AD56: =IF(RC[21]=42,"*",IF(RC[21]=32,"",RC[21])) ->  | AE56: =RC[-28] ->  | AF56: =RC[-28] ->  | AG56: =RC[-28] ->  | AH56: =RC[-28] ->  | AI56: =RC[-28] ->  | AJ56: =RC[-28] ->  | AK56: =RC[-28] ->  | AL56: =RC[-28] -> 0 | AM56: =RC[-28] ->  | AN56: =RC[-28] ->  | AO56: =RC[-28] ->  | AP56: - | AQ56: =RC[-29] -> 0 | AR56: =RC[-29] -> 0 | AS56: - | AT56: =RC[-30] -> 0 | AU56: =RC[-30] -> 0 | AV56: =RC[-30] ->  | AW56: =RC[-30] -> 
A57: =IF(RC[1]="","",DATEVALUE(RC[1])) ->  | T57: =(RC[-16]*RC[-15]-RC[-13]*RC[-12])/1000 -> #VALUE! | W57: =RC[-2]*RC[-10]/1000 -> #VALUE! | X57: =ABS((RC[-3]*RC[-11]-RC[-2]*RC[-9])/1000) -> #VALUE! | Y57: =(RC[-14]-RC[1])/RC[-18]*100 -> #VALUE! | AC57: =VALUE(RC[-27]) -> #VALUE! | AD57: =IF(RC[21]=42,"*",IF(RC[21]=32,"",RC[21])) ->  | AE57: =RC[-28] ->  | AF57: =RC[-28] ->  | AG57: =RC[-28] ->  | AH57: =RC[-28] ->  | AI57: =RC[-28] ->  | AJ57: =RC[-28] ->  | AK57: =RC[-28] ->  | AL57: =RC[-28] -> 0 | AM57: =RC[-28] ->  | AN57: =RC[-28] ->  | AO57: =RC[-28] ->  | AP57: - | AQ57: =RC[-29] -> 0 | AR57: =RC[-29] -> 0 | AS57: - | AT57: =RC[-30] -> 0 | AU57: =RC[-30] -> 0 | AV57: =RC[-30] ->  | AW57: =RC[-30] -> 
A58: =IF(RC[1]="","",DATEVALUE(RC[1])) ->  | T58: =(RC[-16]*RC[-15]-RC[-13]*RC[-12])/1000 -> #VALUE! | W58: =RC[-2]*RC[-10]/1000 -> #VALUE! | X58: =ABS((RC[-3]*RC[-11]-RC[-2]*RC[-9])/1000) -> #VALUE! | Y58: =(RC[-14]-RC[1])/RC[-18]*100 -> #VALUE! | AC58: =VALUE(RC[-27]) -> #VALUE! | AD58: =IF(RC[21]=42,"*",IF(RC[21]=32,"",RC[21])) ->  | AE58: =RC[-28] ->  | AF58: =RC[-28] ->  | AG58: =RC[-28] ->  | AH58: =RC[-28] ->  | AI58: =RC[-28] ->  | AJ58: =RC[-28] ->  | AK58: =RC[-28] ->  | AL58: =RC[-28] -> 0 | AM58: =RC[-28] ->  | AN58: =RC[-28] ->  | AO58: =RC[-28] ->  | AP58: - | AQ58: =RC[-29] -> 0 | AR58: =RC[-29] -> 0 | AS58: - | AT58: =RC[-30] -> 0 | AU58: =RC[-30] -> 0 | AV58: =RC[-30] ->  | AW58: =RC[-30] -> 
A59: =IF(RC[1]="","",DATEVALUE(RC[1])) ->  | T59: =(RC[-16]*RC[-15]-RC[-13]*RC[-12])/1000 -> #VALUE! | W59: =RC[-2]*RC[-10]/1000 -> #VALUE! | X59: =ABS((RC[-3]*RC[-11]-RC[-2]*RC[-9])/1000) -> #VALUE! | Y59: =(RC[-14]-RC[1])/RC[-18]*100 -> #VALUE! | AC59: =VALUE(RC[-27]) -> #VALUE! | AD59: =IF(RC[21]=42,"*",IF(RC[21]=32,"",RC[21])) ->  | AE59: =RC[-28] ->  | AF59: =RC[-28] ->  | AG59: =RC[-28] ->  | AH59: =RC[-28] ->  | AI59: =RC[-28] ->  | AJ59: =RC[-28] ->  | AK59: =RC[-28] ->  | AL59: =RC[-28] -> 0 | AM59: =RC[-28] ->  | AN59: =RC[-28] ->  | AO59: =RC[-28] ->  | AP59: - | AQ59: =RC[-29] -> 0 | AR59: =RC[-29] -> 0 | AS59: - | AT59: =RC[-30] -> 0 | AU59: =RC[-30] -> 0 | AV59: =RC[-30] ->  | AW59: =RC[-30] -> 
A60: =IF(RC[1]="","",DATEVALUE(RC[1])) ->  | T60: =(RC[-16]*RC[-15]-RC[-13]*RC[-12])/1000 -> #VALUE! | W60: =RC[-2]*RC[-10]/1000 -> #VALUE! | X60: =ABS((RC[-3]*RC[-11]-RC[-2]*RC[-9])/1000) -> #VALUE! | Y60: =(RC[-14]-RC[1])/RC[-18]*100 -> #VALUE! | AC60: =VALUE(RC[-27]) -> #VALUE! | AD60: =IF(RC[21]=42,"*",IF(RC[21]=32,"",RC[21])) ->  | AE60: =RC[-28] ->  | AF60: =RC[-28] ->  | AG60: =RC[-28] ->  | AH60: =RC[-28] ->  | AI60: =RC[-28] ->  | AJ60: =RC[-28] ->  | AK60: =RC[-28] ->  | AL60: =RC[-28] -> 0 | AM60: =RC[-28] ->  | AN60: =RC[-28] ->  | AO60: =RC[-28] ->  | AP60: - | AQ60: =RC[-29] -> 0 | AR60: =RC[-29] -> 0 | AS60: - | AT60: =RC[-30] -> 0 | AU60: =RC[-30] -> 0 | AV60: =RC[-30] ->  | AW60: =RC[-30] -> 
A61: =IF(RC[1]="","",DATEVALUE(RC[1])) ->  | T61: =(RC[-16]*RC[-15]-RC[-13]*RC[-12])/1000 -> #VALUE! | W61: =RC[-2]*RC[-10]/1000 -> #VALUE! | X61: =ABS((RC[-3]*RC[-11]-RC[-2]*RC[-9])/1000) -> #VALUE! | Y61: =(RC[-14]-RC[1])/RC[-18]*100 -> #VALUE! | AC61: =VALUE(RC[-27]) -> #VALUE! | AD61: =IF(RC[21]=42,"*",IF(RC[21]=32,"",RC[21])) ->  | AE61: =RC[-28] ->  | AF61: =RC[-28] ->  | AG61: =RC[-28] ->  | AH61: =RC[-28] ->  | AI61: =RC[-28] ->  | AJ61: =RC[-28] ->  | AK61: =RC[-28] ->  | AL61: =RC[-28] -> 0 | AM61: =RC[-28] ->  | AN61: =RC[-28] ->  | AO61: =RC[-28] ->  | AP61: - | AQ61: =RC[-29] -> 0 | AR61: =RC[-29] -> 0 | AS61: - | AT61: =RC[-30] -> 0 | AU61: =RC[-30] -> 0 | AV61: =RC[-30] ->  | AW61: =RC[-30] -> 
A62: =IF(RC[1]="","",DATEVALUE(RC[1])) ->  | T62: =(RC[-16]*RC[-15]-RC[-13]*RC[-12])/1000 -> #VALUE! | W62: =RC[-2]*RC[-10]/1000 -> #VALUE! | X62: =ABS((RC[-3]*RC[-11]-RC[-2]*RC[-9])/1000) -> #VALUE! | Y62: =(RC[-14]-RC[1])/RC[-18]*100 -> #VALUE! | AC62: =VALUE(RC[-27]) -> #VALUE! | AD62: =IF(RC[21]=42,"*",IF(RC[21]=32,"",RC[21])) ->  | AE62: =RC[-28] ->  | AF62: =RC[-28] ->  | AG62: =RC[-28] ->  | AH62: =RC[-28] ->  | AI62: =RC[-28] ->  | AJ62: =RC[-28] ->  | AK62: =RC[-28] ->  | AL62: =RC[-28] -> 0 | AM62: =RC[-28] ->  | AN62: =RC[-28] ->  | AO62: =RC[-28] ->  | AP62: - | AQ62: =RC[-29] -> 0 | AR62: =RC[-29] -> 0 | AS62: - | AT62: =RC[-30] -> 0 | AU62: =RC[-30] -> 0 | AV62: =RC[-30] ->  | AW62: =RC[-30] -> 
A63: =IF(RC[1]="","",DATEVALUE(RC[1])) ->  | T63: =(RC[-16]*RC[-15]-RC[-13]*RC[-12])/1000 -> #VALUE! | W63: =RC[-2]*RC[-10]/1000 -> #VALUE! | X63: =ABS((RC[-3]*RC[-11]-RC[-2]*RC[-9])/1000) -> #VALUE! | Y63: =(RC[-14]-RC[1])/RC[-18]*100 -> #VALUE! | AC63: =VALUE(RC[-27]) -> #VALUE! | AD63: =IF(RC[21]=42,"*",IF(RC[21]=32,"",RC[21])) ->  | AE63: =RC[-28] ->  | AF63: =RC[-28] ->  | AG63: =RC[-28] ->  | AH63: =RC[-28] ->  | AI63: =RC[-28] ->  | AJ63: =RC[-28] ->  | AK63: =RC[-28] ->  | AL63: =RC[-28] -> 0 | AM63: =RC[-28] ->  | AN63: =RC[-28] ->  | AO63: =RC[-28] ->  | AP63: - | AQ63: =RC[-29] -> 0 | AR63: =RC[-29] -> 0 | AS63: - | AT63: =RC[-30] -> 0 | AU63: =RC[-30] -> 0 | AV63: =RC[-30] ->  | AW63: =RC[-30] -> 
A64: =IF(RC[1]="","",DATEVALUE(RC[1])) ->  | T64: =(RC[-16]*RC[-15]-RC[-13]*RC[-12])/1000 -> #VALUE! | W64: =RC[-2]*RC[-10]/1000 -> #VALUE! | X64: =ABS((RC[-3]*RC[-11]-RC[-2]*RC[-9])/1000) -> #VALUE! | Y64: =(RC[-14]-RC[1])/RC[-18]*100 -> #VALUE! | AC64: =VALUE(RC[-27]) -> #VALUE! | AD64: =IF(RC[21]=42,"*",IF(RC[21]=32,"",RC[21])) ->  | AE64: =RC[-28] ->  | AF64: =RC[-28] ->  | AG64: =RC[-28] ->  | AH64: =RC[-28] ->  | AI64: =RC[-28] ->  | AJ64: =RC[-28] ->  | AK64: =RC[-28] ->  | AL64: =RC[-28] -> 0 | AM64: =RC[-28] ->  | AN64: =RC[-28] ->  | AO64: =RC[-28] ->  | AP64: - | AQ64: =RC[-29] -> 0 | AR64: =RC[-29] -> 0 | AS64: - | AT64: =RC[-30] -> 0 | AU64: =RC[-30] -> 0 | AV64: =RC[-30] ->  | AW64: =RC[-30] -> 
A65: =IF(RC[1]="","",DATEVALUE(RC[1])) ->  | T65: =(RC[-16]*RC[-15]-RC[-13]*RC[-12])/1000 -> #VALUE! | W65: =RC[-2]*RC[-10]/1000 -> #VALUE! | X65: =ABS((RC[-3]*RC[-11]-RC[-2]*RC[-9])/1000) -> #VALUE! | Y65: =(RC[-14]-RC[1])/RC[-18]*100 -> #VALUE! | AC65: =VALUE(RC[-27]) -> #VALUE! | AD65: =IF(RC[21]=42,"*",IF(RC[21]=32,"",RC[21])) ->  | AE65: =RC[-28] ->  | AF65: =RC[-28] ->  | AG65: =RC[-28] ->  | AH65: =RC[-28] ->  | AI65: =RC[-28] ->  | AJ65: =RC[-28] ->  | AK65: =RC[-28] ->  | AL65: =RC[-28] -> 0 | AM65: =RC[-28] ->  | AN65: =RC[-28] ->  | AO65: =RC[-28] ->  | AP65: - | AQ65: =RC[-29] -> 0 | AR65: =RC[-29] -> 0 | AS65: - | AT65: =RC[-30] -> 0 | AU65: =RC[-30] -> 0 | AV65: =RC[-30] ->  | AW65: =RC[-30] -> 
A66: =IF(RC[1]="","",DATEVALUE(RC[1])) ->  | T66: =(RC[-16]*RC[-15]-RC[-13]*RC[-12])/1000 -> #VALUE! | W66: =RC[-2]*RC[-10]/1000 -> #VALUE! | X66: =ABS((RC[-3]*RC[-11]-RC[-2]*RC[-9])/1000) -> #VALUE! | Y66: =(RC[-14]-RC[1])/RC[-18]*100 -> #VALUE! | AC66: =VALUE(RC[-27]) -> #VALUE! | AD66: =IF(RC[21]=42,"*",IF(RC[21]=32,"",RC[21])) ->  | AE66: =RC[-28] ->  | AF66: =RC[-28] ->  | AG66: =RC[-28] ->  | AH66: =RC[-28] ->  | AI66: =RC[-28] ->  | AJ66: =RC[-28] ->  | AK66: =RC[-28] ->  | AL66: =RC[-28] -> 0 | AM66: =RC[-28] ->  | AN66: =RC[-28] ->  | AO66: =RC[-28] ->  | AP66: - | AQ66: =RC[-29] -> 0 | AR66: =RC[-29] -> 0 | AS66: - | AT66: =RC[-30] -> 0 | AU66: =RC[-30] -> 0 | AV66: =RC[-30] ->  | AW66: =RC[-30] -> 
A67: =IF(RC[1]="","",DATEVALUE(RC[1])) ->  | T67: =(RC[-16]*RC[-15]-RC[-13]*RC[-12])/1000 -> #VALUE! | W67: =RC[-2]*RC[-10]/1000 -> #VALUE! | X67: =ABS((RC[-3]*RC[-11]-RC[-2]*RC[-9])/1000) -> #VALUE! | Y67: =(RC[-14]-RC[1])/RC[-18]*100 -> #VALUE! | AC67: =VALUE(RC[-27]) -> #VALUE! | AD67: =IF(RC[21]=42,"*",IF(RC[21]=32,"",RC[21])) ->  | AE67: =RC[-28] ->  | AF67: =RC[-28] ->  | AG67: =RC[-28] ->  | AH67: =RC[-28] ->  | AI67: =RC[-28] ->  | AJ67: =RC[-28] ->  | AK67: =RC[-28] ->  | AL67: =RC[-28] -> 0 | AM67: =RC[-28] ->  | AN67: =RC[-28] ->  | AO67: =RC[-28] ->  | AP67: - | AQ67: =RC[-29] -> 0 | AR67: =RC[-29] -> 0 | AS67: - | AT67: =RC[-30] -> 0 | AU67: =RC[-30] -> 0 | AV67: =RC[-30] ->  | AW67: =RC[-30] -> 
A68: =IF(RC[1]="","",DATEVALUE(RC[1])) ->  | T68: =(RC[-16]*RC[-15]-RC[-13]*RC[-12])/1000 -> #VALUE! | W68: =RC[-2]*RC[-10]/1000 -> #VALUE! | X68: =ABS((RC[-3]*RC[-11]-RC[-2]*RC[-9])/1000) -> #VALUE! | Y68: =(RC[-14]-RC[1])/RC[-18]*100 -> #VALUE! | AC68: =VALUE(RC[-27]) -> #VALUE! | AD68: =IF(RC[21]=42,"*",IF(RC[21]=32,"",RC[21])) ->  | AE68: =RC[-28] ->  | AF68: =RC[-28] ->  | AG68: =RC[-28] ->  | AH68: =RC[-28] ->  | AI68: =RC[-28] ->  | AJ68: =RC[-28] ->  | AK68: =RC[-28] ->  | AL68: =RC[-28] -> 0 | AM68: =RC[-28] ->  | AN68: =RC[-28] ->  | AO68: =RC[-28] ->  | AP68: - | AQ68: =RC[-29] -> 0 | AR68: =RC[-29] -> 0 | AS68: - | AT68: =RC[-30] -> 0 | AU68: =RC[-30] -> 0 | AV68: =RC[-30] ->  | AW68: =RC[-30] -> 
A69: =IF(RC[1]="","",DATEVALUE(RC[1])) ->  | T69: =(RC[-16]*RC[-15]-RC[-13]*RC[-12])/1000 -> #VALUE! | W69: =RC[-2]*RC[-10]/1000 -> #VALUE! | X69: =ABS((RC[-3]*RC[-11]-RC[-2]*RC[-9])/1000) -> #VALUE! | Y69: =(RC[-14]-RC[1])/RC[-18]*100 -> #VALUE! | AC69: =VALUE(RC[-27]) -> #VALUE! | AD69: =IF(RC[21]=42,"*",IF(RC[21]=32,"",RC[21])) ->  | AE69: =RC[-28] ->  | AF69: =RC[-28] ->  | AG69: =RC[-28] ->  | AH69: =RC[-28] ->  | AI69: =RC[-28] ->  | AJ69: =RC[-28] ->  | AK69: =RC[-28] ->  | AL69: =RC[-28] -> 0 | AM69: =RC[-28] ->  | AN69: =RC[-28] ->  | AO69: =RC[-28] ->  | AP69: - | AQ69: =RC[-29] -> 0 | AR69: =RC[-29] -> 0 | AS69: - | AT69: =RC[-30] -> 0 | AU69: =RC[-30] -> 0 | AV69: =RC[-30] ->  | AW69: =RC[-30] -> 
A70: =IF(RC[1]="","",DATEVALUE(RC[1])) ->  | T70: =(RC[-16]*RC[-15]-RC[-13]*RC[-12])/1000 -> #VALUE! | W70: =RC[-2]*RC[-10]/1000 -> #VALUE! | X70: =ABS((RC[-3]*RC[-11]-RC[-2]*RC[-9])/1000) -> #VALUE! | Y70: =(RC[-14]-RC[1])/RC[-18]*100 -> #VALUE! | AC70: =VALUE(RC[-27]) -> #VALUE! | AD70: =IF(RC[21]=42,"*",IF(RC[21]=32,"",RC[21])) ->  | AE70: =RC[-28] ->  | AF70: =RC[-28] ->  | AG70: =RC[-28] ->  | AH70: =RC[-28] ->  | AI70: =RC[-28] ->  | AJ70: =RC[-28] ->  | AK70: =RC[-28] ->  | AL70: =RC[-28] -> 0 | AM70: =RC[-28] ->  | AN70: =RC[-28] ->  | AO70: =RC[-28] ->  | AP70: - | AQ70: =RC[-29] -> 0 | AR70: =RC[-29] -> 0 | AS70: - | AT70: =RC[-30] -> 0 | AU70: =RC[-30] -> 0 | AV70: =RC[-30] ->  | AW70: =RC[-30] -> 
A71: =IF(RC[1]="","",DATEVALUE(RC[1])) ->  | T71: =(RC[-16]*RC[-15]-RC[-13]*RC[-12])/1000 -> #VALUE! | W71: =RC[-2]*RC[-10]/1000 -> #VALUE! | X71: =ABS((RC[-3]*RC[-11]-RC[-2]*RC[-9])/1000) -> #VALUE! | Y71: =(RC[-14]-RC[1])/RC[-18]*100 -> #VALUE! | AC71: =VALUE(RC[-27]) -> #VALUE! | AD71: =IF(RC[21]=42,"*",IF(RC[21]=32,"",RC[21])) ->  | AE71: =RC[-28] ->  | AF71: =RC[-28] ->  | AG71: =RC[-28] ->  | AH71: =RC[-28] ->  | AI71: =RC[-28] ->  | AJ71: =RC[-28] ->  | AK71: =RC[-28] ->  | AL71: =RC[-28] -> 0 | AM71: =RC[-28] ->  | AN71: =RC[-28] ->  | AO71: =RC[-28] ->  | AP71: - | AQ71: =RC[-29] -> 0 | AR71: =RC[-29] -> 0 | AS71: - | AT71: =RC[-30] -> 0 | AU71: =RC[-30] -> 0 | AV71: =RC[-30] ->  | AW71: =RC[-30] -> 
A72: =IF(RC[1]="","",DATEVALUE(RC[1])) ->  | T72: =(RC[-16]*RC[-15]-RC[-13]*RC[-12])/1000 -> #VALUE! | W72: =RC[-2]*RC[-10]/1000 -> #VALUE! | X72: =ABS((RC[-3]*RC[-11]-RC[-2]*RC[-9])/1000) -> #VALUE! | Y72: =(RC[-14]-RC[1])/RC[-18]*100 -> #VALUE! | AC72: =VALUE(RC[-27]) -> #VALUE! | AD72: =IF(RC[21]=42,"*",IF(RC[21]=32,"",RC[21])) ->  | AE72: =RC[-28] ->  | AF72: =RC[-28] ->  | AG72: =RC[-28] ->  | AH72: =RC[-28] ->  | AI72: =RC[-28] ->  | AJ72: =RC[-28] ->  | AK72: =RC[-28] ->  | AL72: =RC[-28] -> 0 | AM72: =RC[-28] ->  | AN72: =RC[-28] ->  | AO72: =RC[-28] ->  | AP72: - | AQ72: =RC[-29] -> 0 | AR72: =RC[-29] -> 0 | AS72: - | AT72: =RC[-30] -> 0 | AU72: =RC[-30] -> 0 | AV72: =RC[-30] ->  | AW72: =RC[-30] -> 
A73: =IF(RC[1]="","",DATEVALUE(RC[1])) ->  | T73: =(RC[-16]*RC[-15]-RC[-13]*RC[-12])/1000 -> #VALUE! | W73: =RC[-2]*RC[-10]/1000 -> #VALUE! | X73: =ABS((RC[-3]*RC[-11]-RC[-2]*RC[-9])/1000) -> #VALUE! | Y73: =(RC[-14]-RC[1])/RC[-18]*100 -> #VALUE! | AC73: =VALUE(RC[-27]) -> #VALUE! | AD73: =IF(RC[21]=42,"*",IF(RC[21]=32,"",RC[21])) ->  | AE73: =RC[-28] ->  | AF73: =RC[-28] ->  | AG73: =RC[-28] ->  | AH73: =RC[-28] ->  | AI73: =RC[-28] ->  | AJ73: =RC[-28] ->  | AK73: =RC[-28] ->  | AL73: =RC[-28] -> 0 | AM73: =RC[-28] ->  | AN73: =RC[-28] ->  | AO73: =RC[-28] ->  | AP73: - | AQ73: =RC[-29] -> 0 | AR73: =RC[-29] -> 0 | AS73: - | AT73: =RC[-30] -> 0 | AU73: =RC[-30] -> 0 | AV73: =RC[-30] ->  | AW73: =RC[-30] -> 
A74: =IF(RC[1]="","",DATEVALUE(RC[1])) ->  | T74: =(RC[-16]*RC[-15]-RC[-13]*RC[-12])/1000 -> #VALUE! | W74: =RC[-2]*RC[-10]/1000 -> #VALUE! | X74: =ABS((RC[-3]*RC[-11]-RC[-2]*RC[-9])/1000) -> #VALUE! | Y74: =(RC[-14]-RC[1])/RC[-18]*100 -> #VALUE! | AC74: =VALUE(RC[-27]) -> #VALUE! | AD74: =IF(RC[21]=42,"*",IF(RC[21]=32,"",RC[21])) ->  | AE74: =RC[-28] ->  | AF74: =RC[-28] ->  | AG74: =RC[-28] ->  | AH74: =RC[-28] ->  | AI74: =RC[-28] ->  | AJ74: =RC[-28] ->  | AK74: =RC[-28] ->  | AL74: =RC[-28] -> 0 | AM74: =RC[-28] ->  | AN74: =RC[-28] ->  | AO74: =RC[-28] ->  | AP74: - | AQ74: =RC[-29] -> 0 | AR74: =RC[-29] -> 0 | AS74: - | AT74: =RC[-30] -> 0 | AU74: =RC[-30] -> 0 | AV74: =RC[-30] ->  | AW74: =RC[-30] -> 
A75: =IF(RC[1]="","",DATEVALUE(RC[1])) ->  | T75: =(RC[-16]*RC[-15]-RC[-13]*RC[-12])/1000 -> #VALUE! | W75: =RC[-2]*RC[-10]/1000 -> #VALUE! | X75: =ABS((RC[-3]*RC[-11]-RC[-2]*RC[-9])/1000) -> #VALUE! | Y75: =(RC[-14]-RC[1])/RC[-18]*100 -> #VALUE! | AC75: =VALUE(RC[-27]) -> #VALUE! | AD75: =IF(RC[21]=42,"*",IF(RC[21]=32,"",RC[21])) ->  | AE75: =RC[-28] ->  | AF75: =RC[-28] ->  | AG75: =RC[-28] ->  | AH75: =RC[-28] ->  | AI75: =RC[-28] ->  | AJ75: =RC[-28] ->  | AK75: =RC[-28] ->  | AL75: =RC[-28] -> 0 | AM75: =RC[-28] ->  | AN75: =RC[-28] ->  | AO75: =RC[-28] ->  | AP75: - | AQ75: =RC[-29] -> 0 | AR75: =RC[-29] -> 0 | AS75: - | AT75: =RC[-30] -> 0 | AU75: =RC[-30] -> 0 | AV75: =RC[-30] ->  | AW75: =RC[-30] -> 
A76: =IF(RC[1]="","",DATEVALUE(RC[1])) ->  | T76: =(RC[-16]*RC[-15]-RC[-13]*RC[-12])/1000 -> #VALUE! | W76: =RC[-2]*RC[-10]/1000 -> #VALUE! | X76: =ABS((RC[-3]*RC[-11]-RC[-2]*RC[-9])/1000) -> #VALUE! | Y76: =(RC[-14]-RC[1])/RC[-18]*100 -> #VALUE! | AC76: =VALUE(RC[-27]) -> #VALUE! | AD76: =IF(RC[21]=42,"*",IF(RC[21]=32,"",RC[21])) ->  | AE76: =RC[-28] ->  | AF76: =RC[-28] ->  | AG76: =RC[-28] ->  | AH76: =RC[-28] ->  | AI76: =RC[-28] ->  | AJ76: =RC[-28] ->  | AK76: =RC[-28] ->  | AL76: =RC[-28] -> 0 | AM76: =RC[-28] ->  | AN76: =RC[-28] ->  | AO76: =RC[-28] ->  | AP76: - | AQ76: =RC[-29] -> 0 | AR76: =RC[-29] -> 0 | AS76: - | AT76: =RC[-30] -> 0 | AU76: =RC[-30] -> 0 | AV76: =RC[-30] ->  | AW76: =RC[-30] -> 
A77: =IF(RC[1]="","",DATEVALUE(RC[1])) ->  | T77: =(RC[-16]*RC[-15]-RC[-13]*RC[-12])/1000 -> #VALUE! | W77: =RC[-2]*RC[-10]/1000 -> #VALUE! | X77: =ABS((RC[-3]*RC[-11]-RC[-2]*RC[-9])/1000) -> #VALUE! | Y77: =(RC[-14]-RC[1])/RC[-18]*100 -> #VALUE! | AC77: =VALUE(RC[-27]) -> #VALUE! | AD77: =IF(RC[21]=42,"*",IF(RC[21]=32,"",RC[21])) ->  | AE77: =RC[-28] ->  | AF77: =RC[-28] ->  | AG77: =RC[-28] ->  | AH77: =RC[-28] ->  | AI77: =RC[-28] ->  | AJ77: =RC[-28] ->  | AK77: =RC[-28] ->  | AL77: =RC[-28] -> 0 | AM77: =RC[-28] ->  | AN77: =RC[-28] ->  | AO77: =RC[-28] ->  | AP77: - | AQ77: =RC[-29] -> 0 | AR77: =RC[-29] -> 0 | AS77: - | AT77: =RC[-30] -> 0 | AU77: =RC[-30] -> 0 | AV77: =RC[-30] ->  | AW77: =RC[-30] -> 
A78: =IF(RC[1]="","",DATEVALUE(RC[1])) ->  | T78: =(RC[-16]*RC[-15]-RC[-13]*RC[-12])/1000 -> #VALUE! | W78: =RC[-2]*RC[-10]/1000 -> #VALUE! | X78: =ABS((RC[-3]*RC[-11]-RC[-2]*RC[-9])/1000) -> #VALUE! | Y78: =(RC[-14]-RC[1])/RC[-18]*100 -> #VALUE! | AC78: =VALUE(RC[-27]) -> #VALUE! | AD78: =IF(RC[21]=42,"*",IF(RC[21]=32,"",RC[21])) ->  | AE78: =RC[-28] ->  | AF78: =RC[-28] ->  | AG78: =RC[-28] ->  | AH78: =RC[-28] ->  | AI78: =RC[-28] ->  | AJ78: =RC[-28] ->  | AK78: =RC[-28] ->  | AL78: =RC[-28] -> 0 | AM78: =RC[-28] ->  | AN78: =RC[-28] ->  | AO78: =RC[-28] ->  | AP78: - | AQ78: =RC[-29] -> 0 | AR78: =RC[-29] -> 0 | AS78: - | AT78: =RC[-30] -> 0 | AU78: =RC[-30] -> 0 | AV78: =RC[-30] ->  | AW78: =RC[-30] -> 
A79: =IF(RC[1]="","",DATEVALUE(RC[1])) ->  | T79: =(RC[-16]*RC[-15]-RC[-13]*RC[-12])/1000 -> #VALUE! | W79: =RC[-2]*RC[-10]/1000 -> #VALUE! | X79: =ABS((RC[-3]*RC[-11]-RC[-2]*RC[-9])/1000) -> #VALUE! | Y79: =(RC[-14]-RC[1])/RC[-18]*100 -> #VALUE! | AC79: =VALUE(RC[-27]) -> #VALUE! | AD79: =IF(RC[21]=42,"*",IF(RC[21]=32,"",RC[21])) ->  | AE79: =RC[-28] ->  | AF79: =RC[-28] ->  | AG79: =RC[-28] ->  | AH79: =RC[-28] ->  | AI79: =RC[-28] ->  | AJ79: =RC[-28] ->  | AK79: =RC[-28] ->  | AL79: =RC[-28] -> 0 | AM79: =RC[-28] ->  | AN79: =RC[-28] ->  | AO79: =RC[-28] ->  | AP79: - | AQ79: =RC[-29] -> 0 | AR79: =RC[-29] -> 0 | AS79: - | AT79: =RC[-30] -> 0 | AU79: =RC[-30] -> 0 | AV79: =RC[-30] ->  | AW79: =RC[-30] -> 
A80: =IF(RC[1]="","",DATEVALUE(RC[1])) ->  | T80: =(RC[-16]*RC[-15]-RC[-13]*RC[-12])/1000 -> #VALUE! | W80: =RC[-2]*RC[-10]/1000 -> #VALUE! | X80: =ABS((RC[-3]*RC[-11]-RC[-2]*RC[-9])/1000) -> #VALUE! | Y80: =(RC[-14]-RC[1])/RC[-18]*100 -> #VALUE! | AC80: =VALUE(RC[-27]) -> #VALUE! | AD80: =IF(RC[21]=42,"*",IF(RC[21]=32,"",RC[21])) ->  | AE80: =RC[-28] ->  | AF80: =RC[-28] ->  | AG80: =RC[-28] ->  | AH80: =RC[-28] ->  | AI80: =RC[-28] ->  | AJ80: =RC[-28] ->  | AK80: =RC[-28] ->  | AL80: =RC[-28] -> 0 | AM80: =RC[-28] ->  | AN80: =RC[-28] ->  | AO80: =RC[-28] ->  | AP80: - | AQ80: =RC[-29] -> 0 | AR80: =RC[-29] -> 0 | AS80: - | AT80: =RC[-30] -> 0 | AU80: =RC[-30] -> 0 | AV80: =RC[-30] ->  | AW80: =RC[-30] -> 
A81: =IF(RC[1]="","",DATEVALUE(RC[1])) ->  | T81: =(RC[-16]*RC[-15]-RC[-13]*RC[-12])/1000 -> #VALUE! | W81: =RC[-2]*RC[-10]/1000 -> #VALUE! | X81: =ABS((RC[-3]*RC[-11]-RC[-2]*RC[-9])/1000) -> #VALUE! | Y81: =(RC[-14]-RC[1])/RC[-18]*100 -> #VALUE! | AC81: =VALUE(RC[-27]) -> #VALUE! | AD81: =IF(RC[21]=42,"*",IF(RC[21]=32,"",RC[21])) ->  | AE81: =RC[-28] ->  | AF81: =RC[-28] ->  | AG81: =RC[-28] ->  | AH81: =RC[-28] ->  | AI81: =RC[-28] ->  | AJ81: =RC[-28] ->  | AK81: =RC[-28] ->  | AL81: =RC[-28] -> 0 | AM81: =RC[-28] ->  | AN81: =RC[-28] ->  | AO81: =RC[-28] ->  | AP81: - | AQ81: =RC[-29] -> 0 | AR81: =RC[-29] -> 0 | AS81: - | AT81: =RC[-30] -> 0 | AU81: =RC[-30] -> 0 | AV81: =RC[-30] ->  | AW81: =RC[-30] -> 
A82: =IF(RC[1]="","",DATEVALUE(RC[1])) ->  | T82: =(RC[-16]*RC[-15]-RC[-13]*RC[-12])/1000 -> #VALUE! | W82: =RC[-2]*RC[-10]/1000 -> #VALUE! | X82: =ABS((RC[-3]*RC[-11]-RC[-2]*RC[-9])/1000) -> #VALUE! | Y82: =(RC[-14]-RC[1])/RC[-18]*100 -> #VALUE! | AC82: =VALUE(RC[-27]) -> #VALUE! | AD82: =IF(RC[21]=42,"*",IF(RC[21]=32,"",RC[21])) ->  | AE82: =RC[-28] ->  | AF82: =RC[-28] ->  | AG82: =RC[-28] ->  | AH82: =RC[-28] ->  | AI82: =RC[-28] ->  | AJ82: =RC[-28] ->  | AK82: =RC[-28] ->  | AL82: =RC[-28] -> 0 | AM82: =RC[-28] ->  | AN82: =RC[-28] ->  | AO82: =RC[-28] ->  | AP82: - | AQ82: =RC[-29] -> 0 | AR82: =RC[-29] -> 0 | AS82: - | AT82: =RC[-30] -> 0 | AU82: =RC[-30] -> 0 | AV82: =RC[-30] ->  | AW82: =RC[-30] -> 
A83: =IF(RC[1]="","",DATEVALUE(RC[1])) ->  | T83: =(RC[-16]*RC[-15]-RC[-13]*RC[-12])/1000 -> #VALUE! | W83: =RC[-2]*RC[-10]/1000 -> #VALUE! | X83: =ABS((RC[-3]*RC[-11]-RC[-2]*RC[-9])/1000) -> #VALUE! | Y83: =(RC[-14]-RC[1])/RC[-18]*100 -> #VALUE! | AC83: =VALUE(RC[-27]) -> #VALUE! | AD83: =IF(RC[21]=42,"*",IF(RC[21]=32,"",RC[21])) ->  | AE83: =RC[-28] ->  | AF83: =RC[-28] ->  | AG83: =RC[-28] ->  | AH83: =RC[-28] ->  | AI83: =RC[-28] ->  | AJ83: =RC[-28] ->  | AK83: =RC[-28] ->  | AL83: =RC[-28] -> 0 | AM83: =RC[-28] ->  | AN83: =RC[-28] ->  | AO83: =RC[-28] ->  | AP83: - | AQ83: =RC[-29] -> 0 | AR83: =RC[-29] -> 0 | AS83: - | AT83: =RC[-30] -> 0 | AU83: =RC[-30] -> 0 | AV83: =RC[-30] ->  | AW83: =RC[-30] -> 
AC84: Среднее | AF84: =R[1]C[-28] -> 162.39066666666665 | AG84: =R[1]C[-28] -> 69.197999999999993 | AH84: =R[1]C[-28] -> 6.8183333333333334 | AI84: =R[1]C[-28] -> 143.65700000000001 | AJ84: =R[1]C[-28] -> 44.085333333333331 | AK84: =R[1]C[-28] -> 5.4733333333333336 | AL84: =R[1]C[-28] -> 25.112666666666659 | AM84: =R[1]C[-28] -> 18.733666666666668 | AN84: =R[1]C[-28] -> 21.926333333333329 | AO84: =R[1]C[-28] -> 68.557666666666663 | AP84: - | AQ84: =R[1]C[-29] -> 0 | AR84: =R[1]C[-29] -> 0 | AS84: - | AT84: =R[1]C[-30] -> 0 | AU84: =R[1]C[-30] -> 0
B85: Среднее | D85: =AVERAGE(OFFSET(R[-74]C,3,0,R7C1,1)) -> 162.39066666666665 | E85: =AVERAGE(OFFSET(R[-74]C,3,0,R7C1,1)) -> 69.197999999999993 | F85: =AVERAGE(OFFSET(R[-74]C,3,0,R7C1,1)) -> 6.8183333333333334 | G85: =AVERAGE(OFFSET(R[-74]C,3,0,R7C1,1)) -> 143.65700000000001 | H85: =AVERAGE(OFFSET(R[-74]C,3,0,R7C1,1)) -> 44.085333333333331 | I85: =AVERAGE(OFFSET(R[-74]C,3,0,R7C1,1)) -> 5.4733333333333336 | J85: =AVERAGE(OFFSET(R[-74]C,3,0,R7C1,1)) -> 25.112666666666659 | K85: =AVERAGE(OFFSET(R[-74]C,3,0,R7C1,1)) -> 18.733666666666668 | L85: =IF(SUM(OFFSET(R[-74]C,3,0,R7C1,1))=0,"",AVERAGE(OFFSET(R[-74]C,3,0,R7C1,1))) -> 21.926333333333329 | M85: =IF(SUM(OFFSET(R[-74]C,3,0,R7C1,1))=0,"",AVERAGE(OFFSET(R[-74]C,3,0,R7C1,1))) -> 68.557666666666663 | R85: =IF(SUM(OFFSET(R[-74]C,3,0,R7C1,1))=0,"",AVERAGE(OFFSET(R[-74]C,3,0,R7C1,1))) -> 1.4700999999999997 | S85: =AVERAGE(OFFSET(R[-74]C,3,0,R7C1,1)) -> 5.0696048044444444 | T85: =AVERAGE(OFFSET(R[-74]C,3,0,R7C1,1)) -> 4.9942483711111114 | W85: =AVERAGE(OFFSET(R[-74]C,3,0,R7C1,1)) -> 1.4696795066666666 | X85: =AVERAGE(OFFSET(R[-74]C,3,0,R7C1,1)) -> #VALUE! | AC85: Итого | AE85: =R[1]C[-28] -> 720 | AF85: =R[1]C[-28] -> 4871.7199999999993 | AI85: =R[1]C[-28] -> 4309.71 | AM85: =R[1]C[-28] -> 562.01 | AN85: =R[1]C[-28] -> 657.78999999999985 | AQ85: =R[1]C[-29] -> 0 | AU85: =R[1]C[-30] -> 0 | AV85: =R[1]C[-30] -> 44.102999999999994 | AW85: =R[1]C[-30] -> 152.08814413333334
B86: ИТОГО: | C86: =SUM(OFFSET(R[-75]C,3,0,R7C1,1)) -> 720 | D86: =SUM(OFFSET(R[-75]C,3,0,R7C1,1)) -> 4871.7199999999993 | G86: =SUM(OFFSET(R[-75]C,3,0,R7C1,1)) -> 4309.71 | K86: =SUM(OFFSET(R[-75]C,3,0,R7C1,1)) -> 562.01 | L86: =IF(SUM(OFFSET(R[-75]C,3,0,R7C1,1))=0,"",SUM(OFFSET(R[-75]C,3,0,R7C1,1))) -> 657.78999999999985 | R86: =IF(SUM(OFFSET(R[-75]C,3,0,R7C1,1))=0,"",SUM(OFFSET(R[-75]C,3,0,R7C1,1))) -> 44.102999999999994 | S86: =SUM(OFFSET(R[-75]C,3,0,R7C1,1)) -> 152.08814413333334 | T86: =SUM(OFFSET(R[-75]C,3,0,R7C1,1)) -> 149.82745113333334 | W86: =SUM(OFFSET(R[-75]C,3,0,R7C1,1)) -> 44.0903852 | X86: =SUM(OFFSET(R[-75]C,3,0,R7C1,1)) -> #VALUE!
AC87: Досчёт | AF87: =R[1]C[-28] -> 0 | AI87: =R[1]C[-28] -> 0 | AM87: =R[1]C[-28] -> 0 | AN87: =R[1]C[-28] -> 0 | AQ87: =R[1]C[-29] -> 0 | AU87: =R[1]C[-30] -> 0 | AV87: =R[1]C[-30] -> 0 | AW87: =R[1]C[-30] -> 0
A88: 11дн=264ч 4дн=96ч | B88: Досчёт до конца м-ца (+) | C88: =R6C1*24 -> 216 | T88: № 54148 | AC88: Снятие | AF88: =-R[1]C[-28] -> 0 | AI88: =-R[1]C[-28] -> 0 | AM88: =-R[1]C[-28] -> 0 | AN88: =-R[1]C[-28] -> 0 | AQ88: =-R[1]C[-29] -> 0 | AU88: =-R[1]C[-30] -> 0 | AV88: =-R[1]C[-30] -> 0 | AW88: =-R[1]C[-30] -> 0
A89: 9дн=216ч 7дн=168ч | B89: Вычет с предыдущего (-) | C89: =R4C1*24 -> 192 | AC89: Сумма | AF89: =R[1]C[-28] -> 4871.7199999999993 | AI89: =R[1]C[-28] -> 4309.71 | AM89: =R[1]C[-28] -> 562.01 | AN89: =R[1]C[-28] -> 657.78999999999985 | AQ89: =R[1]C[-29] -> 0 | AU89: =R[1]C[-30] -> 0 | AV89: =R[1]C[-30] -> 44.102999999999994 | AW89: =R[1]C[-30] -> 152.08814413333334
B90: СУММА: | C90: =R[-4]C+R[-2]C-R[-1]C -> 744 | D90: =R[-4]C+R[-2]C-R[-1]C -> 4871.7199999999993 | G90: =R[-4]C+R[-2]C-R[-1]C -> 4309.71 | K90: =R[-4]C+R[-2]C-R[-1]C -> 562.01 | L90: =IF(SUM(OFFSET(R[-79]C,3,0,R7C1,1))=0,"",(R[-4]C+R[-2]C-R[-1]C)) -> 657.78999999999985 | R90: =IF(SUM(OFFSET(R[-79]C,3,0,R7C1,1))=0,"",(R[-4]C+R[-2]C-R[-1]C)) -> 44.102999999999994 | S90: =R[-4]C+R[-2]C-R[-1]C -> 152.08814413333334
AC91: Тхв на источнике | AE91: V гвс (м3) | AF91: =R[-2]C[15] -> 0 | AG91: W гвс (Гкал) | AH91: =RC[-2]*0.06 -> 0 | AI91: W без гвс (Гкал) | AJ91: =R[-2]C[13]-RC[-2] -> 152.08814413333334
B92: Показания счетчиков на момент снятия данных:
B93: Дата, время | D93: М1, т | F93: М2, т | H93: М3, т | J93: М4, т | L93: Qо, Гкал | N93: Qг, Гкал | P93: время, час
B94: 23.09.18 02:00 | D94: 167161.65 | F94: 142717.25 | H94: 28518.5 | J94: - | L94: 5251.1660000000002 | N94: 2062.1320000000001 | P94: -
B95: 23.10.18 00:00 | D95: 172052.91 | F95: 147013.60999999999 | H95: 29161.56 | J95: - | L95: 5401.6710000000003 | N95: 2106.1619999999998 | P95: -
AC97: =ZAYAVKA_N -> з.н д. №02/147-2783 от 04.10.18 с 26.09.18г по 28.09.18г некорректная работа приборов
B98: Представитель потребителя:_______________________________________________________________________ В.О. Топорков
I101: Рекомендуемые значения по параметрам теплопотребления (не являются официально утверждёнными)
I102: М, т | J102: V, м3 | K102: Qгвс, Гкал | L102: Qотоп, Гкал | M102: Qо, Гкал
I103: =R[-13]C[-3] -> 0 | J103: =RC[-1]/0.98 -> 0 | K103: =RC[-1]*0.06 -> 0 | L103: =RC[1]-RC[-1] -> 44.102999999999994 | M103: =R[-13]C[5] -> 44.102999999999994
O105: ДЛЯ САМОКОНТРОЛЯ
B106: В строке выбора дат указать период с 16.7.13 по 23.8.13 - жильё | N106: Q | O106: Qг
B107: В строке выбора дат указать период с 18.7.13 по 25.8.13 - не жилое | N107: =(R[-21]C[-10]*R[-22]C[-7]-R[-21]C[-9]*R[-22]C[-6])/1000 -> 699.85668004000001 | O107: =IF(R[-22]C[-2]="",R[-21]C[-3]*R[-22]C/1000,"") ->  | P107: Си2
O108: =IF(R[-23]C[-2]="","",((R[-22]C[-3]*R[-23]C)-(R[-22]C[-2]*R[-23]C[2]))/1000) -> 0 | P108: Си3