Sheet: Лист1
G1: Отчёт о теплопотреблении за сентябрь 2018 | M1: з. на доп.№ 02/147-2548 от 5.10.2017
A4: =EOMONTH(R[9]C,0)-R[9]C -> 9 | B4: Потребитель: ЗАО "Сити Сервис"
A5: =MAX(R[9]C:R[78]C) -> 2018-09-22T00:00:00.000 | B5: Адрес: г. СПб, Кораблестроителей ул., д.29 к.1 ИТП 2
A6: =EOMONTH(R[-1]C,0)-R[-1]C -> 8 | B6: Телефон: 8-911-021-19-79
A7: =R[-2]C-R[6]C -> 31 | B7: Договор 10023-2 (.) 14399
A8: 7 | B8: Тепловычислитель: ВКТ-7 № 107106 | L8: М2 мах= | M8: 256.8 | O8: Мгвс мах= | P8: 75.84
L9: Qотоп мах= | M9: 20.64 | O9: Qгвс мах= | P9: 4.55
B10: Расчётная формула: Q=M1*(h1-h2)+(M1-M2)*(h2-hхв)
D12: Учет | L12: Контроль
A13: =R[1]C[1]-1 -> 2018-08-22T00:00:00.000 | B13: Дата | C13: N, ч | D13: M1, т | E13: T1, С | F13: P1, кг/см2 | G13: M2, т | H13: T2, С | I13: P2, кг/см2 | J13: dT, С | K13: M1-М2, т | L13: V3, м3 | M13: T3, С | N13: V4, м3 | O13: =IF(R[-12]C[-14]="м.куб","","T4, С") -> T4, С | P13: dT, С | Q13: V3-V4, м3 | R13: Qгвс, Гкал | S13: Qобщ., Гкал | T13: Q | U13: M3 | V13: M4 | W13: си2 | X13: си3 | Y13: Разб. | Z13: dM2 | AC13: Дата | AD13: НС | AE13: n, ч | AF13: М1, т | AG13: t1, гр. С | AH13: Р1, кгс/см2 | AI13: М2, т | AJ13: t2, гр. С | AK13: Р2, кгс/см2 | AL13: t1-t2, гр. С | AM13: М1-М2, т | AN13: М1гвс, т | AO13: t1гвс, гр. С | AP13: Р1гвс, кгс/см2 | AQ13: М2гвс, т | AR13: t2гвс, гр. С | AS13: Р2гвс, кгс/см2 | AT13: t1гвс-t2гвс | AU13: М1гвс-М2гвс, т | AV13: Wгвс, Гкал | AW13: Wсумм, Гкал | AY13: NS_TV1 | AZ13: НС | BA13: NS_TV2
A14: =IF(RC[1]="","",DATEVALUE(RC[1])) -> 43335 | B14: 23.08.18 | C14: 24 | L14: 34.090000000000003 | M14: 58.44 | R14: 1.96 | S14: =RC[-1] -> 1.96 | T14: =(RC[-16]*RC[-15]-RC[-13]*RC[-12])/1000 -> 0 | U14: 33.56 | V14: - | W14: =RC[-2]*RC[-10]/1000 -> 1.9612464000000001 | X14: =ABS((RC[-3]*RC[-11]-RC[-2]*RC[-9])/1000) -> #VALUE! | Y14: =(RC[-14]-RC[1])/RC[-18]*100 -> #DIV/0! | Z14: 33.56 | AC14: =VALUE(RC[-27]) -> 2018-08-23T00:00:00.000 | AD14: =IF(RC[21]=42,"*",IF(RC[21]=32,"",RC[21])) -> - | AE14: =RC[-28] -> 24 | AF14: =RC[-28] -> 0 | AG14: =RC[-28] -> 0 | AH14: =RC[-28] -> 0 | AI14: =RC[-28] -> 0 | AJ14: =RC[-28] -> 0 | AK14: =RC[-28] -> 0 | AL14: =RC[-28] -> 0 | AM14: =RC[-28] -> 0 | AN14: =RC[-28] -> 34.090000000000003 | AO14: =RC[-28] -> 58.44 | AP14: - | AQ14: =RC[-29] -> 0 | AR14: =RC[-29] -> 0 | AS14: - | AT14: =RC[-30] -> 0 | AU14: =RC[-30] -> 0 | AV14: =RC[-30] -> 1.96 | AW14: =RC[-30] -> 1.96 | AY14: - | AZ14: - | BA14: -
A15: =IF(RC[1]="","",DATEVALUE(RC[1])) -> 43336 | B15: 24.08.18 | C15: 24 | L15: 33.81 | M15: 58.61 | R15: 1.9490000000000001 | S15: =RC[-1] -> 1.9490000000000001 | T15: =(RC[-16]*RC[-15]-RC[-13]*RC[-12])/1000 -> 0 | U15: 33.270000000000003 | V15: - | W15: =RC[-2]*RC[-10]/1000 -> 1.9499547000000002 | X15: =ABS((RC[-3]*RC[-11]-RC[-2]*RC[-9])/1000) -> #VALUE! | Y15: =(RC[-14]-RC[1])/RC[-18]*100 -> #DIV/0! | Z15: 33.270000000000003 | AC15: =VALUE(RC[-27]) -> 2018-08-24T00:00:00.000 | AD15: =IF(RC[21]=42,"*",IF(RC[21]=32,"",RC[21])) -> - | AE15: =RC[-28] -> 24 | AF15: =RC[-28] -> 0 | AG15: =RC[-28] -> 0 | AH15: =RC[-28] -> 0 | AI15: =RC[-28] -> 0 | AJ15: =RC[-28] -> 0 | AK15: =RC[-28] -> 0 | AL15: =RC[-28] -> 0 | AM15: =RC[-28] -> 0 | AN15: =RC[-28] -> 33.81 | AO15: =RC[-28] -> 58.61 | AP15: - | AQ15: =RC[-29] -> 0 | AR15: =RC[-29] -> 0 | AS15: - | AT15: =RC[-30] -> 0 | AU15: =RC[-30] -> 0 | AV15: =RC[-30] -> 1.9490000000000001 | AW15: =RC[-30] -> 1.9490000000000001 | AY15: - | AZ15: - | BA15: -
A16: =IF(RC[1]="","",DATEVALUE(RC[1])) -> 43337 | B16: 25.08.18 | C16: 24 | L16: 31.83 | M16: 58.18 | R16: 1.825 | S16: =RC[-1] -> 1.825 | T16: =(RC[-16]*RC[-15]-RC[-13]*RC[-12])/1000 -> 0 | U16: 31.33 | V16: - | W16: =RC[-2]*RC[-10]/1000 -> 1.8227793999999999 | X16: =ABS((RC[-3]*RC[-11]-RC[-2]*RC[-9])/1000) -> #VALUE! | Y16: =(RC[-14]-RC[1])/RC[-18]*100 -> #DIV/0! | Z16: 31.33 | AC16: =VALUE(RC[-27]) -> 2018-08-25T00:00:00.000 | AD16: =IF(RC[21]=42,"*",IF(RC[21]=32,"",RC[21])) -> - | AE16: =RC[-28] -> 24 | AF16: =RC[-28] -> 0 | AG16: =RC[-28] -> 0 | AH16: =RC[-28] -> 0 | AI16: =RC[-28] -> 0 | AJ16: =RC[-28] -> 0 | AK16: =RC[-28] -> 0 | AL16: =RC[-28] -> 0 | AM16: =RC[-28] -> 0 | AN16: =RC[-28] -> 31.83 | AO16: =RC[-28] -> 58.18 | AP16: - | AQ16: =RC[-29] -> 0 | AR16: =RC[-29] -> 0 | AS16: - | AT16: =RC[-30] -> 0 | AU16: =RC[-30] -> 0 | AV16: =RC[-30] -> 1.825 | AW16: =RC[-30] -> 1.825 | AY16: - | AZ16: - | BA16: -
A17: =IF(RC[1]="","",DATEVALUE(RC[1])) -> 43338 | B17: 26.08.18 | C17: 24 | L17: 33.020000000000003 | M17: 58.62 | R17: 1.905 | S17: =RC[-1] -> 1.905 | T17: =(RC[-16]*RC[-15]-RC[-13]*RC[-12])/1000 -> 0 | U17: 32.49 | V17: - | W17: =RC[-2]*RC[-10]/1000 -> 1.9045638 | X17: =ABS((RC[-3]*RC[-11]-RC[-2]*RC[-9])/1000) -> #VALUE! | Y17: =(RC[-14]-RC[1])/RC[-18]*100 -> #DIV/0! | Z17: 32.49 | AC17: =VALUE(RC[-27]) -> 2018-08-26T00:00:00.000 | AD17: =IF(RC[21]=42,"*",IF(RC[21]=32,"",RC[21])) -> - | AE17: =RC[-28] -> 24 | AF17: =RC[-28] -> 0 | AG17: =RC[-28] -> 0 | AH17: =RC[-28] -> 0 | AI17: =RC[-28] -> 0 | AJ17: =RC[-28] -> 0 | AK17: =RC[-28] -> 0 | AL17: =RC[-28] -> 0 | AM17: =RC[-28] -> 0 | AN17: =RC[-28] -> 33.020000000000003 | AO17: =RC[-28] -> 58.62 | AP17: - | AQ17: =RC[-29] -> 0 | AR17: =RC[-29] -> 0 | AS17: - | AT17: =RC[-30] -> 0 | AU17: =RC[-30] -> 0 | AV17: =RC[-30] -> 1.905 | AW17: =RC[-30] -> 1.905 | AY17: - | AZ17: - | BA17: -
A18: =IF(RC[1]="","",DATEVALUE(RC[1])) -> 43339 | B18: 27.08.18 | C18: 24 | L18: 34.67 | M18: 58.93 | R18: 2.012 | S18: =RC[-1] -> 2.012 | T18: =(RC[-16]*RC[-15]-RC[-13]*RC[-12])/1000 -> 0 | U18: 34.11 | V18: - | W18: =RC[-2]*RC[-10]/1000 -> 2.0101023000000002 | X18: =ABS((RC[-3]*RC[-11]-RC[-2]*RC[-9])/1000) -> #VALUE! | Y18: =(RC[-14]-RC[1])/RC[-18]*100 -> #DIV/0! | Z18: 34.11 | AC18: =VALUE(RC[-27]) -> 2018-08-27T00:00:00.000 | AD18: =IF(RC[21]=42,"*",IF(RC[21]=32,"",RC[21])) -> - | AE18: =RC[-28] -> 24 | AF18: =RC[-28] -> 0 | AG18: =RC[-28] -> 0 | AH18: =RC[-28] -> 0 | AI18: =RC[-28] -> 0 | AJ18: =RC[-28] -> 0 | AK18: =RC[-28] -> 0 | AL18: =RC[-28] -> 0 | AM18: =RC[-28] -> 0 | AN18: =RC[-28] -> 34.67 | AO18: =RC[-28] -> 58.93 | AP18: - | AQ18: =RC[-29] -> 0 | AR18: =RC[-29] -> 0 | AS18: - | AT18: =RC[-30] -> 0 | AU18: =RC[-30] -> 0 | AV18: =RC[-30] -> 2.012 | AW18: =RC[-30] -> 2.012 | AY18: - | AZ18: - | BA18: -
A19: =IF(RC[1]="","",DATEVALUE(RC[1])) -> 43340 | B19: 28.08.18 | C19: 24 | L19: 33.799999999999997 | M19: 59.24 | R19: 1.9710000000000001 | S19: =RC[-1] -> 1.9710000000000001 | T19: =(RC[-16]*RC[-15]-RC[-13]*RC[-12])/1000 -> 0 | U19: 33.26 | V19: - | W19: =RC[-2]*RC[-10]/1000 -> 1.9703223999999999 | X19: =ABS((RC[-3]*RC[-11]-RC[-2]*RC[-9])/1000) -> #VALUE! | Y19: =(RC[-14]-RC[1])/RC[-18]*100 -> #DIV/0! | Z19: 33.26 | AC19: =VALUE(RC[-27]) -> 2018-08-28T00:00:00.000 | AD19: =IF(RC[21]=42,"*",IF(RC[21]=32,"",RC[21])) -> - | AE19: =RC[-28] -> 24 | AF19: =RC[-28] -> 0 | AG19: =RC[-28] -> 0 | AH19: =RC[-28] -> 0 | AI19: =RC[-28] -> 0 | AJ19: =RC[-28] -> 0 | AK19: =RC[-28] -> 0 | AL19: =RC[-28] -> 0 | AM19: =RC[-28] -> 0 | AN19: =RC[-28] -> 33.799999999999997 | AO19: =RC[-28] -> 59.24 | AP19: - | AQ19: =RC[-29] -> 0 | AR19: =RC[-29] -> 0 | AS19: - | AT19: =RC[-30] -> 0 | AU19: =RC[-30] -> 0 | AV19: =RC[-30] -> 1.9710000000000001 | AW19: =RC[-30] -> 1.9710000000000001 | AY19: - | AZ19: - | BA19: -
A20: =IF(RC[1]="","",DATEVALUE(RC[1])) -> 43341 | B20: 29.08.18 | C20: 24 | L20: 37.92 | M20: 59.41 | R20: 2.2210000000000001 | S20: =RC[-1] -> 2.2210000000000001 | T20: =(RC[-16]*RC[-15]-RC[-13]*RC[-12])/1000 -> 0 | U20: 37.33 | V20: - | W20: =RC[-2]*RC[-10]/1000 -> 2.2177753 | X20: =ABS((RC[-3]*RC[-11]-RC[-2]*RC[-9])/1000) -> #VALUE! | Y20: =(RC[-14]-RC[1])/RC[-18]*100 -> #DIV/0! | Z20: 37.33 | AC20: =VALUE(RC[-27]) -> 2018-08-29T00:00:00.000 | AD20: =IF(RC[21]=42,"*",IF(RC[21]=32,"",RC[21])) -> - | AE20: =RC[-28] -> 24 | AF20: =RC[-28] -> 0 | AG20: =RC[-28] -> 0 | AH20: =RC[-28] -> 0 | AI20: =RC[-28] -> 0 | AJ20: =RC[-28] -> 0 | AK20: =RC[-28] -> 0 | AL20: =RC[-28] -> 0 | AM20: =RC[-28] -> 0 | AN20: =RC[-28] -> 37.92 | AO20: =RC[-28] -> 59.41 | AP20: - | AQ20: =RC[-29] -> 0 | AR20: =RC[-29] -> 0 | AS20: - | AT20: =RC[-30] -> 0 | AU20: =RC[-30] -> 0 | AV20: =RC[-30] -> 2.2210000000000001 | AW20: =RC[-30] -> 2.2210000000000001 | AY20: - | AZ20: - | BA20: -
A21: =IF(RC[1]="","",DATEVALUE(RC[1])) -> 43342 | B21: 30.08.18 | C21: 24 | L21: 37.44 | M21: 57.54 | R21: 2.1230000000000002 | S21: =RC[-1] -> 2.1230000000000002 | T21: =(RC[-16]*RC[-15]-RC[-13]*RC[-12])/1000 -> 0 | U21: 36.85 | V21: - | W21: =RC[-2]*RC[-10]/1000 -> 2.120349 | X21: =ABS((RC[-3]*RC[-11]-RC[-2]*RC[-9])/1000) -> #VALUE! | Y21: =(RC[-14]-RC[1])/RC[-18]*100 -> #DIV/0! | Z21: 36.85 | AC21: =VALUE(RC[-27]) -> 2018-08-30T00:00:00.000 | AD21: =IF(RC[21]=42,"*",IF(RC[21]=32,"",RC[21])) -> - | AE21: =RC[-28] -> 24 | AF21: =RC[-28] -> 0 | AG21: =RC[-28] -> 0 | AH21: =RC[-28] -> 0 | AI21: =RC[-28] -> 0 | AJ21: =RC[-28] -> 0 | AK21: =RC[-28] -> 0 | AL21: =RC[-28] -> 0 | AM21: =RC[-28] -> 0 | AN21: =RC[-28] -> 37.44 | AO21: =RC[-28] -> 57.54 | AP21: - | AQ21: =RC[-29] -> 0 | AR21: =RC[-29] -> 0 | AS21: - | AT21: =RC[-30] -> 0 | AU21: =RC[-30] -> 0 | AV21: =RC[-30] -> 2.1230000000000002 | AW21: =RC[-30] -> 2.1230000000000002 | AY21: - | AZ21: - | BA21: -
A22: =IF(RC[1]="","",DATEVALUE(RC[1])) -> 43343 | B22: 31.08.18 | C22: 24 | L22: 34.97 | M22: 58.17 | R22: 2.0030000000000001 | S22: =RC[-1] -> 2.0030000000000001 | T22: =(RC[-16]*RC[-15]-RC[-13]*RC[-12])/1000 -> 0 | U22: 34.42 | V22: - | W22: =RC[-2]*RC[-10]/1000 -> 2.0022114000000002 | X22: =ABS((RC[-3]*RC[-11]-RC[-2]*RC[-9])/1000) -> #VALUE! | Y22: =(RC[-14]-RC[1])/RC[-18]*100 -> #DIV/0! | Z22: 34.42 | AC22: =VALUE(RC[-27]) -> 2018-08-31T00:00:00.000 | AD22: =IF(RC[21]=42,"*",IF(RC[21]=32,"",RC[21])) -> - | AE22: =RC[-28] -> 24 | AF22: =RC[-28] -> 0 | AG22: =RC[-28] -> 0 | AH22: =RC[-28] -> 0 | AI22: =RC[-28] -> 0 | AJ22: =RC[-28] -> 0 | AK22: =RC[-28] -> 0 | AL22: =RC[-28] -> 0 | AM22: =RC[-28] -> 0 | AN22: =RC[-28] -> 34.97 | AO22: =RC[-28] -> 58.17 | AP22: - | AQ22: =RC[-29] -> 0 | AR22: =RC[-29] -> 0 | AS22: - | AT22: =RC[-30] -> 0 | AU22: =RC[-30] -> 0 | AV22: =RC[-30] -> 2.0030000000000001 | AW22: =RC[-30] -> 2.0030000000000001 | AY22: - | AZ22: - | BA22: -
A23: =IF(RC[1]="","",DATEVALUE(RC[1])) -> 43344 | B23: 01.09.18 | C23: 24 | L23: 35.78 | M23: 58.82 | R23: 2.0739999999999998 | S23: =RC[-1] -> 2.0739999999999998 | T23: =(RC[-16]*RC[-15]-RC[-13]*RC[-12])/1000 -> 0 | U23: 35.21 | V23: - | W23: =RC[-2]*RC[-10]/1000 -> 2.0710522 | X23: =ABS((RC[-3]*RC[-11]-RC[-2]*RC[-9])/1000) -> #VALUE! | Y23: =(RC[-14]-RC[1])/RC[-18]*100 -> #DIV/0! | Z23: 35.21 | AC23: =VALUE(RC[-27]) -> 2018-09-01T00:00:00.000 | AD23: =IF(RC[21]=42,"*",IF(RC[21]=32,"",RC[21])) -> - | AE23: =RC[-28] -> 24 | AF23: =RC[-28] -> 0 | AG23: =RC[-28] -> 0 | AH23: =RC[-28] -> 0 | AI23: =RC[-28] -> 0 | AJ23: =RC[-28] -> 0 | AK23: =RC[-28] -> 0 | AL23: =RC[-28] -> 0 | AM23: =RC[-28] -> 0 | AN23: =RC[-28] -> 35.78 | AO23: =RC[-28] -> 58.82 | AP23: - | AQ23: =RC[-29] -> 0 | AR23: =RC[-29] -> 0 | AS23: - | AT23: =RC[-30] -> 0 | AU23: =RC[-30] -> 0 | AV23: =RC[-30] -> 2.0739999999999998 | AW23: =RC[-30] -> 2.0739999999999998 | AY23: - | AZ23: - | BA23: -
A24: =IF(RC[1]="","",DATEVALUE(RC[1])) -> 43345 | B24: 02.09.18 | C24: 24 | L24: 39.1 | M24: 59.73 | R24: 2.2999999999999998 | S24: =RC[-1] -> 2.2999999999999998 | T24: =(RC[-16]*RC[-15]-RC[-13]*RC[-12])/1000 -> 0 | U24: 38.47 | V24: - | W24: =RC[-2]*RC[-10]/1000 -> 2.2978130999999999 | X24: =ABS((RC[-3]*RC[-11]-RC[-2]*RC[-9])/1000) -> #VALUE! | Y24: =(RC[-14]-RC[1])/RC[-18]*100 -> #DIV/0! | Z24: 38.47 | AC24: =VALUE(RC[-27]) -> 2018-09-02T00:00:00.000 | AD24: =IF(RC[21]=42,"*",IF(RC[21]=32,"",RC[21])) -> - | AE24: =RC[-28] -> 24 | AF24: =RC[-28] -> 0 | AG24: =RC[-28] -> 0 | AH24: =RC[-28] -> 0 | AI24: =RC[-28] -> 0 | AJ24: =RC[-28] -> 0 | AK24: =RC[-28] -> 0 | AL24: =RC[-28] -> 0 | AM24: =RC[-28] -> 0 | AN24: =RC[-28] -> 39.1 | AO24: =RC[-28] -> 59.73 | AP24: - | AQ24: =RC[-29] -> 0 | AR24: =RC[-29] -> 0 | AS24: - | AT24: =RC[-30] -> 0 | AU24: =RC[-30] -> 0 | AV24: =RC[-30] -> 2.2999999999999998 | AW24: =RC[-30] -> 2.2999999999999998 | AY24: - | AZ24: - | BA24: -
A25: =IF(RC[1]="","",DATEVALUE(RC[1])) -> 43346 | B25: 03.09.18 | C25: 24 | L25: 36.200000000000003 | M25: 59.25 | R25: 2.11 | S25: =RC[-1] -> 2.11 | T25: =(RC[-16]*RC[-15]-RC[-13]*RC[-12])/1000 -> 0 | U25: 35.590000000000003 | V25: - | W25: =RC[-2]*RC[-10]/1000 -> 2.1087075 | X25: =ABS((RC[-3]*RC[-11]-RC[-2]*RC[-9])/1000) -> #VALUE! | Y25: =(RC[-14]-RC[1])/RC[-18]*100 -> #DIV/0! | Z25: 35.590000000000003 | AC25: =VALUE(RC[-27]) -> 2018-09-03T00:00:00.000 | AD25: =IF(RC[21]=42,"*",IF(RC[21]=32,"",RC[21])) -> - | AE25: =RC[-28] -> 24 | AF25: =RC[-28] -> 0 | AG25: =RC[-28] -> 0 | AH25: =RC[-28] -> 0 | AI25: =RC[-28] -> 0 | AJ25: =RC[-28] -> 0 | AK25: =RC[-28] -> 0 | AL25: =RC[-28] -> 0 | AM25: =RC[-28] -> 0 | AN25: =RC[-28] -> 36.200000000000003 | AO25: =RC[-28] -> 59.25 | AP25: - | AQ25: =RC[-29] -> 0 | AR25: =RC[-29] -> 0 | AS25: - | AT25: =RC[-30] -> 0 | AU25: =RC[-30] -> 0 | AV25: =RC[-30] -> 2.11 | AW25: =RC[-30] -> 2.11 | AY25: - | AZ25: - | BA25: -
A26: =IF(RC[1]="","",DATEVALUE(RC[1])) -> 43347 | B26: 04.09.18 | C26: 24 | L26: 34.71 | M26: 59.02 | R26: 2.0169999999999999 | S26: =RC[-1] -> 2.0169999999999999 | T26: =(RC[-16]*RC[-15]-RC[-13]*RC[-12])/1000 -> 0 | U26: 34.15 | V26: - | W26: =RC[-2]*RC[-10]/1000 -> 2.015533 | X26: =ABS((RC[-3]*RC[-11]-RC[-2]*RC[-9])/1000) -> #VALUE! | Y26: =(RC[-14]-RC[1])/RC[-18]*100 -> #DIV/0! | Z26: 34.15 | AC26: =VALUE(RC[-27]) -> 2018-09-04T00:00:00.000 | AD26: =IF(RC[21]=42,"*",IF(RC[21]=32,"",RC[21])) -> - | AE26: =RC[-28] -> 24 | AF26: =RC[-28] -> 0 | AG26: =RC[-28] -> 0 | AH26: =RC[-28] -> 0 | AI26: =RC[-28] -> 0 | AJ26: =RC[-28] -> 0 | AK26: =RC[-28] -> 0 | AL26: =RC[-28] -> 0 | AM26: =RC[-28] -> 0 | AN26: =RC[-28] -> 34.71 | AO26: =RC[-28] -> 59.02 | AP26: - | AQ26: =RC[-29] -> 0 | AR26: =RC[-29] -> 0 | AS26: - | AT26: =RC[-30] -> 0 | AU26: =RC[-30] -> 0 | AV26: =RC[-30] -> 2.0169999999999999 | AW26: =RC[-30] -> 2.0169999999999999 | AY26: - | AZ26: - | BA26: -
A27: =IF(RC[1]="","",DATEVALUE(RC[1])) -> 43348 | B27: 05.09.18 | C27: 24 | L27: 35.21 | M27: 58.95 | R27: 2.044 | S27: =RC[-1] -> 2.044 | T27: =(RC[-16]*RC[-15]-RC[-13]*RC[-12])/1000 -> 0 | U27: 34.65 | V27: - | W27: =RC[-2]*RC[-10]/1000 -> 2.0426175 | X27: =ABS((RC[-3]*RC[-11]-RC[-2]*RC[-9])/1000) -> #VALUE! | Y27: =(RC[-14]-RC[1])/RC[-18]*100 -> #DIV/0! | Z27: 34.65 | AC27: =VALUE(RC[-27]) -> 2018-09-05T00:00:00.000 | AD27: =IF(RC[21]=42,"*",IF(RC[21]=32,"",RC[21])) -> - | AE27: =RC[-28] -> 24 | AF27: =RC[-28] -> 0 | AG27: =RC[-28] -> 0 | AH27: =RC[-28] -> 0 | AI27: =RC[-28] -> 0 | AJ27: =RC[-28] -> 0 | AK27: =RC[-28] -> 0 | AL27: =RC[-28] -> 0 | AM27: =RC[-28] -> 0 | AN27: =RC[-28] -> 35.21 | AO27: =RC[-28] -> 58.95 | AP27: - | AQ27: =RC[-29] -> 0 | AR27: =RC[-29] -> 0 | AS27: - | AT27: =RC[-30] -> 0 | AU27: =RC[-30] -> 0 | AV27: =RC[-30] -> 2.044 | AW27: =RC[-30] -> 2.044 | AY27: - | AZ27: - | BA27: -
A28: =IF(RC[1]="","",DATEVALUE(RC[1])) -> 43349 | B28: 06.09.18 | C28: 24 | L28: 37.18 | M28: 59.37 | R28: 2.1709999999999998 | S28: =RC[-1] -> 2.1709999999999998 | T28: =(RC[-16]*RC[-15]-RC[-13]*RC[-12])/1000 -> 0 | U28: 36.549999999999997 | V28: - | W28: =RC[-2]*RC[-10]/1000 -> 2.1699734999999998 | X28: =ABS((RC[-3]*RC[-11]-RC[-2]*RC[-9])/1000) -> #VALUE! | Y28: =(RC[-14]-RC[1])/RC[-18]*100 -> #DIV/0! | Z28: 36.549999999999997 | AC28: =VALUE(RC[-27]) -> 2018-09-06T00:00:00.000 | AD28: =IF(RC[21]=42,"*",IF(RC[21]=32,"",RC[21])) -> - | AE28: =RC[-28] -> 24 | AF28: =RC[-28] -> 0 | AG28: =RC[-28] -> 0 | AH28: =RC[-28] -> 0 | AI28: =RC[-28] -> 0 | AJ28: =RC[-28] -> 0 | AK28: =RC[-28] -> 0 | AL28: =RC[-28] -> 0 | AM28: =RC[-28] -> 0 | AN28: =RC[-28] -> 37.18 | AO28: =RC[-28] -> 59.37 | AP28: - | AQ28: =RC[-29] -> 0 | AR28: =RC[-29] -> 0 | AS28: - | AT28: =RC[-30] -> 0 | AU28: =RC[-30] -> 0 | AV28: =RC[-30] -> 2.1709999999999998 | AW28: =RC[-30] -> 2.1709999999999998 | AY28: - | AZ28: - | BA28: -
A29: =IF(RC[1]="","",DATEVALUE(RC[1])) -> 43350 | B29: 07.09.18 | C29: 24 | L29: 33.96 | M29: 59.18 | R29: 1.9790000000000001 | S29: =RC[-1] -> 1.9790000000000001 | T29: =(RC[-16]*RC[-15]-RC[-13]*RC[-12])/1000 -> 0 | U29: 33.43 | V29: - | W29: =RC[-2]*RC[-10]/1000 -> 1.9783874000000001 | X29: =ABS((RC[-3]*RC[-11]-RC[-2]*RC[-9])/1000) -> #VALUE! | Y29: =(RC[-14]-RC[1])/RC[-18]*100 -> #DIV/0! | Z29: 33.43 | AC29: =VALUE(RC[-27]) -> 2018-09-07T00:00:00.000 | AD29: =IF(RC[21]=42,"*",IF(RC[21]=32,"",RC[21])) -> - | AE29: =RC[-28] -> 24 | AF29: =RC[-28] -> 0 | AG29: =RC[-28] -> 0 | AH29: =RC[-28] -> 0 | AI29: =RC[-28] -> 0 | AJ29: =RC[-28] -> 0 | AK29: =RC[-28] -> 0 | AL29: =RC[-28] -> 0 | AM29: =RC[-28] -> 0 | AN29: =RC[-28] -> 33.96 | AO29: =RC[-28] -> 59.18 | AP29: - | AQ29: =RC[-29] -> 0 | AR29: =RC[-29] -> 0 | AS29: - | AT29: =RC[-30] -> 0 | AU29: =RC[-30] -> 0 | AV29: =RC[-30] -> 1.9790000000000001 | AW29: =RC[-30] -> 1.9790000000000001 | AY29: - | AZ29: - | BA29: -
A30: =IF(RC[1]="","",DATEVALUE(RC[1])) -> 43351 | B30: 08.09.18 | C30: 24 | L30: 36.82 | M30: 59.39 | R30: 2.15 | S30: =RC[-1] -> 2.15 | T30: =(RC[-16]*RC[-15]-RC[-13]*RC[-12])/1000 -> 0 | U30: 36.24 | V30: - | W30: =RC[-2]*RC[-10]/1000 -> 2.1522936000000001 | X30: =ABS((RC[-3]*RC[-11]-RC[-2]*RC[-9])/1000) -> #VALUE! | Y30: =(RC[-14]-RC[1])/RC[-18]*100 -> #DIV/0! | Z30: 36.24 | AC30: =VALUE(RC[-27]) -> 2018-09-08T00:00:00.000 | AD30: =IF(RC[21]=42,"*",IF(RC[21]=32,"",RC[21])) -> - | AE30: =RC[-28] -> 24 | AF30: =RC[-28] -> 0 | AG30: =RC[-28] -> 0 | AH30: =RC[-28] -> 0 | AI30: =RC[-28] -> 0 | AJ30: =RC[-28] -> 0 | AK30: =RC[-28] -> 0 | AL30: =RC[-28] -> 0 | AM30: =RC[-28] -> 0 | AN30: =RC[-28] -> 36.82 | AO30: =RC[-28] -> 59.39 | AP30: - | AQ30: =RC[-29] -> 0 | AR30: =RC[-29] -> 0 | AS30: - | AT30: =RC[-30] -> 0 | AU30: =RC[-30] -> 0 | AV30: =RC[-30] -> 2.15 | AW30: =RC[-30] -> 2.15 | AY30: - | AZ30: - | BA30: -
A31: =IF(RC[1]="","",DATEVALUE(RC[1])) -> 43352 | B31: 09.09.18 | C31: 24 | L31: 40.08 | M31: 59.22 | R31: 2.335 | S31: =RC[-1] -> 2.335 | T31: =(RC[-16]*RC[-15]-RC[-13]*RC[-12])/1000 -> 0 | U31: 39.42 | V31: - | W31: =RC[-2]*RC[-10]/1000 -> 2.3344524 | X31: =ABS((RC[-3]*RC[-11]-RC[-2]*RC[-9])/1000) -> #VALUE! | Y31: =(RC[-14]-RC[1])/RC[-18]*100 -> #DIV/0! | Z31: 39.42 | AC31: =VALUE(RC[-27]) -> 2018-09-09T00:00:00.000 | AD31: =IF(RC[21]=42,"*",IF(RC[21]=32,"",RC[21])) -> - | AE31: =RC[-28] -> 24 | AF31: =RC[-28] -> 0 | AG31: =RC[-28] -> 0 | AH31: =RC[-28] -> 0 | AI31: =RC[-28] -> 0 | AJ31: =RC[-28] -> 0 | AK31: =RC[-28] -> 0 | AL31: =RC[-28] -> 0 | AM31: =RC[-28] -> 0 | AN31: =RC[-28] -> 40.08 | AO31: =RC[-28] -> 59.22 | AP31: - | AQ31: =RC[-29] -> 0 | AR31: =RC[-29] -> 0 | AS31: - | AT31: =RC[-30] -> 0 | AU31: =RC[-30] -> 0 | AV31: =RC[-30] -> 2.335 | AW31: =RC[-30] -> 2.335 | AY31: - | AZ31: - | BA31: -
A32: =IF(RC[1]="","",DATEVALUE(RC[1])) -> 43353 | B32: 10.09.18 | C32: 24 | L32: 37.770000000000003 | M32: 60.24 | R32: 2.2400000000000002 | S32: =RC[-1] -> 2.2400000000000002 | T32: =(RC[-16]*RC[-15]-RC[-13]*RC[-12])/1000 -> 0 | U32: 37.130000000000003 | V32: - | W32: =RC[-2]*RC[-10]/1000 -> 2.2367112000000002 | X32: =ABS((RC[-3]*RC[-11]-RC[-2]*RC[-9])/1000) -> #VALUE! | Y32: =(RC[-14]-RC[1])/RC[-18]*100 -> #DIV/0! | Z32: 37.130000000000003 | AC32: =VALUE(RC[-27]) -> 2018-09-10T00:00:00.000 | AD32: =IF(RC[21]=42,"*",IF(RC[21]=32,"",RC[21])) -> - | AE32: =RC[-28] -> 24 | AF32: =RC[-28] -> 0 | AG32: =RC[-28] -> 0 | AH32: =RC[-28] -> 0 | AI32: =RC[-28] -> 0 | AJ32: =RC[-28] -> 0 | AK32: =RC[-28] -> 0 | AL32: =RC[-28] -> 0 | AM32: =RC[-28] -> 0 | AN32: =RC[-28] -> 37.770000000000003 | AO32: =RC[-28] -> 60.24 | AP32: - | AQ32: =RC[-29] -> 0 | AR32: =RC[-29] -> 0 | AS32: - | AT32: =RC[-30] -> 0 | AU32: =RC[-30] -> 0 | AV32: =RC[-30] -> 2.2400000000000002 | AW32: =RC[-30] -> 2.2400000000000002 | AY32: - | AZ32: - | BA32: -
A33: =IF(RC[1]="","",DATEVALUE(RC[1])) -> 43354 | B33: 11.09.18 | C33: 24 | L33: 37.53 | M33: 59.68 | R33: 2.202 | S33: =RC[-1] -> 2.202 | T33: =(RC[-16]*RC[-15]-RC[-13]*RC[-12])/1000 -> 0 | U33: 36.9 | V33: - | W33: =RC[-2]*RC[-10]/1000 -> 2.2021920000000001 | X33: =ABS((RC[-3]*RC[-11]-RC[-2]*RC[-9])/1000) -> #VALUE! | Y33: =(RC[-14]-RC[1])/RC[-18]*100 -> #DIV/0! | Z33: 36.9 | AC33: =VALUE(RC[-27]) -> 2018-09-11T00:00:00.000 | AD33: =IF(RC[21]=42,"*",IF(RC[21]=32,"",RC[21])) -> - | AE33: =RC[-28] -> 24 | AF33: =RC[-28] -> 0 | AG33: =RC[-28] -> 0 | AH33: =RC[-28] -> 0 | AI33: =RC[-28] -> 0 | AJ33: =RC[-28] -> 0 | AK33: =RC[-28] -> 0 | AL33: =RC[-28] -> 0 | AM33: =RC[-28] -> 0 | AN33: =RC[-28] -> 37.53 | AO33: =RC[-28] -> 59.68 | AP33: - | AQ33: =RC[-29] -> 0 | AR33: =RC[-29] -> 0 | AS33: - | AT33: =RC[-30] -> 0 | AU33: =RC[-30] -> 0 | AV33: =RC[-30] -> 2.202 | AW33: =RC[-30] -> 2.202 | AY33: - | AZ33: - | BA33: -
A34: =IF(RC[1]="","",DATEVALUE(RC[1])) -> 43355 | B34: 12.09.18 | C34: 24 | L34: 37.270000000000003 | M34: 59.61 | R34: 2.1840000000000002 | S34: =RC[-1] -> 2.1840000000000002 | T34: =(RC[-16]*RC[-15]-RC[-13]*RC[-12])/1000 -> 0 | U34: 36.659999999999997 | V34: - | W34: =RC[-2]*RC[-10]/1000 -> 2.1853026 | X34: =ABS((RC[-3]*RC[-11]-RC[-2]*RC[-9])/1000) -> #VALUE! | Y34: =(RC[-14]-RC[1])/RC[-18]*100 -> #DIV/0! | Z34: 36.659999999999997 | AC34: =VALUE(RC[-27]) -> 2018-09-12T00:00:00.000 | AD34: =IF(RC[21]=42,"*",IF(RC[21]=32,"",RC[21])) -> - | AE34: =RC[-28] -> 24 | AF34: =RC[-28] -> 0 | AG34: =RC[-28] -> 0 | AH34: =RC[-28] -> 0 | AI34: =RC[-28] -> 0 | AJ34: =RC[-28] -> 0 | AK34: =RC[-28] -> 0 | AL34: =RC[-28] -> 0 | AM34: =RC[-28] -> 0 | AN34: =RC[-28] -> 37.270000000000003 | AO34: =RC[-28] -> 59.61 | AP34: - | AQ34: =RC[-29] -> 0 | AR34: =RC[-29] -> 0 | AS34: - | AT34: =RC[-30] -> 0 | AU34: =RC[-30] -> 0 | AV34: =RC[-30] -> 2.1840000000000002 | AW34: =RC[-30] -> 2.1840000000000002 | AY34: - | AZ34: - | BA34: -
A35: =IF(RC[1]="","",DATEVALUE(RC[1])) -> 43356 | B35: 13.09.18 | C35: 24 | L35: 37.57 | M35: 59.43 | R35: 2.198 | S35: =RC[-1] -> 2.198 | T35: =(RC[-16]*RC[-15]-RC[-13]*RC[-12])/1000 -> 0 | U35: 36.97 | V35: - | W35: =RC[-2]*RC[-10]/1000 -> 2.1971270999999999 | X35: =ABS((RC[-3]*RC[-11]-RC[-2]*RC[-9])/1000) -> #VALUE! | Y35: =(RC[-14]-RC[1])/RC[-18]*100 -> #DIV/0! | Z35: 36.97 | AC35: =VALUE(RC[-27]) -> 2018-09-13T00:00:00.000 | AD35: =IF(RC[21]=42,"*",IF(RC[21]=32,"",RC[21])) -> - | AE35: =RC[-28] -> 24 | AF35: =RC[-28] -> 0 | AG35: =RC[-28] -> 0 | AH35: =RC[-28] -> 0 | AI35: =RC[-28] -> 0 | AJ35: =RC[-28] -> 0 | AK35: =RC[-28] -> 0 | AL35: =RC[-28] -> 0 | AM35: =RC[-28] -> 0 | AN35: =RC[-28] -> 37.57 | AO35: =RC[-28] -> 59.43 | AP35: - | AQ35: =RC[-29] -> 0 | AR35: =RC[-29] -> 0 | AS35: - | AT35: =RC[-30] -> 0 | AU35: =RC[-30] -> 0 | AV35: =RC[-30] -> 2.198 | AW35: =RC[-30] -> 2.198 | AY35: - | AZ35: - | BA35: -
A36: =IF(RC[1]="","",DATEVALUE(RC[1])) -> 43357 | B36: 14.09.18 | C36: 24 | L36: 38.520000000000003 | M36: 59.19 | R36: 2.2429999999999999 | S36: =RC[-1] -> 2.2429999999999999 | T36: =(RC[-16]*RC[-15]-RC[-13]*RC[-12])/1000 -> 0 | U36: 37.9 | V36: - | W36: =RC[-2]*RC[-10]/1000 -> 2.2433009999999998 | X36: =ABS((RC[-3]*RC[-11]-RC[-2]*RC[-9])/1000) -> #VALUE! | Y36: =(RC[-14]-RC[1])/RC[-18]*100 -> #DIV/0! | Z36: 37.9 | AC36: =VALUE(RC[-27]) -> 2018-09-14T00:00:00.000 | AD36: =IF(RC[21]=42,"*",IF(RC[21]=32,"",RC[21])) -> - | AE36: =RC[-28] -> 24 | AF36: =RC[-28] -> 0 | AG36: =RC[-28] -> 0 | AH36: =RC[-28] -> 0 | AI36: =RC[-28] -> 0 | AJ36: =RC[-28] -> 0 | AK36: =RC[-28] -> 0 | AL36: =RC[-28] -> 0 | AM36: =RC[-28] -> 0 | AN36: =RC[-28] -> 38.520000000000003 | AO36: =RC[-28] -> 59.19 | AP36: - | AQ36: =RC[-29] -> 0 | AR36: =RC[-29] -> 0 | AS36: - | AT36: =RC[-30] -> 0 | AU36: =RC[-30] -> 0 | AV36: =RC[-30] -> 2.2429999999999999 | AW36: =RC[-30] -> 2.2429999999999999 | AY36: - | AZ36: - | BA36: -
A37: =IF(RC[1]="","",DATEVALUE(RC[1])) -> 43358 | B37: 15.09.18 | C37: 24 | L37: 37.26 | M37: 58.17 | R37: 2.137 | S37: =RC[-1] -> 2.137 | T37: =(RC[-16]*RC[-15]-RC[-13]*RC[-12])/1000 -> 0 | U37: 36.68 | V37: - | W37: =RC[-2]*RC[-10]/1000 -> 2.1336756000000001 | X37: =ABS((RC[-3]*RC[-11]-RC[-2]*RC[-9])/1000) -> #VALUE! | Y37: =(RC[-14]-RC[1])/RC[-18]*100 -> #DIV/0! | Z37: 36.68 | AC37: =VALUE(RC[-27]) -> 2018-09-15T00:00:00.000 | AD37: =IF(RC[21]=42,"*",IF(RC[21]=32,"",RC[21])) -> - | AE37: =RC[-28] -> 24 | AF37: =RC[-28] -> 0 | AG37: =RC[-28] -> 0 | AH37: =RC[-28] -> 0 | AI37: =RC[-28] -> 0 | AJ37: =RC[-28] -> 0 | AK37: =RC[-28] -> 0 | AL37: =RC[-28] -> 0 | AM37: =RC[-28] -> 0 | AN37: =RC[-28] -> 37.26 | AO37: =RC[-28] -> 58.17 | AP37: - | AQ37: =RC[-29] -> 0 | AR37: =RC[-29] -> 0 | AS37: - | AT37: =RC[-30] -> 0 | AU37: =RC[-30] -> 0 | AV37: =RC[-30] -> 2.137 | AW37: =RC[-30] -> 2.137 | AY37: - | AZ37: - | BA37: -
A38: =IF(RC[1]="","",DATEVALUE(RC[1])) -> 43359 | B38: 16.09.18 | C38: 24 | L38: 41.21 | M38: 58.77 | R38: 2.383 | S38: =RC[-1] -> 2.383 | T38: =(RC[-16]*RC[-15]-RC[-13]*RC[-12])/1000 -> 0 | U38: 40.549999999999997 | V38: - | W38: =RC[-2]*RC[-10]/1000 -> 2.3831235 | X38: =ABS((RC[-3]*RC[-11]-RC[-2]*RC[-9])/1000) -> #VALUE! | Y38: =(RC[-14]-RC[1])/RC[-18]*100 -> #DIV/0! | Z38: 40.549999999999997 | AC38: =VALUE(RC[-27]) -> 2018-09-16T00:00:00.000 | AD38: =IF(RC[21]=42,"*",IF(RC[21]=32,"",RC[21])) -> - | AE38: =RC[-28] -> 24 | AF38: =RC[-28] -> 0 | AG38: =RC[-28] -> 0 | AH38: =RC[-28] -> 0 | AI38: =RC[-28] -> 0 | AJ38: =RC[-28] -> 0 | AK38: =RC[-28] -> 0 | AL38: =RC[-28] -> 0 | AM38: =RC[-28] -> 0 | AN38: =RC[-28] -> 41.21 | AO38: =RC[-28] -> 58.77 | AP38: - | AQ38: =RC[-29] -> 0 | AR38: =RC[-29] -> 0 | AS38: - | AT38: =RC[-30] -> 0 | AU38: =RC[-30] -> 0 | AV38: =RC[-30] -> 2.383 | AW38: =RC[-30] -> 2.383 | AY38: - | AZ38: - | BA38: -
A39: =IF(RC[1]="","",DATEVALUE(RC[1])) -> 43360 | B39: 17.09.18 | C39: 24 | L39: 40.64 | M39: 58.49 | R39: 2.34 | S39: =RC[-1] -> 2.34 | T39: =(RC[-16]*RC[-15]-RC[-13]*RC[-12])/1000 -> 0 | U39: 39.979999999999997 | V39: - | W39: =RC[-2]*RC[-10]/1000 -> 2.3384301999999999 | X39: =ABS((RC[-3]*RC[-11]-RC[-2]*RC[-9])/1000) -> #VALUE! | Y39: =(RC[-14]-RC[1])/RC[-18]*100 -> #DIV/0! | Z39: 39.979999999999997 | AC39: =VALUE(RC[-27]) -> 2018-09-17T00:00:00.000 | AD39: =IF(RC[21]=42,"*",IF(RC[21]=32,"",RC[21])) -> - | AE39: =RC[-28] -> 24 | AF39: =RC[-28] -> 0 | AG39: =RC[-28] -> 0 | AH39: =RC[-28] -> 0 | AI39: =RC[-28] -> 0 | AJ39: =RC[-28] -> 0 | AK39: =RC[-28] -> 0 | AL39: =RC[-28] -> 0 | AM39: =RC[-28] -> 0 | AN39: =RC[-28] -> 40.64 | AO39: =RC[-28] -> 58.49 | AP39: - | AQ39: =RC[-29] -> 0 | AR39: =RC[-29] -> 0 | AS39: - | AT39: =RC[-30] -> 0 | AU39: =RC[-30] -> 0 | AV39: =RC[-30] -> 2.34 | AW39: =RC[-30] -> 2.34 | AY39: - | AZ39: - | BA39: -
A40: =IF(RC[1]="","",DATEVALUE(RC[1])) -> 43361 | B40: 18.09.18 | C40: 24 | L40: 40.6 | M40: 59.43 | R40: 2.3759999999999999 | S40: =RC[-1] -> 2.3759999999999999 | T40: =(RC[-16]*RC[-15]-RC[-13]*RC[-12])/1000 -> 0 | U40: 39.96 | V40: - | W40: =RC[-2]*RC[-10]/1000 -> 2.3748228 | X40: =ABS((RC[-3]*RC[-11]-RC[-2]*RC[-9])/1000) -> #VALUE! | Y40: =(RC[-14]-RC[1])/RC[-18]*100 -> #DIV/0! | Z40: 39.96 | AC40: =VALUE(RC[-27]) -> 2018-09-18T00:00:00.000 | AD40: =IF(RC[21]=42,"*",IF(RC[21]=32,"",RC[21])) -> - | AE40: =RC[-28] -> 24 | AF40: =RC[-28] -> 0 | AG40: =RC[-28] -> 0 | AH40: =RC[-28] -> 0 | AI40: =RC[-28] -> 0 | AJ40: =RC[-28] -> 0 | AK40: =RC[-28] -> 0 | AL40: =RC[-28] -> 0 | AM40: =RC[-28] -> 0 | AN40: =RC[-28] -> 40.6 | AO40: =RC[-28] -> 59.43 | AP40: - | AQ40: =RC[-29] -> 0 | AR40: =RC[-29] -> 0 | AS40: - | AT40: =RC[-30] -> 0 | AU40: =RC[-30] -> 0 | AV40: =RC[-30] -> 2.3759999999999999 | AW40: =RC[-30] -> 2.3759999999999999 | AY40: - | AZ40: - | BA40: -
A41: =IF(RC[1]="","",DATEVALUE(RC[1])) -> 43362 | B41: 19.09.18 | C41: 24 | L41: 39.21 | M41: 63.8 | R41: 2.4540000000000002 | S41: =RC[-1] -> 2.4540000000000002 | T41: =(RC[-16]*RC[-15]-RC[-13]*RC[-12])/1000 -> 0 | W41: =RC[-2]*RC[-10]/1000 -> #VALUE! | X41: =ABS((RC[-3]*RC[-11]-RC[-2]*RC[-9])/1000) -> #VALUE! | Y41: =(RC[-14]-RC[1])/RC[-18]*100 -> #VALUE! | AC41: =VALUE(RC[-27]) -> 2018-09-19T00:00:00.000 | AD41: =IF(RC[21]=42,"*",IF(RC[21]=32,"",RC[21])) ->  | AE41: =RC[-28] -> 24 | AF41: =RC[-28] -> 0 | AG41: =RC[-28] -> 0 | AH41: =RC[-28] -> 0 | AI41: =RC[-28] -> 0 | AJ41: =RC[-28] -> 0 | AK41: =RC[-28] -> 0 | AL41: =RC[-28] -> 0 | AM41: =RC[-28] -> 0 | AN41: =RC[-28] -> 39.21 | AO41: =RC[-28] -> 63.8 | AP41: - | AQ41: =RC[-29] -> 0 | AR41: =RC[-29] -> 0 | AS41: - | AT41: =RC[-30] -> 0 | AU41: =RC[-30] -> 0 | AV41: =RC[-30] -> 2.4540000000000002 | AW41: =RC[-30] -> 2.4540000000000002
A42: =IF(RC[1]="","",DATEVALUE(RC[1])) -> 43363 | B42: 20.09.18 | C42: 24 | L42: 36.520000000000003 | M42: 65.489999999999995 | R42: 2.347 | S42: =RC[-1] -> 2.347 | T42: =(RC[-16]*RC[-15]-RC[-13]*RC[-12])/1000 -> 0 | W42: =RC[-2]*RC[-10]/1000 -> #VALUE! | X42: =ABS((RC[-3]*RC[-11]-RC[-2]*RC[-9])/1000) -> #VALUE! | Y42: =(RC[-14]-RC[1])/RC[-18]*100 -> #VALUE! | AC42: =VALUE(RC[-27]) -> 2018-09-20T00:00:00.000 | AD42: =IF(RC[21]=42,"*",IF(RC[21]=32,"",RC[21])) ->  | AE42: =RC[-28] -> 24 | AF42: =RC[-28] -> 0 | AG42: =RC[-28] -> 0 | AH42: =RC[-28] -> 0 | AI42: =RC[-28] -> 0 | AJ42: =RC[-28] -> 0 | AK42: =RC[-28] -> 0 | AL42: =RC[-28] -> 0 | AM42: =RC[-28] -> 0 | AN42: =RC[-28] -> 36.520000000000003 | AO42: =RC[-28] -> 65.489999999999995 | AP42: - | AQ42: =RC[-29] -> 0 | AR42: =RC[-29] -> 0 | AS42: - | AT42: =RC[-30] -> 0 | AU42: =RC[-30] -> 0 | AV42: =RC[-30] -> 2.347 | AW42: =RC[-30] -> 2.347
A43: =IF(RC[1]="","",DATEVALUE(RC[1])) -> 43364 | B43: 21.09.18 | C43: 24 | L43: 36.31 | M43: 65.83 | R43: 2.3439999999999999 | S43: =RC[-1] -> 2.3439999999999999 | T43: =(RC[-16]*RC[-15]-RC[-13]*RC[-12])/1000 -> 0 | W43: =RC[-2]*RC[-10]/1000 -> #VALUE! | X43: =ABS((RC[-3]*RC[-11]-RC[-2]*RC[-9])/1000) -> #VALUE! | Y43: =(RC[-14]-RC[1])/RC[-18]*100 -> #VALUE! | AC43: =VALUE(RC[-27]) -> 2018-09-21T00:00:00.000 | AD43: =IF(RC[21]=42,"*",IF(RC[21]=32,"",RC[21])) ->  | AE43: =RC[-28] -> 24 | AF43: =RC[-28] -> 0 | AG43: =RC[-28] -> 0 | AH43: =RC[-28] -> 0 | AI43: =RC[-28] -> 0 | AJ43: =RC[-28] -> 0 | AK43: =RC[-28] -> 0 | AL43: =RC[-28] -> 0 | AM43: =RC[-28] -> 0 | AN43: =RC[-28] -> 36.31 | AO43: =RC[-28] -> 65.83 | AP43: - | AQ43: =RC[-29] -> 0 | AR43: =RC[-29] -> 0 | AS43: - | AT43: =RC[-30] -> 0 | AU43: =RC[-30] -> 0 | AV43: =RC[-30] -> 2.3439999999999999 | AW43: =RC[-30] -> 2.3439999999999999
A44: =IF(RC[1]="","",DATEVALUE(RC[1])) -> 43365 | B44: 22.09.18 | C44: 24 | L44: 33.47 | M44: 65.48 | R44: 2.149 | S44: =RC[-1] -> 2.149 | T44: =(RC[-16]*RC[-15]-RC[-13]*RC[-12])/1000 -> 0 | W44: =RC[-2]*RC[-10]/1000 -> #VALUE! | X44: =ABS((RC[-3]*RC[-11]-RC[-2]*RC[-9])/1000) -> #VALUE! | Y44: =(RC[-14]-RC[1])/RC[-18]*100 -> #VALUE! | AC44: =VALUE(RC[-27]) -> 2018-09-22T00:00:00.000 | AD44: =IF(RC[21]=42,"*",IF(RC[21]=32,"",RC[21])) ->  | AE44: =RC[-28] -> 24 | AF44: =RC[-28] -> 0 | AG44: =RC[-28] -> 0 | AH44: =RC[-28] -> 0 | AI44: =RC[-28] -> 0 | AJ44: =RC[-28] -> 0 | AK44: =RC[-28] -> 0 | AL44: =RC[-28] -> 0 | AM44: =RC[-28] -> 0 | AN44: =RC[-28] -> 33.47 | AO44: =RC[-28] -> 65.48 | AP44: - | AQ44: =RC[-29] -> 0 | AR44: =RC[-29] -> 0 | AS44: - | AT44: =RC[-30] -> 0 | AU44: =RC[-30] -> 0 | AV44: =RC[-30] -> 2.149 | AW44: =RC[-30] -> 2.149
A45: =IF(RC[1]="","",DATEVALUE(RC[1])) ->  | C45: 24 | S45: =RC[-1] ->  | T45: =(RC[-16]*RC[-15]-RC[-13]*RC[-12])/1000 -> 0 | W45: =RC[-2]*RC[-10]/1000 -> #VALUE! | X45: =ABS((RC[-3]*RC[-11]-RC[-2]*RC[-9])/1000) -> #VALUE! | Y45: =(RC[-14]-RC[1])/RC[-18]*100 -> #VALUE! | AC45: =VALUE(RC[-27]) -> #VALUE! | AD45: =IF(RC[21]=42,"*",IF(RC[21]=32,"",RC[21])) ->  | AE45: =RC[-28] -> 24 | AF45: =RC[-28] -> 0 | AG45: =RC[-28] -> 0 | AH45: =RC[-28] -> 0 | AI45: =RC[-28] -> 0 | AJ45: =RC[-28] -> 0 | AK45: =RC[-28] -> 0 | AL45: =RC[-28] -> 0 | AM45: =RC[-28] -> 0 | AN45: =RC[-28] ->  | AO45: =RC[-28] ->  | AP45: - | AQ45: =RC[-29] -> 0 | AR45: =RC[-29] -> 0 | AS45: - | AT45: =RC[-30] -> 0 | AU45: =RC[-30] -> 0 | AV45: =RC[-30] ->  | AW45: =RC[-30] -> 
A46: =IF(RC[1]="","",DATEVALUE(RC[1])) ->  | C46: 24 | S46: =RC[-1] ->  | T46: =(RC[-16]*RC[-15]-RC[-13]*RC[-12])/1000 -> 0 | W46: =RC[-2]*RC[-10]/1000 -> #VALUE! | X46: =ABS((RC[-3]*RC[-11]-RC[-2]*RC[-9])/1000) -> #VALUE! | Y46: =(RC[-14]-RC[1])/RC[-18]*100 -> #VALUE! | AC46: =VALUE(RC[-27]) -> #VALUE! | AD46: =IF(RC[21]=42,"*",IF(RC[21]=32,"",RC[21])) ->  | AE46: =RC[-28] -> 24 | AF46: =RC[-28] -> 0 | AG46: =RC[-28] -> 0 | AH46: =RC[-28] -> 0 | AI46: =RC[-28] -> 0 | AJ46: =RC[-28] -> 0 | AK46: =RC[-28] -> 0 | AL46: =RC[-28] -> 0 | AM46: =RC[-28] -> 0 | AN46: =RC[-28] ->  | AO46: =RC[-28] ->  | AP46: - | AQ46: =RC[-29] -> 0 | AR46: =RC[-29] -> 0 | AS46: - | AT46: =RC[-30] -> 0 | AU46: =RC[-30] -> 0 | AV46: =RC[-30] ->  | AW46: =RC[-30] -> 
A47: =IF(RC[1]="","",DATEVALUE(RC[1])) ->  | C47: 24 | S47: =RC[-1] ->  | T47: =(RC[-16]*RC[-15]-RC[-13]*RC[-12])/1000 -> 0 | W47: =RC[-2]*RC[-10]/1000 -> #VALUE! | X47: =ABS((RC[-3]*RC[-11]-RC[-2]*RC[-9])/1000) -> #VALUE! | Y47: =(RC[-14]-RC[1])/RC[-18]*100 -> #VALUE! | AC47: =VALUE(RC[-27]) -> #VALUE! | AD47: =IF(RC[21]=42,"*",IF(RC[21]=32,"",RC[21])) ->  | AE47: =RC[-28] -> 24 | AF47: =RC[-28] -> 0 | AG47: =RC[-28] -> 0 | AH47: =RC[-28] -> 0 | AI47: =RC[-28] -> 0 | AJ47: =RC[-28] -> 0 | AK47: =RC[-28] -> 0 | AL47: =RC[-28] -> 0 | AM47: =RC[-28] -> 0 | AN47: =RC[-28] ->  | AO47: =RC[-28] ->  | AP47: - | AQ47: =RC[-29] -> 0 | AR47: =RC[-29] -> 0 | AS47: - | AT47: =RC[-30] -> 0 | AU47: =RC[-30] -> 0 | AV47: =RC[-30] ->  | AW47: =RC[-30] -> 
A48: =IF(RC[1]="","",DATEVALUE(RC[1])) ->  | C48: 24 | S48: =RC[-1] ->  | T48: =(RC[-16]*RC[-15]-RC[-13]*RC[-12])/1000 -> 0 | W48: =RC[-2]*RC[-10]/1000 -> #VALUE! | X48: =ABS((RC[-3]*RC[-11]-RC[-2]*RC[-9])/1000) -> #VALUE! | Y48: =(RC[-14]-RC[1])/RC[-18]*100 -> #VALUE! | AC48: =VALUE(RC[-27]) -> #VALUE! | AD48: =IF(RC[21]=42,"*",IF(RC[21]=32,"",RC[21])) ->  | AE48: =RC[-28] -> 24 | AF48: =RC[-28] -> 0 | AG48: =RC[-28] -> 0 | AH48: =RC[-28] -> 0 | AI48: =RC[-28] -> 0 | AJ48: =RC[-28] -> 0 | AK48: =RC[-28] -> 0 | AL48: =RC[-28] -> 0 | AM48: =RC[-28] -> 0 | AN48: =RC[-28] ->  | AO48: =RC[-28] ->  | AP48: - | AQ48: =RC[-29] -> 0 | AR48: =RC[-29] -> 0 | AS48: - | AT48: =RC[-30] -> 0 | AU48: =RC[-30] -> 0 | AV48: =RC[-30] ->  | AW48: =RC[-30] -> 
A49: =IF(RC[1]="","",DATEVALUE(RC[1])) ->  | C49: 24 | S49: =RC[-1] ->  | T49: =(RC[-16]*RC[-15]-RC[-13]*RC[-12])/1000 -> 0 | W49: =RC[-2]*RC[-10]/1000 -> #VALUE! | X49: =ABS((RC[-3]*RC[-11]-RC[-2]*RC[-9])/1000) -> #VALUE! | Y49: =(RC[-14]-RC[1])/RC[-18]*100 -> #VALUE! | AC49: =VALUE(RC[-27]) -> #VALUE! | AD49: =IF(RC[21]=42,"*",IF(RC[21]=32,"",RC[21])) ->  | AE49: =RC[-28] -> 24 | AF49: =RC[-28] -> 0 | AG49: =RC[-28] -> 0 | AH49: =RC[-28] -> 0 | AI49: =RC[-28] -> 0 | AJ49: =RC[-28] -> 0 | AK49: =RC[-28] -> 0 | AL49: =RC[-28] -> 0 | AM49: =RC[-28] -> 0 | AN49: =RC[-28] ->  | AO49: =RC[-28] ->  | AP49: - | AQ49: =RC[-29] -> 0 | AR49: =RC[-29] -> 0 | AS49: - | AT49: =RC[-30] -> 0 | AU49: =RC[-30] -> 0 | AV49: =RC[-30] ->  | AW49: =RC[-30] -> 
A50: =IF(RC[1]="","",DATEVALUE(RC[1])) ->  | S50: =RC[-1] ->  | T50: =(RC[-16]*RC[-15]-RC[-13]*RC[-12])/1000 -> 0 | W50: =RC[-2]*RC[-10]/1000 -> #VALUE! | X50: =ABS((RC[-3]*RC[-11]-RC[-2]*RC[-9])/1000) -> #VALUE! | Y50: =(RC[-14]-RC[1])/RC[-18]*100 -> #VALUE! | AC50: =VALUE(RC[-27]) -> #VALUE! | AD50: =IF(RC[21]=42,"*",IF(RC[21]=32,"",RC[21])) ->  | AE50: =RC[-28] ->  | AF50: =RC[-28] -> 0 | AG50: =RC[-28] -> 0 | AH50: =RC[-28] -> 0 | AI50: =RC[-28] -> 0 | AJ50: =RC[-28] -> 0 | AK50: =RC[-28] -> 0 | AL50: =RC[-28] -> 0 | AM50: =RC[-28] -> 0 | AN50: =RC[-28] ->  | AO50: =RC[-28] ->  | AP50: - | AQ50: =RC[-29] -> 0 | AR50: =RC[-29] -> 0 | AS50: - | AT50: =RC[-30] -> 0 | AU50: =RC[-30] -> 0 | AV50: =RC[-30] ->  | AW50: =RC[-30] -> 
A51: =IF(RC[1]="","",DATEVALUE(RC[1])) ->  | S51: =RC[-1] ->  | T51: =(RC[-16]*RC[-15]-RC[-13]*RC[-12])/1000 -> 0 | W51: =RC[-2]*RC[-10]/1000 -> #VALUE! | X51: =ABS((RC[-3]*RC[-11]-RC[-2]*RC[-9])/1000) -> #VALUE! | Y51: =(RC[-14]-RC[1])/RC[-18]*100 -> #VALUE! | AC51: =VALUE(RC[-27]) -> #VALUE! | AD51: =IF(RC[21]=42,"*",IF(RC[21]=32,"",RC[21])) ->  | AE51: =RC[-28] ->  | AF51: =RC[-28] -> 0 | AG51: =RC[-28] -> 0 | AH51: =RC[-28] -> 0 | AI51: =RC[-28] -> 0 | AJ51: =RC[-28] -> 0 | AK51: =RC[-28] -> 0 | AL51: =RC[-28] -> 0 | AM51: =RC[-28] -> 0 | AN51: =RC[-28] ->  | AO51: =RC[-28] ->  | AP51: - | AQ51: =RC[-29] -> 0 | AR51: =RC[-29] -> 0 | AS51: - | AT51: =RC[-30] -> 0 | AU51: =RC[-30] -> 0 | AV51: =RC[-30] ->  | AW51: =RC[-30] -> 
A52: =IF(RC[1]="","",DATEVALUE(RC[1])) ->  | S52: =RC[-1] ->  | T52: =(RC[-16]*RC[-15]-RC[-13]*RC[-12])/1000 -> 0 | W52: =RC[-2]*RC[-10]/1000 -> #VALUE! | X52: =ABS((RC[-3]*RC[-11]-RC[-2]*RC[-9])/1000) -> #VALUE! | Y52: =(RC[-14]-RC[1])/RC[-18]*100 -> #VALUE! | AC52: =VALUE(RC[-27]) -> #VALUE! | AD52: =IF(RC[21]=42,"*",IF(RC[21]=32,"",RC[21])) ->  | AE52: =RC[-28] ->  | AF52: =RC[-28] -> 0 | AG52: =RC[-28] -> 0 | AH52: =RC[-28] -> 0 | AI52: =RC[-28] -> 0 | AJ52: =RC[-28] -> 0 | AK52: =RC[-28] -> 0 | AL52: =RC[-28] -> 0 | AM52: =RC[-28] -> 0 | AN52: =RC[-28] ->  | AO52: =RC[-28] ->  | AP52: - | AQ52: =RC[-29] -> 0 | AR52: =RC[-29] -> 0 | AS52: - | AT52: =RC[-30] -> 0 | AU52: =RC[-30] -> 0 | AV52: =RC[-30] ->  | AW52: =RC[-30] -> 
A53: =IF(RC[1]="","",DATEVALUE(RC[1])) ->  | S53: =RC[-1] ->  | T53: =(RC[-16]*RC[-15]-RC[-13]*RC[-12])/1000 -> 0 | W53: =RC[-2]*RC[-10]/1000 -> #VALUE! | X53: =ABS((RC[-3]*RC[-11]-RC[-2]*RC[-9])/1000) -> #VALUE! | Y53: =(RC[-14]-RC[1])/RC[-18]*100 -> #VALUE! | AC53: =VALUE(RC[-27]) -> #VALUE! | AD53: =IF(RC[21]=42,"*",IF(RC[21]=32,"",RC[21])) ->  | AE53: =RC[-28] ->  | AF53: =RC[-28] -> 0 | AG53: =RC[-28] -> 0 | AH53: =RC[-28] -> 0 | AI53: =RC[-28] -> 0 | AJ53: =RC[-28] -> 0 | AK53: =RC[-28] -> 0 | AL53: =RC[-28] -> 0 | AM53: =RC[-28] -> 0 | AN53: =RC[-28] ->  | AO53: =RC[-28] ->  | AP53: - | AQ53: =RC[-29] -> 0 | AR53: =RC[-29] -> 0 | AS53: - | AT53: =RC[-30] -> 0 | AU53: =RC[-30] -> 0 | AV53: =RC[-30] ->  | AW53: =RC[-30] -> 
A54: =IF(RC[1]="","",DATEVALUE(RC[1])) ->  | S54: =RC[-1] ->  | T54: =(RC[-16]*RC[-15]-RC[-13]*RC[-12])/1000 -> 0 | W54: =RC[-2]*RC[-10]/1000 -> #VALUE! | X54: =ABS((RC[-3]*RC[-11]-RC[-2]*RC[-9])/1000) -> #VALUE! | Y54: =(RC[-14]-RC[1])/RC[-18]*100 -> #VALUE! | AC54: =VALUE(RC[-27]) -> #VALUE! | AD54: =IF(RC[21]=42,"*",IF(RC[21]=32,"",RC[21])) ->  | AE54: =RC[-28] ->  | AF54: =RC[-28] -> 0 | AG54: =RC[-28] -> 0 | AH54: =RC[-28] -> 0 | AI54: =RC[-28] -> 0 | AJ54: =RC[-28] -> 0 | AK54: =RC[-28] -> 0 | AL54: =RC[-28] -> 0 | AM54: =RC[-28] -> 0 | AN54: =RC[-28] ->  | AO54: =RC[-28] ->  | AP54: - | AQ54: =RC[-29] -> 0 | AR54: =RC[-29] -> 0 | AS54: - | AT54: =RC[-30] -> 0 | AU54: =RC[-30] -> 0 | AV54: =RC[-30] ->  | AW54: =RC[-30] -> 
A55: =IF(RC[1]="","",DATEVALUE(RC[1])) ->  | S55: =RC[-1] ->  | T55: =(RC[-16]*RC[-15]-RC[-13]*RC[-12])/1000 -> 0 | W55: =RC[-2]*RC[-10]/1000 -> #VALUE! | X55: =ABS((RC[-3]*RC[-11]-RC[-2]*RC[-9])/1000) -> #VALUE! | Y55: =(RC[-14]-RC[1])/RC[-18]*100 -> #VALUE! | AC55: =VALUE(RC[-27]) -> #VALUE! | AD55: =IF(RC[21]=42,"*",IF(RC[21]=32,"",RC[21])) ->  | AE55: =RC[-28] ->  | AF55: =RC[-28] -> 0 | AG55: =RC[-28] -> 0 | AH55: =RC[-28] -> 0 | AI55: =RC[-28] -> 0 | AJ55: =RC[-28] -> 0 | AK55: =RC[-28] -> 0 | AL55: =RC[-28] -> 0 | AM55: =RC[-28] -> 0 | AN55: =RC[-28] ->  | AO55: =RC[-28] ->  | AP55: - | AQ55: =RC[-29] -> 0 | AR55: =RC[-29] -> 0 | AS55: - | AT55: =RC[-30] -> 0 | AU55: =RC[-30] -> 0 | AV55: =RC[-30] ->  | AW55: =RC[-30] -> 
A56: =IF(RC[1]="","",DATEVALUE(RC[1])) ->  | S56: =RC[-1] ->  | T56: =(RC[-16]*RC[-15]-RC[-13]*RC[-12])/1000 -> 0 | W56: =RC[-2]*RC[-10]/1000 -> #VALUE! | X56: =ABS((RC[-3]*RC[-11]-RC[-2]*RC[-9])/1000) -> #VALUE! | Y56: =(RC[-14]-RC[1])/RC[-18]*100 -> #VALUE! | AC56: =VALUE(RC[-27]) -> #VALUE! | AD56: =IF(RC[21]=42,"*",IF(RC[21]=32,"",RC[21])) ->  | AE56: =RC[-28] ->  | AF56: =RC[-28] -> 0 | AG56: =RC[-28] -> 0 | AH56: =RC[-28] -> 0 | AI56: =RC[-28] -> 0 | AJ56: =RC[-28] -> 0 | AK56: =RC[-28] -> 0 | AL56: =RC[-28] -> 0 | AM56: =RC[-28] -> 0 | AN56: =RC[-28] ->  | AO56: =RC[-28] ->  | AP56: - | AQ56: =RC[-29] -> 0 | AR56: =RC[-29] -> 0 | AS56: - | AT56: =RC[-30] -> 0 | AU56: =RC[-30] -> 0 | AV56: =RC[-30] ->  | AW56: =RC[-30] -> 
A57: =IF(RC[1]="","",DATEVALUE(RC[1])) ->  | S57: =RC[-1] ->  | T57: =(RC[-16]*RC[-15]-RC[-13]*RC[-12])/1000 -> 0 | W57: =RC[-2]*RC[-10]/1000 -> #VALUE! | X57: =ABS((RC[-3]*RC[-11]-RC[-2]*RC[-9])/1000) -> #VALUE! | Y57: =(RC[-14]-RC[1])/RC[-18]*100 -> #VALUE! | AC57: =VALUE(RC[-27]) -> #VALUE! | AD57: =IF(RC[21]=42,"*",IF(RC[21]=32,"",RC[21])) ->  | AE57: =RC[-28] ->  | AF57: =RC[-28] -> 0 | AG57: =RC[-28] -> 0 | AH57: =RC[-28] -> 0 | AI57: =RC[-28] -> 0 | AJ57: =RC[-28] -> 0 | AK57: =RC[-28] -> 0 | AL57: =RC[-28] -> 0 | AM57: =RC[-28] -> 0 | AN57: =RC[-28] ->  | AO57: =RC[-28] ->  | AP57: - | AQ57: =RC[-29] -> 0 | AR57: =RC[-29] -> 0 | AS57: - | AT57: =RC[-30] -> 0 | AU57: =RC[-30] -> 0 | AV57: =RC[-30] ->  | AW57: =RC[-30] -> 
A58: =IF(RC[1]="","",DATEVALUE(RC[1])) ->  | S58: =RC[-1] ->  | T58: =(RC[-16]*RC[-15]-RC[-13]*RC[-12])/1000 -> 0 | W58: =RC[-2]*RC[-10]/1000 -> #VALUE! | X58: =ABS((RC[-3]*RC[-11]-RC[-2]*RC[-9])/1000) -> #VALUE! | Y58: =(RC[-14]-RC[1])/RC[-18]*100 -> #VALUE! | AC58: =VALUE(RC[-27]) -> #VALUE! | AD58: =IF(RC[21]=42,"*",IF(RC[21]=32,"",RC[21])) ->  | AE58: =RC[-28] ->  | AF58: =RC[-28] -> 0 | AG58: =RC[-28] -> 0 | AH58: =RC[-28] -> 0 | AI58: =RC[-28] -> 0 | AJ58: =RC[-28] -> 0 | AK58: =RC[-28] -> 0 | AL58: =RC[-28] -> 0 | AM58: =RC[-28] -> 0 | AN58: =RC[-28] ->  | AO58: =RC[-28] ->  | AP58: - | AQ58: =RC[-29] -> 0 | AR58: =RC[-29] -> 0 | AS58: - | AT58: =RC[-30] -> 0 | AU58: =RC[-30] -> 0 | AV58: =RC[-30] ->  | AW58: =RC[-30] -> 
A59: =IF(RC[1]="","",DATEVALUE(RC[1])) ->  | S59: =RC[-1] ->  | T59: =(RC[-16]*RC[-15]-RC[-13]*RC[-12])/1000 -> 0 | W59: =RC[-2]*RC[-10]/1000 -> #VALUE! | X59: =ABS((RC[-3]*RC[-11]-RC[-2]*RC[-9])/1000) -> #VALUE! | Y59: =(RC[-14]-RC[1])/RC[-18]*100 -> #VALUE! | AC59: =VALUE(RC[-27]) -> #VALUE! | AD59: =IF(RC[21]=42,"*",IF(RC[21]=32,"",RC[21])) ->  | AE59: =RC[-28] ->  | AF59: =RC[-28] -> 0 | AG59: =RC[-28] -> 0 | AH59: =RC[-28] -> 0 | AI59: =RC[-28] -> 0 | AJ59: =RC[-28] -> 0 | AK59: =RC[-28] -> 0 | AL59: =RC[-28] -> 0 | AM59: =RC[-28] -> 0 | AN59: =RC[-28] ->  | AO59: =RC[-28] ->  | AP59: - | AQ59: =RC[-29] -> 0 | AR59: =RC[-29] -> 0 | AS59: - | AT59: =RC[-30] -> 0 | AU59: =RC[-30] -> 0 | AV59: =RC[-30] ->  | AW59: =RC[-30] -> 
A60: =IF(RC[1]="","",DATEVALUE(RC[1])) ->  | S60: =RC[-1] ->  | T60: =(RC[-16]*RC[-15]-RC[-13]*RC[-12])/1000 -> 0 | W60: =RC[-2]*RC[-10]/1000 -> #VALUE! | X60: =ABS((RC[-3]*RC[-11]-RC[-2]*RC[-9])/1000) -> #VALUE! | Y60: =(RC[-14]-RC[1])/RC[-18]*100 -> #VALUE! | AC60: =VALUE(RC[-27]) -> #VALUE! | AD60: =IF(RC[21]=42,"*",IF(RC[21]=32,"",RC[21])) ->  | AE60: =RC[-28] ->  | AF60: =RC[-28] -> 0 | AG60: =RC[-28] -> 0 | AH60: =RC[-28] -> 0 | AI60: =RC[-28] -> 0 | AJ60: =RC[-28] -> 0 | AK60: =RC[-28] -> 0 | AL60: =RC[-28] -> 0 | AM60: =RC[-28] -> 0 | AN60: =RC[-28] ->  | AO60: =RC[-28] ->  | AP60: - | AQ60: =RC[-29] -> 0 | AR60: =RC[-29] -> 0 | AS60: - | AT60: =RC[-30] -> 0 | AU60: =RC[-30] -> 0 | AV60: =RC[-30] ->  | AW60: =RC[-30] -> 
A61: =IF(RC[1]="","",DATEVALUE(RC[1])) ->  | S61: =RC[-1] ->  | T61: =(RC[-16]*RC[-15]-RC[-13]*RC[-12])/1000 -> 0 | W61: =RC[-2]*RC[-10]/1000 -> #VALUE! | X61: =ABS((RC[-3]*RC[-11]-RC[-2]*RC[-9])/1000) -> #VALUE! | Y61: =(RC[-14]-RC[1])/RC[-18]*100 -> #VALUE! | AC61: =VALUE(RC[-27]) -> #VALUE! | AD61: =IF(RC[21]=42,"*",IF(RC[21]=32,"",RC[21])) ->  | AE61: =RC[-28] ->  | AF61: =RC[-28] -> 0 | AG61: =RC[-28] -> 0 | AH61: =RC[-28] -> 0 | AI61: =RC[-28] -> 0 | AJ61: =RC[-28] -> 0 | AK61: =RC[-28] -> 0 | AL61: =RC[-28] -> 0 | AM61: =RC[-28] -> 0 | AN61: =RC[-28] ->  | AO61: =RC[-28] ->  | AP61: - | AQ61: =RC[-29] -> 0 | AR61: =RC[-29] -> 0 | AS61: - | AT61: =RC[-30] -> 0 | AU61: =RC[-30] -> 0 | AV61: =RC[-30] ->  | AW61: =RC[-30] -> 
A62: =IF(RC[1]="","",DATEVALUE(RC[1])) ->  | S62: =RC[-1] ->  | T62: =(RC[-16]*RC[-15]-RC[-13]*RC[-12])/1000 -> 0 | W62: =RC[-2]*RC[-10]/1000 -> #VALUE! | X62: =ABS((RC[-3]*RC[-11]-RC[-2]*RC[-9])/1000) -> #VALUE! | Y62: =(RC[-14]-RC[1])/RC[-18]*100 -> #VALUE! | AC62: =VALUE(RC[-27]) -> #VALUE! | AD62: =IF(RC[21]=42,"*",IF(RC[21]=32,"",RC[21])) ->  | AE62: =RC[-28] ->  | AF62: =RC[-28] -> 0 | AG62: =RC[-28] -> 0 | AH62: =RC[-28] -> 0 | AI62: =RC[-28] -> 0 | AJ62: =RC[-28] -> 0 | AK62: =RC[-28] -> 0 | AL62: =RC[-28] -> 0 | AM62: =RC[-28] -> 0 | AN62: =RC[-28] ->  | AO62: =RC[-28] ->  | AP62: - | AQ62: =RC[-29] -> 0 | AR62: =RC[-29] -> 0 | AS62: - | AT62: =RC[-30] -> 0 | AU62: =RC[-30] -> 0 | AV62: =RC[-30] ->  | AW62: =RC[-30] -> 
A63: =IF(RC[1]="","",DATEVALUE(RC[1])) ->  | S63: =RC[-1] ->  | T63: =(RC[-16]*RC[-15]-RC[-13]*RC[-12])/1000 -> 0 | W63: =RC[-2]*RC[-10]/1000 -> #VALUE! | X63: =ABS((RC[-3]*RC[-11]-RC[-2]*RC[-9])/1000) -> #VALUE! | Y63: =(RC[-14]-RC[1])/RC[-18]*100 -> #VALUE! | AC63: =VALUE(RC[-27]) -> #VALUE! | AD63: =IF(RC[21]=42,"*",IF(RC[21]=32,"",RC[21])) ->  | AE63: =RC[-28] ->  | AF63: =RC[-28] -> 0 | AG63: =RC[-28] -> 0 | AH63: =RC[-28] -> 0 | AI63: =RC[-28] -> 0 | AJ63: =RC[-28] -> 0 | AK63: =RC[-28] -> 0 | AL63: =RC[-28] -> 0 | AM63: =RC[-28] -> 0 | AN63: =RC[-28] ->  | AO63: =RC[-28] ->  | AP63: - | AQ63: =RC[-29] -> 0 | AR63: =RC[-29] -> 0 | AS63: - | AT63: =RC[-30] -> 0 | AU63: =RC[-30] -> 0 | AV63: =RC[-30] ->  | AW63: =RC[-30] -> 
A64: =IF(RC[1]="","",DATEVALUE(RC[1])) ->  | S64: =RC[-1] ->  | T64: =(RC[-16]*RC[-15]-RC[-13]*RC[-12])/1000 -> 0 | W64: =RC[-2]*RC[-10]/1000 -> #VALUE! | X64: =ABS((RC[-3]*RC[-11]-RC[-2]*RC[-9])/1000) -> #VALUE! | Y64: =(RC[-14]-RC[1])/RC[-18]*100 -> #VALUE! | AC64: =VALUE(RC[-27]) -> #VALUE! | AD64: =IF(RC[21]=42,"*",IF(RC[21]=32,"",RC[21])) ->  | AE64: =RC[-28] ->  | AF64: =RC[-28] -> 0 | AG64: =RC[-28] -> 0 | AH64: =RC[-28] -> 0 | AI64: =RC[-28] -> 0 | AJ64: =RC[-28] -> 0 | AK64: =RC[-28] -> 0 | AL64: =RC[-28] -> 0 | AM64: =RC[-28] -> 0 | AN64: =RC[-28] ->  | AO64: =RC[-28] ->  | AP64: - | AQ64: =RC[-29] -> 0 | AR64: =RC[-29] -> 0 | AS64: - | AT64: =RC[-30] -> 0 | AU64: =RC[-30] -> 0 | AV64: =RC[-30] ->  | AW64: =RC[-30] -> 
A65: =IF(RC[1]="","",DATEVALUE(RC[1])) ->  | S65: =RC[-1] ->  | T65: =(RC[-16]*RC[-15]-RC[-13]*RC[-12])/1000 -> 0 | W65: =RC[-2]*RC[-10]/1000 -> #VALUE! | X65: =ABS((RC[-3]*RC[-11]-RC[-2]*RC[-9])/1000) -> #VALUE! | Y65: =(RC[-14]-RC[1])/RC[-18]*100 -> #VALUE! | AC65: =VALUE(RC[-27]) -> #VALUE! | AD65: =IF(RC[21]=42,"*",IF(RC[21]=32,"",RC[21])) ->  | AE65: =RC[-28] ->  | AF65: =RC[-28] -> 0 | AG65: =RC[-28] -> 0 | AH65: =RC[-28] -> 0 | AI65: =RC[-28] -> 0 | AJ65: =RC[-28] -> 0 | AK65: =RC[-28] -> 0 | AL65: =RC[-28] -> 0 | AM65: =RC[-28] -> 0 | AN65: =RC[-28] ->  | AO65: =RC[-28] ->  | AP65: - | AQ65: =RC[-29] -> 0 | AR65: =RC[-29] -> 0 | AS65: - | AT65: =RC[-30] -> 0 | AU65: =RC[-30] -> 0 | AV65: =RC[-30] ->  | AW65: =RC[-30] -> 
A66: =IF(RC[1]="","",DATEVALUE(RC[1])) ->  | S66: =RC[-1] ->  | T66: =(RC[-16]*RC[-15]-RC[-13]*RC[-12])/1000 -> 0 | W66: =RC[-2]*RC[-10]/1000 -> #VALUE! | X66: =ABS((RC[-3]*RC[-11]-RC[-2]*RC[-9])/1000) -> #VALUE! | Y66: =(RC[-14]-RC[1])/RC[-18]*100 -> #VALUE! | AC66: =VALUE(RC[-27]) -> #VALUE! | AD66: =IF(RC[21]=42,"*",IF(RC[21]=32,"",RC[21])) ->  | AE66: =RC[-28] ->  | AF66: =RC[-28] -> 0 | AG66: =RC[-28] -> 0 | AH66: =RC[-28] -> 0 | AI66: =RC[-28] -> 0 | AJ66: =RC[-28] -> 0 | AK66: =RC[-28] -> 0 | AL66: =RC[-28] -> 0 | AM66: =RC[-28] -> 0 | AN66: =RC[-28] ->  | AO66: =RC[-28] ->  | AP66: - | AQ66: =RC[-29] -> 0 | AR66: =RC[-29] -> 0 | AS66: - | AT66: =RC[-30] -> 0 | AU66: =RC[-30] -> 0 | AV66: =RC[-30] ->  | AW66: =RC[-30] -> 
A67: =IF(RC[1]="","",DATEVALUE(RC[1])) ->  | S67: =RC[-1] ->  | T67: =(RC[-16]*RC[-15]-RC[-13]*RC[-12])/1000 -> 0 | W67: =RC[-2]*RC[-10]/1000 -> #VALUE! | X67: =ABS((RC[-3]*RC[-11]-RC[-2]*RC[-9])/1000) -> #VALUE! | Y67: =(RC[-14]-RC[1])/RC[-18]*100 -> #VALUE! | AC67: =VALUE(RC[-27]) -> #VALUE! | AD67: =IF(RC[21]=42,"*",IF(RC[21]=32,"",RC[21])) ->  | AE67: =RC[-28] ->  | AF67: =RC[-28] -> 0 | AG67: =RC[-28] -> 0 | AH67: =RC[-28] -> 0 | AI67: =RC[-28] -> 0 | AJ67: =RC[-28] -> 0 | AK67: =RC[-28] -> 0 | AL67: =RC[-28] -> 0 | AM67: =RC[-28] -> 0 | AN67: =RC[-28] ->  | AO67: =RC[-28] ->  | AP67: - | AQ67: =RC[-29] -> 0 | AR67: =RC[-29] -> 0 | AS67: - | AT67: =RC[-30] -> 0 | AU67: =RC[-30] -> 0 | AV67: =RC[-30] ->  | AW67: =RC[-30] -> 
A68: =IF(RC[1]="","",DATEVALUE(RC[1])) ->  | S68: =RC[-1] ->  | T68: =(RC[-16]*RC[-15]-RC[-13]*RC[-12])/1000 -> 0 | W68: =RC[-2]*RC[-10]/1000 -> #VALUE! | X68: =ABS((RC[-3]*RC[-11]-RC[-2]*RC[-9])/1000) -> #VALUE! | Y68: =(RC[-14]-RC[1])/RC[-18]*100 -> #VALUE! | AC68: =VALUE(RC[-27]) -> #VALUE! | AD68: =IF(RC[21]=42,"*",IF(RC[21]=32,"",RC[21])) ->  | AE68: =RC[-28] ->  | AF68: =RC[-28] -> 0 | AG68: =RC[-28] -> 0 | AH68: =RC[-28] -> 0 | AI68: =RC[-28] -> 0 | AJ68: =RC[-28] -> 0 | AK68: =RC[-28] -> 0 | AL68: =RC[-28] -> 0 | AM68: =RC[-28] -> 0 | AN68: =RC[-28] ->  | AO68: =RC[-28] ->  | AP68: - | AQ68: =RC[-29] -> 0 | AR68: =RC[-29] -> 0 | AS68: - | AT68: =RC[-30] -> 0 | AU68: =RC[-30] -> 0 | AV68: =RC[-30] ->  | AW68: =RC[-30] -> 
A69: =IF(RC[1]="","",DATEVALUE(RC[1])) ->  | S69: =RC[-1] ->  | T69: =(RC[-16]*RC[-15]-RC[-13]*RC[-12])/1000 -> 0 | W69: =RC[-2]*RC[-10]/1000 -> #VALUE! | X69: =ABS((RC[-3]*RC[-11]-RC[-2]*RC[-9])/1000) -> #VALUE! | Y69: =(RC[-14]-RC[1])/RC[-18]*100 -> #VALUE! | AC69: =VALUE(RC[-27]) -> #VALUE! | AD69: =IF(RC[21]=42,"*",IF(RC[21]=32,"",RC[21])) ->  | AE69: =RC[-28] ->  | AF69: =RC[-28] -> 0 | AG69: =RC[-28] -> 0 | AH69: =RC[-28] -> 0 | AI69: =RC[-28] -> 0 | AJ69: =RC[-28] -> 0 | AK69: =RC[-28] -> 0 | AL69: =RC[-28] -> 0 | AM69: =RC[-28] -> 0 | AN69: =RC[-28] ->  | AO69: =RC[-28] ->  | AP69: - | AQ69: =RC[-29] -> 0 | AR69: =RC[-29] -> 0 | AS69: - | AT69: =RC[-30] -> 0 | AU69: =RC[-30] -> 0 | AV69: =RC[-30] ->  | AW69: =RC[-30] -> 
A70: =IF(RC[1]="","",DATEVALUE(RC[1])) ->  | S70: =RC[-1] ->  | T70: =(RC[-16]*RC[-15]-RC[-13]*RC[-12])/1000 -> 0 | W70: =RC[-2]*RC[-10]/1000 -> #VALUE! | X70: =ABS((RC[-3]*RC[-11]-RC[-2]*RC[-9])/1000) -> #VALUE! | Y70: =(RC[-14]-RC[1])/RC[-18]*100 -> #VALUE! | AC70: =VALUE(RC[-27]) -> #VALUE! | AD70: =IF(RC[21]=42,"*",IF(RC[21]=32,"",RC[21])) ->  | AE70: =RC[-28] ->  | AF70: =RC[-28] -> 0 | AG70: =RC[-28] -> 0 | AH70: =RC[-28] -> 0 | AI70: =RC[-28] -> 0 | AJ70: =RC[-28] -> 0 | AK70: =RC[-28] -> 0 | AL70: =RC[-28] -> 0 | AM70: =RC[-28] -> 0 | AN70: =RC[-28] ->  | AO70: =RC[-28] ->  | AP70: - | AQ70: =RC[-29] -> 0 | AR70: =RC[-29] -> 0 | AS70: - | AT70: =RC[-30] -> 0 | AU70: =RC[-30] -> 0 | AV70: =RC[-30] ->  | AW70: =RC[-30] -> 
A71: =IF(RC[1]="","",DATEVALUE(RC[1])) ->  | S71: =RC[-1] ->  | T71: =(RC[-16]*RC[-15]-RC[-13]*RC[-12])/1000 -> 0 | W71: =RC[-2]*RC[-10]/1000 -> #VALUE! | X71: =ABS((RC[-3]*RC[-11]-RC[-2]*RC[-9])/1000) -> #VALUE! | Y71: =(RC[-14]-RC[1])/RC[-18]*100 -> #VALUE! | AC71: =VALUE(RC[-27]) -> #VALUE! | AD71: =IF(RC[21]=42,"*",IF(RC[21]=32,"",RC[21])) ->  | AE71: =RC[-28] ->  | AF71: =RC[-28] -> 0 | AG71: =RC[-28] -> 0 | AH71: =RC[-28] -> 0 | AI71: =RC[-28] -> 0 | AJ71: =RC[-28] -> 0 | AK71: =RC[-28] -> 0 | AL71: =RC[-28] -> 0 | AM71: =RC[-28] -> 0 | AN71: =RC[-28] ->  | AO71: =RC[-28] ->  | AP71: - | AQ71: =RC[-29] -> 0 | AR71: =RC[-29] -> 0 | AS71: - | AT71: =RC[-30] -> 0 | AU71: =RC[-30] -> 0 | AV71: =RC[-30] ->  | AW71: =RC[-30] -> 
A72: =IF(RC[1]="","",DATEVALUE(RC[1])) ->  | S72: =RC[-1] ->  | T72: =(RC[-16]*RC[-15]-RC[-13]*RC[-12])/1000 -> 0 | W72: =RC[-2]*RC[-10]/1000 -> #VALUE! | X72: =ABS((RC[-3]*RC[-11]-RC[-2]*RC[-9])/1000) -> #VALUE! | Y72: =(RC[-14]-RC[1])/RC[-18]*100 -> #VALUE! | AC72: =VALUE(RC[-27]) -> #VALUE! | AD72: =IF(RC[21]=42,"*",IF(RC[21]=32,"",RC[21])) ->  | AE72: =RC[-28] ->  | AF72: =RC[-28] -> 0 | AG72: =RC[-28] -> 0 | AH72: =RC[-28] -> 0 | AI72: =RC[-28] -> 0 | AJ72: =RC[-28] -> 0 | AK72: =RC[-28] -> 0 | AL72: =RC[-28] -> 0 | AM72: =RC[-28] -> 0 | AN72: =RC[-28] ->  | AO72: =RC[-28] ->  | AP72: - | AQ72: =RC[-29] -> 0 | AR72: =RC[-29] -> 0 | AS72: - | AT72: =RC[-30] -> 0 | AU72: =RC[-30] -> 0 | AV72: =RC[-30] ->  | AW72: =RC[-30] -> 
A73: =IF(RC[1]="","",DATEVALUE(RC[1])) ->  | S73: =RC[-1] ->  | T73: =(RC[-16]*RC[-15]-RC[-13]*RC[-12])/1000 -> 0 | W73: =RC[-2]*RC[-10]/1000 -> #VALUE! | X73: =ABS((RC[-3]*RC[-11]-RC[-2]*RC[-9])/1000) -> #VALUE! | Y73: =(RC[-14]-RC[1])/RC[-18]*100 -> #VALUE! | AC73: =VALUE(RC[-27]) -> #VALUE! | AD73: =IF(RC[21]=42,"*",IF(RC[21]=32,"",RC[21])) ->  | AE73: =RC[-28] ->  | AF73: =RC[-28] -> 0 | AG73: =RC[-28] -> 0 | AH73: =RC[-28] -> 0 | AI73: =RC[-28] -> 0 | AJ73: =RC[-28] -> 0 | AK73: =RC[-28] -> 0 | AL73: =RC[-28] -> 0 | AM73: =RC[-28] -> 0 | AN73: =RC[-28] ->  | AO73: =RC[-28] ->  | AP73: - | AQ73: =RC[-29] -> 0 | AR73: =RC[-29] -> 0 | AS73: - | AT73: =RC[-30] -> 0 | AU73: =RC[-30] -> 0 | AV73: =RC[-30] ->  | AW73: =RC[-30] -> 
A74: =IF(RC[1]="","",DATEVALUE(RC[1])) ->  | S74: =RC[-1] ->  | T74: =(RC[-16]*RC[-15]-RC[-13]*RC[-12])/1000 -> 0 | W74: =RC[-2]*RC[-10]/1000 -> #VALUE! | X74: =ABS((RC[-3]*RC[-11]-RC[-2]*RC[-9])/1000) -> #VALUE! | Y74: =(RC[-14]-RC[1])/RC[-18]*100 -> #VALUE! | AC74: =VALUE(RC[-27]) -> #VALUE! | AD74: =IF(RC[21]=42,"*",IF(RC[21]=32,"",RC[21])) ->  | AE74: =RC[-28] ->  | AF74: =RC[-28] -> 0 | AG74: =RC[-28] -> 0 | AH74: =RC[-28] -> 0 | AI74: =RC[-28] -> 0 | AJ74: =RC[-28] -> 0 | AK74: =RC[-28] -> 0 | AL74: =RC[-28] -> 0 | AM74: =RC[-28] -> 0 | AN74: =RC[-28] ->  | AO74: =RC[-28] ->  | AP74: - | AQ74: =RC[-29] -> 0 | AR74: =RC[-29] -> 0 | AS74: - | AT74: =RC[-30] -> 0 | AU74: =RC[-30] -> 0 | AV74: =RC[-30] ->  | AW74: =RC[-30] -> 
A75: =IF(RC[1]="","",DATEVALUE(RC[1])) ->  | S75: =RC[-1] ->  | T75: =(RC[-16]*RC[-15]-RC[-13]*RC[-12])/1000 -> 0 | W75: =RC[-2]*RC[-10]/1000 -> #VALUE! | X75: =ABS((RC[-3]*RC[-11]-RC[-2]*RC[-9])/1000) -> #VALUE! | Y75: =(RC[-14]-RC[1])/RC[-18]*100 -> #VALUE! | AC75: =VALUE(RC[-27]) -> #VALUE! | AD75: =IF(RC[21]=42,"*",IF(RC[21]=32,"",RC[21])) ->  | AE75: =RC[-28] ->  | AF75: =RC[-28] -> 0 | AG75: =RC[-28] -> 0 | AH75: =RC[-28] -> 0 | AI75: =RC[-28] -> 0 | AJ75: =RC[-28] -> 0 | AK75: =RC[-28] -> 0 | AL75: =RC[-28] -> 0 | AM75: =RC[-28] -> 0 | AN75: =RC[-28] ->  | AO75: =RC[-28] ->  | AP75: - | AQ75: =RC[-29] -> 0 | AR75: =RC[-29] -> 0 | AS75: - | AT75: =RC[-30] -> 0 | AU75: =RC[-30] -> 0 | AV75: =RC[-30] ->  | AW75: =RC[-30] -> 
A76: =IF(RC[1]="","",DATEVALUE(RC[1])) ->  | S76: =RC[-1] ->  | T76: =(RC[-16]*RC[-15]-RC[-13]*RC[-12])/1000 -> 0 | W76: =RC[-2]*RC[-10]/1000 -> #VALUE! | X76: =ABS((RC[-3]*RC[-11]-RC[-2]*RC[-9])/1000) -> #VALUE! | Y76: =(RC[-14]-RC[1])/RC[-18]*100 -> #VALUE! | AC76: =VALUE(RC[-27]) -> #VALUE! | AD76: =IF(RC[21]=42,"*",IF(RC[21]=32,"",RC[21])) ->  | AE76: =RC[-28] ->  | AF76: =RC[-28] -> 0 | AG76: =RC[-28] -> 0 | AH76: =RC[-28] -> 0 | AI76: =RC[-28] -> 0 | AJ76: =RC[-28] -> 0 | AK76: =RC[-28] -> 0 | AL76: =RC[-28] -> 0 | AM76: =RC[-28] -> 0 | AN76: =RC[-28] ->  | AO76: =RC[-28] ->  | AP76: - | AQ76: =RC[-29] -> 0 | AR76: =RC[-29] -> 0 | AS76: - | AT76: =RC[-30] -> 0 | AU76: =RC[-30] -> 0 | AV76: =RC[-30] ->  | AW76: =RC[-30] -> 
A77: =IF(RC[1]="","",DATEVALUE(RC[1])) ->  | S77: =RC[-1] ->  | T77: =(RC[-16]*RC[-15]-RC[-13]*RC[-12])/1000 -> 0 | W77: =RC[-2]*RC[-10]/1000 -> #VALUE! | X77: =ABS((RC[-3]*RC[-11]-RC[-2]*RC[-9])/1000) -> #VALUE! | Y77: =(RC[-14]-RC[1])/RC[-18]*100 -> #VALUE! | AC77: =VALUE(RC[-27]) -> #VALUE! | AD77: =IF(RC[21]=42,"*",IF(RC[21]=32,"",RC[21])) ->  | AE77: =RC[-28] ->  | AF77: =RC[-28] -> 0 | AG77: =RC[-28] -> 0 | AH77: =RC[-28] -> 0 | AI77: =RC[-28] -> 0 | AJ77: =RC[-28] -> 0 | AK77: =RC[-28] -> 0 | AL77: =RC[-28] -> 0 | AM77: =RC[-28] -> 0 | AN77: =RC[-28] ->  | AO77: =RC[-28] ->  | AP77: - | AQ77: =RC[-29] -> 0 | AR77: =RC[-29] -> 0 | AS77: - | AT77: =RC[-30] -> 0 | AU77: =RC[-30] -> 0 | AV77: =RC[-30] ->  | AW77: =RC[-30] -> 
A78: =IF(RC[1]="","",DATEVALUE(RC[1])) ->  | S78: =RC[-1] ->  | T78: =(RC[-16]*RC[-15]-RC[-13]*RC[-12])/1000 -> 0 | W78: =RC[-2]*RC[-10]/1000 -> #VALUE! | X78: =ABS((RC[-3]*RC[-11]-RC[-2]*RC[-9])/1000) -> #VALUE! | Y78: =(RC[-14]-RC[1])/RC[-18]*100 -> #VALUE! | AC78: =VALUE(RC[-27]) -> #VALUE! | AD78: =IF(RC[21]=42,"*",IF(RC[21]=32,"",RC[21])) ->  | AE78: =RC[-28] ->  | AF78: =RC[-28] -> 0 | AG78: =RC[-28] -> 0 | AH78: =RC[-28] -> 0 | AI78: =RC[-28] -> 0 | AJ78: =RC[-28] -> 0 | AK78: =RC[-28] -> 0 | AL78: =RC[-28] -> 0 | AM78: =RC[-28] -> 0 | AN78: =RC[-28] ->  | AO78: =RC[-28] ->  | AP78: - | AQ78: =RC[-29] -> 0 | AR78: =RC[-29] -> 0 | AS78: - | AT78: =RC[-30] -> 0 | AU78: =RC[-30] -> 0 | AV78: =RC[-30] ->  | AW78: =RC[-30] -> 
A79: =IF(RC[1]="","",DATEVALUE(RC[1])) ->  | S79: =RC[-1] ->  | T79: =(RC[-16]*RC[-15]-RC[-13]*RC[-12])/1000 -> 0 | W79: =RC[-2]*RC[-10]/1000 -> #VALUE! | X79: =ABS((RC[-3]*RC[-11]-RC[-2]*RC[-9])/1000) -> #VALUE! | Y79: =(RC[-14]-RC[1])/RC[-18]*100 -> #VALUE! | AC79: =VALUE(RC[-27]) -> #VALUE! | AD79: =IF(RC[21]=42,"*",IF(RC[21]=32,"",RC[21])) ->  | AE79: =RC[-28] ->  | AF79: =RC[-28] -> 0 | AG79: =RC[-28] -> 0 | AH79: =RC[-28] -> 0 | AI79: =RC[-28] -> 0 | AJ79: =RC[-28] -> 0 | AK79: =RC[-28] -> 0 | AL79: =RC[-28] -> 0 | AM79: =RC[-28] -> 0 | AN79: =RC[-28] ->  | AO79: =RC[-28] ->  | AP79: - | AQ79: =RC[-29] -> 0 | AR79: =RC[-29] -> 0 | AS79: - | AT79: =RC[-30] -> 0 | AU79: =RC[-30] -> 0 | AV79: =RC[-30] ->  | AW79: =RC[-30] -> 
A80: =IF(RC[1]="","",DATEVALUE(RC[1])) ->  | S80: =RC[-1] ->  | T80: =(RC[-16]*RC[-15]-RC[-13]*RC[-12])/1000 -> 0 | W80: =RC[-2]*RC[-10]/1000 -> #VALUE! | X80: =ABS((RC[-3]*RC[-11]-RC[-2]*RC[-9])/1000) -> #VALUE! | Y80: =(RC[-14]-RC[1])/RC[-18]*100 -> #VALUE! | AC80: =VALUE(RC[-27]) -> #VALUE! | AD80: =IF(RC[21]=42,"*",IF(RC[21]=32,"",RC[21])) ->  | AE80: =RC[-28] ->  | AF80: =RC[-28] -> 0 | AG80: =RC[-28] -> 0 | AH80: =RC[-28] -> 0 | AI80: =RC[-28] -> 0 | AJ80: =RC[-28] -> 0 | AK80: =RC[-28] -> 0 | AL80: =RC[-28] -> 0 | AM80: =RC[-28] -> 0 | AN80: =RC[-28] ->  | AO80: =RC[-28] ->  | AP80: - | AQ80: =RC[-29] -> 0 | AR80: =RC[-29] -> 0 | AS80: - | AT80: =RC[-30] -> 0 | AU80: =RC[-30] -> 0 | AV80: =RC[-30] ->  | AW80: =RC[-30] -> 
A81: =IF(RC[1]="","",DATEVALUE(RC[1])) ->  | S81: =RC[-1] ->  | T81: =(RC[-16]*RC[-15]-RC[-13]*RC[-12])/1000 -> 0 | W81: =RC[-2]*RC[-10]/1000 -> #VALUE! | X81: =ABS((RC[-3]*RC[-11]-RC[-2]*RC[-9])/1000) -> #VALUE! | Y81: =(RC[-14]-RC[1])/RC[-18]*100 -> #VALUE! | AC81: =VALUE(RC[-27]) -> #VALUE! | AD81: =IF(RC[21]=42,"*",IF(RC[21]=32,"",RC[21])) ->  | AE81: =RC[-28] ->  | AF81: =RC[-28] -> 0 | AG81: =RC[-28] -> 0 | AH81: =RC[-28] -> 0 | AI81: =RC[-28] -> 0 | AJ81: =RC[-28] -> 0 | AK81: =RC[-28] -> 0 | AL81: =RC[-28] -> 0 | AM81: =RC[-28] -> 0 | AN81: =RC[-28] ->  | AO81: =RC[-28] ->  | AP81: - | AQ81: =RC[-29] -> 0 | AR81: =RC[-29] -> 0 | AS81: - | AT81: =RC[-30] -> 0 | AU81: =RC[-30] -> 0 | AV81: =RC[-30] ->  | AW81: =RC[-30] -> 
A82: =IF(RC[1]="","",DATEVALUE(RC[1])) ->  | S82: =RC[-1] ->  | T82: =(RC[-16]*RC[-15]-RC[-13]*RC[-12])/1000 -> 0 | W82: =RC[-2]*RC[-10]/1000 -> #VALUE! | X82: =ABS((RC[-3]*RC[-11]-RC[-2]*RC[-9])/1000) -> #VALUE! | Y82: =(RC[-14]-RC[1])/RC[-18]*100 -> #VALUE! | AC82: =VALUE(RC[-27]) -> #VALUE! | AD82: =IF(RC[21]=42,"*",IF(RC[21]=32,"",RC[21])) ->  | AE82: =RC[-28] ->  | AF82: =RC[-28] -> 0 | AG82: =RC[-28] -> 0 | AH82: =RC[-28] -> 0 | AI82: =RC[-28] -> 0 | AJ82: =RC[-28] -> 0 | AK82: =RC[-28] -> 0 | AL82: =RC[-28] -> 0 | AM82: =RC[-28] -> 0 | AN82: =RC[-28] ->  | AO82: =RC[-28] ->  | AP82: - | AQ82: =RC[-29] -> 0 | AR82: =RC[-29] -> 0 | AS82: - | AT82: =RC[-30] -> 0 | AU82: =RC[-30] -> 0 | AV82: =RC[-30] ->  | AW82: =RC[-30] -> 
A83: =IF(RC[1]="","",DATEVALUE(RC[1])) ->  | S83: =RC[-1] ->  | T83: =(RC[-16]*RC[-15]-RC[-13]*RC[-12])/1000 -> 0 | W83: =RC[-2]*RC[-10]/1000 -> #VALUE! | X83: =ABS((RC[-3]*RC[-11]-RC[-2]*RC[-9])/1000) -> #VALUE! | Y83: =(RC[-14]-RC[1])/RC[-18]*100 -> #VALUE! | AC83: =VALUE(RC[-27]) -> #VALUE! | AD83: =IF(RC[21]=42,"*",IF(RC[21]=32,"",RC[21])) ->  | AE83: =RC[-28] ->  | AF83: =RC[-28] -> 0 | AG83: =RC[-28] -> 0 | AH83: =RC[-28] -> 0 | AI83: =RC[-28] -> 0 | AJ83: =RC[-28] -> 0 | AK83: =RC[-28] -> 0 | AL83: =RC[-28] -> 0 | AM83: =RC[-28] -> 0 | AN83: =RC[-28] ->  | AO83: =RC[-28] ->  | AP83: - | AQ83: =RC[-29] -> 0 | AR83: =RC[-29] -> 0 | AS83: - | AT83: =RC[-30] -> 0 | AU83: =RC[-30] -> 0 | AV83: =RC[-30] ->  | AW83: =RC[-30] -> 
AC84: Среднее | AF84: =R[1]C[-28] -> 0 | AG84: =R[1]C[-28] -> 0 | AH84: =R[1]C[-28] -> 0 | AI84: =R[1]C[-28] -> 0 | AJ84: =R[1]C[-28] -> 0 | AK84: =R[1]C[-28] -> 0 | AL84: =R[1]C[-28] -> 0 | AM84: =R[1]C[-28] -> 0 | AN84: =R[1]C[-28] -> 36.595806451612901 | AO84: =R[1]C[-28] -> 59.796129032258065 | AP84: - | AQ84: =R[1]C[-29] -> 0 | AR84: =R[1]C[-29] -> 0 | AS84: - | AT84: =R[1]C[-30] -> 0 | AU84: =R[1]C[-30] -> 0
B85: Среднее | L85: =IF(SUM(OFFSET(R[-74]C,3,0,R7C1,1))=0,"",AVERAGE(OFFSET(R[-74]C,3,0,R7C1,1))) -> 36.595806451612901 | M85: =IF(SUM(OFFSET(R[-74]C,3,0,R7C1,1))=0,"",AVERAGE(OFFSET(R[-74]C,3,0,R7C1,1))) -> 59.796129032258065 | R85: =IF(SUM(OFFSET(R[-74]C,3,0,R7C1,1))=0,"",AVERAGE(OFFSET(R[-74]C,3,0,R7C1,1))) -> 2.1530967741935485 | S85: =AVERAGE(OFFSET(R[-74]C,3,0,R7C1,1)) -> 2.1530967741935485 | T85: =AVERAGE(OFFSET(R[-74]C,3,0,R7C1,1)) -> 0 | W85: =AVERAGE(OFFSET(R[-74]C,3,0,R7C1,1)) -> #VALUE! | X85: =AVERAGE(OFFSET(R[-74]C,3,0,R7C1,1)) -> #VALUE! | AC85: Итого | AE85: =R[1]C[-28] -> 744 | AF85: =R[1]C[-28] -> 0 | AI85: =R[1]C[-28] -> 0 | AM85: =R[1]C[-28] -> 0 | AN85: =R[1]C[-28] -> 1134.47 | AQ85: =R[1]C[-29] -> 0 | AU85: =R[1]C[-30] -> 0 | AV85: =R[1]C[-30] -> 66.746000000000009 | AW85: =R[1]C[-30] -> 66.746000000000009
B86: ИТОГО: | C86: =SUM(OFFSET(R[-75]C,3,0,R7C1,1)) -> 744 | L86: =IF(SUM(OFFSET(R[-75]C,3,0,R7C1,1))=0,"",SUM(OFFSET(R[-75]C,3,0,R7C1,1))) -> 1134.47 | R86: =IF(SUM(OFFSET(R[-75]C,3,0,R7C1,1))=0,"",SUM(OFFSET(R[-75]C,3,0,R7C1,1))) -> 66.746000000000009 | S86: =SUM(OFFSET(R[-75]C,3,0,R7C1,1)) -> 66.746000000000009 | T86: =SUM(OFFSET(R[-75]C,3,0,R7C1,1)) -> 0 | W86: =SUM(OFFSET(R[-75]C,3,0,R7C1,1)) -> #VALUE! | X86: =SUM(OFFSET(R[-75]C,3,0,R7C1,1)) -> #VALUE!
AC87: Досчёт | AF87: =R[1]C[-28] -> 0 | AI87: =R[1]C[-28] -> 0 | AM87: =R[1]C[-28] -> 0 | AN87: =R[1]C[-28] -> 0 | AQ87: =R[1]C[-29] -> 0 | AU87: =R[1]C[-30] -> 0 | AV87: =R[1]C[-30] -> 0 | AW87: =R[1]C[-30] -> 0
A88: 11дн=264ч 4дн=96ч | B88: Досчёт до конца м-ца (+) | C88: =R6C1*24 -> 192 | L88: 0 | R88: 0 | S88: 0 | T88: № 107106 | AC88: Снятие | AF88: =-R[1]C[-28] -> 0 | AI88: =-R[1]C[-28] -> 0 | AM88: =-R[1]C[-28] -> 0 | AN88: =-R[1]C[-28] -> 0 | AQ88: =-R[1]C[-29] -> 0 | AU88: =-R[1]C[-30] -> 0 | AV88: =-R[1]C[-30] -> 0 | AW88: =-R[1]C[-30] -> 0
A89: 9дн=216ч 7дн=168ч | B89: Вычет с предыдущего (-) | C89: =R4C1*24 -> 216 | AC89: Сумма | AF89: =R[1]C[-28] -> 0 | AI89: =R[1]C[-28] -> 0 | AM89: =R[1]C[-28] -> 0 | AN89: =R[1]C[-28] -> 1134.47 | AQ89: =R[1]C[-29] -> 0 | AU89: =R[1]C[-30] -> 0 | AV89: =R[1]C[-30] -> 66.746000000000009 | AW89: =R[1]C[-30] -> 66.746000000000009
B90: СУММА: | C90: =R[-4]C+R[-2]C-R[-1]C -> 720 | L90: =IF(SUM(OFFSET(R[-79]C,3,0,R7C1,1))=0,"",(R[-4]C+R[-2]C-R[-1]C)) -> 1134.47 | R90: =IF(SUM(OFFSET(R[-79]C,3,0,R7C1,1))=0,"",(R[-4]C+R[-2]C-R[-1]C)) -> 66.746000000000009 | S90: =R[-4]C+R[-2]C-R[-1]C -> 66.746000000000009
AC91: Тхв на источнике | AE91: V гвс (м3) | AF91: =R[-2]C[15] -> 0 | AG91: W гвс (Гкал) | AH91: =RC[-2]*0.06 -> 0 | AI91: W без гвс (Гкал) | AJ91: =R[-2]C[13]-RC[-2] -> 66.746000000000009
B92: Показания счетчиков на момент снятия данных:
B93: Дата, время | D93: М1, т | F93: М2, т | H93: М3, т | J93: М4, т | L93: Qо, Гкал | N93: Qг, Гкал | P93: время, час
B94: 24.08.18 00:00 | D94: 65064.56 | F94: 50489.88 | H94: 17036.939999999999 | J94: - | L94: 2463.0309999999999 | N94: 1172.3989999999999 | P94: -
B95: 19.09.18 01:00 | D95: 65958.47 | F95: 50489.88 | H95: 17977.96 | J95: - | L95: 2515.895 | N95: 1227.9829999999999 | P95: -
AC97: =ZAYAVKA_N -> з. на доп.№ 02/147-2548 от 5.10.2017
B98: Представитель потребителя:_______________________________________________________________________ В.О. Топорков
I101: Рекомендуемые значения по параметрам теплопотребления (не являются официально утверждёнными)
I102: М, т | J102: V, м3 | K102: Qгвс, Гкал | L102: Qотоп, Гкал | M102: Qо, Гкал
I103: =R[-13]C[-3] -> 0 | J103: =RC[-1]/0.98 -> 0 | K103: =RC[-1]*0.06 -> 0 | L103: =RC[1]-RC[-1] -> 66.746000000000009 | M103: =R[-13]C[5] -> 66.746000000000009
O105: ДЛЯ САМОКОНТРОЛЯ
B106: В строке выбора дат указать период с 16.7.13 по 23.8.13 - жильё | N106: Q | O106: Qг
B107: В строке выбора дат указать период с 18.7.13 по 25.8.13 - не жилое | N107: =(R[-21]C[-10]*R[-22]C[-7]-R[-21]C[-9]*R[-22]C[-6])/1000 -> 0 | O107: =IF(R[-22]C[-2]="",R[-21]C[-3]*R[-22]C/1000,"") ->  | P107: Си2
O108: =IF(R[-23]C[-2]="","",((R[-22]C[-3]*R[-23]C)-(R[-22]C[-2]*R[-23]C[2]))/1000) -> 0 | P108: Си3