Sheet: Лист1
G1: Отчёт о теплопотреблении за октябрь 2018 | M1: з.н д. №02/147-2783 от 04.10.18 29.09.18г некорректная работа М3
A4: =EOMONTH(R[9]C,0)-R[9]C -> 8 | B4: Потребитель: ЗАО "Сити Сервис"
A5: =MAX(R[9]C:R[78]C) -> 2018-10-22T00:00:00.000 | B5: Адрес: г. СПб, Кораблестроителей ул., д.35 к.1 ИТП 1
A6: =EOMONTH(R[-1]C,0)-R[-1]C -> 9 | B6: Телефон: 8-911-021-19-79
A7: =R[-2]C-R[6]C -> 30 | B7: Договор 10023-2(.)400
A8: 7 | B8: Тепловычислитель: ВТД-УВ № B04A | L8: М2 мах= | M8: 62.4 | O8: Мгвс мах= | P8: 36.72
L9: Qотоп мах= | M9: 4.992 | O9: Qгвс мах= | P9: 2.208
B10: Расчётная формула: Q=M1*(h1-h2)+(M1-M2)*(h2-hхв)
D12: Учет | L12: Контроль
A13: =R[1]C[1]-1 -> 2018-09-22T00:00:00.000 | B13: Дата | C13: N, ч | D13: M1, т | E13: T1, С | F13: P1, кг/см2 | G13: M2, т | H13: T2, С | I13: P2, кг/см2 | J13: dT, С | K13: M1-М2, т | L13: V3, м3 | M13: T3, С | N13: V4, м3 | O13: =IF(R[-12]C[-14]="м.куб","","T4, С") -> T4, С | P13: dT, С | Q13: V3-V4, м3 | R13: Qгвс, Гкал | S13: Qобщ., Гкал | T13: Q | U13: M3 | V13: M4 | W13: си2 | X13: си3 | Y13: Разб. | Z13: dM2 | AC13: Дата | AD13: НС | AE13: n, ч | AF13: М1, т | AG13: t1, гр. С | AH13: Р1, кгс/см2 | AI13: М2, т | AJ13: t2, гр. С | AK13: Р2, кгс/см2 | AL13: t1-t2, гр. С | AM13: М1-М2, т | AN13: М1гвс, т | AO13: t1гвс, гр. С | AP13: Р1гвс, кгс/см2 | AQ13: М2гвс, т | AR13: t2гвс, гр. С | AS13: Р2гвс, кгс/см2 | AT13: t1гвс-t2гвс | AU13: М1гвс-М2гвс, т | AV13: Wгвс, Гкал | AW13: Wсумм, Гкал | AY13: NS_TV1 | AZ13: НС | BA13: NS_TV2
A14: =IF(RC[1]="","",DATEVALUE(RC[1])) -> 43366 | B14: 23.09.18 | C14: 24 | D14: 8.0470943500000001 | E14: 66.78 | F14: 0 | G14: 0 | H14: 22.32 | I14: 0 | J14: =RC[-5]-RC[-2] -> 44.46 | K14: 8.0470943500000001 | L14: 7.9966635699999999 | M14: 64.12 | R14: 0.53822219833763296 | S14: =RC[-1] -> 0.53822219833763296 | T14: =(RC[-16]*RC[-15]-RC[-13]*RC[-12])/1000 -> 0.53738496069300001 | U14: 7.8288054499999999 | V14: - | W14: =RC[-2]*RC[-10]/1000 -> 0.50198300545399999 | X14: =ABS((RC[-3]*RC[-11]-RC[-2]*RC[-9])/1000) -> #VALUE! | Y14: =(RC[-14]-RC[1])/RC[-18]*100 -> #DIV/0! | Z14: 7.8288054499999999 | AC14: =VALUE(RC[-27]) -> 2018-09-23T00:00:00.000 | AD14: =IF(RC[21]=42,"*",IF(RC[21]=32,"",RC[21])) -> - | AE14: =RC[-28] -> 24 | AF14: =RC[-28] -> 8.0470943500000001 | AG14: =RC[-28] -> 66.78 | AH14: =RC[-28] -> 0 | AI14: =RC[-28] -> 0 | AJ14: =RC[-28] -> 22.32 | AK14: =RC[-28] -> 0 | AL14: =RC[-28] -> 44.46 | AM14: =RC[-28] -> 8.0470943500000001 | AN14: =RC[-28] -> 7.9966635699999999 | AO14: =RC[-28] -> 64.12 | AP14: - | AQ14: =RC[-29] -> 0 | AR14: =RC[-29] -> 0 | AS14: - | AT14: =RC[-30] -> 0 | AU14: =RC[-30] -> 0 | AV14: =RC[-30] -> 0.53822219833763296 | AW14: =RC[-30] -> 0.53822219833763296 | AY14: - | AZ14: - | BA14: -
A15: =IF(RC[1]="","",DATEVALUE(RC[1])) -> 43367 | B15: 24.09.18 | C15: 24 | D15: 7.4983654 | E15: 66.66 | F15: 0 | G15: 0 | H15: 27.21 | I15: 0 | J15: =RC[-5]-RC[-2] -> 39.449999999999996 | K15: 7.4983654 | L15: 7.4606776200000002 | M15: 64.489999999999995 | R15: 0.49052025890895201 | S15: =RC[-1] -> 0.49052025890895201 | T15: =(RC[-16]*RC[-15]-RC[-13]*RC[-12])/1000 -> 0.499841037564 | U15: 7.31096506 | V15: - | W15: =RC[-2]*RC[-10]/1000 -> 0.47148413671939993 | X15: =ABS((RC[-3]*RC[-11]-RC[-2]*RC[-9])/1000) -> #VALUE! | Y15: =(RC[-14]-RC[1])/RC[-18]*100 -> #DIV/0! | Z15: 7.31096506 | AC15: =VALUE(RC[-27]) -> 2018-09-24T00:00:00.000 | AD15: =IF(RC[21]=42,"*",IF(RC[21]=32,"",RC[21])) -> - | AE15: =RC[-28] -> 24 | AF15: =RC[-28] -> 7.4983654 | AG15: =RC[-28] -> 66.66 | AH15: =RC[-28] -> 0 | AI15: =RC[-28] -> 0 | AJ15: =RC[-28] -> 27.21 | AK15: =RC[-28] -> 0 | AL15: =RC[-28] -> 39.449999999999996 | AM15: =RC[-28] -> 7.4983654 | AN15: =RC[-28] -> 7.4606776200000002 | AO15: =RC[-28] -> 64.489999999999995 | AP15: - | AQ15: =RC[-29] -> 0 | AR15: =RC[-29] -> 0 | AS15: - | AT15: =RC[-30] -> 0 | AU15: =RC[-30] -> 0 | AV15: =RC[-30] -> 0.49052025890895201 | AW15: =RC[-30] -> 0.49052025890895201 | AY15: - | AZ15: - | BA15: -
A16: =IF(RC[1]="","",DATEVALUE(RC[1])) -> 43368 | B16: 25.09.18 | C16: 24 | D16: 6.9424824699999999 | E16: 64.37 | F16: 0 | G16: 0 | H16: 20.09 | I16: 0 | J16: =RC[-5]-RC[-2] -> 44.28 | K16: 6.9424824699999999 | L16: 6.92772436 | M16: 62.01 | R16: 0.44490513757523598 | S16: =RC[-1] -> 0.44490513757523598 | T16: =(RC[-16]*RC[-15]-RC[-13]*RC[-12])/1000 -> 0.44688759659390004 | U16: 6.7948026700000002 | V16: - | W16: =RC[-2]*RC[-10]/1000 -> 0.42134571356669998 | X16: =ABS((RC[-3]*RC[-11]-RC[-2]*RC[-9])/1000) -> #VALUE! | Y16: =(RC[-14]-RC[1])/RC[-18]*100 -> #DIV/0! | Z16: 6.7948026700000002 | AC16: =VALUE(RC[-27]) -> 2018-09-25T00:00:00.000 | AD16: =IF(RC[21]=42,"*",IF(RC[21]=32,"",RC[21])) -> - | AE16: =RC[-28] -> 24 | AF16: =RC[-28] -> 6.9424824699999999 | AG16: =RC[-28] -> 64.37 | AH16: =RC[-28] -> 0 | AI16: =RC[-28] -> 0 | AJ16: =RC[-28] -> 20.09 | AK16: =RC[-28] -> 0 | AL16: =RC[-28] -> 44.28 | AM16: =RC[-28] -> 6.9424824699999999 | AN16: =RC[-28] -> 6.92772436 | AO16: =RC[-28] -> 62.01 | AP16: - | AQ16: =RC[-29] -> 0 | AR16: =RC[-29] -> 0 | AS16: - | AT16: =RC[-30] -> 0 | AU16: =RC[-30] -> 0 | AV16: =RC[-30] -> 0.44490513757523598 | AW16: =RC[-30] -> 0.44490513757523598 | AY16: - | AZ16: - | BA16: -
A17: =IF(RC[1]="","",DATEVALUE(RC[1])) -> 43369 | B17: 26.09.18 | C17: 24 | D17: 8.2876033800000002 | E17: 63.91 | F17: 0 | G17: 0 | H17: 19.63 | I17: 0 | J17: =RC[-5]-RC[-2] -> 44.28 | K17: 8.2876033800000002 | L17: 8.2927484499999995 | M17: 61.3 | R17: 0.53069653434604003 | S17: =RC[-1] -> 0.53069653434604003 | T17: =(RC[-16]*RC[-15]-RC[-13]*RC[-12])/1000 -> 0.5296607320158 | U17: 8.1346006400000004 | V17: - | W17: =RC[-2]*RC[-10]/1000 -> 0.498651019232 | X17: =ABS((RC[-3]*RC[-11]-RC[-2]*RC[-9])/1000) -> #VALUE! | Y17: =(RC[-14]-RC[1])/RC[-18]*100 -> #DIV/0! | Z17: 8.1346006400000004 | AC17: =VALUE(RC[-27]) -> 2018-09-26T00:00:00.000 | AD17: =IF(RC[21]=42,"*",IF(RC[21]=32,"",RC[21])) -> - | AE17: =RC[-28] -> 24 | AF17: =RC[-28] -> 8.2876033800000002 | AG17: =RC[-28] -> 63.91 | AH17: =RC[-28] -> 0 | AI17: =RC[-28] -> 0 | AJ17: =RC[-28] -> 19.63 | AK17: =RC[-28] -> 0 | AL17: =RC[-28] -> 44.28 | AM17: =RC[-28] -> 8.2876033800000002 | AN17: =RC[-28] -> 8.2927484499999995 | AO17: =RC[-28] -> 61.3 | AP17: - | AQ17: =RC[-29] -> 0 | AR17: =RC[-29] -> 0 | AS17: - | AT17: =RC[-30] -> 0 | AU17: =RC[-30] -> 0 | AV17: =RC[-30] -> 0.53069653434604003 | AW17: =RC[-30] -> 0.53069653434604003 | AY17: - | AZ17: - | BA17: -
A18: =IF(RC[1]="","",DATEVALUE(RC[1])) -> 43370 | B18: 27.09.18 | C18: 24 | D18: 7.0774073599999996 | E18: 60.57 | F18: 0 | G18: 0 | H18: 19.600000000000001 | I18: 0 | J18: =RC[-5]-RC[-2] -> 40.97 | K18: 7.0774073599999996 | L18: 7.0487089200000002 | M18: 58.6 | R18: 0.421820454762587 | S18: =RC[-1] -> 0.421820454762587 | T18: =(RC[-16]*RC[-15]-RC[-13]*RC[-12])/1000 -> 0.42867856379519997 | U18: 6.9306345 | V18: - | W18: =RC[-2]*RC[-10]/1000 -> 0.40613518170000001 | X18: =ABS((RC[-3]*RC[-11]-RC[-2]*RC[-9])/1000) -> #VALUE! | Y18: =(RC[-14]-RC[1])/RC[-18]*100 -> #DIV/0! | Z18: 6.9306345 | AC18: =VALUE(RC[-27]) -> 2018-09-27T00:00:00.000 | AD18: =IF(RC[21]=42,"*",IF(RC[21]=32,"",RC[21])) -> - | AE18: =RC[-28] -> 24 | AF18: =RC[-28] -> 7.0774073599999996 | AG18: =RC[-28] -> 60.57 | AH18: =RC[-28] -> 0 | AI18: =RC[-28] -> 0 | AJ18: =RC[-28] -> 19.600000000000001 | AK18: =RC[-28] -> 0 | AL18: =RC[-28] -> 40.97 | AM18: =RC[-28] -> 7.0774073599999996 | AN18: =RC[-28] -> 7.0487089200000002 | AO18: =RC[-28] -> 58.6 | AP18: - | AQ18: =RC[-29] -> 0 | AR18: =RC[-29] -> 0 | AS18: - | AT18: =RC[-30] -> 0 | AU18: =RC[-30] -> 0 | AV18: =RC[-30] -> 0.421820454762587 | AW18: =RC[-30] -> 0.421820454762587 | AY18: - | AZ18: - | BA18: -
A19: =IF(RC[1]="","",DATEVALUE(RC[1])) -> 43371 | B19: 28.09.18 | C19: 24 | D19: 35.597999569999999 | E19: 64.94 | F19: 0 | G19: 28.574958800000001 | H19: 29.84 | I19: 0 | J19: =RC[-5]-RC[-2] -> 35.099999999999994 | K19: 7.0230407699999997 | L19: 9.7117805500000003 | M19: 62.81 | R19: 0.635971367153912 | S19: 1.1198786256807101 | T19: =(RC[-16]*RC[-15]-RC[-13]*RC[-12])/1000 -> 1.4590573214837996 | U19: 9.5181693999999997 | V19: - | W19: =RC[-2]*RC[-10]/1000 -> 0.59783622001399994 | X19: =ABS((RC[-3]*RC[-11]-RC[-2]*RC[-9])/1000) -> #VALUE! | Y19: =(RC[-14]-RC[1])/RC[-18]*100 -> -8.7318713124443761 | Z19: 9.5181693999999997 | AC19: =VALUE(RC[-27]) -> 2018-09-28T00:00:00.000 | AD19: =IF(RC[21]=42,"*",IF(RC[21]=32,"",RC[21])) -> - | AE19: =RC[-28] -> 24 | AF19: =RC[-28] -> 35.597999569999999 | AG19: =RC[-28] -> 64.94 | AH19: =RC[-28] -> 0 | AI19: =RC[-28] -> 28.574958800000001 | AJ19: =RC[-28] -> 29.84 | AK19: =RC[-28] -> 0 | AL19: =RC[-28] -> 35.099999999999994 | AM19: =RC[-28] -> 7.0230407699999997 | AN19: =RC[-28] -> 9.7117805500000003 | AO19: =RC[-28] -> 62.81 | AP19: - | AQ19: =RC[-29] -> 0 | AR19: =RC[-29] -> 0 | AS19: - | AT19: =RC[-30] -> 0 | AU19: =RC[-30] -> 0 | AV19: =RC[-30] -> 0.635971367153912 | AW19: =RC[-30] -> 1.1198786256807101 | AY19: - | AZ19: - | BA19: -
A20: =IF(RC[1]="","",DATEVALUE(RC[1])) -> 43372 | B20: 29.09.18 | C20: 24 | D20: 79.915153500000002 | E20: 67.63 | F20: 0 | G20: 72.196746829999995 | H20: 45.38 | I20: 0 | J20: =RC[-5]-RC[-2] -> 22.249999999999993 | K20: 7.71840667000001 | L20: =AVERAGE(R[1]C:R[3]C) -> 8.0775036799999995 | M20: 65.58 | R20: =RC[5] -> 0.52972269133439998 | S20: 2.1209661674787399 | T20: =(RC[-16]*RC[-15]-RC[-13]*RC[-12])/1000 -> 2.1283734600595996 | U20: 8.0775036799999995 | V20: - | W20: =RC[-2]*RC[-10]/1000 -> 0.52972269133439998 | X20: =ABS((RC[-3]*RC[-11]-RC[-2]*RC[-9])/1000) -> #VALUE! | Y20: =(RC[-14]-RC[1])/RC[-18]*100 -> -0.49738669090665111 | Z20: 8.0775036799999995 | AC20: =VALUE(RC[-27]) -> 2018-09-29T00:00:00.000 | AD20: =IF(RC[21]=42,"*",IF(RC[21]=32,"",RC[21])) -> - | AE20: =RC[-28] -> 24 | AF20: =RC[-28] -> 79.915153500000002 | AG20: =RC[-28] -> 67.63 | AH20: =RC[-28] -> 0 | AI20: =RC[-28] -> 72.196746829999995 | AJ20: =RC[-28] -> 45.38 | AK20: =RC[-28] -> 0 | AL20: =RC[-28] -> 22.249999999999993 | AM20: =RC[-28] -> 7.71840667000001 | AN20: =RC[-28] -> 8.0775036799999995 | AO20: =RC[-28] -> 65.58 | AP20: - | AQ20: =RC[-29] -> 0 | AR20: =RC[-29] -> 0 | AS20: - | AT20: =RC[-30] -> 0 | AU20: =RC[-30] -> 0 | AV20: =RC[-30] -> 0.52972269133439998 | AW20: =RC[-30] -> 2.1209661674787399 | AY20: - | AZ20: - | BA20: -
A21: =IF(RC[1]="","",DATEVALUE(RC[1])) -> 43373 | B21: 30.09.18 | C21: 24 | D21: 77.770286560000002 | E21: 69.77 | F21: 0 | G21: 69.782341000000002 | H21: 45.69 | I21: 0 | J21: =RC[-5]-RC[-2] -> 24.08 | K21: 7.98794556 | L21: 10.273090359999999 | M21: 67.13 | R21: 0.70111792777300097 | S21: 2.2397016719212801 | T21: =(RC[-16]*RC[-15]-RC[-13]*RC[-12])/1000 -> 2.2376777330011999 | U21: 10.051321980000001 | V21: - | W21: =RC[-2]*RC[-10]/1000 -> 0.67474524451740003 | X21: =ABS((RC[-3]*RC[-11]-RC[-2]*RC[-9])/1000) -> #VALUE! | Y21: =(RC[-14]-RC[1])/RC[-18]*100 -> -2.9568747485843172 | Z21: 10.051321980000001 | AC21: =VALUE(RC[-27]) -> 2018-09-30T00:00:00.000 | AD21: =IF(RC[21]=42,"*",IF(RC[21]=32,"",RC[21])) -> - | AE21: =RC[-28] -> 24 | AF21: =RC[-28] -> 77.770286560000002 | AG21: =RC[-28] -> 69.77 | AH21: =RC[-28] -> 0 | AI21: =RC[-28] -> 69.782341000000002 | AJ21: =RC[-28] -> 45.69 | AK21: =RC[-28] -> 0 | AL21: =RC[-28] -> 24.08 | AM21: =RC[-28] -> 7.98794556 | AN21: =RC[-28] -> 10.273090359999999 | AO21: =RC[-28] -> 67.13 | AP21: - | AQ21: =RC[-29] -> 0 | AR21: =RC[-29] -> 0 | AS21: - | AT21: =RC[-30] -> 0 | AU21: =RC[-30] -> 0 | AV21: =RC[-30] -> 0.70111792777300097 | AW21: =RC[-30] -> 2.2397016719212801 | AY21: - | AZ21: - | BA21: -
A22: =IF(RC[1]="","",DATEVALUE(RC[1])) -> 43374 | B22: 01.10.18 | C22: 24 | D22: 72.566970830000002 | E22: 68.62 | F22: 0 | G22: 65.757965089999999 | H22: 45.21 | I22: 0 | J22: =RC[-5]-RC[-2] -> 23.410000000000004 | K22: 6.8090057399999999 | L22: 6.7827253299999999 | M22: 66.02 | R22: 0.45043236361899303 | S22: 2.0070566638005198 | T22: =(RC[-16]*RC[-15]-RC[-13]*RC[-12])/1000 -> 2.0066279366357005 | U22: 6.6441039999999996 | V22: - | W22: =RC[-2]*RC[-10]/1000 -> 0.43864374607999995 | X22: =ABS((RC[-3]*RC[-11]-RC[-2]*RC[-9])/1000) -> #VALUE! | Y22: =(RC[-14]-RC[1])/RC[-18]*100 -> 0.25077074659215304 | Z22: 6.6441039999999996 | AC22: =VALUE(RC[-27]) -> 2018-10-01T00:00:00.000 | AD22: =IF(RC[21]=42,"*",IF(RC[21]=32,"",RC[21])) -> - | AE22: =RC[-28] -> 24 | AF22: =RC[-28] -> 72.566970830000002 | AG22: =RC[-28] -> 68.62 | AH22: =RC[-28] -> 0 | AI22: =RC[-28] -> 65.757965089999999 | AJ22: =RC[-28] -> 45.21 | AK22: =RC[-28] -> 0 | AL22: =RC[-28] -> 23.410000000000004 | AM22: =RC[-28] -> 6.8090057399999999 | AN22: =RC[-28] -> 6.7827253299999999 | AO22: =RC[-28] -> 66.02 | AP22: - | AQ22: =RC[-29] -> 0 | AR22: =RC[-29] -> 0 | AS22: - | AT22: =RC[-30] -> 0 | AU22: =RC[-30] -> 0 | AV22: =RC[-30] -> 0.45043236361899303 | AW22: =RC[-30] -> 2.0070566638005198 | AY22: - | AZ22: - | BA22: -
A23: =IF(RC[1]="","",DATEVALUE(RC[1])) -> 43375 | B23: 02.10.18 | C23: 24 | D23: 73.091178889999995 | E23: 67.41 | F23: 0 | G23: 65.903526310000004 | H23: 44.78 | I23: 0 | J23: =RC[-5]-RC[-2] -> 22.629999999999995 | K23: 7.1876525799999902 | L23: 7.1766953500000001 | M23: 65.25 | R23: 0.46960948934747299 | S23: 1.9773847449125801 | T23: =(RC[-16]*RC[-15]-RC[-13]*RC[-12])/1000 -> 1.975916460813099 | U23: 7.0341491700000001 | V23: - | W23: =RC[-2]*RC[-10]/1000 -> 0.45897823334249999 | X23: =ABS((RC[-3]*RC[-11]-RC[-2]*RC[-9])/1000) -> #VALUE! | Y23: =(RC[-14]-RC[1])/RC[-18]*100 -> 0.23292139069756873 | Z23: 7.0341491700000001 | AC23: =VALUE(RC[-27]) -> 2018-10-02T00:00:00.000 | AD23: =IF(RC[21]=42,"*",IF(RC[21]=32,"",RC[21])) -> - | AE23: =RC[-28] -> 24 | AF23: =RC[-28] -> 73.091178889999995 | AG23: =RC[-28] -> 67.41 | AH23: =RC[-28] -> 0 | AI23: =RC[-28] -> 65.903526310000004 | AJ23: =RC[-28] -> 44.78 | AK23: =RC[-28] -> 0 | AL23: =RC[-28] -> 22.629999999999995 | AM23: =RC[-28] -> 7.1876525799999902 | AN23: =RC[-28] -> 7.1766953500000001 | AO23: =RC[-28] -> 65.25 | AP23: - | AQ23: =RC[-29] -> 0 | AR23: =RC[-29] -> 0 | AS23: - | AT23: =RC[-30] -> 0 | AU23: =RC[-30] -> 0 | AV23: =RC[-30] -> 0.46960948934747299 | AW23: =RC[-30] -> 1.9773847449125801 | AY23: - | AZ23: - | BA23: -
A24: =IF(RC[1]="","",DATEVALUE(RC[1])) -> 43376 | B24: 03.10.18 | C24: 24 | D24: 72.711318969999994 | E24: 67.55 | F24: 0 | G24: 65.078086850000005 | H24: 44.61 | I24: 0 | J24: =RC[-5]-RC[-2] -> 22.939999999999998 | K24: 7.63323211999999 | L24: 7.6036992100000003 | M24: 65.239999999999995 | R24: 0.49978258335721798 | S24: 2.0103453687780601 | T24: =(RC[-16]*RC[-15]-RC[-13]*RC[-12])/1000 -> 2.0085161420449991 | U24: 7.4513492599999998 | V24: - | W24: =RC[-2]*RC[-10]/1000 -> 0.48612602572239993 | X24: =ABS((RC[-3]*RC[-11]-RC[-2]*RC[-9])/1000) -> #VALUE! | Y24: =(RC[-14]-RC[1])/RC[-18]*100 -> 0.27948403034529312 | Z24: 7.4513492599999998 | AC24: =VALUE(RC[-27]) -> 2018-10-03T00:00:00.000 | AD24: =IF(RC[21]=42,"*",IF(RC[21]=32,"",RC[21])) -> - | AE24: =RC[-28] -> 24 | AF24: =RC[-28] -> 72.711318969999994 | AG24: =RC[-28] -> 67.55 | AH24: =RC[-28] -> 0 | AI24: =RC[-28] -> 65.078086850000005 | AJ24: =RC[-28] -> 44.61 | AK24: =RC[-28] -> 0 | AL24: =RC[-28] -> 22.939999999999998 | AM24: =RC[-28] -> 7.63323211999999 | AN24: =RC[-28] -> 7.6036992100000003 | AO24: =RC[-28] -> 65.239999999999995 | AP24: - | AQ24: =RC[-29] -> 0 | AR24: =RC[-29] -> 0 | AS24: - | AT24: =RC[-30] -> 0 | AU24: =RC[-30] -> 0 | AV24: =RC[-30] -> 0.49978258335721798 | AW24: =RC[-30] -> 2.0103453687780601 | AY24: - | AZ24: - | BA24: -
A25: =IF(RC[1]="","",DATEVALUE(RC[1])) -> 43377 | B25: 04.10.18 | C25: 24 | D25: 70.417114260000005 | E25: 66.94 | F25: 0 | G25: 63.461280819999999 | H25: 43.84 | I25: 0 | J25: =RC[-5]-RC[-2] -> 23.099999999999994 | K25: 6.9558334400000099 | L25: 6.8637251900000003 | M25: 64.739999999999995 | R25: 0.44575783653386802 | S25: 1.93247084885832 | T25: =(RC[-16]*RC[-15]-RC[-13]*RC[-12])/1000 -> 1.9315790774155999 | U25: 6.7293400800000001 | V25: - | W25: =RC[-2]*RC[-10]/1000 -> 0.43565747677919997 | X25: =ABS((RC[-3]*RC[-11]-RC[-2]*RC[-9])/1000) -> #VALUE! | Y25: =(RC[-14]-RC[1])/RC[-18]*100 -> 0.35690007682389835 | Z25: 6.7293400800000001 | AC25: =VALUE(RC[-27]) -> 2018-10-04T00:00:00.000 | AD25: =IF(RC[21]=42,"*",IF(RC[21]=32,"",RC[21])) -> - | AE25: =RC[-28] -> 24 | AF25: =RC[-28] -> 70.417114260000005 | AG25: =RC[-28] -> 66.94 | AH25: =RC[-28] -> 0 | AI25: =RC[-28] -> 63.461280819999999 | AJ25: =RC[-28] -> 43.84 | AK25: =RC[-28] -> 0 | AL25: =RC[-28] -> 23.099999999999994 | AM25: =RC[-28] -> 6.9558334400000099 | AN25: =RC[-28] -> 6.8637251900000003 | AO25: =RC[-28] -> 64.739999999999995 | AP25: - | AQ25: =RC[-29] -> 0 | AR25: =RC[-29] -> 0 | AS25: - | AT25: =RC[-30] -> 0 | AU25: =RC[-30] -> 0 | AV25: =RC[-30] -> 0.44575783653386802 | AW25: =RC[-30] -> 1.93247084885832 | AY25: - | AZ25: - | BA25: -
A26: =IF(RC[1]="","",DATEVALUE(RC[1])) -> 43378 | B26: 05.10.18 | C26: 24 | D26: 70.229644780000001 | E26: 66.3 | F26: 0 | G26: 63.822471620000002 | H26: 43.58 | I26: 0 | J26: =RC[-5]-RC[-2] -> 22.72 | K26: 6.4071731600000001 | L26: 6.2927618000000001 | M26: 63.63 | R26: 0.40507919174548601 | S26: 1.87617882631126 | T26: =(RC[-16]*RC[-15]-RC[-13]*RC[-12])/1000 -> 1.8748421357143998 | U26: 6.1715879400000002 | V26: - | W26: =RC[-2]*RC[-10]/1000 -> 0.39269814062219999 | X26: =ABS((RC[-3]*RC[-11]-RC[-2]*RC[-9])/1000) -> #VALUE! | Y26: =(RC[-14]-RC[1])/RC[-18]*100 -> 0.36912581731819794 | Z26: 6.1715879400000002 | AC26: =VALUE(RC[-27]) -> 2018-10-05T00:00:00.000 | AD26: =IF(RC[21]=42,"*",IF(RC[21]=32,"",RC[21])) -> - | AE26: =RC[-28] -> 24 | AF26: =RC[-28] -> 70.229644780000001 | AG26: =RC[-28] -> 66.3 | AH26: =RC[-28] -> 0 | AI26: =RC[-28] -> 63.822471620000002 | AJ26: =RC[-28] -> 43.58 | AK26: =RC[-28] -> 0 | AL26: =RC[-28] -> 22.72 | AM26: =RC[-28] -> 6.4071731600000001 | AN26: =RC[-28] -> 6.2927618000000001 | AO26: =RC[-28] -> 63.63 | AP26: - | AQ26: =RC[-29] -> 0 | AR26: =RC[-29] -> 0 | AS26: - | AT26: =RC[-30] -> 0 | AU26: =RC[-30] -> 0 | AV26: =RC[-30] -> 0.40507919174548601 | AW26: =RC[-30] -> 1.87617882631126 | AY26: - | AZ26: - | BA26: -
A27: =IF(RC[1]="","",DATEVALUE(RC[1])) -> 43379 | B27: 06.10.18 | C27: 24 | D27: 69.323310849999999 | E27: 66.95 | F27: 0 | G27: 62.597663879999999 | H27: 43.86 | I27: 0 | J27: =RC[-5]-RC[-2] -> 23.090000000000003 | K27: 6.7256469699999997 | L27: 6.6017742200000002 | M27: 64.150000000000006 | R27: 0.43106777252316802 | S27: 1.89925978073947 | T27: =(RC[-16]*RC[-15]-RC[-13]*RC[-12])/1000 -> 1.8956621236306996 | U27: 6.47107601 | V27: - | W27: =RC[-2]*RC[-10]/1000 -> 0.41511952604150004 | X27: =ABS((RC[-3]*RC[-11]-RC[-2]*RC[-9])/1000) -> #VALUE! | Y27: =(RC[-14]-RC[1])/RC[-18]*100 -> 0.4066780518966544 | Z27: 6.47107601 | AC27: =VALUE(RC[-27]) -> 2018-10-06T00:00:00.000 | AD27: =IF(RC[21]=42,"*",IF(RC[21]=32,"",RC[21])) -> - | AE27: =RC[-28] -> 24 | AF27: =RC[-28] -> 69.323310849999999 | AG27: =RC[-28] -> 66.95 | AH27: =RC[-28] -> 0 | AI27: =RC[-28] -> 62.597663879999999 | AJ27: =RC[-28] -> 43.86 | AK27: =RC[-28] -> 0 | AL27: =RC[-28] -> 23.090000000000003 | AM27: =RC[-28] -> 6.7256469699999997 | AN27: =RC[-28] -> 6.6017742200000002 | AO27: =RC[-28] -> 64.150000000000006 | AP27: - | AQ27: =RC[-29] -> 0 | AR27: =RC[-29] -> 0 | AS27: - | AT27: =RC[-30] -> 0 | AU27: =RC[-30] -> 0 | AV27: =RC[-30] -> 0.43106777252316802 | AW27: =RC[-30] -> 1.89925978073947 | AY27: - | AZ27: - | BA27: -
A28: =IF(RC[1]="","",DATEVALUE(RC[1])) -> 43380 | B28: 07.10.18 | C28: 24 | D28: 72.553733829999999 | E28: 67.23 | F28: 0 | G28: 63.432765959999998 | H28: 44.22 | I28: 0 | J28: =RC[-5]-RC[-2] -> 23.010000000000005 | K28: 9.1209678699999994 | L28: 10.021780010000001 | M28: 65.040000000000006 | R28: 0.65754532100888496 | S28: 2.0738038430304799 | T28: =(RC[-16]*RC[-15]-RC[-13]*RC[-12])/1000 -> 2.0727906146397008 | U28: 9.8215427399999999 | V28: - | W28: =RC[-2]*RC[-10]/1000 -> 0.63879313980959995 | X28: =ABS((RC[-3]*RC[-11]-RC[-2]*RC[-9])/1000) -> #VALUE! | Y28: =(RC[-14]-RC[1])/RC[-18]*100 -> -1.1044368937683962 | Z28: 9.8215427399999999 | AC28: =VALUE(RC[-27]) -> 2018-10-07T00:00:00.000 | AD28: =IF(RC[21]=42,"*",IF(RC[21]=32,"",RC[21])) -> - | AE28: =RC[-28] -> 24 | AF28: =RC[-28] -> 72.553733829999999 | AG28: =RC[-28] -> 67.23 | AH28: =RC[-28] -> 0 | AI28: =RC[-28] -> 63.432765959999998 | AJ28: =RC[-28] -> 44.22 | AK28: =RC[-28] -> 0 | AL28: =RC[-28] -> 23.010000000000005 | AM28: =RC[-28] -> 9.1209678699999994 | AN28: =RC[-28] -> 10.021780010000001 | AO28: =RC[-28] -> 65.040000000000006 | AP28: - | AQ28: =RC[-29] -> 0 | AR28: =RC[-29] -> 0 | AS28: - | AT28: =RC[-30] -> 0 | AU28: =RC[-30] -> 0 | AV28: =RC[-30] -> 0.65754532100888496 | AW28: =RC[-30] -> 2.0738038430304799 | AY28: - | AZ28: - | BA28: -
A29: =IF(RC[1]="","",DATEVALUE(RC[1])) -> 43381 | B29: 08.10.18 | C29: 24 | D29: 72.199142460000004 | E29: 67.22 | F29: 0 | G29: 64.550064090000006 | H29: 44.04 | I29: 0 | J29: =RC[-5]-RC[-2] -> 23.18 | K29: 7.6490783699999998 | L29: 8.0296535500000008 | M29: 64.7 | R29: 0.52452537259959897 | S29: 2.0114769848093998 | T29: =(RC[-16]*RC[-15]-RC[-13]*RC[-12])/1000 -> 2.0104415336375996 | U29: 7.8707079899999997 | V29: - | W29: =RC[-2]*RC[-10]/1000 -> 0.50923480695299994 | X29: =ABS((RC[-3]*RC[-11]-RC[-2]*RC[-9])/1000) -> #VALUE! | Y29: =(RC[-14]-RC[1])/RC[-18]*100 -> -0.34334531363282467 | Z29: 7.8707079899999997 | AC29: =VALUE(RC[-27]) -> 2018-10-08T00:00:00.000 | AD29: =IF(RC[21]=42,"*",IF(RC[21]=32,"",RC[21])) -> - | AE29: =RC[-28] -> 24 | AF29: =RC[-28] -> 72.199142460000004 | AG29: =RC[-28] -> 67.22 | AH29: =RC[-28] -> 0 | AI29: =RC[-28] -> 64.550064090000006 | AJ29: =RC[-28] -> 44.04 | AK29: =RC[-28] -> 0 | AL29: =RC[-28] -> 23.18 | AM29: =RC[-28] -> 7.6490783699999998 | AN29: =RC[-28] -> 8.0296535500000008 | AO29: =RC[-28] -> 64.7 | AP29: - | AQ29: =RC[-29] -> 0 | AR29: =RC[-29] -> 0 | AS29: - | AT29: =RC[-30] -> 0 | AU29: =RC[-30] -> 0 | AV29: =RC[-30] -> 0.52452537259959897 | AW29: =RC[-30] -> 2.0114769848093998 | AY29: - | AZ29: - | BA29: -
A30: =IF(RC[1]="","",DATEVALUE(RC[1])) -> 43382 | B30: 09.10.18 | C30: 24 | D30: 71.040420530000006 | E30: 67.06 | F30: 0 | G30: 63.951541900000002 | H30: 44.1 | I30: 0 | J30: =RC[-5]-RC[-2] -> 22.96 | K30: 7.08887863 | L30: 6.96871376 | M30: 64.540000000000006 | R30: 0.45578334288716899 | S30: 1.9469463432693199 | T30: =(RC[-16]*RC[-15]-RC[-13]*RC[-12])/1000 -> 1.9437076029518008 | U30: 6.8303694699999999 | V30: - | W30: =RC[-2]*RC[-10]/1000 -> 0.44083204559380007 | X30: =ABS((RC[-3]*RC[-11]-RC[-2]*RC[-9])/1000) -> #VALUE! | Y30: =(RC[-14]-RC[1])/RC[-18]*100 -> 0.40422662584778113 | Z30: 6.8303694699999999 | AC30: =VALUE(RC[-27]) -> 2018-10-09T00:00:00.000 | AD30: =IF(RC[21]=42,"*",IF(RC[21]=32,"",RC[21])) -> - | AE30: =RC[-28] -> 24 | AF30: =RC[-28] -> 71.040420530000006 | AG30: =RC[-28] -> 67.06 | AH30: =RC[-28] -> 0 | AI30: =RC[-28] -> 63.951541900000002 | AJ30: =RC[-28] -> 44.1 | AK30: =RC[-28] -> 0 | AL30: =RC[-28] -> 22.96 | AM30: =RC[-28] -> 7.08887863 | AN30: =RC[-28] -> 6.96871376 | AO30: =RC[-28] -> 64.540000000000006 | AP30: - | AQ30: =RC[-29] -> 0 | AR30: =RC[-29] -> 0 | AS30: - | AT30: =RC[-30] -> 0 | AU30: =RC[-30] -> 0 | AV30: =RC[-30] -> 0.45578334288716899 | AW30: =RC[-30] -> 1.9469463432693199 | AY30: - | AZ30: - | BA30: -
A31: =IF(RC[1]="","",DATEVALUE(RC[1])) -> 43383 | B31: 10.10.18 | C31: 24 | D31: 70.704490660000005 | E31: 68.06 | F31: 0 | G31: 63.513610839999998 | H31: 44.97 | I31: 0 | J31: =RC[-5]-RC[-2] -> 23.090000000000003 | K31: 7.1908798200000099 | L31: 7.1267042199999997 | M31: 66.11 | R31: 0.47268613021878297 | S31: 1.9595210041081501 | T31: =(RC[-16]*RC[-15]-RC[-13]*RC[-12])/1000 -> 1.9559405548448012 | U31: 6.9814372100000002 | V31: - | W31: =RC[-2]*RC[-10]/1000 -> 0.46154281395309998 | X31: =ABS((RC[-3]*RC[-11]-RC[-2]*RC[-9])/1000) -> #VALUE! | Y31: =(RC[-14]-RC[1])/RC[-18]*100 -> 0.32976019979028759 | Z31: 6.9814372100000002 | AC31: =VALUE(RC[-27]) -> 2018-10-10T00:00:00.000 | AD31: =IF(RC[21]=42,"*",IF(RC[21]=32,"",RC[21])) -> - | AE31: =RC[-28] -> 24 | AF31: =RC[-28] -> 70.704490660000005 | AG31: =RC[-28] -> 68.06 | AH31: =RC[-28] -> 0 | AI31: =RC[-28] -> 63.513610839999998 | AJ31: =RC[-28] -> 44.97 | AK31: =RC[-28] -> 0 | AL31: =RC[-28] -> 23.090000000000003 | AM31: =RC[-28] -> 7.1908798200000099 | AN31: =RC[-28] -> 7.1267042199999997 | AO31: =RC[-28] -> 66.11 | AP31: - | AQ31: =RC[-29] -> 0 | AR31: =RC[-29] -> 0 | AS31: - | AT31: =RC[-30] -> 0 | AU31: =RC[-30] -> 0 | AV31: =RC[-30] -> 0.47268613021878297 | AW31: =RC[-30] -> 1.9595210041081501 | AY31: - | AZ31: - | BA31: -
A32: =IF(RC[1]="","",DATEVALUE(RC[1])) -> 43384 | B32: 11.10.18 | C32: 24 | D32: 72.256652829999993 | E32: 69.2 | F32: 0 | G32: 65.28515625 | H32: 45.87 | I32: 0 | J32: =RC[-5]-RC[-2] -> 23.330000000000005 | K32: 6.9714965799999904 | L32: 6.9296979900000002 | M32: 67.38 | R32: 0.46525342982707601 | S32: 2.0081741568739901 | T32: =(RC[-16]*RC[-15]-RC[-13]*RC[-12])/1000 -> 2.0055302586484998 | U32: 6.7851285900000002 | V32: - | W32: =RC[-2]*RC[-10]/1000 -> 0.4571819643942 | X32: =ABS((RC[-3]*RC[-11]-RC[-2]*RC[-9])/1000) -> #VALUE! | Y32: =(RC[-14]-RC[1])/RC[-18]*100 -> 0.28546763262129765 | Z32: 6.7851285900000002 | AC32: =VALUE(RC[-27]) -> 2018-10-11T00:00:00.000 | AD32: =IF(RC[21]=42,"*",IF(RC[21]=32,"",RC[21])) -> - | AE32: =RC[-28] -> 24 | AF32: =RC[-28] -> 72.256652829999993 | AG32: =RC[-28] -> 69.2 | AH32: =RC[-28] -> 0 | AI32: =RC[-28] -> 65.28515625 | AJ32: =RC[-28] -> 45.87 | AK32: =RC[-28] -> 0 | AL32: =RC[-28] -> 23.330000000000005 | AM32: =RC[-28] -> 6.9714965799999904 | AN32: =RC[-28] -> 6.9296979900000002 | AO32: =RC[-28] -> 67.38 | AP32: - | AQ32: =RC[-29] -> 0 | AR32: =RC[-29] -> 0 | AS32: - | AT32: =RC[-30] -> 0 | AU32: =RC[-30] -> 0 | AV32: =RC[-30] -> 0.46525342982707601 | AW32: =RC[-30] -> 2.0081741568739901 | AY32: - | AZ32: - | BA32: -
A33: =IF(RC[1]="","",DATEVALUE(RC[1])) -> 43385 | B33: 12.10.18 | C33: 24 | D33: 72.126434329999995 | E33: 69.06 | F33: 0 | G33: 65.438354489999995 | H33: 45.81 | I33: 0 | J33: =RC[-5]-RC[-2] -> 23.25 | K33: 6.6880798400000003 | L33: 6.6467394799999999 | M33: 66.790000000000006 | R33: 0.44529581064297302 | S33: 1.98533704261011 | T33: =(RC[-16]*RC[-15]-RC[-13]*RC[-12])/1000 -> 1.9833205356428998 | U33: 6.50857639 | V33: - | W33: =RC[-2]*RC[-10]/1000 -> 0.43470781708810008 | X33: =ABS((RC[-3]*RC[-11]-RC[-2]*RC[-9])/1000) -> #VALUE! | Y33: =(RC[-14]-RC[1])/RC[-18]*100 -> 0.27430923561415543 | Z33: 6.50857639 | AC33: =VALUE(RC[-27]) -> 2018-10-12T00:00:00.000 | AD33: =IF(RC[21]=42,"*",IF(RC[21]=32,"",RC[21])) -> - | AE33: =RC[-28] -> 24 | AF33: =RC[-28] -> 72.126434329999995 | AG33: =RC[-28] -> 69.06 | AH33: =RC[-28] -> 0 | AI33: =RC[-28] -> 65.438354489999995 | AJ33: =RC[-28] -> 45.81 | AK33: =RC[-28] -> 0 | AL33: =RC[-28] -> 23.25 | AM33: =RC[-28] -> 6.6880798400000003 | AN33: =RC[-28] -> 6.6467394799999999 | AO33: =RC[-28] -> 66.790000000000006 | AP33: - | AQ33: =RC[-29] -> 0 | AR33: =RC[-29] -> 0 | AS33: - | AT33: =RC[-30] -> 0 | AU33: =RC[-30] -> 0 | AV33: =RC[-30] -> 0.44529581064297302 | AW33: =RC[-30] -> 1.98533704261011 | AY33: - | AZ33: - | BA33: -
A34: =IF(RC[1]="","",DATEVALUE(RC[1])) -> 43386 | B34: 13.10.18 | C34: 24 | D34: 72.563285829999998 | E34: 70.150000000000006 | F34: 0 | G34: 65.122726439999994 | H34: 46.56 | I34: 0 | J34: =RC[-5]-RC[-2] -> 23.590000000000003 | K34: 7.4405593899999998 | L34: 7.4016981099999999 | M34: 67.61 | R34: 0.50520092911053804 | S34: 2.0617439667526498 | T34: =(RC[-16]*RC[-15]-RC[-13]*RC[-12])/1000 -> 2.0582003579281003 | U34: 7.24221659 | V34: - | W34: =RC[-2]*RC[-10]/1000 -> 0.48964626364989999 | X34: =ABS((RC[-3]*RC[-11]-RC[-2]*RC[-9])/1000) -> #VALUE! | Y34: =(RC[-14]-RC[1])/RC[-18]*100 -> 0.30456771520882264 | Z34: 7.24221659 | AC34: =VALUE(RC[-27]) -> 2018-10-13T00:00:00.000 | AD34: =IF(RC[21]=42,"*",IF(RC[21]=32,"",RC[21])) -> - | AE34: =RC[-28] -> 24 | AF34: =RC[-28] -> 72.563285829999998 | AG34: =RC[-28] -> 70.150000000000006 | AH34: =RC[-28] -> 0 | AI34: =RC[-28] -> 65.122726439999994 | AJ34: =RC[-28] -> 46.56 | AK34: =RC[-28] -> 0 | AL34: =RC[-28] -> 23.590000000000003 | AM34: =RC[-28] -> 7.4405593899999998 | AN34: =RC[-28] -> 7.4016981099999999 | AO34: =RC[-28] -> 67.61 | AP34: - | AQ34: =RC[-29] -> 0 | AR34: =RC[-29] -> 0 | AS34: - | AT34: =RC[-30] -> 0 | AU34: =RC[-30] -> 0 | AV34: =RC[-30] -> 0.50520092911053804 | AW34: =RC[-30] -> 2.0617439667526498 | AY34: - | AZ34: - | BA34: -
A35: =IF(RC[1]="","",DATEVALUE(RC[1])) -> 43387 | B35: 14.10.18 | C35: 24 | D35: 72.938117980000001 | E35: 70.930000000000007 | F35: 0 | G35: 64.96315002 | H35: 47.29 | I35: 0 | J35: =RC[-5]-RC[-2] -> 23.640000000000008 | K35: 7.9749679599999999 | L35: 8.0066461600000007 | M35: 67.8 | R35: 0.55346588564058496 | S35: 2.1057727070793901 | T35: =(RC[-16]*RC[-15]-RC[-13]*RC[-12])/1000 -> 2.1013933438756003 | U35: 7.8300023100000002 | V35: - | W35: =RC[-2]*RC[-10]/1000 -> 0.53087415661800008 | X35: =ABS((RC[-3]*RC[-11]-RC[-2]*RC[-9])/1000) -> #VALUE! | Y35: =(RC[-14]-RC[1])/RC[-18]*100 -> 0.22315058607128732 | Z35: 7.8300023100000002 | AC35: =VALUE(RC[-27]) -> 2018-10-14T00:00:00.000 | AD35: =IF(RC[21]=42,"*",IF(RC[21]=32,"",RC[21])) -> - | AE35: =RC[-28] -> 24 | AF35: =RC[-28] -> 72.938117980000001 | AG35: =RC[-28] -> 70.930000000000007 | AH35: =RC[-28] -> 0 | AI35: =RC[-28] -> 64.96315002 | AJ35: =RC[-28] -> 47.29 | AK35: =RC[-28] -> 0 | AL35: =RC[-28] -> 23.640000000000008 | AM35: =RC[-28] -> 7.9749679599999999 | AN35: =RC[-28] -> 8.0066461600000007 | AO35: =RC[-28] -> 67.8 | AP35: - | AQ35: =RC[-29] -> 0 | AR35: =RC[-29] -> 0 | AS35: - | AT35: =RC[-30] -> 0 | AU35: =RC[-30] -> 0 | AV35: =RC[-30] -> 0.55346588564058496 | AW35: =RC[-30] -> 2.1057727070793901 | AY35: - | AZ35: - | BA35: -
A36: =IF(RC[1]="","",DATEVALUE(RC[1])) -> 43388 | B36: 15.10.18 | C36: 24 | D36: 72.746894839999996 | E36: 70.42 | F36: 0 | G36: 65.391464229999997 | H36: 47.34 | I36: 0 | J36: =RC[-5]-RC[-2] -> 23.08 | K36: 7.35543061 | L36: 7.4046831099999997 | M36: 67.83 | R36: 0.50698593675360704 | S36: 2.0307862257571401 | T36: =(RC[-16]*RC[-15]-RC[-13]*RC[-12])/1000 -> 2.0272044179845996 | U36: 7.2442784299999996 | V36: - | W36: =RC[-2]*RC[-10]/1000 -> 0.49137940590689994 | X36: =ABS((RC[-3]*RC[-11]-RC[-2]*RC[-9])/1000) -> #VALUE! | Y36: =(RC[-14]-RC[1])/RC[-18]*100 -> 0.16997964689863373 | Z36: 7.2442784299999996 | AC36: =VALUE(RC[-27]) -> 2018-10-15T00:00:00.000 | AD36: =IF(RC[21]=42,"*",IF(RC[21]=32,"",RC[21])) -> - | AE36: =RC[-28] -> 24 | AF36: =RC[-28] -> 72.746894839999996 | AG36: =RC[-28] -> 70.42 | AH36: =RC[-28] -> 0 | AI36: =RC[-28] -> 65.391464229999997 | AJ36: =RC[-28] -> 47.34 | AK36: =RC[-28] -> 0 | AL36: =RC[-28] -> 23.08 | AM36: =RC[-28] -> 7.35543061 | AN36: =RC[-28] -> 7.4046831099999997 | AO36: =RC[-28] -> 67.83 | AP36: - | AQ36: =RC[-29] -> 0 | AR36: =RC[-29] -> 0 | AS36: - | AT36: =RC[-30] -> 0 | AU36: =RC[-30] -> 0 | AV36: =RC[-30] -> 0.50698593675360704 | AW36: =RC[-30] -> 2.0307862257571401 | AY36: - | AZ36: - | BA36: -
A37: =IF(RC[1]="","",DATEVALUE(RC[1])) -> 43389 | B37: 16.10.18 | C37: 24 | D37: 72.699348450000002 | E37: 70.45 | F37: 0 | G37: 65.450393680000005 | H37: 47.49 | I37: 0 | J37: =RC[-5]-RC[-2] -> 22.96 | K37: 7.2489547700000001 | L37: 7.29670811 | M37: 68.180000000000007 | R37: 0.49888626397248498 | S37: 2.0151597520779601 | T37: =(RC[-16]*RC[-15]-RC[-13]*RC[-12])/1000 -> 2.0134299024393001 | U37: 7.1390700300000001 | V37: - | W37: =RC[-2]*RC[-10]/1000 -> 0.48674179464540002 | X37: =ABS((RC[-3]*RC[-11]-RC[-2]*RC[-9])/1000) -> #VALUE! | Y37: =(RC[-14]-RC[1])/RC[-18]*100 -> 0.16789011314011096 | Z37: 7.1390700300000001 | AC37: =VALUE(RC[-27]) -> 2018-10-16T00:00:00.000 | AD37: =IF(RC[21]=42,"*",IF(RC[21]=32,"",RC[21])) -> - | AE37: =RC[-28] -> 24 | AF37: =RC[-28] -> 72.699348450000002 | AG37: =RC[-28] -> 70.45 | AH37: =RC[-28] -> 0 | AI37: =RC[-28] -> 65.450393680000005 | AJ37: =RC[-28] -> 47.49 | AK37: =RC[-28] -> 0 | AL37: =RC[-28] -> 22.96 | AM37: =RC[-28] -> 7.2489547700000001 | AN37: =RC[-28] -> 7.29670811 | AO37: =RC[-28] -> 68.180000000000007 | AP37: - | AQ37: =RC[-29] -> 0 | AR37: =RC[-29] -> 0 | AS37: - | AT37: =RC[-30] -> 0 | AU37: =RC[-30] -> 0 | AV37: =RC[-30] -> 0.49888626397248498 | AW37: =RC[-30] -> 2.0151597520779601 | AY37: - | AZ37: - | BA37: -
A38: =IF(RC[1]="","",DATEVALUE(RC[1])) -> 43390 | B38: 17.10.18 | C38: 24 | D38: 73.465751650000001 | E38: 70.64 | F38: 0 | G38: 66.249946589999993 | H38: 47.72 | I38: 0 | J38: =RC[-5]-RC[-2] -> 22.92 | K38: 7.2158050600000099 | L38: 7.2707385999999996 | M38: 68.48 | R38: 0.49854037928728401 | S38: 2.0312083022833698 | T38: =(RC[-16]*RC[-15]-RC[-13]*RC[-12])/1000 -> 2.0281732452812009 | U38: 7.1127142900000004 | V38: - | W38: =RC[-2]*RC[-10]/1000 -> 0.48707867457920007 | X38: =ABS((RC[-3]*RC[-11]-RC[-2]*RC[-9])/1000) -> #VALUE! | Y38: =(RC[-14]-RC[1])/RC[-18]*100 -> 0.15560883488405761 | Z38: 7.1127142900000004 | AC38: =VALUE(RC[-27]) -> 2018-10-17T00:00:00.000 | AD38: =IF(RC[21]=42,"*",IF(RC[21]=32,"",RC[21])) -> - | AE38: =RC[-28] -> 24 | AF38: =RC[-28] -> 73.465751650000001 | AG38: =RC[-28] -> 70.64 | AH38: =RC[-28] -> 0 | AI38: =RC[-28] -> 66.249946589999993 | AJ38: =RC[-28] -> 47.72 | AK38: =RC[-28] -> 0 | AL38: =RC[-28] -> 22.92 | AM38: =RC[-28] -> 7.2158050600000099 | AN38: =RC[-28] -> 7.2707385999999996 | AO38: =RC[-28] -> 68.48 | AP38: - | AQ38: =RC[-29] -> 0 | AR38: =RC[-29] -> 0 | AS38: - | AT38: =RC[-30] -> 0 | AU38: =RC[-30] -> 0 | AV38: =RC[-30] -> 0.49854037928728401 | AW38: =RC[-30] -> 2.0312083022833698 | AY38: - | AZ38: - | BA38: -
A39: =IF(RC[1]="","",DATEVALUE(RC[1])) -> 43391 | B39: 18.10.18 | C39: 24 | D39: 74.190216059999997 | E39: 71.11 | F39: 0 | G39: 67.32344818 | H39: 48.18 | I39: 0 | J39: 22.93 | K39: 6.8667678800000003 | L39: 6.9027199699999997 | M39: 68.569999999999993 | R39: 0.47760836916021798 | S39: 2.03492683194803 | T39: 2.0320225307141997 | U39: 6.7501225500000004 | V39: - | W39: 0.46285590325350001 | X39: #VALUE! | Y39: 0.17326107493503592 | Z39: 6.7501225500000004 | AC39: =VALUE(RC[-27]) -> 2018-10-18T00:00:00.000 | AD39: =IF(RC[21]=42,"*",IF(RC[21]=32,"",RC[21])) ->  | AE39: =RC[-28] -> 24 | AF39: =RC[-28] -> 74.190216059999997 | AG39: =RC[-28] -> 71.11 | AH39: =RC[-28] -> 0 | AI39: =RC[-28] -> 67.32344818 | AJ39: =RC[-28] -> 48.18 | AK39: =RC[-28] -> 0 | AL39: =RC[-28] -> 22.93 | AM39: =RC[-28] -> 6.8667678800000003 | AN39: =RC[-28] -> 6.9027199699999997 | AO39: =RC[-28] -> 68.569999999999993 | AP39: - | AQ39: =RC[-29] -> 0 | AR39: =RC[-29] -> 0 | AS39: - | AT39: =RC[-30] -> 0 | AU39: =RC[-30] -> 0 | AV39: =RC[-30] -> 0.47760836916021798 | AW39: =RC[-30] -> 2.03492683194803
A40: =IF(RC[1]="","",DATEVALUE(RC[1])) -> 43392 | B40: 19.10.18 | C40: 24 | D40: 76.440940859999998 | E40: 70.900000000000006 | F40: 0 | G40: 68.935363769999995 | H40: 48.01 | I40: 0 | J40: 22.890000000000008 | K40: 7.5055770900000001 | L40: 9.8569707900000001 | M40: 68.22 | R40: 0.68047838922327297 | S40: 2.10942973392567 | T40: 2.110075892376301 | U40: 9.6395254099999992 | V40: - | W40: 0.65760842347019988 | X40: #VALUE! | Y40: -3.0955785293595168 | Z40: 9.6395254099999992 | AC40: =VALUE(RC[-27]) -> 2018-10-19T00:00:00.000 | AD40: =IF(RC[21]=42,"*",IF(RC[21]=32,"",RC[21])) ->  | AE40: =RC[-28] -> 24 | AF40: =RC[-28] -> 76.440940859999998 | AG40: =RC[-28] -> 70.900000000000006 | AH40: =RC[-28] -> 0 | AI40: =RC[-28] -> 68.935363769999995 | AJ40: =RC[-28] -> 48.01 | AK40: =RC[-28] -> 0 | AL40: =RC[-28] -> 22.890000000000008 | AM40: =RC[-28] -> 7.5055770900000001 | AN40: =RC[-28] -> 9.8569707900000001 | AO40: =RC[-28] -> 68.22 | AP40: - | AQ40: =RC[-29] -> 0 | AR40: =RC[-29] -> 0 | AS40: - | AT40: =RC[-30] -> 0 | AU40: =RC[-30] -> 0 | AV40: =RC[-30] -> 0.68047838922327297 | AW40: =RC[-30] -> 2.10942973392567
A41: =IF(RC[1]="","",DATEVALUE(RC[1])) -> 43393 | B41: 20.10.18 | C41: 24 | D41: 74.438064580000002 | E41: 70.209999999999994 | F41: 0 | G41: 67.384201050000001 | H41: 47.2 | I41: 0 | J41: 23.009999999999991 | K41: 7.0538635300000001 | L41: 7.0687317800000002 | M41: 67.72 | R41: 0.48204041989108598 | S41: 2.0479581948027099 | T41: 2.0457622246017997 | U41: 6.9166913000000001 | V41: - | W41: 0.46839833483600002 | X41: #VALUE! | Y41: 0.20356734644403712 | Z41: 6.9166913000000001 | AC41: =VALUE(RC[-27]) -> 2018-10-20T00:00:00.000 | AD41: =IF(RC[21]=42,"*",IF(RC[21]=32,"",RC[21])) ->  | AE41: =RC[-28] -> 24 | AF41: =RC[-28] -> 74.438064580000002 | AG41: =RC[-28] -> 70.209999999999994 | AH41: =RC[-28] -> 0 | AI41: =RC[-28] -> 67.384201050000001 | AJ41: =RC[-28] -> 47.2 | AK41: =RC[-28] -> 0 | AL41: =RC[-28] -> 23.009999999999991 | AM41: =RC[-28] -> 7.0538635300000001 | AN41: =RC[-28] -> 7.0687317800000002 | AO41: =RC[-28] -> 67.72 | AP41: - | AQ41: =RC[-29] -> 0 | AR41: =RC[-29] -> 0 | AS41: - | AT41: =RC[-30] -> 0 | AU41: =RC[-30] -> 0 | AV41: =RC[-30] -> 0.48204041989108598 | AW41: =RC[-30] -> 2.0479581948027099
A42: =IF(RC[1]="","",DATEVALUE(RC[1])) -> 43394 | B42: 21.10.18 | C42: 24 | D42: 75.777267460000004 | E42: 69.34 | F42: 0 | G42: 66.882034300000001 | H42: 46.58 | I42: 0 | J42: 22.760000000000005 | K42: 8.8952331600000001 | L42: 8.9588909099999992 | M42: 67.72 | R42: 0.60460686443106904 | S42: 2.1419070029616898 | T42: 2.1390305679824007 | U42: 8.7698087699999991 | V42: - | W42: 0.5938914499043999 | X42: #VALUE! | Y42: 0.18753076414722772 | Z42: 8.7698087699999991 | AC42: =VALUE(RC[-27]) -> 2018-10-21T00:00:00.000 | AD42: =IF(RC[21]=42,"*",IF(RC[21]=32,"",RC[21])) ->  | AE42: =RC[-28] -> 24 | AF42: =RC[-28] -> 75.777267460000004 | AG42: =RC[-28] -> 69.34 | AH42: =RC[-28] -> 0 | AI42: =RC[-28] -> 66.882034300000001 | AJ42: =RC[-28] -> 46.58 | AK42: =RC[-28] -> 0 | AL42: =RC[-28] -> 22.760000000000005 | AM42: =RC[-28] -> 8.8952331600000001 | AN42: =RC[-28] -> 8.9588909099999992 | AO42: =RC[-28] -> 67.72 | AP42: - | AQ42: =RC[-29] -> 0 | AR42: =RC[-29] -> 0 | AS42: - | AT42: =RC[-30] -> 0 | AU42: =RC[-30] -> 0 | AV42: =RC[-30] -> 0.60460686443106904 | AW42: =RC[-30] -> 2.1419070029616898
A43: =IF(RC[1]="","",DATEVALUE(RC[1])) -> 43395 | B43: 22.10.18 | C43: 24 | D43: 75.033218379999994 | E43: 69.819999999999993 | F43: 0 | G43: 66.866134639999999 | H43: 46.68 | I43: 0 | J43: 23.139999999999993 | K43: 8.1670837400000007 | L43: 8.1597003899999994 | M43: 67.48 | R43: 0.55501923903697303 | S43: 2.12126478933792 | T43: 2.1175081422963995 | U43: 7.9850816699999996 | V43: - | W43: 0.53883331109159993 | X43: #VALUE! | Y43: 0.27218871104166631 | Z43: 7.9850816699999996 | AC43: =VALUE(RC[-27]) -> 2018-10-22T00:00:00.000 | AD43: =IF(RC[21]=42,"*",IF(RC[21]=32,"",RC[21])) ->  | AE43: =RC[-28] -> 24 | AF43: =RC[-28] -> 75.033218379999994 | AG43: =RC[-28] -> 69.819999999999993 | AH43: =RC[-28] -> 0 | AI43: =RC[-28] -> 66.866134639999999 | AJ43: =RC[-28] -> 46.68 | AK43: =RC[-28] -> 0 | AL43: =RC[-28] -> 23.139999999999993 | AM43: =RC[-28] -> 8.1670837400000007 | AN43: =RC[-28] -> 8.1597003899999994 | AO43: =RC[-28] -> 67.48 | AP43: - | AQ43: =RC[-29] -> 0 | AR43: =RC[-29] -> 0 | AS43: - | AT43: =RC[-30] -> 0 | AU43: =RC[-30] -> 0 | AV43: =RC[-30] -> 0.55501923903697303 | AW43: =RC[-30] -> 2.12126478933792
A44: =IF(RC[1]="","",DATEVALUE(RC[1])) ->  | C44: 24 | J44: =RC[-5]-RC[-2] -> #VALUE! | T44: =(RC[-16]*RC[-15]-RC[-13]*RC[-12])/1000 -> #VALUE! | W44: =RC[-2]*RC[-10]/1000 -> #VALUE! | X44: =ABS((RC[-3]*RC[-11]-RC[-2]*RC[-9])/1000) -> #VALUE! | Y44: =(RC[-14]-RC[1])/RC[-18]*100 -> #VALUE! | AC44: =VALUE(RC[-27]) -> #VALUE! | AD44: =IF(RC[21]=42,"*",IF(RC[21]=32,"",RC[21])) ->  | AE44: =RC[-28] -> 24 | AF44: =RC[-28] ->  | AG44: =RC[-28] ->  | AH44: =RC[-28] ->  | AI44: =RC[-28] ->  | AJ44: =RC[-28] ->  | AK44: =RC[-28] ->  | AL44: =RC[-28] -> #VALUE! | AM44: =RC[-28] ->  | AN44: =RC[-28] ->  | AO44: =RC[-28] ->  | AP44: - | AQ44: =RC[-29] -> 0 | AR44: =RC[-29] -> 0 | AS44: - | AT44: =RC[-30] -> 0 | AU44: =RC[-30] -> 0 | AV44: =RC[-30] ->  | AW44: =RC[-30] -> 
A45: =IF(RC[1]="","",DATEVALUE(RC[1])) ->  | C45: 24 | T45: =(RC[-16]*RC[-15]-RC[-13]*RC[-12])/1000 -> #VALUE! | W45: =RC[-2]*RC[-10]/1000 -> #VALUE! | X45: =ABS((RC[-3]*RC[-11]-RC[-2]*RC[-9])/1000) -> #VALUE! | Y45: =(RC[-14]-RC[1])/RC[-18]*100 -> #VALUE! | AC45: =VALUE(RC[-27]) -> #VALUE! | AD45: =IF(RC[21]=42,"*",IF(RC[21]=32,"",RC[21])) ->  | AE45: =RC[-28] -> 24 | AF45: =RC[-28] ->  | AG45: =RC[-28] ->  | AH45: =RC[-28] ->  | AI45: =RC[-28] ->  | AJ45: =RC[-28] ->  | AK45: =RC[-28] ->  | AL45: =RC[-28] -> 0 | AM45: =RC[-28] ->  | AN45: =RC[-28] ->  | AO45: =RC[-28] ->  | AP45: - | AQ45: =RC[-29] -> 0 | AR45: =RC[-29] -> 0 | AS45: - | AT45: =RC[-30] -> 0 | AU45: =RC[-30] -> 0 | AV45: =RC[-30] ->  | AW45: =RC[-30] -> 
A46: =IF(RC[1]="","",DATEVALUE(RC[1])) ->  | C46: 24 | T46: =(RC[-16]*RC[-15]-RC[-13]*RC[-12])/1000 -> #VALUE! | W46: =RC[-2]*RC[-10]/1000 -> #VALUE! | X46: =ABS((RC[-3]*RC[-11]-RC[-2]*RC[-9])/1000) -> #VALUE! | Y46: =(RC[-14]-RC[1])/RC[-18]*100 -> #VALUE! | AC46: =VALUE(RC[-27]) -> #VALUE! | AD46: =IF(RC[21]=42,"*",IF(RC[21]=32,"",RC[21])) ->  | AE46: =RC[-28] -> 24 | AF46: =RC[-28] ->  | AG46: =RC[-28] ->  | AH46: =RC[-28] ->  | AI46: =RC[-28] ->  | AJ46: =RC[-28] ->  | AK46: =RC[-28] ->  | AL46: =RC[-28] -> 0 | AM46: =RC[-28] ->  | AN46: =RC[-28] ->  | AO46: =RC[-28] ->  | AP46: - | AQ46: =RC[-29] -> 0 | AR46: =RC[-29] -> 0 | AS46: - | AT46: =RC[-30] -> 0 | AU46: =RC[-30] -> 0 | AV46: =RC[-30] ->  | AW46: =RC[-30] -> 
A47: =IF(RC[1]="","",DATEVALUE(RC[1])) ->  | C47: 24 | T47: =(RC[-16]*RC[-15]-RC[-13]*RC[-12])/1000 -> #VALUE! | W47: =RC[-2]*RC[-10]/1000 -> #VALUE! | X47: =ABS((RC[-3]*RC[-11]-RC[-2]*RC[-9])/1000) -> #VALUE! | Y47: =(RC[-14]-RC[1])/RC[-18]*100 -> #VALUE! | AC47: =VALUE(RC[-27]) -> #VALUE! | AD47: =IF(RC[21]=42,"*",IF(RC[21]=32,"",RC[21])) ->  | AE47: =RC[-28] -> 24 | AF47: =RC[-28] ->  | AG47: =RC[-28] ->  | AH47: =RC[-28] ->  | AI47: =RC[-28] ->  | AJ47: =RC[-28] ->  | AK47: =RC[-28] ->  | AL47: =RC[-28] -> 0 | AM47: =RC[-28] ->  | AN47: =RC[-28] ->  | AO47: =RC[-28] ->  | AP47: - | AQ47: =RC[-29] -> 0 | AR47: =RC[-29] -> 0 | AS47: - | AT47: =RC[-30] -> 0 | AU47: =RC[-30] -> 0 | AV47: =RC[-30] ->  | AW47: =RC[-30] -> 
A48: =IF(RC[1]="","",DATEVALUE(RC[1])) ->  | C48: 24 | T48: =(RC[-16]*RC[-15]-RC[-13]*RC[-12])/1000 -> #VALUE! | W48: =RC[-2]*RC[-10]/1000 -> #VALUE! | X48: =ABS((RC[-3]*RC[-11]-RC[-2]*RC[-9])/1000) -> #VALUE! | Y48: =(RC[-14]-RC[1])/RC[-18]*100 -> #VALUE! | AC48: =VALUE(RC[-27]) -> #VALUE! | AD48: =IF(RC[21]=42,"*",IF(RC[21]=32,"",RC[21])) ->  | AE48: =RC[-28] -> 24 | AF48: =RC[-28] ->  | AG48: =RC[-28] ->  | AH48: =RC[-28] ->  | AI48: =RC[-28] ->  | AJ48: =RC[-28] ->  | AK48: =RC[-28] ->  | AL48: =RC[-28] -> 0 | AM48: =RC[-28] ->  | AN48: =RC[-28] ->  | AO48: =RC[-28] ->  | AP48: - | AQ48: =RC[-29] -> 0 | AR48: =RC[-29] -> 0 | AS48: - | AT48: =RC[-30] -> 0 | AU48: =RC[-30] -> 0 | AV48: =RC[-30] ->  | AW48: =RC[-30] -> 
A49: =IF(RC[1]="","",DATEVALUE(RC[1])) ->  | C49: 24 | T49: =(RC[-16]*RC[-15]-RC[-13]*RC[-12])/1000 -> #VALUE! | W49: =RC[-2]*RC[-10]/1000 -> #VALUE! | X49: =ABS((RC[-3]*RC[-11]-RC[-2]*RC[-9])/1000) -> #VALUE! | Y49: =(RC[-14]-RC[1])/RC[-18]*100 -> #VALUE! | AC49: =VALUE(RC[-27]) -> #VALUE! | AD49: =IF(RC[21]=42,"*",IF(RC[21]=32,"",RC[21])) ->  | AE49: =RC[-28] -> 24 | AF49: =RC[-28] ->  | AG49: =RC[-28] ->  | AH49: =RC[-28] ->  | AI49: =RC[-28] ->  | AJ49: =RC[-28] ->  | AK49: =RC[-28] ->  | AL49: =RC[-28] -> 0 | AM49: =RC[-28] ->  | AN49: =RC[-28] ->  | AO49: =RC[-28] ->  | AP49: - | AQ49: =RC[-29] -> 0 | AR49: =RC[-29] -> 0 | AS49: - | AT49: =RC[-30] -> 0 | AU49: =RC[-30] -> 0 | AV49: =RC[-30] ->  | AW49: =RC[-30] -> 
A50: =IF(RC[1]="","",DATEVALUE(RC[1])) ->  | T50: =(RC[-16]*RC[-15]-RC[-13]*RC[-12])/1000 -> #VALUE! | W50: =RC[-2]*RC[-10]/1000 -> #VALUE! | X50: =ABS((RC[-3]*RC[-11]-RC[-2]*RC[-9])/1000) -> #VALUE! | Y50: =(RC[-14]-RC[1])/RC[-18]*100 -> #VALUE! | AC50: =VALUE(RC[-27]) -> #VALUE! | AD50: =IF(RC[21]=42,"*",IF(RC[21]=32,"",RC[21])) ->  | AE50: =RC[-28] ->  | AF50: =RC[-28] ->  | AG50: =RC[-28] ->  | AH50: =RC[-28] ->  | AI50: =RC[-28] ->  | AJ50: =RC[-28] ->  | AK50: =RC[-28] ->  | AL50: =RC[-28] -> 0 | AM50: =RC[-28] ->  | AN50: =RC[-28] ->  | AO50: =RC[-28] ->  | AP50: - | AQ50: =RC[-29] -> 0 | AR50: =RC[-29] -> 0 | AS50: - | AT50: =RC[-30] -> 0 | AU50: =RC[-30] -> 0 | AV50: =RC[-30] ->  | AW50: =RC[-30] -> 
A51: =IF(RC[1]="","",DATEVALUE(RC[1])) ->  | T51: =(RC[-16]*RC[-15]-RC[-13]*RC[-12])/1000 -> #VALUE! | W51: =RC[-2]*RC[-10]/1000 -> #VALUE! | X51: =ABS((RC[-3]*RC[-11]-RC[-2]*RC[-9])/1000) -> #VALUE! | Y51: =(RC[-14]-RC[1])/RC[-18]*100 -> #VALUE! | AC51: =VALUE(RC[-27]) -> #VALUE! | AD51: =IF(RC[21]=42,"*",IF(RC[21]=32,"",RC[21])) ->  | AE51: =RC[-28] ->  | AF51: =RC[-28] ->  | AG51: =RC[-28] ->  | AH51: =RC[-28] ->  | AI51: =RC[-28] ->  | AJ51: =RC[-28] ->  | AK51: =RC[-28] ->  | AL51: =RC[-28] -> 0 | AM51: =RC[-28] ->  | AN51: =RC[-28] ->  | AO51: =RC[-28] ->  | AP51: - | AQ51: =RC[-29] -> 0 | AR51: =RC[-29] -> 0 | AS51: - | AT51: =RC[-30] -> 0 | AU51: =RC[-30] -> 0 | AV51: =RC[-30] ->  | AW51: =RC[-30] -> 
A52: =IF(RC[1]="","",DATEVALUE(RC[1])) ->  | T52: =(RC[-16]*RC[-15]-RC[-13]*RC[-12])/1000 -> #VALUE! | W52: =RC[-2]*RC[-10]/1000 -> #VALUE! | X52: =ABS((RC[-3]*RC[-11]-RC[-2]*RC[-9])/1000) -> #VALUE! | Y52: =(RC[-14]-RC[1])/RC[-18]*100 -> #VALUE! | AC52: =VALUE(RC[-27]) -> #VALUE! | AD52: =IF(RC[21]=42,"*",IF(RC[21]=32,"",RC[21])) ->  | AE52: =RC[-28] ->  | AF52: =RC[-28] ->  | AG52: =RC[-28] ->  | AH52: =RC[-28] ->  | AI52: =RC[-28] ->  | AJ52: =RC[-28] ->  | AK52: =RC[-28] ->  | AL52: =RC[-28] -> 0 | AM52: =RC[-28] ->  | AN52: =RC[-28] ->  | AO52: =RC[-28] ->  | AP52: - | AQ52: =RC[-29] -> 0 | AR52: =RC[-29] -> 0 | AS52: - | AT52: =RC[-30] -> 0 | AU52: =RC[-30] -> 0 | AV52: =RC[-30] ->  | AW52: =RC[-30] -> 
A53: =IF(RC[1]="","",DATEVALUE(RC[1])) ->  | T53: =(RC[-16]*RC[-15]-RC[-13]*RC[-12])/1000 -> #VALUE! | W53: =RC[-2]*RC[-10]/1000 -> #VALUE! | X53: =ABS((RC[-3]*RC[-11]-RC[-2]*RC[-9])/1000) -> #VALUE! | Y53: =(RC[-14]-RC[1])/RC[-18]*100 -> #VALUE! | AC53: =VALUE(RC[-27]) -> #VALUE! | AD53: =IF(RC[21]=42,"*",IF(RC[21]=32,"",RC[21])) ->  | AE53: =RC[-28] ->  | AF53: =RC[-28] ->  | AG53: =RC[-28] ->  | AH53: =RC[-28] ->  | AI53: =RC[-28] ->  | AJ53: =RC[-28] ->  | AK53: =RC[-28] ->  | AL53: =RC[-28] -> 0 | AM53: =RC[-28] ->  | AN53: =RC[-28] ->  | AO53: =RC[-28] ->  | AP53: - | AQ53: =RC[-29] -> 0 | AR53: =RC[-29] -> 0 | AS53: - | AT53: =RC[-30] -> 0 | AU53: =RC[-30] -> 0 | AV53: =RC[-30] ->  | AW53: =RC[-30] -> 
A54: =IF(RC[1]="","",DATEVALUE(RC[1])) ->  | T54: =(RC[-16]*RC[-15]-RC[-13]*RC[-12])/1000 -> #VALUE! | W54: =RC[-2]*RC[-10]/1000 -> #VALUE! | X54: =ABS((RC[-3]*RC[-11]-RC[-2]*RC[-9])/1000) -> #VALUE! | Y54: =(RC[-14]-RC[1])/RC[-18]*100 -> #VALUE! | AC54: =VALUE(RC[-27]) -> #VALUE! | AD54: =IF(RC[21]=42,"*",IF(RC[21]=32,"",RC[21])) ->  | AE54: =RC[-28] ->  | AF54: =RC[-28] ->  | AG54: =RC[-28] ->  | AH54: =RC[-28] ->  | AI54: =RC[-28] ->  | AJ54: =RC[-28] ->  | AK54: =RC[-28] ->  | AL54: =RC[-28] -> 0 | AM54: =RC[-28] ->  | AN54: =RC[-28] ->  | AO54: =RC[-28] ->  | AP54: - | AQ54: =RC[-29] -> 0 | AR54: =RC[-29] -> 0 | AS54: - | AT54: =RC[-30] -> 0 | AU54: =RC[-30] -> 0 | AV54: =RC[-30] ->  | AW54: =RC[-30] -> 
A55: =IF(RC[1]="","",DATEVALUE(RC[1])) ->  | T55: =(RC[-16]*RC[-15]-RC[-13]*RC[-12])/1000 -> #VALUE! | W55: =RC[-2]*RC[-10]/1000 -> #VALUE! | X55: =ABS((RC[-3]*RC[-11]-RC[-2]*RC[-9])/1000) -> #VALUE! | Y55: =(RC[-14]-RC[1])/RC[-18]*100 -> #VALUE! | AC55: =VALUE(RC[-27]) -> #VALUE! | AD55: =IF(RC[21]=42,"*",IF(RC[21]=32,"",RC[21])) ->  | AE55: =RC[-28] ->  | AF55: =RC[-28] ->  | AG55: =RC[-28] ->  | AH55: =RC[-28] ->  | AI55: =RC[-28] ->  | AJ55: =RC[-28] ->  | AK55: =RC[-28] ->  | AL55: =RC[-28] -> 0 | AM55: =RC[-28] ->  | AN55: =RC[-28] ->  | AO55: =RC[-28] ->  | AP55: - | AQ55: =RC[-29] -> 0 | AR55: =RC[-29] -> 0 | AS55: - | AT55: =RC[-30] -> 0 | AU55: =RC[-30] -> 0 | AV55: =RC[-30] ->  | AW55: =RC[-30] -> 
A56: =IF(RC[1]="","",DATEVALUE(RC[1])) ->  | T56: =(RC[-16]*RC[-15]-RC[-13]*RC[-12])/1000 -> #VALUE! | W56: =RC[-2]*RC[-10]/1000 -> #VALUE! | X56: =ABS((RC[-3]*RC[-11]-RC[-2]*RC[-9])/1000) -> #VALUE! | Y56: =(RC[-14]-RC[1])/RC[-18]*100 -> #VALUE! | AC56: =VALUE(RC[-27]) -> #VALUE! | AD56: =IF(RC[21]=42,"*",IF(RC[21]=32,"",RC[21])) ->  | AE56: =RC[-28] ->  | AF56: =RC[-28] ->  | AG56: =RC[-28] ->  | AH56: =RC[-28] ->  | AI56: =RC[-28] ->  | AJ56: =RC[-28] ->  | AK56: =RC[-28] ->  | AL56: =RC[-28] -> 0 | AM56: =RC[-28] ->  | AN56: =RC[-28] ->  | AO56: =RC[-28] ->  | AP56: - | AQ56: =RC[-29] -> 0 | AR56: =RC[-29] -> 0 | AS56: - | AT56: =RC[-30] -> 0 | AU56: =RC[-30] -> 0 | AV56: =RC[-30] ->  | AW56: =RC[-30] -> 
A57: =IF(RC[1]="","",DATEVALUE(RC[1])) ->  | T57: =(RC[-16]*RC[-15]-RC[-13]*RC[-12])/1000 -> #VALUE! | W57: =RC[-2]*RC[-10]/1000 -> #VALUE! | X57: =ABS((RC[-3]*RC[-11]-RC[-2]*RC[-9])/1000) -> #VALUE! | Y57: =(RC[-14]-RC[1])/RC[-18]*100 -> #VALUE! | AC57: =VALUE(RC[-27]) -> #VALUE! | AD57: =IF(RC[21]=42,"*",IF(RC[21]=32,"",RC[21])) ->  | AE57: =RC[-28] ->  | AF57: =RC[-28] ->  | AG57: =RC[-28] ->  | AH57: =RC[-28] ->  | AI57: =RC[-28] ->  | AJ57: =RC[-28] ->  | AK57: =RC[-28] ->  | AL57: =RC[-28] -> 0 | AM57: =RC[-28] ->  | AN57: =RC[-28] ->  | AO57: =RC[-28] ->  | AP57: - | AQ57: =RC[-29] -> 0 | AR57: =RC[-29] -> 0 | AS57: - | AT57: =RC[-30] -> 0 | AU57: =RC[-30] -> 0 | AV57: =RC[-30] ->  | AW57: =RC[-30] -> 
A58: =IF(RC[1]="","",DATEVALUE(RC[1])) ->  | T58: =(RC[-16]*RC[-15]-RC[-13]*RC[-12])/1000 -> #VALUE! | W58: =RC[-2]*RC[-10]/1000 -> #VALUE! | X58: =ABS((RC[-3]*RC[-11]-RC[-2]*RC[-9])/1000) -> #VALUE! | Y58: =(RC[-14]-RC[1])/RC[-18]*100 -> #VALUE! | AC58: =VALUE(RC[-27]) -> #VALUE! | AD58: =IF(RC[21]=42,"*",IF(RC[21]=32,"",RC[21])) ->  | AE58: =RC[-28] ->  | AF58: =RC[-28] ->  | AG58: =RC[-28] ->  | AH58: =RC[-28] ->  | AI58: =RC[-28] ->  | AJ58: =RC[-28] ->  | AK58: =RC[-28] ->  | AL58: =RC[-28] -> 0 | AM58: =RC[-28] ->  | AN58: =RC[-28] ->  | AO58: =RC[-28] ->  | AP58: - | AQ58: =RC[-29] -> 0 | AR58: =RC[-29] -> 0 | AS58: - | AT58: =RC[-30] -> 0 | AU58: =RC[-30] -> 0 | AV58: =RC[-30] ->  | AW58: =RC[-30] -> 
A59: =IF(RC[1]="","",DATEVALUE(RC[1])) ->  | T59: =(RC[-16]*RC[-15]-RC[-13]*RC[-12])/1000 -> #VALUE! | W59: =RC[-2]*RC[-10]/1000 -> #VALUE! | X59: =ABS((RC[-3]*RC[-11]-RC[-2]*RC[-9])/1000) -> #VALUE! | Y59: =(RC[-14]-RC[1])/RC[-18]*100 -> #VALUE! | AC59: =VALUE(RC[-27]) -> #VALUE! | AD59: =IF(RC[21]=42,"*",IF(RC[21]=32,"",RC[21])) ->  | AE59: =RC[-28] ->  | AF59: =RC[-28] ->  | AG59: =RC[-28] ->  | AH59: =RC[-28] ->  | AI59: =RC[-28] ->  | AJ59: =RC[-28] ->  | AK59: =RC[-28] ->  | AL59: =RC[-28] -> 0 | AM59: =RC[-28] ->  | AN59: =RC[-28] ->  | AO59: =RC[-28] ->  | AP59: - | AQ59: =RC[-29] -> 0 | AR59: =RC[-29] -> 0 | AS59: - | AT59: =RC[-30] -> 0 | AU59: =RC[-30] -> 0 | AV59: =RC[-30] ->  | AW59: =RC[-30] -> 
A60: =IF(RC[1]="","",DATEVALUE(RC[1])) ->  | T60: =(RC[-16]*RC[-15]-RC[-13]*RC[-12])/1000 -> #VALUE! | W60: =RC[-2]*RC[-10]/1000 -> #VALUE! | X60: =ABS((RC[-3]*RC[-11]-RC[-2]*RC[-9])/1000) -> #VALUE! | Y60: =(RC[-14]-RC[1])/RC[-18]*100 -> #VALUE! | AC60: =VALUE(RC[-27]) -> #VALUE! | AD60: =IF(RC[21]=42,"*",IF(RC[21]=32,"",RC[21])) ->  | AE60: =RC[-28] ->  | AF60: =RC[-28] ->  | AG60: =RC[-28] ->  | AH60: =RC[-28] ->  | AI60: =RC[-28] ->  | AJ60: =RC[-28] ->  | AK60: =RC[-28] ->  | AL60: =RC[-28] -> 0 | AM60: =RC[-28] ->  | AN60: =RC[-28] ->  | AO60: =RC[-28] ->  | AP60: - | AQ60: =RC[-29] -> 0 | AR60: =RC[-29] -> 0 | AS60: - | AT60: =RC[-30] -> 0 | AU60: =RC[-30] -> 0 | AV60: =RC[-30] ->  | AW60: =RC[-30] -> 
A61: =IF(RC[1]="","",DATEVALUE(RC[1])) ->  | T61: =(RC[-16]*RC[-15]-RC[-13]*RC[-12])/1000 -> #VALUE! | W61: =RC[-2]*RC[-10]/1000 -> #VALUE! | X61: =ABS((RC[-3]*RC[-11]-RC[-2]*RC[-9])/1000) -> #VALUE! | Y61: =(RC[-14]-RC[1])/RC[-18]*100 -> #VALUE! | AC61: =VALUE(RC[-27]) -> #VALUE! | AD61: =IF(RC[21]=42,"*",IF(RC[21]=32,"",RC[21])) ->  | AE61: =RC[-28] ->  | AF61: =RC[-28] ->  | AG61: =RC[-28] ->  | AH61: =RC[-28] ->  | AI61: =RC[-28] ->  | AJ61: =RC[-28] ->  | AK61: =RC[-28] ->  | AL61: =RC[-28] -> 0 | AM61: =RC[-28] ->  | AN61: =RC[-28] ->  | AO61: =RC[-28] ->  | AP61: - | AQ61: =RC[-29] -> 0 | AR61: =RC[-29] -> 0 | AS61: - | AT61: =RC[-30] -> 0 | AU61: =RC[-30] -> 0 | AV61: =RC[-30] ->  | AW61: =RC[-30] -> 
A62: =IF(RC[1]="","",DATEVALUE(RC[1])) ->  | T62: =(RC[-16]*RC[-15]-RC[-13]*RC[-12])/1000 -> #VALUE! | W62: =RC[-2]*RC[-10]/1000 -> #VALUE! | X62: =ABS((RC[-3]*RC[-11]-RC[-2]*RC[-9])/1000) -> #VALUE! | Y62: =(RC[-14]-RC[1])/RC[-18]*100 -> #VALUE! | AC62: =VALUE(RC[-27]) -> #VALUE! | AD62: =IF(RC[21]=42,"*",IF(RC[21]=32,"",RC[21])) ->  | AE62: =RC[-28] ->  | AF62: =RC[-28] ->  | AG62: =RC[-28] ->  | AH62: =RC[-28] ->  | AI62: =RC[-28] ->  | AJ62: =RC[-28] ->  | AK62: =RC[-28] ->  | AL62: =RC[-28] -> 0 | AM62: =RC[-28] ->  | AN62: =RC[-28] ->  | AO62: =RC[-28] ->  | AP62: - | AQ62: =RC[-29] -> 0 | AR62: =RC[-29] -> 0 | AS62: - | AT62: =RC[-30] -> 0 | AU62: =RC[-30] -> 0 | AV62: =RC[-30] ->  | AW62: =RC[-30] -> 
A63: =IF(RC[1]="","",DATEVALUE(RC[1])) ->  | T63: =(RC[-16]*RC[-15]-RC[-13]*RC[-12])/1000 -> #VALUE! | W63: =RC[-2]*RC[-10]/1000 -> #VALUE! | X63: =ABS((RC[-3]*RC[-11]-RC[-2]*RC[-9])/1000) -> #VALUE! | Y63: =(RC[-14]-RC[1])/RC[-18]*100 -> #VALUE! | AC63: =VALUE(RC[-27]) -> #VALUE! | AD63: =IF(RC[21]=42,"*",IF(RC[21]=32,"",RC[21])) ->  | AE63: =RC[-28] ->  | AF63: =RC[-28] ->  | AG63: =RC[-28] ->  | AH63: =RC[-28] ->  | AI63: =RC[-28] ->  | AJ63: =RC[-28] ->  | AK63: =RC[-28] ->  | AL63: =RC[-28] -> 0 | AM63: =RC[-28] ->  | AN63: =RC[-28] ->  | AO63: =RC[-28] ->  | AP63: - | AQ63: =RC[-29] -> 0 | AR63: =RC[-29] -> 0 | AS63: - | AT63: =RC[-30] -> 0 | AU63: =RC[-30] -> 0 | AV63: =RC[-30] ->  | AW63: =RC[-30] -> 
A64: =IF(RC[1]="","",DATEVALUE(RC[1])) ->  | T64: =(RC[-16]*RC[-15]-RC[-13]*RC[-12])/1000 -> #VALUE! | W64: =RC[-2]*RC[-10]/1000 -> #VALUE! | X64: =ABS((RC[-3]*RC[-11]-RC[-2]*RC[-9])/1000) -> #VALUE! | Y64: =(RC[-14]-RC[1])/RC[-18]*100 -> #VALUE! | AC64: =VALUE(RC[-27]) -> #VALUE! | AD64: =IF(RC[21]=42,"*",IF(RC[21]=32,"",RC[21])) ->  | AE64: =RC[-28] ->  | AF64: =RC[-28] ->  | AG64: =RC[-28] ->  | AH64: =RC[-28] ->  | AI64: =RC[-28] ->  | AJ64: =RC[-28] ->  | AK64: =RC[-28] ->  | AL64: =RC[-28] -> 0 | AM64: =RC[-28] ->  | AN64: =RC[-28] ->  | AO64: =RC[-28] ->  | AP64: - | AQ64: =RC[-29] -> 0 | AR64: =RC[-29] -> 0 | AS64: - | AT64: =RC[-30] -> 0 | AU64: =RC[-30] -> 0 | AV64: =RC[-30] ->  | AW64: =RC[-30] -> 
A65: =IF(RC[1]="","",DATEVALUE(RC[1])) ->  | T65: =(RC[-16]*RC[-15]-RC[-13]*RC[-12])/1000 -> #VALUE! | W65: =RC[-2]*RC[-10]/1000 -> #VALUE! | X65: =ABS((RC[-3]*RC[-11]-RC[-2]*RC[-9])/1000) -> #VALUE! | Y65: =(RC[-14]-RC[1])/RC[-18]*100 -> #VALUE! | AC65: =VALUE(RC[-27]) -> #VALUE! | AD65: =IF(RC[21]=42,"*",IF(RC[21]=32,"",RC[21])) ->  | AE65: =RC[-28] ->  | AF65: =RC[-28] ->  | AG65: =RC[-28] ->  | AH65: =RC[-28] ->  | AI65: =RC[-28] ->  | AJ65: =RC[-28] ->  | AK65: =RC[-28] ->  | AL65: =RC[-28] -> 0 | AM65: =RC[-28] ->  | AN65: =RC[-28] ->  | AO65: =RC[-28] ->  | AP65: - | AQ65: =RC[-29] -> 0 | AR65: =RC[-29] -> 0 | AS65: - | AT65: =RC[-30] -> 0 | AU65: =RC[-30] -> 0 | AV65: =RC[-30] ->  | AW65: =RC[-30] -> 
A66: =IF(RC[1]="","",DATEVALUE(RC[1])) ->  | T66: =(RC[-16]*RC[-15]-RC[-13]*RC[-12])/1000 -> #VALUE! | W66: =RC[-2]*RC[-10]/1000 -> #VALUE! | X66: =ABS((RC[-3]*RC[-11]-RC[-2]*RC[-9])/1000) -> #VALUE! | Y66: =(RC[-14]-RC[1])/RC[-18]*100 -> #VALUE! | AC66: =VALUE(RC[-27]) -> #VALUE! | AD66: =IF(RC[21]=42,"*",IF(RC[21]=32,"",RC[21])) ->  | AE66: =RC[-28] ->  | AF66: =RC[-28] ->  | AG66: =RC[-28] ->  | AH66: =RC[-28] ->  | AI66: =RC[-28] ->  | AJ66: =RC[-28] ->  | AK66: =RC[-28] ->  | AL66: =RC[-28] -> 0 | AM66: =RC[-28] ->  | AN66: =RC[-28] ->  | AO66: =RC[-28] ->  | AP66: - | AQ66: =RC[-29] -> 0 | AR66: =RC[-29] -> 0 | AS66: - | AT66: =RC[-30] -> 0 | AU66: =RC[-30] -> 0 | AV66: =RC[-30] ->  | AW66: =RC[-30] -> 
A67: =IF(RC[1]="","",DATEVALUE(RC[1])) ->  | T67: =(RC[-16]*RC[-15]-RC[-13]*RC[-12])/1000 -> #VALUE! | W67: =RC[-2]*RC[-10]/1000 -> #VALUE! | X67: =ABS((RC[-3]*RC[-11]-RC[-2]*RC[-9])/1000) -> #VALUE! | Y67: =(RC[-14]-RC[1])/RC[-18]*100 -> #VALUE! | AC67: =VALUE(RC[-27]) -> #VALUE! | AD67: =IF(RC[21]=42,"*",IF(RC[21]=32,"",RC[21])) ->  | AE67: =RC[-28] ->  | AF67: =RC[-28] ->  | AG67: =RC[-28] ->  | AH67: =RC[-28] ->  | AI67: =RC[-28] ->  | AJ67: =RC[-28] ->  | AK67: =RC[-28] ->  | AL67: =RC[-28] -> 0 | AM67: =RC[-28] ->  | AN67: =RC[-28] ->  | AO67: =RC[-28] ->  | AP67: - | AQ67: =RC[-29] -> 0 | AR67: =RC[-29] -> 0 | AS67: - | AT67: =RC[-30] -> 0 | AU67: =RC[-30] -> 0 | AV67: =RC[-30] ->  | AW67: =RC[-30] -> 
A68: =IF(RC[1]="","",DATEVALUE(RC[1])) ->  | T68: =(RC[-16]*RC[-15]-RC[-13]*RC[-12])/1000 -> #VALUE! | W68: =RC[-2]*RC[-10]/1000 -> #VALUE! | X68: =ABS((RC[-3]*RC[-11]-RC[-2]*RC[-9])/1000) -> #VALUE! | Y68: =(RC[-14]-RC[1])/RC[-18]*100 -> #VALUE! | AC68: =VALUE(RC[-27]) -> #VALUE! | AD68: =IF(RC[21]=42,"*",IF(RC[21]=32,"",RC[21])) ->  | AE68: =RC[-28] ->  | AF68: =RC[-28] ->  | AG68: =RC[-28] ->  | AH68: =RC[-28] ->  | AI68: =RC[-28] ->  | AJ68: =RC[-28] ->  | AK68: =RC[-28] ->  | AL68: =RC[-28] -> 0 | AM68: =RC[-28] ->  | AN68: =RC[-28] ->  | AO68: =RC[-28] ->  | AP68: - | AQ68: =RC[-29] -> 0 | AR68: =RC[-29] -> 0 | AS68: - | AT68: =RC[-30] -> 0 | AU68: =RC[-30] -> 0 | AV68: =RC[-30] ->  | AW68: =RC[-30] -> 
A69: =IF(RC[1]="","",DATEVALUE(RC[1])) ->  | T69: =(RC[-16]*RC[-15]-RC[-13]*RC[-12])/1000 -> #VALUE! | W69: =RC[-2]*RC[-10]/1000 -> #VALUE! | X69: =ABS((RC[-3]*RC[-11]-RC[-2]*RC[-9])/1000) -> #VALUE! | Y69: =(RC[-14]-RC[1])/RC[-18]*100 -> #VALUE! | AC69: =VALUE(RC[-27]) -> #VALUE! | AD69: =IF(RC[21]=42,"*",IF(RC[21]=32,"",RC[21])) ->  | AE69: =RC[-28] ->  | AF69: =RC[-28] ->  | AG69: =RC[-28] ->  | AH69: =RC[-28] ->  | AI69: =RC[-28] ->  | AJ69: =RC[-28] ->  | AK69: =RC[-28] ->  | AL69: =RC[-28] -> 0 | AM69: =RC[-28] ->  | AN69: =RC[-28] ->  | AO69: =RC[-28] ->  | AP69: - | AQ69: =RC[-29] -> 0 | AR69: =RC[-29] -> 0 | AS69: - | AT69: =RC[-30] -> 0 | AU69: =RC[-30] -> 0 | AV69: =RC[-30] ->  | AW69: =RC[-30] -> 
A70: =IF(RC[1]="","",DATEVALUE(RC[1])) ->  | T70: =(RC[-16]*RC[-15]-RC[-13]*RC[-12])/1000 -> #VALUE! | W70: =RC[-2]*RC[-10]/1000 -> #VALUE! | X70: =ABS((RC[-3]*RC[-11]-RC[-2]*RC[-9])/1000) -> #VALUE! | Y70: =(RC[-14]-RC[1])/RC[-18]*100 -> #VALUE! | AC70: =VALUE(RC[-27]) -> #VALUE! | AD70: =IF(RC[21]=42,"*",IF(RC[21]=32,"",RC[21])) ->  | AE70: =RC[-28] ->  | AF70: =RC[-28] ->  | AG70: =RC[-28] ->  | AH70: =RC[-28] ->  | AI70: =RC[-28] ->  | AJ70: =RC[-28] ->  | AK70: =RC[-28] ->  | AL70: =RC[-28] -> 0 | AM70: =RC[-28] ->  | AN70: =RC[-28] ->  | AO70: =RC[-28] ->  | AP70: - | AQ70: =RC[-29] -> 0 | AR70: =RC[-29] -> 0 | AS70: - | AT70: =RC[-30] -> 0 | AU70: =RC[-30] -> 0 | AV70: =RC[-30] ->  | AW70: =RC[-30] -> 
A71: =IF(RC[1]="","",DATEVALUE(RC[1])) ->  | T71: =(RC[-16]*RC[-15]-RC[-13]*RC[-12])/1000 -> #VALUE! | W71: =RC[-2]*RC[-10]/1000 -> #VALUE! | X71: =ABS((RC[-3]*RC[-11]-RC[-2]*RC[-9])/1000) -> #VALUE! | Y71: =(RC[-14]-RC[1])/RC[-18]*100 -> #VALUE! | AC71: =VALUE(RC[-27]) -> #VALUE! | AD71: =IF(RC[21]=42,"*",IF(RC[21]=32,"",RC[21])) ->  | AE71: =RC[-28] ->  | AF71: =RC[-28] ->  | AG71: =RC[-28] ->  | AH71: =RC[-28] ->  | AI71: =RC[-28] ->  | AJ71: =RC[-28] ->  | AK71: =RC[-28] ->  | AL71: =RC[-28] -> 0 | AM71: =RC[-28] ->  | AN71: =RC[-28] ->  | AO71: =RC[-28] ->  | AP71: - | AQ71: =RC[-29] -> 0 | AR71: =RC[-29] -> 0 | AS71: - | AT71: =RC[-30] -> 0 | AU71: =RC[-30] -> 0 | AV71: =RC[-30] ->  | AW71: =RC[-30] -> 
A72: =IF(RC[1]="","",DATEVALUE(RC[1])) ->  | T72: =(RC[-16]*RC[-15]-RC[-13]*RC[-12])/1000 -> #VALUE! | W72: =RC[-2]*RC[-10]/1000 -> #VALUE! | X72: =ABS((RC[-3]*RC[-11]-RC[-2]*RC[-9])/1000) -> #VALUE! | Y72: =(RC[-14]-RC[1])/RC[-18]*100 -> #VALUE! | AC72: =VALUE(RC[-27]) -> #VALUE! | AD72: =IF(RC[21]=42,"*",IF(RC[21]=32,"",RC[21])) ->  | AE72: =RC[-28] ->  | AF72: =RC[-28] ->  | AG72: =RC[-28] ->  | AH72: =RC[-28] ->  | AI72: =RC[-28] ->  | AJ72: =RC[-28] ->  | AK72: =RC[-28] ->  | AL72: =RC[-28] -> 0 | AM72: =RC[-28] ->  | AN72: =RC[-28] ->  | AO72: =RC[-28] ->  | AP72: - | AQ72: =RC[-29] -> 0 | AR72: =RC[-29] -> 0 | AS72: - | AT72: =RC[-30] -> 0 | AU72: =RC[-30] -> 0 | AV72: =RC[-30] ->  | AW72: =RC[-30] -> 
A73: =IF(RC[1]="","",DATEVALUE(RC[1])) ->  | T73: =(RC[-16]*RC[-15]-RC[-13]*RC[-12])/1000 -> #VALUE! | W73: =RC[-2]*RC[-10]/1000 -> #VALUE! | X73: =ABS((RC[-3]*RC[-11]-RC[-2]*RC[-9])/1000) -> #VALUE! | Y73: =(RC[-14]-RC[1])/RC[-18]*100 -> #VALUE! | AC73: =VALUE(RC[-27]) -> #VALUE! | AD73: =IF(RC[21]=42,"*",IF(RC[21]=32,"",RC[21])) ->  | AE73: =RC[-28] ->  | AF73: =RC[-28] ->  | AG73: =RC[-28] ->  | AH73: =RC[-28] ->  | AI73: =RC[-28] ->  | AJ73: =RC[-28] ->  | AK73: =RC[-28] ->  | AL73: =RC[-28] -> 0 | AM73: =RC[-28] ->  | AN73: =RC[-28] ->  | AO73: =RC[-28] ->  | AP73: - | AQ73: =RC[-29] -> 0 | AR73: =RC[-29] -> 0 | AS73: - | AT73: =RC[-30] -> 0 | AU73: =RC[-30] -> 0 | AV73: =RC[-30] ->  | AW73: =RC[-30] -> 
A74: =IF(RC[1]="","",DATEVALUE(RC[1])) ->  | T74: =(RC[-16]*RC[-15]-RC[-13]*RC[-12])/1000 -> #VALUE! | W74: =RC[-2]*RC[-10]/1000 -> #VALUE! | X74: =ABS((RC[-3]*RC[-11]-RC[-2]*RC[-9])/1000) -> #VALUE! | Y74: =(RC[-14]-RC[1])/RC[-18]*100 -> #VALUE! | AC74: =VALUE(RC[-27]) -> #VALUE! | AD74: =IF(RC[21]=42,"*",IF(RC[21]=32,"",RC[21])) ->  | AE74: =RC[-28] ->  | AF74: =RC[-28] ->  | AG74: =RC[-28] ->  | AH74: =RC[-28] ->  | AI74: =RC[-28] ->  | AJ74: =RC[-28] ->  | AK74: =RC[-28] ->  | AL74: =RC[-28] -> 0 | AM74: =RC[-28] ->  | AN74: =RC[-28] ->  | AO74: =RC[-28] ->  | AP74: - | AQ74: =RC[-29] -> 0 | AR74: =RC[-29] -> 0 | AS74: - | AT74: =RC[-30] -> 0 | AU74: =RC[-30] -> 0 | AV74: =RC[-30] ->  | AW74: =RC[-30] -> 
A75: =IF(RC[1]="","",DATEVALUE(RC[1])) ->  | T75: =(RC[-16]*RC[-15]-RC[-13]*RC[-12])/1000 -> #VALUE! | W75: =RC[-2]*RC[-10]/1000 -> #VALUE! | X75: =ABS((RC[-3]*RC[-11]-RC[-2]*RC[-9])/1000) -> #VALUE! | Y75: =(RC[-14]-RC[1])/RC[-18]*100 -> #VALUE! | AC75: =VALUE(RC[-27]) -> #VALUE! | AD75: =IF(RC[21]=42,"*",IF(RC[21]=32,"",RC[21])) ->  | AE75: =RC[-28] ->  | AF75: =RC[-28] ->  | AG75: =RC[-28] ->  | AH75: =RC[-28] ->  | AI75: =RC[-28] ->  | AJ75: =RC[-28] ->  | AK75: =RC[-28] ->  | AL75: =RC[-28] -> 0 | AM75: =RC[-28] ->  | AN75: =RC[-28] ->  | AO75: =RC[-28] ->  | AP75: - | AQ75: =RC[-29] -> 0 | AR75: =RC[-29] -> 0 | AS75: - | AT75: =RC[-30] -> 0 | AU75: =RC[-30] -> 0 | AV75: =RC[-30] ->  | AW75: =RC[-30] -> 
A76: =IF(RC[1]="","",DATEVALUE(RC[1])) ->  | T76: =(RC[-16]*RC[-15]-RC[-13]*RC[-12])/1000 -> #VALUE! | W76: =RC[-2]*RC[-10]/1000 -> #VALUE! | X76: =ABS((RC[-3]*RC[-11]-RC[-2]*RC[-9])/1000) -> #VALUE! | Y76: =(RC[-14]-RC[1])/RC[-18]*100 -> #VALUE! | AC76: =VALUE(RC[-27]) -> #VALUE! | AD76: =IF(RC[21]=42,"*",IF(RC[21]=32,"",RC[21])) ->  | AE76: =RC[-28] ->  | AF76: =RC[-28] ->  | AG76: =RC[-28] ->  | AH76: =RC[-28] ->  | AI76: =RC[-28] ->  | AJ76: =RC[-28] ->  | AK76: =RC[-28] ->  | AL76: =RC[-28] -> 0 | AM76: =RC[-28] ->  | AN76: =RC[-28] ->  | AO76: =RC[-28] ->  | AP76: - | AQ76: =RC[-29] -> 0 | AR76: =RC[-29] -> 0 | AS76: - | AT76: =RC[-30] -> 0 | AU76: =RC[-30] -> 0 | AV76: =RC[-30] ->  | AW76: =RC[-30] -> 
A77: =IF(RC[1]="","",DATEVALUE(RC[1])) ->  | T77: =(RC[-16]*RC[-15]-RC[-13]*RC[-12])/1000 -> #VALUE! | W77: =RC[-2]*RC[-10]/1000 -> #VALUE! | X77: =ABS((RC[-3]*RC[-11]-RC[-2]*RC[-9])/1000) -> #VALUE! | Y77: =(RC[-14]-RC[1])/RC[-18]*100 -> #VALUE! | AC77: =VALUE(RC[-27]) -> #VALUE! | AD77: =IF(RC[21]=42,"*",IF(RC[21]=32,"",RC[21])) ->  | AE77: =RC[-28] ->  | AF77: =RC[-28] ->  | AG77: =RC[-28] ->  | AH77: =RC[-28] ->  | AI77: =RC[-28] ->  | AJ77: =RC[-28] ->  | AK77: =RC[-28] ->  | AL77: =RC[-28] -> 0 | AM77: =RC[-28] ->  | AN77: =RC[-28] ->  | AO77: =RC[-28] ->  | AP77: - | AQ77: =RC[-29] -> 0 | AR77: =RC[-29] -> 0 | AS77: - | AT77: =RC[-30] -> 0 | AU77: =RC[-30] -> 0 | AV77: =RC[-30] ->  | AW77: =RC[-30] -> 
A78: =IF(RC[1]="","",DATEVALUE(RC[1])) ->  | T78: =(RC[-16]*RC[-15]-RC[-13]*RC[-12])/1000 -> #VALUE! | W78: =RC[-2]*RC[-10]/1000 -> #VALUE! | X78: =ABS((RC[-3]*RC[-11]-RC[-2]*RC[-9])/1000) -> #VALUE! | Y78: =(RC[-14]-RC[1])/RC[-18]*100 -> #VALUE! | AC78: =VALUE(RC[-27]) -> #VALUE! | AD78: =IF(RC[21]=42,"*",IF(RC[21]=32,"",RC[21])) ->  | AE78: =RC[-28] ->  | AF78: =RC[-28] ->  | AG78: =RC[-28] ->  | AH78: =RC[-28] ->  | AI78: =RC[-28] ->  | AJ78: =RC[-28] ->  | AK78: =RC[-28] ->  | AL78: =RC[-28] -> 0 | AM78: =RC[-28] ->  | AN78: =RC[-28] ->  | AO78: =RC[-28] ->  | AP78: - | AQ78: =RC[-29] -> 0 | AR78: =RC[-29] -> 0 | AS78: - | AT78: =RC[-30] -> 0 | AU78: =RC[-30] -> 0 | AV78: =RC[-30] ->  | AW78: =RC[-30] -> 
A79: =IF(RC[1]="","",DATEVALUE(RC[1])) ->  | T79: =(RC[-16]*RC[-15]-RC[-13]*RC[-12])/1000 -> #VALUE! | W79: =RC[-2]*RC[-10]/1000 -> #VALUE! | X79: =ABS((RC[-3]*RC[-11]-RC[-2]*RC[-9])/1000) -> #VALUE! | Y79: =(RC[-14]-RC[1])/RC[-18]*100 -> #VALUE! | AC79: =VALUE(RC[-27]) -> #VALUE! | AD79: =IF(RC[21]=42,"*",IF(RC[21]=32,"",RC[21])) ->  | AE79: =RC[-28] ->  | AF79: =RC[-28] ->  | AG79: =RC[-28] ->  | AH79: =RC[-28] ->  | AI79: =RC[-28] ->  | AJ79: =RC[-28] ->  | AK79: =RC[-28] ->  | AL79: =RC[-28] -> 0 | AM79: =RC[-28] ->  | AN79: =RC[-28] ->  | AO79: =RC[-28] ->  | AP79: - | AQ79: =RC[-29] -> 0 | AR79: =RC[-29] -> 0 | AS79: - | AT79: =RC[-30] -> 0 | AU79: =RC[-30] -> 0 | AV79: =RC[-30] ->  | AW79: =RC[-30] -> 
A80: =IF(RC[1]="","",DATEVALUE(RC[1])) ->  | T80: =(RC[-16]*RC[-15]-RC[-13]*RC[-12])/1000 -> #VALUE! | W80: =RC[-2]*RC[-10]/1000 -> #VALUE! | X80: =ABS((RC[-3]*RC[-11]-RC[-2]*RC[-9])/1000) -> #VALUE! | Y80: =(RC[-14]-RC[1])/RC[-18]*100 -> #VALUE! | AC80: =VALUE(RC[-27]) -> #VALUE! | AD80: =IF(RC[21]=42,"*",IF(RC[21]=32,"",RC[21])) ->  | AE80: =RC[-28] ->  | AF80: =RC[-28] ->  | AG80: =RC[-28] ->  | AH80: =RC[-28] ->  | AI80: =RC[-28] ->  | AJ80: =RC[-28] ->  | AK80: =RC[-28] ->  | AL80: =RC[-28] -> 0 | AM80: =RC[-28] ->  | AN80: =RC[-28] ->  | AO80: =RC[-28] ->  | AP80: - | AQ80: =RC[-29] -> 0 | AR80: =RC[-29] -> 0 | AS80: - | AT80: =RC[-30] -> 0 | AU80: =RC[-30] -> 0 | AV80: =RC[-30] ->  | AW80: =RC[-30] -> 
A81: =IF(RC[1]="","",DATEVALUE(RC[1])) ->  | T81: =(RC[-16]*RC[-15]-RC[-13]*RC[-12])/1000 -> #VALUE! | W81: =RC[-2]*RC[-10]/1000 -> #VALUE! | X81: =ABS((RC[-3]*RC[-11]-RC[-2]*RC[-9])/1000) -> #VALUE! | Y81: =(RC[-14]-RC[1])/RC[-18]*100 -> #VALUE! | AC81: =VALUE(RC[-27]) -> #VALUE! | AD81: =IF(RC[21]=42,"*",IF(RC[21]=32,"",RC[21])) ->  | AE81: =RC[-28] ->  | AF81: =RC[-28] ->  | AG81: =RC[-28] ->  | AH81: =RC[-28] ->  | AI81: =RC[-28] ->  | AJ81: =RC[-28] ->  | AK81: =RC[-28] ->  | AL81: =RC[-28] -> 0 | AM81: =RC[-28] ->  | AN81: =RC[-28] ->  | AO81: =RC[-28] ->  | AP81: - | AQ81: =RC[-29] -> 0 | AR81: =RC[-29] -> 0 | AS81: - | AT81: =RC[-30] -> 0 | AU81: =RC[-30] -> 0 | AV81: =RC[-30] ->  | AW81: =RC[-30] -> 
A82: =IF(RC[1]="","",DATEVALUE(RC[1])) ->  | T82: =(RC[-16]*RC[-15]-RC[-13]*RC[-12])/1000 -> #VALUE! | W82: =RC[-2]*RC[-10]/1000 -> #VALUE! | X82: =ABS((RC[-3]*RC[-11]-RC[-2]*RC[-9])/1000) -> #VALUE! | Y82: =(RC[-14]-RC[1])/RC[-18]*100 -> #VALUE! | AC82: =VALUE(RC[-27]) -> #VALUE! | AD82: =IF(RC[21]=42,"*",IF(RC[21]=32,"",RC[21])) ->  | AE82: =RC[-28] ->  | AF82: =RC[-28] ->  | AG82: =RC[-28] ->  | AH82: =RC[-28] ->  | AI82: =RC[-28] ->  | AJ82: =RC[-28] ->  | AK82: =RC[-28] ->  | AL82: =RC[-28] -> 0 | AM82: =RC[-28] ->  | AN82: =RC[-28] ->  | AO82: =RC[-28] ->  | AP82: - | AQ82: =RC[-29] -> 0 | AR82: =RC[-29] -> 0 | AS82: - | AT82: =RC[-30] -> 0 | AU82: =RC[-30] -> 0 | AV82: =RC[-30] ->  | AW82: =RC[-30] -> 
A83: =IF(RC[1]="","",DATEVALUE(RC[1])) ->  | T83: =(RC[-16]*RC[-15]-RC[-13]*RC[-12])/1000 -> #VALUE! | W83: =RC[-2]*RC[-10]/1000 -> #VALUE! | X83: =ABS((RC[-3]*RC[-11]-RC[-2]*RC[-9])/1000) -> #VALUE! | Y83: =(RC[-14]-RC[1])/RC[-18]*100 -> #VALUE! | AC83: =VALUE(RC[-27]) -> #VALUE! | AD83: =IF(RC[21]=42,"*",IF(RC[21]=32,"",RC[21])) ->  | AE83: =RC[-28] ->  | AF83: =RC[-28] ->  | AG83: =RC[-28] ->  | AH83: =RC[-28] ->  | AI83: =RC[-28] ->  | AJ83: =RC[-28] ->  | AK83: =RC[-28] ->  | AL83: =RC[-28] -> 0 | AM83: =RC[-28] ->  | AN83: =RC[-28] ->  | AO83: =RC[-28] ->  | AP83: - | AQ83: =RC[-29] -> 0 | AR83: =RC[-29] -> 0 | AS83: - | AT83: =RC[-30] -> 0 | AU83: =RC[-30] -> 0 | AV83: =RC[-30] ->  | AW83: =RC[-30] -> 
AC84: Среднее | AF84: =R[1]C[-28] -> 61.021663729999986 | AG84: =R[1]C[-28] -> 68.006666666666675 | AH84: =R[1]C[-28] -> 0 | AI84: =R[1]C[-28] -> 53.597179921000006 | AJ84: =R[1]C[-28] -> 41.256666666666668 | AK84: =R[1]C[-28] -> 0 | AL84: =R[1]C[-28] -> 26.75 | AM84: =R[1]C[-28] -> 7.4244838090000007 | AN84: =R[1]C[-28] -> 7.7053685183333336 | AO84: =R[1]C[-28] -> 65.641333333333321 | AP84: - | AQ84: =R[1]C[-29] -> 0 | AR84: =R[1]C[-29] -> 0 | AS84: - | AT84: =R[1]C[-30] -> 0 | AU84: =R[1]C[-30] -> 0
B85: Среднее | D85: =AVERAGE(OFFSET(R[-74]C,3,0,R7C1,1)) -> 61.021663729999986 | E85: =AVERAGE(OFFSET(R[-74]C,3,0,R7C1,1)) -> 68.006666666666675 | F85: =AVERAGE(OFFSET(R[-74]C,3,0,R7C1,1)) -> 0 | G85: =AVERAGE(OFFSET(R[-74]C,3,0,R7C1,1)) -> 53.597179921000006 | H85: =AVERAGE(OFFSET(R[-74]C,3,0,R7C1,1)) -> 41.256666666666668 | I85: =AVERAGE(OFFSET(R[-74]C,3,0,R7C1,1)) -> 0 | J85: =AVERAGE(OFFSET(R[-74]C,3,0,R7C1,1)) -> 26.75 | K85: =AVERAGE(OFFSET(R[-74]C,3,0,R7C1,1)) -> 7.4244838090000007 | L85: =IF(SUM(OFFSET(R[-74]C,3,0,R7C1,1))=0,"",AVERAGE(OFFSET(R[-74]C,3,0,R7C1,1))) -> 7.7053685183333336 | M85: =IF(SUM(OFFSET(R[-74]C,3,0,R7C1,1))=0,"",AVERAGE(OFFSET(R[-74]C,3,0,R7C1,1))) -> 65.641333333333321 | R85: =IF(SUM(OFFSET(R[-74]C,3,0,R7C1,1))=0,"",AVERAGE(OFFSET(R[-74]C,3,0,R7C1,1))) -> 0.51262092970031903 | S85: =AVERAGE(OFFSET(R[-74]C,3,0,R7C1,1)) -> 1.743160805467979 | T85: =AVERAGE(OFFSET(R[-74]C,3,0,R7C1,1)) -> 1.7535079002435401 | W85: =AVERAGE(OFFSET(R[-74]C,3,0,R7C1,1)) -> 0.49595755556241994 | X85: =AVERAGE(OFFSET(R[-74]C,3,0,R7C1,1)) -> #VALUE! | AC85: Итого | AE85: =R[1]C[-28] -> 720 | AF85: =R[1]C[-28] -> 1830.6499118999996 | AI85: =R[1]C[-28] -> 1607.9153976300001 | AM85: =R[1]C[-28] -> 222.73451427000003 | AN85: =R[1]C[-28] -> 231.16105555000001 | AQ85: =R[1]C[-29] -> 0 | AU85: =R[1]C[-30] -> 0 | AV85: =R[1]C[-30] -> 15.378627891009572 | AW85: =R[1]C[-30] -> 52.294824164039369
B86: ИТОГО: | C86: =SUM(OFFSET(R[-75]C,3,0,R7C1,1)) -> 720 | D86: =SUM(OFFSET(R[-75]C,3,0,R7C1,1)) -> 1830.6499118999996 | G86: =SUM(OFFSET(R[-75]C,3,0,R7C1,1)) -> 1607.9153976300001 | K86: =SUM(OFFSET(R[-75]C,3,0,R7C1,1)) -> 222.73451427000003 | L86: =IF(SUM(OFFSET(R[-75]C,3,0,R7C1,1))=0,"",SUM(OFFSET(R[-75]C,3,0,R7C1,1))) -> 231.16105555000001 | R86: =IF(SUM(OFFSET(R[-75]C,3,0,R7C1,1))=0,"",SUM(OFFSET(R[-75]C,3,0,R7C1,1))) -> 15.378627891009572 | S86: =SUM(OFFSET(R[-75]C,3,0,R7C1,1)) -> 52.294824164039369 | T86: =SUM(OFFSET(R[-75]C,3,0,R7C1,1)) -> 52.605237007306201 | W86: =SUM(OFFSET(R[-75]C,3,0,R7C1,1)) -> 14.878726666872598 | X86: =SUM(OFFSET(R[-75]C,3,0,R7C1,1)) -> #VALUE!
AC87: Досчёт | AF87: =R[1]C[-28] -> 0 | AI87: =R[1]C[-28] -> 0 | AM87: =R[1]C[-28] -> 0 | AN87: =R[1]C[-28] -> 0 | AQ87: =R[1]C[-29] -> 0 | AU87: =R[1]C[-30] -> 0 | AV87: =R[1]C[-30] -> 0 | AW87: =R[1]C[-30] -> 0
A88: 11дн=264ч 4дн=96ч | B88: Досчёт до конца м-ца (+) | C88: =R6C1*24 -> 216 | T88: № B04A | AC88: Снятие | AF88: =-R[1]C[-28] -> 0 | AI88: =-R[1]C[-28] -> 0 | AM88: =-R[1]C[-28] -> 0 | AN88: =-R[1]C[-28] -> 0 | AQ88: =-R[1]C[-29] -> 0 | AU88: =-R[1]C[-30] -> 0 | AV88: =-R[1]C[-30] -> 0 | AW88: =-R[1]C[-30] -> 0
A89: 9дн=216ч 7дн=168ч | B89: Вычет с предыдущего (-) | C89: =R4C1*24 -> 192 | AC89: Сумма | AF89: =R[1]C[-28] -> 1830.6499118999996 | AI89: =R[1]C[-28] -> 1607.9153976300001 | AM89: =R[1]C[-28] -> 222.73451427000003 | AN89: =R[1]C[-28] -> 231.16105555000001 | AQ89: =R[1]C[-29] -> 0 | AU89: =R[1]C[-30] -> 0 | AV89: =R[1]C[-30] -> 15.378627891009572 | AW89: =R[1]C[-30] -> 52.294824164039369
B90: СУММА: | C90: =R[-4]C+R[-2]C-R[-1]C -> 744 | D90: =R[-4]C+R[-2]C-R[-1]C -> 1830.6499118999996 | G90: =R[-4]C+R[-2]C-R[-1]C -> 1607.9153976300001 | K90: =R[-4]C+R[-2]C-R[-1]C -> 222.73451427000003 | L90: =IF(SUM(OFFSET(R[-79]C,3,0,R7C1,1))=0,"",(R[-4]C+R[-2]C-R[-1]C)) -> 231.16105555000001 | R90: =IF(SUM(OFFSET(R[-79]C,3,0,R7C1,1))=0,"",(R[-4]C+R[-2]C-R[-1]C)) -> 15.378627891009572 | S90: =R[-4]C+R[-2]C-R[-1]C -> 52.294824164039369
AC91: Тхв на источнике | AE91: V гвс (м3) | AF91: =R[-2]C[15] -> 0 | AG91: W гвс (Гкал) | AH91: =RC[-2]*0.06 -> 0 | AI91: W без гвс (Гкал) | AJ91: =R[-2]C[13]-RC[-2] -> 52.294824164039369
B92: Показания счетчиков на момент снятия данных:
B93: Дата, время | D93: М1, т | F93: М2, т | H93: М3, т | J93: М4, т | L93: Qо, Гкал | N93: Qг, Гкал | P93: время, час
B94: 23.09.18 01:26 | D94: 41631.05859375 | F94: 35328.76171875 | H94: 6781.9272460900002 | J94: - | L94: 1354.47082198815 | N94: 504.15336453616101 | P94: -
B95: 18.10.18 01:39 | D95: 43090.43359375 | F95: 36603.9609375 | H95: 6975.1655273400002 | J95: - | L95: 1396.51784608054 | N95: 517.19565668051996 | P95: -
AC97: =ZAYAVKA_N -> з.н д. №02/147-2783 от 04.10.18 29.09.18г некорректная работа М3
B98: Представитель потребителя:_______________________________________________________________________ В.О. Топорков
I101: Рекомендуемые значения по параметрам теплопотребления (не являются официально утверждёнными)
I102: М, т | J102: V, м3 | K102: Qгвс, Гкал | L102: Qотоп, Гкал | M102: Qо, Гкал
I103: =R[-13]C[-3] -> 0 | J103: =RC[-1]/0.98 -> 0 | K103: =RC[-1]*0.06 -> 0 | L103: =RC[1]-RC[-1] -> 15.378627891009572 | M103: =R[-13]C[5] -> 15.378627891009572
O105: ДЛЯ САМОКОНТРОЛЯ
B106: В строке выбора дат указать период с 16.7.13 по 23.8.13 - жильё | N106: Q | O106: Qг
B107: В строке выбора дат указать период с 18.7.13 по 25.8.13 - не жилое | N107: =(R[-21]C[-10]*R[-22]C[-7]-R[-21]C[-9]*R[-22]C[-6])/1000 -> 98.117672700467082 | O107: =IF(R[-22]C[-2]="",R[-21]C[-3]*R[-22]C/1000,"") ->  | P107: Си2
O108: =IF(R[-23]C[-2]="","",((R[-22]C[-3]*R[-23]C)-(R[-22]C[-2]*R[-23]C[2]))/1000) -> 0 | P108: Си3