Sheet: Лист1
G1: Отчёт о теплопотреблении за октябрь 2018 | M1: з.н д. №02/147-2783 от 04.10.18 В данном отчете ГВС суммируется
A4: =EOMONTH(R[9]C,0)-R[9]C -> 8 | B4: Потребитель: ЗАО "Сити Сервис"
A5: =MAX(R[9]C:R[78]C) -> 2018-10-22T00:00:00.000 | B5: Адрес: г. СПб, Кораблестроителей ул., д.29 к.5 ИТП 2
A6: =EOMONTH(R[-1]C,0)-R[-1]C -> 9 | B6: Телефон: 8-911-021-19-79
A7: =R[-2]C-R[6]C -> 30 | B7: Договор 10023-2 (.) 87486
A8: 7 | B8: Тепловычислитель: СПТ-943 № 05769 | L8: М2 мах= | M8: 114 | O8: Мгвс мах= | P8: 27.36
L9: Qотоп мах= | M9: 9.12 | O9: Qгвс мах= | P9: 1.642
B10: Расчётная формула: Q=M1*(h1-h2)+(M1-M2)*(h2-hхв)
D12: Учет | L12: Контроль
A13: =R[1]C[1]-1 -> 2018-09-22T00:00:00.000 | B13: Дата | C13: N, ч | D13: M1, т | E13: T1, С | F13: P1, кг/см2 | G13: M2, т | H13: T2, С | I13: P2, кг/см2 | J13: dT, С | K13: M1-М2, т | L13: V3, м3 | M13: T3, С | N13: V4, м3 | O13: =IF(R[-12]C[-14]="м.куб","","T4, С") -> T4, С | P13: dT, С | Q13: V3+V4, м3 | R13: Qгвс, Гкал | S13: Qобщ., Гкал | T13: Q | U13: M3 | V13: M4 | W13: си2 | X13: си3 | Y13: Разб. | Z13: dM2 | AC13: Дата | AD13: НС | AE13: n, ч | AF13: М1, т | AG13: t1, гр. С | AH13: Р1, кгс/см2 | AI13: М2, т | AJ13: t2, гр. С | AK13: Р2, кгс/см2 | AL13: t1-t2, гр. С | AM13: М1-М2, т | AN13: М1гвс, т | AO13: t1гвс, гр. С | AP13: Р1гвс, кгс/см2 | AQ13: М2гвс, т | AR13: t2гвс, гр. С | AS13: Р2гвс, кгс/см2 | AT13: t1гвс-t2гвс | AU13: М1гвс-М2гвс, т | AV13: Wгвс, Гкал | AW13: Wсумм, Гкал | AY13: NS_TV1 | AZ13: НС | BA13: NS_TV2
A14: =IF(RC[1]="","",DATEVALUE(RC[1])) -> 43366 | B14: 23.09.18 | C14: 24 | D14: 72.618324000000001 | E14: 70.667418999999995 | F14: 7.5869450000000001 | G14: 60.892226999999998 | H14: 70.303207 | I14: 4.2546179999999998 | J14: =RC[-5]-RC[-2] -> 0.36421199999999487 | K14: 11.808248000000001 | L14: 9.9638770000000001 | M14: 70.460419000000002 | N14: 3.3884889999999999 | O14: 69.250152999999997 | P14: =IF(AND(ISNUMBER(RC[-3]),ISNUMBER(RC[-1])),RC[-3]-RC[-1],"-") -> 1.2102660000000043 | Q14: 13.352366 | R14: 0.91674500000000003 | S14: =RC[-1] -> 0.91674500000000003 | T14: =(RC[-16]*RC[-15]-RC[-13]*RC[-12])/1000 -> 0.8508306897137673 | U14: 9.7422900000000006 | V14: 3.3154539999999999 | W14: =RC[-2]*RC[-10]/1000 -> 0.6864458354195101 | X14: =ABS((RC[-3]*RC[-11]-RC[-2]*RC[-9])/1000) -> 0.45685013865504809 | Y14: =(RC[-14]-RC[1])/RC[-18]*100 -> -2.0519794751471299 | Z14: =RC[-5]+RC[-4] -> 13.057744 | AC14: =VALUE(RC[-27]) -> 2018-09-23T00:00:00.000 | AD14: =IF(RC[21]=42,"*",IF(RC[21]=32,"",RC[21])) -> - | AE14: =RC[-28] -> 24 | AF14: =RC[-28] -> 72.618324000000001 | AG14: =RC[-28] -> 70.667418999999995 | AH14: =RC[-28] -> 7.5869450000000001 | AI14: =RC[-28] -> 60.892226999999998 | AJ14: =RC[-28] -> 70.303207 | AK14: =RC[-28] -> 4.2546179999999998 | AL14: =RC[-28] -> 0.36421199999999487 | AM14: =RC[-28] -> 11.808248000000001 | AN14: =RC[-28] -> 9.9638770000000001 | AO14: =RC[-28] -> 70.460419000000002 | AP14: - | AQ14: =RC[-29] -> 3.3884889999999999 | AR14: =RC[-29] -> 69.250152999999997 | AS14: - | AT14: =RC[-30] -> 1.2102660000000043 | AU14: =RC[-30] -> 13.352366 | AV14: =RC[-30] -> 0.91674500000000003 | AW14: =RC[-30] -> 0.91674500000000003 | AY14: - | AZ14: - | BA14: -
A15: =IF(RC[1]="","",DATEVALUE(RC[1])) -> 43367 | B15: 24.09.18 | C15: 24 | D15: 66.233870999999994 | E15: 69.535186999999993 | F15: 7.6822840000000001 | G15: 54.895854999999997 | H15: 69.157745000000006 | I15: 4.7462879999999998 | J15: =RC[-5]-RC[-2] -> 0.37744199999998784 | K15: 11.342995999999999 | L15: 9.9884880000000003 | M15: 69.193077000000002 | N15: 2.892433 | O15: 67.774772999999996 | P15: =IF(AND(ISNUMBER(RC[-3]),ISNUMBER(RC[-1])),RC[-3]-RC[-1],"-") -> 1.4183040000000062 | Q15: 12.880921000000001 | R15: 0.86889700000000003 | S15: =RC[-1] -> 0.86889700000000003 | T15: =(RC[-16]*RC[-15]-RC[-13]*RC[-12])/1000 -> 0.80911106407190114 | U15: 9.7735649999999996 | V15: 2.8324859999999998 | W15: =RC[-2]*RC[-10]/1000 -> 0.67626303560950496 | X15: =ABS((RC[-3]*RC[-11]-RC[-2]*RC[-9])/1000) -> 0.48429193993382702 | Y15: =(RC[-14]-RC[1])/RC[-18]*100 -> -2.3008203442682507 | Z15: =RC[-5]+RC[-4] -> 12.606050999999999 | AC15: =VALUE(RC[-27]) -> 2018-09-24T00:00:00.000 | AD15: =IF(RC[21]=42,"*",IF(RC[21]=32,"",RC[21])) -> - | AE15: =RC[-28] -> 24 | AF15: =RC[-28] -> 66.233870999999994 | AG15: =RC[-28] -> 69.535186999999993 | AH15: =RC[-28] -> 7.6822840000000001 | AI15: =RC[-28] -> 54.895854999999997 | AJ15: =RC[-28] -> 69.157745000000006 | AK15: =RC[-28] -> 4.7462879999999998 | AL15: =RC[-28] -> 0.37744199999998784 | AM15: =RC[-28] -> 11.342995999999999 | AN15: =RC[-28] -> 9.9884880000000003 | AO15: =RC[-28] -> 69.193077000000002 | AP15: - | AQ15: =RC[-29] -> 2.892433 | AR15: =RC[-29] -> 67.774772999999996 | AS15: - | AT15: =RC[-30] -> 1.4183040000000062 | AU15: =RC[-30] -> 12.880921000000001 | AV15: =RC[-30] -> 0.86889700000000003 | AW15: =RC[-30] -> 0.86889700000000003 | AY15: - | AZ15: - | BA15: -
A16: =IF(RC[1]="","",DATEVALUE(RC[1])) -> 43368 | B16: 25.09.18 | C16: 24 | D16: 88.529999000000004 | E16: 67.896477000000004 | F16: 7.7330160000000001 | G16: 77.917572000000007 | H16: 51.825496999999999 | I16: 5.4572580000000004 | J16: =RC[-5]-RC[-2] -> 16.070980000000006 | K16: 10.612425 | L16: 9.6020099999999999 | M16: 67.618415999999996 | N16: 3.2094779999999998 | O16: 66.667434999999998 | P16: =IF(AND(ISNUMBER(RC[-3]),ISNUMBER(RC[-1])),RC[-3]-RC[-1],"-") -> 0.95098099999999874 | Q16: 12.811488000000001 | R16: 0.84618000000000004 | S16: 1.98234 | T16: =(RC[-16]*RC[-15]-RC[-13]*RC[-12])/1000 -> 1.9727581469802393 | U16: 9.4038880000000002 | V16: 3.1449280000000002 | W16: =RC[-2]*RC[-10]/1000 -> 0.63587601080140799 | X16: =ABS((RC[-3]*RC[-11]-RC[-2]*RC[-9])/1000) -> 0.42621172778172806 | Y16: =(RC[-14]-RC[1])/RC[-18]*100 -> -2.4851788246173792 | Z16: =RC[-5]+RC[-4] -> 12.548816 | AC16: =VALUE(RC[-27]) -> 2018-09-25T00:00:00.000 | AD16: =IF(RC[21]=42,"*",IF(RC[21]=32,"",RC[21])) -> - | AE16: =RC[-28] -> 24 | AF16: =RC[-28] -> 88.529999000000004 | AG16: =RC[-28] -> 67.896477000000004 | AH16: =RC[-28] -> 7.7330160000000001 | AI16: =RC[-28] -> 77.917572000000007 | AJ16: =RC[-28] -> 51.825496999999999 | AK16: =RC[-28] -> 5.4572580000000004 | AL16: =RC[-28] -> 16.070980000000006 | AM16: =RC[-28] -> 10.612425 | AN16: =RC[-28] -> 9.6020099999999999 | AO16: =RC[-28] -> 67.618415999999996 | AP16: - | AQ16: =RC[-29] -> 3.2094779999999998 | AR16: =RC[-29] -> 66.667434999999998 | AS16: - | AT16: =RC[-30] -> 0.95098099999999874 | AU16: =RC[-30] -> 12.811488000000001 | AV16: =RC[-30] -> 0.84618000000000004 | AW16: =RC[-30] -> 1.98234 | AY16: - | AZ16: - | BA16: -
A17: =IF(RC[1]="","",DATEVALUE(RC[1])) -> 43369 | B17: 26.09.18 | C17: 24 | D17: 125.960815 | E17: 67.810965999999993 | F17: 7.6140210000000002 | G17: 117.026993 | H17: 44.266086999999999 | I17: 5.457605 | J17: =RC[-5]-RC[-2] -> 23.544878999999995 | K17: 8.9901499999999999 | L17: 9.4745659999999994 | M17: 66.884033000000002 | N17: 3.0469219999999999 | O17: 65.55162 | P17: =IF(AND(ISNUMBER(RC[-3]),ISNUMBER(RC[-1])),RC[-3]-RC[-1],"-") -> 1.3324130000000025 | Q17: 12.521488 | R17: 0.81732300000000002 | S17: 4.5744980000000002 | T17: =(RC[-16]*RC[-15]-RC[-13]*RC[-12])/1000 -> 3.3611974898108983 | U17: 9.2828920000000004 | V17: 2.987511 | W17: =RC[-2]*RC[-10]/1000 -> 0.62087725486343603 | X17: =ABS((RC[-3]*RC[-11]-RC[-2]*RC[-9])/1000) -> 0.42504106904561606 | Y17: =(RC[-14]-RC[1])/RC[-18]*100 -> -2.8029883669659013 | Z17: =RC[-5]+RC[-4] -> 12.270403 | AC17: =VALUE(RC[-27]) -> 2018-09-26T00:00:00.000 | AD17: =IF(RC[21]=42,"*",IF(RC[21]=32,"",RC[21])) -> - | AE17: =RC[-28] -> 24 | AF17: =RC[-28] -> 125.960815 | AG17: =RC[-28] -> 67.810965999999993 | AH17: =RC[-28] -> 7.6140210000000002 | AI17: =RC[-28] -> 117.026993 | AJ17: =RC[-28] -> 44.266086999999999 | AK17: =RC[-28] -> 5.457605 | AL17: =RC[-28] -> 23.544878999999995 | AM17: =RC[-28] -> 8.9901499999999999 | AN17: =RC[-28] -> 9.4745659999999994 | AO17: =RC[-28] -> 66.884033000000002 | AP17: - | AQ17: =RC[-29] -> 3.0469219999999999 | AR17: =RC[-29] -> 65.55162 | AS17: - | AT17: =RC[-30] -> 1.3324130000000025 | AU17: =RC[-30] -> 12.521488 | AV17: =RC[-30] -> 0.81732300000000002 | AW17: =RC[-30] -> 4.5744980000000002 | AY17: - | AZ17: - | BA17: -
A18: =IF(RC[1]="","",DATEVALUE(RC[1])) -> 43370 | B18: 27.09.18 | C18: 24 | D18: 114.97547900000001 | E18: 63.127364999999998 | F18: 7.2534669999999997 | G18: 105.37080400000001 | H18: 41.369267000000001 | I18: 5.4968919999999999 | J18: =RC[-5]-RC[-2] -> 21.758097999999997 | K18: 9.6046800000000001 | L18: 9.5705109999999998 | M18: 62.940083000000001 | N18: 3.0243769999999999 | O18: 61.657958999999998 | P18: =IF(AND(ISNUMBER(RC[-3]),ISNUMBER(RC[-1])),RC[-3]-RC[-1],"-") -> 1.2821240000000032 | Q18: 12.594887999999999 | R18: 0.77529499999999996 | S18: 4.1530670000000001 | T18: =(RC[-16]*RC[-15]-RC[-13]*RC[-12])/1000 -> 2.8989861042021667 | U18: 9.3974089999999997 | V18: 2.971708 | W18: =RC[-2]*RC[-10]/1000 -> 0.59147370244494701 | X18: =ABS((RC[-3]*RC[-11]-RC[-2]*RC[-9])/1000) -> 0.40824425242097501 | Y18: =(RC[-14]-RC[1])/RC[-18]*100 -> -2.6235322262512102 | Z18: =RC[-5]+RC[-4] -> 12.369116999999999 | AC18: =VALUE(RC[-27]) -> 2018-09-27T00:00:00.000 | AD18: =IF(RC[21]=42,"*",IF(RC[21]=32,"",RC[21])) -> - | AE18: =RC[-28] -> 24 | AF18: =RC[-28] -> 114.97547900000001 | AG18: =RC[-28] -> 63.127364999999998 | AH18: =RC[-28] -> 7.2534669999999997 | AI18: =RC[-28] -> 105.37080400000001 | AJ18: =RC[-28] -> 41.369267000000001 | AK18: =RC[-28] -> 5.4968919999999999 | AL18: =RC[-28] -> 21.758097999999997 | AM18: =RC[-28] -> 9.6046800000000001 | AN18: =RC[-28] -> 9.5705109999999998 | AO18: =RC[-28] -> 62.940083000000001 | AP18: - | AQ18: =RC[-29] -> 3.0243769999999999 | AR18: =RC[-29] -> 61.657958999999998 | AS18: - | AT18: =RC[-30] -> 1.2821240000000032 | AU18: =RC[-30] -> 12.594887999999999 | AV18: =RC[-30] -> 0.77529499999999996 | AW18: =RC[-30] -> 4.1530670000000001 | AY18: - | AZ18: - | BA18: -
A19: =IF(RC[1]="","",DATEVALUE(RC[1])) -> 43371 | B19: 28.09.18 | C19: 24 | D19: 116.39447800000001 | E19: 67.676933000000005 | F19: 7.5335479999999997 | G19: 108.456367 | H19: 43.375931000000001 | I19: 5.6279690000000002 | J19: =RC[-5]-RC[-2] -> 24.301002000000004 | K19: 7.9381050000000002 | L19: 8.6166889999999992 | M19: 67.370445000000004 | N19: 2.628644 | O19: 65.786582999999993 | P19: =IF(AND(ISNUMBER(RC[-3]),ISNUMBER(RC[-1])),RC[-3]-RC[-1],"-") -> 1.5838620000000105 | Q19: 11.245333 | R19: 0.738703 | S19: 5.0275470000000002 | T19: =(RC[-16]*RC[-15]-RC[-13]*RC[-12])/1000 -> 3.1728253976732987 | U19: 8.4400759999999995 | V19: 2.577048 | W19: =RC[-2]*RC[-10]/1000 -> 0.5686116759538199 | X19: =ABS((RC[-3]*RC[-11]-RC[-2]*RC[-9])/1000) -> 0.39907649380683596 | Y19: =(RC[-14]-RC[1])/RC[-18]*100 -> -2.8389472053770701 | Z19: =RC[-5]+RC[-4] -> 11.017123999999999 | AC19: =VALUE(RC[-27]) -> 2018-09-28T00:00:00.000 | AD19: =IF(RC[21]=42,"*",IF(RC[21]=32,"",RC[21])) -> - | AE19: =RC[-28] -> 24 | AF19: =RC[-28] -> 116.39447800000001 | AG19: =RC[-28] -> 67.676933000000005 | AH19: =RC[-28] -> 7.5335479999999997 | AI19: =RC[-28] -> 108.456367 | AJ19: =RC[-28] -> 43.375931000000001 | AK19: =RC[-28] -> 5.6279690000000002 | AL19: =RC[-28] -> 24.301002000000004 | AM19: =RC[-28] -> 7.9381050000000002 | AN19: =RC[-28] -> 8.6166889999999992 | AO19: =RC[-28] -> 67.370445000000004 | AP19: - | AQ19: =RC[-29] -> 2.628644 | AR19: =RC[-29] -> 65.786582999999993 | AS19: - | AT19: =RC[-30] -> 1.5838620000000105 | AU19: =RC[-30] -> 11.245333 | AV19: =RC[-30] -> 0.738703 | AW19: =RC[-30] -> 5.0275470000000002 | AY19: - | AZ19: - | BA19: -
A20: =IF(RC[1]="","",DATEVALUE(RC[1])) -> 43372 | B20: 29.09.18 | C20: 24 | D20: 134.09419299999999 | E20: 67.463097000000005 | F20: 8.3856369999999991 | G20: 124.998665 | H20: 45.012650000000001 | I20: 5.9323790000000001 | J20: =RC[-5]-RC[-2] -> 22.450447000000004 | K20: 9.1699619999999999 | L20: 9.7816890000000001 | M20: 66.992378000000002 | N20: 3.1632220000000002 | O20: 65.706230000000005 | P20: =IF(AND(ISNUMBER(RC[-3]),ISNUMBER(RC[-1])),RC[-3]-RC[-1],"-") -> 1.2861479999999972 | Q20: 12.944910999999999 | R20: 0.84642600000000001 | S20: 4.640841 | T20: =(RC[-16]*RC[-15]-RC[-13]*RC[-12])/1000 -> 3.4198883913834699 | U20: 9.5832789999999992 | V20: 3.1012900000000001 | W20: =RC[-2]*RC[-10]/1000 -> 0.64200664924746198 | X20: =ABS((RC[-3]*RC[-11]-RC[-2]*RC[-9])/1000) -> 0.43823257521076192 | Y20: =(RC[-14]-RC[1])/RC[-18]*100 -> -2.8117156291229186 | Z20: =RC[-5]+RC[-4] -> 12.684569 | AC20: =VALUE(RC[-27]) -> 2018-09-29T00:00:00.000 | AD20: =IF(RC[21]=42,"*",IF(RC[21]=32,"",RC[21])) -> - | AE20: =RC[-28] -> 24 | AF20: =RC[-28] -> 134.09419299999999 | AG20: =RC[-28] -> 67.463097000000005 | AH20: =RC[-28] -> 8.3856369999999991 | AI20: =RC[-28] -> 124.998665 | AJ20: =RC[-28] -> 45.012650000000001 | AK20: =RC[-28] -> 5.9323790000000001 | AL20: =RC[-28] -> 22.450447000000004 | AM20: =RC[-28] -> 9.1699619999999999 | AN20: =RC[-28] -> 9.7816890000000001 | AO20: =RC[-28] -> 66.992378000000002 | AP20: - | AQ20: =RC[-29] -> 3.1632220000000002 | AR20: =RC[-29] -> 65.706230000000005 | AS20: - | AT20: =RC[-30] -> 1.2861479999999972 | AU20: =RC[-30] -> 12.944910999999999 | AV20: =RC[-30] -> 0.84642600000000001 | AW20: =RC[-30] -> 4.640841 | AY20: - | AZ20: - | BA20: -
A21: =IF(RC[1]="","",DATEVALUE(RC[1])) -> 43373 | B21: 30.09.18 | C21: 24 | D21: 136.72418200000001 | E21: 69.670952 | F21: 8.3765110000000007 | G21: 126.639748 | H21: 46.297778999999998 | I21: 5.8742080000000003 | J21: =RC[-5]-RC[-2] -> 23.373173000000001 | K21: 10.103573000000001 | L21: 10.755387000000001 | M21: 69.624213999999995 | N21: 3.1542780000000001 | O21: 68.532180999999994 | P21: =IF(AND(ISNUMBER(RC[-3]),ISNUMBER(RC[-1])),RC[-3]-RC[-1],"-") -> 1.0920330000000007 | Q21: 13.909665 | R21: 0.94484299999999999 | S21: 5.4812440000000002 | T21: =(RC[-16]*RC[-15]-RC[-13]*RC[-12])/1000 -> 3.6625648558415724 | U21: 10.521304000000001 | V21: 3.0875300000000001 | W21: =RC[-2]*RC[-10]/1000 -> 0.732537521255056 | X21: =ABS((RC[-3]*RC[-11]-RC[-2]*RC[-9])/1000) -> 0.52094235645212605 | Y21: =(RC[-14]-RC[1])/RC[-18]*100 -> -2.7678995381450071 | Z21: =RC[-5]+RC[-4] -> 13.608834000000002 | AC21: =VALUE(RC[-27]) -> 2018-09-30T00:00:00.000 | AD21: =IF(RC[21]=42,"*",IF(RC[21]=32,"",RC[21])) -> - | AE21: =RC[-28] -> 24 | AF21: =RC[-28] -> 136.72418200000001 | AG21: =RC[-28] -> 69.670952 | AH21: =RC[-28] -> 8.3765110000000007 | AI21: =RC[-28] -> 126.639748 | AJ21: =RC[-28] -> 46.297778999999998 | AK21: =RC[-28] -> 5.8742080000000003 | AL21: =RC[-28] -> 23.373173000000001 | AM21: =RC[-28] -> 10.103573000000001 | AN21: =RC[-28] -> 10.755387000000001 | AO21: =RC[-28] -> 69.624213999999995 | AP21: - | AQ21: =RC[-29] -> 3.1542780000000001 | AR21: =RC[-29] -> 68.532180999999994 | AS21: - | AT21: =RC[-30] -> 1.0920330000000007 | AU21: =RC[-30] -> 13.909665 | AV21: =RC[-30] -> 0.94484299999999999 | AW21: =RC[-30] -> 5.4812440000000002 | AY21: - | AZ21: - | BA21: -
A22: =IF(RC[1]="","",DATEVALUE(RC[1])) -> 43374 | B22: 01.10.18 | C22: 24 | D22: 131.85983300000001 | E22: 68.512482000000006 | F22: 8.3736610000000002 | G22: 123.983566 | H22: 46.069674999999997 | I22: 6.00068 | J22: =RC[-5]-RC[-2] -> 22.442807000000009 | K22: 7.9124920000000003 | L22: 8.6211649999999995 | M22: 68.037239 | N22: 3.0731890000000002 | O22: 66.951942000000003 | P22: =IF(AND(ISNUMBER(RC[-3]),ISNUMBER(RC[-1])),RC[-3]-RC[-1],"-") -> 1.0852969999999971 | Q22: 11.694354000000001 | R22: 0.77649400000000002 | S22: 3.3301660000000002 | T22: =(RC[-16]*RC[-15]-RC[-13]*RC[-12])/1000 -> 3.3221618439744578 | U22: 8.4412640000000003 | V22: 3.010904 | W22: =RC[-2]*RC[-10]/1000 -> 0.57432029623009595 | X22: =ABS((RC[-3]*RC[-11]-RC[-2]*RC[-9])/1000) -> 0.37273442625452796 | Y22: =(RC[-14]-RC[1])/RC[-18]*100 -> -2.8549557930927718 | Z22: =RC[-5]+RC[-4] -> 11.452168 | AC22: =VALUE(RC[-27]) -> 2018-10-01T00:00:00.000 | AD22: =IF(RC[21]=42,"*",IF(RC[21]=32,"",RC[21])) -> - | AE22: =RC[-28] -> 24 | AF22: =RC[-28] -> 131.85983300000001 | AG22: =RC[-28] -> 68.512482000000006 | AH22: =RC[-28] -> 8.3736610000000002 | AI22: =RC[-28] -> 123.983566 | AJ22: =RC[-28] -> 46.069674999999997 | AK22: =RC[-28] -> 6.00068 | AL22: =RC[-28] -> 22.442807000000009 | AM22: =RC[-28] -> 7.9124920000000003 | AN22: =RC[-28] -> 8.6211649999999995 | AO22: =RC[-28] -> 68.037239 | AP22: - | AQ22: =RC[-29] -> 3.0731890000000002 | AR22: =RC[-29] -> 66.951942000000003 | AS22: - | AT22: =RC[-30] -> 1.0852969999999971 | AU22: =RC[-30] -> 11.694354000000001 | AV22: =RC[-30] -> 0.77649400000000002 | AW22: =RC[-30] -> 3.3301660000000002 | AY22: - | AZ22: - | BA22: -
A23: =IF(RC[1]="","",DATEVALUE(RC[1])) -> 43375 | B23: 02.10.18 | C23: 24 | D23: 136.06068400000001 | E23: 67.271759000000003 | F23: 8.3431619999999995 | G23: 126.637184 | H23: 45.822552000000002 | I23: 5.8618800000000002 | J23: =RC[-5]-RC[-2] -> 21.449207000000001 | K23: 9.4574049999999996 | L23: 10.492743000000001 | M23: 67.002632000000006 | N23: 2.7528779999999999 | O23: 65.576194999999998 | P23: =IF(AND(ISNUMBER(RC[-3]),ISNUMBER(RC[-1])),RC[-3]-RC[-1],"-") -> 1.4264370000000071 | Q23: 13.245621 | R23: 0.86644100000000002 | S23: 3.9738549999999999 | T23: =(RC[-16]*RC[-15]-RC[-13]*RC[-12])/1000 -> 3.3502025944495881 | U23: 10.279864 | V23: 2.6991640000000001 | W23: =RC[-2]*RC[-10]/1000 -> 0.688777944602048 | X23: =ABS((RC[-3]*RC[-11]-RC[-2]*RC[-9])/1000) -> 0.51177703980106803 | Y23: =(RC[-14]-RC[1])/RC[-18]*100 -> -2.7808759550433466 | Z23: =RC[-5]+RC[-4] -> 12.979028 | AC23: =VALUE(RC[-27]) -> 2018-10-02T00:00:00.000 | AD23: =IF(RC[21]=42,"*",IF(RC[21]=32,"",RC[21])) -> - | AE23: =RC[-28] -> 24 | AF23: =RC[-28] -> 136.06068400000001 | AG23: =RC[-28] -> 67.271759000000003 | AH23: =RC[-28] -> 8.3431619999999995 | AI23: =RC[-28] -> 126.637184 | AJ23: =RC[-28] -> 45.822552000000002 | AK23: =RC[-28] -> 5.8618800000000002 | AL23: =RC[-28] -> 21.449207000000001 | AM23: =RC[-28] -> 9.4574049999999996 | AN23: =RC[-28] -> 10.492743000000001 | AO23: =RC[-28] -> 67.002632000000006 | AP23: - | AQ23: =RC[-29] -> 2.7528779999999999 | AR23: =RC[-29] -> 65.576194999999998 | AS23: - | AT23: =RC[-30] -> 1.4264370000000071 | AU23: =RC[-30] -> 13.245621 | AV23: =RC[-30] -> 0.86644100000000002 | AW23: =RC[-30] -> 3.9738549999999999 | AY23: - | AZ23: - | BA23: -
A24: =IF(RC[1]="","",DATEVALUE(RC[1])) -> 43376 | B24: 03.10.18 | C24: 24 | D24: 135.97073399999999 | E24: 67.404754999999994 | F24: 8.330667 | G24: 127.34112500000001 | H24: 45.982365000000001 | I24: 5.8216789999999996 | J24: =RC[-5]-RC[-2] -> 21.422389999999993 | K24: 8.7061689999999992 | L24: 9.3734660000000005 | M24: 67.128189000000006 | N24: 3.0081440000000002 | O24: 65.956879000000001 | P24: =IF(AND(ISNUMBER(RC[-3]),ISNUMBER(RC[-1])),RC[-3]-RC[-1],"-") -> 1.1713100000000054 | Q24: 12.38161 | R24: 0.811527 | S24: 4.549639 | T24: =(RC[-16]*RC[-15]-RC[-13]*RC[-12])/1000 -> 3.3096279231795434 | U24: 9.1826310000000007 | V24: 2.9488270000000001 | W24: =RC[-2]*RC[-10]/1000 -> 0.61641338928525913 | X24: =ABS((RC[-3]*RC[-11]-RC[-2]*RC[-9])/1000) -> 0.42191796365432604 | Y24: =(RC[-14]-RC[1])/RC[-18]*100 -> -2.6898529442079306 | Z24: =RC[-5]+RC[-4] -> 12.131458 | AC24: =VALUE(RC[-27]) -> 2018-10-03T00:00:00.000 | AD24: =IF(RC[21]=42,"*",IF(RC[21]=32,"",RC[21])) -> - | AE24: =RC[-28] -> 24 | AF24: =RC[-28] -> 135.97073399999999 | AG24: =RC[-28] -> 67.404754999999994 | AH24: =RC[-28] -> 8.330667 | AI24: =RC[-28] -> 127.34112500000001 | AJ24: =RC[-28] -> 45.982365000000001 | AK24: =RC[-28] -> 5.8216789999999996 | AL24: =RC[-28] -> 21.422389999999993 | AM24: =RC[-28] -> 8.7061689999999992 | AN24: =RC[-28] -> 9.3734660000000005 | AO24: =RC[-28] -> 67.128189000000006 | AP24: - | AQ24: =RC[-29] -> 3.0081440000000002 | AR24: =RC[-29] -> 65.956879000000001 | AS24: - | AT24: =RC[-30] -> 1.1713100000000054 | AU24: =RC[-30] -> 12.38161 | AV24: =RC[-30] -> 0.811527 | AW24: =RC[-30] -> 4.549639 | AY24: - | AZ24: - | BA24: -
A25: =IF(RC[1]="","",DATEVALUE(RC[1])) -> 43377 | B25: 04.10.18 | C25: 24 | D25: 135.62086500000001 | E25: 66.794669999999996 | F25: 8.3204799999999999 | G25: 126.80490899999999 | H25: 45.234962000000003 | I25: 5.8301429999999996 | J25: =RC[-5]-RC[-2] -> 21.559707999999993 | K25: 8.88002 | L25: 9.9839540000000007 | M25: 66.529976000000005 | N25: 2.7300559999999998 | O25: 65.132132999999996 | P25: =IF(AND(ISNUMBER(RC[-3]),ISNUMBER(RC[-1])),RC[-3]-RC[-1],"-") -> 1.3978430000000088 | Q25: 12.71401 | R25: 0.82594599999999996 | S25: 4.560937 | T25: =(RC[-16]*RC[-15]-RC[-13]*RC[-12])/1000 -> 3.3227356827610919 | U25: 9.7840030000000002 | V25: 2.6774420000000001 | W25: =RC[-2]*RC[-10]/1000 -> 0.65092948477392809 | X25: =ABS((RC[-3]*RC[-11]-RC[-2]*RC[-9])/1000) -> 0.476541976330142 | Y25: =(RC[-14]-RC[1])/RC[-18]*100 -> -2.8243583219637038 | Z25: =RC[-5]+RC[-4] -> 12.461445000000001 | AC25: =VALUE(RC[-27]) -> 2018-10-04T00:00:00.000 | AD25: =IF(RC[21]=42,"*",IF(RC[21]=32,"",RC[21])) -> - | AE25: =RC[-28] -> 24 | AF25: =RC[-28] -> 135.62086500000001 | AG25: =RC[-28] -> 66.794669999999996 | AH25: =RC[-28] -> 8.3204799999999999 | AI25: =RC[-28] -> 126.80490899999999 | AJ25: =RC[-28] -> 45.234962000000003 | AK25: =RC[-28] -> 5.8301429999999996 | AL25: =RC[-28] -> 21.559707999999993 | AM25: =RC[-28] -> 8.88002 | AN25: =RC[-28] -> 9.9839540000000007 | AO25: =RC[-28] -> 66.529976000000005 | AP25: - | AQ25: =RC[-29] -> 2.7300559999999998 | AR25: =RC[-29] -> 65.132132999999996 | AS25: - | AT25: =RC[-30] -> 1.3978430000000088 | AU25: =RC[-30] -> 12.71401 | AV25: =RC[-30] -> 0.82594599999999996 | AW25: =RC[-30] -> 4.560937 | AY25: - | AZ25: - | BA25: -
A26: =IF(RC[1]="","",DATEVALUE(RC[1])) -> 43378 | B26: 05.10.18 | C26: 24 | D26: 137.289154 | E26: 66.159285999999994 | F26: 8.3111250000000005 | G26: 129.134399 | H26: 44.754955000000002 | I26: 5.7259700000000002 | J26: =RC[-5]-RC[-2] -> 21.404330999999992 | K26: 8.1715599999999995 | L26: 9.0316890000000001 | M26: 65.915801999999999 | N26: 2.9710549999999998 | O26: 64.831688 | P26: =IF(AND(ISNUMBER(RC[-3]),ISNUMBER(RC[-1])),RC[-3]-RC[-1],"-") -> 1.0841139999999996 | Q26: 12.002744 | R26: 0.77313600000000005 | S26: 4.5334490000000001 | T26: =(RC[-16]*RC[-15]-RC[-13]*RC[-12])/1000 -> 3.3035481879869977 | U26: 8.8538610000000002 | V26: 2.9142779999999999 | W26: =RC[-2]*RC[-10]/1000 -> 0.58360934861152203 | X26: =ABS((RC[-3]*RC[-11]-RC[-2]*RC[-9])/1000) -> 0.39467178657025809 | Y26: =(RC[-14]-RC[1])/RC[-18]*100 -> -2.7851440265734309 | Z26: =RC[-5]+RC[-4] -> 11.768139 | AC26: =VALUE(RC[-27]) -> 2018-10-05T00:00:00.000 | AD26: =IF(RC[21]=42,"*",IF(RC[21]=32,"",RC[21])) -> - | AE26: =RC[-28] -> 24 | AF26: =RC[-28] -> 137.289154 | AG26: =RC[-28] -> 66.159285999999994 | AH26: =RC[-28] -> 8.3111250000000005 | AI26: =RC[-28] -> 129.134399 | AJ26: =RC[-28] -> 44.754955000000002 | AK26: =RC[-28] -> 5.7259700000000002 | AL26: =RC[-28] -> 21.404330999999992 | AM26: =RC[-28] -> 8.1715599999999995 | AN26: =RC[-28] -> 9.0316890000000001 | AO26: =RC[-28] -> 65.915801999999999 | AP26: - | AQ26: =RC[-29] -> 2.9710549999999998 | AR26: =RC[-29] -> 64.831688 | AS26: - | AT26: =RC[-30] -> 1.0841139999999996 | AU26: =RC[-30] -> 12.002744 | AV26: =RC[-30] -> 0.77313600000000005 | AW26: =RC[-30] -> 4.5334490000000001 | AY26: - | AZ26: - | BA26: -
A27: =IF(RC[1]="","",DATEVALUE(RC[1])) -> 43379 | B27: 06.10.18 | C27: 24 | D27: 136.192215 | E27: 66.816513 | F27: 8.3111789999999992 | G27: 126.58060500000001 | H27: 45.218814999999999 | I27: 5.8647159999999996 | J27: =RC[-5]-RC[-2] -> 21.597698000000001 | K27: 9.611618 | L27: 10.721355000000001 | M27: 66.668944999999994 | N27: 2.7052659999999999 | O27: 65.323227000000003 | P27: =IF(AND(ISNUMBER(RC[-3]),ISNUMBER(RC[-1])),RC[-3]-RC[-1],"-") -> 1.3457179999999909 | Q27: 13.426621000000001 | R27: 0.87437100000000001 | S27: 3.9966499999999998 | T27: =(RC[-16]*RC[-15]-RC[-13]*RC[-12])/1000 -> 3.3760639439632194 | U27: 10.50581 | V27: 2.6528559999999999 | W27: =RC[-2]*RC[-10]/1000 -> 0.70041126907044993 | X27: =ABS((RC[-3]*RC[-11]-RC[-2]*RC[-9])/1000) -> 0.52711815438413789 | Y27: =(RC[-14]-RC[1])/RC[-18]*100 -> -2.8022049665507605 | Z27: =RC[-5]+RC[-4] -> 13.158666 | AC27: =VALUE(RC[-27]) -> 2018-10-06T00:00:00.000 | AD27: =IF(RC[21]=42,"*",IF(RC[21]=32,"",RC[21])) -> - | AE27: =RC[-28] -> 24 | AF27: =RC[-28] -> 136.192215 | AG27: =RC[-28] -> 66.816513 | AH27: =RC[-28] -> 8.3111789999999992 | AI27: =RC[-28] -> 126.58060500000001 | AJ27: =RC[-28] -> 45.218814999999999 | AK27: =RC[-28] -> 5.8647159999999996 | AL27: =RC[-28] -> 21.597698000000001 | AM27: =RC[-28] -> 9.611618 | AN27: =RC[-28] -> 10.721355000000001 | AO27: =RC[-28] -> 66.668944999999994 | AP27: - | AQ27: =RC[-29] -> 2.7052659999999999 | AR27: =RC[-29] -> 65.323227000000003 | AS27: - | AT27: =RC[-30] -> 1.3457179999999909 | AU27: =RC[-30] -> 13.426621000000001 | AV27: =RC[-30] -> 0.87437100000000001 | AW27: =RC[-30] -> 3.9966499999999998 | AY27: - | AZ27: - | BA27: -
A28: =IF(RC[1]="","",DATEVALUE(RC[1])) -> 43380 | B28: 07.10.18 | C28: 24 | D28: 138.017639 | E28: 67.078911000000005 | F28: 8.2953200000000002 | G28: 127.644249 | H28: 45.532241999999997 | I28: 5.8377629999999998 | J28: =RC[-5]-RC[-2] -> 21.546669000000009 | K28: 10.489903 | L28: 10.946887 | M28: 66.869140999999999 | N28: 3.212755 | O28: 65.873199 | P28: =IF(AND(ISNUMBER(RC[-3]),ISNUMBER(RC[-1])),RC[-3]-RC[-1],"-") -> 0.99594199999999944 | Q28: 14.159642 | R28: 0.92539000000000005 | S28: 4.6819309999999996 | T28: =(RC[-16]*RC[-15]-RC[-13]*RC[-12])/1000 -> 3.4461440875348717 | U28: 10.7256 | V28: 3.1495549999999999 | W28: =RC[-2]*RC[-10]/1000 -> 0.71721165870960002 | X28: =ABS((RC[-3]*RC[-11]-RC[-2]*RC[-9])/1000) -> 0.50974039543315497 | Y28: =(RC[-14]-RC[1])/RC[-18]*100 -> -2.65209911650622 | Z28: =RC[-5]+RC[-4] -> 13.875154999999999 | AC28: =VALUE(RC[-27]) -> 2018-10-07T00:00:00.000 | AD28: =IF(RC[21]=42,"*",IF(RC[21]=32,"",RC[21])) -> - | AE28: =RC[-28] -> 24 | AF28: =RC[-28] -> 138.017639 | AG28: =RC[-28] -> 67.078911000000005 | AH28: =RC[-28] -> 8.2953200000000002 | AI28: =RC[-28] -> 127.644249 | AJ28: =RC[-28] -> 45.532241999999997 | AK28: =RC[-28] -> 5.8377629999999998 | AL28: =RC[-28] -> 21.546669000000009 | AM28: =RC[-28] -> 10.489903 | AN28: =RC[-28] -> 10.946887 | AO28: =RC[-28] -> 66.869140999999999 | AP28: - | AQ28: =RC[-29] -> 3.212755 | AR28: =RC[-29] -> 65.873199 | AS28: - | AT28: =RC[-30] -> 0.99594199999999944 | AU28: =RC[-30] -> 14.159642 | AV28: =RC[-30] -> 0.92539000000000005 | AW28: =RC[-30] -> 4.6819309999999996 | AY28: - | AZ28: - | BA28: -
A29: =IF(RC[1]="","",DATEVALUE(RC[1])) -> 43381 | B29: 08.10.18 | C29: 24 | D29: 138.95057700000001 | E29: 67.051749999999998 | F29: 8.2904769999999992 | G29: 129.43557699999999 | H29: 45.272830999999996 | I29: 5.7499450000000003 | J29: =RC[-5]-RC[-2] -> 21.778919000000002 | K29: 9.5531900000000007 | L29: 10.168555 | M29: 66.817672999999999 | N29: 3.2725209999999998 | O29: 65.656761000000003 | P29: =IF(AND(ISNUMBER(RC[-3]),ISNUMBER(RC[-1])),RC[-3]-RC[-1],"-") -> 1.1609119999999962 | Q29: 13.441076000000001 | R29: 0.87705599999999995 | S29: 4.0742729999999998 | T29: =(RC[-16]*RC[-15]-RC[-13]*RC[-12])/1000 -> 3.4569643484512635 | U29: 9.9632889999999996 | V29: 3.2085360000000001 | W29: =RC[-2]*RC[-10]/1000 -> 0.66572378640649699 | X29: =ABS((RC[-3]*RC[-11]-RC[-2]*RC[-9])/1000) -> 0.45506170509460092 | Y29: =(RC[-14]-RC[1])/RC[-18]*100 -> -2.7957035336582918 | Z29: =RC[-5]+RC[-4] -> 13.171825 | AC29: =VALUE(RC[-27]) -> 2018-10-08T00:00:00.000 | AD29: =IF(RC[21]=42,"*",IF(RC[21]=32,"",RC[21])) -> - | AE29: =RC[-28] -> 24 | AF29: =RC[-28] -> 138.95057700000001 | AG29: =RC[-28] -> 67.051749999999998 | AH29: =RC[-28] -> 8.2904769999999992 | AI29: =RC[-28] -> 129.43557699999999 | AJ29: =RC[-28] -> 45.272830999999996 | AK29: =RC[-28] -> 5.7499450000000003 | AL29: =RC[-28] -> 21.778919000000002 | AM29: =RC[-28] -> 9.5531900000000007 | AN29: =RC[-28] -> 10.168555 | AO29: =RC[-28] -> 66.817672999999999 | AP29: - | AQ29: =RC[-29] -> 3.2725209999999998 | AR29: =RC[-29] -> 65.656761000000003 | AS29: - | AT29: =RC[-30] -> 1.1609119999999962 | AU29: =RC[-30] -> 13.441076000000001 | AV29: =RC[-30] -> 0.87705599999999995 | AW29: =RC[-30] -> 4.0742729999999998 | AY29: - | AZ29: - | BA29: -
A30: =IF(RC[1]="","",DATEVALUE(RC[1])) -> 43382 | B30: 09.10.18 | C30: 24 | D30: 137.48370399999999 | E30: 66.917823999999996 | F30: 8.3003199999999993 | G30: 128.39588900000001 | H30: 45.497604000000003 | I30: 5.7943930000000003 | J30: =RC[-5]-RC[-2] -> 21.420219999999993 | K30: 9.0878160000000001 | L30: 10.127333 | M30: 66.878119999999996 | N30: 2.7928440000000001 | O30: 65.503349 | P30: =IF(AND(ISNUMBER(RC[-3]),ISNUMBER(RC[-1])),RC[-3]-RC[-1],"-") -> 1.3747709999999955 | Q30: 12.920177000000001 | R30: 0.84361200000000003 | S30: 5.2055170000000004 | T30: =(RC[-16]*RC[-15]-RC[-13]*RC[-12])/1000 -> 3.3584049941901366 | U30: 9.922523 | V30: 2.7384520000000001 | W30: =RC[-2]*RC[-10]/1000 -> 0.66359968389675994 | X30: =ABS((RC[-3]*RC[-11]-RC[-2]*RC[-9])/1000) -> 0.48422190682101202 | Y30: =(RC[-14]-RC[1])/RC[-18]*100 -> -2.782923213374846 | Z30: =RC[-5]+RC[-4] -> 12.660975000000001 | AC30: =VALUE(RC[-27]) -> 2018-10-09T00:00:00.000 | AD30: =IF(RC[21]=42,"*",IF(RC[21]=32,"",RC[21])) -> - | AE30: =RC[-28] -> 24 | AF30: =RC[-28] -> 137.48370399999999 | AG30: =RC[-28] -> 66.917823999999996 | AH30: =RC[-28] -> 8.3003199999999993 | AI30: =RC[-28] -> 128.39588900000001 | AJ30: =RC[-28] -> 45.497604000000003 | AK30: =RC[-28] -> 5.7943930000000003 | AL30: =RC[-28] -> 21.420219999999993 | AM30: =RC[-28] -> 9.0878160000000001 | AN30: =RC[-28] -> 10.127333 | AO30: =RC[-28] -> 66.878119999999996 | AP30: - | AQ30: =RC[-29] -> 2.7928440000000001 | AR30: =RC[-29] -> 65.503349 | AS30: - | AT30: =RC[-30] -> 1.3747709999999955 | AU30: =RC[-30] -> 12.920177000000001 | AV30: =RC[-30] -> 0.84361200000000003 | AW30: =RC[-30] -> 5.2055170000000004 | AY30: - | AZ30: - | BA30: -
A31: =IF(RC[1]="","",DATEVALUE(RC[1])) -> 43383 | B31: 10.10.18 | C31: 24 | D31: 135.12056000000001 | E31: 67.929657000000006 | F31: 8.3105930000000008 | G31: 126.7453 | H31: 46.314326999999999 | I31: 5.875515 | J31: =RC[-5]-RC[-2] -> 21.615330000000007 | K31: 8.3954889999999995 | L31: 9.3374100000000002 | M31: 67.800522000000001 | N31: 2.7647659999999998 | O31: 66.592819000000006 | P31: =IF(AND(ISNUMBER(RC[-3]),ISNUMBER(RC[-1])),RC[-3]-RC[-1],"-") -> 1.2077029999999951 | Q31: 12.102176 | R31: 0.80098000000000003 | S31: 3.3161390000000002 | T31: =(RC[-16]*RC[-15]-RC[-13]*RC[-12])/1000 -> 3.3085700245348217 | U31: 9.1438059999999997 | V31: 2.7092749999999999 | W31: =RC[-2]*RC[-10]/1000 -> 0.61995481986673195 | X31: =ABS((RC[-3]*RC[-11]-RC[-2]*RC[-9])/1000) -> 0.43953656017050696 | Y31: =(RC[-14]-RC[1])/RC[-18]*100 -> -2.7279843907426939 | Z31: =RC[-5]+RC[-4] -> 11.853081 | AC31: =VALUE(RC[-27]) -> 2018-10-10T00:00:00.000 | AD31: =IF(RC[21]=42,"*",IF(RC[21]=32,"",RC[21])) -> - | AE31: =RC[-28] -> 24 | AF31: =RC[-28] -> 135.12056000000001 | AG31: =RC[-28] -> 67.929657000000006 | AH31: =RC[-28] -> 8.3105930000000008 | AI31: =RC[-28] -> 126.7453 | AJ31: =RC[-28] -> 46.314326999999999 | AK31: =RC[-28] -> 5.875515 | AL31: =RC[-28] -> 21.615330000000007 | AM31: =RC[-28] -> 8.3954889999999995 | AN31: =RC[-28] -> 9.3374100000000002 | AO31: =RC[-28] -> 67.800522000000001 | AP31: - | AQ31: =RC[-29] -> 2.7647659999999998 | AR31: =RC[-29] -> 66.592819000000006 | AS31: - | AT31: =RC[-30] -> 1.2077029999999951 | AU31: =RC[-30] -> 12.102176 | AV31: =RC[-30] -> 0.80098000000000003 | AW31: =RC[-30] -> 3.3161390000000002 | AY31: - | AZ31: - | BA31: -
A32: =IF(RC[1]="","",DATEVALUE(RC[1])) -> 43384 | B32: 11.10.18 | C32: 24 | D32: 137.6465 | E32: 69.036743000000001 | F32: 8.2894609999999993 | G32: 130.52058400000001 | H32: 47.212882999999998 | I32: 5.6931010000000004 | J32: =RC[-5]-RC[-2] -> 21.823860000000003 | K32: 7.1259100000000002 | L32: 8.2627769999999998 | M32: 68.730452999999997 | N32: 2.5085109999999999 | O32: 67.173614999999998 | P32: =IF(AND(ISNUMBER(RC[-3]),ISNUMBER(RC[-1])),RC[-3]-RC[-1],"-") -> 1.5568379999999991 | Q32: 10.771288 | R32: 0.72145000000000004 | S32: 4.561312 | T32: =(RC[-16]*RC[-15]-RC[-13]*RC[-12])/1000 -> 3.3404129838658281 | U32: 8.0871469999999999 | V32: 2.4573520000000002 | W32: =RC[-2]*RC[-10]/1000 -> 0.55583327678759098 | X32: =ABS((RC[-3]*RC[-11]-RC[-2]*RC[-9])/1000) -> 0.39076405962011096 | Y32: =(RC[-14]-RC[1])/RC[-18]*100 -> -2.6191952987277465 | Z32: =RC[-5]+RC[-4] -> 10.544499 | AC32: =VALUE(RC[-27]) -> 2018-10-11T00:00:00.000 | AD32: =IF(RC[21]=42,"*",IF(RC[21]=32,"",RC[21])) -> - | AE32: =RC[-28] -> 24 | AF32: =RC[-28] -> 137.6465 | AG32: =RC[-28] -> 69.036743000000001 | AH32: =RC[-28] -> 8.2894609999999993 | AI32: =RC[-28] -> 130.52058400000001 | AJ32: =RC[-28] -> 47.212882999999998 | AK32: =RC[-28] -> 5.6931010000000004 | AL32: =RC[-28] -> 21.823860000000003 | AM32: =RC[-28] -> 7.1259100000000002 | AN32: =RC[-28] -> 8.2627769999999998 | AO32: =RC[-28] -> 68.730452999999997 | AP32: - | AQ32: =RC[-29] -> 2.5085109999999999 | AR32: =RC[-29] -> 67.173614999999998 | AS32: - | AT32: =RC[-30] -> 1.5568379999999991 | AU32: =RC[-30] -> 10.771288 | AV32: =RC[-30] -> 0.72145000000000004 | AW32: =RC[-30] -> 4.561312 | AY32: - | AZ32: - | BA32: -
A33: =IF(RC[1]="","",DATEVALUE(RC[1])) -> 43385 | B33: 12.10.18 | C33: 24 | D33: 138.21798699999999 | E33: 68.896682999999996 | F33: 8.2915189999999992 | G33: 130.629379 | H33: 47.147263000000002 | I33: 5.6745380000000001 | J33: =RC[-5]-RC[-2] -> 21.749419999999994 | K33: 7.590986 | L33: 8.8539779999999997 | M33: 68.551811000000001 | N33: 2.5005109999999999 | O33: 67.134270000000001 | P33: =IF(AND(ISNUMBER(RC[-3]),ISNUMBER(RC[-1])),RC[-3]-RC[-1],"-") -> 1.4175409999999999 | Q33: 11.354488999999999 | R33: 0.75914099999999995 | S33: 4.5875959999999996 | T33: =(RC[-16]*RC[-15]-RC[-13]*RC[-12])/1000 -> 3.3639431479974435 | U33: 8.6666740000000004 | V33: 2.4495559999999998 | W33: =RC[-2]*RC[-10]/1000 -> 0.59411619804661409 | X33: =ABS((RC[-3]*RC[-11]-RC[-2]*RC[-9])/1000) -> 0.42966704416249407 | Y33: =(RC[-14]-RC[1])/RC[-18]*100 -> -2.6986609191489763 | Z33: =RC[-5]+RC[-4] -> 11.11623 | AC33: =VALUE(RC[-27]) -> 2018-10-12T00:00:00.000 | AD33: =IF(RC[21]=42,"*",IF(RC[21]=32,"",RC[21])) -> - | AE33: =RC[-28] -> 24 | AF33: =RC[-28] -> 138.21798699999999 | AG33: =RC[-28] -> 68.896682999999996 | AH33: =RC[-28] -> 8.2915189999999992 | AI33: =RC[-28] -> 130.629379 | AJ33: =RC[-28] -> 47.147263000000002 | AK33: =RC[-28] -> 5.6745380000000001 | AL33: =RC[-28] -> 21.749419999999994 | AM33: =RC[-28] -> 7.590986 | AN33: =RC[-28] -> 8.8539779999999997 | AO33: =RC[-28] -> 68.551811000000001 | AP33: - | AQ33: =RC[-29] -> 2.5005109999999999 | AR33: =RC[-29] -> 67.134270000000001 | AS33: - | AT33: =RC[-30] -> 1.4175409999999999 | AU33: =RC[-30] -> 11.354488999999999 | AV33: =RC[-30] -> 0.75914099999999995 | AW33: =RC[-30] -> 4.5875959999999996 | AY33: - | AZ33: - | BA33: -
A34: =IF(RC[1]="","",DATEVALUE(RC[1])) -> 43386 | B34: 13.10.18 | C34: 24 | D34: 139.32214400000001 | E34: 69.977744999999999 | F34: 8.2896979999999996 | G34: 130.820053 | H34: 48.294510000000002 | I34: 5.6419940000000004 | J34: =RC[-5]-RC[-2] -> 21.683234999999996 | K34: 8.5496850000000002 | L34: 9.8099419999999995 | M34: 69.735732999999996 | N34: 2.4785439999999999 | O34: 68.032073999999994 | P34: =IF(AND(ISNUMBER(RC[-3]),ISNUMBER(RC[-1])),RC[-3]-RC[-1],"-") -> 1.7036590000000018 | Q34: 12.288486000000001 | R34: 0.83490900000000001 | S34: 3.4416630000000001 | T34: =(RC[-16]*RC[-15]-RC[-13]*RC[-12])/1000 -> 3.4315591078762502 | U34: 9.5958400000000008 | V34: 2.4268010000000002 | W34: =RC[-2]*RC[-10]/1000 -> 0.66917293615072004 | X34: =ABS((RC[-3]*RC[-11]-RC[-2]*RC[-9])/1000) -> 0.50407263093544596 | Y34: =(RC[-14]-RC[1])/RC[-18]*100 -> -2.6547581355895034 | Z34: =RC[-5]+RC[-4] -> 12.022641 | AC34: =VALUE(RC[-27]) -> 2018-10-13T00:00:00.000 | AD34: =IF(RC[21]=42,"*",IF(RC[21]=32,"",RC[21])) -> - | AE34: =RC[-28] -> 24 | AF34: =RC[-28] -> 139.32214400000001 | AG34: =RC[-28] -> 69.977744999999999 | AH34: =RC[-28] -> 8.2896979999999996 | AI34: =RC[-28] -> 130.820053 | AJ34: =RC[-28] -> 48.294510000000002 | AK34: =RC[-28] -> 5.6419940000000004 | AL34: =RC[-28] -> 21.683234999999996 | AM34: =RC[-28] -> 8.5496850000000002 | AN34: =RC[-28] -> 9.8099419999999995 | AO34: =RC[-28] -> 69.735732999999996 | AP34: - | AQ34: =RC[-29] -> 2.4785439999999999 | AR34: =RC[-29] -> 68.032073999999994 | AS34: - | AT34: =RC[-30] -> 1.7036590000000018 | AU34: =RC[-30] -> 12.288486000000001 | AV34: =RC[-30] -> 0.83490900000000001 | AW34: =RC[-30] -> 3.4416630000000001 | AY34: - | AZ34: - | BA34: -
A35: =IF(RC[1]="","",DATEVALUE(RC[1])) -> 43387 | B35: 14.10.18 | C35: 24 | D35: 139.876755 | E35: 70.757683 | F35: 8.2813300000000005 | G35: 130.92825300000001 | H35: 49.580329999999996 | I35: 5.6139970000000003 | J35: =RC[-5]-RC[-2] -> 21.177353000000004 | K35: 9.0246150000000007 | L35: 9.376455 | M35: 70.556113999999994 | N35: 3.2410220000000001 | O35: 69.550606000000002 | P35: =IF(AND(ISNUMBER(RC[-3]),ISNUMBER(RC[-1])),RC[-3]-RC[-1],"-") -> 1.0055079999999919 | Q35: 12.617476999999999 | R35: 0.86799499999999996 | S35: 4.0279179999999997 | T35: =(RC[-16]*RC[-15]-RC[-13]*RC[-12])/1000 -> 3.4058890992951758 | U35: 9.167408 | V35: 3.1705960000000002 | W35: =RC[-2]*RC[-10]/1000 -> 0.64681668393251202 | X35: =ABS((RC[-3]*RC[-11]-RC[-2]*RC[-9])/1000) -> 0.42629981075133594 | Y35: =(RC[-14]-RC[1])/RC[-18]*100 -> -2.5306906065568588 | Z35: =RC[-5]+RC[-4] -> 12.338004 | AC35: =VALUE(RC[-27]) -> 2018-10-14T00:00:00.000 | AD35: =IF(RC[21]=42,"*",IF(RC[21]=32,"",RC[21])) -> - | AE35: =RC[-28] -> 24 | AF35: =RC[-28] -> 139.876755 | AG35: =RC[-28] -> 70.757683 | AH35: =RC[-28] -> 8.2813300000000005 | AI35: =RC[-28] -> 130.92825300000001 | AJ35: =RC[-28] -> 49.580329999999996 | AK35: =RC[-28] -> 5.6139970000000003 | AL35: =RC[-28] -> 21.177353000000004 | AM35: =RC[-28] -> 9.0246150000000007 | AN35: =RC[-28] -> 9.376455 | AO35: =RC[-28] -> 70.556113999999994 | AP35: - | AQ35: =RC[-29] -> 3.2410220000000001 | AR35: =RC[-29] -> 69.550606000000002 | AS35: - | AT35: =RC[-30] -> 1.0055079999999919 | AU35: =RC[-30] -> 12.617476999999999 | AV35: =RC[-30] -> 0.86799499999999996 | AW35: =RC[-30] -> 4.0279179999999997 | AY35: - | AZ35: - | BA35: -
A36: =IF(RC[1]="","",DATEVALUE(RC[1])) -> 43388 | B36: 15.10.18 | C36: 24 | D36: 138.743439 | E36: 70.252128999999996 | F36: 8.2841210000000007 | G36: 130.95678699999999 | H36: 49.826110999999997 | I36: 5.6069849999999999 | J36: =RC[-5]-RC[-2] -> 20.426017999999999 | K36: 7.7866270000000002 | L36: 8.8526989999999994 | M36: 70.016716000000002 | N36: 2.4300890000000002 | O36: 68.507866000000007 | P36: =IF(AND(ISNUMBER(RC[-3]),ISNUMBER(RC[-1])),RC[-3]-RC[-1],"-") -> 1.5088499999999954 | Q36: 11.282788 | R36: 0.76975499999999997 | S36: 3.8452600000000001 | T36: =(RC[-16]*RC[-15]-RC[-13]*RC[-12])/1000 -> 3.2219545692662743 | U36: 8.658061 | V36: 2.3787159999999998 | W36: =RC[-2]*RC[-10]/1000 -> 0.60620899814767593 | X36: =ABS((RC[-3]*RC[-11]-RC[-2]*RC[-9])/1000) -> 0.44324824116762002 | Y36: =(RC[-14]-RC[1])/RC[-18]*100 -> -2.4818492225225417 | Z36: =RC[-5]+RC[-4] -> 11.036777000000001 | AC36: =VALUE(RC[-27]) -> 2018-10-15T00:00:00.000 | AD36: =IF(RC[21]=42,"*",IF(RC[21]=32,"",RC[21])) -> - | AE36: =RC[-28] -> 24 | AF36: =RC[-28] -> 138.743439 | AG36: =RC[-28] -> 70.252128999999996 | AH36: =RC[-28] -> 8.2841210000000007 | AI36: =RC[-28] -> 130.95678699999999 | AJ36: =RC[-28] -> 49.826110999999997 | AK36: =RC[-28] -> 5.6069849999999999 | AL36: =RC[-28] -> 20.426017999999999 | AM36: =RC[-28] -> 7.7866270000000002 | AN36: =RC[-28] -> 8.8526989999999994 | AO36: =RC[-28] -> 70.016716000000002 | AP36: - | AQ36: =RC[-29] -> 2.4300890000000002 | AR36: =RC[-29] -> 68.507866000000007 | AS36: - | AT36: =RC[-30] -> 1.5088499999999954 | AU36: =RC[-30] -> 11.282788 | AV36: =RC[-30] -> 0.76975499999999997 | AW36: =RC[-30] -> 3.8452600000000001 | AY36: - | AZ36: - | BA36: -
A37: =IF(RC[1]="","",DATEVALUE(RC[1])) -> 43389 | B37: 16.10.18 | C37: 24 | D37: 139.330399 | E37: 70.281318999999996 | F37: 8.2901690000000006 | G37: 130.96185299999999 | H37: 49.868972999999997 | I37: 5.635535 | J37: =RC[-5]-RC[-2] -> 20.412345999999999 | K37: 8.4896890000000003 | L37: 9.1667550000000002 | M37: 70.035942000000006 | N37: 2.7705660000000001 | O37: 68.644585000000006 | P37: =IF(AND(ISNUMBER(RC[-3]),ISNUMBER(RC[-1])),RC[-3]-RC[-1],"-") -> 1.3913569999999993 | Q37: 11.937321000000001 | R37: 0.81465100000000001 | S37: 3.8905020000000001 | T37: =(RC[-16]*RC[-15]-RC[-13]*RC[-12])/1000 -> 3.2613911072293122 | U37: 8.9651150000000008 | V37: 2.7117870000000002 | W37: =RC[-2]*RC[-10]/1000 -> 0.62788027416333014 | X37: =ABS((RC[-3]*RC[-11]-RC[-2]*RC[-9])/1000) -> 0.44173078093993506 | Y37: =(RC[-14]-RC[1])/RC[-18]*100 -> -2.4336957113763513 | Z37: =RC[-5]+RC[-4] -> 11.676902000000002 | AC37: =VALUE(RC[-27]) -> 2018-10-16T00:00:00.000 | AD37: =IF(RC[21]=42,"*",IF(RC[21]=32,"",RC[21])) -> - | AE37: =RC[-28] -> 24 | AF37: =RC[-28] -> 139.330399 | AG37: =RC[-28] -> 70.281318999999996 | AH37: =RC[-28] -> 8.2901690000000006 | AI37: =RC[-28] -> 130.96185299999999 | AJ37: =RC[-28] -> 49.868972999999997 | AK37: =RC[-28] -> 5.635535 | AL37: =RC[-28] -> 20.412345999999999 | AM37: =RC[-28] -> 8.4896890000000003 | AN37: =RC[-28] -> 9.1667550000000002 | AO37: =RC[-28] -> 70.035942000000006 | AP37: - | AQ37: =RC[-29] -> 2.7705660000000001 | AR37: =RC[-29] -> 68.644585000000006 | AS37: - | AT37: =RC[-30] -> 1.3913569999999993 | AU37: =RC[-30] -> 11.937321000000001 | AV37: =RC[-30] -> 0.81465100000000001 | AW37: =RC[-30] -> 3.8905020000000001 | AY37: - | AZ37: - | BA37: -
A38: =IF(RC[1]="","",DATEVALUE(RC[1])) -> 43390 | B38: 17.10.18 | C38: 24 | D38: 138.60855100000001 | E38: 70.483840999999998 | F38: 8.2937150000000006 | G38: 131.03829999999999 | H38: 50.116813999999998 | I38: 5.617502 | J38: =RC[-5]-RC[-2] -> 20.367027 | K38: 7.5769260000000003 | L38: 8.5177429999999994 | M38: 70.299721000000005 | N38: 2.6989109999999998 | O38: 68.946678000000006 | P38: =IF(AND(ISNUMBER(RC[-3]),ISNUMBER(RC[-1])),RC[-3]-RC[-1],"-") -> 1.3530429999999996 | Q38: 11.216654 | R38: 0.76821600000000001 | S38: 5.058497 | T38: =(RC[-16]*RC[-15]-RC[-13]*RC[-12])/1000 -> 3.2024409619481911 | U38: 8.3290839999999999 | V38: 2.641184 | W38: =RC[-2]*RC[-10]/1000 -> 0.58553228138556401 | X38: =ABS((RC[-3]*RC[-11]-RC[-2]*RC[-9])/1000) -> 0.40343141859881199 | Y38: =(RC[-14]-RC[1])/RC[-18]*100 -> -2.589580298279206 | Z38: =RC[-5]+RC[-4] -> 10.970268000000001 | AC38: =VALUE(RC[-27]) -> 2018-10-17T00:00:00.000 | AD38: =IF(RC[21]=42,"*",IF(RC[21]=32,"",RC[21])) -> - | AE38: =RC[-28] -> 24 | AF38: =RC[-28] -> 138.60855100000001 | AG38: =RC[-28] -> 70.483840999999998 | AH38: =RC[-28] -> 8.2937150000000006 | AI38: =RC[-28] -> 131.03829999999999 | AJ38: =RC[-28] -> 50.116813999999998 | AK38: =RC[-28] -> 5.617502 | AL38: =RC[-28] -> 20.367027 | AM38: =RC[-28] -> 7.5769260000000003 | AN38: =RC[-28] -> 8.5177429999999994 | AO38: =RC[-28] -> 70.299721000000005 | AP38: - | AQ38: =RC[-29] -> 2.6989109999999998 | AR38: =RC[-29] -> 68.946678000000006 | AS38: - | AT38: =RC[-30] -> 1.3530429999999996 | AU38: =RC[-30] -> 11.216654 | AV38: =RC[-30] -> 0.76821600000000001 | AW38: =RC[-30] -> 5.058497 | AY38: - | AZ38: - | BA38: -
A39: =IF(RC[1]="","",DATEVALUE(RC[1])) -> 43391 | B39: 18.10.18 | C39: 24 | D39: 138.97039799999999 | E39: 70.960609000000005 | F39: 8.2952049999999993 | G39: 131.22622699999999 | H39: 50.420516999999997 | I39: 5.6190110000000004 | J39: 20.540092000000008 | K39: 7.7759349999999996 | L39: 8.726343 | M39: 70.790169000000006 | N39: 2.6202890000000001 | O39: 69.533173000000005 | P39: 1.2569960000000009 | Q39: 11.346632 | R39: 0.78271900000000005 | S39: 3.2546020000000002 | T39: 3.2449298657530243 | U39: 8.5306080000000009 | V39: 2.5633789999999999 | W39: 0.60388318199275215 | X39: 0.42564330652118521 | Y39: 1.37831136454148 | Z39: =RC[-5]+RC[-4] -> 11.093987 | AC39: =VALUE(RC[-27]) -> 2018-10-18T00:00:00.000 | AD39: =IF(RC[21]=42,"*",IF(RC[21]=32,"",RC[21])) ->  | AE39: =RC[-28] -> 24 | AF39: =RC[-28] -> 138.97039799999999 | AG39: =RC[-28] -> 70.960609000000005 | AH39: =RC[-28] -> 8.2952049999999993 | AI39: =RC[-28] -> 131.22622699999999 | AJ39: =RC[-28] -> 50.420516999999997 | AK39: =RC[-28] -> 5.6190110000000004 | AL39: =RC[-28] -> 20.540092000000008 | AM39: =RC[-28] -> 7.7759349999999996 | AN39: =RC[-28] -> 8.726343 | AO39: =RC[-28] -> 70.790169000000006 | AP39: - | AQ39: =RC[-29] -> 2.6202890000000001 | AR39: =RC[-29] -> 69.533173000000005 | AS39: - | AT39: =RC[-30] -> 1.2569960000000009 | AU39: =RC[-30] -> 11.346632 | AV39: =RC[-30] -> 0.78271900000000005 | AW39: =RC[-30] -> 3.2546020000000002
A40: =IF(RC[1]="","",DATEVALUE(RC[1])) -> 43392 | B40: 19.10.18 | C40: 24 | D40: 138.91810599999999 | E40: 70.748290999999995 | F40: 8.2995330000000003 | G40: 131.00769 | H40: 49.845469999999999 | I40: 5.6344260000000004 | J40: 20.902820999999996 | K40: 7.9104130000000001 | L40: 8.5204109999999993 | M40: 70.617981 | N40: 3.0450879999999998 | O40: 69.091660000000005 | P40: 1.5263209999999958 | Q40: 11.565499000000001 | R40: 0.79473400000000005 | S40: 4.5382600000000002 | T40: 3.2980787067925448 | U40: 8.3301359999999995 | V40: 2.9797129999999998 | W40: 0.58825738577541598 | X40: 0.38238406828183602 | Y40: 1.9540761309507861 | Z40: =RC[-5]+RC[-4] -> 11.309849 | AC40: =VALUE(RC[-27]) -> 2018-10-19T00:00:00.000 | AD40: =IF(RC[21]=42,"*",IF(RC[21]=32,"",RC[21])) ->  | AE40: =RC[-28] -> 24 | AF40: =RC[-28] -> 138.91810599999999 | AG40: =RC[-28] -> 70.748290999999995 | AH40: =RC[-28] -> 8.2995330000000003 | AI40: =RC[-28] -> 131.00769 | AJ40: =RC[-28] -> 49.845469999999999 | AK40: =RC[-28] -> 5.6344260000000004 | AL40: =RC[-28] -> 20.902820999999996 | AM40: =RC[-28] -> 7.9104130000000001 | AN40: =RC[-28] -> 8.5204109999999993 | AO40: =RC[-28] -> 70.617981 | AP40: - | AQ40: =RC[-29] -> 3.0450879999999998 | AR40: =RC[-29] -> 69.091660000000005 | AS40: - | AT40: =RC[-30] -> 1.5263209999999958 | AU40: =RC[-30] -> 11.565499000000001 | AV40: =RC[-30] -> 0.79473400000000005 | AW40: =RC[-30] -> 4.5382600000000002
A41: =IF(RC[1]="","",DATEVALUE(RC[1])) -> 43393 | B41: 20.10.18 | C41: 24 | D41: 140.400116 | E41: 70.083861999999996 | F41: 8.3058770000000006 | G41: 131.19667100000001 | H41: 49.013717999999997 | I41: 5.6185900000000002 | J41: 21.070143999999999 | K41: 9.2489410000000003 | L41: 9.7775540000000003 | M41: 69.916518999999994 | N41: 3.1406000000000001 | O41: 68.661109999999994 | P41: 1.2554090000000002 | Q41: 12.918153999999999 | R41: 0.88034400000000002 | S41: 4.0322950000000004 | T41: 3.4093457195952133 | U41: 9.5631179999999993 | V41: 3.0739369999999999 | W41: 0.66861992134624193 | X41: 0.45755999485617188 | Y41: 2.1035289835974571 | Z41: =RC[-5]+RC[-4] -> 12.637055 | AC41: =VALUE(RC[-27]) -> 2018-10-20T00:00:00.000 | AD41: =IF(RC[21]=42,"*",IF(RC[21]=32,"",RC[21])) ->  | AE41: =RC[-28] -> 24 | AF41: =RC[-28] -> 140.400116 | AG41: =RC[-28] -> 70.083861999999996 | AH41: =RC[-28] -> 8.3058770000000006 | AI41: =RC[-28] -> 131.19667100000001 | AJ41: =RC[-28] -> 49.013717999999997 | AK41: =RC[-28] -> 5.6185900000000002 | AL41: =RC[-28] -> 21.070143999999999 | AM41: =RC[-28] -> 9.2489410000000003 | AN41: =RC[-28] -> 9.7775540000000003 | AO41: =RC[-28] -> 69.916518999999994 | AP41: - | AQ41: =RC[-29] -> 3.1406000000000001 | AR41: =RC[-29] -> 68.661109999999994 | AS41: - | AT41: =RC[-30] -> 1.2554090000000002 | AU41: =RC[-30] -> 12.918153999999999 | AV41: =RC[-30] -> 0.88034400000000002 | AW41: =RC[-30] -> 4.0322950000000004
A42: =IF(RC[1]="","",DATEVALUE(RC[1])) -> 43394 | B42: 21.10.18 | C42: 24 | D42: 141.21545399999999 | E42: 69.195366000000007 | F42: 8.2989460000000008 | G42: 131.03338600000001 | H42: 48.406174 | I42: 6.0263499999999999 | J42: 20.789192000000007 | K42: 10.262589999999999 | L42: 10.869554000000001 | M42: 68.984275999999994 | N42: 3.1457999999999999 | O42: 67.749870000000001 | P42: 1.2344059999999928 | Q42: 14.015354 | R42: 0.94321299999999997 | S42: 4.6655329999999999 | T42: 3.4286301418610008 | U42: 10.636952000000001 | V42: 3.0806429999999998 | W42: 0.73378243256675202 | X42: 0.52506926980034196 | Y42: 2.0653369973969835 | Z42: =RC[-5]+RC[-4] -> 13.717595000000001 | AC42: =VALUE(RC[-27]) -> 2018-10-21T00:00:00.000 | AD42: =IF(RC[21]=42,"*",IF(RC[21]=32,"",RC[21])) ->  | AE42: =RC[-28] -> 24 | AF42: =RC[-28] -> 141.21545399999999 | AG42: =RC[-28] -> 69.195366000000007 | AH42: =RC[-28] -> 8.2989460000000008 | AI42: =RC[-28] -> 131.03338600000001 | AJ42: =RC[-28] -> 48.406174 | AK42: =RC[-28] -> 6.0263499999999999 | AL42: =RC[-28] -> 20.789192000000007 | AM42: =RC[-28] -> 10.262589999999999 | AN42: =RC[-28] -> 10.869554000000001 | AO42: =RC[-28] -> 68.984275999999994 | AP42: - | AQ42: =RC[-29] -> 3.1457999999999999 | AR42: =RC[-29] -> 67.749870000000001 | AS42: - | AT42: =RC[-30] -> 1.2344059999999928 | AU42: =RC[-30] -> 14.015354 | AV42: =RC[-30] -> 0.94321299999999997 | AW42: =RC[-30] -> 4.6655329999999999
A43: =IF(RC[1]="","",DATEVALUE(RC[1])) -> 43395 | B43: 22.10.18 | C43: 24 | D43: 139.29184000000001 | E43: 69.683075000000002 | F43: 8.3023779999999991 | G43: 130.98292499999999 | H43: 48.513610999999997 | I43: 6.3102280000000004 | J43: 21.169464000000005 | K43: 8.405322 | L43: 9.2919450000000001 | M43: 69.605430999999996 | N43: 2.8372660000000001 | O43: 68.342742999999999 | P43: 1.2626879999999971 | Q43: 12.129211 | R43: 0.82314399999999999 | S43: 3.9776570000000002 | T43: 3.3518290625158271 | U43: 9.0898059999999994 | V43: 2.7775370000000001 | W43: 0.63269986433638592 | X43: 0.44287536697239488 | Y43: 1.5979586652229674 | Z43: =RC[-5]+RC[-4] -> 11.867343 | AC43: =VALUE(RC[-27]) -> 2018-10-22T00:00:00.000 | AD43: =IF(RC[21]=42,"*",IF(RC[21]=32,"",RC[21])) ->  | AE43: =RC[-28] -> 24 | AF43: =RC[-28] -> 139.29184000000001 | AG43: =RC[-28] -> 69.683075000000002 | AH43: =RC[-28] -> 8.3023779999999991 | AI43: =RC[-28] -> 130.98292499999999 | AJ43: =RC[-28] -> 48.513610999999997 | AK43: =RC[-28] -> 6.3102280000000004 | AL43: =RC[-28] -> 21.169464000000005 | AM43: =RC[-28] -> 8.405322 | AN43: =RC[-28] -> 9.2919450000000001 | AO43: =RC[-28] -> 69.605430999999996 | AP43: - | AQ43: =RC[-29] -> 2.8372660000000001 | AR43: =RC[-29] -> 68.342742999999999 | AS43: - | AT43: =RC[-30] -> 1.2626879999999971 | AU43: =RC[-30] -> 12.129211 | AV43: =RC[-30] -> 0.82314399999999999 | AW43: =RC[-30] -> 3.9776570000000002
A44: =IF(RC[1]="","",DATEVALUE(RC[1])) ->  | C44: 24 | J44: =RC[-5]-RC[-2] -> #VALUE! | P44: =IF(AND(ISNUMBER(RC[-3]),ISNUMBER(RC[-1])),RC[-3]-RC[-1],"-") -> - | T44: =(RC[-16]*RC[-15]-RC[-13]*RC[-12])/1000 -> #VALUE! | W44: =RC[-2]*RC[-10]/1000 -> #VALUE! | X44: =ABS((RC[-3]*RC[-11]-RC[-2]*RC[-9])/1000) -> #VALUE! | Y44: =(RC[-14]-RC[1])/RC[-18]*100 -> #VALUE! | Z44: =RC[-5]+RC[-4] -> #VALUE! | AC44: =VALUE(RC[-27]) -> #VALUE! | AD44: =IF(RC[21]=42,"*",IF(RC[21]=32,"",RC[21])) ->  | AE44: =RC[-28] -> 24 | AF44: =RC[-28] ->  | AG44: =RC[-28] ->  | AH44: =RC[-28] ->  | AI44: =RC[-28] ->  | AJ44: =RC[-28] ->  | AK44: =RC[-28] ->  | AL44: =RC[-28] -> #VALUE! | AM44: =RC[-28] ->  | AN44: =RC[-28] ->  | AO44: =RC[-28] ->  | AP44: - | AQ44: =RC[-29] ->  | AR44: =RC[-29] ->  | AS44: - | AT44: =RC[-30] -> - | AU44: =RC[-30] ->  | AV44: =RC[-30] ->  | AW44: =RC[-30] -> 
A45: =IF(RC[1]="","",DATEVALUE(RC[1])) ->  | C45: 24 | P45: =IF(AND(ISNUMBER(RC[-3]),ISNUMBER(RC[-1])),RC[-3]-RC[-1],"-") -> - | T45: =(RC[-16]*RC[-15]-RC[-13]*RC[-12])/1000 -> #VALUE! | W45: =RC[-2]*RC[-10]/1000 -> #VALUE! | X45: =ABS((RC[-3]*RC[-11]-RC[-2]*RC[-9])/1000) -> #VALUE! | Y45: =(RC[-14]-RC[1])/RC[-18]*100 -> #VALUE! | Z45: =RC[-5]+RC[-4] -> #VALUE! | AC45: =VALUE(RC[-27]) -> #VALUE! | AD45: =IF(RC[21]=42,"*",IF(RC[21]=32,"",RC[21])) ->  | AE45: =RC[-28] -> 24 | AF45: =RC[-28] ->  | AG45: =RC[-28] ->  | AH45: =RC[-28] ->  | AI45: =RC[-28] ->  | AJ45: =RC[-28] ->  | AK45: =RC[-28] ->  | AL45: =RC[-28] -> 0 | AM45: =RC[-28] ->  | AN45: =RC[-28] ->  | AO45: =RC[-28] ->  | AP45: - | AQ45: =RC[-29] ->  | AR45: =RC[-29] ->  | AS45: - | AT45: =RC[-30] -> - | AU45: =RC[-30] ->  | AV45: =RC[-30] ->  | AW45: =RC[-30] -> 
A46: =IF(RC[1]="","",DATEVALUE(RC[1])) ->  | C46: 24 | P46: =IF(AND(ISNUMBER(RC[-3]),ISNUMBER(RC[-1])),RC[-3]-RC[-1],"-") -> - | T46: =(RC[-16]*RC[-15]-RC[-13]*RC[-12])/1000 -> #VALUE! | W46: =RC[-2]*RC[-10]/1000 -> #VALUE! | X46: =ABS((RC[-3]*RC[-11]-RC[-2]*RC[-9])/1000) -> #VALUE! | Y46: =(RC[-14]-RC[1])/RC[-18]*100 -> #VALUE! | Z46: =RC[-5]+RC[-4] -> #VALUE! | AC46: =VALUE(RC[-27]) -> #VALUE! | AD46: =IF(RC[21]=42,"*",IF(RC[21]=32,"",RC[21])) ->  | AE46: =RC[-28] -> 24 | AF46: =RC[-28] ->  | AG46: =RC[-28] ->  | AH46: =RC[-28] ->  | AI46: =RC[-28] ->  | AJ46: =RC[-28] ->  | AK46: =RC[-28] ->  | AL46: =RC[-28] -> 0 | AM46: =RC[-28] ->  | AN46: =RC[-28] ->  | AO46: =RC[-28] ->  | AP46: - | AQ46: =RC[-29] ->  | AR46: =RC[-29] ->  | AS46: - | AT46: =RC[-30] -> - | AU46: =RC[-30] ->  | AV46: =RC[-30] ->  | AW46: =RC[-30] -> 
A47: =IF(RC[1]="","",DATEVALUE(RC[1])) ->  | C47: 24 | P47: =IF(AND(ISNUMBER(RC[-3]),ISNUMBER(RC[-1])),RC[-3]-RC[-1],"-") -> - | T47: =(RC[-16]*RC[-15]-RC[-13]*RC[-12])/1000 -> #VALUE! | W47: =RC[-2]*RC[-10]/1000 -> #VALUE! | X47: =ABS((RC[-3]*RC[-11]-RC[-2]*RC[-9])/1000) -> #VALUE! | Y47: =(RC[-14]-RC[1])/RC[-18]*100 -> #VALUE! | Z47: =RC[-5]+RC[-4] -> #VALUE! | AC47: =VALUE(RC[-27]) -> #VALUE! | AD47: =IF(RC[21]=42,"*",IF(RC[21]=32,"",RC[21])) ->  | AE47: =RC[-28] -> 24 | AF47: =RC[-28] ->  | AG47: =RC[-28] ->  | AH47: =RC[-28] ->  | AI47: =RC[-28] ->  | AJ47: =RC[-28] ->  | AK47: =RC[-28] ->  | AL47: =RC[-28] -> 0 | AM47: =RC[-28] ->  | AN47: =RC[-28] ->  | AO47: =RC[-28] ->  | AP47: - | AQ47: =RC[-29] ->  | AR47: =RC[-29] ->  | AS47: - | AT47: =RC[-30] -> - | AU47: =RC[-30] ->  | AV47: =RC[-30] ->  | AW47: =RC[-30] -> 
A48: =IF(RC[1]="","",DATEVALUE(RC[1])) ->  | C48: 24 | P48: =IF(AND(ISNUMBER(RC[-3]),ISNUMBER(RC[-1])),RC[-3]-RC[-1],"-") -> - | T48: =(RC[-16]*RC[-15]-RC[-13]*RC[-12])/1000 -> #VALUE! | W48: =RC[-2]*RC[-10]/1000 -> #VALUE! | X48: =ABS((RC[-3]*RC[-11]-RC[-2]*RC[-9])/1000) -> #VALUE! | Y48: =(RC[-14]-RC[1])/RC[-18]*100 -> #VALUE! | Z48: =RC[-5]+RC[-4] -> #VALUE! | AC48: =VALUE(RC[-27]) -> #VALUE! | AD48: =IF(RC[21]=42,"*",IF(RC[21]=32,"",RC[21])) ->  | AE48: =RC[-28] -> 24 | AF48: =RC[-28] ->  | AG48: =RC[-28] ->  | AH48: =RC[-28] ->  | AI48: =RC[-28] ->  | AJ48: =RC[-28] ->  | AK48: =RC[-28] ->  | AL48: =RC[-28] -> 0 | AM48: =RC[-28] ->  | AN48: =RC[-28] ->  | AO48: =RC[-28] ->  | AP48: - | AQ48: =RC[-29] ->  | AR48: =RC[-29] ->  | AS48: - | AT48: =RC[-30] -> - | AU48: =RC[-30] ->  | AV48: =RC[-30] ->  | AW48: =RC[-30] -> 
A49: =IF(RC[1]="","",DATEVALUE(RC[1])) ->  | C49: 24 | P49: =IF(AND(ISNUMBER(RC[-3]),ISNUMBER(RC[-1])),RC[-3]-RC[-1],"-") -> - | T49: =(RC[-16]*RC[-15]-RC[-13]*RC[-12])/1000 -> #VALUE! | W49: =RC[-2]*RC[-10]/1000 -> #VALUE! | X49: =ABS((RC[-3]*RC[-11]-RC[-2]*RC[-9])/1000) -> #VALUE! | Y49: =(RC[-14]-RC[1])/RC[-18]*100 -> #VALUE! | Z49: =RC[-5]+RC[-4] -> #VALUE! | AC49: =VALUE(RC[-27]) -> #VALUE! | AD49: =IF(RC[21]=42,"*",IF(RC[21]=32,"",RC[21])) ->  | AE49: =RC[-28] -> 24 | AF49: =RC[-28] ->  | AG49: =RC[-28] ->  | AH49: =RC[-28] ->  | AI49: =RC[-28] ->  | AJ49: =RC[-28] ->  | AK49: =RC[-28] ->  | AL49: =RC[-28] -> 0 | AM49: =RC[-28] ->  | AN49: =RC[-28] ->  | AO49: =RC[-28] ->  | AP49: - | AQ49: =RC[-29] ->  | AR49: =RC[-29] ->  | AS49: - | AT49: =RC[-30] -> - | AU49: =RC[-30] ->  | AV49: =RC[-30] ->  | AW49: =RC[-30] -> 
A50: =IF(RC[1]="","",DATEVALUE(RC[1])) ->  | P50: =IF(AND(ISNUMBER(RC[-3]),ISNUMBER(RC[-1])),RC[-3]-RC[-1],"-") -> - | T50: =(RC[-16]*RC[-15]-RC[-13]*RC[-12])/1000 -> #VALUE! | W50: =RC[-2]*RC[-10]/1000 -> #VALUE! | X50: =ABS((RC[-3]*RC[-11]-RC[-2]*RC[-9])/1000) -> #VALUE! | Y50: =(RC[-14]-RC[1])/RC[-18]*100 -> #VALUE! | Z50: =RC[-5]+RC[-4] -> #VALUE! | AC50: =VALUE(RC[-27]) -> #VALUE! | AD50: =IF(RC[21]=42,"*",IF(RC[21]=32,"",RC[21])) ->  | AE50: =RC[-28] ->  | AF50: =RC[-28] ->  | AG50: =RC[-28] ->  | AH50: =RC[-28] ->  | AI50: =RC[-28] ->  | AJ50: =RC[-28] ->  | AK50: =RC[-28] ->  | AL50: =RC[-28] -> 0 | AM50: =RC[-28] ->  | AN50: =RC[-28] ->  | AO50: =RC[-28] ->  | AP50: - | AQ50: =RC[-29] ->  | AR50: =RC[-29] ->  | AS50: - | AT50: =RC[-30] -> - | AU50: =RC[-30] ->  | AV50: =RC[-30] ->  | AW50: =RC[-30] -> 
A51: =IF(RC[1]="","",DATEVALUE(RC[1])) ->  | P51: =IF(AND(ISNUMBER(RC[-3]),ISNUMBER(RC[-1])),RC[-3]-RC[-1],"-") -> - | T51: =(RC[-16]*RC[-15]-RC[-13]*RC[-12])/1000 -> #VALUE! | W51: =RC[-2]*RC[-10]/1000 -> #VALUE! | X51: =ABS((RC[-3]*RC[-11]-RC[-2]*RC[-9])/1000) -> #VALUE! | Y51: =(RC[-14]-RC[1])/RC[-18]*100 -> #VALUE! | Z51: =RC[-5]+RC[-4] -> #VALUE! | AC51: =VALUE(RC[-27]) -> #VALUE! | AD51: =IF(RC[21]=42,"*",IF(RC[21]=32,"",RC[21])) ->  | AE51: =RC[-28] ->  | AF51: =RC[-28] ->  | AG51: =RC[-28] ->  | AH51: =RC[-28] ->  | AI51: =RC[-28] ->  | AJ51: =RC[-28] ->  | AK51: =RC[-28] ->  | AL51: =RC[-28] -> 0 | AM51: =RC[-28] ->  | AN51: =RC[-28] ->  | AO51: =RC[-28] ->  | AP51: - | AQ51: =RC[-29] ->  | AR51: =RC[-29] ->  | AS51: - | AT51: =RC[-30] -> - | AU51: =RC[-30] ->  | AV51: =RC[-30] ->  | AW51: =RC[-30] -> 
A52: =IF(RC[1]="","",DATEVALUE(RC[1])) ->  | P52: =IF(AND(ISNUMBER(RC[-3]),ISNUMBER(RC[-1])),RC[-3]-RC[-1],"-") -> - | T52: =(RC[-16]*RC[-15]-RC[-13]*RC[-12])/1000 -> #VALUE! | W52: =RC[-2]*RC[-10]/1000 -> #VALUE! | X52: =ABS((RC[-3]*RC[-11]-RC[-2]*RC[-9])/1000) -> #VALUE! | Y52: =(RC[-14]-RC[1])/RC[-18]*100 -> #VALUE! | Z52: =RC[-5]+RC[-4] -> #VALUE! | AC52: =VALUE(RC[-27]) -> #VALUE! | AD52: =IF(RC[21]=42,"*",IF(RC[21]=32,"",RC[21])) ->  | AE52: =RC[-28] ->  | AF52: =RC[-28] ->  | AG52: =RC[-28] ->  | AH52: =RC[-28] ->  | AI52: =RC[-28] ->  | AJ52: =RC[-28] ->  | AK52: =RC[-28] ->  | AL52: =RC[-28] -> 0 | AM52: =RC[-28] ->  | AN52: =RC[-28] ->  | AO52: =RC[-28] ->  | AP52: - | AQ52: =RC[-29] ->  | AR52: =RC[-29] ->  | AS52: - | AT52: =RC[-30] -> - | AU52: =RC[-30] ->  | AV52: =RC[-30] ->  | AW52: =RC[-30] -> 
A53: =IF(RC[1]="","",DATEVALUE(RC[1])) ->  | P53: =IF(AND(ISNUMBER(RC[-3]),ISNUMBER(RC[-1])),RC[-3]-RC[-1],"-") -> - | T53: =(RC[-16]*RC[-15]-RC[-13]*RC[-12])/1000 -> #VALUE! | W53: =RC[-2]*RC[-10]/1000 -> #VALUE! | X53: =ABS((RC[-3]*RC[-11]-RC[-2]*RC[-9])/1000) -> #VALUE! | Y53: =(RC[-14]-RC[1])/RC[-18]*100 -> #VALUE! | Z53: =RC[-5]+RC[-4] -> #VALUE! | AC53: =VALUE(RC[-27]) -> #VALUE! | AD53: =IF(RC[21]=42,"*",IF(RC[21]=32,"",RC[21])) ->  | AE53: =RC[-28] ->  | AF53: =RC[-28] ->  | AG53: =RC[-28] ->  | AH53: =RC[-28] ->  | AI53: =RC[-28] ->  | AJ53: =RC[-28] ->  | AK53: =RC[-28] ->  | AL53: =RC[-28] -> 0 | AM53: =RC[-28] ->  | AN53: =RC[-28] ->  | AO53: =RC[-28] ->  | AP53: - | AQ53: =RC[-29] ->  | AR53: =RC[-29] ->  | AS53: - | AT53: =RC[-30] -> - | AU53: =RC[-30] ->  | AV53: =RC[-30] ->  | AW53: =RC[-30] -> 
A54: =IF(RC[1]="","",DATEVALUE(RC[1])) ->  | P54: =IF(AND(ISNUMBER(RC[-3]),ISNUMBER(RC[-1])),RC[-3]-RC[-1],"-") -> - | T54: =(RC[-16]*RC[-15]-RC[-13]*RC[-12])/1000 -> #VALUE! | W54: =RC[-2]*RC[-10]/1000 -> #VALUE! | X54: =ABS((RC[-3]*RC[-11]-RC[-2]*RC[-9])/1000) -> #VALUE! | Y54: =(RC[-14]-RC[1])/RC[-18]*100 -> #VALUE! | Z54: =RC[-5]+RC[-4] -> #VALUE! | AC54: =VALUE(RC[-27]) -> #VALUE! | AD54: =IF(RC[21]=42,"*",IF(RC[21]=32,"",RC[21])) ->  | AE54: =RC[-28] ->  | AF54: =RC[-28] ->  | AG54: =RC[-28] ->  | AH54: =RC[-28] ->  | AI54: =RC[-28] ->  | AJ54: =RC[-28] ->  | AK54: =RC[-28] ->  | AL54: =RC[-28] -> 0 | AM54: =RC[-28] ->  | AN54: =RC[-28] ->  | AO54: =RC[-28] ->  | AP54: - | AQ54: =RC[-29] ->  | AR54: =RC[-29] ->  | AS54: - | AT54: =RC[-30] -> - | AU54: =RC[-30] ->  | AV54: =RC[-30] ->  | AW54: =RC[-30] -> 
A55: =IF(RC[1]="","",DATEVALUE(RC[1])) ->  | P55: =IF(AND(ISNUMBER(RC[-3]),ISNUMBER(RC[-1])),RC[-3]-RC[-1],"-") -> - | T55: =(RC[-16]*RC[-15]-RC[-13]*RC[-12])/1000 -> #VALUE! | W55: =RC[-2]*RC[-10]/1000 -> #VALUE! | X55: =ABS((RC[-3]*RC[-11]-RC[-2]*RC[-9])/1000) -> #VALUE! | Y55: =(RC[-14]-RC[1])/RC[-18]*100 -> #VALUE! | Z55: =RC[-5]+RC[-4] -> #VALUE! | AC55: =VALUE(RC[-27]) -> #VALUE! | AD55: =IF(RC[21]=42,"*",IF(RC[21]=32,"",RC[21])) ->  | AE55: =RC[-28] ->  | AF55: =RC[-28] ->  | AG55: =RC[-28] ->  | AH55: =RC[-28] ->  | AI55: =RC[-28] ->  | AJ55: =RC[-28] ->  | AK55: =RC[-28] ->  | AL55: =RC[-28] -> 0 | AM55: =RC[-28] ->  | AN55: =RC[-28] ->  | AO55: =RC[-28] ->  | AP55: - | AQ55: =RC[-29] ->  | AR55: =RC[-29] ->  | AS55: - | AT55: =RC[-30] -> - | AU55: =RC[-30] ->  | AV55: =RC[-30] ->  | AW55: =RC[-30] -> 
A56: =IF(RC[1]="","",DATEVALUE(RC[1])) ->  | P56: =IF(AND(ISNUMBER(RC[-3]),ISNUMBER(RC[-1])),RC[-3]-RC[-1],"-") -> - | T56: =(RC[-16]*RC[-15]-RC[-13]*RC[-12])/1000 -> #VALUE! | W56: =RC[-2]*RC[-10]/1000 -> #VALUE! | X56: =ABS((RC[-3]*RC[-11]-RC[-2]*RC[-9])/1000) -> #VALUE! | Y56: =(RC[-14]-RC[1])/RC[-18]*100 -> #VALUE! | Z56: =RC[-5]+RC[-4] -> #VALUE! | AC56: =VALUE(RC[-27]) -> #VALUE! | AD56: =IF(RC[21]=42,"*",IF(RC[21]=32,"",RC[21])) ->  | AE56: =RC[-28] ->  | AF56: =RC[-28] ->  | AG56: =RC[-28] ->  | AH56: =RC[-28] ->  | AI56: =RC[-28] ->  | AJ56: =RC[-28] ->  | AK56: =RC[-28] ->  | AL56: =RC[-28] -> 0 | AM56: =RC[-28] ->  | AN56: =RC[-28] ->  | AO56: =RC[-28] ->  | AP56: - | AQ56: =RC[-29] ->  | AR56: =RC[-29] ->  | AS56: - | AT56: =RC[-30] -> - | AU56: =RC[-30] ->  | AV56: =RC[-30] ->  | AW56: =RC[-30] -> 
A57: =IF(RC[1]="","",DATEVALUE(RC[1])) ->  | P57: =IF(AND(ISNUMBER(RC[-3]),ISNUMBER(RC[-1])),RC[-3]-RC[-1],"-") -> - | T57: =(RC[-16]*RC[-15]-RC[-13]*RC[-12])/1000 -> #VALUE! | W57: =RC[-2]*RC[-10]/1000 -> #VALUE! | X57: =ABS((RC[-3]*RC[-11]-RC[-2]*RC[-9])/1000) -> #VALUE! | Y57: =(RC[-14]-RC[1])/RC[-18]*100 -> #VALUE! | Z57: =RC[-5]+RC[-4] -> #VALUE! | AC57: =VALUE(RC[-27]) -> #VALUE! | AD57: =IF(RC[21]=42,"*",IF(RC[21]=32,"",RC[21])) ->  | AE57: =RC[-28] ->  | AF57: =RC[-28] ->  | AG57: =RC[-28] ->  | AH57: =RC[-28] ->  | AI57: =RC[-28] ->  | AJ57: =RC[-28] ->  | AK57: =RC[-28] ->  | AL57: =RC[-28] -> 0 | AM57: =RC[-28] ->  | AN57: =RC[-28] ->  | AO57: =RC[-28] ->  | AP57: - | AQ57: =RC[-29] ->  | AR57: =RC[-29] ->  | AS57: - | AT57: =RC[-30] -> - | AU57: =RC[-30] ->  | AV57: =RC[-30] ->  | AW57: =RC[-30] -> 
A58: =IF(RC[1]="","",DATEVALUE(RC[1])) ->  | P58: =IF(AND(ISNUMBER(RC[-3]),ISNUMBER(RC[-1])),RC[-3]-RC[-1],"-") -> - | T58: =(RC[-16]*RC[-15]-RC[-13]*RC[-12])/1000 -> #VALUE! | W58: =RC[-2]*RC[-10]/1000 -> #VALUE! | X58: =ABS((RC[-3]*RC[-11]-RC[-2]*RC[-9])/1000) -> #VALUE! | Y58: =(RC[-14]-RC[1])/RC[-18]*100 -> #VALUE! | Z58: =RC[-5]+RC[-4] -> #VALUE! | AC58: =VALUE(RC[-27]) -> #VALUE! | AD58: =IF(RC[21]=42,"*",IF(RC[21]=32,"",RC[21])) ->  | AE58: =RC[-28] ->  | AF58: =RC[-28] ->  | AG58: =RC[-28] ->  | AH58: =RC[-28] ->  | AI58: =RC[-28] ->  | AJ58: =RC[-28] ->  | AK58: =RC[-28] ->  | AL58: =RC[-28] -> 0 | AM58: =RC[-28] ->  | AN58: =RC[-28] ->  | AO58: =RC[-28] ->  | AP58: - | AQ58: =RC[-29] ->  | AR58: =RC[-29] ->  | AS58: - | AT58: =RC[-30] -> - | AU58: =RC[-30] ->  | AV58: =RC[-30] ->  | AW58: =RC[-30] -> 
A59: =IF(RC[1]="","",DATEVALUE(RC[1])) ->  | P59: =IF(AND(ISNUMBER(RC[-3]),ISNUMBER(RC[-1])),RC[-3]-RC[-1],"-") -> - | T59: =(RC[-16]*RC[-15]-RC[-13]*RC[-12])/1000 -> #VALUE! | W59: =RC[-2]*RC[-10]/1000 -> #VALUE! | X59: =ABS((RC[-3]*RC[-11]-RC[-2]*RC[-9])/1000) -> #VALUE! | Y59: =(RC[-14]-RC[1])/RC[-18]*100 -> #VALUE! | Z59: =RC[-5]+RC[-4] -> #VALUE! | AC59: =VALUE(RC[-27]) -> #VALUE! | AD59: =IF(RC[21]=42,"*",IF(RC[21]=32,"",RC[21])) ->  | AE59: =RC[-28] ->  | AF59: =RC[-28] ->  | AG59: =RC[-28] ->  | AH59: =RC[-28] ->  | AI59: =RC[-28] ->  | AJ59: =RC[-28] ->  | AK59: =RC[-28] ->  | AL59: =RC[-28] -> 0 | AM59: =RC[-28] ->  | AN59: =RC[-28] ->  | AO59: =RC[-28] ->  | AP59: - | AQ59: =RC[-29] ->  | AR59: =RC[-29] ->  | AS59: - | AT59: =RC[-30] -> - | AU59: =RC[-30] ->  | AV59: =RC[-30] ->  | AW59: =RC[-30] -> 
A60: =IF(RC[1]="","",DATEVALUE(RC[1])) ->  | P60: =IF(AND(ISNUMBER(RC[-3]),ISNUMBER(RC[-1])),RC[-3]-RC[-1],"-") -> - | T60: =(RC[-16]*RC[-15]-RC[-13]*RC[-12])/1000 -> #VALUE! | W60: =RC[-2]*RC[-10]/1000 -> #VALUE! | X60: =ABS((RC[-3]*RC[-11]-RC[-2]*RC[-9])/1000) -> #VALUE! | Y60: =(RC[-14]-RC[1])/RC[-18]*100 -> #VALUE! | Z60: =RC[-5]+RC[-4] -> #VALUE! | AC60: =VALUE(RC[-27]) -> #VALUE! | AD60: =IF(RC[21]=42,"*",IF(RC[21]=32,"",RC[21])) ->  | AE60: =RC[-28] ->  | AF60: =RC[-28] ->  | AG60: =RC[-28] ->  | AH60: =RC[-28] ->  | AI60: =RC[-28] ->  | AJ60: =RC[-28] ->  | AK60: =RC[-28] ->  | AL60: =RC[-28] -> 0 | AM60: =RC[-28] ->  | AN60: =RC[-28] ->  | AO60: =RC[-28] ->  | AP60: - | AQ60: =RC[-29] ->  | AR60: =RC[-29] ->  | AS60: - | AT60: =RC[-30] -> - | AU60: =RC[-30] ->  | AV60: =RC[-30] ->  | AW60: =RC[-30] -> 
A61: =IF(RC[1]="","",DATEVALUE(RC[1])) ->  | P61: =IF(AND(ISNUMBER(RC[-3]),ISNUMBER(RC[-1])),RC[-3]-RC[-1],"-") -> - | T61: =(RC[-16]*RC[-15]-RC[-13]*RC[-12])/1000 -> #VALUE! | W61: =RC[-2]*RC[-10]/1000 -> #VALUE! | X61: =ABS((RC[-3]*RC[-11]-RC[-2]*RC[-9])/1000) -> #VALUE! | Y61: =(RC[-14]-RC[1])/RC[-18]*100 -> #VALUE! | Z61: =RC[-5]+RC[-4] -> #VALUE! | AC61: =VALUE(RC[-27]) -> #VALUE! | AD61: =IF(RC[21]=42,"*",IF(RC[21]=32,"",RC[21])) ->  | AE61: =RC[-28] ->  | AF61: =RC[-28] ->  | AG61: =RC[-28] ->  | AH61: =RC[-28] ->  | AI61: =RC[-28] ->  | AJ61: =RC[-28] ->  | AK61: =RC[-28] ->  | AL61: =RC[-28] -> 0 | AM61: =RC[-28] ->  | AN61: =RC[-28] ->  | AO61: =RC[-28] ->  | AP61: - | AQ61: =RC[-29] ->  | AR61: =RC[-29] ->  | AS61: - | AT61: =RC[-30] -> - | AU61: =RC[-30] ->  | AV61: =RC[-30] ->  | AW61: =RC[-30] -> 
A62: =IF(RC[1]="","",DATEVALUE(RC[1])) ->  | P62: =IF(AND(ISNUMBER(RC[-3]),ISNUMBER(RC[-1])),RC[-3]-RC[-1],"-") -> - | T62: =(RC[-16]*RC[-15]-RC[-13]*RC[-12])/1000 -> #VALUE! | W62: =RC[-2]*RC[-10]/1000 -> #VALUE! | X62: =ABS((RC[-3]*RC[-11]-RC[-2]*RC[-9])/1000) -> #VALUE! | Y62: =(RC[-14]-RC[1])/RC[-18]*100 -> #VALUE! | Z62: =RC[-5]+RC[-4] -> #VALUE! | AC62: =VALUE(RC[-27]) -> #VALUE! | AD62: =IF(RC[21]=42,"*",IF(RC[21]=32,"",RC[21])) ->  | AE62: =RC[-28] ->  | AF62: =RC[-28] ->  | AG62: =RC[-28] ->  | AH62: =RC[-28] ->  | AI62: =RC[-28] ->  | AJ62: =RC[-28] ->  | AK62: =RC[-28] ->  | AL62: =RC[-28] -> 0 | AM62: =RC[-28] ->  | AN62: =RC[-28] ->  | AO62: =RC[-28] ->  | AP62: - | AQ62: =RC[-29] ->  | AR62: =RC[-29] ->  | AS62: - | AT62: =RC[-30] -> - | AU62: =RC[-30] ->  | AV62: =RC[-30] ->  | AW62: =RC[-30] -> 
A63: =IF(RC[1]="","",DATEVALUE(RC[1])) ->  | P63: =IF(AND(ISNUMBER(RC[-3]),ISNUMBER(RC[-1])),RC[-3]-RC[-1],"-") -> - | T63: =(RC[-16]*RC[-15]-RC[-13]*RC[-12])/1000 -> #VALUE! | W63: =RC[-2]*RC[-10]/1000 -> #VALUE! | X63: =ABS((RC[-3]*RC[-11]-RC[-2]*RC[-9])/1000) -> #VALUE! | Y63: =(RC[-14]-RC[1])/RC[-18]*100 -> #VALUE! | Z63: =RC[-5]+RC[-4] -> #VALUE! | AC63: =VALUE(RC[-27]) -> #VALUE! | AD63: =IF(RC[21]=42,"*",IF(RC[21]=32,"",RC[21])) ->  | AE63: =RC[-28] ->  | AF63: =RC[-28] ->  | AG63: =RC[-28] ->  | AH63: =RC[-28] ->  | AI63: =RC[-28] ->  | AJ63: =RC[-28] ->  | AK63: =RC[-28] ->  | AL63: =RC[-28] -> 0 | AM63: =RC[-28] ->  | AN63: =RC[-28] ->  | AO63: =RC[-28] ->  | AP63: - | AQ63: =RC[-29] ->  | AR63: =RC[-29] ->  | AS63: - | AT63: =RC[-30] -> - | AU63: =RC[-30] ->  | AV63: =RC[-30] ->  | AW63: =RC[-30] -> 
A64: =IF(RC[1]="","",DATEVALUE(RC[1])) ->  | P64: =IF(AND(ISNUMBER(RC[-3]),ISNUMBER(RC[-1])),RC[-3]-RC[-1],"-") -> - | T64: =(RC[-16]*RC[-15]-RC[-13]*RC[-12])/1000 -> #VALUE! | W64: =RC[-2]*RC[-10]/1000 -> #VALUE! | X64: =ABS((RC[-3]*RC[-11]-RC[-2]*RC[-9])/1000) -> #VALUE! | Y64: =(RC[-14]-RC[1])/RC[-18]*100 -> #VALUE! | Z64: =RC[-5]+RC[-4] -> #VALUE! | AC64: =VALUE(RC[-27]) -> #VALUE! | AD64: =IF(RC[21]=42,"*",IF(RC[21]=32,"",RC[21])) ->  | AE64: =RC[-28] ->  | AF64: =RC[-28] ->  | AG64: =RC[-28] ->  | AH64: =RC[-28] ->  | AI64: =RC[-28] ->  | AJ64: =RC[-28] ->  | AK64: =RC[-28] ->  | AL64: =RC[-28] -> 0 | AM64: =RC[-28] ->  | AN64: =RC[-28] ->  | AO64: =RC[-28] ->  | AP64: - | AQ64: =RC[-29] ->  | AR64: =RC[-29] ->  | AS64: - | AT64: =RC[-30] -> - | AU64: =RC[-30] ->  | AV64: =RC[-30] ->  | AW64: =RC[-30] -> 
A65: =IF(RC[1]="","",DATEVALUE(RC[1])) ->  | P65: =IF(AND(ISNUMBER(RC[-3]),ISNUMBER(RC[-1])),RC[-3]-RC[-1],"-") -> - | T65: =(RC[-16]*RC[-15]-RC[-13]*RC[-12])/1000 -> #VALUE! | W65: =RC[-2]*RC[-10]/1000 -> #VALUE! | X65: =ABS((RC[-3]*RC[-11]-RC[-2]*RC[-9])/1000) -> #VALUE! | Y65: =(RC[-14]-RC[1])/RC[-18]*100 -> #VALUE! | Z65: =RC[-5]+RC[-4] -> #VALUE! | AC65: =VALUE(RC[-27]) -> #VALUE! | AD65: =IF(RC[21]=42,"*",IF(RC[21]=32,"",RC[21])) ->  | AE65: =RC[-28] ->  | AF65: =RC[-28] ->  | AG65: =RC[-28] ->  | AH65: =RC[-28] ->  | AI65: =RC[-28] ->  | AJ65: =RC[-28] ->  | AK65: =RC[-28] ->  | AL65: =RC[-28] -> 0 | AM65: =RC[-28] ->  | AN65: =RC[-28] ->  | AO65: =RC[-28] ->  | AP65: - | AQ65: =RC[-29] ->  | AR65: =RC[-29] ->  | AS65: - | AT65: =RC[-30] -> - | AU65: =RC[-30] ->  | AV65: =RC[-30] ->  | AW65: =RC[-30] -> 
A66: =IF(RC[1]="","",DATEVALUE(RC[1])) ->  | P66: =IF(AND(ISNUMBER(RC[-3]),ISNUMBER(RC[-1])),RC[-3]-RC[-1],"-") -> - | T66: =(RC[-16]*RC[-15]-RC[-13]*RC[-12])/1000 -> #VALUE! | W66: =RC[-2]*RC[-10]/1000 -> #VALUE! | X66: =ABS((RC[-3]*RC[-11]-RC[-2]*RC[-9])/1000) -> #VALUE! | Y66: =(RC[-14]-RC[1])/RC[-18]*100 -> #VALUE! | Z66: =RC[-5]+RC[-4] -> #VALUE! | AC66: =VALUE(RC[-27]) -> #VALUE! | AD66: =IF(RC[21]=42,"*",IF(RC[21]=32,"",RC[21])) ->  | AE66: =RC[-28] ->  | AF66: =RC[-28] ->  | AG66: =RC[-28] ->  | AH66: =RC[-28] ->  | AI66: =RC[-28] ->  | AJ66: =RC[-28] ->  | AK66: =RC[-28] ->  | AL66: =RC[-28] -> 0 | AM66: =RC[-28] ->  | AN66: =RC[-28] ->  | AO66: =RC[-28] ->  | AP66: - | AQ66: =RC[-29] ->  | AR66: =RC[-29] ->  | AS66: - | AT66: =RC[-30] -> - | AU66: =RC[-30] ->  | AV66: =RC[-30] ->  | AW66: =RC[-30] -> 
A67: =IF(RC[1]="","",DATEVALUE(RC[1])) ->  | P67: =IF(AND(ISNUMBER(RC[-3]),ISNUMBER(RC[-1])),RC[-3]-RC[-1],"-") -> - | T67: =(RC[-16]*RC[-15]-RC[-13]*RC[-12])/1000 -> #VALUE! | W67: =RC[-2]*RC[-10]/1000 -> #VALUE! | X67: =ABS((RC[-3]*RC[-11]-RC[-2]*RC[-9])/1000) -> #VALUE! | Y67: =(RC[-14]-RC[1])/RC[-18]*100 -> #VALUE! | Z67: =RC[-5]+RC[-4] -> #VALUE! | AC67: =VALUE(RC[-27]) -> #VALUE! | AD67: =IF(RC[21]=42,"*",IF(RC[21]=32,"",RC[21])) ->  | AE67: =RC[-28] ->  | AF67: =RC[-28] ->  | AG67: =RC[-28] ->  | AH67: =RC[-28] ->  | AI67: =RC[-28] ->  | AJ67: =RC[-28] ->  | AK67: =RC[-28] ->  | AL67: =RC[-28] -> 0 | AM67: =RC[-28] ->  | AN67: =RC[-28] ->  | AO67: =RC[-28] ->  | AP67: - | AQ67: =RC[-29] ->  | AR67: =RC[-29] ->  | AS67: - | AT67: =RC[-30] -> - | AU67: =RC[-30] ->  | AV67: =RC[-30] ->  | AW67: =RC[-30] -> 
A68: =IF(RC[1]="","",DATEVALUE(RC[1])) ->  | P68: =IF(AND(ISNUMBER(RC[-3]),ISNUMBER(RC[-1])),RC[-3]-RC[-1],"-") -> - | T68: =(RC[-16]*RC[-15]-RC[-13]*RC[-12])/1000 -> #VALUE! | W68: =RC[-2]*RC[-10]/1000 -> #VALUE! | X68: =ABS((RC[-3]*RC[-11]-RC[-2]*RC[-9])/1000) -> #VALUE! | Y68: =(RC[-14]-RC[1])/RC[-18]*100 -> #VALUE! | Z68: =RC[-5]+RC[-4] -> #VALUE! | AC68: =VALUE(RC[-27]) -> #VALUE! | AD68: =IF(RC[21]=42,"*",IF(RC[21]=32,"",RC[21])) ->  | AE68: =RC[-28] ->  | AF68: =RC[-28] ->  | AG68: =RC[-28] ->  | AH68: =RC[-28] ->  | AI68: =RC[-28] ->  | AJ68: =RC[-28] ->  | AK68: =RC[-28] ->  | AL68: =RC[-28] -> 0 | AM68: =RC[-28] ->  | AN68: =RC[-28] ->  | AO68: =RC[-28] ->  | AP68: - | AQ68: =RC[-29] ->  | AR68: =RC[-29] ->  | AS68: - | AT68: =RC[-30] -> - | AU68: =RC[-30] ->  | AV68: =RC[-30] ->  | AW68: =RC[-30] -> 
A69: =IF(RC[1]="","",DATEVALUE(RC[1])) ->  | P69: =IF(AND(ISNUMBER(RC[-3]),ISNUMBER(RC[-1])),RC[-3]-RC[-1],"-") -> - | T69: =(RC[-16]*RC[-15]-RC[-13]*RC[-12])/1000 -> #VALUE! | W69: =RC[-2]*RC[-10]/1000 -> #VALUE! | X69: =ABS((RC[-3]*RC[-11]-RC[-2]*RC[-9])/1000) -> #VALUE! | Y69: =(RC[-14]-RC[1])/RC[-18]*100 -> #VALUE! | Z69: =RC[-5]+RC[-4] -> #VALUE! | AC69: =VALUE(RC[-27]) -> #VALUE! | AD69: =IF(RC[21]=42,"*",IF(RC[21]=32,"",RC[21])) ->  | AE69: =RC[-28] ->  | AF69: =RC[-28] ->  | AG69: =RC[-28] ->  | AH69: =RC[-28] ->  | AI69: =RC[-28] ->  | AJ69: =RC[-28] ->  | AK69: =RC[-28] ->  | AL69: =RC[-28] -> 0 | AM69: =RC[-28] ->  | AN69: =RC[-28] ->  | AO69: =RC[-28] ->  | AP69: - | AQ69: =RC[-29] ->  | AR69: =RC[-29] ->  | AS69: - | AT69: =RC[-30] -> - | AU69: =RC[-30] ->  | AV69: =RC[-30] ->  | AW69: =RC[-30] -> 
A70: =IF(RC[1]="","",DATEVALUE(RC[1])) ->  | P70: =IF(AND(ISNUMBER(RC[-3]),ISNUMBER(RC[-1])),RC[-3]-RC[-1],"-") -> - | T70: =(RC[-16]*RC[-15]-RC[-13]*RC[-12])/1000 -> #VALUE! | W70: =RC[-2]*RC[-10]/1000 -> #VALUE! | X70: =ABS((RC[-3]*RC[-11]-RC[-2]*RC[-9])/1000) -> #VALUE! | Y70: =(RC[-14]-RC[1])/RC[-18]*100 -> #VALUE! | Z70: =RC[-5]+RC[-4] -> #VALUE! | AC70: =VALUE(RC[-27]) -> #VALUE! | AD70: =IF(RC[21]=42,"*",IF(RC[21]=32,"",RC[21])) ->  | AE70: =RC[-28] ->  | AF70: =RC[-28] ->  | AG70: =RC[-28] ->  | AH70: =RC[-28] ->  | AI70: =RC[-28] ->  | AJ70: =RC[-28] ->  | AK70: =RC[-28] ->  | AL70: =RC[-28] -> 0 | AM70: =RC[-28] ->  | AN70: =RC[-28] ->  | AO70: =RC[-28] ->  | AP70: - | AQ70: =RC[-29] ->  | AR70: =RC[-29] ->  | AS70: - | AT70: =RC[-30] -> - | AU70: =RC[-30] ->  | AV70: =RC[-30] ->  | AW70: =RC[-30] -> 
A71: =IF(RC[1]="","",DATEVALUE(RC[1])) ->  | P71: =IF(AND(ISNUMBER(RC[-3]),ISNUMBER(RC[-1])),RC[-3]-RC[-1],"-") -> - | T71: =(RC[-16]*RC[-15]-RC[-13]*RC[-12])/1000 -> #VALUE! | W71: =RC[-2]*RC[-10]/1000 -> #VALUE! | X71: =ABS((RC[-3]*RC[-11]-RC[-2]*RC[-9])/1000) -> #VALUE! | Y71: =(RC[-14]-RC[1])/RC[-18]*100 -> #VALUE! | Z71: =RC[-5]+RC[-4] -> #VALUE! | AC71: =VALUE(RC[-27]) -> #VALUE! | AD71: =IF(RC[21]=42,"*",IF(RC[21]=32,"",RC[21])) ->  | AE71: =RC[-28] ->  | AF71: =RC[-28] ->  | AG71: =RC[-28] ->  | AH71: =RC[-28] ->  | AI71: =RC[-28] ->  | AJ71: =RC[-28] ->  | AK71: =RC[-28] ->  | AL71: =RC[-28] -> 0 | AM71: =RC[-28] ->  | AN71: =RC[-28] ->  | AO71: =RC[-28] ->  | AP71: - | AQ71: =RC[-29] ->  | AR71: =RC[-29] ->  | AS71: - | AT71: =RC[-30] -> - | AU71: =RC[-30] ->  | AV71: =RC[-30] ->  | AW71: =RC[-30] -> 
A72: =IF(RC[1]="","",DATEVALUE(RC[1])) ->  | P72: =IF(AND(ISNUMBER(RC[-3]),ISNUMBER(RC[-1])),RC[-3]-RC[-1],"-") -> - | T72: =(RC[-16]*RC[-15]-RC[-13]*RC[-12])/1000 -> #VALUE! | W72: =RC[-2]*RC[-10]/1000 -> #VALUE! | X72: =ABS((RC[-3]*RC[-11]-RC[-2]*RC[-9])/1000) -> #VALUE! | Y72: =(RC[-14]-RC[1])/RC[-18]*100 -> #VALUE! | Z72: =RC[-5]+RC[-4] -> #VALUE! | AC72: =VALUE(RC[-27]) -> #VALUE! | AD72: =IF(RC[21]=42,"*",IF(RC[21]=32,"",RC[21])) ->  | AE72: =RC[-28] ->  | AF72: =RC[-28] ->  | AG72: =RC[-28] ->  | AH72: =RC[-28] ->  | AI72: =RC[-28] ->  | AJ72: =RC[-28] ->  | AK72: =RC[-28] ->  | AL72: =RC[-28] -> 0 | AM72: =RC[-28] ->  | AN72: =RC[-28] ->  | AO72: =RC[-28] ->  | AP72: - | AQ72: =RC[-29] ->  | AR72: =RC[-29] ->  | AS72: - | AT72: =RC[-30] -> - | AU72: =RC[-30] ->  | AV72: =RC[-30] ->  | AW72: =RC[-30] -> 
A73: =IF(RC[1]="","",DATEVALUE(RC[1])) ->  | P73: =IF(AND(ISNUMBER(RC[-3]),ISNUMBER(RC[-1])),RC[-3]-RC[-1],"-") -> - | T73: =(RC[-16]*RC[-15]-RC[-13]*RC[-12])/1000 -> #VALUE! | W73: =RC[-2]*RC[-10]/1000 -> #VALUE! | X73: =ABS((RC[-3]*RC[-11]-RC[-2]*RC[-9])/1000) -> #VALUE! | Y73: =(RC[-14]-RC[1])/RC[-18]*100 -> #VALUE! | Z73: =RC[-5]+RC[-4] -> #VALUE! | AC73: =VALUE(RC[-27]) -> #VALUE! | AD73: =IF(RC[21]=42,"*",IF(RC[21]=32,"",RC[21])) ->  | AE73: =RC[-28] ->  | AF73: =RC[-28] ->  | AG73: =RC[-28] ->  | AH73: =RC[-28] ->  | AI73: =RC[-28] ->  | AJ73: =RC[-28] ->  | AK73: =RC[-28] ->  | AL73: =RC[-28] -> 0 | AM73: =RC[-28] ->  | AN73: =RC[-28] ->  | AO73: =RC[-28] ->  | AP73: - | AQ73: =RC[-29] ->  | AR73: =RC[-29] ->  | AS73: - | AT73: =RC[-30] -> - | AU73: =RC[-30] ->  | AV73: =RC[-30] ->  | AW73: =RC[-30] -> 
A74: =IF(RC[1]="","",DATEVALUE(RC[1])) ->  | P74: =IF(AND(ISNUMBER(RC[-3]),ISNUMBER(RC[-1])),RC[-3]-RC[-1],"-") -> - | T74: =(RC[-16]*RC[-15]-RC[-13]*RC[-12])/1000 -> #VALUE! | W74: =RC[-2]*RC[-10]/1000 -> #VALUE! | X74: =ABS((RC[-3]*RC[-11]-RC[-2]*RC[-9])/1000) -> #VALUE! | Y74: =(RC[-14]-RC[1])/RC[-18]*100 -> #VALUE! | Z74: =RC[-5]+RC[-4] -> #VALUE! | AC74: =VALUE(RC[-27]) -> #VALUE! | AD74: =IF(RC[21]=42,"*",IF(RC[21]=32,"",RC[21])) ->  | AE74: =RC[-28] ->  | AF74: =RC[-28] ->  | AG74: =RC[-28] ->  | AH74: =RC[-28] ->  | AI74: =RC[-28] ->  | AJ74: =RC[-28] ->  | AK74: =RC[-28] ->  | AL74: =RC[-28] -> 0 | AM74: =RC[-28] ->  | AN74: =RC[-28] ->  | AO74: =RC[-28] ->  | AP74: - | AQ74: =RC[-29] ->  | AR74: =RC[-29] ->  | AS74: - | AT74: =RC[-30] -> - | AU74: =RC[-30] ->  | AV74: =RC[-30] ->  | AW74: =RC[-30] -> 
A75: =IF(RC[1]="","",DATEVALUE(RC[1])) ->  | P75: =IF(AND(ISNUMBER(RC[-3]),ISNUMBER(RC[-1])),RC[-3]-RC[-1],"-") -> - | T75: =(RC[-16]*RC[-15]-RC[-13]*RC[-12])/1000 -> #VALUE! | W75: =RC[-2]*RC[-10]/1000 -> #VALUE! | X75: =ABS((RC[-3]*RC[-11]-RC[-2]*RC[-9])/1000) -> #VALUE! | Y75: =(RC[-14]-RC[1])/RC[-18]*100 -> #VALUE! | Z75: =RC[-5]+RC[-4] -> #VALUE! | AC75: =VALUE(RC[-27]) -> #VALUE! | AD75: =IF(RC[21]=42,"*",IF(RC[21]=32,"",RC[21])) ->  | AE75: =RC[-28] ->  | AF75: =RC[-28] ->  | AG75: =RC[-28] ->  | AH75: =RC[-28] ->  | AI75: =RC[-28] ->  | AJ75: =RC[-28] ->  | AK75: =RC[-28] ->  | AL75: =RC[-28] -> 0 | AM75: =RC[-28] ->  | AN75: =RC[-28] ->  | AO75: =RC[-28] ->  | AP75: - | AQ75: =RC[-29] ->  | AR75: =RC[-29] ->  | AS75: - | AT75: =RC[-30] -> - | AU75: =RC[-30] ->  | AV75: =RC[-30] ->  | AW75: =RC[-30] -> 
A76: =IF(RC[1]="","",DATEVALUE(RC[1])) ->  | P76: =IF(AND(ISNUMBER(RC[-3]),ISNUMBER(RC[-1])),RC[-3]-RC[-1],"-") -> - | T76: =(RC[-16]*RC[-15]-RC[-13]*RC[-12])/1000 -> #VALUE! | W76: =RC[-2]*RC[-10]/1000 -> #VALUE! | X76: =ABS((RC[-3]*RC[-11]-RC[-2]*RC[-9])/1000) -> #VALUE! | Y76: =(RC[-14]-RC[1])/RC[-18]*100 -> #VALUE! | Z76: =RC[-5]+RC[-4] -> #VALUE! | AC76: =VALUE(RC[-27]) -> #VALUE! | AD76: =IF(RC[21]=42,"*",IF(RC[21]=32,"",RC[21])) ->  | AE76: =RC[-28] ->  | AF76: =RC[-28] ->  | AG76: =RC[-28] ->  | AH76: =RC[-28] ->  | AI76: =RC[-28] ->  | AJ76: =RC[-28] ->  | AK76: =RC[-28] ->  | AL76: =RC[-28] -> 0 | AM76: =RC[-28] ->  | AN76: =RC[-28] ->  | AO76: =RC[-28] ->  | AP76: - | AQ76: =RC[-29] ->  | AR76: =RC[-29] ->  | AS76: - | AT76: =RC[-30] -> - | AU76: =RC[-30] ->  | AV76: =RC[-30] ->  | AW76: =RC[-30] -> 
A77: =IF(RC[1]="","",DATEVALUE(RC[1])) ->  | P77: =IF(AND(ISNUMBER(RC[-3]),ISNUMBER(RC[-1])),RC[-3]-RC[-1],"-") -> - | T77: =(RC[-16]*RC[-15]-RC[-13]*RC[-12])/1000 -> #VALUE! | W77: =RC[-2]*RC[-10]/1000 -> #VALUE! | X77: =ABS((RC[-3]*RC[-11]-RC[-2]*RC[-9])/1000) -> #VALUE! | Y77: =(RC[-14]-RC[1])/RC[-18]*100 -> #VALUE! | Z77: =RC[-5]+RC[-4] -> #VALUE! | AC77: =VALUE(RC[-27]) -> #VALUE! | AD77: =IF(RC[21]=42,"*",IF(RC[21]=32,"",RC[21])) ->  | AE77: =RC[-28] ->  | AF77: =RC[-28] ->  | AG77: =RC[-28] ->  | AH77: =RC[-28] ->  | AI77: =RC[-28] ->  | AJ77: =RC[-28] ->  | AK77: =RC[-28] ->  | AL77: =RC[-28] -> 0 | AM77: =RC[-28] ->  | AN77: =RC[-28] ->  | AO77: =RC[-28] ->  | AP77: - | AQ77: =RC[-29] ->  | AR77: =RC[-29] ->  | AS77: - | AT77: =RC[-30] -> - | AU77: =RC[-30] ->  | AV77: =RC[-30] ->  | AW77: =RC[-30] -> 
A78: =IF(RC[1]="","",DATEVALUE(RC[1])) ->  | P78: =IF(AND(ISNUMBER(RC[-3]),ISNUMBER(RC[-1])),RC[-3]-RC[-1],"-") -> - | T78: =(RC[-16]*RC[-15]-RC[-13]*RC[-12])/1000 -> #VALUE! | W78: =RC[-2]*RC[-10]/1000 -> #VALUE! | X78: =ABS((RC[-3]*RC[-11]-RC[-2]*RC[-9])/1000) -> #VALUE! | Y78: =(RC[-14]-RC[1])/RC[-18]*100 -> #VALUE! | Z78: =RC[-5]+RC[-4] -> #VALUE! | AC78: =VALUE(RC[-27]) -> #VALUE! | AD78: =IF(RC[21]=42,"*",IF(RC[21]=32,"",RC[21])) ->  | AE78: =RC[-28] ->  | AF78: =RC[-28] ->  | AG78: =RC[-28] ->  | AH78: =RC[-28] ->  | AI78: =RC[-28] ->  | AJ78: =RC[-28] ->  | AK78: =RC[-28] ->  | AL78: =RC[-28] -> 0 | AM78: =RC[-28] ->  | AN78: =RC[-28] ->  | AO78: =RC[-28] ->  | AP78: - | AQ78: =RC[-29] ->  | AR78: =RC[-29] ->  | AS78: - | AT78: =RC[-30] -> - | AU78: =RC[-30] ->  | AV78: =RC[-30] ->  | AW78: =RC[-30] -> 
A79: =IF(RC[1]="","",DATEVALUE(RC[1])) ->  | P79: =IF(AND(ISNUMBER(RC[-3]),ISNUMBER(RC[-1])),RC[-3]-RC[-1],"-") -> - | T79: =(RC[-16]*RC[-15]-RC[-13]*RC[-12])/1000 -> #VALUE! | W79: =RC[-2]*RC[-10]/1000 -> #VALUE! | X79: =ABS((RC[-3]*RC[-11]-RC[-2]*RC[-9])/1000) -> #VALUE! | Y79: =(RC[-14]-RC[1])/RC[-18]*100 -> #VALUE! | Z79: =RC[-5]+RC[-4] -> #VALUE! | AC79: =VALUE(RC[-27]) -> #VALUE! | AD79: =IF(RC[21]=42,"*",IF(RC[21]=32,"",RC[21])) ->  | AE79: =RC[-28] ->  | AF79: =RC[-28] ->  | AG79: =RC[-28] ->  | AH79: =RC[-28] ->  | AI79: =RC[-28] ->  | AJ79: =RC[-28] ->  | AK79: =RC[-28] ->  | AL79: =RC[-28] -> 0 | AM79: =RC[-28] ->  | AN79: =RC[-28] ->  | AO79: =RC[-28] ->  | AP79: - | AQ79: =RC[-29] ->  | AR79: =RC[-29] ->  | AS79: - | AT79: =RC[-30] -> - | AU79: =RC[-30] ->  | AV79: =RC[-30] ->  | AW79: =RC[-30] -> 
A80: =IF(RC[1]="","",DATEVALUE(RC[1])) ->  | P80: =IF(AND(ISNUMBER(RC[-3]),ISNUMBER(RC[-1])),RC[-3]-RC[-1],"-") -> - | T80: =(RC[-16]*RC[-15]-RC[-13]*RC[-12])/1000 -> #VALUE! | W80: =RC[-2]*RC[-10]/1000 -> #VALUE! | X80: =ABS((RC[-3]*RC[-11]-RC[-2]*RC[-9])/1000) -> #VALUE! | Y80: =(RC[-14]-RC[1])/RC[-18]*100 -> #VALUE! | Z80: =RC[-5]+RC[-4] -> #VALUE! | AC80: =VALUE(RC[-27]) -> #VALUE! | AD80: =IF(RC[21]=42,"*",IF(RC[21]=32,"",RC[21])) ->  | AE80: =RC[-28] ->  | AF80: =RC[-28] ->  | AG80: =RC[-28] ->  | AH80: =RC[-28] ->  | AI80: =RC[-28] ->  | AJ80: =RC[-28] ->  | AK80: =RC[-28] ->  | AL80: =RC[-28] -> 0 | AM80: =RC[-28] ->  | AN80: =RC[-28] ->  | AO80: =RC[-28] ->  | AP80: - | AQ80: =RC[-29] ->  | AR80: =RC[-29] ->  | AS80: - | AT80: =RC[-30] -> - | AU80: =RC[-30] ->  | AV80: =RC[-30] ->  | AW80: =RC[-30] -> 
A81: =IF(RC[1]="","",DATEVALUE(RC[1])) ->  | P81: =IF(AND(ISNUMBER(RC[-3]),ISNUMBER(RC[-1])),RC[-3]-RC[-1],"-") -> - | T81: =(RC[-16]*RC[-15]-RC[-13]*RC[-12])/1000 -> #VALUE! | W81: =RC[-2]*RC[-10]/1000 -> #VALUE! | X81: =ABS((RC[-3]*RC[-11]-RC[-2]*RC[-9])/1000) -> #VALUE! | Y81: =(RC[-14]-RC[1])/RC[-18]*100 -> #VALUE! | Z81: =RC[-5]+RC[-4] -> #VALUE! | AC81: =VALUE(RC[-27]) -> #VALUE! | AD81: =IF(RC[21]=42,"*",IF(RC[21]=32,"",RC[21])) ->  | AE81: =RC[-28] ->  | AF81: =RC[-28] ->  | AG81: =RC[-28] ->  | AH81: =RC[-28] ->  | AI81: =RC[-28] ->  | AJ81: =RC[-28] ->  | AK81: =RC[-28] ->  | AL81: =RC[-28] -> 0 | AM81: =RC[-28] ->  | AN81: =RC[-28] ->  | AO81: =RC[-28] ->  | AP81: - | AQ81: =RC[-29] ->  | AR81: =RC[-29] ->  | AS81: - | AT81: =RC[-30] -> - | AU81: =RC[-30] ->  | AV81: =RC[-30] ->  | AW81: =RC[-30] -> 
A82: =IF(RC[1]="","",DATEVALUE(RC[1])) ->  | P82: =IF(AND(ISNUMBER(RC[-3]),ISNUMBER(RC[-1])),RC[-3]-RC[-1],"-") -> - | T82: =(RC[-16]*RC[-15]-RC[-13]*RC[-12])/1000 -> #VALUE! | W82: =RC[-2]*RC[-10]/1000 -> #VALUE! | X82: =ABS((RC[-3]*RC[-11]-RC[-2]*RC[-9])/1000) -> #VALUE! | Y82: =(RC[-14]-RC[1])/RC[-18]*100 -> #VALUE! | Z82: =RC[-5]+RC[-4] -> #VALUE! | AC82: =VALUE(RC[-27]) -> #VALUE! | AD82: =IF(RC[21]=42,"*",IF(RC[21]=32,"",RC[21])) ->  | AE82: =RC[-28] ->  | AF82: =RC[-28] ->  | AG82: =RC[-28] ->  | AH82: =RC[-28] ->  | AI82: =RC[-28] ->  | AJ82: =RC[-28] ->  | AK82: =RC[-28] ->  | AL82: =RC[-28] -> 0 | AM82: =RC[-28] ->  | AN82: =RC[-28] ->  | AO82: =RC[-28] ->  | AP82: - | AQ82: =RC[-29] ->  | AR82: =RC[-29] ->  | AS82: - | AT82: =RC[-30] -> - | AU82: =RC[-30] ->  | AV82: =RC[-30] ->  | AW82: =RC[-30] -> 
A83: =IF(RC[1]="","",DATEVALUE(RC[1])) ->  | P83: =IF(AND(ISNUMBER(RC[-3]),ISNUMBER(RC[-1])),RC[-3]-RC[-1],"-") -> - | T83: =(RC[-16]*RC[-15]-RC[-13]*RC[-12])/1000 -> #VALUE! | W83: =RC[-2]*RC[-10]/1000 -> #VALUE! | X83: =ABS((RC[-3]*RC[-11]-RC[-2]*RC[-9])/1000) -> #VALUE! | Y83: =(RC[-14]-RC[1])/RC[-18]*100 -> #VALUE! | Z83: =RC[-5]+RC[-4] -> #VALUE! | AC83: =VALUE(RC[-27]) -> #VALUE! | AD83: =IF(RC[21]=42,"*",IF(RC[21]=32,"",RC[21])) ->  | AE83: =RC[-28] ->  | AF83: =RC[-28] ->  | AG83: =RC[-28] ->  | AH83: =RC[-28] ->  | AI83: =RC[-28] ->  | AJ83: =RC[-28] ->  | AK83: =RC[-28] ->  | AL83: =RC[-28] -> 0 | AM83: =RC[-28] ->  | AN83: =RC[-28] ->  | AO83: =RC[-28] ->  | AP83: - | AQ83: =RC[-29] ->  | AR83: =RC[-29] ->  | AS83: - | AT83: =RC[-30] -> - | AU83: =RC[-30] ->  | AV83: =RC[-30] ->  | AW83: =RC[-30] -> 
AC84: Среднее | AF84: =R[1]C[-28] -> 129.62129983333332 | AG84: =R[1]C[-28] -> 68.538111633333315 | AH84: =R[1]C[-28] -> 8.1624788333333331 | AI84: =R[1]C[-28] -> 120.67343806666666 | AJ84: =R[1]C[-28] -> 48.5184955 | AK84: =R[1]C[-28] -> 5.6634052666666674 | AL84: =R[1]C[-28] -> 20.019616133333329 | AM84: =R[1]C[-28] -> 8.9861146666666691 | AN84: =R[1]C[-28] -> 9.5527976666666667 | AO84: =R[1]C[-28] -> 68.285739000000007 | AP84: - | AQ84: =R[1]C[-29] -> 2.9069504666666663 | AR84: =R[1]C[-29] -> 66.989779200000001 | AS84: - | AT84: =R[1]C[-30] -> 1.2959597999999997 | AU84: =R[1]C[-30] -> 12.459748133333335
B85: Среднее | D85: =AVERAGE(OFFSET(R[-74]C,3,0,R7C1,1)) -> 129.62129983333332 | E85: =AVERAGE(OFFSET(R[-74]C,3,0,R7C1,1)) -> 68.538111633333315 | F85: =AVERAGE(OFFSET(R[-74]C,3,0,R7C1,1)) -> 8.1624788333333331 | G85: =AVERAGE(OFFSET(R[-74]C,3,0,R7C1,1)) -> 120.67343806666666 | H85: =AVERAGE(OFFSET(R[-74]C,3,0,R7C1,1)) -> 48.5184955 | I85: =AVERAGE(OFFSET(R[-74]C,3,0,R7C1,1)) -> 5.6634052666666674 | J85: =AVERAGE(OFFSET(R[-74]C,3,0,R7C1,1)) -> 20.019616133333329 | K85: =AVERAGE(OFFSET(R[-74]C,3,0,R7C1,1)) -> 8.9861146666666691 | L85: =IF(SUM(OFFSET(R[-74]C,3,0,R7C1,1))=0,"",AVERAGE(OFFSET(R[-74]C,3,0,R7C1,1))) -> 9.5527976666666667 | M85: =IF(SUM(OFFSET(R[-74]C,3,0,R7C1,1))=0,"",AVERAGE(OFFSET(R[-74]C,3,0,R7C1,1))) -> 68.285739000000007 | N85: =IF(SUM(OFFSET(R[-74]C,3,0,R7C1,1))=0,"",AVERAGE(OFFSET(R[-74]C,3,0,R7C1,1))) -> 2.9069504666666663 | O85: =IF(SUM(OFFSET(R[-74]C,3,0,R7C1,1))=0,"",AVERAGE(OFFSET(R[-74]C,3,0,R7C1,1))) -> 66.989779200000001 | P85: =IF(SUM(OFFSET(R[-74]C,3,0,R7C1,1))=0,"",AVERAGE(OFFSET(R[-74]C,3,0,R7C1,1))) -> 1.2959597999999997 | Q85: =IF(SUM(OFFSET(R[-74]C,3,0,R7C1,1))=0,"",AVERAGE(OFFSET(R[-74]C,3,0,R7C1,1))) -> 12.459748133333335 | R85: =IF(SUM(OFFSET(R[-74]C,3,0,R7C1,1))=0,"",AVERAGE(OFFSET(R[-74]C,3,0,R7C1,1))) -> 0.82965453333333339 | S85: =AVERAGE(OFFSET(R[-74]C,3,0,R7C1,1)) -> 3.991627666666667 | T85: =AVERAGE(OFFSET(R[-74]C,3,0,R7C1,1)) -> 3.1220996748233127 | W85: =AVERAGE(OFFSET(R[-74]C,3,0,R7C1,1)) -> 0.63826156005598622 | X85: =AVERAGE(OFFSET(R[-74]C,3,0,R7C1,1)) -> 0.44749861534761121 | AC85: Итого | AE85: =R[1]C[-28] -> 720 | AF85: =R[1]C[-28] -> 3888.6389949999998 | AI85: =R[1]C[-28] -> 3620.2031419999998 | AM85: =R[1]C[-28] -> 269.58344000000005 | AN85: =R[1]C[-28] -> 286.58393000000001 | AQ85: =R[1]C[-29] -> 87.208513999999994 | AU85: =R[1]C[-30] -> 373.79244400000005 | AV85: =R[1]C[-30] -> 24.889636000000003 | AW85: =R[1]C[-30] -> 119.74883000000001
B86: ИТОГО: | C86: =SUM(OFFSET(R[-75]C,3,0,R7C1,1)) -> 720 | D86: =SUM(OFFSET(R[-75]C,3,0,R7C1,1)) -> 3888.6389949999998 | G86: =SUM(OFFSET(R[-75]C,3,0,R7C1,1)) -> 3620.2031419999998 | K86: =SUM(OFFSET(R[-75]C,3,0,R7C1,1)) -> 269.58344000000005 | L86: =IF(SUM(OFFSET(R[-75]C,3,0,R7C1,1))=0,"",SUM(OFFSET(R[-75]C,3,0,R7C1,1))) -> 286.58393000000001 | N86: =IF(SUM(OFFSET(R[-75]C,3,0,R7C1,1))=0,"",SUM(OFFSET(R[-75]C,3,0,R7C1,1))) -> 87.208513999999994 | Q86: =IF(SUM(OFFSET(R[-75]C,3,0,R7C1,1))=0,"",SUM(OFFSET(R[-75]C,3,0,R7C1,1))) -> 373.79244400000005 | R86: =IF(SUM(OFFSET(R[-75]C,3,0,R7C1,1))=0,"",SUM(OFFSET(R[-75]C,3,0,R7C1,1))) -> 24.889636000000003 | S86: =SUM(OFFSET(R[-75]C,3,0,R7C1,1)) -> 119.74883000000001 | T86: =SUM(OFFSET(R[-75]C,3,0,R7C1,1)) -> 93.662990244699387 | W86: =SUM(OFFSET(R[-75]C,3,0,R7C1,1)) -> 19.147846801679588 | X86: =SUM(OFFSET(R[-75]C,3,0,R7C1,1)) -> 13.424958460428336
AC87: Досчёт | AF87: =R[1]C[-28] -> 0 | AI87: =R[1]C[-28] -> 0 | AM87: =R[1]C[-28] -> 0 | AN87: =R[1]C[-28] -> 0 | AQ87: =R[1]C[-29] -> 0 | AU87: =R[1]C[-30] -> 0 | AV87: =R[1]C[-30] -> 0 | AW87: =R[1]C[-30] -> 0
A88: 11дн=264ч 4дн=96ч | B88: Досчёт до конца м-ца (+) | C88: =R6C1*24 -> 216 | T88: № 05769 | AC88: Снятие | AF88: =-R[1]C[-28] -> 0 | AI88: =-R[1]C[-28] -> 0 | AM88: =-R[1]C[-28] -> 0 | AN88: =-R[1]C[-28] -> 0 | AQ88: =-R[1]C[-29] -> 0 | AU88: =-R[1]C[-30] -> 0 | AV88: =-R[1]C[-30] -> 0 | AW88: =-R[1]C[-30] -> 0
A89: 9дн=216ч 7дн=168ч | B89: Вычет с предыдущего (-) | C89: =R4C1*24 -> 192 | AC89: Сумма | AF89: =R[1]C[-28] -> 3888.6389949999998 | AI89: =R[1]C[-28] -> 3620.2031419999998 | AM89: =R[1]C[-28] -> 269.58344000000005 | AN89: =R[1]C[-28] -> 286.58393000000001 | AQ89: =R[1]C[-29] -> 87.208513999999994 | AU89: =R[1]C[-30] -> 373.79244400000005 | AV89: =R[1]C[-30] -> 24.889636000000003 | AW89: =R[1]C[-30] -> 119.74883000000001
B90: СУММА: | C90: =R[-4]C+R[-2]C-R[-1]C -> 744 | D90: =R[-4]C+R[-2]C-R[-1]C -> 3888.6389949999998 | G90: =R[-4]C+R[-2]C-R[-1]C -> 3620.2031419999998 | K90: =R[-4]C+R[-2]C-R[-1]C -> 269.58344000000005 | L90: =IF(SUM(OFFSET(R[-79]C,3,0,R7C1,1))=0,"",(R[-4]C+R[-2]C-R[-1]C)) -> 286.58393000000001 | N90: =IF(SUM(OFFSET(R[-79]C,3,0,R7C1,1))=0,"",(R[-4]C+R[-2]C-R[-1]C)) -> 87.208513999999994 | Q90: =IF(SUM(OFFSET(R[-79]C,3,0,R7C1,1))=0,"",(R[-4]C+R[-2]C-R[-1]C)) -> 373.79244400000005 | R90: =IF(SUM(OFFSET(R[-79]C,3,0,R7C1,1))=0,"",(R[-4]C+R[-2]C-R[-1]C)) -> 24.889636000000003 | S90: =R[-4]C+R[-2]C-R[-1]C -> 119.74883000000001
AC91: Тхв на источнике | AE91: V гвс (м3) | AF91: =R[-2]C[15] -> 373.79244400000005 | AG91: W гвс (Гкал) | AH91: =RC[-2]*0.06 -> 22.427546640000003 | AI91: W без гвс (Гкал) | AJ91: =R[-2]C[13]-RC[-2] -> 97.32128336000001
B92: Показания счетчиков на момент снятия данных:
B93: Дата, время | D93: М1, т | F93: М2, т | H93: М3, т | J93: М4, т | L93: Qо, Гкал | N93: Qг, Гкал | P93: время, час
B94: 23.09.18 00:00 | D94: 59617.718699999998 | F94: 51072.2163 | H94: 7391.0462900000002 | J94: 2032.22622 | L94: 2388.6195699999998 | N94: 687.89484000000004 | P94: -
B95: 18.10.18 06:00 | D95: 62843.818149999999 | F95: 54072.740210000004 | H95: 7626.6187 | J95: 2103.41599 | L95: 2488.6014500000001 | N95: 708.65728000000001 | P95: -
AC97: =ZAYAVKA_N -> з.н д. №02/147-2783 от 04.10.18 В данном отчете ГВС суммируется
B98: Представитель потребителя:_______________________________________________________________________ В.О. Топорков
I101: Рекомендуемые значения по параметрам теплопотребления (не являются официально утверждёнными)
I102: М, т | J102: V, м3 | K102: Qгвс, Гкал | L102: Qотоп, Гкал | M102: Qо, Гкал
I103: =R[-13]C[-3] -> 0 | J103: =RC[-1]/0.98 -> 0 | K103: =RC[-1]*0.06 -> 0 | L103: =RC[1]-RC[-1] -> 24.889636000000003 | M103: =R[-13]C[5] -> 24.889636000000003
O105: ДЛЯ САМОКОНТРОЛЯ
B106: В строке выбора дат указать период с 16.7.13 по 23.8.13 - жильё | N106: Q | O106: Qг
B107: В строке выбора дат указать период с 18.7.13 по 25.8.13 - не жилое | N107: =(R[-21]C[-10]*R[-22]C[-7]-R[-21]C[-9]*R[-22]C[-6])/1000 -> 469.2554369267574 | O107: =IF(R[-22]C[-2]="",R[-21]C[-3]*R[-22]C/1000,"") ->  | P107: Си2
O108: =IF(R[-23]C[-2]="","",((R[-22]C[-3]*R[-23]C)-(R[-22]C[-2]*R[-23]C[2]))/1000) -> 19.198194192968259 | P108: Си3