Sheet: Лист1
G1: Отчёт о теплопотреблении за октябрь 2018 | M1: з.н д. №02/147-2783 от 04.10.18 25.09.18г, 27.09.18г, 17.10.18г, с 19.10.18г по 22.10.18г, 17.10.18г, с 19.10.18г по 22.10.18г некорректная работа приборов
A4: =EOMONTH(R[9]C,0)-R[9]C -> 8 | B4: Потребитель: ЗАО "Сити Сервис"
A5: =MAX(R[9]C:R[78]C) -> 2018-10-22T00:00:00.000 | B5: Адрес: г. СПб, Кораблестроителей ул., д.35 к.4
A6: =EOMONTH(R[-1]C,0)-R[-1]C -> 9 | B6: Телефон: 8-911-021-19-79
A7: =R[-2]C-R[6]C -> 30 | B7: Договор 10023-2 (.) 413
A8: 7 | B8: Тепловычислитель: ВКТ-7 № 30155 | L8: М2 мах= | M8: 153.12 | O8: Мгвс мах= | P8: 38.4
L9: Qотоп мах= | M9: 12.24 | O9: Qгвс мах= | P9: 2.4
B10: Расчётная формула: Q=M1*(h1-hхв)-M2*(h2-hхв)
D12: Учет | L12: Контроль
A13: =R[1]C[1]-1 -> 2018-09-22T00:00:00.000 | B13: Дата | C13: N, ч | D13: M1, т | E13: T1, С | F13: P1, кг/см2 | G13: M2, т | H13: T2, С | I13: P2, кг/см2 | J13: dT, С | K13: M1-М2, т | L13: V3, м3 | M13: T3, С | N13: V4, м3 | O13: =IF(R[-12]C[-14]="м.куб","","T4, С") -> T4, С | P13: dT, С | Q13: V3-V4, м3 | R13: Qгвс, Гкал | S13: Qобщ., Гкал | T13: Q | U13: M3 | V13: M4 | W13: си2 | X13: си3 | Y13: Разб. | Z13: dM2 | AC13: Дата | AD13: НС | AE13: n, ч | AF13: М1, т | AG13: t1, гр. С | AH13: Р1, кгс/см2 | AI13: М2, т | AJ13: t2, гр. С | AK13: Р2, кгс/см2 | AL13: t1-t2, гр. С | AM13: М1-М2, т | AN13: М1гвс, т | AO13: t1гвс, гр. С | AP13: Р1гвс, кгс/см2 | AQ13: М2гвс, т | AR13: t2гвс, гр. С | AS13: Р2гвс, кгс/см2 | AT13: t1гвс-t2гвс | AU13: М1гвс-М2гвс, т | AV13: Wгвс, Гкал | AW13: Wсумм, Гкал | AY13: NS_TV1 | AZ13: НС | BA13: NS_TV2
A14: =IF(RC[1]="","",DATEVALUE(RC[1])) -> 43366 | B14: 23.09.18 | C14: 24 | D14: 13.74 | E14: 69.44 | F14: 7.24 | G14: 0 | H14: 28.61 | I14: 4.74 | J14: =RC[-5]-RC[-2] -> 40.83 | K14: 13.74 | L14: 14.31 | M14: 68.87 | R14: 0.96599999999999997 | S14: =RC[-1] -> 0.96599999999999997 | T14: =(RC[-16]*RC[-15]-RC[-13]*RC[-12])/1000 -> 0.9541056 | U14: 14.02 | V14: - | W14: =RC[-2]*RC[-10]/1000 -> 0.96555740000000001 | X14: =ABS((RC[-3]*RC[-11]-RC[-2]*RC[-9])/1000) -> #VALUE! | Y14: =(RC[-14]-RC[1])/RC[-18]*100 -> #DIV/0! | Z14: 14.02 | AC14: =VALUE(RC[-27]) -> 2018-09-23T00:00:00.000 | AD14: =IF(RC[21]=42,"*",IF(RC[21]=32,"",RC[21])) -> - | AE14: =RC[-28] -> 24 | AF14: =RC[-28] -> 13.74 | AG14: =RC[-28] -> 69.44 | AH14: =RC[-28] -> 7.24 | AI14: =RC[-28] -> 0 | AJ14: =RC[-28] -> 28.61 | AK14: =RC[-28] -> 4.74 | AL14: =RC[-28] -> 40.83 | AM14: =RC[-28] -> 13.74 | AN14: =RC[-28] -> 14.31 | AO14: =RC[-28] -> 68.87 | AP14: - | AQ14: =RC[-29] -> 0 | AR14: =RC[-29] -> 0 | AS14: - | AT14: =RC[-30] -> 0 | AU14: =RC[-30] -> 0 | AV14: =RC[-30] -> 0.96599999999999997 | AW14: =RC[-30] -> 0.96599999999999997 | AY14: - | AZ14: - | BA14: -
A15: =IF(RC[1]="","",DATEVALUE(RC[1])) -> 43367 | B15: 24.09.18 | C15: 24 | D15: 14 | E15: 68.19 | F15: 7.36 | G15: 0 | H15: 28.02 | I15: 5.21 | J15: =RC[-5]-RC[-2] -> 40.17 | K15: 14 | L15: 14.59 | M15: 67.569999999999993 | R15: 0.96599999999999997 | S15: =RC[-1] -> 0.96599999999999997 | T15: =(RC[-16]*RC[-15]-RC[-13]*RC[-12])/1000 -> 0.95465999999999995 | U15: 14.31 | V15: - | W15: =RC[-2]*RC[-10]/1000 -> 0.96692670000000003 | X15: =ABS((RC[-3]*RC[-11]-RC[-2]*RC[-9])/1000) -> #VALUE! | Y15: =(RC[-14]-RC[1])/RC[-18]*100 -> #DIV/0! | Z15: 14.31 | AC15: =VALUE(RC[-27]) -> 2018-09-24T00:00:00.000 | AD15: =IF(RC[21]=42,"*",IF(RC[21]=32,"",RC[21])) -> - | AE15: =RC[-28] -> 24 | AF15: =RC[-28] -> 14 | AG15: =RC[-28] -> 68.19 | AH15: =RC[-28] -> 7.36 | AI15: =RC[-28] -> 0 | AJ15: =RC[-28] -> 28.02 | AK15: =RC[-28] -> 5.21 | AL15: =RC[-28] -> 40.17 | AM15: =RC[-28] -> 14 | AN15: =RC[-28] -> 14.59 | AO15: =RC[-28] -> 67.569999999999993 | AP15: - | AQ15: =RC[-29] -> 0 | AR15: =RC[-29] -> 0 | AS15: - | AT15: =RC[-30] -> 0 | AU15: =RC[-30] -> 0 | AV15: =RC[-30] -> 0.96599999999999997 | AW15: =RC[-30] -> 0.96599999999999997 | AY15: - | AZ15: - | BA15: -
A16: =IF(RC[1]="","",DATEVALUE(RC[1])) -> 43368 | B16: 25.09.18 | C16: 24 | D16: 13.22 | E16: 66.52 | F16: 7.41 | G16: 2.08 | H16: 66.239999999999995 | I16: 5.61 | J16: =RC[-5]-RC[-2] -> 0.28000000000000114 | K16: 11.14 | L16: 14.69 | M16: 66.5 | R16: =RC[5] -> 0.976885 | S16: =RC[-1] -> 0.976885 | T16: =(RC[-16]*RC[-15]-RC[-13]*RC[-12])/1000 -> 0.74161519999999992 | U16: 14.69 | V16: - | W16: =RC[-2]*RC[-10]/1000 -> 0.976885 | X16: =ABS((RC[-3]*RC[-11]-RC[-2]*RC[-9])/1000) -> #VALUE! | Y16: =(RC[-14]-RC[1])/RC[-18]*100 -> -170.67307692307688 | Z16: 14.69 | AC16: =VALUE(RC[-27]) -> 2018-09-25T00:00:00.000 | AD16: =IF(RC[21]=42,"*",IF(RC[21]=32,"",RC[21])) -> - | AE16: =RC[-28] -> 24 | AF16: =RC[-28] -> 13.22 | AG16: =RC[-28] -> 66.52 | AH16: =RC[-28] -> 7.41 | AI16: =RC[-28] -> 2.08 | AJ16: =RC[-28] -> 66.239999999999995 | AK16: =RC[-28] -> 5.61 | AL16: =RC[-28] -> 0.28000000000000114 | AM16: =RC[-28] -> 11.14 | AN16: =RC[-28] -> 14.69 | AO16: =RC[-28] -> 66.5 | AP16: - | AQ16: =RC[-29] -> 0 | AR16: =RC[-29] -> 0 | AS16: - | AT16: =RC[-30] -> 0 | AU16: =RC[-30] -> 0 | AV16: =RC[-30] -> 0.976885 | AW16: =RC[-30] -> 0.976885 | AY16: - | AZ16: - | BA16: -
A17: =IF(RC[1]="","",DATEVALUE(RC[1])) -> 43369 | B17: 26.09.18 | C17: 24 | D17: 14.38 | E17: 65.97 | F17: 7.22 | G17: 0 | H17: 27.19 | I17: 5.49 | J17: =RC[-5]-RC[-2] -> 38.78 | K17: 14.38 | L17: 14.87 | M17: 65.48 | R17: 0.95799999999999996 | S17: =RC[-1] -> 0.95799999999999996 | T17: =(RC[-16]*RC[-15]-RC[-13]*RC[-12])/1000 -> 0.94864859999999995 | U17: 14.59 | V17: - | W17: =RC[-2]*RC[-10]/1000 -> 0.95535320000000001 | X17: =ABS((RC[-3]*RC[-11]-RC[-2]*RC[-9])/1000) -> #VALUE! | Y17: =(RC[-14]-RC[1])/RC[-18]*100 -> #DIV/0! | Z17: 14.59 | AC17: =VALUE(RC[-27]) -> 2018-09-26T00:00:00.000 | AD17: =IF(RC[21]=42,"*",IF(RC[21]=32,"",RC[21])) -> - | AE17: =RC[-28] -> 24 | AF17: =RC[-28] -> 14.38 | AG17: =RC[-28] -> 65.97 | AH17: =RC[-28] -> 7.22 | AI17: =RC[-28] -> 0 | AJ17: =RC[-28] -> 27.19 | AK17: =RC[-28] -> 5.49 | AL17: =RC[-28] -> 38.78 | AM17: =RC[-28] -> 14.38 | AN17: =RC[-28] -> 14.87 | AO17: =RC[-28] -> 65.48 | AP17: - | AQ17: =RC[-29] -> 0 | AR17: =RC[-29] -> 0 | AS17: - | AT17: =RC[-30] -> 0 | AU17: =RC[-30] -> 0 | AV17: =RC[-30] -> 0.95799999999999996 | AW17: =RC[-30] -> 0.95799999999999996 | AY17: - | AZ17: - | BA17: -
A18: =IF(RC[1]="","",DATEVALUE(RC[1])) -> 43370 | B18: 27.09.18 | C18: 24 | D18: 14.05 | E18: 62.07 | F18: 7.14 | G18: 0.02 | H18: 39.380000000000003 | I18: 5.65 | J18: =RC[-5]-RC[-2] -> 22.689999999999998 | K18: 14.03 | L18: =AVERAGE(R[1]C:R[3]C) -> 14.69 | M18: 60.58 | R18: =RC[5] -> 0.88992019999999994 | S18: =RC[-1] -> 0.88992019999999994 | T18: =(RC[-16]*RC[-15]-RC[-13]*RC[-12])/1000 -> 0.87129590000000012 | U18: 14.69 | V18: - | W18: =RC[-2]*RC[-10]/1000 -> 0.88992019999999994 | X18: =ABS((RC[-3]*RC[-11]-RC[-2]*RC[-9])/1000) -> #VALUE! | Y18: =(RC[-14]-RC[1])/RC[-18]*100 -> -3300.0000000000009 | Z18: 14.69 | AC18: =VALUE(RC[-27]) -> 2018-09-27T00:00:00.000 | AD18: =IF(RC[21]=42,"*",IF(RC[21]=32,"",RC[21])) -> - | AE18: =RC[-28] -> 24 | AF18: =RC[-28] -> 14.05 | AG18: =RC[-28] -> 62.07 | AH18: =RC[-28] -> 7.14 | AI18: =RC[-28] -> 0.02 | AJ18: =RC[-28] -> 39.380000000000003 | AK18: =RC[-28] -> 5.65 | AL18: =RC[-28] -> 22.689999999999998 | AM18: =RC[-28] -> 14.03 | AN18: =RC[-28] -> 14.69 | AO18: =RC[-28] -> 60.58 | AP18: - | AQ18: =RC[-29] -> 0 | AR18: =RC[-29] -> 0 | AS18: - | AT18: =RC[-30] -> 0 | AU18: =RC[-30] -> 0 | AV18: =RC[-30] -> 0.88992019999999994 | AW18: =RC[-30] -> 0.88992019999999994 | AY18: - | AZ18: - | BA18: -
A19: =IF(RC[1]="","",DATEVALUE(RC[1])) -> 43371 | B19: 28.09.18 | C19: 24 | D19: 88.69 | E19: 68.209999999999994 | F19: 7.17 | G19: 72.510000000000005 | H19: 56.49 | I19: 5.8 | J19: =RC[-5]-RC[-2] -> 11.719999999999992 | K19: 16.18 | L19: 14.47 | M19: 67.010000000000005 | R19: 0.95 | S19: 1.958 | T19: =(RC[-16]*RC[-15]-RC[-13]*RC[-12])/1000 -> 1.9534549999999982 | U19: 14.16 | V19: - | W19: =RC[-2]*RC[-10]/1000 -> 0.94886160000000008 | X19: =ABS((RC[-3]*RC[-11]-RC[-2]*RC[-9])/1000) -> #VALUE! | Y19: =(RC[-14]-RC[1])/RC[-18]*100 -> 2.785822645152392 | Z19: 14.16 | AC19: =VALUE(RC[-27]) -> 2018-09-28T00:00:00.000 | AD19: =IF(RC[21]=42,"*",IF(RC[21]=32,"",RC[21])) -> - | AE19: =RC[-28] -> 24 | AF19: =RC[-28] -> 88.69 | AG19: =RC[-28] -> 68.209999999999994 | AH19: =RC[-28] -> 7.17 | AI19: =RC[-28] -> 72.510000000000005 | AJ19: =RC[-28] -> 56.49 | AK19: =RC[-28] -> 5.8 | AL19: =RC[-28] -> 11.719999999999992 | AM19: =RC[-28] -> 16.18 | AN19: =RC[-28] -> 14.47 | AO19: =RC[-28] -> 67.010000000000005 | AP19: - | AQ19: =RC[-29] -> 0 | AR19: =RC[-29] -> 0 | AS19: - | AT19: =RC[-30] -> 0 | AU19: =RC[-30] -> 0 | AV19: =RC[-30] -> 0.95 | AW19: =RC[-30] -> 1.958 | AY19: - | AZ19: - | BA19: -
A20: =IF(RC[1]="","",DATEVALUE(RC[1])) -> 43372 | B20: 29.09.18 | C20: 24 | D20: 190.95 | E20: 67.69 | F20: 7.64 | G20: 170.36 | H20: 44.99 | I20: 6.11 | J20: =RC[-5]-RC[-2] -> 22.699999999999996 | K20: 20.59 | L20: 14.36 | M20: 67.319999999999993 | R20: 0.94799999999999995 | S20: 5.2610000000000001 | T20: =(RC[-16]*RC[-15]-RC[-13]*RC[-12])/1000 -> 5.2609090999999983 | U20: 14.08 | V20: - | W20: =RC[-2]*RC[-10]/1000 -> 0.94786559999999986 | X20: =ABS((RC[-3]*RC[-11]-RC[-2]*RC[-9])/1000) -> #VALUE! | Y20: =(RC[-14]-RC[1])/RC[-18]*100 -> 3.821319558581826 | Z20: 14.08 | AC20: =VALUE(RC[-27]) -> 2018-09-29T00:00:00.000 | AD20: =IF(RC[21]=42,"*",IF(RC[21]=32,"",RC[21])) -> - | AE20: =RC[-28] -> 24 | AF20: =RC[-28] -> 190.95 | AG20: =RC[-28] -> 67.69 | AH20: =RC[-28] -> 7.64 | AI20: =RC[-28] -> 170.36 | AJ20: =RC[-28] -> 44.99 | AK20: =RC[-28] -> 6.11 | AL20: =RC[-28] -> 22.699999999999996 | AM20: =RC[-28] -> 20.59 | AN20: =RC[-28] -> 14.36 | AO20: =RC[-28] -> 67.319999999999993 | AP20: - | AQ20: =RC[-29] -> 0 | AR20: =RC[-29] -> 0 | AS20: - | AT20: =RC[-30] -> 0 | AU20: =RC[-30] -> 0 | AV20: =RC[-30] -> 0.94799999999999995 | AW20: =RC[-30] -> 5.2610000000000001 | AY20: - | AZ20: - | BA20: -
A21: =IF(RC[1]="","",DATEVALUE(RC[1])) -> 43373 | B21: 30.09.18 | C21: 24 | D21: 195.46 | E21: 69.97 | F21: 7.47 | G21: 174.51 | H21: 47.15 | I21: 5.9 | J21: =RC[-5]-RC[-2] -> 22.82 | K21: 20.95 | L21: 15.24 | M21: 70.12 | R21: 1.046 | S21: 5.4509999999999996 | T21: =(RC[-16]*RC[-15]-RC[-13]*RC[-12])/1000 -> 5.4481897000000012 | U21: 14.91 | V21: - | W21: =RC[-2]*RC[-10]/1000 -> 1.0454892 | X21: =ABS((RC[-3]*RC[-11]-RC[-2]*RC[-9])/1000) -> #VALUE! | Y21: =(RC[-14]-RC[1])/RC[-18]*100 -> 3.4611197066070707 | Z21: 14.91 | AC21: =VALUE(RC[-27]) -> 2018-09-30T00:00:00.000 | AD21: =IF(RC[21]=42,"*",IF(RC[21]=32,"",RC[21])) -> - | AE21: =RC[-28] -> 24 | AF21: =RC[-28] -> 195.46 | AG21: =RC[-28] -> 69.97 | AH21: =RC[-28] -> 7.47 | AI21: =RC[-28] -> 174.51 | AJ21: =RC[-28] -> 47.15 | AK21: =RC[-28] -> 5.9 | AL21: =RC[-28] -> 22.82 | AM21: =RC[-28] -> 20.95 | AN21: =RC[-28] -> 15.24 | AO21: =RC[-28] -> 70.12 | AP21: - | AQ21: =RC[-29] -> 0 | AR21: =RC[-29] -> 0 | AS21: - | AT21: =RC[-30] -> 0 | AU21: =RC[-30] -> 0 | AV21: =RC[-30] -> 1.046 | AW21: =RC[-30] -> 5.4509999999999996 | AY21: - | AZ21: - | BA21: -
A22: =IF(RC[1]="","",DATEVALUE(RC[1])) -> 43374 | B22: 01.10.18 | C22: 24 | D22: 186.26 | E22: 68.67 | F22: 7.47 | G22: 167.75 | H22: 46.82 | I22: 6.03 | J22: =RC[-5]-RC[-2] -> 21.85 | K22: 18.510000000000002 | L22: 13.24 | M22: 68.28 | R22: 0.88400000000000001 | S22: 4.9390000000000001 | T22: =(RC[-16]*RC[-15]-RC[-13]*RC[-12])/1000 -> 4.9364192000000005 | U22: 12.97 | V22: - | W22: =RC[-2]*RC[-10]/1000 -> 0.88559160000000003 | X22: =ABS((RC[-3]*RC[-11]-RC[-2]*RC[-9])/1000) -> #VALUE! | Y22: =(RC[-14]-RC[1])/RC[-18]*100 -> 3.3025335320417293 | Z22: 12.97 | AC22: =VALUE(RC[-27]) -> 2018-10-01T00:00:00.000 | AD22: =IF(RC[21]=42,"*",IF(RC[21]=32,"",RC[21])) -> - | AE22: =RC[-28] -> 24 | AF22: =RC[-28] -> 186.26 | AG22: =RC[-28] -> 68.67 | AH22: =RC[-28] -> 7.47 | AI22: =RC[-28] -> 167.75 | AJ22: =RC[-28] -> 46.82 | AK22: =RC[-28] -> 6.03 | AL22: =RC[-28] -> 21.85 | AM22: =RC[-28] -> 18.510000000000002 | AN22: =RC[-28] -> 13.24 | AO22: =RC[-28] -> 68.28 | AP22: - | AQ22: =RC[-29] -> 0 | AR22: =RC[-29] -> 0 | AS22: - | AT22: =RC[-30] -> 0 | AU22: =RC[-30] -> 0 | AV22: =RC[-30] -> 0.88400000000000001 | AW22: =RC[-30] -> 4.9390000000000001 | AY22: - | AZ22: - | BA22: -
A23: =IF(RC[1]="","",DATEVALUE(RC[1])) -> 43375 | B23: 02.10.18 | C23: 24 | D23: 186.88 | E23: 67.5 | F23: 7.48 | G23: 167.49 | H23: 46.45 | I23: 5.99 | J23: =RC[-5]-RC[-2] -> 21.049999999999997 | K23: 19.39 | L23: 14.05 | M23: 67.31 | R23: 0.92800000000000005 | S23: 4.8339999999999996 | T23: =(RC[-16]*RC[-15]-RC[-13]*RC[-12])/1000 -> 4.8344894999999983 | U23: 13.78 | V23: - | W23: =RC[-2]*RC[-10]/1000 -> 0.92753180000000002 | X23: =ABS((RC[-3]*RC[-11]-RC[-2]*RC[-9])/1000) -> #VALUE! | Y23: =(RC[-14]-RC[1])/RC[-18]*100 -> 3.3494536987282828 | Z23: 13.78 | AC23: =VALUE(RC[-27]) -> 2018-10-02T00:00:00.000 | AD23: =IF(RC[21]=42,"*",IF(RC[21]=32,"",RC[21])) -> - | AE23: =RC[-28] -> 24 | AF23: =RC[-28] -> 186.88 | AG23: =RC[-28] -> 67.5 | AH23: =RC[-28] -> 7.48 | AI23: =RC[-28] -> 167.49 | AJ23: =RC[-28] -> 46.45 | AK23: =RC[-28] -> 5.99 | AL23: =RC[-28] -> 21.049999999999997 | AM23: =RC[-28] -> 19.39 | AN23: =RC[-28] -> 14.05 | AO23: =RC[-28] -> 67.31 | AP23: - | AQ23: =RC[-29] -> 0 | AR23: =RC[-29] -> 0 | AS23: - | AT23: =RC[-30] -> 0 | AU23: =RC[-30] -> 0 | AV23: =RC[-30] -> 0.92800000000000005 | AW23: =RC[-30] -> 4.8339999999999996 | AY23: - | AZ23: - | BA23: -
A24: =IF(RC[1]="","",DATEVALUE(RC[1])) -> 43376 | B24: 03.10.18 | C24: 24 | D24: 185.38 | E24: 67.650000000000006 | F24: 7.4 | G24: 167.15 | H24: 46.56 | I24: 5.99 | J24: =RC[-5]-RC[-2] -> 21.090000000000003 | K24: 18.23 | L24: 12.77 | M24: 67.52 | R24: 0.84399999999999997 | S24: 4.7590000000000003 | T24: =(RC[-16]*RC[-15]-RC[-13]*RC[-12])/1000 -> 4.7584529999999994 | U24: 12.52 | V24: - | W24: =RC[-2]*RC[-10]/1000 -> 0.84535039999999995 | X24: =ABS((RC[-3]*RC[-11]-RC[-2]*RC[-9])/1000) -> #VALUE! | Y24: =(RC[-14]-RC[1])/RC[-18]*100 -> 3.4160933293448998 | Z24: 12.52 | AC24: =VALUE(RC[-27]) -> 2018-10-03T00:00:00.000 | AD24: =IF(RC[21]=42,"*",IF(RC[21]=32,"",RC[21])) -> - | AE24: =RC[-28] -> 24 | AF24: =RC[-28] -> 185.38 | AG24: =RC[-28] -> 67.650000000000006 | AH24: =RC[-28] -> 7.4 | AI24: =RC[-28] -> 167.15 | AJ24: =RC[-28] -> 46.56 | AK24: =RC[-28] -> 5.99 | AL24: =RC[-28] -> 21.090000000000003 | AM24: =RC[-28] -> 18.23 | AN24: =RC[-28] -> 12.77 | AO24: =RC[-28] -> 67.52 | AP24: - | AQ24: =RC[-29] -> 0 | AR24: =RC[-29] -> 0 | AS24: - | AT24: =RC[-30] -> 0 | AU24: =RC[-30] -> 0 | AV24: =RC[-30] -> 0.84399999999999997 | AW24: =RC[-30] -> 4.7590000000000003 | AY24: - | AZ24: - | BA24: -
A25: =IF(RC[1]="","",DATEVALUE(RC[1])) -> 43377 | B25: 04.10.18 | C25: 24 | D25: 183.54 | E25: 67.03 | F25: 7.27 | G25: 164.54 | H25: 45.82 | I25: 5.86 | J25: =RC[-5]-RC[-2] -> 21.21 | K25: 19 | L25: 13.67 | M25: 66.849999999999994 | R25: 0.89500000000000002 | S25: 4.7640000000000002 | T25: =(RC[-16]*RC[-15]-RC[-13]*RC[-12])/1000 -> 4.7634634000000009 | U25: 13.4 | V25: - | W25: =RC[-2]*RC[-10]/1000 -> 0.89578999999999998 | X25: =ABS((RC[-3]*RC[-11]-RC[-2]*RC[-9])/1000) -> #VALUE! | Y25: =(RC[-14]-RC[1])/RC[-18]*100 -> 3.403427737936064 | Z25: 13.4 | AC25: =VALUE(RC[-27]) -> 2018-10-04T00:00:00.000 | AD25: =IF(RC[21]=42,"*",IF(RC[21]=32,"",RC[21])) -> - | AE25: =RC[-28] -> 24 | AF25: =RC[-28] -> 183.54 | AG25: =RC[-28] -> 67.03 | AH25: =RC[-28] -> 7.27 | AI25: =RC[-28] -> 164.54 | AJ25: =RC[-28] -> 45.82 | AK25: =RC[-28] -> 5.86 | AL25: =RC[-28] -> 21.21 | AM25: =RC[-28] -> 19 | AN25: =RC[-28] -> 13.67 | AO25: =RC[-28] -> 66.849999999999994 | AP25: - | AQ25: =RC[-29] -> 0 | AR25: =RC[-29] -> 0 | AS25: - | AT25: =RC[-30] -> 0 | AU25: =RC[-30] -> 0 | AV25: =RC[-30] -> 0.89500000000000002 | AW25: =RC[-30] -> 4.7640000000000002 | AY25: - | AZ25: - | BA25: -
A26: =IF(RC[1]="","",DATEVALUE(RC[1])) -> 43378 | B26: 05.10.18 | C26: 24 | D26: 183.99 | E26: 66.39 | F26: 7.34 | G26: 165.47 | H26: 45.47 | I26: 5.87 | J26: =RC[-5]-RC[-2] -> 20.92 | K26: 18.52 | L26: 13.36 | M26: 66.27 | R26: 0.86899999999999999 | S26: 4.6900000000000004 | T26: =(RC[-16]*RC[-15]-RC[-13]*RC[-12])/1000 -> 4.6911752000000009 | U26: 13.12 | V26: - | W26: =RC[-2]*RC[-10]/1000 -> 0.86946239999999986 | X26: =ABS((RC[-3]*RC[-11]-RC[-2]*RC[-9])/1000) -> #VALUE! | Y26: =(RC[-14]-RC[1])/RC[-18]*100 -> 3.2634314377228502 | Z26: 13.12 | AC26: =VALUE(RC[-27]) -> 2018-10-05T00:00:00.000 | AD26: =IF(RC[21]=42,"*",IF(RC[21]=32,"",RC[21])) -> - | AE26: =RC[-28] -> 24 | AF26: =RC[-28] -> 183.99 | AG26: =RC[-28] -> 66.39 | AH26: =RC[-28] -> 7.34 | AI26: =RC[-28] -> 165.47 | AJ26: =RC[-28] -> 45.47 | AK26: =RC[-28] -> 5.87 | AL26: =RC[-28] -> 20.92 | AM26: =RC[-28] -> 18.52 | AN26: =RC[-28] -> 13.36 | AO26: =RC[-28] -> 66.27 | AP26: - | AQ26: =RC[-29] -> 0 | AR26: =RC[-29] -> 0 | AS26: - | AT26: =RC[-30] -> 0 | AU26: =RC[-30] -> 0 | AV26: =RC[-30] -> 0.86899999999999999 | AW26: =RC[-30] -> 4.6900000000000004 | AY26: - | AZ26: - | BA26: -
A27: =IF(RC[1]="","",DATEVALUE(RC[1])) -> 43379 | B27: 06.10.18 | C27: 24 | D27: 180.21 | E27: 67.099999999999994 | F27: 7.21 | G27: 161.51 | H27: 45.8 | I27: 5.85 | J27: =RC[-5]-RC[-2] -> 21.299999999999997 | K27: 18.7 | L27: 13.36 | M27: 67.13 | R27: 0.879 | S27: 4.6950000000000003 | T27: =(RC[-16]*RC[-15]-RC[-13]*RC[-12])/1000 -> 4.6949330000000007 | U27: 13.08 | V27: - | W27: =RC[-2]*RC[-10]/1000 -> 0.87806039999999996 | X27: =ABS((RC[-3]*RC[-11]-RC[-2]*RC[-9])/1000) -> #VALUE! | Y27: =(RC[-14]-RC[1])/RC[-18]*100 -> 3.4796607021237076 | Z27: 13.08 | AC27: =VALUE(RC[-27]) -> 2018-10-06T00:00:00.000 | AD27: =IF(RC[21]=42,"*",IF(RC[21]=32,"",RC[21])) -> - | AE27: =RC[-28] -> 24 | AF27: =RC[-28] -> 180.21 | AG27: =RC[-28] -> 67.099999999999994 | AH27: =RC[-28] -> 7.21 | AI27: =RC[-28] -> 161.51 | AJ27: =RC[-28] -> 45.8 | AK27: =RC[-28] -> 5.85 | AL27: =RC[-28] -> 21.299999999999997 | AM27: =RC[-28] -> 18.7 | AN27: =RC[-28] -> 13.36 | AO27: =RC[-28] -> 67.13 | AP27: - | AQ27: =RC[-29] -> 0 | AR27: =RC[-29] -> 0 | AS27: - | AT27: =RC[-30] -> 0 | AU27: =RC[-30] -> 0 | AV27: =RC[-30] -> 0.879 | AW27: =RC[-30] -> 4.6950000000000003 | AY27: - | AZ27: - | BA27: -
A28: =IF(RC[1]="","",DATEVALUE(RC[1])) -> 43380 | B28: 07.10.18 | C28: 24 | D28: 182.62 | E28: 67.34 | F28: 7.38 | G28: 162.16999999999999 | H28: 46.06 | I28: 5.94 | J28: =RC[-5]-RC[-2] -> 21.28 | K28: 20.45 | L28: 15.55 | M28: 67.260000000000005 | R28: 1.026 | S28: 4.8280000000000003 | T28: =(RC[-16]*RC[-15]-RC[-13]*RC[-12])/1000 -> 4.8280806000000007 | U28: 15.24 | V28: - | W28: =RC[-2]*RC[-10]/1000 -> 1.0250424 | X28: =ABS((RC[-3]*RC[-11]-RC[-2]*RC[-9])/1000) -> #VALUE! | Y28: =(RC[-14]-RC[1])/RC[-18]*100 -> 3.2126780538940616 | Z28: 15.24 | AC28: =VALUE(RC[-27]) -> 2018-10-07T00:00:00.000 | AD28: =IF(RC[21]=42,"*",IF(RC[21]=32,"",RC[21])) -> - | AE28: =RC[-28] -> 24 | AF28: =RC[-28] -> 182.62 | AG28: =RC[-28] -> 67.34 | AH28: =RC[-28] -> 7.38 | AI28: =RC[-28] -> 162.16999999999999 | AJ28: =RC[-28] -> 46.06 | AK28: =RC[-28] -> 5.94 | AL28: =RC[-28] -> 21.28 | AM28: =RC[-28] -> 20.45 | AN28: =RC[-28] -> 15.55 | AO28: =RC[-28] -> 67.260000000000005 | AP28: - | AQ28: =RC[-29] -> 0 | AR28: =RC[-29] -> 0 | AS28: - | AT28: =RC[-30] -> 0 | AU28: =RC[-30] -> 0 | AV28: =RC[-30] -> 1.026 | AW28: =RC[-30] -> 4.8280000000000003 | AY28: - | AZ28: - | BA28: -
A29: =IF(RC[1]="","",DATEVALUE(RC[1])) -> 43381 | B29: 08.10.18 | C29: 24 | D29: 183.67 | E29: 67.33 | F29: 7.28 | G29: 164.36 | H29: 45.9 | I29: 5.82 | J29: =RC[-5]-RC[-2] -> 21.43 | K29: 19.309999999999999 | L29: 13.7 | M29: 67.23 | R29: 0.9 | S29: 4.8239999999999998 | T29: =(RC[-16]*RC[-15]-RC[-13]*RC[-12])/1000 -> 4.8223770999999989 | U29: 13.41 | V29: - | W29: =RC[-2]*RC[-10]/1000 -> 0.90155430000000003 | X29: =ABS((RC[-3]*RC[-11]-RC[-2]*RC[-9])/1000) -> #VALUE! | Y29: =(RC[-14]-RC[1])/RC[-18]*100 -> 3.5896811876368937 | Z29: 13.41 | AC29: =VALUE(RC[-27]) -> 2018-10-08T00:00:00.000 | AD29: =IF(RC[21]=42,"*",IF(RC[21]=32,"",RC[21])) -> - | AE29: =RC[-28] -> 24 | AF29: =RC[-28] -> 183.67 | AG29: =RC[-28] -> 67.33 | AH29: =RC[-28] -> 7.28 | AI29: =RC[-28] -> 164.36 | AJ29: =RC[-28] -> 45.9 | AK29: =RC[-28] -> 5.82 | AL29: =RC[-28] -> 21.43 | AM29: =RC[-28] -> 19.309999999999999 | AN29: =RC[-28] -> 13.7 | AO29: =RC[-28] -> 67.23 | AP29: - | AQ29: =RC[-29] -> 0 | AR29: =RC[-29] -> 0 | AS29: - | AT29: =RC[-30] -> 0 | AU29: =RC[-30] -> 0 | AV29: =RC[-30] -> 0.9 | AW29: =RC[-30] -> 4.8239999999999998 | AY29: - | AZ29: - | BA29: -
A30: =IF(RC[1]="","",DATEVALUE(RC[1])) -> 43382 | B30: 09.10.18 | C30: 24 | D30: 182.15 | E30: 67.19 | F30: 7.27 | G30: 163.07 | H30: 46.08 | I30: 5.86 | J30: =RC[-5]-RC[-2] -> 21.11 | K30: 19.079999999999998 | L30: 13.48 | M30: 67.19 | R30: 0.88800000000000001 | S30: 4.7220000000000004 | T30: =(RC[-16]*RC[-15]-RC[-13]*RC[-12])/1000 -> 4.7243928999999998 | U30: 13.21 | V30: - | W30: =RC[-2]*RC[-10]/1000 -> 0.88757990000000009 | X30: =ABS((RC[-3]*RC[-11]-RC[-2]*RC[-9])/1000) -> #VALUE! | Y30: =(RC[-14]-RC[1])/RC[-18]*100 -> 3.59968111853805 | Z30: 13.21 | AC30: =VALUE(RC[-27]) -> 2018-10-09T00:00:00.000 | AD30: =IF(RC[21]=42,"*",IF(RC[21]=32,"",RC[21])) -> - | AE30: =RC[-28] -> 24 | AF30: =RC[-28] -> 182.15 | AG30: =RC[-28] -> 67.19 | AH30: =RC[-28] -> 7.27 | AI30: =RC[-28] -> 163.07 | AJ30: =RC[-28] -> 46.08 | AK30: =RC[-28] -> 5.86 | AL30: =RC[-28] -> 21.11 | AM30: =RC[-28] -> 19.079999999999998 | AN30: =RC[-28] -> 13.48 | AO30: =RC[-28] -> 67.19 | AP30: - | AQ30: =RC[-29] -> 0 | AR30: =RC[-29] -> 0 | AS30: - | AT30: =RC[-30] -> 0 | AU30: =RC[-30] -> 0 | AV30: =RC[-30] -> 0.88800000000000001 | AW30: =RC[-30] -> 4.7220000000000004 | AY30: - | AZ30: - | BA30: -
A31: =IF(RC[1]="","",DATEVALUE(RC[1])) -> 43383 | B31: 10.10.18 | C31: 24 | D31: 180.12 | E31: 68.209999999999994 | F31: 7.3 | G31: 161.47999999999999 | H31: 46.97 | I31: 5.9 | J31: =RC[-5]-RC[-2] -> 21.239999999999995 | K31: 18.64 | L31: 13.28 | M31: 68.23 | R31: 0.88800000000000001 | S31: 4.7009999999999996 | T31: =(RC[-16]*RC[-15]-RC[-13]*RC[-12])/1000 -> 4.7012695999999998 | U31: 13.02 | V31: - | W31: =RC[-2]*RC[-10]/1000 -> 0.88835459999999999 | X31: =ABS((RC[-3]*RC[-11]-RC[-2]*RC[-9])/1000) -> #VALUE! | Y31: =(RC[-14]-RC[1])/RC[-18]*100 -> 3.4803071587812742 | Z31: 13.02 | AC31: =VALUE(RC[-27]) -> 2018-10-10T00:00:00.000 | AD31: =IF(RC[21]=42,"*",IF(RC[21]=32,"",RC[21])) -> - | AE31: =RC[-28] -> 24 | AF31: =RC[-28] -> 180.12 | AG31: =RC[-28] -> 68.209999999999994 | AH31: =RC[-28] -> 7.3 | AI31: =RC[-28] -> 161.47999999999999 | AJ31: =RC[-28] -> 46.97 | AK31: =RC[-28] -> 5.9 | AL31: =RC[-28] -> 21.239999999999995 | AM31: =RC[-28] -> 18.64 | AN31: =RC[-28] -> 13.28 | AO31: =RC[-28] -> 68.23 | AP31: - | AQ31: =RC[-29] -> 0 | AR31: =RC[-29] -> 0 | AS31: - | AT31: =RC[-30] -> 0 | AU31: =RC[-30] -> 0 | AV31: =RC[-30] -> 0.88800000000000001 | AW31: =RC[-30] -> 4.7009999999999996 | AY31: - | AZ31: - | BA31: -
A32: =IF(RC[1]="","",DATEVALUE(RC[1])) -> 43384 | B32: 11.10.18 | C32: 24 | D32: 184.11 | E32: 69.319999999999993 | F32: 7.28 | G32: 165.47 | H32: 48.3 | I32: 5.84 | J32: =RC[-5]-RC[-2] -> 21.019999999999996 | K32: 18.64 | L32: 13.31 | M32: 69.19 | R32: 0.90300000000000002 | S32: 4.7709999999999999 | T32: =(RC[-16]*RC[-15]-RC[-13]*RC[-12])/1000 -> 4.7703042000000009 | U32: 13.03 | V32: - | W32: =RC[-2]*RC[-10]/1000 -> 0.90154569999999989 | X32: =ABS((RC[-3]*RC[-11]-RC[-2]*RC[-9])/1000) -> #VALUE! | Y32: =(RC[-14]-RC[1])/RC[-18]*100 -> 3.3903426603009614 | Z32: 13.03 | AC32: =VALUE(RC[-27]) -> 2018-10-11T00:00:00.000 | AD32: =IF(RC[21]=42,"*",IF(RC[21]=32,"",RC[21])) -> - | AE32: =RC[-28] -> 24 | AF32: =RC[-28] -> 184.11 | AG32: =RC[-28] -> 69.319999999999993 | AH32: =RC[-28] -> 7.28 | AI32: =RC[-28] -> 165.47 | AJ32: =RC[-28] -> 48.3 | AK32: =RC[-28] -> 5.84 | AL32: =RC[-28] -> 21.019999999999996 | AM32: =RC[-28] -> 18.64 | AN32: =RC[-28] -> 13.31 | AO32: =RC[-28] -> 69.19 | AP32: - | AQ32: =RC[-29] -> 0 | AR32: =RC[-29] -> 0 | AS32: - | AT32: =RC[-30] -> 0 | AU32: =RC[-30] -> 0 | AV32: =RC[-30] -> 0.90300000000000002 | AW32: =RC[-30] -> 4.7709999999999999 | AY32: - | AZ32: - | BA32: -
A33: =IF(RC[1]="","",DATEVALUE(RC[1])) -> 43385 | B33: 12.10.18 | C33: 24 | D33: 184.53 | E33: 69.16 | F33: 7.23 | G33: 166.67 | H33: 48.19 | I33: 5.77 | J33: =RC[-5]-RC[-2] -> 20.97 | K33: 17.86 | L33: 12.14 | M33: 69.010000000000005 | R33: 0.82199999999999995 | S33: 4.7329999999999997 | T33: =(RC[-16]*RC[-15]-RC[-13]*RC[-12])/1000 -> 4.7302675000000001 | U33: 11.9 | V33: - | W33: =RC[-2]*RC[-10]/1000 -> 0.82121900000000003 | X33: =ABS((RC[-3]*RC[-11]-RC[-2]*RC[-9])/1000) -> #VALUE! | Y33: =(RC[-14]-RC[1])/RC[-18]*100 -> 3.5759284814303709 | Z33: 11.9 | AC33: =VALUE(RC[-27]) -> 2018-10-12T00:00:00.000 | AD33: =IF(RC[21]=42,"*",IF(RC[21]=32,"",RC[21])) -> - | AE33: =RC[-28] -> 24 | AF33: =RC[-28] -> 184.53 | AG33: =RC[-28] -> 69.16 | AH33: =RC[-28] -> 7.23 | AI33: =RC[-28] -> 166.67 | AJ33: =RC[-28] -> 48.19 | AK33: =RC[-28] -> 5.77 | AL33: =RC[-28] -> 20.97 | AM33: =RC[-28] -> 17.86 | AN33: =RC[-28] -> 12.14 | AO33: =RC[-28] -> 69.010000000000005 | AP33: - | AQ33: =RC[-29] -> 0 | AR33: =RC[-29] -> 0 | AS33: - | AT33: =RC[-30] -> 0 | AU33: =RC[-30] -> 0 | AV33: =RC[-30] -> 0.82199999999999995 | AW33: =RC[-30] -> 4.7329999999999997 | AY33: - | AZ33: - | BA33: -
A34: =IF(RC[1]="","",DATEVALUE(RC[1])) -> 43386 | B34: 13.10.18 | C34: 24 | D34: 185.33 | E34: 70.28 | F34: 7.32 | G34: 166.6 | H34: 48.95 | I34: 5.85 | J34: =RC[-5]-RC[-2] -> 21.33 | K34: 18.73 | L34: 13 | M34: 70.180000000000007 | R34: 0.89300000000000002 | S34: 4.8719999999999999 | T34: =(RC[-16]*RC[-15]-RC[-13]*RC[-12])/1000 -> 4.8699224000000001 | U34: 12.72 | V34: - | W34: =RC[-2]*RC[-10]/1000 -> 0.89268960000000019 | X34: =ABS((RC[-3]*RC[-11]-RC[-2]*RC[-9])/1000) -> #VALUE! | Y34: =(RC[-14]-RC[1])/RC[-18]*100 -> 3.6074429771908765 | Z34: 12.72 | AC34: =VALUE(RC[-27]) -> 2018-10-13T00:00:00.000 | AD34: =IF(RC[21]=42,"*",IF(RC[21]=32,"",RC[21])) -> - | AE34: =RC[-28] -> 24 | AF34: =RC[-28] -> 185.33 | AG34: =RC[-28] -> 70.28 | AH34: =RC[-28] -> 7.32 | AI34: =RC[-28] -> 166.6 | AJ34: =RC[-28] -> 48.95 | AK34: =RC[-28] -> 5.85 | AL34: =RC[-28] -> 21.33 | AM34: =RC[-28] -> 18.73 | AN34: =RC[-28] -> 13 | AO34: =RC[-28] -> 70.180000000000007 | AP34: - | AQ34: =RC[-29] -> 0 | AR34: =RC[-29] -> 0 | AS34: - | AT34: =RC[-30] -> 0 | AU34: =RC[-30] -> 0 | AV34: =RC[-30] -> 0.89300000000000002 | AW34: =RC[-30] -> 4.8719999999999999 | AY34: - | AZ34: - | BA34: -
A35: =IF(RC[1]="","",DATEVALUE(RC[1])) -> 43387 | B35: 14.10.18 | C35: 24 | D35: 186.39 | E35: 71.05 | F35: 7.2 | G35: 166.53 | H35: 49.34 | I35: 5.76 | J35: =RC[-5]-RC[-2] -> 21.709999999999994 | K35: 19.86 | L35: 13.83 | M35: 71.010000000000005 | R35: 0.96099999999999997 | S35: 5.0289999999999999 | T35: =(RC[-16]*RC[-15]-RC[-13]*RC[-12])/1000 -> 5.0264192999999979 | U35: 13.51 | V35: - | W35: =RC[-2]*RC[-10]/1000 -> 0.95934509999999995 | X35: =ABS((RC[-3]*RC[-11]-RC[-2]*RC[-9])/1000) -> #VALUE! | Y35: =(RC[-14]-RC[1])/RC[-18]*100 -> 3.8131267639464359 | Z35: 13.51 | AC35: =VALUE(RC[-27]) -> 2018-10-14T00:00:00.000 | AD35: =IF(RC[21]=42,"*",IF(RC[21]=32,"",RC[21])) -> - | AE35: =RC[-28] -> 24 | AF35: =RC[-28] -> 186.39 | AG35: =RC[-28] -> 71.05 | AH35: =RC[-28] -> 7.2 | AI35: =RC[-28] -> 166.53 | AJ35: =RC[-28] -> 49.34 | AK35: =RC[-28] -> 5.76 | AL35: =RC[-28] -> 21.709999999999994 | AM35: =RC[-28] -> 19.86 | AN35: =RC[-28] -> 13.83 | AO35: =RC[-28] -> 71.010000000000005 | AP35: - | AQ35: =RC[-29] -> 0 | AR35: =RC[-29] -> 0 | AS35: - | AT35: =RC[-30] -> 0 | AU35: =RC[-30] -> 0 | AV35: =RC[-30] -> 0.96099999999999997 | AW35: =RC[-30] -> 5.0289999999999999 | AY35: - | AZ35: - | BA35: -
A36: =IF(RC[1]="","",DATEVALUE(RC[1])) -> 43388 | B36: 15.10.18 | C36: 24 | D36: 184.57 | E36: 70.510000000000005 | F36: 7.08 | G36: 166.96 | H36: 49.38 | I36: 5.63 | J36: =RC[-5]-RC[-2] -> 21.130000000000003 | K36: 17.61 | L36: 12.41 | M36: 70.349999999999994 | R36: 0.85499999999999998 | S36: 4.7670000000000003 | T36: =(RC[-16]*RC[-15]-RC[-13]*RC[-12])/1000 -> 4.7695459000000007 | U36: 12.15 | V36: - | W36: =RC[-2]*RC[-10]/1000 -> 0.85475249999999992 | X36: =ABS((RC[-3]*RC[-11]-RC[-2]*RC[-9])/1000) -> #VALUE! | Y36: =(RC[-14]-RC[1])/RC[-18]*100 -> 3.2702443699089598 | Z36: 12.15 | AC36: =VALUE(RC[-27]) -> 2018-10-15T00:00:00.000 | AD36: =IF(RC[21]=42,"*",IF(RC[21]=32,"",RC[21])) -> - | AE36: =RC[-28] -> 24 | AF36: =RC[-28] -> 184.57 | AG36: =RC[-28] -> 70.510000000000005 | AH36: =RC[-28] -> 7.08 | AI36: =RC[-28] -> 166.96 | AJ36: =RC[-28] -> 49.38 | AK36: =RC[-28] -> 5.63 | AL36: =RC[-28] -> 21.130000000000003 | AM36: =RC[-28] -> 17.61 | AN36: =RC[-28] -> 12.41 | AO36: =RC[-28] -> 70.349999999999994 | AP36: - | AQ36: =RC[-29] -> 0 | AR36: =RC[-29] -> 0 | AS36: - | AT36: =RC[-30] -> 0 | AU36: =RC[-30] -> 0 | AV36: =RC[-30] -> 0.85499999999999998 | AW36: =RC[-30] -> 4.7670000000000003 | AY36: - | AZ36: - | BA36: -
A37: =IF(RC[1]="","",DATEVALUE(RC[1])) -> 43389 | B37: 16.10.18 | C37: 24 | D37: 186.33 | E37: 70.52 | F37: 7.2 | G37: 166.71 | H37: 49.33 | I37: 5.75 | J37: =RC[-5]-RC[-2] -> 21.189999999999998 | K37: 19.62 | L37: 14.01 | M37: 70.34 | R37: 0.96199999999999997 | S37: 4.92 | T37: =(RC[-16]*RC[-15]-RC[-13]*RC[-12])/1000 -> 4.9161872999999998 | U37: 13.7 | V37: - | W37: =RC[-2]*RC[-10]/1000 -> 0.96365800000000001 | X37: =ABS((RC[-3]*RC[-11]-RC[-2]*RC[-9])/1000) -> #VALUE! | Y37: =(RC[-14]-RC[1])/RC[-18]*100 -> 3.5510767200527873 | Z37: 13.7 | AC37: =VALUE(RC[-27]) -> 2018-10-16T00:00:00.000 | AD37: =IF(RC[21]=42,"*",IF(RC[21]=32,"",RC[21])) -> - | AE37: =RC[-28] -> 24 | AF37: =RC[-28] -> 186.33 | AG37: =RC[-28] -> 70.52 | AH37: =RC[-28] -> 7.2 | AI37: =RC[-28] -> 166.71 | AJ37: =RC[-28] -> 49.33 | AK37: =RC[-28] -> 5.75 | AL37: =RC[-28] -> 21.189999999999998 | AM37: =RC[-28] -> 19.62 | AN37: =RC[-28] -> 14.01 | AO37: =RC[-28] -> 70.34 | AP37: - | AQ37: =RC[-29] -> 0 | AR37: =RC[-29] -> 0 | AS37: - | AT37: =RC[-30] -> 0 | AU37: =RC[-30] -> 0 | AV37: =RC[-30] -> 0.96199999999999997 | AW37: =RC[-30] -> 4.92 | AY37: - | AZ37: - | BA37: -
A38: =IF(RC[1]="","",DATEVALUE(RC[1])) -> 43390 | B38: 17.10.18 | C38: 24 | D38: =AVERAGE(R[-3]C:R[-1]C) -> 185.76333333333332 | E38: =AVERAGE(R[-3]C:R[-1]C) -> 70.693333333333328 | F38: =AVERAGE(R[-3]C:R[-1]C) -> 7.16 | G38: =AVERAGE(R[-3]C:R[-1]C) -> 166.73333333333335 | H38: =AVERAGE(R[-3]C:R[-1]C) -> 49.35 | I38: =AVERAGE(R[-3]C:R[-1]C) -> 5.7133333333333338 | J38: =AVERAGE(R[-3]C:R[-1]C) -> 21.343333333333334 | K38: =AVERAGE(R[-3]C:R[-1]C) -> 19.03 | L38: =AVERAGE(R[-3]C:R[-1]C) -> 13.416666666666666 | M38: =AVERAGE(R[-3]C:R[-1]C) -> 70.566666666666677 | R38: =AVERAGE(R[-3]C:R[-1]C) -> 0.92599999999999982 | S38: =AVERAGE(R[-3]C:R[-1]C) -> 4.9053333333333331 | T38: =(RC[-16]*RC[-15]-RC[-13]*RC[-12])/1000 -> 4.9039392444444418 | U38: 12.24 | V38: - | W38: =RC[-2]*RC[-10]/1000 -> 0.86373600000000006 | X38: =ABS((RC[-3]*RC[-11]-RC[-2]*RC[-9])/1000) -> #VALUE! | Y38: =(RC[-14]-RC[1])/RC[-18]*100 -> 3.3646541383446622 | Z38: 13.42 | AC38: =VALUE(RC[-27]) -> 2018-10-17T00:00:00.000 | AD38: =IF(RC[21]=42,"*",IF(RC[21]=32,"",RC[21])) -> - | AE38: =RC[-28] -> 24 | AF38: =RC[-28] -> 185.76333333333332 | AG38: =RC[-28] -> 70.693333333333328 | AH38: =RC[-28] -> 7.16 | AI38: =RC[-28] -> 166.73333333333335 | AJ38: =RC[-28] -> 49.35 | AK38: =RC[-28] -> 5.7133333333333338 | AL38: =RC[-28] -> 21.343333333333334 | AM38: =RC[-28] -> 19.03 | AN38: =RC[-28] -> 13.416666666666666 | AO38: =RC[-28] -> 70.566666666666677 | AP38: - | AQ38: =RC[-29] -> 0 | AR38: =RC[-29] -> 0 | AS38: - | AT38: =RC[-30] -> 0 | AU38: =RC[-30] -> 0 | AV38: =RC[-30] -> 0.92599999999999982 | AW38: =RC[-30] -> 4.9053333333333331 | AY38: - | AZ38: - | BA38: -
A39: =IF(RC[1]="","",DATEVALUE(RC[1])) -> 43391 | B39: 18.10.18 | C39: 24 | D39: 189.79 | E39: 71.209999999999994 | F39: 7.18 | G39: 170.5 | H39: 49.94 | I39: 5.72 | J39: =RC[-5]-RC[-2] -> 21.269999999999996 | K39: 19.29 | L39: 12.79 | M39: 71.239999999999995 | R39: 0.88800000000000001 | S39: 5.0039999999999996 | T39: =(RC[-16]*RC[-15]-RC[-13]*RC[-12])/1000 -> 5.0001758999999986 | U39: 12.51 | V39: - | W39: =RC[-2]*RC[-10]/1000 -> 0.8912123999999999 | X39: =ABS((RC[-3]*RC[-11]-RC[-2]*RC[-9])/1000) -> #VALUE! | Y39: =(RC[-14]-RC[1])/RC[-18]*100 -> 3.9765395894428153 | Z39: 12.51 | AC39: =VALUE(RC[-27]) -> 2018-10-18T00:00:00.000 | AD39: =IF(RC[21]=42,"*",IF(RC[21]=32,"",RC[21])) -> - | AE39: =RC[-28] -> 24 | AF39: =RC[-28] -> 189.79 | AG39: =RC[-28] -> 71.209999999999994 | AH39: =RC[-28] -> 7.18 | AI39: =RC[-28] -> 170.5 | AJ39: =RC[-28] -> 49.94 | AK39: =RC[-28] -> 5.72 | AL39: =RC[-28] -> 21.269999999999996 | AM39: =RC[-28] -> 19.29 | AN39: =RC[-28] -> 12.79 | AO39: =RC[-28] -> 71.239999999999995 | AP39: - | AQ39: =RC[-29] -> 0 | AR39: =RC[-29] -> 0 | AS39: - | AT39: =RC[-30] -> 0 | AU39: =RC[-30] -> 0 | AV39: =RC[-30] -> 0.88800000000000001 | AW39: =RC[-30] -> 5.0039999999999996 | AY39: - | AZ39: - | BA39: -
A40: =IF(RC[1]="","",DATEVALUE(RC[1])) -> 43392 | B40: 19.10.18 | C40: 24 | D40: 185.76333333333332 | E40: 70.693333333333328 | F40: 7.16 | G40: 166.73333333333335 | H40: 49.35 | I40: 5.7133333333333338 | J40: 21.343333333333334 | K40: 19.03 | L40: 13.416666666666666 | M40: 70.566666666666677 | R40: 0.92599999999999982 | S40: 4.9053333333333331 | T40: =(RC[-16]*RC[-15]-RC[-13]*RC[-12])/1000 -> 4.9039392444444418 | U40: 12.55 | V40: - | W40: =RC[-2]*RC[-10]/1000 -> 0.8856116666666668 | X40: =ABS((RC[-3]*RC[-11]-RC[-2]*RC[-9])/1000) -> #VALUE! | Y40: =(RC[-14]-RC[1])/RC[-18]*100 -> 3.8864454218312674 | Z40: 12.55 | AC40: =VALUE(RC[-27]) -> 2018-10-19T00:00:00.000 | AD40: =IF(RC[21]=42,"*",IF(RC[21]=32,"",RC[21])) -> - | AE40: =RC[-28] -> 24 | AF40: =RC[-28] -> 185.76333333333332 | AG40: =RC[-28] -> 70.693333333333328 | AH40: =RC[-28] -> 7.16 | AI40: =RC[-28] -> 166.73333333333335 | AJ40: =RC[-28] -> 49.35 | AK40: =RC[-28] -> 5.7133333333333338 | AL40: =RC[-28] -> 21.343333333333334 | AM40: =RC[-28] -> 19.03 | AN40: =RC[-28] -> 13.416666666666666 | AO40: =RC[-28] -> 70.566666666666677 | AP40: - | AQ40: =RC[-29] -> 0 | AR40: =RC[-29] -> 0 | AS40: - | AT40: =RC[-30] -> 0 | AU40: =RC[-30] -> 0 | AV40: =RC[-30] -> 0.92599999999999982 | AW40: =RC[-30] -> 4.9053333333333331 | AY40: - | AZ40: - | BA40: -
A41: =IF(RC[1]="","",DATEVALUE(RC[1])) -> 43393 | B41: 20.10.18 | C41: 24 | D41: 185.76333333333332 | E41: 70.693333333333328 | F41: 7.16 | G41: 166.73333333333335 | H41: 49.35 | I41: 5.7133333333333338 | J41: 21.343333333333334 | K41: 19.03 | L41: 13.416666666666666 | M41: 70.566666666666677 | R41: 0.92599999999999982 | S41: 4.9053333333333331 | T41: =(RC[-16]*RC[-15]-RC[-13]*RC[-12])/1000 -> 4.9039392444444418 | U41: 12.91 | V41: - | W41: =RC[-2]*RC[-10]/1000 -> 0.91101566666666678 | X41: =ABS((RC[-3]*RC[-11]-RC[-2]*RC[-9])/1000) -> #VALUE! | Y41: =(RC[-14]-RC[1])/RC[-18]*100 -> 3.6705317872850864 | Z41: 12.91 | AC41: =VALUE(RC[-27]) -> 2018-10-20T00:00:00.000 | AD41: =IF(RC[21]=42,"*",IF(RC[21]=32,"",RC[21])) -> - | AE41: =RC[-28] -> 24 | AF41: =RC[-28] -> 185.76333333333332 | AG41: =RC[-28] -> 70.693333333333328 | AH41: =RC[-28] -> 7.16 | AI41: =RC[-28] -> 166.73333333333335 | AJ41: =RC[-28] -> 49.35 | AK41: =RC[-28] -> 5.7133333333333338 | AL41: =RC[-28] -> 21.343333333333334 | AM41: =RC[-28] -> 19.03 | AN41: =RC[-28] -> 13.416666666666666 | AO41: =RC[-28] -> 70.566666666666677 | AP41: - | AQ41: =RC[-29] -> 0 | AR41: =RC[-29] -> 0 | AS41: - | AT41: =RC[-30] -> 0 | AU41: =RC[-30] -> 0 | AV41: =RC[-30] -> 0.92599999999999982 | AW41: =RC[-30] -> 4.9053333333333331 | AY41: - | AZ41: - | BA41: -
A42: =IF(RC[1]="","",DATEVALUE(RC[1])) -> 43394 | B42: 21.10.18 | C42: 24 | D42: 185.76333333333332 | E42: 70.693333333333328 | F42: 7.16 | G42: 166.73333333333335 | H42: 49.35 | I42: 5.7133333333333338 | J42: 21.343333333333334 | K42: 19.03 | L42: 13.416666666666666 | M42: 70.566666666666677 | R42: 0.92599999999999982 | S42: 4.9053333333333331 | T42: =(RC[-16]*RC[-15]-RC[-13]*RC[-12])/1000 -> 4.9039392444444418 | U42: 14.37 | V42: - | W42: =RC[-2]*RC[-10]/1000 -> 1.014043 | X42: =ABS((RC[-3]*RC[-11]-RC[-2]*RC[-9])/1000) -> #VALUE! | Y42: =(RC[-14]-RC[1])/RC[-18]*100 -> 2.7948820471811282 | Z42: 14.37 | AC42: =VALUE(RC[-27]) -> 2018-10-21T00:00:00.000 | AD42: =IF(RC[21]=42,"*",IF(RC[21]=32,"",RC[21])) -> - | AE42: =RC[-28] -> 24 | AF42: =RC[-28] -> 185.76333333333332 | AG42: =RC[-28] -> 70.693333333333328 | AH42: =RC[-28] -> 7.16 | AI42: =RC[-28] -> 166.73333333333335 | AJ42: =RC[-28] -> 49.35 | AK42: =RC[-28] -> 5.7133333333333338 | AL42: =RC[-28] -> 21.343333333333334 | AM42: =RC[-28] -> 19.03 | AN42: =RC[-28] -> 13.416666666666666 | AO42: =RC[-28] -> 70.566666666666677 | AP42: - | AQ42: =RC[-29] -> 0 | AR42: =RC[-29] -> 0 | AS42: - | AT42: =RC[-30] -> 0 | AU42: =RC[-30] -> 0 | AV42: =RC[-30] -> 0.92599999999999982 | AW42: =RC[-30] -> 4.9053333333333331 | AY42: - | AZ42: - | BA42: -
A43: =IF(RC[1]="","",DATEVALUE(RC[1])) -> 43395 | B43: 22.10.18 | C43: 24 | D43: 185.76333333333332 | E43: 70.693333333333328 | F43: 7.16 | G43: 166.73333333333335 | H43: 49.35 | I43: 5.7133333333333338 | J43: 21.343333333333334 | K43: 19.03 | L43: 13.416666666666666 | M43: 70.566666666666677 | R43: 0.92599999999999982 | S43: 4.9053333333333331 | T43: =(RC[-16]*RC[-15]-RC[-13]*RC[-12])/1000 -> 4.9039392444444418 | U43: 14.11 | V43: - | W43: =RC[-2]*RC[-10]/1000 -> 0.99569566666666676 | X43: =ABS((RC[-3]*RC[-11]-RC[-2]*RC[-9])/1000) -> #VALUE! | Y43: =(RC[-14]-RC[1])/RC[-18]*100 -> 2.9508196721311482 | Z43: 14.11 | AC43: =VALUE(RC[-27]) -> 2018-10-22T00:00:00.000 | AD43: =IF(RC[21]=42,"*",IF(RC[21]=32,"",RC[21])) -> - | AE43: =RC[-28] -> 24 | AF43: =RC[-28] -> 185.76333333333332 | AG43: =RC[-28] -> 70.693333333333328 | AH43: =RC[-28] -> 7.16 | AI43: =RC[-28] -> 166.73333333333335 | AJ43: =RC[-28] -> 49.35 | AK43: =RC[-28] -> 5.7133333333333338 | AL43: =RC[-28] -> 21.343333333333334 | AM43: =RC[-28] -> 19.03 | AN43: =RC[-28] -> 13.416666666666666 | AO43: =RC[-28] -> 70.566666666666677 | AP43: - | AQ43: =RC[-29] -> 0 | AR43: =RC[-29] -> 0 | AS43: - | AT43: =RC[-30] -> 0 | AU43: =RC[-30] -> 0 | AV43: =RC[-30] -> 0.92599999999999982 | AW43: =RC[-30] -> 4.9053333333333331 | AY43: - | AZ43: - | BA43: -
A44: =IF(RC[1]="","",DATEVALUE(RC[1])) ->  | C44: 24 | J44: =RC[-5]-RC[-2] -> #VALUE! | T44: =(RC[-16]*RC[-15]-RC[-13]*RC[-12])/1000 -> #VALUE! | W44: =RC[-2]*RC[-10]/1000 -> #VALUE! | X44: =ABS((RC[-3]*RC[-11]-RC[-2]*RC[-9])/1000) -> #VALUE! | Y44: =(RC[-14]-RC[1])/RC[-18]*100 -> #VALUE! | AC44: =VALUE(RC[-27]) -> #VALUE! | AD44: =IF(RC[21]=42,"*",IF(RC[21]=32,"",RC[21])) ->  | AE44: =RC[-28] -> 24 | AF44: =RC[-28] ->  | AG44: =RC[-28] ->  | AH44: =RC[-28] ->  | AI44: =RC[-28] ->  | AJ44: =RC[-28] ->  | AK44: =RC[-28] ->  | AL44: =RC[-28] -> #VALUE! | AM44: =RC[-28] ->  | AN44: =RC[-28] ->  | AO44: =RC[-28] ->  | AP44: - | AQ44: =RC[-29] -> 0 | AR44: =RC[-29] -> 0 | AS44: - | AT44: =RC[-30] -> 0 | AU44: =RC[-30] -> 0 | AV44: =RC[-30] ->  | AW44: =RC[-30] -> 
A45: =IF(RC[1]="","",DATEVALUE(RC[1])) ->  | C45: 24 | T45: =(RC[-16]*RC[-15]-RC[-13]*RC[-12])/1000 -> #VALUE! | W45: =RC[-2]*RC[-10]/1000 -> #VALUE! | X45: =ABS((RC[-3]*RC[-11]-RC[-2]*RC[-9])/1000) -> #VALUE! | Y45: =(RC[-14]-RC[1])/RC[-18]*100 -> #VALUE! | AC45: =VALUE(RC[-27]) -> #VALUE! | AD45: =IF(RC[21]=42,"*",IF(RC[21]=32,"",RC[21])) ->  | AE45: =RC[-28] -> 24 | AF45: =RC[-28] ->  | AG45: =RC[-28] ->  | AH45: =RC[-28] ->  | AI45: =RC[-28] ->  | AJ45: =RC[-28] ->  | AK45: =RC[-28] ->  | AL45: =RC[-28] -> 0 | AM45: =RC[-28] ->  | AN45: =RC[-28] ->  | AO45: =RC[-28] ->  | AP45: - | AQ45: =RC[-29] -> 0 | AR45: =RC[-29] -> 0 | AS45: - | AT45: =RC[-30] -> 0 | AU45: =RC[-30] -> 0 | AV45: =RC[-30] ->  | AW45: =RC[-30] -> 
A46: =IF(RC[1]="","",DATEVALUE(RC[1])) ->  | C46: 24 | T46: =(RC[-16]*RC[-15]-RC[-13]*RC[-12])/1000 -> #VALUE! | W46: =RC[-2]*RC[-10]/1000 -> #VALUE! | X46: =ABS((RC[-3]*RC[-11]-RC[-2]*RC[-9])/1000) -> #VALUE! | Y46: =(RC[-14]-RC[1])/RC[-18]*100 -> #VALUE! | AC46: =VALUE(RC[-27]) -> #VALUE! | AD46: =IF(RC[21]=42,"*",IF(RC[21]=32,"",RC[21])) ->  | AE46: =RC[-28] -> 24 | AF46: =RC[-28] ->  | AG46: =RC[-28] ->  | AH46: =RC[-28] ->  | AI46: =RC[-28] ->  | AJ46: =RC[-28] ->  | AK46: =RC[-28] ->  | AL46: =RC[-28] -> 0 | AM46: =RC[-28] ->  | AN46: =RC[-28] ->  | AO46: =RC[-28] ->  | AP46: - | AQ46: =RC[-29] -> 0 | AR46: =RC[-29] -> 0 | AS46: - | AT46: =RC[-30] -> 0 | AU46: =RC[-30] -> 0 | AV46: =RC[-30] ->  | AW46: =RC[-30] -> 
A47: =IF(RC[1]="","",DATEVALUE(RC[1])) ->  | C47: 24 | T47: =(RC[-16]*RC[-15]-RC[-13]*RC[-12])/1000 -> #VALUE! | W47: =RC[-2]*RC[-10]/1000 -> #VALUE! | X47: =ABS((RC[-3]*RC[-11]-RC[-2]*RC[-9])/1000) -> #VALUE! | Y47: =(RC[-14]-RC[1])/RC[-18]*100 -> #VALUE! | AC47: =VALUE(RC[-27]) -> #VALUE! | AD47: =IF(RC[21]=42,"*",IF(RC[21]=32,"",RC[21])) ->  | AE47: =RC[-28] -> 24 | AF47: =RC[-28] ->  | AG47: =RC[-28] ->  | AH47: =RC[-28] ->  | AI47: =RC[-28] ->  | AJ47: =RC[-28] ->  | AK47: =RC[-28] ->  | AL47: =RC[-28] -> 0 | AM47: =RC[-28] ->  | AN47: =RC[-28] ->  | AO47: =RC[-28] ->  | AP47: - | AQ47: =RC[-29] -> 0 | AR47: =RC[-29] -> 0 | AS47: - | AT47: =RC[-30] -> 0 | AU47: =RC[-30] -> 0 | AV47: =RC[-30] ->  | AW47: =RC[-30] -> 
A48: =IF(RC[1]="","",DATEVALUE(RC[1])) ->  | C48: 24 | T48: =(RC[-16]*RC[-15]-RC[-13]*RC[-12])/1000 -> #VALUE! | W48: =RC[-2]*RC[-10]/1000 -> #VALUE! | X48: =ABS((RC[-3]*RC[-11]-RC[-2]*RC[-9])/1000) -> #VALUE! | Y48: =(RC[-14]-RC[1])/RC[-18]*100 -> #VALUE! | AC48: =VALUE(RC[-27]) -> #VALUE! | AD48: =IF(RC[21]=42,"*",IF(RC[21]=32,"",RC[21])) ->  | AE48: =RC[-28] -> 24 | AF48: =RC[-28] ->  | AG48: =RC[-28] ->  | AH48: =RC[-28] ->  | AI48: =RC[-28] ->  | AJ48: =RC[-28] ->  | AK48: =RC[-28] ->  | AL48: =RC[-28] -> 0 | AM48: =RC[-28] ->  | AN48: =RC[-28] ->  | AO48: =RC[-28] ->  | AP48: - | AQ48: =RC[-29] -> 0 | AR48: =RC[-29] -> 0 | AS48: - | AT48: =RC[-30] -> 0 | AU48: =RC[-30] -> 0 | AV48: =RC[-30] ->  | AW48: =RC[-30] -> 
A49: =IF(RC[1]="","",DATEVALUE(RC[1])) ->  | C49: 24 | T49: =(RC[-16]*RC[-15]-RC[-13]*RC[-12])/1000 -> #VALUE! | W49: =RC[-2]*RC[-10]/1000 -> #VALUE! | X49: =ABS((RC[-3]*RC[-11]-RC[-2]*RC[-9])/1000) -> #VALUE! | Y49: =(RC[-14]-RC[1])/RC[-18]*100 -> #VALUE! | AC49: =VALUE(RC[-27]) -> #VALUE! | AD49: =IF(RC[21]=42,"*",IF(RC[21]=32,"",RC[21])) ->  | AE49: =RC[-28] -> 24 | AF49: =RC[-28] ->  | AG49: =RC[-28] ->  | AH49: =RC[-28] ->  | AI49: =RC[-28] ->  | AJ49: =RC[-28] ->  | AK49: =RC[-28] ->  | AL49: =RC[-28] -> 0 | AM49: =RC[-28] ->  | AN49: =RC[-28] ->  | AO49: =RC[-28] ->  | AP49: - | AQ49: =RC[-29] -> 0 | AR49: =RC[-29] -> 0 | AS49: - | AT49: =RC[-30] -> 0 | AU49: =RC[-30] -> 0 | AV49: =RC[-30] ->  | AW49: =RC[-30] -> 
A50: =IF(RC[1]="","",DATEVALUE(RC[1])) ->  | T50: =(RC[-16]*RC[-15]-RC[-13]*RC[-12])/1000 -> #VALUE! | W50: =RC[-2]*RC[-10]/1000 -> #VALUE! | X50: =ABS((RC[-3]*RC[-11]-RC[-2]*RC[-9])/1000) -> #VALUE! | Y50: =(RC[-14]-RC[1])/RC[-18]*100 -> #VALUE! | AC50: =VALUE(RC[-27]) -> #VALUE! | AD50: =IF(RC[21]=42,"*",IF(RC[21]=32,"",RC[21])) ->  | AE50: =RC[-28] ->  | AF50: =RC[-28] ->  | AG50: =RC[-28] ->  | AH50: =RC[-28] ->  | AI50: =RC[-28] ->  | AJ50: =RC[-28] ->  | AK50: =RC[-28] ->  | AL50: =RC[-28] -> 0 | AM50: =RC[-28] ->  | AN50: =RC[-28] ->  | AO50: =RC[-28] ->  | AP50: - | AQ50: =RC[-29] -> 0 | AR50: =RC[-29] -> 0 | AS50: - | AT50: =RC[-30] -> 0 | AU50: =RC[-30] -> 0 | AV50: =RC[-30] ->  | AW50: =RC[-30] -> 
A51: =IF(RC[1]="","",DATEVALUE(RC[1])) ->  | T51: =(RC[-16]*RC[-15]-RC[-13]*RC[-12])/1000 -> #VALUE! | W51: =RC[-2]*RC[-10]/1000 -> #VALUE! | X51: =ABS((RC[-3]*RC[-11]-RC[-2]*RC[-9])/1000) -> #VALUE! | Y51: =(RC[-14]-RC[1])/RC[-18]*100 -> #VALUE! | AC51: =VALUE(RC[-27]) -> #VALUE! | AD51: =IF(RC[21]=42,"*",IF(RC[21]=32,"",RC[21])) ->  | AE51: =RC[-28] ->  | AF51: =RC[-28] ->  | AG51: =RC[-28] ->  | AH51: =RC[-28] ->  | AI51: =RC[-28] ->  | AJ51: =RC[-28] ->  | AK51: =RC[-28] ->  | AL51: =RC[-28] -> 0 | AM51: =RC[-28] ->  | AN51: =RC[-28] ->  | AO51: =RC[-28] ->  | AP51: - | AQ51: =RC[-29] -> 0 | AR51: =RC[-29] -> 0 | AS51: - | AT51: =RC[-30] -> 0 | AU51: =RC[-30] -> 0 | AV51: =RC[-30] ->  | AW51: =RC[-30] -> 
A52: =IF(RC[1]="","",DATEVALUE(RC[1])) ->  | T52: =(RC[-16]*RC[-15]-RC[-13]*RC[-12])/1000 -> #VALUE! | W52: =RC[-2]*RC[-10]/1000 -> #VALUE! | X52: =ABS((RC[-3]*RC[-11]-RC[-2]*RC[-9])/1000) -> #VALUE! | Y52: =(RC[-14]-RC[1])/RC[-18]*100 -> #VALUE! | AC52: =VALUE(RC[-27]) -> #VALUE! | AD52: =IF(RC[21]=42,"*",IF(RC[21]=32,"",RC[21])) ->  | AE52: =RC[-28] ->  | AF52: =RC[-28] ->  | AG52: =RC[-28] ->  | AH52: =RC[-28] ->  | AI52: =RC[-28] ->  | AJ52: =RC[-28] ->  | AK52: =RC[-28] ->  | AL52: =RC[-28] -> 0 | AM52: =RC[-28] ->  | AN52: =RC[-28] ->  | AO52: =RC[-28] ->  | AP52: - | AQ52: =RC[-29] -> 0 | AR52: =RC[-29] -> 0 | AS52: - | AT52: =RC[-30] -> 0 | AU52: =RC[-30] -> 0 | AV52: =RC[-30] ->  | AW52: =RC[-30] -> 
A53: =IF(RC[1]="","",DATEVALUE(RC[1])) ->  | T53: =(RC[-16]*RC[-15]-RC[-13]*RC[-12])/1000 -> #VALUE! | W53: =RC[-2]*RC[-10]/1000 -> #VALUE! | X53: =ABS((RC[-3]*RC[-11]-RC[-2]*RC[-9])/1000) -> #VALUE! | Y53: =(RC[-14]-RC[1])/RC[-18]*100 -> #VALUE! | AC53: =VALUE(RC[-27]) -> #VALUE! | AD53: =IF(RC[21]=42,"*",IF(RC[21]=32,"",RC[21])) ->  | AE53: =RC[-28] ->  | AF53: =RC[-28] ->  | AG53: =RC[-28] ->  | AH53: =RC[-28] ->  | AI53: =RC[-28] ->  | AJ53: =RC[-28] ->  | AK53: =RC[-28] ->  | AL53: =RC[-28] -> 0 | AM53: =RC[-28] ->  | AN53: =RC[-28] ->  | AO53: =RC[-28] ->  | AP53: - | AQ53: =RC[-29] -> 0 | AR53: =RC[-29] -> 0 | AS53: - | AT53: =RC[-30] -> 0 | AU53: =RC[-30] -> 0 | AV53: =RC[-30] ->  | AW53: =RC[-30] -> 
A54: =IF(RC[1]="","",DATEVALUE(RC[1])) ->  | T54: =(RC[-16]*RC[-15]-RC[-13]*RC[-12])/1000 -> #VALUE! | W54: =RC[-2]*RC[-10]/1000 -> #VALUE! | X54: =ABS((RC[-3]*RC[-11]-RC[-2]*RC[-9])/1000) -> #VALUE! | Y54: =(RC[-14]-RC[1])/RC[-18]*100 -> #VALUE! | AC54: =VALUE(RC[-27]) -> #VALUE! | AD54: =IF(RC[21]=42,"*",IF(RC[21]=32,"",RC[21])) ->  | AE54: =RC[-28] ->  | AF54: =RC[-28] ->  | AG54: =RC[-28] ->  | AH54: =RC[-28] ->  | AI54: =RC[-28] ->  | AJ54: =RC[-28] ->  | AK54: =RC[-28] ->  | AL54: =RC[-28] -> 0 | AM54: =RC[-28] ->  | AN54: =RC[-28] ->  | AO54: =RC[-28] ->  | AP54: - | AQ54: =RC[-29] -> 0 | AR54: =RC[-29] -> 0 | AS54: - | AT54: =RC[-30] -> 0 | AU54: =RC[-30] -> 0 | AV54: =RC[-30] ->  | AW54: =RC[-30] -> 
A55: =IF(RC[1]="","",DATEVALUE(RC[1])) ->  | T55: =(RC[-16]*RC[-15]-RC[-13]*RC[-12])/1000 -> #VALUE! | W55: =RC[-2]*RC[-10]/1000 -> #VALUE! | X55: =ABS((RC[-3]*RC[-11]-RC[-2]*RC[-9])/1000) -> #VALUE! | Y55: =(RC[-14]-RC[1])/RC[-18]*100 -> #VALUE! | AC55: =VALUE(RC[-27]) -> #VALUE! | AD55: =IF(RC[21]=42,"*",IF(RC[21]=32,"",RC[21])) ->  | AE55: =RC[-28] ->  | AF55: =RC[-28] ->  | AG55: =RC[-28] ->  | AH55: =RC[-28] ->  | AI55: =RC[-28] ->  | AJ55: =RC[-28] ->  | AK55: =RC[-28] ->  | AL55: =RC[-28] -> 0 | AM55: =RC[-28] ->  | AN55: =RC[-28] ->  | AO55: =RC[-28] ->  | AP55: - | AQ55: =RC[-29] -> 0 | AR55: =RC[-29] -> 0 | AS55: - | AT55: =RC[-30] -> 0 | AU55: =RC[-30] -> 0 | AV55: =RC[-30] ->  | AW55: =RC[-30] -> 
A56: =IF(RC[1]="","",DATEVALUE(RC[1])) ->  | T56: =(RC[-16]*RC[-15]-RC[-13]*RC[-12])/1000 -> #VALUE! | W56: =RC[-2]*RC[-10]/1000 -> #VALUE! | X56: =ABS((RC[-3]*RC[-11]-RC[-2]*RC[-9])/1000) -> #VALUE! | Y56: =(RC[-14]-RC[1])/RC[-18]*100 -> #VALUE! | AC56: =VALUE(RC[-27]) -> #VALUE! | AD56: =IF(RC[21]=42,"*",IF(RC[21]=32,"",RC[21])) ->  | AE56: =RC[-28] ->  | AF56: =RC[-28] ->  | AG56: =RC[-28] ->  | AH56: =RC[-28] ->  | AI56: =RC[-28] ->  | AJ56: =RC[-28] ->  | AK56: =RC[-28] ->  | AL56: =RC[-28] -> 0 | AM56: =RC[-28] ->  | AN56: =RC[-28] ->  | AO56: =RC[-28] ->  | AP56: - | AQ56: =RC[-29] -> 0 | AR56: =RC[-29] -> 0 | AS56: - | AT56: =RC[-30] -> 0 | AU56: =RC[-30] -> 0 | AV56: =RC[-30] ->  | AW56: =RC[-30] -> 
A57: =IF(RC[1]="","",DATEVALUE(RC[1])) ->  | T57: =(RC[-16]*RC[-15]-RC[-13]*RC[-12])/1000 -> #VALUE! | W57: =RC[-2]*RC[-10]/1000 -> #VALUE! | X57: =ABS((RC[-3]*RC[-11]-RC[-2]*RC[-9])/1000) -> #VALUE! | Y57: =(RC[-14]-RC[1])/RC[-18]*100 -> #VALUE! | AC57: =VALUE(RC[-27]) -> #VALUE! | AD57: =IF(RC[21]=42,"*",IF(RC[21]=32,"",RC[21])) ->  | AE57: =RC[-28] ->  | AF57: =RC[-28] ->  | AG57: =RC[-28] ->  | AH57: =RC[-28] ->  | AI57: =RC[-28] ->  | AJ57: =RC[-28] ->  | AK57: =RC[-28] ->  | AL57: =RC[-28] -> 0 | AM57: =RC[-28] ->  | AN57: =RC[-28] ->  | AO57: =RC[-28] ->  | AP57: - | AQ57: =RC[-29] -> 0 | AR57: =RC[-29] -> 0 | AS57: - | AT57: =RC[-30] -> 0 | AU57: =RC[-30] -> 0 | AV57: =RC[-30] ->  | AW57: =RC[-30] -> 
A58: =IF(RC[1]="","",DATEVALUE(RC[1])) ->  | T58: =(RC[-16]*RC[-15]-RC[-13]*RC[-12])/1000 -> #VALUE! | W58: =RC[-2]*RC[-10]/1000 -> #VALUE! | X58: =ABS((RC[-3]*RC[-11]-RC[-2]*RC[-9])/1000) -> #VALUE! | Y58: =(RC[-14]-RC[1])/RC[-18]*100 -> #VALUE! | AC58: =VALUE(RC[-27]) -> #VALUE! | AD58: =IF(RC[21]=42,"*",IF(RC[21]=32,"",RC[21])) ->  | AE58: =RC[-28] ->  | AF58: =RC[-28] ->  | AG58: =RC[-28] ->  | AH58: =RC[-28] ->  | AI58: =RC[-28] ->  | AJ58: =RC[-28] ->  | AK58: =RC[-28] ->  | AL58: =RC[-28] -> 0 | AM58: =RC[-28] ->  | AN58: =RC[-28] ->  | AO58: =RC[-28] ->  | AP58: - | AQ58: =RC[-29] -> 0 | AR58: =RC[-29] -> 0 | AS58: - | AT58: =RC[-30] -> 0 | AU58: =RC[-30] -> 0 | AV58: =RC[-30] ->  | AW58: =RC[-30] -> 
A59: =IF(RC[1]="","",DATEVALUE(RC[1])) ->  | T59: =(RC[-16]*RC[-15]-RC[-13]*RC[-12])/1000 -> #VALUE! | W59: =RC[-2]*RC[-10]/1000 -> #VALUE! | X59: =ABS((RC[-3]*RC[-11]-RC[-2]*RC[-9])/1000) -> #VALUE! | Y59: =(RC[-14]-RC[1])/RC[-18]*100 -> #VALUE! | AC59: =VALUE(RC[-27]) -> #VALUE! | AD59: =IF(RC[21]=42,"*",IF(RC[21]=32,"",RC[21])) ->  | AE59: =RC[-28] ->  | AF59: =RC[-28] ->  | AG59: =RC[-28] ->  | AH59: =RC[-28] ->  | AI59: =RC[-28] ->  | AJ59: =RC[-28] ->  | AK59: =RC[-28] ->  | AL59: =RC[-28] -> 0 | AM59: =RC[-28] ->  | AN59: =RC[-28] ->  | AO59: =RC[-28] ->  | AP59: - | AQ59: =RC[-29] -> 0 | AR59: =RC[-29] -> 0 | AS59: - | AT59: =RC[-30] -> 0 | AU59: =RC[-30] -> 0 | AV59: =RC[-30] ->  | AW59: =RC[-30] -> 
A60: =IF(RC[1]="","",DATEVALUE(RC[1])) ->  | T60: =(RC[-16]*RC[-15]-RC[-13]*RC[-12])/1000 -> #VALUE! | W60: =RC[-2]*RC[-10]/1000 -> #VALUE! | X60: =ABS((RC[-3]*RC[-11]-RC[-2]*RC[-9])/1000) -> #VALUE! | Y60: =(RC[-14]-RC[1])/RC[-18]*100 -> #VALUE! | AC60: =VALUE(RC[-27]) -> #VALUE! | AD60: =IF(RC[21]=42,"*",IF(RC[21]=32,"",RC[21])) ->  | AE60: =RC[-28] ->  | AF60: =RC[-28] ->  | AG60: =RC[-28] ->  | AH60: =RC[-28] ->  | AI60: =RC[-28] ->  | AJ60: =RC[-28] ->  | AK60: =RC[-28] ->  | AL60: =RC[-28] -> 0 | AM60: =RC[-28] ->  | AN60: =RC[-28] ->  | AO60: =RC[-28] ->  | AP60: - | AQ60: =RC[-29] -> 0 | AR60: =RC[-29] -> 0 | AS60: - | AT60: =RC[-30] -> 0 | AU60: =RC[-30] -> 0 | AV60: =RC[-30] ->  | AW60: =RC[-30] -> 
A61: =IF(RC[1]="","",DATEVALUE(RC[1])) ->  | T61: =(RC[-16]*RC[-15]-RC[-13]*RC[-12])/1000 -> #VALUE! | W61: =RC[-2]*RC[-10]/1000 -> #VALUE! | X61: =ABS((RC[-3]*RC[-11]-RC[-2]*RC[-9])/1000) -> #VALUE! | Y61: =(RC[-14]-RC[1])/RC[-18]*100 -> #VALUE! | AC61: =VALUE(RC[-27]) -> #VALUE! | AD61: =IF(RC[21]=42,"*",IF(RC[21]=32,"",RC[21])) ->  | AE61: =RC[-28] ->  | AF61: =RC[-28] ->  | AG61: =RC[-28] ->  | AH61: =RC[-28] ->  | AI61: =RC[-28] ->  | AJ61: =RC[-28] ->  | AK61: =RC[-28] ->  | AL61: =RC[-28] -> 0 | AM61: =RC[-28] ->  | AN61: =RC[-28] ->  | AO61: =RC[-28] ->  | AP61: - | AQ61: =RC[-29] -> 0 | AR61: =RC[-29] -> 0 | AS61: - | AT61: =RC[-30] -> 0 | AU61: =RC[-30] -> 0 | AV61: =RC[-30] ->  | AW61: =RC[-30] -> 
A62: =IF(RC[1]="","",DATEVALUE(RC[1])) ->  | T62: =(RC[-16]*RC[-15]-RC[-13]*RC[-12])/1000 -> #VALUE! | W62: =RC[-2]*RC[-10]/1000 -> #VALUE! | X62: =ABS((RC[-3]*RC[-11]-RC[-2]*RC[-9])/1000) -> #VALUE! | Y62: =(RC[-14]-RC[1])/RC[-18]*100 -> #VALUE! | AC62: =VALUE(RC[-27]) -> #VALUE! | AD62: =IF(RC[21]=42,"*",IF(RC[21]=32,"",RC[21])) ->  | AE62: =RC[-28] ->  | AF62: =RC[-28] ->  | AG62: =RC[-28] ->  | AH62: =RC[-28] ->  | AI62: =RC[-28] ->  | AJ62: =RC[-28] ->  | AK62: =RC[-28] ->  | AL62: =RC[-28] -> 0 | AM62: =RC[-28] ->  | AN62: =RC[-28] ->  | AO62: =RC[-28] ->  | AP62: - | AQ62: =RC[-29] -> 0 | AR62: =RC[-29] -> 0 | AS62: - | AT62: =RC[-30] -> 0 | AU62: =RC[-30] -> 0 | AV62: =RC[-30] ->  | AW62: =RC[-30] -> 
A63: =IF(RC[1]="","",DATEVALUE(RC[1])) ->  | T63: =(RC[-16]*RC[-15]-RC[-13]*RC[-12])/1000 -> #VALUE! | W63: =RC[-2]*RC[-10]/1000 -> #VALUE! | X63: =ABS((RC[-3]*RC[-11]-RC[-2]*RC[-9])/1000) -> #VALUE! | Y63: =(RC[-14]-RC[1])/RC[-18]*100 -> #VALUE! | AC63: =VALUE(RC[-27]) -> #VALUE! | AD63: =IF(RC[21]=42,"*",IF(RC[21]=32,"",RC[21])) ->  | AE63: =RC[-28] ->  | AF63: =RC[-28] ->  | AG63: =RC[-28] ->  | AH63: =RC[-28] ->  | AI63: =RC[-28] ->  | AJ63: =RC[-28] ->  | AK63: =RC[-28] ->  | AL63: =RC[-28] -> 0 | AM63: =RC[-28] ->  | AN63: =RC[-28] ->  | AO63: =RC[-28] ->  | AP63: - | AQ63: =RC[-29] -> 0 | AR63: =RC[-29] -> 0 | AS63: - | AT63: =RC[-30] -> 0 | AU63: =RC[-30] -> 0 | AV63: =RC[-30] ->  | AW63: =RC[-30] -> 
A64: =IF(RC[1]="","",DATEVALUE(RC[1])) ->  | T64: =(RC[-16]*RC[-15]-RC[-13]*RC[-12])/1000 -> #VALUE! | W64: =RC[-2]*RC[-10]/1000 -> #VALUE! | X64: =ABS((RC[-3]*RC[-11]-RC[-2]*RC[-9])/1000) -> #VALUE! | Y64: =(RC[-14]-RC[1])/RC[-18]*100 -> #VALUE! | AC64: =VALUE(RC[-27]) -> #VALUE! | AD64: =IF(RC[21]=42,"*",IF(RC[21]=32,"",RC[21])) ->  | AE64: =RC[-28] ->  | AF64: =RC[-28] ->  | AG64: =RC[-28] ->  | AH64: =RC[-28] ->  | AI64: =RC[-28] ->  | AJ64: =RC[-28] ->  | AK64: =RC[-28] ->  | AL64: =RC[-28] -> 0 | AM64: =RC[-28] ->  | AN64: =RC[-28] ->  | AO64: =RC[-28] ->  | AP64: - | AQ64: =RC[-29] -> 0 | AR64: =RC[-29] -> 0 | AS64: - | AT64: =RC[-30] -> 0 | AU64: =RC[-30] -> 0 | AV64: =RC[-30] ->  | AW64: =RC[-30] -> 
A65: =IF(RC[1]="","",DATEVALUE(RC[1])) ->  | T65: =(RC[-16]*RC[-15]-RC[-13]*RC[-12])/1000 -> #VALUE! | W65: =RC[-2]*RC[-10]/1000 -> #VALUE! | X65: =ABS((RC[-3]*RC[-11]-RC[-2]*RC[-9])/1000) -> #VALUE! | Y65: =(RC[-14]-RC[1])/RC[-18]*100 -> #VALUE! | AC65: =VALUE(RC[-27]) -> #VALUE! | AD65: =IF(RC[21]=42,"*",IF(RC[21]=32,"",RC[21])) ->  | AE65: =RC[-28] ->  | AF65: =RC[-28] ->  | AG65: =RC[-28] ->  | AH65: =RC[-28] ->  | AI65: =RC[-28] ->  | AJ65: =RC[-28] ->  | AK65: =RC[-28] ->  | AL65: =RC[-28] -> 0 | AM65: =RC[-28] ->  | AN65: =RC[-28] ->  | AO65: =RC[-28] ->  | AP65: - | AQ65: =RC[-29] -> 0 | AR65: =RC[-29] -> 0 | AS65: - | AT65: =RC[-30] -> 0 | AU65: =RC[-30] -> 0 | AV65: =RC[-30] ->  | AW65: =RC[-30] -> 
A66: =IF(RC[1]="","",DATEVALUE(RC[1])) ->  | T66: =(RC[-16]*RC[-15]-RC[-13]*RC[-12])/1000 -> #VALUE! | W66: =RC[-2]*RC[-10]/1000 -> #VALUE! | X66: =ABS((RC[-3]*RC[-11]-RC[-2]*RC[-9])/1000) -> #VALUE! | Y66: =(RC[-14]-RC[1])/RC[-18]*100 -> #VALUE! | AC66: =VALUE(RC[-27]) -> #VALUE! | AD66: =IF(RC[21]=42,"*",IF(RC[21]=32,"",RC[21])) ->  | AE66: =RC[-28] ->  | AF66: =RC[-28] ->  | AG66: =RC[-28] ->  | AH66: =RC[-28] ->  | AI66: =RC[-28] ->  | AJ66: =RC[-28] ->  | AK66: =RC[-28] ->  | AL66: =RC[-28] -> 0 | AM66: =RC[-28] ->  | AN66: =RC[-28] ->  | AO66: =RC[-28] ->  | AP66: - | AQ66: =RC[-29] -> 0 | AR66: =RC[-29] -> 0 | AS66: - | AT66: =RC[-30] -> 0 | AU66: =RC[-30] -> 0 | AV66: =RC[-30] ->  | AW66: =RC[-30] -> 
A67: =IF(RC[1]="","",DATEVALUE(RC[1])) ->  | T67: =(RC[-16]*RC[-15]-RC[-13]*RC[-12])/1000 -> #VALUE! | W67: =RC[-2]*RC[-10]/1000 -> #VALUE! | X67: =ABS((RC[-3]*RC[-11]-RC[-2]*RC[-9])/1000) -> #VALUE! | Y67: =(RC[-14]-RC[1])/RC[-18]*100 -> #VALUE! | AC67: =VALUE(RC[-27]) -> #VALUE! | AD67: =IF(RC[21]=42,"*",IF(RC[21]=32,"",RC[21])) ->  | AE67: =RC[-28] ->  | AF67: =RC[-28] ->  | AG67: =RC[-28] ->  | AH67: =RC[-28] ->  | AI67: =RC[-28] ->  | AJ67: =RC[-28] ->  | AK67: =RC[-28] ->  | AL67: =RC[-28] -> 0 | AM67: =RC[-28] ->  | AN67: =RC[-28] ->  | AO67: =RC[-28] ->  | AP67: - | AQ67: =RC[-29] -> 0 | AR67: =RC[-29] -> 0 | AS67: - | AT67: =RC[-30] -> 0 | AU67: =RC[-30] -> 0 | AV67: =RC[-30] ->  | AW67: =RC[-30] -> 
A68: =IF(RC[1]="","",DATEVALUE(RC[1])) ->  | T68: =(RC[-16]*RC[-15]-RC[-13]*RC[-12])/1000 -> #VALUE! | W68: =RC[-2]*RC[-10]/1000 -> #VALUE! | X68: =ABS((RC[-3]*RC[-11]-RC[-2]*RC[-9])/1000) -> #VALUE! | Y68: =(RC[-14]-RC[1])/RC[-18]*100 -> #VALUE! | AC68: =VALUE(RC[-27]) -> #VALUE! | AD68: =IF(RC[21]=42,"*",IF(RC[21]=32,"",RC[21])) ->  | AE68: =RC[-28] ->  | AF68: =RC[-28] ->  | AG68: =RC[-28] ->  | AH68: =RC[-28] ->  | AI68: =RC[-28] ->  | AJ68: =RC[-28] ->  | AK68: =RC[-28] ->  | AL68: =RC[-28] -> 0 | AM68: =RC[-28] ->  | AN68: =RC[-28] ->  | AO68: =RC[-28] ->  | AP68: - | AQ68: =RC[-29] -> 0 | AR68: =RC[-29] -> 0 | AS68: - | AT68: =RC[-30] -> 0 | AU68: =RC[-30] -> 0 | AV68: =RC[-30] ->  | AW68: =RC[-30] -> 
A69: =IF(RC[1]="","",DATEVALUE(RC[1])) ->  | T69: =(RC[-16]*RC[-15]-RC[-13]*RC[-12])/1000 -> #VALUE! | W69: =RC[-2]*RC[-10]/1000 -> #VALUE! | X69: =ABS((RC[-3]*RC[-11]-RC[-2]*RC[-9])/1000) -> #VALUE! | Y69: =(RC[-14]-RC[1])/RC[-18]*100 -> #VALUE! | AC69: =VALUE(RC[-27]) -> #VALUE! | AD69: =IF(RC[21]=42,"*",IF(RC[21]=32,"",RC[21])) ->  | AE69: =RC[-28] ->  | AF69: =RC[-28] ->  | AG69: =RC[-28] ->  | AH69: =RC[-28] ->  | AI69: =RC[-28] ->  | AJ69: =RC[-28] ->  | AK69: =RC[-28] ->  | AL69: =RC[-28] -> 0 | AM69: =RC[-28] ->  | AN69: =RC[-28] ->  | AO69: =RC[-28] ->  | AP69: - | AQ69: =RC[-29] -> 0 | AR69: =RC[-29] -> 0 | AS69: - | AT69: =RC[-30] -> 0 | AU69: =RC[-30] -> 0 | AV69: =RC[-30] ->  | AW69: =RC[-30] -> 
A70: =IF(RC[1]="","",DATEVALUE(RC[1])) ->  | T70: =(RC[-16]*RC[-15]-RC[-13]*RC[-12])/1000 -> #VALUE! | W70: =RC[-2]*RC[-10]/1000 -> #VALUE! | X70: =ABS((RC[-3]*RC[-11]-RC[-2]*RC[-9])/1000) -> #VALUE! | Y70: =(RC[-14]-RC[1])/RC[-18]*100 -> #VALUE! | AC70: =VALUE(RC[-27]) -> #VALUE! | AD70: =IF(RC[21]=42,"*",IF(RC[21]=32,"",RC[21])) ->  | AE70: =RC[-28] ->  | AF70: =RC[-28] ->  | AG70: =RC[-28] ->  | AH70: =RC[-28] ->  | AI70: =RC[-28] ->  | AJ70: =RC[-28] ->  | AK70: =RC[-28] ->  | AL70: =RC[-28] -> 0 | AM70: =RC[-28] ->  | AN70: =RC[-28] ->  | AO70: =RC[-28] ->  | AP70: - | AQ70: =RC[-29] -> 0 | AR70: =RC[-29] -> 0 | AS70: - | AT70: =RC[-30] -> 0 | AU70: =RC[-30] -> 0 | AV70: =RC[-30] ->  | AW70: =RC[-30] -> 
A71: =IF(RC[1]="","",DATEVALUE(RC[1])) ->  | T71: =(RC[-16]*RC[-15]-RC[-13]*RC[-12])/1000 -> #VALUE! | W71: =RC[-2]*RC[-10]/1000 -> #VALUE! | X71: =ABS((RC[-3]*RC[-11]-RC[-2]*RC[-9])/1000) -> #VALUE! | Y71: =(RC[-14]-RC[1])/RC[-18]*100 -> #VALUE! | AC71: =VALUE(RC[-27]) -> #VALUE! | AD71: =IF(RC[21]=42,"*",IF(RC[21]=32,"",RC[21])) ->  | AE71: =RC[-28] ->  | AF71: =RC[-28] ->  | AG71: =RC[-28] ->  | AH71: =RC[-28] ->  | AI71: =RC[-28] ->  | AJ71: =RC[-28] ->  | AK71: =RC[-28] ->  | AL71: =RC[-28] -> 0 | AM71: =RC[-28] ->  | AN71: =RC[-28] ->  | AO71: =RC[-28] ->  | AP71: - | AQ71: =RC[-29] -> 0 | AR71: =RC[-29] -> 0 | AS71: - | AT71: =RC[-30] -> 0 | AU71: =RC[-30] -> 0 | AV71: =RC[-30] ->  | AW71: =RC[-30] -> 
A72: =IF(RC[1]="","",DATEVALUE(RC[1])) ->  | T72: =(RC[-16]*RC[-15]-RC[-13]*RC[-12])/1000 -> #VALUE! | W72: =RC[-2]*RC[-10]/1000 -> #VALUE! | X72: =ABS((RC[-3]*RC[-11]-RC[-2]*RC[-9])/1000) -> #VALUE! | Y72: =(RC[-14]-RC[1])/RC[-18]*100 -> #VALUE! | AC72: =VALUE(RC[-27]) -> #VALUE! | AD72: =IF(RC[21]=42,"*",IF(RC[21]=32,"",RC[21])) ->  | AE72: =RC[-28] ->  | AF72: =RC[-28] ->  | AG72: =RC[-28] ->  | AH72: =RC[-28] ->  | AI72: =RC[-28] ->  | AJ72: =RC[-28] ->  | AK72: =RC[-28] ->  | AL72: =RC[-28] -> 0 | AM72: =RC[-28] ->  | AN72: =RC[-28] ->  | AO72: =RC[-28] ->  | AP72: - | AQ72: =RC[-29] -> 0 | AR72: =RC[-29] -> 0 | AS72: - | AT72: =RC[-30] -> 0 | AU72: =RC[-30] -> 0 | AV72: =RC[-30] ->  | AW72: =RC[-30] -> 
A73: =IF(RC[1]="","",DATEVALUE(RC[1])) ->  | T73: =(RC[-16]*RC[-15]-RC[-13]*RC[-12])/1000 -> #VALUE! | W73: =RC[-2]*RC[-10]/1000 -> #VALUE! | X73: =ABS((RC[-3]*RC[-11]-RC[-2]*RC[-9])/1000) -> #VALUE! | Y73: =(RC[-14]-RC[1])/RC[-18]*100 -> #VALUE! | AC73: =VALUE(RC[-27]) -> #VALUE! | AD73: =IF(RC[21]=42,"*",IF(RC[21]=32,"",RC[21])) ->  | AE73: =RC[-28] ->  | AF73: =RC[-28] ->  | AG73: =RC[-28] ->  | AH73: =RC[-28] ->  | AI73: =RC[-28] ->  | AJ73: =RC[-28] ->  | AK73: =RC[-28] ->  | AL73: =RC[-28] -> 0 | AM73: =RC[-28] ->  | AN73: =RC[-28] ->  | AO73: =RC[-28] ->  | AP73: - | AQ73: =RC[-29] -> 0 | AR73: =RC[-29] -> 0 | AS73: - | AT73: =RC[-30] -> 0 | AU73: =RC[-30] -> 0 | AV73: =RC[-30] ->  | AW73: =RC[-30] -> 
A74: =IF(RC[1]="","",DATEVALUE(RC[1])) ->  | T74: =(RC[-16]*RC[-15]-RC[-13]*RC[-12])/1000 -> #VALUE! | W74: =RC[-2]*RC[-10]/1000 -> #VALUE! | X74: =ABS((RC[-3]*RC[-11]-RC[-2]*RC[-9])/1000) -> #VALUE! | Y74: =(RC[-14]-RC[1])/RC[-18]*100 -> #VALUE! | AC74: =VALUE(RC[-27]) -> #VALUE! | AD74: =IF(RC[21]=42,"*",IF(RC[21]=32,"",RC[21])) ->  | AE74: =RC[-28] ->  | AF74: =RC[-28] ->  | AG74: =RC[-28] ->  | AH74: =RC[-28] ->  | AI74: =RC[-28] ->  | AJ74: =RC[-28] ->  | AK74: =RC[-28] ->  | AL74: =RC[-28] -> 0 | AM74: =RC[-28] ->  | AN74: =RC[-28] ->  | AO74: =RC[-28] ->  | AP74: - | AQ74: =RC[-29] -> 0 | AR74: =RC[-29] -> 0 | AS74: - | AT74: =RC[-30] -> 0 | AU74: =RC[-30] -> 0 | AV74: =RC[-30] ->  | AW74: =RC[-30] -> 
A75: =IF(RC[1]="","",DATEVALUE(RC[1])) ->  | T75: =(RC[-16]*RC[-15]-RC[-13]*RC[-12])/1000 -> #VALUE! | W75: =RC[-2]*RC[-10]/1000 -> #VALUE! | X75: =ABS((RC[-3]*RC[-11]-RC[-2]*RC[-9])/1000) -> #VALUE! | Y75: =(RC[-14]-RC[1])/RC[-18]*100 -> #VALUE! | AC75: =VALUE(RC[-27]) -> #VALUE! | AD75: =IF(RC[21]=42,"*",IF(RC[21]=32,"",RC[21])) ->  | AE75: =RC[-28] ->  | AF75: =RC[-28] ->  | AG75: =RC[-28] ->  | AH75: =RC[-28] ->  | AI75: =RC[-28] ->  | AJ75: =RC[-28] ->  | AK75: =RC[-28] ->  | AL75: =RC[-28] -> 0 | AM75: =RC[-28] ->  | AN75: =RC[-28] ->  | AO75: =RC[-28] ->  | AP75: - | AQ75: =RC[-29] -> 0 | AR75: =RC[-29] -> 0 | AS75: - | AT75: =RC[-30] -> 0 | AU75: =RC[-30] -> 0 | AV75: =RC[-30] ->  | AW75: =RC[-30] -> 
A76: =IF(RC[1]="","",DATEVALUE(RC[1])) ->  | T76: =(RC[-16]*RC[-15]-RC[-13]*RC[-12])/1000 -> #VALUE! | W76: =RC[-2]*RC[-10]/1000 -> #VALUE! | X76: =ABS((RC[-3]*RC[-11]-RC[-2]*RC[-9])/1000) -> #VALUE! | Y76: =(RC[-14]-RC[1])/RC[-18]*100 -> #VALUE! | AC76: =VALUE(RC[-27]) -> #VALUE! | AD76: =IF(RC[21]=42,"*",IF(RC[21]=32,"",RC[21])) ->  | AE76: =RC[-28] ->  | AF76: =RC[-28] ->  | AG76: =RC[-28] ->  | AH76: =RC[-28] ->  | AI76: =RC[-28] ->  | AJ76: =RC[-28] ->  | AK76: =RC[-28] ->  | AL76: =RC[-28] -> 0 | AM76: =RC[-28] ->  | AN76: =RC[-28] ->  | AO76: =RC[-28] ->  | AP76: - | AQ76: =RC[-29] -> 0 | AR76: =RC[-29] -> 0 | AS76: - | AT76: =RC[-30] -> 0 | AU76: =RC[-30] -> 0 | AV76: =RC[-30] ->  | AW76: =RC[-30] -> 
A77: =IF(RC[1]="","",DATEVALUE(RC[1])) ->  | T77: =(RC[-16]*RC[-15]-RC[-13]*RC[-12])/1000 -> #VALUE! | W77: =RC[-2]*RC[-10]/1000 -> #VALUE! | X77: =ABS((RC[-3]*RC[-11]-RC[-2]*RC[-9])/1000) -> #VALUE! | Y77: =(RC[-14]-RC[1])/RC[-18]*100 -> #VALUE! | AC77: =VALUE(RC[-27]) -> #VALUE! | AD77: =IF(RC[21]=42,"*",IF(RC[21]=32,"",RC[21])) ->  | AE77: =RC[-28] ->  | AF77: =RC[-28] ->  | AG77: =RC[-28] ->  | AH77: =RC[-28] ->  | AI77: =RC[-28] ->  | AJ77: =RC[-28] ->  | AK77: =RC[-28] ->  | AL77: =RC[-28] -> 0 | AM77: =RC[-28] ->  | AN77: =RC[-28] ->  | AO77: =RC[-28] ->  | AP77: - | AQ77: =RC[-29] -> 0 | AR77: =RC[-29] -> 0 | AS77: - | AT77: =RC[-30] -> 0 | AU77: =RC[-30] -> 0 | AV77: =RC[-30] ->  | AW77: =RC[-30] -> 
A78: =IF(RC[1]="","",DATEVALUE(RC[1])) ->  | T78: =(RC[-16]*RC[-15]-RC[-13]*RC[-12])/1000 -> #VALUE! | W78: =RC[-2]*RC[-10]/1000 -> #VALUE! | X78: =ABS((RC[-3]*RC[-11]-RC[-2]*RC[-9])/1000) -> #VALUE! | Y78: =(RC[-14]-RC[1])/RC[-18]*100 -> #VALUE! | AC78: =VALUE(RC[-27]) -> #VALUE! | AD78: =IF(RC[21]=42,"*",IF(RC[21]=32,"",RC[21])) ->  | AE78: =RC[-28] ->  | AF78: =RC[-28] ->  | AG78: =RC[-28] ->  | AH78: =RC[-28] ->  | AI78: =RC[-28] ->  | AJ78: =RC[-28] ->  | AK78: =RC[-28] ->  | AL78: =RC[-28] -> 0 | AM78: =RC[-28] ->  | AN78: =RC[-28] ->  | AO78: =RC[-28] ->  | AP78: - | AQ78: =RC[-29] -> 0 | AR78: =RC[-29] -> 0 | AS78: - | AT78: =RC[-30] -> 0 | AU78: =RC[-30] -> 0 | AV78: =RC[-30] ->  | AW78: =RC[-30] -> 
A79: =IF(RC[1]="","",DATEVALUE(RC[1])) ->  | T79: =(RC[-16]*RC[-15]-RC[-13]*RC[-12])/1000 -> #VALUE! | W79: =RC[-2]*RC[-10]/1000 -> #VALUE! | X79: =ABS((RC[-3]*RC[-11]-RC[-2]*RC[-9])/1000) -> #VALUE! | Y79: =(RC[-14]-RC[1])/RC[-18]*100 -> #VALUE! | AC79: =VALUE(RC[-27]) -> #VALUE! | AD79: =IF(RC[21]=42,"*",IF(RC[21]=32,"",RC[21])) ->  | AE79: =RC[-28] ->  | AF79: =RC[-28] ->  | AG79: =RC[-28] ->  | AH79: =RC[-28] ->  | AI79: =RC[-28] ->  | AJ79: =RC[-28] ->  | AK79: =RC[-28] ->  | AL79: =RC[-28] -> 0 | AM79: =RC[-28] ->  | AN79: =RC[-28] ->  | AO79: =RC[-28] ->  | AP79: - | AQ79: =RC[-29] -> 0 | AR79: =RC[-29] -> 0 | AS79: - | AT79: =RC[-30] -> 0 | AU79: =RC[-30] -> 0 | AV79: =RC[-30] ->  | AW79: =RC[-30] -> 
A80: =IF(RC[1]="","",DATEVALUE(RC[1])) ->  | T80: =(RC[-16]*RC[-15]-RC[-13]*RC[-12])/1000 -> #VALUE! | W80: =RC[-2]*RC[-10]/1000 -> #VALUE! | X80: =ABS((RC[-3]*RC[-11]-RC[-2]*RC[-9])/1000) -> #VALUE! | Y80: =(RC[-14]-RC[1])/RC[-18]*100 -> #VALUE! | AC80: =VALUE(RC[-27]) -> #VALUE! | AD80: =IF(RC[21]=42,"*",IF(RC[21]=32,"",RC[21])) ->  | AE80: =RC[-28] ->  | AF80: =RC[-28] ->  | AG80: =RC[-28] ->  | AH80: =RC[-28] ->  | AI80: =RC[-28] ->  | AJ80: =RC[-28] ->  | AK80: =RC[-28] ->  | AL80: =RC[-28] -> 0 | AM80: =RC[-28] ->  | AN80: =RC[-28] ->  | AO80: =RC[-28] ->  | AP80: - | AQ80: =RC[-29] -> 0 | AR80: =RC[-29] -> 0 | AS80: - | AT80: =RC[-30] -> 0 | AU80: =RC[-30] -> 0 | AV80: =RC[-30] ->  | AW80: =RC[-30] -> 
A81: =IF(RC[1]="","",DATEVALUE(RC[1])) ->  | T81: =(RC[-16]*RC[-15]-RC[-13]*RC[-12])/1000 -> #VALUE! | W81: =RC[-2]*RC[-10]/1000 -> #VALUE! | X81: =ABS((RC[-3]*RC[-11]-RC[-2]*RC[-9])/1000) -> #VALUE! | Y81: =(RC[-14]-RC[1])/RC[-18]*100 -> #VALUE! | AC81: =VALUE(RC[-27]) -> #VALUE! | AD81: =IF(RC[21]=42,"*",IF(RC[21]=32,"",RC[21])) ->  | AE81: =RC[-28] ->  | AF81: =RC[-28] ->  | AG81: =RC[-28] ->  | AH81: =RC[-28] ->  | AI81: =RC[-28] ->  | AJ81: =RC[-28] ->  | AK81: =RC[-28] ->  | AL81: =RC[-28] -> 0 | AM81: =RC[-28] ->  | AN81: =RC[-28] ->  | AO81: =RC[-28] ->  | AP81: - | AQ81: =RC[-29] -> 0 | AR81: =RC[-29] -> 0 | AS81: - | AT81: =RC[-30] -> 0 | AU81: =RC[-30] -> 0 | AV81: =RC[-30] ->  | AW81: =RC[-30] -> 
A82: =IF(RC[1]="","",DATEVALUE(RC[1])) ->  | T82: =(RC[-16]*RC[-15]-RC[-13]*RC[-12])/1000 -> #VALUE! | W82: =RC[-2]*RC[-10]/1000 -> #VALUE! | X82: =ABS((RC[-3]*RC[-11]-RC[-2]*RC[-9])/1000) -> #VALUE! | Y82: =(RC[-14]-RC[1])/RC[-18]*100 -> #VALUE! | AC82: =VALUE(RC[-27]) -> #VALUE! | AD82: =IF(RC[21]=42,"*",IF(RC[21]=32,"",RC[21])) ->  | AE82: =RC[-28] ->  | AF82: =RC[-28] ->  | AG82: =RC[-28] ->  | AH82: =RC[-28] ->  | AI82: =RC[-28] ->  | AJ82: =RC[-28] ->  | AK82: =RC[-28] ->  | AL82: =RC[-28] -> 0 | AM82: =RC[-28] ->  | AN82: =RC[-28] ->  | AO82: =RC[-28] ->  | AP82: - | AQ82: =RC[-29] -> 0 | AR82: =RC[-29] -> 0 | AS82: - | AT82: =RC[-30] -> 0 | AU82: =RC[-30] -> 0 | AV82: =RC[-30] ->  | AW82: =RC[-30] -> 
A83: =IF(RC[1]="","",DATEVALUE(RC[1])) ->  | T83: =(RC[-16]*RC[-15]-RC[-13]*RC[-12])/1000 -> #VALUE! | W83: =RC[-2]*RC[-10]/1000 -> #VALUE! | X83: =ABS((RC[-3]*RC[-11]-RC[-2]*RC[-9])/1000) -> #VALUE! | Y83: =(RC[-14]-RC[1])/RC[-18]*100 -> #VALUE! | AC83: =VALUE(RC[-27]) -> #VALUE! | AD83: =IF(RC[21]=42,"*",IF(RC[21]=32,"",RC[21])) ->  | AE83: =RC[-28] ->  | AF83: =RC[-28] ->  | AG83: =RC[-28] ->  | AH83: =RC[-28] ->  | AI83: =RC[-28] ->  | AJ83: =RC[-28] ->  | AK83: =RC[-28] ->  | AL83: =RC[-28] -> 0 | AM83: =RC[-28] ->  | AN83: =RC[-28] ->  | AO83: =RC[-28] ->  | AP83: - | AQ83: =RC[-29] -> 0 | AR83: =RC[-29] -> 0 | AS83: - | AT83: =RC[-30] -> 0 | AU83: =RC[-30] -> 0 | AV83: =RC[-30] ->  | AW83: =RC[-30] -> 
AC84: Среднее | AF84: =R[1]C[-28] -> 153.6392222222222 | AG84: =R[1]C[-28] -> 68.599555555555554 | AH84: =R[1]C[-28] -> 7.2779999999999996 | AI84: =R[1]C[-28] -> 135.58588888888892 | AJ84: =R[1]C[-28] -> 46.339333333333322 | AK84: =R[1]C[-28] -> 5.7502222222222228 | AL84: =R[1]C[-28] -> 22.260222222222225 | AM84: =R[1]C[-28] -> 18.053333333333335 | AN84: =R[1]C[-28] -> 13.741777777777781 | AO84: =R[1]C[-28] -> 68.362444444444435 | AP84: - | AQ84: =R[1]C[-29] -> 0 | AR84: =R[1]C[-29] -> 0 | AS84: - | AT84: =R[1]C[-30] -> 0 | AU84: =R[1]C[-30] -> 0
B85: Среднее | D85: =AVERAGE(OFFSET(R[-74]C,3,0,R7C1,1)) -> 153.6392222222222 | E85: =AVERAGE(OFFSET(R[-74]C,3,0,R7C1,1)) -> 68.599555555555554 | F85: =AVERAGE(OFFSET(R[-74]C,3,0,R7C1,1)) -> 7.2779999999999996 | G85: =AVERAGE(OFFSET(R[-74]C,3,0,R7C1,1)) -> 135.58588888888892 | H85: =AVERAGE(OFFSET(R[-74]C,3,0,R7C1,1)) -> 46.339333333333322 | I85: =AVERAGE(OFFSET(R[-74]C,3,0,R7C1,1)) -> 5.7502222222222228 | J85: =AVERAGE(OFFSET(R[-74]C,3,0,R7C1,1)) -> 22.260222222222225 | K85: =AVERAGE(OFFSET(R[-74]C,3,0,R7C1,1)) -> 18.053333333333335 | L85: =IF(SUM(OFFSET(R[-74]C,3,0,R7C1,1))=0,"",AVERAGE(OFFSET(R[-74]C,3,0,R7C1,1))) -> 13.741777777777781 | M85: =IF(SUM(OFFSET(R[-74]C,3,0,R7C1,1))=0,"",AVERAGE(OFFSET(R[-74]C,3,0,R7C1,1))) -> 68.362444444444435 | R85: =IF(SUM(OFFSET(R[-74]C,3,0,R7C1,1))=0,"",AVERAGE(OFFSET(R[-74]C,3,0,R7C1,1))) -> 0.92052683999999962 | S85: =AVERAGE(OFFSET(R[-74]C,3,0,R7C1,1)) -> 4.126849062222222 | T85: =AVERAGE(OFFSET(R[-74]C,3,0,R7C1,1)) -> 4.1163483774074079 | W85: =AVERAGE(OFFSET(R[-74]C,3,0,R7C1,1)) -> 0.92185669999999997 | X85: =AVERAGE(OFFSET(R[-74]C,3,0,R7C1,1)) -> #VALUE! | AC85: Итого | AE85: =R[1]C[-28] -> 720 | AF85: =R[1]C[-28] -> 4609.1766666666663 | AI85: =R[1]C[-28] -> 4067.5766666666677 | AM85: =R[1]C[-28] -> 541.6 | AN85: =R[1]C[-28] -> 412.25333333333344 | AQ85: =R[1]C[-29] -> 0 | AU85: =R[1]C[-30] -> 0 | AV85: =R[1]C[-30] -> 27.61580519999999 | AW85: =R[1]C[-30] -> 123.80547186666666
B86: ИТОГО: | C86: =SUM(OFFSET(R[-75]C,3,0,R7C1,1)) -> 720 | D86: =SUM(OFFSET(R[-75]C,3,0,R7C1,1)) -> 4609.1766666666663 | G86: =SUM(OFFSET(R[-75]C,3,0,R7C1,1)) -> 4067.5766666666677 | K86: =SUM(OFFSET(R[-75]C,3,0,R7C1,1)) -> 541.6 | L86: =IF(SUM(OFFSET(R[-75]C,3,0,R7C1,1))=0,"",SUM(OFFSET(R[-75]C,3,0,R7C1,1))) -> 412.25333333333344 | R86: =IF(SUM(OFFSET(R[-75]C,3,0,R7C1,1))=0,"",SUM(OFFSET(R[-75]C,3,0,R7C1,1))) -> 27.61580519999999 | S86: =SUM(OFFSET(R[-75]C,3,0,R7C1,1)) -> 123.80547186666666 | T86: =SUM(OFFSET(R[-75]C,3,0,R7C1,1)) -> 123.49045132222223 | W86: =SUM(OFFSET(R[-75]C,3,0,R7C1,1)) -> 27.655701000000001 | X86: =SUM(OFFSET(R[-75]C,3,0,R7C1,1)) -> #VALUE!
AC87: Досчёт | AF87: =R[1]C[-28] -> 0 | AI87: =R[1]C[-28] -> 0 | AM87: =R[1]C[-28] -> 0 | AN87: =R[1]C[-28] -> 0 | AQ87: =R[1]C[-29] -> 0 | AU87: =R[1]C[-30] -> 0 | AV87: =R[1]C[-30] -> 0 | AW87: =R[1]C[-30] -> 0
A88: 11дн=264ч 4дн=96ч | B88: Досчёт до конца м-ца (+) | C88: =R6C1*24 -> 216 | T88: № 30155 | AC88: Снятие | AF88: =-R[1]C[-28] -> 0 | AI88: =-R[1]C[-28] -> 0 | AM88: =-R[1]C[-28] -> 0 | AN88: =-R[1]C[-28] -> 0 | AQ88: =-R[1]C[-29] -> 0 | AU88: =-R[1]C[-30] -> 0 | AV88: =-R[1]C[-30] -> 0 | AW88: =-R[1]C[-30] -> 0
A89: 9дн=216ч 7дн=168ч | B89: Вычет с предыдущего (-) | C89: =R4C1*24 -> 192 | AC89: Сумма | AF89: =R[1]C[-28] -> 4609.1766666666663 | AI89: =R[1]C[-28] -> 4067.5766666666677 | AM89: =R[1]C[-28] -> 541.6 | AN89: =R[1]C[-28] -> 412.25333333333344 | AQ89: =R[1]C[-29] -> 0 | AU89: =R[1]C[-30] -> 0 | AV89: =R[1]C[-30] -> 27.61580519999999 | AW89: =R[1]C[-30] -> 123.80547186666666
B90: СУММА: | C90: =R[-4]C+R[-2]C-R[-1]C -> 744 | D90: =R[-4]C+R[-2]C-R[-1]C -> 4609.1766666666663 | G90: =R[-4]C+R[-2]C-R[-1]C -> 4067.5766666666677 | K90: =R[-4]C+R[-2]C-R[-1]C -> 541.6 | L90: =IF(SUM(OFFSET(R[-79]C,3,0,R7C1,1))=0,"",(R[-4]C+R[-2]C-R[-1]C)) -> 412.25333333333344 | R90: =IF(SUM(OFFSET(R[-79]C,3,0,R7C1,1))=0,"",(R[-4]C+R[-2]C-R[-1]C)) -> 27.61580519999999 | S90: =R[-4]C+R[-2]C-R[-1]C -> 123.80547186666666
AC91: Тхв на источнике | AE91: V гвс (м3) | AF91: =R[-2]C[15] -> 0 | AG91: W гвс (Гкал) | AH91: =RC[-2]*0.06 -> 0 | AI91: W без гвс (Гкал) | AJ91: =R[-2]C[13]-RC[-2] -> 123.80547186666666
B92: Показания счетчиков на момент снятия данных:
B93: Дата, время | D93: М1, т | F93: М2, т | H93: М3, т | J93: М4, т | L93: Qо, Гкал | N93: Qг, Гкал | P93: время, час
B94: 23.09.18 01:00 | D94: 47903.25 | F94: 42701.3 | H94: 6816.92 | J94: - | L94: 1418.172 | N94: 483.8 | P94: -
B95: 23.10.18 03:00 | D95: 52557.04 | F95: 46804.45 | H95: 7250.52 | J95: - | L95: 1543.0350000000001 | N95: 513.23699999999997 | P95: -
AC97: =ZAYAVKA_N -> з.н д. №02/147-2783 от 04.10.18 25.09.18г, 27.09.18г, 17.10.18г, с 19.10.18г по 22.10.18г, 17.10.18г, с 19.10.18г по 22.10.18г некорректная работа приборов
B98: Представитель потребителя:_______________________________________________________________________ В.О. Топорков
I101: Рекомендуемые значения по параметрам теплопотребления (не являются официально утверждёнными)
I102: М, т | J102: V, м3 | K102: Qгвс, Гкал | L102: Qотоп, Гкал | M102: Qо, Гкал
I103: =R[-13]C[-3] -> 0 | J103: =RC[-1]/0.98 -> 0 | K103: =RC[-1]*0.06 -> 0 | L103: =RC[1]-RC[-1] -> 27.61580519999999 | M103: =R[-13]C[5] -> 27.61580519999999
O105: ДЛЯ САМОКОНТРОЛЯ
B106: В строке выбора дат указать период с 16.7.13 по 23.8.13 - жильё | N106: Q | O106: Qг
B107: В строке выбора дат указать период с 18.7.13 по 25.8.13 - не жилое | N107: =(R[-21]C[-10]*R[-22]C[-7]-R[-21]C[-9]*R[-22]C[-6])/1000 -> 624.93931539592597 | O107: =IF(R[-22]C[-2]="",R[-21]C[-3]*R[-22]C/1000,"") ->  | P107: Си2
O108: =IF(R[-23]C[-2]="","",((R[-22]C[-3]*R[-23]C)-(R[-22]C[-2]*R[-23]C[2]))/1000) -> 0 | P108: Си3