Sheet: Лист1
G1: Отчёт о теплопотреблении за октябрь 2018 | M1: з.н д. №02/147-2783 от 04.10.18 с 26.09.18г по 01.10.18г некорректная работа приборов
A4: =EOMONTH(R[9]C,0)-R[9]C -> 8 | B4: Потребитель: ЗАО "Сити Сервис"
A5: =MAX(R[9]C:R[78]C) -> 2018-10-22T00:00:00.000 | B5: Адрес: г. СПб, Беринга ул., д.36
A6: =EOMONTH(R[-1]C,0)-R[-1]C -> 9 | B6: Телефон: 8-911-021-19-79
A7: =R[-2]C-R[6]C -> 30 | B7: Договор 10023-9
A8: 7 | B8: Тепловычислитель: ТСРВ-026М № 1412633 | L8: М2 мах= | M8: 180 | O8: Мгвс мах= | P8: 98.4
L9: Qотоп мах= | M9: 14.16 | O9: Qгвс мах= | P9: 6
B10: Расчётная формула: Q=M1*(h1-hхв)-M2*(h2-hхв)
D12: Учет | L12: Контроль
A13: =R[1]C[1]-1 -> 2018-09-22T00:00:00.000 | B13: Дата | C13: N, ч | D13: M1, т | E13: T1, С | F13: P1, кг/см2 | G13: M2, т | H13: T2, С | I13: P2, кг/см2 | J13: dT, С | K13: M1-М2, т | L13: V3, м3 | M13: T3, С | N13: V4, м3 | O13: =IF(R[-12]C[-14]="м.куб","","T4, С") -> T4, С | P13: dT, С | Q13: V3-V4, м3 | R13: Qгвс, Гкал | S13: Qобщ., Гкал | T13: Q | U13: M3 | V13: M4 | W13: си2 | X13: си3 | Y13: Разб. | Z13: dM2 | AC13: Дата | AD13: НС | AE13: n, ч | AF13: М1, т | AG13: t1, гр. С | AH13: Р1, кгс/см2 | AI13: М2, т | AJ13: t2, гр. С | AK13: Р2, кгс/см2 | AL13: t1-t2, гр. С | AM13: М1-М2, т | AN13: М1гвс, т | AO13: t1гвс, гр. С | AP13: Р1гвс, кгс/см2 | AQ13: М2гвс, т | AR13: t2гвс, гр. С | AS13: Р2гвс, кгс/см2 | AT13: t1гвс-t2гвс | AU13: М1гвс-М2гвс, т | AV13: Wгвс, Гкал | AW13: Wсумм, Гкал | AY13: NS_TV1 | AZ13: НС | BA13: NS_TV2
A14: =IF(RC[1]="","",DATEVALUE(RC[1])) -> 43366 | B14: 23.09.18 | C14: 24 | D14: 0 | E14: 60.46 | F14: 8.1734039999999997 | G14: 0 | H14: 24.69 | I14: 0.82652400000000004 | J14: =RC[-5]-RC[-2] -> 35.769999999999996 | K14: 0 | L14: 18.1436462402344 | M14: 59.7 | R14: 1.11150097846985 | S14: =RC[-1] -> 1.11150097846985 | T14: =(RC[-16]*RC[-15]-RC[-13]*RC[-12])/1000 -> 0 | U14: 17.822847366333001 | V14: - | W14: =RC[-2]*RC[-10]/1000 -> 1.0640239877700801 | X14: =ABS((RC[-3]*RC[-11]-RC[-2]*RC[-9])/1000) -> #VALUE! | Y14: =(RC[-14]-RC[1])/RC[-18]*100 -> #DIV/0! | Z14: 17.822847366333001 | AC14: =VALUE(RC[-27]) -> 2018-09-23T00:00:00.000 | AD14: =IF(RC[21]=42,"*",IF(RC[21]=32,"",RC[21])) -> - | AE14: =RC[-28] -> 24 | AF14: =RC[-28] -> 0 | AG14: =RC[-28] -> 60.46 | AH14: =RC[-28] -> 8.1734039999999997 | AI14: =RC[-28] -> 0 | AJ14: =RC[-28] -> 24.69 | AK14: =RC[-28] -> 0.82652400000000004 | AL14: =RC[-28] -> 35.769999999999996 | AM14: =RC[-28] -> 0 | AN14: =RC[-28] -> 18.1436462402344 | AO14: =RC[-28] -> 59.7 | AP14: - | AQ14: =RC[-29] -> 0 | AR14: =RC[-29] -> 0 | AS14: - | AT14: =RC[-30] -> 0 | AU14: =RC[-30] -> 0 | AV14: =RC[-30] -> 1.11150097846985 | AW14: =RC[-30] -> 1.11150097846985 | AY14: - | AZ14: - | BA14: -
A15: =IF(RC[1]="","",DATEVALUE(RC[1])) -> 43367 | B15: 24.09.18 | C15: 24 | D15: 0 | E15: 59.28 | F15: 8.0611599999999992 | G15: 0 | H15: 24.5 | I15: 0.80611600000000005 | J15: =RC[-5]-RC[-2] -> 34.78 | K15: 0 | L15: 14.985705375671399 | M15: 58.48 | R15: 0.88538742065429699 | S15: =RC[-1] -> 0.88538742065429699 | T15: =(RC[-16]*RC[-15]-RC[-13]*RC[-12])/1000 -> 0 | U15: 14.7387809753418 | V15: - | W15: =RC[-2]*RC[-10]/1000 -> 0.86192391143798841 | X15: =ABS((RC[-3]*RC[-11]-RC[-2]*RC[-9])/1000) -> #VALUE! | Y15: =(RC[-14]-RC[1])/RC[-18]*100 -> #DIV/0! | Z15: 14.7387809753418 | AC15: =VALUE(RC[-27]) -> 2018-09-24T00:00:00.000 | AD15: =IF(RC[21]=42,"*",IF(RC[21]=32,"",RC[21])) -> - | AE15: =RC[-28] -> 24 | AF15: =RC[-28] -> 0 | AG15: =RC[-28] -> 59.28 | AH15: =RC[-28] -> 8.0611599999999992 | AI15: =RC[-28] -> 0 | AJ15: =RC[-28] -> 24.5 | AK15: =RC[-28] -> 0.80611600000000005 | AL15: =RC[-28] -> 34.78 | AM15: =RC[-28] -> 0 | AN15: =RC[-28] -> 14.985705375671399 | AO15: =RC[-28] -> 58.48 | AP15: - | AQ15: =RC[-29] -> 0 | AR15: =RC[-29] -> 0 | AS15: - | AT15: =RC[-30] -> 0 | AU15: =RC[-30] -> 0 | AV15: =RC[-30] -> 0.88538742065429699 | AW15: =RC[-30] -> 0.88538742065429699 | AY15: - | AZ15: - | BA15: -
A16: =IF(RC[1]="","",DATEVALUE(RC[1])) -> 43368 | B16: 25.09.18 | C16: 24 | D16: 0 | E16: 59.42 | F16: 8.1223840000000003 | G16: 0 | H16: 23.99 | I16: 0.77550399999999997 | J16: =RC[-5]-RC[-2] -> 35.430000000000007 | K16: 0 | L16: 16.853593826293899 | M16: 58.68 | R16: 0.99980217218399003 | S16: =RC[-1] -> 0.99980217218399003 | T16: =(RC[-16]*RC[-15]-RC[-13]*RC[-12])/1000 -> 0 | U16: 16.573877334594702 | V16: - | W16: =RC[-2]*RC[-10]/1000 -> 0.97255512199401706 | X16: =ABS((RC[-3]*RC[-11]-RC[-2]*RC[-9])/1000) -> #VALUE! | Y16: =(RC[-14]-RC[1])/RC[-18]*100 -> #DIV/0! | Z16: 16.573877334594702 | AC16: =VALUE(RC[-27]) -> 2018-09-25T00:00:00.000 | AD16: =IF(RC[21]=42,"*",IF(RC[21]=32,"",RC[21])) -> - | AE16: =RC[-28] -> 24 | AF16: =RC[-28] -> 0 | AG16: =RC[-28] -> 59.42 | AH16: =RC[-28] -> 8.1223840000000003 | AI16: =RC[-28] -> 0 | AJ16: =RC[-28] -> 23.99 | AK16: =RC[-28] -> 0.77550399999999997 | AL16: =RC[-28] -> 35.430000000000007 | AM16: =RC[-28] -> 0 | AN16: =RC[-28] -> 16.853593826293899 | AO16: =RC[-28] -> 58.68 | AP16: - | AQ16: =RC[-29] -> 0 | AR16: =RC[-29] -> 0 | AS16: - | AT16: =RC[-30] -> 0 | AU16: =RC[-30] -> 0 | AV16: =RC[-30] -> 0.99980217218399003 | AW16: =RC[-30] -> 0.99980217218399003 | AY16: - | AZ16: - | BA16: -
A17: =IF(RC[1]="","",DATEVALUE(RC[1])) -> 43369 | B17: 26.09.18 | C17: 24 | D17: 140.21877034505201 | E17: 66.7 | F17: 6.605389333333334 | G17: 127.23296101888032 | H17: 41.363333333333337 | I17: 4.4523453333333327 | J17: 25.336666666666673 | K17: 12.985809326171866 | L17: 18.0551433563232 | M17: 60.68 | R17: 1.1046544313430799 | S17: =RC[1] -> 4.0898126044040177 | T17: =(RC[-16]*RC[-15]-RC[-13]*RC[-12])/1000 -> 4.0898126044040177 | U17: 17.737176895141602 | V17: - | W17: =RC[-2]*RC[-10]/1000 -> 1.0762918939971924 | X17: =ABS((RC[-3]*RC[-11]-RC[-2]*RC[-9])/1000) -> #VALUE! | Y17: =(RC[-14]-RC[1])/RC[-18]*100 -> -3.7343841807349532 | Z17: 17.737176895141602 | AC17: =VALUE(RC[-27]) -> 2018-09-26T00:00:00.000 | AD17: =IF(RC[21]=42,"*",IF(RC[21]=32,"",RC[21])) -> - | AE17: =RC[-28] -> 24 | AF17: =RC[-28] -> 140.21877034505201 | AG17: =RC[-28] -> 66.7 | AH17: =RC[-28] -> 6.605389333333334 | AI17: =RC[-28] -> 127.23296101888032 | AJ17: =RC[-28] -> 41.363333333333337 | AK17: =RC[-28] -> 4.4523453333333327 | AL17: =RC[-28] -> 25.336666666666673 | AM17: =RC[-28] -> 12.985809326171866 | AN17: =RC[-28] -> 18.0551433563232 | AO17: =RC[-28] -> 60.68 | AP17: - | AQ17: =RC[-29] -> 0 | AR17: =RC[-29] -> 0 | AS17: - | AT17: =RC[-30] -> 0 | AU17: =RC[-30] -> 0 | AV17: =RC[-30] -> 1.1046544313430799 | AW17: =RC[-30] -> 4.0898126044040177 | AY17: - | AZ17: - | BA17: -
A18: =IF(RC[1]="","",DATEVALUE(RC[1])) -> 43370 | B18: 27.09.18 | C18: 24 | D18: 140.21877034505201 | E18: 66.7 | F18: 6.605389333333334 | G18: 127.23296101888032 | H18: 41.363333333333337 | I18: 4.4523453333333327 | J18: 25.336666666666673 | K18: 12.985809326171866 | L18: 16.710891723632798 | M18: 62.52 | R18: 1.03120684623718 | S18: =RC[1] -> 4.0898126044040177 | T18: =(RC[-16]*RC[-15]-RC[-13]*RC[-12])/1000 -> 4.0898126044040177 | U18: 16.411375045776399 | V18: - | W18: =RC[-2]*RC[-10]/1000 -> 1.0260391678619405 | X18: =ABS((RC[-3]*RC[-11]-RC[-2]*RC[-9])/1000) -> #VALUE! | Y18: =(RC[-14]-RC[1])/RC[-18]*100 -> -2.6923571472145551 | Z18: 16.411375045776399 | AC18: =VALUE(RC[-27]) -> 2018-09-27T00:00:00.000 | AD18: =IF(RC[21]=42,"*",IF(RC[21]=32,"",RC[21])) -> - | AE18: =RC[-28] -> 24 | AF18: =RC[-28] -> 140.21877034505201 | AG18: =RC[-28] -> 66.7 | AH18: =RC[-28] -> 6.605389333333334 | AI18: =RC[-28] -> 127.23296101888032 | AJ18: =RC[-28] -> 41.363333333333337 | AK18: =RC[-28] -> 4.4523453333333327 | AL18: =RC[-28] -> 25.336666666666673 | AM18: =RC[-28] -> 12.985809326171866 | AN18: =RC[-28] -> 16.710891723632798 | AO18: =RC[-28] -> 62.52 | AP18: - | AQ18: =RC[-29] -> 0 | AR18: =RC[-29] -> 0 | AS18: - | AT18: =RC[-30] -> 0 | AU18: =RC[-30] -> 0 | AV18: =RC[-30] -> 1.03120684623718 | AW18: =RC[-30] -> 4.0898126044040177 | AY18: - | AZ18: - | BA18: -
A19: =IF(RC[1]="","",DATEVALUE(RC[1])) -> 43371 | B19: 28.09.18 | C19: 24 | D19: 140.21877034505201 | E19: 66.7 | F19: 6.605389333333334 | G19: 127.23296101888032 | H19: 41.363333333333337 | I19: 4.4523453333333327 | J19: 25.336666666666673 | K19: 12.985809326171866 | L19: 13.5343990325928 | M19: 66.790000000000006 | R19: 0.89499419927597001 | S19: =RC[1] -> 4.0898126044040177 | T19: =(RC[-16]*RC[-15]-RC[-13]*RC[-12])/1000 -> 4.0898126044040177 | U19: 13.257469177246101 | V19: - | W19: =RC[-2]*RC[-10]/1000 -> 0.88546636634826714 | X19: =ABS((RC[-3]*RC[-11]-RC[-2]*RC[-9])/1000) -> #VALUE! | Y19: =(RC[-14]-RC[1])/RC[-18]*100 -> -0.21351373802730461 | Z19: 13.257469177246101 | AC19: =VALUE(RC[-27]) -> 2018-09-28T00:00:00.000 | AD19: =IF(RC[21]=42,"*",IF(RC[21]=32,"",RC[21])) -> - | AE19: =RC[-28] -> 24 | AF19: =RC[-28] -> 140.21877034505201 | AG19: =RC[-28] -> 66.7 | AH19: =RC[-28] -> 6.605389333333334 | AI19: =RC[-28] -> 127.23296101888032 | AJ19: =RC[-28] -> 41.363333333333337 | AK19: =RC[-28] -> 4.4523453333333327 | AL19: =RC[-28] -> 25.336666666666673 | AM19: =RC[-28] -> 12.985809326171866 | AN19: =RC[-28] -> 13.5343990325928 | AO19: =RC[-28] -> 66.790000000000006 | AP19: - | AQ19: =RC[-29] -> 0 | AR19: =RC[-29] -> 0 | AS19: - | AT19: =RC[-30] -> 0 | AU19: =RC[-30] -> 0 | AV19: =RC[-30] -> 0.89499419927597001 | AW19: =RC[-30] -> 4.0898126044040177 | AY19: - | AZ19: - | BA19: -
A20: =IF(RC[1]="","",DATEVALUE(RC[1])) -> 43372 | B20: 29.09.18 | C20: 24 | D20: 140.21877034505201 | E20: 66.7 | F20: 6.605389333333334 | G20: 127.23296101888032 | H20: 41.363333333333337 | I20: 4.4523453333333327 | J20: 25.336666666666673 | K20: 12.985809326171866 | L20: 14.9455099105835 | M20: 66.22 | R20: 0.97399371862411499 | S20: =RC[1] -> 4.0898126044040177 | T20: =(RC[-16]*RC[-15]-RC[-13]*RC[-12])/1000 -> 4.0898126044040177 | U20: 14.648138999939 | V20: - | W20: =RC[-2]*RC[-10]/1000 -> 0.9699997645759606 | X20: =ABS((RC[-3]*RC[-11]-RC[-2]*RC[-9])/1000) -> #VALUE! | Y20: =(RC[-14]-RC[1])/RC[-18]*100 -> -1.3065243946656702 | Z20: 14.648138999939 | AC20: =VALUE(RC[-27]) -> 2018-09-29T00:00:00.000 | AD20: =IF(RC[21]=42,"*",IF(RC[21]=32,"",RC[21])) -> - | AE20: =RC[-28] -> 24 | AF20: =RC[-28] -> 140.21877034505201 | AG20: =RC[-28] -> 66.7 | AH20: =RC[-28] -> 6.605389333333334 | AI20: =RC[-28] -> 127.23296101888032 | AJ20: =RC[-28] -> 41.363333333333337 | AK20: =RC[-28] -> 4.4523453333333327 | AL20: =RC[-28] -> 25.336666666666673 | AM20: =RC[-28] -> 12.985809326171866 | AN20: =RC[-28] -> 14.9455099105835 | AO20: =RC[-28] -> 66.22 | AP20: - | AQ20: =RC[-29] -> 0 | AR20: =RC[-29] -> 0 | AS20: - | AT20: =RC[-30] -> 0 | AU20: =RC[-30] -> 0 | AV20: =RC[-30] -> 0.97399371862411499 | AW20: =RC[-30] -> 4.0898126044040177 | AY20: - | AZ20: - | BA20: -
A21: =IF(RC[1]="","",DATEVALUE(RC[1])) -> 43373 | B21: 30.09.18 | C21: 24 | D21: 140.21877034505201 | E21: 66.7 | F21: 6.605389333333334 | G21: 127.23296101888032 | H21: 41.363333333333337 | I21: 4.4523453333333327 | J21: 25.336666666666673 | K21: 12.985809326171866 | L21: 16.479906082153299 | M21: 68.67 | R21: 1.1188536882400499 | S21: =RC[1] -> 4.0898126044040177 | T21: =(RC[-16]*RC[-15]-RC[-13]*RC[-12])/1000 -> 4.0898126044040177 | U21: 16.1252956390381 | V21: - | W21: =RC[-2]*RC[-10]/1000 -> 1.1073240515327463 | X21: =ABS((RC[-3]*RC[-11]-RC[-2]*RC[-9])/1000) -> #VALUE! | Y21: =(RC[-14]-RC[1])/RC[-18]*100 -> -2.4675102172623022 | Z21: 16.1252956390381 | AC21: =VALUE(RC[-27]) -> 2018-09-30T00:00:00.000 | AD21: =IF(RC[21]=42,"*",IF(RC[21]=32,"",RC[21])) -> - | AE21: =RC[-28] -> 24 | AF21: =RC[-28] -> 140.21877034505201 | AG21: =RC[-28] -> 66.7 | AH21: =RC[-28] -> 6.605389333333334 | AI21: =RC[-28] -> 127.23296101888032 | AJ21: =RC[-28] -> 41.363333333333337 | AK21: =RC[-28] -> 4.4523453333333327 | AL21: =RC[-28] -> 25.336666666666673 | AM21: =RC[-28] -> 12.985809326171866 | AN21: =RC[-28] -> 16.479906082153299 | AO21: =RC[-28] -> 68.67 | AP21: - | AQ21: =RC[-29] -> 0 | AR21: =RC[-29] -> 0 | AS21: - | AT21: =RC[-30] -> 0 | AU21: =RC[-30] -> 0 | AV21: =RC[-30] -> 1.1188536882400499 | AW21: =RC[-30] -> 4.0898126044040177 | AY21: - | AZ21: - | BA21: -
A22: =IF(RC[1]="","",DATEVALUE(RC[1])) -> 43374 | B22: 01.10.18 | C22: 24 | D22: =AVERAGE(R[1]C:R[3]C) -> 140.21877034505201 | E22: =AVERAGE(R[1]C:R[3]C) -> 66.7 | F22: =AVERAGE(R[1]C:R[3]C) -> 6.605389333333334 | G22: =AVERAGE(R[1]C:R[3]C) -> 127.23296101888032 | H22: =AVERAGE(R[1]C:R[3]C) -> 41.363333333333337 | I22: =AVERAGE(R[1]C:R[3]C) -> 4.4523453333333327 | J22: =AVERAGE(R[1]C:R[3]C) -> 25.336666666666673 | K22: =AVERAGE(R[1]C:R[3]C) -> 12.985809326171866 | L22: 15.4284915924072 | M22: 67.099999999999994 | R22: 1.01926052570343 | S22: =RC[1] -> 4.0898126044040177 | T22: =(RC[-16]*RC[-15]-RC[-13]*RC[-12])/1000 -> 4.0898126044040177 | U22: 15.113247871398899 | V22: - | W22: =RC[-2]*RC[-10]/1000 -> 1.014098932170866 | X22: =ABS((RC[-3]*RC[-11]-RC[-2]*RC[-9])/1000) -> #VALUE! | Y22: =(RC[-14]-RC[1])/RC[-18]*100 -> -1.6720812973230568 | Z22: 15.113247871398899 | AC22: =VALUE(RC[-27]) -> 2018-10-01T00:00:00.000 | AD22: =IF(RC[21]=42,"*",IF(RC[21]=32,"",RC[21])) -> - | AE22: =RC[-28] -> 24 | AF22: =RC[-28] -> 140.21877034505201 | AG22: =RC[-28] -> 66.7 | AH22: =RC[-28] -> 6.605389333333334 | AI22: =RC[-28] -> 127.23296101888032 | AJ22: =RC[-28] -> 41.363333333333337 | AK22: =RC[-28] -> 4.4523453333333327 | AL22: =RC[-28] -> 25.336666666666673 | AM22: =RC[-28] -> 12.985809326171866 | AN22: =RC[-28] -> 15.4284915924072 | AO22: =RC[-28] -> 67.099999999999994 | AP22: - | AQ22: =RC[-29] -> 0 | AR22: =RC[-29] -> 0 | AS22: - | AT22: =RC[-30] -> 0 | AU22: =RC[-30] -> 0 | AV22: =RC[-30] -> 1.01926052570343 | AW22: =RC[-30] -> 4.0898126044040177 | AY22: - | AZ22: - | BA22: -
A23: =IF(RC[1]="","",DATEVALUE(RC[1])) -> 43375 | B23: 02.10.18 | C23: 24 | D23: 144.66905212402301 | E23: 66.84 | F23: 6.6836200000000003 | G23: 132.30114746093801 | H23: 42.11 | I23: 4.3571080000000002 | J23: =RC[-5]-RC[-2] -> 24.730000000000004 | K23: 12.3679046630859 | L23: 14.5535879135132 | M23: 66.010000000000005 | R23: 0.94727414846420299 | S23: 4.0984725952148402 | T23: =(RC[-16]*RC[-15]-RC[-13]*RC[-12])/1000 -> 4.0984781243895991 | U23: 14.2643089294434 | V23: - | W23: =RC[-2]*RC[-10]/1000 -> 0.94158703243255892 | X23: =ABS((RC[-3]*RC[-11]-RC[-2]*RC[-9])/1000) -> #VALUE! | Y23: =(RC[-14]-RC[1])/RC[-18]*100 -> -1.4333997117579154 | Z23: 14.2643089294434 | AC23: =VALUE(RC[-27]) -> 2018-10-02T00:00:00.000 | AD23: =IF(RC[21]=42,"*",IF(RC[21]=32,"",RC[21])) -> - | AE23: =RC[-28] -> 24 | AF23: =RC[-28] -> 144.66905212402301 | AG23: =RC[-28] -> 66.84 | AH23: =RC[-28] -> 6.6836200000000003 | AI23: =RC[-28] -> 132.30114746093801 | AJ23: =RC[-28] -> 42.11 | AK23: =RC[-28] -> 4.3571080000000002 | AL23: =RC[-28] -> 24.730000000000004 | AM23: =RC[-28] -> 12.3679046630859 | AN23: =RC[-28] -> 14.5535879135132 | AO23: =RC[-28] -> 66.010000000000005 | AP23: - | AQ23: =RC[-29] -> 0 | AR23: =RC[-29] -> 0 | AS23: - | AT23: =RC[-30] -> 0 | AU23: =RC[-30] -> 0 | AV23: =RC[-30] -> 0.94727414846420299 | AW23: =RC[-30] -> 4.0984725952148402 | AY23: - | AZ23: - | BA23: -
A24: =IF(RC[1]="","",DATEVALUE(RC[1])) -> 43376 | B24: 03.10.18 | C24: 24 | D24: 142.039627075195 | E24: 66.97 | F24: 6.6530079999999998 | G24: 128.54806518554699 | H24: 41.73 | I24: 4.4591479999999999 | J24: =RC[-5]-RC[-2] -> 25.240000000000002 | K24: 13.4915618896484 | L24: 16.062341690063501 | M24: 66.150000000000006 | R24: 1.04904890060425 | S24: 4.1500487327575701 | T24: =(RC[-16]*RC[-15]-RC[-13]*RC[-12])/1000 -> 4.1480830650329334 | U24: 15.740970611572299 | V24: - | W24: =RC[-2]*RC[-10]/1000 -> 1.0412652059555079 | X24: =ABS((RC[-3]*RC[-11]-RC[-2]*RC[-9])/1000) -> #VALUE! | Y24: =(RC[-14]-RC[1])/RC[-18]*100 -> -1.7498580929064083 | Z24: 15.740970611572299 | AC24: =VALUE(RC[-27]) -> 2018-10-03T00:00:00.000 | AD24: =IF(RC[21]=42,"*",IF(RC[21]=32,"",RC[21])) -> - | AE24: =RC[-28] -> 24 | AF24: =RC[-28] -> 142.039627075195 | AG24: =RC[-28] -> 66.97 | AH24: =RC[-28] -> 6.6530079999999998 | AI24: =RC[-28] -> 128.54806518554699 | AJ24: =RC[-28] -> 41.73 | AK24: =RC[-28] -> 4.4591479999999999 | AL24: =RC[-28] -> 25.240000000000002 | AM24: =RC[-28] -> 13.4915618896484 | AN24: =RC[-28] -> 16.062341690063501 | AO24: =RC[-28] -> 66.150000000000006 | AP24: - | AQ24: =RC[-29] -> 0 | AR24: =RC[-29] -> 0 | AS24: - | AT24: =RC[-30] -> 0 | AU24: =RC[-30] -> 0 | AV24: =RC[-30] -> 1.04904890060425 | AW24: =RC[-30] -> 4.1500487327575701 | AY24: - | AZ24: - | BA24: -
A25: =IF(RC[1]="","",DATEVALUE(RC[1])) -> 43377 | B25: 04.10.18 | C25: 24 | D25: 133.94763183593801 | E25: 66.290000000000006 | F25: 6.4795400000000001 | G25: 120.84967041015599 | H25: 40.25 | I25: 4.5407799999999998 | J25: =RC[-5]-RC[-2] -> 26.040000000000006 | K25: 13.0979614257813 | L25: 15.6000461578369 | M25: 65.47 | R25: 1.00734150409698 | S25: 4.00909423828125 | T25: =(RC[-16]*RC[-15]-RC[-13]*RC[-12])/1000 -> 4.0151892803955533 | U25: 15.294471740722701 | V25: - | W25: =RC[-2]*RC[-10]/1000 -> 1.0013290648651152 | X25: =ABS((RC[-3]*RC[-11]-RC[-2]*RC[-9])/1000) -> #VALUE! | Y25: =(RC[-14]-RC[1])/RC[-18]*100 -> -1.8175559002242923 | Z25: 15.294471740722701 | AC25: =VALUE(RC[-27]) -> 2018-10-04T00:00:00.000 | AD25: =IF(RC[21]=42,"*",IF(RC[21]=32,"",RC[21])) -> - | AE25: =RC[-28] -> 24 | AF25: =RC[-28] -> 133.94763183593801 | AG25: =RC[-28] -> 66.290000000000006 | AH25: =RC[-28] -> 6.4795400000000001 | AI25: =RC[-28] -> 120.84967041015599 | AJ25: =RC[-28] -> 40.25 | AK25: =RC[-28] -> 4.5407799999999998 | AL25: =RC[-28] -> 26.040000000000006 | AM25: =RC[-28] -> 13.0979614257813 | AN25: =RC[-28] -> 15.6000461578369 | AO25: =RC[-28] -> 65.47 | AP25: - | AQ25: =RC[-29] -> 0 | AR25: =RC[-29] -> 0 | AS25: - | AT25: =RC[-30] -> 0 | AU25: =RC[-30] -> 0 | AV25: =RC[-30] -> 1.00734150409698 | AW25: =RC[-30] -> 4.00909423828125 | AY25: - | AZ25: - | BA25: -
A26: =IF(RC[1]="","",DATEVALUE(RC[1])) -> 43378 | B26: 05.10.18 | C26: 24 | D26: 122.466957092285 | E26: 65.56 | F26: 6.2448480000000002 | G26: 109.495231628418 | H26: 38.5 | I26: 4.6632280000000002 | J26: =RC[-5]-RC[-2] -> 27.060000000000002 | K26: 12.9717254638672 | L26: 15.2202711105347 | M26: 64.72 | R26: 0.97335046529769897 | S26: 3.8123226165771502 | T26: =(RC[-16]*RC[-15]-RC[-13]*RC[-12])/1000 -> 3.8133672892761123 | U26: 14.927395820617701 | V26: - | W26: =RC[-2]*RC[-10]/1000 -> 0.96610105751037756 | X26: =ABS((RC[-3]*RC[-11]-RC[-2]*RC[-9])/1000) -> #VALUE! | Y26: =(RC[-14]-RC[1])/RC[-18]*100 -> -1.7860781037362845 | Z26: 14.927395820617701 | AC26: =VALUE(RC[-27]) -> 2018-10-05T00:00:00.000 | AD26: =IF(RC[21]=42,"*",IF(RC[21]=32,"",RC[21])) -> - | AE26: =RC[-28] -> 24 | AF26: =RC[-28] -> 122.466957092285 | AG26: =RC[-28] -> 65.56 | AH26: =RC[-28] -> 6.2448480000000002 | AI26: =RC[-28] -> 109.495231628418 | AJ26: =RC[-28] -> 38.5 | AK26: =RC[-28] -> 4.6632280000000002 | AL26: =RC[-28] -> 27.060000000000002 | AM26: =RC[-28] -> 12.9717254638672 | AN26: =RC[-28] -> 15.2202711105347 | AO26: =RC[-28] -> 64.72 | AP26: - | AQ26: =RC[-29] -> 0 | AR26: =RC[-29] -> 0 | AS26: - | AT26: =RC[-30] -> 0 | AU26: =RC[-30] -> 0 | AV26: =RC[-30] -> 0.97335046529769897 | AW26: =RC[-30] -> 3.8123226165771502 | AY26: - | AZ26: - | BA26: -
A27: =IF(RC[1]="","",DATEVALUE(RC[1])) -> 43379 | B27: 06.10.18 | C27: 24 | D27: 123.73468780517599 | E27: 66.25 | F27: 6.1938279999999999 | G27: 110.314079284668 | H27: 39.42 | I27: 4.5918000000000001 | J27: =RC[-5]-RC[-2] -> 26.83 | K27: 13.4206085205078 | L27: 15.8213748931885 | M27: 65.41 | R27: 1.0254487991332999 | S27: 3.8529496192932098 | T27: =(RC[-16]*RC[-15]-RC[-13]*RC[-12])/1000 -> 3.8488420616912973 | U27: 15.5089826583862 | V27: - | W27: =RC[-2]*RC[-10]/1000 -> 1.0144425556850414 | X27: =ABS((RC[-3]*RC[-11]-RC[-2]*RC[-9])/1000) -> #VALUE! | Y27: =(RC[-14]-RC[1])/RC[-18]*100 -> -1.893116591663067 | Z27: 15.5089826583862 | AC27: =VALUE(RC[-27]) -> 2018-10-06T00:00:00.000 | AD27: =IF(RC[21]=42,"*",IF(RC[21]=32,"",RC[21])) -> - | AE27: =RC[-28] -> 24 | AF27: =RC[-28] -> 123.73468780517599 | AG27: =RC[-28] -> 66.25 | AH27: =RC[-28] -> 6.1938279999999999 | AI27: =RC[-28] -> 110.314079284668 | AJ27: =RC[-28] -> 39.42 | AK27: =RC[-28] -> 4.5918000000000001 | AL27: =RC[-28] -> 26.83 | AM27: =RC[-28] -> 13.4206085205078 | AN27: =RC[-28] -> 15.8213748931885 | AO27: =RC[-28] -> 65.41 | AP27: - | AQ27: =RC[-29] -> 0 | AR27: =RC[-29] -> 0 | AS27: - | AT27: =RC[-30] -> 0 | AU27: =RC[-30] -> 0 | AV27: =RC[-30] -> 1.0254487991332999 | AW27: =RC[-30] -> 3.8529496192932098 | AY27: - | AZ27: - | BA27: -
A28: =IF(RC[1]="","",DATEVALUE(RC[1])) -> 43380 | B28: 07.10.18 | C28: 24 | D28: 123.53742980957 | E28: 66.48 | F28: 6.1734200000000001 | G28: 108.96314239502 | H28: 39.43 | I28: 4.6122079999999999 | J28: =RC[-5]-RC[-2] -> 27.050000000000004 | K28: 14.574287414550801 | L28: 17.382774353027301 | M28: 65.680000000000007 | R28: 1.1279927492141699 | S28: 3.9134325981140101 | T28: =(RC[-16]*RC[-15]-RC[-13]*RC[-12])/1000 -> 3.9163516291045752 | U28: 17.0387477874756 | V28: - | W28: =RC[-2]*RC[-10]/1000 -> 1.1191049546813974 | X28: =ABS((RC[-3]*RC[-11]-RC[-2]*RC[-9])/1000) -> #VALUE! | Y28: =(RC[-14]-RC[1])/RC[-18]*100 -> -2.2617376103109099 | Z28: 17.0387477874756 | AC28: =VALUE(RC[-27]) -> 2018-10-07T00:00:00.000 | AD28: =IF(RC[21]=42,"*",IF(RC[21]=32,"",RC[21])) -> - | AE28: =RC[-28] -> 24 | AF28: =RC[-28] -> 123.53742980957 | AG28: =RC[-28] -> 66.48 | AH28: =RC[-28] -> 6.1734200000000001 | AI28: =RC[-28] -> 108.96314239502 | AJ28: =RC[-28] -> 39.43 | AK28: =RC[-28] -> 4.6122079999999999 | AL28: =RC[-28] -> 27.050000000000004 | AM28: =RC[-28] -> 14.574287414550801 | AN28: =RC[-28] -> 17.382774353027301 | AO28: =RC[-28] -> 65.680000000000007 | AP28: - | AQ28: =RC[-29] -> 0 | AR28: =RC[-29] -> 0 | AS28: - | AT28: =RC[-30] -> 0 | AU28: =RC[-30] -> 0 | AV28: =RC[-30] -> 1.1279927492141699 | AW28: =RC[-30] -> 3.9134325981140101 | AY28: - | AZ28: - | BA28: -
A29: =IF(RC[1]="","",DATEVALUE(RC[1])) -> 43381 | B29: 08.10.18 | C29: 24 | D29: 120.60366058349599 | E29: 66.430000000000007 | F29: 6.1530120000000004 | G29: 107.94451904296901 | H29: 38.630000000000003 | I29: 4.6122079999999999 | J29: =RC[-5]-RC[-2] -> 27.800000000000004 | K29: 12.659141540527299 | L29: 15.554873466491699 | M29: 65.489999999999995 | R29: 1.0077018737793 | S29: 3.8411049842834499 | T29: =(RC[-16]*RC[-15]-RC[-13]*RC[-12])/1000 -> 3.8418044019317468 | U29: 15.2480268478394 | V29: - | W29: =RC[-2]*RC[-10]/1000 -> 0.99859327826500222 | X29: =ABS((RC[-3]*RC[-11]-RC[-2]*RC[-9])/1000) -> #VALUE! | Y29: =(RC[-14]-RC[1])/RC[-18]*100 -> -2.3983480868366778 | Z29: 15.2480268478394 | AC29: =VALUE(RC[-27]) -> 2018-10-08T00:00:00.000 | AD29: =IF(RC[21]=42,"*",IF(RC[21]=32,"",RC[21])) -> - | AE29: =RC[-28] -> 24 | AF29: =RC[-28] -> 120.60366058349599 | AG29: =RC[-28] -> 66.430000000000007 | AH29: =RC[-28] -> 6.1530120000000004 | AI29: =RC[-28] -> 107.94451904296901 | AJ29: =RC[-28] -> 38.630000000000003 | AK29: =RC[-28] -> 4.6122079999999999 | AL29: =RC[-28] -> 27.800000000000004 | AM29: =RC[-28] -> 12.659141540527299 | AN29: =RC[-28] -> 15.554873466491699 | AO29: =RC[-28] -> 65.489999999999995 | AP29: - | AQ29: =RC[-29] -> 0 | AR29: =RC[-29] -> 0 | AS29: - | AT29: =RC[-30] -> 0 | AU29: =RC[-30] -> 0 | AV29: =RC[-30] -> 1.0077018737793 | AW29: =RC[-30] -> 3.8411049842834499 | AY29: - | AZ29: - | BA29: -
A30: =IF(RC[1]="","",DATEVALUE(RC[1])) -> 43382 | B30: 09.10.18 | C30: 24 | D30: 124.997886657715 | E30: 66.36 | F30: 6.2856639999999997 | G30: 112.262130737305 | H30: 39.25 | I30: 4.6326159999999996 | J30: =RC[-5]-RC[-2] -> 27.11 | K30: 12.735755920410201 | L30: 15.5050964355469 | M30: 65.430000000000007 | R30: 1.00601541996002 | S30: 3.8905076980590798 | T30: =(RC[-16]*RC[-15]-RC[-13]*RC[-12])/1000 -> 3.8885711271667471 | U30: 15.1983728408813 | V30: - | W30: =RC[-2]*RC[-10]/1000 -> 0.99442953497886355 | X30: =ABS((RC[-3]*RC[-11]-RC[-2]*RC[-9])/1000) -> #VALUE! | Y30: =(RC[-14]-RC[1])/RC[-18]*100 -> -2.1936310172427231 | Z30: 15.1983728408813 | AC30: =VALUE(RC[-27]) -> 2018-10-09T00:00:00.000 | AD30: =IF(RC[21]=42,"*",IF(RC[21]=32,"",RC[21])) -> - | AE30: =RC[-28] -> 24 | AF30: =RC[-28] -> 124.997886657715 | AG30: =RC[-28] -> 66.36 | AH30: =RC[-28] -> 6.2856639999999997 | AI30: =RC[-28] -> 112.262130737305 | AJ30: =RC[-28] -> 39.25 | AK30: =RC[-28] -> 4.6326159999999996 | AL30: =RC[-28] -> 27.11 | AM30: =RC[-28] -> 12.735755920410201 | AN30: =RC[-28] -> 15.5050964355469 | AO30: =RC[-28] -> 65.430000000000007 | AP30: - | AQ30: =RC[-29] -> 0 | AR30: =RC[-29] -> 0 | AS30: - | AT30: =RC[-30] -> 0 | AU30: =RC[-30] -> 0 | AV30: =RC[-30] -> 1.00601541996002 | AW30: =RC[-30] -> 3.8905076980590798 | AY30: - | AZ30: - | BA30: -
A31: =IF(RC[1]="","",DATEVALUE(RC[1])) -> 43383 | B31: 10.10.18 | C31: 24 | D31: 126.27053070068401 | E31: 67.44 | F31: 6.2040319999999998 | G31: 113.12160491943401 | H31: 40.090000000000003 | I31: 4.5203720000000001 | J31: =RC[-5]-RC[-2] -> 27.349999999999994 | K31: 13.14892578125 | L31: 16.005823135376001 | M31: 66.62 | R31: 1.0550221204757699 | S31: 3.9843511581420898 | T31: =(RC[-16]*RC[-15]-RC[-13]*RC[-12])/1000 -> 3.9806394492340198 | U31: 15.6794490814209 | V31: - | W31: =RC[-2]*RC[-10]/1000 -> 1.0445648978042605 | X31: =ABS((RC[-3]*RC[-11]-RC[-2]*RC[-9])/1000) -> #VALUE! | Y31: =(RC[-14]-RC[1])/RC[-18]*100 -> -2.2369938103098486 | Z31: 15.6794490814209 | AC31: =VALUE(RC[-27]) -> 2018-10-10T00:00:00.000 | AD31: =IF(RC[21]=42,"*",IF(RC[21]=32,"",RC[21])) -> - | AE31: =RC[-28] -> 24 | AF31: =RC[-28] -> 126.27053070068401 | AG31: =RC[-28] -> 67.44 | AH31: =RC[-28] -> 6.2040319999999998 | AI31: =RC[-28] -> 113.12160491943401 | AJ31: =RC[-28] -> 40.090000000000003 | AK31: =RC[-28] -> 4.5203720000000001 | AL31: =RC[-28] -> 27.349999999999994 | AM31: =RC[-28] -> 13.14892578125 | AN31: =RC[-28] -> 16.005823135376001 | AO31: =RC[-28] -> 66.62 | AP31: - | AQ31: =RC[-29] -> 0 | AR31: =RC[-29] -> 0 | AS31: - | AT31: =RC[-30] -> 0 | AU31: =RC[-30] -> 0 | AV31: =RC[-30] -> 1.0550221204757699 | AW31: =RC[-30] -> 3.9843511581420898 | AY31: - | AZ31: - | BA31: -
A32: =IF(RC[1]="","",DATEVALUE(RC[1])) -> 43384 | B32: 11.10.18 | C32: 24 | D32: 128.78860473632801 | E32: 68.48 | F32: 6.3060720000000003 | G32: 118.662460327148 | H32: 41.22 | I32: 4.4387400000000001 | J32: =RC[-5]-RC[-2] -> 27.260000000000005 | K32: 10.1261444091797 | L32: 12.427303314209 | M32: 63.94 | R32: 0.82772439718246504 | S32: 3.9296541213989298 | T32: =(RC[-16]*RC[-15]-RC[-13]*RC[-12])/1000 -> 3.9281770376587026 | U32: 12.1687870025635 | V32: - | W32: =RC[-2]*RC[-10]/1000 -> 0.77807224094391014 | X32: =ABS((RC[-3]*RC[-11]-RC[-2]*RC[-9])/1000) -> #VALUE! | Y32: =(RC[-14]-RC[1])/RC[-18]*100 -> -1.7213890456613743 | Z32: 12.1687870025635 | AC32: =VALUE(RC[-27]) -> 2018-10-11T00:00:00.000 | AD32: =IF(RC[21]=42,"*",IF(RC[21]=32,"",RC[21])) -> - | AE32: =RC[-28] -> 24 | AF32: =RC[-28] -> 128.78860473632801 | AG32: =RC[-28] -> 68.48 | AH32: =RC[-28] -> 6.3060720000000003 | AI32: =RC[-28] -> 118.662460327148 | AJ32: =RC[-28] -> 41.22 | AK32: =RC[-28] -> 4.4387400000000001 | AL32: =RC[-28] -> 27.260000000000005 | AM32: =RC[-28] -> 10.1261444091797 | AN32: =RC[-28] -> 12.427303314209 | AO32: =RC[-28] -> 63.94 | AP32: - | AQ32: =RC[-29] -> 0 | AR32: =RC[-29] -> 0 | AS32: - | AT32: =RC[-30] -> 0 | AU32: =RC[-30] -> 0 | AV32: =RC[-30] -> 0.82772439718246504 | AW32: =RC[-30] -> 3.9296541213989298 | AY32: - | AZ32: - | BA32: -
A33: =IF(RC[1]="","",DATEVALUE(RC[1])) -> 43385 | B33: 12.10.18 | C33: 24 | D33: 131.67790222168 | E33: 68.34 | F33: 6.3468879999999999 | G33: 118.386390686035 | H33: 41.06 | I33: 4.4999640000000003 | J33: =RC[-5]-RC[-2] -> 27.28 | K33: 13.291511535644499 | L33: 15.8645429611206 | M33: 67.459999999999994 | R33: 1.05617356300354 | S33: 4.1405935287475604 | T33: =(RC[-16]*RC[-15]-RC[-13]*RC[-12])/1000 -> 4.1379226362610142 | U33: 15.5350856781006 | V33: - | W33: =RC[-2]*RC[-10]/1000 -> 1.0479968798446664 | X33: =ABS((RC[-3]*RC[-11]-RC[-2]*RC[-9])/1000) -> #VALUE! | Y33: =(RC[-14]-RC[1])/RC[-18]*100 -> -1.8951284260419266 | Z33: 15.5350856781006 | AC33: =VALUE(RC[-27]) -> 2018-10-12T00:00:00.000 | AD33: =IF(RC[21]=42,"*",IF(RC[21]=32,"",RC[21])) -> - | AE33: =RC[-28] -> 24 | AF33: =RC[-28] -> 131.67790222168 | AG33: =RC[-28] -> 68.34 | AH33: =RC[-28] -> 6.3468879999999999 | AI33: =RC[-28] -> 118.386390686035 | AJ33: =RC[-28] -> 41.06 | AK33: =RC[-28] -> 4.4999640000000003 | AL33: =RC[-28] -> 27.28 | AM33: =RC[-28] -> 13.291511535644499 | AN33: =RC[-28] -> 15.8645429611206 | AO33: =RC[-28] -> 67.459999999999994 | AP33: - | AQ33: =RC[-29] -> 0 | AR33: =RC[-29] -> 0 | AS33: - | AT33: =RC[-30] -> 0 | AU33: =RC[-30] -> 0 | AV33: =RC[-30] -> 1.05617356300354 | AW33: =RC[-30] -> 4.1405935287475604 | AY33: - | AZ33: - | BA33: -
A34: =IF(RC[1]="","",DATEVALUE(RC[1])) -> 43386 | B34: 13.10.18 | C34: 24 | D34: 137.22441101074199 | E34: 69.52 | F34: 6.5305600000000004 | G34: 124.979484558105 | H34: 42.62 | I34: 4.4693519999999998 | J34: =RC[-5]-RC[-2] -> 26.9 | K34: 12.244926452636699 | L34: 15.003222465515099 | M34: 68.52 | R34: 1.01617479324341 | S34: 4.2184429168701199 | T34: =(RC[-16]*RC[-15]-RC[-13]*RC[-12])/1000 -> 4.2132154216003475 | U34: 14.6814413070679 | V34: - | W34: =RC[-2]*RC[-10]/1000 -> 1.0059723583602924 | X34: =ABS((RC[-3]*RC[-11]-RC[-2]*RC[-9])/1000) -> #VALUE! | Y34: =(RC[-14]-RC[1])/RC[-18]*100 -> -1.949531847603696 | Z34: 14.6814413070679 | AC34: =VALUE(RC[-27]) -> 2018-10-13T00:00:00.000 | AD34: =IF(RC[21]=42,"*",IF(RC[21]=32,"",RC[21])) -> - | AE34: =RC[-28] -> 24 | AF34: =RC[-28] -> 137.22441101074199 | AG34: =RC[-28] -> 69.52 | AH34: =RC[-28] -> 6.5305600000000004 | AI34: =RC[-28] -> 124.979484558105 | AJ34: =RC[-28] -> 42.62 | AK34: =RC[-28] -> 4.4693519999999998 | AL34: =RC[-28] -> 26.9 | AM34: =RC[-28] -> 12.244926452636699 | AN34: =RC[-28] -> 15.003222465515099 | AO34: =RC[-28] -> 68.52 | AP34: - | AQ34: =RC[-29] -> 0 | AR34: =RC[-29] -> 0 | AS34: - | AT34: =RC[-30] -> 0 | AU34: =RC[-30] -> 0 | AV34: =RC[-30] -> 1.01617479324341 | AW34: =RC[-30] -> 4.2184429168701199 | AY34: - | AZ34: - | BA34: -
A35: =IF(RC[1]="","",DATEVALUE(RC[1])) -> 43387 | B35: 14.10.18 | C35: 24 | D35: 138.93019104003901 | E35: 70.3 | F35: 6.4999479999999998 | G35: 126.65713500976599 | H35: 43.61 | I35: 4.377516 | J35: =RC[-5]-RC[-2] -> 26.689999999999998 | K35: 12.2730560302734 | L35: 15.0201301574707 | M35: 69.36 | R35: 1.02883517742157 | S35: 4.2476711273193404 | T35: =(RC[-16]*RC[-15]-RC[-13]*RC[-12])/1000 -> 4.2432747723388466 | U35: 14.6909484863281 | V35: - | W35: =RC[-2]*RC[-10]/1000 -> 1.018964187011717 | X35: =ABS((RC[-3]*RC[-11]-RC[-2]*RC[-9])/1000) -> #VALUE! | Y35: =(RC[-14]-RC[1])/RC[-18]*100 -> -1.9090061178695277 | Z35: 14.6909484863281 | AC35: =VALUE(RC[-27]) -> 2018-10-14T00:00:00.000 | AD35: =IF(RC[21]=42,"*",IF(RC[21]=32,"",RC[21])) -> - | AE35: =RC[-28] -> 24 | AF35: =RC[-28] -> 138.93019104003901 | AG35: =RC[-28] -> 70.3 | AH35: =RC[-28] -> 6.4999479999999998 | AI35: =RC[-28] -> 126.65713500976599 | AJ35: =RC[-28] -> 43.61 | AK35: =RC[-28] -> 4.377516 | AL35: =RC[-28] -> 26.689999999999998 | AM35: =RC[-28] -> 12.2730560302734 | AN35: =RC[-28] -> 15.0201301574707 | AO35: =RC[-28] -> 69.36 | AP35: - | AQ35: =RC[-29] -> 0 | AR35: =RC[-29] -> 0 | AS35: - | AT35: =RC[-30] -> 0 | AU35: =RC[-30] -> 0 | AV35: =RC[-30] -> 1.02883517742157 | AW35: =RC[-30] -> 4.2476711273193404 | AY35: - | AZ35: - | BA35: -
A36: =IF(RC[1]="","",DATEVALUE(RC[1])) -> 43388 | B36: 15.10.18 | C36: 24 | D36: 141.764404296875 | E36: 69.8 | F36: 6.5815799999999998 | G36: 129.89010620117199 | H36: 43.99 | I36: 4.3571080000000002 | J36: =RC[-5]-RC[-2] -> 25.809999999999995 | K36: 11.8742980957031 | L36: 14.5932865142822 | M36: 68.91 | R36: 0.99062854051589999 | S36: 4.1831388473510698 | T36: =(RC[-16]*RC[-15]-RC[-13]*RC[-12])/1000 -> 4.1812896481323198 | U36: 14.2789649963379 | V36: - | W36: =RC[-2]*RC[-10]/1000 -> 0.9839634778976446 | X36: =ABS((RC[-3]*RC[-11]-RC[-2]*RC[-9])/1000) -> #VALUE! | Y36: =(RC[-14]-RC[1])/RC[-18]*100 -> -1.8513087493442222 | Z36: 14.2789649963379 | AC36: =VALUE(RC[-27]) -> 2018-10-15T00:00:00.000 | AD36: =IF(RC[21]=42,"*",IF(RC[21]=32,"",RC[21])) -> - | AE36: =RC[-28] -> 24 | AF36: =RC[-28] -> 141.764404296875 | AG36: =RC[-28] -> 69.8 | AH36: =RC[-28] -> 6.5815799999999998 | AI36: =RC[-28] -> 129.89010620117199 | AJ36: =RC[-28] -> 43.99 | AK36: =RC[-28] -> 4.3571080000000002 | AL36: =RC[-28] -> 25.809999999999995 | AM36: =RC[-28] -> 11.8742980957031 | AN36: =RC[-28] -> 14.5932865142822 | AO36: =RC[-28] -> 68.91 | AP36: - | AQ36: =RC[-29] -> 0 | AR36: =RC[-29] -> 0 | AS36: - | AT36: =RC[-30] -> 0 | AU36: =RC[-30] -> 0 | AV36: =RC[-30] -> 0.99062854051589999 | AW36: =RC[-30] -> 4.1831388473510698 | AY36: - | AZ36: - | BA36: -
A37: =IF(RC[1]="","",DATEVALUE(RC[1])) -> 43389 | B37: 16.10.18 | C37: 24 | D37: 143.55334472656301 | E37: 69.8 | F37: 6.5407640000000002 | G37: 130.18548583984401 | H37: 44.13 | I37: 4.295884 | J37: =RC[-5]-RC[-2] -> 25.669999999999995 | K37: 13.3678588867188 | L37: 16.118770599365199 | M37: 68.819999999999993 | R37: 1.09492075443268 | S37: 4.27746629714966 | T37: =(RC[-16]*RC[-15]-RC[-13]*RC[-12])/1000 -> 4.2749379718017808 | U37: 15.771116256713899 | V37: - | W37: =RC[-2]*RC[-10]/1000 -> 1.0853682207870503 | X37: =ABS((RC[-3]*RC[-11]-RC[-2]*RC[-9])/1000) -> #VALUE! | Y37: =(RC[-14]-RC[1])/RC[-18]*100 -> -1.8460255799572156 | Z37: 15.771116256713899 | AC37: =VALUE(RC[-27]) -> 2018-10-16T00:00:00.000 | AD37: =IF(RC[21]=42,"*",IF(RC[21]=32,"",RC[21])) -> - | AE37: =RC[-28] -> 24 | AF37: =RC[-28] -> 143.55334472656301 | AG37: =RC[-28] -> 69.8 | AH37: =RC[-28] -> 6.5407640000000002 | AI37: =RC[-28] -> 130.18548583984401 | AJ37: =RC[-28] -> 44.13 | AK37: =RC[-28] -> 4.295884 | AL37: =RC[-28] -> 25.669999999999995 | AM37: =RC[-28] -> 13.3678588867188 | AN37: =RC[-28] -> 16.118770599365199 | AO37: =RC[-28] -> 68.819999999999993 | AP37: - | AQ37: =RC[-29] -> 0 | AR37: =RC[-29] -> 0 | AS37: - | AT37: =RC[-30] -> 0 | AU37: =RC[-30] -> 0 | AV37: =RC[-30] -> 1.09492075443268 | AW37: =RC[-30] -> 4.27746629714966 | AY37: - | AZ37: - | BA37: -
A38: =IF(RC[1]="","",DATEVALUE(RC[1])) -> 43390 | B38: 17.10.18 | C38: 24 | D38: 136.12818908691401 | E38: 70.069999999999993 | F38: 6.6734159999999996 | G38: 124.68325805664099 | H38: 43.63 | I38: 4.2754760000000003 | J38: 26.439999999999991 | K38: 11.4449310302734 | L38: 14.044071197509799 | M38: 69.069999999999993 | R38: 0.95731550455093395 | S38: 4.0912322998046902 | T38: 4.098571660308818 | U38: 13.739244461059601 | V38: - | W38: 0.94896961492538656 | X38: #VALUE! | Y38: -1.8401134735699172 | Z38: 13.739244461059601 | AC38: =VALUE(RC[-27]) -> 2018-10-17T00:00:00.000 | AD38: =IF(RC[21]=42,"*",IF(RC[21]=32,"",RC[21])) -> - | AE38: =RC[-28] -> 24 | AF38: =RC[-28] -> 136.12818908691401 | AG38: =RC[-28] -> 70.069999999999993 | AH38: =RC[-28] -> 6.6734159999999996 | AI38: =RC[-28] -> 124.68325805664099 | AJ38: =RC[-28] -> 43.63 | AK38: =RC[-28] -> 4.2754760000000003 | AL38: =RC[-28] -> 26.439999999999991 | AM38: =RC[-28] -> 11.4449310302734 | AN38: =RC[-28] -> 14.044071197509799 | AO38: =RC[-28] -> 69.069999999999993 | AP38: - | AQ38: =RC[-29] -> 0 | AR38: =RC[-29] -> 0 | AS38: - | AT38: =RC[-30] -> 0 | AU38: =RC[-30] -> 0 | AV38: =RC[-30] -> 0.95731550455093395 | AW38: =RC[-30] -> 4.0912322998046902 | AY38: - | AZ38: - | BA38: -
A39: =IF(RC[1]="","",DATEVALUE(RC[1])) -> 43391 | B39: 18.10.18 | C39: 24 | D39: 127.073738098145 | E39: 70.37 | F39: 6.7448439999999996 | G39: 115.969451904297 | H39: 42.85 | I39: 4.3162919999999998 | J39: 27.520000000000003 | K39: 11.104286193847701 | L39: 13.6115875244141 | M39: 69.39 | R39: 0.93212908506393399 | S39: 3.97563695907593 | T39: 3.9728879358673375 | U39: 13.313601493835399 | V39: - | W39: 0.92383080765723835 | X39: #VALUE! | Y39: -1.9050838507117556 | Z39: 13.313601493835399 | AC39: =VALUE(RC[-27]) -> 2018-10-18T00:00:00.000 | AD39: =IF(RC[21]=42,"*",IF(RC[21]=32,"",RC[21])) ->  | AE39: =RC[-28] -> 24 | AF39: =RC[-28] -> 127.073738098145 | AG39: =RC[-28] -> 70.37 | AH39: =RC[-28] -> 6.7448439999999996 | AI39: =RC[-28] -> 115.969451904297 | AJ39: =RC[-28] -> 42.85 | AK39: =RC[-28] -> 4.3162919999999998 | AL39: =RC[-28] -> 27.520000000000003 | AM39: =RC[-28] -> 11.104286193847701 | AN39: =RC[-28] -> 13.6115875244141 | AO39: =RC[-28] -> 69.39 | AP39: - | AQ39: =RC[-29] -> 0 | AR39: =RC[-29] -> 0 | AS39: - | AT39: =RC[-30] -> 0 | AU39: =RC[-30] -> 0 | AV39: =RC[-30] -> 0.93212908506393399 | AW39: =RC[-30] -> 3.97563695907593
A40: =IF(RC[1]="","",DATEVALUE(RC[1])) -> 43392 | B40: 19.10.18 | C40: 24 | D40: 126.95941162109401 | E40: 70.19 | F40: 6.7346399999999997 | G40: 115.299919128418 | H40: 42.43 | I40: 4.3264959999999997 | J40: 27.759999999999998 | K40: 11.659492492675801 | L40: 14.175020217895501 | M40: 69.290000000000006 | R40: 0.96828192472457897 | S40: 4.0211505889892596 | T40: 4.0191055330658125 | U40: 13.8661432266235 | V40: - | W40: 0.96078506417274245 | X40: #VALUE! | Y40: -1.9138354568054725 | Z40: 13.8661432266235 | AC40: =VALUE(RC[-27]) -> 2018-10-19T00:00:00.000 | AD40: =IF(RC[21]=42,"*",IF(RC[21]=32,"",RC[21])) ->  | AE40: =RC[-28] -> 24 | AF40: =RC[-28] -> 126.95941162109401 | AG40: =RC[-28] -> 70.19 | AH40: =RC[-28] -> 6.7346399999999997 | AI40: =RC[-28] -> 115.299919128418 | AJ40: =RC[-28] -> 42.43 | AK40: =RC[-28] -> 4.3264959999999997 | AL40: =RC[-28] -> 27.759999999999998 | AM40: =RC[-28] -> 11.659492492675801 | AN40: =RC[-28] -> 14.175020217895501 | AO40: =RC[-28] -> 69.290000000000006 | AP40: - | AQ40: =RC[-29] -> 0 | AR40: =RC[-29] -> 0 | AS40: - | AT40: =RC[-30] -> 0 | AU40: =RC[-30] -> 0 | AV40: =RC[-30] -> 0.96828192472457897 | AW40: =RC[-30] -> 4.0211505889892596
A41: =IF(RC[1]="","",DATEVALUE(RC[1])) -> 43393 | B41: 20.10.18 | C41: 24 | D41: 121.868408203125 | E41: 69.36 | F41: 6.5815799999999998 | G41: 109.878089904785 | H41: 41.01 | I41: 4.3979239999999997 | J41: 28.35 | K41: 11.990318298339799 | L41: 14.409396171569799 | M41: 68.36 | R41: 0.97279578447341897 | S41: 3.9494800567627002 | T41: 3.9466923259735176 | U41: 14.102247238159199 | V41: - | W41: 0.96402962120056279 | X41: #VALUE! | Y41: -1.9220655743556285 | Z41: 14.102247238159199 | AC41: =VALUE(RC[-27]) -> 2018-10-20T00:00:00.000 | AD41: =IF(RC[21]=42,"*",IF(RC[21]=32,"",RC[21])) ->  | AE41: =RC[-28] -> 24 | AF41: =RC[-28] -> 121.868408203125 | AG41: =RC[-28] -> 69.36 | AH41: =RC[-28] -> 6.5815799999999998 | AI41: =RC[-28] -> 109.878089904785 | AJ41: =RC[-28] -> 41.01 | AK41: =RC[-28] -> 4.3979239999999997 | AL41: =RC[-28] -> 28.35 | AM41: =RC[-28] -> 11.990318298339799 | AN41: =RC[-28] -> 14.409396171569799 | AO41: =RC[-28] -> 68.36 | AP41: - | AQ41: =RC[-29] -> 0 | AR41: =RC[-29] -> 0 | AS41: - | AT41: =RC[-30] -> 0 | AU41: =RC[-30] -> 0 | AV41: =RC[-30] -> 0.97279578447341897 | AW41: =RC[-30] -> 3.9494800567627002
A42: =IF(RC[1]="","",DATEVALUE(RC[1])) -> 43394 | B42: 21.10.18 | C42: 24 | D42: 122.77194976806599 | E42: 68.56 | F42: 6.5815799999999998 | G42: 109.128036499023 | H42: 40.43 | I42: 4.4285360000000003 | J42: 28.130000000000003 | K42: 13.643913269043001 | L42: 16.0855903625488 | M42: 67.66 | R42: 1.07501697540283 | S42: 4.0051155090331996 | T42: 4.0051983604431047 | U42: 15.749189376831101 | V42: - | W42: 1.0655901532363923 | X42: #VALUE! | Y42: -1.9291798655306589 | Z42: 15.749189376831101 | AC42: =VALUE(RC[-27]) -> 2018-10-21T00:00:00.000 | AD42: =IF(RC[21]=42,"*",IF(RC[21]=32,"",RC[21])) ->  | AE42: =RC[-28] -> 24 | AF42: =RC[-28] -> 122.77194976806599 | AG42: =RC[-28] -> 68.56 | AH42: =RC[-28] -> 6.5815799999999998 | AI42: =RC[-28] -> 109.128036499023 | AJ42: =RC[-28] -> 40.43 | AK42: =RC[-28] -> 4.4285360000000003 | AL42: =RC[-28] -> 28.130000000000003 | AM42: =RC[-28] -> 13.643913269043001 | AN42: =RC[-28] -> 16.0855903625488 | AO42: =RC[-28] -> 67.66 | AP42: - | AQ42: =RC[-29] -> 0 | AR42: =RC[-29] -> 0 | AS42: - | AT42: =RC[-30] -> 0 | AU42: =RC[-30] -> 0 | AV42: =RC[-30] -> 1.07501697540283 | AW42: =RC[-30] -> 4.0051155090331996
A43: =IF(RC[1]="","",DATEVALUE(RC[1])) -> 43395 | B43: 22.10.18 | C43: 24 | D43: 121.23184967041 | E43: 69.08 | F43: 6.5713759999999999 | G43: 108.17755126953099 | H43: 40.33 | I43: 4.448944 | J43: 28.75 | K43: 13.054298400878899 | L43: 15.414158821106 | M43: 68.22 | R43: 1.0410960912704501 | S43: 4.0169439315795898 | T43: 4.0118955325317378 | U43: 15.085262298584 | V43: - | W43: 1.0291165940094005 | X43: #VALUE! | Y43: -1.8774356360173379 | Z43: 15.085262298584 | AC43: =VALUE(RC[-27]) -> 2018-10-22T00:00:00.000 | AD43: =IF(RC[21]=42,"*",IF(RC[21]=32,"",RC[21])) ->  | AE43: =RC[-28] -> 24 | AF43: =RC[-28] -> 121.23184967041 | AG43: =RC[-28] -> 69.08 | AH43: =RC[-28] -> 6.5713759999999999 | AI43: =RC[-28] -> 108.17755126953099 | AJ43: =RC[-28] -> 40.33 | AK43: =RC[-28] -> 4.448944 | AL43: =RC[-28] -> 28.75 | AM43: =RC[-28] -> 13.054298400878899 | AN43: =RC[-28] -> 15.414158821106 | AO43: =RC[-28] -> 68.22 | AP43: - | AQ43: =RC[-29] -> 0 | AR43: =RC[-29] -> 0 | AS43: - | AT43: =RC[-30] -> 0 | AU43: =RC[-30] -> 0 | AV43: =RC[-30] -> 1.0410960912704501 | AW43: =RC[-30] -> 4.0169439315795898
A44: =IF(RC[1]="","",DATEVALUE(RC[1])) ->  | C44: 24 | J44: =RC[-5]-RC[-2] -> #VALUE! | T44: =(RC[-16]*RC[-15]-RC[-13]*RC[-12])/1000 -> #VALUE! | W44: =RC[-2]*RC[-10]/1000 -> #VALUE! | X44: =ABS((RC[-3]*RC[-11]-RC[-2]*RC[-9])/1000) -> #VALUE! | Y44: =(RC[-14]-RC[1])/RC[-18]*100 -> #VALUE! | AC44: =VALUE(RC[-27]) -> #VALUE! | AD44: =IF(RC[21]=42,"*",IF(RC[21]=32,"",RC[21])) ->  | AE44: =RC[-28] -> 24 | AF44: =RC[-28] ->  | AG44: =RC[-28] ->  | AH44: =RC[-28] ->  | AI44: =RC[-28] ->  | AJ44: =RC[-28] ->  | AK44: =RC[-28] ->  | AL44: =RC[-28] -> #VALUE! | AM44: =RC[-28] ->  | AN44: =RC[-28] ->  | AO44: =RC[-28] ->  | AP44: - | AQ44: =RC[-29] -> 0 | AR44: =RC[-29] -> 0 | AS44: - | AT44: =RC[-30] -> 0 | AU44: =RC[-30] -> 0 | AV44: =RC[-30] ->  | AW44: =RC[-30] -> 
A45: =IF(RC[1]="","",DATEVALUE(RC[1])) ->  | C45: 24 | T45: =(RC[-16]*RC[-15]-RC[-13]*RC[-12])/1000 -> #VALUE! | W45: =RC[-2]*RC[-10]/1000 -> #VALUE! | X45: =ABS((RC[-3]*RC[-11]-RC[-2]*RC[-9])/1000) -> #VALUE! | Y45: =(RC[-14]-RC[1])/RC[-18]*100 -> #VALUE! | AC45: =VALUE(RC[-27]) -> #VALUE! | AD45: =IF(RC[21]=42,"*",IF(RC[21]=32,"",RC[21])) ->  | AE45: =RC[-28] -> 24 | AF45: =RC[-28] ->  | AG45: =RC[-28] ->  | AH45: =RC[-28] ->  | AI45: =RC[-28] ->  | AJ45: =RC[-28] ->  | AK45: =RC[-28] ->  | AL45: =RC[-28] -> 0 | AM45: =RC[-28] ->  | AN45: =RC[-28] ->  | AO45: =RC[-28] ->  | AP45: - | AQ45: =RC[-29] -> 0 | AR45: =RC[-29] -> 0 | AS45: - | AT45: =RC[-30] -> 0 | AU45: =RC[-30] -> 0 | AV45: =RC[-30] ->  | AW45: =RC[-30] -> 
A46: =IF(RC[1]="","",DATEVALUE(RC[1])) ->  | C46: 24 | T46: =(RC[-16]*RC[-15]-RC[-13]*RC[-12])/1000 -> #VALUE! | W46: =RC[-2]*RC[-10]/1000 -> #VALUE! | X46: =ABS((RC[-3]*RC[-11]-RC[-2]*RC[-9])/1000) -> #VALUE! | Y46: =(RC[-14]-RC[1])/RC[-18]*100 -> #VALUE! | AC46: =VALUE(RC[-27]) -> #VALUE! | AD46: =IF(RC[21]=42,"*",IF(RC[21]=32,"",RC[21])) ->  | AE46: =RC[-28] -> 24 | AF46: =RC[-28] ->  | AG46: =RC[-28] ->  | AH46: =RC[-28] ->  | AI46: =RC[-28] ->  | AJ46: =RC[-28] ->  | AK46: =RC[-28] ->  | AL46: =RC[-28] -> 0 | AM46: =RC[-28] ->  | AN46: =RC[-28] ->  | AO46: =RC[-28] ->  | AP46: - | AQ46: =RC[-29] -> 0 | AR46: =RC[-29] -> 0 | AS46: - | AT46: =RC[-30] -> 0 | AU46: =RC[-30] -> 0 | AV46: =RC[-30] ->  | AW46: =RC[-30] -> 
A47: =IF(RC[1]="","",DATEVALUE(RC[1])) ->  | C47: 24 | T47: =(RC[-16]*RC[-15]-RC[-13]*RC[-12])/1000 -> #VALUE! | W47: =RC[-2]*RC[-10]/1000 -> #VALUE! | X47: =ABS((RC[-3]*RC[-11]-RC[-2]*RC[-9])/1000) -> #VALUE! | Y47: =(RC[-14]-RC[1])/RC[-18]*100 -> #VALUE! | AC47: =VALUE(RC[-27]) -> #VALUE! | AD47: =IF(RC[21]=42,"*",IF(RC[21]=32,"",RC[21])) ->  | AE47: =RC[-28] -> 24 | AF47: =RC[-28] ->  | AG47: =RC[-28] ->  | AH47: =RC[-28] ->  | AI47: =RC[-28] ->  | AJ47: =RC[-28] ->  | AK47: =RC[-28] ->  | AL47: =RC[-28] -> 0 | AM47: =RC[-28] ->  | AN47: =RC[-28] ->  | AO47: =RC[-28] ->  | AP47: - | AQ47: =RC[-29] -> 0 | AR47: =RC[-29] -> 0 | AS47: - | AT47: =RC[-30] -> 0 | AU47: =RC[-30] -> 0 | AV47: =RC[-30] ->  | AW47: =RC[-30] -> 
A48: =IF(RC[1]="","",DATEVALUE(RC[1])) ->  | C48: 24 | T48: =(RC[-16]*RC[-15]-RC[-13]*RC[-12])/1000 -> #VALUE! | W48: =RC[-2]*RC[-10]/1000 -> #VALUE! | X48: =ABS((RC[-3]*RC[-11]-RC[-2]*RC[-9])/1000) -> #VALUE! | Y48: =(RC[-14]-RC[1])/RC[-18]*100 -> #VALUE! | AC48: =VALUE(RC[-27]) -> #VALUE! | AD48: =IF(RC[21]=42,"*",IF(RC[21]=32,"",RC[21])) ->  | AE48: =RC[-28] -> 24 | AF48: =RC[-28] ->  | AG48: =RC[-28] ->  | AH48: =RC[-28] ->  | AI48: =RC[-28] ->  | AJ48: =RC[-28] ->  | AK48: =RC[-28] ->  | AL48: =RC[-28] -> 0 | AM48: =RC[-28] ->  | AN48: =RC[-28] ->  | AO48: =RC[-28] ->  | AP48: - | AQ48: =RC[-29] -> 0 | AR48: =RC[-29] -> 0 | AS48: - | AT48: =RC[-30] -> 0 | AU48: =RC[-30] -> 0 | AV48: =RC[-30] ->  | AW48: =RC[-30] -> 
A49: =IF(RC[1]="","",DATEVALUE(RC[1])) ->  | C49: 24 | T49: =(RC[-16]*RC[-15]-RC[-13]*RC[-12])/1000 -> #VALUE! | W49: =RC[-2]*RC[-10]/1000 -> #VALUE! | X49: =ABS((RC[-3]*RC[-11]-RC[-2]*RC[-9])/1000) -> #VALUE! | Y49: =(RC[-14]-RC[1])/RC[-18]*100 -> #VALUE! | AC49: =VALUE(RC[-27]) -> #VALUE! | AD49: =IF(RC[21]=42,"*",IF(RC[21]=32,"",RC[21])) ->  | AE49: =RC[-28] -> 24 | AF49: =RC[-28] ->  | AG49: =RC[-28] ->  | AH49: =RC[-28] ->  | AI49: =RC[-28] ->  | AJ49: =RC[-28] ->  | AK49: =RC[-28] ->  | AL49: =RC[-28] -> 0 | AM49: =RC[-28] ->  | AN49: =RC[-28] ->  | AO49: =RC[-28] ->  | AP49: - | AQ49: =RC[-29] -> 0 | AR49: =RC[-29] -> 0 | AS49: - | AT49: =RC[-30] -> 0 | AU49: =RC[-30] -> 0 | AV49: =RC[-30] ->  | AW49: =RC[-30] -> 
A50: =IF(RC[1]="","",DATEVALUE(RC[1])) ->  | T50: =(RC[-16]*RC[-15]-RC[-13]*RC[-12])/1000 -> #VALUE! | W50: =RC[-2]*RC[-10]/1000 -> #VALUE! | X50: =ABS((RC[-3]*RC[-11]-RC[-2]*RC[-9])/1000) -> #VALUE! | Y50: =(RC[-14]-RC[1])/RC[-18]*100 -> #VALUE! | AC50: =VALUE(RC[-27]) -> #VALUE! | AD50: =IF(RC[21]=42,"*",IF(RC[21]=32,"",RC[21])) ->  | AE50: =RC[-28] ->  | AF50: =RC[-28] ->  | AG50: =RC[-28] ->  | AH50: =RC[-28] ->  | AI50: =RC[-28] ->  | AJ50: =RC[-28] ->  | AK50: =RC[-28] ->  | AL50: =RC[-28] -> 0 | AM50: =RC[-28] ->  | AN50: =RC[-28] ->  | AO50: =RC[-28] ->  | AP50: - | AQ50: =RC[-29] -> 0 | AR50: =RC[-29] -> 0 | AS50: - | AT50: =RC[-30] -> 0 | AU50: =RC[-30] -> 0 | AV50: =RC[-30] ->  | AW50: =RC[-30] -> 
A51: =IF(RC[1]="","",DATEVALUE(RC[1])) ->  | T51: =(RC[-16]*RC[-15]-RC[-13]*RC[-12])/1000 -> #VALUE! | W51: =RC[-2]*RC[-10]/1000 -> #VALUE! | X51: =ABS((RC[-3]*RC[-11]-RC[-2]*RC[-9])/1000) -> #VALUE! | Y51: =(RC[-14]-RC[1])/RC[-18]*100 -> #VALUE! | AC51: =VALUE(RC[-27]) -> #VALUE! | AD51: =IF(RC[21]=42,"*",IF(RC[21]=32,"",RC[21])) ->  | AE51: =RC[-28] ->  | AF51: =RC[-28] ->  | AG51: =RC[-28] ->  | AH51: =RC[-28] ->  | AI51: =RC[-28] ->  | AJ51: =RC[-28] ->  | AK51: =RC[-28] ->  | AL51: =RC[-28] -> 0 | AM51: =RC[-28] ->  | AN51: =RC[-28] ->  | AO51: =RC[-28] ->  | AP51: - | AQ51: =RC[-29] -> 0 | AR51: =RC[-29] -> 0 | AS51: - | AT51: =RC[-30] -> 0 | AU51: =RC[-30] -> 0 | AV51: =RC[-30] ->  | AW51: =RC[-30] -> 
A52: =IF(RC[1]="","",DATEVALUE(RC[1])) ->  | T52: =(RC[-16]*RC[-15]-RC[-13]*RC[-12])/1000 -> #VALUE! | W52: =RC[-2]*RC[-10]/1000 -> #VALUE! | X52: =ABS((RC[-3]*RC[-11]-RC[-2]*RC[-9])/1000) -> #VALUE! | Y52: =(RC[-14]-RC[1])/RC[-18]*100 -> #VALUE! | AC52: =VALUE(RC[-27]) -> #VALUE! | AD52: =IF(RC[21]=42,"*",IF(RC[21]=32,"",RC[21])) ->  | AE52: =RC[-28] ->  | AF52: =RC[-28] ->  | AG52: =RC[-28] ->  | AH52: =RC[-28] ->  | AI52: =RC[-28] ->  | AJ52: =RC[-28] ->  | AK52: =RC[-28] ->  | AL52: =RC[-28] -> 0 | AM52: =RC[-28] ->  | AN52: =RC[-28] ->  | AO52: =RC[-28] ->  | AP52: - | AQ52: =RC[-29] -> 0 | AR52: =RC[-29] -> 0 | AS52: - | AT52: =RC[-30] -> 0 | AU52: =RC[-30] -> 0 | AV52: =RC[-30] ->  | AW52: =RC[-30] -> 
A53: =IF(RC[1]="","",DATEVALUE(RC[1])) ->  | T53: =(RC[-16]*RC[-15]-RC[-13]*RC[-12])/1000 -> #VALUE! | W53: =RC[-2]*RC[-10]/1000 -> #VALUE! | X53: =ABS((RC[-3]*RC[-11]-RC[-2]*RC[-9])/1000) -> #VALUE! | Y53: =(RC[-14]-RC[1])/RC[-18]*100 -> #VALUE! | AC53: =VALUE(RC[-27]) -> #VALUE! | AD53: =IF(RC[21]=42,"*",IF(RC[21]=32,"",RC[21])) ->  | AE53: =RC[-28] ->  | AF53: =RC[-28] ->  | AG53: =RC[-28] ->  | AH53: =RC[-28] ->  | AI53: =RC[-28] ->  | AJ53: =RC[-28] ->  | AK53: =RC[-28] ->  | AL53: =RC[-28] -> 0 | AM53: =RC[-28] ->  | AN53: =RC[-28] ->  | AO53: =RC[-28] ->  | AP53: - | AQ53: =RC[-29] -> 0 | AR53: =RC[-29] -> 0 | AS53: - | AT53: =RC[-30] -> 0 | AU53: =RC[-30] -> 0 | AV53: =RC[-30] ->  | AW53: =RC[-30] -> 
A54: =IF(RC[1]="","",DATEVALUE(RC[1])) ->  | T54: =(RC[-16]*RC[-15]-RC[-13]*RC[-12])/1000 -> #VALUE! | W54: =RC[-2]*RC[-10]/1000 -> #VALUE! | X54: =ABS((RC[-3]*RC[-11]-RC[-2]*RC[-9])/1000) -> #VALUE! | Y54: =(RC[-14]-RC[1])/RC[-18]*100 -> #VALUE! | AC54: =VALUE(RC[-27]) -> #VALUE! | AD54: =IF(RC[21]=42,"*",IF(RC[21]=32,"",RC[21])) ->  | AE54: =RC[-28] ->  | AF54: =RC[-28] ->  | AG54: =RC[-28] ->  | AH54: =RC[-28] ->  | AI54: =RC[-28] ->  | AJ54: =RC[-28] ->  | AK54: =RC[-28] ->  | AL54: =RC[-28] -> 0 | AM54: =RC[-28] ->  | AN54: =RC[-28] ->  | AO54: =RC[-28] ->  | AP54: - | AQ54: =RC[-29] -> 0 | AR54: =RC[-29] -> 0 | AS54: - | AT54: =RC[-30] -> 0 | AU54: =RC[-30] -> 0 | AV54: =RC[-30] ->  | AW54: =RC[-30] -> 
A55: =IF(RC[1]="","",DATEVALUE(RC[1])) ->  | T55: =(RC[-16]*RC[-15]-RC[-13]*RC[-12])/1000 -> #VALUE! | W55: =RC[-2]*RC[-10]/1000 -> #VALUE! | X55: =ABS((RC[-3]*RC[-11]-RC[-2]*RC[-9])/1000) -> #VALUE! | Y55: =(RC[-14]-RC[1])/RC[-18]*100 -> #VALUE! | AC55: =VALUE(RC[-27]) -> #VALUE! | AD55: =IF(RC[21]=42,"*",IF(RC[21]=32,"",RC[21])) ->  | AE55: =RC[-28] ->  | AF55: =RC[-28] ->  | AG55: =RC[-28] ->  | AH55: =RC[-28] ->  | AI55: =RC[-28] ->  | AJ55: =RC[-28] ->  | AK55: =RC[-28] ->  | AL55: =RC[-28] -> 0 | AM55: =RC[-28] ->  | AN55: =RC[-28] ->  | AO55: =RC[-28] ->  | AP55: - | AQ55: =RC[-29] -> 0 | AR55: =RC[-29] -> 0 | AS55: - | AT55: =RC[-30] -> 0 | AU55: =RC[-30] -> 0 | AV55: =RC[-30] ->  | AW55: =RC[-30] -> 
A56: =IF(RC[1]="","",DATEVALUE(RC[1])) ->  | T56: =(RC[-16]*RC[-15]-RC[-13]*RC[-12])/1000 -> #VALUE! | W56: =RC[-2]*RC[-10]/1000 -> #VALUE! | X56: =ABS((RC[-3]*RC[-11]-RC[-2]*RC[-9])/1000) -> #VALUE! | Y56: =(RC[-14]-RC[1])/RC[-18]*100 -> #VALUE! | AC56: =VALUE(RC[-27]) -> #VALUE! | AD56: =IF(RC[21]=42,"*",IF(RC[21]=32,"",RC[21])) ->  | AE56: =RC[-28] ->  | AF56: =RC[-28] ->  | AG56: =RC[-28] ->  | AH56: =RC[-28] ->  | AI56: =RC[-28] ->  | AJ56: =RC[-28] ->  | AK56: =RC[-28] ->  | AL56: =RC[-28] -> 0 | AM56: =RC[-28] ->  | AN56: =RC[-28] ->  | AO56: =RC[-28] ->  | AP56: - | AQ56: =RC[-29] -> 0 | AR56: =RC[-29] -> 0 | AS56: - | AT56: =RC[-30] -> 0 | AU56: =RC[-30] -> 0 | AV56: =RC[-30] ->  | AW56: =RC[-30] -> 
A57: =IF(RC[1]="","",DATEVALUE(RC[1])) ->  | T57: =(RC[-16]*RC[-15]-RC[-13]*RC[-12])/1000 -> #VALUE! | W57: =RC[-2]*RC[-10]/1000 -> #VALUE! | X57: =ABS((RC[-3]*RC[-11]-RC[-2]*RC[-9])/1000) -> #VALUE! | Y57: =(RC[-14]-RC[1])/RC[-18]*100 -> #VALUE! | AC57: =VALUE(RC[-27]) -> #VALUE! | AD57: =IF(RC[21]=42,"*",IF(RC[21]=32,"",RC[21])) ->  | AE57: =RC[-28] ->  | AF57: =RC[-28] ->  | AG57: =RC[-28] ->  | AH57: =RC[-28] ->  | AI57: =RC[-28] ->  | AJ57: =RC[-28] ->  | AK57: =RC[-28] ->  | AL57: =RC[-28] -> 0 | AM57: =RC[-28] ->  | AN57: =RC[-28] ->  | AO57: =RC[-28] ->  | AP57: - | AQ57: =RC[-29] -> 0 | AR57: =RC[-29] -> 0 | AS57: - | AT57: =RC[-30] -> 0 | AU57: =RC[-30] -> 0 | AV57: =RC[-30] ->  | AW57: =RC[-30] -> 
A58: =IF(RC[1]="","",DATEVALUE(RC[1])) ->  | T58: =(RC[-16]*RC[-15]-RC[-13]*RC[-12])/1000 -> #VALUE! | W58: =RC[-2]*RC[-10]/1000 -> #VALUE! | X58: =ABS((RC[-3]*RC[-11]-RC[-2]*RC[-9])/1000) -> #VALUE! | Y58: =(RC[-14]-RC[1])/RC[-18]*100 -> #VALUE! | AC58: =VALUE(RC[-27]) -> #VALUE! | AD58: =IF(RC[21]=42,"*",IF(RC[21]=32,"",RC[21])) ->  | AE58: =RC[-28] ->  | AF58: =RC[-28] ->  | AG58: =RC[-28] ->  | AH58: =RC[-28] ->  | AI58: =RC[-28] ->  | AJ58: =RC[-28] ->  | AK58: =RC[-28] ->  | AL58: =RC[-28] -> 0 | AM58: =RC[-28] ->  | AN58: =RC[-28] ->  | AO58: =RC[-28] ->  | AP58: - | AQ58: =RC[-29] -> 0 | AR58: =RC[-29] -> 0 | AS58: - | AT58: =RC[-30] -> 0 | AU58: =RC[-30] -> 0 | AV58: =RC[-30] ->  | AW58: =RC[-30] -> 
A59: =IF(RC[1]="","",DATEVALUE(RC[1])) ->  | T59: =(RC[-16]*RC[-15]-RC[-13]*RC[-12])/1000 -> #VALUE! | W59: =RC[-2]*RC[-10]/1000 -> #VALUE! | X59: =ABS((RC[-3]*RC[-11]-RC[-2]*RC[-9])/1000) -> #VALUE! | Y59: =(RC[-14]-RC[1])/RC[-18]*100 -> #VALUE! | AC59: =VALUE(RC[-27]) -> #VALUE! | AD59: =IF(RC[21]=42,"*",IF(RC[21]=32,"",RC[21])) ->  | AE59: =RC[-28] ->  | AF59: =RC[-28] ->  | AG59: =RC[-28] ->  | AH59: =RC[-28] ->  | AI59: =RC[-28] ->  | AJ59: =RC[-28] ->  | AK59: =RC[-28] ->  | AL59: =RC[-28] -> 0 | AM59: =RC[-28] ->  | AN59: =RC[-28] ->  | AO59: =RC[-28] ->  | AP59: - | AQ59: =RC[-29] -> 0 | AR59: =RC[-29] -> 0 | AS59: - | AT59: =RC[-30] -> 0 | AU59: =RC[-30] -> 0 | AV59: =RC[-30] ->  | AW59: =RC[-30] -> 
A60: =IF(RC[1]="","",DATEVALUE(RC[1])) ->  | T60: =(RC[-16]*RC[-15]-RC[-13]*RC[-12])/1000 -> #VALUE! | W60: =RC[-2]*RC[-10]/1000 -> #VALUE! | X60: =ABS((RC[-3]*RC[-11]-RC[-2]*RC[-9])/1000) -> #VALUE! | Y60: =(RC[-14]-RC[1])/RC[-18]*100 -> #VALUE! | AC60: =VALUE(RC[-27]) -> #VALUE! | AD60: =IF(RC[21]=42,"*",IF(RC[21]=32,"",RC[21])) ->  | AE60: =RC[-28] ->  | AF60: =RC[-28] ->  | AG60: =RC[-28] ->  | AH60: =RC[-28] ->  | AI60: =RC[-28] ->  | AJ60: =RC[-28] ->  | AK60: =RC[-28] ->  | AL60: =RC[-28] -> 0 | AM60: =RC[-28] ->  | AN60: =RC[-28] ->  | AO60: =RC[-28] ->  | AP60: - | AQ60: =RC[-29] -> 0 | AR60: =RC[-29] -> 0 | AS60: - | AT60: =RC[-30] -> 0 | AU60: =RC[-30] -> 0 | AV60: =RC[-30] ->  | AW60: =RC[-30] -> 
A61: =IF(RC[1]="","",DATEVALUE(RC[1])) ->  | T61: =(RC[-16]*RC[-15]-RC[-13]*RC[-12])/1000 -> #VALUE! | W61: =RC[-2]*RC[-10]/1000 -> #VALUE! | X61: =ABS((RC[-3]*RC[-11]-RC[-2]*RC[-9])/1000) -> #VALUE! | Y61: =(RC[-14]-RC[1])/RC[-18]*100 -> #VALUE! | AC61: =VALUE(RC[-27]) -> #VALUE! | AD61: =IF(RC[21]=42,"*",IF(RC[21]=32,"",RC[21])) ->  | AE61: =RC[-28] ->  | AF61: =RC[-28] ->  | AG61: =RC[-28] ->  | AH61: =RC[-28] ->  | AI61: =RC[-28] ->  | AJ61: =RC[-28] ->  | AK61: =RC[-28] ->  | AL61: =RC[-28] -> 0 | AM61: =RC[-28] ->  | AN61: =RC[-28] ->  | AO61: =RC[-28] ->  | AP61: - | AQ61: =RC[-29] -> 0 | AR61: =RC[-29] -> 0 | AS61: - | AT61: =RC[-30] -> 0 | AU61: =RC[-30] -> 0 | AV61: =RC[-30] ->  | AW61: =RC[-30] -> 
A62: =IF(RC[1]="","",DATEVALUE(RC[1])) ->  | T62: =(RC[-16]*RC[-15]-RC[-13]*RC[-12])/1000 -> #VALUE! | W62: =RC[-2]*RC[-10]/1000 -> #VALUE! | X62: =ABS((RC[-3]*RC[-11]-RC[-2]*RC[-9])/1000) -> #VALUE! | Y62: =(RC[-14]-RC[1])/RC[-18]*100 -> #VALUE! | AC62: =VALUE(RC[-27]) -> #VALUE! | AD62: =IF(RC[21]=42,"*",IF(RC[21]=32,"",RC[21])) ->  | AE62: =RC[-28] ->  | AF62: =RC[-28] ->  | AG62: =RC[-28] ->  | AH62: =RC[-28] ->  | AI62: =RC[-28] ->  | AJ62: =RC[-28] ->  | AK62: =RC[-28] ->  | AL62: =RC[-28] -> 0 | AM62: =RC[-28] ->  | AN62: =RC[-28] ->  | AO62: =RC[-28] ->  | AP62: - | AQ62: =RC[-29] -> 0 | AR62: =RC[-29] -> 0 | AS62: - | AT62: =RC[-30] -> 0 | AU62: =RC[-30] -> 0 | AV62: =RC[-30] ->  | AW62: =RC[-30] -> 
A63: =IF(RC[1]="","",DATEVALUE(RC[1])) ->  | T63: =(RC[-16]*RC[-15]-RC[-13]*RC[-12])/1000 -> #VALUE! | W63: =RC[-2]*RC[-10]/1000 -> #VALUE! | X63: =ABS((RC[-3]*RC[-11]-RC[-2]*RC[-9])/1000) -> #VALUE! | Y63: =(RC[-14]-RC[1])/RC[-18]*100 -> #VALUE! | AC63: =VALUE(RC[-27]) -> #VALUE! | AD63: =IF(RC[21]=42,"*",IF(RC[21]=32,"",RC[21])) ->  | AE63: =RC[-28] ->  | AF63: =RC[-28] ->  | AG63: =RC[-28] ->  | AH63: =RC[-28] ->  | AI63: =RC[-28] ->  | AJ63: =RC[-28] ->  | AK63: =RC[-28] ->  | AL63: =RC[-28] -> 0 | AM63: =RC[-28] ->  | AN63: =RC[-28] ->  | AO63: =RC[-28] ->  | AP63: - | AQ63: =RC[-29] -> 0 | AR63: =RC[-29] -> 0 | AS63: - | AT63: =RC[-30] -> 0 | AU63: =RC[-30] -> 0 | AV63: =RC[-30] ->  | AW63: =RC[-30] -> 
A64: =IF(RC[1]="","",DATEVALUE(RC[1])) ->  | T64: =(RC[-16]*RC[-15]-RC[-13]*RC[-12])/1000 -> #VALUE! | W64: =RC[-2]*RC[-10]/1000 -> #VALUE! | X64: =ABS((RC[-3]*RC[-11]-RC[-2]*RC[-9])/1000) -> #VALUE! | Y64: =(RC[-14]-RC[1])/RC[-18]*100 -> #VALUE! | AC64: =VALUE(RC[-27]) -> #VALUE! | AD64: =IF(RC[21]=42,"*",IF(RC[21]=32,"",RC[21])) ->  | AE64: =RC[-28] ->  | AF64: =RC[-28] ->  | AG64: =RC[-28] ->  | AH64: =RC[-28] ->  | AI64: =RC[-28] ->  | AJ64: =RC[-28] ->  | AK64: =RC[-28] ->  | AL64: =RC[-28] -> 0 | AM64: =RC[-28] ->  | AN64: =RC[-28] ->  | AO64: =RC[-28] ->  | AP64: - | AQ64: =RC[-29] -> 0 | AR64: =RC[-29] -> 0 | AS64: - | AT64: =RC[-30] -> 0 | AU64: =RC[-30] -> 0 | AV64: =RC[-30] ->  | AW64: =RC[-30] -> 
A65: =IF(RC[1]="","",DATEVALUE(RC[1])) ->  | T65: =(RC[-16]*RC[-15]-RC[-13]*RC[-12])/1000 -> #VALUE! | W65: =RC[-2]*RC[-10]/1000 -> #VALUE! | X65: =ABS((RC[-3]*RC[-11]-RC[-2]*RC[-9])/1000) -> #VALUE! | Y65: =(RC[-14]-RC[1])/RC[-18]*100 -> #VALUE! | AC65: =VALUE(RC[-27]) -> #VALUE! | AD65: =IF(RC[21]=42,"*",IF(RC[21]=32,"",RC[21])) ->  | AE65: =RC[-28] ->  | AF65: =RC[-28] ->  | AG65: =RC[-28] ->  | AH65: =RC[-28] ->  | AI65: =RC[-28] ->  | AJ65: =RC[-28] ->  | AK65: =RC[-28] ->  | AL65: =RC[-28] -> 0 | AM65: =RC[-28] ->  | AN65: =RC[-28] ->  | AO65: =RC[-28] ->  | AP65: - | AQ65: =RC[-29] -> 0 | AR65: =RC[-29] -> 0 | AS65: - | AT65: =RC[-30] -> 0 | AU65: =RC[-30] -> 0 | AV65: =RC[-30] ->  | AW65: =RC[-30] -> 
A66: =IF(RC[1]="","",DATEVALUE(RC[1])) ->  | T66: =(RC[-16]*RC[-15]-RC[-13]*RC[-12])/1000 -> #VALUE! | W66: =RC[-2]*RC[-10]/1000 -> #VALUE! | X66: =ABS((RC[-3]*RC[-11]-RC[-2]*RC[-9])/1000) -> #VALUE! | Y66: =(RC[-14]-RC[1])/RC[-18]*100 -> #VALUE! | AC66: =VALUE(RC[-27]) -> #VALUE! | AD66: =IF(RC[21]=42,"*",IF(RC[21]=32,"",RC[21])) ->  | AE66: =RC[-28] ->  | AF66: =RC[-28] ->  | AG66: =RC[-28] ->  | AH66: =RC[-28] ->  | AI66: =RC[-28] ->  | AJ66: =RC[-28] ->  | AK66: =RC[-28] ->  | AL66: =RC[-28] -> 0 | AM66: =RC[-28] ->  | AN66: =RC[-28] ->  | AO66: =RC[-28] ->  | AP66: - | AQ66: =RC[-29] -> 0 | AR66: =RC[-29] -> 0 | AS66: - | AT66: =RC[-30] -> 0 | AU66: =RC[-30] -> 0 | AV66: =RC[-30] ->  | AW66: =RC[-30] -> 
A67: =IF(RC[1]="","",DATEVALUE(RC[1])) ->  | T67: =(RC[-16]*RC[-15]-RC[-13]*RC[-12])/1000 -> #VALUE! | W67: =RC[-2]*RC[-10]/1000 -> #VALUE! | X67: =ABS((RC[-3]*RC[-11]-RC[-2]*RC[-9])/1000) -> #VALUE! | Y67: =(RC[-14]-RC[1])/RC[-18]*100 -> #VALUE! | AC67: =VALUE(RC[-27]) -> #VALUE! | AD67: =IF(RC[21]=42,"*",IF(RC[21]=32,"",RC[21])) ->  | AE67: =RC[-28] ->  | AF67: =RC[-28] ->  | AG67: =RC[-28] ->  | AH67: =RC[-28] ->  | AI67: =RC[-28] ->  | AJ67: =RC[-28] ->  | AK67: =RC[-28] ->  | AL67: =RC[-28] -> 0 | AM67: =RC[-28] ->  | AN67: =RC[-28] ->  | AO67: =RC[-28] ->  | AP67: - | AQ67: =RC[-29] -> 0 | AR67: =RC[-29] -> 0 | AS67: - | AT67: =RC[-30] -> 0 | AU67: =RC[-30] -> 0 | AV67: =RC[-30] ->  | AW67: =RC[-30] -> 
A68: =IF(RC[1]="","",DATEVALUE(RC[1])) ->  | T68: =(RC[-16]*RC[-15]-RC[-13]*RC[-12])/1000 -> #VALUE! | W68: =RC[-2]*RC[-10]/1000 -> #VALUE! | X68: =ABS((RC[-3]*RC[-11]-RC[-2]*RC[-9])/1000) -> #VALUE! | Y68: =(RC[-14]-RC[1])/RC[-18]*100 -> #VALUE! | AC68: =VALUE(RC[-27]) -> #VALUE! | AD68: =IF(RC[21]=42,"*",IF(RC[21]=32,"",RC[21])) ->  | AE68: =RC[-28] ->  | AF68: =RC[-28] ->  | AG68: =RC[-28] ->  | AH68: =RC[-28] ->  | AI68: =RC[-28] ->  | AJ68: =RC[-28] ->  | AK68: =RC[-28] ->  | AL68: =RC[-28] -> 0 | AM68: =RC[-28] ->  | AN68: =RC[-28] ->  | AO68: =RC[-28] ->  | AP68: - | AQ68: =RC[-29] -> 0 | AR68: =RC[-29] -> 0 | AS68: - | AT68: =RC[-30] -> 0 | AU68: =RC[-30] -> 0 | AV68: =RC[-30] ->  | AW68: =RC[-30] -> 
A69: =IF(RC[1]="","",DATEVALUE(RC[1])) ->  | T69: =(RC[-16]*RC[-15]-RC[-13]*RC[-12])/1000 -> #VALUE! | W69: =RC[-2]*RC[-10]/1000 -> #VALUE! | X69: =ABS((RC[-3]*RC[-11]-RC[-2]*RC[-9])/1000) -> #VALUE! | Y69: =(RC[-14]-RC[1])/RC[-18]*100 -> #VALUE! | AC69: =VALUE(RC[-27]) -> #VALUE! | AD69: =IF(RC[21]=42,"*",IF(RC[21]=32,"",RC[21])) ->  | AE69: =RC[-28] ->  | AF69: =RC[-28] ->  | AG69: =RC[-28] ->  | AH69: =RC[-28] ->  | AI69: =RC[-28] ->  | AJ69: =RC[-28] ->  | AK69: =RC[-28] ->  | AL69: =RC[-28] -> 0 | AM69: =RC[-28] ->  | AN69: =RC[-28] ->  | AO69: =RC[-28] ->  | AP69: - | AQ69: =RC[-29] -> 0 | AR69: =RC[-29] -> 0 | AS69: - | AT69: =RC[-30] -> 0 | AU69: =RC[-30] -> 0 | AV69: =RC[-30] ->  | AW69: =RC[-30] -> 
A70: =IF(RC[1]="","",DATEVALUE(RC[1])) ->  | T70: =(RC[-16]*RC[-15]-RC[-13]*RC[-12])/1000 -> #VALUE! | W70: =RC[-2]*RC[-10]/1000 -> #VALUE! | X70: =ABS((RC[-3]*RC[-11]-RC[-2]*RC[-9])/1000) -> #VALUE! | Y70: =(RC[-14]-RC[1])/RC[-18]*100 -> #VALUE! | AC70: =VALUE(RC[-27]) -> #VALUE! | AD70: =IF(RC[21]=42,"*",IF(RC[21]=32,"",RC[21])) ->  | AE70: =RC[-28] ->  | AF70: =RC[-28] ->  | AG70: =RC[-28] ->  | AH70: =RC[-28] ->  | AI70: =RC[-28] ->  | AJ70: =RC[-28] ->  | AK70: =RC[-28] ->  | AL70: =RC[-28] -> 0 | AM70: =RC[-28] ->  | AN70: =RC[-28] ->  | AO70: =RC[-28] ->  | AP70: - | AQ70: =RC[-29] -> 0 | AR70: =RC[-29] -> 0 | AS70: - | AT70: =RC[-30] -> 0 | AU70: =RC[-30] -> 0 | AV70: =RC[-30] ->  | AW70: =RC[-30] -> 
A71: =IF(RC[1]="","",DATEVALUE(RC[1])) ->  | T71: =(RC[-16]*RC[-15]-RC[-13]*RC[-12])/1000 -> #VALUE! | W71: =RC[-2]*RC[-10]/1000 -> #VALUE! | X71: =ABS((RC[-3]*RC[-11]-RC[-2]*RC[-9])/1000) -> #VALUE! | Y71: =(RC[-14]-RC[1])/RC[-18]*100 -> #VALUE! | AC71: =VALUE(RC[-27]) -> #VALUE! | AD71: =IF(RC[21]=42,"*",IF(RC[21]=32,"",RC[21])) ->  | AE71: =RC[-28] ->  | AF71: =RC[-28] ->  | AG71: =RC[-28] ->  | AH71: =RC[-28] ->  | AI71: =RC[-28] ->  | AJ71: =RC[-28] ->  | AK71: =RC[-28] ->  | AL71: =RC[-28] -> 0 | AM71: =RC[-28] ->  | AN71: =RC[-28] ->  | AO71: =RC[-28] ->  | AP71: - | AQ71: =RC[-29] -> 0 | AR71: =RC[-29] -> 0 | AS71: - | AT71: =RC[-30] -> 0 | AU71: =RC[-30] -> 0 | AV71: =RC[-30] ->  | AW71: =RC[-30] -> 
A72: =IF(RC[1]="","",DATEVALUE(RC[1])) ->  | T72: =(RC[-16]*RC[-15]-RC[-13]*RC[-12])/1000 -> #VALUE! | W72: =RC[-2]*RC[-10]/1000 -> #VALUE! | X72: =ABS((RC[-3]*RC[-11]-RC[-2]*RC[-9])/1000) -> #VALUE! | Y72: =(RC[-14]-RC[1])/RC[-18]*100 -> #VALUE! | AC72: =VALUE(RC[-27]) -> #VALUE! | AD72: =IF(RC[21]=42,"*",IF(RC[21]=32,"",RC[21])) ->  | AE72: =RC[-28] ->  | AF72: =RC[-28] ->  | AG72: =RC[-28] ->  | AH72: =RC[-28] ->  | AI72: =RC[-28] ->  | AJ72: =RC[-28] ->  | AK72: =RC[-28] ->  | AL72: =RC[-28] -> 0 | AM72: =RC[-28] ->  | AN72: =RC[-28] ->  | AO72: =RC[-28] ->  | AP72: - | AQ72: =RC[-29] -> 0 | AR72: =RC[-29] -> 0 | AS72: - | AT72: =RC[-30] -> 0 | AU72: =RC[-30] -> 0 | AV72: =RC[-30] ->  | AW72: =RC[-30] -> 
A73: =IF(RC[1]="","",DATEVALUE(RC[1])) ->  | T73: =(RC[-16]*RC[-15]-RC[-13]*RC[-12])/1000 -> #VALUE! | W73: =RC[-2]*RC[-10]/1000 -> #VALUE! | X73: =ABS((RC[-3]*RC[-11]-RC[-2]*RC[-9])/1000) -> #VALUE! | Y73: =(RC[-14]-RC[1])/RC[-18]*100 -> #VALUE! | AC73: =VALUE(RC[-27]) -> #VALUE! | AD73: =IF(RC[21]=42,"*",IF(RC[21]=32,"",RC[21])) ->  | AE73: =RC[-28] ->  | AF73: =RC[-28] ->  | AG73: =RC[-28] ->  | AH73: =RC[-28] ->  | AI73: =RC[-28] ->  | AJ73: =RC[-28] ->  | AK73: =RC[-28] ->  | AL73: =RC[-28] -> 0 | AM73: =RC[-28] ->  | AN73: =RC[-28] ->  | AO73: =RC[-28] ->  | AP73: - | AQ73: =RC[-29] -> 0 | AR73: =RC[-29] -> 0 | AS73: - | AT73: =RC[-30] -> 0 | AU73: =RC[-30] -> 0 | AV73: =RC[-30] ->  | AW73: =RC[-30] -> 
A74: =IF(RC[1]="","",DATEVALUE(RC[1])) ->  | T74: =(RC[-16]*RC[-15]-RC[-13]*RC[-12])/1000 -> #VALUE! | W74: =RC[-2]*RC[-10]/1000 -> #VALUE! | X74: =ABS((RC[-3]*RC[-11]-RC[-2]*RC[-9])/1000) -> #VALUE! | Y74: =(RC[-14]-RC[1])/RC[-18]*100 -> #VALUE! | AC74: =VALUE(RC[-27]) -> #VALUE! | AD74: =IF(RC[21]=42,"*",IF(RC[21]=32,"",RC[21])) ->  | AE74: =RC[-28] ->  | AF74: =RC[-28] ->  | AG74: =RC[-28] ->  | AH74: =RC[-28] ->  | AI74: =RC[-28] ->  | AJ74: =RC[-28] ->  | AK74: =RC[-28] ->  | AL74: =RC[-28] -> 0 | AM74: =RC[-28] ->  | AN74: =RC[-28] ->  | AO74: =RC[-28] ->  | AP74: - | AQ74: =RC[-29] -> 0 | AR74: =RC[-29] -> 0 | AS74: - | AT74: =RC[-30] -> 0 | AU74: =RC[-30] -> 0 | AV74: =RC[-30] ->  | AW74: =RC[-30] -> 
A75: =IF(RC[1]="","",DATEVALUE(RC[1])) ->  | T75: =(RC[-16]*RC[-15]-RC[-13]*RC[-12])/1000 -> #VALUE! | W75: =RC[-2]*RC[-10]/1000 -> #VALUE! | X75: =ABS((RC[-3]*RC[-11]-RC[-2]*RC[-9])/1000) -> #VALUE! | Y75: =(RC[-14]-RC[1])/RC[-18]*100 -> #VALUE! | AC75: =VALUE(RC[-27]) -> #VALUE! | AD75: =IF(RC[21]=42,"*",IF(RC[21]=32,"",RC[21])) ->  | AE75: =RC[-28] ->  | AF75: =RC[-28] ->  | AG75: =RC[-28] ->  | AH75: =RC[-28] ->  | AI75: =RC[-28] ->  | AJ75: =RC[-28] ->  | AK75: =RC[-28] ->  | AL75: =RC[-28] -> 0 | AM75: =RC[-28] ->  | AN75: =RC[-28] ->  | AO75: =RC[-28] ->  | AP75: - | AQ75: =RC[-29] -> 0 | AR75: =RC[-29] -> 0 | AS75: - | AT75: =RC[-30] -> 0 | AU75: =RC[-30] -> 0 | AV75: =RC[-30] ->  | AW75: =RC[-30] -> 
A76: =IF(RC[1]="","",DATEVALUE(RC[1])) ->  | T76: =(RC[-16]*RC[-15]-RC[-13]*RC[-12])/1000 -> #VALUE! | W76: =RC[-2]*RC[-10]/1000 -> #VALUE! | X76: =ABS((RC[-3]*RC[-11]-RC[-2]*RC[-9])/1000) -> #VALUE! | Y76: =(RC[-14]-RC[1])/RC[-18]*100 -> #VALUE! | AC76: =VALUE(RC[-27]) -> #VALUE! | AD76: =IF(RC[21]=42,"*",IF(RC[21]=32,"",RC[21])) ->  | AE76: =RC[-28] ->  | AF76: =RC[-28] ->  | AG76: =RC[-28] ->  | AH76: =RC[-28] ->  | AI76: =RC[-28] ->  | AJ76: =RC[-28] ->  | AK76: =RC[-28] ->  | AL76: =RC[-28] -> 0 | AM76: =RC[-28] ->  | AN76: =RC[-28] ->  | AO76: =RC[-28] ->  | AP76: - | AQ76: =RC[-29] -> 0 | AR76: =RC[-29] -> 0 | AS76: - | AT76: =RC[-30] -> 0 | AU76: =RC[-30] -> 0 | AV76: =RC[-30] ->  | AW76: =RC[-30] -> 
A77: =IF(RC[1]="","",DATEVALUE(RC[1])) ->  | T77: =(RC[-16]*RC[-15]-RC[-13]*RC[-12])/1000 -> #VALUE! | W77: =RC[-2]*RC[-10]/1000 -> #VALUE! | X77: =ABS((RC[-3]*RC[-11]-RC[-2]*RC[-9])/1000) -> #VALUE! | Y77: =(RC[-14]-RC[1])/RC[-18]*100 -> #VALUE! | AC77: =VALUE(RC[-27]) -> #VALUE! | AD77: =IF(RC[21]=42,"*",IF(RC[21]=32,"",RC[21])) ->  | AE77: =RC[-28] ->  | AF77: =RC[-28] ->  | AG77: =RC[-28] ->  | AH77: =RC[-28] ->  | AI77: =RC[-28] ->  | AJ77: =RC[-28] ->  | AK77: =RC[-28] ->  | AL77: =RC[-28] -> 0 | AM77: =RC[-28] ->  | AN77: =RC[-28] ->  | AO77: =RC[-28] ->  | AP77: - | AQ77: =RC[-29] -> 0 | AR77: =RC[-29] -> 0 | AS77: - | AT77: =RC[-30] -> 0 | AU77: =RC[-30] -> 0 | AV77: =RC[-30] ->  | AW77: =RC[-30] -> 
A78: =IF(RC[1]="","",DATEVALUE(RC[1])) ->  | T78: =(RC[-16]*RC[-15]-RC[-13]*RC[-12])/1000 -> #VALUE! | W78: =RC[-2]*RC[-10]/1000 -> #VALUE! | X78: =ABS((RC[-3]*RC[-11]-RC[-2]*RC[-9])/1000) -> #VALUE! | Y78: =(RC[-14]-RC[1])/RC[-18]*100 -> #VALUE! | AC78: =VALUE(RC[-27]) -> #VALUE! | AD78: =IF(RC[21]=42,"*",IF(RC[21]=32,"",RC[21])) ->  | AE78: =RC[-28] ->  | AF78: =RC[-28] ->  | AG78: =RC[-28] ->  | AH78: =RC[-28] ->  | AI78: =RC[-28] ->  | AJ78: =RC[-28] ->  | AK78: =RC[-28] ->  | AL78: =RC[-28] -> 0 | AM78: =RC[-28] ->  | AN78: =RC[-28] ->  | AO78: =RC[-28] ->  | AP78: - | AQ78: =RC[-29] -> 0 | AR78: =RC[-29] -> 0 | AS78: - | AT78: =RC[-30] -> 0 | AU78: =RC[-30] -> 0 | AV78: =RC[-30] ->  | AW78: =RC[-30] -> 
A79: =IF(RC[1]="","",DATEVALUE(RC[1])) ->  | T79: =(RC[-16]*RC[-15]-RC[-13]*RC[-12])/1000 -> #VALUE! | W79: =RC[-2]*RC[-10]/1000 -> #VALUE! | X79: =ABS((RC[-3]*RC[-11]-RC[-2]*RC[-9])/1000) -> #VALUE! | Y79: =(RC[-14]-RC[1])/RC[-18]*100 -> #VALUE! | AC79: =VALUE(RC[-27]) -> #VALUE! | AD79: =IF(RC[21]=42,"*",IF(RC[21]=32,"",RC[21])) ->  | AE79: =RC[-28] ->  | AF79: =RC[-28] ->  | AG79: =RC[-28] ->  | AH79: =RC[-28] ->  | AI79: =RC[-28] ->  | AJ79: =RC[-28] ->  | AK79: =RC[-28] ->  | AL79: =RC[-28] -> 0 | AM79: =RC[-28] ->  | AN79: =RC[-28] ->  | AO79: =RC[-28] ->  | AP79: - | AQ79: =RC[-29] -> 0 | AR79: =RC[-29] -> 0 | AS79: - | AT79: =RC[-30] -> 0 | AU79: =RC[-30] -> 0 | AV79: =RC[-30] ->  | AW79: =RC[-30] -> 
A80: =IF(RC[1]="","",DATEVALUE(RC[1])) ->  | T80: =(RC[-16]*RC[-15]-RC[-13]*RC[-12])/1000 -> #VALUE! | W80: =RC[-2]*RC[-10]/1000 -> #VALUE! | X80: =ABS((RC[-3]*RC[-11]-RC[-2]*RC[-9])/1000) -> #VALUE! | Y80: =(RC[-14]-RC[1])/RC[-18]*100 -> #VALUE! | AC80: =VALUE(RC[-27]) -> #VALUE! | AD80: =IF(RC[21]=42,"*",IF(RC[21]=32,"",RC[21])) ->  | AE80: =RC[-28] ->  | AF80: =RC[-28] ->  | AG80: =RC[-28] ->  | AH80: =RC[-28] ->  | AI80: =RC[-28] ->  | AJ80: =RC[-28] ->  | AK80: =RC[-28] ->  | AL80: =RC[-28] -> 0 | AM80: =RC[-28] ->  | AN80: =RC[-28] ->  | AO80: =RC[-28] ->  | AP80: - | AQ80: =RC[-29] -> 0 | AR80: =RC[-29] -> 0 | AS80: - | AT80: =RC[-30] -> 0 | AU80: =RC[-30] -> 0 | AV80: =RC[-30] ->  | AW80: =RC[-30] -> 
A81: =IF(RC[1]="","",DATEVALUE(RC[1])) ->  | T81: =(RC[-16]*RC[-15]-RC[-13]*RC[-12])/1000 -> #VALUE! | W81: =RC[-2]*RC[-10]/1000 -> #VALUE! | X81: =ABS((RC[-3]*RC[-11]-RC[-2]*RC[-9])/1000) -> #VALUE! | Y81: =(RC[-14]-RC[1])/RC[-18]*100 -> #VALUE! | AC81: =VALUE(RC[-27]) -> #VALUE! | AD81: =IF(RC[21]=42,"*",IF(RC[21]=32,"",RC[21])) ->  | AE81: =RC[-28] ->  | AF81: =RC[-28] ->  | AG81: =RC[-28] ->  | AH81: =RC[-28] ->  | AI81: =RC[-28] ->  | AJ81: =RC[-28] ->  | AK81: =RC[-28] ->  | AL81: =RC[-28] -> 0 | AM81: =RC[-28] ->  | AN81: =RC[-28] ->  | AO81: =RC[-28] ->  | AP81: - | AQ81: =RC[-29] -> 0 | AR81: =RC[-29] -> 0 | AS81: - | AT81: =RC[-30] -> 0 | AU81: =RC[-30] -> 0 | AV81: =RC[-30] ->  | AW81: =RC[-30] -> 
A82: =IF(RC[1]="","",DATEVALUE(RC[1])) ->  | T82: =(RC[-16]*RC[-15]-RC[-13]*RC[-12])/1000 -> #VALUE! | W82: =RC[-2]*RC[-10]/1000 -> #VALUE! | X82: =ABS((RC[-3]*RC[-11]-RC[-2]*RC[-9])/1000) -> #VALUE! | Y82: =(RC[-14]-RC[1])/RC[-18]*100 -> #VALUE! | AC82: =VALUE(RC[-27]) -> #VALUE! | AD82: =IF(RC[21]=42,"*",IF(RC[21]=32,"",RC[21])) ->  | AE82: =RC[-28] ->  | AF82: =RC[-28] ->  | AG82: =RC[-28] ->  | AH82: =RC[-28] ->  | AI82: =RC[-28] ->  | AJ82: =RC[-28] ->  | AK82: =RC[-28] ->  | AL82: =RC[-28] -> 0 | AM82: =RC[-28] ->  | AN82: =RC[-28] ->  | AO82: =RC[-28] ->  | AP82: - | AQ82: =RC[-29] -> 0 | AR82: =RC[-29] -> 0 | AS82: - | AT82: =RC[-30] -> 0 | AU82: =RC[-30] -> 0 | AV82: =RC[-30] ->  | AW82: =RC[-30] -> 
A83: =IF(RC[1]="","",DATEVALUE(RC[1])) ->  | T83: =(RC[-16]*RC[-15]-RC[-13]*RC[-12])/1000 -> #VALUE! | W83: =RC[-2]*RC[-10]/1000 -> #VALUE! | X83: =ABS((RC[-3]*RC[-11]-RC[-2]*RC[-9])/1000) -> #VALUE! | Y83: =(RC[-14]-RC[1])/RC[-18]*100 -> #VALUE! | AC83: =VALUE(RC[-27]) -> #VALUE! | AD83: =IF(RC[21]=42,"*",IF(RC[21]=32,"",RC[21])) ->  | AE83: =RC[-28] ->  | AF83: =RC[-28] ->  | AG83: =RC[-28] ->  | AH83: =RC[-28] ->  | AI83: =RC[-28] ->  | AJ83: =RC[-28] ->  | AK83: =RC[-28] ->  | AL83: =RC[-28] -> 0 | AM83: =RC[-28] ->  | AN83: =RC[-28] ->  | AO83: =RC[-28] ->  | AP83: - | AQ83: =RC[-29] -> 0 | AR83: =RC[-29] -> 0 | AS83: - | AT83: =RC[-30] -> 0 | AU83: =RC[-30] -> 0 | AV83: =RC[-30] ->  | AW83: =RC[-30] -> 
AC84: Среднее | AF84: =R[1]C[-28] -> 119.38508300781253 | AG84: =R[1]C[-28] -> 67.061666666666653 | AH84: =R[1]C[-28] -> 6.6584501333333339 | AI84: =R[1]C[-28] -> 107.96982421875006 | AJ84: =R[1]C[-28] -> 39.602666666666664 | AK84: =R[1]C[-28] -> 4.0914638666666665 | AL84: =R[1]C[-28] -> 27.458999999999993 | AM84: =R[1]C[-28] -> 11.415258789062497 | AN84: =R[1]C[-28] -> 15.453685220082599 | AO84: =R[1]C[-28] -> 65.960666666666668 | AP84: - | AQ84: =R[1]C[-29] -> 0 | AR84: =R[1]C[-29] -> 0 | AS84: - | AT84: =R[1]C[-30] -> 0 | AU84: =R[1]C[-30] -> 0
B85: Среднее | D85: =AVERAGE(OFFSET(R[-74]C,3,0,R7C1,1)) -> 119.38508300781253 | E85: =AVERAGE(OFFSET(R[-74]C,3,0,R7C1,1)) -> 67.061666666666653 | F85: =AVERAGE(OFFSET(R[-74]C,3,0,R7C1,1)) -> 6.6584501333333339 | G85: =AVERAGE(OFFSET(R[-74]C,3,0,R7C1,1)) -> 107.96982421875006 | H85: =AVERAGE(OFFSET(R[-74]C,3,0,R7C1,1)) -> 39.602666666666664 | I85: =AVERAGE(OFFSET(R[-74]C,3,0,R7C1,1)) -> 4.0914638666666665 | J85: =AVERAGE(OFFSET(R[-74]C,3,0,R7C1,1)) -> 27.458999999999993 | K85: =AVERAGE(OFFSET(R[-74]C,3,0,R7C1,1)) -> 11.415258789062497 | L85: =IF(SUM(OFFSET(R[-74]C,3,0,R7C1,1))=0,"",AVERAGE(OFFSET(R[-74]C,3,0,R7C1,1))) -> 15.453685220082599 | M85: =IF(SUM(OFFSET(R[-74]C,3,0,R7C1,1))=0,"",AVERAGE(OFFSET(R[-74]C,3,0,R7C1,1))) -> 65.960666666666668 | R85: =IF(SUM(OFFSET(R[-74]C,3,0,R7C1,1))=0,"",AVERAGE(OFFSET(R[-74]C,3,0,R7C1,1))) -> 1.0099980851014452 | S85: =AVERAGE(OFFSET(R[-74]C,3,0,R7C1,1)) -> 3.7381458874178977 | T85: =AVERAGE(OFFSET(R[-74]C,3,0,R7C1,1)) -> 3.6374456963543342 | W85: =AVERAGE(OFFSET(R[-74]C,3,0,R7C1,1)) -> 0.99705999999713968 | X85: =AVERAGE(OFFSET(R[-74]C,3,0,R7C1,1)) -> #VALUE! | AC85: Итого | AE85: =R[1]C[-28] -> 720 | AF85: =R[1]C[-28] -> 3581.5524902343759 | AI85: =R[1]C[-28] -> 3239.0947265625018 | AM85: =R[1]C[-28] -> 342.45776367187489 | AN85: =R[1]C[-28] -> 463.61055660247797 | AQ85: =R[1]C[-29] -> 0 | AU85: =R[1]C[-30] -> 0 | AV85: =R[1]C[-30] -> 30.299942553043358 | AW85: =R[1]C[-30] -> 112.14437662253692
B86: ИТОГО: | C86: =SUM(OFFSET(R[-75]C,3,0,R7C1,1)) -> 720 | D86: =SUM(OFFSET(R[-75]C,3,0,R7C1,1)) -> 3581.5524902343759 | G86: =SUM(OFFSET(R[-75]C,3,0,R7C1,1)) -> 3239.0947265625018 | K86: =SUM(OFFSET(R[-75]C,3,0,R7C1,1)) -> 342.45776367187489 | L86: =IF(SUM(OFFSET(R[-75]C,3,0,R7C1,1))=0,"",SUM(OFFSET(R[-75]C,3,0,R7C1,1))) -> 463.61055660247797 | R86: =IF(SUM(OFFSET(R[-75]C,3,0,R7C1,1))=0,"",SUM(OFFSET(R[-75]C,3,0,R7C1,1))) -> 30.299942553043358 | S86: =SUM(OFFSET(R[-75]C,3,0,R7C1,1)) -> 112.14437662253692 | T86: =SUM(OFFSET(R[-75]C,3,0,R7C1,1)) -> 109.12337089063003 | W86: =SUM(OFFSET(R[-75]C,3,0,R7C1,1)) -> 29.911799999914191 | X86: =SUM(OFFSET(R[-75]C,3,0,R7C1,1)) -> #VALUE!
AC87: Досчёт | AF87: =R[1]C[-28] -> 0 | AI87: =R[1]C[-28] -> 0 | AM87: =R[1]C[-28] -> 0 | AN87: =R[1]C[-28] -> 0 | AQ87: =R[1]C[-29] -> 0 | AU87: =R[1]C[-30] -> 0 | AV87: =R[1]C[-30] -> 0 | AW87: =R[1]C[-30] -> 0
A88: 11дн=264ч 4дн=96ч | B88: Досчёт до конца м-ца (+) | C88: =R6C1*24 -> 216 | T88: № 1412633 | AC88: Снятие | AF88: =-R[1]C[-28] -> 0 | AI88: =-R[1]C[-28] -> 0 | AM88: =-R[1]C[-28] -> 0 | AN88: =-R[1]C[-28] -> 0 | AQ88: =-R[1]C[-29] -> 0 | AU88: =-R[1]C[-30] -> 0 | AV88: =-R[1]C[-30] -> 0 | AW88: =-R[1]C[-30] -> 0
A89: 9дн=216ч 7дн=168ч | B89: Вычет с предыдущего (-) | C89: =R4C1*24 -> 192 | AC89: Сумма | AF89: =R[1]C[-28] -> 3581.5524902343759 | AI89: =R[1]C[-28] -> 3239.0947265625018 | AM89: =R[1]C[-28] -> 342.45776367187489 | AN89: =R[1]C[-28] -> 463.61055660247797 | AQ89: =R[1]C[-29] -> 0 | AU89: =R[1]C[-30] -> 0 | AV89: =R[1]C[-30] -> 30.299942553043358 | AW89: =R[1]C[-30] -> 112.14437662253692
B90: СУММА: | C90: =R[-4]C+R[-2]C-R[-1]C -> 744 | D90: =R[-4]C+R[-2]C-R[-1]C -> 3581.5524902343759 | G90: =R[-4]C+R[-2]C-R[-1]C -> 3239.0947265625018 | K90: =R[-4]C+R[-2]C-R[-1]C -> 342.45776367187489 | L90: =IF(SUM(OFFSET(R[-79]C,3,0,R7C1,1))=0,"",(R[-4]C+R[-2]C-R[-1]C)) -> 463.61055660247797 | R90: =IF(SUM(OFFSET(R[-79]C,3,0,R7C1,1))=0,"",(R[-4]C+R[-2]C-R[-1]C)) -> 30.299942553043358 | S90: =R[-4]C+R[-2]C-R[-1]C -> 112.14437662253692
AC91: Тхв на источнике | AE91: V гвс (м3) | AF91: =R[-2]C[15] -> 0 | AG91: W гвс (Гкал) | AH91: =RC[-2]*0.06 -> 0 | AI91: W без гвс (Гкал) | AJ91: =R[-2]C[13]-RC[-2] -> 112.14437662253692
B92: Показания счетчиков на момент снятия данных:
B93: Дата, время | D93: М1, т | F93: М2, т | H93: М3, т | J93: М4, т | L93: Qо, Гкал | N93: Qг, Гкал | P93: время, час
B94: 22.09.18 22:59 | D94: - | F94: - | H94: - | J94: - | L94: - | N94: - | P94: -
B95: 18.10.18 05:59 | D95: - | F95: - | H95: - | J95: - | L95: - | N95: - | P95: -
AC97: =ZAYAVKA_N -> з.н д. №02/147-2783 от 04.10.18 с 26.09.18г по 01.10.18г некорректная работа приборов
B98: Представитель потребителя:_______________________________________________________________________ В.О. Топорков
I101: Рекомендуемые значения по параметрам теплопотребления (не являются официально утверждёнными)
I102: М, т | J102: V, м3 | K102: Qгвс, Гкал | L102: Qотоп, Гкал | M102: Qо, Гкал
I103: =R[-13]C[-3] -> 0 | J103: =RC[-1]/0.98 -> 0 | K103: =RC[-1]*0.06 -> 0 | L103: =RC[1]-RC[-1] -> 30.299942553043358 | M103: =R[-13]C[5] -> 30.299942553043358
O105: ДЛЯ САМОКОНТРОЛЯ
B106: В строке выбора дат указать период с 16.7.13 по 23.8.13 - жильё | N106: Q | O106: Qг
B107: В строке выбора дат указать период с 18.7.13 по 25.8.13 - не жилое | N107: =(R[-21]C[-10]*R[-22]C[-7]-R[-21]C[-9]*R[-22]C[-6])/1000 -> 386.69959280083214 | O107: =IF(R[-22]C[-2]="",R[-21]C[-3]*R[-22]C/1000,"") ->  | P107: Си2
O108: =IF(R[-23]C[-2]="","",((R[-22]C[-3]*R[-23]C)-(R[-22]C[-2]*R[-23]C[2]))/1000) -> 0 | P108: Си3