Sheet: Лист1
G1: Отчёт о теплопотреблении за октябрь 2018 | M1: з.н д. №02/147-2783 от 04.10.18
A4: =EOMONTH(R[9]C,0)-R[9]C -> 8 | B4: Потребитель: ЗАО "Сити Сервис"
A5: =MAX(R[9]C:R[78]C) -> 2018-10-22T00:00:00.000 | B5: Адрес: г. СПб, Кораблестроителей ул., д.35 к.1 ИТП 2
A6: =EOMONTH(R[-1]C,0)-R[-1]C -> 9 | B6: Телефон: 8-911-021-19-79
A7: =R[-2]C-R[6]C -> 30 | B7: Договор 10023-2(.)400
A8: 7 | B8: Тепловычислитель: ВТД-УВ № B019 | L8: М2 мах= | M8: 124.56 | O8: Мгвс мах= | P8: 73.68
L9: Qотоп мах= | M9: 9.96 | O9: Qгвс мах= | P9: 4.416
B10: Расчётная формула: Q=M1*(h1-h2)+(M1-M2)*(h2-hхв)
D12: Учет | L12: Контроль
A13: =R[1]C[1]-1 -> 2018-09-22T00:00:00.000 | B13: Дата | C13: N, ч | D13: M1, т | E13: T1, С | F13: P1, кг/см2 | G13: M2, т | H13: T2, С | I13: P2, кг/см2 | J13: dT, С | K13: M1-М2, т | L13: V3, м3 | M13: T3, С | N13: V4, м3 | O13: =IF(R[-12]C[-14]="м.куб","","T4, С") -> T4, С | P13: dT, С | Q13: V3-V4, м3 | R13: Qгвс, Гкал | S13: Qобщ., Гкал | T13: Q | U13: M3 | V13: M4 | W13: си2 | X13: си3 | Y13: Разб. | Z13: dM2 | AC13: Дата | AD13: НС | AE13: n, ч | AF13: М1, т | AG13: t1, гр. С | AH13: Р1, кгс/см2 | AI13: М2, т | AJ13: t2, гр. С | AK13: Р2, кгс/см2 | AL13: t1-t2, гр. С | AM13: М1-М2, т | AN13: М1гвс, т | AO13: t1гвс, гр. С | AP13: Р1гвс, кгс/см2 | AQ13: М2гвс, т | AR13: t2гвс, гр. С | AS13: Р2гвс, кгс/см2 | AT13: t1гвс-t2гвс | AU13: М1гвс-М2гвс, т | AV13: Wгвс, Гкал | AW13: Wсумм, Гкал | AY13: NS_TV1 | AZ13: НС | BA13: NS_TV2
A14: =IF(RC[1]="","",DATEVALUE(RC[1])) -> 43366 | B14: 23.09.18 | C14: 24 | D14: 117.29267883 | E14: 71.13 | F14: 16.91255980048 | G14: 102.39100646999999 | H14: 71 | I14: 4.2305876856399998 | J14: =RC[-5]-RC[-2] -> 0.12999999999999545 | K14: 14.901672359999999 | L14: 16.330385209999999 | M14: 70.23 | R14: 1.1314451275437101 | S14: =RC[-1] -> 1.1314451275437101 | T14: =(RC[-16]*RC[-15]-RC[-13]*RC[-12])/1000 -> 1.0732667858079012 | U14: 15.966977119999999 | V14: - | W14: =RC[-2]*RC[-10]/1000 -> 1.1213608031375999 | X14: =ABS((RC[-3]*RC[-11]-RC[-2]*RC[-9])/1000) -> #VALUE! | Y14: =(RC[-14]-RC[1])/RC[-18]*100 -> -1.0404280578217859 | Z14: 15.966977119999999 | AC14: =VALUE(RC[-27]) -> 2018-09-23T00:00:00.000 | AD14: =IF(RC[21]=42,"*",IF(RC[21]=32,"",RC[21])) -> - | AE14: =RC[-28] -> 24 | AF14: =RC[-28] -> 117.29267883 | AG14: =RC[-28] -> 71.13 | AH14: =RC[-28] -> 16.91255980048 | AI14: =RC[-28] -> 102.39100646999999 | AJ14: =RC[-28] -> 71 | AK14: =RC[-28] -> 4.2305876856399998 | AL14: =RC[-28] -> 0.12999999999999545 | AM14: =RC[-28] -> 14.901672359999999 | AN14: =RC[-28] -> 16.330385209999999 | AO14: =RC[-28] -> 70.23 | AP14: - | AQ14: =RC[-29] -> 0 | AR14: =RC[-29] -> 0 | AS14: - | AT14: =RC[-30] -> 0 | AU14: =RC[-30] -> 0 | AV14: =RC[-30] -> 1.1314451275437101 | AW14: =RC[-30] -> 1.1314451275437101 | AY14: - | AZ14: - | BA14: -
A15: =IF(RC[1]="","",DATEVALUE(RC[1])) -> 43367 | B15: 24.09.18 | C15: 24 | D15: 105.83601379 | E15: 69.98 | F15: 16.907400964200001 | G15: 93.845466610000003 | H15: 69.819999999999993 | I15: 4.7990198728399998 | J15: =RC[-5]-RC[-2] -> 0.1600000000000108 | K15: 11.99054718 | L15: 13.57646942 | M15: 69.069999999999993 | R15: 0.92467942103754697 | S15: =RC[-1] -> 0.92467942103754697 | T15: =(RC[-16]*RC[-15]-RC[-13]*RC[-12])/1000 -> 0.85411376631400071 | U15: 13.28387165 | V15: - | W15: =RC[-2]*RC[-10]/1000 -> 0.91751701486549997 | X15: =ABS((RC[-3]*RC[-11]-RC[-2]*RC[-9])/1000) -> #VALUE! | Y15: =(RC[-14]-RC[1])/RC[-18]*100 -> -1.378142724117678 | Z15: 13.28387165 | AC15: =VALUE(RC[-27]) -> 2018-09-24T00:00:00.000 | AD15: =IF(RC[21]=42,"*",IF(RC[21]=32,"",RC[21])) -> - | AE15: =RC[-28] -> 24 | AF15: =RC[-28] -> 105.83601379 | AG15: =RC[-28] -> 69.98 | AH15: =RC[-28] -> 16.907400964200001 | AI15: =RC[-28] -> 93.845466610000003 | AJ15: =RC[-28] -> 69.819999999999993 | AK15: =RC[-28] -> 4.7990198728399998 | AL15: =RC[-28] -> 0.1600000000000108 | AM15: =RC[-28] -> 11.99054718 | AN15: =RC[-28] -> 13.57646942 | AO15: =RC[-28] -> 69.069999999999993 | AP15: - | AQ15: =RC[-29] -> 0 | AR15: =RC[-29] -> 0 | AS15: - | AT15: =RC[-30] -> 0 | AU15: =RC[-30] -> 0 | AV15: =RC[-30] -> 0.92467942103754697 | AW15: =RC[-30] -> 0.92467942103754697 | AY15: - | AZ15: - | BA15: -
A16: =IF(RC[1]="","",DATEVALUE(RC[1])) -> 43368 | B16: 25.09.18 | C16: 24 | D16: 97.435638429999997 | E16: 68.59 | F16: 16.9066443376 | G16: 83.185462950000002 | H16: 68.400000000000006 | I16: 5.4424376846399998 | J16: =RC[-5]-RC[-2] -> 0.18999999999999773 | K16: 14.250175479999999 | L16: 15.74755669 | M16: 67.77 | R16: 1.05022085841215 | S16: =RC[-1] -> 1.05022085841215 | T16: =(RC[-16]*RC[-15]-RC[-13]*RC[-12])/1000 -> 0.99322477413369958 | U16: 15.421667100000001 | V16: - | W16: =RC[-2]*RC[-10]/1000 -> 1.045126379367 | X16: =ABS((RC[-3]*RC[-11]-RC[-2]*RC[-9])/1000) -> #VALUE! | Y16: =(RC[-14]-RC[1])/RC[-18]*100 -> -1.4082888745887554 | Z16: 15.421667100000001 | AC16: =VALUE(RC[-27]) -> 2018-09-25T00:00:00.000 | AD16: =IF(RC[21]=42,"*",IF(RC[21]=32,"",RC[21])) -> - | AE16: =RC[-28] -> 24 | AF16: =RC[-28] -> 97.435638429999997 | AG16: =RC[-28] -> 68.59 | AH16: =RC[-28] -> 16.9066443376 | AI16: =RC[-28] -> 83.185462950000002 | AJ16: =RC[-28] -> 68.400000000000006 | AK16: =RC[-28] -> 5.4424376846399998 | AL16: =RC[-28] -> 0.18999999999999773 | AM16: =RC[-28] -> 14.250175479999999 | AN16: =RC[-28] -> 15.74755669 | AO16: =RC[-28] -> 67.77 | AP16: - | AQ16: =RC[-29] -> 0 | AR16: =RC[-29] -> 0 | AS16: - | AT16: =RC[-30] -> 0 | AU16: =RC[-30] -> 0 | AV16: =RC[-30] -> 1.05022085841215 | AW16: =RC[-30] -> 1.05022085841215 | AY16: - | AZ16: - | BA16: -
A17: =IF(RC[1]="","",DATEVALUE(RC[1])) -> 43369 | B17: 26.09.18 | C17: 24 | D17: 93.89496613 | E17: 68.03 | F17: 16.905876792720001 | G17: 80.338897709999998 | H17: 67.819999999999993 | I17: 5.4536207584399996 | J17: =RC[-5]-RC[-2] -> 0.21000000000000796 | K17: 13.556068420000001 | L17: 15.02254486 | M17: 67.099999999999994 | R17: 0.98915943680137597 | S17: =RC[-1] -> 0.98915943680137597 | T17: =(RC[-16]*RC[-15]-RC[-13]*RC[-12])/1000 -> 0.93909050313170062 | U17: 14.719342230000001 | V17: - | W17: =RC[-2]*RC[-10]/1000 -> 0.98766786363299996 | X17: =ABS((RC[-3]*RC[-11]-RC[-2]*RC[-9])/1000) -> #VALUE! | Y17: =(RC[-14]-RC[1])/RC[-18]*100 -> -1.4479583902172508 | Z17: 14.719342230000001 | AC17: =VALUE(RC[-27]) -> 2018-09-26T00:00:00.000 | AD17: =IF(RC[21]=42,"*",IF(RC[21]=32,"",RC[21])) -> - | AE17: =RC[-28] -> 24 | AF17: =RC[-28] -> 93.89496613 | AG17: =RC[-28] -> 68.03 | AH17: =RC[-28] -> 16.905876792720001 | AI17: =RC[-28] -> 80.338897709999998 | AJ17: =RC[-28] -> 67.819999999999993 | AK17: =RC[-28] -> 5.4536207584399996 | AL17: =RC[-28] -> 0.21000000000000796 | AM17: =RC[-28] -> 13.556068420000001 | AN17: =RC[-28] -> 15.02254486 | AO17: =RC[-28] -> 67.099999999999994 | AP17: - | AQ17: =RC[-29] -> 0 | AR17: =RC[-29] -> 0 | AS17: - | AT17: =RC[-30] -> 0 | AU17: =RC[-30] -> 0 | AV17: =RC[-30] -> 0.98915943680137597 | AW17: =RC[-30] -> 0.98915943680137597 | AY17: - | AZ17: - | BA17: -
A18: =IF(RC[1]="","",DATEVALUE(RC[1])) -> 43370 | B18: 27.09.18 | C18: 24 | D18: 87.638648989999993 | E18: 63.35 | F18: 16.905876792720001 | G18: 71.42920685 | H18: 63.14 | I18: 5.4901216909199997 | J18: =RC[-5]-RC[-2] -> 0.21000000000000085 | K18: 16.20944214 | L18: 17.723646160000001 | M18: 62.82 | R18: 1.0991742261392901 | S18: =RC[-1] -> 1.0991742261392901 | T18: =(RC[-16]*RC[-15]-RC[-13]*RC[-12])/1000 -> 1.0418682930074992 | U18: 17.404657360000002 | V18: - | W18: =RC[-2]*RC[-10]/1000 -> 1.0933605753552 | X18: =ABS((RC[-3]*RC[-11]-RC[-2]*RC[-9])/1000) -> #VALUE! | Y18: =(RC[-14]-RC[1])/RC[-18]*100 -> -1.6732864226113153 | Z18: 17.404657360000002 | AC18: =VALUE(RC[-27]) -> 2018-09-27T00:00:00.000 | AD18: =IF(RC[21]=42,"*",IF(RC[21]=32,"",RC[21])) -> - | AE18: =RC[-28] -> 24 | AF18: =RC[-28] -> 87.638648989999993 | AG18: =RC[-28] -> 63.35 | AH18: =RC[-28] -> 16.905876792720001 | AI18: =RC[-28] -> 71.42920685 | AJ18: =RC[-28] -> 63.14 | AK18: =RC[-28] -> 5.4901216909199997 | AL18: =RC[-28] -> 0.21000000000000085 | AM18: =RC[-28] -> 16.20944214 | AN18: =RC[-28] -> 17.723646160000001 | AO18: =RC[-28] -> 62.82 | AP18: - | AQ18: =RC[-29] -> 0 | AR18: =RC[-29] -> 0 | AS18: - | AT18: =RC[-30] -> 0 | AU18: =RC[-30] -> 0 | AV18: =RC[-30] -> 1.0991742261392901 | AW18: =RC[-30] -> 1.0991742261392901 | AY18: - | AZ18: - | BA18: -
A19: =IF(RC[1]="","",DATEVALUE(RC[1])) -> 43371 | B19: 28.09.18 | C19: 24 | D19: 100.24390411 | E19: 67.98 | F19: 16.90582822168 | G19: 84.570198059999996 | H19: 58.77 | I19: 5.6398966151599996 | J19: =RC[-5]-RC[-2] -> 9.2100000000000009 | K19: 15.67370605 | L19: 17.350242609999999 | M19: 67.489999999999995 | R19: 1.1520127448170401 | S19: 2.0522158808636699 | T19: =(RC[-16]*RC[-15]-RC[-13]*RC[-12])/1000 -> 1.8443900614116009 | U19: 16.993621829999999 | V19: - | W19: =RC[-2]*RC[-10]/1000 -> 1.1468995373066999 | X19: =ABS((RC[-3]*RC[-11]-RC[-2]*RC[-9])/1000) -> #VALUE! | Y19: =(RC[-14]-RC[1])/RC[-18]*100 -> -1.5607339349773763 | Z19: 16.993621829999999 | AC19: =VALUE(RC[-27]) -> 2018-09-28T00:00:00.000 | AD19: =IF(RC[21]=42,"*",IF(RC[21]=32,"",RC[21])) -> - | AE19: =RC[-28] -> 24 | AF19: =RC[-28] -> 100.24390411 | AG19: =RC[-28] -> 67.98 | AH19: =RC[-28] -> 16.90582822168 | AI19: =RC[-28] -> 84.570198059999996 | AJ19: =RC[-28] -> 58.77 | AK19: =RC[-28] -> 5.6398966151599996 | AL19: =RC[-28] -> 9.2100000000000009 | AM19: =RC[-28] -> 15.67370605 | AN19: =RC[-28] -> 17.350242609999999 | AO19: =RC[-28] -> 67.489999999999995 | AP19: - | AQ19: =RC[-29] -> 0 | AR19: =RC[-29] -> 0 | AS19: - | AT19: =RC[-30] -> 0 | AU19: =RC[-30] -> 0 | AV19: =RC[-30] -> 1.1520127448170401 | AW19: =RC[-30] -> 2.0522158808636699 | AY19: - | AZ19: - | BA19: -
A20: =IF(RC[1]="","",DATEVALUE(RC[1])) -> 43372 | B20: 29.09.18 | C20: 24 | D20: 132.69894409 | E20: 67.87 | F20: 16.906933927120001 | G20: 117.14714813000001 | H20: 47.17 | I20: 6.0064318461199999 | J20: =RC[-5]-RC[-2] -> 20.700000000000003 | K20: 15.55179596 | L20: 17.319332119999999 | M20: 67.099999999999994 | R20: 1.1425382989395201 | S20: 3.4754675121811398 | T20: =(RC[-16]*RC[-15]-RC[-13]*RC[-12])/1000 -> 3.4804463580962 | U20: 16.969453810000001 | V20: - | W20: =RC[-2]*RC[-10]/1000 -> 1.138650350651 | X20: =ABS((RC[-3]*RC[-11]-RC[-2]*RC[-9])/1000) -> #VALUE! | Y20: =(RC[-14]-RC[1])/RC[-18]*100 -> -1.2101513973065776 | Z20: 16.969453810000001 | AC20: =VALUE(RC[-27]) -> 2018-09-29T00:00:00.000 | AD20: =IF(RC[21]=42,"*",IF(RC[21]=32,"",RC[21])) -> - | AE20: =RC[-28] -> 24 | AF20: =RC[-28] -> 132.69894409 | AG20: =RC[-28] -> 67.87 | AH20: =RC[-28] -> 16.906933927120001 | AI20: =RC[-28] -> 117.14714813000001 | AJ20: =RC[-28] -> 47.17 | AK20: =RC[-28] -> 6.0064318461199999 | AL20: =RC[-28] -> 20.700000000000003 | AM20: =RC[-28] -> 15.55179596 | AN20: =RC[-28] -> 17.319332119999999 | AO20: =RC[-28] -> 67.099999999999994 | AP20: - | AQ20: =RC[-29] -> 0 | AR20: =RC[-29] -> 0 | AS20: - | AT20: =RC[-30] -> 0 | AU20: =RC[-30] -> 0 | AV20: =RC[-30] -> 1.1425382989395201 | AW20: =RC[-30] -> 3.4754675121811398 | AY20: - | AZ20: - | BA20: -
A21: =IF(RC[1]="","",DATEVALUE(RC[1])) -> 43373 | B21: 30.09.18 | C21: 24 | D21: 137.56227111999999 | E21: 69.959999999999994 | F21: 16.913102347159999 | G21: 122.28424835 | H21: 47.21 | I21: 5.9007694261200001 | J21: =RC[-5]-RC[-2] -> 22.749999999999993 | K21: 15.27802277 | L21: 16.42045212 | M21: 69.209999999999994 | R21: 1.1251111015572799 | S21: 3.8571306248208699 | T21: =(RC[-16]*RC[-15]-RC[-13]*RC[-12])/1000 -> 3.8508171229516983 | U21: 16.06272697 | V21: - | W21: =RC[-2]*RC[-10]/1000 -> 1.1117013335936998 | X21: =ABS((RC[-3]*RC[-11]-RC[-2]*RC[-9])/1000) -> #VALUE! | Y21: =(RC[-14]-RC[1])/RC[-18]*100 -> -0.64170505243981424 | Z21: 16.06272697 | AC21: =VALUE(RC[-27]) -> 2018-09-30T00:00:00.000 | AD21: =IF(RC[21]=42,"*",IF(RC[21]=32,"",RC[21])) -> - | AE21: =RC[-28] -> 24 | AF21: =RC[-28] -> 137.56227111999999 | AG21: =RC[-28] -> 69.959999999999994 | AH21: =RC[-28] -> 16.913102347159999 | AI21: =RC[-28] -> 122.28424835 | AJ21: =RC[-28] -> 47.21 | AK21: =RC[-28] -> 5.9007694261200001 | AL21: =RC[-28] -> 22.749999999999993 | AM21: =RC[-28] -> 15.27802277 | AN21: =RC[-28] -> 16.42045212 | AO21: =RC[-28] -> 69.209999999999994 | AP21: - | AQ21: =RC[-29] -> 0 | AR21: =RC[-29] -> 0 | AS21: - | AT21: =RC[-30] -> 0 | AU21: =RC[-30] -> 0 | AV21: =RC[-30] -> 1.1251111015572799 | AW21: =RC[-30] -> 3.8571306248208699 | AY21: - | AZ21: - | BA21: -
A22: =IF(RC[1]="","",DATEVALUE(RC[1])) -> 43374 | B22: 01.10.18 | C22: 24 | D22: 134.00737000000001 | E22: 68.87 | F22: 16.913818769999999 | G22: 119.25151062 | H22: 45.2 | I22: 6.0043262507200001 | J22: =RC[-5]-RC[-2] -> 23.67 | K22: 14.75585938 | L22: 16.242755890000002 | M22: 68.38 | R22: 1.0882641898347201 | S22: 3.83624582258527 | T22: =(RC[-16]*RC[-15]-RC[-13]*RC[-12])/1000 -> 3.8389192918760009 | U22: 15.9032135 | V22: - | W22: =RC[-2]*RC[-10]/1000 -> 1.0874617391299999 | X22: =ABS((RC[-3]*RC[-11]-RC[-2]*RC[-9])/1000) -> #VALUE! | Y22: =(RC[-14]-RC[1])/RC[-18]*100 -> -0.96212963176298183 | Z22: 15.9032135 | AC22: =VALUE(RC[-27]) -> 2018-10-01T00:00:00.000 | AD22: =IF(RC[21]=42,"*",IF(RC[21]=32,"",RC[21])) -> - | AE22: =RC[-28] -> 24 | AF22: =RC[-28] -> 134.00737000000001 | AG22: =RC[-28] -> 68.87 | AH22: =RC[-28] -> 16.913818769999999 | AI22: =RC[-28] -> 119.25151062 | AJ22: =RC[-28] -> 45.2 | AK22: =RC[-28] -> 6.0043262507200001 | AL22: =RC[-28] -> 23.67 | AM22: =RC[-28] -> 14.75585938 | AN22: =RC[-28] -> 16.242755890000002 | AO22: =RC[-28] -> 68.38 | AP22: - | AQ22: =RC[-29] -> 0 | AR22: =RC[-29] -> 0 | AS22: - | AT22: =RC[-30] -> 0 | AU22: =RC[-30] -> 0 | AV22: =RC[-30] -> 1.0882641898347201 | AW22: =RC[-30] -> 3.83624582258527 | AY22: - | AZ22: - | BA22: -
A23: =IF(RC[1]="","",DATEVALUE(RC[1])) -> 43375 | B23: 02.10.18 | C23: 24 | D23: 133.09783935999999 | E23: 67.650000000000006 | F23: 16.91412407368 | G23: 118.17376709 | H23: 44.8 | I23: 5.9120455604000002 | J23: =RC[-5]-RC[-2] -> 22.850000000000009 | K23: 14.92407227 | L23: 16.410501480000001 | M23: 67.069999999999993 | R23: 1.0832273789051301 | S23: 3.7074925002388501 | T23: =(RC[-16]*RC[-15]-RC[-13]*RC[-12])/1000 -> 3.709884067072001 | U23: 16.07771301 | V23: - | W23: =RC[-2]*RC[-10]/1000 -> 1.0783322115806999 | X23: =ABS((RC[-3]*RC[-11]-RC[-2]*RC[-9])/1000) -> #VALUE! | Y23: =(RC[-14]-RC[1])/RC[-18]*100 -> -0.97622405412649527 | Z23: 16.07771301 | AC23: =VALUE(RC[-27]) -> 2018-10-02T00:00:00.000 | AD23: =IF(RC[21]=42,"*",IF(RC[21]=32,"",RC[21])) -> - | AE23: =RC[-28] -> 24 | AF23: =RC[-28] -> 133.09783935999999 | AG23: =RC[-28] -> 67.650000000000006 | AH23: =RC[-28] -> 16.91412407368 | AI23: =RC[-28] -> 118.17376709 | AJ23: =RC[-28] -> 44.8 | AK23: =RC[-28] -> 5.9120455604000002 | AL23: =RC[-28] -> 22.850000000000009 | AM23: =RC[-28] -> 14.92407227 | AN23: =RC[-28] -> 16.410501480000001 | AO23: =RC[-28] -> 67.069999999999993 | AP23: - | AQ23: =RC[-29] -> 0 | AR23: =RC[-29] -> 0 | AS23: - | AT23: =RC[-30] -> 0 | AU23: =RC[-30] -> 0 | AV23: =RC[-30] -> 1.0832273789051301 | AW23: =RC[-30] -> 3.7074925002388501 | AY23: - | AZ23: - | BA23: -
A24: =IF(RC[1]="","",DATEVALUE(RC[1])) -> 43376 | B24: 03.10.18 | C24: 24 | D24: 131.72042847 | E24: 67.77 | F24: 16.91387958584 | G24: 117.26815796 | H24: 44.87 | I24: 5.9116289310800001 | J24: =RC[-5]-RC[-2] -> 22.9 | K24: 14.45227051 | L24: 16.077466959999999 | M24: 66.959999999999994 | R24: 1.0647706100124199 | S24: 3.6665604471195201 | T24: =(RC[-16]*RC[-15]-RC[-13]*RC[-12])/1000 -> 3.664871189746699 | U24: 15.74923325 | V24: - | W24: =RC[-2]*RC[-10]/1000 -> 1.0545686584199998 | X24: =ABS((RC[-3]*RC[-11]-RC[-2]*RC[-9])/1000) -> #VALUE! | Y24: =(RC[-14]-RC[1])/RC[-18]*100 -> -1.1059803126117083 | Z24: 15.74923325 | AC24: =VALUE(RC[-27]) -> 2018-10-03T00:00:00.000 | AD24: =IF(RC[21]=42,"*",IF(RC[21]=32,"",RC[21])) -> - | AE24: =RC[-28] -> 24 | AF24: =RC[-28] -> 131.72042847 | AG24: =RC[-28] -> 67.77 | AH24: =RC[-28] -> 16.91387958584 | AI24: =RC[-28] -> 117.26815796 | AJ24: =RC[-28] -> 44.87 | AK24: =RC[-28] -> 5.9116289310800001 | AL24: =RC[-28] -> 22.9 | AM24: =RC[-28] -> 14.45227051 | AN24: =RC[-28] -> 16.077466959999999 | AO24: =RC[-28] -> 66.959999999999994 | AP24: - | AQ24: =RC[-29] -> 0 | AR24: =RC[-29] -> 0 | AS24: - | AT24: =RC[-30] -> 0 | AU24: =RC[-30] -> 0 | AV24: =RC[-30] -> 1.0647706100124199 | AW24: =RC[-30] -> 3.6665604471195201 | AY24: - | AZ24: - | BA24: -
A25: =IF(RC[1]="","",DATEVALUE(RC[1])) -> 43377 | B25: 04.10.18 | C25: 24 | D25: 132.29127502 | E25: 67.180000000000007 | F25: 16.91066338708 | G25: 115.13717651 | H25: 44.15 | I25: 5.9474948686399998 | J25: =RC[-5]-RC[-2] -> 23.030000000000008 | K25: 17.154098510000001 | L25: 18.69391632 | M25: 66.58 | R25: 1.22668591286902 | S25: 3.8030041177032601 | T25: =(RC[-16]*RC[-15]-RC[-13]*RC[-12])/1000 -> 3.8040215129271009 | U25: 18.31936455 | V25: - | W25: =RC[-2]*RC[-10]/1000 -> 1.2197032917390001 | X25: =ABS((RC[-3]*RC[-11]-RC[-2]*RC[-9])/1000) -> #VALUE! | Y25: =(RC[-14]-RC[1])/RC[-18]*100 -> -1.0120675834870694 | Z25: 18.31936455 | AC25: =VALUE(RC[-27]) -> 2018-10-04T00:00:00.000 | AD25: =IF(RC[21]=42,"*",IF(RC[21]=32,"",RC[21])) -> - | AE25: =RC[-28] -> 24 | AF25: =RC[-28] -> 132.29127502 | AG25: =RC[-28] -> 67.180000000000007 | AH25: =RC[-28] -> 16.91066338708 | AI25: =RC[-28] -> 115.13717651 | AJ25: =RC[-28] -> 44.15 | AK25: =RC[-28] -> 5.9474948686399998 | AL25: =RC[-28] -> 23.030000000000008 | AM25: =RC[-28] -> 17.154098510000001 | AN25: =RC[-28] -> 18.69391632 | AO25: =RC[-28] -> 66.58 | AP25: - | AQ25: =RC[-29] -> 0 | AR25: =RC[-29] -> 0 | AS25: - | AT25: =RC[-30] -> 0 | AU25: =RC[-30] -> 0 | AV25: =RC[-30] -> 1.22668591286902 | AW25: =RC[-30] -> 3.8030041177032601 | AY25: - | AZ25: - | BA25: -
A26: =IF(RC[1]="","",DATEVALUE(RC[1])) -> 43378 | B26: 05.10.18 | C26: 24 | D26: 131.24839782999999 | E26: 66.540000000000006 | F26: 16.907312189399999 | G26: 117.35249329 | H26: 43.81 | I26: 5.8520254283200002 | J26: =RC[-5]-RC[-2] -> 22.730000000000004 | K26: 13.89590454 | L26: 15.47756672 | M26: 65.95 | R26: 1.0066009864335499 | S26: 3.5912726115410298 | T26: =(RC[-16]*RC[-15]-RC[-13]*RC[-12])/1000 -> 3.5920556605732998 | U26: 15.17262936 | V26: - | W26: =RC[-2]*RC[-10]/1000 -> 1.0006349062920001 | X26: =ABS((RC[-3]*RC[-11]-RC[-2]*RC[-9])/1000) -> #VALUE! | Y26: =(RC[-14]-RC[1])/RC[-18]*100 -> -1.0879400890486186 | Z26: 15.17262936 | AC26: =VALUE(RC[-27]) -> 2018-10-05T00:00:00.000 | AD26: =IF(RC[21]=42,"*",IF(RC[21]=32,"",RC[21])) -> - | AE26: =RC[-28] -> 24 | AF26: =RC[-28] -> 131.24839782999999 | AG26: =RC[-28] -> 66.540000000000006 | AH26: =RC[-28] -> 16.907312189399999 | AI26: =RC[-28] -> 117.35249329 | AJ26: =RC[-28] -> 43.81 | AK26: =RC[-28] -> 5.8520254283200002 | AL26: =RC[-28] -> 22.730000000000004 | AM26: =RC[-28] -> 13.89590454 | AN26: =RC[-28] -> 15.47756672 | AO26: =RC[-28] -> 65.95 | AP26: - | AQ26: =RC[-29] -> 0 | AR26: =RC[-29] -> 0 | AS26: - | AT26: =RC[-30] -> 0 | AU26: =RC[-30] -> 0 | AV26: =RC[-30] -> 1.0066009864335499 | AW26: =RC[-30] -> 3.5912726115410298 | AY26: - | AZ26: - | BA26: -
A27: =IF(RC[1]="","",DATEVALUE(RC[1])) -> 43379 | B27: 06.10.18 | C27: 24 | D27: 130.78210448999999 | E27: 67.180000000000007 | F27: 16.909783904320001 | G27: 114.22054291000001 | H27: 44.05 | I27: 5.9689061259200002 | J27: =RC[-5]-RC[-2] -> 23.13000000000001 | K27: 16.561561579999999 | L27: 18.1410923 | M27: 66.34 | R27: 1.1940108125537401 | S27: 3.7582006950415598 | T27: =(RC[-16]*RC[-15]-RC[-13]*RC[-12])/1000 -> 3.7545268644527003 | U27: 17.77605247 | V27: - | W27: =RC[-2]*RC[-10]/1000 -> 1.1792633208598 | X27: =ABS((RC[-3]*RC[-11]-RC[-2]*RC[-9])/1000) -> #VALUE! | Y27: =(RC[-14]-RC[1])/RC[-18]*100 -> -1.0632858670239009 | Z27: 17.77605247 | AC27: =VALUE(RC[-27]) -> 2018-10-06T00:00:00.000 | AD27: =IF(RC[21]=42,"*",IF(RC[21]=32,"",RC[21])) -> - | AE27: =RC[-28] -> 24 | AF27: =RC[-28] -> 130.78210448999999 | AG27: =RC[-28] -> 67.180000000000007 | AH27: =RC[-28] -> 16.909783904320001 | AI27: =RC[-28] -> 114.22054291000001 | AJ27: =RC[-28] -> 44.05 | AK27: =RC[-28] -> 5.9689061259200002 | AL27: =RC[-28] -> 23.13000000000001 | AM27: =RC[-28] -> 16.561561579999999 | AN27: =RC[-28] -> 18.1410923 | AO27: =RC[-28] -> 66.34 | AP27: - | AQ27: =RC[-29] -> 0 | AR27: =RC[-29] -> 0 | AS27: - | AT27: =RC[-30] -> 0 | AU27: =RC[-30] -> 0 | AV27: =RC[-30] -> 1.1940108125537401 | AW27: =RC[-30] -> 3.7582006950415598 | AY27: - | AZ27: - | BA27: -
A28: =IF(RC[1]="","",DATEVALUE(RC[1])) -> 43380 | B28: 07.10.18 | C28: 24 | D28: 134.26870728 | E28: 67.459999999999994 | F28: 16.9077489206 | G28: 116.86467743 | H28: 44.61 | I28: 5.91406482996 | J28: =RC[-5]-RC[-2] -> 22.849999999999994 | K28: 17.404029850000001 | L28: 19.021703720000001 | M28: 66.86 | R28: 1.2552009291105399 | S28: 3.8464504203687802 | T28: =(RC[-16]*RC[-15]-RC[-13]*RC[-12])/1000 -> 3.8444337329564986 | U28: 18.636047359999999 | V28: - | W28: =RC[-2]*RC[-10]/1000 -> 1.2460061264895999 | X28: =ABS((RC[-3]*RC[-11]-RC[-2]*RC[-9])/1000) -> #VALUE! | Y28: =(RC[-14]-RC[1])/RC[-18]*100 -> -1.0542257396277475 | Z28: 18.636047359999999 | AC28: =VALUE(RC[-27]) -> 2018-10-07T00:00:00.000 | AD28: =IF(RC[21]=42,"*",IF(RC[21]=32,"",RC[21])) -> - | AE28: =RC[-28] -> 24 | AF28: =RC[-28] -> 134.26870728 | AG28: =RC[-28] -> 67.459999999999994 | AH28: =RC[-28] -> 16.9077489206 | AI28: =RC[-28] -> 116.86467743 | AJ28: =RC[-28] -> 44.61 | AK28: =RC[-28] -> 5.91406482996 | AL28: =RC[-28] -> 22.849999999999994 | AM28: =RC[-28] -> 17.404029850000001 | AN28: =RC[-28] -> 19.021703720000001 | AO28: =RC[-28] -> 66.86 | AP28: - | AQ28: =RC[-29] -> 0 | AR28: =RC[-29] -> 0 | AS28: - | AT28: =RC[-30] -> 0 | AU28: =RC[-30] -> 0 | AV28: =RC[-30] -> 1.2552009291105399 | AW28: =RC[-30] -> 3.8464504203687802 | AY28: - | AZ28: - | BA28: -
A29: =IF(RC[1]="","",DATEVALUE(RC[1])) -> 43381 | B29: 08.10.18 | C29: 24 | D29: 133.18063354 | E29: 67.45 | F29: 16.90855289376 | G29: 117.92049408 | H29: 44.27 | I29: 5.8437890656400002 | J29: =RC[-5]-RC[-2] -> 23.18 | K29: 15.26013946 | L29: 16.59870338 | M29: 66.819999999999993 | R29: 1.0935911937517899 | S29: 3.76163745820197 | T29: =(RC[-16]*RC[-15]-RC[-13]*RC[-12])/1000 -> 3.7626934593514005 | U29: 16.263544079999999 | V29: - | W29: =RC[-2]*RC[-10]/1000 -> 1.0867300154255997 | X29: =ABS((RC[-3]*RC[-11]-RC[-2]*RC[-9])/1000) -> #VALUE! | Y29: =(RC[-14]-RC[1])/RC[-18]*100 -> -0.85091622777569653 | Z29: 16.263544079999999 | AC29: =VALUE(RC[-27]) -> 2018-10-08T00:00:00.000 | AD29: =IF(RC[21]=42,"*",IF(RC[21]=32,"",RC[21])) -> - | AE29: =RC[-28] -> 24 | AF29: =RC[-28] -> 133.18063354 | AG29: =RC[-28] -> 67.45 | AH29: =RC[-28] -> 16.90855289376 | AI29: =RC[-28] -> 117.92049408 | AJ29: =RC[-28] -> 44.27 | AK29: =RC[-28] -> 5.8437890656400002 | AL29: =RC[-28] -> 23.18 | AM29: =RC[-28] -> 15.26013946 | AN29: =RC[-28] -> 16.59870338 | AO29: =RC[-28] -> 66.819999999999993 | AP29: - | AQ29: =RC[-29] -> 0 | AR29: =RC[-29] -> 0 | AS29: - | AT29: =RC[-30] -> 0 | AU29: =RC[-30] -> 0 | AV29: =RC[-30] -> 1.0935911937517899 | AW29: =RC[-30] -> 3.76163745820197 | AY29: - | AZ29: - | BA29: -
A30: =IF(RC[1]="","",DATEVALUE(RC[1])) -> 43382 | B30: 09.10.18 | C30: 24 | D30: 131.84696959999999 | E30: 67.27 | F30: 16.913144897839999 | G30: 117.37010193 | H30: 44.29 | I30: 5.8857832194800004 | J30: =RC[-5]-RC[-2] -> 22.979999999999997 | K30: 14.476867670000001 | L30: 15.96592426 | M30: 66.650000000000006 | R30: 1.05071332043565 | S30: 3.6724160193942899 | T30: =(RC[-16]*RC[-15]-RC[-13]*RC[-12])/1000 -> 3.6710238305122993 | U30: 15.64396477 | V30: - | W30: =RC[-2]*RC[-10]/1000 -> 1.0426702519205 | X30: =ABS((RC[-3]*RC[-11]-RC[-2]*RC[-9])/1000) -> #VALUE! | Y30: =(RC[-14]-RC[1])/RC[-18]*100 -> -0.99437342288077823 | Z30: 15.64396477 | AC30: =VALUE(RC[-27]) -> 2018-10-09T00:00:00.000 | AD30: =IF(RC[21]=42,"*",IF(RC[21]=32,"",RC[21])) -> - | AE30: =RC[-28] -> 24 | AF30: =RC[-28] -> 131.84696959999999 | AG30: =RC[-28] -> 67.27 | AH30: =RC[-28] -> 16.913144897839999 | AI30: =RC[-28] -> 117.37010193 | AJ30: =RC[-28] -> 44.29 | AK30: =RC[-28] -> 5.8857832194800004 | AL30: =RC[-28] -> 22.979999999999997 | AM30: =RC[-28] -> 14.476867670000001 | AN30: =RC[-28] -> 15.96592426 | AO30: =RC[-28] -> 66.650000000000006 | AP30: - | AQ30: =RC[-29] -> 0 | AR30: =RC[-29] -> 0 | AS30: - | AT30: =RC[-30] -> 0 | AU30: =RC[-30] -> 0 | AV30: =RC[-30] -> 1.05071332043565 | AW30: =RC[-30] -> 3.6724160193942899 | AY30: - | AZ30: - | BA30: -
A31: =IF(RC[1]="","",DATEVALUE(RC[1])) -> 43383 | B31: 10.10.18 | C31: 24 | D31: 132.09483337 | E31: 68.28 | F31: 16.914057237480002 | G31: 116.63211823 | H31: 45.3 | I31: 5.9441217323600002 | J31: =RC[-5]-RC[-2] -> 22.980000000000004 | K31: 15.46271514 | L31: 16.844686509999999 | M31: 67.69 | R31: 1.12690943441292 | S31: 3.74054605904271 | T31: =(RC[-16]*RC[-15]-RC[-13]*RC[-12])/1000 -> 3.7360002666846004 | U31: 16.493926999999999 | V31: - | W31: =RC[-2]*RC[-10]/1000 -> 1.1164739186299999 | X31: =ABS((RC[-3]*RC[-11]-RC[-2]*RC[-9])/1000) -> #VALUE! | Y31: =(RC[-14]-RC[1])/RC[-18]*100 -> -0.88415770514125125 | Z31: 16.493926999999999 | AC31: =VALUE(RC[-27]) -> 2018-10-10T00:00:00.000 | AD31: =IF(RC[21]=42,"*",IF(RC[21]=32,"",RC[21])) -> - | AE31: =RC[-28] -> 24 | AF31: =RC[-28] -> 132.09483337 | AG31: =RC[-28] -> 68.28 | AH31: =RC[-28] -> 16.914057237480002 | AI31: =RC[-28] -> 116.63211823 | AJ31: =RC[-28] -> 45.3 | AK31: =RC[-28] -> 5.9441217323600002 | AL31: =RC[-28] -> 22.980000000000004 | AM31: =RC[-28] -> 15.46271514 | AN31: =RC[-28] -> 16.844686509999999 | AO31: =RC[-28] -> 67.69 | AP31: - | AQ31: =RC[-29] -> 0 | AR31: =RC[-29] -> 0 | AS31: - | AT31: =RC[-30] -> 0 | AU31: =RC[-30] -> 0 | AV31: =RC[-30] -> 1.12690943441292 | AW31: =RC[-30] -> 3.74054605904271 | AY31: - | AZ31: - | BA31: -
A32: =IF(RC[1]="","",DATEVALUE(RC[1])) -> 43384 | B32: 11.10.18 | C32: 24 | D32: 133.41217040999999 | E32: 69.430000000000007 | F32: 16.913964789240001 | G32: 119.58041382 | H32: 45.9 | I32: 5.7885512422399996 | J32: =RC[-5]-RC[-2] -> 23.530000000000008 | K32: 13.831756589999999 | L32: 14.98162746 | M32: 68.62 | R32: 1.0150337871405399 | S32: 3.77484079487914 | T32: =(RC[-16]*RC[-15]-RC[-13]*RC[-12])/1000 -> 3.7740659972283002 | U32: 14.66233826 | V32: - | W32: =RC[-2]*RC[-10]/1000 -> 1.0061296514012001 | X32: =ABS((RC[-3]*RC[-11]-RC[-2]*RC[-9])/1000) -> #VALUE! | Y32: =(RC[-14]-RC[1])/RC[-18]*100 -> -0.69458002650019657 | Z32: 14.66233826 | AC32: =VALUE(RC[-27]) -> 2018-10-11T00:00:00.000 | AD32: =IF(RC[21]=42,"*",IF(RC[21]=32,"",RC[21])) -> - | AE32: =RC[-28] -> 24 | AF32: =RC[-28] -> 133.41217040999999 | AG32: =RC[-28] -> 69.430000000000007 | AH32: =RC[-28] -> 16.913964789240001 | AI32: =RC[-28] -> 119.58041382 | AJ32: =RC[-28] -> 45.9 | AK32: =RC[-28] -> 5.7885512422399996 | AL32: =RC[-28] -> 23.530000000000008 | AM32: =RC[-28] -> 13.831756589999999 | AN32: =RC[-28] -> 14.98162746 | AO32: =RC[-28] -> 68.62 | AP32: - | AQ32: =RC[-29] -> 0 | AR32: =RC[-29] -> 0 | AS32: - | AT32: =RC[-30] -> 0 | AU32: =RC[-30] -> 0 | AV32: =RC[-30] -> 1.0150337871405399 | AW32: =RC[-30] -> 3.77484079487914 | AY32: - | AZ32: - | BA32: -
A33: =IF(RC[1]="","",DATEVALUE(RC[1])) -> 43385 | B33: 12.10.18 | C33: 24 | D33: 133.35887145999999 | E33: 69.3 | F33: 16.913653363160002 | G33: 120.16150665000001 | H33: 45.56 | I33: 5.7902334736799999 | J33: =RC[-5]-RC[-2] -> 23.739999999999995 | K33: 13.19736481 | L33: 15.083897589999999 | M33: 68.569999999999993 | R33: 1.01999873411675 | S33: 3.7676274195089299 | T33: =(RC[-16]*RC[-15]-RC[-13]*RC[-12])/1000 -> 3.7672115492039975 | U33: 14.763312340000001 | V33: - | W33: =RC[-2]*RC[-10]/1000 -> 1.0123203271537999 | X33: =ABS((RC[-3]*RC[-11]-RC[-2]*RC[-9])/1000) -> #VALUE! | Y33: =(RC[-14]-RC[1])/RC[-18]*100 -> -1.3032023096724383 | Z33: 14.763312340000001 | AC33: =VALUE(RC[-27]) -> 2018-10-12T00:00:00.000 | AD33: =IF(RC[21]=42,"*",IF(RC[21]=32,"",RC[21])) -> - | AE33: =RC[-28] -> 24 | AF33: =RC[-28] -> 133.35887145999999 | AG33: =RC[-28] -> 69.3 | AH33: =RC[-28] -> 16.913653363160002 | AI33: =RC[-28] -> 120.16150665000001 | AJ33: =RC[-28] -> 45.56 | AK33: =RC[-28] -> 5.7902334736799999 | AL33: =RC[-28] -> 23.739999999999995 | AM33: =RC[-28] -> 13.19736481 | AN33: =RC[-28] -> 15.083897589999999 | AO33: =RC[-28] -> 68.569999999999993 | AP33: - | AQ33: =RC[-29] -> 0 | AR33: =RC[-29] -> 0 | AS33: - | AT33: =RC[-30] -> 0 | AU33: =RC[-30] -> 0 | AV33: =RC[-30] -> 1.01999873411675 | AW33: =RC[-30] -> 3.7676274195089299 | AY33: - | AZ33: - | BA33: -
A34: =IF(RC[1]="","",DATEVALUE(RC[1])) -> 43386 | B34: 13.10.18 | C34: 24 | D34: 134.97570801000001 | E34: 70.37 | F34: 16.913923360999998 | G34: 119.65771484 | H34: 46.39 | I34: 5.7824229239199996 | J34: =RC[-5]-RC[-2] -> 23.980000000000004 | K34: 15.317993169999999 | L34: 17.098484039999999 | M34: 69.7 | R34: 1.1746695710327699 | S34: 3.9493801877328698 | T34: =(RC[-16]*RC[-15]-RC[-13]*RC[-12])/1000 -> 3.947319181236101 | U34: 16.724784849999999 | V34: - | W34: =RC[-2]*RC[-10]/1000 -> 1.1657175040449999 | X34: =ABS((RC[-3]*RC[-11]-RC[-2]*RC[-9])/1000) -> #VALUE! | Y34: =(RC[-14]-RC[1])/RC[-18]*100 -> -1.1756798814694793 | Z34: 16.724784849999999 | AC34: =VALUE(RC[-27]) -> 2018-10-13T00:00:00.000 | AD34: =IF(RC[21]=42,"*",IF(RC[21]=32,"",RC[21])) -> - | AE34: =RC[-28] -> 24 | AF34: =RC[-28] -> 134.97570801000001 | AG34: =RC[-28] -> 70.37 | AH34: =RC[-28] -> 16.913923360999998 | AI34: =RC[-28] -> 119.65771484 | AJ34: =RC[-28] -> 46.39 | AK34: =RC[-28] -> 5.7824229239199996 | AL34: =RC[-28] -> 23.980000000000004 | AM34: =RC[-28] -> 15.317993169999999 | AN34: =RC[-28] -> 17.098484039999999 | AO34: =RC[-28] -> 69.7 | AP34: - | AQ34: =RC[-29] -> 0 | AR34: =RC[-29] -> 0 | AS34: - | AT34: =RC[-30] -> 0 | AU34: =RC[-30] -> 0 | AV34: =RC[-30] -> 1.1746695710327699 | AW34: =RC[-30] -> 3.9493801877328698 | AY34: - | AZ34: - | BA34: -
A35: =IF(RC[1]="","",DATEVALUE(RC[1])) -> 43387 | B35: 14.10.18 | C35: 24 | D35: 135.67657471000001 | E35: 71.150000000000006 | F35: 16.914793149960001 | G35: 119.67044067 | H35: 47.38 | I35: 5.7650665321599996 | J35: =RC[-5]-RC[-2] -> 23.770000000000003 | K35: 16.006134039999999 | L35: 17.49459457 | M35: 70.510000000000005 | R35: 1.21583828699723 | S35: 3.9871822991306001 | T35: =(RC[-16]*RC[-15]-RC[-13]*RC[-12])/1000 -> 3.9834028116719011 | U35: 17.10336113 | V35: - | W35: =RC[-2]*RC[-10]/1000 -> 1.2059579932763003 | X35: =ABS((RC[-3]*RC[-11]-RC[-2]*RC[-9])/1000) -> #VALUE! | Y35: =(RC[-14]-RC[1])/RC[-18]*100 -> -0.91687394469089023 | Z35: 17.10336113 | AC35: =VALUE(RC[-27]) -> 2018-10-14T00:00:00.000 | AD35: =IF(RC[21]=42,"*",IF(RC[21]=32,"",RC[21])) -> - | AE35: =RC[-28] -> 24 | AF35: =RC[-28] -> 135.67657471000001 | AG35: =RC[-28] -> 71.150000000000006 | AH35: =RC[-28] -> 16.914793149960001 | AI35: =RC[-28] -> 119.67044067 | AJ35: =RC[-28] -> 47.38 | AK35: =RC[-28] -> 5.7650665321599996 | AL35: =RC[-28] -> 23.770000000000003 | AM35: =RC[-28] -> 16.006134039999999 | AN35: =RC[-28] -> 17.49459457 | AO35: =RC[-28] -> 70.510000000000005 | AP35: - | AQ35: =RC[-29] -> 0 | AR35: =RC[-29] -> 0 | AS35: - | AT35: =RC[-30] -> 0 | AU35: =RC[-30] -> 0 | AV35: =RC[-30] -> 1.21583828699723 | AW35: =RC[-30] -> 3.9871822991306001 | AY35: - | AZ35: - | BA35: -
A36: =IF(RC[1]="","",DATEVALUE(RC[1])) -> 43388 | B36: 15.10.18 | C36: 24 | D36: 132.45982361 | E36: 70.64 | F36: 16.918175980040001 | G36: 120.04959869 | H36: 47.39 | I36: 5.7624440021199996 | J36: =RC[-5]-RC[-2] -> 23.25 | K36: 12.410224919999999 | L36: 13.74247551 | M36: 69.73 | R36: 0.94704992595777204 | S36: 3.6697607743384002 | T36: =(RC[-16]*RC[-15]-RC[-13]*RC[-12])/1000 -> 3.6678114578913008 | U36: 13.439723969999999 | V36: - | W36: =RC[-2]*RC[-10]/1000 -> 0.93715195242810001 | X36: =ABS((RC[-3]*RC[-11]-RC[-2]*RC[-9])/1000) -> #VALUE! | Y36: =(RC[-14]-RC[1])/RC[-18]*100 -> -0.85756142563911486 | Z36: 13.439723969999999 | AC36: =VALUE(RC[-27]) -> 2018-10-15T00:00:00.000 | AD36: =IF(RC[21]=42,"*",IF(RC[21]=32,"",RC[21])) -> - | AE36: =RC[-28] -> 24 | AF36: =RC[-28] -> 132.45982361 | AG36: =RC[-28] -> 70.64 | AH36: =RC[-28] -> 16.918175980040001 | AI36: =RC[-28] -> 120.04959869 | AJ36: =RC[-28] -> 47.39 | AK36: =RC[-28] -> 5.7624440021199996 | AL36: =RC[-28] -> 23.25 | AM36: =RC[-28] -> 12.410224919999999 | AN36: =RC[-28] -> 13.74247551 | AO36: =RC[-28] -> 69.73 | AP36: - | AQ36: =RC[-29] -> 0 | AR36: =RC[-29] -> 0 | AS36: - | AT36: =RC[-30] -> 0 | AU36: =RC[-30] -> 0 | AV36: =RC[-30] -> 0.94704992595777204 | AW36: =RC[-30] -> 3.6697607743384002 | AY36: - | AZ36: - | BA36: -
A37: =IF(RC[1]="","",DATEVALUE(RC[1])) -> 43389 | B37: 16.10.18 | C37: 24 | D37: 132.36518860000001 | E37: 70.67 | F37: 16.915704265119999 | G37: 119.73800659 | H37: 47.32 | I37: 5.7652970405200001 | J37: =RC[-5]-RC[-2] -> 23.35 | K37: 12.62718201 | L37: 13.95549488 | M37: 69.77 | R37: 0.96108586032291998 | S37: 3.68925383347664 | T37: =(RC[-16]*RC[-15]-RC[-13]*RC[-12])/1000 -> 3.6882454065232007 | U37: 13.648463250000001 | V37: - | W37: =RC[-2]*RC[-10]/1000 -> 0.95225328095249995 | X37: =ABS((RC[-3]*RC[-11]-RC[-2]*RC[-9])/1000) -> #VALUE! | Y37: =(RC[-14]-RC[1])/RC[-18]*100 -> -0.85292988340536935 | Z37: 13.648463250000001 | AC37: =VALUE(RC[-27]) -> 2018-10-16T00:00:00.000 | AD37: =IF(RC[21]=42,"*",IF(RC[21]=32,"",RC[21])) -> - | AE37: =RC[-28] -> 24 | AF37: =RC[-28] -> 132.36518860000001 | AG37: =RC[-28] -> 70.67 | AH37: =RC[-28] -> 16.915704265119999 | AI37: =RC[-28] -> 119.73800659 | AJ37: =RC[-28] -> 47.32 | AK37: =RC[-28] -> 5.7652970405200001 | AL37: =RC[-28] -> 23.35 | AM37: =RC[-28] -> 12.62718201 | AN37: =RC[-28] -> 13.95549488 | AO37: =RC[-28] -> 69.77 | AP37: - | AQ37: =RC[-29] -> 0 | AR37: =RC[-29] -> 0 | AS37: - | AT37: =RC[-30] -> 0 | AU37: =RC[-30] -> 0 | AV37: =RC[-30] -> 0.96108586032291998 | AW37: =RC[-30] -> 3.68925383347664 | AY37: - | AZ37: - | BA37: -
A38: =IF(RC[1]="","",DATEVALUE(RC[1])) -> 43390 | B38: 17.10.18 | C38: 24 | D38: 135.07714844 | E38: 70.849999999999994 | F38: 16.915143453279999 | G38: 120.41900635 | H38: 47.51 | I38: 5.7490032933200004 | J38: =RC[-5]-RC[-2] -> 23.339999999999996 | K38: 14.65814209 | L38: 15.590796470000001 | M38: 70.05 | R38: 1.07724721027993 | S38: 3.8519681928919498 | T38: =(RC[-16]*RC[-15]-RC[-13]*RC[-12])/1000 -> 3.8491089752854997 | U38: 15.24570179 | V38: - | W38: =RC[-2]*RC[-10]/1000 -> 1.0679614103894999 | X38: =ABS((RC[-3]*RC[-11]-RC[-2]*RC[-9])/1000) -> #VALUE! | Y38: =(RC[-14]-RC[1])/RC[-18]*100 -> -0.48792937079404813 | Z38: 15.24570179 | AC38: =VALUE(RC[-27]) -> 2018-10-17T00:00:00.000 | AD38: =IF(RC[21]=42,"*",IF(RC[21]=32,"",RC[21])) -> - | AE38: =RC[-28] -> 24 | AF38: =RC[-28] -> 135.07714844 | AG38: =RC[-28] -> 70.849999999999994 | AH38: =RC[-28] -> 16.915143453279999 | AI38: =RC[-28] -> 120.41900635 | AJ38: =RC[-28] -> 47.51 | AK38: =RC[-28] -> 5.7490032933200004 | AL38: =RC[-28] -> 23.339999999999996 | AM38: =RC[-28] -> 14.65814209 | AN38: =RC[-28] -> 15.590796470000001 | AO38: =RC[-28] -> 70.05 | AP38: - | AQ38: =RC[-29] -> 0 | AR38: =RC[-29] -> 0 | AS38: - | AT38: =RC[-30] -> 0 | AU38: =RC[-30] -> 0 | AV38: =RC[-30] -> 1.07724721027993 | AW38: =RC[-30] -> 3.8519681928919498 | AY38: - | AZ38: - | BA38: -
A39: =IF(RC[1]="","",DATEVALUE(RC[1])) -> 43391 | B39: 18.10.18 | C39: 24 | D39: 135.58128357000001 | E39: 71.319999999999993 | F39: 16.91513733088 | G39: 122.28205871999999 | H39: 47.95 | I39: 5.7222933029199998 | J39: 23.36999999999999 | K39: 13.29922485 | L39: 14.78456974 | M39: 70.19 | R39: 1.0279898681570601 | S39: 3.8075034799847098 | T39: 3.8062324285884004 | U39: 14.453307150000001 | V39: - | W39: 1.0144776288585 | X39: #VALUE! | Y39: -0.94378710342340955 | Z39: 14.453307150000001 | AC39: =VALUE(RC[-27]) -> 2018-10-18T00:00:00.000 | AD39: =IF(RC[21]=42,"*",IF(RC[21]=32,"",RC[21])) ->  | AE39: =RC[-28] -> 24 | AF39: =RC[-28] -> 135.58128357000001 | AG39: =RC[-28] -> 71.319999999999993 | AH39: =RC[-28] -> 16.91513733088 | AI39: =RC[-28] -> 122.28205871999999 | AJ39: =RC[-28] -> 47.95 | AK39: =RC[-28] -> 5.7222933029199998 | AL39: =RC[-28] -> 23.36999999999999 | AM39: =RC[-28] -> 13.29922485 | AN39: =RC[-28] -> 14.78456974 | AO39: =RC[-28] -> 70.19 | AP39: - | AQ39: =RC[-29] -> 0 | AR39: =RC[-29] -> 0 | AS39: - | AT39: =RC[-30] -> 0 | AU39: =RC[-30] -> 0 | AV39: =RC[-30] -> 1.0279898681570601 | AW39: =RC[-30] -> 3.8075034799847098
A40: =IF(RC[1]="","",DATEVALUE(RC[1])) -> 43392 | B40: 19.10.18 | C40: 24 | D40: 134.34899902000001 | E40: 71.12 | F40: 16.91834506032 | G40: 122.19992065 | H40: 47.61 | I40: 5.7302480351999998 | J40: 23.510000000000005 | K40: 12.14907837 | L40: 13.879534720000001 | M40: 70.34 | R40: 0.96187261631795196 | S40: 3.7376650807299101 | T40: 3.7369625881559014 | U40: 13.57054329 | V40: - | W40: 0.9545520150186001 | X40: #VALUE! | Y40: -1.1632290041098321 | Z40: 13.57054329 | AC40: =VALUE(RC[-27]) -> 2018-10-19T00:00:00.000 | AD40: =IF(RC[21]=42,"*",IF(RC[21]=32,"",RC[21])) ->  | AE40: =RC[-28] -> 24 | AF40: =RC[-28] -> 134.34899902000001 | AG40: =RC[-28] -> 71.12 | AH40: =RC[-28] -> 16.91834506032 | AI40: =RC[-28] -> 122.19992065 | AJ40: =RC[-28] -> 47.61 | AK40: =RC[-28] -> 5.7302480351999998 | AL40: =RC[-28] -> 23.510000000000005 | AM40: =RC[-28] -> 12.14907837 | AN40: =RC[-28] -> 13.879534720000001 | AO40: =RC[-28] -> 70.34 | AP40: - | AQ40: =RC[-29] -> 0 | AR40: =RC[-29] -> 0 | AS40: - | AT40: =RC[-30] -> 0 | AU40: =RC[-30] -> 0 | AV40: =RC[-30] -> 0.96187261631795196 | AW40: =RC[-30] -> 3.7376650807299101
A41: =IF(RC[1]="","",DATEVALUE(RC[1])) -> 43393 | B41: 20.10.18 | C41: 24 | D41: 137.66990662000001 | E41: 70.459999999999994 | F41: 16.915175085680001 | G41: 121.84867096000001 | H41: 46.82 | I41: 5.7276819332800004 | J41: 23.639999999999993 | K41: 15.821235659999999 | L41: 17.60966492 | M41: 69.77 | R41: 1.2122984546670501 | S41: 3.99940913824401 | T41: 3.9952668460979992 | U41: 17.22276115 | V41: - | W41: 1.2016320454355001 | X41: #VALUE! | Y41: -1.150218118062271 | Z41: 17.22276115 | AC41: =VALUE(RC[-27]) -> 2018-10-20T00:00:00.000 | AD41: =IF(RC[21]=42,"*",IF(RC[21]=32,"",RC[21])) ->  | AE41: =RC[-28] -> 24 | AF41: =RC[-28] -> 137.66990662000001 | AG41: =RC[-28] -> 70.459999999999994 | AH41: =RC[-28] -> 16.915175085680001 | AI41: =RC[-28] -> 121.84867096000001 | AJ41: =RC[-28] -> 46.82 | AK41: =RC[-28] -> 5.7276819332800004 | AL41: =RC[-28] -> 23.639999999999993 | AM41: =RC[-28] -> 15.821235659999999 | AN41: =RC[-28] -> 17.60966492 | AO41: =RC[-28] -> 69.77 | AP41: - | AQ41: =RC[-29] -> 0 | AR41: =RC[-29] -> 0 | AS41: - | AT41: =RC[-30] -> 0 | AU41: =RC[-30] -> 0 | AV41: =RC[-30] -> 1.2122984546670501 | AW41: =RC[-30] -> 3.99940913824401
A42: =IF(RC[1]="","",DATEVALUE(RC[1])) -> 43394 | B42: 21.10.18 | C42: 24 | D42: 138.49339294000001 | E42: 69.569999999999993 | F42: 16.914319990479999 | G42: 122.26480865000001 | H42: 46.42 | I42: 5.7269283678800003 | J42: 23.149999999999991 | K42: 16.228584290000001 | L42: 18.01262856 | M42: 68.930000000000007 | R42: 1.2220679898729301 | S42: 3.95998340259864 | T42: 3.9594529293027989 | U42: 17.627788540000001 | V42: - | W42: 1.2150834640622001 | X42: #VALUE! | Y42: -1.1444047272878142 | Z42: 17.627788540000001 | AC42: =VALUE(RC[-27]) -> 2018-10-21T00:00:00.000 | AD42: =IF(RC[21]=42,"*",IF(RC[21]=32,"",RC[21])) ->  | AE42: =RC[-28] -> 24 | AF42: =RC[-28] -> 138.49339294000001 | AG42: =RC[-28] -> 69.569999999999993 | AH42: =RC[-28] -> 16.914319990479999 | AI42: =RC[-28] -> 122.26480865000001 | AJ42: =RC[-28] -> 46.42 | AK42: =RC[-28] -> 5.7269283678800003 | AL42: =RC[-28] -> 23.149999999999991 | AM42: =RC[-28] -> 16.228584290000001 | AN42: =RC[-28] -> 18.01262856 | AO42: =RC[-28] -> 68.930000000000007 | AP42: - | AQ42: =RC[-29] -> 0 | AR42: =RC[-29] -> 0 | AS42: - | AT42: =RC[-30] -> 0 | AU42: =RC[-30] -> 0 | AV42: =RC[-30] -> 1.2220679898729301 | AW42: =RC[-30] -> 3.95998340259864
A43: =IF(RC[1]="","",DATEVALUE(RC[1])) -> 43395 | B43: 22.10.18 | C43: 24 | D43: 138.29705810999999 | E43: 70.040000000000006 | F43: 16.913976932000001 | G43: 123.54338074 | H43: 46.71 | I43: 5.7364121695600003 | J43: 23.330000000000005 | K43: 14.75367737 | L43: 16.45944214 | M43: 69.02 | R43: 1.1280708894621201 | S43: 3.920502997516 | T43: 3.9156146356589998 | U43: 16.100507740000001 | V43: - | W43: 1.1112570442148 | X43: #VALUE! | Y43: -1.0901679733327339 | Z43: 16.100507740000001 | AC43: =VALUE(RC[-27]) -> 2018-10-22T00:00:00.000 | AD43: =IF(RC[21]=42,"*",IF(RC[21]=32,"",RC[21])) ->  | AE43: =RC[-28] -> 24 | AF43: =RC[-28] -> 138.29705810999999 | AG43: =RC[-28] -> 70.040000000000006 | AH43: =RC[-28] -> 16.913976932000001 | AI43: =RC[-28] -> 123.54338074 | AJ43: =RC[-28] -> 46.71 | AK43: =RC[-28] -> 5.7364121695600003 | AL43: =RC[-28] -> 23.330000000000005 | AM43: =RC[-28] -> 14.75367737 | AN43: =RC[-28] -> 16.45944214 | AO43: =RC[-28] -> 69.02 | AP43: - | AQ43: =RC[-29] -> 0 | AR43: =RC[-29] -> 0 | AS43: - | AT43: =RC[-30] -> 0 | AU43: =RC[-30] -> 0 | AV43: =RC[-30] -> 1.1280708894621201 | AW43: =RC[-30] -> 3.920502997516
A44: =IF(RC[1]="","",DATEVALUE(RC[1])) ->  | C44: 24 | J44: =RC[-5]-RC[-2] -> #VALUE! | T44: =(RC[-16]*RC[-15]-RC[-13]*RC[-12])/1000 -> #VALUE! | W44: =RC[-2]*RC[-10]/1000 -> #VALUE! | X44: =ABS((RC[-3]*RC[-11]-RC[-2]*RC[-9])/1000) -> #VALUE! | Y44: =(RC[-14]-RC[1])/RC[-18]*100 -> #VALUE! | AC44: =VALUE(RC[-27]) -> #VALUE! | AD44: =IF(RC[21]=42,"*",IF(RC[21]=32,"",RC[21])) ->  | AE44: =RC[-28] -> 24 | AF44: =RC[-28] ->  | AG44: =RC[-28] ->  | AH44: =RC[-28] ->  | AI44: =RC[-28] ->  | AJ44: =RC[-28] ->  | AK44: =RC[-28] ->  | AL44: =RC[-28] -> #VALUE! | AM44: =RC[-28] ->  | AN44: =RC[-28] ->  | AO44: =RC[-28] ->  | AP44: - | AQ44: =RC[-29] -> 0 | AR44: =RC[-29] -> 0 | AS44: - | AT44: =RC[-30] -> 0 | AU44: =RC[-30] -> 0 | AV44: =RC[-30] ->  | AW44: =RC[-30] -> 
A45: =IF(RC[1]="","",DATEVALUE(RC[1])) ->  | C45: 24 | T45: =(RC[-16]*RC[-15]-RC[-13]*RC[-12])/1000 -> #VALUE! | W45: =RC[-2]*RC[-10]/1000 -> #VALUE! | X45: =ABS((RC[-3]*RC[-11]-RC[-2]*RC[-9])/1000) -> #VALUE! | Y45: =(RC[-14]-RC[1])/RC[-18]*100 -> #VALUE! | AC45: =VALUE(RC[-27]) -> #VALUE! | AD45: =IF(RC[21]=42,"*",IF(RC[21]=32,"",RC[21])) ->  | AE45: =RC[-28] -> 24 | AF45: =RC[-28] ->  | AG45: =RC[-28] ->  | AH45: =RC[-28] ->  | AI45: =RC[-28] ->  | AJ45: =RC[-28] ->  | AK45: =RC[-28] ->  | AL45: =RC[-28] -> 0 | AM45: =RC[-28] ->  | AN45: =RC[-28] ->  | AO45: =RC[-28] ->  | AP45: - | AQ45: =RC[-29] -> 0 | AR45: =RC[-29] -> 0 | AS45: - | AT45: =RC[-30] -> 0 | AU45: =RC[-30] -> 0 | AV45: =RC[-30] ->  | AW45: =RC[-30] -> 
A46: =IF(RC[1]="","",DATEVALUE(RC[1])) ->  | C46: 24 | T46: =(RC[-16]*RC[-15]-RC[-13]*RC[-12])/1000 -> #VALUE! | W46: =RC[-2]*RC[-10]/1000 -> #VALUE! | X46: =ABS((RC[-3]*RC[-11]-RC[-2]*RC[-9])/1000) -> #VALUE! | Y46: =(RC[-14]-RC[1])/RC[-18]*100 -> #VALUE! | AC46: =VALUE(RC[-27]) -> #VALUE! | AD46: =IF(RC[21]=42,"*",IF(RC[21]=32,"",RC[21])) ->  | AE46: =RC[-28] -> 24 | AF46: =RC[-28] ->  | AG46: =RC[-28] ->  | AH46: =RC[-28] ->  | AI46: =RC[-28] ->  | AJ46: =RC[-28] ->  | AK46: =RC[-28] ->  | AL46: =RC[-28] -> 0 | AM46: =RC[-28] ->  | AN46: =RC[-28] ->  | AO46: =RC[-28] ->  | AP46: - | AQ46: =RC[-29] -> 0 | AR46: =RC[-29] -> 0 | AS46: - | AT46: =RC[-30] -> 0 | AU46: =RC[-30] -> 0 | AV46: =RC[-30] ->  | AW46: =RC[-30] -> 
A47: =IF(RC[1]="","",DATEVALUE(RC[1])) ->  | C47: 24 | T47: =(RC[-16]*RC[-15]-RC[-13]*RC[-12])/1000 -> #VALUE! | W47: =RC[-2]*RC[-10]/1000 -> #VALUE! | X47: =ABS((RC[-3]*RC[-11]-RC[-2]*RC[-9])/1000) -> #VALUE! | Y47: =(RC[-14]-RC[1])/RC[-18]*100 -> #VALUE! | AC47: =VALUE(RC[-27]) -> #VALUE! | AD47: =IF(RC[21]=42,"*",IF(RC[21]=32,"",RC[21])) ->  | AE47: =RC[-28] -> 24 | AF47: =RC[-28] ->  | AG47: =RC[-28] ->  | AH47: =RC[-28] ->  | AI47: =RC[-28] ->  | AJ47: =RC[-28] ->  | AK47: =RC[-28] ->  | AL47: =RC[-28] -> 0 | AM47: =RC[-28] ->  | AN47: =RC[-28] ->  | AO47: =RC[-28] ->  | AP47: - | AQ47: =RC[-29] -> 0 | AR47: =RC[-29] -> 0 | AS47: - | AT47: =RC[-30] -> 0 | AU47: =RC[-30] -> 0 | AV47: =RC[-30] ->  | AW47: =RC[-30] -> 
A48: =IF(RC[1]="","",DATEVALUE(RC[1])) ->  | C48: 24 | T48: =(RC[-16]*RC[-15]-RC[-13]*RC[-12])/1000 -> #VALUE! | W48: =RC[-2]*RC[-10]/1000 -> #VALUE! | X48: =ABS((RC[-3]*RC[-11]-RC[-2]*RC[-9])/1000) -> #VALUE! | Y48: =(RC[-14]-RC[1])/RC[-18]*100 -> #VALUE! | AC48: =VALUE(RC[-27]) -> #VALUE! | AD48: =IF(RC[21]=42,"*",IF(RC[21]=32,"",RC[21])) ->  | AE48: =RC[-28] -> 24 | AF48: =RC[-28] ->  | AG48: =RC[-28] ->  | AH48: =RC[-28] ->  | AI48: =RC[-28] ->  | AJ48: =RC[-28] ->  | AK48: =RC[-28] ->  | AL48: =RC[-28] -> 0 | AM48: =RC[-28] ->  | AN48: =RC[-28] ->  | AO48: =RC[-28] ->  | AP48: - | AQ48: =RC[-29] -> 0 | AR48: =RC[-29] -> 0 | AS48: - | AT48: =RC[-30] -> 0 | AU48: =RC[-30] -> 0 | AV48: =RC[-30] ->  | AW48: =RC[-30] -> 
A49: =IF(RC[1]="","",DATEVALUE(RC[1])) ->  | C49: 24 | T49: =(RC[-16]*RC[-15]-RC[-13]*RC[-12])/1000 -> #VALUE! | W49: =RC[-2]*RC[-10]/1000 -> #VALUE! | X49: =ABS((RC[-3]*RC[-11]-RC[-2]*RC[-9])/1000) -> #VALUE! | Y49: =(RC[-14]-RC[1])/RC[-18]*100 -> #VALUE! | AC49: =VALUE(RC[-27]) -> #VALUE! | AD49: =IF(RC[21]=42,"*",IF(RC[21]=32,"",RC[21])) ->  | AE49: =RC[-28] -> 24 | AF49: =RC[-28] ->  | AG49: =RC[-28] ->  | AH49: =RC[-28] ->  | AI49: =RC[-28] ->  | AJ49: =RC[-28] ->  | AK49: =RC[-28] ->  | AL49: =RC[-28] -> 0 | AM49: =RC[-28] ->  | AN49: =RC[-28] ->  | AO49: =RC[-28] ->  | AP49: - | AQ49: =RC[-29] -> 0 | AR49: =RC[-29] -> 0 | AS49: - | AT49: =RC[-30] -> 0 | AU49: =RC[-30] -> 0 | AV49: =RC[-30] ->  | AW49: =RC[-30] -> 
A50: =IF(RC[1]="","",DATEVALUE(RC[1])) ->  | T50: =(RC[-16]*RC[-15]-RC[-13]*RC[-12])/1000 -> #VALUE! | W50: =RC[-2]*RC[-10]/1000 -> #VALUE! | X50: =ABS((RC[-3]*RC[-11]-RC[-2]*RC[-9])/1000) -> #VALUE! | Y50: =(RC[-14]-RC[1])/RC[-18]*100 -> #VALUE! | AC50: =VALUE(RC[-27]) -> #VALUE! | AD50: =IF(RC[21]=42,"*",IF(RC[21]=32,"",RC[21])) ->  | AE50: =RC[-28] ->  | AF50: =RC[-28] ->  | AG50: =RC[-28] ->  | AH50: =RC[-28] ->  | AI50: =RC[-28] ->  | AJ50: =RC[-28] ->  | AK50: =RC[-28] ->  | AL50: =RC[-28] -> 0 | AM50: =RC[-28] ->  | AN50: =RC[-28] ->  | AO50: =RC[-28] ->  | AP50: - | AQ50: =RC[-29] -> 0 | AR50: =RC[-29] -> 0 | AS50: - | AT50: =RC[-30] -> 0 | AU50: =RC[-30] -> 0 | AV50: =RC[-30] ->  | AW50: =RC[-30] -> 
A51: =IF(RC[1]="","",DATEVALUE(RC[1])) ->  | T51: =(RC[-16]*RC[-15]-RC[-13]*RC[-12])/1000 -> #VALUE! | W51: =RC[-2]*RC[-10]/1000 -> #VALUE! | X51: =ABS((RC[-3]*RC[-11]-RC[-2]*RC[-9])/1000) -> #VALUE! | Y51: =(RC[-14]-RC[1])/RC[-18]*100 -> #VALUE! | AC51: =VALUE(RC[-27]) -> #VALUE! | AD51: =IF(RC[21]=42,"*",IF(RC[21]=32,"",RC[21])) ->  | AE51: =RC[-28] ->  | AF51: =RC[-28] ->  | AG51: =RC[-28] ->  | AH51: =RC[-28] ->  | AI51: =RC[-28] ->  | AJ51: =RC[-28] ->  | AK51: =RC[-28] ->  | AL51: =RC[-28] -> 0 | AM51: =RC[-28] ->  | AN51: =RC[-28] ->  | AO51: =RC[-28] ->  | AP51: - | AQ51: =RC[-29] -> 0 | AR51: =RC[-29] -> 0 | AS51: - | AT51: =RC[-30] -> 0 | AU51: =RC[-30] -> 0 | AV51: =RC[-30] ->  | AW51: =RC[-30] -> 
A52: =IF(RC[1]="","",DATEVALUE(RC[1])) ->  | T52: =(RC[-16]*RC[-15]-RC[-13]*RC[-12])/1000 -> #VALUE! | W52: =RC[-2]*RC[-10]/1000 -> #VALUE! | X52: =ABS((RC[-3]*RC[-11]-RC[-2]*RC[-9])/1000) -> #VALUE! | Y52: =(RC[-14]-RC[1])/RC[-18]*100 -> #VALUE! | AC52: =VALUE(RC[-27]) -> #VALUE! | AD52: =IF(RC[21]=42,"*",IF(RC[21]=32,"",RC[21])) ->  | AE52: =RC[-28] ->  | AF52: =RC[-28] ->  | AG52: =RC[-28] ->  | AH52: =RC[-28] ->  | AI52: =RC[-28] ->  | AJ52: =RC[-28] ->  | AK52: =RC[-28] ->  | AL52: =RC[-28] -> 0 | AM52: =RC[-28] ->  | AN52: =RC[-28] ->  | AO52: =RC[-28] ->  | AP52: - | AQ52: =RC[-29] -> 0 | AR52: =RC[-29] -> 0 | AS52: - | AT52: =RC[-30] -> 0 | AU52: =RC[-30] -> 0 | AV52: =RC[-30] ->  | AW52: =RC[-30] -> 
A53: =IF(RC[1]="","",DATEVALUE(RC[1])) ->  | T53: =(RC[-16]*RC[-15]-RC[-13]*RC[-12])/1000 -> #VALUE! | W53: =RC[-2]*RC[-10]/1000 -> #VALUE! | X53: =ABS((RC[-3]*RC[-11]-RC[-2]*RC[-9])/1000) -> #VALUE! | Y53: =(RC[-14]-RC[1])/RC[-18]*100 -> #VALUE! | AC53: =VALUE(RC[-27]) -> #VALUE! | AD53: =IF(RC[21]=42,"*",IF(RC[21]=32,"",RC[21])) ->  | AE53: =RC[-28] ->  | AF53: =RC[-28] ->  | AG53: =RC[-28] ->  | AH53: =RC[-28] ->  | AI53: =RC[-28] ->  | AJ53: =RC[-28] ->  | AK53: =RC[-28] ->  | AL53: =RC[-28] -> 0 | AM53: =RC[-28] ->  | AN53: =RC[-28] ->  | AO53: =RC[-28] ->  | AP53: - | AQ53: =RC[-29] -> 0 | AR53: =RC[-29] -> 0 | AS53: - | AT53: =RC[-30] -> 0 | AU53: =RC[-30] -> 0 | AV53: =RC[-30] ->  | AW53: =RC[-30] -> 
A54: =IF(RC[1]="","",DATEVALUE(RC[1])) ->  | T54: =(RC[-16]*RC[-15]-RC[-13]*RC[-12])/1000 -> #VALUE! | W54: =RC[-2]*RC[-10]/1000 -> #VALUE! | X54: =ABS((RC[-3]*RC[-11]-RC[-2]*RC[-9])/1000) -> #VALUE! | Y54: =(RC[-14]-RC[1])/RC[-18]*100 -> #VALUE! | AC54: =VALUE(RC[-27]) -> #VALUE! | AD54: =IF(RC[21]=42,"*",IF(RC[21]=32,"",RC[21])) ->  | AE54: =RC[-28] ->  | AF54: =RC[-28] ->  | AG54: =RC[-28] ->  | AH54: =RC[-28] ->  | AI54: =RC[-28] ->  | AJ54: =RC[-28] ->  | AK54: =RC[-28] ->  | AL54: =RC[-28] -> 0 | AM54: =RC[-28] ->  | AN54: =RC[-28] ->  | AO54: =RC[-28] ->  | AP54: - | AQ54: =RC[-29] -> 0 | AR54: =RC[-29] -> 0 | AS54: - | AT54: =RC[-30] -> 0 | AU54: =RC[-30] -> 0 | AV54: =RC[-30] ->  | AW54: =RC[-30] -> 
A55: =IF(RC[1]="","",DATEVALUE(RC[1])) ->  | T55: =(RC[-16]*RC[-15]-RC[-13]*RC[-12])/1000 -> #VALUE! | W55: =RC[-2]*RC[-10]/1000 -> #VALUE! | X55: =ABS((RC[-3]*RC[-11]-RC[-2]*RC[-9])/1000) -> #VALUE! | Y55: =(RC[-14]-RC[1])/RC[-18]*100 -> #VALUE! | AC55: =VALUE(RC[-27]) -> #VALUE! | AD55: =IF(RC[21]=42,"*",IF(RC[21]=32,"",RC[21])) ->  | AE55: =RC[-28] ->  | AF55: =RC[-28] ->  | AG55: =RC[-28] ->  | AH55: =RC[-28] ->  | AI55: =RC[-28] ->  | AJ55: =RC[-28] ->  | AK55: =RC[-28] ->  | AL55: =RC[-28] -> 0 | AM55: =RC[-28] ->  | AN55: =RC[-28] ->  | AO55: =RC[-28] ->  | AP55: - | AQ55: =RC[-29] -> 0 | AR55: =RC[-29] -> 0 | AS55: - | AT55: =RC[-30] -> 0 | AU55: =RC[-30] -> 0 | AV55: =RC[-30] ->  | AW55: =RC[-30] -> 
A56: =IF(RC[1]="","",DATEVALUE(RC[1])) ->  | T56: =(RC[-16]*RC[-15]-RC[-13]*RC[-12])/1000 -> #VALUE! | W56: =RC[-2]*RC[-10]/1000 -> #VALUE! | X56: =ABS((RC[-3]*RC[-11]-RC[-2]*RC[-9])/1000) -> #VALUE! | Y56: =(RC[-14]-RC[1])/RC[-18]*100 -> #VALUE! | AC56: =VALUE(RC[-27]) -> #VALUE! | AD56: =IF(RC[21]=42,"*",IF(RC[21]=32,"",RC[21])) ->  | AE56: =RC[-28] ->  | AF56: =RC[-28] ->  | AG56: =RC[-28] ->  | AH56: =RC[-28] ->  | AI56: =RC[-28] ->  | AJ56: =RC[-28] ->  | AK56: =RC[-28] ->  | AL56: =RC[-28] -> 0 | AM56: =RC[-28] ->  | AN56: =RC[-28] ->  | AO56: =RC[-28] ->  | AP56: - | AQ56: =RC[-29] -> 0 | AR56: =RC[-29] -> 0 | AS56: - | AT56: =RC[-30] -> 0 | AU56: =RC[-30] -> 0 | AV56: =RC[-30] ->  | AW56: =RC[-30] -> 
A57: =IF(RC[1]="","",DATEVALUE(RC[1])) ->  | T57: =(RC[-16]*RC[-15]-RC[-13]*RC[-12])/1000 -> #VALUE! | W57: =RC[-2]*RC[-10]/1000 -> #VALUE! | X57: =ABS((RC[-3]*RC[-11]-RC[-2]*RC[-9])/1000) -> #VALUE! | Y57: =(RC[-14]-RC[1])/RC[-18]*100 -> #VALUE! | AC57: =VALUE(RC[-27]) -> #VALUE! | AD57: =IF(RC[21]=42,"*",IF(RC[21]=32,"",RC[21])) ->  | AE57: =RC[-28] ->  | AF57: =RC[-28] ->  | AG57: =RC[-28] ->  | AH57: =RC[-28] ->  | AI57: =RC[-28] ->  | AJ57: =RC[-28] ->  | AK57: =RC[-28] ->  | AL57: =RC[-28] -> 0 | AM57: =RC[-28] ->  | AN57: =RC[-28] ->  | AO57: =RC[-28] ->  | AP57: - | AQ57: =RC[-29] -> 0 | AR57: =RC[-29] -> 0 | AS57: - | AT57: =RC[-30] -> 0 | AU57: =RC[-30] -> 0 | AV57: =RC[-30] ->  | AW57: =RC[-30] -> 
A58: =IF(RC[1]="","",DATEVALUE(RC[1])) ->  | T58: =(RC[-16]*RC[-15]-RC[-13]*RC[-12])/1000 -> #VALUE! | W58: =RC[-2]*RC[-10]/1000 -> #VALUE! | X58: =ABS((RC[-3]*RC[-11]-RC[-2]*RC[-9])/1000) -> #VALUE! | Y58: =(RC[-14]-RC[1])/RC[-18]*100 -> #VALUE! | AC58: =VALUE(RC[-27]) -> #VALUE! | AD58: =IF(RC[21]=42,"*",IF(RC[21]=32,"",RC[21])) ->  | AE58: =RC[-28] ->  | AF58: =RC[-28] ->  | AG58: =RC[-28] ->  | AH58: =RC[-28] ->  | AI58: =RC[-28] ->  | AJ58: =RC[-28] ->  | AK58: =RC[-28] ->  | AL58: =RC[-28] -> 0 | AM58: =RC[-28] ->  | AN58: =RC[-28] ->  | AO58: =RC[-28] ->  | AP58: - | AQ58: =RC[-29] -> 0 | AR58: =RC[-29] -> 0 | AS58: - | AT58: =RC[-30] -> 0 | AU58: =RC[-30] -> 0 | AV58: =RC[-30] ->  | AW58: =RC[-30] -> 
A59: =IF(RC[1]="","",DATEVALUE(RC[1])) ->  | T59: =(RC[-16]*RC[-15]-RC[-13]*RC[-12])/1000 -> #VALUE! | W59: =RC[-2]*RC[-10]/1000 -> #VALUE! | X59: =ABS((RC[-3]*RC[-11]-RC[-2]*RC[-9])/1000) -> #VALUE! | Y59: =(RC[-14]-RC[1])/RC[-18]*100 -> #VALUE! | AC59: =VALUE(RC[-27]) -> #VALUE! | AD59: =IF(RC[21]=42,"*",IF(RC[21]=32,"",RC[21])) ->  | AE59: =RC[-28] ->  | AF59: =RC[-28] ->  | AG59: =RC[-28] ->  | AH59: =RC[-28] ->  | AI59: =RC[-28] ->  | AJ59: =RC[-28] ->  | AK59: =RC[-28] ->  | AL59: =RC[-28] -> 0 | AM59: =RC[-28] ->  | AN59: =RC[-28] ->  | AO59: =RC[-28] ->  | AP59: - | AQ59: =RC[-29] -> 0 | AR59: =RC[-29] -> 0 | AS59: - | AT59: =RC[-30] -> 0 | AU59: =RC[-30] -> 0 | AV59: =RC[-30] ->  | AW59: =RC[-30] -> 
A60: =IF(RC[1]="","",DATEVALUE(RC[1])) ->  | T60: =(RC[-16]*RC[-15]-RC[-13]*RC[-12])/1000 -> #VALUE! | W60: =RC[-2]*RC[-10]/1000 -> #VALUE! | X60: =ABS((RC[-3]*RC[-11]-RC[-2]*RC[-9])/1000) -> #VALUE! | Y60: =(RC[-14]-RC[1])/RC[-18]*100 -> #VALUE! | AC60: =VALUE(RC[-27]) -> #VALUE! | AD60: =IF(RC[21]=42,"*",IF(RC[21]=32,"",RC[21])) ->  | AE60: =RC[-28] ->  | AF60: =RC[-28] ->  | AG60: =RC[-28] ->  | AH60: =RC[-28] ->  | AI60: =RC[-28] ->  | AJ60: =RC[-28] ->  | AK60: =RC[-28] ->  | AL60: =RC[-28] -> 0 | AM60: =RC[-28] ->  | AN60: =RC[-28] ->  | AO60: =RC[-28] ->  | AP60: - | AQ60: =RC[-29] -> 0 | AR60: =RC[-29] -> 0 | AS60: - | AT60: =RC[-30] -> 0 | AU60: =RC[-30] -> 0 | AV60: =RC[-30] ->  | AW60: =RC[-30] -> 
A61: =IF(RC[1]="","",DATEVALUE(RC[1])) ->  | T61: =(RC[-16]*RC[-15]-RC[-13]*RC[-12])/1000 -> #VALUE! | W61: =RC[-2]*RC[-10]/1000 -> #VALUE! | X61: =ABS((RC[-3]*RC[-11]-RC[-2]*RC[-9])/1000) -> #VALUE! | Y61: =(RC[-14]-RC[1])/RC[-18]*100 -> #VALUE! | AC61: =VALUE(RC[-27]) -> #VALUE! | AD61: =IF(RC[21]=42,"*",IF(RC[21]=32,"",RC[21])) ->  | AE61: =RC[-28] ->  | AF61: =RC[-28] ->  | AG61: =RC[-28] ->  | AH61: =RC[-28] ->  | AI61: =RC[-28] ->  | AJ61: =RC[-28] ->  | AK61: =RC[-28] ->  | AL61: =RC[-28] -> 0 | AM61: =RC[-28] ->  | AN61: =RC[-28] ->  | AO61: =RC[-28] ->  | AP61: - | AQ61: =RC[-29] -> 0 | AR61: =RC[-29] -> 0 | AS61: - | AT61: =RC[-30] -> 0 | AU61: =RC[-30] -> 0 | AV61: =RC[-30] ->  | AW61: =RC[-30] -> 
A62: =IF(RC[1]="","",DATEVALUE(RC[1])) ->  | T62: =(RC[-16]*RC[-15]-RC[-13]*RC[-12])/1000 -> #VALUE! | W62: =RC[-2]*RC[-10]/1000 -> #VALUE! | X62: =ABS((RC[-3]*RC[-11]-RC[-2]*RC[-9])/1000) -> #VALUE! | Y62: =(RC[-14]-RC[1])/RC[-18]*100 -> #VALUE! | AC62: =VALUE(RC[-27]) -> #VALUE! | AD62: =IF(RC[21]=42,"*",IF(RC[21]=32,"",RC[21])) ->  | AE62: =RC[-28] ->  | AF62: =RC[-28] ->  | AG62: =RC[-28] ->  | AH62: =RC[-28] ->  | AI62: =RC[-28] ->  | AJ62: =RC[-28] ->  | AK62: =RC[-28] ->  | AL62: =RC[-28] -> 0 | AM62: =RC[-28] ->  | AN62: =RC[-28] ->  | AO62: =RC[-28] ->  | AP62: - | AQ62: =RC[-29] -> 0 | AR62: =RC[-29] -> 0 | AS62: - | AT62: =RC[-30] -> 0 | AU62: =RC[-30] -> 0 | AV62: =RC[-30] ->  | AW62: =RC[-30] -> 
A63: =IF(RC[1]="","",DATEVALUE(RC[1])) ->  | T63: =(RC[-16]*RC[-15]-RC[-13]*RC[-12])/1000 -> #VALUE! | W63: =RC[-2]*RC[-10]/1000 -> #VALUE! | X63: =ABS((RC[-3]*RC[-11]-RC[-2]*RC[-9])/1000) -> #VALUE! | Y63: =(RC[-14]-RC[1])/RC[-18]*100 -> #VALUE! | AC63: =VALUE(RC[-27]) -> #VALUE! | AD63: =IF(RC[21]=42,"*",IF(RC[21]=32,"",RC[21])) ->  | AE63: =RC[-28] ->  | AF63: =RC[-28] ->  | AG63: =RC[-28] ->  | AH63: =RC[-28] ->  | AI63: =RC[-28] ->  | AJ63: =RC[-28] ->  | AK63: =RC[-28] ->  | AL63: =RC[-28] -> 0 | AM63: =RC[-28] ->  | AN63: =RC[-28] ->  | AO63: =RC[-28] ->  | AP63: - | AQ63: =RC[-29] -> 0 | AR63: =RC[-29] -> 0 | AS63: - | AT63: =RC[-30] -> 0 | AU63: =RC[-30] -> 0 | AV63: =RC[-30] ->  | AW63: =RC[-30] -> 
A64: =IF(RC[1]="","",DATEVALUE(RC[1])) ->  | T64: =(RC[-16]*RC[-15]-RC[-13]*RC[-12])/1000 -> #VALUE! | W64: =RC[-2]*RC[-10]/1000 -> #VALUE! | X64: =ABS((RC[-3]*RC[-11]-RC[-2]*RC[-9])/1000) -> #VALUE! | Y64: =(RC[-14]-RC[1])/RC[-18]*100 -> #VALUE! | AC64: =VALUE(RC[-27]) -> #VALUE! | AD64: =IF(RC[21]=42,"*",IF(RC[21]=32,"",RC[21])) ->  | AE64: =RC[-28] ->  | AF64: =RC[-28] ->  | AG64: =RC[-28] ->  | AH64: =RC[-28] ->  | AI64: =RC[-28] ->  | AJ64: =RC[-28] ->  | AK64: =RC[-28] ->  | AL64: =RC[-28] -> 0 | AM64: =RC[-28] ->  | AN64: =RC[-28] ->  | AO64: =RC[-28] ->  | AP64: - | AQ64: =RC[-29] -> 0 | AR64: =RC[-29] -> 0 | AS64: - | AT64: =RC[-30] -> 0 | AU64: =RC[-30] -> 0 | AV64: =RC[-30] ->  | AW64: =RC[-30] -> 
A65: =IF(RC[1]="","",DATEVALUE(RC[1])) ->  | T65: =(RC[-16]*RC[-15]-RC[-13]*RC[-12])/1000 -> #VALUE! | W65: =RC[-2]*RC[-10]/1000 -> #VALUE! | X65: =ABS((RC[-3]*RC[-11]-RC[-2]*RC[-9])/1000) -> #VALUE! | Y65: =(RC[-14]-RC[1])/RC[-18]*100 -> #VALUE! | AC65: =VALUE(RC[-27]) -> #VALUE! | AD65: =IF(RC[21]=42,"*",IF(RC[21]=32,"",RC[21])) ->  | AE65: =RC[-28] ->  | AF65: =RC[-28] ->  | AG65: =RC[-28] ->  | AH65: =RC[-28] ->  | AI65: =RC[-28] ->  | AJ65: =RC[-28] ->  | AK65: =RC[-28] ->  | AL65: =RC[-28] -> 0 | AM65: =RC[-28] ->  | AN65: =RC[-28] ->  | AO65: =RC[-28] ->  | AP65: - | AQ65: =RC[-29] -> 0 | AR65: =RC[-29] -> 0 | AS65: - | AT65: =RC[-30] -> 0 | AU65: =RC[-30] -> 0 | AV65: =RC[-30] ->  | AW65: =RC[-30] -> 
A66: =IF(RC[1]="","",DATEVALUE(RC[1])) ->  | T66: =(RC[-16]*RC[-15]-RC[-13]*RC[-12])/1000 -> #VALUE! | W66: =RC[-2]*RC[-10]/1000 -> #VALUE! | X66: =ABS((RC[-3]*RC[-11]-RC[-2]*RC[-9])/1000) -> #VALUE! | Y66: =(RC[-14]-RC[1])/RC[-18]*100 -> #VALUE! | AC66: =VALUE(RC[-27]) -> #VALUE! | AD66: =IF(RC[21]=42,"*",IF(RC[21]=32,"",RC[21])) ->  | AE66: =RC[-28] ->  | AF66: =RC[-28] ->  | AG66: =RC[-28] ->  | AH66: =RC[-28] ->  | AI66: =RC[-28] ->  | AJ66: =RC[-28] ->  | AK66: =RC[-28] ->  | AL66: =RC[-28] -> 0 | AM66: =RC[-28] ->  | AN66: =RC[-28] ->  | AO66: =RC[-28] ->  | AP66: - | AQ66: =RC[-29] -> 0 | AR66: =RC[-29] -> 0 | AS66: - | AT66: =RC[-30] -> 0 | AU66: =RC[-30] -> 0 | AV66: =RC[-30] ->  | AW66: =RC[-30] -> 
A67: =IF(RC[1]="","",DATEVALUE(RC[1])) ->  | T67: =(RC[-16]*RC[-15]-RC[-13]*RC[-12])/1000 -> #VALUE! | W67: =RC[-2]*RC[-10]/1000 -> #VALUE! | X67: =ABS((RC[-3]*RC[-11]-RC[-2]*RC[-9])/1000) -> #VALUE! | Y67: =(RC[-14]-RC[1])/RC[-18]*100 -> #VALUE! | AC67: =VALUE(RC[-27]) -> #VALUE! | AD67: =IF(RC[21]=42,"*",IF(RC[21]=32,"",RC[21])) ->  | AE67: =RC[-28] ->  | AF67: =RC[-28] ->  | AG67: =RC[-28] ->  | AH67: =RC[-28] ->  | AI67: =RC[-28] ->  | AJ67: =RC[-28] ->  | AK67: =RC[-28] ->  | AL67: =RC[-28] -> 0 | AM67: =RC[-28] ->  | AN67: =RC[-28] ->  | AO67: =RC[-28] ->  | AP67: - | AQ67: =RC[-29] -> 0 | AR67: =RC[-29] -> 0 | AS67: - | AT67: =RC[-30] -> 0 | AU67: =RC[-30] -> 0 | AV67: =RC[-30] ->  | AW67: =RC[-30] -> 
A68: =IF(RC[1]="","",DATEVALUE(RC[1])) ->  | T68: =(RC[-16]*RC[-15]-RC[-13]*RC[-12])/1000 -> #VALUE! | W68: =RC[-2]*RC[-10]/1000 -> #VALUE! | X68: =ABS((RC[-3]*RC[-11]-RC[-2]*RC[-9])/1000) -> #VALUE! | Y68: =(RC[-14]-RC[1])/RC[-18]*100 -> #VALUE! | AC68: =VALUE(RC[-27]) -> #VALUE! | AD68: =IF(RC[21]=42,"*",IF(RC[21]=32,"",RC[21])) ->  | AE68: =RC[-28] ->  | AF68: =RC[-28] ->  | AG68: =RC[-28] ->  | AH68: =RC[-28] ->  | AI68: =RC[-28] ->  | AJ68: =RC[-28] ->  | AK68: =RC[-28] ->  | AL68: =RC[-28] -> 0 | AM68: =RC[-28] ->  | AN68: =RC[-28] ->  | AO68: =RC[-28] ->  | AP68: - | AQ68: =RC[-29] -> 0 | AR68: =RC[-29] -> 0 | AS68: - | AT68: =RC[-30] -> 0 | AU68: =RC[-30] -> 0 | AV68: =RC[-30] ->  | AW68: =RC[-30] -> 
A69: =IF(RC[1]="","",DATEVALUE(RC[1])) ->  | T69: =(RC[-16]*RC[-15]-RC[-13]*RC[-12])/1000 -> #VALUE! | W69: =RC[-2]*RC[-10]/1000 -> #VALUE! | X69: =ABS((RC[-3]*RC[-11]-RC[-2]*RC[-9])/1000) -> #VALUE! | Y69: =(RC[-14]-RC[1])/RC[-18]*100 -> #VALUE! | AC69: =VALUE(RC[-27]) -> #VALUE! | AD69: =IF(RC[21]=42,"*",IF(RC[21]=32,"",RC[21])) ->  | AE69: =RC[-28] ->  | AF69: =RC[-28] ->  | AG69: =RC[-28] ->  | AH69: =RC[-28] ->  | AI69: =RC[-28] ->  | AJ69: =RC[-28] ->  | AK69: =RC[-28] ->  | AL69: =RC[-28] -> 0 | AM69: =RC[-28] ->  | AN69: =RC[-28] ->  | AO69: =RC[-28] ->  | AP69: - | AQ69: =RC[-29] -> 0 | AR69: =RC[-29] -> 0 | AS69: - | AT69: =RC[-30] -> 0 | AU69: =RC[-30] -> 0 | AV69: =RC[-30] ->  | AW69: =RC[-30] -> 
A70: =IF(RC[1]="","",DATEVALUE(RC[1])) ->  | T70: =(RC[-16]*RC[-15]-RC[-13]*RC[-12])/1000 -> #VALUE! | W70: =RC[-2]*RC[-10]/1000 -> #VALUE! | X70: =ABS((RC[-3]*RC[-11]-RC[-2]*RC[-9])/1000) -> #VALUE! | Y70: =(RC[-14]-RC[1])/RC[-18]*100 -> #VALUE! | AC70: =VALUE(RC[-27]) -> #VALUE! | AD70: =IF(RC[21]=42,"*",IF(RC[21]=32,"",RC[21])) ->  | AE70: =RC[-28] ->  | AF70: =RC[-28] ->  | AG70: =RC[-28] ->  | AH70: =RC[-28] ->  | AI70: =RC[-28] ->  | AJ70: =RC[-28] ->  | AK70: =RC[-28] ->  | AL70: =RC[-28] -> 0 | AM70: =RC[-28] ->  | AN70: =RC[-28] ->  | AO70: =RC[-28] ->  | AP70: - | AQ70: =RC[-29] -> 0 | AR70: =RC[-29] -> 0 | AS70: - | AT70: =RC[-30] -> 0 | AU70: =RC[-30] -> 0 | AV70: =RC[-30] ->  | AW70: =RC[-30] -> 
A71: =IF(RC[1]="","",DATEVALUE(RC[1])) ->  | T71: =(RC[-16]*RC[-15]-RC[-13]*RC[-12])/1000 -> #VALUE! | W71: =RC[-2]*RC[-10]/1000 -> #VALUE! | X71: =ABS((RC[-3]*RC[-11]-RC[-2]*RC[-9])/1000) -> #VALUE! | Y71: =(RC[-14]-RC[1])/RC[-18]*100 -> #VALUE! | AC71: =VALUE(RC[-27]) -> #VALUE! | AD71: =IF(RC[21]=42,"*",IF(RC[21]=32,"",RC[21])) ->  | AE71: =RC[-28] ->  | AF71: =RC[-28] ->  | AG71: =RC[-28] ->  | AH71: =RC[-28] ->  | AI71: =RC[-28] ->  | AJ71: =RC[-28] ->  | AK71: =RC[-28] ->  | AL71: =RC[-28] -> 0 | AM71: =RC[-28] ->  | AN71: =RC[-28] ->  | AO71: =RC[-28] ->  | AP71: - | AQ71: =RC[-29] -> 0 | AR71: =RC[-29] -> 0 | AS71: - | AT71: =RC[-30] -> 0 | AU71: =RC[-30] -> 0 | AV71: =RC[-30] ->  | AW71: =RC[-30] -> 
A72: =IF(RC[1]="","",DATEVALUE(RC[1])) ->  | T72: =(RC[-16]*RC[-15]-RC[-13]*RC[-12])/1000 -> #VALUE! | W72: =RC[-2]*RC[-10]/1000 -> #VALUE! | X72: =ABS((RC[-3]*RC[-11]-RC[-2]*RC[-9])/1000) -> #VALUE! | Y72: =(RC[-14]-RC[1])/RC[-18]*100 -> #VALUE! | AC72: =VALUE(RC[-27]) -> #VALUE! | AD72: =IF(RC[21]=42,"*",IF(RC[21]=32,"",RC[21])) ->  | AE72: =RC[-28] ->  | AF72: =RC[-28] ->  | AG72: =RC[-28] ->  | AH72: =RC[-28] ->  | AI72: =RC[-28] ->  | AJ72: =RC[-28] ->  | AK72: =RC[-28] ->  | AL72: =RC[-28] -> 0 | AM72: =RC[-28] ->  | AN72: =RC[-28] ->  | AO72: =RC[-28] ->  | AP72: - | AQ72: =RC[-29] -> 0 | AR72: =RC[-29] -> 0 | AS72: - | AT72: =RC[-30] -> 0 | AU72: =RC[-30] -> 0 | AV72: =RC[-30] ->  | AW72: =RC[-30] -> 
A73: =IF(RC[1]="","",DATEVALUE(RC[1])) ->  | T73: =(RC[-16]*RC[-15]-RC[-13]*RC[-12])/1000 -> #VALUE! | W73: =RC[-2]*RC[-10]/1000 -> #VALUE! | X73: =ABS((RC[-3]*RC[-11]-RC[-2]*RC[-9])/1000) -> #VALUE! | Y73: =(RC[-14]-RC[1])/RC[-18]*100 -> #VALUE! | AC73: =VALUE(RC[-27]) -> #VALUE! | AD73: =IF(RC[21]=42,"*",IF(RC[21]=32,"",RC[21])) ->  | AE73: =RC[-28] ->  | AF73: =RC[-28] ->  | AG73: =RC[-28] ->  | AH73: =RC[-28] ->  | AI73: =RC[-28] ->  | AJ73: =RC[-28] ->  | AK73: =RC[-28] ->  | AL73: =RC[-28] -> 0 | AM73: =RC[-28] ->  | AN73: =RC[-28] ->  | AO73: =RC[-28] ->  | AP73: - | AQ73: =RC[-29] -> 0 | AR73: =RC[-29] -> 0 | AS73: - | AT73: =RC[-30] -> 0 | AU73: =RC[-30] -> 0 | AV73: =RC[-30] ->  | AW73: =RC[-30] -> 
A74: =IF(RC[1]="","",DATEVALUE(RC[1])) ->  | T74: =(RC[-16]*RC[-15]-RC[-13]*RC[-12])/1000 -> #VALUE! | W74: =RC[-2]*RC[-10]/1000 -> #VALUE! | X74: =ABS((RC[-3]*RC[-11]-RC[-2]*RC[-9])/1000) -> #VALUE! | Y74: =(RC[-14]-RC[1])/RC[-18]*100 -> #VALUE! | AC74: =VALUE(RC[-27]) -> #VALUE! | AD74: =IF(RC[21]=42,"*",IF(RC[21]=32,"",RC[21])) ->  | AE74: =RC[-28] ->  | AF74: =RC[-28] ->  | AG74: =RC[-28] ->  | AH74: =RC[-28] ->  | AI74: =RC[-28] ->  | AJ74: =RC[-28] ->  | AK74: =RC[-28] ->  | AL74: =RC[-28] -> 0 | AM74: =RC[-28] ->  | AN74: =RC[-28] ->  | AO74: =RC[-28] ->  | AP74: - | AQ74: =RC[-29] -> 0 | AR74: =RC[-29] -> 0 | AS74: - | AT74: =RC[-30] -> 0 | AU74: =RC[-30] -> 0 | AV74: =RC[-30] ->  | AW74: =RC[-30] -> 
A75: =IF(RC[1]="","",DATEVALUE(RC[1])) ->  | T75: =(RC[-16]*RC[-15]-RC[-13]*RC[-12])/1000 -> #VALUE! | W75: =RC[-2]*RC[-10]/1000 -> #VALUE! | X75: =ABS((RC[-3]*RC[-11]-RC[-2]*RC[-9])/1000) -> #VALUE! | Y75: =(RC[-14]-RC[1])/RC[-18]*100 -> #VALUE! | AC75: =VALUE(RC[-27]) -> #VALUE! | AD75: =IF(RC[21]=42,"*",IF(RC[21]=32,"",RC[21])) ->  | AE75: =RC[-28] ->  | AF75: =RC[-28] ->  | AG75: =RC[-28] ->  | AH75: =RC[-28] ->  | AI75: =RC[-28] ->  | AJ75: =RC[-28] ->  | AK75: =RC[-28] ->  | AL75: =RC[-28] -> 0 | AM75: =RC[-28] ->  | AN75: =RC[-28] ->  | AO75: =RC[-28] ->  | AP75: - | AQ75: =RC[-29] -> 0 | AR75: =RC[-29] -> 0 | AS75: - | AT75: =RC[-30] -> 0 | AU75: =RC[-30] -> 0 | AV75: =RC[-30] ->  | AW75: =RC[-30] -> 
A76: =IF(RC[1]="","",DATEVALUE(RC[1])) ->  | T76: =(RC[-16]*RC[-15]-RC[-13]*RC[-12])/1000 -> #VALUE! | W76: =RC[-2]*RC[-10]/1000 -> #VALUE! | X76: =ABS((RC[-3]*RC[-11]-RC[-2]*RC[-9])/1000) -> #VALUE! | Y76: =(RC[-14]-RC[1])/RC[-18]*100 -> #VALUE! | AC76: =VALUE(RC[-27]) -> #VALUE! | AD76: =IF(RC[21]=42,"*",IF(RC[21]=32,"",RC[21])) ->  | AE76: =RC[-28] ->  | AF76: =RC[-28] ->  | AG76: =RC[-28] ->  | AH76: =RC[-28] ->  | AI76: =RC[-28] ->  | AJ76: =RC[-28] ->  | AK76: =RC[-28] ->  | AL76: =RC[-28] -> 0 | AM76: =RC[-28] ->  | AN76: =RC[-28] ->  | AO76: =RC[-28] ->  | AP76: - | AQ76: =RC[-29] -> 0 | AR76: =RC[-29] -> 0 | AS76: - | AT76: =RC[-30] -> 0 | AU76: =RC[-30] -> 0 | AV76: =RC[-30] ->  | AW76: =RC[-30] -> 
A77: =IF(RC[1]="","",DATEVALUE(RC[1])) ->  | T77: =(RC[-16]*RC[-15]-RC[-13]*RC[-12])/1000 -> #VALUE! | W77: =RC[-2]*RC[-10]/1000 -> #VALUE! | X77: =ABS((RC[-3]*RC[-11]-RC[-2]*RC[-9])/1000) -> #VALUE! | Y77: =(RC[-14]-RC[1])/RC[-18]*100 -> #VALUE! | AC77: =VALUE(RC[-27]) -> #VALUE! | AD77: =IF(RC[21]=42,"*",IF(RC[21]=32,"",RC[21])) ->  | AE77: =RC[-28] ->  | AF77: =RC[-28] ->  | AG77: =RC[-28] ->  | AH77: =RC[-28] ->  | AI77: =RC[-28] ->  | AJ77: =RC[-28] ->  | AK77: =RC[-28] ->  | AL77: =RC[-28] -> 0 | AM77: =RC[-28] ->  | AN77: =RC[-28] ->  | AO77: =RC[-28] ->  | AP77: - | AQ77: =RC[-29] -> 0 | AR77: =RC[-29] -> 0 | AS77: - | AT77: =RC[-30] -> 0 | AU77: =RC[-30] -> 0 | AV77: =RC[-30] ->  | AW77: =RC[-30] -> 
A78: =IF(RC[1]="","",DATEVALUE(RC[1])) ->  | T78: =(RC[-16]*RC[-15]-RC[-13]*RC[-12])/1000 -> #VALUE! | W78: =RC[-2]*RC[-10]/1000 -> #VALUE! | X78: =ABS((RC[-3]*RC[-11]-RC[-2]*RC[-9])/1000) -> #VALUE! | Y78: =(RC[-14]-RC[1])/RC[-18]*100 -> #VALUE! | AC78: =VALUE(RC[-27]) -> #VALUE! | AD78: =IF(RC[21]=42,"*",IF(RC[21]=32,"",RC[21])) ->  | AE78: =RC[-28] ->  | AF78: =RC[-28] ->  | AG78: =RC[-28] ->  | AH78: =RC[-28] ->  | AI78: =RC[-28] ->  | AJ78: =RC[-28] ->  | AK78: =RC[-28] ->  | AL78: =RC[-28] -> 0 | AM78: =RC[-28] ->  | AN78: =RC[-28] ->  | AO78: =RC[-28] ->  | AP78: - | AQ78: =RC[-29] -> 0 | AR78: =RC[-29] -> 0 | AS78: - | AT78: =RC[-30] -> 0 | AU78: =RC[-30] -> 0 | AV78: =RC[-30] ->  | AW78: =RC[-30] -> 
A79: =IF(RC[1]="","",DATEVALUE(RC[1])) ->  | T79: =(RC[-16]*RC[-15]-RC[-13]*RC[-12])/1000 -> #VALUE! | W79: =RC[-2]*RC[-10]/1000 -> #VALUE! | X79: =ABS((RC[-3]*RC[-11]-RC[-2]*RC[-9])/1000) -> #VALUE! | Y79: =(RC[-14]-RC[1])/RC[-18]*100 -> #VALUE! | AC79: =VALUE(RC[-27]) -> #VALUE! | AD79: =IF(RC[21]=42,"*",IF(RC[21]=32,"",RC[21])) ->  | AE79: =RC[-28] ->  | AF79: =RC[-28] ->  | AG79: =RC[-28] ->  | AH79: =RC[-28] ->  | AI79: =RC[-28] ->  | AJ79: =RC[-28] ->  | AK79: =RC[-28] ->  | AL79: =RC[-28] -> 0 | AM79: =RC[-28] ->  | AN79: =RC[-28] ->  | AO79: =RC[-28] ->  | AP79: - | AQ79: =RC[-29] -> 0 | AR79: =RC[-29] -> 0 | AS79: - | AT79: =RC[-30] -> 0 | AU79: =RC[-30] -> 0 | AV79: =RC[-30] ->  | AW79: =RC[-30] -> 
A80: =IF(RC[1]="","",DATEVALUE(RC[1])) ->  | T80: =(RC[-16]*RC[-15]-RC[-13]*RC[-12])/1000 -> #VALUE! | W80: =RC[-2]*RC[-10]/1000 -> #VALUE! | X80: =ABS((RC[-3]*RC[-11]-RC[-2]*RC[-9])/1000) -> #VALUE! | Y80: =(RC[-14]-RC[1])/RC[-18]*100 -> #VALUE! | AC80: =VALUE(RC[-27]) -> #VALUE! | AD80: =IF(RC[21]=42,"*",IF(RC[21]=32,"",RC[21])) ->  | AE80: =RC[-28] ->  | AF80: =RC[-28] ->  | AG80: =RC[-28] ->  | AH80: =RC[-28] ->  | AI80: =RC[-28] ->  | AJ80: =RC[-28] ->  | AK80: =RC[-28] ->  | AL80: =RC[-28] -> 0 | AM80: =RC[-28] ->  | AN80: =RC[-28] ->  | AO80: =RC[-28] ->  | AP80: - | AQ80: =RC[-29] -> 0 | AR80: =RC[-29] -> 0 | AS80: - | AT80: =RC[-30] -> 0 | AU80: =RC[-30] -> 0 | AV80: =RC[-30] ->  | AW80: =RC[-30] -> 
A81: =IF(RC[1]="","",DATEVALUE(RC[1])) ->  | T81: =(RC[-16]*RC[-15]-RC[-13]*RC[-12])/1000 -> #VALUE! | W81: =RC[-2]*RC[-10]/1000 -> #VALUE! | X81: =ABS((RC[-3]*RC[-11]-RC[-2]*RC[-9])/1000) -> #VALUE! | Y81: =(RC[-14]-RC[1])/RC[-18]*100 -> #VALUE! | AC81: =VALUE(RC[-27]) -> #VALUE! | AD81: =IF(RC[21]=42,"*",IF(RC[21]=32,"",RC[21])) ->  | AE81: =RC[-28] ->  | AF81: =RC[-28] ->  | AG81: =RC[-28] ->  | AH81: =RC[-28] ->  | AI81: =RC[-28] ->  | AJ81: =RC[-28] ->  | AK81: =RC[-28] ->  | AL81: =RC[-28] -> 0 | AM81: =RC[-28] ->  | AN81: =RC[-28] ->  | AO81: =RC[-28] ->  | AP81: - | AQ81: =RC[-29] -> 0 | AR81: =RC[-29] -> 0 | AS81: - | AT81: =RC[-30] -> 0 | AU81: =RC[-30] -> 0 | AV81: =RC[-30] ->  | AW81: =RC[-30] -> 
A82: =IF(RC[1]="","",DATEVALUE(RC[1])) ->  | T82: =(RC[-16]*RC[-15]-RC[-13]*RC[-12])/1000 -> #VALUE! | W82: =RC[-2]*RC[-10]/1000 -> #VALUE! | X82: =ABS((RC[-3]*RC[-11]-RC[-2]*RC[-9])/1000) -> #VALUE! | Y82: =(RC[-14]-RC[1])/RC[-18]*100 -> #VALUE! | AC82: =VALUE(RC[-27]) -> #VALUE! | AD82: =IF(RC[21]=42,"*",IF(RC[21]=32,"",RC[21])) ->  | AE82: =RC[-28] ->  | AF82: =RC[-28] ->  | AG82: =RC[-28] ->  | AH82: =RC[-28] ->  | AI82: =RC[-28] ->  | AJ82: =RC[-28] ->  | AK82: =RC[-28] ->  | AL82: =RC[-28] -> 0 | AM82: =RC[-28] ->  | AN82: =RC[-28] ->  | AO82: =RC[-28] ->  | AP82: - | AQ82: =RC[-29] -> 0 | AR82: =RC[-29] -> 0 | AS82: - | AT82: =RC[-30] -> 0 | AU82: =RC[-30] -> 0 | AV82: =RC[-30] ->  | AW82: =RC[-30] -> 
A83: =IF(RC[1]="","",DATEVALUE(RC[1])) ->  | T83: =(RC[-16]*RC[-15]-RC[-13]*RC[-12])/1000 -> #VALUE! | W83: =RC[-2]*RC[-10]/1000 -> #VALUE! | X83: =ABS((RC[-3]*RC[-11]-RC[-2]*RC[-9])/1000) -> #VALUE! | Y83: =(RC[-14]-RC[1])/RC[-18]*100 -> #VALUE! | AC83: =VALUE(RC[-27]) -> #VALUE! | AD83: =IF(RC[21]=42,"*",IF(RC[21]=32,"",RC[21])) ->  | AE83: =RC[-28] ->  | AF83: =RC[-28] ->  | AG83: =RC[-28] ->  | AH83: =RC[-28] ->  | AI83: =RC[-28] ->  | AJ83: =RC[-28] ->  | AK83: =RC[-28] ->  | AL83: =RC[-28] -> 0 | AM83: =RC[-28] ->  | AN83: =RC[-28] ->  | AO83: =RC[-28] ->  | AP83: - | AQ83: =RC[-29] -> 0 | AR83: =RC[-29] -> 0 | AS83: - | AT83: =RC[-30] -> 0 | AU83: =RC[-30] -> 0 | AV83: =RC[-30] ->  | AW83: =RC[-30] -> 
AC84: Среднее | AF84: =R[1]C[-28] -> 127.29525833166663 | AG84: =R[1]C[-28] -> 68.915333333333351 | AH84: =R[1]C[-28] -> 16.91198739349467 | AI84: =R[1]C[-28] -> 112.55994008366669 | AJ84: =R[1]C[-28] -> 50.054666666666662 | AK84: =R[1]C[-28] -> 5.706455130306666 | AL84: =R[1]C[-28] -> 18.860666666666667 | AM84: =R[1]C[-28] -> 14.735318248000002 | AN84: =R[1]C[-28] -> 16.255271911000001 | AO84: =R[1]C[-28] -> 68.176333333333346 | AP84: - | AQ84: =R[1]C[-29] -> 0 | AR84: =R[1]C[-29] -> 0 | AS84: - | AT84: =R[1]C[-30] -> 0 | AU84: =R[1]C[-30] -> 0
B85: Среднее | D85: =AVERAGE(OFFSET(R[-74]C,3,0,R7C1,1)) -> 127.29525833166663 | E85: =AVERAGE(OFFSET(R[-74]C,3,0,R7C1,1)) -> 68.915333333333351 | F85: =AVERAGE(OFFSET(R[-74]C,3,0,R7C1,1)) -> 16.91198739349467 | G85: =AVERAGE(OFFSET(R[-74]C,3,0,R7C1,1)) -> 112.55994008366669 | H85: =AVERAGE(OFFSET(R[-74]C,3,0,R7C1,1)) -> 50.054666666666662 | I85: =AVERAGE(OFFSET(R[-74]C,3,0,R7C1,1)) -> 5.706455130306666 | J85: =AVERAGE(OFFSET(R[-74]C,3,0,R7C1,1)) -> 18.860666666666667 | K85: =AVERAGE(OFFSET(R[-74]C,3,0,R7C1,1)) -> 14.735318248000002 | L85: =IF(SUM(OFFSET(R[-74]C,3,0,R7C1,1))=0,"",AVERAGE(OFFSET(R[-74]C,3,0,R7C1,1))) -> 16.255271911000001 | M85: =IF(SUM(OFFSET(R[-74]C,3,0,R7C1,1))=0,"",AVERAGE(OFFSET(R[-74]C,3,0,R7C1,1))) -> 68.176333333333346 | R85: =IF(SUM(OFFSET(R[-74]C,3,0,R7C1,1))=0,"",AVERAGE(OFFSET(R[-74]C,3,0,R7C1,1))) -> 1.0922513059297472 | S85: =AVERAGE(OFFSET(R[-74]C,3,0,R7C1,1)) -> 3.269279894668959 | T85: =AVERAGE(OFFSET(R[-74]C,3,0,R7C1,1)) -> 3.2515447449283763 | W85: =AVERAGE(OFFSET(R[-74]C,3,0,R7C1,1)) -> 1.0839540871877633 | X85: =AVERAGE(OFFSET(R[-74]C,3,0,R7C1,1)) -> #VALUE! | AC85: Итого | AE85: =R[1]C[-28] -> 720 | AF85: =R[1]C[-28] -> 3818.8577499499988 | AI85: =R[1]C[-28] -> 3376.7982025100005 | AM85: =R[1]C[-28] -> 442.05954744000007 | AN85: =R[1]C[-28] -> 487.65815733000005 | AQ85: =R[1]C[-29] -> 0 | AU85: =R[1]C[-30] -> 0 | AV85: =R[1]C[-30] -> 32.767539177892417 | AW85: =R[1]C[-30] -> 98.078396840068763
B86: ИТОГО: | C86: =SUM(OFFSET(R[-75]C,3,0,R7C1,1)) -> 720 | D86: =SUM(OFFSET(R[-75]C,3,0,R7C1,1)) -> 3818.8577499499988 | G86: =SUM(OFFSET(R[-75]C,3,0,R7C1,1)) -> 3376.7982025100005 | K86: =SUM(OFFSET(R[-75]C,3,0,R7C1,1)) -> 442.05954744000007 | L86: =IF(SUM(OFFSET(R[-75]C,3,0,R7C1,1))=0,"",SUM(OFFSET(R[-75]C,3,0,R7C1,1))) -> 487.65815733000005 | R86: =IF(SUM(OFFSET(R[-75]C,3,0,R7C1,1))=0,"",SUM(OFFSET(R[-75]C,3,0,R7C1,1))) -> 32.767539177892417 | S86: =SUM(OFFSET(R[-75]C,3,0,R7C1,1)) -> 98.078396840068763 | T86: =SUM(OFFSET(R[-75]C,3,0,R7C1,1)) -> 97.546342347851294 | W86: =SUM(OFFSET(R[-75]C,3,0,R7C1,1)) -> 32.5186226156329 | X86: =SUM(OFFSET(R[-75]C,3,0,R7C1,1)) -> #VALUE!
AC87: Досчёт | AF87: =R[1]C[-28] -> 0 | AI87: =R[1]C[-28] -> 0 | AM87: =R[1]C[-28] -> 0 | AN87: =R[1]C[-28] -> 0 | AQ87: =R[1]C[-29] -> 0 | AU87: =R[1]C[-30] -> 0 | AV87: =R[1]C[-30] -> 0 | AW87: =R[1]C[-30] -> 0
A88: 11дн=264ч 4дн=96ч | B88: Досчёт до конца м-ца (+) | C88: =R6C1*24 -> 216 | T88: № B019 | AC88: Снятие | AF88: =-R[1]C[-28] -> 0 | AI88: =-R[1]C[-28] -> 0 | AM88: =-R[1]C[-28] -> 0 | AN88: =-R[1]C[-28] -> 0 | AQ88: =-R[1]C[-29] -> 0 | AU88: =-R[1]C[-30] -> 0 | AV88: =-R[1]C[-30] -> 0 | AW88: =-R[1]C[-30] -> 0
A89: 9дн=216ч 7дн=168ч | B89: Вычет с предыдущего (-) | C89: =R4C1*24 -> 192 | AC89: Сумма | AF89: =R[1]C[-28] -> 3818.8577499499988 | AI89: =R[1]C[-28] -> 3376.7982025100005 | AM89: =R[1]C[-28] -> 442.05954744000007 | AN89: =R[1]C[-28] -> 487.65815733000005 | AQ89: =R[1]C[-29] -> 0 | AU89: =R[1]C[-30] -> 0 | AV89: =R[1]C[-30] -> 32.767539177892417 | AW89: =R[1]C[-30] -> 98.078396840068763
B90: СУММА: | C90: =R[-4]C+R[-2]C-R[-1]C -> 744 | D90: =R[-4]C+R[-2]C-R[-1]C -> 3818.8577499499988 | G90: =R[-4]C+R[-2]C-R[-1]C -> 3376.7982025100005 | K90: =R[-4]C+R[-2]C-R[-1]C -> 442.05954744000007 | L90: =IF(SUM(OFFSET(R[-79]C,3,0,R7C1,1))=0,"",(R[-4]C+R[-2]C-R[-1]C)) -> 487.65815733000005 | R90: =IF(SUM(OFFSET(R[-79]C,3,0,R7C1,1))=0,"",(R[-4]C+R[-2]C-R[-1]C)) -> 32.767539177892417 | S90: =R[-4]C+R[-2]C-R[-1]C -> 98.078396840068763
AC91: Тхв на источнике | AE91: V гвс (м3) | AF91: =R[-2]C[15] -> 0 | AG91: W гвс (Гкал) | AH91: =RC[-2]*0.06 -> 0 | AI91: W без гвс (Гкал) | AJ91: =R[-2]C[13]-RC[-2] -> 98.078396840068763
B92: Показания счетчиков на момент снятия данных:
B93: Дата, время | D93: М1, т | F93: М2, т | H93: М3, т | J93: М4, т | L93: Qо, Гкал | N93: Qг, Гкал | P93: время, час
B94: 23.09.18 07:39 | D94: 80215.5625 | F94: 67701.953125 | H94: 21552.10546875 | J94: - | L94: 2584.6755353133699 | N94: 1594.2841144716699 | P94: -
B95: 18.10.18 02:00 | D95: 83326.65625 | F95: 70443.4765625 | H95: 21950.017578129999 | J95: - | L95: 2663.87137663371 | N95: 1621.4644976091499 | P95: -
AC97: =ZAYAVKA_N -> з.н д. №02/147-2783 от 04.10.18
B98: Представитель потребителя:_______________________________________________________________________ В.О. Топорков
I101: Рекомендуемые значения по параметрам теплопотребления (не являются официально утверждёнными)
I102: М, т | J102: V, м3 | K102: Qгвс, Гкал | L102: Qотоп, Гкал | M102: Qо, Гкал
I103: =R[-13]C[-3] -> 0 | J103: =RC[-1]/0.98 -> 0 | K103: =RC[-1]*0.06 -> 0 | L103: =RC[1]-RC[-1] -> 32.767539177892417 | M103: =R[-13]C[5] -> 32.767539177892417
O105: ДЛЯ САМОКОНТРОЛЯ
B106: В строке выбора дат указать период с 16.7.13 по 23.8.13 - жильё | N106: Q | O106: Qг
B107: В строке выбора дат указать период с 18.7.13 по 25.8.13 - не жилое | N107: =(R[-21]C[-10]*R[-22]C[-7]-R[-21]C[-9]*R[-22]C[-6])/1000 -> 429.85039952241806 | O107: =IF(R[-22]C[-2]="",R[-21]C[-3]*R[-22]C/1000,"") ->  | P107: Си2
O108: =IF(R[-23]C[-2]="","",((R[-22]C[-3]*R[-23]C)-(R[-22]C[-2]*R[-23]C[2]))/1000) -> 0 | P108: Си3