Sheet: Лист1
G1: Отчёт о теплопотреблении за октябрь 2018 | M1: з.н д. №02/147-2783 от 04.10.18 с 27.09.18г по 02.10.18г некорректная работа приборов
A4: =EOMONTH(R[9]C,0)-R[9]C -> 8 | B4: Потребитель: ЗАО "Сити Сервис"
A5: =MAX(R[9]C:R[78]C) -> 2018-10-22T00:00:00.000 | B5: Адрес: г. СПб, Кима пр., д.26, лит.А Отопление
A6: =EOMONTH(R[-1]C,0)-R[-1]C -> 9 | B6: Телефон: 8-911-021-19-79
A7: =R[-2]C-R[6]C -> 30 | B7: Договор 10023-3 (.) 337, 342-344, 347
A8: 7 | B8: Тепловычислитель: СПТ-941 № 26955 | L8: М2 мах= | M8: 87.36 | O8: Мгвс мах= | P8: 0
L9: Qотоп мах= | M9: 6.96 | O9: Qгвс мах= | P9: 0
B10: Расчётная формула: Q=M1*(h1-hхв)-M2*(h2-hхв)
D12: Учет | L12: Контроль
A13: =R[1]C[1]-1 -> 2018-09-22T00:00:00.000 | B13: Дата | C13: N, ч | D13: M1, т | E13: T1, С | F13: P1, кг/см2 | G13: M2, т | H13: T2, С | I13: P2, кг/см2 | J13: dT, С | K13: M1-М2, т | L13: V3, м3 | M13: T3, С | N13: V4, м3 | O13: =IF(R[-12]C[-14]="м.куб","","T4, С") -> T4, С | P13: dT, С | Q13: V3-V4, м3 | R13: Qгвс, Гкал | S13: Qобщ., Гкал | T13: Q | U13: M3 | V13: M4 | W13: си2 | X13: си3 | Y13: Разб. | Z13: dM2 | AC13: Дата | AD13: НС | AE13: n, ч | AF13: М1, т | AG13: t1, гр. С | AH13: Р1, кгс/см2 | AI13: М2, т | AJ13: t2, гр. С | AK13: Р2, кгс/см2 | AL13: t1-t2, гр. С | AM13: М1-М2, т | AN13: М1гвс, т | AO13: t1гвс, гр. С | AP13: Р1гвс, кгс/см2 | AQ13: М2гвс, т | AR13: t2гвс, гр. С | AS13: Р2гвс, кгс/см2 | AT13: t1гвс-t2гвс | AU13: М1гвс-М2гвс, т | AV13: Wгвс, Гкал | AW13: Wсумм, Гкал | AY13: NS_TV1 | AZ13: НС | BA13: NS_TV2
A14: =IF(RC[1]="","",DATEVALUE(RC[1])) -> 43366 | B14: 23.09.18 | C14: 24 | D14: 0 | E14: 20.553926000000001 | G14: 0 | H14: 17.953381 | J14: =RC[-5]-RC[-2] -> 2.6005450000000003 | K14: -6.9600000000003004E-4 | S14: 4.1934750982139998E-3 | T14: =(RC[-16]*RC[-15]-RC[-13]*RC[-12])/1000 -> 0 | U14: - | V14: - | W14: =RC[-2]*RC[-10]/1000 -> #VALUE! | X14: =ABS((RC[-3]*RC[-11]-RC[-2]*RC[-9])/1000) -> #VALUE! | Y14: =RC[-14]/RC[-18]*100 -> #DIV/0! | Z14: - | AC14: =VALUE(RC[-27]) -> 2018-09-23T00:00:00.000 | AD14: =IF(RC[21]=42,"*",IF(RC[21]=32,"",RC[21])) -> - | AE14: =RC[-28] -> 24 | AF14: =RC[-28] -> 0 | AG14: =RC[-28] -> 20.553926000000001 | AH14: =RC[-28] -> 0 | AI14: =RC[-28] -> 0 | AJ14: =RC[-28] -> 17.953381 | AK14: =RC[-28] -> 0 | AL14: =RC[-28] -> 2.6005450000000003 | AM14: =RC[-28] -> -6.9600000000003004E-4 | AN14: =RC[-28] -> 0 | AO14: =RC[-28] -> 0 | AP14: - | AQ14: =RC[-29] -> 0 | AR14: =RC[-29] -> 0 | AS14: - | AT14: =RC[-30] -> 0 | AU14: =RC[-30] -> 0 | AV14: =RC[-30] -> 0 | AW14: =RC[-30] -> 4.1934750982139998E-3 | AY14: - | AZ14: * | BA14: -
A15: =IF(RC[1]="","",DATEVALUE(RC[1])) -> 43367 | B15: 24.09.18 | C15: 24 | D15: 0 | E15: 19.723883000000001 | G15: 0 | H15: 17.759018000000001 | J15: =RC[-5]-RC[-2] -> 1.9648649999999996 | K15: -5.7400000000007402E-4 | S15: 3.8509880784130001E-3 | T15: =(RC[-16]*RC[-15]-RC[-13]*RC[-12])/1000 -> 0 | U15: - | V15: - | W15: =RC[-2]*RC[-10]/1000 -> #VALUE! | X15: =ABS((RC[-3]*RC[-11]-RC[-2]*RC[-9])/1000) -> #VALUE! | Y15: =RC[-14]/RC[-18]*100 -> #DIV/0! | Z15: - | AC15: =VALUE(RC[-27]) -> 2018-09-24T00:00:00.000 | AD15: =IF(RC[21]=42,"*",IF(RC[21]=32,"",RC[21])) -> - | AE15: =RC[-28] -> 24 | AF15: =RC[-28] -> 0 | AG15: =RC[-28] -> 19.723883000000001 | AH15: =RC[-28] -> 0 | AI15: =RC[-28] -> 0 | AJ15: =RC[-28] -> 17.759018000000001 | AK15: =RC[-28] -> 0 | AL15: =RC[-28] -> 1.9648649999999996 | AM15: =RC[-28] -> -5.7400000000007402E-4 | AN15: =RC[-28] -> 0 | AO15: =RC[-28] -> 0 | AP15: - | AQ15: =RC[-29] -> 0 | AR15: =RC[-29] -> 0 | AS15: - | AT15: =RC[-30] -> 0 | AU15: =RC[-30] -> 0 | AV15: =RC[-30] -> 0 | AW15: =RC[-30] -> 3.8509880784130001E-3 | AY15: - | AZ15: * | BA15: -
A16: =IF(RC[1]="","",DATEVALUE(RC[1])) -> 43368 | B16: 25.09.18 | C16: 24 | D16: 0 | E16: 22.664401999999999 | G16: 0 | H16: 17.678370000000001 | J16: =RC[-5]-RC[-2] -> 4.986031999999998 | K16: -2.2340000000000701E-3 | S16: 0 | T16: =(RC[-16]*RC[-15]-RC[-13]*RC[-12])/1000 -> 0 | U16: - | V16: - | W16: =RC[-2]*RC[-10]/1000 -> #VALUE! | X16: =ABS((RC[-3]*RC[-11]-RC[-2]*RC[-9])/1000) -> #VALUE! | Y16: =RC[-14]/RC[-18]*100 -> #DIV/0! | Z16: - | AC16: =VALUE(RC[-27]) -> 2018-09-25T00:00:00.000 | AD16: =IF(RC[21]=42,"*",IF(RC[21]=32,"",RC[21])) -> - | AE16: =RC[-28] -> 24 | AF16: =RC[-28] -> 0 | AG16: =RC[-28] -> 22.664401999999999 | AH16: =RC[-28] -> 0 | AI16: =RC[-28] -> 0 | AJ16: =RC[-28] -> 17.678370000000001 | AK16: =RC[-28] -> 0 | AL16: =RC[-28] -> 4.986031999999998 | AM16: =RC[-28] -> -2.2340000000000701E-3 | AN16: =RC[-28] -> 0 | AO16: =RC[-28] -> 0 | AP16: - | AQ16: =RC[-29] -> 0 | AR16: =RC[-29] -> 0 | AS16: - | AT16: =RC[-30] -> 0 | AU16: =RC[-30] -> 0 | AV16: =RC[-30] -> 0 | AW16: =RC[-30] -> 0 | AY16: - | AZ16: * | BA16: -
A17: =IF(RC[1]="","",DATEVALUE(RC[1])) -> 43369 | B17: 26.09.18 | C17: 24 | D17: 0 | E17: 25.290617000000001 | G17: 0 | H17: 17.699102 | J17: =RC[-5]-RC[-2] -> 7.5915150000000011 | K17: -3.7579999999999298E-3 | S17: 0 | T17: =(RC[-16]*RC[-15]-RC[-13]*RC[-12])/1000 -> 0 | U17: - | V17: - | W17: =RC[-2]*RC[-10]/1000 -> #VALUE! | X17: =ABS((RC[-3]*RC[-11]-RC[-2]*RC[-9])/1000) -> #VALUE! | Y17: =RC[-14]/RC[-18]*100 -> #DIV/0! | Z17: - | AC17: =VALUE(RC[-27]) -> 2018-09-26T00:00:00.000 | AD17: =IF(RC[21]=42,"*",IF(RC[21]=32,"",RC[21])) -> - | AE17: =RC[-28] -> 24 | AF17: =RC[-28] -> 0 | AG17: =RC[-28] -> 25.290617000000001 | AH17: =RC[-28] -> 0 | AI17: =RC[-28] -> 0 | AJ17: =RC[-28] -> 17.699102 | AK17: =RC[-28] -> 0 | AL17: =RC[-28] -> 7.5915150000000011 | AM17: =RC[-28] -> -3.7579999999999298E-3 | AN17: =RC[-28] -> 0 | AO17: =RC[-28] -> 0 | AP17: - | AQ17: =RC[-29] -> 0 | AR17: =RC[-29] -> 0 | AS17: - | AT17: =RC[-30] -> 0 | AU17: =RC[-30] -> 0 | AV17: =RC[-30] -> 0 | AW17: =RC[-30] -> 0 | AY17: - | AZ17: * | BA17: -
A18: =IF(RC[1]="","",DATEVALUE(RC[1])) -> 43370 | B18: 27.09.18 | C18: 24 | D18: 47.101229666666661 | E18: 64.650833333333324 | G18: 47.647415333333328 | H18: 39.994516000000004 | J18: 24.656317333333334 | K18: -0.54618566666666635 | S18: 1.1379366101675468 | T18: =(RC[-16]*RC[-15]-RC[-13]*RC[-12])/1000 -> 1.1394984340670762 | U18: - | V18: - | W18: =RC[-2]*RC[-10]/1000 -> #VALUE! | X18: =ABS((RC[-3]*RC[-11]-RC[-2]*RC[-9])/1000) -> #VALUE! | Y18: =RC[-14]/RC[-18]*100 -> -1.1463070196896159 | Z18: - | AC18: =VALUE(RC[-27]) -> 2018-09-27T00:00:00.000 | AD18: =IF(RC[21]=42,"*",IF(RC[21]=32,"",RC[21])) -> - | AE18: =RC[-28] -> 24 | AF18: =RC[-28] -> 47.101229666666661 | AG18: =RC[-28] -> 64.650833333333324 | AH18: =RC[-28] -> 0 | AI18: =RC[-28] -> 47.647415333333328 | AJ18: =RC[-28] -> 39.994516000000004 | AK18: =RC[-28] -> 0 | AL18: =RC[-28] -> 24.656317333333334 | AM18: =RC[-28] -> -0.54618566666666635 | AN18: =RC[-28] -> 0 | AO18: =RC[-28] -> 0 | AP18: - | AQ18: =RC[-29] -> 0 | AR18: =RC[-29] -> 0 | AS18: - | AT18: =RC[-30] -> 0 | AU18: =RC[-30] -> 0 | AV18: =RC[-30] -> 0 | AW18: =RC[-30] -> 1.1379366101675468 | AY18: - | AZ18: * | BA18: -
A19: =IF(RC[1]="","",DATEVALUE(RC[1])) -> 43371 | B19: 28.09.18 | C19: 24 | D19: 47.101229666666661 | E19: 64.650833333333324 | G19: 47.647415333333328 | H19: 39.994516000000004 | J19: 24.656317333333334 | K19: -0.54618566666666635 | S19: 1.1379366101675468 | T19: =(RC[-16]*RC[-15]-RC[-13]*RC[-12])/1000 -> 1.1394984340670762 | U19: - | V19: - | W19: =RC[-2]*RC[-10]/1000 -> #VALUE! | X19: =ABS((RC[-3]*RC[-11]-RC[-2]*RC[-9])/1000) -> #VALUE! | Y19: =RC[-14]/RC[-18]*100 -> -1.1463070196896159 | Z19: - | AC19: =VALUE(RC[-27]) -> 2018-09-28T00:00:00.000 | AD19: =IF(RC[21]=42,"*",IF(RC[21]=32,"",RC[21])) -> - | AE19: =RC[-28] -> 24 | AF19: =RC[-28] -> 47.101229666666661 | AG19: =RC[-28] -> 64.650833333333324 | AH19: =RC[-28] -> 0 | AI19: =RC[-28] -> 47.647415333333328 | AJ19: =RC[-28] -> 39.994516000000004 | AK19: =RC[-28] -> 0 | AL19: =RC[-28] -> 24.656317333333334 | AM19: =RC[-28] -> -0.54618566666666635 | AN19: =RC[-28] -> 0 | AO19: =RC[-28] -> 0 | AP19: - | AQ19: =RC[-29] -> 0 | AR19: =RC[-29] -> 0 | AS19: - | AT19: =RC[-30] -> 0 | AU19: =RC[-30] -> 0 | AV19: =RC[-30] -> 0 | AW19: =RC[-30] -> 1.1379366101675468 | AY19: - | AZ19: * | BA19: -
A20: =IF(RC[1]="","",DATEVALUE(RC[1])) -> 43372 | B20: 29.09.18 | C20: 24 | D20: 47.101229666666661 | E20: 64.650833333333324 | G20: 47.647415333333328 | H20: 39.994516000000004 | J20: 24.656317333333334 | K20: -0.54618566666666635 | S20: 1.1379366101675468 | T20: =(RC[-16]*RC[-15]-RC[-13]*RC[-12])/1000 -> 1.1394984340670762 | U20: - | V20: - | W20: =RC[-2]*RC[-10]/1000 -> #VALUE! | X20: =ABS((RC[-3]*RC[-11]-RC[-2]*RC[-9])/1000) -> #VALUE! | Y20: =RC[-14]/RC[-18]*100 -> -1.1463070196896159 | Z20: - | AC20: =VALUE(RC[-27]) -> 2018-09-29T00:00:00.000 | AD20: =IF(RC[21]=42,"*",IF(RC[21]=32,"",RC[21])) -> - | AE20: =RC[-28] -> 24 | AF20: =RC[-28] -> 47.101229666666661 | AG20: =RC[-28] -> 64.650833333333324 | AH20: =RC[-28] -> 0 | AI20: =RC[-28] -> 47.647415333333328 | AJ20: =RC[-28] -> 39.994516000000004 | AK20: =RC[-28] -> 0 | AL20: =RC[-28] -> 24.656317333333334 | AM20: =RC[-28] -> -0.54618566666666635 | AN20: =RC[-28] -> 0 | AO20: =RC[-28] -> 0 | AP20: - | AQ20: =RC[-29] -> 0 | AR20: =RC[-29] -> 0 | AS20: - | AT20: =RC[-30] -> 0 | AU20: =RC[-30] -> 0 | AV20: =RC[-30] -> 0 | AW20: =RC[-30] -> 1.1379366101675468 | AY20: - | AZ20: * | BA20: -
A21: =IF(RC[1]="","",DATEVALUE(RC[1])) -> 43373 | B21: 30.09.18 | C21: 24 | D21: 47.101229666666661 | E21: 64.650833333333324 | G21: 47.647415333333328 | H21: 39.994516000000004 | J21: 24.656317333333334 | K21: -0.54618566666666635 | S21: 1.1379366101675468 | T21: =(RC[-16]*RC[-15]-RC[-13]*RC[-12])/1000 -> 1.1394984340670762 | U21: - | V21: - | W21: =RC[-2]*RC[-10]/1000 -> #VALUE! | X21: =ABS((RC[-3]*RC[-11]-RC[-2]*RC[-9])/1000) -> #VALUE! | Y21: =RC[-14]/RC[-18]*100 -> -1.1463070196896159 | Z21: - | AC21: =VALUE(RC[-27]) -> 2018-09-30T00:00:00.000 | AD21: =IF(RC[21]=42,"*",IF(RC[21]=32,"",RC[21])) -> - | AE21: =RC[-28] -> 24 | AF21: =RC[-28] -> 47.101229666666661 | AG21: =RC[-28] -> 64.650833333333324 | AH21: =RC[-28] -> 0 | AI21: =RC[-28] -> 47.647415333333328 | AJ21: =RC[-28] -> 39.994516000000004 | AK21: =RC[-28] -> 0 | AL21: =RC[-28] -> 24.656317333333334 | AM21: =RC[-28] -> -0.54618566666666635 | AN21: =RC[-28] -> 0 | AO21: =RC[-28] -> 0 | AP21: - | AQ21: =RC[-29] -> 0 | AR21: =RC[-29] -> 0 | AS21: - | AT21: =RC[-30] -> 0 | AU21: =RC[-30] -> 0 | AV21: =RC[-30] -> 0 | AW21: =RC[-30] -> 1.1379366101675468 | AY21: - | AZ21: * | BA21: -
A22: =IF(RC[1]="","",DATEVALUE(RC[1])) -> 43374 | B22: 01.10.18 | C22: 24 | D22: 47.101229666666661 | E22: 64.650833333333324 | G22: 47.647415333333328 | H22: 39.994516000000004 | J22: 24.656317333333334 | K22: -0.54618566666666635 | S22: 1.1379366101675468 | T22: =(RC[-16]*RC[-15]-RC[-13]*RC[-12])/1000 -> 1.1394984340670762 | U22: - | V22: - | W22: =RC[-2]*RC[-10]/1000 -> #VALUE! | X22: =ABS((RC[-3]*RC[-11]-RC[-2]*RC[-9])/1000) -> #VALUE! | Y22: =RC[-14]/RC[-18]*100 -> -1.1463070196896159 | Z22: - | AC22: =VALUE(RC[-27]) -> 2018-10-01T00:00:00.000 | AD22: =IF(RC[21]=42,"*",IF(RC[21]=32,"",RC[21])) -> - | AE22: =RC[-28] -> 24 | AF22: =RC[-28] -> 47.101229666666661 | AG22: =RC[-28] -> 64.650833333333324 | AH22: =RC[-28] -> 0 | AI22: =RC[-28] -> 47.647415333333328 | AJ22: =RC[-28] -> 39.994516000000004 | AK22: =RC[-28] -> 0 | AL22: =RC[-28] -> 24.656317333333334 | AM22: =RC[-28] -> -0.54618566666666635 | AN22: =RC[-28] -> 0 | AO22: =RC[-28] -> 0 | AP22: - | AQ22: =RC[-29] -> 0 | AR22: =RC[-29] -> 0 | AS22: - | AT22: =RC[-30] -> 0 | AU22: =RC[-30] -> 0 | AV22: =RC[-30] -> 0 | AW22: =RC[-30] -> 1.1379366101675468 | AY22: - | AZ22: * | BA22: -
A23: =IF(RC[1]="","",DATEVALUE(RC[1])) -> 43375 | B23: 02.10.18 | C23: 24 | D23: =AVERAGE(R[1]C:R[3]C) -> 47.101229666666661 | E23: =AVERAGE(R[1]C:R[3]C) -> 64.650833333333324 | G23: =AVERAGE(R[1]C:R[3]C) -> 47.647415333333328 | H23: =AVERAGE(R[1]C:R[3]C) -> 39.994516000000004 | J23: =AVERAGE(R[1]C:R[3]C) -> 24.656317333333334 | K23: =AVERAGE(R[1]C:R[3]C) -> -0.54618566666666635 | S23: =AVERAGE(R[1]C:R[3]C) -> 1.1379366101675468 | T23: =(RC[-16]*RC[-15]-RC[-13]*RC[-12])/1000 -> 1.1394984340670762 | U23: - | V23: - | W23: =RC[-2]*RC[-10]/1000 -> #VALUE! | X23: =ABS((RC[-3]*RC[-11]-RC[-2]*RC[-9])/1000) -> #VALUE! | Y23: =RC[-14]/RC[-18]*100 -> -1.1463070196896159 | Z23: - | AC23: =VALUE(RC[-27]) -> 2018-10-02T00:00:00.000 | AD23: =IF(RC[21]=42,"*",IF(RC[21]=32,"",RC[21])) -> - | AE23: =RC[-28] -> 24 | AF23: =RC[-28] -> 47.101229666666661 | AG23: =RC[-28] -> 64.650833333333324 | AH23: =RC[-28] -> 0 | AI23: =RC[-28] -> 47.647415333333328 | AJ23: =RC[-28] -> 39.994516000000004 | AK23: =RC[-28] -> 0 | AL23: =RC[-28] -> 24.656317333333334 | AM23: =RC[-28] -> -0.54618566666666635 | AN23: =RC[-28] -> 0 | AO23: =RC[-28] -> 0 | AP23: - | AQ23: =RC[-29] -> 0 | AR23: =RC[-29] -> 0 | AS23: - | AT23: =RC[-30] -> 0 | AU23: =RC[-30] -> 0 | AV23: =RC[-30] -> 0 | AW23: =RC[-30] -> 1.1379366101675468 | AY23: - | AZ23: * | BA23: -
A24: =IF(RC[1]="","",DATEVALUE(RC[1])) -> 43376 | B24: 03.10.18 | C24: 24 | D24: 50.384540999999999 | E24: 65.454346000000001 | G24: 50.961509999999997 | H24: 41.498958999999999 | J24: =RC[-5]-RC[-2] -> 23.955387000000002 | K24: -0.57696899999999796 | S24: 1.1830375655970999 | T24: =(RC[-16]*RC[-15]-RC[-13]*RC[-12])/1000 -> 1.1830375655970962 | U24: - | V24: - | W24: =RC[-2]*RC[-10]/1000 -> #VALUE! | X24: =ABS((RC[-3]*RC[-11]-RC[-2]*RC[-9])/1000) -> #VALUE! | Y24: =RC[-14]/RC[-18]*100 -> -1.1321662172098079 | Z24: - | AC24: =VALUE(RC[-27]) -> 2018-10-03T00:00:00.000 | AD24: =IF(RC[21]=42,"*",IF(RC[21]=32,"",RC[21])) -> - | AE24: =RC[-28] -> 24 | AF24: =RC[-28] -> 50.384540999999999 | AG24: =RC[-28] -> 65.454346000000001 | AH24: =RC[-28] -> 0 | AI24: =RC[-28] -> 50.961509999999997 | AJ24: =RC[-28] -> 41.498958999999999 | AK24: =RC[-28] -> 0 | AL24: =RC[-28] -> 23.955387000000002 | AM24: =RC[-28] -> -0.57696899999999796 | AN24: =RC[-28] -> 0 | AO24: =RC[-28] -> 0 | AP24: - | AQ24: =RC[-29] -> 0 | AR24: =RC[-29] -> 0 | AS24: - | AT24: =RC[-30] -> 0 | AU24: =RC[-30] -> 0 | AV24: =RC[-30] -> 0 | AW24: =RC[-30] -> 1.1830375655970999 | AY24: - | AZ24: * | BA24: -
A25: =IF(RC[1]="","",DATEVALUE(RC[1])) -> 43377 | B25: 04.10.18 | C25: 24 | D25: 47.649132000000002 | E25: 64.881934999999999 | G25: 48.205944000000002 | H25: 40.130394000000003 | J25: =RC[-5]-RC[-2] -> 24.751540999999996 | K25: -0.55681200000000097 | S25: 1.15704435936848 | T25: =(RC[-16]*RC[-15]-RC[-13]*RC[-12])/1000 -> 1.1570443593684838 | U25: - | V25: - | W25: =RC[-2]*RC[-10]/1000 -> #VALUE! | X25: =ABS((RC[-3]*RC[-11]-RC[-2]*RC[-9])/1000) -> #VALUE! | Y25: =RC[-14]/RC[-18]*100 -> -1.155069175701654 | Z25: - | AC25: =VALUE(RC[-27]) -> 2018-10-04T00:00:00.000 | AD25: =IF(RC[21]=42,"*",IF(RC[21]=32,"",RC[21])) -> - | AE25: =RC[-28] -> 24 | AF25: =RC[-28] -> 47.649132000000002 | AG25: =RC[-28] -> 64.881934999999999 | AH25: =RC[-28] -> 0 | AI25: =RC[-28] -> 48.205944000000002 | AJ25: =RC[-28] -> 40.130394000000003 | AK25: =RC[-28] -> 0 | AL25: =RC[-28] -> 24.751540999999996 | AM25: =RC[-28] -> -0.55681200000000097 | AN25: =RC[-28] -> 0 | AO25: =RC[-28] -> 0 | AP25: - | AQ25: =RC[-29] -> 0 | AR25: =RC[-29] -> 0 | AS25: - | AT25: =RC[-30] -> 0 | AU25: =RC[-30] -> 0 | AV25: =RC[-30] -> 0 | AW25: =RC[-30] -> 1.15704435936848 | AY25: - | AZ25: * | BA25: -
A26: =IF(RC[1]="","",DATEVALUE(RC[1])) -> 43378 | B26: 05.10.18 | C26: 24 | D26: 43.270015999999998 | E26: 63.616219000000001 | G26: 43.774791999999998 | H26: 38.354194999999997 | J26: =RC[-5]-RC[-2] -> 25.262024000000004 | K26: -0.504776 | S26: 1.0737279055370601 | T26: =(RC[-16]*RC[-15]-RC[-13]*RC[-12])/1000 -> 1.0737279055370641 | U26: - | V26: - | W26: =RC[-2]*RC[-10]/1000 -> #VALUE! | X26: =ABS((RC[-3]*RC[-11]-RC[-2]*RC[-9])/1000) -> #VALUE! | Y26: =RC[-14]/RC[-18]*100 -> -1.1531202706799841 | Z26: - | AC26: =VALUE(RC[-27]) -> 2018-10-05T00:00:00.000 | AD26: =IF(RC[21]=42,"*",IF(RC[21]=32,"",RC[21])) -> - | AE26: =RC[-28] -> 24 | AF26: =RC[-28] -> 43.270015999999998 | AG26: =RC[-28] -> 63.616219000000001 | AH26: =RC[-28] -> 0 | AI26: =RC[-28] -> 43.774791999999998 | AJ26: =RC[-28] -> 38.354194999999997 | AK26: =RC[-28] -> 0 | AL26: =RC[-28] -> 25.262024000000004 | AM26: =RC[-28] -> -0.504776 | AN26: =RC[-28] -> 0 | AO26: =RC[-28] -> 0 | AP26: - | AQ26: =RC[-29] -> 0 | AR26: =RC[-29] -> 0 | AS26: - | AT26: =RC[-30] -> 0 | AU26: =RC[-30] -> 0 | AV26: =RC[-30] -> 0 | AW26: =RC[-30] -> 1.0737279055370601 | AY26: - | AZ26: * | BA26: -
A27: =IF(RC[1]="","",DATEVALUE(RC[1])) -> 43379 | B27: 06.10.18 | C27: 24 | D27: 44.754249999999999 | E27: 63.413646999999997 | G27: 45.257590999999998 | H27: 39.161662999999997 | J27: =RC[-5]-RC[-2] -> 24.251984 | K27: -0.50334099999999904 | S27: 1.0656676843159201 | T27: =(RC[-16]*RC[-15]-RC[-13]*RC[-12])/1000 -> 1.065667684315917 | U27: - | V27: - | W27: =RC[-2]*RC[-10]/1000 -> #VALUE! | X27: =ABS((RC[-3]*RC[-11]-RC[-2]*RC[-9])/1000) -> #VALUE! | Y27: =RC[-14]/RC[-18]*100 -> -1.1121692270364083 | Z27: - | AC27: =VALUE(RC[-27]) -> 2018-10-06T00:00:00.000 | AD27: =IF(RC[21]=42,"*",IF(RC[21]=32,"",RC[21])) -> - | AE27: =RC[-28] -> 24 | AF27: =RC[-28] -> 44.754249999999999 | AG27: =RC[-28] -> 63.413646999999997 | AH27: =RC[-28] -> 0 | AI27: =RC[-28] -> 45.257590999999998 | AJ27: =RC[-28] -> 39.161662999999997 | AK27: =RC[-28] -> 0 | AL27: =RC[-28] -> 24.251984 | AM27: =RC[-28] -> -0.50334099999999904 | AN27: =RC[-28] -> 0 | AO27: =RC[-28] -> 0 | AP27: - | AQ27: =RC[-29] -> 0 | AR27: =RC[-29] -> 0 | AS27: - | AT27: =RC[-30] -> 0 | AU27: =RC[-30] -> 0 | AV27: =RC[-30] -> 0 | AW27: =RC[-30] -> 1.0656676843159201 | AY27: - | AZ27: * | BA27: -
A28: =IF(RC[1]="","",DATEVALUE(RC[1])) -> 43380 | B28: 07.10.18 | C28: 24 | D28: 44.641609000000003 | E28: 63.726616 | G28: 45.144832999999998 | H28: 39.541744000000001 | J28: =RC[-5]-RC[-2] -> 24.184871999999999 | K28: -0.503224000000003 | S28: 1.05975324495639 | T28: =(RC[-16]*RC[-15]-RC[-13]*RC[-12])/1000 -> 1.059753244956392 | U28: - | V28: - | W28: =RC[-2]*RC[-10]/1000 -> #VALUE! | X28: =ABS((RC[-3]*RC[-11]-RC[-2]*RC[-9])/1000) -> #VALUE! | Y28: =RC[-14]/RC[-18]*100 -> -1.1146879200993014 | Z28: - | AC28: =VALUE(RC[-27]) -> 2018-10-07T00:00:00.000 | AD28: =IF(RC[21]=42,"*",IF(RC[21]=32,"",RC[21])) -> - | AE28: =RC[-28] -> 24 | AF28: =RC[-28] -> 44.641609000000003 | AG28: =RC[-28] -> 63.726616 | AH28: =RC[-28] -> 0 | AI28: =RC[-28] -> 45.144832999999998 | AJ28: =RC[-28] -> 39.541744000000001 | AK28: =RC[-28] -> 0 | AL28: =RC[-28] -> 24.184871999999999 | AM28: =RC[-28] -> -0.503224000000003 | AN28: =RC[-28] -> 0 | AO28: =RC[-28] -> 0 | AP28: - | AQ28: =RC[-29] -> 0 | AR28: =RC[-29] -> 0 | AS28: - | AT28: =RC[-30] -> 0 | AU28: =RC[-30] -> 0 | AV28: =RC[-30] -> 0 | AW28: =RC[-30] -> 1.05975324495639 | AY28: - | AZ28: * | BA28: -
A29: =IF(RC[1]="","",DATEVALUE(RC[1])) -> 43381 | B29: 08.10.18 | C29: 24 | D29: 43.526153999999998 | E29: 63.622036000000001 | G29: 44.026420999999999 | H29: 38.808017999999997 | J29: =RC[-5]-RC[-2] -> 24.814018000000004 | K29: -0.50026700000000102 | S29: 1.0606443980859701 | T29: =(RC[-16]*RC[-15]-RC[-13]*RC[-12])/1000 -> 1.0606443980859663 | U29: - | V29: - | W29: =RC[-2]*RC[-10]/1000 -> #VALUE! | X29: =ABS((RC[-3]*RC[-11]-RC[-2]*RC[-9])/1000) -> #VALUE! | Y29: =RC[-14]/RC[-18]*100 -> -1.1362881393425122 | Z29: - | AC29: =VALUE(RC[-27]) -> 2018-10-08T00:00:00.000 | AD29: =IF(RC[21]=42,"*",IF(RC[21]=32,"",RC[21])) -> - | AE29: =RC[-28] -> 24 | AF29: =RC[-28] -> 43.526153999999998 | AG29: =RC[-28] -> 63.622036000000001 | AH29: =RC[-28] -> 0 | AI29: =RC[-28] -> 44.026420999999999 | AJ29: =RC[-28] -> 38.808017999999997 | AK29: =RC[-28] -> 0 | AL29: =RC[-28] -> 24.814018000000004 | AM29: =RC[-28] -> -0.50026700000000102 | AN29: =RC[-28] -> 0 | AO29: =RC[-28] -> 0 | AP29: - | AQ29: =RC[-29] -> 0 | AR29: =RC[-29] -> 0 | AS29: - | AT29: =RC[-30] -> 0 | AU29: =RC[-30] -> 0 | AV29: =RC[-30] -> 0 | AW29: =RC[-30] -> 1.0606443980859701 | AY29: - | AZ29: * | BA29: -
A30: =IF(RC[1]="","",DATEVALUE(RC[1])) -> 43382 | B30: 09.10.18 | C30: 24 | D30: 45.426333999999997 | E30: 63.546951 | G30: 45.931972999999999 | H30: 39.655208999999999 | J30: =RC[-5]-RC[-2] -> 23.891742000000001 | K30: -0.50563900000000195 | S30: 1.06526303171028 | T30: =(RC[-16]*RC[-15]-RC[-13]*RC[-12])/1000 -> 1.0652630317102769 | U30: - | V30: - | W30: =RC[-2]*RC[-10]/1000 -> #VALUE! | X30: =ABS((RC[-3]*RC[-11]-RC[-2]*RC[-9])/1000) -> #VALUE! | Y30: =RC[-14]/RC[-18]*100 -> -1.1008431969599954 | Z30: - | AC30: =VALUE(RC[-27]) -> 2018-10-09T00:00:00.000 | AD30: =IF(RC[21]=42,"*",IF(RC[21]=32,"",RC[21])) -> - | AE30: =RC[-28] -> 24 | AF30: =RC[-28] -> 45.426333999999997 | AG30: =RC[-28] -> 63.546951 | AH30: =RC[-28] -> 0 | AI30: =RC[-28] -> 45.931972999999999 | AJ30: =RC[-28] -> 39.655208999999999 | AK30: =RC[-28] -> 0 | AL30: =RC[-28] -> 23.891742000000001 | AM30: =RC[-28] -> -0.50563900000000195 | AN30: =RC[-28] -> 0 | AO30: =RC[-28] -> 0 | AP30: - | AQ30: =RC[-29] -> 0 | AR30: =RC[-29] -> 0 | AS30: - | AT30: =RC[-30] -> 0 | AU30: =RC[-30] -> 0 | AV30: =RC[-30] -> 0 | AW30: =RC[-30] -> 1.06526303171028 | AY30: - | AZ30: * | BA30: -
A31: =IF(RC[1]="","",DATEVALUE(RC[1])) -> 43383 | B31: 10.10.18 | C31: 24 | D31: 45.653885000000002 | E31: 64.572540000000004 | G31: 46.175217000000004 | H31: 40.376308000000002 | J31: =RC[-5]-RC[-2] -> 24.196232000000002 | K31: -0.52133200000000102 | S31: 1.0836025317590601 | T31: =(RC[-16]*RC[-15]-RC[-13]*RC[-12])/1000 -> 1.0836025317590643 | U31: - | V31: - | W31: =RC[-2]*RC[-10]/1000 -> #VALUE! | X31: =ABS((RC[-3]*RC[-11]-RC[-2]*RC[-9])/1000) -> #VALUE! | Y31: =RC[-14]/RC[-18]*100 -> -1.1290298863132597 | Z31: - | AC31: =VALUE(RC[-27]) -> 2018-10-10T00:00:00.000 | AD31: =IF(RC[21]=42,"*",IF(RC[21]=32,"",RC[21])) -> - | AE31: =RC[-28] -> 24 | AF31: =RC[-28] -> 45.653885000000002 | AG31: =RC[-28] -> 64.572540000000004 | AH31: =RC[-28] -> 0 | AI31: =RC[-28] -> 46.175217000000004 | AJ31: =RC[-28] -> 40.376308000000002 | AK31: =RC[-28] -> 0 | AL31: =RC[-28] -> 24.196232000000002 | AM31: =RC[-28] -> -0.52133200000000102 | AN31: =RC[-28] -> 0 | AO31: =RC[-28] -> 0 | AP31: - | AQ31: =RC[-29] -> 0 | AR31: =RC[-29] -> 0 | AS31: - | AT31: =RC[-30] -> 0 | AU31: =RC[-30] -> 0 | AV31: =RC[-30] -> 0 | AW31: =RC[-30] -> 1.0836025317590601 | AY31: - | AZ31: * | BA31: -
A32: =IF(RC[1]="","",DATEVALUE(RC[1])) -> 43384 | B32: 11.10.18 | C32: 24 | D32: 47.022990999999998 | E32: 65.645111 | G32: 47.569164000000001 | H32: 41.397185999999998 | J32: =RC[-5]-RC[-2] -> 24.247925000000002 | K32: -0.54617300000000302 | S32: 1.1175999337745 | T32: =(RC[-16]*RC[-15]-RC[-13]*RC[-12])/1000 -> 1.1175999337744968 | U32: - | V32: - | W32: =RC[-2]*RC[-10]/1000 -> #VALUE! | X32: =ABS((RC[-3]*RC[-11]-RC[-2]*RC[-9])/1000) -> #VALUE! | Y32: =RC[-14]/RC[-18]*100 -> -1.148166068253802 | Z32: - | AC32: =VALUE(RC[-27]) -> 2018-10-11T00:00:00.000 | AD32: =IF(RC[21]=42,"*",IF(RC[21]=32,"",RC[21])) -> - | AE32: =RC[-28] -> 24 | AF32: =RC[-28] -> 47.022990999999998 | AG32: =RC[-28] -> 65.645111 | AH32: =RC[-28] -> 0 | AI32: =RC[-28] -> 47.569164000000001 | AJ32: =RC[-28] -> 41.397185999999998 | AK32: =RC[-28] -> 0 | AL32: =RC[-28] -> 24.247925000000002 | AM32: =RC[-28] -> -0.54617300000000302 | AN32: =RC[-28] -> 0 | AO32: =RC[-28] -> 0 | AP32: - | AQ32: =RC[-29] -> 0 | AR32: =RC[-29] -> 0 | AS32: - | AT32: =RC[-30] -> 0 | AU32: =RC[-30] -> 0 | AV32: =RC[-30] -> 0 | AW32: =RC[-30] -> 1.1175999337745 | AY32: - | AZ32: * | BA32: -
A33: =IF(RC[1]="","",DATEVALUE(RC[1])) -> 43385 | B33: 12.10.18 | C33: 24 | D33: 46.420673000000001 | E33: 65.542716999999996 | G33: 46.958793999999997 | H33: 41.311816999999998 | J33: =RC[-5]-RC[-2] -> 24.230899999999998 | K33: -0.53812099999999696 | S33: 1.10258392911984 | T33: =(RC[-16]*RC[-15]-RC[-13]*RC[-12])/1000 -> 1.1025839291198429 | U33: - | V33: - | W33: =RC[-2]*RC[-10]/1000 -> #VALUE! | X33: =ABS((RC[-3]*RC[-11]-RC[-2]*RC[-9])/1000) -> #VALUE! | Y33: =RC[-14]/RC[-18]*100 -> -1.1459429728966144 | Z33: - | AC33: =VALUE(RC[-27]) -> 2018-10-12T00:00:00.000 | AD33: =IF(RC[21]=42,"*",IF(RC[21]=32,"",RC[21])) -> - | AE33: =RC[-28] -> 24 | AF33: =RC[-28] -> 46.420673000000001 | AG33: =RC[-28] -> 65.542716999999996 | AH33: =RC[-28] -> 0 | AI33: =RC[-28] -> 46.958793999999997 | AJ33: =RC[-28] -> 41.311816999999998 | AK33: =RC[-28] -> 0 | AL33: =RC[-28] -> 24.230899999999998 | AM33: =RC[-28] -> -0.53812099999999696 | AN33: =RC[-28] -> 0 | AO33: =RC[-28] -> 0 | AP33: - | AQ33: =RC[-29] -> 0 | AR33: =RC[-29] -> 0 | AS33: - | AT33: =RC[-30] -> 0 | AU33: =RC[-30] -> 0 | AV33: =RC[-30] -> 0 | AW33: =RC[-30] -> 1.10258392911984 | AY33: - | AZ33: * | BA33: -
A34: =IF(RC[1]="","",DATEVALUE(RC[1])) -> 43386 | B34: 13.10.18 | C34: 24 | D34: 48.455207999999999 | E34: 66.627823000000006 | G34: 49.023788000000003 | H34: 42.480803999999999 | J34: =RC[-5]-RC[-2] -> 24.147019000000007 | K34: -0.56857999999999698 | S34: 1.14589509268663 | T34: =(RC[-16]*RC[-15]-RC[-13]*RC[-12])/1000 -> 1.1458950926866323 | U34: - | V34: - | W34: =RC[-2]*RC[-10]/1000 -> #VALUE! | X34: =ABS((RC[-3]*RC[-11]-RC[-2]*RC[-9])/1000) -> #VALUE! | Y34: =RC[-14]/RC[-18]*100 -> -1.1598042974565672 | Z34: - | AC34: =VALUE(RC[-27]) -> 2018-10-13T00:00:00.000 | AD34: =IF(RC[21]=42,"*",IF(RC[21]=32,"",RC[21])) -> - | AE34: =RC[-28] -> 24 | AF34: =RC[-28] -> 48.455207999999999 | AG34: =RC[-28] -> 66.627823000000006 | AH34: =RC[-28] -> 0 | AI34: =RC[-28] -> 49.023788000000003 | AJ34: =RC[-28] -> 42.480803999999999 | AK34: =RC[-28] -> 0 | AL34: =RC[-28] -> 24.147019000000007 | AM34: =RC[-28] -> -0.56857999999999698 | AN34: =RC[-28] -> 0 | AO34: =RC[-28] -> 0 | AP34: - | AQ34: =RC[-29] -> 0 | AR34: =RC[-29] -> 0 | AS34: - | AT34: =RC[-30] -> 0 | AU34: =RC[-30] -> 0 | AV34: =RC[-30] -> 0 | AW34: =RC[-30] -> 1.14589509268663 | AY34: - | AZ34: * | BA34: -
A35: =IF(RC[1]="","",DATEVALUE(RC[1])) -> 43387 | B35: 14.10.18 | C35: 24 | D35: 49.489455999999997 | E35: 67.451981000000004 | G35: 50.072208000000003 | H35: 43.529060000000001 | J35: =RC[-5]-RC[-2] -> 23.922921000000002 | K35: -0.58275199999999905 | S35: 1.1585656994478599 | T35: =(RC[-16]*RC[-15]-RC[-13]*RC[-12])/1000 -> 1.1585656994478559 | U35: - | V35: - | W35: =RC[-2]*RC[-10]/1000 -> #VALUE! | X35: =ABS((RC[-3]*RC[-11]-RC[-2]*RC[-9])/1000) -> #VALUE! | Y35: =RC[-14]/RC[-18]*100 -> -1.1638232530109296 | Z35: - | AC35: =VALUE(RC[-27]) -> 2018-10-14T00:00:00.000 | AD35: =IF(RC[21]=42,"*",IF(RC[21]=32,"",RC[21])) -> - | AE35: =RC[-28] -> 24 | AF35: =RC[-28] -> 49.489455999999997 | AG35: =RC[-28] -> 67.451981000000004 | AH35: =RC[-28] -> 0 | AI35: =RC[-28] -> 50.072208000000003 | AJ35: =RC[-28] -> 43.529060000000001 | AK35: =RC[-28] -> 0 | AL35: =RC[-28] -> 23.922921000000002 | AM35: =RC[-28] -> -0.58275199999999905 | AN35: =RC[-28] -> 0 | AO35: =RC[-28] -> 0 | AP35: - | AQ35: =RC[-29] -> 0 | AR35: =RC[-29] -> 0 | AS35: - | AT35: =RC[-30] -> 0 | AU35: =RC[-30] -> 0 | AV35: =RC[-30] -> 0 | AW35: =RC[-30] -> 1.1585656994478599 | AY35: - | AZ35: * | BA35: -
A36: =IF(RC[1]="","",DATEVALUE(RC[1])) -> 43388 | B36: 15.10.18 | C36: 24 | D36: 50.774994 | E36: 67.096290999999994 | G36: 51.350532999999999 | H36: 44.093547999999998 | J36: =RC[-5]-RC[-2] -> 23.002742999999995 | K36: -0.57553899999999902 | S36: 1.14258658128617 | T36: =(RC[-16]*RC[-15]-RC[-13]*RC[-12])/1000 -> 1.1425865812861697 | U36: - | V36: - | W36: =RC[-2]*RC[-10]/1000 -> #VALUE! | X36: =ABS((RC[-3]*RC[-11]-RC[-2]*RC[-9])/1000) -> #VALUE! | Y36: =RC[-14]/RC[-18]*100 -> -1.1208043351760324 | Z36: - | AC36: =VALUE(RC[-27]) -> 2018-10-15T00:00:00.000 | AD36: =IF(RC[21]=42,"*",IF(RC[21]=32,"",RC[21])) -> - | AE36: =RC[-28] -> 24 | AF36: =RC[-28] -> 50.774994 | AG36: =RC[-28] -> 67.096290999999994 | AH36: =RC[-28] -> 0 | AI36: =RC[-28] -> 51.350532999999999 | AJ36: =RC[-28] -> 44.093547999999998 | AK36: =RC[-28] -> 0 | AL36: =RC[-28] -> 23.002742999999995 | AM36: =RC[-28] -> -0.57553899999999902 | AN36: =RC[-28] -> 0 | AO36: =RC[-28] -> 0 | AP36: - | AQ36: =RC[-29] -> 0 | AR36: =RC[-29] -> 0 | AS36: - | AT36: =RC[-30] -> 0 | AU36: =RC[-30] -> 0 | AV36: =RC[-30] -> 0 | AW36: =RC[-30] -> 1.14258658128617 | AY36: - | AZ36: * | BA36: -
A37: =IF(RC[1]="","",DATEVALUE(RC[1])) -> 43389 | B37: 16.10.18 | C37: 24 | D37: 50.951152999999998 | E37: 67.136809999999997 | G37: 51.525852 | H37: 44.280318999999999 | J37: =RC[-5]-RC[-2] -> 22.856490999999998 | K37: -0.57469900000000296 | S37: 1.13911671493514 | T37: =(RC[-16]*RC[-15]-RC[-13]*RC[-12])/1000 -> 1.1391167149351418 | U37: - | V37: - | W37: =RC[-2]*RC[-10]/1000 -> #VALUE! | X37: =ABS((RC[-3]*RC[-11]-RC[-2]*RC[-9])/1000) -> #VALUE! | Y37: =RC[-14]/RC[-18]*100 -> -1.1153604990364894 | Z37: - | AC37: =VALUE(RC[-27]) -> 2018-10-16T00:00:00.000 | AD37: =IF(RC[21]=42,"*",IF(RC[21]=32,"",RC[21])) -> - | AE37: =RC[-28] -> 24 | AF37: =RC[-28] -> 50.951152999999998 | AG37: =RC[-28] -> 67.136809999999997 | AH37: =RC[-28] -> 0 | AI37: =RC[-28] -> 51.525852 | AJ37: =RC[-28] -> 44.280318999999999 | AK37: =RC[-28] -> 0 | AL37: =RC[-28] -> 22.856490999999998 | AM37: =RC[-28] -> -0.57469900000000296 | AN37: =RC[-28] -> 0 | AO37: =RC[-28] -> 0 | AP37: - | AQ37: =RC[-29] -> 0 | AR37: =RC[-29] -> 0 | AS37: - | AT37: =RC[-30] -> 0 | AU37: =RC[-30] -> 0 | AV37: =RC[-30] -> 0 | AW37: =RC[-30] -> 1.13911671493514 | AY37: - | AZ37: * | BA37: -
A38: =IF(RC[1]="","",DATEVALUE(RC[1])) -> 43390 | B38: 17.10.18 | C38: 24 | D38: 51.965201999999998 | E38: 67.299858 | G38: 52.546227000000002 | H38: 44.733856000000003 | J38: =RC[-5]-RC[-2] -> 22.566001999999997 | K38: -0.58102499999999702 | S38: 1.1466553635800001 | T38: =(RC[-16]*RC[-15]-RC[-13]*RC[-12])/1000 -> 1.1466553635800036 | U38: - | V38: - | W38: =RC[-2]*RC[-10]/1000 -> #VALUE! | X38: =ABS((RC[-3]*RC[-11]-RC[-2]*RC[-9])/1000) -> #VALUE! | Y38: =RC[-14]/RC[-18]*100 -> -1.1057406652622215 | Z38: - | AC38: =VALUE(RC[-27]) -> 2018-10-17T00:00:00.000 | AD38: =IF(RC[21]=42,"*",IF(RC[21]=32,"",RC[21])) -> - | AE38: =RC[-28] -> 24 | AF38: =RC[-28] -> 51.965201999999998 | AG38: =RC[-28] -> 67.299858 | AH38: =RC[-28] -> 0 | AI38: =RC[-28] -> 52.546227000000002 | AJ38: =RC[-28] -> 44.733856000000003 | AK38: =RC[-28] -> 0 | AL38: =RC[-28] -> 22.566001999999997 | AM38: =RC[-28] -> -0.58102499999999702 | AN38: =RC[-28] -> 0 | AO38: =RC[-28] -> 0 | AP38: - | AQ38: =RC[-29] -> 0 | AR38: =RC[-29] -> 0 | AS38: - | AT38: =RC[-30] -> 0 | AU38: =RC[-30] -> 0 | AV38: =RC[-30] -> 0 | AW38: =RC[-30] -> 1.1466553635800001 | AY38: - | AZ38: * | BA38: -
A39: =IF(RC[1]="","",DATEVALUE(RC[1])) -> 43391 | B39: 18.10.18 | C39: 24 | D39: 51.737358 | E39: 67.783362999999994 | F39: - | G39: 52.326949999999997 | H39: 44.883881000000002 | I39: - | J39: 22.899481999999992 | K39: -0.58959199999999601 | S39: 1.1582955210820001 | T39: 1.1582955210820036 | U39: - | V39: - | W39: #VALUE! | X39: #VALUE! | Y39: =RC[-14]/RC[-18]*100 -> -1.1267463515454199 | AC39: =VALUE(RC[-27]) -> 2018-10-18T00:00:00.000 | AD39: =IF(RC[21]=42,"*",IF(RC[21]=32,"",RC[21])) ->  | AE39: =RC[-28] -> 24 | AF39: =RC[-28] -> 51.737358 | AG39: =RC[-28] -> 67.783362999999994 | AH39: =RC[-28] -> - | AI39: =RC[-28] -> 52.326949999999997 | AJ39: =RC[-28] -> 44.883881000000002 | AK39: =RC[-28] -> - | AL39: =RC[-28] -> 22.899481999999992 | AM39: =RC[-28] -> -0.58959199999999601 | AN39: =RC[-28] -> 0 | AO39: =RC[-28] -> 0 | AP39: - | AQ39: =RC[-29] -> 0 | AR39: =RC[-29] -> 0 | AS39: - | AT39: =RC[-30] -> 0 | AU39: =RC[-30] -> 0 | AV39: =RC[-30] -> 0 | AW39: =RC[-30] -> 1.1582955210820001
A40: =IF(RC[1]="","",DATEVALUE(RC[1])) -> 43392 | B40: 19.10.18 | C40: 24 | D40: 51.938960999999999 | E40: 67.753197 | F40: - | G40: 52.536059999999999 | H40: 44.608131 | I40: - | J40: 23.145066 | K40: -0.59709900000000005 | S40: 1.17549520990446 | T40: 1.1754952099044567 | U40: - | V40: - | W40: #VALUE! | X40: #VALUE! | Y40: =RC[-14]/RC[-18]*100 -> -1.1365507805495885 | AC40: =VALUE(RC[-27]) -> 2018-10-19T00:00:00.000 | AD40: =IF(RC[21]=42,"*",IF(RC[21]=32,"",RC[21])) ->  | AE40: =RC[-28] -> 24 | AF40: =RC[-28] -> 51.938960999999999 | AG40: =RC[-28] -> 67.753197 | AH40: =RC[-28] -> - | AI40: =RC[-28] -> 52.536059999999999 | AJ40: =RC[-28] -> 44.608131 | AK40: =RC[-28] -> - | AL40: =RC[-28] -> 23.145066 | AM40: =RC[-28] -> -0.59709900000000005 | AN40: =RC[-28] -> 0 | AO40: =RC[-28] -> 0 | AP40: - | AQ40: =RC[-29] -> 0 | AR40: =RC[-29] -> 0 | AS40: - | AT40: =RC[-30] -> 0 | AU40: =RC[-30] -> 0 | AV40: =RC[-30] -> 0 | AW40: =RC[-30] -> 1.17549520990446
A41: =IF(RC[1]="","",DATEVALUE(RC[1])) -> 43393 | B41: 20.10.18 | C41: 24 | D41: 49.511021 | E41: 66.855689999999996 | F41: - | G41: 50.077762999999997 | H41: 43.498927999999999 | I41: - | J41: 23.356761999999996 | K41: -0.56674199999999797 | S41: 1.13176446442143 | T41: 1.131764464421426 | U41: - | V41: - | W41: #VALUE! | X41: #VALUE! | Y41: =RC[-14]/RC[-18]*100 -> -1.1317238751259677 | AC41: =VALUE(RC[-27]) -> 2018-10-20T00:00:00.000 | AD41: =IF(RC[21]=42,"*",IF(RC[21]=32,"",RC[21])) ->  | AE41: =RC[-28] -> 24 | AF41: =RC[-28] -> 49.511021 | AG41: =RC[-28] -> 66.855689999999996 | AH41: =RC[-28] -> - | AI41: =RC[-28] -> 50.077762999999997 | AJ41: =RC[-28] -> 43.498927999999999 | AK41: =RC[-28] -> - | AL41: =RC[-28] -> 23.356761999999996 | AM41: =RC[-28] -> -0.56674199999999797 | AN41: =RC[-28] -> 0 | AO41: =RC[-28] -> 0 | AP41: - | AQ41: =RC[-29] -> 0 | AR41: =RC[-29] -> 0 | AS41: - | AT41: =RC[-30] -> 0 | AU41: =RC[-30] -> 0 | AV41: =RC[-30] -> 0 | AW41: =RC[-30] -> 1.13176446442143
A42: =IF(RC[1]="","",DATEVALUE(RC[1])) -> 43394 | B42: 21.10.18 | C42: 24 | D42: 49.399940000000001 | E42: 66.165085000000005 | F42: - | G42: 49.948554999999999 | H42: 43.371474999999997 | I42: - | J42: 22.793610000000008 | K42: -0.54861499999999797 | S42: 1.10220872462627 | T42: 1.1022087246262759 | U42: - | V42: - | W42: #VALUE! | X42: #VALUE! | Y42: =RC[-14]/RC[-18]*100 -> -1.0983601027096739 | AC42: =VALUE(RC[-27]) -> 2018-10-21T00:00:00.000 | AD42: =IF(RC[21]=42,"*",IF(RC[21]=32,"",RC[21])) ->  | AE42: =RC[-28] -> 24 | AF42: =RC[-28] -> 49.399940000000001 | AG42: =RC[-28] -> 66.165085000000005 | AH42: =RC[-28] -> - | AI42: =RC[-28] -> 49.948554999999999 | AJ42: =RC[-28] -> 43.371474999999997 | AK42: =RC[-28] -> - | AL42: =RC[-28] -> 22.793610000000008 | AM42: =RC[-28] -> -0.54861499999999797 | AN42: =RC[-28] -> 0 | AO42: =RC[-28] -> 0 | AP42: - | AQ42: =RC[-29] -> 0 | AR42: =RC[-29] -> 0 | AS42: - | AT42: =RC[-30] -> 0 | AU42: =RC[-30] -> 0 | AV42: =RC[-30] -> 0 | AW42: =RC[-30] -> 1.10220872462627
A43: =IF(RC[1]="","",DATEVALUE(RC[1])) -> 43395 | B43: 22.10.18 | C43: 24 | D43: 48.817172999999997 | E43: 66.360725000000002 | F43: - | G43: 49.369872999999998 | H43: 43.123108000000002 | I43: - | J43: 23.237617 | K43: -0.55270000000000197 | S43: 1.1105606274051401 | T43: 1.1105606274051412 | U43: - | V43: - | W43: #VALUE! | X43: #VALUE! | Y43: =RC[-14]/RC[-18]*100 -> -1.1195086525744191 | AC43: =VALUE(RC[-27]) -> 2018-10-22T00:00:00.000 | AD43: =IF(RC[21]=42,"*",IF(RC[21]=32,"",RC[21])) ->  | AE43: =RC[-28] -> 24 | AF43: =RC[-28] -> 48.817172999999997 | AG43: =RC[-28] -> 66.360725000000002 | AH43: =RC[-28] -> - | AI43: =RC[-28] -> 49.369872999999998 | AJ43: =RC[-28] -> 43.123108000000002 | AK43: =RC[-28] -> - | AL43: =RC[-28] -> 23.237617 | AM43: =RC[-28] -> -0.55270000000000197 | AN43: =RC[-28] -> 0 | AO43: =RC[-28] -> 0 | AP43: - | AQ43: =RC[-29] -> 0 | AR43: =RC[-29] -> 0 | AS43: - | AT43: =RC[-30] -> 0 | AU43: =RC[-30] -> 0 | AV43: =RC[-30] -> 0 | AW43: =RC[-30] -> 1.1105606274051401
A44: =IF(RC[1]="","",DATEVALUE(RC[1])) ->  | C44: 24 | J44: =RC[-5]-RC[-2] -> #VALUE! | T44: =(RC[-16]*RC[-15]-RC[-13]*RC[-12])/1000 -> #VALUE! | W44: =RC[-2]*RC[-10]/1000 -> #VALUE! | X44: =ABS((RC[-3]*RC[-11]-RC[-2]*RC[-9])/1000) -> #VALUE! | Y44: =RC[-14]/RC[-18]*100 -> #VALUE! | AC44: =VALUE(RC[-27]) -> #VALUE! | AD44: =IF(RC[21]=42,"*",IF(RC[21]=32,"",RC[21])) ->  | AE44: =RC[-28] -> 24 | AF44: =RC[-28] ->  | AG44: =RC[-28] ->  | AH44: =RC[-28] -> 0 | AI44: =RC[-28] ->  | AJ44: =RC[-28] ->  | AK44: =RC[-28] -> 0 | AL44: =RC[-28] -> #VALUE! | AM44: =RC[-28] ->  | AN44: =RC[-28] -> 0 | AO44: =RC[-28] -> 0 | AP44: - | AQ44: =RC[-29] -> 0 | AR44: =RC[-29] -> 0 | AS44: - | AT44: =RC[-30] -> 0 | AU44: =RC[-30] -> 0 | AV44: =RC[-30] -> 0 | AW44: =RC[-30] -> 
A45: =IF(RC[1]="","",DATEVALUE(RC[1])) ->  | C45: 24 | T45: =(RC[-16]*RC[-15]-RC[-13]*RC[-12])/1000 -> #VALUE! | W45: =RC[-2]*RC[-10]/1000 -> #VALUE! | X45: =ABS((RC[-3]*RC[-11]-RC[-2]*RC[-9])/1000) -> #VALUE! | Y45: =RC[-14]/RC[-18]*100 -> #VALUE! | AC45: =VALUE(RC[-27]) -> #VALUE! | AD45: =IF(RC[21]=42,"*",IF(RC[21]=32,"",RC[21])) ->  | AE45: =RC[-28] -> 24 | AF45: =RC[-28] ->  | AG45: =RC[-28] ->  | AH45: =RC[-28] -> 0 | AI45: =RC[-28] ->  | AJ45: =RC[-28] ->  | AK45: =RC[-28] -> 0 | AL45: =RC[-28] -> 0 | AM45: =RC[-28] ->  | AN45: =RC[-28] -> 0 | AO45: =RC[-28] -> 0 | AP45: - | AQ45: =RC[-29] -> 0 | AR45: =RC[-29] -> 0 | AS45: - | AT45: =RC[-30] -> 0 | AU45: =RC[-30] -> 0 | AV45: =RC[-30] -> 0 | AW45: =RC[-30] -> 
A46: =IF(RC[1]="","",DATEVALUE(RC[1])) ->  | C46: 24 | T46: =(RC[-16]*RC[-15]-RC[-13]*RC[-12])/1000 -> #VALUE! | W46: =RC[-2]*RC[-10]/1000 -> #VALUE! | X46: =ABS((RC[-3]*RC[-11]-RC[-2]*RC[-9])/1000) -> #VALUE! | Y46: =RC[-14]/RC[-18]*100 -> #VALUE! | AC46: =VALUE(RC[-27]) -> #VALUE! | AD46: =IF(RC[21]=42,"*",IF(RC[21]=32,"",RC[21])) ->  | AE46: =RC[-28] -> 24 | AF46: =RC[-28] ->  | AG46: =RC[-28] ->  | AH46: =RC[-28] -> 0 | AI46: =RC[-28] ->  | AJ46: =RC[-28] ->  | AK46: =RC[-28] -> 0 | AL46: =RC[-28] -> 0 | AM46: =RC[-28] ->  | AN46: =RC[-28] -> 0 | AO46: =RC[-28] -> 0 | AP46: - | AQ46: =RC[-29] -> 0 | AR46: =RC[-29] -> 0 | AS46: - | AT46: =RC[-30] -> 0 | AU46: =RC[-30] -> 0 | AV46: =RC[-30] -> 0 | AW46: =RC[-30] -> 
A47: =IF(RC[1]="","",DATEVALUE(RC[1])) ->  | C47: 24 | T47: =(RC[-16]*RC[-15]-RC[-13]*RC[-12])/1000 -> #VALUE! | W47: =RC[-2]*RC[-10]/1000 -> #VALUE! | X47: =ABS((RC[-3]*RC[-11]-RC[-2]*RC[-9])/1000) -> #VALUE! | Y47: =RC[-14]/RC[-18]*100 -> #VALUE! | AC47: =VALUE(RC[-27]) -> #VALUE! | AD47: =IF(RC[21]=42,"*",IF(RC[21]=32,"",RC[21])) ->  | AE47: =RC[-28] -> 24 | AF47: =RC[-28] ->  | AG47: =RC[-28] ->  | AH47: =RC[-28] -> 0 | AI47: =RC[-28] ->  | AJ47: =RC[-28] ->  | AK47: =RC[-28] -> 0 | AL47: =RC[-28] -> 0 | AM47: =RC[-28] ->  | AN47: =RC[-28] -> 0 | AO47: =RC[-28] -> 0 | AP47: - | AQ47: =RC[-29] -> 0 | AR47: =RC[-29] -> 0 | AS47: - | AT47: =RC[-30] -> 0 | AU47: =RC[-30] -> 0 | AV47: =RC[-30] -> 0 | AW47: =RC[-30] -> 
A48: =IF(RC[1]="","",DATEVALUE(RC[1])) ->  | C48: 24 | T48: =(RC[-16]*RC[-15]-RC[-13]*RC[-12])/1000 -> #VALUE! | W48: =RC[-2]*RC[-10]/1000 -> #VALUE! | X48: =ABS((RC[-3]*RC[-11]-RC[-2]*RC[-9])/1000) -> #VALUE! | Y48: =RC[-14]/RC[-18]*100 -> #VALUE! | AC48: =VALUE(RC[-27]) -> #VALUE! | AD48: =IF(RC[21]=42,"*",IF(RC[21]=32,"",RC[21])) ->  | AE48: =RC[-28] -> 24 | AF48: =RC[-28] ->  | AG48: =RC[-28] ->  | AH48: =RC[-28] -> 0 | AI48: =RC[-28] ->  | AJ48: =RC[-28] ->  | AK48: =RC[-28] -> 0 | AL48: =RC[-28] -> 0 | AM48: =RC[-28] ->  | AN48: =RC[-28] -> 0 | AO48: =RC[-28] -> 0 | AP48: - | AQ48: =RC[-29] -> 0 | AR48: =RC[-29] -> 0 | AS48: - | AT48: =RC[-30] -> 0 | AU48: =RC[-30] -> 0 | AV48: =RC[-30] -> 0 | AW48: =RC[-30] -> 
A49: =IF(RC[1]="","",DATEVALUE(RC[1])) ->  | C49: 24 | T49: =(RC[-16]*RC[-15]-RC[-13]*RC[-12])/1000 -> #VALUE! | W49: =RC[-2]*RC[-10]/1000 -> #VALUE! | X49: =ABS((RC[-3]*RC[-11]-RC[-2]*RC[-9])/1000) -> #VALUE! | Y49: =RC[-14]/RC[-18]*100 -> #VALUE! | AC49: =VALUE(RC[-27]) -> #VALUE! | AD49: =IF(RC[21]=42,"*",IF(RC[21]=32,"",RC[21])) ->  | AE49: =RC[-28] -> 24 | AF49: =RC[-28] ->  | AG49: =RC[-28] ->  | AH49: =RC[-28] -> 0 | AI49: =RC[-28] ->  | AJ49: =RC[-28] ->  | AK49: =RC[-28] -> 0 | AL49: =RC[-28] -> 0 | AM49: =RC[-28] ->  | AN49: =RC[-28] -> 0 | AO49: =RC[-28] -> 0 | AP49: - | AQ49: =RC[-29] -> 0 | AR49: =RC[-29] -> 0 | AS49: - | AT49: =RC[-30] -> 0 | AU49: =RC[-30] -> 0 | AV49: =RC[-30] -> 0 | AW49: =RC[-30] -> 
A50: =IF(RC[1]="","",DATEVALUE(RC[1])) ->  | T50: =(RC[-16]*RC[-15]-RC[-13]*RC[-12])/1000 -> #VALUE! | W50: =RC[-2]*RC[-10]/1000 -> #VALUE! | X50: =ABS((RC[-3]*RC[-11]-RC[-2]*RC[-9])/1000) -> #VALUE! | Y50: =RC[-14]/RC[-18]*100 -> #VALUE! | AC50: =VALUE(RC[-27]) -> #VALUE! | AD50: =IF(RC[21]=42,"*",IF(RC[21]=32,"",RC[21])) ->  | AE50: =RC[-28] ->  | AF50: =RC[-28] ->  | AG50: =RC[-28] ->  | AH50: =RC[-28] -> 0 | AI50: =RC[-28] ->  | AJ50: =RC[-28] ->  | AK50: =RC[-28] -> 0 | AL50: =RC[-28] -> 0 | AM50: =RC[-28] ->  | AN50: =RC[-28] -> 0 | AO50: =RC[-28] -> 0 | AP50: - | AQ50: =RC[-29] -> 0 | AR50: =RC[-29] -> 0 | AS50: - | AT50: =RC[-30] -> 0 | AU50: =RC[-30] -> 0 | AV50: =RC[-30] -> 0 | AW50: =RC[-30] -> 
A51: =IF(RC[1]="","",DATEVALUE(RC[1])) ->  | T51: =(RC[-16]*RC[-15]-RC[-13]*RC[-12])/1000 -> #VALUE! | W51: =RC[-2]*RC[-10]/1000 -> #VALUE! | X51: =ABS((RC[-3]*RC[-11]-RC[-2]*RC[-9])/1000) -> #VALUE! | Y51: =RC[-14]/RC[-18]*100 -> #VALUE! | AC51: =VALUE(RC[-27]) -> #VALUE! | AD51: =IF(RC[21]=42,"*",IF(RC[21]=32,"",RC[21])) ->  | AE51: =RC[-28] ->  | AF51: =RC[-28] ->  | AG51: =RC[-28] ->  | AH51: =RC[-28] -> 0 | AI51: =RC[-28] ->  | AJ51: =RC[-28] ->  | AK51: =RC[-28] -> 0 | AL51: =RC[-28] -> 0 | AM51: =RC[-28] ->  | AN51: =RC[-28] -> 0 | AO51: =RC[-28] -> 0 | AP51: - | AQ51: =RC[-29] -> 0 | AR51: =RC[-29] -> 0 | AS51: - | AT51: =RC[-30] -> 0 | AU51: =RC[-30] -> 0 | AV51: =RC[-30] -> 0 | AW51: =RC[-30] -> 
A52: =IF(RC[1]="","",DATEVALUE(RC[1])) ->  | T52: =(RC[-16]*RC[-15]-RC[-13]*RC[-12])/1000 -> #VALUE! | W52: =RC[-2]*RC[-10]/1000 -> #VALUE! | X52: =ABS((RC[-3]*RC[-11]-RC[-2]*RC[-9])/1000) -> #VALUE! | Y52: =RC[-14]/RC[-18]*100 -> #VALUE! | AC52: =VALUE(RC[-27]) -> #VALUE! | AD52: =IF(RC[21]=42,"*",IF(RC[21]=32,"",RC[21])) ->  | AE52: =RC[-28] ->  | AF52: =RC[-28] ->  | AG52: =RC[-28] ->  | AH52: =RC[-28] -> 0 | AI52: =RC[-28] ->  | AJ52: =RC[-28] ->  | AK52: =RC[-28] -> 0 | AL52: =RC[-28] -> 0 | AM52: =RC[-28] ->  | AN52: =RC[-28] -> 0 | AO52: =RC[-28] -> 0 | AP52: - | AQ52: =RC[-29] -> 0 | AR52: =RC[-29] -> 0 | AS52: - | AT52: =RC[-30] -> 0 | AU52: =RC[-30] -> 0 | AV52: =RC[-30] -> 0 | AW52: =RC[-30] -> 
A53: =IF(RC[1]="","",DATEVALUE(RC[1])) ->  | T53: =(RC[-16]*RC[-15]-RC[-13]*RC[-12])/1000 -> #VALUE! | W53: =RC[-2]*RC[-10]/1000 -> #VALUE! | X53: =ABS((RC[-3]*RC[-11]-RC[-2]*RC[-9])/1000) -> #VALUE! | Y53: =RC[-14]/RC[-18]*100 -> #VALUE! | AC53: =VALUE(RC[-27]) -> #VALUE! | AD53: =IF(RC[21]=42,"*",IF(RC[21]=32,"",RC[21])) ->  | AE53: =RC[-28] ->  | AF53: =RC[-28] ->  | AG53: =RC[-28] ->  | AH53: =RC[-28] -> 0 | AI53: =RC[-28] ->  | AJ53: =RC[-28] ->  | AK53: =RC[-28] -> 0 | AL53: =RC[-28] -> 0 | AM53: =RC[-28] ->  | AN53: =RC[-28] -> 0 | AO53: =RC[-28] -> 0 | AP53: - | AQ53: =RC[-29] -> 0 | AR53: =RC[-29] -> 0 | AS53: - | AT53: =RC[-30] -> 0 | AU53: =RC[-30] -> 0 | AV53: =RC[-30] -> 0 | AW53: =RC[-30] -> 
A54: =IF(RC[1]="","",DATEVALUE(RC[1])) ->  | T54: =(RC[-16]*RC[-15]-RC[-13]*RC[-12])/1000 -> #VALUE! | W54: =RC[-2]*RC[-10]/1000 -> #VALUE! | X54: =ABS((RC[-3]*RC[-11]-RC[-2]*RC[-9])/1000) -> #VALUE! | Y54: =RC[-14]/RC[-18]*100 -> #VALUE! | AC54: =VALUE(RC[-27]) -> #VALUE! | AD54: =IF(RC[21]=42,"*",IF(RC[21]=32,"",RC[21])) ->  | AE54: =RC[-28] ->  | AF54: =RC[-28] ->  | AG54: =RC[-28] ->  | AH54: =RC[-28] -> 0 | AI54: =RC[-28] ->  | AJ54: =RC[-28] ->  | AK54: =RC[-28] -> 0 | AL54: =RC[-28] -> 0 | AM54: =RC[-28] ->  | AN54: =RC[-28] -> 0 | AO54: =RC[-28] -> 0 | AP54: - | AQ54: =RC[-29] -> 0 | AR54: =RC[-29] -> 0 | AS54: - | AT54: =RC[-30] -> 0 | AU54: =RC[-30] -> 0 | AV54: =RC[-30] -> 0 | AW54: =RC[-30] -> 
A55: =IF(RC[1]="","",DATEVALUE(RC[1])) ->  | T55: =(RC[-16]*RC[-15]-RC[-13]*RC[-12])/1000 -> #VALUE! | W55: =RC[-2]*RC[-10]/1000 -> #VALUE! | X55: =ABS((RC[-3]*RC[-11]-RC[-2]*RC[-9])/1000) -> #VALUE! | Y55: =RC[-14]/RC[-18]*100 -> #VALUE! | AC55: =VALUE(RC[-27]) -> #VALUE! | AD55: =IF(RC[21]=42,"*",IF(RC[21]=32,"",RC[21])) ->  | AE55: =RC[-28] ->  | AF55: =RC[-28] ->  | AG55: =RC[-28] ->  | AH55: =RC[-28] -> 0 | AI55: =RC[-28] ->  | AJ55: =RC[-28] ->  | AK55: =RC[-28] -> 0 | AL55: =RC[-28] -> 0 | AM55: =RC[-28] ->  | AN55: =RC[-28] -> 0 | AO55: =RC[-28] -> 0 | AP55: - | AQ55: =RC[-29] -> 0 | AR55: =RC[-29] -> 0 | AS55: - | AT55: =RC[-30] -> 0 | AU55: =RC[-30] -> 0 | AV55: =RC[-30] -> 0 | AW55: =RC[-30] -> 
A56: =IF(RC[1]="","",DATEVALUE(RC[1])) ->  | T56: =(RC[-16]*RC[-15]-RC[-13]*RC[-12])/1000 -> #VALUE! | W56: =RC[-2]*RC[-10]/1000 -> #VALUE! | X56: =ABS((RC[-3]*RC[-11]-RC[-2]*RC[-9])/1000) -> #VALUE! | Y56: =RC[-14]/RC[-18]*100 -> #VALUE! | AC56: =VALUE(RC[-27]) -> #VALUE! | AD56: =IF(RC[21]=42,"*",IF(RC[21]=32,"",RC[21])) ->  | AE56: =RC[-28] ->  | AF56: =RC[-28] ->  | AG56: =RC[-28] ->  | AH56: =RC[-28] -> 0 | AI56: =RC[-28] ->  | AJ56: =RC[-28] ->  | AK56: =RC[-28] -> 0 | AL56: =RC[-28] -> 0 | AM56: =RC[-28] ->  | AN56: =RC[-28] -> 0 | AO56: =RC[-28] -> 0 | AP56: - | AQ56: =RC[-29] -> 0 | AR56: =RC[-29] -> 0 | AS56: - | AT56: =RC[-30] -> 0 | AU56: =RC[-30] -> 0 | AV56: =RC[-30] -> 0 | AW56: =RC[-30] -> 
A57: =IF(RC[1]="","",DATEVALUE(RC[1])) ->  | T57: =(RC[-16]*RC[-15]-RC[-13]*RC[-12])/1000 -> #VALUE! | W57: =RC[-2]*RC[-10]/1000 -> #VALUE! | X57: =ABS((RC[-3]*RC[-11]-RC[-2]*RC[-9])/1000) -> #VALUE! | Y57: =RC[-14]/RC[-18]*100 -> #VALUE! | AC57: =VALUE(RC[-27]) -> #VALUE! | AD57: =IF(RC[21]=42,"*",IF(RC[21]=32,"",RC[21])) ->  | AE57: =RC[-28] ->  | AF57: =RC[-28] ->  | AG57: =RC[-28] ->  | AH57: =RC[-28] -> 0 | AI57: =RC[-28] ->  | AJ57: =RC[-28] ->  | AK57: =RC[-28] -> 0 | AL57: =RC[-28] -> 0 | AM57: =RC[-28] ->  | AN57: =RC[-28] -> 0 | AO57: =RC[-28] -> 0 | AP57: - | AQ57: =RC[-29] -> 0 | AR57: =RC[-29] -> 0 | AS57: - | AT57: =RC[-30] -> 0 | AU57: =RC[-30] -> 0 | AV57: =RC[-30] -> 0 | AW57: =RC[-30] -> 
A58: =IF(RC[1]="","",DATEVALUE(RC[1])) ->  | T58: =(RC[-16]*RC[-15]-RC[-13]*RC[-12])/1000 -> #VALUE! | W58: =RC[-2]*RC[-10]/1000 -> #VALUE! | X58: =ABS((RC[-3]*RC[-11]-RC[-2]*RC[-9])/1000) -> #VALUE! | Y58: =RC[-14]/RC[-18]*100 -> #VALUE! | AC58: =VALUE(RC[-27]) -> #VALUE! | AD58: =IF(RC[21]=42,"*",IF(RC[21]=32,"",RC[21])) ->  | AE58: =RC[-28] ->  | AF58: =RC[-28] ->  | AG58: =RC[-28] ->  | AH58: =RC[-28] -> 0 | AI58: =RC[-28] ->  | AJ58: =RC[-28] ->  | AK58: =RC[-28] -> 0 | AL58: =RC[-28] -> 0 | AM58: =RC[-28] ->  | AN58: =RC[-28] -> 0 | AO58: =RC[-28] -> 0 | AP58: - | AQ58: =RC[-29] -> 0 | AR58: =RC[-29] -> 0 | AS58: - | AT58: =RC[-30] -> 0 | AU58: =RC[-30] -> 0 | AV58: =RC[-30] -> 0 | AW58: =RC[-30] -> 
A59: =IF(RC[1]="","",DATEVALUE(RC[1])) ->  | T59: =(RC[-16]*RC[-15]-RC[-13]*RC[-12])/1000 -> #VALUE! | W59: =RC[-2]*RC[-10]/1000 -> #VALUE! | X59: =ABS((RC[-3]*RC[-11]-RC[-2]*RC[-9])/1000) -> #VALUE! | Y59: =RC[-14]/RC[-18]*100 -> #VALUE! | AC59: =VALUE(RC[-27]) -> #VALUE! | AD59: =IF(RC[21]=42,"*",IF(RC[21]=32,"",RC[21])) ->  | AE59: =RC[-28] ->  | AF59: =RC[-28] ->  | AG59: =RC[-28] ->  | AH59: =RC[-28] -> 0 | AI59: =RC[-28] ->  | AJ59: =RC[-28] ->  | AK59: =RC[-28] -> 0 | AL59: =RC[-28] -> 0 | AM59: =RC[-28] ->  | AN59: =RC[-28] -> 0 | AO59: =RC[-28] -> 0 | AP59: - | AQ59: =RC[-29] -> 0 | AR59: =RC[-29] -> 0 | AS59: - | AT59: =RC[-30] -> 0 | AU59: =RC[-30] -> 0 | AV59: =RC[-30] -> 0 | AW59: =RC[-30] -> 
A60: =IF(RC[1]="","",DATEVALUE(RC[1])) ->  | T60: =(RC[-16]*RC[-15]-RC[-13]*RC[-12])/1000 -> #VALUE! | W60: =RC[-2]*RC[-10]/1000 -> #VALUE! | X60: =ABS((RC[-3]*RC[-11]-RC[-2]*RC[-9])/1000) -> #VALUE! | Y60: =RC[-14]/RC[-18]*100 -> #VALUE! | AC60: =VALUE(RC[-27]) -> #VALUE! | AD60: =IF(RC[21]=42,"*",IF(RC[21]=32,"",RC[21])) ->  | AE60: =RC[-28] ->  | AF60: =RC[-28] ->  | AG60: =RC[-28] ->  | AH60: =RC[-28] -> 0 | AI60: =RC[-28] ->  | AJ60: =RC[-28] ->  | AK60: =RC[-28] -> 0 | AL60: =RC[-28] -> 0 | AM60: =RC[-28] ->  | AN60: =RC[-28] -> 0 | AO60: =RC[-28] -> 0 | AP60: - | AQ60: =RC[-29] -> 0 | AR60: =RC[-29] -> 0 | AS60: - | AT60: =RC[-30] -> 0 | AU60: =RC[-30] -> 0 | AV60: =RC[-30] -> 0 | AW60: =RC[-30] -> 
A61: =IF(RC[1]="","",DATEVALUE(RC[1])) ->  | T61: =(RC[-16]*RC[-15]-RC[-13]*RC[-12])/1000 -> #VALUE! | W61: =RC[-2]*RC[-10]/1000 -> #VALUE! | X61: =ABS((RC[-3]*RC[-11]-RC[-2]*RC[-9])/1000) -> #VALUE! | Y61: =RC[-14]/RC[-18]*100 -> #VALUE! | AC61: =VALUE(RC[-27]) -> #VALUE! | AD61: =IF(RC[21]=42,"*",IF(RC[21]=32,"",RC[21])) ->  | AE61: =RC[-28] ->  | AF61: =RC[-28] ->  | AG61: =RC[-28] ->  | AH61: =RC[-28] -> 0 | AI61: =RC[-28] ->  | AJ61: =RC[-28] ->  | AK61: =RC[-28] -> 0 | AL61: =RC[-28] -> 0 | AM61: =RC[-28] ->  | AN61: =RC[-28] -> 0 | AO61: =RC[-28] -> 0 | AP61: - | AQ61: =RC[-29] -> 0 | AR61: =RC[-29] -> 0 | AS61: - | AT61: =RC[-30] -> 0 | AU61: =RC[-30] -> 0 | AV61: =RC[-30] -> 0 | AW61: =RC[-30] -> 
A62: =IF(RC[1]="","",DATEVALUE(RC[1])) ->  | T62: =(RC[-16]*RC[-15]-RC[-13]*RC[-12])/1000 -> #VALUE! | W62: =RC[-2]*RC[-10]/1000 -> #VALUE! | X62: =ABS((RC[-3]*RC[-11]-RC[-2]*RC[-9])/1000) -> #VALUE! | Y62: =RC[-14]/RC[-18]*100 -> #VALUE! | AC62: =VALUE(RC[-27]) -> #VALUE! | AD62: =IF(RC[21]=42,"*",IF(RC[21]=32,"",RC[21])) ->  | AE62: =RC[-28] ->  | AF62: =RC[-28] ->  | AG62: =RC[-28] ->  | AH62: =RC[-28] -> 0 | AI62: =RC[-28] ->  | AJ62: =RC[-28] ->  | AK62: =RC[-28] -> 0 | AL62: =RC[-28] -> 0 | AM62: =RC[-28] ->  | AN62: =RC[-28] -> 0 | AO62: =RC[-28] -> 0 | AP62: - | AQ62: =RC[-29] -> 0 | AR62: =RC[-29] -> 0 | AS62: - | AT62: =RC[-30] -> 0 | AU62: =RC[-30] -> 0 | AV62: =RC[-30] -> 0 | AW62: =RC[-30] -> 
A63: =IF(RC[1]="","",DATEVALUE(RC[1])) ->  | T63: =(RC[-16]*RC[-15]-RC[-13]*RC[-12])/1000 -> #VALUE! | W63: =RC[-2]*RC[-10]/1000 -> #VALUE! | X63: =ABS((RC[-3]*RC[-11]-RC[-2]*RC[-9])/1000) -> #VALUE! | Y63: =RC[-14]/RC[-18]*100 -> #VALUE! | AC63: =VALUE(RC[-27]) -> #VALUE! | AD63: =IF(RC[21]=42,"*",IF(RC[21]=32,"",RC[21])) ->  | AE63: =RC[-28] ->  | AF63: =RC[-28] ->  | AG63: =RC[-28] ->  | AH63: =RC[-28] -> 0 | AI63: =RC[-28] ->  | AJ63: =RC[-28] ->  | AK63: =RC[-28] -> 0 | AL63: =RC[-28] -> 0 | AM63: =RC[-28] ->  | AN63: =RC[-28] -> 0 | AO63: =RC[-28] -> 0 | AP63: - | AQ63: =RC[-29] -> 0 | AR63: =RC[-29] -> 0 | AS63: - | AT63: =RC[-30] -> 0 | AU63: =RC[-30] -> 0 | AV63: =RC[-30] -> 0 | AW63: =RC[-30] -> 
A64: =IF(RC[1]="","",DATEVALUE(RC[1])) ->  | T64: =(RC[-16]*RC[-15]-RC[-13]*RC[-12])/1000 -> #VALUE! | W64: =RC[-2]*RC[-10]/1000 -> #VALUE! | X64: =ABS((RC[-3]*RC[-11]-RC[-2]*RC[-9])/1000) -> #VALUE! | Y64: =RC[-14]/RC[-18]*100 -> #VALUE! | AC64: =VALUE(RC[-27]) -> #VALUE! | AD64: =IF(RC[21]=42,"*",IF(RC[21]=32,"",RC[21])) ->  | AE64: =RC[-28] ->  | AF64: =RC[-28] ->  | AG64: =RC[-28] ->  | AH64: =RC[-28] -> 0 | AI64: =RC[-28] ->  | AJ64: =RC[-28] ->  | AK64: =RC[-28] -> 0 | AL64: =RC[-28] -> 0 | AM64: =RC[-28] ->  | AN64: =RC[-28] -> 0 | AO64: =RC[-28] -> 0 | AP64: - | AQ64: =RC[-29] -> 0 | AR64: =RC[-29] -> 0 | AS64: - | AT64: =RC[-30] -> 0 | AU64: =RC[-30] -> 0 | AV64: =RC[-30] -> 0 | AW64: =RC[-30] -> 
A65: =IF(RC[1]="","",DATEVALUE(RC[1])) ->  | T65: =(RC[-16]*RC[-15]-RC[-13]*RC[-12])/1000 -> #VALUE! | W65: =RC[-2]*RC[-10]/1000 -> #VALUE! | X65: =ABS((RC[-3]*RC[-11]-RC[-2]*RC[-9])/1000) -> #VALUE! | Y65: =RC[-14]/RC[-18]*100 -> #VALUE! | AC65: =VALUE(RC[-27]) -> #VALUE! | AD65: =IF(RC[21]=42,"*",IF(RC[21]=32,"",RC[21])) ->  | AE65: =RC[-28] ->  | AF65: =RC[-28] ->  | AG65: =RC[-28] ->  | AH65: =RC[-28] -> 0 | AI65: =RC[-28] ->  | AJ65: =RC[-28] ->  | AK65: =RC[-28] -> 0 | AL65: =RC[-28] -> 0 | AM65: =RC[-28] ->  | AN65: =RC[-28] -> 0 | AO65: =RC[-28] -> 0 | AP65: - | AQ65: =RC[-29] -> 0 | AR65: =RC[-29] -> 0 | AS65: - | AT65: =RC[-30] -> 0 | AU65: =RC[-30] -> 0 | AV65: =RC[-30] -> 0 | AW65: =RC[-30] -> 
A66: =IF(RC[1]="","",DATEVALUE(RC[1])) ->  | T66: =(RC[-16]*RC[-15]-RC[-13]*RC[-12])/1000 -> #VALUE! | W66: =RC[-2]*RC[-10]/1000 -> #VALUE! | X66: =ABS((RC[-3]*RC[-11]-RC[-2]*RC[-9])/1000) -> #VALUE! | Y66: =RC[-14]/RC[-18]*100 -> #VALUE! | AC66: =VALUE(RC[-27]) -> #VALUE! | AD66: =IF(RC[21]=42,"*",IF(RC[21]=32,"",RC[21])) ->  | AE66: =RC[-28] ->  | AF66: =RC[-28] ->  | AG66: =RC[-28] ->  | AH66: =RC[-28] -> 0 | AI66: =RC[-28] ->  | AJ66: =RC[-28] ->  | AK66: =RC[-28] -> 0 | AL66: =RC[-28] -> 0 | AM66: =RC[-28] ->  | AN66: =RC[-28] -> 0 | AO66: =RC[-28] -> 0 | AP66: - | AQ66: =RC[-29] -> 0 | AR66: =RC[-29] -> 0 | AS66: - | AT66: =RC[-30] -> 0 | AU66: =RC[-30] -> 0 | AV66: =RC[-30] -> 0 | AW66: =RC[-30] -> 
A67: =IF(RC[1]="","",DATEVALUE(RC[1])) ->  | T67: =(RC[-16]*RC[-15]-RC[-13]*RC[-12])/1000 -> #VALUE! | W67: =RC[-2]*RC[-10]/1000 -> #VALUE! | X67: =ABS((RC[-3]*RC[-11]-RC[-2]*RC[-9])/1000) -> #VALUE! | Y67: =RC[-14]/RC[-18]*100 -> #VALUE! | AC67: =VALUE(RC[-27]) -> #VALUE! | AD67: =IF(RC[21]=42,"*",IF(RC[21]=32,"",RC[21])) ->  | AE67: =RC[-28] ->  | AF67: =RC[-28] ->  | AG67: =RC[-28] ->  | AH67: =RC[-28] -> 0 | AI67: =RC[-28] ->  | AJ67: =RC[-28] ->  | AK67: =RC[-28] -> 0 | AL67: =RC[-28] -> 0 | AM67: =RC[-28] ->  | AN67: =RC[-28] -> 0 | AO67: =RC[-28] -> 0 | AP67: - | AQ67: =RC[-29] -> 0 | AR67: =RC[-29] -> 0 | AS67: - | AT67: =RC[-30] -> 0 | AU67: =RC[-30] -> 0 | AV67: =RC[-30] -> 0 | AW67: =RC[-30] -> 
A68: =IF(RC[1]="","",DATEVALUE(RC[1])) ->  | T68: =(RC[-16]*RC[-15]-RC[-13]*RC[-12])/1000 -> #VALUE! | W68: =RC[-2]*RC[-10]/1000 -> #VALUE! | X68: =ABS((RC[-3]*RC[-11]-RC[-2]*RC[-9])/1000) -> #VALUE! | Y68: =RC[-14]/RC[-18]*100 -> #VALUE! | AC68: =VALUE(RC[-27]) -> #VALUE! | AD68: =IF(RC[21]=42,"*",IF(RC[21]=32,"",RC[21])) ->  | AE68: =RC[-28] ->  | AF68: =RC[-28] ->  | AG68: =RC[-28] ->  | AH68: =RC[-28] -> 0 | AI68: =RC[-28] ->  | AJ68: =RC[-28] ->  | AK68: =RC[-28] -> 0 | AL68: =RC[-28] -> 0 | AM68: =RC[-28] ->  | AN68: =RC[-28] -> 0 | AO68: =RC[-28] -> 0 | AP68: - | AQ68: =RC[-29] -> 0 | AR68: =RC[-29] -> 0 | AS68: - | AT68: =RC[-30] -> 0 | AU68: =RC[-30] -> 0 | AV68: =RC[-30] -> 0 | AW68: =RC[-30] -> 
A69: =IF(RC[1]="","",DATEVALUE(RC[1])) ->  | T69: =(RC[-16]*RC[-15]-RC[-13]*RC[-12])/1000 -> #VALUE! | W69: =RC[-2]*RC[-10]/1000 -> #VALUE! | X69: =ABS((RC[-3]*RC[-11]-RC[-2]*RC[-9])/1000) -> #VALUE! | Y69: =RC[-14]/RC[-18]*100 -> #VALUE! | AC69: =VALUE(RC[-27]) -> #VALUE! | AD69: =IF(RC[21]=42,"*",IF(RC[21]=32,"",RC[21])) ->  | AE69: =RC[-28] ->  | AF69: =RC[-28] ->  | AG69: =RC[-28] ->  | AH69: =RC[-28] -> 0 | AI69: =RC[-28] ->  | AJ69: =RC[-28] ->  | AK69: =RC[-28] -> 0 | AL69: =RC[-28] -> 0 | AM69: =RC[-28] ->  | AN69: =RC[-28] -> 0 | AO69: =RC[-28] -> 0 | AP69: - | AQ69: =RC[-29] -> 0 | AR69: =RC[-29] -> 0 | AS69: - | AT69: =RC[-30] -> 0 | AU69: =RC[-30] -> 0 | AV69: =RC[-30] -> 0 | AW69: =RC[-30] -> 
A70: =IF(RC[1]="","",DATEVALUE(RC[1])) ->  | T70: =(RC[-16]*RC[-15]-RC[-13]*RC[-12])/1000 -> #VALUE! | W70: =RC[-2]*RC[-10]/1000 -> #VALUE! | X70: =ABS((RC[-3]*RC[-11]-RC[-2]*RC[-9])/1000) -> #VALUE! | Y70: =RC[-14]/RC[-18]*100 -> #VALUE! | AC70: =VALUE(RC[-27]) -> #VALUE! | AD70: =IF(RC[21]=42,"*",IF(RC[21]=32,"",RC[21])) ->  | AE70: =RC[-28] ->  | AF70: =RC[-28] ->  | AG70: =RC[-28] ->  | AH70: =RC[-28] -> 0 | AI70: =RC[-28] ->  | AJ70: =RC[-28] ->  | AK70: =RC[-28] -> 0 | AL70: =RC[-28] -> 0 | AM70: =RC[-28] ->  | AN70: =RC[-28] -> 0 | AO70: =RC[-28] -> 0 | AP70: - | AQ70: =RC[-29] -> 0 | AR70: =RC[-29] -> 0 | AS70: - | AT70: =RC[-30] -> 0 | AU70: =RC[-30] -> 0 | AV70: =RC[-30] -> 0 | AW70: =RC[-30] -> 
A71: =IF(RC[1]="","",DATEVALUE(RC[1])) ->  | T71: =(RC[-16]*RC[-15]-RC[-13]*RC[-12])/1000 -> #VALUE! | W71: =RC[-2]*RC[-10]/1000 -> #VALUE! | X71: =ABS((RC[-3]*RC[-11]-RC[-2]*RC[-9])/1000) -> #VALUE! | Y71: =RC[-14]/RC[-18]*100 -> #VALUE! | AC71: =VALUE(RC[-27]) -> #VALUE! | AD71: =IF(RC[21]=42,"*",IF(RC[21]=32,"",RC[21])) ->  | AE71: =RC[-28] ->  | AF71: =RC[-28] ->  | AG71: =RC[-28] ->  | AH71: =RC[-28] -> 0 | AI71: =RC[-28] ->  | AJ71: =RC[-28] ->  | AK71: =RC[-28] -> 0 | AL71: =RC[-28] -> 0 | AM71: =RC[-28] ->  | AN71: =RC[-28] -> 0 | AO71: =RC[-28] -> 0 | AP71: - | AQ71: =RC[-29] -> 0 | AR71: =RC[-29] -> 0 | AS71: - | AT71: =RC[-30] -> 0 | AU71: =RC[-30] -> 0 | AV71: =RC[-30] -> 0 | AW71: =RC[-30] -> 
A72: =IF(RC[1]="","",DATEVALUE(RC[1])) ->  | T72: =(RC[-16]*RC[-15]-RC[-13]*RC[-12])/1000 -> #VALUE! | W72: =RC[-2]*RC[-10]/1000 -> #VALUE! | X72: =ABS((RC[-3]*RC[-11]-RC[-2]*RC[-9])/1000) -> #VALUE! | Y72: =RC[-14]/RC[-18]*100 -> #VALUE! | AC72: =VALUE(RC[-27]) -> #VALUE! | AD72: =IF(RC[21]=42,"*",IF(RC[21]=32,"",RC[21])) ->  | AE72: =RC[-28] ->  | AF72: =RC[-28] ->  | AG72: =RC[-28] ->  | AH72: =RC[-28] -> 0 | AI72: =RC[-28] ->  | AJ72: =RC[-28] ->  | AK72: =RC[-28] -> 0 | AL72: =RC[-28] -> 0 | AM72: =RC[-28] ->  | AN72: =RC[-28] -> 0 | AO72: =RC[-28] -> 0 | AP72: - | AQ72: =RC[-29] -> 0 | AR72: =RC[-29] -> 0 | AS72: - | AT72: =RC[-30] -> 0 | AU72: =RC[-30] -> 0 | AV72: =RC[-30] -> 0 | AW72: =RC[-30] -> 
A73: =IF(RC[1]="","",DATEVALUE(RC[1])) ->  | T73: =(RC[-16]*RC[-15]-RC[-13]*RC[-12])/1000 -> #VALUE! | W73: =RC[-2]*RC[-10]/1000 -> #VALUE! | X73: =ABS((RC[-3]*RC[-11]-RC[-2]*RC[-9])/1000) -> #VALUE! | Y73: =RC[-14]/RC[-18]*100 -> #VALUE! | AC73: =VALUE(RC[-27]) -> #VALUE! | AD73: =IF(RC[21]=42,"*",IF(RC[21]=32,"",RC[21])) ->  | AE73: =RC[-28] ->  | AF73: =RC[-28] ->  | AG73: =RC[-28] ->  | AH73: =RC[-28] -> 0 | AI73: =RC[-28] ->  | AJ73: =RC[-28] ->  | AK73: =RC[-28] -> 0 | AL73: =RC[-28] -> 0 | AM73: =RC[-28] ->  | AN73: =RC[-28] -> 0 | AO73: =RC[-28] -> 0 | AP73: - | AQ73: =RC[-29] -> 0 | AR73: =RC[-29] -> 0 | AS73: - | AT73: =RC[-30] -> 0 | AU73: =RC[-30] -> 0 | AV73: =RC[-30] -> 0 | AW73: =RC[-30] -> 
A74: =IF(RC[1]="","",DATEVALUE(RC[1])) ->  | T74: =(RC[-16]*RC[-15]-RC[-13]*RC[-12])/1000 -> #VALUE! | W74: =RC[-2]*RC[-10]/1000 -> #VALUE! | X74: =ABS((RC[-3]*RC[-11]-RC[-2]*RC[-9])/1000) -> #VALUE! | Y74: =RC[-14]/RC[-18]*100 -> #VALUE! | AC74: =VALUE(RC[-27]) -> #VALUE! | AD74: =IF(RC[21]=42,"*",IF(RC[21]=32,"",RC[21])) ->  | AE74: =RC[-28] ->  | AF74: =RC[-28] ->  | AG74: =RC[-28] ->  | AH74: =RC[-28] -> 0 | AI74: =RC[-28] ->  | AJ74: =RC[-28] ->  | AK74: =RC[-28] -> 0 | AL74: =RC[-28] -> 0 | AM74: =RC[-28] ->  | AN74: =RC[-28] -> 0 | AO74: =RC[-28] -> 0 | AP74: - | AQ74: =RC[-29] -> 0 | AR74: =RC[-29] -> 0 | AS74: - | AT74: =RC[-30] -> 0 | AU74: =RC[-30] -> 0 | AV74: =RC[-30] -> 0 | AW74: =RC[-30] -> 
A75: =IF(RC[1]="","",DATEVALUE(RC[1])) ->  | T75: =(RC[-16]*RC[-15]-RC[-13]*RC[-12])/1000 -> #VALUE! | W75: =RC[-2]*RC[-10]/1000 -> #VALUE! | X75: =ABS((RC[-3]*RC[-11]-RC[-2]*RC[-9])/1000) -> #VALUE! | Y75: =RC[-14]/RC[-18]*100 -> #VALUE! | AC75: =VALUE(RC[-27]) -> #VALUE! | AD75: =IF(RC[21]=42,"*",IF(RC[21]=32,"",RC[21])) ->  | AE75: =RC[-28] ->  | AF75: =RC[-28] ->  | AG75: =RC[-28] ->  | AH75: =RC[-28] -> 0 | AI75: =RC[-28] ->  | AJ75: =RC[-28] ->  | AK75: =RC[-28] -> 0 | AL75: =RC[-28] -> 0 | AM75: =RC[-28] ->  | AN75: =RC[-28] -> 0 | AO75: =RC[-28] -> 0 | AP75: - | AQ75: =RC[-29] -> 0 | AR75: =RC[-29] -> 0 | AS75: - | AT75: =RC[-30] -> 0 | AU75: =RC[-30] -> 0 | AV75: =RC[-30] -> 0 | AW75: =RC[-30] -> 
A76: =IF(RC[1]="","",DATEVALUE(RC[1])) ->  | T76: =(RC[-16]*RC[-15]-RC[-13]*RC[-12])/1000 -> #VALUE! | W76: =RC[-2]*RC[-10]/1000 -> #VALUE! | X76: =ABS((RC[-3]*RC[-11]-RC[-2]*RC[-9])/1000) -> #VALUE! | Y76: =RC[-14]/RC[-18]*100 -> #VALUE! | AC76: =VALUE(RC[-27]) -> #VALUE! | AD76: =IF(RC[21]=42,"*",IF(RC[21]=32,"",RC[21])) ->  | AE76: =RC[-28] ->  | AF76: =RC[-28] ->  | AG76: =RC[-28] ->  | AH76: =RC[-28] -> 0 | AI76: =RC[-28] ->  | AJ76: =RC[-28] ->  | AK76: =RC[-28] -> 0 | AL76: =RC[-28] -> 0 | AM76: =RC[-28] ->  | AN76: =RC[-28] -> 0 | AO76: =RC[-28] -> 0 | AP76: - | AQ76: =RC[-29] -> 0 | AR76: =RC[-29] -> 0 | AS76: - | AT76: =RC[-30] -> 0 | AU76: =RC[-30] -> 0 | AV76: =RC[-30] -> 0 | AW76: =RC[-30] -> 
A77: =IF(RC[1]="","",DATEVALUE(RC[1])) ->  | T77: =(RC[-16]*RC[-15]-RC[-13]*RC[-12])/1000 -> #VALUE! | W77: =RC[-2]*RC[-10]/1000 -> #VALUE! | X77: =ABS((RC[-3]*RC[-11]-RC[-2]*RC[-9])/1000) -> #VALUE! | Y77: =RC[-14]/RC[-18]*100 -> #VALUE! | AC77: =VALUE(RC[-27]) -> #VALUE! | AD77: =IF(RC[21]=42,"*",IF(RC[21]=32,"",RC[21])) ->  | AE77: =RC[-28] ->  | AF77: =RC[-28] ->  | AG77: =RC[-28] ->  | AH77: =RC[-28] -> 0 | AI77: =RC[-28] ->  | AJ77: =RC[-28] ->  | AK77: =RC[-28] -> 0 | AL77: =RC[-28] -> 0 | AM77: =RC[-28] ->  | AN77: =RC[-28] -> 0 | AO77: =RC[-28] -> 0 | AP77: - | AQ77: =RC[-29] -> 0 | AR77: =RC[-29] -> 0 | AS77: - | AT77: =RC[-30] -> 0 | AU77: =RC[-30] -> 0 | AV77: =RC[-30] -> 0 | AW77: =RC[-30] -> 
A78: =IF(RC[1]="","",DATEVALUE(RC[1])) ->  | T78: =(RC[-16]*RC[-15]-RC[-13]*RC[-12])/1000 -> #VALUE! | W78: =RC[-2]*RC[-10]/1000 -> #VALUE! | X78: =ABS((RC[-3]*RC[-11]-RC[-2]*RC[-9])/1000) -> #VALUE! | Y78: =RC[-14]/RC[-18]*100 -> #VALUE! | AC78: =VALUE(RC[-27]) -> #VALUE! | AD78: =IF(RC[21]=42,"*",IF(RC[21]=32,"",RC[21])) ->  | AE78: =RC[-28] ->  | AF78: =RC[-28] ->  | AG78: =RC[-28] ->  | AH78: =RC[-28] -> 0 | AI78: =RC[-28] ->  | AJ78: =RC[-28] ->  | AK78: =RC[-28] -> 0 | AL78: =RC[-28] -> 0 | AM78: =RC[-28] ->  | AN78: =RC[-28] -> 0 | AO78: =RC[-28] -> 0 | AP78: - | AQ78: =RC[-29] -> 0 | AR78: =RC[-29] -> 0 | AS78: - | AT78: =RC[-30] -> 0 | AU78: =RC[-30] -> 0 | AV78: =RC[-30] -> 0 | AW78: =RC[-30] -> 
A79: =IF(RC[1]="","",DATEVALUE(RC[1])) ->  | T79: =(RC[-16]*RC[-15]-RC[-13]*RC[-12])/1000 -> #VALUE! | W79: =RC[-2]*RC[-10]/1000 -> #VALUE! | X79: =ABS((RC[-3]*RC[-11]-RC[-2]*RC[-9])/1000) -> #VALUE! | Y79: =RC[-14]/RC[-18]*100 -> #VALUE! | AC79: =VALUE(RC[-27]) -> #VALUE! | AD79: =IF(RC[21]=42,"*",IF(RC[21]=32,"",RC[21])) ->  | AE79: =RC[-28] ->  | AF79: =RC[-28] ->  | AG79: =RC[-28] ->  | AH79: =RC[-28] -> 0 | AI79: =RC[-28] ->  | AJ79: =RC[-28] ->  | AK79: =RC[-28] -> 0 | AL79: =RC[-28] -> 0 | AM79: =RC[-28] ->  | AN79: =RC[-28] -> 0 | AO79: =RC[-28] -> 0 | AP79: - | AQ79: =RC[-29] -> 0 | AR79: =RC[-29] -> 0 | AS79: - | AT79: =RC[-30] -> 0 | AU79: =RC[-30] -> 0 | AV79: =RC[-30] -> 0 | AW79: =RC[-30] -> 
A80: =IF(RC[1]="","",DATEVALUE(RC[1])) ->  | T80: =(RC[-16]*RC[-15]-RC[-13]*RC[-12])/1000 -> #VALUE! | W80: =RC[-2]*RC[-10]/1000 -> #VALUE! | X80: =ABS((RC[-3]*RC[-11]-RC[-2]*RC[-9])/1000) -> #VALUE! | Y80: =RC[-14]/RC[-18]*100 -> #VALUE! | AC80: =VALUE(RC[-27]) -> #VALUE! | AD80: =IF(RC[21]=42,"*",IF(RC[21]=32,"",RC[21])) ->  | AE80: =RC[-28] ->  | AF80: =RC[-28] ->  | AG80: =RC[-28] ->  | AH80: =RC[-28] -> 0 | AI80: =RC[-28] ->  | AJ80: =RC[-28] ->  | AK80: =RC[-28] -> 0 | AL80: =RC[-28] -> 0 | AM80: =RC[-28] ->  | AN80: =RC[-28] -> 0 | AO80: =RC[-28] -> 0 | AP80: - | AQ80: =RC[-29] -> 0 | AR80: =RC[-29] -> 0 | AS80: - | AT80: =RC[-30] -> 0 | AU80: =RC[-30] -> 0 | AV80: =RC[-30] -> 0 | AW80: =RC[-30] -> 
A81: =IF(RC[1]="","",DATEVALUE(RC[1])) ->  | T81: =(RC[-16]*RC[-15]-RC[-13]*RC[-12])/1000 -> #VALUE! | W81: =RC[-2]*RC[-10]/1000 -> #VALUE! | X81: =ABS((RC[-3]*RC[-11]-RC[-2]*RC[-9])/1000) -> #VALUE! | Y81: =RC[-14]/RC[-18]*100 -> #VALUE! | AC81: =VALUE(RC[-27]) -> #VALUE! | AD81: =IF(RC[21]=42,"*",IF(RC[21]=32,"",RC[21])) ->  | AE81: =RC[-28] ->  | AF81: =RC[-28] ->  | AG81: =RC[-28] ->  | AH81: =RC[-28] -> 0 | AI81: =RC[-28] ->  | AJ81: =RC[-28] ->  | AK81: =RC[-28] -> 0 | AL81: =RC[-28] -> 0 | AM81: =RC[-28] ->  | AN81: =RC[-28] -> 0 | AO81: =RC[-28] -> 0 | AP81: - | AQ81: =RC[-29] -> 0 | AR81: =RC[-29] -> 0 | AS81: - | AT81: =RC[-30] -> 0 | AU81: =RC[-30] -> 0 | AV81: =RC[-30] -> 0 | AW81: =RC[-30] -> 
A82: =IF(RC[1]="","",DATEVALUE(RC[1])) ->  | T82: =(RC[-16]*RC[-15]-RC[-13]*RC[-12])/1000 -> #VALUE! | W82: =RC[-2]*RC[-10]/1000 -> #VALUE! | X82: =ABS((RC[-3]*RC[-11]-RC[-2]*RC[-9])/1000) -> #VALUE! | Y82: =RC[-14]/RC[-18]*100 -> #VALUE! | AC82: =VALUE(RC[-27]) -> #VALUE! | AD82: =IF(RC[21]=42,"*",IF(RC[21]=32,"",RC[21])) ->  | AE82: =RC[-28] ->  | AF82: =RC[-28] ->  | AG82: =RC[-28] ->  | AH82: =RC[-28] -> 0 | AI82: =RC[-28] ->  | AJ82: =RC[-28] ->  | AK82: =RC[-28] -> 0 | AL82: =RC[-28] -> 0 | AM82: =RC[-28] ->  | AN82: =RC[-28] -> 0 | AO82: =RC[-28] -> 0 | AP82: - | AQ82: =RC[-29] -> 0 | AR82: =RC[-29] -> 0 | AS82: - | AT82: =RC[-30] -> 0 | AU82: =RC[-30] -> 0 | AV82: =RC[-30] -> 0 | AW82: =RC[-30] -> 
A83: =IF(RC[1]="","",DATEVALUE(RC[1])) ->  | T83: =(RC[-16]*RC[-15]-RC[-13]*RC[-12])/1000 -> #VALUE! | W83: =RC[-2]*RC[-10]/1000 -> #VALUE! | X83: =ABS((RC[-3]*RC[-11]-RC[-2]*RC[-9])/1000) -> #VALUE! | Y83: =RC[-14]/RC[-18]*100 -> #VALUE! | AC83: =VALUE(RC[-27]) -> #VALUE! | AD83: =IF(RC[21]=42,"*",IF(RC[21]=32,"",RC[21])) ->  | AE83: =RC[-28] ->  | AF83: =RC[-28] ->  | AG83: =RC[-28] ->  | AH83: =RC[-28] -> 0 | AI83: =RC[-28] ->  | AJ83: =RC[-28] ->  | AK83: =RC[-28] -> 0 | AL83: =RC[-28] -> 0 | AM83: =RC[-28] ->  | AN83: =RC[-28] -> 0 | AO83: =RC[-28] -> 0 | AP83: - | AQ83: =RC[-29] -> 0 | AR83: =RC[-29] -> 0 | AS83: - | AT83: =RC[-30] -> 0 | AU83: =RC[-30] -> 0 | AV83: =RC[-30] -> 0 | AW83: =RC[-30] -> 
AC84: Среднее | AF84: =R[1]C[-28] -> 41.479914300000004 | AG84: =R[1]C[-28] -> 59.689692300000011 | AH84: =R[1]C[-28] -> 0 | AI84: =R[1]C[-28] -> 41.955617999999994 | AJ84: =R[1]C[-28] -> 38.329852333333328 | AK84: =R[1]C[-28] -> 0 | AL84: =R[1]C[-28] -> 21.359839966666677 | AM84: =R[1]C[-28] -> -0.47594576666666633 | AN84: =R[1]C[-28] -> 0 | AO84: =R[1]C[-28] -> 0 | AP84: - | AQ84: =R[1]C[-29] -> 0 | AR84: =R[1]C[-29] -> 0 | AS84: - | AT84: =R[1]C[-30] -> 0 | AU84: =R[1]C[-30] -> 0
B85: Среднее | D85: =AVERAGE(OFFSET(R[-74]C,3,0,R7C1,1)) -> 41.479914300000004 | E85: =AVERAGE(OFFSET(R[-74]C,3,0,R7C1,1)) -> 59.689692300000011 | G85: =AVERAGE(OFFSET(R[-74]C,3,0,R7C1,1)) -> 41.955617999999994 | H85: =AVERAGE(OFFSET(R[-74]C,3,0,R7C1,1)) -> 38.329852333333328 | J85: =AVERAGE(OFFSET(R[-74]C,3,0,R7C1,1)) -> 21.359839966666677 | K85: =AVERAGE(OFFSET(R[-74]C,3,0,R7C1,1)) -> -0.47594576666666633 | S85: =AVERAGE(OFFSET(R[-74]C,3,0,R7C1,1)) -> 0.9738577569260537 | T85: =AVERAGE(OFFSET(R[-74]C,3,0,R7C1,1)) -> 0.97390197293340564 | W85: =AVERAGE(OFFSET(R[-74]C,3,0,R7C1,1)) -> #VALUE! | X85: =AVERAGE(OFFSET(R[-74]C,3,0,R7C1,1)) -> #VALUE! | AC85: Итого | AE85: =R[1]C[-28] -> 720 | AF85: =R[1]C[-28] -> 1244.3974290000001 | AI85: =R[1]C[-28] -> 1258.6685399999999 | AM85: =R[1]C[-28] -> -14.27837299999999 | AN85: =R[1]C[-28] -> 0 | AQ85: =R[1]C[-29] -> 0 | AU85: =R[1]C[-30] -> 0 | AV85: =R[1]C[-30] -> 0 | AW85: =R[1]C[-30] -> 29.215732707781612
B86: ИТОГО: | C86: =SUM(OFFSET(R[-75]C,3,0,R7C1,1)) -> 720 | D86: =SUM(OFFSET(R[-75]C,3,0,R7C1,1)) -> 1244.3974290000001 | G86: =SUM(OFFSET(R[-75]C,3,0,R7C1,1)) -> 1258.6685399999999 | K86: =SUM(OFFSET(R[-75]C,3,0,R7C1,1)) -> -14.27837299999999 | S86: =SUM(OFFSET(R[-75]C,3,0,R7C1,1)) -> 29.215732707781612 | T86: =SUM(OFFSET(R[-75]C,3,0,R7C1,1)) -> 29.217059188002168 | W86: =SUM(OFFSET(R[-75]C,3,0,R7C1,1)) -> #VALUE! | X86: =SUM(OFFSET(R[-75]C,3,0,R7C1,1)) -> #VALUE!
AC87: Досчёт | AF87: =R[1]C[-28] -> 0 | AI87: =R[1]C[-28] -> 0 | AM87: =R[1]C[-28] -> 0 | AN87: =R[1]C[-28] -> 0 | AQ87: =R[1]C[-29] -> 0 | AU87: =R[1]C[-30] -> 0 | AV87: =R[1]C[-30] -> 0 | AW87: =R[1]C[-30] -> 0
A88: 11дн=264ч 4дн=96ч | B88: Досчёт до конца м-ца (+) | C88: =R6C1*24 -> 216 | T88: № 26955 | AC88: Снятие | AF88: =-R[1]C[-28] -> 0 | AI88: =-R[1]C[-28] -> 0 | AM88: =-R[1]C[-28] -> 0 | AN88: =-R[1]C[-28] -> 0 | AQ88: =-R[1]C[-29] -> 0 | AU88: =-R[1]C[-30] -> 0 | AV88: =-R[1]C[-30] -> 0 | AW88: =-R[1]C[-30] -> 0
A89: 9дн=216ч 7дн=168ч | B89: Вычет с предыдущего (-) | C89: =R4C1*24 -> 192 | AC89: Сумма | AF89: =R[1]C[-28] -> 1244.3974290000001 | AI89: =R[1]C[-28] -> 1258.6685399999999 | AM89: =R[1]C[-28] -> -14.27837299999999 | AN89: =R[1]C[-28] -> 0 | AQ89: =R[1]C[-29] -> 0 | AU89: =R[1]C[-30] -> 0 | AV89: =R[1]C[-30] -> 0 | AW89: =R[1]C[-30] -> 29.215732707781612
B90: СУММА: | C90: =R[-4]C+R[-2]C-R[-1]C -> 744 | D90: =R[-4]C+R[-2]C-R[-1]C -> 1244.3974290000001 | G90: =R[-4]C+R[-2]C-R[-1]C -> 1258.6685399999999 | K90: =R[-4]C+R[-2]C-R[-1]C -> -14.27837299999999 | S90: =R[-4]C+R[-2]C-R[-1]C -> 29.215732707781612
AC91: Тхв на источнике | AE91: V гвс (м3) | AF91: =R[-2]C[15] -> 0 | AG91: W гвс (Гкал) | AH91: =RC[-2]*0.06 -> 0 | AI91: W без гвс (Гкал) | AJ91: =R[-2]C[13]-RC[-2] -> 29.215732707781612
B92: Показания счетчиков на момент снятия данных:
B93: Дата, время | D93: М1, т | F93: М2, т | H93: М3, т | J93: М4, т | L93: Qо, Гкал | N93: Qг, Гкал | P93: время, час
B94: 23.09.18 01:00 | D94: 39011.307439999997 | F94: 39563.858659999998 | H94: - | J94: - | L94: - | N94: - | P94: 34834.966670000002
B95: 18.10.18 09:00 | D95: 39760.449509999999 | F95: 40321.492969999999 | H95: - | J95: - | L95: - | N95: - | P95: 35442.966670000002
AC97: =ZAYAVKA_N -> з.н д. №02/147-2783 от 04.10.18 с 27.09.18г по 02.10.18г некорректная работа приборов
B98: Представитель потребителя:_______________________________________________________________________ В.О. Топорков
I101: Рекомендуемые значения по параметрам теплопотребления (не являются официально утверждёнными)
I102: М, т | J102: V, м3 | K102: Qгвс, Гкал | L102: Qотоп, Гкал | M102: Qо, Гкал
I103: =R[-13]C[-3] -> 0 | J103: =RC[-1]/0.98 -> 0 | K103: =RC[-1]*0.06 -> 0 | L103: =RC[1]-RC[-1] -> 0 | M103: =R[-13]C[5] -> 0
O105: ДЛЯ САМОКОНТРОЛЯ
B106: В строке выбора дат указать период с 16.7.13 по 23.8.13 - жильё | N106: Q | O106: Qг
B107: В строке выбора дат указать период с 18.7.13 по 25.8.13 - не жилое | N107: =(R[-21]C[-10]*R[-22]C[-7]-R[-21]C[-9]*R[-22]C[-6])/1000 -> 52.209463171306119 | O107: =IF(R[-22]C[-2]="",R[-21]C[-3]*R[-22]C/1000,"") -> 0 | P107: Си2
O108: =IF(R[-23]C[-2]="","",((R[-22]C[-3]*R[-23]C)-(R[-22]C[-2]*R[-23]C[2]))/1000) ->  | P108: Си3