Sheet: Лист1
G1: Отчёт о теплопотреблении за сентябрь 2018 | M1: письмо В данном отчете ГВС суммируется
A4: =EOMONTH(R[9]C,0)-R[9]C -> 9 | B4: Потребитель: ЗАО "Сити Сервис"
A5: =MAX(R[9]C:R[78]C) -> 2018-09-22T00:00:00.000 | B5: Адрес: г. СПб, Кораблестроителей ул., д.29 к.5 ИТП 1
A6: =EOMONTH(R[-1]C,0)-R[-1]C -> 8 | B6: Телефон: 8-911-021-19-79
A7: =R[-2]C-R[6]C -> 31 | B7: Договор 10023-2 (.) 326
A8: 7 | B8: Тепловычислитель: СПТ-943 № 10060 | L8: М2 мах= | M8: 114 | O8: Мгвс мах= | P8: 27.36
L9: Qотоп мах= | M9: 9.12 | O9: Qгвс мах= | P9: 1.642
B10: Расчётная формула: Q=M1*(h1-h2)+(M1-M2)*(h2-hхв)
D12: Учет | L12: Контроль
A13: =R[1]C[1]-1 -> 2018-08-22T00:00:00.000 | B13: Дата | C13: N, ч | D13: M1, т | E13: T1, С | F13: P1, кг/см2 | G13: M2, т | H13: T2, С | I13: P2, кг/см2 | J13: dT, С | K13: M1-М2, т | L13: V3, м3 | M13: T3, С | N13: V4, м3 | O13: =IF(R[-12]C[-14]="м.куб","","T4, С") -> T4, С | P13: dT, С | Q13: V3+V4, м3 | R13: Qгвс, Гкал | S13: Qобщ., Гкал | T13: Q | U13: M3 | V13: M4 | W13: си2 | X13: си3 | Y13: Разб. | Z13: dM2 | AC13: Дата | AD13: НС | AE13: n, ч | AF13: М1, т | AG13: t1, гр. С | AH13: Р1, кгс/см2 | AI13: М2, т | AJ13: t2, гр. С | AK13: Р2, кгс/см2 | AL13: t1-t2, гр. С | AM13: М1-М2, т | AN13: М1гвс, т | AO13: t1гвс, гр. С | AP13: Р1гвс, кгс/см2 | AQ13: М2гвс, т | AR13: t2гвс, гр. С | AS13: Р2гвс, кгс/см2 | AT13: t1гвс-t2гвс | AU13: М1гвс-М2гвс, т | AV13: Wгвс, Гкал | AW13: Wсумм, Гкал | AY13: NS_TV1 | AZ13: НС | BA13: NS_TV2
A14: =IF(RC[1]="","",DATEVALUE(RC[1])) -> 43335 | B14: 23.08.18 | C14: 24 | L14: 5.4968769999999996 | M14: 69.204666000000003 | N14: 1.789733 | O14: 65.934769000000003 | P14: =IF(AND(ISNUMBER(RC[-3]),ISNUMBER(RC[-1])),RC[-3]-RC[-1],"-") -> 3.2698970000000003 | Q14: 7.2866099999999996 | R14: 0.48825200000000002 | S14: =RC[-1] -> 0.48825200000000002 | T14: =(RC[-16]*RC[-15]-RC[-13]*RC[-12])/1000 -> 0 | U14: 5.378552 | V14: 1.754375 | W14: =RC[-2]*RC[-10]/1000 -> 0.37222089472363201 | X14: =ABS((RC[-3]*RC[-11]-RC[-2]*RC[-9])/1000) -> 0.25654658435925698 | Y14: =(RC[-14]-RC[1])/RC[-18]*100 -> #DIV/0! | Z14: =RC[-5]+RC[-4] -> 7.1329270000000005 | AC14: =VALUE(RC[-27]) -> 2018-08-23T00:00:00.000 | AD14: =IF(RC[21]=42,"*",IF(RC[21]=32,"",RC[21])) -> - | AE14: =RC[-28] -> 24 | AF14: =RC[-28] -> 0 | AG14: =RC[-28] -> 0 | AH14: =RC[-28] -> 0 | AI14: =RC[-28] -> 0 | AJ14: =RC[-28] -> 0 | AK14: =RC[-28] -> 0 | AL14: =RC[-28] -> 0 | AM14: =RC[-28] -> 0 | AN14: =RC[-28] -> 5.4968769999999996 | AO14: =RC[-28] -> 69.204666000000003 | AP14: - | AQ14: =RC[-29] -> 1.789733 | AR14: =RC[-29] -> 65.934769000000003 | AS14: - | AT14: =RC[-30] -> 3.2698970000000003 | AU14: =RC[-30] -> 7.2866099999999996 | AV14: =RC[-30] -> 0.48825200000000002 | AW14: =RC[-30] -> 0.48825200000000002 | AY14: - | AZ14: - | BA14: -
A15: =IF(RC[1]="","",DATEVALUE(RC[1])) -> 43336 | B15: 24.08.18 | C15: 24 | L15: 5.2881099999999996 | M15: 70.494765999999998 | N15: 2.244167 | O15: 67.804451 | P15: =IF(AND(ISNUMBER(RC[-3]),ISNUMBER(RC[-1])),RC[-3]-RC[-1],"-") -> 2.6903149999999982 | Q15: 7.5322769999999997 | R15: 0.51386699999999996 | S15: =RC[-1] -> 0.51386699999999996 | T15: =(RC[-16]*RC[-15]-RC[-13]*RC[-12])/1000 -> 0 | U15: 5.1703659999999996 | V15: 2.1975750000000001 | W15: =RC[-2]*RC[-10]/1000 -> 0.36448374130435601 | X15: =ABS((RC[-3]*RC[-11]-RC[-2]*RC[-9])/1000) -> 0.21547837489803098 | Y15: =(RC[-14]-RC[1])/RC[-18]*100 -> #DIV/0! | Z15: =RC[-5]+RC[-4] -> 7.3679410000000001 | AC15: =VALUE(RC[-27]) -> 2018-08-24T00:00:00.000 | AD15: =IF(RC[21]=42,"*",IF(RC[21]=32,"",RC[21])) -> - | AE15: =RC[-28] -> 24 | AF15: =RC[-28] -> 0 | AG15: =RC[-28] -> 0 | AH15: =RC[-28] -> 0 | AI15: =RC[-28] -> 0 | AJ15: =RC[-28] -> 0 | AK15: =RC[-28] -> 0 | AL15: =RC[-28] -> 0 | AM15: =RC[-28] -> 0 | AN15: =RC[-28] -> 5.2881099999999996 | AO15: =RC[-28] -> 70.494765999999998 | AP15: - | AQ15: =RC[-29] -> 2.244167 | AR15: =RC[-29] -> 67.804451 | AS15: - | AT15: =RC[-30] -> 2.6903149999999982 | AU15: =RC[-30] -> 7.5322769999999997 | AV15: =RC[-30] -> 0.51386699999999996 | AW15: =RC[-30] -> 0.51386699999999996 | AY15: - | AZ15: - | BA15: -
A16: =IF(RC[1]="","",DATEVALUE(RC[1])) -> 43337 | B16: 25.08.18 | C16: 24 | L16: 5.414777 | M16: 69.414894000000004 | N16: 2.2883779999999998 | O16: 66.529304999999994 | P16: =IF(AND(ISNUMBER(RC[-3]),ISNUMBER(RC[-1])),RC[-3]-RC[-1],"-") -> 2.8855890000000102 | Q16: 7.7031549999999998 | R16: 0.51731300000000002 | S16: =RC[-1] -> 0.51731300000000002 | T16: =(RC[-16]*RC[-15]-RC[-13]*RC[-12])/1000 -> 0 | U16: 5.2975770000000004 | V16: 2.242515 | W16: =RC[-2]*RC[-10]/1000 -> 0.36773074591183802 | X16: =ABS((RC[-3]*RC[-11]-RC[-2]*RC[-9])/1000) -> 0.21853778150976305 | Y16: =(RC[-14]-RC[1])/RC[-18]*100 -> #DIV/0! | Z16: =RC[-5]+RC[-4] -> 7.5400920000000005 | AC16: =VALUE(RC[-27]) -> 2018-08-25T00:00:00.000 | AD16: =IF(RC[21]=42,"*",IF(RC[21]=32,"",RC[21])) -> - | AE16: =RC[-28] -> 24 | AF16: =RC[-28] -> 0 | AG16: =RC[-28] -> 0 | AH16: =RC[-28] -> 0 | AI16: =RC[-28] -> 0 | AJ16: =RC[-28] -> 0 | AK16: =RC[-28] -> 0 | AL16: =RC[-28] -> 0 | AM16: =RC[-28] -> 0 | AN16: =RC[-28] -> 5.414777 | AO16: =RC[-28] -> 69.414894000000004 | AP16: - | AQ16: =RC[-29] -> 2.2883779999999998 | AR16: =RC[-29] -> 66.529304999999994 | AS16: - | AT16: =RC[-30] -> 2.8855890000000102 | AU16: =RC[-30] -> 7.7031549999999998 | AV16: =RC[-30] -> 0.51731300000000002 | AW16: =RC[-30] -> 0.51731300000000002 | AY16: - | AZ16: - | BA16: -
A17: =IF(RC[1]="","",DATEVALUE(RC[1])) -> 43338 | B17: 26.08.18 | C17: 24 | L17: 6.5120990000000001 | M17: 70.027717999999993 | N17: 2.4842 | O17: 67.275588999999997 | P17: =IF(AND(ISNUMBER(RC[-3]),ISNUMBER(RC[-1])),RC[-3]-RC[-1],"-") -> 2.7521289999999965 | Q17: 8.9962990000000005 | R17: 0.61014900000000005 | S17: =RC[-1] -> 0.61014900000000005 | T17: =(RC[-16]*RC[-15]-RC[-13]*RC[-12])/1000 -> 0 | U17: 6.3688310000000001 | V17: 2.43336 | W17: =RC[-2]*RC[-10]/1000 -> 0.44599470125765794 | X17: =ABS((RC[-3]*RC[-11]-RC[-2]*RC[-9])/1000) -> 0.28228897400861797 | Y17: =(RC[-14]-RC[1])/RC[-18]*100 -> #DIV/0! | Z17: =RC[-5]+RC[-4] -> 8.8021910000000005 | AC17: =VALUE(RC[-27]) -> 2018-08-26T00:00:00.000 | AD17: =IF(RC[21]=42,"*",IF(RC[21]=32,"",RC[21])) -> - | AE17: =RC[-28] -> 24 | AF17: =RC[-28] -> 0 | AG17: =RC[-28] -> 0 | AH17: =RC[-28] -> 0 | AI17: =RC[-28] -> 0 | AJ17: =RC[-28] -> 0 | AK17: =RC[-28] -> 0 | AL17: =RC[-28] -> 0 | AM17: =RC[-28] -> 0 | AN17: =RC[-28] -> 6.5120990000000001 | AO17: =RC[-28] -> 70.027717999999993 | AP17: - | AQ17: =RC[-29] -> 2.4842 | AR17: =RC[-29] -> 67.275588999999997 | AS17: - | AT17: =RC[-30] -> 2.7521289999999965 | AU17: =RC[-30] -> 8.9962990000000005 | AV17: =RC[-30] -> 0.61014900000000005 | AW17: =RC[-30] -> 0.61014900000000005 | AY17: - | AZ17: - | BA17: -
A18: =IF(RC[1]="","",DATEVALUE(RC[1])) -> 43339 | B18: 27.08.18 | C18: 24 | L18: 5.3568110000000004 | M18: 69.824348000000001 | N18: 2.623078 | O18: 67.544685000000001 | P18: =IF(AND(ISNUMBER(RC[-3]),ISNUMBER(RC[-1])),RC[-3]-RC[-1],"-") -> 2.2796629999999993 | Q18: 7.979889 | R18: 0.539767 | S18: =RC[-1] -> 0.539767 | T18: =(RC[-16]*RC[-15]-RC[-13]*RC[-12])/1000 -> 0 | U18: 5.2395719999999999 | V18: 2.5690089999999999 | W18: =RC[-2]*RC[-10]/1000 -> 0.36584969869905598 | X18: =ABS((RC[-3]*RC[-11]-RC[-2]*RC[-9])/1000) -> 0.19232679503189098 | Y18: =(RC[-14]-RC[1])/RC[-18]*100 -> #DIV/0! | Z18: =RC[-5]+RC[-4] -> 7.8085810000000002 | AC18: =VALUE(RC[-27]) -> 2018-08-27T00:00:00.000 | AD18: =IF(RC[21]=42,"*",IF(RC[21]=32,"",RC[21])) -> - | AE18: =RC[-28] -> 24 | AF18: =RC[-28] -> 0 | AG18: =RC[-28] -> 0 | AH18: =RC[-28] -> 0 | AI18: =RC[-28] -> 0 | AJ18: =RC[-28] -> 0 | AK18: =RC[-28] -> 0 | AL18: =RC[-28] -> 0 | AM18: =RC[-28] -> 0 | AN18: =RC[-28] -> 5.3568110000000004 | AO18: =RC[-28] -> 69.824348000000001 | AP18: - | AQ18: =RC[-29] -> 2.623078 | AR18: =RC[-29] -> 67.544685000000001 | AS18: - | AT18: =RC[-30] -> 2.2796629999999993 | AU18: =RC[-30] -> 7.979889 | AV18: =RC[-30] -> 0.539767 | AW18: =RC[-30] -> 0.539767 | AY18: - | AZ18: - | BA18: -
A19: =IF(RC[1]="","",DATEVALUE(RC[1])) -> 43340 | B19: 28.08.18 | C19: 24 | L19: 6.0962550000000002 | M19: 69.911438000000004 | N19: 2.7081110000000002 | O19: 67.513114999999999 | P19: =IF(AND(ISNUMBER(RC[-3]),ISNUMBER(RC[-1])),RC[-3]-RC[-1],"-") -> 2.3983230000000049 | Q19: 8.8043659999999999 | R19: 0.59636699999999998 | S19: =RC[-1] -> 0.59636699999999998 | T19: =(RC[-16]*RC[-15]-RC[-13]*RC[-12])/1000 -> 0 | U19: 5.9625709999999996 | V19: 2.6523530000000002 | W19: =RC[-2]*RC[-10]/1000 -> 0.41685191278709799 | X19: =ABS((RC[-3]*RC[-11]-RC[-2]*RC[-9])/1000) -> 0.23778329967750297 | Y19: =(RC[-14]-RC[1])/RC[-18]*100 -> #DIV/0! | Z19: =RC[-5]+RC[-4] -> 8.6149240000000002 | AC19: =VALUE(RC[-27]) -> 2018-08-28T00:00:00.000 | AD19: =IF(RC[21]=42,"*",IF(RC[21]=32,"",RC[21])) -> - | AE19: =RC[-28] -> 24 | AF19: =RC[-28] -> 0 | AG19: =RC[-28] -> 0 | AH19: =RC[-28] -> 0 | AI19: =RC[-28] -> 0 | AJ19: =RC[-28] -> 0 | AK19: =RC[-28] -> 0 | AL19: =RC[-28] -> 0 | AM19: =RC[-28] -> 0 | AN19: =RC[-28] -> 6.0962550000000002 | AO19: =RC[-28] -> 69.911438000000004 | AP19: - | AQ19: =RC[-29] -> 2.7081110000000002 | AR19: =RC[-29] -> 67.513114999999999 | AS19: - | AT19: =RC[-30] -> 2.3983230000000049 | AU19: =RC[-30] -> 8.8043659999999999 | AV19: =RC[-30] -> 0.59636699999999998 | AW19: =RC[-30] -> 0.59636699999999998 | AY19: - | AZ19: - | BA19: -
A20: =IF(RC[1]="","",DATEVALUE(RC[1])) -> 43341 | B20: 29.08.18 | C20: 24 | L20: 6.359477 | M20: 68.506873999999996 | N20: 2.7743440000000001 | O20: 65.940162999999998 | P20: =IF(AND(ISNUMBER(RC[-3]),ISNUMBER(RC[-1])),RC[-3]-RC[-1],"-") -> 2.566710999999998 | Q20: 9.1338209999999993 | R20: 0.60624 | S20: =RC[-1] -> 0.60624 | T20: =(RC[-16]*RC[-15]-RC[-13]*RC[-12])/1000 -> 0 | U20: 6.2250719999999999 | V20: 2.7196120000000001 | W20: =RC[-2]*RC[-10]/1000 -> 0.42646022314492799 | X20: =ABS((RC[-3]*RC[-11]-RC[-2]*RC[-9])/1000) -> 0.24712856456817195 | Y20: =(RC[-14]-RC[1])/RC[-18]*100 -> #DIV/0! | Z20: =RC[-5]+RC[-4] -> 8.9446840000000005 | AC20: =VALUE(RC[-27]) -> 2018-08-29T00:00:00.000 | AD20: =IF(RC[21]=42,"*",IF(RC[21]=32,"",RC[21])) -> - | AE20: =RC[-28] -> 24 | AF20: =RC[-28] -> 0 | AG20: =RC[-28] -> 0 | AH20: =RC[-28] -> 0 | AI20: =RC[-28] -> 0 | AJ20: =RC[-28] -> 0 | AK20: =RC[-28] -> 0 | AL20: =RC[-28] -> 0 | AM20: =RC[-28] -> 0 | AN20: =RC[-28] -> 6.359477 | AO20: =RC[-28] -> 68.506873999999996 | AP20: - | AQ20: =RC[-29] -> 2.7743440000000001 | AR20: =RC[-29] -> 65.940162999999998 | AS20: - | AT20: =RC[-30] -> 2.566710999999998 | AU20: =RC[-30] -> 9.1338209999999993 | AV20: =RC[-30] -> 0.60624 | AW20: =RC[-30] -> 0.60624 | AY20: - | AZ20: - | BA20: -
A21: =IF(RC[1]="","",DATEVALUE(RC[1])) -> 43342 | B21: 30.08.18 | C21: 24 | L21: 6.070144 | M21: 67.131821000000002 | N21: 2.1776219999999999 | O21: 64.219787999999994 | P21: =IF(AND(ISNUMBER(RC[-3]),ISNUMBER(RC[-1])),RC[-3]-RC[-1],"-") -> 2.9120330000000081 | Q21: 8.2477660000000004 | R21: 0.53681599999999996 | S21: =RC[-1] -> 0.53681599999999996 | T21: =(RC[-16]*RC[-15]-RC[-13]*RC[-12])/1000 -> 0 | U21: 5.9465180000000002 | V21: 2.136698 | W21: =RC[-2]*RC[-10]/1000 -> 0.39920058194927804 | X21: =ABS((RC[-3]*RC[-11]-RC[-2]*RC[-9])/1000) -> 0.26198228936925411 | Y21: =(RC[-14]-RC[1])/RC[-18]*100 -> #DIV/0! | Z21: =RC[-5]+RC[-4] -> 8.0832160000000002 | AC21: =VALUE(RC[-27]) -> 2018-08-30T00:00:00.000 | AD21: =IF(RC[21]=42,"*",IF(RC[21]=32,"",RC[21])) -> - | AE21: =RC[-28] -> 24 | AF21: =RC[-28] -> 0 | AG21: =RC[-28] -> 0 | AH21: =RC[-28] -> 0 | AI21: =RC[-28] -> 0 | AJ21: =RC[-28] -> 0 | AK21: =RC[-28] -> 0 | AL21: =RC[-28] -> 0 | AM21: =RC[-28] -> 0 | AN21: =RC[-28] -> 6.070144 | AO21: =RC[-28] -> 67.131821000000002 | AP21: - | AQ21: =RC[-29] -> 2.1776219999999999 | AR21: =RC[-29] -> 64.219787999999994 | AS21: - | AT21: =RC[-30] -> 2.9120330000000081 | AU21: =RC[-30] -> 8.2477660000000004 | AV21: =RC[-30] -> 0.53681599999999996 | AW21: =RC[-30] -> 0.53681599999999996 | AY21: - | AZ21: - | BA21: -
A22: =IF(RC[1]="","",DATEVALUE(RC[1])) -> 43343 | B22: 31.08.18 | C22: 24 | L22: 6.454866 | M22: 68.969375999999997 | N22: 2.423111 | O22: 66.085037 | P22: =IF(AND(ISNUMBER(RC[-3]),ISNUMBER(RC[-1])),RC[-3]-RC[-1],"-") -> 2.8843389999999971 | Q22: 8.8779769999999996 | R22: 0.59305399999999997 | S22: =RC[-1] -> 0.59305399999999997 | T22: =(RC[-16]*RC[-15]-RC[-13]*RC[-12])/1000 -> 0 | U22: 6.3167439999999999 | V22: 2.375102 | W22: =RC[-2]*RC[-10]/1000 -> 0.43566189203174399 | X22: =ABS((RC[-3]*RC[-11]-RC[-2]*RC[-9])/1000) -> 0.27870318848296999 | Y22: =(RC[-14]-RC[1])/RC[-18]*100 -> #DIV/0! | Z22: =RC[-5]+RC[-4] -> 8.691846 | AC22: =VALUE(RC[-27]) -> 2018-08-31T00:00:00.000 | AD22: =IF(RC[21]=42,"*",IF(RC[21]=32,"",RC[21])) -> - | AE22: =RC[-28] -> 24 | AF22: =RC[-28] -> 0 | AG22: =RC[-28] -> 0 | AH22: =RC[-28] -> 0 | AI22: =RC[-28] -> 0 | AJ22: =RC[-28] -> 0 | AK22: =RC[-28] -> 0 | AL22: =RC[-28] -> 0 | AM22: =RC[-28] -> 0 | AN22: =RC[-28] -> 6.454866 | AO22: =RC[-28] -> 68.969375999999997 | AP22: - | AQ22: =RC[-29] -> 2.423111 | AR22: =RC[-29] -> 66.085037 | AS22: - | AT22: =RC[-30] -> 2.8843389999999971 | AU22: =RC[-30] -> 8.8779769999999996 | AV22: =RC[-30] -> 0.59305399999999997 | AW22: =RC[-30] -> 0.59305399999999997 | AY22: - | AZ22: - | BA22: -
A23: =IF(RC[1]="","",DATEVALUE(RC[1])) -> 43344 | B23: 01.09.18 | C23: 24 | L23: 5.8107220000000002 | M23: 69.883835000000005 | N23: 2.3309220000000002 | O23: 66.651184000000001 | P23: =IF(AND(ISNUMBER(RC[-3]),ISNUMBER(RC[-1])),RC[-3]-RC[-1],"-") -> 3.2326510000000042 | Q23: 8.1416439999999994 | R23: 0.54982399999999998 | S23: =RC[-1] -> 0.54982399999999998 | T23: =(RC[-16]*RC[-15]-RC[-13]*RC[-12])/1000 -> 0 | U23: 5.6833920000000004 | V23: 2.2840470000000002 | W23: =RC[-2]*RC[-10]/1000 -> 0.39717722876832007 | X23: =ABS((RC[-3]*RC[-11]-RC[-2]*RC[-9])/1000) -> 0.24494279190667204 | Y23: =(RC[-14]-RC[1])/RC[-18]*100 -> #DIV/0! | Z23: =RC[-5]+RC[-4] -> 7.9674390000000006 | AC23: =VALUE(RC[-27]) -> 2018-09-01T00:00:00.000 | AD23: =IF(RC[21]=42,"*",IF(RC[21]=32,"",RC[21])) -> - | AE23: =RC[-28] -> 24 | AF23: =RC[-28] -> 0 | AG23: =RC[-28] -> 0 | AH23: =RC[-28] -> 0 | AI23: =RC[-28] -> 0 | AJ23: =RC[-28] -> 0 | AK23: =RC[-28] -> 0 | AL23: =RC[-28] -> 0 | AM23: =RC[-28] -> 0 | AN23: =RC[-28] -> 5.8107220000000002 | AO23: =RC[-28] -> 69.883835000000005 | AP23: - | AQ23: =RC[-29] -> 2.3309220000000002 | AR23: =RC[-29] -> 66.651184000000001 | AS23: - | AT23: =RC[-30] -> 3.2326510000000042 | AU23: =RC[-30] -> 8.1416439999999994 | AV23: =RC[-30] -> 0.54982399999999998 | AW23: =RC[-30] -> 0.54982399999999998 | AY23: - | AZ23: - | BA23: -
A24: =IF(RC[1]="","",DATEVALUE(RC[1])) -> 43345 | B24: 02.09.18 | C24: 24 | L24: 6.5686220000000004 | M24: 70.403762999999998 | N24: 3.1151219999999999 | O24: 68.409194999999997 | P24: =IF(AND(ISNUMBER(RC[-3]),ISNUMBER(RC[-1])),RC[-3]-RC[-1],"-") -> 1.994568000000001 | Q24: 9.6837440000000008 | R24: 0.66129099999999996 | S24: =RC[-1] -> 0.66129099999999996 | T24: =(RC[-16]*RC[-15]-RC[-13]*RC[-12])/1000 -> 0 | U24: 6.4227400000000001 | V24: 3.049423 | W24: =RC[-2]*RC[-10]/1000 -> 0.45218506477061998 | X24: =ABS((RC[-3]*RC[-11]-RC[-2]*RC[-9])/1000) -> 0.243576492126135 | Y24: =(RC[-14]-RC[1])/RC[-18]*100 -> #DIV/0! | Z24: =RC[-5]+RC[-4] -> 9.4721630000000001 | AC24: =VALUE(RC[-27]) -> 2018-09-02T00:00:00.000 | AD24: =IF(RC[21]=42,"*",IF(RC[21]=32,"",RC[21])) -> - | AE24: =RC[-28] -> 24 | AF24: =RC[-28] -> 0 | AG24: =RC[-28] -> 0 | AH24: =RC[-28] -> 0 | AI24: =RC[-28] -> 0 | AJ24: =RC[-28] -> 0 | AK24: =RC[-28] -> 0 | AL24: =RC[-28] -> 0 | AM24: =RC[-28] -> 0 | AN24: =RC[-28] -> 6.5686220000000004 | AO24: =RC[-28] -> 70.403762999999998 | AP24: - | AQ24: =RC[-29] -> 3.1151219999999999 | AR24: =RC[-29] -> 68.409194999999997 | AS24: - | AT24: =RC[-30] -> 1.994568000000001 | AU24: =RC[-30] -> 9.6837440000000008 | AV24: =RC[-30] -> 0.66129099999999996 | AW24: =RC[-30] -> 0.66129099999999996 | AY24: - | AZ24: - | BA24: -
A25: =IF(RC[1]="","",DATEVALUE(RC[1])) -> 43346 | B25: 03.09.18 | C25: 24 | L25: 6.5533890000000001 | M25: 69.748847999999995 | N25: 2.6079780000000001 | O25: 67.284385999999998 | P25: =IF(AND(ISNUMBER(RC[-3]),ISNUMBER(RC[-1])),RC[-3]-RC[-1],"-") -> 2.4644619999999975 | Q25: 9.1613670000000003 | R25: 0.61945799999999995 | S25: =RC[-1] -> 0.61945799999999995 | T25: =(RC[-16]*RC[-15]-RC[-13]*RC[-12])/1000 -> 0 | U25: 6.410304 | V25: 2.5545930000000001 | W25: =RC[-2]*RC[-10]/1000 -> 0.44711131932979198 | X25: =ABS((RC[-3]*RC[-11]-RC[-2]*RC[-9])/1000) -> 0.27522709784489391 | Y25: =(RC[-14]-RC[1])/RC[-18]*100 -> #DIV/0! | Z25: =RC[-5]+RC[-4] -> 8.9648970000000006 | AC25: =VALUE(RC[-27]) -> 2018-09-03T00:00:00.000 | AD25: =IF(RC[21]=42,"*",IF(RC[21]=32,"",RC[21])) -> - | AE25: =RC[-28] -> 24 | AF25: =RC[-28] -> 0 | AG25: =RC[-28] -> 0 | AH25: =RC[-28] -> 0 | AI25: =RC[-28] -> 0 | AJ25: =RC[-28] -> 0 | AK25: =RC[-28] -> 0 | AL25: =RC[-28] -> 0 | AM25: =RC[-28] -> 0 | AN25: =RC[-28] -> 6.5533890000000001 | AO25: =RC[-28] -> 69.748847999999995 | AP25: - | AQ25: =RC[-29] -> 2.6079780000000001 | AR25: =RC[-29] -> 67.284385999999998 | AS25: - | AT25: =RC[-30] -> 2.4644619999999975 | AU25: =RC[-30] -> 9.1613670000000003 | AV25: =RC[-30] -> 0.61945799999999995 | AW25: =RC[-30] -> 0.61945799999999995 | AY25: - | AZ25: - | BA25: -
A26: =IF(RC[1]="","",DATEVALUE(RC[1])) -> 43347 | B26: 04.09.18 | C26: 24 | L26: 6.4485890000000001 | M26: 69.653366000000005 | N26: 2.1806220000000001 | O26: 66.226027999999999 | P26: =IF(AND(ISNUMBER(RC[-3]),ISNUMBER(RC[-1])),RC[-3]-RC[-1],"-") -> 3.427338000000006 | Q26: 8.6292109999999997 | R26: 0.58135300000000001 | S26: =RC[-1] -> 0.58135300000000001 | T26: =(RC[-16]*RC[-15]-RC[-13]*RC[-12])/1000 -> 0 | U26: 6.3081290000000001 | V26: 2.137238 | W26: =RC[-2]*RC[-10]/1000 -> 0.439382418012214 | X26: =ABS((RC[-3]*RC[-11]-RC[-2]*RC[-9])/1000) -> 0.29784163438155004 | Y26: =(RC[-14]-RC[1])/RC[-18]*100 -> #DIV/0! | Z26: =RC[-5]+RC[-4] -> 8.445367000000001 | AC26: =VALUE(RC[-27]) -> 2018-09-04T00:00:00.000 | AD26: =IF(RC[21]=42,"*",IF(RC[21]=32,"",RC[21])) -> - | AE26: =RC[-28] -> 24 | AF26: =RC[-28] -> 0 | AG26: =RC[-28] -> 0 | AH26: =RC[-28] -> 0 | AI26: =RC[-28] -> 0 | AJ26: =RC[-28] -> 0 | AK26: =RC[-28] -> 0 | AL26: =RC[-28] -> 0 | AM26: =RC[-28] -> 0 | AN26: =RC[-28] -> 6.4485890000000001 | AO26: =RC[-28] -> 69.653366000000005 | AP26: - | AQ26: =RC[-29] -> 2.1806220000000001 | AR26: =RC[-29] -> 66.226027999999999 | AS26: - | AT26: =RC[-30] -> 3.427338000000006 | AU26: =RC[-30] -> 8.6292109999999997 | AV26: =RC[-30] -> 0.58135300000000001 | AW26: =RC[-30] -> 0.58135300000000001 | AY26: - | AZ26: - | BA26: -
A27: =IF(RC[1]="","",DATEVALUE(RC[1])) -> 43348 | B27: 05.09.18 | C27: 24 | L27: 6.1395 | M27: 70.027327999999997 | N27: 2.6418550000000001 | O27: 67.818077000000002 | P27: =IF(AND(ISNUMBER(RC[-3]),ISNUMBER(RC[-1])),RC[-3]-RC[-1],"-") -> 2.2092509999999947 | Q27: 8.7813549999999996 | R27: 0.59636699999999998 | S27: =RC[-1] -> 0.59636699999999998 | T27: =(RC[-16]*RC[-15]-RC[-13]*RC[-12])/1000 -> 0 | U27: 6.0044519999999997 | V27: 2.5870099999999998 | W27: =RC[-2]*RC[-10]/1000 -> 0.42047572966425595 | X27: =ABS((RC[-3]*RC[-11]-RC[-2]*RC[-9])/1000) -> 0.24502968628448593 | Y27: =(RC[-14]-RC[1])/RC[-18]*100 -> #DIV/0! | Z27: =RC[-5]+RC[-4] -> 8.5914619999999999 | AC27: =VALUE(RC[-27]) -> 2018-09-05T00:00:00.000 | AD27: =IF(RC[21]=42,"*",IF(RC[21]=32,"",RC[21])) -> - | AE27: =RC[-28] -> 24 | AF27: =RC[-28] -> 0 | AG27: =RC[-28] -> 0 | AH27: =RC[-28] -> 0 | AI27: =RC[-28] -> 0 | AJ27: =RC[-28] -> 0 | AK27: =RC[-28] -> 0 | AL27: =RC[-28] -> 0 | AM27: =RC[-28] -> 0 | AN27: =RC[-28] -> 6.1395 | AO27: =RC[-28] -> 70.027327999999997 | AP27: - | AQ27: =RC[-29] -> 2.6418550000000001 | AR27: =RC[-29] -> 67.818077000000002 | AS27: - | AT27: =RC[-30] -> 2.2092509999999947 | AU27: =RC[-30] -> 8.7813549999999996 | AV27: =RC[-30] -> 0.59636699999999998 | AW27: =RC[-30] -> 0.59636699999999998 | AY27: - | AZ27: - | BA27: -
A28: =IF(RC[1]="","",DATEVALUE(RC[1])) -> 43349 | B28: 06.09.18 | C28: 24 | L28: 5.9887439999999996 | M28: 70.112244000000004 | N28: 2.335356 | O28: 67.264090999999993 | P28: =IF(AND(ISNUMBER(RC[-3]),ISNUMBER(RC[-1])),RC[-3]-RC[-1],"-") -> 2.8481530000000106 | Q28: 8.3240999999999996 | R28: 0.56492399999999998 | S28: =RC[-1] -> 0.56492399999999998 | T28: =(RC[-16]*RC[-15]-RC[-13]*RC[-12])/1000 -> 0 | U28: 5.856738 | V28: 2.287585 | W28: =RC[-2]*RC[-10]/1000 -> 0.41062904370007203 | X28: =ABS((RC[-3]*RC[-11]-RC[-2]*RC[-9])/1000) -> 0.25675671808983702 | Y28: =(RC[-14]-RC[1])/RC[-18]*100 -> #DIV/0! | Z28: =RC[-5]+RC[-4] -> 8.144323 | AC28: =VALUE(RC[-27]) -> 2018-09-06T00:00:00.000 | AD28: =IF(RC[21]=42,"*",IF(RC[21]=32,"",RC[21])) -> - | AE28: =RC[-28] -> 24 | AF28: =RC[-28] -> 0 | AG28: =RC[-28] -> 0 | AH28: =RC[-28] -> 0 | AI28: =RC[-28] -> 0 | AJ28: =RC[-28] -> 0 | AK28: =RC[-28] -> 0 | AL28: =RC[-28] -> 0 | AM28: =RC[-28] -> 0 | AN28: =RC[-28] -> 5.9887439999999996 | AO28: =RC[-28] -> 70.112244000000004 | AP28: - | AQ28: =RC[-29] -> 2.335356 | AR28: =RC[-29] -> 67.264090999999993 | AS28: - | AT28: =RC[-30] -> 2.8481530000000106 | AU28: =RC[-30] -> 8.3240999999999996 | AV28: =RC[-30] -> 0.56492399999999998 | AW28: =RC[-30] -> 0.56492399999999998 | AY28: - | AZ28: - | BA28: -
A29: =IF(RC[1]="","",DATEVALUE(RC[1])) -> 43350 | B29: 07.09.18 | C29: 24 | L29: 5.8362550000000004 | M29: 70.346474000000001 | N29: 2.780389 | O29: 67.940978999999999 | P29: =IF(AND(ISNUMBER(RC[-3]),ISNUMBER(RC[-1])),RC[-3]-RC[-1],"-") -> 2.4054950000000019 | Q29: 8.6166440000000009 | R29: 0.58685699999999996 | S29: =RC[-1] -> 0.58685699999999996 | T29: =(RC[-16]*RC[-15]-RC[-13]*RC[-12])/1000 -> 0 | U29: 5.7068070000000004 | V29: 2.7224699999999999 | W29: =RC[-2]*RC[-10]/1000 -> 0.40145375024851804 | X29: =ABS((RC[-3]*RC[-11]-RC[-2]*RC[-9])/1000) -> 0.21648647315038805 | Y29: =(RC[-14]-RC[1])/RC[-18]*100 -> #DIV/0! | Z29: =RC[-5]+RC[-4] -> 8.4292770000000008 | AC29: =VALUE(RC[-27]) -> 2018-09-07T00:00:00.000 | AD29: =IF(RC[21]=42,"*",IF(RC[21]=32,"",RC[21])) -> - | AE29: =RC[-28] -> 24 | AF29: =RC[-28] -> 0 | AG29: =RC[-28] -> 0 | AH29: =RC[-28] -> 0 | AI29: =RC[-28] -> 0 | AJ29: =RC[-28] -> 0 | AK29: =RC[-28] -> 0 | AL29: =RC[-28] -> 0 | AM29: =RC[-28] -> 0 | AN29: =RC[-28] -> 5.8362550000000004 | AO29: =RC[-28] -> 70.346474000000001 | AP29: - | AQ29: =RC[-29] -> 2.780389 | AR29: =RC[-29] -> 67.940978999999999 | AS29: - | AT29: =RC[-30] -> 2.4054950000000019 | AU29: =RC[-30] -> 8.6166440000000009 | AV29: =RC[-30] -> 0.58685699999999996 | AW29: =RC[-30] -> 0.58685699999999996 | AY29: - | AZ29: - | BA29: -
A30: =IF(RC[1]="","",DATEVALUE(RC[1])) -> 43351 | B30: 08.09.18 | C30: 24 | L30: 6.7726220000000001 | M30: 69.331199999999995 | N30: 2.8271109999999999 | O30: 66.905227999999994 | P30: =IF(AND(ISNUMBER(RC[-3]),ISNUMBER(RC[-1])),RC[-3]-RC[-1],"-") -> 2.4259720000000016 | Q30: 9.5997330000000005 | R30: 0.64521799999999996 | S30: =RC[-1] -> 0.64521799999999996 | T30: =(RC[-16]*RC[-15]-RC[-13]*RC[-12])/1000 -> 0 | U30: 6.6263529999999999 | V30: 2.7698649999999998 | W30: =RC[-2]*RC[-10]/1000 -> 0.4594130051136 | X30: =ABS((RC[-3]*RC[-11]-RC[-2]*RC[-9])/1000) -> 0.27409455575938002 | Y30: =(RC[-14]-RC[1])/RC[-18]*100 -> #DIV/0! | Z30: =RC[-5]+RC[-4] -> 9.3962179999999993 | AC30: =VALUE(RC[-27]) -> 2018-09-08T00:00:00.000 | AD30: =IF(RC[21]=42,"*",IF(RC[21]=32,"",RC[21])) -> - | AE30: =RC[-28] -> 24 | AF30: =RC[-28] -> 0 | AG30: =RC[-28] -> 0 | AH30: =RC[-28] -> 0 | AI30: =RC[-28] -> 0 | AJ30: =RC[-28] -> 0 | AK30: =RC[-28] -> 0 | AL30: =RC[-28] -> 0 | AM30: =RC[-28] -> 0 | AN30: =RC[-28] -> 6.7726220000000001 | AO30: =RC[-28] -> 69.331199999999995 | AP30: - | AQ30: =RC[-29] -> 2.8271109999999999 | AR30: =RC[-29] -> 66.905227999999994 | AS30: - | AT30: =RC[-30] -> 2.4259720000000016 | AU30: =RC[-30] -> 9.5997330000000005 | AV30: =RC[-30] -> 0.64521799999999996 | AW30: =RC[-30] -> 0.64521799999999996 | AY30: - | AZ30: - | BA30: -
A31: =IF(RC[1]="","",DATEVALUE(RC[1])) -> 43352 | B31: 09.09.18 | C31: 24 | L31: 7.1795330000000002 | M31: 69.462158000000002 | N31: 3.1207549999999999 | O31: 67.081963000000002 | P31: =IF(AND(ISNUMBER(RC[-3]),ISNUMBER(RC[-1])),RC[-3]-RC[-1],"-") -> 2.3801950000000005 | Q31: 10.300288 | R31: 0.693496 | S31: =RC[-1] -> 0.693496 | T31: =(RC[-16]*RC[-15]-RC[-13]*RC[-12])/1000 -> 0 | U31: 7.0239240000000001 | V31: 3.05722 | W31: =RC[-2]*RC[-10]/1000 -> 0.48789691866799201 | X31: =ABS((RC[-3]*RC[-11]-RC[-2]*RC[-9])/1000) -> 0.28281259974513201 | Y31: =(RC[-14]-RC[1])/RC[-18]*100 -> #DIV/0! | Z31: =RC[-5]+RC[-4] -> 10.081144 | AC31: =VALUE(RC[-27]) -> 2018-09-09T00:00:00.000 | AD31: =IF(RC[21]=42,"*",IF(RC[21]=32,"",RC[21])) -> - | AE31: =RC[-28] -> 24 | AF31: =RC[-28] -> 0 | AG31: =RC[-28] -> 0 | AH31: =RC[-28] -> 0 | AI31: =RC[-28] -> 0 | AJ31: =RC[-28] -> 0 | AK31: =RC[-28] -> 0 | AL31: =RC[-28] -> 0 | AM31: =RC[-28] -> 0 | AN31: =RC[-28] -> 7.1795330000000002 | AO31: =RC[-28] -> 69.462158000000002 | AP31: - | AQ31: =RC[-29] -> 3.1207549999999999 | AR31: =RC[-29] -> 67.081963000000002 | AS31: - | AT31: =RC[-30] -> 2.3801950000000005 | AU31: =RC[-30] -> 10.300288 | AV31: =RC[-30] -> 0.693496 | AW31: =RC[-30] -> 0.693496 | AY31: - | AZ31: - | BA31: -
A32: =IF(RC[1]="","",DATEVALUE(RC[1])) -> 43353 | B32: 10.09.18 | C32: 24 | L32: 6.1539219999999997 | M32: 71.198707999999996 | N32: 2.7212550000000002 | O32: 68.290665000000004 | P32: =IF(AND(ISNUMBER(RC[-3]),ISNUMBER(RC[-1])),RC[-3]-RC[-1],"-") -> 2.9080429999999922 | Q32: 8.8751770000000008 | R32: 0.61059399999999997 | S32: =RC[-1] -> 0.61059399999999997 | T32: =(RC[-16]*RC[-15]-RC[-13]*RC[-12])/1000 -> 0 | U32: 6.0144200000000003 | V32: 2.6639900000000001 | W32: =RC[-2]*RC[-10]/1000 -> 0.42821893336936001 | X32: =ABS((RC[-3]*RC[-11]-RC[-2]*RC[-9])/1000) -> 0.24629328471601 | Y32: =(RC[-14]-RC[1])/RC[-18]*100 -> #DIV/0! | Z32: =RC[-5]+RC[-4] -> 8.6784099999999995 | AC32: =VALUE(RC[-27]) -> 2018-09-10T00:00:00.000 | AD32: =IF(RC[21]=42,"*",IF(RC[21]=32,"",RC[21])) -> - | AE32: =RC[-28] -> 24 | AF32: =RC[-28] -> 0 | AG32: =RC[-28] -> 0 | AH32: =RC[-28] -> 0 | AI32: =RC[-28] -> 0 | AJ32: =RC[-28] -> 0 | AK32: =RC[-28] -> 0 | AL32: =RC[-28] -> 0 | AM32: =RC[-28] -> 0 | AN32: =RC[-28] -> 6.1539219999999997 | AO32: =RC[-28] -> 71.198707999999996 | AP32: - | AQ32: =RC[-29] -> 2.7212550000000002 | AR32: =RC[-29] -> 68.290665000000004 | AS32: - | AT32: =RC[-30] -> 2.9080429999999922 | AU32: =RC[-30] -> 8.8751770000000008 | AV32: =RC[-30] -> 0.61059399999999997 | AW32: =RC[-30] -> 0.61059399999999997 | AY32: - | AZ32: - | BA32: -
A33: =IF(RC[1]="","",DATEVALUE(RC[1])) -> 43354 | B33: 11.09.18 | C33: 24 | L33: 5.9774789999999998 | M33: 69.885673999999995 | N33: 2.7460659999999999 | O33: 67.164894000000004 | P33: =IF(AND(ISNUMBER(RC[-3]),ISNUMBER(RC[-1])),RC[-3]-RC[-1],"-") -> 2.7207799999999907 | Q33: 8.7235449999999997 | R33: 0.58969000000000005 | S33: =RC[-1] -> 0.58969000000000005 | T33: =(RC[-16]*RC[-15]-RC[-13]*RC[-12])/1000 -> 0 | U33: 5.8464700000000001 | V33: 2.690016 | W33: =RC[-2]*RC[-10]/1000 -> 0.40858449647077999 | X33: =ABS((RC[-3]*RC[-11]-RC[-2]*RC[-9])/1000) -> 0.22790985697247598 | Y33: =(RC[-14]-RC[1])/RC[-18]*100 -> #DIV/0! | Z33: =RC[-5]+RC[-4] -> 8.536486 | AC33: =VALUE(RC[-27]) -> 2018-09-11T00:00:00.000 | AD33: =IF(RC[21]=42,"*",IF(RC[21]=32,"",RC[21])) -> - | AE33: =RC[-28] -> 24 | AF33: =RC[-28] -> 0 | AG33: =RC[-28] -> 0 | AH33: =RC[-28] -> 0 | AI33: =RC[-28] -> 0 | AJ33: =RC[-28] -> 0 | AK33: =RC[-28] -> 0 | AL33: =RC[-28] -> 0 | AM33: =RC[-28] -> 0 | AN33: =RC[-28] -> 5.9774789999999998 | AO33: =RC[-28] -> 69.885673999999995 | AP33: - | AQ33: =RC[-29] -> 2.7460659999999999 | AR33: =RC[-29] -> 67.164894000000004 | AS33: - | AT33: =RC[-30] -> 2.7207799999999907 | AU33: =RC[-30] -> 8.7235449999999997 | AV33: =RC[-30] -> 0.58969000000000005 | AW33: =RC[-30] -> 0.58969000000000005 | AY33: - | AZ33: - | BA33: -
A34: =IF(RC[1]="","",DATEVALUE(RC[1])) -> 43355 | B34: 12.09.18 | C34: 24 | L34: 7.7672670000000004 | M34: 70.321213 | N34: 2.7561659999999999 | O34: 67.747887000000006 | P34: =IF(AND(ISNUMBER(RC[-3]),ISNUMBER(RC[-1])),RC[-3]-RC[-1],"-") -> 2.5733259999999945 | Q34: 10.523433000000001 | R34: 0.71748500000000004 | S34: =RC[-1] -> 0.71748500000000004 | T34: =(RC[-16]*RC[-15]-RC[-13]*RC[-12])/1000 -> 0 | U34: 7.5951060000000004 | V34: 2.699039 | W34: =RC[-2]*RC[-10]/1000 -> 0.53409706678357804 | X34: =ABS((RC[-3]*RC[-11]-RC[-2]*RC[-9])/1000) -> 0.351242877602985 | Y34: =(RC[-14]-RC[1])/RC[-18]*100 -> #DIV/0! | Z34: =RC[-5]+RC[-4] -> 10.294145 | AC34: =VALUE(RC[-27]) -> 2018-09-12T00:00:00.000 | AD34: =IF(RC[21]=42,"*",IF(RC[21]=32,"",RC[21])) -> - | AE34: =RC[-28] -> 24 | AF34: =RC[-28] -> 0 | AG34: =RC[-28] -> 0 | AH34: =RC[-28] -> 0 | AI34: =RC[-28] -> 0 | AJ34: =RC[-28] -> 0 | AK34: =RC[-28] -> 0 | AL34: =RC[-28] -> 0 | AM34: =RC[-28] -> 0 | AN34: =RC[-28] -> 7.7672670000000004 | AO34: =RC[-28] -> 70.321213 | AP34: - | AQ34: =RC[-29] -> 2.7561659999999999 | AR34: =RC[-29] -> 67.747887000000006 | AS34: - | AT34: =RC[-30] -> 2.5733259999999945 | AU34: =RC[-30] -> 10.523433000000001 | AV34: =RC[-30] -> 0.71748500000000004 | AW34: =RC[-30] -> 0.71748500000000004 | AY34: - | AZ34: - | BA34: -
A35: =IF(RC[1]="","",DATEVALUE(RC[1])) -> 43356 | B35: 13.09.18 | C35: 24 | L35: 6.747433 | M35: 69.958939000000001 | N35: 2.5508999999999999 | O35: 67.482940999999997 | P35: =IF(AND(ISNUMBER(RC[-3]),ISNUMBER(RC[-1])),RC[-3]-RC[-1],"-") -> 2.4759980000000041 | Q35: 9.2983329999999995 | R35: 0.63074600000000003 | S35: =RC[-1] -> 0.63074600000000003 | T35: =(RC[-16]*RC[-15]-RC[-13]*RC[-12])/1000 -> 0 | U35: 6.5992740000000003 | V35: 2.498405 | W35: =RC[-2]*RC[-10]/1000 -> 0.46167820721028602 | X35: =ABS((RC[-3]*RC[-11]-RC[-2]*RC[-9])/1000) -> 0.29307849000118102 | Y35: =(RC[-14]-RC[1])/RC[-18]*100 -> #DIV/0! | Z35: =RC[-5]+RC[-4] -> 9.0976789999999994 | AC35: =VALUE(RC[-27]) -> 2018-09-13T00:00:00.000 | AD35: =IF(RC[21]=42,"*",IF(RC[21]=32,"",RC[21])) -> - | AE35: =RC[-28] -> 24 | AF35: =RC[-28] -> 0 | AG35: =RC[-28] -> 0 | AH35: =RC[-28] -> 0 | AI35: =RC[-28] -> 0 | AJ35: =RC[-28] -> 0 | AK35: =RC[-28] -> 0 | AL35: =RC[-28] -> 0 | AM35: =RC[-28] -> 0 | AN35: =RC[-28] -> 6.747433 | AO35: =RC[-28] -> 69.958939000000001 | AP35: - | AQ35: =RC[-29] -> 2.5508999999999999 | AR35: =RC[-29] -> 67.482940999999997 | AS35: - | AT35: =RC[-30] -> 2.4759980000000041 | AU35: =RC[-30] -> 9.2983329999999995 | AV35: =RC[-30] -> 0.63074600000000003 | AW35: =RC[-30] -> 0.63074600000000003 | AY35: - | AZ35: - | BA35: -
A36: =IF(RC[1]="","",DATEVALUE(RC[1])) -> 43357 | B36: 14.09.18 | C36: 24 | L36: 5.8303330000000004 | M36: 68.988647 | N36: 2.5337329999999998 | O36: 66.761757000000003 | P36: =IF(AND(ISNUMBER(RC[-3]),ISNUMBER(RC[-1])),RC[-3]-RC[-1],"-") -> 2.2268899999999974 | Q36: 8.3640659999999993 | R36: 0.55977900000000003 | S36: =RC[-1] -> 0.55977900000000003 | T36: =(RC[-16]*RC[-15]-RC[-13]*RC[-12])/1000 -> 0 | U36: 5.705546 | V36: 2.4826109999999999 | W36: =RC[-2]*RC[-10]/1000 -> 0.39361789893626203 | X36: =ABS((RC[-3]*RC[-11]-RC[-2]*RC[-9])/1000) -> 0.227874426628735 | Y36: =(RC[-14]-RC[1])/RC[-18]*100 -> #DIV/0! | Z36: =RC[-5]+RC[-4] -> 8.1881570000000004 | AC36: =VALUE(RC[-27]) -> 2018-09-14T00:00:00.000 | AD36: =IF(RC[21]=42,"*",IF(RC[21]=32,"",RC[21])) -> - | AE36: =RC[-28] -> 24 | AF36: =RC[-28] -> 0 | AG36: =RC[-28] -> 0 | AH36: =RC[-28] -> 0 | AI36: =RC[-28] -> 0 | AJ36: =RC[-28] -> 0 | AK36: =RC[-28] -> 0 | AL36: =RC[-28] -> 0 | AM36: =RC[-28] -> 0 | AN36: =RC[-28] -> 5.8303330000000004 | AO36: =RC[-28] -> 68.988647 | AP36: - | AQ36: =RC[-29] -> 2.5337329999999998 | AR36: =RC[-29] -> 66.761757000000003 | AS36: - | AT36: =RC[-30] -> 2.2268899999999974 | AU36: =RC[-30] -> 8.3640659999999993 | AV36: =RC[-30] -> 0.55977900000000003 | AW36: =RC[-30] -> 0.55977900000000003 | AY36: - | AZ36: - | BA36: -
A37: =IF(RC[1]="","",DATEVALUE(RC[1])) -> 43358 | B37: 15.09.18 | C37: 24 | L37: 5.9559110000000004 | M37: 67.430801000000002 | N37: 2.7234889999999998 | O37: 65.44838 | P37: =IF(AND(ISNUMBER(RC[-3]),ISNUMBER(RC[-1])),RC[-3]-RC[-1],"-") -> 1.9824210000000022 | Q37: 8.6793999999999993 | R37: 0.56857599999999997 | S37: =RC[-1] -> 0.56857599999999997 | T37: =(RC[-16]*RC[-15]-RC[-13]*RC[-12])/1000 -> 0 | U37: 5.8336490000000003 | V37: 2.670515 | W37: =RC[-2]*RC[-10]/1000 -> 0.39336762482284904 | X37: =ABS((RC[-3]*RC[-11]-RC[-2]*RC[-9])/1000) -> 0.21858674430714906 | Y37: =(RC[-14]-RC[1])/RC[-18]*100 -> #DIV/0! | Z37: =RC[-5]+RC[-4] -> 8.5041639999999994 | AC37: =VALUE(RC[-27]) -> 2018-09-15T00:00:00.000 | AD37: =IF(RC[21]=42,"*",IF(RC[21]=32,"",RC[21])) -> - | AE37: =RC[-28] -> 24 | AF37: =RC[-28] -> 0 | AG37: =RC[-28] -> 0 | AH37: =RC[-28] -> 0 | AI37: =RC[-28] -> 0 | AJ37: =RC[-28] -> 0 | AK37: =RC[-28] -> 0 | AL37: =RC[-28] -> 0 | AM37: =RC[-28] -> 0 | AN37: =RC[-28] -> 5.9559110000000004 | AO37: =RC[-28] -> 67.430801000000002 | AP37: - | AQ37: =RC[-29] -> 2.7234889999999998 | AR37: =RC[-29] -> 65.44838 | AS37: - | AT37: =RC[-30] -> 1.9824210000000022 | AU37: =RC[-30] -> 8.6793999999999993 | AV37: =RC[-30] -> 0.56857599999999997 | AW37: =RC[-30] -> 0.56857599999999997 | AY37: - | AZ37: - | BA37: -
A38: =IF(RC[1]="","",DATEVALUE(RC[1])) -> 43359 | B38: 16.09.18 | C38: 24 | L38: 7.3545550000000004 | M38: 67.824295000000006 | N38: 4.7424660000000003 | O38: 66.430519000000004 | P38: =IF(AND(ISNUMBER(RC[-3]),ISNUMBER(RC[-1])),RC[-3]-RC[-1],"-") -> 1.3937760000000026 | Q38: 12.097021 | R38: 0.79782299999999995 | S38: =RC[-1] -> 0.79782299999999995 | T38: =(RC[-16]*RC[-15]-RC[-13]*RC[-12])/1000 -> 0 | U38: 7.201956 | V38: 4.6477250000000003 | W38: =RC[-2]*RC[-10]/1000 -> 0.48846758832102005 | X38: =ABS((RC[-3]*RC[-11]-RC[-2]*RC[-9])/1000) -> 0.17971680440174503 | Y38: =(RC[-14]-RC[1])/RC[-18]*100 -> #DIV/0! | Z38: =RC[-5]+RC[-4] -> 11.849681 | AC38: =VALUE(RC[-27]) -> 2018-09-16T00:00:00.000 | AD38: =IF(RC[21]=42,"*",IF(RC[21]=32,"",RC[21])) -> - | AE38: =RC[-28] -> 24 | AF38: =RC[-28] -> 0 | AG38: =RC[-28] -> 0 | AH38: =RC[-28] -> 0 | AI38: =RC[-28] -> 0 | AJ38: =RC[-28] -> 0 | AK38: =RC[-28] -> 0 | AL38: =RC[-28] -> 0 | AM38: =RC[-28] -> 0 | AN38: =RC[-28] -> 7.3545550000000004 | AO38: =RC[-28] -> 67.824295000000006 | AP38: - | AQ38: =RC[-29] -> 4.7424660000000003 | AR38: =RC[-29] -> 66.430519000000004 | AS38: - | AT38: =RC[-30] -> 1.3937760000000026 | AU38: =RC[-30] -> 12.097021 | AV38: =RC[-30] -> 0.79782299999999995 | AW38: =RC[-30] -> 0.79782299999999995 | AY38: - | AZ38: - | BA38: -
A39: =IF(RC[1]="","",DATEVALUE(RC[1])) -> 43360 | B39: 17.09.18 | C39: 24 | L39: 7.0639440000000002 | M39: 68.512032000000005 | N39: 2.8259780000000001 | O39: 66.279381000000001 | P39: =IF(AND(ISNUMBER(RC[-3]),ISNUMBER(RC[-1])),RC[-3]-RC[-1],"-") -> 2.2326510000000042 | Q39: 9.8899220000000003 | R39: 0.65778899999999996 | S39: =RC[-1] -> 0.65778899999999996 | T39: =(RC[-16]*RC[-15]-RC[-13]*RC[-12])/1000 -> 0 | U39: 6.914606 | V39: 2.7696999999999998 | W39: =RC[-2]*RC[-10]/1000 -> 0.47373370753939203 | X39: =ABS((RC[-3]*RC[-11]-RC[-2]*RC[-9])/1000) -> 0.29015970598369201 | Y39: =(RC[-14]-RC[1])/RC[-18]*100 -> #DIV/0! | Z39: =RC[-5]+RC[-4] -> 9.6843059999999994 | AC39: =VALUE(RC[-27]) -> 2018-09-17T00:00:00.000 | AD39: =IF(RC[21]=42,"*",IF(RC[21]=32,"",RC[21])) -> - | AE39: =RC[-28] -> 24 | AF39: =RC[-28] -> 0 | AG39: =RC[-28] -> 0 | AH39: =RC[-28] -> 0 | AI39: =RC[-28] -> 0 | AJ39: =RC[-28] -> 0 | AK39: =RC[-28] -> 0 | AL39: =RC[-28] -> 0 | AM39: =RC[-28] -> 0 | AN39: =RC[-28] -> 7.0639440000000002 | AO39: =RC[-28] -> 68.512032000000005 | AP39: - | AQ39: =RC[-29] -> 2.8259780000000001 | AR39: =RC[-29] -> 66.279381000000001 | AS39: - | AT39: =RC[-30] -> 2.2326510000000042 | AU39: =RC[-30] -> 9.8899220000000003 | AV39: =RC[-30] -> 0.65778899999999996 | AW39: =RC[-30] -> 0.65778899999999996 | AY39: - | AZ39: - | BA39: -
A40: =IF(RC[1]="","",DATEVALUE(RC[1])) -> 43361 | B40: 18.09.18 | C40: 24 | L40: 6.4519440000000001 | M40: 69.309646999999998 | N40: 2.4047999999999998 | O40: 66.981560000000002 | P40: =IF(AND(ISNUMBER(RC[-3]),ISNUMBER(RC[-1])),RC[-3]-RC[-1],"-") -> 2.3280869999999965 | Q40: 8.8567440000000008 | R40: 0.59578299999999995 | S40: =RC[-1] -> 0.59578299999999995 | T40: =(RC[-16]*RC[-15]-RC[-13]*RC[-12])/1000 -> 0 | U40: 6.3126800000000003 | V40: 2.3559809999999999 | W40: =RC[-2]*RC[-10]/1000 -> 0.43752962242395999 | X40: =ABS((RC[-3]*RC[-11]-RC[-2]*RC[-9])/1000) -> 0.27972233971360005 | Y40: =(RC[-14]-RC[1])/RC[-18]*100 -> #DIV/0! | Z40: =RC[-5]+RC[-4] -> 8.6686610000000002 | AC40: =VALUE(RC[-27]) -> 2018-09-18T00:00:00.000 | AD40: =IF(RC[21]=42,"*",IF(RC[21]=32,"",RC[21])) -> - | AE40: =RC[-28] -> 24 | AF40: =RC[-28] -> 0 | AG40: =RC[-28] -> 0 | AH40: =RC[-28] -> 0 | AI40: =RC[-28] -> 0 | AJ40: =RC[-28] -> 0 | AK40: =RC[-28] -> 0 | AL40: =RC[-28] -> 0 | AM40: =RC[-28] -> 0 | AN40: =RC[-28] -> 6.4519440000000001 | AO40: =RC[-28] -> 69.309646999999998 | AP40: - | AQ40: =RC[-29] -> 2.4047999999999998 | AR40: =RC[-29] -> 66.981560000000002 | AS40: - | AT40: =RC[-30] -> 2.3280869999999965 | AU40: =RC[-30] -> 8.8567440000000008 | AV40: =RC[-30] -> 0.59578299999999995 | AW40: =RC[-30] -> 0.59578299999999995 | AY40: - | AZ40: - | BA40: -
A41: =IF(RC[1]="","",DATEVALUE(RC[1])) -> 43362 | B41: 19.09.18 | C41: 24 | L41: 6.6386329999999996 | M41: 68.135475 | N41: 3.2408440000000001 | O41: 66.398292999999995 | P41: 1.7371820000000042 | Q41: 9.8794769999999996 | R41: 0.65420900000000004 | S41: =RC[-1] -> 0.65420900000000004 | T41: =(RC[-16]*RC[-15]-RC[-13]*RC[-12])/1000 -> 0 | W41: =RC[-2]*RC[-10]/1000 -> #VALUE! | X41: =ABS((RC[-3]*RC[-11]-RC[-2]*RC[-9])/1000) -> #VALUE! | Y41: =(RC[-14]-RC[1])/RC[-18]*100 -> #VALUE! | Z41: =RC[-5]+RC[-4] -> #VALUE! | AC41: =VALUE(RC[-27]) -> 2018-09-19T00:00:00.000 | AD41: =IF(RC[21]=42,"*",IF(RC[21]=32,"",RC[21])) ->  | AE41: =RC[-28] -> 24 | AF41: =RC[-28] -> 0 | AG41: =RC[-28] -> 0 | AH41: =RC[-28] -> 0 | AI41: =RC[-28] -> 0 | AJ41: =RC[-28] -> 0 | AK41: =RC[-28] -> 0 | AL41: =RC[-28] -> 0 | AM41: =RC[-28] -> 0 | AN41: =RC[-28] -> 6.6386329999999996 | AO41: =RC[-28] -> 68.135475 | AP41: - | AQ41: =RC[-29] -> 3.2408440000000001 | AR41: =RC[-29] -> 66.398292999999995 | AS41: - | AT41: =RC[-30] -> 1.7371820000000042 | AU41: =RC[-30] -> 9.8794769999999996 | AV41: =RC[-30] -> 0.65420900000000004 | AW41: =RC[-30] -> 0.65420900000000004
A42: =IF(RC[1]="","",DATEVALUE(RC[1])) -> 43363 | B42: 20.09.18 | C42: 24 | L42: 6.0144549999999999 | M42: 69.803764000000001 | N42: 2.936045 | O42: 67.867217999999994 | P42: 1.936546000000007 | Q42: 8.9504999999999999 | R42: 0.60622600000000004 | S42: =RC[-1] -> 0.60622600000000004 | T42: =(RC[-16]*RC[-15]-RC[-13]*RC[-12])/1000 -> 0 | W42: =RC[-2]*RC[-10]/1000 -> #VALUE! | X42: =ABS((RC[-3]*RC[-11]-RC[-2]*RC[-9])/1000) -> #VALUE! | Y42: =(RC[-14]-RC[1])/RC[-18]*100 -> #VALUE! | Z42: =RC[-5]+RC[-4] -> #VALUE! | AC42: =VALUE(RC[-27]) -> 2018-09-20T00:00:00.000 | AD42: =IF(RC[21]=42,"*",IF(RC[21]=32,"",RC[21])) ->  | AE42: =RC[-28] -> 24 | AF42: =RC[-28] -> 0 | AG42: =RC[-28] -> 0 | AH42: =RC[-28] -> 0 | AI42: =RC[-28] -> 0 | AJ42: =RC[-28] -> 0 | AK42: =RC[-28] -> 0 | AL42: =RC[-28] -> 0 | AM42: =RC[-28] -> 0 | AN42: =RC[-28] -> 6.0144549999999999 | AO42: =RC[-28] -> 69.803764000000001 | AP42: - | AQ42: =RC[-29] -> 2.936045 | AR42: =RC[-29] -> 67.867217999999994 | AS42: - | AT42: =RC[-30] -> 1.936546000000007 | AU42: =RC[-30] -> 8.9504999999999999 | AV42: =RC[-30] -> 0.60622600000000004 | AW42: =RC[-30] -> 0.60622600000000004
A43: =IF(RC[1]="","",DATEVALUE(RC[1])) -> 43364 | B43: 21.09.18 | C43: 24 | L43: 7.0503330000000002 | M43: 70.215248000000003 | N43: 2.7400660000000001 | O43: 67.917732000000001 | P43: 2.2975160000000017 | Q43: 9.7903990000000007 | R43: 0.66682799999999998 | S43: =RC[-1] -> 0.66682799999999998 | T43: =(RC[-16]*RC[-15]-RC[-13]*RC[-12])/1000 -> 0 | W43: =RC[-2]*RC[-10]/1000 -> #VALUE! | X43: =ABS((RC[-3]*RC[-11]-RC[-2]*RC[-9])/1000) -> #VALUE! | Y43: =(RC[-14]-RC[1])/RC[-18]*100 -> #VALUE! | Z43: =RC[-5]+RC[-4] -> #VALUE! | AC43: =VALUE(RC[-27]) -> 2018-09-21T00:00:00.000 | AD43: =IF(RC[21]=42,"*",IF(RC[21]=32,"",RC[21])) ->  | AE43: =RC[-28] -> 24 | AF43: =RC[-28] -> 0 | AG43: =RC[-28] -> 0 | AH43: =RC[-28] -> 0 | AI43: =RC[-28] -> 0 | AJ43: =RC[-28] -> 0 | AK43: =RC[-28] -> 0 | AL43: =RC[-28] -> 0 | AM43: =RC[-28] -> 0 | AN43: =RC[-28] -> 7.0503330000000002 | AO43: =RC[-28] -> 70.215248000000003 | AP43: - | AQ43: =RC[-29] -> 2.7400660000000001 | AR43: =RC[-29] -> 67.917732000000001 | AS43: - | AT43: =RC[-30] -> 2.2975160000000017 | AU43: =RC[-30] -> 9.7903990000000007 | AV43: =RC[-30] -> 0.66682799999999998 | AW43: =RC[-30] -> 0.66682799999999998
A44: =IF(RC[1]="","",DATEVALUE(RC[1])) -> 43365 | B44: 22.09.18 | C44: 24 | L44: 6.270499 | M44: 70.061874000000003 | N44: 2.385189 | O44: 67.660094999999998 | P44: 2.4017790000000048 | Q44: 8.6556879999999996 | R44: 0.58813899999999997 | S44: =RC[-1] -> 0.58813899999999997 | T44: =(RC[-16]*RC[-15]-RC[-13]*RC[-12])/1000 -> 0 | W44: =RC[-2]*RC[-10]/1000 -> #VALUE! | X44: =ABS((RC[-3]*RC[-11]-RC[-2]*RC[-9])/1000) -> #VALUE! | Y44: =(RC[-14]-RC[1])/RC[-18]*100 -> #VALUE! | Z44: =RC[-5]+RC[-4] -> #VALUE! | AC44: =VALUE(RC[-27]) -> 2018-09-22T00:00:00.000 | AD44: =IF(RC[21]=42,"*",IF(RC[21]=32,"",RC[21])) ->  | AE44: =RC[-28] -> 24 | AF44: =RC[-28] -> 0 | AG44: =RC[-28] -> 0 | AH44: =RC[-28] -> 0 | AI44: =RC[-28] -> 0 | AJ44: =RC[-28] -> 0 | AK44: =RC[-28] -> 0 | AL44: =RC[-28] -> 0 | AM44: =RC[-28] -> 0 | AN44: =RC[-28] -> 6.270499 | AO44: =RC[-28] -> 70.061874000000003 | AP44: - | AQ44: =RC[-29] -> 2.385189 | AR44: =RC[-29] -> 67.660094999999998 | AS44: - | AT44: =RC[-30] -> 2.4017790000000048 | AU44: =RC[-30] -> 8.6556879999999996 | AV44: =RC[-30] -> 0.58813899999999997 | AW44: =RC[-30] -> 0.58813899999999997
A45: =IF(RC[1]="","",DATEVALUE(RC[1])) ->  | C45: 24 | P45: =IF(AND(ISNUMBER(RC[-3]),ISNUMBER(RC[-1])),RC[-3]-RC[-1],"-") -> - | S45: =RC[-1] ->  | T45: =(RC[-16]*RC[-15]-RC[-13]*RC[-12])/1000 -> 0 | W45: =RC[-2]*RC[-10]/1000 -> #VALUE! | X45: =ABS((RC[-3]*RC[-11]-RC[-2]*RC[-9])/1000) -> #VALUE! | Y45: =(RC[-14]-RC[1])/RC[-18]*100 -> #VALUE! | Z45: =RC[-5]+RC[-4] -> #VALUE! | AC45: =VALUE(RC[-27]) -> #VALUE! | AD45: =IF(RC[21]=42,"*",IF(RC[21]=32,"",RC[21])) ->  | AE45: =RC[-28] -> 24 | AF45: =RC[-28] -> 0 | AG45: =RC[-28] -> 0 | AH45: =RC[-28] -> 0 | AI45: =RC[-28] -> 0 | AJ45: =RC[-28] -> 0 | AK45: =RC[-28] -> 0 | AL45: =RC[-28] -> 0 | AM45: =RC[-28] -> 0 | AN45: =RC[-28] ->  | AO45: =RC[-28] ->  | AP45: - | AQ45: =RC[-29] ->  | AR45: =RC[-29] ->  | AS45: - | AT45: =RC[-30] -> - | AU45: =RC[-30] ->  | AV45: =RC[-30] ->  | AW45: =RC[-30] -> 
A46: =IF(RC[1]="","",DATEVALUE(RC[1])) ->  | C46: 24 | P46: =IF(AND(ISNUMBER(RC[-3]),ISNUMBER(RC[-1])),RC[-3]-RC[-1],"-") -> - | S46: =RC[-1] ->  | T46: =(RC[-16]*RC[-15]-RC[-13]*RC[-12])/1000 -> 0 | W46: =RC[-2]*RC[-10]/1000 -> #VALUE! | X46: =ABS((RC[-3]*RC[-11]-RC[-2]*RC[-9])/1000) -> #VALUE! | Y46: =(RC[-14]-RC[1])/RC[-18]*100 -> #VALUE! | Z46: =RC[-5]+RC[-4] -> #VALUE! | AC46: =VALUE(RC[-27]) -> #VALUE! | AD46: =IF(RC[21]=42,"*",IF(RC[21]=32,"",RC[21])) ->  | AE46: =RC[-28] -> 24 | AF46: =RC[-28] -> 0 | AG46: =RC[-28] -> 0 | AH46: =RC[-28] -> 0 | AI46: =RC[-28] -> 0 | AJ46: =RC[-28] -> 0 | AK46: =RC[-28] -> 0 | AL46: =RC[-28] -> 0 | AM46: =RC[-28] -> 0 | AN46: =RC[-28] ->  | AO46: =RC[-28] ->  | AP46: - | AQ46: =RC[-29] ->  | AR46: =RC[-29] ->  | AS46: - | AT46: =RC[-30] -> - | AU46: =RC[-30] ->  | AV46: =RC[-30] ->  | AW46: =RC[-30] -> 
A47: =IF(RC[1]="","",DATEVALUE(RC[1])) ->  | C47: 24 | P47: =IF(AND(ISNUMBER(RC[-3]),ISNUMBER(RC[-1])),RC[-3]-RC[-1],"-") -> - | S47: =RC[-1] ->  | T47: =(RC[-16]*RC[-15]-RC[-13]*RC[-12])/1000 -> 0 | W47: =RC[-2]*RC[-10]/1000 -> #VALUE! | X47: =ABS((RC[-3]*RC[-11]-RC[-2]*RC[-9])/1000) -> #VALUE! | Y47: =(RC[-14]-RC[1])/RC[-18]*100 -> #VALUE! | Z47: =RC[-5]+RC[-4] -> #VALUE! | AC47: =VALUE(RC[-27]) -> #VALUE! | AD47: =IF(RC[21]=42,"*",IF(RC[21]=32,"",RC[21])) ->  | AE47: =RC[-28] -> 24 | AF47: =RC[-28] -> 0 | AG47: =RC[-28] -> 0 | AH47: =RC[-28] -> 0 | AI47: =RC[-28] -> 0 | AJ47: =RC[-28] -> 0 | AK47: =RC[-28] -> 0 | AL47: =RC[-28] -> 0 | AM47: =RC[-28] -> 0 | AN47: =RC[-28] ->  | AO47: =RC[-28] ->  | AP47: - | AQ47: =RC[-29] ->  | AR47: =RC[-29] ->  | AS47: - | AT47: =RC[-30] -> - | AU47: =RC[-30] ->  | AV47: =RC[-30] ->  | AW47: =RC[-30] -> 
A48: =IF(RC[1]="","",DATEVALUE(RC[1])) ->  | C48: 24 | P48: =IF(AND(ISNUMBER(RC[-3]),ISNUMBER(RC[-1])),RC[-3]-RC[-1],"-") -> - | S48: =RC[-1] ->  | T48: =(RC[-16]*RC[-15]-RC[-13]*RC[-12])/1000 -> 0 | W48: =RC[-2]*RC[-10]/1000 -> #VALUE! | X48: =ABS((RC[-3]*RC[-11]-RC[-2]*RC[-9])/1000) -> #VALUE! | Y48: =(RC[-14]-RC[1])/RC[-18]*100 -> #VALUE! | Z48: =RC[-5]+RC[-4] -> #VALUE! | AC48: =VALUE(RC[-27]) -> #VALUE! | AD48: =IF(RC[21]=42,"*",IF(RC[21]=32,"",RC[21])) ->  | AE48: =RC[-28] -> 24 | AF48: =RC[-28] -> 0 | AG48: =RC[-28] -> 0 | AH48: =RC[-28] -> 0 | AI48: =RC[-28] -> 0 | AJ48: =RC[-28] -> 0 | AK48: =RC[-28] -> 0 | AL48: =RC[-28] -> 0 | AM48: =RC[-28] -> 0 | AN48: =RC[-28] ->  | AO48: =RC[-28] ->  | AP48: - | AQ48: =RC[-29] ->  | AR48: =RC[-29] ->  | AS48: - | AT48: =RC[-30] -> - | AU48: =RC[-30] ->  | AV48: =RC[-30] ->  | AW48: =RC[-30] -> 
A49: =IF(RC[1]="","",DATEVALUE(RC[1])) ->  | C49: 24 | P49: =IF(AND(ISNUMBER(RC[-3]),ISNUMBER(RC[-1])),RC[-3]-RC[-1],"-") -> - | S49: =RC[-1] ->  | T49: =(RC[-16]*RC[-15]-RC[-13]*RC[-12])/1000 -> 0 | W49: =RC[-2]*RC[-10]/1000 -> #VALUE! | X49: =ABS((RC[-3]*RC[-11]-RC[-2]*RC[-9])/1000) -> #VALUE! | Y49: =(RC[-14]-RC[1])/RC[-18]*100 -> #VALUE! | Z49: =RC[-5]+RC[-4] -> #VALUE! | AC49: =VALUE(RC[-27]) -> #VALUE! | AD49: =IF(RC[21]=42,"*",IF(RC[21]=32,"",RC[21])) ->  | AE49: =RC[-28] -> 24 | AF49: =RC[-28] -> 0 | AG49: =RC[-28] -> 0 | AH49: =RC[-28] -> 0 | AI49: =RC[-28] -> 0 | AJ49: =RC[-28] -> 0 | AK49: =RC[-28] -> 0 | AL49: =RC[-28] -> 0 | AM49: =RC[-28] -> 0 | AN49: =RC[-28] ->  | AO49: =RC[-28] ->  | AP49: - | AQ49: =RC[-29] ->  | AR49: =RC[-29] ->  | AS49: - | AT49: =RC[-30] -> - | AU49: =RC[-30] ->  | AV49: =RC[-30] ->  | AW49: =RC[-30] -> 
A50: =IF(RC[1]="","",DATEVALUE(RC[1])) ->  | P50: =IF(AND(ISNUMBER(RC[-3]),ISNUMBER(RC[-1])),RC[-3]-RC[-1],"-") -> - | S50: =RC[-1] ->  | T50: =(RC[-16]*RC[-15]-RC[-13]*RC[-12])/1000 -> 0 | W50: =RC[-2]*RC[-10]/1000 -> #VALUE! | X50: =ABS((RC[-3]*RC[-11]-RC[-2]*RC[-9])/1000) -> #VALUE! | Y50: =(RC[-14]-RC[1])/RC[-18]*100 -> #VALUE! | Z50: =RC[-5]+RC[-4] -> #VALUE! | AC50: =VALUE(RC[-27]) -> #VALUE! | AD50: =IF(RC[21]=42,"*",IF(RC[21]=32,"",RC[21])) ->  | AE50: =RC[-28] ->  | AF50: =RC[-28] -> 0 | AG50: =RC[-28] -> 0 | AH50: =RC[-28] -> 0 | AI50: =RC[-28] -> 0 | AJ50: =RC[-28] -> 0 | AK50: =RC[-28] -> 0 | AL50: =RC[-28] -> 0 | AM50: =RC[-28] -> 0 | AN50: =RC[-28] ->  | AO50: =RC[-28] ->  | AP50: - | AQ50: =RC[-29] ->  | AR50: =RC[-29] ->  | AS50: - | AT50: =RC[-30] -> - | AU50: =RC[-30] ->  | AV50: =RC[-30] ->  | AW50: =RC[-30] -> 
A51: =IF(RC[1]="","",DATEVALUE(RC[1])) ->  | P51: =IF(AND(ISNUMBER(RC[-3]),ISNUMBER(RC[-1])),RC[-3]-RC[-1],"-") -> - | S51: =RC[-1] ->  | T51: =(RC[-16]*RC[-15]-RC[-13]*RC[-12])/1000 -> 0 | W51: =RC[-2]*RC[-10]/1000 -> #VALUE! | X51: =ABS((RC[-3]*RC[-11]-RC[-2]*RC[-9])/1000) -> #VALUE! | Y51: =(RC[-14]-RC[1])/RC[-18]*100 -> #VALUE! | Z51: =RC[-5]+RC[-4] -> #VALUE! | AC51: =VALUE(RC[-27]) -> #VALUE! | AD51: =IF(RC[21]=42,"*",IF(RC[21]=32,"",RC[21])) ->  | AE51: =RC[-28] ->  | AF51: =RC[-28] -> 0 | AG51: =RC[-28] -> 0 | AH51: =RC[-28] -> 0 | AI51: =RC[-28] -> 0 | AJ51: =RC[-28] -> 0 | AK51: =RC[-28] -> 0 | AL51: =RC[-28] -> 0 | AM51: =RC[-28] -> 0 | AN51: =RC[-28] ->  | AO51: =RC[-28] ->  | AP51: - | AQ51: =RC[-29] ->  | AR51: =RC[-29] ->  | AS51: - | AT51: =RC[-30] -> - | AU51: =RC[-30] ->  | AV51: =RC[-30] ->  | AW51: =RC[-30] -> 
A52: =IF(RC[1]="","",DATEVALUE(RC[1])) ->  | P52: =IF(AND(ISNUMBER(RC[-3]),ISNUMBER(RC[-1])),RC[-3]-RC[-1],"-") -> - | S52: =RC[-1] ->  | T52: =(RC[-16]*RC[-15]-RC[-13]*RC[-12])/1000 -> 0 | W52: =RC[-2]*RC[-10]/1000 -> #VALUE! | X52: =ABS((RC[-3]*RC[-11]-RC[-2]*RC[-9])/1000) -> #VALUE! | Y52: =(RC[-14]-RC[1])/RC[-18]*100 -> #VALUE! | Z52: =RC[-5]+RC[-4] -> #VALUE! | AC52: =VALUE(RC[-27]) -> #VALUE! | AD52: =IF(RC[21]=42,"*",IF(RC[21]=32,"",RC[21])) ->  | AE52: =RC[-28] ->  | AF52: =RC[-28] -> 0 | AG52: =RC[-28] -> 0 | AH52: =RC[-28] -> 0 | AI52: =RC[-28] -> 0 | AJ52: =RC[-28] -> 0 | AK52: =RC[-28] -> 0 | AL52: =RC[-28] -> 0 | AM52: =RC[-28] -> 0 | AN52: =RC[-28] ->  | AO52: =RC[-28] ->  | AP52: - | AQ52: =RC[-29] ->  | AR52: =RC[-29] ->  | AS52: - | AT52: =RC[-30] -> - | AU52: =RC[-30] ->  | AV52: =RC[-30] ->  | AW52: =RC[-30] -> 
A53: =IF(RC[1]="","",DATEVALUE(RC[1])) ->  | P53: =IF(AND(ISNUMBER(RC[-3]),ISNUMBER(RC[-1])),RC[-3]-RC[-1],"-") -> - | S53: =RC[-1] ->  | T53: =(RC[-16]*RC[-15]-RC[-13]*RC[-12])/1000 -> 0 | W53: =RC[-2]*RC[-10]/1000 -> #VALUE! | X53: =ABS((RC[-3]*RC[-11]-RC[-2]*RC[-9])/1000) -> #VALUE! | Y53: =(RC[-14]-RC[1])/RC[-18]*100 -> #VALUE! | Z53: =RC[-5]+RC[-4] -> #VALUE! | AC53: =VALUE(RC[-27]) -> #VALUE! | AD53: =IF(RC[21]=42,"*",IF(RC[21]=32,"",RC[21])) ->  | AE53: =RC[-28] ->  | AF53: =RC[-28] -> 0 | AG53: =RC[-28] -> 0 | AH53: =RC[-28] -> 0 | AI53: =RC[-28] -> 0 | AJ53: =RC[-28] -> 0 | AK53: =RC[-28] -> 0 | AL53: =RC[-28] -> 0 | AM53: =RC[-28] -> 0 | AN53: =RC[-28] ->  | AO53: =RC[-28] ->  | AP53: - | AQ53: =RC[-29] ->  | AR53: =RC[-29] ->  | AS53: - | AT53: =RC[-30] -> - | AU53: =RC[-30] ->  | AV53: =RC[-30] ->  | AW53: =RC[-30] -> 
A54: =IF(RC[1]="","",DATEVALUE(RC[1])) ->  | P54: =IF(AND(ISNUMBER(RC[-3]),ISNUMBER(RC[-1])),RC[-3]-RC[-1],"-") -> - | S54: =RC[-1] ->  | T54: =(RC[-16]*RC[-15]-RC[-13]*RC[-12])/1000 -> 0 | W54: =RC[-2]*RC[-10]/1000 -> #VALUE! | X54: =ABS((RC[-3]*RC[-11]-RC[-2]*RC[-9])/1000) -> #VALUE! | Y54: =(RC[-14]-RC[1])/RC[-18]*100 -> #VALUE! | Z54: =RC[-5]+RC[-4] -> #VALUE! | AC54: =VALUE(RC[-27]) -> #VALUE! | AD54: =IF(RC[21]=42,"*",IF(RC[21]=32,"",RC[21])) ->  | AE54: =RC[-28] ->  | AF54: =RC[-28] -> 0 | AG54: =RC[-28] -> 0 | AH54: =RC[-28] -> 0 | AI54: =RC[-28] -> 0 | AJ54: =RC[-28] -> 0 | AK54: =RC[-28] -> 0 | AL54: =RC[-28] -> 0 | AM54: =RC[-28] -> 0 | AN54: =RC[-28] ->  | AO54: =RC[-28] ->  | AP54: - | AQ54: =RC[-29] ->  | AR54: =RC[-29] ->  | AS54: - | AT54: =RC[-30] -> - | AU54: =RC[-30] ->  | AV54: =RC[-30] ->  | AW54: =RC[-30] -> 
A55: =IF(RC[1]="","",DATEVALUE(RC[1])) ->  | P55: =IF(AND(ISNUMBER(RC[-3]),ISNUMBER(RC[-1])),RC[-3]-RC[-1],"-") -> - | S55: =RC[-1] ->  | T55: =(RC[-16]*RC[-15]-RC[-13]*RC[-12])/1000 -> 0 | W55: =RC[-2]*RC[-10]/1000 -> #VALUE! | X55: =ABS((RC[-3]*RC[-11]-RC[-2]*RC[-9])/1000) -> #VALUE! | Y55: =(RC[-14]-RC[1])/RC[-18]*100 -> #VALUE! | Z55: =RC[-5]+RC[-4] -> #VALUE! | AC55: =VALUE(RC[-27]) -> #VALUE! | AD55: =IF(RC[21]=42,"*",IF(RC[21]=32,"",RC[21])) ->  | AE55: =RC[-28] ->  | AF55: =RC[-28] -> 0 | AG55: =RC[-28] -> 0 | AH55: =RC[-28] -> 0 | AI55: =RC[-28] -> 0 | AJ55: =RC[-28] -> 0 | AK55: =RC[-28] -> 0 | AL55: =RC[-28] -> 0 | AM55: =RC[-28] -> 0 | AN55: =RC[-28] ->  | AO55: =RC[-28] ->  | AP55: - | AQ55: =RC[-29] ->  | AR55: =RC[-29] ->  | AS55: - | AT55: =RC[-30] -> - | AU55: =RC[-30] ->  | AV55: =RC[-30] ->  | AW55: =RC[-30] -> 
A56: =IF(RC[1]="","",DATEVALUE(RC[1])) ->  | P56: =IF(AND(ISNUMBER(RC[-3]),ISNUMBER(RC[-1])),RC[-3]-RC[-1],"-") -> - | S56: =RC[-1] ->  | T56: =(RC[-16]*RC[-15]-RC[-13]*RC[-12])/1000 -> 0 | W56: =RC[-2]*RC[-10]/1000 -> #VALUE! | X56: =ABS((RC[-3]*RC[-11]-RC[-2]*RC[-9])/1000) -> #VALUE! | Y56: =(RC[-14]-RC[1])/RC[-18]*100 -> #VALUE! | Z56: =RC[-5]+RC[-4] -> #VALUE! | AC56: =VALUE(RC[-27]) -> #VALUE! | AD56: =IF(RC[21]=42,"*",IF(RC[21]=32,"",RC[21])) ->  | AE56: =RC[-28] ->  | AF56: =RC[-28] -> 0 | AG56: =RC[-28] -> 0 | AH56: =RC[-28] -> 0 | AI56: =RC[-28] -> 0 | AJ56: =RC[-28] -> 0 | AK56: =RC[-28] -> 0 | AL56: =RC[-28] -> 0 | AM56: =RC[-28] -> 0 | AN56: =RC[-28] ->  | AO56: =RC[-28] ->  | AP56: - | AQ56: =RC[-29] ->  | AR56: =RC[-29] ->  | AS56: - | AT56: =RC[-30] -> - | AU56: =RC[-30] ->  | AV56: =RC[-30] ->  | AW56: =RC[-30] -> 
A57: =IF(RC[1]="","",DATEVALUE(RC[1])) ->  | P57: =IF(AND(ISNUMBER(RC[-3]),ISNUMBER(RC[-1])),RC[-3]-RC[-1],"-") -> - | S57: =RC[-1] ->  | T57: =(RC[-16]*RC[-15]-RC[-13]*RC[-12])/1000 -> 0 | W57: =RC[-2]*RC[-10]/1000 -> #VALUE! | X57: =ABS((RC[-3]*RC[-11]-RC[-2]*RC[-9])/1000) -> #VALUE! | Y57: =(RC[-14]-RC[1])/RC[-18]*100 -> #VALUE! | Z57: =RC[-5]+RC[-4] -> #VALUE! | AC57: =VALUE(RC[-27]) -> #VALUE! | AD57: =IF(RC[21]=42,"*",IF(RC[21]=32,"",RC[21])) ->  | AE57: =RC[-28] ->  | AF57: =RC[-28] -> 0 | AG57: =RC[-28] -> 0 | AH57: =RC[-28] -> 0 | AI57: =RC[-28] -> 0 | AJ57: =RC[-28] -> 0 | AK57: =RC[-28] -> 0 | AL57: =RC[-28] -> 0 | AM57: =RC[-28] -> 0 | AN57: =RC[-28] ->  | AO57: =RC[-28] ->  | AP57: - | AQ57: =RC[-29] ->  | AR57: =RC[-29] ->  | AS57: - | AT57: =RC[-30] -> - | AU57: =RC[-30] ->  | AV57: =RC[-30] ->  | AW57: =RC[-30] -> 
A58: =IF(RC[1]="","",DATEVALUE(RC[1])) ->  | P58: =IF(AND(ISNUMBER(RC[-3]),ISNUMBER(RC[-1])),RC[-3]-RC[-1],"-") -> - | S58: =RC[-1] ->  | T58: =(RC[-16]*RC[-15]-RC[-13]*RC[-12])/1000 -> 0 | W58: =RC[-2]*RC[-10]/1000 -> #VALUE! | X58: =ABS((RC[-3]*RC[-11]-RC[-2]*RC[-9])/1000) -> #VALUE! | Y58: =(RC[-14]-RC[1])/RC[-18]*100 -> #VALUE! | Z58: =RC[-5]+RC[-4] -> #VALUE! | AC58: =VALUE(RC[-27]) -> #VALUE! | AD58: =IF(RC[21]=42,"*",IF(RC[21]=32,"",RC[21])) ->  | AE58: =RC[-28] ->  | AF58: =RC[-28] -> 0 | AG58: =RC[-28] -> 0 | AH58: =RC[-28] -> 0 | AI58: =RC[-28] -> 0 | AJ58: =RC[-28] -> 0 | AK58: =RC[-28] -> 0 | AL58: =RC[-28] -> 0 | AM58: =RC[-28] -> 0 | AN58: =RC[-28] ->  | AO58: =RC[-28] ->  | AP58: - | AQ58: =RC[-29] ->  | AR58: =RC[-29] ->  | AS58: - | AT58: =RC[-30] -> - | AU58: =RC[-30] ->  | AV58: =RC[-30] ->  | AW58: =RC[-30] -> 
A59: =IF(RC[1]="","",DATEVALUE(RC[1])) ->  | P59: =IF(AND(ISNUMBER(RC[-3]),ISNUMBER(RC[-1])),RC[-3]-RC[-1],"-") -> - | S59: =RC[-1] ->  | T59: =(RC[-16]*RC[-15]-RC[-13]*RC[-12])/1000 -> 0 | W59: =RC[-2]*RC[-10]/1000 -> #VALUE! | X59: =ABS((RC[-3]*RC[-11]-RC[-2]*RC[-9])/1000) -> #VALUE! | Y59: =(RC[-14]-RC[1])/RC[-18]*100 -> #VALUE! | Z59: =RC[-5]+RC[-4] -> #VALUE! | AC59: =VALUE(RC[-27]) -> #VALUE! | AD59: =IF(RC[21]=42,"*",IF(RC[21]=32,"",RC[21])) ->  | AE59: =RC[-28] ->  | AF59: =RC[-28] -> 0 | AG59: =RC[-28] -> 0 | AH59: =RC[-28] -> 0 | AI59: =RC[-28] -> 0 | AJ59: =RC[-28] -> 0 | AK59: =RC[-28] -> 0 | AL59: =RC[-28] -> 0 | AM59: =RC[-28] -> 0 | AN59: =RC[-28] ->  | AO59: =RC[-28] ->  | AP59: - | AQ59: =RC[-29] ->  | AR59: =RC[-29] ->  | AS59: - | AT59: =RC[-30] -> - | AU59: =RC[-30] ->  | AV59: =RC[-30] ->  | AW59: =RC[-30] -> 
A60: =IF(RC[1]="","",DATEVALUE(RC[1])) ->  | P60: =IF(AND(ISNUMBER(RC[-3]),ISNUMBER(RC[-1])),RC[-3]-RC[-1],"-") -> - | S60: =RC[-1] ->  | T60: =(RC[-16]*RC[-15]-RC[-13]*RC[-12])/1000 -> 0 | W60: =RC[-2]*RC[-10]/1000 -> #VALUE! | X60: =ABS((RC[-3]*RC[-11]-RC[-2]*RC[-9])/1000) -> #VALUE! | Y60: =(RC[-14]-RC[1])/RC[-18]*100 -> #VALUE! | Z60: =RC[-5]+RC[-4] -> #VALUE! | AC60: =VALUE(RC[-27]) -> #VALUE! | AD60: =IF(RC[21]=42,"*",IF(RC[21]=32,"",RC[21])) ->  | AE60: =RC[-28] ->  | AF60: =RC[-28] -> 0 | AG60: =RC[-28] -> 0 | AH60: =RC[-28] -> 0 | AI60: =RC[-28] -> 0 | AJ60: =RC[-28] -> 0 | AK60: =RC[-28] -> 0 | AL60: =RC[-28] -> 0 | AM60: =RC[-28] -> 0 | AN60: =RC[-28] ->  | AO60: =RC[-28] ->  | AP60: - | AQ60: =RC[-29] ->  | AR60: =RC[-29] ->  | AS60: - | AT60: =RC[-30] -> - | AU60: =RC[-30] ->  | AV60: =RC[-30] ->  | AW60: =RC[-30] -> 
A61: =IF(RC[1]="","",DATEVALUE(RC[1])) ->  | P61: =IF(AND(ISNUMBER(RC[-3]),ISNUMBER(RC[-1])),RC[-3]-RC[-1],"-") -> - | S61: =RC[-1] ->  | T61: =(RC[-16]*RC[-15]-RC[-13]*RC[-12])/1000 -> 0 | W61: =RC[-2]*RC[-10]/1000 -> #VALUE! | X61: =ABS((RC[-3]*RC[-11]-RC[-2]*RC[-9])/1000) -> #VALUE! | Y61: =(RC[-14]-RC[1])/RC[-18]*100 -> #VALUE! | Z61: =RC[-5]+RC[-4] -> #VALUE! | AC61: =VALUE(RC[-27]) -> #VALUE! | AD61: =IF(RC[21]=42,"*",IF(RC[21]=32,"",RC[21])) ->  | AE61: =RC[-28] ->  | AF61: =RC[-28] -> 0 | AG61: =RC[-28] -> 0 | AH61: =RC[-28] -> 0 | AI61: =RC[-28] -> 0 | AJ61: =RC[-28] -> 0 | AK61: =RC[-28] -> 0 | AL61: =RC[-28] -> 0 | AM61: =RC[-28] -> 0 | AN61: =RC[-28] ->  | AO61: =RC[-28] ->  | AP61: - | AQ61: =RC[-29] ->  | AR61: =RC[-29] ->  | AS61: - | AT61: =RC[-30] -> - | AU61: =RC[-30] ->  | AV61: =RC[-30] ->  | AW61: =RC[-30] -> 
A62: =IF(RC[1]="","",DATEVALUE(RC[1])) ->  | P62: =IF(AND(ISNUMBER(RC[-3]),ISNUMBER(RC[-1])),RC[-3]-RC[-1],"-") -> - | S62: =RC[-1] ->  | T62: =(RC[-16]*RC[-15]-RC[-13]*RC[-12])/1000 -> 0 | W62: =RC[-2]*RC[-10]/1000 -> #VALUE! | X62: =ABS((RC[-3]*RC[-11]-RC[-2]*RC[-9])/1000) -> #VALUE! | Y62: =(RC[-14]-RC[1])/RC[-18]*100 -> #VALUE! | Z62: =RC[-5]+RC[-4] -> #VALUE! | AC62: =VALUE(RC[-27]) -> #VALUE! | AD62: =IF(RC[21]=42,"*",IF(RC[21]=32,"",RC[21])) ->  | AE62: =RC[-28] ->  | AF62: =RC[-28] -> 0 | AG62: =RC[-28] -> 0 | AH62: =RC[-28] -> 0 | AI62: =RC[-28] -> 0 | AJ62: =RC[-28] -> 0 | AK62: =RC[-28] -> 0 | AL62: =RC[-28] -> 0 | AM62: =RC[-28] -> 0 | AN62: =RC[-28] ->  | AO62: =RC[-28] ->  | AP62: - | AQ62: =RC[-29] ->  | AR62: =RC[-29] ->  | AS62: - | AT62: =RC[-30] -> - | AU62: =RC[-30] ->  | AV62: =RC[-30] ->  | AW62: =RC[-30] -> 
A63: =IF(RC[1]="","",DATEVALUE(RC[1])) ->  | P63: =IF(AND(ISNUMBER(RC[-3]),ISNUMBER(RC[-1])),RC[-3]-RC[-1],"-") -> - | S63: =RC[-1] ->  | T63: =(RC[-16]*RC[-15]-RC[-13]*RC[-12])/1000 -> 0 | W63: =RC[-2]*RC[-10]/1000 -> #VALUE! | X63: =ABS((RC[-3]*RC[-11]-RC[-2]*RC[-9])/1000) -> #VALUE! | Y63: =(RC[-14]-RC[1])/RC[-18]*100 -> #VALUE! | Z63: =RC[-5]+RC[-4] -> #VALUE! | AC63: =VALUE(RC[-27]) -> #VALUE! | AD63: =IF(RC[21]=42,"*",IF(RC[21]=32,"",RC[21])) ->  | AE63: =RC[-28] ->  | AF63: =RC[-28] -> 0 | AG63: =RC[-28] -> 0 | AH63: =RC[-28] -> 0 | AI63: =RC[-28] -> 0 | AJ63: =RC[-28] -> 0 | AK63: =RC[-28] -> 0 | AL63: =RC[-28] -> 0 | AM63: =RC[-28] -> 0 | AN63: =RC[-28] ->  | AO63: =RC[-28] ->  | AP63: - | AQ63: =RC[-29] ->  | AR63: =RC[-29] ->  | AS63: - | AT63: =RC[-30] -> - | AU63: =RC[-30] ->  | AV63: =RC[-30] ->  | AW63: =RC[-30] -> 
A64: =IF(RC[1]="","",DATEVALUE(RC[1])) ->  | P64: =IF(AND(ISNUMBER(RC[-3]),ISNUMBER(RC[-1])),RC[-3]-RC[-1],"-") -> - | S64: =RC[-1] ->  | T64: =(RC[-16]*RC[-15]-RC[-13]*RC[-12])/1000 -> 0 | W64: =RC[-2]*RC[-10]/1000 -> #VALUE! | X64: =ABS((RC[-3]*RC[-11]-RC[-2]*RC[-9])/1000) -> #VALUE! | Y64: =(RC[-14]-RC[1])/RC[-18]*100 -> #VALUE! | Z64: =RC[-5]+RC[-4] -> #VALUE! | AC64: =VALUE(RC[-27]) -> #VALUE! | AD64: =IF(RC[21]=42,"*",IF(RC[21]=32,"",RC[21])) ->  | AE64: =RC[-28] ->  | AF64: =RC[-28] -> 0 | AG64: =RC[-28] -> 0 | AH64: =RC[-28] -> 0 | AI64: =RC[-28] -> 0 | AJ64: =RC[-28] -> 0 | AK64: =RC[-28] -> 0 | AL64: =RC[-28] -> 0 | AM64: =RC[-28] -> 0 | AN64: =RC[-28] ->  | AO64: =RC[-28] ->  | AP64: - | AQ64: =RC[-29] ->  | AR64: =RC[-29] ->  | AS64: - | AT64: =RC[-30] -> - | AU64: =RC[-30] ->  | AV64: =RC[-30] ->  | AW64: =RC[-30] -> 
A65: =IF(RC[1]="","",DATEVALUE(RC[1])) ->  | P65: =IF(AND(ISNUMBER(RC[-3]),ISNUMBER(RC[-1])),RC[-3]-RC[-1],"-") -> - | S65: =RC[-1] ->  | T65: =(RC[-16]*RC[-15]-RC[-13]*RC[-12])/1000 -> 0 | W65: =RC[-2]*RC[-10]/1000 -> #VALUE! | X65: =ABS((RC[-3]*RC[-11]-RC[-2]*RC[-9])/1000) -> #VALUE! | Y65: =(RC[-14]-RC[1])/RC[-18]*100 -> #VALUE! | Z65: =RC[-5]+RC[-4] -> #VALUE! | AC65: =VALUE(RC[-27]) -> #VALUE! | AD65: =IF(RC[21]=42,"*",IF(RC[21]=32,"",RC[21])) ->  | AE65: =RC[-28] ->  | AF65: =RC[-28] -> 0 | AG65: =RC[-28] -> 0 | AH65: =RC[-28] -> 0 | AI65: =RC[-28] -> 0 | AJ65: =RC[-28] -> 0 | AK65: =RC[-28] -> 0 | AL65: =RC[-28] -> 0 | AM65: =RC[-28] -> 0 | AN65: =RC[-28] ->  | AO65: =RC[-28] ->  | AP65: - | AQ65: =RC[-29] ->  | AR65: =RC[-29] ->  | AS65: - | AT65: =RC[-30] -> - | AU65: =RC[-30] ->  | AV65: =RC[-30] ->  | AW65: =RC[-30] -> 
A66: =IF(RC[1]="","",DATEVALUE(RC[1])) ->  | P66: =IF(AND(ISNUMBER(RC[-3]),ISNUMBER(RC[-1])),RC[-3]-RC[-1],"-") -> - | S66: =RC[-1] ->  | T66: =(RC[-16]*RC[-15]-RC[-13]*RC[-12])/1000 -> 0 | W66: =RC[-2]*RC[-10]/1000 -> #VALUE! | X66: =ABS((RC[-3]*RC[-11]-RC[-2]*RC[-9])/1000) -> #VALUE! | Y66: =(RC[-14]-RC[1])/RC[-18]*100 -> #VALUE! | Z66: =RC[-5]+RC[-4] -> #VALUE! | AC66: =VALUE(RC[-27]) -> #VALUE! | AD66: =IF(RC[21]=42,"*",IF(RC[21]=32,"",RC[21])) ->  | AE66: =RC[-28] ->  | AF66: =RC[-28] -> 0 | AG66: =RC[-28] -> 0 | AH66: =RC[-28] -> 0 | AI66: =RC[-28] -> 0 | AJ66: =RC[-28] -> 0 | AK66: =RC[-28] -> 0 | AL66: =RC[-28] -> 0 | AM66: =RC[-28] -> 0 | AN66: =RC[-28] ->  | AO66: =RC[-28] ->  | AP66: - | AQ66: =RC[-29] ->  | AR66: =RC[-29] ->  | AS66: - | AT66: =RC[-30] -> - | AU66: =RC[-30] ->  | AV66: =RC[-30] ->  | AW66: =RC[-30] -> 
A67: =IF(RC[1]="","",DATEVALUE(RC[1])) ->  | P67: =IF(AND(ISNUMBER(RC[-3]),ISNUMBER(RC[-1])),RC[-3]-RC[-1],"-") -> - | S67: =RC[-1] ->  | T67: =(RC[-16]*RC[-15]-RC[-13]*RC[-12])/1000 -> 0 | W67: =RC[-2]*RC[-10]/1000 -> #VALUE! | X67: =ABS((RC[-3]*RC[-11]-RC[-2]*RC[-9])/1000) -> #VALUE! | Y67: =(RC[-14]-RC[1])/RC[-18]*100 -> #VALUE! | Z67: =RC[-5]+RC[-4] -> #VALUE! | AC67: =VALUE(RC[-27]) -> #VALUE! | AD67: =IF(RC[21]=42,"*",IF(RC[21]=32,"",RC[21])) ->  | AE67: =RC[-28] ->  | AF67: =RC[-28] -> 0 | AG67: =RC[-28] -> 0 | AH67: =RC[-28] -> 0 | AI67: =RC[-28] -> 0 | AJ67: =RC[-28] -> 0 | AK67: =RC[-28] -> 0 | AL67: =RC[-28] -> 0 | AM67: =RC[-28] -> 0 | AN67: =RC[-28] ->  | AO67: =RC[-28] ->  | AP67: - | AQ67: =RC[-29] ->  | AR67: =RC[-29] ->  | AS67: - | AT67: =RC[-30] -> - | AU67: =RC[-30] ->  | AV67: =RC[-30] ->  | AW67: =RC[-30] -> 
A68: =IF(RC[1]="","",DATEVALUE(RC[1])) ->  | P68: =IF(AND(ISNUMBER(RC[-3]),ISNUMBER(RC[-1])),RC[-3]-RC[-1],"-") -> - | S68: =RC[-1] ->  | T68: =(RC[-16]*RC[-15]-RC[-13]*RC[-12])/1000 -> 0 | W68: =RC[-2]*RC[-10]/1000 -> #VALUE! | X68: =ABS((RC[-3]*RC[-11]-RC[-2]*RC[-9])/1000) -> #VALUE! | Y68: =(RC[-14]-RC[1])/RC[-18]*100 -> #VALUE! | Z68: =RC[-5]+RC[-4] -> #VALUE! | AC68: =VALUE(RC[-27]) -> #VALUE! | AD68: =IF(RC[21]=42,"*",IF(RC[21]=32,"",RC[21])) ->  | AE68: =RC[-28] ->  | AF68: =RC[-28] -> 0 | AG68: =RC[-28] -> 0 | AH68: =RC[-28] -> 0 | AI68: =RC[-28] -> 0 | AJ68: =RC[-28] -> 0 | AK68: =RC[-28] -> 0 | AL68: =RC[-28] -> 0 | AM68: =RC[-28] -> 0 | AN68: =RC[-28] ->  | AO68: =RC[-28] ->  | AP68: - | AQ68: =RC[-29] ->  | AR68: =RC[-29] ->  | AS68: - | AT68: =RC[-30] -> - | AU68: =RC[-30] ->  | AV68: =RC[-30] ->  | AW68: =RC[-30] -> 
A69: =IF(RC[1]="","",DATEVALUE(RC[1])) ->  | P69: =IF(AND(ISNUMBER(RC[-3]),ISNUMBER(RC[-1])),RC[-3]-RC[-1],"-") -> - | S69: =RC[-1] ->  | T69: =(RC[-16]*RC[-15]-RC[-13]*RC[-12])/1000 -> 0 | W69: =RC[-2]*RC[-10]/1000 -> #VALUE! | X69: =ABS((RC[-3]*RC[-11]-RC[-2]*RC[-9])/1000) -> #VALUE! | Y69: =(RC[-14]-RC[1])/RC[-18]*100 -> #VALUE! | Z69: =RC[-5]+RC[-4] -> #VALUE! | AC69: =VALUE(RC[-27]) -> #VALUE! | AD69: =IF(RC[21]=42,"*",IF(RC[21]=32,"",RC[21])) ->  | AE69: =RC[-28] ->  | AF69: =RC[-28] -> 0 | AG69: =RC[-28] -> 0 | AH69: =RC[-28] -> 0 | AI69: =RC[-28] -> 0 | AJ69: =RC[-28] -> 0 | AK69: =RC[-28] -> 0 | AL69: =RC[-28] -> 0 | AM69: =RC[-28] -> 0 | AN69: =RC[-28] ->  | AO69: =RC[-28] ->  | AP69: - | AQ69: =RC[-29] ->  | AR69: =RC[-29] ->  | AS69: - | AT69: =RC[-30] -> - | AU69: =RC[-30] ->  | AV69: =RC[-30] ->  | AW69: =RC[-30] -> 
A70: =IF(RC[1]="","",DATEVALUE(RC[1])) ->  | P70: =IF(AND(ISNUMBER(RC[-3]),ISNUMBER(RC[-1])),RC[-3]-RC[-1],"-") -> - | S70: =RC[-1] ->  | T70: =(RC[-16]*RC[-15]-RC[-13]*RC[-12])/1000 -> 0 | W70: =RC[-2]*RC[-10]/1000 -> #VALUE! | X70: =ABS((RC[-3]*RC[-11]-RC[-2]*RC[-9])/1000) -> #VALUE! | Y70: =(RC[-14]-RC[1])/RC[-18]*100 -> #VALUE! | Z70: =RC[-5]+RC[-4] -> #VALUE! | AC70: =VALUE(RC[-27]) -> #VALUE! | AD70: =IF(RC[21]=42,"*",IF(RC[21]=32,"",RC[21])) ->  | AE70: =RC[-28] ->  | AF70: =RC[-28] -> 0 | AG70: =RC[-28] -> 0 | AH70: =RC[-28] -> 0 | AI70: =RC[-28] -> 0 | AJ70: =RC[-28] -> 0 | AK70: =RC[-28] -> 0 | AL70: =RC[-28] -> 0 | AM70: =RC[-28] -> 0 | AN70: =RC[-28] ->  | AO70: =RC[-28] ->  | AP70: - | AQ70: =RC[-29] ->  | AR70: =RC[-29] ->  | AS70: - | AT70: =RC[-30] -> - | AU70: =RC[-30] ->  | AV70: =RC[-30] ->  | AW70: =RC[-30] -> 
A71: =IF(RC[1]="","",DATEVALUE(RC[1])) ->  | P71: =IF(AND(ISNUMBER(RC[-3]),ISNUMBER(RC[-1])),RC[-3]-RC[-1],"-") -> - | S71: =RC[-1] ->  | T71: =(RC[-16]*RC[-15]-RC[-13]*RC[-12])/1000 -> 0 | W71: =RC[-2]*RC[-10]/1000 -> #VALUE! | X71: =ABS((RC[-3]*RC[-11]-RC[-2]*RC[-9])/1000) -> #VALUE! | Y71: =(RC[-14]-RC[1])/RC[-18]*100 -> #VALUE! | Z71: =RC[-5]+RC[-4] -> #VALUE! | AC71: =VALUE(RC[-27]) -> #VALUE! | AD71: =IF(RC[21]=42,"*",IF(RC[21]=32,"",RC[21])) ->  | AE71: =RC[-28] ->  | AF71: =RC[-28] -> 0 | AG71: =RC[-28] -> 0 | AH71: =RC[-28] -> 0 | AI71: =RC[-28] -> 0 | AJ71: =RC[-28] -> 0 | AK71: =RC[-28] -> 0 | AL71: =RC[-28] -> 0 | AM71: =RC[-28] -> 0 | AN71: =RC[-28] ->  | AO71: =RC[-28] ->  | AP71: - | AQ71: =RC[-29] ->  | AR71: =RC[-29] ->  | AS71: - | AT71: =RC[-30] -> - | AU71: =RC[-30] ->  | AV71: =RC[-30] ->  | AW71: =RC[-30] -> 
A72: =IF(RC[1]="","",DATEVALUE(RC[1])) ->  | P72: =IF(AND(ISNUMBER(RC[-3]),ISNUMBER(RC[-1])),RC[-3]-RC[-1],"-") -> - | S72: =RC[-1] ->  | T72: =(RC[-16]*RC[-15]-RC[-13]*RC[-12])/1000 -> 0 | W72: =RC[-2]*RC[-10]/1000 -> #VALUE! | X72: =ABS((RC[-3]*RC[-11]-RC[-2]*RC[-9])/1000) -> #VALUE! | Y72: =(RC[-14]-RC[1])/RC[-18]*100 -> #VALUE! | Z72: =RC[-5]+RC[-4] -> #VALUE! | AC72: =VALUE(RC[-27]) -> #VALUE! | AD72: =IF(RC[21]=42,"*",IF(RC[21]=32,"",RC[21])) ->  | AE72: =RC[-28] ->  | AF72: =RC[-28] -> 0 | AG72: =RC[-28] -> 0 | AH72: =RC[-28] -> 0 | AI72: =RC[-28] -> 0 | AJ72: =RC[-28] -> 0 | AK72: =RC[-28] -> 0 | AL72: =RC[-28] -> 0 | AM72: =RC[-28] -> 0 | AN72: =RC[-28] ->  | AO72: =RC[-28] ->  | AP72: - | AQ72: =RC[-29] ->  | AR72: =RC[-29] ->  | AS72: - | AT72: =RC[-30] -> - | AU72: =RC[-30] ->  | AV72: =RC[-30] ->  | AW72: =RC[-30] -> 
A73: =IF(RC[1]="","",DATEVALUE(RC[1])) ->  | P73: =IF(AND(ISNUMBER(RC[-3]),ISNUMBER(RC[-1])),RC[-3]-RC[-1],"-") -> - | S73: =RC[-1] ->  | T73: =(RC[-16]*RC[-15]-RC[-13]*RC[-12])/1000 -> 0 | W73: =RC[-2]*RC[-10]/1000 -> #VALUE! | X73: =ABS((RC[-3]*RC[-11]-RC[-2]*RC[-9])/1000) -> #VALUE! | Y73: =(RC[-14]-RC[1])/RC[-18]*100 -> #VALUE! | Z73: =RC[-5]+RC[-4] -> #VALUE! | AC73: =VALUE(RC[-27]) -> #VALUE! | AD73: =IF(RC[21]=42,"*",IF(RC[21]=32,"",RC[21])) ->  | AE73: =RC[-28] ->  | AF73: =RC[-28] -> 0 | AG73: =RC[-28] -> 0 | AH73: =RC[-28] -> 0 | AI73: =RC[-28] -> 0 | AJ73: =RC[-28] -> 0 | AK73: =RC[-28] -> 0 | AL73: =RC[-28] -> 0 | AM73: =RC[-28] -> 0 | AN73: =RC[-28] ->  | AO73: =RC[-28] ->  | AP73: - | AQ73: =RC[-29] ->  | AR73: =RC[-29] ->  | AS73: - | AT73: =RC[-30] -> - | AU73: =RC[-30] ->  | AV73: =RC[-30] ->  | AW73: =RC[-30] -> 
A74: =IF(RC[1]="","",DATEVALUE(RC[1])) ->  | P74: =IF(AND(ISNUMBER(RC[-3]),ISNUMBER(RC[-1])),RC[-3]-RC[-1],"-") -> - | S74: =RC[-1] ->  | T74: =(RC[-16]*RC[-15]-RC[-13]*RC[-12])/1000 -> 0 | W74: =RC[-2]*RC[-10]/1000 -> #VALUE! | X74: =ABS((RC[-3]*RC[-11]-RC[-2]*RC[-9])/1000) -> #VALUE! | Y74: =(RC[-14]-RC[1])/RC[-18]*100 -> #VALUE! | Z74: =RC[-5]+RC[-4] -> #VALUE! | AC74: =VALUE(RC[-27]) -> #VALUE! | AD74: =IF(RC[21]=42,"*",IF(RC[21]=32,"",RC[21])) ->  | AE74: =RC[-28] ->  | AF74: =RC[-28] -> 0 | AG74: =RC[-28] -> 0 | AH74: =RC[-28] -> 0 | AI74: =RC[-28] -> 0 | AJ74: =RC[-28] -> 0 | AK74: =RC[-28] -> 0 | AL74: =RC[-28] -> 0 | AM74: =RC[-28] -> 0 | AN74: =RC[-28] ->  | AO74: =RC[-28] ->  | AP74: - | AQ74: =RC[-29] ->  | AR74: =RC[-29] ->  | AS74: - | AT74: =RC[-30] -> - | AU74: =RC[-30] ->  | AV74: =RC[-30] ->  | AW74: =RC[-30] -> 
A75: =IF(RC[1]="","",DATEVALUE(RC[1])) ->  | P75: =IF(AND(ISNUMBER(RC[-3]),ISNUMBER(RC[-1])),RC[-3]-RC[-1],"-") -> - | S75: =RC[-1] ->  | T75: =(RC[-16]*RC[-15]-RC[-13]*RC[-12])/1000 -> 0 | W75: =RC[-2]*RC[-10]/1000 -> #VALUE! | X75: =ABS((RC[-3]*RC[-11]-RC[-2]*RC[-9])/1000) -> #VALUE! | Y75: =(RC[-14]-RC[1])/RC[-18]*100 -> #VALUE! | Z75: =RC[-5]+RC[-4] -> #VALUE! | AC75: =VALUE(RC[-27]) -> #VALUE! | AD75: =IF(RC[21]=42,"*",IF(RC[21]=32,"",RC[21])) ->  | AE75: =RC[-28] ->  | AF75: =RC[-28] -> 0 | AG75: =RC[-28] -> 0 | AH75: =RC[-28] -> 0 | AI75: =RC[-28] -> 0 | AJ75: =RC[-28] -> 0 | AK75: =RC[-28] -> 0 | AL75: =RC[-28] -> 0 | AM75: =RC[-28] -> 0 | AN75: =RC[-28] ->  | AO75: =RC[-28] ->  | AP75: - | AQ75: =RC[-29] ->  | AR75: =RC[-29] ->  | AS75: - | AT75: =RC[-30] -> - | AU75: =RC[-30] ->  | AV75: =RC[-30] ->  | AW75: =RC[-30] -> 
A76: =IF(RC[1]="","",DATEVALUE(RC[1])) ->  | P76: =IF(AND(ISNUMBER(RC[-3]),ISNUMBER(RC[-1])),RC[-3]-RC[-1],"-") -> - | S76: =RC[-1] ->  | T76: =(RC[-16]*RC[-15]-RC[-13]*RC[-12])/1000 -> 0 | W76: =RC[-2]*RC[-10]/1000 -> #VALUE! | X76: =ABS((RC[-3]*RC[-11]-RC[-2]*RC[-9])/1000) -> #VALUE! | Y76: =(RC[-14]-RC[1])/RC[-18]*100 -> #VALUE! | Z76: =RC[-5]+RC[-4] -> #VALUE! | AC76: =VALUE(RC[-27]) -> #VALUE! | AD76: =IF(RC[21]=42,"*",IF(RC[21]=32,"",RC[21])) ->  | AE76: =RC[-28] ->  | AF76: =RC[-28] -> 0 | AG76: =RC[-28] -> 0 | AH76: =RC[-28] -> 0 | AI76: =RC[-28] -> 0 | AJ76: =RC[-28] -> 0 | AK76: =RC[-28] -> 0 | AL76: =RC[-28] -> 0 | AM76: =RC[-28] -> 0 | AN76: =RC[-28] ->  | AO76: =RC[-28] ->  | AP76: - | AQ76: =RC[-29] ->  | AR76: =RC[-29] ->  | AS76: - | AT76: =RC[-30] -> - | AU76: =RC[-30] ->  | AV76: =RC[-30] ->  | AW76: =RC[-30] -> 
A77: =IF(RC[1]="","",DATEVALUE(RC[1])) ->  | P77: =IF(AND(ISNUMBER(RC[-3]),ISNUMBER(RC[-1])),RC[-3]-RC[-1],"-") -> - | S77: =RC[-1] ->  | T77: =(RC[-16]*RC[-15]-RC[-13]*RC[-12])/1000 -> 0 | W77: =RC[-2]*RC[-10]/1000 -> #VALUE! | X77: =ABS((RC[-3]*RC[-11]-RC[-2]*RC[-9])/1000) -> #VALUE! | Y77: =(RC[-14]-RC[1])/RC[-18]*100 -> #VALUE! | Z77: =RC[-5]+RC[-4] -> #VALUE! | AC77: =VALUE(RC[-27]) -> #VALUE! | AD77: =IF(RC[21]=42,"*",IF(RC[21]=32,"",RC[21])) ->  | AE77: =RC[-28] ->  | AF77: =RC[-28] -> 0 | AG77: =RC[-28] -> 0 | AH77: =RC[-28] -> 0 | AI77: =RC[-28] -> 0 | AJ77: =RC[-28] -> 0 | AK77: =RC[-28] -> 0 | AL77: =RC[-28] -> 0 | AM77: =RC[-28] -> 0 | AN77: =RC[-28] ->  | AO77: =RC[-28] ->  | AP77: - | AQ77: =RC[-29] ->  | AR77: =RC[-29] ->  | AS77: - | AT77: =RC[-30] -> - | AU77: =RC[-30] ->  | AV77: =RC[-30] ->  | AW77: =RC[-30] -> 
A78: =IF(RC[1]="","",DATEVALUE(RC[1])) ->  | P78: =IF(AND(ISNUMBER(RC[-3]),ISNUMBER(RC[-1])),RC[-3]-RC[-1],"-") -> - | S78: =RC[-1] ->  | T78: =(RC[-16]*RC[-15]-RC[-13]*RC[-12])/1000 -> 0 | W78: =RC[-2]*RC[-10]/1000 -> #VALUE! | X78: =ABS((RC[-3]*RC[-11]-RC[-2]*RC[-9])/1000) -> #VALUE! | Y78: =(RC[-14]-RC[1])/RC[-18]*100 -> #VALUE! | Z78: =RC[-5]+RC[-4] -> #VALUE! | AC78: =VALUE(RC[-27]) -> #VALUE! | AD78: =IF(RC[21]=42,"*",IF(RC[21]=32,"",RC[21])) ->  | AE78: =RC[-28] ->  | AF78: =RC[-28] -> 0 | AG78: =RC[-28] -> 0 | AH78: =RC[-28] -> 0 | AI78: =RC[-28] -> 0 | AJ78: =RC[-28] -> 0 | AK78: =RC[-28] -> 0 | AL78: =RC[-28] -> 0 | AM78: =RC[-28] -> 0 | AN78: =RC[-28] ->  | AO78: =RC[-28] ->  | AP78: - | AQ78: =RC[-29] ->  | AR78: =RC[-29] ->  | AS78: - | AT78: =RC[-30] -> - | AU78: =RC[-30] ->  | AV78: =RC[-30] ->  | AW78: =RC[-30] -> 
A79: =IF(RC[1]="","",DATEVALUE(RC[1])) ->  | P79: =IF(AND(ISNUMBER(RC[-3]),ISNUMBER(RC[-1])),RC[-3]-RC[-1],"-") -> - | S79: =RC[-1] ->  | T79: =(RC[-16]*RC[-15]-RC[-13]*RC[-12])/1000 -> 0 | W79: =RC[-2]*RC[-10]/1000 -> #VALUE! | X79: =ABS((RC[-3]*RC[-11]-RC[-2]*RC[-9])/1000) -> #VALUE! | Y79: =(RC[-14]-RC[1])/RC[-18]*100 -> #VALUE! | Z79: =RC[-5]+RC[-4] -> #VALUE! | AC79: =VALUE(RC[-27]) -> #VALUE! | AD79: =IF(RC[21]=42,"*",IF(RC[21]=32,"",RC[21])) ->  | AE79: =RC[-28] ->  | AF79: =RC[-28] -> 0 | AG79: =RC[-28] -> 0 | AH79: =RC[-28] -> 0 | AI79: =RC[-28] -> 0 | AJ79: =RC[-28] -> 0 | AK79: =RC[-28] -> 0 | AL79: =RC[-28] -> 0 | AM79: =RC[-28] -> 0 | AN79: =RC[-28] ->  | AO79: =RC[-28] ->  | AP79: - | AQ79: =RC[-29] ->  | AR79: =RC[-29] ->  | AS79: - | AT79: =RC[-30] -> - | AU79: =RC[-30] ->  | AV79: =RC[-30] ->  | AW79: =RC[-30] -> 
A80: =IF(RC[1]="","",DATEVALUE(RC[1])) ->  | P80: =IF(AND(ISNUMBER(RC[-3]),ISNUMBER(RC[-1])),RC[-3]-RC[-1],"-") -> - | S80: =RC[-1] ->  | T80: =(RC[-16]*RC[-15]-RC[-13]*RC[-12])/1000 -> 0 | W80: =RC[-2]*RC[-10]/1000 -> #VALUE! | X80: =ABS((RC[-3]*RC[-11]-RC[-2]*RC[-9])/1000) -> #VALUE! | Y80: =(RC[-14]-RC[1])/RC[-18]*100 -> #VALUE! | Z80: =RC[-5]+RC[-4] -> #VALUE! | AC80: =VALUE(RC[-27]) -> #VALUE! | AD80: =IF(RC[21]=42,"*",IF(RC[21]=32,"",RC[21])) ->  | AE80: =RC[-28] ->  | AF80: =RC[-28] -> 0 | AG80: =RC[-28] -> 0 | AH80: =RC[-28] -> 0 | AI80: =RC[-28] -> 0 | AJ80: =RC[-28] -> 0 | AK80: =RC[-28] -> 0 | AL80: =RC[-28] -> 0 | AM80: =RC[-28] -> 0 | AN80: =RC[-28] ->  | AO80: =RC[-28] ->  | AP80: - | AQ80: =RC[-29] ->  | AR80: =RC[-29] ->  | AS80: - | AT80: =RC[-30] -> - | AU80: =RC[-30] ->  | AV80: =RC[-30] ->  | AW80: =RC[-30] -> 
A81: =IF(RC[1]="","",DATEVALUE(RC[1])) ->  | P81: =IF(AND(ISNUMBER(RC[-3]),ISNUMBER(RC[-1])),RC[-3]-RC[-1],"-") -> - | S81: =RC[-1] ->  | T81: =(RC[-16]*RC[-15]-RC[-13]*RC[-12])/1000 -> 0 | W81: =RC[-2]*RC[-10]/1000 -> #VALUE! | X81: =ABS((RC[-3]*RC[-11]-RC[-2]*RC[-9])/1000) -> #VALUE! | Y81: =(RC[-14]-RC[1])/RC[-18]*100 -> #VALUE! | Z81: =RC[-5]+RC[-4] -> #VALUE! | AC81: =VALUE(RC[-27]) -> #VALUE! | AD81: =IF(RC[21]=42,"*",IF(RC[21]=32,"",RC[21])) ->  | AE81: =RC[-28] ->  | AF81: =RC[-28] -> 0 | AG81: =RC[-28] -> 0 | AH81: =RC[-28] -> 0 | AI81: =RC[-28] -> 0 | AJ81: =RC[-28] -> 0 | AK81: =RC[-28] -> 0 | AL81: =RC[-28] -> 0 | AM81: =RC[-28] -> 0 | AN81: =RC[-28] ->  | AO81: =RC[-28] ->  | AP81: - | AQ81: =RC[-29] ->  | AR81: =RC[-29] ->  | AS81: - | AT81: =RC[-30] -> - | AU81: =RC[-30] ->  | AV81: =RC[-30] ->  | AW81: =RC[-30] -> 
A82: =IF(RC[1]="","",DATEVALUE(RC[1])) ->  | P82: =IF(AND(ISNUMBER(RC[-3]),ISNUMBER(RC[-1])),RC[-3]-RC[-1],"-") -> - | S82: =RC[-1] ->  | T82: =(RC[-16]*RC[-15]-RC[-13]*RC[-12])/1000 -> 0 | W82: =RC[-2]*RC[-10]/1000 -> #VALUE! | X82: =ABS((RC[-3]*RC[-11]-RC[-2]*RC[-9])/1000) -> #VALUE! | Y82: =(RC[-14]-RC[1])/RC[-18]*100 -> #VALUE! | Z82: =RC[-5]+RC[-4] -> #VALUE! | AC82: =VALUE(RC[-27]) -> #VALUE! | AD82: =IF(RC[21]=42,"*",IF(RC[21]=32,"",RC[21])) ->  | AE82: =RC[-28] ->  | AF82: =RC[-28] -> 0 | AG82: =RC[-28] -> 0 | AH82: =RC[-28] -> 0 | AI82: =RC[-28] -> 0 | AJ82: =RC[-28] -> 0 | AK82: =RC[-28] -> 0 | AL82: =RC[-28] -> 0 | AM82: =RC[-28] -> 0 | AN82: =RC[-28] ->  | AO82: =RC[-28] ->  | AP82: - | AQ82: =RC[-29] ->  | AR82: =RC[-29] ->  | AS82: - | AT82: =RC[-30] -> - | AU82: =RC[-30] ->  | AV82: =RC[-30] ->  | AW82: =RC[-30] -> 
A83: =IF(RC[1]="","",DATEVALUE(RC[1])) ->  | P83: =IF(AND(ISNUMBER(RC[-3]),ISNUMBER(RC[-1])),RC[-3]-RC[-1],"-") -> - | S83: =RC[-1] ->  | T83: =(RC[-16]*RC[-15]-RC[-13]*RC[-12])/1000 -> 0 | W83: =RC[-2]*RC[-10]/1000 -> #VALUE! | X83: =ABS((RC[-3]*RC[-11]-RC[-2]*RC[-9])/1000) -> #VALUE! | Y83: =(RC[-14]-RC[1])/RC[-18]*100 -> #VALUE! | Z83: =RC[-5]+RC[-4] -> #VALUE! | AC83: =VALUE(RC[-27]) -> #VALUE! | AD83: =IF(RC[21]=42,"*",IF(RC[21]=32,"",RC[21])) ->  | AE83: =RC[-28] ->  | AF83: =RC[-28] -> 0 | AG83: =RC[-28] -> 0 | AH83: =RC[-28] -> 0 | AI83: =RC[-28] -> 0 | AJ83: =RC[-28] -> 0 | AK83: =RC[-28] -> 0 | AL83: =RC[-28] -> 0 | AM83: =RC[-28] -> 0 | AN83: =RC[-28] ->  | AO83: =RC[-28] ->  | AP83: - | AQ83: =RC[-29] ->  | AR83: =RC[-29] ->  | AS83: - | AT83: =RC[-30] -> - | AU83: =RC[-30] ->  | AV83: =RC[-30] ->  | AW83: =RC[-30] -> 
AC84: Среднее | AF84: =R[1]C[-28] -> 0 | AG84: =R[1]C[-28] -> 0 | AH84: =R[1]C[-28] -> 0 | AI84: =R[1]C[-28] -> 0 | AJ84: =R[1]C[-28] -> 0 | AK84: =R[1]C[-28] -> 0 | AL84: =R[1]C[-28] -> 0 | AM84: =R[1]C[-28] -> 0 | AN84: =R[1]C[-28] -> 6.3104548387096759 | AO84: =R[1]C[-28] -> 69.487143032258075 | AP84: - | AQ84: =R[1]C[-29] -> 2.6696726129032253 | AR84: =R[1]C[-29] -> 66.995463064516144 | AS84: - | AT84: =R[1]C[-30] -> 2.4916799677419363 | AU84: =R[1]C[-30] -> 8.980127451612903
B85: Среднее | L85: =IF(SUM(OFFSET(R[-74]C,3,0,R7C1,1))=0,"",AVERAGE(OFFSET(R[-74]C,3,0,R7C1,1))) -> 6.3104548387096759 | M85: =IF(SUM(OFFSET(R[-74]C,3,0,R7C1,1))=0,"",AVERAGE(OFFSET(R[-74]C,3,0,R7C1,1))) -> 69.487143032258075 | N85: =IF(SUM(OFFSET(R[-74]C,3,0,R7C1,1))=0,"",AVERAGE(OFFSET(R[-74]C,3,0,R7C1,1))) -> 2.6696726129032253 | O85: =IF(SUM(OFFSET(R[-74]C,3,0,R7C1,1))=0,"",AVERAGE(OFFSET(R[-74]C,3,0,R7C1,1))) -> 66.995463064516144 | P85: =IF(SUM(OFFSET(R[-74]C,3,0,R7C1,1))=0,"",AVERAGE(OFFSET(R[-74]C,3,0,R7C1,1))) -> 2.4916799677419363 | Q85: =IF(SUM(OFFSET(R[-74]C,3,0,R7C1,1))=0,"",AVERAGE(OFFSET(R[-74]C,3,0,R7C1,1))) -> 8.980127451612903 | R85: =IF(SUM(OFFSET(R[-74]C,3,0,R7C1,1))=0,"",AVERAGE(OFFSET(R[-74]C,3,0,R7C1,1))) -> 0.60465419354838723 | S85: =AVERAGE(OFFSET(R[-74]C,3,0,R7C1,1)) -> 0.60465419354838723 | T85: =AVERAGE(OFFSET(R[-74]C,3,0,R7C1,1)) -> 0 | W85: =AVERAGE(OFFSET(R[-74]C,3,0,R7C1,1)) -> #VALUE! | X85: =AVERAGE(OFFSET(R[-74]C,3,0,R7C1,1)) -> #VALUE! | AC85: Итого | AE85: =R[1]C[-28] -> 744 | AF85: =R[1]C[-28] -> 0 | AI85: =R[1]C[-28] -> 0 | AM85: =R[1]C[-28] -> 0 | AN85: =R[1]C[-28] -> 195.62409999999994 | AQ85: =R[1]C[-29] -> 82.759850999999983 | AU85: =R[1]C[-30] -> 278.38395099999997 | AV85: =R[1]C[-30] -> 18.744280000000003 | AW85: =R[1]C[-30] -> 18.744280000000003
B86: ИТОГО: | C86: =SUM(OFFSET(R[-75]C,3,0,R7C1,1)) -> 744 | L86: =IF(SUM(OFFSET(R[-75]C,3,0,R7C1,1))=0,"",SUM(OFFSET(R[-75]C,3,0,R7C1,1))) -> 195.62409999999994 | N86: =IF(SUM(OFFSET(R[-75]C,3,0,R7C1,1))=0,"",SUM(OFFSET(R[-75]C,3,0,R7C1,1))) -> 82.759850999999983 | Q86: =IF(SUM(OFFSET(R[-75]C,3,0,R7C1,1))=0,"",SUM(OFFSET(R[-75]C,3,0,R7C1,1))) -> 278.38395099999997 | R86: =IF(SUM(OFFSET(R[-75]C,3,0,R7C1,1))=0,"",SUM(OFFSET(R[-75]C,3,0,R7C1,1))) -> 18.744280000000003 | S86: =SUM(OFFSET(R[-75]C,3,0,R7C1,1)) -> 18.744280000000003 | T86: =SUM(OFFSET(R[-75]C,3,0,R7C1,1)) -> 0 | W86: =SUM(OFFSET(R[-75]C,3,0,R7C1,1)) -> #VALUE! | X86: =SUM(OFFSET(R[-75]C,3,0,R7C1,1)) -> #VALUE!
AC87: Досчёт | AF87: =R[1]C[-28] -> 0 | AI87: =R[1]C[-28] -> 0 | AM87: =R[1]C[-28] -> 0 | AN87: =R[1]C[-28] -> 0 | AQ87: =R[1]C[-29] -> 0 | AU87: =R[1]C[-30] -> 0 | AV87: =R[1]C[-30] -> 0 | AW87: =R[1]C[-30] -> 0
A88: 11дн=264ч 4дн=96ч | B88: Досчёт до конца м-ца (+) | C88: =R6C1*24 -> 192 | L88: 0 | N88: 0 | R88: 0 | S88: 0 | T88: № 10060 | AC88: Снятие | AF88: =-R[1]C[-28] -> 0 | AI88: =-R[1]C[-28] -> 0 | AM88: =-R[1]C[-28] -> 0 | AN88: =-R[1]C[-28] -> 0 | AQ88: =-R[1]C[-29] -> 0 | AU88: =-R[1]C[-30] -> 0 | AV88: =-R[1]C[-30] -> 0 | AW88: =-R[1]C[-30] -> 0
A89: 9дн=216ч 7дн=168ч | B89: Вычет с предыдущего (-) | C89: =R4C1*24 -> 216 | AC89: Сумма | AF89: =R[1]C[-28] -> 0 | AI89: =R[1]C[-28] -> 0 | AM89: =R[1]C[-28] -> 0 | AN89: =R[1]C[-28] -> 195.62409999999994 | AQ89: =R[1]C[-29] -> 82.759850999999983 | AU89: =R[1]C[-30] -> 278.38395099999997 | AV89: =R[1]C[-30] -> 18.744280000000003 | AW89: =R[1]C[-30] -> 18.744280000000003
B90: СУММА: | C90: =R[-4]C+R[-2]C-R[-1]C -> 720 | L90: =IF(SUM(OFFSET(R[-79]C,3,0,R7C1,1))=0,"",(R[-4]C+R[-2]C-R[-1]C)) -> 195.62409999999994 | N90: =IF(SUM(OFFSET(R[-79]C,3,0,R7C1,1))=0,"",(R[-4]C+R[-2]C-R[-1]C)) -> 82.759850999999983 | Q90: =IF(SUM(OFFSET(R[-79]C,3,0,R7C1,1))=0,"",(R[-4]C+R[-2]C-R[-1]C)) -> 278.38395099999997 | R90: =IF(SUM(OFFSET(R[-79]C,3,0,R7C1,1))=0,"",(R[-4]C+R[-2]C-R[-1]C)) -> 18.744280000000003 | S90: =R[-4]C+R[-2]C-R[-1]C -> 18.744280000000003
AC91: Тхв на источнике | AE91: V гвс (м3) | AF91: =R[-2]C[15] -> 278.38395099999997 | AG91: W гвс (Гкал) | AH91: =RC[-2]*0.06 -> 16.703037059999996 | AI91: W без гвс (Гкал) | AJ91: =R[-2]C[13]-RC[-2] -> 2.0412429400000072
B92: Показания счетчиков на момент снятия данных:
B93: Дата, время | D93: М1, т | F93: М2, т | H93: М3, т | J93: М4, т | L93: Qо, Гкал | N93: Qг, Гкал | P93: время, час
B94: 23.08.18 21:00 | D94: 75899.0815 | F94: 66741.443920000005 | H94: 7334.7864099999997 | J94: 2015.50343 | L94: 2401.92184 | N94: 677.98144000000002 | P94: -
B95: 19.09.18 01:00 | D95: 79701.517129999993 | F95: 70310.455870000005 | H95: 7496.8140700000004 | J95: 2084.24764 | L95: 2455.9931799999999 | N95: 693.85438999999997 | P95: -
AC97: =ZAYAVKA_N -> письмо В данном отчете ГВС суммируется
B98: Представитель потребителя:_______________________________________________________________________ В.О. Топорков
I101: Рекомендуемые значения по параметрам теплопотребления (не являются официально утверждёнными)
I102: М, т | J102: V, м3 | K102: Qгвс, Гкал | L102: Qотоп, Гкал | M102: Qо, Гкал
I103: =R[-13]C[-3] -> 0 | J103: =RC[-1]/0.98 -> 0 | K103: =RC[-1]*0.06 -> 0 | L103: =RC[1]-RC[-1] -> 18.744280000000003 | M103: =R[-13]C[5] -> 18.744280000000003
O105: ДЛЯ САМОКОНТРОЛЯ
B106: В строке выбора дат указать период с 16.7.13 по 23.8.13 - жильё | N106: Q | O106: Qг
B107: В строке выбора дат указать период с 18.7.13 по 25.8.13 - не жилое | N107: =(R[-21]C[-10]*R[-22]C[-7]-R[-21]C[-9]*R[-22]C[-6])/1000 -> 0 | O107: =IF(R[-22]C[-2]="",R[-21]C[-3]*R[-22]C/1000,"") ->  | P107: Си2
O108: =IF(R[-23]C[-2]="","",((R[-22]C[-3]*R[-23]C)-(R[-22]C[-2]*R[-23]C[2]))/1000) -> 13.105927166079208 | P108: Си3