Sheet: Лист1
G1: Отчёт о теплопотреблении за октябрь 2018 | M1: з.н д. №02/147-2783 от 04.10.18 15.10.18г некорректная работа приборов
A4: =EOMONTH(R[9]C,0)-R[9]C -> 8 | B4: Потребитель: ЗАО "Сити Сервис"
A5: =MAX(R[9]C:R[78]C) -> 2018-10-22T00:00:00.000 | B5: Адрес: г. СПб, Морская наб., д.23 к.1
A6: =EOMONTH(R[-1]C,0)-R[-1]C -> 9 | B6: Телефон: 8-911-021-19-79
A7: =R[-2]C-R[6]C -> 30 | B7: Договор 10023 (.) 409, 410
A8: 7 | B8: Тепловычислитель: ВКТ-7 № 31119 | L8: М2 мах= | M8: 105.6 | O8: Мгвс мах= | P8: 84
L9: Qотоп мах= | M9: 7.92 | O9: Qгвс мах= | P9: 5.76
B10: Расчётная формула: Q=M1*(h1-hхв)-M2*(h2-hхв)
D12: Учёт - ОТОПЛЕНИЕ | M12: Учёт - ГВС
A13: =R[1]C-1 -> 43365 | B13: Дата | C13: N, ч | D13: M1, т | E13: T1, С | F13: P1, кг/см2 | G13: M2, т | H13: T2, С | I13: P2, кг/см2 | J13: dT, гр.C | K13: M1-М2, т | L13: Qотоп, Гкал | M13: V3, м3 | N13: T3, С | O13: V4, м3 | P13: T4, С | Q13: dT, гр.C | R13: V3-V4, м3 | S13: Qгвс, Гкал | T13: Qобщ. | U13: Qo | V13: M3 | W13: M4 | X13: си4 | Y13: си5 | Z13: ТСО | AA13: Внутр. | AD13: Дата | AE13: НС | AF13: n, ч | AG13: М1, т | AH13: t1, гр. С | AI13: Р1, кгс/см2 | AJ13: М2, т | AK13: t2, гр. С | AL13: Р2, кгс/см2 | AM13: t1-t2, гр. С | AN13: М1-М2, т | AO13: Wотоп, Гкал | AP13: М1гвс, т | AQ13: t1гвс, гр. С | AR13: Р1гвс, кгс/см2 | AS13: М2гвс, т | AT13: t2гвс, гр. С | AU13: Р2гвс, кгс/см2 | AV13: t1гвс-t2гвс | AW13: М1гвс-М2гвс, т | AX13: Wгвс, Гкал | AY13: Wсумм, Гкал | BA13: NS_TV1 | BB13: НС | BC13: NS_TV2
A14: =IF(RC[1]="","",DATEVALUE(RC[1])) -> 43366 | B14: 23.09.18 | C14: 24 | D14: 0 | E14: 22.48 | F14: 7.53 | G14: 0 | H14: 22.07 | I14: 5.43 | J14: =RC[-5]-RC[-2] -> 0.41000000000000014 | K14: 0 | L14: 0 | M14: 36.64 | N14: 64.150000000000006 | O14: 22.64 | P14: 48.01 | Q14: =RC[-3]-RC[-1] -> 16.140000000000008 | R14: 14 | S14: 1.232 | T14: =RC[-8]+RC[-1] -> 1.232 | U14: =(RC[-17]*RC[-16]-RC[-14]*RC[-13])/1000 -> 0 | V14: 35.96 | W14: 22.4 | X14: =RC[-2]*RC[-10]/1000 -> 2.3068340000000003 | Y14: =(RC[-3]*RC[-11]-RC[-2]*RC[-9])/1000 -> 1.2314100000000003 | Z14: 2013-11-23T00:00:00.000 | AA14: 2013-11-21T00:00:00.000 | AD14: =VALUE(RC[-28]) -> 2018-09-23T00:00:00.000 | AE14: =IF(RC[22]=42,"*",IF(RC[22]=32,"",RC[22])) -> - | AF14: =RC[-29] -> 24 | AG14: =RC[-29] -> 0 | AH14: =RC[-29] -> 22.48 | AI14: =RC[-29] -> 7.53 | AJ14: =RC[-29] -> 0 | AK14: =RC[-29] -> 22.07 | AL14: =RC[-29] -> 5.43 | AM14: =RC[-29] -> 0.41000000000000014 | AN14: =RC[-29] -> 0 | AO14: =RC[-29] -> 0 | AP14: =RC[-29] -> 36.64 | AQ14: =RC[-29] -> 64.150000000000006 | AR14: - | AS14: =RC[-30] -> 22.64 | AT14: =RC[-30] -> 48.01 | AU14: - | AV14: =RC[-31] -> 16.140000000000008 | AW14: =RC[-31] -> 14 | AX14: =RC[-31] -> 1.232 | AY14: =RC[-31] -> 1.232 | BA14: - | BB14: - | BC14: -
A15: =IF(RC[1]="","",DATEVALUE(RC[1])) -> 43367 | B15: 24.09.18 | C15: 24 | D15: 0 | E15: 22.3 | F15: 7.53 | G15: 0 | H15: 21.98 | I15: 5.43 | J15: =RC[-5]-RC[-2] -> 0.32000000000000028 | K15: 0 | L15: 0 | M15: 35.44 | N15: 63.27 | O15: 22.39 | P15: 47.47 | Q15: =RC[-3]-RC[-1] -> 15.800000000000004 | R15: 13.05 | S15: 1.1539999999999999 | T15: =RC[-8]+RC[-1] -> 1.1539999999999999 | U15: =(RC[-17]*RC[-16]-RC[-14]*RC[-13])/1000 -> 0 | V15: 34.82 | W15: 22.15 | X15: =RC[-2]*RC[-10]/1000 -> 2.2030614000000002 | Y15: =(RC[-3]*RC[-11]-RC[-2]*RC[-9])/1000 -> 1.1516009 | Z15: 2013-11-24T00:00:00.000 | AA15: 2013-11-22T00:00:00.000 | AD15: =VALUE(RC[-28]) -> 2018-09-24T00:00:00.000 | AE15: =IF(RC[22]=42,"*",IF(RC[22]=32,"",RC[22])) -> - | AF15: =RC[-29] -> 24 | AG15: =RC[-29] -> 0 | AH15: =RC[-29] -> 22.3 | AI15: =RC[-29] -> 7.53 | AJ15: =RC[-29] -> 0 | AK15: =RC[-29] -> 21.98 | AL15: =RC[-29] -> 5.43 | AM15: =RC[-29] -> 0.32000000000000028 | AN15: =RC[-29] -> 0 | AO15: =RC[-29] -> 0 | AP15: =RC[-29] -> 35.44 | AQ15: =RC[-29] -> 63.27 | AR15: - | AS15: =RC[-30] -> 22.39 | AT15: =RC[-30] -> 47.47 | AU15: - | AV15: =RC[-31] -> 15.800000000000004 | AW15: =RC[-31] -> 13.05 | AX15: =RC[-31] -> 1.1539999999999999 | AY15: =RC[-31] -> 1.1539999999999999 | BA15: - | BB15: - | BC15: -
A16: =IF(RC[1]="","",DATEVALUE(RC[1])) -> 43368 | B16: 25.09.18 | C16: 24 | D16: 0 | E16: 21.69 | F16: 7.53 | G16: 0 | H16: 21.59 | I16: 5.43 | J16: =RC[-5]-RC[-2] -> 0.10000000000000142 | K16: 0 | L16: 0 | M16: 38.21 | N16: 61.69 | O16: 22.33 | P16: 46.53 | Q16: =RC[-3]-RC[-1] -> 15.159999999999997 | R16: 15.88 | S16: 1.2889999999999999 | T16: =RC[-8]+RC[-1] -> 1.2889999999999999 | U16: =(RC[-17]*RC[-16]-RC[-14]*RC[-13])/1000 -> 0 | V16: 37.549999999999997 | W16: 22.09 | X16: =RC[-2]*RC[-10]/1000 -> 2.3164595000000001 | Y16: =(RC[-3]*RC[-11]-RC[-2]*RC[-9])/1000 -> 1.2886118 | Z16: 2013-11-25T00:00:00.000 | AA16: 2013-11-23T00:00:00.000 | AD16: =VALUE(RC[-28]) -> 2018-09-25T00:00:00.000 | AE16: =IF(RC[22]=42,"*",IF(RC[22]=32,"",RC[22])) -> - | AF16: =RC[-29] -> 24 | AG16: =RC[-29] -> 0 | AH16: =RC[-29] -> 21.69 | AI16: =RC[-29] -> 7.53 | AJ16: =RC[-29] -> 0 | AK16: =RC[-29] -> 21.59 | AL16: =RC[-29] -> 5.43 | AM16: =RC[-29] -> 0.10000000000000142 | AN16: =RC[-29] -> 0 | AO16: =RC[-29] -> 0 | AP16: =RC[-29] -> 38.21 | AQ16: =RC[-29] -> 61.69 | AR16: - | AS16: =RC[-30] -> 22.33 | AT16: =RC[-30] -> 46.53 | AU16: - | AV16: =RC[-31] -> 15.159999999999997 | AW16: =RC[-31] -> 15.88 | AX16: =RC[-31] -> 1.2889999999999999 | AY16: =RC[-31] -> 1.2889999999999999 | BA16: - | BB16: - | BC16: -
A17: =IF(RC[1]="","",DATEVALUE(RC[1])) -> 43369 | B17: 26.09.18 | C17: 24 | D17: 0 | E17: 21.47 | F17: 7.53 | G17: 0 | H17: 21.66 | I17: 5.43 | J17: =RC[-5]-RC[-2] -> -0.19000000000000128 | K17: 0 | L17: 0 | M17: 36.81 | N17: 60.39 | O17: 22.24 | P17: 45.53 | Q17: =RC[-3]-RC[-1] -> 14.86 | R17: 14.57 | S17: 1.1870000000000001 | T17: =RC[-8]+RC[-1] -> 1.1870000000000001 | U17: =(RC[-17]*RC[-16]-RC[-14]*RC[-13])/1000 -> 0 | V17: 36.21 | W17: 22 | X17: =RC[-2]*RC[-10]/1000 -> 2.1867219000000002 | Y17: =(RC[-3]*RC[-11]-RC[-2]*RC[-9])/1000 -> 1.1850619 | Z17: 2013-11-26T00:00:00.000 | AA17: 2013-11-24T00:00:00.000 | AD17: =VALUE(RC[-28]) -> 2018-09-26T00:00:00.000 | AE17: =IF(RC[22]=42,"*",IF(RC[22]=32,"",RC[22])) -> - | AF17: =RC[-29] -> 24 | AG17: =RC[-29] -> 0 | AH17: =RC[-29] -> 21.47 | AI17: =RC[-29] -> 7.53 | AJ17: =RC[-29] -> 0 | AK17: =RC[-29] -> 21.66 | AL17: =RC[-29] -> 5.43 | AM17: =RC[-29] -> -0.19000000000000128 | AN17: =RC[-29] -> 0 | AO17: =RC[-29] -> 0 | AP17: =RC[-29] -> 36.81 | AQ17: =RC[-29] -> 60.39 | AR17: - | AS17: =RC[-30] -> 22.24 | AT17: =RC[-30] -> 45.53 | AU17: - | AV17: =RC[-31] -> 14.86 | AW17: =RC[-31] -> 14.57 | AX17: =RC[-31] -> 1.1870000000000001 | AY17: =RC[-31] -> 1.1870000000000001 | BA17: - | BB17: - | BC17: -
A18: =IF(RC[1]="","",DATEVALUE(RC[1])) -> 43370 | B18: 27.09.18 | C18: 24 | D18: 30.76 | E18: 45.06 | F18: 7.53 | G18: 32.880000000000003 | H18: 42.42 | I18: 5.43 | J18: =RC[-5]-RC[-2] -> 2.6400000000000006 | K18: -2.12 | L18: 6.7000000000000004E-2 | M18: 38.86 | N18: 57.22 | O18: 20.68 | P18: 42.83 | Q18: =RC[-3]-RC[-1] -> 14.39 | R18: 18.18 | S18: 1.3169999999999999 | T18: =RC[-8]+RC[-1] -> 1.3839999999999999 | U18: =(RC[-17]*RC[-16]-RC[-14]*RC[-13])/1000 -> -8.7239999999999332E-3 | V18: 38.28 | W18: 20.440000000000001 | X18: =RC[-2]*RC[-10]/1000 -> 2.1903816000000003 | Y18: =(RC[-3]*RC[-11]-RC[-2]*RC[-9])/1000 -> 1.3149364000000001 | Z18: 2013-11-27T00:00:00.000 | AA18: 2013-11-25T00:00:00.000 | AD18: =VALUE(RC[-28]) -> 2018-09-27T00:00:00.000 | AE18: =IF(RC[22]=42,"*",IF(RC[22]=32,"",RC[22])) -> - | AF18: =RC[-29] -> 24 | AG18: =RC[-29] -> 30.76 | AH18: =RC[-29] -> 45.06 | AI18: =RC[-29] -> 7.53 | AJ18: =RC[-29] -> 32.880000000000003 | AK18: =RC[-29] -> 42.42 | AL18: =RC[-29] -> 5.43 | AM18: =RC[-29] -> 2.6400000000000006 | AN18: =RC[-29] -> -2.12 | AO18: =RC[-29] -> 6.7000000000000004E-2 | AP18: =RC[-29] -> 38.86 | AQ18: =RC[-29] -> 57.22 | AR18: - | AS18: =RC[-30] -> 20.68 | AT18: =RC[-30] -> 42.83 | AU18: - | AV18: =RC[-31] -> 14.39 | AW18: =RC[-31] -> 18.18 | AX18: =RC[-31] -> 1.3169999999999999 | AY18: =RC[-31] -> 1.3839999999999999 | BA18: - | BB18: - | BC18: -
A19: =IF(RC[1]="","",DATEVALUE(RC[1])) -> 43371 | B19: 28.09.18 | C19: 24 | D19: 172.93 | E19: 45.77 | F19: 7.53 | G19: 172.93 | H19: 44 | I19: 5.43 | J19: =RC[-5]-RC[-2] -> 1.7700000000000031 | K19: 0 | L19: 0.313 | M19: 37.659999999999997 | N19: 59.81 | O19: 21.52 | P19: 44.4 | Q19: =RC[-3]-RC[-1] -> 15.410000000000004 | R19: 16.14 | S19: 1.2689999999999999 | T19: =RC[-8]+RC[-1] -> 1.5819999999999999 | U19: =(RC[-17]*RC[-16]-RC[-14]*RC[-13])/1000 -> 0.30608610000000042 | V19: 37.03 | W19: 21.28 | X19: =RC[-2]*RC[-10]/1000 -> 2.2147643000000001 | Y19: =(RC[-3]*RC[-11]-RC[-2]*RC[-9])/1000 -> 1.2699323000000005 | Z19: 2013-11-28T00:00:00.000 | AA19: 2013-11-26T00:00:00.000 | AD19: =VALUE(RC[-28]) -> 2018-09-28T00:00:00.000 | AE19: =IF(RC[22]=42,"*",IF(RC[22]=32,"",RC[22])) -> - | AF19: =RC[-29] -> 24 | AG19: =RC[-29] -> 172.93 | AH19: =RC[-29] -> 45.77 | AI19: =RC[-29] -> 7.53 | AJ19: =RC[-29] -> 172.93 | AK19: =RC[-29] -> 44 | AL19: =RC[-29] -> 5.43 | AM19: =RC[-29] -> 1.7700000000000031 | AN19: =RC[-29] -> 0 | AO19: =RC[-29] -> 0.313 | AP19: =RC[-29] -> 37.659999999999997 | AQ19: =RC[-29] -> 59.81 | AR19: - | AS19: =RC[-30] -> 21.52 | AT19: =RC[-30] -> 44.4 | AU19: - | AV19: =RC[-31] -> 15.410000000000004 | AW19: =RC[-31] -> 16.14 | AX19: =RC[-31] -> 1.2689999999999999 | AY19: =RC[-31] -> 1.5819999999999999 | BA19: - | BB19: - | BC19: -
A20: =IF(RC[1]="","",DATEVALUE(RC[1])) -> 43372 | B20: 29.09.18 | C20: 24 | D20: 199.05 | E20: 50.33 | F20: 7.53 | G20: 199.05 | H20: 48.46 | I20: 5.43 | J20: =RC[-5]-RC[-2] -> 1.8699999999999974 | K20: 0 | L20: 0.378 | M20: 37.21 | N20: 60.12 | O20: 21.57 | P20: 44.62 | Q20: =RC[-3]-RC[-1] -> 15.5 | R20: 15.64 | S20: 1.2490000000000001 | T20: =RC[-8]+RC[-1] -> 1.6270000000000002 | U20: =(RC[-17]*RC[-16]-RC[-14]*RC[-13])/1000 -> 0.37222349999999826 | V20: 36.590000000000003 | W20: 21.33 | X20: =RC[-2]*RC[-10]/1000 -> 2.1997908000000002 | Y20: =(RC[-3]*RC[-11]-RC[-2]*RC[-9])/1000 -> 1.2480462000000003 | Z20: 2013-11-29T00:00:00.000 | AA20: 2013-11-27T00:00:00.000 | AD20: =VALUE(RC[-28]) -> 2018-09-29T00:00:00.000 | AE20: =IF(RC[22]=42,"*",IF(RC[22]=32,"",RC[22])) -> - | AF20: =RC[-29] -> 24 | AG20: =RC[-29] -> 199.05 | AH20: =RC[-29] -> 50.33 | AI20: =RC[-29] -> 7.53 | AJ20: =RC[-29] -> 199.05 | AK20: =RC[-29] -> 48.46 | AL20: =RC[-29] -> 5.43 | AM20: =RC[-29] -> 1.8699999999999974 | AN20: =RC[-29] -> 0 | AO20: =RC[-29] -> 0.378 | AP20: =RC[-29] -> 37.21 | AQ20: =RC[-29] -> 60.12 | AR20: - | AS20: =RC[-30] -> 21.57 | AT20: =RC[-30] -> 44.62 | AU20: - | AV20: =RC[-31] -> 15.5 | AW20: =RC[-31] -> 15.64 | AX20: =RC[-31] -> 1.2490000000000001 | AY20: =RC[-31] -> 1.6270000000000002 | BA20: - | BB20: - | BC20: -
A21: =IF(RC[1]="","",DATEVALUE(RC[1])) -> 43373 | B21: 30.09.18 | C21: 24 | D21: 198.8 | E21: 50.87 | F21: 7.53 | G21: 197.99 | H21: 44.98 | I21: 5.43 | J21: =RC[-5]-RC[-2] -> 5.8900000000000006 | K21: 0.81 | L21: 1.216 | M21: 37.200000000000003 | N21: 61.56 | O21: 21.63 | P21: 45.19 | Q21: =RC[-3]-RC[-1] -> 16.370000000000005 | R21: 15.57 | S21: 1.286 | T21: =RC[-8]+RC[-1] -> 2.5019999999999998 | U21: =(RC[-17]*RC[-16]-RC[-14]*RC[-13])/1000 -> 1.2073657999999996 | V21: 36.54 | W21: 21.39 | X21: =RC[-2]*RC[-10]/1000 -> 2.2494024000000001 | Y21: =(RC[-3]*RC[-11]-RC[-2]*RC[-9])/1000 -> 1.2827883 | Z21: 2013-11-30T00:00:00.000 | AA21: 2013-11-28T00:00:00.000 | AD21: =VALUE(RC[-28]) -> 2018-09-30T00:00:00.000 | AE21: =IF(RC[22]=42,"*",IF(RC[22]=32,"",RC[22])) -> - | AF21: =RC[-29] -> 24 | AG21: =RC[-29] -> 198.8 | AH21: =RC[-29] -> 50.87 | AI21: =RC[-29] -> 7.53 | AJ21: =RC[-29] -> 197.99 | AK21: =RC[-29] -> 44.98 | AL21: =RC[-29] -> 5.43 | AM21: =RC[-29] -> 5.8900000000000006 | AN21: =RC[-29] -> 0.81 | AO21: =RC[-29] -> 1.216 | AP21: =RC[-29] -> 37.200000000000003 | AQ21: =RC[-29] -> 61.56 | AR21: - | AS21: =RC[-30] -> 21.63 | AT21: =RC[-30] -> 45.19 | AU21: - | AV21: =RC[-31] -> 16.370000000000005 | AW21: =RC[-31] -> 15.57 | AX21: =RC[-31] -> 1.286 | AY21: =RC[-31] -> 2.5019999999999998 | BA21: - | BB21: - | BC21: -
A22: =IF(RC[1]="","",DATEVALUE(RC[1])) -> 43374 | B22: 01.10.18 | C22: 24 | D22: 198.62 | E22: 50.42 | F22: 7.53 | G22: 197.57 | H22: 38.380000000000003 | I22: 5.43 | J22: =RC[-5]-RC[-2] -> 12.04 | K22: 1.05 | L22: 2.4329999999999998 | M22: 35.450000000000003 | N22: 60.76 | O22: 21.72 | P22: 45.48 | Q22: =RC[-3]-RC[-1] -> 15.280000000000001 | R22: 13.73 | S22: 1.141 | T22: =RC[-8]+RC[-1] -> 3.5739999999999998 | U22: =(RC[-17]*RC[-16]-RC[-14]*RC[-13])/1000 -> 2.4316838000000005 | V22: 34.85 | W22: 21.48 | X22: =RC[-2]*RC[-10]/1000 -> 2.117486 | Y22: =(RC[-3]*RC[-11]-RC[-2]*RC[-9])/1000 -> 1.1405755999999998 | Z22: 2013-12-01T00:00:00.000 | AA22: 2013-11-29T00:00:00.000 | AD22: =VALUE(RC[-28]) -> 2018-10-01T00:00:00.000 | AE22: =IF(RC[22]=42,"*",IF(RC[22]=32,"",RC[22])) -> - | AF22: =RC[-29] -> 24 | AG22: =RC[-29] -> 198.62 | AH22: =RC[-29] -> 50.42 | AI22: =RC[-29] -> 7.53 | AJ22: =RC[-29] -> 197.57 | AK22: =RC[-29] -> 38.380000000000003 | AL22: =RC[-29] -> 5.43 | AM22: =RC[-29] -> 12.04 | AN22: =RC[-29] -> 1.05 | AO22: =RC[-29] -> 2.4329999999999998 | AP22: =RC[-29] -> 35.450000000000003 | AQ22: =RC[-29] -> 60.76 | AR22: - | AS22: =RC[-30] -> 21.72 | AT22: =RC[-30] -> 45.48 | AU22: - | AV22: =RC[-31] -> 15.280000000000001 | AW22: =RC[-31] -> 13.73 | AX22: =RC[-31] -> 1.141 | AY22: =RC[-31] -> 3.5739999999999998 | BA22: - | BB22: - | BC22: -
A23: =IF(RC[1]="","",DATEVALUE(RC[1])) -> 43375 | B23: 02.10.18 | C23: 24 | D23: 198.3 | E23: 50.29 | F23: 7.53 | G23: 197.61 | H23: 38.159999999999997 | I23: 5.43 | J23: =RC[-5]-RC[-2] -> 12.130000000000003 | K23: 0.69 | L23: 2.4359999999999999 | M23: 34.880000000000003 | N23: 59.67 | O23: 22.18 | P23: 45.1 | Q23: =RC[-3]-RC[-1] -> 14.57 | R23: 12.7 | S23: 1.0580000000000001 | T23: =RC[-8]+RC[-1] -> 3.4939999999999998 | U23: =(RC[-17]*RC[-16]-RC[-14]*RC[-13])/1000 -> 2.4317093999999999 | V23: 34.31 | W23: 21.94 | X23: =RC[-2]*RC[-10]/1000 -> 2.0472777 | Y23: =(RC[-3]*RC[-11]-RC[-2]*RC[-9])/1000 -> 1.0577836999999999 | Z23: 2013-12-02T00:00:00.000 | AA23: 2013-11-30T00:00:00.000 | AD23: =VALUE(RC[-28]) -> 2018-10-02T00:00:00.000 | AE23: =IF(RC[22]=42,"*",IF(RC[22]=32,"",RC[22])) -> - | AF23: =RC[-29] -> 24 | AG23: =RC[-29] -> 198.3 | AH23: =RC[-29] -> 50.29 | AI23: =RC[-29] -> 7.53 | AJ23: =RC[-29] -> 197.61 | AK23: =RC[-29] -> 38.159999999999997 | AL23: =RC[-29] -> 5.43 | AM23: =RC[-29] -> 12.130000000000003 | AN23: =RC[-29] -> 0.69 | AO23: =RC[-29] -> 2.4359999999999999 | AP23: =RC[-29] -> 34.880000000000003 | AQ23: =RC[-29] -> 59.67 | AR23: - | AS23: =RC[-30] -> 22.18 | AT23: =RC[-30] -> 45.1 | AU23: - | AV23: =RC[-31] -> 14.57 | AW23: =RC[-31] -> 12.7 | AX23: =RC[-31] -> 1.0580000000000001 | AY23: =RC[-31] -> 3.4939999999999998 | BA23: - | BB23: - | BC23: -
A24: =IF(RC[1]="","",DATEVALUE(RC[1])) -> 43376 | B24: 03.10.18 | C24: 24 | D24: 201.16 | E24: 50.88 | F24: 7.53 | G24: 199.84 | H24: 38.549999999999997 | I24: 5.43 | J24: =RC[-5]-RC[-2] -> 12.330000000000005 | K24: 1.32 | L24: 2.532 | M24: 35.54 | N24: 59.69 | O24: 21.32 | P24: 44.85 | Q24: =RC[-3]-RC[-1] -> 14.839999999999996 | R24: 14.22 | S24: 1.139 | T24: =RC[-8]+RC[-1] -> 3.6710000000000003 | U24: =(RC[-17]*RC[-16]-RC[-14]*RC[-13])/1000 -> 2.5311888000000007 | V24: 34.950000000000003 | W24: 21.08 | X24: =RC[-2]*RC[-10]/1000 -> 2.0861654999999999 | Y24: =(RC[-3]*RC[-11]-RC[-2]*RC[-9])/1000 -> 1.1407274999999999 | Z24: 2013-12-03T00:00:00.000 | AA24: 2013-12-01T00:00:00.000 | AD24: =VALUE(RC[-28]) -> 2018-10-03T00:00:00.000 | AE24: =IF(RC[22]=42,"*",IF(RC[22]=32,"",RC[22])) -> - | AF24: =RC[-29] -> 24 | AG24: =RC[-29] -> 201.16 | AH24: =RC[-29] -> 50.88 | AI24: =RC[-29] -> 7.53 | AJ24: =RC[-29] -> 199.84 | AK24: =RC[-29] -> 38.549999999999997 | AL24: =RC[-29] -> 5.43 | AM24: =RC[-29] -> 12.330000000000005 | AN24: =RC[-29] -> 1.32 | AO24: =RC[-29] -> 2.532 | AP24: =RC[-29] -> 35.54 | AQ24: =RC[-29] -> 59.69 | AR24: - | AS24: =RC[-30] -> 21.32 | AT24: =RC[-30] -> 44.85 | AU24: - | AV24: =RC[-31] -> 14.839999999999996 | AW24: =RC[-31] -> 14.22 | AX24: =RC[-31] -> 1.139 | AY24: =RC[-31] -> 3.6710000000000003 | BA24: - | BB24: - | BC24: -
A25: =IF(RC[1]="","",DATEVALUE(RC[1])) -> 43377 | B25: 04.10.18 | C25: 24 | D25: 201.4 | E25: 50.57 | F25: 7.53 | G25: 200.64 | H25: 38.130000000000003 | I25: 5.43 | J25: =RC[-5]-RC[-2] -> 12.439999999999998 | K25: 0.76 | L25: 2.5409999999999999 | M25: 36.33 | N25: 59.37 | O25: 20.91 | P25: 44.78 | Q25: =RC[-3]-RC[-1] -> 14.589999999999996 | R25: 15.42 | S25: 1.196 | T25: =RC[-8]+RC[-1] -> 3.7370000000000001 | U25: =(RC[-17]*RC[-16]-RC[-14]*RC[-13])/1000 -> 2.5343948000000007 | V25: 35.75 | W25: 20.67 | X25: =RC[-2]*RC[-10]/1000 -> 2.1224775 | Y25: =(RC[-3]*RC[-11]-RC[-2]*RC[-9])/1000 -> 1.1968748999999999 | Z25: 2013-12-04T00:00:00.000 | AA25: 2013-12-02T00:00:00.000 | AD25: =VALUE(RC[-28]) -> 2018-10-04T00:00:00.000 | AE25: =IF(RC[22]=42,"*",IF(RC[22]=32,"",RC[22])) -> - | AF25: =RC[-29] -> 24 | AG25: =RC[-29] -> 201.4 | AH25: =RC[-29] -> 50.57 | AI25: =RC[-29] -> 7.53 | AJ25: =RC[-29] -> 200.64 | AK25: =RC[-29] -> 38.130000000000003 | AL25: =RC[-29] -> 5.43 | AM25: =RC[-29] -> 12.439999999999998 | AN25: =RC[-29] -> 0.76 | AO25: =RC[-29] -> 2.5409999999999999 | AP25: =RC[-29] -> 36.33 | AQ25: =RC[-29] -> 59.37 | AR25: - | AS25: =RC[-30] -> 20.91 | AT25: =RC[-30] -> 44.78 | AU25: - | AV25: =RC[-31] -> 14.589999999999996 | AW25: =RC[-31] -> 15.42 | AX25: =RC[-31] -> 1.196 | AY25: =RC[-31] -> 3.7370000000000001 | BA25: - | BB25: - | BC25: -
A26: =IF(RC[1]="","",DATEVALUE(RC[1])) -> 43378 | B26: 05.10.18 | C26: 24 | D26: 200.77 | E26: 51.11 | F26: 7.53 | G26: 200.7 | H26: 38.33 | I26: 5.43 | J26: =RC[-5]-RC[-2] -> 12.780000000000001 | K26: 7.0000000000000007E-2 | L26: 2.5720000000000001 | M26: 35.590000000000003 | N26: 58.72 | O26: 21.31 | P26: 44.24 | Q26: =RC[-3]-RC[-1] -> 14.479999999999997 | R26: 14.28 | S26: 1.1240000000000001 | T26: =RC[-8]+RC[-1] -> 3.6960000000000002 | U26: =(RC[-17]*RC[-16]-RC[-14]*RC[-13])/1000 -> 2.5685237000000005 | V26: 35.01 | W26: 21.07 | X26: =RC[-2]*RC[-10]/1000 -> 2.0557871999999997 | Y26: =(RC[-3]*RC[-11]-RC[-2]*RC[-9])/1000 -> 1.1236503999999996 | Z26: 2013-12-05T00:00:00.000 | AA26: 2013-12-03T00:00:00.000 | AD26: =VALUE(RC[-28]) -> 2018-10-05T00:00:00.000 | AE26: =IF(RC[22]=42,"*",IF(RC[22]=32,"",RC[22])) -> - | AF26: =RC[-29] -> 24 | AG26: =RC[-29] -> 200.77 | AH26: =RC[-29] -> 51.11 | AI26: =RC[-29] -> 7.53 | AJ26: =RC[-29] -> 200.7 | AK26: =RC[-29] -> 38.33 | AL26: =RC[-29] -> 5.43 | AM26: =RC[-29] -> 12.780000000000001 | AN26: =RC[-29] -> 7.0000000000000007E-2 | AO26: =RC[-29] -> 2.5720000000000001 | AP26: =RC[-29] -> 35.590000000000003 | AQ26: =RC[-29] -> 58.72 | AR26: - | AS26: =RC[-30] -> 21.31 | AT26: =RC[-30] -> 44.24 | AU26: - | AV26: =RC[-31] -> 14.479999999999997 | AW26: =RC[-31] -> 14.28 | AX26: =RC[-31] -> 1.1240000000000001 | AY26: =RC[-31] -> 3.6960000000000002 | BA26: - | BB26: - | BC26: -
A27: =IF(RC[1]="","",DATEVALUE(RC[1])) -> 43379 | B27: 06.10.18 | C27: 24 | D27: 201.2 | E27: 51.01 | F27: 7.53 | G27: 201.2 | H27: 38.89 | I27: 5.43 | J27: =RC[-5]-RC[-2] -> 12.119999999999997 | K27: 0 | L27: 2.4420000000000002 | M27: 35.950000000000003 | N27: 59.13 | O27: 21.49 | P27: 44.9 | Q27: =RC[-3]-RC[-1] -> 14.230000000000004 | R27: 14.46 | S27: 1.1379999999999999 | T27: =RC[-8]+RC[-1] -> 3.58 | U27: =(RC[-17]*RC[-16]-RC[-14]*RC[-13])/1000 -> 2.4385439999999998 | V27: 35.36 | W27: 21.25 | X27: =RC[-2]*RC[-10]/1000 -> 2.0908367999999999 | Y27: =(RC[-3]*RC[-11]-RC[-2]*RC[-9])/1000 -> 1.1367118 | Z27: 2013-12-06T00:00:00.000 | AA27: 2013-12-04T00:00:00.000 | AD27: =VALUE(RC[-28]) -> 2018-10-06T00:00:00.000 | AE27: =IF(RC[22]=42,"*",IF(RC[22]=32,"",RC[22])) -> - | AF27: =RC[-29] -> 24 | AG27: =RC[-29] -> 201.2 | AH27: =RC[-29] -> 51.01 | AI27: =RC[-29] -> 7.53 | AJ27: =RC[-29] -> 201.2 | AK27: =RC[-29] -> 38.89 | AL27: =RC[-29] -> 5.43 | AM27: =RC[-29] -> 12.119999999999997 | AN27: =RC[-29] -> 0 | AO27: =RC[-29] -> 2.4420000000000002 | AP27: =RC[-29] -> 35.950000000000003 | AQ27: =RC[-29] -> 59.13 | AR27: - | AS27: =RC[-30] -> 21.49 | AT27: =RC[-30] -> 44.9 | AU27: - | AV27: =RC[-31] -> 14.230000000000004 | AW27: =RC[-31] -> 14.46 | AX27: =RC[-31] -> 1.1379999999999999 | AY27: =RC[-31] -> 3.58 | BA27: - | BB27: - | BC27: -
A28: =IF(RC[1]="","",DATEVALUE(RC[1])) -> 43380 | B28: 07.10.18 | C28: 24 | D28: 201.17 | E28: 51.79 | F28: 7.53 | G28: 201.16 | H28: 39.35 | I28: 5.43 | J28: =RC[-5]-RC[-2] -> 12.439999999999998 | K28: 0.01 | L28: 2.5059999999999998 | M28: 38.380000000000003 | N28: 59.68 | O28: 20.85 | P28: 45.33 | Q28: =RC[-3]-RC[-1] -> 14.350000000000001 | R28: 17.53 | S28: 1.32 | T28: =RC[-8]+RC[-1] -> 3.8259999999999996 | U28: =(RC[-17]*RC[-16]-RC[-14]*RC[-13])/1000 -> 2.502948299999999 | V28: 37.76 | W28: 20.61 | X28: =RC[-2]*RC[-10]/1000 -> 2.2535167999999999 | Y28: =(RC[-3]*RC[-11]-RC[-2]*RC[-9])/1000 -> 1.3192655 | Z28: 2013-12-07T00:00:00.000 | AA28: 2013-12-05T00:00:00.000 | AD28: =VALUE(RC[-28]) -> 2018-10-07T00:00:00.000 | AE28: =IF(RC[22]=42,"*",IF(RC[22]=32,"",RC[22])) -> - | AF28: =RC[-29] -> 24 | AG28: =RC[-29] -> 201.17 | AH28: =RC[-29] -> 51.79 | AI28: =RC[-29] -> 7.53 | AJ28: =RC[-29] -> 201.16 | AK28: =RC[-29] -> 39.35 | AL28: =RC[-29] -> 5.43 | AM28: =RC[-29] -> 12.439999999999998 | AN28: =RC[-29] -> 0.01 | AO28: =RC[-29] -> 2.5059999999999998 | AP28: =RC[-29] -> 38.380000000000003 | AQ28: =RC[-29] -> 59.68 | AR28: - | AS28: =RC[-30] -> 20.85 | AT28: =RC[-30] -> 45.33 | AU28: - | AV28: =RC[-31] -> 14.350000000000001 | AW28: =RC[-31] -> 17.53 | AX28: =RC[-31] -> 1.32 | AY28: =RC[-31] -> 3.8259999999999996 | BA28: - | BB28: - | BC28: -
A29: =IF(RC[1]="","",DATEVALUE(RC[1])) -> 43381 | B29: 08.10.18 | C29: 24 | D29: 201.06 | E29: 51.13 | F29: 7.53 | G29: 201.06 | H29: 38.96 | I29: 5.43 | J29: =RC[-5]-RC[-2] -> 12.170000000000002 | K29: 0 | L29: 2.4500000000000002 | M29: 35.409999999999997 | N29: 59.33 | O29: 21.24 | P29: 44.91 | Q29: =RC[-3]-RC[-1] -> 14.420000000000002 | R29: 14.17 | S29: 1.1220000000000001 | T29: =RC[-8]+RC[-1] -> 3.5720000000000001 | U29: =(RC[-17]*RC[-16]-RC[-14]*RC[-13])/1000 -> 2.4469002 | V29: 34.83 | W29: 21 | X29: =RC[-2]*RC[-10]/1000 -> 2.0664638999999996 | Y29: =(RC[-3]*RC[-11]-RC[-2]*RC[-9])/1000 -> 1.1233538999999999 | Z29: 2013-12-08T00:00:00.000 | AA29: 2013-12-06T00:00:00.000 | AD29: =VALUE(RC[-28]) -> 2018-10-08T00:00:00.000 | AE29: =IF(RC[22]=42,"*",IF(RC[22]=32,"",RC[22])) -> - | AF29: =RC[-29] -> 24 | AG29: =RC[-29] -> 201.06 | AH29: =RC[-29] -> 51.13 | AI29: =RC[-29] -> 7.53 | AJ29: =RC[-29] -> 201.06 | AK29: =RC[-29] -> 38.96 | AL29: =RC[-29] -> 5.43 | AM29: =RC[-29] -> 12.170000000000002 | AN29: =RC[-29] -> 0 | AO29: =RC[-29] -> 2.4500000000000002 | AP29: =RC[-29] -> 35.409999999999997 | AQ29: =RC[-29] -> 59.33 | AR29: - | AS29: =RC[-30] -> 21.24 | AT29: =RC[-30] -> 44.91 | AU29: - | AV29: =RC[-31] -> 14.420000000000002 | AW29: =RC[-31] -> 14.17 | AX29: =RC[-31] -> 1.1220000000000001 | AY29: =RC[-31] -> 3.5720000000000001 | BA29: - | BB29: - | BC29: -
A30: =IF(RC[1]="","",DATEVALUE(RC[1])) -> 43382 | B30: 09.10.18 | C30: 24 | D30: 201.51 | E30: 49.47 | F30: 7.53 | G30: 201.5 | H30: 38.090000000000003 | I30: 5.43 | J30: =RC[-5]-RC[-2] -> 11.379999999999995 | K30: 0.01 | L30: 2.2989999999999999 | M30: 34.770000000000003 | N30: 59.06 | O30: 21.23 | P30: 44.69 | Q30: =RC[-3]-RC[-1] -> 14.370000000000005 | R30: 13.54 | S30: 1.083 | T30: =RC[-8]+RC[-1] -> 3.3819999999999997 | U30: =(RC[-17]*RC[-16]-RC[-14]*RC[-13])/1000 -> 2.2935646999999979 | V30: 34.22 | W30: 20.99 | X30: =RC[-2]*RC[-10]/1000 -> 2.0210332000000002 | Y30: =(RC[-3]*RC[-11]-RC[-2]*RC[-9])/1000 -> 1.0829901000000002 | Z30: 2013-12-09T00:00:00.000 | AA30: 2013-12-07T00:00:00.000 | AD30: =VALUE(RC[-28]) -> 2018-10-09T00:00:00.000 | AE30: =IF(RC[22]=42,"*",IF(RC[22]=32,"",RC[22])) -> - | AF30: =RC[-29] -> 24 | AG30: =RC[-29] -> 201.51 | AH30: =RC[-29] -> 49.47 | AI30: =RC[-29] -> 7.53 | AJ30: =RC[-29] -> 201.5 | AK30: =RC[-29] -> 38.090000000000003 | AL30: =RC[-29] -> 5.43 | AM30: =RC[-29] -> 11.379999999999995 | AN30: =RC[-29] -> 0.01 | AO30: =RC[-29] -> 2.2989999999999999 | AP30: =RC[-29] -> 34.770000000000003 | AQ30: =RC[-29] -> 59.06 | AR30: - | AS30: =RC[-30] -> 21.23 | AT30: =RC[-30] -> 44.69 | AU30: - | AV30: =RC[-31] -> 14.370000000000005 | AW30: =RC[-31] -> 13.54 | AX30: =RC[-31] -> 1.083 | AY30: =RC[-31] -> 3.3819999999999997 | BA30: - | BB30: - | BC30: -
A31: =IF(RC[1]="","",DATEVALUE(RC[1])) -> 43383 | B31: 10.10.18 | C31: 24 | D31: 201.34 | E31: 50.18 | F31: 7.53 | G31: 201.31 | H31: 38.58 | I31: 5.43 | J31: =RC[-5]-RC[-2] -> 11.600000000000001 | K31: 0.03 | L31: 2.3380000000000001 | M31: 36.4 | N31: 59.95 | O31: 21.28 | P31: 45.6 | Q31: =RC[-3]-RC[-1] -> 14.350000000000001 | R31: 15.12 | S31: 1.1870000000000001 | T31: =RC[-8]+RC[-1] -> 3.5250000000000004 | U31: =(RC[-17]*RC[-16]-RC[-14]*RC[-13])/1000 -> 2.3367014000000008 | V31: 35.79 | W31: 21.04 | X31: =RC[-2]*RC[-10]/1000 -> 2.1456105000000001 | Y31: =(RC[-3]*RC[-11]-RC[-2]*RC[-9])/1000 -> 1.1861865000000003 | Z31: 2013-12-10T00:00:00.000 | AA31: 2013-12-08T00:00:00.000 | AD31: =VALUE(RC[-28]) -> 2018-10-10T00:00:00.000 | AE31: =IF(RC[22]=42,"*",IF(RC[22]=32,"",RC[22])) -> - | AF31: =RC[-29] -> 24 | AG31: =RC[-29] -> 201.34 | AH31: =RC[-29] -> 50.18 | AI31: =RC[-29] -> 7.53 | AJ31: =RC[-29] -> 201.31 | AK31: =RC[-29] -> 38.58 | AL31: =RC[-29] -> 5.43 | AM31: =RC[-29] -> 11.600000000000001 | AN31: =RC[-29] -> 0.03 | AO31: =RC[-29] -> 2.3380000000000001 | AP31: =RC[-29] -> 36.4 | AQ31: =RC[-29] -> 59.95 | AR31: - | AS31: =RC[-30] -> 21.28 | AT31: =RC[-30] -> 45.6 | AU31: - | AV31: =RC[-31] -> 14.350000000000001 | AW31: =RC[-31] -> 15.12 | AX31: =RC[-31] -> 1.1870000000000001 | AY31: =RC[-31] -> 3.5250000000000004 | BA31: - | BB31: - | BC31: -
A32: =IF(RC[1]="","",DATEVALUE(RC[1])) -> 43384 | B32: 11.10.18 | C32: 24 | D32: 201.81 | E32: 50.53 | F32: 7.53 | G32: 201.71 | H32: 38.9 | I32: 5.43 | J32: =RC[-5]-RC[-2] -> 11.630000000000003 | K32: 0.1 | L32: 2.3519999999999999 | M32: 35.14 | N32: 60.56 | O32: 21.83 | P32: 45.62 | Q32: =RC[-3]-RC[-1] -> 14.940000000000005 | R32: 13.31 | S32: 1.1080000000000001 | T32: =RC[-8]+RC[-1] -> 3.46 | U32: =(RC[-17]*RC[-16]-RC[-14]*RC[-13])/1000 -> 2.3509403000000004 | V32: 34.56 | W32: 21.59 | X32: =RC[-2]*RC[-10]/1000 -> 2.0929536000000004 | Y32: =(RC[-3]*RC[-11]-RC[-2]*RC[-9])/1000 -> 1.1080178000000003 | Z32: 2013-12-11T00:00:00.000 | AA32: 2013-12-09T00:00:00.000 | AD32: =VALUE(RC[-28]) -> 2018-10-11T00:00:00.000 | AE32: =IF(RC[22]=42,"*",IF(RC[22]=32,"",RC[22])) -> - | AF32: =RC[-29] -> 24 | AG32: =RC[-29] -> 201.81 | AH32: =RC[-29] -> 50.53 | AI32: =RC[-29] -> 7.53 | AJ32: =RC[-29] -> 201.71 | AK32: =RC[-29] -> 38.9 | AL32: =RC[-29] -> 5.43 | AM32: =RC[-29] -> 11.630000000000003 | AN32: =RC[-29] -> 0.1 | AO32: =RC[-29] -> 2.3519999999999999 | AP32: =RC[-29] -> 35.14 | AQ32: =RC[-29] -> 60.56 | AR32: - | AS32: =RC[-30] -> 21.83 | AT32: =RC[-30] -> 45.62 | AU32: - | AV32: =RC[-31] -> 14.940000000000005 | AW32: =RC[-31] -> 13.31 | AX32: =RC[-31] -> 1.1080000000000001 | AY32: =RC[-31] -> 3.46 | BA32: - | BB32: - | BC32: -
A33: =IF(RC[1]="","",DATEVALUE(RC[1])) -> 43385 | B33: 12.10.18 | C33: 24 | D33: 202.31 | E33: 49.07 | F33: 7.53 | G33: 201.81 | H33: 37.85 | I33: 5.43 | J33: =RC[-5]-RC[-2] -> 11.219999999999999 | K33: 0.5 | L33: 2.2930000000000001 | M33: 35.5 | N33: 60.53 | O33: 21.61 | P33: 45.91 | Q33: =RC[-3]-RC[-1] -> 14.620000000000005 | R33: 13.89 | S33: 1.131 | T33: =RC[-8]+RC[-1] -> 3.4240000000000004 | U33: =(RC[-17]*RC[-16]-RC[-14]*RC[-13])/1000 -> 2.2888432000000001 | V33: 34.909999999999997 | W33: 21.37 | X33: =RC[-2]*RC[-10]/1000 -> 2.1131023 | Y33: =(RC[-3]*RC[-11]-RC[-2]*RC[-9])/1000 -> 1.1320056000000001 | Z33: 2013-12-12T00:00:00.000 | AA33: 2013-12-10T00:00:00.000 | AD33: =VALUE(RC[-28]) -> 2018-10-12T00:00:00.000 | AE33: =IF(RC[22]=42,"*",IF(RC[22]=32,"",RC[22])) -> - | AF33: =RC[-29] -> 24 | AG33: =RC[-29] -> 202.31 | AH33: =RC[-29] -> 49.07 | AI33: =RC[-29] -> 7.53 | AJ33: =RC[-29] -> 201.81 | AK33: =RC[-29] -> 37.85 | AL33: =RC[-29] -> 5.43 | AM33: =RC[-29] -> 11.219999999999999 | AN33: =RC[-29] -> 0.5 | AO33: =RC[-29] -> 2.2930000000000001 | AP33: =RC[-29] -> 35.5 | AQ33: =RC[-29] -> 60.53 | AR33: - | AS33: =RC[-30] -> 21.61 | AT33: =RC[-30] -> 45.91 | AU33: - | AV33: =RC[-31] -> 14.620000000000005 | AW33: =RC[-31] -> 13.89 | AX33: =RC[-31] -> 1.131 | AY33: =RC[-31] -> 3.4240000000000004 | BA33: - | BB33: - | BC33: -
A34: =IF(RC[1]="","",DATEVALUE(RC[1])) -> 43386 | B34: 13.10.18 | C34: 24 | D34: 202.57 | E34: 50.26 | F34: 7.53 | G34: 201.84 | H34: 38.64 | I34: 5.43 | J34: =RC[-5]-RC[-2] -> 11.619999999999997 | K34: 0.73 | L34: 2.3849999999999998 | M34: 35.26 | N34: 61.17 | O34: 21.7 | P34: 46.32 | Q34: =RC[-3]-RC[-1] -> 14.850000000000001 | R34: 13.56 | S34: 1.129 | T34: =RC[-8]+RC[-1] -> 3.5139999999999998 | U34: =(RC[-17]*RC[-16]-RC[-14]*RC[-13])/1000 -> 2.3820706 | V34: 34.65 | W34: 21.46 | X34: =RC[-2]*RC[-10]/1000 -> 2.1195405000000003 | Y34: =(RC[-3]*RC[-11]-RC[-2]*RC[-9])/1000 -> 1.1255133000000002 | Z34: 2013-12-13T00:00:00.000 | AA34: 2013-12-11T00:00:00.000 | AD34: =VALUE(RC[-28]) -> 2018-10-13T00:00:00.000 | AE34: =IF(RC[22]=42,"*",IF(RC[22]=32,"",RC[22])) -> - | AF34: =RC[-29] -> 24 | AG34: =RC[-29] -> 202.57 | AH34: =RC[-29] -> 50.26 | AI34: =RC[-29] -> 7.53 | AJ34: =RC[-29] -> 201.84 | AK34: =RC[-29] -> 38.64 | AL34: =RC[-29] -> 5.43 | AM34: =RC[-29] -> 11.619999999999997 | AN34: =RC[-29] -> 0.73 | AO34: =RC[-29] -> 2.3849999999999998 | AP34: =RC[-29] -> 35.26 | AQ34: =RC[-29] -> 61.17 | AR34: - | AS34: =RC[-30] -> 21.7 | AT34: =RC[-30] -> 46.32 | AU34: - | AV34: =RC[-31] -> 14.850000000000001 | AW34: =RC[-31] -> 13.56 | AX34: =RC[-31] -> 1.129 | AY34: =RC[-31] -> 3.5139999999999998 | BA34: - | BB34: - | BC34: -
A35: =IF(RC[1]="","",DATEVALUE(RC[1])) -> 43387 | B35: 14.10.18 | C35: 24 | D35: 202.72 | E35: 49.57 | F35: 7.53 | G35: 202.38 | H35: 38.49 | I35: 5.43 | J35: =RC[-5]-RC[-2] -> 11.079999999999998 | K35: 0.34 | L35: 2.266 | M35: 37.49 | N35: 62.13 | O35: 21.28 | P35: 47.09 | Q35: =RC[-3]-RC[-1] -> 15.04 | R35: 16.21 | S35: 1.2989999999999999 | T35: =RC[-8]+RC[-1] -> 3.5649999999999999 | U35: =(RC[-17]*RC[-16]-RC[-14]*RC[-13])/1000 -> 2.2592242000000007 | V35: 36.81 | W35: 21.04 | X35: =RC[-2]*RC[-10]/1000 -> 2.2870053000000001 | Y35: =(RC[-3]*RC[-11]-RC[-2]*RC[-9])/1000 -> 1.2962317000000003 | Z35: 2013-12-14T00:00:00.000 | AA35: 2013-12-12T00:00:00.000 | AD35: =VALUE(RC[-28]) -> 2018-10-14T00:00:00.000 | AE35: =IF(RC[22]=42,"*",IF(RC[22]=32,"",RC[22])) -> - | AF35: =RC[-29] -> 24 | AG35: =RC[-29] -> 202.72 | AH35: =RC[-29] -> 49.57 | AI35: =RC[-29] -> 7.53 | AJ35: =RC[-29] -> 202.38 | AK35: =RC[-29] -> 38.49 | AL35: =RC[-29] -> 5.43 | AM35: =RC[-29] -> 11.079999999999998 | AN35: =RC[-29] -> 0.34 | AO35: =RC[-29] -> 2.266 | AP35: =RC[-29] -> 37.49 | AQ35: =RC[-29] -> 62.13 | AR35: - | AS35: =RC[-30] -> 21.28 | AT35: =RC[-30] -> 47.09 | AU35: - | AV35: =RC[-31] -> 15.04 | AW35: =RC[-31] -> 16.21 | AX35: =RC[-31] -> 1.2989999999999999 | AY35: =RC[-31] -> 3.5649999999999999 | BA35: - | BB35: - | BC35: -
A36: =IF(RC[1]="","",DATEVALUE(RC[1])) -> 43388 | B36: 15.10.18 | C36: 24 | D36: 189.78 | E36: 49.61 | F36: 7.53 | G36: 189.56 | H36: 38.76 | I36: 5.43 | J36: =RC[-5]-RC[-2] -> 10.850000000000001 | K36: 0.22 | L36: 2.0720000000000001 | M36: =AVERAGE(R[1]C:R[3]C) -> 35.926666666666669 | N36: =AVERAGE(R[1]C:R[3]C) -> 61.886666666666663 | O36: =AVERAGE(R[1]C:R[3]C) -> 22.5 | P36: =AVERAGE(R[1]C:R[3]C) -> 47.35 | Q36: =AVERAGE(R[1]C:R[3]C) -> 14.536666666666664 | R36: =AVERAGE(R[1]C:R[3]C) -> 13.426666666666668 | S36: =AVERAGE(R[1]C:R[3]C) -> 1.1303333333333334 | T36: =AVERAGE(R[1]C:R[3]C) -> 3.3519999999999999 | U36: =(RC[-17]*RC[-16]-RC[-14]*RC[-13])/1000 -> 2.0676402000000009 | V36: 42.77 | W36: 20.25 | X36: =RC[-2]*RC[-10]/1000 -> 2.6468927333333334 | Y36: =(RC[-3]*RC[-11]-RC[-2]*RC[-9])/1000 -> 1.6880552333333334 | Z36: 2013-12-15T00:00:00.000 | AA36: 2013-12-13T00:00:00.000 | AD36: =VALUE(RC[-28]) -> 2018-10-15T00:00:00.000 | AE36: =IF(RC[22]=42,"*",IF(RC[22]=32,"",RC[22])) -> - | AF36: =RC[-29] -> 24 | AG36: =RC[-29] -> 189.78 | AH36: =RC[-29] -> 49.61 | AI36: =RC[-29] -> 7.53 | AJ36: =RC[-29] -> 189.56 | AK36: =RC[-29] -> 38.76 | AL36: =RC[-29] -> 5.43 | AM36: =RC[-29] -> 10.850000000000001 | AN36: =RC[-29] -> 0.22 | AO36: =RC[-29] -> 2.0720000000000001 | AP36: =RC[-29] -> 35.926666666666669 | AQ36: =RC[-29] -> 61.886666666666663 | AR36: - | AS36: =RC[-30] -> 22.5 | AT36: =RC[-30] -> 47.35 | AU36: - | AV36: =RC[-31] -> 14.536666666666664 | AW36: =RC[-31] -> 13.426666666666668 | AX36: =RC[-31] -> 1.1303333333333334 | AY36: =RC[-31] -> 3.3519999999999999 | BA36: - | BB36: - | BC36: -
A37: =IF(RC[1]="","",DATEVALUE(RC[1])) -> 43389 | B37: 16.10.18 | C37: 24 | D37: 204.05 | E37: 48.86 | F37: 7.53 | G37: 203.78 | H37: 38.33 | I37: 5.43 | J37: =RC[-5]-RC[-2] -> 10.530000000000001 | K37: 0.27 | L37: 2.1640000000000001 | M37: 36.46 | N37: 61.71 | O37: 22.1 | P37: 47.17 | Q37: =RC[-3]-RC[-1] -> 14.54 | R37: 14.36 | S37: 1.179 | T37: =RC[-8]+RC[-1] -> 3.343 | U37: =(RC[-17]*RC[-16]-RC[-14]*RC[-13])/1000 -> 2.1589956000000003 | V37: 35.83 | W37: 21.86 | X37: =RC[-2]*RC[-10]/1000 -> 2.2110693000000001 | Y37: =(RC[-3]*RC[-11]-RC[-2]*RC[-9])/1000 -> 1.1799331000000002 | Z37: 2013-12-16T00:00:00.000 | AA37: 2013-12-14T00:00:00.000 | AD37: =VALUE(RC[-28]) -> 2018-10-16T00:00:00.000 | AE37: =IF(RC[22]=42,"*",IF(RC[22]=32,"",RC[22])) -> - | AF37: =RC[-29] -> 24 | AG37: =RC[-29] -> 204.05 | AH37: =RC[-29] -> 48.86 | AI37: =RC[-29] -> 7.53 | AJ37: =RC[-29] -> 203.78 | AK37: =RC[-29] -> 38.33 | AL37: =RC[-29] -> 5.43 | AM37: =RC[-29] -> 10.530000000000001 | AN37: =RC[-29] -> 0.27 | AO37: =RC[-29] -> 2.1640000000000001 | AP37: =RC[-29] -> 36.46 | AQ37: =RC[-29] -> 61.71 | AR37: - | AS37: =RC[-30] -> 22.1 | AT37: =RC[-30] -> 47.17 | AU37: - | AV37: =RC[-31] -> 14.54 | AW37: =RC[-31] -> 14.36 | AX37: =RC[-31] -> 1.179 | AY37: =RC[-31] -> 3.343 | BA37: - | BB37: - | BC37: -
A38: =IF(RC[1]="","",DATEVALUE(RC[1])) -> 43390 | B38: 17.10.18 | C38: 24 | D38: 204.96 | E38: 49.85 | F38: 7.53 | G38: 205.11 | H38: 39.36 | I38: 5.43 | J38: =RC[-5]-RC[-2] -> 10.490000000000002 | K38: -0.15 | L38: 2.1930000000000001 | M38: 35.75 | N38: 61.83 | O38: 22.73 | P38: 47.34 | Q38: =RC[-3]-RC[-1] -> 14.489999999999995 | R38: 13.02 | S38: 1.107 | T38: =RC[-8]+RC[-1] -> 3.3 | U38: =(RC[-17]*RC[-16]-RC[-14]*RC[-13])/1000 -> 2.1441264000000011 | V38: 35.130000000000003 | W38: 22.49 | X38: =RC[-2]*RC[-10]/1000 -> 2.1720879000000002 | Y38: =(RC[-3]*RC[-11]-RC[-2]*RC[-9])/1000 -> 1.1074112999999999 | Z38: 2013-12-17T00:00:00.000 | AA38: 2013-12-15T00:00:00.000 | AD38: =VALUE(RC[-28]) -> 2018-10-17T00:00:00.000 | AE38: =IF(RC[22]=42,"*",IF(RC[22]=32,"",RC[22])) -> - | AF38: =RC[-29] -> 24 | AG38: =RC[-29] -> 204.96 | AH38: =RC[-29] -> 49.85 | AI38: =RC[-29] -> 7.53 | AJ38: =RC[-29] -> 205.11 | AK38: =RC[-29] -> 39.36 | AL38: =RC[-29] -> 5.43 | AM38: =RC[-29] -> 10.490000000000002 | AN38: =RC[-29] -> -0.15 | AO38: =RC[-29] -> 2.1930000000000001 | AP38: =RC[-29] -> 35.75 | AQ38: =RC[-29] -> 61.83 | AR38: - | AS38: =RC[-30] -> 22.73 | AT38: =RC[-30] -> 47.34 | AU38: - | AV38: =RC[-31] -> 14.489999999999995 | AW38: =RC[-31] -> 13.02 | AX38: =RC[-31] -> 1.107 | AY38: =RC[-31] -> 3.3 | BA38: - | BB38: - | BC38: -
A39: =IF(RC[1]="","",DATEVALUE(RC[1])) -> 43391 | B39: 18.10.18 | C39: 24 | D39: 204.61 | E39: 50.1 | F39: 7.53 | G39: 202.77 | H39: 39.18 | I39: 5.43 | J39: =RC[-5]-RC[-2] -> 10.920000000000002 | K39: 1.84 | L39: 2.3079999999999998 | M39: 35.57 | N39: 62.12 | O39: 22.67 | P39: 47.54 | Q39: =RC[-3]-RC[-1] -> 14.579999999999998 | R39: 12.9 | S39: 1.105 | T39: =RC[-8]+RC[-1] -> 3.4129999999999998 | U39: =(RC[-17]*RC[-16]-RC[-14]*RC[-13])/1000 -> 2.3064324000000007 | V39: 34.93 | W39: 22.43 | X39: =RC[-2]*RC[-10]/1000 -> 2.1698515999999999 | Y39: =(RC[-3]*RC[-11]-RC[-2]*RC[-9])/1000 -> 1.1035294 | Z39: 2013-12-18T00:00:00.000 | AA39: 2013-12-16T00:00:00.000 | AD39: =VALUE(RC[-28]) -> 2018-10-18T00:00:00.000 | AE39: =IF(RC[22]=42,"*",IF(RC[22]=32,"",RC[22])) -> - | AF39: =RC[-29] -> 24 | AG39: =RC[-29] -> 204.61 | AH39: =RC[-29] -> 50.1 | AI39: =RC[-29] -> 7.53 | AJ39: =RC[-29] -> 202.77 | AK39: =RC[-29] -> 39.18 | AL39: =RC[-29] -> 5.43 | AM39: =RC[-29] -> 10.920000000000002 | AN39: =RC[-29] -> 1.84 | AO39: =RC[-29] -> 2.3079999999999998 | AP39: =RC[-29] -> 35.57 | AQ39: =RC[-29] -> 62.12 | AR39: - | AS39: =RC[-30] -> 22.67 | AT39: =RC[-30] -> 47.54 | AU39: - | AV39: =RC[-31] -> 14.579999999999998 | AW39: =RC[-31] -> 12.9 | AX39: =RC[-31] -> 1.105 | AY39: =RC[-31] -> 3.4129999999999998 | BA39: - | BB39: - | BC39: -
A40: =IF(RC[1]="","",DATEVALUE(RC[1])) -> 43392 | B40: 19.10.18 | C40: 24 | D40: 204.68 | E40: 49.92 | F40: 7.53 | G40: 202.86 | H40: 38.729999999999997 | I40: 5.43 | J40: =RC[-5]-RC[-2] -> 11.190000000000005 | K40: 1.82 | L40: 2.3620000000000001 | M40: 35.659999999999997 | N40: 62.09 | O40: 22.53 | P40: 47.24 | Q40: =RC[-3]-RC[-1] -> 14.850000000000001 | R40: 13.13 | S40: 1.123 | T40: =RC[-8]+RC[-1] -> 3.4850000000000003 | U40: =(RC[-17]*RC[-16]-RC[-14]*RC[-13])/1000 -> 2.3608578000000016 | V40: 35.03 | W40: 22.29 | X40: =RC[-2]*RC[-10]/1000 -> 2.1750127000000004 | Y40: =(RC[-3]*RC[-11]-RC[-2]*RC[-9])/1000 -> 1.1220331000000003 | Z40: 2013-12-19T00:00:00.000 | AA40: 2013-12-17T00:00:00.000 | AD40: =VALUE(RC[-28]) -> 2018-10-19T00:00:00.000 | AE40: =IF(RC[22]=42,"*",IF(RC[22]=32,"",RC[22])) -> - | AF40: =RC[-29] -> 24 | AG40: =RC[-29] -> 204.68 | AH40: =RC[-29] -> 49.92 | AI40: =RC[-29] -> 7.53 | AJ40: =RC[-29] -> 202.86 | AK40: =RC[-29] -> 38.729999999999997 | AL40: =RC[-29] -> 5.43 | AM40: =RC[-29] -> 11.190000000000005 | AN40: =RC[-29] -> 1.82 | AO40: =RC[-29] -> 2.3620000000000001 | AP40: =RC[-29] -> 35.659999999999997 | AQ40: =RC[-29] -> 62.09 | AR40: - | AS40: =RC[-30] -> 22.53 | AT40: =RC[-30] -> 47.24 | AU40: - | AV40: =RC[-31] -> 14.850000000000001 | AW40: =RC[-31] -> 13.13 | AX40: =RC[-31] -> 1.123 | AY40: =RC[-31] -> 3.4850000000000003 | BA40: - | BB40: - | BC40: -
A41: =IF(RC[1]="","",DATEVALUE(RC[1])) -> 43393 | B41: 20.10.18 | C41: 24 | D41: 204.43 | E41: 50.17 | F41: 7.53 | G41: 202.86 | H41: 38.69 | I41: 5.43 | J41: =RC[-5]-RC[-2] -> 11.480000000000004 | K41: 1.57 | L41: 2.41 | M41: 34 | N41: 61.45 | O41: 22.72 | P41: 46.7 | Q41: =RC[-3]-RC[-1] -> 14.75 | R41: 11.28 | S41: 1.002 | T41: =RC[-8]+RC[-1] -> 3.4119999999999999 | U41: =(RC[-17]*RC[-16]-RC[-14]*RC[-13])/1000 -> 2.4075996999999996 | V41: 33.39 | W41: 22.48 | X41: =RC[-2]*RC[-10]/1000 -> 2.0518155 | Y41: =(RC[-3]*RC[-11]-RC[-2]*RC[-9])/1000 -> 1.0019995000000002 | Z41: 2013-12-20T00:00:00.000 | AA41: 2013-12-18T00:00:00.000 | AD41: =VALUE(RC[-28]) -> 2018-10-20T00:00:00.000 | AE41: =IF(RC[22]=42,"*",IF(RC[22]=32,"",RC[22])) -> - | AF41: =RC[-29] -> 24 | AG41: =RC[-29] -> 204.43 | AH41: =RC[-29] -> 50.17 | AI41: =RC[-29] -> 7.53 | AJ41: =RC[-29] -> 202.86 | AK41: =RC[-29] -> 38.69 | AL41: =RC[-29] -> 5.43 | AM41: =RC[-29] -> 11.480000000000004 | AN41: =RC[-29] -> 1.57 | AO41: =RC[-29] -> 2.41 | AP41: =RC[-29] -> 34 | AQ41: =RC[-29] -> 61.45 | AR41: - | AS41: =RC[-30] -> 22.72 | AT41: =RC[-30] -> 46.7 | AU41: - | AV41: =RC[-31] -> 14.75 | AW41: =RC[-31] -> 11.28 | AX41: =RC[-31] -> 1.002 | AY41: =RC[-31] -> 3.4119999999999999 | BA41: - | BB41: - | BC41: -
A42: =IF(RC[1]="","",DATEVALUE(RC[1])) -> 43394 | B42: 21.10.18 | C42: 24 | D42: 204.44 | E42: 50.84 | F42: 7.53 | G42: 203.19 | H42: 39.1 | I42: 5.43 | J42: =RC[-5]-RC[-2] -> 11.740000000000002 | K42: 1.25 | L42: 2.4529999999999998 | M42: 37.83 | N42: 61.35 | O42: 21.58 | P42: 46.89 | Q42: =RC[-3]-RC[-1] -> 14.46 | R42: 16.25 | S42: 1.282 | T42: =RC[-8]+RC[-1] -> 3.7349999999999999 | U42: =(RC[-17]*RC[-16]-RC[-14]*RC[-13])/1000 -> 2.4490006000000002 | V42: 37.159999999999997 | W42: 21.34 | X42: =RC[-2]*RC[-10]/1000 -> 2.2797659999999995 | Y42: =(RC[-3]*RC[-11]-RC[-2]*RC[-9])/1000 -> 1.2791333999999996 | Z42: 2013-12-21T00:00:00.000 | AA42: 2013-12-19T00:00:00.000 | AD42: =VALUE(RC[-28]) -> 2018-10-21T00:00:00.000 | AE42: =IF(RC[22]=42,"*",IF(RC[22]=32,"",RC[22])) -> - | AF42: =RC[-29] -> 24 | AG42: =RC[-29] -> 204.44 | AH42: =RC[-29] -> 50.84 | AI42: =RC[-29] -> 7.53 | AJ42: =RC[-29] -> 203.19 | AK42: =RC[-29] -> 39.1 | AL42: =RC[-29] -> 5.43 | AM42: =RC[-29] -> 11.740000000000002 | AN42: =RC[-29] -> 1.25 | AO42: =RC[-29] -> 2.4529999999999998 | AP42: =RC[-29] -> 37.83 | AQ42: =RC[-29] -> 61.35 | AR42: - | AS42: =RC[-30] -> 21.58 | AT42: =RC[-30] -> 46.89 | AU42: - | AV42: =RC[-31] -> 14.46 | AW42: =RC[-31] -> 16.25 | AX42: =RC[-31] -> 1.282 | AY42: =RC[-31] -> 3.7349999999999999 | BA42: - | BB42: - | BC42: -
A43: =IF(RC[1]="","",DATEVALUE(RC[1])) -> 43395 | B43: 22.10.18 | C43: 24 | D43: 205.03 | E43: 52.09 | F43: 7.53 | G43: 203.97 | H43: 39.74 | I43: 5.43 | J43: =RC[-5]-RC[-2] -> 12.350000000000001 | K43: 1.06 | L43: 2.5779999999999998 | M43: 36.06 | N43: 61.3 | O43: 21.93 | P43: 46.69 | Q43: =RC[-3]-RC[-1] -> 14.61 | R43: 14.13 | S43: 1.159 | T43: =RC[-8]+RC[-1] -> 3.7370000000000001 | U43: =(RC[-17]*RC[-16]-RC[-14]*RC[-13])/1000 -> 2.5742449000000005 | V43: 35.44 | W43: 21.69 | X43: =RC[-2]*RC[-10]/1000 -> 2.172472 | Y43: =(RC[-3]*RC[-11]-RC[-2]*RC[-9])/1000 -> 1.1597658999999998 | Z43: 2013-12-22T00:00:00.000 | AA43: 2013-12-20T00:00:00.000 | AD43: =VALUE(RC[-28]) -> 2018-10-22T00:00:00.000 | AE43: =IF(RC[22]=42,"*",IF(RC[22]=32,"",RC[22])) -> - | AF43: =RC[-29] -> 24 | AG43: =RC[-29] -> 205.03 | AH43: =RC[-29] -> 52.09 | AI43: =RC[-29] -> 7.53 | AJ43: =RC[-29] -> 203.97 | AK43: =RC[-29] -> 39.74 | AL43: =RC[-29] -> 5.43 | AM43: =RC[-29] -> 12.350000000000001 | AN43: =RC[-29] -> 1.06 | AO43: =RC[-29] -> 2.5779999999999998 | AP43: =RC[-29] -> 36.06 | AQ43: =RC[-29] -> 61.3 | AR43: - | AS43: =RC[-30] -> 21.93 | AT43: =RC[-30] -> 46.69 | AU43: - | AV43: =RC[-31] -> 14.61 | AW43: =RC[-31] -> 14.13 | AX43: =RC[-31] -> 1.159 | AY43: =RC[-31] -> 3.7370000000000001 | BA43: - | BB43: - | BC43: -
A44: =IF(RC[1]="","",DATEVALUE(RC[1])) ->  | C44: 24 | J44: =RC[-5]-RC[-2] -> #VALUE! | Q44: =RC[-3]-RC[-1] -> #VALUE! | T44: =RC[-8]+RC[-1] -> #VALUE! | U44: =(RC[-17]*RC[-16]-RC[-14]*RC[-13])/1000 -> #VALUE! | X44: =RC[-2]*RC[-10]/1000 -> #VALUE! | Y44: =(RC[-3]*RC[-11]-RC[-2]*RC[-9])/1000 -> #VALUE! | AD44: =VALUE(RC[-28]) -> #VALUE! | AE44: =IF(RC[22]=42,"*",IF(RC[22]=32,"",RC[22])) ->  | AF44: =RC[-29] -> 24 | AG44: =RC[-29] ->  | AH44: =RC[-29] ->  | AI44: =RC[-29] ->  | AJ44: =RC[-29] ->  | AK44: =RC[-29] ->  | AL44: =RC[-29] ->  | AM44: =RC[-29] -> #VALUE! | AN44: =RC[-29] ->  | AO44: =RC[-29] ->  | AP44: =RC[-29] ->  | AQ44: =RC[-29] ->  | AR44: - | AS44: =RC[-30] ->  | AT44: =RC[-30] ->  | AU44: - | AV44: =RC[-31] -> #VALUE! | AW44: =RC[-31] ->  | AX44: =RC[-31] ->  | AY44: =RC[-31] -> #VALUE!
A45: =IF(RC[1]="","",DATEVALUE(RC[1])) ->  | C45: 24 | J45: =RC[-5]-RC[-2] -> #VALUE! | Q45: =RC[-3]-RC[-1] -> #VALUE! | T45: =RC[-8]+RC[-1] -> #VALUE! | U45: =(RC[-17]*RC[-16]-RC[-14]*RC[-13])/1000 -> #VALUE! | X45: =RC[-2]*RC[-10]/1000 -> #VALUE! | Y45: =(RC[-3]*RC[-11]-RC[-2]*RC[-9])/1000 -> #VALUE! | AD45: =VALUE(RC[-28]) -> #VALUE! | AE45: =IF(RC[22]=42,"*",IF(RC[22]=32,"",RC[22])) ->  | AF45: =RC[-29] -> 24 | AG45: =RC[-29] ->  | AH45: =RC[-29] ->  | AI45: =RC[-29] ->  | AJ45: =RC[-29] ->  | AK45: =RC[-29] ->  | AL45: =RC[-29] ->  | AM45: =RC[-29] -> #VALUE! | AN45: =RC[-29] ->  | AO45: =RC[-29] ->  | AP45: =RC[-29] ->  | AQ45: =RC[-29] ->  | AR45: - | AS45: =RC[-30] ->  | AT45: =RC[-30] ->  | AU45: - | AV45: =RC[-31] -> #VALUE! | AW45: =RC[-31] ->  | AX45: =RC[-31] ->  | AY45: =RC[-31] -> #VALUE!
A46: =IF(RC[1]="","",DATEVALUE(RC[1])) ->  | C46: 24 | J46: =RC[-5]-RC[-2] -> #VALUE! | Q46: =RC[-3]-RC[-1] -> #VALUE! | T46: =RC[-8]+RC[-1] -> #VALUE! | U46: =(RC[-17]*RC[-16]-RC[-14]*RC[-13])/1000 -> #VALUE! | X46: =RC[-2]*RC[-10]/1000 -> #VALUE! | Y46: =(RC[-3]*RC[-11]-RC[-2]*RC[-9])/1000 -> #VALUE! | AD46: =VALUE(RC[-28]) -> #VALUE! | AE46: =IF(RC[22]=42,"*",IF(RC[22]=32,"",RC[22])) ->  | AF46: =RC[-29] -> 24 | AG46: =RC[-29] ->  | AH46: =RC[-29] ->  | AI46: =RC[-29] ->  | AJ46: =RC[-29] ->  | AK46: =RC[-29] ->  | AL46: =RC[-29] ->  | AM46: =RC[-29] -> #VALUE! | AN46: =RC[-29] ->  | AO46: =RC[-29] ->  | AP46: =RC[-29] ->  | AQ46: =RC[-29] ->  | AR46: - | AS46: =RC[-30] ->  | AT46: =RC[-30] ->  | AU46: - | AV46: =RC[-31] -> #VALUE! | AW46: =RC[-31] ->  | AX46: =RC[-31] ->  | AY46: =RC[-31] -> #VALUE!
A47: =IF(RC[1]="","",DATEVALUE(RC[1])) ->  | C47: 24 | J47: =RC[-5]-RC[-2] -> #VALUE! | Q47: =RC[-3]-RC[-1] -> #VALUE! | T47: =RC[-8]+RC[-1] -> #VALUE! | U47: =(RC[-17]*RC[-16]-RC[-14]*RC[-13])/1000 -> #VALUE! | X47: =RC[-2]*RC[-10]/1000 -> #VALUE! | Y47: =(RC[-3]*RC[-11]-RC[-2]*RC[-9])/1000 -> #VALUE! | AD47: =VALUE(RC[-28]) -> #VALUE! | AE47: =IF(RC[22]=42,"*",IF(RC[22]=32,"",RC[22])) ->  | AF47: =RC[-29] -> 24 | AG47: =RC[-29] ->  | AH47: =RC[-29] ->  | AI47: =RC[-29] ->  | AJ47: =RC[-29] ->  | AK47: =RC[-29] ->  | AL47: =RC[-29] ->  | AM47: =RC[-29] -> #VALUE! | AN47: =RC[-29] ->  | AO47: =RC[-29] ->  | AP47: =RC[-29] ->  | AQ47: =RC[-29] ->  | AR47: - | AS47: =RC[-30] ->  | AT47: =RC[-30] ->  | AU47: - | AV47: =RC[-31] -> #VALUE! | AW47: =RC[-31] ->  | AX47: =RC[-31] ->  | AY47: =RC[-31] -> #VALUE!
A48: =IF(RC[1]="","",DATEVALUE(RC[1])) ->  | C48: 24 | J48: =RC[-5]-RC[-2] -> #VALUE! | Q48: =RC[-3]-RC[-1] -> #VALUE! | T48: =RC[-8]+RC[-1] -> #VALUE! | U48: =(RC[-17]*RC[-16]-RC[-14]*RC[-13])/1000 -> #VALUE! | X48: =RC[-2]*RC[-10]/1000 -> #VALUE! | Y48: =(RC[-3]*RC[-11]-RC[-2]*RC[-9])/1000 -> #VALUE! | AD48: =VALUE(RC[-28]) -> #VALUE! | AE48: =IF(RC[22]=42,"*",IF(RC[22]=32,"",RC[22])) ->  | AF48: =RC[-29] -> 24 | AG48: =RC[-29] ->  | AH48: =RC[-29] ->  | AI48: =RC[-29] ->  | AJ48: =RC[-29] ->  | AK48: =RC[-29] ->  | AL48: =RC[-29] ->  | AM48: =RC[-29] -> #VALUE! | AN48: =RC[-29] ->  | AO48: =RC[-29] ->  | AP48: =RC[-29] ->  | AQ48: =RC[-29] ->  | AR48: - | AS48: =RC[-30] ->  | AT48: =RC[-30] ->  | AU48: - | AV48: =RC[-31] -> #VALUE! | AW48: =RC[-31] ->  | AX48: =RC[-31] ->  | AY48: =RC[-31] -> #VALUE!
A49: =IF(RC[1]="","",DATEVALUE(RC[1])) ->  | C49: 24 | J49: =RC[-5]-RC[-2] -> #VALUE! | Q49: =RC[-3]-RC[-1] -> #VALUE! | T49: =RC[-8]+RC[-1] -> #VALUE! | U49: =(RC[-17]*RC[-16]-RC[-14]*RC[-13])/1000 -> #VALUE! | X49: =RC[-2]*RC[-10]/1000 -> #VALUE! | Y49: =(RC[-3]*RC[-11]-RC[-2]*RC[-9])/1000 -> #VALUE! | AD49: =VALUE(RC[-28]) -> #VALUE! | AE49: =IF(RC[22]=42,"*",IF(RC[22]=32,"",RC[22])) ->  | AF49: =RC[-29] -> 24 | AG49: =RC[-29] ->  | AH49: =RC[-29] ->  | AI49: =RC[-29] ->  | AJ49: =RC[-29] ->  | AK49: =RC[-29] ->  | AL49: =RC[-29] ->  | AM49: =RC[-29] -> #VALUE! | AN49: =RC[-29] ->  | AO49: =RC[-29] ->  | AP49: =RC[-29] ->  | AQ49: =RC[-29] ->  | AR49: - | AS49: =RC[-30] ->  | AT49: =RC[-30] ->  | AU49: - | AV49: =RC[-31] -> #VALUE! | AW49: =RC[-31] ->  | AX49: =RC[-31] ->  | AY49: =RC[-31] -> #VALUE!
A50: =IF(RC[1]="","",DATEVALUE(RC[1])) ->  | C50: 24 | J50: =RC[-5]-RC[-2] -> #VALUE! | Q50: =RC[-3]-RC[-1] -> #VALUE! | T50: =RC[-8]+RC[-1] -> #VALUE! | U50: =(RC[-17]*RC[-16]-RC[-14]*RC[-13])/1000 -> #VALUE! | X50: =RC[-2]*RC[-10]/1000 -> #VALUE! | Y50: =(RC[-3]*RC[-11]-RC[-2]*RC[-9])/1000 -> #VALUE! | AD50: =VALUE(RC[-28]) -> #VALUE! | AE50: =IF(RC[22]=42,"*",IF(RC[22]=32,"",RC[22])) ->  | AF50: =RC[-29] -> 24 | AG50: =RC[-29] ->  | AH50: =RC[-29] ->  | AI50: =RC[-29] ->  | AJ50: =RC[-29] ->  | AK50: =RC[-29] ->  | AL50: =RC[-29] ->  | AM50: =RC[-29] -> #VALUE! | AN50: =RC[-29] ->  | AO50: =RC[-29] ->  | AP50: =RC[-29] ->  | AQ50: =RC[-29] ->  | AR50: - | AS50: =RC[-30] ->  | AT50: =RC[-30] ->  | AU50: - | AV50: =RC[-31] -> #VALUE! | AW50: =RC[-31] ->  | AX50: =RC[-31] ->  | AY50: =RC[-31] -> #VALUE!
A51: =IF(RC[1]="","",DATEVALUE(RC[1])) ->  | C51: 24 | J51: =RC[-5]-RC[-2] -> #VALUE! | Q51: =RC[-3]-RC[-1] -> #VALUE! | T51: =RC[-8]+RC[-1] -> #VALUE! | U51: =(RC[-17]*RC[-16]-RC[-14]*RC[-13])/1000 -> #VALUE! | X51: =RC[-2]*RC[-10]/1000 -> #VALUE! | Y51: =(RC[-3]*RC[-11]-RC[-2]*RC[-9])/1000 -> #VALUE! | AD51: =VALUE(RC[-28]) -> #VALUE! | AE51: =IF(RC[22]=42,"*",IF(RC[22]=32,"",RC[22])) ->  | AF51: =RC[-29] -> 24 | AG51: =RC[-29] ->  | AH51: =RC[-29] ->  | AI51: =RC[-29] ->  | AJ51: =RC[-29] ->  | AK51: =RC[-29] ->  | AL51: =RC[-29] ->  | AM51: =RC[-29] -> #VALUE! | AN51: =RC[-29] ->  | AO51: =RC[-29] ->  | AP51: =RC[-29] ->  | AQ51: =RC[-29] ->  | AR51: - | AS51: =RC[-30] ->  | AT51: =RC[-30] ->  | AU51: - | AV51: =RC[-31] -> #VALUE! | AW51: =RC[-31] ->  | AX51: =RC[-31] ->  | AY51: =RC[-31] -> #VALUE!
A52: =IF(RC[1]="","",DATEVALUE(RC[1])) ->  | C52: 24 | J52: =RC[-5]-RC[-2] -> #VALUE! | Q52: =RC[-3]-RC[-1] -> #VALUE! | T52: =RC[-8]+RC[-1] -> #VALUE! | U52: =(RC[-17]*RC[-16]-RC[-14]*RC[-13])/1000 -> #VALUE! | X52: =RC[-2]*RC[-10]/1000 -> #VALUE! | Y52: =(RC[-3]*RC[-11]-RC[-2]*RC[-9])/1000 -> #VALUE! | AD52: =VALUE(RC[-28]) -> #VALUE! | AE52: =IF(RC[22]=42,"*",IF(RC[22]=32,"",RC[22])) ->  | AF52: =RC[-29] -> 24 | AG52: =RC[-29] ->  | AH52: =RC[-29] ->  | AI52: =RC[-29] ->  | AJ52: =RC[-29] ->  | AK52: =RC[-29] ->  | AL52: =RC[-29] ->  | AM52: =RC[-29] -> #VALUE! | AN52: =RC[-29] ->  | AO52: =RC[-29] ->  | AP52: =RC[-29] ->  | AQ52: =RC[-29] ->  | AR52: - | AS52: =RC[-30] ->  | AT52: =RC[-30] ->  | AU52: - | AV52: =RC[-31] -> #VALUE! | AW52: =RC[-31] ->  | AX52: =RC[-31] ->  | AY52: =RC[-31] -> #VALUE!
A53: =IF(RC[1]="","",DATEVALUE(RC[1])) ->  | C53: 24 | J53: =RC[-5]-RC[-2] -> #VALUE! | Q53: =RC[-3]-RC[-1] -> #VALUE! | T53: =RC[-8]+RC[-1] -> #VALUE! | U53: =(RC[-17]*RC[-16]-RC[-14]*RC[-13])/1000 -> #VALUE! | X53: =RC[-2]*RC[-10]/1000 -> #VALUE! | Y53: =(RC[-3]*RC[-11]-RC[-2]*RC[-9])/1000 -> #VALUE! | AD53: =VALUE(RC[-28]) -> #VALUE! | AE53: =IF(RC[22]=42,"*",IF(RC[22]=32,"",RC[22])) ->  | AF53: =RC[-29] -> 24 | AG53: =RC[-29] ->  | AH53: =RC[-29] ->  | AI53: =RC[-29] ->  | AJ53: =RC[-29] ->  | AK53: =RC[-29] ->  | AL53: =RC[-29] ->  | AM53: =RC[-29] -> #VALUE! | AN53: =RC[-29] ->  | AO53: =RC[-29] ->  | AP53: =RC[-29] ->  | AQ53: =RC[-29] ->  | AR53: - | AS53: =RC[-30] ->  | AT53: =RC[-30] ->  | AU53: - | AV53: =RC[-31] -> #VALUE! | AW53: =RC[-31] ->  | AX53: =RC[-31] ->  | AY53: =RC[-31] -> #VALUE!
A54: =IF(RC[1]="","",DATEVALUE(RC[1])) ->  | C54: 24 | J54: =RC[-5]-RC[-2] -> #VALUE! | Q54: =RC[-3]-RC[-1] -> #VALUE! | T54: =RC[-8]+RC[-1] -> #VALUE! | U54: =(RC[-17]*RC[-16]-RC[-14]*RC[-13])/1000 -> #VALUE! | X54: =RC[-2]*RC[-10]/1000 -> #VALUE! | Y54: =(RC[-3]*RC[-11]-RC[-2]*RC[-9])/1000 -> #VALUE! | AD54: =VALUE(RC[-28]) -> #VALUE! | AE54: =IF(RC[22]=42,"*",IF(RC[22]=32,"",RC[22])) ->  | AF54: =RC[-29] -> 24 | AG54: =RC[-29] ->  | AH54: =RC[-29] ->  | AI54: =RC[-29] ->  | AJ54: =RC[-29] ->  | AK54: =RC[-29] ->  | AL54: =RC[-29] ->  | AM54: =RC[-29] -> #VALUE! | AN54: =RC[-29] ->  | AO54: =RC[-29] ->  | AP54: =RC[-29] ->  | AQ54: =RC[-29] ->  | AR54: - | AS54: =RC[-30] ->  | AT54: =RC[-30] ->  | AU54: - | AV54: =RC[-31] -> #VALUE! | AW54: =RC[-31] ->  | AX54: =RC[-31] ->  | AY54: =RC[-31] -> #VALUE!
A55: =IF(RC[1]="","",DATEVALUE(RC[1])) ->  | C55: 24 | J55: =RC[-5]-RC[-2] -> #VALUE! | Q55: =RC[-3]-RC[-1] -> #VALUE! | T55: =RC[-8]+RC[-1] -> #VALUE! | U55: =(RC[-17]*RC[-16]-RC[-14]*RC[-13])/1000 -> #VALUE! | X55: =RC[-2]*RC[-10]/1000 -> #VALUE! | Y55: =(RC[-3]*RC[-11]-RC[-2]*RC[-9])/1000 -> #VALUE! | AD55: =VALUE(RC[-28]) -> #VALUE! | AE55: =IF(RC[22]=42,"*",IF(RC[22]=32,"",RC[22])) ->  | AF55: =RC[-29] -> 24 | AG55: =RC[-29] ->  | AH55: =RC[-29] ->  | AI55: =RC[-29] ->  | AJ55: =RC[-29] ->  | AK55: =RC[-29] ->  | AL55: =RC[-29] ->  | AM55: =RC[-29] -> #VALUE! | AN55: =RC[-29] ->  | AO55: =RC[-29] ->  | AP55: =RC[-29] ->  | AQ55: =RC[-29] ->  | AR55: - | AS55: =RC[-30] ->  | AT55: =RC[-30] ->  | AU55: - | AV55: =RC[-31] -> #VALUE! | AW55: =RC[-31] ->  | AX55: =RC[-31] ->  | AY55: =RC[-31] -> #VALUE!
A56: =IF(RC[1]="","",DATEVALUE(RC[1])) ->  | C56: 24 | J56: =RC[-5]-RC[-2] -> #VALUE! | Q56: =RC[-3]-RC[-1] -> #VALUE! | T56: =RC[-8]+RC[-1] -> #VALUE! | U56: =(RC[-17]*RC[-16]-RC[-14]*RC[-13])/1000 -> #VALUE! | X56: =RC[-2]*RC[-10]/1000 -> #VALUE! | Y56: =(RC[-3]*RC[-11]-RC[-2]*RC[-9])/1000 -> #VALUE! | AD56: =VALUE(RC[-28]) -> #VALUE! | AE56: =IF(RC[22]=42,"*",IF(RC[22]=32,"",RC[22])) ->  | AF56: =RC[-29] -> 24 | AG56: =RC[-29] ->  | AH56: =RC[-29] ->  | AI56: =RC[-29] ->  | AJ56: =RC[-29] ->  | AK56: =RC[-29] ->  | AL56: =RC[-29] ->  | AM56: =RC[-29] -> #VALUE! | AN56: =RC[-29] ->  | AO56: =RC[-29] ->  | AP56: =RC[-29] ->  | AQ56: =RC[-29] ->  | AR56: - | AS56: =RC[-30] ->  | AT56: =RC[-30] ->  | AU56: - | AV56: =RC[-31] -> #VALUE! | AW56: =RC[-31] ->  | AX56: =RC[-31] ->  | AY56: =RC[-31] -> #VALUE!
A57: =IF(RC[1]="","",DATEVALUE(RC[1])) ->  | C57: 24 | J57: =RC[-5]-RC[-2] -> #VALUE! | Q57: =RC[-3]-RC[-1] -> #VALUE! | T57: =RC[-8]+RC[-1] -> #VALUE! | U57: =(RC[-17]*RC[-16]-RC[-14]*RC[-13])/1000 -> #VALUE! | X57: =RC[-2]*RC[-10]/1000 -> #VALUE! | Y57: =(RC[-3]*RC[-11]-RC[-2]*RC[-9])/1000 -> #VALUE! | AD57: =VALUE(RC[-28]) -> #VALUE! | AE57: =IF(RC[22]=42,"*",IF(RC[22]=32,"",RC[22])) ->  | AF57: =RC[-29] -> 24 | AG57: =RC[-29] ->  | AH57: =RC[-29] ->  | AI57: =RC[-29] ->  | AJ57: =RC[-29] ->  | AK57: =RC[-29] ->  | AL57: =RC[-29] ->  | AM57: =RC[-29] -> #VALUE! | AN57: =RC[-29] ->  | AO57: =RC[-29] ->  | AP57: =RC[-29] ->  | AQ57: =RC[-29] ->  | AR57: - | AS57: =RC[-30] ->  | AT57: =RC[-30] ->  | AU57: - | AV57: =RC[-31] -> #VALUE! | AW57: =RC[-31] ->  | AX57: =RC[-31] ->  | AY57: =RC[-31] -> #VALUE!
A58: =IF(RC[1]="","",DATEVALUE(RC[1])) ->  | C58: 24 | J58: =RC[-5]-RC[-2] -> #VALUE! | Q58: =RC[-3]-RC[-1] -> #VALUE! | T58: =RC[-8]+RC[-1] -> #VALUE! | U58: =(RC[-17]*RC[-16]-RC[-14]*RC[-13])/1000 -> #VALUE! | X58: =RC[-2]*RC[-10]/1000 -> #VALUE! | Y58: =(RC[-3]*RC[-11]-RC[-2]*RC[-9])/1000 -> #VALUE! | AD58: =VALUE(RC[-28]) -> #VALUE! | AE58: =IF(RC[22]=42,"*",IF(RC[22]=32,"",RC[22])) ->  | AF58: =RC[-29] -> 24 | AG58: =RC[-29] ->  | AH58: =RC[-29] ->  | AI58: =RC[-29] ->  | AJ58: =RC[-29] ->  | AK58: =RC[-29] ->  | AL58: =RC[-29] ->  | AM58: =RC[-29] -> #VALUE! | AN58: =RC[-29] ->  | AO58: =RC[-29] ->  | AP58: =RC[-29] ->  | AQ58: =RC[-29] ->  | AR58: - | AS58: =RC[-30] ->  | AT58: =RC[-30] ->  | AU58: - | AV58: =RC[-31] -> #VALUE! | AW58: =RC[-31] ->  | AX58: =RC[-31] ->  | AY58: =RC[-31] -> #VALUE!
A59: =IF(RC[1]="","",DATEVALUE(RC[1])) ->  | C59: 24 | J59: =RC[-5]-RC[-2] -> #VALUE! | Q59: =RC[-3]-RC[-1] -> #VALUE! | T59: =RC[-8]+RC[-1] -> #VALUE! | U59: =(RC[-17]*RC[-16]-RC[-14]*RC[-13])/1000 -> #VALUE! | X59: =RC[-2]*RC[-10]/1000 -> #VALUE! | Y59: =(RC[-3]*RC[-11]-RC[-2]*RC[-9])/1000 -> #VALUE! | AD59: =VALUE(RC[-28]) -> #VALUE! | AE59: =IF(RC[22]=42,"*",IF(RC[22]=32,"",RC[22])) ->  | AF59: =RC[-29] -> 24 | AG59: =RC[-29] ->  | AH59: =RC[-29] ->  | AI59: =RC[-29] ->  | AJ59: =RC[-29] ->  | AK59: =RC[-29] ->  | AL59: =RC[-29] ->  | AM59: =RC[-29] -> #VALUE! | AN59: =RC[-29] ->  | AO59: =RC[-29] ->  | AP59: =RC[-29] ->  | AQ59: =RC[-29] ->  | AR59: - | AS59: =RC[-30] ->  | AT59: =RC[-30] ->  | AU59: - | AV59: =RC[-31] -> #VALUE! | AW59: =RC[-31] ->  | AX59: =RC[-31] ->  | AY59: =RC[-31] -> #VALUE!
A60: =IF(RC[1]="","",DATEVALUE(RC[1])) ->  | C60: 24 | J60: =RC[-5]-RC[-2] -> #VALUE! | Q60: =RC[-3]-RC[-1] -> #VALUE! | T60: =RC[-8]+RC[-1] -> #VALUE! | U60: =(RC[-17]*RC[-16]-RC[-14]*RC[-13])/1000 -> #VALUE! | X60: =RC[-2]*RC[-10]/1000 -> #VALUE! | Y60: =(RC[-3]*RC[-11]-RC[-2]*RC[-9])/1000 -> #VALUE! | AD60: =VALUE(RC[-28]) -> #VALUE! | AE60: =IF(RC[22]=42,"*",IF(RC[22]=32,"",RC[22])) ->  | AF60: =RC[-29] -> 24 | AG60: =RC[-29] ->  | AH60: =RC[-29] ->  | AI60: =RC[-29] ->  | AJ60: =RC[-29] ->  | AK60: =RC[-29] ->  | AL60: =RC[-29] ->  | AM60: =RC[-29] -> #VALUE! | AN60: =RC[-29] ->  | AO60: =RC[-29] ->  | AP60: =RC[-29] ->  | AQ60: =RC[-29] ->  | AR60: - | AS60: =RC[-30] ->  | AT60: =RC[-30] ->  | AU60: - | AV60: =RC[-31] -> #VALUE! | AW60: =RC[-31] ->  | AX60: =RC[-31] ->  | AY60: =RC[-31] -> #VALUE!
A61: =IF(RC[1]="","",DATEVALUE(RC[1])) ->  | C61: 24 | J61: =RC[-5]-RC[-2] -> #VALUE! | Q61: =RC[-3]-RC[-1] -> #VALUE! | T61: =RC[-8]+RC[-1] -> #VALUE! | U61: =(RC[-17]*RC[-16]-RC[-14]*RC[-13])/1000 -> #VALUE! | X61: =RC[-2]*RC[-10]/1000 -> #VALUE! | Y61: =(RC[-3]*RC[-11]-RC[-2]*RC[-9])/1000 -> #VALUE! | AD61: =VALUE(RC[-28]) -> #VALUE! | AE61: =IF(RC[22]=42,"*",IF(RC[22]=32,"",RC[22])) ->  | AF61: =RC[-29] -> 24 | AG61: =RC[-29] ->  | AH61: =RC[-29] ->  | AI61: =RC[-29] ->  | AJ61: =RC[-29] ->  | AK61: =RC[-29] ->  | AL61: =RC[-29] ->  | AM61: =RC[-29] -> #VALUE! | AN61: =RC[-29] ->  | AO61: =RC[-29] ->  | AP61: =RC[-29] ->  | AQ61: =RC[-29] ->  | AR61: - | AS61: =RC[-30] ->  | AT61: =RC[-30] ->  | AU61: - | AV61: =RC[-31] -> #VALUE! | AW61: =RC[-31] ->  | AX61: =RC[-31] ->  | AY61: =RC[-31] -> #VALUE!
A62: =IF(RC[1]="","",DATEVALUE(RC[1])) ->  | C62: 24 | J62: =RC[-5]-RC[-2] -> #VALUE! | Q62: =RC[-3]-RC[-1] -> #VALUE! | T62: =RC[-8]+RC[-1] -> #VALUE! | U62: =(RC[-17]*RC[-16]-RC[-14]*RC[-13])/1000 -> #VALUE! | X62: =RC[-2]*RC[-10]/1000 -> #VALUE! | Y62: =(RC[-3]*RC[-11]-RC[-2]*RC[-9])/1000 -> #VALUE! | AD62: =VALUE(RC[-28]) -> #VALUE! | AE62: =IF(RC[22]=42,"*",IF(RC[22]=32,"",RC[22])) ->  | AF62: =RC[-29] -> 24 | AG62: =RC[-29] ->  | AH62: =RC[-29] ->  | AI62: =RC[-29] ->  | AJ62: =RC[-29] ->  | AK62: =RC[-29] ->  | AL62: =RC[-29] ->  | AM62: =RC[-29] -> #VALUE! | AN62: =RC[-29] ->  | AO62: =RC[-29] ->  | AP62: =RC[-29] ->  | AQ62: =RC[-29] ->  | AR62: - | AS62: =RC[-30] ->  | AT62: =RC[-30] ->  | AU62: - | AV62: =RC[-31] -> #VALUE! | AW62: =RC[-31] ->  | AX62: =RC[-31] ->  | AY62: =RC[-31] -> #VALUE!
A63: =IF(RC[1]="","",DATEVALUE(RC[1])) ->  | C63: 24 | J63: =RC[-5]-RC[-2] -> #VALUE! | Q63: =RC[-3]-RC[-1] -> #VALUE! | T63: =RC[-8]+RC[-1] -> #VALUE! | U63: =(RC[-17]*RC[-16]-RC[-14]*RC[-13])/1000 -> #VALUE! | X63: =RC[-2]*RC[-10]/1000 -> #VALUE! | Y63: =(RC[-3]*RC[-11]-RC[-2]*RC[-9])/1000 -> #VALUE! | AD63: =VALUE(RC[-28]) -> #VALUE! | AE63: =IF(RC[22]=42,"*",IF(RC[22]=32,"",RC[22])) ->  | AF63: =RC[-29] -> 24 | AG63: =RC[-29] ->  | AH63: =RC[-29] ->  | AI63: =RC[-29] ->  | AJ63: =RC[-29] ->  | AK63: =RC[-29] ->  | AL63: =RC[-29] ->  | AM63: =RC[-29] -> #VALUE! | AN63: =RC[-29] ->  | AO63: =RC[-29] ->  | AP63: =RC[-29] ->  | AQ63: =RC[-29] ->  | AR63: - | AS63: =RC[-30] ->  | AT63: =RC[-30] ->  | AU63: - | AV63: =RC[-31] -> #VALUE! | AW63: =RC[-31] ->  | AX63: =RC[-31] ->  | AY63: =RC[-31] -> #VALUE!
A64: =IF(RC[1]="","",DATEVALUE(RC[1])) ->  | C64: 24 | J64: =RC[-5]-RC[-2] -> #VALUE! | Q64: =RC[-3]-RC[-1] -> #VALUE! | T64: =RC[-8]+RC[-1] -> #VALUE! | U64: =(RC[-17]*RC[-16]-RC[-14]*RC[-13])/1000 -> #VALUE! | X64: =RC[-2]*RC[-10]/1000 -> #VALUE! | Y64: =(RC[-3]*RC[-11]-RC[-2]*RC[-9])/1000 -> #VALUE! | AD64: =VALUE(RC[-28]) -> #VALUE! | AE64: =IF(RC[22]=42,"*",IF(RC[22]=32,"",RC[22])) ->  | AF64: =RC[-29] -> 24 | AG64: =RC[-29] ->  | AH64: =RC[-29] ->  | AI64: =RC[-29] ->  | AJ64: =RC[-29] ->  | AK64: =RC[-29] ->  | AL64: =RC[-29] ->  | AM64: =RC[-29] -> #VALUE! | AN64: =RC[-29] ->  | AO64: =RC[-29] ->  | AP64: =RC[-29] ->  | AQ64: =RC[-29] ->  | AR64: - | AS64: =RC[-30] ->  | AT64: =RC[-30] ->  | AU64: - | AV64: =RC[-31] -> #VALUE! | AW64: =RC[-31] ->  | AX64: =RC[-31] ->  | AY64: =RC[-31] -> #VALUE!
A65: =IF(RC[1]="","",DATEVALUE(RC[1])) ->  | C65: 24 | J65: =RC[-5]-RC[-2] -> #VALUE! | Q65: =RC[-3]-RC[-1] -> #VALUE! | T65: =RC[-8]+RC[-1] -> #VALUE! | U65: =(RC[-17]*RC[-16]-RC[-14]*RC[-13])/1000 -> #VALUE! | X65: =RC[-2]*RC[-10]/1000 -> #VALUE! | Y65: =(RC[-3]*RC[-11]-RC[-2]*RC[-9])/1000 -> #VALUE! | AD65: =VALUE(RC[-28]) -> #VALUE! | AE65: =IF(RC[22]=42,"*",IF(RC[22]=32,"",RC[22])) ->  | AF65: =RC[-29] -> 24 | AG65: =RC[-29] ->  | AH65: =RC[-29] ->  | AI65: =RC[-29] ->  | AJ65: =RC[-29] ->  | AK65: =RC[-29] ->  | AL65: =RC[-29] ->  | AM65: =RC[-29] -> #VALUE! | AN65: =RC[-29] ->  | AO65: =RC[-29] ->  | AP65: =RC[-29] ->  | AQ65: =RC[-29] ->  | AR65: - | AS65: =RC[-30] ->  | AT65: =RC[-30] ->  | AU65: - | AV65: =RC[-31] -> #VALUE! | AW65: =RC[-31] ->  | AX65: =RC[-31] ->  | AY65: =RC[-31] -> #VALUE!
A66: =IF(RC[1]="","",DATEVALUE(RC[1])) ->  | C66: 24 | J66: =RC[-5]-RC[-2] -> #VALUE! | Q66: =RC[-3]-RC[-1] -> #VALUE! | T66: =RC[-8]+RC[-1] -> #VALUE! | U66: =(RC[-17]*RC[-16]-RC[-14]*RC[-13])/1000 -> #VALUE! | X66: =RC[-2]*RC[-10]/1000 -> #VALUE! | Y66: =(RC[-3]*RC[-11]-RC[-2]*RC[-9])/1000 -> #VALUE! | AD66: =VALUE(RC[-28]) -> #VALUE! | AE66: =IF(RC[22]=42,"*",IF(RC[22]=32,"",RC[22])) ->  | AF66: =RC[-29] -> 24 | AG66: =RC[-29] ->  | AH66: =RC[-29] ->  | AI66: =RC[-29] ->  | AJ66: =RC[-29] ->  | AK66: =RC[-29] ->  | AL66: =RC[-29] ->  | AM66: =RC[-29] -> #VALUE! | AN66: =RC[-29] ->  | AO66: =RC[-29] ->  | AP66: =RC[-29] ->  | AQ66: =RC[-29] ->  | AR66: - | AS66: =RC[-30] ->  | AT66: =RC[-30] ->  | AU66: - | AV66: =RC[-31] -> #VALUE! | AW66: =RC[-31] ->  | AX66: =RC[-31] ->  | AY66: =RC[-31] -> #VALUE!
A67: =IF(RC[1]="","",DATEVALUE(RC[1])) ->  | C67: 24 | J67: =RC[-5]-RC[-2] -> #VALUE! | Q67: =RC[-3]-RC[-1] -> #VALUE! | T67: =RC[-8]+RC[-1] -> #VALUE! | U67: =(RC[-17]*RC[-16]-RC[-14]*RC[-13])/1000 -> #VALUE! | X67: =RC[-2]*RC[-10]/1000 -> #VALUE! | Y67: =(RC[-3]*RC[-11]-RC[-2]*RC[-9])/1000 -> #VALUE! | AD67: =VALUE(RC[-28]) -> #VALUE! | AE67: =IF(RC[22]=42,"*",IF(RC[22]=32,"",RC[22])) ->  | AF67: =RC[-29] -> 24 | AG67: =RC[-29] ->  | AH67: =RC[-29] ->  | AI67: =RC[-29] ->  | AJ67: =RC[-29] ->  | AK67: =RC[-29] ->  | AL67: =RC[-29] ->  | AM67: =RC[-29] -> #VALUE! | AN67: =RC[-29] ->  | AO67: =RC[-29] ->  | AP67: =RC[-29] ->  | AQ67: =RC[-29] ->  | AR67: - | AS67: =RC[-30] ->  | AT67: =RC[-30] ->  | AU67: - | AV67: =RC[-31] -> #VALUE! | AW67: =RC[-31] ->  | AX67: =RC[-31] ->  | AY67: =RC[-31] -> #VALUE!
A68: =IF(RC[1]="","",DATEVALUE(RC[1])) ->  | C68: 24 | J68: =RC[-5]-RC[-2] -> #VALUE! | Q68: =RC[-3]-RC[-1] -> #VALUE! | T68: =RC[-8]+RC[-1] -> #VALUE! | U68: =(RC[-17]*RC[-16]-RC[-14]*RC[-13])/1000 -> #VALUE! | X68: =RC[-2]*RC[-10]/1000 -> #VALUE! | Y68: =(RC[-3]*RC[-11]-RC[-2]*RC[-9])/1000 -> #VALUE! | AD68: =VALUE(RC[-28]) -> #VALUE! | AE68: =IF(RC[22]=42,"*",IF(RC[22]=32,"",RC[22])) ->  | AF68: =RC[-29] -> 24 | AG68: =RC[-29] ->  | AH68: =RC[-29] ->  | AI68: =RC[-29] ->  | AJ68: =RC[-29] ->  | AK68: =RC[-29] ->  | AL68: =RC[-29] ->  | AM68: =RC[-29] -> #VALUE! | AN68: =RC[-29] ->  | AO68: =RC[-29] ->  | AP68: =RC[-29] ->  | AQ68: =RC[-29] ->  | AR68: - | AS68: =RC[-30] ->  | AT68: =RC[-30] ->  | AU68: - | AV68: =RC[-31] -> #VALUE! | AW68: =RC[-31] ->  | AX68: =RC[-31] ->  | AY68: =RC[-31] -> #VALUE!
A69: =IF(RC[1]="","",DATEVALUE(RC[1])) ->  | C69: 24 | J69: =RC[-5]-RC[-2] -> #VALUE! | Q69: =RC[-3]-RC[-1] -> #VALUE! | T69: =RC[-8]+RC[-1] -> #VALUE! | U69: =(RC[-17]*RC[-16]-RC[-14]*RC[-13])/1000 -> #VALUE! | X69: =RC[-2]*RC[-10]/1000 -> #VALUE! | Y69: =(RC[-3]*RC[-11]-RC[-2]*RC[-9])/1000 -> #VALUE! | AD69: =VALUE(RC[-28]) -> #VALUE! | AE69: =IF(RC[22]=42,"*",IF(RC[22]=32,"",RC[22])) ->  | AF69: =RC[-29] -> 24 | AG69: =RC[-29] ->  | AH69: =RC[-29] ->  | AI69: =RC[-29] ->  | AJ69: =RC[-29] ->  | AK69: =RC[-29] ->  | AL69: =RC[-29] ->  | AM69: =RC[-29] -> #VALUE! | AN69: =RC[-29] ->  | AO69: =RC[-29] ->  | AP69: =RC[-29] ->  | AQ69: =RC[-29] ->  | AR69: - | AS69: =RC[-30] ->  | AT69: =RC[-30] ->  | AU69: - | AV69: =RC[-31] -> #VALUE! | AW69: =RC[-31] ->  | AX69: =RC[-31] ->  | AY69: =RC[-31] -> #VALUE!
A70: =IF(RC[1]="","",DATEVALUE(RC[1])) ->  | C70: 24 | J70: =RC[-5]-RC[-2] -> #VALUE! | Q70: =RC[-3]-RC[-1] -> #VALUE! | T70: =RC[-8]+RC[-1] -> #VALUE! | U70: =(RC[-17]*RC[-16]-RC[-14]*RC[-13])/1000 -> #VALUE! | X70: =RC[-2]*RC[-10]/1000 -> #VALUE! | Y70: =(RC[-3]*RC[-11]-RC[-2]*RC[-9])/1000 -> #VALUE! | AD70: =VALUE(RC[-28]) -> #VALUE! | AE70: =IF(RC[22]=42,"*",IF(RC[22]=32,"",RC[22])) ->  | AF70: =RC[-29] -> 24 | AG70: =RC[-29] ->  | AH70: =RC[-29] ->  | AI70: =RC[-29] ->  | AJ70: =RC[-29] ->  | AK70: =RC[-29] ->  | AL70: =RC[-29] ->  | AM70: =RC[-29] -> #VALUE! | AN70: =RC[-29] ->  | AO70: =RC[-29] ->  | AP70: =RC[-29] ->  | AQ70: =RC[-29] ->  | AR70: - | AS70: =RC[-30] ->  | AT70: =RC[-30] ->  | AU70: - | AV70: =RC[-31] -> #VALUE! | AW70: =RC[-31] ->  | AX70: =RC[-31] ->  | AY70: =RC[-31] -> #VALUE!
A71: =IF(RC[1]="","",DATEVALUE(RC[1])) ->  | C71: 24 | J71: =RC[-5]-RC[-2] -> #VALUE! | Q71: =RC[-3]-RC[-1] -> #VALUE! | T71: =RC[-8]+RC[-1] -> #VALUE! | U71: =(RC[-17]*RC[-16]-RC[-14]*RC[-13])/1000 -> #VALUE! | X71: =RC[-2]*RC[-10]/1000 -> #VALUE! | Y71: =(RC[-3]*RC[-11]-RC[-2]*RC[-9])/1000 -> #VALUE! | AD71: =VALUE(RC[-28]) -> #VALUE! | AE71: =IF(RC[22]=42,"*",IF(RC[22]=32,"",RC[22])) ->  | AF71: =RC[-29] -> 24 | AG71: =RC[-29] ->  | AH71: =RC[-29] ->  | AI71: =RC[-29] ->  | AJ71: =RC[-29] ->  | AK71: =RC[-29] ->  | AL71: =RC[-29] ->  | AM71: =RC[-29] -> #VALUE! | AN71: =RC[-29] ->  | AO71: =RC[-29] ->  | AP71: =RC[-29] ->  | AQ71: =RC[-29] ->  | AR71: - | AS71: =RC[-30] ->  | AT71: =RC[-30] ->  | AU71: - | AV71: =RC[-31] -> #VALUE! | AW71: =RC[-31] ->  | AX71: =RC[-31] ->  | AY71: =RC[-31] -> #VALUE!
A72: =IF(RC[1]="","",DATEVALUE(RC[1])) ->  | C72: 24 | J72: =RC[-5]-RC[-2] -> #VALUE! | Q72: =RC[-3]-RC[-1] -> #VALUE! | T72: =RC[-8]+RC[-1] -> #VALUE! | U72: =(RC[-17]*RC[-16]-RC[-14]*RC[-13])/1000 -> #VALUE! | X72: =RC[-2]*RC[-10]/1000 -> #VALUE! | Y72: =(RC[-3]*RC[-11]-RC[-2]*RC[-9])/1000 -> #VALUE! | AD72: =VALUE(RC[-28]) -> #VALUE! | AE72: =IF(RC[22]=42,"*",IF(RC[22]=32,"",RC[22])) ->  | AF72: =RC[-29] -> 24 | AG72: =RC[-29] ->  | AH72: =RC[-29] ->  | AI72: =RC[-29] ->  | AJ72: =RC[-29] ->  | AK72: =RC[-29] ->  | AL72: =RC[-29] ->  | AM72: =RC[-29] -> #VALUE! | AN72: =RC[-29] ->  | AO72: =RC[-29] ->  | AP72: =RC[-29] ->  | AQ72: =RC[-29] ->  | AR72: - | AS72: =RC[-30] ->  | AT72: =RC[-30] ->  | AU72: - | AV72: =RC[-31] -> #VALUE! | AW72: =RC[-31] ->  | AX72: =RC[-31] ->  | AY72: =RC[-31] -> #VALUE!
A73: =IF(RC[1]="","",DATEVALUE(RC[1])) ->  | C73: 24 | J73: =RC[-5]-RC[-2] -> #VALUE! | Q73: =RC[-3]-RC[-1] -> #VALUE! | T73: =RC[-8]+RC[-1] -> #VALUE! | U73: =(RC[-17]*RC[-16]-RC[-14]*RC[-13])/1000 -> #VALUE! | X73: =RC[-2]*RC[-10]/1000 -> #VALUE! | Y73: =(RC[-3]*RC[-11]-RC[-2]*RC[-9])/1000 -> #VALUE! | AD73: =VALUE(RC[-28]) -> #VALUE! | AE73: =IF(RC[22]=42,"*",IF(RC[22]=32,"",RC[22])) ->  | AF73: =RC[-29] -> 24 | AG73: =RC[-29] ->  | AH73: =RC[-29] ->  | AI73: =RC[-29] ->  | AJ73: =RC[-29] ->  | AK73: =RC[-29] ->  | AL73: =RC[-29] ->  | AM73: =RC[-29] -> #VALUE! | AN73: =RC[-29] ->  | AO73: =RC[-29] ->  | AP73: =RC[-29] ->  | AQ73: =RC[-29] ->  | AR73: - | AS73: =RC[-30] ->  | AT73: =RC[-30] ->  | AU73: - | AV73: =RC[-31] -> #VALUE! | AW73: =RC[-31] ->  | AX73: =RC[-31] ->  | AY73: =RC[-31] -> #VALUE!
A74: =IF(RC[1]="","",DATEVALUE(RC[1])) ->  | C74: 24 | J74: =RC[-5]-RC[-2] -> #VALUE! | Q74: =RC[-3]-RC[-1] -> #VALUE! | T74: =RC[-8]+RC[-1] -> #VALUE! | U74: =(RC[-17]*RC[-16]-RC[-14]*RC[-13])/1000 -> #VALUE! | X74: =RC[-2]*RC[-10]/1000 -> #VALUE! | Y74: =(RC[-3]*RC[-11]-RC[-2]*RC[-9])/1000 -> #VALUE! | AD74: =VALUE(RC[-28]) -> #VALUE! | AE74: =IF(RC[22]=42,"*",IF(RC[22]=32,"",RC[22])) ->  | AF74: =RC[-29] -> 24 | AG74: =RC[-29] ->  | AH74: =RC[-29] ->  | AI74: =RC[-29] ->  | AJ74: =RC[-29] ->  | AK74: =RC[-29] ->  | AL74: =RC[-29] ->  | AM74: =RC[-29] -> #VALUE! | AN74: =RC[-29] ->  | AO74: =RC[-29] ->  | AP74: =RC[-29] ->  | AQ74: =RC[-29] ->  | AR74: - | AS74: =RC[-30] ->  | AT74: =RC[-30] ->  | AU74: - | AV74: =RC[-31] -> #VALUE! | AW74: =RC[-31] ->  | AX74: =RC[-31] ->  | AY74: =RC[-31] -> #VALUE!
A75: =IF(RC[1]="","",DATEVALUE(RC[1])) ->  | C75: 24 | J75: =RC[-5]-RC[-2] -> #VALUE! | Q75: =RC[-3]-RC[-1] -> #VALUE! | T75: =RC[-8]+RC[-1] -> #VALUE! | U75: =(RC[-17]*RC[-16]-RC[-14]*RC[-13])/1000 -> #VALUE! | X75: =RC[-2]*RC[-10]/1000 -> #VALUE! | Y75: =(RC[-3]*RC[-11]-RC[-2]*RC[-9])/1000 -> #VALUE! | AD75: =VALUE(RC[-28]) -> #VALUE! | AE75: =IF(RC[22]=42,"*",IF(RC[22]=32,"",RC[22])) ->  | AF75: =RC[-29] -> 24 | AG75: =RC[-29] ->  | AH75: =RC[-29] ->  | AI75: =RC[-29] ->  | AJ75: =RC[-29] ->  | AK75: =RC[-29] ->  | AL75: =RC[-29] ->  | AM75: =RC[-29] -> #VALUE! | AN75: =RC[-29] ->  | AO75: =RC[-29] ->  | AP75: =RC[-29] ->  | AQ75: =RC[-29] ->  | AR75: - | AS75: =RC[-30] ->  | AT75: =RC[-30] ->  | AU75: - | AV75: =RC[-31] -> #VALUE! | AW75: =RC[-31] ->  | AX75: =RC[-31] ->  | AY75: =RC[-31] -> #VALUE!
A76: =IF(RC[1]="","",DATEVALUE(RC[1])) ->  | C76: 24 | J76: =RC[-5]-RC[-2] -> #VALUE! | Q76: =RC[-3]-RC[-1] -> #VALUE! | T76: =RC[-8]+RC[-1] -> #VALUE! | U76: =(RC[-17]*RC[-16]-RC[-14]*RC[-13])/1000 -> #VALUE! | X76: =RC[-2]*RC[-10]/1000 -> #VALUE! | Y76: =(RC[-3]*RC[-11]-RC[-2]*RC[-9])/1000 -> #VALUE! | AD76: =VALUE(RC[-28]) -> #VALUE! | AE76: =IF(RC[22]=42,"*",IF(RC[22]=32,"",RC[22])) ->  | AF76: =RC[-29] -> 24 | AG76: =RC[-29] ->  | AH76: =RC[-29] ->  | AI76: =RC[-29] ->  | AJ76: =RC[-29] ->  | AK76: =RC[-29] ->  | AL76: =RC[-29] ->  | AM76: =RC[-29] -> #VALUE! | AN76: =RC[-29] ->  | AO76: =RC[-29] ->  | AP76: =RC[-29] ->  | AQ76: =RC[-29] ->  | AR76: - | AS76: =RC[-30] ->  | AT76: =RC[-30] ->  | AU76: - | AV76: =RC[-31] -> #VALUE! | AW76: =RC[-31] ->  | AX76: =RC[-31] ->  | AY76: =RC[-31] -> #VALUE!
A77: =IF(RC[1]="","",DATEVALUE(RC[1])) ->  | C77: 24 | J77: =RC[-5]-RC[-2] -> #VALUE! | Q77: =RC[-3]-RC[-1] -> #VALUE! | T77: =RC[-8]+RC[-1] -> #VALUE! | U77: =(RC[-17]*RC[-16]-RC[-14]*RC[-13])/1000 -> #VALUE! | X77: =RC[-2]*RC[-10]/1000 -> #VALUE! | Y77: =(RC[-3]*RC[-11]-RC[-2]*RC[-9])/1000 -> #VALUE! | AD77: =VALUE(RC[-28]) -> #VALUE! | AE77: =IF(RC[22]=42,"*",IF(RC[22]=32,"",RC[22])) ->  | AF77: =RC[-29] -> 24 | AG77: =RC[-29] ->  | AH77: =RC[-29] ->  | AI77: =RC[-29] ->  | AJ77: =RC[-29] ->  | AK77: =RC[-29] ->  | AL77: =RC[-29] ->  | AM77: =RC[-29] -> #VALUE! | AN77: =RC[-29] ->  | AO77: =RC[-29] ->  | AP77: =RC[-29] ->  | AQ77: =RC[-29] ->  | AR77: - | AS77: =RC[-30] ->  | AT77: =RC[-30] ->  | AU77: - | AV77: =RC[-31] -> #VALUE! | AW77: =RC[-31] ->  | AX77: =RC[-31] ->  | AY77: =RC[-31] -> #VALUE!
A78: =IF(RC[1]="","",DATEVALUE(RC[1])) ->  | C78: 24 | J78: =RC[-5]-RC[-2] -> #VALUE! | Q78: =RC[-3]-RC[-1] -> #VALUE! | T78: =RC[-8]+RC[-1] -> #VALUE! | U78: =(RC[-17]*RC[-16]-RC[-14]*RC[-13])/1000 -> #VALUE! | X78: =RC[-2]*RC[-10]/1000 -> #VALUE! | Y78: =(RC[-3]*RC[-11]-RC[-2]*RC[-9])/1000 -> #VALUE! | AD78: =VALUE(RC[-28]) -> #VALUE! | AE78: =IF(RC[22]=42,"*",IF(RC[22]=32,"",RC[22])) ->  | AF78: =RC[-29] -> 24 | AG78: =RC[-29] ->  | AH78: =RC[-29] ->  | AI78: =RC[-29] ->  | AJ78: =RC[-29] ->  | AK78: =RC[-29] ->  | AL78: =RC[-29] ->  | AM78: =RC[-29] -> #VALUE! | AN78: =RC[-29] ->  | AO78: =RC[-29] ->  | AP78: =RC[-29] ->  | AQ78: =RC[-29] ->  | AR78: - | AS78: =RC[-30] ->  | AT78: =RC[-30] ->  | AU78: - | AV78: =RC[-31] -> #VALUE! | AW78: =RC[-31] ->  | AX78: =RC[-31] ->  | AY78: =RC[-31] -> #VALUE!
A79: =IF(RC[1]="","",DATEVALUE(RC[1])) ->  | C79: 24 | J79: =RC[-5]-RC[-2] -> #VALUE! | Q79: =RC[-3]-RC[-1] -> #VALUE! | T79: =RC[-8]+RC[-1] -> #VALUE! | U79: =(RC[-17]*RC[-16]-RC[-14]*RC[-13])/1000 -> #VALUE! | X79: =RC[-2]*RC[-10]/1000 -> #VALUE! | Y79: =(RC[-3]*RC[-11]-RC[-2]*RC[-9])/1000 -> #VALUE! | AD79: =VALUE(RC[-28]) -> #VALUE! | AE79: =IF(RC[22]=42,"*",IF(RC[22]=32,"",RC[22])) ->  | AF79: =RC[-29] -> 24 | AG79: =RC[-29] ->  | AH79: =RC[-29] ->  | AI79: =RC[-29] ->  | AJ79: =RC[-29] ->  | AK79: =RC[-29] ->  | AL79: =RC[-29] ->  | AM79: =RC[-29] -> #VALUE! | AN79: =RC[-29] ->  | AO79: =RC[-29] ->  | AP79: =RC[-29] ->  | AQ79: =RC[-29] ->  | AR79: - | AS79: =RC[-30] ->  | AT79: =RC[-30] ->  | AU79: - | AV79: =RC[-31] -> #VALUE! | AW79: =RC[-31] ->  | AX79: =RC[-31] ->  | AY79: =RC[-31] -> #VALUE!
A80: =IF(RC[1]="","",DATEVALUE(RC[1])) ->  | C80: 24 | J80: =RC[-5]-RC[-2] -> #VALUE! | Q80: =RC[-3]-RC[-1] -> #VALUE! | T80: =RC[-8]+RC[-1] -> #VALUE! | U80: =(RC[-17]*RC[-16]-RC[-14]*RC[-13])/1000 -> #VALUE! | X80: =RC[-2]*RC[-10]/1000 -> #VALUE! | Y80: =(RC[-3]*RC[-11]-RC[-2]*RC[-9])/1000 -> #VALUE! | AD80: =VALUE(RC[-28]) -> #VALUE! | AE80: =IF(RC[22]=42,"*",IF(RC[22]=32,"",RC[22])) ->  | AF80: =RC[-29] -> 24 | AG80: =RC[-29] ->  | AH80: =RC[-29] ->  | AI80: =RC[-29] ->  | AJ80: =RC[-29] ->  | AK80: =RC[-29] ->  | AL80: =RC[-29] ->  | AM80: =RC[-29] -> #VALUE! | AN80: =RC[-29] ->  | AO80: =RC[-29] ->  | AP80: =RC[-29] ->  | AQ80: =RC[-29] ->  | AR80: - | AS80: =RC[-30] ->  | AT80: =RC[-30] ->  | AU80: - | AV80: =RC[-31] -> #VALUE! | AW80: =RC[-31] ->  | AX80: =RC[-31] ->  | AY80: =RC[-31] -> #VALUE!
A81: =IF(RC[1]="","",DATEVALUE(RC[1])) ->  | C81: 24 | J81: =RC[-5]-RC[-2] -> #VALUE! | Q81: =RC[-3]-RC[-1] -> #VALUE! | T81: =RC[-8]+RC[-1] -> #VALUE! | U81: =(RC[-17]*RC[-16]-RC[-14]*RC[-13])/1000 -> #VALUE! | X81: =RC[-2]*RC[-10]/1000 -> #VALUE! | Y81: =(RC[-3]*RC[-11]-RC[-2]*RC[-9])/1000 -> #VALUE! | AD81: =VALUE(RC[-28]) -> #VALUE! | AE81: =IF(RC[22]=42,"*",IF(RC[22]=32,"",RC[22])) ->  | AF81: =RC[-29] -> 24 | AG81: =RC[-29] ->  | AH81: =RC[-29] ->  | AI81: =RC[-29] ->  | AJ81: =RC[-29] ->  | AK81: =RC[-29] ->  | AL81: =RC[-29] ->  | AM81: =RC[-29] -> #VALUE! | AN81: =RC[-29] ->  | AO81: =RC[-29] ->  | AP81: =RC[-29] ->  | AQ81: =RC[-29] ->  | AR81: - | AS81: =RC[-30] ->  | AT81: =RC[-30] ->  | AU81: - | AV81: =RC[-31] -> #VALUE! | AW81: =RC[-31] ->  | AX81: =RC[-31] ->  | AY81: =RC[-31] -> #VALUE!
A82: =IF(RC[1]="","",DATEVALUE(RC[1])) ->  | C82: 24 | J82: =RC[-5]-RC[-2] -> #VALUE! | Q82: =RC[-3]-RC[-1] -> #VALUE! | T82: =RC[-8]+RC[-1] -> #VALUE! | U82: =(RC[-17]*RC[-16]-RC[-14]*RC[-13])/1000 -> #VALUE! | X82: =RC[-2]*RC[-10]/1000 -> #VALUE! | Y82: =(RC[-3]*RC[-11]-RC[-2]*RC[-9])/1000 -> #VALUE! | AD82: =VALUE(RC[-28]) -> #VALUE! | AE82: =IF(RC[22]=42,"*",IF(RC[22]=32,"",RC[22])) ->  | AF82: =RC[-29] -> 24 | AG82: =RC[-29] ->  | AH82: =RC[-29] ->  | AI82: =RC[-29] ->  | AJ82: =RC[-29] ->  | AK82: =RC[-29] ->  | AL82: =RC[-29] ->  | AM82: =RC[-29] -> #VALUE! | AN82: =RC[-29] ->  | AO82: =RC[-29] ->  | AP82: =RC[-29] ->  | AQ82: =RC[-29] ->  | AR82: - | AS82: =RC[-30] ->  | AT82: =RC[-30] ->  | AU82: - | AV82: =RC[-31] -> #VALUE! | AW82: =RC[-31] ->  | AX82: =RC[-31] ->  | AY82: =RC[-31] -> #VALUE!
A83: =IF(RC[1]="","",DATEVALUE(RC[1])) ->  | C83: 24 | J83: =RC[-5]-RC[-2] -> #VALUE! | Q83: =RC[-3]-RC[-1] -> #VALUE! | T83: =RC[-8]+RC[-1] -> #VALUE! | U83: =(RC[-17]*RC[-16]-RC[-14]*RC[-13])/1000 -> #VALUE! | X83: =RC[-2]*RC[-10]/1000 -> #VALUE! | Y83: =(RC[-3]*RC[-11]-RC[-2]*RC[-9])/1000 -> #VALUE! | AD83: =VALUE(RC[-28]) -> #VALUE! | AE83: =IF(RC[22]=42,"*",IF(RC[22]=32,"",RC[22])) ->  | AF83: =RC[-29] -> 24 | AG83: =RC[-29] ->  | AH83: =RC[-29] ->  | AI83: =RC[-29] ->  | AJ83: =RC[-29] ->  | AK83: =RC[-29] ->  | AL83: =RC[-29] ->  | AM83: =RC[-29] -> #VALUE! | AN83: =RC[-29] ->  | AO83: =RC[-29] ->  | AP83: =RC[-29] ->  | AQ83: =RC[-29] ->  | AR83: - | AS83: =RC[-30] ->  | AT83: =RC[-30] ->  | AU83: - | AV83: =RC[-31] -> #VALUE! | AW83: =RC[-31] ->  | AX83: =RC[-31] ->  | AY83: =RC[-31] -> #VALUE!
AD84: Среднее | AG84: =R[1]C[-29] -> 167.98200000000003 | AH84: =R[1]C[-29] -> 46.256333333333323 | AI84: =R[1]C[-29] -> 7.53 | AJ84: =R[1]C[-29] -> 167.57600000000002 | AK84: =R[1]C[-29] -> 37.278333333333336 | AL84: =R[1]C[-29] -> 5.4300000000000042 | AM84: =R[1]C[-29] -> 8.9779999999999873 | AN84: =R[1]C[-29] -> 0.40599999999999997 | AP84: =R[1]C[-29] -> 36.245888888888885 | AQ84: =R[1]C[-29] -> 60.723222222222219 | AS84: =R[1]C[-30] -> 21.790333333333333 | AT84: =R[1]C[-30] -> 45.877333333333347 | AU84: - | AV84: =R[1]C[-31] -> 14.845888888888872
B85: Среднее | D85: =AVERAGE(OFFSET(R[-74]C,3,0,R7C1,1)) -> 167.98200000000003 | E85: =IF(SUM(OFFSET(R[-74]C,3,0,R7C1,1))=0,0,AVERAGE(OFFSET(R[-74]C,3,0,R7C1,1))) -> 46.256333333333323 | F85: =IF(SUM(OFFSET(R[-74]C,3,0,R7C1,1))=0,0,AVERAGE(OFFSET(R[-74]C,3,0,R7C1,1))) -> 7.53 | G85: =AVERAGE(OFFSET(R[-74]C,3,0,R7C1,1)) -> 167.57600000000002 | H85: =IF(SUM(OFFSET(R[-74]C,3,0,R7C1,1))=0,0,AVERAGE(OFFSET(R[-74]C,3,0,R7C1,1))) -> 37.278333333333336 | I85: =IF(SUM(OFFSET(R[-74]C,3,0,R7C1,1))=0,0,AVERAGE(OFFSET(R[-74]C,3,0,R7C1,1))) -> 5.4300000000000042 | J85: =RC[-5]-RC[-2] -> 8.9779999999999873 | K85: =AVERAGE(OFFSET(R[-74]C,3,0,R7C1,1)) -> 0.40599999999999997 | L85: =AVERAGE(OFFSET(R[-74]C,3,0,R7C1,1)) -> 1.8119666666666669 | M85: =AVERAGE(OFFSET(R[-74]C,3,0,R7C1,1)) -> 36.245888888888885 | N85: =IF(SUM(OFFSET(R[-74]C,3,0,R7C1,1))=0,0,AVERAGE(OFFSET(R[-74]C,3,0,R7C1,1))) -> 60.723222222222219 | O85: =AVERAGE(OFFSET(R[-74]C,3,0,R7C1,1)) -> 21.790333333333333 | P85: =IF(SUM(OFFSET(R[-74]C,3,0,R7C1,1))=0,0,AVERAGE(OFFSET(R[-74]C,3,0,R7C1,1))) -> 45.877333333333347 | Q85: =RC[-3]-RC[-1] -> 14.845888888888872 | R85: =AVERAGE(OFFSET(R[-74]C,3,0,R7C1,1)) -> 14.45555555555555 | S85: =AVERAGE(OFFSET(R[-74]C,3,0,R7C1,1)) -> 1.1748444444444444 | T85: =AVERAGE(OFFSET(R[-74]C,3,0,R7C1,1)) -> 2.9918 | U85: =AVERAGE(OFFSET(R[-74]C,3,0,R7C1,1)) -> 1.8047695466666664 | X85: =AVERAGE(OFFSET(R[-74]C,3,0,R7C1,1)) -> 2.1788546811111114 | Y85: =AVERAGE(OFFSET(R[-74]C,3,0,R7C1,1)) -> 1.1928045677777777 | AD85: Итого | AF85: =R[1]C[-29] -> 720 | AG85: =R[1]C[-29] -> 5039.4600000000009 | AJ85: =R[1]C[-29] -> 5027.2800000000007 | AN85: =R[1]C[-29] -> 12.18 | AO85: =R[1]C[-29] -> 54.359000000000009 | AP85: =R[1]C[-29] -> 1087.3766666666666 | AS85: =R[1]C[-30] -> 653.71 | AW85: =R[1]C[-31] -> 433.66666666666652 | AX85: =R[1]C[-31] -> 35.245333333333328 | AY85: =R[1]C[-31] -> 89.754000000000005
B86: ИТОГО: | C86: =SUM(OFFSET(R[-75]C,3,0,R7C1,1)) -> 720 | D86: =SUM(OFFSET(R[-75]C,3,0,R7C1,1)) -> 5039.4600000000009 | G86: =SUM(OFFSET(R[-75]C,3,0,R7C1,1)) -> 5027.2800000000007 | K86: =SUM(OFFSET(R[-75]C,3,0,R7C1,1)) -> 12.18 | L86: =SUM(OFFSET(R[-75]C,3,0,R7C1,1)) -> 54.359000000000009 | M86: =SUM(OFFSET(R[-75]C,3,0,R7C1,1)) -> 1087.3766666666666 | O86: =SUM(OFFSET(R[-75]C,3,0,R7C1,1)) -> 653.71 | R86: =SUM(OFFSET(R[-75]C,3,0,R7C1,1)) -> 433.66666666666652 | S86: =SUM(OFFSET(R[-75]C,3,0,R7C1,1)) -> 35.245333333333328 | T86: =SUM(OFFSET(R[-75]C,3,0,R7C1,1)) -> 89.754000000000005 | U86: =SUM(OFFSET(R[-75]C,3,0,R7C1,1)) -> 54.143086399999994 | X86: =SUM(OFFSET(R[-75]C,3,0,R7C1,1)) -> 65.36564043333334 | Y86: =SUM(OFFSET(R[-75]C,3,0,R7C1,1)) -> 35.78413703333333
AD87: Досчёт по среднему до конца месяца | AG87: =R[1]C[-29] -> 0 | AJ87: =R[1]C[-29] -> 0 | AN87: =R[1]C[-29] -> 0 | AO87: =R[1]C[-29] -> 0 | AP87: =R[1]C[-29] -> 0 | AS87: =R[1]C[-30] -> 0 | AW87: =R[1]C[-31] -> 0 | AX87: =R[1]C[-31] -> 0 | AY87: =R[1]C[-31] -> 0
A88: 11дн=264ч 4дн=96ч | B88: Досчёт до конца м-ца (+) | C88: =R[-82]C[-2]*24 -> 216 | U88: № 31119 | AD88: Снятие досчёта по среднему предыдущего отчёта | AG88: =-R[1]C[-29] -> 0 | AJ88: =-R[1]C[-29] -> 0 | AN88: =-R[1]C[-29] -> 0 | AO88: =-R[1]C[-29] -> 0 | AP88: =-R[1]C[-29] -> 0 | AS88: =-R[1]C[-30] -> 0 | AW88: =-R[1]C[-31] -> 0 | AX88: =-R[1]C[-31] -> 0 | AY88: =-R[1]C[-31] -> 0
A89: 9дн=216ч 7дн=168ч | B89: Вычет с предыдущего (-) | C89: =R[-85]C[-2]*24 -> 192 | AD89: Сумма: | AG89: =R[1]C[-29] -> 5039.4600000000009 | AJ89: =R[1]C[-29] -> 5027.2800000000007 | AN89: =R[1]C[-29] -> 12.18 | AO89: =R[1]C[-29] -> 54.359000000000009 | AP89: =R[1]C[-29] -> 1087.3766666666666 | AS89: =R[1]C[-30] -> 653.71 | AW89: =R[1]C[-31] -> 433.66666666666652 | AX89: =R[1]C[-31] -> 35.245333333333328 | AY89: =R[1]C[-31] -> 89.754000000000005
B90: СУММА: | C90: =R[-4]C+R[-2]C-R[-1]C -> 744 | D90: =R[-4]C+R[-2]C-R[-1]C -> 5039.4600000000009 | G90: =R[-4]C+R[-2]C-R[-1]C -> 5027.2800000000007 | K90: =R[-4]C+R[-2]C-R[-1]C -> 12.18 | L90: =R[-4]C+R[-2]C-R[-1]C -> 54.359000000000009 | M90: =R[-4]C+R[-2]C-R[-1]C -> 1087.3766666666666 | O90: =R[-4]C+R[-2]C-R[-1]C -> 653.71 | R90: =R[-4]C+R[-2]C-R[-1]C -> 433.66666666666652 | S90: =R[-4]C+R[-2]C-R[-1]C -> 35.245333333333328 | T90: =R[-4]C+R[-2]C-R[-1]C -> 89.754000000000005 | AD90: Тхв на источнике | AE90: 0 | AF90: V гвс (м3) | AG90: =R[-1]C[16] -> 433.66666666666652 | AH90: W гвс (Гкал) | AI90: =RC[-2]*0.06 -> 26.019999999999989 | AJ90: W без гвс (Гкал) | AK90: =R[-1]C[4] -> 54.359000000000009
AD91: =R[-90]C[-17] -> з.н д. №02/147-2783 от 04.10.18 15.10.18г некорректная работа приборов
B93: Дата, время | D93: М1, т | F93: М2, т | H93: М3, т | J93: М4, т | L93: Qо, Гкал | N93: Qг, Гкал | P93: время, час
B94: 23.09.18 07:00 | D94: 158377.21 | F94: 156724.72 | H94: 169483.36 | J94: 169352.31 | L94: 3000.5219999999999 | N94: 2886.9140000000002 | P94: -
B95: 23.10.18 02:00 | D95: 162249.04999999999 | F95: 160417.03 | H95: 176409.48 | J95: 175379.33 | L95: 3040.989 | N95: 2941.0749999999998 | P95: -
B98: Представитель потредителя:_______________________________________________________ В.О. Топорков
I101: Рекомендуемые значения по параметрам теплопотребления (не являются официально утверждёнными)
I102: М, т | J102: V, м3 | K102: Qгвс, Гкал | L102: Qотоп, Гкал | M102: Qо, Гкал
I103: =R[-13]C[6] -> 653.71 | J103: =RC[-1]/0.98 -> 667.05102040816337 | K103: =R[-13]C[8] -> 35.245333333333328 | L103: =R[-13]C -> 54.359000000000009 | M103: =R[-6]C[2] -> 0
P105: ДЛЯ САМОКОНТРОЛЯ
B106: В строке выбора дат указать период с 16.7.13 по 23.8.13 - жильё | O106: Qo | Q106: Qг
B107: В строке выбора дат указать период с 18.7.13 по 25.8.13 - не жилое | O107: =((R[-21]C[-11]*R[-22]C[-8])-(R[-21]C[-10]*R[-22]C[-7]))/1000 -> 844.49254896000025 | Q107: =IF(R[-22]C[-3]="",R[-21]C[-4]*R[-22]C[-1]/1000,"") ->  | R107: Си4
Q108: =IF(R[-23]C[-3]="","",((R[-22]C[-4]*R[-23]C[-1])-(R[-22]C[-3]*R[-23]C[1]))/1000) -> 49.88594179555556 | R108: Си5