Sheet: Лист1
G1: Отчёт о теплопотреблении за октябрь 2018 | M1: з.н д. №02/147-2783 от 04.10.18
A4: =EOMONTH(R[9]C,0)-R[9]C -> 8 | B4: Потребитель: ЗАО "Сити Сервис"
A5: =MAX(R[9]C:R[78]C) -> 2018-10-22T00:00:00.000 | B5: Адрес: г. СПб, Кораблестроителей ул., д.46 к.1 ИТП 2
A6: =EOMONTH(R[-1]C,0)-R[-1]C -> 9 | B6: Телефон: 8-911-021-19-79
A7: =R[-2]C-R[6]C -> 30 | B7: Договор 10023 (.) 85564
A8: 7 | B8: Тепловычислитель: ВКТ-7 № 43383 | L8: М2 мах= | M8: 132.72 | O8: Мгвс мах= | P8: 184.8
L9: Qотоп мах= | M9: 10.2 | O9: Qгвс мах= | P9: 11.04
B10: Расчётная формула: Q=M1*(h1-hхв)-M2*(h2-hхв)
D12: Учёт - ОТОПЛЕНИЕ | M12: Учёт - ГВС
A13: =R[1]C-1 -> 43365 | B13: Дата | C13: N, ч | D13: M1, т | E13: T1, С | F13: P1, кг/см2 | G13: M2, т | H13: T2, С | I13: P2, кг/см2 | J13: dT, гр.C | K13: M1-М2, т | L13: Qотоп, Гкал | M13: V3, м3 | N13: T3, С | O13: V4, м3 | P13: T4, С | Q13: dT, гр.C | R13: V3-V4, м3 | S13: Qгвс, Гкал | T13: Qобщ. | U13: Qo | V13: M3 | W13: M4 | X13: си4 | Y13: си5 | Z13: ТСО | AA13: Внутр. | AD13: Дата | AE13: НС | AF13: n, ч | AG13: М1, т | AH13: t1, гр. С | AI13: Р1, кгс/см2 | AJ13: М2, т | AK13: t2, гр. С | AL13: Р2, кгс/см2 | AM13: t1-t2, гр. С | AN13: М1-М2, т | AO13: Wотоп, Гкал | AP13: М1гвс, т | AQ13: t1гвс, гр. С | AR13: Р1гвс, кгс/см2 | AS13: М2гвс, т | AT13: t2гвс, гр. С | AU13: Р2гвс, кгс/см2 | AV13: t1гвс-t2гвс | AW13: М1гвс-М2гвс, т | AX13: Wгвс, Гкал | AY13: Wсумм, Гкал | BA13: NS_TV1 | BB13: НС | BC13: NS_TV2
A14: =IF(RC[1]="","",DATEVALUE(RC[1])) -> 43366 | B14: 23.09.18 | C14: 24 | D14: 0 | E14: 19.27 | F14: 7.53 | G14: 0 | H14: 19.05 | I14: 5.43 | J14: =RC[-5]-RC[-2] -> 0.21999999999999886 | K14: 0 | L14: 0 | M14: 30.91 | N14: 67.25 | O14: 2.62 | P14: 23.68 | Q14: =RC[-3]-RC[-1] -> 43.57 | R14: 28.29 | S14: 1.974 | T14: =RC[-8]+RC[-1] -> 1.974 | U14: =(RC[-17]*RC[-16]-RC[-14]*RC[-13])/1000 -> 0 | V14: 30.27 | W14: 2.62 | X14: =RC[-2]*RC[-10]/1000 -> 2.0356575000000001 | Y14: =(RC[-3]*RC[-11]-RC[-2]*RC[-9])/1000 -> 1.9736159 | Z14: 2013-11-23T00:00:00.000 | AA14: 2013-11-21T00:00:00.000 | AD14: =VALUE(RC[-28]) -> 2018-09-23T00:00:00.000 | AE14: =IF(RC[22]=42,"*",IF(RC[22]=32,"",RC[22])) -> - | AF14: =RC[-29] -> 24 | AG14: =RC[-29] -> 0 | AH14: =RC[-29] -> 19.27 | AI14: =RC[-29] -> 7.53 | AJ14: =RC[-29] -> 0 | AK14: =RC[-29] -> 19.05 | AL14: =RC[-29] -> 5.43 | AM14: =RC[-29] -> 0.21999999999999886 | AN14: =RC[-29] -> 0 | AO14: =RC[-29] -> 0 | AP14: =RC[-29] -> 30.91 | AQ14: =RC[-29] -> 67.25 | AR14: - | AS14: =RC[-30] -> 2.62 | AT14: =RC[-30] -> 23.68 | AU14: - | AV14: =RC[-31] -> 43.57 | AW14: =RC[-31] -> 28.29 | AX14: =RC[-31] -> 1.974 | AY14: =RC[-31] -> 1.974 | BA14: - | BB14: - | BC14: -
A15: =IF(RC[1]="","",DATEVALUE(RC[1])) -> 43367 | B15: 24.09.18 | C15: 24 | D15: 0 | E15: 18.62 | F15: 7.53 | G15: 0 | H15: 18.27 | I15: 5.43 | J15: =RC[-5]-RC[-2] -> 0.35000000000000142 | K15: 0 | L15: 0 | M15: 28.56 | N15: 66.27 | O15: 2.62 | P15: 22.49 | Q15: =RC[-3]-RC[-1] -> 43.78 | R15: 25.94 | S15: 1.796 | T15: =RC[-8]+RC[-1] -> 1.796 | U15: =(RC[-17]*RC[-16]-RC[-14]*RC[-13])/1000 -> 0 | V15: 27.98 | W15: 2.62 | X15: =RC[-2]*RC[-10]/1000 -> 1.8542346000000001 | Y15: =(RC[-3]*RC[-11]-RC[-2]*RC[-9])/1000 -> 1.7953108 | Z15: 2013-11-24T00:00:00.000 | AA15: 2013-11-22T00:00:00.000 | AD15: =VALUE(RC[-28]) -> 2018-09-24T00:00:00.000 | AE15: =IF(RC[22]=42,"*",IF(RC[22]=32,"",RC[22])) -> - | AF15: =RC[-29] -> 24 | AG15: =RC[-29] -> 0 | AH15: =RC[-29] -> 18.62 | AI15: =RC[-29] -> 7.53 | AJ15: =RC[-29] -> 0 | AK15: =RC[-29] -> 18.27 | AL15: =RC[-29] -> 5.43 | AM15: =RC[-29] -> 0.35000000000000142 | AN15: =RC[-29] -> 0 | AO15: =RC[-29] -> 0 | AP15: =RC[-29] -> 28.56 | AQ15: =RC[-29] -> 66.27 | AR15: - | AS15: =RC[-30] -> 2.62 | AT15: =RC[-30] -> 22.49 | AU15: - | AV15: =RC[-31] -> 43.78 | AW15: =RC[-31] -> 25.94 | AX15: =RC[-31] -> 1.796 | AY15: =RC[-31] -> 1.796 | BA15: - | BB15: - | BC15: -
A16: =IF(RC[1]="","",DATEVALUE(RC[1])) -> 43368 | B16: 25.09.18 | C16: 24 | D16: 0 | E16: 18.52 | F16: 7.53 | G16: 0 | H16: 18.3 | I16: 5.43 | J16: =RC[-5]-RC[-2] -> 0.21999999999999886 | K16: 0 | L16: 0 | M16: 29.37 | N16: 64.87 | O16: 2.6 | P16: 20.03 | Q16: =RC[-3]-RC[-1] -> 44.84 | R16: 26.77 | S16: 1.819 | T16: =RC[-8]+RC[-1] -> 1.819 | U16: =(RC[-17]*RC[-16]-RC[-14]*RC[-13])/1000 -> 0 | V16: 28.84 | W16: 2.6 | X16: =RC[-2]*RC[-10]/1000 -> 1.8708508000000001 | Y16: =(RC[-3]*RC[-11]-RC[-2]*RC[-9])/1000 -> 1.8187728000000001 | Z16: 2013-11-25T00:00:00.000 | AA16: 2013-11-23T00:00:00.000 | AD16: =VALUE(RC[-28]) -> 2018-09-25T00:00:00.000 | AE16: =IF(RC[22]=42,"*",IF(RC[22]=32,"",RC[22])) -> - | AF16: =RC[-29] -> 24 | AG16: =RC[-29] -> 0 | AH16: =RC[-29] -> 18.52 | AI16: =RC[-29] -> 7.53 | AJ16: =RC[-29] -> 0 | AK16: =RC[-29] -> 18.3 | AL16: =RC[-29] -> 5.43 | AM16: =RC[-29] -> 0.21999999999999886 | AN16: =RC[-29] -> 0 | AO16: =RC[-29] -> 0 | AP16: =RC[-29] -> 29.37 | AQ16: =RC[-29] -> 64.87 | AR16: - | AS16: =RC[-30] -> 2.6 | AT16: =RC[-30] -> 20.03 | AU16: - | AV16: =RC[-31] -> 44.84 | AW16: =RC[-31] -> 26.77 | AX16: =RC[-31] -> 1.819 | AY16: =RC[-31] -> 1.819 | BA16: - | BB16: - | BC16: -
A17: =IF(RC[1]="","",DATEVALUE(RC[1])) -> 43369 | B17: 26.09.18 | C17: 24 | D17: 2.39 | E17: 49.39 | F17: 7.53 | G17: 7.06 | H17: 32.06 | I17: 5.43 | J17: =RC[-5]-RC[-2] -> 17.329999999999998 | K17: -4.67 | L17: 6.6000000000000003E-2 | M17: 30.96 | N17: 64.25 | O17: 2.6 | P17: 20.53 | Q17: =RC[-3]-RC[-1] -> 43.72 | R17: 28.36 | S17: 1.9 | T17: =RC[-1] -> 1.9 | U17: =(RC[-17]*RC[-16]-RC[-14]*RC[-13])/1000 -> -0.10830150000000001 | V17: 30.4 | W17: 2.6 | X17: =RC[-2]*RC[-10]/1000 -> 1.9531999999999998 | Y17: =(RC[-3]*RC[-11]-RC[-2]*RC[-9])/1000 -> 1.8998219999999999 | Z17: 2013-11-26T00:00:00.000 | AA17: 2013-11-24T00:00:00.000 | AD17: =VALUE(RC[-28]) -> 2018-09-26T00:00:00.000 | AE17: =IF(RC[22]=42,"*",IF(RC[22]=32,"",RC[22])) -> - | AF17: =RC[-29] -> 24 | AG17: =RC[-29] -> 2.39 | AH17: =RC[-29] -> 49.39 | AI17: =RC[-29] -> 7.53 | AJ17: =RC[-29] -> 7.06 | AK17: =RC[-29] -> 32.06 | AL17: =RC[-29] -> 5.43 | AM17: =RC[-29] -> 17.329999999999998 | AN17: =RC[-29] -> -4.67 | AO17: =RC[-29] -> 6.6000000000000003E-2 | AP17: =RC[-29] -> 30.96 | AQ17: =RC[-29] -> 64.25 | AR17: - | AS17: =RC[-30] -> 2.6 | AT17: =RC[-30] -> 20.53 | AU17: - | AV17: =RC[-31] -> 43.72 | AW17: =RC[-31] -> 28.36 | AX17: =RC[-31] -> 1.9 | AY17: =RC[-31] -> 1.9 | BA17: - | BB17: - | BC17: -
A18: =IF(RC[1]="","",DATEVALUE(RC[1])) -> 43370 | B18: 27.09.18 | C18: 24 | D18: 8.48 | E18: 51.2 | F18: 7.53 | G18: 11.69 | H18: 26.6 | I18: 5.43 | J18: =RC[-5]-RC[-2] -> 24.6 | K18: -3.21 | L18: 0.24099999999999999 | M18: 30.19 | N18: 60.28 | O18: 2.58 | P18: 18.21 | Q18: =RC[-3]-RC[-1] -> 42.07 | R18: 27.61 | S18: 1.742 | T18: =RC[-8]+RC[-1] -> 1.9830000000000001 | U18: =(RC[-17]*RC[-16]-RC[-14]*RC[-13])/1000 -> 0.12322200000000004 | V18: 29.67 | W18: 2.58 | X18: =RC[-2]*RC[-10]/1000 -> 1.7885076000000002 | Y18: =(RC[-3]*RC[-11]-RC[-2]*RC[-9])/1000 -> 1.7415258 | Z18: 2013-11-27T00:00:00.000 | AA18: 2013-11-25T00:00:00.000 | AD18: =VALUE(RC[-28]) -> 2018-09-27T00:00:00.000 | AE18: =IF(RC[22]=42,"*",IF(RC[22]=32,"",RC[22])) -> - | AF18: =RC[-29] -> 24 | AG18: =RC[-29] -> 8.48 | AH18: =RC[-29] -> 51.2 | AI18: =RC[-29] -> 7.53 | AJ18: =RC[-29] -> 11.69 | AK18: =RC[-29] -> 26.6 | AL18: =RC[-29] -> 5.43 | AM18: =RC[-29] -> 24.6 | AN18: =RC[-29] -> -3.21 | AO18: =RC[-29] -> 0.24099999999999999 | AP18: =RC[-29] -> 30.19 | AQ18: =RC[-29] -> 60.28 | AR18: - | AS18: =RC[-30] -> 2.58 | AT18: =RC[-30] -> 18.21 | AU18: - | AV18: =RC[-31] -> 42.07 | AW18: =RC[-31] -> 27.61 | AX18: =RC[-31] -> 1.742 | AY18: =RC[-31] -> 1.9830000000000001 | BA18: - | BB18: - | BC18: -
A19: =IF(RC[1]="","",DATEVALUE(RC[1])) -> 43371 | B19: 28.09.18 | C19: 24 | D19: 129.80000000000001 | E19: 45.87 | F19: 7.53 | G19: 128.44 | H19: 35.03 | I19: 5.43 | J19: =RC[-5]-RC[-2] -> 10.839999999999996 | K19: 1.36 | L19: 1.4570000000000001 | M19: 28.97 | N19: 63.73 | O19: 2.61 | P19: 21.91 | Q19: =RC[-3]-RC[-1] -> 41.819999999999993 | R19: 26.36 | S19: 1.758 | T19: =RC[-8]+RC[-1] -> 3.2149999999999999 | U19: =(RC[-17]*RC[-16]-RC[-14]*RC[-13])/1000 -> 1.4546728000000002 | V19: 28.43 | W19: 2.61 | X19: =RC[-2]*RC[-10]/1000 -> 1.8118439 | Y19: =(RC[-3]*RC[-11]-RC[-2]*RC[-9])/1000 -> 1.7546587999999999 | Z19: 2013-11-28T00:00:00.000 | AA19: 2013-11-26T00:00:00.000 | AD19: =VALUE(RC[-28]) -> 2018-09-28T00:00:00.000 | AE19: =IF(RC[22]=42,"*",IF(RC[22]=32,"",RC[22])) -> - | AF19: =RC[-29] -> 24 | AG19: =RC[-29] -> 129.80000000000001 | AH19: =RC[-29] -> 45.87 | AI19: =RC[-29] -> 7.53 | AJ19: =RC[-29] -> 128.44 | AK19: =RC[-29] -> 35.03 | AL19: =RC[-29] -> 5.43 | AM19: =RC[-29] -> 10.839999999999996 | AN19: =RC[-29] -> 1.36 | AO19: =RC[-29] -> 1.4570000000000001 | AP19: =RC[-29] -> 28.97 | AQ19: =RC[-29] -> 63.73 | AR19: - | AS19: =RC[-30] -> 2.61 | AT19: =RC[-30] -> 21.91 | AU19: - | AV19: =RC[-31] -> 41.819999999999993 | AW19: =RC[-31] -> 26.36 | AX19: =RC[-31] -> 1.758 | AY19: =RC[-31] -> 3.2149999999999999 | BA19: - | BB19: - | BC19: -
A20: =IF(RC[1]="","",DATEVALUE(RC[1])) -> 43372 | B20: 29.09.18 | C20: 24 | D20: 244.97 | E20: 51.2 | F20: 7.53 | G20: 241.79 | H20: 39.71 | I20: 5.43 | J20: =RC[-5]-RC[-2] -> 11.490000000000002 | K20: 3.18 | L20: 2.9430000000000001 | M20: 29.3 | N20: 63.47 | O20: 2.63 | P20: 23.18 | Q20: =RC[-3]-RC[-1] -> 40.29 | R20: 26.67 | S20: 1.766 | T20: =RC[-8]+RC[-1] -> 4.7089999999999996 | U20: =(RC[-17]*RC[-16]-RC[-14]*RC[-13])/1000 -> 2.9409830999999995 | V20: 28.76 | W20: 2.63 | X20: =RC[-2]*RC[-10]/1000 -> 1.8253972000000001 | Y20: =(RC[-3]*RC[-11]-RC[-2]*RC[-9])/1000 -> 1.7644337999999999 | Z20: 2013-11-29T00:00:00.000 | AA20: 2013-11-27T00:00:00.000 | AD20: =VALUE(RC[-28]) -> 2018-09-29T00:00:00.000 | AE20: =IF(RC[22]=42,"*",IF(RC[22]=32,"",RC[22])) -> - | AF20: =RC[-29] -> 24 | AG20: =RC[-29] -> 244.97 | AH20: =RC[-29] -> 51.2 | AI20: =RC[-29] -> 7.53 | AJ20: =RC[-29] -> 241.79 | AK20: =RC[-29] -> 39.71 | AL20: =RC[-29] -> 5.43 | AM20: =RC[-29] -> 11.490000000000002 | AN20: =RC[-29] -> 3.18 | AO20: =RC[-29] -> 2.9430000000000001 | AP20: =RC[-29] -> 29.3 | AQ20: =RC[-29] -> 63.47 | AR20: - | AS20: =RC[-30] -> 2.63 | AT20: =RC[-30] -> 23.18 | AU20: - | AV20: =RC[-31] -> 40.29 | AW20: =RC[-31] -> 26.67 | AX20: =RC[-31] -> 1.766 | AY20: =RC[-31] -> 4.7089999999999996 | BA20: - | BB20: - | BC20: -
A21: =IF(RC[1]="","",DATEVALUE(RC[1])) -> 43373 | B21: 30.09.18 | C21: 24 | D21: 245.44 | E21: 51.73 | F21: 7.53 | G21: 242.05 | H21: 40.340000000000003 | I21: 5.43 | J21: =RC[-5]-RC[-2] -> 11.389999999999993 | K21: 3.39 | L21: 2.9359999999999999 | M21: 34.69 | N21: 65.86 | O21: 2.66 | P21: 24.56 | Q21: =RC[-3]-RC[-1] -> 41.3 | R21: 32.03 | S21: 2.1749999999999998 | T21: =RC[-8]+RC[-1] -> 5.1109999999999998 | U21: =(RC[-17]*RC[-16]-RC[-14]*RC[-13])/1000 -> 2.9323141999999991 | V21: 34.01 | W21: 2.66 | X21: =RC[-2]*RC[-10]/1000 -> 2.2398986000000001 | Y21: =(RC[-3]*RC[-11]-RC[-2]*RC[-9])/1000 -> 2.174569 | Z21: 2013-11-30T00:00:00.000 | AA21: 2013-11-28T00:00:00.000 | AD21: =VALUE(RC[-28]) -> 2018-09-30T00:00:00.000 | AE21: =IF(RC[22]=42,"*",IF(RC[22]=32,"",RC[22])) -> - | AF21: =RC[-29] -> 24 | AG21: =RC[-29] -> 245.44 | AH21: =RC[-29] -> 51.73 | AI21: =RC[-29] -> 7.53 | AJ21: =RC[-29] -> 242.05 | AK21: =RC[-29] -> 40.340000000000003 | AL21: =RC[-29] -> 5.43 | AM21: =RC[-29] -> 11.389999999999993 | AN21: =RC[-29] -> 3.39 | AO21: =RC[-29] -> 2.9359999999999999 | AP21: =RC[-29] -> 34.69 | AQ21: =RC[-29] -> 65.86 | AR21: - | AS21: =RC[-30] -> 2.66 | AT21: =RC[-30] -> 24.56 | AU21: - | AV21: =RC[-31] -> 41.3 | AW21: =RC[-31] -> 32.03 | AX21: =RC[-31] -> 2.1749999999999998 | AY21: =RC[-31] -> 5.1109999999999998 | BA21: - | BB21: - | BC21: -
A22: =IF(RC[1]="","",DATEVALUE(RC[1])) -> 43374 | B22: 01.10.18 | C22: 24 | D22: 246.96 | E22: 51.35 | F22: 7.53 | G22: 243.55 | H22: 40.61 | I22: 5.43 | J22: =RC[-5]-RC[-2] -> 10.740000000000002 | K22: 3.41 | L22: 2.7959999999999998 | M22: 27.91 | N22: 64.34 | O22: 2.69 | P22: 25.73 | Q22: =RC[-3]-RC[-1] -> 38.61 | R22: 25.22 | S22: 1.694 | T22: =RC[-8]+RC[-1] -> 4.49 | U22: =(RC[-17]*RC[-16]-RC[-14]*RC[-13])/1000 -> 2.7908305000000002 | V22: 27.41 | W22: 2.69 | X22: =RC[-2]*RC[-10]/1000 -> 1.7635594000000001 | Y22: =(RC[-3]*RC[-11]-RC[-2]*RC[-9])/1000 -> 1.6943457000000002 | Z22: 2013-12-01T00:00:00.000 | AA22: 2013-11-29T00:00:00.000 | AD22: =VALUE(RC[-28]) -> 2018-10-01T00:00:00.000 | AE22: =IF(RC[22]=42,"*",IF(RC[22]=32,"",RC[22])) -> - | AF22: =RC[-29] -> 24 | AG22: =RC[-29] -> 246.96 | AH22: =RC[-29] -> 51.35 | AI22: =RC[-29] -> 7.53 | AJ22: =RC[-29] -> 243.55 | AK22: =RC[-29] -> 40.61 | AL22: =RC[-29] -> 5.43 | AM22: =RC[-29] -> 10.740000000000002 | AN22: =RC[-29] -> 3.41 | AO22: =RC[-29] -> 2.7959999999999998 | AP22: =RC[-29] -> 27.91 | AQ22: =RC[-29] -> 64.34 | AR22: - | AS22: =RC[-30] -> 2.69 | AT22: =RC[-30] -> 25.73 | AU22: - | AV22: =RC[-31] -> 38.61 | AW22: =RC[-31] -> 25.22 | AX22: =RC[-31] -> 1.694 | AY22: =RC[-31] -> 4.49 | BA22: - | BB22: - | BC22: -
A23: =IF(RC[1]="","",DATEVALUE(RC[1])) -> 43375 | B23: 02.10.18 | C23: 24 | D23: 248.69 | E23: 51.25 | F23: 7.53 | G23: 245.29 | H23: 40.65 | I23: 5.43 | J23: =RC[-5]-RC[-2] -> 10.600000000000001 | K23: 3.4 | L23: 2.7810000000000001 | M23: 26.31 | N23: 63.18 | O23: 2.69 | P23: 25.89 | Q23: =RC[-3]-RC[-1] -> 37.29 | R23: 23.62 | S23: 1.5609999999999999 | T23: =RC[-8]+RC[-1] -> 4.3420000000000005 | U23: =(RC[-17]*RC[-16]-RC[-14]*RC[-13])/1000 -> 2.7743240000000005 | V23: 25.82 | W23: 2.69 | X23: =RC[-2]*RC[-10]/1000 -> 1.6313076000000002 | Y23: =(RC[-3]*RC[-11]-RC[-2]*RC[-9])/1000 -> 1.5616635000000001 | Z23: 2013-12-02T00:00:00.000 | AA23: 2013-11-30T00:00:00.000 | AD23: =VALUE(RC[-28]) -> 2018-10-02T00:00:00.000 | AE23: =IF(RC[22]=42,"*",IF(RC[22]=32,"",RC[22])) -> - | AF23: =RC[-29] -> 24 | AG23: =RC[-29] -> 248.69 | AH23: =RC[-29] -> 51.25 | AI23: =RC[-29] -> 7.53 | AJ23: =RC[-29] -> 245.29 | AK23: =RC[-29] -> 40.65 | AL23: =RC[-29] -> 5.43 | AM23: =RC[-29] -> 10.600000000000001 | AN23: =RC[-29] -> 3.4 | AO23: =RC[-29] -> 2.7810000000000001 | AP23: =RC[-29] -> 26.31 | AQ23: =RC[-29] -> 63.18 | AR23: - | AS23: =RC[-30] -> 2.69 | AT23: =RC[-30] -> 25.89 | AU23: - | AV23: =RC[-31] -> 37.29 | AW23: =RC[-31] -> 23.62 | AX23: =RC[-31] -> 1.5609999999999999 | AY23: =RC[-31] -> 4.3420000000000005 | BA23: - | BB23: - | BC23: -
A24: =IF(RC[1]="","",DATEVALUE(RC[1])) -> 43376 | B24: 03.10.18 | C24: 24 | D24: 250.25 | E24: 51.87 | F24: 7.53 | G24: 245.76 | H24: 40.840000000000003 | I24: 5.43 | J24: =RC[-5]-RC[-2] -> 11.029999999999994 | K24: 4.49 | L24: 2.9470000000000001 | M24: 27.57 | N24: 63.32 | O24: 2.67 | P24: 25.93 | Q24: =RC[-3]-RC[-1] -> 37.39 | R24: 24.9 | S24: 1.6439999999999999 | T24: =RC[-8]+RC[-1] -> 4.5910000000000002 | U24: =(RC[-17]*RC[-16]-RC[-14]*RC[-13])/1000 -> 2.9436290999999981 | V24: 27.06 | W24: 2.67 | X24: =RC[-2]*RC[-10]/1000 -> 1.7134392000000001 | Y24: =(RC[-3]*RC[-11]-RC[-2]*RC[-9])/1000 -> 1.6442061000000001 | Z24: 2013-12-03T00:00:00.000 | AA24: 2013-12-01T00:00:00.000 | AD24: =VALUE(RC[-28]) -> 2018-10-03T00:00:00.000 | AE24: =IF(RC[22]=42,"*",IF(RC[22]=32,"",RC[22])) -> - | AF24: =RC[-29] -> 24 | AG24: =RC[-29] -> 250.25 | AH24: =RC[-29] -> 51.87 | AI24: =RC[-29] -> 7.53 | AJ24: =RC[-29] -> 245.76 | AK24: =RC[-29] -> 40.840000000000003 | AL24: =RC[-29] -> 5.43 | AM24: =RC[-29] -> 11.029999999999994 | AN24: =RC[-29] -> 4.49 | AO24: =RC[-29] -> 2.9470000000000001 | AP24: =RC[-29] -> 27.57 | AQ24: =RC[-29] -> 63.32 | AR24: - | AS24: =RC[-30] -> 2.67 | AT24: =RC[-30] -> 25.93 | AU24: - | AV24: =RC[-31] -> 37.39 | AW24: =RC[-31] -> 24.9 | AX24: =RC[-31] -> 1.6439999999999999 | AY24: =RC[-31] -> 4.5910000000000002 | BA24: - | BB24: - | BC24: -
A25: =IF(RC[1]="","",DATEVALUE(RC[1])) -> 43377 | B25: 04.10.18 | C25: 24 | D25: 252.02 | E25: 51.54 | F25: 7.53 | G25: 248.48 | H25: 40.159999999999997 | I25: 5.43 | J25: =RC[-5]-RC[-2] -> 11.380000000000003 | K25: 3.54 | L25: 3.0150000000000001 | M25: 26.93 | N25: 62.8 | O25: 2.66 | P25: 25.36 | Q25: =RC[-3]-RC[-1] -> 37.44 | R25: 24.27 | S25: 1.595 | T25: =RC[-8]+RC[-1] -> 4.6100000000000003 | U25: =(RC[-17]*RC[-16]-RC[-14]*RC[-13])/1000 -> 3.0101540000000022 | V25: 26.43 | W25: 2.66 | X25: =RC[-2]*RC[-10]/1000 -> 1.6598039999999998 | Y25: =(RC[-3]*RC[-11]-RC[-2]*RC[-9])/1000 -> 1.5923463999999998 | Z25: 2013-12-04T00:00:00.000 | AA25: 2013-12-02T00:00:00.000 | AD25: =VALUE(RC[-28]) -> 2018-10-04T00:00:00.000 | AE25: =IF(RC[22]=42,"*",IF(RC[22]=32,"",RC[22])) -> - | AF25: =RC[-29] -> 24 | AG25: =RC[-29] -> 252.02 | AH25: =RC[-29] -> 51.54 | AI25: =RC[-29] -> 7.53 | AJ25: =RC[-29] -> 248.48 | AK25: =RC[-29] -> 40.159999999999997 | AL25: =RC[-29] -> 5.43 | AM25: =RC[-29] -> 11.380000000000003 | AN25: =RC[-29] -> 3.54 | AO25: =RC[-29] -> 3.0150000000000001 | AP25: =RC[-29] -> 26.93 | AQ25: =RC[-29] -> 62.8 | AR25: - | AS25: =RC[-30] -> 2.66 | AT25: =RC[-30] -> 25.36 | AU25: - | AV25: =RC[-31] -> 37.44 | AW25: =RC[-31] -> 24.27 | AX25: =RC[-31] -> 1.595 | AY25: =RC[-31] -> 4.6100000000000003 | BA25: - | BB25: - | BC25: -
A26: =IF(RC[1]="","",DATEVALUE(RC[1])) -> 43378 | B26: 05.10.18 | C26: 24 | D26: 252.2 | E26: 52.1 | F26: 7.53 | G26: 248.56 | H26: 40.229999999999997 | I26: 5.43 | J26: =RC[-5]-RC[-2] -> 11.870000000000005 | K26: 3.64 | L26: 3.1440000000000001 | M26: 25.97 | N26: 62.2 | O26: 2.64 | P26: 24.95 | Q26: =RC[-3]-RC[-1] -> 37.25 | R26: 23.33 | S26: 1.522 | T26: =RC[-8]+RC[-1] -> 4.6660000000000004 | U26: =(RC[-17]*RC[-16]-RC[-14]*RC[-13])/1000 -> 3.1400511999999998 | V26: 25.52 | W26: 2.64 | X26: =RC[-2]*RC[-10]/1000 -> 1.5873440000000001 | Y26: =(RC[-3]*RC[-11]-RC[-2]*RC[-9])/1000 -> 1.5214760000000001 | Z26: 2013-12-05T00:00:00.000 | AA26: 2013-12-03T00:00:00.000 | AD26: =VALUE(RC[-28]) -> 2018-10-05T00:00:00.000 | AE26: =IF(RC[22]=42,"*",IF(RC[22]=32,"",RC[22])) -> - | AF26: =RC[-29] -> 24 | AG26: =RC[-29] -> 252.2 | AH26: =RC[-29] -> 52.1 | AI26: =RC[-29] -> 7.53 | AJ26: =RC[-29] -> 248.56 | AK26: =RC[-29] -> 40.229999999999997 | AL26: =RC[-29] -> 5.43 | AM26: =RC[-29] -> 11.870000000000005 | AN26: =RC[-29] -> 3.64 | AO26: =RC[-29] -> 3.1440000000000001 | AP26: =RC[-29] -> 25.97 | AQ26: =RC[-29] -> 62.2 | AR26: - | AS26: =RC[-30] -> 2.64 | AT26: =RC[-30] -> 24.95 | AU26: - | AV26: =RC[-31] -> 37.25 | AW26: =RC[-31] -> 23.33 | AX26: =RC[-31] -> 1.522 | AY26: =RC[-31] -> 4.6660000000000004 | BA26: - | BB26: - | BC26: -
A27: =IF(RC[1]="","",DATEVALUE(RC[1])) -> 43379 | B27: 06.10.18 | C27: 24 | D27: 252.36 | E27: 52.05 | F27: 7.53 | G27: 248.57 | H27: 40.64 | I27: 5.43 | J27: =RC[-5]-RC[-2] -> 11.409999999999997 | K27: 3.79 | L27: 3.0390000000000001 | M27: 26.19 | N27: 62.89 | O27: 2.64 | P27: 25.76 | Q27: =RC[-3]-RC[-1] -> 37.129999999999995 | R27: 23.55 | S27: 1.5529999999999999 | T27: =RC[-8]+RC[-1] -> 4.5920000000000005 | U27: =(RC[-17]*RC[-16]-RC[-14]*RC[-13])/1000 -> 3.0334531999999998 | V27: 25.74 | W27: 2.64 | X27: =RC[-2]*RC[-10]/1000 -> 1.6187885999999998 | Y27: =(RC[-3]*RC[-11]-RC[-2]*RC[-9])/1000 -> 1.5507821999999998 | Z27: 2013-12-06T00:00:00.000 | AA27: 2013-12-04T00:00:00.000 | AD27: =VALUE(RC[-28]) -> 2018-10-06T00:00:00.000 | AE27: =IF(RC[22]=42,"*",IF(RC[22]=32,"",RC[22])) -> - | AF27: =RC[-29] -> 24 | AG27: =RC[-29] -> 252.36 | AH27: =RC[-29] -> 52.05 | AI27: =RC[-29] -> 7.53 | AJ27: =RC[-29] -> 248.57 | AK27: =RC[-29] -> 40.64 | AL27: =RC[-29] -> 5.43 | AM27: =RC[-29] -> 11.409999999999997 | AN27: =RC[-29] -> 3.79 | AO27: =RC[-29] -> 3.0390000000000001 | AP27: =RC[-29] -> 26.19 | AQ27: =RC[-29] -> 62.89 | AR27: - | AS27: =RC[-30] -> 2.64 | AT27: =RC[-30] -> 25.76 | AU27: - | AV27: =RC[-31] -> 37.129999999999995 | AW27: =RC[-31] -> 23.55 | AX27: =RC[-31] -> 1.5529999999999999 | AY27: =RC[-31] -> 4.5920000000000005 | BA27: - | BB27: - | BC27: -
A28: =IF(RC[1]="","",DATEVALUE(RC[1])) -> 43380 | B28: 07.10.18 | C28: 24 | D28: 252.59 | E28: 52.78 | F28: 7.53 | G28: 248.54 | H28: 41.11 | I28: 5.43 | J28: =RC[-5]-RC[-2] -> 11.670000000000002 | K28: 4.05 | L28: 3.1190000000000002 | M28: 31.38 | N28: 63.38 | O28: 2.64 | P28: 26.02 | Q28: =RC[-3]-RC[-1] -> 37.36 | R28: 28.74 | S28: 1.8839999999999999 | T28: =RC[-8]+RC[-1] -> 5.0030000000000001 | U28: =(RC[-17]*RC[-16]-RC[-14]*RC[-13])/1000 -> 3.1142208000000009 | V28: 30.82 | W28: 2.64 | X28: =RC[-2]*RC[-10]/1000 -> 1.9533716000000001 | Y28: =(RC[-3]*RC[-11]-RC[-2]*RC[-9])/1000 -> 1.8846788000000001 | Z28: 2013-12-07T00:00:00.000 | AA28: 2013-12-05T00:00:00.000 | AD28: =VALUE(RC[-28]) -> 2018-10-07T00:00:00.000 | AE28: =IF(RC[22]=42,"*",IF(RC[22]=32,"",RC[22])) -> - | AF28: =RC[-29] -> 24 | AG28: =RC[-29] -> 252.59 | AH28: =RC[-29] -> 52.78 | AI28: =RC[-29] -> 7.53 | AJ28: =RC[-29] -> 248.54 | AK28: =RC[-29] -> 41.11 | AL28: =RC[-29] -> 5.43 | AM28: =RC[-29] -> 11.670000000000002 | AN28: =RC[-29] -> 4.05 | AO28: =RC[-29] -> 3.1190000000000002 | AP28: =RC[-29] -> 31.38 | AQ28: =RC[-29] -> 63.38 | AR28: - | AS28: =RC[-30] -> 2.64 | AT28: =RC[-30] -> 26.02 | AU28: - | AV28: =RC[-31] -> 37.36 | AW28: =RC[-31] -> 28.74 | AX28: =RC[-31] -> 1.8839999999999999 | AY28: =RC[-31] -> 5.0030000000000001 | BA28: - | BB28: - | BC28: -
A29: =IF(RC[1]="","",DATEVALUE(RC[1])) -> 43381 | B29: 08.10.18 | C29: 24 | D29: 252.69 | E29: 52.18 | F29: 7.53 | G29: 248.01 | H29: 40.630000000000003 | I29: 5.43 | J29: =RC[-5]-RC[-2] -> 11.549999999999997 | K29: 4.68 | L29: 3.11 | M29: 28.18 | N29: 63 | O29: 2.62 | P29: 25.45 | Q29: =RC[-3]-RC[-1] -> 37.549999999999997 | R29: 25.56 | S29: 1.6759999999999999 | T29: =RC[-8]+RC[-1] -> 4.7859999999999996 | U29: =(RC[-17]*RC[-16]-RC[-14]*RC[-13])/1000 -> 3.1087178999999998 | V29: 27.67 | W29: 2.62 | X29: =RC[-2]*RC[-10]/1000 -> 1.7432099999999999 | Y29: =(RC[-3]*RC[-11]-RC[-2]*RC[-9])/1000 -> 1.676531 | Z29: 2013-12-08T00:00:00.000 | AA29: 2013-12-06T00:00:00.000 | AD29: =VALUE(RC[-28]) -> 2018-10-08T00:00:00.000 | AE29: =IF(RC[22]=42,"*",IF(RC[22]=32,"",RC[22])) -> - | AF29: =RC[-29] -> 24 | AG29: =RC[-29] -> 252.69 | AH29: =RC[-29] -> 52.18 | AI29: =RC[-29] -> 7.53 | AJ29: =RC[-29] -> 248.01 | AK29: =RC[-29] -> 40.630000000000003 | AL29: =RC[-29] -> 5.43 | AM29: =RC[-29] -> 11.549999999999997 | AN29: =RC[-29] -> 4.68 | AO29: =RC[-29] -> 3.11 | AP29: =RC[-29] -> 28.18 | AQ29: =RC[-29] -> 63 | AR29: - | AS29: =RC[-30] -> 2.62 | AT29: =RC[-30] -> 25.45 | AU29: - | AV29: =RC[-31] -> 37.549999999999997 | AW29: =RC[-31] -> 25.56 | AX29: =RC[-31] -> 1.6759999999999999 | AY29: =RC[-31] -> 4.7859999999999996 | BA29: - | BB29: - | BC29: -
A30: =IF(RC[1]="","",DATEVALUE(RC[1])) -> 43382 | B30: 09.10.18 | C30: 24 | D30: 252.14 | E30: 50.39 | F30: 7.53 | G30: 248.03 | H30: 39.57 | I30: 5.43 | J30: =RC[-5]-RC[-2] -> 10.82 | K30: 4.1100000000000003 | L30: 2.8980000000000001 | M30: 28.77 | N30: 62.75 | O30: 2.63 | P30: 25.73 | Q30: =RC[-3]-RC[-1] -> 37.019999999999996 | R30: 26.14 | S30: 1.706 | T30: =RC[-8]+RC[-1] -> 4.6040000000000001 | U30: =(RC[-17]*RC[-16]-RC[-14]*RC[-13])/1000 -> 2.8907875000000005 | V30: 28.27 | W30: 2.63 | X30: =RC[-2]*RC[-10]/1000 -> 1.7739425 | Y30: =(RC[-3]*RC[-11]-RC[-2]*RC[-9])/1000 -> 1.7062725999999997 | Z30: 2013-12-09T00:00:00.000 | AA30: 2013-12-07T00:00:00.000 | AD30: =VALUE(RC[-28]) -> 2018-10-09T00:00:00.000 | AE30: =IF(RC[22]=42,"*",IF(RC[22]=32,"",RC[22])) -> - | AF30: =RC[-29] -> 24 | AG30: =RC[-29] -> 252.14 | AH30: =RC[-29] -> 50.39 | AI30: =RC[-29] -> 7.53 | AJ30: =RC[-29] -> 248.03 | AK30: =RC[-29] -> 39.57 | AL30: =RC[-29] -> 5.43 | AM30: =RC[-29] -> 10.82 | AN30: =RC[-29] -> 4.1100000000000003 | AO30: =RC[-29] -> 2.8980000000000001 | AP30: =RC[-29] -> 28.77 | AQ30: =RC[-29] -> 62.75 | AR30: - | AS30: =RC[-30] -> 2.63 | AT30: =RC[-30] -> 25.73 | AU30: - | AV30: =RC[-31] -> 37.019999999999996 | AW30: =RC[-31] -> 26.14 | AX30: =RC[-31] -> 1.706 | AY30: =RC[-31] -> 4.6040000000000001 | BA30: - | BB30: - | BC30: -
A31: =IF(RC[1]="","",DATEVALUE(RC[1])) -> 43383 | B31: 10.10.18 | C31: 24 | D31: 252.49 | E31: 51.18 | F31: 7.53 | G31: 248.14 | H31: 40.380000000000003 | I31: 5.43 | J31: =RC[-5]-RC[-2] -> 10.799999999999997 | K31: 4.3499999999999996 | L31: 2.9060000000000001 | M31: 26.64 | N31: 63.73 | O31: 2.62 | P31: 26.5 | Q31: =RC[-3]-RC[-1] -> 37.229999999999997 | R31: 24.02 | S31: 1.5940000000000001 | T31: =RC[-8]+RC[-1] -> 4.5 | U31: =(RC[-17]*RC[-16]-RC[-14]*RC[-13])/1000 -> 2.9025449999999999 | V31: 26.12 | W31: 2.62 | X31: =RC[-2]*RC[-10]/1000 -> 1.6646276 | Y31: =(RC[-3]*RC[-11]-RC[-2]*RC[-9])/1000 -> 1.5951975999999999 | Z31: 2013-12-10T00:00:00.000 | AA31: 2013-12-08T00:00:00.000 | AD31: =VALUE(RC[-28]) -> 2018-10-10T00:00:00.000 | AE31: =IF(RC[22]=42,"*",IF(RC[22]=32,"",RC[22])) -> - | AF31: =RC[-29] -> 24 | AG31: =RC[-29] -> 252.49 | AH31: =RC[-29] -> 51.18 | AI31: =RC[-29] -> 7.53 | AJ31: =RC[-29] -> 248.14 | AK31: =RC[-29] -> 40.380000000000003 | AL31: =RC[-29] -> 5.43 | AM31: =RC[-29] -> 10.799999999999997 | AN31: =RC[-29] -> 4.3499999999999996 | AO31: =RC[-29] -> 2.9060000000000001 | AP31: =RC[-29] -> 26.64 | AQ31: =RC[-29] -> 63.73 | AR31: - | AS31: =RC[-30] -> 2.62 | AT31: =RC[-30] -> 26.5 | AU31: - | AV31: =RC[-31] -> 37.229999999999997 | AW31: =RC[-31] -> 24.02 | AX31: =RC[-31] -> 1.5940000000000001 | AY31: =RC[-31] -> 4.5 | BA31: - | BB31: - | BC31: -
A32: =IF(RC[1]="","",DATEVALUE(RC[1])) -> 43384 | B32: 11.10.18 | C32: 24 | D32: 253.16 | E32: 51.57 | F32: 7.53 | G32: 248.7 | H32: 40.76 | I32: 5.43 | J32: =RC[-5]-RC[-2] -> 10.810000000000002 | K32: 4.46 | L32: 2.9249999999999998 | M32: 25.54 | N32: 64.59 | O32: 2.62 | P32: 26.62 | Q32: =RC[-3]-RC[-1] -> 37.97 | R32: 22.92 | S32: 1.548 | T32: =RC[-8]+RC[-1] -> 4.4729999999999999 | U32: =(RC[-17]*RC[-16]-RC[-14]*RC[-13])/1000 -> 2.9184492000000009 | V32: 25.07 | W32: 2.62 | X32: =RC[-2]*RC[-10]/1000 -> 1.6192713000000001 | Y32: =(RC[-3]*RC[-11]-RC[-2]*RC[-9])/1000 -> 1.5495269 | Z32: 2013-12-11T00:00:00.000 | AA32: 2013-12-09T00:00:00.000 | AD32: =VALUE(RC[-28]) -> 2018-10-11T00:00:00.000 | AE32: =IF(RC[22]=42,"*",IF(RC[22]=32,"",RC[22])) -> - | AF32: =RC[-29] -> 24 | AG32: =RC[-29] -> 253.16 | AH32: =RC[-29] -> 51.57 | AI32: =RC[-29] -> 7.53 | AJ32: =RC[-29] -> 248.7 | AK32: =RC[-29] -> 40.76 | AL32: =RC[-29] -> 5.43 | AM32: =RC[-29] -> 10.810000000000002 | AN32: =RC[-29] -> 4.46 | AO32: =RC[-29] -> 2.9249999999999998 | AP32: =RC[-29] -> 25.54 | AQ32: =RC[-29] -> 64.59 | AR32: - | AS32: =RC[-30] -> 2.62 | AT32: =RC[-30] -> 26.62 | AU32: - | AV32: =RC[-31] -> 37.97 | AW32: =RC[-31] -> 22.92 | AX32: =RC[-31] -> 1.548 | AY32: =RC[-31] -> 4.4729999999999999 | BA32: - | BB32: - | BC32: -
A33: =IF(RC[1]="","",DATEVALUE(RC[1])) -> 43385 | B33: 12.10.18 | C33: 24 | D33: 253.57 | E33: 50.01 | F33: 7.53 | G33: 249.03 | H33: 39.74 | I33: 5.43 | J33: =RC[-5]-RC[-2] -> 10.269999999999996 | K33: 4.54 | L33: 2.7869999999999999 | M33: 27.87 | N33: 64.44 | O33: 2.62 | P33: 26.53 | Q33: =RC[-3]-RC[-1] -> 37.909999999999997 | R33: 25.25 | S33: 1.694 | T33: =RC[-8]+RC[-1] -> 4.4809999999999999 | U33: =(RC[-17]*RC[-16]-RC[-14]*RC[-13])/1000 -> 2.7845834999999988 | V33: 27.34 | W33: 2.62 | X33: =RC[-2]*RC[-10]/1000 -> 1.7617895999999997 | Y33: =(RC[-3]*RC[-11]-RC[-2]*RC[-9])/1000 -> 1.6922809999999999 | Z33: 2013-12-12T00:00:00.000 | AA33: 2013-12-10T00:00:00.000 | AD33: =VALUE(RC[-28]) -> 2018-10-12T00:00:00.000 | AE33: =IF(RC[22]=42,"*",IF(RC[22]=32,"",RC[22])) -> - | AF33: =RC[-29] -> 24 | AG33: =RC[-29] -> 253.57 | AH33: =RC[-29] -> 50.01 | AI33: =RC[-29] -> 7.53 | AJ33: =RC[-29] -> 249.03 | AK33: =RC[-29] -> 39.74 | AL33: =RC[-29] -> 5.43 | AM33: =RC[-29] -> 10.269999999999996 | AN33: =RC[-29] -> 4.54 | AO33: =RC[-29] -> 2.7869999999999999 | AP33: =RC[-29] -> 27.87 | AQ33: =RC[-29] -> 64.44 | AR33: - | AS33: =RC[-30] -> 2.62 | AT33: =RC[-30] -> 26.53 | AU33: - | AV33: =RC[-31] -> 37.909999999999997 | AW33: =RC[-31] -> 25.25 | AX33: =RC[-31] -> 1.694 | AY33: =RC[-31] -> 4.4809999999999999 | BA33: - | BB33: - | BC33: -
A34: =IF(RC[1]="","",DATEVALUE(RC[1])) -> 43386 | B34: 13.10.18 | C34: 24 | D34: 253.87 | E34: 51.26 | F34: 7.53 | G34: 249.1 | H34: 40.75 | I34: 5.43 | J34: =RC[-5]-RC[-2] -> 10.509999999999998 | K34: 4.7699999999999996 | L34: 2.8679999999999999 | M34: 26.11 | N34: 65.5 | O34: 2.61 | P34: 27 | Q34: =RC[-3]-RC[-1] -> 38.5 | R34: 23.5 | S34: 1.6060000000000001 | T34: =RC[-8]+RC[-1] -> 4.4740000000000002 | U34: =(RC[-17]*RC[-16]-RC[-14]*RC[-13])/1000 -> 2.8625512000000017 | V34: 25.62 | W34: 2.61 | X34: =RC[-2]*RC[-10]/1000 -> 1.6781100000000002 | Y34: =(RC[-3]*RC[-11]-RC[-2]*RC[-9])/1000 -> 1.6076400000000002 | Z34: 2013-12-13T00:00:00.000 | AA34: 2013-12-11T00:00:00.000 | AD34: =VALUE(RC[-28]) -> 2018-10-13T00:00:00.000 | AE34: =IF(RC[22]=42,"*",IF(RC[22]=32,"",RC[22])) -> - | AF34: =RC[-29] -> 24 | AG34: =RC[-29] -> 253.87 | AH34: =RC[-29] -> 51.26 | AI34: =RC[-29] -> 7.53 | AJ34: =RC[-29] -> 249.1 | AK34: =RC[-29] -> 40.75 | AL34: =RC[-29] -> 5.43 | AM34: =RC[-29] -> 10.509999999999998 | AN34: =RC[-29] -> 4.7699999999999996 | AO34: =RC[-29] -> 2.8679999999999999 | AP34: =RC[-29] -> 26.11 | AQ34: =RC[-29] -> 65.5 | AR34: - | AS34: =RC[-30] -> 2.61 | AT34: =RC[-30] -> 27 | AU34: - | AV34: =RC[-31] -> 38.5 | AW34: =RC[-31] -> 23.5 | AX34: =RC[-31] -> 1.6060000000000001 | AY34: =RC[-31] -> 4.4740000000000002 | BA34: - | BB34: - | BC34: -
A35: =IF(RC[1]="","",DATEVALUE(RC[1])) -> 43387 | B35: 14.10.18 | C35: 24 | D35: 253.74 | E35: 50.52 | F35: 7.53 | G35: 248.94 | H35: 40.71 | I35: 5.43 | J35: =RC[-5]-RC[-2] -> 9.8100000000000023 | K35: 4.8 | L35: 2.6920000000000002 | M35: 29.24 | N35: 66.510000000000005 | O35: 2.61 | P35: 27.67 | Q35: =RC[-3]-RC[-1] -> 38.840000000000003 | R35: 26.63 | S35: 1.8340000000000001 | T35: =RC[-8]+RC[-1] -> 4.5259999999999998 | U35: =(RC[-17]*RC[-16]-RC[-14]*RC[-13])/1000 -> 2.6845974000000004 | V35: 28.67 | W35: 2.61 | X35: =RC[-2]*RC[-10]/1000 -> 1.9068417000000002 | Y35: =(RC[-3]*RC[-11]-RC[-2]*RC[-9])/1000 -> 1.8346230000000003 | Z35: 2013-12-14T00:00:00.000 | AA35: 2013-12-12T00:00:00.000 | AD35: =VALUE(RC[-28]) -> 2018-10-14T00:00:00.000 | AE35: =IF(RC[22]=42,"*",IF(RC[22]=32,"",RC[22])) -> - | AF35: =RC[-29] -> 24 | AG35: =RC[-29] -> 253.74 | AH35: =RC[-29] -> 50.52 | AI35: =RC[-29] -> 7.53 | AJ35: =RC[-29] -> 248.94 | AK35: =RC[-29] -> 40.71 | AL35: =RC[-29] -> 5.43 | AM35: =RC[-29] -> 9.8100000000000023 | AN35: =RC[-29] -> 4.8 | AO35: =RC[-29] -> 2.6920000000000002 | AP35: =RC[-29] -> 29.24 | AQ35: =RC[-29] -> 66.510000000000005 | AR35: - | AS35: =RC[-30] -> 2.61 | AT35: =RC[-30] -> 27.67 | AU35: - | AV35: =RC[-31] -> 38.840000000000003 | AW35: =RC[-31] -> 26.63 | AX35: =RC[-31] -> 1.8340000000000001 | AY35: =RC[-31] -> 4.5259999999999998 | BA35: - | BB35: - | BC35: -
A36: =IF(RC[1]="","",DATEVALUE(RC[1])) -> 43388 | B36: 15.10.18 | C36: 24 | D36: 254.76 | E36: 50.54 | F36: 7.53 | G36: 249.85 | H36: 40.950000000000003 | I36: 5.43 | J36: =RC[-5]-RC[-2] -> 9.5899999999999963 | K36: 4.91 | L36: 2.65 | M36: 26.87 | N36: 65.75 | O36: 2.6 | P36: 27.96 | Q36: =RC[-3]-RC[-1] -> 37.79 | R36: 24.27 | S36: 1.659 | T36: =RC[-8]+RC[-1] -> 4.3090000000000002 | U36: =(RC[-17]*RC[-16]-RC[-14]*RC[-13])/1000 -> 2.6442128999999985 | V36: 26.35 | W36: 2.6 | X36: =RC[-2]*RC[-10]/1000 -> 1.7325125000000001 | Y36: =(RC[-3]*RC[-11]-RC[-2]*RC[-9])/1000 -> 1.6598165 | Z36: 2013-12-15T00:00:00.000 | AA36: 2013-12-13T00:00:00.000 | AD36: =VALUE(RC[-28]) -> 2018-10-15T00:00:00.000 | AE36: =IF(RC[22]=42,"*",IF(RC[22]=32,"",RC[22])) -> - | AF36: =RC[-29] -> 24 | AG36: =RC[-29] -> 254.76 | AH36: =RC[-29] -> 50.54 | AI36: =RC[-29] -> 7.53 | AJ36: =RC[-29] -> 249.85 | AK36: =RC[-29] -> 40.950000000000003 | AL36: =RC[-29] -> 5.43 | AM36: =RC[-29] -> 9.5899999999999963 | AN36: =RC[-29] -> 4.91 | AO36: =RC[-29] -> 2.65 | AP36: =RC[-29] -> 26.87 | AQ36: =RC[-29] -> 65.75 | AR36: - | AS36: =RC[-30] -> 2.6 | AT36: =RC[-30] -> 27.96 | AU36: - | AV36: =RC[-31] -> 37.79 | AW36: =RC[-31] -> 24.27 | AX36: =RC[-31] -> 1.659 | AY36: =RC[-31] -> 4.3090000000000002 | BA36: - | BB36: - | BC36: -
A37: =IF(RC[1]="","",DATEVALUE(RC[1])) -> 43389 | B37: 16.10.18 | C37: 24 | D37: 257.83 | E37: 49.77 | F37: 7.53 | G37: 252.89 | H37: 40.51 | I37: 5.43 | J37: =RC[-5]-RC[-2] -> 9.2600000000000051 | K37: 4.9400000000000004 | L37: 2.5920000000000001 | M37: 25.95 | N37: 65.37 | O37: 2.59 | P37: 27.88 | Q37: =RC[-3]-RC[-1] -> 37.490000000000009 | R37: 23.36 | S37: 1.593 | T37: =RC[-8]+RC[-1] -> 4.1850000000000005 | U37: =(RC[-17]*RC[-16]-RC[-14]*RC[-13])/1000 -> 2.5876252000000006 | V37: 25.46 | W37: 2.59 | X37: =RC[-2]*RC[-10]/1000 -> 1.6643202000000001 | Y37: =(RC[-3]*RC[-11]-RC[-2]*RC[-9])/1000 -> 1.5921110000000001 | Z37: 2013-12-16T00:00:00.000 | AA37: 2013-12-14T00:00:00.000 | AD37: =VALUE(RC[-28]) -> 2018-10-16T00:00:00.000 | AE37: =IF(RC[22]=42,"*",IF(RC[22]=32,"",RC[22])) -> - | AF37: =RC[-29] -> 24 | AG37: =RC[-29] -> 257.83 | AH37: =RC[-29] -> 49.77 | AI37: =RC[-29] -> 7.53 | AJ37: =RC[-29] -> 252.89 | AK37: =RC[-29] -> 40.51 | AL37: =RC[-29] -> 5.43 | AM37: =RC[-29] -> 9.2600000000000051 | AN37: =RC[-29] -> 4.9400000000000004 | AO37: =RC[-29] -> 2.5920000000000001 | AP37: =RC[-29] -> 25.95 | AQ37: =RC[-29] -> 65.37 | AR37: - | AS37: =RC[-30] -> 2.59 | AT37: =RC[-30] -> 27.88 | AU37: - | AV37: =RC[-31] -> 37.490000000000009 | AW37: =RC[-31] -> 23.36 | AX37: =RC[-31] -> 1.593 | AY37: =RC[-31] -> 4.1850000000000005 | BA37: - | BB37: - | BC37: -
A38: =IF(RC[1]="","",DATEVALUE(RC[1])) -> 43390 | B38: 17.10.18 | C38: 24 | D38: 259.99 | E38: 50.79 | F38: 7.53 | G38: 254.9 | H38: 41.2 | I38: 5.43 | J38: =RC[-5]-RC[-2] -> 9.5899999999999963 | K38: 5.09 | L38: 2.71 | M38: 25.87 | N38: 65.010000000000005 | O38: 2.59 | P38: 27.85 | Q38: =RC[-3]-RC[-1] -> 37.160000000000004 | R38: 23.28 | S38: 1.579 | T38: =RC[-8]+RC[-1] -> 4.2889999999999997 | U38: =(RC[-17]*RC[-16]-RC[-14]*RC[-13])/1000 -> 2.7030121 | V38: 25.39 | W38: 2.59 | X38: =RC[-2]*RC[-10]/1000 -> 1.6506039000000001 | Y38: =(RC[-3]*RC[-11]-RC[-2]*RC[-9])/1000 -> 1.5784724000000001 | Z38: 2013-12-17T00:00:00.000 | AA38: 2013-12-15T00:00:00.000 | AD38: =VALUE(RC[-28]) -> 2018-10-17T00:00:00.000 | AE38: =IF(RC[22]=42,"*",IF(RC[22]=32,"",RC[22])) -> - | AF38: =RC[-29] -> 24 | AG38: =RC[-29] -> 259.99 | AH38: =RC[-29] -> 50.79 | AI38: =RC[-29] -> 7.53 | AJ38: =RC[-29] -> 254.9 | AK38: =RC[-29] -> 41.2 | AL38: =RC[-29] -> 5.43 | AM38: =RC[-29] -> 9.5899999999999963 | AN38: =RC[-29] -> 5.09 | AO38: =RC[-29] -> 2.71 | AP38: =RC[-29] -> 25.87 | AQ38: =RC[-29] -> 65.010000000000005 | AR38: - | AS38: =RC[-30] -> 2.59 | AT38: =RC[-30] -> 27.85 | AU38: - | AV38: =RC[-31] -> 37.160000000000004 | AW38: =RC[-31] -> 23.28 | AX38: =RC[-31] -> 1.579 | AY38: =RC[-31] -> 4.2889999999999997 | BA38: - | BB38: - | BC38: -
A39: =IF(RC[1]="","",DATEVALUE(RC[1])) -> 43391 | B39: 18.10.18 | C39: 24 | D39: 260.08 | E39: 51.02 | F39: 7.53 | G39: 255.01 | H39: 41.28 | I39: 5.43 | J39: =RC[-5]-RC[-2] -> 9.740000000000002 | K39: 5.07 | L39: 2.7490000000000001 | M39: 24.9 | N39: 65.33 | O39: 2.57 | P39: 27.96 | Q39: =RC[-3]-RC[-1] -> 37.369999999999997 | R39: 22.33 | S39: 1.524 | T39: =RC[-8]+RC[-1] -> 4.2729999999999997 | U39: =(RC[-17]*RC[-16]-RC[-14]*RC[-13])/1000 -> 2.7424688000000006 | V39: 24.43 | W39: 2.57 | X39: =RC[-2]*RC[-10]/1000 -> 1.5960118999999999 | Y39: =(RC[-3]*RC[-11]-RC[-2]*RC[-9])/1000 -> 1.5241547 | Z39: 2013-12-18T00:00:00.000 | AA39: 2013-12-16T00:00:00.000 | AD39: =VALUE(RC[-28]) -> 2018-10-18T00:00:00.000 | AE39: =IF(RC[22]=42,"*",IF(RC[22]=32,"",RC[22])) -> - | AF39: =RC[-29] -> 24 | AG39: =RC[-29] -> 260.08 | AH39: =RC[-29] -> 51.02 | AI39: =RC[-29] -> 7.53 | AJ39: =RC[-29] -> 255.01 | AK39: =RC[-29] -> 41.28 | AL39: =RC[-29] -> 5.43 | AM39: =RC[-29] -> 9.740000000000002 | AN39: =RC[-29] -> 5.07 | AO39: =RC[-29] -> 2.7490000000000001 | AP39: =RC[-29] -> 24.9 | AQ39: =RC[-29] -> 65.33 | AR39: - | AS39: =RC[-30] -> 2.57 | AT39: =RC[-30] -> 27.96 | AU39: - | AV39: =RC[-31] -> 37.369999999999997 | AW39: =RC[-31] -> 22.33 | AX39: =RC[-31] -> 1.524 | AY39: =RC[-31] -> 4.2729999999999997 | BA39: - | BB39: - | BC39: -
A40: =IF(RC[1]="","",DATEVALUE(RC[1])) -> 43392 | B40: 19.10.18 | C40: 24 | D40: 260.19 | E40: 50.89 | F40: 7.53 | G40: 255.2 | H40: 40.950000000000003 | I40: 5.43 | J40: =RC[-5]-RC[-2] -> 9.9399999999999977 | K40: 4.99 | L40: 2.7970000000000002 | M40: 26.62 | N40: 65.319999999999993 | O40: 2.56 | P40: 27.65 | Q40: =RC[-3]-RC[-1] -> 37.669999999999995 | R40: 24.06 | S40: 1.6339999999999999 | T40: =RC[-8]+RC[-1] -> 4.431 | U40: =(RC[-17]*RC[-16]-RC[-14]*RC[-13])/1000 -> 2.7906291000000003 | V40: 26.11 | W40: 2.56 | X40: =RC[-2]*RC[-10]/1000 -> 1.7055051999999997 | Y40: =(RC[-3]*RC[-11]-RC[-2]*RC[-9])/1000 -> 1.6347212 | Z40: 2013-12-19T00:00:00.000 | AA40: 2013-12-17T00:00:00.000 | AD40: =VALUE(RC[-28]) -> 2018-10-19T00:00:00.000 | AE40: =IF(RC[22]=42,"*",IF(RC[22]=32,"",RC[22])) -> - | AF40: =RC[-29] -> 24 | AG40: =RC[-29] -> 260.19 | AH40: =RC[-29] -> 50.89 | AI40: =RC[-29] -> 7.53 | AJ40: =RC[-29] -> 255.2 | AK40: =RC[-29] -> 40.950000000000003 | AL40: =RC[-29] -> 5.43 | AM40: =RC[-29] -> 9.9399999999999977 | AN40: =RC[-29] -> 4.99 | AO40: =RC[-29] -> 2.7970000000000002 | AP40: =RC[-29] -> 26.62 | AQ40: =RC[-29] -> 65.319999999999993 | AR40: - | AS40: =RC[-30] -> 2.56 | AT40: =RC[-30] -> 27.65 | AU40: - | AV40: =RC[-31] -> 37.669999999999995 | AW40: =RC[-31] -> 24.06 | AX40: =RC[-31] -> 1.6339999999999999 | AY40: =RC[-31] -> 4.431 | BA40: - | BB40: - | BC40: -
A41: =IF(RC[1]="","",DATEVALUE(RC[1])) -> 43393 | B41: 20.10.18 | C41: 24 | D41: 260.22000000000003 | E41: 51.14 | F41: 7.53 | G41: 255.24 | H41: 40.770000000000003 | I41: 5.43 | J41: =RC[-5]-RC[-2] -> 10.369999999999997 | K41: 4.9800000000000004 | L41: 2.907 | M41: 26.6 | N41: 64.97 | O41: 2.54 | P41: 27.03 | Q41: =RC[-3]-RC[-1] -> 37.94 | R41: 24.06 | S41: 1.6259999999999999 | T41: =RC[-8]+RC[-1] -> 4.5329999999999995 | U41: =(RC[-17]*RC[-16]-RC[-14]*RC[-13])/1000 -> 2.9015159999999995 | V41: 26.09 | W41: 2.54 | X41: =RC[-2]*RC[-10]/1000 -> 1.6950672999999998 | Y41: =(RC[-3]*RC[-11]-RC[-2]*RC[-9])/1000 -> 1.6264111000000001 | Z41: 2013-12-20T00:00:00.000 | AA41: 2013-12-18T00:00:00.000 | AD41: =VALUE(RC[-28]) -> 2018-10-20T00:00:00.000 | AE41: =IF(RC[22]=42,"*",IF(RC[22]=32,"",RC[22])) -> - | AF41: =RC[-29] -> 24 | AG41: =RC[-29] -> 260.22000000000003 | AH41: =RC[-29] -> 51.14 | AI41: =RC[-29] -> 7.53 | AJ41: =RC[-29] -> 255.24 | AK41: =RC[-29] -> 40.770000000000003 | AL41: =RC[-29] -> 5.43 | AM41: =RC[-29] -> 10.369999999999997 | AN41: =RC[-29] -> 4.9800000000000004 | AO41: =RC[-29] -> 2.907 | AP41: =RC[-29] -> 26.6 | AQ41: =RC[-29] -> 64.97 | AR41: - | AS41: =RC[-30] -> 2.54 | AT41: =RC[-30] -> 27.03 | AU41: - | AV41: =RC[-31] -> 37.94 | AW41: =RC[-31] -> 24.06 | AX41: =RC[-31] -> 1.6259999999999999 | AY41: =RC[-31] -> 4.5329999999999995 | BA41: - | BB41: - | BC41: -
A42: =IF(RC[1]="","",DATEVALUE(RC[1])) -> 43394 | B42: 21.10.18 | C42: 24 | D42: 260.26 | E42: 51.84 | F42: 7.53 | G42: 255.29 | H42: 41.18 | I42: 5.43 | J42: =RC[-5]-RC[-2] -> 10.660000000000004 | K42: 4.97 | L42: 2.984 | M42: 32.520000000000003 | N42: 64.790000000000006 | O42: 2.54 | P42: 26.89 | Q42: =RC[-3]-RC[-1] -> 37.900000000000006 | R42: 29.98 | S42: 2 | T42: =RC[-8]+RC[-1] -> 4.984 | U42: =(RC[-17]*RC[-16]-RC[-14]*RC[-13])/1000 -> 2.9790362000000004 | V42: 31.91 | W42: 2.54 | X42: =RC[-2]*RC[-10]/1000 -> 2.0674489000000005 | Y42: =(RC[-3]*RC[-11]-RC[-2]*RC[-9])/1000 -> 1.9991483000000003 | Z42: 2013-12-21T00:00:00.000 | AA42: 2013-12-19T00:00:00.000 | AD42: =VALUE(RC[-28]) -> 2018-10-21T00:00:00.000 | AE42: =IF(RC[22]=42,"*",IF(RC[22]=32,"",RC[22])) -> - | AF42: =RC[-29] -> 24 | AG42: =RC[-29] -> 260.26 | AH42: =RC[-29] -> 51.84 | AI42: =RC[-29] -> 7.53 | AJ42: =RC[-29] -> 255.29 | AK42: =RC[-29] -> 41.18 | AL42: =RC[-29] -> 5.43 | AM42: =RC[-29] -> 10.660000000000004 | AN42: =RC[-29] -> 4.97 | AO42: =RC[-29] -> 2.984 | AP42: =RC[-29] -> 32.520000000000003 | AQ42: =RC[-29] -> 64.790000000000006 | AR42: - | AS42: =RC[-30] -> 2.54 | AT42: =RC[-30] -> 26.89 | AU42: - | AV42: =RC[-31] -> 37.900000000000006 | AW42: =RC[-31] -> 29.98 | AX42: =RC[-31] -> 2 | AY42: =RC[-31] -> 4.984 | BA42: - | BB42: - | BC42: -
A43: =IF(RC[1]="","",DATEVALUE(RC[1])) -> 43395 | B43: 22.10.18 | C43: 24 | D43: 260.14 | E43: 53.13 | F43: 7.53 | G43: 255.19 | H43: 41.76 | I43: 5.43 | J43: =RC[-5]-RC[-2] -> 11.370000000000005 | K43: 4.95 | L43: 3.169 | M43: 27.71 | N43: 64.739999999999995 | O43: 2.5299999999999998 | P43: 26.89 | Q43: =RC[-3]-RC[-1] -> 37.849999999999994 | R43: 25.18 | S43: 1.6930000000000001 | T43: =RC[-8]+RC[-1] -> 4.8620000000000001 | U43: =(RC[-17]*RC[-16]-RC[-14]*RC[-13])/1000 -> 3.1645038000000003 | V43: 27.2 | W43: 2.5299999999999998 | X43: =RC[-2]*RC[-10]/1000 -> 1.7609279999999998 | Y43: =(RC[-3]*RC[-11]-RC[-2]*RC[-9])/1000 -> 1.6928962999999999 | Z43: 2013-12-22T00:00:00.000 | AA43: 2013-12-20T00:00:00.000 | AD43: =VALUE(RC[-28]) -> 2018-10-22T00:00:00.000 | AE43: =IF(RC[22]=42,"*",IF(RC[22]=32,"",RC[22])) -> - | AF43: =RC[-29] -> 24 | AG43: =RC[-29] -> 260.14 | AH43: =RC[-29] -> 53.13 | AI43: =RC[-29] -> 7.53 | AJ43: =RC[-29] -> 255.19 | AK43: =RC[-29] -> 41.76 | AL43: =RC[-29] -> 5.43 | AM43: =RC[-29] -> 11.370000000000005 | AN43: =RC[-29] -> 4.95 | AO43: =RC[-29] -> 3.169 | AP43: =RC[-29] -> 27.71 | AQ43: =RC[-29] -> 64.739999999999995 | AR43: - | AS43: =RC[-30] -> 2.5299999999999998 | AT43: =RC[-30] -> 26.89 | AU43: - | AV43: =RC[-31] -> 37.849999999999994 | AW43: =RC[-31] -> 25.18 | AX43: =RC[-31] -> 1.6930000000000001 | AY43: =RC[-31] -> 4.8620000000000001 | BA43: - | BB43: - | BC43: -
A44: =IF(RC[1]="","",DATEVALUE(RC[1])) ->  | C44: 24 | J44: =RC[-5]-RC[-2] -> #VALUE! | Q44: =RC[-3]-RC[-1] -> #VALUE! | T44: =RC[-8]+RC[-1] -> #VALUE! | U44: =(RC[-17]*RC[-16]-RC[-14]*RC[-13])/1000 -> #VALUE! | X44: =RC[-2]*RC[-10]/1000 -> #VALUE! | Y44: =(RC[-3]*RC[-11]-RC[-2]*RC[-9])/1000 -> #VALUE! | AD44: =VALUE(RC[-28]) -> #VALUE! | AE44: =IF(RC[22]=42,"*",IF(RC[22]=32,"",RC[22])) ->  | AF44: =RC[-29] -> 24 | AG44: =RC[-29] ->  | AH44: =RC[-29] ->  | AI44: =RC[-29] ->  | AJ44: =RC[-29] ->  | AK44: =RC[-29] ->  | AL44: =RC[-29] ->  | AM44: =RC[-29] -> #VALUE! | AN44: =RC[-29] ->  | AO44: =RC[-29] ->  | AP44: =RC[-29] ->  | AQ44: =RC[-29] ->  | AR44: - | AS44: =RC[-30] ->  | AT44: =RC[-30] ->  | AU44: - | AV44: =RC[-31] -> #VALUE! | AW44: =RC[-31] ->  | AX44: =RC[-31] ->  | AY44: =RC[-31] -> #VALUE!
A45: =IF(RC[1]="","",DATEVALUE(RC[1])) ->  | C45: 24 | J45: =RC[-5]-RC[-2] -> #VALUE! | Q45: =RC[-3]-RC[-1] -> #VALUE! | T45: =RC[-8]+RC[-1] -> #VALUE! | U45: =(RC[-17]*RC[-16]-RC[-14]*RC[-13])/1000 -> #VALUE! | X45: =RC[-2]*RC[-10]/1000 -> #VALUE! | Y45: =(RC[-3]*RC[-11]-RC[-2]*RC[-9])/1000 -> #VALUE! | AD45: =VALUE(RC[-28]) -> #VALUE! | AE45: =IF(RC[22]=42,"*",IF(RC[22]=32,"",RC[22])) ->  | AF45: =RC[-29] -> 24 | AG45: =RC[-29] ->  | AH45: =RC[-29] ->  | AI45: =RC[-29] ->  | AJ45: =RC[-29] ->  | AK45: =RC[-29] ->  | AL45: =RC[-29] ->  | AM45: =RC[-29] -> #VALUE! | AN45: =RC[-29] ->  | AO45: =RC[-29] ->  | AP45: =RC[-29] ->  | AQ45: =RC[-29] ->  | AR45: - | AS45: =RC[-30] ->  | AT45: =RC[-30] ->  | AU45: - | AV45: =RC[-31] -> #VALUE! | AW45: =RC[-31] ->  | AX45: =RC[-31] ->  | AY45: =RC[-31] -> #VALUE!
A46: =IF(RC[1]="","",DATEVALUE(RC[1])) ->  | C46: 24 | J46: =RC[-5]-RC[-2] -> #VALUE! | Q46: =RC[-3]-RC[-1] -> #VALUE! | T46: =RC[-8]+RC[-1] -> #VALUE! | U46: =(RC[-17]*RC[-16]-RC[-14]*RC[-13])/1000 -> #VALUE! | X46: =RC[-2]*RC[-10]/1000 -> #VALUE! | Y46: =(RC[-3]*RC[-11]-RC[-2]*RC[-9])/1000 -> #VALUE! | AD46: =VALUE(RC[-28]) -> #VALUE! | AE46: =IF(RC[22]=42,"*",IF(RC[22]=32,"",RC[22])) ->  | AF46: =RC[-29] -> 24 | AG46: =RC[-29] ->  | AH46: =RC[-29] ->  | AI46: =RC[-29] ->  | AJ46: =RC[-29] ->  | AK46: =RC[-29] ->  | AL46: =RC[-29] ->  | AM46: =RC[-29] -> #VALUE! | AN46: =RC[-29] ->  | AO46: =RC[-29] ->  | AP46: =RC[-29] ->  | AQ46: =RC[-29] ->  | AR46: - | AS46: =RC[-30] ->  | AT46: =RC[-30] ->  | AU46: - | AV46: =RC[-31] -> #VALUE! | AW46: =RC[-31] ->  | AX46: =RC[-31] ->  | AY46: =RC[-31] -> #VALUE!
A47: =IF(RC[1]="","",DATEVALUE(RC[1])) ->  | C47: 24 | J47: =RC[-5]-RC[-2] -> #VALUE! | Q47: =RC[-3]-RC[-1] -> #VALUE! | T47: =RC[-8]+RC[-1] -> #VALUE! | U47: =(RC[-17]*RC[-16]-RC[-14]*RC[-13])/1000 -> #VALUE! | X47: =RC[-2]*RC[-10]/1000 -> #VALUE! | Y47: =(RC[-3]*RC[-11]-RC[-2]*RC[-9])/1000 -> #VALUE! | AD47: =VALUE(RC[-28]) -> #VALUE! | AE47: =IF(RC[22]=42,"*",IF(RC[22]=32,"",RC[22])) ->  | AF47: =RC[-29] -> 24 | AG47: =RC[-29] ->  | AH47: =RC[-29] ->  | AI47: =RC[-29] ->  | AJ47: =RC[-29] ->  | AK47: =RC[-29] ->  | AL47: =RC[-29] ->  | AM47: =RC[-29] -> #VALUE! | AN47: =RC[-29] ->  | AO47: =RC[-29] ->  | AP47: =RC[-29] ->  | AQ47: =RC[-29] ->  | AR47: - | AS47: =RC[-30] ->  | AT47: =RC[-30] ->  | AU47: - | AV47: =RC[-31] -> #VALUE! | AW47: =RC[-31] ->  | AX47: =RC[-31] ->  | AY47: =RC[-31] -> #VALUE!
A48: =IF(RC[1]="","",DATEVALUE(RC[1])) ->  | C48: 24 | J48: =RC[-5]-RC[-2] -> #VALUE! | Q48: =RC[-3]-RC[-1] -> #VALUE! | T48: =RC[-8]+RC[-1] -> #VALUE! | U48: =(RC[-17]*RC[-16]-RC[-14]*RC[-13])/1000 -> #VALUE! | X48: =RC[-2]*RC[-10]/1000 -> #VALUE! | Y48: =(RC[-3]*RC[-11]-RC[-2]*RC[-9])/1000 -> #VALUE! | AD48: =VALUE(RC[-28]) -> #VALUE! | AE48: =IF(RC[22]=42,"*",IF(RC[22]=32,"",RC[22])) ->  | AF48: =RC[-29] -> 24 | AG48: =RC[-29] ->  | AH48: =RC[-29] ->  | AI48: =RC[-29] ->  | AJ48: =RC[-29] ->  | AK48: =RC[-29] ->  | AL48: =RC[-29] ->  | AM48: =RC[-29] -> #VALUE! | AN48: =RC[-29] ->  | AO48: =RC[-29] ->  | AP48: =RC[-29] ->  | AQ48: =RC[-29] ->  | AR48: - | AS48: =RC[-30] ->  | AT48: =RC[-30] ->  | AU48: - | AV48: =RC[-31] -> #VALUE! | AW48: =RC[-31] ->  | AX48: =RC[-31] ->  | AY48: =RC[-31] -> #VALUE!
A49: =IF(RC[1]="","",DATEVALUE(RC[1])) ->  | C49: 24 | J49: =RC[-5]-RC[-2] -> #VALUE! | Q49: =RC[-3]-RC[-1] -> #VALUE! | T49: =RC[-8]+RC[-1] -> #VALUE! | U49: =(RC[-17]*RC[-16]-RC[-14]*RC[-13])/1000 -> #VALUE! | X49: =RC[-2]*RC[-10]/1000 -> #VALUE! | Y49: =(RC[-3]*RC[-11]-RC[-2]*RC[-9])/1000 -> #VALUE! | AD49: =VALUE(RC[-28]) -> #VALUE! | AE49: =IF(RC[22]=42,"*",IF(RC[22]=32,"",RC[22])) ->  | AF49: =RC[-29] -> 24 | AG49: =RC[-29] ->  | AH49: =RC[-29] ->  | AI49: =RC[-29] ->  | AJ49: =RC[-29] ->  | AK49: =RC[-29] ->  | AL49: =RC[-29] ->  | AM49: =RC[-29] -> #VALUE! | AN49: =RC[-29] ->  | AO49: =RC[-29] ->  | AP49: =RC[-29] ->  | AQ49: =RC[-29] ->  | AR49: - | AS49: =RC[-30] ->  | AT49: =RC[-30] ->  | AU49: - | AV49: =RC[-31] -> #VALUE! | AW49: =RC[-31] ->  | AX49: =RC[-31] ->  | AY49: =RC[-31] -> #VALUE!
A50: =IF(RC[1]="","",DATEVALUE(RC[1])) ->  | C50: 24 | J50: =RC[-5]-RC[-2] -> #VALUE! | Q50: =RC[-3]-RC[-1] -> #VALUE! | T50: =RC[-8]+RC[-1] -> #VALUE! | U50: =(RC[-17]*RC[-16]-RC[-14]*RC[-13])/1000 -> #VALUE! | X50: =RC[-2]*RC[-10]/1000 -> #VALUE! | Y50: =(RC[-3]*RC[-11]-RC[-2]*RC[-9])/1000 -> #VALUE! | AD50: =VALUE(RC[-28]) -> #VALUE! | AE50: =IF(RC[22]=42,"*",IF(RC[22]=32,"",RC[22])) ->  | AF50: =RC[-29] -> 24 | AG50: =RC[-29] ->  | AH50: =RC[-29] ->  | AI50: =RC[-29] ->  | AJ50: =RC[-29] ->  | AK50: =RC[-29] ->  | AL50: =RC[-29] ->  | AM50: =RC[-29] -> #VALUE! | AN50: =RC[-29] ->  | AO50: =RC[-29] ->  | AP50: =RC[-29] ->  | AQ50: =RC[-29] ->  | AR50: - | AS50: =RC[-30] ->  | AT50: =RC[-30] ->  | AU50: - | AV50: =RC[-31] -> #VALUE! | AW50: =RC[-31] ->  | AX50: =RC[-31] ->  | AY50: =RC[-31] -> #VALUE!
A51: =IF(RC[1]="","",DATEVALUE(RC[1])) ->  | C51: 24 | J51: =RC[-5]-RC[-2] -> #VALUE! | Q51: =RC[-3]-RC[-1] -> #VALUE! | T51: =RC[-8]+RC[-1] -> #VALUE! | U51: =(RC[-17]*RC[-16]-RC[-14]*RC[-13])/1000 -> #VALUE! | X51: =RC[-2]*RC[-10]/1000 -> #VALUE! | Y51: =(RC[-3]*RC[-11]-RC[-2]*RC[-9])/1000 -> #VALUE! | AD51: =VALUE(RC[-28]) -> #VALUE! | AE51: =IF(RC[22]=42,"*",IF(RC[22]=32,"",RC[22])) ->  | AF51: =RC[-29] -> 24 | AG51: =RC[-29] ->  | AH51: =RC[-29] ->  | AI51: =RC[-29] ->  | AJ51: =RC[-29] ->  | AK51: =RC[-29] ->  | AL51: =RC[-29] ->  | AM51: =RC[-29] -> #VALUE! | AN51: =RC[-29] ->  | AO51: =RC[-29] ->  | AP51: =RC[-29] ->  | AQ51: =RC[-29] ->  | AR51: - | AS51: =RC[-30] ->  | AT51: =RC[-30] ->  | AU51: - | AV51: =RC[-31] -> #VALUE! | AW51: =RC[-31] ->  | AX51: =RC[-31] ->  | AY51: =RC[-31] -> #VALUE!
A52: =IF(RC[1]="","",DATEVALUE(RC[1])) ->  | C52: 24 | J52: =RC[-5]-RC[-2] -> #VALUE! | Q52: =RC[-3]-RC[-1] -> #VALUE! | T52: =RC[-8]+RC[-1] -> #VALUE! | U52: =(RC[-17]*RC[-16]-RC[-14]*RC[-13])/1000 -> #VALUE! | X52: =RC[-2]*RC[-10]/1000 -> #VALUE! | Y52: =(RC[-3]*RC[-11]-RC[-2]*RC[-9])/1000 -> #VALUE! | AD52: =VALUE(RC[-28]) -> #VALUE! | AE52: =IF(RC[22]=42,"*",IF(RC[22]=32,"",RC[22])) ->  | AF52: =RC[-29] -> 24 | AG52: =RC[-29] ->  | AH52: =RC[-29] ->  | AI52: =RC[-29] ->  | AJ52: =RC[-29] ->  | AK52: =RC[-29] ->  | AL52: =RC[-29] ->  | AM52: =RC[-29] -> #VALUE! | AN52: =RC[-29] ->  | AO52: =RC[-29] ->  | AP52: =RC[-29] ->  | AQ52: =RC[-29] ->  | AR52: - | AS52: =RC[-30] ->  | AT52: =RC[-30] ->  | AU52: - | AV52: =RC[-31] -> #VALUE! | AW52: =RC[-31] ->  | AX52: =RC[-31] ->  | AY52: =RC[-31] -> #VALUE!
A53: =IF(RC[1]="","",DATEVALUE(RC[1])) ->  | C53: 24 | J53: =RC[-5]-RC[-2] -> #VALUE! | Q53: =RC[-3]-RC[-1] -> #VALUE! | T53: =RC[-8]+RC[-1] -> #VALUE! | U53: =(RC[-17]*RC[-16]-RC[-14]*RC[-13])/1000 -> #VALUE! | X53: =RC[-2]*RC[-10]/1000 -> #VALUE! | Y53: =(RC[-3]*RC[-11]-RC[-2]*RC[-9])/1000 -> #VALUE! | AD53: =VALUE(RC[-28]) -> #VALUE! | AE53: =IF(RC[22]=42,"*",IF(RC[22]=32,"",RC[22])) ->  | AF53: =RC[-29] -> 24 | AG53: =RC[-29] ->  | AH53: =RC[-29] ->  | AI53: =RC[-29] ->  | AJ53: =RC[-29] ->  | AK53: =RC[-29] ->  | AL53: =RC[-29] ->  | AM53: =RC[-29] -> #VALUE! | AN53: =RC[-29] ->  | AO53: =RC[-29] ->  | AP53: =RC[-29] ->  | AQ53: =RC[-29] ->  | AR53: - | AS53: =RC[-30] ->  | AT53: =RC[-30] ->  | AU53: - | AV53: =RC[-31] -> #VALUE! | AW53: =RC[-31] ->  | AX53: =RC[-31] ->  | AY53: =RC[-31] -> #VALUE!
A54: =IF(RC[1]="","",DATEVALUE(RC[1])) ->  | C54: 24 | J54: =RC[-5]-RC[-2] -> #VALUE! | Q54: =RC[-3]-RC[-1] -> #VALUE! | T54: =RC[-8]+RC[-1] -> #VALUE! | U54: =(RC[-17]*RC[-16]-RC[-14]*RC[-13])/1000 -> #VALUE! | X54: =RC[-2]*RC[-10]/1000 -> #VALUE! | Y54: =(RC[-3]*RC[-11]-RC[-2]*RC[-9])/1000 -> #VALUE! | AD54: =VALUE(RC[-28]) -> #VALUE! | AE54: =IF(RC[22]=42,"*",IF(RC[22]=32,"",RC[22])) ->  | AF54: =RC[-29] -> 24 | AG54: =RC[-29] ->  | AH54: =RC[-29] ->  | AI54: =RC[-29] ->  | AJ54: =RC[-29] ->  | AK54: =RC[-29] ->  | AL54: =RC[-29] ->  | AM54: =RC[-29] -> #VALUE! | AN54: =RC[-29] ->  | AO54: =RC[-29] ->  | AP54: =RC[-29] ->  | AQ54: =RC[-29] ->  | AR54: - | AS54: =RC[-30] ->  | AT54: =RC[-30] ->  | AU54: - | AV54: =RC[-31] -> #VALUE! | AW54: =RC[-31] ->  | AX54: =RC[-31] ->  | AY54: =RC[-31] -> #VALUE!
A55: =IF(RC[1]="","",DATEVALUE(RC[1])) ->  | C55: 24 | J55: =RC[-5]-RC[-2] -> #VALUE! | Q55: =RC[-3]-RC[-1] -> #VALUE! | T55: =RC[-8]+RC[-1] -> #VALUE! | U55: =(RC[-17]*RC[-16]-RC[-14]*RC[-13])/1000 -> #VALUE! | X55: =RC[-2]*RC[-10]/1000 -> #VALUE! | Y55: =(RC[-3]*RC[-11]-RC[-2]*RC[-9])/1000 -> #VALUE! | AD55: =VALUE(RC[-28]) -> #VALUE! | AE55: =IF(RC[22]=42,"*",IF(RC[22]=32,"",RC[22])) ->  | AF55: =RC[-29] -> 24 | AG55: =RC[-29] ->  | AH55: =RC[-29] ->  | AI55: =RC[-29] ->  | AJ55: =RC[-29] ->  | AK55: =RC[-29] ->  | AL55: =RC[-29] ->  | AM55: =RC[-29] -> #VALUE! | AN55: =RC[-29] ->  | AO55: =RC[-29] ->  | AP55: =RC[-29] ->  | AQ55: =RC[-29] ->  | AR55: - | AS55: =RC[-30] ->  | AT55: =RC[-30] ->  | AU55: - | AV55: =RC[-31] -> #VALUE! | AW55: =RC[-31] ->  | AX55: =RC[-31] ->  | AY55: =RC[-31] -> #VALUE!
A56: =IF(RC[1]="","",DATEVALUE(RC[1])) ->  | C56: 24 | J56: =RC[-5]-RC[-2] -> #VALUE! | Q56: =RC[-3]-RC[-1] -> #VALUE! | T56: =RC[-8]+RC[-1] -> #VALUE! | U56: =(RC[-17]*RC[-16]-RC[-14]*RC[-13])/1000 -> #VALUE! | X56: =RC[-2]*RC[-10]/1000 -> #VALUE! | Y56: =(RC[-3]*RC[-11]-RC[-2]*RC[-9])/1000 -> #VALUE! | AD56: =VALUE(RC[-28]) -> #VALUE! | AE56: =IF(RC[22]=42,"*",IF(RC[22]=32,"",RC[22])) ->  | AF56: =RC[-29] -> 24 | AG56: =RC[-29] ->  | AH56: =RC[-29] ->  | AI56: =RC[-29] ->  | AJ56: =RC[-29] ->  | AK56: =RC[-29] ->  | AL56: =RC[-29] ->  | AM56: =RC[-29] -> #VALUE! | AN56: =RC[-29] ->  | AO56: =RC[-29] ->  | AP56: =RC[-29] ->  | AQ56: =RC[-29] ->  | AR56: - | AS56: =RC[-30] ->  | AT56: =RC[-30] ->  | AU56: - | AV56: =RC[-31] -> #VALUE! | AW56: =RC[-31] ->  | AX56: =RC[-31] ->  | AY56: =RC[-31] -> #VALUE!
A57: =IF(RC[1]="","",DATEVALUE(RC[1])) ->  | C57: 24 | J57: =RC[-5]-RC[-2] -> #VALUE! | Q57: =RC[-3]-RC[-1] -> #VALUE! | T57: =RC[-8]+RC[-1] -> #VALUE! | U57: =(RC[-17]*RC[-16]-RC[-14]*RC[-13])/1000 -> #VALUE! | X57: =RC[-2]*RC[-10]/1000 -> #VALUE! | Y57: =(RC[-3]*RC[-11]-RC[-2]*RC[-9])/1000 -> #VALUE! | AD57: =VALUE(RC[-28]) -> #VALUE! | AE57: =IF(RC[22]=42,"*",IF(RC[22]=32,"",RC[22])) ->  | AF57: =RC[-29] -> 24 | AG57: =RC[-29] ->  | AH57: =RC[-29] ->  | AI57: =RC[-29] ->  | AJ57: =RC[-29] ->  | AK57: =RC[-29] ->  | AL57: =RC[-29] ->  | AM57: =RC[-29] -> #VALUE! | AN57: =RC[-29] ->  | AO57: =RC[-29] ->  | AP57: =RC[-29] ->  | AQ57: =RC[-29] ->  | AR57: - | AS57: =RC[-30] ->  | AT57: =RC[-30] ->  | AU57: - | AV57: =RC[-31] -> #VALUE! | AW57: =RC[-31] ->  | AX57: =RC[-31] ->  | AY57: =RC[-31] -> #VALUE!
A58: =IF(RC[1]="","",DATEVALUE(RC[1])) ->  | C58: 24 | J58: =RC[-5]-RC[-2] -> #VALUE! | Q58: =RC[-3]-RC[-1] -> #VALUE! | T58: =RC[-8]+RC[-1] -> #VALUE! | U58: =(RC[-17]*RC[-16]-RC[-14]*RC[-13])/1000 -> #VALUE! | X58: =RC[-2]*RC[-10]/1000 -> #VALUE! | Y58: =(RC[-3]*RC[-11]-RC[-2]*RC[-9])/1000 -> #VALUE! | AD58: =VALUE(RC[-28]) -> #VALUE! | AE58: =IF(RC[22]=42,"*",IF(RC[22]=32,"",RC[22])) ->  | AF58: =RC[-29] -> 24 | AG58: =RC[-29] ->  | AH58: =RC[-29] ->  | AI58: =RC[-29] ->  | AJ58: =RC[-29] ->  | AK58: =RC[-29] ->  | AL58: =RC[-29] ->  | AM58: =RC[-29] -> #VALUE! | AN58: =RC[-29] ->  | AO58: =RC[-29] ->  | AP58: =RC[-29] ->  | AQ58: =RC[-29] ->  | AR58: - | AS58: =RC[-30] ->  | AT58: =RC[-30] ->  | AU58: - | AV58: =RC[-31] -> #VALUE! | AW58: =RC[-31] ->  | AX58: =RC[-31] ->  | AY58: =RC[-31] -> #VALUE!
A59: =IF(RC[1]="","",DATEVALUE(RC[1])) ->  | C59: 24 | J59: =RC[-5]-RC[-2] -> #VALUE! | Q59: =RC[-3]-RC[-1] -> #VALUE! | T59: =RC[-8]+RC[-1] -> #VALUE! | U59: =(RC[-17]*RC[-16]-RC[-14]*RC[-13])/1000 -> #VALUE! | X59: =RC[-2]*RC[-10]/1000 -> #VALUE! | Y59: =(RC[-3]*RC[-11]-RC[-2]*RC[-9])/1000 -> #VALUE! | AD59: =VALUE(RC[-28]) -> #VALUE! | AE59: =IF(RC[22]=42,"*",IF(RC[22]=32,"",RC[22])) ->  | AF59: =RC[-29] -> 24 | AG59: =RC[-29] ->  | AH59: =RC[-29] ->  | AI59: =RC[-29] ->  | AJ59: =RC[-29] ->  | AK59: =RC[-29] ->  | AL59: =RC[-29] ->  | AM59: =RC[-29] -> #VALUE! | AN59: =RC[-29] ->  | AO59: =RC[-29] ->  | AP59: =RC[-29] ->  | AQ59: =RC[-29] ->  | AR59: - | AS59: =RC[-30] ->  | AT59: =RC[-30] ->  | AU59: - | AV59: =RC[-31] -> #VALUE! | AW59: =RC[-31] ->  | AX59: =RC[-31] ->  | AY59: =RC[-31] -> #VALUE!
A60: =IF(RC[1]="","",DATEVALUE(RC[1])) ->  | C60: 24 | J60: =RC[-5]-RC[-2] -> #VALUE! | Q60: =RC[-3]-RC[-1] -> #VALUE! | T60: =RC[-8]+RC[-1] -> #VALUE! | U60: =(RC[-17]*RC[-16]-RC[-14]*RC[-13])/1000 -> #VALUE! | X60: =RC[-2]*RC[-10]/1000 -> #VALUE! | Y60: =(RC[-3]*RC[-11]-RC[-2]*RC[-9])/1000 -> #VALUE! | AD60: =VALUE(RC[-28]) -> #VALUE! | AE60: =IF(RC[22]=42,"*",IF(RC[22]=32,"",RC[22])) ->  | AF60: =RC[-29] -> 24 | AG60: =RC[-29] ->  | AH60: =RC[-29] ->  | AI60: =RC[-29] ->  | AJ60: =RC[-29] ->  | AK60: =RC[-29] ->  | AL60: =RC[-29] ->  | AM60: =RC[-29] -> #VALUE! | AN60: =RC[-29] ->  | AO60: =RC[-29] ->  | AP60: =RC[-29] ->  | AQ60: =RC[-29] ->  | AR60: - | AS60: =RC[-30] ->  | AT60: =RC[-30] ->  | AU60: - | AV60: =RC[-31] -> #VALUE! | AW60: =RC[-31] ->  | AX60: =RC[-31] ->  | AY60: =RC[-31] -> #VALUE!
A61: =IF(RC[1]="","",DATEVALUE(RC[1])) ->  | C61: 24 | J61: =RC[-5]-RC[-2] -> #VALUE! | Q61: =RC[-3]-RC[-1] -> #VALUE! | T61: =RC[-8]+RC[-1] -> #VALUE! | U61: =(RC[-17]*RC[-16]-RC[-14]*RC[-13])/1000 -> #VALUE! | X61: =RC[-2]*RC[-10]/1000 -> #VALUE! | Y61: =(RC[-3]*RC[-11]-RC[-2]*RC[-9])/1000 -> #VALUE! | AD61: =VALUE(RC[-28]) -> #VALUE! | AE61: =IF(RC[22]=42,"*",IF(RC[22]=32,"",RC[22])) ->  | AF61: =RC[-29] -> 24 | AG61: =RC[-29] ->  | AH61: =RC[-29] ->  | AI61: =RC[-29] ->  | AJ61: =RC[-29] ->  | AK61: =RC[-29] ->  | AL61: =RC[-29] ->  | AM61: =RC[-29] -> #VALUE! | AN61: =RC[-29] ->  | AO61: =RC[-29] ->  | AP61: =RC[-29] ->  | AQ61: =RC[-29] ->  | AR61: - | AS61: =RC[-30] ->  | AT61: =RC[-30] ->  | AU61: - | AV61: =RC[-31] -> #VALUE! | AW61: =RC[-31] ->  | AX61: =RC[-31] ->  | AY61: =RC[-31] -> #VALUE!
A62: =IF(RC[1]="","",DATEVALUE(RC[1])) ->  | C62: 24 | J62: =RC[-5]-RC[-2] -> #VALUE! | Q62: =RC[-3]-RC[-1] -> #VALUE! | T62: =RC[-8]+RC[-1] -> #VALUE! | U62: =(RC[-17]*RC[-16]-RC[-14]*RC[-13])/1000 -> #VALUE! | X62: =RC[-2]*RC[-10]/1000 -> #VALUE! | Y62: =(RC[-3]*RC[-11]-RC[-2]*RC[-9])/1000 -> #VALUE! | AD62: =VALUE(RC[-28]) -> #VALUE! | AE62: =IF(RC[22]=42,"*",IF(RC[22]=32,"",RC[22])) ->  | AF62: =RC[-29] -> 24 | AG62: =RC[-29] ->  | AH62: =RC[-29] ->  | AI62: =RC[-29] ->  | AJ62: =RC[-29] ->  | AK62: =RC[-29] ->  | AL62: =RC[-29] ->  | AM62: =RC[-29] -> #VALUE! | AN62: =RC[-29] ->  | AO62: =RC[-29] ->  | AP62: =RC[-29] ->  | AQ62: =RC[-29] ->  | AR62: - | AS62: =RC[-30] ->  | AT62: =RC[-30] ->  | AU62: - | AV62: =RC[-31] -> #VALUE! | AW62: =RC[-31] ->  | AX62: =RC[-31] ->  | AY62: =RC[-31] -> #VALUE!
A63: =IF(RC[1]="","",DATEVALUE(RC[1])) ->  | C63: 24 | J63: =RC[-5]-RC[-2] -> #VALUE! | Q63: =RC[-3]-RC[-1] -> #VALUE! | T63: =RC[-8]+RC[-1] -> #VALUE! | U63: =(RC[-17]*RC[-16]-RC[-14]*RC[-13])/1000 -> #VALUE! | X63: =RC[-2]*RC[-10]/1000 -> #VALUE! | Y63: =(RC[-3]*RC[-11]-RC[-2]*RC[-9])/1000 -> #VALUE! | AD63: =VALUE(RC[-28]) -> #VALUE! | AE63: =IF(RC[22]=42,"*",IF(RC[22]=32,"",RC[22])) ->  | AF63: =RC[-29] -> 24 | AG63: =RC[-29] ->  | AH63: =RC[-29] ->  | AI63: =RC[-29] ->  | AJ63: =RC[-29] ->  | AK63: =RC[-29] ->  | AL63: =RC[-29] ->  | AM63: =RC[-29] -> #VALUE! | AN63: =RC[-29] ->  | AO63: =RC[-29] ->  | AP63: =RC[-29] ->  | AQ63: =RC[-29] ->  | AR63: - | AS63: =RC[-30] ->  | AT63: =RC[-30] ->  | AU63: - | AV63: =RC[-31] -> #VALUE! | AW63: =RC[-31] ->  | AX63: =RC[-31] ->  | AY63: =RC[-31] -> #VALUE!
A64: =IF(RC[1]="","",DATEVALUE(RC[1])) ->  | C64: 24 | J64: =RC[-5]-RC[-2] -> #VALUE! | Q64: =RC[-3]-RC[-1] -> #VALUE! | T64: =RC[-8]+RC[-1] -> #VALUE! | U64: =(RC[-17]*RC[-16]-RC[-14]*RC[-13])/1000 -> #VALUE! | X64: =RC[-2]*RC[-10]/1000 -> #VALUE! | Y64: =(RC[-3]*RC[-11]-RC[-2]*RC[-9])/1000 -> #VALUE! | AD64: =VALUE(RC[-28]) -> #VALUE! | AE64: =IF(RC[22]=42,"*",IF(RC[22]=32,"",RC[22])) ->  | AF64: =RC[-29] -> 24 | AG64: =RC[-29] ->  | AH64: =RC[-29] ->  | AI64: =RC[-29] ->  | AJ64: =RC[-29] ->  | AK64: =RC[-29] ->  | AL64: =RC[-29] ->  | AM64: =RC[-29] -> #VALUE! | AN64: =RC[-29] ->  | AO64: =RC[-29] ->  | AP64: =RC[-29] ->  | AQ64: =RC[-29] ->  | AR64: - | AS64: =RC[-30] ->  | AT64: =RC[-30] ->  | AU64: - | AV64: =RC[-31] -> #VALUE! | AW64: =RC[-31] ->  | AX64: =RC[-31] ->  | AY64: =RC[-31] -> #VALUE!
A65: =IF(RC[1]="","",DATEVALUE(RC[1])) ->  | C65: 24 | J65: =RC[-5]-RC[-2] -> #VALUE! | Q65: =RC[-3]-RC[-1] -> #VALUE! | T65: =RC[-8]+RC[-1] -> #VALUE! | U65: =(RC[-17]*RC[-16]-RC[-14]*RC[-13])/1000 -> #VALUE! | X65: =RC[-2]*RC[-10]/1000 -> #VALUE! | Y65: =(RC[-3]*RC[-11]-RC[-2]*RC[-9])/1000 -> #VALUE! | AD65: =VALUE(RC[-28]) -> #VALUE! | AE65: =IF(RC[22]=42,"*",IF(RC[22]=32,"",RC[22])) ->  | AF65: =RC[-29] -> 24 | AG65: =RC[-29] ->  | AH65: =RC[-29] ->  | AI65: =RC[-29] ->  | AJ65: =RC[-29] ->  | AK65: =RC[-29] ->  | AL65: =RC[-29] ->  | AM65: =RC[-29] -> #VALUE! | AN65: =RC[-29] ->  | AO65: =RC[-29] ->  | AP65: =RC[-29] ->  | AQ65: =RC[-29] ->  | AR65: - | AS65: =RC[-30] ->  | AT65: =RC[-30] ->  | AU65: - | AV65: =RC[-31] -> #VALUE! | AW65: =RC[-31] ->  | AX65: =RC[-31] ->  | AY65: =RC[-31] -> #VALUE!
A66: =IF(RC[1]="","",DATEVALUE(RC[1])) ->  | C66: 24 | J66: =RC[-5]-RC[-2] -> #VALUE! | Q66: =RC[-3]-RC[-1] -> #VALUE! | T66: =RC[-8]+RC[-1] -> #VALUE! | U66: =(RC[-17]*RC[-16]-RC[-14]*RC[-13])/1000 -> #VALUE! | X66: =RC[-2]*RC[-10]/1000 -> #VALUE! | Y66: =(RC[-3]*RC[-11]-RC[-2]*RC[-9])/1000 -> #VALUE! | AD66: =VALUE(RC[-28]) -> #VALUE! | AE66: =IF(RC[22]=42,"*",IF(RC[22]=32,"",RC[22])) ->  | AF66: =RC[-29] -> 24 | AG66: =RC[-29] ->  | AH66: =RC[-29] ->  | AI66: =RC[-29] ->  | AJ66: =RC[-29] ->  | AK66: =RC[-29] ->  | AL66: =RC[-29] ->  | AM66: =RC[-29] -> #VALUE! | AN66: =RC[-29] ->  | AO66: =RC[-29] ->  | AP66: =RC[-29] ->  | AQ66: =RC[-29] ->  | AR66: - | AS66: =RC[-30] ->  | AT66: =RC[-30] ->  | AU66: - | AV66: =RC[-31] -> #VALUE! | AW66: =RC[-31] ->  | AX66: =RC[-31] ->  | AY66: =RC[-31] -> #VALUE!
A67: =IF(RC[1]="","",DATEVALUE(RC[1])) ->  | C67: 24 | J67: =RC[-5]-RC[-2] -> #VALUE! | Q67: =RC[-3]-RC[-1] -> #VALUE! | T67: =RC[-8]+RC[-1] -> #VALUE! | U67: =(RC[-17]*RC[-16]-RC[-14]*RC[-13])/1000 -> #VALUE! | X67: =RC[-2]*RC[-10]/1000 -> #VALUE! | Y67: =(RC[-3]*RC[-11]-RC[-2]*RC[-9])/1000 -> #VALUE! | AD67: =VALUE(RC[-28]) -> #VALUE! | AE67: =IF(RC[22]=42,"*",IF(RC[22]=32,"",RC[22])) ->  | AF67: =RC[-29] -> 24 | AG67: =RC[-29] ->  | AH67: =RC[-29] ->  | AI67: =RC[-29] ->  | AJ67: =RC[-29] ->  | AK67: =RC[-29] ->  | AL67: =RC[-29] ->  | AM67: =RC[-29] -> #VALUE! | AN67: =RC[-29] ->  | AO67: =RC[-29] ->  | AP67: =RC[-29] ->  | AQ67: =RC[-29] ->  | AR67: - | AS67: =RC[-30] ->  | AT67: =RC[-30] ->  | AU67: - | AV67: =RC[-31] -> #VALUE! | AW67: =RC[-31] ->  | AX67: =RC[-31] ->  | AY67: =RC[-31] -> #VALUE!
A68: =IF(RC[1]="","",DATEVALUE(RC[1])) ->  | C68: 24 | J68: =RC[-5]-RC[-2] -> #VALUE! | Q68: =RC[-3]-RC[-1] -> #VALUE! | T68: =RC[-8]+RC[-1] -> #VALUE! | U68: =(RC[-17]*RC[-16]-RC[-14]*RC[-13])/1000 -> #VALUE! | X68: =RC[-2]*RC[-10]/1000 -> #VALUE! | Y68: =(RC[-3]*RC[-11]-RC[-2]*RC[-9])/1000 -> #VALUE! | AD68: =VALUE(RC[-28]) -> #VALUE! | AE68: =IF(RC[22]=42,"*",IF(RC[22]=32,"",RC[22])) ->  | AF68: =RC[-29] -> 24 | AG68: =RC[-29] ->  | AH68: =RC[-29] ->  | AI68: =RC[-29] ->  | AJ68: =RC[-29] ->  | AK68: =RC[-29] ->  | AL68: =RC[-29] ->  | AM68: =RC[-29] -> #VALUE! | AN68: =RC[-29] ->  | AO68: =RC[-29] ->  | AP68: =RC[-29] ->  | AQ68: =RC[-29] ->  | AR68: - | AS68: =RC[-30] ->  | AT68: =RC[-30] ->  | AU68: - | AV68: =RC[-31] -> #VALUE! | AW68: =RC[-31] ->  | AX68: =RC[-31] ->  | AY68: =RC[-31] -> #VALUE!
A69: =IF(RC[1]="","",DATEVALUE(RC[1])) ->  | C69: 24 | J69: =RC[-5]-RC[-2] -> #VALUE! | Q69: =RC[-3]-RC[-1] -> #VALUE! | T69: =RC[-8]+RC[-1] -> #VALUE! | U69: =(RC[-17]*RC[-16]-RC[-14]*RC[-13])/1000 -> #VALUE! | X69: =RC[-2]*RC[-10]/1000 -> #VALUE! | Y69: =(RC[-3]*RC[-11]-RC[-2]*RC[-9])/1000 -> #VALUE! | AD69: =VALUE(RC[-28]) -> #VALUE! | AE69: =IF(RC[22]=42,"*",IF(RC[22]=32,"",RC[22])) ->  | AF69: =RC[-29] -> 24 | AG69: =RC[-29] ->  | AH69: =RC[-29] ->  | AI69: =RC[-29] ->  | AJ69: =RC[-29] ->  | AK69: =RC[-29] ->  | AL69: =RC[-29] ->  | AM69: =RC[-29] -> #VALUE! | AN69: =RC[-29] ->  | AO69: =RC[-29] ->  | AP69: =RC[-29] ->  | AQ69: =RC[-29] ->  | AR69: - | AS69: =RC[-30] ->  | AT69: =RC[-30] ->  | AU69: - | AV69: =RC[-31] -> #VALUE! | AW69: =RC[-31] ->  | AX69: =RC[-31] ->  | AY69: =RC[-31] -> #VALUE!
A70: =IF(RC[1]="","",DATEVALUE(RC[1])) ->  | C70: 24 | J70: =RC[-5]-RC[-2] -> #VALUE! | Q70: =RC[-3]-RC[-1] -> #VALUE! | T70: =RC[-8]+RC[-1] -> #VALUE! | U70: =(RC[-17]*RC[-16]-RC[-14]*RC[-13])/1000 -> #VALUE! | X70: =RC[-2]*RC[-10]/1000 -> #VALUE! | Y70: =(RC[-3]*RC[-11]-RC[-2]*RC[-9])/1000 -> #VALUE! | AD70: =VALUE(RC[-28]) -> #VALUE! | AE70: =IF(RC[22]=42,"*",IF(RC[22]=32,"",RC[22])) ->  | AF70: =RC[-29] -> 24 | AG70: =RC[-29] ->  | AH70: =RC[-29] ->  | AI70: =RC[-29] ->  | AJ70: =RC[-29] ->  | AK70: =RC[-29] ->  | AL70: =RC[-29] ->  | AM70: =RC[-29] -> #VALUE! | AN70: =RC[-29] ->  | AO70: =RC[-29] ->  | AP70: =RC[-29] ->  | AQ70: =RC[-29] ->  | AR70: - | AS70: =RC[-30] ->  | AT70: =RC[-30] ->  | AU70: - | AV70: =RC[-31] -> #VALUE! | AW70: =RC[-31] ->  | AX70: =RC[-31] ->  | AY70: =RC[-31] -> #VALUE!
A71: =IF(RC[1]="","",DATEVALUE(RC[1])) ->  | C71: 24 | J71: =RC[-5]-RC[-2] -> #VALUE! | Q71: =RC[-3]-RC[-1] -> #VALUE! | T71: =RC[-8]+RC[-1] -> #VALUE! | U71: =(RC[-17]*RC[-16]-RC[-14]*RC[-13])/1000 -> #VALUE! | X71: =RC[-2]*RC[-10]/1000 -> #VALUE! | Y71: =(RC[-3]*RC[-11]-RC[-2]*RC[-9])/1000 -> #VALUE! | AD71: =VALUE(RC[-28]) -> #VALUE! | AE71: =IF(RC[22]=42,"*",IF(RC[22]=32,"",RC[22])) ->  | AF71: =RC[-29] -> 24 | AG71: =RC[-29] ->  | AH71: =RC[-29] ->  | AI71: =RC[-29] ->  | AJ71: =RC[-29] ->  | AK71: =RC[-29] ->  | AL71: =RC[-29] ->  | AM71: =RC[-29] -> #VALUE! | AN71: =RC[-29] ->  | AO71: =RC[-29] ->  | AP71: =RC[-29] ->  | AQ71: =RC[-29] ->  | AR71: - | AS71: =RC[-30] ->  | AT71: =RC[-30] ->  | AU71: - | AV71: =RC[-31] -> #VALUE! | AW71: =RC[-31] ->  | AX71: =RC[-31] ->  | AY71: =RC[-31] -> #VALUE!
A72: =IF(RC[1]="","",DATEVALUE(RC[1])) ->  | C72: 24 | J72: =RC[-5]-RC[-2] -> #VALUE! | Q72: =RC[-3]-RC[-1] -> #VALUE! | T72: =RC[-8]+RC[-1] -> #VALUE! | U72: =(RC[-17]*RC[-16]-RC[-14]*RC[-13])/1000 -> #VALUE! | X72: =RC[-2]*RC[-10]/1000 -> #VALUE! | Y72: =(RC[-3]*RC[-11]-RC[-2]*RC[-9])/1000 -> #VALUE! | AD72: =VALUE(RC[-28]) -> #VALUE! | AE72: =IF(RC[22]=42,"*",IF(RC[22]=32,"",RC[22])) ->  | AF72: =RC[-29] -> 24 | AG72: =RC[-29] ->  | AH72: =RC[-29] ->  | AI72: =RC[-29] ->  | AJ72: =RC[-29] ->  | AK72: =RC[-29] ->  | AL72: =RC[-29] ->  | AM72: =RC[-29] -> #VALUE! | AN72: =RC[-29] ->  | AO72: =RC[-29] ->  | AP72: =RC[-29] ->  | AQ72: =RC[-29] ->  | AR72: - | AS72: =RC[-30] ->  | AT72: =RC[-30] ->  | AU72: - | AV72: =RC[-31] -> #VALUE! | AW72: =RC[-31] ->  | AX72: =RC[-31] ->  | AY72: =RC[-31] -> #VALUE!
A73: =IF(RC[1]="","",DATEVALUE(RC[1])) ->  | C73: 24 | J73: =RC[-5]-RC[-2] -> #VALUE! | Q73: =RC[-3]-RC[-1] -> #VALUE! | T73: =RC[-8]+RC[-1] -> #VALUE! | U73: =(RC[-17]*RC[-16]-RC[-14]*RC[-13])/1000 -> #VALUE! | X73: =RC[-2]*RC[-10]/1000 -> #VALUE! | Y73: =(RC[-3]*RC[-11]-RC[-2]*RC[-9])/1000 -> #VALUE! | AD73: =VALUE(RC[-28]) -> #VALUE! | AE73: =IF(RC[22]=42,"*",IF(RC[22]=32,"",RC[22])) ->  | AF73: =RC[-29] -> 24 | AG73: =RC[-29] ->  | AH73: =RC[-29] ->  | AI73: =RC[-29] ->  | AJ73: =RC[-29] ->  | AK73: =RC[-29] ->  | AL73: =RC[-29] ->  | AM73: =RC[-29] -> #VALUE! | AN73: =RC[-29] ->  | AO73: =RC[-29] ->  | AP73: =RC[-29] ->  | AQ73: =RC[-29] ->  | AR73: - | AS73: =RC[-30] ->  | AT73: =RC[-30] ->  | AU73: - | AV73: =RC[-31] -> #VALUE! | AW73: =RC[-31] ->  | AX73: =RC[-31] ->  | AY73: =RC[-31] -> #VALUE!
A74: =IF(RC[1]="","",DATEVALUE(RC[1])) ->  | C74: 24 | J74: =RC[-5]-RC[-2] -> #VALUE! | Q74: =RC[-3]-RC[-1] -> #VALUE! | T74: =RC[-8]+RC[-1] -> #VALUE! | U74: =(RC[-17]*RC[-16]-RC[-14]*RC[-13])/1000 -> #VALUE! | X74: =RC[-2]*RC[-10]/1000 -> #VALUE! | Y74: =(RC[-3]*RC[-11]-RC[-2]*RC[-9])/1000 -> #VALUE! | AD74: =VALUE(RC[-28]) -> #VALUE! | AE74: =IF(RC[22]=42,"*",IF(RC[22]=32,"",RC[22])) ->  | AF74: =RC[-29] -> 24 | AG74: =RC[-29] ->  | AH74: =RC[-29] ->  | AI74: =RC[-29] ->  | AJ74: =RC[-29] ->  | AK74: =RC[-29] ->  | AL74: =RC[-29] ->  | AM74: =RC[-29] -> #VALUE! | AN74: =RC[-29] ->  | AO74: =RC[-29] ->  | AP74: =RC[-29] ->  | AQ74: =RC[-29] ->  | AR74: - | AS74: =RC[-30] ->  | AT74: =RC[-30] ->  | AU74: - | AV74: =RC[-31] -> #VALUE! | AW74: =RC[-31] ->  | AX74: =RC[-31] ->  | AY74: =RC[-31] -> #VALUE!
A75: =IF(RC[1]="","",DATEVALUE(RC[1])) ->  | C75: 24 | J75: =RC[-5]-RC[-2] -> #VALUE! | Q75: =RC[-3]-RC[-1] -> #VALUE! | T75: =RC[-8]+RC[-1] -> #VALUE! | U75: =(RC[-17]*RC[-16]-RC[-14]*RC[-13])/1000 -> #VALUE! | X75: =RC[-2]*RC[-10]/1000 -> #VALUE! | Y75: =(RC[-3]*RC[-11]-RC[-2]*RC[-9])/1000 -> #VALUE! | AD75: =VALUE(RC[-28]) -> #VALUE! | AE75: =IF(RC[22]=42,"*",IF(RC[22]=32,"",RC[22])) ->  | AF75: =RC[-29] -> 24 | AG75: =RC[-29] ->  | AH75: =RC[-29] ->  | AI75: =RC[-29] ->  | AJ75: =RC[-29] ->  | AK75: =RC[-29] ->  | AL75: =RC[-29] ->  | AM75: =RC[-29] -> #VALUE! | AN75: =RC[-29] ->  | AO75: =RC[-29] ->  | AP75: =RC[-29] ->  | AQ75: =RC[-29] ->  | AR75: - | AS75: =RC[-30] ->  | AT75: =RC[-30] ->  | AU75: - | AV75: =RC[-31] -> #VALUE! | AW75: =RC[-31] ->  | AX75: =RC[-31] ->  | AY75: =RC[-31] -> #VALUE!
A76: =IF(RC[1]="","",DATEVALUE(RC[1])) ->  | C76: 24 | J76: =RC[-5]-RC[-2] -> #VALUE! | Q76: =RC[-3]-RC[-1] -> #VALUE! | T76: =RC[-8]+RC[-1] -> #VALUE! | U76: =(RC[-17]*RC[-16]-RC[-14]*RC[-13])/1000 -> #VALUE! | X76: =RC[-2]*RC[-10]/1000 -> #VALUE! | Y76: =(RC[-3]*RC[-11]-RC[-2]*RC[-9])/1000 -> #VALUE! | AD76: =VALUE(RC[-28]) -> #VALUE! | AE76: =IF(RC[22]=42,"*",IF(RC[22]=32,"",RC[22])) ->  | AF76: =RC[-29] -> 24 | AG76: =RC[-29] ->  | AH76: =RC[-29] ->  | AI76: =RC[-29] ->  | AJ76: =RC[-29] ->  | AK76: =RC[-29] ->  | AL76: =RC[-29] ->  | AM76: =RC[-29] -> #VALUE! | AN76: =RC[-29] ->  | AO76: =RC[-29] ->  | AP76: =RC[-29] ->  | AQ76: =RC[-29] ->  | AR76: - | AS76: =RC[-30] ->  | AT76: =RC[-30] ->  | AU76: - | AV76: =RC[-31] -> #VALUE! | AW76: =RC[-31] ->  | AX76: =RC[-31] ->  | AY76: =RC[-31] -> #VALUE!
A77: =IF(RC[1]="","",DATEVALUE(RC[1])) ->  | C77: 24 | J77: =RC[-5]-RC[-2] -> #VALUE! | Q77: =RC[-3]-RC[-1] -> #VALUE! | T77: =RC[-8]+RC[-1] -> #VALUE! | U77: =(RC[-17]*RC[-16]-RC[-14]*RC[-13])/1000 -> #VALUE! | X77: =RC[-2]*RC[-10]/1000 -> #VALUE! | Y77: =(RC[-3]*RC[-11]-RC[-2]*RC[-9])/1000 -> #VALUE! | AD77: =VALUE(RC[-28]) -> #VALUE! | AE77: =IF(RC[22]=42,"*",IF(RC[22]=32,"",RC[22])) ->  | AF77: =RC[-29] -> 24 | AG77: =RC[-29] ->  | AH77: =RC[-29] ->  | AI77: =RC[-29] ->  | AJ77: =RC[-29] ->  | AK77: =RC[-29] ->  | AL77: =RC[-29] ->  | AM77: =RC[-29] -> #VALUE! | AN77: =RC[-29] ->  | AO77: =RC[-29] ->  | AP77: =RC[-29] ->  | AQ77: =RC[-29] ->  | AR77: - | AS77: =RC[-30] ->  | AT77: =RC[-30] ->  | AU77: - | AV77: =RC[-31] -> #VALUE! | AW77: =RC[-31] ->  | AX77: =RC[-31] ->  | AY77: =RC[-31] -> #VALUE!
A78: =IF(RC[1]="","",DATEVALUE(RC[1])) ->  | C78: 24 | J78: =RC[-5]-RC[-2] -> #VALUE! | Q78: =RC[-3]-RC[-1] -> #VALUE! | T78: =RC[-8]+RC[-1] -> #VALUE! | U78: =(RC[-17]*RC[-16]-RC[-14]*RC[-13])/1000 -> #VALUE! | X78: =RC[-2]*RC[-10]/1000 -> #VALUE! | Y78: =(RC[-3]*RC[-11]-RC[-2]*RC[-9])/1000 -> #VALUE! | AD78: =VALUE(RC[-28]) -> #VALUE! | AE78: =IF(RC[22]=42,"*",IF(RC[22]=32,"",RC[22])) ->  | AF78: =RC[-29] -> 24 | AG78: =RC[-29] ->  | AH78: =RC[-29] ->  | AI78: =RC[-29] ->  | AJ78: =RC[-29] ->  | AK78: =RC[-29] ->  | AL78: =RC[-29] ->  | AM78: =RC[-29] -> #VALUE! | AN78: =RC[-29] ->  | AO78: =RC[-29] ->  | AP78: =RC[-29] ->  | AQ78: =RC[-29] ->  | AR78: - | AS78: =RC[-30] ->  | AT78: =RC[-30] ->  | AU78: - | AV78: =RC[-31] -> #VALUE! | AW78: =RC[-31] ->  | AX78: =RC[-31] ->  | AY78: =RC[-31] -> #VALUE!
A79: =IF(RC[1]="","",DATEVALUE(RC[1])) ->  | C79: 24 | J79: =RC[-5]-RC[-2] -> #VALUE! | Q79: =RC[-3]-RC[-1] -> #VALUE! | T79: =RC[-8]+RC[-1] -> #VALUE! | U79: =(RC[-17]*RC[-16]-RC[-14]*RC[-13])/1000 -> #VALUE! | X79: =RC[-2]*RC[-10]/1000 -> #VALUE! | Y79: =(RC[-3]*RC[-11]-RC[-2]*RC[-9])/1000 -> #VALUE! | AD79: =VALUE(RC[-28]) -> #VALUE! | AE79: =IF(RC[22]=42,"*",IF(RC[22]=32,"",RC[22])) ->  | AF79: =RC[-29] -> 24 | AG79: =RC[-29] ->  | AH79: =RC[-29] ->  | AI79: =RC[-29] ->  | AJ79: =RC[-29] ->  | AK79: =RC[-29] ->  | AL79: =RC[-29] ->  | AM79: =RC[-29] -> #VALUE! | AN79: =RC[-29] ->  | AO79: =RC[-29] ->  | AP79: =RC[-29] ->  | AQ79: =RC[-29] ->  | AR79: - | AS79: =RC[-30] ->  | AT79: =RC[-30] ->  | AU79: - | AV79: =RC[-31] -> #VALUE! | AW79: =RC[-31] ->  | AX79: =RC[-31] ->  | AY79: =RC[-31] -> #VALUE!
A80: =IF(RC[1]="","",DATEVALUE(RC[1])) ->  | C80: 24 | J80: =RC[-5]-RC[-2] -> #VALUE! | Q80: =RC[-3]-RC[-1] -> #VALUE! | T80: =RC[-8]+RC[-1] -> #VALUE! | U80: =(RC[-17]*RC[-16]-RC[-14]*RC[-13])/1000 -> #VALUE! | X80: =RC[-2]*RC[-10]/1000 -> #VALUE! | Y80: =(RC[-3]*RC[-11]-RC[-2]*RC[-9])/1000 -> #VALUE! | AD80: =VALUE(RC[-28]) -> #VALUE! | AE80: =IF(RC[22]=42,"*",IF(RC[22]=32,"",RC[22])) ->  | AF80: =RC[-29] -> 24 | AG80: =RC[-29] ->  | AH80: =RC[-29] ->  | AI80: =RC[-29] ->  | AJ80: =RC[-29] ->  | AK80: =RC[-29] ->  | AL80: =RC[-29] ->  | AM80: =RC[-29] -> #VALUE! | AN80: =RC[-29] ->  | AO80: =RC[-29] ->  | AP80: =RC[-29] ->  | AQ80: =RC[-29] ->  | AR80: - | AS80: =RC[-30] ->  | AT80: =RC[-30] ->  | AU80: - | AV80: =RC[-31] -> #VALUE! | AW80: =RC[-31] ->  | AX80: =RC[-31] ->  | AY80: =RC[-31] -> #VALUE!
A81: =IF(RC[1]="","",DATEVALUE(RC[1])) ->  | C81: 24 | J81: =RC[-5]-RC[-2] -> #VALUE! | Q81: =RC[-3]-RC[-1] -> #VALUE! | T81: =RC[-8]+RC[-1] -> #VALUE! | U81: =(RC[-17]*RC[-16]-RC[-14]*RC[-13])/1000 -> #VALUE! | X81: =RC[-2]*RC[-10]/1000 -> #VALUE! | Y81: =(RC[-3]*RC[-11]-RC[-2]*RC[-9])/1000 -> #VALUE! | AD81: =VALUE(RC[-28]) -> #VALUE! | AE81: =IF(RC[22]=42,"*",IF(RC[22]=32,"",RC[22])) ->  | AF81: =RC[-29] -> 24 | AG81: =RC[-29] ->  | AH81: =RC[-29] ->  | AI81: =RC[-29] ->  | AJ81: =RC[-29] ->  | AK81: =RC[-29] ->  | AL81: =RC[-29] ->  | AM81: =RC[-29] -> #VALUE! | AN81: =RC[-29] ->  | AO81: =RC[-29] ->  | AP81: =RC[-29] ->  | AQ81: =RC[-29] ->  | AR81: - | AS81: =RC[-30] ->  | AT81: =RC[-30] ->  | AU81: - | AV81: =RC[-31] -> #VALUE! | AW81: =RC[-31] ->  | AX81: =RC[-31] ->  | AY81: =RC[-31] -> #VALUE!
A82: =IF(RC[1]="","",DATEVALUE(RC[1])) ->  | C82: 24 | J82: =RC[-5]-RC[-2] -> #VALUE! | Q82: =RC[-3]-RC[-1] -> #VALUE! | T82: =RC[-8]+RC[-1] -> #VALUE! | U82: =(RC[-17]*RC[-16]-RC[-14]*RC[-13])/1000 -> #VALUE! | X82: =RC[-2]*RC[-10]/1000 -> #VALUE! | Y82: =(RC[-3]*RC[-11]-RC[-2]*RC[-9])/1000 -> #VALUE! | AD82: =VALUE(RC[-28]) -> #VALUE! | AE82: =IF(RC[22]=42,"*",IF(RC[22]=32,"",RC[22])) ->  | AF82: =RC[-29] -> 24 | AG82: =RC[-29] ->  | AH82: =RC[-29] ->  | AI82: =RC[-29] ->  | AJ82: =RC[-29] ->  | AK82: =RC[-29] ->  | AL82: =RC[-29] ->  | AM82: =RC[-29] -> #VALUE! | AN82: =RC[-29] ->  | AO82: =RC[-29] ->  | AP82: =RC[-29] ->  | AQ82: =RC[-29] ->  | AR82: - | AS82: =RC[-30] ->  | AT82: =RC[-30] ->  | AU82: - | AV82: =RC[-31] -> #VALUE! | AW82: =RC[-31] ->  | AX82: =RC[-31] ->  | AY82: =RC[-31] -> #VALUE!
A83: =IF(RC[1]="","",DATEVALUE(RC[1])) ->  | C83: 24 | J83: =RC[-5]-RC[-2] -> #VALUE! | Q83: =RC[-3]-RC[-1] -> #VALUE! | T83: =RC[-8]+RC[-1] -> #VALUE! | U83: =(RC[-17]*RC[-16]-RC[-14]*RC[-13])/1000 -> #VALUE! | X83: =RC[-2]*RC[-10]/1000 -> #VALUE! | Y83: =(RC[-3]*RC[-11]-RC[-2]*RC[-9])/1000 -> #VALUE! | AD83: =VALUE(RC[-28]) -> #VALUE! | AE83: =IF(RC[22]=42,"*",IF(RC[22]=32,"",RC[22])) ->  | AF83: =RC[-29] -> 24 | AG83: =RC[-29] ->  | AH83: =RC[-29] ->  | AI83: =RC[-29] ->  | AJ83: =RC[-29] ->  | AK83: =RC[-29] ->  | AL83: =RC[-29] ->  | AM83: =RC[-29] -> #VALUE! | AN83: =RC[-29] ->  | AO83: =RC[-29] ->  | AP83: =RC[-29] ->  | AQ83: =RC[-29] ->  | AR83: - | AS83: =RC[-30] ->  | AT83: =RC[-30] ->  | AU83: - | AV83: =RC[-31] -> #VALUE! | AW83: =RC[-31] ->  | AX83: =RC[-31] ->  | AY83: =RC[-31] -> #VALUE!
AD84: Среднее | AG84: =R[1]C[-29] -> 207.70933333333335 | AH84: =R[1]C[-29] -> 47.832333333333331 | AI84: =R[1]C[-29] -> 7.53 | AJ84: =R[1]C[-29] -> 204.4433333333333 | AK84: =R[1]C[-29] -> 37.491333333333344 | AL84: =R[1]C[-29] -> 5.4300000000000042 | AM84: =R[1]C[-29] -> 10.340999999999987 | AN84: =R[1]C[-29] -> 3.266 | AP84: =R[1]C[-29] -> 28.153333333333332 | AQ84: =R[1]C[-29] -> 64.329666666666668 | AS84: =R[1]C[-30] -> 2.6133333333333337 | AT84: =R[1]C[-30] -> 25.327999999999996 | AU84: - | AV84: =R[1]C[-31] -> 39.001666666666672
B85: Среднее | D85: =AVERAGE(OFFSET(R[-74]C,3,0,R7C1,1)) -> 207.70933333333335 | E85: =IF(SUM(OFFSET(R[-74]C,3,0,R7C1,1))=0,0,AVERAGE(OFFSET(R[-74]C,3,0,R7C1,1))) -> 47.832333333333331 | F85: =IF(SUM(OFFSET(R[-74]C,3,0,R7C1,1))=0,0,AVERAGE(OFFSET(R[-74]C,3,0,R7C1,1))) -> 7.53 | G85: =AVERAGE(OFFSET(R[-74]C,3,0,R7C1,1)) -> 204.4433333333333 | H85: =IF(SUM(OFFSET(R[-74]C,3,0,R7C1,1))=0,0,AVERAGE(OFFSET(R[-74]C,3,0,R7C1,1))) -> 37.491333333333344 | I85: =IF(SUM(OFFSET(R[-74]C,3,0,R7C1,1))=0,0,AVERAGE(OFFSET(R[-74]C,3,0,R7C1,1))) -> 5.4300000000000042 | J85: =RC[-5]-RC[-2] -> 10.340999999999987 | K85: =AVERAGE(OFFSET(R[-74]C,3,0,R7C1,1)) -> 3.266 | L85: =AVERAGE(OFFSET(R[-74]C,3,0,R7C1,1)) -> 2.3742666666666663 | M85: =AVERAGE(OFFSET(R[-74]C,3,0,R7C1,1)) -> 28.153333333333332 | N85: =IF(SUM(OFFSET(R[-74]C,3,0,R7C1,1))=0,0,AVERAGE(OFFSET(R[-74]C,3,0,R7C1,1))) -> 64.329666666666668 | O85: =AVERAGE(OFFSET(R[-74]C,3,0,R7C1,1)) -> 2.6133333333333337 | P85: =IF(SUM(OFFSET(R[-74]C,3,0,R7C1,1))=0,0,AVERAGE(OFFSET(R[-74]C,3,0,R7C1,1))) -> 25.327999999999996 | Q85: =RC[-3]-RC[-1] -> 39.001666666666672 | R85: =AVERAGE(OFFSET(R[-74]C,3,0,R7C1,1)) -> 25.539999999999996 | S85: =AVERAGE(OFFSET(R[-74]C,3,0,R7C1,1)) -> 1.7116333333333336 | T85: =AVERAGE(OFFSET(R[-74]C,3,0,R7C1,1)) -> 4.0836999999999994 | U85: =AVERAGE(OFFSET(R[-74]C,3,0,R7C1,1)) -> 2.3604929733333333 | X85: =AVERAGE(OFFSET(R[-74]C,3,0,R7C1,1)) -> 1.77757984 | Y85: =AVERAGE(OFFSET(R[-74]C,3,0,R7C1,1)) -> 1.7114003733333336 | AD85: Итого | AF85: =R[1]C[-29] -> 720 | AG85: =R[1]C[-29] -> 6231.2800000000007 | AJ85: =R[1]C[-29] -> 6133.2999999999993 | AN85: =R[1]C[-29] -> 97.98 | AO85: =R[1]C[-29] -> 71.227999999999994 | AP85: =R[1]C[-29] -> 844.6 | AS85: =R[1]C[-30] -> 78.400000000000006 | AW85: =R[1]C[-31] -> 766.19999999999982 | AX85: =R[1]C[-31] -> 51.349000000000004 | AY85: =R[1]C[-31] -> 122.51099999999998
B86: ИТОГО: | C86: =SUM(OFFSET(R[-75]C,3,0,R7C1,1)) -> 720 | D86: =SUM(OFFSET(R[-75]C,3,0,R7C1,1)) -> 6231.2800000000007 | G86: =SUM(OFFSET(R[-75]C,3,0,R7C1,1)) -> 6133.2999999999993 | K86: =SUM(OFFSET(R[-75]C,3,0,R7C1,1)) -> 97.98 | L86: =SUM(OFFSET(R[-75]C,3,0,R7C1,1)) -> 71.227999999999994 | M86: =SUM(OFFSET(R[-75]C,3,0,R7C1,1)) -> 844.6 | O86: =SUM(OFFSET(R[-75]C,3,0,R7C1,1)) -> 78.400000000000006 | R86: =SUM(OFFSET(R[-75]C,3,0,R7C1,1)) -> 766.19999999999982 | S86: =SUM(OFFSET(R[-75]C,3,0,R7C1,1)) -> 51.349000000000004 | T86: =SUM(OFFSET(R[-75]C,3,0,R7C1,1)) -> 122.51099999999998 | U86: =SUM(OFFSET(R[-75]C,3,0,R7C1,1)) -> 70.814789199999993 | X86: =SUM(OFFSET(R[-75]C,3,0,R7C1,1)) -> 53.327395199999998 | Y86: =SUM(OFFSET(R[-75]C,3,0,R7C1,1)) -> 51.342011200000009
AD87: Досчёт по среднему до конца месяца | AG87: =R[1]C[-29] -> 0 | AJ87: =R[1]C[-29] -> 0 | AN87: =R[1]C[-29] -> 0 | AO87: =R[1]C[-29] -> 0 | AP87: =R[1]C[-29] -> 0 | AS87: =R[1]C[-30] -> 0 | AW87: =R[1]C[-31] -> 0 | AX87: =R[1]C[-31] -> 0 | AY87: =R[1]C[-31] -> 0
A88: 11дн=264ч 4дн=96ч | B88: Досчёт до конца м-ца (+) | C88: =R[-82]C[-2]*24 -> 216 | U88: № 43383 | AD88: Снятие досчёта по среднему предыдущего отчёта | AG88: =-R[1]C[-29] -> 0 | AJ88: =-R[1]C[-29] -> 0 | AN88: =-R[1]C[-29] -> 0 | AO88: =-R[1]C[-29] -> 0 | AP88: =-R[1]C[-29] -> 0 | AS88: =-R[1]C[-30] -> 0 | AW88: =-R[1]C[-31] -> 0 | AX88: =-R[1]C[-31] -> 0 | AY88: =-R[1]C[-31] -> 0
A89: 9дн=216ч 7дн=168ч | B89: Вычет с предыдущего (-) | C89: =R[-85]C[-2]*24 -> 192 | AD89: Сумма: | AG89: =R[1]C[-29] -> 6231.2800000000007 | AJ89: =R[1]C[-29] -> 6133.2999999999993 | AN89: =R[1]C[-29] -> 97.98 | AO89: =R[1]C[-29] -> 71.227999999999994 | AP89: =R[1]C[-29] -> 844.6 | AS89: =R[1]C[-30] -> 78.400000000000006 | AW89: =R[1]C[-31] -> 766.19999999999982 | AX89: =R[1]C[-31] -> 51.349000000000004 | AY89: =R[1]C[-31] -> 122.51099999999998
B90: СУММА: | C90: =R[-4]C+R[-2]C-R[-1]C -> 744 | D90: =R[-4]C+R[-2]C-R[-1]C -> 6231.2800000000007 | G90: =R[-4]C+R[-2]C-R[-1]C -> 6133.2999999999993 | K90: =R[-4]C+R[-2]C-R[-1]C -> 97.98 | L90: =R[-4]C+R[-2]C-R[-1]C -> 71.227999999999994 | M90: =R[-4]C+R[-2]C-R[-1]C -> 844.6 | O90: =R[-4]C+R[-2]C-R[-1]C -> 78.400000000000006 | R90: =R[-4]C+R[-2]C-R[-1]C -> 766.19999999999982 | S90: =R[-4]C+R[-2]C-R[-1]C -> 51.349000000000004 | T90: =R[-4]C+R[-2]C-R[-1]C -> 122.51099999999998 | AD90: Тхв на источнике | AE90: 0 | AF90: V гвс (м3) | AG90: =R[-1]C[16] -> 766.19999999999982 | AH90: W гвс (Гкал) | AI90: =RC[-2]*0.06 -> 45.971999999999987 | AJ90: W без гвс (Гкал) | AK90: =R[-1]C[4] -> 71.227999999999994
AD91: =R[-90]C[-17] -> з.н д. №02/147-2783 от 04.10.18
B93: Дата, время | D93: М1, т | F93: М2, т | H93: М3, т | J93: М4, т | L93: Qо, Гкал | N93: Qг, Гкал | P93: время, час
B94: 23.09.18 02:00 | D94: 158377.21 | F94: 156724.72 | H94: 169483.36 | J94: 169352.31 | L94: 3000.5219999999999 | N94: 2886.9140000000002 | P94: -
B95: 23.10.18 03:00 | D95: 162249.04999999999 | F95: 160417.03 | H95: 176409.48 | J95: 175379.33 | L95: 3040.989 | N95: 2941.0749999999998 | P95: -
B98: Представитель потредителя:_______________________________________________________ В.О. Топорков
I101: Рекомендуемые значения по параметрам теплопотребления (не являются официально утверждёнными)
I102: М, т | J102: V, м3 | K102: Qгвс, Гкал | L102: Qотоп, Гкал | M102: Qо, Гкал
I103: =R[-13]C[6] -> 78.400000000000006 | J103: =RC[-1]/0.98 -> 80.000000000000014 | K103: =R[-13]C[8] -> 51.349000000000004 | L103: =R[-13]C -> 71.227999999999994 | M103: =R[-6]C[2] -> 0
P105: ДЛЯ САМОКОНТРОЛЯ
B106: В строке выбора дат указать период с 16.7.13 по 23.8.13 - жильё | O106: Qo | Q106: Qг
B107: В строке выбора дат указать период с 18.7.13 по 25.8.13 - не жилое | O107: =((R[-21]C[-11]*R[-22]C[-8])-(R[-21]C[-10]*R[-22]C[-7]))/1000 -> 1273.9436541333334 | Q107: =IF(R[-22]C[-3]="",R[-21]C[-4]*R[-22]C[-1]/1000,"") ->  | R107: Си4
Q108: =IF(R[-23]C[-3]="","",((R[-22]C[-4]*R[-23]C[-1])-(R[-22]C[-3]*R[-23]C[1]))/1000) -> 21.392028799999995 | R108: Си5