Sheet: Лист1
G1: Отчёт о теплопотреблении за октябрь 2018 | M1: з.н д. №02/147-2783 от 04.10.18 с 06.10.18г по 22.10.18г некорректная работа приборов
A4: =EOMONTH(R[9]C,0)-R[9]C -> 8 | B4: Потребитель: ЗАО "Сити Сервис"
A5: =MAX(R[9]C:R[78]C) -> 2018-10-22T00:00:00.000 | B5: Адрес: г. СПб, Кораблестроителей ул., д.35 к.1 ИТП 9
A6: =EOMONTH(R[-1]C,0)-R[-1]C -> 9 | B6: Телефон: 8-911-021-19-79
A7: =R[-2]C-R[6]C -> 30 | B7: Договор 10023-2(.)400
A8: 7 | B8: Тепловычислитель: ВТД-УВ № B016 | L8: М2 мах= | M8: 156.24 | O8: Мгвс мах= | P8: 92.4
L9: Qотоп мах= | M9: 12.48 | O9: Qгвс мах= | P9: 5.52
B10: Расчётная формула: Q=M1*(h1-h2)+(M1-M2)*(h2-hхв)
D12: Учет | L12: Контроль
A13: =R[1]C[1]-1 -> 2018-09-22T00:00:00.000 | B13: Дата | C13: N, ч | D13: M1, т | E13: T1, С | F13: P1, кг/см2 | G13: M2, т | H13: T2, С | I13: P2, кг/см2 | J13: dT, С | K13: M1-М2, т | L13: V3, м3 | M13: T3, С | N13: V4, м3 | O13: =IF(R[-12]C[-14]="м.куб","","T4, С") -> T4, С | P13: dT, С | Q13: V3-V4, м3 | R13: Qгвс, Гкал | S13: Qобщ., Гкал | T13: Q | U13: M3 | V13: M4 | W13: си2 | X13: си3 | Y13: Разб. | Z13: dM2 | AC13: Дата | AD13: НС | AE13: n, ч | AF13: М1, т | AG13: t1, гр. С | AH13: Р1, кгс/см2 | AI13: М2, т | AJ13: t2, гр. С | AK13: Р2, кгс/см2 | AL13: t1-t2, гр. С | AM13: М1-М2, т | AN13: М1гвс, т | AO13: t1гвс, гр. С | AP13: Р1гвс, кгс/см2 | AQ13: М2гвс, т | AR13: t2гвс, гр. С | AS13: Р2гвс, кгс/см2 | AT13: t1гвс-t2гвс | AU13: М1гвс-М2гвс, т | AV13: Wгвс, Гкал | AW13: Wсумм, Гкал | AY13: NS_TV1 | AZ13: НС | BA13: NS_TV2
A14: =IF(RC[1]="","",DATEVALUE(RC[1])) -> 43366 | B14: 23.09.18 | C14: 24 | D14: 242.00352477999999 | E14: 69.790000000000006 | F14: 4.9427240293199999 | G14: 212.34225463999999 | H14: 69.89 | I14: 4.1301248158800004 | J14: =RC[-5]-RC[-2] -> -9.9999999999994316E-2 | K14: 29.661270139999999 | L14: 28.894161220000001 | M14: 69.180000000000007 | R14: 1.9776056940861799 | S14: =RC[-1] -> 1.9776056940861799 | T14: =(RC[-16]*RC[-15]-RC[-13]*RC[-12])/1000 -> 2.0488258176066028 | U14: 28.267616270000001 | V14: - | W14: =RC[-2]*RC[-10]/1000 -> 1.9555536935586004 | X14: =ABS((RC[-3]*RC[-11]-RC[-2]*RC[-9])/1000) -> #VALUE! | Y14: =(RC[-14]-RC[1])/RC[-18]*100 -> 0.65632432525630169 | Z14: 28.267616270000001 | AC14: =VALUE(RC[-27]) -> 2018-09-23T00:00:00.000 | AD14: =IF(RC[21]=42,"*",IF(RC[21]=32,"",RC[21])) -> - | AE14: =RC[-28] -> 24 | AF14: =RC[-28] -> 242.00352477999999 | AG14: =RC[-28] -> 69.790000000000006 | AH14: =RC[-28] -> 4.9427240293199999 | AI14: =RC[-28] -> 212.34225463999999 | AJ14: =RC[-28] -> 69.89 | AK14: =RC[-28] -> 4.1301248158800004 | AL14: =RC[-28] -> -9.9999999999994316E-2 | AM14: =RC[-28] -> 29.661270139999999 | AN14: =RC[-28] -> 28.894161220000001 | AO14: =RC[-28] -> 69.180000000000007 | AP14: - | AQ14: =RC[-29] -> 0 | AR14: =RC[-29] -> 0 | AS14: - | AT14: =RC[-30] -> 0 | AU14: =RC[-30] -> 0 | AV14: =RC[-30] -> 1.9776056940861799 | AW14: =RC[-30] -> 1.9776056940861799 | AY14: - | AZ14: - | BA14: -
A15: =IF(RC[1]="","",DATEVALUE(RC[1])) -> 43367 | B15: 24.09.18 | C15: 24 | D15: 236.34609985 | E15: 68.88 | F15: 4.9209155303200003 | G15: 208.33346558 | H15: 69.02 | I15: 4.141719417 | J15: =RC[-5]-RC[-2] -> -0.14000000000000057 | K15: 28.01263427 | L15: 27.124851230000001 | M15: 68.59 | R15: 1.8278623340021001 | S15: =RC[-1] -> 1.8278623340021001 | T15: =(RC[-16]*RC[-15]-RC[-13]*RC[-12])/1000 -> 1.9003435633364005 | U15: 26.553283690000001 | V15: - | W15: =RC[-2]*RC[-10]/1000 -> 1.8212897282971001 | X15: =ABS((RC[-3]*RC[-11]-RC[-2]*RC[-9])/1000) -> #VALUE! | Y15: =(RC[-14]-RC[1])/RC[-18]*100 -> 0.70048783374153045 | Z15: 26.553283690000001 | AC15: =VALUE(RC[-27]) -> 2018-09-24T00:00:00.000 | AD15: =IF(RC[21]=42,"*",IF(RC[21]=32,"",RC[21])) -> - | AE15: =RC[-28] -> 24 | AF15: =RC[-28] -> 236.34609985 | AG15: =RC[-28] -> 68.88 | AH15: =RC[-28] -> 4.9209155303200003 | AI15: =RC[-28] -> 208.33346558 | AJ15: =RC[-28] -> 69.02 | AK15: =RC[-28] -> 4.141719417 | AL15: =RC[-28] -> -0.14000000000000057 | AM15: =RC[-28] -> 28.01263427 | AN15: =RC[-28] -> 27.124851230000001 | AO15: =RC[-28] -> 68.59 | AP15: - | AQ15: =RC[-29] -> 0 | AR15: =RC[-29] -> 0 | AS15: - | AT15: =RC[-30] -> 0 | AU15: =RC[-30] -> 0 | AV15: =RC[-30] -> 1.8278623340021001 | AW15: =RC[-30] -> 1.8278623340021001 | AY15: - | AZ15: - | BA15: -
A16: =IF(RC[1]="","",DATEVALUE(RC[1])) -> 43368 | B16: 25.09.18 | C16: 24 | D16: 239.82295227 | E16: 67.3 | F16: 4.8137910811999998 | G16: 211.6987915 | H16: 67.400000000000006 | I16: 4.0051370402800002 | J16: =RC[-5]-RC[-2] -> -0.10000000000000853 | K16: 28.12416077 | L16: 26.813716889999998 | M16: 66.73 | R16: 1.76541213337155 | S16: =RC[-1] -> 1.76541213337155 | T16: =(RC[-16]*RC[-15]-RC[-13]*RC[-12])/1000 -> 1.8715861406709973 | U16: 26.2729702 | V16: - | W16: =RC[-2]*RC[-10]/1000 -> 1.753195301446 | X16: =ABS((RC[-3]*RC[-11]-RC[-2]*RC[-9])/1000) -> #VALUE! | Y16: =(RC[-14]-RC[1])/RC[-18]*100 -> 0.87444550669529919 | Z16: 26.2729702 | AC16: =VALUE(RC[-27]) -> 2018-09-25T00:00:00.000 | AD16: =IF(RC[21]=42,"*",IF(RC[21]=32,"",RC[21])) -> - | AE16: =RC[-28] -> 24 | AF16: =RC[-28] -> 239.82295227 | AG16: =RC[-28] -> 67.3 | AH16: =RC[-28] -> 4.8137910811999998 | AI16: =RC[-28] -> 211.6987915 | AJ16: =RC[-28] -> 67.400000000000006 | AK16: =RC[-28] -> 4.0051370402800002 | AL16: =RC[-28] -> -0.10000000000000853 | AM16: =RC[-28] -> 28.12416077 | AN16: =RC[-28] -> 26.813716889999998 | AO16: =RC[-28] -> 66.73 | AP16: - | AQ16: =RC[-29] -> 0 | AR16: =RC[-29] -> 0 | AS16: - | AT16: =RC[-30] -> 0 | AU16: =RC[-30] -> 0 | AV16: =RC[-30] -> 1.76541213337155 | AW16: =RC[-30] -> 1.76541213337155 | AY16: - | AZ16: - | BA16: -
A17: =IF(RC[1]="","",DATEVALUE(RC[1])) -> 43369 | B17: 26.09.18 | C17: 24 | D17: 224.02143860000001 | E17: 66.72 | F17: 4.6547957205200001 | G17: 194.89907837000001 | H17: 65.8 | I17: 3.96498787168 | J17: =RC[-5]-RC[-2] -> 0.92000000000000171 | K17: 29.122360230000002 | L17: 27.091798780000001 | M17: 66.34 | R17: 1.7593127209324499 | S17: =RC[-1] -> 1.7593127209324499 | T17: =(RC[-16]*RC[-15]-RC[-13]*RC[-12])/1000 -> 2.1223510266459997 | U17: 26.558872220000001 | V17: - | W17: =RC[-2]*RC[-10]/1000 -> 1.7619155830748001 | X17: =ABS((RC[-3]*RC[-11]-RC[-2]*RC[-9])/1000) -> #VALUE! | Y17: =(RC[-14]-RC[1])/RC[-18]*100 -> 1.3152899600343042 | Z17: 26.558872220000001 | AC17: =VALUE(RC[-27]) -> 2018-09-26T00:00:00.000 | AD17: =IF(RC[21]=42,"*",IF(RC[21]=32,"",RC[21])) -> - | AE17: =RC[-28] -> 24 | AF17: =RC[-28] -> 224.02143860000001 | AG17: =RC[-28] -> 66.72 | AH17: =RC[-28] -> 4.6547957205200001 | AI17: =RC[-28] -> 194.89907837000001 | AJ17: =RC[-28] -> 65.8 | AK17: =RC[-28] -> 3.96498787168 | AL17: =RC[-28] -> 0.92000000000000171 | AM17: =RC[-28] -> 29.122360230000002 | AN17: =RC[-28] -> 27.091798780000001 | AO17: =RC[-28] -> 66.34 | AP17: - | AQ17: =RC[-29] -> 0 | AR17: =RC[-29] -> 0 | AS17: - | AT17: =RC[-30] -> 0 | AU17: =RC[-30] -> 0 | AV17: =RC[-30] -> 1.7593127209324499 | AW17: =RC[-30] -> 1.7593127209324499 | AY17: - | AZ17: - | BA17: -
A18: =IF(RC[1]="","",DATEVALUE(RC[1])) -> 43370 | B18: 27.09.18 | C18: 24 | D18: 192.99513245 | E18: 62.08 | F18: 4.5334233241600002 | G18: 161.66926574999999 | H18: 51.75 | I18: 4.0724444609999999 | J18: =RC[-5]-RC[-2] -> 10.329999999999998 | K18: 31.325866699999999 | L18: 29.421436310000001 | M18: 60.48 | R18: 1.7924532912964599 | S18: 3.47270019824209 | T18: =(RC[-16]*RC[-15]-RC[-13]*RC[-12])/1000 -> 3.6147533199334996 | U18: 28.909849170000001 | V18: - | W18: =RC[-2]*RC[-10]/1000 -> 1.7484676778016002 | X18: =ABS((RC[-3]*RC[-11]-RC[-2]*RC[-9])/1000) -> #VALUE! | Y18: =(RC[-14]-RC[1])/RC[-18]*100 -> 1.4944198074951656 | Z18: 28.909849170000001 | AC18: =VALUE(RC[-27]) -> 2018-09-27T00:00:00.000 | AD18: =IF(RC[21]=42,"*",IF(RC[21]=32,"",RC[21])) -> - | AE18: =RC[-28] -> 24 | AF18: =RC[-28] -> 192.99513245 | AG18: =RC[-28] -> 62.08 | AH18: =RC[-28] -> 4.5334233241600002 | AI18: =RC[-28] -> 161.66926574999999 | AJ18: =RC[-28] -> 51.75 | AK18: =RC[-28] -> 4.0724444609999999 | AL18: =RC[-28] -> 10.329999999999998 | AM18: =RC[-28] -> 31.325866699999999 | AN18: =RC[-28] -> 29.421436310000001 | AO18: =RC[-28] -> 60.48 | AP18: - | AQ18: =RC[-29] -> 0 | AR18: =RC[-29] -> 0 | AS18: - | AT18: =RC[-30] -> 0 | AU18: =RC[-30] -> 0 | AV18: =RC[-30] -> 1.7924532912964599 | AW18: =RC[-30] -> 3.47270019824209 | AY18: - | AZ18: - | BA18: -
A19: =IF(RC[1]="","",DATEVALUE(RC[1])) -> 43371 | B19: 28.09.18 | C19: 24 | D19: 156.84338378999999 | E19: 66.069999999999993 | F19: 4.4979351386799999 | G19: 132.83879089000001 | H19: 44.2 | I19: 4.2066614484800002 | J19: =RC[-5]-RC[-2] -> 21.86999999999999 | K19: 24.004592899999999 | L19: 23.234403610000001 | M19: 65.22 | R19: 1.5120366437374599 | S19: 4.42233686586414 | T19: =(RC[-16]*RC[-15]-RC[-13]*RC[-12])/1000 -> 4.4911678096672984 | U19: 22.7758255 | V19: - | W19: =RC[-2]*RC[-10]/1000 -> 1.48543933911 | X19: =ABS((RC[-3]*RC[-11]-RC[-2]*RC[-9])/1000) -> #VALUE! | Y19: =(RC[-14]-RC[1])/RC[-18]*100 -> 0.92500646216925142 | Z19: 22.7758255 | AC19: =VALUE(RC[-27]) -> 2018-09-28T00:00:00.000 | AD19: =IF(RC[21]=42,"*",IF(RC[21]=32,"",RC[21])) -> - | AE19: =RC[-28] -> 24 | AF19: =RC[-28] -> 156.84338378999999 | AG19: =RC[-28] -> 66.069999999999993 | AH19: =RC[-28] -> 4.4979351386799999 | AI19: =RC[-28] -> 132.83879089000001 | AJ19: =RC[-28] -> 44.2 | AK19: =RC[-28] -> 4.2066614484800002 | AL19: =RC[-28] -> 21.86999999999999 | AM19: =RC[-28] -> 24.004592899999999 | AN19: =RC[-28] -> 23.234403610000001 | AO19: =RC[-28] -> 65.22 | AP19: - | AQ19: =RC[-29] -> 0 | AR19: =RC[-29] -> 0 | AS19: - | AT19: =RC[-30] -> 0 | AU19: =RC[-30] -> 0 | AV19: =RC[-30] -> 1.5120366437374599 | AW19: =RC[-30] -> 4.42233686586414 | AY19: - | AZ19: - | BA19: -
A20: =IF(RC[1]="","",DATEVALUE(RC[1])) -> 43372 | B20: 29.09.18 | C20: 24 | D20: 132.63079834000001 | E20: 66.45 | F20: 4.5501012519600001 | G20: 104.66989135999999 | H20: 40.659999999999997 | I20: 4.3913371139199997 | J20: =RC[-5]-RC[-2] -> 25.790000000000006 | K20: 27.960906980000001 | L20: 27.203376769999998 | M20: 66.09 | R20: 1.7665527467278099 | S20: 4.5336485239323601 | T20: =(RC[-16]*RC[-15]-RC[-13]*RC[-12])/1000 -> 4.5574387669954017 | U20: 26.668088910000002 | V20: - | W20: =RC[-2]*RC[-10]/1000 -> 1.7624939960619002 | X20: =ABS((RC[-3]*RC[-11]-RC[-2]*RC[-9])/1000) -> #VALUE! | Y20: =(RC[-14]-RC[1])/RC[-18]*100 -> 1.2351384464071917 | Z20: 26.668088910000002 | AC20: =VALUE(RC[-27]) -> 2018-09-29T00:00:00.000 | AD20: =IF(RC[21]=42,"*",IF(RC[21]=32,"",RC[21])) -> - | AE20: =RC[-28] -> 24 | AF20: =RC[-28] -> 132.63079834000001 | AG20: =RC[-28] -> 66.45 | AH20: =RC[-28] -> 4.5501012519600001 | AI20: =RC[-28] -> 104.66989135999999 | AJ20: =RC[-28] -> 40.659999999999997 | AK20: =RC[-28] -> 4.3913371139199997 | AL20: =RC[-28] -> 25.790000000000006 | AM20: =RC[-28] -> 27.960906980000001 | AN20: =RC[-28] -> 27.203376769999998 | AO20: =RC[-28] -> 66.09 | AP20: - | AQ20: =RC[-29] -> 0 | AR20: =RC[-29] -> 0 | AS20: - | AT20: =RC[-30] -> 0 | AU20: =RC[-30] -> 0 | AV20: =RC[-30] -> 1.7665527467278099 | AW20: =RC[-30] -> 4.5336485239323601 | AY20: - | AZ20: - | BA20: -
A21: =IF(RC[1]="","",DATEVALUE(RC[1])) -> 43373 | B21: 30.09.18 | C21: 24 | D21: 127.14432526 | E21: 68.27 | F21: 4.4825563841599996 | G21: 97.231826780000006 | H21: 40.380000000000003 | I21: 4.3521838557199999 | J21: =RC[-5]-RC[-2] -> 27.889999999999993 | K21: 29.91249848 | L21: 29.608596800000001 | M21: 67.59 | R21: 1.98778774004013 | S21: 4.7381518510556999 | T21: =(RC[-16]*RC[-15]-RC[-13]*RC[-12])/1000 -> 4.7539219201237994 | U21: 28.987548830000001 | V21: - | W21: =RC[-2]*RC[-10]/1000 -> 1.9592684254197001 | X21: =ABS((RC[-3]*RC[-11]-RC[-2]*RC[-9])/1000) -> #VALUE! | Y21: =(RC[-14]-RC[1])/RC[-18]*100 -> 0.95128280587879999 | Z21: 28.987548830000001 | AC21: =VALUE(RC[-27]) -> 2018-09-30T00:00:00.000 | AD21: =IF(RC[21]=42,"*",IF(RC[21]=32,"",RC[21])) -> - | AE21: =RC[-28] -> 24 | AF21: =RC[-28] -> 127.14432526 | AG21: =RC[-28] -> 68.27 | AH21: =RC[-28] -> 4.4825563841599996 | AI21: =RC[-28] -> 97.231826780000006 | AJ21: =RC[-28] -> 40.380000000000003 | AK21: =RC[-28] -> 4.3521838557199999 | AL21: =RC[-28] -> 27.889999999999993 | AM21: =RC[-28] -> 29.91249848 | AN21: =RC[-28] -> 29.608596800000001 | AO21: =RC[-28] -> 67.59 | AP21: - | AQ21: =RC[-29] -> 0 | AR21: =RC[-29] -> 0 | AS21: - | AT21: =RC[-30] -> 0 | AU21: =RC[-30] -> 0 | AV21: =RC[-30] -> 1.98778774004013 | AW21: =RC[-30] -> 4.7381518510556999 | AY21: - | AZ21: - | BA21: -
A22: =IF(RC[1]="","",DATEVALUE(RC[1])) -> 43374 | B22: 01.10.18 | C22: 24 | D22: 124.62738037 | E22: 67.38 | F22: 4.5364811568399999 | G22: 96.607887270000006 | H22: 39.520000000000003 | I22: 4.4078690224799999 | J22: =RC[-5]-RC[-2] -> 27.859999999999992 | K22: 28.019493099999998 | L22: 27.576061249999999 | M22: 66.72 | R22: 1.8149598953855 | S22: 4.5458794640298104 | T22: =(RC[-16]*RC[-15]-RC[-13]*RC[-12])/1000 -> 4.5794491844202003 | U22: 27.020612719999999 | V22: - | W22: =RC[-2]*RC[-10]/1000 -> 1.8028152806783999 | X22: =ABS((RC[-3]*RC[-11]-RC[-2]*RC[-9])/1000) -> #VALUE! | Y22: =(RC[-14]-RC[1])/RC[-18]*100 -> 1.0339532394578979 | Z22: 27.020612719999999 | AC22: =VALUE(RC[-27]) -> 2018-10-01T00:00:00.000 | AD22: =IF(RC[21]=42,"*",IF(RC[21]=32,"",RC[21])) -> - | AE22: =RC[-28] -> 24 | AF22: =RC[-28] -> 124.62738037 | AG22: =RC[-28] -> 67.38 | AH22: =RC[-28] -> 4.5364811568399999 | AI22: =RC[-28] -> 96.607887270000006 | AJ22: =RC[-28] -> 39.520000000000003 | AK22: =RC[-28] -> 4.4078690224799999 | AL22: =RC[-28] -> 27.859999999999992 | AM22: =RC[-28] -> 28.019493099999998 | AN22: =RC[-28] -> 27.576061249999999 | AO22: =RC[-28] -> 66.72 | AP22: - | AQ22: =RC[-29] -> 0 | AR22: =RC[-29] -> 0 | AS22: - | AT22: =RC[-30] -> 0 | AU22: =RC[-30] -> 0 | AV22: =RC[-30] -> 1.8149598953855 | AW22: =RC[-30] -> 4.5458794640298104 | AY22: - | AZ22: - | BA22: -
A23: =IF(RC[1]="","",DATEVALUE(RC[1])) -> 43375 | B23: 02.10.18 | C23: 24 | D23: 115.15225983000001 | E23: 66.010000000000005 | F23: 4.4876008336000002 | G23: 88.012382509999995 | H23: 37.229999999999997 | I23: 4.3884706062400003 | J23: =RC[-5]-RC[-2] -> 28.780000000000008 | K23: 27.13987732 | L23: 26.547901150000001 | M23: 65.11 | R23: 1.7132090092672201 | S23: 4.2896953186204296 | T23: =(RC[-16]*RC[-15]-RC[-13]*RC[-12])/1000 -> 4.3244996705310026 | U23: 26.03126907 | V23: - | W23: =RC[-2]*RC[-10]/1000 -> 1.6948959291476999 | X23: =ABS((RC[-3]*RC[-11]-RC[-2]*RC[-9])/1000) -> #VALUE! | Y23: =(RC[-14]-RC[1])/RC[-18]*100 -> 1.2596048628430656 | Z23: 26.03126907 | AC23: =VALUE(RC[-27]) -> 2018-10-02T00:00:00.000 | AD23: =IF(RC[21]=42,"*",IF(RC[21]=32,"",RC[21])) -> - | AE23: =RC[-28] -> 24 | AF23: =RC[-28] -> 115.15225983000001 | AG23: =RC[-28] -> 66.010000000000005 | AH23: =RC[-28] -> 4.4876008336000002 | AI23: =RC[-28] -> 88.012382509999995 | AJ23: =RC[-28] -> 37.229999999999997 | AK23: =RC[-28] -> 4.3884706062400003 | AL23: =RC[-28] -> 28.780000000000008 | AM23: =RC[-28] -> 27.13987732 | AN23: =RC[-28] -> 26.547901150000001 | AO23: =RC[-28] -> 65.11 | AP23: - | AQ23: =RC[-29] -> 0 | AR23: =RC[-29] -> 0 | AS23: - | AT23: =RC[-30] -> 0 | AU23: =RC[-30] -> 0 | AV23: =RC[-30] -> 1.7132090092672201 | AW23: =RC[-30] -> 4.2896953186204296 | AY23: - | AZ23: - | BA23: -
A24: =IF(RC[1]="","",DATEVALUE(RC[1])) -> 43376 | B24: 03.10.18 | C24: 24 | D24: 109.85743712999999 | E24: 66.040000000000006 | F24: 4.5776712354800004 | G24: 82.470298769999999 | H24: 35.299999999999997 | I24: 4.4989588039599999 | J24: =RC[-5]-RC[-2] -> 30.740000000000009 | K24: 27.387138360000002 | L24: 27.251995090000001 | M24: 65.489999999999995 | R24: 1.76317782793542 | S24: 4.32331536734499 | T24: =(RC[-16]*RC[-15]-RC[-13]*RC[-12])/1000 -> 4.3437836014842013 | U24: 26.719541549999999 | V24: - | W24: =RC[-2]*RC[-10]/1000 -> 1.7498627761094996 | X24: =ABS((RC[-3]*RC[-11]-RC[-2]*RC[-9])/1000) -> #VALUE! | Y24: =(RC[-14]-RC[1])/RC[-18]*100 -> 0.80949968650150284 | Z24: 26.719541549999999 | AC24: =VALUE(RC[-27]) -> 2018-10-03T00:00:00.000 | AD24: =IF(RC[21]=42,"*",IF(RC[21]=32,"",RC[21])) -> - | AE24: =RC[-28] -> 24 | AF24: =RC[-28] -> 109.85743712999999 | AG24: =RC[-28] -> 66.040000000000006 | AH24: =RC[-28] -> 4.5776712354800004 | AI24: =RC[-28] -> 82.470298769999999 | AJ24: =RC[-28] -> 35.299999999999997 | AK24: =RC[-28] -> 4.4989588039599999 | AL24: =RC[-28] -> 30.740000000000009 | AM24: =RC[-28] -> 27.387138360000002 | AN24: =RC[-28] -> 27.251995090000001 | AO24: =RC[-28] -> 65.489999999999995 | AP24: - | AQ24: =RC[-29] -> 0 | AR24: =RC[-29] -> 0 | AS24: - | AT24: =RC[-30] -> 0 | AU24: =RC[-30] -> 0 | AV24: =RC[-30] -> 1.76317782793542 | AW24: =RC[-30] -> 4.32331536734499 | AY24: - | AZ24: - | BA24: -
A25: =IF(RC[1]="","",DATEVALUE(RC[1])) -> 43377 | B25: 04.10.18 | C25: 24 | D25: 101.82087708 | E25: 65.39 | F25: 4.6243884127600001 | G25: 72.364311220000005 | H25: 33.299999999999997 | I25: 4.5692457926800003 | J25: =RC[-5]-RC[-2] -> 32.090000000000003 | K25: 29.456565860000001 | L25: 27.734573359999999 | M25: 64.959999999999994 | R25: 1.77418045524028 | S25: 4.2100179110537903 | T25: =(RC[-16]*RC[-15]-RC[-13]*RC[-12])/1000 -> 4.2483355886352001 | U25: 27.20467567 | V25: - | W25: =RC[-2]*RC[-10]/1000 -> 1.7672157315231998 | X25: =ABS((RC[-3]*RC[-11]-RC[-2]*RC[-9])/1000) -> #VALUE! | Y25: =(RC[-14]-RC[1])/RC[-18]*100 -> 3.1118795329286919 | Z25: 27.20467567 | AC25: =VALUE(RC[-27]) -> 2018-10-04T00:00:00.000 | AD25: =IF(RC[21]=42,"*",IF(RC[21]=32,"",RC[21])) -> - | AE25: =RC[-28] -> 24 | AF25: =RC[-28] -> 101.82087708 | AG25: =RC[-28] -> 65.39 | AH25: =RC[-28] -> 4.6243884127600001 | AI25: =RC[-28] -> 72.364311220000005 | AJ25: =RC[-28] -> 33.299999999999997 | AK25: =RC[-28] -> 4.5692457926800003 | AL25: =RC[-28] -> 32.090000000000003 | AM25: =RC[-28] -> 29.456565860000001 | AN25: =RC[-28] -> 27.734573359999999 | AO25: =RC[-28] -> 64.959999999999994 | AP25: - | AQ25: =RC[-29] -> 0 | AR25: =RC[-29] -> 0 | AS25: - | AT25: =RC[-30] -> 0 | AU25: =RC[-30] -> 0 | AV25: =RC[-30] -> 1.77418045524028 | AW25: =RC[-30] -> 4.2100179110537903 | AY25: - | AZ25: - | BA25: -
A26: =IF(RC[1]="","",DATEVALUE(RC[1])) -> 43378 | B26: 05.10.18 | C26: 24 | D26: 91.62360382 | E26: 64.69 | F26: 4.7096090575199998 | G26: 65.462249760000006 | H26: 30.96 | I26: 4.6894853409600001 | J26: =RC[-5]-RC[-2] -> 33.729999999999997 | K26: 26.161354060000001 | L26: 30.215511320000001 | M26: 64.28 | R26: 1.91557950702207 | S26: 3.8781830753797699 | T26: =(RC[-16]*RC[-15]-RC[-13]*RC[-12])/1000 -> 3.9004196785462 | U26: 29.646842960000001 | V26: - | W26: =RC[-2]*RC[-10]/1000 -> 1.9056990654688 | X26: =ABS((RC[-3]*RC[-11]-RC[-2]*RC[-9])/1000) -> #VALUE! | Y26: =(RC[-14]-RC[1])/RC[-18]*100 -> -5.3244257763499139 | Z26: 29.646842960000001 | AC26: =VALUE(RC[-27]) -> 2018-10-05T00:00:00.000 | AD26: =IF(RC[21]=42,"*",IF(RC[21]=32,"",RC[21])) -> - | AE26: =RC[-28] -> 24 | AF26: =RC[-28] -> 91.62360382 | AG26: =RC[-28] -> 64.69 | AH26: =RC[-28] -> 4.7096090575199998 | AI26: =RC[-28] -> 65.462249760000006 | AJ26: =RC[-28] -> 30.96 | AK26: =RC[-28] -> 4.6894853409600001 | AL26: =RC[-28] -> 33.729999999999997 | AM26: =RC[-28] -> 26.161354060000001 | AN26: =RC[-28] -> 30.215511320000001 | AO26: =RC[-28] -> 64.28 | AP26: - | AQ26: =RC[-29] -> 0 | AR26: =RC[-29] -> 0 | AS26: - | AT26: =RC[-30] -> 0 | AU26: =RC[-30] -> 0 | AV26: =RC[-30] -> 1.91557950702207 | AW26: =RC[-30] -> 3.8781830753797699 | AY26: - | AZ26: - | BA26: -
A27: =IF(RC[1]="","",DATEVALUE(RC[1])) -> 43379 | B27: 06.10.18 | C27: 24 | D27: 91.715621949999999 | E27: 65.319999999999993 | F27: 4.6215770066799999 | G27: 65.05155182 | H27: 31.6 | I27: 4.6320065150799996 | J27: =RC[-5]-RC[-2] -> 33.719999999999992 | K27: 26.664070129999999 | L27: =AVERAGE(R[-3]C:R[-1]C) -> 28.400693256666667 | M27: 65.31 | R27: =RC[5] -> 1.8548492765929001 | S27: 3.8956579917837 | T27: =(RC[-16]*RC[-15]-RC[-13]*RC[-12])/1000 -> 3.9352353882619995 | U27: 28.400693256666667 | V27: - | W27: =RC[-2]*RC[-10]/1000 -> 1.8548492765929001 | X27: =ABS((RC[-3]*RC[-11]-RC[-2]*RC[-9])/1000) -> #VALUE! | Y27: =(RC[-14]-RC[1])/RC[-18]*100 -> -2.6696106058652793 | Z27: 28.400693256666667 | AC27: =VALUE(RC[-27]) -> 2018-10-06T00:00:00.000 | AD27: =IF(RC[21]=42,"*",IF(RC[21]=32,"",RC[21])) -> - | AE27: =RC[-28] -> 24 | AF27: =RC[-28] -> 91.715621949999999 | AG27: =RC[-28] -> 65.319999999999993 | AH27: =RC[-28] -> 4.6215770066799999 | AI27: =RC[-28] -> 65.05155182 | AJ27: =RC[-28] -> 31.6 | AK27: =RC[-28] -> 4.6320065150799996 | AL27: =RC[-28] -> 33.719999999999992 | AM27: =RC[-28] -> 26.664070129999999 | AN27: =RC[-28] -> 28.400693256666667 | AO27: =RC[-28] -> 65.31 | AP27: - | AQ27: =RC[-29] -> 0 | AR27: =RC[-29] -> 0 | AS27: - | AT27: =RC[-30] -> 0 | AU27: =RC[-30] -> 0 | AV27: =RC[-30] -> 1.8548492765929001 | AW27: =RC[-30] -> 3.8956579917837 | AY27: - | AZ27: - | BA27: -
A28: =IF(RC[1]="","",DATEVALUE(RC[1])) -> 43380 | B28: 07.10.18 | C28: 24 | D28: 88.813522340000006 | E28: 65.58 | F28: 4.6255486075599999 | G28: 58.713108060000003 | H28: 31.31 | I28: 4.6405733853199997 | J28: =RC[-5]-RC[-2] -> 34.269999999999996 | K28: 30.100414279999999 | L28: 28.400693256666667 | M28: 65.55 | R28: =RC[5] -> 1.8616654429744999 | S28: 3.9110145457151 | T28: =(RC[-16]*RC[-15]-RC[-13]*RC[-12])/1000 -> 3.9860833816986001 | U28: 28.400693256666667 | V28: - | W28: =RC[-2]*RC[-10]/1000 -> 1.8616654429744999 | X28: =ABS((RC[-3]*RC[-11]-RC[-2]*RC[-9])/1000) -> #VALUE! | Y28: =(RC[-14]-RC[1])/RC[-18]*100 -> 2.8949600515039262 | Z28: 28.400693256666667 | AC28: =VALUE(RC[-27]) -> 2018-10-07T00:00:00.000 | AD28: =IF(RC[21]=42,"*",IF(RC[21]=32,"",RC[21])) -> - | AE28: =RC[-28] -> 24 | AF28: =RC[-28] -> 88.813522340000006 | AG28: =RC[-28] -> 65.58 | AH28: =RC[-28] -> 4.6255486075599999 | AI28: =RC[-28] -> 58.713108060000003 | AJ28: =RC[-28] -> 31.31 | AK28: =RC[-28] -> 4.6405733853199997 | AL28: =RC[-28] -> 34.269999999999996 | AM28: =RC[-28] -> 30.100414279999999 | AN28: =RC[-28] -> 28.400693256666667 | AO28: =RC[-28] -> 65.55 | AP28: - | AQ28: =RC[-29] -> 0 | AR28: =RC[-29] -> 0 | AS28: - | AT28: =RC[-30] -> 0 | AU28: =RC[-30] -> 0 | AV28: =RC[-30] -> 1.8616654429744999 | AW28: =RC[-30] -> 3.9110145457151 | AY28: - | AZ28: - | BA28: -
A29: =IF(RC[1]="","",DATEVALUE(RC[1])) -> 43381 | B29: 08.10.18 | C29: 24 | D29: =AVERAGE(R[1]C:R[3]C) -> 250.54728698666668 | E29: =AVERAGE(R[1]C:R[3]C) -> 67.16 | F29: =AVERAGE(R[1]C:R[3]C) -> 5.0371233761599994 | G29: =AVERAGE(R[1]C:R[3]C) -> 227.67353312 | H29: =AVERAGE(R[1]C:R[3]C) -> 49.22 | I29: =AVERAGE(R[1]C:R[3]C) -> 4.7204446511066669 | J29: =AVERAGE(R[1]C:R[3]C) -> 17.940000000000001 | K29: =AVERAGE(R[1]C:R[3]C) -> 22.873753866666664 | L29: 28.400693256666667 | M29: 65.89 | R29: =RC[5] -> 1.8713216786817668 | S29: =RC[1] -> 5.6206644938581318 | T29: =(RC[-16]*RC[-15]-RC[-13]*RC[-12])/1000 -> 5.6206644938581318 | U29: 28.400693256666667 | V29: - | W29: =RC[-2]*RC[-10]/1000 -> 1.8713216786817668 | X29: =ABS((RC[-3]*RC[-11]-RC[-2]*RC[-9])/1000) -> #VALUE! | Y29: =(RC[-14]-RC[1])/RC[-18]*100 -> -2.4275721970225304 | Z29: 28.400693256666667 | AC29: =VALUE(RC[-27]) -> 2018-10-08T00:00:00.000 | AD29: =IF(RC[21]=42,"*",IF(RC[21]=32,"",RC[21])) -> - | AE29: =RC[-28] -> 24 | AF29: =RC[-28] -> 250.54728698666668 | AG29: =RC[-28] -> 67.16 | AH29: =RC[-28] -> 5.0371233761599994 | AI29: =RC[-28] -> 227.67353312 | AJ29: =RC[-28] -> 49.22 | AK29: =RC[-28] -> 4.7204446511066669 | AL29: =RC[-28] -> 17.940000000000001 | AM29: =RC[-28] -> 22.873753866666664 | AN29: =RC[-28] -> 28.400693256666667 | AO29: =RC[-28] -> 65.89 | AP29: - | AQ29: =RC[-29] -> 0 | AR29: =RC[-29] -> 0 | AS29: - | AT29: =RC[-30] -> 0 | AU29: =RC[-30] -> 0 | AV29: =RC[-30] -> 1.8713216786817668 | AW29: =RC[-30] -> 5.6206644938581318 | AY29: - | AZ29: - | BA29: -
A30: =IF(RC[1]="","",DATEVALUE(RC[1])) -> 43382 | B30: 09.10.18 | C30: 24 | D30: 256.82791137999999 | E30: 66.150000000000006 | F30: 5.1545660080399998 | G30: 233.58439636 | H30: 48.48 | I30: 4.8210205131599997 | J30: =RC[-5]-RC[-2] -> 17.670000000000009 | K30: 23.24351502 | L30: 28.400693256666667 | M30: 66.3 | R30: =RC[5] -> 1.8829659629169999 | S30: 5.6396947955479098 | T30: =(RC[-16]*RC[-15]-RC[-13]*RC[-12])/1000 -> 5.6649948022541992 | U30: 28.400693256666667 | V30: - | W30: =RC[-2]*RC[-10]/1000 -> 1.8829659629169999 | X30: =ABS((RC[-3]*RC[-11]-RC[-2]*RC[-9])/1000) -> #VALUE! | Y30: =(RC[-14]-RC[1])/RC[-18]*100 -> -2.2078436389725407 | Z30: 28.400693256666667 | AC30: =VALUE(RC[-27]) -> 2018-10-09T00:00:00.000 | AD30: =IF(RC[21]=42,"*",IF(RC[21]=32,"",RC[21])) -> - | AE30: =RC[-28] -> 24 | AF30: =RC[-28] -> 256.82791137999999 | AG30: =RC[-28] -> 66.150000000000006 | AH30: =RC[-28] -> 5.1545660080399998 | AI30: =RC[-28] -> 233.58439636 | AJ30: =RC[-28] -> 48.48 | AK30: =RC[-28] -> 4.8210205131599997 | AL30: =RC[-28] -> 17.670000000000009 | AM30: =RC[-28] -> 23.24351502 | AN30: =RC[-28] -> 28.400693256666667 | AO30: =RC[-28] -> 66.3 | AP30: - | AQ30: =RC[-29] -> 0 | AR30: =RC[-29] -> 0 | AS30: - | AT30: =RC[-30] -> 0 | AU30: =RC[-30] -> 0 | AV30: =RC[-30] -> 1.8829659629169999 | AW30: =RC[-30] -> 5.6396947955479098 | AY30: - | AZ30: - | BA30: -
A31: =IF(RC[1]="","",DATEVALUE(RC[1])) -> 43383 | B31: 10.10.18 | C31: 24 | D31: 240.85050964000001 | E31: 67.11 | F31: 5.0029393639200004 | G31: 218.81813048999999 | H31: 48.87 | I31: 4.7147900364800002 | J31: =RC[-5]-RC[-2] -> 18.240000000000002 | K31: 22.032379150000001 | L31: 28.400693256666667 | M31: 67.260000000000005 | R31: =RC[5] -> 1.9102306284434001 | S31: 5.4593130433744204 | T31: =(RC[-16]*RC[-15]-RC[-13]*RC[-12])/1000 -> 5.4698356648941022 | U31: 28.400693256666667 | V31: - | W31: =RC[-2]*RC[-10]/1000 -> 1.9102306284434001 | X31: =ABS((RC[-3]*RC[-11]-RC[-2]*RC[-9])/1000) -> #VALUE! | Y31: =(RC[-14]-RC[1])/RC[-18]*100 -> -2.9103228751685633 | Z31: 28.400693256666667 | AC31: =VALUE(RC[-27]) -> 2018-10-10T00:00:00.000 | AD31: =IF(RC[21]=42,"*",IF(RC[21]=32,"",RC[21])) -> - | AE31: =RC[-28] -> 24 | AF31: =RC[-28] -> 240.85050964000001 | AG31: =RC[-28] -> 67.11 | AH31: =RC[-28] -> 5.0029393639200004 | AI31: =RC[-28] -> 218.81813048999999 | AJ31: =RC[-28] -> 48.87 | AK31: =RC[-28] -> 4.7147900364800002 | AL31: =RC[-28] -> 18.240000000000002 | AM31: =RC[-28] -> 22.032379150000001 | AN31: =RC[-28] -> 28.400693256666667 | AO31: =RC[-28] -> 67.260000000000005 | AP31: - | AQ31: =RC[-29] -> 0 | AR31: =RC[-29] -> 0 | AS31: - | AT31: =RC[-30] -> 0 | AU31: =RC[-30] -> 0 | AV31: =RC[-30] -> 1.9102306284434001 | AW31: =RC[-30] -> 5.4593130433744204 | AY31: - | AZ31: - | BA31: -
A32: =IF(RC[1]="","",DATEVALUE(RC[1])) -> 43384 | B32: 11.10.18 | C32: 24 | D32: 253.96343994 | E32: 68.22 | F32: 4.9538647565199998 | G32: 230.61807250999999 | H32: 50.31 | I32: 4.6255234036799999 | J32: =RC[-5]-RC[-2] -> 17.909999999999997 | K32: 23.34536743 | L32: 28.400693256666667 | M32: 68.36 | R32: =RC[5] -> 1.9414713910257333 | S32: 5.7347346780357302 | T32: =(RC[-16]*RC[-15]-RC[-13]*RC[-12])/1000 -> 5.7229906447286991 | U32: 28.400693256666667 | V32: - | W32: =RC[-2]*RC[-10]/1000 -> 1.9414713910257333 | X32: =ABS((RC[-3]*RC[-11]-RC[-2]*RC[-9])/1000) -> #VALUE! | Y32: =(RC[-14]-RC[1])/RC[-18]*100 -> -2.1920770439391561 | Z32: 28.400693256666667 | AC32: =VALUE(RC[-27]) -> 2018-10-11T00:00:00.000 | AD32: =IF(RC[21]=42,"*",IF(RC[21]=32,"",RC[21])) -> - | AE32: =RC[-28] -> 24 | AF32: =RC[-28] -> 253.96343994 | AG32: =RC[-28] -> 68.22 | AH32: =RC[-28] -> 4.9538647565199998 | AI32: =RC[-28] -> 230.61807250999999 | AJ32: =RC[-28] -> 50.31 | AK32: =RC[-28] -> 4.6255234036799999 | AL32: =RC[-28] -> 17.909999999999997 | AM32: =RC[-28] -> 23.34536743 | AN32: =RC[-28] -> 28.400693256666667 | AO32: =RC[-28] -> 68.36 | AP32: - | AQ32: =RC[-29] -> 0 | AR32: =RC[-29] -> 0 | AS32: - | AT32: =RC[-30] -> 0 | AU32: =RC[-30] -> 0 | AV32: =RC[-30] -> 1.9414713910257333 | AW32: =RC[-30] -> 5.7347346780357302 | AY32: - | AZ32: - | BA32: -
A33: =IF(RC[1]="","",DATEVALUE(RC[1])) -> 43385 | B33: 12.10.18 | C33: 24 | D33: 250.47607421999999 | E33: 68.099999999999994 | F33: 4.98995354944 | G33: 230.55410767000001 | H33: 50.24 | I33: 4.6812858147199998 | J33: =RC[-5]-RC[-2] -> 17.859999999999992 | K33: 19.92196655 | L33: 28.400693256666667 | M33: 68.25 | R33: =RC[5] -> 1.9383473147674999 | S33: 5.4635771066208099 | T33: =(RC[-16]*RC[-15]-RC[-13]*RC[-12])/1000 -> 5.4743822850411963 | U33: 28.400693256666667 | V33: - | W33: =RC[-2]*RC[-10]/1000 -> 1.9383473147674999 | X33: =ABS((RC[-3]*RC[-11]-RC[-2]*RC[-9])/1000) -> #VALUE! | Y33: =(RC[-14]-RC[1])/RC[-18]*100 -> -3.6775431122669735 | Z33: 28.400693256666667 | AC33: =VALUE(RC[-27]) -> 2018-10-12T00:00:00.000 | AD33: =IF(RC[21]=42,"*",IF(RC[21]=32,"",RC[21])) -> - | AE33: =RC[-28] -> 24 | AF33: =RC[-28] -> 250.47607421999999 | AG33: =RC[-28] -> 68.099999999999994 | AH33: =RC[-28] -> 4.98995354944 | AI33: =RC[-28] -> 230.55410767000001 | AJ33: =RC[-28] -> 50.24 | AK33: =RC[-28] -> 4.6812858147199998 | AL33: =RC[-28] -> 17.859999999999992 | AM33: =RC[-28] -> 19.92196655 | AN33: =RC[-28] -> 28.400693256666667 | AO33: =RC[-28] -> 68.25 | AP33: - | AQ33: =RC[-29] -> 0 | AR33: =RC[-29] -> 0 | AS33: - | AT33: =RC[-30] -> 0 | AU33: =RC[-30] -> 0 | AV33: =RC[-30] -> 1.9383473147674999 | AW33: =RC[-30] -> 5.4635771066208099 | AY33: - | AZ33: - | BA33: -
A34: =IF(RC[1]="","",DATEVALUE(RC[1])) -> 43386 | B34: 13.10.18 | C34: 24 | D34: 254.18939209000001 | E34: 69.13 | F34: 4.99868439796 | G34: 231.29899596999999 | H34: 51.07 | I34: 4.6813639773600002 | J34: =RC[-5]-RC[-2] -> 18.059999999999995 | K34: 22.890396119999998 | L34: 28.400693256666667 | M34: 69.290000000000006 | R34: =RC[5] -> 1.9678840357544336 | S34: 5.7566075952995099 | T34: =(RC[-16]*RC[-15]-RC[-13]*RC[-12])/1000 -> 5.7596729509937994 | U34: 28.400693256666667 | V34: - | W34: =RC[-2]*RC[-10]/1000 -> 1.9678840357544336 | X34: =ABS((RC[-3]*RC[-11]-RC[-2]*RC[-9])/1000) -> #VALUE! | Y34: =(RC[-14]-RC[1])/RC[-18]*100 -> -2.3823264400946069 | Z34: 28.400693256666667 | AC34: =VALUE(RC[-27]) -> 2018-10-13T00:00:00.000 | AD34: =IF(RC[21]=42,"*",IF(RC[21]=32,"",RC[21])) -> - | AE34: =RC[-28] -> 24 | AF34: =RC[-28] -> 254.18939209000001 | AG34: =RC[-28] -> 69.13 | AH34: =RC[-28] -> 4.99868439796 | AI34: =RC[-28] -> 231.29899596999999 | AJ34: =RC[-28] -> 51.07 | AK34: =RC[-28] -> 4.6813639773600002 | AL34: =RC[-28] -> 18.059999999999995 | AM34: =RC[-28] -> 22.890396119999998 | AN34: =RC[-28] -> 28.400693256666667 | AO34: =RC[-28] -> 69.290000000000006 | AP34: - | AQ34: =RC[-29] -> 0 | AR34: =RC[-29] -> 0 | AS34: - | AT34: =RC[-30] -> 0 | AU34: =RC[-30] -> 0 | AV34: =RC[-30] -> 1.9678840357544336 | AW34: =RC[-30] -> 5.7566075952995099 | AY34: - | AZ34: - | BA34: -
A35: =IF(RC[1]="","",DATEVALUE(RC[1])) -> 43387 | B35: 14.10.18 | C35: 24 | D35: 250.99708557 | E35: 69.91 | F35: 4.9003584498799997 | G35: 228.44163513000001 | H35: 51.75 | I35: 4.5915669406399999 | J35: =RC[-5]-RC[-2] -> 18.159999999999997 | K35: 22.555450440000001 | L35: 28.400693256666667 | M35: 70.069999999999993 | R35: =RC[5] -> 1.9900365764946333 | S35: 5.71236200917168 | T35: =(RC[-16]*RC[-15]-RC[-13]*RC[-12])/1000 -> 5.725351634221199 | U35: 28.400693256666667 | V35: - | W35: =RC[-2]*RC[-10]/1000 -> 1.9900365764946333 | X35: =ABS((RC[-3]*RC[-11]-RC[-2]*RC[-9])/1000) -> #VALUE! | Y35: =(RC[-14]-RC[1])/RC[-18]*100 -> -2.558746707157955 | Z35: 28.400693256666667 | AC35: =VALUE(RC[-27]) -> 2018-10-14T00:00:00.000 | AD35: =IF(RC[21]=42,"*",IF(RC[21]=32,"",RC[21])) -> - | AE35: =RC[-28] -> 24 | AF35: =RC[-28] -> 250.99708557 | AG35: =RC[-28] -> 69.91 | AH35: =RC[-28] -> 4.9003584498799997 | AI35: =RC[-28] -> 228.44163513000001 | AJ35: =RC[-28] -> 51.75 | AK35: =RC[-28] -> 4.5915669406399999 | AL35: =RC[-28] -> 18.159999999999997 | AM35: =RC[-28] -> 22.555450440000001 | AN35: =RC[-28] -> 28.400693256666667 | AO35: =RC[-28] -> 70.069999999999993 | AP35: - | AQ35: =RC[-29] -> 0 | AR35: =RC[-29] -> 0 | AS35: - | AT35: =RC[-30] -> 0 | AU35: =RC[-30] -> 0 | AV35: =RC[-30] -> 1.9900365764946333 | AW35: =RC[-30] -> 5.71236200917168 | AY35: - | AZ35: - | BA35: -
A36: =IF(RC[1]="","",DATEVALUE(RC[1])) -> 43388 | B36: 15.10.18 | C36: 24 | D36: 254.50834656000001 | E36: 69.459999999999994 | F36: 4.8995294769199997 | G36: 233.17852783000001 | H36: 52.06 | I36: 4.5787520431599997 | J36: =RC[-5]-RC[-2] -> 17.399999999999991 | K36: 21.32981873 | L36: 28.400693256666667 | M36: 69.63 | R36: =RC[5] -> 1.9775402714616999 | S36: 5.5272879645552697 | T36: =(RC[-16]*RC[-15]-RC[-13]*RC[-12])/1000 -> 5.5388755932277967 | U36: 28.400693256666667 | V36: - | W36: =RC[-2]*RC[-10]/1000 -> 1.9775402714616999 | X36: =ABS((RC[-3]*RC[-11]-RC[-2]*RC[-9])/1000) -> #VALUE! | Y36: =(RC[-14]-RC[1])/RC[-18]*100 -> -3.0323866406008553 | Z36: 28.400693256666667 | AC36: =VALUE(RC[-27]) -> 2018-10-15T00:00:00.000 | AD36: =IF(RC[21]=42,"*",IF(RC[21]=32,"",RC[21])) -> - | AE36: =RC[-28] -> 24 | AF36: =RC[-28] -> 254.50834656000001 | AG36: =RC[-28] -> 69.459999999999994 | AH36: =RC[-28] -> 4.8995294769199997 | AI36: =RC[-28] -> 233.17852783000001 | AJ36: =RC[-28] -> 52.06 | AK36: =RC[-28] -> 4.5787520431599997 | AL36: =RC[-28] -> 17.399999999999991 | AM36: =RC[-28] -> 21.32981873 | AN36: =RC[-28] -> 28.400693256666667 | AO36: =RC[-28] -> 69.63 | AP36: - | AQ36: =RC[-29] -> 0 | AR36: =RC[-29] -> 0 | AS36: - | AT36: =RC[-30] -> 0 | AU36: =RC[-30] -> 0 | AV36: =RC[-30] -> 1.9775402714616999 | AW36: =RC[-30] -> 5.5272879645552697 | AY36: - | AZ36: - | BA36: -
A37: =IF(RC[1]="","",DATEVALUE(RC[1])) -> 43389 | B37: 16.10.18 | C37: 24 | D37: 254.28814697000001 | E37: 69.52 | F37: 4.8410952505199996 | G37: 232.59803772000001 | H37: 51.97 | I37: 4.5197849638800003 | J37: =RC[-5]-RC[-2] -> 17.549999999999997 | K37: 21.690109249999999 | L37: 28.400693256666667 | M37: 69.680000000000007 | R37: =RC[5] -> 1.9789603061245336 | S37: 5.57488694468329 | T37: =(RC[-16]*RC[-15]-RC[-13]*RC[-12])/1000 -> 5.589991957046001 | U37: 28.400693256666667 | V37: - | W37: =RC[-2]*RC[-10]/1000 -> 1.9789603061245336 | X37: =ABS((RC[-3]*RC[-11]-RC[-2]*RC[-9])/1000) -> #VALUE! | Y37: =(RC[-14]-RC[1])/RC[-18]*100 -> -2.8850561562969097 | Z37: 28.400693256666667 | AC37: =VALUE(RC[-27]) -> 2018-10-16T00:00:00.000 | AD37: =IF(RC[21]=42,"*",IF(RC[21]=32,"",RC[21])) -> - | AE37: =RC[-28] -> 24 | AF37: =RC[-28] -> 254.28814697000001 | AG37: =RC[-28] -> 69.52 | AH37: =RC[-28] -> 4.8410952505199996 | AI37: =RC[-28] -> 232.59803772000001 | AJ37: =RC[-28] -> 51.97 | AK37: =RC[-28] -> 4.5197849638800003 | AL37: =RC[-28] -> 17.549999999999997 | AM37: =RC[-28] -> 21.690109249999999 | AN37: =RC[-28] -> 28.400693256666667 | AO37: =RC[-28] -> 69.680000000000007 | AP37: - | AQ37: =RC[-29] -> 0 | AR37: =RC[-29] -> 0 | AS37: - | AT37: =RC[-30] -> 0 | AU37: =RC[-30] -> 0 | AV37: =RC[-30] -> 1.9789603061245336 | AW37: =RC[-30] -> 5.57488694468329 | AY37: - | AZ37: - | BA37: -
A38: =IF(RC[1]="","",DATEVALUE(RC[1])) -> 43390 | B38: 17.10.18 | C38: 24 | D38: 266.61880493000001 | E38: 69.63 | F38: 4.84611082264 | G38: 243.90043639999999 | H38: 52.56 | I38: 4.4873560396399998 | J38: =RC[-5]-RC[-2] -> 17.069999999999993 | K38: 22.718368529999999 | L38: 28.400693256666667 | M38: 69.8 | R38: =RC[5] -> 1.9823683893153334 | S38: 5.7355296336103896 | T38: =(RC[-16]*RC[-15]-RC[-13]*RC[-12])/1000 -> 5.7452604500918989 | U38: 28.400693256666667 | V38: - | W38: =RC[-2]*RC[-10]/1000 -> 1.9823683893153334 | X38: =ABS((RC[-3]*RC[-11]-RC[-2]*RC[-9])/1000) -> #VALUE! | Y38: =(RC[-14]-RC[1])/RC[-18]*100 -> -2.329772267134274 | Z38: 28.400693256666667 | AC38: =VALUE(RC[-27]) -> 2018-10-17T00:00:00.000 | AD38: =IF(RC[21]=42,"*",IF(RC[21]=32,"",RC[21])) -> - | AE38: =RC[-28] -> 24 | AF38: =RC[-28] -> 266.61880493000001 | AG38: =RC[-28] -> 69.63 | AH38: =RC[-28] -> 4.84611082264 | AI38: =RC[-28] -> 243.90043639999999 | AJ38: =RC[-28] -> 52.56 | AK38: =RC[-28] -> 4.4873560396399998 | AL38: =RC[-28] -> 17.069999999999993 | AM38: =RC[-28] -> 22.718368529999999 | AN38: =RC[-28] -> 28.400693256666667 | AO38: =RC[-28] -> 69.8 | AP38: - | AQ38: =RC[-29] -> 0 | AR38: =RC[-29] -> 0 | AS38: - | AT38: =RC[-30] -> 0 | AU38: =RC[-30] -> 0 | AV38: =RC[-30] -> 1.9823683893153334 | AW38: =RC[-30] -> 5.7355296336103896 | AY38: - | AZ38: - | BA38: -
A39: =IF(RC[1]="","",DATEVALUE(RC[1])) -> 43391 | B39: 18.10.18 | C39: 24 | D39: 280.29794312000001 | E39: 70.040000000000006 | F39: 4.8881441598400004 | G39: 258.54666137999999 | H39: 53.59 | I39: 4.4833081128399996 | J39: =RC[-5]-RC[-2] -> 16.450000000000003 | K39: 21.75128174 | L39: 28.400693256666667 | M39: 70.22 | R39: =RC[5] -> 1.9942966804831332 | S39: 5.7655721529569099 | T39: =(RC[-16]*RC[-15]-RC[-13]*RC[-12])/1000 -> 5.7765523527706044 | U39: 28.400693256666667 | V39: - | W39: =RC[-2]*RC[-10]/1000 -> 1.9942966804831332 | X39: =ABS((RC[-3]*RC[-11]-RC[-2]*RC[-9])/1000) -> #VALUE! | Y39: =(RC[-14]-RC[1])/RC[-18]*100 -> -2.5718419573377003 | Z39: 28.400693256666667 | AC39: =VALUE(RC[-27]) -> 2018-10-18T00:00:00.000 | AD39: =IF(RC[21]=42,"*",IF(RC[21]=32,"",RC[21])) -> - | AE39: =RC[-28] -> 24 | AF39: =RC[-28] -> 280.29794312000001 | AG39: =RC[-28] -> 70.040000000000006 | AH39: =RC[-28] -> 4.8881441598400004 | AI39: =RC[-28] -> 258.54666137999999 | AJ39: =RC[-28] -> 53.59 | AK39: =RC[-28] -> 4.4833081128399996 | AL39: =RC[-28] -> 16.450000000000003 | AM39: =RC[-28] -> 21.75128174 | AN39: =RC[-28] -> 28.400693256666667 | AO39: =RC[-28] -> 70.22 | AP39: - | AQ39: =RC[-29] -> 0 | AR39: =RC[-29] -> 0 | AS39: - | AT39: =RC[-30] -> 0 | AU39: =RC[-30] -> 0 | AV39: =RC[-30] -> 1.9942966804831332 | AW39: =RC[-30] -> 5.7655721529569099 | AY39: - | AZ39: - | BA39: -
A40: =IF(RC[1]="","",DATEVALUE(RC[1])) -> 43392 | B40: 19.10.18 | C40: 24 | D40: 271.05078125 | E40: 69.95 | F40: 4.8839238874799999 | G40: 251.28842162999999 | H40: 53.14 | I40: 4.5068565979199997 | J40: =RC[-5]-RC[-2] -> 16.810000000000002 | K40: 19.762359620000002 | L40: 28.400693256666667 | M40: 70.12 | R40: =RC[5] -> 1.9914566111574667 | S40: 5.5935221792299599 | T40: =(RC[-16]*RC[-15]-RC[-13]*RC[-12])/1000 -> 5.6065354230193005 | U40: 28.400693256666667 | V40: - | W40: =RC[-2]*RC[-10]/1000 -> 1.9914566111574667 | X40: =ABS((RC[-3]*RC[-11]-RC[-2]*RC[-9])/1000) -> #VALUE! | Y40: =(RC[-14]-RC[1])/RC[-18]*100 -> -3.4376170539945723 | Z40: 28.400693256666667 | AC40: =VALUE(RC[-27]) -> 2018-10-19T00:00:00.000 | AD40: =IF(RC[21]=42,"*",IF(RC[21]=32,"",RC[21])) -> - | AE40: =RC[-28] -> 24 | AF40: =RC[-28] -> 271.05078125 | AG40: =RC[-28] -> 69.95 | AH40: =RC[-28] -> 4.8839238874799999 | AI40: =RC[-28] -> 251.28842162999999 | AJ40: =RC[-28] -> 53.14 | AK40: =RC[-28] -> 4.5068565979199997 | AL40: =RC[-28] -> 16.810000000000002 | AM40: =RC[-28] -> 19.762359620000002 | AN40: =RC[-28] -> 28.400693256666667 | AO40: =RC[-28] -> 70.12 | AP40: - | AQ40: =RC[-29] -> 0 | AR40: =RC[-29] -> 0 | AS40: - | AT40: =RC[-30] -> 0 | AU40: =RC[-30] -> 0 | AV40: =RC[-30] -> 1.9914566111574667 | AW40: =RC[-30] -> 5.5935221792299599 | AY40: - | AZ40: - | BA40: -
A41: =IF(RC[1]="","",DATEVALUE(RC[1])) -> 43393 | B41: 20.10.18 | C41: 24 | D41: 249.59356689000001 | E41: 69.28 | F41: 4.8600696905599996 | G41: 227.32698059000001 | H41: 51.4 | I41: 4.5516206275600002 | J41: =RC[-5]-RC[-2] -> 17.880000000000003 | K41: 22.2665863 | L41: 28.400693256666667 | M41: 69.430000000000007 | R41: =RC[5] -> 1.9718601328103669 | S41: 5.5926324663227298 | T41: =(RC[-16]*RC[-15]-RC[-13]*RC[-12])/1000 -> 5.6072355118132018 | U41: 28.400693256666667 | V41: - | W41: =RC[-2]*RC[-10]/1000 -> 1.9718601328103669 | X41: =ABS((RC[-3]*RC[-11]-RC[-2]*RC[-9])/1000) -> #VALUE! | Y41: =(RC[-14]-RC[1])/RC[-18]*100 -> -2.6983629223184709 | Z41: 28.400693256666667 | AC41: =VALUE(RC[-27]) -> 2018-10-20T00:00:00.000 | AD41: =IF(RC[21]=42,"*",IF(RC[21]=32,"",RC[21])) -> - | AE41: =RC[-28] -> 24 | AF41: =RC[-28] -> 249.59356689000001 | AG41: =RC[-28] -> 69.28 | AH41: =RC[-28] -> 4.8600696905599996 | AI41: =RC[-28] -> 227.32698059000001 | AJ41: =RC[-28] -> 51.4 | AK41: =RC[-28] -> 4.5516206275600002 | AL41: =RC[-28] -> 17.880000000000003 | AM41: =RC[-28] -> 22.2665863 | AN41: =RC[-28] -> 28.400693256666667 | AO41: =RC[-28] -> 69.430000000000007 | AP41: - | AQ41: =RC[-29] -> 0 | AR41: =RC[-29] -> 0 | AS41: - | AT41: =RC[-30] -> 0 | AU41: =RC[-30] -> 0 | AV41: =RC[-30] -> 1.9718601328103669 | AW41: =RC[-30] -> 5.5926324663227298 | AY41: - | AZ41: - | BA41: -
A42: =IF(RC[1]="","",DATEVALUE(RC[1])) -> 43394 | B42: 21.10.18 | C42: 24 | D42: 242.57565308 | E42: 68.430000000000007 | F42: 4.8622188570400002 | G42: 216.23057556000001 | H42: 50.08 | I42: 4.5787672471200001 | J42: =RC[-5]-RC[-2] -> 18.350000000000009 | K42: 26.34507752 | L42: 28.400693256666667 | M42: 68.58 | R42: =RC[5] -> 1.9477195435421999 | S42: 5.7408032244195999 | T42: =(RC[-16]*RC[-15]-RC[-13]*RC[-12])/1000 -> 5.7706247162195998 | U42: 28.400693256666667 | V42: - | W42: =RC[-2]*RC[-10]/1000 -> 1.9477195435421999 | X42: =ABS((RC[-3]*RC[-11]-RC[-2]*RC[-9])/1000) -> #VALUE! | Y42: =(RC[-14]-RC[1])/RC[-18]*100 -> -0.95065914306659716 | Z42: 28.400693256666667 | AC42: =VALUE(RC[-27]) -> 2018-10-21T00:00:00.000 | AD42: =IF(RC[21]=42,"*",IF(RC[21]=32,"",RC[21])) -> - | AE42: =RC[-28] -> 24 | AF42: =RC[-28] -> 242.57565308 | AG42: =RC[-28] -> 68.430000000000007 | AH42: =RC[-28] -> 4.8622188570400002 | AI42: =RC[-28] -> 216.23057556000001 | AJ42: =RC[-28] -> 50.08 | AK42: =RC[-28] -> 4.5787672471200001 | AL42: =RC[-28] -> 18.350000000000009 | AM42: =RC[-28] -> 26.34507752 | AN42: =RC[-28] -> 28.400693256666667 | AO42: =RC[-28] -> 68.58 | AP42: - | AQ42: =RC[-29] -> 0 | AR42: =RC[-29] -> 0 | AS42: - | AT42: =RC[-30] -> 0 | AU42: =RC[-30] -> 0 | AV42: =RC[-30] -> 1.9477195435421999 | AW42: =RC[-30] -> 5.7408032244195999 | AY42: - | AZ42: - | BA42: -
A43: =IF(RC[1]="","",DATEVALUE(RC[1])) -> 43395 | B43: 22.10.18 | C43: 24 | D43: 234.56256103999999 | E43: 68.760000000000005 | F43: 4.8666891273999999 | G43: 211.74325562000001 | H43: 49.97 | I43: 4.6023473645999999 | J43: =RC[-5]-RC[-2] -> 18.790000000000006 | K43: 22.819305419999999 | L43: 28.400693256666667 | M43: 68.91 | R43: =RC[5] -> 1.9570917723168999 | S43: 5.5306399923569298 | T43: =(RC[-16]*RC[-15]-RC[-13]*RC[-12])/1000 -> 5.5477112137789995 | U43: 28.400693256666667 | V43: - | W43: =RC[-2]*RC[-10]/1000 -> 1.9570917723168999 | X43: =ABS((RC[-3]*RC[-11]-RC[-2]*RC[-9])/1000) -> #VALUE! | Y43: =(RC[-14]-RC[1])/RC[-18]*100 -> -2.6359223675502435 | Z43: 28.400693256666667 | AC43: =VALUE(RC[-27]) -> 2018-10-22T00:00:00.000 | AD43: =IF(RC[21]=42,"*",IF(RC[21]=32,"",RC[21])) -> - | AE43: =RC[-28] -> 24 | AF43: =RC[-28] -> 234.56256103999999 | AG43: =RC[-28] -> 68.760000000000005 | AH43: =RC[-28] -> 4.8666891273999999 | AI43: =RC[-28] -> 211.74325562000001 | AJ43: =RC[-28] -> 49.97 | AK43: =RC[-28] -> 4.6023473645999999 | AL43: =RC[-28] -> 18.790000000000006 | AM43: =RC[-28] -> 22.819305419999999 | AN43: =RC[-28] -> 28.400693256666667 | AO43: =RC[-28] -> 68.91 | AP43: - | AQ43: =RC[-29] -> 0 | AR43: =RC[-29] -> 0 | AS43: - | AT43: =RC[-30] -> 0 | AU43: =RC[-30] -> 0 | AV43: =RC[-30] -> 1.9570917723168999 | AW43: =RC[-30] -> 5.5306399923569298 | AY43: - | AZ43: - | BA43: -
A44: =IF(RC[1]="","",DATEVALUE(RC[1])) ->  | C44: 24 | J44: =RC[-5]-RC[-2] -> #VALUE! | T44: =(RC[-16]*RC[-15]-RC[-13]*RC[-12])/1000 -> #VALUE! | W44: =RC[-2]*RC[-10]/1000 -> #VALUE! | X44: =ABS((RC[-3]*RC[-11]-RC[-2]*RC[-9])/1000) -> #VALUE! | Y44: =(RC[-14]-RC[1])/RC[-18]*100 -> #VALUE! | AC44: =VALUE(RC[-27]) -> #VALUE! | AD44: =IF(RC[21]=42,"*",IF(RC[21]=32,"",RC[21])) ->  | AE44: =RC[-28] -> 24 | AF44: =RC[-28] ->  | AG44: =RC[-28] ->  | AH44: =RC[-28] ->  | AI44: =RC[-28] ->  | AJ44: =RC[-28] ->  | AK44: =RC[-28] ->  | AL44: =RC[-28] -> #VALUE! | AM44: =RC[-28] ->  | AN44: =RC[-28] ->  | AO44: =RC[-28] ->  | AP44: - | AQ44: =RC[-29] -> 0 | AR44: =RC[-29] -> 0 | AS44: - | AT44: =RC[-30] -> 0 | AU44: =RC[-30] -> 0 | AV44: =RC[-30] ->  | AW44: =RC[-30] -> 
A45: =IF(RC[1]="","",DATEVALUE(RC[1])) ->  | C45: 24 | T45: =(RC[-16]*RC[-15]-RC[-13]*RC[-12])/1000 -> #VALUE! | W45: =RC[-2]*RC[-10]/1000 -> #VALUE! | X45: =ABS((RC[-3]*RC[-11]-RC[-2]*RC[-9])/1000) -> #VALUE! | Y45: =(RC[-14]-RC[1])/RC[-18]*100 -> #VALUE! | AC45: =VALUE(RC[-27]) -> #VALUE! | AD45: =IF(RC[21]=42,"*",IF(RC[21]=32,"",RC[21])) ->  | AE45: =RC[-28] -> 24 | AF45: =RC[-28] ->  | AG45: =RC[-28] ->  | AH45: =RC[-28] ->  | AI45: =RC[-28] ->  | AJ45: =RC[-28] ->  | AK45: =RC[-28] ->  | AL45: =RC[-28] -> 0 | AM45: =RC[-28] ->  | AN45: =RC[-28] ->  | AO45: =RC[-28] ->  | AP45: - | AQ45: =RC[-29] -> 0 | AR45: =RC[-29] -> 0 | AS45: - | AT45: =RC[-30] -> 0 | AU45: =RC[-30] -> 0 | AV45: =RC[-30] ->  | AW45: =RC[-30] -> 
A46: =IF(RC[1]="","",DATEVALUE(RC[1])) ->  | C46: 24 | T46: =(RC[-16]*RC[-15]-RC[-13]*RC[-12])/1000 -> #VALUE! | W46: =RC[-2]*RC[-10]/1000 -> #VALUE! | X46: =ABS((RC[-3]*RC[-11]-RC[-2]*RC[-9])/1000) -> #VALUE! | Y46: =(RC[-14]-RC[1])/RC[-18]*100 -> #VALUE! | AC46: =VALUE(RC[-27]) -> #VALUE! | AD46: =IF(RC[21]=42,"*",IF(RC[21]=32,"",RC[21])) ->  | AE46: =RC[-28] -> 24 | AF46: =RC[-28] ->  | AG46: =RC[-28] ->  | AH46: =RC[-28] ->  | AI46: =RC[-28] ->  | AJ46: =RC[-28] ->  | AK46: =RC[-28] ->  | AL46: =RC[-28] -> 0 | AM46: =RC[-28] ->  | AN46: =RC[-28] ->  | AO46: =RC[-28] ->  | AP46: - | AQ46: =RC[-29] -> 0 | AR46: =RC[-29] -> 0 | AS46: - | AT46: =RC[-30] -> 0 | AU46: =RC[-30] -> 0 | AV46: =RC[-30] ->  | AW46: =RC[-30] -> 
A47: =IF(RC[1]="","",DATEVALUE(RC[1])) ->  | C47: 24 | T47: =(RC[-16]*RC[-15]-RC[-13]*RC[-12])/1000 -> #VALUE! | W47: =RC[-2]*RC[-10]/1000 -> #VALUE! | X47: =ABS((RC[-3]*RC[-11]-RC[-2]*RC[-9])/1000) -> #VALUE! | Y47: =(RC[-14]-RC[1])/RC[-18]*100 -> #VALUE! | AC47: =VALUE(RC[-27]) -> #VALUE! | AD47: =IF(RC[21]=42,"*",IF(RC[21]=32,"",RC[21])) ->  | AE47: =RC[-28] -> 24 | AF47: =RC[-28] ->  | AG47: =RC[-28] ->  | AH47: =RC[-28] ->  | AI47: =RC[-28] ->  | AJ47: =RC[-28] ->  | AK47: =RC[-28] ->  | AL47: =RC[-28] -> 0 | AM47: =RC[-28] ->  | AN47: =RC[-28] ->  | AO47: =RC[-28] ->  | AP47: - | AQ47: =RC[-29] -> 0 | AR47: =RC[-29] -> 0 | AS47: - | AT47: =RC[-30] -> 0 | AU47: =RC[-30] -> 0 | AV47: =RC[-30] ->  | AW47: =RC[-30] -> 
A48: =IF(RC[1]="","",DATEVALUE(RC[1])) ->  | C48: 24 | T48: =(RC[-16]*RC[-15]-RC[-13]*RC[-12])/1000 -> #VALUE! | W48: =RC[-2]*RC[-10]/1000 -> #VALUE! | X48: =ABS((RC[-3]*RC[-11]-RC[-2]*RC[-9])/1000) -> #VALUE! | Y48: =(RC[-14]-RC[1])/RC[-18]*100 -> #VALUE! | AC48: =VALUE(RC[-27]) -> #VALUE! | AD48: =IF(RC[21]=42,"*",IF(RC[21]=32,"",RC[21])) ->  | AE48: =RC[-28] -> 24 | AF48: =RC[-28] ->  | AG48: =RC[-28] ->  | AH48: =RC[-28] ->  | AI48: =RC[-28] ->  | AJ48: =RC[-28] ->  | AK48: =RC[-28] ->  | AL48: =RC[-28] -> 0 | AM48: =RC[-28] ->  | AN48: =RC[-28] ->  | AO48: =RC[-28] ->  | AP48: - | AQ48: =RC[-29] -> 0 | AR48: =RC[-29] -> 0 | AS48: - | AT48: =RC[-30] -> 0 | AU48: =RC[-30] -> 0 | AV48: =RC[-30] ->  | AW48: =RC[-30] -> 
A49: =IF(RC[1]="","",DATEVALUE(RC[1])) ->  | C49: 24 | T49: =(RC[-16]*RC[-15]-RC[-13]*RC[-12])/1000 -> #VALUE! | W49: =RC[-2]*RC[-10]/1000 -> #VALUE! | X49: =ABS((RC[-3]*RC[-11]-RC[-2]*RC[-9])/1000) -> #VALUE! | Y49: =(RC[-14]-RC[1])/RC[-18]*100 -> #VALUE! | AC49: =VALUE(RC[-27]) -> #VALUE! | AD49: =IF(RC[21]=42,"*",IF(RC[21]=32,"",RC[21])) ->  | AE49: =RC[-28] -> 24 | AF49: =RC[-28] ->  | AG49: =RC[-28] ->  | AH49: =RC[-28] ->  | AI49: =RC[-28] ->  | AJ49: =RC[-28] ->  | AK49: =RC[-28] ->  | AL49: =RC[-28] -> 0 | AM49: =RC[-28] ->  | AN49: =RC[-28] ->  | AO49: =RC[-28] ->  | AP49: - | AQ49: =RC[-29] -> 0 | AR49: =RC[-29] -> 0 | AS49: - | AT49: =RC[-30] -> 0 | AU49: =RC[-30] -> 0 | AV49: =RC[-30] ->  | AW49: =RC[-30] -> 
A50: =IF(RC[1]="","",DATEVALUE(RC[1])) ->  | T50: =(RC[-16]*RC[-15]-RC[-13]*RC[-12])/1000 -> #VALUE! | W50: =RC[-2]*RC[-10]/1000 -> #VALUE! | X50: =ABS((RC[-3]*RC[-11]-RC[-2]*RC[-9])/1000) -> #VALUE! | Y50: =(RC[-14]-RC[1])/RC[-18]*100 -> #VALUE! | AC50: =VALUE(RC[-27]) -> #VALUE! | AD50: =IF(RC[21]=42,"*",IF(RC[21]=32,"",RC[21])) ->  | AE50: =RC[-28] ->  | AF50: =RC[-28] ->  | AG50: =RC[-28] ->  | AH50: =RC[-28] ->  | AI50: =RC[-28] ->  | AJ50: =RC[-28] ->  | AK50: =RC[-28] ->  | AL50: =RC[-28] -> 0 | AM50: =RC[-28] ->  | AN50: =RC[-28] ->  | AO50: =RC[-28] ->  | AP50: - | AQ50: =RC[-29] -> 0 | AR50: =RC[-29] -> 0 | AS50: - | AT50: =RC[-30] -> 0 | AU50: =RC[-30] -> 0 | AV50: =RC[-30] ->  | AW50: =RC[-30] -> 
A51: =IF(RC[1]="","",DATEVALUE(RC[1])) ->  | T51: =(RC[-16]*RC[-15]-RC[-13]*RC[-12])/1000 -> #VALUE! | W51: =RC[-2]*RC[-10]/1000 -> #VALUE! | X51: =ABS((RC[-3]*RC[-11]-RC[-2]*RC[-9])/1000) -> #VALUE! | Y51: =(RC[-14]-RC[1])/RC[-18]*100 -> #VALUE! | AC51: =VALUE(RC[-27]) -> #VALUE! | AD51: =IF(RC[21]=42,"*",IF(RC[21]=32,"",RC[21])) ->  | AE51: =RC[-28] ->  | AF51: =RC[-28] ->  | AG51: =RC[-28] ->  | AH51: =RC[-28] ->  | AI51: =RC[-28] ->  | AJ51: =RC[-28] ->  | AK51: =RC[-28] ->  | AL51: =RC[-28] -> 0 | AM51: =RC[-28] ->  | AN51: =RC[-28] ->  | AO51: =RC[-28] ->  | AP51: - | AQ51: =RC[-29] -> 0 | AR51: =RC[-29] -> 0 | AS51: - | AT51: =RC[-30] -> 0 | AU51: =RC[-30] -> 0 | AV51: =RC[-30] ->  | AW51: =RC[-30] -> 
A52: =IF(RC[1]="","",DATEVALUE(RC[1])) ->  | T52: =(RC[-16]*RC[-15]-RC[-13]*RC[-12])/1000 -> #VALUE! | W52: =RC[-2]*RC[-10]/1000 -> #VALUE! | X52: =ABS((RC[-3]*RC[-11]-RC[-2]*RC[-9])/1000) -> #VALUE! | Y52: =(RC[-14]-RC[1])/RC[-18]*100 -> #VALUE! | AC52: =VALUE(RC[-27]) -> #VALUE! | AD52: =IF(RC[21]=42,"*",IF(RC[21]=32,"",RC[21])) ->  | AE52: =RC[-28] ->  | AF52: =RC[-28] ->  | AG52: =RC[-28] ->  | AH52: =RC[-28] ->  | AI52: =RC[-28] ->  | AJ52: =RC[-28] ->  | AK52: =RC[-28] ->  | AL52: =RC[-28] -> 0 | AM52: =RC[-28] ->  | AN52: =RC[-28] ->  | AO52: =RC[-28] ->  | AP52: - | AQ52: =RC[-29] -> 0 | AR52: =RC[-29] -> 0 | AS52: - | AT52: =RC[-30] -> 0 | AU52: =RC[-30] -> 0 | AV52: =RC[-30] ->  | AW52: =RC[-30] -> 
A53: =IF(RC[1]="","",DATEVALUE(RC[1])) ->  | T53: =(RC[-16]*RC[-15]-RC[-13]*RC[-12])/1000 -> #VALUE! | W53: =RC[-2]*RC[-10]/1000 -> #VALUE! | X53: =ABS((RC[-3]*RC[-11]-RC[-2]*RC[-9])/1000) -> #VALUE! | Y53: =(RC[-14]-RC[1])/RC[-18]*100 -> #VALUE! | AC53: =VALUE(RC[-27]) -> #VALUE! | AD53: =IF(RC[21]=42,"*",IF(RC[21]=32,"",RC[21])) ->  | AE53: =RC[-28] ->  | AF53: =RC[-28] ->  | AG53: =RC[-28] ->  | AH53: =RC[-28] ->  | AI53: =RC[-28] ->  | AJ53: =RC[-28] ->  | AK53: =RC[-28] ->  | AL53: =RC[-28] -> 0 | AM53: =RC[-28] ->  | AN53: =RC[-28] ->  | AO53: =RC[-28] ->  | AP53: - | AQ53: =RC[-29] -> 0 | AR53: =RC[-29] -> 0 | AS53: - | AT53: =RC[-30] -> 0 | AU53: =RC[-30] -> 0 | AV53: =RC[-30] ->  | AW53: =RC[-30] -> 
A54: =IF(RC[1]="","",DATEVALUE(RC[1])) ->  | T54: =(RC[-16]*RC[-15]-RC[-13]*RC[-12])/1000 -> #VALUE! | W54: =RC[-2]*RC[-10]/1000 -> #VALUE! | X54: =ABS((RC[-3]*RC[-11]-RC[-2]*RC[-9])/1000) -> #VALUE! | Y54: =(RC[-14]-RC[1])/RC[-18]*100 -> #VALUE! | AC54: =VALUE(RC[-27]) -> #VALUE! | AD54: =IF(RC[21]=42,"*",IF(RC[21]=32,"",RC[21])) ->  | AE54: =RC[-28] ->  | AF54: =RC[-28] ->  | AG54: =RC[-28] ->  | AH54: =RC[-28] ->  | AI54: =RC[-28] ->  | AJ54: =RC[-28] ->  | AK54: =RC[-28] ->  | AL54: =RC[-28] -> 0 | AM54: =RC[-28] ->  | AN54: =RC[-28] ->  | AO54: =RC[-28] ->  | AP54: - | AQ54: =RC[-29] -> 0 | AR54: =RC[-29] -> 0 | AS54: - | AT54: =RC[-30] -> 0 | AU54: =RC[-30] -> 0 | AV54: =RC[-30] ->  | AW54: =RC[-30] -> 
A55: =IF(RC[1]="","",DATEVALUE(RC[1])) ->  | T55: =(RC[-16]*RC[-15]-RC[-13]*RC[-12])/1000 -> #VALUE! | W55: =RC[-2]*RC[-10]/1000 -> #VALUE! | X55: =ABS((RC[-3]*RC[-11]-RC[-2]*RC[-9])/1000) -> #VALUE! | Y55: =(RC[-14]-RC[1])/RC[-18]*100 -> #VALUE! | AC55: =VALUE(RC[-27]) -> #VALUE! | AD55: =IF(RC[21]=42,"*",IF(RC[21]=32,"",RC[21])) ->  | AE55: =RC[-28] ->  | AF55: =RC[-28] ->  | AG55: =RC[-28] ->  | AH55: =RC[-28] ->  | AI55: =RC[-28] ->  | AJ55: =RC[-28] ->  | AK55: =RC[-28] ->  | AL55: =RC[-28] -> 0 | AM55: =RC[-28] ->  | AN55: =RC[-28] ->  | AO55: =RC[-28] ->  | AP55: - | AQ55: =RC[-29] -> 0 | AR55: =RC[-29] -> 0 | AS55: - | AT55: =RC[-30] -> 0 | AU55: =RC[-30] -> 0 | AV55: =RC[-30] ->  | AW55: =RC[-30] -> 
A56: =IF(RC[1]="","",DATEVALUE(RC[1])) ->  | T56: =(RC[-16]*RC[-15]-RC[-13]*RC[-12])/1000 -> #VALUE! | W56: =RC[-2]*RC[-10]/1000 -> #VALUE! | X56: =ABS((RC[-3]*RC[-11]-RC[-2]*RC[-9])/1000) -> #VALUE! | Y56: =(RC[-14]-RC[1])/RC[-18]*100 -> #VALUE! | AC56: =VALUE(RC[-27]) -> #VALUE! | AD56: =IF(RC[21]=42,"*",IF(RC[21]=32,"",RC[21])) ->  | AE56: =RC[-28] ->  | AF56: =RC[-28] ->  | AG56: =RC[-28] ->  | AH56: =RC[-28] ->  | AI56: =RC[-28] ->  | AJ56: =RC[-28] ->  | AK56: =RC[-28] ->  | AL56: =RC[-28] -> 0 | AM56: =RC[-28] ->  | AN56: =RC[-28] ->  | AO56: =RC[-28] ->  | AP56: - | AQ56: =RC[-29] -> 0 | AR56: =RC[-29] -> 0 | AS56: - | AT56: =RC[-30] -> 0 | AU56: =RC[-30] -> 0 | AV56: =RC[-30] ->  | AW56: =RC[-30] -> 
A57: =IF(RC[1]="","",DATEVALUE(RC[1])) ->  | T57: =(RC[-16]*RC[-15]-RC[-13]*RC[-12])/1000 -> #VALUE! | W57: =RC[-2]*RC[-10]/1000 -> #VALUE! | X57: =ABS((RC[-3]*RC[-11]-RC[-2]*RC[-9])/1000) -> #VALUE! | Y57: =(RC[-14]-RC[1])/RC[-18]*100 -> #VALUE! | AC57: =VALUE(RC[-27]) -> #VALUE! | AD57: =IF(RC[21]=42,"*",IF(RC[21]=32,"",RC[21])) ->  | AE57: =RC[-28] ->  | AF57: =RC[-28] ->  | AG57: =RC[-28] ->  | AH57: =RC[-28] ->  | AI57: =RC[-28] ->  | AJ57: =RC[-28] ->  | AK57: =RC[-28] ->  | AL57: =RC[-28] -> 0 | AM57: =RC[-28] ->  | AN57: =RC[-28] ->  | AO57: =RC[-28] ->  | AP57: - | AQ57: =RC[-29] -> 0 | AR57: =RC[-29] -> 0 | AS57: - | AT57: =RC[-30] -> 0 | AU57: =RC[-30] -> 0 | AV57: =RC[-30] ->  | AW57: =RC[-30] -> 
A58: =IF(RC[1]="","",DATEVALUE(RC[1])) ->  | T58: =(RC[-16]*RC[-15]-RC[-13]*RC[-12])/1000 -> #VALUE! | W58: =RC[-2]*RC[-10]/1000 -> #VALUE! | X58: =ABS((RC[-3]*RC[-11]-RC[-2]*RC[-9])/1000) -> #VALUE! | Y58: =(RC[-14]-RC[1])/RC[-18]*100 -> #VALUE! | AC58: =VALUE(RC[-27]) -> #VALUE! | AD58: =IF(RC[21]=42,"*",IF(RC[21]=32,"",RC[21])) ->  | AE58: =RC[-28] ->  | AF58: =RC[-28] ->  | AG58: =RC[-28] ->  | AH58: =RC[-28] ->  | AI58: =RC[-28] ->  | AJ58: =RC[-28] ->  | AK58: =RC[-28] ->  | AL58: =RC[-28] -> 0 | AM58: =RC[-28] ->  | AN58: =RC[-28] ->  | AO58: =RC[-28] ->  | AP58: - | AQ58: =RC[-29] -> 0 | AR58: =RC[-29] -> 0 | AS58: - | AT58: =RC[-30] -> 0 | AU58: =RC[-30] -> 0 | AV58: =RC[-30] ->  | AW58: =RC[-30] -> 
A59: =IF(RC[1]="","",DATEVALUE(RC[1])) ->  | T59: =(RC[-16]*RC[-15]-RC[-13]*RC[-12])/1000 -> #VALUE! | W59: =RC[-2]*RC[-10]/1000 -> #VALUE! | X59: =ABS((RC[-3]*RC[-11]-RC[-2]*RC[-9])/1000) -> #VALUE! | Y59: =(RC[-14]-RC[1])/RC[-18]*100 -> #VALUE! | AC59: =VALUE(RC[-27]) -> #VALUE! | AD59: =IF(RC[21]=42,"*",IF(RC[21]=32,"",RC[21])) ->  | AE59: =RC[-28] ->  | AF59: =RC[-28] ->  | AG59: =RC[-28] ->  | AH59: =RC[-28] ->  | AI59: =RC[-28] ->  | AJ59: =RC[-28] ->  | AK59: =RC[-28] ->  | AL59: =RC[-28] -> 0 | AM59: =RC[-28] ->  | AN59: =RC[-28] ->  | AO59: =RC[-28] ->  | AP59: - | AQ59: =RC[-29] -> 0 | AR59: =RC[-29] -> 0 | AS59: - | AT59: =RC[-30] -> 0 | AU59: =RC[-30] -> 0 | AV59: =RC[-30] ->  | AW59: =RC[-30] -> 
A60: =IF(RC[1]="","",DATEVALUE(RC[1])) ->  | T60: =(RC[-16]*RC[-15]-RC[-13]*RC[-12])/1000 -> #VALUE! | W60: =RC[-2]*RC[-10]/1000 -> #VALUE! | X60: =ABS((RC[-3]*RC[-11]-RC[-2]*RC[-9])/1000) -> #VALUE! | Y60: =(RC[-14]-RC[1])/RC[-18]*100 -> #VALUE! | AC60: =VALUE(RC[-27]) -> #VALUE! | AD60: =IF(RC[21]=42,"*",IF(RC[21]=32,"",RC[21])) ->  | AE60: =RC[-28] ->  | AF60: =RC[-28] ->  | AG60: =RC[-28] ->  | AH60: =RC[-28] ->  | AI60: =RC[-28] ->  | AJ60: =RC[-28] ->  | AK60: =RC[-28] ->  | AL60: =RC[-28] -> 0 | AM60: =RC[-28] ->  | AN60: =RC[-28] ->  | AO60: =RC[-28] ->  | AP60: - | AQ60: =RC[-29] -> 0 | AR60: =RC[-29] -> 0 | AS60: - | AT60: =RC[-30] -> 0 | AU60: =RC[-30] -> 0 | AV60: =RC[-30] ->  | AW60: =RC[-30] -> 
A61: =IF(RC[1]="","",DATEVALUE(RC[1])) ->  | T61: =(RC[-16]*RC[-15]-RC[-13]*RC[-12])/1000 -> #VALUE! | W61: =RC[-2]*RC[-10]/1000 -> #VALUE! | X61: =ABS((RC[-3]*RC[-11]-RC[-2]*RC[-9])/1000) -> #VALUE! | Y61: =(RC[-14]-RC[1])/RC[-18]*100 -> #VALUE! | AC61: =VALUE(RC[-27]) -> #VALUE! | AD61: =IF(RC[21]=42,"*",IF(RC[21]=32,"",RC[21])) ->  | AE61: =RC[-28] ->  | AF61: =RC[-28] ->  | AG61: =RC[-28] ->  | AH61: =RC[-28] ->  | AI61: =RC[-28] ->  | AJ61: =RC[-28] ->  | AK61: =RC[-28] ->  | AL61: =RC[-28] -> 0 | AM61: =RC[-28] ->  | AN61: =RC[-28] ->  | AO61: =RC[-28] ->  | AP61: - | AQ61: =RC[-29] -> 0 | AR61: =RC[-29] -> 0 | AS61: - | AT61: =RC[-30] -> 0 | AU61: =RC[-30] -> 0 | AV61: =RC[-30] ->  | AW61: =RC[-30] -> 
A62: =IF(RC[1]="","",DATEVALUE(RC[1])) ->  | T62: =(RC[-16]*RC[-15]-RC[-13]*RC[-12])/1000 -> #VALUE! | W62: =RC[-2]*RC[-10]/1000 -> #VALUE! | X62: =ABS((RC[-3]*RC[-11]-RC[-2]*RC[-9])/1000) -> #VALUE! | Y62: =(RC[-14]-RC[1])/RC[-18]*100 -> #VALUE! | AC62: =VALUE(RC[-27]) -> #VALUE! | AD62: =IF(RC[21]=42,"*",IF(RC[21]=32,"",RC[21])) ->  | AE62: =RC[-28] ->  | AF62: =RC[-28] ->  | AG62: =RC[-28] ->  | AH62: =RC[-28] ->  | AI62: =RC[-28] ->  | AJ62: =RC[-28] ->  | AK62: =RC[-28] ->  | AL62: =RC[-28] -> 0 | AM62: =RC[-28] ->  | AN62: =RC[-28] ->  | AO62: =RC[-28] ->  | AP62: - | AQ62: =RC[-29] -> 0 | AR62: =RC[-29] -> 0 | AS62: - | AT62: =RC[-30] -> 0 | AU62: =RC[-30] -> 0 | AV62: =RC[-30] ->  | AW62: =RC[-30] -> 
A63: =IF(RC[1]="","",DATEVALUE(RC[1])) ->  | T63: =(RC[-16]*RC[-15]-RC[-13]*RC[-12])/1000 -> #VALUE! | W63: =RC[-2]*RC[-10]/1000 -> #VALUE! | X63: =ABS((RC[-3]*RC[-11]-RC[-2]*RC[-9])/1000) -> #VALUE! | Y63: =(RC[-14]-RC[1])/RC[-18]*100 -> #VALUE! | AC63: =VALUE(RC[-27]) -> #VALUE! | AD63: =IF(RC[21]=42,"*",IF(RC[21]=32,"",RC[21])) ->  | AE63: =RC[-28] ->  | AF63: =RC[-28] ->  | AG63: =RC[-28] ->  | AH63: =RC[-28] ->  | AI63: =RC[-28] ->  | AJ63: =RC[-28] ->  | AK63: =RC[-28] ->  | AL63: =RC[-28] -> 0 | AM63: =RC[-28] ->  | AN63: =RC[-28] ->  | AO63: =RC[-28] ->  | AP63: - | AQ63: =RC[-29] -> 0 | AR63: =RC[-29] -> 0 | AS63: - | AT63: =RC[-30] -> 0 | AU63: =RC[-30] -> 0 | AV63: =RC[-30] ->  | AW63: =RC[-30] -> 
A64: =IF(RC[1]="","",DATEVALUE(RC[1])) ->  | T64: =(RC[-16]*RC[-15]-RC[-13]*RC[-12])/1000 -> #VALUE! | W64: =RC[-2]*RC[-10]/1000 -> #VALUE! | X64: =ABS((RC[-3]*RC[-11]-RC[-2]*RC[-9])/1000) -> #VALUE! | Y64: =(RC[-14]-RC[1])/RC[-18]*100 -> #VALUE! | AC64: =VALUE(RC[-27]) -> #VALUE! | AD64: =IF(RC[21]=42,"*",IF(RC[21]=32,"",RC[21])) ->  | AE64: =RC[-28] ->  | AF64: =RC[-28] ->  | AG64: =RC[-28] ->  | AH64: =RC[-28] ->  | AI64: =RC[-28] ->  | AJ64: =RC[-28] ->  | AK64: =RC[-28] ->  | AL64: =RC[-28] -> 0 | AM64: =RC[-28] ->  | AN64: =RC[-28] ->  | AO64: =RC[-28] ->  | AP64: - | AQ64: =RC[-29] -> 0 | AR64: =RC[-29] -> 0 | AS64: - | AT64: =RC[-30] -> 0 | AU64: =RC[-30] -> 0 | AV64: =RC[-30] ->  | AW64: =RC[-30] -> 
A65: =IF(RC[1]="","",DATEVALUE(RC[1])) ->  | T65: =(RC[-16]*RC[-15]-RC[-13]*RC[-12])/1000 -> #VALUE! | W65: =RC[-2]*RC[-10]/1000 -> #VALUE! | X65: =ABS((RC[-3]*RC[-11]-RC[-2]*RC[-9])/1000) -> #VALUE! | Y65: =(RC[-14]-RC[1])/RC[-18]*100 -> #VALUE! | AC65: =VALUE(RC[-27]) -> #VALUE! | AD65: =IF(RC[21]=42,"*",IF(RC[21]=32,"",RC[21])) ->  | AE65: =RC[-28] ->  | AF65: =RC[-28] ->  | AG65: =RC[-28] ->  | AH65: =RC[-28] ->  | AI65: =RC[-28] ->  | AJ65: =RC[-28] ->  | AK65: =RC[-28] ->  | AL65: =RC[-28] -> 0 | AM65: =RC[-28] ->  | AN65: =RC[-28] ->  | AO65: =RC[-28] ->  | AP65: - | AQ65: =RC[-29] -> 0 | AR65: =RC[-29] -> 0 | AS65: - | AT65: =RC[-30] -> 0 | AU65: =RC[-30] -> 0 | AV65: =RC[-30] ->  | AW65: =RC[-30] -> 
A66: =IF(RC[1]="","",DATEVALUE(RC[1])) ->  | T66: =(RC[-16]*RC[-15]-RC[-13]*RC[-12])/1000 -> #VALUE! | W66: =RC[-2]*RC[-10]/1000 -> #VALUE! | X66: =ABS((RC[-3]*RC[-11]-RC[-2]*RC[-9])/1000) -> #VALUE! | Y66: =(RC[-14]-RC[1])/RC[-18]*100 -> #VALUE! | AC66: =VALUE(RC[-27]) -> #VALUE! | AD66: =IF(RC[21]=42,"*",IF(RC[21]=32,"",RC[21])) ->  | AE66: =RC[-28] ->  | AF66: =RC[-28] ->  | AG66: =RC[-28] ->  | AH66: =RC[-28] ->  | AI66: =RC[-28] ->  | AJ66: =RC[-28] ->  | AK66: =RC[-28] ->  | AL66: =RC[-28] -> 0 | AM66: =RC[-28] ->  | AN66: =RC[-28] ->  | AO66: =RC[-28] ->  | AP66: - | AQ66: =RC[-29] -> 0 | AR66: =RC[-29] -> 0 | AS66: - | AT66: =RC[-30] -> 0 | AU66: =RC[-30] -> 0 | AV66: =RC[-30] ->  | AW66: =RC[-30] -> 
A67: =IF(RC[1]="","",DATEVALUE(RC[1])) ->  | T67: =(RC[-16]*RC[-15]-RC[-13]*RC[-12])/1000 -> #VALUE! | W67: =RC[-2]*RC[-10]/1000 -> #VALUE! | X67: =ABS((RC[-3]*RC[-11]-RC[-2]*RC[-9])/1000) -> #VALUE! | Y67: =(RC[-14]-RC[1])/RC[-18]*100 -> #VALUE! | AC67: =VALUE(RC[-27]) -> #VALUE! | AD67: =IF(RC[21]=42,"*",IF(RC[21]=32,"",RC[21])) ->  | AE67: =RC[-28] ->  | AF67: =RC[-28] ->  | AG67: =RC[-28] ->  | AH67: =RC[-28] ->  | AI67: =RC[-28] ->  | AJ67: =RC[-28] ->  | AK67: =RC[-28] ->  | AL67: =RC[-28] -> 0 | AM67: =RC[-28] ->  | AN67: =RC[-28] ->  | AO67: =RC[-28] ->  | AP67: - | AQ67: =RC[-29] -> 0 | AR67: =RC[-29] -> 0 | AS67: - | AT67: =RC[-30] -> 0 | AU67: =RC[-30] -> 0 | AV67: =RC[-30] ->  | AW67: =RC[-30] -> 
A68: =IF(RC[1]="","",DATEVALUE(RC[1])) ->  | T68: =(RC[-16]*RC[-15]-RC[-13]*RC[-12])/1000 -> #VALUE! | W68: =RC[-2]*RC[-10]/1000 -> #VALUE! | X68: =ABS((RC[-3]*RC[-11]-RC[-2]*RC[-9])/1000) -> #VALUE! | Y68: =(RC[-14]-RC[1])/RC[-18]*100 -> #VALUE! | AC68: =VALUE(RC[-27]) -> #VALUE! | AD68: =IF(RC[21]=42,"*",IF(RC[21]=32,"",RC[21])) ->  | AE68: =RC[-28] ->  | AF68: =RC[-28] ->  | AG68: =RC[-28] ->  | AH68: =RC[-28] ->  | AI68: =RC[-28] ->  | AJ68: =RC[-28] ->  | AK68: =RC[-28] ->  | AL68: =RC[-28] -> 0 | AM68: =RC[-28] ->  | AN68: =RC[-28] ->  | AO68: =RC[-28] ->  | AP68: - | AQ68: =RC[-29] -> 0 | AR68: =RC[-29] -> 0 | AS68: - | AT68: =RC[-30] -> 0 | AU68: =RC[-30] -> 0 | AV68: =RC[-30] ->  | AW68: =RC[-30] -> 
A69: =IF(RC[1]="","",DATEVALUE(RC[1])) ->  | T69: =(RC[-16]*RC[-15]-RC[-13]*RC[-12])/1000 -> #VALUE! | W69: =RC[-2]*RC[-10]/1000 -> #VALUE! | X69: =ABS((RC[-3]*RC[-11]-RC[-2]*RC[-9])/1000) -> #VALUE! | Y69: =(RC[-14]-RC[1])/RC[-18]*100 -> #VALUE! | AC69: =VALUE(RC[-27]) -> #VALUE! | AD69: =IF(RC[21]=42,"*",IF(RC[21]=32,"",RC[21])) ->  | AE69: =RC[-28] ->  | AF69: =RC[-28] ->  | AG69: =RC[-28] ->  | AH69: =RC[-28] ->  | AI69: =RC[-28] ->  | AJ69: =RC[-28] ->  | AK69: =RC[-28] ->  | AL69: =RC[-28] -> 0 | AM69: =RC[-28] ->  | AN69: =RC[-28] ->  | AO69: =RC[-28] ->  | AP69: - | AQ69: =RC[-29] -> 0 | AR69: =RC[-29] -> 0 | AS69: - | AT69: =RC[-30] -> 0 | AU69: =RC[-30] -> 0 | AV69: =RC[-30] ->  | AW69: =RC[-30] -> 
A70: =IF(RC[1]="","",DATEVALUE(RC[1])) ->  | T70: =(RC[-16]*RC[-15]-RC[-13]*RC[-12])/1000 -> #VALUE! | W70: =RC[-2]*RC[-10]/1000 -> #VALUE! | X70: =ABS((RC[-3]*RC[-11]-RC[-2]*RC[-9])/1000) -> #VALUE! | Y70: =(RC[-14]-RC[1])/RC[-18]*100 -> #VALUE! | AC70: =VALUE(RC[-27]) -> #VALUE! | AD70: =IF(RC[21]=42,"*",IF(RC[21]=32,"",RC[21])) ->  | AE70: =RC[-28] ->  | AF70: =RC[-28] ->  | AG70: =RC[-28] ->  | AH70: =RC[-28] ->  | AI70: =RC[-28] ->  | AJ70: =RC[-28] ->  | AK70: =RC[-28] ->  | AL70: =RC[-28] -> 0 | AM70: =RC[-28] ->  | AN70: =RC[-28] ->  | AO70: =RC[-28] ->  | AP70: - | AQ70: =RC[-29] -> 0 | AR70: =RC[-29] -> 0 | AS70: - | AT70: =RC[-30] -> 0 | AU70: =RC[-30] -> 0 | AV70: =RC[-30] ->  | AW70: =RC[-30] -> 
A71: =IF(RC[1]="","",DATEVALUE(RC[1])) ->  | T71: =(RC[-16]*RC[-15]-RC[-13]*RC[-12])/1000 -> #VALUE! | W71: =RC[-2]*RC[-10]/1000 -> #VALUE! | X71: =ABS((RC[-3]*RC[-11]-RC[-2]*RC[-9])/1000) -> #VALUE! | Y71: =(RC[-14]-RC[1])/RC[-18]*100 -> #VALUE! | AC71: =VALUE(RC[-27]) -> #VALUE! | AD71: =IF(RC[21]=42,"*",IF(RC[21]=32,"",RC[21])) ->  | AE71: =RC[-28] ->  | AF71: =RC[-28] ->  | AG71: =RC[-28] ->  | AH71: =RC[-28] ->  | AI71: =RC[-28] ->  | AJ71: =RC[-28] ->  | AK71: =RC[-28] ->  | AL71: =RC[-28] -> 0 | AM71: =RC[-28] ->  | AN71: =RC[-28] ->  | AO71: =RC[-28] ->  | AP71: - | AQ71: =RC[-29] -> 0 | AR71: =RC[-29] -> 0 | AS71: - | AT71: =RC[-30] -> 0 | AU71: =RC[-30] -> 0 | AV71: =RC[-30] ->  | AW71: =RC[-30] -> 
A72: =IF(RC[1]="","",DATEVALUE(RC[1])) ->  | T72: =(RC[-16]*RC[-15]-RC[-13]*RC[-12])/1000 -> #VALUE! | W72: =RC[-2]*RC[-10]/1000 -> #VALUE! | X72: =ABS((RC[-3]*RC[-11]-RC[-2]*RC[-9])/1000) -> #VALUE! | Y72: =(RC[-14]-RC[1])/RC[-18]*100 -> #VALUE! | AC72: =VALUE(RC[-27]) -> #VALUE! | AD72: =IF(RC[21]=42,"*",IF(RC[21]=32,"",RC[21])) ->  | AE72: =RC[-28] ->  | AF72: =RC[-28] ->  | AG72: =RC[-28] ->  | AH72: =RC[-28] ->  | AI72: =RC[-28] ->  | AJ72: =RC[-28] ->  | AK72: =RC[-28] ->  | AL72: =RC[-28] -> 0 | AM72: =RC[-28] ->  | AN72: =RC[-28] ->  | AO72: =RC[-28] ->  | AP72: - | AQ72: =RC[-29] -> 0 | AR72: =RC[-29] -> 0 | AS72: - | AT72: =RC[-30] -> 0 | AU72: =RC[-30] -> 0 | AV72: =RC[-30] ->  | AW72: =RC[-30] -> 
A73: =IF(RC[1]="","",DATEVALUE(RC[1])) ->  | T73: =(RC[-16]*RC[-15]-RC[-13]*RC[-12])/1000 -> #VALUE! | W73: =RC[-2]*RC[-10]/1000 -> #VALUE! | X73: =ABS((RC[-3]*RC[-11]-RC[-2]*RC[-9])/1000) -> #VALUE! | Y73: =(RC[-14]-RC[1])/RC[-18]*100 -> #VALUE! | AC73: =VALUE(RC[-27]) -> #VALUE! | AD73: =IF(RC[21]=42,"*",IF(RC[21]=32,"",RC[21])) ->  | AE73: =RC[-28] ->  | AF73: =RC[-28] ->  | AG73: =RC[-28] ->  | AH73: =RC[-28] ->  | AI73: =RC[-28] ->  | AJ73: =RC[-28] ->  | AK73: =RC[-28] ->  | AL73: =RC[-28] -> 0 | AM73: =RC[-28] ->  | AN73: =RC[-28] ->  | AO73: =RC[-28] ->  | AP73: - | AQ73: =RC[-29] -> 0 | AR73: =RC[-29] -> 0 | AS73: - | AT73: =RC[-30] -> 0 | AU73: =RC[-30] -> 0 | AV73: =RC[-30] ->  | AW73: =RC[-30] -> 
A74: =IF(RC[1]="","",DATEVALUE(RC[1])) ->  | T74: =(RC[-16]*RC[-15]-RC[-13]*RC[-12])/1000 -> #VALUE! | W74: =RC[-2]*RC[-10]/1000 -> #VALUE! | X74: =ABS((RC[-3]*RC[-11]-RC[-2]*RC[-9])/1000) -> #VALUE! | Y74: =(RC[-14]-RC[1])/RC[-18]*100 -> #VALUE! | AC74: =VALUE(RC[-27]) -> #VALUE! | AD74: =IF(RC[21]=42,"*",IF(RC[21]=32,"",RC[21])) ->  | AE74: =RC[-28] ->  | AF74: =RC[-28] ->  | AG74: =RC[-28] ->  | AH74: =RC[-28] ->  | AI74: =RC[-28] ->  | AJ74: =RC[-28] ->  | AK74: =RC[-28] ->  | AL74: =RC[-28] -> 0 | AM74: =RC[-28] ->  | AN74: =RC[-28] ->  | AO74: =RC[-28] ->  | AP74: - | AQ74: =RC[-29] -> 0 | AR74: =RC[-29] -> 0 | AS74: - | AT74: =RC[-30] -> 0 | AU74: =RC[-30] -> 0 | AV74: =RC[-30] ->  | AW74: =RC[-30] -> 
A75: =IF(RC[1]="","",DATEVALUE(RC[1])) ->  | T75: =(RC[-16]*RC[-15]-RC[-13]*RC[-12])/1000 -> #VALUE! | W75: =RC[-2]*RC[-10]/1000 -> #VALUE! | X75: =ABS((RC[-3]*RC[-11]-RC[-2]*RC[-9])/1000) -> #VALUE! | Y75: =(RC[-14]-RC[1])/RC[-18]*100 -> #VALUE! | AC75: =VALUE(RC[-27]) -> #VALUE! | AD75: =IF(RC[21]=42,"*",IF(RC[21]=32,"",RC[21])) ->  | AE75: =RC[-28] ->  | AF75: =RC[-28] ->  | AG75: =RC[-28] ->  | AH75: =RC[-28] ->  | AI75: =RC[-28] ->  | AJ75: =RC[-28] ->  | AK75: =RC[-28] ->  | AL75: =RC[-28] -> 0 | AM75: =RC[-28] ->  | AN75: =RC[-28] ->  | AO75: =RC[-28] ->  | AP75: - | AQ75: =RC[-29] -> 0 | AR75: =RC[-29] -> 0 | AS75: - | AT75: =RC[-30] -> 0 | AU75: =RC[-30] -> 0 | AV75: =RC[-30] ->  | AW75: =RC[-30] -> 
A76: =IF(RC[1]="","",DATEVALUE(RC[1])) ->  | T76: =(RC[-16]*RC[-15]-RC[-13]*RC[-12])/1000 -> #VALUE! | W76: =RC[-2]*RC[-10]/1000 -> #VALUE! | X76: =ABS((RC[-3]*RC[-11]-RC[-2]*RC[-9])/1000) -> #VALUE! | Y76: =(RC[-14]-RC[1])/RC[-18]*100 -> #VALUE! | AC76: =VALUE(RC[-27]) -> #VALUE! | AD76: =IF(RC[21]=42,"*",IF(RC[21]=32,"",RC[21])) ->  | AE76: =RC[-28] ->  | AF76: =RC[-28] ->  | AG76: =RC[-28] ->  | AH76: =RC[-28] ->  | AI76: =RC[-28] ->  | AJ76: =RC[-28] ->  | AK76: =RC[-28] ->  | AL76: =RC[-28] -> 0 | AM76: =RC[-28] ->  | AN76: =RC[-28] ->  | AO76: =RC[-28] ->  | AP76: - | AQ76: =RC[-29] -> 0 | AR76: =RC[-29] -> 0 | AS76: - | AT76: =RC[-30] -> 0 | AU76: =RC[-30] -> 0 | AV76: =RC[-30] ->  | AW76: =RC[-30] -> 
A77: =IF(RC[1]="","",DATEVALUE(RC[1])) ->  | T77: =(RC[-16]*RC[-15]-RC[-13]*RC[-12])/1000 -> #VALUE! | W77: =RC[-2]*RC[-10]/1000 -> #VALUE! | X77: =ABS((RC[-3]*RC[-11]-RC[-2]*RC[-9])/1000) -> #VALUE! | Y77: =(RC[-14]-RC[1])/RC[-18]*100 -> #VALUE! | AC77: =VALUE(RC[-27]) -> #VALUE! | AD77: =IF(RC[21]=42,"*",IF(RC[21]=32,"",RC[21])) ->  | AE77: =RC[-28] ->  | AF77: =RC[-28] ->  | AG77: =RC[-28] ->  | AH77: =RC[-28] ->  | AI77: =RC[-28] ->  | AJ77: =RC[-28] ->  | AK77: =RC[-28] ->  | AL77: =RC[-28] -> 0 | AM77: =RC[-28] ->  | AN77: =RC[-28] ->  | AO77: =RC[-28] ->  | AP77: - | AQ77: =RC[-29] -> 0 | AR77: =RC[-29] -> 0 | AS77: - | AT77: =RC[-30] -> 0 | AU77: =RC[-30] -> 0 | AV77: =RC[-30] ->  | AW77: =RC[-30] -> 
A78: =IF(RC[1]="","",DATEVALUE(RC[1])) ->  | T78: =(RC[-16]*RC[-15]-RC[-13]*RC[-12])/1000 -> #VALUE! | W78: =RC[-2]*RC[-10]/1000 -> #VALUE! | X78: =ABS((RC[-3]*RC[-11]-RC[-2]*RC[-9])/1000) -> #VALUE! | Y78: =(RC[-14]-RC[1])/RC[-18]*100 -> #VALUE! | AC78: =VALUE(RC[-27]) -> #VALUE! | AD78: =IF(RC[21]=42,"*",IF(RC[21]=32,"",RC[21])) ->  | AE78: =RC[-28] ->  | AF78: =RC[-28] ->  | AG78: =RC[-28] ->  | AH78: =RC[-28] ->  | AI78: =RC[-28] ->  | AJ78: =RC[-28] ->  | AK78: =RC[-28] ->  | AL78: =RC[-28] -> 0 | AM78: =RC[-28] ->  | AN78: =RC[-28] ->  | AO78: =RC[-28] ->  | AP78: - | AQ78: =RC[-29] -> 0 | AR78: =RC[-29] -> 0 | AS78: - | AT78: =RC[-30] -> 0 | AU78: =RC[-30] -> 0 | AV78: =RC[-30] ->  | AW78: =RC[-30] -> 
A79: =IF(RC[1]="","",DATEVALUE(RC[1])) ->  | T79: =(RC[-16]*RC[-15]-RC[-13]*RC[-12])/1000 -> #VALUE! | W79: =RC[-2]*RC[-10]/1000 -> #VALUE! | X79: =ABS((RC[-3]*RC[-11]-RC[-2]*RC[-9])/1000) -> #VALUE! | Y79: =(RC[-14]-RC[1])/RC[-18]*100 -> #VALUE! | AC79: =VALUE(RC[-27]) -> #VALUE! | AD79: =IF(RC[21]=42,"*",IF(RC[21]=32,"",RC[21])) ->  | AE79: =RC[-28] ->  | AF79: =RC[-28] ->  | AG79: =RC[-28] ->  | AH79: =RC[-28] ->  | AI79: =RC[-28] ->  | AJ79: =RC[-28] ->  | AK79: =RC[-28] ->  | AL79: =RC[-28] -> 0 | AM79: =RC[-28] ->  | AN79: =RC[-28] ->  | AO79: =RC[-28] ->  | AP79: - | AQ79: =RC[-29] -> 0 | AR79: =RC[-29] -> 0 | AS79: - | AT79: =RC[-30] -> 0 | AU79: =RC[-30] -> 0 | AV79: =RC[-30] ->  | AW79: =RC[-30] -> 
A80: =IF(RC[1]="","",DATEVALUE(RC[1])) ->  | T80: =(RC[-16]*RC[-15]-RC[-13]*RC[-12])/1000 -> #VALUE! | W80: =RC[-2]*RC[-10]/1000 -> #VALUE! | X80: =ABS((RC[-3]*RC[-11]-RC[-2]*RC[-9])/1000) -> #VALUE! | Y80: =(RC[-14]-RC[1])/RC[-18]*100 -> #VALUE! | AC80: =VALUE(RC[-27]) -> #VALUE! | AD80: =IF(RC[21]=42,"*",IF(RC[21]=32,"",RC[21])) ->  | AE80: =RC[-28] ->  | AF80: =RC[-28] ->  | AG80: =RC[-28] ->  | AH80: =RC[-28] ->  | AI80: =RC[-28] ->  | AJ80: =RC[-28] ->  | AK80: =RC[-28] ->  | AL80: =RC[-28] -> 0 | AM80: =RC[-28] ->  | AN80: =RC[-28] ->  | AO80: =RC[-28] ->  | AP80: - | AQ80: =RC[-29] -> 0 | AR80: =RC[-29] -> 0 | AS80: - | AT80: =RC[-30] -> 0 | AU80: =RC[-30] -> 0 | AV80: =RC[-30] ->  | AW80: =RC[-30] -> 
A81: =IF(RC[1]="","",DATEVALUE(RC[1])) ->  | T81: =(RC[-16]*RC[-15]-RC[-13]*RC[-12])/1000 -> #VALUE! | W81: =RC[-2]*RC[-10]/1000 -> #VALUE! | X81: =ABS((RC[-3]*RC[-11]-RC[-2]*RC[-9])/1000) -> #VALUE! | Y81: =(RC[-14]-RC[1])/RC[-18]*100 -> #VALUE! | AC81: =VALUE(RC[-27]) -> #VALUE! | AD81: =IF(RC[21]=42,"*",IF(RC[21]=32,"",RC[21])) ->  | AE81: =RC[-28] ->  | AF81: =RC[-28] ->  | AG81: =RC[-28] ->  | AH81: =RC[-28] ->  | AI81: =RC[-28] ->  | AJ81: =RC[-28] ->  | AK81: =RC[-28] ->  | AL81: =RC[-28] -> 0 | AM81: =RC[-28] ->  | AN81: =RC[-28] ->  | AO81: =RC[-28] ->  | AP81: - | AQ81: =RC[-29] -> 0 | AR81: =RC[-29] -> 0 | AS81: - | AT81: =RC[-30] -> 0 | AU81: =RC[-30] -> 0 | AV81: =RC[-30] ->  | AW81: =RC[-30] -> 
A82: =IF(RC[1]="","",DATEVALUE(RC[1])) ->  | T82: =(RC[-16]*RC[-15]-RC[-13]*RC[-12])/1000 -> #VALUE! | W82: =RC[-2]*RC[-10]/1000 -> #VALUE! | X82: =ABS((RC[-3]*RC[-11]-RC[-2]*RC[-9])/1000) -> #VALUE! | Y82: =(RC[-14]-RC[1])/RC[-18]*100 -> #VALUE! | AC82: =VALUE(RC[-27]) -> #VALUE! | AD82: =IF(RC[21]=42,"*",IF(RC[21]=32,"",RC[21])) ->  | AE82: =RC[-28] ->  | AF82: =RC[-28] ->  | AG82: =RC[-28] ->  | AH82: =RC[-28] ->  | AI82: =RC[-28] ->  | AJ82: =RC[-28] ->  | AK82: =RC[-28] ->  | AL82: =RC[-28] -> 0 | AM82: =RC[-28] ->  | AN82: =RC[-28] ->  | AO82: =RC[-28] ->  | AP82: - | AQ82: =RC[-29] -> 0 | AR82: =RC[-29] -> 0 | AS82: - | AT82: =RC[-30] -> 0 | AU82: =RC[-30] -> 0 | AV82: =RC[-30] ->  | AW82: =RC[-30] -> 
A83: =IF(RC[1]="","",DATEVALUE(RC[1])) ->  | T83: =(RC[-16]*RC[-15]-RC[-13]*RC[-12])/1000 -> #VALUE! | W83: =RC[-2]*RC[-10]/1000 -> #VALUE! | X83: =ABS((RC[-3]*RC[-11]-RC[-2]*RC[-9])/1000) -> #VALUE! | Y83: =(RC[-14]-RC[1])/RC[-18]*100 -> #VALUE! | AC83: =VALUE(RC[-27]) -> #VALUE! | AD83: =IF(RC[21]=42,"*",IF(RC[21]=32,"",RC[21])) ->  | AE83: =RC[-28] ->  | AF83: =RC[-28] ->  | AG83: =RC[-28] ->  | AH83: =RC[-28] ->  | AI83: =RC[-28] ->  | AJ83: =RC[-28] ->  | AK83: =RC[-28] ->  | AL83: =RC[-28] -> 0 | AM83: =RC[-28] ->  | AN83: =RC[-28] ->  | AO83: =RC[-28] ->  | AP83: - | AQ83: =RC[-29] -> 0 | AR83: =RC[-29] -> 0 | AS83: - | AT83: =RC[-30] -> 0 | AU83: =RC[-30] -> 0 | AV83: =RC[-30] ->  | AW83: =RC[-30] -> 
AC84: Среднее | AF84: =R[1]C[-28] -> 202.89219538422222 | AG84: =R[1]C[-28] -> 67.560666666666663 | AH84: =R[1]C[-28] -> 4.785479664836001 | AI84: =R[1]C[-28] -> 177.60556407533332 | AJ84: =R[1]C[-28] -> 48.434333333333342 | AK84: =R[1]C[-28] -> 4.4745331274848885 | AL84: =R[1]C[-28] -> 19.126333333333331 | AM84: =R[1]C[-28] -> 25.286631308888886 | AN84: =R[1]C[-28] -> 28.051005638111089 | AO84: =R[1]C[-28] -> 67.314333333333337 | AP84: - | AQ84: =R[1]C[-29] -> 0 | AR84: =R[1]C[-29] -> 0 | AS84: - | AT84: =R[1]C[-30] -> 0 | AU84: =R[1]C[-30] -> 0
B85: Среднее | D85: =AVERAGE(OFFSET(R[-74]C,3,0,R7C1,1)) -> 202.89219538422222 | E85: =AVERAGE(OFFSET(R[-74]C,3,0,R7C1,1)) -> 67.560666666666663 | F85: =AVERAGE(OFFSET(R[-74]C,3,0,R7C1,1)) -> 4.785479664836001 | G85: =AVERAGE(OFFSET(R[-74]C,3,0,R7C1,1)) -> 177.60556407533332 | H85: =AVERAGE(OFFSET(R[-74]C,3,0,R7C1,1)) -> 48.434333333333342 | I85: =AVERAGE(OFFSET(R[-74]C,3,0,R7C1,1)) -> 4.4745331274848885 | J85: =AVERAGE(OFFSET(R[-74]C,3,0,R7C1,1)) -> 19.126333333333331 | K85: =AVERAGE(OFFSET(R[-74]C,3,0,R7C1,1)) -> 25.286631308888886 | L85: =IF(SUM(OFFSET(R[-74]C,3,0,R7C1,1))=0,"",AVERAGE(OFFSET(R[-74]C,3,0,R7C1,1))) -> 28.051005638111089 | M85: =IF(SUM(OFFSET(R[-74]C,3,0,R7C1,1))=0,"",AVERAGE(OFFSET(R[-74]C,3,0,R7C1,1))) -> 67.314333333333337 | R85: =IF(SUM(OFFSET(R[-74]C,3,0,R7C1,1))=0,"",AVERAGE(OFFSET(R[-74]C,3,0,R7C1,1))) -> 1.8796732004636041 | S85: =AVERAGE(OFFSET(R[-74]C,3,0,R7C1,1)) -> 4.5999540758485811 | T85: =AVERAGE(OFFSET(R[-74]C,3,0,R7C1,1)) -> 4.6432958184172044 | W85: =AVERAGE(OFFSET(R[-74]C,3,0,R7C1,1)) -> 1.8729392847520263 | X85: =AVERAGE(OFFSET(R[-74]C,3,0,R7C1,1)) -> #VALUE! | AC85: Итого | AE85: =R[1]C[-28] -> 720 | AF85: =R[1]C[-28] -> 6086.7658615266664 | AI85: =R[1]C[-28] -> 5328.1669222599994 | AM85: =R[1]C[-28] -> 758.59893926666655 | AN85: =R[1]C[-28] -> 841.53016914333273 | AQ85: =R[1]C[-29] -> 0 | AU85: =R[1]C[-30] -> 0 | AV85: =R[1]C[-30] -> 56.390196013908124 | AW85: =R[1]C[-30] -> 137.99862227545742
B86: ИТОГО: | C86: =SUM(OFFSET(R[-75]C,3,0,R7C1,1)) -> 720 | D86: =SUM(OFFSET(R[-75]C,3,0,R7C1,1)) -> 6086.7658615266664 | G86: =SUM(OFFSET(R[-75]C,3,0,R7C1,1)) -> 5328.1669222599994 | K86: =SUM(OFFSET(R[-75]C,3,0,R7C1,1)) -> 758.59893926666655 | L86: =IF(SUM(OFFSET(R[-75]C,3,0,R7C1,1))=0,"",SUM(OFFSET(R[-75]C,3,0,R7C1,1))) -> 841.53016914333273 | R86: =IF(SUM(OFFSET(R[-75]C,3,0,R7C1,1))=0,"",SUM(OFFSET(R[-75]C,3,0,R7C1,1))) -> 56.390196013908124 | S86: =SUM(OFFSET(R[-75]C,3,0,R7C1,1)) -> 137.99862227545742 | T86: =SUM(OFFSET(R[-75]C,3,0,R7C1,1)) -> 139.29887455251614 | W86: =SUM(OFFSET(R[-75]C,3,0,R7C1,1)) -> 56.188178542560792 | X86: =SUM(OFFSET(R[-75]C,3,0,R7C1,1)) -> #VALUE!
AC87: Досчёт | AF87: =R[1]C[-28] -> 0 | AI87: =R[1]C[-28] -> 0 | AM87: =R[1]C[-28] -> 0 | AN87: =R[1]C[-28] -> 0 | AQ87: =R[1]C[-29] -> 0 | AU87: =R[1]C[-30] -> 0 | AV87: =R[1]C[-30] -> 0 | AW87: =R[1]C[-30] -> 0
A88: 11дн=264ч 4дн=96ч | B88: Досчёт до конца м-ца (+) | C88: =R6C1*24 -> 216 | T88: № B016 | AC88: Снятие | AF88: =-R[1]C[-28] -> 0 | AI88: =-R[1]C[-28] -> 0 | AM88: =-R[1]C[-28] -> 0 | AN88: =-R[1]C[-28] -> 0 | AQ88: =-R[1]C[-29] -> 0 | AU88: =-R[1]C[-30] -> 0 | AV88: =-R[1]C[-30] -> 0 | AW88: =-R[1]C[-30] -> 0
A89: 9дн=216ч 7дн=168ч | B89: Вычет с предыдущего (-) | C89: =R4C1*24 -> 192 | AC89: Сумма | AF89: =R[1]C[-28] -> 6086.7658615266664 | AI89: =R[1]C[-28] -> 5328.1669222599994 | AM89: =R[1]C[-28] -> 758.59893926666655 | AN89: =R[1]C[-28] -> 841.53016914333273 | AQ89: =R[1]C[-29] -> 0 | AU89: =R[1]C[-30] -> 0 | AV89: =R[1]C[-30] -> 56.390196013908124 | AW89: =R[1]C[-30] -> 137.99862227545742
B90: СУММА: | C90: =R[-4]C+R[-2]C-R[-1]C -> 744 | D90: =R[-4]C+R[-2]C-R[-1]C -> 6086.7658615266664 | G90: =R[-4]C+R[-2]C-R[-1]C -> 5328.1669222599994 | K90: =R[-4]C+R[-2]C-R[-1]C -> 758.59893926666655 | L90: =IF(SUM(OFFSET(R[-79]C,3,0,R7C1,1))=0,"",(R[-4]C+R[-2]C-R[-1]C)) -> 841.53016914333273 | R90: =IF(SUM(OFFSET(R[-79]C,3,0,R7C1,1))=0,"",(R[-4]C+R[-2]C-R[-1]C)) -> 56.390196013908124 | S90: =R[-4]C+R[-2]C-R[-1]C -> 137.99862227545742
AC91: Тхв на источнике | AE91: V гвс (м3) | AF91: =R[-2]C[15] -> 0 | AG91: W гвс (Гкал) | AH91: =RC[-2]*0.06 -> 0 | AI91: W без гвс (Гкал) | AJ91: =R[-2]C[13]-RC[-2] -> 137.99862227545742
B92: Показания счетчиков на момент снятия данных:
B93: Дата, время | D93: М1, т | F93: М2, т | H93: М3, т | J93: М4, т | L93: Qо, Гкал | N93: Qг, Гкал | P93: время, час
B94: 23.09.18 01:45 | D94: 102181.9453125 | F94: 84961.375 | H94: 18006.763671879999 | J94: - | L94: 3594.74130377138 | N94: 1281.41978117894 | P94: -
B95: 23.10.18 01:49 | D95: 108191.6015625 | F95: 90175.3359375 | H95: 20168.759765629999 | J95: - | L95: 3734.5177010939101 | N95: 1429.4474412152499 | P95: -
AC97: =ZAYAVKA_N -> з.н д. №02/147-2783 от 04.10.18 с 06.10.18г по 22.10.18г некорректная работа приборов
B98: Представитель потребителя:_______________________________________________________________________ В.О. Топорков
I101: Рекомендуемые значения по параметрам теплопотребления (не являются официально утверждёнными)
I102: М, т | J102: V, м3 | K102: Qгвс, Гкал | L102: Qотоп, Гкал | M102: Qо, Гкал
I103: =R[-13]C[-3] -> 0 | J103: =RC[-1]/0.98 -> 0 | K103: =RC[-1]*0.06 -> 0 | L103: =RC[1]-RC[-1] -> 56.390196013908124 | M103: =R[-13]C[5] -> 56.390196013908124
O105: ДЛЯ САМОКОНТРОЛЯ
B106: В строке выбора дат указать период с 16.7.13 по 23.8.13 - жильё | N106: Q | O106: Qг
B107: В строке выбора дат указать период с 18.7.13 по 25.8.13 - не жилое | N107: =(R[-21]C[-10]*R[-22]C[-7]-R[-21]C[-9]*R[-22]C[-6])/1000 -> 1081.0434842309257 | O107: =IF(R[-22]C[-2]="",R[-21]C[-3]*R[-22]C/1000,"") ->  | P107: Си2
O108: =IF(R[-23]C[-2]="","",((R[-22]C[-3]*R[-23]C)-(R[-22]C[-2]*R[-23]C[2]))/1000) -> 0 | P108: Си3