Sheet: Лист1
G1: Отчёт о теплопотреблении за октябрь 2018 | M1: з.н д. №02/147-2783 от 04.10.18 24.09.18г некорректная работа приборов
A4: =EOMONTH(R[9]C,0)-R[9]C -> 8 | B4: Потребитель: ЗАО "Сити Сервис"
A5: =MAX(R[9]C:R[78]C) -> 2018-10-22T00:00:00.000 | B5: Адрес: г. СПб, Новосмоленская наб., д.1 ИТП 11
A6: =EOMONTH(R[-1]C,0)-R[-1]C -> 9 | B6: Телефон: 8-911-021-19-79
A7: =R[-2]C-R[6]C -> 30 | B7: Договор 10023-7 (.) 394, 396, 397
A8: 7 | B8: Тепловычислитель: ВКТ-7 № 49531 | L8: М2 мах= | M8: 146.16 | O8: Мгвс мах= | P8: 90.96
L9: Qотоп мах= | M9: 11.76 | O9: Qгвс мах= | P9: 5.448
B10: Расчётная формула: Q=M1*(h1-hхв)-M2*(h2-hхв)
D12: Учет | L12: Контроль
A13: =R[1]C[1]-1 -> 2018-09-22T00:00:00.000 | B13: Дата | C13: N, ч | D13: M1, т | E13: T1, С | F13: P1, кг/см2 | G13: M2, т | H13: T2, С | I13: P2, кг/см2 | J13: dT, С | K13: M1-М2, т | L13: V3, м3 | M13: T3, С | N13: V4, м3 | O13: =IF(R[-12]C[-14]="м.куб","","T4, С") -> T4, С | P13: dT, С | Q13: V3-V4, м3 | R13: Qгвс, Гкал | S13: Qобщ., Гкал | T13: Q | U13: M3 | V13: M4 | W13: си2 | X13: си3 | Y13: Разб. | Z13: dM2 | AC13: Дата | AD13: НС | AE13: n, ч | AF13: М1, т | AG13: t1, гр. С | AH13: Р1, кгс/см2 | AI13: М2, т | AJ13: t2, гр. С | AK13: Р2, кгс/см2 | AL13: t1-t2, гр. С | AM13: М1-М2, т | AN13: М1гвс, т | AO13: t1гвс, гр. С | AP13: Р1гвс, кгс/см2 | AQ13: М2гвс, т | AR13: t2гвс, гр. С | AS13: Р2гвс, кгс/см2 | AT13: t1гвс-t2гвс | AU13: М1гвс-М2гвс, т | AV13: Wгвс, Гкал | AW13: Wсумм, Гкал | AY13: NS_TV1 | AZ13: НС | BA13: NS_TV2
A14: =IF(RC[1]="","",DATEVALUE(RC[1])) -> 43366 | B14: 23.09.18 | C14: 24 | D14: 14.63 | E14: 69.63 | F14: 8.7799999999999994 | G14: 0 | H14: 23.76 | I14: 8.86 | J14: =RC[-5]-RC[-2] -> 45.86999999999999 | K14: =RC[-7]-RC[-4] -> 14.63 | L14: 15.57 | M14: 68.89 | R14: 1.0489999999999999 | S14: =RC[-1] -> 1.0489999999999999 | T14: =(RC[-16]*RC[-15]-RC[-13]*RC[-12])/1000 -> 1.0186869000000001 | U14: 15.25 | V14: - | W14: =RC[-2]*RC[-10]/1000 -> 1.0505724999999999 | X14: =ABS((RC[-3]*RC[-11]-RC[-2]*RC[-9])/1000) -> #VALUE! | Y14: =(RC[-14]-RC[1])/RC[-18]*100 -> #DIV/0! | Z14: 15.25 | AC14: =VALUE(RC[-27]) -> 2018-09-23T00:00:00.000 | AD14: =IF(RC[21]=42,"*",IF(RC[21]=32,"",RC[21])) -> - | AE14: =RC[-28] -> 24 | AF14: =RC[-28] -> 14.63 | AG14: =RC[-28] -> 69.63 | AH14: =RC[-28] -> 8.7799999999999994 | AI14: =RC[-28] -> 0 | AJ14: =RC[-28] -> 23.76 | AK14: =RC[-28] -> 8.86 | AL14: =RC[-28] -> 45.86999999999999 | AM14: =RC[-28] -> 14.63 | AN14: =RC[-28] -> 15.57 | AO14: =RC[-28] -> 68.89 | AP14: - | AQ14: =RC[-29] -> 0 | AR14: =RC[-29] -> 0 | AS14: - | AT14: =RC[-30] -> 0 | AU14: =RC[-30] -> 0 | AV14: =RC[-30] -> 1.0489999999999999 | AW14: =RC[-30] -> 1.0489999999999999 | AY14: - | AZ14: - | BA14: -
A15: =IF(RC[1]="","",DATEVALUE(RC[1])) -> 43367 | B15: 24.09.18 | C15: 24 | D15: 13.52 | E15: 68.42 | F15: 8.86 | G15: 0 | H15: 22.64 | I15: 8.94 | J15: =RC[-5]-RC[-2] -> 45.78 | K15: =RC[-7]-RC[-4] -> 13.52 | L15: =AVERAGE(R[1]C:R[3]C) -> 14.906666666666666 | M15: 67.569999999999993 | R15: =RC[5] -> 1.0072434666666665 | S15: =RC[-1] -> 1.0072434666666665 | T15: =(RC[-16]*RC[-15]-RC[-13]*RC[-12])/1000 -> 0.92503840000000004 | U15: 14.906666666666666 | V15: - | W15: =RC[-2]*RC[-10]/1000 -> 1.0072434666666665 | X15: =ABS((RC[-3]*RC[-11]-RC[-2]*RC[-9])/1000) -> #VALUE! | Y15: =(RC[-14]-RC[1])/RC[-18]*100 -> #DIV/0! | Z15: 14.906666666666666 | AC15: =VALUE(RC[-27]) -> 2018-09-24T00:00:00.000 | AD15: =IF(RC[21]=42,"*",IF(RC[21]=32,"",RC[21])) -> - | AE15: =RC[-28] -> 24 | AF15: =RC[-28] -> 13.52 | AG15: =RC[-28] -> 68.42 | AH15: =RC[-28] -> 8.86 | AI15: =RC[-28] -> 0 | AJ15: =RC[-28] -> 22.64 | AK15: =RC[-28] -> 8.94 | AL15: =RC[-28] -> 45.78 | AM15: =RC[-28] -> 13.52 | AN15: =RC[-28] -> 14.906666666666666 | AO15: =RC[-28] -> 67.569999999999993 | AP15: - | AQ15: =RC[-29] -> 0 | AR15: =RC[-29] -> 0 | AS15: - | AT15: =RC[-30] -> 0 | AU15: =RC[-30] -> 0 | AV15: =RC[-30] -> 1.0072434666666665 | AW15: =RC[-30] -> 1.0072434666666665 | AY15: - | AZ15: - | BA15: -
A16: =IF(RC[1]="","",DATEVALUE(RC[1])) -> 43368 | B16: 25.09.18 | C16: 24 | D16: 79.08 | E16: 67.540000000000006 | F16: 8.6999999999999993 | G16: 60.75 | H16: 47.18 | I16: 8 | J16: =RC[-5]-RC[-2] -> 20.360000000000007 | K16: =RC[-7]-RC[-4] -> 18.329999999999998 | L16: 15.39 | M16: 67 | R16: 1.01 | S16: 2.4769999999999999 | T16: =(RC[-16]*RC[-15]-RC[-13]*RC[-12])/1000 -> 2.4748782000000005 | U16: 15.07 | V16: - | W16: =RC[-2]*RC[-10]/1000 -> 1.00969 | X16: =ABS((RC[-3]*RC[-11]-RC[-2]*RC[-9])/1000) -> #VALUE! | Y16: =(RC[-14]-RC[1])/RC[-18]*100 -> 5.3662551440329187 | Z16: 15.07 | AC16: =VALUE(RC[-27]) -> 2018-09-25T00:00:00.000 | AD16: =IF(RC[21]=42,"*",IF(RC[21]=32,"",RC[21])) -> - | AE16: =RC[-28] -> 24 | AF16: =RC[-28] -> 79.08 | AG16: =RC[-28] -> 67.540000000000006 | AH16: =RC[-28] -> 8.6999999999999993 | AI16: =RC[-28] -> 60.75 | AJ16: =RC[-28] -> 47.18 | AK16: =RC[-28] -> 8 | AL16: =RC[-28] -> 20.360000000000007 | AM16: =RC[-28] -> 18.329999999999998 | AN16: =RC[-28] -> 15.39 | AO16: =RC[-28] -> 67 | AP16: - | AQ16: =RC[-29] -> 0 | AR16: =RC[-29] -> 0 | AS16: - | AT16: =RC[-30] -> 0 | AU16: =RC[-30] -> 0 | AV16: =RC[-30] -> 1.01 | AW16: =RC[-30] -> 2.4769999999999999 | AY16: - | AZ16: - | BA16: -
A17: =IF(RC[1]="","",DATEVALUE(RC[1])) -> 43369 | B17: 26.09.18 | C17: 24 | D17: 163.78 | E17: 68.14 | F17: 8.19 | G17: 151.52000000000001 | H17: 45.96 | I17: 6.57 | J17: =RC[-5]-RC[-2] -> 22.18 | K17: =RC[-7]-RC[-4] -> 12.259999999999991 | L17: 15.02 | M17: 67.290000000000006 | R17: 0.98899999999999999 | S17: 4.1959999999999997 | T17: =(RC[-16]*RC[-15]-RC[-13]*RC[-12])/1000 -> 4.1961099999999991 | U17: 14.71 | V17: - | W17: =RC[-2]*RC[-10]/1000 -> 0.9898359000000001 | X17: =ABS((RC[-3]*RC[-11]-RC[-2]*RC[-9])/1000) -> #VALUE! | Y17: =(RC[-14]-RC[1])/RC[-18]*100 -> -1.6169482576557612 | Z17: 14.71 | AC17: =VALUE(RC[-27]) -> 2018-09-26T00:00:00.000 | AD17: =IF(RC[21]=42,"*",IF(RC[21]=32,"",RC[21])) -> - | AE17: =RC[-28] -> 24 | AF17: =RC[-28] -> 163.78 | AG17: =RC[-28] -> 68.14 | AH17: =RC[-28] -> 8.19 | AI17: =RC[-28] -> 151.52000000000001 | AJ17: =RC[-28] -> 45.96 | AK17: =RC[-28] -> 6.57 | AL17: =RC[-28] -> 22.18 | AM17: =RC[-28] -> 12.259999999999991 | AN17: =RC[-28] -> 15.02 | AO17: =RC[-28] -> 67.290000000000006 | AP17: - | AQ17: =RC[-29] -> 0 | AR17: =RC[-29] -> 0 | AS17: - | AT17: =RC[-30] -> 0 | AU17: =RC[-30] -> 0 | AV17: =RC[-30] -> 0.98899999999999999 | AW17: =RC[-30] -> 4.1959999999999997 | AY17: - | AZ17: - | BA17: -
A18: =IF(RC[1]="","",DATEVALUE(RC[1])) -> 43370 | B18: 27.09.18 | C18: 24 | D18: 147.05000000000001 | E18: 63.39 | F18: 7.85 | G18: 135.06 | H18: 44.72 | I18: 6.58 | J18: =RC[-5]-RC[-2] -> 18.670000000000002 | K18: =RC[-7]-RC[-4] -> 11.990000000000009 | L18: 14.31 | M18: 62.75 | R18: 0.88500000000000001 | S18: 3.2839999999999998 | T18: =(RC[-16]*RC[-15]-RC[-13]*RC[-12])/1000 -> 3.2816162999999996 | U18: 14.06 | V18: - | W18: =RC[-2]*RC[-10]/1000 -> 0.88226499999999997 | X18: =ABS((RC[-3]*RC[-11]-RC[-2]*RC[-9])/1000) -> #VALUE! | Y18: =(RC[-14]-RC[1])/RC[-18]*100 -> -1.5326521545979501 | Z18: 14.06 | AC18: =VALUE(RC[-27]) -> 2018-09-27T00:00:00.000 | AD18: =IF(RC[21]=42,"*",IF(RC[21]=32,"",RC[21])) -> - | AE18: =RC[-28] -> 24 | AF18: =RC[-28] -> 147.05000000000001 | AG18: =RC[-28] -> 63.39 | AH18: =RC[-28] -> 7.85 | AI18: =RC[-28] -> 135.06 | AJ18: =RC[-28] -> 44.72 | AK18: =RC[-28] -> 6.58 | AL18: =RC[-28] -> 18.670000000000002 | AM18: =RC[-28] -> 11.990000000000009 | AN18: =RC[-28] -> 14.31 | AO18: =RC[-28] -> 62.75 | AP18: - | AQ18: =RC[-29] -> 0 | AR18: =RC[-29] -> 0 | AS18: - | AT18: =RC[-30] -> 0 | AU18: =RC[-30] -> 0 | AV18: =RC[-30] -> 0.88500000000000001 | AW18: =RC[-30] -> 3.2839999999999998 | AY18: - | AZ18: - | BA18: -
A19: =IF(RC[1]="","",DATEVALUE(RC[1])) -> 43371 | B19: 28.09.18 | C19: 24 | D19: 150.75 | E19: 68.150000000000006 | F19: 8.0500000000000007 | G19: 138.79 | H19: 43.34 | I19: 6.69 | J19: =RC[-5]-RC[-2] -> 24.810000000000002 | K19: =RC[-7]-RC[-4] -> 11.960000000000008 | L19: 14.49 | M19: 67.97 | R19: 0.96499999999999997 | S19: 4.2560000000000002 | T19: =(RC[-16]*RC[-15]-RC[-13]*RC[-12])/1000 -> 4.258453900000001 | U19: 14.2 | V19: - | W19: =RC[-2]*RC[-10]/1000 -> 0.96517399999999998 | X19: =ABS((RC[-3]*RC[-11]-RC[-2]*RC[-9])/1000) -> #VALUE! | Y19: =(RC[-14]-RC[1])/RC[-18]*100 -> -1.6139491317818226 | Z19: 14.2 | AC19: =VALUE(RC[-27]) -> 2018-09-28T00:00:00.000 | AD19: =IF(RC[21]=42,"*",IF(RC[21]=32,"",RC[21])) -> - | AE19: =RC[-28] -> 24 | AF19: =RC[-28] -> 150.75 | AG19: =RC[-28] -> 68.150000000000006 | AH19: =RC[-28] -> 8.0500000000000007 | AI19: =RC[-28] -> 138.79 | AJ19: =RC[-28] -> 43.34 | AK19: =RC[-28] -> 6.69 | AL19: =RC[-28] -> 24.810000000000002 | AM19: =RC[-28] -> 11.960000000000008 | AN19: =RC[-28] -> 14.49 | AO19: =RC[-28] -> 67.97 | AP19: - | AQ19: =RC[-29] -> 0 | AR19: =RC[-29] -> 0 | AS19: - | AT19: =RC[-30] -> 0 | AU19: =RC[-30] -> 0 | AV19: =RC[-30] -> 0.96499999999999997 | AW19: =RC[-30] -> 4.2560000000000002 | AY19: - | AZ19: - | BA19: -
A20: =IF(RC[1]="","",DATEVALUE(RC[1])) -> 43372 | B20: 29.09.18 | C20: 24 | D20: 166.91 | E20: 67.81 | F20: 8.7100000000000009 | G20: 156.13 | H20: 43.58 | I20: 6.98 | J20: =RC[-5]-RC[-2] -> 24.230000000000004 | K20: =RC[-7]-RC[-4] -> 10.780000000000001 | L20: 13.09 | M20: 67.19 | R20: 0.86299999999999999 | S20: 4.5149999999999997 | T20: =(RC[-16]*RC[-15]-RC[-13]*RC[-12])/1000 -> 4.5140217000000016 | U20: 12.83 | V20: - | W20: =RC[-2]*RC[-10]/1000 -> 0.86204769999999997 | X20: =ABS((RC[-3]*RC[-11]-RC[-2]*RC[-9])/1000) -> #VALUE! | Y20: =(RC[-14]-RC[1])/RC[-18]*100 -> -1.3130083904438603 | Z20: 12.83 | AC20: =VALUE(RC[-27]) -> 2018-09-29T00:00:00.000 | AD20: =IF(RC[21]=42,"*",IF(RC[21]=32,"",RC[21])) -> - | AE20: =RC[-28] -> 24 | AF20: =RC[-28] -> 166.91 | AG20: =RC[-28] -> 67.81 | AH20: =RC[-28] -> 8.7100000000000009 | AI20: =RC[-28] -> 156.13 | AJ20: =RC[-28] -> 43.58 | AK20: =RC[-28] -> 6.98 | AL20: =RC[-28] -> 24.230000000000004 | AM20: =RC[-28] -> 10.780000000000001 | AN20: =RC[-28] -> 13.09 | AO20: =RC[-28] -> 67.19 | AP20: - | AQ20: =RC[-29] -> 0 | AR20: =RC[-29] -> 0 | AS20: - | AT20: =RC[-30] -> 0 | AU20: =RC[-30] -> 0 | AV20: =RC[-30] -> 0.86299999999999999 | AW20: =RC[-30] -> 4.5149999999999997 | AY20: - | AZ20: - | BA20: -
A21: =IF(RC[1]="","",DATEVALUE(RC[1])) -> 43373 | B21: 30.09.18 | C21: 24 | D21: 170.17 | E21: 70.11 | F21: 8.64 | G21: 156.47999999999999 | H21: 44.75 | I21: 6.91 | J21: =RC[-5]-RC[-2] -> 25.36 | K21: =RC[-7]-RC[-4] -> 13.689999999999998 | L21: 16.27 | M21: 70.11 | R21: 1.115 | S21: 4.9290000000000003 | T21: =(RC[-16]*RC[-15]-RC[-13]*RC[-12])/1000 -> 4.9281386999999999 | U21: 15.92 | V21: - | W21: =RC[-2]*RC[-10]/1000 -> 1.1161512 | X21: =ABS((RC[-3]*RC[-11]-RC[-2]*RC[-9])/1000) -> #VALUE! | Y21: =(RC[-14]-RC[1])/RC[-18]*100 -> -1.4251022494887542 | Z21: 15.92 | AC21: =VALUE(RC[-27]) -> 2018-09-30T00:00:00.000 | AD21: =IF(RC[21]=42,"*",IF(RC[21]=32,"",RC[21])) -> - | AE21: =RC[-28] -> 24 | AF21: =RC[-28] -> 170.17 | AG21: =RC[-28] -> 70.11 | AH21: =RC[-28] -> 8.64 | AI21: =RC[-28] -> 156.47999999999999 | AJ21: =RC[-28] -> 44.75 | AK21: =RC[-28] -> 6.91 | AL21: =RC[-28] -> 25.36 | AM21: =RC[-28] -> 13.689999999999998 | AN21: =RC[-28] -> 16.27 | AO21: =RC[-28] -> 70.11 | AP21: - | AQ21: =RC[-29] -> 0 | AR21: =RC[-29] -> 0 | AS21: - | AT21: =RC[-30] -> 0 | AU21: =RC[-30] -> 0 | AV21: =RC[-30] -> 1.115 | AW21: =RC[-30] -> 4.9290000000000003 | AY21: - | AZ21: - | BA21: -
A22: =IF(RC[1]="","",DATEVALUE(RC[1])) -> 43374 | B22: 01.10.18 | C22: 24 | D22: 167.57 | E22: 68.819999999999993 | F22: 8.77 | G22: 156.72 | H22: 44.77 | I22: 7.04 | J22: =RC[-5]-RC[-2] -> 24.04999999999999 | K22: =RC[-7]-RC[-4] -> 10.849999999999994 | L22: 13.72 | M22: 68.38 | R22: 0.91600000000000004 | S22: 4.5190000000000001 | T22: =(RC[-16]*RC[-15]-RC[-13]*RC[-12])/1000 -> 4.5158129999999979 | U22: 13.43 | V22: - | W22: =RC[-2]*RC[-10]/1000 -> 0.91834339999999992 | X22: =ABS((RC[-3]*RC[-11]-RC[-2]*RC[-9])/1000) -> #VALUE! | Y22: =(RC[-14]-RC[1])/RC[-18]*100 -> -1.6462480857580433 | Z22: 13.43 | AC22: =VALUE(RC[-27]) -> 2018-10-01T00:00:00.000 | AD22: =IF(RC[21]=42,"*",IF(RC[21]=32,"",RC[21])) -> - | AE22: =RC[-28] -> 24 | AF22: =RC[-28] -> 167.57 | AG22: =RC[-28] -> 68.819999999999993 | AH22: =RC[-28] -> 8.77 | AI22: =RC[-28] -> 156.72 | AJ22: =RC[-28] -> 44.77 | AK22: =RC[-28] -> 7.04 | AL22: =RC[-28] -> 24.04999999999999 | AM22: =RC[-28] -> 10.849999999999994 | AN22: =RC[-28] -> 13.72 | AO22: =RC[-28] -> 68.38 | AP22: - | AQ22: =RC[-29] -> 0 | AR22: =RC[-29] -> 0 | AS22: - | AT22: =RC[-30] -> 0 | AU22: =RC[-30] -> 0 | AV22: =RC[-30] -> 0.91600000000000004 | AW22: =RC[-30] -> 4.5190000000000001 | AY22: - | AZ22: - | BA22: -
A23: =IF(RC[1]="","",DATEVALUE(RC[1])) -> 43375 | B23: 02.10.18 | C23: 24 | D23: 169.17 | E23: 67.599999999999994 | F23: 8.68 | G23: 159.09 | H23: 44.49 | I23: 6.87 | J23: =RC[-5]-RC[-2] -> 23.109999999999992 | K23: =RC[-7]-RC[-4] -> 10.079999999999984 | L23: 13.07 | M23: 67.209999999999994 | R23: 0.86 | S23: 4.3600000000000003 | T23: =(RC[-16]*RC[-15]-RC[-13]*RC[-12])/1000 -> 4.3579778999999972 | U23: 12.8 | V23: - | W23: =RC[-2]*RC[-10]/1000 -> 0.86028800000000005 | X23: =ABS((RC[-3]*RC[-11]-RC[-2]*RC[-9])/1000) -> #VALUE! | Y23: =(RC[-14]-RC[1])/RC[-18]*100 -> -1.7097240555660425 | Z23: 12.8 | AC23: =VALUE(RC[-27]) -> 2018-10-02T00:00:00.000 | AD23: =IF(RC[21]=42,"*",IF(RC[21]=32,"",RC[21])) -> - | AE23: =RC[-28] -> 24 | AF23: =RC[-28] -> 169.17 | AG23: =RC[-28] -> 67.599999999999994 | AH23: =RC[-28] -> 8.68 | AI23: =RC[-28] -> 159.09 | AJ23: =RC[-28] -> 44.49 | AK23: =RC[-28] -> 6.87 | AL23: =RC[-28] -> 23.109999999999992 | AM23: =RC[-28] -> 10.079999999999984 | AN23: =RC[-28] -> 13.07 | AO23: =RC[-28] -> 67.209999999999994 | AP23: - | AQ23: =RC[-29] -> 0 | AR23: =RC[-29] -> 0 | AS23: - | AT23: =RC[-30] -> 0 | AU23: =RC[-30] -> 0 | AV23: =RC[-30] -> 0.86 | AW23: =RC[-30] -> 4.3600000000000003 | AY23: - | AZ23: - | BA23: -
A24: =IF(RC[1]="","",DATEVALUE(RC[1])) -> 43376 | B24: 03.10.18 | C24: 24 | D24: 169.71 | E24: 67.739999999999995 | F24: 8.6 | G24: 158.38999999999999 | H24: 44.53 | I24: 6.82 | J24: =RC[-5]-RC[-2] -> 23.209999999999994 | K24: =RC[-7]-RC[-4] -> 11.320000000000022 | L24: 14.35 | M24: 67.459999999999994 | R24: 0.94799999999999995 | S24: 4.4470000000000001 | T24: =(RC[-16]*RC[-15]-RC[-13]*RC[-12])/1000 -> 4.4430487000000003 | U24: 14.05 | V24: - | W24: =RC[-2]*RC[-10]/1000 -> 0.94781300000000002 | X24: =ABS((RC[-3]*RC[-11]-RC[-2]*RC[-9])/1000) -> #VALUE! | Y24: =(RC[-14]-RC[1])/RC[-18]*100 -> -1.723593661215973 | Z24: 14.05 | AC24: =VALUE(RC[-27]) -> 2018-10-03T00:00:00.000 | AD24: =IF(RC[21]=42,"*",IF(RC[21]=32,"",RC[21])) -> - | AE24: =RC[-28] -> 24 | AF24: =RC[-28] -> 169.71 | AG24: =RC[-28] -> 67.739999999999995 | AH24: =RC[-28] -> 8.6 | AI24: =RC[-28] -> 158.38999999999999 | AJ24: =RC[-28] -> 44.53 | AK24: =RC[-28] -> 6.82 | AL24: =RC[-28] -> 23.209999999999994 | AM24: =RC[-28] -> 11.320000000000022 | AN24: =RC[-28] -> 14.35 | AO24: =RC[-28] -> 67.459999999999994 | AP24: - | AQ24: =RC[-29] -> 0 | AR24: =RC[-29] -> 0 | AS24: - | AT24: =RC[-30] -> 0 | AU24: =RC[-30] -> 0 | AV24: =RC[-30] -> 0.94799999999999995 | AW24: =RC[-30] -> 4.4470000000000001 | AY24: - | AZ24: - | BA24: -
A25: =IF(RC[1]="","",DATEVALUE(RC[1])) -> 43377 | B25: 04.10.18 | C25: 24 | D25: 174.41 | E25: 67.11 | F25: 8.75 | G25: 163.66999999999999 | H25: 44.38 | I25: 6.84 | J25: =RC[-5]-RC[-2] -> 22.729999999999997 | K25: =RC[-7]-RC[-4] -> 10.740000000000009 | L25: 14.23 | M25: 66.540000000000006 | R25: 0.93 | S25: 4.4429999999999996 | T25: =(RC[-16]*RC[-15]-RC[-13]*RC[-12])/1000 -> 4.4409804999999993 | U25: 13.96 | V25: - | W25: =RC[-2]*RC[-10]/1000 -> 0.92889840000000012 | X25: =ABS((RC[-3]*RC[-11]-RC[-2]*RC[-9])/1000) -> #VALUE! | Y25: =(RC[-14]-RC[1])/RC[-18]*100 -> -1.9673733732510492 | Z25: 13.96 | AC25: =VALUE(RC[-27]) -> 2018-10-04T00:00:00.000 | AD25: =IF(RC[21]=42,"*",IF(RC[21]=32,"",RC[21])) -> - | AE25: =RC[-28] -> 24 | AF25: =RC[-28] -> 174.41 | AG25: =RC[-28] -> 67.11 | AH25: =RC[-28] -> 8.75 | AI25: =RC[-28] -> 163.66999999999999 | AJ25: =RC[-28] -> 44.38 | AK25: =RC[-28] -> 6.84 | AL25: =RC[-28] -> 22.729999999999997 | AM25: =RC[-28] -> 10.740000000000009 | AN25: =RC[-28] -> 14.23 | AO25: =RC[-28] -> 66.540000000000006 | AP25: - | AQ25: =RC[-29] -> 0 | AR25: =RC[-29] -> 0 | AS25: - | AT25: =RC[-30] -> 0 | AU25: =RC[-30] -> 0 | AV25: =RC[-30] -> 0.93 | AW25: =RC[-30] -> 4.4429999999999996 | AY25: - | AZ25: - | BA25: -
A26: =IF(RC[1]="","",DATEVALUE(RC[1])) -> 43378 | B26: 05.10.18 | C26: 24 | D26: 178.56 | E26: 66.48 | F26: 8.7100000000000009 | G26: 167.73 | H26: 44.22 | I26: 6.71 | J26: =RC[-5]-RC[-2] -> 22.260000000000005 | K26: =RC[-7]-RC[-4] -> 10.830000000000013 | L26: 14.25 | M26: 66.150000000000006 | R26: 0.92600000000000005 | S26: 4.4550000000000001 | T26: =(RC[-16]*RC[-15]-RC[-13]*RC[-12])/1000 -> 4.4536482000000026 | U26: 13.99 | V26: - | W26: =RC[-2]*RC[-10]/1000 -> 0.92543850000000005 | X26: =ABS((RC[-3]*RC[-11]-RC[-2]*RC[-9])/1000) -> #VALUE! | Y26: =(RC[-14]-RC[1])/RC[-18]*100 -> -1.8839802062839015 | Z26: 13.99 | AC26: =VALUE(RC[-27]) -> 2018-10-05T00:00:00.000 | AD26: =IF(RC[21]=42,"*",IF(RC[21]=32,"",RC[21])) -> - | AE26: =RC[-28] -> 24 | AF26: =RC[-28] -> 178.56 | AG26: =RC[-28] -> 66.48 | AH26: =RC[-28] -> 8.7100000000000009 | AI26: =RC[-28] -> 167.73 | AJ26: =RC[-28] -> 44.22 | AK26: =RC[-28] -> 6.71 | AL26: =RC[-28] -> 22.260000000000005 | AM26: =RC[-28] -> 10.830000000000013 | AN26: =RC[-28] -> 14.25 | AO26: =RC[-28] -> 66.150000000000006 | AP26: - | AQ26: =RC[-29] -> 0 | AR26: =RC[-29] -> 0 | AS26: - | AT26: =RC[-30] -> 0 | AU26: =RC[-30] -> 0 | AV26: =RC[-30] -> 0.92600000000000005 | AW26: =RC[-30] -> 4.4550000000000001 | AY26: - | AZ26: - | BA26: -
A27: =IF(RC[1]="","",DATEVALUE(RC[1])) -> 43379 | B27: 06.10.18 | C27: 24 | D27: 175.62 | E27: 67.17 | F27: 8.7200000000000006 | G27: 163.91 | H27: 44.41 | I27: 6.82 | J27: =RC[-5]-RC[-2] -> 22.760000000000005 | K27: =RC[-7]-RC[-4] -> 11.710000000000008 | L27: 14.7 | M27: 66.94 | R27: 0.96299999999999997 | S27: 4.5179999999999998 | T27: =(RC[-16]*RC[-15]-RC[-13]*RC[-12])/1000 -> 4.5171523000000011 | U27: 14.4 | V27: - | W27: =RC[-2]*RC[-10]/1000 -> 0.96393600000000002 | X27: =ABS((RC[-3]*RC[-11]-RC[-2]*RC[-9])/1000) -> #VALUE! | Y27: =(RC[-14]-RC[1])/RC[-18]*100 -> -1.6411445305350449 | Z27: 14.4 | AC27: =VALUE(RC[-27]) -> 2018-10-06T00:00:00.000 | AD27: =IF(RC[21]=42,"*",IF(RC[21]=32,"",RC[21])) -> - | AE27: =RC[-28] -> 24 | AF27: =RC[-28] -> 175.62 | AG27: =RC[-28] -> 67.17 | AH27: =RC[-28] -> 8.7200000000000006 | AI27: =RC[-28] -> 163.91 | AJ27: =RC[-28] -> 44.41 | AK27: =RC[-28] -> 6.82 | AL27: =RC[-28] -> 22.760000000000005 | AM27: =RC[-28] -> 11.710000000000008 | AN27: =RC[-28] -> 14.7 | AO27: =RC[-28] -> 66.94 | AP27: - | AQ27: =RC[-29] -> 0 | AR27: =RC[-29] -> 0 | AS27: - | AT27: =RC[-30] -> 0 | AU27: =RC[-30] -> 0 | AV27: =RC[-30] -> 0.96299999999999997 | AW27: =RC[-30] -> 4.5179999999999998 | AY27: - | AZ27: - | BA27: -
A28: =IF(RC[1]="","",DATEVALUE(RC[1])) -> 43380 | B28: 07.10.18 | C28: 24 | D28: 176.33 | E28: 67.42 | F28: 8.6999999999999993 | G28: 164.95 | H28: 44.84 | I28: 6.77 | J28: =RC[-5]-RC[-2] -> 22.58 | K28: =RC[-7]-RC[-4] -> 11.380000000000024 | L28: 14.38 | M28: 67.16 | R28: 0.94599999999999995 | S28: 4.4950000000000001 | T28: =(RC[-16]*RC[-15]-RC[-13]*RC[-12])/1000 -> 4.4918106000000009 | U28: 14.07 | V28: - | W28: =RC[-2]*RC[-10]/1000 -> 0.94494119999999993 | X28: =ABS((RC[-3]*RC[-11]-RC[-2]*RC[-9])/1000) -> #VALUE! | Y28: =(RC[-14]-RC[1])/RC[-18]*100 -> -1.63079721127613 | Z28: 14.07 | AC28: =VALUE(RC[-27]) -> 2018-10-07T00:00:00.000 | AD28: =IF(RC[21]=42,"*",IF(RC[21]=32,"",RC[21])) -> - | AE28: =RC[-28] -> 24 | AF28: =RC[-28] -> 176.33 | AG28: =RC[-28] -> 67.42 | AH28: =RC[-28] -> 8.6999999999999993 | AI28: =RC[-28] -> 164.95 | AJ28: =RC[-28] -> 44.84 | AK28: =RC[-28] -> 6.77 | AL28: =RC[-28] -> 22.58 | AM28: =RC[-28] -> 11.380000000000024 | AN28: =RC[-28] -> 14.38 | AO28: =RC[-28] -> 67.16 | AP28: - | AQ28: =RC[-29] -> 0 | AR28: =RC[-29] -> 0 | AS28: - | AT28: =RC[-30] -> 0 | AU28: =RC[-30] -> 0 | AV28: =RC[-30] -> 0.94599999999999995 | AW28: =RC[-30] -> 4.4950000000000001 | AY28: - | AZ28: - | BA28: -
A29: =IF(RC[1]="","",DATEVALUE(RC[1])) -> 43381 | B29: 08.10.18 | C29: 24 | D29: 177.88 | E29: 67.400000000000006 | F29: 8.65 | G29: 166.66 | H29: 44.68 | I29: 6.68 | J29: =RC[-5]-RC[-2] -> 22.720000000000006 | K29: =RC[-7]-RC[-4] -> 11.219999999999999 | L29: 14.32 | M29: 67.08 | R29: 0.94199999999999995 | S29: 4.548 | T29: =(RC[-16]*RC[-15]-RC[-13]*RC[-12])/1000 -> 4.5427432000000012 | U29: 14.03 | V29: - | W29: =RC[-2]*RC[-10]/1000 -> 0.94113239999999998 | X29: =ABS((RC[-3]*RC[-11]-RC[-2]*RC[-9])/1000) -> #VALUE! | Y29: =(RC[-14]-RC[1])/RC[-18]*100 -> -1.686067442697708 | Z29: 14.03 | AC29: =VALUE(RC[-27]) -> 2018-10-08T00:00:00.000 | AD29: =IF(RC[21]=42,"*",IF(RC[21]=32,"",RC[21])) -> - | AE29: =RC[-28] -> 24 | AF29: =RC[-28] -> 177.88 | AG29: =RC[-28] -> 67.400000000000006 | AH29: =RC[-28] -> 8.65 | AI29: =RC[-28] -> 166.66 | AJ29: =RC[-28] -> 44.68 | AK29: =RC[-28] -> 6.68 | AL29: =RC[-28] -> 22.720000000000006 | AM29: =RC[-28] -> 11.219999999999999 | AN29: =RC[-28] -> 14.32 | AO29: =RC[-28] -> 67.08 | AP29: - | AQ29: =RC[-29] -> 0 | AR29: =RC[-29] -> 0 | AS29: - | AT29: =RC[-30] -> 0 | AU29: =RC[-30] -> 0 | AV29: =RC[-30] -> 0.94199999999999995 | AW29: =RC[-30] -> 4.548 | AY29: - | AZ29: - | BA29: -
A30: =IF(RC[1]="","",DATEVALUE(RC[1])) -> 43382 | B30: 09.10.18 | C30: 24 | D30: 174.87 | E30: 67.260000000000005 | F30: 8.65 | G30: 164.43 | H30: 44.41 | I30: 6.74 | J30: =RC[-5]-RC[-2] -> 22.850000000000009 | K30: =RC[-7]-RC[-4] -> 10.439999999999998 | L30: 13.53 | M30: 67.05 | R30: 0.89100000000000001 | S30: 4.4619999999999997 | T30: =(RC[-16]*RC[-15]-RC[-13]*RC[-12])/1000 -> 4.4594199000000021 | U30: 13.26 | V30: - | W30: =RC[-2]*RC[-10]/1000 -> 0.88908299999999996 | X30: =ABS((RC[-3]*RC[-11]-RC[-2]*RC[-9])/1000) -> #VALUE! | Y30: =(RC[-14]-RC[1])/RC[-18]*100 -> -1.7150155081189575 | Z30: 13.26 | AC30: =VALUE(RC[-27]) -> 2018-10-09T00:00:00.000 | AD30: =IF(RC[21]=42,"*",IF(RC[21]=32,"",RC[21])) -> - | AE30: =RC[-28] -> 24 | AF30: =RC[-28] -> 174.87 | AG30: =RC[-28] -> 67.260000000000005 | AH30: =RC[-28] -> 8.65 | AI30: =RC[-28] -> 164.43 | AJ30: =RC[-28] -> 44.41 | AK30: =RC[-28] -> 6.74 | AL30: =RC[-28] -> 22.850000000000009 | AM30: =RC[-28] -> 10.439999999999998 | AN30: =RC[-28] -> 13.53 | AO30: =RC[-28] -> 67.05 | AP30: - | AQ30: =RC[-29] -> 0 | AR30: =RC[-29] -> 0 | AS30: - | AT30: =RC[-30] -> 0 | AU30: =RC[-30] -> 0 | AV30: =RC[-30] -> 0.89100000000000001 | AW30: =RC[-30] -> 4.4619999999999997 | AY30: - | AZ30: - | BA30: -
A31: =IF(RC[1]="","",DATEVALUE(RC[1])) -> 43383 | B31: 10.10.18 | C31: 24 | D31: 171.48 | E31: 68.27 | F31: 8.67 | G31: 160.32 | H31: 45.06 | I31: 6.84 | J31: =RC[-5]-RC[-2] -> 23.209999999999994 | K31: =RC[-7]-RC[-4] -> 11.159999999999997 | L31: 12.9 | M31: 68.12 | R31: 0.86099999999999999 | S31: 4.4820000000000002 | T31: =(RC[-16]*RC[-15]-RC[-13]*RC[-12])/1000 -> 4.4829203999999985 | U31: 12.63 | V31: - | W31: =RC[-2]*RC[-10]/1000 -> 0.86035560000000011 | X31: =ABS((RC[-3]*RC[-11]-RC[-2]*RC[-9])/1000) -> #VALUE! | Y31: =(RC[-14]-RC[1])/RC[-18]*100 -> -0.91691616766467332 | Z31: 12.63 | AC31: =VALUE(RC[-27]) -> 2018-10-10T00:00:00.000 | AD31: =IF(RC[21]=42,"*",IF(RC[21]=32,"",RC[21])) -> - | AE31: =RC[-28] -> 24 | AF31: =RC[-28] -> 171.48 | AG31: =RC[-28] -> 68.27 | AH31: =RC[-28] -> 8.67 | AI31: =RC[-28] -> 160.32 | AJ31: =RC[-28] -> 45.06 | AK31: =RC[-28] -> 6.84 | AL31: =RC[-28] -> 23.209999999999994 | AM31: =RC[-28] -> 11.159999999999997 | AN31: =RC[-28] -> 12.9 | AO31: =RC[-28] -> 68.12 | AP31: - | AQ31: =RC[-29] -> 0 | AR31: =RC[-29] -> 0 | AS31: - | AT31: =RC[-30] -> 0 | AU31: =RC[-30] -> 0 | AV31: =RC[-30] -> 0.86099999999999999 | AW31: =RC[-30] -> 4.4820000000000002 | AY31: - | AZ31: - | BA31: -
A32: =IF(RC[1]="","",DATEVALUE(RC[1])) -> 43384 | B32: 11.10.18 | C32: 24 | D32: 177.51 | E32: 69.39 | F32: 8.6 | G32: 164.92 | H32: 46.17 | I32: 6.64 | J32: =RC[-5]-RC[-2] -> 23.22 | K32: =RC[-7]-RC[-4] -> 12.590000000000003 | L32: 14.62 | M32: 69.12 | R32: 0.98599999999999999 | S32: 4.7080000000000002 | T32: =(RC[-16]*RC[-15]-RC[-13]*RC[-12])/1000 -> 4.7030624999999988 | U32: 14.3 | V32: - | W32: =RC[-2]*RC[-10]/1000 -> 0.98841600000000018 | X32: =ABS((RC[-3]*RC[-11]-RC[-2]*RC[-9])/1000) -> #VALUE! | Y32: =(RC[-14]-RC[1])/RC[-18]*100 -> -1.0368663594470031 | Z32: 14.3 | AC32: =VALUE(RC[-27]) -> 2018-10-11T00:00:00.000 | AD32: =IF(RC[21]=42,"*",IF(RC[21]=32,"",RC[21])) -> - | AE32: =RC[-28] -> 24 | AF32: =RC[-28] -> 177.51 | AG32: =RC[-28] -> 69.39 | AH32: =RC[-28] -> 8.6 | AI32: =RC[-28] -> 164.92 | AJ32: =RC[-28] -> 46.17 | AK32: =RC[-28] -> 6.64 | AL32: =RC[-28] -> 23.22 | AM32: =RC[-28] -> 12.590000000000003 | AN32: =RC[-28] -> 14.62 | AO32: =RC[-28] -> 69.12 | AP32: - | AQ32: =RC[-29] -> 0 | AR32: =RC[-29] -> 0 | AS32: - | AT32: =RC[-30] -> 0 | AU32: =RC[-30] -> 0 | AV32: =RC[-30] -> 0.98599999999999999 | AW32: =RC[-30] -> 4.7080000000000002 | AY32: - | AZ32: - | BA32: -
A33: =IF(RC[1]="","",DATEVALUE(RC[1])) -> 43385 | B33: 12.10.18 | C33: 24 | D33: 176.64 | E33: 69.239999999999995 | F33: 8.58 | G33: 166 | H33: 45.97 | I33: 6.64 | J33: =RC[-5]-RC[-2] -> 23.269999999999996 | K33: =RC[-7]-RC[-4] -> 10.639999999999986 | L33: 13.65 | M33: 68.92 | R33: 0.91700000000000004 | S33: 4.5999999999999996 | T33: =(RC[-16]*RC[-15]-RC[-13]*RC[-12])/1000 -> 4.5995335999999982 | U33: 13.32 | V33: - | W33: =RC[-2]*RC[-10]/1000 -> 0.91801440000000001 | X33: =ABS((RC[-3]*RC[-11]-RC[-2]*RC[-9])/1000) -> #VALUE! | Y33: =(RC[-14]-RC[1])/RC[-18]*100 -> -1.6144578313253097 | Z33: 13.32 | AC33: =VALUE(RC[-27]) -> 2018-10-12T00:00:00.000 | AD33: =IF(RC[21]=42,"*",IF(RC[21]=32,"",RC[21])) -> - | AE33: =RC[-28] -> 24 | AF33: =RC[-28] -> 176.64 | AG33: =RC[-28] -> 69.239999999999995 | AH33: =RC[-28] -> 8.58 | AI33: =RC[-28] -> 166 | AJ33: =RC[-28] -> 45.97 | AK33: =RC[-28] -> 6.64 | AL33: =RC[-28] -> 23.269999999999996 | AM33: =RC[-28] -> 10.639999999999986 | AN33: =RC[-28] -> 13.65 | AO33: =RC[-28] -> 68.92 | AP33: - | AQ33: =RC[-29] -> 0 | AR33: =RC[-29] -> 0 | AS33: - | AT33: =RC[-30] -> 0 | AU33: =RC[-30] -> 0 | AV33: =RC[-30] -> 0.91700000000000004 | AW33: =RC[-30] -> 4.5999999999999996 | AY33: - | AZ33: - | BA33: -
A34: =IF(RC[1]="","",DATEVALUE(RC[1])) -> 43386 | B34: 13.10.18 | C34: 24 | D34: 176.07 | E34: 70.349999999999994 | F34: 8.5500000000000007 | G34: 165.18 | H34: 46.86 | I34: 6.63 | J34: =RC[-5]-RC[-2] -> 23.489999999999995 | K34: =RC[-7]-RC[-4] -> 10.889999999999986 | L34: 13.93 | M34: 70.16 | R34: 0.95299999999999996 | S34: 4.6479999999999997 | T34: =(RC[-16]*RC[-15]-RC[-13]*RC[-12])/1000 -> 4.6461896999999972 | U34: 13.62 | V34: - | W34: =RC[-2]*RC[-10]/1000 -> 0.95557919999999985 | X34: =ABS((RC[-3]*RC[-11]-RC[-2]*RC[-9])/1000) -> #VALUE! | Y34: =(RC[-14]-RC[1])/RC[-18]*100 -> -1.6527424627678973 | Z34: 13.62 | AC34: =VALUE(RC[-27]) -> 2018-10-13T00:00:00.000 | AD34: =IF(RC[21]=42,"*",IF(RC[21]=32,"",RC[21])) -> - | AE34: =RC[-28] -> 24 | AF34: =RC[-28] -> 176.07 | AG34: =RC[-28] -> 70.349999999999994 | AH34: =RC[-28] -> 8.5500000000000007 | AI34: =RC[-28] -> 165.18 | AJ34: =RC[-28] -> 46.86 | AK34: =RC[-28] -> 6.63 | AL34: =RC[-28] -> 23.489999999999995 | AM34: =RC[-28] -> 10.889999999999986 | AN34: =RC[-28] -> 13.93 | AO34: =RC[-28] -> 70.16 | AP34: - | AQ34: =RC[-29] -> 0 | AR34: =RC[-29] -> 0 | AS34: - | AT34: =RC[-30] -> 0 | AU34: =RC[-30] -> 0 | AV34: =RC[-30] -> 0.95299999999999996 | AW34: =RC[-30] -> 4.6479999999999997 | AY34: - | AZ34: - | BA34: -
A35: =IF(RC[1]="","",DATEVALUE(RC[1])) -> 43387 | B35: 14.10.18 | C35: 24 | D35: 175.54 | E35: 71.11 | F35: 8.5399999999999991 | G35: 165.26 | H35: 47.67 | I35: 6.62 | J35: =RC[-5]-RC[-2] -> 23.439999999999998 | K35: =RC[-7]-RC[-4] -> 10.280000000000001 | L35: 13.23 | M35: 70.97 | R35: 0.91800000000000004 | S35: 4.609 | T35: =(RC[-16]*RC[-15]-RC[-13]*RC[-12])/1000 -> 4.6047052000000006 | U35: 12.95 | V35: - | W35: =RC[-2]*RC[-10]/1000 -> 0.91906149999999986 | X35: =ABS((RC[-3]*RC[-11]-RC[-2]*RC[-9])/1000) -> #VALUE! | Y35: =(RC[-14]-RC[1])/RC[-18]*100 -> -1.6156359675662584 | Z35: 12.95 | AC35: =VALUE(RC[-27]) -> 2018-10-14T00:00:00.000 | AD35: =IF(RC[21]=42,"*",IF(RC[21]=32,"",RC[21])) -> - | AE35: =RC[-28] -> 24 | AF35: =RC[-28] -> 175.54 | AG35: =RC[-28] -> 71.11 | AH35: =RC[-28] -> 8.5399999999999991 | AI35: =RC[-28] -> 165.26 | AJ35: =RC[-28] -> 47.67 | AK35: =RC[-28] -> 6.62 | AL35: =RC[-28] -> 23.439999999999998 | AM35: =RC[-28] -> 10.280000000000001 | AN35: =RC[-28] -> 13.23 | AO35: =RC[-28] -> 70.97 | AP35: - | AQ35: =RC[-29] -> 0 | AR35: =RC[-29] -> 0 | AS35: - | AT35: =RC[-30] -> 0 | AU35: =RC[-30] -> 0 | AV35: =RC[-30] -> 0.91800000000000004 | AW35: =RC[-30] -> 4.609 | AY35: - | AZ35: - | BA35: -
A36: =IF(RC[1]="","",DATEVALUE(RC[1])) -> 43388 | B36: 15.10.18 | C36: 24 | D36: 175.63 | E36: 70.569999999999993 | F36: 8.5399999999999991 | G36: 165.67 | H36: 47.8 | I36: 6.61 | J36: =RC[-5]-RC[-2] -> 22.769999999999996 | K36: =RC[-7]-RC[-4] -> 9.960000000000008 | L36: 12.74 | M36: 70.27 | R36: 0.877 | S36: 4.4790000000000001 | T36: =(RC[-16]*RC[-15]-RC[-13]*RC[-12])/1000 -> 4.4751830999999989 | U36: 12.46 | V36: - | W36: =RC[-2]*RC[-10]/1000 -> 0.87556420000000001 | X36: =ABS((RC[-3]*RC[-11]-RC[-2]*RC[-9])/1000) -> #VALUE! | Y36: =(RC[-14]-RC[1])/RC[-18]*100 -> -1.5090239633005331 | Z36: 12.46 | AC36: =VALUE(RC[-27]) -> 2018-10-15T00:00:00.000 | AD36: =IF(RC[21]=42,"*",IF(RC[21]=32,"",RC[21])) -> - | AE36: =RC[-28] -> 24 | AF36: =RC[-28] -> 175.63 | AG36: =RC[-28] -> 70.569999999999993 | AH36: =RC[-28] -> 8.5399999999999991 | AI36: =RC[-28] -> 165.67 | AJ36: =RC[-28] -> 47.8 | AK36: =RC[-28] -> 6.61 | AL36: =RC[-28] -> 22.769999999999996 | AM36: =RC[-28] -> 9.960000000000008 | AN36: =RC[-28] -> 12.74 | AO36: =RC[-28] -> 70.27 | AP36: - | AQ36: =RC[-29] -> 0 | AR36: =RC[-29] -> 0 | AS36: - | AT36: =RC[-30] -> 0 | AU36: =RC[-30] -> 0 | AV36: =RC[-30] -> 0.877 | AW36: =RC[-30] -> 4.4790000000000001 | AY36: - | AZ36: - | BA36: -
A37: =IF(RC[1]="","",DATEVALUE(RC[1])) -> 43389 | B37: 16.10.18 | C37: 24 | D37: 175.85 | E37: 70.58 | F37: 8.5299999999999994 | G37: 165.02 | H37: 47.79 | I37: 6.61 | J37: =RC[-5]-RC[-2] -> 22.79 | K37: =RC[-7]-RC[-4] -> 10.829999999999984 | L37: 13.81 | M37: 70.260000000000005 | R37: 0.94799999999999995 | S37: 4.5279999999999996 | T37: =(RC[-16]*RC[-15]-RC[-13]*RC[-12])/1000 -> 4.5251871999999986 | U37: 13.52 | V37: - | W37: =RC[-2]*RC[-10]/1000 -> 0.94991520000000007 | X37: =ABS((RC[-3]*RC[-11]-RC[-2]*RC[-9])/1000) -> #VALUE! | Y37: =(RC[-14]-RC[1])/RC[-18]*100 -> -1.6301054417646437 | Z37: 13.52 | AC37: =VALUE(RC[-27]) -> 2018-10-16T00:00:00.000 | AD37: =IF(RC[21]=42,"*",IF(RC[21]=32,"",RC[21])) -> - | AE37: =RC[-28] -> 24 | AF37: =RC[-28] -> 175.85 | AG37: =RC[-28] -> 70.58 | AH37: =RC[-28] -> 8.5299999999999994 | AI37: =RC[-28] -> 165.02 | AJ37: =RC[-28] -> 47.79 | AK37: =RC[-28] -> 6.61 | AL37: =RC[-28] -> 22.79 | AM37: =RC[-28] -> 10.829999999999984 | AN37: =RC[-28] -> 13.81 | AO37: =RC[-28] -> 70.260000000000005 | AP37: - | AQ37: =RC[-29] -> 0 | AR37: =RC[-29] -> 0 | AS37: - | AT37: =RC[-30] -> 0 | AU37: =RC[-30] -> 0 | AV37: =RC[-30] -> 0.94799999999999995 | AW37: =RC[-30] -> 4.5279999999999996 | AY37: - | AZ37: - | BA37: -
A38: =IF(RC[1]="","",DATEVALUE(RC[1])) -> 43390 | B38: 17.10.18 | C38: 24 | D38: 175.99 | E38: 70.819999999999993 | F38: 8.5299999999999994 | G38: 165.23 | H38: 48.1 | I38: 6.61 | J38: =RC[-5]-RC[-2] -> 22.719999999999992 | K38: =RC[-7]-RC[-4] -> 10.760000000000019 | L38: 13.85 | M38: 70.540000000000006 | R38: 0.95599999999999996 | S38: 4.5190000000000001 | T38: =(RC[-16]*RC[-15]-RC[-13]*RC[-12])/1000 -> 4.5160487999999983 | U38: 13.56 | V38: - | W38: =RC[-2]*RC[-10]/1000 -> 0.95652240000000022 | X38: =ABS((RC[-3]*RC[-11]-RC[-2]*RC[-9])/1000) -> #VALUE! | Y38: =(RC[-14]-RC[1])/RC[-18]*100 -> -1.6946075167947594 | Z38: 13.56 | AC38: =VALUE(RC[-27]) -> 2018-10-17T00:00:00.000 | AD38: =IF(RC[21]=42,"*",IF(RC[21]=32,"",RC[21])) -> - | AE38: =RC[-28] -> 24 | AF38: =RC[-28] -> 175.99 | AG38: =RC[-28] -> 70.819999999999993 | AH38: =RC[-28] -> 8.5299999999999994 | AI38: =RC[-28] -> 165.23 | AJ38: =RC[-28] -> 48.1 | AK38: =RC[-28] -> 6.61 | AL38: =RC[-28] -> 22.719999999999992 | AM38: =RC[-28] -> 10.760000000000019 | AN38: =RC[-28] -> 13.85 | AO38: =RC[-28] -> 70.540000000000006 | AP38: - | AQ38: =RC[-29] -> 0 | AR38: =RC[-29] -> 0 | AS38: - | AT38: =RC[-30] -> 0 | AU38: =RC[-30] -> 0 | AV38: =RC[-30] -> 0.95599999999999996 | AW38: =RC[-30] -> 4.5190000000000001 | AY38: - | AZ38: - | BA38: -
A39: =IF(RC[1]="","",DATEVALUE(RC[1])) -> 43391 | B39: 18.10.18 | C39: 24 | D39: 175.39 | E39: 71.28 | F39: 8.5399999999999991 | G39: 165.88 | H39: 48.39 | I39: 6.61 | J39: 22.89 | K39: 9.51 | L39: 12.56 | M39: 70.989999999999995 | R39: 0.86899999999999999 | S39: 4.4779999999999998 | T39: 4.4748659999999996 | U39: 12.26 | V39: - | W39: 0.87033739999999993 | X39: #VALUE! | Y39: -1.6578249336870028 | Z39: 12.26 | AC39: =VALUE(RC[-27]) -> 2018-10-18T00:00:00.000 | AD39: =IF(RC[21]=42,"*",IF(RC[21]=32,"",RC[21])) ->  | AE39: =RC[-28] -> 24 | AF39: =RC[-28] -> 175.39 | AG39: =RC[-28] -> 71.28 | AH39: =RC[-28] -> 8.5399999999999991 | AI39: =RC[-28] -> 165.88 | AJ39: =RC[-28] -> 48.39 | AK39: =RC[-28] -> 6.61 | AL39: =RC[-28] -> 22.89 | AM39: =RC[-28] -> 9.51 | AN39: =RC[-28] -> 12.56 | AO39: =RC[-28] -> 70.989999999999995 | AP39: - | AQ39: =RC[-29] -> 0 | AR39: =RC[-29] -> 0 | AS39: - | AT39: =RC[-30] -> 0 | AU39: =RC[-30] -> 0 | AV39: =RC[-30] -> 0.86899999999999999 | AW39: =RC[-30] -> 4.4779999999999998
A40: =IF(RC[1]="","",DATEVALUE(RC[1])) -> 43392 | B40: 19.10.18 | C40: 24 | D40: 174.54 | E40: 71.08 | F40: 8.56 | G40: 166.24 | H40: 47.91 | I40: 6.62 | J40: 23.17 | K40: 8.3000000000000007 | L40: 11.28 | M40: 70.69 | R40: 0.77900000000000003 | S40: 4.4429999999999996 | T40: 4.4417447999999986 | U40: 11.04 | V40: - | W40: 0.78041759999999993 | X40: #VALUE! | Y40: -1.6482194417709324 | Z40: 11.04 | AC40: =VALUE(RC[-27]) -> 2018-10-19T00:00:00.000 | AD40: =IF(RC[21]=42,"*",IF(RC[21]=32,"",RC[21])) ->  | AE40: =RC[-28] -> 24 | AF40: =RC[-28] -> 174.54 | AG40: =RC[-28] -> 71.08 | AH40: =RC[-28] -> 8.56 | AI40: =RC[-28] -> 166.24 | AJ40: =RC[-28] -> 47.91 | AK40: =RC[-28] -> 6.62 | AL40: =RC[-28] -> 23.17 | AM40: =RC[-28] -> 8.3000000000000007 | AN40: =RC[-28] -> 11.28 | AO40: =RC[-28] -> 70.69 | AP40: - | AQ40: =RC[-29] -> 0 | AR40: =RC[-29] -> 0 | AS40: - | AT40: =RC[-30] -> 0 | AU40: =RC[-30] -> 0 | AV40: =RC[-30] -> 0.77900000000000003 | AW40: =RC[-30] -> 4.4429999999999996
A41: =IF(RC[1]="","",DATEVALUE(RC[1])) -> 43393 | B41: 20.10.18 | C41: 24 | D41: 176.18 | E41: 70.34 | F41: 8.5399999999999991 | G41: 166.08 | H41: 47.48 | I41: 6.61 | J41: 22.860000000000007 | K41: 10.1 | L41: 13.11 | M41: 70 | R41: 0.90100000000000002 | S41: 4.51 | T41: 4.5070228000000006 | U41: 12.84 | V41: - | W41: 0.89879999999999993 | X41: #VALUE! | Y41: -1.6498073217726399 | Z41: 12.84 | AC41: =VALUE(RC[-27]) -> 2018-10-20T00:00:00.000 | AD41: =IF(RC[21]=42,"*",IF(RC[21]=32,"",RC[21])) ->  | AE41: =RC[-28] -> 24 | AF41: =RC[-28] -> 176.18 | AG41: =RC[-28] -> 70.34 | AH41: =RC[-28] -> 8.5399999999999991 | AI41: =RC[-28] -> 166.08 | AJ41: =RC[-28] -> 47.48 | AK41: =RC[-28] -> 6.61 | AL41: =RC[-28] -> 22.860000000000007 | AM41: =RC[-28] -> 10.1 | AN41: =RC[-28] -> 13.11 | AO41: =RC[-28] -> 70 | AP41: - | AQ41: =RC[-29] -> 0 | AR41: =RC[-29] -> 0 | AS41: - | AT41: =RC[-30] -> 0 | AU41: =RC[-30] -> 0 | AV41: =RC[-30] -> 0.90100000000000002 | AW41: =RC[-30] -> 4.51
A42: =IF(RC[1]="","",DATEVALUE(RC[1])) -> 43394 | B42: 21.10.18 | C42: 24 | D42: 176.85 | E42: 69.510000000000005 | F42: 8.5500000000000007 | G42: 166.04 | H42: 46.86 | I42: 6.61 | J42: 22.650000000000006 | K42: 10.81 | L42: 13.98 | M42: 69.19 | R42: 0.94799999999999995 | S42: 4.5119999999999996 | T42: 4.5122091000000006 | U42: 13.7 | V42: - | W42: 0.94790299999999994 | X42: #VALUE! | Y42: -1.7405444471211748 | Z42: 13.7 | AC42: =VALUE(RC[-27]) -> 2018-10-21T00:00:00.000 | AD42: =IF(RC[21]=42,"*",IF(RC[21]=32,"",RC[21])) ->  | AE42: =RC[-28] -> 24 | AF42: =RC[-28] -> 176.85 | AG42: =RC[-28] -> 69.510000000000005 | AH42: =RC[-28] -> 8.5500000000000007 | AI42: =RC[-28] -> 166.04 | AJ42: =RC[-28] -> 46.86 | AK42: =RC[-28] -> 6.61 | AL42: =RC[-28] -> 22.650000000000006 | AM42: =RC[-28] -> 10.81 | AN42: =RC[-28] -> 13.98 | AO42: =RC[-28] -> 69.19 | AP42: - | AQ42: =RC[-29] -> 0 | AR42: =RC[-29] -> 0 | AS42: - | AT42: =RC[-30] -> 0 | AU42: =RC[-30] -> 0 | AV42: =RC[-30] -> 0.94799999999999995 | AW42: =RC[-30] -> 4.5119999999999996
A43: =IF(RC[1]="","",DATEVALUE(RC[1])) -> 43395 | B43: 22.10.18 | C43: 24 | D43: 176.04 | E43: 70.03 | F43: 8.57 | G43: 166.34 | H43: 46.95 | I43: 6.63 | J43: 23.08 | K43: 9.6999999999999993 | L43: 12.68 | M43: 69.95 | R43: 0.87 | S43: 4.5199999999999996 | T43: 4.5184182000000002 | U43: 12.4 | V43: - | W43: 0.86738000000000015 | X43: #VALUE! | Y43: -1.6231814356138037 | Z43: 12.4 | AC43: =VALUE(RC[-27]) -> 2018-10-22T00:00:00.000 | AD43: =IF(RC[21]=42,"*",IF(RC[21]=32,"",RC[21])) ->  | AE43: =RC[-28] -> 24 | AF43: =RC[-28] -> 176.04 | AG43: =RC[-28] -> 70.03 | AH43: =RC[-28] -> 8.57 | AI43: =RC[-28] -> 166.34 | AJ43: =RC[-28] -> 46.95 | AK43: =RC[-28] -> 6.63 | AL43: =RC[-28] -> 23.08 | AM43: =RC[-28] -> 9.6999999999999993 | AN43: =RC[-28] -> 12.68 | AO43: =RC[-28] -> 69.95 | AP43: - | AQ43: =RC[-29] -> 0 | AR43: =RC[-29] -> 0 | AS43: - | AT43: =RC[-30] -> 0 | AU43: =RC[-30] -> 0 | AV43: =RC[-30] -> 0.87 | AW43: =RC[-30] -> 4.5199999999999996
A44: =IF(RC[1]="","",DATEVALUE(RC[1])) ->  | C44: 24 | J44: =RC[-5]-RC[-2] -> #VALUE! | K44: =RC[-7]-RC[-4] -> #VALUE! | T44: =(RC[-16]*RC[-15]-RC[-13]*RC[-12])/1000 -> #VALUE! | W44: =RC[-2]*RC[-10]/1000 -> #VALUE! | X44: =ABS((RC[-3]*RC[-11]-RC[-2]*RC[-9])/1000) -> #VALUE! | Y44: =(RC[-14]-RC[1])/RC[-18]*100 -> #VALUE! | AC44: =VALUE(RC[-27]) -> #VALUE! | AD44: =IF(RC[21]=42,"*",IF(RC[21]=32,"",RC[21])) ->  | AE44: =RC[-28] -> 24 | AF44: =RC[-28] ->  | AG44: =RC[-28] ->  | AH44: =RC[-28] ->  | AI44: =RC[-28] ->  | AJ44: =RC[-28] ->  | AK44: =RC[-28] ->  | AL44: =RC[-28] -> #VALUE! | AM44: =RC[-28] -> #VALUE! | AN44: =RC[-28] ->  | AO44: =RC[-28] ->  | AP44: - | AQ44: =RC[-29] -> 0 | AR44: =RC[-29] -> 0 | AS44: - | AT44: =RC[-30] -> 0 | AU44: =RC[-30] -> 0 | AV44: =RC[-30] ->  | AW44: =RC[-30] -> 
A45: =IF(RC[1]="","",DATEVALUE(RC[1])) ->  | C45: 24 | K45: =RC[-7]-RC[-4] -> #VALUE! | T45: =(RC[-16]*RC[-15]-RC[-13]*RC[-12])/1000 -> #VALUE! | W45: =RC[-2]*RC[-10]/1000 -> #VALUE! | X45: =ABS((RC[-3]*RC[-11]-RC[-2]*RC[-9])/1000) -> #VALUE! | Y45: =(RC[-14]-RC[1])/RC[-18]*100 -> #VALUE! | AC45: =VALUE(RC[-27]) -> #VALUE! | AD45: =IF(RC[21]=42,"*",IF(RC[21]=32,"",RC[21])) ->  | AE45: =RC[-28] -> 24 | AF45: =RC[-28] ->  | AG45: =RC[-28] ->  | AH45: =RC[-28] ->  | AI45: =RC[-28] ->  | AJ45: =RC[-28] ->  | AK45: =RC[-28] ->  | AL45: =RC[-28] -> 0 | AM45: =RC[-28] -> #VALUE! | AN45: =RC[-28] ->  | AO45: =RC[-28] ->  | AP45: - | AQ45: =RC[-29] -> 0 | AR45: =RC[-29] -> 0 | AS45: - | AT45: =RC[-30] -> 0 | AU45: =RC[-30] -> 0 | AV45: =RC[-30] ->  | AW45: =RC[-30] -> 
A46: =IF(RC[1]="","",DATEVALUE(RC[1])) ->  | C46: 24 | K46: =RC[-7]-RC[-4] -> #VALUE! | T46: =(RC[-16]*RC[-15]-RC[-13]*RC[-12])/1000 -> #VALUE! | W46: =RC[-2]*RC[-10]/1000 -> #VALUE! | X46: =ABS((RC[-3]*RC[-11]-RC[-2]*RC[-9])/1000) -> #VALUE! | Y46: =(RC[-14]-RC[1])/RC[-18]*100 -> #VALUE! | AC46: =VALUE(RC[-27]) -> #VALUE! | AD46: =IF(RC[21]=42,"*",IF(RC[21]=32,"",RC[21])) ->  | AE46: =RC[-28] -> 24 | AF46: =RC[-28] ->  | AG46: =RC[-28] ->  | AH46: =RC[-28] ->  | AI46: =RC[-28] ->  | AJ46: =RC[-28] ->  | AK46: =RC[-28] ->  | AL46: =RC[-28] -> 0 | AM46: =RC[-28] -> #VALUE! | AN46: =RC[-28] ->  | AO46: =RC[-28] ->  | AP46: - | AQ46: =RC[-29] -> 0 | AR46: =RC[-29] -> 0 | AS46: - | AT46: =RC[-30] -> 0 | AU46: =RC[-30] -> 0 | AV46: =RC[-30] ->  | AW46: =RC[-30] -> 
A47: =IF(RC[1]="","",DATEVALUE(RC[1])) ->  | C47: 24 | K47: =RC[-7]-RC[-4] -> #VALUE! | T47: =(RC[-16]*RC[-15]-RC[-13]*RC[-12])/1000 -> #VALUE! | W47: =RC[-2]*RC[-10]/1000 -> #VALUE! | X47: =ABS((RC[-3]*RC[-11]-RC[-2]*RC[-9])/1000) -> #VALUE! | Y47: =(RC[-14]-RC[1])/RC[-18]*100 -> #VALUE! | AC47: =VALUE(RC[-27]) -> #VALUE! | AD47: =IF(RC[21]=42,"*",IF(RC[21]=32,"",RC[21])) ->  | AE47: =RC[-28] -> 24 | AF47: =RC[-28] ->  | AG47: =RC[-28] ->  | AH47: =RC[-28] ->  | AI47: =RC[-28] ->  | AJ47: =RC[-28] ->  | AK47: =RC[-28] ->  | AL47: =RC[-28] -> 0 | AM47: =RC[-28] -> #VALUE! | AN47: =RC[-28] ->  | AO47: =RC[-28] ->  | AP47: - | AQ47: =RC[-29] -> 0 | AR47: =RC[-29] -> 0 | AS47: - | AT47: =RC[-30] -> 0 | AU47: =RC[-30] -> 0 | AV47: =RC[-30] ->  | AW47: =RC[-30] -> 
A48: =IF(RC[1]="","",DATEVALUE(RC[1])) ->  | C48: 24 | K48: =RC[-7]-RC[-4] -> #VALUE! | T48: =(RC[-16]*RC[-15]-RC[-13]*RC[-12])/1000 -> #VALUE! | W48: =RC[-2]*RC[-10]/1000 -> #VALUE! | X48: =ABS((RC[-3]*RC[-11]-RC[-2]*RC[-9])/1000) -> #VALUE! | Y48: =(RC[-14]-RC[1])/RC[-18]*100 -> #VALUE! | AC48: =VALUE(RC[-27]) -> #VALUE! | AD48: =IF(RC[21]=42,"*",IF(RC[21]=32,"",RC[21])) ->  | AE48: =RC[-28] -> 24 | AF48: =RC[-28] ->  | AG48: =RC[-28] ->  | AH48: =RC[-28] ->  | AI48: =RC[-28] ->  | AJ48: =RC[-28] ->  | AK48: =RC[-28] ->  | AL48: =RC[-28] -> 0 | AM48: =RC[-28] -> #VALUE! | AN48: =RC[-28] ->  | AO48: =RC[-28] ->  | AP48: - | AQ48: =RC[-29] -> 0 | AR48: =RC[-29] -> 0 | AS48: - | AT48: =RC[-30] -> 0 | AU48: =RC[-30] -> 0 | AV48: =RC[-30] ->  | AW48: =RC[-30] -> 
A49: =IF(RC[1]="","",DATEVALUE(RC[1])) ->  | C49: 24 | K49: =RC[-7]-RC[-4] -> #VALUE! | T49: =(RC[-16]*RC[-15]-RC[-13]*RC[-12])/1000 -> #VALUE! | W49: =RC[-2]*RC[-10]/1000 -> #VALUE! | X49: =ABS((RC[-3]*RC[-11]-RC[-2]*RC[-9])/1000) -> #VALUE! | Y49: =(RC[-14]-RC[1])/RC[-18]*100 -> #VALUE! | AC49: =VALUE(RC[-27]) -> #VALUE! | AD49: =IF(RC[21]=42,"*",IF(RC[21]=32,"",RC[21])) ->  | AE49: =RC[-28] -> 24 | AF49: =RC[-28] ->  | AG49: =RC[-28] ->  | AH49: =RC[-28] ->  | AI49: =RC[-28] ->  | AJ49: =RC[-28] ->  | AK49: =RC[-28] ->  | AL49: =RC[-28] -> 0 | AM49: =RC[-28] -> #VALUE! | AN49: =RC[-28] ->  | AO49: =RC[-28] ->  | AP49: - | AQ49: =RC[-29] -> 0 | AR49: =RC[-29] -> 0 | AS49: - | AT49: =RC[-30] -> 0 | AU49: =RC[-30] -> 0 | AV49: =RC[-30] ->  | AW49: =RC[-30] -> 
A50: =IF(RC[1]="","",DATEVALUE(RC[1])) ->  | K50: =RC[-7]-RC[-4] -> #VALUE! | T50: =(RC[-16]*RC[-15]-RC[-13]*RC[-12])/1000 -> #VALUE! | W50: =RC[-2]*RC[-10]/1000 -> #VALUE! | X50: =ABS((RC[-3]*RC[-11]-RC[-2]*RC[-9])/1000) -> #VALUE! | Y50: =(RC[-14]-RC[1])/RC[-18]*100 -> #VALUE! | AC50: =VALUE(RC[-27]) -> #VALUE! | AD50: =IF(RC[21]=42,"*",IF(RC[21]=32,"",RC[21])) ->  | AE50: =RC[-28] ->  | AF50: =RC[-28] ->  | AG50: =RC[-28] ->  | AH50: =RC[-28] ->  | AI50: =RC[-28] ->  | AJ50: =RC[-28] ->  | AK50: =RC[-28] ->  | AL50: =RC[-28] -> 0 | AM50: =RC[-28] -> #VALUE! | AN50: =RC[-28] ->  | AO50: =RC[-28] ->  | AP50: - | AQ50: =RC[-29] -> 0 | AR50: =RC[-29] -> 0 | AS50: - | AT50: =RC[-30] -> 0 | AU50: =RC[-30] -> 0 | AV50: =RC[-30] ->  | AW50: =RC[-30] -> 
A51: =IF(RC[1]="","",DATEVALUE(RC[1])) ->  | K51: =RC[-7]-RC[-4] -> #VALUE! | T51: =(RC[-16]*RC[-15]-RC[-13]*RC[-12])/1000 -> #VALUE! | W51: =RC[-2]*RC[-10]/1000 -> #VALUE! | X51: =ABS((RC[-3]*RC[-11]-RC[-2]*RC[-9])/1000) -> #VALUE! | Y51: =(RC[-14]-RC[1])/RC[-18]*100 -> #VALUE! | AC51: =VALUE(RC[-27]) -> #VALUE! | AD51: =IF(RC[21]=42,"*",IF(RC[21]=32,"",RC[21])) ->  | AE51: =RC[-28] ->  | AF51: =RC[-28] ->  | AG51: =RC[-28] ->  | AH51: =RC[-28] ->  | AI51: =RC[-28] ->  | AJ51: =RC[-28] ->  | AK51: =RC[-28] ->  | AL51: =RC[-28] -> 0 | AM51: =RC[-28] -> #VALUE! | AN51: =RC[-28] ->  | AO51: =RC[-28] ->  | AP51: - | AQ51: =RC[-29] -> 0 | AR51: =RC[-29] -> 0 | AS51: - | AT51: =RC[-30] -> 0 | AU51: =RC[-30] -> 0 | AV51: =RC[-30] ->  | AW51: =RC[-30] -> 
A52: =IF(RC[1]="","",DATEVALUE(RC[1])) ->  | K52: =RC[-7]-RC[-4] -> #VALUE! | T52: =(RC[-16]*RC[-15]-RC[-13]*RC[-12])/1000 -> #VALUE! | W52: =RC[-2]*RC[-10]/1000 -> #VALUE! | X52: =ABS((RC[-3]*RC[-11]-RC[-2]*RC[-9])/1000) -> #VALUE! | Y52: =(RC[-14]-RC[1])/RC[-18]*100 -> #VALUE! | AC52: =VALUE(RC[-27]) -> #VALUE! | AD52: =IF(RC[21]=42,"*",IF(RC[21]=32,"",RC[21])) ->  | AE52: =RC[-28] ->  | AF52: =RC[-28] ->  | AG52: =RC[-28] ->  | AH52: =RC[-28] ->  | AI52: =RC[-28] ->  | AJ52: =RC[-28] ->  | AK52: =RC[-28] ->  | AL52: =RC[-28] -> 0 | AM52: =RC[-28] -> #VALUE! | AN52: =RC[-28] ->  | AO52: =RC[-28] ->  | AP52: - | AQ52: =RC[-29] -> 0 | AR52: =RC[-29] -> 0 | AS52: - | AT52: =RC[-30] -> 0 | AU52: =RC[-30] -> 0 | AV52: =RC[-30] ->  | AW52: =RC[-30] -> 
A53: =IF(RC[1]="","",DATEVALUE(RC[1])) ->  | K53: =RC[-7]-RC[-4] -> #VALUE! | T53: =(RC[-16]*RC[-15]-RC[-13]*RC[-12])/1000 -> #VALUE! | W53: =RC[-2]*RC[-10]/1000 -> #VALUE! | X53: =ABS((RC[-3]*RC[-11]-RC[-2]*RC[-9])/1000) -> #VALUE! | Y53: =(RC[-14]-RC[1])/RC[-18]*100 -> #VALUE! | AC53: =VALUE(RC[-27]) -> #VALUE! | AD53: =IF(RC[21]=42,"*",IF(RC[21]=32,"",RC[21])) ->  | AE53: =RC[-28] ->  | AF53: =RC[-28] ->  | AG53: =RC[-28] ->  | AH53: =RC[-28] ->  | AI53: =RC[-28] ->  | AJ53: =RC[-28] ->  | AK53: =RC[-28] ->  | AL53: =RC[-28] -> 0 | AM53: =RC[-28] -> #VALUE! | AN53: =RC[-28] ->  | AO53: =RC[-28] ->  | AP53: - | AQ53: =RC[-29] -> 0 | AR53: =RC[-29] -> 0 | AS53: - | AT53: =RC[-30] -> 0 | AU53: =RC[-30] -> 0 | AV53: =RC[-30] ->  | AW53: =RC[-30] -> 
A54: =IF(RC[1]="","",DATEVALUE(RC[1])) ->  | K54: =RC[-7]-RC[-4] -> #VALUE! | T54: =(RC[-16]*RC[-15]-RC[-13]*RC[-12])/1000 -> #VALUE! | W54: =RC[-2]*RC[-10]/1000 -> #VALUE! | X54: =ABS((RC[-3]*RC[-11]-RC[-2]*RC[-9])/1000) -> #VALUE! | Y54: =(RC[-14]-RC[1])/RC[-18]*100 -> #VALUE! | AC54: =VALUE(RC[-27]) -> #VALUE! | AD54: =IF(RC[21]=42,"*",IF(RC[21]=32,"",RC[21])) ->  | AE54: =RC[-28] ->  | AF54: =RC[-28] ->  | AG54: =RC[-28] ->  | AH54: =RC[-28] ->  | AI54: =RC[-28] ->  | AJ54: =RC[-28] ->  | AK54: =RC[-28] ->  | AL54: =RC[-28] -> 0 | AM54: =RC[-28] -> #VALUE! | AN54: =RC[-28] ->  | AO54: =RC[-28] ->  | AP54: - | AQ54: =RC[-29] -> 0 | AR54: =RC[-29] -> 0 | AS54: - | AT54: =RC[-30] -> 0 | AU54: =RC[-30] -> 0 | AV54: =RC[-30] ->  | AW54: =RC[-30] -> 
A55: =IF(RC[1]="","",DATEVALUE(RC[1])) ->  | K55: =RC[-7]-RC[-4] -> #VALUE! | T55: =(RC[-16]*RC[-15]-RC[-13]*RC[-12])/1000 -> #VALUE! | W55: =RC[-2]*RC[-10]/1000 -> #VALUE! | X55: =ABS((RC[-3]*RC[-11]-RC[-2]*RC[-9])/1000) -> #VALUE! | Y55: =(RC[-14]-RC[1])/RC[-18]*100 -> #VALUE! | AC55: =VALUE(RC[-27]) -> #VALUE! | AD55: =IF(RC[21]=42,"*",IF(RC[21]=32,"",RC[21])) ->  | AE55: =RC[-28] ->  | AF55: =RC[-28] ->  | AG55: =RC[-28] ->  | AH55: =RC[-28] ->  | AI55: =RC[-28] ->  | AJ55: =RC[-28] ->  | AK55: =RC[-28] ->  | AL55: =RC[-28] -> 0 | AM55: =RC[-28] -> #VALUE! | AN55: =RC[-28] ->  | AO55: =RC[-28] ->  | AP55: - | AQ55: =RC[-29] -> 0 | AR55: =RC[-29] -> 0 | AS55: - | AT55: =RC[-30] -> 0 | AU55: =RC[-30] -> 0 | AV55: =RC[-30] ->  | AW55: =RC[-30] -> 
A56: =IF(RC[1]="","",DATEVALUE(RC[1])) ->  | K56: =RC[-7]-RC[-4] -> #VALUE! | T56: =(RC[-16]*RC[-15]-RC[-13]*RC[-12])/1000 -> #VALUE! | W56: =RC[-2]*RC[-10]/1000 -> #VALUE! | X56: =ABS((RC[-3]*RC[-11]-RC[-2]*RC[-9])/1000) -> #VALUE! | Y56: =(RC[-14]-RC[1])/RC[-18]*100 -> #VALUE! | AC56: =VALUE(RC[-27]) -> #VALUE! | AD56: =IF(RC[21]=42,"*",IF(RC[21]=32,"",RC[21])) ->  | AE56: =RC[-28] ->  | AF56: =RC[-28] ->  | AG56: =RC[-28] ->  | AH56: =RC[-28] ->  | AI56: =RC[-28] ->  | AJ56: =RC[-28] ->  | AK56: =RC[-28] ->  | AL56: =RC[-28] -> 0 | AM56: =RC[-28] -> #VALUE! | AN56: =RC[-28] ->  | AO56: =RC[-28] ->  | AP56: - | AQ56: =RC[-29] -> 0 | AR56: =RC[-29] -> 0 | AS56: - | AT56: =RC[-30] -> 0 | AU56: =RC[-30] -> 0 | AV56: =RC[-30] ->  | AW56: =RC[-30] -> 
A57: =IF(RC[1]="","",DATEVALUE(RC[1])) ->  | K57: =RC[-7]-RC[-4] -> #VALUE! | T57: =(RC[-16]*RC[-15]-RC[-13]*RC[-12])/1000 -> #VALUE! | W57: =RC[-2]*RC[-10]/1000 -> #VALUE! | X57: =ABS((RC[-3]*RC[-11]-RC[-2]*RC[-9])/1000) -> #VALUE! | Y57: =(RC[-14]-RC[1])/RC[-18]*100 -> #VALUE! | AC57: =VALUE(RC[-27]) -> #VALUE! | AD57: =IF(RC[21]=42,"*",IF(RC[21]=32,"",RC[21])) ->  | AE57: =RC[-28] ->  | AF57: =RC[-28] ->  | AG57: =RC[-28] ->  | AH57: =RC[-28] ->  | AI57: =RC[-28] ->  | AJ57: =RC[-28] ->  | AK57: =RC[-28] ->  | AL57: =RC[-28] -> 0 | AM57: =RC[-28] -> #VALUE! | AN57: =RC[-28] ->  | AO57: =RC[-28] ->  | AP57: - | AQ57: =RC[-29] -> 0 | AR57: =RC[-29] -> 0 | AS57: - | AT57: =RC[-30] -> 0 | AU57: =RC[-30] -> 0 | AV57: =RC[-30] ->  | AW57: =RC[-30] -> 
A58: =IF(RC[1]="","",DATEVALUE(RC[1])) ->  | K58: =RC[-7]-RC[-4] -> #VALUE! | T58: =(RC[-16]*RC[-15]-RC[-13]*RC[-12])/1000 -> #VALUE! | W58: =RC[-2]*RC[-10]/1000 -> #VALUE! | X58: =ABS((RC[-3]*RC[-11]-RC[-2]*RC[-9])/1000) -> #VALUE! | Y58: =(RC[-14]-RC[1])/RC[-18]*100 -> #VALUE! | AC58: =VALUE(RC[-27]) -> #VALUE! | AD58: =IF(RC[21]=42,"*",IF(RC[21]=32,"",RC[21])) ->  | AE58: =RC[-28] ->  | AF58: =RC[-28] ->  | AG58: =RC[-28] ->  | AH58: =RC[-28] ->  | AI58: =RC[-28] ->  | AJ58: =RC[-28] ->  | AK58: =RC[-28] ->  | AL58: =RC[-28] -> 0 | AM58: =RC[-28] -> #VALUE! | AN58: =RC[-28] ->  | AO58: =RC[-28] ->  | AP58: - | AQ58: =RC[-29] -> 0 | AR58: =RC[-29] -> 0 | AS58: - | AT58: =RC[-30] -> 0 | AU58: =RC[-30] -> 0 | AV58: =RC[-30] ->  | AW58: =RC[-30] -> 
A59: =IF(RC[1]="","",DATEVALUE(RC[1])) ->  | K59: =RC[-7]-RC[-4] -> #VALUE! | T59: =(RC[-16]*RC[-15]-RC[-13]*RC[-12])/1000 -> #VALUE! | W59: =RC[-2]*RC[-10]/1000 -> #VALUE! | X59: =ABS((RC[-3]*RC[-11]-RC[-2]*RC[-9])/1000) -> #VALUE! | Y59: =(RC[-14]-RC[1])/RC[-18]*100 -> #VALUE! | AC59: =VALUE(RC[-27]) -> #VALUE! | AD59: =IF(RC[21]=42,"*",IF(RC[21]=32,"",RC[21])) ->  | AE59: =RC[-28] ->  | AF59: =RC[-28] ->  | AG59: =RC[-28] ->  | AH59: =RC[-28] ->  | AI59: =RC[-28] ->  | AJ59: =RC[-28] ->  | AK59: =RC[-28] ->  | AL59: =RC[-28] -> 0 | AM59: =RC[-28] -> #VALUE! | AN59: =RC[-28] ->  | AO59: =RC[-28] ->  | AP59: - | AQ59: =RC[-29] -> 0 | AR59: =RC[-29] -> 0 | AS59: - | AT59: =RC[-30] -> 0 | AU59: =RC[-30] -> 0 | AV59: =RC[-30] ->  | AW59: =RC[-30] -> 
A60: =IF(RC[1]="","",DATEVALUE(RC[1])) ->  | K60: =RC[-7]-RC[-4] -> #VALUE! | T60: =(RC[-16]*RC[-15]-RC[-13]*RC[-12])/1000 -> #VALUE! | W60: =RC[-2]*RC[-10]/1000 -> #VALUE! | X60: =ABS((RC[-3]*RC[-11]-RC[-2]*RC[-9])/1000) -> #VALUE! | Y60: =(RC[-14]-RC[1])/RC[-18]*100 -> #VALUE! | AC60: =VALUE(RC[-27]) -> #VALUE! | AD60: =IF(RC[21]=42,"*",IF(RC[21]=32,"",RC[21])) ->  | AE60: =RC[-28] ->  | AF60: =RC[-28] ->  | AG60: =RC[-28] ->  | AH60: =RC[-28] ->  | AI60: =RC[-28] ->  | AJ60: =RC[-28] ->  | AK60: =RC[-28] ->  | AL60: =RC[-28] -> 0 | AM60: =RC[-28] -> #VALUE! | AN60: =RC[-28] ->  | AO60: =RC[-28] ->  | AP60: - | AQ60: =RC[-29] -> 0 | AR60: =RC[-29] -> 0 | AS60: - | AT60: =RC[-30] -> 0 | AU60: =RC[-30] -> 0 | AV60: =RC[-30] ->  | AW60: =RC[-30] -> 
A61: =IF(RC[1]="","",DATEVALUE(RC[1])) ->  | K61: =RC[-7]-RC[-4] -> #VALUE! | T61: =(RC[-16]*RC[-15]-RC[-13]*RC[-12])/1000 -> #VALUE! | W61: =RC[-2]*RC[-10]/1000 -> #VALUE! | X61: =ABS((RC[-3]*RC[-11]-RC[-2]*RC[-9])/1000) -> #VALUE! | Y61: =(RC[-14]-RC[1])/RC[-18]*100 -> #VALUE! | AC61: =VALUE(RC[-27]) -> #VALUE! | AD61: =IF(RC[21]=42,"*",IF(RC[21]=32,"",RC[21])) ->  | AE61: =RC[-28] ->  | AF61: =RC[-28] ->  | AG61: =RC[-28] ->  | AH61: =RC[-28] ->  | AI61: =RC[-28] ->  | AJ61: =RC[-28] ->  | AK61: =RC[-28] ->  | AL61: =RC[-28] -> 0 | AM61: =RC[-28] -> #VALUE! | AN61: =RC[-28] ->  | AO61: =RC[-28] ->  | AP61: - | AQ61: =RC[-29] -> 0 | AR61: =RC[-29] -> 0 | AS61: - | AT61: =RC[-30] -> 0 | AU61: =RC[-30] -> 0 | AV61: =RC[-30] ->  | AW61: =RC[-30] -> 
A62: =IF(RC[1]="","",DATEVALUE(RC[1])) ->  | K62: =RC[-7]-RC[-4] -> #VALUE! | T62: =(RC[-16]*RC[-15]-RC[-13]*RC[-12])/1000 -> #VALUE! | W62: =RC[-2]*RC[-10]/1000 -> #VALUE! | X62: =ABS((RC[-3]*RC[-11]-RC[-2]*RC[-9])/1000) -> #VALUE! | Y62: =(RC[-14]-RC[1])/RC[-18]*100 -> #VALUE! | AC62: =VALUE(RC[-27]) -> #VALUE! | AD62: =IF(RC[21]=42,"*",IF(RC[21]=32,"",RC[21])) ->  | AE62: =RC[-28] ->  | AF62: =RC[-28] ->  | AG62: =RC[-28] ->  | AH62: =RC[-28] ->  | AI62: =RC[-28] ->  | AJ62: =RC[-28] ->  | AK62: =RC[-28] ->  | AL62: =RC[-28] -> 0 | AM62: =RC[-28] -> #VALUE! | AN62: =RC[-28] ->  | AO62: =RC[-28] ->  | AP62: - | AQ62: =RC[-29] -> 0 | AR62: =RC[-29] -> 0 | AS62: - | AT62: =RC[-30] -> 0 | AU62: =RC[-30] -> 0 | AV62: =RC[-30] ->  | AW62: =RC[-30] -> 
A63: =IF(RC[1]="","",DATEVALUE(RC[1])) ->  | K63: =RC[-7]-RC[-4] -> #VALUE! | T63: =(RC[-16]*RC[-15]-RC[-13]*RC[-12])/1000 -> #VALUE! | W63: =RC[-2]*RC[-10]/1000 -> #VALUE! | X63: =ABS((RC[-3]*RC[-11]-RC[-2]*RC[-9])/1000) -> #VALUE! | Y63: =(RC[-14]-RC[1])/RC[-18]*100 -> #VALUE! | AC63: =VALUE(RC[-27]) -> #VALUE! | AD63: =IF(RC[21]=42,"*",IF(RC[21]=32,"",RC[21])) ->  | AE63: =RC[-28] ->  | AF63: =RC[-28] ->  | AG63: =RC[-28] ->  | AH63: =RC[-28] ->  | AI63: =RC[-28] ->  | AJ63: =RC[-28] ->  | AK63: =RC[-28] ->  | AL63: =RC[-28] -> 0 | AM63: =RC[-28] -> #VALUE! | AN63: =RC[-28] ->  | AO63: =RC[-28] ->  | AP63: - | AQ63: =RC[-29] -> 0 | AR63: =RC[-29] -> 0 | AS63: - | AT63: =RC[-30] -> 0 | AU63: =RC[-30] -> 0 | AV63: =RC[-30] ->  | AW63: =RC[-30] -> 
A64: =IF(RC[1]="","",DATEVALUE(RC[1])) ->  | K64: =RC[-7]-RC[-4] -> #VALUE! | T64: =(RC[-16]*RC[-15]-RC[-13]*RC[-12])/1000 -> #VALUE! | W64: =RC[-2]*RC[-10]/1000 -> #VALUE! | X64: =ABS((RC[-3]*RC[-11]-RC[-2]*RC[-9])/1000) -> #VALUE! | Y64: =(RC[-14]-RC[1])/RC[-18]*100 -> #VALUE! | AC64: =VALUE(RC[-27]) -> #VALUE! | AD64: =IF(RC[21]=42,"*",IF(RC[21]=32,"",RC[21])) ->  | AE64: =RC[-28] ->  | AF64: =RC[-28] ->  | AG64: =RC[-28] ->  | AH64: =RC[-28] ->  | AI64: =RC[-28] ->  | AJ64: =RC[-28] ->  | AK64: =RC[-28] ->  | AL64: =RC[-28] -> 0 | AM64: =RC[-28] -> #VALUE! | AN64: =RC[-28] ->  | AO64: =RC[-28] ->  | AP64: - | AQ64: =RC[-29] -> 0 | AR64: =RC[-29] -> 0 | AS64: - | AT64: =RC[-30] -> 0 | AU64: =RC[-30] -> 0 | AV64: =RC[-30] ->  | AW64: =RC[-30] -> 
A65: =IF(RC[1]="","",DATEVALUE(RC[1])) ->  | K65: =RC[-7]-RC[-4] -> #VALUE! | T65: =(RC[-16]*RC[-15]-RC[-13]*RC[-12])/1000 -> #VALUE! | W65: =RC[-2]*RC[-10]/1000 -> #VALUE! | X65: =ABS((RC[-3]*RC[-11]-RC[-2]*RC[-9])/1000) -> #VALUE! | Y65: =(RC[-14]-RC[1])/RC[-18]*100 -> #VALUE! | AC65: =VALUE(RC[-27]) -> #VALUE! | AD65: =IF(RC[21]=42,"*",IF(RC[21]=32,"",RC[21])) ->  | AE65: =RC[-28] ->  | AF65: =RC[-28] ->  | AG65: =RC[-28] ->  | AH65: =RC[-28] ->  | AI65: =RC[-28] ->  | AJ65: =RC[-28] ->  | AK65: =RC[-28] ->  | AL65: =RC[-28] -> 0 | AM65: =RC[-28] -> #VALUE! | AN65: =RC[-28] ->  | AO65: =RC[-28] ->  | AP65: - | AQ65: =RC[-29] -> 0 | AR65: =RC[-29] -> 0 | AS65: - | AT65: =RC[-30] -> 0 | AU65: =RC[-30] -> 0 | AV65: =RC[-30] ->  | AW65: =RC[-30] -> 
A66: =IF(RC[1]="","",DATEVALUE(RC[1])) ->  | K66: =RC[-7]-RC[-4] -> #VALUE! | T66: =(RC[-16]*RC[-15]-RC[-13]*RC[-12])/1000 -> #VALUE! | W66: =RC[-2]*RC[-10]/1000 -> #VALUE! | X66: =ABS((RC[-3]*RC[-11]-RC[-2]*RC[-9])/1000) -> #VALUE! | Y66: =(RC[-14]-RC[1])/RC[-18]*100 -> #VALUE! | AC66: =VALUE(RC[-27]) -> #VALUE! | AD66: =IF(RC[21]=42,"*",IF(RC[21]=32,"",RC[21])) ->  | AE66: =RC[-28] ->  | AF66: =RC[-28] ->  | AG66: =RC[-28] ->  | AH66: =RC[-28] ->  | AI66: =RC[-28] ->  | AJ66: =RC[-28] ->  | AK66: =RC[-28] ->  | AL66: =RC[-28] -> 0 | AM66: =RC[-28] -> #VALUE! | AN66: =RC[-28] ->  | AO66: =RC[-28] ->  | AP66: - | AQ66: =RC[-29] -> 0 | AR66: =RC[-29] -> 0 | AS66: - | AT66: =RC[-30] -> 0 | AU66: =RC[-30] -> 0 | AV66: =RC[-30] ->  | AW66: =RC[-30] -> 
A67: =IF(RC[1]="","",DATEVALUE(RC[1])) ->  | K67: =RC[-7]-RC[-4] -> #VALUE! | T67: =(RC[-16]*RC[-15]-RC[-13]*RC[-12])/1000 -> #VALUE! | W67: =RC[-2]*RC[-10]/1000 -> #VALUE! | X67: =ABS((RC[-3]*RC[-11]-RC[-2]*RC[-9])/1000) -> #VALUE! | Y67: =(RC[-14]-RC[1])/RC[-18]*100 -> #VALUE! | AC67: =VALUE(RC[-27]) -> #VALUE! | AD67: =IF(RC[21]=42,"*",IF(RC[21]=32,"",RC[21])) ->  | AE67: =RC[-28] ->  | AF67: =RC[-28] ->  | AG67: =RC[-28] ->  | AH67: =RC[-28] ->  | AI67: =RC[-28] ->  | AJ67: =RC[-28] ->  | AK67: =RC[-28] ->  | AL67: =RC[-28] -> 0 | AM67: =RC[-28] -> #VALUE! | AN67: =RC[-28] ->  | AO67: =RC[-28] ->  | AP67: - | AQ67: =RC[-29] -> 0 | AR67: =RC[-29] -> 0 | AS67: - | AT67: =RC[-30] -> 0 | AU67: =RC[-30] -> 0 | AV67: =RC[-30] ->  | AW67: =RC[-30] -> 
A68: =IF(RC[1]="","",DATEVALUE(RC[1])) ->  | K68: =RC[-7]-RC[-4] -> #VALUE! | T68: =(RC[-16]*RC[-15]-RC[-13]*RC[-12])/1000 -> #VALUE! | W68: =RC[-2]*RC[-10]/1000 -> #VALUE! | X68: =ABS((RC[-3]*RC[-11]-RC[-2]*RC[-9])/1000) -> #VALUE! | Y68: =(RC[-14]-RC[1])/RC[-18]*100 -> #VALUE! | AC68: =VALUE(RC[-27]) -> #VALUE! | AD68: =IF(RC[21]=42,"*",IF(RC[21]=32,"",RC[21])) ->  | AE68: =RC[-28] ->  | AF68: =RC[-28] ->  | AG68: =RC[-28] ->  | AH68: =RC[-28] ->  | AI68: =RC[-28] ->  | AJ68: =RC[-28] ->  | AK68: =RC[-28] ->  | AL68: =RC[-28] -> 0 | AM68: =RC[-28] -> #VALUE! | AN68: =RC[-28] ->  | AO68: =RC[-28] ->  | AP68: - | AQ68: =RC[-29] -> 0 | AR68: =RC[-29] -> 0 | AS68: - | AT68: =RC[-30] -> 0 | AU68: =RC[-30] -> 0 | AV68: =RC[-30] ->  | AW68: =RC[-30] -> 
A69: =IF(RC[1]="","",DATEVALUE(RC[1])) ->  | K69: =RC[-7]-RC[-4] -> #VALUE! | T69: =(RC[-16]*RC[-15]-RC[-13]*RC[-12])/1000 -> #VALUE! | W69: =RC[-2]*RC[-10]/1000 -> #VALUE! | X69: =ABS((RC[-3]*RC[-11]-RC[-2]*RC[-9])/1000) -> #VALUE! | Y69: =(RC[-14]-RC[1])/RC[-18]*100 -> #VALUE! | AC69: =VALUE(RC[-27]) -> #VALUE! | AD69: =IF(RC[21]=42,"*",IF(RC[21]=32,"",RC[21])) ->  | AE69: =RC[-28] ->  | AF69: =RC[-28] ->  | AG69: =RC[-28] ->  | AH69: =RC[-28] ->  | AI69: =RC[-28] ->  | AJ69: =RC[-28] ->  | AK69: =RC[-28] ->  | AL69: =RC[-28] -> 0 | AM69: =RC[-28] -> #VALUE! | AN69: =RC[-28] ->  | AO69: =RC[-28] ->  | AP69: - | AQ69: =RC[-29] -> 0 | AR69: =RC[-29] -> 0 | AS69: - | AT69: =RC[-30] -> 0 | AU69: =RC[-30] -> 0 | AV69: =RC[-30] ->  | AW69: =RC[-30] -> 
A70: =IF(RC[1]="","",DATEVALUE(RC[1])) ->  | K70: =RC[-7]-RC[-4] -> #VALUE! | T70: =(RC[-16]*RC[-15]-RC[-13]*RC[-12])/1000 -> #VALUE! | W70: =RC[-2]*RC[-10]/1000 -> #VALUE! | X70: =ABS((RC[-3]*RC[-11]-RC[-2]*RC[-9])/1000) -> #VALUE! | Y70: =(RC[-14]-RC[1])/RC[-18]*100 -> #VALUE! | AC70: =VALUE(RC[-27]) -> #VALUE! | AD70: =IF(RC[21]=42,"*",IF(RC[21]=32,"",RC[21])) ->  | AE70: =RC[-28] ->  | AF70: =RC[-28] ->  | AG70: =RC[-28] ->  | AH70: =RC[-28] ->  | AI70: =RC[-28] ->  | AJ70: =RC[-28] ->  | AK70: =RC[-28] ->  | AL70: =RC[-28] -> 0 | AM70: =RC[-28] -> #VALUE! | AN70: =RC[-28] ->  | AO70: =RC[-28] ->  | AP70: - | AQ70: =RC[-29] -> 0 | AR70: =RC[-29] -> 0 | AS70: - | AT70: =RC[-30] -> 0 | AU70: =RC[-30] -> 0 | AV70: =RC[-30] ->  | AW70: =RC[-30] -> 
A71: =IF(RC[1]="","",DATEVALUE(RC[1])) ->  | K71: =RC[-7]-RC[-4] -> #VALUE! | T71: =(RC[-16]*RC[-15]-RC[-13]*RC[-12])/1000 -> #VALUE! | W71: =RC[-2]*RC[-10]/1000 -> #VALUE! | X71: =ABS((RC[-3]*RC[-11]-RC[-2]*RC[-9])/1000) -> #VALUE! | Y71: =(RC[-14]-RC[1])/RC[-18]*100 -> #VALUE! | AC71: =VALUE(RC[-27]) -> #VALUE! | AD71: =IF(RC[21]=42,"*",IF(RC[21]=32,"",RC[21])) ->  | AE71: =RC[-28] ->  | AF71: =RC[-28] ->  | AG71: =RC[-28] ->  | AH71: =RC[-28] ->  | AI71: =RC[-28] ->  | AJ71: =RC[-28] ->  | AK71: =RC[-28] ->  | AL71: =RC[-28] -> 0 | AM71: =RC[-28] -> #VALUE! | AN71: =RC[-28] ->  | AO71: =RC[-28] ->  | AP71: - | AQ71: =RC[-29] -> 0 | AR71: =RC[-29] -> 0 | AS71: - | AT71: =RC[-30] -> 0 | AU71: =RC[-30] -> 0 | AV71: =RC[-30] ->  | AW71: =RC[-30] -> 
A72: =IF(RC[1]="","",DATEVALUE(RC[1])) ->  | K72: =RC[-7]-RC[-4] -> #VALUE! | T72: =(RC[-16]*RC[-15]-RC[-13]*RC[-12])/1000 -> #VALUE! | W72: =RC[-2]*RC[-10]/1000 -> #VALUE! | X72: =ABS((RC[-3]*RC[-11]-RC[-2]*RC[-9])/1000) -> #VALUE! | Y72: =(RC[-14]-RC[1])/RC[-18]*100 -> #VALUE! | AC72: =VALUE(RC[-27]) -> #VALUE! | AD72: =IF(RC[21]=42,"*",IF(RC[21]=32,"",RC[21])) ->  | AE72: =RC[-28] ->  | AF72: =RC[-28] ->  | AG72: =RC[-28] ->  | AH72: =RC[-28] ->  | AI72: =RC[-28] ->  | AJ72: =RC[-28] ->  | AK72: =RC[-28] ->  | AL72: =RC[-28] -> 0 | AM72: =RC[-28] -> #VALUE! | AN72: =RC[-28] ->  | AO72: =RC[-28] ->  | AP72: - | AQ72: =RC[-29] -> 0 | AR72: =RC[-29] -> 0 | AS72: - | AT72: =RC[-30] -> 0 | AU72: =RC[-30] -> 0 | AV72: =RC[-30] ->  | AW72: =RC[-30] -> 
A73: =IF(RC[1]="","",DATEVALUE(RC[1])) ->  | K73: =RC[-7]-RC[-4] -> #VALUE! | T73: =(RC[-16]*RC[-15]-RC[-13]*RC[-12])/1000 -> #VALUE! | W73: =RC[-2]*RC[-10]/1000 -> #VALUE! | X73: =ABS((RC[-3]*RC[-11]-RC[-2]*RC[-9])/1000) -> #VALUE! | Y73: =(RC[-14]-RC[1])/RC[-18]*100 -> #VALUE! | AC73: =VALUE(RC[-27]) -> #VALUE! | AD73: =IF(RC[21]=42,"*",IF(RC[21]=32,"",RC[21])) ->  | AE73: =RC[-28] ->  | AF73: =RC[-28] ->  | AG73: =RC[-28] ->  | AH73: =RC[-28] ->  | AI73: =RC[-28] ->  | AJ73: =RC[-28] ->  | AK73: =RC[-28] ->  | AL73: =RC[-28] -> 0 | AM73: =RC[-28] -> #VALUE! | AN73: =RC[-28] ->  | AO73: =RC[-28] ->  | AP73: - | AQ73: =RC[-29] -> 0 | AR73: =RC[-29] -> 0 | AS73: - | AT73: =RC[-30] -> 0 | AU73: =RC[-30] -> 0 | AV73: =RC[-30] ->  | AW73: =RC[-30] -> 
A74: =IF(RC[1]="","",DATEVALUE(RC[1])) ->  | K74: =RC[-7]-RC[-4] -> #VALUE! | T74: =(RC[-16]*RC[-15]-RC[-13]*RC[-12])/1000 -> #VALUE! | W74: =RC[-2]*RC[-10]/1000 -> #VALUE! | X74: =ABS((RC[-3]*RC[-11]-RC[-2]*RC[-9])/1000) -> #VALUE! | Y74: =(RC[-14]-RC[1])/RC[-18]*100 -> #VALUE! | AC74: =VALUE(RC[-27]) -> #VALUE! | AD74: =IF(RC[21]=42,"*",IF(RC[21]=32,"",RC[21])) ->  | AE74: =RC[-28] ->  | AF74: =RC[-28] ->  | AG74: =RC[-28] ->  | AH74: =RC[-28] ->  | AI74: =RC[-28] ->  | AJ74: =RC[-28] ->  | AK74: =RC[-28] ->  | AL74: =RC[-28] -> 0 | AM74: =RC[-28] -> #VALUE! | AN74: =RC[-28] ->  | AO74: =RC[-28] ->  | AP74: - | AQ74: =RC[-29] -> 0 | AR74: =RC[-29] -> 0 | AS74: - | AT74: =RC[-30] -> 0 | AU74: =RC[-30] -> 0 | AV74: =RC[-30] ->  | AW74: =RC[-30] -> 
A75: =IF(RC[1]="","",DATEVALUE(RC[1])) ->  | K75: =RC[-7]-RC[-4] -> #VALUE! | T75: =(RC[-16]*RC[-15]-RC[-13]*RC[-12])/1000 -> #VALUE! | W75: =RC[-2]*RC[-10]/1000 -> #VALUE! | X75: =ABS((RC[-3]*RC[-11]-RC[-2]*RC[-9])/1000) -> #VALUE! | Y75: =(RC[-14]-RC[1])/RC[-18]*100 -> #VALUE! | AC75: =VALUE(RC[-27]) -> #VALUE! | AD75: =IF(RC[21]=42,"*",IF(RC[21]=32,"",RC[21])) ->  | AE75: =RC[-28] ->  | AF75: =RC[-28] ->  | AG75: =RC[-28] ->  | AH75: =RC[-28] ->  | AI75: =RC[-28] ->  | AJ75: =RC[-28] ->  | AK75: =RC[-28] ->  | AL75: =RC[-28] -> 0 | AM75: =RC[-28] -> #VALUE! | AN75: =RC[-28] ->  | AO75: =RC[-28] ->  | AP75: - | AQ75: =RC[-29] -> 0 | AR75: =RC[-29] -> 0 | AS75: - | AT75: =RC[-30] -> 0 | AU75: =RC[-30] -> 0 | AV75: =RC[-30] ->  | AW75: =RC[-30] -> 
A76: =IF(RC[1]="","",DATEVALUE(RC[1])) ->  | K76: =RC[-7]-RC[-4] -> #VALUE! | T76: =(RC[-16]*RC[-15]-RC[-13]*RC[-12])/1000 -> #VALUE! | W76: =RC[-2]*RC[-10]/1000 -> #VALUE! | X76: =ABS((RC[-3]*RC[-11]-RC[-2]*RC[-9])/1000) -> #VALUE! | Y76: =(RC[-14]-RC[1])/RC[-18]*100 -> #VALUE! | AC76: =VALUE(RC[-27]) -> #VALUE! | AD76: =IF(RC[21]=42,"*",IF(RC[21]=32,"",RC[21])) ->  | AE76: =RC[-28] ->  | AF76: =RC[-28] ->  | AG76: =RC[-28] ->  | AH76: =RC[-28] ->  | AI76: =RC[-28] ->  | AJ76: =RC[-28] ->  | AK76: =RC[-28] ->  | AL76: =RC[-28] -> 0 | AM76: =RC[-28] -> #VALUE! | AN76: =RC[-28] ->  | AO76: =RC[-28] ->  | AP76: - | AQ76: =RC[-29] -> 0 | AR76: =RC[-29] -> 0 | AS76: - | AT76: =RC[-30] -> 0 | AU76: =RC[-30] -> 0 | AV76: =RC[-30] ->  | AW76: =RC[-30] -> 
A77: =IF(RC[1]="","",DATEVALUE(RC[1])) ->  | K77: =RC[-7]-RC[-4] -> #VALUE! | T77: =(RC[-16]*RC[-15]-RC[-13]*RC[-12])/1000 -> #VALUE! | W77: =RC[-2]*RC[-10]/1000 -> #VALUE! | X77: =ABS((RC[-3]*RC[-11]-RC[-2]*RC[-9])/1000) -> #VALUE! | Y77: =(RC[-14]-RC[1])/RC[-18]*100 -> #VALUE! | AC77: =VALUE(RC[-27]) -> #VALUE! | AD77: =IF(RC[21]=42,"*",IF(RC[21]=32,"",RC[21])) ->  | AE77: =RC[-28] ->  | AF77: =RC[-28] ->  | AG77: =RC[-28] ->  | AH77: =RC[-28] ->  | AI77: =RC[-28] ->  | AJ77: =RC[-28] ->  | AK77: =RC[-28] ->  | AL77: =RC[-28] -> 0 | AM77: =RC[-28] -> #VALUE! | AN77: =RC[-28] ->  | AO77: =RC[-28] ->  | AP77: - | AQ77: =RC[-29] -> 0 | AR77: =RC[-29] -> 0 | AS77: - | AT77: =RC[-30] -> 0 | AU77: =RC[-30] -> 0 | AV77: =RC[-30] ->  | AW77: =RC[-30] -> 
A78: =IF(RC[1]="","",DATEVALUE(RC[1])) ->  | K78: =RC[-7]-RC[-4] -> #VALUE! | T78: =(RC[-16]*RC[-15]-RC[-13]*RC[-12])/1000 -> #VALUE! | W78: =RC[-2]*RC[-10]/1000 -> #VALUE! | X78: =ABS((RC[-3]*RC[-11]-RC[-2]*RC[-9])/1000) -> #VALUE! | Y78: =(RC[-14]-RC[1])/RC[-18]*100 -> #VALUE! | AC78: =VALUE(RC[-27]) -> #VALUE! | AD78: =IF(RC[21]=42,"*",IF(RC[21]=32,"",RC[21])) ->  | AE78: =RC[-28] ->  | AF78: =RC[-28] ->  | AG78: =RC[-28] ->  | AH78: =RC[-28] ->  | AI78: =RC[-28] ->  | AJ78: =RC[-28] ->  | AK78: =RC[-28] ->  | AL78: =RC[-28] -> 0 | AM78: =RC[-28] -> #VALUE! | AN78: =RC[-28] ->  | AO78: =RC[-28] ->  | AP78: - | AQ78: =RC[-29] -> 0 | AR78: =RC[-29] -> 0 | AS78: - | AT78: =RC[-30] -> 0 | AU78: =RC[-30] -> 0 | AV78: =RC[-30] ->  | AW78: =RC[-30] -> 
A79: =IF(RC[1]="","",DATEVALUE(RC[1])) ->  | K79: =RC[-7]-RC[-4] -> #VALUE! | T79: =(RC[-16]*RC[-15]-RC[-13]*RC[-12])/1000 -> #VALUE! | W79: =RC[-2]*RC[-10]/1000 -> #VALUE! | X79: =ABS((RC[-3]*RC[-11]-RC[-2]*RC[-9])/1000) -> #VALUE! | Y79: =(RC[-14]-RC[1])/RC[-18]*100 -> #VALUE! | AC79: =VALUE(RC[-27]) -> #VALUE! | AD79: =IF(RC[21]=42,"*",IF(RC[21]=32,"",RC[21])) ->  | AE79: =RC[-28] ->  | AF79: =RC[-28] ->  | AG79: =RC[-28] ->  | AH79: =RC[-28] ->  | AI79: =RC[-28] ->  | AJ79: =RC[-28] ->  | AK79: =RC[-28] ->  | AL79: =RC[-28] -> 0 | AM79: =RC[-28] -> #VALUE! | AN79: =RC[-28] ->  | AO79: =RC[-28] ->  | AP79: - | AQ79: =RC[-29] -> 0 | AR79: =RC[-29] -> 0 | AS79: - | AT79: =RC[-30] -> 0 | AU79: =RC[-30] -> 0 | AV79: =RC[-30] ->  | AW79: =RC[-30] -> 
A80: =IF(RC[1]="","",DATEVALUE(RC[1])) ->  | K80: =RC[-7]-RC[-4] -> #VALUE! | T80: =(RC[-16]*RC[-15]-RC[-13]*RC[-12])/1000 -> #VALUE! | W80: =RC[-2]*RC[-10]/1000 -> #VALUE! | X80: =ABS((RC[-3]*RC[-11]-RC[-2]*RC[-9])/1000) -> #VALUE! | Y80: =(RC[-14]-RC[1])/RC[-18]*100 -> #VALUE! | AC80: =VALUE(RC[-27]) -> #VALUE! | AD80: =IF(RC[21]=42,"*",IF(RC[21]=32,"",RC[21])) ->  | AE80: =RC[-28] ->  | AF80: =RC[-28] ->  | AG80: =RC[-28] ->  | AH80: =RC[-28] ->  | AI80: =RC[-28] ->  | AJ80: =RC[-28] ->  | AK80: =RC[-28] ->  | AL80: =RC[-28] -> 0 | AM80: =RC[-28] -> #VALUE! | AN80: =RC[-28] ->  | AO80: =RC[-28] ->  | AP80: - | AQ80: =RC[-29] -> 0 | AR80: =RC[-29] -> 0 | AS80: - | AT80: =RC[-30] -> 0 | AU80: =RC[-30] -> 0 | AV80: =RC[-30] ->  | AW80: =RC[-30] -> 
A81: =IF(RC[1]="","",DATEVALUE(RC[1])) ->  | K81: =RC[-7]-RC[-4] -> #VALUE! | T81: =(RC[-16]*RC[-15]-RC[-13]*RC[-12])/1000 -> #VALUE! | W81: =RC[-2]*RC[-10]/1000 -> #VALUE! | X81: =ABS((RC[-3]*RC[-11]-RC[-2]*RC[-9])/1000) -> #VALUE! | Y81: =(RC[-14]-RC[1])/RC[-18]*100 -> #VALUE! | AC81: =VALUE(RC[-27]) -> #VALUE! | AD81: =IF(RC[21]=42,"*",IF(RC[21]=32,"",RC[21])) ->  | AE81: =RC[-28] ->  | AF81: =RC[-28] ->  | AG81: =RC[-28] ->  | AH81: =RC[-28] ->  | AI81: =RC[-28] ->  | AJ81: =RC[-28] ->  | AK81: =RC[-28] ->  | AL81: =RC[-28] -> 0 | AM81: =RC[-28] -> #VALUE! | AN81: =RC[-28] ->  | AO81: =RC[-28] ->  | AP81: - | AQ81: =RC[-29] -> 0 | AR81: =RC[-29] -> 0 | AS81: - | AT81: =RC[-30] -> 0 | AU81: =RC[-30] -> 0 | AV81: =RC[-30] ->  | AW81: =RC[-30] -> 
A82: =IF(RC[1]="","",DATEVALUE(RC[1])) ->  | K82: =RC[-7]-RC[-4] -> #VALUE! | T82: =(RC[-16]*RC[-15]-RC[-13]*RC[-12])/1000 -> #VALUE! | W82: =RC[-2]*RC[-10]/1000 -> #VALUE! | X82: =ABS((RC[-3]*RC[-11]-RC[-2]*RC[-9])/1000) -> #VALUE! | Y82: =(RC[-14]-RC[1])/RC[-18]*100 -> #VALUE! | AC82: =VALUE(RC[-27]) -> #VALUE! | AD82: =IF(RC[21]=42,"*",IF(RC[21]=32,"",RC[21])) ->  | AE82: =RC[-28] ->  | AF82: =RC[-28] ->  | AG82: =RC[-28] ->  | AH82: =RC[-28] ->  | AI82: =RC[-28] ->  | AJ82: =RC[-28] ->  | AK82: =RC[-28] ->  | AL82: =RC[-28] -> 0 | AM82: =RC[-28] -> #VALUE! | AN82: =RC[-28] ->  | AO82: =RC[-28] ->  | AP82: - | AQ82: =RC[-29] -> 0 | AR82: =RC[-29] -> 0 | AS82: - | AT82: =RC[-30] -> 0 | AU82: =RC[-30] -> 0 | AV82: =RC[-30] ->  | AW82: =RC[-30] -> 
A83: =IF(RC[1]="","",DATEVALUE(RC[1])) ->  | K83: =RC[-7]-RC[-4] -> #VALUE! | T83: =(RC[-16]*RC[-15]-RC[-13]*RC[-12])/1000 -> #VALUE! | W83: =RC[-2]*RC[-10]/1000 -> #VALUE! | X83: =ABS((RC[-3]*RC[-11]-RC[-2]*RC[-9])/1000) -> #VALUE! | Y83: =(RC[-14]-RC[1])/RC[-18]*100 -> #VALUE! | AC83: =VALUE(RC[-27]) -> #VALUE! | AD83: =IF(RC[21]=42,"*",IF(RC[21]=32,"",RC[21])) ->  | AE83: =RC[-28] ->  | AF83: =RC[-28] ->  | AG83: =RC[-28] ->  | AH83: =RC[-28] ->  | AI83: =RC[-28] ->  | AJ83: =RC[-28] ->  | AK83: =RC[-28] ->  | AL83: =RC[-28] -> 0 | AM83: =RC[-28] -> #VALUE! | AN83: =RC[-28] ->  | AO83: =RC[-28] ->  | AP83: - | AQ83: =RC[-29] -> 0 | AR83: =RC[-29] -> 0 | AS83: - | AT83: =RC[-30] -> 0 | AU83: =RC[-30] -> 0 | AV83: =RC[-30] ->  | AW83: =RC[-30] -> 
AC84: Среднее | AF84: =R[1]C[-28] -> 158.45733333333337 | AG84: =R[1]C[-28] -> 68.758666666666656 | AH84: =R[1]C[-28] -> 8.577 | AI84: =R[1]C[-28] -> 147.08199999999999 | AJ84: =R[1]C[-28] -> 44.322333333333333 | AK84: =R[1]C[-28] -> 6.9033333333333351 | AL84: =R[1]C[-28] -> 24.436333333333334 | AM84: =R[1]C[-28] -> 11.375333333333336 | AN84: =R[1]C[-28] -> 13.931222222222223 | AO84: =R[1]C[-28] -> 68.397333333333336 | AP84: - | AQ84: =R[1]C[-29] -> 0 | AR84: =R[1]C[-29] -> 0 | AS84: - | AT84: =R[1]C[-30] -> 0 | AU84: =R[1]C[-30] -> 0
B85: Среднее | D85: =AVERAGE(OFFSET(R[-74]C,3,0,R7C1,1)) -> 158.45733333333337 | E85: =AVERAGE(OFFSET(R[-74]C,3,0,R7C1,1)) -> 68.758666666666656 | F85: =AVERAGE(OFFSET(R[-74]C,3,0,R7C1,1)) -> 8.577 | G85: =AVERAGE(OFFSET(R[-74]C,3,0,R7C1,1)) -> 147.08199999999999 | H85: =AVERAGE(OFFSET(R[-74]C,3,0,R7C1,1)) -> 44.322333333333333 | I85: =AVERAGE(OFFSET(R[-74]C,3,0,R7C1,1)) -> 6.9033333333333351 | J85: =AVERAGE(OFFSET(R[-74]C,3,0,R7C1,1)) -> 24.436333333333334 | K85: =AVERAGE(OFFSET(R[-74]C,3,0,R7C1,1)) -> 11.375333333333336 | L85: =IF(SUM(OFFSET(R[-74]C,3,0,R7C1,1))=0,"",AVERAGE(OFFSET(R[-74]C,3,0,R7C1,1))) -> 13.931222222222223 | M85: =IF(SUM(OFFSET(R[-74]C,3,0,R7C1,1))=0,"",AVERAGE(OFFSET(R[-74]C,3,0,R7C1,1))) -> 68.397333333333336 | R85: =IF(SUM(OFFSET(R[-74]C,3,0,R7C1,1))=0,"",AVERAGE(OFFSET(R[-74]C,3,0,R7C1,1))) -> 0.93294144888888886 | S85: =AVERAGE(OFFSET(R[-74]C,3,0,R7C1,1)) -> 4.1665414488888883 | T85: =AVERAGE(OFFSET(R[-74]C,3,0,R7C1,1)) -> 4.1608876600000002 | W85: =AVERAGE(OFFSET(R[-74]C,3,0,R7C1,1)) -> 0.93303733888888907 | X85: =AVERAGE(OFFSET(R[-74]C,3,0,R7C1,1)) -> #VALUE! | AC85: Итого | AE85: =R[1]C[-28] -> 720 | AF85: =R[1]C[-28] -> 4753.7200000000012 | AI85: =R[1]C[-28] -> 4412.46 | AM85: =R[1]C[-28] -> 341.26000000000005 | AN85: =R[1]C[-28] -> 417.93666666666667 | AQ85: =R[1]C[-29] -> 0 | AU85: =R[1]C[-30] -> 0 | AV85: =R[1]C[-30] -> 27.988243466666667 | AW85: =R[1]C[-30] -> 124.99624346666666
B86: ИТОГО: | C86: =SUM(OFFSET(R[-75]C,3,0,R7C1,1)) -> 720 | D86: =SUM(OFFSET(R[-75]C,3,0,R7C1,1)) -> 4753.7200000000012 | G86: =SUM(OFFSET(R[-75]C,3,0,R7C1,1)) -> 4412.46 | K86: =SUM(OFFSET(R[-75]C,3,0,R7C1,1)) -> 341.26000000000005 | L86: =IF(SUM(OFFSET(R[-75]C,3,0,R7C1,1))=0,"",SUM(OFFSET(R[-75]C,3,0,R7C1,1))) -> 417.93666666666667 | R86: =IF(SUM(OFFSET(R[-75]C,3,0,R7C1,1))=0,"",SUM(OFFSET(R[-75]C,3,0,R7C1,1))) -> 27.988243466666667 | S86: =SUM(OFFSET(R[-75]C,3,0,R7C1,1)) -> 124.99624346666666 | T86: =SUM(OFFSET(R[-75]C,3,0,R7C1,1)) -> 124.82662980000001 | W86: =SUM(OFFSET(R[-75]C,3,0,R7C1,1)) -> 27.991120166666672 | X86: =SUM(OFFSET(R[-75]C,3,0,R7C1,1)) -> #VALUE!
AC87: Досчёт | AF87: =R[1]C[-28] -> 0 | AI87: =R[1]C[-28] -> 0 | AM87: =R[1]C[-28] -> 0 | AN87: =R[1]C[-28] -> 0 | AQ87: =R[1]C[-29] -> 0 | AU87: =R[1]C[-30] -> 0 | AV87: =R[1]C[-30] -> 0 | AW87: =R[1]C[-30] -> 0
A88: 11дн=264ч 4дн=96ч | B88: Досчёт до конца м-ца (+) | C88: =R6C1*24 -> 216 | T88: № 49531 | AC88: Снятие | AF88: =-R[1]C[-28] -> 0 | AI88: =-R[1]C[-28] -> 0 | AM88: =-R[1]C[-28] -> 0 | AN88: =-R[1]C[-28] -> 0 | AQ88: =-R[1]C[-29] -> 0 | AU88: =-R[1]C[-30] -> 0 | AV88: =-R[1]C[-30] -> 0 | AW88: =-R[1]C[-30] -> 0
A89: 9дн=216ч 7дн=168ч | B89: Вычет с предыдущего (-) | C89: =R4C1*24 -> 192 | AC89: Сумма | AF89: =R[1]C[-28] -> 4753.7200000000012 | AI89: =R[1]C[-28] -> 4412.46 | AM89: =R[1]C[-28] -> 341.26000000000005 | AN89: =R[1]C[-28] -> 417.93666666666667 | AQ89: =R[1]C[-29] -> 0 | AU89: =R[1]C[-30] -> 0 | AV89: =R[1]C[-30] -> 27.988243466666667 | AW89: =R[1]C[-30] -> 124.99624346666666
B90: СУММА: | C90: =R[-4]C+R[-2]C-R[-1]C -> 744 | D90: =R[-4]C+R[-2]C-R[-1]C -> 4753.7200000000012 | G90: =R[-4]C+R[-2]C-R[-1]C -> 4412.46 | K90: =R[-4]C+R[-2]C-R[-1]C -> 341.26000000000005 | L90: =IF(SUM(OFFSET(R[-79]C,3,0,R7C1,1))=0,"",(R[-4]C+R[-2]C-R[-1]C)) -> 417.93666666666667 | R90: =IF(SUM(OFFSET(R[-79]C,3,0,R7C1,1))=0,"",(R[-4]C+R[-2]C-R[-1]C)) -> 27.988243466666667 | S90: =R[-4]C+R[-2]C-R[-1]C -> 124.99624346666666
AC91: Тхв на источнике | AE91: V гвс (м3) | AF91: =R[-2]C[15] -> 0 | AG91: W гвс (Гкал) | AH91: =RC[-2]*0.06 -> 0 | AI91: W без гвс (Гкал) | AJ91: =R[-2]C[13]-RC[-2] -> 124.99624346666666
B92: Показания счетчиков на момент снятия данных:
B93: Дата, время | D93: М1, т | F93: М2, т | H93: М3, т | J93: М4, т | L93: Qо, Гкал | N93: Qг, Гкал | P93: время, час
B94: 23.09.18 02:00 | D94: 197275.17 | F94: 184876.08 | H94: 17482.98 | J94: - | L94: 4262.4489999999996 | N94: 1255.855 | P94: -
B95: 18.10.18 08:00 | D95: 201221.88 | F95: 188532.25 | H95: 17836.8 | J95: - | L95: 4366.9040000000005 | N95: 1279.921 | P95: -
AC97: =ZAYAVKA_N -> з.н д. №02/147-2783 от 04.10.18 24.09.18г некорректная работа приборов
B98: Представитель потребителя:_______________________________________________________________________ В.О. Топорков
I101: Рекомендуемые значения по параметрам теплопотребления (не являются официально утверждёнными)
I102: М, т | J102: V, м3 | K102: Qгвс, Гкал | L102: Qотоп, Гкал | M102: Qо, Гкал
I103: =R[-13]C[-3] -> 0 | J103: =RC[-1]/0.98 -> 0 | K103: =RC[-1]*0.06 -> 0 | L103: =RC[1]-RC[-1] -> 27.988243466666667 | M103: =R[-13]C[5] -> 27.988243466666667
O105: ДЛЯ САМОКОНТРОЛЯ
B106: В строке выбора дат указать период с 16.7.13 по 23.8.13 - жильё | N106: Q | O106: Qг
B107: В строке выбора дат указать период с 18.7.13 по 25.8.13 - не жилое | N107: =(R[-21]C[-10]*R[-22]C[-7]-R[-21]C[-9]*R[-22]C[-6])/1000 -> 699.18664504000014 | O107: =IF(R[-22]C[-2]="",R[-21]C[-3]*R[-22]C/1000,"") ->  | P107: Си2
O108: =IF(R[-23]C[-2]="","",((R[-22]C[-3]*R[-23]C)-(R[-22]C[-2]*R[-23]C[2]))/1000) -> 0 | P108: Си3