Sheet: Лист1
G1: Отчёт о теплопотреблении за октябрь 2018 | M1: з.н д. №02/147-2783 от 04.10.18
A4: =EOMONTH(R[9]C,0)-R[9]C -> 8 | B4: Потребитель: ЗАО "Сити Сервис"
A5: =MAX(R[9]C:R[78]C) -> 2018-10-22T00:00:00.000 | B5: Адрес: г. СПб, Каховского пер., д.5 лит.Б ЦО
A6: =EOMONTH(R[-1]C,0)-R[-1]C -> 9 | B6: Телефон: 8-911-021-19-79
A7: =R[-2]C-R[6]C -> 30 | B7: Договор 10023-6 (.) 304, 309, 313
A8: 7 | B8: Тепловычислитель: СПТ-943 № 03013 | L8: М2 мах= | M8: 185.28 | O8: Мгвс мах= | P8: 0
L9: Qотоп мах= | M9: 14.88 | O9: Qгвс мах= | P9: 0
B10: Расчётная формула: Q=M1*(h1-hхв)-M2*(h2-hхв)
D12: Учет | L12: Контроль
A13: =R[1]C[1]-1 -> 2018-09-22T00:00:00.000 | B13: Дата | C13: N, ч | D13: M1, т | E13: T1, С | F13: P1, кг/см2 | G13: M2, т | H13: T2, С | I13: P2, кг/см2 | J13: dT, С | K13: M1-М2, т | L13: V3, м3 | M13: T3, С | N13: V4, м3 | O13: =IF(R[-12]C[-14]="м.куб","","T4, С") -> T4, С | P13: dT, С | Q13: V3-V4, м3 | R13: Qгвс, Гкал | S13: Qобщ., Гкал | T13: Q | U13: M3 | V13: M4 | W13: си2 | X13: си3 | Y13: Разб. | Z13: dM2 | AC13: Дата | AD13: НС | AE13: n, ч | AF13: М1, т | AG13: t1, гр. С | AH13: Р1, кгс/см2 | AI13: М2, т | AJ13: t2, гр. С | AK13: Р2, кгс/см2 | AL13: t1-t2, гр. С | AM13: М1-М2, т | AN13: М1гвс, т | AO13: t1гвс, гр. С | AP13: Р1гвс, кгс/см2 | AQ13: М2гвс, т | AR13: t2гвс, гр. С | AS13: Р2гвс, кгс/см2 | AT13: t1гвс-t2гвс | AU13: М1гвс-М2гвс, т | AV13: Wгвс, Гкал | AW13: Wсумм, Гкал | AY13: NS_TV1 | AZ13: НС | BA13: NS_TV2
A14: =IF(RC[1]="","",DATEVALUE(RC[1])) -> 43366 | B14: 23.09.18 | C14: 24 | D14: 0 | E14: 15.836601 | F14: 6.5 | G14: 0 | H14: 15.475731 | I14: 4.4000000000000004 | J14: =RC[-5]-RC[-2] -> 0.36087000000000025 | K14: =RC[-7]-RC[-4] -> 0 | S14: =RC[1] -> 0 | T14: =(RC[-16]*RC[-15]-RC[-13]*RC[-12])/1000 -> 0 | U14: - | V14: - | W14: =RC[-2]*RC[-10]/1000 -> #VALUE! | X14: =ABS((RC[-3]*RC[-11]-RC[-2]*RC[-9])/1000) -> #VALUE! | Y14: =RC[-14]/RC[-18]*100 -> #DIV/0! | Z14: - | AC14: =VALUE(RC[-27]) -> 2018-09-23T00:00:00.000 | AD14: =IF(RC[21]=42,"*",IF(RC[21]=32,"",RC[21])) -> - | AE14: =RC[-28] -> 24 | AF14: =RC[-28] -> 0 | AG14: =RC[-28] -> 15.836601 | AH14: =RC[-28] -> 6.5 | AI14: =RC[-28] -> 0 | AJ14: =RC[-28] -> 15.475731 | AK14: =RC[-28] -> 4.4000000000000004 | AL14: =RC[-28] -> 0.36087000000000025 | AM14: =RC[-28] -> 0 | AN14: =RC[-28] -> 0 | AO14: =RC[-28] -> 0 | AP14: - | AQ14: =RC[-29] -> 0 | AR14: =RC[-29] -> 0 | AS14: - | AT14: =RC[-30] -> 0 | AU14: =RC[-30] -> 0 | AV14: =RC[-30] -> 0 | AW14: =RC[-30] -> 0 | AY14: - | AZ14: * | BA14: -
A15: =IF(RC[1]="","",DATEVALUE(RC[1])) -> 43367 | B15: 24.09.18 | C15: 24 | D15: 0 | E15: 14.977791 | F15: 6.5 | G15: 0 | H15: 14.725243000000001 | I15: 4.4000000000000004 | J15: =RC[-5]-RC[-2] -> 0.25254799999999911 | K15: =RC[-7]-RC[-4] -> 0 | S15: =RC[1] -> 0 | T15: =(RC[-16]*RC[-15]-RC[-13]*RC[-12])/1000 -> 0 | U15: - | V15: - | W15: =RC[-2]*RC[-10]/1000 -> #VALUE! | X15: =ABS((RC[-3]*RC[-11]-RC[-2]*RC[-9])/1000) -> #VALUE! | Y15: =RC[-14]/RC[-18]*100 -> #DIV/0! | Z15: - | AC15: =VALUE(RC[-27]) -> 2018-09-24T00:00:00.000 | AD15: =IF(RC[21]=42,"*",IF(RC[21]=32,"",RC[21])) -> - | AE15: =RC[-28] -> 24 | AF15: =RC[-28] -> 0 | AG15: =RC[-28] -> 14.977791 | AH15: =RC[-28] -> 6.5 | AI15: =RC[-28] -> 0 | AJ15: =RC[-28] -> 14.725243000000001 | AK15: =RC[-28] -> 4.4000000000000004 | AL15: =RC[-28] -> 0.25254799999999911 | AM15: =RC[-28] -> 0 | AN15: =RC[-28] -> 0 | AO15: =RC[-28] -> 0 | AP15: - | AQ15: =RC[-29] -> 0 | AR15: =RC[-29] -> 0 | AS15: - | AT15: =RC[-30] -> 0 | AU15: =RC[-30] -> 0 | AV15: =RC[-30] -> 0 | AW15: =RC[-30] -> 0 | AY15: - | AZ15: * | BA15: -
A16: =IF(RC[1]="","",DATEVALUE(RC[1])) -> 43368 | B16: 25.09.18 | C16: 24 | D16: 102.600334 | E16: 66.486000000000004 | F16: 6.5 | G16: 100.850739 | H16: 66.851478999999998 | I16: 4.4000000000000004 | J16: =RC[-5]-RC[-2] -> -0.36547899999999345 | K16: =RC[-7]-RC[-4] -> 1.7495949999999993 | S16: =RC[1] -> 7.9464745931019931E-2 | T16: =(RC[-16]*RC[-15]-RC[-13]*RC[-12])/1000 -> 7.9464745931019931E-2 | U16: - | V16: - | W16: =RC[-2]*RC[-10]/1000 -> #VALUE! | X16: =ABS((RC[-3]*RC[-11]-RC[-2]*RC[-9])/1000) -> #VALUE! | Y16: =RC[-14]/RC[-18]*100 -> 1.7348360729414183 | Z16: - | AC16: =VALUE(RC[-27]) -> 2018-09-25T00:00:00.000 | AD16: =IF(RC[21]=42,"*",IF(RC[21]=32,"",RC[21])) -> - | AE16: =RC[-28] -> 24 | AF16: =RC[-28] -> 102.600334 | AG16: =RC[-28] -> 66.486000000000004 | AH16: =RC[-28] -> 6.5 | AI16: =RC[-28] -> 100.850739 | AJ16: =RC[-28] -> 66.851478999999998 | AK16: =RC[-28] -> 4.4000000000000004 | AL16: =RC[-28] -> -0.36547899999999345 | AM16: =RC[-28] -> 1.7495949999999993 | AN16: =RC[-28] -> 0 | AO16: =RC[-28] -> 0 | AP16: - | AQ16: =RC[-29] -> 0 | AR16: =RC[-29] -> 0 | AS16: - | AT16: =RC[-30] -> 0 | AU16: =RC[-30] -> 0 | AV16: =RC[-30] -> 0 | AW16: =RC[-30] -> 7.9464745931019931E-2 | AY16: - | AZ16: * | BA16: -
A17: =IF(RC[1]="","",DATEVALUE(RC[1])) -> 43369 | B17: 26.09.18 | C17: 24 | D17: 169.12088 | E17: 67.014824000000004 | F17: 6.5 | G17: 166.05990600000001 | H17: 67.363167000000004 | I17: 4.4000000000000004 | J17: =RC[-5]-RC[-2] -> -0.34834299999999985 | K17: =RC[-7]-RC[-4] -> 3.0609739999999874 | S17: =RC[1] -> 0.14728482804281703 | T17: =(RC[-16]*RC[-15]-RC[-13]*RC[-12])/1000 -> 0.14728482804281703 | U17: - | V17: - | W17: =RC[-2]*RC[-10]/1000 -> #VALUE! | X17: =ABS((RC[-3]*RC[-11]-RC[-2]*RC[-9])/1000) -> #VALUE! | Y17: =RC[-14]/RC[-18]*100 -> 1.8432950335404787 | Z17: - | AC17: =VALUE(RC[-27]) -> 2018-09-26T00:00:00.000 | AD17: =IF(RC[21]=42,"*",IF(RC[21]=32,"",RC[21])) -> - | AE17: =RC[-28] -> 24 | AF17: =RC[-28] -> 169.12088 | AG17: =RC[-28] -> 67.014824000000004 | AH17: =RC[-28] -> 6.5 | AI17: =RC[-28] -> 166.05990600000001 | AJ17: =RC[-28] -> 67.363167000000004 | AK17: =RC[-28] -> 4.4000000000000004 | AL17: =RC[-28] -> -0.34834299999999985 | AM17: =RC[-28] -> 3.0609739999999874 | AN17: =RC[-28] -> 0 | AO17: =RC[-28] -> 0 | AP17: - | AQ17: =RC[-29] -> 0 | AR17: =RC[-29] -> 0 | AS17: - | AT17: =RC[-30] -> 0 | AU17: =RC[-30] -> 0 | AV17: =RC[-30] -> 0 | AW17: =RC[-30] -> 0.14728482804281703 | AY17: - | AZ17: * | BA17: -
A18: =IF(RC[1]="","",DATEVALUE(RC[1])) -> 43370 | B18: 27.09.18 | C18: 24 | D18: 158.27099999999999 | E18: 62.483204000000001 | F18: 6.5 | G18: 157.39065600000001 | H18: 56.117088000000003 | I18: 4.4000000000000004 | J18: =RC[-5]-RC[-2] -> 6.3661159999999981 | K18: =RC[-7]-RC[-4] -> 0.88034399999997959 | S18: =RC[1] -> 1.0569738871542704 | T18: =(RC[-16]*RC[-15]-RC[-13]*RC[-12])/1000 -> 1.0569738871542704 | U18: - | V18: - | W18: =RC[-2]*RC[-10]/1000 -> #VALUE! | X18: =ABS((RC[-3]*RC[-11]-RC[-2]*RC[-9])/1000) -> #VALUE! | Y18: =RC[-14]/RC[-18]*100 -> 0.55933688973250073 | Z18: - | AC18: =VALUE(RC[-27]) -> 2018-09-27T00:00:00.000 | AD18: =IF(RC[21]=42,"*",IF(RC[21]=32,"",RC[21])) -> - | AE18: =RC[-28] -> 24 | AF18: =RC[-28] -> 158.27099999999999 | AG18: =RC[-28] -> 62.483204000000001 | AH18: =RC[-28] -> 6.5 | AI18: =RC[-28] -> 157.39065600000001 | AJ18: =RC[-28] -> 56.117088000000003 | AK18: =RC[-28] -> 4.4000000000000004 | AL18: =RC[-28] -> 6.3661159999999981 | AM18: =RC[-28] -> 0.88034399999997959 | AN18: =RC[-28] -> 0 | AO18: =RC[-28] -> 0 | AP18: - | AQ18: =RC[-29] -> 0 | AR18: =RC[-29] -> 0 | AS18: - | AT18: =RC[-30] -> 0 | AU18: =RC[-30] -> 0 | AV18: =RC[-30] -> 0 | AW18: =RC[-30] -> 1.0569738871542704 | AY18: - | AZ18: * | BA18: -
A19: =IF(RC[1]="","",DATEVALUE(RC[1])) -> 43371 | B19: 28.09.18 | C19: 24 | D19: 151.95541399999999 | E19: 66.683967999999993 | F19: 6.5 | G19: 152.05076600000001 | H19: 48.519714 | I19: 4.4000000000000004 | J19: =RC[-5]-RC[-2] -> 18.164253999999993 | K19: =RC[-7]-RC[-4] -> -9.5352000000019643E-2 | S19: =RC[1] -> 2.7555302848018255 | T19: =(RC[-16]*RC[-15]-RC[-13]*RC[-12])/1000 -> 2.7555302848018255 | U19: - | V19: - | W19: =RC[-2]*RC[-10]/1000 -> #VALUE! | X19: =ABS((RC[-3]*RC[-11]-RC[-2]*RC[-9])/1000) -> #VALUE! | Y19: =RC[-14]/RC[-18]*100 -> -6.2710634420624786E-2 | Z19: - | AC19: =VALUE(RC[-27]) -> 2018-09-28T00:00:00.000 | AD19: =IF(RC[21]=42,"*",IF(RC[21]=32,"",RC[21])) -> - | AE19: =RC[-28] -> 24 | AF19: =RC[-28] -> 151.95541399999999 | AG19: =RC[-28] -> 66.683967999999993 | AH19: =RC[-28] -> 6.5 | AI19: =RC[-28] -> 152.05076600000001 | AJ19: =RC[-28] -> 48.519714 | AK19: =RC[-28] -> 4.4000000000000004 | AL19: =RC[-28] -> 18.164253999999993 | AM19: =RC[-28] -> -9.5352000000019643E-2 | AN19: =RC[-28] -> 0 | AO19: =RC[-28] -> 0 | AP19: - | AQ19: =RC[-29] -> 0 | AR19: =RC[-29] -> 0 | AS19: - | AT19: =RC[-30] -> 0 | AU19: =RC[-30] -> 0 | AV19: =RC[-30] -> 0 | AW19: =RC[-30] -> 2.7555302848018255 | AY19: - | AZ19: * | BA19: -
A20: =IF(RC[1]="","",DATEVALUE(RC[1])) -> 43372 | B20: 29.09.18 | C20: 24 | D20: 149.020096 | E20: 66.678794999999994 | F20: 6.5 | G20: 148.996567 | H20: 48.687927000000002 | I20: 4.4000000000000004 | J20: =RC[-5]-RC[-2] -> 17.990867999999992 | K20: =RC[-7]-RC[-4] -> 2.3528999999996358E-2 | S20: =RC[1] -> 2.6821464547177083 | T20: =(RC[-16]*RC[-15]-RC[-13]*RC[-12])/1000 -> 2.6821464547177083 | U20: - | V20: - | W20: =RC[-2]*RC[-10]/1000 -> #VALUE! | X20: =ABS((RC[-3]*RC[-11]-RC[-2]*RC[-9])/1000) -> #VALUE! | Y20: =RC[-14]/RC[-18]*100 -> 1.5791639011384979E-2 | Z20: - | AC20: =VALUE(RC[-27]) -> 2018-09-29T00:00:00.000 | AD20: =IF(RC[21]=42,"*",IF(RC[21]=32,"",RC[21])) -> - | AE20: =RC[-28] -> 24 | AF20: =RC[-28] -> 149.020096 | AG20: =RC[-28] -> 66.678794999999994 | AH20: =RC[-28] -> 6.5 | AI20: =RC[-28] -> 148.996567 | AJ20: =RC[-28] -> 48.687927000000002 | AK20: =RC[-28] -> 4.4000000000000004 | AL20: =RC[-28] -> 17.990867999999992 | AM20: =RC[-28] -> 2.3528999999996358E-2 | AN20: =RC[-28] -> 0 | AO20: =RC[-28] -> 0 | AP20: - | AQ20: =RC[-29] -> 0 | AR20: =RC[-29] -> 0 | AS20: - | AT20: =RC[-30] -> 0 | AU20: =RC[-30] -> 0 | AV20: =RC[-30] -> 0 | AW20: =RC[-30] -> 2.6821464547177083 | AY20: - | AZ20: * | BA20: -
A21: =IF(RC[1]="","",DATEVALUE(RC[1])) -> 43373 | B21: 30.09.18 | C21: 24 | D21: 147.469177 | E21: 68.543578999999994 | F21: 6.5 | G21: 147.60900899999999 | H21: 49.436909 | I21: 4.4000000000000004 | J21: =RC[-5]-RC[-2] -> 19.106669999999994 | K21: =RC[-7]-RC[-4] -> -0.13983199999998419 | S21: =RC[1] -> 2.8107320382513015 | T21: =(RC[-16]*RC[-15]-RC[-13]*RC[-12])/1000 -> 2.8107320382513015 | U21: - | V21: - | W21: =RC[-2]*RC[-10]/1000 -> #VALUE! | X21: =ABS((RC[-3]*RC[-11]-RC[-2]*RC[-9])/1000) -> #VALUE! | Y21: =RC[-14]/RC[-18]*100 -> -9.4731345293419186E-2 | Z21: - | AC21: =VALUE(RC[-27]) -> 2018-09-30T00:00:00.000 | AD21: =IF(RC[21]=42,"*",IF(RC[21]=32,"",RC[21])) -> - | AE21: =RC[-28] -> 24 | AF21: =RC[-28] -> 147.469177 | AG21: =RC[-28] -> 68.543578999999994 | AH21: =RC[-28] -> 6.5 | AI21: =RC[-28] -> 147.60900899999999 | AJ21: =RC[-28] -> 49.436909 | AK21: =RC[-28] -> 4.4000000000000004 | AL21: =RC[-28] -> 19.106669999999994 | AM21: =RC[-28] -> -0.13983199999998419 | AN21: =RC[-28] -> 0 | AO21: =RC[-28] -> 0 | AP21: - | AQ21: =RC[-29] -> 0 | AR21: =RC[-29] -> 0 | AS21: - | AT21: =RC[-30] -> 0 | AU21: =RC[-30] -> 0 | AV21: =RC[-30] -> 0 | AW21: =RC[-30] -> 2.8107320382513015 | AY21: - | AZ21: * | BA21: -
A22: =IF(RC[1]="","",DATEVALUE(RC[1])) -> 43374 | B22: 01.10.18 | C22: 24 | D22: 148.71444700000001 | E22: 67.744086999999993 | F22: 6.5 | G22: 148.66580200000001 | H22: 49.689056000000001 | I22: 4.4000000000000004 | J22: =RC[-5]-RC[-2] -> 18.055030999999993 | K22: =RC[-7]-RC[-4] -> 4.8644999999993388E-2 | S22: =RC[1] -> 2.6874610748619752 | T22: =(RC[-16]*RC[-15]-RC[-13]*RC[-12])/1000 -> 2.6874610748619752 | U22: - | V22: - | W22: =RC[-2]*RC[-10]/1000 -> #VALUE! | X22: =ABS((RC[-3]*RC[-11]-RC[-2]*RC[-9])/1000) -> #VALUE! | Y22: =RC[-14]/RC[-18]*100 -> 3.2721042328210347E-2 | Z22: - | AC22: =VALUE(RC[-27]) -> 2018-10-01T00:00:00.000 | AD22: =IF(RC[21]=42,"*",IF(RC[21]=32,"",RC[21])) -> - | AE22: =RC[-28] -> 24 | AF22: =RC[-28] -> 148.71444700000001 | AG22: =RC[-28] -> 67.744086999999993 | AH22: =RC[-28] -> 6.5 | AI22: =RC[-28] -> 148.66580200000001 | AJ22: =RC[-28] -> 49.689056000000001 | AK22: =RC[-28] -> 4.4000000000000004 | AL22: =RC[-28] -> 18.055030999999993 | AM22: =RC[-28] -> 4.8644999999993388E-2 | AN22: =RC[-28] -> 0 | AO22: =RC[-28] -> 0 | AP22: - | AQ22: =RC[-29] -> 0 | AR22: =RC[-29] -> 0 | AS22: - | AT22: =RC[-30] -> 0 | AU22: =RC[-30] -> 0 | AV22: =RC[-30] -> 0 | AW22: =RC[-30] -> 2.6874610748619752 | AY22: - | AZ22: * | BA22: -
A23: =IF(RC[1]="","",DATEVALUE(RC[1])) -> 43375 | B23: 02.10.18 | C23: 24 | D23: 170.98933400000001 | E23: 66.469352999999998 | F23: 6.5 | G23: 172.669693 | H23: 48.290562000000001 | I23: 4.4000000000000004 | J23: =RC[-5]-RC[-2] -> 18.178790999999997 | K23: =RC[-7]-RC[-4] -> -1.6803589999999815 | S23: =RC[1] -> 3.0272338855434353 | T23: =(RC[-16]*RC[-15]-RC[-13]*RC[-12])/1000 -> 3.0272338855434353 | U23: - | V23: - | W23: =RC[-2]*RC[-10]/1000 -> #VALUE! | X23: =ABS((RC[-3]*RC[-11]-RC[-2]*RC[-9])/1000) -> #VALUE! | Y23: =RC[-14]/RC[-18]*100 -> -0.97316383136210327 | Z23: - | AC23: =VALUE(RC[-27]) -> 2018-10-02T00:00:00.000 | AD23: =IF(RC[21]=42,"*",IF(RC[21]=32,"",RC[21])) -> - | AE23: =RC[-28] -> 24 | AF23: =RC[-28] -> 170.98933400000001 | AG23: =RC[-28] -> 66.469352999999998 | AH23: =RC[-28] -> 6.5 | AI23: =RC[-28] -> 172.669693 | AJ23: =RC[-28] -> 48.290562000000001 | AK23: =RC[-28] -> 4.4000000000000004 | AL23: =RC[-28] -> 18.178790999999997 | AM23: =RC[-28] -> -1.6803589999999815 | AN23: =RC[-28] -> 0 | AO23: =RC[-28] -> 0 | AP23: - | AQ23: =RC[-29] -> 0 | AR23: =RC[-29] -> 0 | AS23: - | AT23: =RC[-30] -> 0 | AU23: =RC[-30] -> 0 | AV23: =RC[-30] -> 0 | AW23: =RC[-30] -> 3.0272338855434353 | AY23: - | AZ23: * | BA23: -
A24: =IF(RC[1]="","",DATEVALUE(RC[1])) -> 43376 | B24: 03.10.18 | C24: 24 | D24: 201.08538799999999 | E24: 66.636786999999998 | F24: 6.5 | G24: 202.45347599999999 | H24: 44.423855000000003 | I24: 4.4000000000000004 | J24: =RC[-5]-RC[-2] -> 22.212931999999995 | K24: =RC[-7]-RC[-4] -> -1.3680880000000002 | S24: =RC[1] -> 4.4059203068983752 | T24: =(RC[-16]*RC[-15]-RC[-13]*RC[-12])/1000 -> 4.4059203068983752 | U24: - | V24: - | W24: =RC[-2]*RC[-10]/1000 -> #VALUE! | X24: =ABS((RC[-3]*RC[-11]-RC[-2]*RC[-9])/1000) -> #VALUE! | Y24: =RC[-14]/RC[-18]*100 -> -0.6757542656368124 | Z24: - | AC24: =VALUE(RC[-27]) -> 2018-10-03T00:00:00.000 | AD24: =IF(RC[21]=42,"*",IF(RC[21]=32,"",RC[21])) -> - | AE24: =RC[-28] -> 24 | AF24: =RC[-28] -> 201.08538799999999 | AG24: =RC[-28] -> 66.636786999999998 | AH24: =RC[-28] -> 6.5 | AI24: =RC[-28] -> 202.45347599999999 | AJ24: =RC[-28] -> 44.423855000000003 | AK24: =RC[-28] -> 4.4000000000000004 | AL24: =RC[-28] -> 22.212931999999995 | AM24: =RC[-28] -> -1.3680880000000002 | AN24: =RC[-28] -> 0 | AO24: =RC[-28] -> 0 | AP24: - | AQ24: =RC[-29] -> 0 | AR24: =RC[-29] -> 0 | AS24: - | AT24: =RC[-30] -> 0 | AU24: =RC[-30] -> 0 | AV24: =RC[-30] -> 0 | AW24: =RC[-30] -> 4.4059203068983752 | AY24: - | AZ24: * | BA24: -
A25: =IF(RC[1]="","",DATEVALUE(RC[1])) -> 43377 | B25: 04.10.18 | C25: 24 | D25: 191.91395600000001 | E25: 66.061988999999997 | F25: 6.5 | G25: 193.207886 | H25: 40.075752000000001 | I25: 4.4000000000000004 | J25: =RC[-5]-RC[-2] -> 25.986236999999996 | K25: =RC[-7]-RC[-4] -> -1.2939299999999889 | S25: =RC[1] -> 4.9352663264382128 | T25: =(RC[-16]*RC[-15]-RC[-13]*RC[-12])/1000 -> 4.9352663264382128 | U25: - | V25: - | W25: =RC[-2]*RC[-10]/1000 -> #VALUE! | X25: =ABS((RC[-3]*RC[-11]-RC[-2]*RC[-9])/1000) -> #VALUE! | Y25: =RC[-14]/RC[-18]*100 -> -0.66970868880579182 | Z25: - | AC25: =VALUE(RC[-27]) -> 2018-10-04T00:00:00.000 | AD25: =IF(RC[21]=42,"*",IF(RC[21]=32,"",RC[21])) -> - | AE25: =RC[-28] -> 24 | AF25: =RC[-28] -> 191.91395600000001 | AG25: =RC[-28] -> 66.061988999999997 | AH25: =RC[-28] -> 6.5 | AI25: =RC[-28] -> 193.207886 | AJ25: =RC[-28] -> 40.075752000000001 | AK25: =RC[-28] -> 4.4000000000000004 | AL25: =RC[-28] -> 25.986236999999996 | AM25: =RC[-28] -> -1.2939299999999889 | AN25: =RC[-28] -> 0 | AO25: =RC[-28] -> 0 | AP25: - | AQ25: =RC[-29] -> 0 | AR25: =RC[-29] -> 0 | AS25: - | AT25: =RC[-30] -> 0 | AU25: =RC[-30] -> 0 | AV25: =RC[-30] -> 0 | AW25: =RC[-30] -> 4.9352663264382128 | AY25: - | AZ25: * | BA25: -
A26: =IF(RC[1]="","",DATEVALUE(RC[1])) -> 43378 | B26: 05.10.18 | C26: 24 | D26: 173.34698499999999 | E26: 65.299216999999999 | F26: 6.5 | G26: 175.006531 | H26: 37.930382000000002 | I26: 4.4000000000000004 | J26: =RC[-5]-RC[-2] -> 27.368834999999997 | K26: =RC[-7]-RC[-4] -> -1.659546000000006 | S26: =RC[1] -> 4.6813578164859031 | T26: =(RC[-16]*RC[-15]-RC[-13]*RC[-12])/1000 -> 4.6813578164859031 | U26: - | V26: - | W26: =RC[-2]*RC[-10]/1000 -> #VALUE! | X26: =ABS((RC[-3]*RC[-11]-RC[-2]*RC[-9])/1000) -> #VALUE! | Y26: =RC[-14]/RC[-18]*100 -> -0.94827661031690635 | Z26: - | AC26: =VALUE(RC[-27]) -> 2018-10-05T00:00:00.000 | AD26: =IF(RC[21]=42,"*",IF(RC[21]=32,"",RC[21])) -> - | AE26: =RC[-28] -> 24 | AF26: =RC[-28] -> 173.34698499999999 | AG26: =RC[-28] -> 65.299216999999999 | AH26: =RC[-28] -> 6.5 | AI26: =RC[-28] -> 175.006531 | AJ26: =RC[-28] -> 37.930382000000002 | AK26: =RC[-28] -> 4.4000000000000004 | AL26: =RC[-28] -> 27.368834999999997 | AM26: =RC[-28] -> -1.659546000000006 | AN26: =RC[-28] -> 0 | AO26: =RC[-28] -> 0 | AP26: - | AQ26: =RC[-29] -> 0 | AR26: =RC[-29] -> 0 | AS26: - | AT26: =RC[-30] -> 0 | AU26: =RC[-30] -> 0 | AV26: =RC[-30] -> 0 | AW26: =RC[-30] -> 4.6813578164859031 | AY26: - | AZ26: * | BA26: -
A27: =IF(RC[1]="","",DATEVALUE(RC[1])) -> 43379 | B27: 06.10.18 | C27: 24 | D27: 175.820877 | E27: 65.834487999999993 | F27: 6.5 | G27: 177.10789500000001 | H27: 37.998165 | I27: 4.4000000000000004 | J27: =RC[-5]-RC[-2] -> 27.836322999999993 | K27: =RC[-7]-RC[-4] -> -1.2870180000000175 | S27: =RC[1] -> 4.8453023999932983 | T27: =(RC[-16]*RC[-15]-RC[-13]*RC[-12])/1000 -> 4.8453023999932983 | U27: - | V27: - | W27: =RC[-2]*RC[-10]/1000 -> #VALUE! | X27: =ABS((RC[-3]*RC[-11]-RC[-2]*RC[-9])/1000) -> #VALUE! | Y27: =RC[-14]/RC[-18]*100 -> -0.72668584311276319 | Z27: - | AC27: =VALUE(RC[-27]) -> 2018-10-06T00:00:00.000 | AD27: =IF(RC[21]=42,"*",IF(RC[21]=32,"",RC[21])) -> - | AE27: =RC[-28] -> 24 | AF27: =RC[-28] -> 175.820877 | AG27: =RC[-28] -> 65.834487999999993 | AH27: =RC[-28] -> 6.5 | AI27: =RC[-28] -> 177.10789500000001 | AJ27: =RC[-28] -> 37.998165 | AK27: =RC[-28] -> 4.4000000000000004 | AL27: =RC[-28] -> 27.836322999999993 | AM27: =RC[-28] -> -1.2870180000000175 | AN27: =RC[-28] -> 0 | AO27: =RC[-28] -> 0 | AP27: - | AQ27: =RC[-29] -> 0 | AR27: =RC[-29] -> 0 | AS27: - | AT27: =RC[-30] -> 0 | AU27: =RC[-30] -> 0 | AV27: =RC[-30] -> 0 | AW27: =RC[-30] -> 4.8453023999932983 | AY27: - | AZ27: * | BA27: -
A28: =IF(RC[1]="","",DATEVALUE(RC[1])) -> 43380 | B28: 07.10.18 | C28: 24 | D28: 175.46473700000001 | E28: 66.154785000000004 | F28: 6.5 | G28: 176.92796300000001 | H28: 38.262065999999997 | I28: 4.4000000000000004 | J28: =RC[-5]-RC[-2] -> 27.892719000000007 | K28: =RC[-7]-RC[-4] -> -1.4632259999999917 | S28: =RC[1] -> 4.8382025537649884 | T28: =(RC[-16]*RC[-15]-RC[-13]*RC[-12])/1000 -> 4.8382025537649884 | U28: - | V28: - | W28: =RC[-2]*RC[-10]/1000 -> #VALUE! | X28: =ABS((RC[-3]*RC[-11]-RC[-2]*RC[-9])/1000) -> #VALUE! | Y28: =RC[-14]/RC[-18]*100 -> -0.82701794289011943 | Z28: - | AC28: =VALUE(RC[-27]) -> 2018-10-07T00:00:00.000 | AD28: =IF(RC[21]=42,"*",IF(RC[21]=32,"",RC[21])) -> - | AE28: =RC[-28] -> 24 | AF28: =RC[-28] -> 175.46473700000001 | AG28: =RC[-28] -> 66.154785000000004 | AH28: =RC[-28] -> 6.5 | AI28: =RC[-28] -> 176.92796300000001 | AJ28: =RC[-28] -> 38.262065999999997 | AK28: =RC[-28] -> 4.4000000000000004 | AL28: =RC[-28] -> 27.892719000000007 | AM28: =RC[-28] -> -1.4632259999999917 | AN28: =RC[-28] -> 0 | AO28: =RC[-28] -> 0 | AP28: - | AQ28: =RC[-29] -> 0 | AR28: =RC[-29] -> 0 | AS28: - | AT28: =RC[-30] -> 0 | AU28: =RC[-30] -> 0 | AV28: =RC[-30] -> 0 | AW28: =RC[-30] -> 4.8382025537649884 | AY28: - | AZ28: * | BA28: -
A29: =IF(RC[1]="","",DATEVALUE(RC[1])) -> 43381 | B29: 08.10.18 | C29: 24 | D29: 171.649719 | E29: 66.113083000000003 | F29: 6.5 | G29: 173.143112 | H29: 37.597808999999998 | I29: 4.4000000000000004 | J29: =RC[-5]-RC[-2] -> 28.515274000000005 | K29: =RC[-7]-RC[-4] -> -1.4933929999999975 | S29: =RC[1] -> 4.8384904645320708 | T29: =(RC[-16]*RC[-15]-RC[-13]*RC[-12])/1000 -> 4.8384904645320708 | U29: - | V29: - | W29: =RC[-2]*RC[-10]/1000 -> #VALUE! | X29: =ABS((RC[-3]*RC[-11]-RC[-2]*RC[-9])/1000) -> #VALUE! | Y29: =RC[-14]/RC[-18]*100 -> -0.86251943998788549 | Z29: - | AC29: =VALUE(RC[-27]) -> 2018-10-08T00:00:00.000 | AD29: =IF(RC[21]=42,"*",IF(RC[21]=32,"",RC[21])) -> - | AE29: =RC[-28] -> 24 | AF29: =RC[-28] -> 171.649719 | AG29: =RC[-28] -> 66.113083000000003 | AH29: =RC[-28] -> 6.5 | AI29: =RC[-28] -> 173.143112 | AJ29: =RC[-28] -> 37.597808999999998 | AK29: =RC[-28] -> 4.4000000000000004 | AL29: =RC[-28] -> 28.515274000000005 | AM29: =RC[-28] -> -1.4933929999999975 | AN29: =RC[-28] -> 0 | AO29: =RC[-28] -> 0 | AP29: - | AQ29: =RC[-29] -> 0 | AR29: =RC[-29] -> 0 | AS29: - | AT29: =RC[-30] -> 0 | AU29: =RC[-30] -> 0 | AV29: =RC[-30] -> 0 | AW29: =RC[-30] -> 4.8384904645320708 | AY29: - | AZ29: * | BA29: -
A30: =IF(RC[1]="","",DATEVALUE(RC[1])) -> 43382 | B30: 09.10.18 | C30: 24 | D30: 178.69227599999999 | E30: 65.930496000000005 | F30: 6.5 | G30: 180.028717 | H30: 38.393912999999998 | I30: 4.4000000000000004 | J30: =RC[-5]-RC[-2] -> 27.536583000000007 | K30: =RC[-7]-RC[-4] -> -1.3364410000000078 | S30: =RC[1] -> 4.8692634900492768 | T30: =(RC[-16]*RC[-15]-RC[-13]*RC[-12])/1000 -> 4.8692634900492768 | U30: - | V30: - | W30: =RC[-2]*RC[-10]/1000 -> #VALUE! | X30: =ABS((RC[-3]*RC[-11]-RC[-2]*RC[-9])/1000) -> #VALUE! | Y30: =RC[-14]/RC[-18]*100 -> -0.74234878872130594 | Z30: - | AC30: =VALUE(RC[-27]) -> 2018-10-09T00:00:00.000 | AD30: =IF(RC[21]=42,"*",IF(RC[21]=32,"",RC[21])) -> - | AE30: =RC[-28] -> 24 | AF30: =RC[-28] -> 178.69227599999999 | AG30: =RC[-28] -> 65.930496000000005 | AH30: =RC[-28] -> 6.5 | AI30: =RC[-28] -> 180.028717 | AJ30: =RC[-28] -> 38.393912999999998 | AK30: =RC[-28] -> 4.4000000000000004 | AL30: =RC[-28] -> 27.536583000000007 | AM30: =RC[-28] -> -1.3364410000000078 | AN30: =RC[-28] -> 0 | AO30: =RC[-28] -> 0 | AP30: - | AQ30: =RC[-29] -> 0 | AR30: =RC[-29] -> 0 | AS30: - | AT30: =RC[-30] -> 0 | AU30: =RC[-30] -> 0 | AV30: =RC[-30] -> 0 | AW30: =RC[-30] -> 4.8692634900492768 | AY30: - | AZ30: * | BA30: -
A31: =IF(RC[1]="","",DATEVALUE(RC[1])) -> 43383 | B31: 10.10.18 | C31: 24 | D31: 179.22579999999999 | E31: 67.005882 | F31: 6.5 | G31: 180.823059 | H31: 39.217281 | I31: 4.4000000000000004 | J31: =RC[-5]-RC[-2] -> 27.788601 | K31: =RC[-7]-RC[-4] -> -1.5972590000000082 | S31: =RC[1] -> 4.9177940900730199 | T31: =(RC[-16]*RC[-15]-RC[-13]*RC[-12])/1000 -> 4.9177940900730199 | U31: - | V31: - | W31: =RC[-2]*RC[-10]/1000 -> #VALUE! | X31: =ABS((RC[-3]*RC[-11]-RC[-2]*RC[-9])/1000) -> #VALUE! | Y31: =RC[-14]/RC[-18]*100 -> -0.88332705399039191 | Z31: - | AC31: =VALUE(RC[-27]) -> 2018-10-10T00:00:00.000 | AD31: =IF(RC[21]=42,"*",IF(RC[21]=32,"",RC[21])) -> - | AE31: =RC[-28] -> 24 | AF31: =RC[-28] -> 179.22579999999999 | AG31: =RC[-28] -> 67.005882 | AH31: =RC[-28] -> 6.5 | AI31: =RC[-28] -> 180.823059 | AJ31: =RC[-28] -> 39.217281 | AK31: =RC[-28] -> 4.4000000000000004 | AL31: =RC[-28] -> 27.788601 | AM31: =RC[-28] -> -1.5972590000000082 | AN31: =RC[-28] -> 0 | AO31: =RC[-28] -> 0 | AP31: - | AQ31: =RC[-29] -> 0 | AR31: =RC[-29] -> 0 | AS31: - | AT31: =RC[-30] -> 0 | AU31: =RC[-30] -> 0 | AV31: =RC[-30] -> 0 | AW31: =RC[-30] -> 4.9177940900730199 | AY31: - | AZ31: * | BA31: -
A32: =IF(RC[1]="","",DATEVALUE(RC[1])) -> 43384 | B32: 11.10.18 | C32: 24 | D32: 184.466599 | E32: 68.099365000000006 | F32: 6.5 | G32: 186.11627200000001 | H32: 40.059353000000002 | I32: 4.4000000000000004 | J32: =RC[-5]-RC[-2] -> 28.040012000000004 | K32: =RC[-7]-RC[-4] -> -1.6496730000000071 | S32: =RC[1] -> 5.1063608165176193 | T32: =(RC[-16]*RC[-15]-RC[-13]*RC[-12])/1000 -> 5.1063608165176193 | U32: - | V32: - | W32: =RC[-2]*RC[-10]/1000 -> #VALUE! | X32: =ABS((RC[-3]*RC[-11]-RC[-2]*RC[-9])/1000) -> #VALUE! | Y32: =RC[-14]/RC[-18]*100 -> -0.88636688360059501 | Z32: - | AC32: =VALUE(RC[-27]) -> 2018-10-11T00:00:00.000 | AD32: =IF(RC[21]=42,"*",IF(RC[21]=32,"",RC[21])) -> - | AE32: =RC[-28] -> 24 | AF32: =RC[-28] -> 184.466599 | AG32: =RC[-28] -> 68.099365000000006 | AH32: =RC[-28] -> 6.5 | AI32: =RC[-28] -> 186.11627200000001 | AJ32: =RC[-28] -> 40.059353000000002 | AK32: =RC[-28] -> 4.4000000000000004 | AL32: =RC[-28] -> 28.040012000000004 | AM32: =RC[-28] -> -1.6496730000000071 | AN32: =RC[-28] -> 0 | AO32: =RC[-28] -> 0 | AP32: - | AQ32: =RC[-29] -> 0 | AR32: =RC[-29] -> 0 | AS32: - | AT32: =RC[-30] -> 0 | AU32: =RC[-30] -> 0 | AV32: =RC[-30] -> 0 | AW32: =RC[-30] -> 5.1063608165176193 | AY32: - | AZ32: * | BA32: -
A33: =IF(RC[1]="","",DATEVALUE(RC[1])) -> 43385 | B33: 12.10.18 | C33: 24 | D33: 182.136505 | E33: 67.991416999999998 | F33: 6.5 | G33: 183.91398599999999 | H33: 39.855648000000002 | I33: 4.4000000000000004 | J33: =RC[-5]-RC[-2] -> 28.135768999999996 | K33: =RC[-7]-RC[-4] -> -1.7774809999999945 | S33: =RC[1] -> 5.0537079740846558 | T33: =(RC[-16]*RC[-15]-RC[-13]*RC[-12])/1000 -> 5.0537079740846558 | U33: - | V33: - | W33: =RC[-2]*RC[-10]/1000 -> #VALUE! | X33: =ABS((RC[-3]*RC[-11]-RC[-2]*RC[-9])/1000) -> #VALUE! | Y33: =RC[-14]/RC[-18]*100 -> -0.96647407772456984 | Z33: - | AC33: =VALUE(RC[-27]) -> 2018-10-12T00:00:00.000 | AD33: =IF(RC[21]=42,"*",IF(RC[21]=32,"",RC[21])) -> - | AE33: =RC[-28] -> 24 | AF33: =RC[-28] -> 182.136505 | AG33: =RC[-28] -> 67.991416999999998 | AH33: =RC[-28] -> 6.5 | AI33: =RC[-28] -> 183.91398599999999 | AJ33: =RC[-28] -> 39.855648000000002 | AK33: =RC[-28] -> 4.4000000000000004 | AL33: =RC[-28] -> 28.135768999999996 | AM33: =RC[-28] -> -1.7774809999999945 | AN33: =RC[-28] -> 0 | AO33: =RC[-28] -> 0 | AP33: - | AQ33: =RC[-29] -> 0 | AR33: =RC[-29] -> 0 | AS33: - | AT33: =RC[-30] -> 0 | AU33: =RC[-30] -> 0 | AV33: =RC[-30] -> 0 | AW33: =RC[-30] -> 5.0537079740846558 | AY33: - | AZ33: * | BA33: -
A34: =IF(RC[1]="","",DATEVALUE(RC[1])) -> 43386 | B34: 13.10.18 | C34: 24 | D34: 189.917709 | E34: 69.052254000000005 | F34: 6.5 | G34: 191.684372 | H34: 41.191611999999999 | I34: 4.4000000000000004 | J34: =RC[-5]-RC[-2] -> 27.860642000000006 | K34: =RC[-7]-RC[-4] -> -1.7666629999999941 | S34: =RC[1] -> 5.2184576030784235 | T34: =(RC[-16]*RC[-15]-RC[-13]*RC[-12])/1000 -> 5.2184576030784235 | U34: - | V34: - | W34: =RC[-2]*RC[-10]/1000 -> #VALUE! | X34: =ABS((RC[-3]*RC[-11]-RC[-2]*RC[-9])/1000) -> #VALUE! | Y34: =RC[-14]/RC[-18]*100 -> -0.92165207917940961 | Z34: - | AC34: =VALUE(RC[-27]) -> 2018-10-13T00:00:00.000 | AD34: =IF(RC[21]=42,"*",IF(RC[21]=32,"",RC[21])) -> - | AE34: =RC[-28] -> 24 | AF34: =RC[-28] -> 189.917709 | AG34: =RC[-28] -> 69.052254000000005 | AH34: =RC[-28] -> 6.5 | AI34: =RC[-28] -> 191.684372 | AJ34: =RC[-28] -> 41.191611999999999 | AK34: =RC[-28] -> 4.4000000000000004 | AL34: =RC[-28] -> 27.860642000000006 | AM34: =RC[-28] -> -1.7666629999999941 | AN34: =RC[-28] -> 0 | AO34: =RC[-28] -> 0 | AP34: - | AQ34: =RC[-29] -> 0 | AR34: =RC[-29] -> 0 | AS34: - | AT34: =RC[-30] -> 0 | AU34: =RC[-30] -> 0 | AV34: =RC[-30] -> 0 | AW34: =RC[-30] -> 5.2184576030784235 | AY34: - | AZ34: * | BA34: -
A35: =IF(RC[1]="","",DATEVALUE(RC[1])) -> 43387 | B35: 14.10.18 | C35: 24 | D35: 192.73912000000001 | E35: 69.854416000000001 | F35: 6.5 | G35: 194.68206799999999 | H35: 42.304141999999999 | I35: 4.4000000000000004 | J35: =RC[-5]-RC[-2] -> 27.550274000000002 | K35: =RC[-7]-RC[-4] -> -1.9429479999999728 | S35: =RC[1] -> 5.2278208184282668 | T35: =(RC[-16]*RC[-15]-RC[-13]*RC[-12])/1000 -> 5.2278208184282668 | U35: - | V35: - | W35: =RC[-2]*RC[-10]/1000 -> #VALUE! | X35: =ABS((RC[-3]*RC[-11]-RC[-2]*RC[-9])/1000) -> #VALUE! | Y35: =RC[-14]/RC[-18]*100 -> -0.99801076697005953 | Z35: - | AC35: =VALUE(RC[-27]) -> 2018-10-14T00:00:00.000 | AD35: =IF(RC[21]=42,"*",IF(RC[21]=32,"",RC[21])) -> - | AE35: =RC[-28] -> 24 | AF35: =RC[-28] -> 192.73912000000001 | AG35: =RC[-28] -> 69.854416000000001 | AH35: =RC[-28] -> 6.5 | AI35: =RC[-28] -> 194.68206799999999 | AJ35: =RC[-28] -> 42.304141999999999 | AK35: =RC[-28] -> 4.4000000000000004 | AL35: =RC[-28] -> 27.550274000000002 | AM35: =RC[-28] -> -1.9429479999999728 | AN35: =RC[-28] -> 0 | AO35: =RC[-28] -> 0 | AP35: - | AQ35: =RC[-29] -> 0 | AR35: =RC[-29] -> 0 | AS35: - | AT35: =RC[-30] -> 0 | AU35: =RC[-30] -> 0 | AV35: =RC[-30] -> 0 | AW35: =RC[-30] -> 5.2278208184282668 | AY35: - | AZ35: * | BA35: -
A36: =IF(RC[1]="","",DATEVALUE(RC[1])) -> 43388 | B36: 15.10.18 | C36: 24 | D36: 197.85131799999999 | E36: 69.363395999999995 | F36: 6.5 | G36: 199.49400299999999 | H36: 42.880263999999997 | I36: 4.4000000000000004 | J36: =RC[-5]-RC[-2] -> 26.483131999999998 | K36: =RC[-7]-RC[-4] -> -1.6426850000000002 | S36: =RC[1] -> 5.1692838044991349 | T36: =(RC[-16]*RC[-15]-RC[-13]*RC[-12])/1000 -> 5.1692838044991349 | U36: - | V36: - | W36: =RC[-2]*RC[-10]/1000 -> #VALUE! | X36: =ABS((RC[-3]*RC[-11]-RC[-2]*RC[-9])/1000) -> #VALUE! | Y36: =RC[-14]/RC[-18]*100 -> -0.82342575480827873 | Z36: - | AC36: =VALUE(RC[-27]) -> 2018-10-15T00:00:00.000 | AD36: =IF(RC[21]=42,"*",IF(RC[21]=32,"",RC[21])) -> - | AE36: =RC[-28] -> 24 | AF36: =RC[-28] -> 197.85131799999999 | AG36: =RC[-28] -> 69.363395999999995 | AH36: =RC[-28] -> 6.5 | AI36: =RC[-28] -> 199.49400299999999 | AJ36: =RC[-28] -> 42.880263999999997 | AK36: =RC[-28] -> 4.4000000000000004 | AL36: =RC[-28] -> 26.483131999999998 | AM36: =RC[-28] -> -1.6426850000000002 | AN36: =RC[-28] -> 0 | AO36: =RC[-28] -> 0 | AP36: - | AQ36: =RC[-29] -> 0 | AR36: =RC[-29] -> 0 | AS36: - | AT36: =RC[-30] -> 0 | AU36: =RC[-30] -> 0 | AV36: =RC[-30] -> 0 | AW36: =RC[-30] -> 5.1692838044991349 | AY36: - | AZ36: * | BA36: -
A37: =IF(RC[1]="","",DATEVALUE(RC[1])) -> 43389 | B37: 16.10.18 | C37: 24 | D37: 198.79376199999999 | E37: 69.389258999999996 | F37: 6.5 | G37: 200.584091 | H37: 43.035739999999997 | I37: 4.4000000000000004 | J37: =RC[-5]-RC[-2] -> 26.353518999999999 | K37: =RC[-7]-RC[-4] -> -1.790329000000014 | S37: =RC[1] -> 5.1618670505900157 | T37: =(RC[-16]*RC[-15]-RC[-13]*RC[-12])/1000 -> 5.1618670505900157 | U37: - | V37: - | W37: =RC[-2]*RC[-10]/1000 -> #VALUE! | X37: =ABS((RC[-3]*RC[-11]-RC[-2]*RC[-9])/1000) -> #VALUE! | Y37: =RC[-14]/RC[-18]*100 -> -0.89255782503708836 | Z37: - | AC37: =VALUE(RC[-27]) -> 2018-10-16T00:00:00.000 | AD37: =IF(RC[21]=42,"*",IF(RC[21]=32,"",RC[21])) -> - | AE37: =RC[-28] -> 24 | AF37: =RC[-28] -> 198.79376199999999 | AG37: =RC[-28] -> 69.389258999999996 | AH37: =RC[-28] -> 6.5 | AI37: =RC[-28] -> 200.584091 | AJ37: =RC[-28] -> 43.035739999999997 | AK37: =RC[-28] -> 4.4000000000000004 | AL37: =RC[-28] -> 26.353518999999999 | AM37: =RC[-28] -> -1.790329000000014 | AN37: =RC[-28] -> 0 | AO37: =RC[-28] -> 0 | AP37: - | AQ37: =RC[-29] -> 0 | AR37: =RC[-29] -> 0 | AS37: - | AT37: =RC[-30] -> 0 | AU37: =RC[-30] -> 0 | AV37: =RC[-30] -> 0 | AW37: =RC[-30] -> 5.1618670505900157 | AY37: - | AZ37: * | BA37: -
A38: =IF(RC[1]="","",DATEVALUE(RC[1])) -> 43390 | B38: 17.10.18 | C38: 24 | D38: 202.715271 | E38: 69.519371000000007 | F38: 6.5 | G38: 204.38536099999999 | H38: 43.539760999999999 | I38: 4.4000000000000004 | J38: =RC[-5]-RC[-2] -> 25.979610000000008 | K38: =RC[-7]-RC[-4] -> -1.6700899999999876 | S38: =RC[1] -> 5.193748362175822 | T38: =(RC[-16]*RC[-15]-RC[-13]*RC[-12])/1000 -> 5.193748362175822 | U38: - | V38: - | W38: =RC[-2]*RC[-10]/1000 -> #VALUE! | X38: =ABS((RC[-3]*RC[-11]-RC[-2]*RC[-9])/1000) -> #VALUE! | Y38: =RC[-14]/RC[-18]*100 -> -0.81712799381947299 | Z38: - | AC38: =VALUE(RC[-27]) -> 2018-10-17T00:00:00.000 | AD38: =IF(RC[21]=42,"*",IF(RC[21]=32,"",RC[21])) -> - | AE38: =RC[-28] -> 24 | AF38: =RC[-28] -> 202.715271 | AG38: =RC[-28] -> 69.519371000000007 | AH38: =RC[-28] -> 6.5 | AI38: =RC[-28] -> 204.38536099999999 | AJ38: =RC[-28] -> 43.539760999999999 | AK38: =RC[-28] -> 4.4000000000000004 | AL38: =RC[-28] -> 25.979610000000008 | AM38: =RC[-28] -> -1.6700899999999876 | AN38: =RC[-28] -> 0 | AO38: =RC[-28] -> 0 | AP38: - | AQ38: =RC[-29] -> 0 | AR38: =RC[-29] -> 0 | AS38: - | AT38: =RC[-30] -> 0 | AU38: =RC[-30] -> 0 | AV38: =RC[-30] -> 0 | AW38: =RC[-30] -> 5.193748362175822 | AY38: - | AZ38: * | BA38: -
A39: =IF(RC[1]="","",DATEVALUE(RC[1])) -> 43391 | B39: 18.10.18 | C39: 24 | D39: 201.77581799999999 | E39: 70.018996999999999 | F39: 6.5 | G39: 203.61106899999999 | H39: 43.715572000000002 | I39: 4.4000000000000004 | J39: 26.303424999999997 | K39: -1.835251 | S39: =RC[1] -> 5.2271660483480771 | T39: 5.2271660483480771 | U39: - | V39: - | W39: #VALUE! | X39: #VALUE! | Y39: =RC[-14]/RC[-18]*100 -> -0.90135129146637905 | Z39: - | AC39: =VALUE(RC[-27]) -> 2018-10-18T00:00:00.000 | AD39: =IF(RC[21]=42,"*",IF(RC[21]=32,"",RC[21])) ->  | AE39: =RC[-28] -> 24 | AF39: =RC[-28] -> 201.77581799999999 | AG39: =RC[-28] -> 70.018996999999999 | AH39: =RC[-28] -> 6.5 | AI39: =RC[-28] -> 203.61106899999999 | AJ39: =RC[-28] -> 43.715572000000002 | AK39: =RC[-28] -> 4.4000000000000004 | AL39: =RC[-28] -> 26.303424999999997 | AM39: =RC[-28] -> -1.835251 | AN39: =RC[-28] -> 0 | AO39: =RC[-28] -> 0 | AP39: - | AQ39: =RC[-29] -> 0 | AR39: =RC[-29] -> 0 | AS39: - | AT39: =RC[-30] -> 0 | AU39: =RC[-30] -> 0 | AV39: =RC[-30] -> 0 | AW39: =RC[-30] -> 5.2271660483480771
A40: =IF(RC[1]="","",DATEVALUE(RC[1])) -> 43392 | B40: 19.10.18 | C40: 24 | D40: 202.75692699999999 | E40: 69.950507999999999 | F40: 6.5 | G40: 204.45240799999999 | H40: 43.579365000000003 | I40: 4.4000000000000004 | J40: 26.371142999999996 | K40: -1.695481 | S40: =RC[1] -> 5.2730439308079964 | T40: 5.2730439308079964 | U40: - | V40: - | W40: #VALUE! | X40: #VALUE! | Y40: =RC[-14]/RC[-18]*100 -> -0.8292790564736221 | Z40: - | AC40: =VALUE(RC[-27]) -> 2018-10-19T00:00:00.000 | AD40: =IF(RC[21]=42,"*",IF(RC[21]=32,"",RC[21])) ->  | AE40: =RC[-28] -> 24 | AF40: =RC[-28] -> 202.75692699999999 | AG40: =RC[-28] -> 69.950507999999999 | AH40: =RC[-28] -> 6.5 | AI40: =RC[-28] -> 204.45240799999999 | AJ40: =RC[-28] -> 43.579365000000003 | AK40: =RC[-28] -> 4.4000000000000004 | AL40: =RC[-28] -> 26.371142999999996 | AM40: =RC[-28] -> -1.695481 | AN40: =RC[-28] -> 0 | AO40: =RC[-28] -> 0 | AP40: - | AQ40: =RC[-29] -> 0 | AR40: =RC[-29] -> 0 | AS40: - | AT40: =RC[-30] -> 0 | AU40: =RC[-30] -> 0 | AV40: =RC[-30] -> 0 | AW40: =RC[-30] -> 5.2730439308079964
A41: =IF(RC[1]="","",DATEVALUE(RC[1])) -> 43393 | B41: 20.10.18 | C41: 24 | D41: 193.59271200000001 | E41: 69.197067000000004 | F41: 6.5 | G41: 195.394836 | H41: 42.190792000000002 | I41: 4.4000000000000004 | J41: 27.006275000000002 | K41: -1.80212400000002 | S41: =RC[1] -> 5.1521849794255923 | T41: 5.1521849794255923 | U41: - | V41: - | W41: #VALUE! | X41: #VALUE! | Y41: =RC[-14]/RC[-18]*100 -> -0.92229868347187027 | Z41: - | AC41: =VALUE(RC[-27]) -> 2018-10-20T00:00:00.000 | AD41: =IF(RC[21]=42,"*",IF(RC[21]=32,"",RC[21])) ->  | AE41: =RC[-28] -> 24 | AF41: =RC[-28] -> 193.59271200000001 | AG41: =RC[-28] -> 69.197067000000004 | AH41: =RC[-28] -> 6.5 | AI41: =RC[-28] -> 195.394836 | AJ41: =RC[-28] -> 42.190792000000002 | AK41: =RC[-28] -> 4.4000000000000004 | AL41: =RC[-28] -> 27.006275000000002 | AM41: =RC[-28] -> -1.80212400000002 | AN41: =RC[-28] -> 0 | AO41: =RC[-28] -> 0 | AP41: - | AQ41: =RC[-29] -> 0 | AR41: =RC[-29] -> 0 | AS41: - | AT41: =RC[-30] -> 0 | AU41: =RC[-30] -> 0 | AV41: =RC[-30] -> 0 | AW41: =RC[-30] -> 5.1521849794255923
A42: =IF(RC[1]="","",DATEVALUE(RC[1])) -> 43394 | B42: 21.10.18 | C42: 24 | D42: 193.553268 | E42: 68.391479000000004 | F42: 6.5 | G42: 195.09219400000001 | H42: 41.780701000000001 | I42: 4.4000000000000004 | J42: 26.610778000000003 | K42: -1.53892599999998 | S42: =RC[1] -> 5.0863056388553787 | T42: 5.0863056388553787 | U42: - | V42: - | W42: #VALUE! | X42: #VALUE! | Y42: =RC[-14]/RC[-18]*100 -> -0.78881987456657543 | Z42: - | AC42: =VALUE(RC[-27]) -> 2018-10-21T00:00:00.000 | AD42: =IF(RC[21]=42,"*",IF(RC[21]=32,"",RC[21])) ->  | AE42: =RC[-28] -> 24 | AF42: =RC[-28] -> 193.553268 | AG42: =RC[-28] -> 68.391479000000004 | AH42: =RC[-28] -> 6.5 | AI42: =RC[-28] -> 195.09219400000001 | AJ42: =RC[-28] -> 41.780701000000001 | AK42: =RC[-28] -> 4.4000000000000004 | AL42: =RC[-28] -> 26.610778000000003 | AM42: =RC[-28] -> -1.53892599999998 | AN42: =RC[-28] -> 0 | AO42: =RC[-28] -> 0 | AP42: - | AQ42: =RC[-29] -> 0 | AR42: =RC[-29] -> 0 | AS42: - | AT42: =RC[-30] -> 0 | AU42: =RC[-30] -> 0 | AV42: =RC[-30] -> 0 | AW42: =RC[-30] -> 5.0863056388553787
A43: =IF(RC[1]="","",DATEVALUE(RC[1])) -> 43395 | B43: 22.10.18 | C43: 24 | D43: 191.09667999999999 | E43: 68.660438999999997 | F43: 6.5 | G43: 192.813751 | H43: 41.475006 | I43: 4.4000000000000004 | J43: 27.185432999999996 | K43: -1.717071 | S43: =RC[1] -> 5.1238304606350127 | T43: 5.1238304606350127 | U43: - | V43: - | W43: #VALUE! | X43: #VALUE! | Y43: =RC[-14]/RC[-18]*100 -> -0.89053347652574855 | Z43: - | AC43: =VALUE(RC[-27]) -> 2018-10-22T00:00:00.000 | AD43: =IF(RC[21]=42,"*",IF(RC[21]=32,"",RC[21])) ->  | AE43: =RC[-28] -> 24 | AF43: =RC[-28] -> 191.09667999999999 | AG43: =RC[-28] -> 68.660438999999997 | AH43: =RC[-28] -> 6.5 | AI43: =RC[-28] -> 192.813751 | AJ43: =RC[-28] -> 41.475006 | AK43: =RC[-28] -> 4.4000000000000004 | AL43: =RC[-28] -> 27.185432999999996 | AM43: =RC[-28] -> -1.717071 | AN43: =RC[-28] -> 0 | AO43: =RC[-28] -> 0 | AP43: - | AQ43: =RC[-29] -> 0 | AR43: =RC[-29] -> 0 | AS43: - | AT43: =RC[-30] -> 0 | AU43: =RC[-30] -> 0 | AV43: =RC[-30] -> 0 | AW43: =RC[-30] -> 5.1238304606350127
A44: =IF(RC[1]="","",DATEVALUE(RC[1])) ->  | C44: 24 | J44: =RC[-5]-RC[-2] -> #VALUE! | K44: =RC[-7]-RC[-4] -> #VALUE! | S44: =RC[1] -> #VALUE! | T44: =(RC[-16]*RC[-15]-RC[-13]*RC[-12])/1000 -> #VALUE! | W44: =RC[-2]*RC[-10]/1000 -> #VALUE! | X44: =ABS((RC[-3]*RC[-11]-RC[-2]*RC[-9])/1000) -> #VALUE! | Y44: =RC[-14]/RC[-18]*100 -> #VALUE! | AC44: =VALUE(RC[-27]) -> #VALUE! | AD44: =IF(RC[21]=42,"*",IF(RC[21]=32,"",RC[21])) ->  | AE44: =RC[-28] -> 24 | AF44: =RC[-28] ->  | AG44: =RC[-28] ->  | AH44: =RC[-28] ->  | AI44: =RC[-28] ->  | AJ44: =RC[-28] ->  | AK44: =RC[-28] ->  | AL44: =RC[-28] -> #VALUE! | AM44: =RC[-28] -> #VALUE! | AN44: =RC[-28] -> 0 | AO44: =RC[-28] -> 0 | AP44: - | AQ44: =RC[-29] -> 0 | AR44: =RC[-29] -> 0 | AS44: - | AT44: =RC[-30] -> 0 | AU44: =RC[-30] -> 0 | AV44: =RC[-30] -> 0 | AW44: =RC[-30] -> #VALUE!
A45: =IF(RC[1]="","",DATEVALUE(RC[1])) ->  | C45: 24 | K45: =RC[-7]-RC[-4] -> #VALUE! | S45: =RC[1] -> #VALUE! | T45: =(RC[-16]*RC[-15]-RC[-13]*RC[-12])/1000 -> #VALUE! | W45: =RC[-2]*RC[-10]/1000 -> #VALUE! | X45: =ABS((RC[-3]*RC[-11]-RC[-2]*RC[-9])/1000) -> #VALUE! | Y45: =RC[-14]/RC[-18]*100 -> #VALUE! | AC45: =VALUE(RC[-27]) -> #VALUE! | AD45: =IF(RC[21]=42,"*",IF(RC[21]=32,"",RC[21])) ->  | AE45: =RC[-28] -> 24 | AF45: =RC[-28] ->  | AG45: =RC[-28] ->  | AH45: =RC[-28] ->  | AI45: =RC[-28] ->  | AJ45: =RC[-28] ->  | AK45: =RC[-28] ->  | AL45: =RC[-28] -> 0 | AM45: =RC[-28] -> #VALUE! | AN45: =RC[-28] -> 0 | AO45: =RC[-28] -> 0 | AP45: - | AQ45: =RC[-29] -> 0 | AR45: =RC[-29] -> 0 | AS45: - | AT45: =RC[-30] -> 0 | AU45: =RC[-30] -> 0 | AV45: =RC[-30] -> 0 | AW45: =RC[-30] -> #VALUE!
A46: =IF(RC[1]="","",DATEVALUE(RC[1])) ->  | C46: 24 | K46: =RC[-7]-RC[-4] -> #VALUE! | S46: =RC[1] -> #VALUE! | T46: =(RC[-16]*RC[-15]-RC[-13]*RC[-12])/1000 -> #VALUE! | W46: =RC[-2]*RC[-10]/1000 -> #VALUE! | X46: =ABS((RC[-3]*RC[-11]-RC[-2]*RC[-9])/1000) -> #VALUE! | Y46: =RC[-14]/RC[-18]*100 -> #VALUE! | AC46: =VALUE(RC[-27]) -> #VALUE! | AD46: =IF(RC[21]=42,"*",IF(RC[21]=32,"",RC[21])) ->  | AE46: =RC[-28] -> 24 | AF46: =RC[-28] ->  | AG46: =RC[-28] ->  | AH46: =RC[-28] ->  | AI46: =RC[-28] ->  | AJ46: =RC[-28] ->  | AK46: =RC[-28] ->  | AL46: =RC[-28] -> 0 | AM46: =RC[-28] -> #VALUE! | AN46: =RC[-28] -> 0 | AO46: =RC[-28] -> 0 | AP46: - | AQ46: =RC[-29] -> 0 | AR46: =RC[-29] -> 0 | AS46: - | AT46: =RC[-30] -> 0 | AU46: =RC[-30] -> 0 | AV46: =RC[-30] -> 0 | AW46: =RC[-30] -> #VALUE!
A47: =IF(RC[1]="","",DATEVALUE(RC[1])) ->  | C47: 24 | K47: =RC[-7]-RC[-4] -> #VALUE! | S47: =RC[1] -> #VALUE! | T47: =(RC[-16]*RC[-15]-RC[-13]*RC[-12])/1000 -> #VALUE! | W47: =RC[-2]*RC[-10]/1000 -> #VALUE! | X47: =ABS((RC[-3]*RC[-11]-RC[-2]*RC[-9])/1000) -> #VALUE! | Y47: =RC[-14]/RC[-18]*100 -> #VALUE! | AC47: =VALUE(RC[-27]) -> #VALUE! | AD47: =IF(RC[21]=42,"*",IF(RC[21]=32,"",RC[21])) ->  | AE47: =RC[-28] -> 24 | AF47: =RC[-28] ->  | AG47: =RC[-28] ->  | AH47: =RC[-28] ->  | AI47: =RC[-28] ->  | AJ47: =RC[-28] ->  | AK47: =RC[-28] ->  | AL47: =RC[-28] -> 0 | AM47: =RC[-28] -> #VALUE! | AN47: =RC[-28] -> 0 | AO47: =RC[-28] -> 0 | AP47: - | AQ47: =RC[-29] -> 0 | AR47: =RC[-29] -> 0 | AS47: - | AT47: =RC[-30] -> 0 | AU47: =RC[-30] -> 0 | AV47: =RC[-30] -> 0 | AW47: =RC[-30] -> #VALUE!
A48: =IF(RC[1]="","",DATEVALUE(RC[1])) ->  | C48: 24 | K48: =RC[-7]-RC[-4] -> #VALUE! | S48: =RC[1] -> #VALUE! | T48: =(RC[-16]*RC[-15]-RC[-13]*RC[-12])/1000 -> #VALUE! | W48: =RC[-2]*RC[-10]/1000 -> #VALUE! | X48: =ABS((RC[-3]*RC[-11]-RC[-2]*RC[-9])/1000) -> #VALUE! | Y48: =RC[-14]/RC[-18]*100 -> #VALUE! | AC48: =VALUE(RC[-27]) -> #VALUE! | AD48: =IF(RC[21]=42,"*",IF(RC[21]=32,"",RC[21])) ->  | AE48: =RC[-28] -> 24 | AF48: =RC[-28] ->  | AG48: =RC[-28] ->  | AH48: =RC[-28] ->  | AI48: =RC[-28] ->  | AJ48: =RC[-28] ->  | AK48: =RC[-28] ->  | AL48: =RC[-28] -> 0 | AM48: =RC[-28] -> #VALUE! | AN48: =RC[-28] -> 0 | AO48: =RC[-28] -> 0 | AP48: - | AQ48: =RC[-29] -> 0 | AR48: =RC[-29] -> 0 | AS48: - | AT48: =RC[-30] -> 0 | AU48: =RC[-30] -> 0 | AV48: =RC[-30] -> 0 | AW48: =RC[-30] -> #VALUE!
A49: =IF(RC[1]="","",DATEVALUE(RC[1])) ->  | C49: 24 | K49: =RC[-7]-RC[-4] -> #VALUE! | S49: =RC[1] -> #VALUE! | T49: =(RC[-16]*RC[-15]-RC[-13]*RC[-12])/1000 -> #VALUE! | W49: =RC[-2]*RC[-10]/1000 -> #VALUE! | X49: =ABS((RC[-3]*RC[-11]-RC[-2]*RC[-9])/1000) -> #VALUE! | Y49: =RC[-14]/RC[-18]*100 -> #VALUE! | AC49: =VALUE(RC[-27]) -> #VALUE! | AD49: =IF(RC[21]=42,"*",IF(RC[21]=32,"",RC[21])) ->  | AE49: =RC[-28] -> 24 | AF49: =RC[-28] ->  | AG49: =RC[-28] ->  | AH49: =RC[-28] ->  | AI49: =RC[-28] ->  | AJ49: =RC[-28] ->  | AK49: =RC[-28] ->  | AL49: =RC[-28] -> 0 | AM49: =RC[-28] -> #VALUE! | AN49: =RC[-28] -> 0 | AO49: =RC[-28] -> 0 | AP49: - | AQ49: =RC[-29] -> 0 | AR49: =RC[-29] -> 0 | AS49: - | AT49: =RC[-30] -> 0 | AU49: =RC[-30] -> 0 | AV49: =RC[-30] -> 0 | AW49: =RC[-30] -> #VALUE!
A50: =IF(RC[1]="","",DATEVALUE(RC[1])) ->  | K50: =RC[-7]-RC[-4] -> #VALUE! | S50: =RC[1] -> #VALUE! | T50: =(RC[-16]*RC[-15]-RC[-13]*RC[-12])/1000 -> #VALUE! | W50: =RC[-2]*RC[-10]/1000 -> #VALUE! | X50: =ABS((RC[-3]*RC[-11]-RC[-2]*RC[-9])/1000) -> #VALUE! | Y50: =RC[-14]/RC[-18]*100 -> #VALUE! | AC50: =VALUE(RC[-27]) -> #VALUE! | AD50: =IF(RC[21]=42,"*",IF(RC[21]=32,"",RC[21])) ->  | AE50: =RC[-28] ->  | AF50: =RC[-28] ->  | AG50: =RC[-28] ->  | AH50: =RC[-28] ->  | AI50: =RC[-28] ->  | AJ50: =RC[-28] ->  | AK50: =RC[-28] ->  | AL50: =RC[-28] -> 0 | AM50: =RC[-28] -> #VALUE! | AN50: =RC[-28] -> 0 | AO50: =RC[-28] -> 0 | AP50: - | AQ50: =RC[-29] -> 0 | AR50: =RC[-29] -> 0 | AS50: - | AT50: =RC[-30] -> 0 | AU50: =RC[-30] -> 0 | AV50: =RC[-30] -> 0 | AW50: =RC[-30] -> #VALUE!
A51: =IF(RC[1]="","",DATEVALUE(RC[1])) ->  | K51: =RC[-7]-RC[-4] -> #VALUE! | S51: =RC[1] -> #VALUE! | T51: =(RC[-16]*RC[-15]-RC[-13]*RC[-12])/1000 -> #VALUE! | W51: =RC[-2]*RC[-10]/1000 -> #VALUE! | X51: =ABS((RC[-3]*RC[-11]-RC[-2]*RC[-9])/1000) -> #VALUE! | Y51: =RC[-14]/RC[-18]*100 -> #VALUE! | AC51: =VALUE(RC[-27]) -> #VALUE! | AD51: =IF(RC[21]=42,"*",IF(RC[21]=32,"",RC[21])) ->  | AE51: =RC[-28] ->  | AF51: =RC[-28] ->  | AG51: =RC[-28] ->  | AH51: =RC[-28] ->  | AI51: =RC[-28] ->  | AJ51: =RC[-28] ->  | AK51: =RC[-28] ->  | AL51: =RC[-28] -> 0 | AM51: =RC[-28] -> #VALUE! | AN51: =RC[-28] -> 0 | AO51: =RC[-28] -> 0 | AP51: - | AQ51: =RC[-29] -> 0 | AR51: =RC[-29] -> 0 | AS51: - | AT51: =RC[-30] -> 0 | AU51: =RC[-30] -> 0 | AV51: =RC[-30] -> 0 | AW51: =RC[-30] -> #VALUE!
A52: =IF(RC[1]="","",DATEVALUE(RC[1])) ->  | K52: =RC[-7]-RC[-4] -> #VALUE! | S52: =RC[1] -> #VALUE! | T52: =(RC[-16]*RC[-15]-RC[-13]*RC[-12])/1000 -> #VALUE! | W52: =RC[-2]*RC[-10]/1000 -> #VALUE! | X52: =ABS((RC[-3]*RC[-11]-RC[-2]*RC[-9])/1000) -> #VALUE! | Y52: =RC[-14]/RC[-18]*100 -> #VALUE! | AC52: =VALUE(RC[-27]) -> #VALUE! | AD52: =IF(RC[21]=42,"*",IF(RC[21]=32,"",RC[21])) ->  | AE52: =RC[-28] ->  | AF52: =RC[-28] ->  | AG52: =RC[-28] ->  | AH52: =RC[-28] ->  | AI52: =RC[-28] ->  | AJ52: =RC[-28] ->  | AK52: =RC[-28] ->  | AL52: =RC[-28] -> 0 | AM52: =RC[-28] -> #VALUE! | AN52: =RC[-28] -> 0 | AO52: =RC[-28] -> 0 | AP52: - | AQ52: =RC[-29] -> 0 | AR52: =RC[-29] -> 0 | AS52: - | AT52: =RC[-30] -> 0 | AU52: =RC[-30] -> 0 | AV52: =RC[-30] -> 0 | AW52: =RC[-30] -> #VALUE!
A53: =IF(RC[1]="","",DATEVALUE(RC[1])) ->  | K53: =RC[-7]-RC[-4] -> #VALUE! | S53: =RC[1] -> #VALUE! | T53: =(RC[-16]*RC[-15]-RC[-13]*RC[-12])/1000 -> #VALUE! | W53: =RC[-2]*RC[-10]/1000 -> #VALUE! | X53: =ABS((RC[-3]*RC[-11]-RC[-2]*RC[-9])/1000) -> #VALUE! | Y53: =RC[-14]/RC[-18]*100 -> #VALUE! | AC53: =VALUE(RC[-27]) -> #VALUE! | AD53: =IF(RC[21]=42,"*",IF(RC[21]=32,"",RC[21])) ->  | AE53: =RC[-28] ->  | AF53: =RC[-28] ->  | AG53: =RC[-28] ->  | AH53: =RC[-28] ->  | AI53: =RC[-28] ->  | AJ53: =RC[-28] ->  | AK53: =RC[-28] ->  | AL53: =RC[-28] -> 0 | AM53: =RC[-28] -> #VALUE! | AN53: =RC[-28] -> 0 | AO53: =RC[-28] -> 0 | AP53: - | AQ53: =RC[-29] -> 0 | AR53: =RC[-29] -> 0 | AS53: - | AT53: =RC[-30] -> 0 | AU53: =RC[-30] -> 0 | AV53: =RC[-30] -> 0 | AW53: =RC[-30] -> #VALUE!
A54: =IF(RC[1]="","",DATEVALUE(RC[1])) ->  | K54: =RC[-7]-RC[-4] -> #VALUE! | S54: =RC[1] -> #VALUE! | T54: =(RC[-16]*RC[-15]-RC[-13]*RC[-12])/1000 -> #VALUE! | W54: =RC[-2]*RC[-10]/1000 -> #VALUE! | X54: =ABS((RC[-3]*RC[-11]-RC[-2]*RC[-9])/1000) -> #VALUE! | Y54: =RC[-14]/RC[-18]*100 -> #VALUE! | AC54: =VALUE(RC[-27]) -> #VALUE! | AD54: =IF(RC[21]=42,"*",IF(RC[21]=32,"",RC[21])) ->  | AE54: =RC[-28] ->  | AF54: =RC[-28] ->  | AG54: =RC[-28] ->  | AH54: =RC[-28] ->  | AI54: =RC[-28] ->  | AJ54: =RC[-28] ->  | AK54: =RC[-28] ->  | AL54: =RC[-28] -> 0 | AM54: =RC[-28] -> #VALUE! | AN54: =RC[-28] -> 0 | AO54: =RC[-28] -> 0 | AP54: - | AQ54: =RC[-29] -> 0 | AR54: =RC[-29] -> 0 | AS54: - | AT54: =RC[-30] -> 0 | AU54: =RC[-30] -> 0 | AV54: =RC[-30] -> 0 | AW54: =RC[-30] -> #VALUE!
A55: =IF(RC[1]="","",DATEVALUE(RC[1])) ->  | K55: =RC[-7]-RC[-4] -> #VALUE! | S55: =RC[1] -> #VALUE! | T55: =(RC[-16]*RC[-15]-RC[-13]*RC[-12])/1000 -> #VALUE! | W55: =RC[-2]*RC[-10]/1000 -> #VALUE! | X55: =ABS((RC[-3]*RC[-11]-RC[-2]*RC[-9])/1000) -> #VALUE! | Y55: =RC[-14]/RC[-18]*100 -> #VALUE! | AC55: =VALUE(RC[-27]) -> #VALUE! | AD55: =IF(RC[21]=42,"*",IF(RC[21]=32,"",RC[21])) ->  | AE55: =RC[-28] ->  | AF55: =RC[-28] ->  | AG55: =RC[-28] ->  | AH55: =RC[-28] ->  | AI55: =RC[-28] ->  | AJ55: =RC[-28] ->  | AK55: =RC[-28] ->  | AL55: =RC[-28] -> 0 | AM55: =RC[-28] -> #VALUE! | AN55: =RC[-28] -> 0 | AO55: =RC[-28] -> 0 | AP55: - | AQ55: =RC[-29] -> 0 | AR55: =RC[-29] -> 0 | AS55: - | AT55: =RC[-30] -> 0 | AU55: =RC[-30] -> 0 | AV55: =RC[-30] -> 0 | AW55: =RC[-30] -> #VALUE!
A56: =IF(RC[1]="","",DATEVALUE(RC[1])) ->  | K56: =RC[-7]-RC[-4] -> #VALUE! | S56: =RC[1] -> #VALUE! | T56: =(RC[-16]*RC[-15]-RC[-13]*RC[-12])/1000 -> #VALUE! | W56: =RC[-2]*RC[-10]/1000 -> #VALUE! | X56: =ABS((RC[-3]*RC[-11]-RC[-2]*RC[-9])/1000) -> #VALUE! | Y56: =RC[-14]/RC[-18]*100 -> #VALUE! | AC56: =VALUE(RC[-27]) -> #VALUE! | AD56: =IF(RC[21]=42,"*",IF(RC[21]=32,"",RC[21])) ->  | AE56: =RC[-28] ->  | AF56: =RC[-28] ->  | AG56: =RC[-28] ->  | AH56: =RC[-28] ->  | AI56: =RC[-28] ->  | AJ56: =RC[-28] ->  | AK56: =RC[-28] ->  | AL56: =RC[-28] -> 0 | AM56: =RC[-28] -> #VALUE! | AN56: =RC[-28] -> 0 | AO56: =RC[-28] -> 0 | AP56: - | AQ56: =RC[-29] -> 0 | AR56: =RC[-29] -> 0 | AS56: - | AT56: =RC[-30] -> 0 | AU56: =RC[-30] -> 0 | AV56: =RC[-30] -> 0 | AW56: =RC[-30] -> #VALUE!
A57: =IF(RC[1]="","",DATEVALUE(RC[1])) ->  | K57: =RC[-7]-RC[-4] -> #VALUE! | S57: =RC[1] -> #VALUE! | T57: =(RC[-16]*RC[-15]-RC[-13]*RC[-12])/1000 -> #VALUE! | W57: =RC[-2]*RC[-10]/1000 -> #VALUE! | X57: =ABS((RC[-3]*RC[-11]-RC[-2]*RC[-9])/1000) -> #VALUE! | Y57: =RC[-14]/RC[-18]*100 -> #VALUE! | AC57: =VALUE(RC[-27]) -> #VALUE! | AD57: =IF(RC[21]=42,"*",IF(RC[21]=32,"",RC[21])) ->  | AE57: =RC[-28] ->  | AF57: =RC[-28] ->  | AG57: =RC[-28] ->  | AH57: =RC[-28] ->  | AI57: =RC[-28] ->  | AJ57: =RC[-28] ->  | AK57: =RC[-28] ->  | AL57: =RC[-28] -> 0 | AM57: =RC[-28] -> #VALUE! | AN57: =RC[-28] -> 0 | AO57: =RC[-28] -> 0 | AP57: - | AQ57: =RC[-29] -> 0 | AR57: =RC[-29] -> 0 | AS57: - | AT57: =RC[-30] -> 0 | AU57: =RC[-30] -> 0 | AV57: =RC[-30] -> 0 | AW57: =RC[-30] -> #VALUE!
A58: =IF(RC[1]="","",DATEVALUE(RC[1])) ->  | K58: =RC[-7]-RC[-4] -> #VALUE! | S58: =RC[1] -> #VALUE! | T58: =(RC[-16]*RC[-15]-RC[-13]*RC[-12])/1000 -> #VALUE! | W58: =RC[-2]*RC[-10]/1000 -> #VALUE! | X58: =ABS((RC[-3]*RC[-11]-RC[-2]*RC[-9])/1000) -> #VALUE! | Y58: =RC[-14]/RC[-18]*100 -> #VALUE! | AC58: =VALUE(RC[-27]) -> #VALUE! | AD58: =IF(RC[21]=42,"*",IF(RC[21]=32,"",RC[21])) ->  | AE58: =RC[-28] ->  | AF58: =RC[-28] ->  | AG58: =RC[-28] ->  | AH58: =RC[-28] ->  | AI58: =RC[-28] ->  | AJ58: =RC[-28] ->  | AK58: =RC[-28] ->  | AL58: =RC[-28] -> 0 | AM58: =RC[-28] -> #VALUE! | AN58: =RC[-28] -> 0 | AO58: =RC[-28] -> 0 | AP58: - | AQ58: =RC[-29] -> 0 | AR58: =RC[-29] -> 0 | AS58: - | AT58: =RC[-30] -> 0 | AU58: =RC[-30] -> 0 | AV58: =RC[-30] -> 0 | AW58: =RC[-30] -> #VALUE!
A59: =IF(RC[1]="","",DATEVALUE(RC[1])) ->  | K59: =RC[-7]-RC[-4] -> #VALUE! | S59: =RC[1] -> #VALUE! | T59: =(RC[-16]*RC[-15]-RC[-13]*RC[-12])/1000 -> #VALUE! | W59: =RC[-2]*RC[-10]/1000 -> #VALUE! | X59: =ABS((RC[-3]*RC[-11]-RC[-2]*RC[-9])/1000) -> #VALUE! | Y59: =RC[-14]/RC[-18]*100 -> #VALUE! | AC59: =VALUE(RC[-27]) -> #VALUE! | AD59: =IF(RC[21]=42,"*",IF(RC[21]=32,"",RC[21])) ->  | AE59: =RC[-28] ->  | AF59: =RC[-28] ->  | AG59: =RC[-28] ->  | AH59: =RC[-28] ->  | AI59: =RC[-28] ->  | AJ59: =RC[-28] ->  | AK59: =RC[-28] ->  | AL59: =RC[-28] -> 0 | AM59: =RC[-28] -> #VALUE! | AN59: =RC[-28] -> 0 | AO59: =RC[-28] -> 0 | AP59: - | AQ59: =RC[-29] -> 0 | AR59: =RC[-29] -> 0 | AS59: - | AT59: =RC[-30] -> 0 | AU59: =RC[-30] -> 0 | AV59: =RC[-30] -> 0 | AW59: =RC[-30] -> #VALUE!
A60: =IF(RC[1]="","",DATEVALUE(RC[1])) ->  | K60: =RC[-7]-RC[-4] -> #VALUE! | S60: =RC[1] -> #VALUE! | T60: =(RC[-16]*RC[-15]-RC[-13]*RC[-12])/1000 -> #VALUE! | W60: =RC[-2]*RC[-10]/1000 -> #VALUE! | X60: =ABS((RC[-3]*RC[-11]-RC[-2]*RC[-9])/1000) -> #VALUE! | Y60: =RC[-14]/RC[-18]*100 -> #VALUE! | AC60: =VALUE(RC[-27]) -> #VALUE! | AD60: =IF(RC[21]=42,"*",IF(RC[21]=32,"",RC[21])) ->  | AE60: =RC[-28] ->  | AF60: =RC[-28] ->  | AG60: =RC[-28] ->  | AH60: =RC[-28] ->  | AI60: =RC[-28] ->  | AJ60: =RC[-28] ->  | AK60: =RC[-28] ->  | AL60: =RC[-28] -> 0 | AM60: =RC[-28] -> #VALUE! | AN60: =RC[-28] -> 0 | AO60: =RC[-28] -> 0 | AP60: - | AQ60: =RC[-29] -> 0 | AR60: =RC[-29] -> 0 | AS60: - | AT60: =RC[-30] -> 0 | AU60: =RC[-30] -> 0 | AV60: =RC[-30] -> 0 | AW60: =RC[-30] -> #VALUE!
A61: =IF(RC[1]="","",DATEVALUE(RC[1])) ->  | K61: =RC[-7]-RC[-4] -> #VALUE! | S61: =RC[1] -> #VALUE! | T61: =(RC[-16]*RC[-15]-RC[-13]*RC[-12])/1000 -> #VALUE! | W61: =RC[-2]*RC[-10]/1000 -> #VALUE! | X61: =ABS((RC[-3]*RC[-11]-RC[-2]*RC[-9])/1000) -> #VALUE! | Y61: =RC[-14]/RC[-18]*100 -> #VALUE! | AC61: =VALUE(RC[-27]) -> #VALUE! | AD61: =IF(RC[21]=42,"*",IF(RC[21]=32,"",RC[21])) ->  | AE61: =RC[-28] ->  | AF61: =RC[-28] ->  | AG61: =RC[-28] ->  | AH61: =RC[-28] ->  | AI61: =RC[-28] ->  | AJ61: =RC[-28] ->  | AK61: =RC[-28] ->  | AL61: =RC[-28] -> 0 | AM61: =RC[-28] -> #VALUE! | AN61: =RC[-28] -> 0 | AO61: =RC[-28] -> 0 | AP61: - | AQ61: =RC[-29] -> 0 | AR61: =RC[-29] -> 0 | AS61: - | AT61: =RC[-30] -> 0 | AU61: =RC[-30] -> 0 | AV61: =RC[-30] -> 0 | AW61: =RC[-30] -> #VALUE!
A62: =IF(RC[1]="","",DATEVALUE(RC[1])) ->  | K62: =RC[-7]-RC[-4] -> #VALUE! | S62: =RC[1] -> #VALUE! | T62: =(RC[-16]*RC[-15]-RC[-13]*RC[-12])/1000 -> #VALUE! | W62: =RC[-2]*RC[-10]/1000 -> #VALUE! | X62: =ABS((RC[-3]*RC[-11]-RC[-2]*RC[-9])/1000) -> #VALUE! | Y62: =RC[-14]/RC[-18]*100 -> #VALUE! | AC62: =VALUE(RC[-27]) -> #VALUE! | AD62: =IF(RC[21]=42,"*",IF(RC[21]=32,"",RC[21])) ->  | AE62: =RC[-28] ->  | AF62: =RC[-28] ->  | AG62: =RC[-28] ->  | AH62: =RC[-28] ->  | AI62: =RC[-28] ->  | AJ62: =RC[-28] ->  | AK62: =RC[-28] ->  | AL62: =RC[-28] -> 0 | AM62: =RC[-28] -> #VALUE! | AN62: =RC[-28] -> 0 | AO62: =RC[-28] -> 0 | AP62: - | AQ62: =RC[-29] -> 0 | AR62: =RC[-29] -> 0 | AS62: - | AT62: =RC[-30] -> 0 | AU62: =RC[-30] -> 0 | AV62: =RC[-30] -> 0 | AW62: =RC[-30] -> #VALUE!
A63: =IF(RC[1]="","",DATEVALUE(RC[1])) ->  | K63: =RC[-7]-RC[-4] -> #VALUE! | S63: =RC[1] -> #VALUE! | T63: =(RC[-16]*RC[-15]-RC[-13]*RC[-12])/1000 -> #VALUE! | W63: =RC[-2]*RC[-10]/1000 -> #VALUE! | X63: =ABS((RC[-3]*RC[-11]-RC[-2]*RC[-9])/1000) -> #VALUE! | Y63: =RC[-14]/RC[-18]*100 -> #VALUE! | AC63: =VALUE(RC[-27]) -> #VALUE! | AD63: =IF(RC[21]=42,"*",IF(RC[21]=32,"",RC[21])) ->  | AE63: =RC[-28] ->  | AF63: =RC[-28] ->  | AG63: =RC[-28] ->  | AH63: =RC[-28] ->  | AI63: =RC[-28] ->  | AJ63: =RC[-28] ->  | AK63: =RC[-28] ->  | AL63: =RC[-28] -> 0 | AM63: =RC[-28] -> #VALUE! | AN63: =RC[-28] -> 0 | AO63: =RC[-28] -> 0 | AP63: - | AQ63: =RC[-29] -> 0 | AR63: =RC[-29] -> 0 | AS63: - | AT63: =RC[-30] -> 0 | AU63: =RC[-30] -> 0 | AV63: =RC[-30] -> 0 | AW63: =RC[-30] -> #VALUE!
A64: =IF(RC[1]="","",DATEVALUE(RC[1])) ->  | K64: =RC[-7]-RC[-4] -> #VALUE! | S64: =RC[1] -> #VALUE! | T64: =(RC[-16]*RC[-15]-RC[-13]*RC[-12])/1000 -> #VALUE! | W64: =RC[-2]*RC[-10]/1000 -> #VALUE! | X64: =ABS((RC[-3]*RC[-11]-RC[-2]*RC[-9])/1000) -> #VALUE! | Y64: =RC[-14]/RC[-18]*100 -> #VALUE! | AC64: =VALUE(RC[-27]) -> #VALUE! | AD64: =IF(RC[21]=42,"*",IF(RC[21]=32,"",RC[21])) ->  | AE64: =RC[-28] ->  | AF64: =RC[-28] ->  | AG64: =RC[-28] ->  | AH64: =RC[-28] ->  | AI64: =RC[-28] ->  | AJ64: =RC[-28] ->  | AK64: =RC[-28] ->  | AL64: =RC[-28] -> 0 | AM64: =RC[-28] -> #VALUE! | AN64: =RC[-28] -> 0 | AO64: =RC[-28] -> 0 | AP64: - | AQ64: =RC[-29] -> 0 | AR64: =RC[-29] -> 0 | AS64: - | AT64: =RC[-30] -> 0 | AU64: =RC[-30] -> 0 | AV64: =RC[-30] -> 0 | AW64: =RC[-30] -> #VALUE!
A65: =IF(RC[1]="","",DATEVALUE(RC[1])) ->  | K65: =RC[-7]-RC[-4] -> #VALUE! | S65: =RC[1] -> #VALUE! | T65: =(RC[-16]*RC[-15]-RC[-13]*RC[-12])/1000 -> #VALUE! | W65: =RC[-2]*RC[-10]/1000 -> #VALUE! | X65: =ABS((RC[-3]*RC[-11]-RC[-2]*RC[-9])/1000) -> #VALUE! | Y65: =RC[-14]/RC[-18]*100 -> #VALUE! | AC65: =VALUE(RC[-27]) -> #VALUE! | AD65: =IF(RC[21]=42,"*",IF(RC[21]=32,"",RC[21])) ->  | AE65: =RC[-28] ->  | AF65: =RC[-28] ->  | AG65: =RC[-28] ->  | AH65: =RC[-28] ->  | AI65: =RC[-28] ->  | AJ65: =RC[-28] ->  | AK65: =RC[-28] ->  | AL65: =RC[-28] -> 0 | AM65: =RC[-28] -> #VALUE! | AN65: =RC[-28] -> 0 | AO65: =RC[-28] -> 0 | AP65: - | AQ65: =RC[-29] -> 0 | AR65: =RC[-29] -> 0 | AS65: - | AT65: =RC[-30] -> 0 | AU65: =RC[-30] -> 0 | AV65: =RC[-30] -> 0 | AW65: =RC[-30] -> #VALUE!
A66: =IF(RC[1]="","",DATEVALUE(RC[1])) ->  | K66: =RC[-7]-RC[-4] -> #VALUE! | S66: =RC[1] -> #VALUE! | T66: =(RC[-16]*RC[-15]-RC[-13]*RC[-12])/1000 -> #VALUE! | W66: =RC[-2]*RC[-10]/1000 -> #VALUE! | X66: =ABS((RC[-3]*RC[-11]-RC[-2]*RC[-9])/1000) -> #VALUE! | Y66: =RC[-14]/RC[-18]*100 -> #VALUE! | AC66: =VALUE(RC[-27]) -> #VALUE! | AD66: =IF(RC[21]=42,"*",IF(RC[21]=32,"",RC[21])) ->  | AE66: =RC[-28] ->  | AF66: =RC[-28] ->  | AG66: =RC[-28] ->  | AH66: =RC[-28] ->  | AI66: =RC[-28] ->  | AJ66: =RC[-28] ->  | AK66: =RC[-28] ->  | AL66: =RC[-28] -> 0 | AM66: =RC[-28] -> #VALUE! | AN66: =RC[-28] -> 0 | AO66: =RC[-28] -> 0 | AP66: - | AQ66: =RC[-29] -> 0 | AR66: =RC[-29] -> 0 | AS66: - | AT66: =RC[-30] -> 0 | AU66: =RC[-30] -> 0 | AV66: =RC[-30] -> 0 | AW66: =RC[-30] -> #VALUE!
A67: =IF(RC[1]="","",DATEVALUE(RC[1])) ->  | K67: =RC[-7]-RC[-4] -> #VALUE! | S67: =RC[1] -> #VALUE! | T67: =(RC[-16]*RC[-15]-RC[-13]*RC[-12])/1000 -> #VALUE! | W67: =RC[-2]*RC[-10]/1000 -> #VALUE! | X67: =ABS((RC[-3]*RC[-11]-RC[-2]*RC[-9])/1000) -> #VALUE! | Y67: =RC[-14]/RC[-18]*100 -> #VALUE! | AC67: =VALUE(RC[-27]) -> #VALUE! | AD67: =IF(RC[21]=42,"*",IF(RC[21]=32,"",RC[21])) ->  | AE67: =RC[-28] ->  | AF67: =RC[-28] ->  | AG67: =RC[-28] ->  | AH67: =RC[-28] ->  | AI67: =RC[-28] ->  | AJ67: =RC[-28] ->  | AK67: =RC[-28] ->  | AL67: =RC[-28] -> 0 | AM67: =RC[-28] -> #VALUE! | AN67: =RC[-28] -> 0 | AO67: =RC[-28] -> 0 | AP67: - | AQ67: =RC[-29] -> 0 | AR67: =RC[-29] -> 0 | AS67: - | AT67: =RC[-30] -> 0 | AU67: =RC[-30] -> 0 | AV67: =RC[-30] -> 0 | AW67: =RC[-30] -> #VALUE!
A68: =IF(RC[1]="","",DATEVALUE(RC[1])) ->  | K68: =RC[-7]-RC[-4] -> #VALUE! | S68: =RC[1] -> #VALUE! | T68: =(RC[-16]*RC[-15]-RC[-13]*RC[-12])/1000 -> #VALUE! | W68: =RC[-2]*RC[-10]/1000 -> #VALUE! | X68: =ABS((RC[-3]*RC[-11]-RC[-2]*RC[-9])/1000) -> #VALUE! | Y68: =RC[-14]/RC[-18]*100 -> #VALUE! | AC68: =VALUE(RC[-27]) -> #VALUE! | AD68: =IF(RC[21]=42,"*",IF(RC[21]=32,"",RC[21])) ->  | AE68: =RC[-28] ->  | AF68: =RC[-28] ->  | AG68: =RC[-28] ->  | AH68: =RC[-28] ->  | AI68: =RC[-28] ->  | AJ68: =RC[-28] ->  | AK68: =RC[-28] ->  | AL68: =RC[-28] -> 0 | AM68: =RC[-28] -> #VALUE! | AN68: =RC[-28] -> 0 | AO68: =RC[-28] -> 0 | AP68: - | AQ68: =RC[-29] -> 0 | AR68: =RC[-29] -> 0 | AS68: - | AT68: =RC[-30] -> 0 | AU68: =RC[-30] -> 0 | AV68: =RC[-30] -> 0 | AW68: =RC[-30] -> #VALUE!
A69: =IF(RC[1]="","",DATEVALUE(RC[1])) ->  | K69: =RC[-7]-RC[-4] -> #VALUE! | S69: =RC[1] -> #VALUE! | T69: =(RC[-16]*RC[-15]-RC[-13]*RC[-12])/1000 -> #VALUE! | W69: =RC[-2]*RC[-10]/1000 -> #VALUE! | X69: =ABS((RC[-3]*RC[-11]-RC[-2]*RC[-9])/1000) -> #VALUE! | Y69: =RC[-14]/RC[-18]*100 -> #VALUE! | AC69: =VALUE(RC[-27]) -> #VALUE! | AD69: =IF(RC[21]=42,"*",IF(RC[21]=32,"",RC[21])) ->  | AE69: =RC[-28] ->  | AF69: =RC[-28] ->  | AG69: =RC[-28] ->  | AH69: =RC[-28] ->  | AI69: =RC[-28] ->  | AJ69: =RC[-28] ->  | AK69: =RC[-28] ->  | AL69: =RC[-28] -> 0 | AM69: =RC[-28] -> #VALUE! | AN69: =RC[-28] -> 0 | AO69: =RC[-28] -> 0 | AP69: - | AQ69: =RC[-29] -> 0 | AR69: =RC[-29] -> 0 | AS69: - | AT69: =RC[-30] -> 0 | AU69: =RC[-30] -> 0 | AV69: =RC[-30] -> 0 | AW69: =RC[-30] -> #VALUE!
A70: =IF(RC[1]="","",DATEVALUE(RC[1])) ->  | K70: =RC[-7]-RC[-4] -> #VALUE! | S70: =RC[1] -> #VALUE! | T70: =(RC[-16]*RC[-15]-RC[-13]*RC[-12])/1000 -> #VALUE! | W70: =RC[-2]*RC[-10]/1000 -> #VALUE! | X70: =ABS((RC[-3]*RC[-11]-RC[-2]*RC[-9])/1000) -> #VALUE! | Y70: =RC[-14]/RC[-18]*100 -> #VALUE! | AC70: =VALUE(RC[-27]) -> #VALUE! | AD70: =IF(RC[21]=42,"*",IF(RC[21]=32,"",RC[21])) ->  | AE70: =RC[-28] ->  | AF70: =RC[-28] ->  | AG70: =RC[-28] ->  | AH70: =RC[-28] ->  | AI70: =RC[-28] ->  | AJ70: =RC[-28] ->  | AK70: =RC[-28] ->  | AL70: =RC[-28] -> 0 | AM70: =RC[-28] -> #VALUE! | AN70: =RC[-28] -> 0 | AO70: =RC[-28] -> 0 | AP70: - | AQ70: =RC[-29] -> 0 | AR70: =RC[-29] -> 0 | AS70: - | AT70: =RC[-30] -> 0 | AU70: =RC[-30] -> 0 | AV70: =RC[-30] -> 0 | AW70: =RC[-30] -> #VALUE!
A71: =IF(RC[1]="","",DATEVALUE(RC[1])) ->  | K71: =RC[-7]-RC[-4] -> #VALUE! | S71: =RC[1] -> #VALUE! | T71: =(RC[-16]*RC[-15]-RC[-13]*RC[-12])/1000 -> #VALUE! | W71: =RC[-2]*RC[-10]/1000 -> #VALUE! | X71: =ABS((RC[-3]*RC[-11]-RC[-2]*RC[-9])/1000) -> #VALUE! | Y71: =RC[-14]/RC[-18]*100 -> #VALUE! | AC71: =VALUE(RC[-27]) -> #VALUE! | AD71: =IF(RC[21]=42,"*",IF(RC[21]=32,"",RC[21])) ->  | AE71: =RC[-28] ->  | AF71: =RC[-28] ->  | AG71: =RC[-28] ->  | AH71: =RC[-28] ->  | AI71: =RC[-28] ->  | AJ71: =RC[-28] ->  | AK71: =RC[-28] ->  | AL71: =RC[-28] -> 0 | AM71: =RC[-28] -> #VALUE! | AN71: =RC[-28] -> 0 | AO71: =RC[-28] -> 0 | AP71: - | AQ71: =RC[-29] -> 0 | AR71: =RC[-29] -> 0 | AS71: - | AT71: =RC[-30] -> 0 | AU71: =RC[-30] -> 0 | AV71: =RC[-30] -> 0 | AW71: =RC[-30] -> #VALUE!
A72: =IF(RC[1]="","",DATEVALUE(RC[1])) ->  | K72: =RC[-7]-RC[-4] -> #VALUE! | S72: =RC[1] -> #VALUE! | T72: =(RC[-16]*RC[-15]-RC[-13]*RC[-12])/1000 -> #VALUE! | W72: =RC[-2]*RC[-10]/1000 -> #VALUE! | X72: =ABS((RC[-3]*RC[-11]-RC[-2]*RC[-9])/1000) -> #VALUE! | Y72: =RC[-14]/RC[-18]*100 -> #VALUE! | AC72: =VALUE(RC[-27]) -> #VALUE! | AD72: =IF(RC[21]=42,"*",IF(RC[21]=32,"",RC[21])) ->  | AE72: =RC[-28] ->  | AF72: =RC[-28] ->  | AG72: =RC[-28] ->  | AH72: =RC[-28] ->  | AI72: =RC[-28] ->  | AJ72: =RC[-28] ->  | AK72: =RC[-28] ->  | AL72: =RC[-28] -> 0 | AM72: =RC[-28] -> #VALUE! | AN72: =RC[-28] -> 0 | AO72: =RC[-28] -> 0 | AP72: - | AQ72: =RC[-29] -> 0 | AR72: =RC[-29] -> 0 | AS72: - | AT72: =RC[-30] -> 0 | AU72: =RC[-30] -> 0 | AV72: =RC[-30] -> 0 | AW72: =RC[-30] -> #VALUE!
A73: =IF(RC[1]="","",DATEVALUE(RC[1])) ->  | K73: =RC[-7]-RC[-4] -> #VALUE! | S73: =RC[1] -> #VALUE! | T73: =(RC[-16]*RC[-15]-RC[-13]*RC[-12])/1000 -> #VALUE! | W73: =RC[-2]*RC[-10]/1000 -> #VALUE! | X73: =ABS((RC[-3]*RC[-11]-RC[-2]*RC[-9])/1000) -> #VALUE! | Y73: =RC[-14]/RC[-18]*100 -> #VALUE! | AC73: =VALUE(RC[-27]) -> #VALUE! | AD73: =IF(RC[21]=42,"*",IF(RC[21]=32,"",RC[21])) ->  | AE73: =RC[-28] ->  | AF73: =RC[-28] ->  | AG73: =RC[-28] ->  | AH73: =RC[-28] ->  | AI73: =RC[-28] ->  | AJ73: =RC[-28] ->  | AK73: =RC[-28] ->  | AL73: =RC[-28] -> 0 | AM73: =RC[-28] -> #VALUE! | AN73: =RC[-28] -> 0 | AO73: =RC[-28] -> 0 | AP73: - | AQ73: =RC[-29] -> 0 | AR73: =RC[-29] -> 0 | AS73: - | AT73: =RC[-30] -> 0 | AU73: =RC[-30] -> 0 | AV73: =RC[-30] -> 0 | AW73: =RC[-30] -> #VALUE!
A74: =IF(RC[1]="","",DATEVALUE(RC[1])) ->  | K74: =RC[-7]-RC[-4] -> #VALUE! | S74: =RC[1] -> #VALUE! | T74: =(RC[-16]*RC[-15]-RC[-13]*RC[-12])/1000 -> #VALUE! | W74: =RC[-2]*RC[-10]/1000 -> #VALUE! | X74: =ABS((RC[-3]*RC[-11]-RC[-2]*RC[-9])/1000) -> #VALUE! | Y74: =RC[-14]/RC[-18]*100 -> #VALUE! | AC74: =VALUE(RC[-27]) -> #VALUE! | AD74: =IF(RC[21]=42,"*",IF(RC[21]=32,"",RC[21])) ->  | AE74: =RC[-28] ->  | AF74: =RC[-28] ->  | AG74: =RC[-28] ->  | AH74: =RC[-28] ->  | AI74: =RC[-28] ->  | AJ74: =RC[-28] ->  | AK74: =RC[-28] ->  | AL74: =RC[-28] -> 0 | AM74: =RC[-28] -> #VALUE! | AN74: =RC[-28] -> 0 | AO74: =RC[-28] -> 0 | AP74: - | AQ74: =RC[-29] -> 0 | AR74: =RC[-29] -> 0 | AS74: - | AT74: =RC[-30] -> 0 | AU74: =RC[-30] -> 0 | AV74: =RC[-30] -> 0 | AW74: =RC[-30] -> #VALUE!
A75: =IF(RC[1]="","",DATEVALUE(RC[1])) ->  | K75: =RC[-7]-RC[-4] -> #VALUE! | S75: =RC[1] -> #VALUE! | T75: =(RC[-16]*RC[-15]-RC[-13]*RC[-12])/1000 -> #VALUE! | W75: =RC[-2]*RC[-10]/1000 -> #VALUE! | X75: =ABS((RC[-3]*RC[-11]-RC[-2]*RC[-9])/1000) -> #VALUE! | Y75: =RC[-14]/RC[-18]*100 -> #VALUE! | AC75: =VALUE(RC[-27]) -> #VALUE! | AD75: =IF(RC[21]=42,"*",IF(RC[21]=32,"",RC[21])) ->  | AE75: =RC[-28] ->  | AF75: =RC[-28] ->  | AG75: =RC[-28] ->  | AH75: =RC[-28] ->  | AI75: =RC[-28] ->  | AJ75: =RC[-28] ->  | AK75: =RC[-28] ->  | AL75: =RC[-28] -> 0 | AM75: =RC[-28] -> #VALUE! | AN75: =RC[-28] -> 0 | AO75: =RC[-28] -> 0 | AP75: - | AQ75: =RC[-29] -> 0 | AR75: =RC[-29] -> 0 | AS75: - | AT75: =RC[-30] -> 0 | AU75: =RC[-30] -> 0 | AV75: =RC[-30] -> 0 | AW75: =RC[-30] -> #VALUE!
A76: =IF(RC[1]="","",DATEVALUE(RC[1])) ->  | K76: =RC[-7]-RC[-4] -> #VALUE! | S76: =RC[1] -> #VALUE! | T76: =(RC[-16]*RC[-15]-RC[-13]*RC[-12])/1000 -> #VALUE! | W76: =RC[-2]*RC[-10]/1000 -> #VALUE! | X76: =ABS((RC[-3]*RC[-11]-RC[-2]*RC[-9])/1000) -> #VALUE! | Y76: =RC[-14]/RC[-18]*100 -> #VALUE! | AC76: =VALUE(RC[-27]) -> #VALUE! | AD76: =IF(RC[21]=42,"*",IF(RC[21]=32,"",RC[21])) ->  | AE76: =RC[-28] ->  | AF76: =RC[-28] ->  | AG76: =RC[-28] ->  | AH76: =RC[-28] ->  | AI76: =RC[-28] ->  | AJ76: =RC[-28] ->  | AK76: =RC[-28] ->  | AL76: =RC[-28] -> 0 | AM76: =RC[-28] -> #VALUE! | AN76: =RC[-28] -> 0 | AO76: =RC[-28] -> 0 | AP76: - | AQ76: =RC[-29] -> 0 | AR76: =RC[-29] -> 0 | AS76: - | AT76: =RC[-30] -> 0 | AU76: =RC[-30] -> 0 | AV76: =RC[-30] -> 0 | AW76: =RC[-30] -> #VALUE!
A77: =IF(RC[1]="","",DATEVALUE(RC[1])) ->  | K77: =RC[-7]-RC[-4] -> #VALUE! | S77: =RC[1] -> #VALUE! | T77: =(RC[-16]*RC[-15]-RC[-13]*RC[-12])/1000 -> #VALUE! | W77: =RC[-2]*RC[-10]/1000 -> #VALUE! | X77: =ABS((RC[-3]*RC[-11]-RC[-2]*RC[-9])/1000) -> #VALUE! | Y77: =RC[-14]/RC[-18]*100 -> #VALUE! | AC77: =VALUE(RC[-27]) -> #VALUE! | AD77: =IF(RC[21]=42,"*",IF(RC[21]=32,"",RC[21])) ->  | AE77: =RC[-28] ->  | AF77: =RC[-28] ->  | AG77: =RC[-28] ->  | AH77: =RC[-28] ->  | AI77: =RC[-28] ->  | AJ77: =RC[-28] ->  | AK77: =RC[-28] ->  | AL77: =RC[-28] -> 0 | AM77: =RC[-28] -> #VALUE! | AN77: =RC[-28] -> 0 | AO77: =RC[-28] -> 0 | AP77: - | AQ77: =RC[-29] -> 0 | AR77: =RC[-29] -> 0 | AS77: - | AT77: =RC[-30] -> 0 | AU77: =RC[-30] -> 0 | AV77: =RC[-30] -> 0 | AW77: =RC[-30] -> #VALUE!
A78: =IF(RC[1]="","",DATEVALUE(RC[1])) ->  | K78: =RC[-7]-RC[-4] -> #VALUE! | S78: =RC[1] -> #VALUE! | T78: =(RC[-16]*RC[-15]-RC[-13]*RC[-12])/1000 -> #VALUE! | W78: =RC[-2]*RC[-10]/1000 -> #VALUE! | X78: =ABS((RC[-3]*RC[-11]-RC[-2]*RC[-9])/1000) -> #VALUE! | Y78: =RC[-14]/RC[-18]*100 -> #VALUE! | AC78: =VALUE(RC[-27]) -> #VALUE! | AD78: =IF(RC[21]=42,"*",IF(RC[21]=32,"",RC[21])) ->  | AE78: =RC[-28] ->  | AF78: =RC[-28] ->  | AG78: =RC[-28] ->  | AH78: =RC[-28] ->  | AI78: =RC[-28] ->  | AJ78: =RC[-28] ->  | AK78: =RC[-28] ->  | AL78: =RC[-28] -> 0 | AM78: =RC[-28] -> #VALUE! | AN78: =RC[-28] -> 0 | AO78: =RC[-28] -> 0 | AP78: - | AQ78: =RC[-29] -> 0 | AR78: =RC[-29] -> 0 | AS78: - | AT78: =RC[-30] -> 0 | AU78: =RC[-30] -> 0 | AV78: =RC[-30] -> 0 | AW78: =RC[-30] -> #VALUE!
A79: =IF(RC[1]="","",DATEVALUE(RC[1])) ->  | K79: =RC[-7]-RC[-4] -> #VALUE! | S79: =RC[1] -> #VALUE! | T79: =(RC[-16]*RC[-15]-RC[-13]*RC[-12])/1000 -> #VALUE! | W79: =RC[-2]*RC[-10]/1000 -> #VALUE! | X79: =ABS((RC[-3]*RC[-11]-RC[-2]*RC[-9])/1000) -> #VALUE! | Y79: =RC[-14]/RC[-18]*100 -> #VALUE! | AC79: =VALUE(RC[-27]) -> #VALUE! | AD79: =IF(RC[21]=42,"*",IF(RC[21]=32,"",RC[21])) ->  | AE79: =RC[-28] ->  | AF79: =RC[-28] ->  | AG79: =RC[-28] ->  | AH79: =RC[-28] ->  | AI79: =RC[-28] ->  | AJ79: =RC[-28] ->  | AK79: =RC[-28] ->  | AL79: =RC[-28] -> 0 | AM79: =RC[-28] -> #VALUE! | AN79: =RC[-28] -> 0 | AO79: =RC[-28] -> 0 | AP79: - | AQ79: =RC[-29] -> 0 | AR79: =RC[-29] -> 0 | AS79: - | AT79: =RC[-30] -> 0 | AU79: =RC[-30] -> 0 | AV79: =RC[-30] -> 0 | AW79: =RC[-30] -> #VALUE!
A80: =IF(RC[1]="","",DATEVALUE(RC[1])) ->  | K80: =RC[-7]-RC[-4] -> #VALUE! | S80: =RC[1] -> #VALUE! | T80: =(RC[-16]*RC[-15]-RC[-13]*RC[-12])/1000 -> #VALUE! | W80: =RC[-2]*RC[-10]/1000 -> #VALUE! | X80: =ABS((RC[-3]*RC[-11]-RC[-2]*RC[-9])/1000) -> #VALUE! | Y80: =RC[-14]/RC[-18]*100 -> #VALUE! | AC80: =VALUE(RC[-27]) -> #VALUE! | AD80: =IF(RC[21]=42,"*",IF(RC[21]=32,"",RC[21])) ->  | AE80: =RC[-28] ->  | AF80: =RC[-28] ->  | AG80: =RC[-28] ->  | AH80: =RC[-28] ->  | AI80: =RC[-28] ->  | AJ80: =RC[-28] ->  | AK80: =RC[-28] ->  | AL80: =RC[-28] -> 0 | AM80: =RC[-28] -> #VALUE! | AN80: =RC[-28] -> 0 | AO80: =RC[-28] -> 0 | AP80: - | AQ80: =RC[-29] -> 0 | AR80: =RC[-29] -> 0 | AS80: - | AT80: =RC[-30] -> 0 | AU80: =RC[-30] -> 0 | AV80: =RC[-30] -> 0 | AW80: =RC[-30] -> #VALUE!
A81: =IF(RC[1]="","",DATEVALUE(RC[1])) ->  | K81: =RC[-7]-RC[-4] -> #VALUE! | S81: =RC[1] -> #VALUE! | T81: =(RC[-16]*RC[-15]-RC[-13]*RC[-12])/1000 -> #VALUE! | W81: =RC[-2]*RC[-10]/1000 -> #VALUE! | X81: =ABS((RC[-3]*RC[-11]-RC[-2]*RC[-9])/1000) -> #VALUE! | Y81: =RC[-14]/RC[-18]*100 -> #VALUE! | AC81: =VALUE(RC[-27]) -> #VALUE! | AD81: =IF(RC[21]=42,"*",IF(RC[21]=32,"",RC[21])) ->  | AE81: =RC[-28] ->  | AF81: =RC[-28] ->  | AG81: =RC[-28] ->  | AH81: =RC[-28] ->  | AI81: =RC[-28] ->  | AJ81: =RC[-28] ->  | AK81: =RC[-28] ->  | AL81: =RC[-28] -> 0 | AM81: =RC[-28] -> #VALUE! | AN81: =RC[-28] -> 0 | AO81: =RC[-28] -> 0 | AP81: - | AQ81: =RC[-29] -> 0 | AR81: =RC[-29] -> 0 | AS81: - | AT81: =RC[-30] -> 0 | AU81: =RC[-30] -> 0 | AV81: =RC[-30] -> 0 | AW81: =RC[-30] -> #VALUE!
A82: =IF(RC[1]="","",DATEVALUE(RC[1])) ->  | K82: =RC[-7]-RC[-4] -> #VALUE! | S82: =RC[1] -> #VALUE! | T82: =(RC[-16]*RC[-15]-RC[-13]*RC[-12])/1000 -> #VALUE! | W82: =RC[-2]*RC[-10]/1000 -> #VALUE! | X82: =ABS((RC[-3]*RC[-11]-RC[-2]*RC[-9])/1000) -> #VALUE! | Y82: =RC[-14]/RC[-18]*100 -> #VALUE! | AC82: =VALUE(RC[-27]) -> #VALUE! | AD82: =IF(RC[21]=42,"*",IF(RC[21]=32,"",RC[21])) ->  | AE82: =RC[-28] ->  | AF82: =RC[-28] ->  | AG82: =RC[-28] ->  | AH82: =RC[-28] ->  | AI82: =RC[-28] ->  | AJ82: =RC[-28] ->  | AK82: =RC[-28] ->  | AL82: =RC[-28] -> 0 | AM82: =RC[-28] -> #VALUE! | AN82: =RC[-28] -> 0 | AO82: =RC[-28] -> 0 | AP82: - | AQ82: =RC[-29] -> 0 | AR82: =RC[-29] -> 0 | AS82: - | AT82: =RC[-30] -> 0 | AU82: =RC[-30] -> 0 | AV82: =RC[-30] -> 0 | AW82: =RC[-30] -> #VALUE!
A83: =IF(RC[1]="","",DATEVALUE(RC[1])) ->  | K83: =RC[-7]-RC[-4] -> #VALUE! | S83: =RC[1] -> #VALUE! | T83: =(RC[-16]*RC[-15]-RC[-13]*RC[-12])/1000 -> #VALUE! | W83: =RC[-2]*RC[-10]/1000 -> #VALUE! | X83: =ABS((RC[-3]*RC[-11]-RC[-2]*RC[-9])/1000) -> #VALUE! | Y83: =RC[-14]/RC[-18]*100 -> #VALUE! | AC83: =VALUE(RC[-27]) -> #VALUE! | AD83: =IF(RC[21]=42,"*",IF(RC[21]=32,"",RC[21])) ->  | AE83: =RC[-28] ->  | AF83: =RC[-28] ->  | AG83: =RC[-28] ->  | AH83: =RC[-28] ->  | AI83: =RC[-28] ->  | AJ83: =RC[-28] ->  | AK83: =RC[-28] ->  | AL83: =RC[-28] -> 0 | AM83: =RC[-28] -> #VALUE! | AN83: =RC[-28] -> 0 | AO83: =RC[-28] -> 0 | AP83: - | AQ83: =RC[-29] -> 0 | AR83: =RC[-29] -> 0 | AS83: - | AT83: =RC[-30] -> 0 | AU83: =RC[-30] -> 0 | AV83: =RC[-30] -> 0 | AW83: =RC[-30] -> #VALUE!
AC84: Среднее | AF84: =R[1]C[-28] -> 165.8912036333333 | AG84: =R[1]C[-28] -> 64.048096566666658 | AH84: =R[1]C[-28] -> 6.5 | AI84: =R[1]C[-28] -> 166.8405396 | AJ84: =R[1]C[-28] -> 42.822135166666655 | AK84: =R[1]C[-28] -> 4.4000000000000021 | AL84: =R[1]C[-28] -> 21.225961399999996 | AM84: =R[1]C[-28] -> -0.94933596666666731 | AN84: =R[1]C[-28] -> 0 | AO84: =R[1]C[-28] -> 0 | AP84: - | AQ84: =R[1]C[-29] -> 0 | AR84: =R[1]C[-29] -> 0 | AS84: - | AT84: =R[1]C[-30] -> 0 | AU84: =R[1]C[-30] -> 0
B85: Среднее | D85: =AVERAGE(OFFSET(R[-74]C,3,0,R7C1,1)) -> 165.8912036333333 | E85: =AVERAGE(OFFSET(R[-74]C,3,0,R7C1,1)) -> 64.048096566666658 | F85: =AVERAGE(OFFSET(R[-74]C,3,0,R7C1,1)) -> 6.5 | G85: =AVERAGE(OFFSET(R[-74]C,3,0,R7C1,1)) -> 166.8405396 | H85: =AVERAGE(OFFSET(R[-74]C,3,0,R7C1,1)) -> 42.822135166666655 | I85: =AVERAGE(OFFSET(R[-74]C,3,0,R7C1,1)) -> 4.4000000000000021 | J85: =AVERAGE(OFFSET(R[-74]C,3,0,R7C1,1)) -> 21.225961399999996 | K85: =AVERAGE(OFFSET(R[-74]C,3,0,R7C1,1)) -> -0.94933596666666731 | S85: =AVERAGE(OFFSET(R[-74]C,3,0,R7C1,1)) -> 3.852406737832851 | T85: =AVERAGE(OFFSET(R[-74]C,3,0,R7C1,1)) -> 3.852406737832851 | W85: =AVERAGE(OFFSET(R[-74]C,3,0,R7C1,1)) -> #VALUE! | X85: =AVERAGE(OFFSET(R[-74]C,3,0,R7C1,1)) -> #VALUE! | AC85: Итого | AE85: =R[1]C[-28] -> 720 | AF85: =R[1]C[-28] -> 4976.7361089999995 | AI85: =R[1]C[-28] -> 5005.2161880000003 | AM85: =R[1]C[-28] -> -28.480079000000018 | AN85: =R[1]C[-28] -> 0 | AQ85: =R[1]C[-29] -> 0 | AU85: =R[1]C[-30] -> 0 | AV85: =R[1]C[-30] -> 0 | AW85: =R[1]C[-30] -> 115.57220213498553
B86: ИТОГО: | C86: =SUM(OFFSET(R[-75]C,3,0,R7C1,1)) -> 720 | D86: =SUM(OFFSET(R[-75]C,3,0,R7C1,1)) -> 4976.7361089999995 | G86: =SUM(OFFSET(R[-75]C,3,0,R7C1,1)) -> 5005.2161880000003 | K86: =SUM(OFFSET(R[-75]C,3,0,R7C1,1)) -> -28.480079000000018 | S86: =SUM(OFFSET(R[-75]C,3,0,R7C1,1)) -> 115.57220213498553 | T86: =SUM(OFFSET(R[-75]C,3,0,R7C1,1)) -> 115.57220213498553 | W86: =SUM(OFFSET(R[-75]C,3,0,R7C1,1)) -> #VALUE! | X86: =SUM(OFFSET(R[-75]C,3,0,R7C1,1)) -> #VALUE!
AC87: Досчёт | AF87: =R[1]C[-28] -> 0 | AI87: =R[1]C[-28] -> 0 | AM87: =R[1]C[-28] -> 0 | AN87: =R[1]C[-28] -> 0 | AQ87: =R[1]C[-29] -> 0 | AU87: =R[1]C[-30] -> 0 | AV87: =R[1]C[-30] -> 0 | AW87: =R[1]C[-30] -> 0
A88: 11дн=264ч 4дн=96ч | B88: Досчёт до конца м-ца (+) | C88: =R6C1*24 -> 216 | T88: № 03013 | AC88: Снятие | AF88: =-R[1]C[-28] -> 0 | AI88: =-R[1]C[-28] -> 0 | AM88: =-R[1]C[-28] -> 0 | AN88: =-R[1]C[-28] -> 0 | AQ88: =-R[1]C[-29] -> 0 | AU88: =-R[1]C[-30] -> 0 | AV88: =-R[1]C[-30] -> 0 | AW88: =-R[1]C[-30] -> 0
A89: 9дн=216ч 7дн=168ч | B89: Вычет с предыдущего (-) | C89: =R4C1*24 -> 192 | AC89: Сумма | AF89: =R[1]C[-28] -> 4976.7361089999995 | AI89: =R[1]C[-28] -> 5005.2161880000003 | AM89: =R[1]C[-28] -> -28.480079000000018 | AN89: =R[1]C[-28] -> 0 | AQ89: =R[1]C[-29] -> 0 | AU89: =R[1]C[-30] -> 0 | AV89: =R[1]C[-30] -> 0 | AW89: =R[1]C[-30] -> 115.57220213498553
B90: СУММА: | C90: =R[-4]C+R[-2]C-R[-1]C -> 744 | D90: =R[-4]C+R[-2]C-R[-1]C -> 4976.7361089999995 | G90: =R[-4]C+R[-2]C-R[-1]C -> 5005.2161880000003 | K90: =R[-4]C+R[-2]C-R[-1]C -> -28.480079000000018 | S90: =R[-4]C+R[-2]C-R[-1]C -> 115.57220213498553
AC91: Тхв на источнике | AE91: V гвс (м3) | AF91: =R[-2]C[15] -> 0 | AG91: W гвс (Гкал) | AH91: =RC[-2]*0.06 -> 0 | AI91: W без гвс (Гкал) | AJ91: =R[-2]C[13]-RC[-2] -> 115.57220213498553
B92: Показания счетчиков на момент снятия данных:
B93: Дата, время | D93: М1, т | F93: М2, т | H93: М3, т | J93: М4, т | L93: Qо, Гкал | N93: Qг, Гкал | P93: время, час
B94: 23.09.18 00:00 | D94: 83592.973190000004 | F94: 84533.238899999997 | H94: - | J94: - | L94: 4995.9990600000001 | N94: - | P94: -
B95: 18.10.18 01:00 | D95: 87591.681150000004 | F95: 88564.158580000003 | H95: - | J95: - | L95: 5093.7084800000002 | N95: - | P95: -
AC97: =ZAYAVKA_N -> з.н д. №02/147-2783 от 04.10.18
B98: Представитель потребителя:_______________________________________________________________________ В.О. Топорков
I101: Рекомендуемые значения по параметрам теплопотребления (не являются официально утверждёнными)
I102: М, т | J102: V, м3 | K102: Qгвс, Гкал | L102: Qотоп, Гкал | M102: Qо, Гкал
I103: =R[-13]C[-3] -> 0 | J103: =RC[-1]/0.98 -> 0 | K103: =RC[-1]*0.06 -> 0 | L103: =RC[1]-RC[-1] -> 0 | M103: =R[-13]C[5] -> 0
O105: ДЛЯ САМОКОНТРОЛЯ
B106: В строке выбора дат указать период с 16.7.13 по 23.8.13 - жильё | N106: Q | O106: Qг
B107: В строке выбора дат указать период с 18.7.13 по 25.8.13 - не жилое | N107: =(R[-21]C[-10]*R[-22]C[-7]-R[-21]C[-9]*R[-22]C[-6])/1000 -> 830.32133787236432 | O107: =IF(R[-22]C[-2]="",R[-21]C[-3]*R[-22]C/1000,"") -> 0 | P107: Си2
O108: =IF(R[-23]C[-2]="","",((R[-22]C[-3]*R[-23]C)-(R[-22]C[-2]*R[-23]C[2]))/1000) ->  | P108: Си3