Sheet: Лист1
G1: Отчёт о теплопотреблении за октябрь 2018 | M1: з.н д. №02/147-2783 от 04.10.18
A4: =EOMONTH(R[9]C,0)-R[9]C -> 8 | B4: Потребитель: ЗАО "Сити Сервис"
A5: =MAX(R[9]C:R[78]C) -> 2018-10-22T00:00:00.000 | B5: Адрес: г. СПб, Наличная ул., д.44 к2
A6: =EOMONTH(R[-1]C,0)-R[-1]C -> 9 | B6: Телефон: 8-911-021-19-79
A7: =R[-2]C-R[6]C -> 30 | B7: Договор 10023-2 (.) 31871, 31891
A8: 7 | B8: Тепловычислитель: ВТД № B06F | L8: М2 мах= | M8: 366 | O8: Мгвс мах= | P8: 187.2
L9: Qотоп мах= | M9: 29.28 | O9: Qгвс мах= | P9: 11.28
B10: Расчётная формула: Q=M1*(h1-hхв)-M2*(h2-hхв)
D12: Учет | L12: Контроль
A13: =R[1]C[1]-1 -> 2018-09-22T00:00:00.000 | B13: Дата | C13: N, ч | D13: M1, т | E13: T1, С | F13: P1, кг/см2 | G13: M2, т | H13: T2, С | I13: P2, кг/см2 | J13: dT, С | K13: M1-М2, т | L13: V3, м3 | M13: T3, С | N13: V4, м3 | O13: =IF(R[-12]C[-14]="м.куб","","T4, С") -> T4, С | P13: dT, С | Q13: V3-V4, м3 | R13: Qгвс, Гкал | S13: Qобщ., Гкал | T13: Q | U13: M3 | V13: M4 | W13: си2 | X13: си3 | Y13: Разб. | Z13: dM2 | AC13: Дата | AD13: НС | AE13: n, ч | AF13: М1, т | AG13: t1, гр. С | AH13: Р1, кгс/см2 | AI13: М2, т | AJ13: t2, гр. С | AK13: Р2, кгс/см2 | AL13: t1-t2, гр. С | AM13: М1-М2, т | AN13: М1гвс, т | AO13: t1гвс, гр. С | AP13: Р1гвс, кгс/см2 | AQ13: М2гвс, т | AR13: t2гвс, гр. С | AS13: Р2гвс, кгс/см2 | AT13: t1гвс-t2гвс | AU13: М1гвс-М2гвс, т | AV13: Wгвс, Гкал | AW13: Wсумм, Гкал | AY13: NS_TV1 | AZ13: НС | BA13: NS_TV2
A14: =IF(RC[1]="","",DATEVALUE(RC[1])) -> 43366 | B14: 23.09.18 | C14: 24 | D14: 64.074821470000003 | E14: 69.739999999999995 | F14: 4.1363033378800003 | G14: 0 | H14: 34.5 | I14: 2.7525517549199998 | J14: =RC[-5]-RC[-2] -> 35.239999999999995 | K14: 64.074821470000003 | L14: 65.425186159999996 | M14: 69.62 | R14: 4.5058829081876404 | S14: 4.5174209372313001 | T14: =(RC[-16]*RC[-15]-RC[-13]*RC[-12])/1000 -> 4.4685780493177996 | U14: 63.990562439999998 | V14: - | W14: =RC[-2]*RC[-10]/1000 -> 4.4550229570728002 | X14: =ABS((RC[-3]*RC[-11]-RC[-2]*RC[-9])/1000) -> #VALUE! | Y14: =(RC[-14]-RC[1])/RC[-18]*100 -> #DIV/0! | Z14: 63.990562439999998 | AC14: =VALUE(RC[-27]) -> 2018-09-23T00:00:00.000 | AD14: =IF(RC[21]=42,"*",IF(RC[21]=32,"",RC[21])) -> - | AE14: =RC[-28] -> 24 | AF14: =RC[-28] -> 64.074821470000003 | AG14: =RC[-28] -> 69.739999999999995 | AH14: =RC[-28] -> 4.1363033378800003 | AI14: =RC[-28] -> 0 | AJ14: =RC[-28] -> 34.5 | AK14: =RC[-28] -> 2.7525517549199998 | AL14: =RC[-28] -> 35.239999999999995 | AM14: =RC[-28] -> 64.074821470000003 | AN14: =RC[-28] -> 65.425186159999996 | AO14: =RC[-28] -> 69.62 | AP14: - | AQ14: =RC[-29] -> 0 | AR14: =RC[-29] -> 0 | AS14: - | AT14: =RC[-30] -> 0 | AU14: =RC[-30] -> 0 | AV14: =RC[-30] -> 4.5058829081876404 | AW14: =RC[-30] -> 4.5174209372313001 | AY14: - | AZ14: - | BA14: -
A15: =IF(RC[1]="","",DATEVALUE(RC[1])) -> 43367 | B15: 24.09.18 | C15: 24 | D15: 57.026901250000002 | E15: 68.62 | F15: 4.6392089064400004 | G15: 0 | H15: 34.520000000000003 | I15: 2.74449457448 | J15: =RC[-5]-RC[-2] -> 34.1 | K15: 57.026901250000002 | L15: 58.040752410000003 | M15: 68.47 | R15: 3.9354304122480199 | S15: 3.9624653052450598 | T15: =(RC[-16]*RC[-15]-RC[-13]*RC[-12])/1000 -> 3.9131859637750002 | U15: 56.804405209999999 | V15: - | W15: =RC[-2]*RC[-10]/1000 -> 3.8893976247287001 | X15: =ABS((RC[-3]*RC[-11]-RC[-2]*RC[-9])/1000) -> #VALUE! | Y15: =(RC[-14]-RC[1])/RC[-18]*100 -> #DIV/0! | Z15: 56.804405209999999 | AC15: =VALUE(RC[-27]) -> 2018-09-24T00:00:00.000 | AD15: =IF(RC[21]=42,"*",IF(RC[21]=32,"",RC[21])) -> - | AE15: =RC[-28] -> 24 | AF15: =RC[-28] -> 57.026901250000002 | AG15: =RC[-28] -> 68.62 | AH15: =RC[-28] -> 4.6392089064400004 | AI15: =RC[-28] -> 0 | AJ15: =RC[-28] -> 34.520000000000003 | AK15: =RC[-28] -> 2.74449457448 | AL15: =RC[-28] -> 34.1 | AM15: =RC[-28] -> 57.026901250000002 | AN15: =RC[-28] -> 58.040752410000003 | AO15: =RC[-28] -> 68.47 | AP15: - | AQ15: =RC[-29] -> 0 | AR15: =RC[-29] -> 0 | AS15: - | AT15: =RC[-30] -> 0 | AU15: =RC[-30] -> 0 | AV15: =RC[-30] -> 3.9354304122480199 | AW15: =RC[-30] -> 3.9624653052450598 | AY15: - | AZ15: - | BA15: -
A16: =IF(RC[1]="","",DATEVALUE(RC[1])) -> 43368 | B16: 25.09.18 | C16: 24 | D16: 98.866439819999997 | E16: 67.73 | F16: 5.3999022086000004 | G16: 37.644355769999997 | H16: 49.67 | I16: 2.7352088324400001 | J16: =RC[-5]-RC[-2] -> 18.060000000000002 | K16: 61.222084049999999 | L16: 61.655490880000002 | M16: 67.67 | R16: 4.1143142734307796 | S16: 4.2307523789051302 | T16: =(RC[-16]*RC[-15]-RC[-13]*RC[-12])/1000 -> 4.8264288179127002 | U16: 60.381076810000003 | V16: - | W16: =RC[-2]*RC[-10]/1000 -> 4.0859874677326999 | X16: =ABS((RC[-3]*RC[-11]-RC[-2]*RC[-9])/1000) -> #VALUE! | Y16: =(RC[-14]-RC[1])/RC[-18]*100 -> 2.234085888302602 | Z16: 60.381076810000003 | AC16: =VALUE(RC[-27]) -> 2018-09-25T00:00:00.000 | AD16: =IF(RC[21]=42,"*",IF(RC[21]=32,"",RC[21])) -> - | AE16: =RC[-28] -> 24 | AF16: =RC[-28] -> 98.866439819999997 | AG16: =RC[-28] -> 67.73 | AH16: =RC[-28] -> 5.3999022086000004 | AI16: =RC[-28] -> 37.644355769999997 | AJ16: =RC[-28] -> 49.67 | AK16: =RC[-28] -> 2.7352088324400001 | AL16: =RC[-28] -> 18.060000000000002 | AM16: =RC[-28] -> 61.222084049999999 | AN16: =RC[-28] -> 61.655490880000002 | AO16: =RC[-28] -> 67.67 | AP16: - | AQ16: =RC[-29] -> 0 | AR16: =RC[-29] -> 0 | AS16: - | AT16: =RC[-30] -> 0 | AU16: =RC[-30] -> 0 | AV16: =RC[-30] -> 4.1143142734307796 | AW16: =RC[-30] -> 4.2307523789051302 | AY16: - | AZ16: - | BA16: -
A17: =IF(RC[1]="","",DATEVALUE(RC[1])) -> 43369 | B17: 26.09.18 | C17: 24 | D17: 145.10879517000001 | E17: 67.73 | F17: 5.4142784201199996 | G17: 78.571510309999994 | H17: 67.33 | I17: 2.6836986322800001 | J17: =RC[-5]-RC[-2] -> 0.40000000000000568 | K17: 66.53728486 | L17: 66.72029114 | M17: 67.7 | R17: 4.4188263017101397 | S17: =RC[-1] -> 4.4188263017101397 | T17: =(RC[-16]*RC[-15]-RC[-13]*RC[-12])/1000 -> 4.5379989076918026 | U17: 65.360847469999996 | V17: - | W17: =RC[-2]*RC[-10]/1000 -> 4.4249293737190003 | X17: =ABS((RC[-3]*RC[-11]-RC[-2]*RC[-9])/1000) -> #VALUE! | Y17: =(RC[-14]-RC[1])/RC[-18]*100 -> 1.4972823932726105 | Z17: 65.360847469999996 | AC17: =VALUE(RC[-27]) -> 2018-09-26T00:00:00.000 | AD17: =IF(RC[21]=42,"*",IF(RC[21]=32,"",RC[21])) -> - | AE17: =RC[-28] -> 24 | AF17: =RC[-28] -> 145.10879517000001 | AG17: =RC[-28] -> 67.73 | AH17: =RC[-28] -> 5.4142784201199996 | AI17: =RC[-28] -> 78.571510309999994 | AJ17: =RC[-28] -> 67.33 | AK17: =RC[-28] -> 2.6836986322800001 | AL17: =RC[-28] -> 0.40000000000000568 | AM17: =RC[-28] -> 66.53728486 | AN17: =RC[-28] -> 66.72029114 | AO17: =RC[-28] -> 67.7 | AP17: - | AQ17: =RC[-29] -> 0 | AR17: =RC[-29] -> 0 | AS17: - | AT17: =RC[-30] -> 0 | AU17: =RC[-30] -> 0 | AV17: =RC[-30] -> 4.4188263017101397 | AW17: =RC[-30] -> 4.4188263017101397 | AY17: - | AZ17: - | BA17: -
A18: =IF(RC[1]="","",DATEVALUE(RC[1])) -> 43370 | B18: 27.09.18 | C18: 24 | D18: 138.09928894000001 | E18: 63.02 | F18: 5.4712739845599998 | G18: 69.225860600000004 | H18: 62.6 | I18: 2.4628275421199999 | J18: =RC[-5]-RC[-2] -> 0.42000000000000171 | K18: 68.873428340000004 | L18: 68.656311040000006 | M18: 63.05 | R18: 4.2591134159740101 | S18: =RC[-1] -> 4.2591134159740101 | T18: =(RC[-16]*RC[-15]-RC[-13]*RC[-12])/1000 -> 4.3694783154388013 | U18: 67.420761110000001 | V18: - | W18: =RC[-2]*RC[-10]/1000 -> 4.2508789879854998 | X18: =ABS((RC[-3]*RC[-11]-RC[-2]*RC[-9])/1000) -> #VALUE! | Y18: =(RC[-14]-RC[1])/RC[-18]*100 -> 2.0984458949434899 | Z18: 67.420761110000001 | AC18: =VALUE(RC[-27]) -> 2018-09-27T00:00:00.000 | AD18: =IF(RC[21]=42,"*",IF(RC[21]=32,"",RC[21])) -> - | AE18: =RC[-28] -> 24 | AF18: =RC[-28] -> 138.09928894000001 | AG18: =RC[-28] -> 63.02 | AH18: =RC[-28] -> 5.4712739845599998 | AI18: =RC[-28] -> 69.225860600000004 | AJ18: =RC[-28] -> 62.6 | AK18: =RC[-28] -> 2.4628275421199999 | AL18: =RC[-28] -> 0.42000000000000171 | AM18: =RC[-28] -> 68.873428340000004 | AN18: =RC[-28] -> 68.656311040000006 | AO18: =RC[-28] -> 63.05 | AP18: - | AQ18: =RC[-29] -> 0 | AR18: =RC[-29] -> 0 | AS18: - | AT18: =RC[-30] -> 0 | AU18: =RC[-30] -> 0 | AV18: =RC[-30] -> 4.2591134159740101 | AW18: =RC[-30] -> 4.2591134159740101 | AY18: - | AZ18: - | BA18: -
A19: =IF(RC[1]="","",DATEVALUE(RC[1])) -> 43371 | B19: 28.09.18 | C19: 24 | D19: 132.93972778 | E19: 67.400000000000006 | F19: 5.62031299632 | G19: 66.178688050000005 | H19: 64.760000000000005 | I19: 2.5533856951999998 | J19: =RC[-5]-RC[-2] -> 2.6400000000000006 | K19: 66.761039729999993 | L19: 65.161865230000004 | M19: 67.42 | R19: 4.3207432621572597 | S19: =RC[-1] -> 4.3207432621572597 | T19: =(RC[-16]*RC[-15]-RC[-13]*RC[-12])/1000 -> 4.6744058142540004 | U19: 63.806224819999997 | V19: - | W19: =RC[-2]*RC[-10]/1000 -> 4.3018156773643996 | X19: =ABS((RC[-3]*RC[-11]-RC[-2]*RC[-9])/1000) -> #VALUE! | Y19: =(RC[-14]-RC[1])/RC[-18]*100 -> 4.4649040303844405 | Z19: 63.806224819999997 | AC19: =VALUE(RC[-27]) -> 2018-09-28T00:00:00.000 | AD19: =IF(RC[21]=42,"*",IF(RC[21]=32,"",RC[21])) -> - | AE19: =RC[-28] -> 24 | AF19: =RC[-28] -> 132.93972778 | AG19: =RC[-28] -> 67.400000000000006 | AH19: =RC[-28] -> 5.62031299632 | AI19: =RC[-28] -> 66.178688050000005 | AJ19: =RC[-28] -> 64.760000000000005 | AK19: =RC[-28] -> 2.5533856951999998 | AL19: =RC[-28] -> 2.6400000000000006 | AM19: =RC[-28] -> 66.761039729999993 | AN19: =RC[-28] -> 65.161865230000004 | AO19: =RC[-28] -> 67.42 | AP19: - | AQ19: =RC[-29] -> 0 | AR19: =RC[-29] -> 0 | AS19: - | AT19: =RC[-30] -> 0 | AU19: =RC[-30] -> 0 | AV19: =RC[-30] -> 4.3207432621572597 | AW19: =RC[-30] -> 4.3207432621572597 | AY19: - | AZ19: - | BA19: -
A20: =IF(RC[1]="","",DATEVALUE(RC[1])) -> 43372 | B20: 29.09.18 | C20: 24 | D20: 178.55273438 | E20: 67.62 | F20: 5.9797467534799997 | G20: 108.26602936 | H20: 67.34 | I20: 2.7965189542000002 | J20: =RC[-5]-RC[-2] -> 0.28000000000000114 | K20: 70.286705019999999 | L20: 70.145629880000001 | M20: 67.61 | R20: 4.65445456195663 | S20: =RC[-1] -> 4.65445456195663 | T20: =(RC[-16]*RC[-15]-RC[-13]*RC[-12])/1000 -> 4.7831014816732011 | U20: 68.709190370000002 | V20: - | W20: =RC[-2]*RC[-10]/1000 -> 4.6454283609156999 | X20: =ABS((RC[-3]*RC[-11]-RC[-2]*RC[-9])/1000) -> #VALUE! | Y20: =(RC[-14]-RC[1])/RC[-18]*100 -> 1.4570726010044539 | Z20: 68.709190370000002 | AC20: =VALUE(RC[-27]) -> 2018-09-29T00:00:00.000 | AD20: =IF(RC[21]=42,"*",IF(RC[21]=32,"",RC[21])) -> - | AE20: =RC[-28] -> 24 | AF20: =RC[-28] -> 178.55273438 | AG20: =RC[-28] -> 67.62 | AH20: =RC[-28] -> 5.9797467534799997 | AI20: =RC[-28] -> 108.26602936 | AJ20: =RC[-28] -> 67.34 | AK20: =RC[-28] -> 2.7965189542000002 | AL20: =RC[-28] -> 0.28000000000000114 | AM20: =RC[-28] -> 70.286705019999999 | AN20: =RC[-28] -> 70.145629880000001 | AO20: =RC[-28] -> 67.61 | AP20: - | AQ20: =RC[-29] -> 0 | AR20: =RC[-29] -> 0 | AS20: - | AT20: =RC[-30] -> 0 | AU20: =RC[-30] -> 0 | AV20: =RC[-30] -> 4.65445456195663 | AW20: =RC[-30] -> 4.65445456195663 | AY20: - | AZ20: - | BA20: -
A21: =IF(RC[1]="","",DATEVALUE(RC[1])) -> 43373 | B21: 30.09.18 | C21: 24 | D21: 101.48869324 | E21: 60.39 | F21: 5.9037988916800002 | G21: 66.266304020000007 | H21: 61.68 | I21: 2.4278563933199999 | J21: =RC[-5]-RC[-2] -> -1.2899999999999991 | K21: 35.222389219999997 | L21: 71.664169310000005 | M21: 60.48 | R21: 4.0553175766695304 | S21: =RC[-1] -> 4.0553175766695304 | T21: =(RC[-16]*RC[-15]-RC[-13]*RC[-12])/1000 -> 2.0415965528100002 | U21: 70.511947629999995 | V21: - | W21: =RC[-2]*RC[-10]/1000 -> 4.2645625926623998 | X21: =ABS((RC[-3]*RC[-11]-RC[-2]*RC[-9])/1000) -> #VALUE! | Y21: =(RC[-14]-RC[1])/RC[-18]*100 -> -53.254152214901204 | Z21: 70.511947629999995 | AC21: =VALUE(RC[-27]) -> 2018-09-30T00:00:00.000 | AD21: =IF(RC[21]=42,"*",IF(RC[21]=32,"",RC[21])) -> - | AE21: =RC[-28] -> 24 | AF21: =RC[-28] -> 101.48869324 | AG21: =RC[-28] -> 60.39 | AH21: =RC[-28] -> 5.9037988916800002 | AI21: =RC[-28] -> 66.266304020000007 | AJ21: =RC[-28] -> 61.68 | AK21: =RC[-28] -> 2.4278563933199999 | AL21: =RC[-28] -> -1.2899999999999991 | AM21: =RC[-28] -> 35.222389219999997 | AN21: =RC[-28] -> 71.664169310000005 | AO21: =RC[-28] -> 60.48 | AP21: - | AQ21: =RC[-29] -> 0 | AR21: =RC[-29] -> 0 | AS21: - | AT21: =RC[-30] -> 0 | AU21: =RC[-30] -> 0 | AV21: =RC[-30] -> 4.0553175766695304 | AW21: =RC[-30] -> 4.0553175766695304 | AY21: - | AZ21: - | BA21: -
A22: =IF(RC[1]="","",DATEVALUE(RC[1])) -> 43374 | B22: 01.10.18 | C22: 24 | D22: 321.63623046999999 | E22: 60.32 | F22: 6.1064792089999997 | G22: 263.83419800000001 | H22: 46.55 | I22: 2.5374488839199998 | J22: =RC[-5]-RC[-2] -> 13.770000000000003 | K22: 57.80203247 | L22: 67.681922909999997 | M22: 20.260000000000002 | R22: 4.2579558302283402 | S22: 9.4405766766981891 | T22: =(RC[-16]*RC[-15]-RC[-13]*RC[-12])/1000 -> 7.1196155050503984 | U22: 66.409011840000005 | V22: - | W22: =RC[-2]*RC[-10]/1000 -> 1.3454465798784001 | X22: =ABS((RC[-3]*RC[-11]-RC[-2]*RC[-9])/1000) -> #VALUE! | Y22: =(RC[-14]-RC[1])/RC[-18]*100 -> -3.2622682863879553 | Z22: 66.409011840000005 | AC22: =VALUE(RC[-27]) -> 2018-10-01T00:00:00.000 | AD22: =IF(RC[21]=42,"*",IF(RC[21]=32,"",RC[21])) -> - | AE22: =RC[-28] -> 24 | AF22: =RC[-28] -> 321.63623046999999 | AG22: =RC[-28] -> 60.32 | AH22: =RC[-28] -> 6.1064792089999997 | AI22: =RC[-28] -> 263.83419800000001 | AJ22: =RC[-28] -> 46.55 | AK22: =RC[-28] -> 2.5374488839199998 | AL22: =RC[-28] -> 13.770000000000003 | AM22: =RC[-28] -> 57.80203247 | AN22: =RC[-28] -> 67.681922909999997 | AO22: =RC[-28] -> 20.260000000000002 | AP22: - | AQ22: =RC[-29] -> 0 | AR22: =RC[-29] -> 0 | AS22: - | AT22: =RC[-30] -> 0 | AU22: =RC[-30] -> 0 | AV22: =RC[-30] -> 4.2579558302283402 | AW22: =RC[-30] -> 9.4405766766981891 | AY22: - | AZ22: - | BA22: -
A23: =IF(RC[1]="","",DATEVALUE(RC[1])) -> 43375 | B23: 02.10.18 | C23: 24 | D23: 609.39434814000003 | E23: 67.56 | F23: 6.0981523368400001 | G23: 539.22698975000003 | H23: 50.75 | I23: 2.8023181935200001 | J23: =RC[-5]-RC[-2] -> 16.810000000000002 | K23: 70.167358390000004 | L23: 66.00578308 | M23: 67.650000000000006 | R23: 4.38689684484571 | S23: 13.8510356620808 | T23: =(RC[-16]*RC[-15]-RC[-13]*RC[-12])/1000 -> 13.804912430525899 | U23: 64.653854370000005 | V23: - | W23: =RC[-2]*RC[-10]/1000 -> 4.3738332481305005 | X23: =ABS((RC[-3]*RC[-11]-RC[-2]*RC[-9])/1000) -> #VALUE! | Y23: =(RC[-14]-RC[1])/RC[-18]*100 -> 1.022482947776076 | Z23: 64.653854370000005 | AC23: =VALUE(RC[-27]) -> 2018-10-02T00:00:00.000 | AD23: =IF(RC[21]=42,"*",IF(RC[21]=32,"",RC[21])) -> - | AE23: =RC[-28] -> 24 | AF23: =RC[-28] -> 609.39434814000003 | AG23: =RC[-28] -> 67.56 | AH23: =RC[-28] -> 6.0981523368400001 | AI23: =RC[-28] -> 539.22698975000003 | AJ23: =RC[-28] -> 50.75 | AK23: =RC[-28] -> 2.8023181935200001 | AL23: =RC[-28] -> 16.810000000000002 | AM23: =RC[-28] -> 70.167358390000004 | AN23: =RC[-28] -> 66.00578308 | AO23: =RC[-28] -> 67.650000000000006 | AP23: - | AQ23: =RC[-29] -> 0 | AR23: =RC[-29] -> 0 | AS23: - | AT23: =RC[-30] -> 0 | AU23: =RC[-30] -> 0 | AV23: =RC[-30] -> 4.38689684484571 | AW23: =RC[-30] -> 13.8510356620808 | AY23: - | AZ23: - | BA23: -
A24: =IF(RC[1]="","",DATEVALUE(RC[1])) -> 43376 | B24: 03.10.18 | C24: 24 | D24: 581.53033446999996 | E24: 67.650000000000006 | F24: 6.0597319299199999 | G24: 509.57876586999998 | H24: 50.92 | I24: 2.8221606878399998 | J24: =RC[-5]-RC[-2] -> 16.730000000000004 | K24: 71.951568600000002 | L24: 66.195365910000007 | M24: 67.72 | R24: 4.4084754681379597 | S24: 13.4088722699914 | T24: =(RC[-16]*RC[-15]-RC[-13]*RC[-12])/1000 -> 13.392776368795104 | U24: 64.835472109999998 | V24: - | W24: =RC[-2]*RC[-10]/1000 -> 4.390658171289199 | X24: =ABS((RC[-3]*RC[-11]-RC[-2]*RC[-9])/1000) -> #VALUE! | Y24: =(RC[-14]-RC[1])/RC[-18]*100 -> 1.3964664477042614 | Z24: 64.835472109999998 | AC24: =VALUE(RC[-27]) -> 2018-10-03T00:00:00.000 | AD24: =IF(RC[21]=42,"*",IF(RC[21]=32,"",RC[21])) -> - | AE24: =RC[-28] -> 24 | AF24: =RC[-28] -> 581.53033446999996 | AG24: =RC[-28] -> 67.650000000000006 | AH24: =RC[-28] -> 6.0597319299199999 | AI24: =RC[-28] -> 509.57876586999998 | AJ24: =RC[-28] -> 50.92 | AK24: =RC[-28] -> 2.8221606878399998 | AL24: =RC[-28] -> 16.730000000000004 | AM24: =RC[-28] -> 71.951568600000002 | AN24: =RC[-28] -> 66.195365910000007 | AO24: =RC[-28] -> 67.72 | AP24: - | AQ24: =RC[-29] -> 0 | AR24: =RC[-29] -> 0 | AS24: - | AT24: =RC[-30] -> 0 | AU24: =RC[-30] -> 0 | AV24: =RC[-30] -> 4.4084754681379597 | AW24: =RC[-30] -> 13.4088722699914 | AY24: - | AZ24: - | BA24: -
A25: =IF(RC[1]="","",DATEVALUE(RC[1])) -> 43377 | B25: 04.10.18 | C25: 24 | D25: 481.35293579 | E25: 67.08 | F25: 6.0154442230000003 | G25: 413.80447387999999 | H25: 60.2 | I25: 2.8201979484400002 | J25: =RC[-5]-RC[-2] -> 6.8799999999999955 | K25: 67.54846191 | L25: 65.145240779999995 | M25: 67.12 | R25: 4.2998443369637904 | S25: 6.9385378045285204 | T25: =(RC[-16]*RC[-15]-RC[-13]*RC[-12])/1000 -> 7.3781256052171997 | U25: 63.824878689999998 | V25: - | W25: =RC[-2]*RC[-10]/1000 -> 4.2839258576727994 | X25: =ABS((RC[-3]*RC[-11]-RC[-2]*RC[-9])/1000) -> #VALUE! | Y25: =(RC[-14]-RC[1])/RC[-18]*100 -> 0.89984121850741794 | Z25: 63.824878689999998 | AC25: =VALUE(RC[-27]) -> 2018-10-04T00:00:00.000 | AD25: =IF(RC[21]=42,"*",IF(RC[21]=32,"",RC[21])) -> - | AE25: =RC[-28] -> 24 | AF25: =RC[-28] -> 481.35293579 | AG25: =RC[-28] -> 67.08 | AH25: =RC[-28] -> 6.0154442230000003 | AI25: =RC[-28] -> 413.80447387999999 | AJ25: =RC[-28] -> 60.2 | AK25: =RC[-28] -> 2.8201979484400002 | AL25: =RC[-28] -> 6.8799999999999955 | AM25: =RC[-28] -> 67.54846191 | AN25: =RC[-28] -> 65.145240779999995 | AO25: =RC[-28] -> 67.12 | AP25: - | AQ25: =RC[-29] -> 0 | AR25: =RC[-29] -> 0 | AS25: - | AT25: =RC[-30] -> 0 | AU25: =RC[-30] -> 0 | AV25: =RC[-30] -> 4.2998443369637904 | AW25: =RC[-30] -> 6.9385378045285204 | AY25: - | AZ25: - | BA25: -
A26: =IF(RC[1]="","",DATEVALUE(RC[1])) -> 43378 | B26: 05.10.18 | C26: 24 | D26: 434.13470459000001 | E26: 66.52 | F26: 5.9814065361199997 | G26: 362.00125121999997 | H26: 47.18 | I26: 2.8628270971999998 | J26: =RC[-5]-RC[-2] -> 19.339999999999996 | K26: 72.133453369999998 | L26: 66.046501160000005 | M26: 66.489999999999995 | R26: 4.3197341907900997 | S26: 11.613066267794 | T26: =(RC[-16]*RC[-15]-RC[-13]*RC[-12])/1000 -> 11.7994215167672 | U26: 64.730110170000003 | V26: - | W26: =RC[-2]*RC[-10]/1000 -> 4.3039050252033002 | X26: =ABS((RC[-3]*RC[-11]-RC[-2]*RC[-9])/1000) -> #VALUE! | Y26: =(RC[-14]-RC[1])/RC[-18]*100 -> 2.0451153621844091 | Z26: 64.730110170000003 | AC26: =VALUE(RC[-27]) -> 2018-10-05T00:00:00.000 | AD26: =IF(RC[21]=42,"*",IF(RC[21]=32,"",RC[21])) -> - | AE26: =RC[-28] -> 24 | AF26: =RC[-28] -> 434.13470459000001 | AG26: =RC[-28] -> 66.52 | AH26: =RC[-28] -> 5.9814065361199997 | AI26: =RC[-28] -> 362.00125121999997 | AJ26: =RC[-28] -> 47.18 | AK26: =RC[-28] -> 2.8628270971999998 | AL26: =RC[-28] -> 19.339999999999996 | AM26: =RC[-28] -> 72.133453369999998 | AN26: =RC[-28] -> 66.046501160000005 | AO26: =RC[-28] -> 66.489999999999995 | AP26: - | AQ26: =RC[-29] -> 0 | AR26: =RC[-29] -> 0 | AS26: - | AT26: =RC[-30] -> 0 | AU26: =RC[-30] -> 0 | AV26: =RC[-30] -> 4.3197341907900997 | AW26: =RC[-30] -> 11.613066267794 | AY26: - | AZ26: - | BA26: -
A27: =IF(RC[1]="","",DATEVALUE(RC[1])) -> 43379 | B27: 06.10.18 | C27: 24 | D27: 560.52966308999999 | E27: 67.12 | F27: 6.2281544600799998 | G27: 491.08819579999999 | H27: 50.32 | I27: 2.8399506475599998 | J27: =RC[-5]-RC[-2] -> 16.800000000000004 | K27: 69.441467290000006 | L27: 64.086410520000001 | M27: 66.989999999999995 | R27: 4.2351863666762197 | S27: 12.966428250692701 | T27: =(RC[-16]*RC[-15]-RC[-13]*RC[-12])/1000 -> 12.911192973944805 | U27: 62.786827090000003 | V27: - | W27: =RC[-2]*RC[-10]/1000 -> 4.2060895467590997 | X27: =ABS((RC[-3]*RC[-11]-RC[-2]*RC[-9])/1000) -> #VALUE! | Y27: =(RC[-14]-RC[1])/RC[-18]*100 -> 1.3550804635324942 | Z27: 62.786827090000003 | AC27: =VALUE(RC[-27]) -> 2018-10-06T00:00:00.000 | AD27: =IF(RC[21]=42,"*",IF(RC[21]=32,"",RC[21])) -> - | AE27: =RC[-28] -> 24 | AF27: =RC[-28] -> 560.52966308999999 | AG27: =RC[-28] -> 67.12 | AH27: =RC[-28] -> 6.2281544600799998 | AI27: =RC[-28] -> 491.08819579999999 | AJ27: =RC[-28] -> 50.32 | AK27: =RC[-28] -> 2.8399506475599998 | AL27: =RC[-28] -> 16.800000000000004 | AM27: =RC[-28] -> 69.441467290000006 | AN27: =RC[-28] -> 64.086410520000001 | AO27: =RC[-28] -> 66.989999999999995 | AP27: - | AQ27: =RC[-29] -> 0 | AR27: =RC[-29] -> 0 | AS27: - | AT27: =RC[-30] -> 0 | AU27: =RC[-30] -> 0 | AV27: =RC[-30] -> 4.2351863666762197 | AW27: =RC[-30] -> 12.966428250692701 | AY27: - | AZ27: - | BA27: -
A28: =IF(RC[1]="","",DATEVALUE(RC[1])) -> 43380 | B28: 07.10.18 | C28: 24 | D28: 568.81756591999999 | E28: 67.459999999999994 | F28: 6.1683952442800001 | G28: 495.98431396000001 | H28: 50.69 | I28: 2.8571543874800001 | J28: =RC[-5]-RC[-2] -> 16.769999999999996 | K28: 72.833251959999998 | L28: 69.645378109999996 | M28: 67.33 | R28: 4.62061948504825 | S28: 13.2816883610395 | T28: =(RC[-16]*RC[-15]-RC[-13]*RC[-12])/1000 -> 13.230988122330796 | U28: 68.223014829999997 | V28: - | W28: =RC[-2]*RC[-10]/1000 -> 4.5934555885038995 | X28: =ABS((RC[-3]*RC[-11]-RC[-2]*RC[-9])/1000) -> #VALUE! | Y28: =(RC[-14]-RC[1])/RC[-18]*100 -> 0.92951268825243671 | Z28: 68.223014829999997 | AC28: =VALUE(RC[-27]) -> 2018-10-07T00:00:00.000 | AD28: =IF(RC[21]=42,"*",IF(RC[21]=32,"",RC[21])) -> - | AE28: =RC[-28] -> 24 | AF28: =RC[-28] -> 568.81756591999999 | AG28: =RC[-28] -> 67.459999999999994 | AH28: =RC[-28] -> 6.1683952442800001 | AI28: =RC[-28] -> 495.98431396000001 | AJ28: =RC[-28] -> 50.69 | AK28: =RC[-28] -> 2.8571543874800001 | AL28: =RC[-28] -> 16.769999999999996 | AM28: =RC[-28] -> 72.833251959999998 | AN28: =RC[-28] -> 69.645378109999996 | AO28: =RC[-28] -> 67.33 | AP28: - | AQ28: =RC[-29] -> 0 | AR28: =RC[-29] -> 0 | AS28: - | AT28: =RC[-30] -> 0 | AU28: =RC[-30] -> 0 | AV28: =RC[-30] -> 4.62061948504825 | AW28: =RC[-30] -> 13.2816883610395 | AY28: - | AZ28: - | BA28: -
A29: =IF(RC[1]="","",DATEVALUE(RC[1])) -> 43381 | B29: 08.10.18 | C29: 24 | D29: 596.30731201000003 | E29: 67.42 | F29: 6.0166709478799998 | G29: 529.72033691000001 | H29: 51.14 | I29: 2.8713796818400001 | J29: =RC[-5]-RC[-2] -> 16.28 | K29: 66.586975100000004 | L29: 64.380805969999997 | M29: 67.349999999999994 | R29: 4.2624932334957499 | S29: 13.1308780739467 | T29: =(RC[-16]*RC[-15]-RC[-13]*RC[-12])/1000 -> 13.113140946136802 | U29: 63.066581730000003 | V29: - | W29: =RC[-2]*RC[-10]/1000 -> 4.2475342795155004 | X29: =ABS((RC[-3]*RC[-11]-RC[-2]*RC[-9])/1000) -> #VALUE! | Y29: =(RC[-14]-RC[1])/RC[-18]*100 -> 0.66457583836320011 | Z29: 63.066581730000003 | AC29: =VALUE(RC[-27]) -> 2018-10-08T00:00:00.000 | AD29: =IF(RC[21]=42,"*",IF(RC[21]=32,"",RC[21])) -> - | AE29: =RC[-28] -> 24 | AF29: =RC[-28] -> 596.30731201000003 | AG29: =RC[-28] -> 67.42 | AH29: =RC[-28] -> 6.0166709478799998 | AI29: =RC[-28] -> 529.72033691000001 | AJ29: =RC[-28] -> 51.14 | AK29: =RC[-28] -> 2.8713796818400001 | AL29: =RC[-28] -> 16.28 | AM29: =RC[-28] -> 66.586975100000004 | AN29: =RC[-28] -> 64.380805969999997 | AO29: =RC[-28] -> 67.349999999999994 | AP29: - | AQ29: =RC[-29] -> 0 | AR29: =RC[-29] -> 0 | AS29: - | AT29: =RC[-30] -> 0 | AU29: =RC[-30] -> 0 | AV29: =RC[-30] -> 4.2624932334957499 | AW29: =RC[-30] -> 13.1308780739467 | AY29: - | AZ29: - | BA29: -
A30: =IF(RC[1]="","",DATEVALUE(RC[1])) -> 43382 | B30: 09.10.18 | C30: 24 | D30: 637.62054443 | E30: 67.150000000000006 | F30: 5.9303848014399998 | G30: 571.75769043000003 | H30: 52.04 | I30: 2.9070297027600001 | J30: =RC[-5]-RC[-2] -> 15.110000000000007 | K30: 65.862853999999999 | L30: 64.100784300000001 | M30: 67.150000000000006 | R30: 4.24260064488392 | S30: 13.115301485621501 | T30: =(RC[-16]*RC[-15]-RC[-13]*RC[-12])/1000 -> 13.061949348497306 | U30: 62.794006349999997 | V30: - | W30: =RC[-2]*RC[-10]/1000 -> 4.2166175264025005 | X30: =ABS((RC[-3]*RC[-11]-RC[-2]*RC[-9])/1000) -> #VALUE! | Y30: =(RC[-14]-RC[1])/RC[-18]*100 -> 0.53673919937867798 | Z30: 62.794006349999997 | AC30: =VALUE(RC[-27]) -> 2018-10-09T00:00:00.000 | AD30: =IF(RC[21]=42,"*",IF(RC[21]=32,"",RC[21])) -> - | AE30: =RC[-28] -> 24 | AF30: =RC[-28] -> 637.62054443 | AG30: =RC[-28] -> 67.150000000000006 | AH30: =RC[-28] -> 5.9303848014399998 | AI30: =RC[-28] -> 571.75769043000003 | AJ30: =RC[-28] -> 52.04 | AK30: =RC[-28] -> 2.9070297027600001 | AL30: =RC[-28] -> 15.110000000000007 | AM30: =RC[-28] -> 65.862853999999999 | AN30: =RC[-28] -> 64.100784300000001 | AO30: =RC[-28] -> 67.150000000000006 | AP30: - | AQ30: =RC[-29] -> 0 | AR30: =RC[-29] -> 0 | AS30: - | AT30: =RC[-30] -> 0 | AU30: =RC[-30] -> 0 | AV30: =RC[-30] -> 4.24260064488392 | AW30: =RC[-30] -> 13.115301485621501 | AY30: - | AZ30: - | BA30: -
A31: =IF(RC[1]="","",DATEVALUE(RC[1])) -> 43383 | B31: 10.10.18 | C31: 24 | D31: 633.63287353999999 | E31: 68.22 | F31: 5.9991376187599998 | G31: 565.49047852000001 | H31: 52.71 | I31: 2.9127219021199999 | J31: =RC[-5]-RC[-2] -> 15.509999999999998 | K31: 68.142395019999995 | L31: 66.270797729999998 | M31: 68.290000000000006 | R31: 4.4680265835483004 | S31: 13.4807372384637 | T31: =(RC[-16]*RC[-15]-RC[-13]*RC[-12])/1000 -> 13.419431510109597 | U31: 64.873405460000001 | V31: - | W31: =RC[-2]*RC[-10]/1000 -> 4.4302048588634007 | X31: =ABS((RC[-3]*RC[-11]-RC[-2]*RC[-9])/1000) -> #VALUE! | Y31: =(RC[-14]-RC[1])/RC[-18]*100 -> 0.57808038935608319 | Z31: 64.873405460000001 | AC31: =VALUE(RC[-27]) -> 2018-10-10T00:00:00.000 | AD31: =IF(RC[21]=42,"*",IF(RC[21]=32,"",RC[21])) -> - | AE31: =RC[-28] -> 24 | AF31: =RC[-28] -> 633.63287353999999 | AG31: =RC[-28] -> 68.22 | AH31: =RC[-28] -> 5.9991376187599998 | AI31: =RC[-28] -> 565.49047852000001 | AJ31: =RC[-28] -> 52.71 | AK31: =RC[-28] -> 2.9127219021199999 | AL31: =RC[-28] -> 15.509999999999998 | AM31: =RC[-28] -> 68.142395019999995 | AN31: =RC[-28] -> 66.270797729999998 | AO31: =RC[-28] -> 68.290000000000006 | AP31: - | AQ31: =RC[-29] -> 0 | AR31: =RC[-29] -> 0 | AS31: - | AT31: =RC[-30] -> 0 | AU31: =RC[-30] -> 0 | AV31: =RC[-30] -> 4.4680265835483004 | AW31: =RC[-30] -> 13.4807372384637 | AY31: - | AZ31: - | BA31: -
A32: =IF(RC[1]="","",DATEVALUE(RC[1])) -> 43384 | B32: 11.10.18 | C32: 24 | D32: 646.54089354999996 | E32: 69.34 | F32: 5.8180181493600003 | G32: 584.31066895000004 | H32: 53.8 | I32: 2.9429469664400001 | J32: =RC[-5]-RC[-2] -> 15.540000000000006 | K32: 62.2302245999999 | L32: 61.52599335 | M32: 69.38 | R32: 4.1963437494028897 | S32: 13.4284596302666 | T32: =(RC[-16]*RC[-15]-RC[-13]*RC[-12])/1000 -> 13.395231569247001 | U32: 60.198051450000001 | V32: - | W32: =RC[-2]*RC[-10]/1000 -> 4.1765408096009997 | X32: =ABS((RC[-3]*RC[-11]-RC[-2]*RC[-9])/1000) -> #VALUE! | Y32: =(RC[-14]-RC[1])/RC[-18]*100 -> 0.34778984160116261 | Z32: 60.198051450000001 | AC32: =VALUE(RC[-27]) -> 2018-10-11T00:00:00.000 | AD32: =IF(RC[21]=42,"*",IF(RC[21]=32,"",RC[21])) -> - | AE32: =RC[-28] -> 24 | AF32: =RC[-28] -> 646.54089354999996 | AG32: =RC[-28] -> 69.34 | AH32: =RC[-28] -> 5.8180181493600003 | AI32: =RC[-28] -> 584.31066895000004 | AJ32: =RC[-28] -> 53.8 | AK32: =RC[-28] -> 2.9429469664400001 | AL32: =RC[-28] -> 15.540000000000006 | AM32: =RC[-28] -> 62.2302245999999 | AN32: =RC[-28] -> 61.52599335 | AO32: =RC[-28] -> 69.38 | AP32: - | AQ32: =RC[-29] -> 0 | AR32: =RC[-29] -> 0 | AS32: - | AT32: =RC[-30] -> 0 | AU32: =RC[-30] -> 0 | AV32: =RC[-30] -> 4.1963437494028897 | AW32: =RC[-30] -> 13.4284596302666 | AY32: - | AZ32: - | BA32: -
A33: =IF(RC[1]="","",DATEVALUE(RC[1])) -> 43385 | B33: 12.10.18 | C33: 24 | D33: 639.24151611000002 | E33: 69.25 | F33: 5.83510576776 | G33: 582.31347656000003 | H33: 53.62 | I33: 2.9455932718 | J33: =RC[-5]-RC[-2] -> 15.630000000000003 | K33: 56.928039550000001 | L33: 57.961166380000002 | M33: 69.290000000000006 | R33: 3.9461097043087801 | S33: 13.0812682406611 | T33: =(RC[-16]*RC[-15]-RC[-13]*RC[-12])/1000 -> 13.043826377470298 | U33: 56.717414859999998 | V33: - | W33: =RC[-2]*RC[-10]/1000 -> 3.9299496756494006 | X33: =ABS((RC[-3]*RC[-11]-RC[-2]*RC[-9])/1000) -> #VALUE! | Y33: =(RC[-14]-RC[1])/RC[-18]*100 -> 3.6170327234097743E-2 | Z33: 56.717414859999998 | AC33: =VALUE(RC[-27]) -> 2018-10-12T00:00:00.000 | AD33: =IF(RC[21]=42,"*",IF(RC[21]=32,"",RC[21])) -> - | AE33: =RC[-28] -> 24 | AF33: =RC[-28] -> 639.24151611000002 | AG33: =RC[-28] -> 69.25 | AH33: =RC[-28] -> 5.83510576776 | AI33: =RC[-28] -> 582.31347656000003 | AJ33: =RC[-28] -> 53.62 | AK33: =RC[-28] -> 2.9455932718 | AL33: =RC[-28] -> 15.630000000000003 | AM33: =RC[-28] -> 56.928039550000001 | AN33: =RC[-28] -> 57.961166380000002 | AO33: =RC[-28] -> 69.290000000000006 | AP33: - | AQ33: =RC[-29] -> 0 | AR33: =RC[-29] -> 0 | AS33: - | AT33: =RC[-30] -> 0 | AU33: =RC[-30] -> 0 | AV33: =RC[-30] -> 3.9461097043087801 | AW33: =RC[-30] -> 13.0812682406611 | AY33: - | AZ33: - | BA33: -
A34: =IF(RC[1]="","",DATEVALUE(RC[1])) -> 43386 | B34: 13.10.18 | C34: 24 | D34: 639.25378418000003 | E34: 70.260000000000005 | F34: 5.8365593275599998 | G34: 578.86364746000004 | H34: 54.42 | I34: 2.9477846828400001 | J34: =RC[-5]-RC[-2] -> 15.840000000000003 | K34: 60.390136720000001 | L34: 60.981956480000001 | M34: 70.3 | R34: 4.2162960160504399 | S34: 13.4526427056463 | T34: =(RC[-16]*RC[-15]-RC[-13]*RC[-12])/1000 -> 13.412211181713603 | U34: 59.631950379999999 | V34: - | W34: =RC[-2]*RC[-10]/1000 -> 4.1921261117139998 | X34: =ABS((RC[-3]*RC[-11]-RC[-2]*RC[-9])/1000) -> #VALUE! | Y34: =(RC[-14]-RC[1])/RC[-18]*100 -> 0.13097839937381678 | Z34: 59.631950379999999 | AC34: =VALUE(RC[-27]) -> 2018-10-13T00:00:00.000 | AD34: =IF(RC[21]=42,"*",IF(RC[21]=32,"",RC[21])) -> - | AE34: =RC[-28] -> 24 | AF34: =RC[-28] -> 639.25378418000003 | AG34: =RC[-28] -> 70.260000000000005 | AH34: =RC[-28] -> 5.8365593275599998 | AI34: =RC[-28] -> 578.86364746000004 | AJ34: =RC[-28] -> 54.42 | AK34: =RC[-28] -> 2.9477846828400001 | AL34: =RC[-28] -> 15.840000000000003 | AM34: =RC[-28] -> 60.390136720000001 | AN34: =RC[-28] -> 60.981956480000001 | AO34: =RC[-28] -> 70.3 | AP34: - | AQ34: =RC[-29] -> 0 | AR34: =RC[-29] -> 0 | AS34: - | AT34: =RC[-30] -> 0 | AU34: =RC[-30] -> 0 | AV34: =RC[-30] -> 4.2162960160504399 | AW34: =RC[-30] -> 13.4526427056463 | AY34: - | AZ34: - | BA34: -
A35: =IF(RC[1]="","",DATEVALUE(RC[1])) -> 43387 | B35: 14.10.18 | C35: 24 | D35: 643.17218018000005 | E35: 71.069999999999993 | F35: 5.8153925581200001 | G35: 580.07061768000005 | H35: 55.28 | I35: 2.9650254632799999 | J35: =RC[-5]-RC[-2] -> 15.789999999999992 | K35: 63.1015625 | L35: 63.879611969999999 | M35: 71.11 | R35: 4.4730591812362697 | S35: 13.7004732014904 | T35: =(RC[-16]*RC[-15]-RC[-13]*RC[-12])/1000 -> 13.643943100042193 | U35: 62.433917999999998 | V35: - | W35: =RC[-2]*RC[-10]/1000 -> 4.43967590898 | X35: =ABS((RC[-3]*RC[-11]-RC[-2]*RC[-9])/1000) -> #VALUE! | Y35: =(RC[-14]-RC[1])/RC[-18]*100 -> 0.1150971070850398 | Z35: 62.433917999999998 | AC35: =VALUE(RC[-27]) -> 2018-10-14T00:00:00.000 | AD35: =IF(RC[21]=42,"*",IF(RC[21]=32,"",RC[21])) -> - | AE35: =RC[-28] -> 24 | AF35: =RC[-28] -> 643.17218018000005 | AG35: =RC[-28] -> 71.069999999999993 | AH35: =RC[-28] -> 5.8153925581200001 | AI35: =RC[-28] -> 580.07061768000005 | AJ35: =RC[-28] -> 55.28 | AK35: =RC[-28] -> 2.9650254632799999 | AL35: =RC[-28] -> 15.789999999999992 | AM35: =RC[-28] -> 63.1015625 | AN35: =RC[-28] -> 63.879611969999999 | AO35: =RC[-28] -> 71.11 | AP35: - | AQ35: =RC[-29] -> 0 | AR35: =RC[-29] -> 0 | AS35: - | AT35: =RC[-30] -> 0 | AU35: =RC[-30] -> 0 | AV35: =RC[-30] -> 4.4730591812362697 | AW35: =RC[-30] -> 13.7004732014904 | AY35: - | AZ35: - | BA35: -
A36: =IF(RC[1]="","",DATEVALUE(RC[1])) -> 43388 | B36: 15.10.18 | C36: 24 | D36: 638.91589354999996 | E36: 70.56 | F36: 5.80688803432 | G36: 582.27313231999995 | H36: 55.18 | I36: 2.97758158732 | J36: =RC[-5]-RC[-2] -> 15.380000000000003 | K36: 56.642761229999998 | L36: 57.086036679999999 | M36: 70.61 | R36: 3.9600403482373201 | S36: 12.989617287666 | T36: =(RC[-16]*RC[-15]-RC[-13]*RC[-12])/1000 -> 12.952074007470401 | U36: 55.813087459999998 | V36: - | W36: =RC[-2]*RC[-10]/1000 -> 3.9409621055506001 | X36: =ABS((RC[-3]*RC[-11]-RC[-2]*RC[-9])/1000) -> #VALUE! | Y36: =(RC[-14]-RC[1])/RC[-18]*100 -> 0.14248876067735777 | Z36: 55.813087459999998 | AC36: =VALUE(RC[-27]) -> 2018-10-15T00:00:00.000 | AD36: =IF(RC[21]=42,"*",IF(RC[21]=32,"",RC[21])) -> - | AE36: =RC[-28] -> 24 | AF36: =RC[-28] -> 638.91589354999996 | AG36: =RC[-28] -> 70.56 | AH36: =RC[-28] -> 5.80688803432 | AI36: =RC[-28] -> 582.27313231999995 | AJ36: =RC[-28] -> 55.18 | AK36: =RC[-28] -> 2.97758158732 | AL36: =RC[-28] -> 15.380000000000003 | AM36: =RC[-28] -> 56.642761229999998 | AN36: =RC[-28] -> 57.086036679999999 | AO36: =RC[-28] -> 70.61 | AP36: - | AQ36: =RC[-29] -> 0 | AR36: =RC[-29] -> 0 | AS36: - | AT36: =RC[-30] -> 0 | AU36: =RC[-30] -> 0 | AV36: =RC[-30] -> 3.9600403482373201 | AW36: =RC[-30] -> 12.989617287666 | AY36: - | AZ36: - | BA36: -
A37: =IF(RC[1]="","",DATEVALUE(RC[1])) -> 43389 | B37: 16.10.18 | C37: 24 | D37: 642.58093262 | E37: 70.64 | F37: 5.8040336693999999 | G37: 583.53009033000001 | H37: 55.19 | I37: 2.9926100385200001 | J37: =RC[-5]-RC[-2] -> 15.450000000000003 | K37: 59.050842289999999 | L37: 59.88486099 | M37: 70.739999999999995 | R37: 4.1591630266552002 | S37: 13.226918828222001 | T37: =(RC[-16]*RC[-15]-RC[-13]*RC[-12])/1000 -> 13.1868913949641 | U37: 58.548038480000002 | V37: - | W37: =RC[-2]*RC[-10]/1000 -> 4.1416882420752001 | X37: =ABS((RC[-3]*RC[-11]-RC[-2]*RC[-9])/1000) -> #VALUE! | Y37: =(RC[-14]-RC[1])/RC[-18]*100 -> 8.6165875304844805E-2 | Z37: 58.548038480000002 | AC37: =VALUE(RC[-27]) -> 2018-10-16T00:00:00.000 | AD37: =IF(RC[21]=42,"*",IF(RC[21]=32,"",RC[21])) -> - | AE37: =RC[-28] -> 24 | AF37: =RC[-28] -> 642.58093262 | AG37: =RC[-28] -> 70.64 | AH37: =RC[-28] -> 5.8040336693999999 | AI37: =RC[-28] -> 583.53009033000001 | AJ37: =RC[-28] -> 55.19 | AK37: =RC[-28] -> 2.9926100385200001 | AL37: =RC[-28] -> 15.450000000000003 | AM37: =RC[-28] -> 59.050842289999999 | AN37: =RC[-28] -> 59.88486099 | AO37: =RC[-28] -> 70.739999999999995 | AP37: - | AQ37: =RC[-29] -> 0 | AR37: =RC[-29] -> 0 | AS37: - | AT37: =RC[-30] -> 0 | AU37: =RC[-30] -> 0 | AV37: =RC[-30] -> 4.1591630266552002 | AW37: =RC[-30] -> 13.226918828222001 | AY37: - | AZ37: - | BA37: -
A38: =IF(RC[1]="","",DATEVALUE(RC[1])) -> 43390 | B38: 17.10.18 | C38: 24 | D38: 642.78631591999999 | E38: 70.739999999999995 | F38: 5.8044642782000002 | G38: 582.90325928000004 | H38: 55.16 | I38: 3.0003321195999999 | J38: =RC[-5]-RC[-2] -> 15.579999999999998 | K38: 59.8830566399999 | L38: 60.680904390000002 | M38: 70.81 | R38: 4.2236128045285204 | S38: 13.3565955741855 | T38: =(RC[-16]*RC[-15]-RC[-13]*RC[-12])/1000 -> 13.317760206295992 | U38: 59.320789339999997 | V38: - | W38: =RC[-2]*RC[-10]/1000 -> 4.2005050931653996 | X38: =ABS((RC[-3]*RC[-11]-RC[-2]*RC[-9])/1000) -> #VALUE! | Y38: =(RC[-14]-RC[1])/RC[-18]*100 -> 9.645979689569982E-2 | Z38: 59.320789339999997 | AC38: =VALUE(RC[-27]) -> 2018-10-17T00:00:00.000 | AD38: =IF(RC[21]=42,"*",IF(RC[21]=32,"",RC[21])) -> - | AE38: =RC[-28] -> 24 | AF38: =RC[-28] -> 642.78631591999999 | AG38: =RC[-28] -> 70.739999999999995 | AH38: =RC[-28] -> 5.8044642782000002 | AI38: =RC[-28] -> 582.90325928000004 | AJ38: =RC[-28] -> 55.16 | AK38: =RC[-28] -> 3.0003321195999999 | AL38: =RC[-28] -> 15.579999999999998 | AM38: =RC[-28] -> 59.8830566399999 | AN38: =RC[-28] -> 60.680904390000002 | AO38: =RC[-28] -> 70.81 | AP38: - | AQ38: =RC[-29] -> 0 | AR38: =RC[-29] -> 0 | AS38: - | AT38: =RC[-30] -> 0 | AU38: =RC[-30] -> 0 | AV38: =RC[-30] -> 4.2236128045285204 | AW38: =RC[-30] -> 13.3565955741855 | AY38: - | AZ38: - | BA38: -
A39: =IF(RC[1]="","",DATEVALUE(RC[1])) -> 43391 | B39: 18.10.18 | C39: 24 | D39: 642.47772216999999 | E39: 71.260000000000005 | F39: 5.793290388 | G39: 585.46209716999999 | H39: 55.45 | I39: 2.9963927633599998 | J39: =RC[-5]-RC[-2] -> 15.810000000000002 | K39: 57.015625 | L39: 58.340148929999998 | M39: 71.34 | R39: 4.0894583357217904 | S39: 13.3622846374319 | T39: =(RC[-16]*RC[-15]-RC[-13]*RC[-12])/1000 -> 13.319089193757703 | U39: 57.016075129999997 | V39: - | W39: =RC[-2]*RC[-10]/1000 -> 4.0675267997741997 | X39: =ABS((RC[-3]*RC[-11]-RC[-2]*RC[-9])/1000) -> #VALUE! | Y39: =(RC[-14]-RC[1])/RC[-18]*100 -> -7.6884567279949677E-5 | Z39: 57.016075129999997 | AC39: =VALUE(RC[-27]) -> 2018-10-18T00:00:00.000 | AD39: =IF(RC[21]=42,"*",IF(RC[21]=32,"",RC[21])) -> - | AE39: =RC[-28] -> 24 | AF39: =RC[-28] -> 642.47772216999999 | AG39: =RC[-28] -> 71.260000000000005 | AH39: =RC[-28] -> 5.793290388 | AI39: =RC[-28] -> 585.46209716999999 | AJ39: =RC[-28] -> 55.45 | AK39: =RC[-28] -> 2.9963927633599998 | AL39: =RC[-28] -> 15.810000000000002 | AM39: =RC[-28] -> 57.015625 | AN39: =RC[-28] -> 58.340148929999998 | AO39: =RC[-28] -> 71.34 | AP39: - | AQ39: =RC[-29] -> 0 | AR39: =RC[-29] -> 0 | AS39: - | AT39: =RC[-30] -> 0 | AU39: =RC[-30] -> 0 | AV39: =RC[-30] -> 4.0894583357217904 | AW39: =RC[-30] -> 13.3622846374319 | AY39: - | AZ39: - | BA39: -
A40: =IF(RC[1]="","",DATEVALUE(RC[1])) -> 43392 | B40: 19.10.18 | C40: 24 | D40: 641.12927246000004 | E40: 71.17 | F40: 5.8123345213600004 | G40: 583.30133057 | H40: 55.06 | I40: 2.98009830188 | J40: =RC[-5]-RC[-2] -> 16.11 | K40: 57.827941889999998 | L40: 58.441364290000003 | M40: 71.27 | R40: 4.0881522379860504 | S40: 13.5424695853635 | T40: =(RC[-16]*RC[-15]-RC[-13]*RC[-12])/1000 -> 13.512599059794004 | U40: 57.11870193 | V40: - | W40: =RC[-2]*RC[-10]/1000 -> 4.0708498865511 | X40: =ABS((RC[-3]*RC[-11]-RC[-2]*RC[-9])/1000) -> #VALUE! | Y40: =(RC[-14]-RC[1])/RC[-18]*100 -> 0.12159066383526523 | Z40: 57.11870193 | AC40: =VALUE(RC[-27]) -> 2018-10-19T00:00:00.000 | AD40: =IF(RC[21]=42,"*",IF(RC[21]=32,"",RC[21])) -> - | AE40: =RC[-28] -> 24 | AF40: =RC[-28] -> 641.12927246000004 | AG40: =RC[-28] -> 71.17 | AH40: =RC[-28] -> 5.8123345213600004 | AI40: =RC[-28] -> 583.30133057 | AJ40: =RC[-28] -> 55.06 | AK40: =RC[-28] -> 2.98009830188 | AL40: =RC[-28] -> 16.11 | AM40: =RC[-28] -> 57.827941889999998 | AN40: =RC[-28] -> 58.441364290000003 | AO40: =RC[-28] -> 71.27 | AP40: - | AQ40: =RC[-29] -> 0 | AR40: =RC[-29] -> 0 | AS40: - | AT40: =RC[-30] -> 0 | AU40: =RC[-30] -> 0 | AV40: =RC[-30] -> 4.0881522379860504 | AW40: =RC[-30] -> 13.5424695853635 | AY40: - | AZ40: - | BA40: -
A41: =IF(RC[1]="","",DATEVALUE(RC[1])) -> 43393 | B41: 20.10.18 | C41: 24 | D41: 643.97912598000005 | E41: 70.41 | F41: 5.8077571089999998 | G41: 582.76794433999999 | H41: 54.48 | I41: 2.9777832183599999 | J41: =RC[-5]-RC[-2] -> 15.93 | K41: 61.211181640000099 | L41: 61.913082119999999 | M41: 70.5 | R41: 4.2920510318142702 | S41: 13.632605338205799 | T41: =(RC[-16]*RC[-15]-RC[-13]*RC[-12])/1000 -> 13.593372652608602 | U41: 60.534187320000001 | V41: - | W41: =RC[-2]*RC[-10]/1000 -> 4.2676602060599995 | X41: =ABS((RC[-3]*RC[-11]-RC[-2]*RC[-9])/1000) -> #VALUE! | Y41: =(RC[-14]-RC[1])/RC[-18]*100 -> 0.11616876435556385 | Z41: 60.534187320000001 | AC41: =VALUE(RC[-27]) -> 2018-10-20T00:00:00.000 | AD41: =IF(RC[21]=42,"*",IF(RC[21]=32,"",RC[21])) -> - | AE41: =RC[-28] -> 24 | AF41: =RC[-28] -> 643.97912598000005 | AG41: =RC[-28] -> 70.41 | AH41: =RC[-28] -> 5.8077571089999998 | AI41: =RC[-28] -> 582.76794433999999 | AJ41: =RC[-28] -> 54.48 | AK41: =RC[-28] -> 2.9777832183599999 | AL41: =RC[-28] -> 15.93 | AM41: =RC[-28] -> 61.211181640000099 | AN41: =RC[-28] -> 61.913082119999999 | AO41: =RC[-28] -> 70.5 | AP41: - | AQ41: =RC[-29] -> 0 | AR41: =RC[-29] -> 0 | AS41: - | AT41: =RC[-30] -> 0 | AU41: =RC[-30] -> 0 | AV41: =RC[-30] -> 4.2920510318142702 | AW41: =RC[-30] -> 13.632605338205799 | AY41: - | AZ41: - | BA41: -
A42: =IF(RC[1]="","",DATEVALUE(RC[1])) -> 43394 | B42: 21.10.18 | C42: 24 | D42: 647.10552978999999 | E42: 69.62 | F42: 5.8140399158799996 | G42: 581.14385986000002 | H42: 53.99 | I42: 2.9505762931600001 | J42: =RC[-5]-RC[-2] -> 15.630000000000003 | K42: 65.961669929999999 | L42: 66.644882199999998 | M42: 69.67 | R42: 4.5665414970860798 | S42: 13.7132171061431 | T42: =(RC[-16]*RC[-15]-RC[-13]*RC[-12])/1000 -> 13.675529990138402 | U42: 65.197349549999998 | V42: - | W42: =RC[-2]*RC[-10]/1000 -> 4.5422993431485006 | X42: =ABS((RC[-3]*RC[-11]-RC[-2]*RC[-9])/1000) -> #VALUE! | Y42: =(RC[-14]-RC[1])/RC[-18]*100 -> 0.13151999578626347 | Z42: 65.197349549999998 | AC42: =VALUE(RC[-27]) -> 2018-10-21T00:00:00.000 | AD42: =IF(RC[21]=42,"*",IF(RC[21]=32,"",RC[21])) -> - | AE42: =RC[-28] -> 24 | AF42: =RC[-28] -> 647.10552978999999 | AG42: =RC[-28] -> 69.62 | AH42: =RC[-28] -> 5.8140399158799996 | AI42: =RC[-28] -> 581.14385986000002 | AJ42: =RC[-28] -> 53.99 | AK42: =RC[-28] -> 2.9505762931600001 | AL42: =RC[-28] -> 15.630000000000003 | AM42: =RC[-28] -> 65.961669929999999 | AN42: =RC[-28] -> 66.644882199999998 | AO42: =RC[-28] -> 69.67 | AP42: - | AQ42: =RC[-29] -> 0 | AR42: =RC[-29] -> 0 | AS42: - | AT42: =RC[-30] -> 0 | AU42: =RC[-30] -> 0 | AV42: =RC[-30] -> 4.5665414970860798 | AW42: =RC[-30] -> 13.7132171061431 | AY42: - | AZ42: - | BA42: -
A43: =IF(RC[1]="","",DATEVALUE(RC[1])) -> 43395 | B43: 22.10.18 | C43: 24 | D43: 642.96575928000004 | E43: 69.94 | F43: 5.8246707492000001 | G43: 580.73242187999995 | H43: 54.03 | I43: 2.93235837768 | J43: =RC[-5]-RC[-2] -> 15.909999999999997 | K43: 62.233337400000103 | L43: 62.445907589999997 | M43: 70.03 | R43: 4.3082799871023196 | S43: 13.638391893570301 | T43: =(RC[-16]*RC[-15]-RC[-13]*RC[-12])/1000 -> 13.592052449866806 | U43: 61.06799316 | V43: - | W43: =RC[-2]*RC[-10]/1000 -> 4.2765915609947998 | X43: =ABS((RC[-3]*RC[-11]-RC[-2]*RC[-9])/1000) -> #VALUE! | Y43: =(RC[-14]-RC[1])/RC[-18]*100 -> 0.20066801785020785 | Z43: 61.06799316 | AC43: =VALUE(RC[-27]) -> 2018-10-22T00:00:00.000 | AD43: =IF(RC[21]=42,"*",IF(RC[21]=32,"",RC[21])) -> - | AE43: =RC[-28] -> 24 | AF43: =RC[-28] -> 642.96575928000004 | AG43: =RC[-28] -> 69.94 | AH43: =RC[-28] -> 5.8246707492000001 | AI43: =RC[-28] -> 580.73242187999995 | AJ43: =RC[-28] -> 54.03 | AK43: =RC[-28] -> 2.93235837768 | AL43: =RC[-28] -> 15.909999999999997 | AM43: =RC[-28] -> 62.233337400000103 | AN43: =RC[-28] -> 62.445907589999997 | AO43: =RC[-28] -> 70.03 | AP43: - | AQ43: =RC[-29] -> 0 | AR43: =RC[-29] -> 0 | AS43: - | AT43: =RC[-30] -> 0 | AU43: =RC[-30] -> 0 | AV43: =RC[-30] -> 4.3082799871023196 | AW43: =RC[-30] -> 13.638391893570301 | AY43: - | AZ43: - | BA43: -
A44: =IF(RC[1]="","",DATEVALUE(RC[1])) ->  | C44: 24 | J44: =RC[-5]-RC[-2] -> #VALUE! | T44: =(RC[-16]*RC[-15]-RC[-13]*RC[-12])/1000 -> #VALUE! | W44: =RC[-2]*RC[-10]/1000 -> #VALUE! | X44: =ABS((RC[-3]*RC[-11]-RC[-2]*RC[-9])/1000) -> #VALUE! | Y44: =(RC[-14]-RC[1])/RC[-18]*100 -> #VALUE! | AC44: =VALUE(RC[-27]) -> #VALUE! | AD44: =IF(RC[21]=42,"*",IF(RC[21]=32,"",RC[21])) ->  | AE44: =RC[-28] -> 24 | AF44: =RC[-28] ->  | AG44: =RC[-28] ->  | AH44: =RC[-28] ->  | AI44: =RC[-28] ->  | AJ44: =RC[-28] ->  | AK44: =RC[-28] ->  | AL44: =RC[-28] -> #VALUE! | AM44: =RC[-28] ->  | AN44: =RC[-28] ->  | AO44: =RC[-28] ->  | AP44: - | AQ44: =RC[-29] -> 0 | AR44: =RC[-29] -> 0 | AS44: - | AT44: =RC[-30] -> 0 | AU44: =RC[-30] -> 0 | AV44: =RC[-30] ->  | AW44: =RC[-30] -> 
A45: =IF(RC[1]="","",DATEVALUE(RC[1])) ->  | C45: 24 | T45: =(RC[-16]*RC[-15]-RC[-13]*RC[-12])/1000 -> #VALUE! | W45: =RC[-2]*RC[-10]/1000 -> #VALUE! | X45: =ABS((RC[-3]*RC[-11]-RC[-2]*RC[-9])/1000) -> #VALUE! | Y45: =(RC[-14]-RC[1])/RC[-18]*100 -> #VALUE! | AC45: =VALUE(RC[-27]) -> #VALUE! | AD45: =IF(RC[21]=42,"*",IF(RC[21]=32,"",RC[21])) ->  | AE45: =RC[-28] -> 24 | AF45: =RC[-28] ->  | AG45: =RC[-28] ->  | AH45: =RC[-28] ->  | AI45: =RC[-28] ->  | AJ45: =RC[-28] ->  | AK45: =RC[-28] ->  | AL45: =RC[-28] -> 0 | AM45: =RC[-28] ->  | AN45: =RC[-28] ->  | AO45: =RC[-28] ->  | AP45: - | AQ45: =RC[-29] -> 0 | AR45: =RC[-29] -> 0 | AS45: - | AT45: =RC[-30] -> 0 | AU45: =RC[-30] -> 0 | AV45: =RC[-30] ->  | AW45: =RC[-30] -> 
A46: =IF(RC[1]="","",DATEVALUE(RC[1])) ->  | C46: 24 | T46: =(RC[-16]*RC[-15]-RC[-13]*RC[-12])/1000 -> #VALUE! | W46: =RC[-2]*RC[-10]/1000 -> #VALUE! | X46: =ABS((RC[-3]*RC[-11]-RC[-2]*RC[-9])/1000) -> #VALUE! | Y46: =(RC[-14]-RC[1])/RC[-18]*100 -> #VALUE! | AC46: =VALUE(RC[-27]) -> #VALUE! | AD46: =IF(RC[21]=42,"*",IF(RC[21]=32,"",RC[21])) ->  | AE46: =RC[-28] -> 24 | AF46: =RC[-28] ->  | AG46: =RC[-28] ->  | AH46: =RC[-28] ->  | AI46: =RC[-28] ->  | AJ46: =RC[-28] ->  | AK46: =RC[-28] ->  | AL46: =RC[-28] -> 0 | AM46: =RC[-28] ->  | AN46: =RC[-28] ->  | AO46: =RC[-28] ->  | AP46: - | AQ46: =RC[-29] -> 0 | AR46: =RC[-29] -> 0 | AS46: - | AT46: =RC[-30] -> 0 | AU46: =RC[-30] -> 0 | AV46: =RC[-30] ->  | AW46: =RC[-30] -> 
A47: =IF(RC[1]="","",DATEVALUE(RC[1])) ->  | C47: 24 | T47: =(RC[-16]*RC[-15]-RC[-13]*RC[-12])/1000 -> #VALUE! | W47: =RC[-2]*RC[-10]/1000 -> #VALUE! | X47: =ABS((RC[-3]*RC[-11]-RC[-2]*RC[-9])/1000) -> #VALUE! | Y47: =(RC[-14]-RC[1])/RC[-18]*100 -> #VALUE! | AC47: =VALUE(RC[-27]) -> #VALUE! | AD47: =IF(RC[21]=42,"*",IF(RC[21]=32,"",RC[21])) ->  | AE47: =RC[-28] -> 24 | AF47: =RC[-28] ->  | AG47: =RC[-28] ->  | AH47: =RC[-28] ->  | AI47: =RC[-28] ->  | AJ47: =RC[-28] ->  | AK47: =RC[-28] ->  | AL47: =RC[-28] -> 0 | AM47: =RC[-28] ->  | AN47: =RC[-28] ->  | AO47: =RC[-28] ->  | AP47: - | AQ47: =RC[-29] -> 0 | AR47: =RC[-29] -> 0 | AS47: - | AT47: =RC[-30] -> 0 | AU47: =RC[-30] -> 0 | AV47: =RC[-30] ->  | AW47: =RC[-30] -> 
A48: =IF(RC[1]="","",DATEVALUE(RC[1])) ->  | C48: 24 | T48: =(RC[-16]*RC[-15]-RC[-13]*RC[-12])/1000 -> #VALUE! | W48: =RC[-2]*RC[-10]/1000 -> #VALUE! | X48: =ABS((RC[-3]*RC[-11]-RC[-2]*RC[-9])/1000) -> #VALUE! | Y48: =(RC[-14]-RC[1])/RC[-18]*100 -> #VALUE! | AC48: =VALUE(RC[-27]) -> #VALUE! | AD48: =IF(RC[21]=42,"*",IF(RC[21]=32,"",RC[21])) ->  | AE48: =RC[-28] -> 24 | AF48: =RC[-28] ->  | AG48: =RC[-28] ->  | AH48: =RC[-28] ->  | AI48: =RC[-28] ->  | AJ48: =RC[-28] ->  | AK48: =RC[-28] ->  | AL48: =RC[-28] -> 0 | AM48: =RC[-28] ->  | AN48: =RC[-28] ->  | AO48: =RC[-28] ->  | AP48: - | AQ48: =RC[-29] -> 0 | AR48: =RC[-29] -> 0 | AS48: - | AT48: =RC[-30] -> 0 | AU48: =RC[-30] -> 0 | AV48: =RC[-30] ->  | AW48: =RC[-30] -> 
A49: =IF(RC[1]="","",DATEVALUE(RC[1])) ->  | C49: 24 | T49: =(RC[-16]*RC[-15]-RC[-13]*RC[-12])/1000 -> #VALUE! | W49: =RC[-2]*RC[-10]/1000 -> #VALUE! | X49: =ABS((RC[-3]*RC[-11]-RC[-2]*RC[-9])/1000) -> #VALUE! | Y49: =(RC[-14]-RC[1])/RC[-18]*100 -> #VALUE! | AC49: =VALUE(RC[-27]) -> #VALUE! | AD49: =IF(RC[21]=42,"*",IF(RC[21]=32,"",RC[21])) ->  | AE49: =RC[-28] -> 24 | AF49: =RC[-28] ->  | AG49: =RC[-28] ->  | AH49: =RC[-28] ->  | AI49: =RC[-28] ->  | AJ49: =RC[-28] ->  | AK49: =RC[-28] ->  | AL49: =RC[-28] -> 0 | AM49: =RC[-28] ->  | AN49: =RC[-28] ->  | AO49: =RC[-28] ->  | AP49: - | AQ49: =RC[-29] -> 0 | AR49: =RC[-29] -> 0 | AS49: - | AT49: =RC[-30] -> 0 | AU49: =RC[-30] -> 0 | AV49: =RC[-30] ->  | AW49: =RC[-30] -> 
A50: =IF(RC[1]="","",DATEVALUE(RC[1])) ->  | T50: =(RC[-16]*RC[-15]-RC[-13]*RC[-12])/1000 -> #VALUE! | W50: =RC[-2]*RC[-10]/1000 -> #VALUE! | X50: =ABS((RC[-3]*RC[-11]-RC[-2]*RC[-9])/1000) -> #VALUE! | Y50: =(RC[-14]-RC[1])/RC[-18]*100 -> #VALUE! | AC50: =VALUE(RC[-27]) -> #VALUE! | AD50: =IF(RC[21]=42,"*",IF(RC[21]=32,"",RC[21])) ->  | AE50: =RC[-28] ->  | AF50: =RC[-28] ->  | AG50: =RC[-28] ->  | AH50: =RC[-28] ->  | AI50: =RC[-28] ->  | AJ50: =RC[-28] ->  | AK50: =RC[-28] ->  | AL50: =RC[-28] -> 0 | AM50: =RC[-28] ->  | AN50: =RC[-28] ->  | AO50: =RC[-28] ->  | AP50: - | AQ50: =RC[-29] -> 0 | AR50: =RC[-29] -> 0 | AS50: - | AT50: =RC[-30] -> 0 | AU50: =RC[-30] -> 0 | AV50: =RC[-30] ->  | AW50: =RC[-30] -> 
A51: =IF(RC[1]="","",DATEVALUE(RC[1])) ->  | T51: =(RC[-16]*RC[-15]-RC[-13]*RC[-12])/1000 -> #VALUE! | W51: =RC[-2]*RC[-10]/1000 -> #VALUE! | X51: =ABS((RC[-3]*RC[-11]-RC[-2]*RC[-9])/1000) -> #VALUE! | Y51: =(RC[-14]-RC[1])/RC[-18]*100 -> #VALUE! | AC51: =VALUE(RC[-27]) -> #VALUE! | AD51: =IF(RC[21]=42,"*",IF(RC[21]=32,"",RC[21])) ->  | AE51: =RC[-28] ->  | AF51: =RC[-28] ->  | AG51: =RC[-28] ->  | AH51: =RC[-28] ->  | AI51: =RC[-28] ->  | AJ51: =RC[-28] ->  | AK51: =RC[-28] ->  | AL51: =RC[-28] -> 0 | AM51: =RC[-28] ->  | AN51: =RC[-28] ->  | AO51: =RC[-28] ->  | AP51: - | AQ51: =RC[-29] -> 0 | AR51: =RC[-29] -> 0 | AS51: - | AT51: =RC[-30] -> 0 | AU51: =RC[-30] -> 0 | AV51: =RC[-30] ->  | AW51: =RC[-30] -> 
A52: =IF(RC[1]="","",DATEVALUE(RC[1])) ->  | T52: =(RC[-16]*RC[-15]-RC[-13]*RC[-12])/1000 -> #VALUE! | W52: =RC[-2]*RC[-10]/1000 -> #VALUE! | X52: =ABS((RC[-3]*RC[-11]-RC[-2]*RC[-9])/1000) -> #VALUE! | Y52: =(RC[-14]-RC[1])/RC[-18]*100 -> #VALUE! | AC52: =VALUE(RC[-27]) -> #VALUE! | AD52: =IF(RC[21]=42,"*",IF(RC[21]=32,"",RC[21])) ->  | AE52: =RC[-28] ->  | AF52: =RC[-28] ->  | AG52: =RC[-28] ->  | AH52: =RC[-28] ->  | AI52: =RC[-28] ->  | AJ52: =RC[-28] ->  | AK52: =RC[-28] ->  | AL52: =RC[-28] -> 0 | AM52: =RC[-28] ->  | AN52: =RC[-28] ->  | AO52: =RC[-28] ->  | AP52: - | AQ52: =RC[-29] -> 0 | AR52: =RC[-29] -> 0 | AS52: - | AT52: =RC[-30] -> 0 | AU52: =RC[-30] -> 0 | AV52: =RC[-30] ->  | AW52: =RC[-30] -> 
A53: =IF(RC[1]="","",DATEVALUE(RC[1])) ->  | T53: =(RC[-16]*RC[-15]-RC[-13]*RC[-12])/1000 -> #VALUE! | W53: =RC[-2]*RC[-10]/1000 -> #VALUE! | X53: =ABS((RC[-3]*RC[-11]-RC[-2]*RC[-9])/1000) -> #VALUE! | Y53: =(RC[-14]-RC[1])/RC[-18]*100 -> #VALUE! | AC53: =VALUE(RC[-27]) -> #VALUE! | AD53: =IF(RC[21]=42,"*",IF(RC[21]=32,"",RC[21])) ->  | AE53: =RC[-28] ->  | AF53: =RC[-28] ->  | AG53: =RC[-28] ->  | AH53: =RC[-28] ->  | AI53: =RC[-28] ->  | AJ53: =RC[-28] ->  | AK53: =RC[-28] ->  | AL53: =RC[-28] -> 0 | AM53: =RC[-28] ->  | AN53: =RC[-28] ->  | AO53: =RC[-28] ->  | AP53: - | AQ53: =RC[-29] -> 0 | AR53: =RC[-29] -> 0 | AS53: - | AT53: =RC[-30] -> 0 | AU53: =RC[-30] -> 0 | AV53: =RC[-30] ->  | AW53: =RC[-30] -> 
A54: =IF(RC[1]="","",DATEVALUE(RC[1])) ->  | T54: =(RC[-16]*RC[-15]-RC[-13]*RC[-12])/1000 -> #VALUE! | W54: =RC[-2]*RC[-10]/1000 -> #VALUE! | X54: =ABS((RC[-3]*RC[-11]-RC[-2]*RC[-9])/1000) -> #VALUE! | Y54: =(RC[-14]-RC[1])/RC[-18]*100 -> #VALUE! | AC54: =VALUE(RC[-27]) -> #VALUE! | AD54: =IF(RC[21]=42,"*",IF(RC[21]=32,"",RC[21])) ->  | AE54: =RC[-28] ->  | AF54: =RC[-28] ->  | AG54: =RC[-28] ->  | AH54: =RC[-28] ->  | AI54: =RC[-28] ->  | AJ54: =RC[-28] ->  | AK54: =RC[-28] ->  | AL54: =RC[-28] -> 0 | AM54: =RC[-28] ->  | AN54: =RC[-28] ->  | AO54: =RC[-28] ->  | AP54: - | AQ54: =RC[-29] -> 0 | AR54: =RC[-29] -> 0 | AS54: - | AT54: =RC[-30] -> 0 | AU54: =RC[-30] -> 0 | AV54: =RC[-30] ->  | AW54: =RC[-30] -> 
A55: =IF(RC[1]="","",DATEVALUE(RC[1])) ->  | T55: =(RC[-16]*RC[-15]-RC[-13]*RC[-12])/1000 -> #VALUE! | W55: =RC[-2]*RC[-10]/1000 -> #VALUE! | X55: =ABS((RC[-3]*RC[-11]-RC[-2]*RC[-9])/1000) -> #VALUE! | Y55: =(RC[-14]-RC[1])/RC[-18]*100 -> #VALUE! | AC55: =VALUE(RC[-27]) -> #VALUE! | AD55: =IF(RC[21]=42,"*",IF(RC[21]=32,"",RC[21])) ->  | AE55: =RC[-28] ->  | AF55: =RC[-28] ->  | AG55: =RC[-28] ->  | AH55: =RC[-28] ->  | AI55: =RC[-28] ->  | AJ55: =RC[-28] ->  | AK55: =RC[-28] ->  | AL55: =RC[-28] -> 0 | AM55: =RC[-28] ->  | AN55: =RC[-28] ->  | AO55: =RC[-28] ->  | AP55: - | AQ55: =RC[-29] -> 0 | AR55: =RC[-29] -> 0 | AS55: - | AT55: =RC[-30] -> 0 | AU55: =RC[-30] -> 0 | AV55: =RC[-30] ->  | AW55: =RC[-30] -> 
A56: =IF(RC[1]="","",DATEVALUE(RC[1])) ->  | T56: =(RC[-16]*RC[-15]-RC[-13]*RC[-12])/1000 -> #VALUE! | W56: =RC[-2]*RC[-10]/1000 -> #VALUE! | X56: =ABS((RC[-3]*RC[-11]-RC[-2]*RC[-9])/1000) -> #VALUE! | Y56: =(RC[-14]-RC[1])/RC[-18]*100 -> #VALUE! | AC56: =VALUE(RC[-27]) -> #VALUE! | AD56: =IF(RC[21]=42,"*",IF(RC[21]=32,"",RC[21])) ->  | AE56: =RC[-28] ->  | AF56: =RC[-28] ->  | AG56: =RC[-28] ->  | AH56: =RC[-28] ->  | AI56: =RC[-28] ->  | AJ56: =RC[-28] ->  | AK56: =RC[-28] ->  | AL56: =RC[-28] -> 0 | AM56: =RC[-28] ->  | AN56: =RC[-28] ->  | AO56: =RC[-28] ->  | AP56: - | AQ56: =RC[-29] -> 0 | AR56: =RC[-29] -> 0 | AS56: - | AT56: =RC[-30] -> 0 | AU56: =RC[-30] -> 0 | AV56: =RC[-30] ->  | AW56: =RC[-30] -> 
A57: =IF(RC[1]="","",DATEVALUE(RC[1])) ->  | T57: =(RC[-16]*RC[-15]-RC[-13]*RC[-12])/1000 -> #VALUE! | W57: =RC[-2]*RC[-10]/1000 -> #VALUE! | X57: =ABS((RC[-3]*RC[-11]-RC[-2]*RC[-9])/1000) -> #VALUE! | Y57: =(RC[-14]-RC[1])/RC[-18]*100 -> #VALUE! | AC57: =VALUE(RC[-27]) -> #VALUE! | AD57: =IF(RC[21]=42,"*",IF(RC[21]=32,"",RC[21])) ->  | AE57: =RC[-28] ->  | AF57: =RC[-28] ->  | AG57: =RC[-28] ->  | AH57: =RC[-28] ->  | AI57: =RC[-28] ->  | AJ57: =RC[-28] ->  | AK57: =RC[-28] ->  | AL57: =RC[-28] -> 0 | AM57: =RC[-28] ->  | AN57: =RC[-28] ->  | AO57: =RC[-28] ->  | AP57: - | AQ57: =RC[-29] -> 0 | AR57: =RC[-29] -> 0 | AS57: - | AT57: =RC[-30] -> 0 | AU57: =RC[-30] -> 0 | AV57: =RC[-30] ->  | AW57: =RC[-30] -> 
A58: =IF(RC[1]="","",DATEVALUE(RC[1])) ->  | T58: =(RC[-16]*RC[-15]-RC[-13]*RC[-12])/1000 -> #VALUE! | W58: =RC[-2]*RC[-10]/1000 -> #VALUE! | X58: =ABS((RC[-3]*RC[-11]-RC[-2]*RC[-9])/1000) -> #VALUE! | Y58: =(RC[-14]-RC[1])/RC[-18]*100 -> #VALUE! | AC58: =VALUE(RC[-27]) -> #VALUE! | AD58: =IF(RC[21]=42,"*",IF(RC[21]=32,"",RC[21])) ->  | AE58: =RC[-28] ->  | AF58: =RC[-28] ->  | AG58: =RC[-28] ->  | AH58: =RC[-28] ->  | AI58: =RC[-28] ->  | AJ58: =RC[-28] ->  | AK58: =RC[-28] ->  | AL58: =RC[-28] -> 0 | AM58: =RC[-28] ->  | AN58: =RC[-28] ->  | AO58: =RC[-28] ->  | AP58: - | AQ58: =RC[-29] -> 0 | AR58: =RC[-29] -> 0 | AS58: - | AT58: =RC[-30] -> 0 | AU58: =RC[-30] -> 0 | AV58: =RC[-30] ->  | AW58: =RC[-30] -> 
A59: =IF(RC[1]="","",DATEVALUE(RC[1])) ->  | T59: =(RC[-16]*RC[-15]-RC[-13]*RC[-12])/1000 -> #VALUE! | W59: =RC[-2]*RC[-10]/1000 -> #VALUE! | X59: =ABS((RC[-3]*RC[-11]-RC[-2]*RC[-9])/1000) -> #VALUE! | Y59: =(RC[-14]-RC[1])/RC[-18]*100 -> #VALUE! | AC59: =VALUE(RC[-27]) -> #VALUE! | AD59: =IF(RC[21]=42,"*",IF(RC[21]=32,"",RC[21])) ->  | AE59: =RC[-28] ->  | AF59: =RC[-28] ->  | AG59: =RC[-28] ->  | AH59: =RC[-28] ->  | AI59: =RC[-28] ->  | AJ59: =RC[-28] ->  | AK59: =RC[-28] ->  | AL59: =RC[-28] -> 0 | AM59: =RC[-28] ->  | AN59: =RC[-28] ->  | AO59: =RC[-28] ->  | AP59: - | AQ59: =RC[-29] -> 0 | AR59: =RC[-29] -> 0 | AS59: - | AT59: =RC[-30] -> 0 | AU59: =RC[-30] -> 0 | AV59: =RC[-30] ->  | AW59: =RC[-30] -> 
A60: =IF(RC[1]="","",DATEVALUE(RC[1])) ->  | T60: =(RC[-16]*RC[-15]-RC[-13]*RC[-12])/1000 -> #VALUE! | W60: =RC[-2]*RC[-10]/1000 -> #VALUE! | X60: =ABS((RC[-3]*RC[-11]-RC[-2]*RC[-9])/1000) -> #VALUE! | Y60: =(RC[-14]-RC[1])/RC[-18]*100 -> #VALUE! | AC60: =VALUE(RC[-27]) -> #VALUE! | AD60: =IF(RC[21]=42,"*",IF(RC[21]=32,"",RC[21])) ->  | AE60: =RC[-28] ->  | AF60: =RC[-28] ->  | AG60: =RC[-28] ->  | AH60: =RC[-28] ->  | AI60: =RC[-28] ->  | AJ60: =RC[-28] ->  | AK60: =RC[-28] ->  | AL60: =RC[-28] -> 0 | AM60: =RC[-28] ->  | AN60: =RC[-28] ->  | AO60: =RC[-28] ->  | AP60: - | AQ60: =RC[-29] -> 0 | AR60: =RC[-29] -> 0 | AS60: - | AT60: =RC[-30] -> 0 | AU60: =RC[-30] -> 0 | AV60: =RC[-30] ->  | AW60: =RC[-30] -> 
A61: =IF(RC[1]="","",DATEVALUE(RC[1])) ->  | T61: =(RC[-16]*RC[-15]-RC[-13]*RC[-12])/1000 -> #VALUE! | W61: =RC[-2]*RC[-10]/1000 -> #VALUE! | X61: =ABS((RC[-3]*RC[-11]-RC[-2]*RC[-9])/1000) -> #VALUE! | Y61: =(RC[-14]-RC[1])/RC[-18]*100 -> #VALUE! | AC61: =VALUE(RC[-27]) -> #VALUE! | AD61: =IF(RC[21]=42,"*",IF(RC[21]=32,"",RC[21])) ->  | AE61: =RC[-28] ->  | AF61: =RC[-28] ->  | AG61: =RC[-28] ->  | AH61: =RC[-28] ->  | AI61: =RC[-28] ->  | AJ61: =RC[-28] ->  | AK61: =RC[-28] ->  | AL61: =RC[-28] -> 0 | AM61: =RC[-28] ->  | AN61: =RC[-28] ->  | AO61: =RC[-28] ->  | AP61: - | AQ61: =RC[-29] -> 0 | AR61: =RC[-29] -> 0 | AS61: - | AT61: =RC[-30] -> 0 | AU61: =RC[-30] -> 0 | AV61: =RC[-30] ->  | AW61: =RC[-30] -> 
A62: =IF(RC[1]="","",DATEVALUE(RC[1])) ->  | T62: =(RC[-16]*RC[-15]-RC[-13]*RC[-12])/1000 -> #VALUE! | W62: =RC[-2]*RC[-10]/1000 -> #VALUE! | X62: =ABS((RC[-3]*RC[-11]-RC[-2]*RC[-9])/1000) -> #VALUE! | Y62: =(RC[-14]-RC[1])/RC[-18]*100 -> #VALUE! | AC62: =VALUE(RC[-27]) -> #VALUE! | AD62: =IF(RC[21]=42,"*",IF(RC[21]=32,"",RC[21])) ->  | AE62: =RC[-28] ->  | AF62: =RC[-28] ->  | AG62: =RC[-28] ->  | AH62: =RC[-28] ->  | AI62: =RC[-28] ->  | AJ62: =RC[-28] ->  | AK62: =RC[-28] ->  | AL62: =RC[-28] -> 0 | AM62: =RC[-28] ->  | AN62: =RC[-28] ->  | AO62: =RC[-28] ->  | AP62: - | AQ62: =RC[-29] -> 0 | AR62: =RC[-29] -> 0 | AS62: - | AT62: =RC[-30] -> 0 | AU62: =RC[-30] -> 0 | AV62: =RC[-30] ->  | AW62: =RC[-30] -> 
A63: =IF(RC[1]="","",DATEVALUE(RC[1])) ->  | T63: =(RC[-16]*RC[-15]-RC[-13]*RC[-12])/1000 -> #VALUE! | W63: =RC[-2]*RC[-10]/1000 -> #VALUE! | X63: =ABS((RC[-3]*RC[-11]-RC[-2]*RC[-9])/1000) -> #VALUE! | Y63: =(RC[-14]-RC[1])/RC[-18]*100 -> #VALUE! | AC63: =VALUE(RC[-27]) -> #VALUE! | AD63: =IF(RC[21]=42,"*",IF(RC[21]=32,"",RC[21])) ->  | AE63: =RC[-28] ->  | AF63: =RC[-28] ->  | AG63: =RC[-28] ->  | AH63: =RC[-28] ->  | AI63: =RC[-28] ->  | AJ63: =RC[-28] ->  | AK63: =RC[-28] ->  | AL63: =RC[-28] -> 0 | AM63: =RC[-28] ->  | AN63: =RC[-28] ->  | AO63: =RC[-28] ->  | AP63: - | AQ63: =RC[-29] -> 0 | AR63: =RC[-29] -> 0 | AS63: - | AT63: =RC[-30] -> 0 | AU63: =RC[-30] -> 0 | AV63: =RC[-30] ->  | AW63: =RC[-30] -> 
A64: =IF(RC[1]="","",DATEVALUE(RC[1])) ->  | T64: =(RC[-16]*RC[-15]-RC[-13]*RC[-12])/1000 -> #VALUE! | W64: =RC[-2]*RC[-10]/1000 -> #VALUE! | X64: =ABS((RC[-3]*RC[-11]-RC[-2]*RC[-9])/1000) -> #VALUE! | Y64: =(RC[-14]-RC[1])/RC[-18]*100 -> #VALUE! | AC64: =VALUE(RC[-27]) -> #VALUE! | AD64: =IF(RC[21]=42,"*",IF(RC[21]=32,"",RC[21])) ->  | AE64: =RC[-28] ->  | AF64: =RC[-28] ->  | AG64: =RC[-28] ->  | AH64: =RC[-28] ->  | AI64: =RC[-28] ->  | AJ64: =RC[-28] ->  | AK64: =RC[-28] ->  | AL64: =RC[-28] -> 0 | AM64: =RC[-28] ->  | AN64: =RC[-28] ->  | AO64: =RC[-28] ->  | AP64: - | AQ64: =RC[-29] -> 0 | AR64: =RC[-29] -> 0 | AS64: - | AT64: =RC[-30] -> 0 | AU64: =RC[-30] -> 0 | AV64: =RC[-30] ->  | AW64: =RC[-30] -> 
A65: =IF(RC[1]="","",DATEVALUE(RC[1])) ->  | T65: =(RC[-16]*RC[-15]-RC[-13]*RC[-12])/1000 -> #VALUE! | W65: =RC[-2]*RC[-10]/1000 -> #VALUE! | X65: =ABS((RC[-3]*RC[-11]-RC[-2]*RC[-9])/1000) -> #VALUE! | Y65: =(RC[-14]-RC[1])/RC[-18]*100 -> #VALUE! | AC65: =VALUE(RC[-27]) -> #VALUE! | AD65: =IF(RC[21]=42,"*",IF(RC[21]=32,"",RC[21])) ->  | AE65: =RC[-28] ->  | AF65: =RC[-28] ->  | AG65: =RC[-28] ->  | AH65: =RC[-28] ->  | AI65: =RC[-28] ->  | AJ65: =RC[-28] ->  | AK65: =RC[-28] ->  | AL65: =RC[-28] -> 0 | AM65: =RC[-28] ->  | AN65: =RC[-28] ->  | AO65: =RC[-28] ->  | AP65: - | AQ65: =RC[-29] -> 0 | AR65: =RC[-29] -> 0 | AS65: - | AT65: =RC[-30] -> 0 | AU65: =RC[-30] -> 0 | AV65: =RC[-30] ->  | AW65: =RC[-30] -> 
A66: =IF(RC[1]="","",DATEVALUE(RC[1])) ->  | T66: =(RC[-16]*RC[-15]-RC[-13]*RC[-12])/1000 -> #VALUE! | W66: =RC[-2]*RC[-10]/1000 -> #VALUE! | X66: =ABS((RC[-3]*RC[-11]-RC[-2]*RC[-9])/1000) -> #VALUE! | Y66: =(RC[-14]-RC[1])/RC[-18]*100 -> #VALUE! | AC66: =VALUE(RC[-27]) -> #VALUE! | AD66: =IF(RC[21]=42,"*",IF(RC[21]=32,"",RC[21])) ->  | AE66: =RC[-28] ->  | AF66: =RC[-28] ->  | AG66: =RC[-28] ->  | AH66: =RC[-28] ->  | AI66: =RC[-28] ->  | AJ66: =RC[-28] ->  | AK66: =RC[-28] ->  | AL66: =RC[-28] -> 0 | AM66: =RC[-28] ->  | AN66: =RC[-28] ->  | AO66: =RC[-28] ->  | AP66: - | AQ66: =RC[-29] -> 0 | AR66: =RC[-29] -> 0 | AS66: - | AT66: =RC[-30] -> 0 | AU66: =RC[-30] -> 0 | AV66: =RC[-30] ->  | AW66: =RC[-30] -> 
A67: =IF(RC[1]="","",DATEVALUE(RC[1])) ->  | T67: =(RC[-16]*RC[-15]-RC[-13]*RC[-12])/1000 -> #VALUE! | W67: =RC[-2]*RC[-10]/1000 -> #VALUE! | X67: =ABS((RC[-3]*RC[-11]-RC[-2]*RC[-9])/1000) -> #VALUE! | Y67: =(RC[-14]-RC[1])/RC[-18]*100 -> #VALUE! | AC67: =VALUE(RC[-27]) -> #VALUE! | AD67: =IF(RC[21]=42,"*",IF(RC[21]=32,"",RC[21])) ->  | AE67: =RC[-28] ->  | AF67: =RC[-28] ->  | AG67: =RC[-28] ->  | AH67: =RC[-28] ->  | AI67: =RC[-28] ->  | AJ67: =RC[-28] ->  | AK67: =RC[-28] ->  | AL67: =RC[-28] -> 0 | AM67: =RC[-28] ->  | AN67: =RC[-28] ->  | AO67: =RC[-28] ->  | AP67: - | AQ67: =RC[-29] -> 0 | AR67: =RC[-29] -> 0 | AS67: - | AT67: =RC[-30] -> 0 | AU67: =RC[-30] -> 0 | AV67: =RC[-30] ->  | AW67: =RC[-30] -> 
A68: =IF(RC[1]="","",DATEVALUE(RC[1])) ->  | T68: =(RC[-16]*RC[-15]-RC[-13]*RC[-12])/1000 -> #VALUE! | W68: =RC[-2]*RC[-10]/1000 -> #VALUE! | X68: =ABS((RC[-3]*RC[-11]-RC[-2]*RC[-9])/1000) -> #VALUE! | Y68: =(RC[-14]-RC[1])/RC[-18]*100 -> #VALUE! | AC68: =VALUE(RC[-27]) -> #VALUE! | AD68: =IF(RC[21]=42,"*",IF(RC[21]=32,"",RC[21])) ->  | AE68: =RC[-28] ->  | AF68: =RC[-28] ->  | AG68: =RC[-28] ->  | AH68: =RC[-28] ->  | AI68: =RC[-28] ->  | AJ68: =RC[-28] ->  | AK68: =RC[-28] ->  | AL68: =RC[-28] -> 0 | AM68: =RC[-28] ->  | AN68: =RC[-28] ->  | AO68: =RC[-28] ->  | AP68: - | AQ68: =RC[-29] -> 0 | AR68: =RC[-29] -> 0 | AS68: - | AT68: =RC[-30] -> 0 | AU68: =RC[-30] -> 0 | AV68: =RC[-30] ->  | AW68: =RC[-30] -> 
A69: =IF(RC[1]="","",DATEVALUE(RC[1])) ->  | T69: =(RC[-16]*RC[-15]-RC[-13]*RC[-12])/1000 -> #VALUE! | W69: =RC[-2]*RC[-10]/1000 -> #VALUE! | X69: =ABS((RC[-3]*RC[-11]-RC[-2]*RC[-9])/1000) -> #VALUE! | Y69: =(RC[-14]-RC[1])/RC[-18]*100 -> #VALUE! | AC69: =VALUE(RC[-27]) -> #VALUE! | AD69: =IF(RC[21]=42,"*",IF(RC[21]=32,"",RC[21])) ->  | AE69: =RC[-28] ->  | AF69: =RC[-28] ->  | AG69: =RC[-28] ->  | AH69: =RC[-28] ->  | AI69: =RC[-28] ->  | AJ69: =RC[-28] ->  | AK69: =RC[-28] ->  | AL69: =RC[-28] -> 0 | AM69: =RC[-28] ->  | AN69: =RC[-28] ->  | AO69: =RC[-28] ->  | AP69: - | AQ69: =RC[-29] -> 0 | AR69: =RC[-29] -> 0 | AS69: - | AT69: =RC[-30] -> 0 | AU69: =RC[-30] -> 0 | AV69: =RC[-30] ->  | AW69: =RC[-30] -> 
A70: =IF(RC[1]="","",DATEVALUE(RC[1])) ->  | T70: =(RC[-16]*RC[-15]-RC[-13]*RC[-12])/1000 -> #VALUE! | W70: =RC[-2]*RC[-10]/1000 -> #VALUE! | X70: =ABS((RC[-3]*RC[-11]-RC[-2]*RC[-9])/1000) -> #VALUE! | Y70: =(RC[-14]-RC[1])/RC[-18]*100 -> #VALUE! | AC70: =VALUE(RC[-27]) -> #VALUE! | AD70: =IF(RC[21]=42,"*",IF(RC[21]=32,"",RC[21])) ->  | AE70: =RC[-28] ->  | AF70: =RC[-28] ->  | AG70: =RC[-28] ->  | AH70: =RC[-28] ->  | AI70: =RC[-28] ->  | AJ70: =RC[-28] ->  | AK70: =RC[-28] ->  | AL70: =RC[-28] -> 0 | AM70: =RC[-28] ->  | AN70: =RC[-28] ->  | AO70: =RC[-28] ->  | AP70: - | AQ70: =RC[-29] -> 0 | AR70: =RC[-29] -> 0 | AS70: - | AT70: =RC[-30] -> 0 | AU70: =RC[-30] -> 0 | AV70: =RC[-30] ->  | AW70: =RC[-30] -> 
A71: =IF(RC[1]="","",DATEVALUE(RC[1])) ->  | T71: =(RC[-16]*RC[-15]-RC[-13]*RC[-12])/1000 -> #VALUE! | W71: =RC[-2]*RC[-10]/1000 -> #VALUE! | X71: =ABS((RC[-3]*RC[-11]-RC[-2]*RC[-9])/1000) -> #VALUE! | Y71: =(RC[-14]-RC[1])/RC[-18]*100 -> #VALUE! | AC71: =VALUE(RC[-27]) -> #VALUE! | AD71: =IF(RC[21]=42,"*",IF(RC[21]=32,"",RC[21])) ->  | AE71: =RC[-28] ->  | AF71: =RC[-28] ->  | AG71: =RC[-28] ->  | AH71: =RC[-28] ->  | AI71: =RC[-28] ->  | AJ71: =RC[-28] ->  | AK71: =RC[-28] ->  | AL71: =RC[-28] -> 0 | AM71: =RC[-28] ->  | AN71: =RC[-28] ->  | AO71: =RC[-28] ->  | AP71: - | AQ71: =RC[-29] -> 0 | AR71: =RC[-29] -> 0 | AS71: - | AT71: =RC[-30] -> 0 | AU71: =RC[-30] -> 0 | AV71: =RC[-30] ->  | AW71: =RC[-30] -> 
A72: =IF(RC[1]="","",DATEVALUE(RC[1])) ->  | T72: =(RC[-16]*RC[-15]-RC[-13]*RC[-12])/1000 -> #VALUE! | W72: =RC[-2]*RC[-10]/1000 -> #VALUE! | X72: =ABS((RC[-3]*RC[-11]-RC[-2]*RC[-9])/1000) -> #VALUE! | Y72: =(RC[-14]-RC[1])/RC[-18]*100 -> #VALUE! | AC72: =VALUE(RC[-27]) -> #VALUE! | AD72: =IF(RC[21]=42,"*",IF(RC[21]=32,"",RC[21])) ->  | AE72: =RC[-28] ->  | AF72: =RC[-28] ->  | AG72: =RC[-28] ->  | AH72: =RC[-28] ->  | AI72: =RC[-28] ->  | AJ72: =RC[-28] ->  | AK72: =RC[-28] ->  | AL72: =RC[-28] -> 0 | AM72: =RC[-28] ->  | AN72: =RC[-28] ->  | AO72: =RC[-28] ->  | AP72: - | AQ72: =RC[-29] -> 0 | AR72: =RC[-29] -> 0 | AS72: - | AT72: =RC[-30] -> 0 | AU72: =RC[-30] -> 0 | AV72: =RC[-30] ->  | AW72: =RC[-30] -> 
A73: =IF(RC[1]="","",DATEVALUE(RC[1])) ->  | T73: =(RC[-16]*RC[-15]-RC[-13]*RC[-12])/1000 -> #VALUE! | W73: =RC[-2]*RC[-10]/1000 -> #VALUE! | X73: =ABS((RC[-3]*RC[-11]-RC[-2]*RC[-9])/1000) -> #VALUE! | Y73: =(RC[-14]-RC[1])/RC[-18]*100 -> #VALUE! | AC73: =VALUE(RC[-27]) -> #VALUE! | AD73: =IF(RC[21]=42,"*",IF(RC[21]=32,"",RC[21])) ->  | AE73: =RC[-28] ->  | AF73: =RC[-28] ->  | AG73: =RC[-28] ->  | AH73: =RC[-28] ->  | AI73: =RC[-28] ->  | AJ73: =RC[-28] ->  | AK73: =RC[-28] ->  | AL73: =RC[-28] -> 0 | AM73: =RC[-28] ->  | AN73: =RC[-28] ->  | AO73: =RC[-28] ->  | AP73: - | AQ73: =RC[-29] -> 0 | AR73: =RC[-29] -> 0 | AS73: - | AT73: =RC[-30] -> 0 | AU73: =RC[-30] -> 0 | AV73: =RC[-30] ->  | AW73: =RC[-30] -> 
A74: =IF(RC[1]="","",DATEVALUE(RC[1])) ->  | T74: =(RC[-16]*RC[-15]-RC[-13]*RC[-12])/1000 -> #VALUE! | W74: =RC[-2]*RC[-10]/1000 -> #VALUE! | X74: =ABS((RC[-3]*RC[-11]-RC[-2]*RC[-9])/1000) -> #VALUE! | Y74: =(RC[-14]-RC[1])/RC[-18]*100 -> #VALUE! | AC74: =VALUE(RC[-27]) -> #VALUE! | AD74: =IF(RC[21]=42,"*",IF(RC[21]=32,"",RC[21])) ->  | AE74: =RC[-28] ->  | AF74: =RC[-28] ->  | AG74: =RC[-28] ->  | AH74: =RC[-28] ->  | AI74: =RC[-28] ->  | AJ74: =RC[-28] ->  | AK74: =RC[-28] ->  | AL74: =RC[-28] -> 0 | AM74: =RC[-28] ->  | AN74: =RC[-28] ->  | AO74: =RC[-28] ->  | AP74: - | AQ74: =RC[-29] -> 0 | AR74: =RC[-29] -> 0 | AS74: - | AT74: =RC[-30] -> 0 | AU74: =RC[-30] -> 0 | AV74: =RC[-30] ->  | AW74: =RC[-30] -> 
A75: =IF(RC[1]="","",DATEVALUE(RC[1])) ->  | T75: =(RC[-16]*RC[-15]-RC[-13]*RC[-12])/1000 -> #VALUE! | W75: =RC[-2]*RC[-10]/1000 -> #VALUE! | X75: =ABS((RC[-3]*RC[-11]-RC[-2]*RC[-9])/1000) -> #VALUE! | Y75: =(RC[-14]-RC[1])/RC[-18]*100 -> #VALUE! | AC75: =VALUE(RC[-27]) -> #VALUE! | AD75: =IF(RC[21]=42,"*",IF(RC[21]=32,"",RC[21])) ->  | AE75: =RC[-28] ->  | AF75: =RC[-28] ->  | AG75: =RC[-28] ->  | AH75: =RC[-28] ->  | AI75: =RC[-28] ->  | AJ75: =RC[-28] ->  | AK75: =RC[-28] ->  | AL75: =RC[-28] -> 0 | AM75: =RC[-28] ->  | AN75: =RC[-28] ->  | AO75: =RC[-28] ->  | AP75: - | AQ75: =RC[-29] -> 0 | AR75: =RC[-29] -> 0 | AS75: - | AT75: =RC[-30] -> 0 | AU75: =RC[-30] -> 0 | AV75: =RC[-30] ->  | AW75: =RC[-30] -> 
A76: =IF(RC[1]="","",DATEVALUE(RC[1])) ->  | T76: =(RC[-16]*RC[-15]-RC[-13]*RC[-12])/1000 -> #VALUE! | W76: =RC[-2]*RC[-10]/1000 -> #VALUE! | X76: =ABS((RC[-3]*RC[-11]-RC[-2]*RC[-9])/1000) -> #VALUE! | Y76: =(RC[-14]-RC[1])/RC[-18]*100 -> #VALUE! | AC76: =VALUE(RC[-27]) -> #VALUE! | AD76: =IF(RC[21]=42,"*",IF(RC[21]=32,"",RC[21])) ->  | AE76: =RC[-28] ->  | AF76: =RC[-28] ->  | AG76: =RC[-28] ->  | AH76: =RC[-28] ->  | AI76: =RC[-28] ->  | AJ76: =RC[-28] ->  | AK76: =RC[-28] ->  | AL76: =RC[-28] -> 0 | AM76: =RC[-28] ->  | AN76: =RC[-28] ->  | AO76: =RC[-28] ->  | AP76: - | AQ76: =RC[-29] -> 0 | AR76: =RC[-29] -> 0 | AS76: - | AT76: =RC[-30] -> 0 | AU76: =RC[-30] -> 0 | AV76: =RC[-30] ->  | AW76: =RC[-30] -> 
A77: =IF(RC[1]="","",DATEVALUE(RC[1])) ->  | T77: =(RC[-16]*RC[-15]-RC[-13]*RC[-12])/1000 -> #VALUE! | W77: =RC[-2]*RC[-10]/1000 -> #VALUE! | X77: =ABS((RC[-3]*RC[-11]-RC[-2]*RC[-9])/1000) -> #VALUE! | Y77: =(RC[-14]-RC[1])/RC[-18]*100 -> #VALUE! | AC77: =VALUE(RC[-27]) -> #VALUE! | AD77: =IF(RC[21]=42,"*",IF(RC[21]=32,"",RC[21])) ->  | AE77: =RC[-28] ->  | AF77: =RC[-28] ->  | AG77: =RC[-28] ->  | AH77: =RC[-28] ->  | AI77: =RC[-28] ->  | AJ77: =RC[-28] ->  | AK77: =RC[-28] ->  | AL77: =RC[-28] -> 0 | AM77: =RC[-28] ->  | AN77: =RC[-28] ->  | AO77: =RC[-28] ->  | AP77: - | AQ77: =RC[-29] -> 0 | AR77: =RC[-29] -> 0 | AS77: - | AT77: =RC[-30] -> 0 | AU77: =RC[-30] -> 0 | AV77: =RC[-30] ->  | AW77: =RC[-30] -> 
A78: =IF(RC[1]="","",DATEVALUE(RC[1])) ->  | T78: =(RC[-16]*RC[-15]-RC[-13]*RC[-12])/1000 -> #VALUE! | W78: =RC[-2]*RC[-10]/1000 -> #VALUE! | X78: =ABS((RC[-3]*RC[-11]-RC[-2]*RC[-9])/1000) -> #VALUE! | Y78: =(RC[-14]-RC[1])/RC[-18]*100 -> #VALUE! | AC78: =VALUE(RC[-27]) -> #VALUE! | AD78: =IF(RC[21]=42,"*",IF(RC[21]=32,"",RC[21])) ->  | AE78: =RC[-28] ->  | AF78: =RC[-28] ->  | AG78: =RC[-28] ->  | AH78: =RC[-28] ->  | AI78: =RC[-28] ->  | AJ78: =RC[-28] ->  | AK78: =RC[-28] ->  | AL78: =RC[-28] -> 0 | AM78: =RC[-28] ->  | AN78: =RC[-28] ->  | AO78: =RC[-28] ->  | AP78: - | AQ78: =RC[-29] -> 0 | AR78: =RC[-29] -> 0 | AS78: - | AT78: =RC[-30] -> 0 | AU78: =RC[-30] -> 0 | AV78: =RC[-30] ->  | AW78: =RC[-30] -> 
A79: =IF(RC[1]="","",DATEVALUE(RC[1])) ->  | T79: =(RC[-16]*RC[-15]-RC[-13]*RC[-12])/1000 -> #VALUE! | W79: =RC[-2]*RC[-10]/1000 -> #VALUE! | X79: =ABS((RC[-3]*RC[-11]-RC[-2]*RC[-9])/1000) -> #VALUE! | Y79: =(RC[-14]-RC[1])/RC[-18]*100 -> #VALUE! | AC79: =VALUE(RC[-27]) -> #VALUE! | AD79: =IF(RC[21]=42,"*",IF(RC[21]=32,"",RC[21])) ->  | AE79: =RC[-28] ->  | AF79: =RC[-28] ->  | AG79: =RC[-28] ->  | AH79: =RC[-28] ->  | AI79: =RC[-28] ->  | AJ79: =RC[-28] ->  | AK79: =RC[-28] ->  | AL79: =RC[-28] -> 0 | AM79: =RC[-28] ->  | AN79: =RC[-28] ->  | AO79: =RC[-28] ->  | AP79: - | AQ79: =RC[-29] -> 0 | AR79: =RC[-29] -> 0 | AS79: - | AT79: =RC[-30] -> 0 | AU79: =RC[-30] -> 0 | AV79: =RC[-30] ->  | AW79: =RC[-30] -> 
A80: =IF(RC[1]="","",DATEVALUE(RC[1])) ->  | T80: =(RC[-16]*RC[-15]-RC[-13]*RC[-12])/1000 -> #VALUE! | W80: =RC[-2]*RC[-10]/1000 -> #VALUE! | X80: =ABS((RC[-3]*RC[-11]-RC[-2]*RC[-9])/1000) -> #VALUE! | Y80: =(RC[-14]-RC[1])/RC[-18]*100 -> #VALUE! | AC80: =VALUE(RC[-27]) -> #VALUE! | AD80: =IF(RC[21]=42,"*",IF(RC[21]=32,"",RC[21])) ->  | AE80: =RC[-28] ->  | AF80: =RC[-28] ->  | AG80: =RC[-28] ->  | AH80: =RC[-28] ->  | AI80: =RC[-28] ->  | AJ80: =RC[-28] ->  | AK80: =RC[-28] ->  | AL80: =RC[-28] -> 0 | AM80: =RC[-28] ->  | AN80: =RC[-28] ->  | AO80: =RC[-28] ->  | AP80: - | AQ80: =RC[-29] -> 0 | AR80: =RC[-29] -> 0 | AS80: - | AT80: =RC[-30] -> 0 | AU80: =RC[-30] -> 0 | AV80: =RC[-30] ->  | AW80: =RC[-30] -> 
A81: =IF(RC[1]="","",DATEVALUE(RC[1])) ->  | T81: =(RC[-16]*RC[-15]-RC[-13]*RC[-12])/1000 -> #VALUE! | W81: =RC[-2]*RC[-10]/1000 -> #VALUE! | X81: =ABS((RC[-3]*RC[-11]-RC[-2]*RC[-9])/1000) -> #VALUE! | Y81: =(RC[-14]-RC[1])/RC[-18]*100 -> #VALUE! | AC81: =VALUE(RC[-27]) -> #VALUE! | AD81: =IF(RC[21]=42,"*",IF(RC[21]=32,"",RC[21])) ->  | AE81: =RC[-28] ->  | AF81: =RC[-28] ->  | AG81: =RC[-28] ->  | AH81: =RC[-28] ->  | AI81: =RC[-28] ->  | AJ81: =RC[-28] ->  | AK81: =RC[-28] ->  | AL81: =RC[-28] -> 0 | AM81: =RC[-28] ->  | AN81: =RC[-28] ->  | AO81: =RC[-28] ->  | AP81: - | AQ81: =RC[-29] -> 0 | AR81: =RC[-29] -> 0 | AS81: - | AT81: =RC[-30] -> 0 | AU81: =RC[-30] -> 0 | AV81: =RC[-30] ->  | AW81: =RC[-30] -> 
A82: =IF(RC[1]="","",DATEVALUE(RC[1])) ->  | T82: =(RC[-16]*RC[-15]-RC[-13]*RC[-12])/1000 -> #VALUE! | W82: =RC[-2]*RC[-10]/1000 -> #VALUE! | X82: =ABS((RC[-3]*RC[-11]-RC[-2]*RC[-9])/1000) -> #VALUE! | Y82: =(RC[-14]-RC[1])/RC[-18]*100 -> #VALUE! | AC82: =VALUE(RC[-27]) -> #VALUE! | AD82: =IF(RC[21]=42,"*",IF(RC[21]=32,"",RC[21])) ->  | AE82: =RC[-28] ->  | AF82: =RC[-28] ->  | AG82: =RC[-28] ->  | AH82: =RC[-28] ->  | AI82: =RC[-28] ->  | AJ82: =RC[-28] ->  | AK82: =RC[-28] ->  | AL82: =RC[-28] -> 0 | AM82: =RC[-28] ->  | AN82: =RC[-28] ->  | AO82: =RC[-28] ->  | AP82: - | AQ82: =RC[-29] -> 0 | AR82: =RC[-29] -> 0 | AS82: - | AT82: =RC[-30] -> 0 | AU82: =RC[-30] -> 0 | AV82: =RC[-30] ->  | AW82: =RC[-30] -> 
A83: =IF(RC[1]="","",DATEVALUE(RC[1])) ->  | T83: =(RC[-16]*RC[-15]-RC[-13]*RC[-12])/1000 -> #VALUE! | W83: =RC[-2]*RC[-10]/1000 -> #VALUE! | X83: =ABS((RC[-3]*RC[-11]-RC[-2]*RC[-9])/1000) -> #VALUE! | Y83: =(RC[-14]-RC[1])/RC[-18]*100 -> #VALUE! | AC83: =VALUE(RC[-27]) -> #VALUE! | AD83: =IF(RC[21]=42,"*",IF(RC[21]=32,"",RC[21])) ->  | AE83: =RC[-28] ->  | AF83: =RC[-28] ->  | AG83: =RC[-28] ->  | AH83: =RC[-28] ->  | AI83: =RC[-28] ->  | AJ83: =RC[-28] ->  | AK83: =RC[-28] ->  | AL83: =RC[-28] -> 0 | AM83: =RC[-28] ->  | AN83: =RC[-28] ->  | AO83: =RC[-28] ->  | AP83: - | AQ83: =RC[-29] -> 0 | AR83: =RC[-29] -> 0 | AS83: - | AT83: =RC[-30] -> 0 | AU83: =RC[-30] -> 0 | AV83: =RC[-30] ->  | AW83: =RC[-30] -> 
AC84: Среднее | AF84: =R[1]C[-28] -> 468.37542800966668 | AG84: =R[1]C[-28] -> 68.100333333333339 | AH84: =R[1]C[-28] -> 5.7647112424853342 | AI84: =R[1]C[-28] -> 405.21039962833328 | AJ84: =R[1]C[-28] -> 53.68533333333334 | AK84: =R[1]C[-28] -> 2.8332938198626669 | AL84: =R[1]C[-28] -> 14.414999999999997 | AM84: =R[1]C[-28] -> 63.165028381333336 | AN84: =R[1]C[-28] -> 63.893820062999993 | AO84: =R[1]C[-28] -> 66.780666666666647 | AP84: - | AQ84: =R[1]C[-29] -> 0 | AR84: =R[1]C[-29] -> 0 | AS84: - | AT84: =R[1]C[-30] -> 0 | AU84: =R[1]C[-30] -> 0
B85: Среднее | D85: =AVERAGE(OFFSET(R[-74]C,3,0,R7C1,1)) -> 468.37542800966668 | E85: =AVERAGE(OFFSET(R[-74]C,3,0,R7C1,1)) -> 68.100333333333339 | F85: =AVERAGE(OFFSET(R[-74]C,3,0,R7C1,1)) -> 5.7647112424853342 | G85: =AVERAGE(OFFSET(R[-74]C,3,0,R7C1,1)) -> 405.21039962833328 | H85: =AVERAGE(OFFSET(R[-74]C,3,0,R7C1,1)) -> 53.68533333333334 | I85: =AVERAGE(OFFSET(R[-74]C,3,0,R7C1,1)) -> 2.8332938198626669 | J85: =AVERAGE(OFFSET(R[-74]C,3,0,R7C1,1)) -> 14.414999999999997 | K85: =AVERAGE(OFFSET(R[-74]C,3,0,R7C1,1)) -> 63.165028381333336 | L85: =IF(SUM(OFFSET(R[-74]C,3,0,R7C1,1))=0,"",AVERAGE(OFFSET(R[-74]C,3,0,R7C1,1))) -> 63.893820062999993 | M85: =IF(SUM(OFFSET(R[-74]C,3,0,R7C1,1))=0,"",AVERAGE(OFFSET(R[-74]C,3,0,R7C1,1))) -> 66.780666666666647 | R85: =IF(SUM(OFFSET(R[-74]C,3,0,R7C1,1))=0,"",AVERAGE(OFFSET(R[-74]C,3,0,R7C1,1))) -> 4.2761674539027412 | S85: =AVERAGE(OFFSET(R[-74]C,3,0,R7C1,1)) -> 10.559038661985285 | T85: =AVERAGE(OFFSET(R[-74]C,3,0,R7C1,1)) -> 10.449696980453917 | W85: =AVERAGE(OFFSET(R[-74]C,3,0,R7C1,1)) -> 4.1652023155887994 | X85: =AVERAGE(OFFSET(R[-74]C,3,0,R7C1,1)) -> #VALUE! | AC85: Итого | AE85: =R[1]C[-28] -> 720 | AF85: =R[1]C[-28] -> 14051.262840290001 | AI85: =R[1]C[-28] -> 12156.311988849999 | AM85: =R[1]C[-28] -> 1894.9508514400002 | AN85: =R[1]C[-28] -> 1916.8146018899997 | AQ85: =R[1]C[-29] -> 0 | AU85: =R[1]C[-30] -> 0 | AV85: =R[1]C[-30] -> 128.28502361708223 | AW85: =R[1]C[-30] -> 316.77115985955857
B86: ИТОГО: | C86: =SUM(OFFSET(R[-75]C,3,0,R7C1,1)) -> 720 | D86: =SUM(OFFSET(R[-75]C,3,0,R7C1,1)) -> 14051.262840290001 | G86: =SUM(OFFSET(R[-75]C,3,0,R7C1,1)) -> 12156.311988849999 | K86: =SUM(OFFSET(R[-75]C,3,0,R7C1,1)) -> 1894.9508514400002 | L86: =IF(SUM(OFFSET(R[-75]C,3,0,R7C1,1))=0,"",SUM(OFFSET(R[-75]C,3,0,R7C1,1))) -> 1916.8146018899997 | R86: =IF(SUM(OFFSET(R[-75]C,3,0,R7C1,1))=0,"",SUM(OFFSET(R[-75]C,3,0,R7C1,1))) -> 128.28502361708223 | S86: =SUM(OFFSET(R[-75]C,3,0,R7C1,1)) -> 316.77115985955857 | T86: =SUM(OFFSET(R[-75]C,3,0,R7C1,1)) -> 313.49090941361749 | W86: =SUM(OFFSET(R[-75]C,3,0,R7C1,1)) -> 124.95606946766399 | X86: =SUM(OFFSET(R[-75]C,3,0,R7C1,1)) -> #VALUE!
AC87: Досчёт | AF87: =R[1]C[-28] -> 0 | AI87: =R[1]C[-28] -> 0 | AM87: =R[1]C[-28] -> 0 | AN87: =R[1]C[-28] -> 0 | AQ87: =R[1]C[-29] -> 0 | AU87: =R[1]C[-30] -> 0 | AV87: =R[1]C[-30] -> 0 | AW87: =R[1]C[-30] -> 0
A88: 11дн=264ч 4дн=96ч | B88: Досчёт до конца м-ца (+) | C88: =R6C1*24 -> 216 | T88: № B06F | AC88: Снятие | AF88: =-R[1]C[-28] -> 0 | AI88: =-R[1]C[-28] -> 0 | AM88: =-R[1]C[-28] -> 0 | AN88: =-R[1]C[-28] -> 0 | AQ88: =-R[1]C[-29] -> 0 | AU88: =-R[1]C[-30] -> 0 | AV88: =-R[1]C[-30] -> 0 | AW88: =-R[1]C[-30] -> 0
A89: 9дн=216ч 7дн=168ч | B89: Вычет с предыдущего (-) | C89: =R4C1*24 -> 192 | AC89: Сумма | AF89: =R[1]C[-28] -> 14051.262840290001 | AI89: =R[1]C[-28] -> 12156.311988849999 | AM89: =R[1]C[-28] -> 1894.9508514400002 | AN89: =R[1]C[-28] -> 1916.8146018899997 | AQ89: =R[1]C[-29] -> 0 | AU89: =R[1]C[-30] -> 0 | AV89: =R[1]C[-30] -> 128.28502361708223 | AW89: =R[1]C[-30] -> 316.77115985955857
B90: СУММА: | C90: =R[-4]C+R[-2]C-R[-1]C -> 744 | D90: =R[-4]C+R[-2]C-R[-1]C -> 14051.262840290001 | G90: =R[-4]C+R[-2]C-R[-1]C -> 12156.311988849999 | K90: =R[-4]C+R[-2]C-R[-1]C -> 1894.9508514400002 | L90: =IF(SUM(OFFSET(R[-79]C,3,0,R7C1,1))=0,"",(R[-4]C+R[-2]C-R[-1]C)) -> 1916.8146018899997 | R90: =IF(SUM(OFFSET(R[-79]C,3,0,R7C1,1))=0,"",(R[-4]C+R[-2]C-R[-1]C)) -> 128.28502361708223 | S90: =R[-4]C+R[-2]C-R[-1]C -> 316.77115985955857
AC91: Тхв на источнике | AE91: V гвс (м3) | AF91: =R[-2]C[15] -> 0 | AG91: W гвс (Гкал) | AH91: =RC[-2]*0.06 -> 0 | AI91: W без гвс (Гкал) | AJ91: =R[-2]C[13]-RC[-2] -> 316.77115985955857
B92: Показания счетчиков на момент снятия данных:
B93: Дата, время | D93: М1, т | F93: М2, т | H93: М3, т | J93: М4, т | L93: Qо, Гкал | N93: Qг, Гкал | P93: время, час
B94: 23.09.18 05:11 | D94: 608342.5 | F94: 471916.53125 | H94: 117757.15625 | J94: - | L94: 20187.270110824498 | N94: 8635.9268265739902 | P94: -
B95: 23.10.18 05:16 | D95: 622524.1875 | F95: 484201.65625 | H95: 119635.2890625 | J95: - | L95: 20505.558391850602 | N95: 8764.3167589208897 | P95: -
AC97: =ZAYAVKA_N -> з.н д. №02/147-2783 от 04.10.18
B98: Представитель потребителя:_______________________________________________________________________ В.О. Топорков
I101: Рекомендуемые значения по параметрам теплопотребления (не являются официально утверждёнными)
I102: М, т | J102: V, м3 | K102: Qгвс, Гкал | L102: Qотоп, Гкал | M102: Qо, Гкал
I103: =R[-13]C[-3] -> 0 | J103: =RC[-1]/0.98 -> 0 | K103: =RC[-1]*0.06 -> 0 | L103: =RC[1]-RC[-1] -> 128.28502361708223 | M103: =R[-13]C[5] -> 128.28502361708223
O105: ДЛЯ САМОКОНТРОЛЯ
B106: В строке выбора дат указать период с 16.7.13 по 23.8.13 - жильё | N106: Q | O106: Qг
B107: В строке выбора дат указать период с 18.7.13 по 25.8.13 - не жилое | N107: =(R[-21]C[-10]*R[-22]C[-7]-R[-21]C[-9]*R[-22]C[-6])/1000 -> 5693.7178307966606 | O107: =IF(R[-22]C[-2]="",R[-21]C[-3]*R[-22]C/1000,"") ->  | P107: Си2
O108: =IF(R[-23]C[-2]="","",((R[-22]C[-3]*R[-23]C)-(R[-22]C[-2]*R[-23]C[2]))/1000) -> 0 | P108: Си3