Sheet: Лист1
G1: Отчёт о теплопотреблении за сентябрь 2018 | M1: з. на доп.№ 02/147-2548 от 5.10.2017
A4: =EOMONTH(R[9]C,0)-R[9]C -> 9 | B4: Потребитель: ЗАО "Сити Сервис"
A5: =MAX(R[9]C:R[78]C) -> 2018-09-22T00:00:00.000 | B5: Адрес: г. СПб, Наличная ул., д.55 ИТП 2
A6: =EOMONTH(R[-1]C,0)-R[-1]C -> 8 | B6: Телефон: 8-911-021-19-79
A7: =R[-2]C-R[6]C -> 31 | B7: Договор 10023-3 (.) 85875, 85876
A8: 7 | B8: Тепловычислитель: ВКТ-7 № 21183 | L8: М2 мах= | M8: 138.24 | O8: Мгвс мах= | P8: 12
L9: Qотоп мах= | M9: 11.064 | O9: Qгвс мах= | P9: 0.792
B10: Расчётная формула: Q=M1*(h1-hхв)-M2*(h2-hхв)
D12: Учет | L12: Контроль
A13: =R[1]C[1]-1 -> 2018-08-22T00:00:00.000 | B13: Дата | C13: N, ч | D13: M1, т | E13: T1, С | F13: P1, кг/см2 | G13: M2, т | H13: T2, С | I13: P2, кг/см2 | J13: dT, С | K13: M1-М2, т | L13: V3, м3 | M13: T3, С | N13: V4, м3 | O13: =IF(R[-12]C[-14]="м.куб","","T4, С") -> T4, С | P13: dT, С | Q13: V3-V4, м3 | R13: Qгвс, Гкал | S13: Qобщ., Гкал | T13: Q | U13: M3 | V13: M4 | W13: си2 | X13: си3 | Y13: Разб. | Z13: dM2 | AC13: Дата | AD13: НС | AE13: n, ч | AF13: М1, т | AG13: t1, гр. С | AH13: Р1, кгс/см2 | AI13: М2, т | AJ13: t2, гр. С | AK13: Р2, кгс/см2 | AL13: t1-t2, гр. С | AM13: М1-М2, т | AN13: М1гвс, т | AO13: t1гвс, гр. С | AP13: Р1гвс, кгс/см2 | AQ13: М2гвс, т | AR13: t2гвс, гр. С | AS13: Р2гвс, кгс/см2 | AT13: t1гвс-t2гвс | AU13: М1гвс-М2гвс, т | AV13: Wгвс, Гкал | AW13: Wсумм, Гкал | AY13: NS_TV1 | AZ13: НС | BA13: NS_TV2
A14: =IF(RC[1]="","",DATEVALUE(RC[1])) -> 43335 | B14: 23.08.18 | C14: 24 | L14: 34.31 | M14: 68.42 | N14: 28.76 | O14: 52.94 | P14: =IF(AND(ISNUMBER(RC[-3]),ISNUMBER(RC[-1])),RC[-3]-RC[-1],"-") -> 15.480000000000004 | Q14: 5.55 | R14: 0.80600000000000005 | S14: =RC[-1] -> 0.80600000000000005 | T14: =(RC[-16]*RC[-15]-RC[-13]*RC[-12])/1000 -> 0 | U14: 33.590000000000003 | V14: 28.27 | W14: =RC[-2]*RC[-10]/1000 -> 2.2982278000000003 | X14: =ABS((RC[-3]*RC[-11]-RC[-2]*RC[-9])/1000) -> 0.80161400000000027 | Y14: =(RC[-14]-RC[1])/RC[-18]*100 -> #DIV/0! | Z14: 5.32 | AC14: =VALUE(RC[-27]) -> 2018-08-23T00:00:00.000 | AD14: =IF(RC[21]=42,"*",IF(RC[21]=32,"",RC[21])) -> - | AE14: =RC[-28] -> 24 | AF14: =RC[-28] -> 0 | AG14: =RC[-28] -> 0 | AH14: =RC[-28] -> 0 | AI14: =RC[-28] -> 0 | AJ14: =RC[-28] -> 0 | AK14: =RC[-28] -> 0 | AL14: =RC[-28] -> 0 | AM14: =RC[-28] -> 0 | AN14: =RC[-28] -> 34.31 | AO14: =RC[-28] -> 68.42 | AP14: - | AQ14: =RC[-29] -> 28.76 | AR14: =RC[-29] -> 52.94 | AS14: - | AT14: =RC[-30] -> 15.480000000000004 | AU14: =RC[-30] -> 5.55 | AV14: =RC[-30] -> 0.80600000000000005 | AW14: =RC[-30] -> 0.80600000000000005 | AY14: - | AZ14: - | BA14: -
A15: =IF(RC[1]="","",DATEVALUE(RC[1])) -> 43336 | B15: 24.08.18 | C15: 24 | L15: 33.880000000000003 | M15: 69.09 | N15: 28.85 | O15: 53.32 | P15: =IF(AND(ISNUMBER(RC[-3]),ISNUMBER(RC[-1])),RC[-3]-RC[-1],"-") -> 15.770000000000003 | Q15: 5.03 | R15: 0.78500000000000003 | S15: =RC[-1] -> 0.78500000000000003 | T15: =(RC[-16]*RC[-15]-RC[-13]*RC[-12])/1000 -> 0 | U15: 33.15 | V15: 28.33 | W15: =RC[-2]*RC[-10]/1000 -> 2.2903335 | X15: =ABS((RC[-3]*RC[-11]-RC[-2]*RC[-9])/1000) -> 0.77977790000000025 | Y15: =(RC[-14]-RC[1])/RC[-18]*100 -> #DIV/0! | Z15: 4.82 | AC15: =VALUE(RC[-27]) -> 2018-08-24T00:00:00.000 | AD15: =IF(RC[21]=42,"*",IF(RC[21]=32,"",RC[21])) -> - | AE15: =RC[-28] -> 24 | AF15: =RC[-28] -> 0 | AG15: =RC[-28] -> 0 | AH15: =RC[-28] -> 0 | AI15: =RC[-28] -> 0 | AJ15: =RC[-28] -> 0 | AK15: =RC[-28] -> 0 | AL15: =RC[-28] -> 0 | AM15: =RC[-28] -> 0 | AN15: =RC[-28] -> 33.880000000000003 | AO15: =RC[-28] -> 69.09 | AP15: - | AQ15: =RC[-29] -> 28.85 | AR15: =RC[-29] -> 53.32 | AS15: - | AT15: =RC[-30] -> 15.770000000000003 | AU15: =RC[-30] -> 5.03 | AV15: =RC[-30] -> 0.78500000000000003 | AW15: =RC[-30] -> 0.78500000000000003 | AY15: - | AZ15: - | BA15: -
A16: =IF(RC[1]="","",DATEVALUE(RC[1])) -> 43337 | B16: 25.08.18 | C16: 24 | L16: 33.96 | M16: 68.73 | N16: 29.03 | O16: 53.4 | P16: =IF(AND(ISNUMBER(RC[-3]),ISNUMBER(RC[-1])),RC[-3]-RC[-1],"-") -> 15.330000000000005 | Q16: 4.93 | R16: 0.76300000000000001 | S16: =RC[-1] -> 0.76300000000000001 | T16: =(RC[-16]*RC[-15]-RC[-13]*RC[-12])/1000 -> 0 | U16: 33.24 | V16: 28.52 | W16: =RC[-2]*RC[-10]/1000 -> 2.2845852000000004 | X16: =ABS((RC[-3]*RC[-11]-RC[-2]*RC[-9])/1000) -> 0.76161720000000055 | Y16: =(RC[-14]-RC[1])/RC[-18]*100 -> #DIV/0! | Z16: 4.72 | AC16: =VALUE(RC[-27]) -> 2018-08-25T00:00:00.000 | AD16: =IF(RC[21]=42,"*",IF(RC[21]=32,"",RC[21])) -> - | AE16: =RC[-28] -> 24 | AF16: =RC[-28] -> 0 | AG16: =RC[-28] -> 0 | AH16: =RC[-28] -> 0 | AI16: =RC[-28] -> 0 | AJ16: =RC[-28] -> 0 | AK16: =RC[-28] -> 0 | AL16: =RC[-28] -> 0 | AM16: =RC[-28] -> 0 | AN16: =RC[-28] -> 33.96 | AO16: =RC[-28] -> 68.73 | AP16: - | AQ16: =RC[-29] -> 29.03 | AR16: =RC[-29] -> 53.4 | AS16: - | AT16: =RC[-30] -> 15.330000000000005 | AU16: =RC[-30] -> 4.93 | AV16: =RC[-30] -> 0.76300000000000001 | AW16: =RC[-30] -> 0.76300000000000001 | AY16: - | AZ16: - | BA16: -
A17: =IF(RC[1]="","",DATEVALUE(RC[1])) -> 43338 | B17: 26.08.18 | C17: 24 | L17: 35.29 | M17: 68.66 | N17: 29.16 | O17: 53.38 | P17: =IF(AND(ISNUMBER(RC[-3]),ISNUMBER(RC[-1])),RC[-3]-RC[-1],"-") -> 15.279999999999994 | Q17: 6.13 | R17: 0.84899999999999998 | S17: =RC[-1] -> 0.84899999999999998 | T17: =(RC[-16]*RC[-15]-RC[-13]*RC[-12])/1000 -> 0 | U17: 34.590000000000003 | V17: 28.62 | W17: =RC[-2]*RC[-10]/1000 -> 2.3749493999999998 | X17: =ABS((RC[-3]*RC[-11]-RC[-2]*RC[-9])/1000) -> 0.84721379999999979 | Y17: =(RC[-14]-RC[1])/RC[-18]*100 -> #DIV/0! | Z17: 5.97 | AC17: =VALUE(RC[-27]) -> 2018-08-26T00:00:00.000 | AD17: =IF(RC[21]=42,"*",IF(RC[21]=32,"",RC[21])) -> - | AE17: =RC[-28] -> 24 | AF17: =RC[-28] -> 0 | AG17: =RC[-28] -> 0 | AH17: =RC[-28] -> 0 | AI17: =RC[-28] -> 0 | AJ17: =RC[-28] -> 0 | AK17: =RC[-28] -> 0 | AL17: =RC[-28] -> 0 | AM17: =RC[-28] -> 0 | AN17: =RC[-28] -> 35.29 | AO17: =RC[-28] -> 68.66 | AP17: - | AQ17: =RC[-29] -> 29.16 | AR17: =RC[-29] -> 53.38 | AS17: - | AT17: =RC[-30] -> 15.279999999999994 | AU17: =RC[-30] -> 6.13 | AV17: =RC[-30] -> 0.84899999999999998 | AW17: =RC[-30] -> 0.84899999999999998 | AY17: - | AZ17: - | BA17: -
A18: =IF(RC[1]="","",DATEVALUE(RC[1])) -> 43339 | B18: 27.08.18 | C18: 24 | L18: 35.19 | M18: 68.849999999999994 | N18: 28.85 | O18: 53.34 | P18: =IF(AND(ISNUMBER(RC[-3]),ISNUMBER(RC[-1])),RC[-3]-RC[-1],"-") -> 15.509999999999991 | Q18: 6.34 | R18: 0.86 | S18: =RC[-1] -> 0.86 | T18: =(RC[-16]*RC[-15]-RC[-13]*RC[-12])/1000 -> 0 | U18: 34.47 | V18: 28.34 | W18: =RC[-2]*RC[-10]/1000 -> 2.3732594999999996 | X18: =ABS((RC[-3]*RC[-11]-RC[-2]*RC[-9])/1000) -> 0.86160389999999965 | Y18: =(RC[-14]-RC[1])/RC[-18]*100 -> #DIV/0! | Z18: 6.13 | AC18: =VALUE(RC[-27]) -> 2018-08-27T00:00:00.000 | AD18: =IF(RC[21]=42,"*",IF(RC[21]=32,"",RC[21])) -> - | AE18: =RC[-28] -> 24 | AF18: =RC[-28] -> 0 | AG18: =RC[-28] -> 0 | AH18: =RC[-28] -> 0 | AI18: =RC[-28] -> 0 | AJ18: =RC[-28] -> 0 | AK18: =RC[-28] -> 0 | AL18: =RC[-28] -> 0 | AM18: =RC[-28] -> 0 | AN18: =RC[-28] -> 35.19 | AO18: =RC[-28] -> 68.849999999999994 | AP18: - | AQ18: =RC[-29] -> 28.85 | AR18: =RC[-29] -> 53.34 | AS18: - | AT18: =RC[-30] -> 15.509999999999991 | AU18: =RC[-30] -> 6.34 | AV18: =RC[-30] -> 0.86 | AW18: =RC[-30] -> 0.86 | AY18: - | AZ18: - | BA18: -
A19: =IF(RC[1]="","",DATEVALUE(RC[1])) -> 43340 | B19: 28.08.18 | C19: 24 | L19: 34.590000000000003 | M19: 69.08 | N19: 29.22 | O19: 53.46 | P19: =IF(AND(ISNUMBER(RC[-3]),ISNUMBER(RC[-1])),RC[-3]-RC[-1],"-") -> 15.619999999999997 | Q19: 5.37 | R19: 0.80800000000000005 | S19: =RC[-1] -> 0.80800000000000005 | T19: =(RC[-16]*RC[-15]-RC[-13]*RC[-12])/1000 -> 0 | U19: 33.85 | V19: 28.72 | W19: =RC[-2]*RC[-10]/1000 -> 2.3383580000000004 | X19: =ABS((RC[-3]*RC[-11]-RC[-2]*RC[-9])/1000) -> 0.80298680000000011 | Y19: =(RC[-14]-RC[1])/RC[-18]*100 -> #DIV/0! | Z19: 5.13 | AC19: =VALUE(RC[-27]) -> 2018-08-28T00:00:00.000 | AD19: =IF(RC[21]=42,"*",IF(RC[21]=32,"",RC[21])) -> - | AE19: =RC[-28] -> 24 | AF19: =RC[-28] -> 0 | AG19: =RC[-28] -> 0 | AH19: =RC[-28] -> 0 | AI19: =RC[-28] -> 0 | AJ19: =RC[-28] -> 0 | AK19: =RC[-28] -> 0 | AL19: =RC[-28] -> 0 | AM19: =RC[-28] -> 0 | AN19: =RC[-28] -> 34.590000000000003 | AO19: =RC[-28] -> 69.08 | AP19: - | AQ19: =RC[-29] -> 29.22 | AR19: =RC[-29] -> 53.46 | AS19: - | AT19: =RC[-30] -> 15.619999999999997 | AU19: =RC[-30] -> 5.37 | AV19: =RC[-30] -> 0.80800000000000005 | AW19: =RC[-30] -> 0.80800000000000005 | AY19: - | AZ19: - | BA19: -
A20: =IF(RC[1]="","",DATEVALUE(RC[1])) -> 43341 | B20: 29.08.18 | C20: 24 | L20: 35.450000000000003 | M20: 68.08 | N20: 29.28 | O20: 52.96 | P20: =IF(AND(ISNUMBER(RC[-3]),ISNUMBER(RC[-1])),RC[-3]-RC[-1],"-") -> 15.119999999999997 | Q20: 6.17 | R20: 0.84399999999999997 | S20: =RC[-1] -> 0.84399999999999997 | T20: =(RC[-16]*RC[-15]-RC[-13]*RC[-12])/1000 -> 0 | U20: 34.700000000000003 | V20: 28.81 | W20: =RC[-2]*RC[-10]/1000 -> 2.3623760000000003 | X20: =ABS((RC[-3]*RC[-11]-RC[-2]*RC[-9])/1000) -> 0.8365984000000003 | Y20: =(RC[-14]-RC[1])/RC[-18]*100 -> #DIV/0! | Z20: 5.89 | AC20: =VALUE(RC[-27]) -> 2018-08-29T00:00:00.000 | AD20: =IF(RC[21]=42,"*",IF(RC[21]=32,"",RC[21])) -> - | AE20: =RC[-28] -> 24 | AF20: =RC[-28] -> 0 | AG20: =RC[-28] -> 0 | AH20: =RC[-28] -> 0 | AI20: =RC[-28] -> 0 | AJ20: =RC[-28] -> 0 | AK20: =RC[-28] -> 0 | AL20: =RC[-28] -> 0 | AM20: =RC[-28] -> 0 | AN20: =RC[-28] -> 35.450000000000003 | AO20: =RC[-28] -> 68.08 | AP20: - | AQ20: =RC[-29] -> 29.28 | AR20: =RC[-29] -> 52.96 | AS20: - | AT20: =RC[-30] -> 15.119999999999997 | AU20: =RC[-30] -> 6.17 | AV20: =RC[-30] -> 0.84399999999999997 | AW20: =RC[-30] -> 0.84399999999999997 | AY20: - | AZ20: - | BA20: -
A21: =IF(RC[1]="","",DATEVALUE(RC[1])) -> 43342 | B21: 30.08.18 | C21: 24 | L21: 36.39 | M21: 66.14 | N21: 28.96 | O21: 51.6 | P21: =IF(AND(ISNUMBER(RC[-3]),ISNUMBER(RC[-1])),RC[-3]-RC[-1],"-") -> 14.54 | Q21: 7.43 | R21: 0.88600000000000001 | S21: =RC[-1] -> 0.88600000000000001 | T21: =(RC[-16]*RC[-15]-RC[-13]*RC[-12])/1000 -> 0 | U21: 35.68 | V21: 28.55 | W21: =RC[-2]*RC[-10]/1000 -> 2.3598751999999998 | X21: =ABS((RC[-3]*RC[-11]-RC[-2]*RC[-9])/1000) -> 0.88669519999999991 | Y21: =(RC[-14]-RC[1])/RC[-18]*100 -> #DIV/0! | Z21: 7.13 | AC21: =VALUE(RC[-27]) -> 2018-08-30T00:00:00.000 | AD21: =IF(RC[21]=42,"*",IF(RC[21]=32,"",RC[21])) -> - | AE21: =RC[-28] -> 24 | AF21: =RC[-28] -> 0 | AG21: =RC[-28] -> 0 | AH21: =RC[-28] -> 0 | AI21: =RC[-28] -> 0 | AJ21: =RC[-28] -> 0 | AK21: =RC[-28] -> 0 | AL21: =RC[-28] -> 0 | AM21: =RC[-28] -> 0 | AN21: =RC[-28] -> 36.39 | AO21: =RC[-28] -> 66.14 | AP21: - | AQ21: =RC[-29] -> 28.96 | AR21: =RC[-29] -> 51.6 | AS21: - | AT21: =RC[-30] -> 14.54 | AU21: =RC[-30] -> 7.43 | AV21: =RC[-30] -> 0.88600000000000001 | AW21: =RC[-30] -> 0.88600000000000001 | AY21: - | AZ21: - | BA21: -
A22: =IF(RC[1]="","",DATEVALUE(RC[1])) -> 43343 | B22: 31.08.18 | C22: 24 | L22: 34.979999999999997 | M22: 67.36 | N22: 28.91 | O22: 52.35 | P22: =IF(AND(ISNUMBER(RC[-3]),ISNUMBER(RC[-1])),RC[-3]-RC[-1],"-") -> 15.009999999999998 | Q22: 6.07 | R22: 0.81599999999999995 | S22: =RC[-1] -> 0.81599999999999995 | T22: =(RC[-16]*RC[-15]-RC[-13]*RC[-12])/1000 -> 0 | U22: 34.25 | V22: 28.47 | W22: =RC[-2]*RC[-10]/1000 -> 2.30708 | X22: =ABS((RC[-3]*RC[-11]-RC[-2]*RC[-9])/1000) -> 0.81667550000000011 | Y22: =(RC[-14]-RC[1])/RC[-18]*100 -> #DIV/0! | Z22: 5.78 | AC22: =VALUE(RC[-27]) -> 2018-08-31T00:00:00.000 | AD22: =IF(RC[21]=42,"*",IF(RC[21]=32,"",RC[21])) -> - | AE22: =RC[-28] -> 24 | AF22: =RC[-28] -> 0 | AG22: =RC[-28] -> 0 | AH22: =RC[-28] -> 0 | AI22: =RC[-28] -> 0 | AJ22: =RC[-28] -> 0 | AK22: =RC[-28] -> 0 | AL22: =RC[-28] -> 0 | AM22: =RC[-28] -> 0 | AN22: =RC[-28] -> 34.979999999999997 | AO22: =RC[-28] -> 67.36 | AP22: - | AQ22: =RC[-29] -> 28.91 | AR22: =RC[-29] -> 52.35 | AS22: - | AT22: =RC[-30] -> 15.009999999999998 | AU22: =RC[-30] -> 6.07 | AV22: =RC[-30] -> 0.81599999999999995 | AW22: =RC[-30] -> 0.81599999999999995 | AY22: - | AZ22: - | BA22: -
A23: =IF(RC[1]="","",DATEVALUE(RC[1])) -> 43344 | B23: 01.09.18 | C23: 24 | L23: 35.24 | M23: 69.180000000000007 | N23: 29.05 | O23: 53.41 | P23: =IF(AND(ISNUMBER(RC[-3]),ISNUMBER(RC[-1])),RC[-3]-RC[-1],"-") -> 15.77000000000001 | Q23: 6.19 | R23: 0.86299999999999999 | S23: =RC[-1] -> 0.86299999999999999 | T23: =(RC[-16]*RC[-15]-RC[-13]*RC[-12])/1000 -> 0 | U23: 34.520000000000003 | V23: 28.56 | W23: =RC[-2]*RC[-10]/1000 -> 2.3880936000000008 | X23: =ABS((RC[-3]*RC[-11]-RC[-2]*RC[-9])/1000) -> 0.86270400000000091 | Y23: =(RC[-14]-RC[1])/RC[-18]*100 -> #DIV/0! | Z23: 5.96 | AC23: =VALUE(RC[-27]) -> 2018-09-01T00:00:00.000 | AD23: =IF(RC[21]=42,"*",IF(RC[21]=32,"",RC[21])) -> - | AE23: =RC[-28] -> 24 | AF23: =RC[-28] -> 0 | AG23: =RC[-28] -> 0 | AH23: =RC[-28] -> 0 | AI23: =RC[-28] -> 0 | AJ23: =RC[-28] -> 0 | AK23: =RC[-28] -> 0 | AL23: =RC[-28] -> 0 | AM23: =RC[-28] -> 0 | AN23: =RC[-28] -> 35.24 | AO23: =RC[-28] -> 69.180000000000007 | AP23: - | AQ23: =RC[-29] -> 29.05 | AR23: =RC[-29] -> 53.41 | AS23: - | AT23: =RC[-30] -> 15.77000000000001 | AU23: =RC[-30] -> 6.19 | AV23: =RC[-30] -> 0.86299999999999999 | AW23: =RC[-30] -> 0.86299999999999999 | AY23: - | AZ23: - | BA23: -
A24: =IF(RC[1]="","",DATEVALUE(RC[1])) -> 43345 | B24: 02.09.18 | C24: 24 | L24: 34.299999999999997 | M24: 69.28 | N24: 28.86 | O24: 53.35 | P24: =IF(AND(ISNUMBER(RC[-3]),ISNUMBER(RC[-1])),RC[-3]-RC[-1],"-") -> 15.93 | Q24: 5.44 | R24: 0.81499999999999995 | S24: =RC[-1] -> 0.81499999999999995 | T24: =(RC[-16]*RC[-15]-RC[-13]*RC[-12])/1000 -> 0 | U24: 33.54 | V24: 28.37 | W24: =RC[-2]*RC[-10]/1000 -> 2.3236511999999996 | X24: =ABS((RC[-3]*RC[-11]-RC[-2]*RC[-9])/1000) -> 0.81011169999999966 | Y24: =(RC[-14]-RC[1])/RC[-18]*100 -> #DIV/0! | Z24: 5.17 | AC24: =VALUE(RC[-27]) -> 2018-09-02T00:00:00.000 | AD24: =IF(RC[21]=42,"*",IF(RC[21]=32,"",RC[21])) -> - | AE24: =RC[-28] -> 24 | AF24: =RC[-28] -> 0 | AG24: =RC[-28] -> 0 | AH24: =RC[-28] -> 0 | AI24: =RC[-28] -> 0 | AJ24: =RC[-28] -> 0 | AK24: =RC[-28] -> 0 | AL24: =RC[-28] -> 0 | AM24: =RC[-28] -> 0 | AN24: =RC[-28] -> 34.299999999999997 | AO24: =RC[-28] -> 69.28 | AP24: - | AQ24: =RC[-29] -> 28.86 | AR24: =RC[-29] -> 53.35 | AS24: - | AT24: =RC[-30] -> 15.93 | AU24: =RC[-30] -> 5.44 | AV24: =RC[-30] -> 0.81499999999999995 | AW24: =RC[-30] -> 0.81499999999999995 | AY24: - | AZ24: - | BA24: -
A25: =IF(RC[1]="","",DATEVALUE(RC[1])) -> 43346 | B25: 03.09.18 | C25: 24 | L25: 35.83 | M25: 69.150000000000006 | N25: 29.47 | O25: 53.64 | P25: =IF(AND(ISNUMBER(RC[-3]),ISNUMBER(RC[-1])),RC[-3]-RC[-1],"-") -> 15.510000000000005 | Q25: 6.36 | R25: 0.873 | S25: =RC[-1] -> 0.873 | T25: =(RC[-16]*RC[-15]-RC[-13]*RC[-12])/1000 -> 0 | U25: 35.07 | V25: 28.97 | W25: =RC[-2]*RC[-10]/1000 -> 2.4250905 | X25: =ABS((RC[-3]*RC[-11]-RC[-2]*RC[-9])/1000) -> 0.87113970000000041 | Y25: =(RC[-14]-RC[1])/RC[-18]*100 -> #DIV/0! | Z25: 6.1 | AC25: =VALUE(RC[-27]) -> 2018-09-03T00:00:00.000 | AD25: =IF(RC[21]=42,"*",IF(RC[21]=32,"",RC[21])) -> - | AE25: =RC[-28] -> 24 | AF25: =RC[-28] -> 0 | AG25: =RC[-28] -> 0 | AH25: =RC[-28] -> 0 | AI25: =RC[-28] -> 0 | AJ25: =RC[-28] -> 0 | AK25: =RC[-28] -> 0 | AL25: =RC[-28] -> 0 | AM25: =RC[-28] -> 0 | AN25: =RC[-28] -> 35.83 | AO25: =RC[-28] -> 69.150000000000006 | AP25: - | AQ25: =RC[-29] -> 29.47 | AR25: =RC[-29] -> 53.64 | AS25: - | AT25: =RC[-30] -> 15.510000000000005 | AU25: =RC[-30] -> 6.36 | AV25: =RC[-30] -> 0.873 | AW25: =RC[-30] -> 0.873 | AY25: - | AZ25: - | BA25: -
A26: =IF(RC[1]="","",DATEVALUE(RC[1])) -> 43347 | B26: 04.09.18 | C26: 24 | L26: 36.06 | M26: 69.069999999999993 | N26: 29.61 | O26: 53.53 | P26: =IF(AND(ISNUMBER(RC[-3]),ISNUMBER(RC[-1])),RC[-3]-RC[-1],"-") -> 15.539999999999992 | Q26: 6.45 | R26: 0.88600000000000001 | S26: =RC[-1] -> 0.88600000000000001 | T26: =(RC[-16]*RC[-15]-RC[-13]*RC[-12])/1000 -> 0 | U26: 35.270000000000003 | V26: 29.13 | W26: =RC[-2]*RC[-10]/1000 -> 2.4360989000000002 | X26: =ABS((RC[-3]*RC[-11]-RC[-2]*RC[-9])/1000) -> 0.87676999999999994 | Y26: =(RC[-14]-RC[1])/RC[-18]*100 -> #DIV/0! | Z26: 6.14 | AC26: =VALUE(RC[-27]) -> 2018-09-04T00:00:00.000 | AD26: =IF(RC[21]=42,"*",IF(RC[21]=32,"",RC[21])) -> - | AE26: =RC[-28] -> 24 | AF26: =RC[-28] -> 0 | AG26: =RC[-28] -> 0 | AH26: =RC[-28] -> 0 | AI26: =RC[-28] -> 0 | AJ26: =RC[-28] -> 0 | AK26: =RC[-28] -> 0 | AL26: =RC[-28] -> 0 | AM26: =RC[-28] -> 0 | AN26: =RC[-28] -> 36.06 | AO26: =RC[-28] -> 69.069999999999993 | AP26: - | AQ26: =RC[-29] -> 29.61 | AR26: =RC[-29] -> 53.53 | AS26: - | AT26: =RC[-30] -> 15.539999999999992 | AU26: =RC[-30] -> 6.45 | AV26: =RC[-30] -> 0.88600000000000001 | AW26: =RC[-30] -> 0.88600000000000001 | AY26: - | AZ26: - | BA26: -
A27: =IF(RC[1]="","",DATEVALUE(RC[1])) -> 43348 | B27: 05.09.18 | C27: 24 | L27: 35.6 | M27: 69.38 | N27: 29.49 | O27: 53.67 | P27: =IF(AND(ISNUMBER(RC[-3]),ISNUMBER(RC[-1])),RC[-3]-RC[-1],"-") -> 15.709999999999994 | Q27: 6.11 | R27: 0.86799999999999999 | S27: =RC[-1] -> 0.86799999999999999 | T27: =(RC[-16]*RC[-15]-RC[-13]*RC[-12])/1000 -> 0 | U27: 34.840000000000003 | V27: 28.99 | W27: =RC[-2]*RC[-10]/1000 -> 2.4171992000000002 | X27: =ABS((RC[-3]*RC[-11]-RC[-2]*RC[-9])/1000) -> 0.86130590000000007 | Y27: =(RC[-14]-RC[1])/RC[-18]*100 -> #DIV/0! | Z27: 5.85 | AC27: =VALUE(RC[-27]) -> 2018-09-05T00:00:00.000 | AD27: =IF(RC[21]=42,"*",IF(RC[21]=32,"",RC[21])) -> - | AE27: =RC[-28] -> 24 | AF27: =RC[-28] -> 0 | AG27: =RC[-28] -> 0 | AH27: =RC[-28] -> 0 | AI27: =RC[-28] -> 0 | AJ27: =RC[-28] -> 0 | AK27: =RC[-28] -> 0 | AL27: =RC[-28] -> 0 | AM27: =RC[-28] -> 0 | AN27: =RC[-28] -> 35.6 | AO27: =RC[-28] -> 69.38 | AP27: - | AQ27: =RC[-29] -> 29.49 | AR27: =RC[-29] -> 53.67 | AS27: - | AT27: =RC[-30] -> 15.709999999999994 | AU27: =RC[-30] -> 6.11 | AV27: =RC[-30] -> 0.86799999999999999 | AW27: =RC[-30] -> 0.86799999999999999 | AY27: - | AZ27: - | BA27: -
A28: =IF(RC[1]="","",DATEVALUE(RC[1])) -> 43349 | B28: 06.09.18 | C28: 24 | L28: 35.44 | M28: 69.5 | N28: 29.44 | O28: 53.91 | P28: =IF(AND(ISNUMBER(RC[-3]),ISNUMBER(RC[-1])),RC[-3]-RC[-1],"-") -> 15.590000000000003 | Q28: 6 | R28: 0.85599999999999998 | S28: =RC[-1] -> 0.85599999999999998 | T28: =(RC[-16]*RC[-15]-RC[-13]*RC[-12])/1000 -> 0 | U28: 34.68 | V28: 28.94 | W28: =RC[-2]*RC[-10]/1000 -> 2.4102599999999996 | X28: =ABS((RC[-3]*RC[-11]-RC[-2]*RC[-9])/1000) -> 0.85010459999999988 | Y28: =(RC[-14]-RC[1])/RC[-18]*100 -> #DIV/0! | Z28: 5.74 | AC28: =VALUE(RC[-27]) -> 2018-09-06T00:00:00.000 | AD28: =IF(RC[21]=42,"*",IF(RC[21]=32,"",RC[21])) -> - | AE28: =RC[-28] -> 24 | AF28: =RC[-28] -> 0 | AG28: =RC[-28] -> 0 | AH28: =RC[-28] -> 0 | AI28: =RC[-28] -> 0 | AJ28: =RC[-28] -> 0 | AK28: =RC[-28] -> 0 | AL28: =RC[-28] -> 0 | AM28: =RC[-28] -> 0 | AN28: =RC[-28] -> 35.44 | AO28: =RC[-28] -> 69.5 | AP28: - | AQ28: =RC[-29] -> 29.44 | AR28: =RC[-29] -> 53.91 | AS28: - | AT28: =RC[-30] -> 15.590000000000003 | AU28: =RC[-30] -> 6 | AV28: =RC[-30] -> 0.85599999999999998 | AW28: =RC[-30] -> 0.85599999999999998 | AY28: - | AZ28: - | BA28: -
A29: =IF(RC[1]="","",DATEVALUE(RC[1])) -> 43350 | B29: 07.09.18 | C29: 24 | L29: 34.57 | M29: 69.89 | N29: 29.45 | O29: 54.02 | P29: =IF(AND(ISNUMBER(RC[-3]),ISNUMBER(RC[-1])),RC[-3]-RC[-1],"-") -> 15.869999999999997 | Q29: 5.12 | R29: 0.80700000000000005 | S29: =RC[-1] -> 0.80700000000000005 | T29: =(RC[-16]*RC[-15]-RC[-13]*RC[-12])/1000 -> 0 | U29: 33.83 | V29: 28.95 | W29: =RC[-2]*RC[-10]/1000 -> 2.3643786999999996 | X29: =ABS((RC[-3]*RC[-11]-RC[-2]*RC[-9])/1000) -> 0.80049969999999959 | Y29: =(RC[-14]-RC[1])/RC[-18]*100 -> #DIV/0! | Z29: 4.88 | AC29: =VALUE(RC[-27]) -> 2018-09-07T00:00:00.000 | AD29: =IF(RC[21]=42,"*",IF(RC[21]=32,"",RC[21])) -> - | AE29: =RC[-28] -> 24 | AF29: =RC[-28] -> 0 | AG29: =RC[-28] -> 0 | AH29: =RC[-28] -> 0 | AI29: =RC[-28] -> 0 | AJ29: =RC[-28] -> 0 | AK29: =RC[-28] -> 0 | AL29: =RC[-28] -> 0 | AM29: =RC[-28] -> 0 | AN29: =RC[-28] -> 34.57 | AO29: =RC[-28] -> 69.89 | AP29: - | AQ29: =RC[-29] -> 29.45 | AR29: =RC[-29] -> 54.02 | AS29: - | AT29: =RC[-30] -> 15.869999999999997 | AU29: =RC[-30] -> 5.12 | AV29: =RC[-30] -> 0.80700000000000005 | AW29: =RC[-30] -> 0.80700000000000005 | AY29: - | AZ29: - | BA29: -
A30: =IF(RC[1]="","",DATEVALUE(RC[1])) -> 43351 | B30: 08.09.18 | C30: 24 | L30: 34.659999999999997 | M30: 69.069999999999993 | N30: 29.22 | O30: 53.58 | P30: =IF(AND(ISNUMBER(RC[-3]),ISNUMBER(RC[-1])),RC[-3]-RC[-1],"-") -> 15.489999999999995 | Q30: 5.44 | R30: 0.80500000000000005 | S30: =RC[-1] -> 0.80500000000000005 | T30: =(RC[-16]*RC[-15]-RC[-13]*RC[-12])/1000 -> 0 | U30: 33.93 | V30: 28.71 | W30: =RC[-2]*RC[-10]/1000 -> 2.3435450999999996 | X30: =ABS((RC[-3]*RC[-11]-RC[-2]*RC[-9])/1000) -> 0.80526329999999979 | Y30: =(RC[-14]-RC[1])/RC[-18]*100 -> #DIV/0! | Z30: 5.22 | AC30: =VALUE(RC[-27]) -> 2018-09-08T00:00:00.000 | AD30: =IF(RC[21]=42,"*",IF(RC[21]=32,"",RC[21])) -> - | AE30: =RC[-28] -> 24 | AF30: =RC[-28] -> 0 | AG30: =RC[-28] -> 0 | AH30: =RC[-28] -> 0 | AI30: =RC[-28] -> 0 | AJ30: =RC[-28] -> 0 | AK30: =RC[-28] -> 0 | AL30: =RC[-28] -> 0 | AM30: =RC[-28] -> 0 | AN30: =RC[-28] -> 34.659999999999997 | AO30: =RC[-28] -> 69.069999999999993 | AP30: - | AQ30: =RC[-29] -> 29.22 | AR30: =RC[-29] -> 53.58 | AS30: - | AT30: =RC[-30] -> 15.489999999999995 | AU30: =RC[-30] -> 5.44 | AV30: =RC[-30] -> 0.80500000000000005 | AW30: =RC[-30] -> 0.80500000000000005 | AY30: - | AZ30: - | BA30: -
A31: =IF(RC[1]="","",DATEVALUE(RC[1])) -> 43352 | B31: 09.09.18 | C31: 24 | L31: 34.92 | M31: 68.959999999999994 | N31: 29.23 | O31: 53.35 | P31: =IF(AND(ISNUMBER(RC[-3]),ISNUMBER(RC[-1])),RC[-3]-RC[-1],"-") -> 15.609999999999992 | Q31: 5.69 | R31: 0.83 | S31: =RC[-1] -> 0.83 | T31: =(RC[-16]*RC[-15]-RC[-13]*RC[-12])/1000 -> 0 | U31: 34.159999999999997 | V31: 28.75 | W31: =RC[-2]*RC[-10]/1000 -> 2.3556735999999998 | X31: =ABS((RC[-3]*RC[-11]-RC[-2]*RC[-9])/1000) -> 0.82186109999999968 | Y31: =(RC[-14]-RC[1])/RC[-18]*100 -> #DIV/0! | Z31: 5.41 | AC31: =VALUE(RC[-27]) -> 2018-09-09T00:00:00.000 | AD31: =IF(RC[21]=42,"*",IF(RC[21]=32,"",RC[21])) -> - | AE31: =RC[-28] -> 24 | AF31: =RC[-28] -> 0 | AG31: =RC[-28] -> 0 | AH31: =RC[-28] -> 0 | AI31: =RC[-28] -> 0 | AJ31: =RC[-28] -> 0 | AK31: =RC[-28] -> 0 | AL31: =RC[-28] -> 0 | AM31: =RC[-28] -> 0 | AN31: =RC[-28] -> 34.92 | AO31: =RC[-28] -> 68.959999999999994 | AP31: - | AQ31: =RC[-29] -> 29.23 | AR31: =RC[-29] -> 53.35 | AS31: - | AT31: =RC[-30] -> 15.609999999999992 | AU31: =RC[-30] -> 5.69 | AV31: =RC[-30] -> 0.83 | AW31: =RC[-30] -> 0.83 | AY31: - | AZ31: - | BA31: -
A32: =IF(RC[1]="","",DATEVALUE(RC[1])) -> 43353 | B32: 10.09.18 | C32: 24 | L32: 33.96 | M32: 70.84 | N32: 28.05 | O32: 53.72 | P32: =IF(AND(ISNUMBER(RC[-3]),ISNUMBER(RC[-1])),RC[-3]-RC[-1],"-") -> 17.120000000000005 | Q32: 5.91 | R32: 0.876 | S32: =RC[-1] -> 0.876 | T32: =(RC[-16]*RC[-15]-RC[-13]*RC[-12])/1000 -> 0 | U32: 33.25 | V32: 27.62 | W32: =RC[-2]*RC[-10]/1000 -> 2.3554300000000001 | X32: =ABS((RC[-3]*RC[-11]-RC[-2]*RC[-9])/1000) -> 0.87168360000000034 | Y32: =(RC[-14]-RC[1])/RC[-18]*100 -> #DIV/0! | Z32: 5.63 | AC32: =VALUE(RC[-27]) -> 2018-09-10T00:00:00.000 | AD32: =IF(RC[21]=42,"*",IF(RC[21]=32,"",RC[21])) -> - | AE32: =RC[-28] -> 24 | AF32: =RC[-28] -> 0 | AG32: =RC[-28] -> 0 | AH32: =RC[-28] -> 0 | AI32: =RC[-28] -> 0 | AJ32: =RC[-28] -> 0 | AK32: =RC[-28] -> 0 | AL32: =RC[-28] -> 0 | AM32: =RC[-28] -> 0 | AN32: =RC[-28] -> 33.96 | AO32: =RC[-28] -> 70.84 | AP32: - | AQ32: =RC[-29] -> 28.05 | AR32: =RC[-29] -> 53.72 | AS32: - | AT32: =RC[-30] -> 17.120000000000005 | AU32: =RC[-30] -> 5.91 | AV32: =RC[-30] -> 0.876 | AW32: =RC[-30] -> 0.876 | AY32: - | AZ32: - | BA32: -
A33: =IF(RC[1]="","",DATEVALUE(RC[1])) -> 43354 | B33: 11.09.18 | C33: 24 | L33: 33.200000000000003 | M33: 69.94 | N33: 26.92 | O33: 52.71 | P33: =IF(AND(ISNUMBER(RC[-3]),ISNUMBER(RC[-1])),RC[-3]-RC[-1],"-") -> 17.229999999999997 | Q33: 6.28 | R33: 0.872 | S33: =RC[-1] -> 0.872 | T33: =(RC[-16]*RC[-15]-RC[-13]*RC[-12])/1000 -> 0 | U33: 32.479999999999997 | V33: 26.6 | W33: =RC[-2]*RC[-10]/1000 -> 2.2716512 | X33: =ABS((RC[-3]*RC[-11]-RC[-2]*RC[-9])/1000) -> 0.86956519999999982 | Y33: =(RC[-14]-RC[1])/RC[-18]*100 -> #DIV/0! | Z33: 5.88 | AC33: =VALUE(RC[-27]) -> 2018-09-11T00:00:00.000 | AD33: =IF(RC[21]=42,"*",IF(RC[21]=32,"",RC[21])) -> - | AE33: =RC[-28] -> 24 | AF33: =RC[-28] -> 0 | AG33: =RC[-28] -> 0 | AH33: =RC[-28] -> 0 | AI33: =RC[-28] -> 0 | AJ33: =RC[-28] -> 0 | AK33: =RC[-28] -> 0 | AL33: =RC[-28] -> 0 | AM33: =RC[-28] -> 0 | AN33: =RC[-28] -> 33.200000000000003 | AO33: =RC[-28] -> 69.94 | AP33: - | AQ33: =RC[-29] -> 26.92 | AR33: =RC[-29] -> 52.71 | AS33: - | AT33: =RC[-30] -> 17.229999999999997 | AU33: =RC[-30] -> 6.28 | AV33: =RC[-30] -> 0.872 | AW33: =RC[-30] -> 0.872 | AY33: - | AZ33: - | BA33: -
A34: =IF(RC[1]="","",DATEVALUE(RC[1])) -> 43355 | B34: 12.09.18 | C34: 24 | L34: 33.49 | M34: 70.599999999999994 | N34: 26.89 | O34: 53.24 | P34: =IF(AND(ISNUMBER(RC[-3]),ISNUMBER(RC[-1])),RC[-3]-RC[-1],"-") -> 17.359999999999992 | Q34: 6.6 | R34: 0.90400000000000003 | S34: =RC[-1] -> 0.90400000000000003 | T34: =(RC[-16]*RC[-15]-RC[-13]*RC[-12])/1000 -> 0 | U34: 32.770000000000003 | V34: 26.52 | W34: =RC[-2]*RC[-10]/1000 -> 2.3135620000000001 | X34: =ABS((RC[-3]*RC[-11]-RC[-2]*RC[-9])/1000) -> 0.90163719999999992 | Y34: =(RC[-14]-RC[1])/RC[-18]*100 -> #DIV/0! | Z34: 6.25 | AC34: =VALUE(RC[-27]) -> 2018-09-12T00:00:00.000 | AD34: =IF(RC[21]=42,"*",IF(RC[21]=32,"",RC[21])) -> - | AE34: =RC[-28] -> 24 | AF34: =RC[-28] -> 0 | AG34: =RC[-28] -> 0 | AH34: =RC[-28] -> 0 | AI34: =RC[-28] -> 0 | AJ34: =RC[-28] -> 0 | AK34: =RC[-28] -> 0 | AL34: =RC[-28] -> 0 | AM34: =RC[-28] -> 0 | AN34: =RC[-28] -> 33.49 | AO34: =RC[-28] -> 70.599999999999994 | AP34: - | AQ34: =RC[-29] -> 26.89 | AR34: =RC[-29] -> 53.24 | AS34: - | AT34: =RC[-30] -> 17.359999999999992 | AU34: =RC[-30] -> 6.6 | AV34: =RC[-30] -> 0.90400000000000003 | AW34: =RC[-30] -> 0.90400000000000003 | AY34: - | AZ34: - | BA34: -
A35: =IF(RC[1]="","",DATEVALUE(RC[1])) -> 43356 | B35: 13.09.18 | C35: 24 | L35: 33.200000000000003 | M35: 70.53 | N35: 26.78 | O35: 52.97 | P35: =IF(AND(ISNUMBER(RC[-3]),ISNUMBER(RC[-1])),RC[-3]-RC[-1],"-") -> 17.560000000000002 | Q35: 6.42 | R35: 0.89300000000000002 | S35: =RC[-1] -> 0.89300000000000002 | T35: =(RC[-16]*RC[-15]-RC[-13]*RC[-12])/1000 -> 0 | U35: 32.520000000000003 | V35: 26.46 | W35: =RC[-2]*RC[-10]/1000 -> 2.2936356 | X35: =ABS((RC[-3]*RC[-11]-RC[-2]*RC[-9])/1000) -> 0.8920494000000001 | Y35: =(RC[-14]-RC[1])/RC[-18]*100 -> #DIV/0! | Z35: 6.06 | AC35: =VALUE(RC[-27]) -> 2018-09-13T00:00:00.000 | AD35: =IF(RC[21]=42,"*",IF(RC[21]=32,"",RC[21])) -> - | AE35: =RC[-28] -> 24 | AF35: =RC[-28] -> 0 | AG35: =RC[-28] -> 0 | AH35: =RC[-28] -> 0 | AI35: =RC[-28] -> 0 | AJ35: =RC[-28] -> 0 | AK35: =RC[-28] -> 0 | AL35: =RC[-28] -> 0 | AM35: =RC[-28] -> 0 | AN35: =RC[-28] -> 33.200000000000003 | AO35: =RC[-28] -> 70.53 | AP35: - | AQ35: =RC[-29] -> 26.78 | AR35: =RC[-29] -> 52.97 | AS35: - | AT35: =RC[-30] -> 17.560000000000002 | AU35: =RC[-30] -> 6.42 | AV35: =RC[-30] -> 0.89300000000000002 | AW35: =RC[-30] -> 0.89300000000000002 | AY35: - | AZ35: - | BA35: -
A36: =IF(RC[1]="","",DATEVALUE(RC[1])) -> 43357 | B36: 14.09.18 | C36: 24 | L36: 32.81 | M36: 69.849999999999994 | N36: 26.31 | O36: 52.52 | P36: =IF(AND(ISNUMBER(RC[-3]),ISNUMBER(RC[-1])),RC[-3]-RC[-1],"-") -> 17.329999999999991 | Q36: 6.5 | R36: 0.875 | S36: =RC[-1] -> 0.875 | T36: =(RC[-16]*RC[-15]-RC[-13]*RC[-12])/1000 -> 0 | U36: 32.08 | V36: 26.05 | W36: =RC[-2]*RC[-10]/1000 -> 2.2407879999999993 | X36: =ABS((RC[-3]*RC[-11]-RC[-2]*RC[-9])/1000) -> 0.87264199999999936 | Y36: =(RC[-14]-RC[1])/RC[-18]*100 -> #DIV/0! | Z36: 6.03 | AC36: =VALUE(RC[-27]) -> 2018-09-14T00:00:00.000 | AD36: =IF(RC[21]=42,"*",IF(RC[21]=32,"",RC[21])) -> - | AE36: =RC[-28] -> 24 | AF36: =RC[-28] -> 0 | AG36: =RC[-28] -> 0 | AH36: =RC[-28] -> 0 | AI36: =RC[-28] -> 0 | AJ36: =RC[-28] -> 0 | AK36: =RC[-28] -> 0 | AL36: =RC[-28] -> 0 | AM36: =RC[-28] -> 0 | AN36: =RC[-28] -> 32.81 | AO36: =RC[-28] -> 69.849999999999994 | AP36: - | AQ36: =RC[-29] -> 26.31 | AR36: =RC[-29] -> 52.52 | AS36: - | AT36: =RC[-30] -> 17.329999999999991 | AU36: =RC[-30] -> 6.5 | AV36: =RC[-30] -> 0.875 | AW36: =RC[-30] -> 0.875 | AY36: - | AZ36: - | BA36: -
A37: =IF(RC[1]="","",DATEVALUE(RC[1])) -> 43358 | B37: 15.09.18 | C37: 24 | L37: 32.47 | M37: 68.45 | N37: 26.08 | O37: 51.81 | P37: =IF(AND(ISNUMBER(RC[-3]),ISNUMBER(RC[-1])),RC[-3]-RC[-1],"-") -> 16.64 | Q37: 6.39 | R37: 0.83499999999999996 | S37: =RC[-1] -> 0.83499999999999996 | T37: =(RC[-16]*RC[-15]-RC[-13]*RC[-12])/1000 -> 0 | U37: 31.77 | V37: 25.84 | W37: =RC[-2]*RC[-10]/1000 -> 2.1746565000000002 | X37: =ABS((RC[-3]*RC[-11]-RC[-2]*RC[-9])/1000) -> 0.83588609999999997 | Y37: =(RC[-14]-RC[1])/RC[-18]*100 -> #DIV/0! | Z37: 5.93 | AC37: =VALUE(RC[-27]) -> 2018-09-15T00:00:00.000 | AD37: =IF(RC[21]=42,"*",IF(RC[21]=32,"",RC[21])) -> - | AE37: =RC[-28] -> 24 | AF37: =RC[-28] -> 0 | AG37: =RC[-28] -> 0 | AH37: =RC[-28] -> 0 | AI37: =RC[-28] -> 0 | AJ37: =RC[-28] -> 0 | AK37: =RC[-28] -> 0 | AL37: =RC[-28] -> 0 | AM37: =RC[-28] -> 0 | AN37: =RC[-28] -> 32.47 | AO37: =RC[-28] -> 68.45 | AP37: - | AQ37: =RC[-29] -> 26.08 | AR37: =RC[-29] -> 51.81 | AS37: - | AT37: =RC[-30] -> 16.64 | AU37: =RC[-30] -> 6.39 | AV37: =RC[-30] -> 0.83499999999999996 | AW37: =RC[-30] -> 0.83499999999999996 | AY37: - | AZ37: - | BA37: -
A38: =IF(RC[1]="","",DATEVALUE(RC[1])) -> 43359 | B38: 16.09.18 | C38: 24 | L38: 33.270000000000003 | M38: 68.77 | N38: 26.32 | O38: 52.06 | P38: =IF(AND(ISNUMBER(RC[-3]),ISNUMBER(RC[-1])),RC[-3]-RC[-1],"-") -> 16.709999999999994 | Q38: 6.95 | R38: 0.88800000000000001 | S38: =RC[-1] -> 0.88800000000000001 | T38: =(RC[-16]*RC[-15]-RC[-13]*RC[-12])/1000 -> 0 | U38: 32.6 | V38: 26.07 | W38: =RC[-2]*RC[-10]/1000 -> 2.2419020000000001 | X38: =ABS((RC[-3]*RC[-11]-RC[-2]*RC[-9])/1000) -> 0.88469779999999987 | Y38: =(RC[-14]-RC[1])/RC[-18]*100 -> #DIV/0! | Z38: 6.53 | AC38: =VALUE(RC[-27]) -> 2018-09-16T00:00:00.000 | AD38: =IF(RC[21]=42,"*",IF(RC[21]=32,"",RC[21])) -> - | AE38: =RC[-28] -> 24 | AF38: =RC[-28] -> 0 | AG38: =RC[-28] -> 0 | AH38: =RC[-28] -> 0 | AI38: =RC[-28] -> 0 | AJ38: =RC[-28] -> 0 | AK38: =RC[-28] -> 0 | AL38: =RC[-28] -> 0 | AM38: =RC[-28] -> 0 | AN38: =RC[-28] -> 33.270000000000003 | AO38: =RC[-28] -> 68.77 | AP38: - | AQ38: =RC[-29] -> 26.32 | AR38: =RC[-29] -> 52.06 | AS38: - | AT38: =RC[-30] -> 16.709999999999994 | AU38: =RC[-30] -> 6.95 | AV38: =RC[-30] -> 0.88800000000000001 | AW38: =RC[-30] -> 0.88800000000000001 | AY38: - | AZ38: - | BA38: -
A39: =IF(RC[1]="","",DATEVALUE(RC[1])) -> 43360 | B39: 17.09.18 | C39: 24 | L39: 33.17 | M39: 69.42 | N39: 26.3 | O39: 51.99 | P39: =IF(AND(ISNUMBER(RC[-3]),ISNUMBER(RC[-1])),RC[-3]-RC[-1],"-") -> 17.43 | Q39: 6.87 | R39: 0.90100000000000002 | S39: =RC[-1] -> 0.90100000000000002 | T39: =(RC[-16]*RC[-15]-RC[-13]*RC[-12])/1000 -> 0 | U39: 32.47 | V39: 26.01 | W39: =RC[-2]*RC[-10]/1000 -> 2.2540673999999998 | X39: =ABS((RC[-3]*RC[-11]-RC[-2]*RC[-9])/1000) -> 0.90180749999999965 | Y39: =(RC[-14]-RC[1])/RC[-18]*100 -> #DIV/0! | Z39: 6.46 | AC39: =VALUE(RC[-27]) -> 2018-09-17T00:00:00.000 | AD39: =IF(RC[21]=42,"*",IF(RC[21]=32,"",RC[21])) -> - | AE39: =RC[-28] -> 24 | AF39: =RC[-28] -> 0 | AG39: =RC[-28] -> 0 | AH39: =RC[-28] -> 0 | AI39: =RC[-28] -> 0 | AJ39: =RC[-28] -> 0 | AK39: =RC[-28] -> 0 | AL39: =RC[-28] -> 0 | AM39: =RC[-28] -> 0 | AN39: =RC[-28] -> 33.17 | AO39: =RC[-28] -> 69.42 | AP39: - | AQ39: =RC[-29] -> 26.3 | AR39: =RC[-29] -> 51.99 | AS39: - | AT39: =RC[-30] -> 17.43 | AU39: =RC[-30] -> 6.87 | AV39: =RC[-30] -> 0.90100000000000002 | AW39: =RC[-30] -> 0.90100000000000002 | AY39: - | AZ39: - | BA39: -
A40: =IF(RC[1]="","",DATEVALUE(RC[1])) -> 43361 | B40: 18.09.18 | C40: 24 | L40: 33.68 | M40: 70.28 | N40: 25.81 | O40: 52.71 | P40: =IF(AND(ISNUMBER(RC[-3]),ISNUMBER(RC[-1])),RC[-3]-RC[-1],"-") -> 17.57 | Q40: 7.87 | R40: 0.97 | S40: =RC[-1] -> 0.97 | T40: =(RC[-16]*RC[-15]-RC[-13]*RC[-12])/1000 -> 0 | U40: 32.94 | V40: 25.56 | W40: =RC[-2]*RC[-10]/1000 -> 2.3150232000000002 | X40: =ABS((RC[-3]*RC[-11]-RC[-2]*RC[-9])/1000) -> 0.96775560000000016 | Y40: =(RC[-14]-RC[1])/RC[-18]*100 -> #DIV/0! | Z40: 7.38 | AC40: =VALUE(RC[-27]) -> 2018-09-18T00:00:00.000 | AD40: =IF(RC[21]=42,"*",IF(RC[21]=32,"",RC[21])) -> - | AE40: =RC[-28] -> 24 | AF40: =RC[-28] -> 0 | AG40: =RC[-28] -> 0 | AH40: =RC[-28] -> 0 | AI40: =RC[-28] -> 0 | AJ40: =RC[-28] -> 0 | AK40: =RC[-28] -> 0 | AL40: =RC[-28] -> 0 | AM40: =RC[-28] -> 0 | AN40: =RC[-28] -> 33.68 | AO40: =RC[-28] -> 70.28 | AP40: - | AQ40: =RC[-29] -> 25.81 | AR40: =RC[-29] -> 52.71 | AS40: - | AT40: =RC[-30] -> 17.57 | AU40: =RC[-30] -> 7.87 | AV40: =RC[-30] -> 0.97 | AW40: =RC[-30] -> 0.97 | AY40: - | AZ40: - | BA40: -
A41: =IF(RC[1]="","",DATEVALUE(RC[1])) -> 43362 | B41: 19.09.18 | C41: 24 | L41: 12.55 | M41: 63.28 | N41: 11.27 | O41: 55.14 | P41: 8.14 | Q41: 1.28 | R41: 0.21 | S41: =RC[-1] -> 0.21 | T41: =(RC[-16]*RC[-15]-RC[-13]*RC[-12])/1000 -> 0 | W41: =RC[-2]*RC[-10]/1000 -> #VALUE! | X41: =ABS((RC[-3]*RC[-11]-RC[-2]*RC[-9])/1000) -> #VALUE! | Y41: =(RC[-14]-RC[1])/RC[-18]*100 -> #VALUE! | AC41: =VALUE(RC[-27]) -> 2018-09-19T00:00:00.000 | AD41: =IF(RC[21]=42,"*",IF(RC[21]=32,"",RC[21])) ->  | AE41: =RC[-28] -> 24 | AF41: =RC[-28] -> 0 | AG41: =RC[-28] -> 0 | AH41: =RC[-28] -> 0 | AI41: =RC[-28] -> 0 | AJ41: =RC[-28] -> 0 | AK41: =RC[-28] -> 0 | AL41: =RC[-28] -> 0 | AM41: =RC[-28] -> 0 | AN41: =RC[-28] -> 12.55 | AO41: =RC[-28] -> 63.28 | AP41: - | AQ41: =RC[-29] -> 11.27 | AR41: =RC[-29] -> 55.14 | AS41: - | AT41: =RC[-30] -> 8.14 | AU41: =RC[-30] -> 1.28 | AV41: =RC[-30] -> 0.21 | AW41: =RC[-30] -> 0.21
A42: =IF(RC[1]="","",DATEVALUE(RC[1])) -> 43363 | B42: 20.09.18 | C42: 24 | L42: 11.85 | M42: 56.15 | N42: 10.77 | O42: 55.04 | P42: 1.1099999999999994 | Q42: 1.08 | R42: 0.184 | S42: =RC[-1] -> 0.184 | T42: =(RC[-16]*RC[-15]-RC[-13]*RC[-12])/1000 -> 0 | W42: =RC[-2]*RC[-10]/1000 -> #VALUE! | X42: =ABS((RC[-3]*RC[-11]-RC[-2]*RC[-9])/1000) -> #VALUE! | Y42: =(RC[-14]-RC[1])/RC[-18]*100 -> #VALUE! | AC42: =VALUE(RC[-27]) -> 2018-09-20T00:00:00.000 | AD42: =IF(RC[21]=42,"*",IF(RC[21]=32,"",RC[21])) ->  | AE42: =RC[-28] -> 24 | AF42: =RC[-28] -> 0 | AG42: =RC[-28] -> 0 | AH42: =RC[-28] -> 0 | AI42: =RC[-28] -> 0 | AJ42: =RC[-28] -> 0 | AK42: =RC[-28] -> 0 | AL42: =RC[-28] -> 0 | AM42: =RC[-28] -> 0 | AN42: =RC[-28] -> 11.85 | AO42: =RC[-28] -> 56.15 | AP42: - | AQ42: =RC[-29] -> 10.77 | AR42: =RC[-29] -> 55.04 | AS42: - | AT42: =RC[-30] -> 1.1099999999999994 | AU42: =RC[-30] -> 1.08 | AV42: =RC[-30] -> 0.184 | AW42: =RC[-30] -> 0.184
A43: =IF(RC[1]="","",DATEVALUE(RC[1])) -> 43364 | B43: 21.09.18 | C43: 24 | L43: 26.7 | M43: 68.28 | N43: 23.92 | O43: 55.86 | P43: 12.420000000000002 | Q43: 2.78 | R43: 0.48 | S43: =RC[-1] -> 0.48 | T43: =(RC[-16]*RC[-15]-RC[-13]*RC[-12])/1000 -> 0 | W43: =RC[-2]*RC[-10]/1000 -> #VALUE! | X43: =ABS((RC[-3]*RC[-11]-RC[-2]*RC[-9])/1000) -> #VALUE! | Y43: =(RC[-14]-RC[1])/RC[-18]*100 -> #VALUE! | AC43: =VALUE(RC[-27]) -> 2018-09-21T00:00:00.000 | AD43: =IF(RC[21]=42,"*",IF(RC[21]=32,"",RC[21])) ->  | AE43: =RC[-28] -> 24 | AF43: =RC[-28] -> 0 | AG43: =RC[-28] -> 0 | AH43: =RC[-28] -> 0 | AI43: =RC[-28] -> 0 | AJ43: =RC[-28] -> 0 | AK43: =RC[-28] -> 0 | AL43: =RC[-28] -> 0 | AM43: =RC[-28] -> 0 | AN43: =RC[-28] -> 26.7 | AO43: =RC[-28] -> 68.28 | AP43: - | AQ43: =RC[-29] -> 23.92 | AR43: =RC[-29] -> 55.86 | AS43: - | AT43: =RC[-30] -> 12.420000000000002 | AU43: =RC[-30] -> 2.78 | AV43: =RC[-30] -> 0.48 | AW43: =RC[-30] -> 0.48
A44: =IF(RC[1]="","",DATEVALUE(RC[1])) -> 43365 | B44: 22.09.18 | C44: 24 | L44: 4.47 | M44: 54.31 | N44: 4.1900000000000004 | O44: 55.64 | P44: -1.3299999999999983 | Q44: 0.27999999999999903 | R44: 2.4E-2 | S44: =RC[-1] -> 2.4E-2 | T44: =(RC[-16]*RC[-15]-RC[-13]*RC[-12])/1000 -> 0 | W44: =RC[-2]*RC[-10]/1000 -> #VALUE! | X44: =ABS((RC[-3]*RC[-11]-RC[-2]*RC[-9])/1000) -> #VALUE! | Y44: =(RC[-14]-RC[1])/RC[-18]*100 -> #VALUE! | AC44: =VALUE(RC[-27]) -> 2018-09-22T00:00:00.000 | AD44: =IF(RC[21]=42,"*",IF(RC[21]=32,"",RC[21])) ->  | AE44: =RC[-28] -> 24 | AF44: =RC[-28] -> 0 | AG44: =RC[-28] -> 0 | AH44: =RC[-28] -> 0 | AI44: =RC[-28] -> 0 | AJ44: =RC[-28] -> 0 | AK44: =RC[-28] -> 0 | AL44: =RC[-28] -> 0 | AM44: =RC[-28] -> 0 | AN44: =RC[-28] -> 4.47 | AO44: =RC[-28] -> 54.31 | AP44: - | AQ44: =RC[-29] -> 4.1900000000000004 | AR44: =RC[-29] -> 55.64 | AS44: - | AT44: =RC[-30] -> -1.3299999999999983 | AU44: =RC[-30] -> 0.27999999999999903 | AV44: =RC[-30] -> 2.4E-2 | AW44: =RC[-30] -> 2.4E-2
A45: =IF(RC[1]="","",DATEVALUE(RC[1])) ->  | C45: 24 | P45: =IF(AND(ISNUMBER(RC[-3]),ISNUMBER(RC[-1])),RC[-3]-RC[-1],"-") -> - | S45: =RC[-1] ->  | T45: =(RC[-16]*RC[-15]-RC[-13]*RC[-12])/1000 -> 0 | W45: =RC[-2]*RC[-10]/1000 -> #VALUE! | X45: =ABS((RC[-3]*RC[-11]-RC[-2]*RC[-9])/1000) -> #VALUE! | Y45: =(RC[-14]-RC[1])/RC[-18]*100 -> #VALUE! | AC45: =VALUE(RC[-27]) -> #VALUE! | AD45: =IF(RC[21]=42,"*",IF(RC[21]=32,"",RC[21])) ->  | AE45: =RC[-28] -> 24 | AF45: =RC[-28] -> 0 | AG45: =RC[-28] -> 0 | AH45: =RC[-28] -> 0 | AI45: =RC[-28] -> 0 | AJ45: =RC[-28] -> 0 | AK45: =RC[-28] -> 0 | AL45: =RC[-28] -> 0 | AM45: =RC[-28] -> 0 | AN45: =RC[-28] ->  | AO45: =RC[-28] ->  | AP45: - | AQ45: =RC[-29] ->  | AR45: =RC[-29] ->  | AS45: - | AT45: =RC[-30] -> - | AU45: =RC[-30] ->  | AV45: =RC[-30] ->  | AW45: =RC[-30] -> 
A46: =IF(RC[1]="","",DATEVALUE(RC[1])) ->  | C46: 24 | P46: =IF(AND(ISNUMBER(RC[-3]),ISNUMBER(RC[-1])),RC[-3]-RC[-1],"-") -> - | S46: =RC[-1] ->  | T46: =(RC[-16]*RC[-15]-RC[-13]*RC[-12])/1000 -> 0 | W46: =RC[-2]*RC[-10]/1000 -> #VALUE! | X46: =ABS((RC[-3]*RC[-11]-RC[-2]*RC[-9])/1000) -> #VALUE! | Y46: =(RC[-14]-RC[1])/RC[-18]*100 -> #VALUE! | AC46: =VALUE(RC[-27]) -> #VALUE! | AD46: =IF(RC[21]=42,"*",IF(RC[21]=32,"",RC[21])) ->  | AE46: =RC[-28] -> 24 | AF46: =RC[-28] -> 0 | AG46: =RC[-28] -> 0 | AH46: =RC[-28] -> 0 | AI46: =RC[-28] -> 0 | AJ46: =RC[-28] -> 0 | AK46: =RC[-28] -> 0 | AL46: =RC[-28] -> 0 | AM46: =RC[-28] -> 0 | AN46: =RC[-28] ->  | AO46: =RC[-28] ->  | AP46: - | AQ46: =RC[-29] ->  | AR46: =RC[-29] ->  | AS46: - | AT46: =RC[-30] -> - | AU46: =RC[-30] ->  | AV46: =RC[-30] ->  | AW46: =RC[-30] -> 
A47: =IF(RC[1]="","",DATEVALUE(RC[1])) ->  | C47: 24 | P47: =IF(AND(ISNUMBER(RC[-3]),ISNUMBER(RC[-1])),RC[-3]-RC[-1],"-") -> - | S47: =RC[-1] ->  | T47: =(RC[-16]*RC[-15]-RC[-13]*RC[-12])/1000 -> 0 | W47: =RC[-2]*RC[-10]/1000 -> #VALUE! | X47: =ABS((RC[-3]*RC[-11]-RC[-2]*RC[-9])/1000) -> #VALUE! | Y47: =(RC[-14]-RC[1])/RC[-18]*100 -> #VALUE! | AC47: =VALUE(RC[-27]) -> #VALUE! | AD47: =IF(RC[21]=42,"*",IF(RC[21]=32,"",RC[21])) ->  | AE47: =RC[-28] -> 24 | AF47: =RC[-28] -> 0 | AG47: =RC[-28] -> 0 | AH47: =RC[-28] -> 0 | AI47: =RC[-28] -> 0 | AJ47: =RC[-28] -> 0 | AK47: =RC[-28] -> 0 | AL47: =RC[-28] -> 0 | AM47: =RC[-28] -> 0 | AN47: =RC[-28] ->  | AO47: =RC[-28] ->  | AP47: - | AQ47: =RC[-29] ->  | AR47: =RC[-29] ->  | AS47: - | AT47: =RC[-30] -> - | AU47: =RC[-30] ->  | AV47: =RC[-30] ->  | AW47: =RC[-30] -> 
A48: =IF(RC[1]="","",DATEVALUE(RC[1])) ->  | C48: 24 | P48: =IF(AND(ISNUMBER(RC[-3]),ISNUMBER(RC[-1])),RC[-3]-RC[-1],"-") -> - | S48: =RC[-1] ->  | T48: =(RC[-16]*RC[-15]-RC[-13]*RC[-12])/1000 -> 0 | W48: =RC[-2]*RC[-10]/1000 -> #VALUE! | X48: =ABS((RC[-3]*RC[-11]-RC[-2]*RC[-9])/1000) -> #VALUE! | Y48: =(RC[-14]-RC[1])/RC[-18]*100 -> #VALUE! | AC48: =VALUE(RC[-27]) -> #VALUE! | AD48: =IF(RC[21]=42,"*",IF(RC[21]=32,"",RC[21])) ->  | AE48: =RC[-28] -> 24 | AF48: =RC[-28] -> 0 | AG48: =RC[-28] -> 0 | AH48: =RC[-28] -> 0 | AI48: =RC[-28] -> 0 | AJ48: =RC[-28] -> 0 | AK48: =RC[-28] -> 0 | AL48: =RC[-28] -> 0 | AM48: =RC[-28] -> 0 | AN48: =RC[-28] ->  | AO48: =RC[-28] ->  | AP48: - | AQ48: =RC[-29] ->  | AR48: =RC[-29] ->  | AS48: - | AT48: =RC[-30] -> - | AU48: =RC[-30] ->  | AV48: =RC[-30] ->  | AW48: =RC[-30] -> 
A49: =IF(RC[1]="","",DATEVALUE(RC[1])) ->  | C49: 24 | P49: =IF(AND(ISNUMBER(RC[-3]),ISNUMBER(RC[-1])),RC[-3]-RC[-1],"-") -> - | S49: =RC[-1] ->  | T49: =(RC[-16]*RC[-15]-RC[-13]*RC[-12])/1000 -> 0 | W49: =RC[-2]*RC[-10]/1000 -> #VALUE! | X49: =ABS((RC[-3]*RC[-11]-RC[-2]*RC[-9])/1000) -> #VALUE! | Y49: =(RC[-14]-RC[1])/RC[-18]*100 -> #VALUE! | AC49: =VALUE(RC[-27]) -> #VALUE! | AD49: =IF(RC[21]=42,"*",IF(RC[21]=32,"",RC[21])) ->  | AE49: =RC[-28] -> 24 | AF49: =RC[-28] -> 0 | AG49: =RC[-28] -> 0 | AH49: =RC[-28] -> 0 | AI49: =RC[-28] -> 0 | AJ49: =RC[-28] -> 0 | AK49: =RC[-28] -> 0 | AL49: =RC[-28] -> 0 | AM49: =RC[-28] -> 0 | AN49: =RC[-28] ->  | AO49: =RC[-28] ->  | AP49: - | AQ49: =RC[-29] ->  | AR49: =RC[-29] ->  | AS49: - | AT49: =RC[-30] -> - | AU49: =RC[-30] ->  | AV49: =RC[-30] ->  | AW49: =RC[-30] -> 
A50: =IF(RC[1]="","",DATEVALUE(RC[1])) ->  | P50: =IF(AND(ISNUMBER(RC[-3]),ISNUMBER(RC[-1])),RC[-3]-RC[-1],"-") -> - | S50: =RC[-1] ->  | T50: =(RC[-16]*RC[-15]-RC[-13]*RC[-12])/1000 -> 0 | W50: =RC[-2]*RC[-10]/1000 -> #VALUE! | X50: =ABS((RC[-3]*RC[-11]-RC[-2]*RC[-9])/1000) -> #VALUE! | Y50: =(RC[-14]-RC[1])/RC[-18]*100 -> #VALUE! | AC50: =VALUE(RC[-27]) -> #VALUE! | AD50: =IF(RC[21]=42,"*",IF(RC[21]=32,"",RC[21])) ->  | AE50: =RC[-28] ->  | AF50: =RC[-28] -> 0 | AG50: =RC[-28] -> 0 | AH50: =RC[-28] -> 0 | AI50: =RC[-28] -> 0 | AJ50: =RC[-28] -> 0 | AK50: =RC[-28] -> 0 | AL50: =RC[-28] -> 0 | AM50: =RC[-28] -> 0 | AN50: =RC[-28] ->  | AO50: =RC[-28] ->  | AP50: - | AQ50: =RC[-29] ->  | AR50: =RC[-29] ->  | AS50: - | AT50: =RC[-30] -> - | AU50: =RC[-30] ->  | AV50: =RC[-30] ->  | AW50: =RC[-30] -> 
A51: =IF(RC[1]="","",DATEVALUE(RC[1])) ->  | P51: =IF(AND(ISNUMBER(RC[-3]),ISNUMBER(RC[-1])),RC[-3]-RC[-1],"-") -> - | S51: =RC[-1] ->  | T51: =(RC[-16]*RC[-15]-RC[-13]*RC[-12])/1000 -> 0 | W51: =RC[-2]*RC[-10]/1000 -> #VALUE! | X51: =ABS((RC[-3]*RC[-11]-RC[-2]*RC[-9])/1000) -> #VALUE! | Y51: =(RC[-14]-RC[1])/RC[-18]*100 -> #VALUE! | AC51: =VALUE(RC[-27]) -> #VALUE! | AD51: =IF(RC[21]=42,"*",IF(RC[21]=32,"",RC[21])) ->  | AE51: =RC[-28] ->  | AF51: =RC[-28] -> 0 | AG51: =RC[-28] -> 0 | AH51: =RC[-28] -> 0 | AI51: =RC[-28] -> 0 | AJ51: =RC[-28] -> 0 | AK51: =RC[-28] -> 0 | AL51: =RC[-28] -> 0 | AM51: =RC[-28] -> 0 | AN51: =RC[-28] ->  | AO51: =RC[-28] ->  | AP51: - | AQ51: =RC[-29] ->  | AR51: =RC[-29] ->  | AS51: - | AT51: =RC[-30] -> - | AU51: =RC[-30] ->  | AV51: =RC[-30] ->  | AW51: =RC[-30] -> 
A52: =IF(RC[1]="","",DATEVALUE(RC[1])) ->  | P52: =IF(AND(ISNUMBER(RC[-3]),ISNUMBER(RC[-1])),RC[-3]-RC[-1],"-") -> - | S52: =RC[-1] ->  | T52: =(RC[-16]*RC[-15]-RC[-13]*RC[-12])/1000 -> 0 | W52: =RC[-2]*RC[-10]/1000 -> #VALUE! | X52: =ABS((RC[-3]*RC[-11]-RC[-2]*RC[-9])/1000) -> #VALUE! | Y52: =(RC[-14]-RC[1])/RC[-18]*100 -> #VALUE! | AC52: =VALUE(RC[-27]) -> #VALUE! | AD52: =IF(RC[21]=42,"*",IF(RC[21]=32,"",RC[21])) ->  | AE52: =RC[-28] ->  | AF52: =RC[-28] -> 0 | AG52: =RC[-28] -> 0 | AH52: =RC[-28] -> 0 | AI52: =RC[-28] -> 0 | AJ52: =RC[-28] -> 0 | AK52: =RC[-28] -> 0 | AL52: =RC[-28] -> 0 | AM52: =RC[-28] -> 0 | AN52: =RC[-28] ->  | AO52: =RC[-28] ->  | AP52: - | AQ52: =RC[-29] ->  | AR52: =RC[-29] ->  | AS52: - | AT52: =RC[-30] -> - | AU52: =RC[-30] ->  | AV52: =RC[-30] ->  | AW52: =RC[-30] -> 
A53: =IF(RC[1]="","",DATEVALUE(RC[1])) ->  | P53: =IF(AND(ISNUMBER(RC[-3]),ISNUMBER(RC[-1])),RC[-3]-RC[-1],"-") -> - | S53: =RC[-1] ->  | T53: =(RC[-16]*RC[-15]-RC[-13]*RC[-12])/1000 -> 0 | W53: =RC[-2]*RC[-10]/1000 -> #VALUE! | X53: =ABS((RC[-3]*RC[-11]-RC[-2]*RC[-9])/1000) -> #VALUE! | Y53: =(RC[-14]-RC[1])/RC[-18]*100 -> #VALUE! | AC53: =VALUE(RC[-27]) -> #VALUE! | AD53: =IF(RC[21]=42,"*",IF(RC[21]=32,"",RC[21])) ->  | AE53: =RC[-28] ->  | AF53: =RC[-28] -> 0 | AG53: =RC[-28] -> 0 | AH53: =RC[-28] -> 0 | AI53: =RC[-28] -> 0 | AJ53: =RC[-28] -> 0 | AK53: =RC[-28] -> 0 | AL53: =RC[-28] -> 0 | AM53: =RC[-28] -> 0 | AN53: =RC[-28] ->  | AO53: =RC[-28] ->  | AP53: - | AQ53: =RC[-29] ->  | AR53: =RC[-29] ->  | AS53: - | AT53: =RC[-30] -> - | AU53: =RC[-30] ->  | AV53: =RC[-30] ->  | AW53: =RC[-30] -> 
A54: =IF(RC[1]="","",DATEVALUE(RC[1])) ->  | P54: =IF(AND(ISNUMBER(RC[-3]),ISNUMBER(RC[-1])),RC[-3]-RC[-1],"-") -> - | S54: =RC[-1] ->  | T54: =(RC[-16]*RC[-15]-RC[-13]*RC[-12])/1000 -> 0 | W54: =RC[-2]*RC[-10]/1000 -> #VALUE! | X54: =ABS((RC[-3]*RC[-11]-RC[-2]*RC[-9])/1000) -> #VALUE! | Y54: =(RC[-14]-RC[1])/RC[-18]*100 -> #VALUE! | AC54: =VALUE(RC[-27]) -> #VALUE! | AD54: =IF(RC[21]=42,"*",IF(RC[21]=32,"",RC[21])) ->  | AE54: =RC[-28] ->  | AF54: =RC[-28] -> 0 | AG54: =RC[-28] -> 0 | AH54: =RC[-28] -> 0 | AI54: =RC[-28] -> 0 | AJ54: =RC[-28] -> 0 | AK54: =RC[-28] -> 0 | AL54: =RC[-28] -> 0 | AM54: =RC[-28] -> 0 | AN54: =RC[-28] ->  | AO54: =RC[-28] ->  | AP54: - | AQ54: =RC[-29] ->  | AR54: =RC[-29] ->  | AS54: - | AT54: =RC[-30] -> - | AU54: =RC[-30] ->  | AV54: =RC[-30] ->  | AW54: =RC[-30] -> 
A55: =IF(RC[1]="","",DATEVALUE(RC[1])) ->  | P55: =IF(AND(ISNUMBER(RC[-3]),ISNUMBER(RC[-1])),RC[-3]-RC[-1],"-") -> - | S55: =RC[-1] ->  | T55: =(RC[-16]*RC[-15]-RC[-13]*RC[-12])/1000 -> 0 | W55: =RC[-2]*RC[-10]/1000 -> #VALUE! | X55: =ABS((RC[-3]*RC[-11]-RC[-2]*RC[-9])/1000) -> #VALUE! | Y55: =(RC[-14]-RC[1])/RC[-18]*100 -> #VALUE! | AC55: =VALUE(RC[-27]) -> #VALUE! | AD55: =IF(RC[21]=42,"*",IF(RC[21]=32,"",RC[21])) ->  | AE55: =RC[-28] ->  | AF55: =RC[-28] -> 0 | AG55: =RC[-28] -> 0 | AH55: =RC[-28] -> 0 | AI55: =RC[-28] -> 0 | AJ55: =RC[-28] -> 0 | AK55: =RC[-28] -> 0 | AL55: =RC[-28] -> 0 | AM55: =RC[-28] -> 0 | AN55: =RC[-28] ->  | AO55: =RC[-28] ->  | AP55: - | AQ55: =RC[-29] ->  | AR55: =RC[-29] ->  | AS55: - | AT55: =RC[-30] -> - | AU55: =RC[-30] ->  | AV55: =RC[-30] ->  | AW55: =RC[-30] -> 
A56: =IF(RC[1]="","",DATEVALUE(RC[1])) ->  | P56: =IF(AND(ISNUMBER(RC[-3]),ISNUMBER(RC[-1])),RC[-3]-RC[-1],"-") -> - | S56: =RC[-1] ->  | T56: =(RC[-16]*RC[-15]-RC[-13]*RC[-12])/1000 -> 0 | W56: =RC[-2]*RC[-10]/1000 -> #VALUE! | X56: =ABS((RC[-3]*RC[-11]-RC[-2]*RC[-9])/1000) -> #VALUE! | Y56: =(RC[-14]-RC[1])/RC[-18]*100 -> #VALUE! | AC56: =VALUE(RC[-27]) -> #VALUE! | AD56: =IF(RC[21]=42,"*",IF(RC[21]=32,"",RC[21])) ->  | AE56: =RC[-28] ->  | AF56: =RC[-28] -> 0 | AG56: =RC[-28] -> 0 | AH56: =RC[-28] -> 0 | AI56: =RC[-28] -> 0 | AJ56: =RC[-28] -> 0 | AK56: =RC[-28] -> 0 | AL56: =RC[-28] -> 0 | AM56: =RC[-28] -> 0 | AN56: =RC[-28] ->  | AO56: =RC[-28] ->  | AP56: - | AQ56: =RC[-29] ->  | AR56: =RC[-29] ->  | AS56: - | AT56: =RC[-30] -> - | AU56: =RC[-30] ->  | AV56: =RC[-30] ->  | AW56: =RC[-30] -> 
A57: =IF(RC[1]="","",DATEVALUE(RC[1])) ->  | P57: =IF(AND(ISNUMBER(RC[-3]),ISNUMBER(RC[-1])),RC[-3]-RC[-1],"-") -> - | S57: =RC[-1] ->  | T57: =(RC[-16]*RC[-15]-RC[-13]*RC[-12])/1000 -> 0 | W57: =RC[-2]*RC[-10]/1000 -> #VALUE! | X57: =ABS((RC[-3]*RC[-11]-RC[-2]*RC[-9])/1000) -> #VALUE! | Y57: =(RC[-14]-RC[1])/RC[-18]*100 -> #VALUE! | AC57: =VALUE(RC[-27]) -> #VALUE! | AD57: =IF(RC[21]=42,"*",IF(RC[21]=32,"",RC[21])) ->  | AE57: =RC[-28] ->  | AF57: =RC[-28] -> 0 | AG57: =RC[-28] -> 0 | AH57: =RC[-28] -> 0 | AI57: =RC[-28] -> 0 | AJ57: =RC[-28] -> 0 | AK57: =RC[-28] -> 0 | AL57: =RC[-28] -> 0 | AM57: =RC[-28] -> 0 | AN57: =RC[-28] ->  | AO57: =RC[-28] ->  | AP57: - | AQ57: =RC[-29] ->  | AR57: =RC[-29] ->  | AS57: - | AT57: =RC[-30] -> - | AU57: =RC[-30] ->  | AV57: =RC[-30] ->  | AW57: =RC[-30] -> 
A58: =IF(RC[1]="","",DATEVALUE(RC[1])) ->  | P58: =IF(AND(ISNUMBER(RC[-3]),ISNUMBER(RC[-1])),RC[-3]-RC[-1],"-") -> - | S58: =RC[-1] ->  | T58: =(RC[-16]*RC[-15]-RC[-13]*RC[-12])/1000 -> 0 | W58: =RC[-2]*RC[-10]/1000 -> #VALUE! | X58: =ABS((RC[-3]*RC[-11]-RC[-2]*RC[-9])/1000) -> #VALUE! | Y58: =(RC[-14]-RC[1])/RC[-18]*100 -> #VALUE! | AC58: =VALUE(RC[-27]) -> #VALUE! | AD58: =IF(RC[21]=42,"*",IF(RC[21]=32,"",RC[21])) ->  | AE58: =RC[-28] ->  | AF58: =RC[-28] -> 0 | AG58: =RC[-28] -> 0 | AH58: =RC[-28] -> 0 | AI58: =RC[-28] -> 0 | AJ58: =RC[-28] -> 0 | AK58: =RC[-28] -> 0 | AL58: =RC[-28] -> 0 | AM58: =RC[-28] -> 0 | AN58: =RC[-28] ->  | AO58: =RC[-28] ->  | AP58: - | AQ58: =RC[-29] ->  | AR58: =RC[-29] ->  | AS58: - | AT58: =RC[-30] -> - | AU58: =RC[-30] ->  | AV58: =RC[-30] ->  | AW58: =RC[-30] -> 
A59: =IF(RC[1]="","",DATEVALUE(RC[1])) ->  | P59: =IF(AND(ISNUMBER(RC[-3]),ISNUMBER(RC[-1])),RC[-3]-RC[-1],"-") -> - | S59: =RC[-1] ->  | T59: =(RC[-16]*RC[-15]-RC[-13]*RC[-12])/1000 -> 0 | W59: =RC[-2]*RC[-10]/1000 -> #VALUE! | X59: =ABS((RC[-3]*RC[-11]-RC[-2]*RC[-9])/1000) -> #VALUE! | Y59: =(RC[-14]-RC[1])/RC[-18]*100 -> #VALUE! | AC59: =VALUE(RC[-27]) -> #VALUE! | AD59: =IF(RC[21]=42,"*",IF(RC[21]=32,"",RC[21])) ->  | AE59: =RC[-28] ->  | AF59: =RC[-28] -> 0 | AG59: =RC[-28] -> 0 | AH59: =RC[-28] -> 0 | AI59: =RC[-28] -> 0 | AJ59: =RC[-28] -> 0 | AK59: =RC[-28] -> 0 | AL59: =RC[-28] -> 0 | AM59: =RC[-28] -> 0 | AN59: =RC[-28] ->  | AO59: =RC[-28] ->  | AP59: - | AQ59: =RC[-29] ->  | AR59: =RC[-29] ->  | AS59: - | AT59: =RC[-30] -> - | AU59: =RC[-30] ->  | AV59: =RC[-30] ->  | AW59: =RC[-30] -> 
A60: =IF(RC[1]="","",DATEVALUE(RC[1])) ->  | P60: =IF(AND(ISNUMBER(RC[-3]),ISNUMBER(RC[-1])),RC[-3]-RC[-1],"-") -> - | S60: =RC[-1] ->  | T60: =(RC[-16]*RC[-15]-RC[-13]*RC[-12])/1000 -> 0 | W60: =RC[-2]*RC[-10]/1000 -> #VALUE! | X60: =ABS((RC[-3]*RC[-11]-RC[-2]*RC[-9])/1000) -> #VALUE! | Y60: =(RC[-14]-RC[1])/RC[-18]*100 -> #VALUE! | AC60: =VALUE(RC[-27]) -> #VALUE! | AD60: =IF(RC[21]=42,"*",IF(RC[21]=32,"",RC[21])) ->  | AE60: =RC[-28] ->  | AF60: =RC[-28] -> 0 | AG60: =RC[-28] -> 0 | AH60: =RC[-28] -> 0 | AI60: =RC[-28] -> 0 | AJ60: =RC[-28] -> 0 | AK60: =RC[-28] -> 0 | AL60: =RC[-28] -> 0 | AM60: =RC[-28] -> 0 | AN60: =RC[-28] ->  | AO60: =RC[-28] ->  | AP60: - | AQ60: =RC[-29] ->  | AR60: =RC[-29] ->  | AS60: - | AT60: =RC[-30] -> - | AU60: =RC[-30] ->  | AV60: =RC[-30] ->  | AW60: =RC[-30] -> 
A61: =IF(RC[1]="","",DATEVALUE(RC[1])) ->  | P61: =IF(AND(ISNUMBER(RC[-3]),ISNUMBER(RC[-1])),RC[-3]-RC[-1],"-") -> - | S61: =RC[-1] ->  | T61: =(RC[-16]*RC[-15]-RC[-13]*RC[-12])/1000 -> 0 | W61: =RC[-2]*RC[-10]/1000 -> #VALUE! | X61: =ABS((RC[-3]*RC[-11]-RC[-2]*RC[-9])/1000) -> #VALUE! | Y61: =(RC[-14]-RC[1])/RC[-18]*100 -> #VALUE! | AC61: =VALUE(RC[-27]) -> #VALUE! | AD61: =IF(RC[21]=42,"*",IF(RC[21]=32,"",RC[21])) ->  | AE61: =RC[-28] ->  | AF61: =RC[-28] -> 0 | AG61: =RC[-28] -> 0 | AH61: =RC[-28] -> 0 | AI61: =RC[-28] -> 0 | AJ61: =RC[-28] -> 0 | AK61: =RC[-28] -> 0 | AL61: =RC[-28] -> 0 | AM61: =RC[-28] -> 0 | AN61: =RC[-28] ->  | AO61: =RC[-28] ->  | AP61: - | AQ61: =RC[-29] ->  | AR61: =RC[-29] ->  | AS61: - | AT61: =RC[-30] -> - | AU61: =RC[-30] ->  | AV61: =RC[-30] ->  | AW61: =RC[-30] -> 
A62: =IF(RC[1]="","",DATEVALUE(RC[1])) ->  | P62: =IF(AND(ISNUMBER(RC[-3]),ISNUMBER(RC[-1])),RC[-3]-RC[-1],"-") -> - | S62: =RC[-1] ->  | T62: =(RC[-16]*RC[-15]-RC[-13]*RC[-12])/1000 -> 0 | W62: =RC[-2]*RC[-10]/1000 -> #VALUE! | X62: =ABS((RC[-3]*RC[-11]-RC[-2]*RC[-9])/1000) -> #VALUE! | Y62: =(RC[-14]-RC[1])/RC[-18]*100 -> #VALUE! | AC62: =VALUE(RC[-27]) -> #VALUE! | AD62: =IF(RC[21]=42,"*",IF(RC[21]=32,"",RC[21])) ->  | AE62: =RC[-28] ->  | AF62: =RC[-28] -> 0 | AG62: =RC[-28] -> 0 | AH62: =RC[-28] -> 0 | AI62: =RC[-28] -> 0 | AJ62: =RC[-28] -> 0 | AK62: =RC[-28] -> 0 | AL62: =RC[-28] -> 0 | AM62: =RC[-28] -> 0 | AN62: =RC[-28] ->  | AO62: =RC[-28] ->  | AP62: - | AQ62: =RC[-29] ->  | AR62: =RC[-29] ->  | AS62: - | AT62: =RC[-30] -> - | AU62: =RC[-30] ->  | AV62: =RC[-30] ->  | AW62: =RC[-30] -> 
A63: =IF(RC[1]="","",DATEVALUE(RC[1])) ->  | P63: =IF(AND(ISNUMBER(RC[-3]),ISNUMBER(RC[-1])),RC[-3]-RC[-1],"-") -> - | S63: =RC[-1] ->  | T63: =(RC[-16]*RC[-15]-RC[-13]*RC[-12])/1000 -> 0 | W63: =RC[-2]*RC[-10]/1000 -> #VALUE! | X63: =ABS((RC[-3]*RC[-11]-RC[-2]*RC[-9])/1000) -> #VALUE! | Y63: =(RC[-14]-RC[1])/RC[-18]*100 -> #VALUE! | AC63: =VALUE(RC[-27]) -> #VALUE! | AD63: =IF(RC[21]=42,"*",IF(RC[21]=32,"",RC[21])) ->  | AE63: =RC[-28] ->  | AF63: =RC[-28] -> 0 | AG63: =RC[-28] -> 0 | AH63: =RC[-28] -> 0 | AI63: =RC[-28] -> 0 | AJ63: =RC[-28] -> 0 | AK63: =RC[-28] -> 0 | AL63: =RC[-28] -> 0 | AM63: =RC[-28] -> 0 | AN63: =RC[-28] ->  | AO63: =RC[-28] ->  | AP63: - | AQ63: =RC[-29] ->  | AR63: =RC[-29] ->  | AS63: - | AT63: =RC[-30] -> - | AU63: =RC[-30] ->  | AV63: =RC[-30] ->  | AW63: =RC[-30] -> 
A64: =IF(RC[1]="","",DATEVALUE(RC[1])) ->  | P64: =IF(AND(ISNUMBER(RC[-3]),ISNUMBER(RC[-1])),RC[-3]-RC[-1],"-") -> - | S64: =RC[-1] ->  | T64: =(RC[-16]*RC[-15]-RC[-13]*RC[-12])/1000 -> 0 | W64: =RC[-2]*RC[-10]/1000 -> #VALUE! | X64: =ABS((RC[-3]*RC[-11]-RC[-2]*RC[-9])/1000) -> #VALUE! | Y64: =(RC[-14]-RC[1])/RC[-18]*100 -> #VALUE! | AC64: =VALUE(RC[-27]) -> #VALUE! | AD64: =IF(RC[21]=42,"*",IF(RC[21]=32,"",RC[21])) ->  | AE64: =RC[-28] ->  | AF64: =RC[-28] -> 0 | AG64: =RC[-28] -> 0 | AH64: =RC[-28] -> 0 | AI64: =RC[-28] -> 0 | AJ64: =RC[-28] -> 0 | AK64: =RC[-28] -> 0 | AL64: =RC[-28] -> 0 | AM64: =RC[-28] -> 0 | AN64: =RC[-28] ->  | AO64: =RC[-28] ->  | AP64: - | AQ64: =RC[-29] ->  | AR64: =RC[-29] ->  | AS64: - | AT64: =RC[-30] -> - | AU64: =RC[-30] ->  | AV64: =RC[-30] ->  | AW64: =RC[-30] -> 
A65: =IF(RC[1]="","",DATEVALUE(RC[1])) ->  | P65: =IF(AND(ISNUMBER(RC[-3]),ISNUMBER(RC[-1])),RC[-3]-RC[-1],"-") -> - | S65: =RC[-1] ->  | T65: =(RC[-16]*RC[-15]-RC[-13]*RC[-12])/1000 -> 0 | W65: =RC[-2]*RC[-10]/1000 -> #VALUE! | X65: =ABS((RC[-3]*RC[-11]-RC[-2]*RC[-9])/1000) -> #VALUE! | Y65: =(RC[-14]-RC[1])/RC[-18]*100 -> #VALUE! | AC65: =VALUE(RC[-27]) -> #VALUE! | AD65: =IF(RC[21]=42,"*",IF(RC[21]=32,"",RC[21])) ->  | AE65: =RC[-28] ->  | AF65: =RC[-28] -> 0 | AG65: =RC[-28] -> 0 | AH65: =RC[-28] -> 0 | AI65: =RC[-28] -> 0 | AJ65: =RC[-28] -> 0 | AK65: =RC[-28] -> 0 | AL65: =RC[-28] -> 0 | AM65: =RC[-28] -> 0 | AN65: =RC[-28] ->  | AO65: =RC[-28] ->  | AP65: - | AQ65: =RC[-29] ->  | AR65: =RC[-29] ->  | AS65: - | AT65: =RC[-30] -> - | AU65: =RC[-30] ->  | AV65: =RC[-30] ->  | AW65: =RC[-30] -> 
A66: =IF(RC[1]="","",DATEVALUE(RC[1])) ->  | P66: =IF(AND(ISNUMBER(RC[-3]),ISNUMBER(RC[-1])),RC[-3]-RC[-1],"-") -> - | S66: =RC[-1] ->  | T66: =(RC[-16]*RC[-15]-RC[-13]*RC[-12])/1000 -> 0 | W66: =RC[-2]*RC[-10]/1000 -> #VALUE! | X66: =ABS((RC[-3]*RC[-11]-RC[-2]*RC[-9])/1000) -> #VALUE! | Y66: =(RC[-14]-RC[1])/RC[-18]*100 -> #VALUE! | AC66: =VALUE(RC[-27]) -> #VALUE! | AD66: =IF(RC[21]=42,"*",IF(RC[21]=32,"",RC[21])) ->  | AE66: =RC[-28] ->  | AF66: =RC[-28] -> 0 | AG66: =RC[-28] -> 0 | AH66: =RC[-28] -> 0 | AI66: =RC[-28] -> 0 | AJ66: =RC[-28] -> 0 | AK66: =RC[-28] -> 0 | AL66: =RC[-28] -> 0 | AM66: =RC[-28] -> 0 | AN66: =RC[-28] ->  | AO66: =RC[-28] ->  | AP66: - | AQ66: =RC[-29] ->  | AR66: =RC[-29] ->  | AS66: - | AT66: =RC[-30] -> - | AU66: =RC[-30] ->  | AV66: =RC[-30] ->  | AW66: =RC[-30] -> 
A67: =IF(RC[1]="","",DATEVALUE(RC[1])) ->  | P67: =IF(AND(ISNUMBER(RC[-3]),ISNUMBER(RC[-1])),RC[-3]-RC[-1],"-") -> - | S67: =RC[-1] ->  | T67: =(RC[-16]*RC[-15]-RC[-13]*RC[-12])/1000 -> 0 | W67: =RC[-2]*RC[-10]/1000 -> #VALUE! | X67: =ABS((RC[-3]*RC[-11]-RC[-2]*RC[-9])/1000) -> #VALUE! | Y67: =(RC[-14]-RC[1])/RC[-18]*100 -> #VALUE! | AC67: =VALUE(RC[-27]) -> #VALUE! | AD67: =IF(RC[21]=42,"*",IF(RC[21]=32,"",RC[21])) ->  | AE67: =RC[-28] ->  | AF67: =RC[-28] -> 0 | AG67: =RC[-28] -> 0 | AH67: =RC[-28] -> 0 | AI67: =RC[-28] -> 0 | AJ67: =RC[-28] -> 0 | AK67: =RC[-28] -> 0 | AL67: =RC[-28] -> 0 | AM67: =RC[-28] -> 0 | AN67: =RC[-28] ->  | AO67: =RC[-28] ->  | AP67: - | AQ67: =RC[-29] ->  | AR67: =RC[-29] ->  | AS67: - | AT67: =RC[-30] -> - | AU67: =RC[-30] ->  | AV67: =RC[-30] ->  | AW67: =RC[-30] -> 
A68: =IF(RC[1]="","",DATEVALUE(RC[1])) ->  | P68: =IF(AND(ISNUMBER(RC[-3]),ISNUMBER(RC[-1])),RC[-3]-RC[-1],"-") -> - | S68: =RC[-1] ->  | T68: =(RC[-16]*RC[-15]-RC[-13]*RC[-12])/1000 -> 0 | W68: =RC[-2]*RC[-10]/1000 -> #VALUE! | X68: =ABS((RC[-3]*RC[-11]-RC[-2]*RC[-9])/1000) -> #VALUE! | Y68: =(RC[-14]-RC[1])/RC[-18]*100 -> #VALUE! | AC68: =VALUE(RC[-27]) -> #VALUE! | AD68: =IF(RC[21]=42,"*",IF(RC[21]=32,"",RC[21])) ->  | AE68: =RC[-28] ->  | AF68: =RC[-28] -> 0 | AG68: =RC[-28] -> 0 | AH68: =RC[-28] -> 0 | AI68: =RC[-28] -> 0 | AJ68: =RC[-28] -> 0 | AK68: =RC[-28] -> 0 | AL68: =RC[-28] -> 0 | AM68: =RC[-28] -> 0 | AN68: =RC[-28] ->  | AO68: =RC[-28] ->  | AP68: - | AQ68: =RC[-29] ->  | AR68: =RC[-29] ->  | AS68: - | AT68: =RC[-30] -> - | AU68: =RC[-30] ->  | AV68: =RC[-30] ->  | AW68: =RC[-30] -> 
A69: =IF(RC[1]="","",DATEVALUE(RC[1])) ->  | P69: =IF(AND(ISNUMBER(RC[-3]),ISNUMBER(RC[-1])),RC[-3]-RC[-1],"-") -> - | S69: =RC[-1] ->  | T69: =(RC[-16]*RC[-15]-RC[-13]*RC[-12])/1000 -> 0 | W69: =RC[-2]*RC[-10]/1000 -> #VALUE! | X69: =ABS((RC[-3]*RC[-11]-RC[-2]*RC[-9])/1000) -> #VALUE! | Y69: =(RC[-14]-RC[1])/RC[-18]*100 -> #VALUE! | AC69: =VALUE(RC[-27]) -> #VALUE! | AD69: =IF(RC[21]=42,"*",IF(RC[21]=32,"",RC[21])) ->  | AE69: =RC[-28] ->  | AF69: =RC[-28] -> 0 | AG69: =RC[-28] -> 0 | AH69: =RC[-28] -> 0 | AI69: =RC[-28] -> 0 | AJ69: =RC[-28] -> 0 | AK69: =RC[-28] -> 0 | AL69: =RC[-28] -> 0 | AM69: =RC[-28] -> 0 | AN69: =RC[-28] ->  | AO69: =RC[-28] ->  | AP69: - | AQ69: =RC[-29] ->  | AR69: =RC[-29] ->  | AS69: - | AT69: =RC[-30] -> - | AU69: =RC[-30] ->  | AV69: =RC[-30] ->  | AW69: =RC[-30] -> 
A70: =IF(RC[1]="","",DATEVALUE(RC[1])) ->  | P70: =IF(AND(ISNUMBER(RC[-3]),ISNUMBER(RC[-1])),RC[-3]-RC[-1],"-") -> - | S70: =RC[-1] ->  | T70: =(RC[-16]*RC[-15]-RC[-13]*RC[-12])/1000 -> 0 | W70: =RC[-2]*RC[-10]/1000 -> #VALUE! | X70: =ABS((RC[-3]*RC[-11]-RC[-2]*RC[-9])/1000) -> #VALUE! | Y70: =(RC[-14]-RC[1])/RC[-18]*100 -> #VALUE! | AC70: =VALUE(RC[-27]) -> #VALUE! | AD70: =IF(RC[21]=42,"*",IF(RC[21]=32,"",RC[21])) ->  | AE70: =RC[-28] ->  | AF70: =RC[-28] -> 0 | AG70: =RC[-28] -> 0 | AH70: =RC[-28] -> 0 | AI70: =RC[-28] -> 0 | AJ70: =RC[-28] -> 0 | AK70: =RC[-28] -> 0 | AL70: =RC[-28] -> 0 | AM70: =RC[-28] -> 0 | AN70: =RC[-28] ->  | AO70: =RC[-28] ->  | AP70: - | AQ70: =RC[-29] ->  | AR70: =RC[-29] ->  | AS70: - | AT70: =RC[-30] -> - | AU70: =RC[-30] ->  | AV70: =RC[-30] ->  | AW70: =RC[-30] -> 
A71: =IF(RC[1]="","",DATEVALUE(RC[1])) ->  | P71: =IF(AND(ISNUMBER(RC[-3]),ISNUMBER(RC[-1])),RC[-3]-RC[-1],"-") -> - | S71: =RC[-1] ->  | T71: =(RC[-16]*RC[-15]-RC[-13]*RC[-12])/1000 -> 0 | W71: =RC[-2]*RC[-10]/1000 -> #VALUE! | X71: =ABS((RC[-3]*RC[-11]-RC[-2]*RC[-9])/1000) -> #VALUE! | Y71: =(RC[-14]-RC[1])/RC[-18]*100 -> #VALUE! | AC71: =VALUE(RC[-27]) -> #VALUE! | AD71: =IF(RC[21]=42,"*",IF(RC[21]=32,"",RC[21])) ->  | AE71: =RC[-28] ->  | AF71: =RC[-28] -> 0 | AG71: =RC[-28] -> 0 | AH71: =RC[-28] -> 0 | AI71: =RC[-28] -> 0 | AJ71: =RC[-28] -> 0 | AK71: =RC[-28] -> 0 | AL71: =RC[-28] -> 0 | AM71: =RC[-28] -> 0 | AN71: =RC[-28] ->  | AO71: =RC[-28] ->  | AP71: - | AQ71: =RC[-29] ->  | AR71: =RC[-29] ->  | AS71: - | AT71: =RC[-30] -> - | AU71: =RC[-30] ->  | AV71: =RC[-30] ->  | AW71: =RC[-30] -> 
A72: =IF(RC[1]="","",DATEVALUE(RC[1])) ->  | P72: =IF(AND(ISNUMBER(RC[-3]),ISNUMBER(RC[-1])),RC[-3]-RC[-1],"-") -> - | S72: =RC[-1] ->  | T72: =(RC[-16]*RC[-15]-RC[-13]*RC[-12])/1000 -> 0 | W72: =RC[-2]*RC[-10]/1000 -> #VALUE! | X72: =ABS((RC[-3]*RC[-11]-RC[-2]*RC[-9])/1000) -> #VALUE! | Y72: =(RC[-14]-RC[1])/RC[-18]*100 -> #VALUE! | AC72: =VALUE(RC[-27]) -> #VALUE! | AD72: =IF(RC[21]=42,"*",IF(RC[21]=32,"",RC[21])) ->  | AE72: =RC[-28] ->  | AF72: =RC[-28] -> 0 | AG72: =RC[-28] -> 0 | AH72: =RC[-28] -> 0 | AI72: =RC[-28] -> 0 | AJ72: =RC[-28] -> 0 | AK72: =RC[-28] -> 0 | AL72: =RC[-28] -> 0 | AM72: =RC[-28] -> 0 | AN72: =RC[-28] ->  | AO72: =RC[-28] ->  | AP72: - | AQ72: =RC[-29] ->  | AR72: =RC[-29] ->  | AS72: - | AT72: =RC[-30] -> - | AU72: =RC[-30] ->  | AV72: =RC[-30] ->  | AW72: =RC[-30] -> 
A73: =IF(RC[1]="","",DATEVALUE(RC[1])) ->  | P73: =IF(AND(ISNUMBER(RC[-3]),ISNUMBER(RC[-1])),RC[-3]-RC[-1],"-") -> - | S73: =RC[-1] ->  | T73: =(RC[-16]*RC[-15]-RC[-13]*RC[-12])/1000 -> 0 | W73: =RC[-2]*RC[-10]/1000 -> #VALUE! | X73: =ABS((RC[-3]*RC[-11]-RC[-2]*RC[-9])/1000) -> #VALUE! | Y73: =(RC[-14]-RC[1])/RC[-18]*100 -> #VALUE! | AC73: =VALUE(RC[-27]) -> #VALUE! | AD73: =IF(RC[21]=42,"*",IF(RC[21]=32,"",RC[21])) ->  | AE73: =RC[-28] ->  | AF73: =RC[-28] -> 0 | AG73: =RC[-28] -> 0 | AH73: =RC[-28] -> 0 | AI73: =RC[-28] -> 0 | AJ73: =RC[-28] -> 0 | AK73: =RC[-28] -> 0 | AL73: =RC[-28] -> 0 | AM73: =RC[-28] -> 0 | AN73: =RC[-28] ->  | AO73: =RC[-28] ->  | AP73: - | AQ73: =RC[-29] ->  | AR73: =RC[-29] ->  | AS73: - | AT73: =RC[-30] -> - | AU73: =RC[-30] ->  | AV73: =RC[-30] ->  | AW73: =RC[-30] -> 
A74: =IF(RC[1]="","",DATEVALUE(RC[1])) ->  | P74: =IF(AND(ISNUMBER(RC[-3]),ISNUMBER(RC[-1])),RC[-3]-RC[-1],"-") -> - | S74: =RC[-1] ->  | T74: =(RC[-16]*RC[-15]-RC[-13]*RC[-12])/1000 -> 0 | W74: =RC[-2]*RC[-10]/1000 -> #VALUE! | X74: =ABS((RC[-3]*RC[-11]-RC[-2]*RC[-9])/1000) -> #VALUE! | Y74: =(RC[-14]-RC[1])/RC[-18]*100 -> #VALUE! | AC74: =VALUE(RC[-27]) -> #VALUE! | AD74: =IF(RC[21]=42,"*",IF(RC[21]=32,"",RC[21])) ->  | AE74: =RC[-28] ->  | AF74: =RC[-28] -> 0 | AG74: =RC[-28] -> 0 | AH74: =RC[-28] -> 0 | AI74: =RC[-28] -> 0 | AJ74: =RC[-28] -> 0 | AK74: =RC[-28] -> 0 | AL74: =RC[-28] -> 0 | AM74: =RC[-28] -> 0 | AN74: =RC[-28] ->  | AO74: =RC[-28] ->  | AP74: - | AQ74: =RC[-29] ->  | AR74: =RC[-29] ->  | AS74: - | AT74: =RC[-30] -> - | AU74: =RC[-30] ->  | AV74: =RC[-30] ->  | AW74: =RC[-30] -> 
A75: =IF(RC[1]="","",DATEVALUE(RC[1])) ->  | P75: =IF(AND(ISNUMBER(RC[-3]),ISNUMBER(RC[-1])),RC[-3]-RC[-1],"-") -> - | S75: =RC[-1] ->  | T75: =(RC[-16]*RC[-15]-RC[-13]*RC[-12])/1000 -> 0 | W75: =RC[-2]*RC[-10]/1000 -> #VALUE! | X75: =ABS((RC[-3]*RC[-11]-RC[-2]*RC[-9])/1000) -> #VALUE! | Y75: =(RC[-14]-RC[1])/RC[-18]*100 -> #VALUE! | AC75: =VALUE(RC[-27]) -> #VALUE! | AD75: =IF(RC[21]=42,"*",IF(RC[21]=32,"",RC[21])) ->  | AE75: =RC[-28] ->  | AF75: =RC[-28] -> 0 | AG75: =RC[-28] -> 0 | AH75: =RC[-28] -> 0 | AI75: =RC[-28] -> 0 | AJ75: =RC[-28] -> 0 | AK75: =RC[-28] -> 0 | AL75: =RC[-28] -> 0 | AM75: =RC[-28] -> 0 | AN75: =RC[-28] ->  | AO75: =RC[-28] ->  | AP75: - | AQ75: =RC[-29] ->  | AR75: =RC[-29] ->  | AS75: - | AT75: =RC[-30] -> - | AU75: =RC[-30] ->  | AV75: =RC[-30] ->  | AW75: =RC[-30] -> 
A76: =IF(RC[1]="","",DATEVALUE(RC[1])) ->  | P76: =IF(AND(ISNUMBER(RC[-3]),ISNUMBER(RC[-1])),RC[-3]-RC[-1],"-") -> - | S76: =RC[-1] ->  | T76: =(RC[-16]*RC[-15]-RC[-13]*RC[-12])/1000 -> 0 | W76: =RC[-2]*RC[-10]/1000 -> #VALUE! | X76: =ABS((RC[-3]*RC[-11]-RC[-2]*RC[-9])/1000) -> #VALUE! | Y76: =(RC[-14]-RC[1])/RC[-18]*100 -> #VALUE! | AC76: =VALUE(RC[-27]) -> #VALUE! | AD76: =IF(RC[21]=42,"*",IF(RC[21]=32,"",RC[21])) ->  | AE76: =RC[-28] ->  | AF76: =RC[-28] -> 0 | AG76: =RC[-28] -> 0 | AH76: =RC[-28] -> 0 | AI76: =RC[-28] -> 0 | AJ76: =RC[-28] -> 0 | AK76: =RC[-28] -> 0 | AL76: =RC[-28] -> 0 | AM76: =RC[-28] -> 0 | AN76: =RC[-28] ->  | AO76: =RC[-28] ->  | AP76: - | AQ76: =RC[-29] ->  | AR76: =RC[-29] ->  | AS76: - | AT76: =RC[-30] -> - | AU76: =RC[-30] ->  | AV76: =RC[-30] ->  | AW76: =RC[-30] -> 
A77: =IF(RC[1]="","",DATEVALUE(RC[1])) ->  | P77: =IF(AND(ISNUMBER(RC[-3]),ISNUMBER(RC[-1])),RC[-3]-RC[-1],"-") -> - | S77: =RC[-1] ->  | T77: =(RC[-16]*RC[-15]-RC[-13]*RC[-12])/1000 -> 0 | W77: =RC[-2]*RC[-10]/1000 -> #VALUE! | X77: =ABS((RC[-3]*RC[-11]-RC[-2]*RC[-9])/1000) -> #VALUE! | Y77: =(RC[-14]-RC[1])/RC[-18]*100 -> #VALUE! | AC77: =VALUE(RC[-27]) -> #VALUE! | AD77: =IF(RC[21]=42,"*",IF(RC[21]=32,"",RC[21])) ->  | AE77: =RC[-28] ->  | AF77: =RC[-28] -> 0 | AG77: =RC[-28] -> 0 | AH77: =RC[-28] -> 0 | AI77: =RC[-28] -> 0 | AJ77: =RC[-28] -> 0 | AK77: =RC[-28] -> 0 | AL77: =RC[-28] -> 0 | AM77: =RC[-28] -> 0 | AN77: =RC[-28] ->  | AO77: =RC[-28] ->  | AP77: - | AQ77: =RC[-29] ->  | AR77: =RC[-29] ->  | AS77: - | AT77: =RC[-30] -> - | AU77: =RC[-30] ->  | AV77: =RC[-30] ->  | AW77: =RC[-30] -> 
A78: =IF(RC[1]="","",DATEVALUE(RC[1])) ->  | P78: =IF(AND(ISNUMBER(RC[-3]),ISNUMBER(RC[-1])),RC[-3]-RC[-1],"-") -> - | S78: =RC[-1] ->  | T78: =(RC[-16]*RC[-15]-RC[-13]*RC[-12])/1000 -> 0 | W78: =RC[-2]*RC[-10]/1000 -> #VALUE! | X78: =ABS((RC[-3]*RC[-11]-RC[-2]*RC[-9])/1000) -> #VALUE! | Y78: =(RC[-14]-RC[1])/RC[-18]*100 -> #VALUE! | AC78: =VALUE(RC[-27]) -> #VALUE! | AD78: =IF(RC[21]=42,"*",IF(RC[21]=32,"",RC[21])) ->  | AE78: =RC[-28] ->  | AF78: =RC[-28] -> 0 | AG78: =RC[-28] -> 0 | AH78: =RC[-28] -> 0 | AI78: =RC[-28] -> 0 | AJ78: =RC[-28] -> 0 | AK78: =RC[-28] -> 0 | AL78: =RC[-28] -> 0 | AM78: =RC[-28] -> 0 | AN78: =RC[-28] ->  | AO78: =RC[-28] ->  | AP78: - | AQ78: =RC[-29] ->  | AR78: =RC[-29] ->  | AS78: - | AT78: =RC[-30] -> - | AU78: =RC[-30] ->  | AV78: =RC[-30] ->  | AW78: =RC[-30] -> 
A79: =IF(RC[1]="","",DATEVALUE(RC[1])) ->  | P79: =IF(AND(ISNUMBER(RC[-3]),ISNUMBER(RC[-1])),RC[-3]-RC[-1],"-") -> - | S79: =RC[-1] ->  | T79: =(RC[-16]*RC[-15]-RC[-13]*RC[-12])/1000 -> 0 | W79: =RC[-2]*RC[-10]/1000 -> #VALUE! | X79: =ABS((RC[-3]*RC[-11]-RC[-2]*RC[-9])/1000) -> #VALUE! | Y79: =(RC[-14]-RC[1])/RC[-18]*100 -> #VALUE! | AC79: =VALUE(RC[-27]) -> #VALUE! | AD79: =IF(RC[21]=42,"*",IF(RC[21]=32,"",RC[21])) ->  | AE79: =RC[-28] ->  | AF79: =RC[-28] -> 0 | AG79: =RC[-28] -> 0 | AH79: =RC[-28] -> 0 | AI79: =RC[-28] -> 0 | AJ79: =RC[-28] -> 0 | AK79: =RC[-28] -> 0 | AL79: =RC[-28] -> 0 | AM79: =RC[-28] -> 0 | AN79: =RC[-28] ->  | AO79: =RC[-28] ->  | AP79: - | AQ79: =RC[-29] ->  | AR79: =RC[-29] ->  | AS79: - | AT79: =RC[-30] -> - | AU79: =RC[-30] ->  | AV79: =RC[-30] ->  | AW79: =RC[-30] -> 
A80: =IF(RC[1]="","",DATEVALUE(RC[1])) ->  | P80: =IF(AND(ISNUMBER(RC[-3]),ISNUMBER(RC[-1])),RC[-3]-RC[-1],"-") -> - | S80: =RC[-1] ->  | T80: =(RC[-16]*RC[-15]-RC[-13]*RC[-12])/1000 -> 0 | W80: =RC[-2]*RC[-10]/1000 -> #VALUE! | X80: =ABS((RC[-3]*RC[-11]-RC[-2]*RC[-9])/1000) -> #VALUE! | Y80: =(RC[-14]-RC[1])/RC[-18]*100 -> #VALUE! | AC80: =VALUE(RC[-27]) -> #VALUE! | AD80: =IF(RC[21]=42,"*",IF(RC[21]=32,"",RC[21])) ->  | AE80: =RC[-28] ->  | AF80: =RC[-28] -> 0 | AG80: =RC[-28] -> 0 | AH80: =RC[-28] -> 0 | AI80: =RC[-28] -> 0 | AJ80: =RC[-28] -> 0 | AK80: =RC[-28] -> 0 | AL80: =RC[-28] -> 0 | AM80: =RC[-28] -> 0 | AN80: =RC[-28] ->  | AO80: =RC[-28] ->  | AP80: - | AQ80: =RC[-29] ->  | AR80: =RC[-29] ->  | AS80: - | AT80: =RC[-30] -> - | AU80: =RC[-30] ->  | AV80: =RC[-30] ->  | AW80: =RC[-30] -> 
A81: =IF(RC[1]="","",DATEVALUE(RC[1])) ->  | P81: =IF(AND(ISNUMBER(RC[-3]),ISNUMBER(RC[-1])),RC[-3]-RC[-1],"-") -> - | S81: =RC[-1] ->  | T81: =(RC[-16]*RC[-15]-RC[-13]*RC[-12])/1000 -> 0 | W81: =RC[-2]*RC[-10]/1000 -> #VALUE! | X81: =ABS((RC[-3]*RC[-11]-RC[-2]*RC[-9])/1000) -> #VALUE! | Y81: =(RC[-14]-RC[1])/RC[-18]*100 -> #VALUE! | AC81: =VALUE(RC[-27]) -> #VALUE! | AD81: =IF(RC[21]=42,"*",IF(RC[21]=32,"",RC[21])) ->  | AE81: =RC[-28] ->  | AF81: =RC[-28] -> 0 | AG81: =RC[-28] -> 0 | AH81: =RC[-28] -> 0 | AI81: =RC[-28] -> 0 | AJ81: =RC[-28] -> 0 | AK81: =RC[-28] -> 0 | AL81: =RC[-28] -> 0 | AM81: =RC[-28] -> 0 | AN81: =RC[-28] ->  | AO81: =RC[-28] ->  | AP81: - | AQ81: =RC[-29] ->  | AR81: =RC[-29] ->  | AS81: - | AT81: =RC[-30] -> - | AU81: =RC[-30] ->  | AV81: =RC[-30] ->  | AW81: =RC[-30] -> 
A82: =IF(RC[1]="","",DATEVALUE(RC[1])) ->  | P82: =IF(AND(ISNUMBER(RC[-3]),ISNUMBER(RC[-1])),RC[-3]-RC[-1],"-") -> - | S82: =RC[-1] ->  | T82: =(RC[-16]*RC[-15]-RC[-13]*RC[-12])/1000 -> 0 | W82: =RC[-2]*RC[-10]/1000 -> #VALUE! | X82: =ABS((RC[-3]*RC[-11]-RC[-2]*RC[-9])/1000) -> #VALUE! | Y82: =(RC[-14]-RC[1])/RC[-18]*100 -> #VALUE! | AC82: =VALUE(RC[-27]) -> #VALUE! | AD82: =IF(RC[21]=42,"*",IF(RC[21]=32,"",RC[21])) ->  | AE82: =RC[-28] ->  | AF82: =RC[-28] -> 0 | AG82: =RC[-28] -> 0 | AH82: =RC[-28] -> 0 | AI82: =RC[-28] -> 0 | AJ82: =RC[-28] -> 0 | AK82: =RC[-28] -> 0 | AL82: =RC[-28] -> 0 | AM82: =RC[-28] -> 0 | AN82: =RC[-28] ->  | AO82: =RC[-28] ->  | AP82: - | AQ82: =RC[-29] ->  | AR82: =RC[-29] ->  | AS82: - | AT82: =RC[-30] -> - | AU82: =RC[-30] ->  | AV82: =RC[-30] ->  | AW82: =RC[-30] -> 
A83: =IF(RC[1]="","",DATEVALUE(RC[1])) ->  | P83: =IF(AND(ISNUMBER(RC[-3]),ISNUMBER(RC[-1])),RC[-3]-RC[-1],"-") -> - | S83: =RC[-1] ->  | T83: =(RC[-16]*RC[-15]-RC[-13]*RC[-12])/1000 -> 0 | W83: =RC[-2]*RC[-10]/1000 -> #VALUE! | X83: =ABS((RC[-3]*RC[-11]-RC[-2]*RC[-9])/1000) -> #VALUE! | Y83: =(RC[-14]-RC[1])/RC[-18]*100 -> #VALUE! | AC83: =VALUE(RC[-27]) -> #VALUE! | AD83: =IF(RC[21]=42,"*",IF(RC[21]=32,"",RC[21])) ->  | AE83: =RC[-28] ->  | AF83: =RC[-28] -> 0 | AG83: =RC[-28] -> 0 | AH83: =RC[-28] -> 0 | AI83: =RC[-28] -> 0 | AJ83: =RC[-28] -> 0 | AK83: =RC[-28] -> 0 | AL83: =RC[-28] -> 0 | AM83: =RC[-28] -> 0 | AN83: =RC[-28] ->  | AO83: =RC[-28] ->  | AP83: - | AQ83: =RC[-29] ->  | AR83: =RC[-29] ->  | AS83: - | AT83: =RC[-30] -> - | AU83: =RC[-30] ->  | AV83: =RC[-30] ->  | AW83: =RC[-30] -> 
AC84: Среднее | AF84: =R[1]C[-28] -> 0 | AG84: =R[1]C[-28] -> 0 | AH84: =R[1]C[-28] -> 0 | AI84: =R[1]C[-28] -> 0 | AJ84: =R[1]C[-28] -> 0 | AK84: =R[1]C[-28] -> 0 | AL84: =R[1]C[-28] -> 0 | AM84: =R[1]C[-28] -> 0 | AN84: =R[1]C[-28] -> 31.789677419354842 | AO84: =R[1]C[-28] -> 68.019032258064513 | AP84: - | AQ84: =R[1]C[-29] -> 26.272580645161288 | AR84: =R[1]C[-29] -> 53.374838709677412 | AS84: - | AT84: =R[1]C[-30] -> 14.644193548387097 | AU84: =R[1]C[-30] -> 5.5170967741935488
B85: Среднее | L85: =IF(SUM(OFFSET(R[-74]C,3,0,R7C1,1))=0,"",AVERAGE(OFFSET(R[-74]C,3,0,R7C1,1))) -> 31.789677419354842 | M85: =IF(SUM(OFFSET(R[-74]C,3,0,R7C1,1))=0,"",AVERAGE(OFFSET(R[-74]C,3,0,R7C1,1))) -> 68.019032258064513 | N85: =IF(SUM(OFFSET(R[-74]C,3,0,R7C1,1))=0,"",AVERAGE(OFFSET(R[-74]C,3,0,R7C1,1))) -> 26.272580645161288 | O85: =IF(SUM(OFFSET(R[-74]C,3,0,R7C1,1))=0,"",AVERAGE(OFFSET(R[-74]C,3,0,R7C1,1))) -> 53.374838709677412 | P85: =IF(SUM(OFFSET(R[-74]C,3,0,R7C1,1))=0,"",AVERAGE(OFFSET(R[-74]C,3,0,R7C1,1))) -> 14.644193548387097 | Q85: =IF(SUM(OFFSET(R[-74]C,3,0,R7C1,1))=0,"",AVERAGE(OFFSET(R[-74]C,3,0,R7C1,1))) -> 5.5170967741935488 | R85: =IF(SUM(OFFSET(R[-74]C,3,0,R7C1,1))=0,"",AVERAGE(OFFSET(R[-74]C,3,0,R7C1,1))) -> 0.77200000000000013 | S85: =AVERAGE(OFFSET(R[-74]C,3,0,R7C1,1)) -> 0.77200000000000013 | T85: =AVERAGE(OFFSET(R[-74]C,3,0,R7C1,1)) -> 0 | W85: =AVERAGE(OFFSET(R[-74]C,3,0,R7C1,1)) -> #VALUE! | X85: =AVERAGE(OFFSET(R[-74]C,3,0,R7C1,1)) -> #VALUE! | AC85: Итого | AE85: =R[1]C[-28] -> 744 | AF85: =R[1]C[-28] -> 0 | AI85: =R[1]C[-28] -> 0 | AM85: =R[1]C[-28] -> 0 | AN85: =R[1]C[-28] -> 985.48000000000013 | AQ85: =R[1]C[-29] -> 814.44999999999993 | AU85: =R[1]C[-30] -> 171.03 | AV85: =R[1]C[-30] -> 23.932000000000006 | AW85: =R[1]C[-30] -> 23.932000000000006
B86: ИТОГО: | C86: =SUM(OFFSET(R[-75]C,3,0,R7C1,1)) -> 744 | L86: =IF(SUM(OFFSET(R[-75]C,3,0,R7C1,1))=0,"",SUM(OFFSET(R[-75]C,3,0,R7C1,1))) -> 985.48000000000013 | N86: =IF(SUM(OFFSET(R[-75]C,3,0,R7C1,1))=0,"",SUM(OFFSET(R[-75]C,3,0,R7C1,1))) -> 814.44999999999993 | Q86: =IF(SUM(OFFSET(R[-75]C,3,0,R7C1,1))=0,"",SUM(OFFSET(R[-75]C,3,0,R7C1,1))) -> 171.03 | R86: =IF(SUM(OFFSET(R[-75]C,3,0,R7C1,1))=0,"",SUM(OFFSET(R[-75]C,3,0,R7C1,1))) -> 23.932000000000006 | S86: =SUM(OFFSET(R[-75]C,3,0,R7C1,1)) -> 23.932000000000006 | T86: =SUM(OFFSET(R[-75]C,3,0,R7C1,1)) -> 0 | W86: =SUM(OFFSET(R[-75]C,3,0,R7C1,1)) -> #VALUE! | X86: =SUM(OFFSET(R[-75]C,3,0,R7C1,1)) -> #VALUE!
AC87: Досчёт | AF87: =R[1]C[-28] -> 0 | AI87: =R[1]C[-28] -> 0 | AM87: =R[1]C[-28] -> 0 | AN87: =R[1]C[-28] -> 0 | AQ87: =R[1]C[-29] -> 0 | AU87: =R[1]C[-30] -> 0 | AV87: =R[1]C[-30] -> 0 | AW87: =R[1]C[-30] -> 0
A88: 11дн=264ч 4дн=96ч | B88: Досчёт до конца м-ца (+) | C88: =R6C1*24 -> 192 | L88: 0 | N88: 0 | R88: 0 | S88: 0 | T88: № 21183 | AC88: Снятие | AF88: =-R[1]C[-28] -> 0 | AI88: =-R[1]C[-28] -> 0 | AM88: =-R[1]C[-28] -> 0 | AN88: =-R[1]C[-28] -> 0 | AQ88: =-R[1]C[-29] -> 0 | AU88: =-R[1]C[-30] -> 0 | AV88: =-R[1]C[-30] -> 0 | AW88: =-R[1]C[-30] -> 0
A89: 9дн=216ч 7дн=168ч | B89: Вычет с предыдущего (-) | C89: =R4C1*24 -> 216 | AC89: Сумма | AF89: =R[1]C[-28] -> 0 | AI89: =R[1]C[-28] -> 0 | AM89: =R[1]C[-28] -> 0 | AN89: =R[1]C[-28] -> 985.48000000000013 | AQ89: =R[1]C[-29] -> 814.44999999999993 | AU89: =R[1]C[-30] -> 171.03 | AV89: =R[1]C[-30] -> 23.932000000000006 | AW89: =R[1]C[-30] -> 23.932000000000006
B90: СУММА: | C90: =R[-4]C+R[-2]C-R[-1]C -> 720 | L90: =IF(SUM(OFFSET(R[-79]C,3,0,R7C1,1))=0,"",(R[-4]C+R[-2]C-R[-1]C)) -> 985.48000000000013 | N90: =IF(SUM(OFFSET(R[-79]C,3,0,R7C1,1))=0,"",(R[-4]C+R[-2]C-R[-1]C)) -> 814.44999999999993 | Q90: =IF(SUM(OFFSET(R[-79]C,3,0,R7C1,1))=0,"",(R[-4]C+R[-2]C-R[-1]C)) -> 171.03 | R90: =IF(SUM(OFFSET(R[-79]C,3,0,R7C1,1))=0,"",(R[-4]C+R[-2]C-R[-1]C)) -> 23.932000000000006 | S90: =R[-4]C+R[-2]C-R[-1]C -> 23.932000000000006
AC91: Тхв на источнике | AE91: V гвс (м3) | AF91: =R[-2]C[15] -> 171.03 | AG91: W гвс (Гкал) | AH91: =RC[-2]*0.06 -> 10.261799999999999 | AI91: W без гвс (Гкал) | AJ91: =R[-2]C[13]-RC[-2] -> 13.670200000000007
B92: Показания счетчиков на момент снятия данных:
B93: Дата, время | D93: М1, т | F93: М2, т | H93: М3, т | J93: М4, т | L93: Qо, Гкал | N93: Qг, Гкал | P93: время, час
B94: 24.08.18 01:00 | D94: 67846.62 | F94: 63869.15 | H94: 35322.03 | J94: 32067.919999999998 | L94: 1545.298 | N94: 606.76700000000005 | P94: -
B95: 19.09.18 06:00 | D95: 69359.94 | F95: 65229.17 | H95: 36204.03 | J95: 32797.11 | L95: 1567.5450000000001 | N95: 629.11900000000003 | P95: -
AC97: =ZAYAVKA_N -> з. на доп.№ 02/147-2548 от 5.10.2017
B98: Представитель потребителя:_______________________________________________________________________ В.О. Топорков
I101: Рекомендуемые значения по параметрам теплопотребления (не являются официально утверждёнными)
I102: М, т | J102: V, м3 | K102: Qгвс, Гкал | L102: Qотоп, Гкал | M102: Qо, Гкал
I103: =R[-13]C[-3] -> 0 | J103: =RC[-1]/0.98 -> 0 | K103: =RC[-1]*0.06 -> 0 | L103: =RC[1]-RC[-1] -> 23.932000000000006 | M103: =R[-13]C[5] -> 23.932000000000006
O105: ДЛЯ САМОКОНТРОЛЯ
B106: В строке выбора дат указать период с 16.7.13 по 23.8.13 - жильё | N106: Q | O106: Qг
B107: В строке выбора дат указать период с 18.7.13 по 25.8.13 - не жилое | N107: =(R[-21]C[-10]*R[-22]C[-7]-R[-21]C[-9]*R[-22]C[-6])/1000 -> 0 | O107: =IF(R[-22]C[-2]="",R[-21]C[-3]*R[-22]C/1000,"") ->  | P107: Си2
O108: =IF(R[-23]C[-2]="","",((R[-22]C[-3]*R[-23]C)-(R[-22]C[-2]*R[-23]C[2]))/1000) -> 52.599836051612904 | P108: Си3