Sheet: Лист1
G1: Отчёт о теплопотреблении за сентябрь 2018 | M1: Письмо
A4: =EOMONTH(R[9]C,0)-R[9]C -> 9 | B4: Потребитель: ЗАО "Сити Сервис"
A5: =MAX(R[9]C:R[78]C) -> 2018-09-22T00:00:00.000 | B5: Адрес: г. СПб, Кораблестроителей ул., д.36 к.1 ИТП 4
A6: =EOMONTH(R[-1]C,0)-R[-1]C -> 8 | B6: Телефон: 8-911-021-19-79
A7: =R[-2]C-R[6]C -> 31 | B7: Договор 10023 (.) 85571
A8: 7 | B8: Тепловычислитель: ВКТ-7 № 49517 | L8: М2 мах= | M8: 180.24 | O8: Мгвс мах= | P8: 372.24
L9: Qотоп мах= | M9: 13.512 | O9: Qгвс мах= | P9: 23.52
B10: Расчётная формула: Q=M1*(h1-hхв)-M2*(h2-hхв)
D12: Учёт - ОТОПЛЕНИЕ | M12: Учёт - ГВС
A13: =R[1]C-1 -> 43334 | B13: Дата | C13: N, ч | D13: M1, т | E13: T1, С | F13: P1, кг/см2 | G13: M2, т | H13: T2, С | I13: P2, кг/см2 | J13: dT, гр.C | K13: M1-М2, т | L13: Qотоп, Гкал | M13: V3, м3 | N13: T3, С | O13: V4, м3 | P13: T4, С | Q13: dT, гр.C | R13: V3-V4, м3 | S13: Qгвс, Гкал | T13: Qобщ. | U13: Qo | V13: M3 | W13: M4 | X13: си4 | Y13: си5 | Z13: ТСО | AA13: Внутр. | AD13: Дата | AE13: НС | AF13: n, ч | AG13: М1, т | AH13: t1, гр. С | AI13: Р1, кгс/см2 | AJ13: М2, т | AK13: t2, гр. С | AL13: Р2, кгс/см2 | AM13: t1-t2, гр. С | AN13: М1-М2, т | AO13: Wотоп, Гкал | AP13: М1гвс, т | AQ13: t1гвс, гр. С | AR13: Р1гвс, кгс/см2 | AS13: М2гвс, т | AT13: t2гвс, гр. С | AU13: Р2гвс, кгс/см2 | AV13: t1гвс-t2гвс | AW13: М1гвс-М2гвс, т | AX13: Wгвс, Гкал | AY13: Wсумм, Гкал | BA13: NS_TV1 | BB13: НС | BC13: NS_TV2
A14: =IF(RC[1]="","",DATEVALUE(RC[1])) -> 43335 | B14: 23.08.18 | C14: 24 | M14: 247.69 | N14: 67.44 | O14: 176.53 | P14: 54.81 | Q14: =RC[-3]-RC[-1] -> 12.629999999999995 | R14: 71.16 | S14: 6.827 | T14: =RC[-1] -> 6.827 | U14: =(RC[-17]*RC[-16]-RC[-14]*RC[-13])/1000 -> 0 | V14: 242.61 | W14: 174.06 | X14: =RC[-2]*RC[-10]/1000 -> 16.361618400000001 | Y14: =(RC[-3]*RC[-11]-RC[-2]*RC[-9])/1000 -> 6.8213898000000004 | Z14: 2013-11-23T00:00:00.000 | AA14: 2013-11-21T00:00:00.000 | AD14: =VALUE(RC[-28]) -> 2018-08-23T00:00:00.000 | AE14: =IF(RC[22]=42,"*",IF(RC[22]=32,"",RC[22])) -> - | AF14: =RC[-29] -> 24 | AG14: =RC[-29] -> 0 | AH14: =RC[-29] -> 0 | AI14: =RC[-29] -> 0 | AJ14: =RC[-29] -> 0 | AK14: =RC[-29] -> 0 | AL14: =RC[-29] -> 0 | AM14: =RC[-29] -> 0 | AN14: =RC[-29] -> 0 | AO14: =RC[-29] -> 0 | AP14: =RC[-29] -> 247.69 | AQ14: =RC[-29] -> 67.44 | AR14: - | AS14: =RC[-30] -> 176.53 | AT14: =RC[-30] -> 54.81 | AU14: - | AV14: =RC[-31] -> 12.629999999999995 | AW14: =RC[-31] -> 71.16 | AX14: =RC[-31] -> 6.827 | AY14: =RC[-31] -> 6.827 | BA14: - | BB14: - | BC14: -
A15: =IF(RC[1]="","",DATEVALUE(RC[1])) -> 43336 | B15: 24.08.18 | C15: 24 | M15: 248.45 | N15: 68.36 | O15: 177.34 | P15: 55.36 | Q15: =RC[-3]-RC[-1] -> 13 | R15: 71.11 | S15: 6.9560000000000004 | T15: =RC[-1] -> 6.9560000000000004 | U15: =(RC[-17]*RC[-16]-RC[-14]*RC[-13])/1000 -> 0 | V15: 243.23 | W15: 174.84 | X15: =RC[-2]*RC[-10]/1000 -> 16.627202799999999 | Y15: =(RC[-3]*RC[-11]-RC[-2]*RC[-9])/1000 -> 6.9480603999999984 | Z15: 2013-11-24T00:00:00.000 | AA15: 2013-11-22T00:00:00.000 | AD15: =VALUE(RC[-28]) -> 2018-08-24T00:00:00.000 | AE15: =IF(RC[22]=42,"*",IF(RC[22]=32,"",RC[22])) -> - | AF15: =RC[-29] -> 24 | AG15: =RC[-29] -> 0 | AH15: =RC[-29] -> 0 | AI15: =RC[-29] -> 0 | AJ15: =RC[-29] -> 0 | AK15: =RC[-29] -> 0 | AL15: =RC[-29] -> 0 | AM15: =RC[-29] -> 0 | AN15: =RC[-29] -> 0 | AO15: =RC[-29] -> 0 | AP15: =RC[-29] -> 248.45 | AQ15: =RC[-29] -> 68.36 | AR15: - | AS15: =RC[-30] -> 177.34 | AT15: =RC[-30] -> 55.36 | AU15: - | AV15: =RC[-31] -> 13 | AW15: =RC[-31] -> 71.11 | AX15: =RC[-31] -> 6.9560000000000004 | AY15: =RC[-31] -> 6.9560000000000004 | BA15: - | BB15: - | BC15: -
A16: =IF(RC[1]="","",DATEVALUE(RC[1])) -> 43337 | B16: 25.08.18 | C16: 24 | M16: 259.62 | N16: 67.84 | O16: 191.5 | P16: 55.63 | Q16: =RC[-3]-RC[-1] -> 12.21 | R16: 68.12 | S16: 6.7539999999999996 | T16: =RC[-1] -> 6.7539999999999996 | U16: =(RC[-17]*RC[-16]-RC[-14]*RC[-13])/1000 -> 0 | V16: 254.27 | W16: 188.75 | X16: =RC[-2]*RC[-10]/1000 -> 17.2496768 | Y16: =(RC[-3]*RC[-11]-RC[-2]*RC[-9])/1000 -> 6.7495143000000004 | Z16: 2013-11-25T00:00:00.000 | AA16: 2013-11-23T00:00:00.000 | AD16: =VALUE(RC[-28]) -> 2018-08-25T00:00:00.000 | AE16: =IF(RC[22]=42,"*",IF(RC[22]=32,"",RC[22])) -> - | AF16: =RC[-29] -> 24 | AG16: =RC[-29] -> 0 | AH16: =RC[-29] -> 0 | AI16: =RC[-29] -> 0 | AJ16: =RC[-29] -> 0 | AK16: =RC[-29] -> 0 | AL16: =RC[-29] -> 0 | AM16: =RC[-29] -> 0 | AN16: =RC[-29] -> 0 | AO16: =RC[-29] -> 0 | AP16: =RC[-29] -> 259.62 | AQ16: =RC[-29] -> 67.84 | AR16: - | AS16: =RC[-30] -> 191.5 | AT16: =RC[-30] -> 55.63 | AU16: - | AV16: =RC[-31] -> 12.21 | AW16: =RC[-31] -> 68.12 | AX16: =RC[-31] -> 6.7539999999999996 | AY16: =RC[-31] -> 6.7539999999999996 | BA16: - | BB16: - | BC16: -
A17: =IF(RC[1]="","",DATEVALUE(RC[1])) -> 43338 | B17: 26.08.18 | C17: 24 | M17: 268.69 | N17: 68.099999999999994 | O17: 192.7 | P17: 55.66 | Q17: =RC[-3]-RC[-1] -> 12.439999999999998 | R17: 75.989999999999995 | S17: 7.3529999999999998 | T17: =RC[-1] -> 7.3529999999999998 | U17: =(RC[-17]*RC[-16]-RC[-14]*RC[-13])/1000 -> 0 | V17: 263.10000000000002 | W17: 189.89 | X17: =RC[-2]*RC[-10]/1000 -> 17.917110000000001 | Y17: =(RC[-3]*RC[-11]-RC[-2]*RC[-9])/1000 -> 7.3478326000000012 | Z17: 2013-11-26T00:00:00.000 | AA17: 2013-11-24T00:00:00.000 | AD17: =VALUE(RC[-28]) -> 2018-08-26T00:00:00.000 | AE17: =IF(RC[22]=42,"*",IF(RC[22]=32,"",RC[22])) -> - | AF17: =RC[-29] -> 24 | AG17: =RC[-29] -> 0 | AH17: =RC[-29] -> 0 | AI17: =RC[-29] -> 0 | AJ17: =RC[-29] -> 0 | AK17: =RC[-29] -> 0 | AL17: =RC[-29] -> 0 | AM17: =RC[-29] -> 0 | AN17: =RC[-29] -> 0 | AO17: =RC[-29] -> 0 | AP17: =RC[-29] -> 268.69 | AQ17: =RC[-29] -> 68.099999999999994 | AR17: - | AS17: =RC[-30] -> 192.7 | AT17: =RC[-30] -> 55.66 | AU17: - | AV17: =RC[-31] -> 12.439999999999998 | AW17: =RC[-31] -> 75.989999999999995 | AX17: =RC[-31] -> 7.3529999999999998 | AY17: =RC[-31] -> 7.3529999999999998 | BA17: - | BB17: - | BC17: -
A18: =IF(RC[1]="","",DATEVALUE(RC[1])) -> 43339 | B18: 27.08.18 | C18: 24 | M18: 273.01 | N18: 68.180000000000007 | O18: 192.74 | P18: 55.48 | Q18: =RC[-3]-RC[-1] -> 12.70000000000001 | R18: 80.27 | S18: 7.6920000000000002 | T18: =RC[-1] -> 7.6920000000000002 | U18: =(RC[-17]*RC[-16]-RC[-14]*RC[-13])/1000 -> 0 | V18: 267.31 | W18: 189.95 | X18: =RC[-2]*RC[-10]/1000 -> 18.225195800000002 | Y18: =(RC[-3]*RC[-11]-RC[-2]*RC[-9])/1000 -> 7.6867698000000022 | Z18: 2013-11-27T00:00:00.000 | AA18: 2013-11-25T00:00:00.000 | AD18: =VALUE(RC[-28]) -> 2018-08-27T00:00:00.000 | AE18: =IF(RC[22]=42,"*",IF(RC[22]=32,"",RC[22])) -> - | AF18: =RC[-29] -> 24 | AG18: =RC[-29] -> 0 | AH18: =RC[-29] -> 0 | AI18: =RC[-29] -> 0 | AJ18: =RC[-29] -> 0 | AK18: =RC[-29] -> 0 | AL18: =RC[-29] -> 0 | AM18: =RC[-29] -> 0 | AN18: =RC[-29] -> 0 | AO18: =RC[-29] -> 0 | AP18: =RC[-29] -> 273.01 | AQ18: =RC[-29] -> 68.180000000000007 | AR18: - | AS18: =RC[-30] -> 192.74 | AT18: =RC[-30] -> 55.48 | AU18: - | AV18: =RC[-31] -> 12.70000000000001 | AW18: =RC[-31] -> 80.27 | AX18: =RC[-31] -> 7.6920000000000002 | AY18: =RC[-31] -> 7.6920000000000002 | BA18: - | BB18: - | BC18: -
A19: =IF(RC[1]="","",DATEVALUE(RC[1])) -> 43340 | B19: 28.08.18 | C19: 24 | M19: 267.41000000000003 | N19: 68.16 | O19: 191.75 | P19: 55.11 | Q19: =RC[-3]-RC[-1] -> 13.049999999999997 | R19: 75.66 | S19: 7.4340000000000002 | T19: =RC[-1] -> 7.4340000000000002 | U19: =(RC[-17]*RC[-16]-RC[-14]*RC[-13])/1000 -> 0 | V19: 261.83999999999997 | W19: 189.04 | X19: =RC[-2]*RC[-10]/1000 -> 17.847014399999996 | Y19: =(RC[-3]*RC[-11]-RC[-2]*RC[-9])/1000 -> 7.4290199999999968 | Z19: 2013-11-28T00:00:00.000 | AA19: 2013-11-26T00:00:00.000 | AD19: =VALUE(RC[-28]) -> 2018-08-28T00:00:00.000 | AE19: =IF(RC[22]=42,"*",IF(RC[22]=32,"",RC[22])) -> - | AF19: =RC[-29] -> 24 | AG19: =RC[-29] -> 0 | AH19: =RC[-29] -> 0 | AI19: =RC[-29] -> 0 | AJ19: =RC[-29] -> 0 | AK19: =RC[-29] -> 0 | AL19: =RC[-29] -> 0 | AM19: =RC[-29] -> 0 | AN19: =RC[-29] -> 0 | AO19: =RC[-29] -> 0 | AP19: =RC[-29] -> 267.41000000000003 | AQ19: =RC[-29] -> 68.16 | AR19: - | AS19: =RC[-30] -> 191.75 | AT19: =RC[-30] -> 55.11 | AU19: - | AV19: =RC[-31] -> 13.049999999999997 | AW19: =RC[-31] -> 75.66 | AX19: =RC[-31] -> 7.4340000000000002 | AY19: =RC[-31] -> 7.4340000000000002 | BA19: - | BB19: - | BC19: -
A20: =IF(RC[1]="","",DATEVALUE(RC[1])) -> 43341 | B20: 29.08.18 | C20: 24 | M20: 272.36 | N20: 67.010000000000005 | O20: 189.59 | P20: 54.4 | Q20: =RC[-3]-RC[-1] -> 12.610000000000007 | R20: 82.77 | S20: 7.7160000000000002 | T20: =RC[-1] -> 7.7160000000000002 | U20: =(RC[-17]*RC[-16]-RC[-14]*RC[-13])/1000 -> 0 | V20: 266.83 | W20: 186.95 | X20: =RC[-2]*RC[-10]/1000 -> 17.880278300000001 | Y20: =(RC[-3]*RC[-11]-RC[-2]*RC[-9])/1000 -> 7.7101983000000018 | Z20: 2013-11-29T00:00:00.000 | AA20: 2013-11-27T00:00:00.000 | AD20: =VALUE(RC[-28]) -> 2018-08-29T00:00:00.000 | AE20: =IF(RC[22]=42,"*",IF(RC[22]=32,"",RC[22])) -> - | AF20: =RC[-29] -> 24 | AG20: =RC[-29] -> 0 | AH20: =RC[-29] -> 0 | AI20: =RC[-29] -> 0 | AJ20: =RC[-29] -> 0 | AK20: =RC[-29] -> 0 | AL20: =RC[-29] -> 0 | AM20: =RC[-29] -> 0 | AN20: =RC[-29] -> 0 | AO20: =RC[-29] -> 0 | AP20: =RC[-29] -> 272.36 | AQ20: =RC[-29] -> 67.010000000000005 | AR20: - | AS20: =RC[-30] -> 189.59 | AT20: =RC[-30] -> 54.4 | AU20: - | AV20: =RC[-31] -> 12.610000000000007 | AW20: =RC[-31] -> 82.77 | AX20: =RC[-31] -> 7.7160000000000002 | AY20: =RC[-31] -> 7.7160000000000002 | BA20: - | BB20: - | BC20: -
A21: =IF(RC[1]="","",DATEVALUE(RC[1])) -> 43342 | B21: 30.08.18 | C21: 24 | M21: 266.36 | N21: 65.650000000000006 | O21: 189.39 | P21: 53.24 | Q21: =RC[-3]-RC[-1] -> 12.410000000000004 | R21: 76.97 | S21: 7.1980000000000004 | T21: =RC[-1] -> 7.1980000000000004 | U21: =(RC[-17]*RC[-16]-RC[-14]*RC[-13])/1000 -> 0 | V21: 261.16000000000003 | W21: 186.9 | X21: =RC[-2]*RC[-10]/1000 -> 17.145154000000002 | Y21: =(RC[-3]*RC[-11]-RC[-2]*RC[-9])/1000 -> 7.1945980000000018 | Z21: 2013-11-30T00:00:00.000 | AA21: 2013-11-28T00:00:00.000 | AD21: =VALUE(RC[-28]) -> 2018-08-30T00:00:00.000 | AE21: =IF(RC[22]=42,"*",IF(RC[22]=32,"",RC[22])) -> - | AF21: =RC[-29] -> 24 | AG21: =RC[-29] -> 0 | AH21: =RC[-29] -> 0 | AI21: =RC[-29] -> 0 | AJ21: =RC[-29] -> 0 | AK21: =RC[-29] -> 0 | AL21: =RC[-29] -> 0 | AM21: =RC[-29] -> 0 | AN21: =RC[-29] -> 0 | AO21: =RC[-29] -> 0 | AP21: =RC[-29] -> 266.36 | AQ21: =RC[-29] -> 65.650000000000006 | AR21: - | AS21: =RC[-30] -> 189.39 | AT21: =RC[-30] -> 53.24 | AU21: - | AV21: =RC[-31] -> 12.410000000000004 | AW21: =RC[-31] -> 76.97 | AX21: =RC[-31] -> 7.1980000000000004 | AY21: =RC[-31] -> 7.1980000000000004 | BA21: - | BB21: - | BC21: -
A22: =IF(RC[1]="","",DATEVALUE(RC[1])) -> 43343 | B22: 31.08.18 | C22: 24 | M22: 266.35000000000002 | N22: 67.06 | O22: 184.66 | P22: 53.89 | Q22: =RC[-3]-RC[-1] -> 13.170000000000002 | R22: 81.69 | S22: 7.6859999999999999 | T22: =RC[-1] -> 7.6859999999999999 | U22: =(RC[-17]*RC[-16]-RC[-14]*RC[-13])/1000 -> 0 | V22: 260.95999999999998 | W22: 182.14 | X22: =RC[-2]*RC[-10]/1000 -> 17.499977599999998 | Y22: =(RC[-3]*RC[-11]-RC[-2]*RC[-9])/1000 -> 7.6844529999999995 | Z22: 2013-12-01T00:00:00.000 | AA22: 2013-11-29T00:00:00.000 | AD22: =VALUE(RC[-28]) -> 2018-08-31T00:00:00.000 | AE22: =IF(RC[22]=42,"*",IF(RC[22]=32,"",RC[22])) -> - | AF22: =RC[-29] -> 24 | AG22: =RC[-29] -> 0 | AH22: =RC[-29] -> 0 | AI22: =RC[-29] -> 0 | AJ22: =RC[-29] -> 0 | AK22: =RC[-29] -> 0 | AL22: =RC[-29] -> 0 | AM22: =RC[-29] -> 0 | AN22: =RC[-29] -> 0 | AO22: =RC[-29] -> 0 | AP22: =RC[-29] -> 266.35000000000002 | AQ22: =RC[-29] -> 67.06 | AR22: - | AS22: =RC[-30] -> 184.66 | AT22: =RC[-30] -> 53.89 | AU22: - | AV22: =RC[-31] -> 13.170000000000002 | AW22: =RC[-31] -> 81.69 | AX22: =RC[-31] -> 7.6859999999999999 | AY22: =RC[-31] -> 7.6859999999999999 | BA22: - | BB22: - | BC22: -
A23: =IF(RC[1]="","",DATEVALUE(RC[1])) -> 43344 | B23: 01.09.18 | C23: 24 | M23: 258.22000000000003 | N23: 68.14 | O23: 181.91 | P23: 54.35 | Q23: =RC[-3]-RC[-1] -> 13.79 | R23: 76.31 | S23: 7.4850000000000003 | T23: =RC[-1] -> 7.4850000000000003 | U23: =(RC[-17]*RC[-16]-RC[-14]*RC[-13])/1000 -> 0 | V23: 252.83 | W23: 179.36 | X23: =RC[-2]*RC[-10]/1000 -> 17.227836200000002 | Y23: =(RC[-3]*RC[-11]-RC[-2]*RC[-9])/1000 -> 7.4796202000000012 | Z23: 2013-12-02T00:00:00.000 | AA23: 2013-11-30T00:00:00.000 | AD23: =VALUE(RC[-28]) -> 2018-09-01T00:00:00.000 | AE23: =IF(RC[22]=42,"*",IF(RC[22]=32,"",RC[22])) -> - | AF23: =RC[-29] -> 24 | AG23: =RC[-29] -> 0 | AH23: =RC[-29] -> 0 | AI23: =RC[-29] -> 0 | AJ23: =RC[-29] -> 0 | AK23: =RC[-29] -> 0 | AL23: =RC[-29] -> 0 | AM23: =RC[-29] -> 0 | AN23: =RC[-29] -> 0 | AO23: =RC[-29] -> 0 | AP23: =RC[-29] -> 258.22000000000003 | AQ23: =RC[-29] -> 68.14 | AR23: - | AS23: =RC[-30] -> 181.91 | AT23: =RC[-30] -> 54.35 | AU23: - | AV23: =RC[-31] -> 13.79 | AW23: =RC[-31] -> 76.31 | AX23: =RC[-31] -> 7.4850000000000003 | AY23: =RC[-31] -> 7.4850000000000003 | BA23: - | BB23: - | BC23: -
A24: =IF(RC[1]="","",DATEVALUE(RC[1])) -> 43345 | B24: 02.09.18 | C24: 24 | M24: 261.32 | N24: 68.430000000000007 | O24: 181.56 | P24: 54.63 | Q24: =RC[-3]-RC[-1] -> 13.800000000000004 | R24: 79.760000000000005 | S24: 7.7329999999999997 | T24: =RC[-1] -> 7.7329999999999997 | U24: =(RC[-17]*RC[-16]-RC[-14]*RC[-13])/1000 -> 0 | V24: 255.83 | W24: 179 | X24: =RC[-2]*RC[-10]/1000 -> 17.506446900000004 | Y24: =(RC[-3]*RC[-11]-RC[-2]*RC[-9])/1000 -> 7.7276769000000023 | Z24: 2013-12-03T00:00:00.000 | AA24: 2013-12-01T00:00:00.000 | AD24: =VALUE(RC[-28]) -> 2018-09-02T00:00:00.000 | AE24: =IF(RC[22]=42,"*",IF(RC[22]=32,"",RC[22])) -> - | AF24: =RC[-29] -> 24 | AG24: =RC[-29] -> 0 | AH24: =RC[-29] -> 0 | AI24: =RC[-29] -> 0 | AJ24: =RC[-29] -> 0 | AK24: =RC[-29] -> 0 | AL24: =RC[-29] -> 0 | AM24: =RC[-29] -> 0 | AN24: =RC[-29] -> 0 | AO24: =RC[-29] -> 0 | AP24: =RC[-29] -> 261.32 | AQ24: =RC[-29] -> 68.430000000000007 | AR24: - | AS24: =RC[-30] -> 181.56 | AT24: =RC[-30] -> 54.63 | AU24: - | AV24: =RC[-31] -> 13.800000000000004 | AW24: =RC[-31] -> 79.760000000000005 | AX24: =RC[-31] -> 7.7329999999999997 | AY24: =RC[-31] -> 7.7329999999999997 | BA24: - | BB24: - | BC24: -
A25: =IF(RC[1]="","",DATEVALUE(RC[1])) -> 43346 | B25: 03.09.18 | C25: 24 | M25: 259.14999999999998 | N25: 68.040000000000006 | O25: 183.63 | P25: 54.41 | Q25: =RC[-3]-RC[-1] -> 13.63000000000001 | R25: 75.52 | S25: 7.4180000000000001 | T25: =RC[-1] -> 7.4180000000000001 | U25: =(RC[-17]*RC[-16]-RC[-14]*RC[-13])/1000 -> 0 | V25: 253.79 | W25: 181.08 | X25: =RC[-2]*RC[-10]/1000 -> 17.267871600000003 | Y25: =(RC[-3]*RC[-11]-RC[-2]*RC[-9])/1000 -> 7.4153088000000027 | Z25: 2013-12-04T00:00:00.000 | AA25: 2013-12-02T00:00:00.000 | AD25: =VALUE(RC[-28]) -> 2018-09-03T00:00:00.000 | AE25: =IF(RC[22]=42,"*",IF(RC[22]=32,"",RC[22])) -> - | AF25: =RC[-29] -> 24 | AG25: =RC[-29] -> 0 | AH25: =RC[-29] -> 0 | AI25: =RC[-29] -> 0 | AJ25: =RC[-29] -> 0 | AK25: =RC[-29] -> 0 | AL25: =RC[-29] -> 0 | AM25: =RC[-29] -> 0 | AN25: =RC[-29] -> 0 | AO25: =RC[-29] -> 0 | AP25: =RC[-29] -> 259.14999999999998 | AQ25: =RC[-29] -> 68.040000000000006 | AR25: - | AS25: =RC[-30] -> 183.63 | AT25: =RC[-30] -> 54.41 | AU25: - | AV25: =RC[-31] -> 13.63000000000001 | AW25: =RC[-31] -> 75.52 | AX25: =RC[-31] -> 7.4180000000000001 | AY25: =RC[-31] -> 7.4180000000000001 | BA25: - | BB25: - | BC25: -
A26: =IF(RC[1]="","",DATEVALUE(RC[1])) -> 43347 | B26: 04.09.18 | C26: 24 | M26: 258.69 | N26: 67.959999999999994 | O26: 184.5 | P26: 54.31 | Q26: =RC[-3]-RC[-1] -> 13.649999999999991 | R26: 74.19 | S26: 7.3380000000000001 | T26: =RC[-1] -> 7.3380000000000001 | U26: =(RC[-17]*RC[-16]-RC[-14]*RC[-13])/1000 -> 0 | V26: 253.33 | W26: 181.97 | X26: =RC[-2]*RC[-10]/1000 -> 17.216306799999998 | Y26: =(RC[-3]*RC[-11]-RC[-2]*RC[-9])/1000 -> 7.3335160999999989 | Z26: 2013-12-05T00:00:00.000 | AA26: 2013-12-03T00:00:00.000 | AD26: =VALUE(RC[-28]) -> 2018-09-04T00:00:00.000 | AE26: =IF(RC[22]=42,"*",IF(RC[22]=32,"",RC[22])) -> - | AF26: =RC[-29] -> 24 | AG26: =RC[-29] -> 0 | AH26: =RC[-29] -> 0 | AI26: =RC[-29] -> 0 | AJ26: =RC[-29] -> 0 | AK26: =RC[-29] -> 0 | AL26: =RC[-29] -> 0 | AM26: =RC[-29] -> 0 | AN26: =RC[-29] -> 0 | AO26: =RC[-29] -> 0 | AP26: =RC[-29] -> 258.69 | AQ26: =RC[-29] -> 67.959999999999994 | AR26: - | AS26: =RC[-30] -> 184.5 | AT26: =RC[-30] -> 54.31 | AU26: - | AV26: =RC[-31] -> 13.649999999999991 | AW26: =RC[-31] -> 74.19 | AX26: =RC[-31] -> 7.3380000000000001 | AY26: =RC[-31] -> 7.3380000000000001 | BA26: - | BB26: - | BC26: -
A27: =IF(RC[1]="","",DATEVALUE(RC[1])) -> 43348 | B27: 05.09.18 | C27: 24 | M27: 260.8 | N27: 68.319999999999993 | O27: 185.03 | P27: 54.67 | Q27: =RC[-3]-RC[-1] -> 13.649999999999991 | R27: 75.77 | S27: 7.4740000000000002 | T27: =RC[-1] -> 7.4740000000000002 | U27: =(RC[-17]*RC[-16]-RC[-14]*RC[-13])/1000 -> 0 | V27: 255.36 | W27: 182.45 | X27: =RC[-2]*RC[-10]/1000 -> 17.446195199999998 | Y27: =(RC[-3]*RC[-11]-RC[-2]*RC[-9])/1000 -> 7.4716536999999992 | Z27: 2013-12-06T00:00:00.000 | AA27: 2013-12-04T00:00:00.000 | AD27: =VALUE(RC[-28]) -> 2018-09-05T00:00:00.000 | AE27: =IF(RC[22]=42,"*",IF(RC[22]=32,"",RC[22])) -> - | AF27: =RC[-29] -> 24 | AG27: =RC[-29] -> 0 | AH27: =RC[-29] -> 0 | AI27: =RC[-29] -> 0 | AJ27: =RC[-29] -> 0 | AK27: =RC[-29] -> 0 | AL27: =RC[-29] -> 0 | AM27: =RC[-29] -> 0 | AN27: =RC[-29] -> 0 | AO27: =RC[-29] -> 0 | AP27: =RC[-29] -> 260.8 | AQ27: =RC[-29] -> 68.319999999999993 | AR27: - | AS27: =RC[-30] -> 185.03 | AT27: =RC[-30] -> 54.67 | AU27: - | AV27: =RC[-31] -> 13.649999999999991 | AW27: =RC[-31] -> 75.77 | AX27: =RC[-31] -> 7.4740000000000002 | AY27: =RC[-31] -> 7.4740000000000002 | BA27: - | BB27: - | BC27: -
A28: =IF(RC[1]="","",DATEVALUE(RC[1])) -> 43349 | B28: 06.09.18 | C28: 24 | M28: 261.97000000000003 | N28: 68.38 | O28: 185.23 | P28: 55.58 | Q28: =RC[-3]-RC[-1] -> 12.799999999999997 | R28: 76.739999999999995 | S28: 7.391 | T28: =RC[-1] -> 7.391 | U28: =(RC[-17]*RC[-16]-RC[-14]*RC[-13])/1000 -> 0 | V28: 256.47000000000003 | W28: 182.59 | X28: =RC[-2]*RC[-10]/1000 -> 17.537418600000002 | Y28: =(RC[-3]*RC[-11]-RC[-2]*RC[-9])/1000 -> 7.3890664000000017 | Z28: 2013-12-07T00:00:00.000 | AA28: 2013-12-05T00:00:00.000 | AD28: =VALUE(RC[-28]) -> 2018-09-06T00:00:00.000 | AE28: =IF(RC[22]=42,"*",IF(RC[22]=32,"",RC[22])) -> - | AF28: =RC[-29] -> 24 | AG28: =RC[-29] -> 0 | AH28: =RC[-29] -> 0 | AI28: =RC[-29] -> 0 | AJ28: =RC[-29] -> 0 | AK28: =RC[-29] -> 0 | AL28: =RC[-29] -> 0 | AM28: =RC[-29] -> 0 | AN28: =RC[-29] -> 0 | AO28: =RC[-29] -> 0 | AP28: =RC[-29] -> 261.97000000000003 | AQ28: =RC[-29] -> 68.38 | AR28: - | AS28: =RC[-30] -> 185.23 | AT28: =RC[-30] -> 55.58 | AU28: - | AV28: =RC[-31] -> 12.799999999999997 | AW28: =RC[-31] -> 76.739999999999995 | AX28: =RC[-31] -> 7.391 | AY28: =RC[-31] -> 7.391 | BA28: - | BB28: - | BC28: -
A29: =IF(RC[1]="","",DATEVALUE(RC[1])) -> 43350 | B29: 07.09.18 | C29: 24 | M29: 261.24 | N29: 68.66 | O29: 186.82 | P29: 56.12 | Q29: =RC[-3]-RC[-1] -> 12.54 | R29: 74.42 | S29: 7.2279999999999998 | T29: =RC[-1] -> 7.2279999999999998 | U29: =(RC[-17]*RC[-16]-RC[-14]*RC[-13])/1000 -> 0 | V29: 255.73 | W29: 184.1 | X29: =RC[-2]*RC[-10]/1000 -> 17.558421800000001 | Y29: =(RC[-3]*RC[-11]-RC[-2]*RC[-9])/1000 -> 7.2267298000000011 | Z29: 2013-12-08T00:00:00.000 | AA29: 2013-12-06T00:00:00.000 | AD29: =VALUE(RC[-28]) -> 2018-09-07T00:00:00.000 | AE29: =IF(RC[22]=42,"*",IF(RC[22]=32,"",RC[22])) -> - | AF29: =RC[-29] -> 24 | AG29: =RC[-29] -> 0 | AH29: =RC[-29] -> 0 | AI29: =RC[-29] -> 0 | AJ29: =RC[-29] -> 0 | AK29: =RC[-29] -> 0 | AL29: =RC[-29] -> 0 | AM29: =RC[-29] -> 0 | AN29: =RC[-29] -> 0 | AO29: =RC[-29] -> 0 | AP29: =RC[-29] -> 261.24 | AQ29: =RC[-29] -> 68.66 | AR29: - | AS29: =RC[-30] -> 186.82 | AT29: =RC[-30] -> 56.12 | AU29: - | AV29: =RC[-31] -> 12.54 | AW29: =RC[-31] -> 74.42 | AX29: =RC[-31] -> 7.2279999999999998 | AY29: =RC[-31] -> 7.2279999999999998 | BA29: - | BB29: - | BC29: -
A30: =IF(RC[1]="","",DATEVALUE(RC[1])) -> 43351 | B30: 08.09.18 | C30: 24 | M30: 261.25 | N30: 67.650000000000006 | O30: 187.33 | P30: 55.1 | Q30: =RC[-3]-RC[-1] -> 12.550000000000004 | R30: 73.92 | S30: 7.1369999999999996 | T30: =RC[-1] -> 7.1369999999999996 | U30: =(RC[-17]*RC[-16]-RC[-14]*RC[-13])/1000 -> 0 | V30: 255.9 | W30: 184.72 | X30: =RC[-2]*RC[-10]/1000 -> 17.311635000000003 | Y30: =(RC[-3]*RC[-11]-RC[-2]*RC[-9])/1000 -> 7.1335630000000023 | Z30: 2013-12-09T00:00:00.000 | AA30: 2013-12-07T00:00:00.000 | AD30: =VALUE(RC[-28]) -> 2018-09-08T00:00:00.000 | AE30: =IF(RC[22]=42,"*",IF(RC[22]=32,"",RC[22])) -> - | AF30: =RC[-29] -> 24 | AG30: =RC[-29] -> 0 | AH30: =RC[-29] -> 0 | AI30: =RC[-29] -> 0 | AJ30: =RC[-29] -> 0 | AK30: =RC[-29] -> 0 | AL30: =RC[-29] -> 0 | AM30: =RC[-29] -> 0 | AN30: =RC[-29] -> 0 | AO30: =RC[-29] -> 0 | AP30: =RC[-29] -> 261.25 | AQ30: =RC[-29] -> 67.650000000000006 | AR30: - | AS30: =RC[-30] -> 187.33 | AT30: =RC[-30] -> 55.1 | AU30: - | AV30: =RC[-31] -> 12.550000000000004 | AW30: =RC[-31] -> 73.92 | AX30: =RC[-31] -> 7.1369999999999996 | AY30: =RC[-31] -> 7.1369999999999996 | BA30: - | BB30: - | BC30: -
A31: =IF(RC[1]="","",DATEVALUE(RC[1])) -> 43352 | B31: 09.09.18 | C31: 24 | M31: 271.04000000000002 | N31: 67.77 | O31: 187.51 | P31: 54.91 | Q31: =RC[-3]-RC[-1] -> 12.86 | R31: 83.53 | S31: 7.843 | T31: =RC[-1] -> 7.843 | U31: =(RC[-17]*RC[-16]-RC[-14]*RC[-13])/1000 -> 0 | V31: 265.45999999999998 | W31: 184.87 | X31: =RC[-2]*RC[-10]/1000 -> 17.990224199999997 | Y31: =(RC[-3]*RC[-11]-RC[-2]*RC[-9])/1000 -> 7.8390124999999973 | Z31: 2013-12-10T00:00:00.000 | AA31: 2013-12-08T00:00:00.000 | AD31: =VALUE(RC[-28]) -> 2018-09-09T00:00:00.000 | AE31: =IF(RC[22]=42,"*",IF(RC[22]=32,"",RC[22])) -> - | AF31: =RC[-29] -> 24 | AG31: =RC[-29] -> 0 | AH31: =RC[-29] -> 0 | AI31: =RC[-29] -> 0 | AJ31: =RC[-29] -> 0 | AK31: =RC[-29] -> 0 | AL31: =RC[-29] -> 0 | AM31: =RC[-29] -> 0 | AN31: =RC[-29] -> 0 | AO31: =RC[-29] -> 0 | AP31: =RC[-29] -> 271.04000000000002 | AQ31: =RC[-29] -> 67.77 | AR31: - | AS31: =RC[-30] -> 187.51 | AT31: =RC[-30] -> 54.91 | AU31: - | AV31: =RC[-31] -> 12.86 | AW31: =RC[-31] -> 83.53 | AX31: =RC[-31] -> 7.843 | AY31: =RC[-31] -> 7.843 | BA31: - | BB31: - | BC31: -
A32: =IF(RC[1]="","",DATEVALUE(RC[1])) -> 43353 | B32: 10.09.18 | C32: 24 | M32: 258.23 | N32: 69.349999999999994 | O32: 182.87 | P32: 55.21 | Q32: =RC[-3]-RC[-1] -> 14.139999999999993 | R32: 75.36 | S32: 7.5709999999999997 | T32: =RC[-1] -> 7.5709999999999997 | U32: =(RC[-17]*RC[-16]-RC[-14]*RC[-13])/1000 -> 0 | V32: 252.65 | W32: 180.31 | X32: =RC[-2]*RC[-10]/1000 -> 17.5212775 | Y32: =(RC[-3]*RC[-11]-RC[-2]*RC[-9])/1000 -> 7.5663624 | Z32: 2013-12-11T00:00:00.000 | AA32: 2013-12-09T00:00:00.000 | AD32: =VALUE(RC[-28]) -> 2018-09-10T00:00:00.000 | AE32: =IF(RC[22]=42,"*",IF(RC[22]=32,"",RC[22])) -> - | AF32: =RC[-29] -> 24 | AG32: =RC[-29] -> 0 | AH32: =RC[-29] -> 0 | AI32: =RC[-29] -> 0 | AJ32: =RC[-29] -> 0 | AK32: =RC[-29] -> 0 | AL32: =RC[-29] -> 0 | AM32: =RC[-29] -> 0 | AN32: =RC[-29] -> 0 | AO32: =RC[-29] -> 0 | AP32: =RC[-29] -> 258.23 | AQ32: =RC[-29] -> 69.349999999999994 | AR32: - | AS32: =RC[-30] -> 182.87 | AT32: =RC[-30] -> 55.21 | AU32: - | AV32: =RC[-31] -> 14.139999999999993 | AW32: =RC[-31] -> 75.36 | AX32: =RC[-31] -> 7.5709999999999997 | AY32: =RC[-31] -> 7.5709999999999997 | BA32: - | BB32: - | BC32: -
A33: =IF(RC[1]="","",DATEVALUE(RC[1])) -> 43354 | B33: 11.09.18 | C33: 24 | M33: 255.38 | N33: 68.2 | O33: 177.33 | P33: 55.08 | Q33: =RC[-3]-RC[-1] -> 13.120000000000005 | R33: 78.05 | S33: 7.4240000000000004 | T33: =RC[-1] -> 7.4240000000000004 | U33: =(RC[-17]*RC[-16]-RC[-14]*RC[-13])/1000 -> 0 | V33: 250.05 | W33: 174.87 | X33: =RC[-2]*RC[-10]/1000 -> 17.05341 | Y33: =(RC[-3]*RC[-11]-RC[-2]*RC[-9])/1000 -> 7.4215704000000002 | Z33: 2013-12-12T00:00:00.000 | AA33: 2013-12-10T00:00:00.000 | AD33: =VALUE(RC[-28]) -> 2018-09-11T00:00:00.000 | AE33: =IF(RC[22]=42,"*",IF(RC[22]=32,"",RC[22])) -> - | AF33: =RC[-29] -> 24 | AG33: =RC[-29] -> 0 | AH33: =RC[-29] -> 0 | AI33: =RC[-29] -> 0 | AJ33: =RC[-29] -> 0 | AK33: =RC[-29] -> 0 | AL33: =RC[-29] -> 0 | AM33: =RC[-29] -> 0 | AN33: =RC[-29] -> 0 | AO33: =RC[-29] -> 0 | AP33: =RC[-29] -> 255.38 | AQ33: =RC[-29] -> 68.2 | AR33: - | AS33: =RC[-30] -> 177.33 | AT33: =RC[-30] -> 55.08 | AU33: - | AV33: =RC[-31] -> 13.120000000000005 | AW33: =RC[-31] -> 78.05 | AX33: =RC[-31] -> 7.4240000000000004 | AY33: =RC[-31] -> 7.4240000000000004 | BA33: - | BB33: - | BC33: -
A34: =IF(RC[1]="","",DATEVALUE(RC[1])) -> 43355 | B34: 12.09.18 | C34: 24 | M34: 256.70999999999998 | N34: 68.37 | O34: 172.95 | P34: 57.56 | Q34: =RC[-3]-RC[-1] -> 10.810000000000002 | R34: 83.76 | S34: 7.3840000000000003 | T34: =RC[-1] -> 7.3840000000000003 | U34: =(RC[-17]*RC[-16]-RC[-14]*RC[-13])/1000 -> 0 | V34: 251.33 | W34: 170.34 | X34: =RC[-2]*RC[-10]/1000 -> 17.183432100000001 | Y34: =(RC[-3]*RC[-11]-RC[-2]*RC[-9])/1000 -> 7.3786617000000003 | Z34: 2013-12-13T00:00:00.000 | AA34: 2013-12-11T00:00:00.000 | AD34: =VALUE(RC[-28]) -> 2018-09-12T00:00:00.000 | AE34: =IF(RC[22]=42,"*",IF(RC[22]=32,"",RC[22])) -> - | AF34: =RC[-29] -> 24 | AG34: =RC[-29] -> 0 | AH34: =RC[-29] -> 0 | AI34: =RC[-29] -> 0 | AJ34: =RC[-29] -> 0 | AK34: =RC[-29] -> 0 | AL34: =RC[-29] -> 0 | AM34: =RC[-29] -> 0 | AN34: =RC[-29] -> 0 | AO34: =RC[-29] -> 0 | AP34: =RC[-29] -> 256.70999999999998 | AQ34: =RC[-29] -> 68.37 | AR34: - | AS34: =RC[-30] -> 172.95 | AT34: =RC[-30] -> 57.56 | AU34: - | AV34: =RC[-31] -> 10.810000000000002 | AW34: =RC[-31] -> 83.76 | AX34: =RC[-31] -> 7.3840000000000003 | AY34: =RC[-31] -> 7.3840000000000003 | BA34: - | BB34: - | BC34: -
A35: =IF(RC[1]="","",DATEVALUE(RC[1])) -> 43356 | B35: 13.09.18 | C35: 24 | M35: 236.67 | N35: 67.75 | O35: 154.54 | P35: 55.47 | Q35: =RC[-3]-RC[-1] -> 12.280000000000001 | R35: 82.13 | S35: 7.2549999999999999 | T35: =RC[-1] -> 7.2549999999999999 | U35: =(RC[-17]*RC[-16]-RC[-14]*RC[-13])/1000 -> 0 | V35: 231.78 | W35: 152.36000000000001 | X35: =RC[-2]*RC[-10]/1000 -> 15.703094999999999 | Y35: =(RC[-3]*RC[-11]-RC[-2]*RC[-9])/1000 -> 7.2516857999999988 | Z35: 2013-12-14T00:00:00.000 | AA35: 2013-12-12T00:00:00.000 | AD35: =VALUE(RC[-28]) -> 2018-09-13T00:00:00.000 | AE35: =IF(RC[22]=42,"*",IF(RC[22]=32,"",RC[22])) -> - | AF35: =RC[-29] -> 24 | AG35: =RC[-29] -> 0 | AH35: =RC[-29] -> 0 | AI35: =RC[-29] -> 0 | AJ35: =RC[-29] -> 0 | AK35: =RC[-29] -> 0 | AL35: =RC[-29] -> 0 | AM35: =RC[-29] -> 0 | AN35: =RC[-29] -> 0 | AO35: =RC[-29] -> 0 | AP35: =RC[-29] -> 236.67 | AQ35: =RC[-29] -> 67.75 | AR35: - | AS35: =RC[-30] -> 154.54 | AT35: =RC[-30] -> 55.47 | AU35: - | AV35: =RC[-31] -> 12.280000000000001 | AW35: =RC[-31] -> 82.13 | AX35: =RC[-31] -> 7.2549999999999999 | AY35: =RC[-31] -> 7.2549999999999999 | BA35: - | BB35: - | BC35: -
A36: =IF(RC[1]="","",DATEVALUE(RC[1])) -> 43357 | B36: 14.09.18 | C36: 24 | M36: 230.42 | N36: 66.97 | O36: 148.52000000000001 | P36: 54.31 | Q36: =RC[-3]-RC[-1] -> 12.659999999999997 | R36: 81.900000000000006 | S36: 7.1639999999999997 | T36: =RC[-1] -> 7.1639999999999997 | U36: =(RC[-17]*RC[-16]-RC[-14]*RC[-13])/1000 -> 0 | V36: 225.76 | W36: 146.47999999999999 | X36: =RC[-2]*RC[-10]/1000 -> 15.119147199999999 | Y36: =(RC[-3]*RC[-11]-RC[-2]*RC[-9])/1000 -> 7.1638183999999994 | Z36: 2013-12-15T00:00:00.000 | AA36: 2013-12-13T00:00:00.000 | AD36: =VALUE(RC[-28]) -> 2018-09-14T00:00:00.000 | AE36: =IF(RC[22]=42,"*",IF(RC[22]=32,"",RC[22])) -> - | AF36: =RC[-29] -> 24 | AG36: =RC[-29] -> 0 | AH36: =RC[-29] -> 0 | AI36: =RC[-29] -> 0 | AJ36: =RC[-29] -> 0 | AK36: =RC[-29] -> 0 | AL36: =RC[-29] -> 0 | AM36: =RC[-29] -> 0 | AN36: =RC[-29] -> 0 | AO36: =RC[-29] -> 0 | AP36: =RC[-29] -> 230.42 | AQ36: =RC[-29] -> 66.97 | AR36: - | AS36: =RC[-30] -> 148.52000000000001 | AT36: =RC[-30] -> 54.31 | AU36: - | AV36: =RC[-31] -> 12.659999999999997 | AW36: =RC[-31] -> 81.900000000000006 | AX36: =RC[-31] -> 7.1639999999999997 | AY36: =RC[-31] -> 7.1639999999999997 | BA36: - | BB36: - | BC36: -
A37: =IF(RC[1]="","",DATEVALUE(RC[1])) -> 43358 | B37: 15.09.18 | C37: 24 | M37: 220.71 | N37: 65.540000000000006 | O37: 139.84 | P37: 52.15 | Q37: =RC[-3]-RC[-1] -> 13.390000000000008 | R37: 80.87 | S37: 6.984 | T37: =RC[-1] -> 6.984 | U37: =(RC[-17]*RC[-16]-RC[-14]*RC[-13])/1000 -> 0 | V37: 216.44 | W37: 138.11000000000001 | X37: =RC[-2]*RC[-10]/1000 -> 14.185477600000002 | Y37: =(RC[-3]*RC[-11]-RC[-2]*RC[-9])/1000 -> 6.9830411000000012 | Z37: 2013-12-16T00:00:00.000 | AA37: 2013-12-14T00:00:00.000 | AD37: =VALUE(RC[-28]) -> 2018-09-15T00:00:00.000 | AE37: =IF(RC[22]=42,"*",IF(RC[22]=32,"",RC[22])) -> - | AF37: =RC[-29] -> 24 | AG37: =RC[-29] -> 0 | AH37: =RC[-29] -> 0 | AI37: =RC[-29] -> 0 | AJ37: =RC[-29] -> 0 | AK37: =RC[-29] -> 0 | AL37: =RC[-29] -> 0 | AM37: =RC[-29] -> 0 | AN37: =RC[-29] -> 0 | AO37: =RC[-29] -> 0 | AP37: =RC[-29] -> 220.71 | AQ37: =RC[-29] -> 65.540000000000006 | AR37: - | AS37: =RC[-30] -> 139.84 | AT37: =RC[-30] -> 52.15 | AU37: - | AV37: =RC[-31] -> 13.390000000000008 | AW37: =RC[-31] -> 80.87 | AX37: =RC[-31] -> 6.984 | AY37: =RC[-31] -> 6.984 | BA37: - | BB37: - | BC37: -
A38: =IF(RC[1]="","",DATEVALUE(RC[1])) -> 43359 | B38: 16.09.18 | C38: 24 | M38: 228.57 | N38: 65.790000000000006 | O38: 137.91999999999999 | P38: 51.76 | Q38: =RC[-3]-RC[-1] -> 14.030000000000008 | R38: 90.65 | S38: 7.6920000000000002 | T38: =RC[-1] -> 7.6920000000000002 | U38: =(RC[-17]*RC[-16]-RC[-14]*RC[-13])/1000 -> 0 | V38: 224.1 | W38: 136.25 | X38: =RC[-2]*RC[-10]/1000 -> 14.743539 | Y38: =(RC[-3]*RC[-11]-RC[-2]*RC[-9])/1000 -> 7.6912390000000004 | Z38: 2013-12-17T00:00:00.000 | AA38: 2013-12-15T00:00:00.000 | AD38: =VALUE(RC[-28]) -> 2018-09-16T00:00:00.000 | AE38: =IF(RC[22]=42,"*",IF(RC[22]=32,"",RC[22])) -> - | AF38: =RC[-29] -> 24 | AG38: =RC[-29] -> 0 | AH38: =RC[-29] -> 0 | AI38: =RC[-29] -> 0 | AJ38: =RC[-29] -> 0 | AK38: =RC[-29] -> 0 | AL38: =RC[-29] -> 0 | AM38: =RC[-29] -> 0 | AN38: =RC[-29] -> 0 | AO38: =RC[-29] -> 0 | AP38: =RC[-29] -> 228.57 | AQ38: =RC[-29] -> 65.790000000000006 | AR38: - | AS38: =RC[-30] -> 137.91999999999999 | AT38: =RC[-30] -> 51.76 | AU38: - | AV38: =RC[-31] -> 14.030000000000008 | AW38: =RC[-31] -> 90.65 | AX38: =RC[-31] -> 7.6920000000000002 | AY38: =RC[-31] -> 7.6920000000000002 | BA38: - | BB38: - | BC38: -
A39: =IF(RC[1]="","",DATEVALUE(RC[1])) -> 43360 | B39: 17.09.18 | C39: 24 | M39: 223.59 | N39: 66.03 | O39: 139.69 | P39: 51.25 | Q39: =RC[-3]-RC[-1] -> 14.780000000000001 | R39: 83.9 | S39: 7.4 | T39: =RC[-1] -> 7.4 | U39: =(RC[-17]*RC[-16]-RC[-14]*RC[-13])/1000 -> 0 | V39: 219.18 | W39: 138.01 | X39: =RC[-2]*RC[-10]/1000 -> 14.472455400000001 | Y39: =(RC[-3]*RC[-11]-RC[-2]*RC[-9])/1000 -> 7.3994429000000013 | Z39: 2013-12-18T00:00:00.000 | AA39: 2013-12-16T00:00:00.000 | AD39: =VALUE(RC[-28]) -> 2018-09-17T00:00:00.000 | AE39: =IF(RC[22]=42,"*",IF(RC[22]=32,"",RC[22])) -> - | AF39: =RC[-29] -> 24 | AG39: =RC[-29] -> 0 | AH39: =RC[-29] -> 0 | AI39: =RC[-29] -> 0 | AJ39: =RC[-29] -> 0 | AK39: =RC[-29] -> 0 | AL39: =RC[-29] -> 0 | AM39: =RC[-29] -> 0 | AN39: =RC[-29] -> 0 | AO39: =RC[-29] -> 0 | AP39: =RC[-29] -> 223.59 | AQ39: =RC[-29] -> 66.03 | AR39: - | AS39: =RC[-30] -> 139.69 | AT39: =RC[-30] -> 51.25 | AU39: - | AV39: =RC[-31] -> 14.780000000000001 | AW39: =RC[-31] -> 83.9 | AX39: =RC[-31] -> 7.4 | AY39: =RC[-31] -> 7.4 | BA39: - | BB39: - | BC39: -
A40: =IF(RC[1]="","",DATEVALUE(RC[1])) -> 43361 | B40: 18.09.18 | C40: 24 | M40: 218.65 | N40: 66.849999999999994 | O40: 139.96 | P40: 51.45 | Q40: =RC[-3]-RC[-1] -> 15.399999999999991 | R40: 78.69 | S40: 7.2110000000000003 | T40: =RC[-1] -> 7.2110000000000003 | U40: =(RC[-17]*RC[-16]-RC[-14]*RC[-13])/1000 -> 0 | V40: 214.27 | W40: 138.26 | X40: =RC[-2]*RC[-10]/1000 -> 14.323949499999999 | Y40: =(RC[-3]*RC[-11]-RC[-2]*RC[-9])/1000 -> 7.210472499999999 | Z40: 2013-12-19T00:00:00.000 | AA40: 2013-12-17T00:00:00.000 | AD40: =VALUE(RC[-28]) -> 2018-09-18T00:00:00.000 | AE40: =IF(RC[22]=42,"*",IF(RC[22]=32,"",RC[22])) -> - | AF40: =RC[-29] -> 24 | AG40: =RC[-29] -> 0 | AH40: =RC[-29] -> 0 | AI40: =RC[-29] -> 0 | AJ40: =RC[-29] -> 0 | AK40: =RC[-29] -> 0 | AL40: =RC[-29] -> 0 | AM40: =RC[-29] -> 0 | AN40: =RC[-29] -> 0 | AO40: =RC[-29] -> 0 | AP40: =RC[-29] -> 218.65 | AQ40: =RC[-29] -> 66.849999999999994 | AR40: - | AS40: =RC[-30] -> 139.96 | AT40: =RC[-30] -> 51.45 | AU40: - | AV40: =RC[-31] -> 15.399999999999991 | AW40: =RC[-31] -> 78.69 | AX40: =RC[-31] -> 7.2110000000000003 | AY40: =RC[-31] -> 7.2110000000000003 | BA40: - | BB40: - | BC40: -
A41: =IF(RC[1]="","",DATEVALUE(RC[1])) -> 43362 | B41: 19.09.18 | C41: 24 | M41: 219.38 | N41: 66.83 | O41: 138.44999999999999 | P41: 51.36 | Q41: 15.469999999999999 | R41: 80.930000000000007 | S41: 7.3440000000000003 | T41: =RC[-1] -> 7.3440000000000003 | U41: =(RC[-17]*RC[-16]-RC[-14]*RC[-13])/1000 -> 0 | X41: =RC[-2]*RC[-10]/1000 -> #VALUE! | Y41: =(RC[-3]*RC[-11]-RC[-2]*RC[-9])/1000 -> #VALUE! | Z41: 2013-12-20T00:00:00.000 | AA41: 2013-12-18T00:00:00.000 | AD41: =VALUE(RC[-28]) -> 2018-09-19T00:00:00.000 | AE41: =IF(RC[22]=42,"*",IF(RC[22]=32,"",RC[22])) ->  | AF41: =RC[-29] -> 24 | AG41: =RC[-29] -> 0 | AH41: =RC[-29] -> 0 | AI41: =RC[-29] -> 0 | AJ41: =RC[-29] -> 0 | AK41: =RC[-29] -> 0 | AL41: =RC[-29] -> 0 | AM41: =RC[-29] -> 0 | AN41: =RC[-29] -> 0 | AO41: =RC[-29] -> 0 | AP41: =RC[-29] -> 219.38 | AQ41: =RC[-29] -> 66.83 | AR41: - | AS41: =RC[-30] -> 138.44999999999999 | AT41: =RC[-30] -> 51.36 | AU41: - | AV41: =RC[-31] -> 15.469999999999999 | AW41: =RC[-31] -> 80.930000000000007 | AX41: =RC[-31] -> 7.3440000000000003 | AY41: =RC[-31] -> 7.3440000000000003
A42: =IF(RC[1]="","",DATEVALUE(RC[1])) -> 43363 | B42: 20.09.18 | C42: 24 | M42: 224.38 | N42: 67.89 | O42: 143.58000000000001 | P42: 52.37 | Q42: 15.520000000000003 | R42: 80.8 | S42: 7.4960000000000004 | T42: =RC[-1] -> 7.4960000000000004 | U42: =(RC[-17]*RC[-16]-RC[-14]*RC[-13])/1000 -> 0 | X42: =RC[-2]*RC[-10]/1000 -> #VALUE! | Y42: =(RC[-3]*RC[-11]-RC[-2]*RC[-9])/1000 -> #VALUE! | Z42: 2013-12-21T00:00:00.000 | AA42: 2013-12-19T00:00:00.000 | AD42: =VALUE(RC[-28]) -> 2018-09-20T00:00:00.000 | AE42: =IF(RC[22]=42,"*",IF(RC[22]=32,"",RC[22])) ->  | AF42: =RC[-29] -> 24 | AG42: =RC[-29] -> 0 | AH42: =RC[-29] -> 0 | AI42: =RC[-29] -> 0 | AJ42: =RC[-29] -> 0 | AK42: =RC[-29] -> 0 | AL42: =RC[-29] -> 0 | AM42: =RC[-29] -> 0 | AN42: =RC[-29] -> 0 | AO42: =RC[-29] -> 0 | AP42: =RC[-29] -> 224.38 | AQ42: =RC[-29] -> 67.89 | AR42: - | AS42: =RC[-30] -> 143.58000000000001 | AT42: =RC[-30] -> 52.37 | AU42: - | AV42: =RC[-31] -> 15.520000000000003 | AW42: =RC[-31] -> 80.8 | AX42: =RC[-31] -> 7.4960000000000004 | AY42: =RC[-31] -> 7.4960000000000004
A43: =IF(RC[1]="","",DATEVALUE(RC[1])) -> 43364 | B43: 21.09.18 | C43: 24 | M43: 219.37 | N43: 68.06 | O43: 143.72 | P43: 53.19 | Q43: 14.870000000000005 | R43: 75.650000000000006 | S43: 7.08 | T43: =RC[-1] -> 7.08 | U43: =(RC[-17]*RC[-16]-RC[-14]*RC[-13])/1000 -> 0 | X43: =RC[-2]*RC[-10]/1000 -> #VALUE! | Y43: =(RC[-3]*RC[-11]-RC[-2]*RC[-9])/1000 -> #VALUE! | Z43: 2013-12-22T00:00:00.000 | AA43: 2013-12-20T00:00:00.000 | AD43: =VALUE(RC[-28]) -> 2018-09-21T00:00:00.000 | AE43: =IF(RC[22]=42,"*",IF(RC[22]=32,"",RC[22])) ->  | AF43: =RC[-29] -> 24 | AG43: =RC[-29] -> 0 | AH43: =RC[-29] -> 0 | AI43: =RC[-29] -> 0 | AJ43: =RC[-29] -> 0 | AK43: =RC[-29] -> 0 | AL43: =RC[-29] -> 0 | AM43: =RC[-29] -> 0 | AN43: =RC[-29] -> 0 | AO43: =RC[-29] -> 0 | AP43: =RC[-29] -> 219.37 | AQ43: =RC[-29] -> 68.06 | AR43: - | AS43: =RC[-30] -> 143.72 | AT43: =RC[-30] -> 53.19 | AU43: - | AV43: =RC[-31] -> 14.870000000000005 | AW43: =RC[-31] -> 75.650000000000006 | AX43: =RC[-31] -> 7.08 | AY43: =RC[-31] -> 7.08
A44: =IF(RC[1]="","",DATEVALUE(RC[1])) -> 43365 | B44: 22.09.18 | C44: 24 | M44: 225.84 | N44: 68.19 | O44: 146.9 | P44: 52.74 | Q44: 15.449999999999996 | R44: 78.94 | S44: 7.4359999999999999 | T44: =RC[-1] -> 7.4359999999999999 | U44: =(RC[-17]*RC[-16]-RC[-14]*RC[-13])/1000 -> 0 | X44: =RC[-2]*RC[-10]/1000 -> #VALUE! | Y44: =(RC[-3]*RC[-11]-RC[-2]*RC[-9])/1000 -> #VALUE! | AD44: =VALUE(RC[-28]) -> 2018-09-22T00:00:00.000 | AE44: =IF(RC[22]=42,"*",IF(RC[22]=32,"",RC[22])) ->  | AF44: =RC[-29] -> 24 | AG44: =RC[-29] -> 0 | AH44: =RC[-29] -> 0 | AI44: =RC[-29] -> 0 | AJ44: =RC[-29] -> 0 | AK44: =RC[-29] -> 0 | AL44: =RC[-29] -> 0 | AM44: =RC[-29] -> 0 | AN44: =RC[-29] -> 0 | AO44: =RC[-29] -> 0 | AP44: =RC[-29] -> 225.84 | AQ44: =RC[-29] -> 68.19 | AR44: - | AS44: =RC[-30] -> 146.9 | AT44: =RC[-30] -> 52.74 | AU44: - | AV44: =RC[-31] -> 15.449999999999996 | AW44: =RC[-31] -> 78.94 | AX44: =RC[-31] -> 7.4359999999999999 | AY44: =RC[-31] -> 7.4359999999999999
A45: =IF(RC[1]="","",DATEVALUE(RC[1])) ->  | C45: 24 | Q45: =RC[-3]-RC[-1] -> #VALUE! | T45: =RC[-1] ->  | U45: =(RC[-17]*RC[-16]-RC[-14]*RC[-13])/1000 -> 0 | X45: =RC[-2]*RC[-10]/1000 -> #VALUE! | Y45: =(RC[-3]*RC[-11]-RC[-2]*RC[-9])/1000 -> #VALUE! | AD45: =VALUE(RC[-28]) -> #VALUE! | AE45: =IF(RC[22]=42,"*",IF(RC[22]=32,"",RC[22])) ->  | AF45: =RC[-29] -> 24 | AG45: =RC[-29] -> 0 | AH45: =RC[-29] -> 0 | AI45: =RC[-29] -> 0 | AJ45: =RC[-29] -> 0 | AK45: =RC[-29] -> 0 | AL45: =RC[-29] -> 0 | AM45: =RC[-29] -> 0 | AN45: =RC[-29] -> 0 | AO45: =RC[-29] -> 0 | AP45: =RC[-29] ->  | AQ45: =RC[-29] ->  | AR45: - | AS45: =RC[-30] ->  | AT45: =RC[-30] ->  | AU45: - | AV45: =RC[-31] -> #VALUE! | AW45: =RC[-31] ->  | AX45: =RC[-31] ->  | AY45: =RC[-31] -> 
A46: =IF(RC[1]="","",DATEVALUE(RC[1])) ->  | C46: 24 | Q46: =RC[-3]-RC[-1] -> #VALUE! | T46: =RC[-1] ->  | U46: =(RC[-17]*RC[-16]-RC[-14]*RC[-13])/1000 -> 0 | X46: =RC[-2]*RC[-10]/1000 -> #VALUE! | Y46: =(RC[-3]*RC[-11]-RC[-2]*RC[-9])/1000 -> #VALUE! | AD46: =VALUE(RC[-28]) -> #VALUE! | AE46: =IF(RC[22]=42,"*",IF(RC[22]=32,"",RC[22])) ->  | AF46: =RC[-29] -> 24 | AG46: =RC[-29] -> 0 | AH46: =RC[-29] -> 0 | AI46: =RC[-29] -> 0 | AJ46: =RC[-29] -> 0 | AK46: =RC[-29] -> 0 | AL46: =RC[-29] -> 0 | AM46: =RC[-29] -> 0 | AN46: =RC[-29] -> 0 | AO46: =RC[-29] -> 0 | AP46: =RC[-29] ->  | AQ46: =RC[-29] ->  | AR46: - | AS46: =RC[-30] ->  | AT46: =RC[-30] ->  | AU46: - | AV46: =RC[-31] -> #VALUE! | AW46: =RC[-31] ->  | AX46: =RC[-31] ->  | AY46: =RC[-31] -> 
A47: =IF(RC[1]="","",DATEVALUE(RC[1])) ->  | C47: 24 | Q47: =RC[-3]-RC[-1] -> #VALUE! | T47: =RC[-1] ->  | U47: =(RC[-17]*RC[-16]-RC[-14]*RC[-13])/1000 -> 0 | X47: =RC[-2]*RC[-10]/1000 -> #VALUE! | Y47: =(RC[-3]*RC[-11]-RC[-2]*RC[-9])/1000 -> #VALUE! | AD47: =VALUE(RC[-28]) -> #VALUE! | AE47: =IF(RC[22]=42,"*",IF(RC[22]=32,"",RC[22])) ->  | AF47: =RC[-29] -> 24 | AG47: =RC[-29] -> 0 | AH47: =RC[-29] -> 0 | AI47: =RC[-29] -> 0 | AJ47: =RC[-29] -> 0 | AK47: =RC[-29] -> 0 | AL47: =RC[-29] -> 0 | AM47: =RC[-29] -> 0 | AN47: =RC[-29] -> 0 | AO47: =RC[-29] -> 0 | AP47: =RC[-29] ->  | AQ47: =RC[-29] ->  | AR47: - | AS47: =RC[-30] ->  | AT47: =RC[-30] ->  | AU47: - | AV47: =RC[-31] -> #VALUE! | AW47: =RC[-31] ->  | AX47: =RC[-31] ->  | AY47: =RC[-31] -> 
A48: =IF(RC[1]="","",DATEVALUE(RC[1])) ->  | C48: 24 | Q48: =RC[-3]-RC[-1] -> #VALUE! | T48: =RC[-1] ->  | U48: =(RC[-17]*RC[-16]-RC[-14]*RC[-13])/1000 -> 0 | X48: =RC[-2]*RC[-10]/1000 -> #VALUE! | Y48: =(RC[-3]*RC[-11]-RC[-2]*RC[-9])/1000 -> #VALUE! | AD48: =VALUE(RC[-28]) -> #VALUE! | AE48: =IF(RC[22]=42,"*",IF(RC[22]=32,"",RC[22])) ->  | AF48: =RC[-29] -> 24 | AG48: =RC[-29] -> 0 | AH48: =RC[-29] -> 0 | AI48: =RC[-29] -> 0 | AJ48: =RC[-29] -> 0 | AK48: =RC[-29] -> 0 | AL48: =RC[-29] -> 0 | AM48: =RC[-29] -> 0 | AN48: =RC[-29] -> 0 | AO48: =RC[-29] -> 0 | AP48: =RC[-29] ->  | AQ48: =RC[-29] ->  | AR48: - | AS48: =RC[-30] ->  | AT48: =RC[-30] ->  | AU48: - | AV48: =RC[-31] -> #VALUE! | AW48: =RC[-31] ->  | AX48: =RC[-31] ->  | AY48: =RC[-31] -> 
A49: =IF(RC[1]="","",DATEVALUE(RC[1])) ->  | C49: 24 | Q49: =RC[-3]-RC[-1] -> #VALUE! | T49: =RC[-1] ->  | U49: =(RC[-17]*RC[-16]-RC[-14]*RC[-13])/1000 -> 0 | X49: =RC[-2]*RC[-10]/1000 -> #VALUE! | Y49: =(RC[-3]*RC[-11]-RC[-2]*RC[-9])/1000 -> #VALUE! | AD49: =VALUE(RC[-28]) -> #VALUE! | AE49: =IF(RC[22]=42,"*",IF(RC[22]=32,"",RC[22])) ->  | AF49: =RC[-29] -> 24 | AG49: =RC[-29] -> 0 | AH49: =RC[-29] -> 0 | AI49: =RC[-29] -> 0 | AJ49: =RC[-29] -> 0 | AK49: =RC[-29] -> 0 | AL49: =RC[-29] -> 0 | AM49: =RC[-29] -> 0 | AN49: =RC[-29] -> 0 | AO49: =RC[-29] -> 0 | AP49: =RC[-29] ->  | AQ49: =RC[-29] ->  | AR49: - | AS49: =RC[-30] ->  | AT49: =RC[-30] ->  | AU49: - | AV49: =RC[-31] -> #VALUE! | AW49: =RC[-31] ->  | AX49: =RC[-31] ->  | AY49: =RC[-31] -> 
A50: =IF(RC[1]="","",DATEVALUE(RC[1])) ->  | C50: 24 | Q50: =RC[-3]-RC[-1] -> #VALUE! | T50: =RC[-1] ->  | U50: =(RC[-17]*RC[-16]-RC[-14]*RC[-13])/1000 -> 0 | X50: =RC[-2]*RC[-10]/1000 -> #VALUE! | Y50: =(RC[-3]*RC[-11]-RC[-2]*RC[-9])/1000 -> #VALUE! | AD50: =VALUE(RC[-28]) -> #VALUE! | AE50: =IF(RC[22]=42,"*",IF(RC[22]=32,"",RC[22])) ->  | AF50: =RC[-29] -> 24 | AG50: =RC[-29] -> 0 | AH50: =RC[-29] -> 0 | AI50: =RC[-29] -> 0 | AJ50: =RC[-29] -> 0 | AK50: =RC[-29] -> 0 | AL50: =RC[-29] -> 0 | AM50: =RC[-29] -> 0 | AN50: =RC[-29] -> 0 | AO50: =RC[-29] -> 0 | AP50: =RC[-29] ->  | AQ50: =RC[-29] ->  | AR50: - | AS50: =RC[-30] ->  | AT50: =RC[-30] ->  | AU50: - | AV50: =RC[-31] -> #VALUE! | AW50: =RC[-31] ->  | AX50: =RC[-31] ->  | AY50: =RC[-31] -> 
A51: =IF(RC[1]="","",DATEVALUE(RC[1])) ->  | C51: 24 | Q51: =RC[-3]-RC[-1] -> #VALUE! | T51: =RC[-1] ->  | U51: =(RC[-17]*RC[-16]-RC[-14]*RC[-13])/1000 -> 0 | X51: =RC[-2]*RC[-10]/1000 -> #VALUE! | Y51: =(RC[-3]*RC[-11]-RC[-2]*RC[-9])/1000 -> #VALUE! | AD51: =VALUE(RC[-28]) -> #VALUE! | AE51: =IF(RC[22]=42,"*",IF(RC[22]=32,"",RC[22])) ->  | AF51: =RC[-29] -> 24 | AG51: =RC[-29] -> 0 | AH51: =RC[-29] -> 0 | AI51: =RC[-29] -> 0 | AJ51: =RC[-29] -> 0 | AK51: =RC[-29] -> 0 | AL51: =RC[-29] -> 0 | AM51: =RC[-29] -> 0 | AN51: =RC[-29] -> 0 | AO51: =RC[-29] -> 0 | AP51: =RC[-29] ->  | AQ51: =RC[-29] ->  | AR51: - | AS51: =RC[-30] ->  | AT51: =RC[-30] ->  | AU51: - | AV51: =RC[-31] -> #VALUE! | AW51: =RC[-31] ->  | AX51: =RC[-31] ->  | AY51: =RC[-31] -> 
A52: =IF(RC[1]="","",DATEVALUE(RC[1])) ->  | C52: 24 | Q52: =RC[-3]-RC[-1] -> #VALUE! | T52: =RC[-1] ->  | U52: =(RC[-17]*RC[-16]-RC[-14]*RC[-13])/1000 -> 0 | X52: =RC[-2]*RC[-10]/1000 -> #VALUE! | Y52: =(RC[-3]*RC[-11]-RC[-2]*RC[-9])/1000 -> #VALUE! | AD52: =VALUE(RC[-28]) -> #VALUE! | AE52: =IF(RC[22]=42,"*",IF(RC[22]=32,"",RC[22])) ->  | AF52: =RC[-29] -> 24 | AG52: =RC[-29] -> 0 | AH52: =RC[-29] -> 0 | AI52: =RC[-29] -> 0 | AJ52: =RC[-29] -> 0 | AK52: =RC[-29] -> 0 | AL52: =RC[-29] -> 0 | AM52: =RC[-29] -> 0 | AN52: =RC[-29] -> 0 | AO52: =RC[-29] -> 0 | AP52: =RC[-29] ->  | AQ52: =RC[-29] ->  | AR52: - | AS52: =RC[-30] ->  | AT52: =RC[-30] ->  | AU52: - | AV52: =RC[-31] -> #VALUE! | AW52: =RC[-31] ->  | AX52: =RC[-31] ->  | AY52: =RC[-31] -> 
A53: =IF(RC[1]="","",DATEVALUE(RC[1])) ->  | C53: 24 | Q53: =RC[-3]-RC[-1] -> #VALUE! | T53: =RC[-1] ->  | U53: =(RC[-17]*RC[-16]-RC[-14]*RC[-13])/1000 -> 0 | X53: =RC[-2]*RC[-10]/1000 -> #VALUE! | Y53: =(RC[-3]*RC[-11]-RC[-2]*RC[-9])/1000 -> #VALUE! | AD53: =VALUE(RC[-28]) -> #VALUE! | AE53: =IF(RC[22]=42,"*",IF(RC[22]=32,"",RC[22])) ->  | AF53: =RC[-29] -> 24 | AG53: =RC[-29] -> 0 | AH53: =RC[-29] -> 0 | AI53: =RC[-29] -> 0 | AJ53: =RC[-29] -> 0 | AK53: =RC[-29] -> 0 | AL53: =RC[-29] -> 0 | AM53: =RC[-29] -> 0 | AN53: =RC[-29] -> 0 | AO53: =RC[-29] -> 0 | AP53: =RC[-29] ->  | AQ53: =RC[-29] ->  | AR53: - | AS53: =RC[-30] ->  | AT53: =RC[-30] ->  | AU53: - | AV53: =RC[-31] -> #VALUE! | AW53: =RC[-31] ->  | AX53: =RC[-31] ->  | AY53: =RC[-31] -> 
A54: =IF(RC[1]="","",DATEVALUE(RC[1])) ->  | C54: 24 | Q54: =RC[-3]-RC[-1] -> #VALUE! | T54: =RC[-1] ->  | U54: =(RC[-17]*RC[-16]-RC[-14]*RC[-13])/1000 -> 0 | X54: =RC[-2]*RC[-10]/1000 -> #VALUE! | Y54: =(RC[-3]*RC[-11]-RC[-2]*RC[-9])/1000 -> #VALUE! | AD54: =VALUE(RC[-28]) -> #VALUE! | AE54: =IF(RC[22]=42,"*",IF(RC[22]=32,"",RC[22])) ->  | AF54: =RC[-29] -> 24 | AG54: =RC[-29] -> 0 | AH54: =RC[-29] -> 0 | AI54: =RC[-29] -> 0 | AJ54: =RC[-29] -> 0 | AK54: =RC[-29] -> 0 | AL54: =RC[-29] -> 0 | AM54: =RC[-29] -> 0 | AN54: =RC[-29] -> 0 | AO54: =RC[-29] -> 0 | AP54: =RC[-29] ->  | AQ54: =RC[-29] ->  | AR54: - | AS54: =RC[-30] ->  | AT54: =RC[-30] ->  | AU54: - | AV54: =RC[-31] -> #VALUE! | AW54: =RC[-31] ->  | AX54: =RC[-31] ->  | AY54: =RC[-31] -> 
A55: =IF(RC[1]="","",DATEVALUE(RC[1])) ->  | C55: 24 | Q55: =RC[-3]-RC[-1] -> #VALUE! | T55: =RC[-1] ->  | U55: =(RC[-17]*RC[-16]-RC[-14]*RC[-13])/1000 -> 0 | X55: =RC[-2]*RC[-10]/1000 -> #VALUE! | Y55: =(RC[-3]*RC[-11]-RC[-2]*RC[-9])/1000 -> #VALUE! | AD55: =VALUE(RC[-28]) -> #VALUE! | AE55: =IF(RC[22]=42,"*",IF(RC[22]=32,"",RC[22])) ->  | AF55: =RC[-29] -> 24 | AG55: =RC[-29] -> 0 | AH55: =RC[-29] -> 0 | AI55: =RC[-29] -> 0 | AJ55: =RC[-29] -> 0 | AK55: =RC[-29] -> 0 | AL55: =RC[-29] -> 0 | AM55: =RC[-29] -> 0 | AN55: =RC[-29] -> 0 | AO55: =RC[-29] -> 0 | AP55: =RC[-29] ->  | AQ55: =RC[-29] ->  | AR55: - | AS55: =RC[-30] ->  | AT55: =RC[-30] ->  | AU55: - | AV55: =RC[-31] -> #VALUE! | AW55: =RC[-31] ->  | AX55: =RC[-31] ->  | AY55: =RC[-31] -> 
A56: =IF(RC[1]="","",DATEVALUE(RC[1])) ->  | C56: 24 | Q56: =RC[-3]-RC[-1] -> #VALUE! | T56: =RC[-1] ->  | U56: =(RC[-17]*RC[-16]-RC[-14]*RC[-13])/1000 -> 0 | X56: =RC[-2]*RC[-10]/1000 -> #VALUE! | Y56: =(RC[-3]*RC[-11]-RC[-2]*RC[-9])/1000 -> #VALUE! | AD56: =VALUE(RC[-28]) -> #VALUE! | AE56: =IF(RC[22]=42,"*",IF(RC[22]=32,"",RC[22])) ->  | AF56: =RC[-29] -> 24 | AG56: =RC[-29] -> 0 | AH56: =RC[-29] -> 0 | AI56: =RC[-29] -> 0 | AJ56: =RC[-29] -> 0 | AK56: =RC[-29] -> 0 | AL56: =RC[-29] -> 0 | AM56: =RC[-29] -> 0 | AN56: =RC[-29] -> 0 | AO56: =RC[-29] -> 0 | AP56: =RC[-29] ->  | AQ56: =RC[-29] ->  | AR56: - | AS56: =RC[-30] ->  | AT56: =RC[-30] ->  | AU56: - | AV56: =RC[-31] -> #VALUE! | AW56: =RC[-31] ->  | AX56: =RC[-31] ->  | AY56: =RC[-31] -> 
A57: =IF(RC[1]="","",DATEVALUE(RC[1])) ->  | C57: 24 | Q57: =RC[-3]-RC[-1] -> #VALUE! | T57: =RC[-1] ->  | U57: =(RC[-17]*RC[-16]-RC[-14]*RC[-13])/1000 -> 0 | X57: =RC[-2]*RC[-10]/1000 -> #VALUE! | Y57: =(RC[-3]*RC[-11]-RC[-2]*RC[-9])/1000 -> #VALUE! | AD57: =VALUE(RC[-28]) -> #VALUE! | AE57: =IF(RC[22]=42,"*",IF(RC[22]=32,"",RC[22])) ->  | AF57: =RC[-29] -> 24 | AG57: =RC[-29] -> 0 | AH57: =RC[-29] -> 0 | AI57: =RC[-29] -> 0 | AJ57: =RC[-29] -> 0 | AK57: =RC[-29] -> 0 | AL57: =RC[-29] -> 0 | AM57: =RC[-29] -> 0 | AN57: =RC[-29] -> 0 | AO57: =RC[-29] -> 0 | AP57: =RC[-29] ->  | AQ57: =RC[-29] ->  | AR57: - | AS57: =RC[-30] ->  | AT57: =RC[-30] ->  | AU57: - | AV57: =RC[-31] -> #VALUE! | AW57: =RC[-31] ->  | AX57: =RC[-31] ->  | AY57: =RC[-31] -> 
A58: =IF(RC[1]="","",DATEVALUE(RC[1])) ->  | C58: 24 | Q58: =RC[-3]-RC[-1] -> #VALUE! | T58: =RC[-1] ->  | U58: =(RC[-17]*RC[-16]-RC[-14]*RC[-13])/1000 -> 0 | X58: =RC[-2]*RC[-10]/1000 -> #VALUE! | Y58: =(RC[-3]*RC[-11]-RC[-2]*RC[-9])/1000 -> #VALUE! | AD58: =VALUE(RC[-28]) -> #VALUE! | AE58: =IF(RC[22]=42,"*",IF(RC[22]=32,"",RC[22])) ->  | AF58: =RC[-29] -> 24 | AG58: =RC[-29] -> 0 | AH58: =RC[-29] -> 0 | AI58: =RC[-29] -> 0 | AJ58: =RC[-29] -> 0 | AK58: =RC[-29] -> 0 | AL58: =RC[-29] -> 0 | AM58: =RC[-29] -> 0 | AN58: =RC[-29] -> 0 | AO58: =RC[-29] -> 0 | AP58: =RC[-29] ->  | AQ58: =RC[-29] ->  | AR58: - | AS58: =RC[-30] ->  | AT58: =RC[-30] ->  | AU58: - | AV58: =RC[-31] -> #VALUE! | AW58: =RC[-31] ->  | AX58: =RC[-31] ->  | AY58: =RC[-31] -> 
A59: =IF(RC[1]="","",DATEVALUE(RC[1])) ->  | C59: 24 | Q59: =RC[-3]-RC[-1] -> #VALUE! | T59: =RC[-1] ->  | U59: =(RC[-17]*RC[-16]-RC[-14]*RC[-13])/1000 -> 0 | X59: =RC[-2]*RC[-10]/1000 -> #VALUE! | Y59: =(RC[-3]*RC[-11]-RC[-2]*RC[-9])/1000 -> #VALUE! | AD59: =VALUE(RC[-28]) -> #VALUE! | AE59: =IF(RC[22]=42,"*",IF(RC[22]=32,"",RC[22])) ->  | AF59: =RC[-29] -> 24 | AG59: =RC[-29] -> 0 | AH59: =RC[-29] -> 0 | AI59: =RC[-29] -> 0 | AJ59: =RC[-29] -> 0 | AK59: =RC[-29] -> 0 | AL59: =RC[-29] -> 0 | AM59: =RC[-29] -> 0 | AN59: =RC[-29] -> 0 | AO59: =RC[-29] -> 0 | AP59: =RC[-29] ->  | AQ59: =RC[-29] ->  | AR59: - | AS59: =RC[-30] ->  | AT59: =RC[-30] ->  | AU59: - | AV59: =RC[-31] -> #VALUE! | AW59: =RC[-31] ->  | AX59: =RC[-31] ->  | AY59: =RC[-31] -> 
A60: =IF(RC[1]="","",DATEVALUE(RC[1])) ->  | C60: 24 | Q60: =RC[-3]-RC[-1] -> #VALUE! | T60: =RC[-1] ->  | U60: =(RC[-17]*RC[-16]-RC[-14]*RC[-13])/1000 -> 0 | X60: =RC[-2]*RC[-10]/1000 -> #VALUE! | Y60: =(RC[-3]*RC[-11]-RC[-2]*RC[-9])/1000 -> #VALUE! | AD60: =VALUE(RC[-28]) -> #VALUE! | AE60: =IF(RC[22]=42,"*",IF(RC[22]=32,"",RC[22])) ->  | AF60: =RC[-29] -> 24 | AG60: =RC[-29] -> 0 | AH60: =RC[-29] -> 0 | AI60: =RC[-29] -> 0 | AJ60: =RC[-29] -> 0 | AK60: =RC[-29] -> 0 | AL60: =RC[-29] -> 0 | AM60: =RC[-29] -> 0 | AN60: =RC[-29] -> 0 | AO60: =RC[-29] -> 0 | AP60: =RC[-29] ->  | AQ60: =RC[-29] ->  | AR60: - | AS60: =RC[-30] ->  | AT60: =RC[-30] ->  | AU60: - | AV60: =RC[-31] -> #VALUE! | AW60: =RC[-31] ->  | AX60: =RC[-31] ->  | AY60: =RC[-31] -> 
A61: =IF(RC[1]="","",DATEVALUE(RC[1])) ->  | C61: 24 | Q61: =RC[-3]-RC[-1] -> #VALUE! | T61: =RC[-1] ->  | U61: =(RC[-17]*RC[-16]-RC[-14]*RC[-13])/1000 -> 0 | X61: =RC[-2]*RC[-10]/1000 -> #VALUE! | Y61: =(RC[-3]*RC[-11]-RC[-2]*RC[-9])/1000 -> #VALUE! | AD61: =VALUE(RC[-28]) -> #VALUE! | AE61: =IF(RC[22]=42,"*",IF(RC[22]=32,"",RC[22])) ->  | AF61: =RC[-29] -> 24 | AG61: =RC[-29] -> 0 | AH61: =RC[-29] -> 0 | AI61: =RC[-29] -> 0 | AJ61: =RC[-29] -> 0 | AK61: =RC[-29] -> 0 | AL61: =RC[-29] -> 0 | AM61: =RC[-29] -> 0 | AN61: =RC[-29] -> 0 | AO61: =RC[-29] -> 0 | AP61: =RC[-29] ->  | AQ61: =RC[-29] ->  | AR61: - | AS61: =RC[-30] ->  | AT61: =RC[-30] ->  | AU61: - | AV61: =RC[-31] -> #VALUE! | AW61: =RC[-31] ->  | AX61: =RC[-31] ->  | AY61: =RC[-31] -> 
A62: =IF(RC[1]="","",DATEVALUE(RC[1])) ->  | C62: 24 | Q62: =RC[-3]-RC[-1] -> #VALUE! | T62: =RC[-1] ->  | U62: =(RC[-17]*RC[-16]-RC[-14]*RC[-13])/1000 -> 0 | X62: =RC[-2]*RC[-10]/1000 -> #VALUE! | Y62: =(RC[-3]*RC[-11]-RC[-2]*RC[-9])/1000 -> #VALUE! | AD62: =VALUE(RC[-28]) -> #VALUE! | AE62: =IF(RC[22]=42,"*",IF(RC[22]=32,"",RC[22])) ->  | AF62: =RC[-29] -> 24 | AG62: =RC[-29] -> 0 | AH62: =RC[-29] -> 0 | AI62: =RC[-29] -> 0 | AJ62: =RC[-29] -> 0 | AK62: =RC[-29] -> 0 | AL62: =RC[-29] -> 0 | AM62: =RC[-29] -> 0 | AN62: =RC[-29] -> 0 | AO62: =RC[-29] -> 0 | AP62: =RC[-29] ->  | AQ62: =RC[-29] ->  | AR62: - | AS62: =RC[-30] ->  | AT62: =RC[-30] ->  | AU62: - | AV62: =RC[-31] -> #VALUE! | AW62: =RC[-31] ->  | AX62: =RC[-31] ->  | AY62: =RC[-31] -> 
A63: =IF(RC[1]="","",DATEVALUE(RC[1])) ->  | C63: 24 | Q63: =RC[-3]-RC[-1] -> #VALUE! | T63: =RC[-1] ->  | U63: =(RC[-17]*RC[-16]-RC[-14]*RC[-13])/1000 -> 0 | X63: =RC[-2]*RC[-10]/1000 -> #VALUE! | Y63: =(RC[-3]*RC[-11]-RC[-2]*RC[-9])/1000 -> #VALUE! | AD63: =VALUE(RC[-28]) -> #VALUE! | AE63: =IF(RC[22]=42,"*",IF(RC[22]=32,"",RC[22])) ->  | AF63: =RC[-29] -> 24 | AG63: =RC[-29] -> 0 | AH63: =RC[-29] -> 0 | AI63: =RC[-29] -> 0 | AJ63: =RC[-29] -> 0 | AK63: =RC[-29] -> 0 | AL63: =RC[-29] -> 0 | AM63: =RC[-29] -> 0 | AN63: =RC[-29] -> 0 | AO63: =RC[-29] -> 0 | AP63: =RC[-29] ->  | AQ63: =RC[-29] ->  | AR63: - | AS63: =RC[-30] ->  | AT63: =RC[-30] ->  | AU63: - | AV63: =RC[-31] -> #VALUE! | AW63: =RC[-31] ->  | AX63: =RC[-31] ->  | AY63: =RC[-31] -> 
A64: =IF(RC[1]="","",DATEVALUE(RC[1])) ->  | C64: 24 | Q64: =RC[-3]-RC[-1] -> #VALUE! | T64: =RC[-1] ->  | U64: =(RC[-17]*RC[-16]-RC[-14]*RC[-13])/1000 -> 0 | X64: =RC[-2]*RC[-10]/1000 -> #VALUE! | Y64: =(RC[-3]*RC[-11]-RC[-2]*RC[-9])/1000 -> #VALUE! | AD64: =VALUE(RC[-28]) -> #VALUE! | AE64: =IF(RC[22]=42,"*",IF(RC[22]=32,"",RC[22])) ->  | AF64: =RC[-29] -> 24 | AG64: =RC[-29] -> 0 | AH64: =RC[-29] -> 0 | AI64: =RC[-29] -> 0 | AJ64: =RC[-29] -> 0 | AK64: =RC[-29] -> 0 | AL64: =RC[-29] -> 0 | AM64: =RC[-29] -> 0 | AN64: =RC[-29] -> 0 | AO64: =RC[-29] -> 0 | AP64: =RC[-29] ->  | AQ64: =RC[-29] ->  | AR64: - | AS64: =RC[-30] ->  | AT64: =RC[-30] ->  | AU64: - | AV64: =RC[-31] -> #VALUE! | AW64: =RC[-31] ->  | AX64: =RC[-31] ->  | AY64: =RC[-31] -> 
A65: =IF(RC[1]="","",DATEVALUE(RC[1])) ->  | C65: 24 | Q65: =RC[-3]-RC[-1] -> #VALUE! | T65: =RC[-1] ->  | U65: =(RC[-17]*RC[-16]-RC[-14]*RC[-13])/1000 -> 0 | X65: =RC[-2]*RC[-10]/1000 -> #VALUE! | Y65: =(RC[-3]*RC[-11]-RC[-2]*RC[-9])/1000 -> #VALUE! | AD65: =VALUE(RC[-28]) -> #VALUE! | AE65: =IF(RC[22]=42,"*",IF(RC[22]=32,"",RC[22])) ->  | AF65: =RC[-29] -> 24 | AG65: =RC[-29] -> 0 | AH65: =RC[-29] -> 0 | AI65: =RC[-29] -> 0 | AJ65: =RC[-29] -> 0 | AK65: =RC[-29] -> 0 | AL65: =RC[-29] -> 0 | AM65: =RC[-29] -> 0 | AN65: =RC[-29] -> 0 | AO65: =RC[-29] -> 0 | AP65: =RC[-29] ->  | AQ65: =RC[-29] ->  | AR65: - | AS65: =RC[-30] ->  | AT65: =RC[-30] ->  | AU65: - | AV65: =RC[-31] -> #VALUE! | AW65: =RC[-31] ->  | AX65: =RC[-31] ->  | AY65: =RC[-31] -> 
A66: =IF(RC[1]="","",DATEVALUE(RC[1])) ->  | C66: 24 | Q66: =RC[-3]-RC[-1] -> #VALUE! | T66: =RC[-1] ->  | U66: =(RC[-17]*RC[-16]-RC[-14]*RC[-13])/1000 -> 0 | X66: =RC[-2]*RC[-10]/1000 -> #VALUE! | Y66: =(RC[-3]*RC[-11]-RC[-2]*RC[-9])/1000 -> #VALUE! | AD66: =VALUE(RC[-28]) -> #VALUE! | AE66: =IF(RC[22]=42,"*",IF(RC[22]=32,"",RC[22])) ->  | AF66: =RC[-29] -> 24 | AG66: =RC[-29] -> 0 | AH66: =RC[-29] -> 0 | AI66: =RC[-29] -> 0 | AJ66: =RC[-29] -> 0 | AK66: =RC[-29] -> 0 | AL66: =RC[-29] -> 0 | AM66: =RC[-29] -> 0 | AN66: =RC[-29] -> 0 | AO66: =RC[-29] -> 0 | AP66: =RC[-29] ->  | AQ66: =RC[-29] ->  | AR66: - | AS66: =RC[-30] ->  | AT66: =RC[-30] ->  | AU66: - | AV66: =RC[-31] -> #VALUE! | AW66: =RC[-31] ->  | AX66: =RC[-31] ->  | AY66: =RC[-31] -> 
A67: =IF(RC[1]="","",DATEVALUE(RC[1])) ->  | C67: 24 | Q67: =RC[-3]-RC[-1] -> #VALUE! | T67: =RC[-1] ->  | U67: =(RC[-17]*RC[-16]-RC[-14]*RC[-13])/1000 -> 0 | X67: =RC[-2]*RC[-10]/1000 -> #VALUE! | Y67: =(RC[-3]*RC[-11]-RC[-2]*RC[-9])/1000 -> #VALUE! | AD67: =VALUE(RC[-28]) -> #VALUE! | AE67: =IF(RC[22]=42,"*",IF(RC[22]=32,"",RC[22])) ->  | AF67: =RC[-29] -> 24 | AG67: =RC[-29] -> 0 | AH67: =RC[-29] -> 0 | AI67: =RC[-29] -> 0 | AJ67: =RC[-29] -> 0 | AK67: =RC[-29] -> 0 | AL67: =RC[-29] -> 0 | AM67: =RC[-29] -> 0 | AN67: =RC[-29] -> 0 | AO67: =RC[-29] -> 0 | AP67: =RC[-29] ->  | AQ67: =RC[-29] ->  | AR67: - | AS67: =RC[-30] ->  | AT67: =RC[-30] ->  | AU67: - | AV67: =RC[-31] -> #VALUE! | AW67: =RC[-31] ->  | AX67: =RC[-31] ->  | AY67: =RC[-31] -> 
A68: =IF(RC[1]="","",DATEVALUE(RC[1])) ->  | C68: 24 | Q68: =RC[-3]-RC[-1] -> #VALUE! | T68: =RC[-1] ->  | U68: =(RC[-17]*RC[-16]-RC[-14]*RC[-13])/1000 -> 0 | X68: =RC[-2]*RC[-10]/1000 -> #VALUE! | Y68: =(RC[-3]*RC[-11]-RC[-2]*RC[-9])/1000 -> #VALUE! | AD68: =VALUE(RC[-28]) -> #VALUE! | AE68: =IF(RC[22]=42,"*",IF(RC[22]=32,"",RC[22])) ->  | AF68: =RC[-29] -> 24 | AG68: =RC[-29] -> 0 | AH68: =RC[-29] -> 0 | AI68: =RC[-29] -> 0 | AJ68: =RC[-29] -> 0 | AK68: =RC[-29] -> 0 | AL68: =RC[-29] -> 0 | AM68: =RC[-29] -> 0 | AN68: =RC[-29] -> 0 | AO68: =RC[-29] -> 0 | AP68: =RC[-29] ->  | AQ68: =RC[-29] ->  | AR68: - | AS68: =RC[-30] ->  | AT68: =RC[-30] ->  | AU68: - | AV68: =RC[-31] -> #VALUE! | AW68: =RC[-31] ->  | AX68: =RC[-31] ->  | AY68: =RC[-31] -> 
A69: =IF(RC[1]="","",DATEVALUE(RC[1])) ->  | C69: 24 | Q69: =RC[-3]-RC[-1] -> #VALUE! | T69: =RC[-1] ->  | U69: =(RC[-17]*RC[-16]-RC[-14]*RC[-13])/1000 -> 0 | X69: =RC[-2]*RC[-10]/1000 -> #VALUE! | Y69: =(RC[-3]*RC[-11]-RC[-2]*RC[-9])/1000 -> #VALUE! | AD69: =VALUE(RC[-28]) -> #VALUE! | AE69: =IF(RC[22]=42,"*",IF(RC[22]=32,"",RC[22])) ->  | AF69: =RC[-29] -> 24 | AG69: =RC[-29] -> 0 | AH69: =RC[-29] -> 0 | AI69: =RC[-29] -> 0 | AJ69: =RC[-29] -> 0 | AK69: =RC[-29] -> 0 | AL69: =RC[-29] -> 0 | AM69: =RC[-29] -> 0 | AN69: =RC[-29] -> 0 | AO69: =RC[-29] -> 0 | AP69: =RC[-29] ->  | AQ69: =RC[-29] ->  | AR69: - | AS69: =RC[-30] ->  | AT69: =RC[-30] ->  | AU69: - | AV69: =RC[-31] -> #VALUE! | AW69: =RC[-31] ->  | AX69: =RC[-31] ->  | AY69: =RC[-31] -> 
A70: =IF(RC[1]="","",DATEVALUE(RC[1])) ->  | C70: 24 | Q70: =RC[-3]-RC[-1] -> #VALUE! | T70: =RC[-1] ->  | U70: =(RC[-17]*RC[-16]-RC[-14]*RC[-13])/1000 -> 0 | X70: =RC[-2]*RC[-10]/1000 -> #VALUE! | Y70: =(RC[-3]*RC[-11]-RC[-2]*RC[-9])/1000 -> #VALUE! | AD70: =VALUE(RC[-28]) -> #VALUE! | AE70: =IF(RC[22]=42,"*",IF(RC[22]=32,"",RC[22])) ->  | AF70: =RC[-29] -> 24 | AG70: =RC[-29] -> 0 | AH70: =RC[-29] -> 0 | AI70: =RC[-29] -> 0 | AJ70: =RC[-29] -> 0 | AK70: =RC[-29] -> 0 | AL70: =RC[-29] -> 0 | AM70: =RC[-29] -> 0 | AN70: =RC[-29] -> 0 | AO70: =RC[-29] -> 0 | AP70: =RC[-29] ->  | AQ70: =RC[-29] ->  | AR70: - | AS70: =RC[-30] ->  | AT70: =RC[-30] ->  | AU70: - | AV70: =RC[-31] -> #VALUE! | AW70: =RC[-31] ->  | AX70: =RC[-31] ->  | AY70: =RC[-31] -> 
A71: =IF(RC[1]="","",DATEVALUE(RC[1])) ->  | C71: 24 | Q71: =RC[-3]-RC[-1] -> #VALUE! | T71: =RC[-1] ->  | U71: =(RC[-17]*RC[-16]-RC[-14]*RC[-13])/1000 -> 0 | X71: =RC[-2]*RC[-10]/1000 -> #VALUE! | Y71: =(RC[-3]*RC[-11]-RC[-2]*RC[-9])/1000 -> #VALUE! | AD71: =VALUE(RC[-28]) -> #VALUE! | AE71: =IF(RC[22]=42,"*",IF(RC[22]=32,"",RC[22])) ->  | AF71: =RC[-29] -> 24 | AG71: =RC[-29] -> 0 | AH71: =RC[-29] -> 0 | AI71: =RC[-29] -> 0 | AJ71: =RC[-29] -> 0 | AK71: =RC[-29] -> 0 | AL71: =RC[-29] -> 0 | AM71: =RC[-29] -> 0 | AN71: =RC[-29] -> 0 | AO71: =RC[-29] -> 0 | AP71: =RC[-29] ->  | AQ71: =RC[-29] ->  | AR71: - | AS71: =RC[-30] ->  | AT71: =RC[-30] ->  | AU71: - | AV71: =RC[-31] -> #VALUE! | AW71: =RC[-31] ->  | AX71: =RC[-31] ->  | AY71: =RC[-31] -> 
A72: =IF(RC[1]="","",DATEVALUE(RC[1])) ->  | C72: 24 | Q72: =RC[-3]-RC[-1] -> #VALUE! | T72: =RC[-1] ->  | U72: =(RC[-17]*RC[-16]-RC[-14]*RC[-13])/1000 -> 0 | X72: =RC[-2]*RC[-10]/1000 -> #VALUE! | Y72: =(RC[-3]*RC[-11]-RC[-2]*RC[-9])/1000 -> #VALUE! | AD72: =VALUE(RC[-28]) -> #VALUE! | AE72: =IF(RC[22]=42,"*",IF(RC[22]=32,"",RC[22])) ->  | AF72: =RC[-29] -> 24 | AG72: =RC[-29] -> 0 | AH72: =RC[-29] -> 0 | AI72: =RC[-29] -> 0 | AJ72: =RC[-29] -> 0 | AK72: =RC[-29] -> 0 | AL72: =RC[-29] -> 0 | AM72: =RC[-29] -> 0 | AN72: =RC[-29] -> 0 | AO72: =RC[-29] -> 0 | AP72: =RC[-29] ->  | AQ72: =RC[-29] ->  | AR72: - | AS72: =RC[-30] ->  | AT72: =RC[-30] ->  | AU72: - | AV72: =RC[-31] -> #VALUE! | AW72: =RC[-31] ->  | AX72: =RC[-31] ->  | AY72: =RC[-31] -> 
A73: =IF(RC[1]="","",DATEVALUE(RC[1])) ->  | C73: 24 | Q73: =RC[-3]-RC[-1] -> #VALUE! | T73: =RC[-1] ->  | U73: =(RC[-17]*RC[-16]-RC[-14]*RC[-13])/1000 -> 0 | X73: =RC[-2]*RC[-10]/1000 -> #VALUE! | Y73: =(RC[-3]*RC[-11]-RC[-2]*RC[-9])/1000 -> #VALUE! | AD73: =VALUE(RC[-28]) -> #VALUE! | AE73: =IF(RC[22]=42,"*",IF(RC[22]=32,"",RC[22])) ->  | AF73: =RC[-29] -> 24 | AG73: =RC[-29] -> 0 | AH73: =RC[-29] -> 0 | AI73: =RC[-29] -> 0 | AJ73: =RC[-29] -> 0 | AK73: =RC[-29] -> 0 | AL73: =RC[-29] -> 0 | AM73: =RC[-29] -> 0 | AN73: =RC[-29] -> 0 | AO73: =RC[-29] -> 0 | AP73: =RC[-29] ->  | AQ73: =RC[-29] ->  | AR73: - | AS73: =RC[-30] ->  | AT73: =RC[-30] ->  | AU73: - | AV73: =RC[-31] -> #VALUE! | AW73: =RC[-31] ->  | AX73: =RC[-31] ->  | AY73: =RC[-31] -> 
A74: =IF(RC[1]="","",DATEVALUE(RC[1])) ->  | C74: 24 | Q74: =RC[-3]-RC[-1] -> #VALUE! | T74: =RC[-1] ->  | U74: =(RC[-17]*RC[-16]-RC[-14]*RC[-13])/1000 -> 0 | X74: =RC[-2]*RC[-10]/1000 -> #VALUE! | Y74: =(RC[-3]*RC[-11]-RC[-2]*RC[-9])/1000 -> #VALUE! | AD74: =VALUE(RC[-28]) -> #VALUE! | AE74: =IF(RC[22]=42,"*",IF(RC[22]=32,"",RC[22])) ->  | AF74: =RC[-29] -> 24 | AG74: =RC[-29] -> 0 | AH74: =RC[-29] -> 0 | AI74: =RC[-29] -> 0 | AJ74: =RC[-29] -> 0 | AK74: =RC[-29] -> 0 | AL74: =RC[-29] -> 0 | AM74: =RC[-29] -> 0 | AN74: =RC[-29] -> 0 | AO74: =RC[-29] -> 0 | AP74: =RC[-29] ->  | AQ74: =RC[-29] ->  | AR74: - | AS74: =RC[-30] ->  | AT74: =RC[-30] ->  | AU74: - | AV74: =RC[-31] -> #VALUE! | AW74: =RC[-31] ->  | AX74: =RC[-31] ->  | AY74: =RC[-31] -> 
A75: =IF(RC[1]="","",DATEVALUE(RC[1])) ->  | C75: 24 | Q75: =RC[-3]-RC[-1] -> #VALUE! | T75: =RC[-1] ->  | U75: =(RC[-17]*RC[-16]-RC[-14]*RC[-13])/1000 -> 0 | X75: =RC[-2]*RC[-10]/1000 -> #VALUE! | Y75: =(RC[-3]*RC[-11]-RC[-2]*RC[-9])/1000 -> #VALUE! | AD75: =VALUE(RC[-28]) -> #VALUE! | AE75: =IF(RC[22]=42,"*",IF(RC[22]=32,"",RC[22])) ->  | AF75: =RC[-29] -> 24 | AG75: =RC[-29] -> 0 | AH75: =RC[-29] -> 0 | AI75: =RC[-29] -> 0 | AJ75: =RC[-29] -> 0 | AK75: =RC[-29] -> 0 | AL75: =RC[-29] -> 0 | AM75: =RC[-29] -> 0 | AN75: =RC[-29] -> 0 | AO75: =RC[-29] -> 0 | AP75: =RC[-29] ->  | AQ75: =RC[-29] ->  | AR75: - | AS75: =RC[-30] ->  | AT75: =RC[-30] ->  | AU75: - | AV75: =RC[-31] -> #VALUE! | AW75: =RC[-31] ->  | AX75: =RC[-31] ->  | AY75: =RC[-31] -> 
A76: =IF(RC[1]="","",DATEVALUE(RC[1])) ->  | C76: 24 | Q76: =RC[-3]-RC[-1] -> #VALUE! | T76: =RC[-1] ->  | U76: =(RC[-17]*RC[-16]-RC[-14]*RC[-13])/1000 -> 0 | X76: =RC[-2]*RC[-10]/1000 -> #VALUE! | Y76: =(RC[-3]*RC[-11]-RC[-2]*RC[-9])/1000 -> #VALUE! | AD76: =VALUE(RC[-28]) -> #VALUE! | AE76: =IF(RC[22]=42,"*",IF(RC[22]=32,"",RC[22])) ->  | AF76: =RC[-29] -> 24 | AG76: =RC[-29] -> 0 | AH76: =RC[-29] -> 0 | AI76: =RC[-29] -> 0 | AJ76: =RC[-29] -> 0 | AK76: =RC[-29] -> 0 | AL76: =RC[-29] -> 0 | AM76: =RC[-29] -> 0 | AN76: =RC[-29] -> 0 | AO76: =RC[-29] -> 0 | AP76: =RC[-29] ->  | AQ76: =RC[-29] ->  | AR76: - | AS76: =RC[-30] ->  | AT76: =RC[-30] ->  | AU76: - | AV76: =RC[-31] -> #VALUE! | AW76: =RC[-31] ->  | AX76: =RC[-31] ->  | AY76: =RC[-31] -> 
A77: =IF(RC[1]="","",DATEVALUE(RC[1])) ->  | C77: 24 | Q77: =RC[-3]-RC[-1] -> #VALUE! | T77: =RC[-1] ->  | U77: =(RC[-17]*RC[-16]-RC[-14]*RC[-13])/1000 -> 0 | X77: =RC[-2]*RC[-10]/1000 -> #VALUE! | Y77: =(RC[-3]*RC[-11]-RC[-2]*RC[-9])/1000 -> #VALUE! | AD77: =VALUE(RC[-28]) -> #VALUE! | AE77: =IF(RC[22]=42,"*",IF(RC[22]=32,"",RC[22])) ->  | AF77: =RC[-29] -> 24 | AG77: =RC[-29] -> 0 | AH77: =RC[-29] -> 0 | AI77: =RC[-29] -> 0 | AJ77: =RC[-29] -> 0 | AK77: =RC[-29] -> 0 | AL77: =RC[-29] -> 0 | AM77: =RC[-29] -> 0 | AN77: =RC[-29] -> 0 | AO77: =RC[-29] -> 0 | AP77: =RC[-29] ->  | AQ77: =RC[-29] ->  | AR77: - | AS77: =RC[-30] ->  | AT77: =RC[-30] ->  | AU77: - | AV77: =RC[-31] -> #VALUE! | AW77: =RC[-31] ->  | AX77: =RC[-31] ->  | AY77: =RC[-31] -> 
A78: =IF(RC[1]="","",DATEVALUE(RC[1])) ->  | C78: 24 | Q78: =RC[-3]-RC[-1] -> #VALUE! | T78: =RC[-1] ->  | U78: =(RC[-17]*RC[-16]-RC[-14]*RC[-13])/1000 -> 0 | X78: =RC[-2]*RC[-10]/1000 -> #VALUE! | Y78: =(RC[-3]*RC[-11]-RC[-2]*RC[-9])/1000 -> #VALUE! | AD78: =VALUE(RC[-28]) -> #VALUE! | AE78: =IF(RC[22]=42,"*",IF(RC[22]=32,"",RC[22])) ->  | AF78: =RC[-29] -> 24 | AG78: =RC[-29] -> 0 | AH78: =RC[-29] -> 0 | AI78: =RC[-29] -> 0 | AJ78: =RC[-29] -> 0 | AK78: =RC[-29] -> 0 | AL78: =RC[-29] -> 0 | AM78: =RC[-29] -> 0 | AN78: =RC[-29] -> 0 | AO78: =RC[-29] -> 0 | AP78: =RC[-29] ->  | AQ78: =RC[-29] ->  | AR78: - | AS78: =RC[-30] ->  | AT78: =RC[-30] ->  | AU78: - | AV78: =RC[-31] -> #VALUE! | AW78: =RC[-31] ->  | AX78: =RC[-31] ->  | AY78: =RC[-31] -> 
A79: =IF(RC[1]="","",DATEVALUE(RC[1])) ->  | C79: 24 | Q79: =RC[-3]-RC[-1] -> #VALUE! | T79: =RC[-1] ->  | U79: =(RC[-17]*RC[-16]-RC[-14]*RC[-13])/1000 -> 0 | X79: =RC[-2]*RC[-10]/1000 -> #VALUE! | Y79: =(RC[-3]*RC[-11]-RC[-2]*RC[-9])/1000 -> #VALUE! | AD79: =VALUE(RC[-28]) -> #VALUE! | AE79: =IF(RC[22]=42,"*",IF(RC[22]=32,"",RC[22])) ->  | AF79: =RC[-29] -> 24 | AG79: =RC[-29] -> 0 | AH79: =RC[-29] -> 0 | AI79: =RC[-29] -> 0 | AJ79: =RC[-29] -> 0 | AK79: =RC[-29] -> 0 | AL79: =RC[-29] -> 0 | AM79: =RC[-29] -> 0 | AN79: =RC[-29] -> 0 | AO79: =RC[-29] -> 0 | AP79: =RC[-29] ->  | AQ79: =RC[-29] ->  | AR79: - | AS79: =RC[-30] ->  | AT79: =RC[-30] ->  | AU79: - | AV79: =RC[-31] -> #VALUE! | AW79: =RC[-31] ->  | AX79: =RC[-31] ->  | AY79: =RC[-31] -> 
A80: =IF(RC[1]="","",DATEVALUE(RC[1])) ->  | C80: 24 | Q80: =RC[-3]-RC[-1] -> #VALUE! | T80: =RC[-1] ->  | U80: =(RC[-17]*RC[-16]-RC[-14]*RC[-13])/1000 -> 0 | X80: =RC[-2]*RC[-10]/1000 -> #VALUE! | Y80: =(RC[-3]*RC[-11]-RC[-2]*RC[-9])/1000 -> #VALUE! | AD80: =VALUE(RC[-28]) -> #VALUE! | AE80: =IF(RC[22]=42,"*",IF(RC[22]=32,"",RC[22])) ->  | AF80: =RC[-29] -> 24 | AG80: =RC[-29] -> 0 | AH80: =RC[-29] -> 0 | AI80: =RC[-29] -> 0 | AJ80: =RC[-29] -> 0 | AK80: =RC[-29] -> 0 | AL80: =RC[-29] -> 0 | AM80: =RC[-29] -> 0 | AN80: =RC[-29] -> 0 | AO80: =RC[-29] -> 0 | AP80: =RC[-29] ->  | AQ80: =RC[-29] ->  | AR80: - | AS80: =RC[-30] ->  | AT80: =RC[-30] ->  | AU80: - | AV80: =RC[-31] -> #VALUE! | AW80: =RC[-31] ->  | AX80: =RC[-31] ->  | AY80: =RC[-31] -> 
A81: =IF(RC[1]="","",DATEVALUE(RC[1])) ->  | C81: 24 | Q81: =RC[-3]-RC[-1] -> #VALUE! | T81: =RC[-1] ->  | U81: =(RC[-17]*RC[-16]-RC[-14]*RC[-13])/1000 -> 0 | X81: =RC[-2]*RC[-10]/1000 -> #VALUE! | Y81: =(RC[-3]*RC[-11]-RC[-2]*RC[-9])/1000 -> #VALUE! | AD81: =VALUE(RC[-28]) -> #VALUE! | AE81: =IF(RC[22]=42,"*",IF(RC[22]=32,"",RC[22])) ->  | AF81: =RC[-29] -> 24 | AG81: =RC[-29] -> 0 | AH81: =RC[-29] -> 0 | AI81: =RC[-29] -> 0 | AJ81: =RC[-29] -> 0 | AK81: =RC[-29] -> 0 | AL81: =RC[-29] -> 0 | AM81: =RC[-29] -> 0 | AN81: =RC[-29] -> 0 | AO81: =RC[-29] -> 0 | AP81: =RC[-29] ->  | AQ81: =RC[-29] ->  | AR81: - | AS81: =RC[-30] ->  | AT81: =RC[-30] ->  | AU81: - | AV81: =RC[-31] -> #VALUE! | AW81: =RC[-31] ->  | AX81: =RC[-31] ->  | AY81: =RC[-31] -> 
A82: =IF(RC[1]="","",DATEVALUE(RC[1])) ->  | C82: 24 | Q82: =RC[-3]-RC[-1] -> #VALUE! | T82: =RC[-1] ->  | U82: =(RC[-17]*RC[-16]-RC[-14]*RC[-13])/1000 -> 0 | X82: =RC[-2]*RC[-10]/1000 -> #VALUE! | Y82: =(RC[-3]*RC[-11]-RC[-2]*RC[-9])/1000 -> #VALUE! | AD82: =VALUE(RC[-28]) -> #VALUE! | AE82: =IF(RC[22]=42,"*",IF(RC[22]=32,"",RC[22])) ->  | AF82: =RC[-29] -> 24 | AG82: =RC[-29] -> 0 | AH82: =RC[-29] -> 0 | AI82: =RC[-29] -> 0 | AJ82: =RC[-29] -> 0 | AK82: =RC[-29] -> 0 | AL82: =RC[-29] -> 0 | AM82: =RC[-29] -> 0 | AN82: =RC[-29] -> 0 | AO82: =RC[-29] -> 0 | AP82: =RC[-29] ->  | AQ82: =RC[-29] ->  | AR82: - | AS82: =RC[-30] ->  | AT82: =RC[-30] ->  | AU82: - | AV82: =RC[-31] -> #VALUE! | AW82: =RC[-31] ->  | AX82: =RC[-31] ->  | AY82: =RC[-31] -> 
A83: =IF(RC[1]="","",DATEVALUE(RC[1])) ->  | C83: 24 | Q83: =RC[-3]-RC[-1] -> #VALUE! | T83: =RC[-1] ->  | U83: =(RC[-17]*RC[-16]-RC[-14]*RC[-13])/1000 -> 0 | X83: =RC[-2]*RC[-10]/1000 -> #VALUE! | Y83: =(RC[-3]*RC[-11]-RC[-2]*RC[-9])/1000 -> #VALUE! | AD83: =VALUE(RC[-28]) -> #VALUE! | AE83: =IF(RC[22]=42,"*",IF(RC[22]=32,"",RC[22])) ->  | AF83: =RC[-29] -> 24 | AG83: =RC[-29] -> 0 | AH83: =RC[-29] -> 0 | AI83: =RC[-29] -> 0 | AJ83: =RC[-29] -> 0 | AK83: =RC[-29] -> 0 | AL83: =RC[-29] -> 0 | AM83: =RC[-29] -> 0 | AN83: =RC[-29] -> 0 | AO83: =RC[-29] -> 0 | AP83: =RC[-29] ->  | AQ83: =RC[-29] ->  | AR83: - | AS83: =RC[-30] ->  | AT83: =RC[-30] ->  | AU83: - | AV83: =RC[-31] -> #VALUE! | AW83: =RC[-31] ->  | AX83: =RC[-31] ->  | AY83: =RC[-31] -> 
AD84: Среднее | AG84: =R[1]C[-29] -> 0 | AH84: =R[1]C[-29] -> 0 | AI84: =R[1]C[-29] -> 0 | AJ84: =R[1]C[-29] -> 0 | AK84: =R[1]C[-29] -> 0 | AL84: =R[1]C[-29] -> 0 | AM84: =R[1]C[-29] -> 0 | AN84: =R[1]C[-29] -> 0 | AP84: =R[1]C[-29] -> 249.72645161290325 | AQ84: =R[1]C[-29] -> 67.644193548387079 | AS84: =R[1]C[-30] -> 171.48354838709676 | AT84: =R[1]C[-30] -> 54.243870967741927 | AU84: - | AV84: =R[1]C[-31] -> 13.400322580645152
B85: Среднее | M85: =AVERAGE(OFFSET(R[-74]C,3,0,R7C1,1)) -> 249.72645161290325 | N85: =IF(SUM(OFFSET(R[-74]C,3,0,R7C1,1))=0,0,AVERAGE(OFFSET(R[-74]C,3,0,R7C1,1))) -> 67.644193548387079 | O85: =AVERAGE(OFFSET(R[-74]C,3,0,R7C1,1)) -> 171.48354838709676 | P85: =IF(SUM(OFFSET(R[-74]C,3,0,R7C1,1))=0,0,AVERAGE(OFFSET(R[-74]C,3,0,R7C1,1))) -> 54.243870967741927 | Q85: =RC[-3]-RC[-1] -> 13.400322580645152 | R85: =AVERAGE(OFFSET(R[-74]C,3,0,R7C1,1)) -> 78.242903225806458 | S85: =AVERAGE(OFFSET(R[-74]C,3,0,R7C1,1)) -> 7.3581935483870993 | T85: =AVERAGE(OFFSET(R[-74]C,3,0,R7C1,1)) -> 7.3581935483870993 | U85: =AVERAGE(OFFSET(R[-74]C,3,0,R7C1,1)) -> 0 | X85: =AVERAGE(OFFSET(R[-74]C,3,0,R7C1,1)) -> #VALUE! | Y85: =AVERAGE(OFFSET(R[-74]C,3,0,R7C1,1)) -> #VALUE! | AD85: Итого | AF85: =R[1]C[-29] -> 744 | AG85: =R[1]C[-29] -> 0 | AJ85: =R[1]C[-29] -> 0 | AN85: =R[1]C[-29] -> 0 | AO85: =R[1]C[-29] -> 0 | AP85: =R[1]C[-29] -> 7741.52 | AS85: =R[1]C[-30] -> 5315.99 | AW85: =R[1]C[-31] -> 2425.5300000000002 | AX85: =R[1]C[-31] -> 228.10400000000007 | AY85: =R[1]C[-31] -> 228.10400000000007
B86: ИТОГО: | C86: =SUM(OFFSET(R[-75]C,3,0,R7C1,1)) -> 744 | M86: =SUM(OFFSET(R[-75]C,3,0,R7C1,1)) -> 7741.52 | O86: =SUM(OFFSET(R[-75]C,3,0,R7C1,1)) -> 5315.99 | R86: =SUM(OFFSET(R[-75]C,3,0,R7C1,1)) -> 2425.5300000000002 | S86: =SUM(OFFSET(R[-75]C,3,0,R7C1,1)) -> 228.10400000000007 | T86: =SUM(OFFSET(R[-75]C,3,0,R7C1,1)) -> 228.10400000000007 | U86: =SUM(OFFSET(R[-75]C,3,0,R7C1,1)) -> 0 | X86: =SUM(OFFSET(R[-75]C,3,0,R7C1,1)) -> #VALUE! | Y86: =SUM(OFFSET(R[-75]C,3,0,R7C1,1)) -> #VALUE!
AD87: Досчёт по среднему до конца месяца | AG87: =R[1]C[-29] -> 0 | AJ87: =R[1]C[-29] -> 0 | AN87: =R[1]C[-29] -> 0 | AO87: =R[1]C[-29] -> 0 | AP87: =R[1]C[-29] -> 0 | AS87: =R[1]C[-30] -> 0 | AW87: =R[1]C[-31] -> 0 | AX87: =R[1]C[-31] -> 0 | AY87: =R[1]C[-31] -> 0
A88: 11дн=264ч 4дн=96ч | B88: Досчёт до конца м-ца (+) | C88: =R[-82]C[-2]*24 -> 192 | M88: 0 | O88: 0 | R88: 0 | S88: 0 | T88: 0 | U88: № 49517 | AD88: Снятие досчёта по среднему предыдущего отчёта | AG88: =-R[1]C[-29] -> 0 | AJ88: =-R[1]C[-29] -> 0 | AN88: =-R[1]C[-29] -> 0 | AO88: =-R[1]C[-29] -> 0 | AP88: =-R[1]C[-29] -> 0 | AS88: =-R[1]C[-30] -> 0 | AW88: =-R[1]C[-31] -> 0 | AX88: =-R[1]C[-31] -> 0 | AY88: =-R[1]C[-31] -> 0
A89: 9дн=216ч 7дн=168ч | B89: Вычет с предыдущего (-) | C89: =R[-85]C[-2]*24 -> 216 | AD89: Сумма: | AG89: =R[1]C[-29] -> 0 | AJ89: =R[1]C[-29] -> 0 | AN89: =R[1]C[-29] -> 0 | AO89: =R[1]C[-29] -> 0 | AP89: =R[1]C[-29] -> 7741.52 | AS89: =R[1]C[-30] -> 5315.99 | AW89: =R[1]C[-31] -> 2425.5300000000002 | AX89: =R[1]C[-31] -> 228.10400000000007 | AY89: =R[1]C[-31] -> 228.10400000000007
B90: СУММА: | C90: =R[-4]C+R[-2]C-R[-1]C -> 720 | M90: =R[-4]C+R[-2]C-R[-1]C -> 7741.52 | O90: =R[-4]C+R[-2]C-R[-1]C -> 5315.99 | R90: =R[-4]C+R[-2]C-R[-1]C -> 2425.5300000000002 | S90: =R[-4]C+R[-2]C-R[-1]C -> 228.10400000000007 | T90: =R[-4]C+R[-2]C-R[-1]C -> 228.10400000000007 | AD90: Тхв на источнике | AE90: 0 | AF90: V гвс (м3) | AG90: =R[-1]C[16] -> 2425.5300000000002 | AH90: W гвс (Гкал) | AI90: =RC[-2]*0.06 -> 145.5318 | AJ90: W без гвс (Гкал) | AK90: =R[-1]C[4] -> 0
AD91: =R[-90]C[-17] -> Письмо
B93: Дата, время | D93: М1, т | F93: М2, т | H93: М3, т | J93: М4, т | L93: Qо, Гкал | N93: Qг, Гкал | P93: время, час
B94: 24.08.18 02:00 | D94: 158377.21 | F94: 156724.72 | H94: 169483.36 | J94: 169352.31 | L94: 3000.5219999999999 | N94: 2886.9140000000002 | P94: -
B95: 19.09.18 01:00 | D95: 162249.04999999999 | F95: 160417.03 | H95: 176409.48 | J95: 175379.33 | L95: 3040.989 | N95: 2941.0749999999998 | P95: -
B98: Представитель потредителя:_______________________________________________________ В.О. Топорков
I101: Рекомендуемые значения по параметрам теплопотребления (не являются официально утверждёнными)
I102: М, т | J102: V, м3 | K102: Qгвс, Гкал | L102: Qотоп, Гкал | M102: Qо, Гкал
I103: =R[-13]C[6] -> 5315.99 | J103: =RC[-1]/0.98 -> 5424.4795918367345 | K103: =R[-13]C[8] -> 228.10400000000007 | L103: =R[-13]C -> 0 | M103: =R[-6]C[2] -> 0
P105: ДЛЯ САМОКОНТРОЛЯ
B106: В строке выбора дат указать период с 16.7.13 по 23.8.13 - жильё | O106: Qo | Q106: Qг
B107: В строке выбора дат указать период с 18.7.13 по 25.8.13 - не жилое | O107: =((R[-21]C[-11]*R[-22]C[-8])-(R[-21]C[-10]*R[-22]C[-7]))/1000 -> 0 | Q107: =IF(R[-22]C[-3]="",R[-21]C[-4]*R[-22]C[-1]/1000,"") ->  | R107: Си4
Q108: =IF(R[-23]C[-3]="","",((R[-22]C[-4]*R[-23]C[-1])-(R[-22]C[-3]*R[-23]C[1]))/1000) -> 419.93001197419352 | R108: Си5