Sheet: Лист1
G1: Отчёт о теплопотреблении за октябрь 2018 | M1: з.н д. №02/147-2783 от 04.10.18 В данном отчете ГВС суммируется
A4: =EOMONTH(R[9]C,0)-R[9]C -> 8 | B4: Потребитель: ЗАО "Сити Сервис"
A5: =MAX(R[9]C:R[78]C) -> 2018-10-22T00:00:00.000 | B5: Адрес: г. СПб, Кораблестроителей ул., д.29 к.5 ИТП 1
A6: =EOMONTH(R[-1]C,0)-R[-1]C -> 9 | B6: Телефон: 8-911-021-19-79
A7: =R[-2]C-R[6]C -> 30 | B7: Договор 10023-2 (.) 326
A8: 7 | B8: Тепловычислитель: СПТ-943 № 10060 | L8: М2 мах= | M8: 114 | O8: Мгвс мах= | P8: 27.36
L9: Qотоп мах= | M9: 9.12 | O9: Qгвс мах= | P9: 1.642
B10: Расчётная формула: Q=M1*(h1-h2)+(M1-M2)*(h2-hхв)
D12: Учет | L12: Контроль
A13: =R[1]C[1]-1 -> 2018-09-22T00:00:00.000 | B13: Дата | C13: N, ч | D13: M1, т | E13: T1, С | F13: P1, кг/см2 | G13: M2, т | H13: T2, С | I13: P2, кг/см2 | J13: dT, С | K13: M1-М2, т | L13: V3, м3 | M13: T3, С | N13: V4, м3 | O13: =IF(R[-12]C[-14]="м.куб","","T4, С") -> T4, С | P13: dT, С | Q13: V3+V4, м3 | R13: Qгвс, Гкал | S13: Qобщ., Гкал | T13: Q | U13: M3 | V13: M4 | W13: си2 | X13: си3 | Y13: Разб. | Z13: dM2 | AC13: Дата | AD13: НС | AE13: n, ч | AF13: М1, т | AG13: t1, гр. С | AH13: Р1, кгс/см2 | AI13: М2, т | AJ13: t2, гр. С | AK13: Р2, кгс/см2 | AL13: t1-t2, гр. С | AM13: М1-М2, т | AN13: М1гвс, т | AO13: t1гвс, гр. С | AP13: Р1гвс, кгс/см2 | AQ13: М2гвс, т | AR13: t2гвс, гр. С | AS13: Р2гвс, кгс/см2 | AT13: t1гвс-t2гвс | AU13: М1гвс-М2гвс, т | AV13: Wгвс, Гкал | AW13: Wсумм, Гкал | AY13: NS_TV1 | AZ13: НС | BA13: NS_TV2
A14: =IF(RC[1]="","",DATEVALUE(RC[1])) -> 43366 | B14: 23.09.18 | C14: 24 | D14: 156.41134600000001 | E14: 70.819794000000002 | F14: 7.418812 | G14: 146.39897199999999 | H14: 70.724663000000007 | I14: 4.2189420000000002 | J14: =RC[-5]-RC[-2] -> 9.513099999999497E-2 | K14: 10.154228 | L14: 6.8881329999999998 | M14: 70.188064999999995 | N14: 3.2248329999999998 | O14: 68.294669999999996 | P14: =IF(AND(ISNUMBER(RC[-3]),ISNUMBER(RC[-1])),RC[-3]-RC[-1],"-") -> 1.8933949999999982 | Q14: 10.112966 | R14: 0.68890700000000005 | S14: =RC[-1] -> 0.68890700000000005 | T14: =(RC[-16]*RC[-15]-RC[-13]*RC[-12])/1000 -> 0.72300134473628896 | U14: 6.7360009999999999 | V14: 3.157006 | W14: =RC[-2]*RC[-10]/1000 -> 0.47278687602806496 | X14: =ABS((RC[-3]*RC[-11]-RC[-2]*RC[-9])/1000) -> 0.25718019307004497 | Y14: =(RC[-14]-RC[1])/RC[-18]*100 -> 0.17843089772515552 | Z14: =RC[-5]+RC[-4] -> 9.8930070000000008 | AC14: =VALUE(RC[-27]) -> 2018-09-23T00:00:00.000 | AD14: =IF(RC[21]=42,"*",IF(RC[21]=32,"",RC[21])) -> - | AE14: =RC[-28] -> 24 | AF14: =RC[-28] -> 156.41134600000001 | AG14: =RC[-28] -> 70.819794000000002 | AH14: =RC[-28] -> 7.418812 | AI14: =RC[-28] -> 146.39897199999999 | AJ14: =RC[-28] -> 70.724663000000007 | AK14: =RC[-28] -> 4.2189420000000002 | AL14: =RC[-28] -> 9.513099999999497E-2 | AM14: =RC[-28] -> 10.154228 | AN14: =RC[-28] -> 6.8881329999999998 | AO14: =RC[-28] -> 70.188064999999995 | AP14: - | AQ14: =RC[-29] -> 3.2248329999999998 | AR14: =RC[-29] -> 68.294669999999996 | AS14: - | AT14: =RC[-30] -> 1.8933949999999982 | AU14: =RC[-30] -> 10.112966 | AV14: =RC[-30] -> 0.68890700000000005 | AW14: =RC[-30] -> 0.68890700000000005 | AY14: - | AZ14: - | BA14: -
A15: =IF(RC[1]="","",DATEVALUE(RC[1])) -> 43367 | B15: 24.09.18 | C15: 24 | D15: 144.040604 | E15: 69.710746999999998 | F15: 7.5152669999999997 | G15: 134.94302400000001 | H15: 69.603774999999999 | I15: 4.7129209999999997 | J15: =RC[-5]-RC[-2] -> 0.10697199999999896 | K15: 9.1580779999999997 | L15: 6.672021 | M15: 68.955185 | N15: 2.4835669999999999 | O15: 66.629868000000002 | P15: =IF(AND(ISNUMBER(RC[-3]),ISNUMBER(RC[-1])),RC[-3]-RC[-1],"-") -> 2.3253169999999983 | Q15: 9.1555879999999998 | R15: 0.61284000000000005 | S15: =RC[-1] -> 0.61284000000000005 | T15: =(RC[-16]*RC[-15]-RC[-13]*RC[-12])/1000 -> 0.64863422285558592 | U15: 6.5293450000000002 | V15: 2.433624 | W15: =RC[-2]*RC[-10]/1000 -> 0.450232192403825 | X15: =ABS((RC[-3]*RC[-11]-RC[-2]*RC[-9])/1000) -> 0.28808014652219299 | Y15: =(RC[-14]-RC[1])/RC[-18]*100 -> 0.14458620699058783 | Z15: =RC[-5]+RC[-4] -> 8.9629690000000011 | AC15: =VALUE(RC[-27]) -> 2018-09-24T00:00:00.000 | AD15: =IF(RC[21]=42,"*",IF(RC[21]=32,"",RC[21])) -> - | AE15: =RC[-28] -> 24 | AF15: =RC[-28] -> 144.040604 | AG15: =RC[-28] -> 69.710746999999998 | AH15: =RC[-28] -> 7.5152669999999997 | AI15: =RC[-28] -> 134.94302400000001 | AJ15: =RC[-28] -> 69.603774999999999 | AK15: =RC[-28] -> 4.7129209999999997 | AL15: =RC[-28] -> 0.10697199999999896 | AM15: =RC[-28] -> 9.1580779999999997 | AN15: =RC[-28] -> 6.672021 | AO15: =RC[-28] -> 68.955185 | AP15: - | AQ15: =RC[-29] -> 2.4835669999999999 | AR15: =RC[-29] -> 66.629868000000002 | AS15: - | AT15: =RC[-30] -> 2.3253169999999983 | AU15: =RC[-30] -> 9.1555879999999998 | AV15: =RC[-30] -> 0.61284000000000005 | AW15: =RC[-30] -> 0.61284000000000005 | AY15: - | AZ15: - | BA15: -
A16: =IF(RC[1]="","",DATEVALUE(RC[1])) -> 43368 | B16: 25.09.18 | C16: 24 | D16: 131.015839 | E16: 68.316695999999993 | F16: 7.5951909999999998 | G16: 120.63056899999999 | H16: 58.837699999999998 | I16: 5.455463 | J16: =RC[-5]-RC[-2] -> 9.4789959999999951 | K16: 10.413372000000001 | L16: 6.922911 | M16: 67.373069999999998 | N16: 2.9640550000000001 | O16: 65.408524 | P16: =IF(AND(ISNUMBER(RC[-3]),ISNUMBER(RC[-1])),RC[-3]-RC[-1],"-") -> 1.9645459999999986 | Q16: 9.8869659999999993 | R16: 0.64744299999999999 | S16: 3.3182160000000001 | T16: =(RC[-16]*RC[-15]-RC[-13]*RC[-12])/1000 -> 1.8529440144966429 | U16: 6.7809869999999997 | V16: 2.906463 | W16: =RC[-2]*RC[-10]/1000 -> 0.45685591182008994 | X16: =ABS((RC[-3]*RC[-11]-RC[-2]*RC[-9])/1000) -> 0.26674845692947791 | Y16: =(RC[-14]-RC[1])/RC[-18]*100 -> 0.6017728391880508 | Z16: =RC[-5]+RC[-4] -> 9.6874500000000001 | AC16: =VALUE(RC[-27]) -> 2018-09-25T00:00:00.000 | AD16: =IF(RC[21]=42,"*",IF(RC[21]=32,"",RC[21])) -> - | AE16: =RC[-28] -> 24 | AF16: =RC[-28] -> 131.015839 | AG16: =RC[-28] -> 68.316695999999993 | AH16: =RC[-28] -> 7.5951909999999998 | AI16: =RC[-28] -> 120.63056899999999 | AJ16: =RC[-28] -> 58.837699999999998 | AK16: =RC[-28] -> 5.455463 | AL16: =RC[-28] -> 9.4789959999999951 | AM16: =RC[-28] -> 10.413372000000001 | AN16: =RC[-28] -> 6.922911 | AO16: =RC[-28] -> 67.373069999999998 | AP16: - | AQ16: =RC[-29] -> 2.9640550000000001 | AR16: =RC[-29] -> 65.408524 | AS16: - | AT16: =RC[-30] -> 1.9645459999999986 | AU16: =RC[-30] -> 9.8869659999999993 | AV16: =RC[-30] -> 0.64744299999999999 | AW16: =RC[-30] -> 3.3182160000000001 | AY16: - | AZ16: - | BA16: -
A17: =IF(RC[1]="","",DATEVALUE(RC[1])) -> 43369 | B17: 26.09.18 | C17: 24 | D17: 128.009445 | E17: 67.810683999999995 | F17: 7.4915580000000004 | G17: 117.03104399999999 | H17: 45.664326000000003 | I17: 5.473859 | J17: =RC[-5]-RC[-2] -> 22.146357999999992 | K17: 11.016045999999999 | L17: 6.8552559999999998 | M17: 66.786949000000007 | N17: 3.1650999999999998 | O17: 64.875183000000007 | P17: =IF(AND(ISNUMBER(RC[-3]),ISNUMBER(RC[-1])),RC[-3]-RC[-1],"-") -> 1.9117660000000001 | Q17: 10.020356 | R17: 0.65049400000000002 | S17: 3.3432599999999999 | T17: =(RC[-16]*RC[-15]-RC[-13]*RC[-12])/1000 -> 3.3362642785740344 | U17: 6.7169439999999998 | V17: 3.1045280000000002 | W17: =RC[-2]*RC[-10]/1000 -> 0.44860419636385601 | X17: =ABS((RC[-3]*RC[-11]-RC[-2]*RC[-9])/1000) -> 0.247197374235232 | Y17: =(RC[-14]-RC[1])/RC[-18]*100 -> 1.0207325844243509 | Z17: =RC[-5]+RC[-4] -> 9.821472 | AC17: =VALUE(RC[-27]) -> 2018-09-26T00:00:00.000 | AD17: =IF(RC[21]=42,"*",IF(RC[21]=32,"",RC[21])) -> - | AE17: =RC[-28] -> 24 | AF17: =RC[-28] -> 128.009445 | AG17: =RC[-28] -> 67.810683999999995 | AH17: =RC[-28] -> 7.4915580000000004 | AI17: =RC[-28] -> 117.03104399999999 | AJ17: =RC[-28] -> 45.664326000000003 | AK17: =RC[-28] -> 5.473859 | AL17: =RC[-28] -> 22.146357999999992 | AM17: =RC[-28] -> 11.016045999999999 | AN17: =RC[-28] -> 6.8552559999999998 | AO17: =RC[-28] -> 66.786949000000007 | AP17: - | AQ17: =RC[-29] -> 3.1650999999999998 | AR17: =RC[-29] -> 64.875183000000007 | AS17: - | AT17: =RC[-30] -> 1.9117660000000001 | AU17: =RC[-30] -> 10.020356 | AV17: =RC[-30] -> 0.65049400000000002 | AW17: =RC[-30] -> 3.3432599999999999 | AY17: - | AZ17: - | BA17: -
A18: =IF(RC[1]="","",DATEVALUE(RC[1])) -> 43370 | B18: 27.09.18 | C18: 24 | D18: 116.98389400000001 | E18: 63.072243 | F18: 7.14649 | G18: 105.86788199999999 | H18: 42.547759999999997 | I18: 5.5113089999999998 | J18: =RC[-5]-RC[-2] -> 20.524483000000004 | K18: 11.218088 | L18: 6.8299890000000003 | M18: 62.549109999999999 | N18: 3.4058000000000002 | O18: 60.788592999999999 | P18: =IF(AND(ISNUMBER(RC[-3]),ISNUMBER(RC[-1])),RC[-3]-RC[-1],"-") -> 1.7605170000000001 | Q18: 10.235789 | R18: 0.62356599999999995 | S18: 4.1277160000000004 | T18: =(RC[-16]*RC[-15]-RC[-13]*RC[-12])/1000 -> 2.8739953544099235 | U18: 6.707865 | V18: 3.3480099999999999 | W18: =RC[-2]*RC[-10]/1000 -> 0.41957098575015001 | X18: =ABS((RC[-3]*RC[-11]-RC[-2]*RC[-9])/1000) -> 0.21605016850021999 | Y18: =(RC[-14]-RC[1])/RC[-18]*100 -> 1.0977956468421646 | Z18: =RC[-5]+RC[-4] -> 10.055875 | AC18: =VALUE(RC[-27]) -> 2018-09-27T00:00:00.000 | AD18: =IF(RC[21]=42,"*",IF(RC[21]=32,"",RC[21])) -> - | AE18: =RC[-28] -> 24 | AF18: =RC[-28] -> 116.98389400000001 | AG18: =RC[-28] -> 63.072243 | AH18: =RC[-28] -> 7.14649 | AI18: =RC[-28] -> 105.86788199999999 | AJ18: =RC[-28] -> 42.547759999999997 | AK18: =RC[-28] -> 5.5113089999999998 | AL18: =RC[-28] -> 20.524483000000004 | AM18: =RC[-28] -> 11.218088 | AN18: =RC[-28] -> 6.8299890000000003 | AO18: =RC[-28] -> 62.549109999999999 | AP18: - | AQ18: =RC[-29] -> 3.4058000000000002 | AR18: =RC[-29] -> 60.788592999999999 | AS18: - | AT18: =RC[-30] -> 1.7605170000000001 | AU18: =RC[-30] -> 10.235789 | AV18: =RC[-30] -> 0.62356599999999995 | AW18: =RC[-30] -> 4.1277160000000004 | AY18: - | AZ18: - | BA18: -
A19: =IF(RC[1]="","",DATEVALUE(RC[1])) -> 43371 | B19: 28.09.18 | C19: 24 | D19: 117.79965199999999 | E19: 67.578650999999994 | F19: 7.3982669999999997 | G19: 108.11434199999999 | H19: 44.675998999999997 | I19: 5.6287370000000001 | J19: =RC[-5]-RC[-2] -> 22.902651999999996 | K19: 9.7982820000000004 | L19: 6.400544 | M19: 66.931015000000002 | N19: 2.432178 | O19: 64.183188999999999 | P19: =IF(AND(ISNUMBER(RC[-3]),ISNUMBER(RC[-1])),RC[-3]-RC[-1],"-") -> 2.7478260000000034 | Q19: 8.8327220000000004 | R19: 0.57331900000000002 | S19: 3.139948 | T19: =(RC[-16]*RC[-15]-RC[-13]*RC[-12])/1000 -> 3.1306253353517932 | U19: 6.2709140000000003 | V19: 2.38652 | W19: =RC[-2]*RC[-10]/1000 -> 0.41971863899771006 | X19: =ABS((RC[-3]*RC[-11]-RC[-2]*RC[-9])/1000) -> 0.26654417478543008 | Y19: =(RC[-14]-RC[1])/RC[-18]*100 -> 1.0552235521167026 | Z19: =RC[-5]+RC[-4] -> 8.6574340000000003 | AC19: =VALUE(RC[-27]) -> 2018-09-28T00:00:00.000 | AD19: =IF(RC[21]=42,"*",IF(RC[21]=32,"",RC[21])) -> - | AE19: =RC[-28] -> 24 | AF19: =RC[-28] -> 117.79965199999999 | AG19: =RC[-28] -> 67.578650999999994 | AH19: =RC[-28] -> 7.3982669999999997 | AI19: =RC[-28] -> 108.11434199999999 | AJ19: =RC[-28] -> 44.675998999999997 | AK19: =RC[-28] -> 5.6287370000000001 | AL19: =RC[-28] -> 22.902651999999996 | AM19: =RC[-28] -> 9.7982820000000004 | AN19: =RC[-28] -> 6.400544 | AO19: =RC[-28] -> 66.931015000000002 | AP19: - | AQ19: =RC[-29] -> 2.432178 | AR19: =RC[-29] -> 64.183188999999999 | AS19: - | AT19: =RC[-30] -> 2.7478260000000034 | AU19: =RC[-30] -> 8.8327220000000004 | AV19: =RC[-30] -> 0.57331900000000002 | AW19: =RC[-30] -> 3.139948 | AY19: - | AZ19: - | BA19: -
A20: =IF(RC[1]="","",DATEVALUE(RC[1])) -> 43372 | B20: 29.09.18 | C20: 24 | D20: 134.93255600000001 | E20: 67.441017000000002 | F20: 8.2416319999999992 | G20: 125.19104799999999 | H20: 46.323493999999997 | I20: 5.9386659999999996 | J20: =RC[-5]-RC[-2] -> 21.117523000000006 | K20: 9.7415070000000004 | L20: 6.5711209999999998 | M20: 66.540565000000001 | N20: 2.751344 | O20: 64.289642000000001 | P20: =IF(AND(ISNUMBER(RC[-3]),ISNUMBER(RC[-1])),RC[-3]-RC[-1],"-") -> 2.2509230000000002 | Q20: 9.3224649999999993 | R20: 0.60248999999999997 | S20: 4.5319459999999996 | T20: =(RC[-16]*RC[-15]-RC[-13]*RC[-12])/1000 -> 3.3007020421677415 | U20: 6.4394669999999996 | V20: 2.6995439999999999 | W20: =RC[-2]*RC[-10]/1000 -> 0.428485772478855 | X20: =ABS((RC[-3]*RC[-11]-RC[-2]*RC[-9])/1000) -> 0.25493305515560699 | Y20: =(RC[-14]-RC[1])/RC[-18]*100 -> 0.48126124800872372 | Z20: =RC[-5]+RC[-4] -> 9.139011 | AC20: =VALUE(RC[-27]) -> 2018-09-29T00:00:00.000 | AD20: =IF(RC[21]=42,"*",IF(RC[21]=32,"",RC[21])) -> - | AE20: =RC[-28] -> 24 | AF20: =RC[-28] -> 134.93255600000001 | AG20: =RC[-28] -> 67.441017000000002 | AH20: =RC[-28] -> 8.2416319999999992 | AI20: =RC[-28] -> 125.19104799999999 | AJ20: =RC[-28] -> 46.323493999999997 | AK20: =RC[-28] -> 5.9386659999999996 | AL20: =RC[-28] -> 21.117523000000006 | AM20: =RC[-28] -> 9.7415070000000004 | AN20: =RC[-28] -> 6.5711209999999998 | AO20: =RC[-28] -> 66.540565000000001 | AP20: - | AQ20: =RC[-29] -> 2.751344 | AR20: =RC[-29] -> 64.289642000000001 | AS20: - | AT20: =RC[-30] -> 2.2509230000000002 | AU20: =RC[-30] -> 9.3224649999999993 | AV20: =RC[-30] -> 0.60248999999999997 | AW20: =RC[-30] -> 4.5319459999999996 | AY20: - | AZ20: - | BA20: -
A21: =IF(RC[1]="","",DATEVALUE(RC[1])) -> 43373 | B21: 30.09.18 | C21: 24 | D21: 137.788757 | E21: 69.590880999999996 | F21: 8.2404250000000001 | G21: 126.608482 | H21: 47.623119000000003 | I21: 5.8700590000000004 | J21: =RC[-5]-RC[-2] -> 21.967761999999993 | K21: 11.280767000000001 | L21: 7.2911659999999996 | M21: 69.167534000000003 | N21: 2.928277 | O21: 66.999488999999997 | P21: =IF(AND(ISNUMBER(RC[-3]),ISNUMBER(RC[-1])),RC[-3]-RC[-1],"-") -> 2.1680450000000064 | Q21: 10.219443 | R21: 0.68618299999999999 | S21: 4.1820139999999997 | T21: =(RC[-16]*RC[-15]-RC[-13]*RC[-12])/1000 -> 3.5593501868295596 | U21: 7.1343459999999999 | V21: 2.868811 | W21: =RC[-2]*RC[-10]/1000 -> 0.49346511952276406 | X21: =ABS((RC[-3]*RC[-11]-RC[-2]*RC[-9])/1000) -> 0.30125624848518506 | Y21: =(RC[-14]-RC[1])/RC[-18]*100 -> 1.0091030078063814 | Z21: =RC[-5]+RC[-4] -> 10.003157 | AC21: =VALUE(RC[-27]) -> 2018-09-30T00:00:00.000 | AD21: =IF(RC[21]=42,"*",IF(RC[21]=32,"",RC[21])) -> - | AE21: =RC[-28] -> 24 | AF21: =RC[-28] -> 137.788757 | AG21: =RC[-28] -> 69.590880999999996 | AH21: =RC[-28] -> 8.2404250000000001 | AI21: =RC[-28] -> 126.608482 | AJ21: =RC[-28] -> 47.623119000000003 | AK21: =RC[-28] -> 5.8700590000000004 | AL21: =RC[-28] -> 21.967761999999993 | AM21: =RC[-28] -> 11.280767000000001 | AN21: =RC[-28] -> 7.2911659999999996 | AO21: =RC[-28] -> 69.167534000000003 | AP21: - | AQ21: =RC[-29] -> 2.928277 | AR21: =RC[-29] -> 66.999488999999997 | AS21: - | AT21: =RC[-30] -> 2.1680450000000064 | AU21: =RC[-30] -> 10.219443 | AV21: =RC[-30] -> 0.68618299999999999 | AW21: =RC[-30] -> 4.1820139999999997 | AY21: - | AZ21: - | BA21: -
A22: =IF(RC[1]="","",DATEVALUE(RC[1])) -> 43374 | B22: 01.10.18 | C22: 24 | D22: 133.48670999999999 | E22: 68.496063000000007 | F22: 8.2596889999999998 | G22: 124.099335 | H22: 47.568398000000002 | I22: 5.9987490000000001 | J22: =RC[-5]-RC[-2] -> 20.927665000000005 | K22: 9.3937170000000005 | L22: 6.4650109999999996 | M22: 67.661995000000005 | N22: 2.618655 | O22: 64.888283000000001 | P22: =IF(AND(ISNUMBER(RC[-3]),ISNUMBER(RC[-1])),RC[-3]-RC[-1],"-") -> 2.7737120000000033 | Q22: 9.0836659999999991 | R22: 0.59550400000000003 | S22: 4.4787119999999998 | T22: =(RC[-16]*RC[-15]-RC[-13]*RC[-12])/1000 -> 3.2401075390073992 | U22: 6.3314469999999998 | V22: 2.568492 | W22: =RC[-2]*RC[-10]/1000 -> 0.42839833525676502 | X22: =ABS((RC[-3]*RC[-11]-RC[-2]*RC[-9])/1000) -> 0.26173329947752899 | Y22: =(RC[-14]-RC[1])/RC[-18]*100 -> 0.39788931987427711 | Z22: =RC[-5]+RC[-4] -> 8.8999389999999998 | AC22: =VALUE(RC[-27]) -> 2018-10-01T00:00:00.000 | AD22: =IF(RC[21]=42,"*",IF(RC[21]=32,"",RC[21])) -> - | AE22: =RC[-28] -> 24 | AF22: =RC[-28] -> 133.48670999999999 | AG22: =RC[-28] -> 68.496063000000007 | AH22: =RC[-28] -> 8.2596889999999998 | AI22: =RC[-28] -> 124.099335 | AJ22: =RC[-28] -> 47.568398000000002 | AK22: =RC[-28] -> 5.9987490000000001 | AL22: =RC[-28] -> 20.927665000000005 | AM22: =RC[-28] -> 9.3937170000000005 | AN22: =RC[-28] -> 6.4650109999999996 | AO22: =RC[-28] -> 67.661995000000005 | AP22: - | AQ22: =RC[-29] -> 2.618655 | AR22: =RC[-29] -> 64.888283000000001 | AS22: - | AT22: =RC[-30] -> 2.7737120000000033 | AU22: =RC[-30] -> 9.0836659999999991 | AV22: =RC[-30] -> 0.59550400000000003 | AW22: =RC[-30] -> 4.4787119999999998 | AY22: - | AZ22: - | BA22: -
A23: =IF(RC[1]="","",DATEVALUE(RC[1])) -> 43375 | B23: 02.10.18 | C23: 24 | D23: 137.07183800000001 | E23: 67.235870000000006 | F23: 8.2281169999999992 | G23: 126.762253 | H23: 47.41695 | I23: 5.8553569999999997 | J23: =RC[-5]-RC[-2] -> 19.818920000000006 | K23: 10.328203 | L23: 6.7273329999999998 | M23: 66.543312 | N23: 3.1699220000000001 | O23: 64.297234000000003 | P23: =IF(AND(ISNUMBER(RC[-3]),ISNUMBER(RC[-1])),RC[-3]-RC[-1],"-") -> 2.2460779999999971 | Q23: 9.8972549999999995 | R23: 0.63914400000000005 | S23: 4.4585520000000001 | T23: =(RC[-16]*RC[-15]-RC[-13]*RC[-12])/1000 -> 3.2054648680407118 | U23: 6.5925260000000003 | V23: 3.1102319999999999 | W23: =RC[-2]*RC[-10]/1000 -> 0.43868851448611201 | X23: =ABS((RC[-3]*RC[-11]-RC[-2]*RC[-9])/1000) -> 0.23870919978782401 | Y23: =(RC[-14]-RC[1])/RC[-18]*100 -> 0.49340003447240793 | Z23: =RC[-5]+RC[-4] -> 9.7027579999999993 | AC23: =VALUE(RC[-27]) -> 2018-10-02T00:00:00.000 | AD23: =IF(RC[21]=42,"*",IF(RC[21]=32,"",RC[21])) -> - | AE23: =RC[-28] -> 24 | AF23: =RC[-28] -> 137.07183800000001 | AG23: =RC[-28] -> 67.235870000000006 | AH23: =RC[-28] -> 8.2281169999999992 | AI23: =RC[-28] -> 126.762253 | AJ23: =RC[-28] -> 47.41695 | AK23: =RC[-28] -> 5.8553569999999997 | AL23: =RC[-28] -> 19.818920000000006 | AM23: =RC[-28] -> 10.328203 | AN23: =RC[-28] -> 6.7273329999999998 | AO23: =RC[-28] -> 66.543312 | AP23: - | AQ23: =RC[-29] -> 3.1699220000000001 | AR23: =RC[-29] -> 64.297234000000003 | AS23: - | AT23: =RC[-30] -> 2.2460779999999971 | AU23: =RC[-30] -> 9.8972549999999995 | AV23: =RC[-30] -> 0.63914400000000005 | AW23: =RC[-30] -> 4.4585520000000001 | AY23: - | AZ23: - | BA23: -
A24: =IF(RC[1]="","",DATEVALUE(RC[1])) -> 43376 | B24: 03.10.18 | C24: 24 | D24: 139.96400499999999 | E24: 67.376632999999998 | F24: 8.2047589999999992 | G24: 127.165451 | H24: 47.391818999999998 | I24: 5.8130990000000002 | J24: =RC[-5]-RC[-2] -> 19.984814 | K24: 12.848330000000001 | L24: 8.5856549999999991 | M24: 66.902298000000002 | N24: 2.5086439999999999 | O24: 64.071190000000001 | P24: =IF(AND(ISNUMBER(RC[-3]),ISNUMBER(RC[-1])),RC[-3]-RC[-1],"-") -> 2.8311080000000004 | Q24: 11.094298999999999 | R24: 0.72104400000000002 | S24: 4.657775 | T24: =(RC[-16]*RC[-15]-RC[-13]*RC[-12])/1000 -> 3.4037013612497948 | U24: 8.4119189999999993 | V24: 2.4617140000000002 | W24: =RC[-2]*RC[-10]/1000 -> 0.56277671168986199 | X24: =ABS((RC[-3]*RC[-11]-RC[-2]*RC[-9])/1000) -> 0.40505176627020195 | Y24: =(RC[-14]-RC[1])/RC[-18]*100 -> 1.552856522326965 | Z24: =RC[-5]+RC[-4] -> 10.873633 | AC24: =VALUE(RC[-27]) -> 2018-10-03T00:00:00.000 | AD24: =IF(RC[21]=42,"*",IF(RC[21]=32,"",RC[21])) -> - | AE24: =RC[-28] -> 24 | AF24: =RC[-28] -> 139.96400499999999 | AG24: =RC[-28] -> 67.376632999999998 | AH24: =RC[-28] -> 8.2047589999999992 | AI24: =RC[-28] -> 127.165451 | AJ24: =RC[-28] -> 47.391818999999998 | AK24: =RC[-28] -> 5.8130990000000002 | AL24: =RC[-28] -> 19.984814 | AM24: =RC[-28] -> 12.848330000000001 | AN24: =RC[-28] -> 8.5856549999999991 | AO24: =RC[-28] -> 66.902298000000002 | AP24: - | AQ24: =RC[-29] -> 2.5086439999999999 | AR24: =RC[-29] -> 64.071190000000001 | AS24: - | AT24: =RC[-30] -> 2.8311080000000004 | AU24: =RC[-30] -> 11.094298999999999 | AV24: =RC[-30] -> 0.72104400000000002 | AW24: =RC[-30] -> 4.657775 | AY24: - | AZ24: - | BA24: -
A25: =IF(RC[1]="","",DATEVALUE(RC[1])) -> 43377 | B25: 04.10.18 | C25: 24 | D25: 137.33055100000001 | E25: 66.771636999999998 | F25: 8.1862969999999997 | G25: 126.316574 | H25: 46.275410000000001 | I25: 5.8204880000000001 | J25: =RC[-5]-RC[-2] -> 20.496226999999998 | K25: 11.121114 | L25: 7.6152759999999997 | M25: 66.133713 | N25: 2.619955 | O25: 63.029442000000003 | P25: =IF(AND(ISNUMBER(RC[-3]),ISNUMBER(RC[-1])),RC[-3]-RC[-1],"-") -> 3.1042709999999971 | Q25: 10.235231000000001 | R25: 0.65627500000000005 | S25: 3.9539870000000001 | T25: =(RC[-16]*RC[-15]-RC[-13]*RC[-12])/1000 -> 3.324434448736648 | U25: 7.4644170000000001 | V25: 2.5723690000000001 | W25: =RC[-2]*RC[-10]/1000 -> 0.493649611590321 | X25: =ABS((RC[-3]*RC[-11]-RC[-2]*RC[-9])/1000) -> 0.33151462890222294 | Y25: =(RC[-14]-RC[1])/RC[-18]*100 -> 0.85842100182356196 | Z25: =RC[-5]+RC[-4] -> 10.036785999999999 | AC25: =VALUE(RC[-27]) -> 2018-10-04T00:00:00.000 | AD25: =IF(RC[21]=42,"*",IF(RC[21]=32,"",RC[21])) -> - | AE25: =RC[-28] -> 24 | AF25: =RC[-28] -> 137.33055100000001 | AG25: =RC[-28] -> 66.771636999999998 | AH25: =RC[-28] -> 8.1862969999999997 | AI25: =RC[-28] -> 126.316574 | AJ25: =RC[-28] -> 46.275410000000001 | AK25: =RC[-28] -> 5.8204880000000001 | AL25: =RC[-28] -> 20.496226999999998 | AM25: =RC[-28] -> 11.121114 | AN25: =RC[-28] -> 7.6152759999999997 | AO25: =RC[-28] -> 66.133713 | AP25: - | AQ25: =RC[-29] -> 2.619955 | AR25: =RC[-29] -> 63.029442000000003 | AS25: - | AT25: =RC[-30] -> 3.1042709999999971 | AU25: =RC[-30] -> 10.235231000000001 | AV25: =RC[-30] -> 0.65627500000000005 | AW25: =RC[-30] -> 3.9539870000000001 | AY25: - | AZ25: - | BA25: -
A26: =IF(RC[1]="","",DATEVALUE(RC[1])) -> 43378 | B26: 05.10.18 | C26: 24 | D26: 139.845901 | E26: 66.138503999999998 | F26: 8.1588279999999997 | G26: 128.611786 | H26: 45.571922000000001 | I26: 5.6988430000000001 | J26: =RC[-5]-RC[-2] -> 20.566581999999997 | K26: 11.355572 | L26: 7.5318659999999999 | M26: 65.508232000000007 | N26: 2.985522 | O26: 62.708781999999999 | P26: =IF(AND(ISNUMBER(RC[-3]),ISNUMBER(RC[-1])),RC[-3]-RC[-1],"-") -> 2.7994500000000073 | Q26: 10.517388 | R26: 0.66813100000000003 | S26: 4.0170190000000003 | T26: =(RC[-16]*RC[-15]-RC[-13]*RC[-12])/1000 -> 3.3881124027994121 | U26: 7.3852380000000002 | V26: 2.931743 | W26: =RC[-2]*RC[-10]/1000 -> 0.48379388427921605 | X26: =ABS((RC[-3]*RC[-11]-RC[-2]*RC[-9])/1000) -> 0.29994785161219006 | Y26: =(RC[-14]-RC[1])/RC[-18]*100 -> 0.80753952052263733 | Z26: =RC[-5]+RC[-4] -> 10.316981 | AC26: =VALUE(RC[-27]) -> 2018-10-05T00:00:00.000 | AD26: =IF(RC[21]=42,"*",IF(RC[21]=32,"",RC[21])) -> - | AE26: =RC[-28] -> 24 | AF26: =RC[-28] -> 139.845901 | AG26: =RC[-28] -> 66.138503999999998 | AH26: =RC[-28] -> 8.1588279999999997 | AI26: =RC[-28] -> 128.611786 | AJ26: =RC[-28] -> 45.571922000000001 | AK26: =RC[-28] -> 5.6988430000000001 | AL26: =RC[-28] -> 20.566581999999997 | AM26: =RC[-28] -> 11.355572 | AN26: =RC[-28] -> 7.5318659999999999 | AO26: =RC[-28] -> 65.508232000000007 | AP26: - | AQ26: =RC[-29] -> 2.985522 | AR26: =RC[-29] -> 62.708781999999999 | AS26: - | AT26: =RC[-30] -> 2.7994500000000073 | AU26: =RC[-30] -> 10.517388 | AV26: =RC[-30] -> 0.66813100000000003 | AW26: =RC[-30] -> 4.0170190000000003 | AY26: - | AZ26: - | BA26: -
A27: =IF(RC[1]="","",DATEVALUE(RC[1])) -> 43379 | B27: 06.10.18 | C27: 24 | D27: 139.85609400000001 | E27: 66.788544000000002 | F27: 8.1891320000000007 | G27: 125.87350499999999 | H27: 45.864193 | I27: 5.8284459999999996 | J27: =RC[-5]-RC[-2] -> 20.924351000000001 | K27: 14.021172999999999 | L27: 8.9235989999999994 | M27: 66.359076999999999 | N27: 3.4015110000000002 | O27: 64.234459000000001 | P27: =IF(AND(ISNUMBER(RC[-3]),ISNUMBER(RC[-1])),RC[-3]-RC[-1],"-") -> 2.1246179999999981 | Q27: 12.32511 | R27: 0.79534499999999997 | S27: 3.5762480000000001 | T27: =(RC[-16]*RC[-15]-RC[-13]*RC[-12])/1000 -> 3.5676981608806719 | U27: 8.7457139999999995 | V27: 3.3375859999999999 | W27: =RC[-2]*RC[-10]/1000 -> 0.58035750874597791 | X27: =ABS((RC[-3]*RC[-11]-RC[-2]*RC[-9])/1000) -> 0.36596947767000393 | Y27: =(RC[-14]-RC[1])/RC[-18]*100 -> 1.5395400326700999 | Z27: =RC[-5]+RC[-4] -> 12.083299999999999 | AC27: =VALUE(RC[-27]) -> 2018-10-06T00:00:00.000 | AD27: =IF(RC[21]=42,"*",IF(RC[21]=32,"",RC[21])) -> - | AE27: =RC[-28] -> 24 | AF27: =RC[-28] -> 139.85609400000001 | AG27: =RC[-28] -> 66.788544000000002 | AH27: =RC[-28] -> 8.1891320000000007 | AI27: =RC[-28] -> 125.87350499999999 | AJ27: =RC[-28] -> 45.864193 | AK27: =RC[-28] -> 5.8284459999999996 | AL27: =RC[-28] -> 20.924351000000001 | AM27: =RC[-28] -> 14.021172999999999 | AN27: =RC[-28] -> 8.9235989999999994 | AO27: =RC[-28] -> 66.359076999999999 | AP27: - | AQ27: =RC[-29] -> 3.4015110000000002 | AR27: =RC[-29] -> 64.234459000000001 | AS27: - | AT27: =RC[-30] -> 2.1246179999999981 | AU27: =RC[-30] -> 12.32511 | AV27: =RC[-30] -> 0.79534499999999997 | AW27: =RC[-30] -> 3.5762480000000001 | AY27: - | AZ27: - | BA27: -
A28: =IF(RC[1]="","",DATEVALUE(RC[1])) -> 43380 | B28: 07.10.18 | C28: 24 | D28: 141.80538899999999 | E28: 67.058563000000007 | F28: 8.1840869999999999 | G28: 127.00357099999999 | H28: 46.207622999999998 | I28: 5.4142749999999999 | J28: =RC[-5]-RC[-2] -> 20.850940000000008 | K28: 14.843417000000001 | L28: 9.3138660000000009 | M28: 66.491714000000002 | N28: 3.6593439999999999 | O28: 64.302306999999999 | P28: =IF(AND(ISNUMBER(RC[-3]),ISNUMBER(RC[-1])),RC[-3]-RC[-1],"-") -> 2.1894070000000028 | Q28: 12.97321 | R28: 0.83840499999999996 | S28: 5.5035350000000003 | T28: =(RC[-16]*RC[-15]-RC[-13]*RC[-12])/1000 -> 3.6407324835742738 | U28: 9.1275089999999999 | V28: 3.5904240000000001 | W28: =RC[-2]*RC[-10]/1000 -> 0.60690371796042597 | X28: =ABS((RC[-3]*RC[-11]-RC[-2]*RC[-9])/1000) -> 0.37603117165225797 | Y28: =(RC[-14]-RC[1])/RC[-18]*100 -> 1.673562391407089 | Z28: =RC[-5]+RC[-4] -> 12.717933 | AC28: =VALUE(RC[-27]) -> 2018-10-07T00:00:00.000 | AD28: =IF(RC[21]=42,"*",IF(RC[21]=32,"",RC[21])) -> - | AE28: =RC[-28] -> 24 | AF28: =RC[-28] -> 141.80538899999999 | AG28: =RC[-28] -> 67.058563000000007 | AH28: =RC[-28] -> 8.1840869999999999 | AI28: =RC[-28] -> 127.00357099999999 | AJ28: =RC[-28] -> 46.207622999999998 | AK28: =RC[-28] -> 5.4142749999999999 | AL28: =RC[-28] -> 20.850940000000008 | AM28: =RC[-28] -> 14.843417000000001 | AN28: =RC[-28] -> 9.3138660000000009 | AO28: =RC[-28] -> 66.491714000000002 | AP28: - | AQ28: =RC[-29] -> 3.6593439999999999 | AR28: =RC[-29] -> 64.302306999999999 | AS28: - | AT28: =RC[-30] -> 2.1894070000000028 | AU28: =RC[-30] -> 12.97321 | AV28: =RC[-30] -> 0.83840499999999996 | AW28: =RC[-30] -> 5.5035350000000003 | AY28: - | AZ28: - | BA28: -
A29: =IF(RC[1]="","",DATEVALUE(RC[1])) -> 43381 | B29: 08.10.18 | C29: 24 | D29: 141.57002299999999 | E29: 67.015556000000004 | F29: 8.1797679999999993 | G29: 128.69499200000001 | H29: 46.152016000000003 | I29: 4.4000000000000004 | J29: =RC[-5]-RC[-2] -> 20.86354 | K29: 12.986227 | L29: 8.2475769999999997 | M29: 66.236221 | N29: 3.5338669999999999 | O29: 63.857093999999996 | P29: =IF(AND(ISNUMBER(RC[-3]),ISNUMBER(RC[-1])),RC[-3]-RC[-1],"-") -> 2.379127000000004 | Q29: 11.781444 | R29: 0.75746999999999998 | S29: 3.5635870000000001 | T29: =(RC[-16]*RC[-15]-RC[-13]*RC[-12])/1000 -> 3.5478604743739153 | U29: 8.0837289999999999 | V29: 3.4681449999999998 | W29: =RC[-2]*RC[-10]/1000 -> 0.53543566054810898 | X29: =ABS((RC[-3]*RC[-11]-RC[-2]*RC[-9])/1000) -> 0.31396999927747904 | Y29: =(RC[-14]-RC[1])/RC[-18]*100 -> 1.1145367645696731 | Z29: =RC[-5]+RC[-4] -> 11.551874 | AC29: =VALUE(RC[-27]) -> 2018-10-08T00:00:00.000 | AD29: =IF(RC[21]=42,"*",IF(RC[21]=32,"",RC[21])) -> - | AE29: =RC[-28] -> 24 | AF29: =RC[-28] -> 141.57002299999999 | AG29: =RC[-28] -> 67.015556000000004 | AH29: =RC[-28] -> 8.1797679999999993 | AI29: =RC[-28] -> 128.69499200000001 | AJ29: =RC[-28] -> 46.152016000000003 | AK29: =RC[-28] -> 4.4000000000000004 | AL29: =RC[-28] -> 20.86354 | AM29: =RC[-28] -> 12.986227 | AN29: =RC[-28] -> 8.2475769999999997 | AO29: =RC[-28] -> 66.236221 | AP29: - | AQ29: =RC[-29] -> 3.5338669999999999 | AR29: =RC[-29] -> 63.857093999999996 | AS29: - | AT29: =RC[-30] -> 2.379127000000004 | AU29: =RC[-30] -> 11.781444 | AV29: =RC[-30] -> 0.75746999999999998 | AW29: =RC[-30] -> 3.5635870000000001 | AY29: - | AZ29: - | BA29: -
A30: =IF(RC[1]="","",DATEVALUE(RC[1])) -> 43382 | B30: 09.10.18 | C30: 24 | D30: 139.658646 | E30: 66.867958000000002 | F30: 8.2014560000000003 | G30: 127.720901 | H30: 46.469994 | I30: 4.648549 | J30: =RC[-5]-RC[-2] -> 20.397964000000002 | K30: 11.937757 | L30: 7.6321000000000003 | M30: 66.234611999999998 | N30: 3.3690000000000002 | O30: 63.645802000000003 | P30: =IF(AND(ISNUMBER(RC[-3]),ISNUMBER(RC[-1])),RC[-3]-RC[-1],"-") -> 2.5888099999999952 | Q30: 11.001099999999999 | R30: 0.70643299999999998 | S30: 5.2683010000000001 | T30: =(RC[-16]*RC[-15]-RC[-13]*RC[-12])/1000 -> 3.403498971920274 | U30: 7.4804320000000004 | V30: 3.306673 | W30: =RC[-2]*RC[-10]/1000 -> 0.49546351111238401 | X30: =ABS((RC[-3]*RC[-11]-RC[-2]*RC[-9])/1000) -> 0.28500765607563799 | Y30: =(RC[-14]-RC[1])/RC[-18]*100 -> 0.9009112768473182 | Z30: =RC[-5]+RC[-4] -> 10.787105 | AC30: =VALUE(RC[-27]) -> 2018-10-09T00:00:00.000 | AD30: =IF(RC[21]=42,"*",IF(RC[21]=32,"",RC[21])) -> - | AE30: =RC[-28] -> 24 | AF30: =RC[-28] -> 139.658646 | AG30: =RC[-28] -> 66.867958000000002 | AH30: =RC[-28] -> 8.2014560000000003 | AI30: =RC[-28] -> 127.720901 | AJ30: =RC[-28] -> 46.469994 | AK30: =RC[-28] -> 4.648549 | AL30: =RC[-28] -> 20.397964000000002 | AM30: =RC[-28] -> 11.937757 | AN30: =RC[-28] -> 7.6321000000000003 | AO30: =RC[-28] -> 66.234611999999998 | AP30: - | AQ30: =RC[-29] -> 3.3690000000000002 | AR30: =RC[-29] -> 63.645802000000003 | AS30: - | AT30: =RC[-30] -> 2.5888099999999952 | AU30: =RC[-30] -> 11.001099999999999 | AV30: =RC[-30] -> 0.70643299999999998 | AW30: =RC[-30] -> 5.2683010000000001 | AY30: - | AZ30: - | BA30: -
A31: =IF(RC[1]="","",DATEVALUE(RC[1])) -> 43383 | B31: 10.10.18 | C31: 24 | D31: 136.63398699999999 | E31: 67.902266999999995 | F31: 8.2275700000000001 | G31: 126.188889 | H31: 47.110000999999997 | I31: 5.7904730000000004 | J31: =RC[-5]-RC[-2] -> 20.792265999999998 | K31: 10.514659999999999 | L31: 7.1413099999999998 | M31: 67.404060000000001 | N31: 2.7633890000000001 | O31: 65.008972 | P31: =IF(AND(ISNUMBER(RC[-3]),ISNUMBER(RC[-1])),RC[-3]-RC[-1],"-") -> 2.3950880000000012 | Q31: 9.9046990000000008 | R31: 0.64815100000000003 | S31: 4.5801499999999997 | T31: =(RC[-16]*RC[-15]-RC[-13]*RC[-12])/1000 -> 3.3329987795696399 | U31: 6.994796 | V31: 2.7102840000000001 | W31: =RC[-2]*RC[-10]/1000 -> 0.47147764927176 | X31: =ABS((RC[-3]*RC[-11]-RC[-2]*RC[-9])/1000) -> 0.295284872603712 | Y31: =(RC[-14]-RC[1])/RC[-18]*100 -> 0.64156203166191483 | Z31: =RC[-5]+RC[-4] -> 9.7050800000000006 | AC31: =VALUE(RC[-27]) -> 2018-10-10T00:00:00.000 | AD31: =IF(RC[21]=42,"*",IF(RC[21]=32,"",RC[21])) -> - | AE31: =RC[-28] -> 24 | AF31: =RC[-28] -> 136.63398699999999 | AG31: =RC[-28] -> 67.902266999999995 | AH31: =RC[-28] -> 8.2275700000000001 | AI31: =RC[-28] -> 126.188889 | AJ31: =RC[-28] -> 47.110000999999997 | AK31: =RC[-28] -> 5.7904730000000004 | AL31: =RC[-28] -> 20.792265999999998 | AM31: =RC[-28] -> 10.514659999999999 | AN31: =RC[-28] -> 7.1413099999999998 | AO31: =RC[-28] -> 67.404060000000001 | AP31: - | AQ31: =RC[-29] -> 2.7633890000000001 | AR31: =RC[-29] -> 65.008972 | AS31: - | AT31: =RC[-30] -> 2.3950880000000012 | AU31: =RC[-30] -> 9.9046990000000008 | AV31: =RC[-30] -> 0.64815100000000003 | AW31: =RC[-30] -> 4.5801499999999997 | AY31: - | AZ31: - | BA31: -
A32: =IF(RC[1]="","",DATEVALUE(RC[1])) -> 43384 | B32: 11.10.18 | C32: 24 | D32: 141.09187299999999 | E32: 68.994095000000002 | F32: 8.1979009999999999 | G32: 129.864777 | H32: 48.054813000000003 | I32: 5.6601379999999999 | J32: =RC[-5]-RC[-2] -> 20.939281999999999 | K32: 11.363135 | L32: 7.4523109999999999 | M32: 68.379562000000007 | N32: 3.0343330000000002 | O32: 65.397582999999997 | P32: =IF(AND(ISNUMBER(RC[-3]),ISNUMBER(RC[-1])),RC[-3]-RC[-1],"-") -> 2.9819790000000097 | Q32: 10.486644 | R32: 0.69392699999999996 | S32: 3.5080040000000001 | T32: =(RC[-16]*RC[-15]-RC[-13]*RC[-12])/1000 -> 3.4938785154682326 | U32: 7.2953749999999999 | V32: 2.9752269999999998 | W32: =RC[-2]*RC[-10]/1000 -> 0.49885454712575006 | X32: =ABS((RC[-3]*RC[-11]-RC[-2]*RC[-9])/1000) -> 0.30428189244940906 | Y32: =(RC[-14]-RC[1])/RC[-18]*100 -> 0.84128508533149027 | Z32: =RC[-5]+RC[-4] -> 10.270602 | AC32: =VALUE(RC[-27]) -> 2018-10-11T00:00:00.000 | AD32: =IF(RC[21]=42,"*",IF(RC[21]=32,"",RC[21])) -> - | AE32: =RC[-28] -> 24 | AF32: =RC[-28] -> 141.09187299999999 | AG32: =RC[-28] -> 68.994095000000002 | AH32: =RC[-28] -> 8.1979009999999999 | AI32: =RC[-28] -> 129.864777 | AJ32: =RC[-28] -> 48.054813000000003 | AK32: =RC[-28] -> 5.6601379999999999 | AL32: =RC[-28] -> 20.939281999999999 | AM32: =RC[-28] -> 11.363135 | AN32: =RC[-28] -> 7.4523109999999999 | AO32: =RC[-28] -> 68.379562000000007 | AP32: - | AQ32: =RC[-29] -> 3.0343330000000002 | AR32: =RC[-29] -> 65.397582999999997 | AS32: - | AT32: =RC[-30] -> 2.9819790000000097 | AU32: =RC[-30] -> 10.486644 | AV32: =RC[-30] -> 0.69392699999999996 | AW32: =RC[-30] -> 3.5080040000000001 | AY32: - | AZ32: - | BA32: -
A33: =IF(RC[1]="","",DATEVALUE(RC[1])) -> 43385 | B33: 12.10.18 | C33: 24 | D33: 140.00074799999999 | E33: 68.856560000000002 | F33: 8.1960949999999997 | G33: 130.002182 | H33: 48.160361999999999 | I33: 5.6654679999999997 | J33: =RC[-5]-RC[-2] -> 20.696198000000003 | K33: 10.000055 | L33: 7.063644 | M33: 68.107726999999997 | N33: 2.3915549999999999 | O33: 64.452529999999996 | P33: =IF(AND(ISNUMBER(RC[-3]),ISNUMBER(RC[-1])),RC[-3]-RC[-1],"-") -> 3.6551970000000011 | Q33: 9.4551990000000004 | R33: 0.62268900000000005 | S33: 5.2260030000000004 | T33: =(RC[-16]*RC[-15]-RC[-13]*RC[-12])/1000 -> 3.3790177587969947 | U33: 6.9159290000000002 | V33: 2.3461859999999999 | W33: =RC[-2]*RC[-10]/1000 -> 0.47102820428338299 | X33: =ABS((RC[-3]*RC[-11]-RC[-2]*RC[-9])/1000) -> 0.31981058073280305 | Y33: =(RC[-14]-RC[1])/RC[-18]*100 -> 0.56763662628370348 | Z33: =RC[-5]+RC[-4] -> 9.2621149999999997 | AC33: =VALUE(RC[-27]) -> 2018-10-12T00:00:00.000 | AD33: =IF(RC[21]=42,"*",IF(RC[21]=32,"",RC[21])) -> - | AE33: =RC[-28] -> 24 | AF33: =RC[-28] -> 140.00074799999999 | AG33: =RC[-28] -> 68.856560000000002 | AH33: =RC[-28] -> 8.1960949999999997 | AI33: =RC[-28] -> 130.002182 | AJ33: =RC[-28] -> 48.160361999999999 | AK33: =RC[-28] -> 5.6654679999999997 | AL33: =RC[-28] -> 20.696198000000003 | AM33: =RC[-28] -> 10.000055 | AN33: =RC[-28] -> 7.063644 | AO33: =RC[-28] -> 68.107726999999997 | AP33: - | AQ33: =RC[-29] -> 2.3915549999999999 | AR33: =RC[-29] -> 64.452529999999996 | AS33: - | AT33: =RC[-30] -> 3.6551970000000011 | AU33: =RC[-30] -> 9.4551990000000004 | AV33: =RC[-30] -> 0.62268900000000005 | AW33: =RC[-30] -> 5.2260030000000004 | AY33: - | AZ33: - | BA33: -
A34: =IF(RC[1]="","",DATEVALUE(RC[1])) -> 43386 | B34: 13.10.18 | C34: 24 | D34: 140.02233899999999 | E34: 69.930672000000001 | F34: 8.1996310000000001 | G34: 130.38694799999999 | H34: 49.023040999999999 | I34: 5.6656469999999999 | J34: =RC[-5]-RC[-2] -> 20.907631000000002 | K34: 9.6353790000000004 | L34: 6.4620430000000004 | M34: 69.226967000000002 | N34: 3.1788669999999999 | O34: 66.603340000000003 | P34: =IF(AND(ISNUMBER(RC[-3]),ISNUMBER(RC[-1])),RC[-3]-RC[-1],"-") -> 2.623626999999999 | Q34: 9.6409099999999999 | R34: 0.64563400000000004 | S34: 4.631856 | T34: =(RC[-16]*RC[-15]-RC[-13]*RC[-12])/1000 -> 3.3998915636129405 | U34: 6.322832 | V34: 3.1149010000000001 | W34: =RC[-2]*RC[-10]/1000 -> 0.43771048221054398 | X34: =ABS((RC[-3]*RC[-11]-RC[-2]*RC[-9])/1000) -> 0.23024767184120398 | Y34: =(RC[-14]-RC[1])/RC[-18]*100 -> 0.15158419077345126 | Z34: =RC[-5]+RC[-4] -> 9.4377329999999997 | AC34: =VALUE(RC[-27]) -> 2018-10-13T00:00:00.000 | AD34: =IF(RC[21]=42,"*",IF(RC[21]=32,"",RC[21])) -> - | AE34: =RC[-28] -> 24 | AF34: =RC[-28] -> 140.02233899999999 | AG34: =RC[-28] -> 69.930672000000001 | AH34: =RC[-28] -> 8.1996310000000001 | AI34: =RC[-28] -> 130.38694799999999 | AJ34: =RC[-28] -> 49.023040999999999 | AK34: =RC[-28] -> 5.6656469999999999 | AL34: =RC[-28] -> 20.907631000000002 | AM34: =RC[-28] -> 9.6353790000000004 | AN34: =RC[-28] -> 6.4620430000000004 | AO34: =RC[-28] -> 69.226967000000002 | AP34: - | AQ34: =RC[-29] -> 3.1788669999999999 | AR34: =RC[-29] -> 66.603340000000003 | AS34: - | AT34: =RC[-30] -> 2.623626999999999 | AU34: =RC[-30] -> 9.6409099999999999 | AV34: =RC[-30] -> 0.64563400000000004 | AW34: =RC[-30] -> 4.631856 | AY34: - | AZ34: - | BA34: -
A35: =IF(RC[1]="","",DATEVALUE(RC[1])) -> 43387 | B35: 14.10.18 | C35: 24 | D35: 141.91838100000001 | E35: 70.727264000000005 | F35: 8.1877370000000003 | G35: 130.40992700000001 | H35: 50.297550000000001 | I35: 5.6547739999999997 | J35: =RC[-5]-RC[-2] -> 20.429714000000004 | K35: 11.658787 | L35: 7.7453329999999996 | M35: 70.234206999999998 | N35: 2.6461440000000001 | O35: 67.609581000000006 | P35: =IF(AND(ISNUMBER(RC[-3]),ISNUMBER(RC[-1])),RC[-3]-RC[-1],"-") -> 2.6246259999999921 | Q35: 10.391477 | R35: 0.70768500000000001 | S35: 4.7229619999999999 | T35: =(RC[-16]*RC[-15]-RC[-13]*RC[-12])/1000 -> 3.4781989756607343 | U35: 7.574014 | V35: 2.591494 | W35: =RC[-2]*RC[-10]/1000 -> 0.53195486709689799 | X35: =ABS((RC[-3]*RC[-11]-RC[-2]*RC[-9])/1000) -> 0.35674504359288389 | Y35: =(RC[-14]-RC[1])/RC[-18]*100 -> 1.1450654366212483 | Z35: =RC[-5]+RC[-4] -> 10.165507999999999 | AC35: =VALUE(RC[-27]) -> 2018-10-14T00:00:00.000 | AD35: =IF(RC[21]=42,"*",IF(RC[21]=32,"",RC[21])) -> - | AE35: =RC[-28] -> 24 | AF35: =RC[-28] -> 141.91838100000001 | AG35: =RC[-28] -> 70.727264000000005 | AH35: =RC[-28] -> 8.1877370000000003 | AI35: =RC[-28] -> 130.40992700000001 | AJ35: =RC[-28] -> 50.297550000000001 | AK35: =RC[-28] -> 5.6547739999999997 | AL35: =RC[-28] -> 20.429714000000004 | AM35: =RC[-28] -> 11.658787 | AN35: =RC[-28] -> 7.7453329999999996 | AO35: =RC[-28] -> 70.234206999999998 | AP35: - | AQ35: =RC[-29] -> 2.6461440000000001 | AR35: =RC[-29] -> 67.609581000000006 | AS35: - | AT35: =RC[-30] -> 2.6246259999999921 | AU35: =RC[-30] -> 10.391477 | AV35: =RC[-30] -> 0.70768500000000001 | AW35: =RC[-30] -> 4.7229619999999999 | AY35: - | AZ35: - | BA35: -
A36: =IF(RC[1]="","",DATEVALUE(RC[1])) -> 43388 | B36: 15.10.18 | C36: 24 | D36: 141.022415 | E36: 70.225539999999995 | F36: 8.1752179999999992 | G36: 130.60348500000001 | H36: 51.080463000000002 | I36: 5.6436060000000001 | J36: =RC[-5]-RC[-2] -> 19.145076999999993 | K36: 10.499017 | L36: 7.0535670000000001 | M36: 69.612037999999998 | N36: 2.8488660000000001 | O36: 67.088531000000003 | P36: =IF(AND(ISNUMBER(RC[-3]),ISNUMBER(RC[-1])),RC[-3]-RC[-1],"-") -> 2.5235069999999951 | Q36: 9.9024330000000003 | R36: 0.66805599999999998 | S36: 4.4899060000000004 | T36: =(RC[-16]*RC[-15]-RC[-13]*RC[-12])/1000 -> 3.2320887622655436 | U36: 6.9000830000000004 | V36: 2.7908559999999998 | W36: =RC[-2]*RC[-10]/1000 -> 0.48032883999915399 | X36: =ABS((RC[-3]*RC[-11]-RC[-2]*RC[-9])/1000) -> 0.29309441072661796 | Y36: =(RC[-14]-RC[1])/RC[-18]*100 -> 0.61872621546048334 | Z36: =RC[-5]+RC[-4] -> 9.6909390000000002 | AC36: =VALUE(RC[-27]) -> 2018-10-15T00:00:00.000 | AD36: =IF(RC[21]=42,"*",IF(RC[21]=32,"",RC[21])) -> - | AE36: =RC[-28] -> 24 | AF36: =RC[-28] -> 141.022415 | AG36: =RC[-28] -> 70.225539999999995 | AH36: =RC[-28] -> 8.1752179999999992 | AI36: =RC[-28] -> 130.60348500000001 | AJ36: =RC[-28] -> 51.080463000000002 | AK36: =RC[-28] -> 5.6436060000000001 | AL36: =RC[-28] -> 19.145076999999993 | AM36: =RC[-28] -> 10.499017 | AN36: =RC[-28] -> 7.0535670000000001 | AO36: =RC[-28] -> 69.612037999999998 | AP36: - | AQ36: =RC[-29] -> 2.8488660000000001 | AR36: =RC[-29] -> 67.088531000000003 | AS36: - | AT36: =RC[-30] -> 2.5235069999999951 | AU36: =RC[-30] -> 9.9024330000000003 | AV36: =RC[-30] -> 0.66805599999999998 | AW36: =RC[-30] -> 4.4899060000000004 | AY36: - | AZ36: - | BA36: -
A37: =IF(RC[1]="","",DATEVALUE(RC[1])) -> 43389 | B37: 16.10.18 | C37: 24 | D37: 139.83596800000001 | E37: 70.248671999999999 | F37: 8.1707990000000006 | G37: 130.53183000000001 | H37: 51.203029999999998 | I37: 5.6334400000000002 | J37: =RC[-5]-RC[-2] -> 19.045642000000001 | K37: 9.3145749999999996 | L37: 6.3005209999999998 | M37: 69.511688000000007 | N37: 2.957389 | O37: 66.546822000000006 | P37: =IF(AND(ISNUMBER(RC[-3]),ISNUMBER(RC[-1])),RC[-3]-RC[-1],"-") -> 2.9648660000000007 | Q37: 9.2579100000000007 | R37: 0.62175000000000002 | S37: 4.3898200000000003 | T37: =(RC[-16]*RC[-15]-RC[-13]*RC[-12])/1000 -> 3.1396658423895971 | U37: 6.1638000000000002 | V37: 2.897939 | W37: =RC[-2]*RC[-10]/1000 -> 0.42845614249440006 | X37: =ABS((RC[-3]*RC[-11]-RC[-2]*RC[-9])/1000) -> 0.23560751169454203 | Y37: =(RC[-14]-RC[1])/RC[-18]*100 -> 0.19369681709051367 | Z37: =RC[-5]+RC[-4] -> 9.0617389999999993 | AC37: =VALUE(RC[-27]) -> 2018-10-16T00:00:00.000 | AD37: =IF(RC[21]=42,"*",IF(RC[21]=32,"",RC[21])) -> - | AE37: =RC[-28] -> 24 | AF37: =RC[-28] -> 139.83596800000001 | AG37: =RC[-28] -> 70.248671999999999 | AH37: =RC[-28] -> 8.1707990000000006 | AI37: =RC[-28] -> 130.53183000000001 | AJ37: =RC[-28] -> 51.203029999999998 | AK37: =RC[-28] -> 5.6334400000000002 | AL37: =RC[-28] -> 19.045642000000001 | AM37: =RC[-28] -> 9.3145749999999996 | AN37: =RC[-28] -> 6.3005209999999998 | AO37: =RC[-28] -> 69.511688000000007 | AP37: - | AQ37: =RC[-29] -> 2.957389 | AR37: =RC[-29] -> 66.546822000000006 | AS37: - | AT37: =RC[-30] -> 2.9648660000000007 | AU37: =RC[-30] -> 9.2579100000000007 | AV37: =RC[-30] -> 0.62175000000000002 | AW37: =RC[-30] -> 4.3898200000000003 | AY37: - | AZ37: - | BA37: -
A38: =IF(RC[1]="","",DATEVALUE(RC[1])) -> 43390 | B38: 17.10.18 | C38: 24 | D38: 141.25741600000001 | E38: 70.430083999999994 | F38: 8.1815490000000004 | G38: 130.58296200000001 | H38: 51.114013999999997 | I38: 5.6428450000000003 | J38: =RC[-5]-RC[-2] -> 19.316069999999996 | K38: 10.674441 | L38: 6.9695999999999998 | M38: 69.843079000000003 | N38: 3.2537560000000001 | O38: 67.559921000000003 | P38: =IF(AND(ISNUMBER(RC[-3]),ISNUMBER(RC[-1])),RC[-3]-RC[-1],"-") -> 2.2831580000000002 | Q38: 10.223356000000001 | R38: 0.69192799999999999 | S38: 4.5303659999999999 | T38: =(RC[-16]*RC[-15]-RC[-13]*RC[-12])/1000 -> 3.2741523266734749 | U38: 6.8170250000000001 | V38: 3.1866750000000001 | W38: =RC[-2]*RC[-10]/1000 -> 0.47612201561997503 | X38: =ABS((RC[-3]*RC[-11]-RC[-2]*RC[-9])/1000) -> 0.26083050436730004 | Y38: =(RC[-14]-RC[1])/RC[-18]*100 -> 0.51365123728775541 | Z38: =RC[-5]+RC[-4] -> 10.0037 | AC38: =VALUE(RC[-27]) -> 2018-10-17T00:00:00.000 | AD38: =IF(RC[21]=42,"*",IF(RC[21]=32,"",RC[21])) -> - | AE38: =RC[-28] -> 24 | AF38: =RC[-28] -> 141.25741600000001 | AG38: =RC[-28] -> 70.430083999999994 | AH38: =RC[-28] -> 8.1815490000000004 | AI38: =RC[-28] -> 130.58296200000001 | AJ38: =RC[-28] -> 51.114013999999997 | AK38: =RC[-28] -> 5.6428450000000003 | AL38: =RC[-28] -> 19.316069999999996 | AM38: =RC[-28] -> 10.674441 | AN38: =RC[-28] -> 6.9695999999999998 | AO38: =RC[-28] -> 69.843079000000003 | AP38: - | AQ38: =RC[-29] -> 3.2537560000000001 | AR38: =RC[-29] -> 67.559921000000003 | AS38: - | AT38: =RC[-30] -> 2.2831580000000002 | AU38: =RC[-30] -> 10.223356000000001 | AV38: =RC[-30] -> 0.69192799999999999 | AW38: =RC[-30] -> 4.5303659999999999 | AY38: - | AZ38: - | BA38: -
A39: =IF(RC[1]="","",DATEVALUE(RC[1])) -> 43391 | B39: 18.10.18 | C39: 24 | D39: 141.71624800000001 | E39: 70.921477999999993 | F39: 8.1833679999999998 | G39: 130.695099 | H39: 51.501548999999997 | I39: 5.639386 | J39: 19.419928999999996 | K39: 11.096278 | L39: 7.1534990000000001 | M39: 70.328025999999994 | N39: 3.2084999999999999 | O39: 67.799530000000004 | P39: 2.5284959999999899 | Q39: 10.361999000000001 | R39: 0.70548599999999995 | S39: 3.3317079999999999 | T39: 3.3197257195661924 | U39: 6.994929 | V39: 3.1419169999999998 | W39: 0.49193954858015393 | X39: 0.27891905268114398 | Y39: 0.73409944775358382 | Z39: 10.136846 | AC39: =VALUE(RC[-27]) -> 2018-10-18T00:00:00.000 | AD39: =IF(RC[21]=42,"*",IF(RC[21]=32,"",RC[21])) ->  | AE39: =RC[-28] -> 24 | AF39: =RC[-28] -> 141.71624800000001 | AG39: =RC[-28] -> 70.921477999999993 | AH39: =RC[-28] -> 8.1833679999999998 | AI39: =RC[-28] -> 130.695099 | AJ39: =RC[-28] -> 51.501548999999997 | AK39: =RC[-28] -> 5.639386 | AL39: =RC[-28] -> 19.419928999999996 | AM39: =RC[-28] -> 11.096278 | AN39: =RC[-28] -> 7.1534990000000001 | AO39: =RC[-28] -> 70.328025999999994 | AP39: - | AQ39: =RC[-29] -> 3.2084999999999999 | AR39: =RC[-29] -> 67.799530000000004 | AS39: - | AT39: =RC[-30] -> 2.5284959999999899 | AU39: =RC[-30] -> 10.361999000000001 | AV39: =RC[-30] -> 0.70548599999999995 | AW39: =RC[-30] -> 3.3317079999999999
A40: =IF(RC[1]="","",DATEVALUE(RC[1])) -> 43392 | B40: 19.10.18 | C40: 24 | D40: 140.72081 | E40: 70.708313000000004 | F40: 8.1825939999999999 | G40: 130.55249000000001 | H40: 50.902428 | I40: 5.6354709999999999 | J40: 19.805885000000004 | K40: 10.269501999999999 | L40: 6.8549009999999999 | M40: 70.081871000000007 | N40: 3.051733 | O40: 67.067261000000002 | P40: 3.0146100000000047 | Q40: 9.9066340000000004 | R40: 0.67081100000000005 | S40: 3.9404249999999998 | T40: 3.304692356647811 | U40: 6.7039070000000001 | V40: 2.989563 | W40: 0.46982234556999702 | X40: 0.26932054357305402 | Y40: 0.44122636037045304 | Z40: 9.6934699999999996 | AC40: =VALUE(RC[-27]) -> 2018-10-19T00:00:00.000 | AD40: =IF(RC[21]=42,"*",IF(RC[21]=32,"",RC[21])) ->  | AE40: =RC[-28] -> 24 | AF40: =RC[-28] -> 140.72081 | AG40: =RC[-28] -> 70.708313000000004 | AH40: =RC[-28] -> 8.1825939999999999 | AI40: =RC[-28] -> 130.55249000000001 | AJ40: =RC[-28] -> 50.902428 | AK40: =RC[-28] -> 5.6354709999999999 | AL40: =RC[-28] -> 19.805885000000004 | AM40: =RC[-28] -> 10.269501999999999 | AN40: =RC[-28] -> 6.8549009999999999 | AO40: =RC[-28] -> 70.081871000000007 | AP40: - | AQ40: =RC[-29] -> 3.051733 | AR40: =RC[-29] -> 67.067261000000002 | AS40: - | AT40: =RC[-30] -> 3.0146100000000047 | AU40: =RC[-30] -> 9.9066340000000004 | AV40: =RC[-30] -> 0.67081100000000005 | AW40: =RC[-30] -> 3.9404249999999998
A41: =IF(RC[1]="","",DATEVALUE(RC[1])) -> 43393 | B41: 20.10.18 | C41: 24 | D41: 141.58578499999999 | E41: 70.047684000000004 | F41: 8.1827699999999997 | G41: 130.66670199999999 | H41: 50.152706000000002 | I41: 5.6127000000000002 | J41: 19.894978000000002 | K41: 11.071916999999999 | L41: 7.4286329999999996 | M41: 69.466865999999996 | N41: 2.8054549999999998 | O41: 66.955444 | P41: 2.511421999999996 | Q41: 10.234088 | R41: 0.68938500000000003 | S41: 4.616835 | T41: 3.364467637176328 | U41: 7.2675580000000002 | V41: 2.748523 | W41: 0.504854477733228 | X41: 0.32082589992401594 | Y41: 0.80803753660209432 | Z41: 10.016081 | AC41: =VALUE(RC[-27]) -> 2018-10-20T00:00:00.000 | AD41: =IF(RC[21]=42,"*",IF(RC[21]=32,"",RC[21])) ->  | AE41: =RC[-28] -> 24 | AF41: =RC[-28] -> 141.58578499999999 | AG41: =RC[-28] -> 70.047684000000004 | AH41: =RC[-28] -> 8.1827699999999997 | AI41: =RC[-28] -> 130.66670199999999 | AJ41: =RC[-28] -> 50.152706000000002 | AK41: =RC[-28] -> 5.6127000000000002 | AL41: =RC[-28] -> 19.894978000000002 | AM41: =RC[-28] -> 11.071916999999999 | AN41: =RC[-28] -> 7.4286329999999996 | AO41: =RC[-28] -> 69.466865999999996 | AP41: - | AQ41: =RC[-29] -> 2.8054549999999998 | AR41: =RC[-29] -> 66.955444 | AS41: - | AT41: =RC[-30] -> 2.511421999999996 | AU41: =RC[-30] -> 10.234088 | AV41: =RC[-30] -> 0.68938500000000003 | AW41: =RC[-30] -> 4.616835
A42: =IF(RC[1]="","",DATEVALUE(RC[1])) -> 43394 | B42: 21.10.18 | C42: 24 | D42: 144.54023699999999 | E42: 69.156265000000005 | F42: 8.1776470000000003 | G42: 130.390579 | H42: 49.356216000000003 | I42: 5.6270319999999998 | J42: 19.800049000000001 | K42: 14.261844 | L42: 8.7495989999999999 | M42: 68.649078000000003 | N42: 3.9987110000000001 | O42: 66.524833999999998 | P42: 2.1242440000000045 | Q42: 12.74831 | R42: 0.84922200000000003 | S42: 4.809876 | T42: 3.5602773516457411 | U42: 8.5639830000000003 | V42: 3.9185629999999998 | W42: 0.58790953695767401 | X42: 0.32722778386413204 | Y42: 1.3645909187963654 | Z42: 12.482545999999999 | AC42: =VALUE(RC[-27]) -> 2018-10-21T00:00:00.000 | AD42: =IF(RC[21]=42,"*",IF(RC[21]=32,"",RC[21])) ->  | AE42: =RC[-28] -> 24 | AF42: =RC[-28] -> 144.54023699999999 | AG42: =RC[-28] -> 69.156265000000005 | AH42: =RC[-28] -> 8.1776470000000003 | AI42: =RC[-28] -> 130.390579 | AJ42: =RC[-28] -> 49.356216000000003 | AK42: =RC[-28] -> 5.6270319999999998 | AL42: =RC[-28] -> 19.800049000000001 | AM42: =RC[-28] -> 14.261844 | AN42: =RC[-28] -> 8.7495989999999999 | AO42: =RC[-28] -> 68.649078000000003 | AP42: - | AQ42: =RC[-29] -> 3.9987110000000001 | AR42: =RC[-29] -> 66.524833999999998 | AS42: - | AT42: =RC[-30] -> 2.1242440000000045 | AU42: =RC[-30] -> 12.74831 | AV42: =RC[-30] -> 0.84922200000000003 | AW42: =RC[-30] -> 4.809876
A43: =IF(RC[1]="","",DATEVALUE(RC[1])) -> 43395 | B43: 22.10.18 | C43: 24 | D43: 141.62330600000001 | E43: 69.621764999999996 | F43: 8.1866160000000008 | G43: 130.31802400000001 | H43: 49.350529000000002 | I43: 5.6420190000000003 | J43: 20.271235999999995 | K43: 11.305287999999999 | L43: 7.4220889999999997 | M43: 69.025620000000004 | N43: 3.156177 | O43: 66.517928999999995 | P43: 2.5076910000000083 | Q43: 10.578265999999999 | R43: 0.70758399999999999 | S43: 4.6784939999999997 | T43: 3.4288011062203951 | U43: 7.2630290000000004 | V43: 3.0928849999999999 | W43: 0.50133507980298009 | X43: 0.29560277496781512 | Y43: 0.72850552123165924 | Z43: 10.355914 | AC43: =VALUE(RC[-27]) -> 2018-10-22T00:00:00.000 | AD43: =IF(RC[21]=42,"*",IF(RC[21]=32,"",RC[21])) ->  | AE43: =RC[-28] -> 24 | AF43: =RC[-28] -> 141.62330600000001 | AG43: =RC[-28] -> 69.621764999999996 | AH43: =RC[-28] -> 8.1866160000000008 | AI43: =RC[-28] -> 130.31802400000001 | AJ43: =RC[-28] -> 49.350529000000002 | AK43: =RC[-28] -> 5.6420190000000003 | AL43: =RC[-28] -> 20.271235999999995 | AM43: =RC[-28] -> 11.305287999999999 | AN43: =RC[-28] -> 7.4220889999999997 | AO43: =RC[-28] -> 69.025620000000004 | AP43: - | AQ43: =RC[-29] -> 3.156177 | AR43: =RC[-29] -> 66.517928999999995 | AS43: - | AT43: =RC[-30] -> 2.5076910000000083 | AU43: =RC[-30] -> 10.578265999999999 | AV43: =RC[-30] -> 0.70758399999999999 | AW43: =RC[-30] -> 4.6784939999999997
A44: =IF(RC[1]="","",DATEVALUE(RC[1])) ->  | C44: 24 | J44: =RC[-5]-RC[-2] -> #VALUE! | P44: =IF(AND(ISNUMBER(RC[-3]),ISNUMBER(RC[-1])),RC[-3]-RC[-1],"-") -> - | T44: =(RC[-16]*RC[-15]-RC[-13]*RC[-12])/1000 -> #VALUE! | W44: =RC[-2]*RC[-10]/1000 -> #VALUE! | X44: =ABS((RC[-3]*RC[-11]-RC[-2]*RC[-9])/1000) -> #VALUE! | Y44: =(RC[-14]-RC[1])/RC[-18]*100 -> #VALUE! | Z44: =RC[-5]+RC[-4] -> #VALUE! | AC44: =VALUE(RC[-27]) -> #VALUE! | AD44: =IF(RC[21]=42,"*",IF(RC[21]=32,"",RC[21])) ->  | AE44: =RC[-28] -> 24 | AF44: =RC[-28] ->  | AG44: =RC[-28] ->  | AH44: =RC[-28] ->  | AI44: =RC[-28] ->  | AJ44: =RC[-28] ->  | AK44: =RC[-28] ->  | AL44: =RC[-28] -> #VALUE! | AM44: =RC[-28] ->  | AN44: =RC[-28] ->  | AO44: =RC[-28] ->  | AP44: - | AQ44: =RC[-29] ->  | AR44: =RC[-29] ->  | AS44: - | AT44: =RC[-30] -> - | AU44: =RC[-30] ->  | AV44: =RC[-30] ->  | AW44: =RC[-30] -> 
A45: =IF(RC[1]="","",DATEVALUE(RC[1])) ->  | C45: 24 | P45: =IF(AND(ISNUMBER(RC[-3]),ISNUMBER(RC[-1])),RC[-3]-RC[-1],"-") -> - | T45: =(RC[-16]*RC[-15]-RC[-13]*RC[-12])/1000 -> #VALUE! | W45: =RC[-2]*RC[-10]/1000 -> #VALUE! | X45: =ABS((RC[-3]*RC[-11]-RC[-2]*RC[-9])/1000) -> #VALUE! | Y45: =(RC[-14]-RC[1])/RC[-18]*100 -> #VALUE! | Z45: =RC[-5]+RC[-4] -> #VALUE! | AC45: =VALUE(RC[-27]) -> #VALUE! | AD45: =IF(RC[21]=42,"*",IF(RC[21]=32,"",RC[21])) ->  | AE45: =RC[-28] -> 24 | AF45: =RC[-28] ->  | AG45: =RC[-28] ->  | AH45: =RC[-28] ->  | AI45: =RC[-28] ->  | AJ45: =RC[-28] ->  | AK45: =RC[-28] ->  | AL45: =RC[-28] -> 0 | AM45: =RC[-28] ->  | AN45: =RC[-28] ->  | AO45: =RC[-28] ->  | AP45: - | AQ45: =RC[-29] ->  | AR45: =RC[-29] ->  | AS45: - | AT45: =RC[-30] -> - | AU45: =RC[-30] ->  | AV45: =RC[-30] ->  | AW45: =RC[-30] -> 
A46: =IF(RC[1]="","",DATEVALUE(RC[1])) ->  | C46: 24 | P46: =IF(AND(ISNUMBER(RC[-3]),ISNUMBER(RC[-1])),RC[-3]-RC[-1],"-") -> - | T46: =(RC[-16]*RC[-15]-RC[-13]*RC[-12])/1000 -> #VALUE! | W46: =RC[-2]*RC[-10]/1000 -> #VALUE! | X46: =ABS((RC[-3]*RC[-11]-RC[-2]*RC[-9])/1000) -> #VALUE! | Y46: =(RC[-14]-RC[1])/RC[-18]*100 -> #VALUE! | Z46: =RC[-5]+RC[-4] -> #VALUE! | AC46: =VALUE(RC[-27]) -> #VALUE! | AD46: =IF(RC[21]=42,"*",IF(RC[21]=32,"",RC[21])) ->  | AE46: =RC[-28] -> 24 | AF46: =RC[-28] ->  | AG46: =RC[-28] ->  | AH46: =RC[-28] ->  | AI46: =RC[-28] ->  | AJ46: =RC[-28] ->  | AK46: =RC[-28] ->  | AL46: =RC[-28] -> 0 | AM46: =RC[-28] ->  | AN46: =RC[-28] ->  | AO46: =RC[-28] ->  | AP46: - | AQ46: =RC[-29] ->  | AR46: =RC[-29] ->  | AS46: - | AT46: =RC[-30] -> - | AU46: =RC[-30] ->  | AV46: =RC[-30] ->  | AW46: =RC[-30] -> 
A47: =IF(RC[1]="","",DATEVALUE(RC[1])) ->  | C47: 24 | P47: =IF(AND(ISNUMBER(RC[-3]),ISNUMBER(RC[-1])),RC[-3]-RC[-1],"-") -> - | T47: =(RC[-16]*RC[-15]-RC[-13]*RC[-12])/1000 -> #VALUE! | W47: =RC[-2]*RC[-10]/1000 -> #VALUE! | X47: =ABS((RC[-3]*RC[-11]-RC[-2]*RC[-9])/1000) -> #VALUE! | Y47: =(RC[-14]-RC[1])/RC[-18]*100 -> #VALUE! | Z47: =RC[-5]+RC[-4] -> #VALUE! | AC47: =VALUE(RC[-27]) -> #VALUE! | AD47: =IF(RC[21]=42,"*",IF(RC[21]=32,"",RC[21])) ->  | AE47: =RC[-28] -> 24 | AF47: =RC[-28] ->  | AG47: =RC[-28] ->  | AH47: =RC[-28] ->  | AI47: =RC[-28] ->  | AJ47: =RC[-28] ->  | AK47: =RC[-28] ->  | AL47: =RC[-28] -> 0 | AM47: =RC[-28] ->  | AN47: =RC[-28] ->  | AO47: =RC[-28] ->  | AP47: - | AQ47: =RC[-29] ->  | AR47: =RC[-29] ->  | AS47: - | AT47: =RC[-30] -> - | AU47: =RC[-30] ->  | AV47: =RC[-30] ->  | AW47: =RC[-30] -> 
A48: =IF(RC[1]="","",DATEVALUE(RC[1])) ->  | C48: 24 | P48: =IF(AND(ISNUMBER(RC[-3]),ISNUMBER(RC[-1])),RC[-3]-RC[-1],"-") -> - | T48: =(RC[-16]*RC[-15]-RC[-13]*RC[-12])/1000 -> #VALUE! | W48: =RC[-2]*RC[-10]/1000 -> #VALUE! | X48: =ABS((RC[-3]*RC[-11]-RC[-2]*RC[-9])/1000) -> #VALUE! | Y48: =(RC[-14]-RC[1])/RC[-18]*100 -> #VALUE! | Z48: =RC[-5]+RC[-4] -> #VALUE! | AC48: =VALUE(RC[-27]) -> #VALUE! | AD48: =IF(RC[21]=42,"*",IF(RC[21]=32,"",RC[21])) ->  | AE48: =RC[-28] -> 24 | AF48: =RC[-28] ->  | AG48: =RC[-28] ->  | AH48: =RC[-28] ->  | AI48: =RC[-28] ->  | AJ48: =RC[-28] ->  | AK48: =RC[-28] ->  | AL48: =RC[-28] -> 0 | AM48: =RC[-28] ->  | AN48: =RC[-28] ->  | AO48: =RC[-28] ->  | AP48: - | AQ48: =RC[-29] ->  | AR48: =RC[-29] ->  | AS48: - | AT48: =RC[-30] -> - | AU48: =RC[-30] ->  | AV48: =RC[-30] ->  | AW48: =RC[-30] -> 
A49: =IF(RC[1]="","",DATEVALUE(RC[1])) ->  | C49: 24 | P49: =IF(AND(ISNUMBER(RC[-3]),ISNUMBER(RC[-1])),RC[-3]-RC[-1],"-") -> - | T49: =(RC[-16]*RC[-15]-RC[-13]*RC[-12])/1000 -> #VALUE! | W49: =RC[-2]*RC[-10]/1000 -> #VALUE! | X49: =ABS((RC[-3]*RC[-11]-RC[-2]*RC[-9])/1000) -> #VALUE! | Y49: =(RC[-14]-RC[1])/RC[-18]*100 -> #VALUE! | Z49: =RC[-5]+RC[-4] -> #VALUE! | AC49: =VALUE(RC[-27]) -> #VALUE! | AD49: =IF(RC[21]=42,"*",IF(RC[21]=32,"",RC[21])) ->  | AE49: =RC[-28] -> 24 | AF49: =RC[-28] ->  | AG49: =RC[-28] ->  | AH49: =RC[-28] ->  | AI49: =RC[-28] ->  | AJ49: =RC[-28] ->  | AK49: =RC[-28] ->  | AL49: =RC[-28] -> 0 | AM49: =RC[-28] ->  | AN49: =RC[-28] ->  | AO49: =RC[-28] ->  | AP49: - | AQ49: =RC[-29] ->  | AR49: =RC[-29] ->  | AS49: - | AT49: =RC[-30] -> - | AU49: =RC[-30] ->  | AV49: =RC[-30] ->  | AW49: =RC[-30] -> 
A50: =IF(RC[1]="","",DATEVALUE(RC[1])) ->  | P50: =IF(AND(ISNUMBER(RC[-3]),ISNUMBER(RC[-1])),RC[-3]-RC[-1],"-") -> - | T50: =(RC[-16]*RC[-15]-RC[-13]*RC[-12])/1000 -> #VALUE! | W50: =RC[-2]*RC[-10]/1000 -> #VALUE! | X50: =ABS((RC[-3]*RC[-11]-RC[-2]*RC[-9])/1000) -> #VALUE! | Y50: =(RC[-14]-RC[1])/RC[-18]*100 -> #VALUE! | Z50: =RC[-5]+RC[-4] -> #VALUE! | AC50: =VALUE(RC[-27]) -> #VALUE! | AD50: =IF(RC[21]=42,"*",IF(RC[21]=32,"",RC[21])) ->  | AE50: =RC[-28] ->  | AF50: =RC[-28] ->  | AG50: =RC[-28] ->  | AH50: =RC[-28] ->  | AI50: =RC[-28] ->  | AJ50: =RC[-28] ->  | AK50: =RC[-28] ->  | AL50: =RC[-28] -> 0 | AM50: =RC[-28] ->  | AN50: =RC[-28] ->  | AO50: =RC[-28] ->  | AP50: - | AQ50: =RC[-29] ->  | AR50: =RC[-29] ->  | AS50: - | AT50: =RC[-30] -> - | AU50: =RC[-30] ->  | AV50: =RC[-30] ->  | AW50: =RC[-30] -> 
A51: =IF(RC[1]="","",DATEVALUE(RC[1])) ->  | P51: =IF(AND(ISNUMBER(RC[-3]),ISNUMBER(RC[-1])),RC[-3]-RC[-1],"-") -> - | T51: =(RC[-16]*RC[-15]-RC[-13]*RC[-12])/1000 -> #VALUE! | W51: =RC[-2]*RC[-10]/1000 -> #VALUE! | X51: =ABS((RC[-3]*RC[-11]-RC[-2]*RC[-9])/1000) -> #VALUE! | Y51: =(RC[-14]-RC[1])/RC[-18]*100 -> #VALUE! | Z51: =RC[-5]+RC[-4] -> #VALUE! | AC51: =VALUE(RC[-27]) -> #VALUE! | AD51: =IF(RC[21]=42,"*",IF(RC[21]=32,"",RC[21])) ->  | AE51: =RC[-28] ->  | AF51: =RC[-28] ->  | AG51: =RC[-28] ->  | AH51: =RC[-28] ->  | AI51: =RC[-28] ->  | AJ51: =RC[-28] ->  | AK51: =RC[-28] ->  | AL51: =RC[-28] -> 0 | AM51: =RC[-28] ->  | AN51: =RC[-28] ->  | AO51: =RC[-28] ->  | AP51: - | AQ51: =RC[-29] ->  | AR51: =RC[-29] ->  | AS51: - | AT51: =RC[-30] -> - | AU51: =RC[-30] ->  | AV51: =RC[-30] ->  | AW51: =RC[-30] -> 
A52: =IF(RC[1]="","",DATEVALUE(RC[1])) ->  | P52: =IF(AND(ISNUMBER(RC[-3]),ISNUMBER(RC[-1])),RC[-3]-RC[-1],"-") -> - | T52: =(RC[-16]*RC[-15]-RC[-13]*RC[-12])/1000 -> #VALUE! | W52: =RC[-2]*RC[-10]/1000 -> #VALUE! | X52: =ABS((RC[-3]*RC[-11]-RC[-2]*RC[-9])/1000) -> #VALUE! | Y52: =(RC[-14]-RC[1])/RC[-18]*100 -> #VALUE! | Z52: =RC[-5]+RC[-4] -> #VALUE! | AC52: =VALUE(RC[-27]) -> #VALUE! | AD52: =IF(RC[21]=42,"*",IF(RC[21]=32,"",RC[21])) ->  | AE52: =RC[-28] ->  | AF52: =RC[-28] ->  | AG52: =RC[-28] ->  | AH52: =RC[-28] ->  | AI52: =RC[-28] ->  | AJ52: =RC[-28] ->  | AK52: =RC[-28] ->  | AL52: =RC[-28] -> 0 | AM52: =RC[-28] ->  | AN52: =RC[-28] ->  | AO52: =RC[-28] ->  | AP52: - | AQ52: =RC[-29] ->  | AR52: =RC[-29] ->  | AS52: - | AT52: =RC[-30] -> - | AU52: =RC[-30] ->  | AV52: =RC[-30] ->  | AW52: =RC[-30] -> 
A53: =IF(RC[1]="","",DATEVALUE(RC[1])) ->  | P53: =IF(AND(ISNUMBER(RC[-3]),ISNUMBER(RC[-1])),RC[-3]-RC[-1],"-") -> - | T53: =(RC[-16]*RC[-15]-RC[-13]*RC[-12])/1000 -> #VALUE! | W53: =RC[-2]*RC[-10]/1000 -> #VALUE! | X53: =ABS((RC[-3]*RC[-11]-RC[-2]*RC[-9])/1000) -> #VALUE! | Y53: =(RC[-14]-RC[1])/RC[-18]*100 -> #VALUE! | Z53: =RC[-5]+RC[-4] -> #VALUE! | AC53: =VALUE(RC[-27]) -> #VALUE! | AD53: =IF(RC[21]=42,"*",IF(RC[21]=32,"",RC[21])) ->  | AE53: =RC[-28] ->  | AF53: =RC[-28] ->  | AG53: =RC[-28] ->  | AH53: =RC[-28] ->  | AI53: =RC[-28] ->  | AJ53: =RC[-28] ->  | AK53: =RC[-28] ->  | AL53: =RC[-28] -> 0 | AM53: =RC[-28] ->  | AN53: =RC[-28] ->  | AO53: =RC[-28] ->  | AP53: - | AQ53: =RC[-29] ->  | AR53: =RC[-29] ->  | AS53: - | AT53: =RC[-30] -> - | AU53: =RC[-30] ->  | AV53: =RC[-30] ->  | AW53: =RC[-30] -> 
A54: =IF(RC[1]="","",DATEVALUE(RC[1])) ->  | P54: =IF(AND(ISNUMBER(RC[-3]),ISNUMBER(RC[-1])),RC[-3]-RC[-1],"-") -> - | T54: =(RC[-16]*RC[-15]-RC[-13]*RC[-12])/1000 -> #VALUE! | W54: =RC[-2]*RC[-10]/1000 -> #VALUE! | X54: =ABS((RC[-3]*RC[-11]-RC[-2]*RC[-9])/1000) -> #VALUE! | Y54: =(RC[-14]-RC[1])/RC[-18]*100 -> #VALUE! | Z54: =RC[-5]+RC[-4] -> #VALUE! | AC54: =VALUE(RC[-27]) -> #VALUE! | AD54: =IF(RC[21]=42,"*",IF(RC[21]=32,"",RC[21])) ->  | AE54: =RC[-28] ->  | AF54: =RC[-28] ->  | AG54: =RC[-28] ->  | AH54: =RC[-28] ->  | AI54: =RC[-28] ->  | AJ54: =RC[-28] ->  | AK54: =RC[-28] ->  | AL54: =RC[-28] -> 0 | AM54: =RC[-28] ->  | AN54: =RC[-28] ->  | AO54: =RC[-28] ->  | AP54: - | AQ54: =RC[-29] ->  | AR54: =RC[-29] ->  | AS54: - | AT54: =RC[-30] -> - | AU54: =RC[-30] ->  | AV54: =RC[-30] ->  | AW54: =RC[-30] -> 
A55: =IF(RC[1]="","",DATEVALUE(RC[1])) ->  | P55: =IF(AND(ISNUMBER(RC[-3]),ISNUMBER(RC[-1])),RC[-3]-RC[-1],"-") -> - | T55: =(RC[-16]*RC[-15]-RC[-13]*RC[-12])/1000 -> #VALUE! | W55: =RC[-2]*RC[-10]/1000 -> #VALUE! | X55: =ABS((RC[-3]*RC[-11]-RC[-2]*RC[-9])/1000) -> #VALUE! | Y55: =(RC[-14]-RC[1])/RC[-18]*100 -> #VALUE! | Z55: =RC[-5]+RC[-4] -> #VALUE! | AC55: =VALUE(RC[-27]) -> #VALUE! | AD55: =IF(RC[21]=42,"*",IF(RC[21]=32,"",RC[21])) ->  | AE55: =RC[-28] ->  | AF55: =RC[-28] ->  | AG55: =RC[-28] ->  | AH55: =RC[-28] ->  | AI55: =RC[-28] ->  | AJ55: =RC[-28] ->  | AK55: =RC[-28] ->  | AL55: =RC[-28] -> 0 | AM55: =RC[-28] ->  | AN55: =RC[-28] ->  | AO55: =RC[-28] ->  | AP55: - | AQ55: =RC[-29] ->  | AR55: =RC[-29] ->  | AS55: - | AT55: =RC[-30] -> - | AU55: =RC[-30] ->  | AV55: =RC[-30] ->  | AW55: =RC[-30] -> 
A56: =IF(RC[1]="","",DATEVALUE(RC[1])) ->  | P56: =IF(AND(ISNUMBER(RC[-3]),ISNUMBER(RC[-1])),RC[-3]-RC[-1],"-") -> - | T56: =(RC[-16]*RC[-15]-RC[-13]*RC[-12])/1000 -> #VALUE! | W56: =RC[-2]*RC[-10]/1000 -> #VALUE! | X56: =ABS((RC[-3]*RC[-11]-RC[-2]*RC[-9])/1000) -> #VALUE! | Y56: =(RC[-14]-RC[1])/RC[-18]*100 -> #VALUE! | Z56: =RC[-5]+RC[-4] -> #VALUE! | AC56: =VALUE(RC[-27]) -> #VALUE! | AD56: =IF(RC[21]=42,"*",IF(RC[21]=32,"",RC[21])) ->  | AE56: =RC[-28] ->  | AF56: =RC[-28] ->  | AG56: =RC[-28] ->  | AH56: =RC[-28] ->  | AI56: =RC[-28] ->  | AJ56: =RC[-28] ->  | AK56: =RC[-28] ->  | AL56: =RC[-28] -> 0 | AM56: =RC[-28] ->  | AN56: =RC[-28] ->  | AO56: =RC[-28] ->  | AP56: - | AQ56: =RC[-29] ->  | AR56: =RC[-29] ->  | AS56: - | AT56: =RC[-30] -> - | AU56: =RC[-30] ->  | AV56: =RC[-30] ->  | AW56: =RC[-30] -> 
A57: =IF(RC[1]="","",DATEVALUE(RC[1])) ->  | P57: =IF(AND(ISNUMBER(RC[-3]),ISNUMBER(RC[-1])),RC[-3]-RC[-1],"-") -> - | T57: =(RC[-16]*RC[-15]-RC[-13]*RC[-12])/1000 -> #VALUE! | W57: =RC[-2]*RC[-10]/1000 -> #VALUE! | X57: =ABS((RC[-3]*RC[-11]-RC[-2]*RC[-9])/1000) -> #VALUE! | Y57: =(RC[-14]-RC[1])/RC[-18]*100 -> #VALUE! | Z57: =RC[-5]+RC[-4] -> #VALUE! | AC57: =VALUE(RC[-27]) -> #VALUE! | AD57: =IF(RC[21]=42,"*",IF(RC[21]=32,"",RC[21])) ->  | AE57: =RC[-28] ->  | AF57: =RC[-28] ->  | AG57: =RC[-28] ->  | AH57: =RC[-28] ->  | AI57: =RC[-28] ->  | AJ57: =RC[-28] ->  | AK57: =RC[-28] ->  | AL57: =RC[-28] -> 0 | AM57: =RC[-28] ->  | AN57: =RC[-28] ->  | AO57: =RC[-28] ->  | AP57: - | AQ57: =RC[-29] ->  | AR57: =RC[-29] ->  | AS57: - | AT57: =RC[-30] -> - | AU57: =RC[-30] ->  | AV57: =RC[-30] ->  | AW57: =RC[-30] -> 
A58: =IF(RC[1]="","",DATEVALUE(RC[1])) ->  | P58: =IF(AND(ISNUMBER(RC[-3]),ISNUMBER(RC[-1])),RC[-3]-RC[-1],"-") -> - | T58: =(RC[-16]*RC[-15]-RC[-13]*RC[-12])/1000 -> #VALUE! | W58: =RC[-2]*RC[-10]/1000 -> #VALUE! | X58: =ABS((RC[-3]*RC[-11]-RC[-2]*RC[-9])/1000) -> #VALUE! | Y58: =(RC[-14]-RC[1])/RC[-18]*100 -> #VALUE! | Z58: =RC[-5]+RC[-4] -> #VALUE! | AC58: =VALUE(RC[-27]) -> #VALUE! | AD58: =IF(RC[21]=42,"*",IF(RC[21]=32,"",RC[21])) ->  | AE58: =RC[-28] ->  | AF58: =RC[-28] ->  | AG58: =RC[-28] ->  | AH58: =RC[-28] ->  | AI58: =RC[-28] ->  | AJ58: =RC[-28] ->  | AK58: =RC[-28] ->  | AL58: =RC[-28] -> 0 | AM58: =RC[-28] ->  | AN58: =RC[-28] ->  | AO58: =RC[-28] ->  | AP58: - | AQ58: =RC[-29] ->  | AR58: =RC[-29] ->  | AS58: - | AT58: =RC[-30] -> - | AU58: =RC[-30] ->  | AV58: =RC[-30] ->  | AW58: =RC[-30] -> 
A59: =IF(RC[1]="","",DATEVALUE(RC[1])) ->  | P59: =IF(AND(ISNUMBER(RC[-3]),ISNUMBER(RC[-1])),RC[-3]-RC[-1],"-") -> - | T59: =(RC[-16]*RC[-15]-RC[-13]*RC[-12])/1000 -> #VALUE! | W59: =RC[-2]*RC[-10]/1000 -> #VALUE! | X59: =ABS((RC[-3]*RC[-11]-RC[-2]*RC[-9])/1000) -> #VALUE! | Y59: =(RC[-14]-RC[1])/RC[-18]*100 -> #VALUE! | Z59: =RC[-5]+RC[-4] -> #VALUE! | AC59: =VALUE(RC[-27]) -> #VALUE! | AD59: =IF(RC[21]=42,"*",IF(RC[21]=32,"",RC[21])) ->  | AE59: =RC[-28] ->  | AF59: =RC[-28] ->  | AG59: =RC[-28] ->  | AH59: =RC[-28] ->  | AI59: =RC[-28] ->  | AJ59: =RC[-28] ->  | AK59: =RC[-28] ->  | AL59: =RC[-28] -> 0 | AM59: =RC[-28] ->  | AN59: =RC[-28] ->  | AO59: =RC[-28] ->  | AP59: - | AQ59: =RC[-29] ->  | AR59: =RC[-29] ->  | AS59: - | AT59: =RC[-30] -> - | AU59: =RC[-30] ->  | AV59: =RC[-30] ->  | AW59: =RC[-30] -> 
A60: =IF(RC[1]="","",DATEVALUE(RC[1])) ->  | P60: =IF(AND(ISNUMBER(RC[-3]),ISNUMBER(RC[-1])),RC[-3]-RC[-1],"-") -> - | T60: =(RC[-16]*RC[-15]-RC[-13]*RC[-12])/1000 -> #VALUE! | W60: =RC[-2]*RC[-10]/1000 -> #VALUE! | X60: =ABS((RC[-3]*RC[-11]-RC[-2]*RC[-9])/1000) -> #VALUE! | Y60: =(RC[-14]-RC[1])/RC[-18]*100 -> #VALUE! | Z60: =RC[-5]+RC[-4] -> #VALUE! | AC60: =VALUE(RC[-27]) -> #VALUE! | AD60: =IF(RC[21]=42,"*",IF(RC[21]=32,"",RC[21])) ->  | AE60: =RC[-28] ->  | AF60: =RC[-28] ->  | AG60: =RC[-28] ->  | AH60: =RC[-28] ->  | AI60: =RC[-28] ->  | AJ60: =RC[-28] ->  | AK60: =RC[-28] ->  | AL60: =RC[-28] -> 0 | AM60: =RC[-28] ->  | AN60: =RC[-28] ->  | AO60: =RC[-28] ->  | AP60: - | AQ60: =RC[-29] ->  | AR60: =RC[-29] ->  | AS60: - | AT60: =RC[-30] -> - | AU60: =RC[-30] ->  | AV60: =RC[-30] ->  | AW60: =RC[-30] -> 
A61: =IF(RC[1]="","",DATEVALUE(RC[1])) ->  | P61: =IF(AND(ISNUMBER(RC[-3]),ISNUMBER(RC[-1])),RC[-3]-RC[-1],"-") -> - | T61: =(RC[-16]*RC[-15]-RC[-13]*RC[-12])/1000 -> #VALUE! | W61: =RC[-2]*RC[-10]/1000 -> #VALUE! | X61: =ABS((RC[-3]*RC[-11]-RC[-2]*RC[-9])/1000) -> #VALUE! | Y61: =(RC[-14]-RC[1])/RC[-18]*100 -> #VALUE! | Z61: =RC[-5]+RC[-4] -> #VALUE! | AC61: =VALUE(RC[-27]) -> #VALUE! | AD61: =IF(RC[21]=42,"*",IF(RC[21]=32,"",RC[21])) ->  | AE61: =RC[-28] ->  | AF61: =RC[-28] ->  | AG61: =RC[-28] ->  | AH61: =RC[-28] ->  | AI61: =RC[-28] ->  | AJ61: =RC[-28] ->  | AK61: =RC[-28] ->  | AL61: =RC[-28] -> 0 | AM61: =RC[-28] ->  | AN61: =RC[-28] ->  | AO61: =RC[-28] ->  | AP61: - | AQ61: =RC[-29] ->  | AR61: =RC[-29] ->  | AS61: - | AT61: =RC[-30] -> - | AU61: =RC[-30] ->  | AV61: =RC[-30] ->  | AW61: =RC[-30] -> 
A62: =IF(RC[1]="","",DATEVALUE(RC[1])) ->  | P62: =IF(AND(ISNUMBER(RC[-3]),ISNUMBER(RC[-1])),RC[-3]-RC[-1],"-") -> - | T62: =(RC[-16]*RC[-15]-RC[-13]*RC[-12])/1000 -> #VALUE! | W62: =RC[-2]*RC[-10]/1000 -> #VALUE! | X62: =ABS((RC[-3]*RC[-11]-RC[-2]*RC[-9])/1000) -> #VALUE! | Y62: =(RC[-14]-RC[1])/RC[-18]*100 -> #VALUE! | Z62: =RC[-5]+RC[-4] -> #VALUE! | AC62: =VALUE(RC[-27]) -> #VALUE! | AD62: =IF(RC[21]=42,"*",IF(RC[21]=32,"",RC[21])) ->  | AE62: =RC[-28] ->  | AF62: =RC[-28] ->  | AG62: =RC[-28] ->  | AH62: =RC[-28] ->  | AI62: =RC[-28] ->  | AJ62: =RC[-28] ->  | AK62: =RC[-28] ->  | AL62: =RC[-28] -> 0 | AM62: =RC[-28] ->  | AN62: =RC[-28] ->  | AO62: =RC[-28] ->  | AP62: - | AQ62: =RC[-29] ->  | AR62: =RC[-29] ->  | AS62: - | AT62: =RC[-30] -> - | AU62: =RC[-30] ->  | AV62: =RC[-30] ->  | AW62: =RC[-30] -> 
A63: =IF(RC[1]="","",DATEVALUE(RC[1])) ->  | P63: =IF(AND(ISNUMBER(RC[-3]),ISNUMBER(RC[-1])),RC[-3]-RC[-1],"-") -> - | T63: =(RC[-16]*RC[-15]-RC[-13]*RC[-12])/1000 -> #VALUE! | W63: =RC[-2]*RC[-10]/1000 -> #VALUE! | X63: =ABS((RC[-3]*RC[-11]-RC[-2]*RC[-9])/1000) -> #VALUE! | Y63: =(RC[-14]-RC[1])/RC[-18]*100 -> #VALUE! | Z63: =RC[-5]+RC[-4] -> #VALUE! | AC63: =VALUE(RC[-27]) -> #VALUE! | AD63: =IF(RC[21]=42,"*",IF(RC[21]=32,"",RC[21])) ->  | AE63: =RC[-28] ->  | AF63: =RC[-28] ->  | AG63: =RC[-28] ->  | AH63: =RC[-28] ->  | AI63: =RC[-28] ->  | AJ63: =RC[-28] ->  | AK63: =RC[-28] ->  | AL63: =RC[-28] -> 0 | AM63: =RC[-28] ->  | AN63: =RC[-28] ->  | AO63: =RC[-28] ->  | AP63: - | AQ63: =RC[-29] ->  | AR63: =RC[-29] ->  | AS63: - | AT63: =RC[-30] -> - | AU63: =RC[-30] ->  | AV63: =RC[-30] ->  | AW63: =RC[-30] -> 
A64: =IF(RC[1]="","",DATEVALUE(RC[1])) ->  | P64: =IF(AND(ISNUMBER(RC[-3]),ISNUMBER(RC[-1])),RC[-3]-RC[-1],"-") -> - | T64: =(RC[-16]*RC[-15]-RC[-13]*RC[-12])/1000 -> #VALUE! | W64: =RC[-2]*RC[-10]/1000 -> #VALUE! | X64: =ABS((RC[-3]*RC[-11]-RC[-2]*RC[-9])/1000) -> #VALUE! | Y64: =(RC[-14]-RC[1])/RC[-18]*100 -> #VALUE! | Z64: =RC[-5]+RC[-4] -> #VALUE! | AC64: =VALUE(RC[-27]) -> #VALUE! | AD64: =IF(RC[21]=42,"*",IF(RC[21]=32,"",RC[21])) ->  | AE64: =RC[-28] ->  | AF64: =RC[-28] ->  | AG64: =RC[-28] ->  | AH64: =RC[-28] ->  | AI64: =RC[-28] ->  | AJ64: =RC[-28] ->  | AK64: =RC[-28] ->  | AL64: =RC[-28] -> 0 | AM64: =RC[-28] ->  | AN64: =RC[-28] ->  | AO64: =RC[-28] ->  | AP64: - | AQ64: =RC[-29] ->  | AR64: =RC[-29] ->  | AS64: - | AT64: =RC[-30] -> - | AU64: =RC[-30] ->  | AV64: =RC[-30] ->  | AW64: =RC[-30] -> 
A65: =IF(RC[1]="","",DATEVALUE(RC[1])) ->  | P65: =IF(AND(ISNUMBER(RC[-3]),ISNUMBER(RC[-1])),RC[-3]-RC[-1],"-") -> - | T65: =(RC[-16]*RC[-15]-RC[-13]*RC[-12])/1000 -> #VALUE! | W65: =RC[-2]*RC[-10]/1000 -> #VALUE! | X65: =ABS((RC[-3]*RC[-11]-RC[-2]*RC[-9])/1000) -> #VALUE! | Y65: =(RC[-14]-RC[1])/RC[-18]*100 -> #VALUE! | Z65: =RC[-5]+RC[-4] -> #VALUE! | AC65: =VALUE(RC[-27]) -> #VALUE! | AD65: =IF(RC[21]=42,"*",IF(RC[21]=32,"",RC[21])) ->  | AE65: =RC[-28] ->  | AF65: =RC[-28] ->  | AG65: =RC[-28] ->  | AH65: =RC[-28] ->  | AI65: =RC[-28] ->  | AJ65: =RC[-28] ->  | AK65: =RC[-28] ->  | AL65: =RC[-28] -> 0 | AM65: =RC[-28] ->  | AN65: =RC[-28] ->  | AO65: =RC[-28] ->  | AP65: - | AQ65: =RC[-29] ->  | AR65: =RC[-29] ->  | AS65: - | AT65: =RC[-30] -> - | AU65: =RC[-30] ->  | AV65: =RC[-30] ->  | AW65: =RC[-30] -> 
A66: =IF(RC[1]="","",DATEVALUE(RC[1])) ->  | P66: =IF(AND(ISNUMBER(RC[-3]),ISNUMBER(RC[-1])),RC[-3]-RC[-1],"-") -> - | T66: =(RC[-16]*RC[-15]-RC[-13]*RC[-12])/1000 -> #VALUE! | W66: =RC[-2]*RC[-10]/1000 -> #VALUE! | X66: =ABS((RC[-3]*RC[-11]-RC[-2]*RC[-9])/1000) -> #VALUE! | Y66: =(RC[-14]-RC[1])/RC[-18]*100 -> #VALUE! | Z66: =RC[-5]+RC[-4] -> #VALUE! | AC66: =VALUE(RC[-27]) -> #VALUE! | AD66: =IF(RC[21]=42,"*",IF(RC[21]=32,"",RC[21])) ->  | AE66: =RC[-28] ->  | AF66: =RC[-28] ->  | AG66: =RC[-28] ->  | AH66: =RC[-28] ->  | AI66: =RC[-28] ->  | AJ66: =RC[-28] ->  | AK66: =RC[-28] ->  | AL66: =RC[-28] -> 0 | AM66: =RC[-28] ->  | AN66: =RC[-28] ->  | AO66: =RC[-28] ->  | AP66: - | AQ66: =RC[-29] ->  | AR66: =RC[-29] ->  | AS66: - | AT66: =RC[-30] -> - | AU66: =RC[-30] ->  | AV66: =RC[-30] ->  | AW66: =RC[-30] -> 
A67: =IF(RC[1]="","",DATEVALUE(RC[1])) ->  | P67: =IF(AND(ISNUMBER(RC[-3]),ISNUMBER(RC[-1])),RC[-3]-RC[-1],"-") -> - | T67: =(RC[-16]*RC[-15]-RC[-13]*RC[-12])/1000 -> #VALUE! | W67: =RC[-2]*RC[-10]/1000 -> #VALUE! | X67: =ABS((RC[-3]*RC[-11]-RC[-2]*RC[-9])/1000) -> #VALUE! | Y67: =(RC[-14]-RC[1])/RC[-18]*100 -> #VALUE! | Z67: =RC[-5]+RC[-4] -> #VALUE! | AC67: =VALUE(RC[-27]) -> #VALUE! | AD67: =IF(RC[21]=42,"*",IF(RC[21]=32,"",RC[21])) ->  | AE67: =RC[-28] ->  | AF67: =RC[-28] ->  | AG67: =RC[-28] ->  | AH67: =RC[-28] ->  | AI67: =RC[-28] ->  | AJ67: =RC[-28] ->  | AK67: =RC[-28] ->  | AL67: =RC[-28] -> 0 | AM67: =RC[-28] ->  | AN67: =RC[-28] ->  | AO67: =RC[-28] ->  | AP67: - | AQ67: =RC[-29] ->  | AR67: =RC[-29] ->  | AS67: - | AT67: =RC[-30] -> - | AU67: =RC[-30] ->  | AV67: =RC[-30] ->  | AW67: =RC[-30] -> 
A68: =IF(RC[1]="","",DATEVALUE(RC[1])) ->  | P68: =IF(AND(ISNUMBER(RC[-3]),ISNUMBER(RC[-1])),RC[-3]-RC[-1],"-") -> - | T68: =(RC[-16]*RC[-15]-RC[-13]*RC[-12])/1000 -> #VALUE! | W68: =RC[-2]*RC[-10]/1000 -> #VALUE! | X68: =ABS((RC[-3]*RC[-11]-RC[-2]*RC[-9])/1000) -> #VALUE! | Y68: =(RC[-14]-RC[1])/RC[-18]*100 -> #VALUE! | Z68: =RC[-5]+RC[-4] -> #VALUE! | AC68: =VALUE(RC[-27]) -> #VALUE! | AD68: =IF(RC[21]=42,"*",IF(RC[21]=32,"",RC[21])) ->  | AE68: =RC[-28] ->  | AF68: =RC[-28] ->  | AG68: =RC[-28] ->  | AH68: =RC[-28] ->  | AI68: =RC[-28] ->  | AJ68: =RC[-28] ->  | AK68: =RC[-28] ->  | AL68: =RC[-28] -> 0 | AM68: =RC[-28] ->  | AN68: =RC[-28] ->  | AO68: =RC[-28] ->  | AP68: - | AQ68: =RC[-29] ->  | AR68: =RC[-29] ->  | AS68: - | AT68: =RC[-30] -> - | AU68: =RC[-30] ->  | AV68: =RC[-30] ->  | AW68: =RC[-30] -> 
A69: =IF(RC[1]="","",DATEVALUE(RC[1])) ->  | P69: =IF(AND(ISNUMBER(RC[-3]),ISNUMBER(RC[-1])),RC[-3]-RC[-1],"-") -> - | T69: =(RC[-16]*RC[-15]-RC[-13]*RC[-12])/1000 -> #VALUE! | W69: =RC[-2]*RC[-10]/1000 -> #VALUE! | X69: =ABS((RC[-3]*RC[-11]-RC[-2]*RC[-9])/1000) -> #VALUE! | Y69: =(RC[-14]-RC[1])/RC[-18]*100 -> #VALUE! | Z69: =RC[-5]+RC[-4] -> #VALUE! | AC69: =VALUE(RC[-27]) -> #VALUE! | AD69: =IF(RC[21]=42,"*",IF(RC[21]=32,"",RC[21])) ->  | AE69: =RC[-28] ->  | AF69: =RC[-28] ->  | AG69: =RC[-28] ->  | AH69: =RC[-28] ->  | AI69: =RC[-28] ->  | AJ69: =RC[-28] ->  | AK69: =RC[-28] ->  | AL69: =RC[-28] -> 0 | AM69: =RC[-28] ->  | AN69: =RC[-28] ->  | AO69: =RC[-28] ->  | AP69: - | AQ69: =RC[-29] ->  | AR69: =RC[-29] ->  | AS69: - | AT69: =RC[-30] -> - | AU69: =RC[-30] ->  | AV69: =RC[-30] ->  | AW69: =RC[-30] -> 
A70: =IF(RC[1]="","",DATEVALUE(RC[1])) ->  | P70: =IF(AND(ISNUMBER(RC[-3]),ISNUMBER(RC[-1])),RC[-3]-RC[-1],"-") -> - | T70: =(RC[-16]*RC[-15]-RC[-13]*RC[-12])/1000 -> #VALUE! | W70: =RC[-2]*RC[-10]/1000 -> #VALUE! | X70: =ABS((RC[-3]*RC[-11]-RC[-2]*RC[-9])/1000) -> #VALUE! | Y70: =(RC[-14]-RC[1])/RC[-18]*100 -> #VALUE! | Z70: =RC[-5]+RC[-4] -> #VALUE! | AC70: =VALUE(RC[-27]) -> #VALUE! | AD70: =IF(RC[21]=42,"*",IF(RC[21]=32,"",RC[21])) ->  | AE70: =RC[-28] ->  | AF70: =RC[-28] ->  | AG70: =RC[-28] ->  | AH70: =RC[-28] ->  | AI70: =RC[-28] ->  | AJ70: =RC[-28] ->  | AK70: =RC[-28] ->  | AL70: =RC[-28] -> 0 | AM70: =RC[-28] ->  | AN70: =RC[-28] ->  | AO70: =RC[-28] ->  | AP70: - | AQ70: =RC[-29] ->  | AR70: =RC[-29] ->  | AS70: - | AT70: =RC[-30] -> - | AU70: =RC[-30] ->  | AV70: =RC[-30] ->  | AW70: =RC[-30] -> 
A71: =IF(RC[1]="","",DATEVALUE(RC[1])) ->  | P71: =IF(AND(ISNUMBER(RC[-3]),ISNUMBER(RC[-1])),RC[-3]-RC[-1],"-") -> - | T71: =(RC[-16]*RC[-15]-RC[-13]*RC[-12])/1000 -> #VALUE! | W71: =RC[-2]*RC[-10]/1000 -> #VALUE! | X71: =ABS((RC[-3]*RC[-11]-RC[-2]*RC[-9])/1000) -> #VALUE! | Y71: =(RC[-14]-RC[1])/RC[-18]*100 -> #VALUE! | Z71: =RC[-5]+RC[-4] -> #VALUE! | AC71: =VALUE(RC[-27]) -> #VALUE! | AD71: =IF(RC[21]=42,"*",IF(RC[21]=32,"",RC[21])) ->  | AE71: =RC[-28] ->  | AF71: =RC[-28] ->  | AG71: =RC[-28] ->  | AH71: =RC[-28] ->  | AI71: =RC[-28] ->  | AJ71: =RC[-28] ->  | AK71: =RC[-28] ->  | AL71: =RC[-28] -> 0 | AM71: =RC[-28] ->  | AN71: =RC[-28] ->  | AO71: =RC[-28] ->  | AP71: - | AQ71: =RC[-29] ->  | AR71: =RC[-29] ->  | AS71: - | AT71: =RC[-30] -> - | AU71: =RC[-30] ->  | AV71: =RC[-30] ->  | AW71: =RC[-30] -> 
A72: =IF(RC[1]="","",DATEVALUE(RC[1])) ->  | P72: =IF(AND(ISNUMBER(RC[-3]),ISNUMBER(RC[-1])),RC[-3]-RC[-1],"-") -> - | T72: =(RC[-16]*RC[-15]-RC[-13]*RC[-12])/1000 -> #VALUE! | W72: =RC[-2]*RC[-10]/1000 -> #VALUE! | X72: =ABS((RC[-3]*RC[-11]-RC[-2]*RC[-9])/1000) -> #VALUE! | Y72: =(RC[-14]-RC[1])/RC[-18]*100 -> #VALUE! | Z72: =RC[-5]+RC[-4] -> #VALUE! | AC72: =VALUE(RC[-27]) -> #VALUE! | AD72: =IF(RC[21]=42,"*",IF(RC[21]=32,"",RC[21])) ->  | AE72: =RC[-28] ->  | AF72: =RC[-28] ->  | AG72: =RC[-28] ->  | AH72: =RC[-28] ->  | AI72: =RC[-28] ->  | AJ72: =RC[-28] ->  | AK72: =RC[-28] ->  | AL72: =RC[-28] -> 0 | AM72: =RC[-28] ->  | AN72: =RC[-28] ->  | AO72: =RC[-28] ->  | AP72: - | AQ72: =RC[-29] ->  | AR72: =RC[-29] ->  | AS72: - | AT72: =RC[-30] -> - | AU72: =RC[-30] ->  | AV72: =RC[-30] ->  | AW72: =RC[-30] -> 
A73: =IF(RC[1]="","",DATEVALUE(RC[1])) ->  | P73: =IF(AND(ISNUMBER(RC[-3]),ISNUMBER(RC[-1])),RC[-3]-RC[-1],"-") -> - | T73: =(RC[-16]*RC[-15]-RC[-13]*RC[-12])/1000 -> #VALUE! | W73: =RC[-2]*RC[-10]/1000 -> #VALUE! | X73: =ABS((RC[-3]*RC[-11]-RC[-2]*RC[-9])/1000) -> #VALUE! | Y73: =(RC[-14]-RC[1])/RC[-18]*100 -> #VALUE! | Z73: =RC[-5]+RC[-4] -> #VALUE! | AC73: =VALUE(RC[-27]) -> #VALUE! | AD73: =IF(RC[21]=42,"*",IF(RC[21]=32,"",RC[21])) ->  | AE73: =RC[-28] ->  | AF73: =RC[-28] ->  | AG73: =RC[-28] ->  | AH73: =RC[-28] ->  | AI73: =RC[-28] ->  | AJ73: =RC[-28] ->  | AK73: =RC[-28] ->  | AL73: =RC[-28] -> 0 | AM73: =RC[-28] ->  | AN73: =RC[-28] ->  | AO73: =RC[-28] ->  | AP73: - | AQ73: =RC[-29] ->  | AR73: =RC[-29] ->  | AS73: - | AT73: =RC[-30] -> - | AU73: =RC[-30] ->  | AV73: =RC[-30] ->  | AW73: =RC[-30] -> 
A74: =IF(RC[1]="","",DATEVALUE(RC[1])) ->  | P74: =IF(AND(ISNUMBER(RC[-3]),ISNUMBER(RC[-1])),RC[-3]-RC[-1],"-") -> - | T74: =(RC[-16]*RC[-15]-RC[-13]*RC[-12])/1000 -> #VALUE! | W74: =RC[-2]*RC[-10]/1000 -> #VALUE! | X74: =ABS((RC[-3]*RC[-11]-RC[-2]*RC[-9])/1000) -> #VALUE! | Y74: =(RC[-14]-RC[1])/RC[-18]*100 -> #VALUE! | Z74: =RC[-5]+RC[-4] -> #VALUE! | AC74: =VALUE(RC[-27]) -> #VALUE! | AD74: =IF(RC[21]=42,"*",IF(RC[21]=32,"",RC[21])) ->  | AE74: =RC[-28] ->  | AF74: =RC[-28] ->  | AG74: =RC[-28] ->  | AH74: =RC[-28] ->  | AI74: =RC[-28] ->  | AJ74: =RC[-28] ->  | AK74: =RC[-28] ->  | AL74: =RC[-28] -> 0 | AM74: =RC[-28] ->  | AN74: =RC[-28] ->  | AO74: =RC[-28] ->  | AP74: - | AQ74: =RC[-29] ->  | AR74: =RC[-29] ->  | AS74: - | AT74: =RC[-30] -> - | AU74: =RC[-30] ->  | AV74: =RC[-30] ->  | AW74: =RC[-30] -> 
A75: =IF(RC[1]="","",DATEVALUE(RC[1])) ->  | P75: =IF(AND(ISNUMBER(RC[-3]),ISNUMBER(RC[-1])),RC[-3]-RC[-1],"-") -> - | T75: =(RC[-16]*RC[-15]-RC[-13]*RC[-12])/1000 -> #VALUE! | W75: =RC[-2]*RC[-10]/1000 -> #VALUE! | X75: =ABS((RC[-3]*RC[-11]-RC[-2]*RC[-9])/1000) -> #VALUE! | Y75: =(RC[-14]-RC[1])/RC[-18]*100 -> #VALUE! | Z75: =RC[-5]+RC[-4] -> #VALUE! | AC75: =VALUE(RC[-27]) -> #VALUE! | AD75: =IF(RC[21]=42,"*",IF(RC[21]=32,"",RC[21])) ->  | AE75: =RC[-28] ->  | AF75: =RC[-28] ->  | AG75: =RC[-28] ->  | AH75: =RC[-28] ->  | AI75: =RC[-28] ->  | AJ75: =RC[-28] ->  | AK75: =RC[-28] ->  | AL75: =RC[-28] -> 0 | AM75: =RC[-28] ->  | AN75: =RC[-28] ->  | AO75: =RC[-28] ->  | AP75: - | AQ75: =RC[-29] ->  | AR75: =RC[-29] ->  | AS75: - | AT75: =RC[-30] -> - | AU75: =RC[-30] ->  | AV75: =RC[-30] ->  | AW75: =RC[-30] -> 
A76: =IF(RC[1]="","",DATEVALUE(RC[1])) ->  | P76: =IF(AND(ISNUMBER(RC[-3]),ISNUMBER(RC[-1])),RC[-3]-RC[-1],"-") -> - | T76: =(RC[-16]*RC[-15]-RC[-13]*RC[-12])/1000 -> #VALUE! | W76: =RC[-2]*RC[-10]/1000 -> #VALUE! | X76: =ABS((RC[-3]*RC[-11]-RC[-2]*RC[-9])/1000) -> #VALUE! | Y76: =(RC[-14]-RC[1])/RC[-18]*100 -> #VALUE! | Z76: =RC[-5]+RC[-4] -> #VALUE! | AC76: =VALUE(RC[-27]) -> #VALUE! | AD76: =IF(RC[21]=42,"*",IF(RC[21]=32,"",RC[21])) ->  | AE76: =RC[-28] ->  | AF76: =RC[-28] ->  | AG76: =RC[-28] ->  | AH76: =RC[-28] ->  | AI76: =RC[-28] ->  | AJ76: =RC[-28] ->  | AK76: =RC[-28] ->  | AL76: =RC[-28] -> 0 | AM76: =RC[-28] ->  | AN76: =RC[-28] ->  | AO76: =RC[-28] ->  | AP76: - | AQ76: =RC[-29] ->  | AR76: =RC[-29] ->  | AS76: - | AT76: =RC[-30] -> - | AU76: =RC[-30] ->  | AV76: =RC[-30] ->  | AW76: =RC[-30] -> 
A77: =IF(RC[1]="","",DATEVALUE(RC[1])) ->  | P77: =IF(AND(ISNUMBER(RC[-3]),ISNUMBER(RC[-1])),RC[-3]-RC[-1],"-") -> - | T77: =(RC[-16]*RC[-15]-RC[-13]*RC[-12])/1000 -> #VALUE! | W77: =RC[-2]*RC[-10]/1000 -> #VALUE! | X77: =ABS((RC[-3]*RC[-11]-RC[-2]*RC[-9])/1000) -> #VALUE! | Y77: =(RC[-14]-RC[1])/RC[-18]*100 -> #VALUE! | Z77: =RC[-5]+RC[-4] -> #VALUE! | AC77: =VALUE(RC[-27]) -> #VALUE! | AD77: =IF(RC[21]=42,"*",IF(RC[21]=32,"",RC[21])) ->  | AE77: =RC[-28] ->  | AF77: =RC[-28] ->  | AG77: =RC[-28] ->  | AH77: =RC[-28] ->  | AI77: =RC[-28] ->  | AJ77: =RC[-28] ->  | AK77: =RC[-28] ->  | AL77: =RC[-28] -> 0 | AM77: =RC[-28] ->  | AN77: =RC[-28] ->  | AO77: =RC[-28] ->  | AP77: - | AQ77: =RC[-29] ->  | AR77: =RC[-29] ->  | AS77: - | AT77: =RC[-30] -> - | AU77: =RC[-30] ->  | AV77: =RC[-30] ->  | AW77: =RC[-30] -> 
A78: =IF(RC[1]="","",DATEVALUE(RC[1])) ->  | P78: =IF(AND(ISNUMBER(RC[-3]),ISNUMBER(RC[-1])),RC[-3]-RC[-1],"-") -> - | T78: =(RC[-16]*RC[-15]-RC[-13]*RC[-12])/1000 -> #VALUE! | W78: =RC[-2]*RC[-10]/1000 -> #VALUE! | X78: =ABS((RC[-3]*RC[-11]-RC[-2]*RC[-9])/1000) -> #VALUE! | Y78: =(RC[-14]-RC[1])/RC[-18]*100 -> #VALUE! | Z78: =RC[-5]+RC[-4] -> #VALUE! | AC78: =VALUE(RC[-27]) -> #VALUE! | AD78: =IF(RC[21]=42,"*",IF(RC[21]=32,"",RC[21])) ->  | AE78: =RC[-28] ->  | AF78: =RC[-28] ->  | AG78: =RC[-28] ->  | AH78: =RC[-28] ->  | AI78: =RC[-28] ->  | AJ78: =RC[-28] ->  | AK78: =RC[-28] ->  | AL78: =RC[-28] -> 0 | AM78: =RC[-28] ->  | AN78: =RC[-28] ->  | AO78: =RC[-28] ->  | AP78: - | AQ78: =RC[-29] ->  | AR78: =RC[-29] ->  | AS78: - | AT78: =RC[-30] -> - | AU78: =RC[-30] ->  | AV78: =RC[-30] ->  | AW78: =RC[-30] -> 
A79: =IF(RC[1]="","",DATEVALUE(RC[1])) ->  | P79: =IF(AND(ISNUMBER(RC[-3]),ISNUMBER(RC[-1])),RC[-3]-RC[-1],"-") -> - | T79: =(RC[-16]*RC[-15]-RC[-13]*RC[-12])/1000 -> #VALUE! | W79: =RC[-2]*RC[-10]/1000 -> #VALUE! | X79: =ABS((RC[-3]*RC[-11]-RC[-2]*RC[-9])/1000) -> #VALUE! | Y79: =(RC[-14]-RC[1])/RC[-18]*100 -> #VALUE! | Z79: =RC[-5]+RC[-4] -> #VALUE! | AC79: =VALUE(RC[-27]) -> #VALUE! | AD79: =IF(RC[21]=42,"*",IF(RC[21]=32,"",RC[21])) ->  | AE79: =RC[-28] ->  | AF79: =RC[-28] ->  | AG79: =RC[-28] ->  | AH79: =RC[-28] ->  | AI79: =RC[-28] ->  | AJ79: =RC[-28] ->  | AK79: =RC[-28] ->  | AL79: =RC[-28] -> 0 | AM79: =RC[-28] ->  | AN79: =RC[-28] ->  | AO79: =RC[-28] ->  | AP79: - | AQ79: =RC[-29] ->  | AR79: =RC[-29] ->  | AS79: - | AT79: =RC[-30] -> - | AU79: =RC[-30] ->  | AV79: =RC[-30] ->  | AW79: =RC[-30] -> 
A80: =IF(RC[1]="","",DATEVALUE(RC[1])) ->  | P80: =IF(AND(ISNUMBER(RC[-3]),ISNUMBER(RC[-1])),RC[-3]-RC[-1],"-") -> - | T80: =(RC[-16]*RC[-15]-RC[-13]*RC[-12])/1000 -> #VALUE! | W80: =RC[-2]*RC[-10]/1000 -> #VALUE! | X80: =ABS((RC[-3]*RC[-11]-RC[-2]*RC[-9])/1000) -> #VALUE! | Y80: =(RC[-14]-RC[1])/RC[-18]*100 -> #VALUE! | Z80: =RC[-5]+RC[-4] -> #VALUE! | AC80: =VALUE(RC[-27]) -> #VALUE! | AD80: =IF(RC[21]=42,"*",IF(RC[21]=32,"",RC[21])) ->  | AE80: =RC[-28] ->  | AF80: =RC[-28] ->  | AG80: =RC[-28] ->  | AH80: =RC[-28] ->  | AI80: =RC[-28] ->  | AJ80: =RC[-28] ->  | AK80: =RC[-28] ->  | AL80: =RC[-28] -> 0 | AM80: =RC[-28] ->  | AN80: =RC[-28] ->  | AO80: =RC[-28] ->  | AP80: - | AQ80: =RC[-29] ->  | AR80: =RC[-29] ->  | AS80: - | AT80: =RC[-30] -> - | AU80: =RC[-30] ->  | AV80: =RC[-30] ->  | AW80: =RC[-30] -> 
A81: =IF(RC[1]="","",DATEVALUE(RC[1])) ->  | P81: =IF(AND(ISNUMBER(RC[-3]),ISNUMBER(RC[-1])),RC[-3]-RC[-1],"-") -> - | T81: =(RC[-16]*RC[-15]-RC[-13]*RC[-12])/1000 -> #VALUE! | W81: =RC[-2]*RC[-10]/1000 -> #VALUE! | X81: =ABS((RC[-3]*RC[-11]-RC[-2]*RC[-9])/1000) -> #VALUE! | Y81: =(RC[-14]-RC[1])/RC[-18]*100 -> #VALUE! | Z81: =RC[-5]+RC[-4] -> #VALUE! | AC81: =VALUE(RC[-27]) -> #VALUE! | AD81: =IF(RC[21]=42,"*",IF(RC[21]=32,"",RC[21])) ->  | AE81: =RC[-28] ->  | AF81: =RC[-28] ->  | AG81: =RC[-28] ->  | AH81: =RC[-28] ->  | AI81: =RC[-28] ->  | AJ81: =RC[-28] ->  | AK81: =RC[-28] ->  | AL81: =RC[-28] -> 0 | AM81: =RC[-28] ->  | AN81: =RC[-28] ->  | AO81: =RC[-28] ->  | AP81: - | AQ81: =RC[-29] ->  | AR81: =RC[-29] ->  | AS81: - | AT81: =RC[-30] -> - | AU81: =RC[-30] ->  | AV81: =RC[-30] ->  | AW81: =RC[-30] -> 
A82: =IF(RC[1]="","",DATEVALUE(RC[1])) ->  | P82: =IF(AND(ISNUMBER(RC[-3]),ISNUMBER(RC[-1])),RC[-3]-RC[-1],"-") -> - | T82: =(RC[-16]*RC[-15]-RC[-13]*RC[-12])/1000 -> #VALUE! | W82: =RC[-2]*RC[-10]/1000 -> #VALUE! | X82: =ABS((RC[-3]*RC[-11]-RC[-2]*RC[-9])/1000) -> #VALUE! | Y82: =(RC[-14]-RC[1])/RC[-18]*100 -> #VALUE! | Z82: =RC[-5]+RC[-4] -> #VALUE! | AC82: =VALUE(RC[-27]) -> #VALUE! | AD82: =IF(RC[21]=42,"*",IF(RC[21]=32,"",RC[21])) ->  | AE82: =RC[-28] ->  | AF82: =RC[-28] ->  | AG82: =RC[-28] ->  | AH82: =RC[-28] ->  | AI82: =RC[-28] ->  | AJ82: =RC[-28] ->  | AK82: =RC[-28] ->  | AL82: =RC[-28] -> 0 | AM82: =RC[-28] ->  | AN82: =RC[-28] ->  | AO82: =RC[-28] ->  | AP82: - | AQ82: =RC[-29] ->  | AR82: =RC[-29] ->  | AS82: - | AT82: =RC[-30] -> - | AU82: =RC[-30] ->  | AV82: =RC[-30] ->  | AW82: =RC[-30] -> 
A83: =IF(RC[1]="","",DATEVALUE(RC[1])) ->  | P83: =IF(AND(ISNUMBER(RC[-3]),ISNUMBER(RC[-1])),RC[-3]-RC[-1],"-") -> - | T83: =(RC[-16]*RC[-15]-RC[-13]*RC[-12])/1000 -> #VALUE! | W83: =RC[-2]*RC[-10]/1000 -> #VALUE! | X83: =ABS((RC[-3]*RC[-11]-RC[-2]*RC[-9])/1000) -> #VALUE! | Y83: =(RC[-14]-RC[1])/RC[-18]*100 -> #VALUE! | Z83: =RC[-5]+RC[-4] -> #VALUE! | AC83: =VALUE(RC[-27]) -> #VALUE! | AD83: =IF(RC[21]=42,"*",IF(RC[21]=32,"",RC[21])) ->  | AE83: =RC[-28] ->  | AF83: =RC[-28] ->  | AG83: =RC[-28] ->  | AH83: =RC[-28] ->  | AI83: =RC[-28] ->  | AJ83: =RC[-28] ->  | AK83: =RC[-28] ->  | AL83: =RC[-28] -> 0 | AM83: =RC[-28] ->  | AN83: =RC[-28] ->  | AO83: =RC[-28] ->  | AP83: - | AQ83: =RC[-29] ->  | AR83: =RC[-29] ->  | AS83: - | AT83: =RC[-30] -> - | AU83: =RC[-30] ->  | AV83: =RC[-30] ->  | AW83: =RC[-30] -> 
AC84: Среднее | AF84: =R[1]C[-28] -> 138.31802543333333 | AG84: =R[1]C[-28] -> 68.528690000000012 | AH84: =R[1]C[-28] -> 8.042975666666667 | AI84: =R[1]C[-28] -> 127.27425416666668 | AJ84: =R[1]C[-28] -> 49.740862100000001 | AK84: =R[1]C[-28] -> 5.526692033333334 | AL84: =R[1]C[-28] -> 18.787827900000003 | AM84: =R[1]C[-28] -> 11.109358533333333 | AN84: =R[1]C[-28] -> 7.3090157999999992 | AO84: =R[1]C[-28] -> 67.881115200000011 | AP84: - | AQ84: =R[1]C[-29] -> 3.0172149666666663 | AR84: =R[1]C[-29] -> 65.387867633333343 | AS84: - | AT84: =R[1]C[-30] -> 2.4932475666666671 | AU84: =R[1]C[-30] -> 10.326230766666667
B85: Среднее | D85: =AVERAGE(OFFSET(R[-74]C,3,0,R7C1,1)) -> 138.31802543333333 | E85: =AVERAGE(OFFSET(R[-74]C,3,0,R7C1,1)) -> 68.528690000000012 | F85: =AVERAGE(OFFSET(R[-74]C,3,0,R7C1,1)) -> 8.042975666666667 | G85: =AVERAGE(OFFSET(R[-74]C,3,0,R7C1,1)) -> 127.27425416666668 | H85: =AVERAGE(OFFSET(R[-74]C,3,0,R7C1,1)) -> 49.740862100000001 | I85: =AVERAGE(OFFSET(R[-74]C,3,0,R7C1,1)) -> 5.526692033333334 | J85: =AVERAGE(OFFSET(R[-74]C,3,0,R7C1,1)) -> 18.787827900000003 | K85: =AVERAGE(OFFSET(R[-74]C,3,0,R7C1,1)) -> 11.109358533333333 | L85: =IF(SUM(OFFSET(R[-74]C,3,0,R7C1,1))=0,"",AVERAGE(OFFSET(R[-74]C,3,0,R7C1,1))) -> 7.3090157999999992 | M85: =IF(SUM(OFFSET(R[-74]C,3,0,R7C1,1))=0,"",AVERAGE(OFFSET(R[-74]C,3,0,R7C1,1))) -> 67.881115200000011 | N85: =IF(SUM(OFFSET(R[-74]C,3,0,R7C1,1))=0,"",AVERAGE(OFFSET(R[-74]C,3,0,R7C1,1))) -> 3.0172149666666663 | O85: =IF(SUM(OFFSET(R[-74]C,3,0,R7C1,1))=0,"",AVERAGE(OFFSET(R[-74]C,3,0,R7C1,1))) -> 65.387867633333343 | P85: =IF(SUM(OFFSET(R[-74]C,3,0,R7C1,1))=0,"",AVERAGE(OFFSET(R[-74]C,3,0,R7C1,1))) -> 2.4932475666666671 | Q85: =IF(SUM(OFFSET(R[-74]C,3,0,R7C1,1))=0,"",AVERAGE(OFFSET(R[-74]C,3,0,R7C1,1))) -> 10.326230766666667 | R85: =IF(SUM(OFFSET(R[-74]C,3,0,R7C1,1))=0,"",AVERAGE(OFFSET(R[-74]C,3,0,R7C1,1))) -> 0.67951003333333337 | S85: =AVERAGE(OFFSET(R[-74]C,3,0,R7C1,1)) -> 4.0292989333333331 | T85: =AVERAGE(OFFSET(R[-74]C,3,0,R7C1,1)) -> 3.12849947285661 | W85: =AVERAGE(OFFSET(R[-74]C,3,0,R7C1,1)) -> 0.48556602952601302 | X85: =AVERAGE(OFFSET(R[-74]C,3,0,R7C1,1)) -> 0.29212411371424557 | AC85: Итого | AE85: =R[1]C[-28] -> 720 | AF85: =R[1]C[-28] -> 4149.540763 | AI85: =R[1]C[-28] -> 3818.2276250000004 | AM85: =R[1]C[-28] -> 333.280756 | AN85: =R[1]C[-28] -> 219.27047399999998 | AQ85: =R[1]C[-29] -> 90.516448999999994 | AU85: =R[1]C[-30] -> 309.786923 | AV85: =R[1]C[-30] -> 20.385301000000002 | AW85: =R[1]C[-30] -> 120.878968
B86: ИТОГО: | C86: =SUM(OFFSET(R[-75]C,3,0,R7C1,1)) -> 720 | D86: =SUM(OFFSET(R[-75]C,3,0,R7C1,1)) -> 4149.540763 | G86: =SUM(OFFSET(R[-75]C,3,0,R7C1,1)) -> 3818.2276250000004 | K86: =SUM(OFFSET(R[-75]C,3,0,R7C1,1)) -> 333.280756 | L86: =IF(SUM(OFFSET(R[-75]C,3,0,R7C1,1))=0,"",SUM(OFFSET(R[-75]C,3,0,R7C1,1))) -> 219.27047399999998 | N86: =IF(SUM(OFFSET(R[-75]C,3,0,R7C1,1))=0,"",SUM(OFFSET(R[-75]C,3,0,R7C1,1))) -> 90.516448999999994 | Q86: =IF(SUM(OFFSET(R[-75]C,3,0,R7C1,1))=0,"",SUM(OFFSET(R[-75]C,3,0,R7C1,1))) -> 309.786923 | R86: =IF(SUM(OFFSET(R[-75]C,3,0,R7C1,1))=0,"",SUM(OFFSET(R[-75]C,3,0,R7C1,1))) -> 20.385301000000002 | S86: =SUM(OFFSET(R[-75]C,3,0,R7C1,1)) -> 120.878968 | T86: =SUM(OFFSET(R[-75]C,3,0,R7C1,1)) -> 93.854984185698299 | W86: =SUM(OFFSET(R[-75]C,3,0,R7C1,1)) -> 14.56698088578039 | X86: =SUM(OFFSET(R[-75]C,3,0,R7C1,1)) -> 8.7637234114273674
AC87: Досчёт | AF87: =R[1]C[-28] -> 0 | AI87: =R[1]C[-28] -> 0 | AM87: =R[1]C[-28] -> 0 | AN87: =R[1]C[-28] -> 0 | AQ87: =R[1]C[-29] -> 0 | AU87: =R[1]C[-30] -> 0 | AV87: =R[1]C[-30] -> 0 | AW87: =R[1]C[-30] -> 0
A88: 11дн=264ч 4дн=96ч | B88: Досчёт до конца м-ца (+) | C88: =R6C1*24 -> 216 | T88: № 10060 | AC88: Снятие | AF88: =-R[1]C[-28] -> 0 | AI88: =-R[1]C[-28] -> 0 | AM88: =-R[1]C[-28] -> 0 | AN88: =-R[1]C[-28] -> 0 | AQ88: =-R[1]C[-29] -> 0 | AU88: =-R[1]C[-30] -> 0 | AV88: =-R[1]C[-30] -> 0 | AW88: =-R[1]C[-30] -> 0
A89: 9дн=216ч 7дн=168ч | B89: Вычет с предыдущего (-) | C89: =R4C1*24 -> 192 | AC89: Сумма | AF89: =R[1]C[-28] -> 4149.540763 | AI89: =R[1]C[-28] -> 3818.2276250000004 | AM89: =R[1]C[-28] -> 333.280756 | AN89: =R[1]C[-28] -> 219.27047399999998 | AQ89: =R[1]C[-29] -> 90.516448999999994 | AU89: =R[1]C[-30] -> 309.786923 | AV89: =R[1]C[-30] -> 20.385301000000002 | AW89: =R[1]C[-30] -> 120.878968
B90: СУММА: | C90: =R[-4]C+R[-2]C-R[-1]C -> 744 | D90: =R[-4]C+R[-2]C-R[-1]C -> 4149.540763 | G90: =R[-4]C+R[-2]C-R[-1]C -> 3818.2276250000004 | K90: =R[-4]C+R[-2]C-R[-1]C -> 333.280756 | L90: =IF(SUM(OFFSET(R[-79]C,3,0,R7C1,1))=0,"",(R[-4]C+R[-2]C-R[-1]C)) -> 219.27047399999998 | N90: =IF(SUM(OFFSET(R[-79]C,3,0,R7C1,1))=0,"",(R[-4]C+R[-2]C-R[-1]C)) -> 90.516448999999994 | Q90: =IF(SUM(OFFSET(R[-79]C,3,0,R7C1,1))=0,"",(R[-4]C+R[-2]C-R[-1]C)) -> 309.786923 | R90: =IF(SUM(OFFSET(R[-79]C,3,0,R7C1,1))=0,"",(R[-4]C+R[-2]C-R[-1]C)) -> 20.385301000000002 | S90: =R[-4]C+R[-2]C-R[-1]C -> 120.878968
AC91: Тхв на источнике | AE91: V гвс (м3) | AF91: =R[-2]C[15] -> 309.786923 | AG91: W гвс (Гкал) | AH91: =RC[-2]*0.06 -> 18.58721538 | AI91: W без гвс (Гкал) | AJ91: =R[-2]C[13]-RC[-2] -> 102.29175262
B92: Показания счетчиков на момент снятия данных:
B93: Дата, время | D93: М1, т | F93: М2, т | H93: М3, т | J93: М4, т | L93: Qо, Гкал | N93: Qг, Гкал | P93: время, час
B94: 23.09.18 00:00 | D94: 80275.301999999996 | F94: 70847.639060000001 | H94: 7522.0491000000002 | J94: 2095.0576000000001 | L94: 2463.0329700000002 | N94: 696.34060999999997 | P94: -
B95: 18.10.18 01:00 | D95: 83720.155650000001 | F95: 74018.143119999993 | H95: 7700.3364799999999 | J95: 2168.04108 | L95: 2567.9721800000002 | N95: 713.13818000000003 | P95: -
AC97: =ZAYAVKA_N -> з.н д. №02/147-2783 от 04.10.18 В данном отчете ГВС суммируется
B98: Представитель потребителя:_______________________________________________________________________ В.О. Топорков
I101: Рекомендуемые значения по параметрам теплопотребления (не являются официально утверждёнными)
I102: М, т | J102: V, м3 | K102: Qгвс, Гкал | L102: Qотоп, Гкал | M102: Qо, Гкал
I103: =R[-13]C[-3] -> 0 | J103: =RC[-1]/0.98 -> 0 | K103: =RC[-1]*0.06 -> 0 | L103: =RC[1]-RC[-1] -> 20.385301000000002 | M103: =R[-13]C[5] -> 20.385301000000002
O105: ДЛЯ САМОКОНТРОЛЯ
B106: В строке выбора дат указать период с 16.7.13 по 23.8.13 - жильё | N106: Q | O106: Qг
B107: В строке выбора дат указать период с 18.7.13 по 25.8.13 - не жилое | N107: =(R[-21]C[-10]*R[-22]C[-7]-R[-21]C[-9]*R[-22]C[-6])/1000 -> 528.12970574500594 | O107: =IF(R[-22]C[-2]="",R[-21]C[-3]*R[-22]C/1000,"") ->  | P107: Си2
O108: =IF(R[-23]C[-2]="","",((R[-22]C[-3]*R[-23]C)-(R[-22]C[-2]*R[-23]C[2]))/1000) -> 14.337628729810259 | P108: Си3