Sheet: Лист1
G1: Отчёт о теплопотреблении за октябрь 2018 | M1: з.н д. №02/147-2783 от 04.10.18 с 05.10.18г по 12.10.18г некорректная работа приборов
A4: =EOMONTH(R[9]C,0)-R[9]C -> 8 | B4: Потребитель: ЗАО "Сити Сервис"
A5: =MAX(R[9]C:R[78]C) -> 2018-10-22T00:00:00.000 | B5: Адрес: г. СПб, Кораблестроителей ул., д.29 к.4 ИТП 3
A6: =EOMONTH(R[-1]C,0)-R[-1]C -> 9 | B6: Телефон: 8-911-021-19-79
A7: =R[-2]C-R[6]C -> 30 | B7: Договор 10023-2 (.) 14398
A8: 7 | B8: Тепловычислитель: ВКТ-7 № 108343 | L8: М2 мах= | M8: 256.8 | O8: Мгвс мах= | P8: 80.4
L9: Qотоп мах= | M9: 20.52 | O9: Qгвс мах= | P9: 4.8
B10: Расчётная формула: Q=M1*(h1-h2)+(M1-M2)*(h2-hхв)
D12: Учет | L12: Контроль
A13: =R[1]C[1]-1 -> 2018-09-22T00:00:00.000 | B13: Дата | C13: N, ч | D13: M1, т | E13: T1, С | F13: P1, кг/см2 | G13: M2, т | H13: T2, С | I13: P2, кг/см2 | J13: dT, С | K13: M1-М2, т | L13: V3, м3 | M13: T3, С | N13: V4, м3 | O13: =IF(R[-12]C[-14]="м.куб","","T4, С") -> T4, С | P13: dT, С | Q13: V3-V4, м3 | R13: Qгвс, Гкал | S13: Qобщ., Гкал | T13: Q | U13: M3 | V13: M4 | W13: си2 | X13: си3 | Y13: Разб. | Z13: dM2 | AC13: Дата | AD13: НС | AE13: n, ч | AF13: М1, т | AG13: t1, гр. С | AH13: Р1, кгс/см2 | AI13: М2, т | AJ13: t2, гр. С | AK13: Р2, кгс/см2 | AL13: t1-t2, гр. С | AM13: М1-М2, т | AN13: М1гвс, т | AO13: t1гвс, гр. С | AP13: Р1гвс, кгс/см2 | AQ13: М2гвс, т | AR13: t2гвс, гр. С | AS13: Р2гвс, кгс/см2 | AT13: t1гвс-t2гвс | AU13: М1гвс-М2гвс, т | AV13: Wгвс, Гкал | AW13: Wсумм, Гкал | AY13: NS_TV1 | AZ13: НС | BA13: NS_TV2
A14: =IF(RC[1]="","",DATEVALUE(RC[1])) -> 43366 | B14: 23.09.18 | C14: 24 | D14: 336.67 | E14: 70.97 | F14: 8.06 | G14: 298.83 | H14: 70.959999999999994 | I14: 5.49 | J14: =RC[-5]-RC[-2] -> 1.0000000000005116E-2 | K14: 37.840000000000003 | L14: 33.44 | M14: 70.959999999999994 | R14: 2.3210000000000002 | S14: =RC[-1] -> 2.3210000000000002 | T14: =(RC[-16]*RC[-15]-RC[-13]*RC[-12])/1000 -> 2.6884931000000032 | U14: 32.69 | V14: - | W14: =RC[-2]*RC[-10]/1000 -> 2.3196823999999996 | X14: =ABS((RC[-3]*RC[-11]-RC[-2]*RC[-9])/1000) -> #VALUE! | Y14: =(RC[-14]-RC[1])/RC[-18]*100 -> 1.7233878793963142 | Z14: 32.69 | AC14: =VALUE(RC[-27]) -> 2018-09-23T00:00:00.000 | AD14: =IF(RC[21]=42,"*",IF(RC[21]=32,"",RC[21])) -> - | AE14: =RC[-28] -> 24 | AF14: =RC[-28] -> 336.67 | AG14: =RC[-28] -> 70.97 | AH14: =RC[-28] -> 8.06 | AI14: =RC[-28] -> 298.83 | AJ14: =RC[-28] -> 70.959999999999994 | AK14: =RC[-28] -> 5.49 | AL14: =RC[-28] -> 1.0000000000005116E-2 | AM14: =RC[-28] -> 37.840000000000003 | AN14: =RC[-28] -> 33.44 | AO14: =RC[-28] -> 70.959999999999994 | AP14: - | AQ14: =RC[-29] -> 0 | AR14: =RC[-29] -> 0 | AS14: - | AT14: =RC[-30] -> 0 | AU14: =RC[-30] -> 0 | AV14: =RC[-30] -> 2.3210000000000002 | AW14: =RC[-30] -> 2.3210000000000002 | AY14: - | AZ14: - | BA14: -
A15: =IF(RC[1]="","",DATEVALUE(RC[1])) -> 43367 | B15: 24.09.18 | C15: 24 | D15: 335.25 | E15: 69.86 | F15: 8.1 | G15: 298.01 | H15: 69.86 | I15: 5.49 | J15: =RC[-5]-RC[-2] -> 0 | K15: 37.24 | L15: 32.39 | M15: 69.760000000000005 | R15: 2.2090000000000001 | S15: =RC[-1] -> 2.2090000000000001 | T15: =(RC[-16]*RC[-15]-RC[-13]*RC[-12])/1000 -> 2.6015864 | U15: 31.67 | V15: - | W15: =RC[-2]*RC[-10]/1000 -> 2.2092992000000002 | X15: =ABS((RC[-3]*RC[-11]-RC[-2]*RC[-9])/1000) -> #VALUE! | Y15: =(RC[-14]-RC[1])/RC[-18]*100 -> 1.8690647964833396 | Z15: 31.67 | AC15: =VALUE(RC[-27]) -> 2018-09-24T00:00:00.000 | AD15: =IF(RC[21]=42,"*",IF(RC[21]=32,"",RC[21])) -> - | AE15: =RC[-28] -> 24 | AF15: =RC[-28] -> 335.25 | AG15: =RC[-28] -> 69.86 | AH15: =RC[-28] -> 8.1 | AI15: =RC[-28] -> 298.01 | AJ15: =RC[-28] -> 69.86 | AK15: =RC[-28] -> 5.49 | AL15: =RC[-28] -> 0 | AM15: =RC[-28] -> 37.24 | AN15: =RC[-28] -> 32.39 | AO15: =RC[-28] -> 69.760000000000005 | AP15: - | AQ15: =RC[-29] -> 0 | AR15: =RC[-29] -> 0 | AS15: - | AT15: =RC[-30] -> 0 | AU15: =RC[-30] -> 0 | AV15: =RC[-30] -> 2.2090000000000001 | AW15: =RC[-30] -> 2.2090000000000001 | AY15: - | AZ15: - | BA15: -
A16: =IF(RC[1]="","",DATEVALUE(RC[1])) -> 43368 | B16: 25.09.18 | C16: 24 | D16: 340.99 | E16: 68.34 | F16: 8.1300000000000008 | G16: 303.43 | H16: 68.37 | I16: 5.34 | J16: =RC[-5]-RC[-2] -> -3.0000000000001137E-2 | K16: 37.56 | L16: 34.619999999999997 | M16: 68.08 | R16: 2.3079999999999998 | S16: =RC[-1] -> 2.3079999999999998 | T16: =(RC[-16]*RC[-15]-RC[-13]*RC[-12])/1000 -> 2.5577474999999978 | U16: 33.909999999999997 | V16: - | W16: =RC[-2]*RC[-10]/1000 -> 2.3085928 | X16: =ABS((RC[-3]*RC[-11]-RC[-2]*RC[-9])/1000) -> #VALUE! | Y16: =(RC[-14]-RC[1])/RC[-18]*100 -> 1.2029133572817472 | Z16: 33.909999999999997 | AC16: =VALUE(RC[-27]) -> 2018-09-25T00:00:00.000 | AD16: =IF(RC[21]=42,"*",IF(RC[21]=32,"",RC[21])) -> - | AE16: =RC[-28] -> 24 | AF16: =RC[-28] -> 340.99 | AG16: =RC[-28] -> 68.34 | AH16: =RC[-28] -> 8.1300000000000008 | AI16: =RC[-28] -> 303.43 | AJ16: =RC[-28] -> 68.37 | AK16: =RC[-28] -> 5.34 | AL16: =RC[-28] -> -3.0000000000001137E-2 | AM16: =RC[-28] -> 37.56 | AN16: =RC[-28] -> 34.619999999999997 | AO16: =RC[-28] -> 68.08 | AP16: - | AQ16: =RC[-29] -> 0 | AR16: =RC[-29] -> 0 | AS16: - | AT16: =RC[-30] -> 0 | AU16: =RC[-30] -> 0 | AV16: =RC[-30] -> 2.3079999999999998 | AW16: =RC[-30] -> 2.3079999999999998 | AY16: - | AZ16: - | BA16: -
A17: =IF(RC[1]="","",DATEVALUE(RC[1])) -> 43369 | B17: 26.09.18 | C17: 24 | D17: 313.88 | E17: 67.73 | F17: 8.2100000000000009 | G17: 273.44 | H17: 67.77 | I17: 5.26 | J17: =RC[-5]-RC[-2] -> -3.9999999999992042E-2 | K17: 40.44 | L17: 34.85 | M17: 66.92 | R17: 2.286 | S17: =RC[-1] -> 2.286 | T17: =(RC[-16]*RC[-15]-RC[-13]*RC[-12])/1000 -> 2.7280636000000014 | U17: 34.14 | V17: - | W17: =RC[-2]*RC[-10]/1000 -> 2.2846487999999998 | X17: =ABS((RC[-3]*RC[-11]-RC[-2]*RC[-9])/1000) -> #VALUE! | Y17: =(RC[-14]-RC[1])/RC[-18]*100 -> 2.3039789350497357 | Z17: 34.14 | AC17: =VALUE(RC[-27]) -> 2018-09-26T00:00:00.000 | AD17: =IF(RC[21]=42,"*",IF(RC[21]=32,"",RC[21])) -> - | AE17: =RC[-28] -> 24 | AF17: =RC[-28] -> 313.88 | AG17: =RC[-28] -> 67.73 | AH17: =RC[-28] -> 8.2100000000000009 | AI17: =RC[-28] -> 273.44 | AJ17: =RC[-28] -> 67.77 | AK17: =RC[-28] -> 5.26 | AL17: =RC[-28] -> -3.9999999999992042E-2 | AM17: =RC[-28] -> 40.44 | AN17: =RC[-28] -> 34.85 | AO17: =RC[-28] -> 66.92 | AP17: - | AQ17: =RC[-29] -> 0 | AR17: =RC[-29] -> 0 | AS17: - | AT17: =RC[-30] -> 0 | AU17: =RC[-30] -> 0 | AV17: =RC[-30] -> 2.286 | AW17: =RC[-30] -> 2.286 | AY17: - | AZ17: - | BA17: -
A18: =IF(RC[1]="","",DATEVALUE(RC[1])) -> 43370 | B18: 27.09.18 | C18: 24 | D18: 311.89 | E18: 63.11 | F18: 7.91 | G18: 272.2 | H18: 52.97 | I18: 5.45 | J18: =RC[-5]-RC[-2] -> 10.14 | K18: 39.69 | L18: 35.090000000000003 | M18: 62.89 | R18: 2.169 | S18: 5.2880000000000003 | T18: =(RC[-16]*RC[-15]-RC[-13]*RC[-12])/1000 -> 5.2649439000000005 | U18: 34.49 | V18: - | W18: =RC[-2]*RC[-10]/1000 -> 2.1690761000000003 | X18: =ABS((RC[-3]*RC[-11]-RC[-2]*RC[-9])/1000) -> #VALUE! | Y18: =(RC[-14]-RC[1])/RC[-18]*100 -> 1.9103600293901526 | Z18: 34.49 | AC18: =VALUE(RC[-27]) -> 2018-09-27T00:00:00.000 | AD18: =IF(RC[21]=42,"*",IF(RC[21]=32,"",RC[21])) -> - | AE18: =RC[-28] -> 24 | AF18: =RC[-28] -> 311.89 | AG18: =RC[-28] -> 63.11 | AH18: =RC[-28] -> 7.91 | AI18: =RC[-28] -> 272.2 | AJ18: =RC[-28] -> 52.97 | AK18: =RC[-28] -> 5.45 | AL18: =RC[-28] -> 10.14 | AM18: =RC[-28] -> 39.69 | AN18: =RC[-28] -> 35.090000000000003 | AO18: =RC[-28] -> 62.89 | AP18: - | AQ18: =RC[-29] -> 0 | AR18: =RC[-29] -> 0 | AS18: - | AT18: =RC[-30] -> 0 | AU18: =RC[-30] -> 0 | AV18: =RC[-30] -> 2.169 | AW18: =RC[-30] -> 5.2880000000000003 | AY18: - | AZ18: - | BA18: -
A19: =IF(RC[1]="","",DATEVALUE(RC[1])) -> 43371 | B19: 28.09.18 | C19: 24 | D19: 329.69 | E19: 67.88 | F19: 7.58 | G19: 292.67 | H19: 45.29 | I19: 5.64 | J19: =RC[-5]-RC[-2] -> 22.589999999999996 | K19: 37.020000000000003 | L19: 33.11 | M19: 67.98 | R19: 2.206 | S19: 9.1289999999999996 | T19: =(RC[-16]*RC[-15]-RC[-13]*RC[-12])/1000 -> 9.1243328999999971 | U19: 32.409999999999997 | V19: - | W19: =RC[-2]*RC[-10]/1000 -> 2.2032318000000002 | X19: =ABS((RC[-3]*RC[-11]-RC[-2]*RC[-9])/1000) -> #VALUE! | Y19: =(RC[-14]-RC[1])/RC[-18]*100 -> 1.5751529025865332 | Z19: 32.409999999999997 | AC19: =VALUE(RC[-27]) -> 2018-09-28T00:00:00.000 | AD19: =IF(RC[21]=42,"*",IF(RC[21]=32,"",RC[21])) -> - | AE19: =RC[-28] -> 24 | AF19: =RC[-28] -> 329.69 | AG19: =RC[-28] -> 67.88 | AH19: =RC[-28] -> 7.58 | AI19: =RC[-28] -> 292.67 | AJ19: =RC[-28] -> 45.29 | AK19: =RC[-28] -> 5.64 | AL19: =RC[-28] -> 22.589999999999996 | AM19: =RC[-28] -> 37.020000000000003 | AN19: =RC[-28] -> 33.11 | AO19: =RC[-28] -> 67.98 | AP19: - | AQ19: =RC[-29] -> 0 | AR19: =RC[-29] -> 0 | AS19: - | AT19: =RC[-30] -> 0 | AU19: =RC[-30] -> 0 | AV19: =RC[-30] -> 2.206 | AW19: =RC[-30] -> 9.1289999999999996 | AY19: - | AZ19: - | BA19: -
A20: =IF(RC[1]="","",DATEVALUE(RC[1])) -> 43372 | B20: 29.09.18 | C20: 24 | D20: 319.7 | E20: 67.38 | F20: 7.62 | G20: 284.66000000000003 | H20: 44.74 | I20: 5.76 | J20: =RC[-5]-RC[-2] -> 22.639999999999993 | K20: 35.04 | L20: 32.799999999999997 | M20: 67.17 | R20: 2.1589999999999998 | S20: 8.81 | T20: =(RC[-16]*RC[-15]-RC[-13]*RC[-12])/1000 -> 8.8056975999999985 | U20: 32.15 | V20: - | W20: =RC[-2]*RC[-10]/1000 -> 2.1595154999999999 | X20: =ABS((RC[-3]*RC[-11]-RC[-2]*RC[-9])/1000) -> #VALUE! | Y20: =(RC[-14]-RC[1])/RC[-18]*100 -> 1.0152462586945832 | Z20: 32.15 | AC20: =VALUE(RC[-27]) -> 2018-09-29T00:00:00.000 | AD20: =IF(RC[21]=42,"*",IF(RC[21]=32,"",RC[21])) -> - | AE20: =RC[-28] -> 24 | AF20: =RC[-28] -> 319.7 | AG20: =RC[-28] -> 67.38 | AH20: =RC[-28] -> 7.62 | AI20: =RC[-28] -> 284.66000000000003 | AJ20: =RC[-28] -> 44.74 | AK20: =RC[-28] -> 5.76 | AL20: =RC[-28] -> 22.639999999999993 | AM20: =RC[-28] -> 35.04 | AN20: =RC[-28] -> 32.799999999999997 | AO20: =RC[-28] -> 67.17 | AP20: - | AQ20: =RC[-29] -> 0 | AR20: =RC[-29] -> 0 | AS20: - | AT20: =RC[-30] -> 0 | AU20: =RC[-30] -> 0 | AV20: =RC[-30] -> 2.1589999999999998 | AW20: =RC[-30] -> 8.81 | AY20: - | AZ20: - | BA20: -
A21: =IF(RC[1]="","",DATEVALUE(RC[1])) -> 43373 | B21: 30.09.18 | C21: 24 | D21: 319.79000000000002 | E21: 69.650000000000006 | F21: 7.53 | G21: 283.36 | H21: 46.07 | I21: 5.73 | J21: =RC[-5]-RC[-2] -> 23.580000000000005 | K21: 36.43 | L21: 34.21 | M21: 69.89 | R21: 2.3410000000000002 | S21: 9.2219999999999995 | T21: =(RC[-16]*RC[-15]-RC[-13]*RC[-12])/1000 -> 9.2189782999999998 | U21: 33.46 | V21: - | W21: =RC[-2]*RC[-10]/1000 -> 2.3385194 | X21: =ABS((RC[-3]*RC[-11]-RC[-2]*RC[-9])/1000) -> #VALUE! | Y21: =(RC[-14]-RC[1])/RC[-18]*100 -> 1.0481366459627324 | Z21: 33.46 | AC21: =VALUE(RC[-27]) -> 2018-09-30T00:00:00.000 | AD21: =IF(RC[21]=42,"*",IF(RC[21]=32,"",RC[21])) -> - | AE21: =RC[-28] -> 24 | AF21: =RC[-28] -> 319.79000000000002 | AG21: =RC[-28] -> 69.650000000000006 | AH21: =RC[-28] -> 7.53 | AI21: =RC[-28] -> 283.36 | AJ21: =RC[-28] -> 46.07 | AK21: =RC[-28] -> 5.73 | AL21: =RC[-28] -> 23.580000000000005 | AM21: =RC[-28] -> 36.43 | AN21: =RC[-28] -> 34.21 | AO21: =RC[-28] -> 69.89 | AP21: - | AQ21: =RC[-29] -> 0 | AR21: =RC[-29] -> 0 | AS21: - | AT21: =RC[-30] -> 0 | AU21: =RC[-30] -> 0 | AV21: =RC[-30] -> 2.3410000000000002 | AW21: =RC[-30] -> 9.2219999999999995 | AY21: - | AZ21: - | BA21: -
A22: =IF(RC[1]="","",DATEVALUE(RC[1])) -> 43374 | B22: 01.10.18 | C22: 24 | D22: 320.13 | E22: 68.38 | F22: 7.6 | G22: 284.42 | H22: 46.34 | I22: 5.79 | J22: =RC[-5]-RC[-2] -> 22.039999999999992 | K22: 35.71 | L22: 33.200000000000003 | M22: 68.19 | R22: 2.2170000000000001 | S22: 8.7159999999999993 | T22: =(RC[-16]*RC[-15]-RC[-13]*RC[-12])/1000 -> 8.7104665999999966 | U22: 32.51 | V22: - | W22: =RC[-2]*RC[-10]/1000 -> 2.2168568999999998 | X22: =ABS((RC[-3]*RC[-11]-RC[-2]*RC[-9])/1000) -> #VALUE! | Y22: =(RC[-14]-RC[1])/RC[-18]*100 -> 1.1250966879966258 | Z22: 32.51 | AC22: =VALUE(RC[-27]) -> 2018-10-01T00:00:00.000 | AD22: =IF(RC[21]=42,"*",IF(RC[21]=32,"",RC[21])) -> - | AE22: =RC[-28] -> 24 | AF22: =RC[-28] -> 320.13 | AG22: =RC[-28] -> 68.38 | AH22: =RC[-28] -> 7.6 | AI22: =RC[-28] -> 284.42 | AJ22: =RC[-28] -> 46.34 | AK22: =RC[-28] -> 5.79 | AL22: =RC[-28] -> 22.039999999999992 | AM22: =RC[-28] -> 35.71 | AN22: =RC[-28] -> 33.200000000000003 | AO22: =RC[-28] -> 68.19 | AP22: - | AQ22: =RC[-29] -> 0 | AR22: =RC[-29] -> 0 | AS22: - | AT22: =RC[-30] -> 0 | AU22: =RC[-30] -> 0 | AV22: =RC[-30] -> 2.2170000000000001 | AW22: =RC[-30] -> 8.7159999999999993 | AY22: - | AZ22: - | BA22: -
A23: =IF(RC[1]="","",DATEVALUE(RC[1])) -> 43375 | B23: 02.10.18 | C23: 24 | D23: 301.70999999999998 | E23: 67.11 | F23: 7.37 | G23: 267.48 | H23: 45.12 | I23: 5.77 | J23: =RC[-5]-RC[-2] -> 21.990000000000002 | K23: 34.229999999999997 | L23: 31.78 | M23: 67.03 | R23: 2.089 | S23: 8.1790000000000003 | T23: =(RC[-16]*RC[-15]-RC[-13]*RC[-12])/1000 -> 8.1790605000000003 | U23: 31.13 | V23: - | W23: =RC[-2]*RC[-10]/1000 -> 2.0866438999999999 | X23: =ABS((RC[-3]*RC[-11]-RC[-2]*RC[-9])/1000) -> #VALUE! | Y23: =(RC[-14]-RC[1])/RC[-18]*100 -> 1.1589651562733654 | Z23: 31.13 | AC23: =VALUE(RC[-27]) -> 2018-10-02T00:00:00.000 | AD23: =IF(RC[21]=42,"*",IF(RC[21]=32,"",RC[21])) -> - | AE23: =RC[-28] -> 24 | AF23: =RC[-28] -> 301.70999999999998 | AG23: =RC[-28] -> 67.11 | AH23: =RC[-28] -> 7.37 | AI23: =RC[-28] -> 267.48 | AJ23: =RC[-28] -> 45.12 | AK23: =RC[-28] -> 5.77 | AL23: =RC[-28] -> 21.990000000000002 | AM23: =RC[-28] -> 34.229999999999997 | AN23: =RC[-28] -> 31.78 | AO23: =RC[-28] -> 67.03 | AP23: - | AQ23: =RC[-29] -> 0 | AR23: =RC[-29] -> 0 | AS23: - | AT23: =RC[-30] -> 0 | AU23: =RC[-30] -> 0 | AV23: =RC[-30] -> 2.089 | AW23: =RC[-30] -> 8.1790000000000003 | AY23: - | AZ23: - | BA23: -
A24: =IF(RC[1]="","",DATEVALUE(RC[1])) -> 43376 | B24: 03.10.18 | C24: 24 | D24: 294.05 | E24: 67.209999999999994 | F24: 7.39 | G24: 258.44 | H24: 44.43 | I24: 5.88 | J24: =RC[-5]-RC[-2] -> 22.779999999999994 | K24: 35.61 | L24: 32.04 | M24: 67.22 | R24: 2.1120000000000001 | S24: 8.2810000000000006 | T24: =(RC[-16]*RC[-15]-RC[-13]*RC[-12])/1000 -> 8.2806113000000003 | U24: 31.42 | V24: - | W24: =RC[-2]*RC[-10]/1000 -> 2.1120524000000001 | X24: =ABS((RC[-3]*RC[-11]-RC[-2]*RC[-9])/1000) -> #VALUE! | Y24: =(RC[-14]-RC[1])/RC[-18]*100 -> 1.6212660578857754 | Z24: 31.42 | AC24: =VALUE(RC[-27]) -> 2018-10-03T00:00:00.000 | AD24: =IF(RC[21]=42,"*",IF(RC[21]=32,"",RC[21])) -> - | AE24: =RC[-28] -> 24 | AF24: =RC[-28] -> 294.05 | AG24: =RC[-28] -> 67.209999999999994 | AH24: =RC[-28] -> 7.39 | AI24: =RC[-28] -> 258.44 | AJ24: =RC[-28] -> 44.43 | AK24: =RC[-28] -> 5.88 | AL24: =RC[-28] -> 22.779999999999994 | AM24: =RC[-28] -> 35.61 | AN24: =RC[-28] -> 32.04 | AO24: =RC[-28] -> 67.22 | AP24: - | AQ24: =RC[-29] -> 0 | AR24: =RC[-29] -> 0 | AS24: - | AT24: =RC[-30] -> 0 | AU24: =RC[-30] -> 0 | AV24: =RC[-30] -> 2.1120000000000001 | AW24: =RC[-30] -> 8.2810000000000006 | AY24: - | AZ24: - | BA24: -
A25: =IF(RC[1]="","",DATEVALUE(RC[1])) -> 43377 | B25: 04.10.18 | C25: 24 | D25: 279.79000000000002 | E25: 66.53 | F25: 7.26 | G25: 242.35 | H25: 42.62 | I25: 5.93 | J25: =RC[-5]-RC[-2] -> 23.910000000000004 | K25: 37.44 | L25: 34.880000000000003 | M25: 66.47 | R25: 2.2719999999999998 | S25: 8.2829999999999995 | T25: =(RC[-16]*RC[-15]-RC[-13]*RC[-12])/1000 -> 8.2854717000000022 | U25: 34.19 | V25: - | W25: =RC[-2]*RC[-10]/1000 -> 2.2726092999999996 | X25: =ABS((RC[-3]*RC[-11]-RC[-2]*RC[-9])/1000) -> #VALUE! | Y25: =(RC[-14]-RC[1])/RC[-18]*100 -> 1.3410356921807305 | Z25: 34.19 | AC25: =VALUE(RC[-27]) -> 2018-10-04T00:00:00.000 | AD25: =IF(RC[21]=42,"*",IF(RC[21]=32,"",RC[21])) -> - | AE25: =RC[-28] -> 24 | AF25: =RC[-28] -> 279.79000000000002 | AG25: =RC[-28] -> 66.53 | AH25: =RC[-28] -> 7.26 | AI25: =RC[-28] -> 242.35 | AJ25: =RC[-28] -> 42.62 | AK25: =RC[-28] -> 5.93 | AL25: =RC[-28] -> 23.910000000000004 | AM25: =RC[-28] -> 37.44 | AN25: =RC[-28] -> 34.880000000000003 | AO25: =RC[-28] -> 66.47 | AP25: - | AQ25: =RC[-29] -> 0 | AR25: =RC[-29] -> 0 | AS25: - | AT25: =RC[-30] -> 0 | AU25: =RC[-30] -> 0 | AV25: =RC[-30] -> 2.2719999999999998 | AW25: =RC[-30] -> 8.2829999999999995 | AY25: - | AZ25: - | BA25: -
A26: =IF(RC[1]="","",DATEVALUE(RC[1])) -> 43378 | B26: 05.10.18 | C26: 24 | D26: 282.76333333333338 | E26: 70.076666666666668 | F26: 7.1433333333333335 | G26: 248.05333333333337 | H26: 45.73 | I26: 5.8466666666666667 | J26: 24.346666666666668 | K26: 34.71 | L26: 32.200000000000003 | M26: 65.760000000000005 | R26: 2.08 | S26: =RC[1] -> 8.4716329222222253 | T26: =(RC[-16]*RC[-15]-RC[-13]*RC[-12])/1000 -> 8.4716329222222253 | U26: 31.58 | V26: - | W26: =RC[-2]*RC[-10]/1000 -> 2.0767008000000002 | X26: =ABS((RC[-3]*RC[-11]-RC[-2]*RC[-9])/1000) -> #VALUE! | Y26: =(RC[-14]-RC[1])/RC[-18]*100 -> 1.2618254138894871 | Z26: 31.58 | AC26: =VALUE(RC[-27]) -> 2018-10-05T00:00:00.000 | AD26: =IF(RC[21]=42,"*",IF(RC[21]=32,"",RC[21])) -> - | AE26: =RC[-28] -> 24 | AF26: =RC[-28] -> 282.76333333333338 | AG26: =RC[-28] -> 70.076666666666668 | AH26: =RC[-28] -> 7.1433333333333335 | AI26: =RC[-28] -> 248.05333333333337 | AJ26: =RC[-28] -> 45.73 | AK26: =RC[-28] -> 5.8466666666666667 | AL26: =RC[-28] -> 24.346666666666668 | AM26: =RC[-28] -> 34.71 | AN26: =RC[-28] -> 32.200000000000003 | AO26: =RC[-28] -> 65.760000000000005 | AP26: - | AQ26: =RC[-29] -> 0 | AR26: =RC[-29] -> 0 | AS26: - | AT26: =RC[-30] -> 0 | AU26: =RC[-30] -> 0 | AV26: =RC[-30] -> 2.08 | AW26: =RC[-30] -> 8.4716329222222253 | AY26: - | AZ26: - | BA26: -
A27: =IF(RC[1]="","",DATEVALUE(RC[1])) -> 43379 | B27: 06.10.18 | C27: 24 | D27: 282.76333333333338 | E27: 70.076666666666668 | F27: 7.1433333333333335 | G27: 248.05333333333337 | H27: 45.73 | I27: 5.8466666666666667 | J27: 24.346666666666668 | K27: 34.71 | L27: 35.1 | M27: 66.63 | R27: 2.2959999999999998 | S27: =RC[1] -> 8.4716329222222253 | T27: =(RC[-16]*RC[-15]-RC[-13]*RC[-12])/1000 -> 8.4716329222222253 | U27: 34.42 | V27: - | W27: =RC[-2]*RC[-10]/1000 -> 2.2934045999999997 | X27: =ABS((RC[-3]*RC[-11]-RC[-2]*RC[-9])/1000) -> #VALUE! | Y27: =(RC[-14]-RC[1])/RC[-18]*100 -> 0.11691034186196482 | Z27: 34.42 | AC27: =VALUE(RC[-27]) -> 2018-10-06T00:00:00.000 | AD27: =IF(RC[21]=42,"*",IF(RC[21]=32,"",RC[21])) -> - | AE27: =RC[-28] -> 24 | AF27: =RC[-28] -> 282.76333333333338 | AG27: =RC[-28] -> 70.076666666666668 | AH27: =RC[-28] -> 7.1433333333333335 | AI27: =RC[-28] -> 248.05333333333337 | AJ27: =RC[-28] -> 45.73 | AK27: =RC[-28] -> 5.8466666666666667 | AL27: =RC[-28] -> 24.346666666666668 | AM27: =RC[-28] -> 34.71 | AN27: =RC[-28] -> 35.1 | AO27: =RC[-28] -> 66.63 | AP27: - | AQ27: =RC[-29] -> 0 | AR27: =RC[-29] -> 0 | AS27: - | AT27: =RC[-30] -> 0 | AU27: =RC[-30] -> 0 | AV27: =RC[-30] -> 2.2959999999999998 | AW27: =RC[-30] -> 8.4716329222222253 | AY27: - | AZ27: - | BA27: -
A28: =IF(RC[1]="","",DATEVALUE(RC[1])) -> 43380 | B28: 07.10.18 | C28: 24 | D28: 282.76333333333338 | E28: 70.076666666666668 | F28: 7.1433333333333335 | G28: 248.05333333333337 | H28: 45.73 | I28: 5.8466666666666667 | J28: 24.346666666666668 | K28: 34.71 | L28: 38.97 | M28: 66.790000000000006 | R28: 2.5539999999999998 | S28: =RC[1] -> 8.4716329222222253 | T28: =(RC[-16]*RC[-15]-RC[-13]*RC[-12])/1000 -> 8.4716329222222253 | U28: 38.21 | V28: - | W28: =RC[-2]*RC[-10]/1000 -> 2.5520459 | X28: =ABS((RC[-3]*RC[-11]-RC[-2]*RC[-9])/1000) -> #VALUE! | Y28: =(RC[-14]-RC[1])/RC[-18]*100 -> -1.4109868845409588 | Z28: 38.21 | AC28: =VALUE(RC[-27]) -> 2018-10-07T00:00:00.000 | AD28: =IF(RC[21]=42,"*",IF(RC[21]=32,"",RC[21])) -> - | AE28: =RC[-28] -> 24 | AF28: =RC[-28] -> 282.76333333333338 | AG28: =RC[-28] -> 70.076666666666668 | AH28: =RC[-28] -> 7.1433333333333335 | AI28: =RC[-28] -> 248.05333333333337 | AJ28: =RC[-28] -> 45.73 | AK28: =RC[-28] -> 5.8466666666666667 | AL28: =RC[-28] -> 24.346666666666668 | AM28: =RC[-28] -> 34.71 | AN28: =RC[-28] -> 38.97 | AO28: =RC[-28] -> 66.790000000000006 | AP28: - | AQ28: =RC[-29] -> 0 | AR28: =RC[-29] -> 0 | AS28: - | AT28: =RC[-30] -> 0 | AU28: =RC[-30] -> 0 | AV28: =RC[-30] -> 2.5539999999999998 | AW28: =RC[-30] -> 8.4716329222222253 | AY28: - | AZ28: - | BA28: -
A29: =IF(RC[1]="","",DATEVALUE(RC[1])) -> 43381 | B29: 08.10.18 | C29: 24 | D29: 282.76333333333338 | E29: 70.076666666666668 | F29: 7.1433333333333335 | G29: 248.05333333333337 | H29: 45.73 | I29: 5.8466666666666667 | J29: 24.346666666666668 | K29: 34.71 | L29: 34.630000000000003 | M29: 66.67 | R29: 2.2650000000000001 | S29: =RC[1] -> 8.4716329222222253 | T29: =(RC[-16]*RC[-15]-RC[-13]*RC[-12])/1000 -> 8.4716329222222253 | U29: 33.94 | V29: - | W29: =RC[-2]*RC[-10]/1000 -> 2.2627797999999997 | X29: =ABS((RC[-3]*RC[-11]-RC[-2]*RC[-9])/1000) -> #VALUE! | Y29: =(RC[-14]-RC[1])/RC[-18]*100 -> 0.31041711459901217 | Z29: 33.94 | AC29: =VALUE(RC[-27]) -> 2018-10-08T00:00:00.000 | AD29: =IF(RC[21]=42,"*",IF(RC[21]=32,"",RC[21])) -> - | AE29: =RC[-28] -> 24 | AF29: =RC[-28] -> 282.76333333333338 | AG29: =RC[-28] -> 70.076666666666668 | AH29: =RC[-28] -> 7.1433333333333335 | AI29: =RC[-28] -> 248.05333333333337 | AJ29: =RC[-28] -> 45.73 | AK29: =RC[-28] -> 5.8466666666666667 | AL29: =RC[-28] -> 24.346666666666668 | AM29: =RC[-28] -> 34.71 | AN29: =RC[-28] -> 34.630000000000003 | AO29: =RC[-28] -> 66.67 | AP29: - | AQ29: =RC[-29] -> 0 | AR29: =RC[-29] -> 0 | AS29: - | AT29: =RC[-30] -> 0 | AU29: =RC[-30] -> 0 | AV29: =RC[-30] -> 2.2650000000000001 | AW29: =RC[-30] -> 8.4716329222222253 | AY29: - | AZ29: - | BA29: -
A30: =IF(RC[1]="","",DATEVALUE(RC[1])) -> 43382 | B30: 09.10.18 | C30: 24 | D30: 282.76333333333338 | E30: 70.076666666666668 | F30: 7.1433333333333335 | G30: 248.05333333333337 | H30: 45.73 | I30: 5.8466666666666667 | J30: 24.346666666666668 | K30: 34.71 | L30: 33.61 | M30: 66.7 | R30: 2.1949999999999998 | S30: =RC[1] -> 8.4716329222222253 | T30: =(RC[-16]*RC[-15]-RC[-13]*RC[-12])/1000 -> 8.4716329222222253 | U30: 32.93 | V30: - | W30: =RC[-2]*RC[-10]/1000 -> 2.196431 | X30: =ABS((RC[-3]*RC[-11]-RC[-2]*RC[-9])/1000) -> #VALUE! | Y30: =(RC[-14]-RC[1])/RC[-18]*100 -> 0.71758761556654527 | Z30: 32.93 | AC30: =VALUE(RC[-27]) -> 2018-10-09T00:00:00.000 | AD30: =IF(RC[21]=42,"*",IF(RC[21]=32,"",RC[21])) -> - | AE30: =RC[-28] -> 24 | AF30: =RC[-28] -> 282.76333333333338 | AG30: =RC[-28] -> 70.076666666666668 | AH30: =RC[-28] -> 7.1433333333333335 | AI30: =RC[-28] -> 248.05333333333337 | AJ30: =RC[-28] -> 45.73 | AK30: =RC[-28] -> 5.8466666666666667 | AL30: =RC[-28] -> 24.346666666666668 | AM30: =RC[-28] -> 34.71 | AN30: =RC[-28] -> 33.61 | AO30: =RC[-28] -> 66.7 | AP30: - | AQ30: =RC[-29] -> 0 | AR30: =RC[-29] -> 0 | AS30: - | AT30: =RC[-30] -> 0 | AU30: =RC[-30] -> 0 | AV30: =RC[-30] -> 2.1949999999999998 | AW30: =RC[-30] -> 8.4716329222222253 | AY30: - | AZ30: - | BA30: -
A31: =IF(RC[1]="","",DATEVALUE(RC[1])) -> 43383 | B31: 10.10.18 | C31: 24 | D31: 282.76333333333338 | E31: 70.076666666666668 | F31: 7.1433333333333335 | G31: 248.05333333333337 | H31: 45.73 | I31: 5.8466666666666667 | J31: 24.346666666666668 | K31: 34.71 | L31: 32.85 | M31: 67.83 | R31: 2.1850000000000001 | S31: =RC[1] -> 8.4716329222222253 | T31: =(RC[-16]*RC[-15]-RC[-13]*RC[-12])/1000 -> 8.4716329222222253 | U31: 32.200000000000003 | V31: - | W31: =RC[-2]*RC[-10]/1000 -> 2.184126 | X31: =ABS((RC[-3]*RC[-11]-RC[-2]*RC[-9])/1000) -> #VALUE! | Y31: =(RC[-14]-RC[1])/RC[-18]*100 -> 1.0118791657708011 | Z31: 32.200000000000003 | AC31: =VALUE(RC[-27]) -> 2018-10-10T00:00:00.000 | AD31: =IF(RC[21]=42,"*",IF(RC[21]=32,"",RC[21])) -> - | AE31: =RC[-28] -> 24 | AF31: =RC[-28] -> 282.76333333333338 | AG31: =RC[-28] -> 70.076666666666668 | AH31: =RC[-28] -> 7.1433333333333335 | AI31: =RC[-28] -> 248.05333333333337 | AJ31: =RC[-28] -> 45.73 | AK31: =RC[-28] -> 5.8466666666666667 | AL31: =RC[-28] -> 24.346666666666668 | AM31: =RC[-28] -> 34.71 | AN31: =RC[-28] -> 32.85 | AO31: =RC[-28] -> 67.83 | AP31: - | AQ31: =RC[-29] -> 0 | AR31: =RC[-29] -> 0 | AS31: - | AT31: =RC[-30] -> 0 | AU31: =RC[-30] -> 0 | AV31: =RC[-30] -> 2.1850000000000001 | AW31: =RC[-30] -> 8.4716329222222253 | AY31: - | AZ31: - | BA31: -
A32: =IF(RC[1]="","",DATEVALUE(RC[1])) -> 43384 | B32: 11.10.18 | C32: 24 | D32: 282.76333333333338 | E32: 70.076666666666668 | F32: 7.1433333333333335 | G32: 248.05333333333337 | H32: 45.73 | I32: 5.8466666666666667 | J32: 24.346666666666668 | K32: 34.71 | L32: 31.25 | M32: 68.78 | R32: 2.1030000000000002 | S32: =RC[1] -> 8.4716329222222253 | T32: =(RC[-16]*RC[-15]-RC[-13]*RC[-12])/1000 -> 8.4716329222222253 | U32: 30.58 | V32: - | W32: =RC[-2]*RC[-10]/1000 -> 2.1032924 | X32: =ABS((RC[-3]*RC[-11]-RC[-2]*RC[-9])/1000) -> #VALUE! | Y32: =(RC[-14]-RC[1])/RC[-18]*100 -> 1.6649645237583321 | Z32: 30.58 | AC32: =VALUE(RC[-27]) -> 2018-10-11T00:00:00.000 | AD32: =IF(RC[21]=42,"*",IF(RC[21]=32,"",RC[21])) -> - | AE32: =RC[-28] -> 24 | AF32: =RC[-28] -> 282.76333333333338 | AG32: =RC[-28] -> 70.076666666666668 | AH32: =RC[-28] -> 7.1433333333333335 | AI32: =RC[-28] -> 248.05333333333337 | AJ32: =RC[-28] -> 45.73 | AK32: =RC[-28] -> 5.8466666666666667 | AL32: =RC[-28] -> 24.346666666666668 | AM32: =RC[-28] -> 34.71 | AN32: =RC[-28] -> 31.25 | AO32: =RC[-28] -> 68.78 | AP32: - | AQ32: =RC[-29] -> 0 | AR32: =RC[-29] -> 0 | AS32: - | AT32: =RC[-30] -> 0 | AU32: =RC[-30] -> 0 | AV32: =RC[-30] -> 2.1030000000000002 | AW32: =RC[-30] -> 8.4716329222222253 | AY32: - | AZ32: - | BA32: -
A33: =IF(RC[1]="","",DATEVALUE(RC[1])) -> 43385 | B33: 12.10.18 | C33: 24 | D33: =AVERAGE(R[1]C:R[3]C) -> 282.76333333333338 | E33: =AVERAGE(R[1]C:R[3]C) -> 70.076666666666668 | F33: =AVERAGE(R[1]C:R[3]C) -> 7.1433333333333335 | G33: =AVERAGE(R[1]C:R[3]C) -> 248.05333333333337 | H33: =AVERAGE(R[1]C:R[3]C) -> 45.73 | I33: =AVERAGE(R[1]C:R[3]C) -> 5.8466666666666667 | J33: =AVERAGE(R[1]C:R[3]C) -> 24.346666666666668 | K33: =AVERAGE(R[1]C:R[3]C) -> 34.71 | L33: 31.31 | M33: 68.55 | R33: 2.1 | S33: =RC[1] -> 8.4716329222222253 | T33: =(RC[-16]*RC[-15]-RC[-13]*RC[-12])/1000 -> 8.4716329222222253 | U33: 30.65 | V33: - | W33: =RC[-2]*RC[-10]/1000 -> 2.1010575 | X33: =ABS((RC[-3]*RC[-11]-RC[-2]*RC[-9])/1000) -> #VALUE! | Y33: =(RC[-14]-RC[1])/RC[-18]*100 -> 1.6367447860675133 | Z33: 30.65 | AC33: =VALUE(RC[-27]) -> 2018-10-12T00:00:00.000 | AD33: =IF(RC[21]=42,"*",IF(RC[21]=32,"",RC[21])) -> - | AE33: =RC[-28] -> 24 | AF33: =RC[-28] -> 282.76333333333338 | AG33: =RC[-28] -> 70.076666666666668 | AH33: =RC[-28] -> 7.1433333333333335 | AI33: =RC[-28] -> 248.05333333333337 | AJ33: =RC[-28] -> 45.73 | AK33: =RC[-28] -> 5.8466666666666667 | AL33: =RC[-28] -> 24.346666666666668 | AM33: =RC[-28] -> 34.71 | AN33: =RC[-28] -> 31.31 | AO33: =RC[-28] -> 68.55 | AP33: - | AQ33: =RC[-29] -> 0 | AR33: =RC[-29] -> 0 | AS33: - | AT33: =RC[-30] -> 0 | AU33: =RC[-30] -> 0 | AV33: =RC[-30] -> 2.1 | AW33: =RC[-30] -> 8.4716329222222253 | AY33: - | AZ33: - | BA33: -
A34: =IF(RC[1]="","",DATEVALUE(RC[1])) -> 43386 | B34: 13.10.18 | C34: 24 | D34: 277.25 | E34: 69.72 | F34: 7.15 | G34: 243.31 | H34: 44.83 | I34: 5.9 | J34: =RC[-5]-RC[-2] -> 24.89 | K34: 33.94 | L34: 30.48 | M34: 69.790000000000006 | R34: 2.0870000000000002 | S34: 8.4190000000000005 | T34: =(RC[-16]*RC[-15]-RC[-13]*RC[-12])/1000 -> 8.4222827000000002 | U34: 29.84 | V34: - | W34: =RC[-2]*RC[-10]/1000 -> 2.0825336000000001 | X34: =ABS((RC[-3]*RC[-11]-RC[-2]*RC[-9])/1000) -> #VALUE! | Y34: =(RC[-14]-RC[1])/RC[-18]*100 -> 1.6850930911183255 | Z34: 29.84 | AC34: =VALUE(RC[-27]) -> 2018-10-13T00:00:00.000 | AD34: =IF(RC[21]=42,"*",IF(RC[21]=32,"",RC[21])) -> - | AE34: =RC[-28] -> 24 | AF34: =RC[-28] -> 277.25 | AG34: =RC[-28] -> 69.72 | AH34: =RC[-28] -> 7.15 | AI34: =RC[-28] -> 243.31 | AJ34: =RC[-28] -> 44.83 | AK34: =RC[-28] -> 5.9 | AL34: =RC[-28] -> 24.89 | AM34: =RC[-28] -> 33.94 | AN34: =RC[-28] -> 30.48 | AO34: =RC[-28] -> 69.790000000000006 | AP34: - | AQ34: =RC[-29] -> 0 | AR34: =RC[-29] -> 0 | AS34: - | AT34: =RC[-30] -> 0 | AU34: =RC[-30] -> 0 | AV34: =RC[-30] -> 2.0870000000000002 | AW34: =RC[-30] -> 8.4190000000000005 | AY34: - | AZ34: - | BA34: -
A35: =IF(RC[1]="","",DATEVALUE(RC[1])) -> 43387 | B35: 14.10.18 | C35: 24 | D35: 281.41000000000003 | E35: 70.5 | F35: 7.1 | G35: 246.3 | H35: 45.93 | I35: 5.82 | J35: =RC[-5]-RC[-2] -> 24.57 | K35: 35.11 | L35: 31.45 | M35: 70.64 | R35: 2.173 | S35: 8.5289999999999999 | T35: =(RC[-16]*RC[-15]-RC[-13]*RC[-12])/1000 -> 8.5268460000000008 | U35: 30.74 | V35: - | W35: =RC[-2]*RC[-10]/1000 -> 2.1714735999999997 | X35: =ABS((RC[-3]*RC[-11]-RC[-2]*RC[-9])/1000) -> #VALUE! | Y35: =(RC[-14]-RC[1])/RC[-18]*100 -> 1.7742590336987416 | Z35: 30.74 | AC35: =VALUE(RC[-27]) -> 2018-10-14T00:00:00.000 | AD35: =IF(RC[21]=42,"*",IF(RC[21]=32,"",RC[21])) -> - | AE35: =RC[-28] -> 24 | AF35: =RC[-28] -> 281.41000000000003 | AG35: =RC[-28] -> 70.5 | AH35: =RC[-28] -> 7.1 | AI35: =RC[-28] -> 246.3 | AJ35: =RC[-28] -> 45.93 | AK35: =RC[-28] -> 5.82 | AL35: =RC[-28] -> 24.57 | AM35: =RC[-28] -> 35.11 | AN35: =RC[-28] -> 31.45 | AO35: =RC[-28] -> 70.64 | AP35: - | AQ35: =RC[-29] -> 0 | AR35: =RC[-29] -> 0 | AS35: - | AT35: =RC[-30] -> 0 | AU35: =RC[-30] -> 0 | AV35: =RC[-30] -> 2.173 | AW35: =RC[-30] -> 8.5289999999999999 | AY35: - | AZ35: - | BA35: -
A36: =IF(RC[1]="","",DATEVALUE(RC[1])) -> 43388 | B36: 15.10.18 | C36: 24 | D36: 289.63 | E36: 70.010000000000005 | F36: 7.18 | G36: 254.55 | H36: 46.43 | I36: 5.82 | J36: =RC[-5]-RC[-2] -> 23.580000000000005 | K36: 35.08 | L36: 31.6 | M36: 70.06 | R36: 2.17 | S36: 8.4580000000000002 | T36: =(RC[-16]*RC[-15]-RC[-13]*RC[-12])/1000 -> 8.4582398000000012 | U36: 30.92 | V36: - | W36: =RC[-2]*RC[-10]/1000 -> 2.1662552000000002 | X36: =ABS((RC[-3]*RC[-11]-RC[-2]*RC[-9])/1000) -> #VALUE! | Y36: =(RC[-14]-RC[1])/RC[-18]*100 -> 1.6342565311333712 | Z36: 30.92 | AC36: =VALUE(RC[-27]) -> 2018-10-15T00:00:00.000 | AD36: =IF(RC[21]=42,"*",IF(RC[21]=32,"",RC[21])) -> - | AE36: =RC[-28] -> 24 | AF36: =RC[-28] -> 289.63 | AG36: =RC[-28] -> 70.010000000000005 | AH36: =RC[-28] -> 7.18 | AI36: =RC[-28] -> 254.55 | AJ36: =RC[-28] -> 46.43 | AK36: =RC[-28] -> 5.82 | AL36: =RC[-28] -> 23.580000000000005 | AM36: =RC[-28] -> 35.08 | AN36: =RC[-28] -> 31.6 | AO36: =RC[-28] -> 70.06 | AP36: - | AQ36: =RC[-29] -> 0 | AR36: =RC[-29] -> 0 | AS36: - | AT36: =RC[-30] -> 0 | AU36: =RC[-30] -> 0 | AV36: =RC[-30] -> 2.17 | AW36: =RC[-30] -> 8.4580000000000002 | AY36: - | AZ36: - | BA36: -
A37: =IF(RC[1]="","",DATEVALUE(RC[1])) -> 43389 | B37: 16.10.18 | C37: 24 | D37: 291.83 | E37: 70.02 | F37: 7.14 | G37: 256.92 | H37: 46.64 | I37: 5.76 | J37: =RC[-5]-RC[-2] -> 23.379999999999995 | K37: 34.909999999999997 | L37: 31.68 | M37: 69.989999999999995 | R37: 2.1680000000000001 | S37: 8.4510000000000005 | T37: =(RC[-16]*RC[-15]-RC[-13]*RC[-12])/1000 -> 8.451187799999996 | U37: 30.98 | V37: - | W37: =RC[-2]*RC[-10]/1000 -> 2.1682901999999999 | X37: =ABS((RC[-3]*RC[-11]-RC[-2]*RC[-9])/1000) -> #VALUE! | Y37: =(RC[-14]-RC[1])/RC[-18]*100 -> 1.5296590378327868 | Z37: 30.98 | AC37: =VALUE(RC[-27]) -> 2018-10-16T00:00:00.000 | AD37: =IF(RC[21]=42,"*",IF(RC[21]=32,"",RC[21])) -> - | AE37: =RC[-28] -> 24 | AF37: =RC[-28] -> 291.83 | AG37: =RC[-28] -> 70.02 | AH37: =RC[-28] -> 7.14 | AI37: =RC[-28] -> 256.92 | AJ37: =RC[-28] -> 46.64 | AK37: =RC[-28] -> 5.76 | AL37: =RC[-28] -> 23.379999999999995 | AM37: =RC[-28] -> 34.909999999999997 | AN37: =RC[-28] -> 31.68 | AO37: =RC[-28] -> 69.989999999999995 | AP37: - | AQ37: =RC[-29] -> 0 | AR37: =RC[-29] -> 0 | AS37: - | AT37: =RC[-30] -> 0 | AU37: =RC[-30] -> 0 | AV37: =RC[-30] -> 2.1680000000000001 | AW37: =RC[-30] -> 8.4510000000000005 | AY37: - | AZ37: - | BA37: -
A38: =IF(RC[1]="","",DATEVALUE(RC[1])) -> 43390 | B38: 17.10.18 | C38: 24 | D38: 298.02999999999997 | E38: 70.3 | F38: 7.21 | G38: 263.29000000000002 | H38: 47.15 | I38: 5.75 | J38: =RC[-5]-RC[-2] -> 23.15 | K38: 34.74 | L38: 31.58 | M38: 70.39 | R38: 2.1749999999999998 | S38: 8.5359999999999996 | T38: =(RC[-16]*RC[-15]-RC[-13]*RC[-12])/1000 -> 8.5373854999999992 | U38: 30.89 | V38: - | W38: =RC[-2]*RC[-10]/1000 -> 2.1743470999999999 | X38: =ABS((RC[-3]*RC[-11]-RC[-2]*RC[-9])/1000) -> #VALUE! | Y38: =(RC[-14]-RC[1])/RC[-18]*100 -> 1.4622659424968669 | Z38: 30.89 | AC38: =VALUE(RC[-27]) -> 2018-10-17T00:00:00.000 | AD38: =IF(RC[21]=42,"*",IF(RC[21]=32,"",RC[21])) -> - | AE38: =RC[-28] -> 24 | AF38: =RC[-28] -> 298.02999999999997 | AG38: =RC[-28] -> 70.3 | AH38: =RC[-28] -> 7.21 | AI38: =RC[-28] -> 263.29000000000002 | AJ38: =RC[-28] -> 47.15 | AK38: =RC[-28] -> 5.75 | AL38: =RC[-28] -> 23.15 | AM38: =RC[-28] -> 34.74 | AN38: =RC[-28] -> 31.58 | AO38: =RC[-28] -> 70.39 | AP38: - | AQ38: =RC[-29] -> 0 | AR38: =RC[-29] -> 0 | AS38: - | AT38: =RC[-30] -> 0 | AU38: =RC[-30] -> 0 | AV38: =RC[-30] -> 2.1749999999999998 | AW38: =RC[-30] -> 8.5359999999999996 | AY38: - | AZ38: - | BA38: -
A39: =IF(RC[1]="","",DATEVALUE(RC[1])) -> 43391 | B39: 18.10.18 | C39: 24 | D39: 297.2 | E39: 70.75 | F39: 7.25 | G39: 263.32 | H39: 47.24 | I39: 5.79 | J39: 23.509999999999998 | K39: 33.880000000000003 | L39: 31.07 | M39: 70.87 | R39: 2.1549999999999998 | S39: 8.5879999999999992 | T39: 8.5876631999999979 | U39: 30.37 | V39: - | W39: 2.1523219000000005 | X39: #VALUE! | Y39: 1.3329788850068363 | Z39: 30.37 | AC39: =VALUE(RC[-27]) -> 2018-10-18T00:00:00.000 | AD39: =IF(RC[21]=42,"*",IF(RC[21]=32,"",RC[21])) ->  | AE39: =RC[-28] -> 24 | AF39: =RC[-28] -> 297.2 | AG39: =RC[-28] -> 70.75 | AH39: =RC[-28] -> 7.25 | AI39: =RC[-28] -> 263.32 | AJ39: =RC[-28] -> 47.24 | AK39: =RC[-28] -> 5.79 | AL39: =RC[-28] -> 23.509999999999998 | AM39: =RC[-28] -> 33.880000000000003 | AN39: =RC[-28] -> 31.07 | AO39: =RC[-28] -> 70.87 | AP39: - | AQ39: =RC[-29] -> 0 | AR39: =RC[-29] -> 0 | AS39: - | AT39: =RC[-30] -> 0 | AU39: =RC[-30] -> 0 | AV39: =RC[-30] -> 2.1549999999999998 | AW39: =RC[-30] -> 8.5879999999999992
A40: =IF(RC[1]="","",DATEVALUE(RC[1])) -> 43392 | B40: 19.10.18 | C40: 24 | D40: 296.68 | E40: 70.540000000000006 | F40: 7.26 | G40: 263.76 | H40: 46.87 | I40: 5.79 | J40: 23.670000000000009 | K40: 32.92 | L40: 29.8 | M40: 70.52 | R40: 2.0569999999999999 | S40: 8.5649999999999995 | T40: 8.5653760000000041 | U40: 29.16 | V40: - | W40: 2.0563631999999998 | X40: #VALUE! | Y40: 1.4255383682135281 | Z40: 29.16 | AC40: =VALUE(RC[-27]) -> 2018-10-19T00:00:00.000 | AD40: =IF(RC[21]=42,"*",IF(RC[21]=32,"",RC[21])) ->  | AE40: =RC[-28] -> 24 | AF40: =RC[-28] -> 296.68 | AG40: =RC[-28] -> 70.540000000000006 | AH40: =RC[-28] -> 7.26 | AI40: =RC[-28] -> 263.76 | AJ40: =RC[-28] -> 46.87 | AK40: =RC[-28] -> 5.79 | AL40: =RC[-28] -> 23.670000000000009 | AM40: =RC[-28] -> 32.92 | AN40: =RC[-28] -> 29.8 | AO40: =RC[-28] -> 70.52 | AP40: - | AQ40: =RC[-29] -> 0 | AR40: =RC[-29] -> 0 | AS40: - | AT40: =RC[-30] -> 0 | AU40: =RC[-30] -> 0 | AV40: =RC[-30] -> 2.0569999999999999 | AW40: =RC[-30] -> 8.5649999999999995
A41: =IF(RC[1]="","",DATEVALUE(RC[1])) -> 43393 | B41: 20.10.18 | C41: 24 | D41: 286.49 | E41: 69.739999999999995 | F41: 7.13 | G41: 250.05 | H41: 45.36 | I41: 5.83 | J41: 24.379999999999995 | K41: 36.44 | L41: 33.369999999999997 | M41: 69.819999999999993 | R41: 2.2810000000000001 | S41: 8.6349999999999998 | T41: 8.6375445999999982 | U41: 32.630000000000003 | V41: - | W41: 2.2782266 | X41: #VALUE! | Y41: 1.5236952609478085 | Z41: 32.630000000000003 | AC41: =VALUE(RC[-27]) -> 2018-10-20T00:00:00.000 | AD41: =IF(RC[21]=42,"*",IF(RC[21]=32,"",RC[21])) ->  | AE41: =RC[-28] -> 24 | AF41: =RC[-28] -> 286.49 | AG41: =RC[-28] -> 69.739999999999995 | AH41: =RC[-28] -> 7.13 | AI41: =RC[-28] -> 250.05 | AJ41: =RC[-28] -> 45.36 | AK41: =RC[-28] -> 5.83 | AL41: =RC[-28] -> 24.379999999999995 | AM41: =RC[-28] -> 36.44 | AN41: =RC[-28] -> 33.369999999999997 | AO41: =RC[-28] -> 69.819999999999993 | AP41: - | AQ41: =RC[-29] -> 0 | AR41: =RC[-29] -> 0 | AS41: - | AT41: =RC[-30] -> 0 | AU41: =RC[-30] -> 0 | AV41: =RC[-30] -> 2.2810000000000001 | AW41: =RC[-30] -> 8.6349999999999998
A42: =IF(RC[1]="","",DATEVALUE(RC[1])) -> 43394 | B42: 21.10.18 | C42: 24 | D42: 288.58 | E42: 68.91 | F42: 7.14 | G42: 248.25 | H42: 44.8 | I42: 5.84 | J42: 24.11 | K42: 40.33 | L42: 37.630000000000003 | M42: 68.92 | R42: 2.5419999999999998 | S42: 8.7669999999999995 | T42: 8.7644477999999975 | U42: 36.85 | V42: - | W42: 2.5397020000000001 | X42: #VALUE! | Y42: 1.401812688821751 | Z42: 36.85 | AC42: =VALUE(RC[-27]) -> 2018-10-21T00:00:00.000 | AD42: =IF(RC[21]=42,"*",IF(RC[21]=32,"",RC[21])) ->  | AE42: =RC[-28] -> 24 | AF42: =RC[-28] -> 288.58 | AG42: =RC[-28] -> 68.91 | AH42: =RC[-28] -> 7.14 | AI42: =RC[-28] -> 248.25 | AJ42: =RC[-28] -> 44.8 | AK42: =RC[-28] -> 5.84 | AL42: =RC[-28] -> 24.11 | AM42: =RC[-28] -> 40.33 | AN42: =RC[-28] -> 37.630000000000003 | AO42: =RC[-28] -> 68.92 | AP42: - | AQ42: =RC[-29] -> 0 | AR42: =RC[-29] -> 0 | AS42: - | AT42: =RC[-30] -> 0 | AU42: =RC[-30] -> 0 | AV42: =RC[-30] -> 2.5419999999999998 | AW42: =RC[-30] -> 8.7669999999999995
A43: =IF(RC[1]="","",DATEVALUE(RC[1])) -> 43395 | B43: 22.10.18 | C43: 24 | D43: 282.16000000000003 | E43: 69.39 | F43: 7.15 | G43: 246.72 | H43: 44.82 | I43: 5.88 | J43: 24.57 | K43: 35.44 | L43: 32.36 | M43: 69.62 | R43: 2.2040000000000002 | S43: 8.5239999999999991 | T43: 8.521092000000003 | U43: 31.66 | V43: - | W43: 2.2041692000000004 | X43: #VALUE! | Y43: 1.5321011673151741 | Z43: 31.66 | AC43: =VALUE(RC[-27]) -> 2018-10-22T00:00:00.000 | AD43: =IF(RC[21]=42,"*",IF(RC[21]=32,"",RC[21])) ->  | AE43: =RC[-28] -> 24 | AF43: =RC[-28] -> 282.16000000000003 | AG43: =RC[-28] -> 69.39 | AH43: =RC[-28] -> 7.15 | AI43: =RC[-28] -> 246.72 | AJ43: =RC[-28] -> 44.82 | AK43: =RC[-28] -> 5.88 | AL43: =RC[-28] -> 24.57 | AM43: =RC[-28] -> 35.44 | AN43: =RC[-28] -> 32.36 | AO43: =RC[-28] -> 69.62 | AP43: - | AQ43: =RC[-29] -> 0 | AR43: =RC[-29] -> 0 | AS43: - | AT43: =RC[-30] -> 0 | AU43: =RC[-30] -> 0 | AV43: =RC[-30] -> 2.2040000000000002 | AW43: =RC[-30] -> 8.5239999999999991
A44: =IF(RC[1]="","",DATEVALUE(RC[1])) ->  | C44: 24 | J44: =RC[-5]-RC[-2] -> #VALUE! | T44: =(RC[-16]*RC[-15]-RC[-13]*RC[-12])/1000 -> #VALUE! | W44: =RC[-2]*RC[-10]/1000 -> #VALUE! | X44: =ABS((RC[-3]*RC[-11]-RC[-2]*RC[-9])/1000) -> #VALUE! | Y44: =(RC[-14]-RC[1])/RC[-18]*100 -> #VALUE! | AC44: =VALUE(RC[-27]) -> #VALUE! | AD44: =IF(RC[21]=42,"*",IF(RC[21]=32,"",RC[21])) ->  | AE44: =RC[-28] -> 24 | AF44: =RC[-28] ->  | AG44: =RC[-28] ->  | AH44: =RC[-28] ->  | AI44: =RC[-28] ->  | AJ44: =RC[-28] ->  | AK44: =RC[-28] ->  | AL44: =RC[-28] -> #VALUE! | AM44: =RC[-28] ->  | AN44: =RC[-28] ->  | AO44: =RC[-28] ->  | AP44: - | AQ44: =RC[-29] -> 0 | AR44: =RC[-29] -> 0 | AS44: - | AT44: =RC[-30] -> 0 | AU44: =RC[-30] -> 0 | AV44: =RC[-30] ->  | AW44: =RC[-30] -> 
A45: =IF(RC[1]="","",DATEVALUE(RC[1])) ->  | C45: 24 | T45: =(RC[-16]*RC[-15]-RC[-13]*RC[-12])/1000 -> #VALUE! | W45: =RC[-2]*RC[-10]/1000 -> #VALUE! | X45: =ABS((RC[-3]*RC[-11]-RC[-2]*RC[-9])/1000) -> #VALUE! | Y45: =(RC[-14]-RC[1])/RC[-18]*100 -> #VALUE! | AC45: =VALUE(RC[-27]) -> #VALUE! | AD45: =IF(RC[21]=42,"*",IF(RC[21]=32,"",RC[21])) ->  | AE45: =RC[-28] -> 24 | AF45: =RC[-28] ->  | AG45: =RC[-28] ->  | AH45: =RC[-28] ->  | AI45: =RC[-28] ->  | AJ45: =RC[-28] ->  | AK45: =RC[-28] ->  | AL45: =RC[-28] -> 0 | AM45: =RC[-28] ->  | AN45: =RC[-28] ->  | AO45: =RC[-28] ->  | AP45: - | AQ45: =RC[-29] -> 0 | AR45: =RC[-29] -> 0 | AS45: - | AT45: =RC[-30] -> 0 | AU45: =RC[-30] -> 0 | AV45: =RC[-30] ->  | AW45: =RC[-30] -> 
A46: =IF(RC[1]="","",DATEVALUE(RC[1])) ->  | C46: 24 | T46: =(RC[-16]*RC[-15]-RC[-13]*RC[-12])/1000 -> #VALUE! | W46: =RC[-2]*RC[-10]/1000 -> #VALUE! | X46: =ABS((RC[-3]*RC[-11]-RC[-2]*RC[-9])/1000) -> #VALUE! | Y46: =(RC[-14]-RC[1])/RC[-18]*100 -> #VALUE! | AC46: =VALUE(RC[-27]) -> #VALUE! | AD46: =IF(RC[21]=42,"*",IF(RC[21]=32,"",RC[21])) ->  | AE46: =RC[-28] -> 24 | AF46: =RC[-28] ->  | AG46: =RC[-28] ->  | AH46: =RC[-28] ->  | AI46: =RC[-28] ->  | AJ46: =RC[-28] ->  | AK46: =RC[-28] ->  | AL46: =RC[-28] -> 0 | AM46: =RC[-28] ->  | AN46: =RC[-28] ->  | AO46: =RC[-28] ->  | AP46: - | AQ46: =RC[-29] -> 0 | AR46: =RC[-29] -> 0 | AS46: - | AT46: =RC[-30] -> 0 | AU46: =RC[-30] -> 0 | AV46: =RC[-30] ->  | AW46: =RC[-30] -> 
A47: =IF(RC[1]="","",DATEVALUE(RC[1])) ->  | C47: 24 | T47: =(RC[-16]*RC[-15]-RC[-13]*RC[-12])/1000 -> #VALUE! | W47: =RC[-2]*RC[-10]/1000 -> #VALUE! | X47: =ABS((RC[-3]*RC[-11]-RC[-2]*RC[-9])/1000) -> #VALUE! | Y47: =(RC[-14]-RC[1])/RC[-18]*100 -> #VALUE! | AC47: =VALUE(RC[-27]) -> #VALUE! | AD47: =IF(RC[21]=42,"*",IF(RC[21]=32,"",RC[21])) ->  | AE47: =RC[-28] -> 24 | AF47: =RC[-28] ->  | AG47: =RC[-28] ->  | AH47: =RC[-28] ->  | AI47: =RC[-28] ->  | AJ47: =RC[-28] ->  | AK47: =RC[-28] ->  | AL47: =RC[-28] -> 0 | AM47: =RC[-28] ->  | AN47: =RC[-28] ->  | AO47: =RC[-28] ->  | AP47: - | AQ47: =RC[-29] -> 0 | AR47: =RC[-29] -> 0 | AS47: - | AT47: =RC[-30] -> 0 | AU47: =RC[-30] -> 0 | AV47: =RC[-30] ->  | AW47: =RC[-30] -> 
A48: =IF(RC[1]="","",DATEVALUE(RC[1])) ->  | C48: 24 | T48: =(RC[-16]*RC[-15]-RC[-13]*RC[-12])/1000 -> #VALUE! | W48: =RC[-2]*RC[-10]/1000 -> #VALUE! | X48: =ABS((RC[-3]*RC[-11]-RC[-2]*RC[-9])/1000) -> #VALUE! | Y48: =(RC[-14]-RC[1])/RC[-18]*100 -> #VALUE! | AC48: =VALUE(RC[-27]) -> #VALUE! | AD48: =IF(RC[21]=42,"*",IF(RC[21]=32,"",RC[21])) ->  | AE48: =RC[-28] -> 24 | AF48: =RC[-28] ->  | AG48: =RC[-28] ->  | AH48: =RC[-28] ->  | AI48: =RC[-28] ->  | AJ48: =RC[-28] ->  | AK48: =RC[-28] ->  | AL48: =RC[-28] -> 0 | AM48: =RC[-28] ->  | AN48: =RC[-28] ->  | AO48: =RC[-28] ->  | AP48: - | AQ48: =RC[-29] -> 0 | AR48: =RC[-29] -> 0 | AS48: - | AT48: =RC[-30] -> 0 | AU48: =RC[-30] -> 0 | AV48: =RC[-30] ->  | AW48: =RC[-30] -> 
A49: =IF(RC[1]="","",DATEVALUE(RC[1])) ->  | C49: 24 | T49: =(RC[-16]*RC[-15]-RC[-13]*RC[-12])/1000 -> #VALUE! | W49: =RC[-2]*RC[-10]/1000 -> #VALUE! | X49: =ABS((RC[-3]*RC[-11]-RC[-2]*RC[-9])/1000) -> #VALUE! | Y49: =(RC[-14]-RC[1])/RC[-18]*100 -> #VALUE! | AC49: =VALUE(RC[-27]) -> #VALUE! | AD49: =IF(RC[21]=42,"*",IF(RC[21]=32,"",RC[21])) ->  | AE49: =RC[-28] -> 24 | AF49: =RC[-28] ->  | AG49: =RC[-28] ->  | AH49: =RC[-28] ->  | AI49: =RC[-28] ->  | AJ49: =RC[-28] ->  | AK49: =RC[-28] ->  | AL49: =RC[-28] -> 0 | AM49: =RC[-28] ->  | AN49: =RC[-28] ->  | AO49: =RC[-28] ->  | AP49: - | AQ49: =RC[-29] -> 0 | AR49: =RC[-29] -> 0 | AS49: - | AT49: =RC[-30] -> 0 | AU49: =RC[-30] -> 0 | AV49: =RC[-30] ->  | AW49: =RC[-30] -> 
A50: =IF(RC[1]="","",DATEVALUE(RC[1])) ->  | T50: =(RC[-16]*RC[-15]-RC[-13]*RC[-12])/1000 -> #VALUE! | W50: =RC[-2]*RC[-10]/1000 -> #VALUE! | X50: =ABS((RC[-3]*RC[-11]-RC[-2]*RC[-9])/1000) -> #VALUE! | Y50: =(RC[-14]-RC[1])/RC[-18]*100 -> #VALUE! | AC50: =VALUE(RC[-27]) -> #VALUE! | AD50: =IF(RC[21]=42,"*",IF(RC[21]=32,"",RC[21])) ->  | AE50: =RC[-28] ->  | AF50: =RC[-28] ->  | AG50: =RC[-28] ->  | AH50: =RC[-28] ->  | AI50: =RC[-28] ->  | AJ50: =RC[-28] ->  | AK50: =RC[-28] ->  | AL50: =RC[-28] -> 0 | AM50: =RC[-28] ->  | AN50: =RC[-28] ->  | AO50: =RC[-28] ->  | AP50: - | AQ50: =RC[-29] -> 0 | AR50: =RC[-29] -> 0 | AS50: - | AT50: =RC[-30] -> 0 | AU50: =RC[-30] -> 0 | AV50: =RC[-30] ->  | AW50: =RC[-30] -> 
A51: =IF(RC[1]="","",DATEVALUE(RC[1])) ->  | T51: =(RC[-16]*RC[-15]-RC[-13]*RC[-12])/1000 -> #VALUE! | W51: =RC[-2]*RC[-10]/1000 -> #VALUE! | X51: =ABS((RC[-3]*RC[-11]-RC[-2]*RC[-9])/1000) -> #VALUE! | Y51: =(RC[-14]-RC[1])/RC[-18]*100 -> #VALUE! | AC51: =VALUE(RC[-27]) -> #VALUE! | AD51: =IF(RC[21]=42,"*",IF(RC[21]=32,"",RC[21])) ->  | AE51: =RC[-28] ->  | AF51: =RC[-28] ->  | AG51: =RC[-28] ->  | AH51: =RC[-28] ->  | AI51: =RC[-28] ->  | AJ51: =RC[-28] ->  | AK51: =RC[-28] ->  | AL51: =RC[-28] -> 0 | AM51: =RC[-28] ->  | AN51: =RC[-28] ->  | AO51: =RC[-28] ->  | AP51: - | AQ51: =RC[-29] -> 0 | AR51: =RC[-29] -> 0 | AS51: - | AT51: =RC[-30] -> 0 | AU51: =RC[-30] -> 0 | AV51: =RC[-30] ->  | AW51: =RC[-30] -> 
A52: =IF(RC[1]="","",DATEVALUE(RC[1])) ->  | T52: =(RC[-16]*RC[-15]-RC[-13]*RC[-12])/1000 -> #VALUE! | W52: =RC[-2]*RC[-10]/1000 -> #VALUE! | X52: =ABS((RC[-3]*RC[-11]-RC[-2]*RC[-9])/1000) -> #VALUE! | Y52: =(RC[-14]-RC[1])/RC[-18]*100 -> #VALUE! | AC52: =VALUE(RC[-27]) -> #VALUE! | AD52: =IF(RC[21]=42,"*",IF(RC[21]=32,"",RC[21])) ->  | AE52: =RC[-28] ->  | AF52: =RC[-28] ->  | AG52: =RC[-28] ->  | AH52: =RC[-28] ->  | AI52: =RC[-28] ->  | AJ52: =RC[-28] ->  | AK52: =RC[-28] ->  | AL52: =RC[-28] -> 0 | AM52: =RC[-28] ->  | AN52: =RC[-28] ->  | AO52: =RC[-28] ->  | AP52: - | AQ52: =RC[-29] -> 0 | AR52: =RC[-29] -> 0 | AS52: - | AT52: =RC[-30] -> 0 | AU52: =RC[-30] -> 0 | AV52: =RC[-30] ->  | AW52: =RC[-30] -> 
A53: =IF(RC[1]="","",DATEVALUE(RC[1])) ->  | T53: =(RC[-16]*RC[-15]-RC[-13]*RC[-12])/1000 -> #VALUE! | W53: =RC[-2]*RC[-10]/1000 -> #VALUE! | X53: =ABS((RC[-3]*RC[-11]-RC[-2]*RC[-9])/1000) -> #VALUE! | Y53: =(RC[-14]-RC[1])/RC[-18]*100 -> #VALUE! | AC53: =VALUE(RC[-27]) -> #VALUE! | AD53: =IF(RC[21]=42,"*",IF(RC[21]=32,"",RC[21])) ->  | AE53: =RC[-28] ->  | AF53: =RC[-28] ->  | AG53: =RC[-28] ->  | AH53: =RC[-28] ->  | AI53: =RC[-28] ->  | AJ53: =RC[-28] ->  | AK53: =RC[-28] ->  | AL53: =RC[-28] -> 0 | AM53: =RC[-28] ->  | AN53: =RC[-28] ->  | AO53: =RC[-28] ->  | AP53: - | AQ53: =RC[-29] -> 0 | AR53: =RC[-29] -> 0 | AS53: - | AT53: =RC[-30] -> 0 | AU53: =RC[-30] -> 0 | AV53: =RC[-30] ->  | AW53: =RC[-30] -> 
A54: =IF(RC[1]="","",DATEVALUE(RC[1])) ->  | T54: =(RC[-16]*RC[-15]-RC[-13]*RC[-12])/1000 -> #VALUE! | W54: =RC[-2]*RC[-10]/1000 -> #VALUE! | X54: =ABS((RC[-3]*RC[-11]-RC[-2]*RC[-9])/1000) -> #VALUE! | Y54: =(RC[-14]-RC[1])/RC[-18]*100 -> #VALUE! | AC54: =VALUE(RC[-27]) -> #VALUE! | AD54: =IF(RC[21]=42,"*",IF(RC[21]=32,"",RC[21])) ->  | AE54: =RC[-28] ->  | AF54: =RC[-28] ->  | AG54: =RC[-28] ->  | AH54: =RC[-28] ->  | AI54: =RC[-28] ->  | AJ54: =RC[-28] ->  | AK54: =RC[-28] ->  | AL54: =RC[-28] -> 0 | AM54: =RC[-28] ->  | AN54: =RC[-28] ->  | AO54: =RC[-28] ->  | AP54: - | AQ54: =RC[-29] -> 0 | AR54: =RC[-29] -> 0 | AS54: - | AT54: =RC[-30] -> 0 | AU54: =RC[-30] -> 0 | AV54: =RC[-30] ->  | AW54: =RC[-30] -> 
A55: =IF(RC[1]="","",DATEVALUE(RC[1])) ->  | T55: =(RC[-16]*RC[-15]-RC[-13]*RC[-12])/1000 -> #VALUE! | W55: =RC[-2]*RC[-10]/1000 -> #VALUE! | X55: =ABS((RC[-3]*RC[-11]-RC[-2]*RC[-9])/1000) -> #VALUE! | Y55: =(RC[-14]-RC[1])/RC[-18]*100 -> #VALUE! | AC55: =VALUE(RC[-27]) -> #VALUE! | AD55: =IF(RC[21]=42,"*",IF(RC[21]=32,"",RC[21])) ->  | AE55: =RC[-28] ->  | AF55: =RC[-28] ->  | AG55: =RC[-28] ->  | AH55: =RC[-28] ->  | AI55: =RC[-28] ->  | AJ55: =RC[-28] ->  | AK55: =RC[-28] ->  | AL55: =RC[-28] -> 0 | AM55: =RC[-28] ->  | AN55: =RC[-28] ->  | AO55: =RC[-28] ->  | AP55: - | AQ55: =RC[-29] -> 0 | AR55: =RC[-29] -> 0 | AS55: - | AT55: =RC[-30] -> 0 | AU55: =RC[-30] -> 0 | AV55: =RC[-30] ->  | AW55: =RC[-30] -> 
A56: =IF(RC[1]="","",DATEVALUE(RC[1])) ->  | T56: =(RC[-16]*RC[-15]-RC[-13]*RC[-12])/1000 -> #VALUE! | W56: =RC[-2]*RC[-10]/1000 -> #VALUE! | X56: =ABS((RC[-3]*RC[-11]-RC[-2]*RC[-9])/1000) -> #VALUE! | Y56: =(RC[-14]-RC[1])/RC[-18]*100 -> #VALUE! | AC56: =VALUE(RC[-27]) -> #VALUE! | AD56: =IF(RC[21]=42,"*",IF(RC[21]=32,"",RC[21])) ->  | AE56: =RC[-28] ->  | AF56: =RC[-28] ->  | AG56: =RC[-28] ->  | AH56: =RC[-28] ->  | AI56: =RC[-28] ->  | AJ56: =RC[-28] ->  | AK56: =RC[-28] ->  | AL56: =RC[-28] -> 0 | AM56: =RC[-28] ->  | AN56: =RC[-28] ->  | AO56: =RC[-28] ->  | AP56: - | AQ56: =RC[-29] -> 0 | AR56: =RC[-29] -> 0 | AS56: - | AT56: =RC[-30] -> 0 | AU56: =RC[-30] -> 0 | AV56: =RC[-30] ->  | AW56: =RC[-30] -> 
A57: =IF(RC[1]="","",DATEVALUE(RC[1])) ->  | T57: =(RC[-16]*RC[-15]-RC[-13]*RC[-12])/1000 -> #VALUE! | W57: =RC[-2]*RC[-10]/1000 -> #VALUE! | X57: =ABS((RC[-3]*RC[-11]-RC[-2]*RC[-9])/1000) -> #VALUE! | Y57: =(RC[-14]-RC[1])/RC[-18]*100 -> #VALUE! | AC57: =VALUE(RC[-27]) -> #VALUE! | AD57: =IF(RC[21]=42,"*",IF(RC[21]=32,"",RC[21])) ->  | AE57: =RC[-28] ->  | AF57: =RC[-28] ->  | AG57: =RC[-28] ->  | AH57: =RC[-28] ->  | AI57: =RC[-28] ->  | AJ57: =RC[-28] ->  | AK57: =RC[-28] ->  | AL57: =RC[-28] -> 0 | AM57: =RC[-28] ->  | AN57: =RC[-28] ->  | AO57: =RC[-28] ->  | AP57: - | AQ57: =RC[-29] -> 0 | AR57: =RC[-29] -> 0 | AS57: - | AT57: =RC[-30] -> 0 | AU57: =RC[-30] -> 0 | AV57: =RC[-30] ->  | AW57: =RC[-30] -> 
A58: =IF(RC[1]="","",DATEVALUE(RC[1])) ->  | T58: =(RC[-16]*RC[-15]-RC[-13]*RC[-12])/1000 -> #VALUE! | W58: =RC[-2]*RC[-10]/1000 -> #VALUE! | X58: =ABS((RC[-3]*RC[-11]-RC[-2]*RC[-9])/1000) -> #VALUE! | Y58: =(RC[-14]-RC[1])/RC[-18]*100 -> #VALUE! | AC58: =VALUE(RC[-27]) -> #VALUE! | AD58: =IF(RC[21]=42,"*",IF(RC[21]=32,"",RC[21])) ->  | AE58: =RC[-28] ->  | AF58: =RC[-28] ->  | AG58: =RC[-28] ->  | AH58: =RC[-28] ->  | AI58: =RC[-28] ->  | AJ58: =RC[-28] ->  | AK58: =RC[-28] ->  | AL58: =RC[-28] -> 0 | AM58: =RC[-28] ->  | AN58: =RC[-28] ->  | AO58: =RC[-28] ->  | AP58: - | AQ58: =RC[-29] -> 0 | AR58: =RC[-29] -> 0 | AS58: - | AT58: =RC[-30] -> 0 | AU58: =RC[-30] -> 0 | AV58: =RC[-30] ->  | AW58: =RC[-30] -> 
A59: =IF(RC[1]="","",DATEVALUE(RC[1])) ->  | T59: =(RC[-16]*RC[-15]-RC[-13]*RC[-12])/1000 -> #VALUE! | W59: =RC[-2]*RC[-10]/1000 -> #VALUE! | X59: =ABS((RC[-3]*RC[-11]-RC[-2]*RC[-9])/1000) -> #VALUE! | Y59: =(RC[-14]-RC[1])/RC[-18]*100 -> #VALUE! | AC59: =VALUE(RC[-27]) -> #VALUE! | AD59: =IF(RC[21]=42,"*",IF(RC[21]=32,"",RC[21])) ->  | AE59: =RC[-28] ->  | AF59: =RC[-28] ->  | AG59: =RC[-28] ->  | AH59: =RC[-28] ->  | AI59: =RC[-28] ->  | AJ59: =RC[-28] ->  | AK59: =RC[-28] ->  | AL59: =RC[-28] -> 0 | AM59: =RC[-28] ->  | AN59: =RC[-28] ->  | AO59: =RC[-28] ->  | AP59: - | AQ59: =RC[-29] -> 0 | AR59: =RC[-29] -> 0 | AS59: - | AT59: =RC[-30] -> 0 | AU59: =RC[-30] -> 0 | AV59: =RC[-30] ->  | AW59: =RC[-30] -> 
A60: =IF(RC[1]="","",DATEVALUE(RC[1])) ->  | T60: =(RC[-16]*RC[-15]-RC[-13]*RC[-12])/1000 -> #VALUE! | W60: =RC[-2]*RC[-10]/1000 -> #VALUE! | X60: =ABS((RC[-3]*RC[-11]-RC[-2]*RC[-9])/1000) -> #VALUE! | Y60: =(RC[-14]-RC[1])/RC[-18]*100 -> #VALUE! | AC60: =VALUE(RC[-27]) -> #VALUE! | AD60: =IF(RC[21]=42,"*",IF(RC[21]=32,"",RC[21])) ->  | AE60: =RC[-28] ->  | AF60: =RC[-28] ->  | AG60: =RC[-28] ->  | AH60: =RC[-28] ->  | AI60: =RC[-28] ->  | AJ60: =RC[-28] ->  | AK60: =RC[-28] ->  | AL60: =RC[-28] -> 0 | AM60: =RC[-28] ->  | AN60: =RC[-28] ->  | AO60: =RC[-28] ->  | AP60: - | AQ60: =RC[-29] -> 0 | AR60: =RC[-29] -> 0 | AS60: - | AT60: =RC[-30] -> 0 | AU60: =RC[-30] -> 0 | AV60: =RC[-30] ->  | AW60: =RC[-30] -> 
A61: =IF(RC[1]="","",DATEVALUE(RC[1])) ->  | T61: =(RC[-16]*RC[-15]-RC[-13]*RC[-12])/1000 -> #VALUE! | W61: =RC[-2]*RC[-10]/1000 -> #VALUE! | X61: =ABS((RC[-3]*RC[-11]-RC[-2]*RC[-9])/1000) -> #VALUE! | Y61: =(RC[-14]-RC[1])/RC[-18]*100 -> #VALUE! | AC61: =VALUE(RC[-27]) -> #VALUE! | AD61: =IF(RC[21]=42,"*",IF(RC[21]=32,"",RC[21])) ->  | AE61: =RC[-28] ->  | AF61: =RC[-28] ->  | AG61: =RC[-28] ->  | AH61: =RC[-28] ->  | AI61: =RC[-28] ->  | AJ61: =RC[-28] ->  | AK61: =RC[-28] ->  | AL61: =RC[-28] -> 0 | AM61: =RC[-28] ->  | AN61: =RC[-28] ->  | AO61: =RC[-28] ->  | AP61: - | AQ61: =RC[-29] -> 0 | AR61: =RC[-29] -> 0 | AS61: - | AT61: =RC[-30] -> 0 | AU61: =RC[-30] -> 0 | AV61: =RC[-30] ->  | AW61: =RC[-30] -> 
A62: =IF(RC[1]="","",DATEVALUE(RC[1])) ->  | T62: =(RC[-16]*RC[-15]-RC[-13]*RC[-12])/1000 -> #VALUE! | W62: =RC[-2]*RC[-10]/1000 -> #VALUE! | X62: =ABS((RC[-3]*RC[-11]-RC[-2]*RC[-9])/1000) -> #VALUE! | Y62: =(RC[-14]-RC[1])/RC[-18]*100 -> #VALUE! | AC62: =VALUE(RC[-27]) -> #VALUE! | AD62: =IF(RC[21]=42,"*",IF(RC[21]=32,"",RC[21])) ->  | AE62: =RC[-28] ->  | AF62: =RC[-28] ->  | AG62: =RC[-28] ->  | AH62: =RC[-28] ->  | AI62: =RC[-28] ->  | AJ62: =RC[-28] ->  | AK62: =RC[-28] ->  | AL62: =RC[-28] -> 0 | AM62: =RC[-28] ->  | AN62: =RC[-28] ->  | AO62: =RC[-28] ->  | AP62: - | AQ62: =RC[-29] -> 0 | AR62: =RC[-29] -> 0 | AS62: - | AT62: =RC[-30] -> 0 | AU62: =RC[-30] -> 0 | AV62: =RC[-30] ->  | AW62: =RC[-30] -> 
A63: =IF(RC[1]="","",DATEVALUE(RC[1])) ->  | T63: =(RC[-16]*RC[-15]-RC[-13]*RC[-12])/1000 -> #VALUE! | W63: =RC[-2]*RC[-10]/1000 -> #VALUE! | X63: =ABS((RC[-3]*RC[-11]-RC[-2]*RC[-9])/1000) -> #VALUE! | Y63: =(RC[-14]-RC[1])/RC[-18]*100 -> #VALUE! | AC63: =VALUE(RC[-27]) -> #VALUE! | AD63: =IF(RC[21]=42,"*",IF(RC[21]=32,"",RC[21])) ->  | AE63: =RC[-28] ->  | AF63: =RC[-28] ->  | AG63: =RC[-28] ->  | AH63: =RC[-28] ->  | AI63: =RC[-28] ->  | AJ63: =RC[-28] ->  | AK63: =RC[-28] ->  | AL63: =RC[-28] -> 0 | AM63: =RC[-28] ->  | AN63: =RC[-28] ->  | AO63: =RC[-28] ->  | AP63: - | AQ63: =RC[-29] -> 0 | AR63: =RC[-29] -> 0 | AS63: - | AT63: =RC[-30] -> 0 | AU63: =RC[-30] -> 0 | AV63: =RC[-30] ->  | AW63: =RC[-30] -> 
A64: =IF(RC[1]="","",DATEVALUE(RC[1])) ->  | T64: =(RC[-16]*RC[-15]-RC[-13]*RC[-12])/1000 -> #VALUE! | W64: =RC[-2]*RC[-10]/1000 -> #VALUE! | X64: =ABS((RC[-3]*RC[-11]-RC[-2]*RC[-9])/1000) -> #VALUE! | Y64: =(RC[-14]-RC[1])/RC[-18]*100 -> #VALUE! | AC64: =VALUE(RC[-27]) -> #VALUE! | AD64: =IF(RC[21]=42,"*",IF(RC[21]=32,"",RC[21])) ->  | AE64: =RC[-28] ->  | AF64: =RC[-28] ->  | AG64: =RC[-28] ->  | AH64: =RC[-28] ->  | AI64: =RC[-28] ->  | AJ64: =RC[-28] ->  | AK64: =RC[-28] ->  | AL64: =RC[-28] -> 0 | AM64: =RC[-28] ->  | AN64: =RC[-28] ->  | AO64: =RC[-28] ->  | AP64: - | AQ64: =RC[-29] -> 0 | AR64: =RC[-29] -> 0 | AS64: - | AT64: =RC[-30] -> 0 | AU64: =RC[-30] -> 0 | AV64: =RC[-30] ->  | AW64: =RC[-30] -> 
A65: =IF(RC[1]="","",DATEVALUE(RC[1])) ->  | T65: =(RC[-16]*RC[-15]-RC[-13]*RC[-12])/1000 -> #VALUE! | W65: =RC[-2]*RC[-10]/1000 -> #VALUE! | X65: =ABS((RC[-3]*RC[-11]-RC[-2]*RC[-9])/1000) -> #VALUE! | Y65: =(RC[-14]-RC[1])/RC[-18]*100 -> #VALUE! | AC65: =VALUE(RC[-27]) -> #VALUE! | AD65: =IF(RC[21]=42,"*",IF(RC[21]=32,"",RC[21])) ->  | AE65: =RC[-28] ->  | AF65: =RC[-28] ->  | AG65: =RC[-28] ->  | AH65: =RC[-28] ->  | AI65: =RC[-28] ->  | AJ65: =RC[-28] ->  | AK65: =RC[-28] ->  | AL65: =RC[-28] -> 0 | AM65: =RC[-28] ->  | AN65: =RC[-28] ->  | AO65: =RC[-28] ->  | AP65: - | AQ65: =RC[-29] -> 0 | AR65: =RC[-29] -> 0 | AS65: - | AT65: =RC[-30] -> 0 | AU65: =RC[-30] -> 0 | AV65: =RC[-30] ->  | AW65: =RC[-30] -> 
A66: =IF(RC[1]="","",DATEVALUE(RC[1])) ->  | T66: =(RC[-16]*RC[-15]-RC[-13]*RC[-12])/1000 -> #VALUE! | W66: =RC[-2]*RC[-10]/1000 -> #VALUE! | X66: =ABS((RC[-3]*RC[-11]-RC[-2]*RC[-9])/1000) -> #VALUE! | Y66: =(RC[-14]-RC[1])/RC[-18]*100 -> #VALUE! | AC66: =VALUE(RC[-27]) -> #VALUE! | AD66: =IF(RC[21]=42,"*",IF(RC[21]=32,"",RC[21])) ->  | AE66: =RC[-28] ->  | AF66: =RC[-28] ->  | AG66: =RC[-28] ->  | AH66: =RC[-28] ->  | AI66: =RC[-28] ->  | AJ66: =RC[-28] ->  | AK66: =RC[-28] ->  | AL66: =RC[-28] -> 0 | AM66: =RC[-28] ->  | AN66: =RC[-28] ->  | AO66: =RC[-28] ->  | AP66: - | AQ66: =RC[-29] -> 0 | AR66: =RC[-29] -> 0 | AS66: - | AT66: =RC[-30] -> 0 | AU66: =RC[-30] -> 0 | AV66: =RC[-30] ->  | AW66: =RC[-30] -> 
A67: =IF(RC[1]="","",DATEVALUE(RC[1])) ->  | T67: =(RC[-16]*RC[-15]-RC[-13]*RC[-12])/1000 -> #VALUE! | W67: =RC[-2]*RC[-10]/1000 -> #VALUE! | X67: =ABS((RC[-3]*RC[-11]-RC[-2]*RC[-9])/1000) -> #VALUE! | Y67: =(RC[-14]-RC[1])/RC[-18]*100 -> #VALUE! | AC67: =VALUE(RC[-27]) -> #VALUE! | AD67: =IF(RC[21]=42,"*",IF(RC[21]=32,"",RC[21])) ->  | AE67: =RC[-28] ->  | AF67: =RC[-28] ->  | AG67: =RC[-28] ->  | AH67: =RC[-28] ->  | AI67: =RC[-28] ->  | AJ67: =RC[-28] ->  | AK67: =RC[-28] ->  | AL67: =RC[-28] -> 0 | AM67: =RC[-28] ->  | AN67: =RC[-28] ->  | AO67: =RC[-28] ->  | AP67: - | AQ67: =RC[-29] -> 0 | AR67: =RC[-29] -> 0 | AS67: - | AT67: =RC[-30] -> 0 | AU67: =RC[-30] -> 0 | AV67: =RC[-30] ->  | AW67: =RC[-30] -> 
A68: =IF(RC[1]="","",DATEVALUE(RC[1])) ->  | T68: =(RC[-16]*RC[-15]-RC[-13]*RC[-12])/1000 -> #VALUE! | W68: =RC[-2]*RC[-10]/1000 -> #VALUE! | X68: =ABS((RC[-3]*RC[-11]-RC[-2]*RC[-9])/1000) -> #VALUE! | Y68: =(RC[-14]-RC[1])/RC[-18]*100 -> #VALUE! | AC68: =VALUE(RC[-27]) -> #VALUE! | AD68: =IF(RC[21]=42,"*",IF(RC[21]=32,"",RC[21])) ->  | AE68: =RC[-28] ->  | AF68: =RC[-28] ->  | AG68: =RC[-28] ->  | AH68: =RC[-28] ->  | AI68: =RC[-28] ->  | AJ68: =RC[-28] ->  | AK68: =RC[-28] ->  | AL68: =RC[-28] -> 0 | AM68: =RC[-28] ->  | AN68: =RC[-28] ->  | AO68: =RC[-28] ->  | AP68: - | AQ68: =RC[-29] -> 0 | AR68: =RC[-29] -> 0 | AS68: - | AT68: =RC[-30] -> 0 | AU68: =RC[-30] -> 0 | AV68: =RC[-30] ->  | AW68: =RC[-30] -> 
A69: =IF(RC[1]="","",DATEVALUE(RC[1])) ->  | T69: =(RC[-16]*RC[-15]-RC[-13]*RC[-12])/1000 -> #VALUE! | W69: =RC[-2]*RC[-10]/1000 -> #VALUE! | X69: =ABS((RC[-3]*RC[-11]-RC[-2]*RC[-9])/1000) -> #VALUE! | Y69: =(RC[-14]-RC[1])/RC[-18]*100 -> #VALUE! | AC69: =VALUE(RC[-27]) -> #VALUE! | AD69: =IF(RC[21]=42,"*",IF(RC[21]=32,"",RC[21])) ->  | AE69: =RC[-28] ->  | AF69: =RC[-28] ->  | AG69: =RC[-28] ->  | AH69: =RC[-28] ->  | AI69: =RC[-28] ->  | AJ69: =RC[-28] ->  | AK69: =RC[-28] ->  | AL69: =RC[-28] -> 0 | AM69: =RC[-28] ->  | AN69: =RC[-28] ->  | AO69: =RC[-28] ->  | AP69: - | AQ69: =RC[-29] -> 0 | AR69: =RC[-29] -> 0 | AS69: - | AT69: =RC[-30] -> 0 | AU69: =RC[-30] -> 0 | AV69: =RC[-30] ->  | AW69: =RC[-30] -> 
A70: =IF(RC[1]="","",DATEVALUE(RC[1])) ->  | T70: =(RC[-16]*RC[-15]-RC[-13]*RC[-12])/1000 -> #VALUE! | W70: =RC[-2]*RC[-10]/1000 -> #VALUE! | X70: =ABS((RC[-3]*RC[-11]-RC[-2]*RC[-9])/1000) -> #VALUE! | Y70: =(RC[-14]-RC[1])/RC[-18]*100 -> #VALUE! | AC70: =VALUE(RC[-27]) -> #VALUE! | AD70: =IF(RC[21]=42,"*",IF(RC[21]=32,"",RC[21])) ->  | AE70: =RC[-28] ->  | AF70: =RC[-28] ->  | AG70: =RC[-28] ->  | AH70: =RC[-28] ->  | AI70: =RC[-28] ->  | AJ70: =RC[-28] ->  | AK70: =RC[-28] ->  | AL70: =RC[-28] -> 0 | AM70: =RC[-28] ->  | AN70: =RC[-28] ->  | AO70: =RC[-28] ->  | AP70: - | AQ70: =RC[-29] -> 0 | AR70: =RC[-29] -> 0 | AS70: - | AT70: =RC[-30] -> 0 | AU70: =RC[-30] -> 0 | AV70: =RC[-30] ->  | AW70: =RC[-30] -> 
A71: =IF(RC[1]="","",DATEVALUE(RC[1])) ->  | T71: =(RC[-16]*RC[-15]-RC[-13]*RC[-12])/1000 -> #VALUE! | W71: =RC[-2]*RC[-10]/1000 -> #VALUE! | X71: =ABS((RC[-3]*RC[-11]-RC[-2]*RC[-9])/1000) -> #VALUE! | Y71: =(RC[-14]-RC[1])/RC[-18]*100 -> #VALUE! | AC71: =VALUE(RC[-27]) -> #VALUE! | AD71: =IF(RC[21]=42,"*",IF(RC[21]=32,"",RC[21])) ->  | AE71: =RC[-28] ->  | AF71: =RC[-28] ->  | AG71: =RC[-28] ->  | AH71: =RC[-28] ->  | AI71: =RC[-28] ->  | AJ71: =RC[-28] ->  | AK71: =RC[-28] ->  | AL71: =RC[-28] -> 0 | AM71: =RC[-28] ->  | AN71: =RC[-28] ->  | AO71: =RC[-28] ->  | AP71: - | AQ71: =RC[-29] -> 0 | AR71: =RC[-29] -> 0 | AS71: - | AT71: =RC[-30] -> 0 | AU71: =RC[-30] -> 0 | AV71: =RC[-30] ->  | AW71: =RC[-30] -> 
A72: =IF(RC[1]="","",DATEVALUE(RC[1])) ->  | T72: =(RC[-16]*RC[-15]-RC[-13]*RC[-12])/1000 -> #VALUE! | W72: =RC[-2]*RC[-10]/1000 -> #VALUE! | X72: =ABS((RC[-3]*RC[-11]-RC[-2]*RC[-9])/1000) -> #VALUE! | Y72: =(RC[-14]-RC[1])/RC[-18]*100 -> #VALUE! | AC72: =VALUE(RC[-27]) -> #VALUE! | AD72: =IF(RC[21]=42,"*",IF(RC[21]=32,"",RC[21])) ->  | AE72: =RC[-28] ->  | AF72: =RC[-28] ->  | AG72: =RC[-28] ->  | AH72: =RC[-28] ->  | AI72: =RC[-28] ->  | AJ72: =RC[-28] ->  | AK72: =RC[-28] ->  | AL72: =RC[-28] -> 0 | AM72: =RC[-28] ->  | AN72: =RC[-28] ->  | AO72: =RC[-28] ->  | AP72: - | AQ72: =RC[-29] -> 0 | AR72: =RC[-29] -> 0 | AS72: - | AT72: =RC[-30] -> 0 | AU72: =RC[-30] -> 0 | AV72: =RC[-30] ->  | AW72: =RC[-30] -> 
A73: =IF(RC[1]="","",DATEVALUE(RC[1])) ->  | T73: =(RC[-16]*RC[-15]-RC[-13]*RC[-12])/1000 -> #VALUE! | W73: =RC[-2]*RC[-10]/1000 -> #VALUE! | X73: =ABS((RC[-3]*RC[-11]-RC[-2]*RC[-9])/1000) -> #VALUE! | Y73: =(RC[-14]-RC[1])/RC[-18]*100 -> #VALUE! | AC73: =VALUE(RC[-27]) -> #VALUE! | AD73: =IF(RC[21]=42,"*",IF(RC[21]=32,"",RC[21])) ->  | AE73: =RC[-28] ->  | AF73: =RC[-28] ->  | AG73: =RC[-28] ->  | AH73: =RC[-28] ->  | AI73: =RC[-28] ->  | AJ73: =RC[-28] ->  | AK73: =RC[-28] ->  | AL73: =RC[-28] -> 0 | AM73: =RC[-28] ->  | AN73: =RC[-28] ->  | AO73: =RC[-28] ->  | AP73: - | AQ73: =RC[-29] -> 0 | AR73: =RC[-29] -> 0 | AS73: - | AT73: =RC[-30] -> 0 | AU73: =RC[-30] -> 0 | AV73: =RC[-30] ->  | AW73: =RC[-30] -> 
A74: =IF(RC[1]="","",DATEVALUE(RC[1])) ->  | T74: =(RC[-16]*RC[-15]-RC[-13]*RC[-12])/1000 -> #VALUE! | W74: =RC[-2]*RC[-10]/1000 -> #VALUE! | X74: =ABS((RC[-3]*RC[-11]-RC[-2]*RC[-9])/1000) -> #VALUE! | Y74: =(RC[-14]-RC[1])/RC[-18]*100 -> #VALUE! | AC74: =VALUE(RC[-27]) -> #VALUE! | AD74: =IF(RC[21]=42,"*",IF(RC[21]=32,"",RC[21])) ->  | AE74: =RC[-28] ->  | AF74: =RC[-28] ->  | AG74: =RC[-28] ->  | AH74: =RC[-28] ->  | AI74: =RC[-28] ->  | AJ74: =RC[-28] ->  | AK74: =RC[-28] ->  | AL74: =RC[-28] -> 0 | AM74: =RC[-28] ->  | AN74: =RC[-28] ->  | AO74: =RC[-28] ->  | AP74: - | AQ74: =RC[-29] -> 0 | AR74: =RC[-29] -> 0 | AS74: - | AT74: =RC[-30] -> 0 | AU74: =RC[-30] -> 0 | AV74: =RC[-30] ->  | AW74: =RC[-30] -> 
A75: =IF(RC[1]="","",DATEVALUE(RC[1])) ->  | T75: =(RC[-16]*RC[-15]-RC[-13]*RC[-12])/1000 -> #VALUE! | W75: =RC[-2]*RC[-10]/1000 -> #VALUE! | X75: =ABS((RC[-3]*RC[-11]-RC[-2]*RC[-9])/1000) -> #VALUE! | Y75: =(RC[-14]-RC[1])/RC[-18]*100 -> #VALUE! | AC75: =VALUE(RC[-27]) -> #VALUE! | AD75: =IF(RC[21]=42,"*",IF(RC[21]=32,"",RC[21])) ->  | AE75: =RC[-28] ->  | AF75: =RC[-28] ->  | AG75: =RC[-28] ->  | AH75: =RC[-28] ->  | AI75: =RC[-28] ->  | AJ75: =RC[-28] ->  | AK75: =RC[-28] ->  | AL75: =RC[-28] -> 0 | AM75: =RC[-28] ->  | AN75: =RC[-28] ->  | AO75: =RC[-28] ->  | AP75: - | AQ75: =RC[-29] -> 0 | AR75: =RC[-29] -> 0 | AS75: - | AT75: =RC[-30] -> 0 | AU75: =RC[-30] -> 0 | AV75: =RC[-30] ->  | AW75: =RC[-30] -> 
A76: =IF(RC[1]="","",DATEVALUE(RC[1])) ->  | T76: =(RC[-16]*RC[-15]-RC[-13]*RC[-12])/1000 -> #VALUE! | W76: =RC[-2]*RC[-10]/1000 -> #VALUE! | X76: =ABS((RC[-3]*RC[-11]-RC[-2]*RC[-9])/1000) -> #VALUE! | Y76: =(RC[-14]-RC[1])/RC[-18]*100 -> #VALUE! | AC76: =VALUE(RC[-27]) -> #VALUE! | AD76: =IF(RC[21]=42,"*",IF(RC[21]=32,"",RC[21])) ->  | AE76: =RC[-28] ->  | AF76: =RC[-28] ->  | AG76: =RC[-28] ->  | AH76: =RC[-28] ->  | AI76: =RC[-28] ->  | AJ76: =RC[-28] ->  | AK76: =RC[-28] ->  | AL76: =RC[-28] -> 0 | AM76: =RC[-28] ->  | AN76: =RC[-28] ->  | AO76: =RC[-28] ->  | AP76: - | AQ76: =RC[-29] -> 0 | AR76: =RC[-29] -> 0 | AS76: - | AT76: =RC[-30] -> 0 | AU76: =RC[-30] -> 0 | AV76: =RC[-30] ->  | AW76: =RC[-30] -> 
A77: =IF(RC[1]="","",DATEVALUE(RC[1])) ->  | T77: =(RC[-16]*RC[-15]-RC[-13]*RC[-12])/1000 -> #VALUE! | W77: =RC[-2]*RC[-10]/1000 -> #VALUE! | X77: =ABS((RC[-3]*RC[-11]-RC[-2]*RC[-9])/1000) -> #VALUE! | Y77: =(RC[-14]-RC[1])/RC[-18]*100 -> #VALUE! | AC77: =VALUE(RC[-27]) -> #VALUE! | AD77: =IF(RC[21]=42,"*",IF(RC[21]=32,"",RC[21])) ->  | AE77: =RC[-28] ->  | AF77: =RC[-28] ->  | AG77: =RC[-28] ->  | AH77: =RC[-28] ->  | AI77: =RC[-28] ->  | AJ77: =RC[-28] ->  | AK77: =RC[-28] ->  | AL77: =RC[-28] -> 0 | AM77: =RC[-28] ->  | AN77: =RC[-28] ->  | AO77: =RC[-28] ->  | AP77: - | AQ77: =RC[-29] -> 0 | AR77: =RC[-29] -> 0 | AS77: - | AT77: =RC[-30] -> 0 | AU77: =RC[-30] -> 0 | AV77: =RC[-30] ->  | AW77: =RC[-30] -> 
A78: =IF(RC[1]="","",DATEVALUE(RC[1])) ->  | T78: =(RC[-16]*RC[-15]-RC[-13]*RC[-12])/1000 -> #VALUE! | W78: =RC[-2]*RC[-10]/1000 -> #VALUE! | X78: =ABS((RC[-3]*RC[-11]-RC[-2]*RC[-9])/1000) -> #VALUE! | Y78: =(RC[-14]-RC[1])/RC[-18]*100 -> #VALUE! | AC78: =VALUE(RC[-27]) -> #VALUE! | AD78: =IF(RC[21]=42,"*",IF(RC[21]=32,"",RC[21])) ->  | AE78: =RC[-28] ->  | AF78: =RC[-28] ->  | AG78: =RC[-28] ->  | AH78: =RC[-28] ->  | AI78: =RC[-28] ->  | AJ78: =RC[-28] ->  | AK78: =RC[-28] ->  | AL78: =RC[-28] -> 0 | AM78: =RC[-28] ->  | AN78: =RC[-28] ->  | AO78: =RC[-28] ->  | AP78: - | AQ78: =RC[-29] -> 0 | AR78: =RC[-29] -> 0 | AS78: - | AT78: =RC[-30] -> 0 | AU78: =RC[-30] -> 0 | AV78: =RC[-30] ->  | AW78: =RC[-30] -> 
A79: =IF(RC[1]="","",DATEVALUE(RC[1])) ->  | T79: =(RC[-16]*RC[-15]-RC[-13]*RC[-12])/1000 -> #VALUE! | W79: =RC[-2]*RC[-10]/1000 -> #VALUE! | X79: =ABS((RC[-3]*RC[-11]-RC[-2]*RC[-9])/1000) -> #VALUE! | Y79: =(RC[-14]-RC[1])/RC[-18]*100 -> #VALUE! | AC79: =VALUE(RC[-27]) -> #VALUE! | AD79: =IF(RC[21]=42,"*",IF(RC[21]=32,"",RC[21])) ->  | AE79: =RC[-28] ->  | AF79: =RC[-28] ->  | AG79: =RC[-28] ->  | AH79: =RC[-28] ->  | AI79: =RC[-28] ->  | AJ79: =RC[-28] ->  | AK79: =RC[-28] ->  | AL79: =RC[-28] -> 0 | AM79: =RC[-28] ->  | AN79: =RC[-28] ->  | AO79: =RC[-28] ->  | AP79: - | AQ79: =RC[-29] -> 0 | AR79: =RC[-29] -> 0 | AS79: - | AT79: =RC[-30] -> 0 | AU79: =RC[-30] -> 0 | AV79: =RC[-30] ->  | AW79: =RC[-30] -> 
A80: =IF(RC[1]="","",DATEVALUE(RC[1])) ->  | T80: =(RC[-16]*RC[-15]-RC[-13]*RC[-12])/1000 -> #VALUE! | W80: =RC[-2]*RC[-10]/1000 -> #VALUE! | X80: =ABS((RC[-3]*RC[-11]-RC[-2]*RC[-9])/1000) -> #VALUE! | Y80: =(RC[-14]-RC[1])/RC[-18]*100 -> #VALUE! | AC80: =VALUE(RC[-27]) -> #VALUE! | AD80: =IF(RC[21]=42,"*",IF(RC[21]=32,"",RC[21])) ->  | AE80: =RC[-28] ->  | AF80: =RC[-28] ->  | AG80: =RC[-28] ->  | AH80: =RC[-28] ->  | AI80: =RC[-28] ->  | AJ80: =RC[-28] ->  | AK80: =RC[-28] ->  | AL80: =RC[-28] -> 0 | AM80: =RC[-28] ->  | AN80: =RC[-28] ->  | AO80: =RC[-28] ->  | AP80: - | AQ80: =RC[-29] -> 0 | AR80: =RC[-29] -> 0 | AS80: - | AT80: =RC[-30] -> 0 | AU80: =RC[-30] -> 0 | AV80: =RC[-30] ->  | AW80: =RC[-30] -> 
A81: =IF(RC[1]="","",DATEVALUE(RC[1])) ->  | T81: =(RC[-16]*RC[-15]-RC[-13]*RC[-12])/1000 -> #VALUE! | W81: =RC[-2]*RC[-10]/1000 -> #VALUE! | X81: =ABS((RC[-3]*RC[-11]-RC[-2]*RC[-9])/1000) -> #VALUE! | Y81: =(RC[-14]-RC[1])/RC[-18]*100 -> #VALUE! | AC81: =VALUE(RC[-27]) -> #VALUE! | AD81: =IF(RC[21]=42,"*",IF(RC[21]=32,"",RC[21])) ->  | AE81: =RC[-28] ->  | AF81: =RC[-28] ->  | AG81: =RC[-28] ->  | AH81: =RC[-28] ->  | AI81: =RC[-28] ->  | AJ81: =RC[-28] ->  | AK81: =RC[-28] ->  | AL81: =RC[-28] -> 0 | AM81: =RC[-28] ->  | AN81: =RC[-28] ->  | AO81: =RC[-28] ->  | AP81: - | AQ81: =RC[-29] -> 0 | AR81: =RC[-29] -> 0 | AS81: - | AT81: =RC[-30] -> 0 | AU81: =RC[-30] -> 0 | AV81: =RC[-30] ->  | AW81: =RC[-30] -> 
A82: =IF(RC[1]="","",DATEVALUE(RC[1])) ->  | T82: =(RC[-16]*RC[-15]-RC[-13]*RC[-12])/1000 -> #VALUE! | W82: =RC[-2]*RC[-10]/1000 -> #VALUE! | X82: =ABS((RC[-3]*RC[-11]-RC[-2]*RC[-9])/1000) -> #VALUE! | Y82: =(RC[-14]-RC[1])/RC[-18]*100 -> #VALUE! | AC82: =VALUE(RC[-27]) -> #VALUE! | AD82: =IF(RC[21]=42,"*",IF(RC[21]=32,"",RC[21])) ->  | AE82: =RC[-28] ->  | AF82: =RC[-28] ->  | AG82: =RC[-28] ->  | AH82: =RC[-28] ->  | AI82: =RC[-28] ->  | AJ82: =RC[-28] ->  | AK82: =RC[-28] ->  | AL82: =RC[-28] -> 0 | AM82: =RC[-28] ->  | AN82: =RC[-28] ->  | AO82: =RC[-28] ->  | AP82: - | AQ82: =RC[-29] -> 0 | AR82: =RC[-29] -> 0 | AS82: - | AT82: =RC[-30] -> 0 | AU82: =RC[-30] -> 0 | AV82: =RC[-30] ->  | AW82: =RC[-30] -> 
A83: =IF(RC[1]="","",DATEVALUE(RC[1])) ->  | T83: =(RC[-16]*RC[-15]-RC[-13]*RC[-12])/1000 -> #VALUE! | W83: =RC[-2]*RC[-10]/1000 -> #VALUE! | X83: =ABS((RC[-3]*RC[-11]-RC[-2]*RC[-9])/1000) -> #VALUE! | Y83: =(RC[-14]-RC[1])/RC[-18]*100 -> #VALUE! | AC83: =VALUE(RC[-27]) -> #VALUE! | AD83: =IF(RC[21]=42,"*",IF(RC[21]=32,"",RC[21])) ->  | AE83: =RC[-28] ->  | AF83: =RC[-28] ->  | AG83: =RC[-28] ->  | AH83: =RC[-28] ->  | AI83: =RC[-28] ->  | AJ83: =RC[-28] ->  | AK83: =RC[-28] ->  | AL83: =RC[-28] -> 0 | AM83: =RC[-28] ->  | AN83: =RC[-28] ->  | AO83: =RC[-28] ->  | AP83: - | AQ83: =RC[-29] -> 0 | AR83: =RC[-29] -> 0 | AS83: - | AT83: =RC[-30] -> 0 | AU83: =RC[-30] -> 0 | AV83: =RC[-30] ->  | AW83: =RC[-30] -> 
AC84: Среднее | AF84: =R[1]C[-28] -> 298.49688888888886 | AG84: =R[1]C[-28] -> 69.154777777777767 | AH84: =R[1]C[-28] -> 7.3872222222222224 | AI84: =R[1]C[-28] -> 262.67288888888896 | AJ84: =R[1]C[-28] -> 49.015000000000001 | AK84: =R[1]C[-28] -> 5.7494444444444435 | AL84: =R[1]C[-28] -> 20.13977777777778 | AM84: =R[1]C[-28] -> 35.824000000000005 | AN84: =R[1]C[-28] -> 33.111666666666672 | AO84: =R[1]C[-28] -> 68.363000000000014 | AP84: - | AQ84: =R[1]C[-29] -> 0 | AR84: =R[1]C[-29] -> 0 | AS84: - | AT84: =R[1]C[-30] -> 0 | AU84: =R[1]C[-30] -> 0
B85: Среднее | D85: =AVERAGE(OFFSET(R[-74]C,3,0,R7C1,1)) -> 298.49688888888886 | E85: =AVERAGE(OFFSET(R[-74]C,3,0,R7C1,1)) -> 69.154777777777767 | F85: =AVERAGE(OFFSET(R[-74]C,3,0,R7C1,1)) -> 7.3872222222222224 | G85: =AVERAGE(OFFSET(R[-74]C,3,0,R7C1,1)) -> 262.67288888888896 | H85: =AVERAGE(OFFSET(R[-74]C,3,0,R7C1,1)) -> 49.015000000000001 | I85: =AVERAGE(OFFSET(R[-74]C,3,0,R7C1,1)) -> 5.7494444444444435 | J85: =AVERAGE(OFFSET(R[-74]C,3,0,R7C1,1)) -> 20.13977777777778 | K85: =AVERAGE(OFFSET(R[-74]C,3,0,R7C1,1)) -> 35.824000000000005 | L85: =IF(SUM(OFFSET(R[-74]C,3,0,R7C1,1))=0,"",AVERAGE(OFFSET(R[-74]C,3,0,R7C1,1))) -> 33.111666666666672 | M85: =IF(SUM(OFFSET(R[-74]C,3,0,R7C1,1))=0,"",AVERAGE(OFFSET(R[-74]C,3,0,R7C1,1))) -> 68.363000000000014 | R85: =IF(SUM(OFFSET(R[-74]C,3,0,R7C1,1))=0,"",AVERAGE(OFFSET(R[-74]C,3,0,R7C1,1))) -> 2.2159666666666666 | S85: =AVERAGE(OFFSET(R[-74]C,3,0,R7C1,1)) -> 7.6092354459259273 | T85: =AVERAGE(OFFSET(R[-74]C,3,0,R7C1,1)) -> 7.656352739259261 | W85: =AVERAGE(OFFSET(R[-74]C,3,0,R7C1,1)) -> 2.2148083033333332 | X85: =AVERAGE(OFFSET(R[-74]C,3,0,R7C1,1)) -> #VALUE! | AC85: Итого | AE85: =R[1]C[-28] -> 720 | AF85: =R[1]C[-28] -> 8954.9066666666658 | AI85: =R[1]C[-28] -> 7880.1866666666683 | AM85: =R[1]C[-28] -> 1074.7200000000003 | AN85: =R[1]C[-28] -> 993.35000000000014 | AQ85: =R[1]C[-29] -> 0 | AU85: =R[1]C[-30] -> 0 | AV85: =R[1]C[-30] -> 66.478999999999999 | AW85: =R[1]C[-30] -> 228.27706337777781
B86: ИТОГО: | C86: =SUM(OFFSET(R[-75]C,3,0,R7C1,1)) -> 720 | D86: =SUM(OFFSET(R[-75]C,3,0,R7C1,1)) -> 8954.9066666666658 | G86: =SUM(OFFSET(R[-75]C,3,0,R7C1,1)) -> 7880.1866666666683 | K86: =SUM(OFFSET(R[-75]C,3,0,R7C1,1)) -> 1074.7200000000003 | L86: =IF(SUM(OFFSET(R[-75]C,3,0,R7C1,1))=0,"",SUM(OFFSET(R[-75]C,3,0,R7C1,1))) -> 993.35000000000014 | R86: =IF(SUM(OFFSET(R[-75]C,3,0,R7C1,1))=0,"",SUM(OFFSET(R[-75]C,3,0,R7C1,1))) -> 66.478999999999999 | S86: =SUM(OFFSET(R[-75]C,3,0,R7C1,1)) -> 228.27706337777781 | T86: =SUM(OFFSET(R[-75]C,3,0,R7C1,1)) -> 229.69058217777783 | W86: =SUM(OFFSET(R[-75]C,3,0,R7C1,1)) -> 66.444249099999993 | X86: =SUM(OFFSET(R[-75]C,3,0,R7C1,1)) -> #VALUE!
AC87: Досчёт | AF87: =R[1]C[-28] -> 0 | AI87: =R[1]C[-28] -> 0 | AM87: =R[1]C[-28] -> 0 | AN87: =R[1]C[-28] -> 0 | AQ87: =R[1]C[-29] -> 0 | AU87: =R[1]C[-30] -> 0 | AV87: =R[1]C[-30] -> 0 | AW87: =R[1]C[-30] -> 0
A88: 11дн=264ч 4дн=96ч | B88: Досчёт до конца м-ца (+) | C88: =R6C1*24 -> 216 | T88: № 108343 | AC88: Снятие | AF88: =-R[1]C[-28] -> 0 | AI88: =-R[1]C[-28] -> 0 | AM88: =-R[1]C[-28] -> 0 | AN88: =-R[1]C[-28] -> 0 | AQ88: =-R[1]C[-29] -> 0 | AU88: =-R[1]C[-30] -> 0 | AV88: =-R[1]C[-30] -> 0 | AW88: =-R[1]C[-30] -> 0
A89: 9дн=216ч 7дн=168ч | B89: Вычет с предыдущего (-) | C89: =R4C1*24 -> 192 | AC89: Сумма | AF89: =R[1]C[-28] -> 8954.9066666666658 | AI89: =R[1]C[-28] -> 7880.1866666666683 | AM89: =R[1]C[-28] -> 1074.7200000000003 | AN89: =R[1]C[-28] -> 993.35000000000014 | AQ89: =R[1]C[-29] -> 0 | AU89: =R[1]C[-30] -> 0 | AV89: =R[1]C[-30] -> 66.478999999999999 | AW89: =R[1]C[-30] -> 228.27706337777781
B90: СУММА: | C90: =R[-4]C+R[-2]C-R[-1]C -> 744 | D90: =R[-4]C+R[-2]C-R[-1]C -> 8954.9066666666658 | G90: =R[-4]C+R[-2]C-R[-1]C -> 7880.1866666666683 | K90: =R[-4]C+R[-2]C-R[-1]C -> 1074.7200000000003 | L90: =IF(SUM(OFFSET(R[-79]C,3,0,R7C1,1))=0,"",(R[-4]C+R[-2]C-R[-1]C)) -> 993.35000000000014 | R90: =IF(SUM(OFFSET(R[-79]C,3,0,R7C1,1))=0,"",(R[-4]C+R[-2]C-R[-1]C)) -> 66.478999999999999 | S90: =R[-4]C+R[-2]C-R[-1]C -> 228.27706337777781
AC91: Тхв на источнике | AE91: V гвс (м3) | AF91: =R[-2]C[15] -> 0 | AG91: W гвс (Гкал) | AH91: =RC[-2]*0.06 -> 0 | AI91: W без гвс (Гкал) | AJ91: =R[-2]C[13]-RC[-2] -> 228.27706337777781
B92: Показания счетчиков на момент снятия данных:
B93: Дата, время | D93: М1, т | F93: М2, т | H93: М3, т | J93: М4, т | L93: Qо, Гкал | N93: Qг, Гкал | P93: время, час
B94: 23.09.18 00:00 | D94: 81845.45 | F94: 68642.179999999993 | H94: 19255.919999999998 | J94: - | L94: 2590.5500000000002 | N94: 1331.595 | P94: -
B95: 18.10.18 00:00 | D95: 89170.4 | F95: 74913.820000000007 | H95: 20067.97 | J95: - | L95: 2781.2530000000002 | N95: 1386.835 | P95: -
AC97: =ZAYAVKA_N -> з.н д. №02/147-2783 от 04.10.18 с 05.10.18г по 12.10.18г некорректная работа приборов
B98: Представитель потребителя:_______________________________________________________________________ В.О. Топорков
I101: Рекомендуемые значения по параметрам теплопотребления (не являются официально утверждёнными)
I102: М, т | J102: V, м3 | K102: Qгвс, Гкал | L102: Qотоп, Гкал | M102: Qо, Гкал
I103: =R[-13]C[-3] -> 0 | J103: =RC[-1]/0.98 -> 0 | K103: =RC[-1]*0.06 -> 0 | L103: =RC[1]-RC[-1] -> 66.478999999999999 | M103: =R[-13]C[5] -> 66.478999999999999
O105: ДЛЯ САМОКОНТРОЛЯ
B106: В строке выбора дат указать период с 16.7.13 по 23.8.13 - жильё | N106: Q | O106: Qг
B107: В строке выбора дат указать период с 18.7.13 по 25.8.13 - не жилое | N107: =(R[-21]C[-10]*R[-22]C[-7]-R[-21]C[-9]*R[-22]C[-6])/1000 -> 2352.2112038637042 | O107: =IF(R[-22]C[-2]="",R[-21]C[-3]*R[-22]C/1000,"") ->  | P107: Си2
O108: =IF(R[-23]C[-2]="","",((R[-22]C[-3]*R[-23]C)-(R[-22]C[-2]*R[-23]C[2]))/1000) -> 0 | P108: Си3