Sheet: Лист1
G1: Отчёт о теплопотреблении за октябрь 2018 | M1: з.н д. №02/147-2783 от 04.10.18
A4: =EOMONTH(R[9]C,0)-R[9]C -> 8 | B4: Потребитель: ЗАО "Сити Сервис"
A5: =MAX(R[9]C:R[78]C) -> 2018-10-22T00:00:00.000 | B5: Адрес: г. СПб, Морская наб., д.25 ИТП 2
A6: =EOMONTH(R[-1]C,0)-R[-1]C -> 9 | B6: Телефон: 8-911-021-19-79
A7: =R[-2]C-R[6]C -> 30 | B7: Договор 10023 (.) 365, 87483, 87484
A8: 7 | B8: Тепловычислитель: СПТ-943 № 13671 | L8: М2 мах= | M8: 155.76 | O8: Мгвс мах= | P8: 78.24
L9: Qотоп мах= | M9: 12 | O9: Qгвс мах= | P9: 4.56
B10: Расчётная формула: Q=M1*(h1-hхв)-M2*(h2-hхв)
D12: Учёт - ОТОПЛЕНИЕ | M12: Учёт - ГВС
A13: =R[1]C-1 -> 43365 | B13: Дата | C13: N, ч | D13: M1, т | E13: T1, С | F13: P1, кг/см2 | G13: M2, т | H13: T2, С | I13: P2, кг/см2 | J13: dT, гр.C | K13: M1-М2, т | L13: Qотоп, Гкал | M13: V3, м3 | N13: T3, С | O13: V4, м3 | P13: T4, С | Q13: dT, гр.C | R13: V3-V4, м3 | S13: Qгвс, Гкал | T13: Qобщ. | U13: Qo | V13: M3 | W13: M4 | X13: си4 | Y13: си5 | Z13: ТСО | AA13: Внутр. | AD13: Дата | AE13: НС | AF13: n, ч | AG13: М1, т | AH13: t1, гр. С | AI13: Р1, кгс/см2 | AJ13: М2, т | AK13: t2, гр. С | AL13: Р2, кгс/см2 | AM13: t1-t2, гр. С | AN13: М1-М2, т | AO13: Wотоп, Гкал | AP13: М1гвс, т | AQ13: t1гвс, гр. С | AR13: Р1гвс, кгс/см2 | AS13: М2гвс, т | AT13: t2гвс, гр. С | AU13: Р2гвс, кгс/см2 | AV13: t1гвс-t2гвс | AW13: М1гвс-М2гвс, т | AX13: Wгвс, Гкал | AY13: Wсумм, Гкал | BA13: NS_TV1 | BB13: НС | BC13: NS_TV2
A14: =IF(RC[1]="","",DATEVALUE(RC[1])) -> 43366 | B14: 23.09.18 | C14: 24 | D14: 0 | E14: 25.041525 | F14: 6.53 | G14: 0 | H14: 22.595558 | I14: 4.43 | J14: =RC[-5]-RC[-2] -> 2.4459669999999996 | K14: 0 | L14: =RC[9] -> 0 | M14: 53.381495999999999 | N14: 66.262694999999994 | O14: 38.736499999999999 | P14: 52.257683 | Q14: =RC[-3]-RC[-1] -> 14.005011999999994 | R14: 14.644996000000001 | S14: 1.4700340000000001 | T14: =RC[-8]+RC[-1] -> 1.4700340000000001 | U14: 0 | V14: 52.320301000000001 | W14: 38.241402000000001 | X14: =RC[-2]*RC[-10]/1000 -> 3.4668841474711947 | Y14: =(RC[-3]*RC[-11]-RC[-2]*RC[-9])/1000 -> 1.4684770842796289 | Z14: 2013-11-23T00:00:00.000 | AA14: 2013-11-21T00:00:00.000 | AD14: =VALUE(RC[-28]) -> 2018-09-23T00:00:00.000 | AE14: =IF(RC[22]=42,"*",IF(RC[22]=32,"",RC[22])) -> - | AF14: =RC[-29] -> 24 | AG14: =RC[-29] -> 0 | AH14: =RC[-29] -> 25.041525 | AI14: =RC[-29] -> 6.53 | AJ14: =RC[-29] -> 0 | AK14: =RC[-29] -> 22.595558 | AL14: =RC[-29] -> 4.43 | AM14: =RC[-29] -> 2.4459669999999996 | AN14: =RC[-29] -> 0 | AO14: =RC[-29] -> 0 | AP14: =RC[-29] -> 53.381495999999999 | AQ14: =RC[-29] -> 66.262694999999994 | AR14: - | AS14: =RC[-30] -> 38.736499999999999 | AT14: =RC[-30] -> 52.257683 | AU14: - | AV14: =RC[-31] -> 14.005011999999994 | AW14: =RC[-31] -> 14.644996000000001 | AX14: =RC[-31] -> 1.4700340000000001 | AY14: =RC[-31] -> 1.4700340000000001 | BA14: - | BB14: * | BC14: -
A15: =IF(RC[1]="","",DATEVALUE(RC[1])) -> 43367 | B15: 24.09.18 | C15: 24 | D15: 0 | E15: 24.853162999999999 | F15: 6.53 | G15: 0 | H15: 28.485513999999998 | I15: 4.43 | J15: =RC[-5]-RC[-2] -> -3.6323509999999999 | K15: 0 | L15: 0 | M15: 54.765503000000002 | N15: 65.706337000000005 | O15: 40.702601999999999 | P15: 52.261909000000003 | Q15: =RC[-3]-RC[-1] -> 13.444428000000002 | R15: 14.062901 | S15: 1.4295549999999999 | T15: =RC[-8]+RC[-1] -> 1.4295549999999999 | U15: =(RC[-17]*RC[-16]-RC[-14]*RC[-13])/1000 -> 0 | V15: 53.693531 | W15: 40.182307999999999 | X15: =RC[-2]*RC[-10]/1000 -> 3.5280052426059472 | Y15: =(RC[-3]*RC[-11]-RC[-2]*RC[-9])/1000 -> 1.4280011184999752 | Z15: 2013-11-24T00:00:00.000 | AA15: 2013-11-22T00:00:00.000 | AD15: =VALUE(RC[-28]) -> 2018-09-24T00:00:00.000 | AE15: =IF(RC[22]=42,"*",IF(RC[22]=32,"",RC[22])) -> - | AF15: =RC[-29] -> 24 | AG15: =RC[-29] -> 0 | AH15: =RC[-29] -> 24.853162999999999 | AI15: =RC[-29] -> 6.53 | AJ15: =RC[-29] -> 0 | AK15: =RC[-29] -> 28.485513999999998 | AL15: =RC[-29] -> 4.43 | AM15: =RC[-29] -> -3.6323509999999999 | AN15: =RC[-29] -> 0 | AO15: =RC[-29] -> 0 | AP15: =RC[-29] -> 54.765503000000002 | AQ15: =RC[-29] -> 65.706337000000005 | AR15: - | AS15: =RC[-30] -> 40.702601999999999 | AT15: =RC[-30] -> 52.261909000000003 | AU15: - | AV15: =RC[-31] -> 13.444428000000002 | AW15: =RC[-31] -> 14.062901 | AX15: =RC[-31] -> 1.4295549999999999 | AY15: =RC[-31] -> 1.4295549999999999 | BA15: - | BB15: * | BC15: -
A16: =IF(RC[1]="","",DATEVALUE(RC[1])) -> 43368 | B16: 25.09.18 | C16: 24 | D16: 0 | E16: 24.613019999999999 | F16: 6.53 | G16: 0 | H16: 27.290869000000001 | I16: 4.43 | J16: =RC[-5]-RC[-2] -> -2.6778490000000019 | K16: 0 | L16: 0 | M16: 58.928497 | N16: 64.588081000000003 | O16: 43.402099999999997 | P16: 52.158389999999997 | Q16: =RC[-3]-RC[-1] -> 12.429691000000005 | R16: 15.526396999999999 | S16: 1.5005839999999999 | T16: =RC[-8]+RC[-1] -> 1.5005839999999999 | U16: =(RC[-17]*RC[-16]-RC[-14]*RC[-13])/1000 -> 0 | V16: 57.810886000000004 | W16: 42.849369000000003 | X16: =RC[-2]*RC[-10]/1000 -> 3.7338941876497667 | Y16: =(RC[-3]*RC[-11]-RC[-2]*RC[-9])/1000 -> 1.4989400880938566 | Z16: 2013-11-25T00:00:00.000 | AA16: 2013-11-23T00:00:00.000 | AD16: =VALUE(RC[-28]) -> 2018-09-25T00:00:00.000 | AE16: =IF(RC[22]=42,"*",IF(RC[22]=32,"",RC[22])) -> - | AF16: =RC[-29] -> 24 | AG16: =RC[-29] -> 0 | AH16: =RC[-29] -> 24.613019999999999 | AI16: =RC[-29] -> 6.53 | AJ16: =RC[-29] -> 0 | AK16: =RC[-29] -> 27.290869000000001 | AL16: =RC[-29] -> 4.43 | AM16: =RC[-29] -> -2.6778490000000019 | AN16: =RC[-29] -> 0 | AO16: =RC[-29] -> 0 | AP16: =RC[-29] -> 58.928497 | AQ16: =RC[-29] -> 64.588081000000003 | AR16: - | AS16: =RC[-30] -> 43.402099999999997 | AT16: =RC[-30] -> 52.158389999999997 | AU16: - | AV16: =RC[-31] -> 12.429691000000005 | AW16: =RC[-31] -> 15.526396999999999 | AX16: =RC[-31] -> 1.5005839999999999 | AY16: =RC[-31] -> 1.5005839999999999 | BA16: - | BB16: * | BC16: -
A17: =IF(RC[1]="","",DATEVALUE(RC[1])) -> 43369 | B17: 26.09.18 | C17: 24 | D17: 18.62 | E17: 62.148761999999998 | F17: 6.53 | G17: 18.79 | H17: 59.564273999999997 | I17: 4.43 | J17: =RC[-5]-RC[-2] -> 2.5844880000000003 | K17: -2.3134389999999998 | L17: =RC[9] -> 3.7997239980000132E-2 | M17: 59.542503000000004 | N17: 64.042975999999996 | O17: 44.310295000000004 | P17: 51.781879000000004 | Q17: =RC[-3]-RC[-1] -> 12.261096999999992 | R17: 15.232208 | S17: 1.4780390000000001 | T17: =RC[-8]+RC[-1] -> 1.5160362399800003 | U17: =(RC[-17]*RC[-16]-RC[-14]*RC[-13])/1000 -> 3.7997239980000132E-2 | V17: 58.430695 | W17: 43.753796000000001 | X17: =RC[-2]*RC[-10]/1000 -> 3.74207559754832 | Y17: =(RC[-3]*RC[-11]-RC[-2]*RC[-9])/1000 -> 1.4764218272856355 | Z17: 2013-11-26T00:00:00.000 | AA17: 2013-11-24T00:00:00.000 | AD17: =VALUE(RC[-28]) -> 2018-09-26T00:00:00.000 | AE17: =IF(RC[22]=42,"*",IF(RC[22]=32,"",RC[22])) -> - | AF17: =RC[-29] -> 24 | AG17: =RC[-29] -> 18.62 | AH17: =RC[-29] -> 62.148761999999998 | AI17: =RC[-29] -> 6.53 | AJ17: =RC[-29] -> 18.79 | AK17: =RC[-29] -> 59.564273999999997 | AL17: =RC[-29] -> 4.43 | AM17: =RC[-29] -> 2.5844880000000003 | AN17: =RC[-29] -> -2.3134389999999998 | AO17: =RC[-29] -> 3.7997239980000132E-2 | AP17: =RC[-29] -> 59.542503000000004 | AQ17: =RC[-29] -> 64.042975999999996 | AR17: - | AS17: =RC[-30] -> 44.310295000000004 | AT17: =RC[-30] -> 51.781879000000004 | AU17: - | AV17: =RC[-31] -> 12.261096999999992 | AW17: =RC[-31] -> 15.232208 | AX17: =RC[-31] -> 1.4780390000000001 | AY17: =RC[-31] -> 1.5160362399800003 | BA17: - | BB17: * | BC17: -
A18: =IF(RC[1]="","",DATEVALUE(RC[1])) -> 43370 | B18: 27.09.18 | C18: 24 | D18: 170.999481 | E18: 56.355038 | F18: 6.53 | G18: 173.09828200000001 | H18: 53.542824000000003 | I18: 4.43 | J18: =RC[-5]-RC[-2] -> 2.8122139999999973 | K18: -2.0988009999999799 | L18: =RC[9] -> 0.36851140190690967 | M18: 64.161499000000006 | N18: 60.256293999999997 | O18: 46.903198000000003 | P18: 49.662101999999997 | Q18: =RC[-3]-RC[-1] -> 10.594192 | R18: 17.258300999999999 | S18: 1.5009939999999999 | T18: =RC[-8]+RC[-1] -> 1.8695054019069097 | U18: =(RC[-17]*RC[-16]-RC[-14]*RC[-13])/1000 -> 0.36851140190690967 | V18: 63.091495999999999 | W18: 46.359504999999999 | X18: =RC[-2]*RC[-10]/1000 -> 3.8016597318758234 | Y18: =(RC[-3]*RC[-11]-RC[-2]*RC[-9])/1000 -> 1.4993492658963137 | Z18: 2013-11-27T00:00:00.000 | AA18: 2013-11-25T00:00:00.000 | AD18: =VALUE(RC[-28]) -> 2018-09-27T00:00:00.000 | AE18: =IF(RC[22]=42,"*",IF(RC[22]=32,"",RC[22])) -> - | AF18: =RC[-29] -> 24 | AG18: =RC[-29] -> 170.999481 | AH18: =RC[-29] -> 56.355038 | AI18: =RC[-29] -> 6.53 | AJ18: =RC[-29] -> 173.09828200000001 | AK18: =RC[-29] -> 53.542824000000003 | AL18: =RC[-29] -> 4.43 | AM18: =RC[-29] -> 2.8122139999999973 | AN18: =RC[-29] -> -2.0988009999999799 | AO18: =RC[-29] -> 0.36851140190690967 | AP18: =RC[-29] -> 64.161499000000006 | AQ18: =RC[-29] -> 60.256293999999997 | AR18: - | AS18: =RC[-30] -> 46.903198000000003 | AT18: =RC[-30] -> 49.662101999999997 | AU18: - | AV18: =RC[-31] -> 10.594192 | AW18: =RC[-31] -> 17.258300999999999 | AX18: =RC[-31] -> 1.5009939999999999 | AY18: =RC[-31] -> 1.8695054019069097 | BA18: - | BB18: * | BC18: -
A19: =IF(RC[1]="","",DATEVALUE(RC[1])) -> 43371 | B19: 28.09.18 | C19: 24 | D19: 224.89939899999999 | E19: 49.029671 | F19: 6.53 | G19: 227.967072 | H19: 42.124797999999998 | I19: 4.43 | J19: =RC[-5]-RC[-2] -> 6.904873000000002 | K19: -3.0676730000000099 | L19: =RC[9] -> 1.4236766824162732 | M19: 59.445498999999998 | N19: 62.928702999999999 | O19: 44.039101000000002 | P19: 50.8232 | Q19: =RC[-3]-RC[-1] -> 12.105502999999999 | R19: 15.406397999999999 | S19: 1.463687 | T19: =RC[-8]+RC[-1] -> 2.8873636824162734 | U19: =(RC[-17]*RC[-16]-RC[-14]*RC[-13])/1000 -> 1.4236766824162732 | V19: 58.370888000000001 | W19: 43.50544 | X19: =RC[-2]*RC[-10]/1000 -> 3.6732042747982643 | Y19: =(RC[-3]*RC[-11]-RC[-2]*RC[-9])/1000 -> 1.4621185965902641 | Z19: 2013-11-28T00:00:00.000 | AA19: 2013-11-26T00:00:00.000 | AD19: =VALUE(RC[-28]) -> 2018-09-28T00:00:00.000 | AE19: =IF(RC[22]=42,"*",IF(RC[22]=32,"",RC[22])) -> - | AF19: =RC[-29] -> 24 | AG19: =RC[-29] -> 224.89939899999999 | AH19: =RC[-29] -> 49.029671 | AI19: =RC[-29] -> 6.53 | AJ19: =RC[-29] -> 227.967072 | AK19: =RC[-29] -> 42.124797999999998 | AL19: =RC[-29] -> 4.43 | AM19: =RC[-29] -> 6.904873000000002 | AN19: =RC[-29] -> -3.0676730000000099 | AO19: =RC[-29] -> 1.4236766824162732 | AP19: =RC[-29] -> 59.445498999999998 | AQ19: =RC[-29] -> 62.928702999999999 | AR19: - | AS19: =RC[-30] -> 44.039101000000002 | AT19: =RC[-30] -> 50.8232 | AU19: - | AV19: =RC[-31] -> 12.105502999999999 | AW19: =RC[-31] -> 15.406397999999999 | AX19: =RC[-31] -> 1.463687 | AY19: =RC[-31] -> 2.8873636824162734 | BA19: - | BB19: * | BC19: -
A20: =IF(RC[1]="","",DATEVALUE(RC[1])) -> 43372 | B20: 29.09.18 | C20: 24 | D20: 236.41906700000001 | E20: 51.371853000000002 | F20: 6.53 | G20: 239.73509200000001 | H20: 43.328648000000001 | I20: 4.43 | J20: =RC[-5]-RC[-2] -> 8.0432050000000004 | K20: -3.3160249999999998 | L20: =RC[9] -> 1.7578881418055352 | M20: 58.104996 | N20: 63.145133999999999 | O20: 43.763103000000001 | P20: 50.890884 | Q20: =RC[-3]-RC[-1] -> 12.254249999999999 | R20: 14.341893000000001 | S20: 1.4037599999999999 | T20: =RC[-8]+RC[-1] -> 3.1616481418055349 | U20: =(RC[-17]*RC[-16]-RC[-14]*RC[-13])/1000 -> 1.7578881418055352 | V20: 57.048065000000001 | W20: 43.231445000000001 | X20: =RC[-2]*RC[-10]/1000 -> 3.6023077088657103 | Y20: =(RC[-3]*RC[-11]-RC[-2]*RC[-9])/1000 -> 1.4022212562183298 | Z20: 2013-11-29T00:00:00.000 | AA20: 2013-11-27T00:00:00.000 | AD20: =VALUE(RC[-28]) -> 2018-09-29T00:00:00.000 | AE20: =IF(RC[22]=42,"*",IF(RC[22]=32,"",RC[22])) -> - | AF20: =RC[-29] -> 24 | AG20: =RC[-29] -> 236.41906700000001 | AH20: =RC[-29] -> 51.371853000000002 | AI20: =RC[-29] -> 6.53 | AJ20: =RC[-29] -> 239.73509200000001 | AK20: =RC[-29] -> 43.328648000000001 | AL20: =RC[-29] -> 4.43 | AM20: =RC[-29] -> 8.0432050000000004 | AN20: =RC[-29] -> -3.3160249999999998 | AO20: =RC[-29] -> 1.7578881418055352 | AP20: =RC[-29] -> 58.104996 | AQ20: =RC[-29] -> 63.145133999999999 | AR20: - | AS20: =RC[-30] -> 43.763103000000001 | AT20: =RC[-30] -> 50.890884 | AU20: - | AV20: =RC[-31] -> 12.254249999999999 | AW20: =RC[-31] -> 14.341893000000001 | AX20: =RC[-31] -> 1.4037599999999999 | AY20: =RC[-31] -> 3.1616481418055349 | BA20: - | BB20: * | BC20: -
A21: =IF(RC[1]="","",DATEVALUE(RC[1])) -> 43373 | B21: 30.09.18 | C21: 24 | D21: 239.52722199999999 | E21: 55.516415000000002 | F21: 6.53 | G21: 242.88183599999999 | H21: 46.496699999999997 | I21: 4.43 | J21: =RC[-5]-RC[-2] -> 9.019715000000005 | K21: -3.3546140000000002 | L21: =RC[9] -> 2.0044887964079319 | M21: 56.669497999999997 | N21: 64.586860999999999 | O21: 39.695602000000001 | P21: 51.431541000000003 | Q21: =RC[-3]-RC[-1] -> 13.155319999999996 | R21: 16.973896 | S21: 1.5759989999999999 | T21: =RC[-8]+RC[-1] -> 3.5804877964079318 | U21: =(RC[-17]*RC[-16]-RC[-14]*RC[-13])/1000 -> 2.0044887964079319 | V21: 55.594634999999997 | W21: 39.203445000000002 | X21: =RC[-2]*RC[-10]/1000 -> 3.5906829630907344 | Y21: =(RC[-3]*RC[-11]-RC[-2]*RC[-9])/1000 -> 1.5743893742319894 | Z21: 2013-11-30T00:00:00.000 | AA21: 2013-11-28T00:00:00.000 | AD21: =VALUE(RC[-28]) -> 2018-09-30T00:00:00.000 | AE21: =IF(RC[22]=42,"*",IF(RC[22]=32,"",RC[22])) -> - | AF21: =RC[-29] -> 24 | AG21: =RC[-29] -> 239.52722199999999 | AH21: =RC[-29] -> 55.516415000000002 | AI21: =RC[-29] -> 6.53 | AJ21: =RC[-29] -> 242.88183599999999 | AK21: =RC[-29] -> 46.496699999999997 | AL21: =RC[-29] -> 4.43 | AM21: =RC[-29] -> 9.019715000000005 | AN21: =RC[-29] -> -3.3546140000000002 | AO21: =RC[-29] -> 2.0044887964079319 | AP21: =RC[-29] -> 56.669497999999997 | AQ21: =RC[-29] -> 64.586860999999999 | AR21: - | AS21: =RC[-30] -> 39.695602000000001 | AT21: =RC[-30] -> 51.431541000000003 | AU21: - | AV21: =RC[-31] -> 13.155319999999996 | AW21: =RC[-31] -> 16.973896 | AX21: =RC[-31] -> 1.5759989999999999 | AY21: =RC[-31] -> 3.5804877964079318 | BA21: - | BB21: * | BC21: -
A22: =IF(RC[1]="","",DATEVALUE(RC[1])) -> 43374 | B22: 01.10.18 | C22: 24 | D22: 234.07830799999999 | E22: 52.694682999999998 | F22: 6.53 | G22: 237.43090799999999 | H22: 44.547516000000002 | I22: 4.43 | J22: =RC[-5]-RC[-2] -> 8.1471669999999961 | K22: -3.3525999999999998 | L22: =RC[9] -> 1.7577250642118343 | M22: 56.136496999999999 | N22: 63.990386999999998 | O22: 40.981498999999999 | P22: 51.455086000000001 | Q22: =RC[-3]-RC[-1] -> 12.535300999999997 | R22: 15.154998000000001 | S22: 1.4442280000000001 | T22: =RC[-8]+RC[-1] -> 3.2019530642118346 | U22: =(RC[-17]*RC[-16]-RC[-14]*RC[-13])/1000 -> 1.7577250642118343 | V22: 55.089928 | W22: 40.472996000000002 | X22: =RC[-2]*RC[-10]/1000 -> 3.5252258125221361 | Y22: =(RC[-3]*RC[-11]-RC[-2]*RC[-9])/1000 -> 1.4426843226644801 | Z22: 2013-12-01T00:00:00.000 | AA22: 2013-11-29T00:00:00.000 | AD22: =VALUE(RC[-28]) -> 2018-10-01T00:00:00.000 | AE22: =IF(RC[22]=42,"*",IF(RC[22]=32,"",RC[22])) -> - | AF22: =RC[-29] -> 24 | AG22: =RC[-29] -> 234.07830799999999 | AH22: =RC[-29] -> 52.694682999999998 | AI22: =RC[-29] -> 6.53 | AJ22: =RC[-29] -> 237.43090799999999 | AK22: =RC[-29] -> 44.547516000000002 | AL22: =RC[-29] -> 4.43 | AM22: =RC[-29] -> 8.1471669999999961 | AN22: =RC[-29] -> -3.3525999999999998 | AO22: =RC[-29] -> 1.7577250642118343 | AP22: =RC[-29] -> 56.136496999999999 | AQ22: =RC[-29] -> 63.990386999999998 | AR22: - | AS22: =RC[-30] -> 40.981498999999999 | AT22: =RC[-30] -> 51.455086000000001 | AU22: - | AV22: =RC[-31] -> 12.535300999999997 | AW22: =RC[-31] -> 15.154998000000001 | AX22: =RC[-31] -> 1.4442280000000001 | AY22: =RC[-31] -> 3.2019530642118346 | BA22: - | BB22: * | BC22: -
A23: =IF(RC[1]="","",DATEVALUE(RC[1])) -> 43375 | B23: 02.10.18 | C23: 24 | D23: 227.99498 | E23: 52.667766999999998 | F23: 6.53 | G23: 231.29208399999999 | H23: 44.497726 | I23: 4.43 | J23: =RC[-5]-RC[-2] -> 8.1700409999999977 | K23: -3.2971039999999898 | L23: =RC[9] -> 1.7160147040086757 | M23: 56.327491999999999 | N23: 62.846026999999999 | O23: 42.088298999999999 | P23: 50.736435 | Q23: =RC[-3]-RC[-1] -> 12.109591999999999 | R23: 14.239193 | S23: 1.3680079999999999 | T23: =RC[-8]+RC[-1] -> 3.0840227040086754 | U23: =(RC[-17]*RC[-16]-RC[-14]*RC[-13])/1000 -> 1.7160147040086757 | V23: 55.311886000000001 | W23: 41.579974999999997 | X23: =RC[-2]*RC[-10]/1000 -> 3.4761322809769224 | Y23: =(RC[-3]*RC[-11]-RC[-2]*RC[-9])/1000 -> 1.3665125820877975 | Z23: 2013-12-02T00:00:00.000 | AA23: 2013-11-30T00:00:00.000 | AD23: =VALUE(RC[-28]) -> 2018-10-02T00:00:00.000 | AE23: =IF(RC[22]=42,"*",IF(RC[22]=32,"",RC[22])) -> - | AF23: =RC[-29] -> 24 | AG23: =RC[-29] -> 227.99498 | AH23: =RC[-29] -> 52.667766999999998 | AI23: =RC[-29] -> 6.53 | AJ23: =RC[-29] -> 231.29208399999999 | AK23: =RC[-29] -> 44.497726 | AL23: =RC[-29] -> 4.43 | AM23: =RC[-29] -> 8.1700409999999977 | AN23: =RC[-29] -> -3.2971039999999898 | AO23: =RC[-29] -> 1.7160147040086757 | AP23: =RC[-29] -> 56.327491999999999 | AQ23: =RC[-29] -> 62.846026999999999 | AR23: - | AS23: =RC[-30] -> 42.088298999999999 | AT23: =RC[-30] -> 50.736435 | AU23: - | AV23: =RC[-31] -> 12.109591999999999 | AW23: =RC[-31] -> 14.239193 | AX23: =RC[-31] -> 1.3680079999999999 | AY23: =RC[-31] -> 3.0840227040086754 | BA23: - | BB23: * | BC23: -
A24: =IF(RC[1]="","",DATEVALUE(RC[1])) -> 43376 | B24: 03.10.18 | C24: 24 | D24: 226.881866 | E24: 54.158566 | F24: 6.53 | G24: 228.478577 | H24: 42.873432000000001 | I24: 4.43 | J24: =RC[-5]-RC[-2] -> 11.285133999999999 | K24: -1.596711 | L24: =RC[9] -> 2.4919357794978914 | M24: 55.489491000000001 | N24: 62.820999 | O24: 40.885390999999998 | P24: 50.573692000000001 | Q24: =RC[-3]-RC[-1] -> 12.247306999999999 | R24: 14.604100000000001 | S24: 1.3816740000000001 | T24: =RC[-8]+RC[-1] -> 3.8736097794978912 | U24: =(RC[-17]*RC[-16]-RC[-14]*RC[-13])/1000 -> 2.4919357794978914 | V24: 54.489722999999998 | W24: 40.394629999999999 | X24: =RC[-2]*RC[-10]/1000 -> 3.4230988340932766 | Y24: =(RC[-3]*RC[-11]-RC[-2]*RC[-9])/1000 -> 1.3801932580193168 | Z24: 2013-12-03T00:00:00.000 | AA24: 2013-12-01T00:00:00.000 | AD24: =VALUE(RC[-28]) -> 2018-10-03T00:00:00.000 | AE24: =IF(RC[22]=42,"*",IF(RC[22]=32,"",RC[22])) -> - | AF24: =RC[-29] -> 24 | AG24: =RC[-29] -> 226.881866 | AH24: =RC[-29] -> 54.158566 | AI24: =RC[-29] -> 6.53 | AJ24: =RC[-29] -> 228.478577 | AK24: =RC[-29] -> 42.873432000000001 | AL24: =RC[-29] -> 4.43 | AM24: =RC[-29] -> 11.285133999999999 | AN24: =RC[-29] -> -1.596711 | AO24: =RC[-29] -> 2.4919357794978914 | AP24: =RC[-29] -> 55.489491000000001 | AQ24: =RC[-29] -> 62.820999 | AR24: - | AS24: =RC[-30] -> 40.885390999999998 | AT24: =RC[-30] -> 50.573692000000001 | AU24: - | AV24: =RC[-31] -> 12.247306999999999 | AW24: =RC[-31] -> 14.604100000000001 | AX24: =RC[-31] -> 1.3816740000000001 | AY24: =RC[-31] -> 3.8736097794978912 | BA24: - | BB24: * | BC24: -
A25: =IF(RC[1]="","",DATEVALUE(RC[1])) -> 43377 | B25: 04.10.18 | C25: 24 | D25: 226.16130100000001 | E25: 54.722279 | F25: 6.53 | G25: 229.18798799999999 | H25: 39.975475000000003 | I25: 4.43 | J25: =RC[-5]-RC[-2] -> 14.746803999999997 | K25: -3.0266870000000101 | L25: =RC[9] -> 3.2141631277306786 | M25: 56.028500000000001 | N25: 62.470416999999998 | O25: 40.869900000000001 | P25: 50.438557000000003 | Q25: =RC[-3]-RC[-1] -> 12.031859999999995 | R25: 15.1586 | S25: 1.4024129999999999 | T25: =RC[-8]+RC[-1] -> 4.6165761277306787 | U25: =(RC[-17]*RC[-16]-RC[-14]*RC[-13])/1000 -> 3.2141631277306786 | V25: 55.029429999999998 | W25: 40.381836 | X25: =RC[-2]*RC[-10]/1000 -> 3.4377114393723094 | Y25: =(RC[-3]*RC[-11]-RC[-2]*RC[-9])/1000 -> 1.4009099025216574 | Z25: 2013-12-04T00:00:00.000 | AA25: 2013-12-02T00:00:00.000 | AD25: =VALUE(RC[-28]) -> 2018-10-04T00:00:00.000 | AE25: =IF(RC[22]=42,"*",IF(RC[22]=32,"",RC[22])) -> - | AF25: =RC[-29] -> 24 | AG25: =RC[-29] -> 226.16130100000001 | AH25: =RC[-29] -> 54.722279 | AI25: =RC[-29] -> 6.53 | AJ25: =RC[-29] -> 229.18798799999999 | AK25: =RC[-29] -> 39.975475000000003 | AL25: =RC[-29] -> 4.43 | AM25: =RC[-29] -> 14.746803999999997 | AN25: =RC[-29] -> -3.0266870000000101 | AO25: =RC[-29] -> 3.2141631277306786 | AP25: =RC[-29] -> 56.028500000000001 | AQ25: =RC[-29] -> 62.470416999999998 | AR25: - | AS25: =RC[-30] -> 40.869900000000001 | AT25: =RC[-30] -> 50.438557000000003 | AU25: - | AV25: =RC[-31] -> 12.031859999999995 | AW25: =RC[-31] -> 15.1586 | AX25: =RC[-31] -> 1.4024129999999999 | AY25: =RC[-31] -> 4.6165761277306787 | BA25: - | BB25: * | BC25: -
A26: =IF(RC[1]="","",DATEVALUE(RC[1])) -> 43378 | B26: 05.10.18 | C26: 24 | D26: 226.98497 | E26: 55.260365 | F26: 6.53 | G26: 230.17363 | H26: 40.320435000000003 | I26: 4.43 | J26: =RC[-5]-RC[-2] -> 14.939929999999997 | K26: -3.1886600000000298 | L26: =RC[9] -> 3.2625714045850001 | M26: 56.352497 | N26: 61.919586000000002 | O26: 39.842697000000001 | P26: 50.078659000000002 | Q26: =RC[-3]-RC[-1] -> 11.840927000000001 | R26: 16.509799999999998 | S26: 1.4578800000000001 | T26: =RC[-8]+RC[-1] -> 4.7204514045849999 | U26: =(RC[-17]*RC[-16]-RC[-14]*RC[-13])/1000 -> 3.2625714045850001 | V26: 55.364016999999997 | W26: 39.373404999999998 | X26: =RC[-2]*RC[-10]/1000 -> 3.4281170119369624 | Y26: =(RC[-3]*RC[-11]-RC[-2]*RC[-9])/1000 -> 1.4563496892730672 | Z26: 2013-12-05T00:00:00.000 | AA26: 2013-12-03T00:00:00.000 | AD26: =VALUE(RC[-28]) -> 2018-10-05T00:00:00.000 | AE26: =IF(RC[22]=42,"*",IF(RC[22]=32,"",RC[22])) -> - | AF26: =RC[-29] -> 24 | AG26: =RC[-29] -> 226.98497 | AH26: =RC[-29] -> 55.260365 | AI26: =RC[-29] -> 6.53 | AJ26: =RC[-29] -> 230.17363 | AK26: =RC[-29] -> 40.320435000000003 | AL26: =RC[-29] -> 4.43 | AM26: =RC[-29] -> 14.939929999999997 | AN26: =RC[-29] -> -3.1886600000000298 | AO26: =RC[-29] -> 3.2625714045850001 | AP26: =RC[-29] -> 56.352497 | AQ26: =RC[-29] -> 61.919586000000002 | AR26: - | AS26: =RC[-30] -> 39.842697000000001 | AT26: =RC[-30] -> 50.078659000000002 | AU26: - | AV26: =RC[-31] -> 11.840927000000001 | AW26: =RC[-31] -> 16.509799999999998 | AX26: =RC[-31] -> 1.4578800000000001 | AY26: =RC[-31] -> 4.7204514045849999 | BA26: - | BB26: * | BC26: -
A27: =IF(RC[1]="","",DATEVALUE(RC[1])) -> 43379 | B27: 06.10.18 | C27: 24 | D27: 227.88368199999999 | E27: 53.551876 | F27: 6.53 | G27: 230.986816 | H27: 39.826079999999997 | I27: 4.43 | J27: =RC[-5]-RC[-2] -> 13.725796000000003 | K27: -3.1031339999999799 | L27: =RC[9] -> 3.0042992679261515 | M27: 54.912497999999999 | N27: 62.275688000000002 | O27: 39.366196000000002 | P27: 50.137951000000001 | Q27: =RC[-3]-RC[-1] -> 12.137737000000001 | R27: 15.546302000000001 | S27: 1.410129 | T27: =RC[-8]+RC[-1] -> 4.4144282679261515 | U27: =(RC[-17]*RC[-16]-RC[-14]*RC[-13])/1000 -> 3.0042992679261515 | V27: 53.938941999999997 | W27: 38.901423999999999 | X27: =RC[-2]*RC[-10]/1000 -> 3.3590847230420957 | Y27: =(RC[-3]*RC[-11]-RC[-2]*RC[-9])/1000 -> 1.4086470326998719 | Z27: 2013-12-06T00:00:00.000 | AA27: 2013-12-04T00:00:00.000 | AD27: =VALUE(RC[-28]) -> 2018-10-06T00:00:00.000 | AE27: =IF(RC[22]=42,"*",IF(RC[22]=32,"",RC[22])) -> - | AF27: =RC[-29] -> 24 | AG27: =RC[-29] -> 227.88368199999999 | AH27: =RC[-29] -> 53.551876 | AI27: =RC[-29] -> 6.53 | AJ27: =RC[-29] -> 230.986816 | AK27: =RC[-29] -> 39.826079999999997 | AL27: =RC[-29] -> 4.43 | AM27: =RC[-29] -> 13.725796000000003 | AN27: =RC[-29] -> -3.1031339999999799 | AO27: =RC[-29] -> 3.0042992679261515 | AP27: =RC[-29] -> 54.912497999999999 | AQ27: =RC[-29] -> 62.275688000000002 | AR27: - | AS27: =RC[-30] -> 39.366196000000002 | AT27: =RC[-30] -> 50.137951000000001 | AU27: - | AV27: =RC[-31] -> 12.137737000000001 | AW27: =RC[-31] -> 15.546302000000001 | AX27: =RC[-31] -> 1.410129 | AY27: =RC[-31] -> 4.4144282679261515 | BA27: - | BB27: * | BC27: -
A28: =IF(RC[1]="","",DATEVALUE(RC[1])) -> 43380 | B28: 07.10.18 | C28: 24 | D28: 227.32492099999999 | E28: 55.726646000000002 | F28: 6.53 | G28: 230.53329500000001 | H28: 40.891238999999999 | I28: 4.43 | J28: =RC[-5]-RC[-2] -> 14.835407000000004 | K28: -3.2083739999999898 | L28: =RC[9] -> 3.2412633362424605 | M28: 54.669494999999998 | N28: 62.554851999999997 | O28: 38.787394999999997 | P28: 50.371197000000002 | Q28: =RC[-3]-RC[-1] -> 12.183654999999995 | R28: 15.882099999999999 | S28: 1.429713 | T28: =RC[-8]+RC[-1] -> 4.670976336242461 | U28: =(RC[-17]*RC[-16]-RC[-14]*RC[-13])/1000 -> 3.2412633362424605 | V28: 53.692183999999997 | W28: 38.325347999999998 | X28: =RC[-2]*RC[-10]/1000 -> 3.3587066236767678 | Y28: =(RC[-3]*RC[-11]-RC[-2]*RC[-9])/1000 -> 1.4282129694752119 | Z28: 2013-12-07T00:00:00.000 | AA28: 2013-12-05T00:00:00.000 | AD28: =VALUE(RC[-28]) -> 2018-10-07T00:00:00.000 | AE28: =IF(RC[22]=42,"*",IF(RC[22]=32,"",RC[22])) -> - | AF28: =RC[-29] -> 24 | AG28: =RC[-29] -> 227.32492099999999 | AH28: =RC[-29] -> 55.726646000000002 | AI28: =RC[-29] -> 6.53 | AJ28: =RC[-29] -> 230.53329500000001 | AK28: =RC[-29] -> 40.891238999999999 | AL28: =RC[-29] -> 4.43 | AM28: =RC[-29] -> 14.835407000000004 | AN28: =RC[-29] -> -3.2083739999999898 | AO28: =RC[-29] -> 3.2412633362424605 | AP28: =RC[-29] -> 54.669494999999998 | AQ28: =RC[-29] -> 62.554851999999997 | AR28: - | AS28: =RC[-30] -> 38.787394999999997 | AT28: =RC[-30] -> 50.371197000000002 | AU28: - | AV28: =RC[-31] -> 12.183654999999995 | AW28: =RC[-31] -> 15.882099999999999 | AX28: =RC[-31] -> 1.429713 | AY28: =RC[-31] -> 4.670976336242461 | BA28: - | BB28: * | BC28: -
A29: =IF(RC[1]="","",DATEVALUE(RC[1])) -> 43381 | B29: 08.10.18 | C29: 24 | D29: 227.765533 | E29: 55.555191000000001 | F29: 6.53 | G29: 230.90239 | H29: 40.969231000000001 | I29: 4.43 | J29: =RC[-5]-RC[-2] -> 14.58596 | K29: -3.13685700000002 | L29: =RC[9] -> 3.1936643346697147 | M29: 54.590992 | N29: 62.516762 | O29: 40.272506999999997 | P29: 50.251587000000001 | Q29: =RC[-3]-RC[-1] -> 12.265174999999999 | R29: 14.318485000000001 | S29: 1.3535999999999999 | T29: =RC[-8]+RC[-1] -> 4.5472643346697144 | U29: =(RC[-17]*RC[-16]-RC[-14]*RC[-13])/1000 -> 3.1936643346697147 | V29: 53.616219000000001 | W29: 39.794994000000003 | X29: =RC[-2]*RC[-10]/1000 -> 3.3519124025628781 | Y29: =(RC[-3]*RC[-11]-RC[-2]*RC[-9])/1000 -> 1.3521507994073998 | Z29: 2013-12-08T00:00:00.000 | AA29: 2013-12-06T00:00:00.000 | AD29: =VALUE(RC[-28]) -> 2018-10-08T00:00:00.000 | AE29: =IF(RC[22]=42,"*",IF(RC[22]=32,"",RC[22])) -> - | AF29: =RC[-29] -> 24 | AG29: =RC[-29] -> 227.765533 | AH29: =RC[-29] -> 55.555191000000001 | AI29: =RC[-29] -> 6.53 | AJ29: =RC[-29] -> 230.90239 | AK29: =RC[-29] -> 40.969231000000001 | AL29: =RC[-29] -> 4.43 | AM29: =RC[-29] -> 14.58596 | AN29: =RC[-29] -> -3.13685700000002 | AO29: =RC[-29] -> 3.1936643346697147 | AP29: =RC[-29] -> 54.590992 | AQ29: =RC[-29] -> 62.516762 | AR29: - | AS29: =RC[-30] -> 40.272506999999997 | AT29: =RC[-30] -> 50.251587000000001 | AU29: - | AV29: =RC[-31] -> 12.265174999999999 | AW29: =RC[-31] -> 14.318485000000001 | AX29: =RC[-31] -> 1.3535999999999999 | AY29: =RC[-31] -> 4.5472643346697144 | BA29: - | BB29: * | BC29: -
A30: =IF(RC[1]="","",DATEVALUE(RC[1])) -> 43382 | B30: 09.10.18 | C30: 24 | D30: 227.96054100000001 | E30: 53.704613000000002 | F30: 6.53 | G30: 231.10597200000001 | H30: 40.057682 | I30: 4.43 | J30: =RC[-5]-RC[-2] -> 13.646931000000002 | K30: -3.1454309999999999 | L30: =RC[9] -> 2.9849630989987292 | M30: 54.592495 | N30: 62.263199 | O30: 40.339958000000003 | P30: 50.109653000000002 | Q30: =RC[-3]-RC[-1] -> 12.153545999999999 | R30: 14.252537 | S30: 1.3427070000000001 | T30: =RC[-8]+RC[-1] -> 4.3276700989987296 | U30: =(RC[-17]*RC[-16]-RC[-14]*RC[-13])/1000 -> 2.9849630989987292 | V30: 53.624966000000001 | W30: 39.864243000000002 | X30: =RC[-2]*RC[-10]/1000 -> 3.3388619294262338 | Y30: =(RC[-3]*RC[-11]-RC[-2]*RC[-9])/1000 -> 1.3412785455885547 | Z30: 2013-12-09T00:00:00.000 | AA30: 2013-12-07T00:00:00.000 | AD30: =VALUE(RC[-28]) -> 2018-10-09T00:00:00.000 | AE30: =IF(RC[22]=42,"*",IF(RC[22]=32,"",RC[22])) -> - | AF30: =RC[-29] -> 24 | AG30: =RC[-29] -> 227.96054100000001 | AH30: =RC[-29] -> 53.704613000000002 | AI30: =RC[-29] -> 6.53 | AJ30: =RC[-29] -> 231.10597200000001 | AK30: =RC[-29] -> 40.057682 | AL30: =RC[-29] -> 4.43 | AM30: =RC[-29] -> 13.646931000000002 | AN30: =RC[-29] -> -3.1454309999999999 | AO30: =RC[-29] -> 2.9849630989987292 | AP30: =RC[-29] -> 54.592495 | AQ30: =RC[-29] -> 62.263199 | AR30: - | AS30: =RC[-30] -> 40.339958000000003 | AT30: =RC[-30] -> 50.109653000000002 | AU30: - | AV30: =RC[-31] -> 12.153545999999999 | AW30: =RC[-31] -> 14.252537 | AX30: =RC[-31] -> 1.3427070000000001 | AY30: =RC[-31] -> 4.3276700989987296 | BA30: - | BB30: * | BC30: -
A31: =IF(RC[1]="","",DATEVALUE(RC[1])) -> 43383 | B31: 10.10.18 | C31: 24 | D31: 232.11273199999999 | E31: 53.293621000000002 | F31: 6.53 | G31: 235.37091100000001 | H31: 40.149943999999998 | I31: 4.43 | J31: =RC[-5]-RC[-2] -> 13.143677000000004 | K31: -3.2581789999999802 | L31: =RC[9] -> 2.9199990726035865 | M31: 54.660995 | N31: 63.105198000000001 | O31: 40.002299999999998 | P31: 50.650860000000002 | Q31: =RC[-3]-RC[-1] -> 12.454338 | R31: 14.658695 | S31: 1.3864270000000001 | T31: =RC[-8]+RC[-1] -> 4.3064260726035863 | U31: =(RC[-17]*RC[-16]-RC[-14]*RC[-13])/1000 -> 2.9199990726035865 | V31: 53.667793000000003 | W31: 39.520676000000002 | X31: =RC[-2]*RC[-10]/1000 -> 3.3867167034880143 | Y31: =(RC[-3]*RC[-11]-RC[-2]*RC[-9])/1000 -> 1.3849604763066543 | Z31: 2013-12-10T00:00:00.000 | AA31: 2013-12-08T00:00:00.000 | AD31: =VALUE(RC[-28]) -> 2018-10-10T00:00:00.000 | AE31: =IF(RC[22]=42,"*",IF(RC[22]=32,"",RC[22])) -> - | AF31: =RC[-29] -> 24 | AG31: =RC[-29] -> 232.11273199999999 | AH31: =RC[-29] -> 53.293621000000002 | AI31: =RC[-29] -> 6.53 | AJ31: =RC[-29] -> 235.37091100000001 | AK31: =RC[-29] -> 40.149943999999998 | AL31: =RC[-29] -> 4.43 | AM31: =RC[-29] -> 13.143677000000004 | AN31: =RC[-29] -> -3.2581789999999802 | AO31: =RC[-29] -> 2.9199990726035865 | AP31: =RC[-29] -> 54.660995 | AQ31: =RC[-29] -> 63.105198000000001 | AR31: - | AS31: =RC[-30] -> 40.002299999999998 | AT31: =RC[-30] -> 50.650860000000002 | AU31: - | AV31: =RC[-31] -> 12.454338 | AW31: =RC[-31] -> 14.658695 | AX31: =RC[-31] -> 1.3864270000000001 | AY31: =RC[-31] -> 4.3064260726035863 | BA31: - | BB31: * | BC31: -
A32: =IF(RC[1]="","",DATEVALUE(RC[1])) -> 43384 | B32: 11.10.18 | C32: 24 | D32: 231.85745199999999 | E32: 52.871445000000001 | F32: 6.53 | G32: 235.162384 | H32: 40.019244999999998 | I32: 4.43 | J32: =RC[-5]-RC[-2] -> 12.852200000000003 | K32: -3.3049320000000102 | L32: =RC[9] -> 2.8476174611780607 | M32: 54.656993999999997 | N32: 63.916491999999998 | O32: 38.668095000000001 | P32: 51.069167999999998 | Q32: =RC[-3]-RC[-1] -> 12.847324 | R32: 15.988899 | S32: 1.4794369999999999 | T32: =RC[-8]+RC[-1] -> 4.3270544611780606 | U32: =(RC[-17]*RC[-16]-RC[-14]*RC[-13])/1000 -> 2.8476174611780607 | V32: 53.640217 | W32: 38.195186999999997 | X32: =RC[-2]*RC[-10]/1000 -> 3.4284945007587639 | Y32: =(RC[-3]*RC[-11]-RC[-2]*RC[-9])/1000 -> 1.4778980790643481 | Z32: 2013-12-11T00:00:00.000 | AA32: 2013-12-09T00:00:00.000 | AD32: =VALUE(RC[-28]) -> 2018-10-11T00:00:00.000 | AE32: =IF(RC[22]=42,"*",IF(RC[22]=32,"",RC[22])) -> - | AF32: =RC[-29] -> 24 | AG32: =RC[-29] -> 231.85745199999999 | AH32: =RC[-29] -> 52.871445000000001 | AI32: =RC[-29] -> 6.53 | AJ32: =RC[-29] -> 235.162384 | AK32: =RC[-29] -> 40.019244999999998 | AL32: =RC[-29] -> 4.43 | AM32: =RC[-29] -> 12.852200000000003 | AN32: =RC[-29] -> -3.3049320000000102 | AO32: =RC[-29] -> 2.8476174611780607 | AP32: =RC[-29] -> 54.656993999999997 | AQ32: =RC[-29] -> 63.916491999999998 | AR32: - | AS32: =RC[-30] -> 38.668095000000001 | AT32: =RC[-30] -> 51.069167999999998 | AU32: - | AV32: =RC[-31] -> 12.847324 | AW32: =RC[-31] -> 15.988899 | AX32: =RC[-31] -> 1.4794369999999999 | AY32: =RC[-31] -> 4.3270544611780606 | BA32: - | BB32: * | BC32: -
A33: =IF(RC[1]="","",DATEVALUE(RC[1])) -> 43385 | B33: 12.10.18 | C33: 24 | D33: 231.36026000000001 | E33: 52.763522999999999 | F33: 6.53 | G33: 234.58371 | H33: 39.855849999999997 | I33: 4.43 | J33: =RC[-5]-RC[-2] -> 12.907673000000003 | K33: -3.2234500000000099 | L33: =RC[9] -> 2.857849241592481 | M33: 54.109496999999998 | N33: 63.832625999999998 | O33: 39.671497000000002 | P33: 51.016148000000001 | Q33: =RC[-3]-RC[-1] -> 12.816477999999996 | R33: 14.438000000000001 | S33: 1.3921520000000001 | T33: =RC[-8]+RC[-1] -> 4.2500012415924813 | U33: =(RC[-17]*RC[-16]-RC[-14]*RC[-13])/1000 -> 2.857849241592481 | V33: 53.105347000000002 | W33: 39.187271000000003 | X33: =RC[-2]*RC[-10]/1000 -> 3.3898537536512223 | Y33: =(RC[-3]*RC[-11]-RC[-2]*RC[-9])/1000 -> 1.3906701365991139 | Z33: 2013-12-12T00:00:00.000 | AA33: 2013-12-10T00:00:00.000 | AD33: =VALUE(RC[-28]) -> 2018-10-12T00:00:00.000 | AE33: =IF(RC[22]=42,"*",IF(RC[22]=32,"",RC[22])) -> - | AF33: =RC[-29] -> 24 | AG33: =RC[-29] -> 231.36026000000001 | AH33: =RC[-29] -> 52.763522999999999 | AI33: =RC[-29] -> 6.53 | AJ33: =RC[-29] -> 234.58371 | AK33: =RC[-29] -> 39.855849999999997 | AL33: =RC[-29] -> 4.43 | AM33: =RC[-29] -> 12.907673000000003 | AN33: =RC[-29] -> -3.2234500000000099 | AO33: =RC[-29] -> 2.857849241592481 | AP33: =RC[-29] -> 54.109496999999998 | AQ33: =RC[-29] -> 63.832625999999998 | AR33: - | AS33: =RC[-30] -> 39.671497000000002 | AT33: =RC[-30] -> 51.016148000000001 | AU33: - | AV33: =RC[-31] -> 12.816477999999996 | AW33: =RC[-31] -> 14.438000000000001 | AX33: =RC[-31] -> 1.3921520000000001 | AY33: =RC[-31] -> 4.2500012415924813 | BA33: - | BB33: * | BC33: -
A34: =IF(RC[1]="","",DATEVALUE(RC[1])) -> 43386 | B34: 13.10.18 | C34: 24 | D34: 232.02186599999999 | E34: 52.241847999999997 | F34: 6.53 | G34: 235.260254 | H34: 39.859515999999999 | I34: 4.43 | J34: =RC[-5]-RC[-2] -> 12.382331999999998 | K34: -3.2383880000000098 | L34: =RC[9] -> 2.7438911977713034 | M34: 52.458995999999999 | N34: 64.439612999999994 | O34: 40.296799 | P34: 51.346851000000001 | Q34: =RC[-3]-RC[-1] -> 13.092761999999993 | R34: 12.162197000000001 | S34: 1.2744610000000001 | T34: =RC[-8]+RC[-1] -> 4.0183521977713035 | U34: =(RC[-17]*RC[-16]-RC[-14]*RC[-13])/1000 -> 2.7438911977713034 | V34: 51.468299999999999 | W34: 39.798771000000002 | X34: =RC[-2]*RC[-10]/1000 -> 3.3165973337678998 | Y34: =(RC[-3]*RC[-11]-RC[-2]*RC[-9])/1000 -> 1.2730557692477784 | Z34: 2013-12-13T00:00:00.000 | AA34: 2013-12-11T00:00:00.000 | AD34: =VALUE(RC[-28]) -> 2018-10-13T00:00:00.000 | AE34: =IF(RC[22]=42,"*",IF(RC[22]=32,"",RC[22])) -> - | AF34: =RC[-29] -> 24 | AG34: =RC[-29] -> 232.02186599999999 | AH34: =RC[-29] -> 52.241847999999997 | AI34: =RC[-29] -> 6.53 | AJ34: =RC[-29] -> 235.260254 | AK34: =RC[-29] -> 39.859515999999999 | AL34: =RC[-29] -> 4.43 | AM34: =RC[-29] -> 12.382331999999998 | AN34: =RC[-29] -> -3.2383880000000098 | AO34: =RC[-29] -> 2.7438911977713034 | AP34: =RC[-29] -> 52.458995999999999 | AQ34: =RC[-29] -> 64.439612999999994 | AR34: - | AS34: =RC[-30] -> 40.296799 | AT34: =RC[-30] -> 51.346851000000001 | AU34: - | AV34: =RC[-31] -> 13.092761999999993 | AW34: =RC[-31] -> 12.162197000000001 | AX34: =RC[-31] -> 1.2744610000000001 | AY34: =RC[-31] -> 4.0183521977713035 | BA34: - | BB34: * | BC34: -
A35: =IF(RC[1]="","",DATEVALUE(RC[1])) -> 43387 | B35: 14.10.18 | C35: 24 | D35: 231.905304 | E35: 51.221122999999999 | F35: 6.53 | G35: 235.16192599999999 | H35: 39.605468999999999 | I35: 4.43 | J35: =RC[-5]-RC[-2] -> 11.615653999999999 | K35: -3.2566219999999899 | L35: =RC[9] -> 2.5647517303630973 | M35: 53.314495000000001 | N35: 65.066970999999995 | O35: 35.821503 | P35: 51.668807999999999 | Q35: =RC[-3]-RC[-1] -> 13.398162999999997 | R35: 17.492992000000001 | S35: 1.5762039999999999 | T35: =RC[-8]+RC[-1] -> 4.1409557303630971 | U35: =(RC[-17]*RC[-16]-RC[-14]*RC[-13])/1000 -> 2.5647517303630973 | V35: 52.289485999999997 | W35: 35.373451000000003 | X35: =RC[-2]*RC[-10]/1000 -> 3.4023184691669059 | Y35: =(RC[-3]*RC[-11]-RC[-2]*RC[-9])/1000 -> 1.5746144211504978 | Z35: 2013-12-14T00:00:00.000 | AA35: 2013-12-12T00:00:00.000 | AD35: =VALUE(RC[-28]) -> 2018-10-14T00:00:00.000 | AE35: =IF(RC[22]=42,"*",IF(RC[22]=32,"",RC[22])) -> - | AF35: =RC[-29] -> 24 | AG35: =RC[-29] -> 231.905304 | AH35: =RC[-29] -> 51.221122999999999 | AI35: =RC[-29] -> 6.53 | AJ35: =RC[-29] -> 235.16192599999999 | AK35: =RC[-29] -> 39.605468999999999 | AL35: =RC[-29] -> 4.43 | AM35: =RC[-29] -> 11.615653999999999 | AN35: =RC[-29] -> -3.2566219999999899 | AO35: =RC[-29] -> 2.5647517303630973 | AP35: =RC[-29] -> 53.314495000000001 | AQ35: =RC[-29] -> 65.066970999999995 | AR35: - | AS35: =RC[-30] -> 35.821503 | AT35: =RC[-30] -> 51.668807999999999 | AU35: - | AV35: =RC[-31] -> 13.398162999999997 | AW35: =RC[-31] -> 17.492992000000001 | AX35: =RC[-31] -> 1.5762039999999999 | AY35: =RC[-31] -> 4.1409557303630971 | BA35: - | BB35: * | BC35: -
A36: =IF(RC[1]="","",DATEVALUE(RC[1])) -> 43388 | B36: 15.10.18 | C36: 24 | D36: 234.15640300000001 | E36: 51.018433000000002 | F36: 6.53 | G36: 237.44631999999999 | H36: 39.742409000000002 | I36: 4.43 | J36: =RC[-5]-RC[-2] -> 11.276024 | K36: -3.289917 | L36: =RC[9] -> 2.5096039929916207 | M36: 52.131996000000001 | N36: 64.689650999999998 | O36: 38.655799999999999 | P36: 51.633434000000001 | Q36: =RC[-3]-RC[-1] -> 13.056216999999997 | R36: 13.476196 | S36: 1.338697 | T36: =RC[-8]+RC[-1] -> 3.8483009929916205 | U36: =(RC[-17]*RC[-16]-RC[-14]*RC[-13])/1000 -> 2.5096039929916207 | V36: 51.140422999999998 | W36: 38.172969999999999 | X36: =RC[-2]*RC[-10]/1000 -> 3.3082561158623731 | Y36: =(RC[-3]*RC[-11]-RC[-2]*RC[-9])/1000 -> 1.3372545887833931 | Z36: 2013-12-15T00:00:00.000 | AA36: 2013-12-13T00:00:00.000 | AD36: =VALUE(RC[-28]) -> 2018-10-15T00:00:00.000 | AE36: =IF(RC[22]=42,"*",IF(RC[22]=32,"",RC[22])) -> - | AF36: =RC[-29] -> 24 | AG36: =RC[-29] -> 234.15640300000001 | AH36: =RC[-29] -> 51.018433000000002 | AI36: =RC[-29] -> 6.53 | AJ36: =RC[-29] -> 237.44631999999999 | AK36: =RC[-29] -> 39.742409000000002 | AL36: =RC[-29] -> 4.43 | AM36: =RC[-29] -> 11.276024 | AN36: =RC[-29] -> -3.289917 | AO36: =RC[-29] -> 2.5096039929916207 | AP36: =RC[-29] -> 52.131996000000001 | AQ36: =RC[-29] -> 64.689650999999998 | AR36: - | AS36: =RC[-30] -> 38.655799999999999 | AT36: =RC[-30] -> 51.633434000000001 | AU36: - | AV36: =RC[-31] -> 13.056216999999997 | AW36: =RC[-31] -> 13.476196 | AX36: =RC[-31] -> 1.338697 | AY36: =RC[-31] -> 3.8483009929916205 | BA36: - | BB36: * | BC36: -
A37: =IF(RC[1]="","",DATEVALUE(RC[1])) -> 43389 | B37: 16.10.18 | C37: 24 | D37: 235.640457 | E37: 50.925010999999998 | F37: 6.53 | G37: 238.869934 | H37: 39.695273999999998 | I37: 4.43 | J37: =RC[-5]-RC[-2] -> 11.229737 | K37: -3.2294770000000002 | L37: =RC[9] -> 2.5179853842781124 | M37: 52.193992999999999 | N37: 64.778091000000003 | O37: 36.981121000000002 | P37: 51.646183000000001 | Q37: =RC[-3]-RC[-1] -> 13.131908000000003 | R37: 15.212872000000001 | S37: 1.4319980000000001 | T37: =RC[-8]+RC[-1] -> 3.9499833842781125 | U37: =(RC[-17]*RC[-16]-RC[-14]*RC[-13])/1000 -> 2.5179853842781124 | V37: 51.198757000000001 | W37: 36.518954999999998 | X37: =RC[-2]*RC[-10]/1000 -> 3.3165577400328869 | Y37: =(RC[-3]*RC[-11]-RC[-2]*RC[-9])/1000 -> 1.430493107134122 | Z37: 2013-12-16T00:00:00.000 | AA37: 2013-12-14T00:00:00.000 | AD37: =VALUE(RC[-28]) -> 2018-10-16T00:00:00.000 | AE37: =IF(RC[22]=42,"*",IF(RC[22]=32,"",RC[22])) -> - | AF37: =RC[-29] -> 24 | AG37: =RC[-29] -> 235.640457 | AH37: =RC[-29] -> 50.925010999999998 | AI37: =RC[-29] -> 6.53 | AJ37: =RC[-29] -> 238.869934 | AK37: =RC[-29] -> 39.695273999999998 | AL37: =RC[-29] -> 4.43 | AM37: =RC[-29] -> 11.229737 | AN37: =RC[-29] -> -3.2294770000000002 | AO37: =RC[-29] -> 2.5179853842781124 | AP37: =RC[-29] -> 52.193992999999999 | AQ37: =RC[-29] -> 64.778091000000003 | AR37: - | AS37: =RC[-30] -> 36.981121000000002 | AT37: =RC[-30] -> 51.646183000000001 | AU37: - | AV37: =RC[-31] -> 13.131908000000003 | AW37: =RC[-31] -> 15.212872000000001 | AX37: =RC[-31] -> 1.4319980000000001 | AY37: =RC[-31] -> 3.9499833842781125 | BA37: - | BB37: * | BC37: -
A38: =IF(RC[1]="","",DATEVALUE(RC[1])) -> 43390 | B38: 17.10.18 | C38: 24 | D38: 167.92515599999999 | E38: 50.760852999999997 | F38: 6.53 | G38: 169.878433 | H38: 42.416946000000003 | I38: 4.43 | J38: =RC[-5]-RC[-2] -> 8.3439069999999944 | K38: -1.9532770000000099 | L38: =RC[9] -> 1.3182998395924479 | M38: 51.794494999999998 | N38: 64.713295000000002 | O38: 38.653098999999997 | P38: 51.464255999999999 | Q38: =RC[-3]-RC[-1] -> 13.249039000000003 | R38: 13.141396 | S38: 1.3248610000000001 | T38: =RC[-8]+RC[-1] -> 2.643160839592448 | U38: =(RC[-17]*RC[-16]-RC[-14]*RC[-13])/1000 -> 1.3182998395924479 | V38: 50.808700999999999 | W38: 38.173332000000002 | X38: =RC[-2]*RC[-10]/1000 -> 3.2879984563797953 | Y38: =(RC[-3]*RC[-11]-RC[-2]*RC[-9])/1000 -> 1.3234363259588031 | Z38: 2013-12-17T00:00:00.000 | AA38: 2013-12-15T00:00:00.000 | AD38: =VALUE(RC[-28]) -> 2018-10-17T00:00:00.000 | AE38: =IF(RC[22]=42,"*",IF(RC[22]=32,"",RC[22])) -> - | AF38: =RC[-29] -> 24 | AG38: =RC[-29] -> 167.92515599999999 | AH38: =RC[-29] -> 50.760852999999997 | AI38: =RC[-29] -> 6.53 | AJ38: =RC[-29] -> 169.878433 | AK38: =RC[-29] -> 42.416946000000003 | AL38: =RC[-29] -> 4.43 | AM38: =RC[-29] -> 8.3439069999999944 | AN38: =RC[-29] -> -1.9532770000000099 | AO38: =RC[-29] -> 1.3182998395924479 | AP38: =RC[-29] -> 51.794494999999998 | AQ38: =RC[-29] -> 64.713295000000002 | AR38: - | AS38: =RC[-30] -> 38.653098999999997 | AT38: =RC[-30] -> 51.464255999999999 | AU38: - | AV38: =RC[-31] -> 13.249039000000003 | AW38: =RC[-31] -> 13.141396 | AX38: =RC[-31] -> 1.3248610000000001 | AY38: =RC[-31] -> 2.643160839592448 | BA38: - | BB38: * | BC38: -
A39: =IF(RC[1]="","",DATEVALUE(RC[1])) -> 43391 | B39: 18.10.18 | C39: 24 | D39: 235.58982800000001 | E39: 50.990687999999999 | F39: 6.53 | G39: 239.22898900000001 | H39: 45.747520000000002 | I39: 4.43 | J39: =RC[-5]-RC[-2] -> 5.2431679999999972 | K39: -3.6391610000000001 | L39: =RC[9] -> 1.0687544566643827 | M39: 51.185496999999998 | N39: 65.124611000000002 | O39: 36.494999 | P39: 51.380763999999999 | Q39: =RC[-3]-RC[-1] -> 13.743847000000002 | R39: 14.690498 | S39: 1.4187650000000001 | T39: =RC[-8]+RC[-1] -> 2.4875194566643826 | U39: =(RC[-17]*RC[-16]-RC[-14]*RC[-13])/1000 -> 1.0687544566643827 | V39: 50.199829000000001 | W39: 36.043427000000001 | X39: =RC[-2]*RC[-10]/1000 -> 3.2692443358915195 | Y39: =(RC[-3]*RC[-11]-RC[-2]*RC[-9])/1000 -> 1.4173055194532913 | Z39: 2013-12-18T00:00:00.000 | AA39: 2013-12-16T00:00:00.000 | AD39: =VALUE(RC[-28]) -> 2018-10-18T00:00:00.000 | AE39: =IF(RC[22]=42,"*",IF(RC[22]=32,"",RC[22])) -> - | AF39: =RC[-29] -> 24 | AG39: =RC[-29] -> 235.58982800000001 | AH39: =RC[-29] -> 50.990687999999999 | AI39: =RC[-29] -> 6.53 | AJ39: =RC[-29] -> 239.22898900000001 | AK39: =RC[-29] -> 45.747520000000002 | AL39: =RC[-29] -> 4.43 | AM39: =RC[-29] -> 5.2431679999999972 | AN39: =RC[-29] -> -3.6391610000000001 | AO39: =RC[-29] -> 1.0687544566643827 | AP39: =RC[-29] -> 51.185496999999998 | AQ39: =RC[-29] -> 65.124611000000002 | AR39: - | AS39: =RC[-30] -> 36.494999 | AT39: =RC[-30] -> 51.380763999999999 | AU39: - | AV39: =RC[-31] -> 13.743847000000002 | AW39: =RC[-31] -> 14.690498 | AX39: =RC[-31] -> 1.4187650000000001 | AY39: =RC[-31] -> 2.4875194566643826 | BA39: - | BB39: * | BC39: -
A40: =IF(RC[1]="","",DATEVALUE(RC[1])) -> 43392 | B40: 19.10.18 | C40: 24 | D40: 236.17610199999999 | E40: 50.760978999999999 | F40: 6.53 | G40: 239.83685299999999 | H40: 45.088810000000002 | I40: 4.43 | J40: =RC[-5]-RC[-2] -> 5.6721689999999967 | K40: -3.6607509999999999 | L40: =RC[9] -> 1.1745718580089268 | M40: 52.711497999999999 | N40: 65.270797999999999 | O40: 38.745598000000001 | P40: 51.768901999999997 | Q40: =RC[-3]-RC[-1] -> 13.501896000000002 | R40: 13.9659 | S40: 1.394836 | T40: =RC[-8]+RC[-1] -> 2.569407858008927 | U40: =(RC[-17]*RC[-16]-RC[-14]*RC[-13])/1000 -> 1.1745718580089268 | V40: 51.692230000000002 | W40: 38.259205000000001 | X40: =RC[-2]*RC[-10]/1000 -> 3.37399310249954 | Y40: =(RC[-3]*RC[-11]-RC[-2]*RC[-9])/1000 -> 1.3933560682566299 | Z40: 2013-12-19T00:00:00.000 | AA40: 2013-12-17T00:00:00.000 | AD40: =VALUE(RC[-28]) -> 2018-10-19T00:00:00.000 | AE40: =IF(RC[22]=42,"*",IF(RC[22]=32,"",RC[22])) -> - | AF40: =RC[-29] -> 24 | AG40: =RC[-29] -> 236.17610199999999 | AH40: =RC[-29] -> 50.760978999999999 | AI40: =RC[-29] -> 6.53 | AJ40: =RC[-29] -> 239.83685299999999 | AK40: =RC[-29] -> 45.088810000000002 | AL40: =RC[-29] -> 4.43 | AM40: =RC[-29] -> 5.6721689999999967 | AN40: =RC[-29] -> -3.6607509999999999 | AO40: =RC[-29] -> 1.1745718580089268 | AP40: =RC[-29] -> 52.711497999999999 | AQ40: =RC[-29] -> 65.270797999999999 | AR40: - | AS40: =RC[-30] -> 38.745598000000001 | AT40: =RC[-30] -> 51.768901999999997 | AU40: - | AV40: =RC[-31] -> 13.501896000000002 | AW40: =RC[-31] -> 13.9659 | AX40: =RC[-31] -> 1.394836 | AY40: =RC[-31] -> 2.569407858008927 | BA40: - | BB40: * | BC40: -
A41: =IF(RC[1]="","",DATEVALUE(RC[1])) -> 43393 | B41: 20.10.18 | C41: 24 | D41: 236.98178100000001 | E41: 52.859951000000002 | F41: 6.53 | G41: 237.28447 | H41: 43.509472000000002 | I41: 4.43 | J41: =RC[-5]-RC[-2] -> 9.350479 | K41: -0.30268900000001497 | L41: =RC[9] -> 2.2027233280528908 | M41: 54.018504999999998 | N41: 64.922370999999998 | O41: 39.760795999999999 | P41: 51.690086000000001 | Q41: =RC[-3]-RC[-1] -> 13.232284999999997 | R41: 14.257709 | S41: 1.4118489999999999 | T41: =RC[-8]+RC[-1] -> 3.6145723280528905 | U41: =(RC[-17]*RC[-16]-RC[-14]*RC[-13])/1000 -> 2.2027233280528908 | V41: 52.984188000000003 | W41: 39.263095999999997 | X41: =RC[-2]*RC[-10]/1000 -> 3.4398591104697478 | Y41: =(RC[-3]*RC[-11]-RC[-2]*RC[-9])/1000 -> 1.4103463016034921 | Z41: 2013-12-20T00:00:00.000 | AA41: 2013-12-18T00:00:00.000 | AD41: =VALUE(RC[-28]) -> 2018-10-20T00:00:00.000 | AE41: =IF(RC[22]=42,"*",IF(RC[22]=32,"",RC[22])) -> - | AF41: =RC[-29] -> 24 | AG41: =RC[-29] -> 236.98178100000001 | AH41: =RC[-29] -> 52.859951000000002 | AI41: =RC[-29] -> 6.53 | AJ41: =RC[-29] -> 237.28447 | AK41: =RC[-29] -> 43.509472000000002 | AL41: =RC[-29] -> 4.43 | AM41: =RC[-29] -> 9.350479 | AN41: =RC[-29] -> -0.30268900000001497 | AO41: =RC[-29] -> 2.2027233280528908 | AP41: =RC[-29] -> 54.018504999999998 | AQ41: =RC[-29] -> 64.922370999999998 | AR41: - | AS41: =RC[-30] -> 39.760795999999999 | AT41: =RC[-30] -> 51.690086000000001 | AU41: - | AV41: =RC[-31] -> 13.232284999999997 | AW41: =RC[-31] -> 14.257709 | AX41: =RC[-31] -> 1.4118489999999999 | AY41: =RC[-31] -> 3.6145723280528905 | BA41: - | BB41: * | BC41: -
A42: =IF(RC[1]="","",DATEVALUE(RC[1])) -> 43394 | B42: 21.10.18 | C42: 24 | D42: 234.58647199999999 | E42: 52.616455000000002 | F42: 6.53 | G42: 237.76370199999999 | H42: 40.674255000000002 | I42: 4.43 | J42: =RC[-5]-RC[-2] -> 11.9422 | K42: -3.17723000000001 | L42: =RC[9] -> 2.6722471027047487 | M42: 55.305495999999998 | N42: 64.498786999999993 | O42: 39.809100999999998 | P42: 51.777312999999999 | Q42: =RC[-3]-RC[-1] -> 12.721473999999994 | R42: 15.496395 | S42: 1.4658910000000001 | T42: =RC[-8]+RC[-1] -> 4.1381381027047492 | U42: =(RC[-17]*RC[-16]-RC[-14]*RC[-13])/1000 -> 2.6722471027047487 | V42: 54.259250999999999 | W42: 39.309170000000002 | X42: =RC[-2]*RC[-10]/1000 -> 3.4996558730285363 | Y42: =(RC[-3]*RC[-11]-RC[-2]*RC[-9])/1000 -> 1.4643326741683262 | Z42: 2013-12-21T00:00:00.000 | AA42: 2013-12-19T00:00:00.000 | AD42: =VALUE(RC[-28]) -> 2018-10-21T00:00:00.000 | AE42: =IF(RC[22]=42,"*",IF(RC[22]=32,"",RC[22])) -> - | AF42: =RC[-29] -> 24 | AG42: =RC[-29] -> 234.58647199999999 | AH42: =RC[-29] -> 52.616455000000002 | AI42: =RC[-29] -> 6.53 | AJ42: =RC[-29] -> 237.76370199999999 | AK42: =RC[-29] -> 40.674255000000002 | AL42: =RC[-29] -> 4.43 | AM42: =RC[-29] -> 11.9422 | AN42: =RC[-29] -> -3.17723000000001 | AO42: =RC[-29] -> 2.6722471027047487 | AP42: =RC[-29] -> 55.305495999999998 | AQ42: =RC[-29] -> 64.498786999999993 | AR42: - | AS42: =RC[-30] -> 39.809100999999998 | AT42: =RC[-30] -> 51.777312999999999 | AU42: - | AV42: =RC[-31] -> 12.721473999999994 | AW42: =RC[-31] -> 15.496395 | AX42: =RC[-31] -> 1.4658910000000001 | AY42: =RC[-31] -> 4.1381381027047492 | BA42: - | BB42: * | BC42: -
A43: =IF(RC[1]="","",DATEVALUE(RC[1])) -> 43395 | B43: 22.10.18 | C43: 24 | D43: 194.043915 | E43: 53.507488000000002 | F43: 6.53 | G43: 196.40606700000001 | H43: 41.617493000000003 | I43: 4.43 | J43: =RC[-5]-RC[-2] -> 11.889994999999999 | K43: -2.36215199999998 | L43: =RC[9] -> 2.2088743348054884 | M43: 54.527500000000003 | N43: 64.542191000000003 | O43: 41.117305999999999 | P43: 51.679070000000003 | Q43: =RC[-3]-RC[-1] -> 12.863121 | R43: 13.410194000000001 | S43: 1.35582 | T43: =RC[-8]+RC[-1] -> 3.5646943348054885 | U43: =(RC[-17]*RC[-16]-RC[-14]*RC[-13])/1000 -> 2.2088743348054884 | V43: 53.494613999999999 | W43: 40.602798 | X43: =RC[-2]*RC[-10]/1000 -> 3.4526595942592739 | Y43: =(RC[-3]*RC[-11]-RC[-2]*RC[-9])/1000 -> 1.354344754221414 | Z43: 2013-12-22T00:00:00.000 | AA43: 2013-12-20T00:00:00.000 | AD43: =VALUE(RC[-28]) -> 2018-10-22T00:00:00.000 | AE43: =IF(RC[22]=42,"*",IF(RC[22]=32,"",RC[22])) -> - | AF43: =RC[-29] -> 24 | AG43: =RC[-29] -> 194.043915 | AH43: =RC[-29] -> 53.507488000000002 | AI43: =RC[-29] -> 6.53 | AJ43: =RC[-29] -> 196.40606700000001 | AK43: =RC[-29] -> 41.617493000000003 | AL43: =RC[-29] -> 4.43 | AM43: =RC[-29] -> 11.889994999999999 | AN43: =RC[-29] -> -2.36215199999998 | AO43: =RC[-29] -> 2.2088743348054884 | AP43: =RC[-29] -> 54.527500000000003 | AQ43: =RC[-29] -> 64.542191000000003 | AR43: - | AS43: =RC[-30] -> 41.117305999999999 | AT43: =RC[-30] -> 51.679070000000003 | AU43: - | AV43: =RC[-31] -> 12.863121 | AW43: =RC[-31] -> 13.410194000000001 | AX43: =RC[-31] -> 1.35582 | AY43: =RC[-31] -> 3.5646943348054885 | BA43: - | BB43: * | BC43: -
A44: =IF(RC[1]="","",DATEVALUE(RC[1])) ->  | C44: 24 | J44: =RC[-5]-RC[-2] -> #VALUE! | L44: =RC[9] -> #VALUE! | Q44: =RC[-3]-RC[-1] -> #VALUE! | T44: =RC[-8]+RC[-1] -> #VALUE! | U44: =(RC[-17]*RC[-16]-RC[-14]*RC[-13])/1000 -> #VALUE! | X44: =RC[-2]*RC[-10]/1000 -> #VALUE! | Y44: =(RC[-3]*RC[-11]-RC[-2]*RC[-9])/1000 -> #VALUE! | AD44: =VALUE(RC[-28]) -> #VALUE! | AE44: =IF(RC[22]=42,"*",IF(RC[22]=32,"",RC[22])) ->  | AF44: =RC[-29] -> 24 | AG44: =RC[-29] ->  | AH44: =RC[-29] ->  | AI44: =RC[-29] ->  | AJ44: =RC[-29] ->  | AK44: =RC[-29] ->  | AL44: =RC[-29] ->  | AM44: =RC[-29] -> #VALUE! | AN44: =RC[-29] ->  | AO44: =RC[-29] -> #VALUE! | AP44: =RC[-29] ->  | AQ44: =RC[-29] ->  | AR44: - | AS44: =RC[-30] ->  | AT44: =RC[-30] ->  | AU44: - | AV44: =RC[-31] -> #VALUE! | AW44: =RC[-31] ->  | AX44: =RC[-31] ->  | AY44: =RC[-31] -> #VALUE!
A45: =IF(RC[1]="","",DATEVALUE(RC[1])) ->  | C45: 24 | J45: =RC[-5]-RC[-2] -> #VALUE! | L45: =RC[9] -> #VALUE! | Q45: =RC[-3]-RC[-1] -> #VALUE! | T45: =RC[-8]+RC[-1] -> #VALUE! | U45: =(RC[-17]*RC[-16]-RC[-14]*RC[-13])/1000 -> #VALUE! | X45: =RC[-2]*RC[-10]/1000 -> #VALUE! | Y45: =(RC[-3]*RC[-11]-RC[-2]*RC[-9])/1000 -> #VALUE! | AD45: =VALUE(RC[-28]) -> #VALUE! | AE45: =IF(RC[22]=42,"*",IF(RC[22]=32,"",RC[22])) ->  | AF45: =RC[-29] -> 24 | AG45: =RC[-29] ->  | AH45: =RC[-29] ->  | AI45: =RC[-29] ->  | AJ45: =RC[-29] ->  | AK45: =RC[-29] ->  | AL45: =RC[-29] ->  | AM45: =RC[-29] -> #VALUE! | AN45: =RC[-29] ->  | AO45: =RC[-29] -> #VALUE! | AP45: =RC[-29] ->  | AQ45: =RC[-29] ->  | AR45: - | AS45: =RC[-30] ->  | AT45: =RC[-30] ->  | AU45: - | AV45: =RC[-31] -> #VALUE! | AW45: =RC[-31] ->  | AX45: =RC[-31] ->  | AY45: =RC[-31] -> #VALUE!
A46: =IF(RC[1]="","",DATEVALUE(RC[1])) ->  | C46: 24 | J46: =RC[-5]-RC[-2] -> #VALUE! | L46: =RC[9] -> #VALUE! | Q46: =RC[-3]-RC[-1] -> #VALUE! | T46: =RC[-8]+RC[-1] -> #VALUE! | U46: =(RC[-17]*RC[-16]-RC[-14]*RC[-13])/1000 -> #VALUE! | X46: =RC[-2]*RC[-10]/1000 -> #VALUE! | Y46: =(RC[-3]*RC[-11]-RC[-2]*RC[-9])/1000 -> #VALUE! | AD46: =VALUE(RC[-28]) -> #VALUE! | AE46: =IF(RC[22]=42,"*",IF(RC[22]=32,"",RC[22])) ->  | AF46: =RC[-29] -> 24 | AG46: =RC[-29] ->  | AH46: =RC[-29] ->  | AI46: =RC[-29] ->  | AJ46: =RC[-29] ->  | AK46: =RC[-29] ->  | AL46: =RC[-29] ->  | AM46: =RC[-29] -> #VALUE! | AN46: =RC[-29] ->  | AO46: =RC[-29] -> #VALUE! | AP46: =RC[-29] ->  | AQ46: =RC[-29] ->  | AR46: - | AS46: =RC[-30] ->  | AT46: =RC[-30] ->  | AU46: - | AV46: =RC[-31] -> #VALUE! | AW46: =RC[-31] ->  | AX46: =RC[-31] ->  | AY46: =RC[-31] -> #VALUE!
A47: =IF(RC[1]="","",DATEVALUE(RC[1])) ->  | C47: 24 | J47: =RC[-5]-RC[-2] -> #VALUE! | L47: =RC[9] -> #VALUE! | Q47: =RC[-3]-RC[-1] -> #VALUE! | T47: =RC[-8]+RC[-1] -> #VALUE! | U47: =(RC[-17]*RC[-16]-RC[-14]*RC[-13])/1000 -> #VALUE! | X47: =RC[-2]*RC[-10]/1000 -> #VALUE! | Y47: =(RC[-3]*RC[-11]-RC[-2]*RC[-9])/1000 -> #VALUE! | AD47: =VALUE(RC[-28]) -> #VALUE! | AE47: =IF(RC[22]=42,"*",IF(RC[22]=32,"",RC[22])) ->  | AF47: =RC[-29] -> 24 | AG47: =RC[-29] ->  | AH47: =RC[-29] ->  | AI47: =RC[-29] ->  | AJ47: =RC[-29] ->  | AK47: =RC[-29] ->  | AL47: =RC[-29] ->  | AM47: =RC[-29] -> #VALUE! | AN47: =RC[-29] ->  | AO47: =RC[-29] -> #VALUE! | AP47: =RC[-29] ->  | AQ47: =RC[-29] ->  | AR47: - | AS47: =RC[-30] ->  | AT47: =RC[-30] ->  | AU47: - | AV47: =RC[-31] -> #VALUE! | AW47: =RC[-31] ->  | AX47: =RC[-31] ->  | AY47: =RC[-31] -> #VALUE!
A48: =IF(RC[1]="","",DATEVALUE(RC[1])) ->  | C48: 24 | J48: =RC[-5]-RC[-2] -> #VALUE! | L48: =RC[9] -> #VALUE! | Q48: =RC[-3]-RC[-1] -> #VALUE! | T48: =RC[-8]+RC[-1] -> #VALUE! | U48: =(RC[-17]*RC[-16]-RC[-14]*RC[-13])/1000 -> #VALUE! | X48: =RC[-2]*RC[-10]/1000 -> #VALUE! | Y48: =(RC[-3]*RC[-11]-RC[-2]*RC[-9])/1000 -> #VALUE! | AD48: =VALUE(RC[-28]) -> #VALUE! | AE48: =IF(RC[22]=42,"*",IF(RC[22]=32,"",RC[22])) ->  | AF48: =RC[-29] -> 24 | AG48: =RC[-29] ->  | AH48: =RC[-29] ->  | AI48: =RC[-29] ->  | AJ48: =RC[-29] ->  | AK48: =RC[-29] ->  | AL48: =RC[-29] ->  | AM48: =RC[-29] -> #VALUE! | AN48: =RC[-29] ->  | AO48: =RC[-29] -> #VALUE! | AP48: =RC[-29] ->  | AQ48: =RC[-29] ->  | AR48: - | AS48: =RC[-30] ->  | AT48: =RC[-30] ->  | AU48: - | AV48: =RC[-31] -> #VALUE! | AW48: =RC[-31] ->  | AX48: =RC[-31] ->  | AY48: =RC[-31] -> #VALUE!
A49: =IF(RC[1]="","",DATEVALUE(RC[1])) ->  | C49: 24 | J49: =RC[-5]-RC[-2] -> #VALUE! | L49: =RC[9] -> #VALUE! | Q49: =RC[-3]-RC[-1] -> #VALUE! | T49: =RC[-8]+RC[-1] -> #VALUE! | U49: =(RC[-17]*RC[-16]-RC[-14]*RC[-13])/1000 -> #VALUE! | X49: =RC[-2]*RC[-10]/1000 -> #VALUE! | Y49: =(RC[-3]*RC[-11]-RC[-2]*RC[-9])/1000 -> #VALUE! | AD49: =VALUE(RC[-28]) -> #VALUE! | AE49: =IF(RC[22]=42,"*",IF(RC[22]=32,"",RC[22])) ->  | AF49: =RC[-29] -> 24 | AG49: =RC[-29] ->  | AH49: =RC[-29] ->  | AI49: =RC[-29] ->  | AJ49: =RC[-29] ->  | AK49: =RC[-29] ->  | AL49: =RC[-29] ->  | AM49: =RC[-29] -> #VALUE! | AN49: =RC[-29] ->  | AO49: =RC[-29] -> #VALUE! | AP49: =RC[-29] ->  | AQ49: =RC[-29] ->  | AR49: - | AS49: =RC[-30] ->  | AT49: =RC[-30] ->  | AU49: - | AV49: =RC[-31] -> #VALUE! | AW49: =RC[-31] ->  | AX49: =RC[-31] ->  | AY49: =RC[-31] -> #VALUE!
A50: =IF(RC[1]="","",DATEVALUE(RC[1])) ->  | C50: 24 | J50: =RC[-5]-RC[-2] -> #VALUE! | L50: =RC[9] -> #VALUE! | Q50: =RC[-3]-RC[-1] -> #VALUE! | T50: =RC[-8]+RC[-1] -> #VALUE! | U50: =(RC[-17]*RC[-16]-RC[-14]*RC[-13])/1000 -> #VALUE! | X50: =RC[-2]*RC[-10]/1000 -> #VALUE! | Y50: =(RC[-3]*RC[-11]-RC[-2]*RC[-9])/1000 -> #VALUE! | AD50: =VALUE(RC[-28]) -> #VALUE! | AE50: =IF(RC[22]=42,"*",IF(RC[22]=32,"",RC[22])) ->  | AF50: =RC[-29] -> 24 | AG50: =RC[-29] ->  | AH50: =RC[-29] ->  | AI50: =RC[-29] ->  | AJ50: =RC[-29] ->  | AK50: =RC[-29] ->  | AL50: =RC[-29] ->  | AM50: =RC[-29] -> #VALUE! | AN50: =RC[-29] ->  | AO50: =RC[-29] -> #VALUE! | AP50: =RC[-29] ->  | AQ50: =RC[-29] ->  | AR50: - | AS50: =RC[-30] ->  | AT50: =RC[-30] ->  | AU50: - | AV50: =RC[-31] -> #VALUE! | AW50: =RC[-31] ->  | AX50: =RC[-31] ->  | AY50: =RC[-31] -> #VALUE!
A51: =IF(RC[1]="","",DATEVALUE(RC[1])) ->  | C51: 24 | J51: =RC[-5]-RC[-2] -> #VALUE! | L51: =RC[9] -> #VALUE! | Q51: =RC[-3]-RC[-1] -> #VALUE! | T51: =RC[-8]+RC[-1] -> #VALUE! | U51: =(RC[-17]*RC[-16]-RC[-14]*RC[-13])/1000 -> #VALUE! | X51: =RC[-2]*RC[-10]/1000 -> #VALUE! | Y51: =(RC[-3]*RC[-11]-RC[-2]*RC[-9])/1000 -> #VALUE! | AD51: =VALUE(RC[-28]) -> #VALUE! | AE51: =IF(RC[22]=42,"*",IF(RC[22]=32,"",RC[22])) ->  | AF51: =RC[-29] -> 24 | AG51: =RC[-29] ->  | AH51: =RC[-29] ->  | AI51: =RC[-29] ->  | AJ51: =RC[-29] ->  | AK51: =RC[-29] ->  | AL51: =RC[-29] ->  | AM51: =RC[-29] -> #VALUE! | AN51: =RC[-29] ->  | AO51: =RC[-29] -> #VALUE! | AP51: =RC[-29] ->  | AQ51: =RC[-29] ->  | AR51: - | AS51: =RC[-30] ->  | AT51: =RC[-30] ->  | AU51: - | AV51: =RC[-31] -> #VALUE! | AW51: =RC[-31] ->  | AX51: =RC[-31] ->  | AY51: =RC[-31] -> #VALUE!
A52: =IF(RC[1]="","",DATEVALUE(RC[1])) ->  | C52: 24 | J52: =RC[-5]-RC[-2] -> #VALUE! | L52: =RC[9] -> #VALUE! | Q52: =RC[-3]-RC[-1] -> #VALUE! | T52: =RC[-8]+RC[-1] -> #VALUE! | U52: =(RC[-17]*RC[-16]-RC[-14]*RC[-13])/1000 -> #VALUE! | X52: =RC[-2]*RC[-10]/1000 -> #VALUE! | Y52: =(RC[-3]*RC[-11]-RC[-2]*RC[-9])/1000 -> #VALUE! | AD52: =VALUE(RC[-28]) -> #VALUE! | AE52: =IF(RC[22]=42,"*",IF(RC[22]=32,"",RC[22])) ->  | AF52: =RC[-29] -> 24 | AG52: =RC[-29] ->  | AH52: =RC[-29] ->  | AI52: =RC[-29] ->  | AJ52: =RC[-29] ->  | AK52: =RC[-29] ->  | AL52: =RC[-29] ->  | AM52: =RC[-29] -> #VALUE! | AN52: =RC[-29] ->  | AO52: =RC[-29] -> #VALUE! | AP52: =RC[-29] ->  | AQ52: =RC[-29] ->  | AR52: - | AS52: =RC[-30] ->  | AT52: =RC[-30] ->  | AU52: - | AV52: =RC[-31] -> #VALUE! | AW52: =RC[-31] ->  | AX52: =RC[-31] ->  | AY52: =RC[-31] -> #VALUE!
A53: =IF(RC[1]="","",DATEVALUE(RC[1])) ->  | C53: 24 | J53: =RC[-5]-RC[-2] -> #VALUE! | L53: =RC[9] -> #VALUE! | Q53: =RC[-3]-RC[-1] -> #VALUE! | T53: =RC[-8]+RC[-1] -> #VALUE! | U53: =(RC[-17]*RC[-16]-RC[-14]*RC[-13])/1000 -> #VALUE! | X53: =RC[-2]*RC[-10]/1000 -> #VALUE! | Y53: =(RC[-3]*RC[-11]-RC[-2]*RC[-9])/1000 -> #VALUE! | AD53: =VALUE(RC[-28]) -> #VALUE! | AE53: =IF(RC[22]=42,"*",IF(RC[22]=32,"",RC[22])) ->  | AF53: =RC[-29] -> 24 | AG53: =RC[-29] ->  | AH53: =RC[-29] ->  | AI53: =RC[-29] ->  | AJ53: =RC[-29] ->  | AK53: =RC[-29] ->  | AL53: =RC[-29] ->  | AM53: =RC[-29] -> #VALUE! | AN53: =RC[-29] ->  | AO53: =RC[-29] -> #VALUE! | AP53: =RC[-29] ->  | AQ53: =RC[-29] ->  | AR53: - | AS53: =RC[-30] ->  | AT53: =RC[-30] ->  | AU53: - | AV53: =RC[-31] -> #VALUE! | AW53: =RC[-31] ->  | AX53: =RC[-31] ->  | AY53: =RC[-31] -> #VALUE!
A54: =IF(RC[1]="","",DATEVALUE(RC[1])) ->  | C54: 24 | J54: =RC[-5]-RC[-2] -> #VALUE! | L54: =RC[9] -> #VALUE! | Q54: =RC[-3]-RC[-1] -> #VALUE! | T54: =RC[-8]+RC[-1] -> #VALUE! | U54: =(RC[-17]*RC[-16]-RC[-14]*RC[-13])/1000 -> #VALUE! | X54: =RC[-2]*RC[-10]/1000 -> #VALUE! | Y54: =(RC[-3]*RC[-11]-RC[-2]*RC[-9])/1000 -> #VALUE! | AD54: =VALUE(RC[-28]) -> #VALUE! | AE54: =IF(RC[22]=42,"*",IF(RC[22]=32,"",RC[22])) ->  | AF54: =RC[-29] -> 24 | AG54: =RC[-29] ->  | AH54: =RC[-29] ->  | AI54: =RC[-29] ->  | AJ54: =RC[-29] ->  | AK54: =RC[-29] ->  | AL54: =RC[-29] ->  | AM54: =RC[-29] -> #VALUE! | AN54: =RC[-29] ->  | AO54: =RC[-29] -> #VALUE! | AP54: =RC[-29] ->  | AQ54: =RC[-29] ->  | AR54: - | AS54: =RC[-30] ->  | AT54: =RC[-30] ->  | AU54: - | AV54: =RC[-31] -> #VALUE! | AW54: =RC[-31] ->  | AX54: =RC[-31] ->  | AY54: =RC[-31] -> #VALUE!
A55: =IF(RC[1]="","",DATEVALUE(RC[1])) ->  | C55: 24 | J55: =RC[-5]-RC[-2] -> #VALUE! | L55: =RC[9] -> #VALUE! | Q55: =RC[-3]-RC[-1] -> #VALUE! | T55: =RC[-8]+RC[-1] -> #VALUE! | U55: =(RC[-17]*RC[-16]-RC[-14]*RC[-13])/1000 -> #VALUE! | X55: =RC[-2]*RC[-10]/1000 -> #VALUE! | Y55: =(RC[-3]*RC[-11]-RC[-2]*RC[-9])/1000 -> #VALUE! | AD55: =VALUE(RC[-28]) -> #VALUE! | AE55: =IF(RC[22]=42,"*",IF(RC[22]=32,"",RC[22])) ->  | AF55: =RC[-29] -> 24 | AG55: =RC[-29] ->  | AH55: =RC[-29] ->  | AI55: =RC[-29] ->  | AJ55: =RC[-29] ->  | AK55: =RC[-29] ->  | AL55: =RC[-29] ->  | AM55: =RC[-29] -> #VALUE! | AN55: =RC[-29] ->  | AO55: =RC[-29] -> #VALUE! | AP55: =RC[-29] ->  | AQ55: =RC[-29] ->  | AR55: - | AS55: =RC[-30] ->  | AT55: =RC[-30] ->  | AU55: - | AV55: =RC[-31] -> #VALUE! | AW55: =RC[-31] ->  | AX55: =RC[-31] ->  | AY55: =RC[-31] -> #VALUE!
A56: =IF(RC[1]="","",DATEVALUE(RC[1])) ->  | C56: 24 | J56: =RC[-5]-RC[-2] -> #VALUE! | L56: =RC[9] -> #VALUE! | Q56: =RC[-3]-RC[-1] -> #VALUE! | T56: =RC[-8]+RC[-1] -> #VALUE! | U56: =(RC[-17]*RC[-16]-RC[-14]*RC[-13])/1000 -> #VALUE! | X56: =RC[-2]*RC[-10]/1000 -> #VALUE! | Y56: =(RC[-3]*RC[-11]-RC[-2]*RC[-9])/1000 -> #VALUE! | AD56: =VALUE(RC[-28]) -> #VALUE! | AE56: =IF(RC[22]=42,"*",IF(RC[22]=32,"",RC[22])) ->  | AF56: =RC[-29] -> 24 | AG56: =RC[-29] ->  | AH56: =RC[-29] ->  | AI56: =RC[-29] ->  | AJ56: =RC[-29] ->  | AK56: =RC[-29] ->  | AL56: =RC[-29] ->  | AM56: =RC[-29] -> #VALUE! | AN56: =RC[-29] ->  | AO56: =RC[-29] -> #VALUE! | AP56: =RC[-29] ->  | AQ56: =RC[-29] ->  | AR56: - | AS56: =RC[-30] ->  | AT56: =RC[-30] ->  | AU56: - | AV56: =RC[-31] -> #VALUE! | AW56: =RC[-31] ->  | AX56: =RC[-31] ->  | AY56: =RC[-31] -> #VALUE!
A57: =IF(RC[1]="","",DATEVALUE(RC[1])) ->  | C57: 24 | J57: =RC[-5]-RC[-2] -> #VALUE! | L57: =RC[9] -> #VALUE! | Q57: =RC[-3]-RC[-1] -> #VALUE! | T57: =RC[-8]+RC[-1] -> #VALUE! | U57: =(RC[-17]*RC[-16]-RC[-14]*RC[-13])/1000 -> #VALUE! | X57: =RC[-2]*RC[-10]/1000 -> #VALUE! | Y57: =(RC[-3]*RC[-11]-RC[-2]*RC[-9])/1000 -> #VALUE! | AD57: =VALUE(RC[-28]) -> #VALUE! | AE57: =IF(RC[22]=42,"*",IF(RC[22]=32,"",RC[22])) ->  | AF57: =RC[-29] -> 24 | AG57: =RC[-29] ->  | AH57: =RC[-29] ->  | AI57: =RC[-29] ->  | AJ57: =RC[-29] ->  | AK57: =RC[-29] ->  | AL57: =RC[-29] ->  | AM57: =RC[-29] -> #VALUE! | AN57: =RC[-29] ->  | AO57: =RC[-29] -> #VALUE! | AP57: =RC[-29] ->  | AQ57: =RC[-29] ->  | AR57: - | AS57: =RC[-30] ->  | AT57: =RC[-30] ->  | AU57: - | AV57: =RC[-31] -> #VALUE! | AW57: =RC[-31] ->  | AX57: =RC[-31] ->  | AY57: =RC[-31] -> #VALUE!
A58: =IF(RC[1]="","",DATEVALUE(RC[1])) ->  | C58: 24 | J58: =RC[-5]-RC[-2] -> #VALUE! | L58: =RC[9] -> #VALUE! | Q58: =RC[-3]-RC[-1] -> #VALUE! | T58: =RC[-8]+RC[-1] -> #VALUE! | U58: =(RC[-17]*RC[-16]-RC[-14]*RC[-13])/1000 -> #VALUE! | X58: =RC[-2]*RC[-10]/1000 -> #VALUE! | Y58: =(RC[-3]*RC[-11]-RC[-2]*RC[-9])/1000 -> #VALUE! | AD58: =VALUE(RC[-28]) -> #VALUE! | AE58: =IF(RC[22]=42,"*",IF(RC[22]=32,"",RC[22])) ->  | AF58: =RC[-29] -> 24 | AG58: =RC[-29] ->  | AH58: =RC[-29] ->  | AI58: =RC[-29] ->  | AJ58: =RC[-29] ->  | AK58: =RC[-29] ->  | AL58: =RC[-29] ->  | AM58: =RC[-29] -> #VALUE! | AN58: =RC[-29] ->  | AO58: =RC[-29] -> #VALUE! | AP58: =RC[-29] ->  | AQ58: =RC[-29] ->  | AR58: - | AS58: =RC[-30] ->  | AT58: =RC[-30] ->  | AU58: - | AV58: =RC[-31] -> #VALUE! | AW58: =RC[-31] ->  | AX58: =RC[-31] ->  | AY58: =RC[-31] -> #VALUE!
A59: =IF(RC[1]="","",DATEVALUE(RC[1])) ->  | C59: 24 | J59: =RC[-5]-RC[-2] -> #VALUE! | L59: =RC[9] -> #VALUE! | Q59: =RC[-3]-RC[-1] -> #VALUE! | T59: =RC[-8]+RC[-1] -> #VALUE! | U59: =(RC[-17]*RC[-16]-RC[-14]*RC[-13])/1000 -> #VALUE! | X59: =RC[-2]*RC[-10]/1000 -> #VALUE! | Y59: =(RC[-3]*RC[-11]-RC[-2]*RC[-9])/1000 -> #VALUE! | AD59: =VALUE(RC[-28]) -> #VALUE! | AE59: =IF(RC[22]=42,"*",IF(RC[22]=32,"",RC[22])) ->  | AF59: =RC[-29] -> 24 | AG59: =RC[-29] ->  | AH59: =RC[-29] ->  | AI59: =RC[-29] ->  | AJ59: =RC[-29] ->  | AK59: =RC[-29] ->  | AL59: =RC[-29] ->  | AM59: =RC[-29] -> #VALUE! | AN59: =RC[-29] ->  | AO59: =RC[-29] -> #VALUE! | AP59: =RC[-29] ->  | AQ59: =RC[-29] ->  | AR59: - | AS59: =RC[-30] ->  | AT59: =RC[-30] ->  | AU59: - | AV59: =RC[-31] -> #VALUE! | AW59: =RC[-31] ->  | AX59: =RC[-31] ->  | AY59: =RC[-31] -> #VALUE!
A60: =IF(RC[1]="","",DATEVALUE(RC[1])) ->  | C60: 24 | J60: =RC[-5]-RC[-2] -> #VALUE! | L60: =RC[9] -> #VALUE! | Q60: =RC[-3]-RC[-1] -> #VALUE! | T60: =RC[-8]+RC[-1] -> #VALUE! | U60: =(RC[-17]*RC[-16]-RC[-14]*RC[-13])/1000 -> #VALUE! | X60: =RC[-2]*RC[-10]/1000 -> #VALUE! | Y60: =(RC[-3]*RC[-11]-RC[-2]*RC[-9])/1000 -> #VALUE! | AD60: =VALUE(RC[-28]) -> #VALUE! | AE60: =IF(RC[22]=42,"*",IF(RC[22]=32,"",RC[22])) ->  | AF60: =RC[-29] -> 24 | AG60: =RC[-29] ->  | AH60: =RC[-29] ->  | AI60: =RC[-29] ->  | AJ60: =RC[-29] ->  | AK60: =RC[-29] ->  | AL60: =RC[-29] ->  | AM60: =RC[-29] -> #VALUE! | AN60: =RC[-29] ->  | AO60: =RC[-29] -> #VALUE! | AP60: =RC[-29] ->  | AQ60: =RC[-29] ->  | AR60: - | AS60: =RC[-30] ->  | AT60: =RC[-30] ->  | AU60: - | AV60: =RC[-31] -> #VALUE! | AW60: =RC[-31] ->  | AX60: =RC[-31] ->  | AY60: =RC[-31] -> #VALUE!
A61: =IF(RC[1]="","",DATEVALUE(RC[1])) ->  | C61: 24 | J61: =RC[-5]-RC[-2] -> #VALUE! | L61: =RC[9] -> #VALUE! | Q61: =RC[-3]-RC[-1] -> #VALUE! | T61: =RC[-8]+RC[-1] -> #VALUE! | U61: =(RC[-17]*RC[-16]-RC[-14]*RC[-13])/1000 -> #VALUE! | X61: =RC[-2]*RC[-10]/1000 -> #VALUE! | Y61: =(RC[-3]*RC[-11]-RC[-2]*RC[-9])/1000 -> #VALUE! | AD61: =VALUE(RC[-28]) -> #VALUE! | AE61: =IF(RC[22]=42,"*",IF(RC[22]=32,"",RC[22])) ->  | AF61: =RC[-29] -> 24 | AG61: =RC[-29] ->  | AH61: =RC[-29] ->  | AI61: =RC[-29] ->  | AJ61: =RC[-29] ->  | AK61: =RC[-29] ->  | AL61: =RC[-29] ->  | AM61: =RC[-29] -> #VALUE! | AN61: =RC[-29] ->  | AO61: =RC[-29] -> #VALUE! | AP61: =RC[-29] ->  | AQ61: =RC[-29] ->  | AR61: - | AS61: =RC[-30] ->  | AT61: =RC[-30] ->  | AU61: - | AV61: =RC[-31] -> #VALUE! | AW61: =RC[-31] ->  | AX61: =RC[-31] ->  | AY61: =RC[-31] -> #VALUE!
A62: =IF(RC[1]="","",DATEVALUE(RC[1])) ->  | C62: 24 | J62: =RC[-5]-RC[-2] -> #VALUE! | L62: =RC[9] -> #VALUE! | Q62: =RC[-3]-RC[-1] -> #VALUE! | T62: =RC[-8]+RC[-1] -> #VALUE! | U62: =(RC[-17]*RC[-16]-RC[-14]*RC[-13])/1000 -> #VALUE! | X62: =RC[-2]*RC[-10]/1000 -> #VALUE! | Y62: =(RC[-3]*RC[-11]-RC[-2]*RC[-9])/1000 -> #VALUE! | AD62: =VALUE(RC[-28]) -> #VALUE! | AE62: =IF(RC[22]=42,"*",IF(RC[22]=32,"",RC[22])) ->  | AF62: =RC[-29] -> 24 | AG62: =RC[-29] ->  | AH62: =RC[-29] ->  | AI62: =RC[-29] ->  | AJ62: =RC[-29] ->  | AK62: =RC[-29] ->  | AL62: =RC[-29] ->  | AM62: =RC[-29] -> #VALUE! | AN62: =RC[-29] ->  | AO62: =RC[-29] -> #VALUE! | AP62: =RC[-29] ->  | AQ62: =RC[-29] ->  | AR62: - | AS62: =RC[-30] ->  | AT62: =RC[-30] ->  | AU62: - | AV62: =RC[-31] -> #VALUE! | AW62: =RC[-31] ->  | AX62: =RC[-31] ->  | AY62: =RC[-31] -> #VALUE!
A63: =IF(RC[1]="","",DATEVALUE(RC[1])) ->  | C63: 24 | J63: =RC[-5]-RC[-2] -> #VALUE! | L63: =RC[9] -> #VALUE! | Q63: =RC[-3]-RC[-1] -> #VALUE! | T63: =RC[-8]+RC[-1] -> #VALUE! | U63: =(RC[-17]*RC[-16]-RC[-14]*RC[-13])/1000 -> #VALUE! | X63: =RC[-2]*RC[-10]/1000 -> #VALUE! | Y63: =(RC[-3]*RC[-11]-RC[-2]*RC[-9])/1000 -> #VALUE! | AD63: =VALUE(RC[-28]) -> #VALUE! | AE63: =IF(RC[22]=42,"*",IF(RC[22]=32,"",RC[22])) ->  | AF63: =RC[-29] -> 24 | AG63: =RC[-29] ->  | AH63: =RC[-29] ->  | AI63: =RC[-29] ->  | AJ63: =RC[-29] ->  | AK63: =RC[-29] ->  | AL63: =RC[-29] ->  | AM63: =RC[-29] -> #VALUE! | AN63: =RC[-29] ->  | AO63: =RC[-29] -> #VALUE! | AP63: =RC[-29] ->  | AQ63: =RC[-29] ->  | AR63: - | AS63: =RC[-30] ->  | AT63: =RC[-30] ->  | AU63: - | AV63: =RC[-31] -> #VALUE! | AW63: =RC[-31] ->  | AX63: =RC[-31] ->  | AY63: =RC[-31] -> #VALUE!
A64: =IF(RC[1]="","",DATEVALUE(RC[1])) ->  | C64: 24 | J64: =RC[-5]-RC[-2] -> #VALUE! | L64: =RC[9] -> #VALUE! | Q64: =RC[-3]-RC[-1] -> #VALUE! | T64: =RC[-8]+RC[-1] -> #VALUE! | U64: =(RC[-17]*RC[-16]-RC[-14]*RC[-13])/1000 -> #VALUE! | X64: =RC[-2]*RC[-10]/1000 -> #VALUE! | Y64: =(RC[-3]*RC[-11]-RC[-2]*RC[-9])/1000 -> #VALUE! | AD64: =VALUE(RC[-28]) -> #VALUE! | AE64: =IF(RC[22]=42,"*",IF(RC[22]=32,"",RC[22])) ->  | AF64: =RC[-29] -> 24 | AG64: =RC[-29] ->  | AH64: =RC[-29] ->  | AI64: =RC[-29] ->  | AJ64: =RC[-29] ->  | AK64: =RC[-29] ->  | AL64: =RC[-29] ->  | AM64: =RC[-29] -> #VALUE! | AN64: =RC[-29] ->  | AO64: =RC[-29] -> #VALUE! | AP64: =RC[-29] ->  | AQ64: =RC[-29] ->  | AR64: - | AS64: =RC[-30] ->  | AT64: =RC[-30] ->  | AU64: - | AV64: =RC[-31] -> #VALUE! | AW64: =RC[-31] ->  | AX64: =RC[-31] ->  | AY64: =RC[-31] -> #VALUE!
A65: =IF(RC[1]="","",DATEVALUE(RC[1])) ->  | C65: 24 | J65: =RC[-5]-RC[-2] -> #VALUE! | L65: =RC[9] -> #VALUE! | Q65: =RC[-3]-RC[-1] -> #VALUE! | T65: =RC[-8]+RC[-1] -> #VALUE! | U65: =(RC[-17]*RC[-16]-RC[-14]*RC[-13])/1000 -> #VALUE! | X65: =RC[-2]*RC[-10]/1000 -> #VALUE! | Y65: =(RC[-3]*RC[-11]-RC[-2]*RC[-9])/1000 -> #VALUE! | AD65: =VALUE(RC[-28]) -> #VALUE! | AE65: =IF(RC[22]=42,"*",IF(RC[22]=32,"",RC[22])) ->  | AF65: =RC[-29] -> 24 | AG65: =RC[-29] ->  | AH65: =RC[-29] ->  | AI65: =RC[-29] ->  | AJ65: =RC[-29] ->  | AK65: =RC[-29] ->  | AL65: =RC[-29] ->  | AM65: =RC[-29] -> #VALUE! | AN65: =RC[-29] ->  | AO65: =RC[-29] -> #VALUE! | AP65: =RC[-29] ->  | AQ65: =RC[-29] ->  | AR65: - | AS65: =RC[-30] ->  | AT65: =RC[-30] ->  | AU65: - | AV65: =RC[-31] -> #VALUE! | AW65: =RC[-31] ->  | AX65: =RC[-31] ->  | AY65: =RC[-31] -> #VALUE!
A66: =IF(RC[1]="","",DATEVALUE(RC[1])) ->  | C66: 24 | J66: =RC[-5]-RC[-2] -> #VALUE! | L66: =RC[9] -> #VALUE! | Q66: =RC[-3]-RC[-1] -> #VALUE! | T66: =RC[-8]+RC[-1] -> #VALUE! | U66: =(RC[-17]*RC[-16]-RC[-14]*RC[-13])/1000 -> #VALUE! | X66: =RC[-2]*RC[-10]/1000 -> #VALUE! | Y66: =(RC[-3]*RC[-11]-RC[-2]*RC[-9])/1000 -> #VALUE! | AD66: =VALUE(RC[-28]) -> #VALUE! | AE66: =IF(RC[22]=42,"*",IF(RC[22]=32,"",RC[22])) ->  | AF66: =RC[-29] -> 24 | AG66: =RC[-29] ->  | AH66: =RC[-29] ->  | AI66: =RC[-29] ->  | AJ66: =RC[-29] ->  | AK66: =RC[-29] ->  | AL66: =RC[-29] ->  | AM66: =RC[-29] -> #VALUE! | AN66: =RC[-29] ->  | AO66: =RC[-29] -> #VALUE! | AP66: =RC[-29] ->  | AQ66: =RC[-29] ->  | AR66: - | AS66: =RC[-30] ->  | AT66: =RC[-30] ->  | AU66: - | AV66: =RC[-31] -> #VALUE! | AW66: =RC[-31] ->  | AX66: =RC[-31] ->  | AY66: =RC[-31] -> #VALUE!
A67: =IF(RC[1]="","",DATEVALUE(RC[1])) ->  | C67: 24 | J67: =RC[-5]-RC[-2] -> #VALUE! | L67: =RC[9] -> #VALUE! | Q67: =RC[-3]-RC[-1] -> #VALUE! | T67: =RC[-8]+RC[-1] -> #VALUE! | U67: =(RC[-17]*RC[-16]-RC[-14]*RC[-13])/1000 -> #VALUE! | X67: =RC[-2]*RC[-10]/1000 -> #VALUE! | Y67: =(RC[-3]*RC[-11]-RC[-2]*RC[-9])/1000 -> #VALUE! | AD67: =VALUE(RC[-28]) -> #VALUE! | AE67: =IF(RC[22]=42,"*",IF(RC[22]=32,"",RC[22])) ->  | AF67: =RC[-29] -> 24 | AG67: =RC[-29] ->  | AH67: =RC[-29] ->  | AI67: =RC[-29] ->  | AJ67: =RC[-29] ->  | AK67: =RC[-29] ->  | AL67: =RC[-29] ->  | AM67: =RC[-29] -> #VALUE! | AN67: =RC[-29] ->  | AO67: =RC[-29] -> #VALUE! | AP67: =RC[-29] ->  | AQ67: =RC[-29] ->  | AR67: - | AS67: =RC[-30] ->  | AT67: =RC[-30] ->  | AU67: - | AV67: =RC[-31] -> #VALUE! | AW67: =RC[-31] ->  | AX67: =RC[-31] ->  | AY67: =RC[-31] -> #VALUE!
A68: =IF(RC[1]="","",DATEVALUE(RC[1])) ->  | C68: 24 | J68: =RC[-5]-RC[-2] -> #VALUE! | L68: =RC[9] -> #VALUE! | Q68: =RC[-3]-RC[-1] -> #VALUE! | T68: =RC[-8]+RC[-1] -> #VALUE! | U68: =(RC[-17]*RC[-16]-RC[-14]*RC[-13])/1000 -> #VALUE! | X68: =RC[-2]*RC[-10]/1000 -> #VALUE! | Y68: =(RC[-3]*RC[-11]-RC[-2]*RC[-9])/1000 -> #VALUE! | AD68: =VALUE(RC[-28]) -> #VALUE! | AE68: =IF(RC[22]=42,"*",IF(RC[22]=32,"",RC[22])) ->  | AF68: =RC[-29] -> 24 | AG68: =RC[-29] ->  | AH68: =RC[-29] ->  | AI68: =RC[-29] ->  | AJ68: =RC[-29] ->  | AK68: =RC[-29] ->  | AL68: =RC[-29] ->  | AM68: =RC[-29] -> #VALUE! | AN68: =RC[-29] ->  | AO68: =RC[-29] -> #VALUE! | AP68: =RC[-29] ->  | AQ68: =RC[-29] ->  | AR68: - | AS68: =RC[-30] ->  | AT68: =RC[-30] ->  | AU68: - | AV68: =RC[-31] -> #VALUE! | AW68: =RC[-31] ->  | AX68: =RC[-31] ->  | AY68: =RC[-31] -> #VALUE!
A69: =IF(RC[1]="","",DATEVALUE(RC[1])) ->  | C69: 24 | J69: =RC[-5]-RC[-2] -> #VALUE! | L69: =RC[9] -> #VALUE! | Q69: =RC[-3]-RC[-1] -> #VALUE! | T69: =RC[-8]+RC[-1] -> #VALUE! | U69: =(RC[-17]*RC[-16]-RC[-14]*RC[-13])/1000 -> #VALUE! | X69: =RC[-2]*RC[-10]/1000 -> #VALUE! | Y69: =(RC[-3]*RC[-11]-RC[-2]*RC[-9])/1000 -> #VALUE! | AD69: =VALUE(RC[-28]) -> #VALUE! | AE69: =IF(RC[22]=42,"*",IF(RC[22]=32,"",RC[22])) ->  | AF69: =RC[-29] -> 24 | AG69: =RC[-29] ->  | AH69: =RC[-29] ->  | AI69: =RC[-29] ->  | AJ69: =RC[-29] ->  | AK69: =RC[-29] ->  | AL69: =RC[-29] ->  | AM69: =RC[-29] -> #VALUE! | AN69: =RC[-29] ->  | AO69: =RC[-29] -> #VALUE! | AP69: =RC[-29] ->  | AQ69: =RC[-29] ->  | AR69: - | AS69: =RC[-30] ->  | AT69: =RC[-30] ->  | AU69: - | AV69: =RC[-31] -> #VALUE! | AW69: =RC[-31] ->  | AX69: =RC[-31] ->  | AY69: =RC[-31] -> #VALUE!
A70: =IF(RC[1]="","",DATEVALUE(RC[1])) ->  | C70: 24 | J70: =RC[-5]-RC[-2] -> #VALUE! | L70: =RC[9] -> #VALUE! | Q70: =RC[-3]-RC[-1] -> #VALUE! | T70: =RC[-8]+RC[-1] -> #VALUE! | U70: =(RC[-17]*RC[-16]-RC[-14]*RC[-13])/1000 -> #VALUE! | X70: =RC[-2]*RC[-10]/1000 -> #VALUE! | Y70: =(RC[-3]*RC[-11]-RC[-2]*RC[-9])/1000 -> #VALUE! | AD70: =VALUE(RC[-28]) -> #VALUE! | AE70: =IF(RC[22]=42,"*",IF(RC[22]=32,"",RC[22])) ->  | AF70: =RC[-29] -> 24 | AG70: =RC[-29] ->  | AH70: =RC[-29] ->  | AI70: =RC[-29] ->  | AJ70: =RC[-29] ->  | AK70: =RC[-29] ->  | AL70: =RC[-29] ->  | AM70: =RC[-29] -> #VALUE! | AN70: =RC[-29] ->  | AO70: =RC[-29] -> #VALUE! | AP70: =RC[-29] ->  | AQ70: =RC[-29] ->  | AR70: - | AS70: =RC[-30] ->  | AT70: =RC[-30] ->  | AU70: - | AV70: =RC[-31] -> #VALUE! | AW70: =RC[-31] ->  | AX70: =RC[-31] ->  | AY70: =RC[-31] -> #VALUE!
A71: =IF(RC[1]="","",DATEVALUE(RC[1])) ->  | C71: 24 | J71: =RC[-5]-RC[-2] -> #VALUE! | L71: =RC[9] -> #VALUE! | Q71: =RC[-3]-RC[-1] -> #VALUE! | T71: =RC[-8]+RC[-1] -> #VALUE! | U71: =(RC[-17]*RC[-16]-RC[-14]*RC[-13])/1000 -> #VALUE! | X71: =RC[-2]*RC[-10]/1000 -> #VALUE! | Y71: =(RC[-3]*RC[-11]-RC[-2]*RC[-9])/1000 -> #VALUE! | AD71: =VALUE(RC[-28]) -> #VALUE! | AE71: =IF(RC[22]=42,"*",IF(RC[22]=32,"",RC[22])) ->  | AF71: =RC[-29] -> 24 | AG71: =RC[-29] ->  | AH71: =RC[-29] ->  | AI71: =RC[-29] ->  | AJ71: =RC[-29] ->  | AK71: =RC[-29] ->  | AL71: =RC[-29] ->  | AM71: =RC[-29] -> #VALUE! | AN71: =RC[-29] ->  | AO71: =RC[-29] -> #VALUE! | AP71: =RC[-29] ->  | AQ71: =RC[-29] ->  | AR71: - | AS71: =RC[-30] ->  | AT71: =RC[-30] ->  | AU71: - | AV71: =RC[-31] -> #VALUE! | AW71: =RC[-31] ->  | AX71: =RC[-31] ->  | AY71: =RC[-31] -> #VALUE!
A72: =IF(RC[1]="","",DATEVALUE(RC[1])) ->  | C72: 24 | J72: =RC[-5]-RC[-2] -> #VALUE! | L72: =RC[9] -> #VALUE! | Q72: =RC[-3]-RC[-1] -> #VALUE! | T72: =RC[-8]+RC[-1] -> #VALUE! | U72: =(RC[-17]*RC[-16]-RC[-14]*RC[-13])/1000 -> #VALUE! | X72: =RC[-2]*RC[-10]/1000 -> #VALUE! | Y72: =(RC[-3]*RC[-11]-RC[-2]*RC[-9])/1000 -> #VALUE! | AD72: =VALUE(RC[-28]) -> #VALUE! | AE72: =IF(RC[22]=42,"*",IF(RC[22]=32,"",RC[22])) ->  | AF72: =RC[-29] -> 24 | AG72: =RC[-29] ->  | AH72: =RC[-29] ->  | AI72: =RC[-29] ->  | AJ72: =RC[-29] ->  | AK72: =RC[-29] ->  | AL72: =RC[-29] ->  | AM72: =RC[-29] -> #VALUE! | AN72: =RC[-29] ->  | AO72: =RC[-29] -> #VALUE! | AP72: =RC[-29] ->  | AQ72: =RC[-29] ->  | AR72: - | AS72: =RC[-30] ->  | AT72: =RC[-30] ->  | AU72: - | AV72: =RC[-31] -> #VALUE! | AW72: =RC[-31] ->  | AX72: =RC[-31] ->  | AY72: =RC[-31] -> #VALUE!
A73: =IF(RC[1]="","",DATEVALUE(RC[1])) ->  | C73: 24 | J73: =RC[-5]-RC[-2] -> #VALUE! | L73: =RC[9] -> #VALUE! | Q73: =RC[-3]-RC[-1] -> #VALUE! | T73: =RC[-8]+RC[-1] -> #VALUE! | U73: =(RC[-17]*RC[-16]-RC[-14]*RC[-13])/1000 -> #VALUE! | X73: =RC[-2]*RC[-10]/1000 -> #VALUE! | Y73: =(RC[-3]*RC[-11]-RC[-2]*RC[-9])/1000 -> #VALUE! | AD73: =VALUE(RC[-28]) -> #VALUE! | AE73: =IF(RC[22]=42,"*",IF(RC[22]=32,"",RC[22])) ->  | AF73: =RC[-29] -> 24 | AG73: =RC[-29] ->  | AH73: =RC[-29] ->  | AI73: =RC[-29] ->  | AJ73: =RC[-29] ->  | AK73: =RC[-29] ->  | AL73: =RC[-29] ->  | AM73: =RC[-29] -> #VALUE! | AN73: =RC[-29] ->  | AO73: =RC[-29] -> #VALUE! | AP73: =RC[-29] ->  | AQ73: =RC[-29] ->  | AR73: - | AS73: =RC[-30] ->  | AT73: =RC[-30] ->  | AU73: - | AV73: =RC[-31] -> #VALUE! | AW73: =RC[-31] ->  | AX73: =RC[-31] ->  | AY73: =RC[-31] -> #VALUE!
A74: =IF(RC[1]="","",DATEVALUE(RC[1])) ->  | C74: 24 | J74: =RC[-5]-RC[-2] -> #VALUE! | L74: =RC[9] -> #VALUE! | Q74: =RC[-3]-RC[-1] -> #VALUE! | T74: =RC[-8]+RC[-1] -> #VALUE! | U74: =(RC[-17]*RC[-16]-RC[-14]*RC[-13])/1000 -> #VALUE! | X74: =RC[-2]*RC[-10]/1000 -> #VALUE! | Y74: =(RC[-3]*RC[-11]-RC[-2]*RC[-9])/1000 -> #VALUE! | AD74: =VALUE(RC[-28]) -> #VALUE! | AE74: =IF(RC[22]=42,"*",IF(RC[22]=32,"",RC[22])) ->  | AF74: =RC[-29] -> 24 | AG74: =RC[-29] ->  | AH74: =RC[-29] ->  | AI74: =RC[-29] ->  | AJ74: =RC[-29] ->  | AK74: =RC[-29] ->  | AL74: =RC[-29] ->  | AM74: =RC[-29] -> #VALUE! | AN74: =RC[-29] ->  | AO74: =RC[-29] -> #VALUE! | AP74: =RC[-29] ->  | AQ74: =RC[-29] ->  | AR74: - | AS74: =RC[-30] ->  | AT74: =RC[-30] ->  | AU74: - | AV74: =RC[-31] -> #VALUE! | AW74: =RC[-31] ->  | AX74: =RC[-31] ->  | AY74: =RC[-31] -> #VALUE!
A75: =IF(RC[1]="","",DATEVALUE(RC[1])) ->  | C75: 24 | J75: =RC[-5]-RC[-2] -> #VALUE! | L75: =RC[9] -> #VALUE! | Q75: =RC[-3]-RC[-1] -> #VALUE! | T75: =RC[-8]+RC[-1] -> #VALUE! | U75: =(RC[-17]*RC[-16]-RC[-14]*RC[-13])/1000 -> #VALUE! | X75: =RC[-2]*RC[-10]/1000 -> #VALUE! | Y75: =(RC[-3]*RC[-11]-RC[-2]*RC[-9])/1000 -> #VALUE! | AD75: =VALUE(RC[-28]) -> #VALUE! | AE75: =IF(RC[22]=42,"*",IF(RC[22]=32,"",RC[22])) ->  | AF75: =RC[-29] -> 24 | AG75: =RC[-29] ->  | AH75: =RC[-29] ->  | AI75: =RC[-29] ->  | AJ75: =RC[-29] ->  | AK75: =RC[-29] ->  | AL75: =RC[-29] ->  | AM75: =RC[-29] -> #VALUE! | AN75: =RC[-29] ->  | AO75: =RC[-29] -> #VALUE! | AP75: =RC[-29] ->  | AQ75: =RC[-29] ->  | AR75: - | AS75: =RC[-30] ->  | AT75: =RC[-30] ->  | AU75: - | AV75: =RC[-31] -> #VALUE! | AW75: =RC[-31] ->  | AX75: =RC[-31] ->  | AY75: =RC[-31] -> #VALUE!
A76: =IF(RC[1]="","",DATEVALUE(RC[1])) ->  | C76: 24 | J76: =RC[-5]-RC[-2] -> #VALUE! | L76: =RC[9] -> #VALUE! | Q76: =RC[-3]-RC[-1] -> #VALUE! | T76: =RC[-8]+RC[-1] -> #VALUE! | U76: =(RC[-17]*RC[-16]-RC[-14]*RC[-13])/1000 -> #VALUE! | X76: =RC[-2]*RC[-10]/1000 -> #VALUE! | Y76: =(RC[-3]*RC[-11]-RC[-2]*RC[-9])/1000 -> #VALUE! | AD76: =VALUE(RC[-28]) -> #VALUE! | AE76: =IF(RC[22]=42,"*",IF(RC[22]=32,"",RC[22])) ->  | AF76: =RC[-29] -> 24 | AG76: =RC[-29] ->  | AH76: =RC[-29] ->  | AI76: =RC[-29] ->  | AJ76: =RC[-29] ->  | AK76: =RC[-29] ->  | AL76: =RC[-29] ->  | AM76: =RC[-29] -> #VALUE! | AN76: =RC[-29] ->  | AO76: =RC[-29] -> #VALUE! | AP76: =RC[-29] ->  | AQ76: =RC[-29] ->  | AR76: - | AS76: =RC[-30] ->  | AT76: =RC[-30] ->  | AU76: - | AV76: =RC[-31] -> #VALUE! | AW76: =RC[-31] ->  | AX76: =RC[-31] ->  | AY76: =RC[-31] -> #VALUE!
A77: =IF(RC[1]="","",DATEVALUE(RC[1])) ->  | C77: 24 | J77: =RC[-5]-RC[-2] -> #VALUE! | L77: =RC[9] -> #VALUE! | Q77: =RC[-3]-RC[-1] -> #VALUE! | T77: =RC[-8]+RC[-1] -> #VALUE! | U77: =(RC[-17]*RC[-16]-RC[-14]*RC[-13])/1000 -> #VALUE! | X77: =RC[-2]*RC[-10]/1000 -> #VALUE! | Y77: =(RC[-3]*RC[-11]-RC[-2]*RC[-9])/1000 -> #VALUE! | AD77: =VALUE(RC[-28]) -> #VALUE! | AE77: =IF(RC[22]=42,"*",IF(RC[22]=32,"",RC[22])) ->  | AF77: =RC[-29] -> 24 | AG77: =RC[-29] ->  | AH77: =RC[-29] ->  | AI77: =RC[-29] ->  | AJ77: =RC[-29] ->  | AK77: =RC[-29] ->  | AL77: =RC[-29] ->  | AM77: =RC[-29] -> #VALUE! | AN77: =RC[-29] ->  | AO77: =RC[-29] -> #VALUE! | AP77: =RC[-29] ->  | AQ77: =RC[-29] ->  | AR77: - | AS77: =RC[-30] ->  | AT77: =RC[-30] ->  | AU77: - | AV77: =RC[-31] -> #VALUE! | AW77: =RC[-31] ->  | AX77: =RC[-31] ->  | AY77: =RC[-31] -> #VALUE!
A78: =IF(RC[1]="","",DATEVALUE(RC[1])) ->  | C78: 24 | J78: =RC[-5]-RC[-2] -> #VALUE! | L78: =RC[9] -> #VALUE! | Q78: =RC[-3]-RC[-1] -> #VALUE! | T78: =RC[-8]+RC[-1] -> #VALUE! | U78: =(RC[-17]*RC[-16]-RC[-14]*RC[-13])/1000 -> #VALUE! | X78: =RC[-2]*RC[-10]/1000 -> #VALUE! | Y78: =(RC[-3]*RC[-11]-RC[-2]*RC[-9])/1000 -> #VALUE! | AD78: =VALUE(RC[-28]) -> #VALUE! | AE78: =IF(RC[22]=42,"*",IF(RC[22]=32,"",RC[22])) ->  | AF78: =RC[-29] -> 24 | AG78: =RC[-29] ->  | AH78: =RC[-29] ->  | AI78: =RC[-29] ->  | AJ78: =RC[-29] ->  | AK78: =RC[-29] ->  | AL78: =RC[-29] ->  | AM78: =RC[-29] -> #VALUE! | AN78: =RC[-29] ->  | AO78: =RC[-29] -> #VALUE! | AP78: =RC[-29] ->  | AQ78: =RC[-29] ->  | AR78: - | AS78: =RC[-30] ->  | AT78: =RC[-30] ->  | AU78: - | AV78: =RC[-31] -> #VALUE! | AW78: =RC[-31] ->  | AX78: =RC[-31] ->  | AY78: =RC[-31] -> #VALUE!
A79: =IF(RC[1]="","",DATEVALUE(RC[1])) ->  | C79: 24 | J79: =RC[-5]-RC[-2] -> #VALUE! | L79: =RC[9] -> #VALUE! | Q79: =RC[-3]-RC[-1] -> #VALUE! | T79: =RC[-8]+RC[-1] -> #VALUE! | U79: =(RC[-17]*RC[-16]-RC[-14]*RC[-13])/1000 -> #VALUE! | X79: =RC[-2]*RC[-10]/1000 -> #VALUE! | Y79: =(RC[-3]*RC[-11]-RC[-2]*RC[-9])/1000 -> #VALUE! | AD79: =VALUE(RC[-28]) -> #VALUE! | AE79: =IF(RC[22]=42,"*",IF(RC[22]=32,"",RC[22])) ->  | AF79: =RC[-29] -> 24 | AG79: =RC[-29] ->  | AH79: =RC[-29] ->  | AI79: =RC[-29] ->  | AJ79: =RC[-29] ->  | AK79: =RC[-29] ->  | AL79: =RC[-29] ->  | AM79: =RC[-29] -> #VALUE! | AN79: =RC[-29] ->  | AO79: =RC[-29] -> #VALUE! | AP79: =RC[-29] ->  | AQ79: =RC[-29] ->  | AR79: - | AS79: =RC[-30] ->  | AT79: =RC[-30] ->  | AU79: - | AV79: =RC[-31] -> #VALUE! | AW79: =RC[-31] ->  | AX79: =RC[-31] ->  | AY79: =RC[-31] -> #VALUE!
A80: =IF(RC[1]="","",DATEVALUE(RC[1])) ->  | C80: 24 | J80: =RC[-5]-RC[-2] -> #VALUE! | L80: =RC[9] -> #VALUE! | Q80: =RC[-3]-RC[-1] -> #VALUE! | T80: =RC[-8]+RC[-1] -> #VALUE! | U80: =(RC[-17]*RC[-16]-RC[-14]*RC[-13])/1000 -> #VALUE! | X80: =RC[-2]*RC[-10]/1000 -> #VALUE! | Y80: =(RC[-3]*RC[-11]-RC[-2]*RC[-9])/1000 -> #VALUE! | AD80: =VALUE(RC[-28]) -> #VALUE! | AE80: =IF(RC[22]=42,"*",IF(RC[22]=32,"",RC[22])) ->  | AF80: =RC[-29] -> 24 | AG80: =RC[-29] ->  | AH80: =RC[-29] ->  | AI80: =RC[-29] ->  | AJ80: =RC[-29] ->  | AK80: =RC[-29] ->  | AL80: =RC[-29] ->  | AM80: =RC[-29] -> #VALUE! | AN80: =RC[-29] ->  | AO80: =RC[-29] -> #VALUE! | AP80: =RC[-29] ->  | AQ80: =RC[-29] ->  | AR80: - | AS80: =RC[-30] ->  | AT80: =RC[-30] ->  | AU80: - | AV80: =RC[-31] -> #VALUE! | AW80: =RC[-31] ->  | AX80: =RC[-31] ->  | AY80: =RC[-31] -> #VALUE!
A81: =IF(RC[1]="","",DATEVALUE(RC[1])) ->  | C81: 24 | J81: =RC[-5]-RC[-2] -> #VALUE! | L81: =RC[9] -> #VALUE! | Q81: =RC[-3]-RC[-1] -> #VALUE! | T81: =RC[-8]+RC[-1] -> #VALUE! | U81: =(RC[-17]*RC[-16]-RC[-14]*RC[-13])/1000 -> #VALUE! | X81: =RC[-2]*RC[-10]/1000 -> #VALUE! | Y81: =(RC[-3]*RC[-11]-RC[-2]*RC[-9])/1000 -> #VALUE! | AD81: =VALUE(RC[-28]) -> #VALUE! | AE81: =IF(RC[22]=42,"*",IF(RC[22]=32,"",RC[22])) ->  | AF81: =RC[-29] -> 24 | AG81: =RC[-29] ->  | AH81: =RC[-29] ->  | AI81: =RC[-29] ->  | AJ81: =RC[-29] ->  | AK81: =RC[-29] ->  | AL81: =RC[-29] ->  | AM81: =RC[-29] -> #VALUE! | AN81: =RC[-29] ->  | AO81: =RC[-29] -> #VALUE! | AP81: =RC[-29] ->  | AQ81: =RC[-29] ->  | AR81: - | AS81: =RC[-30] ->  | AT81: =RC[-30] ->  | AU81: - | AV81: =RC[-31] -> #VALUE! | AW81: =RC[-31] ->  | AX81: =RC[-31] ->  | AY81: =RC[-31] -> #VALUE!
A82: =IF(RC[1]="","",DATEVALUE(RC[1])) ->  | C82: 24 | J82: =RC[-5]-RC[-2] -> #VALUE! | L82: =RC[9] -> #VALUE! | Q82: =RC[-3]-RC[-1] -> #VALUE! | T82: =RC[-8]+RC[-1] -> #VALUE! | U82: =(RC[-17]*RC[-16]-RC[-14]*RC[-13])/1000 -> #VALUE! | X82: =RC[-2]*RC[-10]/1000 -> #VALUE! | Y82: =(RC[-3]*RC[-11]-RC[-2]*RC[-9])/1000 -> #VALUE! | AD82: =VALUE(RC[-28]) -> #VALUE! | AE82: =IF(RC[22]=42,"*",IF(RC[22]=32,"",RC[22])) ->  | AF82: =RC[-29] -> 24 | AG82: =RC[-29] ->  | AH82: =RC[-29] ->  | AI82: =RC[-29] ->  | AJ82: =RC[-29] ->  | AK82: =RC[-29] ->  | AL82: =RC[-29] ->  | AM82: =RC[-29] -> #VALUE! | AN82: =RC[-29] ->  | AO82: =RC[-29] -> #VALUE! | AP82: =RC[-29] ->  | AQ82: =RC[-29] ->  | AR82: - | AS82: =RC[-30] ->  | AT82: =RC[-30] ->  | AU82: - | AV82: =RC[-31] -> #VALUE! | AW82: =RC[-31] ->  | AX82: =RC[-31] ->  | AY82: =RC[-31] -> #VALUE!
A83: =IF(RC[1]="","",DATEVALUE(RC[1])) ->  | C83: 24 | J83: =RC[-5]-RC[-2] -> #VALUE! | L83: =RC[9] -> #VALUE! | Q83: =RC[-3]-RC[-1] -> #VALUE! | T83: =RC[-8]+RC[-1] -> #VALUE! | U83: =(RC[-17]*RC[-16]-RC[-14]*RC[-13])/1000 -> #VALUE! | X83: =RC[-2]*RC[-10]/1000 -> #VALUE! | Y83: =(RC[-3]*RC[-11]-RC[-2]*RC[-9])/1000 -> #VALUE! | AD83: =VALUE(RC[-28]) -> #VALUE! | AE83: =IF(RC[22]=42,"*",IF(RC[22]=32,"",RC[22])) ->  | AF83: =RC[-29] -> 24 | AG83: =RC[-29] ->  | AH83: =RC[-29] ->  | AI83: =RC[-29] ->  | AJ83: =RC[-29] ->  | AK83: =RC[-29] ->  | AL83: =RC[-29] ->  | AM83: =RC[-29] -> #VALUE! | AN83: =RC[-29] ->  | AO83: =RC[-29] -> #VALUE! | AP83: =RC[-29] ->  | AQ83: =RC[-29] ->  | AR83: - | AS83: =RC[-30] ->  | AT83: =RC[-30] ->  | AU83: - | AV83: =RC[-31] -> #VALUE! | AW83: =RC[-31] ->  | AX83: =RC[-31] ->  | AY83: =RC[-31] -> #VALUE!
AD84: Среднее | AG84: =R[1]C[-29] -> 195.92863330000006 | AH84: =R[1]C[-29] -> 50.4267617 | AI84: =R[1]C[-29] -> 6.53 | AJ84: =R[1]C[-29] -> 198.49392983333334 | AK84: =R[1]C[-29] -> 41.179006799999996 | AL84: =R[1]C[-29] -> 4.4300000000000033 | AM84: =R[1]C[-29] -> 9.2477549000000039 | AN84: =R[1]C[-29] -> -2.6367445000000007 | AP84: =R[1]C[-29] -> 55.238980166666664 | AQ84: =R[1]C[-29] -> 63.802523099999995 | AS84: =R[1]C[-30] -> 40.322145233333337 | AT84: =R[1]C[-30] -> 51.140408266666668 | AU84: - | AV84: =R[1]C[-31] -> 12.662114833333327
B85: Среднее | D85: =AVERAGE(OFFSET(R[-74]C,3,0,R7C1,1)) -> 195.92863330000006 | E85: =IF(SUM(OFFSET(R[-74]C,3,0,R7C1,1))=0,0,AVERAGE(OFFSET(R[-74]C,3,0,R7C1,1))) -> 50.4267617 | F85: =IF(SUM(OFFSET(R[-74]C,3,0,R7C1,1))=0,0,AVERAGE(OFFSET(R[-74]C,3,0,R7C1,1))) -> 6.53 | G85: =AVERAGE(OFFSET(R[-74]C,3,0,R7C1,1)) -> 198.49392983333334 | H85: =IF(SUM(OFFSET(R[-74]C,3,0,R7C1,1))=0,0,AVERAGE(OFFSET(R[-74]C,3,0,R7C1,1))) -> 41.179006799999996 | I85: =IF(SUM(OFFSET(R[-74]C,3,0,R7C1,1))=0,0,AVERAGE(OFFSET(R[-74]C,3,0,R7C1,1))) -> 4.4300000000000033 | J85: =RC[-5]-RC[-2] -> 9.2477549000000039 | K85: =AVERAGE(OFFSET(R[-74]C,3,0,R7C1,1)) -> -2.6367445000000007 | L85: =AVERAGE(OFFSET(R[-74]C,3,0,R7C1,1)) -> 2.0022110460331648 | M85: =AVERAGE(OFFSET(R[-74]C,3,0,R7C1,1)) -> 55.238980166666664 | N85: =IF(SUM(OFFSET(R[-74]C,3,0,R7C1,1))=0,0,AVERAGE(OFFSET(R[-74]C,3,0,R7C1,1))) -> 63.802523099999995 | O85: =AVERAGE(OFFSET(R[-74]C,3,0,R7C1,1)) -> 40.322145233333337 | P85: =IF(SUM(OFFSET(R[-74]C,3,0,R7C1,1))=0,0,AVERAGE(OFFSET(R[-74]C,3,0,R7C1,1))) -> 51.140408266666668 | Q85: =RC[-3]-RC[-1] -> 12.662114833333327 | R85: =AVERAGE(OFFSET(R[-74]C,3,0,R7C1,1)) -> 14.916834933333332 | S85: =AVERAGE(OFFSET(R[-74]C,3,0,R7C1,1)) -> 1.4221467333333331 | T85: =AVERAGE(OFFSET(R[-74]C,3,0,R7C1,1)) -> 3.4243577793664981 | U85: =AVERAGE(OFFSET(R[-74]C,3,0,R7C1,1)) -> 2.0022110460331648 | X85: =AVERAGE(OFFSET(R[-74]C,3,0,R7C1,1)) -> 3.4569923333590609 | Y85: =AVERAGE(OFFSET(R[-74]C,3,0,R7C1,1)) -> 1.420630864492707 | AD85: Итого | AF85: =R[1]C[-29] -> 720 | AG85: =R[1]C[-29] -> 5877.8589990000019 | AJ85: =R[1]C[-29] -> 5954.8178950000001 | AN85: =R[1]C[-29] -> -79.102335000000025 | AO85: =R[1]C[-29] -> 60.066331380994939 | AP85: =R[1]C[-29] -> 1657.1694049999999 | AS85: =R[1]C[-30] -> 1209.6643570000001 | AW85: =R[1]C[-31] -> 447.50504799999999 | AX85: =R[1]C[-31] -> 42.664401999999995 | AY85: =R[1]C[-31] -> 102.73073338099495
B86: ИТОГО: | C86: =SUM(OFFSET(R[-75]C,3,0,R7C1,1)) -> 720 | D86: =SUM(OFFSET(R[-75]C,3,0,R7C1,1)) -> 5877.8589990000019 | G86: =SUM(OFFSET(R[-75]C,3,0,R7C1,1)) -> 5954.8178950000001 | K86: =SUM(OFFSET(R[-75]C,3,0,R7C1,1)) -> -79.102335000000025 | L86: =SUM(OFFSET(R[-75]C,3,0,R7C1,1)) -> 60.066331380994939 | M86: =SUM(OFFSET(R[-75]C,3,0,R7C1,1)) -> 1657.1694049999999 | O86: =SUM(OFFSET(R[-75]C,3,0,R7C1,1)) -> 1209.6643570000001 | R86: =SUM(OFFSET(R[-75]C,3,0,R7C1,1)) -> 447.50504799999999 | S86: =SUM(OFFSET(R[-75]C,3,0,R7C1,1)) -> 42.664401999999995 | T86: =SUM(OFFSET(R[-75]C,3,0,R7C1,1)) -> 102.73073338099495 | U86: =SUM(OFFSET(R[-75]C,3,0,R7C1,1)) -> 60.066331380994939 | X86: =SUM(OFFSET(R[-75]C,3,0,R7C1,1)) -> 103.70977000077183 | Y86: =SUM(OFFSET(R[-75]C,3,0,R7C1,1)) -> 42.61892593478121
AD87: Досчёт по среднему до конца месяца | AG87: =R[1]C[-29] -> 0 | AJ87: =R[1]C[-29] -> 0 | AN87: =R[1]C[-29] -> 0 | AO87: =R[1]C[-29] -> 0 | AP87: =R[1]C[-29] -> 0 | AS87: =R[1]C[-30] -> 0 | AW87: =R[1]C[-31] -> 0 | AX87: =R[1]C[-31] -> 0 | AY87: =R[1]C[-31] -> 0
A88: 11дн=264ч 4дн=96ч | B88: Досчёт до конца м-ца (+) | C88: =R[-82]C[-2]*24 -> 216 | U88: № 13671 | AD88: Снятие досчёта по среднему предыдущего отчёта | AG88: =-R[1]C[-29] -> 0 | AJ88: =-R[1]C[-29] -> 0 | AN88: =-R[1]C[-29] -> 0 | AO88: =-R[1]C[-29] -> 0 | AP88: =-R[1]C[-29] -> 0 | AS88: =-R[1]C[-30] -> 0 | AW88: =-R[1]C[-31] -> 0 | AX88: =-R[1]C[-31] -> 0 | AY88: =-R[1]C[-31] -> 0
A89: 9дн=216ч 7дн=168ч | B89: Вычет с предыдущего (-) | C89: =R[-85]C[-2]*24 -> 192 | AD89: Сумма: | AG89: =R[1]C[-29] -> 5877.8589990000019 | AJ89: =R[1]C[-29] -> 5954.8178950000001 | AN89: =R[1]C[-29] -> -79.102335000000025 | AO89: =R[1]C[-29] -> 60.066331380994939 | AP89: =R[1]C[-29] -> 1657.1694049999999 | AS89: =R[1]C[-30] -> 1209.6643570000001 | AW89: =R[1]C[-31] -> 447.50504799999999 | AX89: =R[1]C[-31] -> 42.664401999999995 | AY89: =R[1]C[-31] -> 102.73073338099495
B90: СУММА: | C90: =R[-4]C+R[-2]C-R[-1]C -> 744 | D90: =R[-4]C+R[-2]C-R[-1]C -> 5877.8589990000019 | G90: =R[-4]C+R[-2]C-R[-1]C -> 5954.8178950000001 | K90: =R[-4]C+R[-2]C-R[-1]C -> -79.102335000000025 | L90: =R[-4]C+R[-2]C-R[-1]C -> 60.066331380994939 | M90: =R[-4]C+R[-2]C-R[-1]C -> 1657.1694049999999 | O90: =R[-4]C+R[-2]C-R[-1]C -> 1209.6643570000001 | R90: =R[-4]C+R[-2]C-R[-1]C -> 447.50504799999999 | S90: =R[-4]C+R[-2]C-R[-1]C -> 42.664401999999995 | T90: =R[-4]C+R[-2]C-R[-1]C -> 102.73073338099495 | AD90: Тхв на источнике | AE90: 0 | AF90: V гвс (м3) | AG90: =R[-1]C[16] -> 447.50504799999999 | AH90: W гвс (Гкал) | AI90: =RC[-2]*0.06 -> 26.850302879999997 | AJ90: W без гвс (Гкал) | AK90: =R[-1]C[4] -> 60.066331380994939
AD91: =R[-90]C[-17] -> з.н д. №02/147-2783 от 04.10.18
B93: Дата, время | D93: М1, т | F93: М2, т | H93: М3, т | J93: М4, т | L93: Qо, Гкал | N93: Qг, Гкал | P93: время, час
B94: 22.09.18 23:00 | D94: 158377.21 | F94: 156724.72 | H94: 169483.36 | J94: 169352.31 | L94: 3000.5219999999999 | N94: 2886.9140000000002 | P94: -
B95: 22.10.18 22:00 | D95: 162249.04999999999 | F95: 160417.03 | H95: 176409.48 | J95: 175379.33 | L95: 3040.989 | N95: 2941.0749999999998 | P95: -
B98: Представитель потредителя:_______________________________________________________ В.О. Топорков
I101: Рекомендуемые значения по параметрам теплопотребления (не являются официально утверждёнными)
I102: М, т | J102: V, м3 | K102: Qгвс, Гкал | L102: Qотоп, Гкал | M102: Qо, Гкал
I103: =R[-13]C[6] -> 1209.6643570000001 | J103: =RC[-1]/0.98 -> 1234.3513846938777 | K103: =R[-13]C[8] -> 42.664401999999995 | L103: =R[-13]C -> 60.066331380994939 | M103: =R[-6]C[2] -> 0
P105: ДЛЯ САМОКОНТРОЛЯ
B106: В строке выбора дат указать период с 16.7.13 по 23.8.13 - жильё | O106: Qo | Q106: Qг
B107: В строке выбора дат указать период с 18.7.13 по 25.8.13 - не жилое | O107: =((R[-21]C[-11]*R[-22]C[-8])-(R[-21]C[-10]*R[-22]C[-7]))/1000 -> 1166.7193317177332 | Q107: =IF(R[-22]C[-3]="",R[-21]C[-4]*R[-22]C[-1]/1000,"") ->  | R107: Си4
Q108: =IF(R[-23]C[-3]="","",((R[-22]C[-4]*R[-23]C[-1])-(R[-22]C[-3]*R[-23]C[1]))/1000) -> 84.748319938729082 | R108: Си5