Sheet: Лист1
G1: Отчёт о теплопотреблении за октябрь 2018 | M1: з.н д. №02/147-2783 от 04.10.18 с 04.10.18г по 05.10.18г , 07.10.18г, с 12.10.18г по 22.10.18г некорректная работа приборов
A4: =EOMONTH(R[9]C,0)-R[9]C -> 8 | B4: Потребитель: ЗАО "Сити Сервис"
A5: =MAX(R[9]C:R[78]C) -> 2018-10-22T00:00:00.000 | B5: Адрес: г. СПб, Кораблестроителей ул., д.29 к.4 ИТП 1
A6: =EOMONTH(R[-1]C,0)-R[-1]C -> 9 | B6: Телефон: 8-911-021-19-79
A7: =R[-2]C-R[6]C -> 30 | B7: Договор 10023-2 (.) 14398
A8: 7 | B8: Тепловычислитель: ВКТ-7 № 187703 | L8: М2 мах= | M8: 184.8 | O8: Мгвс мах= | P8: 60.792
L9: Qотоп мах= | M9: 14.88 | O9: Qгвс мах= | P9: 3.648
B10: Расчётная формула: Q=M1*(h1-hхв)-M2*(h2-hхв)
D12: Учет | L12: Контроль
A13: =R[1]C[1]-1 -> 2018-09-22T00:00:00.000 | B13: Дата | C13: N, ч | D13: M1, т | E13: T1, С | F13: P1, кг/см2 | G13: M2, т | H13: T2, С | I13: P2, кг/см2 | J13: dT, С | K13: M1-М2, т | L13: V3, м3 | M13: T3, С | N13: V4, м3 | O13: =IF(R[-12]C[-14]="м.куб","","T4, С") -> T4, С | P13: dT, С | Q13: V3-V4, м3 | R13: Qгвс, Гкал | S13: Qобщ., Гкал | T13: Q | U13: M3 | V13: M4 | W13: си2 | X13: си3 | Y13: Разб. | Z13: dM2 | AC13: Дата | AD13: НС | AE13: n, ч | AF13: М1, т | AG13: t1, гр. С | AH13: Р1, кгс/см2 | AI13: М2, т | AJ13: t2, гр. С | AK13: Р2, кгс/см2 | AL13: t1-t2, гр. С | AM13: М1-М2, т | AN13: М1гвс, т | AO13: t1гвс, гр. С | AP13: Р1гвс, кгс/см2 | AQ13: М2гвс, т | AR13: t2гвс, гр. С | AS13: Р2гвс, кгс/см2 | AT13: t1гвс-t2гвс | AU13: М1гвс-М2гвс, т | AV13: Wгвс, Гкал | AW13: Wсумм, Гкал | AY13: NS_TV1 | AZ13: НС | BA13: NS_TV2
A14: =IF(RC[1]="","",DATEVALUE(RC[1])) -> 43366 | B14: 23.09.18 | C14: 24 | D14: 25.2 | E14: 70.12 | F14: 8.74 | G14: 0 | H14: 22.03 | I14: 5.15 | J14: =RC[-5]-RC[-2] -> 48.09 | K14: 25.2 | L14: 24.85 | M14: 70.09 | R14: 1.706 | S14: =RC[-1] -> 1.706 | T14: =(RC[-16]*RC[-15]-RC[-13]*RC[-12])/1000 -> 1.7670240000000002 | U14: 24.32 | V14: - | W14: =RC[-2]*RC[-10]/1000 -> 1.7045888 | X14: =ABS((RC[-3]*RC[-11]-RC[-2]*RC[-9])/1000) -> #VALUE! | Y14: =(RC[-14]-RC[1])/RC[-18]*100 -> #DIV/0! | Z14: 24.32 | AC14: =VALUE(RC[-27]) -> 2018-09-23T00:00:00.000 | AD14: =IF(RC[21]=42,"*",IF(RC[21]=32,"",RC[21])) -> - | AE14: =RC[-28] -> 24 | AF14: =RC[-28] -> 25.2 | AG14: =RC[-28] -> 70.12 | AH14: =RC[-28] -> 8.74 | AI14: =RC[-28] -> 0 | AJ14: =RC[-28] -> 22.03 | AK14: =RC[-28] -> 5.15 | AL14: =RC[-28] -> 48.09 | AM14: =RC[-28] -> 25.2 | AN14: =RC[-28] -> 24.85 | AO14: =RC[-28] -> 70.09 | AP14: - | AQ14: =RC[-29] -> 0 | AR14: =RC[-29] -> 0 | AS14: - | AT14: =RC[-30] -> 0 | AU14: =RC[-30] -> 0 | AV14: =RC[-30] -> 1.706 | AW14: =RC[-30] -> 1.706 | AY14: - | AZ14: - | BA14: -
A15: =IF(RC[1]="","",DATEVALUE(RC[1])) -> 43367 | B15: 24.09.18 | C15: 24 | D15: 23.18 | E15: 68.989999999999995 | F15: 8.7799999999999994 | G15: 0 | H15: 21.13 | I15: 5.17 | J15: =RC[-5]-RC[-2] -> 47.86 | K15: 23.18 | L15: 22.95 | M15: 68.81 | R15: 1.546 | S15: =RC[-1] -> 1.546 | T15: =(RC[-16]*RC[-15]-RC[-13]*RC[-12])/1000 -> 1.5991881999999997 | U15: 22.46 | V15: - | W15: =RC[-2]*RC[-10]/1000 -> 1.5454726000000001 | X15: =ABS((RC[-3]*RC[-11]-RC[-2]*RC[-9])/1000) -> #VALUE! | Y15: =(RC[-14]-RC[1])/RC[-18]*100 -> #DIV/0! | Z15: 22.46 | AC15: =VALUE(RC[-27]) -> 2018-09-24T00:00:00.000 | AD15: =IF(RC[21]=42,"*",IF(RC[21]=32,"",RC[21])) -> - | AE15: =RC[-28] -> 24 | AF15: =RC[-28] -> 23.18 | AG15: =RC[-28] -> 68.989999999999995 | AH15: =RC[-28] -> 8.7799999999999994 | AI15: =RC[-28] -> 0 | AJ15: =RC[-28] -> 21.13 | AK15: =RC[-28] -> 5.17 | AL15: =RC[-28] -> 47.86 | AM15: =RC[-28] -> 23.18 | AN15: =RC[-28] -> 22.95 | AO15: =RC[-28] -> 68.81 | AP15: - | AQ15: =RC[-29] -> 0 | AR15: =RC[-29] -> 0 | AS15: - | AT15: =RC[-30] -> 0 | AU15: =RC[-30] -> 0 | AV15: =RC[-30] -> 1.546 | AW15: =RC[-30] -> 1.546 | AY15: - | AZ15: - | BA15: -
A16: =IF(RC[1]="","",DATEVALUE(RC[1])) -> 43368 | B16: 25.09.18 | C16: 24 | D16: 42.97 | E16: 67.61 | F16: 8.81 | G16: 25.73 | H16: 51.72 | I16: 5.03 | J16: =RC[-5]-RC[-2] -> 15.89 | K16: 17.239999999999998 | L16: 23.45 | M16: 67.260000000000005 | R16: 1.5469999999999999 | S16: 1.706 | T16: =(RC[-16]*RC[-15]-RC[-13]*RC[-12])/1000 -> 1.5744461000000001 | U16: 22.99 | V16: - | W16: =RC[-2]*RC[-10]/1000 -> 1.5463073999999999 | X16: =ABS((RC[-3]*RC[-11]-RC[-2]*RC[-9])/1000) -> #VALUE! | Y16: =(RC[-14]-RC[1])/RC[-18]*100 -> -22.347454333462881 | Z16: 22.99 | AC16: =VALUE(RC[-27]) -> 2018-09-25T00:00:00.000 | AD16: =IF(RC[21]=42,"*",IF(RC[21]=32,"",RC[21])) -> - | AE16: =RC[-28] -> 24 | AF16: =RC[-28] -> 42.97 | AG16: =RC[-28] -> 67.61 | AH16: =RC[-28] -> 8.81 | AI16: =RC[-28] -> 25.73 | AJ16: =RC[-28] -> 51.72 | AK16: =RC[-28] -> 5.03 | AL16: =RC[-28] -> 15.89 | AM16: =RC[-28] -> 17.239999999999998 | AN16: =RC[-28] -> 23.45 | AO16: =RC[-28] -> 67.260000000000005 | AP16: - | AQ16: =RC[-29] -> 0 | AR16: =RC[-29] -> 0 | AS16: - | AT16: =RC[-30] -> 0 | AU16: =RC[-30] -> 0 | AV16: =RC[-30] -> 1.5469999999999999 | AW16: =RC[-30] -> 1.706 | AY16: - | AZ16: - | BA16: -
A17: =IF(RC[1]="","",DATEVALUE(RC[1])) -> 43369 | B17: 26.09.18 | C17: 24 | D17: 24.67 | E17: 66.599999999999994 | F17: 8.85 | G17: 0 | H17: 24.36 | I17: 5.5 | J17: =RC[-5]-RC[-2] -> 42.239999999999995 | K17: 24.67 | L17: 24.24 | M17: 66.34 | R17: 1.577 | S17: 1.6439999999999999 | T17: =(RC[-16]*RC[-15]-RC[-13]*RC[-12])/1000 -> 1.643022 | U17: 23.76 | V17: - | W17: =RC[-2]*RC[-10]/1000 -> 1.5762384000000003 | X17: =ABS((RC[-3]*RC[-11]-RC[-2]*RC[-9])/1000) -> #VALUE! | Y17: =(RC[-14]-RC[1])/RC[-18]*100 -> #DIV/0! | Z17: 23.76 | AC17: =VALUE(RC[-27]) -> 2018-09-26T00:00:00.000 | AD17: =IF(RC[21]=42,"*",IF(RC[21]=32,"",RC[21])) -> - | AE17: =RC[-28] -> 24 | AF17: =RC[-28] -> 24.67 | AG17: =RC[-28] -> 66.599999999999994 | AH17: =RC[-28] -> 8.85 | AI17: =RC[-28] -> 0 | AJ17: =RC[-28] -> 24.36 | AK17: =RC[-28] -> 5.5 | AL17: =RC[-28] -> 42.239999999999995 | AM17: =RC[-28] -> 24.67 | AN17: =RC[-28] -> 24.24 | AO17: =RC[-28] -> 66.34 | AP17: - | AQ17: =RC[-29] -> 0 | AR17: =RC[-29] -> 0 | AS17: - | AT17: =RC[-30] -> 0 | AU17: =RC[-30] -> 0 | AV17: =RC[-30] -> 1.577 | AW17: =RC[-30] -> 1.6439999999999999 | AY17: - | AZ17: - | BA17: -
A18: =IF(RC[1]="","",DATEVALUE(RC[1])) -> 43370 | B18: 27.09.18 | C18: 24 | D18: 125.35 | E18: 63.82 | F18: 8.2899999999999991 | G18: 109.34 | H18: 43.51 | I18: 5.36 | J18: =RC[-5]-RC[-2] -> 20.310000000000002 | K18: 16.010000000000002 | L18: 25.92 | M18: 62.96 | R18: 1.599 | S18: 3.6890000000000001 | T18: =(RC[-16]*RC[-15]-RC[-13]*RC[-12])/1000 -> 3.2424535999999997 | U18: 25.43 | V18: - | W18: =RC[-2]*RC[-10]/1000 -> 1.6010727999999999 | X18: =ABS((RC[-3]*RC[-11]-RC[-2]*RC[-9])/1000) -> #VALUE! | Y18: =(RC[-14]-RC[1])/RC[-18]*100 -> -8.6153283336381907 | Z18: 25.43 | AC18: =VALUE(RC[-27]) -> 2018-09-27T00:00:00.000 | AD18: =IF(RC[21]=42,"*",IF(RC[21]=32,"",RC[21])) -> - | AE18: =RC[-28] -> 24 | AF18: =RC[-28] -> 125.35 | AG18: =RC[-28] -> 63.82 | AH18: =RC[-28] -> 8.2899999999999991 | AI18: =RC[-28] -> 109.34 | AJ18: =RC[-28] -> 43.51 | AK18: =RC[-28] -> 5.36 | AL18: =RC[-28] -> 20.310000000000002 | AM18: =RC[-28] -> 16.010000000000002 | AN18: =RC[-28] -> 25.92 | AO18: =RC[-28] -> 62.96 | AP18: - | AQ18: =RC[-29] -> 0 | AR18: =RC[-29] -> 0 | AS18: - | AT18: =RC[-30] -> 0 | AU18: =RC[-30] -> 0 | AV18: =RC[-30] -> 1.599 | AW18: =RC[-30] -> 3.6890000000000001 | AY18: - | AZ18: - | BA18: -
A19: =IF(RC[1]="","",DATEVALUE(RC[1])) -> 43371 | B19: 28.09.18 | C19: 24 | D19: 237.84 | E19: 68.260000000000005 | F19: 7.68 | G19: 215.18 | H19: 44.79 | I19: 5.37 | J19: =RC[-5]-RC[-2] -> 23.470000000000006 | K19: 22.66 | L19: 23.2 | M19: 68.36 | R19: 1.5529999999999999 | S19: 6.6 | T19: =(RC[-16]*RC[-15]-RC[-13]*RC[-12])/1000 -> 6.5970462000000003 | U19: 22.71 | V19: - | W19: =RC[-2]*RC[-10]/1000 -> 1.5524556 | X19: =ABS((RC[-3]*RC[-11]-RC[-2]*RC[-9])/1000) -> #VALUE! | Y19: =(RC[-14]-RC[1])/RC[-18]*100 -> -2.3236360256529746E-2 | Z19: 22.71 | AC19: =VALUE(RC[-27]) -> 2018-09-28T00:00:00.000 | AD19: =IF(RC[21]=42,"*",IF(RC[21]=32,"",RC[21])) -> - | AE19: =RC[-28] -> 24 | AF19: =RC[-28] -> 237.84 | AG19: =RC[-28] -> 68.260000000000005 | AH19: =RC[-28] -> 7.68 | AI19: =RC[-28] -> 215.18 | AJ19: =RC[-28] -> 44.79 | AK19: =RC[-28] -> 5.37 | AL19: =RC[-28] -> 23.470000000000006 | AM19: =RC[-28] -> 22.66 | AN19: =RC[-28] -> 23.2 | AO19: =RC[-28] -> 68.36 | AP19: - | AQ19: =RC[-29] -> 0 | AR19: =RC[-29] -> 0 | AS19: - | AT19: =RC[-30] -> 0 | AU19: =RC[-30] -> 0 | AV19: =RC[-30] -> 1.5529999999999999 | AW19: =RC[-30] -> 6.6 | AY19: - | AZ19: - | BA19: -
A20: =IF(RC[1]="","",DATEVALUE(RC[1])) -> 43372 | B20: 29.09.18 | C20: 24 | D20: 226.8 | E20: 67.77 | F20: 7.57 | G20: 203.99 | H20: 44.06 | I20: 5.52 | J20: =RC[-5]-RC[-2] -> 23.709999999999994 | K20: 22.81 | L20: 24.33 | M20: 67.47 | R20: 1.6080000000000001 | S20: 6.3869999999999996 | T20: =(RC[-16]*RC[-15]-RC[-13]*RC[-12])/1000 -> 6.3824365999999975 | U20: 23.83 | V20: - | W20: =RC[-2]*RC[-10]/1000 -> 1.6078101 | X20: =ABS((RC[-3]*RC[-11]-RC[-2]*RC[-9])/1000) -> #VALUE! | Y20: =(RC[-14]-RC[1])/RC[-18]*100 -> -0.50002451100544121 | Z20: 23.83 | AC20: =VALUE(RC[-27]) -> 2018-09-29T00:00:00.000 | AD20: =IF(RC[21]=42,"*",IF(RC[21]=32,"",RC[21])) -> - | AE20: =RC[-28] -> 24 | AF20: =RC[-28] -> 226.8 | AG20: =RC[-28] -> 67.77 | AH20: =RC[-28] -> 7.57 | AI20: =RC[-28] -> 203.99 | AJ20: =RC[-28] -> 44.06 | AK20: =RC[-28] -> 5.52 | AL20: =RC[-28] -> 23.709999999999994 | AM20: =RC[-28] -> 22.81 | AN20: =RC[-28] -> 24.33 | AO20: =RC[-28] -> 67.47 | AP20: - | AQ20: =RC[-29] -> 0 | AR20: =RC[-29] -> 0 | AS20: - | AT20: =RC[-30] -> 0 | AU20: =RC[-30] -> 0 | AV20: =RC[-30] -> 1.6080000000000001 | AW20: =RC[-30] -> 6.3869999999999996 | AY20: - | AZ20: - | BA20: -
A21: =IF(RC[1]="","",DATEVALUE(RC[1])) -> 43373 | B21: 30.09.18 | C21: 24 | D21: 225.15 | E21: 70.08 | F21: 7.45 | G21: 199.57 | H21: 45.1 | I21: 5.48 | J21: =RC[-5]-RC[-2] -> 24.979999999999997 | K21: 25.58 | L21: 26.4 | M21: 70.33 | R21: 1.8140000000000001 | S21: 6.782 | T21: =(RC[-16]*RC[-15]-RC[-13]*RC[-12])/1000 -> 6.7779050000000005 | U21: 25.79 | V21: - | W21: =RC[-2]*RC[-10]/1000 -> 1.8138106999999999 | X21: =ABS((RC[-3]*RC[-11]-RC[-2]*RC[-9])/1000) -> #VALUE! | Y21: =(RC[-14]-RC[1])/RC[-18]*100 -> -0.10522623640827823 | Z21: 25.79 | AC21: =VALUE(RC[-27]) -> 2018-09-30T00:00:00.000 | AD21: =IF(RC[21]=42,"*",IF(RC[21]=32,"",RC[21])) -> - | AE21: =RC[-28] -> 24 | AF21: =RC[-28] -> 225.15 | AG21: =RC[-28] -> 70.08 | AH21: =RC[-28] -> 7.45 | AI21: =RC[-28] -> 199.57 | AJ21: =RC[-28] -> 45.1 | AK21: =RC[-28] -> 5.48 | AL21: =RC[-28] -> 24.979999999999997 | AM21: =RC[-28] -> 25.58 | AN21: =RC[-28] -> 26.4 | AO21: =RC[-28] -> 70.33 | AP21: - | AQ21: =RC[-29] -> 0 | AR21: =RC[-29] -> 0 | AS21: - | AT21: =RC[-30] -> 0 | AU21: =RC[-30] -> 0 | AV21: =RC[-30] -> 1.8140000000000001 | AW21: =RC[-30] -> 6.782 | AY21: - | AZ21: - | BA21: -
A22: =IF(RC[1]="","",DATEVALUE(RC[1])) -> 43374 | B22: 01.10.18 | C22: 24 | D22: 223.02 | E22: 68.790000000000006 | F22: 7.51 | G22: 184.56 | H22: 45.03 | I22: 5.53 | J22: =RC[-5]-RC[-2] -> 23.760000000000005 | K22: 38.46 | L22: 23.61 | M22: 68.569999999999993 | R22: 1.585 | S22: 7.0309999999999997 | T22: =(RC[-16]*RC[-15]-RC[-13]*RC[-12])/1000 -> 7.0308090000000014 | U22: 23.13 | V22: - | W22: =RC[-2]*RC[-10]/1000 -> 1.5860240999999999 | X22: =ABS((RC[-3]*RC[-11]-RC[-2]*RC[-9])/1000) -> #VALUE! | Y22: =(RC[-14]-RC[1])/RC[-18]*100 -> 8.3062418725617686 | Z22: 23.13 | AC22: =VALUE(RC[-27]) -> 2018-10-01T00:00:00.000 | AD22: =IF(RC[21]=42,"*",IF(RC[21]=32,"",RC[21])) -> - | AE22: =RC[-28] -> 24 | AF22: =RC[-28] -> 223.02 | AG22: =RC[-28] -> 68.790000000000006 | AH22: =RC[-28] -> 7.51 | AI22: =RC[-28] -> 184.56 | AJ22: =RC[-28] -> 45.03 | AK22: =RC[-28] -> 5.53 | AL22: =RC[-28] -> 23.760000000000005 | AM22: =RC[-28] -> 38.46 | AN22: =RC[-28] -> 23.61 | AO22: =RC[-28] -> 68.569999999999993 | AP22: - | AQ22: =RC[-29] -> 0 | AR22: =RC[-29] -> 0 | AS22: - | AT22: =RC[-30] -> 0 | AU22: =RC[-30] -> 0 | AV22: =RC[-30] -> 1.585 | AW22: =RC[-30] -> 7.0309999999999997 | AY22: - | AZ22: - | BA22: -
A23: =IF(RC[1]="","",DATEVALUE(RC[1])) -> 43375 | B23: 02.10.18 | C23: 24 | D23: 207.17 | E23: 67.53 | F23: 7.2 | G23: 168.11 | H23: 43.46 | I23: 5.54 | J23: =RC[-5]-RC[-2] -> 24.07 | K23: 39.06 | L23: 23.87 | M23: 67.45 | R23: 1.577 | S23: 6.6840000000000002 | T23: =(RC[-16]*RC[-15]-RC[-13]*RC[-12])/1000 -> 6.6841294999999992 | U23: 23.38 | V23: - | W23: =RC[-2]*RC[-10]/1000 -> 1.576981 | X23: =ABS((RC[-3]*RC[-11]-RC[-2]*RC[-9])/1000) -> #VALUE! | Y23: =(RC[-14]-RC[1])/RC[-18]*100 -> 9.3272262209267751 | Z23: 23.38 | AC23: =VALUE(RC[-27]) -> 2018-10-02T00:00:00.000 | AD23: =IF(RC[21]=42,"*",IF(RC[21]=32,"",RC[21])) -> - | AE23: =RC[-28] -> 24 | AF23: =RC[-28] -> 207.17 | AG23: =RC[-28] -> 67.53 | AH23: =RC[-28] -> 7.2 | AI23: =RC[-28] -> 168.11 | AJ23: =RC[-28] -> 43.46 | AK23: =RC[-28] -> 5.54 | AL23: =RC[-28] -> 24.07 | AM23: =RC[-28] -> 39.06 | AN23: =RC[-28] -> 23.87 | AO23: =RC[-28] -> 67.45 | AP23: - | AQ23: =RC[-29] -> 0 | AR23: =RC[-29] -> 0 | AS23: - | AT23: =RC[-30] -> 0 | AU23: =RC[-30] -> 0 | AV23: =RC[-30] -> 1.577 | AW23: =RC[-30] -> 6.6840000000000002 | AY23: - | AZ23: - | BA23: -
A24: =IF(RC[1]="","",DATEVALUE(RC[1])) -> 43376 | B24: 03.10.18 | C24: 24 | D24: 200.13 | E24: 67.64 | F24: 7.19 | G24: 159.72999999999999 | H24: 42.77 | I24: 5.66 | J24: =RC[-5]-RC[-2] -> 24.869999999999997 | K24: 40.4 | L24: 23.94 | M24: 67.650000000000006 | R24: 1.5860000000000001 | S24: 6.7060000000000004 | T24: =(RC[-16]*RC[-15]-RC[-13]*RC[-12])/1000 -> 6.7051410999999996 | U24: 23.44 | V24: - | W24: =RC[-2]*RC[-10]/1000 -> 1.5857160000000001 | X24: =ABS((RC[-3]*RC[-11]-RC[-2]*RC[-9])/1000) -> #VALUE! | Y24: =(RC[-14]-RC[1])/RC[-18]*100 -> 10.617917736179802 | Z24: 23.44 | AC24: =VALUE(RC[-27]) -> 2018-10-03T00:00:00.000 | AD24: =IF(RC[21]=42,"*",IF(RC[21]=32,"",RC[21])) -> - | AE24: =RC[-28] -> 24 | AF24: =RC[-28] -> 200.13 | AG24: =RC[-28] -> 67.64 | AH24: =RC[-28] -> 7.19 | AI24: =RC[-28] -> 159.72999999999999 | AJ24: =RC[-28] -> 42.77 | AK24: =RC[-28] -> 5.66 | AL24: =RC[-28] -> 24.869999999999997 | AM24: =RC[-28] -> 40.4 | AN24: =RC[-28] -> 23.94 | AO24: =RC[-28] -> 67.650000000000006 | AP24: - | AQ24: =RC[-29] -> 0 | AR24: =RC[-29] -> 0 | AS24: - | AT24: =RC[-30] -> 0 | AU24: =RC[-30] -> 0 | AV24: =RC[-30] -> 1.5860000000000001 | AW24: =RC[-30] -> 6.7060000000000004 | AY24: - | AZ24: - | BA24: -
A25: =IF(RC[1]="","",DATEVALUE(RC[1])) -> 43377 | B25: 04.10.18 | C25: 24 | D25: 167.77666666666667 | E25: 67.443333333333328 | F25: 6.7833333333333341 | G25: 143.55000000000001 | H25: 39.386666666666663 | I25: 5.79 | J25: 28.056666666666668 | K25: 24.226666666666663 | L25: 25.486666666666668 | M25: 67.586666666666673 | R25: 1.6866666666666668 | S25: 5.6559999999999997 | T25: =(RC[-16]*RC[-15]-RC[-13]*RC[-12])/1000 -> 5.6614616555555548 | U25: 24.72 | V25: - | W25: =RC[-2]*RC[-10]/1000 -> 1.6707424000000002 | X25: =ABS((RC[-3]*RC[-11]-RC[-2]*RC[-9])/1000) -> #VALUE! | Y25: =(RC[-14]-RC[1])/RC[-18]*100 -> -0.34366655056310402 | Z25: 24.72 | AC25: =VALUE(RC[-27]) -> 2018-10-04T00:00:00.000 | AD25: =IF(RC[21]=42,"*",IF(RC[21]=32,"",RC[21])) -> - | AE25: =RC[-28] -> 24 | AF25: =RC[-28] -> 167.77666666666667 | AG25: =RC[-28] -> 67.443333333333328 | AH25: =RC[-28] -> 6.7833333333333341 | AI25: =RC[-28] -> 143.55000000000001 | AJ25: =RC[-28] -> 39.386666666666663 | AK25: =RC[-28] -> 5.79 | AL25: =RC[-28] -> 28.056666666666668 | AM25: =RC[-28] -> 24.226666666666663 | AN25: =RC[-28] -> 25.486666666666668 | AO25: =RC[-28] -> 67.586666666666673 | AP25: - | AQ25: =RC[-29] -> 0 | AR25: =RC[-29] -> 0 | AS25: - | AT25: =RC[-30] -> 0 | AU25: =RC[-30] -> 0 | AV25: =RC[-30] -> 1.6866666666666668 | AW25: =RC[-30] -> 5.6559999999999997 | AY25: - | AZ25: - | BA25: -
A26: =IF(RC[1]="","",DATEVALUE(RC[1])) -> 43378 | B26: 05.10.18 | C26: 24 | D26: 167.77666666666667 | E26: 67.443333333333328 | F26: 6.7833333333333341 | G26: 143.55000000000001 | H26: 39.386666666666663 | I26: 5.79 | J26: 28.056666666666668 | K26: 24.226666666666663 | L26: 25.486666666666668 | M26: 67.586666666666673 | R26: 1.6866666666666668 | S26: 5.6559999999999997 | T26: =(RC[-16]*RC[-15]-RC[-13]*RC[-12])/1000 -> 5.6614616555555548 | U26: 22.92 | V26: - | W26: =RC[-2]*RC[-10]/1000 -> 1.5490864000000004 | X26: =ABS((RC[-3]*RC[-11]-RC[-2]*RC[-9])/1000) -> #VALUE! | Y26: =(RC[-14]-RC[1])/RC[-18]*100 -> 0.91025194473469961 | Z26: 22.92 | AC26: =VALUE(RC[-27]) -> 2018-10-05T00:00:00.000 | AD26: =IF(RC[21]=42,"*",IF(RC[21]=32,"",RC[21])) -> - | AE26: =RC[-28] -> 24 | AF26: =RC[-28] -> 167.77666666666667 | AG26: =RC[-28] -> 67.443333333333328 | AH26: =RC[-28] -> 6.7833333333333341 | AI26: =RC[-28] -> 143.55000000000001 | AJ26: =RC[-28] -> 39.386666666666663 | AK26: =RC[-28] -> 5.79 | AL26: =RC[-28] -> 28.056666666666668 | AM26: =RC[-28] -> 24.226666666666663 | AN26: =RC[-28] -> 25.486666666666668 | AO26: =RC[-28] -> 67.586666666666673 | AP26: - | AQ26: =RC[-29] -> 0 | AR26: =RC[-29] -> 0 | AS26: - | AT26: =RC[-30] -> 0 | AU26: =RC[-30] -> 0 | AV26: =RC[-30] -> 1.6866666666666668 | AW26: =RC[-30] -> 5.6559999999999997 | AY26: - | AZ26: - | BA26: -
A27: =IF(RC[1]="","",DATEVALUE(RC[1])) -> 43379 | B27: 06.10.18 | C27: 24 | D27: 164.16 | E27: 66.95 | F27: 6.79 | G27: 142.06 | H27: 39.33 | I27: 5.8 | J27: =RC[-5]-RC[-2] -> 27.620000000000005 | K27: 22.1 | L27: 19.329999999999998 | M27: 67.17 | R27: 1.272 | S27: 5.4020000000000001 | T27: =(RC[-16]*RC[-15]-RC[-13]*RC[-12])/1000 -> 5.403292200000001 | U27: 18.940000000000001 | V27: - | W27: =RC[-2]*RC[-10]/1000 -> 1.2721998000000001 | X27: =ABS((RC[-3]*RC[-11]-RC[-2]*RC[-9])/1000) -> #VALUE! | Y27: =(RC[-14]-RC[1])/RC[-18]*100 -> 2.2244122201886527 | Z27: 18.940000000000001 | AC27: =VALUE(RC[-27]) -> 2018-10-06T00:00:00.000 | AD27: =IF(RC[21]=42,"*",IF(RC[21]=32,"",RC[21])) -> - | AE27: =RC[-28] -> 24 | AF27: =RC[-28] -> 164.16 | AG27: =RC[-28] -> 66.95 | AH27: =RC[-28] -> 6.79 | AI27: =RC[-28] -> 142.06 | AJ27: =RC[-28] -> 39.33 | AK27: =RC[-28] -> 5.8 | AL27: =RC[-28] -> 27.620000000000005 | AM27: =RC[-28] -> 22.1 | AN27: =RC[-28] -> 19.329999999999998 | AO27: =RC[-28] -> 67.17 | AP27: - | AQ27: =RC[-29] -> 0 | AR27: =RC[-29] -> 0 | AS27: - | AT27: =RC[-30] -> 0 | AU27: =RC[-30] -> 0 | AV27: =RC[-30] -> 1.272 | AW27: =RC[-30] -> 5.4020000000000001 | AY27: - | AZ27: - | BA27: -
A28: =IF(RC[1]="","",DATEVALUE(RC[1])) -> 43380 | B28: 07.10.18 | C28: 24 | D28: =AVERAGE(R[1]C:R[3]C) -> 167.77666666666667 | E28: =AVERAGE(R[1]C:R[3]C) -> 67.443333333333328 | F28: =AVERAGE(R[1]C:R[3]C) -> 6.7833333333333341 | G28: =AVERAGE(R[1]C:R[3]C) -> 143.55000000000001 | H28: =AVERAGE(R[1]C:R[3]C) -> 39.386666666666663 | I28: =AVERAGE(R[1]C:R[3]C) -> 5.79 | J28: =AVERAGE(R[1]C:R[3]C) -> 28.056666666666668 | K28: =AVERAGE(R[1]C:R[3]C) -> 24.226666666666663 | L28: =AVERAGE(R[1]C:R[3]C) -> 25.486666666666668 | M28: =AVERAGE(R[1]C:R[3]C) -> 67.586666666666673 | R28: =AVERAGE(R[1]C:R[3]C) -> 1.6866666666666668 | S28: =AVERAGE(R[1]C:R[3]C) -> 5.6559999999999997 | T28: =(RC[-16]*RC[-15]-RC[-13]*RC[-12])/1000 -> 5.6614616555555548 | U28: 34.630000000000003 | V28: - | W28: =RC[-2]*RC[-10]/1000 -> 2.3405262666666671 | X28: =ABS((RC[-3]*RC[-11]-RC[-2]*RC[-9])/1000) -> #VALUE! | Y28: =(RC[-14]-RC[1])/RC[-18]*100 -> -7.2471844885638026 | Z28: 34.630000000000003 | AC28: =VALUE(RC[-27]) -> 2018-10-07T00:00:00.000 | AD28: =IF(RC[21]=42,"*",IF(RC[21]=32,"",RC[21])) -> - | AE28: =RC[-28] -> 24 | AF28: =RC[-28] -> 167.77666666666667 | AG28: =RC[-28] -> 67.443333333333328 | AH28: =RC[-28] -> 6.7833333333333341 | AI28: =RC[-28] -> 143.55000000000001 | AJ28: =RC[-28] -> 39.386666666666663 | AK28: =RC[-28] -> 5.79 | AL28: =RC[-28] -> 28.056666666666668 | AM28: =RC[-28] -> 24.226666666666663 | AN28: =RC[-28] -> 25.486666666666668 | AO28: =RC[-28] -> 67.586666666666673 | AP28: - | AQ28: =RC[-29] -> 0 | AR28: =RC[-29] -> 0 | AS28: - | AT28: =RC[-30] -> 0 | AU28: =RC[-30] -> 0 | AV28: =RC[-30] -> 1.6866666666666668 | AW28: =RC[-30] -> 5.6559999999999997 | AY28: - | AZ28: - | BA28: -
A29: =IF(RC[1]="","",DATEVALUE(RC[1])) -> 43381 | B29: 08.10.18 | C29: 24 | D29: 163.53 | E29: 67.17 | F29: 6.75 | G29: 138.18 | H29: 38.44 | I29: 5.82 | J29: =RC[-5]-RC[-2] -> 28.730000000000004 | K29: 25.35 | L29: 26.67 | M29: 67.2 | R29: 1.754 | S29: 5.6680000000000001 | T29: =(RC[-16]*RC[-15]-RC[-13]*RC[-12])/1000 -> 5.6726709000000008 | U29: 26.13 | V29: - | W29: =RC[-2]*RC[-10]/1000 -> 1.7559359999999999 | X29: =ABS((RC[-3]*RC[-11]-RC[-2]*RC[-9])/1000) -> #VALUE! | Y29: =(RC[-14]-RC[1])/RC[-18]*100 -> -0.56448111159357184 | Z29: 26.13 | AC29: =VALUE(RC[-27]) -> 2018-10-08T00:00:00.000 | AD29: =IF(RC[21]=42,"*",IF(RC[21]=32,"",RC[21])) -> - | AE29: =RC[-28] -> 24 | AF29: =RC[-28] -> 163.53 | AG29: =RC[-28] -> 67.17 | AH29: =RC[-28] -> 6.75 | AI29: =RC[-28] -> 138.18 | AJ29: =RC[-28] -> 38.44 | AK29: =RC[-28] -> 5.82 | AL29: =RC[-28] -> 28.730000000000004 | AM29: =RC[-28] -> 25.35 | AN29: =RC[-28] -> 26.67 | AO29: =RC[-28] -> 67.2 | AP29: - | AQ29: =RC[-29] -> 0 | AR29: =RC[-29] -> 0 | AS29: - | AT29: =RC[-30] -> 0 | AU29: =RC[-30] -> 0 | AV29: =RC[-30] -> 1.754 | AW29: =RC[-30] -> 5.6680000000000001 | AY29: - | AZ29: - | BA29: -
A30: =IF(RC[1]="","",DATEVALUE(RC[1])) -> 43382 | B30: 09.10.18 | C30: 24 | D30: 169.11 | E30: 67.05 | F30: 6.86 | G30: 146.41 | H30: 39.43 | I30: 5.83 | J30: =RC[-5]-RC[-2] -> 27.619999999999997 | K30: 22.7 | L30: 23.98 | M30: 67.22 | R30: 1.579 | S30: 5.5629999999999997 | T30: =(RC[-16]*RC[-15]-RC[-13]*RC[-12])/1000 -> 5.5658792000000012 | U30: 23.48 | V30: - | W30: =RC[-2]*RC[-10]/1000 -> 1.5783255999999999 | X30: =ABS((RC[-3]*RC[-11]-RC[-2]*RC[-9])/1000) -> #VALUE! | Y30: =(RC[-14]-RC[1])/RC[-18]*100 -> -0.53275049518475592 | Z30: 23.48 | AC30: =VALUE(RC[-27]) -> 2018-10-09T00:00:00.000 | AD30: =IF(RC[21]=42,"*",IF(RC[21]=32,"",RC[21])) -> - | AE30: =RC[-28] -> 24 | AF30: =RC[-28] -> 169.11 | AG30: =RC[-28] -> 67.05 | AH30: =RC[-28] -> 6.86 | AI30: =RC[-28] -> 146.41 | AJ30: =RC[-28] -> 39.43 | AK30: =RC[-28] -> 5.83 | AL30: =RC[-28] -> 27.619999999999997 | AM30: =RC[-28] -> 22.7 | AN30: =RC[-28] -> 23.98 | AO30: =RC[-28] -> 67.22 | AP30: - | AQ30: =RC[-29] -> 0 | AR30: =RC[-29] -> 0 | AS30: - | AT30: =RC[-30] -> 0 | AU30: =RC[-30] -> 0 | AV30: =RC[-30] -> 1.579 | AW30: =RC[-30] -> 5.5629999999999997 | AY30: - | AZ30: - | BA30: -
A31: =IF(RC[1]="","",DATEVALUE(RC[1])) -> 43383 | B31: 10.10.18 | C31: 24 | D31: 170.69 | E31: 68.11 | F31: 6.74 | G31: 146.06 | H31: 40.29 | I31: 5.72 | J31: =RC[-5]-RC[-2] -> 27.82 | K31: 24.63 | L31: 25.81 | M31: 68.34 | R31: 1.7270000000000001 | S31: 5.7370000000000001 | T31: =(RC[-16]*RC[-15]-RC[-13]*RC[-12])/1000 -> 5.7409385000000004 | U31: 25.28 | V31: - | W31: =RC[-2]*RC[-10]/1000 -> 1.7276352000000001 | X31: =ABS((RC[-3]*RC[-11]-RC[-2]*RC[-9])/1000) -> #VALUE! | Y31: =(RC[-14]-RC[1])/RC[-18]*100 -> -0.44502259345474604 | Z31: 25.28 | AC31: =VALUE(RC[-27]) -> 2018-10-10T00:00:00.000 | AD31: =IF(RC[21]=42,"*",IF(RC[21]=32,"",RC[21])) -> - | AE31: =RC[-28] -> 24 | AF31: =RC[-28] -> 170.69 | AG31: =RC[-28] -> 68.11 | AH31: =RC[-28] -> 6.74 | AI31: =RC[-28] -> 146.06 | AJ31: =RC[-28] -> 40.29 | AK31: =RC[-28] -> 5.72 | AL31: =RC[-28] -> 27.82 | AM31: =RC[-28] -> 24.63 | AN31: =RC[-28] -> 25.81 | AO31: =RC[-28] -> 68.34 | AP31: - | AQ31: =RC[-29] -> 0 | AR31: =RC[-29] -> 0 | AS31: - | AT31: =RC[-30] -> 0 | AU31: =RC[-30] -> 0 | AV31: =RC[-30] -> 1.7270000000000001 | AW31: =RC[-30] -> 5.7370000000000001 | AY31: - | AZ31: - | BA31: -
A32: =IF(RC[1]="","",DATEVALUE(RC[1])) -> 43384 | B32: 11.10.18 | C32: 24 | D32: 172.15 | E32: 69.22 | F32: 6.73 | G32: 149.9 | H32: 41.08 | I32: 5.65 | J32: =RC[-5]-RC[-2] -> 28.14 | K32: 22.25 | L32: 23.41 | M32: 69.260000000000005 | R32: 1.589 | S32: 5.7549999999999999 | T32: =(RC[-16]*RC[-15]-RC[-13]*RC[-12])/1000 -> 5.7583310000000001 | U32: 22.92 | V32: - | W32: =RC[-2]*RC[-10]/1000 -> 1.5874392000000002 | X32: =ABS((RC[-3]*RC[-11]-RC[-2]*RC[-9])/1000) -> #VALUE! | Y32: =(RC[-14]-RC[1])/RC[-18]*100 -> -0.44696464309539807 | Z32: 22.92 | AC32: =VALUE(RC[-27]) -> 2018-10-11T00:00:00.000 | AD32: =IF(RC[21]=42,"*",IF(RC[21]=32,"",RC[21])) -> - | AE32: =RC[-28] -> 24 | AF32: =RC[-28] -> 172.15 | AG32: =RC[-28] -> 69.22 | AH32: =RC[-28] -> 6.73 | AI32: =RC[-28] -> 149.9 | AJ32: =RC[-28] -> 41.08 | AK32: =RC[-28] -> 5.65 | AL32: =RC[-28] -> 28.14 | AM32: =RC[-28] -> 22.25 | AN32: =RC[-28] -> 23.41 | AO32: =RC[-28] -> 69.260000000000005 | AP32: - | AQ32: =RC[-29] -> 0 | AR32: =RC[-29] -> 0 | AS32: - | AT32: =RC[-30] -> 0 | AU32: =RC[-30] -> 0 | AV32: =RC[-30] -> 1.589 | AW32: =RC[-30] -> 5.7549999999999999 | AY32: - | AZ32: - | BA32: -
A33: =IF(RC[1]="","",DATEVALUE(RC[1])) -> 43385 | B33: 12.10.18 | C33: 24 | D33: 167.77666666666667 | E33: 67.443333333333328 | F33: 6.7833333333333341 | G33: 143.55000000000001 | H33: 39.386666666666663 | I33: 5.79 | J33: 28.056666666666668 | K33: 24.226666666666663 | L33: 25.486666666666668 | M33: 67.586666666666673 | R33: 1.6866666666666668 | S33: 5.6559999999999997 | T33: =(RC[-16]*RC[-15]-RC[-13]*RC[-12])/1000 -> 5.6614616555555548 | U33: 102.78 | V33: - | W33: =RC[-2]*RC[-10]/1000 -> 6.9465576000000011 | X33: =ABS((RC[-3]*RC[-11]-RC[-2]*RC[-9])/1000) -> #VALUE! | Y33: =(RC[-14]-RC[1])/RC[-18]*100 -> -54.721931963311278 | Z33: 102.78 | AC33: =VALUE(RC[-27]) -> 2018-10-12T00:00:00.000 | AD33: =IF(RC[21]=42,"*",IF(RC[21]=32,"",RC[21])) -> - | AE33: =RC[-28] -> 24 | AF33: =RC[-28] -> 167.77666666666667 | AG33: =RC[-28] -> 67.443333333333328 | AH33: =RC[-28] -> 6.7833333333333341 | AI33: =RC[-28] -> 143.55000000000001 | AJ33: =RC[-28] -> 39.386666666666663 | AK33: =RC[-28] -> 5.79 | AL33: =RC[-28] -> 28.056666666666668 | AM33: =RC[-28] -> 24.226666666666663 | AN33: =RC[-28] -> 25.486666666666668 | AO33: =RC[-28] -> 67.586666666666673 | AP33: - | AQ33: =RC[-29] -> 0 | AR33: =RC[-29] -> 0 | AS33: - | AT33: =RC[-30] -> 0 | AU33: =RC[-30] -> 0 | AV33: =RC[-30] -> 1.6866666666666668 | AW33: =RC[-30] -> 5.6559999999999997 | AY33: - | AZ33: - | BA33: -
A34: =IF(RC[1]="","",DATEVALUE(RC[1])) -> 43386 | B34: 13.10.18 | C34: 24 | D34: 167.77666666666667 | E34: 67.443333333333328 | F34: 6.7833333333333341 | G34: 143.55000000000001 | H34: 39.386666666666663 | I34: 5.79 | J34: 28.056666666666668 | K34: 24.226666666666663 | L34: 25.486666666666668 | M34: 67.586666666666673 | R34: 1.6866666666666668 | S34: 5.6559999999999997 | T34: =(RC[-16]*RC[-15]-RC[-13]*RC[-12])/1000 -> 5.6614616555555548 | U34: 188.01 | V34: - | W34: =RC[-2]*RC[-10]/1000 -> 12.706969200000001 | X34: =ABS((RC[-3]*RC[-11]-RC[-2]*RC[-9])/1000) -> #VALUE! | Y34: =(RC[-14]-RC[1])/RC[-18]*100 -> -114.09497271566235 | Z34: 188.01 | AC34: =VALUE(RC[-27]) -> 2018-10-13T00:00:00.000 | AD34: =IF(RC[21]=42,"*",IF(RC[21]=32,"",RC[21])) -> - | AE34: =RC[-28] -> 24 | AF34: =RC[-28] -> 167.77666666666667 | AG34: =RC[-28] -> 67.443333333333328 | AH34: =RC[-28] -> 6.7833333333333341 | AI34: =RC[-28] -> 143.55000000000001 | AJ34: =RC[-28] -> 39.386666666666663 | AK34: =RC[-28] -> 5.79 | AL34: =RC[-28] -> 28.056666666666668 | AM34: =RC[-28] -> 24.226666666666663 | AN34: =RC[-28] -> 25.486666666666668 | AO34: =RC[-28] -> 67.586666666666673 | AP34: - | AQ34: =RC[-29] -> 0 | AR34: =RC[-29] -> 0 | AS34: - | AT34: =RC[-30] -> 0 | AU34: =RC[-30] -> 0 | AV34: =RC[-30] -> 1.6866666666666668 | AW34: =RC[-30] -> 5.6559999999999997 | AY34: - | AZ34: - | BA34: -
A35: =IF(RC[1]="","",DATEVALUE(RC[1])) -> 43387 | B35: 14.10.18 | C35: 24 | D35: 167.77666666666667 | E35: 67.443333333333328 | F35: 6.7833333333333341 | G35: 143.55000000000001 | H35: 39.386666666666663 | I35: 5.79 | J35: 28.056666666666668 | K35: 24.226666666666663 | L35: 25.486666666666668 | M35: 67.586666666666673 | R35: 1.6866666666666668 | S35: 5.6559999999999997 | T35: =(RC[-16]*RC[-15]-RC[-13]*RC[-12])/1000 -> 5.6614616555555548 | U35: 188.06 | V35: - | W35: =RC[-2]*RC[-10]/1000 -> 12.710348533333336 | X35: =ABS((RC[-3]*RC[-11]-RC[-2]*RC[-9])/1000) -> #VALUE! | Y35: =(RC[-14]-RC[1])/RC[-18]*100 -> -114.12980378497619 | Z35: 188.06 | AC35: =VALUE(RC[-27]) -> 2018-10-14T00:00:00.000 | AD35: =IF(RC[21]=42,"*",IF(RC[21]=32,"",RC[21])) -> - | AE35: =RC[-28] -> 24 | AF35: =RC[-28] -> 167.77666666666667 | AG35: =RC[-28] -> 67.443333333333328 | AH35: =RC[-28] -> 6.7833333333333341 | AI35: =RC[-28] -> 143.55000000000001 | AJ35: =RC[-28] -> 39.386666666666663 | AK35: =RC[-28] -> 5.79 | AL35: =RC[-28] -> 28.056666666666668 | AM35: =RC[-28] -> 24.226666666666663 | AN35: =RC[-28] -> 25.486666666666668 | AO35: =RC[-28] -> 67.586666666666673 | AP35: - | AQ35: =RC[-29] -> 0 | AR35: =RC[-29] -> 0 | AS35: - | AT35: =RC[-30] -> 0 | AU35: =RC[-30] -> 0 | AV35: =RC[-30] -> 1.6866666666666668 | AW35: =RC[-30] -> 5.6559999999999997 | AY35: - | AZ35: - | BA35: -
A36: =IF(RC[1]="","",DATEVALUE(RC[1])) -> 43388 | B36: 15.10.18 | C36: 24 | D36: 167.77666666666667 | E36: 67.443333333333328 | F36: 6.7833333333333341 | G36: 143.55000000000001 | H36: 39.386666666666663 | I36: 5.79 | J36: 28.056666666666668 | K36: 24.226666666666663 | L36: 25.486666666666668 | M36: 67.586666666666673 | R36: 1.6866666666666668 | S36: 5.6559999999999997 | T36: =(RC[-16]*RC[-15]-RC[-13]*RC[-12])/1000 -> 5.6614616555555548 | U36: 188.01 | V36: - | W36: =RC[-2]*RC[-10]/1000 -> 12.706969200000001 | X36: =ABS((RC[-3]*RC[-11]-RC[-2]*RC[-9])/1000) -> #VALUE! | Y36: =(RC[-14]-RC[1])/RC[-18]*100 -> -114.09497271566235 | Z36: 188.01 | AC36: =VALUE(RC[-27]) -> 2018-10-15T00:00:00.000 | AD36: =IF(RC[21]=42,"*",IF(RC[21]=32,"",RC[21])) -> - | AE36: =RC[-28] -> 24 | AF36: =RC[-28] -> 167.77666666666667 | AG36: =RC[-28] -> 67.443333333333328 | AH36: =RC[-28] -> 6.7833333333333341 | AI36: =RC[-28] -> 143.55000000000001 | AJ36: =RC[-28] -> 39.386666666666663 | AK36: =RC[-28] -> 5.79 | AL36: =RC[-28] -> 28.056666666666668 | AM36: =RC[-28] -> 24.226666666666663 | AN36: =RC[-28] -> 25.486666666666668 | AO36: =RC[-28] -> 67.586666666666673 | AP36: - | AQ36: =RC[-29] -> 0 | AR36: =RC[-29] -> 0 | AS36: - | AT36: =RC[-30] -> 0 | AU36: =RC[-30] -> 0 | AV36: =RC[-30] -> 1.6866666666666668 | AW36: =RC[-30] -> 5.6559999999999997 | AY36: - | AZ36: - | BA36: -
A37: =IF(RC[1]="","",DATEVALUE(RC[1])) -> 43389 | B37: 16.10.18 | C37: 24 | D37: 167.77666666666667 | E37: 67.443333333333328 | F37: 6.7833333333333341 | G37: 143.55000000000001 | H37: 39.386666666666663 | I37: 5.79 | J37: 28.056666666666668 | K37: 24.226666666666663 | L37: 25.486666666666668 | M37: 67.586666666666673 | R37: 1.6866666666666668 | S37: 5.6559999999999997 | T37: =(RC[-16]*RC[-15]-RC[-13]*RC[-12])/1000 -> 5.6614616555555548 | U37: 187.98 | V37: - | W37: =RC[-2]*RC[-10]/1000 -> 12.7049416 | X37: =ABS((RC[-3]*RC[-11]-RC[-2]*RC[-9])/1000) -> #VALUE! | Y37: =(RC[-14]-RC[1])/RC[-18]*100 -> -114.07407407407406 | Z37: 187.98 | AC37: =VALUE(RC[-27]) -> 2018-10-16T00:00:00.000 | AD37: =IF(RC[21]=42,"*",IF(RC[21]=32,"",RC[21])) -> - | AE37: =RC[-28] -> 24 | AF37: =RC[-28] -> 167.77666666666667 | AG37: =RC[-28] -> 67.443333333333328 | AH37: =RC[-28] -> 6.7833333333333341 | AI37: =RC[-28] -> 143.55000000000001 | AJ37: =RC[-28] -> 39.386666666666663 | AK37: =RC[-28] -> 5.79 | AL37: =RC[-28] -> 28.056666666666668 | AM37: =RC[-28] -> 24.226666666666663 | AN37: =RC[-28] -> 25.486666666666668 | AO37: =RC[-28] -> 67.586666666666673 | AP37: - | AQ37: =RC[-29] -> 0 | AR37: =RC[-29] -> 0 | AS37: - | AT37: =RC[-30] -> 0 | AU37: =RC[-30] -> 0 | AV37: =RC[-30] -> 1.6866666666666668 | AW37: =RC[-30] -> 5.6559999999999997 | AY37: - | AZ37: - | BA37: -
A38: =IF(RC[1]="","",DATEVALUE(RC[1])) -> 43390 | B38: 17.10.18 | C38: 24 | D38: 167.77666666666667 | E38: 67.443333333333328 | F38: 6.7833333333333341 | G38: 143.55000000000001 | H38: 39.386666666666663 | I38: 5.79 | J38: 28.056666666666668 | K38: 24.226666666666663 | L38: 25.486666666666668 | M38: 67.586666666666673 | R38: 1.6866666666666668 | S38: 5.6559999999999997 | T38: =(RC[-16]*RC[-15]-RC[-13]*RC[-12])/1000 -> 5.6614616555555548 | U38: 180.88 | V38: - | W38: =RC[-2]*RC[-10]/1000 -> 12.225076266666667 | X38: =ABS((RC[-3]*RC[-11]-RC[-2]*RC[-9])/1000) -> #VALUE! | Y38: =(RC[-14]-RC[1])/RC[-18]*100 -> -109.1280622315105 | Z38: 180.88 | AC38: =VALUE(RC[-27]) -> 2018-10-17T00:00:00.000 | AD38: =IF(RC[21]=42,"*",IF(RC[21]=32,"",RC[21])) -> - | AE38: =RC[-28] -> 24 | AF38: =RC[-28] -> 167.77666666666667 | AG38: =RC[-28] -> 67.443333333333328 | AH38: =RC[-28] -> 6.7833333333333341 | AI38: =RC[-28] -> 143.55000000000001 | AJ38: =RC[-28] -> 39.386666666666663 | AK38: =RC[-28] -> 5.79 | AL38: =RC[-28] -> 28.056666666666668 | AM38: =RC[-28] -> 24.226666666666663 | AN38: =RC[-28] -> 25.486666666666668 | AO38: =RC[-28] -> 67.586666666666673 | AP38: - | AQ38: =RC[-29] -> 0 | AR38: =RC[-29] -> 0 | AS38: - | AT38: =RC[-30] -> 0 | AU38: =RC[-30] -> 0 | AV38: =RC[-30] -> 1.6866666666666668 | AW38: =RC[-30] -> 5.6559999999999997 | AY38: - | AZ38: - | BA38: -
A39: =IF(RC[1]="","",DATEVALUE(RC[1])) -> 43391 | B39: 18.10.18 | C39: 24 | D39: 167.77666666666667 | E39: 67.443333333333328 | F39: 6.7833333333333341 | G39: 143.55000000000001 | H39: 39.386666666666663 | I39: 5.79 | J39: 28.056666666666668 | K39: 24.226666666666663 | L39: 25.486666666666668 | M39: 67.586666666666673 | R39: 1.6866666666666668 | S39: 5.6559999999999997 | T39: -8.0117472000000003 | U39: 187.92 | V39: - | W39: 13.332923999999998 | X39: #VALUE! | Y39: -207.80174391922901 | Z39: 187.92 | AC39: =VALUE(RC[-27]) -> 2018-10-18T00:00:00.000 | AD39: =IF(RC[21]=42,"*",IF(RC[21]=32,"",RC[21])) ->  | AE39: =RC[-28] -> 24 | AF39: =RC[-28] -> 167.77666666666667 | AG39: =RC[-28] -> 67.443333333333328 | AH39: =RC[-28] -> 6.7833333333333341 | AI39: =RC[-28] -> 143.55000000000001 | AJ39: =RC[-28] -> 39.386666666666663 | AK39: =RC[-28] -> 5.79 | AL39: =RC[-28] -> 28.056666666666668 | AM39: =RC[-28] -> 24.226666666666663 | AN39: =RC[-28] -> 25.486666666666668 | AO39: =RC[-28] -> 67.586666666666673 | AP39: - | AQ39: =RC[-29] -> 0 | AR39: =RC[-29] -> 0 | AS39: - | AT39: =RC[-30] -> 0 | AU39: =RC[-30] -> 0 | AV39: =RC[-30] -> 1.6866666666666668 | AW39: =RC[-30] -> 5.6559999999999997
A40: =IF(RC[1]="","",DATEVALUE(RC[1])) -> 43392 | B40: 19.10.18 | C40: 24 | D40: 167.77666666666667 | E40: 67.443333333333328 | F40: 6.7833333333333341 | G40: 143.55000000000001 | H40: 39.386666666666663 | I40: 5.79 | J40: 28.056666666666668 | K40: 24.226666666666663 | L40: 25.486666666666668 | M40: 67.586666666666673 | R40: 1.6866666666666668 | S40: 5.6559999999999997 | T40: -0.68509409999999937 | U40: 108.04 | V40: - | W40: 7.6027748000000006 | X40: #VALUE! | Y40: -111.90129705789306 | Z40: 108.04 | AC40: =VALUE(RC[-27]) -> 2018-10-19T00:00:00.000 | AD40: =IF(RC[21]=42,"*",IF(RC[21]=32,"",RC[21])) ->  | AE40: =RC[-28] -> 24 | AF40: =RC[-28] -> 167.77666666666667 | AG40: =RC[-28] -> 67.443333333333328 | AH40: =RC[-28] -> 6.7833333333333341 | AI40: =RC[-28] -> 143.55000000000001 | AJ40: =RC[-28] -> 39.386666666666663 | AK40: =RC[-28] -> 5.79 | AL40: =RC[-28] -> 28.056666666666668 | AM40: =RC[-28] -> 24.226666666666663 | AN40: =RC[-28] -> 25.486666666666668 | AO40: =RC[-28] -> 67.586666666666673 | AP40: - | AQ40: =RC[-29] -> 0 | AR40: =RC[-29] -> 0 | AS40: - | AT40: =RC[-30] -> 0 | AU40: =RC[-30] -> 0 | AV40: =RC[-30] -> 1.6866666666666668 | AW40: =RC[-30] -> 5.6559999999999997
A41: =IF(RC[1]="","",DATEVALUE(RC[1])) -> 43393 | B41: 20.10.18 | C41: 24 | D41: 167.77666666666667 | E41: 67.443333333333328 | F41: 6.7833333333333341 | G41: 143.55000000000001 | H41: 39.386666666666663 | I41: 5.79 | J41: 28.056666666666668 | K41: 24.226666666666663 | L41: 25.486666666666668 | M41: 67.586666666666673 | R41: 1.6866666666666668 | S41: 5.6559999999999997 | T41: 2.8524159000000004 | U41: 96.33 | V41: - | W41: 6.7960814999999997 | X41: #VALUE! | Y41: -115.98000810482236 | Z41: 96.33 | AC41: =VALUE(RC[-27]) -> 2018-10-20T00:00:00.000 | AD41: =IF(RC[21]=42,"*",IF(RC[21]=32,"",RC[21])) ->  | AE41: =RC[-28] -> 24 | AF41: =RC[-28] -> 167.77666666666667 | AG41: =RC[-28] -> 67.443333333333328 | AH41: =RC[-28] -> 6.7833333333333341 | AI41: =RC[-28] -> 143.55000000000001 | AJ41: =RC[-28] -> 39.386666666666663 | AK41: =RC[-28] -> 5.79 | AL41: =RC[-28] -> 28.056666666666668 | AM41: =RC[-28] -> 24.226666666666663 | AN41: =RC[-28] -> 25.486666666666668 | AO41: =RC[-28] -> 67.586666666666673 | AP41: - | AQ41: =RC[-29] -> 0 | AR41: =RC[-29] -> 0 | AS41: - | AT41: =RC[-30] -> 0 | AU41: =RC[-30] -> 0 | AV41: =RC[-30] -> 1.6866666666666668 | AW41: =RC[-30] -> 5.6559999999999997
A42: =IF(RC[1]="","",DATEVALUE(RC[1])) -> 43394 | B42: 21.10.18 | C42: 24 | D42: 167.77666666666667 | E42: 67.443333333333328 | F42: 6.7833333333333341 | G42: 143.55000000000001 | H42: 39.386666666666663 | I42: 5.79 | J42: 28.056666666666668 | K42: 24.226666666666663 | L42: 25.486666666666668 | M42: 67.586666666666673 | R42: 1.6866666666666668 | S42: 5.6559999999999997 | T42: 0 | U42: 188.13 | V42: - | W42: 12.992257799999999 | X42: #VALUE! | Y42: #DIV/0! | Z42: 188.13 | AC42: =VALUE(RC[-27]) -> 2018-10-21T00:00:00.000 | AD42: =IF(RC[21]=42,"*",IF(RC[21]=32,"",RC[21])) ->  | AE42: =RC[-28] -> 24 | AF42: =RC[-28] -> 167.77666666666667 | AG42: =RC[-28] -> 67.443333333333328 | AH42: =RC[-28] -> 6.7833333333333341 | AI42: =RC[-28] -> 143.55000000000001 | AJ42: =RC[-28] -> 39.386666666666663 | AK42: =RC[-28] -> 5.79 | AL42: =RC[-28] -> 28.056666666666668 | AM42: =RC[-28] -> 24.226666666666663 | AN42: =RC[-28] -> 25.486666666666668 | AO42: =RC[-28] -> 67.586666666666673 | AP42: - | AQ42: =RC[-29] -> 0 | AR42: =RC[-29] -> 0 | AS42: - | AT42: =RC[-30] -> 0 | AU42: =RC[-30] -> 0 | AV42: =RC[-30] -> 1.6866666666666668 | AW42: =RC[-30] -> 5.6559999999999997
A43: =IF(RC[1]="","",DATEVALUE(RC[1])) -> 43395 | B43: 22.10.18 | C43: 24 | D43: 167.77666666666667 | E43: 67.443333333333328 | F43: 6.7833333333333341 | G43: 143.55000000000001 | H43: 39.386666666666663 | I43: 5.79 | J43: 28.056666666666668 | K43: 24.226666666666663 | L43: 25.486666666666668 | M43: 67.586666666666673 | R43: 1.6866666666666668 | S43: 5.6559999999999997 | T43: 0 | U43: 188.06 | V43: - | W43: 13.090856599999999 | X43: #VALUE! | Y43: #DIV/0! | Z43: 188.06 | AC43: =VALUE(RC[-27]) -> 2018-10-22T00:00:00.000 | AD43: =IF(RC[21]=42,"*",IF(RC[21]=32,"",RC[21])) ->  | AE43: =RC[-28] -> 24 | AF43: =RC[-28] -> 167.77666666666667 | AG43: =RC[-28] -> 67.443333333333328 | AH43: =RC[-28] -> 6.7833333333333341 | AI43: =RC[-28] -> 143.55000000000001 | AJ43: =RC[-28] -> 39.386666666666663 | AK43: =RC[-28] -> 5.79 | AL43: =RC[-28] -> 28.056666666666668 | AM43: =RC[-28] -> 24.226666666666663 | AN43: =RC[-28] -> 25.486666666666668 | AO43: =RC[-28] -> 67.586666666666673 | AP43: - | AQ43: =RC[-29] -> 0 | AR43: =RC[-29] -> 0 | AS43: - | AT43: =RC[-30] -> 0 | AU43: =RC[-30] -> 0 | AV43: =RC[-30] -> 1.6866666666666668 | AW43: =RC[-30] -> 5.6559999999999997
A44: =IF(RC[1]="","",DATEVALUE(RC[1])) ->  | C44: 24 | J44: =RC[-5]-RC[-2] -> #VALUE! | T44: =(RC[-16]*RC[-15]-RC[-13]*RC[-12])/1000 -> #VALUE! | W44: =RC[-2]*RC[-10]/1000 -> #VALUE! | X44: =ABS((RC[-3]*RC[-11]-RC[-2]*RC[-9])/1000) -> #VALUE! | Y44: =(RC[-14]-RC[1])/RC[-18]*100 -> #VALUE! | AC44: =VALUE(RC[-27]) -> #VALUE! | AD44: =IF(RC[21]=42,"*",IF(RC[21]=32,"",RC[21])) ->  | AE44: =RC[-28] -> 24 | AF44: =RC[-28] ->  | AG44: =RC[-28] ->  | AH44: =RC[-28] ->  | AI44: =RC[-28] ->  | AJ44: =RC[-28] ->  | AK44: =RC[-28] ->  | AL44: =RC[-28] -> #VALUE! | AM44: =RC[-28] ->  | AN44: =RC[-28] ->  | AO44: =RC[-28] ->  | AP44: - | AQ44: =RC[-29] -> 0 | AR44: =RC[-29] -> 0 | AS44: - | AT44: =RC[-30] -> 0 | AU44: =RC[-30] -> 0 | AV44: =RC[-30] ->  | AW44: =RC[-30] -> 
A45: =IF(RC[1]="","",DATEVALUE(RC[1])) ->  | C45: 24 | T45: =(RC[-16]*RC[-15]-RC[-13]*RC[-12])/1000 -> #VALUE! | W45: =RC[-2]*RC[-10]/1000 -> #VALUE! | X45: =ABS((RC[-3]*RC[-11]-RC[-2]*RC[-9])/1000) -> #VALUE! | Y45: =(RC[-14]-RC[1])/RC[-18]*100 -> #VALUE! | AC45: =VALUE(RC[-27]) -> #VALUE! | AD45: =IF(RC[21]=42,"*",IF(RC[21]=32,"",RC[21])) ->  | AE45: =RC[-28] -> 24 | AF45: =RC[-28] ->  | AG45: =RC[-28] ->  | AH45: =RC[-28] ->  | AI45: =RC[-28] ->  | AJ45: =RC[-28] ->  | AK45: =RC[-28] ->  | AL45: =RC[-28] -> 0 | AM45: =RC[-28] ->  | AN45: =RC[-28] ->  | AO45: =RC[-28] ->  | AP45: - | AQ45: =RC[-29] -> 0 | AR45: =RC[-29] -> 0 | AS45: - | AT45: =RC[-30] -> 0 | AU45: =RC[-30] -> 0 | AV45: =RC[-30] ->  | AW45: =RC[-30] -> 
A46: =IF(RC[1]="","",DATEVALUE(RC[1])) ->  | C46: 24 | T46: =(RC[-16]*RC[-15]-RC[-13]*RC[-12])/1000 -> #VALUE! | W46: =RC[-2]*RC[-10]/1000 -> #VALUE! | X46: =ABS((RC[-3]*RC[-11]-RC[-2]*RC[-9])/1000) -> #VALUE! | Y46: =(RC[-14]-RC[1])/RC[-18]*100 -> #VALUE! | AC46: =VALUE(RC[-27]) -> #VALUE! | AD46: =IF(RC[21]=42,"*",IF(RC[21]=32,"",RC[21])) ->  | AE46: =RC[-28] -> 24 | AF46: =RC[-28] ->  | AG46: =RC[-28] ->  | AH46: =RC[-28] ->  | AI46: =RC[-28] ->  | AJ46: =RC[-28] ->  | AK46: =RC[-28] ->  | AL46: =RC[-28] -> 0 | AM46: =RC[-28] ->  | AN46: =RC[-28] ->  | AO46: =RC[-28] ->  | AP46: - | AQ46: =RC[-29] -> 0 | AR46: =RC[-29] -> 0 | AS46: - | AT46: =RC[-30] -> 0 | AU46: =RC[-30] -> 0 | AV46: =RC[-30] ->  | AW46: =RC[-30] -> 
A47: =IF(RC[1]="","",DATEVALUE(RC[1])) ->  | C47: 24 | T47: =(RC[-16]*RC[-15]-RC[-13]*RC[-12])/1000 -> #VALUE! | W47: =RC[-2]*RC[-10]/1000 -> #VALUE! | X47: =ABS((RC[-3]*RC[-11]-RC[-2]*RC[-9])/1000) -> #VALUE! | Y47: =(RC[-14]-RC[1])/RC[-18]*100 -> #VALUE! | AC47: =VALUE(RC[-27]) -> #VALUE! | AD47: =IF(RC[21]=42,"*",IF(RC[21]=32,"",RC[21])) ->  | AE47: =RC[-28] -> 24 | AF47: =RC[-28] ->  | AG47: =RC[-28] ->  | AH47: =RC[-28] ->  | AI47: =RC[-28] ->  | AJ47: =RC[-28] ->  | AK47: =RC[-28] ->  | AL47: =RC[-28] -> 0 | AM47: =RC[-28] ->  | AN47: =RC[-28] ->  | AO47: =RC[-28] ->  | AP47: - | AQ47: =RC[-29] -> 0 | AR47: =RC[-29] -> 0 | AS47: - | AT47: =RC[-30] -> 0 | AU47: =RC[-30] -> 0 | AV47: =RC[-30] ->  | AW47: =RC[-30] -> 
A48: =IF(RC[1]="","",DATEVALUE(RC[1])) ->  | C48: 24 | T48: =(RC[-16]*RC[-15]-RC[-13]*RC[-12])/1000 -> #VALUE! | W48: =RC[-2]*RC[-10]/1000 -> #VALUE! | X48: =ABS((RC[-3]*RC[-11]-RC[-2]*RC[-9])/1000) -> #VALUE! | Y48: =(RC[-14]-RC[1])/RC[-18]*100 -> #VALUE! | AC48: =VALUE(RC[-27]) -> #VALUE! | AD48: =IF(RC[21]=42,"*",IF(RC[21]=32,"",RC[21])) ->  | AE48: =RC[-28] -> 24 | AF48: =RC[-28] ->  | AG48: =RC[-28] ->  | AH48: =RC[-28] ->  | AI48: =RC[-28] ->  | AJ48: =RC[-28] ->  | AK48: =RC[-28] ->  | AL48: =RC[-28] -> 0 | AM48: =RC[-28] ->  | AN48: =RC[-28] ->  | AO48: =RC[-28] ->  | AP48: - | AQ48: =RC[-29] -> 0 | AR48: =RC[-29] -> 0 | AS48: - | AT48: =RC[-30] -> 0 | AU48: =RC[-30] -> 0 | AV48: =RC[-30] ->  | AW48: =RC[-30] -> 
A49: =IF(RC[1]="","",DATEVALUE(RC[1])) ->  | C49: 24 | T49: =(RC[-16]*RC[-15]-RC[-13]*RC[-12])/1000 -> #VALUE! | W49: =RC[-2]*RC[-10]/1000 -> #VALUE! | X49: =ABS((RC[-3]*RC[-11]-RC[-2]*RC[-9])/1000) -> #VALUE! | Y49: =(RC[-14]-RC[1])/RC[-18]*100 -> #VALUE! | AC49: =VALUE(RC[-27]) -> #VALUE! | AD49: =IF(RC[21]=42,"*",IF(RC[21]=32,"",RC[21])) ->  | AE49: =RC[-28] -> 24 | AF49: =RC[-28] ->  | AG49: =RC[-28] ->  | AH49: =RC[-28] ->  | AI49: =RC[-28] ->  | AJ49: =RC[-28] ->  | AK49: =RC[-28] ->  | AL49: =RC[-28] -> 0 | AM49: =RC[-28] ->  | AN49: =RC[-28] ->  | AO49: =RC[-28] ->  | AP49: - | AQ49: =RC[-29] -> 0 | AR49: =RC[-29] -> 0 | AS49: - | AT49: =RC[-30] -> 0 | AU49: =RC[-30] -> 0 | AV49: =RC[-30] ->  | AW49: =RC[-30] -> 
A50: =IF(RC[1]="","",DATEVALUE(RC[1])) ->  | T50: =(RC[-16]*RC[-15]-RC[-13]*RC[-12])/1000 -> #VALUE! | W50: =RC[-2]*RC[-10]/1000 -> #VALUE! | X50: =ABS((RC[-3]*RC[-11]-RC[-2]*RC[-9])/1000) -> #VALUE! | Y50: =(RC[-14]-RC[1])/RC[-18]*100 -> #VALUE! | AC50: =VALUE(RC[-27]) -> #VALUE! | AD50: =IF(RC[21]=42,"*",IF(RC[21]=32,"",RC[21])) ->  | AE50: =RC[-28] ->  | AF50: =RC[-28] ->  | AG50: =RC[-28] ->  | AH50: =RC[-28] ->  | AI50: =RC[-28] ->  | AJ50: =RC[-28] ->  | AK50: =RC[-28] ->  | AL50: =RC[-28] -> 0 | AM50: =RC[-28] ->  | AN50: =RC[-28] ->  | AO50: =RC[-28] ->  | AP50: - | AQ50: =RC[-29] -> 0 | AR50: =RC[-29] -> 0 | AS50: - | AT50: =RC[-30] -> 0 | AU50: =RC[-30] -> 0 | AV50: =RC[-30] ->  | AW50: =RC[-30] -> 
A51: =IF(RC[1]="","",DATEVALUE(RC[1])) ->  | T51: =(RC[-16]*RC[-15]-RC[-13]*RC[-12])/1000 -> #VALUE! | W51: =RC[-2]*RC[-10]/1000 -> #VALUE! | X51: =ABS((RC[-3]*RC[-11]-RC[-2]*RC[-9])/1000) -> #VALUE! | Y51: =(RC[-14]-RC[1])/RC[-18]*100 -> #VALUE! | AC51: =VALUE(RC[-27]) -> #VALUE! | AD51: =IF(RC[21]=42,"*",IF(RC[21]=32,"",RC[21])) ->  | AE51: =RC[-28] ->  | AF51: =RC[-28] ->  | AG51: =RC[-28] ->  | AH51: =RC[-28] ->  | AI51: =RC[-28] ->  | AJ51: =RC[-28] ->  | AK51: =RC[-28] ->  | AL51: =RC[-28] -> 0 | AM51: =RC[-28] ->  | AN51: =RC[-28] ->  | AO51: =RC[-28] ->  | AP51: - | AQ51: =RC[-29] -> 0 | AR51: =RC[-29] -> 0 | AS51: - | AT51: =RC[-30] -> 0 | AU51: =RC[-30] -> 0 | AV51: =RC[-30] ->  | AW51: =RC[-30] -> 
A52: =IF(RC[1]="","",DATEVALUE(RC[1])) ->  | T52: =(RC[-16]*RC[-15]-RC[-13]*RC[-12])/1000 -> #VALUE! | W52: =RC[-2]*RC[-10]/1000 -> #VALUE! | X52: =ABS((RC[-3]*RC[-11]-RC[-2]*RC[-9])/1000) -> #VALUE! | Y52: =(RC[-14]-RC[1])/RC[-18]*100 -> #VALUE! | AC52: =VALUE(RC[-27]) -> #VALUE! | AD52: =IF(RC[21]=42,"*",IF(RC[21]=32,"",RC[21])) ->  | AE52: =RC[-28] ->  | AF52: =RC[-28] ->  | AG52: =RC[-28] ->  | AH52: =RC[-28] ->  | AI52: =RC[-28] ->  | AJ52: =RC[-28] ->  | AK52: =RC[-28] ->  | AL52: =RC[-28] -> 0 | AM52: =RC[-28] ->  | AN52: =RC[-28] ->  | AO52: =RC[-28] ->  | AP52: - | AQ52: =RC[-29] -> 0 | AR52: =RC[-29] -> 0 | AS52: - | AT52: =RC[-30] -> 0 | AU52: =RC[-30] -> 0 | AV52: =RC[-30] ->  | AW52: =RC[-30] -> 
A53: =IF(RC[1]="","",DATEVALUE(RC[1])) ->  | T53: =(RC[-16]*RC[-15]-RC[-13]*RC[-12])/1000 -> #VALUE! | W53: =RC[-2]*RC[-10]/1000 -> #VALUE! | X53: =ABS((RC[-3]*RC[-11]-RC[-2]*RC[-9])/1000) -> #VALUE! | Y53: =(RC[-14]-RC[1])/RC[-18]*100 -> #VALUE! | AC53: =VALUE(RC[-27]) -> #VALUE! | AD53: =IF(RC[21]=42,"*",IF(RC[21]=32,"",RC[21])) ->  | AE53: =RC[-28] ->  | AF53: =RC[-28] ->  | AG53: =RC[-28] ->  | AH53: =RC[-28] ->  | AI53: =RC[-28] ->  | AJ53: =RC[-28] ->  | AK53: =RC[-28] ->  | AL53: =RC[-28] -> 0 | AM53: =RC[-28] ->  | AN53: =RC[-28] ->  | AO53: =RC[-28] ->  | AP53: - | AQ53: =RC[-29] -> 0 | AR53: =RC[-29] -> 0 | AS53: - | AT53: =RC[-30] -> 0 | AU53: =RC[-30] -> 0 | AV53: =RC[-30] ->  | AW53: =RC[-30] -> 
A54: =IF(RC[1]="","",DATEVALUE(RC[1])) ->  | T54: =(RC[-16]*RC[-15]-RC[-13]*RC[-12])/1000 -> #VALUE! | W54: =RC[-2]*RC[-10]/1000 -> #VALUE! | X54: =ABS((RC[-3]*RC[-11]-RC[-2]*RC[-9])/1000) -> #VALUE! | Y54: =(RC[-14]-RC[1])/RC[-18]*100 -> #VALUE! | AC54: =VALUE(RC[-27]) -> #VALUE! | AD54: =IF(RC[21]=42,"*",IF(RC[21]=32,"",RC[21])) ->  | AE54: =RC[-28] ->  | AF54: =RC[-28] ->  | AG54: =RC[-28] ->  | AH54: =RC[-28] ->  | AI54: =RC[-28] ->  | AJ54: =RC[-28] ->  | AK54: =RC[-28] ->  | AL54: =RC[-28] -> 0 | AM54: =RC[-28] ->  | AN54: =RC[-28] ->  | AO54: =RC[-28] ->  | AP54: - | AQ54: =RC[-29] -> 0 | AR54: =RC[-29] -> 0 | AS54: - | AT54: =RC[-30] -> 0 | AU54: =RC[-30] -> 0 | AV54: =RC[-30] ->  | AW54: =RC[-30] -> 
A55: =IF(RC[1]="","",DATEVALUE(RC[1])) ->  | T55: =(RC[-16]*RC[-15]-RC[-13]*RC[-12])/1000 -> #VALUE! | W55: =RC[-2]*RC[-10]/1000 -> #VALUE! | X55: =ABS((RC[-3]*RC[-11]-RC[-2]*RC[-9])/1000) -> #VALUE! | Y55: =(RC[-14]-RC[1])/RC[-18]*100 -> #VALUE! | AC55: =VALUE(RC[-27]) -> #VALUE! | AD55: =IF(RC[21]=42,"*",IF(RC[21]=32,"",RC[21])) ->  | AE55: =RC[-28] ->  | AF55: =RC[-28] ->  | AG55: =RC[-28] ->  | AH55: =RC[-28] ->  | AI55: =RC[-28] ->  | AJ55: =RC[-28] ->  | AK55: =RC[-28] ->  | AL55: =RC[-28] -> 0 | AM55: =RC[-28] ->  | AN55: =RC[-28] ->  | AO55: =RC[-28] ->  | AP55: - | AQ55: =RC[-29] -> 0 | AR55: =RC[-29] -> 0 | AS55: - | AT55: =RC[-30] -> 0 | AU55: =RC[-30] -> 0 | AV55: =RC[-30] ->  | AW55: =RC[-30] -> 
A56: =IF(RC[1]="","",DATEVALUE(RC[1])) ->  | T56: =(RC[-16]*RC[-15]-RC[-13]*RC[-12])/1000 -> #VALUE! | W56: =RC[-2]*RC[-10]/1000 -> #VALUE! | X56: =ABS((RC[-3]*RC[-11]-RC[-2]*RC[-9])/1000) -> #VALUE! | Y56: =(RC[-14]-RC[1])/RC[-18]*100 -> #VALUE! | AC56: =VALUE(RC[-27]) -> #VALUE! | AD56: =IF(RC[21]=42,"*",IF(RC[21]=32,"",RC[21])) ->  | AE56: =RC[-28] ->  | AF56: =RC[-28] ->  | AG56: =RC[-28] ->  | AH56: =RC[-28] ->  | AI56: =RC[-28] ->  | AJ56: =RC[-28] ->  | AK56: =RC[-28] ->  | AL56: =RC[-28] -> 0 | AM56: =RC[-28] ->  | AN56: =RC[-28] ->  | AO56: =RC[-28] ->  | AP56: - | AQ56: =RC[-29] -> 0 | AR56: =RC[-29] -> 0 | AS56: - | AT56: =RC[-30] -> 0 | AU56: =RC[-30] -> 0 | AV56: =RC[-30] ->  | AW56: =RC[-30] -> 
A57: =IF(RC[1]="","",DATEVALUE(RC[1])) ->  | T57: =(RC[-16]*RC[-15]-RC[-13]*RC[-12])/1000 -> #VALUE! | W57: =RC[-2]*RC[-10]/1000 -> #VALUE! | X57: =ABS((RC[-3]*RC[-11]-RC[-2]*RC[-9])/1000) -> #VALUE! | Y57: =(RC[-14]-RC[1])/RC[-18]*100 -> #VALUE! | AC57: =VALUE(RC[-27]) -> #VALUE! | AD57: =IF(RC[21]=42,"*",IF(RC[21]=32,"",RC[21])) ->  | AE57: =RC[-28] ->  | AF57: =RC[-28] ->  | AG57: =RC[-28] ->  | AH57: =RC[-28] ->  | AI57: =RC[-28] ->  | AJ57: =RC[-28] ->  | AK57: =RC[-28] ->  | AL57: =RC[-28] -> 0 | AM57: =RC[-28] ->  | AN57: =RC[-28] ->  | AO57: =RC[-28] ->  | AP57: - | AQ57: =RC[-29] -> 0 | AR57: =RC[-29] -> 0 | AS57: - | AT57: =RC[-30] -> 0 | AU57: =RC[-30] -> 0 | AV57: =RC[-30] ->  | AW57: =RC[-30] -> 
A58: =IF(RC[1]="","",DATEVALUE(RC[1])) ->  | T58: =(RC[-16]*RC[-15]-RC[-13]*RC[-12])/1000 -> #VALUE! | W58: =RC[-2]*RC[-10]/1000 -> #VALUE! | X58: =ABS((RC[-3]*RC[-11]-RC[-2]*RC[-9])/1000) -> #VALUE! | Y58: =(RC[-14]-RC[1])/RC[-18]*100 -> #VALUE! | AC58: =VALUE(RC[-27]) -> #VALUE! | AD58: =IF(RC[21]=42,"*",IF(RC[21]=32,"",RC[21])) ->  | AE58: =RC[-28] ->  | AF58: =RC[-28] ->  | AG58: =RC[-28] ->  | AH58: =RC[-28] ->  | AI58: =RC[-28] ->  | AJ58: =RC[-28] ->  | AK58: =RC[-28] ->  | AL58: =RC[-28] -> 0 | AM58: =RC[-28] ->  | AN58: =RC[-28] ->  | AO58: =RC[-28] ->  | AP58: - | AQ58: =RC[-29] -> 0 | AR58: =RC[-29] -> 0 | AS58: - | AT58: =RC[-30] -> 0 | AU58: =RC[-30] -> 0 | AV58: =RC[-30] ->  | AW58: =RC[-30] -> 
A59: =IF(RC[1]="","",DATEVALUE(RC[1])) ->  | T59: =(RC[-16]*RC[-15]-RC[-13]*RC[-12])/1000 -> #VALUE! | W59: =RC[-2]*RC[-10]/1000 -> #VALUE! | X59: =ABS((RC[-3]*RC[-11]-RC[-2]*RC[-9])/1000) -> #VALUE! | Y59: =(RC[-14]-RC[1])/RC[-18]*100 -> #VALUE! | AC59: =VALUE(RC[-27]) -> #VALUE! | AD59: =IF(RC[21]=42,"*",IF(RC[21]=32,"",RC[21])) ->  | AE59: =RC[-28] ->  | AF59: =RC[-28] ->  | AG59: =RC[-28] ->  | AH59: =RC[-28] ->  | AI59: =RC[-28] ->  | AJ59: =RC[-28] ->  | AK59: =RC[-28] ->  | AL59: =RC[-28] -> 0 | AM59: =RC[-28] ->  | AN59: =RC[-28] ->  | AO59: =RC[-28] ->  | AP59: - | AQ59: =RC[-29] -> 0 | AR59: =RC[-29] -> 0 | AS59: - | AT59: =RC[-30] -> 0 | AU59: =RC[-30] -> 0 | AV59: =RC[-30] ->  | AW59: =RC[-30] -> 
A60: =IF(RC[1]="","",DATEVALUE(RC[1])) ->  | T60: =(RC[-16]*RC[-15]-RC[-13]*RC[-12])/1000 -> #VALUE! | W60: =RC[-2]*RC[-10]/1000 -> #VALUE! | X60: =ABS((RC[-3]*RC[-11]-RC[-2]*RC[-9])/1000) -> #VALUE! | Y60: =(RC[-14]-RC[1])/RC[-18]*100 -> #VALUE! | AC60: =VALUE(RC[-27]) -> #VALUE! | AD60: =IF(RC[21]=42,"*",IF(RC[21]=32,"",RC[21])) ->  | AE60: =RC[-28] ->  | AF60: =RC[-28] ->  | AG60: =RC[-28] ->  | AH60: =RC[-28] ->  | AI60: =RC[-28] ->  | AJ60: =RC[-28] ->  | AK60: =RC[-28] ->  | AL60: =RC[-28] -> 0 | AM60: =RC[-28] ->  | AN60: =RC[-28] ->  | AO60: =RC[-28] ->  | AP60: - | AQ60: =RC[-29] -> 0 | AR60: =RC[-29] -> 0 | AS60: - | AT60: =RC[-30] -> 0 | AU60: =RC[-30] -> 0 | AV60: =RC[-30] ->  | AW60: =RC[-30] -> 
A61: =IF(RC[1]="","",DATEVALUE(RC[1])) ->  | T61: =(RC[-16]*RC[-15]-RC[-13]*RC[-12])/1000 -> #VALUE! | W61: =RC[-2]*RC[-10]/1000 -> #VALUE! | X61: =ABS((RC[-3]*RC[-11]-RC[-2]*RC[-9])/1000) -> #VALUE! | Y61: =(RC[-14]-RC[1])/RC[-18]*100 -> #VALUE! | AC61: =VALUE(RC[-27]) -> #VALUE! | AD61: =IF(RC[21]=42,"*",IF(RC[21]=32,"",RC[21])) ->  | AE61: =RC[-28] ->  | AF61: =RC[-28] ->  | AG61: =RC[-28] ->  | AH61: =RC[-28] ->  | AI61: =RC[-28] ->  | AJ61: =RC[-28] ->  | AK61: =RC[-28] ->  | AL61: =RC[-28] -> 0 | AM61: =RC[-28] ->  | AN61: =RC[-28] ->  | AO61: =RC[-28] ->  | AP61: - | AQ61: =RC[-29] -> 0 | AR61: =RC[-29] -> 0 | AS61: - | AT61: =RC[-30] -> 0 | AU61: =RC[-30] -> 0 | AV61: =RC[-30] ->  | AW61: =RC[-30] -> 
A62: =IF(RC[1]="","",DATEVALUE(RC[1])) ->  | T62: =(RC[-16]*RC[-15]-RC[-13]*RC[-12])/1000 -> #VALUE! | W62: =RC[-2]*RC[-10]/1000 -> #VALUE! | X62: =ABS((RC[-3]*RC[-11]-RC[-2]*RC[-9])/1000) -> #VALUE! | Y62: =(RC[-14]-RC[1])/RC[-18]*100 -> #VALUE! | AC62: =VALUE(RC[-27]) -> #VALUE! | AD62: =IF(RC[21]=42,"*",IF(RC[21]=32,"",RC[21])) ->  | AE62: =RC[-28] ->  | AF62: =RC[-28] ->  | AG62: =RC[-28] ->  | AH62: =RC[-28] ->  | AI62: =RC[-28] ->  | AJ62: =RC[-28] ->  | AK62: =RC[-28] ->  | AL62: =RC[-28] -> 0 | AM62: =RC[-28] ->  | AN62: =RC[-28] ->  | AO62: =RC[-28] ->  | AP62: - | AQ62: =RC[-29] -> 0 | AR62: =RC[-29] -> 0 | AS62: - | AT62: =RC[-30] -> 0 | AU62: =RC[-30] -> 0 | AV62: =RC[-30] ->  | AW62: =RC[-30] -> 
A63: =IF(RC[1]="","",DATEVALUE(RC[1])) ->  | T63: =(RC[-16]*RC[-15]-RC[-13]*RC[-12])/1000 -> #VALUE! | W63: =RC[-2]*RC[-10]/1000 -> #VALUE! | X63: =ABS((RC[-3]*RC[-11]-RC[-2]*RC[-9])/1000) -> #VALUE! | Y63: =(RC[-14]-RC[1])/RC[-18]*100 -> #VALUE! | AC63: =VALUE(RC[-27]) -> #VALUE! | AD63: =IF(RC[21]=42,"*",IF(RC[21]=32,"",RC[21])) ->  | AE63: =RC[-28] ->  | AF63: =RC[-28] ->  | AG63: =RC[-28] ->  | AH63: =RC[-28] ->  | AI63: =RC[-28] ->  | AJ63: =RC[-28] ->  | AK63: =RC[-28] ->  | AL63: =RC[-28] -> 0 | AM63: =RC[-28] ->  | AN63: =RC[-28] ->  | AO63: =RC[-28] ->  | AP63: - | AQ63: =RC[-29] -> 0 | AR63: =RC[-29] -> 0 | AS63: - | AT63: =RC[-30] -> 0 | AU63: =RC[-30] -> 0 | AV63: =RC[-30] ->  | AW63: =RC[-30] -> 
A64: =IF(RC[1]="","",DATEVALUE(RC[1])) ->  | T64: =(RC[-16]*RC[-15]-RC[-13]*RC[-12])/1000 -> #VALUE! | W64: =RC[-2]*RC[-10]/1000 -> #VALUE! | X64: =ABS((RC[-3]*RC[-11]-RC[-2]*RC[-9])/1000) -> #VALUE! | Y64: =(RC[-14]-RC[1])/RC[-18]*100 -> #VALUE! | AC64: =VALUE(RC[-27]) -> #VALUE! | AD64: =IF(RC[21]=42,"*",IF(RC[21]=32,"",RC[21])) ->  | AE64: =RC[-28] ->  | AF64: =RC[-28] ->  | AG64: =RC[-28] ->  | AH64: =RC[-28] ->  | AI64: =RC[-28] ->  | AJ64: =RC[-28] ->  | AK64: =RC[-28] ->  | AL64: =RC[-28] -> 0 | AM64: =RC[-28] ->  | AN64: =RC[-28] ->  | AO64: =RC[-28] ->  | AP64: - | AQ64: =RC[-29] -> 0 | AR64: =RC[-29] -> 0 | AS64: - | AT64: =RC[-30] -> 0 | AU64: =RC[-30] -> 0 | AV64: =RC[-30] ->  | AW64: =RC[-30] -> 
A65: =IF(RC[1]="","",DATEVALUE(RC[1])) ->  | T65: =(RC[-16]*RC[-15]-RC[-13]*RC[-12])/1000 -> #VALUE! | W65: =RC[-2]*RC[-10]/1000 -> #VALUE! | X65: =ABS((RC[-3]*RC[-11]-RC[-2]*RC[-9])/1000) -> #VALUE! | Y65: =(RC[-14]-RC[1])/RC[-18]*100 -> #VALUE! | AC65: =VALUE(RC[-27]) -> #VALUE! | AD65: =IF(RC[21]=42,"*",IF(RC[21]=32,"",RC[21])) ->  | AE65: =RC[-28] ->  | AF65: =RC[-28] ->  | AG65: =RC[-28] ->  | AH65: =RC[-28] ->  | AI65: =RC[-28] ->  | AJ65: =RC[-28] ->  | AK65: =RC[-28] ->  | AL65: =RC[-28] -> 0 | AM65: =RC[-28] ->  | AN65: =RC[-28] ->  | AO65: =RC[-28] ->  | AP65: - | AQ65: =RC[-29] -> 0 | AR65: =RC[-29] -> 0 | AS65: - | AT65: =RC[-30] -> 0 | AU65: =RC[-30] -> 0 | AV65: =RC[-30] ->  | AW65: =RC[-30] -> 
A66: =IF(RC[1]="","",DATEVALUE(RC[1])) ->  | T66: =(RC[-16]*RC[-15]-RC[-13]*RC[-12])/1000 -> #VALUE! | W66: =RC[-2]*RC[-10]/1000 -> #VALUE! | X66: =ABS((RC[-3]*RC[-11]-RC[-2]*RC[-9])/1000) -> #VALUE! | Y66: =(RC[-14]-RC[1])/RC[-18]*100 -> #VALUE! | AC66: =VALUE(RC[-27]) -> #VALUE! | AD66: =IF(RC[21]=42,"*",IF(RC[21]=32,"",RC[21])) ->  | AE66: =RC[-28] ->  | AF66: =RC[-28] ->  | AG66: =RC[-28] ->  | AH66: =RC[-28] ->  | AI66: =RC[-28] ->  | AJ66: =RC[-28] ->  | AK66: =RC[-28] ->  | AL66: =RC[-28] -> 0 | AM66: =RC[-28] ->  | AN66: =RC[-28] ->  | AO66: =RC[-28] ->  | AP66: - | AQ66: =RC[-29] -> 0 | AR66: =RC[-29] -> 0 | AS66: - | AT66: =RC[-30] -> 0 | AU66: =RC[-30] -> 0 | AV66: =RC[-30] ->  | AW66: =RC[-30] -> 
A67: =IF(RC[1]="","",DATEVALUE(RC[1])) ->  | T67: =(RC[-16]*RC[-15]-RC[-13]*RC[-12])/1000 -> #VALUE! | W67: =RC[-2]*RC[-10]/1000 -> #VALUE! | X67: =ABS((RC[-3]*RC[-11]-RC[-2]*RC[-9])/1000) -> #VALUE! | Y67: =(RC[-14]-RC[1])/RC[-18]*100 -> #VALUE! | AC67: =VALUE(RC[-27]) -> #VALUE! | AD67: =IF(RC[21]=42,"*",IF(RC[21]=32,"",RC[21])) ->  | AE67: =RC[-28] ->  | AF67: =RC[-28] ->  | AG67: =RC[-28] ->  | AH67: =RC[-28] ->  | AI67: =RC[-28] ->  | AJ67: =RC[-28] ->  | AK67: =RC[-28] ->  | AL67: =RC[-28] -> 0 | AM67: =RC[-28] ->  | AN67: =RC[-28] ->  | AO67: =RC[-28] ->  | AP67: - | AQ67: =RC[-29] -> 0 | AR67: =RC[-29] -> 0 | AS67: - | AT67: =RC[-30] -> 0 | AU67: =RC[-30] -> 0 | AV67: =RC[-30] ->  | AW67: =RC[-30] -> 
A68: =IF(RC[1]="","",DATEVALUE(RC[1])) ->  | T68: =(RC[-16]*RC[-15]-RC[-13]*RC[-12])/1000 -> #VALUE! | W68: =RC[-2]*RC[-10]/1000 -> #VALUE! | X68: =ABS((RC[-3]*RC[-11]-RC[-2]*RC[-9])/1000) -> #VALUE! | Y68: =(RC[-14]-RC[1])/RC[-18]*100 -> #VALUE! | AC68: =VALUE(RC[-27]) -> #VALUE! | AD68: =IF(RC[21]=42,"*",IF(RC[21]=32,"",RC[21])) ->  | AE68: =RC[-28] ->  | AF68: =RC[-28] ->  | AG68: =RC[-28] ->  | AH68: =RC[-28] ->  | AI68: =RC[-28] ->  | AJ68: =RC[-28] ->  | AK68: =RC[-28] ->  | AL68: =RC[-28] -> 0 | AM68: =RC[-28] ->  | AN68: =RC[-28] ->  | AO68: =RC[-28] ->  | AP68: - | AQ68: =RC[-29] -> 0 | AR68: =RC[-29] -> 0 | AS68: - | AT68: =RC[-30] -> 0 | AU68: =RC[-30] -> 0 | AV68: =RC[-30] ->  | AW68: =RC[-30] -> 
A69: =IF(RC[1]="","",DATEVALUE(RC[1])) ->  | T69: =(RC[-16]*RC[-15]-RC[-13]*RC[-12])/1000 -> #VALUE! | W69: =RC[-2]*RC[-10]/1000 -> #VALUE! | X69: =ABS((RC[-3]*RC[-11]-RC[-2]*RC[-9])/1000) -> #VALUE! | Y69: =(RC[-14]-RC[1])/RC[-18]*100 -> #VALUE! | AC69: =VALUE(RC[-27]) -> #VALUE! | AD69: =IF(RC[21]=42,"*",IF(RC[21]=32,"",RC[21])) ->  | AE69: =RC[-28] ->  | AF69: =RC[-28] ->  | AG69: =RC[-28] ->  | AH69: =RC[-28] ->  | AI69: =RC[-28] ->  | AJ69: =RC[-28] ->  | AK69: =RC[-28] ->  | AL69: =RC[-28] -> 0 | AM69: =RC[-28] ->  | AN69: =RC[-28] ->  | AO69: =RC[-28] ->  | AP69: - | AQ69: =RC[-29] -> 0 | AR69: =RC[-29] -> 0 | AS69: - | AT69: =RC[-30] -> 0 | AU69: =RC[-30] -> 0 | AV69: =RC[-30] ->  | AW69: =RC[-30] -> 
A70: =IF(RC[1]="","",DATEVALUE(RC[1])) ->  | T70: =(RC[-16]*RC[-15]-RC[-13]*RC[-12])/1000 -> #VALUE! | W70: =RC[-2]*RC[-10]/1000 -> #VALUE! | X70: =ABS((RC[-3]*RC[-11]-RC[-2]*RC[-9])/1000) -> #VALUE! | Y70: =(RC[-14]-RC[1])/RC[-18]*100 -> #VALUE! | AC70: =VALUE(RC[-27]) -> #VALUE! | AD70: =IF(RC[21]=42,"*",IF(RC[21]=32,"",RC[21])) ->  | AE70: =RC[-28] ->  | AF70: =RC[-28] ->  | AG70: =RC[-28] ->  | AH70: =RC[-28] ->  | AI70: =RC[-28] ->  | AJ70: =RC[-28] ->  | AK70: =RC[-28] ->  | AL70: =RC[-28] -> 0 | AM70: =RC[-28] ->  | AN70: =RC[-28] ->  | AO70: =RC[-28] ->  | AP70: - | AQ70: =RC[-29] -> 0 | AR70: =RC[-29] -> 0 | AS70: - | AT70: =RC[-30] -> 0 | AU70: =RC[-30] -> 0 | AV70: =RC[-30] ->  | AW70: =RC[-30] -> 
A71: =IF(RC[1]="","",DATEVALUE(RC[1])) ->  | T71: =(RC[-16]*RC[-15]-RC[-13]*RC[-12])/1000 -> #VALUE! | W71: =RC[-2]*RC[-10]/1000 -> #VALUE! | X71: =ABS((RC[-3]*RC[-11]-RC[-2]*RC[-9])/1000) -> #VALUE! | Y71: =(RC[-14]-RC[1])/RC[-18]*100 -> #VALUE! | AC71: =VALUE(RC[-27]) -> #VALUE! | AD71: =IF(RC[21]=42,"*",IF(RC[21]=32,"",RC[21])) ->  | AE71: =RC[-28] ->  | AF71: =RC[-28] ->  | AG71: =RC[-28] ->  | AH71: =RC[-28] ->  | AI71: =RC[-28] ->  | AJ71: =RC[-28] ->  | AK71: =RC[-28] ->  | AL71: =RC[-28] -> 0 | AM71: =RC[-28] ->  | AN71: =RC[-28] ->  | AO71: =RC[-28] ->  | AP71: - | AQ71: =RC[-29] -> 0 | AR71: =RC[-29] -> 0 | AS71: - | AT71: =RC[-30] -> 0 | AU71: =RC[-30] -> 0 | AV71: =RC[-30] ->  | AW71: =RC[-30] -> 
A72: =IF(RC[1]="","",DATEVALUE(RC[1])) ->  | T72: =(RC[-16]*RC[-15]-RC[-13]*RC[-12])/1000 -> #VALUE! | W72: =RC[-2]*RC[-10]/1000 -> #VALUE! | X72: =ABS((RC[-3]*RC[-11]-RC[-2]*RC[-9])/1000) -> #VALUE! | Y72: =(RC[-14]-RC[1])/RC[-18]*100 -> #VALUE! | AC72: =VALUE(RC[-27]) -> #VALUE! | AD72: =IF(RC[21]=42,"*",IF(RC[21]=32,"",RC[21])) ->  | AE72: =RC[-28] ->  | AF72: =RC[-28] ->  | AG72: =RC[-28] ->  | AH72: =RC[-28] ->  | AI72: =RC[-28] ->  | AJ72: =RC[-28] ->  | AK72: =RC[-28] ->  | AL72: =RC[-28] -> 0 | AM72: =RC[-28] ->  | AN72: =RC[-28] ->  | AO72: =RC[-28] ->  | AP72: - | AQ72: =RC[-29] -> 0 | AR72: =RC[-29] -> 0 | AS72: - | AT72: =RC[-30] -> 0 | AU72: =RC[-30] -> 0 | AV72: =RC[-30] ->  | AW72: =RC[-30] -> 
A73: =IF(RC[1]="","",DATEVALUE(RC[1])) ->  | T73: =(RC[-16]*RC[-15]-RC[-13]*RC[-12])/1000 -> #VALUE! | W73: =RC[-2]*RC[-10]/1000 -> #VALUE! | X73: =ABS((RC[-3]*RC[-11]-RC[-2]*RC[-9])/1000) -> #VALUE! | Y73: =(RC[-14]-RC[1])/RC[-18]*100 -> #VALUE! | AC73: =VALUE(RC[-27]) -> #VALUE! | AD73: =IF(RC[21]=42,"*",IF(RC[21]=32,"",RC[21])) ->  | AE73: =RC[-28] ->  | AF73: =RC[-28] ->  | AG73: =RC[-28] ->  | AH73: =RC[-28] ->  | AI73: =RC[-28] ->  | AJ73: =RC[-28] ->  | AK73: =RC[-28] ->  | AL73: =RC[-28] -> 0 | AM73: =RC[-28] ->  | AN73: =RC[-28] ->  | AO73: =RC[-28] ->  | AP73: - | AQ73: =RC[-29] -> 0 | AR73: =RC[-29] -> 0 | AS73: - | AT73: =RC[-30] -> 0 | AU73: =RC[-30] -> 0 | AV73: =RC[-30] ->  | AW73: =RC[-30] -> 
A74: =IF(RC[1]="","",DATEVALUE(RC[1])) ->  | T74: =(RC[-16]*RC[-15]-RC[-13]*RC[-12])/1000 -> #VALUE! | W74: =RC[-2]*RC[-10]/1000 -> #VALUE! | X74: =ABS((RC[-3]*RC[-11]-RC[-2]*RC[-9])/1000) -> #VALUE! | Y74: =(RC[-14]-RC[1])/RC[-18]*100 -> #VALUE! | AC74: =VALUE(RC[-27]) -> #VALUE! | AD74: =IF(RC[21]=42,"*",IF(RC[21]=32,"",RC[21])) ->  | AE74: =RC[-28] ->  | AF74: =RC[-28] ->  | AG74: =RC[-28] ->  | AH74: =RC[-28] ->  | AI74: =RC[-28] ->  | AJ74: =RC[-28] ->  | AK74: =RC[-28] ->  | AL74: =RC[-28] -> 0 | AM74: =RC[-28] ->  | AN74: =RC[-28] ->  | AO74: =RC[-28] ->  | AP74: - | AQ74: =RC[-29] -> 0 | AR74: =RC[-29] -> 0 | AS74: - | AT74: =RC[-30] -> 0 | AU74: =RC[-30] -> 0 | AV74: =RC[-30] ->  | AW74: =RC[-30] -> 
A75: =IF(RC[1]="","",DATEVALUE(RC[1])) ->  | T75: =(RC[-16]*RC[-15]-RC[-13]*RC[-12])/1000 -> #VALUE! | W75: =RC[-2]*RC[-10]/1000 -> #VALUE! | X75: =ABS((RC[-3]*RC[-11]-RC[-2]*RC[-9])/1000) -> #VALUE! | Y75: =(RC[-14]-RC[1])/RC[-18]*100 -> #VALUE! | AC75: =VALUE(RC[-27]) -> #VALUE! | AD75: =IF(RC[21]=42,"*",IF(RC[21]=32,"",RC[21])) ->  | AE75: =RC[-28] ->  | AF75: =RC[-28] ->  | AG75: =RC[-28] ->  | AH75: =RC[-28] ->  | AI75: =RC[-28] ->  | AJ75: =RC[-28] ->  | AK75: =RC[-28] ->  | AL75: =RC[-28] -> 0 | AM75: =RC[-28] ->  | AN75: =RC[-28] ->  | AO75: =RC[-28] ->  | AP75: - | AQ75: =RC[-29] -> 0 | AR75: =RC[-29] -> 0 | AS75: - | AT75: =RC[-30] -> 0 | AU75: =RC[-30] -> 0 | AV75: =RC[-30] ->  | AW75: =RC[-30] -> 
A76: =IF(RC[1]="","",DATEVALUE(RC[1])) ->  | T76: =(RC[-16]*RC[-15]-RC[-13]*RC[-12])/1000 -> #VALUE! | W76: =RC[-2]*RC[-10]/1000 -> #VALUE! | X76: =ABS((RC[-3]*RC[-11]-RC[-2]*RC[-9])/1000) -> #VALUE! | Y76: =(RC[-14]-RC[1])/RC[-18]*100 -> #VALUE! | AC76: =VALUE(RC[-27]) -> #VALUE! | AD76: =IF(RC[21]=42,"*",IF(RC[21]=32,"",RC[21])) ->  | AE76: =RC[-28] ->  | AF76: =RC[-28] ->  | AG76: =RC[-28] ->  | AH76: =RC[-28] ->  | AI76: =RC[-28] ->  | AJ76: =RC[-28] ->  | AK76: =RC[-28] ->  | AL76: =RC[-28] -> 0 | AM76: =RC[-28] ->  | AN76: =RC[-28] ->  | AO76: =RC[-28] ->  | AP76: - | AQ76: =RC[-29] -> 0 | AR76: =RC[-29] -> 0 | AS76: - | AT76: =RC[-30] -> 0 | AU76: =RC[-30] -> 0 | AV76: =RC[-30] ->  | AW76: =RC[-30] -> 
A77: =IF(RC[1]="","",DATEVALUE(RC[1])) ->  | T77: =(RC[-16]*RC[-15]-RC[-13]*RC[-12])/1000 -> #VALUE! | W77: =RC[-2]*RC[-10]/1000 -> #VALUE! | X77: =ABS((RC[-3]*RC[-11]-RC[-2]*RC[-9])/1000) -> #VALUE! | Y77: =(RC[-14]-RC[1])/RC[-18]*100 -> #VALUE! | AC77: =VALUE(RC[-27]) -> #VALUE! | AD77: =IF(RC[21]=42,"*",IF(RC[21]=32,"",RC[21])) ->  | AE77: =RC[-28] ->  | AF77: =RC[-28] ->  | AG77: =RC[-28] ->  | AH77: =RC[-28] ->  | AI77: =RC[-28] ->  | AJ77: =RC[-28] ->  | AK77: =RC[-28] ->  | AL77: =RC[-28] -> 0 | AM77: =RC[-28] ->  | AN77: =RC[-28] ->  | AO77: =RC[-28] ->  | AP77: - | AQ77: =RC[-29] -> 0 | AR77: =RC[-29] -> 0 | AS77: - | AT77: =RC[-30] -> 0 | AU77: =RC[-30] -> 0 | AV77: =RC[-30] ->  | AW77: =RC[-30] -> 
A78: =IF(RC[1]="","",DATEVALUE(RC[1])) ->  | T78: =(RC[-16]*RC[-15]-RC[-13]*RC[-12])/1000 -> #VALUE! | W78: =RC[-2]*RC[-10]/1000 -> #VALUE! | X78: =ABS((RC[-3]*RC[-11]-RC[-2]*RC[-9])/1000) -> #VALUE! | Y78: =(RC[-14]-RC[1])/RC[-18]*100 -> #VALUE! | AC78: =VALUE(RC[-27]) -> #VALUE! | AD78: =IF(RC[21]=42,"*",IF(RC[21]=32,"",RC[21])) ->  | AE78: =RC[-28] ->  | AF78: =RC[-28] ->  | AG78: =RC[-28] ->  | AH78: =RC[-28] ->  | AI78: =RC[-28] ->  | AJ78: =RC[-28] ->  | AK78: =RC[-28] ->  | AL78: =RC[-28] -> 0 | AM78: =RC[-28] ->  | AN78: =RC[-28] ->  | AO78: =RC[-28] ->  | AP78: - | AQ78: =RC[-29] -> 0 | AR78: =RC[-29] -> 0 | AS78: - | AT78: =RC[-30] -> 0 | AU78: =RC[-30] -> 0 | AV78: =RC[-30] ->  | AW78: =RC[-30] -> 
A79: =IF(RC[1]="","",DATEVALUE(RC[1])) ->  | T79: =(RC[-16]*RC[-15]-RC[-13]*RC[-12])/1000 -> #VALUE! | W79: =RC[-2]*RC[-10]/1000 -> #VALUE! | X79: =ABS((RC[-3]*RC[-11]-RC[-2]*RC[-9])/1000) -> #VALUE! | Y79: =(RC[-14]-RC[1])/RC[-18]*100 -> #VALUE! | AC79: =VALUE(RC[-27]) -> #VALUE! | AD79: =IF(RC[21]=42,"*",IF(RC[21]=32,"",RC[21])) ->  | AE79: =RC[-28] ->  | AF79: =RC[-28] ->  | AG79: =RC[-28] ->  | AH79: =RC[-28] ->  | AI79: =RC[-28] ->  | AJ79: =RC[-28] ->  | AK79: =RC[-28] ->  | AL79: =RC[-28] -> 0 | AM79: =RC[-28] ->  | AN79: =RC[-28] ->  | AO79: =RC[-28] ->  | AP79: - | AQ79: =RC[-29] -> 0 | AR79: =RC[-29] -> 0 | AS79: - | AT79: =RC[-30] -> 0 | AU79: =RC[-30] -> 0 | AV79: =RC[-30] ->  | AW79: =RC[-30] -> 
A80: =IF(RC[1]="","",DATEVALUE(RC[1])) ->  | T80: =(RC[-16]*RC[-15]-RC[-13]*RC[-12])/1000 -> #VALUE! | W80: =RC[-2]*RC[-10]/1000 -> #VALUE! | X80: =ABS((RC[-3]*RC[-11]-RC[-2]*RC[-9])/1000) -> #VALUE! | Y80: =(RC[-14]-RC[1])/RC[-18]*100 -> #VALUE! | AC80: =VALUE(RC[-27]) -> #VALUE! | AD80: =IF(RC[21]=42,"*",IF(RC[21]=32,"",RC[21])) ->  | AE80: =RC[-28] ->  | AF80: =RC[-28] ->  | AG80: =RC[-28] ->  | AH80: =RC[-28] ->  | AI80: =RC[-28] ->  | AJ80: =RC[-28] ->  | AK80: =RC[-28] ->  | AL80: =RC[-28] -> 0 | AM80: =RC[-28] ->  | AN80: =RC[-28] ->  | AO80: =RC[-28] ->  | AP80: - | AQ80: =RC[-29] -> 0 | AR80: =RC[-29] -> 0 | AS80: - | AT80: =RC[-30] -> 0 | AU80: =RC[-30] -> 0 | AV80: =RC[-30] ->  | AW80: =RC[-30] -> 
A81: =IF(RC[1]="","",DATEVALUE(RC[1])) ->  | T81: =(RC[-16]*RC[-15]-RC[-13]*RC[-12])/1000 -> #VALUE! | W81: =RC[-2]*RC[-10]/1000 -> #VALUE! | X81: =ABS((RC[-3]*RC[-11]-RC[-2]*RC[-9])/1000) -> #VALUE! | Y81: =(RC[-14]-RC[1])/RC[-18]*100 -> #VALUE! | AC81: =VALUE(RC[-27]) -> #VALUE! | AD81: =IF(RC[21]=42,"*",IF(RC[21]=32,"",RC[21])) ->  | AE81: =RC[-28] ->  | AF81: =RC[-28] ->  | AG81: =RC[-28] ->  | AH81: =RC[-28] ->  | AI81: =RC[-28] ->  | AJ81: =RC[-28] ->  | AK81: =RC[-28] ->  | AL81: =RC[-28] -> 0 | AM81: =RC[-28] ->  | AN81: =RC[-28] ->  | AO81: =RC[-28] ->  | AP81: - | AQ81: =RC[-29] -> 0 | AR81: =RC[-29] -> 0 | AS81: - | AT81: =RC[-30] -> 0 | AU81: =RC[-30] -> 0 | AV81: =RC[-30] ->  | AW81: =RC[-30] -> 
A82: =IF(RC[1]="","",DATEVALUE(RC[1])) ->  | T82: =(RC[-16]*RC[-15]-RC[-13]*RC[-12])/1000 -> #VALUE! | W82: =RC[-2]*RC[-10]/1000 -> #VALUE! | X82: =ABS((RC[-3]*RC[-11]-RC[-2]*RC[-9])/1000) -> #VALUE! | Y82: =(RC[-14]-RC[1])/RC[-18]*100 -> #VALUE! | AC82: =VALUE(RC[-27]) -> #VALUE! | AD82: =IF(RC[21]=42,"*",IF(RC[21]=32,"",RC[21])) ->  | AE82: =RC[-28] ->  | AF82: =RC[-28] ->  | AG82: =RC[-28] ->  | AH82: =RC[-28] ->  | AI82: =RC[-28] ->  | AJ82: =RC[-28] ->  | AK82: =RC[-28] ->  | AL82: =RC[-28] -> 0 | AM82: =RC[-28] ->  | AN82: =RC[-28] ->  | AO82: =RC[-28] ->  | AP82: - | AQ82: =RC[-29] -> 0 | AR82: =RC[-29] -> 0 | AS82: - | AT82: =RC[-30] -> 0 | AU82: =RC[-30] -> 0 | AV82: =RC[-30] ->  | AW82: =RC[-30] -> 
A83: =IF(RC[1]="","",DATEVALUE(RC[1])) ->  | T83: =(RC[-16]*RC[-15]-RC[-13]*RC[-12])/1000 -> #VALUE! | W83: =RC[-2]*RC[-10]/1000 -> #VALUE! | X83: =ABS((RC[-3]*RC[-11]-RC[-2]*RC[-9])/1000) -> #VALUE! | Y83: =(RC[-14]-RC[1])/RC[-18]*100 -> #VALUE! | AC83: =VALUE(RC[-27]) -> #VALUE! | AD83: =IF(RC[21]=42,"*",IF(RC[21]=32,"",RC[21])) ->  | AE83: =RC[-28] ->  | AF83: =RC[-28] ->  | AG83: =RC[-28] ->  | AH83: =RC[-28] ->  | AI83: =RC[-28] ->  | AJ83: =RC[-28] ->  | AK83: =RC[-28] ->  | AL83: =RC[-28] -> 0 | AM83: =RC[-28] ->  | AN83: =RC[-28] ->  | AO83: =RC[-28] ->  | AP83: - | AQ83: =RC[-29] -> 0 | AR83: =RC[-29] -> 0 | AS83: - | AT83: =RC[-30] -> 0 | AU83: =RC[-30] -> 0 | AV83: =RC[-30] ->  | AW83: =RC[-30] -> 
AC84: Среднее | AF84: =R[1]C[-28] -> 158.33311111111112 | AG84: =R[1]C[-28] -> 67.663888888888906 | AH84: =R[1]C[-28] -> 7.2302222222222223 | AI84: =R[1]C[-28] -> 133.28400000000005 | AJ84: =R[1]C[-28] -> 39.26477777777778 | AK84: =R[1]C[-28] -> 5.6396666666666659 | AL84: =R[1]C[-28] -> 28.399111111111093 | AM84: =R[1]C[-28] -> 25.049111111111124 | AN84: =R[1]C[-28] -> 24.759111111111118 | AO84: =R[1]C[-28] -> 67.689777777777749 | AP84: - | AQ84: =R[1]C[-29] -> 0 | AR84: =R[1]C[-29] -> 0 | AS84: - | AT84: =R[1]C[-30] -> 0 | AU84: =R[1]C[-30] -> 0
B85: Среднее | D85: =AVERAGE(OFFSET(R[-74]C,3,0,R7C1,1)) -> 158.33311111111112 | E85: =AVERAGE(OFFSET(R[-74]C,3,0,R7C1,1)) -> 67.663888888888906 | F85: =AVERAGE(OFFSET(R[-74]C,3,0,R7C1,1)) -> 7.2302222222222223 | G85: =AVERAGE(OFFSET(R[-74]C,3,0,R7C1,1)) -> 133.28400000000005 | H85: =AVERAGE(OFFSET(R[-74]C,3,0,R7C1,1)) -> 39.26477777777778 | I85: =AVERAGE(OFFSET(R[-74]C,3,0,R7C1,1)) -> 5.6396666666666659 | J85: =AVERAGE(OFFSET(R[-74]C,3,0,R7C1,1)) -> 28.399111111111093 | K85: =AVERAGE(OFFSET(R[-74]C,3,0,R7C1,1)) -> 25.049111111111124 | L85: =IF(SUM(OFFSET(R[-74]C,3,0,R7C1,1))=0,"",AVERAGE(OFFSET(R[-74]C,3,0,R7C1,1))) -> 24.759111111111118 | M85: =IF(SUM(OFFSET(R[-74]C,3,0,R7C1,1))=0,"",AVERAGE(OFFSET(R[-74]C,3,0,R7C1,1))) -> 67.689777777777749 | R85: =IF(SUM(OFFSET(R[-74]C,3,0,R7C1,1))=0,"",AVERAGE(OFFSET(R[-74]C,3,0,R7C1,1))) -> 1.6410777777777781 | S85: =AVERAGE(OFFSET(R[-74]C,3,0,R7C1,1)) -> 5.2596666666666687 | T85: =AVERAGE(OFFSET(R[-74]C,3,0,R7C1,1)) -> 4.1084480866666659 | W85: =AVERAGE(OFFSET(R[-74]C,3,0,R7C1,1)) -> 5.1664708488888893 | X85: =AVERAGE(OFFSET(R[-74]C,3,0,R7C1,1)) -> #VALUE! | AC85: Итого | AE85: =R[1]C[-28] -> 720 | AF85: =R[1]C[-28] -> 4749.9933333333338 | AI85: =R[1]C[-28] -> 3998.5200000000018 | AM85: =R[1]C[-28] -> 751.4733333333337 | AN85: =R[1]C[-28] -> 742.77333333333354 | AQ85: =R[1]C[-29] -> 0 | AU85: =R[1]C[-30] -> 0 | AV85: =R[1]C[-30] -> 49.232333333333344 | AW85: =R[1]C[-30] -> 157.79000000000005
B86: ИТОГО: | C86: =SUM(OFFSET(R[-75]C,3,0,R7C1,1)) -> 720 | D86: =SUM(OFFSET(R[-75]C,3,0,R7C1,1)) -> 4749.9933333333338 | G86: =SUM(OFFSET(R[-75]C,3,0,R7C1,1)) -> 3998.5200000000018 | K86: =SUM(OFFSET(R[-75]C,3,0,R7C1,1)) -> 751.4733333333337 | L86: =IF(SUM(OFFSET(R[-75]C,3,0,R7C1,1))=0,"",SUM(OFFSET(R[-75]C,3,0,R7C1,1))) -> 742.77333333333354 | R86: =IF(SUM(OFFSET(R[-75]C,3,0,R7C1,1))=0,"",SUM(OFFSET(R[-75]C,3,0,R7C1,1))) -> 49.232333333333344 | S86: =SUM(OFFSET(R[-75]C,3,0,R7C1,1)) -> 157.79000000000005 | T86: =SUM(OFFSET(R[-75]C,3,0,R7C1,1)) -> 123.25344259999997 | W86: =SUM(OFFSET(R[-75]C,3,0,R7C1,1)) -> 154.99412546666667 | X86: =SUM(OFFSET(R[-75]C,3,0,R7C1,1)) -> #VALUE!
AC87: Досчёт | AF87: =R[1]C[-28] -> 0 | AI87: =R[1]C[-28] -> 0 | AM87: =R[1]C[-28] -> 0 | AN87: =R[1]C[-28] -> 0 | AQ87: =R[1]C[-29] -> 0 | AU87: =R[1]C[-30] -> 0 | AV87: =R[1]C[-30] -> 0 | AW87: =R[1]C[-30] -> 0
A88: 11дн=264ч 4дн=96ч | B88: Досчёт до конца м-ца (+) | C88: =R6C1*24 -> 216 | T88: № 187703 | AC88: Снятие | AF88: =-R[1]C[-28] -> 0 | AI88: =-R[1]C[-28] -> 0 | AM88: =-R[1]C[-28] -> 0 | AN88: =-R[1]C[-28] -> 0 | AQ88: =-R[1]C[-29] -> 0 | AU88: =-R[1]C[-30] -> 0 | AV88: =-R[1]C[-30] -> 0 | AW88: =-R[1]C[-30] -> 0
A89: 9дн=216ч 7дн=168ч | B89: Вычет с предыдущего (-) | C89: =R4C1*24 -> 192 | AC89: Сумма | AF89: =R[1]C[-28] -> 4749.9933333333338 | AI89: =R[1]C[-28] -> 3998.5200000000018 | AM89: =R[1]C[-28] -> 751.4733333333337 | AN89: =R[1]C[-28] -> 742.77333333333354 | AQ89: =R[1]C[-29] -> 0 | AU89: =R[1]C[-30] -> 0 | AV89: =R[1]C[-30] -> 49.232333333333344 | AW89: =R[1]C[-30] -> 157.79000000000005
B90: СУММА: | C90: =R[-4]C+R[-2]C-R[-1]C -> 744 | D90: =R[-4]C+R[-2]C-R[-1]C -> 4749.9933333333338 | G90: =R[-4]C+R[-2]C-R[-1]C -> 3998.5200000000018 | K90: =R[-4]C+R[-2]C-R[-1]C -> 751.4733333333337 | L90: =IF(SUM(OFFSET(R[-79]C,3,0,R7C1,1))=0,"",(R[-4]C+R[-2]C-R[-1]C)) -> 742.77333333333354 | R90: =IF(SUM(OFFSET(R[-79]C,3,0,R7C1,1))=0,"",(R[-4]C+R[-2]C-R[-1]C)) -> 49.232333333333344 | S90: =R[-4]C+R[-2]C-R[-1]C -> 157.79000000000005
AC91: Тхв на источнике | AE91: V гвс (м3) | AF91: =R[-2]C[15] -> 0 | AG91: W гвс (Гкал) | AH91: =RC[-2]*0.06 -> 0 | AI91: W без гвс (Гкал) | AJ91: =R[-2]C[13]-RC[-2] -> 157.79000000000005
B92: Показания счетчиков на момент снятия данных:
B93: Дата, время | D93: М1, т | F93: М2, т | H93: М3, т | J93: М4, т | L93: Qо, Гкал | N93: Qг, Гкал | P93: время, час
B94: 24.09.18 00:00 | D94: 1691.34 | F94: 456.15 | H94: 1192.1400000000001 | J94: - | L94: 86.066000000000003 | N94: 82.664000000000001 | P94: -
B95: 18.10.18 06:00 | D95: 0 | F95: 0 | H95: 0 | J95: - | L95: 0 | N95: 0 | P95: -
AC97: =ZAYAVKA_N -> з.н д. №02/147-2783 от 04.10.18 с 04.10.18г по 05.10.18г , 07.10.18г, с 12.10.18г по 22.10.18г некорректная работа приборов
B98: Представитель потребителя:_______________________________________________________________________ В.О. Топорков
I101: Рекомендуемые значения по параметрам теплопотребления (не являются официально утверждёнными)
I102: М, т | J102: V, м3 | K102: Qгвс, Гкал | L102: Qотоп, Гкал | M102: Qо, Гкал
I103: =R[-13]C[-3] -> 0 | J103: =RC[-1]/0.98 -> 0 | K103: =RC[-1]*0.06 -> 0 | L103: =RC[1]-RC[-1] -> 49.232333333333344 | M103: =R[-13]C[5] -> 49.232333333333344
O105: ДЛЯ САМОКОНТРОЛЯ
B106: В строке выбора дат указать период с 16.7.13 по 23.8.13 - жильё | N106: Q | O106: Qг
B107: В строке выбора дат указать период с 18.7.13 по 25.8.13 - не жилое | N107: =(R[-21]C[-10]*R[-22]C[-7]-R[-21]C[-9]*R[-22]C[-6])/1000 -> 633.09811144000025 | O107: =IF(R[-22]C[-2]="",R[-21]C[-3]*R[-22]C/1000,"") ->  | P107: Си2
O108: =IF(R[-23]C[-2]="","",((R[-22]C[-3]*R[-23]C)-(R[-22]C[-2]*R[-23]C[2]))/1000) -> 0 | P108: Си3