Sheet: Лист1
G1: Отчёт о теплопотреблении за октябрь 2018 | M1: з.н д. №02/147-2783 от 04.10.18 с 03.10.18г по 10.10.18г некорректная работа приборов
A4: =EOMONTH(R[9]C,0)-R[9]C -> 8 | B4: Потребитель: ЗАО "Сити Сервис"
A5: =MAX(R[9]C:R[78]C) -> 2018-10-22T00:00:00.000 | B5: Адрес: г. СПб, Кораблестроителей ул., д.29 к.4 ИТП 2
A6: =EOMONTH(R[-1]C,0)-R[-1]C -> 9 | B6: Телефон: 8-911-021-19-79
A7: =R[-2]C-R[6]C -> 30 | B7: Договор 10023-2 (.) 14398
A8: 7 | B8: Тепловычислитель: ВКТ-7 № 187393 | L8: М2 мах= | M8: 177.6 | O8: Мгвс мах= | P8: 56.16
L9: Qотоп мах= | M9: 14.28 | O9: Qгвс мах= | P9: 3.504
B10: Расчётная формула: Q=M1*(h1-hхв)-M2*(h2-hхв)
D12: Учет | L12: Контроль
A13: =R[1]C[1]-1 -> 2018-09-22T00:00:00.000 | B13: Дата | C13: N, ч | D13: M1, т | E13: T1, С | F13: P1, кг/см2 | G13: M2, т | H13: T2, С | I13: P2, кг/см2 | J13: dT, С | K13: M1-М2, т | L13: V3, м3 | M13: T3, С | N13: V4, м3 | O13: =IF(R[-12]C[-14]="м.куб","","T4, С") -> T4, С | P13: dT, С | Q13: V3-V4, м3 | R13: Qгвс, Гкал | S13: Qобщ., Гкал | T13: Q | U13: M3 | V13: M4 | W13: си2 | X13: си3 | Y13: Разб. | Z13: dM2 | AC13: Дата | AD13: НС | AE13: n, ч | AF13: М1, т | AG13: t1, гр. С | AH13: Р1, кгс/см2 | AI13: М2, т | AJ13: t2, гр. С | AK13: Р2, кгс/см2 | AL13: t1-t2, гр. С | AM13: М1-М2, т | AN13: М1гвс, т | AO13: t1гвс, гр. С | AP13: Р1гвс, кгс/см2 | AQ13: М2гвс, т | AR13: t2гвс, гр. С | AS13: Р2гвс, кгс/см2 | AT13: t1гвс-t2гвс | AU13: М1гвс-М2гвс, т | AV13: Wгвс, Гкал | AW13: Wсумм, Гкал | AY13: NS_TV1 | AZ13: НС | BA13: NS_TV2
A14: =IF(RC[1]="","",DATEVALUE(RC[1])) -> 43366 | B14: 23.09.18 | C14: 24 | D14: 270.89999999999998 | E14: 71.150000000000006 | F14: 7.68 | G14: 240.2 | H14: 71.14 | I14: 5.36 | J14: =RC[-5]-RC[-2] -> 1.0000000000005116E-2 | K14: 30.7 | L14: 26.72 | M14: 71.260000000000005 | R14: 1.865 | S14: =RC[-1] -> 1.865 | T14: =(RC[-16]*RC[-15]-RC[-13]*RC[-12])/1000 -> 2.186707000000002 | U14: 26.15 | V14: - | W14: =RC[-2]*RC[-10]/1000 -> 1.8634490000000001 | X14: =ABS((RC[-3]*RC[-11]-RC[-2]*RC[-9])/1000) -> #VALUE! | Y14: =(RC[-14]-RC[1])/RC[-18]*100 -> 1.8942547876769362 | Z14: 26.15 | AC14: =VALUE(RC[-27]) -> 2018-09-23T00:00:00.000 | AD14: =IF(RC[21]=42,"*",IF(RC[21]=32,"",RC[21])) -> - | AE14: =RC[-28] -> 24 | AF14: =RC[-28] -> 270.89999999999998 | AG14: =RC[-28] -> 71.150000000000006 | AH14: =RC[-28] -> 7.68 | AI14: =RC[-28] -> 240.2 | AJ14: =RC[-28] -> 71.14 | AK14: =RC[-28] -> 5.36 | AL14: =RC[-28] -> 1.0000000000005116E-2 | AM14: =RC[-28] -> 30.7 | AN14: =RC[-28] -> 26.72 | AO14: =RC[-28] -> 71.260000000000005 | AP14: - | AQ14: =RC[-29] -> 0 | AR14: =RC[-29] -> 0 | AS14: - | AT14: =RC[-30] -> 0 | AU14: =RC[-30] -> 0 | AV14: =RC[-30] -> 1.865 | AW14: =RC[-30] -> 1.865 | AY14: - | AZ14: - | BA14: -
A15: =IF(RC[1]="","",DATEVALUE(RC[1])) -> 43367 | B15: 24.09.18 | C15: 24 | D15: 268.45999999999998 | E15: 70.03 | F15: 7.7 | G15: 240.32 | H15: 70.040000000000006 | I15: 5.36 | J15: =RC[-5]-RC[-2] -> -1.0000000000005116E-2 | K15: 28.14 | L15: 24.2 | M15: 70.08 | R15: 1.6579999999999999 | S15: =RC[-1] -> 1.6579999999999999 | T15: =(RC[-16]*RC[-15]-RC[-13]*RC[-12])/1000 -> 1.9682409999999981 | U15: 23.67 | V15: - | W15: =RC[-2]*RC[-10]/1000 -> 1.6587935999999999 | X15: =ABS((RC[-3]*RC[-11]-RC[-2]*RC[-9])/1000) -> #VALUE! | Y15: =(RC[-14]-RC[1])/RC[-18]*100 -> 1.860019973368841 | Z15: 23.67 | AC15: =VALUE(RC[-27]) -> 2018-09-24T00:00:00.000 | AD15: =IF(RC[21]=42,"*",IF(RC[21]=32,"",RC[21])) -> - | AE15: =RC[-28] -> 24 | AF15: =RC[-28] -> 268.45999999999998 | AG15: =RC[-28] -> 70.03 | AH15: =RC[-28] -> 7.7 | AI15: =RC[-28] -> 240.32 | AJ15: =RC[-28] -> 70.040000000000006 | AK15: =RC[-28] -> 5.36 | AL15: =RC[-28] -> -1.0000000000005116E-2 | AM15: =RC[-28] -> 28.14 | AN15: =RC[-28] -> 24.2 | AO15: =RC[-28] -> 70.08 | AP15: - | AQ15: =RC[-29] -> 0 | AR15: =RC[-29] -> 0 | AS15: - | AT15: =RC[-30] -> 0 | AU15: =RC[-30] -> 0 | AV15: =RC[-30] -> 1.6579999999999999 | AW15: =RC[-30] -> 1.6579999999999999 | AY15: - | AZ15: - | BA15: -
A16: =IF(RC[1]="","",DATEVALUE(RC[1])) -> 43368 | B16: 25.09.18 | C16: 24 | D16: 267.07 | E16: 68.510000000000005 | F16: 7.47 | G16: 234.8 | H16: 66.709999999999994 | I16: 5.22 | J16: =RC[-5]-RC[-2] -> 1.8000000000000114 | K16: 32.270000000000003 | L16: 29.09 | M16: 68.31 | R16: 1.9430000000000001 | S16: 2.645 | T16: =(RC[-16]*RC[-15]-RC[-13]*RC[-12])/1000 -> 2.633457700000001 | U16: 28.48 | V16: - | W16: =RC[-2]*RC[-10]/1000 -> 1.9454688 | X16: =ABS((RC[-3]*RC[-11]-RC[-2]*RC[-9])/1000) -> #VALUE! | Y16: =(RC[-14]-RC[1])/RC[-18]*100 -> 1.6141396933560488 | Z16: 28.48 | AC16: =VALUE(RC[-27]) -> 2018-09-25T00:00:00.000 | AD16: =IF(RC[21]=42,"*",IF(RC[21]=32,"",RC[21])) -> - | AE16: =RC[-28] -> 24 | AF16: =RC[-28] -> 267.07 | AG16: =RC[-28] -> 68.510000000000005 | AH16: =RC[-28] -> 7.47 | AI16: =RC[-28] -> 234.8 | AJ16: =RC[-28] -> 66.709999999999994 | AK16: =RC[-28] -> 5.22 | AL16: =RC[-28] -> 1.8000000000000114 | AM16: =RC[-28] -> 32.270000000000003 | AN16: =RC[-28] -> 29.09 | AO16: =RC[-28] -> 68.31 | AP16: - | AQ16: =RC[-29] -> 0 | AR16: =RC[-29] -> 0 | AS16: - | AT16: =RC[-30] -> 0 | AU16: =RC[-30] -> 0 | AV16: =RC[-30] -> 1.9430000000000001 | AW16: =RC[-30] -> 2.645 | AY16: - | AZ16: - | BA16: -
A17: =IF(RC[1]="","",DATEVALUE(RC[1])) -> 43369 | B17: 26.09.18 | C17: 24 | D17: 248.49 | E17: 67.959999999999994 | F17: 7.14 | G17: 218.58 | H17: 63.13 | I17: 5.18 | J17: =RC[-5]-RC[-2] -> 4.8299999999999912 | K17: 29.91 | L17: 26.4 | M17: 67.430000000000007 | R17: 1.746 | S17: 3.097 | T17: =(RC[-16]*RC[-15]-RC[-13]*RC[-12])/1000 -> 3.0884249999999973 | U17: 25.86 | V17: - | W17: =RC[-2]*RC[-10]/1000 -> 1.7437398 | X17: =ABS((RC[-3]*RC[-11]-RC[-2]*RC[-9])/1000) -> #VALUE! | Y17: =(RC[-14]-RC[1])/RC[-18]*100 -> 1.852868514960198 | Z17: 25.86 | AC17: =VALUE(RC[-27]) -> 2018-09-26T00:00:00.000 | AD17: =IF(RC[21]=42,"*",IF(RC[21]=32,"",RC[21])) -> - | AE17: =RC[-28] -> 24 | AF17: =RC[-28] -> 248.49 | AG17: =RC[-28] -> 67.959999999999994 | AH17: =RC[-28] -> 7.14 | AI17: =RC[-28] -> 218.58 | AJ17: =RC[-28] -> 63.13 | AK17: =RC[-28] -> 5.18 | AL17: =RC[-28] -> 4.8299999999999912 | AM17: =RC[-28] -> 29.91 | AN17: =RC[-28] -> 26.4 | AO17: =RC[-28] -> 67.430000000000007 | AP17: - | AQ17: =RC[-29] -> 0 | AR17: =RC[-29] -> 0 | AS17: - | AT17: =RC[-30] -> 0 | AU17: =RC[-30] -> 0 | AV17: =RC[-30] -> 1.746 | AW17: =RC[-30] -> 3.097 | AY17: - | AZ17: - | BA17: -
A18: =IF(RC[1]="","",DATEVALUE(RC[1])) -> 43370 | B18: 27.09.18 | C18: 24 | D18: 205.57 | E18: 63.18 | F18: 6.61 | G18: 176.91 | H18: 53.32 | I18: 5.32 | J18: =RC[-5]-RC[-2] -> 9.86 | K18: 28.66 | L18: 25.84 | M18: 63.25 | R18: 1.607 | S18: 3.5640000000000001 | T18: =(RC[-16]*RC[-15]-RC[-13]*RC[-12])/1000 -> 3.5550713999999988 | U18: 25.38 | V18: - | W18: =RC[-2]*RC[-10]/1000 -> 1.6052849999999999 | X18: =ABS((RC[-3]*RC[-11]-RC[-2]*RC[-9])/1000) -> #VALUE! | Y18: =(RC[-14]-RC[1])/RC[-18]*100 -> 1.8540500819625807 | Z18: 25.38 | AC18: =VALUE(RC[-27]) -> 2018-09-27T00:00:00.000 | AD18: =IF(RC[21]=42,"*",IF(RC[21]=32,"",RC[21])) -> - | AE18: =RC[-28] -> 24 | AF18: =RC[-28] -> 205.57 | AG18: =RC[-28] -> 63.18 | AH18: =RC[-28] -> 6.61 | AI18: =RC[-28] -> 176.91 | AJ18: =RC[-28] -> 53.32 | AK18: =RC[-28] -> 5.32 | AL18: =RC[-28] -> 9.86 | AM18: =RC[-28] -> 28.66 | AN18: =RC[-28] -> 25.84 | AO18: =RC[-28] -> 63.25 | AP18: - | AQ18: =RC[-29] -> 0 | AR18: =RC[-29] -> 0 | AS18: - | AT18: =RC[-30] -> 0 | AU18: =RC[-30] -> 0 | AV18: =RC[-30] -> 1.607 | AW18: =RC[-30] -> 3.5640000000000001 | AY18: - | AZ18: - | BA18: -
A19: =IF(RC[1]="","",DATEVALUE(RC[1])) -> 43371 | B19: 28.09.18 | C19: 24 | D19: 175.71 | E19: 68 | F19: 6.33 | G19: 148.55000000000001 | H19: 41.35 | I19: 5.49 | J19: =RC[-5]-RC[-2] -> 26.65 | K19: 27.16 | L19: 24.69 | M19: 68.099999999999994 | R19: 1.649 | S19: 5.8019999999999996 | T19: =(RC[-16]*RC[-15]-RC[-13]*RC[-12])/1000 -> 5.8057375000000002 | U19: 24.18 | V19: - | W19: =RC[-2]*RC[-10]/1000 -> 1.646658 | X19: =ABS((RC[-3]*RC[-11]-RC[-2]*RC[-9])/1000) -> #VALUE! | Y19: =(RC[-14]-RC[1])/RC[-18]*100 -> 2.0060585661393469 | Z19: 24.18 | AC19: =VALUE(RC[-27]) -> 2018-09-28T00:00:00.000 | AD19: =IF(RC[21]=42,"*",IF(RC[21]=32,"",RC[21])) -> - | AE19: =RC[-28] -> 24 | AF19: =RC[-28] -> 175.71 | AG19: =RC[-28] -> 68 | AH19: =RC[-28] -> 6.33 | AI19: =RC[-28] -> 148.55000000000001 | AJ19: =RC[-28] -> 41.35 | AK19: =RC[-28] -> 5.49 | AL19: =RC[-28] -> 26.65 | AM19: =RC[-28] -> 27.16 | AN19: =RC[-28] -> 24.69 | AO19: =RC[-28] -> 68.099999999999994 | AP19: - | AQ19: =RC[-29] -> 0 | AR19: =RC[-29] -> 0 | AS19: - | AT19: =RC[-30] -> 0 | AU19: =RC[-30] -> 0 | AV19: =RC[-30] -> 1.649 | AW19: =RC[-30] -> 5.8019999999999996 | AY19: - | AZ19: - | BA19: -
A20: =IF(RC[1]="","",DATEVALUE(RC[1])) -> 43372 | B20: 29.09.18 | C20: 24 | D20: 157.22999999999999 | E20: 67.53 | F20: 6.25 | G20: 130.07 | H20: 39.17 | I20: 5.62 | J20: =RC[-5]-RC[-2] -> 28.36 | K20: 27.16 | L20: 25.73 | M20: 67.37 | R20: 1.7 | S20: 5.52 | T20: =(RC[-16]*RC[-15]-RC[-13]*RC[-12])/1000 -> 5.522899999999999 | U20: 25.21 | V20: - | W20: =RC[-2]*RC[-10]/1000 -> 1.6983977000000001 | X20: =ABS((RC[-3]*RC[-11]-RC[-2]*RC[-9])/1000) -> #VALUE! | Y20: =(RC[-14]-RC[1])/RC[-18]*100 -> 1.4991927423694928 | Z20: 25.21 | AC20: =VALUE(RC[-27]) -> 2018-09-29T00:00:00.000 | AD20: =IF(RC[21]=42,"*",IF(RC[21]=32,"",RC[21])) -> - | AE20: =RC[-28] -> 24 | AF20: =RC[-28] -> 157.22999999999999 | AG20: =RC[-28] -> 67.53 | AH20: =RC[-28] -> 6.25 | AI20: =RC[-28] -> 130.07 | AJ20: =RC[-28] -> 39.17 | AK20: =RC[-28] -> 5.62 | AL20: =RC[-28] -> 28.36 | AM20: =RC[-28] -> 27.16 | AN20: =RC[-28] -> 25.73 | AO20: =RC[-28] -> 67.37 | AP20: - | AQ20: =RC[-29] -> 0 | AR20: =RC[-29] -> 0 | AS20: - | AT20: =RC[-30] -> 0 | AU20: =RC[-30] -> 0 | AV20: =RC[-30] -> 1.7 | AW20: =RC[-30] -> 5.52 | AY20: - | AZ20: - | BA20: -
A21: =IF(RC[1]="","",DATEVALUE(RC[1])) -> 43373 | B21: 30.09.18 | C21: 24 | D21: 150.46 | E21: 69.760000000000005 | F21: 6.11 | G21: 121.4 | H21: 38.799999999999997 | I21: 5.57 | J21: =RC[-5]-RC[-2] -> 30.960000000000008 | K21: 29.06 | L21: 27.76 | M21: 70.16 | R21: 1.909 | S21: 5.782 | T21: =(RC[-16]*RC[-15]-RC[-13]*RC[-12])/1000 -> 5.7857696000000018 | U21: 27.17 | V21: - | W21: =RC[-2]*RC[-10]/1000 -> 1.9062471999999999 | X21: =ABS((RC[-3]*RC[-11]-RC[-2]*RC[-9])/1000) -> #VALUE! | Y21: =(RC[-14]-RC[1])/RC[-18]*100 -> 1.5568369028006563 | Z21: 27.17 | AC21: =VALUE(RC[-27]) -> 2018-09-30T00:00:00.000 | AD21: =IF(RC[21]=42,"*",IF(RC[21]=32,"",RC[21])) -> - | AE21: =RC[-28] -> 24 | AF21: =RC[-28] -> 150.46 | AG21: =RC[-28] -> 69.760000000000005 | AH21: =RC[-28] -> 6.11 | AI21: =RC[-28] -> 121.4 | AJ21: =RC[-28] -> 38.799999999999997 | AK21: =RC[-28] -> 5.57 | AL21: =RC[-28] -> 30.960000000000008 | AM21: =RC[-28] -> 29.06 | AN21: =RC[-28] -> 27.76 | AO21: =RC[-28] -> 70.16 | AP21: - | AQ21: =RC[-29] -> 0 | AR21: =RC[-29] -> 0 | AS21: - | AT21: =RC[-30] -> 0 | AU21: =RC[-30] -> 0 | AV21: =RC[-30] -> 1.909 | AW21: =RC[-30] -> 5.782 | AY21: - | AZ21: - | BA21: -
A22: =IF(RC[1]="","",DATEVALUE(RC[1])) -> 43374 | B22: 01.10.18 | C22: 24 | D22: 149.35 | E22: 68.510000000000005 | F22: 6.17 | G22: 121.81 | H22: 39.08 | I22: 5.63 | J22: =RC[-5]-RC[-2] -> 29.430000000000007 | K22: 27.54 | L22: 25.91 | M22: 68.39 | R22: 1.734 | S22: 5.4669999999999996 | T22: =(RC[-16]*RC[-15]-RC[-13]*RC[-12])/1000 -> 5.4716337000000008 | U22: 25.37 | V22: - | W22: =RC[-2]*RC[-10]/1000 -> 1.7350543 | X22: =ABS((RC[-3]*RC[-11]-RC[-2]*RC[-9])/1000) -> #VALUE! | Y22: =(RC[-14]-RC[1])/RC[-18]*100 -> 1.7814629340776604 | Z22: 25.37 | AC22: =VALUE(RC[-27]) -> 2018-10-01T00:00:00.000 | AD22: =IF(RC[21]=42,"*",IF(RC[21]=32,"",RC[21])) -> - | AE22: =RC[-28] -> 24 | AF22: =RC[-28] -> 149.35 | AG22: =RC[-28] -> 68.510000000000005 | AH22: =RC[-28] -> 6.17 | AI22: =RC[-28] -> 121.81 | AJ22: =RC[-28] -> 39.08 | AK22: =RC[-28] -> 5.63 | AL22: =RC[-28] -> 29.430000000000007 | AM22: =RC[-28] -> 27.54 | AN22: =RC[-28] -> 25.91 | AO22: =RC[-28] -> 68.39 | AP22: - | AQ22: =RC[-29] -> 0 | AR22: =RC[-29] -> 0 | AS22: - | AT22: =RC[-30] -> 0 | AU22: =RC[-30] -> 0 | AV22: =RC[-30] -> 1.734 | AW22: =RC[-30] -> 5.4669999999999996 | AY22: - | AZ22: - | BA22: -
A23: =IF(RC[1]="","",DATEVALUE(RC[1])) -> 43375 | B23: 02.10.18 | C23: 24 | D23: 135.52000000000001 | E23: 67.23 | F23: 6.04 | G23: 108.16 | H23: 37.42 | I23: 5.62 | J23: =RC[-5]-RC[-2] -> 29.810000000000002 | K23: 27.36 | L23: 24.39 | M23: 67.27 | R23: 1.609 | S23: 5.0590000000000002 | T23: =(RC[-16]*RC[-15]-RC[-13]*RC[-12])/1000 -> 5.063662400000001 | U23: 23.9 | V23: - | W23: =RC[-2]*RC[-10]/1000 -> 1.6077529999999998 | X23: =ABS((RC[-3]*RC[-11]-RC[-2]*RC[-9])/1000) -> #VALUE! | Y23: =(RC[-14]-RC[1])/RC[-18]*100 -> 3.1989644970414211 | Z23: 23.9 | AC23: =VALUE(RC[-27]) -> 2018-10-02T00:00:00.000 | AD23: =IF(RC[21]=42,"*",IF(RC[21]=32,"",RC[21])) -> - | AE23: =RC[-28] -> 24 | AF23: =RC[-28] -> 135.52000000000001 | AG23: =RC[-28] -> 67.23 | AH23: =RC[-28] -> 6.04 | AI23: =RC[-28] -> 108.16 | AJ23: =RC[-28] -> 37.42 | AK23: =RC[-28] -> 5.62 | AL23: =RC[-28] -> 29.810000000000002 | AM23: =RC[-28] -> 27.36 | AN23: =RC[-28] -> 24.39 | AO23: =RC[-28] -> 67.27 | AP23: - | AQ23: =RC[-29] -> 0 | AR23: =RC[-29] -> 0 | AS23: - | AT23: =RC[-30] -> 0 | AU23: =RC[-30] -> 0 | AV23: =RC[-30] -> 1.609 | AW23: =RC[-30] -> 5.0590000000000002 | AY23: - | AZ23: - | BA23: -
A24: =IF(RC[1]="","",DATEVALUE(RC[1])) -> 43376 | B24: 03.10.18 | C24: 24 | D24: =AVERAGE(R[-3]C:R[-1]C) -> 145.11000000000001 | E24: =AVERAGE(R[-3]C:R[-1]C) -> 68.5 | F24: =AVERAGE(R[-3]C:R[-1]C) -> 6.1066666666666665 | G24: =AVERAGE(R[-3]C:R[-1]C) -> 117.12333333333333 | H24: =AVERAGE(R[-3]C:R[-1]C) -> 38.43333333333333 | I24: =AVERAGE(R[-3]C:R[-1]C) -> 5.6066666666666665 | J24: =AVERAGE(R[-3]C:R[-1]C) -> 30.066666666666674 | K24: =AVERAGE(R[-3]C:R[-1]C) -> 27.986666666666665 | L24: 24.38 | M24: 67.45 | R24: 1.611 | S24: =RC[1] -> 5.4385948888888906 | T24: =(RC[-16]*RC[-15]-RC[-13]*RC[-12])/1000 -> 5.4385948888888906 | U24: 23.88 | V24: - | W24: =RC[-2]*RC[-10]/1000 -> 1.610706 | X24: =ABS((RC[-3]*RC[-11]-RC[-2]*RC[-9])/1000) -> #VALUE! | Y24: =(RC[-14]-RC[1])/RC[-18]*100 -> 3.5062754361499264 | Z24: 23.88 | AC24: =VALUE(RC[-27]) -> 2018-10-03T00:00:00.000 | AD24: =IF(RC[21]=42,"*",IF(RC[21]=32,"",RC[21])) -> - | AE24: =RC[-28] -> 24 | AF24: =RC[-28] -> 145.11000000000001 | AG24: =RC[-28] -> 68.5 | AH24: =RC[-28] -> 6.1066666666666665 | AI24: =RC[-28] -> 117.12333333333333 | AJ24: =RC[-28] -> 38.43333333333333 | AK24: =RC[-28] -> 5.6066666666666665 | AL24: =RC[-28] -> 30.066666666666674 | AM24: =RC[-28] -> 27.986666666666665 | AN24: =RC[-28] -> 24.38 | AO24: =RC[-28] -> 67.45 | AP24: - | AQ24: =RC[-29] -> 0 | AR24: =RC[-29] -> 0 | AS24: - | AT24: =RC[-30] -> 0 | AU24: =RC[-30] -> 0 | AV24: =RC[-30] -> 1.611 | AW24: =RC[-30] -> 5.4385948888888906 | AY24: - | AZ24: - | BA24: -
A25: =IF(RC[1]="","",DATEVALUE(RC[1])) -> 43377 | B25: 04.10.18 | C25: 24 | D25: 145.11000000000001 | E25: 68.5 | F25: 6.1066666666666665 | G25: 117.12333333333333 | H25: 38.43333333333333 | I25: 5.6066666666666665 | J25: 30.066666666666674 | K25: 27.986666666666665 | L25: 26.42 | M25: 66.67 | R25: 1.7250000000000001 | S25: =RC[1] -> 5.4385948888888906 | T25: =(RC[-16]*RC[-15]-RC[-13]*RC[-12])/1000 -> 5.4385948888888906 | U25: 25.89 | V25: - | W25: =RC[-2]*RC[-10]/1000 -> 1.7260863000000002 | X25: =ABS((RC[-3]*RC[-11]-RC[-2]*RC[-9])/1000) -> #VALUE! | Y25: =(RC[-14]-RC[1])/RC[-18]*100 -> 1.790135754333037 | Z25: 25.89 | AC25: =VALUE(RC[-27]) -> 2018-10-04T00:00:00.000 | AD25: =IF(RC[21]=42,"*",IF(RC[21]=32,"",RC[21])) -> - | AE25: =RC[-28] -> 24 | AF25: =RC[-28] -> 145.11000000000001 | AG25: =RC[-28] -> 68.5 | AH25: =RC[-28] -> 6.1066666666666665 | AI25: =RC[-28] -> 117.12333333333333 | AJ25: =RC[-28] -> 38.43333333333333 | AK25: =RC[-28] -> 5.6066666666666665 | AL25: =RC[-28] -> 30.066666666666674 | AM25: =RC[-28] -> 27.986666666666665 | AN25: =RC[-28] -> 26.42 | AO25: =RC[-28] -> 66.67 | AP25: - | AQ25: =RC[-29] -> 0 | AR25: =RC[-29] -> 0 | AS25: - | AT25: =RC[-30] -> 0 | AU25: =RC[-30] -> 0 | AV25: =RC[-30] -> 1.7250000000000001 | AW25: =RC[-30] -> 5.4385948888888906 | AY25: - | AZ25: - | BA25: -
A26: =IF(RC[1]="","",DATEVALUE(RC[1])) -> 43378 | B26: 05.10.18 | C26: 24 | D26: 145.11000000000001 | E26: 68.5 | F26: 6.1066666666666665 | G26: 117.12333333333333 | H26: 38.43333333333333 | I26: 5.6066666666666665 | J26: 30.066666666666674 | K26: 27.986666666666665 | L26: 25.75 | M26: 65.92 | R26: 1.6659999999999999 | S26: =RC[1] -> 5.4385948888888906 | T26: =(RC[-16]*RC[-15]-RC[-13]*RC[-12])/1000 -> 5.4385948888888906 | U26: 25.24 | V26: - | W26: =RC[-2]*RC[-10]/1000 -> 1.6638207999999999 | X26: =ABS((RC[-3]*RC[-11]-RC[-2]*RC[-9])/1000) -> #VALUE! | Y26: =(RC[-14]-RC[1])/RC[-18]*100 -> 2.3451062982041715 | Z26: 25.24 | AC26: =VALUE(RC[-27]) -> 2018-10-05T00:00:00.000 | AD26: =IF(RC[21]=42,"*",IF(RC[21]=32,"",RC[21])) -> - | AE26: =RC[-28] -> 24 | AF26: =RC[-28] -> 145.11000000000001 | AG26: =RC[-28] -> 68.5 | AH26: =RC[-28] -> 6.1066666666666665 | AI26: =RC[-28] -> 117.12333333333333 | AJ26: =RC[-28] -> 38.43333333333333 | AK26: =RC[-28] -> 5.6066666666666665 | AL26: =RC[-28] -> 30.066666666666674 | AM26: =RC[-28] -> 27.986666666666665 | AN26: =RC[-28] -> 25.75 | AO26: =RC[-28] -> 65.92 | AP26: - | AQ26: =RC[-29] -> 0 | AR26: =RC[-29] -> 0 | AS26: - | AT26: =RC[-30] -> 0 | AU26: =RC[-30] -> 0 | AV26: =RC[-30] -> 1.6659999999999999 | AW26: =RC[-30] -> 5.4385948888888906 | AY26: - | AZ26: - | BA26: -
A27: =IF(RC[1]="","",DATEVALUE(RC[1])) -> 43379 | B27: 06.10.18 | C27: 24 | D27: 145.11000000000001 | E27: 68.5 | F27: 6.1066666666666665 | G27: 117.12333333333333 | H27: 38.43333333333333 | I27: 5.6066666666666665 | J27: 30.066666666666674 | K27: 27.986666666666665 | L27: 27.12 | M27: 66.72 | R27: 1.7749999999999999 | S27: =RC[1] -> 5.4385948888888906 | T27: =(RC[-16]*RC[-15]-RC[-13]*RC[-12])/1000 -> 5.4385948888888906 | U27: 26.59 | V27: - | W27: =RC[-2]*RC[-10]/1000 -> 1.7740847999999998 | X27: =ABS((RC[-3]*RC[-11]-RC[-2]*RC[-9])/1000) -> #VALUE! | Y27: =(RC[-14]-RC[1])/RC[-18]*100 -> 1.1924751686256636 | Z27: 26.59 | AC27: =VALUE(RC[-27]) -> 2018-10-06T00:00:00.000 | AD27: =IF(RC[21]=42,"*",IF(RC[21]=32,"",RC[21])) -> - | AE27: =RC[-28] -> 24 | AF27: =RC[-28] -> 145.11000000000001 | AG27: =RC[-28] -> 68.5 | AH27: =RC[-28] -> 6.1066666666666665 | AI27: =RC[-28] -> 117.12333333333333 | AJ27: =RC[-28] -> 38.43333333333333 | AK27: =RC[-28] -> 5.6066666666666665 | AL27: =RC[-28] -> 30.066666666666674 | AM27: =RC[-28] -> 27.986666666666665 | AN27: =RC[-28] -> 27.12 | AO27: =RC[-28] -> 66.72 | AP27: - | AQ27: =RC[-29] -> 0 | AR27: =RC[-29] -> 0 | AS27: - | AT27: =RC[-30] -> 0 | AU27: =RC[-30] -> 0 | AV27: =RC[-30] -> 1.7749999999999999 | AW27: =RC[-30] -> 5.4385948888888906 | AY27: - | AZ27: - | BA27: -
A28: =IF(RC[1]="","",DATEVALUE(RC[1])) -> 43380 | B28: 07.10.18 | C28: 24 | D28: 145.11000000000001 | E28: 68.5 | F28: 6.1066666666666665 | G28: 117.12333333333333 | H28: 38.43333333333333 | I28: 5.6066666666666665 | J28: 30.066666666666674 | K28: 27.986666666666665 | L28: 30.7 | M28: 66.739999999999995 | R28: 2.0110000000000001 | S28: =RC[1] -> 5.4385948888888906 | T28: =(RC[-16]*RC[-15]-RC[-13]*RC[-12])/1000 -> 5.4385948888888906 | U28: 30.13 | V28: - | W28: =RC[-2]*RC[-10]/1000 -> 2.0108761999999998 | X28: =ABS((RC[-3]*RC[-11]-RC[-2]*RC[-9])/1000) -> #VALUE! | Y28: =(RC[-14]-RC[1])/RC[-18]*100 -> -1.8299797933801982 | Z28: 30.13 | AC28: =VALUE(RC[-27]) -> 2018-10-07T00:00:00.000 | AD28: =IF(RC[21]=42,"*",IF(RC[21]=32,"",RC[21])) -> - | AE28: =RC[-28] -> 24 | AF28: =RC[-28] -> 145.11000000000001 | AG28: =RC[-28] -> 68.5 | AH28: =RC[-28] -> 6.1066666666666665 | AI28: =RC[-28] -> 117.12333333333333 | AJ28: =RC[-28] -> 38.43333333333333 | AK28: =RC[-28] -> 5.6066666666666665 | AL28: =RC[-28] -> 30.066666666666674 | AM28: =RC[-28] -> 27.986666666666665 | AN28: =RC[-28] -> 30.7 | AO28: =RC[-28] -> 66.739999999999995 | AP28: - | AQ28: =RC[-29] -> 0 | AR28: =RC[-29] -> 0 | AS28: - | AT28: =RC[-30] -> 0 | AU28: =RC[-30] -> 0 | AV28: =RC[-30] -> 2.0110000000000001 | AW28: =RC[-30] -> 5.4385948888888906 | AY28: - | AZ28: - | BA28: -
A29: =IF(RC[1]="","",DATEVALUE(RC[1])) -> 43381 | B29: 08.10.18 | C29: 24 | D29: 145.11000000000001 | E29: 68.5 | F29: 6.1066666666666665 | G29: 117.12333333333333 | H29: 38.43333333333333 | I29: 5.6066666666666665 | J29: 30.066666666666674 | K29: 27.986666666666665 | L29: 28.49 | M29: 66.790000000000006 | R29: 1.867 | S29: =RC[1] -> 5.4385948888888906 | T29: =(RC[-16]*RC[-15]-RC[-13]*RC[-12])/1000 -> 5.4385948888888906 | U29: 27.91 | V29: - | W29: =RC[-2]*RC[-10]/1000 -> 1.8641089000000002 | X29: =ABS((RC[-3]*RC[-11]-RC[-2]*RC[-9])/1000) -> #VALUE! | Y29: =(RC[-14]-RC[1])/RC[-18]*100 -> 6.5458064148900971E-2 | Z29: 27.91 | AC29: =VALUE(RC[-27]) -> 2018-10-08T00:00:00.000 | AD29: =IF(RC[21]=42,"*",IF(RC[21]=32,"",RC[21])) -> - | AE29: =RC[-28] -> 24 | AF29: =RC[-28] -> 145.11000000000001 | AG29: =RC[-28] -> 68.5 | AH29: =RC[-28] -> 6.1066666666666665 | AI29: =RC[-28] -> 117.12333333333333 | AJ29: =RC[-28] -> 38.43333333333333 | AK29: =RC[-28] -> 5.6066666666666665 | AL29: =RC[-28] -> 30.066666666666674 | AM29: =RC[-28] -> 27.986666666666665 | AN29: =RC[-28] -> 28.49 | AO29: =RC[-28] -> 66.790000000000006 | AP29: - | AQ29: =RC[-29] -> 0 | AR29: =RC[-29] -> 0 | AS29: - | AT29: =RC[-30] -> 0 | AU29: =RC[-30] -> 0 | AV29: =RC[-30] -> 1.867 | AW29: =RC[-30] -> 5.4385948888888906 | AY29: - | AZ29: - | BA29: -
A30: =IF(RC[1]="","",DATEVALUE(RC[1])) -> 43382 | B30: 09.10.18 | C30: 24 | D30: 145.11000000000001 | E30: 68.5 | F30: 6.1066666666666665 | G30: 117.12333333333333 | H30: 38.43333333333333 | I30: 5.6066666666666665 | J30: 30.066666666666674 | K30: 27.986666666666665 | L30: 27.55 | M30: 66.84 | R30: 1.8029999999999999 | S30: =RC[1] -> 5.4385948888888906 | T30: =(RC[-16]*RC[-15]-RC[-13]*RC[-12])/1000 -> 5.4385948888888906 | U30: 26.97 | V30: - | W30: =RC[-2]*RC[-10]/1000 -> 1.8026747999999999 | X30: =ABS((RC[-3]*RC[-11]-RC[-2]*RC[-9])/1000) -> #VALUE! | Y30: =(RC[-14]-RC[1])/RC[-18]*100 -> 0.86803085067023289 | Z30: 26.97 | AC30: =VALUE(RC[-27]) -> 2018-10-09T00:00:00.000 | AD30: =IF(RC[21]=42,"*",IF(RC[21]=32,"",RC[21])) -> - | AE30: =RC[-28] -> 24 | AF30: =RC[-28] -> 145.11000000000001 | AG30: =RC[-28] -> 68.5 | AH30: =RC[-28] -> 6.1066666666666665 | AI30: =RC[-28] -> 117.12333333333333 | AJ30: =RC[-28] -> 38.43333333333333 | AK30: =RC[-28] -> 5.6066666666666665 | AL30: =RC[-28] -> 30.066666666666674 | AM30: =RC[-28] -> 27.986666666666665 | AN30: =RC[-28] -> 27.55 | AO30: =RC[-28] -> 66.84 | AP30: - | AQ30: =RC[-29] -> 0 | AR30: =RC[-29] -> 0 | AS30: - | AT30: =RC[-30] -> 0 | AU30: =RC[-30] -> 0 | AV30: =RC[-30] -> 1.8029999999999999 | AW30: =RC[-30] -> 5.4385948888888906 | AY30: - | AZ30: - | BA30: -
A31: =IF(RC[1]="","",DATEVALUE(RC[1])) -> 43383 | B31: 10.10.18 | C31: 24 | D31: 145.11000000000001 | E31: 68.5 | F31: 6.1066666666666665 | G31: 117.12333333333333 | H31: 38.43333333333333 | I31: 5.6066666666666665 | J31: 30.066666666666674 | K31: 27.986666666666665 | L31: 27.63 | M31: 67.989999999999995 | R31: 1.8420000000000001 | S31: =RC[1] -> 5.4385948888888906 | T31: =(RC[-16]*RC[-15]-RC[-13]*RC[-12])/1000 -> 5.4385948888888906 | U31: 27.06 | V31: - | W31: =RC[-2]*RC[-10]/1000 -> 1.8398093999999998 | X31: =ABS((RC[-3]*RC[-11]-RC[-2]*RC[-9])/1000) -> #VALUE! | Y31: =(RC[-14]-RC[1])/RC[-18]*100 -> 0.7911887753649991 | Z31: 27.06 | AC31: =VALUE(RC[-27]) -> 2018-10-10T00:00:00.000 | AD31: =IF(RC[21]=42,"*",IF(RC[21]=32,"",RC[21])) -> - | AE31: =RC[-28] -> 24 | AF31: =RC[-28] -> 145.11000000000001 | AG31: =RC[-28] -> 68.5 | AH31: =RC[-28] -> 6.1066666666666665 | AI31: =RC[-28] -> 117.12333333333333 | AJ31: =RC[-28] -> 38.43333333333333 | AK31: =RC[-28] -> 5.6066666666666665 | AL31: =RC[-28] -> 30.066666666666674 | AM31: =RC[-28] -> 27.986666666666665 | AN31: =RC[-28] -> 27.63 | AO31: =RC[-28] -> 67.989999999999995 | AP31: - | AQ31: =RC[-29] -> 0 | AR31: =RC[-29] -> 0 | AS31: - | AT31: =RC[-30] -> 0 | AU31: =RC[-30] -> 0 | AV31: =RC[-30] -> 1.8420000000000001 | AW31: =RC[-30] -> 5.4385948888888906 | AY31: - | AZ31: - | BA31: -
A32: =IF(RC[1]="","",DATEVALUE(RC[1])) -> 43384 | B32: 11.10.18 | C32: 24 | D32: 114.23 | E32: 68.8 | F32: 5.94 | G32: 86 | H32: 34.090000000000003 | I32: 5.72 | J32: =RC[-5]-RC[-2] -> 34.709999999999994 | K32: 28.23 | L32: 25.47 | M32: 68.930000000000007 | R32: 1.7190000000000001 | S32: 4.9249999999999998 | T32: =(RC[-16]*RC[-15]-RC[-13]*RC[-12])/1000 -> 4.9272839999999993 | U32: 24.93 | V32: - | W32: =RC[-2]*RC[-10]/1000 -> 1.7184249000000003 | X32: =ABS((RC[-3]*RC[-11]-RC[-2]*RC[-9])/1000) -> #VALUE! | Y32: =(RC[-14]-RC[1])/RC[-18]*100 -> 3.8372093023255824 | Z32: 24.93 | AC32: =VALUE(RC[-27]) -> 2018-10-11T00:00:00.000 | AD32: =IF(RC[21]=42,"*",IF(RC[21]=32,"",RC[21])) -> - | AE32: =RC[-28] -> 24 | AF32: =RC[-28] -> 114.23 | AG32: =RC[-28] -> 68.8 | AH32: =RC[-28] -> 5.94 | AI32: =RC[-28] -> 86 | AJ32: =RC[-28] -> 34.090000000000003 | AK32: =RC[-28] -> 5.72 | AL32: =RC[-28] -> 34.709999999999994 | AM32: =RC[-28] -> 28.23 | AN32: =RC[-28] -> 25.47 | AO32: =RC[-28] -> 68.930000000000007 | AP32: - | AQ32: =RC[-29] -> 0 | AR32: =RC[-29] -> 0 | AS32: - | AT32: =RC[-30] -> 0 | AU32: =RC[-30] -> 0 | AV32: =RC[-30] -> 1.7190000000000001 | AW32: =RC[-30] -> 4.9249999999999998 | AY32: - | AZ32: - | BA32: -
A33: =IF(RC[1]="","",DATEVALUE(RC[1])) -> 43385 | B33: 12.10.18 | C33: 24 | D33: 108.96 | E33: 68.61 | F33: 5.96 | G33: 82.02 | H33: 33.369999999999997 | I33: 5.76 | J33: =RC[-5]-RC[-2] -> 35.24 | K33: 26.94 | L33: 24.4 | M33: 68.67 | R33: 1.641 | S33: 4.7350000000000003 | T33: =(RC[-16]*RC[-15]-RC[-13]*RC[-12])/1000 -> 4.7387381999999993 | U33: 23.89 | V33: - | W33: =RC[-2]*RC[-10]/1000 -> 1.6405262999999999 | X33: =ABS((RC[-3]*RC[-11]-RC[-2]*RC[-9])/1000) -> #VALUE! | Y33: =(RC[-14]-RC[1])/RC[-18]*100 -> 3.7186052182394547 | Z33: 23.89 | AC33: =VALUE(RC[-27]) -> 2018-10-12T00:00:00.000 | AD33: =IF(RC[21]=42,"*",IF(RC[21]=32,"",RC[21])) -> - | AE33: =RC[-28] -> 24 | AF33: =RC[-28] -> 108.96 | AG33: =RC[-28] -> 68.61 | AH33: =RC[-28] -> 5.96 | AI33: =RC[-28] -> 82.02 | AJ33: =RC[-28] -> 33.369999999999997 | AK33: =RC[-28] -> 5.76 | AL33: =RC[-28] -> 35.24 | AM33: =RC[-28] -> 26.94 | AN33: =RC[-28] -> 24.4 | AO33: =RC[-28] -> 68.67 | AP33: - | AQ33: =RC[-29] -> 0 | AR33: =RC[-29] -> 0 | AS33: - | AT33: =RC[-30] -> 0 | AU33: =RC[-30] -> 0 | AV33: =RC[-30] -> 1.641 | AW33: =RC[-30] -> 4.7350000000000003 | AY33: - | AZ33: - | BA33: -
A34: =IF(RC[1]="","",DATEVALUE(RC[1])) -> 43386 | B34: 13.10.18 | C34: 24 | D34: 114.49 | E34: 69.790000000000006 | F34: 5.98 | G34: 85.59 | H34: 34.549999999999997 | I34: 5.77 | J34: =RC[-5]-RC[-2] -> 35.240000000000009 | K34: 28.9 | L34: 26.57 | M34: 69.92 | R34: 1.819 | S34: 5.0309999999999997 | T34: =(RC[-16]*RC[-15]-RC[-13]*RC[-12])/1000 -> 5.0331226000000004 | U34: 26.01 | V34: - | W34: =RC[-2]*RC[-10]/1000 -> 1.8186192000000001 | X34: =ABS((RC[-3]*RC[-11]-RC[-2]*RC[-9])/1000) -> #VALUE! | Y34: =(RC[-14]-RC[1])/RC[-18]*100 -> 3.3765626825563699 | Z34: 26.01 | AC34: =VALUE(RC[-27]) -> 2018-10-13T00:00:00.000 | AD34: =IF(RC[21]=42,"*",IF(RC[21]=32,"",RC[21])) -> - | AE34: =RC[-28] -> 24 | AF34: =RC[-28] -> 114.49 | AG34: =RC[-28] -> 69.790000000000006 | AH34: =RC[-28] -> 5.98 | AI34: =RC[-28] -> 85.59 | AJ34: =RC[-28] -> 34.549999999999997 | AK34: =RC[-28] -> 5.77 | AL34: =RC[-28] -> 35.240000000000009 | AM34: =RC[-28] -> 28.9 | AN34: =RC[-28] -> 26.57 | AO34: =RC[-28] -> 69.92 | AP34: - | AQ34: =RC[-29] -> 0 | AR34: =RC[-29] -> 0 | AS34: - | AT34: =RC[-30] -> 0 | AU34: =RC[-30] -> 0 | AV34: =RC[-30] -> 1.819 | AW34: =RC[-30] -> 5.0309999999999997 | AY34: - | AZ34: - | BA34: -
A35: =IF(RC[1]="","",DATEVALUE(RC[1])) -> 43387 | B35: 14.10.18 | C35: 24 | D35: 115.71 | E35: 70.569999999999993 | F35: 5.89 | G35: 85.94 | H35: 35.6 | I35: 5.68 | J35: =RC[-5]-RC[-2] -> 34.969999999999992 | K35: 29.77 | L35: 27.52 | M35: 70.81 | R35: 1.9079999999999999 | S35: 5.1020000000000003 | T35: =(RC[-16]*RC[-15]-RC[-13]*RC[-12])/1000 -> 5.1061906999999991 | U35: 26.92 | V35: - | W35: =RC[-2]*RC[-10]/1000 -> 1.9062052 | X35: =ABS((RC[-3]*RC[-11]-RC[-2]*RC[-9])/1000) -> #VALUE! | Y35: =(RC[-14]-RC[1])/RC[-18]*100 -> 3.3162671631370695 | Z35: 26.92 | AC35: =VALUE(RC[-27]) -> 2018-10-14T00:00:00.000 | AD35: =IF(RC[21]=42,"*",IF(RC[21]=32,"",RC[21])) -> - | AE35: =RC[-28] -> 24 | AF35: =RC[-28] -> 115.71 | AG35: =RC[-28] -> 70.569999999999993 | AH35: =RC[-28] -> 5.89 | AI35: =RC[-28] -> 85.94 | AJ35: =RC[-28] -> 35.6 | AK35: =RC[-28] -> 5.68 | AL35: =RC[-28] -> 34.969999999999992 | AM35: =RC[-28] -> 29.77 | AN35: =RC[-28] -> 27.52 | AO35: =RC[-28] -> 70.81 | AP35: - | AQ35: =RC[-29] -> 0 | AR35: =RC[-29] -> 0 | AS35: - | AT35: =RC[-30] -> 0 | AU35: =RC[-30] -> 0 | AV35: =RC[-30] -> 1.9079999999999999 | AW35: =RC[-30] -> 5.1020000000000003 | AY35: - | AZ35: - | BA35: -
A36: =IF(RC[1]="","",DATEVALUE(RC[1])) -> 43388 | B36: 15.10.18 | C36: 24 | D36: 117.13 | E36: 70.08 | F36: 5.89 | G36: 89.55 | H36: 36.33 | I36: 5.66 | J36: =RC[-5]-RC[-2] -> 33.75 | K36: 27.58 | L36: 25.26 | M36: 70.2 | R36: 1.736 | S36: 4.952 | T36: =(RC[-16]*RC[-15]-RC[-13]*RC[-12])/1000 -> 4.9551189000000004 | U36: 24.72 | V36: - | W36: =RC[-2]*RC[-10]/1000 -> 1.735344 | X36: =ABS((RC[-3]*RC[-11]-RC[-2]*RC[-9])/1000) -> #VALUE! | Y36: =(RC[-14]-RC[1])/RC[-18]*100 -> 3.1937465103294245 | Z36: 24.72 | AC36: =VALUE(RC[-27]) -> 2018-10-15T00:00:00.000 | AD36: =IF(RC[21]=42,"*",IF(RC[21]=32,"",RC[21])) -> - | AE36: =RC[-28] -> 24 | AF36: =RC[-28] -> 117.13 | AG36: =RC[-28] -> 70.08 | AH36: =RC[-28] -> 5.89 | AI36: =RC[-28] -> 89.55 | AJ36: =RC[-28] -> 36.33 | AK36: =RC[-28] -> 5.66 | AL36: =RC[-28] -> 33.75 | AM36: =RC[-28] -> 27.58 | AN36: =RC[-28] -> 25.26 | AO36: =RC[-28] -> 70.2 | AP36: - | AQ36: =RC[-29] -> 0 | AR36: =RC[-29] -> 0 | AS36: - | AT36: =RC[-30] -> 0 | AU36: =RC[-30] -> 0 | AV36: =RC[-30] -> 1.736 | AW36: =RC[-30] -> 4.952 | AY36: - | AZ36: - | BA36: -
A37: =IF(RC[1]="","",DATEVALUE(RC[1])) -> 43389 | B37: 16.10.18 | C37: 24 | D37: 116.64 | E37: 70.11 | F37: 5.83 | G37: 89.55 | H37: 36.24 | I37: 5.6 | J37: =RC[-5]-RC[-2] -> 33.869999999999997 | K37: 27.09 | L37: 24.81 | M37: 70.2 | R37: 1.706 | S37: 4.9249999999999998 | T37: =(RC[-16]*RC[-15]-RC[-13]*RC[-12])/1000 -> 4.9323384000000008 | U37: 24.27 | V37: - | W37: =RC[-2]*RC[-10]/1000 -> 1.7037540000000002 | X37: =ABS((RC[-3]*RC[-11]-RC[-2]*RC[-9])/1000) -> #VALUE! | Y37: =(RC[-14]-RC[1])/RC[-18]*100 -> 3.1490787269681748 | Z37: 24.27 | AC37: =VALUE(RC[-27]) -> 2018-10-16T00:00:00.000 | AD37: =IF(RC[21]=42,"*",IF(RC[21]=32,"",RC[21])) -> - | AE37: =RC[-28] -> 24 | AF37: =RC[-28] -> 116.64 | AG37: =RC[-28] -> 70.11 | AH37: =RC[-28] -> 5.83 | AI37: =RC[-28] -> 89.55 | AJ37: =RC[-28] -> 36.24 | AK37: =RC[-28] -> 5.6 | AL37: =RC[-28] -> 33.869999999999997 | AM37: =RC[-28] -> 27.09 | AN37: =RC[-28] -> 24.81 | AO37: =RC[-28] -> 70.2 | AP37: - | AQ37: =RC[-29] -> 0 | AR37: =RC[-29] -> 0 | AS37: - | AT37: =RC[-30] -> 0 | AU37: =RC[-30] -> 0 | AV37: =RC[-30] -> 1.706 | AW37: =RC[-30] -> 4.9249999999999998 | AY37: - | AZ37: - | BA37: -
A38: =IF(RC[1]="","",DATEVALUE(RC[1])) -> 43390 | B38: 17.10.18 | C38: 24 | D38: 121.71 | E38: 70.39 | F38: 5.83 | G38: 92.69 | H38: 36.979999999999997 | I38: 5.58 | J38: =RC[-5]-RC[-2] -> 33.410000000000004 | K38: 29.02 | L38: 26.92 | M38: 70.599999999999994 | R38: 1.861 | S38: 5.1349999999999998 | T38: =(RC[-16]*RC[-15]-RC[-13]*RC[-12])/1000 -> 5.1394907000000005 | U38: 26.33 | V38: - | W38: =RC[-2]*RC[-10]/1000 -> 1.8588979999999997 | X38: =ABS((RC[-3]*RC[-11]-RC[-2]*RC[-9])/1000) -> #VALUE! | Y38: =(RC[-14]-RC[1])/RC[-18]*100 -> 2.9021469414176302 | Z38: 26.33 | AC38: =VALUE(RC[-27]) -> 2018-10-17T00:00:00.000 | AD38: =IF(RC[21]=42,"*",IF(RC[21]=32,"",RC[21])) -> - | AE38: =RC[-28] -> 24 | AF38: =RC[-28] -> 121.71 | AG38: =RC[-28] -> 70.39 | AH38: =RC[-28] -> 5.83 | AI38: =RC[-28] -> 92.69 | AJ38: =RC[-28] -> 36.979999999999997 | AK38: =RC[-28] -> 5.58 | AL38: =RC[-28] -> 33.410000000000004 | AM38: =RC[-28] -> 29.02 | AN38: =RC[-28] -> 26.92 | AO38: =RC[-28] -> 70.599999999999994 | AP38: - | AQ38: =RC[-29] -> 0 | AR38: =RC[-29] -> 0 | AS38: - | AT38: =RC[-30] -> 0 | AU38: =RC[-30] -> 0 | AV38: =RC[-30] -> 1.861 | AW38: =RC[-30] -> 5.1349999999999998 | AY38: - | AZ38: - | BA38: -
A39: =IF(RC[1]="","",DATEVALUE(RC[1])) -> 43391 | B39: 18.10.18 | C39: 24 | D39: 122.46 | E39: 70.84 | F39: 5.88 | G39: 93.76 | H39: 37.1 | I39: 5.62 | J39: 33.74 | K39: 28.7 | L39: 25.71 | M39: 71.03 | R39: 1.7869999999999999 | S39: 5.1929999999999996 | T39: 5.1965703999999988 | U39: 25.14 | V39: - | W39: 1.7856942000000002 | X39: #VALUE! | Y39: 3.7969283276450492 | Z39: 25.14 | AC39: =VALUE(RC[-27]) -> 2018-10-18T00:00:00.000 | AD39: =IF(RC[21]=42,"*",IF(RC[21]=32,"",RC[21])) ->  | AE39: =RC[-28] -> 24 | AF39: =RC[-28] -> 122.46 | AG39: =RC[-28] -> 70.84 | AH39: =RC[-28] -> 5.88 | AI39: =RC[-28] -> 93.76 | AJ39: =RC[-28] -> 37.1 | AK39: =RC[-28] -> 5.62 | AL39: =RC[-28] -> 33.74 | AM39: =RC[-28] -> 28.7 | AN39: =RC[-28] -> 25.71 | AO39: =RC[-28] -> 71.03 | AP39: - | AQ39: =RC[-29] -> 0 | AR39: =RC[-29] -> 0 | AS39: - | AT39: =RC[-30] -> 0 | AU39: =RC[-30] -> 0 | AV39: =RC[-30] -> 1.7869999999999999 | AW39: =RC[-30] -> 5.1929999999999996
A40: =IF(RC[1]="","",DATEVALUE(RC[1])) -> 43392 | B40: 19.10.18 | C40: 24 | D40: 124.15 | E40: 70.650000000000006 | F40: 5.91 | G40: 97.37 | H40: 37.01 | I40: 5.63 | J40: 33.640000000000008 | K40: 26.78 | L40: 24.21 | M40: 70.73 | R40: 1.6779999999999999 | S40: 5.1619999999999999 | T40: 5.1675338000000002 | U40: 23.7 | V40: - | W40: 1.676301 | X40: #VALUE! | Y40: 3.163191948238679 | Z40: 23.7 | AC40: =VALUE(RC[-27]) -> 2018-10-19T00:00:00.000 | AD40: =IF(RC[21]=42,"*",IF(RC[21]=32,"",RC[21])) ->  | AE40: =RC[-28] -> 24 | AF40: =RC[-28] -> 124.15 | AG40: =RC[-28] -> 70.650000000000006 | AH40: =RC[-28] -> 5.91 | AI40: =RC[-28] -> 97.37 | AJ40: =RC[-28] -> 37.01 | AK40: =RC[-28] -> 5.63 | AL40: =RC[-28] -> 33.640000000000008 | AM40: =RC[-28] -> 26.78 | AN40: =RC[-28] -> 24.21 | AO40: =RC[-28] -> 70.73 | AP40: - | AQ40: =RC[-29] -> 0 | AR40: =RC[-29] -> 0 | AS40: - | AT40: =RC[-30] -> 0 | AU40: =RC[-30] -> 0 | AV40: =RC[-30] -> 1.6779999999999999 | AW40: =RC[-30] -> 5.1619999999999999
A41: =IF(RC[1]="","",DATEVALUE(RC[1])) -> 43393 | B41: 20.10.18 | C41: 24 | D41: 119.26 | E41: 69.84 | F41: 5.9 | G41: 90.61 | H41: 35.380000000000003 | I41: 5.67 | J41: 34.46 | K41: 28.65 | L41: 26.2 | M41: 70.05 | R41: 1.7989999999999999 | S41: 5.1189999999999998 | T41: 5.1233366000000009 | U41: 25.63 | V41: - | W41: 1.7953815 | X41: #VALUE! | Y41: 3.332965456351396 | Z41: 25.63 | AC41: =VALUE(RC[-27]) -> 2018-10-20T00:00:00.000 | AD41: =IF(RC[21]=42,"*",IF(RC[21]=32,"",RC[21])) ->  | AE41: =RC[-28] -> 24 | AF41: =RC[-28] -> 119.26 | AG41: =RC[-28] -> 69.84 | AH41: =RC[-28] -> 5.9 | AI41: =RC[-28] -> 90.61 | AJ41: =RC[-28] -> 35.380000000000003 | AK41: =RC[-28] -> 5.67 | AL41: =RC[-28] -> 34.46 | AM41: =RC[-28] -> 28.65 | AN41: =RC[-28] -> 26.2 | AO41: =RC[-28] -> 70.05 | AP41: - | AQ41: =RC[-29] -> 0 | AR41: =RC[-29] -> 0 | AS41: - | AT41: =RC[-30] -> 0 | AU41: =RC[-30] -> 0 | AV41: =RC[-30] -> 1.7989999999999999 | AW41: =RC[-30] -> 5.1189999999999998
A42: =IF(RC[1]="","",DATEVALUE(RC[1])) -> 43394 | B42: 21.10.18 | C42: 24 | D42: 118.66 | E42: 69 | F42: 5.91 | G42: 86.57 | H42: 34.770000000000003 | I42: 5.7 | J42: 34.229999999999997 | K42: 32.090000000000003 | L42: 29.98 | M42: 69.13 | R42: 2.0289999999999999 | S42: 5.1710000000000003 | T42: 5.1775010999999997 | U42: 29.34 | V42: - | W42: 2.0282741999999998 | X42: #VALUE! | Y42: 3.1766200762388861 | Z42: 29.34 | AC42: =VALUE(RC[-27]) -> 2018-10-21T00:00:00.000 | AD42: =IF(RC[21]=42,"*",IF(RC[21]=32,"",RC[21])) ->  | AE42: =RC[-28] -> 24 | AF42: =RC[-28] -> 118.66 | AG42: =RC[-28] -> 69 | AH42: =RC[-28] -> 5.91 | AI42: =RC[-28] -> 86.57 | AJ42: =RC[-28] -> 34.770000000000003 | AK42: =RC[-28] -> 5.7 | AL42: =RC[-28] -> 34.229999999999997 | AM42: =RC[-28] -> 32.090000000000003 | AN42: =RC[-28] -> 29.98 | AO42: =RC[-28] -> 69.13 | AP42: - | AQ42: =RC[-29] -> 0 | AR42: =RC[-29] -> 0 | AS42: - | AT42: =RC[-30] -> 0 | AU42: =RC[-30] -> 0 | AV42: =RC[-30] -> 2.0289999999999999 | AW42: =RC[-30] -> 5.1710000000000003
A43: =IF(RC[1]="","",DATEVALUE(RC[1])) -> 43395 | B43: 22.10.18 | C43: 24 | D43: 116.75 | E43: 69.47 | F43: 5.94 | G43: 86.09 | H43: 34.11 | I43: 5.73 | J43: 35.36 | K43: 30.66 | L43: 28.35 | M43: 69.8 | R43: 1.9339999999999999 | S43: 5.1680000000000001 | T43: 5.1740925999999998 | U43: 27.74 | V43: - | W43: 1.9362519999999996 | X43: #VALUE! | Y43: 3.3917992798234424 | Z43: 27.74 | AC43: =VALUE(RC[-27]) -> 2018-10-22T00:00:00.000 | AD43: =IF(RC[21]=42,"*",IF(RC[21]=32,"",RC[21])) ->  | AE43: =RC[-28] -> 24 | AF43: =RC[-28] -> 116.75 | AG43: =RC[-28] -> 69.47 | AH43: =RC[-28] -> 5.94 | AI43: =RC[-28] -> 86.09 | AJ43: =RC[-28] -> 34.11 | AK43: =RC[-28] -> 5.73 | AL43: =RC[-28] -> 35.36 | AM43: =RC[-28] -> 30.66 | AN43: =RC[-28] -> 28.35 | AO43: =RC[-28] -> 69.8 | AP43: - | AQ43: =RC[-29] -> 0 | AR43: =RC[-29] -> 0 | AS43: - | AT43: =RC[-30] -> 0 | AU43: =RC[-30] -> 0 | AV43: =RC[-30] -> 1.9339999999999999 | AW43: =RC[-30] -> 5.1680000000000001
A44: =IF(RC[1]="","",DATEVALUE(RC[1])) ->  | C44: 24 | J44: =RC[-5]-RC[-2] -> #VALUE! | T44: =(RC[-16]*RC[-15]-RC[-13]*RC[-12])/1000 -> #VALUE! | W44: =RC[-2]*RC[-10]/1000 -> #VALUE! | X44: =ABS((RC[-3]*RC[-11]-RC[-2]*RC[-9])/1000) -> #VALUE! | Y44: =(RC[-14]-RC[1])/RC[-18]*100 -> #VALUE! | AC44: =VALUE(RC[-27]) -> #VALUE! | AD44: =IF(RC[21]=42,"*",IF(RC[21]=32,"",RC[21])) ->  | AE44: =RC[-28] -> 24 | AF44: =RC[-28] ->  | AG44: =RC[-28] ->  | AH44: =RC[-28] ->  | AI44: =RC[-28] ->  | AJ44: =RC[-28] ->  | AK44: =RC[-28] ->  | AL44: =RC[-28] -> #VALUE! | AM44: =RC[-28] ->  | AN44: =RC[-28] ->  | AO44: =RC[-28] ->  | AP44: - | AQ44: =RC[-29] -> 0 | AR44: =RC[-29] -> 0 | AS44: - | AT44: =RC[-30] -> 0 | AU44: =RC[-30] -> 0 | AV44: =RC[-30] ->  | AW44: =RC[-30] -> 
A45: =IF(RC[1]="","",DATEVALUE(RC[1])) ->  | C45: 24 | T45: =(RC[-16]*RC[-15]-RC[-13]*RC[-12])/1000 -> #VALUE! | W45: =RC[-2]*RC[-10]/1000 -> #VALUE! | X45: =ABS((RC[-3]*RC[-11]-RC[-2]*RC[-9])/1000) -> #VALUE! | Y45: =(RC[-14]-RC[1])/RC[-18]*100 -> #VALUE! | AC45: =VALUE(RC[-27]) -> #VALUE! | AD45: =IF(RC[21]=42,"*",IF(RC[21]=32,"",RC[21])) ->  | AE45: =RC[-28] -> 24 | AF45: =RC[-28] ->  | AG45: =RC[-28] ->  | AH45: =RC[-28] ->  | AI45: =RC[-28] ->  | AJ45: =RC[-28] ->  | AK45: =RC[-28] ->  | AL45: =RC[-28] -> 0 | AM45: =RC[-28] ->  | AN45: =RC[-28] ->  | AO45: =RC[-28] ->  | AP45: - | AQ45: =RC[-29] -> 0 | AR45: =RC[-29] -> 0 | AS45: - | AT45: =RC[-30] -> 0 | AU45: =RC[-30] -> 0 | AV45: =RC[-30] ->  | AW45: =RC[-30] -> 
A46: =IF(RC[1]="","",DATEVALUE(RC[1])) ->  | C46: 24 | T46: =(RC[-16]*RC[-15]-RC[-13]*RC[-12])/1000 -> #VALUE! | W46: =RC[-2]*RC[-10]/1000 -> #VALUE! | X46: =ABS((RC[-3]*RC[-11]-RC[-2]*RC[-9])/1000) -> #VALUE! | Y46: =(RC[-14]-RC[1])/RC[-18]*100 -> #VALUE! | AC46: =VALUE(RC[-27]) -> #VALUE! | AD46: =IF(RC[21]=42,"*",IF(RC[21]=32,"",RC[21])) ->  | AE46: =RC[-28] -> 24 | AF46: =RC[-28] ->  | AG46: =RC[-28] ->  | AH46: =RC[-28] ->  | AI46: =RC[-28] ->  | AJ46: =RC[-28] ->  | AK46: =RC[-28] ->  | AL46: =RC[-28] -> 0 | AM46: =RC[-28] ->  | AN46: =RC[-28] ->  | AO46: =RC[-28] ->  | AP46: - | AQ46: =RC[-29] -> 0 | AR46: =RC[-29] -> 0 | AS46: - | AT46: =RC[-30] -> 0 | AU46: =RC[-30] -> 0 | AV46: =RC[-30] ->  | AW46: =RC[-30] -> 
A47: =IF(RC[1]="","",DATEVALUE(RC[1])) ->  | C47: 24 | T47: =(RC[-16]*RC[-15]-RC[-13]*RC[-12])/1000 -> #VALUE! | W47: =RC[-2]*RC[-10]/1000 -> #VALUE! | X47: =ABS((RC[-3]*RC[-11]-RC[-2]*RC[-9])/1000) -> #VALUE! | Y47: =(RC[-14]-RC[1])/RC[-18]*100 -> #VALUE! | AC47: =VALUE(RC[-27]) -> #VALUE! | AD47: =IF(RC[21]=42,"*",IF(RC[21]=32,"",RC[21])) ->  | AE47: =RC[-28] -> 24 | AF47: =RC[-28] ->  | AG47: =RC[-28] ->  | AH47: =RC[-28] ->  | AI47: =RC[-28] ->  | AJ47: =RC[-28] ->  | AK47: =RC[-28] ->  | AL47: =RC[-28] -> 0 | AM47: =RC[-28] ->  | AN47: =RC[-28] ->  | AO47: =RC[-28] ->  | AP47: - | AQ47: =RC[-29] -> 0 | AR47: =RC[-29] -> 0 | AS47: - | AT47: =RC[-30] -> 0 | AU47: =RC[-30] -> 0 | AV47: =RC[-30] ->  | AW47: =RC[-30] -> 
A48: =IF(RC[1]="","",DATEVALUE(RC[1])) ->  | C48: 24 | T48: =(RC[-16]*RC[-15]-RC[-13]*RC[-12])/1000 -> #VALUE! | W48: =RC[-2]*RC[-10]/1000 -> #VALUE! | X48: =ABS((RC[-3]*RC[-11]-RC[-2]*RC[-9])/1000) -> #VALUE! | Y48: =(RC[-14]-RC[1])/RC[-18]*100 -> #VALUE! | AC48: =VALUE(RC[-27]) -> #VALUE! | AD48: =IF(RC[21]=42,"*",IF(RC[21]=32,"",RC[21])) ->  | AE48: =RC[-28] -> 24 | AF48: =RC[-28] ->  | AG48: =RC[-28] ->  | AH48: =RC[-28] ->  | AI48: =RC[-28] ->  | AJ48: =RC[-28] ->  | AK48: =RC[-28] ->  | AL48: =RC[-28] -> 0 | AM48: =RC[-28] ->  | AN48: =RC[-28] ->  | AO48: =RC[-28] ->  | AP48: - | AQ48: =RC[-29] -> 0 | AR48: =RC[-29] -> 0 | AS48: - | AT48: =RC[-30] -> 0 | AU48: =RC[-30] -> 0 | AV48: =RC[-30] ->  | AW48: =RC[-30] -> 
A49: =IF(RC[1]="","",DATEVALUE(RC[1])) ->  | C49: 24 | T49: =(RC[-16]*RC[-15]-RC[-13]*RC[-12])/1000 -> #VALUE! | W49: =RC[-2]*RC[-10]/1000 -> #VALUE! | X49: =ABS((RC[-3]*RC[-11]-RC[-2]*RC[-9])/1000) -> #VALUE! | Y49: =(RC[-14]-RC[1])/RC[-18]*100 -> #VALUE! | AC49: =VALUE(RC[-27]) -> #VALUE! | AD49: =IF(RC[21]=42,"*",IF(RC[21]=32,"",RC[21])) ->  | AE49: =RC[-28] -> 24 | AF49: =RC[-28] ->  | AG49: =RC[-28] ->  | AH49: =RC[-28] ->  | AI49: =RC[-28] ->  | AJ49: =RC[-28] ->  | AK49: =RC[-28] ->  | AL49: =RC[-28] -> 0 | AM49: =RC[-28] ->  | AN49: =RC[-28] ->  | AO49: =RC[-28] ->  | AP49: - | AQ49: =RC[-29] -> 0 | AR49: =RC[-29] -> 0 | AS49: - | AT49: =RC[-30] -> 0 | AU49: =RC[-30] -> 0 | AV49: =RC[-30] ->  | AW49: =RC[-30] -> 
A50: =IF(RC[1]="","",DATEVALUE(RC[1])) ->  | T50: =(RC[-16]*RC[-15]-RC[-13]*RC[-12])/1000 -> #VALUE! | W50: =RC[-2]*RC[-10]/1000 -> #VALUE! | X50: =ABS((RC[-3]*RC[-11]-RC[-2]*RC[-9])/1000) -> #VALUE! | Y50: =(RC[-14]-RC[1])/RC[-18]*100 -> #VALUE! | AC50: =VALUE(RC[-27]) -> #VALUE! | AD50: =IF(RC[21]=42,"*",IF(RC[21]=32,"",RC[21])) ->  | AE50: =RC[-28] ->  | AF50: =RC[-28] ->  | AG50: =RC[-28] ->  | AH50: =RC[-28] ->  | AI50: =RC[-28] ->  | AJ50: =RC[-28] ->  | AK50: =RC[-28] ->  | AL50: =RC[-28] -> 0 | AM50: =RC[-28] ->  | AN50: =RC[-28] ->  | AO50: =RC[-28] ->  | AP50: - | AQ50: =RC[-29] -> 0 | AR50: =RC[-29] -> 0 | AS50: - | AT50: =RC[-30] -> 0 | AU50: =RC[-30] -> 0 | AV50: =RC[-30] ->  | AW50: =RC[-30] -> 
A51: =IF(RC[1]="","",DATEVALUE(RC[1])) ->  | T51: =(RC[-16]*RC[-15]-RC[-13]*RC[-12])/1000 -> #VALUE! | W51: =RC[-2]*RC[-10]/1000 -> #VALUE! | X51: =ABS((RC[-3]*RC[-11]-RC[-2]*RC[-9])/1000) -> #VALUE! | Y51: =(RC[-14]-RC[1])/RC[-18]*100 -> #VALUE! | AC51: =VALUE(RC[-27]) -> #VALUE! | AD51: =IF(RC[21]=42,"*",IF(RC[21]=32,"",RC[21])) ->  | AE51: =RC[-28] ->  | AF51: =RC[-28] ->  | AG51: =RC[-28] ->  | AH51: =RC[-28] ->  | AI51: =RC[-28] ->  | AJ51: =RC[-28] ->  | AK51: =RC[-28] ->  | AL51: =RC[-28] -> 0 | AM51: =RC[-28] ->  | AN51: =RC[-28] ->  | AO51: =RC[-28] ->  | AP51: - | AQ51: =RC[-29] -> 0 | AR51: =RC[-29] -> 0 | AS51: - | AT51: =RC[-30] -> 0 | AU51: =RC[-30] -> 0 | AV51: =RC[-30] ->  | AW51: =RC[-30] -> 
A52: =IF(RC[1]="","",DATEVALUE(RC[1])) ->  | T52: =(RC[-16]*RC[-15]-RC[-13]*RC[-12])/1000 -> #VALUE! | W52: =RC[-2]*RC[-10]/1000 -> #VALUE! | X52: =ABS((RC[-3]*RC[-11]-RC[-2]*RC[-9])/1000) -> #VALUE! | Y52: =(RC[-14]-RC[1])/RC[-18]*100 -> #VALUE! | AC52: =VALUE(RC[-27]) -> #VALUE! | AD52: =IF(RC[21]=42,"*",IF(RC[21]=32,"",RC[21])) ->  | AE52: =RC[-28] ->  | AF52: =RC[-28] ->  | AG52: =RC[-28] ->  | AH52: =RC[-28] ->  | AI52: =RC[-28] ->  | AJ52: =RC[-28] ->  | AK52: =RC[-28] ->  | AL52: =RC[-28] -> 0 | AM52: =RC[-28] ->  | AN52: =RC[-28] ->  | AO52: =RC[-28] ->  | AP52: - | AQ52: =RC[-29] -> 0 | AR52: =RC[-29] -> 0 | AS52: - | AT52: =RC[-30] -> 0 | AU52: =RC[-30] -> 0 | AV52: =RC[-30] ->  | AW52: =RC[-30] -> 
A53: =IF(RC[1]="","",DATEVALUE(RC[1])) ->  | T53: =(RC[-16]*RC[-15]-RC[-13]*RC[-12])/1000 -> #VALUE! | W53: =RC[-2]*RC[-10]/1000 -> #VALUE! | X53: =ABS((RC[-3]*RC[-11]-RC[-2]*RC[-9])/1000) -> #VALUE! | Y53: =(RC[-14]-RC[1])/RC[-18]*100 -> #VALUE! | AC53: =VALUE(RC[-27]) -> #VALUE! | AD53: =IF(RC[21]=42,"*",IF(RC[21]=32,"",RC[21])) ->  | AE53: =RC[-28] ->  | AF53: =RC[-28] ->  | AG53: =RC[-28] ->  | AH53: =RC[-28] ->  | AI53: =RC[-28] ->  | AJ53: =RC[-28] ->  | AK53: =RC[-28] ->  | AL53: =RC[-28] -> 0 | AM53: =RC[-28] ->  | AN53: =RC[-28] ->  | AO53: =RC[-28] ->  | AP53: - | AQ53: =RC[-29] -> 0 | AR53: =RC[-29] -> 0 | AS53: - | AT53: =RC[-30] -> 0 | AU53: =RC[-30] -> 0 | AV53: =RC[-30] ->  | AW53: =RC[-30] -> 
A54: =IF(RC[1]="","",DATEVALUE(RC[1])) ->  | T54: =(RC[-16]*RC[-15]-RC[-13]*RC[-12])/1000 -> #VALUE! | W54: =RC[-2]*RC[-10]/1000 -> #VALUE! | X54: =ABS((RC[-3]*RC[-11]-RC[-2]*RC[-9])/1000) -> #VALUE! | Y54: =(RC[-14]-RC[1])/RC[-18]*100 -> #VALUE! | AC54: =VALUE(RC[-27]) -> #VALUE! | AD54: =IF(RC[21]=42,"*",IF(RC[21]=32,"",RC[21])) ->  | AE54: =RC[-28] ->  | AF54: =RC[-28] ->  | AG54: =RC[-28] ->  | AH54: =RC[-28] ->  | AI54: =RC[-28] ->  | AJ54: =RC[-28] ->  | AK54: =RC[-28] ->  | AL54: =RC[-28] -> 0 | AM54: =RC[-28] ->  | AN54: =RC[-28] ->  | AO54: =RC[-28] ->  | AP54: - | AQ54: =RC[-29] -> 0 | AR54: =RC[-29] -> 0 | AS54: - | AT54: =RC[-30] -> 0 | AU54: =RC[-30] -> 0 | AV54: =RC[-30] ->  | AW54: =RC[-30] -> 
A55: =IF(RC[1]="","",DATEVALUE(RC[1])) ->  | T55: =(RC[-16]*RC[-15]-RC[-13]*RC[-12])/1000 -> #VALUE! | W55: =RC[-2]*RC[-10]/1000 -> #VALUE! | X55: =ABS((RC[-3]*RC[-11]-RC[-2]*RC[-9])/1000) -> #VALUE! | Y55: =(RC[-14]-RC[1])/RC[-18]*100 -> #VALUE! | AC55: =VALUE(RC[-27]) -> #VALUE! | AD55: =IF(RC[21]=42,"*",IF(RC[21]=32,"",RC[21])) ->  | AE55: =RC[-28] ->  | AF55: =RC[-28] ->  | AG55: =RC[-28] ->  | AH55: =RC[-28] ->  | AI55: =RC[-28] ->  | AJ55: =RC[-28] ->  | AK55: =RC[-28] ->  | AL55: =RC[-28] -> 0 | AM55: =RC[-28] ->  | AN55: =RC[-28] ->  | AO55: =RC[-28] ->  | AP55: - | AQ55: =RC[-29] -> 0 | AR55: =RC[-29] -> 0 | AS55: - | AT55: =RC[-30] -> 0 | AU55: =RC[-30] -> 0 | AV55: =RC[-30] ->  | AW55: =RC[-30] -> 
A56: =IF(RC[1]="","",DATEVALUE(RC[1])) ->  | T56: =(RC[-16]*RC[-15]-RC[-13]*RC[-12])/1000 -> #VALUE! | W56: =RC[-2]*RC[-10]/1000 -> #VALUE! | X56: =ABS((RC[-3]*RC[-11]-RC[-2]*RC[-9])/1000) -> #VALUE! | Y56: =(RC[-14]-RC[1])/RC[-18]*100 -> #VALUE! | AC56: =VALUE(RC[-27]) -> #VALUE! | AD56: =IF(RC[21]=42,"*",IF(RC[21]=32,"",RC[21])) ->  | AE56: =RC[-28] ->  | AF56: =RC[-28] ->  | AG56: =RC[-28] ->  | AH56: =RC[-28] ->  | AI56: =RC[-28] ->  | AJ56: =RC[-28] ->  | AK56: =RC[-28] ->  | AL56: =RC[-28] -> 0 | AM56: =RC[-28] ->  | AN56: =RC[-28] ->  | AO56: =RC[-28] ->  | AP56: - | AQ56: =RC[-29] -> 0 | AR56: =RC[-29] -> 0 | AS56: - | AT56: =RC[-30] -> 0 | AU56: =RC[-30] -> 0 | AV56: =RC[-30] ->  | AW56: =RC[-30] -> 
A57: =IF(RC[1]="","",DATEVALUE(RC[1])) ->  | T57: =(RC[-16]*RC[-15]-RC[-13]*RC[-12])/1000 -> #VALUE! | W57: =RC[-2]*RC[-10]/1000 -> #VALUE! | X57: =ABS((RC[-3]*RC[-11]-RC[-2]*RC[-9])/1000) -> #VALUE! | Y57: =(RC[-14]-RC[1])/RC[-18]*100 -> #VALUE! | AC57: =VALUE(RC[-27]) -> #VALUE! | AD57: =IF(RC[21]=42,"*",IF(RC[21]=32,"",RC[21])) ->  | AE57: =RC[-28] ->  | AF57: =RC[-28] ->  | AG57: =RC[-28] ->  | AH57: =RC[-28] ->  | AI57: =RC[-28] ->  | AJ57: =RC[-28] ->  | AK57: =RC[-28] ->  | AL57: =RC[-28] -> 0 | AM57: =RC[-28] ->  | AN57: =RC[-28] ->  | AO57: =RC[-28] ->  | AP57: - | AQ57: =RC[-29] -> 0 | AR57: =RC[-29] -> 0 | AS57: - | AT57: =RC[-30] -> 0 | AU57: =RC[-30] -> 0 | AV57: =RC[-30] ->  | AW57: =RC[-30] -> 
A58: =IF(RC[1]="","",DATEVALUE(RC[1])) ->  | T58: =(RC[-16]*RC[-15]-RC[-13]*RC[-12])/1000 -> #VALUE! | W58: =RC[-2]*RC[-10]/1000 -> #VALUE! | X58: =ABS((RC[-3]*RC[-11]-RC[-2]*RC[-9])/1000) -> #VALUE! | Y58: =(RC[-14]-RC[1])/RC[-18]*100 -> #VALUE! | AC58: =VALUE(RC[-27]) -> #VALUE! | AD58: =IF(RC[21]=42,"*",IF(RC[21]=32,"",RC[21])) ->  | AE58: =RC[-28] ->  | AF58: =RC[-28] ->  | AG58: =RC[-28] ->  | AH58: =RC[-28] ->  | AI58: =RC[-28] ->  | AJ58: =RC[-28] ->  | AK58: =RC[-28] ->  | AL58: =RC[-28] -> 0 | AM58: =RC[-28] ->  | AN58: =RC[-28] ->  | AO58: =RC[-28] ->  | AP58: - | AQ58: =RC[-29] -> 0 | AR58: =RC[-29] -> 0 | AS58: - | AT58: =RC[-30] -> 0 | AU58: =RC[-30] -> 0 | AV58: =RC[-30] ->  | AW58: =RC[-30] -> 
A59: =IF(RC[1]="","",DATEVALUE(RC[1])) ->  | T59: =(RC[-16]*RC[-15]-RC[-13]*RC[-12])/1000 -> #VALUE! | W59: =RC[-2]*RC[-10]/1000 -> #VALUE! | X59: =ABS((RC[-3]*RC[-11]-RC[-2]*RC[-9])/1000) -> #VALUE! | Y59: =(RC[-14]-RC[1])/RC[-18]*100 -> #VALUE! | AC59: =VALUE(RC[-27]) -> #VALUE! | AD59: =IF(RC[21]=42,"*",IF(RC[21]=32,"",RC[21])) ->  | AE59: =RC[-28] ->  | AF59: =RC[-28] ->  | AG59: =RC[-28] ->  | AH59: =RC[-28] ->  | AI59: =RC[-28] ->  | AJ59: =RC[-28] ->  | AK59: =RC[-28] ->  | AL59: =RC[-28] -> 0 | AM59: =RC[-28] ->  | AN59: =RC[-28] ->  | AO59: =RC[-28] ->  | AP59: - | AQ59: =RC[-29] -> 0 | AR59: =RC[-29] -> 0 | AS59: - | AT59: =RC[-30] -> 0 | AU59: =RC[-30] -> 0 | AV59: =RC[-30] ->  | AW59: =RC[-30] -> 
A60: =IF(RC[1]="","",DATEVALUE(RC[1])) ->  | T60: =(RC[-16]*RC[-15]-RC[-13]*RC[-12])/1000 -> #VALUE! | W60: =RC[-2]*RC[-10]/1000 -> #VALUE! | X60: =ABS((RC[-3]*RC[-11]-RC[-2]*RC[-9])/1000) -> #VALUE! | Y60: =(RC[-14]-RC[1])/RC[-18]*100 -> #VALUE! | AC60: =VALUE(RC[-27]) -> #VALUE! | AD60: =IF(RC[21]=42,"*",IF(RC[21]=32,"",RC[21])) ->  | AE60: =RC[-28] ->  | AF60: =RC[-28] ->  | AG60: =RC[-28] ->  | AH60: =RC[-28] ->  | AI60: =RC[-28] ->  | AJ60: =RC[-28] ->  | AK60: =RC[-28] ->  | AL60: =RC[-28] -> 0 | AM60: =RC[-28] ->  | AN60: =RC[-28] ->  | AO60: =RC[-28] ->  | AP60: - | AQ60: =RC[-29] -> 0 | AR60: =RC[-29] -> 0 | AS60: - | AT60: =RC[-30] -> 0 | AU60: =RC[-30] -> 0 | AV60: =RC[-30] ->  | AW60: =RC[-30] -> 
A61: =IF(RC[1]="","",DATEVALUE(RC[1])) ->  | T61: =(RC[-16]*RC[-15]-RC[-13]*RC[-12])/1000 -> #VALUE! | W61: =RC[-2]*RC[-10]/1000 -> #VALUE! | X61: =ABS((RC[-3]*RC[-11]-RC[-2]*RC[-9])/1000) -> #VALUE! | Y61: =(RC[-14]-RC[1])/RC[-18]*100 -> #VALUE! | AC61: =VALUE(RC[-27]) -> #VALUE! | AD61: =IF(RC[21]=42,"*",IF(RC[21]=32,"",RC[21])) ->  | AE61: =RC[-28] ->  | AF61: =RC[-28] ->  | AG61: =RC[-28] ->  | AH61: =RC[-28] ->  | AI61: =RC[-28] ->  | AJ61: =RC[-28] ->  | AK61: =RC[-28] ->  | AL61: =RC[-28] -> 0 | AM61: =RC[-28] ->  | AN61: =RC[-28] ->  | AO61: =RC[-28] ->  | AP61: - | AQ61: =RC[-29] -> 0 | AR61: =RC[-29] -> 0 | AS61: - | AT61: =RC[-30] -> 0 | AU61: =RC[-30] -> 0 | AV61: =RC[-30] ->  | AW61: =RC[-30] -> 
A62: =IF(RC[1]="","",DATEVALUE(RC[1])) ->  | T62: =(RC[-16]*RC[-15]-RC[-13]*RC[-12])/1000 -> #VALUE! | W62: =RC[-2]*RC[-10]/1000 -> #VALUE! | X62: =ABS((RC[-3]*RC[-11]-RC[-2]*RC[-9])/1000) -> #VALUE! | Y62: =(RC[-14]-RC[1])/RC[-18]*100 -> #VALUE! | AC62: =VALUE(RC[-27]) -> #VALUE! | AD62: =IF(RC[21]=42,"*",IF(RC[21]=32,"",RC[21])) ->  | AE62: =RC[-28] ->  | AF62: =RC[-28] ->  | AG62: =RC[-28] ->  | AH62: =RC[-28] ->  | AI62: =RC[-28] ->  | AJ62: =RC[-28] ->  | AK62: =RC[-28] ->  | AL62: =RC[-28] -> 0 | AM62: =RC[-28] ->  | AN62: =RC[-28] ->  | AO62: =RC[-28] ->  | AP62: - | AQ62: =RC[-29] -> 0 | AR62: =RC[-29] -> 0 | AS62: - | AT62: =RC[-30] -> 0 | AU62: =RC[-30] -> 0 | AV62: =RC[-30] ->  | AW62: =RC[-30] -> 
A63: =IF(RC[1]="","",DATEVALUE(RC[1])) ->  | T63: =(RC[-16]*RC[-15]-RC[-13]*RC[-12])/1000 -> #VALUE! | W63: =RC[-2]*RC[-10]/1000 -> #VALUE! | X63: =ABS((RC[-3]*RC[-11]-RC[-2]*RC[-9])/1000) -> #VALUE! | Y63: =(RC[-14]-RC[1])/RC[-18]*100 -> #VALUE! | AC63: =VALUE(RC[-27]) -> #VALUE! | AD63: =IF(RC[21]=42,"*",IF(RC[21]=32,"",RC[21])) ->  | AE63: =RC[-28] ->  | AF63: =RC[-28] ->  | AG63: =RC[-28] ->  | AH63: =RC[-28] ->  | AI63: =RC[-28] ->  | AJ63: =RC[-28] ->  | AK63: =RC[-28] ->  | AL63: =RC[-28] -> 0 | AM63: =RC[-28] ->  | AN63: =RC[-28] ->  | AO63: =RC[-28] ->  | AP63: - | AQ63: =RC[-29] -> 0 | AR63: =RC[-29] -> 0 | AS63: - | AT63: =RC[-30] -> 0 | AU63: =RC[-30] -> 0 | AV63: =RC[-30] ->  | AW63: =RC[-30] -> 
A64: =IF(RC[1]="","",DATEVALUE(RC[1])) ->  | T64: =(RC[-16]*RC[-15]-RC[-13]*RC[-12])/1000 -> #VALUE! | W64: =RC[-2]*RC[-10]/1000 -> #VALUE! | X64: =ABS((RC[-3]*RC[-11]-RC[-2]*RC[-9])/1000) -> #VALUE! | Y64: =(RC[-14]-RC[1])/RC[-18]*100 -> #VALUE! | AC64: =VALUE(RC[-27]) -> #VALUE! | AD64: =IF(RC[21]=42,"*",IF(RC[21]=32,"",RC[21])) ->  | AE64: =RC[-28] ->  | AF64: =RC[-28] ->  | AG64: =RC[-28] ->  | AH64: =RC[-28] ->  | AI64: =RC[-28] ->  | AJ64: =RC[-28] ->  | AK64: =RC[-28] ->  | AL64: =RC[-28] -> 0 | AM64: =RC[-28] ->  | AN64: =RC[-28] ->  | AO64: =RC[-28] ->  | AP64: - | AQ64: =RC[-29] -> 0 | AR64: =RC[-29] -> 0 | AS64: - | AT64: =RC[-30] -> 0 | AU64: =RC[-30] -> 0 | AV64: =RC[-30] ->  | AW64: =RC[-30] -> 
A65: =IF(RC[1]="","",DATEVALUE(RC[1])) ->  | T65: =(RC[-16]*RC[-15]-RC[-13]*RC[-12])/1000 -> #VALUE! | W65: =RC[-2]*RC[-10]/1000 -> #VALUE! | X65: =ABS((RC[-3]*RC[-11]-RC[-2]*RC[-9])/1000) -> #VALUE! | Y65: =(RC[-14]-RC[1])/RC[-18]*100 -> #VALUE! | AC65: =VALUE(RC[-27]) -> #VALUE! | AD65: =IF(RC[21]=42,"*",IF(RC[21]=32,"",RC[21])) ->  | AE65: =RC[-28] ->  | AF65: =RC[-28] ->  | AG65: =RC[-28] ->  | AH65: =RC[-28] ->  | AI65: =RC[-28] ->  | AJ65: =RC[-28] ->  | AK65: =RC[-28] ->  | AL65: =RC[-28] -> 0 | AM65: =RC[-28] ->  | AN65: =RC[-28] ->  | AO65: =RC[-28] ->  | AP65: - | AQ65: =RC[-29] -> 0 | AR65: =RC[-29] -> 0 | AS65: - | AT65: =RC[-30] -> 0 | AU65: =RC[-30] -> 0 | AV65: =RC[-30] ->  | AW65: =RC[-30] -> 
A66: =IF(RC[1]="","",DATEVALUE(RC[1])) ->  | T66: =(RC[-16]*RC[-15]-RC[-13]*RC[-12])/1000 -> #VALUE! | W66: =RC[-2]*RC[-10]/1000 -> #VALUE! | X66: =ABS((RC[-3]*RC[-11]-RC[-2]*RC[-9])/1000) -> #VALUE! | Y66: =(RC[-14]-RC[1])/RC[-18]*100 -> #VALUE! | AC66: =VALUE(RC[-27]) -> #VALUE! | AD66: =IF(RC[21]=42,"*",IF(RC[21]=32,"",RC[21])) ->  | AE66: =RC[-28] ->  | AF66: =RC[-28] ->  | AG66: =RC[-28] ->  | AH66: =RC[-28] ->  | AI66: =RC[-28] ->  | AJ66: =RC[-28] ->  | AK66: =RC[-28] ->  | AL66: =RC[-28] -> 0 | AM66: =RC[-28] ->  | AN66: =RC[-28] ->  | AO66: =RC[-28] ->  | AP66: - | AQ66: =RC[-29] -> 0 | AR66: =RC[-29] -> 0 | AS66: - | AT66: =RC[-30] -> 0 | AU66: =RC[-30] -> 0 | AV66: =RC[-30] ->  | AW66: =RC[-30] -> 
A67: =IF(RC[1]="","",DATEVALUE(RC[1])) ->  | T67: =(RC[-16]*RC[-15]-RC[-13]*RC[-12])/1000 -> #VALUE! | W67: =RC[-2]*RC[-10]/1000 -> #VALUE! | X67: =ABS((RC[-3]*RC[-11]-RC[-2]*RC[-9])/1000) -> #VALUE! | Y67: =(RC[-14]-RC[1])/RC[-18]*100 -> #VALUE! | AC67: =VALUE(RC[-27]) -> #VALUE! | AD67: =IF(RC[21]=42,"*",IF(RC[21]=32,"",RC[21])) ->  | AE67: =RC[-28] ->  | AF67: =RC[-28] ->  | AG67: =RC[-28] ->  | AH67: =RC[-28] ->  | AI67: =RC[-28] ->  | AJ67: =RC[-28] ->  | AK67: =RC[-28] ->  | AL67: =RC[-28] -> 0 | AM67: =RC[-28] ->  | AN67: =RC[-28] ->  | AO67: =RC[-28] ->  | AP67: - | AQ67: =RC[-29] -> 0 | AR67: =RC[-29] -> 0 | AS67: - | AT67: =RC[-30] -> 0 | AU67: =RC[-30] -> 0 | AV67: =RC[-30] ->  | AW67: =RC[-30] -> 
A68: =IF(RC[1]="","",DATEVALUE(RC[1])) ->  | T68: =(RC[-16]*RC[-15]-RC[-13]*RC[-12])/1000 -> #VALUE! | W68: =RC[-2]*RC[-10]/1000 -> #VALUE! | X68: =ABS((RC[-3]*RC[-11]-RC[-2]*RC[-9])/1000) -> #VALUE! | Y68: =(RC[-14]-RC[1])/RC[-18]*100 -> #VALUE! | AC68: =VALUE(RC[-27]) -> #VALUE! | AD68: =IF(RC[21]=42,"*",IF(RC[21]=32,"",RC[21])) ->  | AE68: =RC[-28] ->  | AF68: =RC[-28] ->  | AG68: =RC[-28] ->  | AH68: =RC[-28] ->  | AI68: =RC[-28] ->  | AJ68: =RC[-28] ->  | AK68: =RC[-28] ->  | AL68: =RC[-28] -> 0 | AM68: =RC[-28] ->  | AN68: =RC[-28] ->  | AO68: =RC[-28] ->  | AP68: - | AQ68: =RC[-29] -> 0 | AR68: =RC[-29] -> 0 | AS68: - | AT68: =RC[-30] -> 0 | AU68: =RC[-30] -> 0 | AV68: =RC[-30] ->  | AW68: =RC[-30] -> 
A69: =IF(RC[1]="","",DATEVALUE(RC[1])) ->  | T69: =(RC[-16]*RC[-15]-RC[-13]*RC[-12])/1000 -> #VALUE! | W69: =RC[-2]*RC[-10]/1000 -> #VALUE! | X69: =ABS((RC[-3]*RC[-11]-RC[-2]*RC[-9])/1000) -> #VALUE! | Y69: =(RC[-14]-RC[1])/RC[-18]*100 -> #VALUE! | AC69: =VALUE(RC[-27]) -> #VALUE! | AD69: =IF(RC[21]=42,"*",IF(RC[21]=32,"",RC[21])) ->  | AE69: =RC[-28] ->  | AF69: =RC[-28] ->  | AG69: =RC[-28] ->  | AH69: =RC[-28] ->  | AI69: =RC[-28] ->  | AJ69: =RC[-28] ->  | AK69: =RC[-28] ->  | AL69: =RC[-28] -> 0 | AM69: =RC[-28] ->  | AN69: =RC[-28] ->  | AO69: =RC[-28] ->  | AP69: - | AQ69: =RC[-29] -> 0 | AR69: =RC[-29] -> 0 | AS69: - | AT69: =RC[-30] -> 0 | AU69: =RC[-30] -> 0 | AV69: =RC[-30] ->  | AW69: =RC[-30] -> 
A70: =IF(RC[1]="","",DATEVALUE(RC[1])) ->  | T70: =(RC[-16]*RC[-15]-RC[-13]*RC[-12])/1000 -> #VALUE! | W70: =RC[-2]*RC[-10]/1000 -> #VALUE! | X70: =ABS((RC[-3]*RC[-11]-RC[-2]*RC[-9])/1000) -> #VALUE! | Y70: =(RC[-14]-RC[1])/RC[-18]*100 -> #VALUE! | AC70: =VALUE(RC[-27]) -> #VALUE! | AD70: =IF(RC[21]=42,"*",IF(RC[21]=32,"",RC[21])) ->  | AE70: =RC[-28] ->  | AF70: =RC[-28] ->  | AG70: =RC[-28] ->  | AH70: =RC[-28] ->  | AI70: =RC[-28] ->  | AJ70: =RC[-28] ->  | AK70: =RC[-28] ->  | AL70: =RC[-28] -> 0 | AM70: =RC[-28] ->  | AN70: =RC[-28] ->  | AO70: =RC[-28] ->  | AP70: - | AQ70: =RC[-29] -> 0 | AR70: =RC[-29] -> 0 | AS70: - | AT70: =RC[-30] -> 0 | AU70: =RC[-30] -> 0 | AV70: =RC[-30] ->  | AW70: =RC[-30] -> 
A71: =IF(RC[1]="","",DATEVALUE(RC[1])) ->  | T71: =(RC[-16]*RC[-15]-RC[-13]*RC[-12])/1000 -> #VALUE! | W71: =RC[-2]*RC[-10]/1000 -> #VALUE! | X71: =ABS((RC[-3]*RC[-11]-RC[-2]*RC[-9])/1000) -> #VALUE! | Y71: =(RC[-14]-RC[1])/RC[-18]*100 -> #VALUE! | AC71: =VALUE(RC[-27]) -> #VALUE! | AD71: =IF(RC[21]=42,"*",IF(RC[21]=32,"",RC[21])) ->  | AE71: =RC[-28] ->  | AF71: =RC[-28] ->  | AG71: =RC[-28] ->  | AH71: =RC[-28] ->  | AI71: =RC[-28] ->  | AJ71: =RC[-28] ->  | AK71: =RC[-28] ->  | AL71: =RC[-28] -> 0 | AM71: =RC[-28] ->  | AN71: =RC[-28] ->  | AO71: =RC[-28] ->  | AP71: - | AQ71: =RC[-29] -> 0 | AR71: =RC[-29] -> 0 | AS71: - | AT71: =RC[-30] -> 0 | AU71: =RC[-30] -> 0 | AV71: =RC[-30] ->  | AW71: =RC[-30] -> 
A72: =IF(RC[1]="","",DATEVALUE(RC[1])) ->  | T72: =(RC[-16]*RC[-15]-RC[-13]*RC[-12])/1000 -> #VALUE! | W72: =RC[-2]*RC[-10]/1000 -> #VALUE! | X72: =ABS((RC[-3]*RC[-11]-RC[-2]*RC[-9])/1000) -> #VALUE! | Y72: =(RC[-14]-RC[1])/RC[-18]*100 -> #VALUE! | AC72: =VALUE(RC[-27]) -> #VALUE! | AD72: =IF(RC[21]=42,"*",IF(RC[21]=32,"",RC[21])) ->  | AE72: =RC[-28] ->  | AF72: =RC[-28] ->  | AG72: =RC[-28] ->  | AH72: =RC[-28] ->  | AI72: =RC[-28] ->  | AJ72: =RC[-28] ->  | AK72: =RC[-28] ->  | AL72: =RC[-28] -> 0 | AM72: =RC[-28] ->  | AN72: =RC[-28] ->  | AO72: =RC[-28] ->  | AP72: - | AQ72: =RC[-29] -> 0 | AR72: =RC[-29] -> 0 | AS72: - | AT72: =RC[-30] -> 0 | AU72: =RC[-30] -> 0 | AV72: =RC[-30] ->  | AW72: =RC[-30] -> 
A73: =IF(RC[1]="","",DATEVALUE(RC[1])) ->  | T73: =(RC[-16]*RC[-15]-RC[-13]*RC[-12])/1000 -> #VALUE! | W73: =RC[-2]*RC[-10]/1000 -> #VALUE! | X73: =ABS((RC[-3]*RC[-11]-RC[-2]*RC[-9])/1000) -> #VALUE! | Y73: =(RC[-14]-RC[1])/RC[-18]*100 -> #VALUE! | AC73: =VALUE(RC[-27]) -> #VALUE! | AD73: =IF(RC[21]=42,"*",IF(RC[21]=32,"",RC[21])) ->  | AE73: =RC[-28] ->  | AF73: =RC[-28] ->  | AG73: =RC[-28] ->  | AH73: =RC[-28] ->  | AI73: =RC[-28] ->  | AJ73: =RC[-28] ->  | AK73: =RC[-28] ->  | AL73: =RC[-28] -> 0 | AM73: =RC[-28] ->  | AN73: =RC[-28] ->  | AO73: =RC[-28] ->  | AP73: - | AQ73: =RC[-29] -> 0 | AR73: =RC[-29] -> 0 | AS73: - | AT73: =RC[-30] -> 0 | AU73: =RC[-30] -> 0 | AV73: =RC[-30] ->  | AW73: =RC[-30] -> 
A74: =IF(RC[1]="","",DATEVALUE(RC[1])) ->  | T74: =(RC[-16]*RC[-15]-RC[-13]*RC[-12])/1000 -> #VALUE! | W74: =RC[-2]*RC[-10]/1000 -> #VALUE! | X74: =ABS((RC[-3]*RC[-11]-RC[-2]*RC[-9])/1000) -> #VALUE! | Y74: =(RC[-14]-RC[1])/RC[-18]*100 -> #VALUE! | AC74: =VALUE(RC[-27]) -> #VALUE! | AD74: =IF(RC[21]=42,"*",IF(RC[21]=32,"",RC[21])) ->  | AE74: =RC[-28] ->  | AF74: =RC[-28] ->  | AG74: =RC[-28] ->  | AH74: =RC[-28] ->  | AI74: =RC[-28] ->  | AJ74: =RC[-28] ->  | AK74: =RC[-28] ->  | AL74: =RC[-28] -> 0 | AM74: =RC[-28] ->  | AN74: =RC[-28] ->  | AO74: =RC[-28] ->  | AP74: - | AQ74: =RC[-29] -> 0 | AR74: =RC[-29] -> 0 | AS74: - | AT74: =RC[-30] -> 0 | AU74: =RC[-30] -> 0 | AV74: =RC[-30] ->  | AW74: =RC[-30] -> 
A75: =IF(RC[1]="","",DATEVALUE(RC[1])) ->  | T75: =(RC[-16]*RC[-15]-RC[-13]*RC[-12])/1000 -> #VALUE! | W75: =RC[-2]*RC[-10]/1000 -> #VALUE! | X75: =ABS((RC[-3]*RC[-11]-RC[-2]*RC[-9])/1000) -> #VALUE! | Y75: =(RC[-14]-RC[1])/RC[-18]*100 -> #VALUE! | AC75: =VALUE(RC[-27]) -> #VALUE! | AD75: =IF(RC[21]=42,"*",IF(RC[21]=32,"",RC[21])) ->  | AE75: =RC[-28] ->  | AF75: =RC[-28] ->  | AG75: =RC[-28] ->  | AH75: =RC[-28] ->  | AI75: =RC[-28] ->  | AJ75: =RC[-28] ->  | AK75: =RC[-28] ->  | AL75: =RC[-28] -> 0 | AM75: =RC[-28] ->  | AN75: =RC[-28] ->  | AO75: =RC[-28] ->  | AP75: - | AQ75: =RC[-29] -> 0 | AR75: =RC[-29] -> 0 | AS75: - | AT75: =RC[-30] -> 0 | AU75: =RC[-30] -> 0 | AV75: =RC[-30] ->  | AW75: =RC[-30] -> 
A76: =IF(RC[1]="","",DATEVALUE(RC[1])) ->  | T76: =(RC[-16]*RC[-15]-RC[-13]*RC[-12])/1000 -> #VALUE! | W76: =RC[-2]*RC[-10]/1000 -> #VALUE! | X76: =ABS((RC[-3]*RC[-11]-RC[-2]*RC[-9])/1000) -> #VALUE! | Y76: =(RC[-14]-RC[1])/RC[-18]*100 -> #VALUE! | AC76: =VALUE(RC[-27]) -> #VALUE! | AD76: =IF(RC[21]=42,"*",IF(RC[21]=32,"",RC[21])) ->  | AE76: =RC[-28] ->  | AF76: =RC[-28] ->  | AG76: =RC[-28] ->  | AH76: =RC[-28] ->  | AI76: =RC[-28] ->  | AJ76: =RC[-28] ->  | AK76: =RC[-28] ->  | AL76: =RC[-28] -> 0 | AM76: =RC[-28] ->  | AN76: =RC[-28] ->  | AO76: =RC[-28] ->  | AP76: - | AQ76: =RC[-29] -> 0 | AR76: =RC[-29] -> 0 | AS76: - | AT76: =RC[-30] -> 0 | AU76: =RC[-30] -> 0 | AV76: =RC[-30] ->  | AW76: =RC[-30] -> 
A77: =IF(RC[1]="","",DATEVALUE(RC[1])) ->  | T77: =(RC[-16]*RC[-15]-RC[-13]*RC[-12])/1000 -> #VALUE! | W77: =RC[-2]*RC[-10]/1000 -> #VALUE! | X77: =ABS((RC[-3]*RC[-11]-RC[-2]*RC[-9])/1000) -> #VALUE! | Y77: =(RC[-14]-RC[1])/RC[-18]*100 -> #VALUE! | AC77: =VALUE(RC[-27]) -> #VALUE! | AD77: =IF(RC[21]=42,"*",IF(RC[21]=32,"",RC[21])) ->  | AE77: =RC[-28] ->  | AF77: =RC[-28] ->  | AG77: =RC[-28] ->  | AH77: =RC[-28] ->  | AI77: =RC[-28] ->  | AJ77: =RC[-28] ->  | AK77: =RC[-28] ->  | AL77: =RC[-28] -> 0 | AM77: =RC[-28] ->  | AN77: =RC[-28] ->  | AO77: =RC[-28] ->  | AP77: - | AQ77: =RC[-29] -> 0 | AR77: =RC[-29] -> 0 | AS77: - | AT77: =RC[-30] -> 0 | AU77: =RC[-30] -> 0 | AV77: =RC[-30] ->  | AW77: =RC[-30] -> 
A78: =IF(RC[1]="","",DATEVALUE(RC[1])) ->  | T78: =(RC[-16]*RC[-15]-RC[-13]*RC[-12])/1000 -> #VALUE! | W78: =RC[-2]*RC[-10]/1000 -> #VALUE! | X78: =ABS((RC[-3]*RC[-11]-RC[-2]*RC[-9])/1000) -> #VALUE! | Y78: =(RC[-14]-RC[1])/RC[-18]*100 -> #VALUE! | AC78: =VALUE(RC[-27]) -> #VALUE! | AD78: =IF(RC[21]=42,"*",IF(RC[21]=32,"",RC[21])) ->  | AE78: =RC[-28] ->  | AF78: =RC[-28] ->  | AG78: =RC[-28] ->  | AH78: =RC[-28] ->  | AI78: =RC[-28] ->  | AJ78: =RC[-28] ->  | AK78: =RC[-28] ->  | AL78: =RC[-28] -> 0 | AM78: =RC[-28] ->  | AN78: =RC[-28] ->  | AO78: =RC[-28] ->  | AP78: - | AQ78: =RC[-29] -> 0 | AR78: =RC[-29] -> 0 | AS78: - | AT78: =RC[-30] -> 0 | AU78: =RC[-30] -> 0 | AV78: =RC[-30] ->  | AW78: =RC[-30] -> 
A79: =IF(RC[1]="","",DATEVALUE(RC[1])) ->  | T79: =(RC[-16]*RC[-15]-RC[-13]*RC[-12])/1000 -> #VALUE! | W79: =RC[-2]*RC[-10]/1000 -> #VALUE! | X79: =ABS((RC[-3]*RC[-11]-RC[-2]*RC[-9])/1000) -> #VALUE! | Y79: =(RC[-14]-RC[1])/RC[-18]*100 -> #VALUE! | AC79: =VALUE(RC[-27]) -> #VALUE! | AD79: =IF(RC[21]=42,"*",IF(RC[21]=32,"",RC[21])) ->  | AE79: =RC[-28] ->  | AF79: =RC[-28] ->  | AG79: =RC[-28] ->  | AH79: =RC[-28] ->  | AI79: =RC[-28] ->  | AJ79: =RC[-28] ->  | AK79: =RC[-28] ->  | AL79: =RC[-28] -> 0 | AM79: =RC[-28] ->  | AN79: =RC[-28] ->  | AO79: =RC[-28] ->  | AP79: - | AQ79: =RC[-29] -> 0 | AR79: =RC[-29] -> 0 | AS79: - | AT79: =RC[-30] -> 0 | AU79: =RC[-30] -> 0 | AV79: =RC[-30] ->  | AW79: =RC[-30] -> 
A80: =IF(RC[1]="","",DATEVALUE(RC[1])) ->  | T80: =(RC[-16]*RC[-15]-RC[-13]*RC[-12])/1000 -> #VALUE! | W80: =RC[-2]*RC[-10]/1000 -> #VALUE! | X80: =ABS((RC[-3]*RC[-11]-RC[-2]*RC[-9])/1000) -> #VALUE! | Y80: =(RC[-14]-RC[1])/RC[-18]*100 -> #VALUE! | AC80: =VALUE(RC[-27]) -> #VALUE! | AD80: =IF(RC[21]=42,"*",IF(RC[21]=32,"",RC[21])) ->  | AE80: =RC[-28] ->  | AF80: =RC[-28] ->  | AG80: =RC[-28] ->  | AH80: =RC[-28] ->  | AI80: =RC[-28] ->  | AJ80: =RC[-28] ->  | AK80: =RC[-28] ->  | AL80: =RC[-28] -> 0 | AM80: =RC[-28] ->  | AN80: =RC[-28] ->  | AO80: =RC[-28] ->  | AP80: - | AQ80: =RC[-29] -> 0 | AR80: =RC[-29] -> 0 | AS80: - | AT80: =RC[-30] -> 0 | AU80: =RC[-30] -> 0 | AV80: =RC[-30] ->  | AW80: =RC[-30] -> 
A81: =IF(RC[1]="","",DATEVALUE(RC[1])) ->  | T81: =(RC[-16]*RC[-15]-RC[-13]*RC[-12])/1000 -> #VALUE! | W81: =RC[-2]*RC[-10]/1000 -> #VALUE! | X81: =ABS((RC[-3]*RC[-11]-RC[-2]*RC[-9])/1000) -> #VALUE! | Y81: =(RC[-14]-RC[1])/RC[-18]*100 -> #VALUE! | AC81: =VALUE(RC[-27]) -> #VALUE! | AD81: =IF(RC[21]=42,"*",IF(RC[21]=32,"",RC[21])) ->  | AE81: =RC[-28] ->  | AF81: =RC[-28] ->  | AG81: =RC[-28] ->  | AH81: =RC[-28] ->  | AI81: =RC[-28] ->  | AJ81: =RC[-28] ->  | AK81: =RC[-28] ->  | AL81: =RC[-28] -> 0 | AM81: =RC[-28] ->  | AN81: =RC[-28] ->  | AO81: =RC[-28] ->  | AP81: - | AQ81: =RC[-29] -> 0 | AR81: =RC[-29] -> 0 | AS81: - | AT81: =RC[-30] -> 0 | AU81: =RC[-30] -> 0 | AV81: =RC[-30] ->  | AW81: =RC[-30] -> 
A82: =IF(RC[1]="","",DATEVALUE(RC[1])) ->  | T82: =(RC[-16]*RC[-15]-RC[-13]*RC[-12])/1000 -> #VALUE! | W82: =RC[-2]*RC[-10]/1000 -> #VALUE! | X82: =ABS((RC[-3]*RC[-11]-RC[-2]*RC[-9])/1000) -> #VALUE! | Y82: =(RC[-14]-RC[1])/RC[-18]*100 -> #VALUE! | AC82: =VALUE(RC[-27]) -> #VALUE! | AD82: =IF(RC[21]=42,"*",IF(RC[21]=32,"",RC[21])) ->  | AE82: =RC[-28] ->  | AF82: =RC[-28] ->  | AG82: =RC[-28] ->  | AH82: =RC[-28] ->  | AI82: =RC[-28] ->  | AJ82: =RC[-28] ->  | AK82: =RC[-28] ->  | AL82: =RC[-28] -> 0 | AM82: =RC[-28] ->  | AN82: =RC[-28] ->  | AO82: =RC[-28] ->  | AP82: - | AQ82: =RC[-29] -> 0 | AR82: =RC[-29] -> 0 | AS82: - | AT82: =RC[-30] -> 0 | AU82: =RC[-30] -> 0 | AV82: =RC[-30] ->  | AW82: =RC[-30] -> 
A83: =IF(RC[1]="","",DATEVALUE(RC[1])) ->  | T83: =(RC[-16]*RC[-15]-RC[-13]*RC[-12])/1000 -> #VALUE! | W83: =RC[-2]*RC[-10]/1000 -> #VALUE! | X83: =ABS((RC[-3]*RC[-11]-RC[-2]*RC[-9])/1000) -> #VALUE! | Y83: =(RC[-14]-RC[1])/RC[-18]*100 -> #VALUE! | AC83: =VALUE(RC[-27]) -> #VALUE! | AD83: =IF(RC[21]=42,"*",IF(RC[21]=32,"",RC[21])) ->  | AE83: =RC[-28] ->  | AF83: =RC[-28] ->  | AG83: =RC[-28] ->  | AH83: =RC[-28] ->  | AI83: =RC[-28] ->  | AJ83: =RC[-28] ->  | AK83: =RC[-28] ->  | AL83: =RC[-28] -> 0 | AM83: =RC[-28] ->  | AN83: =RC[-28] ->  | AO83: =RC[-28] ->  | AP83: - | AQ83: =RC[-29] -> 0 | AR83: =RC[-29] -> 0 | AS83: - | AT83: =RC[-30] -> 0 | AU83: =RC[-30] -> 0 | AV83: =RC[-30] ->  | AW83: =RC[-30] -> 
AC84: Среднее | AF84: =R[1]C[-28] -> 153.32633333333334 | AG84: =R[1]C[-28] -> 68.933666666666653 | AH84: =R[1]C[-28] -> 6.2404444444444449 | AI84: =R[1]C[-28] -> 124.78422222222228 | AJ84: =R[1]C[-28] -> 41.771888888888867 | AK84: =R[1]C[-28] -> 5.5781111111111104 | AL84: =R[1]C[-28] -> 27.161777777777779 | AM84: =R[1]C[-28] -> 28.542111111111119 | AN84: =R[1]C[-28] -> 26.472333333333335 | AO84: =R[1]C[-28] -> 68.560333333333347 | AP84: - | AQ84: =R[1]C[-29] -> 0 | AR84: =R[1]C[-29] -> 0 | AS84: - | AT84: =R[1]C[-30] -> 0 | AU84: =R[1]C[-30] -> 0
B85: Среднее | D85: =AVERAGE(OFFSET(R[-74]C,3,0,R7C1,1)) -> 153.32633333333334 | E85: =AVERAGE(OFFSET(R[-74]C,3,0,R7C1,1)) -> 68.933666666666653 | F85: =AVERAGE(OFFSET(R[-74]C,3,0,R7C1,1)) -> 6.2404444444444449 | G85: =AVERAGE(OFFSET(R[-74]C,3,0,R7C1,1)) -> 124.78422222222228 | H85: =AVERAGE(OFFSET(R[-74]C,3,0,R7C1,1)) -> 41.771888888888867 | I85: =AVERAGE(OFFSET(R[-74]C,3,0,R7C1,1)) -> 5.5781111111111104 | J85: =AVERAGE(OFFSET(R[-74]C,3,0,R7C1,1)) -> 27.161777777777779 | K85: =AVERAGE(OFFSET(R[-74]C,3,0,R7C1,1)) -> 28.542111111111119 | L85: =IF(SUM(OFFSET(R[-74]C,3,0,R7C1,1))=0,"",AVERAGE(OFFSET(R[-74]C,3,0,R7C1,1))) -> 26.472333333333335 | M85: =IF(SUM(OFFSET(R[-74]C,3,0,R7C1,1))=0,"",AVERAGE(OFFSET(R[-74]C,3,0,R7C1,1))) -> 68.560333333333347 | R85: =IF(SUM(OFFSET(R[-74]C,3,0,R7C1,1))=0,"",AVERAGE(OFFSET(R[-74]C,3,0,R7C1,1))) -> 1.7778999999999996 | S85: =AVERAGE(OFFSET(R[-74]C,3,0,R7C1,1)) -> 4.8195253037037036 | T85: =AVERAGE(OFFSET(R[-74]C,3,0,R7C1,1)) -> 4.8420560803703703 | W85: =AVERAGE(OFFSET(R[-74]C,3,0,R7C1,1)) -> 1.7768896033333335 | X85: =AVERAGE(OFFSET(R[-74]C,3,0,R7C1,1)) -> #VALUE! | AC85: Итого | AE85: =R[1]C[-28] -> 720 | AF85: =R[1]C[-28] -> 4599.79 | AI85: =R[1]C[-28] -> 3743.5266666666685 | AM85: =R[1]C[-28] -> 856.26333333333355 | AN85: =R[1]C[-28] -> 794.17000000000007 | AQ85: =R[1]C[-29] -> 0 | AU85: =R[1]C[-30] -> 0 | AV85: =R[1]C[-30] -> 53.336999999999989 | AW85: =R[1]C[-30] -> 144.58575911111112
B86: ИТОГО: | C86: =SUM(OFFSET(R[-75]C,3,0,R7C1,1)) -> 720 | D86: =SUM(OFFSET(R[-75]C,3,0,R7C1,1)) -> 4599.79 | G86: =SUM(OFFSET(R[-75]C,3,0,R7C1,1)) -> 3743.5266666666685 | K86: =SUM(OFFSET(R[-75]C,3,0,R7C1,1)) -> 856.26333333333355 | L86: =IF(SUM(OFFSET(R[-75]C,3,0,R7C1,1))=0,"",SUM(OFFSET(R[-75]C,3,0,R7C1,1))) -> 794.17000000000007 | R86: =IF(SUM(OFFSET(R[-75]C,3,0,R7C1,1))=0,"",SUM(OFFSET(R[-75]C,3,0,R7C1,1))) -> 53.336999999999989 | S86: =SUM(OFFSET(R[-75]C,3,0,R7C1,1)) -> 144.58575911111112 | T86: =SUM(OFFSET(R[-75]C,3,0,R7C1,1)) -> 145.26168241111111 | W86: =SUM(OFFSET(R[-75]C,3,0,R7C1,1)) -> 53.306688100000002 | X86: =SUM(OFFSET(R[-75]C,3,0,R7C1,1)) -> #VALUE!
AC87: Досчёт | AF87: =R[1]C[-28] -> 0 | AI87: =R[1]C[-28] -> 0 | AM87: =R[1]C[-28] -> 0 | AN87: =R[1]C[-28] -> 0 | AQ87: =R[1]C[-29] -> 0 | AU87: =R[1]C[-30] -> 0 | AV87: =R[1]C[-30] -> 0 | AW87: =R[1]C[-30] -> 0
A88: 11дн=264ч 4дн=96ч | B88: Досчёт до конца м-ца (+) | C88: =R6C1*24 -> 216 | T88: № 187393 | AC88: Снятие | AF88: =-R[1]C[-28] -> 0 | AI88: =-R[1]C[-28] -> 0 | AM88: =-R[1]C[-28] -> 0 | AN88: =-R[1]C[-28] -> 0 | AQ88: =-R[1]C[-29] -> 0 | AU88: =-R[1]C[-30] -> 0 | AV88: =-R[1]C[-30] -> 0 | AW88: =-R[1]C[-30] -> 0
A89: 9дн=216ч 7дн=168ч | B89: Вычет с предыдущего (-) | C89: =R4C1*24 -> 192 | AC89: Сумма | AF89: =R[1]C[-28] -> 4599.79 | AI89: =R[1]C[-28] -> 3743.5266666666685 | AM89: =R[1]C[-28] -> 856.26333333333355 | AN89: =R[1]C[-28] -> 794.17000000000007 | AQ89: =R[1]C[-29] -> 0 | AU89: =R[1]C[-30] -> 0 | AV89: =R[1]C[-30] -> 53.336999999999989 | AW89: =R[1]C[-30] -> 144.58575911111112
B90: СУММА: | C90: =R[-4]C+R[-2]C-R[-1]C -> 744 | D90: =R[-4]C+R[-2]C-R[-1]C -> 4599.79 | G90: =R[-4]C+R[-2]C-R[-1]C -> 3743.5266666666685 | K90: =R[-4]C+R[-2]C-R[-1]C -> 856.26333333333355 | L90: =IF(SUM(OFFSET(R[-79]C,3,0,R7C1,1))=0,"",(R[-4]C+R[-2]C-R[-1]C)) -> 794.17000000000007 | R90: =IF(SUM(OFFSET(R[-79]C,3,0,R7C1,1))=0,"",(R[-4]C+R[-2]C-R[-1]C)) -> 53.336999999999989 | S90: =R[-4]C+R[-2]C-R[-1]C -> 144.58575911111112
AC91: Тхв на источнике | AE91: V гвс (м3) | AF91: =R[-2]C[15] -> 0 | AG91: W гвс (Гкал) | AH91: =RC[-2]*0.06 -> 0 | AI91: W без гвс (Гкал) | AJ91: =R[-2]C[13]-RC[-2] -> 144.58575911111112
B92: Показания счетчиков на момент снятия данных:
B93: Дата, время | D93: М1, т | F93: М2, т | H93: М3, т | J93: М4, т | L93: Qо, Гкал | N93: Qг, Гкал | P93: время, час
B94: 23.09.18 00:00 | D94: 891.17 | F94: 798.89 | H94: 78 | J94: - | L94: 6.593 | N94: 5.5369999999999999 | P94: -
B95: 18.10.18 07:00 | D95: 4639.33 | F95: 3714.82 | H95: 727.54 | J95: - | L95: 124.702 | N95: 49.89 | P95: -
AC97: =ZAYAVKA_N -> з.н д. №02/147-2783 от 04.10.18 с 03.10.18г по 10.10.18г некорректная работа приборов
B98: Представитель потребителя:_______________________________________________________________________ В.О. Топорков
I101: Рекомендуемые значения по параметрам теплопотребления (не являются официально утверждёнными)
I102: М, т | J102: V, м3 | K102: Qгвс, Гкал | L102: Qотоп, Гкал | M102: Qо, Гкал
I103: =R[-13]C[-3] -> 0 | J103: =RC[-1]/0.98 -> 0 | K103: =RC[-1]*0.06 -> 0 | L103: =RC[1]-RC[-1] -> 53.336999999999989 | M103: =R[-13]C[5] -> 53.336999999999989
O105: ДЛЯ САМОКОНТРОЛЯ
B106: В строке выбора дат указать период с 16.7.13 по 23.8.13 - жильё | N106: Q | O106: Qг
B107: В строке выбора дат указать период с 18.7.13 по 25.8.13 - не жилое | N107: =(R[-21]C[-10]*R[-22]C[-7]-R[-21]C[-9]*R[-22]C[-6])/1000 -> 573.98121753555586 | O107: =IF(R[-22]C[-2]="",R[-21]C[-3]*R[-22]C/1000,"") ->  | P107: Си2
O108: =IF(R[-23]C[-2]="","",((R[-22]C[-3]*R[-23]C)-(R[-22]C[-2]*R[-23]C[2]))/1000) -> 0 | P108: Си3