Sheet: Лист1
G1: Отчёт о теплопотреблении за октябрь 2018 | M1: з.н д. №02/147-2783 от 04.10.18 с 26.09.18г по 27.09.18г ,10.10.18г некорректная работа приборов В данном отчете ГВС суммируется
A4: =EOMONTH(R[9]C,0)-R[9]C -> 8 | B4: Потребитель: ЗАО "Сити Сервис"
A5: =MAX(R[9]C:R[78]C) -> 2018-10-22T00:00:00.000 | B5: Адрес: г. СПб, Кораблестроителей ул., д.29 к.2 ИТП 1
A6: =EOMONTH(R[-1]C,0)-R[-1]C -> 9 | B6: Телефон: 8-911-021-19-79
A7: =R[-2]C-R[6]C -> 30 | B7: Договор 10023-2 (.) 327
A8: 7 | B8: Тепловычислитель: СПТ-943 № 01653 | L8: М2 мах= | M8: 114 | O8: Мгвс мах= | P8: 102.24
L9: Qотоп мах= | M9: 9.12 | O9: Qгвс мах= | P9: 6.24
B10: Расчётная формула: Q=M1*(h1-h2)+(M1-M2)*(h2-hхв)
D12: Учет | L12: Контроль
A13: =R[1]C[1]-1 -> 2018-09-22T00:00:00.000 | B13: Дата | C13: N, ч | D13: M1, т | E13: T1, С | F13: P1, кг/см2 | G13: M2, т | H13: T2, С | I13: P2, кг/см2 | J13: dT, С | K13: M1-М2, т | L13: V3, м3 | M13: T3, С | N13: V4, м3 | O13: =IF(R[-12]C[-14]="м.куб","","T4, С") -> T4, С | P13: dT, С | Q13: V3+V4, м3 | R13: Qгвс, Гкал | S13: Qобщ., Гкал | T13: Q | U13: M3 | V13: M4 | W13: си2 | X13: си3 | Y13: Разб. | Z13: dM2 | AC13: Дата | AD13: НС | AE13: n, ч | AF13: М1, т | AG13: t1, гр. С | AH13: Р1, кгс/см2 | AI13: М2, т | AJ13: t2, гр. С | AK13: Р2, кгс/см2 | AL13: t1-t2, гр. С | AM13: М1-М2, т | AN13: М1гвс, т | AO13: t1гвс, гр. С | AP13: Р1гвс, кгс/см2 | AQ13: М2гвс, т | AR13: t2гвс, гр. С | AS13: Р2гвс, кгс/см2 | AT13: t1гвс-t2гвс | AU13: М1гвс-М2гвс, т | AV13: Wгвс, Гкал | AW13: Wсумм, Гкал | AY13: NS_TV1 | AZ13: НС | BA13: NS_TV2
A14: =IF(RC[1]="","",DATEVALUE(RC[1])) -> 43366 | B14: 23.09.18 | C14: 24 | D14: 17.337361999999999 | E14: 58.866816999999998 | F14: 7.5527319999999998 | G14: 0 | H14: 21.063766000000001 | I14: 4.4000000000000004 | J14: =RC[-5]-RC[-2] -> 37.803050999999996 | K14: 17.337361999999999 | L14: 12.980911000000001 | M14: 58.436729 | N14: 4.2250329999999998 | O14: 56.553162 | P14: =IF(AND(ISNUMBER(RC[-3]),ISNUMBER(RC[-1])),RC[-3]-RC[-1],"-") -> 1.8835669999999993 | Q14: 17.205943999999999 | R14: 0.98265000000000002 | S14: =RC[-1] -> 0.98265000000000002 | T14: =(RC[-16]*RC[-15]-RC[-13]*RC[-12])/1000 -> 1.0205953161167538 | U14: 12.775881999999999 | V14: 4.1621860000000002 | W14: =RC[-2]*RC[-10]/1000 -> 0.74658075416997793 | X14: =ABS((RC[-3]*RC[-11]-RC[-2]*RC[-9])/1000) -> 0.51119597503784586 | Y14: =(RC[-14]-RC[1])/RC[-18]*100 -> #DIV/0! | Z14: =RC[-5]+RC[-4] -> 16.938068000000001 | AC14: =VALUE(RC[-27]) -> 2018-09-23T00:00:00.000 | AD14: =IF(RC[21]=42,"*",IF(RC[21]=32,"",RC[21])) -> - | AE14: =RC[-28] -> 24 | AF14: =RC[-28] -> 17.337361999999999 | AG14: =RC[-28] -> 58.866816999999998 | AH14: =RC[-28] -> 7.5527319999999998 | AI14: =RC[-28] -> 0 | AJ14: =RC[-28] -> 21.063766000000001 | AK14: =RC[-28] -> 4.4000000000000004 | AL14: =RC[-28] -> 37.803050999999996 | AM14: =RC[-28] -> 17.337361999999999 | AN14: =RC[-28] -> 12.980911000000001 | AO14: =RC[-28] -> 58.436729 | AP14: - | AQ14: =RC[-29] -> 4.2250329999999998 | AR14: =RC[-29] -> 56.553162 | AS14: - | AT14: =RC[-30] -> 1.8835669999999993 | AU14: =RC[-30] -> 17.205943999999999 | AV14: =RC[-30] -> 0.98265000000000002 | AW14: =RC[-30] -> 0.98265000000000002 | AY14: - | AZ14: - | BA14: -
A15: =IF(RC[1]="","",DATEVALUE(RC[1])) -> 43367 | B15: 24.09.18 | C15: 24 | D15: 16.641697000000001 | E15: 62.602927999999999 | F15: 7.6204640000000001 | G15: 0 | H15: 21.56916 | I15: 4.4000000000000004 | J15: =RC[-5]-RC[-2] -> 41.033767999999995 | K15: 16.641697000000001 | L15: 12.767965 | M15: 62.128112999999999 | N15: 3.7604769999999998 | O15: 59.487369999999999 | P15: =IF(AND(ISNUMBER(RC[-3]),ISNUMBER(RC[-1])),RC[-3]-RC[-1],"-") -> 2.6407430000000005 | Q15: 16.528441999999998 | R15: 0.99988500000000002 | S15: =RC[-1] -> 0.99988500000000002 | T15: =(RC[-16]*RC[-15]-RC[-13]*RC[-12])/1000 -> 1.0418189590888161 | U15: 12.541944000000001 | V15: 3.6988949999999998 | W15: =RC[-2]*RC[-10]/1000 -> 0.7792073140716721 | X15: =ABS((RC[-3]*RC[-11]-RC[-2]*RC[-9])/1000) -> 0.55916977861552208 | Y15: =(RC[-14]-RC[1])/RC[-18]*100 -> #DIV/0! | Z15: =RC[-5]+RC[-4] -> 16.240839000000001 | AC15: =VALUE(RC[-27]) -> 2018-09-24T00:00:00.000 | AD15: =IF(RC[21]=42,"*",IF(RC[21]=32,"",RC[21])) -> - | AE15: =RC[-28] -> 24 | AF15: =RC[-28] -> 16.641697000000001 | AG15: =RC[-28] -> 62.602927999999999 | AH15: =RC[-28] -> 7.6204640000000001 | AI15: =RC[-28] -> 0 | AJ15: =RC[-28] -> 21.56916 | AK15: =RC[-28] -> 4.4000000000000004 | AL15: =RC[-28] -> 41.033767999999995 | AM15: =RC[-28] -> 16.641697000000001 | AN15: =RC[-28] -> 12.767965 | AO15: =RC[-28] -> 62.128112999999999 | AP15: - | AQ15: =RC[-29] -> 3.7604769999999998 | AR15: =RC[-29] -> 59.487369999999999 | AS15: - | AT15: =RC[-30] -> 2.6407430000000005 | AU15: =RC[-30] -> 16.528441999999998 | AV15: =RC[-30] -> 0.99988500000000002 | AW15: =RC[-30] -> 0.99988500000000002 | AY15: - | AZ15: - | BA15: -
A16: =IF(RC[1]="","",DATEVALUE(RC[1])) -> 43368 | B16: 25.09.18 | C16: 24 | D16: 16.204461999999999 | E16: 63.478554000000003 | F16: 7.6829919999999996 | G16: 0 | H16: 24.986298000000001 | I16: 4.4000000000000004 | J16: =RC[-5]-RC[-2] -> 38.492255999999998 | K16: 16.204461999999999 | L16: 12.501122000000001 | M16: 62.611023000000003 | N16: 3.6059999999999999 | O16: 60.568058000000001 | P16: =IF(AND(ISNUMBER(RC[-3]),ISNUMBER(RC[-1])),RC[-3]-RC[-1],"-") -> 2.0429650000000024 | Q16: 16.107122 | R16: 0.984155 | S16: 1.029949 | T16: =(RC[-16]*RC[-15]-RC[-13]*RC[-12])/1000 -> 1.0286358161079479 | U16: 12.277172999999999 | V16: 3.5451969999999999 | W16: =RC[-2]*RC[-10]/1000 -> 0.76868636107797894 | X16: =ABS((RC[-3]*RC[-11]-RC[-2]*RC[-9])/1000) -> 0.55396066356055307 | Y16: =(RC[-14]-RC[1])/RC[-18]*100 -> #DIV/0! | Z16: =RC[-5]+RC[-4] -> 15.822369999999999 | AC16: =VALUE(RC[-27]) -> 2018-09-25T00:00:00.000 | AD16: =IF(RC[21]=42,"*",IF(RC[21]=32,"",RC[21])) -> - | AE16: =RC[-28] -> 24 | AF16: =RC[-28] -> 16.204461999999999 | AG16: =RC[-28] -> 63.478554000000003 | AH16: =RC[-28] -> 7.6829919999999996 | AI16: =RC[-28] -> 0 | AJ16: =RC[-28] -> 24.986298000000001 | AK16: =RC[-28] -> 4.4000000000000004 | AL16: =RC[-28] -> 38.492255999999998 | AM16: =RC[-28] -> 16.204461999999999 | AN16: =RC[-28] -> 12.501122000000001 | AO16: =RC[-28] -> 62.611023000000003 | AP16: - | AQ16: =RC[-29] -> 3.6059999999999999 | AR16: =RC[-29] -> 60.568058000000001 | AS16: - | AT16: =RC[-30] -> 2.0429650000000024 | AU16: =RC[-30] -> 16.107122 | AV16: =RC[-30] -> 0.984155 | AW16: =RC[-30] -> 1.029949 | AY16: - | AZ16: - | BA16: -
A17: =IF(RC[1]="","",DATEVALUE(RC[1])) -> 43369 | B17: 26.09.18 | C17: 24 | D17: 167.66514600000002 | E17: 66.979886666666673 | F17: 7.7523696666666666 | G17: 149.72345466666664 | H17: 47.851014333333332 | I17: 5.8153276666666658 | J17: 19.128872333333337 | K17: 17.941684666666664 | L17: 11.567669666666665 | M17: 66.432444000000018 | N17: 3.337818 | O17: 64.499833666666675 | P17: 1.9326103333333389 | Q17: 14.905487666666666 | R17: 0.96600600000000014 | S17: 4.0689423333333332 | T17: =(RC[-16]*RC[-15]-RC[-13]*RC[-12])/1000 -> 4.0657733017392736 | U17: 11.312317 | V17: 3.3705150000000001 | W17: =RC[-2]*RC[-10]/1000 -> 0.75150486561274821 | X17: =ABS((RC[-3]*RC[-11]-RC[-2]*RC[-9])/1000) -> 0.53410720874174311 | Y17: =(RC[-14]-RC[1])/RC[-18]*100 -> 2.1765812670579461 | Z17: =RC[-5]+RC[-4] -> 14.682832000000001 | AC17: =VALUE(RC[-27]) -> 2018-09-26T00:00:00.000 | AD17: =IF(RC[21]=42,"*",IF(RC[21]=32,"",RC[21])) -> - | AE17: =RC[-28] -> 24 | AF17: =RC[-28] -> 167.66514600000002 | AG17: =RC[-28] -> 66.979886666666673 | AH17: =RC[-28] -> 7.7523696666666666 | AI17: =RC[-28] -> 149.72345466666664 | AJ17: =RC[-28] -> 47.851014333333332 | AK17: =RC[-28] -> 5.8153276666666658 | AL17: =RC[-28] -> 19.128872333333337 | AM17: =RC[-28] -> 17.941684666666664 | AN17: =RC[-28] -> 11.567669666666665 | AO17: =RC[-28] -> 66.432444000000018 | AP17: - | AQ17: =RC[-29] -> 3.337818 | AR17: =RC[-29] -> 64.499833666666675 | AS17: - | AT17: =RC[-30] -> 1.9326103333333389 | AU17: =RC[-30] -> 14.905487666666666 | AV17: =RC[-30] -> 0.96600600000000014 | AW17: =RC[-30] -> 4.0689423333333332 | AY17: - | AZ17: - | BA17: -
A18: =IF(RC[1]="","",DATEVALUE(RC[1])) -> 43370 | B18: 27.09.18 | C18: 24 | D18: =AVERAGE(R[1]C:R[3]C) -> 167.66514600000002 | E18: =AVERAGE(R[1]C:R[3]C) -> 66.979886666666673 | F18: =AVERAGE(R[1]C:R[3]C) -> 7.7523696666666666 | G18: =AVERAGE(R[1]C:R[3]C) -> 149.72345466666664 | H18: =AVERAGE(R[1]C:R[3]C) -> 47.851014333333332 | I18: =AVERAGE(R[1]C:R[3]C) -> 5.8153276666666658 | J18: =AVERAGE(R[1]C:R[3]C) -> 19.128872333333337 | K18: =AVERAGE(R[1]C:R[3]C) -> 17.941684666666664 | L18: =AVERAGE(R[1]C:R[3]C) -> 11.567669666666665 | M18: =AVERAGE(R[1]C:R[3]C) -> 66.432444000000018 | N18: =AVERAGE(R[1]C:R[3]C) -> 3.337818 | O18: =AVERAGE(R[1]C:R[3]C) -> 64.499833666666675 | P18: =AVERAGE(R[1]C:R[3]C) -> 1.9326103333333389 | Q18: =AVERAGE(R[1]C:R[3]C) -> 14.905487666666666 | R18: =AVERAGE(R[1]C:R[3]C) -> 0.96600600000000014 | S18: =AVERAGE(R[1]C:R[3]C) -> 4.0689423333333332 | T18: =(RC[-16]*RC[-15]-RC[-13]*RC[-12])/1000 -> 4.0657733017392736 | U18: 11.451105999999999 | V18: 3.8311730000000002 | W18: =RC[-2]*RC[-10]/1000 -> 0.76072495808306417 | X18: =ABS((RC[-3]*RC[-11]-RC[-2]*RC[-9])/1000) -> 0.51361493683483983 | Y18: =(RC[-14]-RC[1])/RC[-18]*100 -> 1.7762117983367207 | Z18: =RC[-5]+RC[-4] -> 15.282278999999999 | AC18: =VALUE(RC[-27]) -> 2018-09-27T00:00:00.000 | AD18: =IF(RC[21]=42,"*",IF(RC[21]=32,"",RC[21])) -> - | AE18: =RC[-28] -> 24 | AF18: =RC[-28] -> 167.66514600000002 | AG18: =RC[-28] -> 66.979886666666673 | AH18: =RC[-28] -> 7.7523696666666666 | AI18: =RC[-28] -> 149.72345466666664 | AJ18: =RC[-28] -> 47.851014333333332 | AK18: =RC[-28] -> 5.8153276666666658 | AL18: =RC[-28] -> 19.128872333333337 | AM18: =RC[-28] -> 17.941684666666664 | AN18: =RC[-28] -> 11.567669666666665 | AO18: =RC[-28] -> 66.432444000000018 | AP18: - | AQ18: =RC[-29] -> 3.337818 | AR18: =RC[-29] -> 64.499833666666675 | AS18: - | AT18: =RC[-30] -> 1.9326103333333389 | AU18: =RC[-30] -> 14.905487666666666 | AV18: =RC[-30] -> 0.96600600000000014 | AW18: =RC[-30] -> 4.0689423333333332 | AY18: - | AZ18: - | BA18: -
A19: =IF(RC[1]="","",DATEVALUE(RC[1])) -> 43371 | B19: 28.09.18 | C19: 24 | D19: 154.29354900000001 | E19: 66.251320000000007 | F19: 7.2325790000000003 | G19: 137.80693099999999 | H19: 46.264313000000001 | I19: 5.6272080000000004 | J19: =RC[-5]-RC[-2] -> 19.987007000000006 | K19: 16.486626000000001 | L19: 10.685333 | M19: 65.635040000000004 | N19: 3.1826439999999998 | O19: 63.806987999999997 | P19: =IF(AND(ISNUMBER(RC[-3]),ISNUMBER(RC[-1])),RC[-3]-RC[-1],"-") -> 1.8280520000000067 | Q19: 13.867977 | R19: 0.88760300000000003 | S19: 3.8519670000000001 | T19: =(RC[-16]*RC[-15]-RC[-13]*RC[-12])/1000 -> 3.8466082993812787 | U19: 10.476546000000001 | V19: 3.1235729999999999 | W19: =RC[-2]*RC[-10]/1000 -> 0.68762851577184003 | X19: =ABS((RC[-3]*RC[-11]-RC[-2]*RC[-9])/1000) -> 0.48832273084371602 | Y19: =(RC[-14]-RC[1])/RC[-18]*100 -> 2.0946021938475652 | Z19: =RC[-5]+RC[-4] -> 13.600119000000001 | AC19: =VALUE(RC[-27]) -> 2018-09-28T00:00:00.000 | AD19: =IF(RC[21]=42,"*",IF(RC[21]=32,"",RC[21])) -> - | AE19: =RC[-28] -> 24 | AF19: =RC[-28] -> 154.29354900000001 | AG19: =RC[-28] -> 66.251320000000007 | AH19: =RC[-28] -> 7.2325790000000003 | AI19: =RC[-28] -> 137.80693099999999 | AJ19: =RC[-28] -> 46.264313000000001 | AK19: =RC[-28] -> 5.6272080000000004 | AL19: =RC[-28] -> 19.987007000000006 | AM19: =RC[-28] -> 16.486626000000001 | AN19: =RC[-28] -> 10.685333 | AO19: =RC[-28] -> 65.635040000000004 | AP19: - | AQ19: =RC[-29] -> 3.1826439999999998 | AR19: =RC[-29] -> 63.806987999999997 | AS19: - | AT19: =RC[-30] -> 1.8280520000000067 | AU19: =RC[-30] -> 13.867977 | AV19: =RC[-30] -> 0.88760300000000003 | AW19: =RC[-30] -> 3.8519670000000001 | AY19: - | AZ19: - | BA19: -
A20: =IF(RC[1]="","",DATEVALUE(RC[1])) -> 43372 | B20: 29.09.18 | C20: 24 | D20: 173.71009799999999 | E20: 66.336678000000006 | F20: 8.0170209999999997 | G20: 156.03021200000001 | H20: 47.959972 | I20: 5.9467629999999998 | J20: =RC[-5]-RC[-2] -> 18.376706000000006 | K20: 17.679856999999998 | L20: 11.296355 | M20: 65.569473000000002 | N20: 3.3984329999999998 | O20: 63.532226999999999 | P20: =IF(AND(ISNUMBER(RC[-3]),ISNUMBER(RC[-1])),RC[-3]-RC[-1],"-") -> 2.0372460000000032 | Q20: 14.694788000000001 | R20: 0.93890300000000004 | S20: 4.0478730000000001 | T20: =(RC[-16]*RC[-15]-RC[-13]*RC[-12])/1000 -> 4.0401462377003803 | U20: 11.076074999999999 | V20: 3.3358639999999999 | W20: =RC[-2]*RC[-10]/1000 -> 0.72625240065847507 | X20: =ABS((RC[-3]*RC[-11]-RC[-2]*RC[-9])/1000) -> 0.51431753176934702 | Y20: =(RC[-14]-RC[1])/RC[-18]*100 -> 2.0944136126662434 | Z20: =RC[-5]+RC[-4] -> 14.411939 | AC20: =VALUE(RC[-27]) -> 2018-09-29T00:00:00.000 | AD20: =IF(RC[21]=42,"*",IF(RC[21]=32,"",RC[21])) -> - | AE20: =RC[-28] -> 24 | AF20: =RC[-28] -> 173.71009799999999 | AG20: =RC[-28] -> 66.336678000000006 | AH20: =RC[-28] -> 8.0170209999999997 | AI20: =RC[-28] -> 156.03021200000001 | AJ20: =RC[-28] -> 47.959972 | AK20: =RC[-28] -> 5.9467629999999998 | AL20: =RC[-28] -> 18.376706000000006 | AM20: =RC[-28] -> 17.679856999999998 | AN20: =RC[-28] -> 11.296355 | AO20: =RC[-28] -> 65.569473000000002 | AP20: - | AQ20: =RC[-29] -> 3.3984329999999998 | AR20: =RC[-29] -> 63.532226999999999 | AS20: - | AT20: =RC[-30] -> 2.0372460000000032 | AU20: =RC[-30] -> 14.694788000000001 | AV20: =RC[-30] -> 0.93890300000000004 | AW20: =RC[-30] -> 4.0478730000000001 | AY20: - | AZ20: - | BA20: -
A21: =IF(RC[1]="","",DATEVALUE(RC[1])) -> 43373 | B21: 30.09.18 | C21: 24 | D21: 174.99179100000001 | E21: 68.351662000000005 | F21: 8.0075090000000007 | G21: 155.33322100000001 | H21: 49.328758000000001 | I21: 5.8720119999999998 | J21: =RC[-5]-RC[-2] -> 19.022904000000004 | K21: 19.658570999999998 | L21: 12.721321 | M21: 68.092819000000006 | N21: 3.4323769999999998 | O21: 66.160285999999999 | P21: =IF(AND(ISNUMBER(RC[-3]),ISNUMBER(RC[-1])),RC[-3]-RC[-1],"-") -> 1.9325330000000065 | Q21: 16.153697999999999 | R21: 1.071512 | S21: 4.3069870000000003 | T21: =(RC[-16]*RC[-15]-RC[-13]*RC[-12])/1000 -> 4.2985848831371252 | U21: 12.455432999999999 | V21: 3.36429 | W21: =RC[-2]*RC[-10]/1000 -> 0.84812554483562697 | X21: =ABS((RC[-3]*RC[-11]-RC[-2]*RC[-9])/1000) -> 0.62554315624868695 | Y21: =(RC[-14]-RC[1])/RC[-18]*100 -> 2.4713631606209971 | Z21: =RC[-5]+RC[-4] -> 15.819723 | AC21: =VALUE(RC[-27]) -> 2018-09-30T00:00:00.000 | AD21: =IF(RC[21]=42,"*",IF(RC[21]=32,"",RC[21])) -> - | AE21: =RC[-28] -> 24 | AF21: =RC[-28] -> 174.99179100000001 | AG21: =RC[-28] -> 68.351662000000005 | AH21: =RC[-28] -> 8.0075090000000007 | AI21: =RC[-28] -> 155.33322100000001 | AJ21: =RC[-28] -> 49.328758000000001 | AK21: =RC[-28] -> 5.8720119999999998 | AL21: =RC[-28] -> 19.022904000000004 | AM21: =RC[-28] -> 19.658570999999998 | AN21: =RC[-28] -> 12.721321 | AO21: =RC[-28] -> 68.092819000000006 | AP21: - | AQ21: =RC[-29] -> 3.4323769999999998 | AR21: =RC[-29] -> 66.160285999999999 | AS21: - | AT21: =RC[-30] -> 1.9325330000000065 | AU21: =RC[-30] -> 16.153697999999999 | AV21: =RC[-30] -> 1.071512 | AW21: =RC[-30] -> 4.3069870000000003 | AY21: - | AZ21: - | BA21: -
A22: =IF(RC[1]="","",DATEVALUE(RC[1])) -> 43374 | B22: 01.10.18 | C22: 24 | D22: 169.29959099999999 | E22: 67.345932000000005 | F22: 8.0476869999999998 | G22: 151.03114299999999 | H22: 49.147632999999999 | I22: 5.9756539999999996 | J22: =RC[-5]-RC[-2] -> 18.198299000000006 | K22: 18.268442 | L22: 11.494743 | M22: 66.594170000000005 | N22: 3.081766 | O22: 64.563834999999997 | P22: =IF(AND(ISNUMBER(RC[-3]),ISNUMBER(RC[-1])),RC[-3]-RC[-1],"-") -> 2.030335000000008 | Q22: 14.576509 | R22: 0.94603800000000005 | S22: 3.9866130000000002 | T22: =(RC[-16]*RC[-15]-RC[-13]*RC[-12])/1000 -> 3.9788155553792941 | U22: 11.264110000000001 | V22: 3.02332 | W22: =RC[-2]*RC[-10]/1000 -> 0.75012405623870004 | X22: =ABS((RC[-3]*RC[-11]-RC[-2]*RC[-9])/1000) -> 0.55492692260650001 | Y22: =(RC[-14]-RC[1])/RC[-18]*100 -> 2.635888149240849 | Z22: =RC[-5]+RC[-4] -> 14.287430000000001 | AC22: =VALUE(RC[-27]) -> 2018-10-01T00:00:00.000 | AD22: =IF(RC[21]=42,"*",IF(RC[21]=32,"",RC[21])) -> - | AE22: =RC[-28] -> 24 | AF22: =RC[-28] -> 169.29959099999999 | AG22: =RC[-28] -> 67.345932000000005 | AH22: =RC[-28] -> 8.0476869999999998 | AI22: =RC[-28] -> 151.03114299999999 | AJ22: =RC[-28] -> 49.147632999999999 | AK22: =RC[-28] -> 5.9756539999999996 | AL22: =RC[-28] -> 18.198299000000006 | AM22: =RC[-28] -> 18.268442 | AN22: =RC[-28] -> 11.494743 | AO22: =RC[-28] -> 66.594170000000005 | AP22: - | AQ22: =RC[-29] -> 3.081766 | AR22: =RC[-29] -> 64.563834999999997 | AS22: - | AT22: =RC[-30] -> 2.030335000000008 | AU22: =RC[-30] -> 14.576509 | AV22: =RC[-30] -> 0.94603800000000005 | AW22: =RC[-30] -> 3.9866130000000002 | AY22: - | AZ22: - | BA22: -
A23: =IF(RC[1]="","",DATEVALUE(RC[1])) -> 43375 | B23: 02.10.18 | C23: 24 | D23: 168.472443 | E23: 66.130027999999996 | F23: 8.0198009999999993 | G23: 151.333145 | H23: 48.602890000000002 | I23: 5.8363319999999996 | J23: =RC[-5]-RC[-2] -> 17.527137999999994 | K23: 17.139301 | L23: 10.718477 | M23: 65.517532000000003 | N23: 2.809644 | O23: 63.454070999999999 | P23: =IF(AND(ISNUMBER(RC[-3]),ISNUMBER(RC[-1])),RC[-3]-RC[-1],"-") -> 2.0634610000000038 | Q23: 13.528121000000001 | R23: 0.86424000000000001 | S23: 3.793777 | T23: =(RC[-16]*RC[-15]-RC[-13]*RC[-12])/1000 -> 3.7858591730293529 | U23: 10.509765 | V23: 2.758032 | W23: =RC[-2]*RC[-10]/1000 -> 0.68857386469998005 | X23: =ABS((RC[-3]*RC[-11]-RC[-2]*RC[-9])/1000) -> 0.51356550635170806 | Y23: =(RC[-14]-RC[1])/RC[-18]*100 -> 2.5582657388108863 | Z23: =RC[-5]+RC[-4] -> 13.267797 | AC23: =VALUE(RC[-27]) -> 2018-10-02T00:00:00.000 | AD23: =IF(RC[21]=42,"*",IF(RC[21]=32,"",RC[21])) -> - | AE23: =RC[-28] -> 24 | AF23: =RC[-28] -> 168.472443 | AG23: =RC[-28] -> 66.130027999999996 | AH23: =RC[-28] -> 8.0198009999999993 | AI23: =RC[-28] -> 151.333145 | AJ23: =RC[-28] -> 48.602890000000002 | AK23: =RC[-28] -> 5.8363319999999996 | AL23: =RC[-28] -> 17.527137999999994 | AM23: =RC[-28] -> 17.139301 | AN23: =RC[-28] -> 10.718477 | AO23: =RC[-28] -> 65.517532000000003 | AP23: - | AQ23: =RC[-29] -> 2.809644 | AR23: =RC[-29] -> 63.454070999999999 | AS23: - | AT23: =RC[-30] -> 2.0634610000000038 | AU23: =RC[-30] -> 13.528121000000001 | AV23: =RC[-30] -> 0.86424000000000001 | AW23: =RC[-30] -> 3.793777 | AY23: - | AZ23: - | BA23: -
A24: =IF(RC[1]="","",DATEVALUE(RC[1])) -> 43376 | B24: 03.10.18 | C24: 24 | D24: 170.980423 | E24: 66.233292000000006 | F24: 7.9962309999999999 | G24: 152.97163399999999 | H24: 48.643901999999997 | I24: 5.7981930000000004 | J24: =RC[-5]-RC[-2] -> 17.589390000000009 | K24: 18.008790999999999 | L24: 11.220278 | M24: 65.716057000000006 | N24: 3.1631 | O24: 63.556289999999997 | P24: =IF(AND(ISNUMBER(RC[-3]),ISNUMBER(RC[-1])),RC[-3]-RC[-1],"-") -> 2.1597670000000093 | Q24: 14.383378 | R24: 0.92095099999999996 | S24: 3.891559 | T24: =(RC[-16]*RC[-15]-RC[-13]*RC[-12])/1000 -> 3.8834591097666489 | U24: 11.000579 | V24: 3.1048390000000001 | W24: =RC[-2]*RC[-10]/1000 -> 0.72291467659700315 | X24: =ABS((RC[-3]*RC[-11]-RC[-2]*RC[-9])/1000) -> 0.52558262870969319 | Y24: =(RC[-14]-RC[1])/RC[-18]*100 -> 2.5516972643437925 | Z24: =RC[-5]+RC[-4] -> 14.105418 | AC24: =VALUE(RC[-27]) -> 2018-10-03T00:00:00.000 | AD24: =IF(RC[21]=42,"*",IF(RC[21]=32,"",RC[21])) -> - | AE24: =RC[-28] -> 24 | AF24: =RC[-28] -> 170.980423 | AG24: =RC[-28] -> 66.233292000000006 | AH24: =RC[-28] -> 7.9962309999999999 | AI24: =RC[-28] -> 152.97163399999999 | AJ24: =RC[-28] -> 48.643901999999997 | AK24: =RC[-28] -> 5.7981930000000004 | AL24: =RC[-28] -> 17.589390000000009 | AM24: =RC[-28] -> 18.008790999999999 | AN24: =RC[-28] -> 11.220278 | AO24: =RC[-28] -> 65.716057000000006 | AP24: - | AQ24: =RC[-29] -> 3.1631 | AR24: =RC[-29] -> 63.556289999999997 | AS24: - | AT24: =RC[-30] -> 2.1597670000000093 | AU24: =RC[-30] -> 14.383378 | AV24: =RC[-30] -> 0.92095099999999996 | AW24: =RC[-30] -> 3.891559 | AY24: - | AZ24: - | BA24: -
A25: =IF(RC[1]="","",DATEVALUE(RC[1])) -> 43377 | B25: 04.10.18 | C25: 24 | D25: 168.698532 | E25: 65.690796000000006 | F25: 7.9641200000000003 | G25: 150.51975999999999 | H25: 47.955803000000003 | I25: 5.8175439999999998 | J25: =RC[-5]-RC[-2] -> 17.734993000000003 | K25: 18.178766 | L25: 11.747398 | M25: 65.128112999999999 | N25: 2.973678 | O25: 62.94717 | P25: =IF(AND(ISNUMBER(RC[-3]),ISNUMBER(RC[-1])),RC[-3]-RC[-1],"-") -> 2.1809429999999992 | Q25: 14.721076 | R25: 0.93486499999999995 | S25: 3.871397 | T25: =(RC[-16]*RC[-15]-RC[-13]*RC[-12])/1000 -> 3.8636448929441922 | U25: 11.521153999999999 | V25: 2.9198659999999999 | W25: =RC[-2]*RC[-10]/1000 -> 0.75035101960240191 | X25: =ABS((RC[-3]*RC[-11]-RC[-2]*RC[-9])/1000) -> 0.566553718123182 | Y25: =(RC[-14]-RC[1])/RC[-18]*100 -> 2.4832261226034387 | Z25: =RC[-5]+RC[-4] -> 14.441019999999998 | AC25: =VALUE(RC[-27]) -> 2018-10-04T00:00:00.000 | AD25: =IF(RC[21]=42,"*",IF(RC[21]=32,"",RC[21])) -> - | AE25: =RC[-28] -> 24 | AF25: =RC[-28] -> 168.698532 | AG25: =RC[-28] -> 65.690796000000006 | AH25: =RC[-28] -> 7.9641200000000003 | AI25: =RC[-28] -> 150.51975999999999 | AJ25: =RC[-28] -> 47.955803000000003 | AK25: =RC[-28] -> 5.8175439999999998 | AL25: =RC[-28] -> 17.734993000000003 | AM25: =RC[-28] -> 18.178766 | AN25: =RC[-28] -> 11.747398 | AO25: =RC[-28] -> 65.128112999999999 | AP25: - | AQ25: =RC[-29] -> 2.973678 | AR25: =RC[-29] -> 62.94717 | AS25: - | AT25: =RC[-30] -> 2.1809429999999992 | AU25: =RC[-30] -> 14.721076 | AV25: =RC[-30] -> 0.93486499999999995 | AW25: =RC[-30] -> 3.871397 | AY25: - | AZ25: - | BA25: -
A26: =IF(RC[1]="","",DATEVALUE(RC[1])) -> 43378 | B26: 05.10.18 | C26: 24 | D26: 172.70379600000001 | E26: 65.102103999999997 | F26: 7.9270050000000003 | G26: 151.81285099999999 | H26: 47.564033999999999 | I26: 5.7106700000000004 | J26: =RC[-5]-RC[-2] -> 17.538069999999998 | K26: 20.890975999999998 | L26: 13.349043999999999 | M26: 64.637305999999995 | N26: 4.1178330000000001 | O26: 62.895279000000002 | P26: =IF(AND(ISNUMBER(RC[-3]),ISNUMBER(RC[-1])),RC[-3]-RC[-1],"-") -> 1.7420269999999931 | Q26: 17.466877 | R26: 1.1016140000000001 | S26: 4.0306980000000001 | T26: =(RC[-16]*RC[-15]-RC[-13]*RC[-12])/1000 -> 4.0225488817858492 | U26: 13.095510000000001 | V26: 4.0434200000000002 | W26: =RC[-2]*RC[-10]/1000 -> 0.84645848709605997 | X26: =ABS((RC[-3]*RC[-11]-RC[-2]*RC[-9])/1000) -> 0.59214645808188004 | Y26: =(RC[-14]-RC[1])/RC[-18]*100 -> 2.4714943269196601 | Z26: =RC[-5]+RC[-4] -> 17.138930000000002 | AC26: =VALUE(RC[-27]) -> 2018-10-05T00:00:00.000 | AD26: =IF(RC[21]=42,"*",IF(RC[21]=32,"",RC[21])) -> - | AE26: =RC[-28] -> 24 | AF26: =RC[-28] -> 172.70379600000001 | AG26: =RC[-28] -> 65.102103999999997 | AH26: =RC[-28] -> 7.9270050000000003 | AI26: =RC[-28] -> 151.81285099999999 | AJ26: =RC[-28] -> 47.564033999999999 | AK26: =RC[-28] -> 5.7106700000000004 | AL26: =RC[-28] -> 17.538069999999998 | AM26: =RC[-28] -> 20.890975999999998 | AN26: =RC[-28] -> 13.349043999999999 | AO26: =RC[-28] -> 64.637305999999995 | AP26: - | AQ26: =RC[-29] -> 4.1178330000000001 | AR26: =RC[-29] -> 62.895279000000002 | AS26: - | AT26: =RC[-30] -> 1.7420269999999931 | AU26: =RC[-30] -> 17.466877 | AV26: =RC[-30] -> 1.1016140000000001 | AW26: =RC[-30] -> 4.0306980000000001 | AY26: - | AZ26: - | BA26: -
A27: =IF(RC[1]="","",DATEVALUE(RC[1])) -> 43379 | B27: 06.10.18 | C27: 24 | D27: 169.56985499999999 | E27: 65.58963 | F27: 8.0029109999999992 | G27: 152.00370799999999 | H27: 48.207664000000001 | I27: 5.8057889999999999 | J27: =RC[-5]-RC[-2] -> 17.381965999999998 | K27: 17.566133000000001 | L27: 11.155177 | M27: 65.194061000000005 | N27: 3.0275110000000001 | O27: 63.157688 | P27: =IF(AND(ISNUMBER(RC[-3]),ISNUMBER(RC[-1])),RC[-3]-RC[-1],"-") -> 2.0363730000000047 | Q27: 14.182688000000001 | R27: 0.90163499999999996 | S27: 3.8021820000000002 | T27: =(RC[-16]*RC[-15]-RC[-13]*RC[-12])/1000 -> 3.7942803665855371 | U27: 10.939931 | V27: 2.9723769999999998 | W27: =RC[-2]*RC[-10]/1000 -> 0.71321852894979099 | X27: =ABS((RC[-3]*RC[-11]-RC[-2]*RC[-9])/1000) -> 0.52549006976541501 | Y27: =(RC[-14]-RC[1])/RC[-18]*100 -> 2.4037735974177692 | Z27: =RC[-5]+RC[-4] -> 13.912307999999999 | AC27: =VALUE(RC[-27]) -> 2018-10-06T00:00:00.000 | AD27: =IF(RC[21]=42,"*",IF(RC[21]=32,"",RC[21])) -> - | AE27: =RC[-28] -> 24 | AF27: =RC[-28] -> 169.56985499999999 | AG27: =RC[-28] -> 65.58963 | AH27: =RC[-28] -> 8.0029109999999992 | AI27: =RC[-28] -> 152.00370799999999 | AJ27: =RC[-28] -> 48.207664000000001 | AK27: =RC[-28] -> 5.8057889999999999 | AL27: =RC[-28] -> 17.381965999999998 | AM27: =RC[-28] -> 17.566133000000001 | AN27: =RC[-28] -> 11.155177 | AO27: =RC[-28] -> 65.194061000000005 | AP27: - | AQ27: =RC[-29] -> 3.0275110000000001 | AR27: =RC[-29] -> 63.157688 | AS27: - | AT27: =RC[-30] -> 2.0363730000000047 | AU27: =RC[-30] -> 14.182688000000001 | AV27: =RC[-30] -> 0.90163499999999996 | AW27: =RC[-30] -> 3.8021820000000002 | AY27: - | AZ27: - | BA27: -
A28: =IF(RC[1]="","",DATEVALUE(RC[1])) -> 43380 | B28: 07.10.18 | C28: 24 | D28: 172.274002 | E28: 65.866905000000003 | F28: 7.9763719999999996 | G28: 153.13691700000001 | H28: 48.392795999999997 | I28: 5.7533310000000002 | J28: =RC[-5]-RC[-2] -> 17.474109000000006 | K28: 19.137067999999999 | L28: 12.188411 | M28: 65.382698000000005 | N28: 3.5513219999999999 | O28: 63.648108999999998 | P28: =IF(AND(ISNUMBER(RC[-3]),ISNUMBER(RC[-1])),RC[-3]-RC[-1],"-") -> 1.7345890000000068 | Q28: 15.739732999999999 | R28: 1.0040800000000001 | S28: 3.9446629999999998 | T28: =(RC[-16]*RC[-15]-RC[-13]*RC[-12])/1000 -> 3.9364317392538779 | U28: 11.951983999999999 | V28: 3.4857200000000002 | W28: =RC[-2]*RC[-10]/1000 -> 0.78145296037283207 | X28: =ABS((RC[-3]*RC[-11]-RC[-2]*RC[-9])/1000) -> 0.55959347386935199 | Y28: =(RC[-14]-RC[1])/RC[-18]*100 -> 2.4157231792775344 | Z28: =RC[-5]+RC[-4] -> 15.437704 | AC28: =VALUE(RC[-27]) -> 2018-10-07T00:00:00.000 | AD28: =IF(RC[21]=42,"*",IF(RC[21]=32,"",RC[21])) -> - | AE28: =RC[-28] -> 24 | AF28: =RC[-28] -> 172.274002 | AG28: =RC[-28] -> 65.866905000000003 | AH28: =RC[-28] -> 7.9763719999999996 | AI28: =RC[-28] -> 153.13691700000001 | AJ28: =RC[-28] -> 48.392795999999997 | AK28: =RC[-28] -> 5.7533310000000002 | AL28: =RC[-28] -> 17.474109000000006 | AM28: =RC[-28] -> 19.137067999999999 | AN28: =RC[-28] -> 12.188411 | AO28: =RC[-28] -> 65.382698000000005 | AP28: - | AQ28: =RC[-29] -> 3.5513219999999999 | AR28: =RC[-29] -> 63.648108999999998 | AS28: - | AT28: =RC[-30] -> 1.7345890000000068 | AU28: =RC[-30] -> 15.739732999999999 | AV28: =RC[-30] -> 1.0040800000000001 | AW28: =RC[-30] -> 3.9446629999999998 | AY28: - | AZ28: - | BA28: -
A29: =IF(RC[1]="","",DATEVALUE(RC[1])) -> 43381 | B29: 08.10.18 | C29: 24 | D29: 178.247635 | E29: 65.907218999999998 | F29: 7.9097660000000003 | G29: 158.21940599999999 | H29: 48.538715000000003 | I29: 5.6881180000000002 | J29: =RC[-5]-RC[-2] -> 17.368503999999994 | K29: 20.028210000000001 | L29: 12.806343999999999 | M29: 65.384529000000001 | N29: 3.368099 | O29: 63.394168999999998 | P29: =IF(AND(ISNUMBER(RC[-3]),ISNUMBER(RC[-1])),RC[-3]-RC[-1],"-") -> 1.9903600000000026 | Q29: 16.174443 | R29: 1.031482 | S29: 4.076581 | T29: =(RC[-16]*RC[-15]-RC[-13]*RC[-12])/1000 -> 4.0680392608737748 | U29: 12.557905 | V29: 3.3063370000000001 | W29: =RC[-2]*RC[-10]/1000 -> 0.82109270365174492 | X29: =ABS((RC[-3]*RC[-11]-RC[-2]*RC[-9])/1000) -> 0.61149021710279194 | Y29: =(RC[-14]-RC[1])/RC[-18]*100 -> 2.631768191570635 | Z29: =RC[-5]+RC[-4] -> 15.864242000000001 | AC29: =VALUE(RC[-27]) -> 2018-10-08T00:00:00.000 | AD29: =IF(RC[21]=42,"*",IF(RC[21]=32,"",RC[21])) -> - | AE29: =RC[-28] -> 24 | AF29: =RC[-28] -> 178.247635 | AG29: =RC[-28] -> 65.907218999999998 | AH29: =RC[-28] -> 7.9097660000000003 | AI29: =RC[-28] -> 158.21940599999999 | AJ29: =RC[-28] -> 48.538715000000003 | AK29: =RC[-28] -> 5.6881180000000002 | AL29: =RC[-28] -> 17.368503999999994 | AM29: =RC[-28] -> 20.028210000000001 | AN29: =RC[-28] -> 12.806343999999999 | AO29: =RC[-28] -> 65.384529000000001 | AP29: - | AQ29: =RC[-29] -> 3.368099 | AR29: =RC[-29] -> 63.394168999999998 | AS29: - | AT29: =RC[-30] -> 1.9903600000000026 | AU29: =RC[-30] -> 16.174443 | AV29: =RC[-30] -> 1.031482 | AW29: =RC[-30] -> 4.076581 | AY29: - | AZ29: - | BA29: -
A30: =IF(RC[1]="","",DATEVALUE(RC[1])) -> 43382 | B30: 09.10.18 | C30: 24 | D30: 185.38919100000001 | E30: 65.827079999999995 | F30: 7.9031989999999999 | G30: 166.62686199999999 | H30: 49.363590000000002 | I30: 5.7422950000000004 | J30: =RC[-5]-RC[-2] -> 16.463489999999993 | K30: 18.762322999999999 | L30: 11.07291 | M30: 65.472504000000001 | N30: 3.8451780000000002 | O30: 63.794055999999998 | P30: =IF(AND(ISNUMBER(RC[-3]),ISNUMBER(RC[-1])),RC[-3]-RC[-1],"-") -> 1.678448000000003 | Q30: 14.918087999999999 | R30: 0.95233900000000005 | S30: 3.9869349999999999 | T30: =(RC[-16]*RC[-15]-RC[-13]*RC[-12])/1000 -> 3.9783290083376994 | U30: 10.857547 | V30: 3.7738429999999998 | W30: =RC[-2]*RC[-10]/1000 -> 0.710870789387688 | X30: =ABS((RC[-3]*RC[-11]-RC[-2]*RC[-9])/1000) -> 0.47012203771047995 | Y30: =(RC[-14]-RC[1])/RC[-18]*100 -> 2.4791518908877963 | Z30: =RC[-5]+RC[-4] -> 14.63139 | AC30: =VALUE(RC[-27]) -> 2018-10-09T00:00:00.000 | AD30: =IF(RC[21]=42,"*",IF(RC[21]=32,"",RC[21])) -> - | AE30: =RC[-28] -> 24 | AF30: =RC[-28] -> 185.38919100000001 | AG30: =RC[-28] -> 65.827079999999995 | AH30: =RC[-28] -> 7.9031989999999999 | AI30: =RC[-28] -> 166.62686199999999 | AJ30: =RC[-28] -> 49.363590000000002 | AK30: =RC[-28] -> 5.7422950000000004 | AL30: =RC[-28] -> 16.463489999999993 | AM30: =RC[-28] -> 18.762322999999999 | AN30: =RC[-28] -> 11.07291 | AO30: =RC[-28] -> 65.472504000000001 | AP30: - | AQ30: =RC[-29] -> 3.8451780000000002 | AR30: =RC[-29] -> 63.794055999999998 | AS30: - | AT30: =RC[-30] -> 1.678448000000003 | AU30: =RC[-30] -> 14.918087999999999 | AV30: =RC[-30] -> 0.95233900000000005 | AW30: =RC[-30] -> 3.9869349999999999 | AY30: - | AZ30: - | BA30: -
A31: =IF(RC[1]="","",DATEVALUE(RC[1])) -> 43383 | B31: 10.10.18 | C31: 24 | D31: =AVERAGE(R[1]C:R[3]C) -> 188.14711033333333 | E31: =AVERAGE(R[1]C:R[3]C) -> 68.096827333333337 | F31: =AVERAGE(R[1]C:R[3]C) -> 7.9334696666666673 | G31: =AVERAGE(R[1]C:R[3]C) -> 170.51921566666667 | H31: =AVERAGE(R[1]C:R[3]C) -> 51.102128 | I31: =AVERAGE(R[1]C:R[3]C) -> 5.6370676666666668 | J31: =AVERAGE(R[1]C:R[3]C) -> 16.994699333333333 | K31: =AVERAGE(R[1]C:R[3]C) -> 17.627878999999997 | L31: =AVERAGE(R[1]C:R[3]C) -> 10.424477 | M31: =AVERAGE(R[1]C:R[3]C) -> 67.55219266666667 | N31: =AVERAGE(R[1]C:R[3]C) -> 3.2296849999999999 | O31: =AVERAGE(R[1]C:R[3]C) -> 65.630114333333324 | P31: =AVERAGE(R[1]C:R[3]C) -> 1.9220783333333411 | Q31: =AVERAGE(R[1]C:R[3]C) -> 13.654161999999999 | R31: =AVERAGE(R[1]C:R[3]C) -> 0.89821666666666655 | S31: 4.1801209999999998 | T31: =(RC[-16]*RC[-15]-RC[-13]*RC[-12])/1000 -> 4.0983265001770102 | U31: 11.376554 | V31: 3.7488450000000002 | W31: =RC[-2]*RC[-10]/1000 -> 0.76851116769073735 | X31: =ABS((RC[-3]*RC[-11]-RC[-2]*RC[-9])/1000) -> 0.52247404172279244 | Y31: =(RC[-14]-RC[1])/RC[-18]*100 -> 1.4675648079990455 | Z31: =RC[-5]+RC[-4] -> 15.125399000000002 | AC31: =VALUE(RC[-27]) -> 2018-10-10T00:00:00.000 | AD31: =IF(RC[21]=42,"*",IF(RC[21]=32,"",RC[21])) -> - | AE31: =RC[-28] -> 24 | AF31: =RC[-28] -> 188.14711033333333 | AG31: =RC[-28] -> 68.096827333333337 | AH31: =RC[-28] -> 7.9334696666666673 | AI31: =RC[-28] -> 170.51921566666667 | AJ31: =RC[-28] -> 51.102128 | AK31: =RC[-28] -> 5.6370676666666668 | AL31: =RC[-28] -> 16.994699333333333 | AM31: =RC[-28] -> 17.627878999999997 | AN31: =RC[-28] -> 10.424477 | AO31: =RC[-28] -> 67.55219266666667 | AP31: - | AQ31: =RC[-29] -> 3.2296849999999999 | AR31: =RC[-29] -> 65.630114333333324 | AS31: - | AT31: =RC[-30] -> 1.9220783333333411 | AU31: =RC[-30] -> 13.654161999999999 | AV31: =RC[-30] -> 0.89821666666666655 | AW31: =RC[-30] -> 4.1801209999999998 | AY31: - | AZ31: - | BA31: -
A32: =IF(RC[1]="","",DATEVALUE(RC[1])) -> 43384 | B32: 11.10.18 | C32: 24 | D32: 187.898392 | E32: 67.834525999999997 | F32: 7.9289810000000003 | G32: 170.677032 | H32: 50.894072999999999 | I32: 5.642614 | J32: =RC[-5]-RC[-2] -> 16.940452999999998 | K32: 17.221333000000001 | L32: 10.055877000000001 | M32: 67.220680000000002 | N32: 3.260278 | O32: 65.395461999999995 | P32: =IF(AND(ISNUMBER(RC[-3]),ISNUMBER(RC[-1])),RC[-3]-RC[-1],"-") -> 1.8252180000000067 | Q32: 13.316155 | R32: 0.87189399999999995 | S32: 4.0690039999999996 | T32: =(RC[-16]*RC[-15]-RC[-13]*RC[-12])/1000 -> 4.0595490314508549 | U32: 9.8506309999999999 | V32: 3.1969720000000001 | W32: =RC[-2]*RC[-10]/1000 -> 0.66216611424908001 | X32: =ABS((RC[-3]*RC[-11]-RC[-2]*RC[-9])/1000) -> 0.45309865330801602 | Y32: =(RC[-14]-RC[1])/RC[-18]*100 -> 2.4453964022528822 | Z32: =RC[-5]+RC[-4] -> 13.047603000000001 | AC32: =VALUE(RC[-27]) -> 2018-10-11T00:00:00.000 | AD32: =IF(RC[21]=42,"*",IF(RC[21]=32,"",RC[21])) -> - | AE32: =RC[-28] -> 24 | AF32: =RC[-28] -> 187.898392 | AG32: =RC[-28] -> 67.834525999999997 | AH32: =RC[-28] -> 7.9289810000000003 | AI32: =RC[-28] -> 170.677032 | AJ32: =RC[-28] -> 50.894072999999999 | AK32: =RC[-28] -> 5.642614 | AL32: =RC[-28] -> 16.940452999999998 | AM32: =RC[-28] -> 17.221333000000001 | AN32: =RC[-28] -> 10.055877000000001 | AO32: =RC[-28] -> 67.220680000000002 | AP32: - | AQ32: =RC[-29] -> 3.260278 | AR32: =RC[-29] -> 65.395461999999995 | AS32: - | AT32: =RC[-30] -> 1.8252180000000067 | AU32: =RC[-30] -> 13.316155 | AV32: =RC[-30] -> 0.87189399999999995 | AW32: =RC[-30] -> 4.0690039999999996 | AY32: - | AZ32: - | BA32: -
A33: =IF(RC[1]="","",DATEVALUE(RC[1])) -> 43385 | B33: 12.10.18 | C33: 24 | D33: 188.20039399999999 | E33: 67.723877000000002 | F33: 7.9279609999999998 | G33: 170.37184099999999 | H33: 50.740425000000002 | I33: 5.641839 | J33: =RC[-5]-RC[-2] -> 16.983452 | K33: 17.828565999999999 | L33: 10.746765 | M33: 67.143814000000006 | N33: 3.1681219999999999 | O33: 65.114654999999999 | P33: =IF(AND(ISNUMBER(RC[-3]),ISNUMBER(RC[-1])),RC[-3]-RC[-1],"-") -> 2.029159000000007 | Q33: 13.914887 | R33: 0.90989200000000003 | S33: 4.1103940000000003 | T33: =(RC[-16]*RC[-15]-RC[-13]*RC[-12])/1000 -> 4.1009207142351114 | U33: 10.527881000000001 | V33: 3.1070980000000001 | W33: =RC[-2]*RC[-10]/1000 -> 0.7068820836781341 | X33: =ABS((RC[-3]*RC[-11]-RC[-2]*RC[-9])/1000) -> 0.5045644693569441 | Y33: =(RC[-14]-RC[1])/RC[-18]*100 -> 2.4614319921564958 | Z33: =RC[-5]+RC[-4] -> 13.634979000000001 | AC33: =VALUE(RC[-27]) -> 2018-10-12T00:00:00.000 | AD33: =IF(RC[21]=42,"*",IF(RC[21]=32,"",RC[21])) -> - | AE33: =RC[-28] -> 24 | AF33: =RC[-28] -> 188.20039399999999 | AG33: =RC[-28] -> 67.723877000000002 | AH33: =RC[-28] -> 7.9279609999999998 | AI33: =RC[-28] -> 170.37184099999999 | AJ33: =RC[-28] -> 50.740425000000002 | AK33: =RC[-28] -> 5.641839 | AL33: =RC[-28] -> 16.983452 | AM33: =RC[-28] -> 17.828565999999999 | AN33: =RC[-28] -> 10.746765 | AO33: =RC[-28] -> 67.143814000000006 | AP33: - | AQ33: =RC[-29] -> 3.1681219999999999 | AR33: =RC[-29] -> 65.114654999999999 | AS33: - | AT33: =RC[-30] -> 2.029159000000007 | AU33: =RC[-30] -> 13.914887 | AV33: =RC[-30] -> 0.90989200000000003 | AW33: =RC[-30] -> 4.1103940000000003 | AY33: - | AZ33: - | BA33: -
A34: =IF(RC[1]="","",DATEVALUE(RC[1])) -> 43386 | B34: 13.10.18 | C34: 24 | D34: 188.342545 | E34: 68.732078999999999 | F34: 7.9434670000000001 | G34: 170.50877399999999 | H34: 51.671886000000001 | I34: 5.6267500000000004 | J34: =RC[-5]-RC[-2] -> 17.060192999999998 | K34: 17.833738 | L34: 10.470789 | M34: 68.292084000000003 | N34: 3.2606549999999999 | O34: 66.380225999999993 | P34: =IF(AND(ISNUMBER(RC[-3]),ISNUMBER(RC[-1])),RC[-3]-RC[-1],"-") -> 1.9118580000000094 | Q34: 13.731444 | R34: 0.91286400000000001 | S34: 4.1444510000000001 | T34: =(RC[-16]*RC[-15]-RC[-13]*RC[-12])/1000 -> 4.1346647498732914 | U34: 10.2508 | V34: 3.1955879999999999 | W34: =RC[-2]*RC[-10]/1000 -> 0.70004849466719998 | X34: =ABS((RC[-3]*RC[-11]-RC[-2]*RC[-9])/1000) -> 0.48792464102431199 | Y34: =(RC[-14]-RC[1])/RC[-18]*100 -> 2.573093394009156 | Z34: =RC[-5]+RC[-4] -> 13.446387999999999 | AC34: =VALUE(RC[-27]) -> 2018-10-13T00:00:00.000 | AD34: =IF(RC[21]=42,"*",IF(RC[21]=32,"",RC[21])) -> - | AE34: =RC[-28] -> 24 | AF34: =RC[-28] -> 188.342545 | AG34: =RC[-28] -> 68.732078999999999 | AH34: =RC[-28] -> 7.9434670000000001 | AI34: =RC[-28] -> 170.50877399999999 | AJ34: =RC[-28] -> 51.671886000000001 | AK34: =RC[-28] -> 5.6267500000000004 | AL34: =RC[-28] -> 17.060192999999998 | AM34: =RC[-28] -> 17.833738 | AN34: =RC[-28] -> 10.470789 | AO34: =RC[-28] -> 68.292084000000003 | AP34: - | AQ34: =RC[-29] -> 3.2606549999999999 | AR34: =RC[-29] -> 66.380225999999993 | AS34: - | AT34: =RC[-30] -> 1.9118580000000094 | AU34: =RC[-30] -> 13.731444 | AV34: =RC[-30] -> 0.91286400000000001 | AW34: =RC[-30] -> 4.1444510000000001 | AY34: - | AZ34: - | BA34: -
A35: =IF(RC[1]="","",DATEVALUE(RC[1])) -> 43387 | B35: 14.10.18 | C35: 24 | D35: 190.34754899999999 | E35: 69.512123000000003 | F35: 7.9414410000000002 | G35: 170.36885100000001 | H35: 52.580196000000001 | I35: 5.6096370000000002 | J35: =RC[-5]-RC[-2] -> 16.931927000000002 | K35: 19.978672 | L35: 12.269443000000001 | M35: 69.161841999999993 | N35: 3.6416110000000002 | O35: 67.437790000000007 | P35: =IF(AND(ISNUMBER(RC[-3]),ISNUMBER(RC[-1])),RC[-3]-RC[-1],"-") -> 1.7240519999999862 | Q35: 15.911054 | R35: 1.0716829999999999 | S35: 4.2836189999999998 | T35: =(RC[-16]*RC[-15]-RC[-13]*RC[-12])/1000 -> 4.2734346609617297 | U35: 12.005644999999999 | V35: 3.566802 | W35: =RC[-2]*RC[-10]/1000 -> 0.83033252259808987 | X35: =ABS((RC[-3]*RC[-11]-RC[-2]*RC[-9])/1000) -> 0.58979527835050982 | Y35: =(RC[-14]-RC[1])/RC[-18]*100 -> 2.5862855646071119 | Z35: =RC[-5]+RC[-4] -> 15.572447 | AC35: =VALUE(RC[-27]) -> 2018-10-14T00:00:00.000 | AD35: =IF(RC[21]=42,"*",IF(RC[21]=32,"",RC[21])) -> - | AE35: =RC[-28] -> 24 | AF35: =RC[-28] -> 190.34754899999999 | AG35: =RC[-28] -> 69.512123000000003 | AH35: =RC[-28] -> 7.9414410000000002 | AI35: =RC[-28] -> 170.36885100000001 | AJ35: =RC[-28] -> 52.580196000000001 | AK35: =RC[-28] -> 5.6096370000000002 | AL35: =RC[-28] -> 16.931927000000002 | AM35: =RC[-28] -> 19.978672 | AN35: =RC[-28] -> 12.269443000000001 | AO35: =RC[-28] -> 69.161841999999993 | AP35: - | AQ35: =RC[-29] -> 3.6416110000000002 | AR35: =RC[-29] -> 67.437790000000007 | AS35: - | AT35: =RC[-30] -> 1.7240519999999862 | AU35: =RC[-30] -> 15.911054 | AV35: =RC[-30] -> 1.0716829999999999 | AW35: =RC[-30] -> 4.2836189999999998 | AY35: - | AZ35: - | BA35: -
A36: =IF(RC[1]="","",DATEVALUE(RC[1])) -> 43388 | B36: 15.10.18 | C36: 24 | D36: 188.92047099999999 | E36: 69.052368000000001 | F36: 7.9394580000000001 | G36: 170.38816800000001 | H36: 52.676116999999998 | I36: 5.6023810000000003 | J36: =RC[-5]-RC[-2] -> 16.376251000000003 | K36: 18.532285999999999 | L36: 11.077299 | M36: 68.512032000000005 | N36: 3.1535000000000002 | O36: 66.587463 | P36: =IF(AND(ISNUMBER(RC[-3]),ISNUMBER(RC[-1])),RC[-3]-RC[-1],"-") -> 1.9245690000000053 | Q36: 14.230798999999999 | R36: 0.94937800000000006 | S36: 4.0800169999999998 | T36: =(RC[-16]*RC[-15]-RC[-13]*RC[-12])/1000 -> 4.0700188132416715 | U36: 10.843203000000001 | V36: 3.090201 | W36: =RC[-2]*RC[-10]/1000 -> 0.74288987091849601 | X36: =ABS((RC[-3]*RC[-11]-RC[-2]*RC[-9])/1000) -> 0.53712122616843305 | Y36: =(RC[-14]-RC[1])/RC[-18]*100 -> 2.6990618268752073 | Z36: =RC[-5]+RC[-4] -> 13.933404000000001 | AC36: =VALUE(RC[-27]) -> 2018-10-15T00:00:00.000 | AD36: =IF(RC[21]=42,"*",IF(RC[21]=32,"",RC[21])) -> - | AE36: =RC[-28] -> 24 | AF36: =RC[-28] -> 188.92047099999999 | AG36: =RC[-28] -> 69.052368000000001 | AH36: =RC[-28] -> 7.9394580000000001 | AI36: =RC[-28] -> 170.38816800000001 | AJ36: =RC[-28] -> 52.676116999999998 | AK36: =RC[-28] -> 5.6023810000000003 | AL36: =RC[-28] -> 16.376251000000003 | AM36: =RC[-28] -> 18.532285999999999 | AN36: =RC[-28] -> 11.077299 | AO36: =RC[-28] -> 68.512032000000005 | AP36: - | AQ36: =RC[-29] -> 3.1535000000000002 | AR36: =RC[-29] -> 66.587463 | AS36: - | AT36: =RC[-30] -> 1.9245690000000053 | AU36: =RC[-30] -> 14.230798999999999 | AV36: =RC[-30] -> 0.94937800000000006 | AW36: =RC[-30] -> 4.0800169999999998 | AY36: - | AZ36: - | BA36: -
A37: =IF(RC[1]="","",DATEVALUE(RC[1])) -> 43389 | B37: 16.10.18 | C37: 24 | D37: 187.872086 | E37: 69.076424000000003 | F37: 7.9507320000000004 | G37: 170.930511 | H37: 52.698543999999998 | I37: 5.6067369999999999 | J37: =RC[-5]-RC[-2] -> 16.377880000000005 | K37: 16.941568 | L37: 9.5827539999999996 | M37: 68.538246000000001 | N37: 3.2753109999999999 | O37: 66.567238000000003 | P37: =IF(AND(ISNUMBER(RC[-3]),ISNUMBER(RC[-1])),RC[-3]-RC[-1],"-") -> 1.9710079999999977 | Q37: 12.858065 | R37: 0.85719599999999996 | S37: 3.9796779999999998 | T37: =(RC[-16]*RC[-15]-RC[-13]*RC[-12])/1000 -> 3.9697428154244809 | U37: 9.3800950000000007 | V37: 3.2096 | W37: =RC[-2]*RC[-10]/1000 -> 0.64289525861337005 | X37: =ABS((RC[-3]*RC[-11]-RC[-2]*RC[-9])/1000) -> 0.42924105152857006 | Y37: =(RC[-14]-RC[1])/RC[-18]*100 -> 2.5459895805260886 | Z37: =RC[-5]+RC[-4] -> 12.589695000000001 | AC37: =VALUE(RC[-27]) -> 2018-10-16T00:00:00.000 | AD37: =IF(RC[21]=42,"*",IF(RC[21]=32,"",RC[21])) -> - | AE37: =RC[-28] -> 24 | AF37: =RC[-28] -> 187.872086 | AG37: =RC[-28] -> 69.076424000000003 | AH37: =RC[-28] -> 7.9507320000000004 | AI37: =RC[-28] -> 170.930511 | AJ37: =RC[-28] -> 52.698543999999998 | AK37: =RC[-28] -> 5.6067369999999999 | AL37: =RC[-28] -> 16.377880000000005 | AM37: =RC[-28] -> 16.941568 | AN37: =RC[-28] -> 9.5827539999999996 | AO37: =RC[-28] -> 68.538246000000001 | AP37: - | AQ37: =RC[-29] -> 3.2753109999999999 | AR37: =RC[-29] -> 66.567238000000003 | AS37: - | AT37: =RC[-30] -> 1.9710079999999977 | AU37: =RC[-30] -> 12.858065 | AV37: =RC[-30] -> 0.85719599999999996 | AW37: =RC[-30] -> 3.9796779999999998 | AY37: - | AZ37: - | BA37: -
A38: =IF(RC[1]="","",DATEVALUE(RC[1])) -> 43390 | B38: 17.10.18 | C38: 24 | D38: 188.48719800000001 | E38: 69.214111000000003 | F38: 7.9698549999999999 | G38: 171.10171500000001 | H38: 52.959727999999998 | I38: 5.6046459999999998 | J38: =RC[-5]-RC[-2] -> 16.254383000000004 | K38: 17.385490000000001 | L38: 9.3460219999999996 | M38: 68.673546000000002 | N38: 3.323566 | O38: 66.777122000000006 | P38: =IF(AND(ISNUMBER(RC[-3]),ISNUMBER(RC[-1])),RC[-3]-RC[-1],"-") -> 1.8964239999999961 | Q38: 12.669587999999999 | R38: 0.846302 | S38: 3.994551 | T38: =(RC[-16]*RC[-15]-RC[-13]*RC[-12])/1000 -> 3.9844735577174579 | U38: 9.1476520000000008 | V38: 3.2565149999999998 | W38: =RC[-2]*RC[-10]/1000 -> 0.62820170041399204 | X38: =ABS((RC[-3]*RC[-11]-RC[-2]*RC[-9])/1000) -> 0.41074100096416205 | Y38: =(RC[-14]-RC[1])/RC[-18]*100 -> 2.9113226597407276 | Z38: =RC[-5]+RC[-4] -> 12.404167000000001 | AC38: =VALUE(RC[-27]) -> 2018-10-17T00:00:00.000 | AD38: =IF(RC[21]=42,"*",IF(RC[21]=32,"",RC[21])) -> - | AE38: =RC[-28] -> 24 | AF38: =RC[-28] -> 188.48719800000001 | AG38: =RC[-28] -> 69.214111000000003 | AH38: =RC[-28] -> 7.9698549999999999 | AI38: =RC[-28] -> 171.10171500000001 | AJ38: =RC[-28] -> 52.959727999999998 | AK38: =RC[-28] -> 5.6046459999999998 | AL38: =RC[-28] -> 16.254383000000004 | AM38: =RC[-28] -> 17.385490000000001 | AN38: =RC[-28] -> 9.3460219999999996 | AO38: =RC[-28] -> 68.673546000000002 | AP38: - | AQ38: =RC[-29] -> 3.323566 | AR38: =RC[-29] -> 66.777122000000006 | AS38: - | AT38: =RC[-30] -> 1.8964239999999961 | AU38: =RC[-30] -> 12.669587999999999 | AV38: =RC[-30] -> 0.846302 | AW38: =RC[-30] -> 3.994551 | AY38: - | AZ38: - | BA38: -
A39: =IF(RC[1]="","",DATEVALUE(RC[1])) -> 43391 | B39: 18.10.18 | C39: 24 | D39: 189.88192699999999 | E39: 69.697158999999999 | F39: 7.9632560000000003 | G39: 172.13653600000001 | H39: 53.141029000000003 | I39: 5.6022660000000002 | J39: 16.556129999999996 | K39: 17.745446999999999 | L39: 10.650888 | M39: 69.320053000000001 | N39: 3.082789 | O39: 67.228522999999996 | P39: 2.0915300000000059 | Q39: 13.733677 | R39: 0.92609399999999997 | S39: 4.0969199999999999 | T39: 4.0867182058098477 | U39: 10.420923 | V39: 3.0198079999999998 | W39: 0.722378934668919 | X39: 0.51936170308533491 | Y39: 2.5007567248826237 | Z39: 13.440731 | AC39: =VALUE(RC[-27]) -> 2018-10-18T00:00:00.000 | AD39: =IF(RC[21]=42,"*",IF(RC[21]=32,"",RC[21])) ->  | AE39: =RC[-28] -> 24 | AF39: =RC[-28] -> 189.88192699999999 | AG39: =RC[-28] -> 69.697158999999999 | AH39: =RC[-28] -> 7.9632560000000003 | AI39: =RC[-28] -> 172.13653600000001 | AJ39: =RC[-28] -> 53.141029000000003 | AK39: =RC[-28] -> 5.6022660000000002 | AL39: =RC[-28] -> 16.556129999999996 | AM39: =RC[-28] -> 17.745446999999999 | AN39: =RC[-28] -> 10.650888 | AO39: =RC[-28] -> 69.320053000000001 | AP39: - | AQ39: =RC[-29] -> 3.082789 | AR39: =RC[-29] -> 67.228522999999996 | AS39: - | AT39: =RC[-30] -> 2.0915300000000059 | AU39: =RC[-30] -> 13.733677 | AV39: =RC[-30] -> 0.92609399999999997 | AW39: =RC[-30] -> 4.0969199999999999
A40: =IF(RC[1]="","",DATEVALUE(RC[1])) -> 43392 | B40: 19.10.18 | C40: 24 | D40: 190.79800399999999 | E40: 69.551956000000004 | F40: 7.9585229999999996 | G40: 171.436172 | H40: 52.625309000000001 | I40: 5.6129660000000001 | J40: 16.926647000000003 | K40: 19.361820000000002 | L40: 11.2805 | M40: 69.038253999999995 | N40: 4.0869770000000001 | O40: 67.277252000000004 | P40: 1.7610019999999906 | Q40: 15.367476999999999 | R40: 1.0322100000000001 | S40: 4.2586769999999996 | T40: 4.2484928538186759 | U40: 11.038745 | V40: 4.0033789999999998 | W40: 0.76209568115122994 | X40: 0.492759343316722 | Y40: 2.5197109510821325 | Z40: 15.042124000000001 | AC40: =VALUE(RC[-27]) -> 2018-10-19T00:00:00.000 | AD40: =IF(RC[21]=42,"*",IF(RC[21]=32,"",RC[21])) ->  | AE40: =RC[-28] -> 24 | AF40: =RC[-28] -> 190.79800399999999 | AG40: =RC[-28] -> 69.551956000000004 | AH40: =RC[-28] -> 7.9585229999999996 | AI40: =RC[-28] -> 171.436172 | AJ40: =RC[-28] -> 52.625309000000001 | AK40: =RC[-28] -> 5.6129660000000001 | AL40: =RC[-28] -> 16.926647000000003 | AM40: =RC[-28] -> 19.361820000000002 | AN40: =RC[-28] -> 11.2805 | AO40: =RC[-28] -> 69.038253999999995 | AP40: - | AQ40: =RC[-29] -> 4.0869770000000001 | AR40: =RC[-29] -> 67.277252000000004 | AS40: - | AT40: =RC[-30] -> 1.7610019999999906 | AU40: =RC[-30] -> 15.367476999999999 | AV40: =RC[-30] -> 1.0322100000000001 | AW40: =RC[-30] -> 4.2586769999999996
A41: =IF(RC[1]="","",DATEVALUE(RC[1])) -> 43393 | B41: 20.10.18 | C41: 24 | D41: 190.27027899999999 | E41: 68.912750000000003 | F41: 7.960553 | G41: 172.005707 | H41: 52.024807000000003 | I41: 5.612285 | J41: 16.887943 | K41: 18.264555000000001 | L41: 10.646477000000001 | M41: 68.400542999999999 | N41: 3.5926100000000001 | O41: 66.709900000000005 | P41: 1.6906429999999943 | Q41: 14.239087 | R41: 0.94842700000000002 | S41: 4.1734679999999997 | T41: 4.1634844595837004 | U41: 10.422124999999999 | V41: 3.520257 | W41: 0.71287900921387493 | X41: 0.47804301676957495 | Y41: 2.5128079035191564 | Z41: 13.942381999999998 | AC41: =VALUE(RC[-27]) -> 2018-10-20T00:00:00.000 | AD41: =IF(RC[21]=42,"*",IF(RC[21]=32,"",RC[21])) ->  | AE41: =RC[-28] -> 24 | AF41: =RC[-28] -> 190.27027899999999 | AG41: =RC[-28] -> 68.912750000000003 | AH41: =RC[-28] -> 7.960553 | AI41: =RC[-28] -> 172.005707 | AJ41: =RC[-28] -> 52.024807000000003 | AK41: =RC[-28] -> 5.612285 | AL41: =RC[-28] -> 16.887943 | AM41: =RC[-28] -> 18.264555000000001 | AN41: =RC[-28] -> 10.646477000000001 | AO41: =RC[-28] -> 68.400542999999999 | AP41: - | AQ41: =RC[-29] -> 3.5926100000000001 | AR41: =RC[-29] -> 66.709900000000005 | AS41: - | AT41: =RC[-30] -> 1.6906429999999943 | AU41: =RC[-30] -> 14.239087 | AV41: =RC[-30] -> 0.94842700000000002 | AW41: =RC[-30] -> 4.1734679999999997
A42: =IF(RC[1]="","",DATEVALUE(RC[1])) -> 43394 | B42: 21.10.18 | C42: 24 | D42: 192.92953499999999 | E42: 68.047004999999999 | F42: 7.9396440000000004 | G42: 171.29191599999999 | H42: 51.418785 | I42: 5.6190389999999999 | J42: 16.628219999999999 | K42: 21.637608 | L42: 13.782321 | M42: 67.540558000000004 | N42: 3.8629669999999998 | O42: 65.940742 | P42: 1.5998160000000041 | Q42: 17.645288000000001 | R42: 1.162285 | S42: 4.3307169999999999 | T42: 4.3206548317506153 | U42: 13.498562 | V42: 3.7867959999999998 | W42: 0.91170040967759602 | X42: 0.66199627163496388 | Y42: 2.540837945907501 | Z42: 17.285357999999999 | AC42: =VALUE(RC[-27]) -> 2018-10-21T00:00:00.000 | AD42: =IF(RC[21]=42,"*",IF(RC[21]=32,"",RC[21])) ->  | AE42: =RC[-28] -> 24 | AF42: =RC[-28] -> 192.92953499999999 | AG42: =RC[-28] -> 68.047004999999999 | AH42: =RC[-28] -> 7.9396440000000004 | AI42: =RC[-28] -> 171.29191599999999 | AJ42: =RC[-28] -> 51.418785 | AK42: =RC[-28] -> 5.6190389999999999 | AL42: =RC[-28] -> 16.628219999999999 | AM42: =RC[-28] -> 21.637608 | AN42: =RC[-28] -> 13.782321 | AO42: =RC[-28] -> 67.540558000000004 | AP42: - | AQ42: =RC[-29] -> 3.8629669999999998 | AR42: =RC[-29] -> 65.940742 | AS42: - | AT42: =RC[-30] -> 1.5998160000000041 | AU42: =RC[-30] -> 17.645288000000001 | AV42: =RC[-30] -> 1.162285 | AW42: =RC[-30] -> 4.3307169999999999
A43: =IF(RC[1]="","",DATEVALUE(RC[1])) -> 43395 | B43: 22.10.18 | C43: 24 | D43: 189.94998200000001 | E43: 68.459671 | F43: 7.9338730000000002 | G43: 170.44059799999999 | H43: 51.642918000000002 | I43: 5.6297899999999998 | J43: 16.816752999999999 | K43: 19.509377000000001 | L43: 11.864243999999999 | M43: 68.080230999999998 | N43: 3.6869879999999999 | O43: 66.248527999999993 | P43: 1.8317030000000045 | Q43: 15.551232000000001 | R43: 1.031021 | S43: 4.211627 | T43: 4.2018634477909584 | U43: 11.616363 | V43: 3.6136789999999999 | W43: 0.7908446764198529 | X43: 0.55144376200534095 | Y43: 2.5107486421750305 | Z43: 15.230041999999999 | AC43: =VALUE(RC[-27]) -> 2018-10-22T00:00:00.000 | AD43: =IF(RC[21]=42,"*",IF(RC[21]=32,"",RC[21])) ->  | AE43: =RC[-28] -> 24 | AF43: =RC[-28] -> 189.94998200000001 | AG43: =RC[-28] -> 68.459671 | AH43: =RC[-28] -> 7.9338730000000002 | AI43: =RC[-28] -> 170.44059799999999 | AJ43: =RC[-28] -> 51.642918000000002 | AK43: =RC[-28] -> 5.6297899999999998 | AL43: =RC[-28] -> 16.816752999999999 | AM43: =RC[-28] -> 19.509377000000001 | AN43: =RC[-28] -> 11.864243999999999 | AO43: =RC[-28] -> 68.080230999999998 | AP43: - | AQ43: =RC[-29] -> 3.6869879999999999 | AR43: =RC[-29] -> 66.248527999999993 | AS43: - | AT43: =RC[-30] -> 1.8317030000000045 | AU43: =RC[-30] -> 15.551232000000001 | AV43: =RC[-30] -> 1.031021 | AW43: =RC[-30] -> 4.211627
A44: =IF(RC[1]="","",DATEVALUE(RC[1])) ->  | C44: 24 | J44: =RC[-5]-RC[-2] -> #VALUE! | P44: =IF(AND(ISNUMBER(RC[-3]),ISNUMBER(RC[-1])),RC[-3]-RC[-1],"-") -> - | T44: =(RC[-16]*RC[-15]-RC[-13]*RC[-12])/1000 -> #VALUE! | W44: =RC[-2]*RC[-10]/1000 -> #VALUE! | X44: =ABS((RC[-3]*RC[-11]-RC[-2]*RC[-9])/1000) -> #VALUE! | Y44: =(RC[-14]-RC[1])/RC[-18]*100 -> #VALUE! | Z44: =RC[-5]+RC[-4] -> #VALUE! | AC44: =VALUE(RC[-27]) -> #VALUE! | AD44: =IF(RC[21]=42,"*",IF(RC[21]=32,"",RC[21])) ->  | AE44: =RC[-28] -> 24 | AF44: =RC[-28] ->  | AG44: =RC[-28] ->  | AH44: =RC[-28] ->  | AI44: =RC[-28] ->  | AJ44: =RC[-28] ->  | AK44: =RC[-28] ->  | AL44: =RC[-28] -> #VALUE! | AM44: =RC[-28] ->  | AN44: =RC[-28] ->  | AO44: =RC[-28] ->  | AP44: - | AQ44: =RC[-29] ->  | AR44: =RC[-29] ->  | AS44: - | AT44: =RC[-30] -> - | AU44: =RC[-30] ->  | AV44: =RC[-30] ->  | AW44: =RC[-30] -> 
A45: =IF(RC[1]="","",DATEVALUE(RC[1])) ->  | C45: 24 | P45: =IF(AND(ISNUMBER(RC[-3]),ISNUMBER(RC[-1])),RC[-3]-RC[-1],"-") -> - | T45: =(RC[-16]*RC[-15]-RC[-13]*RC[-12])/1000 -> #VALUE! | W45: =RC[-2]*RC[-10]/1000 -> #VALUE! | X45: =ABS((RC[-3]*RC[-11]-RC[-2]*RC[-9])/1000) -> #VALUE! | Y45: =(RC[-14]-RC[1])/RC[-18]*100 -> #VALUE! | Z45: =RC[-5]+RC[-4] -> #VALUE! | AC45: =VALUE(RC[-27]) -> #VALUE! | AD45: =IF(RC[21]=42,"*",IF(RC[21]=32,"",RC[21])) ->  | AE45: =RC[-28] -> 24 | AF45: =RC[-28] ->  | AG45: =RC[-28] ->  | AH45: =RC[-28] ->  | AI45: =RC[-28] ->  | AJ45: =RC[-28] ->  | AK45: =RC[-28] ->  | AL45: =RC[-28] -> 0 | AM45: =RC[-28] ->  | AN45: =RC[-28] ->  | AO45: =RC[-28] ->  | AP45: - | AQ45: =RC[-29] ->  | AR45: =RC[-29] ->  | AS45: - | AT45: =RC[-30] -> - | AU45: =RC[-30] ->  | AV45: =RC[-30] ->  | AW45: =RC[-30] -> 
A46: =IF(RC[1]="","",DATEVALUE(RC[1])) ->  | C46: 24 | P46: =IF(AND(ISNUMBER(RC[-3]),ISNUMBER(RC[-1])),RC[-3]-RC[-1],"-") -> - | T46: =(RC[-16]*RC[-15]-RC[-13]*RC[-12])/1000 -> #VALUE! | W46: =RC[-2]*RC[-10]/1000 -> #VALUE! | X46: =ABS((RC[-3]*RC[-11]-RC[-2]*RC[-9])/1000) -> #VALUE! | Y46: =(RC[-14]-RC[1])/RC[-18]*100 -> #VALUE! | Z46: =RC[-5]+RC[-4] -> #VALUE! | AC46: =VALUE(RC[-27]) -> #VALUE! | AD46: =IF(RC[21]=42,"*",IF(RC[21]=32,"",RC[21])) ->  | AE46: =RC[-28] -> 24 | AF46: =RC[-28] ->  | AG46: =RC[-28] ->  | AH46: =RC[-28] ->  | AI46: =RC[-28] ->  | AJ46: =RC[-28] ->  | AK46: =RC[-28] ->  | AL46: =RC[-28] -> 0 | AM46: =RC[-28] ->  | AN46: =RC[-28] ->  | AO46: =RC[-28] ->  | AP46: - | AQ46: =RC[-29] ->  | AR46: =RC[-29] ->  | AS46: - | AT46: =RC[-30] -> - | AU46: =RC[-30] ->  | AV46: =RC[-30] ->  | AW46: =RC[-30] -> 
A47: =IF(RC[1]="","",DATEVALUE(RC[1])) ->  | C47: 24 | P47: =IF(AND(ISNUMBER(RC[-3]),ISNUMBER(RC[-1])),RC[-3]-RC[-1],"-") -> - | T47: =(RC[-16]*RC[-15]-RC[-13]*RC[-12])/1000 -> #VALUE! | W47: =RC[-2]*RC[-10]/1000 -> #VALUE! | X47: =ABS((RC[-3]*RC[-11]-RC[-2]*RC[-9])/1000) -> #VALUE! | Y47: =(RC[-14]-RC[1])/RC[-18]*100 -> #VALUE! | Z47: =RC[-5]+RC[-4] -> #VALUE! | AC47: =VALUE(RC[-27]) -> #VALUE! | AD47: =IF(RC[21]=42,"*",IF(RC[21]=32,"",RC[21])) ->  | AE47: =RC[-28] -> 24 | AF47: =RC[-28] ->  | AG47: =RC[-28] ->  | AH47: =RC[-28] ->  | AI47: =RC[-28] ->  | AJ47: =RC[-28] ->  | AK47: =RC[-28] ->  | AL47: =RC[-28] -> 0 | AM47: =RC[-28] ->  | AN47: =RC[-28] ->  | AO47: =RC[-28] ->  | AP47: - | AQ47: =RC[-29] ->  | AR47: =RC[-29] ->  | AS47: - | AT47: =RC[-30] -> - | AU47: =RC[-30] ->  | AV47: =RC[-30] ->  | AW47: =RC[-30] -> 
A48: =IF(RC[1]="","",DATEVALUE(RC[1])) ->  | C48: 24 | P48: =IF(AND(ISNUMBER(RC[-3]),ISNUMBER(RC[-1])),RC[-3]-RC[-1],"-") -> - | T48: =(RC[-16]*RC[-15]-RC[-13]*RC[-12])/1000 -> #VALUE! | W48: =RC[-2]*RC[-10]/1000 -> #VALUE! | X48: =ABS((RC[-3]*RC[-11]-RC[-2]*RC[-9])/1000) -> #VALUE! | Y48: =(RC[-14]-RC[1])/RC[-18]*100 -> #VALUE! | Z48: =RC[-5]+RC[-4] -> #VALUE! | AC48: =VALUE(RC[-27]) -> #VALUE! | AD48: =IF(RC[21]=42,"*",IF(RC[21]=32,"",RC[21])) ->  | AE48: =RC[-28] -> 24 | AF48: =RC[-28] ->  | AG48: =RC[-28] ->  | AH48: =RC[-28] ->  | AI48: =RC[-28] ->  | AJ48: =RC[-28] ->  | AK48: =RC[-28] ->  | AL48: =RC[-28] -> 0 | AM48: =RC[-28] ->  | AN48: =RC[-28] ->  | AO48: =RC[-28] ->  | AP48: - | AQ48: =RC[-29] ->  | AR48: =RC[-29] ->  | AS48: - | AT48: =RC[-30] -> - | AU48: =RC[-30] ->  | AV48: =RC[-30] ->  | AW48: =RC[-30] -> 
A49: =IF(RC[1]="","",DATEVALUE(RC[1])) ->  | C49: 24 | P49: =IF(AND(ISNUMBER(RC[-3]),ISNUMBER(RC[-1])),RC[-3]-RC[-1],"-") -> - | T49: =(RC[-16]*RC[-15]-RC[-13]*RC[-12])/1000 -> #VALUE! | W49: =RC[-2]*RC[-10]/1000 -> #VALUE! | X49: =ABS((RC[-3]*RC[-11]-RC[-2]*RC[-9])/1000) -> #VALUE! | Y49: =(RC[-14]-RC[1])/RC[-18]*100 -> #VALUE! | Z49: =RC[-5]+RC[-4] -> #VALUE! | AC49: =VALUE(RC[-27]) -> #VALUE! | AD49: =IF(RC[21]=42,"*",IF(RC[21]=32,"",RC[21])) ->  | AE49: =RC[-28] -> 24 | AF49: =RC[-28] ->  | AG49: =RC[-28] ->  | AH49: =RC[-28] ->  | AI49: =RC[-28] ->  | AJ49: =RC[-28] ->  | AK49: =RC[-28] ->  | AL49: =RC[-28] -> 0 | AM49: =RC[-28] ->  | AN49: =RC[-28] ->  | AO49: =RC[-28] ->  | AP49: - | AQ49: =RC[-29] ->  | AR49: =RC[-29] ->  | AS49: - | AT49: =RC[-30] -> - | AU49: =RC[-30] ->  | AV49: =RC[-30] ->  | AW49: =RC[-30] -> 
A50: =IF(RC[1]="","",DATEVALUE(RC[1])) ->  | P50: =IF(AND(ISNUMBER(RC[-3]),ISNUMBER(RC[-1])),RC[-3]-RC[-1],"-") -> - | T50: =(RC[-16]*RC[-15]-RC[-13]*RC[-12])/1000 -> #VALUE! | W50: =RC[-2]*RC[-10]/1000 -> #VALUE! | X50: =ABS((RC[-3]*RC[-11]-RC[-2]*RC[-9])/1000) -> #VALUE! | Y50: =(RC[-14]-RC[1])/RC[-18]*100 -> #VALUE! | Z50: =RC[-5]+RC[-4] -> #VALUE! | AC50: =VALUE(RC[-27]) -> #VALUE! | AD50: =IF(RC[21]=42,"*",IF(RC[21]=32,"",RC[21])) ->  | AE50: =RC[-28] ->  | AF50: =RC[-28] ->  | AG50: =RC[-28] ->  | AH50: =RC[-28] ->  | AI50: =RC[-28] ->  | AJ50: =RC[-28] ->  | AK50: =RC[-28] ->  | AL50: =RC[-28] -> 0 | AM50: =RC[-28] ->  | AN50: =RC[-28] ->  | AO50: =RC[-28] ->  | AP50: - | AQ50: =RC[-29] ->  | AR50: =RC[-29] ->  | AS50: - | AT50: =RC[-30] -> - | AU50: =RC[-30] ->  | AV50: =RC[-30] ->  | AW50: =RC[-30] -> 
A51: =IF(RC[1]="","",DATEVALUE(RC[1])) ->  | P51: =IF(AND(ISNUMBER(RC[-3]),ISNUMBER(RC[-1])),RC[-3]-RC[-1],"-") -> - | T51: =(RC[-16]*RC[-15]-RC[-13]*RC[-12])/1000 -> #VALUE! | W51: =RC[-2]*RC[-10]/1000 -> #VALUE! | X51: =ABS((RC[-3]*RC[-11]-RC[-2]*RC[-9])/1000) -> #VALUE! | Y51: =(RC[-14]-RC[1])/RC[-18]*100 -> #VALUE! | Z51: =RC[-5]+RC[-4] -> #VALUE! | AC51: =VALUE(RC[-27]) -> #VALUE! | AD51: =IF(RC[21]=42,"*",IF(RC[21]=32,"",RC[21])) ->  | AE51: =RC[-28] ->  | AF51: =RC[-28] ->  | AG51: =RC[-28] ->  | AH51: =RC[-28] ->  | AI51: =RC[-28] ->  | AJ51: =RC[-28] ->  | AK51: =RC[-28] ->  | AL51: =RC[-28] -> 0 | AM51: =RC[-28] ->  | AN51: =RC[-28] ->  | AO51: =RC[-28] ->  | AP51: - | AQ51: =RC[-29] ->  | AR51: =RC[-29] ->  | AS51: - | AT51: =RC[-30] -> - | AU51: =RC[-30] ->  | AV51: =RC[-30] ->  | AW51: =RC[-30] -> 
A52: =IF(RC[1]="","",DATEVALUE(RC[1])) ->  | P52: =IF(AND(ISNUMBER(RC[-3]),ISNUMBER(RC[-1])),RC[-3]-RC[-1],"-") -> - | T52: =(RC[-16]*RC[-15]-RC[-13]*RC[-12])/1000 -> #VALUE! | W52: =RC[-2]*RC[-10]/1000 -> #VALUE! | X52: =ABS((RC[-3]*RC[-11]-RC[-2]*RC[-9])/1000) -> #VALUE! | Y52: =(RC[-14]-RC[1])/RC[-18]*100 -> #VALUE! | Z52: =RC[-5]+RC[-4] -> #VALUE! | AC52: =VALUE(RC[-27]) -> #VALUE! | AD52: =IF(RC[21]=42,"*",IF(RC[21]=32,"",RC[21])) ->  | AE52: =RC[-28] ->  | AF52: =RC[-28] ->  | AG52: =RC[-28] ->  | AH52: =RC[-28] ->  | AI52: =RC[-28] ->  | AJ52: =RC[-28] ->  | AK52: =RC[-28] ->  | AL52: =RC[-28] -> 0 | AM52: =RC[-28] ->  | AN52: =RC[-28] ->  | AO52: =RC[-28] ->  | AP52: - | AQ52: =RC[-29] ->  | AR52: =RC[-29] ->  | AS52: - | AT52: =RC[-30] -> - | AU52: =RC[-30] ->  | AV52: =RC[-30] ->  | AW52: =RC[-30] -> 
A53: =IF(RC[1]="","",DATEVALUE(RC[1])) ->  | P53: =IF(AND(ISNUMBER(RC[-3]),ISNUMBER(RC[-1])),RC[-3]-RC[-1],"-") -> - | T53: =(RC[-16]*RC[-15]-RC[-13]*RC[-12])/1000 -> #VALUE! | W53: =RC[-2]*RC[-10]/1000 -> #VALUE! | X53: =ABS((RC[-3]*RC[-11]-RC[-2]*RC[-9])/1000) -> #VALUE! | Y53: =(RC[-14]-RC[1])/RC[-18]*100 -> #VALUE! | Z53: =RC[-5]+RC[-4] -> #VALUE! | AC53: =VALUE(RC[-27]) -> #VALUE! | AD53: =IF(RC[21]=42,"*",IF(RC[21]=32,"",RC[21])) ->  | AE53: =RC[-28] ->  | AF53: =RC[-28] ->  | AG53: =RC[-28] ->  | AH53: =RC[-28] ->  | AI53: =RC[-28] ->  | AJ53: =RC[-28] ->  | AK53: =RC[-28] ->  | AL53: =RC[-28] -> 0 | AM53: =RC[-28] ->  | AN53: =RC[-28] ->  | AO53: =RC[-28] ->  | AP53: - | AQ53: =RC[-29] ->  | AR53: =RC[-29] ->  | AS53: - | AT53: =RC[-30] -> - | AU53: =RC[-30] ->  | AV53: =RC[-30] ->  | AW53: =RC[-30] -> 
A54: =IF(RC[1]="","",DATEVALUE(RC[1])) ->  | P54: =IF(AND(ISNUMBER(RC[-3]),ISNUMBER(RC[-1])),RC[-3]-RC[-1],"-") -> - | T54: =(RC[-16]*RC[-15]-RC[-13]*RC[-12])/1000 -> #VALUE! | W54: =RC[-2]*RC[-10]/1000 -> #VALUE! | X54: =ABS((RC[-3]*RC[-11]-RC[-2]*RC[-9])/1000) -> #VALUE! | Y54: =(RC[-14]-RC[1])/RC[-18]*100 -> #VALUE! | Z54: =RC[-5]+RC[-4] -> #VALUE! | AC54: =VALUE(RC[-27]) -> #VALUE! | AD54: =IF(RC[21]=42,"*",IF(RC[21]=32,"",RC[21])) ->  | AE54: =RC[-28] ->  | AF54: =RC[-28] ->  | AG54: =RC[-28] ->  | AH54: =RC[-28] ->  | AI54: =RC[-28] ->  | AJ54: =RC[-28] ->  | AK54: =RC[-28] ->  | AL54: =RC[-28] -> 0 | AM54: =RC[-28] ->  | AN54: =RC[-28] ->  | AO54: =RC[-28] ->  | AP54: - | AQ54: =RC[-29] ->  | AR54: =RC[-29] ->  | AS54: - | AT54: =RC[-30] -> - | AU54: =RC[-30] ->  | AV54: =RC[-30] ->  | AW54: =RC[-30] -> 
A55: =IF(RC[1]="","",DATEVALUE(RC[1])) ->  | P55: =IF(AND(ISNUMBER(RC[-3]),ISNUMBER(RC[-1])),RC[-3]-RC[-1],"-") -> - | T55: =(RC[-16]*RC[-15]-RC[-13]*RC[-12])/1000 -> #VALUE! | W55: =RC[-2]*RC[-10]/1000 -> #VALUE! | X55: =ABS((RC[-3]*RC[-11]-RC[-2]*RC[-9])/1000) -> #VALUE! | Y55: =(RC[-14]-RC[1])/RC[-18]*100 -> #VALUE! | Z55: =RC[-5]+RC[-4] -> #VALUE! | AC55: =VALUE(RC[-27]) -> #VALUE! | AD55: =IF(RC[21]=42,"*",IF(RC[21]=32,"",RC[21])) ->  | AE55: =RC[-28] ->  | AF55: =RC[-28] ->  | AG55: =RC[-28] ->  | AH55: =RC[-28] ->  | AI55: =RC[-28] ->  | AJ55: =RC[-28] ->  | AK55: =RC[-28] ->  | AL55: =RC[-28] -> 0 | AM55: =RC[-28] ->  | AN55: =RC[-28] ->  | AO55: =RC[-28] ->  | AP55: - | AQ55: =RC[-29] ->  | AR55: =RC[-29] ->  | AS55: - | AT55: =RC[-30] -> - | AU55: =RC[-30] ->  | AV55: =RC[-30] ->  | AW55: =RC[-30] -> 
A56: =IF(RC[1]="","",DATEVALUE(RC[1])) ->  | P56: =IF(AND(ISNUMBER(RC[-3]),ISNUMBER(RC[-1])),RC[-3]-RC[-1],"-") -> - | T56: =(RC[-16]*RC[-15]-RC[-13]*RC[-12])/1000 -> #VALUE! | W56: =RC[-2]*RC[-10]/1000 -> #VALUE! | X56: =ABS((RC[-3]*RC[-11]-RC[-2]*RC[-9])/1000) -> #VALUE! | Y56: =(RC[-14]-RC[1])/RC[-18]*100 -> #VALUE! | Z56: =RC[-5]+RC[-4] -> #VALUE! | AC56: =VALUE(RC[-27]) -> #VALUE! | AD56: =IF(RC[21]=42,"*",IF(RC[21]=32,"",RC[21])) ->  | AE56: =RC[-28] ->  | AF56: =RC[-28] ->  | AG56: =RC[-28] ->  | AH56: =RC[-28] ->  | AI56: =RC[-28] ->  | AJ56: =RC[-28] ->  | AK56: =RC[-28] ->  | AL56: =RC[-28] -> 0 | AM56: =RC[-28] ->  | AN56: =RC[-28] ->  | AO56: =RC[-28] ->  | AP56: - | AQ56: =RC[-29] ->  | AR56: =RC[-29] ->  | AS56: - | AT56: =RC[-30] -> - | AU56: =RC[-30] ->  | AV56: =RC[-30] ->  | AW56: =RC[-30] -> 
A57: =IF(RC[1]="","",DATEVALUE(RC[1])) ->  | P57: =IF(AND(ISNUMBER(RC[-3]),ISNUMBER(RC[-1])),RC[-3]-RC[-1],"-") -> - | T57: =(RC[-16]*RC[-15]-RC[-13]*RC[-12])/1000 -> #VALUE! | W57: =RC[-2]*RC[-10]/1000 -> #VALUE! | X57: =ABS((RC[-3]*RC[-11]-RC[-2]*RC[-9])/1000) -> #VALUE! | Y57: =(RC[-14]-RC[1])/RC[-18]*100 -> #VALUE! | Z57: =RC[-5]+RC[-4] -> #VALUE! | AC57: =VALUE(RC[-27]) -> #VALUE! | AD57: =IF(RC[21]=42,"*",IF(RC[21]=32,"",RC[21])) ->  | AE57: =RC[-28] ->  | AF57: =RC[-28] ->  | AG57: =RC[-28] ->  | AH57: =RC[-28] ->  | AI57: =RC[-28] ->  | AJ57: =RC[-28] ->  | AK57: =RC[-28] ->  | AL57: =RC[-28] -> 0 | AM57: =RC[-28] ->  | AN57: =RC[-28] ->  | AO57: =RC[-28] ->  | AP57: - | AQ57: =RC[-29] ->  | AR57: =RC[-29] ->  | AS57: - | AT57: =RC[-30] -> - | AU57: =RC[-30] ->  | AV57: =RC[-30] ->  | AW57: =RC[-30] -> 
A58: =IF(RC[1]="","",DATEVALUE(RC[1])) ->  | P58: =IF(AND(ISNUMBER(RC[-3]),ISNUMBER(RC[-1])),RC[-3]-RC[-1],"-") -> - | T58: =(RC[-16]*RC[-15]-RC[-13]*RC[-12])/1000 -> #VALUE! | W58: =RC[-2]*RC[-10]/1000 -> #VALUE! | X58: =ABS((RC[-3]*RC[-11]-RC[-2]*RC[-9])/1000) -> #VALUE! | Y58: =(RC[-14]-RC[1])/RC[-18]*100 -> #VALUE! | Z58: =RC[-5]+RC[-4] -> #VALUE! | AC58: =VALUE(RC[-27]) -> #VALUE! | AD58: =IF(RC[21]=42,"*",IF(RC[21]=32,"",RC[21])) ->  | AE58: =RC[-28] ->  | AF58: =RC[-28] ->  | AG58: =RC[-28] ->  | AH58: =RC[-28] ->  | AI58: =RC[-28] ->  | AJ58: =RC[-28] ->  | AK58: =RC[-28] ->  | AL58: =RC[-28] -> 0 | AM58: =RC[-28] ->  | AN58: =RC[-28] ->  | AO58: =RC[-28] ->  | AP58: - | AQ58: =RC[-29] ->  | AR58: =RC[-29] ->  | AS58: - | AT58: =RC[-30] -> - | AU58: =RC[-30] ->  | AV58: =RC[-30] ->  | AW58: =RC[-30] -> 
A59: =IF(RC[1]="","",DATEVALUE(RC[1])) ->  | P59: =IF(AND(ISNUMBER(RC[-3]),ISNUMBER(RC[-1])),RC[-3]-RC[-1],"-") -> - | T59: =(RC[-16]*RC[-15]-RC[-13]*RC[-12])/1000 -> #VALUE! | W59: =RC[-2]*RC[-10]/1000 -> #VALUE! | X59: =ABS((RC[-3]*RC[-11]-RC[-2]*RC[-9])/1000) -> #VALUE! | Y59: =(RC[-14]-RC[1])/RC[-18]*100 -> #VALUE! | Z59: =RC[-5]+RC[-4] -> #VALUE! | AC59: =VALUE(RC[-27]) -> #VALUE! | AD59: =IF(RC[21]=42,"*",IF(RC[21]=32,"",RC[21])) ->  | AE59: =RC[-28] ->  | AF59: =RC[-28] ->  | AG59: =RC[-28] ->  | AH59: =RC[-28] ->  | AI59: =RC[-28] ->  | AJ59: =RC[-28] ->  | AK59: =RC[-28] ->  | AL59: =RC[-28] -> 0 | AM59: =RC[-28] ->  | AN59: =RC[-28] ->  | AO59: =RC[-28] ->  | AP59: - | AQ59: =RC[-29] ->  | AR59: =RC[-29] ->  | AS59: - | AT59: =RC[-30] -> - | AU59: =RC[-30] ->  | AV59: =RC[-30] ->  | AW59: =RC[-30] -> 
A60: =IF(RC[1]="","",DATEVALUE(RC[1])) ->  | P60: =IF(AND(ISNUMBER(RC[-3]),ISNUMBER(RC[-1])),RC[-3]-RC[-1],"-") -> - | T60: =(RC[-16]*RC[-15]-RC[-13]*RC[-12])/1000 -> #VALUE! | W60: =RC[-2]*RC[-10]/1000 -> #VALUE! | X60: =ABS((RC[-3]*RC[-11]-RC[-2]*RC[-9])/1000) -> #VALUE! | Y60: =(RC[-14]-RC[1])/RC[-18]*100 -> #VALUE! | Z60: =RC[-5]+RC[-4] -> #VALUE! | AC60: =VALUE(RC[-27]) -> #VALUE! | AD60: =IF(RC[21]=42,"*",IF(RC[21]=32,"",RC[21])) ->  | AE60: =RC[-28] ->  | AF60: =RC[-28] ->  | AG60: =RC[-28] ->  | AH60: =RC[-28] ->  | AI60: =RC[-28] ->  | AJ60: =RC[-28] ->  | AK60: =RC[-28] ->  | AL60: =RC[-28] -> 0 | AM60: =RC[-28] ->  | AN60: =RC[-28] ->  | AO60: =RC[-28] ->  | AP60: - | AQ60: =RC[-29] ->  | AR60: =RC[-29] ->  | AS60: - | AT60: =RC[-30] -> - | AU60: =RC[-30] ->  | AV60: =RC[-30] ->  | AW60: =RC[-30] -> 
A61: =IF(RC[1]="","",DATEVALUE(RC[1])) ->  | P61: =IF(AND(ISNUMBER(RC[-3]),ISNUMBER(RC[-1])),RC[-3]-RC[-1],"-") -> - | T61: =(RC[-16]*RC[-15]-RC[-13]*RC[-12])/1000 -> #VALUE! | W61: =RC[-2]*RC[-10]/1000 -> #VALUE! | X61: =ABS((RC[-3]*RC[-11]-RC[-2]*RC[-9])/1000) -> #VALUE! | Y61: =(RC[-14]-RC[1])/RC[-18]*100 -> #VALUE! | Z61: =RC[-5]+RC[-4] -> #VALUE! | AC61: =VALUE(RC[-27]) -> #VALUE! | AD61: =IF(RC[21]=42,"*",IF(RC[21]=32,"",RC[21])) ->  | AE61: =RC[-28] ->  | AF61: =RC[-28] ->  | AG61: =RC[-28] ->  | AH61: =RC[-28] ->  | AI61: =RC[-28] ->  | AJ61: =RC[-28] ->  | AK61: =RC[-28] ->  | AL61: =RC[-28] -> 0 | AM61: =RC[-28] ->  | AN61: =RC[-28] ->  | AO61: =RC[-28] ->  | AP61: - | AQ61: =RC[-29] ->  | AR61: =RC[-29] ->  | AS61: - | AT61: =RC[-30] -> - | AU61: =RC[-30] ->  | AV61: =RC[-30] ->  | AW61: =RC[-30] -> 
A62: =IF(RC[1]="","",DATEVALUE(RC[1])) ->  | P62: =IF(AND(ISNUMBER(RC[-3]),ISNUMBER(RC[-1])),RC[-3]-RC[-1],"-") -> - | T62: =(RC[-16]*RC[-15]-RC[-13]*RC[-12])/1000 -> #VALUE! | W62: =RC[-2]*RC[-10]/1000 -> #VALUE! | X62: =ABS((RC[-3]*RC[-11]-RC[-2]*RC[-9])/1000) -> #VALUE! | Y62: =(RC[-14]-RC[1])/RC[-18]*100 -> #VALUE! | Z62: =RC[-5]+RC[-4] -> #VALUE! | AC62: =VALUE(RC[-27]) -> #VALUE! | AD62: =IF(RC[21]=42,"*",IF(RC[21]=32,"",RC[21])) ->  | AE62: =RC[-28] ->  | AF62: =RC[-28] ->  | AG62: =RC[-28] ->  | AH62: =RC[-28] ->  | AI62: =RC[-28] ->  | AJ62: =RC[-28] ->  | AK62: =RC[-28] ->  | AL62: =RC[-28] -> 0 | AM62: =RC[-28] ->  | AN62: =RC[-28] ->  | AO62: =RC[-28] ->  | AP62: - | AQ62: =RC[-29] ->  | AR62: =RC[-29] ->  | AS62: - | AT62: =RC[-30] -> - | AU62: =RC[-30] ->  | AV62: =RC[-30] ->  | AW62: =RC[-30] -> 
A63: =IF(RC[1]="","",DATEVALUE(RC[1])) ->  | P63: =IF(AND(ISNUMBER(RC[-3]),ISNUMBER(RC[-1])),RC[-3]-RC[-1],"-") -> - | T63: =(RC[-16]*RC[-15]-RC[-13]*RC[-12])/1000 -> #VALUE! | W63: =RC[-2]*RC[-10]/1000 -> #VALUE! | X63: =ABS((RC[-3]*RC[-11]-RC[-2]*RC[-9])/1000) -> #VALUE! | Y63: =(RC[-14]-RC[1])/RC[-18]*100 -> #VALUE! | Z63: =RC[-5]+RC[-4] -> #VALUE! | AC63: =VALUE(RC[-27]) -> #VALUE! | AD63: =IF(RC[21]=42,"*",IF(RC[21]=32,"",RC[21])) ->  | AE63: =RC[-28] ->  | AF63: =RC[-28] ->  | AG63: =RC[-28] ->  | AH63: =RC[-28] ->  | AI63: =RC[-28] ->  | AJ63: =RC[-28] ->  | AK63: =RC[-28] ->  | AL63: =RC[-28] -> 0 | AM63: =RC[-28] ->  | AN63: =RC[-28] ->  | AO63: =RC[-28] ->  | AP63: - | AQ63: =RC[-29] ->  | AR63: =RC[-29] ->  | AS63: - | AT63: =RC[-30] -> - | AU63: =RC[-30] ->  | AV63: =RC[-30] ->  | AW63: =RC[-30] -> 
A64: =IF(RC[1]="","",DATEVALUE(RC[1])) ->  | P64: =IF(AND(ISNUMBER(RC[-3]),ISNUMBER(RC[-1])),RC[-3]-RC[-1],"-") -> - | T64: =(RC[-16]*RC[-15]-RC[-13]*RC[-12])/1000 -> #VALUE! | W64: =RC[-2]*RC[-10]/1000 -> #VALUE! | X64: =ABS((RC[-3]*RC[-11]-RC[-2]*RC[-9])/1000) -> #VALUE! | Y64: =(RC[-14]-RC[1])/RC[-18]*100 -> #VALUE! | Z64: =RC[-5]+RC[-4] -> #VALUE! | AC64: =VALUE(RC[-27]) -> #VALUE! | AD64: =IF(RC[21]=42,"*",IF(RC[21]=32,"",RC[21])) ->  | AE64: =RC[-28] ->  | AF64: =RC[-28] ->  | AG64: =RC[-28] ->  | AH64: =RC[-28] ->  | AI64: =RC[-28] ->  | AJ64: =RC[-28] ->  | AK64: =RC[-28] ->  | AL64: =RC[-28] -> 0 | AM64: =RC[-28] ->  | AN64: =RC[-28] ->  | AO64: =RC[-28] ->  | AP64: - | AQ64: =RC[-29] ->  | AR64: =RC[-29] ->  | AS64: - | AT64: =RC[-30] -> - | AU64: =RC[-30] ->  | AV64: =RC[-30] ->  | AW64: =RC[-30] -> 
A65: =IF(RC[1]="","",DATEVALUE(RC[1])) ->  | P65: =IF(AND(ISNUMBER(RC[-3]),ISNUMBER(RC[-1])),RC[-3]-RC[-1],"-") -> - | T65: =(RC[-16]*RC[-15]-RC[-13]*RC[-12])/1000 -> #VALUE! | W65: =RC[-2]*RC[-10]/1000 -> #VALUE! | X65: =ABS((RC[-3]*RC[-11]-RC[-2]*RC[-9])/1000) -> #VALUE! | Y65: =(RC[-14]-RC[1])/RC[-18]*100 -> #VALUE! | Z65: =RC[-5]+RC[-4] -> #VALUE! | AC65: =VALUE(RC[-27]) -> #VALUE! | AD65: =IF(RC[21]=42,"*",IF(RC[21]=32,"",RC[21])) ->  | AE65: =RC[-28] ->  | AF65: =RC[-28] ->  | AG65: =RC[-28] ->  | AH65: =RC[-28] ->  | AI65: =RC[-28] ->  | AJ65: =RC[-28] ->  | AK65: =RC[-28] ->  | AL65: =RC[-28] -> 0 | AM65: =RC[-28] ->  | AN65: =RC[-28] ->  | AO65: =RC[-28] ->  | AP65: - | AQ65: =RC[-29] ->  | AR65: =RC[-29] ->  | AS65: - | AT65: =RC[-30] -> - | AU65: =RC[-30] ->  | AV65: =RC[-30] ->  | AW65: =RC[-30] -> 
A66: =IF(RC[1]="","",DATEVALUE(RC[1])) ->  | P66: =IF(AND(ISNUMBER(RC[-3]),ISNUMBER(RC[-1])),RC[-3]-RC[-1],"-") -> - | T66: =(RC[-16]*RC[-15]-RC[-13]*RC[-12])/1000 -> #VALUE! | W66: =RC[-2]*RC[-10]/1000 -> #VALUE! | X66: =ABS((RC[-3]*RC[-11]-RC[-2]*RC[-9])/1000) -> #VALUE! | Y66: =(RC[-14]-RC[1])/RC[-18]*100 -> #VALUE! | Z66: =RC[-5]+RC[-4] -> #VALUE! | AC66: =VALUE(RC[-27]) -> #VALUE! | AD66: =IF(RC[21]=42,"*",IF(RC[21]=32,"",RC[21])) ->  | AE66: =RC[-28] ->  | AF66: =RC[-28] ->  | AG66: =RC[-28] ->  | AH66: =RC[-28] ->  | AI66: =RC[-28] ->  | AJ66: =RC[-28] ->  | AK66: =RC[-28] ->  | AL66: =RC[-28] -> 0 | AM66: =RC[-28] ->  | AN66: =RC[-28] ->  | AO66: =RC[-28] ->  | AP66: - | AQ66: =RC[-29] ->  | AR66: =RC[-29] ->  | AS66: - | AT66: =RC[-30] -> - | AU66: =RC[-30] ->  | AV66: =RC[-30] ->  | AW66: =RC[-30] -> 
A67: =IF(RC[1]="","",DATEVALUE(RC[1])) ->  | P67: =IF(AND(ISNUMBER(RC[-3]),ISNUMBER(RC[-1])),RC[-3]-RC[-1],"-") -> - | T67: =(RC[-16]*RC[-15]-RC[-13]*RC[-12])/1000 -> #VALUE! | W67: =RC[-2]*RC[-10]/1000 -> #VALUE! | X67: =ABS((RC[-3]*RC[-11]-RC[-2]*RC[-9])/1000) -> #VALUE! | Y67: =(RC[-14]-RC[1])/RC[-18]*100 -> #VALUE! | Z67: =RC[-5]+RC[-4] -> #VALUE! | AC67: =VALUE(RC[-27]) -> #VALUE! | AD67: =IF(RC[21]=42,"*",IF(RC[21]=32,"",RC[21])) ->  | AE67: =RC[-28] ->  | AF67: =RC[-28] ->  | AG67: =RC[-28] ->  | AH67: =RC[-28] ->  | AI67: =RC[-28] ->  | AJ67: =RC[-28] ->  | AK67: =RC[-28] ->  | AL67: =RC[-28] -> 0 | AM67: =RC[-28] ->  | AN67: =RC[-28] ->  | AO67: =RC[-28] ->  | AP67: - | AQ67: =RC[-29] ->  | AR67: =RC[-29] ->  | AS67: - | AT67: =RC[-30] -> - | AU67: =RC[-30] ->  | AV67: =RC[-30] ->  | AW67: =RC[-30] -> 
A68: =IF(RC[1]="","",DATEVALUE(RC[1])) ->  | P68: =IF(AND(ISNUMBER(RC[-3]),ISNUMBER(RC[-1])),RC[-3]-RC[-1],"-") -> - | T68: =(RC[-16]*RC[-15]-RC[-13]*RC[-12])/1000 -> #VALUE! | W68: =RC[-2]*RC[-10]/1000 -> #VALUE! | X68: =ABS((RC[-3]*RC[-11]-RC[-2]*RC[-9])/1000) -> #VALUE! | Y68: =(RC[-14]-RC[1])/RC[-18]*100 -> #VALUE! | Z68: =RC[-5]+RC[-4] -> #VALUE! | AC68: =VALUE(RC[-27]) -> #VALUE! | AD68: =IF(RC[21]=42,"*",IF(RC[21]=32,"",RC[21])) ->  | AE68: =RC[-28] ->  | AF68: =RC[-28] ->  | AG68: =RC[-28] ->  | AH68: =RC[-28] ->  | AI68: =RC[-28] ->  | AJ68: =RC[-28] ->  | AK68: =RC[-28] ->  | AL68: =RC[-28] -> 0 | AM68: =RC[-28] ->  | AN68: =RC[-28] ->  | AO68: =RC[-28] ->  | AP68: - | AQ68: =RC[-29] ->  | AR68: =RC[-29] ->  | AS68: - | AT68: =RC[-30] -> - | AU68: =RC[-30] ->  | AV68: =RC[-30] ->  | AW68: =RC[-30] -> 
A69: =IF(RC[1]="","",DATEVALUE(RC[1])) ->  | P69: =IF(AND(ISNUMBER(RC[-3]),ISNUMBER(RC[-1])),RC[-3]-RC[-1],"-") -> - | T69: =(RC[-16]*RC[-15]-RC[-13]*RC[-12])/1000 -> #VALUE! | W69: =RC[-2]*RC[-10]/1000 -> #VALUE! | X69: =ABS((RC[-3]*RC[-11]-RC[-2]*RC[-9])/1000) -> #VALUE! | Y69: =(RC[-14]-RC[1])/RC[-18]*100 -> #VALUE! | Z69: =RC[-5]+RC[-4] -> #VALUE! | AC69: =VALUE(RC[-27]) -> #VALUE! | AD69: =IF(RC[21]=42,"*",IF(RC[21]=32,"",RC[21])) ->  | AE69: =RC[-28] ->  | AF69: =RC[-28] ->  | AG69: =RC[-28] ->  | AH69: =RC[-28] ->  | AI69: =RC[-28] ->  | AJ69: =RC[-28] ->  | AK69: =RC[-28] ->  | AL69: =RC[-28] -> 0 | AM69: =RC[-28] ->  | AN69: =RC[-28] ->  | AO69: =RC[-28] ->  | AP69: - | AQ69: =RC[-29] ->  | AR69: =RC[-29] ->  | AS69: - | AT69: =RC[-30] -> - | AU69: =RC[-30] ->  | AV69: =RC[-30] ->  | AW69: =RC[-30] -> 
A70: =IF(RC[1]="","",DATEVALUE(RC[1])) ->  | P70: =IF(AND(ISNUMBER(RC[-3]),ISNUMBER(RC[-1])),RC[-3]-RC[-1],"-") -> - | T70: =(RC[-16]*RC[-15]-RC[-13]*RC[-12])/1000 -> #VALUE! | W70: =RC[-2]*RC[-10]/1000 -> #VALUE! | X70: =ABS((RC[-3]*RC[-11]-RC[-2]*RC[-9])/1000) -> #VALUE! | Y70: =(RC[-14]-RC[1])/RC[-18]*100 -> #VALUE! | Z70: =RC[-5]+RC[-4] -> #VALUE! | AC70: =VALUE(RC[-27]) -> #VALUE! | AD70: =IF(RC[21]=42,"*",IF(RC[21]=32,"",RC[21])) ->  | AE70: =RC[-28] ->  | AF70: =RC[-28] ->  | AG70: =RC[-28] ->  | AH70: =RC[-28] ->  | AI70: =RC[-28] ->  | AJ70: =RC[-28] ->  | AK70: =RC[-28] ->  | AL70: =RC[-28] -> 0 | AM70: =RC[-28] ->  | AN70: =RC[-28] ->  | AO70: =RC[-28] ->  | AP70: - | AQ70: =RC[-29] ->  | AR70: =RC[-29] ->  | AS70: - | AT70: =RC[-30] -> - | AU70: =RC[-30] ->  | AV70: =RC[-30] ->  | AW70: =RC[-30] -> 
A71: =IF(RC[1]="","",DATEVALUE(RC[1])) ->  | P71: =IF(AND(ISNUMBER(RC[-3]),ISNUMBER(RC[-1])),RC[-3]-RC[-1],"-") -> - | T71: =(RC[-16]*RC[-15]-RC[-13]*RC[-12])/1000 -> #VALUE! | W71: =RC[-2]*RC[-10]/1000 -> #VALUE! | X71: =ABS((RC[-3]*RC[-11]-RC[-2]*RC[-9])/1000) -> #VALUE! | Y71: =(RC[-14]-RC[1])/RC[-18]*100 -> #VALUE! | Z71: =RC[-5]+RC[-4] -> #VALUE! | AC71: =VALUE(RC[-27]) -> #VALUE! | AD71: =IF(RC[21]=42,"*",IF(RC[21]=32,"",RC[21])) ->  | AE71: =RC[-28] ->  | AF71: =RC[-28] ->  | AG71: =RC[-28] ->  | AH71: =RC[-28] ->  | AI71: =RC[-28] ->  | AJ71: =RC[-28] ->  | AK71: =RC[-28] ->  | AL71: =RC[-28] -> 0 | AM71: =RC[-28] ->  | AN71: =RC[-28] ->  | AO71: =RC[-28] ->  | AP71: - | AQ71: =RC[-29] ->  | AR71: =RC[-29] ->  | AS71: - | AT71: =RC[-30] -> - | AU71: =RC[-30] ->  | AV71: =RC[-30] ->  | AW71: =RC[-30] -> 
A72: =IF(RC[1]="","",DATEVALUE(RC[1])) ->  | P72: =IF(AND(ISNUMBER(RC[-3]),ISNUMBER(RC[-1])),RC[-3]-RC[-1],"-") -> - | T72: =(RC[-16]*RC[-15]-RC[-13]*RC[-12])/1000 -> #VALUE! | W72: =RC[-2]*RC[-10]/1000 -> #VALUE! | X72: =ABS((RC[-3]*RC[-11]-RC[-2]*RC[-9])/1000) -> #VALUE! | Y72: =(RC[-14]-RC[1])/RC[-18]*100 -> #VALUE! | Z72: =RC[-5]+RC[-4] -> #VALUE! | AC72: =VALUE(RC[-27]) -> #VALUE! | AD72: =IF(RC[21]=42,"*",IF(RC[21]=32,"",RC[21])) ->  | AE72: =RC[-28] ->  | AF72: =RC[-28] ->  | AG72: =RC[-28] ->  | AH72: =RC[-28] ->  | AI72: =RC[-28] ->  | AJ72: =RC[-28] ->  | AK72: =RC[-28] ->  | AL72: =RC[-28] -> 0 | AM72: =RC[-28] ->  | AN72: =RC[-28] ->  | AO72: =RC[-28] ->  | AP72: - | AQ72: =RC[-29] ->  | AR72: =RC[-29] ->  | AS72: - | AT72: =RC[-30] -> - | AU72: =RC[-30] ->  | AV72: =RC[-30] ->  | AW72: =RC[-30] -> 
A73: =IF(RC[1]="","",DATEVALUE(RC[1])) ->  | P73: =IF(AND(ISNUMBER(RC[-3]),ISNUMBER(RC[-1])),RC[-3]-RC[-1],"-") -> - | T73: =(RC[-16]*RC[-15]-RC[-13]*RC[-12])/1000 -> #VALUE! | W73: =RC[-2]*RC[-10]/1000 -> #VALUE! | X73: =ABS((RC[-3]*RC[-11]-RC[-2]*RC[-9])/1000) -> #VALUE! | Y73: =(RC[-14]-RC[1])/RC[-18]*100 -> #VALUE! | Z73: =RC[-5]+RC[-4] -> #VALUE! | AC73: =VALUE(RC[-27]) -> #VALUE! | AD73: =IF(RC[21]=42,"*",IF(RC[21]=32,"",RC[21])) ->  | AE73: =RC[-28] ->  | AF73: =RC[-28] ->  | AG73: =RC[-28] ->  | AH73: =RC[-28] ->  | AI73: =RC[-28] ->  | AJ73: =RC[-28] ->  | AK73: =RC[-28] ->  | AL73: =RC[-28] -> 0 | AM73: =RC[-28] ->  | AN73: =RC[-28] ->  | AO73: =RC[-28] ->  | AP73: - | AQ73: =RC[-29] ->  | AR73: =RC[-29] ->  | AS73: - | AT73: =RC[-30] -> - | AU73: =RC[-30] ->  | AV73: =RC[-30] ->  | AW73: =RC[-30] -> 
A74: =IF(RC[1]="","",DATEVALUE(RC[1])) ->  | P74: =IF(AND(ISNUMBER(RC[-3]),ISNUMBER(RC[-1])),RC[-3]-RC[-1],"-") -> - | T74: =(RC[-16]*RC[-15]-RC[-13]*RC[-12])/1000 -> #VALUE! | W74: =RC[-2]*RC[-10]/1000 -> #VALUE! | X74: =ABS((RC[-3]*RC[-11]-RC[-2]*RC[-9])/1000) -> #VALUE! | Y74: =(RC[-14]-RC[1])/RC[-18]*100 -> #VALUE! | Z74: =RC[-5]+RC[-4] -> #VALUE! | AC74: =VALUE(RC[-27]) -> #VALUE! | AD74: =IF(RC[21]=42,"*",IF(RC[21]=32,"",RC[21])) ->  | AE74: =RC[-28] ->  | AF74: =RC[-28] ->  | AG74: =RC[-28] ->  | AH74: =RC[-28] ->  | AI74: =RC[-28] ->  | AJ74: =RC[-28] ->  | AK74: =RC[-28] ->  | AL74: =RC[-28] -> 0 | AM74: =RC[-28] ->  | AN74: =RC[-28] ->  | AO74: =RC[-28] ->  | AP74: - | AQ74: =RC[-29] ->  | AR74: =RC[-29] ->  | AS74: - | AT74: =RC[-30] -> - | AU74: =RC[-30] ->  | AV74: =RC[-30] ->  | AW74: =RC[-30] -> 
A75: =IF(RC[1]="","",DATEVALUE(RC[1])) ->  | P75: =IF(AND(ISNUMBER(RC[-3]),ISNUMBER(RC[-1])),RC[-3]-RC[-1],"-") -> - | T75: =(RC[-16]*RC[-15]-RC[-13]*RC[-12])/1000 -> #VALUE! | W75: =RC[-2]*RC[-10]/1000 -> #VALUE! | X75: =ABS((RC[-3]*RC[-11]-RC[-2]*RC[-9])/1000) -> #VALUE! | Y75: =(RC[-14]-RC[1])/RC[-18]*100 -> #VALUE! | Z75: =RC[-5]+RC[-4] -> #VALUE! | AC75: =VALUE(RC[-27]) -> #VALUE! | AD75: =IF(RC[21]=42,"*",IF(RC[21]=32,"",RC[21])) ->  | AE75: =RC[-28] ->  | AF75: =RC[-28] ->  | AG75: =RC[-28] ->  | AH75: =RC[-28] ->  | AI75: =RC[-28] ->  | AJ75: =RC[-28] ->  | AK75: =RC[-28] ->  | AL75: =RC[-28] -> 0 | AM75: =RC[-28] ->  | AN75: =RC[-28] ->  | AO75: =RC[-28] ->  | AP75: - | AQ75: =RC[-29] ->  | AR75: =RC[-29] ->  | AS75: - | AT75: =RC[-30] -> - | AU75: =RC[-30] ->  | AV75: =RC[-30] ->  | AW75: =RC[-30] -> 
A76: =IF(RC[1]="","",DATEVALUE(RC[1])) ->  | P76: =IF(AND(ISNUMBER(RC[-3]),ISNUMBER(RC[-1])),RC[-3]-RC[-1],"-") -> - | T76: =(RC[-16]*RC[-15]-RC[-13]*RC[-12])/1000 -> #VALUE! | W76: =RC[-2]*RC[-10]/1000 -> #VALUE! | X76: =ABS((RC[-3]*RC[-11]-RC[-2]*RC[-9])/1000) -> #VALUE! | Y76: =(RC[-14]-RC[1])/RC[-18]*100 -> #VALUE! | Z76: =RC[-5]+RC[-4] -> #VALUE! | AC76: =VALUE(RC[-27]) -> #VALUE! | AD76: =IF(RC[21]=42,"*",IF(RC[21]=32,"",RC[21])) ->  | AE76: =RC[-28] ->  | AF76: =RC[-28] ->  | AG76: =RC[-28] ->  | AH76: =RC[-28] ->  | AI76: =RC[-28] ->  | AJ76: =RC[-28] ->  | AK76: =RC[-28] ->  | AL76: =RC[-28] -> 0 | AM76: =RC[-28] ->  | AN76: =RC[-28] ->  | AO76: =RC[-28] ->  | AP76: - | AQ76: =RC[-29] ->  | AR76: =RC[-29] ->  | AS76: - | AT76: =RC[-30] -> - | AU76: =RC[-30] ->  | AV76: =RC[-30] ->  | AW76: =RC[-30] -> 
A77: =IF(RC[1]="","",DATEVALUE(RC[1])) ->  | P77: =IF(AND(ISNUMBER(RC[-3]),ISNUMBER(RC[-1])),RC[-3]-RC[-1],"-") -> - | T77: =(RC[-16]*RC[-15]-RC[-13]*RC[-12])/1000 -> #VALUE! | W77: =RC[-2]*RC[-10]/1000 -> #VALUE! | X77: =ABS((RC[-3]*RC[-11]-RC[-2]*RC[-9])/1000) -> #VALUE! | Y77: =(RC[-14]-RC[1])/RC[-18]*100 -> #VALUE! | Z77: =RC[-5]+RC[-4] -> #VALUE! | AC77: =VALUE(RC[-27]) -> #VALUE! | AD77: =IF(RC[21]=42,"*",IF(RC[21]=32,"",RC[21])) ->  | AE77: =RC[-28] ->  | AF77: =RC[-28] ->  | AG77: =RC[-28] ->  | AH77: =RC[-28] ->  | AI77: =RC[-28] ->  | AJ77: =RC[-28] ->  | AK77: =RC[-28] ->  | AL77: =RC[-28] -> 0 | AM77: =RC[-28] ->  | AN77: =RC[-28] ->  | AO77: =RC[-28] ->  | AP77: - | AQ77: =RC[-29] ->  | AR77: =RC[-29] ->  | AS77: - | AT77: =RC[-30] -> - | AU77: =RC[-30] ->  | AV77: =RC[-30] ->  | AW77: =RC[-30] -> 
A78: =IF(RC[1]="","",DATEVALUE(RC[1])) ->  | P78: =IF(AND(ISNUMBER(RC[-3]),ISNUMBER(RC[-1])),RC[-3]-RC[-1],"-") -> - | T78: =(RC[-16]*RC[-15]-RC[-13]*RC[-12])/1000 -> #VALUE! | W78: =RC[-2]*RC[-10]/1000 -> #VALUE! | X78: =ABS((RC[-3]*RC[-11]-RC[-2]*RC[-9])/1000) -> #VALUE! | Y78: =(RC[-14]-RC[1])/RC[-18]*100 -> #VALUE! | Z78: =RC[-5]+RC[-4] -> #VALUE! | AC78: =VALUE(RC[-27]) -> #VALUE! | AD78: =IF(RC[21]=42,"*",IF(RC[21]=32,"",RC[21])) ->  | AE78: =RC[-28] ->  | AF78: =RC[-28] ->  | AG78: =RC[-28] ->  | AH78: =RC[-28] ->  | AI78: =RC[-28] ->  | AJ78: =RC[-28] ->  | AK78: =RC[-28] ->  | AL78: =RC[-28] -> 0 | AM78: =RC[-28] ->  | AN78: =RC[-28] ->  | AO78: =RC[-28] ->  | AP78: - | AQ78: =RC[-29] ->  | AR78: =RC[-29] ->  | AS78: - | AT78: =RC[-30] -> - | AU78: =RC[-30] ->  | AV78: =RC[-30] ->  | AW78: =RC[-30] -> 
A79: =IF(RC[1]="","",DATEVALUE(RC[1])) ->  | P79: =IF(AND(ISNUMBER(RC[-3]),ISNUMBER(RC[-1])),RC[-3]-RC[-1],"-") -> - | T79: =(RC[-16]*RC[-15]-RC[-13]*RC[-12])/1000 -> #VALUE! | W79: =RC[-2]*RC[-10]/1000 -> #VALUE! | X79: =ABS((RC[-3]*RC[-11]-RC[-2]*RC[-9])/1000) -> #VALUE! | Y79: =(RC[-14]-RC[1])/RC[-18]*100 -> #VALUE! | Z79: =RC[-5]+RC[-4] -> #VALUE! | AC79: =VALUE(RC[-27]) -> #VALUE! | AD79: =IF(RC[21]=42,"*",IF(RC[21]=32,"",RC[21])) ->  | AE79: =RC[-28] ->  | AF79: =RC[-28] ->  | AG79: =RC[-28] ->  | AH79: =RC[-28] ->  | AI79: =RC[-28] ->  | AJ79: =RC[-28] ->  | AK79: =RC[-28] ->  | AL79: =RC[-28] -> 0 | AM79: =RC[-28] ->  | AN79: =RC[-28] ->  | AO79: =RC[-28] ->  | AP79: - | AQ79: =RC[-29] ->  | AR79: =RC[-29] ->  | AS79: - | AT79: =RC[-30] -> - | AU79: =RC[-30] ->  | AV79: =RC[-30] ->  | AW79: =RC[-30] -> 
A80: =IF(RC[1]="","",DATEVALUE(RC[1])) ->  | P80: =IF(AND(ISNUMBER(RC[-3]),ISNUMBER(RC[-1])),RC[-3]-RC[-1],"-") -> - | T80: =(RC[-16]*RC[-15]-RC[-13]*RC[-12])/1000 -> #VALUE! | W80: =RC[-2]*RC[-10]/1000 -> #VALUE! | X80: =ABS((RC[-3]*RC[-11]-RC[-2]*RC[-9])/1000) -> #VALUE! | Y80: =(RC[-14]-RC[1])/RC[-18]*100 -> #VALUE! | Z80: =RC[-5]+RC[-4] -> #VALUE! | AC80: =VALUE(RC[-27]) -> #VALUE! | AD80: =IF(RC[21]=42,"*",IF(RC[21]=32,"",RC[21])) ->  | AE80: =RC[-28] ->  | AF80: =RC[-28] ->  | AG80: =RC[-28] ->  | AH80: =RC[-28] ->  | AI80: =RC[-28] ->  | AJ80: =RC[-28] ->  | AK80: =RC[-28] ->  | AL80: =RC[-28] -> 0 | AM80: =RC[-28] ->  | AN80: =RC[-28] ->  | AO80: =RC[-28] ->  | AP80: - | AQ80: =RC[-29] ->  | AR80: =RC[-29] ->  | AS80: - | AT80: =RC[-30] -> - | AU80: =RC[-30] ->  | AV80: =RC[-30] ->  | AW80: =RC[-30] -> 
A81: =IF(RC[1]="","",DATEVALUE(RC[1])) ->  | P81: =IF(AND(ISNUMBER(RC[-3]),ISNUMBER(RC[-1])),RC[-3]-RC[-1],"-") -> - | T81: =(RC[-16]*RC[-15]-RC[-13]*RC[-12])/1000 -> #VALUE! | W81: =RC[-2]*RC[-10]/1000 -> #VALUE! | X81: =ABS((RC[-3]*RC[-11]-RC[-2]*RC[-9])/1000) -> #VALUE! | Y81: =(RC[-14]-RC[1])/RC[-18]*100 -> #VALUE! | Z81: =RC[-5]+RC[-4] -> #VALUE! | AC81: =VALUE(RC[-27]) -> #VALUE! | AD81: =IF(RC[21]=42,"*",IF(RC[21]=32,"",RC[21])) ->  | AE81: =RC[-28] ->  | AF81: =RC[-28] ->  | AG81: =RC[-28] ->  | AH81: =RC[-28] ->  | AI81: =RC[-28] ->  | AJ81: =RC[-28] ->  | AK81: =RC[-28] ->  | AL81: =RC[-28] -> 0 | AM81: =RC[-28] ->  | AN81: =RC[-28] ->  | AO81: =RC[-28] ->  | AP81: - | AQ81: =RC[-29] ->  | AR81: =RC[-29] ->  | AS81: - | AT81: =RC[-30] -> - | AU81: =RC[-30] ->  | AV81: =RC[-30] ->  | AW81: =RC[-30] -> 
A82: =IF(RC[1]="","",DATEVALUE(RC[1])) ->  | P82: =IF(AND(ISNUMBER(RC[-3]),ISNUMBER(RC[-1])),RC[-3]-RC[-1],"-") -> - | T82: =(RC[-16]*RC[-15]-RC[-13]*RC[-12])/1000 -> #VALUE! | W82: =RC[-2]*RC[-10]/1000 -> #VALUE! | X82: =ABS((RC[-3]*RC[-11]-RC[-2]*RC[-9])/1000) -> #VALUE! | Y82: =(RC[-14]-RC[1])/RC[-18]*100 -> #VALUE! | Z82: =RC[-5]+RC[-4] -> #VALUE! | AC82: =VALUE(RC[-27]) -> #VALUE! | AD82: =IF(RC[21]=42,"*",IF(RC[21]=32,"",RC[21])) ->  | AE82: =RC[-28] ->  | AF82: =RC[-28] ->  | AG82: =RC[-28] ->  | AH82: =RC[-28] ->  | AI82: =RC[-28] ->  | AJ82: =RC[-28] ->  | AK82: =RC[-28] ->  | AL82: =RC[-28] -> 0 | AM82: =RC[-28] ->  | AN82: =RC[-28] ->  | AO82: =RC[-28] ->  | AP82: - | AQ82: =RC[-29] ->  | AR82: =RC[-29] ->  | AS82: - | AT82: =RC[-30] -> - | AU82: =RC[-30] ->  | AV82: =RC[-30] ->  | AW82: =RC[-30] -> 
A83: =IF(RC[1]="","",DATEVALUE(RC[1])) ->  | P83: =IF(AND(ISNUMBER(RC[-3]),ISNUMBER(RC[-1])),RC[-3]-RC[-1],"-") -> - | T83: =(RC[-16]*RC[-15]-RC[-13]*RC[-12])/1000 -> #VALUE! | W83: =RC[-2]*RC[-10]/1000 -> #VALUE! | X83: =ABS((RC[-3]*RC[-11]-RC[-2]*RC[-9])/1000) -> #VALUE! | Y83: =(RC[-14]-RC[1])/RC[-18]*100 -> #VALUE! | Z83: =RC[-5]+RC[-4] -> #VALUE! | AC83: =VALUE(RC[-27]) -> #VALUE! | AD83: =IF(RC[21]=42,"*",IF(RC[21]=32,"",RC[21])) ->  | AE83: =RC[-28] ->  | AF83: =RC[-28] ->  | AG83: =RC[-28] ->  | AH83: =RC[-28] ->  | AI83: =RC[-28] ->  | AJ83: =RC[-28] ->  | AK83: =RC[-28] ->  | AL83: =RC[-28] -> 0 | AM83: =RC[-28] ->  | AN83: =RC[-28] ->  | AO83: =RC[-28] ->  | AP83: - | AQ83: =RC[-29] ->  | AR83: =RC[-29] ->  | AS83: - | AT83: =RC[-30] -> - | AU83: =RC[-30] ->  | AV83: =RC[-30] ->  | AW83: =RC[-30] -> 
AC84: Среднее | AF84: =R[1]C[-28] -> 163.53967304444447 | AG84: =R[1]C[-28] -> 66.915053155555569 | AH84: =R[1]C[-28] -> 7.8885447333333314 | AI84: =R[1]C[-28] -> 145.28165786666668 | AJ84: =R[1]C[-28] -> 47.315575588888898 | AK84: =R[1]C[-28] -> 5.5817527333333352 | AL84: =R[1]C[-28] -> 19.599477566666668 | AM84: =R[1]C[-28] -> 18.258009777777779 | AN84: =R[1]C[-28] -> 11.467966144444448 | AO84: =R[1]C[-28] -> 66.394637688888878 | AP84: - | AQ84: =R[1]C[-29] -> 3.4281263333333327 | AR84: =R[1]C[-29] -> 64.460448022222238 | AS84: - | AT84: =R[1]C[-30] -> 1.9341896666666691 | AU84: =R[1]C[-30] -> 14.896092477777778
B85: Среднее | D85: =AVERAGE(OFFSET(R[-74]C,3,0,R7C1,1)) -> 163.53967304444447 | E85: =AVERAGE(OFFSET(R[-74]C,3,0,R7C1,1)) -> 66.915053155555569 | F85: =AVERAGE(OFFSET(R[-74]C,3,0,R7C1,1)) -> 7.8885447333333314 | G85: =AVERAGE(OFFSET(R[-74]C,3,0,R7C1,1)) -> 145.28165786666668 | H85: =AVERAGE(OFFSET(R[-74]C,3,0,R7C1,1)) -> 47.315575588888898 | I85: =AVERAGE(OFFSET(R[-74]C,3,0,R7C1,1)) -> 5.5817527333333352 | J85: =AVERAGE(OFFSET(R[-74]C,3,0,R7C1,1)) -> 19.599477566666668 | K85: =AVERAGE(OFFSET(R[-74]C,3,0,R7C1,1)) -> 18.258009777777779 | L85: =IF(SUM(OFFSET(R[-74]C,3,0,R7C1,1))=0,"",AVERAGE(OFFSET(R[-74]C,3,0,R7C1,1))) -> 11.467966144444448 | M85: =IF(SUM(OFFSET(R[-74]C,3,0,R7C1,1))=0,"",AVERAGE(OFFSET(R[-74]C,3,0,R7C1,1))) -> 66.394637688888878 | N85: =IF(SUM(OFFSET(R[-74]C,3,0,R7C1,1))=0,"",AVERAGE(OFFSET(R[-74]C,3,0,R7C1,1))) -> 3.4281263333333327 | O85: =IF(SUM(OFFSET(R[-74]C,3,0,R7C1,1))=0,"",AVERAGE(OFFSET(R[-74]C,3,0,R7C1,1))) -> 64.460448022222238 | P85: =IF(SUM(OFFSET(R[-74]C,3,0,R7C1,1))=0,"",AVERAGE(OFFSET(R[-74]C,3,0,R7C1,1))) -> 1.9341896666666691 | Q85: =IF(SUM(OFFSET(R[-74]C,3,0,R7C1,1))=0,"",AVERAGE(OFFSET(R[-74]C,3,0,R7C1,1))) -> 14.896092477777778 | R85: =IF(SUM(OFFSET(R[-74]C,3,0,R7C1,1))=0,"",AVERAGE(OFFSET(R[-74]C,3,0,R7C1,1))) -> 0.96238088888888884 | S85: =AVERAGE(OFFSET(R[-74]C,3,0,R7C1,1)) -> 3.7551614888888887 | T85: =AVERAGE(OFFSET(R[-74]C,3,0,R7C1,1)) -> 3.7477229581600833 | W85: =AVERAGE(OFFSET(R[-74]C,3,0,R7C1,1)) -> 0.74785312416127181 | X85: =AVERAGE(OFFSET(R[-74]C,3,0,R7C1,1)) -> 0.52860891577363112 | AC85: Итого | AE85: =R[1]C[-28] -> 720 | AF85: =R[1]C[-28] -> 4906.190191333334 | AI85: =R[1]C[-28] -> 4358.4497360000005 | AM85: =R[1]C[-28] -> 547.7402933333334 | AN85: =R[1]C[-28] -> 344.03898433333342 | AQ85: =R[1]C[-29] -> 102.84378999999998 | AU85: =R[1]C[-30] -> 446.88277433333332 | AV85: =R[1]C[-30] -> 28.871426666666665 | AW85: =R[1]C[-30] -> 112.65484466666666
B86: ИТОГО: | C86: =SUM(OFFSET(R[-75]C,3,0,R7C1,1)) -> 720 | D86: =SUM(OFFSET(R[-75]C,3,0,R7C1,1)) -> 4906.190191333334 | G86: =SUM(OFFSET(R[-75]C,3,0,R7C1,1)) -> 4358.4497360000005 | K86: =SUM(OFFSET(R[-75]C,3,0,R7C1,1)) -> 547.7402933333334 | L86: =IF(SUM(OFFSET(R[-75]C,3,0,R7C1,1))=0,"",SUM(OFFSET(R[-75]C,3,0,R7C1,1))) -> 344.03898433333342 | N86: =IF(SUM(OFFSET(R[-75]C,3,0,R7C1,1))=0,"",SUM(OFFSET(R[-75]C,3,0,R7C1,1))) -> 102.84378999999998 | Q86: =IF(SUM(OFFSET(R[-75]C,3,0,R7C1,1))=0,"",SUM(OFFSET(R[-75]C,3,0,R7C1,1))) -> 446.88277433333332 | R86: =IF(SUM(OFFSET(R[-75]C,3,0,R7C1,1))=0,"",SUM(OFFSET(R[-75]C,3,0,R7C1,1))) -> 28.871426666666665 | S86: =SUM(OFFSET(R[-75]C,3,0,R7C1,1)) -> 112.65484466666666 | T86: =SUM(OFFSET(R[-75]C,3,0,R7C1,1)) -> 112.4316887448025 | W86: =SUM(OFFSET(R[-75]C,3,0,R7C1,1)) -> 22.435593724838153 | X86: =SUM(OFFSET(R[-75]C,3,0,R7C1,1)) -> 15.858267473208935
AC87: Досчёт | AF87: =R[1]C[-28] -> 0 | AI87: =R[1]C[-28] -> 0 | AM87: =R[1]C[-28] -> 0 | AN87: =R[1]C[-28] -> 0 | AQ87: =R[1]C[-29] -> 0 | AU87: =R[1]C[-30] -> 0 | AV87: =R[1]C[-30] -> 0 | AW87: =R[1]C[-30] -> 0
A88: 11дн=264ч 4дн=96ч | B88: Досчёт до конца м-ца (+) | C88: =R6C1*24 -> 216 | T88: № 01653 | AC88: Снятие | AF88: =-R[1]C[-28] -> 0 | AI88: =-R[1]C[-28] -> 0 | AM88: =-R[1]C[-28] -> 0 | AN88: =-R[1]C[-28] -> 0 | AQ88: =-R[1]C[-29] -> 0 | AU88: =-R[1]C[-30] -> 0 | AV88: =-R[1]C[-30] -> 0 | AW88: =-R[1]C[-30] -> 0
A89: 9дн=216ч 7дн=168ч | B89: Вычет с предыдущего (-) | C89: =R4C1*24 -> 192 | AC89: Сумма | AF89: =R[1]C[-28] -> 4906.190191333334 | AI89: =R[1]C[-28] -> 4358.4497360000005 | AM89: =R[1]C[-28] -> 547.7402933333334 | AN89: =R[1]C[-28] -> 344.03898433333342 | AQ89: =R[1]C[-29] -> 102.84378999999998 | AU89: =R[1]C[-30] -> 446.88277433333332 | AV89: =R[1]C[-30] -> 28.871426666666665 | AW89: =R[1]C[-30] -> 112.65484466666666
B90: СУММА: | C90: =R[-4]C+R[-2]C-R[-1]C -> 744 | D90: =R[-4]C+R[-2]C-R[-1]C -> 4906.190191333334 | G90: =R[-4]C+R[-2]C-R[-1]C -> 4358.4497360000005 | K90: =R[-4]C+R[-2]C-R[-1]C -> 547.7402933333334 | L90: =IF(SUM(OFFSET(R[-79]C,3,0,R7C1,1))=0,"",(R[-4]C+R[-2]C-R[-1]C)) -> 344.03898433333342 | N90: =IF(SUM(OFFSET(R[-79]C,3,0,R7C1,1))=0,"",(R[-4]C+R[-2]C-R[-1]C)) -> 102.84378999999998 | Q90: =IF(SUM(OFFSET(R[-79]C,3,0,R7C1,1))=0,"",(R[-4]C+R[-2]C-R[-1]C)) -> 446.88277433333332 | R90: =IF(SUM(OFFSET(R[-79]C,3,0,R7C1,1))=0,"",(R[-4]C+R[-2]C-R[-1]C)) -> 28.871426666666665 | S90: =R[-4]C+R[-2]C-R[-1]C -> 112.65484466666666
AC91: Тхв на источнике | AE91: V гвс (м3) | AF91: =R[-2]C[15] -> 446.88277433333332 | AG91: W гвс (Гкал) | AH91: =RC[-2]*0.06 -> 26.812966459999998 | AI91: W без гвс (Гкал) | AJ91: =R[-2]C[13]-RC[-2] -> 85.841878206666664
B92: Показания счетчиков на момент снятия данных:
B93: Дата, время | D93: М1, т | F93: М2, т | H93: М3, т | J93: М4, т | L93: Qо, Гкал | N93: Qг, Гкал | P93: время, час
B94: 23.09.18 00:00 | D94: 96140.988530000002 | F94: 82207.3753 | H94: 8867.7723700000006 | J94: 2699.6678700000002 | L94: 3573.53289 | N94: 797.22271000000001 | P94: -
B95: 18.10.18 00:00 | D95: 99953.767760000002 | F95: 85465.842560000005 | H95: 9149.38717 | J95: 2783.9378999999999 | L95: 3666.68219 | N95: 821.01923999999997 | P95: -
AC97: =ZAYAVKA_N -> з.н д. №02/147-2783 от 04.10.18 с 26.09.18г по 27.09.18г ,10.10.18г некорректная работа приборов В данном отчете ГВС суммируется
B98: Представитель потребителя:_______________________________________________________________________ В.О. Топорков
I101: Рекомендуемые значения по параметрам теплопотребления (не являются официально утверждёнными)
I102: М, т | J102: V, м3 | K102: Qгвс, Гкал | L102: Qотоп, Гкал | M102: Qо, Гкал
I103: =R[-13]C[-3] -> 0 | J103: =RC[-1]/0.98 -> 0 | K103: =RC[-1]*0.06 -> 0 | L103: =RC[1]-RC[-1] -> 28.871426666666665 | M103: =R[-13]C[5] -> 28.871426666666665
O105: ДЛЯ САМОКОНТРОЛЯ
B106: В строке выбора дат указать период с 16.7.13 по 23.8.13 - жильё | N106: Q | O106: Qг
B107: В строке выбора дат указать период с 18.7.13 по 25.8.13 - не жилое | N107: =(R[-21]C[-10]*R[-22]C[-7]-R[-21]C[-9]*R[-22]C[-6])/1000 -> 712.77944480608528 | O107: =IF(R[-22]C[-2]="",R[-21]C[-3]*R[-22]C/1000,"") ->  | P107: Си2
O108: =IF(R[-23]C[-2]="","",((R[-22]C[-3]*R[-23]C)-(R[-22]C[-2]*R[-23]C[2]))/1000) -> 22.176907067236971 | P108: Си3