Sheet: Лист1
G1: Отчёт о теплопотреблении за октябрь 2018 | M1: письмо с 26.09.18г по 17.10.18г некорректная работа приборов
A4: =EOMONTH(R[9]C,0)-R[9]C -> 8 | B4: Потребитель: ЗАО "Сити Сервис"
A5: =MAX(R[9]C:R[78]C) -> 2018-10-22T00:00:00.000 | B5: Адрес: г. СПб, Наличная ул., д.34 ИТП 1
A6: =EOMONTH(R[-1]C,0)-R[-1]C -> 9 | B6: Телефон: 8-911-021-19-79
A7: =R[-2]C-R[6]C -> 30 | B7: Договор 10023-12
A8: 7 | B8: Тепловычислитель: ВКТ-7 № 9198 | L8: М2 мах= | M8: 163.44 | O8: Мгвс мах= | P8: 106.08
L9: Qотоп мах= | M9: 13.08 | O9: Qгвс мах= | P9: 6.36
B10: Расчётная формула: Q=M1*(h1-hхв)-M2*(h2-hхв)
D12: Учет | L12: Контроль
A13: =R[1]C[1]-1 -> 2018-09-22T00:00:00.000 | B13: Дата | C13: N, ч | D13: M1, т | E13: T1, С | F13: P1, кг/см2 | G13: M2, т | H13: T2, С | I13: P2, кг/см2 | J13: dT, С | K13: M1-М2, т | L13: V3, м3 | M13: T3, С | N13: V4, м3 | O13: =IF(R[-12]C[-14]="м.куб","","T4, С") -> T4, С | P13: dT, С | Q13: V3-V4, м3 | R13: Qгвс, Гкал | S13: Qобщ., Гкал | T13: Q | U13: M3 | V13: M4 | W13: си2 | X13: си3 | Y13: Разб. | Z13: dM2 | AC13: Дата | AD13: НС | AE13: n, ч | AF13: М1, т | AG13: t1, гр. С | AH13: Р1, кгс/см2 | AI13: М2, т | AJ13: t2, гр. С | AK13: Р2, кгс/см2 | AL13: t1-t2, гр. С | AM13: М1-М2, т | AN13: М1гвс, т | AO13: t1гвс, гр. С | AP13: Р1гвс, кгс/см2 | AQ13: М2гвс, т | AR13: t2гвс, гр. С | AS13: Р2гвс, кгс/см2 | AT13: t1гвс-t2гвс | AU13: М1гвс-М2гвс, т | AV13: Wгвс, Гкал | AW13: Wсумм, Гкал | AY13: NS_TV1 | AZ13: НС | BA13: NS_TV2
A14: =IF(RC[1]="","",DATEVALUE(RC[1])) -> 43366 | B14: 23.09.18 | C14: 24 | D14: 17.82 | E14: 65.03 | F14: 7.95 | G14: 0 | H14: 23.18 | I14: 2.34 | J14: =RC[-5]-RC[-2] -> 41.85 | K14: 17.82 | L14: 18.59 | M14: 64.510000000000005 | R14: 1.177 | S14: =RC[-1] -> 1.177 | T14: =(RC[-16]*RC[-15]-RC[-13]*RC[-12])/1000 -> 1.1588346 | U14: 18.25 | V14: - | W14: =RC[-2]*RC[-10]/1000 -> 1.1773075000000002 | X14: =ABS((RC[-3]*RC[-11]-RC[-2]*RC[-9])/1000) -> #VALUE! | Y14: =(RC[-14]-RC[1])/RC[-18]*100 -> #DIV/0! | Z14: 18.25 | AC14: =VALUE(RC[-27]) -> 2018-09-23T00:00:00.000 | AD14: =IF(RC[21]=42,"*",IF(RC[21]=32,"",RC[21])) -> - | AE14: =RC[-28] -> 24 | AF14: =RC[-28] -> 17.82 | AG14: =RC[-28] -> 65.03 | AH14: =RC[-28] -> 7.95 | AI14: =RC[-28] -> 0 | AJ14: =RC[-28] -> 23.18 | AK14: =RC[-28] -> 2.34 | AL14: =RC[-28] -> 41.85 | AM14: =RC[-28] -> 17.82 | AN14: =RC[-28] -> 18.59 | AO14: =RC[-28] -> 64.510000000000005 | AP14: - | AQ14: =RC[-29] -> 0 | AR14: =RC[-29] -> 0 | AS14: - | AT14: =RC[-30] -> 0 | AU14: =RC[-30] -> 0 | AV14: =RC[-30] -> 1.177 | AW14: =RC[-30] -> 1.177 | AY14: - | AZ14: - | BA14: -
A15: =IF(RC[1]="","",DATEVALUE(RC[1])) -> 43367 | B15: 24.09.18 | C15: 24 | D15: 14.85 | E15: 63.06 | F15: 7.84 | G15: 0 | H15: 22.74 | I15: 2.36 | J15: =RC[-5]-RC[-2] -> 40.320000000000007 | K15: 14.85 | L15: 15.52 | M15: 62.46 | R15: 0.95199999999999996 | S15: =RC[-1] -> 0.95199999999999996 | T15: =(RC[-16]*RC[-15]-RC[-13]*RC[-12])/1000 -> 0.93644100000000008 | U15: 15.2 | V15: - | W15: =RC[-2]*RC[-10]/1000 -> 0.9493919999999999 | X15: =ABS((RC[-3]*RC[-11]-RC[-2]*RC[-9])/1000) -> #VALUE! | Y15: =(RC[-14]-RC[1])/RC[-18]*100 -> #DIV/0! | Z15: 15.2 | AC15: =VALUE(RC[-27]) -> 2018-09-24T00:00:00.000 | AD15: =IF(RC[21]=42,"*",IF(RC[21]=32,"",RC[21])) -> - | AE15: =RC[-28] -> 24 | AF15: =RC[-28] -> 14.85 | AG15: =RC[-28] -> 63.06 | AH15: =RC[-28] -> 7.84 | AI15: =RC[-28] -> 0 | AJ15: =RC[-28] -> 22.74 | AK15: =RC[-28] -> 2.36 | AL15: =RC[-28] -> 40.320000000000007 | AM15: =RC[-28] -> 14.85 | AN15: =RC[-28] -> 15.52 | AO15: =RC[-28] -> 62.46 | AP15: - | AQ15: =RC[-29] -> 0 | AR15: =RC[-29] -> 0 | AS15: - | AT15: =RC[-30] -> 0 | AU15: =RC[-30] -> 0 | AV15: =RC[-30] -> 0.95199999999999996 | AW15: =RC[-30] -> 0.95199999999999996 | AY15: - | AZ15: - | BA15: -
A16: =IF(RC[1]="","",DATEVALUE(RC[1])) -> 43368 | B16: 25.09.18 | C16: 24 | D16: 16.04 | E16: 61.27 | F16: 7.9 | G16: 0 | H16: 21.98 | I16: 2.2599999999999998 | J16: =RC[-5]-RC[-2] -> 39.290000000000006 | K16: 16.04 | L16: 16.72 | M16: 60.74 | R16: 0.996 | S16: =RC[-1] -> 0.996 | T16: =(RC[-16]*RC[-15]-RC[-13]*RC[-12])/1000 -> 0.98277080000000006 | U16: 16.45 | V16: - | W16: =RC[-2]*RC[-10]/1000 -> 0.99917299999999998 | X16: =ABS((RC[-3]*RC[-11]-RC[-2]*RC[-9])/1000) -> #VALUE! | Y16: =(RC[-14]-RC[1])/RC[-18]*100 -> #DIV/0! | Z16: 16.45 | AC16: =VALUE(RC[-27]) -> 2018-09-25T00:00:00.000 | AD16: =IF(RC[21]=42,"*",IF(RC[21]=32,"",RC[21])) -> - | AE16: =RC[-28] -> 24 | AF16: =RC[-28] -> 16.04 | AG16: =RC[-28] -> 61.27 | AH16: =RC[-28] -> 7.9 | AI16: =RC[-28] -> 0 | AJ16: =RC[-28] -> 21.98 | AK16: =RC[-28] -> 2.2599999999999998 | AL16: =RC[-28] -> 39.290000000000006 | AM16: =RC[-28] -> 16.04 | AN16: =RC[-28] -> 16.72 | AO16: =RC[-28] -> 60.74 | AP16: - | AQ16: =RC[-29] -> 0 | AR16: =RC[-29] -> 0 | AS16: - | AT16: =RC[-30] -> 0 | AU16: =RC[-30] -> 0 | AV16: =RC[-30] -> 0.996 | AW16: =RC[-30] -> 0.996 | AY16: - | AZ16: - | BA16: -
A17: =IF(RC[1]="","",DATEVALUE(RC[1])) -> 43369 | B17: 26.09.18 | C17: 24 | D17: 166.81 | E17: 70.196666666666673 | F17: 6.9766666666666666 | G17: 152.03666666666666 | H17: 47.276666666666664 | I17: 5.63 | J17: 22.92 | K17: 14.773333333333333 | L17: 15.95 | M17: 63.1 | R17: 0.98699999999999999 | S17: =RC[1] -> 4.5217191555555569 | T17: =(RC[-16]*RC[-15]-RC[-13]*RC[-12])/1000 -> 4.5217191555555569 | U17: 15.66 | V17: - | W17: =RC[-2]*RC[-10]/1000 -> 0.98814600000000008 | X17: =ABS((RC[-3]*RC[-11]-RC[-2]*RC[-9])/1000) -> #VALUE! | Y17: =(RC[-14]-RC[1])/RC[-18]*100 -> -0.58319265089561734 | Z17: 15.66 | AC17: =VALUE(RC[-27]) -> 2018-09-26T00:00:00.000 | AD17: =IF(RC[21]=42,"*",IF(RC[21]=32,"",RC[21])) -> - | AE17: =RC[-28] -> 24 | AF17: =RC[-28] -> 166.81 | AG17: =RC[-28] -> 70.196666666666673 | AH17: =RC[-28] -> 6.9766666666666666 | AI17: =RC[-28] -> 152.03666666666666 | AJ17: =RC[-28] -> 47.276666666666664 | AK17: =RC[-28] -> 5.63 | AL17: =RC[-28] -> 22.92 | AM17: =RC[-28] -> 14.773333333333333 | AN17: =RC[-28] -> 15.95 | AO17: =RC[-28] -> 63.1 | AP17: - | AQ17: =RC[-29] -> 0 | AR17: =RC[-29] -> 0 | AS17: - | AT17: =RC[-30] -> 0 | AU17: =RC[-30] -> 0 | AV17: =RC[-30] -> 0.98699999999999999 | AW17: =RC[-30] -> 4.5217191555555569 | AY17: - | AZ17: - | BA17: -
A18: =IF(RC[1]="","",DATEVALUE(RC[1])) -> 43370 | B18: 27.09.18 | C18: 24 | D18: 166.81 | E18: 70.196666666666673 | F18: 6.9766666666666666 | G18: 152.03666666666666 | H18: 47.276666666666664 | I18: 5.63 | J18: 22.92 | K18: 14.773333333333333 | L18: 18.190000000000001 | M18: 62.69 | R18: 1.1220000000000001 | S18: =RC[1] -> 4.5217191555555569 | T18: =(RC[-16]*RC[-15]-RC[-13]*RC[-12])/1000 -> 4.5217191555555569 | U18: 17.87 | V18: - | W18: =RC[-2]*RC[-10]/1000 -> 1.1202703000000001 | X18: =ABS((RC[-3]*RC[-11]-RC[-2]*RC[-9])/1000) -> #VALUE! | Y18: =(RC[-14]-RC[1])/RC[-18]*100 -> -2.03678937098507 | Z18: 17.87 | AC18: =VALUE(RC[-27]) -> 2018-09-27T00:00:00.000 | AD18: =IF(RC[21]=42,"*",IF(RC[21]=32,"",RC[21])) -> - | AE18: =RC[-28] -> 24 | AF18: =RC[-28] -> 166.81 | AG18: =RC[-28] -> 70.196666666666673 | AH18: =RC[-28] -> 6.9766666666666666 | AI18: =RC[-28] -> 152.03666666666666 | AJ18: =RC[-28] -> 47.276666666666664 | AK18: =RC[-28] -> 5.63 | AL18: =RC[-28] -> 22.92 | AM18: =RC[-28] -> 14.773333333333333 | AN18: =RC[-28] -> 18.190000000000001 | AO18: =RC[-28] -> 62.69 | AP18: - | AQ18: =RC[-29] -> 0 | AR18: =RC[-29] -> 0 | AS18: - | AT18: =RC[-30] -> 0 | AU18: =RC[-30] -> 0 | AV18: =RC[-30] -> 1.1220000000000001 | AW18: =RC[-30] -> 4.5217191555555569 | AY18: - | AZ18: - | BA18: -
A19: =IF(RC[1]="","",DATEVALUE(RC[1])) -> 43371 | B19: 28.09.18 | C19: 24 | D19: 166.81 | E19: 70.196666666666673 | F19: 6.9766666666666666 | G19: 152.03666666666666 | H19: 47.276666666666664 | I19: 5.63 | J19: 22.92 | K19: 14.773333333333333 | L19: 15.51 | M19: 67.260000000000005 | R19: 1.022 | S19: =RC[1] -> 4.5217191555555569 | T19: =(RC[-16]*RC[-15]-RC[-13]*RC[-12])/1000 -> 4.5217191555555569 | U19: 15.21 | V19: - | W19: =RC[-2]*RC[-10]/1000 -> 1.0230246000000003 | X19: =ABS((RC[-3]*RC[-11]-RC[-2]*RC[-9])/1000) -> #VALUE! | Y19: =(RC[-14]-RC[1])/RC[-18]*100 -> -0.28721141829821806 | Z19: 15.21 | AC19: =VALUE(RC[-27]) -> 2018-09-28T00:00:00.000 | AD19: =IF(RC[21]=42,"*",IF(RC[21]=32,"",RC[21])) -> - | AE19: =RC[-28] -> 24 | AF19: =RC[-28] -> 166.81 | AG19: =RC[-28] -> 70.196666666666673 | AH19: =RC[-28] -> 6.9766666666666666 | AI19: =RC[-28] -> 152.03666666666666 | AJ19: =RC[-28] -> 47.276666666666664 | AK19: =RC[-28] -> 5.63 | AL19: =RC[-28] -> 22.92 | AM19: =RC[-28] -> 14.773333333333333 | AN19: =RC[-28] -> 15.51 | AO19: =RC[-28] -> 67.260000000000005 | AP19: - | AQ19: =RC[-29] -> 0 | AR19: =RC[-29] -> 0 | AS19: - | AT19: =RC[-30] -> 0 | AU19: =RC[-30] -> 0 | AV19: =RC[-30] -> 1.022 | AW19: =RC[-30] -> 4.5217191555555569 | AY19: - | AZ19: - | BA19: -
A20: =IF(RC[1]="","",DATEVALUE(RC[1])) -> 43372 | B20: 29.09.18 | C20: 24 | D20: 166.81 | E20: 70.196666666666673 | F20: 6.9766666666666666 | G20: 152.03666666666666 | H20: 47.276666666666664 | I20: 5.63 | J20: 22.92 | K20: 14.773333333333333 | L20: 18.68 | M20: 66.34 | R20: 1.2170000000000001 | S20: =RC[1] -> 4.5217191555555569 | T20: =(RC[-16]*RC[-15]-RC[-13]*RC[-12])/1000 -> 4.5217191555555569 | U20: 18.309999999999999 | V20: - | W20: =RC[-2]*RC[-10]/1000 -> 1.2146854 | X20: =ABS((RC[-3]*RC[-11]-RC[-2]*RC[-9])/1000) -> #VALUE! | Y20: =(RC[-14]-RC[1])/RC[-18]*100 -> -2.3261932428580816 | Z20: 18.309999999999999 | AC20: =VALUE(RC[-27]) -> 2018-09-29T00:00:00.000 | AD20: =IF(RC[21]=42,"*",IF(RC[21]=32,"",RC[21])) -> - | AE20: =RC[-28] -> 24 | AF20: =RC[-28] -> 166.81 | AG20: =RC[-28] -> 70.196666666666673 | AH20: =RC[-28] -> 6.9766666666666666 | AI20: =RC[-28] -> 152.03666666666666 | AJ20: =RC[-28] -> 47.276666666666664 | AK20: =RC[-28] -> 5.63 | AL20: =RC[-28] -> 22.92 | AM20: =RC[-28] -> 14.773333333333333 | AN20: =RC[-28] -> 18.68 | AO20: =RC[-28] -> 66.34 | AP20: - | AQ20: =RC[-29] -> 0 | AR20: =RC[-29] -> 0 | AS20: - | AT20: =RC[-30] -> 0 | AU20: =RC[-30] -> 0 | AV20: =RC[-30] -> 1.2170000000000001 | AW20: =RC[-30] -> 4.5217191555555569 | AY20: - | AZ20: - | BA20: -
A21: =IF(RC[1]="","",DATEVALUE(RC[1])) -> 43373 | B21: 30.09.18 | C21: 24 | D21: 166.81 | E21: 70.196666666666673 | F21: 6.9766666666666666 | G21: 152.03666666666666 | H21: 47.276666666666664 | I21: 5.63 | J21: 22.92 | K21: 14.773333333333333 | L21: 19.149999999999999 | M21: 69.319999999999993 | R21: 1.298 | S21: =RC[1] -> 4.5217191555555569 | T21: =(RC[-16]*RC[-15]-RC[-13]*RC[-12])/1000 -> 4.5217191555555569 | U21: 18.739999999999998 | V21: - | W21: =RC[-2]*RC[-10]/1000 -> 1.2990567999999998 | X21: =ABS((RC[-3]*RC[-11]-RC[-2]*RC[-9])/1000) -> #VALUE! | Y21: =(RC[-14]-RC[1])/RC[-18]*100 -> -2.6090197540067082 | Z21: 18.739999999999998 | AC21: =VALUE(RC[-27]) -> 2018-09-30T00:00:00.000 | AD21: =IF(RC[21]=42,"*",IF(RC[21]=32,"",RC[21])) -> - | AE21: =RC[-28] -> 24 | AF21: =RC[-28] -> 166.81 | AG21: =RC[-28] -> 70.196666666666673 | AH21: =RC[-28] -> 6.9766666666666666 | AI21: =RC[-28] -> 152.03666666666666 | AJ21: =RC[-28] -> 47.276666666666664 | AK21: =RC[-28] -> 5.63 | AL21: =RC[-28] -> 22.92 | AM21: =RC[-28] -> 14.773333333333333 | AN21: =RC[-28] -> 19.149999999999999 | AO21: =RC[-28] -> 69.319999999999993 | AP21: - | AQ21: =RC[-29] -> 0 | AR21: =RC[-29] -> 0 | AS21: - | AT21: =RC[-30] -> 0 | AU21: =RC[-30] -> 0 | AV21: =RC[-30] -> 1.298 | AW21: =RC[-30] -> 4.5217191555555569 | AY21: - | AZ21: - | BA21: -
A22: =IF(RC[1]="","",DATEVALUE(RC[1])) -> 43374 | B22: 01.10.18 | C22: 24 | D22: 166.81 | E22: 70.196666666666673 | F22: 6.9766666666666666 | G22: 152.03666666666666 | H22: 47.276666666666664 | I22: 5.63 | J22: 22.92 | K22: 14.773333333333333 | L22: 16.350000000000001 | M22: 67.33 | R22: 1.08 | S22: =RC[1] -> 4.5217191555555569 | T22: =(RC[-16]*RC[-15]-RC[-13]*RC[-12])/1000 -> 4.5217191555555569 | U22: 16.03 | V22: - | W22: =RC[-2]*RC[-10]/1000 -> 1.0792999000000001 | X22: =ABS((RC[-3]*RC[-11]-RC[-2]*RC[-9])/1000) -> #VALUE! | Y22: =(RC[-14]-RC[1])/RC[-18]*100 -> -0.82655499769792451 | Z22: 16.03 | AC22: =VALUE(RC[-27]) -> 2018-10-01T00:00:00.000 | AD22: =IF(RC[21]=42,"*",IF(RC[21]=32,"",RC[21])) -> - | AE22: =RC[-28] -> 24 | AF22: =RC[-28] -> 166.81 | AG22: =RC[-28] -> 70.196666666666673 | AH22: =RC[-28] -> 6.9766666666666666 | AI22: =RC[-28] -> 152.03666666666666 | AJ22: =RC[-28] -> 47.276666666666664 | AK22: =RC[-28] -> 5.63 | AL22: =RC[-28] -> 22.92 | AM22: =RC[-28] -> 14.773333333333333 | AN22: =RC[-28] -> 16.350000000000001 | AO22: =RC[-28] -> 67.33 | AP22: - | AQ22: =RC[-29] -> 0 | AR22: =RC[-29] -> 0 | AS22: - | AT22: =RC[-30] -> 0 | AU22: =RC[-30] -> 0 | AV22: =RC[-30] -> 1.08 | AW22: =RC[-30] -> 4.5217191555555569 | AY22: - | AZ22: - | BA22: -
A23: =IF(RC[1]="","",DATEVALUE(RC[1])) -> 43375 | B23: 02.10.18 | C23: 24 | D23: 166.81 | E23: 70.196666666666673 | F23: 6.9766666666666666 | G23: 152.03666666666666 | H23: 47.276666666666664 | I23: 5.63 | J23: 22.92 | K23: 14.773333333333333 | L23: 15.53 | M23: 66.239999999999995 | R23: 1.0109999999999999 | S23: =RC[1] -> 4.5217191555555569 | T23: =(RC[-16]*RC[-15]-RC[-13]*RC[-12])/1000 -> 4.5217191555555569 | U23: 15.22 | V23: - | W23: =RC[-2]*RC[-10]/1000 -> 1.0081727999999999 | X23: =ABS((RC[-3]*RC[-11]-RC[-2]*RC[-9])/1000) -> #VALUE! | Y23: =(RC[-14]-RC[1])/RC[-18]*100 -> -0.29378877902260458 | Z23: 15.22 | AC23: =VALUE(RC[-27]) -> 2018-10-02T00:00:00.000 | AD23: =IF(RC[21]=42,"*",IF(RC[21]=32,"",RC[21])) -> - | AE23: =RC[-28] -> 24 | AF23: =RC[-28] -> 166.81 | AG23: =RC[-28] -> 70.196666666666673 | AH23: =RC[-28] -> 6.9766666666666666 | AI23: =RC[-28] -> 152.03666666666666 | AJ23: =RC[-28] -> 47.276666666666664 | AK23: =RC[-28] -> 5.63 | AL23: =RC[-28] -> 22.92 | AM23: =RC[-28] -> 14.773333333333333 | AN23: =RC[-28] -> 15.53 | AO23: =RC[-28] -> 66.239999999999995 | AP23: - | AQ23: =RC[-29] -> 0 | AR23: =RC[-29] -> 0 | AS23: - | AT23: =RC[-30] -> 0 | AU23: =RC[-30] -> 0 | AV23: =RC[-30] -> 1.0109999999999999 | AW23: =RC[-30] -> 4.5217191555555569 | AY23: - | AZ23: - | BA23: -
A24: =IF(RC[1]="","",DATEVALUE(RC[1])) -> 43376 | B24: 03.10.18 | C24: 24 | D24: 166.81 | E24: 70.196666666666673 | F24: 6.9766666666666666 | G24: 152.03666666666666 | H24: 47.276666666666664 | I24: 5.63 | J24: 22.92 | K24: 14.773333333333333 | L24: 17.54 | M24: 66.5 | R24: 1.1419999999999999 | S24: =RC[1] -> 4.5217191555555569 | T24: =(RC[-16]*RC[-15]-RC[-13]*RC[-12])/1000 -> 4.5217191555555569 | U24: 17.18 | V24: - | W24: =RC[-2]*RC[-10]/1000 -> 1.1424700000000001 | X24: =ABS((RC[-3]*RC[-11]-RC[-2]*RC[-9])/1000) -> #VALUE! | Y24: =(RC[-14]-RC[1])/RC[-18]*100 -> -1.5829514810023895 | Z24: 17.18 | AC24: =VALUE(RC[-27]) -> 2018-10-03T00:00:00.000 | AD24: =IF(RC[21]=42,"*",IF(RC[21]=32,"",RC[21])) -> - | AE24: =RC[-28] -> 24 | AF24: =RC[-28] -> 166.81 | AG24: =RC[-28] -> 70.196666666666673 | AH24: =RC[-28] -> 6.9766666666666666 | AI24: =RC[-28] -> 152.03666666666666 | AJ24: =RC[-28] -> 47.276666666666664 | AK24: =RC[-28] -> 5.63 | AL24: =RC[-28] -> 22.92 | AM24: =RC[-28] -> 14.773333333333333 | AN24: =RC[-28] -> 17.54 | AO24: =RC[-28] -> 66.5 | AP24: - | AQ24: =RC[-29] -> 0 | AR24: =RC[-29] -> 0 | AS24: - | AT24: =RC[-30] -> 0 | AU24: =RC[-30] -> 0 | AV24: =RC[-30] -> 1.1419999999999999 | AW24: =RC[-30] -> 4.5217191555555569 | AY24: - | AZ24: - | BA24: -
A25: =IF(RC[1]="","",DATEVALUE(RC[1])) -> 43377 | B25: 04.10.18 | C25: 24 | D25: 166.81 | E25: 70.196666666666673 | F25: 6.9766666666666666 | G25: 152.03666666666666 | H25: 47.276666666666664 | I25: 5.63 | J25: 22.92 | K25: 14.773333333333333 | L25: 15.99 | M25: 65.64 | R25: 1.0309999999999999 | S25: =RC[1] -> 4.5217191555555569 | T25: =(RC[-16]*RC[-15]-RC[-13]*RC[-12])/1000 -> 4.5217191555555569 | U25: 15.68 | V25: - | W25: =RC[-2]*RC[-10]/1000 -> 1.0292352 | X25: =ABS((RC[-3]*RC[-11]-RC[-2]*RC[-9])/1000) -> #VALUE! | Y25: =(RC[-14]-RC[1])/RC[-18]*100 -> -0.59634737234439039 | Z25: 15.68 | AC25: =VALUE(RC[-27]) -> 2018-10-04T00:00:00.000 | AD25: =IF(RC[21]=42,"*",IF(RC[21]=32,"",RC[21])) -> - | AE25: =RC[-28] -> 24 | AF25: =RC[-28] -> 166.81 | AG25: =RC[-28] -> 70.196666666666673 | AH25: =RC[-28] -> 6.9766666666666666 | AI25: =RC[-28] -> 152.03666666666666 | AJ25: =RC[-28] -> 47.276666666666664 | AK25: =RC[-28] -> 5.63 | AL25: =RC[-28] -> 22.92 | AM25: =RC[-28] -> 14.773333333333333 | AN25: =RC[-28] -> 15.99 | AO25: =RC[-28] -> 65.64 | AP25: - | AQ25: =RC[-29] -> 0 | AR25: =RC[-29] -> 0 | AS25: - | AT25: =RC[-30] -> 0 | AU25: =RC[-30] -> 0 | AV25: =RC[-30] -> 1.0309999999999999 | AW25: =RC[-30] -> 4.5217191555555569 | AY25: - | AZ25: - | BA25: -
A26: =IF(RC[1]="","",DATEVALUE(RC[1])) -> 43378 | B26: 05.10.18 | C26: 24 | D26: 166.81 | E26: 70.196666666666673 | F26: 6.9766666666666666 | G26: 152.03666666666666 | H26: 47.276666666666664 | I26: 5.63 | J26: 22.92 | K26: 14.773333333333333 | L26: 15.61 | M26: 64.849999999999994 | R26: 0.99099999999999999 | S26: =RC[1] -> 4.5217191555555569 | T26: =(RC[-16]*RC[-15]-RC[-13]*RC[-12])/1000 -> 4.5217191555555569 | U26: 15.29 | V26: - | W26: =RC[-2]*RC[-10]/1000 -> 0.99155649999999995 | X26: =ABS((RC[-3]*RC[-11]-RC[-2]*RC[-9])/1000) -> #VALUE! | Y26: =(RC[-14]-RC[1])/RC[-18]*100 -> -0.33983030409331022 | Z26: 15.29 | AC26: =VALUE(RC[-27]) -> 2018-10-05T00:00:00.000 | AD26: =IF(RC[21]=42,"*",IF(RC[21]=32,"",RC[21])) -> - | AE26: =RC[-28] -> 24 | AF26: =RC[-28] -> 166.81 | AG26: =RC[-28] -> 70.196666666666673 | AH26: =RC[-28] -> 6.9766666666666666 | AI26: =RC[-28] -> 152.03666666666666 | AJ26: =RC[-28] -> 47.276666666666664 | AK26: =RC[-28] -> 5.63 | AL26: =RC[-28] -> 22.92 | AM26: =RC[-28] -> 14.773333333333333 | AN26: =RC[-28] -> 15.61 | AO26: =RC[-28] -> 64.849999999999994 | AP26: - | AQ26: =RC[-29] -> 0 | AR26: =RC[-29] -> 0 | AS26: - | AT26: =RC[-30] -> 0 | AU26: =RC[-30] -> 0 | AV26: =RC[-30] -> 0.99099999999999999 | AW26: =RC[-30] -> 4.5217191555555569 | AY26: - | AZ26: - | BA26: -
A27: =IF(RC[1]="","",DATEVALUE(RC[1])) -> 43379 | B27: 06.10.18 | C27: 24 | D27: 166.81 | E27: 70.196666666666673 | F27: 6.9766666666666666 | G27: 152.03666666666666 | H27: 47.276666666666664 | I27: 5.63 | J27: 22.92 | K27: 14.773333333333333 | L27: 16.72 | M27: 65.790000000000006 | R27: 1.0780000000000001 | S27: =RC[1] -> 4.5217191555555569 | T27: =(RC[-16]*RC[-15]-RC[-13]*RC[-12])/1000 -> 4.5217191555555569 | U27: 16.420000000000002 | V27: - | W27: =RC[-2]*RC[-10]/1000 -> 1.0802718000000002 | X27: =ABS((RC[-3]*RC[-11]-RC[-2]*RC[-9])/1000) -> #VALUE! | Y27: =(RC[-14]-RC[1])/RC[-18]*100 -> -1.0830720659490045 | Z27: 16.420000000000002 | AC27: =VALUE(RC[-27]) -> 2018-10-06T00:00:00.000 | AD27: =IF(RC[21]=42,"*",IF(RC[21]=32,"",RC[21])) -> - | AE27: =RC[-28] -> 24 | AF27: =RC[-28] -> 166.81 | AG27: =RC[-28] -> 70.196666666666673 | AH27: =RC[-28] -> 6.9766666666666666 | AI27: =RC[-28] -> 152.03666666666666 | AJ27: =RC[-28] -> 47.276666666666664 | AK27: =RC[-28] -> 5.63 | AL27: =RC[-28] -> 22.92 | AM27: =RC[-28] -> 14.773333333333333 | AN27: =RC[-28] -> 16.72 | AO27: =RC[-28] -> 65.790000000000006 | AP27: - | AQ27: =RC[-29] -> 0 | AR27: =RC[-29] -> 0 | AS27: - | AT27: =RC[-30] -> 0 | AU27: =RC[-30] -> 0 | AV27: =RC[-30] -> 1.0780000000000001 | AW27: =RC[-30] -> 4.5217191555555569 | AY27: - | AZ27: - | BA27: -
A28: =IF(RC[1]="","",DATEVALUE(RC[1])) -> 43380 | B28: 07.10.18 | C28: 24 | D28: 166.81 | E28: 70.196666666666673 | F28: 6.9766666666666666 | G28: 152.03666666666666 | H28: 47.276666666666664 | I28: 5.63 | J28: 22.92 | K28: 14.773333333333333 | L28: 20.75 | M28: 66.069999999999993 | R28: 1.343 | S28: =RC[1] -> 4.5217191555555569 | T28: =(RC[-16]*RC[-15]-RC[-13]*RC[-12])/1000 -> 4.5217191555555569 | U28: 20.350000000000001 | V28: - | W28: =RC[-2]*RC[-10]/1000 -> 1.3445244999999999 | X28: =ABS((RC[-3]*RC[-11]-RC[-2]*RC[-9])/1000) -> #VALUE! | Y28: =(RC[-14]-RC[1])/RC[-18]*100 -> -3.6679748306329625 | Z28: 20.350000000000001 | AC28: =VALUE(RC[-27]) -> 2018-10-07T00:00:00.000 | AD28: =IF(RC[21]=42,"*",IF(RC[21]=32,"",RC[21])) -> - | AE28: =RC[-28] -> 24 | AF28: =RC[-28] -> 166.81 | AG28: =RC[-28] -> 70.196666666666673 | AH28: =RC[-28] -> 6.9766666666666666 | AI28: =RC[-28] -> 152.03666666666666 | AJ28: =RC[-28] -> 47.276666666666664 | AK28: =RC[-28] -> 5.63 | AL28: =RC[-28] -> 22.92 | AM28: =RC[-28] -> 14.773333333333333 | AN28: =RC[-28] -> 20.75 | AO28: =RC[-28] -> 66.069999999999993 | AP28: - | AQ28: =RC[-29] -> 0 | AR28: =RC[-29] -> 0 | AS28: - | AT28: =RC[-30] -> 0 | AU28: =RC[-30] -> 0 | AV28: =RC[-30] -> 1.343 | AW28: =RC[-30] -> 4.5217191555555569 | AY28: - | AZ28: - | BA28: -
A29: =IF(RC[1]="","",DATEVALUE(RC[1])) -> 43381 | B29: 08.10.18 | C29: 24 | D29: 166.81 | E29: 70.196666666666673 | F29: 6.9766666666666666 | G29: 152.03666666666666 | H29: 47.276666666666664 | I29: 5.63 | J29: 22.92 | K29: 14.773333333333333 | L29: 17.920000000000002 | M29: 65.86 | R29: 1.157 | S29: =RC[1] -> 4.5217191555555569 | T29: =(RC[-16]*RC[-15]-RC[-13]*RC[-12])/1000 -> 4.5217191555555569 | U29: 17.57 | V29: - | W29: =RC[-2]*RC[-10]/1000 -> 1.1571602000000001 | X29: =ABS((RC[-3]*RC[-11]-RC[-2]*RC[-9])/1000) -> #VALUE! | Y29: =(RC[-14]-RC[1])/RC[-18]*100 -> -1.8394685492534697 | Z29: 17.57 | AC29: =VALUE(RC[-27]) -> 2018-10-08T00:00:00.000 | AD29: =IF(RC[21]=42,"*",IF(RC[21]=32,"",RC[21])) -> - | AE29: =RC[-28] -> 24 | AF29: =RC[-28] -> 166.81 | AG29: =RC[-28] -> 70.196666666666673 | AH29: =RC[-28] -> 6.9766666666666666 | AI29: =RC[-28] -> 152.03666666666666 | AJ29: =RC[-28] -> 47.276666666666664 | AK29: =RC[-28] -> 5.63 | AL29: =RC[-28] -> 22.92 | AM29: =RC[-28] -> 14.773333333333333 | AN29: =RC[-28] -> 17.920000000000002 | AO29: =RC[-28] -> 65.86 | AP29: - | AQ29: =RC[-29] -> 0 | AR29: =RC[-29] -> 0 | AS29: - | AT29: =RC[-30] -> 0 | AU29: =RC[-30] -> 0 | AV29: =RC[-30] -> 1.157 | AW29: =RC[-30] -> 4.5217191555555569 | AY29: - | AZ29: - | BA29: -
A30: =IF(RC[1]="","",DATEVALUE(RC[1])) -> 43382 | B30: 09.10.18 | C30: 24 | D30: 166.81 | E30: 70.196666666666673 | F30: 6.9766666666666666 | G30: 152.03666666666666 | H30: 47.276666666666664 | I30: 5.63 | J30: 22.92 | K30: 14.773333333333333 | L30: 16.97 | M30: 65.94 | R30: 1.095 | S30: =RC[1] -> 4.5217191555555569 | T30: =(RC[-16]*RC[-15]-RC[-13]*RC[-12])/1000 -> 4.5217191555555569 | U30: 16.64 | V30: - | W30: =RC[-2]*RC[-10]/1000 -> 1.0972416 | X30: =ABS((RC[-3]*RC[-11]-RC[-2]*RC[-9])/1000) -> #VALUE! | Y30: =(RC[-14]-RC[1])/RC[-18]*100 -> -1.2277740018855103 | Z30: 16.64 | AC30: =VALUE(RC[-27]) -> 2018-10-09T00:00:00.000 | AD30: =IF(RC[21]=42,"*",IF(RC[21]=32,"",RC[21])) -> - | AE30: =RC[-28] -> 24 | AF30: =RC[-28] -> 166.81 | AG30: =RC[-28] -> 70.196666666666673 | AH30: =RC[-28] -> 6.9766666666666666 | AI30: =RC[-28] -> 152.03666666666666 | AJ30: =RC[-28] -> 47.276666666666664 | AK30: =RC[-28] -> 5.63 | AL30: =RC[-28] -> 22.92 | AM30: =RC[-28] -> 14.773333333333333 | AN30: =RC[-28] -> 16.97 | AO30: =RC[-28] -> 65.94 | AP30: - | AQ30: =RC[-29] -> 0 | AR30: =RC[-29] -> 0 | AS30: - | AT30: =RC[-30] -> 0 | AU30: =RC[-30] -> 0 | AV30: =RC[-30] -> 1.095 | AW30: =RC[-30] -> 4.5217191555555569 | AY30: - | AZ30: - | BA30: -
A31: =IF(RC[1]="","",DATEVALUE(RC[1])) -> 43383 | B31: 10.10.18 | C31: 24 | D31: 166.81 | E31: 70.196666666666673 | F31: 6.9766666666666666 | G31: 152.03666666666666 | H31: 47.276666666666664 | I31: 5.63 | J31: 22.92 | K31: 14.773333333333333 | L31: 14.656666666666666 | M31: 69.623333333333335 | R31: 0.9966666666666667 | S31: 4.5163333333333329 | T31: =(RC[-16]*RC[-15]-RC[-13]*RC[-12])/1000 -> 4.5217191555555569 | U31: 72.28 | V31: - | W31: =RC[-2]*RC[-10]/1000 -> 5.0323745333333338 | X31: =ABS((RC[-3]*RC[-11]-RC[-2]*RC[-9])/1000) -> #VALUE! | Y31: =(RC[-14]-RC[1])/RC[-18]*100 -> -37.824209072372895 | Z31: 72.28 | AC31: =VALUE(RC[-27]) -> 2018-10-10T00:00:00.000 | AD31: =IF(RC[21]=42,"*",IF(RC[21]=32,"",RC[21])) -> - | AE31: =RC[-28] -> 24 | AF31: =RC[-28] -> 166.81 | AG31: =RC[-28] -> 70.196666666666673 | AH31: =RC[-28] -> 6.9766666666666666 | AI31: =RC[-28] -> 152.03666666666666 | AJ31: =RC[-28] -> 47.276666666666664 | AK31: =RC[-28] -> 5.63 | AL31: =RC[-28] -> 22.92 | AM31: =RC[-28] -> 14.773333333333333 | AN31: =RC[-28] -> 14.656666666666666 | AO31: =RC[-28] -> 69.623333333333335 | AP31: - | AQ31: =RC[-29] -> 0 | AR31: =RC[-29] -> 0 | AS31: - | AT31: =RC[-30] -> 0 | AU31: =RC[-30] -> 0 | AV31: =RC[-30] -> 0.9966666666666667 | AW31: =RC[-30] -> 4.5163333333333329 | AY31: - | AZ31: - | BA31: -
A32: =IF(RC[1]="","",DATEVALUE(RC[1])) -> 43384 | B32: 11.10.18 | C32: 24 | D32: 166.81 | E32: 70.196666666666673 | F32: 6.9766666666666666 | G32: 152.03666666666666 | H32: 47.276666666666664 | I32: 5.63 | J32: 22.92 | K32: 14.773333333333333 | L32: 14.656666666666666 | M32: 69.623333333333335 | R32: 0.9966666666666667 | S32: 4.5163333333333329 | T32: =(RC[-16]*RC[-15]-RC[-13]*RC[-12])/1000 -> 4.5217191555555569 | U32: 114.65 | V32: - | W32: =RC[-2]*RC[-10]/1000 -> 7.982315166666667 | X32: =ABS((RC[-3]*RC[-11]-RC[-2]*RC[-9])/1000) -> #VALUE! | Y32: =(RC[-14]-RC[1])/RC[-18]*100 -> -65.692486461599174 | Z32: 114.65 | AC32: =VALUE(RC[-27]) -> 2018-10-11T00:00:00.000 | AD32: =IF(RC[21]=42,"*",IF(RC[21]=32,"",RC[21])) -> - | AE32: =RC[-28] -> 24 | AF32: =RC[-28] -> 166.81 | AG32: =RC[-28] -> 70.196666666666673 | AH32: =RC[-28] -> 6.9766666666666666 | AI32: =RC[-28] -> 152.03666666666666 | AJ32: =RC[-28] -> 47.276666666666664 | AK32: =RC[-28] -> 5.63 | AL32: =RC[-28] -> 22.92 | AM32: =RC[-28] -> 14.773333333333333 | AN32: =RC[-28] -> 14.656666666666666 | AO32: =RC[-28] -> 69.623333333333335 | AP32: - | AQ32: =RC[-29] -> 0 | AR32: =RC[-29] -> 0 | AS32: - | AT32: =RC[-30] -> 0 | AU32: =RC[-30] -> 0 | AV32: =RC[-30] -> 0.9966666666666667 | AW32: =RC[-30] -> 4.5163333333333329 | AY32: - | AZ32: - | BA32: -
A33: =IF(RC[1]="","",DATEVALUE(RC[1])) -> 43385 | B33: 12.10.18 | C33: 24 | D33: 166.81 | E33: 70.196666666666673 | F33: 6.9766666666666666 | G33: 152.03666666666666 | H33: 47.276666666666664 | I33: 5.63 | J33: 22.92 | K33: 14.773333333333333 | L33: 14.656666666666666 | M33: 69.623333333333335 | R33: 0.9966666666666667 | S33: 4.5163333333333329 | T33: =(RC[-16]*RC[-15]-RC[-13]*RC[-12])/1000 -> 4.5217191555555569 | U33: 114.93 | V33: - | W33: =RC[-2]*RC[-10]/1000 -> 8.0018097000000008 | X33: =ABS((RC[-3]*RC[-11]-RC[-2]*RC[-9])/1000) -> #VALUE! | Y33: =(RC[-14]-RC[1])/RC[-18]*100 -> -65.876652561881997 | Z33: 114.93 | AC33: =VALUE(RC[-27]) -> 2018-10-12T00:00:00.000 | AD33: =IF(RC[21]=42,"*",IF(RC[21]=32,"",RC[21])) -> - | AE33: =RC[-28] -> 24 | AF33: =RC[-28] -> 166.81 | AG33: =RC[-28] -> 70.196666666666673 | AH33: =RC[-28] -> 6.9766666666666666 | AI33: =RC[-28] -> 152.03666666666666 | AJ33: =RC[-28] -> 47.276666666666664 | AK33: =RC[-28] -> 5.63 | AL33: =RC[-28] -> 22.92 | AM33: =RC[-28] -> 14.773333333333333 | AN33: =RC[-28] -> 14.656666666666666 | AO33: =RC[-28] -> 69.623333333333335 | AP33: - | AQ33: =RC[-29] -> 0 | AR33: =RC[-29] -> 0 | AS33: - | AT33: =RC[-30] -> 0 | AU33: =RC[-30] -> 0 | AV33: =RC[-30] -> 0.9966666666666667 | AW33: =RC[-30] -> 4.5163333333333329 | AY33: - | AZ33: - | BA33: -
A34: =IF(RC[1]="","",DATEVALUE(RC[1])) -> 43386 | B34: 13.10.18 | C34: 24 | D34: 166.81 | E34: 70.196666666666673 | F34: 6.9766666666666666 | G34: 152.03666666666666 | H34: 47.276666666666664 | I34: 5.63 | J34: 22.92 | K34: 14.773333333333333 | L34: 14.656666666666666 | M34: 69.623333333333335 | R34: 0.9966666666666667 | S34: 4.5163333333333329 | T34: =(RC[-16]*RC[-15]-RC[-13]*RC[-12])/1000 -> 4.5217191555555569 | U34: 141.03 | V34: - | W34: =RC[-2]*RC[-10]/1000 -> 9.8189786999999988 | X34: =ABS((RC[-3]*RC[-11]-RC[-2]*RC[-9])/1000) -> #VALUE! | Y34: =(RC[-14]-RC[1])/RC[-18]*100 -> -83.043564052531181 | Z34: 141.03 | AC34: =VALUE(RC[-27]) -> 2018-10-13T00:00:00.000 | AD34: =IF(RC[21]=42,"*",IF(RC[21]=32,"",RC[21])) -> - | AE34: =RC[-28] -> 24 | AF34: =RC[-28] -> 166.81 | AG34: =RC[-28] -> 70.196666666666673 | AH34: =RC[-28] -> 6.9766666666666666 | AI34: =RC[-28] -> 152.03666666666666 | AJ34: =RC[-28] -> 47.276666666666664 | AK34: =RC[-28] -> 5.63 | AL34: =RC[-28] -> 22.92 | AM34: =RC[-28] -> 14.773333333333333 | AN34: =RC[-28] -> 14.656666666666666 | AO34: =RC[-28] -> 69.623333333333335 | AP34: - | AQ34: =RC[-29] -> 0 | AR34: =RC[-29] -> 0 | AS34: - | AT34: =RC[-30] -> 0 | AU34: =RC[-30] -> 0 | AV34: =RC[-30] -> 0.9966666666666667 | AW34: =RC[-30] -> 4.5163333333333329 | AY34: - | AZ34: - | BA34: -
A35: =IF(RC[1]="","",DATEVALUE(RC[1])) -> 43387 | B35: 14.10.18 | C35: 24 | D35: 166.81 | E35: 70.196666666666673 | F35: 6.9766666666666666 | G35: 152.03666666666666 | H35: 47.276666666666664 | I35: 5.63 | J35: 22.92 | K35: 14.773333333333333 | L35: 14.656666666666666 | M35: 69.623333333333335 | R35: 0.9966666666666667 | S35: 4.5163333333333329 | T35: =(RC[-16]*RC[-15]-RC[-13]*RC[-12])/1000 -> 4.5217191555555569 | U35: 123.7 | V35: - | W35: =RC[-2]*RC[-10]/1000 -> 8.6124063333333343 | X35: =ABS((RC[-3]*RC[-11]-RC[-2]*RC[-9])/1000) -> #VALUE! | Y35: =(RC[-14]-RC[1])/RC[-18]*100 -> -71.644997917169121 | Z35: 123.7 | AC35: =VALUE(RC[-27]) -> 2018-10-14T00:00:00.000 | AD35: =IF(RC[21]=42,"*",IF(RC[21]=32,"",RC[21])) -> - | AE35: =RC[-28] -> 24 | AF35: =RC[-28] -> 166.81 | AG35: =RC[-28] -> 70.196666666666673 | AH35: =RC[-28] -> 6.9766666666666666 | AI35: =RC[-28] -> 152.03666666666666 | AJ35: =RC[-28] -> 47.276666666666664 | AK35: =RC[-28] -> 5.63 | AL35: =RC[-28] -> 22.92 | AM35: =RC[-28] -> 14.773333333333333 | AN35: =RC[-28] -> 14.656666666666666 | AO35: =RC[-28] -> 69.623333333333335 | AP35: - | AQ35: =RC[-29] -> 0 | AR35: =RC[-29] -> 0 | AS35: - | AT35: =RC[-30] -> 0 | AU35: =RC[-30] -> 0 | AV35: =RC[-30] -> 0.9966666666666667 | AW35: =RC[-30] -> 4.5163333333333329 | AY35: - | AZ35: - | BA35: -
A36: =IF(RC[1]="","",DATEVALUE(RC[1])) -> 43388 | B36: 15.10.18 | C36: 24 | D36: 166.81 | E36: 70.196666666666673 | F36: 6.9766666666666666 | G36: 152.03666666666666 | H36: 47.276666666666664 | I36: 5.63 | J36: 22.92 | K36: 14.773333333333333 | L36: 14.656666666666666 | M36: 69.623333333333335 | R36: 0.9966666666666667 | S36: 4.5163333333333329 | T36: =(RC[-16]*RC[-15]-RC[-13]*RC[-12])/1000 -> 4.5217191555555569 | U36: 116.25 | V36: - | W36: =RC[-2]*RC[-10]/1000 -> 8.0937125000000005 | X36: =ABS((RC[-3]*RC[-11]-RC[-2]*RC[-9])/1000) -> #VALUE! | Y36: =(RC[-14]-RC[1])/RC[-18]*100 -> -66.744864177501043 | Z36: 116.25 | AC36: =VALUE(RC[-27]) -> 2018-10-15T00:00:00.000 | AD36: =IF(RC[21]=42,"*",IF(RC[21]=32,"",RC[21])) -> - | AE36: =RC[-28] -> 24 | AF36: =RC[-28] -> 166.81 | AG36: =RC[-28] -> 70.196666666666673 | AH36: =RC[-28] -> 6.9766666666666666 | AI36: =RC[-28] -> 152.03666666666666 | AJ36: =RC[-28] -> 47.276666666666664 | AK36: =RC[-28] -> 5.63 | AL36: =RC[-28] -> 22.92 | AM36: =RC[-28] -> 14.773333333333333 | AN36: =RC[-28] -> 14.656666666666666 | AO36: =RC[-28] -> 69.623333333333335 | AP36: - | AQ36: =RC[-29] -> 0 | AR36: =RC[-29] -> 0 | AS36: - | AT36: =RC[-30] -> 0 | AU36: =RC[-30] -> 0 | AV36: =RC[-30] -> 0.9966666666666667 | AW36: =RC[-30] -> 4.5163333333333329 | AY36: - | AZ36: - | BA36: -
A37: =IF(RC[1]="","",DATEVALUE(RC[1])) -> 43389 | B37: 16.10.18 | C37: 24 | D37: 166.81 | E37: 70.196666666666673 | F37: 6.9766666666666666 | G37: 152.03666666666666 | H37: 47.276666666666664 | I37: 5.63 | J37: 22.92 | K37: 14.773333333333333 | L37: 14.656666666666666 | M37: 69.623333333333335 | R37: 0.9966666666666667 | S37: 4.5163333333333329 | T37: =(RC[-16]*RC[-15]-RC[-13]*RC[-12])/1000 -> 4.5217191555555569 | U37: 108.34 | V37: - | W37: =RC[-2]*RC[-10]/1000 -> 7.542991933333334 | X37: =ABS((RC[-3]*RC[-11]-RC[-2]*RC[-9])/1000) -> #VALUE! | Y37: =(RC[-14]-RC[1])/RC[-18]*100 -> -61.542171844511195 | Z37: 108.34 | AC37: =VALUE(RC[-27]) -> 2018-10-16T00:00:00.000 | AD37: =IF(RC[21]=42,"*",IF(RC[21]=32,"",RC[21])) -> - | AE37: =RC[-28] -> 24 | AF37: =RC[-28] -> 166.81 | AG37: =RC[-28] -> 70.196666666666673 | AH37: =RC[-28] -> 6.9766666666666666 | AI37: =RC[-28] -> 152.03666666666666 | AJ37: =RC[-28] -> 47.276666666666664 | AK37: =RC[-28] -> 5.63 | AL37: =RC[-28] -> 22.92 | AM37: =RC[-28] -> 14.773333333333333 | AN37: =RC[-28] -> 14.656666666666666 | AO37: =RC[-28] -> 69.623333333333335 | AP37: - | AQ37: =RC[-29] -> 0 | AR37: =RC[-29] -> 0 | AS37: - | AT37: =RC[-30] -> 0 | AU37: =RC[-30] -> 0 | AV37: =RC[-30] -> 0.9966666666666667 | AW37: =RC[-30] -> 4.5163333333333329 | AY37: - | AZ37: - | BA37: -
A38: =IF(RC[1]="","",DATEVALUE(RC[1])) -> 43390 | B38: 17.10.18 | C38: 24 | D38: =AVERAGE(R[1]C:R[3]C) -> 166.81 | E38: =AVERAGE(R[1]C:R[3]C) -> 70.196666666666673 | F38: =AVERAGE(R[1]C:R[3]C) -> 6.9766666666666666 | G38: =AVERAGE(R[1]C:R[3]C) -> 152.03666666666666 | H38: =AVERAGE(R[1]C:R[3]C) -> 47.276666666666664 | I38: =AVERAGE(R[1]C:R[3]C) -> 5.63 | J38: =AVERAGE(R[1]C:R[3]C) -> 22.92 | K38: =AVERAGE(R[1]C:R[3]C) -> 14.773333333333333 | L38: =AVERAGE(R[1]C:R[3]C) -> 14.656666666666666 | M38: =AVERAGE(R[1]C:R[3]C) -> 69.623333333333335 | R38: =AVERAGE(R[1]C:R[3]C) -> 0.9966666666666667 | S38: =AVERAGE(R[1]C:R[3]C) -> 4.5163333333333329 | T38: =(RC[-16]*RC[-15]-RC[-13]*RC[-12])/1000 -> 4.5217191555555569 | U38: 60.44 | V38: - | W38: =RC[-2]*RC[-10]/1000 -> 4.2080342666666661 | X38: =ABS((RC[-3]*RC[-11]-RC[-2]*RC[-9])/1000) -> #VALUE! | Y38: =(RC[-14]-RC[1])/RC[-18]*100 -> -30.036613974699083 | Z38: 60.44 | AC38: =VALUE(RC[-27]) -> 2018-10-17T00:00:00.000 | AD38: =IF(RC[21]=42,"*",IF(RC[21]=32,"",RC[21])) -> - | AE38: =RC[-28] -> 24 | AF38: =RC[-28] -> 166.81 | AG38: =RC[-28] -> 70.196666666666673 | AH38: =RC[-28] -> 6.9766666666666666 | AI38: =RC[-28] -> 152.03666666666666 | AJ38: =RC[-28] -> 47.276666666666664 | AK38: =RC[-28] -> 5.63 | AL38: =RC[-28] -> 22.92 | AM38: =RC[-28] -> 14.773333333333333 | AN38: =RC[-28] -> 14.656666666666666 | AO38: =RC[-28] -> 69.623333333333335 | AP38: - | AQ38: =RC[-29] -> 0 | AR38: =RC[-29] -> 0 | AS38: - | AT38: =RC[-30] -> 0 | AU38: =RC[-30] -> 0 | AV38: =RC[-30] -> 0.9966666666666667 | AW38: =RC[-30] -> 4.5163333333333329 | AY38: - | AZ38: - | BA38: -
A39: =IF(RC[1]="","",DATEVALUE(RC[1])) -> 43391 | B39: 18.10.18 | C39: 24 | D39: 177 | E39: 70.650000000000006 | F39: 7.01 | G39: 162.12 | H39: 48.78 | I39: 5.84 | J39: =RC[-5]-RC[-2] -> 21.870000000000005 | K39: 14.88 | L39: 14.16 | M39: 70.2 | R39: 0.97099999999999997 | S39: 4.5999999999999996 | T39: =(RC[-16]*RC[-15]-RC[-13]*RC[-12])/1000 -> 4.5968364000000008 | U39: 13.86 | V39: - | W39: =RC[-2]*RC[-10]/1000 -> 0.97297199999999995 | X39: =ABS((RC[-3]*RC[-11]-RC[-2]*RC[-9])/1000) -> #VALUE! | Y39: =(RC[-14]-RC[1])/RC[-18]*100 -> 0.62916358253145899 | Z39: 13.86 | AC39: =VALUE(RC[-27]) -> 2018-10-18T00:00:00.000 | AD39: =IF(RC[21]=42,"*",IF(RC[21]=32,"",RC[21])) -> - | AE39: =RC[-28] -> 24 | AF39: =RC[-28] -> 177 | AG39: =RC[-28] -> 70.650000000000006 | AH39: =RC[-28] -> 7.01 | AI39: =RC[-28] -> 162.12 | AJ39: =RC[-28] -> 48.78 | AK39: =RC[-28] -> 5.84 | AL39: =RC[-28] -> 21.870000000000005 | AM39: =RC[-28] -> 14.88 | AN39: =RC[-28] -> 14.16 | AO39: =RC[-28] -> 70.2 | AP39: - | AQ39: =RC[-29] -> 0 | AR39: =RC[-29] -> 0 | AS39: - | AT39: =RC[-30] -> 0 | AU39: =RC[-30] -> 0 | AV39: =RC[-30] -> 0.97099999999999997 | AW39: =RC[-30] -> 4.5999999999999996 | AY39: - | AZ39: - | BA39: -
A40: =IF(RC[1]="","",DATEVALUE(RC[1])) -> 43392 | B40: 19.10.18 | C40: 24 | D40: 164.55 | E40: 70.33 | F40: 6.99 | G40: 149.71 | H40: 47.05 | I40: 5.59 | J40: =RC[-5]-RC[-2] -> 23.28 | K40: 14.84 | L40: 14.61 | M40: 69.52 | R40: 0.99299999999999999 | S40: 4.5270000000000001 | T40: =(RC[-16]*RC[-15]-RC[-13]*RC[-12])/1000 -> 4.5289460000000021 | U40: 14.3 | V40: - | W40: =RC[-2]*RC[-10]/1000 -> 0.99413600000000002 | X40: =ABS((RC[-3]*RC[-11]-RC[-2]*RC[-9])/1000) -> #VALUE! | Y40: =(RC[-14]-RC[1])/RC[-18]*100 -> 0.36069734820653204 | Z40: 14.3 | AC40: =VALUE(RC[-27]) -> 2018-10-19T00:00:00.000 | AD40: =IF(RC[21]=42,"*",IF(RC[21]=32,"",RC[21])) -> - | AE40: =RC[-28] -> 24 | AF40: =RC[-28] -> 164.55 | AG40: =RC[-28] -> 70.33 | AH40: =RC[-28] -> 6.99 | AI40: =RC[-28] -> 149.71 | AJ40: =RC[-28] -> 47.05 | AK40: =RC[-28] -> 5.59 | AL40: =RC[-28] -> 23.28 | AM40: =RC[-28] -> 14.84 | AN40: =RC[-28] -> 14.61 | AO40: =RC[-28] -> 69.52 | AP40: - | AQ40: =RC[-29] -> 0 | AR40: =RC[-29] -> 0 | AS40: - | AT40: =RC[-30] -> 0 | AU40: =RC[-30] -> 0 | AV40: =RC[-30] -> 0.99299999999999999 | AW40: =RC[-30] -> 4.5270000000000001 | AY40: - | AZ40: - | BA40: -
A41: =IF(RC[1]="","",DATEVALUE(RC[1])) -> 43393 | B41: 20.10.18 | C41: 24 | D41: 158.88 | E41: 69.61 | F41: 6.93 | G41: 144.28 | H41: 46 | I41: 5.46 | J41: =RC[-5]-RC[-2] -> 23.61 | K41: 14.6 | L41: 15.2 | M41: 69.150000000000006 | R41: 1.026 | S41: 4.4219999999999997 | T41: =(RC[-16]*RC[-15]-RC[-13]*RC[-12])/1000 -> 4.4227568000000002 | U41: 14.86 | V41: - | W41: =RC[-2]*RC[-10]/1000 -> 1.027569 | X41: =ABS((RC[-3]*RC[-11]-RC[-2]*RC[-9])/1000) -> #VALUE! | Y41: =(RC[-14]-RC[1])/RC[-18]*100 -> -0.18020515663986678 | Z41: 14.86 | AC41: =VALUE(RC[-27]) -> 2018-10-20T00:00:00.000 | AD41: =IF(RC[21]=42,"*",IF(RC[21]=32,"",RC[21])) -> - | AE41: =RC[-28] -> 24 | AF41: =RC[-28] -> 158.88 | AG41: =RC[-28] -> 69.61 | AH41: =RC[-28] -> 6.93 | AI41: =RC[-28] -> 144.28 | AJ41: =RC[-28] -> 46 | AK41: =RC[-28] -> 5.46 | AL41: =RC[-28] -> 23.61 | AM41: =RC[-28] -> 14.6 | AN41: =RC[-28] -> 15.2 | AO41: =RC[-28] -> 69.150000000000006 | AP41: - | AQ41: =RC[-29] -> 0 | AR41: =RC[-29] -> 0 | AS41: - | AT41: =RC[-30] -> 0 | AU41: =RC[-30] -> 0 | AV41: =RC[-30] -> 1.026 | AW41: =RC[-30] -> 4.4219999999999997 | AY41: - | AZ41: - | BA41: -
A42: =IF(RC[1]="","",DATEVALUE(RC[1])) -> 43394 | B42: 21.10.18 | C42: 24 | D42: 161.69 | E42: 68.790000000000006 | F42: 6.85 | G42: 143.62 | H42: 45.38 | I42: 5.33 | J42: =RC[-5]-RC[-2] -> 23.410000000000004 | K42: 18.07 | L42: 18.809999999999999 | M42: 68.42 | R42: 1.2609999999999999 | S42: 4.6040000000000001 | T42: =(RC[-16]*RC[-15]-RC[-13]*RC[-12])/1000 -> 4.6051794999999993 | U42: 18.43 | V42: - | W42: =RC[-2]*RC[-10]/1000 -> 1.2609806000000001 | X42: =ABS((RC[-3]*RC[-11]-RC[-2]*RC[-9])/1000) -> #VALUE! | Y42: =(RC[-14]-RC[1])/RC[-18]*100 -> -0.2506614677621497 | Z42: 18.43 | AC42: =VALUE(RC[-27]) -> 2018-10-21T00:00:00.000 | AD42: =IF(RC[21]=42,"*",IF(RC[21]=32,"",RC[21])) -> - | AE42: =RC[-28] -> 24 | AF42: =RC[-28] -> 161.69 | AG42: =RC[-28] -> 68.790000000000006 | AH42: =RC[-28] -> 6.85 | AI42: =RC[-28] -> 143.62 | AJ42: =RC[-28] -> 45.38 | AK42: =RC[-28] -> 5.33 | AL42: =RC[-28] -> 23.410000000000004 | AM42: =RC[-28] -> 18.07 | AN42: =RC[-28] -> 18.809999999999999 | AO42: =RC[-28] -> 68.42 | AP42: - | AQ42: =RC[-29] -> 0 | AR42: =RC[-29] -> 0 | AS42: - | AT42: =RC[-30] -> 0 | AU42: =RC[-30] -> 0 | AV42: =RC[-30] -> 1.2609999999999999 | AW42: =RC[-30] -> 4.6040000000000001 | AY42: - | AZ42: - | BA42: -
A43: =IF(RC[1]="","",DATEVALUE(RC[1])) -> 43395 | B43: 22.10.18 | C43: 24 | D43: 161.02000000000001 | E43: 69.27 | F43: 6.87 | G43: 142.22999999999999 | H43: 45.21 | I43: 5.39 | J43: =RC[-5]-RC[-2] -> 24.059999999999995 | K43: 18.79 | L43: 19.54 | M43: 68.45 | R43: 1.3080000000000001 | S43: 4.7220000000000004 | T43: =(RC[-16]*RC[-15]-RC[-13]*RC[-12])/1000 -> 4.7236371000000013 | U43: 19.13 | V43: - | W43: =RC[-2]*RC[-10]/1000 -> 1.3094485 | X43: =ABS((RC[-3]*RC[-11]-RC[-2]*RC[-9])/1000) -> #VALUE! | Y43: =(RC[-14]-RC[1])/RC[-18]*100 -> -0.23904942698446172 | Z43: 19.13 | AC43: =VALUE(RC[-27]) -> 2018-10-22T00:00:00.000 | AD43: =IF(RC[21]=42,"*",IF(RC[21]=32,"",RC[21])) -> - | AE43: =RC[-28] -> 24 | AF43: =RC[-28] -> 161.02000000000001 | AG43: =RC[-28] -> 69.27 | AH43: =RC[-28] -> 6.87 | AI43: =RC[-28] -> 142.22999999999999 | AJ43: =RC[-28] -> 45.21 | AK43: =RC[-28] -> 5.39 | AL43: =RC[-28] -> 24.059999999999995 | AM43: =RC[-28] -> 18.79 | AN43: =RC[-28] -> 19.54 | AO43: =RC[-28] -> 68.45 | AP43: - | AQ43: =RC[-29] -> 0 | AR43: =RC[-29] -> 0 | AS43: - | AT43: =RC[-30] -> 0 | AU43: =RC[-30] -> 0 | AV43: =RC[-30] -> 1.3080000000000001 | AW43: =RC[-30] -> 4.7220000000000004 | AY43: - | AZ43: - | BA43: -
A44: =IF(RC[1]="","",DATEVALUE(RC[1])) ->  | C44: 24 | J44: =RC[-5]-RC[-2] -> #VALUE! | T44: =(RC[-16]*RC[-15]-RC[-13]*RC[-12])/1000 -> #VALUE! | W44: =RC[-2]*RC[-10]/1000 -> #VALUE! | X44: =ABS((RC[-3]*RC[-11]-RC[-2]*RC[-9])/1000) -> #VALUE! | Y44: =(RC[-14]-RC[1])/RC[-18]*100 -> #VALUE! | AC44: =VALUE(RC[-27]) -> #VALUE! | AD44: =IF(RC[21]=42,"*",IF(RC[21]=32,"",RC[21])) ->  | AE44: =RC[-28] -> 24 | AF44: =RC[-28] ->  | AG44: =RC[-28] ->  | AH44: =RC[-28] ->  | AI44: =RC[-28] ->  | AJ44: =RC[-28] ->  | AK44: =RC[-28] ->  | AL44: =RC[-28] -> #VALUE! | AM44: =RC[-28] ->  | AN44: =RC[-28] ->  | AO44: =RC[-28] ->  | AP44: - | AQ44: =RC[-29] -> 0 | AR44: =RC[-29] -> 0 | AS44: - | AT44: =RC[-30] -> 0 | AU44: =RC[-30] -> 0 | AV44: =RC[-30] ->  | AW44: =RC[-30] -> 
A45: =IF(RC[1]="","",DATEVALUE(RC[1])) ->  | C45: 24 | T45: =(RC[-16]*RC[-15]-RC[-13]*RC[-12])/1000 -> #VALUE! | W45: =RC[-2]*RC[-10]/1000 -> #VALUE! | X45: =ABS((RC[-3]*RC[-11]-RC[-2]*RC[-9])/1000) -> #VALUE! | Y45: =(RC[-14]-RC[1])/RC[-18]*100 -> #VALUE! | AC45: =VALUE(RC[-27]) -> #VALUE! | AD45: =IF(RC[21]=42,"*",IF(RC[21]=32,"",RC[21])) ->  | AE45: =RC[-28] -> 24 | AF45: =RC[-28] ->  | AG45: =RC[-28] ->  | AH45: =RC[-28] ->  | AI45: =RC[-28] ->  | AJ45: =RC[-28] ->  | AK45: =RC[-28] ->  | AL45: =RC[-28] -> 0 | AM45: =RC[-28] ->  | AN45: =RC[-28] ->  | AO45: =RC[-28] ->  | AP45: - | AQ45: =RC[-29] -> 0 | AR45: =RC[-29] -> 0 | AS45: - | AT45: =RC[-30] -> 0 | AU45: =RC[-30] -> 0 | AV45: =RC[-30] ->  | AW45: =RC[-30] -> 
A46: =IF(RC[1]="","",DATEVALUE(RC[1])) ->  | C46: 24 | T46: =(RC[-16]*RC[-15]-RC[-13]*RC[-12])/1000 -> #VALUE! | W46: =RC[-2]*RC[-10]/1000 -> #VALUE! | X46: =ABS((RC[-3]*RC[-11]-RC[-2]*RC[-9])/1000) -> #VALUE! | Y46: =(RC[-14]-RC[1])/RC[-18]*100 -> #VALUE! | AC46: =VALUE(RC[-27]) -> #VALUE! | AD46: =IF(RC[21]=42,"*",IF(RC[21]=32,"",RC[21])) ->  | AE46: =RC[-28] -> 24 | AF46: =RC[-28] ->  | AG46: =RC[-28] ->  | AH46: =RC[-28] ->  | AI46: =RC[-28] ->  | AJ46: =RC[-28] ->  | AK46: =RC[-28] ->  | AL46: =RC[-28] -> 0 | AM46: =RC[-28] ->  | AN46: =RC[-28] ->  | AO46: =RC[-28] ->  | AP46: - | AQ46: =RC[-29] -> 0 | AR46: =RC[-29] -> 0 | AS46: - | AT46: =RC[-30] -> 0 | AU46: =RC[-30] -> 0 | AV46: =RC[-30] ->  | AW46: =RC[-30] -> 
A47: =IF(RC[1]="","",DATEVALUE(RC[1])) ->  | C47: 24 | T47: =(RC[-16]*RC[-15]-RC[-13]*RC[-12])/1000 -> #VALUE! | W47: =RC[-2]*RC[-10]/1000 -> #VALUE! | X47: =ABS((RC[-3]*RC[-11]-RC[-2]*RC[-9])/1000) -> #VALUE! | Y47: =(RC[-14]-RC[1])/RC[-18]*100 -> #VALUE! | AC47: =VALUE(RC[-27]) -> #VALUE! | AD47: =IF(RC[21]=42,"*",IF(RC[21]=32,"",RC[21])) ->  | AE47: =RC[-28] -> 24 | AF47: =RC[-28] ->  | AG47: =RC[-28] ->  | AH47: =RC[-28] ->  | AI47: =RC[-28] ->  | AJ47: =RC[-28] ->  | AK47: =RC[-28] ->  | AL47: =RC[-28] -> 0 | AM47: =RC[-28] ->  | AN47: =RC[-28] ->  | AO47: =RC[-28] ->  | AP47: - | AQ47: =RC[-29] -> 0 | AR47: =RC[-29] -> 0 | AS47: - | AT47: =RC[-30] -> 0 | AU47: =RC[-30] -> 0 | AV47: =RC[-30] ->  | AW47: =RC[-30] -> 
A48: =IF(RC[1]="","",DATEVALUE(RC[1])) ->  | C48: 24 | T48: =(RC[-16]*RC[-15]-RC[-13]*RC[-12])/1000 -> #VALUE! | W48: =RC[-2]*RC[-10]/1000 -> #VALUE! | X48: =ABS((RC[-3]*RC[-11]-RC[-2]*RC[-9])/1000) -> #VALUE! | Y48: =(RC[-14]-RC[1])/RC[-18]*100 -> #VALUE! | AC48: =VALUE(RC[-27]) -> #VALUE! | AD48: =IF(RC[21]=42,"*",IF(RC[21]=32,"",RC[21])) ->  | AE48: =RC[-28] -> 24 | AF48: =RC[-28] ->  | AG48: =RC[-28] ->  | AH48: =RC[-28] ->  | AI48: =RC[-28] ->  | AJ48: =RC[-28] ->  | AK48: =RC[-28] ->  | AL48: =RC[-28] -> 0 | AM48: =RC[-28] ->  | AN48: =RC[-28] ->  | AO48: =RC[-28] ->  | AP48: - | AQ48: =RC[-29] -> 0 | AR48: =RC[-29] -> 0 | AS48: - | AT48: =RC[-30] -> 0 | AU48: =RC[-30] -> 0 | AV48: =RC[-30] ->  | AW48: =RC[-30] -> 
A49: =IF(RC[1]="","",DATEVALUE(RC[1])) ->  | C49: 24 | T49: =(RC[-16]*RC[-15]-RC[-13]*RC[-12])/1000 -> #VALUE! | W49: =RC[-2]*RC[-10]/1000 -> #VALUE! | X49: =ABS((RC[-3]*RC[-11]-RC[-2]*RC[-9])/1000) -> #VALUE! | Y49: =(RC[-14]-RC[1])/RC[-18]*100 -> #VALUE! | AC49: =VALUE(RC[-27]) -> #VALUE! | AD49: =IF(RC[21]=42,"*",IF(RC[21]=32,"",RC[21])) ->  | AE49: =RC[-28] -> 24 | AF49: =RC[-28] ->  | AG49: =RC[-28] ->  | AH49: =RC[-28] ->  | AI49: =RC[-28] ->  | AJ49: =RC[-28] ->  | AK49: =RC[-28] ->  | AL49: =RC[-28] -> 0 | AM49: =RC[-28] ->  | AN49: =RC[-28] ->  | AO49: =RC[-28] ->  | AP49: - | AQ49: =RC[-29] -> 0 | AR49: =RC[-29] -> 0 | AS49: - | AT49: =RC[-30] -> 0 | AU49: =RC[-30] -> 0 | AV49: =RC[-30] ->  | AW49: =RC[-30] -> 
A50: =IF(RC[1]="","",DATEVALUE(RC[1])) ->  | T50: =(RC[-16]*RC[-15]-RC[-13]*RC[-12])/1000 -> #VALUE! | W50: =RC[-2]*RC[-10]/1000 -> #VALUE! | X50: =ABS((RC[-3]*RC[-11]-RC[-2]*RC[-9])/1000) -> #VALUE! | Y50: =(RC[-14]-RC[1])/RC[-18]*100 -> #VALUE! | AC50: =VALUE(RC[-27]) -> #VALUE! | AD50: =IF(RC[21]=42,"*",IF(RC[21]=32,"",RC[21])) ->  | AE50: =RC[-28] ->  | AF50: =RC[-28] ->  | AG50: =RC[-28] ->  | AH50: =RC[-28] ->  | AI50: =RC[-28] ->  | AJ50: =RC[-28] ->  | AK50: =RC[-28] ->  | AL50: =RC[-28] -> 0 | AM50: =RC[-28] ->  | AN50: =RC[-28] ->  | AO50: =RC[-28] ->  | AP50: - | AQ50: =RC[-29] -> 0 | AR50: =RC[-29] -> 0 | AS50: - | AT50: =RC[-30] -> 0 | AU50: =RC[-30] -> 0 | AV50: =RC[-30] ->  | AW50: =RC[-30] -> 
A51: =IF(RC[1]="","",DATEVALUE(RC[1])) ->  | T51: =(RC[-16]*RC[-15]-RC[-13]*RC[-12])/1000 -> #VALUE! | W51: =RC[-2]*RC[-10]/1000 -> #VALUE! | X51: =ABS((RC[-3]*RC[-11]-RC[-2]*RC[-9])/1000) -> #VALUE! | Y51: =(RC[-14]-RC[1])/RC[-18]*100 -> #VALUE! | AC51: =VALUE(RC[-27]) -> #VALUE! | AD51: =IF(RC[21]=42,"*",IF(RC[21]=32,"",RC[21])) ->  | AE51: =RC[-28] ->  | AF51: =RC[-28] ->  | AG51: =RC[-28] ->  | AH51: =RC[-28] ->  | AI51: =RC[-28] ->  | AJ51: =RC[-28] ->  | AK51: =RC[-28] ->  | AL51: =RC[-28] -> 0 | AM51: =RC[-28] ->  | AN51: =RC[-28] ->  | AO51: =RC[-28] ->  | AP51: - | AQ51: =RC[-29] -> 0 | AR51: =RC[-29] -> 0 | AS51: - | AT51: =RC[-30] -> 0 | AU51: =RC[-30] -> 0 | AV51: =RC[-30] ->  | AW51: =RC[-30] -> 
A52: =IF(RC[1]="","",DATEVALUE(RC[1])) ->  | T52: =(RC[-16]*RC[-15]-RC[-13]*RC[-12])/1000 -> #VALUE! | W52: =RC[-2]*RC[-10]/1000 -> #VALUE! | X52: =ABS((RC[-3]*RC[-11]-RC[-2]*RC[-9])/1000) -> #VALUE! | Y52: =(RC[-14]-RC[1])/RC[-18]*100 -> #VALUE! | AC52: =VALUE(RC[-27]) -> #VALUE! | AD52: =IF(RC[21]=42,"*",IF(RC[21]=32,"",RC[21])) ->  | AE52: =RC[-28] ->  | AF52: =RC[-28] ->  | AG52: =RC[-28] ->  | AH52: =RC[-28] ->  | AI52: =RC[-28] ->  | AJ52: =RC[-28] ->  | AK52: =RC[-28] ->  | AL52: =RC[-28] -> 0 | AM52: =RC[-28] ->  | AN52: =RC[-28] ->  | AO52: =RC[-28] ->  | AP52: - | AQ52: =RC[-29] -> 0 | AR52: =RC[-29] -> 0 | AS52: - | AT52: =RC[-30] -> 0 | AU52: =RC[-30] -> 0 | AV52: =RC[-30] ->  | AW52: =RC[-30] -> 
A53: =IF(RC[1]="","",DATEVALUE(RC[1])) ->  | T53: =(RC[-16]*RC[-15]-RC[-13]*RC[-12])/1000 -> #VALUE! | W53: =RC[-2]*RC[-10]/1000 -> #VALUE! | X53: =ABS((RC[-3]*RC[-11]-RC[-2]*RC[-9])/1000) -> #VALUE! | Y53: =(RC[-14]-RC[1])/RC[-18]*100 -> #VALUE! | AC53: =VALUE(RC[-27]) -> #VALUE! | AD53: =IF(RC[21]=42,"*",IF(RC[21]=32,"",RC[21])) ->  | AE53: =RC[-28] ->  | AF53: =RC[-28] ->  | AG53: =RC[-28] ->  | AH53: =RC[-28] ->  | AI53: =RC[-28] ->  | AJ53: =RC[-28] ->  | AK53: =RC[-28] ->  | AL53: =RC[-28] -> 0 | AM53: =RC[-28] ->  | AN53: =RC[-28] ->  | AO53: =RC[-28] ->  | AP53: - | AQ53: =RC[-29] -> 0 | AR53: =RC[-29] -> 0 | AS53: - | AT53: =RC[-30] -> 0 | AU53: =RC[-30] -> 0 | AV53: =RC[-30] ->  | AW53: =RC[-30] -> 
A54: =IF(RC[1]="","",DATEVALUE(RC[1])) ->  | T54: =(RC[-16]*RC[-15]-RC[-13]*RC[-12])/1000 -> #VALUE! | W54: =RC[-2]*RC[-10]/1000 -> #VALUE! | X54: =ABS((RC[-3]*RC[-11]-RC[-2]*RC[-9])/1000) -> #VALUE! | Y54: =(RC[-14]-RC[1])/RC[-18]*100 -> #VALUE! | AC54: =VALUE(RC[-27]) -> #VALUE! | AD54: =IF(RC[21]=42,"*",IF(RC[21]=32,"",RC[21])) ->  | AE54: =RC[-28] ->  | AF54: =RC[-28] ->  | AG54: =RC[-28] ->  | AH54: =RC[-28] ->  | AI54: =RC[-28] ->  | AJ54: =RC[-28] ->  | AK54: =RC[-28] ->  | AL54: =RC[-28] -> 0 | AM54: =RC[-28] ->  | AN54: =RC[-28] ->  | AO54: =RC[-28] ->  | AP54: - | AQ54: =RC[-29] -> 0 | AR54: =RC[-29] -> 0 | AS54: - | AT54: =RC[-30] -> 0 | AU54: =RC[-30] -> 0 | AV54: =RC[-30] ->  | AW54: =RC[-30] -> 
A55: =IF(RC[1]="","",DATEVALUE(RC[1])) ->  | T55: =(RC[-16]*RC[-15]-RC[-13]*RC[-12])/1000 -> #VALUE! | W55: =RC[-2]*RC[-10]/1000 -> #VALUE! | X55: =ABS((RC[-3]*RC[-11]-RC[-2]*RC[-9])/1000) -> #VALUE! | Y55: =(RC[-14]-RC[1])/RC[-18]*100 -> #VALUE! | AC55: =VALUE(RC[-27]) -> #VALUE! | AD55: =IF(RC[21]=42,"*",IF(RC[21]=32,"",RC[21])) ->  | AE55: =RC[-28] ->  | AF55: =RC[-28] ->  | AG55: =RC[-28] ->  | AH55: =RC[-28] ->  | AI55: =RC[-28] ->  | AJ55: =RC[-28] ->  | AK55: =RC[-28] ->  | AL55: =RC[-28] -> 0 | AM55: =RC[-28] ->  | AN55: =RC[-28] ->  | AO55: =RC[-28] ->  | AP55: - | AQ55: =RC[-29] -> 0 | AR55: =RC[-29] -> 0 | AS55: - | AT55: =RC[-30] -> 0 | AU55: =RC[-30] -> 0 | AV55: =RC[-30] ->  | AW55: =RC[-30] -> 
A56: =IF(RC[1]="","",DATEVALUE(RC[1])) ->  | T56: =(RC[-16]*RC[-15]-RC[-13]*RC[-12])/1000 -> #VALUE! | W56: =RC[-2]*RC[-10]/1000 -> #VALUE! | X56: =ABS((RC[-3]*RC[-11]-RC[-2]*RC[-9])/1000) -> #VALUE! | Y56: =(RC[-14]-RC[1])/RC[-18]*100 -> #VALUE! | AC56: =VALUE(RC[-27]) -> #VALUE! | AD56: =IF(RC[21]=42,"*",IF(RC[21]=32,"",RC[21])) ->  | AE56: =RC[-28] ->  | AF56: =RC[-28] ->  | AG56: =RC[-28] ->  | AH56: =RC[-28] ->  | AI56: =RC[-28] ->  | AJ56: =RC[-28] ->  | AK56: =RC[-28] ->  | AL56: =RC[-28] -> 0 | AM56: =RC[-28] ->  | AN56: =RC[-28] ->  | AO56: =RC[-28] ->  | AP56: - | AQ56: =RC[-29] -> 0 | AR56: =RC[-29] -> 0 | AS56: - | AT56: =RC[-30] -> 0 | AU56: =RC[-30] -> 0 | AV56: =RC[-30] ->  | AW56: =RC[-30] -> 
A57: =IF(RC[1]="","",DATEVALUE(RC[1])) ->  | T57: =(RC[-16]*RC[-15]-RC[-13]*RC[-12])/1000 -> #VALUE! | W57: =RC[-2]*RC[-10]/1000 -> #VALUE! | X57: =ABS((RC[-3]*RC[-11]-RC[-2]*RC[-9])/1000) -> #VALUE! | Y57: =(RC[-14]-RC[1])/RC[-18]*100 -> #VALUE! | AC57: =VALUE(RC[-27]) -> #VALUE! | AD57: =IF(RC[21]=42,"*",IF(RC[21]=32,"",RC[21])) ->  | AE57: =RC[-28] ->  | AF57: =RC[-28] ->  | AG57: =RC[-28] ->  | AH57: =RC[-28] ->  | AI57: =RC[-28] ->  | AJ57: =RC[-28] ->  | AK57: =RC[-28] ->  | AL57: =RC[-28] -> 0 | AM57: =RC[-28] ->  | AN57: =RC[-28] ->  | AO57: =RC[-28] ->  | AP57: - | AQ57: =RC[-29] -> 0 | AR57: =RC[-29] -> 0 | AS57: - | AT57: =RC[-30] -> 0 | AU57: =RC[-30] -> 0 | AV57: =RC[-30] ->  | AW57: =RC[-30] -> 
A58: =IF(RC[1]="","",DATEVALUE(RC[1])) ->  | T58: =(RC[-16]*RC[-15]-RC[-13]*RC[-12])/1000 -> #VALUE! | W58: =RC[-2]*RC[-10]/1000 -> #VALUE! | X58: =ABS((RC[-3]*RC[-11]-RC[-2]*RC[-9])/1000) -> #VALUE! | Y58: =(RC[-14]-RC[1])/RC[-18]*100 -> #VALUE! | AC58: =VALUE(RC[-27]) -> #VALUE! | AD58: =IF(RC[21]=42,"*",IF(RC[21]=32,"",RC[21])) ->  | AE58: =RC[-28] ->  | AF58: =RC[-28] ->  | AG58: =RC[-28] ->  | AH58: =RC[-28] ->  | AI58: =RC[-28] ->  | AJ58: =RC[-28] ->  | AK58: =RC[-28] ->  | AL58: =RC[-28] -> 0 | AM58: =RC[-28] ->  | AN58: =RC[-28] ->  | AO58: =RC[-28] ->  | AP58: - | AQ58: =RC[-29] -> 0 | AR58: =RC[-29] -> 0 | AS58: - | AT58: =RC[-30] -> 0 | AU58: =RC[-30] -> 0 | AV58: =RC[-30] ->  | AW58: =RC[-30] -> 
A59: =IF(RC[1]="","",DATEVALUE(RC[1])) ->  | T59: =(RC[-16]*RC[-15]-RC[-13]*RC[-12])/1000 -> #VALUE! | W59: =RC[-2]*RC[-10]/1000 -> #VALUE! | X59: =ABS((RC[-3]*RC[-11]-RC[-2]*RC[-9])/1000) -> #VALUE! | Y59: =(RC[-14]-RC[1])/RC[-18]*100 -> #VALUE! | AC59: =VALUE(RC[-27]) -> #VALUE! | AD59: =IF(RC[21]=42,"*",IF(RC[21]=32,"",RC[21])) ->  | AE59: =RC[-28] ->  | AF59: =RC[-28] ->  | AG59: =RC[-28] ->  | AH59: =RC[-28] ->  | AI59: =RC[-28] ->  | AJ59: =RC[-28] ->  | AK59: =RC[-28] ->  | AL59: =RC[-28] -> 0 | AM59: =RC[-28] ->  | AN59: =RC[-28] ->  | AO59: =RC[-28] ->  | AP59: - | AQ59: =RC[-29] -> 0 | AR59: =RC[-29] -> 0 | AS59: - | AT59: =RC[-30] -> 0 | AU59: =RC[-30] -> 0 | AV59: =RC[-30] ->  | AW59: =RC[-30] -> 
A60: =IF(RC[1]="","",DATEVALUE(RC[1])) ->  | T60: =(RC[-16]*RC[-15]-RC[-13]*RC[-12])/1000 -> #VALUE! | W60: =RC[-2]*RC[-10]/1000 -> #VALUE! | X60: =ABS((RC[-3]*RC[-11]-RC[-2]*RC[-9])/1000) -> #VALUE! | Y60: =(RC[-14]-RC[1])/RC[-18]*100 -> #VALUE! | AC60: =VALUE(RC[-27]) -> #VALUE! | AD60: =IF(RC[21]=42,"*",IF(RC[21]=32,"",RC[21])) ->  | AE60: =RC[-28] ->  | AF60: =RC[-28] ->  | AG60: =RC[-28] ->  | AH60: =RC[-28] ->  | AI60: =RC[-28] ->  | AJ60: =RC[-28] ->  | AK60: =RC[-28] ->  | AL60: =RC[-28] -> 0 | AM60: =RC[-28] ->  | AN60: =RC[-28] ->  | AO60: =RC[-28] ->  | AP60: - | AQ60: =RC[-29] -> 0 | AR60: =RC[-29] -> 0 | AS60: - | AT60: =RC[-30] -> 0 | AU60: =RC[-30] -> 0 | AV60: =RC[-30] ->  | AW60: =RC[-30] -> 
A61: =IF(RC[1]="","",DATEVALUE(RC[1])) ->  | T61: =(RC[-16]*RC[-15]-RC[-13]*RC[-12])/1000 -> #VALUE! | W61: =RC[-2]*RC[-10]/1000 -> #VALUE! | X61: =ABS((RC[-3]*RC[-11]-RC[-2]*RC[-9])/1000) -> #VALUE! | Y61: =(RC[-14]-RC[1])/RC[-18]*100 -> #VALUE! | AC61: =VALUE(RC[-27]) -> #VALUE! | AD61: =IF(RC[21]=42,"*",IF(RC[21]=32,"",RC[21])) ->  | AE61: =RC[-28] ->  | AF61: =RC[-28] ->  | AG61: =RC[-28] ->  | AH61: =RC[-28] ->  | AI61: =RC[-28] ->  | AJ61: =RC[-28] ->  | AK61: =RC[-28] ->  | AL61: =RC[-28] -> 0 | AM61: =RC[-28] ->  | AN61: =RC[-28] ->  | AO61: =RC[-28] ->  | AP61: - | AQ61: =RC[-29] -> 0 | AR61: =RC[-29] -> 0 | AS61: - | AT61: =RC[-30] -> 0 | AU61: =RC[-30] -> 0 | AV61: =RC[-30] ->  | AW61: =RC[-30] -> 
A62: =IF(RC[1]="","",DATEVALUE(RC[1])) ->  | T62: =(RC[-16]*RC[-15]-RC[-13]*RC[-12])/1000 -> #VALUE! | W62: =RC[-2]*RC[-10]/1000 -> #VALUE! | X62: =ABS((RC[-3]*RC[-11]-RC[-2]*RC[-9])/1000) -> #VALUE! | Y62: =(RC[-14]-RC[1])/RC[-18]*100 -> #VALUE! | AC62: =VALUE(RC[-27]) -> #VALUE! | AD62: =IF(RC[21]=42,"*",IF(RC[21]=32,"",RC[21])) ->  | AE62: =RC[-28] ->  | AF62: =RC[-28] ->  | AG62: =RC[-28] ->  | AH62: =RC[-28] ->  | AI62: =RC[-28] ->  | AJ62: =RC[-28] ->  | AK62: =RC[-28] ->  | AL62: =RC[-28] -> 0 | AM62: =RC[-28] ->  | AN62: =RC[-28] ->  | AO62: =RC[-28] ->  | AP62: - | AQ62: =RC[-29] -> 0 | AR62: =RC[-29] -> 0 | AS62: - | AT62: =RC[-30] -> 0 | AU62: =RC[-30] -> 0 | AV62: =RC[-30] ->  | AW62: =RC[-30] -> 
A63: =IF(RC[1]="","",DATEVALUE(RC[1])) ->  | T63: =(RC[-16]*RC[-15]-RC[-13]*RC[-12])/1000 -> #VALUE! | W63: =RC[-2]*RC[-10]/1000 -> #VALUE! | X63: =ABS((RC[-3]*RC[-11]-RC[-2]*RC[-9])/1000) -> #VALUE! | Y63: =(RC[-14]-RC[1])/RC[-18]*100 -> #VALUE! | AC63: =VALUE(RC[-27]) -> #VALUE! | AD63: =IF(RC[21]=42,"*",IF(RC[21]=32,"",RC[21])) ->  | AE63: =RC[-28] ->  | AF63: =RC[-28] ->  | AG63: =RC[-28] ->  | AH63: =RC[-28] ->  | AI63: =RC[-28] ->  | AJ63: =RC[-28] ->  | AK63: =RC[-28] ->  | AL63: =RC[-28] -> 0 | AM63: =RC[-28] ->  | AN63: =RC[-28] ->  | AO63: =RC[-28] ->  | AP63: - | AQ63: =RC[-29] -> 0 | AR63: =RC[-29] -> 0 | AS63: - | AT63: =RC[-30] -> 0 | AU63: =RC[-30] -> 0 | AV63: =RC[-30] ->  | AW63: =RC[-30] -> 
A64: =IF(RC[1]="","",DATEVALUE(RC[1])) ->  | T64: =(RC[-16]*RC[-15]-RC[-13]*RC[-12])/1000 -> #VALUE! | W64: =RC[-2]*RC[-10]/1000 -> #VALUE! | X64: =ABS((RC[-3]*RC[-11]-RC[-2]*RC[-9])/1000) -> #VALUE! | Y64: =(RC[-14]-RC[1])/RC[-18]*100 -> #VALUE! | AC64: =VALUE(RC[-27]) -> #VALUE! | AD64: =IF(RC[21]=42,"*",IF(RC[21]=32,"",RC[21])) ->  | AE64: =RC[-28] ->  | AF64: =RC[-28] ->  | AG64: =RC[-28] ->  | AH64: =RC[-28] ->  | AI64: =RC[-28] ->  | AJ64: =RC[-28] ->  | AK64: =RC[-28] ->  | AL64: =RC[-28] -> 0 | AM64: =RC[-28] ->  | AN64: =RC[-28] ->  | AO64: =RC[-28] ->  | AP64: - | AQ64: =RC[-29] -> 0 | AR64: =RC[-29] -> 0 | AS64: - | AT64: =RC[-30] -> 0 | AU64: =RC[-30] -> 0 | AV64: =RC[-30] ->  | AW64: =RC[-30] -> 
A65: =IF(RC[1]="","",DATEVALUE(RC[1])) ->  | T65: =(RC[-16]*RC[-15]-RC[-13]*RC[-12])/1000 -> #VALUE! | W65: =RC[-2]*RC[-10]/1000 -> #VALUE! | X65: =ABS((RC[-3]*RC[-11]-RC[-2]*RC[-9])/1000) -> #VALUE! | Y65: =(RC[-14]-RC[1])/RC[-18]*100 -> #VALUE! | AC65: =VALUE(RC[-27]) -> #VALUE! | AD65: =IF(RC[21]=42,"*",IF(RC[21]=32,"",RC[21])) ->  | AE65: =RC[-28] ->  | AF65: =RC[-28] ->  | AG65: =RC[-28] ->  | AH65: =RC[-28] ->  | AI65: =RC[-28] ->  | AJ65: =RC[-28] ->  | AK65: =RC[-28] ->  | AL65: =RC[-28] -> 0 | AM65: =RC[-28] ->  | AN65: =RC[-28] ->  | AO65: =RC[-28] ->  | AP65: - | AQ65: =RC[-29] -> 0 | AR65: =RC[-29] -> 0 | AS65: - | AT65: =RC[-30] -> 0 | AU65: =RC[-30] -> 0 | AV65: =RC[-30] ->  | AW65: =RC[-30] -> 
A66: =IF(RC[1]="","",DATEVALUE(RC[1])) ->  | T66: =(RC[-16]*RC[-15]-RC[-13]*RC[-12])/1000 -> #VALUE! | W66: =RC[-2]*RC[-10]/1000 -> #VALUE! | X66: =ABS((RC[-3]*RC[-11]-RC[-2]*RC[-9])/1000) -> #VALUE! | Y66: =(RC[-14]-RC[1])/RC[-18]*100 -> #VALUE! | AC66: =VALUE(RC[-27]) -> #VALUE! | AD66: =IF(RC[21]=42,"*",IF(RC[21]=32,"",RC[21])) ->  | AE66: =RC[-28] ->  | AF66: =RC[-28] ->  | AG66: =RC[-28] ->  | AH66: =RC[-28] ->  | AI66: =RC[-28] ->  | AJ66: =RC[-28] ->  | AK66: =RC[-28] ->  | AL66: =RC[-28] -> 0 | AM66: =RC[-28] ->  | AN66: =RC[-28] ->  | AO66: =RC[-28] ->  | AP66: - | AQ66: =RC[-29] -> 0 | AR66: =RC[-29] -> 0 | AS66: - | AT66: =RC[-30] -> 0 | AU66: =RC[-30] -> 0 | AV66: =RC[-30] ->  | AW66: =RC[-30] -> 
A67: =IF(RC[1]="","",DATEVALUE(RC[1])) ->  | T67: =(RC[-16]*RC[-15]-RC[-13]*RC[-12])/1000 -> #VALUE! | W67: =RC[-2]*RC[-10]/1000 -> #VALUE! | X67: =ABS((RC[-3]*RC[-11]-RC[-2]*RC[-9])/1000) -> #VALUE! | Y67: =(RC[-14]-RC[1])/RC[-18]*100 -> #VALUE! | AC67: =VALUE(RC[-27]) -> #VALUE! | AD67: =IF(RC[21]=42,"*",IF(RC[21]=32,"",RC[21])) ->  | AE67: =RC[-28] ->  | AF67: =RC[-28] ->  | AG67: =RC[-28] ->  | AH67: =RC[-28] ->  | AI67: =RC[-28] ->  | AJ67: =RC[-28] ->  | AK67: =RC[-28] ->  | AL67: =RC[-28] -> 0 | AM67: =RC[-28] ->  | AN67: =RC[-28] ->  | AO67: =RC[-28] ->  | AP67: - | AQ67: =RC[-29] -> 0 | AR67: =RC[-29] -> 0 | AS67: - | AT67: =RC[-30] -> 0 | AU67: =RC[-30] -> 0 | AV67: =RC[-30] ->  | AW67: =RC[-30] -> 
A68: =IF(RC[1]="","",DATEVALUE(RC[1])) ->  | T68: =(RC[-16]*RC[-15]-RC[-13]*RC[-12])/1000 -> #VALUE! | W68: =RC[-2]*RC[-10]/1000 -> #VALUE! | X68: =ABS((RC[-3]*RC[-11]-RC[-2]*RC[-9])/1000) -> #VALUE! | Y68: =(RC[-14]-RC[1])/RC[-18]*100 -> #VALUE! | AC68: =VALUE(RC[-27]) -> #VALUE! | AD68: =IF(RC[21]=42,"*",IF(RC[21]=32,"",RC[21])) ->  | AE68: =RC[-28] ->  | AF68: =RC[-28] ->  | AG68: =RC[-28] ->  | AH68: =RC[-28] ->  | AI68: =RC[-28] ->  | AJ68: =RC[-28] ->  | AK68: =RC[-28] ->  | AL68: =RC[-28] -> 0 | AM68: =RC[-28] ->  | AN68: =RC[-28] ->  | AO68: =RC[-28] ->  | AP68: - | AQ68: =RC[-29] -> 0 | AR68: =RC[-29] -> 0 | AS68: - | AT68: =RC[-30] -> 0 | AU68: =RC[-30] -> 0 | AV68: =RC[-30] ->  | AW68: =RC[-30] -> 
A69: =IF(RC[1]="","",DATEVALUE(RC[1])) ->  | T69: =(RC[-16]*RC[-15]-RC[-13]*RC[-12])/1000 -> #VALUE! | W69: =RC[-2]*RC[-10]/1000 -> #VALUE! | X69: =ABS((RC[-3]*RC[-11]-RC[-2]*RC[-9])/1000) -> #VALUE! | Y69: =(RC[-14]-RC[1])/RC[-18]*100 -> #VALUE! | AC69: =VALUE(RC[-27]) -> #VALUE! | AD69: =IF(RC[21]=42,"*",IF(RC[21]=32,"",RC[21])) ->  | AE69: =RC[-28] ->  | AF69: =RC[-28] ->  | AG69: =RC[-28] ->  | AH69: =RC[-28] ->  | AI69: =RC[-28] ->  | AJ69: =RC[-28] ->  | AK69: =RC[-28] ->  | AL69: =RC[-28] -> 0 | AM69: =RC[-28] ->  | AN69: =RC[-28] ->  | AO69: =RC[-28] ->  | AP69: - | AQ69: =RC[-29] -> 0 | AR69: =RC[-29] -> 0 | AS69: - | AT69: =RC[-30] -> 0 | AU69: =RC[-30] -> 0 | AV69: =RC[-30] ->  | AW69: =RC[-30] -> 
A70: =IF(RC[1]="","",DATEVALUE(RC[1])) ->  | T70: =(RC[-16]*RC[-15]-RC[-13]*RC[-12])/1000 -> #VALUE! | W70: =RC[-2]*RC[-10]/1000 -> #VALUE! | X70: =ABS((RC[-3]*RC[-11]-RC[-2]*RC[-9])/1000) -> #VALUE! | Y70: =(RC[-14]-RC[1])/RC[-18]*100 -> #VALUE! | AC70: =VALUE(RC[-27]) -> #VALUE! | AD70: =IF(RC[21]=42,"*",IF(RC[21]=32,"",RC[21])) ->  | AE70: =RC[-28] ->  | AF70: =RC[-28] ->  | AG70: =RC[-28] ->  | AH70: =RC[-28] ->  | AI70: =RC[-28] ->  | AJ70: =RC[-28] ->  | AK70: =RC[-28] ->  | AL70: =RC[-28] -> 0 | AM70: =RC[-28] ->  | AN70: =RC[-28] ->  | AO70: =RC[-28] ->  | AP70: - | AQ70: =RC[-29] -> 0 | AR70: =RC[-29] -> 0 | AS70: - | AT70: =RC[-30] -> 0 | AU70: =RC[-30] -> 0 | AV70: =RC[-30] ->  | AW70: =RC[-30] -> 
A71: =IF(RC[1]="","",DATEVALUE(RC[1])) ->  | T71: =(RC[-16]*RC[-15]-RC[-13]*RC[-12])/1000 -> #VALUE! | W71: =RC[-2]*RC[-10]/1000 -> #VALUE! | X71: =ABS((RC[-3]*RC[-11]-RC[-2]*RC[-9])/1000) -> #VALUE! | Y71: =(RC[-14]-RC[1])/RC[-18]*100 -> #VALUE! | AC71: =VALUE(RC[-27]) -> #VALUE! | AD71: =IF(RC[21]=42,"*",IF(RC[21]=32,"",RC[21])) ->  | AE71: =RC[-28] ->  | AF71: =RC[-28] ->  | AG71: =RC[-28] ->  | AH71: =RC[-28] ->  | AI71: =RC[-28] ->  | AJ71: =RC[-28] ->  | AK71: =RC[-28] ->  | AL71: =RC[-28] -> 0 | AM71: =RC[-28] ->  | AN71: =RC[-28] ->  | AO71: =RC[-28] ->  | AP71: - | AQ71: =RC[-29] -> 0 | AR71: =RC[-29] -> 0 | AS71: - | AT71: =RC[-30] -> 0 | AU71: =RC[-30] -> 0 | AV71: =RC[-30] ->  | AW71: =RC[-30] -> 
A72: =IF(RC[1]="","",DATEVALUE(RC[1])) ->  | T72: =(RC[-16]*RC[-15]-RC[-13]*RC[-12])/1000 -> #VALUE! | W72: =RC[-2]*RC[-10]/1000 -> #VALUE! | X72: =ABS((RC[-3]*RC[-11]-RC[-2]*RC[-9])/1000) -> #VALUE! | Y72: =(RC[-14]-RC[1])/RC[-18]*100 -> #VALUE! | AC72: =VALUE(RC[-27]) -> #VALUE! | AD72: =IF(RC[21]=42,"*",IF(RC[21]=32,"",RC[21])) ->  | AE72: =RC[-28] ->  | AF72: =RC[-28] ->  | AG72: =RC[-28] ->  | AH72: =RC[-28] ->  | AI72: =RC[-28] ->  | AJ72: =RC[-28] ->  | AK72: =RC[-28] ->  | AL72: =RC[-28] -> 0 | AM72: =RC[-28] ->  | AN72: =RC[-28] ->  | AO72: =RC[-28] ->  | AP72: - | AQ72: =RC[-29] -> 0 | AR72: =RC[-29] -> 0 | AS72: - | AT72: =RC[-30] -> 0 | AU72: =RC[-30] -> 0 | AV72: =RC[-30] ->  | AW72: =RC[-30] -> 
A73: =IF(RC[1]="","",DATEVALUE(RC[1])) ->  | T73: =(RC[-16]*RC[-15]-RC[-13]*RC[-12])/1000 -> #VALUE! | W73: =RC[-2]*RC[-10]/1000 -> #VALUE! | X73: =ABS((RC[-3]*RC[-11]-RC[-2]*RC[-9])/1000) -> #VALUE! | Y73: =(RC[-14]-RC[1])/RC[-18]*100 -> #VALUE! | AC73: =VALUE(RC[-27]) -> #VALUE! | AD73: =IF(RC[21]=42,"*",IF(RC[21]=32,"",RC[21])) ->  | AE73: =RC[-28] ->  | AF73: =RC[-28] ->  | AG73: =RC[-28] ->  | AH73: =RC[-28] ->  | AI73: =RC[-28] ->  | AJ73: =RC[-28] ->  | AK73: =RC[-28] ->  | AL73: =RC[-28] -> 0 | AM73: =RC[-28] ->  | AN73: =RC[-28] ->  | AO73: =RC[-28] ->  | AP73: - | AQ73: =RC[-29] -> 0 | AR73: =RC[-29] -> 0 | AS73: - | AT73: =RC[-30] -> 0 | AU73: =RC[-30] -> 0 | AV73: =RC[-30] ->  | AW73: =RC[-30] -> 
A74: =IF(RC[1]="","",DATEVALUE(RC[1])) ->  | T74: =(RC[-16]*RC[-15]-RC[-13]*RC[-12])/1000 -> #VALUE! | W74: =RC[-2]*RC[-10]/1000 -> #VALUE! | X74: =ABS((RC[-3]*RC[-11]-RC[-2]*RC[-9])/1000) -> #VALUE! | Y74: =(RC[-14]-RC[1])/RC[-18]*100 -> #VALUE! | AC74: =VALUE(RC[-27]) -> #VALUE! | AD74: =IF(RC[21]=42,"*",IF(RC[21]=32,"",RC[21])) ->  | AE74: =RC[-28] ->  | AF74: =RC[-28] ->  | AG74: =RC[-28] ->  | AH74: =RC[-28] ->  | AI74: =RC[-28] ->  | AJ74: =RC[-28] ->  | AK74: =RC[-28] ->  | AL74: =RC[-28] -> 0 | AM74: =RC[-28] ->  | AN74: =RC[-28] ->  | AO74: =RC[-28] ->  | AP74: - | AQ74: =RC[-29] -> 0 | AR74: =RC[-29] -> 0 | AS74: - | AT74: =RC[-30] -> 0 | AU74: =RC[-30] -> 0 | AV74: =RC[-30] ->  | AW74: =RC[-30] -> 
A75: =IF(RC[1]="","",DATEVALUE(RC[1])) ->  | T75: =(RC[-16]*RC[-15]-RC[-13]*RC[-12])/1000 -> #VALUE! | W75: =RC[-2]*RC[-10]/1000 -> #VALUE! | X75: =ABS((RC[-3]*RC[-11]-RC[-2]*RC[-9])/1000) -> #VALUE! | Y75: =(RC[-14]-RC[1])/RC[-18]*100 -> #VALUE! | AC75: =VALUE(RC[-27]) -> #VALUE! | AD75: =IF(RC[21]=42,"*",IF(RC[21]=32,"",RC[21])) ->  | AE75: =RC[-28] ->  | AF75: =RC[-28] ->  | AG75: =RC[-28] ->  | AH75: =RC[-28] ->  | AI75: =RC[-28] ->  | AJ75: =RC[-28] ->  | AK75: =RC[-28] ->  | AL75: =RC[-28] -> 0 | AM75: =RC[-28] ->  | AN75: =RC[-28] ->  | AO75: =RC[-28] ->  | AP75: - | AQ75: =RC[-29] -> 0 | AR75: =RC[-29] -> 0 | AS75: - | AT75: =RC[-30] -> 0 | AU75: =RC[-30] -> 0 | AV75: =RC[-30] ->  | AW75: =RC[-30] -> 
A76: =IF(RC[1]="","",DATEVALUE(RC[1])) ->  | T76: =(RC[-16]*RC[-15]-RC[-13]*RC[-12])/1000 -> #VALUE! | W76: =RC[-2]*RC[-10]/1000 -> #VALUE! | X76: =ABS((RC[-3]*RC[-11]-RC[-2]*RC[-9])/1000) -> #VALUE! | Y76: =(RC[-14]-RC[1])/RC[-18]*100 -> #VALUE! | AC76: =VALUE(RC[-27]) -> #VALUE! | AD76: =IF(RC[21]=42,"*",IF(RC[21]=32,"",RC[21])) ->  | AE76: =RC[-28] ->  | AF76: =RC[-28] ->  | AG76: =RC[-28] ->  | AH76: =RC[-28] ->  | AI76: =RC[-28] ->  | AJ76: =RC[-28] ->  | AK76: =RC[-28] ->  | AL76: =RC[-28] -> 0 | AM76: =RC[-28] ->  | AN76: =RC[-28] ->  | AO76: =RC[-28] ->  | AP76: - | AQ76: =RC[-29] -> 0 | AR76: =RC[-29] -> 0 | AS76: - | AT76: =RC[-30] -> 0 | AU76: =RC[-30] -> 0 | AV76: =RC[-30] ->  | AW76: =RC[-30] -> 
A77: =IF(RC[1]="","",DATEVALUE(RC[1])) ->  | T77: =(RC[-16]*RC[-15]-RC[-13]*RC[-12])/1000 -> #VALUE! | W77: =RC[-2]*RC[-10]/1000 -> #VALUE! | X77: =ABS((RC[-3]*RC[-11]-RC[-2]*RC[-9])/1000) -> #VALUE! | Y77: =(RC[-14]-RC[1])/RC[-18]*100 -> #VALUE! | AC77: =VALUE(RC[-27]) -> #VALUE! | AD77: =IF(RC[21]=42,"*",IF(RC[21]=32,"",RC[21])) ->  | AE77: =RC[-28] ->  | AF77: =RC[-28] ->  | AG77: =RC[-28] ->  | AH77: =RC[-28] ->  | AI77: =RC[-28] ->  | AJ77: =RC[-28] ->  | AK77: =RC[-28] ->  | AL77: =RC[-28] -> 0 | AM77: =RC[-28] ->  | AN77: =RC[-28] ->  | AO77: =RC[-28] ->  | AP77: - | AQ77: =RC[-29] -> 0 | AR77: =RC[-29] -> 0 | AS77: - | AT77: =RC[-30] -> 0 | AU77: =RC[-30] -> 0 | AV77: =RC[-30] ->  | AW77: =RC[-30] -> 
A78: =IF(RC[1]="","",DATEVALUE(RC[1])) ->  | T78: =(RC[-16]*RC[-15]-RC[-13]*RC[-12])/1000 -> #VALUE! | W78: =RC[-2]*RC[-10]/1000 -> #VALUE! | X78: =ABS((RC[-3]*RC[-11]-RC[-2]*RC[-9])/1000) -> #VALUE! | Y78: =(RC[-14]-RC[1])/RC[-18]*100 -> #VALUE! | AC78: =VALUE(RC[-27]) -> #VALUE! | AD78: =IF(RC[21]=42,"*",IF(RC[21]=32,"",RC[21])) ->  | AE78: =RC[-28] ->  | AF78: =RC[-28] ->  | AG78: =RC[-28] ->  | AH78: =RC[-28] ->  | AI78: =RC[-28] ->  | AJ78: =RC[-28] ->  | AK78: =RC[-28] ->  | AL78: =RC[-28] -> 0 | AM78: =RC[-28] ->  | AN78: =RC[-28] ->  | AO78: =RC[-28] ->  | AP78: - | AQ78: =RC[-29] -> 0 | AR78: =RC[-29] -> 0 | AS78: - | AT78: =RC[-30] -> 0 | AU78: =RC[-30] -> 0 | AV78: =RC[-30] ->  | AW78: =RC[-30] -> 
A79: =IF(RC[1]="","",DATEVALUE(RC[1])) ->  | T79: =(RC[-16]*RC[-15]-RC[-13]*RC[-12])/1000 -> #VALUE! | W79: =RC[-2]*RC[-10]/1000 -> #VALUE! | X79: =ABS((RC[-3]*RC[-11]-RC[-2]*RC[-9])/1000) -> #VALUE! | Y79: =(RC[-14]-RC[1])/RC[-18]*100 -> #VALUE! | AC79: =VALUE(RC[-27]) -> #VALUE! | AD79: =IF(RC[21]=42,"*",IF(RC[21]=32,"",RC[21])) ->  | AE79: =RC[-28] ->  | AF79: =RC[-28] ->  | AG79: =RC[-28] ->  | AH79: =RC[-28] ->  | AI79: =RC[-28] ->  | AJ79: =RC[-28] ->  | AK79: =RC[-28] ->  | AL79: =RC[-28] -> 0 | AM79: =RC[-28] ->  | AN79: =RC[-28] ->  | AO79: =RC[-28] ->  | AP79: - | AQ79: =RC[-29] -> 0 | AR79: =RC[-29] -> 0 | AS79: - | AT79: =RC[-30] -> 0 | AU79: =RC[-30] -> 0 | AV79: =RC[-30] ->  | AW79: =RC[-30] -> 
A80: =IF(RC[1]="","",DATEVALUE(RC[1])) ->  | T80: =(RC[-16]*RC[-15]-RC[-13]*RC[-12])/1000 -> #VALUE! | W80: =RC[-2]*RC[-10]/1000 -> #VALUE! | X80: =ABS((RC[-3]*RC[-11]-RC[-2]*RC[-9])/1000) -> #VALUE! | Y80: =(RC[-14]-RC[1])/RC[-18]*100 -> #VALUE! | AC80: =VALUE(RC[-27]) -> #VALUE! | AD80: =IF(RC[21]=42,"*",IF(RC[21]=32,"",RC[21])) ->  | AE80: =RC[-28] ->  | AF80: =RC[-28] ->  | AG80: =RC[-28] ->  | AH80: =RC[-28] ->  | AI80: =RC[-28] ->  | AJ80: =RC[-28] ->  | AK80: =RC[-28] ->  | AL80: =RC[-28] -> 0 | AM80: =RC[-28] ->  | AN80: =RC[-28] ->  | AO80: =RC[-28] ->  | AP80: - | AQ80: =RC[-29] -> 0 | AR80: =RC[-29] -> 0 | AS80: - | AT80: =RC[-30] -> 0 | AU80: =RC[-30] -> 0 | AV80: =RC[-30] ->  | AW80: =RC[-30] -> 
A81: =IF(RC[1]="","",DATEVALUE(RC[1])) ->  | T81: =(RC[-16]*RC[-15]-RC[-13]*RC[-12])/1000 -> #VALUE! | W81: =RC[-2]*RC[-10]/1000 -> #VALUE! | X81: =ABS((RC[-3]*RC[-11]-RC[-2]*RC[-9])/1000) -> #VALUE! | Y81: =(RC[-14]-RC[1])/RC[-18]*100 -> #VALUE! | AC81: =VALUE(RC[-27]) -> #VALUE! | AD81: =IF(RC[21]=42,"*",IF(RC[21]=32,"",RC[21])) ->  | AE81: =RC[-28] ->  | AF81: =RC[-28] ->  | AG81: =RC[-28] ->  | AH81: =RC[-28] ->  | AI81: =RC[-28] ->  | AJ81: =RC[-28] ->  | AK81: =RC[-28] ->  | AL81: =RC[-28] -> 0 | AM81: =RC[-28] ->  | AN81: =RC[-28] ->  | AO81: =RC[-28] ->  | AP81: - | AQ81: =RC[-29] -> 0 | AR81: =RC[-29] -> 0 | AS81: - | AT81: =RC[-30] -> 0 | AU81: =RC[-30] -> 0 | AV81: =RC[-30] ->  | AW81: =RC[-30] -> 
A82: =IF(RC[1]="","",DATEVALUE(RC[1])) ->  | T82: =(RC[-16]*RC[-15]-RC[-13]*RC[-12])/1000 -> #VALUE! | W82: =RC[-2]*RC[-10]/1000 -> #VALUE! | X82: =ABS((RC[-3]*RC[-11]-RC[-2]*RC[-9])/1000) -> #VALUE! | Y82: =(RC[-14]-RC[1])/RC[-18]*100 -> #VALUE! | AC82: =VALUE(RC[-27]) -> #VALUE! | AD82: =IF(RC[21]=42,"*",IF(RC[21]=32,"",RC[21])) ->  | AE82: =RC[-28] ->  | AF82: =RC[-28] ->  | AG82: =RC[-28] ->  | AH82: =RC[-28] ->  | AI82: =RC[-28] ->  | AJ82: =RC[-28] ->  | AK82: =RC[-28] ->  | AL82: =RC[-28] -> 0 | AM82: =RC[-28] ->  | AN82: =RC[-28] ->  | AO82: =RC[-28] ->  | AP82: - | AQ82: =RC[-29] -> 0 | AR82: =RC[-29] -> 0 | AS82: - | AT82: =RC[-30] -> 0 | AU82: =RC[-30] -> 0 | AV82: =RC[-30] ->  | AW82: =RC[-30] -> 
A83: =IF(RC[1]="","",DATEVALUE(RC[1])) ->  | T83: =(RC[-16]*RC[-15]-RC[-13]*RC[-12])/1000 -> #VALUE! | W83: =RC[-2]*RC[-10]/1000 -> #VALUE! | X83: =ABS((RC[-3]*RC[-11]-RC[-2]*RC[-9])/1000) -> #VALUE! | Y83: =(RC[-14]-RC[1])/RC[-18]*100 -> #VALUE! | AC83: =VALUE(RC[-27]) -> #VALUE! | AD83: =IF(RC[21]=42,"*",IF(RC[21]=32,"",RC[21])) ->  | AE83: =RC[-28] ->  | AF83: =RC[-28] ->  | AG83: =RC[-28] ->  | AH83: =RC[-28] ->  | AI83: =RC[-28] ->  | AJ83: =RC[-28] ->  | AK83: =RC[-28] ->  | AL83: =RC[-28] -> 0 | AM83: =RC[-28] ->  | AN83: =RC[-28] ->  | AO83: =RC[-28] ->  | AP83: - | AQ83: =RC[-29] -> 0 | AR83: =RC[-29] -> 0 | AS83: - | AT83: =RC[-30] -> 0 | AU83: =RC[-30] -> 0 | AV83: =RC[-30] ->  | AW83: =RC[-30] -> 
AC84: Среднее | AF84: =R[1]C[-28] -> 151.38899999999998 | AG84: =R[1]C[-28] -> 69.41122222222225 | AH84: =R[1]C[-28] -> 7.0608888888888854 | AI84: =R[1]C[-28] -> 136.22555555555562 | AJ84: =R[1]C[-28] -> 44.680222222222213 | AK84: =R[1]C[-28] -> 5.2809999999999997 | AL84: =R[1]C[-28] -> 24.730999999999998 | AM84: =R[1]C[-28] -> 15.163444444444442 | AN84: =R[1]C[-28] -> 16.375444444444437 | AO84: =R[1]C[-28] -> 67.112222222222258 | AP84: - | AQ84: =R[1]C[-29] -> 0 | AR84: =R[1]C[-29] -> 0 | AS84: - | AT84: =R[1]C[-30] -> 0 | AU84: =R[1]C[-30] -> 0
B85: Среднее | D85: =AVERAGE(OFFSET(R[-74]C,3,0,R7C1,1)) -> 151.38899999999998 | E85: =AVERAGE(OFFSET(R[-74]C,3,0,R7C1,1)) -> 69.41122222222225 | F85: =AVERAGE(OFFSET(R[-74]C,3,0,R7C1,1)) -> 7.0608888888888854 | G85: =AVERAGE(OFFSET(R[-74]C,3,0,R7C1,1)) -> 136.22555555555562 | H85: =AVERAGE(OFFSET(R[-74]C,3,0,R7C1,1)) -> 44.680222222222213 | I85: =AVERAGE(OFFSET(R[-74]C,3,0,R7C1,1)) -> 5.2809999999999997 | J85: =AVERAGE(OFFSET(R[-74]C,3,0,R7C1,1)) -> 24.730999999999998 | K85: =AVERAGE(OFFSET(R[-74]C,3,0,R7C1,1)) -> 15.163444444444442 | L85: =IF(SUM(OFFSET(R[-74]C,3,0,R7C1,1))=0,"",AVERAGE(OFFSET(R[-74]C,3,0,R7C1,1))) -> 16.375444444444437 | M85: =IF(SUM(OFFSET(R[-74]C,3,0,R7C1,1))=0,"",AVERAGE(OFFSET(R[-74]C,3,0,R7C1,1))) -> 67.112222222222258 | R85: =IF(SUM(OFFSET(R[-74]C,3,0,R7C1,1))=0,"",AVERAGE(OFFSET(R[-74]C,3,0,R7C1,1))) -> 1.0743777777777774 | S85: =AVERAGE(OFFSET(R[-74]C,3,0,R7C1,1)) -> 4.181157828148149 | T85: =AVERAGE(OFFSET(R[-74]C,3,0,R7C1,1)) -> 4.1811074540740769 | W85: =AVERAGE(OFFSET(R[-74]C,3,0,R7C1,1)) -> 2.7852905777777783 | X85: =AVERAGE(OFFSET(R[-74]C,3,0,R7C1,1)) -> #VALUE! | AC85: Итого | AE85: =R[1]C[-28] -> 720 | AF85: =R[1]C[-28] -> 4541.6699999999992 | AI85: =R[1]C[-28] -> 4086.7666666666682 | AM85: =R[1]C[-28] -> 454.90333333333325 | AN85: =R[1]C[-28] -> 491.26333333333309 | AQ85: =R[1]C[-29] -> 0 | AU85: =R[1]C[-30] -> 0 | AV85: =R[1]C[-30] -> 32.231333333333325 | AW85: =R[1]C[-30] -> 125.43473484444448
B86: ИТОГО: | C86: =SUM(OFFSET(R[-75]C,3,0,R7C1,1)) -> 720 | D86: =SUM(OFFSET(R[-75]C,3,0,R7C1,1)) -> 4541.6699999999992 | G86: =SUM(OFFSET(R[-75]C,3,0,R7C1,1)) -> 4086.7666666666682 | K86: =SUM(OFFSET(R[-75]C,3,0,R7C1,1)) -> 454.90333333333325 | L86: =IF(SUM(OFFSET(R[-75]C,3,0,R7C1,1))=0,"",SUM(OFFSET(R[-75]C,3,0,R7C1,1))) -> 491.26333333333309 | R86: =IF(SUM(OFFSET(R[-75]C,3,0,R7C1,1))=0,"",SUM(OFFSET(R[-75]C,3,0,R7C1,1))) -> 32.231333333333325 | S86: =SUM(OFFSET(R[-75]C,3,0,R7C1,1)) -> 125.43473484444448 | T86: =SUM(OFFSET(R[-75]C,3,0,R7C1,1)) -> 125.4332236222223 | W86: =SUM(OFFSET(R[-75]C,3,0,R7C1,1)) -> 83.558717333333348 | X86: =SUM(OFFSET(R[-75]C,3,0,R7C1,1)) -> #VALUE!
AC87: Досчёт | AF87: =R[1]C[-28] -> 0 | AI87: =R[1]C[-28] -> 0 | AM87: =R[1]C[-28] -> 0 | AN87: =R[1]C[-28] -> 0 | AQ87: =R[1]C[-29] -> 0 | AU87: =R[1]C[-30] -> 0 | AV87: =R[1]C[-30] -> 0 | AW87: =R[1]C[-30] -> 0
A88: 11дн=264ч 4дн=96ч | B88: Досчёт до конца м-ца (+) | C88: =R6C1*24 -> 216 | T88: № 9198 | AC88: Снятие | AF88: =-R[1]C[-28] -> 0 | AI88: =-R[1]C[-28] -> 0 | AM88: =-R[1]C[-28] -> 0 | AN88: =-R[1]C[-28] -> 0 | AQ88: =-R[1]C[-29] -> 0 | AU88: =-R[1]C[-30] -> 0 | AV88: =-R[1]C[-30] -> 0 | AW88: =-R[1]C[-30] -> 0
A89: 9дн=216ч 7дн=168ч | B89: Вычет с предыдущего (-) | C89: =R4C1*24 -> 192 | AC89: Сумма | AF89: =R[1]C[-28] -> 4541.6699999999992 | AI89: =R[1]C[-28] -> 4086.7666666666682 | AM89: =R[1]C[-28] -> 454.90333333333325 | AN89: =R[1]C[-28] -> 491.26333333333309 | AQ89: =R[1]C[-29] -> 0 | AU89: =R[1]C[-30] -> 0 | AV89: =R[1]C[-30] -> 32.231333333333325 | AW89: =R[1]C[-30] -> 125.43473484444448
B90: СУММА: | C90: =R[-4]C+R[-2]C-R[-1]C -> 744 | D90: =R[-4]C+R[-2]C-R[-1]C -> 4541.6699999999992 | G90: =R[-4]C+R[-2]C-R[-1]C -> 4086.7666666666682 | K90: =R[-4]C+R[-2]C-R[-1]C -> 454.90333333333325 | L90: =IF(SUM(OFFSET(R[-79]C,3,0,R7C1,1))=0,"",(R[-4]C+R[-2]C-R[-1]C)) -> 491.26333333333309 | R90: =IF(SUM(OFFSET(R[-79]C,3,0,R7C1,1))=0,"",(R[-4]C+R[-2]C-R[-1]C)) -> 32.231333333333325 | S90: =R[-4]C+R[-2]C-R[-1]C -> 125.43473484444448
AC91: Тхв на источнике | AE91: V гвс (м3) | AF91: =R[-2]C[15] -> 0 | AG91: W гвс (Гкал) | AH91: =RC[-2]*0.06 -> 0 | AI91: W без гвс (Гкал) | AJ91: =R[-2]C[13]-RC[-2] -> 125.43473484444448
B92: Показания счетчиков на момент снятия данных:
B93: Дата, время | D93: М1, т | F93: М2, т | H93: М3, т | J93: М4, т | L93: Qо, Гкал | N93: Qг, Гкал | P93: время, час
B94: 23.09.18 06:00 | D94: 169934.04 | F94: 148412.35 | H94: 24880.37 | J94: - | L94: 5440.1890000000003 | N94: 1744.06 | P94: -
B95: 23.10.18 02:00 | D95: 171858.53 | F95: 160605.37 | H95: 26097.48 | J95: - | L95: 5531.9989999999998 | N95: 1827.135 | P95: -
AC97: =ZAYAVKA_N -> письмо с 26.09.18г по 17.10.18г некорректная работа приборов
B98: Представитель потребителя:_______________________________________________________________________ В.О. Топорков
I101: Рекомендуемые значения по параметрам теплопотребления (не являются официально утверждёнными)
I102: М, т | J102: V, м3 | K102: Qгвс, Гкал | L102: Qотоп, Гкал | M102: Qо, Гкал
I103: =R[-13]C[-3] -> 0 | J103: =RC[-1]/0.98 -> 0 | K103: =RC[-1]*0.06 -> 0 | L103: =RC[1]-RC[-1] -> 32.231333333333325 | M103: =R[-13]C[5] -> 32.231333333333325
O105: ДЛЯ САМОКОНТРОЛЯ
B106: В строке выбора дат указать период с 16.7.13 по 23.8.13 - жильё | N106: Q | O106: Qг
B107: В строке выбора дат указать период с 18.7.13 по 25.8.13 - не жилое | N107: =(R[-21]C[-10]*R[-22]C[-7]-R[-21]C[-9]*R[-22]C[-6])/1000 -> 618.69151890000012 | O107: =IF(R[-22]C[-2]="",R[-21]C[-3]*R[-22]C/1000,"") ->  | P107: Си2
O108: =IF(R[-23]C[-2]="","",((R[-22]C[-3]*R[-23]C)-(R[-22]C[-2]*R[-23]C[2]))/1000) -> 0 | P108: Си3