Sheet: Лист1
G1: Отчёт о теплопотреблении за октябрь 2018 | M1: з.н д. №02/147-2783 от 04.10.18
A4: =EOMONTH(R[9]C,0)-R[9]C -> 8 | B4: Потребитель: ЗАО "Сити Сервис"
A5: =MAX(R[9]C:R[78]C) -> 2018-10-22T00:00:00.000 | B5: Адрес: г. СПб, Наличная ул., д.30 ГВС
A6: =EOMONTH(R[-1]C,0)-R[-1]C -> 9 | B6: Телефон: 458-75-28
A7: =R[-2]C-R[6]C -> 30 | B7: Договор 10023-10
A8: 7 | B8: Тепловычислитель: ВКТ-7 № 11592 | L8: М2 мах= | M8: 0 | O8: Мгвс мах= | P8: 175.2
L9: Qотоп мах= | M9: 0 | O9: Qгвс мах= | P9: 10.56
B10: Расчётная формула: Q=M1*(h1-hхв)-M2*(h2-hхв)
D12: Учет | L12: Контроль
A13: =R[1]C[1]-1 -> 2018-09-22T00:00:00.000 | B13: Дата | C13: N, ч | D13: V1, м3 | E13: T1, С | F13: P1, кг/см2 | G13: V2, м3 | H13: T2, С | I13: P2, кг/см2 | J13: dT, С | K13: V1-V2, м3 | L13: V3, м3 | M13: T3, С | N13: V4, м3 | O13: =IF(R[-12]C[-14]="м.куб","","T4, С") -> T4, С | P13: dT, С | Q13: V3-V4, м3 | R13: Qг, Гкал | S13: Qобщ., Гкал | T13: Q | U13: M3 | V13: M4 | W13: си2 | X13: си3 | Y13: ТСО | Z13: Внутр. | AC13: Дата | AD13: НС | AE13: n, ч | AF13: М1, т | AG13: t1, гр. С | AH13: Р1, кгс/см2 | AI13: М2, т | AJ13: t2, гр. С | AK13: Р2, кгс/см2 | AL13: t1-t2, гр. С | AM13: М1-М2, т | AN13: М1гвс, т | AO13: t1гвс, гр. С | AP13: Р1гвс, кгс/см2 | AQ13: М2гвс, т | AR13: t2гвс, гр. С | AS13: Р2гвс, кгс/см2 | AU13: М1гвс-М2гвс, т | AV13: Wгвс, Гкал | AW13: Wсумм, Гкал | AY13: NS_TV1 | AZ13: НС | BA13: NS_TV2
A14: =IF(RC[1]="","",DATEVALUE(RC[1])) -> 43366 | B14: 23.09.18 | C14: 24 | D14: 74.98 | E14: 68.239999999999995 | F14: 7 | G14: 53.14 | H14: 56.96 | I14: 6 | J14: =RC[-5]-RC[-2] -> 11.279999999999994 | K14: 21.84 | S14: 2.0249999999999999 | T14: =(RC[1]*RC[-15]-RC[2]*RC[-12])/1000 -> 2.0897807999999993 | U14: 74.98 | V14: 53.14 | W14: =RC[-2]*RC[-10]/1000 -> 0 | X14: =ABS((RC[-3]*RC[-11]-RC[-2]*RC[-9])/1000) -> 0 | Y14: 2013-12-23T00:00:00.000 | Z14: 2013-12-21T00:00:00.000 | AC14: =VALUE(RC[-27]) -> 2018-09-23T00:00:00.000 | AD14: =IF(RC[21]=42,"*",IF(RC[21]=32,"",RC[21])) -> - | AE14: =RC[-28] -> 24 | AF14: =RC[-28] -> 74.98 | AG14: =RC[-28] -> 68.239999999999995 | AH14: =RC[-28] -> 7 | AI14: =RC[-28] -> 53.14 | AJ14: =RC[-28] -> 56.96 | AK14: =RC[-28] -> 6 | AL14: =RC[-28] -> 11.279999999999994 | AM14: =RC[-28] -> 21.84 | AN14: =RC[-28] -> 0 | AO14: =RC[-28] -> 0 | AP14: 7 | AQ14: =RC[-29] -> 0 | AR14: =RC[-29] -> 0 | AS14: 6 | AT14: =RC[-30] -> 0 | AU14: =RC[-30] -> 0 | AV14: =RC[-30] -> 0 | AW14: =RC[-30] -> 2.0249999999999999 | AY14: - | AZ14: - | BA14: -
A15: =IF(RC[1]="","",DATEVALUE(RC[1])) -> 43367 | B15: 24.09.18 | C15: 24 | D15: 73.28 | E15: 67.27 | F15: 7 | G15: 53.49 | H15: 56.23 | I15: 6 | J15: =RC[-5]-RC[-2] -> 11.04 | K15: 19.79 | S15: 1.859 | T15: =(RC[1]*RC[-15]-RC[2]*RC[-12])/1000 -> 1.9218028999999996 | U15: 73.28 | V15: 53.49 | W15: =RC[-2]*RC[-10]/1000 -> 0 | X15: =ABS((RC[-3]*RC[-11]-RC[-2]*RC[-9])/1000) -> 0 | Y15: 2013-12-24T00:00:00.000 | Z15: 2013-12-22T00:00:00.000 | AC15: =VALUE(RC[-27]) -> 2018-09-24T00:00:00.000 | AD15: =IF(RC[21]=42,"*",IF(RC[21]=32,"",RC[21])) -> - | AE15: =RC[-28] -> 24 | AF15: =RC[-28] -> 73.28 | AG15: =RC[-28] -> 67.27 | AH15: =RC[-28] -> 7 | AI15: =RC[-28] -> 53.49 | AJ15: =RC[-28] -> 56.23 | AK15: =RC[-28] -> 6 | AL15: =RC[-28] -> 11.04 | AM15: =RC[-28] -> 19.79 | AN15: =RC[-28] -> 0 | AO15: =RC[-28] -> 0 | AP15: 7 | AQ15: =RC[-29] -> 0 | AR15: =RC[-29] -> 0 | AS15: 6 | AT15: =RC[-30] -> 0 | AU15: =RC[-30] -> 0 | AV15: =RC[-30] -> 0 | AW15: =RC[-30] -> 1.859 | AY15: - | AZ15: - | BA15: -
A16: =IF(RC[1]="","",DATEVALUE(RC[1])) -> 43368 | B16: 25.09.18 | C16: 24 | D16: 74.819999999999993 | E16: 65.66 | F16: 7 | G16: 54.23 | H16: 55.02 | I16: 6 | J16: =RC[-5]-RC[-2] -> 10.639999999999993 | K16: 20.59 | S16: 1.871 | T16: =(RC[1]*RC[-15]-RC[2]*RC[-12])/1000 -> 1.9289465999999993 | U16: 74.819999999999993 | V16: 54.23 | W16: =RC[-2]*RC[-10]/1000 -> 0 | X16: =ABS((RC[-3]*RC[-11]-RC[-2]*RC[-9])/1000) -> 0 | Y16: 2013-12-25T00:00:00.000 | Z16: 2013-12-23T00:00:00.000 | AC16: =VALUE(RC[-27]) -> 2018-09-25T00:00:00.000 | AD16: =IF(RC[21]=42,"*",IF(RC[21]=32,"",RC[21])) -> - | AE16: =RC[-28] -> 24 | AF16: =RC[-28] -> 74.819999999999993 | AG16: =RC[-28] -> 65.66 | AH16: =RC[-28] -> 7 | AI16: =RC[-28] -> 54.23 | AJ16: =RC[-28] -> 55.02 | AK16: =RC[-28] -> 6 | AL16: =RC[-28] -> 10.639999999999993 | AM16: =RC[-28] -> 20.59 | AN16: =RC[-28] -> 0 | AO16: =RC[-28] -> 0 | AP16: 7 | AQ16: =RC[-29] -> 0 | AR16: =RC[-29] -> 0 | AS16: 6 | AT16: =RC[-30] -> 0 | AU16: =RC[-30] -> 0 | AV16: =RC[-30] -> 0 | AW16: =RC[-30] -> 1.871 | AY16: - | AZ16: - | BA16: -
A17: =IF(RC[1]="","",DATEVALUE(RC[1])) -> 43369 | B17: 26.09.18 | C17: 24 | D17: 75.98 | E17: 65.25 | F17: 7 | G17: 54.46 | H17: 54.81 | I17: 6 | J17: =RC[-5]-RC[-2] -> 10.439999999999998 | K17: 21.52 | S17: 1.9219999999999999 | T17: =(RC[1]*RC[-15]-RC[2]*RC[-12])/1000 -> 1.9727424000000005 | U17: 75.98 | V17: 54.46 | W17: =RC[-2]*RC[-10]/1000 -> 0 | X17: =ABS((RC[-3]*RC[-11]-RC[-2]*RC[-9])/1000) -> 0 | Y17: 2013-12-26T00:00:00.000 | Z17: 2013-12-24T00:00:00.000 | AC17: =VALUE(RC[-27]) -> 2018-09-26T00:00:00.000 | AD17: =IF(RC[21]=42,"*",IF(RC[21]=32,"",RC[21])) -> - | AE17: =RC[-28] -> 24 | AF17: =RC[-28] -> 75.98 | AG17: =RC[-28] -> 65.25 | AH17: =RC[-28] -> 7 | AI17: =RC[-28] -> 54.46 | AJ17: =RC[-28] -> 54.81 | AK17: =RC[-28] -> 6 | AL17: =RC[-28] -> 10.439999999999998 | AM17: =RC[-28] -> 21.52 | AN17: =RC[-28] -> 0 | AO17: =RC[-28] -> 0 | AP17: 7 | AQ17: =RC[-29] -> 0 | AR17: =RC[-29] -> 0 | AS17: 6 | AT17: =RC[-30] -> 0 | AU17: =RC[-30] -> 0 | AV17: =RC[-30] -> 0 | AW17: =RC[-30] -> 1.9219999999999999 | AY17: - | AZ17: - | BA17: -
A18: =IF(RC[1]="","",DATEVALUE(RC[1])) -> 43370 | B18: 27.09.18 | C18: 24 | D18: 73.290000000000006 | E18: 61.3 | F18: 7 | G18: 51.99 | H18: 51.85 | I18: 6 | J18: =RC[-5]-RC[-2] -> 9.4499999999999957 | K18: 21.3 | S18: 1.7569999999999999 | T18: =(RC[1]*RC[-15]-RC[2]*RC[-12])/1000 -> 1.7969955000000004 | U18: 73.290000000000006 | V18: 51.99 | W18: =RC[-2]*RC[-10]/1000 -> 0 | X18: =ABS((RC[-3]*RC[-11]-RC[-2]*RC[-9])/1000) -> 0 | Y18: 2013-12-27T00:00:00.000 | Z18: 2013-12-25T00:00:00.000 | AC18: =VALUE(RC[-27]) -> 2018-09-27T00:00:00.000 | AD18: =IF(RC[21]=42,"*",IF(RC[21]=32,"",RC[21])) -> - | AE18: =RC[-28] -> 24 | AF18: =RC[-28] -> 73.290000000000006 | AG18: =RC[-28] -> 61.3 | AH18: =RC[-28] -> 7 | AI18: =RC[-28] -> 51.99 | AJ18: =RC[-28] -> 51.85 | AK18: =RC[-28] -> 6 | AL18: =RC[-28] -> 9.4499999999999957 | AM18: =RC[-28] -> 21.3 | AN18: =RC[-28] -> 0 | AO18: =RC[-28] -> 0 | AP18: 7 | AQ18: =RC[-29] -> 0 | AR18: =RC[-29] -> 0 | AS18: 6 | AT18: =RC[-30] -> 0 | AU18: =RC[-30] -> 0 | AV18: =RC[-30] -> 0 | AW18: =RC[-30] -> 1.7569999999999999 | AY18: - | AZ18: - | BA18: -
A19: =IF(RC[1]="","",DATEVALUE(RC[1])) -> 43371 | B19: 28.09.18 | C19: 24 | D19: 72.959999999999994 | E19: 65.25 | F19: 7 | G19: 51.52 | H19: 54.58 | I19: 6 | J19: =RC[-5]-RC[-2] -> 10.670000000000002 | K19: 21.44 | S19: 1.8979999999999999 | T19: =(RC[1]*RC[-15]-RC[2]*RC[-12])/1000 -> 1.9486783999999993 | U19: 72.959999999999994 | V19: 51.52 | W19: =RC[-2]*RC[-10]/1000 -> 0 | X19: =ABS((RC[-3]*RC[-11]-RC[-2]*RC[-9])/1000) -> 0 | Y19: 2013-12-28T00:00:00.000 | Z19: 2013-12-26T00:00:00.000 | AC19: =VALUE(RC[-27]) -> 2018-09-28T00:00:00.000 | AD19: =IF(RC[21]=42,"*",IF(RC[21]=32,"",RC[21])) -> - | AE19: =RC[-28] -> 24 | AF19: =RC[-28] -> 72.959999999999994 | AG19: =RC[-28] -> 65.25 | AH19: =RC[-28] -> 7 | AI19: =RC[-28] -> 51.52 | AJ19: =RC[-28] -> 54.58 | AK19: =RC[-28] -> 6 | AL19: =RC[-28] -> 10.670000000000002 | AM19: =RC[-28] -> 21.44 | AN19: =RC[-28] -> 0 | AO19: =RC[-28] -> 0 | AP19: 7 | AQ19: =RC[-29] -> 0 | AR19: =RC[-29] -> 0 | AS19: 6 | AT19: =RC[-30] -> 0 | AU19: =RC[-30] -> 0 | AV19: =RC[-30] -> 0 | AW19: =RC[-30] -> 1.8979999999999999 | AY19: - | AZ19: - | BA19: -
A20: =IF(RC[1]="","",DATEVALUE(RC[1])) -> 43372 | B20: 29.09.18 | C20: 24 | D20: 70.28 | E20: 64.73 | F20: 7 | G20: 50.54 | H20: 54.11 | I20: 6 | J20: =RC[-5]-RC[-2] -> 10.620000000000005 | K20: 19.739999999999998 | S20: 1.7689999999999999 | T20: =(RC[1]*RC[-15]-RC[2]*RC[-12])/1000 -> 1.814505 | U20: 70.28 | V20: 50.54 | W20: =RC[-2]*RC[-10]/1000 -> 0 | X20: =ABS((RC[-3]*RC[-11]-RC[-2]*RC[-9])/1000) -> 0 | Y20: 2013-12-29T00:00:00.000 | Z20: 2013-12-27T00:00:00.000 | AC20: =VALUE(RC[-27]) -> 2018-09-29T00:00:00.000 | AD20: =IF(RC[21]=42,"*",IF(RC[21]=32,"",RC[21])) -> - | AE20: =RC[-28] -> 24 | AF20: =RC[-28] -> 70.28 | AG20: =RC[-28] -> 64.73 | AH20: =RC[-28] -> 7 | AI20: =RC[-28] -> 50.54 | AJ20: =RC[-28] -> 54.11 | AK20: =RC[-28] -> 6 | AL20: =RC[-28] -> 10.620000000000005 | AM20: =RC[-28] -> 19.739999999999998 | AN20: =RC[-28] -> 0 | AO20: =RC[-28] -> 0 | AP20: 7 | AQ20: =RC[-29] -> 0 | AR20: =RC[-29] -> 0 | AS20: 6 | AT20: =RC[-30] -> 0 | AU20: =RC[-30] -> 0 | AV20: =RC[-30] -> 0 | AW20: =RC[-30] -> 1.7689999999999999 | AY20: - | AZ20: - | BA20: -
A21: =IF(RC[1]="","",DATEVALUE(RC[1])) -> 43373 | B21: 30.09.18 | C21: 24 | D21: 74.42 | E21: 67.13 | F21: 7 | G21: 50.37 | H21: 56.04 | I21: 6 | J21: =RC[-5]-RC[-2] -> 11.089999999999996 | K21: 24.05 | S21: 2.1120000000000001 | T21: =(RC[1]*RC[-15]-RC[2]*RC[-12])/1000 -> 2.1730798 | U21: 74.42 | V21: 50.37 | W21: =RC[-2]*RC[-10]/1000 -> 0 | X21: =ABS((RC[-3]*RC[-11]-RC[-2]*RC[-9])/1000) -> 0 | Y21: 2013-12-30T00:00:00.000 | Z21: 2013-12-28T00:00:00.000 | AC21: =VALUE(RC[-27]) -> 2018-09-30T00:00:00.000 | AD21: =IF(RC[21]=42,"*",IF(RC[21]=32,"",RC[21])) -> - | AE21: =RC[-28] -> 24 | AF21: =RC[-28] -> 74.42 | AG21: =RC[-28] -> 67.13 | AH21: =RC[-28] -> 7 | AI21: =RC[-28] -> 50.37 | AJ21: =RC[-28] -> 56.04 | AK21: =RC[-28] -> 6 | AL21: =RC[-28] -> 11.089999999999996 | AM21: =RC[-28] -> 24.05 | AN21: =RC[-28] -> 0 | AO21: =RC[-28] -> 0 | AP21: 7 | AQ21: =RC[-29] -> 0 | AR21: =RC[-29] -> 0 | AS21: 6 | AT21: =RC[-30] -> 0 | AU21: =RC[-30] -> 0 | AV21: =RC[-30] -> 0 | AW21: =RC[-30] -> 2.1120000000000001 | AY21: - | AZ21: - | BA21: -
A22: =IF(RC[1]="","",DATEVALUE(RC[1])) -> 43374 | B22: 01.10.18 | C22: 24 | D22: 71.41 | E22: 65.77 | F22: 7 | G22: 50.25 | H22: 55.27 | I22: 6 | J22: =RC[-5]-RC[-2] -> 10.499999999999993 | K22: 21.16 | S22: 1.8680000000000001 | T22: =(RC[1]*RC[-15]-RC[2]*RC[-12])/1000 -> 1.9193181999999998 | U22: 71.41 | V22: 50.25 | W22: =RC[-2]*RC[-10]/1000 -> 0 | X22: =ABS((RC[-3]*RC[-11]-RC[-2]*RC[-9])/1000) -> 0 | Y22: 2013-12-31T00:00:00.000 | Z22: 2013-12-29T00:00:00.000 | AC22: =VALUE(RC[-27]) -> 2018-10-01T00:00:00.000 | AD22: =IF(RC[21]=42,"*",IF(RC[21]=32,"",RC[21])) -> - | AE22: =RC[-28] -> 24 | AF22: =RC[-28] -> 71.41 | AG22: =RC[-28] -> 65.77 | AH22: =RC[-28] -> 7 | AI22: =RC[-28] -> 50.25 | AJ22: =RC[-28] -> 55.27 | AK22: =RC[-28] -> 6 | AL22: =RC[-28] -> 10.499999999999993 | AM22: =RC[-28] -> 21.16 | AN22: =RC[-28] -> 0 | AO22: =RC[-28] -> 0 | AP22: 7 | AQ22: =RC[-29] -> 0 | AR22: =RC[-29] -> 0 | AS22: 6 | AT22: =RC[-30] -> 0 | AU22: =RC[-30] -> 0 | AV22: =RC[-30] -> 0 | AW22: =RC[-30] -> 1.8680000000000001 | AY22: - | AZ22: - | BA22: -
A23: =IF(RC[1]="","",DATEVALUE(RC[1])) -> 43375 | B23: 02.10.18 | C23: 24 | D23: 72.569999999999993 | E23: 64.64 | F23: 7 | G23: 51.31 | H23: 54.57 | I23: 6 | J23: =RC[-5]-RC[-2] -> 10.07 | K23: 21.26 | S23: 1.841 | T23: =(RC[1]*RC[-15]-RC[2]*RC[-12])/1000 -> 1.8909380999999998 | U23: 72.569999999999993 | V23: 51.31 | W23: =RC[-2]*RC[-10]/1000 -> 0 | X23: =ABS((RC[-3]*RC[-11]-RC[-2]*RC[-9])/1000) -> 0 | Y23: 2014-01-01T00:00:00.000 | Z23: 2013-12-30T00:00:00.000 | AC23: =VALUE(RC[-27]) -> 2018-10-02T00:00:00.000 | AD23: =IF(RC[21]=42,"*",IF(RC[21]=32,"",RC[21])) -> - | AE23: =RC[-28] -> 24 | AF23: =RC[-28] -> 72.569999999999993 | AG23: =RC[-28] -> 64.64 | AH23: =RC[-28] -> 7 | AI23: =RC[-28] -> 51.31 | AJ23: =RC[-28] -> 54.57 | AK23: =RC[-28] -> 6 | AL23: =RC[-28] -> 10.07 | AM23: =RC[-28] -> 21.26 | AN23: =RC[-28] -> 0 | AO23: =RC[-28] -> 0 | AP23: 7 | AQ23: =RC[-29] -> 0 | AR23: =RC[-29] -> 0 | AS23: 6 | AT23: =RC[-30] -> 0 | AU23: =RC[-30] -> 0 | AV23: =RC[-30] -> 0 | AW23: =RC[-30] -> 1.841 | AY23: - | AZ23: - | BA23: -
A24: =IF(RC[1]="","",DATEVALUE(RC[1])) -> 43376 | B24: 03.10.18 | C24: 24 | D24: 71.44 | E24: 64.66 | F24: 7 | G24: 50.47 | H24: 54.32 | I24: 6 | J24: =RC[-5]-RC[-2] -> 10.339999999999996 | K24: 20.97 | S24: 1.831 | T24: =(RC[1]*RC[-15]-RC[2]*RC[-12])/1000 -> 1.8777799999999993 | U24: 71.44 | V24: 50.47 | W24: =RC[-2]*RC[-10]/1000 -> 0 | X24: =ABS((RC[-3]*RC[-11]-RC[-2]*RC[-9])/1000) -> 0 | Y24: 2014-01-02T00:00:00.000 | Z24: 2013-12-31T00:00:00.000 | AC24: =VALUE(RC[-27]) -> 2018-10-03T00:00:00.000 | AD24: =IF(RC[21]=42,"*",IF(RC[21]=32,"",RC[21])) -> - | AE24: =RC[-28] -> 24 | AF24: =RC[-28] -> 71.44 | AG24: =RC[-28] -> 64.66 | AH24: =RC[-28] -> 7 | AI24: =RC[-28] -> 50.47 | AJ24: =RC[-28] -> 54.32 | AK24: =RC[-28] -> 6 | AL24: =RC[-28] -> 10.339999999999996 | AM24: =RC[-28] -> 20.97 | AN24: =RC[-28] -> 0 | AO24: =RC[-28] -> 0 | AP24: 7 | AQ24: =RC[-29] -> 0 | AR24: =RC[-29] -> 0 | AS24: 6 | AT24: =RC[-30] -> 0 | AU24: =RC[-30] -> 0 | AV24: =RC[-30] -> 0 | AW24: =RC[-30] -> 1.831 | AY24: - | AZ24: - | BA24: -
A25: =IF(RC[1]="","",DATEVALUE(RC[1])) -> 43377 | B25: 04.10.18 | C25: 24 | D25: 70.599999999999994 | E25: 64.010000000000005 | F25: 7 | G25: 49.56 | H25: 53.57 | I25: 6 | J25: =RC[-5]-RC[-2] -> 10.440000000000005 | K25: 21.04 | S25: 1.8180000000000001 | T25: =(RC[1]*RC[-15]-RC[2]*RC[-12])/1000 -> 1.8641767999999996 | U25: 70.599999999999994 | V25: 49.56 | W25: =RC[-2]*RC[-10]/1000 -> 0 | X25: =ABS((RC[-3]*RC[-11]-RC[-2]*RC[-9])/1000) -> 0 | Y25: 2014-01-03T00:00:00.000 | Z25: 2014-01-01T00:00:00.000 | AC25: =VALUE(RC[-27]) -> 2018-10-04T00:00:00.000 | AD25: =IF(RC[21]=42,"*",IF(RC[21]=32,"",RC[21])) -> - | AE25: =RC[-28] -> 24 | AF25: =RC[-28] -> 70.599999999999994 | AG25: =RC[-28] -> 64.010000000000005 | AH25: =RC[-28] -> 7 | AI25: =RC[-28] -> 49.56 | AJ25: =RC[-28] -> 53.57 | AK25: =RC[-28] -> 6 | AL25: =RC[-28] -> 10.440000000000005 | AM25: =RC[-28] -> 21.04 | AN25: =RC[-28] -> 0 | AO25: =RC[-28] -> 0 | AP25: 7 | AQ25: =RC[-29] -> 0 | AR25: =RC[-29] -> 0 | AS25: 6 | AT25: =RC[-30] -> 0 | AU25: =RC[-30] -> 0 | AV25: =RC[-30] -> 0 | AW25: =RC[-30] -> 1.8180000000000001 | AY25: - | AZ25: - | BA25: -
A26: =IF(RC[1]="","",DATEVALUE(RC[1])) -> 43378 | B26: 05.10.18 | C26: 24 | D26: 69.52 | E26: 63.38 | F26: 7 | G26: 48.62 | H26: 52.81 | I26: 6 | J26: =RC[-5]-RC[-2] -> 10.57 | K26: 20.9 | S26: 1.794 | T26: =(RC[1]*RC[-15]-RC[2]*RC[-12])/1000 -> 1.8385554000000002 | U26: 69.52 | V26: 48.62 | W26: =RC[-2]*RC[-10]/1000 -> 0 | X26: =ABS((RC[-3]*RC[-11]-RC[-2]*RC[-9])/1000) -> 0 | Y26: 2014-01-04T00:00:00.000 | Z26: 2014-01-02T00:00:00.000 | AC26: =VALUE(RC[-27]) -> 2018-10-05T00:00:00.000 | AD26: =IF(RC[21]=42,"*",IF(RC[21]=32,"",RC[21])) -> - | AE26: =RC[-28] -> 24 | AF26: =RC[-28] -> 69.52 | AG26: =RC[-28] -> 63.38 | AH26: =RC[-28] -> 7 | AI26: =RC[-28] -> 48.62 | AJ26: =RC[-28] -> 52.81 | AK26: =RC[-28] -> 6 | AL26: =RC[-28] -> 10.57 | AM26: =RC[-28] -> 20.9 | AN26: =RC[-28] -> 0 | AO26: =RC[-28] -> 0 | AP26: 7 | AQ26: =RC[-29] -> 0 | AR26: =RC[-29] -> 0 | AS26: 6 | AT26: =RC[-30] -> 0 | AU26: =RC[-30] -> 0 | AV26: =RC[-30] -> 0 | AW26: =RC[-30] -> 1.794 | AY26: - | AZ26: - | BA26: -
A27: =IF(RC[1]="","",DATEVALUE(RC[1])) -> 43379 | B27: 06.10.18 | C27: 24 | D27: 71.39 | E27: 64.099999999999994 | F27: 7 | G27: 49.04 | H27: 53.75 | I27: 6 | J27: =RC[-5]-RC[-2] -> 10.349999999999994 | K27: 22.35 | S27: 1.8939999999999999 | T27: =(RC[1]*RC[-15]-RC[2]*RC[-12])/1000 -> 1.9401989999999991 | U27: 71.39 | V27: 49.04 | W27: =RC[-2]*RC[-10]/1000 -> 0 | X27: =ABS((RC[-3]*RC[-11]-RC[-2]*RC[-9])/1000) -> 0 | Y27: 2014-01-05T00:00:00.000 | Z27: 2014-01-03T00:00:00.000 | AC27: =VALUE(RC[-27]) -> 2018-10-06T00:00:00.000 | AD27: =IF(RC[21]=42,"*",IF(RC[21]=32,"",RC[21])) -> - | AE27: =RC[-28] -> 24 | AF27: =RC[-28] -> 71.39 | AG27: =RC[-28] -> 64.099999999999994 | AH27: =RC[-28] -> 7 | AI27: =RC[-28] -> 49.04 | AJ27: =RC[-28] -> 53.75 | AK27: =RC[-28] -> 6 | AL27: =RC[-28] -> 10.349999999999994 | AM27: =RC[-28] -> 22.35 | AN27: =RC[-28] -> 0 | AO27: =RC[-28] -> 0 | AP27: 7 | AQ27: =RC[-29] -> 0 | AR27: =RC[-29] -> 0 | AS27: 6 | AT27: =RC[-30] -> 0 | AU27: =RC[-30] -> 0 | AV27: =RC[-30] -> 0 | AW27: =RC[-30] -> 1.8939999999999999 | AY27: - | AZ27: - | BA27: -
A28: =IF(RC[1]="","",DATEVALUE(RC[1])) -> 43380 | B28: 07.10.18 | C28: 24 | D28: 74.53 | E28: 64.45 | F28: 7 | G28: 48.32 | H28: 54.18 | I28: 6 | J28: =RC[-5]-RC[-2] -> 10.270000000000003 | K28: 26.21 | S28: 2.133 | T28: =(RC[1]*RC[-15]-RC[2]*RC[-12])/1000 -> 2.1854809000000004 | U28: 74.53 | V28: 48.32 | W28: =RC[-2]*RC[-10]/1000 -> 0 | X28: =ABS((RC[-3]*RC[-11]-RC[-2]*RC[-9])/1000) -> 0 | Y28: 2014-01-06T00:00:00.000 | Z28: 2014-01-04T00:00:00.000 | AC28: =VALUE(RC[-27]) -> 2018-10-07T00:00:00.000 | AD28: =IF(RC[21]=42,"*",IF(RC[21]=32,"",RC[21])) -> - | AE28: =RC[-28] -> 24 | AF28: =RC[-28] -> 74.53 | AG28: =RC[-28] -> 64.45 | AH28: =RC[-28] -> 7 | AI28: =RC[-28] -> 48.32 | AJ28: =RC[-28] -> 54.18 | AK28: =RC[-28] -> 6 | AL28: =RC[-28] -> 10.270000000000003 | AM28: =RC[-28] -> 26.21 | AN28: =RC[-28] -> 0 | AO28: =RC[-28] -> 0 | AP28: 7 | AQ28: =RC[-29] -> 0 | AR28: =RC[-29] -> 0 | AS28: 6 | AT28: =RC[-30] -> 0 | AU28: =RC[-30] -> 0 | AV28: =RC[-30] -> 0 | AW28: =RC[-30] -> 2.133 | AY28: - | AZ28: - | BA28: -
A29: =IF(RC[1]="","",DATEVALUE(RC[1])) -> 43381 | B29: 08.10.18 | C29: 24 | D29: 71.739999999999995 | E29: 64.239999999999995 | F29: 7 | G29: 48.89 | H29: 53.69 | I29: 6 | J29: =RC[-5]-RC[-2] -> 10.549999999999997 | K29: 22.85 | S29: 1.9370000000000001 | T29: =(RC[1]*RC[-15]-RC[2]*RC[-12])/1000 -> 1.9836734999999999 | U29: 71.739999999999995 | V29: 48.89 | W29: =RC[-2]*RC[-10]/1000 -> 0 | X29: =ABS((RC[-3]*RC[-11]-RC[-2]*RC[-9])/1000) -> 0 | Y29: 2014-01-07T00:00:00.000 | Z29: 2014-01-05T00:00:00.000 | AC29: =VALUE(RC[-27]) -> 2018-10-08T00:00:00.000 | AD29: =IF(RC[21]=42,"*",IF(RC[21]=32,"",RC[21])) -> - | AE29: =RC[-28] -> 24 | AF29: =RC[-28] -> 71.739999999999995 | AG29: =RC[-28] -> 64.239999999999995 | AH29: =RC[-28] -> 7 | AI29: =RC[-28] -> 48.89 | AJ29: =RC[-28] -> 53.69 | AK29: =RC[-28] -> 6 | AL29: =RC[-28] -> 10.549999999999997 | AM29: =RC[-28] -> 22.85 | AN29: =RC[-28] -> 0 | AO29: =RC[-28] -> 0 | AP29: 7 | AQ29: =RC[-29] -> 0 | AR29: =RC[-29] -> 0 | AS29: 6 | AT29: =RC[-30] -> 0 | AU29: =RC[-30] -> 0 | AV29: =RC[-30] -> 0 | AW29: =RC[-30] -> 1.9370000000000001 | AY29: - | AZ29: - | BA29: -
A30: =IF(RC[1]="","",DATEVALUE(RC[1])) -> 43382 | B30: 09.10.18 | C30: 24 | D30: 69.7 | E30: 64.06 | F30: 7 | G30: 49.27 | H30: 53.46 | I30: 6 | J30: =RC[-5]-RC[-2] -> 10.600000000000001 | K30: 20.43 | S30: 1.7869999999999999 | T30: =(RC[1]*RC[-15]-RC[2]*RC[-12])/1000 -> 1.8310077999999999 | U30: 69.7 | V30: 49.27 | W30: =RC[-2]*RC[-10]/1000 -> 0 | X30: =ABS((RC[-3]*RC[-11]-RC[-2]*RC[-9])/1000) -> 0 | Y30: 2014-01-08T00:00:00.000 | Z30: 2014-01-06T00:00:00.000 | AC30: =VALUE(RC[-27]) -> 2018-10-09T00:00:00.000 | AD30: =IF(RC[21]=42,"*",IF(RC[21]=32,"",RC[21])) -> - | AE30: =RC[-28] -> 24 | AF30: =RC[-28] -> 69.7 | AG30: =RC[-28] -> 64.06 | AH30: =RC[-28] -> 7 | AI30: =RC[-28] -> 49.27 | AJ30: =RC[-28] -> 53.46 | AK30: =RC[-28] -> 6 | AL30: =RC[-28] -> 10.600000000000001 | AM30: =RC[-28] -> 20.43 | AN30: =RC[-28] -> 0 | AO30: =RC[-28] -> 0 | AP30: 7 | AQ30: =RC[-29] -> 0 | AR30: =RC[-29] -> 0 | AS30: 6 | AT30: =RC[-30] -> 0 | AU30: =RC[-30] -> 0 | AV30: =RC[-30] -> 0 | AW30: =RC[-30] -> 1.7869999999999999 | AY30: - | AZ30: - | BA30: -
A31: =IF(RC[1]="","",DATEVALUE(RC[1])) -> 43383 | B31: 10.10.18 | C31: 24 | D31: 70.23 | E31: 65.040000000000006 | F31: 7 | G31: 50.1 | H31: 54.34 | I31: 6 | J31: =RC[-5]-RC[-2] -> 10.700000000000003 | K31: 20.13 | S31: 1.7969999999999999 | T31: =(RC[1]*RC[-15]-RC[2]*RC[-12])/1000 -> 1.8453252000000002 | U31: 70.23 | V31: 50.1 | W31: =RC[-2]*RC[-10]/1000 -> 0 | X31: =ABS((RC[-3]*RC[-11]-RC[-2]*RC[-9])/1000) -> 0 | Y31: 2014-01-09T00:00:00.000 | Z31: 2014-01-07T00:00:00.000 | AC31: =VALUE(RC[-27]) -> 2018-10-10T00:00:00.000 | AD31: =IF(RC[21]=42,"*",IF(RC[21]=32,"",RC[21])) -> - | AE31: =RC[-28] -> 24 | AF31: =RC[-28] -> 70.23 | AG31: =RC[-28] -> 65.040000000000006 | AH31: =RC[-28] -> 7 | AI31: =RC[-28] -> 50.1 | AJ31: =RC[-28] -> 54.34 | AK31: =RC[-28] -> 6 | AL31: =RC[-28] -> 10.700000000000003 | AM31: =RC[-28] -> 20.13 | AN31: =RC[-28] -> 0 | AO31: =RC[-28] -> 0 | AP31: 7 | AQ31: =RC[-29] -> 0 | AR31: =RC[-29] -> 0 | AS31: 6 | AT31: =RC[-30] -> 0 | AU31: =RC[-30] -> 0 | AV31: =RC[-30] -> 0 | AW31: =RC[-30] -> 1.7969999999999999 | AY31: - | AZ31: - | BA31: -
A32: =IF(RC[1]="","",DATEVALUE(RC[1])) -> 43384 | B32: 11.10.18 | C32: 24 | D32: 71.28 | E32: 66.040000000000006 | F32: 7 | G32: 51.23 | H32: 55.38 | I32: 6 | J32: =RC[-5]-RC[-2] -> 10.660000000000004 | K32: 20.05 | S32: 1.819 | T32: =(RC[1]*RC[-15]-RC[2]*RC[-12])/1000 -> 1.8702138000000004 | U32: 71.28 | V32: 51.23 | W32: =RC[-2]*RC[-10]/1000 -> 0 | X32: =ABS((RC[-3]*RC[-11]-RC[-2]*RC[-9])/1000) -> 0 | Y32: 2014-01-10T00:00:00.000 | Z32: 2014-01-08T00:00:00.000 | AC32: =VALUE(RC[-27]) -> 2018-10-11T00:00:00.000 | AD32: =IF(RC[21]=42,"*",IF(RC[21]=32,"",RC[21])) -> - | AE32: =RC[-28] -> 24 | AF32: =RC[-28] -> 71.28 | AG32: =RC[-28] -> 66.040000000000006 | AH32: =RC[-28] -> 7 | AI32: =RC[-28] -> 51.23 | AJ32: =RC[-28] -> 55.38 | AK32: =RC[-28] -> 6 | AL32: =RC[-28] -> 10.660000000000004 | AM32: =RC[-28] -> 20.05 | AN32: =RC[-28] -> 0 | AO32: =RC[-28] -> 0 | AP32: 7 | AQ32: =RC[-29] -> 0 | AR32: =RC[-29] -> 0 | AS32: 6 | AT32: =RC[-30] -> 0 | AU32: =RC[-30] -> 0 | AV32: =RC[-30] -> 0 | AW32: =RC[-30] -> 1.819 | AY32: - | AZ32: - | BA32: -
A33: =IF(RC[1]="","",DATEVALUE(RC[1])) -> 43385 | B33: 12.10.18 | C33: 24 | D33: 69.88 | E33: 65.86 | F33: 7 | G33: 51.1 | H33: 54.97 | I33: 6 | J33: =RC[-5]-RC[-2] -> 10.89 | K33: 18.78 | S33: 1.74 | T33: =(RC[1]*RC[-15]-RC[2]*RC[-12])/1000 -> 1.7933298 | U33: 69.88 | V33: 51.1 | W33: =RC[-2]*RC[-10]/1000 -> 0 | X33: =ABS((RC[-3]*RC[-11]-RC[-2]*RC[-9])/1000) -> 0 | Y33: 2014-01-11T00:00:00.000 | Z33: 2014-01-09T00:00:00.000 | AC33: =VALUE(RC[-27]) -> 2018-10-12T00:00:00.000 | AD33: =IF(RC[21]=42,"*",IF(RC[21]=32,"",RC[21])) -> - | AE33: =RC[-28] -> 24 | AF33: =RC[-28] -> 69.88 | AG33: =RC[-28] -> 65.86 | AH33: =RC[-28] -> 7 | AI33: =RC[-28] -> 51.1 | AJ33: =RC[-28] -> 54.97 | AK33: =RC[-28] -> 6 | AL33: =RC[-28] -> 10.89 | AM33: =RC[-28] -> 18.78 | AN33: =RC[-28] -> 0 | AO33: =RC[-28] -> 0 | AP33: 7 | AQ33: =RC[-29] -> 0 | AR33: =RC[-29] -> 0 | AS33: 6 | AT33: =RC[-30] -> 0 | AU33: =RC[-30] -> 0 | AV33: =RC[-30] -> 0 | AW33: =RC[-30] -> 1.74 | AY33: - | AZ33: - | BA33: -
A34: =IF(RC[1]="","",DATEVALUE(RC[1])) -> 43386 | B34: 13.10.18 | C34: 24 | D34: 71.64 | E34: 66.97 | F34: 7 | G34: 50.95 | H34: 56.05 | I34: 6 | J34: =RC[-5]-RC[-2] -> 10.920000000000002 | K34: 20.69 | S34: 1.887 | T34: =(RC[1]*RC[-15]-RC[2]*RC[-12])/1000 -> 1.9419833000000004 | U34: 71.64 | V34: 50.95 | W34: =RC[-2]*RC[-10]/1000 -> 0 | X34: =ABS((RC[-3]*RC[-11]-RC[-2]*RC[-9])/1000) -> 0 | Y34: 2014-01-12T00:00:00.000 | Z34: 2014-01-10T00:00:00.000 | AC34: =VALUE(RC[-27]) -> 2018-10-13T00:00:00.000 | AD34: =IF(RC[21]=42,"*",IF(RC[21]=32,"",RC[21])) -> - | AE34: =RC[-28] -> 24 | AF34: =RC[-28] -> 71.64 | AG34: =RC[-28] -> 66.97 | AH34: =RC[-28] -> 7 | AI34: =RC[-28] -> 50.95 | AJ34: =RC[-28] -> 56.05 | AK34: =RC[-28] -> 6 | AL34: =RC[-28] -> 10.920000000000002 | AM34: =RC[-28] -> 20.69 | AN34: =RC[-28] -> 0 | AO34: =RC[-28] -> 0 | AP34: 7 | AQ34: =RC[-29] -> 0 | AR34: =RC[-29] -> 0 | AS34: 6 | AT34: =RC[-30] -> 0 | AU34: =RC[-30] -> 0 | AV34: =RC[-30] -> 0 | AW34: =RC[-30] -> 1.887 | AY34: - | AZ34: - | BA34: -
A35: =IF(RC[1]="","",DATEVALUE(RC[1])) -> 43387 | B35: 14.10.18 | C35: 24 | D35: 74.13 | E35: 67.87 | F35: 7 | G35: 51.37 | H35: 56.95 | I35: 6 | J35: =RC[-5]-RC[-2] -> 10.920000000000002 | K35: 22.76 | S35: 2.044 | T35: =(RC[1]*RC[-15]-RC[2]*RC[-12])/1000 -> 2.1056816 | U35: 74.13 | V35: 51.37 | W35: =RC[-2]*RC[-10]/1000 -> 0 | X35: =ABS((RC[-3]*RC[-11]-RC[-2]*RC[-9])/1000) -> 0 | Y35: 2014-01-13T00:00:00.000 | Z35: 2014-01-11T00:00:00.000 | AC35: =VALUE(RC[-27]) -> 2018-10-14T00:00:00.000 | AD35: =IF(RC[21]=42,"*",IF(RC[21]=32,"",RC[21])) -> - | AE35: =RC[-28] -> 24 | AF35: =RC[-28] -> 74.13 | AG35: =RC[-28] -> 67.87 | AH35: =RC[-28] -> 7 | AI35: =RC[-28] -> 51.37 | AJ35: =RC[-28] -> 56.95 | AK35: =RC[-28] -> 6 | AL35: =RC[-28] -> 10.920000000000002 | AM35: =RC[-28] -> 22.76 | AN35: =RC[-28] -> 0 | AO35: =RC[-28] -> 0 | AP35: 7 | AQ35: =RC[-29] -> 0 | AR35: =RC[-29] -> 0 | AS35: 6 | AT35: =RC[-30] -> 0 | AU35: =RC[-30] -> 0 | AV35: =RC[-30] -> 0 | AW35: =RC[-30] -> 2.044 | AY35: - | AZ35: - | BA35: -
A36: =IF(RC[1]="","",DATEVALUE(RC[1])) -> 43388 | B36: 15.10.18 | C36: 24 | D36: 71.650000000000006 | E36: 67.260000000000005 | F36: 7 | G36: 52.37 | H36: 56.67 | I36: 6 | J36: =RC[-5]-RC[-2] -> 10.590000000000003 | K36: 19.28 | S36: 1.7949999999999999 | T36: =(RC[1]*RC[-15]-RC[2]*RC[-12])/1000 -> 1.8513711000000013 | U36: 71.650000000000006 | V36: 52.37 | W36: =RC[-2]*RC[-10]/1000 -> 0 | X36: =ABS((RC[-3]*RC[-11]-RC[-2]*RC[-9])/1000) -> 0 | Y36: 2014-01-14T00:00:00.000 | Z36: 2014-01-12T00:00:00.000 | AC36: =VALUE(RC[-27]) -> 2018-10-15T00:00:00.000 | AD36: =IF(RC[21]=42,"*",IF(RC[21]=32,"",RC[21])) -> - | AE36: =RC[-28] -> 24 | AF36: =RC[-28] -> 71.650000000000006 | AG36: =RC[-28] -> 67.260000000000005 | AH36: =RC[-28] -> 7 | AI36: =RC[-28] -> 52.37 | AJ36: =RC[-28] -> 56.67 | AK36: =RC[-28] -> 6 | AL36: =RC[-28] -> 10.590000000000003 | AM36: =RC[-28] -> 19.28 | AN36: =RC[-28] -> 0 | AO36: =RC[-28] -> 0 | AP36: 7 | AQ36: =RC[-29] -> 0 | AR36: =RC[-29] -> 0 | AS36: 6 | AT36: =RC[-30] -> 0 | AU36: =RC[-30] -> 0 | AV36: =RC[-30] -> 0 | AW36: =RC[-30] -> 1.7949999999999999 | AY36: - | AZ36: - | BA36: -
A37: =IF(RC[1]="","",DATEVALUE(RC[1])) -> 43389 | B37: 16.10.18 | C37: 24 | D37: 72.33 | E37: 67.290000000000006 | F37: 7 | G37: 52.87 | H37: 56.57 | I37: 6 | J37: =RC[-5]-RC[-2] -> 10.720000000000006 | K37: 19.46 | S37: 1.8149999999999999 | T37: =(RC[1]*RC[-15]-RC[2]*RC[-12])/1000 -> 1.8762298000000006 | U37: 72.33 | V37: 52.87 | W37: =RC[-2]*RC[-10]/1000 -> 0 | X37: =ABS((RC[-3]*RC[-11]-RC[-2]*RC[-9])/1000) -> 0 | Y37: 2014-01-15T00:00:00.000 | Z37: 2014-01-13T00:00:00.000 | AC37: =VALUE(RC[-27]) -> 2018-10-16T00:00:00.000 | AD37: =IF(RC[21]=42,"*",IF(RC[21]=32,"",RC[21])) -> - | AE37: =RC[-28] -> 24 | AF37: =RC[-28] -> 72.33 | AG37: =RC[-28] -> 67.290000000000006 | AH37: =RC[-28] -> 7 | AI37: =RC[-28] -> 52.87 | AJ37: =RC[-28] -> 56.57 | AK37: =RC[-28] -> 6 | AL37: =RC[-28] -> 10.720000000000006 | AM37: =RC[-28] -> 19.46 | AN37: =RC[-28] -> 0 | AO37: =RC[-28] -> 0 | AP37: 7 | AQ37: =RC[-29] -> 0 | AR37: =RC[-29] -> 0 | AS37: 6 | AT37: =RC[-30] -> 0 | AU37: =RC[-30] -> 0 | AV37: =RC[-30] -> 0 | AW37: =RC[-30] -> 1.8149999999999999 | AY37: - | AZ37: - | BA37: -
A38: =IF(RC[1]="","",DATEVALUE(RC[1])) -> 43390 | B38: 17.10.18 | C38: 24 | D38: 71.599999999999994 | E38: 67.510000000000005 | F38: 7 | G38: 53.08 | H38: 56.93 | I38: 6 | J38: =RC[-5]-RC[-2] -> 10.580000000000005 | K38: 18.52 | S38: 1.756 | T38: =(RC[1]*RC[-15]-RC[2]*RC[-12])/1000 -> 1.8118716000000004 | U38: 71.599999999999994 | V38: 53.08 | W38: =RC[-2]*RC[-10]/1000 -> 0 | X38: =ABS((RC[-3]*RC[-11]-RC[-2]*RC[-9])/1000) -> 0 | Y38: 2014-01-16T00:00:00.000 | Z38: 2014-01-14T00:00:00.000 | AC38: =VALUE(RC[-27]) -> 2018-10-17T00:00:00.000 | AD38: =IF(RC[21]=42,"*",IF(RC[21]=32,"",RC[21])) -> - | AE38: =RC[-28] -> 24 | AF38: =RC[-28] -> 71.599999999999994 | AG38: =RC[-28] -> 67.510000000000005 | AH38: =RC[-28] -> 7 | AI38: =RC[-28] -> 53.08 | AJ38: =RC[-28] -> 56.93 | AK38: =RC[-28] -> 6 | AL38: =RC[-28] -> 10.580000000000005 | AM38: =RC[-28] -> 18.52 | AN38: =RC[-28] -> 0 | AO38: =RC[-28] -> 0 | AP38: 7 | AQ38: =RC[-29] -> 0 | AR38: =RC[-29] -> 0 | AS38: 6 | AT38: =RC[-30] -> 0 | AU38: =RC[-30] -> 0 | AV38: =RC[-30] -> 0 | AW38: =RC[-30] -> 1.756 | AY38: - | AZ38: - | BA38: -
A39: =IF(RC[1]="","",DATEVALUE(RC[1])) -> 43391 | B39: 18.10.18 | C39: 24 | D39: 72.44 | E39: 67.95 | F39: 7 | G39: 52.59 | H39: 57.14 | I39: 6 | J39: 10.810000000000002 | K39: 19.850000000000001 | S39: 1.857 | T39: 1.9173053999999998 | U39: 72.44 | V39: 52.59 | W39: 0 | X39: 0 | Y39: 2014-01-17T00:00:00.000 | Z39: 2014-01-15T00:00:00.000 | AC39: =VALUE(RC[-27]) -> 2018-10-18T00:00:00.000 | AD39: =IF(RC[21]=42,"*",IF(RC[21]=32,"",RC[21])) ->  | AE39: =RC[-28] -> 24 | AF39: =RC[-28] -> 72.44 | AG39: =RC[-28] -> 67.95 | AH39: =RC[-28] -> 7 | AI39: =RC[-28] -> 52.59 | AJ39: =RC[-28] -> 57.14 | AK39: =RC[-28] -> 6 | AL39: =RC[-28] -> 10.810000000000002 | AM39: =RC[-28] -> 19.850000000000001 | AN39: =RC[-28] -> 0 | AO39: =RC[-28] -> 0 | AQ39: =RC[-29] -> 0 | AR39: =RC[-29] -> 0 | AT39: =RC[-30] -> 0 | AU39: =RC[-30] -> 0 | AV39: =RC[-30] -> 0 | AW39: =RC[-30] -> 1.857
A40: =IF(RC[1]="","",DATEVALUE(RC[1])) -> 43392 | B40: 19.10.18 | C40: 24 | D40: 72.58 | E40: 67.72 | F40: 7 | G40: 52.55 | H40: 56.83 | I40: 6 | J40: 10.89 | K40: 20.03 | S40: 1.871 | T40: 1.9287010999999998 | U40: 72.58 | V40: 52.55 | W40: 0 | X40: 0 | Y40: 2014-01-18T00:00:00.000 | Z40: 2014-01-16T00:00:00.000 | AC40: =VALUE(RC[-27]) -> 2018-10-19T00:00:00.000 | AD40: =IF(RC[21]=42,"*",IF(RC[21]=32,"",RC[21])) ->  | AE40: =RC[-28] -> 24 | AF40: =RC[-28] -> 72.58 | AG40: =RC[-28] -> 67.72 | AH40: =RC[-28] -> 7 | AI40: =RC[-28] -> 52.55 | AJ40: =RC[-28] -> 56.83 | AK40: =RC[-28] -> 6 | AL40: =RC[-28] -> 10.89 | AM40: =RC[-28] -> 20.03 | AN40: =RC[-28] -> 0 | AO40: =RC[-28] -> 0 | AQ40: =RC[-29] -> 0 | AR40: =RC[-29] -> 0 | AT40: =RC[-30] -> 0 | AU40: =RC[-30] -> 0 | AV40: =RC[-30] -> 0 | AW40: =RC[-30] -> 1.871
A41: =IF(RC[1]="","",DATEVALUE(RC[1])) -> 43393 | B41: 20.10.18 | C41: 24 | D41: 73.62 | E41: 67.14 | F41: 7 | G41: 51.86 | H41: 56.59 | I41: 6 | J41: 10.549999999999997 | K41: 21.76 | S41: 1.948 | T41: 2.0080894000000002 | U41: 73.62 | V41: 51.86 | W41: 0 | X41: 0 | Y41: 2014-01-19T00:00:00.000 | Z41: 2014-01-17T00:00:00.000 | AC41: =VALUE(RC[-27]) -> 2018-10-20T00:00:00.000 | AD41: =IF(RC[21]=42,"*",IF(RC[21]=32,"",RC[21])) ->  | AE41: =RC[-28] -> 24 | AF41: =RC[-28] -> 73.62 | AG41: =RC[-28] -> 67.14 | AH41: =RC[-28] -> 7 | AI41: =RC[-28] -> 51.86 | AJ41: =RC[-28] -> 56.59 | AK41: =RC[-28] -> 6 | AL41: =RC[-28] -> 10.549999999999997 | AM41: =RC[-28] -> 21.76 | AN41: =RC[-28] -> 0 | AO41: =RC[-28] -> 0 | AQ41: =RC[-29] -> 0 | AR41: =RC[-29] -> 0 | AT41: =RC[-30] -> 0 | AU41: =RC[-30] -> 0 | AV41: =RC[-30] -> 0 | AW41: =RC[-30] -> 1.948
A42: =IF(RC[1]="","",DATEVALUE(RC[1])) -> 43394 | B42: 21.10.18 | C42: 24 | D42: 77.61 | E42: 66.52 | F42: 7 | G42: 50.83 | H42: 56.32 | I42: 6 | J42: 10.199999999999996 | K42: 26.78 | S42: 2.2349999999999999 | T42: 2.2998715999999999 | U42: 77.61 | V42: 50.83 | W42: 0 | X42: 0 | Y42: 2014-01-20T00:00:00.000 | Z42: 2014-01-18T00:00:00.000 | AC42: =VALUE(RC[-27]) -> 2018-10-21T00:00:00.000 | AD42: =IF(RC[21]=42,"*",IF(RC[21]=32,"",RC[21])) ->  | AE42: =RC[-28] -> 24 | AF42: =RC[-28] -> 77.61 | AG42: =RC[-28] -> 66.52 | AH42: =RC[-28] -> 7 | AI42: =RC[-28] -> 50.83 | AJ42: =RC[-28] -> 56.32 | AK42: =RC[-28] -> 6 | AL42: =RC[-28] -> 10.199999999999996 | AM42: =RC[-28] -> 26.78 | AN42: =RC[-28] -> 0 | AO42: =RC[-28] -> 0 | AQ42: =RC[-29] -> 0 | AR42: =RC[-29] -> 0 | AT42: =RC[-30] -> 0 | AU42: =RC[-30] -> 0 | AV42: =RC[-30] -> 0 | AW42: =RC[-30] -> 2.2349999999999999
A43: =IF(RC[1]="","",DATEVALUE(RC[1])) -> 43395 | B43: 22.10.18 | C43: 24 | D43: 72.489999999999995 | E43: 66.73 | F43: 7 | G43: 51.87 | H43: 55.71 | I43: 6 | J43: 11.020000000000003 | K43: 20.62 | S43: 1.89 | T43: 1.9475800000000003 | U43: 72.489999999999995 | V43: 51.87 | W43: 0 | X43: 0 | Y43: 2014-01-21T00:00:00.000 | Z43: 2014-01-19T00:00:00.000 | AC43: =VALUE(RC[-27]) -> 2018-10-22T00:00:00.000 | AD43: =IF(RC[21]=42,"*",IF(RC[21]=32,"",RC[21])) ->  | AE43: =RC[-28] -> 24 | AF43: =RC[-28] -> 72.489999999999995 | AG43: =RC[-28] -> 66.73 | AH43: =RC[-28] -> 7 | AI43: =RC[-28] -> 51.87 | AJ43: =RC[-28] -> 55.71 | AK43: =RC[-28] -> 6 | AL43: =RC[-28] -> 11.020000000000003 | AM43: =RC[-28] -> 20.62 | AN43: =RC[-28] -> 0 | AO43: =RC[-28] -> 0 | AQ43: =RC[-29] -> 0 | AR43: =RC[-29] -> 0 | AT43: =RC[-30] -> 0 | AU43: =RC[-30] -> 0 | AV43: =RC[-30] -> 0 | AW43: =RC[-30] -> 1.89
A44: =IF(RC[1]="","",DATEVALUE(RC[1])) ->  | C44: 24 | J44: =RC[-5]-RC[-2] -> #VALUE! | T44: =(RC[1]*RC[-15]-RC[2]*RC[-12])/1000 -> #VALUE! | W44: =RC[-2]*RC[-10]/1000 -> #VALUE! | X44: =ABS((RC[-3]*RC[-11]-RC[-2]*RC[-9])/1000) -> #VALUE! | Y44: 2014-01-22T00:00:00.000 | Z44: 2014-01-20T00:00:00.000 | AC44: =VALUE(RC[-27]) -> #VALUE! | AD44: =IF(RC[21]=42,"*",IF(RC[21]=32,"",RC[21])) ->  | AE44: =RC[-28] -> 24 | AF44: =RC[-28] ->  | AG44: =RC[-28] ->  | AH44: =RC[-28] ->  | AI44: =RC[-28] ->  | AJ44: =RC[-28] ->  | AK44: =RC[-28] ->  | AL44: =RC[-28] -> #VALUE! | AM44: =RC[-28] ->  | AN44: =RC[-28] -> 0 | AO44: =RC[-28] -> 0 | AQ44: =RC[-29] -> 0 | AR44: =RC[-29] -> 0 | AT44: =RC[-30] -> 0 | AU44: =RC[-30] -> 0 | AV44: =RC[-30] -> 0 | AW44: =RC[-30] -> 
A45: =IF(RC[1]="","",DATEVALUE(RC[1])) ->  | C45: 24 | T45: =(RC[1]*RC[-15]-RC[2]*RC[-12])/1000 -> #VALUE! | W45: =RC[-2]*RC[-10]/1000 -> #VALUE! | X45: =ABS((RC[-3]*RC[-11]-RC[-2]*RC[-9])/1000) -> #VALUE! | AC45: =VALUE(RC[-27]) -> #VALUE! | AD45: =IF(RC[21]=42,"*",IF(RC[21]=32,"",RC[21])) ->  | AE45: =RC[-28] -> 24 | AF45: =RC[-28] ->  | AG45: =RC[-28] ->  | AH45: =RC[-28] ->  | AI45: =RC[-28] ->  | AJ45: =RC[-28] ->  | AK45: =RC[-28] ->  | AL45: =RC[-28] -> 0 | AM45: =RC[-28] ->  | AN45: =RC[-28] -> 0 | AO45: =RC[-28] -> 0 | AQ45: =RC[-29] -> 0 | AR45: =RC[-29] -> 0 | AT45: =RC[-30] -> 0 | AU45: =RC[-30] -> 0 | AV45: =RC[-30] -> 0 | AW45: =RC[-30] -> 
A46: =IF(RC[1]="","",DATEVALUE(RC[1])) ->  | C46: 24 | T46: =(RC[1]*RC[-15]-RC[2]*RC[-12])/1000 -> #VALUE! | W46: =RC[-2]*RC[-10]/1000 -> #VALUE! | X46: =ABS((RC[-3]*RC[-11]-RC[-2]*RC[-9])/1000) -> #VALUE! | AC46: =VALUE(RC[-27]) -> #VALUE! | AD46: =IF(RC[21]=42,"*",IF(RC[21]=32,"",RC[21])) ->  | AE46: =RC[-28] -> 24 | AF46: =RC[-28] ->  | AG46: =RC[-28] ->  | AH46: =RC[-28] ->  | AI46: =RC[-28] ->  | AJ46: =RC[-28] ->  | AK46: =RC[-28] ->  | AL46: =RC[-28] -> 0 | AM46: =RC[-28] ->  | AN46: =RC[-28] -> 0 | AO46: =RC[-28] -> 0 | AQ46: =RC[-29] -> 0 | AR46: =RC[-29] -> 0 | AT46: =RC[-30] -> 0 | AU46: =RC[-30] -> 0 | AV46: =RC[-30] -> 0 | AW46: =RC[-30] -> 
A47: =IF(RC[1]="","",DATEVALUE(RC[1])) ->  | C47: 24 | T47: =(RC[1]*RC[-15]-RC[2]*RC[-12])/1000 -> #VALUE! | W47: =RC[-2]*RC[-10]/1000 -> #VALUE! | X47: =ABS((RC[-3]*RC[-11]-RC[-2]*RC[-9])/1000) -> #VALUE! | AC47: =VALUE(RC[-27]) -> #VALUE! | AD47: =IF(RC[21]=42,"*",IF(RC[21]=32,"",RC[21])) ->  | AE47: =RC[-28] -> 24 | AF47: =RC[-28] ->  | AG47: =RC[-28] ->  | AH47: =RC[-28] ->  | AI47: =RC[-28] ->  | AJ47: =RC[-28] ->  | AK47: =RC[-28] ->  | AL47: =RC[-28] -> 0 | AM47: =RC[-28] ->  | AN47: =RC[-28] -> 0 | AO47: =RC[-28] -> 0 | AQ47: =RC[-29] -> 0 | AR47: =RC[-29] -> 0 | AT47: =RC[-30] -> 0 | AU47: =RC[-30] -> 0 | AV47: =RC[-30] -> 0 | AW47: =RC[-30] -> 
A48: =IF(RC[1]="","",DATEVALUE(RC[1])) ->  | C48: 24 | T48: =(RC[1]*RC[-15]-RC[2]*RC[-12])/1000 -> #VALUE! | W48: =RC[-2]*RC[-10]/1000 -> #VALUE! | X48: =ABS((RC[-3]*RC[-11]-RC[-2]*RC[-9])/1000) -> #VALUE! | AC48: =VALUE(RC[-27]) -> #VALUE! | AD48: =IF(RC[21]=42,"*",IF(RC[21]=32,"",RC[21])) ->  | AE48: =RC[-28] -> 24 | AF48: =RC[-28] ->  | AG48: =RC[-28] ->  | AH48: =RC[-28] ->  | AI48: =RC[-28] ->  | AJ48: =RC[-28] ->  | AK48: =RC[-28] ->  | AL48: =RC[-28] -> 0 | AM48: =RC[-28] ->  | AN48: =RC[-28] -> 0 | AO48: =RC[-28] -> 0 | AQ48: =RC[-29] -> 0 | AR48: =RC[-29] -> 0 | AT48: =RC[-30] -> 0 | AU48: =RC[-30] -> 0 | AV48: =RC[-30] -> 0 | AW48: =RC[-30] -> 
A49: =IF(RC[1]="","",DATEVALUE(RC[1])) ->  | C49: 24 | T49: =(RC[1]*RC[-15]-RC[2]*RC[-12])/1000 -> #VALUE! | W49: =RC[-2]*RC[-10]/1000 -> #VALUE! | X49: =ABS((RC[-3]*RC[-11]-RC[-2]*RC[-9])/1000) -> #VALUE! | AC49: =VALUE(RC[-27]) -> #VALUE! | AD49: =IF(RC[21]=42,"*",IF(RC[21]=32,"",RC[21])) ->  | AE49: =RC[-28] -> 24 | AF49: =RC[-28] ->  | AG49: =RC[-28] ->  | AH49: =RC[-28] ->  | AI49: =RC[-28] ->  | AJ49: =RC[-28] ->  | AK49: =RC[-28] ->  | AL49: =RC[-28] -> 0 | AM49: =RC[-28] ->  | AN49: =RC[-28] -> 0 | AO49: =RC[-28] -> 0 | AQ49: =RC[-29] -> 0 | AR49: =RC[-29] -> 0 | AT49: =RC[-30] -> 0 | AU49: =RC[-30] -> 0 | AV49: =RC[-30] -> 0 | AW49: =RC[-30] -> 
A50: =IF(RC[1]="","",DATEVALUE(RC[1])) ->  | T50: =(RC[1]*RC[-15]-RC[2]*RC[-12])/1000 -> #VALUE! | W50: =RC[-2]*RC[-10]/1000 -> #VALUE! | X50: =ABS((RC[-3]*RC[-11]-RC[-2]*RC[-9])/1000) -> #VALUE! | AC50: =VALUE(RC[-27]) -> #VALUE! | AD50: =IF(RC[21]=42,"*",IF(RC[21]=32,"",RC[21])) ->  | AE50: =RC[-28] ->  | AF50: =RC[-28] ->  | AG50: =RC[-28] ->  | AH50: =RC[-28] ->  | AI50: =RC[-28] ->  | AJ50: =RC[-28] ->  | AK50: =RC[-28] ->  | AL50: =RC[-28] -> 0 | AM50: =RC[-28] ->  | AN50: =RC[-28] -> 0 | AO50: =RC[-28] -> 0 | AQ50: =RC[-29] -> 0 | AR50: =RC[-29] -> 0 | AT50: =RC[-30] -> 0 | AU50: =RC[-30] -> 0 | AV50: =RC[-30] -> 0 | AW50: =RC[-30] -> 
A51: =IF(RC[1]="","",DATEVALUE(RC[1])) ->  | T51: =(RC[1]*RC[-15]-RC[2]*RC[-12])/1000 -> #VALUE! | W51: =RC[-2]*RC[-10]/1000 -> #VALUE! | X51: =ABS((RC[-3]*RC[-11]-RC[-2]*RC[-9])/1000) -> #VALUE! | AC51: =VALUE(RC[-27]) -> #VALUE! | AD51: =IF(RC[21]=42,"*",IF(RC[21]=32,"",RC[21])) ->  | AE51: =RC[-28] ->  | AF51: =RC[-28] ->  | AG51: =RC[-28] ->  | AH51: =RC[-28] ->  | AI51: =RC[-28] ->  | AJ51: =RC[-28] ->  | AK51: =RC[-28] ->  | AL51: =RC[-28] -> 0 | AM51: =RC[-28] ->  | AN51: =RC[-28] -> 0 | AO51: =RC[-28] -> 0 | AQ51: =RC[-29] -> 0 | AR51: =RC[-29] -> 0 | AT51: =RC[-30] -> 0 | AU51: =RC[-30] -> 0 | AV51: =RC[-30] -> 0 | AW51: =RC[-30] -> 
A52: =IF(RC[1]="","",DATEVALUE(RC[1])) ->  | T52: =(RC[1]*RC[-15]-RC[2]*RC[-12])/1000 -> #VALUE! | W52: =RC[-2]*RC[-10]/1000 -> #VALUE! | X52: =ABS((RC[-3]*RC[-11]-RC[-2]*RC[-9])/1000) -> #VALUE! | AC52: =VALUE(RC[-27]) -> #VALUE! | AD52: =IF(RC[21]=42,"*",IF(RC[21]=32,"",RC[21])) ->  | AE52: =RC[-28] ->  | AF52: =RC[-28] ->  | AG52: =RC[-28] ->  | AH52: =RC[-28] ->  | AI52: =RC[-28] ->  | AJ52: =RC[-28] ->  | AK52: =RC[-28] ->  | AL52: =RC[-28] -> 0 | AM52: =RC[-28] ->  | AN52: =RC[-28] -> 0 | AO52: =RC[-28] -> 0 | AQ52: =RC[-29] -> 0 | AR52: =RC[-29] -> 0 | AT52: =RC[-30] -> 0 | AU52: =RC[-30] -> 0 | AV52: =RC[-30] -> 0 | AW52: =RC[-30] -> 
A53: =IF(RC[1]="","",DATEVALUE(RC[1])) ->  | T53: =(RC[1]*RC[-15]-RC[2]*RC[-12])/1000 -> #VALUE! | W53: =RC[-2]*RC[-10]/1000 -> #VALUE! | X53: =ABS((RC[-3]*RC[-11]-RC[-2]*RC[-9])/1000) -> #VALUE! | AC53: =VALUE(RC[-27]) -> #VALUE! | AD53: =IF(RC[21]=42,"*",IF(RC[21]=32,"",RC[21])) ->  | AE53: =RC[-28] ->  | AF53: =RC[-28] ->  | AG53: =RC[-28] ->  | AH53: =RC[-28] ->  | AI53: =RC[-28] ->  | AJ53: =RC[-28] ->  | AK53: =RC[-28] ->  | AL53: =RC[-28] -> 0 | AM53: =RC[-28] ->  | AN53: =RC[-28] -> 0 | AO53: =RC[-28] -> 0 | AQ53: =RC[-29] -> 0 | AR53: =RC[-29] -> 0 | AT53: =RC[-30] -> 0 | AU53: =RC[-30] -> 0 | AV53: =RC[-30] -> 0 | AW53: =RC[-30] -> 
A54: =IF(RC[1]="","",DATEVALUE(RC[1])) ->  | T54: =(RC[1]*RC[-15]-RC[2]*RC[-12])/1000 -> #VALUE! | W54: =RC[-2]*RC[-10]/1000 -> #VALUE! | X54: =ABS((RC[-3]*RC[-11]-RC[-2]*RC[-9])/1000) -> #VALUE! | AC54: =VALUE(RC[-27]) -> #VALUE! | AD54: =IF(RC[21]=42,"*",IF(RC[21]=32,"",RC[21])) ->  | AE54: =RC[-28] ->  | AF54: =RC[-28] ->  | AG54: =RC[-28] ->  | AH54: =RC[-28] ->  | AI54: =RC[-28] ->  | AJ54: =RC[-28] ->  | AK54: =RC[-28] ->  | AL54: =RC[-28] -> 0 | AM54: =RC[-28] ->  | AN54: =RC[-28] -> 0 | AO54: =RC[-28] -> 0 | AQ54: =RC[-29] -> 0 | AR54: =RC[-29] -> 0 | AT54: =RC[-30] -> 0 | AU54: =RC[-30] -> 0 | AV54: =RC[-30] -> 0 | AW54: =RC[-30] -> 
A55: =IF(RC[1]="","",DATEVALUE(RC[1])) ->  | T55: =(RC[1]*RC[-15]-RC[2]*RC[-12])/1000 -> #VALUE! | W55: =RC[-2]*RC[-10]/1000 -> #VALUE! | X55: =ABS((RC[-3]*RC[-11]-RC[-2]*RC[-9])/1000) -> #VALUE! | AC55: =VALUE(RC[-27]) -> #VALUE! | AD55: =IF(RC[21]=42,"*",IF(RC[21]=32,"",RC[21])) ->  | AE55: =RC[-28] ->  | AF55: =RC[-28] ->  | AG55: =RC[-28] ->  | AH55: =RC[-28] ->  | AI55: =RC[-28] ->  | AJ55: =RC[-28] ->  | AK55: =RC[-28] ->  | AL55: =RC[-28] -> 0 | AM55: =RC[-28] ->  | AN55: =RC[-28] -> 0 | AO55: =RC[-28] -> 0 | AQ55: =RC[-29] -> 0 | AR55: =RC[-29] -> 0 | AT55: =RC[-30] -> 0 | AU55: =RC[-30] -> 0 | AV55: =RC[-30] -> 0 | AW55: =RC[-30] -> 
A56: =IF(RC[1]="","",DATEVALUE(RC[1])) ->  | T56: =(RC[1]*RC[-15]-RC[2]*RC[-12])/1000 -> #VALUE! | W56: =RC[-2]*RC[-10]/1000 -> #VALUE! | X56: =ABS((RC[-3]*RC[-11]-RC[-2]*RC[-9])/1000) -> #VALUE! | AC56: =VALUE(RC[-27]) -> #VALUE! | AD56: =IF(RC[21]=42,"*",IF(RC[21]=32,"",RC[21])) ->  | AE56: =RC[-28] ->  | AF56: =RC[-28] ->  | AG56: =RC[-28] ->  | AH56: =RC[-28] ->  | AI56: =RC[-28] ->  | AJ56: =RC[-28] ->  | AK56: =RC[-28] ->  | AL56: =RC[-28] -> 0 | AM56: =RC[-28] ->  | AN56: =RC[-28] -> 0 | AO56: =RC[-28] -> 0 | AQ56: =RC[-29] -> 0 | AR56: =RC[-29] -> 0 | AT56: =RC[-30] -> 0 | AU56: =RC[-30] -> 0 | AV56: =RC[-30] -> 0 | AW56: =RC[-30] -> 
A57: =IF(RC[1]="","",DATEVALUE(RC[1])) ->  | T57: =(RC[1]*RC[-15]-RC[2]*RC[-12])/1000 -> #VALUE! | W57: =RC[-2]*RC[-10]/1000 -> #VALUE! | X57: =ABS((RC[-3]*RC[-11]-RC[-2]*RC[-9])/1000) -> #VALUE! | AC57: =VALUE(RC[-27]) -> #VALUE! | AD57: =IF(RC[21]=42,"*",IF(RC[21]=32,"",RC[21])) ->  | AE57: =RC[-28] ->  | AF57: =RC[-28] ->  | AG57: =RC[-28] ->  | AH57: =RC[-28] ->  | AI57: =RC[-28] ->  | AJ57: =RC[-28] ->  | AK57: =RC[-28] ->  | AL57: =RC[-28] -> 0 | AM57: =RC[-28] ->  | AN57: =RC[-28] -> 0 | AO57: =RC[-28] -> 0 | AQ57: =RC[-29] -> 0 | AR57: =RC[-29] -> 0 | AT57: =RC[-30] -> 0 | AU57: =RC[-30] -> 0 | AV57: =RC[-30] -> 0 | AW57: =RC[-30] -> 
A58: =IF(RC[1]="","",DATEVALUE(RC[1])) ->  | T58: =(RC[1]*RC[-15]-RC[2]*RC[-12])/1000 -> #VALUE! | W58: =RC[-2]*RC[-10]/1000 -> #VALUE! | X58: =ABS((RC[-3]*RC[-11]-RC[-2]*RC[-9])/1000) -> #VALUE! | AC58: =VALUE(RC[-27]) -> #VALUE! | AD58: =IF(RC[21]=42,"*",IF(RC[21]=32,"",RC[21])) ->  | AE58: =RC[-28] ->  | AF58: =RC[-28] ->  | AG58: =RC[-28] ->  | AH58: =RC[-28] ->  | AI58: =RC[-28] ->  | AJ58: =RC[-28] ->  | AK58: =RC[-28] ->  | AL58: =RC[-28] -> 0 | AM58: =RC[-28] ->  | AN58: =RC[-28] -> 0 | AO58: =RC[-28] -> 0 | AQ58: =RC[-29] -> 0 | AR58: =RC[-29] -> 0 | AT58: =RC[-30] -> 0 | AU58: =RC[-30] -> 0 | AV58: =RC[-30] -> 0 | AW58: =RC[-30] -> 
A59: =IF(RC[1]="","",DATEVALUE(RC[1])) ->  | T59: =(RC[1]*RC[-15]-RC[2]*RC[-12])/1000 -> #VALUE! | W59: =RC[-2]*RC[-10]/1000 -> #VALUE! | X59: =ABS((RC[-3]*RC[-11]-RC[-2]*RC[-9])/1000) -> #VALUE! | AC59: =VALUE(RC[-27]) -> #VALUE! | AD59: =IF(RC[21]=42,"*",IF(RC[21]=32,"",RC[21])) ->  | AE59: =RC[-28] ->  | AF59: =RC[-28] ->  | AG59: =RC[-28] ->  | AH59: =RC[-28] ->  | AI59: =RC[-28] ->  | AJ59: =RC[-28] ->  | AK59: =RC[-28] ->  | AL59: =RC[-28] -> 0 | AM59: =RC[-28] ->  | AN59: =RC[-28] -> 0 | AO59: =RC[-28] -> 0 | AQ59: =RC[-29] -> 0 | AR59: =RC[-29] -> 0 | AT59: =RC[-30] -> 0 | AU59: =RC[-30] -> 0 | AV59: =RC[-30] -> 0 | AW59: =RC[-30] -> 
A60: =IF(RC[1]="","",DATEVALUE(RC[1])) ->  | T60: =(RC[1]*RC[-15]-RC[2]*RC[-12])/1000 -> #VALUE! | W60: =RC[-2]*RC[-10]/1000 -> #VALUE! | X60: =ABS((RC[-3]*RC[-11]-RC[-2]*RC[-9])/1000) -> #VALUE! | AC60: =VALUE(RC[-27]) -> #VALUE! | AD60: =IF(RC[21]=42,"*",IF(RC[21]=32,"",RC[21])) ->  | AE60: =RC[-28] ->  | AF60: =RC[-28] ->  | AG60: =RC[-28] ->  | AH60: =RC[-28] ->  | AI60: =RC[-28] ->  | AJ60: =RC[-28] ->  | AK60: =RC[-28] ->  | AL60: =RC[-28] -> 0 | AM60: =RC[-28] ->  | AN60: =RC[-28] -> 0 | AO60: =RC[-28] -> 0 | AQ60: =RC[-29] -> 0 | AR60: =RC[-29] -> 0 | AT60: =RC[-30] -> 0 | AU60: =RC[-30] -> 0 | AV60: =RC[-30] -> 0 | AW60: =RC[-30] -> 
A61: =IF(RC[1]="","",DATEVALUE(RC[1])) ->  | T61: =(RC[1]*RC[-15]-RC[2]*RC[-12])/1000 -> #VALUE! | W61: =RC[-2]*RC[-10]/1000 -> #VALUE! | X61: =ABS((RC[-3]*RC[-11]-RC[-2]*RC[-9])/1000) -> #VALUE! | AC61: =VALUE(RC[-27]) -> #VALUE! | AD61: =IF(RC[21]=42,"*",IF(RC[21]=32,"",RC[21])) ->  | AE61: =RC[-28] ->  | AF61: =RC[-28] ->  | AG61: =RC[-28] ->  | AH61: =RC[-28] ->  | AI61: =RC[-28] ->  | AJ61: =RC[-28] ->  | AK61: =RC[-28] ->  | AL61: =RC[-28] -> 0 | AM61: =RC[-28] ->  | AN61: =RC[-28] -> 0 | AO61: =RC[-28] -> 0 | AQ61: =RC[-29] -> 0 | AR61: =RC[-29] -> 0 | AT61: =RC[-30] -> 0 | AU61: =RC[-30] -> 0 | AV61: =RC[-30] -> 0 | AW61: =RC[-30] -> 
A62: =IF(RC[1]="","",DATEVALUE(RC[1])) ->  | T62: =(RC[1]*RC[-15]-RC[2]*RC[-12])/1000 -> #VALUE! | W62: =RC[-2]*RC[-10]/1000 -> #VALUE! | X62: =ABS((RC[-3]*RC[-11]-RC[-2]*RC[-9])/1000) -> #VALUE! | AC62: =VALUE(RC[-27]) -> #VALUE! | AD62: =IF(RC[21]=42,"*",IF(RC[21]=32,"",RC[21])) ->  | AE62: =RC[-28] ->  | AF62: =RC[-28] ->  | AG62: =RC[-28] ->  | AH62: =RC[-28] ->  | AI62: =RC[-28] ->  | AJ62: =RC[-28] ->  | AK62: =RC[-28] ->  | AL62: =RC[-28] -> 0 | AM62: =RC[-28] ->  | AN62: =RC[-28] -> 0 | AO62: =RC[-28] -> 0 | AQ62: =RC[-29] -> 0 | AR62: =RC[-29] -> 0 | AT62: =RC[-30] -> 0 | AU62: =RC[-30] -> 0 | AV62: =RC[-30] -> 0 | AW62: =RC[-30] -> 
A63: =IF(RC[1]="","",DATEVALUE(RC[1])) ->  | T63: =(RC[1]*RC[-15]-RC[2]*RC[-12])/1000 -> #VALUE! | W63: =RC[-2]*RC[-10]/1000 -> #VALUE! | X63: =ABS((RC[-3]*RC[-11]-RC[-2]*RC[-9])/1000) -> #VALUE! | AC63: =VALUE(RC[-27]) -> #VALUE! | AD63: =IF(RC[21]=42,"*",IF(RC[21]=32,"",RC[21])) ->  | AE63: =RC[-28] ->  | AF63: =RC[-28] ->  | AG63: =RC[-28] ->  | AH63: =RC[-28] ->  | AI63: =RC[-28] ->  | AJ63: =RC[-28] ->  | AK63: =RC[-28] ->  | AL63: =RC[-28] -> 0 | AM63: =RC[-28] ->  | AN63: =RC[-28] -> 0 | AO63: =RC[-28] -> 0 | AQ63: =RC[-29] -> 0 | AR63: =RC[-29] -> 0 | AT63: =RC[-30] -> 0 | AU63: =RC[-30] -> 0 | AV63: =RC[-30] -> 0 | AW63: =RC[-30] -> 
A64: =IF(RC[1]="","",DATEVALUE(RC[1])) ->  | T64: =(RC[1]*RC[-15]-RC[2]*RC[-12])/1000 -> #VALUE! | W64: =RC[-2]*RC[-10]/1000 -> #VALUE! | X64: =ABS((RC[-3]*RC[-11]-RC[-2]*RC[-9])/1000) -> #VALUE! | AC64: =VALUE(RC[-27]) -> #VALUE! | AD64: =IF(RC[21]=42,"*",IF(RC[21]=32,"",RC[21])) ->  | AE64: =RC[-28] ->  | AF64: =RC[-28] ->  | AG64: =RC[-28] ->  | AH64: =RC[-28] ->  | AI64: =RC[-28] ->  | AJ64: =RC[-28] ->  | AK64: =RC[-28] ->  | AL64: =RC[-28] -> 0 | AM64: =RC[-28] ->  | AN64: =RC[-28] -> 0 | AO64: =RC[-28] -> 0 | AQ64: =RC[-29] -> 0 | AR64: =RC[-29] -> 0 | AT64: =RC[-30] -> 0 | AU64: =RC[-30] -> 0 | AV64: =RC[-30] -> 0 | AW64: =RC[-30] -> 
A65: =IF(RC[1]="","",DATEVALUE(RC[1])) ->  | T65: =(RC[1]*RC[-15]-RC[2]*RC[-12])/1000 -> #VALUE! | W65: =RC[-2]*RC[-10]/1000 -> #VALUE! | X65: =ABS((RC[-3]*RC[-11]-RC[-2]*RC[-9])/1000) -> #VALUE! | AC65: =VALUE(RC[-27]) -> #VALUE! | AD65: =IF(RC[21]=42,"*",IF(RC[21]=32,"",RC[21])) ->  | AE65: =RC[-28] ->  | AF65: =RC[-28] ->  | AG65: =RC[-28] ->  | AH65: =RC[-28] ->  | AI65: =RC[-28] ->  | AJ65: =RC[-28] ->  | AK65: =RC[-28] ->  | AL65: =RC[-28] -> 0 | AM65: =RC[-28] ->  | AN65: =RC[-28] -> 0 | AO65: =RC[-28] -> 0 | AQ65: =RC[-29] -> 0 | AR65: =RC[-29] -> 0 | AT65: =RC[-30] -> 0 | AU65: =RC[-30] -> 0 | AV65: =RC[-30] -> 0 | AW65: =RC[-30] -> 
A66: =IF(RC[1]="","",DATEVALUE(RC[1])) ->  | T66: =(RC[1]*RC[-15]-RC[2]*RC[-12])/1000 -> #VALUE! | W66: =RC[-2]*RC[-10]/1000 -> #VALUE! | X66: =ABS((RC[-3]*RC[-11]-RC[-2]*RC[-9])/1000) -> #VALUE! | AC66: =VALUE(RC[-27]) -> #VALUE! | AD66: =IF(RC[21]=42,"*",IF(RC[21]=32,"",RC[21])) ->  | AE66: =RC[-28] ->  | AF66: =RC[-28] ->  | AG66: =RC[-28] ->  | AH66: =RC[-28] ->  | AI66: =RC[-28] ->  | AJ66: =RC[-28] ->  | AK66: =RC[-28] ->  | AL66: =RC[-28] -> 0 | AM66: =RC[-28] ->  | AN66: =RC[-28] -> 0 | AO66: =RC[-28] -> 0 | AQ66: =RC[-29] -> 0 | AR66: =RC[-29] -> 0 | AT66: =RC[-30] -> 0 | AU66: =RC[-30] -> 0 | AV66: =RC[-30] -> 0 | AW66: =RC[-30] -> 
A67: =IF(RC[1]="","",DATEVALUE(RC[1])) ->  | T67: =(RC[1]*RC[-15]-RC[2]*RC[-12])/1000 -> #VALUE! | W67: =RC[-2]*RC[-10]/1000 -> #VALUE! | X67: =ABS((RC[-3]*RC[-11]-RC[-2]*RC[-9])/1000) -> #VALUE! | AC67: =VALUE(RC[-27]) -> #VALUE! | AD67: =IF(RC[21]=42,"*",IF(RC[21]=32,"",RC[21])) ->  | AE67: =RC[-28] ->  | AF67: =RC[-28] ->  | AG67: =RC[-28] ->  | AH67: =RC[-28] ->  | AI67: =RC[-28] ->  | AJ67: =RC[-28] ->  | AK67: =RC[-28] ->  | AL67: =RC[-28] -> 0 | AM67: =RC[-28] ->  | AN67: =RC[-28] -> 0 | AO67: =RC[-28] -> 0 | AQ67: =RC[-29] -> 0 | AR67: =RC[-29] -> 0 | AT67: =RC[-30] -> 0 | AU67: =RC[-30] -> 0 | AV67: =RC[-30] -> 0 | AW67: =RC[-30] -> 
A68: =IF(RC[1]="","",DATEVALUE(RC[1])) ->  | T68: =(RC[1]*RC[-15]-RC[2]*RC[-12])/1000 -> #VALUE! | W68: =RC[-2]*RC[-10]/1000 -> #VALUE! | X68: =ABS((RC[-3]*RC[-11]-RC[-2]*RC[-9])/1000) -> #VALUE! | AC68: =VALUE(RC[-27]) -> #VALUE! | AD68: =IF(RC[21]=42,"*",IF(RC[21]=32,"",RC[21])) ->  | AE68: =RC[-28] ->  | AF68: =RC[-28] ->  | AG68: =RC[-28] ->  | AH68: =RC[-28] ->  | AI68: =RC[-28] ->  | AJ68: =RC[-28] ->  | AK68: =RC[-28] ->  | AL68: =RC[-28] -> 0 | AM68: =RC[-28] ->  | AN68: =RC[-28] -> 0 | AO68: =RC[-28] -> 0 | AQ68: =RC[-29] -> 0 | AR68: =RC[-29] -> 0 | AT68: =RC[-30] -> 0 | AU68: =RC[-30] -> 0 | AV68: =RC[-30] -> 0 | AW68: =RC[-30] -> 
A69: =IF(RC[1]="","",DATEVALUE(RC[1])) ->  | T69: =(RC[1]*RC[-15]-RC[2]*RC[-12])/1000 -> #VALUE! | W69: =RC[-2]*RC[-10]/1000 -> #VALUE! | X69: =ABS((RC[-3]*RC[-11]-RC[-2]*RC[-9])/1000) -> #VALUE! | AC69: =VALUE(RC[-27]) -> #VALUE! | AD69: =IF(RC[21]=42,"*",IF(RC[21]=32,"",RC[21])) ->  | AE69: =RC[-28] ->  | AF69: =RC[-28] ->  | AG69: =RC[-28] ->  | AH69: =RC[-28] ->  | AI69: =RC[-28] ->  | AJ69: =RC[-28] ->  | AK69: =RC[-28] ->  | AL69: =RC[-28] -> 0 | AM69: =RC[-28] ->  | AN69: =RC[-28] -> 0 | AO69: =RC[-28] -> 0 | AQ69: =RC[-29] -> 0 | AR69: =RC[-29] -> 0 | AT69: =RC[-30] -> 0 | AU69: =RC[-30] -> 0 | AV69: =RC[-30] -> 0 | AW69: =RC[-30] -> 
A70: =IF(RC[1]="","",DATEVALUE(RC[1])) ->  | T70: =(RC[1]*RC[-15]-RC[2]*RC[-12])/1000 -> #VALUE! | W70: =RC[-2]*RC[-10]/1000 -> #VALUE! | X70: =ABS((RC[-3]*RC[-11]-RC[-2]*RC[-9])/1000) -> #VALUE! | AC70: =VALUE(RC[-27]) -> #VALUE! | AD70: =IF(RC[21]=42,"*",IF(RC[21]=32,"",RC[21])) ->  | AE70: =RC[-28] ->  | AF70: =RC[-28] ->  | AG70: =RC[-28] ->  | AH70: =RC[-28] ->  | AI70: =RC[-28] ->  | AJ70: =RC[-28] ->  | AK70: =RC[-28] ->  | AL70: =RC[-28] -> 0 | AM70: =RC[-28] ->  | AN70: =RC[-28] -> 0 | AO70: =RC[-28] -> 0 | AQ70: =RC[-29] -> 0 | AR70: =RC[-29] -> 0 | AT70: =RC[-30] -> 0 | AU70: =RC[-30] -> 0 | AV70: =RC[-30] -> 0 | AW70: =RC[-30] -> 
A71: =IF(RC[1]="","",DATEVALUE(RC[1])) ->  | T71: =(RC[1]*RC[-15]-RC[2]*RC[-12])/1000 -> #VALUE! | W71: =RC[-2]*RC[-10]/1000 -> #VALUE! | X71: =ABS((RC[-3]*RC[-11]-RC[-2]*RC[-9])/1000) -> #VALUE! | AC71: =VALUE(RC[-27]) -> #VALUE! | AD71: =IF(RC[21]=42,"*",IF(RC[21]=32,"",RC[21])) ->  | AE71: =RC[-28] ->  | AF71: =RC[-28] ->  | AG71: =RC[-28] ->  | AH71: =RC[-28] ->  | AI71: =RC[-28] ->  | AJ71: =RC[-28] ->  | AK71: =RC[-28] ->  | AL71: =RC[-28] -> 0 | AM71: =RC[-28] ->  | AN71: =RC[-28] -> 0 | AO71: =RC[-28] -> 0 | AQ71: =RC[-29] -> 0 | AR71: =RC[-29] -> 0 | AT71: =RC[-30] -> 0 | AU71: =RC[-30] -> 0 | AV71: =RC[-30] -> 0 | AW71: =RC[-30] -> 
A72: =IF(RC[1]="","",DATEVALUE(RC[1])) ->  | T72: =(RC[1]*RC[-15]-RC[2]*RC[-12])/1000 -> #VALUE! | W72: =RC[-2]*RC[-10]/1000 -> #VALUE! | X72: =ABS((RC[-3]*RC[-11]-RC[-2]*RC[-9])/1000) -> #VALUE! | AC72: =VALUE(RC[-27]) -> #VALUE! | AD72: =IF(RC[21]=42,"*",IF(RC[21]=32,"",RC[21])) ->  | AE72: =RC[-28] ->  | AF72: =RC[-28] ->  | AG72: =RC[-28] ->  | AH72: =RC[-28] ->  | AI72: =RC[-28] ->  | AJ72: =RC[-28] ->  | AK72: =RC[-28] ->  | AL72: =RC[-28] -> 0 | AM72: =RC[-28] ->  | AN72: =RC[-28] -> 0 | AO72: =RC[-28] -> 0 | AQ72: =RC[-29] -> 0 | AR72: =RC[-29] -> 0 | AT72: =RC[-30] -> 0 | AU72: =RC[-30] -> 0 | AV72: =RC[-30] -> 0 | AW72: =RC[-30] -> 
A73: =IF(RC[1]="","",DATEVALUE(RC[1])) ->  | T73: =(RC[1]*RC[-15]-RC[2]*RC[-12])/1000 -> #VALUE! | W73: =RC[-2]*RC[-10]/1000 -> #VALUE! | X73: =ABS((RC[-3]*RC[-11]-RC[-2]*RC[-9])/1000) -> #VALUE! | AC73: =VALUE(RC[-27]) -> #VALUE! | AD73: =IF(RC[21]=42,"*",IF(RC[21]=32,"",RC[21])) ->  | AE73: =RC[-28] ->  | AF73: =RC[-28] ->  | AG73: =RC[-28] ->  | AH73: =RC[-28] ->  | AI73: =RC[-28] ->  | AJ73: =RC[-28] ->  | AK73: =RC[-28] ->  | AL73: =RC[-28] -> 0 | AM73: =RC[-28] ->  | AN73: =RC[-28] -> 0 | AO73: =RC[-28] -> 0 | AQ73: =RC[-29] -> 0 | AR73: =RC[-29] -> 0 | AT73: =RC[-30] -> 0 | AU73: =RC[-30] -> 0 | AV73: =RC[-30] -> 0 | AW73: =RC[-30] -> 
A74: =IF(RC[1]="","",DATEVALUE(RC[1])) ->  | T74: =(RC[1]*RC[-15]-RC[2]*RC[-12])/1000 -> #VALUE! | W74: =RC[-2]*RC[-10]/1000 -> #VALUE! | X74: =ABS((RC[-3]*RC[-11]-RC[-2]*RC[-9])/1000) -> #VALUE! | AC74: =VALUE(RC[-27]) -> #VALUE! | AD74: =IF(RC[21]=42,"*",IF(RC[21]=32,"",RC[21])) ->  | AE74: =RC[-28] ->  | AF74: =RC[-28] ->  | AG74: =RC[-28] ->  | AH74: =RC[-28] ->  | AI74: =RC[-28] ->  | AJ74: =RC[-28] ->  | AK74: =RC[-28] ->  | AL74: =RC[-28] -> 0 | AM74: =RC[-28] ->  | AN74: =RC[-28] -> 0 | AO74: =RC[-28] -> 0 | AQ74: =RC[-29] -> 0 | AR74: =RC[-29] -> 0 | AT74: =RC[-30] -> 0 | AU74: =RC[-30] -> 0 | AV74: =RC[-30] -> 0 | AW74: =RC[-30] -> 
A75: =IF(RC[1]="","",DATEVALUE(RC[1])) ->  | T75: =(RC[1]*RC[-15]-RC[2]*RC[-12])/1000 -> #VALUE! | W75: =RC[-2]*RC[-10]/1000 -> #VALUE! | X75: =ABS((RC[-3]*RC[-11]-RC[-2]*RC[-9])/1000) -> #VALUE! | AC75: =VALUE(RC[-27]) -> #VALUE! | AD75: =IF(RC[21]=42,"*",IF(RC[21]=32,"",RC[21])) ->  | AE75: =RC[-28] ->  | AF75: =RC[-28] ->  | AG75: =RC[-28] ->  | AH75: =RC[-28] ->  | AI75: =RC[-28] ->  | AJ75: =RC[-28] ->  | AK75: =RC[-28] ->  | AL75: =RC[-28] -> 0 | AM75: =RC[-28] ->  | AN75: =RC[-28] -> 0 | AO75: =RC[-28] -> 0 | AQ75: =RC[-29] -> 0 | AR75: =RC[-29] -> 0 | AT75: =RC[-30] -> 0 | AU75: =RC[-30] -> 0 | AV75: =RC[-30] -> 0 | AW75: =RC[-30] -> 
A76: =IF(RC[1]="","",DATEVALUE(RC[1])) ->  | T76: =(RC[1]*RC[-15]-RC[2]*RC[-12])/1000 -> #VALUE! | W76: =RC[-2]*RC[-10]/1000 -> #VALUE! | X76: =ABS((RC[-3]*RC[-11]-RC[-2]*RC[-9])/1000) -> #VALUE! | AC76: =VALUE(RC[-27]) -> #VALUE! | AD76: =IF(RC[21]=42,"*",IF(RC[21]=32,"",RC[21])) ->  | AE76: =RC[-28] ->  | AF76: =RC[-28] ->  | AG76: =RC[-28] ->  | AH76: =RC[-28] ->  | AI76: =RC[-28] ->  | AJ76: =RC[-28] ->  | AK76: =RC[-28] ->  | AL76: =RC[-28] -> 0 | AM76: =RC[-28] ->  | AN76: =RC[-28] -> 0 | AO76: =RC[-28] -> 0 | AQ76: =RC[-29] -> 0 | AR76: =RC[-29] -> 0 | AT76: =RC[-30] -> 0 | AU76: =RC[-30] -> 0 | AV76: =RC[-30] -> 0 | AW76: =RC[-30] -> 
A77: =IF(RC[1]="","",DATEVALUE(RC[1])) ->  | T77: =(RC[1]*RC[-15]-RC[2]*RC[-12])/1000 -> #VALUE! | W77: =RC[-2]*RC[-10]/1000 -> #VALUE! | X77: =ABS((RC[-3]*RC[-11]-RC[-2]*RC[-9])/1000) -> #VALUE! | AC77: =VALUE(RC[-27]) -> #VALUE! | AD77: =IF(RC[21]=42,"*",IF(RC[21]=32,"",RC[21])) ->  | AE77: =RC[-28] ->  | AF77: =RC[-28] ->  | AG77: =RC[-28] ->  | AH77: =RC[-28] ->  | AI77: =RC[-28] ->  | AJ77: =RC[-28] ->  | AK77: =RC[-28] ->  | AL77: =RC[-28] -> 0 | AM77: =RC[-28] ->  | AN77: =RC[-28] -> 0 | AO77: =RC[-28] -> 0 | AQ77: =RC[-29] -> 0 | AR77: =RC[-29] -> 0 | AT77: =RC[-30] -> 0 | AU77: =RC[-30] -> 0 | AV77: =RC[-30] -> 0 | AW77: =RC[-30] -> 
A78: =IF(RC[1]="","",DATEVALUE(RC[1])) ->  | T78: =(RC[1]*RC[-15]-RC[2]*RC[-12])/1000 -> #VALUE! | W78: =RC[-2]*RC[-10]/1000 -> #VALUE! | X78: =ABS((RC[-3]*RC[-11]-RC[-2]*RC[-9])/1000) -> #VALUE! | AC78: =VALUE(RC[-27]) -> #VALUE! | AD78: =IF(RC[21]=42,"*",IF(RC[21]=32,"",RC[21])) ->  | AE78: =RC[-28] ->  | AF78: =RC[-28] ->  | AG78: =RC[-28] ->  | AH78: =RC[-28] ->  | AI78: =RC[-28] ->  | AJ78: =RC[-28] ->  | AK78: =RC[-28] ->  | AL78: =RC[-28] -> 0 | AM78: =RC[-28] ->  | AN78: =RC[-28] -> 0 | AO78: =RC[-28] -> 0 | AQ78: =RC[-29] -> 0 | AR78: =RC[-29] -> 0 | AT78: =RC[-30] -> 0 | AU78: =RC[-30] -> 0 | AV78: =RC[-30] -> 0 | AW78: =RC[-30] -> 
A79: =IF(RC[1]="","",DATEVALUE(RC[1])) ->  | T79: =(RC[1]*RC[-15]-RC[2]*RC[-12])/1000 -> #VALUE! | W79: =RC[-2]*RC[-10]/1000 -> #VALUE! | X79: =ABS((RC[-3]*RC[-11]-RC[-2]*RC[-9])/1000) -> #VALUE! | AC79: =VALUE(RC[-27]) -> #VALUE! | AD79: =IF(RC[21]=42,"*",IF(RC[21]=32,"",RC[21])) ->  | AE79: =RC[-28] ->  | AF79: =RC[-28] ->  | AG79: =RC[-28] ->  | AH79: =RC[-28] ->  | AI79: =RC[-28] ->  | AJ79: =RC[-28] ->  | AK79: =RC[-28] ->  | AL79: =RC[-28] -> 0 | AM79: =RC[-28] ->  | AN79: =RC[-28] -> 0 | AO79: =RC[-28] -> 0 | AQ79: =RC[-29] -> 0 | AR79: =RC[-29] -> 0 | AT79: =RC[-30] -> 0 | AU79: =RC[-30] -> 0 | AV79: =RC[-30] -> 0 | AW79: =RC[-30] -> 
A80: =IF(RC[1]="","",DATEVALUE(RC[1])) ->  | T80: =(RC[1]*RC[-15]-RC[2]*RC[-12])/1000 -> #VALUE! | W80: =RC[-2]*RC[-10]/1000 -> #VALUE! | X80: =ABS((RC[-3]*RC[-11]-RC[-2]*RC[-9])/1000) -> #VALUE! | AC80: =VALUE(RC[-27]) -> #VALUE! | AD80: =IF(RC[21]=42,"*",IF(RC[21]=32,"",RC[21])) ->  | AE80: =RC[-28] ->  | AF80: =RC[-28] ->  | AG80: =RC[-28] ->  | AH80: =RC[-28] ->  | AI80: =RC[-28] ->  | AJ80: =RC[-28] ->  | AK80: =RC[-28] ->  | AL80: =RC[-28] -> 0 | AM80: =RC[-28] ->  | AN80: =RC[-28] -> 0 | AO80: =RC[-28] -> 0 | AQ80: =RC[-29] -> 0 | AR80: =RC[-29] -> 0 | AT80: =RC[-30] -> 0 | AU80: =RC[-30] -> 0 | AV80: =RC[-30] -> 0 | AW80: =RC[-30] -> 
A81: =IF(RC[1]="","",DATEVALUE(RC[1])) ->  | T81: =(RC[1]*RC[-15]-RC[2]*RC[-12])/1000 -> #VALUE! | W81: =RC[-2]*RC[-10]/1000 -> #VALUE! | X81: =ABS((RC[-3]*RC[-11]-RC[-2]*RC[-9])/1000) -> #VALUE! | AC81: =VALUE(RC[-27]) -> #VALUE! | AD81: =IF(RC[21]=42,"*",IF(RC[21]=32,"",RC[21])) ->  | AE81: =RC[-28] ->  | AF81: =RC[-28] ->  | AG81: =RC[-28] ->  | AH81: =RC[-28] ->  | AI81: =RC[-28] ->  | AJ81: =RC[-28] ->  | AK81: =RC[-28] ->  | AL81: =RC[-28] -> 0 | AM81: =RC[-28] ->  | AN81: =RC[-28] -> 0 | AO81: =RC[-28] -> 0 | AQ81: =RC[-29] -> 0 | AR81: =RC[-29] -> 0 | AT81: =RC[-30] -> 0 | AU81: =RC[-30] -> 0 | AV81: =RC[-30] -> 0 | AW81: =RC[-30] -> 
A82: =IF(RC[1]="","",DATEVALUE(RC[1])) ->  | T82: =(RC[1]*RC[-15]-RC[2]*RC[-12])/1000 -> #VALUE! | W82: =RC[-2]*RC[-10]/1000 -> #VALUE! | X82: =ABS((RC[-3]*RC[-11]-RC[-2]*RC[-9])/1000) -> #VALUE! | AC82: =VALUE(RC[-27]) -> #VALUE! | AD82: =IF(RC[21]=42,"*",IF(RC[21]=32,"",RC[21])) ->  | AE82: =RC[-28] ->  | AF82: =RC[-28] ->  | AG82: =RC[-28] ->  | AH82: =RC[-28] ->  | AI82: =RC[-28] ->  | AJ82: =RC[-28] ->  | AK82: =RC[-28] ->  | AL82: =RC[-28] -> 0 | AM82: =RC[-28] ->  | AN82: =RC[-28] -> 0 | AO82: =RC[-28] -> 0 | AQ82: =RC[-29] -> 0 | AR82: =RC[-29] -> 0 | AT82: =RC[-30] -> 0 | AU82: =RC[-30] -> 0 | AV82: =RC[-30] -> 0 | AW82: =RC[-30] -> 
A83: =IF(RC[1]="","",DATEVALUE(RC[1])) ->  | T83: =(RC[1]*RC[-15]-RC[2]*RC[-12])/1000 -> #VALUE! | W83: =RC[-2]*RC[-10]/1000 -> #VALUE! | X83: =ABS((RC[-3]*RC[-11]-RC[-2]*RC[-9])/1000) -> #VALUE! | AC83: =VALUE(RC[-27]) -> #VALUE! | AD83: =IF(RC[21]=42,"*",IF(RC[21]=32,"",RC[21])) ->  | AE83: =RC[-28] ->  | AF83: =RC[-28] ->  | AG83: =RC[-28] ->  | AH83: =RC[-28] ->  | AI83: =RC[-28] ->  | AJ83: =RC[-28] ->  | AK83: =RC[-28] ->  | AL83: =RC[-28] -> 0 | AM83: =RC[-28] ->  | AN83: =RC[-28] -> 0 | AO83: =RC[-28] -> 0 | AQ83: =RC[-29] -> 0 | AR83: =RC[-29] -> 0 | AT83: =RC[-30] -> 0 | AU83: =RC[-30] -> 0 | AV83: =RC[-30] -> 0 | AW83: =RC[-30] -> 
AC84: Среднее | AF84: =R[1]C[-28] -> 72.47966666666666 | AG84: =R[1]C[-28] -> 65.801333333333318 | AH84: =R[1]C[-28] -> 7 | AI84: =R[1]C[-28] -> 51.27466666666664 | AJ84: =R[1]C[-28] -> 55.189 | AK84: =R[1]C[-28] -> 6 | AL84: =R[1]C[-28] -> 10.612333333333334 | AM84: =R[1]C[-28] -> 21.204999999999998 | AN84: =R[1]C[-28] ->  | AO84: =R[1]C[-28] ->  | AP84: =AVERAGE(OFFSET(R[-73]C[-1],10,0,R7C1,1)) -> 0 | AQ84: =R[1]C[-29] ->  | AR84: =R[1]C[-29] ->  | AS84: =AVERAGE(OFFSET(R[-73]C,10,0,R7C1,1)) -> 6 | AT84: =R[1]C[-30] ->  | AU84: =R[1]C[-30] -> 
B85: Среднее | D85: =AVERAGE(OFFSET(R[-74]C,3,0,R7C1,1)) -> 72.47966666666666 | E85: =AVERAGE(OFFSET(R[-74]C,3,0,R7C1,1)) -> 65.801333333333318 | F85: =AVERAGE(OFFSET(R[-74]C,3,0,R7C1,1)) -> 7 | G85: =AVERAGE(OFFSET(R[-74]C,3,0,R7C1,1)) -> 51.27466666666664 | H85: =AVERAGE(OFFSET(R[-74]C,3,0,R7C1,1)) -> 55.189 | I85: =AVERAGE(OFFSET(R[-74]C,3,0,R7C1,1)) -> 6 | J85: =AVERAGE(OFFSET(R[-74]C,3,0,R7C1,1)) -> 10.612333333333334 | K85: =AVERAGE(OFFSET(R[-74]C,3,0,R7C1,1)) -> 21.204999999999998 | L85: =IF(SUM(OFFSET(R[-74]C,3,0,R7C1,1))=0,"",AVERAGE(OFFSET(R[-74]C,3,0,R7C1,1))) ->  | M85: =IF(SUM(OFFSET(R[-74]C,3,0,R7C1,1))=0,"",AVERAGE(OFFSET(R[-74]C,3,0,R7C1,1))) ->  | N85: =IF(SUM(OFFSET(R[-74]C,3,0,R7C1,1))=0,"",AVERAGE(OFFSET(R[-74]C,3,0,R7C1,1))) ->  | O85: =IF(SUM(OFFSET(R[-74]C,3,0,R7C1,1))=0,"",AVERAGE(OFFSET(R[-74]C,3,0,R7C1,1))) ->  | P85: =IF(SUM(OFFSET(R[-74]C,3,0,R7C1,1))=0,"",AVERAGE(OFFSET(R[-74]C,3,0,R7C1,1))) ->  | Q85: =IF(SUM(OFFSET(R[-74]C,3,0,R7C1,1))=0,"",AVERAGE(OFFSET(R[-74]C,3,0,R7C1,1))) ->  | R85: =IF(SUM(OFFSET(R[-74]C,3,0,R7C1,1))=0,"",AVERAGE(OFFSET(R[-74]C,3,0,R7C1,1))) ->  | S85: =AVERAGE(OFFSET(R[-74]C,3,0,R7C1,1)) -> 1.8856666666666666 | T85: =AVERAGE(OFFSET(R[-74]C,3,0,R7C1,1)) -> 1.9391738266666667 | W85: =AVERAGE(OFFSET(R[-74]C,3,0,R7C1,1)) -> 0 | X85: =AVERAGE(OFFSET(R[-74]C,3,0,R7C1,1)) -> 0 | AC85: Итого | AE85: =R[1]C[-28] -> 720 | AF85: =R[1]C[-28] -> 2174.39 | AI85: =R[1]C[-28] -> 1538.2399999999991 | AM85: =R[1]C[-28] -> 636.15 | AN85: =R[1]C[-28] ->  | AQ85: =R[1]C[-29] ->  | AU85: =R[1]C[-30] ->  | AV85: =R[1]C[-30] ->  | AW85: =R[1]C[-30] -> 56.57
B86: ИТОГО: | C86: =SUM(OFFSET(R[-75]C,3,0,R7C1,1)) -> 720 | D86: =SUM(OFFSET(R[-75]C,3,0,R7C1,1)) -> 2174.39 | G86: =SUM(OFFSET(R[-75]C,3,0,R7C1,1)) -> 1538.2399999999991 | K86: =SUM(OFFSET(R[-75]C,3,0,R7C1,1)) -> 636.15 | L86: =IF(SUM(OFFSET(R[-75]C,3,0,R7C1,1))=0,"",SUM(OFFSET(R[-75]C,3,0,R7C1,1))) ->  | N86: =IF(SUM(OFFSET(R[-75]C,3,0,R7C1,1))=0,"",SUM(OFFSET(R[-75]C,3,0,R7C1,1))) ->  | Q86: =IF(SUM(OFFSET(R[-75]C,3,0,R7C1,1))=0,"",SUM(OFFSET(R[-75]C,3,0,R7C1,1))) ->  | R86: =IF(SUM(OFFSET(R[-75]C,3,0,R7C1,1))=0,"",SUM(OFFSET(R[-75]C,3,0,R7C1,1))) ->  | S86: =SUM(OFFSET(R[-75]C,3,0,R7C1,1)) -> 56.57 | T86: =SUM(OFFSET(R[-75]C,3,0,R7C1,1)) -> 58.175214799999999 | W86: =SUM(OFFSET(R[-75]C,3,0,R7C1,1)) -> 0 | X86: =SUM(OFFSET(R[-75]C,3,0,R7C1,1)) -> 0
AC87: Досчёт | AF87: =R[1]C[-28] -> 0 | AI87: =R[1]C[-28] -> 0 | AM87: =R[1]C[-28] -> 0 | AN87: =R[1]C[-28] -> 0 | AQ87: =R[1]C[-29] -> 0 | AU87: =R[1]C[-30] -> 0 | AV87: =R[1]C[-30] -> 0 | AW87: =R[1]C[-30] -> 0
A88: 11дн=264ч 4дн=96ч | B88: Досчёт до конца м-ца (+) | C88: =R6C1*24 -> 216 | AC88: Снятие | AF88: =-R[1]C[-28] -> 0 | AI88: =-R[1]C[-28] -> 0 | AM88: =-R[1]C[-28] -> 0 | AN88: =-R[1]C[-28] -> 0 | AQ88: =-R[1]C[-29] -> 0 | AU88: =-R[1]C[-30] -> 0 | AV88: =-R[1]C[-30] -> 0 | AW88: =-R[1]C[-30] -> 0
A89: 9дн=216ч 7дн=168ч | B89: Вычет с предыдущего (-) | C89: =R4C1*24 -> 192 | AC89: Сумма | AF89: =R[1]C[-28] -> 2174.39 | AI89: =R[1]C[-28] -> 1538.2399999999991 | AM89: =R[1]C[-28] -> 636.15 | AN89: =R[1]C[-28] ->  | AQ89: =R[1]C[-29] ->  | AU89: =R[1]C[-30] ->  | AV89: =R[1]C[-30] ->  | AW89: =R[1]C[-30] -> 56.57
B90: СУММА: | C90: =R[-4]C+R[-2]C-R[-1]C -> 744 | D90: =R[-4]C+R[-2]C-R[-1]C -> 2174.39 | G90: =R[-4]C+R[-2]C-R[-1]C -> 1538.2399999999991 | K90: =R[-4]C+R[-2]C-R[-1]C -> 636.15 | L90: =IF(SUM(OFFSET(R[-79]C,3,0,R7C1,1))=0,"",(R[-4]C+R[-2]C-R[-1]C)) ->  | N90: =IF(SUM(OFFSET(R[-79]C,3,0,R7C1,1))=0,"",(R[-4]C+R[-2]C-R[-1]C)) ->  | Q90: =IF(SUM(OFFSET(R[-79]C,3,0,R7C1,1))=0,"",(R[-4]C+R[-2]C-R[-1]C)) ->  | R90: =IF(SUM(OFFSET(R[-79]C,3,0,R7C1,1))=0,"",(R[-4]C+R[-2]C-R[-1]C)) ->  | S90: =R[-4]C+R[-2]C-R[-1]C -> 56.57
AC91: Тхв на источнике = | AE91: V гвс (м3) = | AF91: =R[-2]C[7] -> 636.15 | AG91: Wотоп (Гкал) = | AH91: 0 | AI91: Гкал с учетом холодной воды = | AJ91: =RC[-4]*0.06 -> 38.168999999999997
B92: Показания счетчиков на момент снятия данных:
B93: Дата, время | D93: М1, т | F93: М2, т | H93: М3, т | J93: М4, т | L93: Qо, Гкал | N93: Qг, Гкал | P93: время, час
B94: 24.09.18 02:00 | D94: 129235.7 | F94: 79805.42 | H94: 126747.16 | J94: 78619.5 | L94: 3805.395 | N94: - | P94: -
B95: 18.10.18 03:00 | D95: 130968.8 | F95: 81032.990000000005 | H95: 128446.6 | J95: 79829.72 | L95: 3850.18 | N95: - | P95: -
AC97: =ZAYAVKA_N -> з.н д. №02/147-2783 от 04.10.18
B98: Представитель потребителя:_______________________________________________________________________ В.О. Топорков
I101: Рекомендуемые значения по параметрам теплопотребления (не являются официально утверждёнными)
I102: М, т | J102: V, м3 | K102: Qгвс, Гкал | L102: Qотоп, Гкал | M102: Qо, Гкал
I103: =R[-13]C[-3] -> 0 | J103: =RC[-1]/0.98 -> 0 | K103: =RC[-1]*0.06 -> 0 | L103: =RC[1]-RC[-1] -> #VALUE! | M103: =R[-13]C[5] -> 
O105: ДЛЯ САМОКОНТРОЛЯ
B106: В строке выбора дат указать период с 16.7.13 по 23.8.13 - жильё | N106: Q | O106: Qг
B107: В строке выбора дат указать период с 18.7.13 по 25.8.13 - не жилое | N107: =(R[-21]C[-10]*R[-22]C[-7]-R[-21]C[-9]*R[-22]C[-6])/1000 -> 111.49112245333328 | O107: =IF(R[-22]C[-2]="",R[-21]C[-3]*R[-22]C/1000,"") -> #VALUE! | P107: Си2
O108: =IF(R[-23]C[-2]="","",((R[-22]C[-3]*R[-23]C)-(R[-22]C[-2]*R[-23]C[2]))/1000) ->  | P108: Си3