Sheet: Лист1
G1: Отчёт о теплопотреблении за октябрь 2018 | M1: письмо с 09.10.18г по 18.10.18г некорректная работа приборов
A4: =EOMONTH(R[9]C,0)-R[9]C -> 8 | B4: Потребитель: ЗАО "Сити Сервис"
A5: =MAX(R[9]C:R[78]C) -> 2018-10-22T00:00:00.000 | B5: Адрес: г. СПб, Кораблестроителей ул., д.35 к.1 ИТП 7
A6: =EOMONTH(R[-1]C,0)-R[-1]C -> 9 | B6: Телефон: 8-911-021-19-79
A7: =R[-2]C-R[6]C -> 30 | B7: Договор 10023-2
A8: 7 | B8: Тепловычислитель: ВТД № B11D | L8: М2 мах= | M8: 0 | O8: Мгвс мах= | P8: 0
L9: Qотоп мах= | M9: 0 | O9: Qгвс мах= | P9: 0
B10: Расчётная формула:
D12: Учет | L12: Контроль
A13: =R[1]C[1]-1 -> 2018-09-22T00:00:00.000 | B13: Дата | C13: N, ч | D13: M1, т | E13: T1, С | F13: P1, кг/см2 | G13: M2, т | H13: T2, С | I13: P2, кг/см2 | J13: dT, С | K13: M1-М2, т | L13: V3, м3 | M13: T3, С | N13: V4, м3 | O13: =IF(R[-12]C[-14]="м.куб","","T4, С") -> T4, С | P13: dT, С | Q13: V3-V4, м3 | R13: Qгвс, Гкал | S13: Qобщ., Гкал | T13: Q | U13: M3 | V13: M4 | W13: си2 | X13: си3 | Y13: Разб. | Z13: dM2 | AC13: Дата | AD13: НС | AE13: n, ч | AF13: М1, т | AG13: t1, гр. С | AH13: Р1, кгс/см2 | AI13: М2, т | AJ13: t2, гр. С | AK13: Р2, кгс/см2 | AL13: t1-t2, гр. С | AM13: М1-М2, т | AN13: М1гвс, т | AO13: t1гвс, гр. С | AP13: Р1гвс, кгс/см2 | AQ13: М2гвс, т | AR13: t2гвс, гр. С | AS13: Р2гвс, кгс/см2 | AT13: t1гвс-t2гвс | AU13: М1гвс-М2гвс, т | AV13: Wгвс, Гкал | AW13: Wсумм, Гкал | AY13: NS_TV1 | AZ13: НС | BA13: NS_TV2
A14: =IF(RC[1]="","",DATEVALUE(RC[1])) -> 43366 | B14: 23.09.18 | C14: 24 | D14: 427.57600000000002 | E14: 70 | F14: 7.01 | G14: 401.66 | H14: 70.900000000000006 | I14: 4.3099999999999996 | J14: =RC[-5]-RC[-2] -> -0.90000000000000568 | K14: =RC[-7]-RC[-4] -> 25.915999999999997 | L14: 26.084 | M14: 68.8 | R14: 1.776 | S14: =RC[-1] -> 1.776 | T14: =(RC[-16]*RC[-15]-RC[-13]*RC[-12])/1000 -> 1.4526259999999966 | U14: 25.521999999999998 | W14: =RC[-2]*RC[-10]/1000 -> 1.7559136 | X14: =ABS((RC[-3]*RC[-11]-RC[-2]*RC[-9])/1000) -> #VALUE! | Y14: =(RC[-14]-RC[1])/RC[-18]*100 -> 9.8092914405217918E-2 | Z14: 25.521999999999998 | AC14: =VALUE(RC[-27]) -> 2018-09-23T00:00:00.000 | AD14: =IF(RC[21]=42,"*",IF(RC[21]=32,"",RC[21])) ->  | AE14: =RC[-28] -> 24 | AF14: =RC[-28] -> 427.57600000000002 | AG14: =RC[-28] -> 70 | AH14: =RC[-28] -> 7.01 | AI14: =RC[-28] -> 401.66 | AJ14: =RC[-28] -> 70.900000000000006 | AK14: =RC[-28] -> 4.3099999999999996 | AL14: =RC[-28] -> -0.90000000000000568 | AM14: =RC[-28] -> 25.915999999999997 | AN14: =RC[-28] -> 26.084 | AO14: =RC[-28] -> 68.8 | AP14: - | AQ14: =RC[-29] ->  | AR14: =RC[-29] ->  | AS14: - | AT14: =RC[-30] -> 0 | AU14: =RC[-30] ->  | AV14: =RC[-30] -> 1.776 | AW14: =RC[-30] -> 1.776
A15: =IF(RC[1]="","",DATEVALUE(RC[1])) -> 43367 | B15: 24.09.18 | C15: 24 | D15: 406.51100000000002 | E15: 69.099999999999994 | F15: 7.1199999999999992 | G15: 379.452 | H15: 69.900000000000006 | I15: 4.6899999999999995 | J15: =RC[-5]-RC[-2] -> -0.80000000000001137 | K15: =RC[-7]-RC[-4] -> 27.059000000000026 | L15: 27.437000000000001 | M15: 68.2 | R15: 1.8480000000000001 | S15: =RC[-1] -> 1.8480000000000001 | T15: =(RC[-16]*RC[-15]-RC[-13]*RC[-12])/1000 -> 1.5662152999999999 | U15: 26.859000000000002 | W15: =RC[-2]*RC[-10]/1000 -> 1.8317838000000002 | X15: =ABS((RC[-3]*RC[-11]-RC[-2]*RC[-9])/1000) -> #VALUE! | Y15: =(RC[-14]-RC[1])/RC[-18]*100 -> 5.2707588838647353E-2 | Z15: 26.859000000000002 | AC15: =VALUE(RC[-27]) -> 2018-09-24T00:00:00.000 | AD15: =IF(RC[21]=42,"*",IF(RC[21]=32,"",RC[21])) ->  | AE15: =RC[-28] -> 24 | AF15: =RC[-28] -> 406.51100000000002 | AG15: =RC[-28] -> 69.099999999999994 | AH15: =RC[-28] -> 7.1199999999999992 | AI15: =RC[-28] -> 379.452 | AJ15: =RC[-28] -> 69.900000000000006 | AK15: =RC[-28] -> 4.6899999999999995 | AL15: =RC[-28] -> -0.80000000000001137 | AM15: =RC[-28] -> 27.059000000000026 | AN15: =RC[-28] -> 27.437000000000001 | AO15: =RC[-28] -> 68.2 | AP15: - | AQ15: =RC[-29] ->  | AR15: =RC[-29] ->  | AS15: - | AT15: =RC[-30] -> 0 | AU15: =RC[-30] ->  | AV15: =RC[-30] -> 1.8480000000000001 | AW15: =RC[-30] -> 1.8480000000000001
A16: =IF(RC[1]="","",DATEVALUE(RC[1])) -> 43368 | B16: 25.09.18 | C16: 24 | D16: 364.214 | E16: 67.8 | F16: 7.34 | G16: 338.28 | H16: 68.7 | I16: 5.44 | J16: =RC[-5]-RC[-2] -> -0.90000000000000568 | K16: =RC[-7]-RC[-4] -> 25.934000000000026 | L16: 26.605 | M16: 66.900000000000006 | R16: 1.7569999999999999 | S16: =RC[-1] -> 1.7569999999999999 | T16: =(RC[-16]*RC[-15]-RC[-13]*RC[-12])/1000 -> 1.4538731999999981 | U16: 26.065000000000001 | W16: =RC[-2]*RC[-10]/1000 -> 1.7437485000000001 | X16: =ABS((RC[-3]*RC[-11]-RC[-2]*RC[-9])/1000) -> #VALUE! | Y16: =(RC[-14]-RC[1])/RC[-18]*100 -> -3.8725316306011399E-2 | Z16: 26.065000000000001 | AC16: =VALUE(RC[-27]) -> 2018-09-25T00:00:00.000 | AD16: =IF(RC[21]=42,"*",IF(RC[21]=32,"",RC[21])) ->  | AE16: =RC[-28] -> 24 | AF16: =RC[-28] -> 364.214 | AG16: =RC[-28] -> 67.8 | AH16: =RC[-28] -> 7.34 | AI16: =RC[-28] -> 338.28 | AJ16: =RC[-28] -> 68.7 | AK16: =RC[-28] -> 5.44 | AL16: =RC[-28] -> -0.90000000000000568 | AM16: =RC[-28] -> 25.934000000000026 | AN16: =RC[-28] -> 26.605 | AO16: =RC[-28] -> 66.900000000000006 | AP16: - | AQ16: =RC[-29] ->  | AR16: =RC[-29] ->  | AS16: - | AT16: =RC[-30] -> 0 | AU16: =RC[-30] ->  | AV16: =RC[-30] -> 1.7569999999999999 | AW16: =RC[-30] -> 1.7569999999999999
A17: =IF(RC[1]="","",DATEVALUE(RC[1])) -> 43369 | B17: 26.09.18 | C17: 24 | D17: 360.61200000000002 | E17: 67.099999999999994 | F17: 7.2799999999999994 | G17: 332.31299999999999 | H17: 67.900000000000006 | I17: 5.45 | J17: =RC[-5]-RC[-2] -> -0.80000000000001137 | K17: =RC[-7]-RC[-4] -> 28.299000000000035 | L17: 28.736999999999998 | M17: 66.2 | R17: 1.867 | S17: =RC[-1] -> 1.867 | T17: =(RC[-16]*RC[-15]-RC[-13]*RC[-12])/1000 -> 1.6330125000000006 | U17: 28.172000000000001 | W17: =RC[-2]*RC[-10]/1000 -> 1.8649864000000003 | X17: =ABS((RC[-3]*RC[-11]-RC[-2]*RC[-9])/1000) -> #VALUE! | Y17: =(RC[-14]-RC[1])/RC[-18]*100 -> 3.8216982182470875E-2 | Z17: 28.172000000000001 | AC17: =VALUE(RC[-27]) -> 2018-09-26T00:00:00.000 | AD17: =IF(RC[21]=42,"*",IF(RC[21]=32,"",RC[21])) ->  | AE17: =RC[-28] -> 24 | AF17: =RC[-28] -> 360.61200000000002 | AG17: =RC[-28] -> 67.099999999999994 | AH17: =RC[-28] -> 7.2799999999999994 | AI17: =RC[-28] -> 332.31299999999999 | AJ17: =RC[-28] -> 67.900000000000006 | AK17: =RC[-28] -> 5.45 | AL17: =RC[-28] -> -0.80000000000001137 | AM17: =RC[-28] -> 28.299000000000035 | AN17: =RC[-28] -> 28.736999999999998 | AO17: =RC[-28] -> 66.2 | AP17: - | AQ17: =RC[-29] ->  | AR17: =RC[-29] ->  | AS17: - | AT17: =RC[-30] -> 0 | AU17: =RC[-30] ->  | AV17: =RC[-30] -> 1.867 | AW17: =RC[-30] -> 1.867
A18: =IF(RC[1]="","",DATEVALUE(RC[1])) -> 43370 | B18: 27.09.18 | C18: 24 | D18: 326.267 | E18: 62.3 | F18: 6.9399999999999995 | G18: 289.50299999999999 | H18: 62.6 | I18: 5.48 | J18: =RC[-5]-RC[-2] -> -0.30000000000000426 | K18: =RC[-7]-RC[-4] -> 36.76400000000001 | L18: 28.960999999999999 | M18: 61.5 | R18: 1.758 | S18: 3.1509999999999998 | T18: =(RC[-16]*RC[-15]-RC[-13]*RC[-12])/1000 -> 2.203546299999998 | U18: 28.460999999999999 | W18: =RC[-2]*RC[-10]/1000 -> 1.7503515000000001 | X18: =ABS((RC[-3]*RC[-11]-RC[-2]*RC[-9])/1000) -> #VALUE! | Y18: =(RC[-14]-RC[1])/RC[-18]*100 -> 2.8680186388396707 | Z18: 28.460999999999999 | AC18: =VALUE(RC[-27]) -> 2018-09-27T00:00:00.000 | AD18: =IF(RC[21]=42,"*",IF(RC[21]=32,"",RC[21])) ->  | AE18: =RC[-28] -> 24 | AF18: =RC[-28] -> 326.267 | AG18: =RC[-28] -> 62.3 | AH18: =RC[-28] -> 6.9399999999999995 | AI18: =RC[-28] -> 289.50299999999999 | AJ18: =RC[-28] -> 62.6 | AK18: =RC[-28] -> 5.48 | AL18: =RC[-28] -> -0.30000000000000426 | AM18: =RC[-28] -> 36.76400000000001 | AN18: =RC[-28] -> 28.960999999999999 | AO18: =RC[-28] -> 61.5 | AP18: - | AQ18: =RC[-29] ->  | AR18: =RC[-29] ->  | AS18: - | AT18: =RC[-30] -> 0 | AU18: =RC[-30] ->  | AV18: =RC[-30] -> 1.758 | AW18: =RC[-30] -> 3.1509999999999998
A19: =IF(RC[1]="","",DATEVALUE(RC[1])) -> 43371 | B19: 28.09.18 | C19: 24 | D19: 303.45100000000002 | E19: 66.400000000000006 | F19: 6.8100000000000005 | G19: 222.655 | H19: 58.8 | I19: 5.57 | J19: =RC[-5]-RC[-2] -> 7.6000000000000085 | K19: =RC[-7]-RC[-4] -> 80.796000000000021 | L19: 28.439 | M19: 65.5 | R19: 1.833 | S19: 7.0490000000000004 | T19: =(RC[-16]*RC[-15]-RC[-13]*RC[-12])/1000 -> 7.0570324000000015 | U19: 27.887 | W19: =RC[-2]*RC[-10]/1000 -> 1.8265985 | X19: =ABS((RC[-3]*RC[-11]-RC[-2]*RC[-9])/1000) -> #VALUE! | Y19: =(RC[-14]-RC[1])/RC[-18]*100 -> 23.762772001527036 | Z19: 27.887 | AC19: =VALUE(RC[-27]) -> 2018-09-28T00:00:00.000 | AD19: =IF(RC[21]=42,"*",IF(RC[21]=32,"",RC[21])) ->  | AE19: =RC[-28] -> 24 | AF19: =RC[-28] -> 303.45100000000002 | AG19: =RC[-28] -> 66.400000000000006 | AH19: =RC[-28] -> 6.8100000000000005 | AI19: =RC[-28] -> 222.655 | AJ19: =RC[-28] -> 58.8 | AK19: =RC[-28] -> 5.57 | AL19: =RC[-28] -> 7.6000000000000085 | AM19: =RC[-28] -> 80.796000000000021 | AN19: =RC[-28] -> 28.439 | AO19: =RC[-28] -> 65.5 | AP19: - | AQ19: =RC[-29] ->  | AR19: =RC[-29] ->  | AS19: - | AT19: =RC[-30] -> 0 | AU19: =RC[-30] ->  | AV19: =RC[-30] -> 1.833 | AW19: =RC[-30] -> 7.0490000000000004
A20: =IF(RC[1]="","",DATEVALUE(RC[1])) -> 43372 | B20: 29.09.18 | C20: 24 | D20: 353.26 | E20: 67 | F20: 7.74 | G20: 314.774 | H20: 57.5 | I20: 6.01 | J20: =RC[-5]-RC[-2] -> 9.5 | K20: =RC[-7]-RC[-4] -> 38.48599999999999 | L20: 29.082000000000001 | M20: 65.900000000000006 | R20: 1.8959999999999999 | S20: 5.5839999999999996 | T20: =(RC[-16]*RC[-15]-RC[-13]*RC[-12])/1000 -> 5.568914999999997 | U20: 28.504000000000001 | W20: =RC[-2]*RC[-10]/1000 -> 1.8784136000000002 | X20: =ABS((RC[-3]*RC[-11]-RC[-2]*RC[-9])/1000) -> #VALUE! | Y20: =(RC[-14]-RC[1])/RC[-18]*100 -> 3.1711640732716138 | Z20: 28.504000000000001 | AC20: =VALUE(RC[-27]) -> 2018-09-29T00:00:00.000 | AD20: =IF(RC[21]=42,"*",IF(RC[21]=32,"",RC[21])) ->  | AE20: =RC[-28] -> 24 | AF20: =RC[-28] -> 353.26 | AG20: =RC[-28] -> 67 | AH20: =RC[-28] -> 7.74 | AI20: =RC[-28] -> 314.774 | AJ20: =RC[-28] -> 57.5 | AK20: =RC[-28] -> 6.01 | AL20: =RC[-28] -> 9.5 | AM20: =RC[-28] -> 38.48599999999999 | AN20: =RC[-28] -> 29.082000000000001 | AO20: =RC[-28] -> 65.900000000000006 | AP20: - | AQ20: =RC[-29] ->  | AR20: =RC[-29] ->  | AS20: - | AT20: =RC[-30] -> 0 | AU20: =RC[-30] ->  | AV20: =RC[-30] -> 1.8959999999999999 | AW20: =RC[-30] -> 5.5839999999999996
A21: =IF(RC[1]="","",DATEVALUE(RC[1])) -> 43373 | B21: 30.09.18 | C21: 24 | D21: 78.673000000000002 | E21: 67.099999999999994 | F21: 7.92 | G21: 48.744 | H21: 33.299999999999997 | I21: 5.8999999999999995 | J21: =RC[-5]-RC[-2] -> 33.799999999999997 | K21: =RC[-7]-RC[-4] -> 29.929000000000002 | L21: 28.803999999999998 | M21: 65.7 | R21: 1.899 | S21: 2.5230000000000001 | T21: =(RC[-16]*RC[-15]-RC[-13]*RC[-12])/1000 -> 3.6557830999999998 | U21: 28.221 | W21: =RC[-2]*RC[-10]/1000 -> 1.8541197000000003 | X21: =ABS((RC[-3]*RC[-11]-RC[-2]*RC[-9])/1000) -> #VALUE! | Y21: =(RC[-14]-RC[1])/RC[-18]*100 -> 3.5040210077137743 | Z21: 28.221 | AC21: =VALUE(RC[-27]) -> 2018-09-30T00:00:00.000 | AD21: =IF(RC[21]=42,"*",IF(RC[21]=32,"",RC[21])) ->  | AE21: =RC[-28] -> 24 | AF21: =RC[-28] -> 78.673000000000002 | AG21: =RC[-28] -> 67.099999999999994 | AH21: =RC[-28] -> 7.92 | AI21: =RC[-28] -> 48.744 | AJ21: =RC[-28] -> 33.299999999999997 | AK21: =RC[-28] -> 5.8999999999999995 | AL21: =RC[-28] -> 33.799999999999997 | AM21: =RC[-28] -> 29.929000000000002 | AN21: =RC[-28] -> 28.803999999999998 | AO21: =RC[-28] -> 65.7 | AP21: - | AQ21: =RC[-29] ->  | AR21: =RC[-29] ->  | AS21: - | AT21: =RC[-30] -> 0 | AU21: =RC[-30] ->  | AV21: =RC[-30] -> 1.899 | AW21: =RC[-30] -> 2.5230000000000001
A22: =IF(RC[1]="","",DATEVALUE(RC[1])) -> 43374 | B22: 01.10.18 | C22: 24 | D22: 54.491 | E22: 67.3 | F22: 7.92 | G22: 19.565000000000001 | H22: 27.8 | I22: 5.93 | J22: =RC[-5]-RC[-2] -> 39.5 | K22: =RC[-7]-RC[-4] -> 34.926000000000002 | L22: 29.952999999999999 | M22: 66.099999999999994 | R22: 1.97 | S22: 2.6669999999999998 | T22: =(RC[-16]*RC[-15]-RC[-13]*RC[-12])/1000 -> 3.1233372999999998 | U22: 29.349 | W22: =RC[-2]*RC[-10]/1000 -> 1.9399688999999998 | X22: =ABS((RC[-3]*RC[-11]-RC[-2]*RC[-9])/1000) -> #VALUE! | Y22: =(RC[-14]-RC[1])/RC[-18]*100 -> 28.504983388704325 | Z22: 29.349 | AC22: =VALUE(RC[-27]) -> 2018-10-01T00:00:00.000 | AD22: =IF(RC[21]=42,"*",IF(RC[21]=32,"",RC[21])) ->  | AE22: =RC[-28] -> 24 | AF22: =RC[-28] -> 54.491 | AG22: =RC[-28] -> 67.3 | AH22: =RC[-28] -> 7.92 | AI22: =RC[-28] -> 19.565000000000001 | AJ22: =RC[-28] -> 27.8 | AK22: =RC[-28] -> 5.93 | AL22: =RC[-28] -> 39.5 | AM22: =RC[-28] -> 34.926000000000002 | AN22: =RC[-28] -> 29.952999999999999 | AO22: =RC[-28] -> 66.099999999999994 | AP22: - | AQ22: =RC[-29] ->  | AR22: =RC[-29] ->  | AS22: - | AT22: =RC[-30] -> 0 | AU22: =RC[-30] ->  | AV22: =RC[-30] -> 1.97 | AW22: =RC[-30] -> 2.6669999999999998
A23: =IF(RC[1]="","",DATEVALUE(RC[1])) -> 43375 | B23: 02.10.18 | C23: 24 | D23: 349.09199999999998 | E23: 66.7 | F23: 7.6400000000000006 | G23: 299.34800000000001 | H23: 54 | I23: 5.93 | J23: =RC[-5]-RC[-2] -> 12.700000000000003 | K23: =RC[-7]-RC[-4] -> 49.743999999999971 | L23: 27.442 | M23: 65.8 | R23: 1.782 | S23: 7.1 | T23: =(RC[-16]*RC[-15]-RC[-13]*RC[-12])/1000 -> 7.1196443999999977 | U23: 26.902000000000001 | W23: =RC[-2]*RC[-10]/1000 -> 1.7701515999999999 | X23: =ABS((RC[-3]*RC[-11]-RC[-2]*RC[-9])/1000) -> #VALUE! | Y23: =(RC[-14]-RC[1])/RC[-18]*100 -> 7.6305838021299515 | Z23: 26.902000000000001 | AC23: =VALUE(RC[-27]) -> 2018-10-02T00:00:00.000 | AD23: =IF(RC[21]=42,"*",IF(RC[21]=32,"",RC[21])) ->  | AE23: =RC[-28] -> 24 | AF23: =RC[-28] -> 349.09199999999998 | AG23: =RC[-28] -> 66.7 | AH23: =RC[-28] -> 7.6400000000000006 | AI23: =RC[-28] -> 299.34800000000001 | AJ23: =RC[-28] -> 54 | AK23: =RC[-28] -> 5.93 | AL23: =RC[-28] -> 12.700000000000003 | AM23: =RC[-28] -> 49.743999999999971 | AN23: =RC[-28] -> 27.442 | AO23: =RC[-28] -> 65.8 | AP23: - | AQ23: =RC[-29] ->  | AR23: =RC[-29] ->  | AS23: - | AT23: =RC[-30] -> 0 | AU23: =RC[-30] ->  | AV23: =RC[-30] -> 1.782 | AW23: =RC[-30] -> 7.1
A24: =IF(RC[1]="","",DATEVALUE(RC[1])) -> 43376 | B24: 03.10.18 | C24: 24 | D24: 347.89600000000002 | E24: 66.7 | F24: 7.63 | G24: 262.327 | H24: 49.2 | I24: 5.9499999999999993 | J24: =RC[-5]-RC[-2] -> 17.5 | K24: =RC[-7]-RC[-4] -> 85.569000000000017 | L24: 27.657 | M24: 65.7 | R24: 1.796 | S24: 10.25 | T24: =(RC[-16]*RC[-15]-RC[-13]*RC[-12])/1000 -> 10.298174800000002 | U24: 27.113 | W24: =RC[-2]*RC[-10]/1000 -> 1.7813241 | X24: =ABS((RC[-3]*RC[-11]-RC[-2]*RC[-9])/1000) -> #VALUE! | Y24: =(RC[-14]-RC[1])/RC[-18]*100 -> 22.283638359757106 | Z24: 27.113 | AC24: =VALUE(RC[-27]) -> 2018-10-03T00:00:00.000 | AD24: =IF(RC[21]=42,"*",IF(RC[21]=32,"",RC[21])) ->  | AE24: =RC[-28] -> 24 | AF24: =RC[-28] -> 347.89600000000002 | AG24: =RC[-28] -> 66.7 | AH24: =RC[-28] -> 7.63 | AI24: =RC[-28] -> 262.327 | AJ24: =RC[-28] -> 49.2 | AK24: =RC[-28] -> 5.9499999999999993 | AL24: =RC[-28] -> 17.5 | AM24: =RC[-28] -> 85.569000000000017 | AN24: =RC[-28] -> 27.657 | AO24: =RC[-28] -> 65.7 | AP24: - | AQ24: =RC[-29] ->  | AR24: =RC[-29] ->  | AS24: - | AT24: =RC[-30] -> 0 | AU24: =RC[-30] ->  | AV24: =RC[-30] -> 1.796 | AW24: =RC[-30] -> 10.25
A25: =IF(RC[1]="","",DATEVALUE(RC[1])) -> 43377 | B25: 04.10.18 | C25: 24 | D25: 343.178 | E25: 66.3 | F25: 7.61 | G25: 310.947 | H25: 47.2 | I25: 6 | J25: =RC[-5]-RC[-2] -> 19.099999999999994 | K25: =RC[-7]-RC[-4] -> 32.230999999999995 | L25: 29.186 | M25: 65.400000000000006 | R25: 1.8859999999999999 | S25: 8.077 | T25: =(RC[-16]*RC[-15]-RC[-13]*RC[-12])/1000 -> 8.0760029999999965 | U25: 28.617000000000001 | W25: =RC[-2]*RC[-10]/1000 -> 1.8715518000000002 | X25: =ABS((RC[-3]*RC[-11]-RC[-2]*RC[-9])/1000) -> #VALUE! | Y25: =(RC[-14]-RC[1])/RC[-18]*100 -> 1.1622559471549794 | Z25: 28.617000000000001 | AC25: =VALUE(RC[-27]) -> 2018-10-04T00:00:00.000 | AD25: =IF(RC[21]=42,"*",IF(RC[21]=32,"",RC[21])) ->  | AE25: =RC[-28] -> 24 | AF25: =RC[-28] -> 343.178 | AG25: =RC[-28] -> 66.3 | AH25: =RC[-28] -> 7.61 | AI25: =RC[-28] -> 310.947 | AJ25: =RC[-28] -> 47.2 | AK25: =RC[-28] -> 6 | AL25: =RC[-28] -> 19.099999999999994 | AM25: =RC[-28] -> 32.230999999999995 | AN25: =RC[-28] -> 29.186 | AO25: =RC[-28] -> 65.400000000000006 | AP25: - | AQ25: =RC[-29] ->  | AR25: =RC[-29] ->  | AS25: - | AT25: =RC[-30] -> 0 | AU25: =RC[-30] ->  | AV25: =RC[-30] -> 1.8859999999999999 | AW25: =RC[-30] -> 8.077
A26: =IF(RC[1]="","",DATEVALUE(RC[1])) -> 43378 | B26: 05.10.18 | C26: 24 | D26: 349.31799999999998 | E26: 65.599999999999994 | F26: 7.55 | G26: 317.90800000000002 | H26: 47 | I26: 5.8699999999999992 | J26: =RC[-5]-RC[-2] -> 18.599999999999994 | K26: =RC[-7]-RC[-4] -> 31.409999999999968 | L26: 28.934999999999999 | M26: 64.599999999999994 | R26: 1.851 | S26: 7.9870000000000001 | T26: =(RC[-16]*RC[-15]-RC[-13]*RC[-12])/1000 -> 7.9735847999999949 | U26: 28.382000000000001 | W26: =RC[-2]*RC[-10]/1000 -> 1.8334772000000001 | X26: =ABS((RC[-3]*RC[-11]-RC[-2]*RC[-9])/1000) -> #VALUE! | Y26: =(RC[-14]-RC[1])/RC[-18]*100 -> 0.95247681719238475 | Z26: 28.382000000000001 | AC26: =VALUE(RC[-27]) -> 2018-10-05T00:00:00.000 | AD26: =IF(RC[21]=42,"*",IF(RC[21]=32,"",RC[21])) ->  | AE26: =RC[-28] -> 24 | AF26: =RC[-28] -> 349.31799999999998 | AG26: =RC[-28] -> 65.599999999999994 | AH26: =RC[-28] -> 7.55 | AI26: =RC[-28] -> 317.90800000000002 | AJ26: =RC[-28] -> 47 | AK26: =RC[-28] -> 5.8699999999999992 | AL26: =RC[-28] -> 18.599999999999994 | AM26: =RC[-28] -> 31.409999999999968 | AN26: =RC[-28] -> 28.934999999999999 | AO26: =RC[-28] -> 64.599999999999994 | AP26: - | AQ26: =RC[-29] ->  | AR26: =RC[-29] ->  | AS26: - | AT26: =RC[-30] -> 0 | AU26: =RC[-30] ->  | AV26: =RC[-30] -> 1.851 | AW26: =RC[-30] -> 7.9870000000000001
A27: =IF(RC[1]="","",DATEVALUE(RC[1])) -> 43379 | B27: 06.10.18 | C27: 24 | D27: 336.15300000000002 | E27: 66.099999999999994 | F27: 7.5600000000000005 | G27: 305.56700000000001 | H27: 47.2 | I27: 6.02 | J27: =RC[-5]-RC[-2] -> 18.899999999999991 | K27: =RC[-7]-RC[-4] -> 30.586000000000013 | L27: 28.216000000000001 | M27: 64.900000000000006 | R27: 1.8169999999999999 | S27: 7.8090000000000002 | T27: =(RC[-16]*RC[-15]-RC[-13]*RC[-12])/1000 -> 7.7969508999999979 | U27: 27.67 | W27: =RC[-2]*RC[-10]/1000 -> 1.7957830000000004 | X27: =ABS((RC[-3]*RC[-11]-RC[-2]*RC[-9])/1000) -> #VALUE! | Y27: =(RC[-14]-RC[1])/RC[-18]*100 -> 0.9542915301717827 | Z27: 27.67 | AC27: =VALUE(RC[-27]) -> 2018-10-06T00:00:00.000 | AD27: =IF(RC[21]=42,"*",IF(RC[21]=32,"",RC[21])) ->  | AE27: =RC[-28] -> 24 | AF27: =RC[-28] -> 336.15300000000002 | AG27: =RC[-28] -> 66.099999999999994 | AH27: =RC[-28] -> 7.5600000000000005 | AI27: =RC[-28] -> 305.56700000000001 | AJ27: =RC[-28] -> 47.2 | AK27: =RC[-28] -> 6.02 | AL27: =RC[-28] -> 18.899999999999991 | AM27: =RC[-28] -> 30.586000000000013 | AN27: =RC[-28] -> 28.216000000000001 | AO27: =RC[-28] -> 64.900000000000006 | AP27: - | AQ27: =RC[-29] ->  | AR27: =RC[-29] ->  | AS27: - | AT27: =RC[-30] -> 0 | AU27: =RC[-30] ->  | AV27: =RC[-30] -> 1.8169999999999999 | AW27: =RC[-30] -> 7.8090000000000002
A28: =IF(RC[1]="","",DATEVALUE(RC[1])) -> 43380 | B28: 07.10.18 | C28: 24 | D28: 339.84800000000001 | E28: 66.5 | F28: 7.54 | G28: 307.26100000000002 | H28: 47.8 | I28: 5.9799999999999995 | J28: =RC[-5]-RC[-2] -> 18.700000000000003 | K28: =RC[-7]-RC[-4] -> 32.586999999999989 | L28: 29.373000000000001 | M28: 65.5 | R28: 1.905 | S28: 7.923 | T28: =(RC[-16]*RC[-15]-RC[-13]*RC[-12])/1000 -> 7.9128161999999991 | U28: 28.797000000000001 | W28: =RC[-2]*RC[-10]/1000 -> 1.8862035000000001 | X28: =ABS((RC[-3]*RC[-11]-RC[-2]*RC[-9])/1000) -> #VALUE! | Y28: =(RC[-14]-RC[1])/RC[-18]*100 -> 1.2334790292292181 | Z28: 28.797000000000001 | AC28: =VALUE(RC[-27]) -> 2018-10-07T00:00:00.000 | AD28: =IF(RC[21]=42,"*",IF(RC[21]=32,"",RC[21])) ->  | AE28: =RC[-28] -> 24 | AF28: =RC[-28] -> 339.84800000000001 | AG28: =RC[-28] -> 66.5 | AH28: =RC[-28] -> 7.54 | AI28: =RC[-28] -> 307.26100000000002 | AJ28: =RC[-28] -> 47.8 | AK28: =RC[-28] -> 5.9799999999999995 | AL28: =RC[-28] -> 18.700000000000003 | AM28: =RC[-28] -> 32.586999999999989 | AN28: =RC[-28] -> 29.373000000000001 | AO28: =RC[-28] -> 65.5 | AP28: - | AQ28: =RC[-29] ->  | AR28: =RC[-29] ->  | AS28: - | AT28: =RC[-30] -> 0 | AU28: =RC[-30] ->  | AV28: =RC[-30] -> 1.905 | AW28: =RC[-30] -> 7.923
A29: =IF(RC[1]="","",DATEVALUE(RC[1])) -> 43381 | B29: 08.10.18 | C29: 24 | D29: 342.25200000000001 | E29: 66.400000000000006 | F29: 7.5 | G29: 309.77100000000002 | H29: 47.6 | I29: 5.8999999999999995 | J29: =RC[-5]-RC[-2] -> 18.800000000000004 | K29: =RC[-7]-RC[-4] -> 32.480999999999995 | L29: 28.684999999999999 | M29: 65.5 | R29: 1.855 | S29: 7.9950000000000001 | T29: =(RC[-16]*RC[-15]-RC[-13]*RC[-12])/1000 -> 7.9804331999999993 | U29: 28.123999999999999 | W29: =RC[-2]*RC[-10]/1000 -> 1.8421219999999998 | X29: =ABS((RC[-3]*RC[-11]-RC[-2]*RC[-9])/1000) -> #VALUE! | Y29: =(RC[-14]-RC[1])/RC[-18]*100 -> 1.4065228830329486 | Z29: 28.123999999999999 | AC29: =VALUE(RC[-27]) -> 2018-10-08T00:00:00.000 | AD29: =IF(RC[21]=42,"*",IF(RC[21]=32,"",RC[21])) ->  | AE29: =RC[-28] -> 24 | AF29: =RC[-28] -> 342.25200000000001 | AG29: =RC[-28] -> 66.400000000000006 | AH29: =RC[-28] -> 7.5 | AI29: =RC[-28] -> 309.77100000000002 | AJ29: =RC[-28] -> 47.6 | AK29: =RC[-28] -> 5.8999999999999995 | AL29: =RC[-28] -> 18.800000000000004 | AM29: =RC[-28] -> 32.480999999999995 | AN29: =RC[-28] -> 28.684999999999999 | AO29: =RC[-28] -> 65.5 | AP29: - | AQ29: =RC[-29] ->  | AR29: =RC[-29] ->  | AS29: - | AT29: =RC[-30] -> 0 | AU29: =RC[-30] ->  | AV29: =RC[-30] -> 1.855 | AW29: =RC[-30] -> 7.9950000000000001
A30: =IF(RC[1]="","",DATEVALUE(RC[1])) -> 43382 | B30: 09.10.18 | C30: 24 | D30: =AVERAGE(R[-3]C:R[-1]C) -> 339.41766666666666 | E30: =AVERAGE(R[-3]C:R[-1]C) -> 66.333333333333329 | F30: =AVERAGE(R[-3]C:R[-1]C) -> 7.5333333333333341 | G30: =AVERAGE(R[-3]C:R[-1]C) -> 307.53299999999996 | H30: =AVERAGE(R[-3]C:R[-1]C) -> 47.533333333333331 | I30: =AVERAGE(R[-3]C:R[-1]C) -> 5.9666666666666659 | J30: =AVERAGE(R[-3]C:R[-1]C) -> 18.8 | K30: =AVERAGE(R[-3]C:R[-1]C) -> 31.884666666666664 | L30: 28.446999999999999 | M30: 65.3 | R30: 1.837 | S30: =RC[1] -> 7.8966366222222222 | T30: =(RC[-16]*RC[-15]-RC[-13]*RC[-12])/1000 -> 7.8966366222222222 | U30: 27.893000000000001 | W30: =RC[-2]*RC[-10]/1000 -> 1.8214129000000001 | X30: =ABS((RC[-3]*RC[-11]-RC[-2]*RC[-9])/1000) -> #VALUE! | Y30: =(RC[-14]-RC[1])/RC[-18]*100 -> 1.2979636873657994 | Z30: 27.893000000000001 | AC30: =VALUE(RC[-27]) -> 2018-10-09T00:00:00.000 | AD30: =IF(RC[21]=42,"*",IF(RC[21]=32,"",RC[21])) ->  | AE30: =RC[-28] -> 24 | AF30: =RC[-28] -> 339.41766666666666 | AG30: =RC[-28] -> 66.333333333333329 | AH30: =RC[-28] -> 7.5333333333333341 | AI30: =RC[-28] -> 307.53299999999996 | AJ30: =RC[-28] -> 47.533333333333331 | AK30: =RC[-28] -> 5.9666666666666659 | AL30: =RC[-28] -> 18.8 | AM30: =RC[-28] -> 31.884666666666664 | AN30: =RC[-28] -> 28.446999999999999 | AO30: =RC[-28] -> 65.3 | AP30: - | AQ30: =RC[-29] ->  | AR30: =RC[-29] ->  | AS30: - | AT30: =RC[-30] -> 0 | AU30: =RC[-30] ->  | AV30: =RC[-30] -> 1.837 | AW30: =RC[-30] -> 7.8966366222222222
A31: =IF(RC[1]="","",DATEVALUE(RC[1])) -> 43383 | B31: 10.10.18 | C31: 24 | D31: 339.41766666666666 | E31: 66.333333333333329 | F31: 7.5333333333333341 | G31: 307.53299999999996 | H31: 47.533333333333331 | I31: 5.9666666666666659 | J31: 18.8 | K31: 31.884666666666664 | L31: 27.1 | M31: 66.3 | R31: 1.7809999999999999 | S31: =RC[1] -> 7.8966366222222222 | T31: =(RC[-16]*RC[-15]-RC[-13]*RC[-12])/1000 -> 7.8966366222222222 | U31: 26.556000000000001 | W31: =RC[-2]*RC[-10]/1000 -> 1.7606628 | X31: =ABS((RC[-3]*RC[-11]-RC[-2]*RC[-9])/1000) -> #VALUE! | Y31: =(RC[-14]-RC[1])/RC[-18]*100 -> 1.7327137792258598 | Z31: 26.556000000000001 | AC31: =VALUE(RC[-27]) -> 2018-10-10T00:00:00.000 | AD31: =IF(RC[21]=42,"*",IF(RC[21]=32,"",RC[21])) ->  | AE31: =RC[-28] -> 24 | AF31: =RC[-28] -> 339.41766666666666 | AG31: =RC[-28] -> 66.333333333333329 | AH31: =RC[-28] -> 7.5333333333333341 | AI31: =RC[-28] -> 307.53299999999996 | AJ31: =RC[-28] -> 47.533333333333331 | AK31: =RC[-28] -> 5.9666666666666659 | AL31: =RC[-28] -> 18.8 | AM31: =RC[-28] -> 31.884666666666664 | AN31: =RC[-28] -> 27.1 | AO31: =RC[-28] -> 66.3 | AP31: - | AQ31: =RC[-29] ->  | AR31: =RC[-29] ->  | AS31: - | AT31: =RC[-30] -> 0 | AU31: =RC[-30] ->  | AV31: =RC[-30] -> 1.7809999999999999 | AW31: =RC[-30] -> 7.8966366222222222
A32: =IF(RC[1]="","",DATEVALUE(RC[1])) -> 43384 | B32: 11.10.18 | C32: 24 | D32: 339.41766666666666 | E32: 66.333333333333329 | F32: 7.5333333333333341 | G32: 307.53299999999996 | H32: 47.533333333333331 | I32: 5.9666666666666659 | J32: 18.8 | K32: 31.884666666666664 | L32: 26.52 | M32: 67.3 | R32: 1.7649999999999999 | S32: =RC[1] -> 7.8966366222222222 | T32: =(RC[-16]*RC[-15]-RC[-13]*RC[-12])/1000 -> 7.8966366222222222 | U32: 25.974 | W32: =RC[-2]*RC[-10]/1000 -> 1.7480502 | X32: =ABS((RC[-3]*RC[-11]-RC[-2]*RC[-9])/1000) -> #VALUE! | Y32: =(RC[-14]-RC[1])/RC[-18]*100 -> 1.9219617623691325 | Z32: 25.974 | AC32: =VALUE(RC[-27]) -> 2018-10-11T00:00:00.000 | AD32: =IF(RC[21]=42,"*",IF(RC[21]=32,"",RC[21])) ->  | AE32: =RC[-28] -> 24 | AF32: =RC[-28] -> 339.41766666666666 | AG32: =RC[-28] -> 66.333333333333329 | AH32: =RC[-28] -> 7.5333333333333341 | AI32: =RC[-28] -> 307.53299999999996 | AJ32: =RC[-28] -> 47.533333333333331 | AK32: =RC[-28] -> 5.9666666666666659 | AL32: =RC[-28] -> 18.8 | AM32: =RC[-28] -> 31.884666666666664 | AN32: =RC[-28] -> 26.52 | AO32: =RC[-28] -> 67.3 | AP32: - | AQ32: =RC[-29] ->  | AR32: =RC[-29] ->  | AS32: - | AT32: =RC[-30] -> 0 | AU32: =RC[-30] ->  | AV32: =RC[-30] -> 1.7649999999999999 | AW32: =RC[-30] -> 7.8966366222222222
A33: =IF(RC[1]="","",DATEVALUE(RC[1])) -> 43385 | B33: 12.10.18 | C33: 24 | D33: 339.41766666666666 | E33: 66.333333333333329 | F33: 7.5333333333333341 | G33: 307.53299999999996 | H33: 47.533333333333331 | I33: 5.9666666666666659 | J33: 18.8 | K33: 31.884666666666664 | L33: 26.966000000000001 | M33: 67.400000000000006 | R33: 1.796 | S33: =RC[1] -> 7.8966366222222222 | T33: =(RC[-16]*RC[-15]-RC[-13]*RC[-12])/1000 -> 7.8966366222222222 | U33: 26.41 | W33: =RC[-2]*RC[-10]/1000 -> 1.7800340000000001 | X33: =ABS((RC[-3]*RC[-11]-RC[-2]*RC[-9])/1000) -> #VALUE! | Y33: =(RC[-14]-RC[1])/RC[-18]*100 -> 1.7801883591896366 | Z33: 26.41 | AC33: =VALUE(RC[-27]) -> 2018-10-12T00:00:00.000 | AD33: =IF(RC[21]=42,"*",IF(RC[21]=32,"",RC[21])) ->  | AE33: =RC[-28] -> 24 | AF33: =RC[-28] -> 339.41766666666666 | AG33: =RC[-28] -> 66.333333333333329 | AH33: =RC[-28] -> 7.5333333333333341 | AI33: =RC[-28] -> 307.53299999999996 | AJ33: =RC[-28] -> 47.533333333333331 | AK33: =RC[-28] -> 5.9666666666666659 | AL33: =RC[-28] -> 18.8 | AM33: =RC[-28] -> 31.884666666666664 | AN33: =RC[-28] -> 26.966000000000001 | AO33: =RC[-28] -> 67.400000000000006 | AP33: - | AQ33: =RC[-29] ->  | AR33: =RC[-29] ->  | AS33: - | AT33: =RC[-30] -> 0 | AU33: =RC[-30] ->  | AV33: =RC[-30] -> 1.796 | AW33: =RC[-30] -> 7.8966366222222222
A34: =IF(RC[1]="","",DATEVALUE(RC[1])) -> 43386 | B34: 13.10.18 | C34: 24 | D34: 339.41766666666666 | E34: 66.333333333333329 | F34: 7.5333333333333341 | G34: 307.53299999999996 | H34: 47.533333333333331 | I34: 5.9666666666666659 | J34: 18.8 | K34: 31.884666666666664 | L34: 27.106000000000002 | M34: 68.400000000000006 | R34: 1.8260000000000001 | S34: =RC[1] -> 7.8966366222222222 | T34: =(RC[-16]*RC[-15]-RC[-13]*RC[-12])/1000 -> 7.8966366222222222 | U34: 26.533000000000001 | W34: =RC[-2]*RC[-10]/1000 -> 1.8148572000000001 | X34: =ABS((RC[-3]*RC[-11]-RC[-2]*RC[-9])/1000) -> #VALUE! | Y34: =(RC[-14]-RC[1])/RC[-18]*100 -> 1.7401926514119341 | Z34: 26.533000000000001 | AC34: =VALUE(RC[-27]) -> 2018-10-13T00:00:00.000 | AD34: =IF(RC[21]=42,"*",IF(RC[21]=32,"",RC[21])) ->  | AE34: =RC[-28] -> 24 | AF34: =RC[-28] -> 339.41766666666666 | AG34: =RC[-28] -> 66.333333333333329 | AH34: =RC[-28] -> 7.5333333333333341 | AI34: =RC[-28] -> 307.53299999999996 | AJ34: =RC[-28] -> 47.533333333333331 | AK34: =RC[-28] -> 5.9666666666666659 | AL34: =RC[-28] -> 18.8 | AM34: =RC[-28] -> 31.884666666666664 | AN34: =RC[-28] -> 27.106000000000002 | AO34: =RC[-28] -> 68.400000000000006 | AP34: - | AQ34: =RC[-29] ->  | AR34: =RC[-29] ->  | AS34: - | AT34: =RC[-30] -> 0 | AU34: =RC[-30] ->  | AV34: =RC[-30] -> 1.8260000000000001 | AW34: =RC[-30] -> 7.8966366222222222
A35: =IF(RC[1]="","",DATEVALUE(RC[1])) -> 43387 | B35: 14.10.18 | C35: 24 | D35: 339.41766666666666 | E35: 66.333333333333329 | F35: 7.5333333333333341 | G35: 307.53299999999996 | H35: 47.533333333333331 | I35: 5.9666666666666659 | J35: 18.8 | K35: 31.884666666666664 | L35: 25.33 | M35: 69.099999999999994 | R35: 1.7290000000000001 | S35: =RC[1] -> 7.8966366222222222 | T35: =(RC[-16]*RC[-15]-RC[-13]*RC[-12])/1000 -> 7.8966366222222222 | U35: 24.783000000000001 | W35: =RC[-2]*RC[-10]/1000 -> 1.7125053000000001 | X35: =ABS((RC[-3]*RC[-11]-RC[-2]*RC[-9])/1000) -> #VALUE! | Y35: =(RC[-14]-RC[1])/RC[-18]*100 -> 2.3092372742654166 | Z35: 24.783000000000001 | AC35: =VALUE(RC[-27]) -> 2018-10-14T00:00:00.000 | AD35: =IF(RC[21]=42,"*",IF(RC[21]=32,"",RC[21])) ->  | AE35: =RC[-28] -> 24 | AF35: =RC[-28] -> 339.41766666666666 | AG35: =RC[-28] -> 66.333333333333329 | AH35: =RC[-28] -> 7.5333333333333341 | AI35: =RC[-28] -> 307.53299999999996 | AJ35: =RC[-28] -> 47.533333333333331 | AK35: =RC[-28] -> 5.9666666666666659 | AL35: =RC[-28] -> 18.8 | AM35: =RC[-28] -> 31.884666666666664 | AN35: =RC[-28] -> 25.33 | AO35: =RC[-28] -> 69.099999999999994 | AP35: - | AQ35: =RC[-29] ->  | AR35: =RC[-29] ->  | AS35: - | AT35: =RC[-30] -> 0 | AU35: =RC[-30] ->  | AV35: =RC[-30] -> 1.7290000000000001 | AW35: =RC[-30] -> 7.8966366222222222
A36: =IF(RC[1]="","",DATEVALUE(RC[1])) -> 43388 | B36: 15.10.18 | C36: 24 | D36: 339.41766666666666 | E36: 66.333333333333329 | F36: 7.5333333333333341 | G36: 307.53299999999996 | H36: 47.533333333333331 | I36: 5.9666666666666659 | J36: 18.8 | K36: 31.884666666666664 | L36: 28.06 | M36: 68.8 | R36: 1.907 | S36: =RC[1] -> 7.8966366222222222 | T36: =(RC[-16]*RC[-15]-RC[-13]*RC[-12])/1000 -> 7.8966366222222222 | U36: 27.457999999999998 | W36: =RC[-2]*RC[-10]/1000 -> 1.8891103999999999 | X36: =ABS((RC[-3]*RC[-11]-RC[-2]*RC[-9])/1000) -> #VALUE! | Y36: =(RC[-14]-RC[1])/RC[-18]*100 -> 1.4394119221893802 | Z36: 27.457999999999998 | AC36: =VALUE(RC[-27]) -> 2018-10-15T00:00:00.000 | AD36: =IF(RC[21]=42,"*",IF(RC[21]=32,"",RC[21])) ->  | AE36: =RC[-28] -> 24 | AF36: =RC[-28] -> 339.41766666666666 | AG36: =RC[-28] -> 66.333333333333329 | AH36: =RC[-28] -> 7.5333333333333341 | AI36: =RC[-28] -> 307.53299999999996 | AJ36: =RC[-28] -> 47.533333333333331 | AK36: =RC[-28] -> 5.9666666666666659 | AL36: =RC[-28] -> 18.8 | AM36: =RC[-28] -> 31.884666666666664 | AN36: =RC[-28] -> 28.06 | AO36: =RC[-28] -> 68.8 | AP36: - | AQ36: =RC[-29] ->  | AR36: =RC[-29] ->  | AS36: - | AT36: =RC[-30] -> 0 | AU36: =RC[-30] ->  | AV36: =RC[-30] -> 1.907 | AW36: =RC[-30] -> 7.8966366222222222
A37: =IF(RC[1]="","",DATEVALUE(RC[1])) -> 43389 | B37: 16.10.18 | C37: 24 | D37: 339.41766666666666 | E37: 66.333333333333329 | F37: 7.5333333333333341 | G37: 307.53299999999996 | H37: 47.533333333333331 | I37: 5.9666666666666659 | J37: 18.8 | K37: 31.884666666666664 | L37: 27.332999999999998 | M37: 69 | R37: 1.8580000000000001 | S37: =RC[1] -> 7.8966366222222222 | T37: =(RC[-16]*RC[-15]-RC[-13]*RC[-12])/1000 -> 7.8966366222222222 | U37: 26.745999999999999 | W37: =RC[-2]*RC[-10]/1000 -> 1.8454739999999998 | X37: =ABS((RC[-3]*RC[-11]-RC[-2]*RC[-9])/1000) -> #VALUE! | Y37: =(RC[-14]-RC[1])/RC[-18]*100 -> 1.6709317916017683 | Z37: 26.745999999999999 | AC37: =VALUE(RC[-27]) -> 2018-10-16T00:00:00.000 | AD37: =IF(RC[21]=42,"*",IF(RC[21]=32,"",RC[21])) ->  | AE37: =RC[-28] -> 24 | AF37: =RC[-28] -> 339.41766666666666 | AG37: =RC[-28] -> 66.333333333333329 | AH37: =RC[-28] -> 7.5333333333333341 | AI37: =RC[-28] -> 307.53299999999996 | AJ37: =RC[-28] -> 47.533333333333331 | AK37: =RC[-28] -> 5.9666666666666659 | AL37: =RC[-28] -> 18.8 | AM37: =RC[-28] -> 31.884666666666664 | AN37: =RC[-28] -> 27.332999999999998 | AO37: =RC[-28] -> 69 | AP37: - | AQ37: =RC[-29] ->  | AR37: =RC[-29] ->  | AS37: - | AT37: =RC[-30] -> 0 | AU37: =RC[-30] ->  | AV37: =RC[-30] -> 1.8580000000000001 | AW37: =RC[-30] -> 7.8966366222222222
A38: =IF(RC[1]="","",DATEVALUE(RC[1])) -> 43390 | B38: 17.10.18 | C38: 24 | D38: 339.41766666666666 | E38: 66.333333333333329 | F38: 7.5333333333333341 | G38: 307.53299999999996 | H38: 47.533333333333331 | I38: 5.9666666666666659 | J38: 18.8 | K38: 31.884666666666664 | L38: 26.588999999999999 | M38: 68.8 | R38: 1.8069999999999999 | S38: =RC[1] -> 7.8966366222222222 | T38: =(RC[-16]*RC[-15]-RC[-13]*RC[-12])/1000 -> 7.8966366222222222 | U38: 26.018000000000001 | W38: =RC[-2]*RC[-10]/1000 -> 1.7900383999999998 | X38: =ABS((RC[-3]*RC[-11]-RC[-2]*RC[-9])/1000) -> #VALUE! | Y38: =(RC[-14]-RC[1])/RC[-18]*100 -> 1.9076543547088165 | Z38: 26.018000000000001 | AC38: =VALUE(RC[-27]) -> 2018-10-17T00:00:00.000 | AD38: =IF(RC[21]=42,"*",IF(RC[21]=32,"",RC[21])) ->  | AE38: =RC[-28] -> 24 | AF38: =RC[-28] -> 339.41766666666666 | AG38: =RC[-28] -> 66.333333333333329 | AH38: =RC[-28] -> 7.5333333333333341 | AI38: =RC[-28] -> 307.53299999999996 | AJ38: =RC[-28] -> 47.533333333333331 | AK38: =RC[-28] -> 5.9666666666666659 | AL38: =RC[-28] -> 18.8 | AM38: =RC[-28] -> 31.884666666666664 | AN38: =RC[-28] -> 26.588999999999999 | AO38: =RC[-28] -> 68.8 | AP38: - | AQ38: =RC[-29] ->  | AR38: =RC[-29] ->  | AS38: - | AT38: =RC[-30] -> 0 | AU38: =RC[-30] ->  | AV38: =RC[-30] -> 1.8069999999999999 | AW38: =RC[-30] -> 7.8966366222222222
A39: =IF(RC[1]="","",DATEVALUE(RC[1])) -> 43391 | B39: 18.10.18 | C39: 24 | D39: 339.41766666666666 | E39: 66.333333333333329 | F39: 7.5333333333333341 | G39: 307.53299999999996 | H39: 47.533333333333331 | I39: 5.9666666666666659 | J39: 18.8 | K39: 31.884666666666664 | L39: 24.92 | M39: 69.2 | R39: 1.7030000000000001 | S39: =RC[1] -> 7.8966366222222222 | T39: =(RC[-16]*RC[-15]-RC[-13]*RC[-12])/1000 -> 7.8966366222222222 | U39: 24.379000000000001 | W39: =RC[-2]*RC[-10]/1000 -> 1.6870268000000002 | X39: =ABS((RC[-3]*RC[-11]-RC[-2]*RC[-9])/1000) -> #VALUE! | Y39: =(RC[-14]-RC[1])/RC[-18]*100 -> 2.4406052900555917 | Z39: 24.379000000000001 | AC39: =VALUE(RC[-27]) -> 2018-10-18T00:00:00.000 | AD39: =IF(RC[21]=42,"*",IF(RC[21]=32,"",RC[21])) ->  | AE39: =RC[-28] -> 24 | AF39: =RC[-28] -> 339.41766666666666 | AG39: =RC[-28] -> 66.333333333333329 | AH39: =RC[-28] -> 7.5333333333333341 | AI39: =RC[-28] -> 307.53299999999996 | AJ39: =RC[-28] -> 47.533333333333331 | AK39: =RC[-28] -> 5.9666666666666659 | AL39: =RC[-28] -> 18.8 | AM39: =RC[-28] -> 31.884666666666664 | AN39: =RC[-28] -> 24.92 | AO39: =RC[-28] -> 69.2 | AP39: - | AQ39: =RC[-29] ->  | AR39: =RC[-29] ->  | AS39: - | AT39: =RC[-30] -> 0 | AU39: =RC[-30] ->  | AV39: =RC[-30] -> 1.7030000000000001 | AW39: =RC[-30] -> 7.8966366222222222
A40: =IF(RC[1]="","",DATEVALUE(RC[1])) -> 43392 | B40: 19.10.18 | C40: 24 | D40: 182.14 | E40: 70.3 | F40: 7.61 | G40: 153.346 | H40: 41.1 | I40: 5.77 | J40: =RC[-5]-RC[-2] -> 29.199999999999996 | K40: =RC[-7]-RC[-4] -> 28.793999999999983 | L40: 25.797000000000001 | M40: 69.2 | R40: 1.762 | S40: 6.5 | T40: =(RC[-16]*RC[-15]-RC[-13]*RC[-12])/1000 -> 6.5019213999999987 | U40: 25.239000000000001 | W40: =RC[-2]*RC[-10]/1000 -> 1.7465387999999999 | X40: =ABS((RC[-3]*RC[-11]-RC[-2]*RC[-9])/1000) -> #VALUE! | Y40: =(RC[-14]-RC[1])/RC[-18]*100 -> 2.3182867502249698 | Z40: 25.239000000000001 | AC40: =VALUE(RC[-27]) -> 2018-10-19T00:00:00.000 | AD40: =IF(RC[21]=42,"*",IF(RC[21]=32,"",RC[21])) ->  | AE40: =RC[-28] -> 24 | AF40: =RC[-28] -> 182.14 | AG40: =RC[-28] -> 70.3 | AH40: =RC[-28] -> 7.61 | AI40: =RC[-28] -> 153.346 | AJ40: =RC[-28] -> 41.1 | AK40: =RC[-28] -> 5.77 | AL40: =RC[-28] -> 29.199999999999996 | AM40: =RC[-28] -> 28.793999999999983 | AN40: =RC[-28] -> 25.797000000000001 | AO40: =RC[-28] -> 69.2 | AP40: - | AQ40: =RC[-29] ->  | AR40: =RC[-29] ->  | AS40: - | AT40: =RC[-30] -> 0 | AU40: =RC[-30] ->  | AV40: =RC[-30] -> 1.762 | AW40: =RC[-30] -> 6.5
A41: =IF(RC[1]="","",DATEVALUE(RC[1])) -> 43393 | B41: 20.10.18 | C41: 24 | D41: 182.53200000000001 | E41: 69.400000000000006 | F41: 7.6 | G41: 151.72800000000001 | H41: 40.200000000000003 | I41: 5.77 | J41: =RC[-5]-RC[-2] -> 29.200000000000003 | K41: =RC[-7]-RC[-4] -> 30.804000000000002 | L41: 26.454999999999998 | M41: 68.2 | R41: 1.7849999999999999 | S41: 6.5640000000000001 | T41: =(RC[-16]*RC[-15]-RC[-13]*RC[-12])/1000 -> 6.5682552000000003 | U41: 25.895 | W41: =RC[-2]*RC[-10]/1000 -> 1.7660389999999999 | X41: =ABS((RC[-3]*RC[-11]-RC[-2]*RC[-9])/1000) -> #VALUE! | Y41: =(RC[-14]-RC[1])/RC[-18]*100 -> 3.2353949172202903 | Z41: 25.895 | AC41: =VALUE(RC[-27]) -> 2018-10-20T00:00:00.000 | AD41: =IF(RC[21]=42,"*",IF(RC[21]=32,"",RC[21])) ->  | AE41: =RC[-28] -> 24 | AF41: =RC[-28] -> 182.53200000000001 | AG41: =RC[-28] -> 69.400000000000006 | AH41: =RC[-28] -> 7.6 | AI41: =RC[-28] -> 151.72800000000001 | AJ41: =RC[-28] -> 40.200000000000003 | AK41: =RC[-28] -> 5.77 | AL41: =RC[-28] -> 29.200000000000003 | AM41: =RC[-28] -> 30.804000000000002 | AN41: =RC[-28] -> 26.454999999999998 | AO41: =RC[-28] -> 68.2 | AP41: - | AQ41: =RC[-29] ->  | AR41: =RC[-29] ->  | AS41: - | AT41: =RC[-30] -> 0 | AU41: =RC[-30] ->  | AV41: =RC[-30] -> 1.7849999999999999 | AW41: =RC[-30] -> 6.5640000000000001
A42: =IF(RC[1]="","",DATEVALUE(RC[1])) -> 43394 | B42: 21.10.18 | C42: 24 | D42: 183.167 | E42: 68.8 | F42: 7.6 | G42: 150.983 | H42: 39.700000000000003 | I42: 5.77 | J42: =RC[-5]-RC[-2] -> 29.099999999999994 | K42: =RC[-7]-RC[-4] -> 32.183999999999997 | L42: 27.114000000000001 | M42: 67.7 | R42: 1.8120000000000001 | S42: 6.601 | T42: =(RC[-16]*RC[-15]-RC[-13]*RC[-12])/1000 -> 6.6078644999999998 | U42: 26.550999999999998 | W42: =RC[-2]*RC[-10]/1000 -> 1.7975026999999999 | X42: =ABS((RC[-3]*RC[-11]-RC[-2]*RC[-9])/1000) -> #VALUE! | Y42: =(RC[-14]-RC[1])/RC[-18]*100 -> 3.73088360941298 | Z42: 26.550999999999998 | AC42: =VALUE(RC[-27]) -> 2018-10-21T00:00:00.000 | AD42: =IF(RC[21]=42,"*",IF(RC[21]=32,"",RC[21])) ->  | AE42: =RC[-28] -> 24 | AF42: =RC[-28] -> 183.167 | AG42: =RC[-28] -> 68.8 | AH42: =RC[-28] -> 7.6 | AI42: =RC[-28] -> 150.983 | AJ42: =RC[-28] -> 39.700000000000003 | AK42: =RC[-28] -> 5.77 | AL42: =RC[-28] -> 29.099999999999994 | AM42: =RC[-28] -> 32.183999999999997 | AN42: =RC[-28] -> 27.114000000000001 | AO42: =RC[-28] -> 67.7 | AP42: - | AQ42: =RC[-29] ->  | AR42: =RC[-29] ->  | AS42: - | AT42: =RC[-30] -> 0 | AU42: =RC[-30] ->  | AV42: =RC[-30] -> 1.8120000000000001 | AW42: =RC[-30] -> 6.601
A43: =IF(RC[1]="","",DATEVALUE(RC[1])) -> 43395 | B43: 22.10.18 | C43: 24 | D43: 184.39599999999999 | E43: 68.900000000000006 | F43: 7.61 | G43: 151.43899999999999 | H43: 39.5 | I43: 5.77 | J43: =RC[-5]-RC[-2] -> 29.400000000000006 | K43: =RC[-7]-RC[-4] -> 32.956999999999994 | L43: 28.401 | M43: 68.099999999999994 | R43: 1.903 | S43: 6.7370000000000001 | T43: =(RC[-16]*RC[-15]-RC[-13]*RC[-12])/1000 -> 6.7230439000000013 | U43: 27.808 | W43: =RC[-2]*RC[-10]/1000 -> 1.8937247999999998 | X43: =ABS((RC[-3]*RC[-11]-RC[-2]*RC[-9])/1000) -> #VALUE! | Y43: =(RC[-14]-RC[1])/RC[-18]*100 -> 3.4000488645593232 | Z43: 27.808 | AC43: =VALUE(RC[-27]) -> 2018-10-22T00:00:00.000 | AD43: =IF(RC[21]=42,"*",IF(RC[21]=32,"",RC[21])) ->  | AE43: =RC[-28] -> 24 | AF43: =RC[-28] -> 184.39599999999999 | AG43: =RC[-28] -> 68.900000000000006 | AH43: =RC[-28] -> 7.61 | AI43: =RC[-28] -> 151.43899999999999 | AJ43: =RC[-28] -> 39.5 | AK43: =RC[-28] -> 5.77 | AL43: =RC[-28] -> 29.400000000000006 | AM43: =RC[-28] -> 32.956999999999994 | AN43: =RC[-28] -> 28.401 | AO43: =RC[-28] -> 68.099999999999994 | AP43: - | AQ43: =RC[-29] ->  | AR43: =RC[-29] ->  | AS43: - | AT43: =RC[-30] -> 0 | AU43: =RC[-30] ->  | AV43: =RC[-30] -> 1.903 | AW43: =RC[-30] -> 6.7370000000000001
A44: =IF(RC[1]="","",DATEVALUE(RC[1])) ->  | C44: 24 | J44: =RC[-5]-RC[-2] -> #VALUE! | K44: =RC[-7]-RC[-4] -> #VALUE! | T44: =(RC[-16]*RC[-15]-RC[-13]*RC[-12])/1000 -> #VALUE! | W44: =RC[-2]*RC[-10]/1000 -> #VALUE! | X44: =ABS((RC[-3]*RC[-11]-RC[-2]*RC[-9])/1000) -> #VALUE! | Y44: =(RC[-14]-RC[1])/RC[-18]*100 -> #VALUE! | AC44: =VALUE(RC[-27]) -> #VALUE! | AD44: =IF(RC[21]=42,"*",IF(RC[21]=32,"",RC[21])) ->  | AE44: =RC[-28] -> 24 | AF44: =RC[-28] ->  | AG44: =RC[-28] ->  | AH44: =RC[-28] ->  | AI44: =RC[-28] ->  | AJ44: =RC[-28] ->  | AK44: =RC[-28] ->  | AL44: =RC[-28] -> #VALUE! | AM44: =RC[-28] -> #VALUE! | AN44: =RC[-28] ->  | AO44: =RC[-28] ->  | AP44: - | AQ44: =RC[-29] ->  | AR44: =RC[-29] ->  | AS44: - | AT44: =RC[-30] -> 0 | AU44: =RC[-30] ->  | AV44: =RC[-30] ->  | AW44: =RC[-30] -> 
A45: =IF(RC[1]="","",DATEVALUE(RC[1])) ->  | C45: 24 | K45: =RC[-7]-RC[-4] -> #VALUE! | T45: =(RC[-16]*RC[-15]-RC[-13]*RC[-12])/1000 -> #VALUE! | W45: =RC[-2]*RC[-10]/1000 -> #VALUE! | X45: =ABS((RC[-3]*RC[-11]-RC[-2]*RC[-9])/1000) -> #VALUE! | Y45: =(RC[-14]-RC[1])/RC[-18]*100 -> #VALUE! | AC45: =VALUE(RC[-27]) -> #VALUE! | AD45: =IF(RC[21]=42,"*",IF(RC[21]=32,"",RC[21])) ->  | AE45: =RC[-28] -> 24 | AF45: =RC[-28] ->  | AG45: =RC[-28] ->  | AH45: =RC[-28] ->  | AI45: =RC[-28] ->  | AJ45: =RC[-28] ->  | AK45: =RC[-28] ->  | AL45: =RC[-28] -> 0 | AM45: =RC[-28] -> #VALUE! | AN45: =RC[-28] ->  | AO45: =RC[-28] ->  | AP45: - | AQ45: =RC[-29] ->  | AR45: =RC[-29] ->  | AS45: - | AT45: =RC[-30] -> 0 | AU45: =RC[-30] ->  | AV45: =RC[-30] ->  | AW45: =RC[-30] -> 
A46: =IF(RC[1]="","",DATEVALUE(RC[1])) ->  | C46: 24 | K46: =RC[-7]-RC[-4] -> #VALUE! | T46: =(RC[-16]*RC[-15]-RC[-13]*RC[-12])/1000 -> #VALUE! | W46: =RC[-2]*RC[-10]/1000 -> #VALUE! | X46: =ABS((RC[-3]*RC[-11]-RC[-2]*RC[-9])/1000) -> #VALUE! | Y46: =(RC[-14]-RC[1])/RC[-18]*100 -> #VALUE! | AC46: =VALUE(RC[-27]) -> #VALUE! | AD46: =IF(RC[21]=42,"*",IF(RC[21]=32,"",RC[21])) ->  | AE46: =RC[-28] -> 24 | AF46: =RC[-28] ->  | AG46: =RC[-28] ->  | AH46: =RC[-28] ->  | AI46: =RC[-28] ->  | AJ46: =RC[-28] ->  | AK46: =RC[-28] ->  | AL46: =RC[-28] -> 0 | AM46: =RC[-28] -> #VALUE! | AN46: =RC[-28] ->  | AO46: =RC[-28] ->  | AP46: - | AQ46: =RC[-29] ->  | AR46: =RC[-29] ->  | AS46: - | AT46: =RC[-30] -> 0 | AU46: =RC[-30] ->  | AV46: =RC[-30] ->  | AW46: =RC[-30] -> 
A47: =IF(RC[1]="","",DATEVALUE(RC[1])) ->  | C47: 24 | K47: =RC[-7]-RC[-4] -> #VALUE! | T47: =(RC[-16]*RC[-15]-RC[-13]*RC[-12])/1000 -> #VALUE! | W47: =RC[-2]*RC[-10]/1000 -> #VALUE! | X47: =ABS((RC[-3]*RC[-11]-RC[-2]*RC[-9])/1000) -> #VALUE! | Y47: =(RC[-14]-RC[1])/RC[-18]*100 -> #VALUE! | AC47: =VALUE(RC[-27]) -> #VALUE! | AD47: =IF(RC[21]=42,"*",IF(RC[21]=32,"",RC[21])) ->  | AE47: =RC[-28] -> 24 | AF47: =RC[-28] ->  | AG47: =RC[-28] ->  | AH47: =RC[-28] ->  | AI47: =RC[-28] ->  | AJ47: =RC[-28] ->  | AK47: =RC[-28] ->  | AL47: =RC[-28] -> 0 | AM47: =RC[-28] -> #VALUE! | AN47: =RC[-28] ->  | AO47: =RC[-28] ->  | AP47: - | AQ47: =RC[-29] ->  | AR47: =RC[-29] ->  | AS47: - | AT47: =RC[-30] -> 0 | AU47: =RC[-30] ->  | AV47: =RC[-30] ->  | AW47: =RC[-30] -> 
A48: =IF(RC[1]="","",DATEVALUE(RC[1])) ->  | C48: 24 | K48: =RC[-7]-RC[-4] -> #VALUE! | T48: =(RC[-16]*RC[-15]-RC[-13]*RC[-12])/1000 -> #VALUE! | W48: =RC[-2]*RC[-10]/1000 -> #VALUE! | X48: =ABS((RC[-3]*RC[-11]-RC[-2]*RC[-9])/1000) -> #VALUE! | Y48: =(RC[-14]-RC[1])/RC[-18]*100 -> #VALUE! | AC48: =VALUE(RC[-27]) -> #VALUE! | AD48: =IF(RC[21]=42,"*",IF(RC[21]=32,"",RC[21])) ->  | AE48: =RC[-28] -> 24 | AF48: =RC[-28] ->  | AG48: =RC[-28] ->  | AH48: =RC[-28] ->  | AI48: =RC[-28] ->  | AJ48: =RC[-28] ->  | AK48: =RC[-28] ->  | AL48: =RC[-28] -> 0 | AM48: =RC[-28] -> #VALUE! | AN48: =RC[-28] ->  | AO48: =RC[-28] ->  | AP48: - | AQ48: =RC[-29] ->  | AR48: =RC[-29] ->  | AS48: - | AT48: =RC[-30] -> 0 | AU48: =RC[-30] ->  | AV48: =RC[-30] ->  | AW48: =RC[-30] -> 
A49: =IF(RC[1]="","",DATEVALUE(RC[1])) ->  | C49: 24 | K49: =RC[-7]-RC[-4] -> #VALUE! | T49: =(RC[-16]*RC[-15]-RC[-13]*RC[-12])/1000 -> #VALUE! | W49: =RC[-2]*RC[-10]/1000 -> #VALUE! | X49: =ABS((RC[-3]*RC[-11]-RC[-2]*RC[-9])/1000) -> #VALUE! | Y49: =(RC[-14]-RC[1])/RC[-18]*100 -> #VALUE! | AC49: =VALUE(RC[-27]) -> #VALUE! | AD49: =IF(RC[21]=42,"*",IF(RC[21]=32,"",RC[21])) ->  | AE49: =RC[-28] -> 24 | AF49: =RC[-28] ->  | AG49: =RC[-28] ->  | AH49: =RC[-28] ->  | AI49: =RC[-28] ->  | AJ49: =RC[-28] ->  | AK49: =RC[-28] ->  | AL49: =RC[-28] -> 0 | AM49: =RC[-28] -> #VALUE! | AN49: =RC[-28] ->  | AO49: =RC[-28] ->  | AP49: - | AQ49: =RC[-29] ->  | AR49: =RC[-29] ->  | AS49: - | AT49: =RC[-30] -> 0 | AU49: =RC[-30] ->  | AV49: =RC[-30] ->  | AW49: =RC[-30] -> 
A50: =IF(RC[1]="","",DATEVALUE(RC[1])) ->  | K50: =RC[-7]-RC[-4] -> #VALUE! | T50: =(RC[-16]*RC[-15]-RC[-13]*RC[-12])/1000 -> #VALUE! | W50: =RC[-2]*RC[-10]/1000 -> #VALUE! | X50: =ABS((RC[-3]*RC[-11]-RC[-2]*RC[-9])/1000) -> #VALUE! | Y50: =(RC[-14]-RC[1])/RC[-18]*100 -> #VALUE! | AC50: =VALUE(RC[-27]) -> #VALUE! | AD50: =IF(RC[21]=42,"*",IF(RC[21]=32,"",RC[21])) ->  | AE50: =RC[-28] ->  | AF50: =RC[-28] ->  | AG50: =RC[-28] ->  | AH50: =RC[-28] ->  | AI50: =RC[-28] ->  | AJ50: =RC[-28] ->  | AK50: =RC[-28] ->  | AL50: =RC[-28] -> 0 | AM50: =RC[-28] -> #VALUE! | AN50: =RC[-28] ->  | AO50: =RC[-28] ->  | AP50: - | AQ50: =RC[-29] ->  | AR50: =RC[-29] ->  | AS50: - | AT50: =RC[-30] -> 0 | AU50: =RC[-30] ->  | AV50: =RC[-30] ->  | AW50: =RC[-30] -> 
A51: =IF(RC[1]="","",DATEVALUE(RC[1])) ->  | K51: =RC[-7]-RC[-4] -> #VALUE! | T51: =(RC[-16]*RC[-15]-RC[-13]*RC[-12])/1000 -> #VALUE! | W51: =RC[-2]*RC[-10]/1000 -> #VALUE! | X51: =ABS((RC[-3]*RC[-11]-RC[-2]*RC[-9])/1000) -> #VALUE! | Y51: =(RC[-14]-RC[1])/RC[-18]*100 -> #VALUE! | AC51: =VALUE(RC[-27]) -> #VALUE! | AD51: =IF(RC[21]=42,"*",IF(RC[21]=32,"",RC[21])) ->  | AE51: =RC[-28] ->  | AF51: =RC[-28] ->  | AG51: =RC[-28] ->  | AH51: =RC[-28] ->  | AI51: =RC[-28] ->  | AJ51: =RC[-28] ->  | AK51: =RC[-28] ->  | AL51: =RC[-28] -> 0 | AM51: =RC[-28] -> #VALUE! | AN51: =RC[-28] ->  | AO51: =RC[-28] ->  | AP51: - | AQ51: =RC[-29] ->  | AR51: =RC[-29] ->  | AS51: - | AT51: =RC[-30] -> 0 | AU51: =RC[-30] ->  | AV51: =RC[-30] ->  | AW51: =RC[-30] -> 
A52: =IF(RC[1]="","",DATEVALUE(RC[1])) ->  | K52: =RC[-7]-RC[-4] -> #VALUE! | T52: =(RC[-16]*RC[-15]-RC[-13]*RC[-12])/1000 -> #VALUE! | W52: =RC[-2]*RC[-10]/1000 -> #VALUE! | X52: =ABS((RC[-3]*RC[-11]-RC[-2]*RC[-9])/1000) -> #VALUE! | Y52: =(RC[-14]-RC[1])/RC[-18]*100 -> #VALUE! | AC52: =VALUE(RC[-27]) -> #VALUE! | AD52: =IF(RC[21]=42,"*",IF(RC[21]=32,"",RC[21])) ->  | AE52: =RC[-28] ->  | AF52: =RC[-28] ->  | AG52: =RC[-28] ->  | AH52: =RC[-28] ->  | AI52: =RC[-28] ->  | AJ52: =RC[-28] ->  | AK52: =RC[-28] ->  | AL52: =RC[-28] -> 0 | AM52: =RC[-28] -> #VALUE! | AN52: =RC[-28] ->  | AO52: =RC[-28] ->  | AP52: - | AQ52: =RC[-29] ->  | AR52: =RC[-29] ->  | AS52: - | AT52: =RC[-30] -> 0 | AU52: =RC[-30] ->  | AV52: =RC[-30] ->  | AW52: =RC[-30] -> 
A53: =IF(RC[1]="","",DATEVALUE(RC[1])) ->  | K53: =RC[-7]-RC[-4] -> #VALUE! | T53: =(RC[-16]*RC[-15]-RC[-13]*RC[-12])/1000 -> #VALUE! | W53: =RC[-2]*RC[-10]/1000 -> #VALUE! | X53: =ABS((RC[-3]*RC[-11]-RC[-2]*RC[-9])/1000) -> #VALUE! | Y53: =(RC[-14]-RC[1])/RC[-18]*100 -> #VALUE! | AC53: =VALUE(RC[-27]) -> #VALUE! | AD53: =IF(RC[21]=42,"*",IF(RC[21]=32,"",RC[21])) ->  | AE53: =RC[-28] ->  | AF53: =RC[-28] ->  | AG53: =RC[-28] ->  | AH53: =RC[-28] ->  | AI53: =RC[-28] ->  | AJ53: =RC[-28] ->  | AK53: =RC[-28] ->  | AL53: =RC[-28] -> 0 | AM53: =RC[-28] -> #VALUE! | AN53: =RC[-28] ->  | AO53: =RC[-28] ->  | AP53: - | AQ53: =RC[-29] ->  | AR53: =RC[-29] ->  | AS53: - | AT53: =RC[-30] -> 0 | AU53: =RC[-30] ->  | AV53: =RC[-30] ->  | AW53: =RC[-30] -> 
A54: =IF(RC[1]="","",DATEVALUE(RC[1])) ->  | K54: =RC[-7]-RC[-4] -> #VALUE! | T54: =(RC[-16]*RC[-15]-RC[-13]*RC[-12])/1000 -> #VALUE! | W54: =RC[-2]*RC[-10]/1000 -> #VALUE! | X54: =ABS((RC[-3]*RC[-11]-RC[-2]*RC[-9])/1000) -> #VALUE! | Y54: =(RC[-14]-RC[1])/RC[-18]*100 -> #VALUE! | AC54: =VALUE(RC[-27]) -> #VALUE! | AD54: =IF(RC[21]=42,"*",IF(RC[21]=32,"",RC[21])) ->  | AE54: =RC[-28] ->  | AF54: =RC[-28] ->  | AG54: =RC[-28] ->  | AH54: =RC[-28] ->  | AI54: =RC[-28] ->  | AJ54: =RC[-28] ->  | AK54: =RC[-28] ->  | AL54: =RC[-28] -> 0 | AM54: =RC[-28] -> #VALUE! | AN54: =RC[-28] ->  | AO54: =RC[-28] ->  | AP54: - | AQ54: =RC[-29] ->  | AR54: =RC[-29] ->  | AS54: - | AT54: =RC[-30] -> 0 | AU54: =RC[-30] ->  | AV54: =RC[-30] ->  | AW54: =RC[-30] -> 
A55: =IF(RC[1]="","",DATEVALUE(RC[1])) ->  | K55: =RC[-7]-RC[-4] -> #VALUE! | T55: =(RC[-16]*RC[-15]-RC[-13]*RC[-12])/1000 -> #VALUE! | W55: =RC[-2]*RC[-10]/1000 -> #VALUE! | X55: =ABS((RC[-3]*RC[-11]-RC[-2]*RC[-9])/1000) -> #VALUE! | Y55: =(RC[-14]-RC[1])/RC[-18]*100 -> #VALUE! | AC55: =VALUE(RC[-27]) -> #VALUE! | AD55: =IF(RC[21]=42,"*",IF(RC[21]=32,"",RC[21])) ->  | AE55: =RC[-28] ->  | AF55: =RC[-28] ->  | AG55: =RC[-28] ->  | AH55: =RC[-28] ->  | AI55: =RC[-28] ->  | AJ55: =RC[-28] ->  | AK55: =RC[-28] ->  | AL55: =RC[-28] -> 0 | AM55: =RC[-28] -> #VALUE! | AN55: =RC[-28] ->  | AO55: =RC[-28] ->  | AP55: - | AQ55: =RC[-29] ->  | AR55: =RC[-29] ->  | AS55: - | AT55: =RC[-30] -> 0 | AU55: =RC[-30] ->  | AV55: =RC[-30] ->  | AW55: =RC[-30] -> 
A56: =IF(RC[1]="","",DATEVALUE(RC[1])) ->  | K56: =RC[-7]-RC[-4] -> #VALUE! | T56: =(RC[-16]*RC[-15]-RC[-13]*RC[-12])/1000 -> #VALUE! | W56: =RC[-2]*RC[-10]/1000 -> #VALUE! | X56: =ABS((RC[-3]*RC[-11]-RC[-2]*RC[-9])/1000) -> #VALUE! | Y56: =(RC[-14]-RC[1])/RC[-18]*100 -> #VALUE! | AC56: =VALUE(RC[-27]) -> #VALUE! | AD56: =IF(RC[21]=42,"*",IF(RC[21]=32,"",RC[21])) ->  | AE56: =RC[-28] ->  | AF56: =RC[-28] ->  | AG56: =RC[-28] ->  | AH56: =RC[-28] ->  | AI56: =RC[-28] ->  | AJ56: =RC[-28] ->  | AK56: =RC[-28] ->  | AL56: =RC[-28] -> 0 | AM56: =RC[-28] -> #VALUE! | AN56: =RC[-28] ->  | AO56: =RC[-28] ->  | AP56: - | AQ56: =RC[-29] ->  | AR56: =RC[-29] ->  | AS56: - | AT56: =RC[-30] -> 0 | AU56: =RC[-30] ->  | AV56: =RC[-30] ->  | AW56: =RC[-30] -> 
A57: =IF(RC[1]="","",DATEVALUE(RC[1])) ->  | K57: =RC[-7]-RC[-4] -> #VALUE! | T57: =(RC[-16]*RC[-15]-RC[-13]*RC[-12])/1000 -> #VALUE! | W57: =RC[-2]*RC[-10]/1000 -> #VALUE! | X57: =ABS((RC[-3]*RC[-11]-RC[-2]*RC[-9])/1000) -> #VALUE! | Y57: =(RC[-14]-RC[1])/RC[-18]*100 -> #VALUE! | AC57: =VALUE(RC[-27]) -> #VALUE! | AD57: =IF(RC[21]=42,"*",IF(RC[21]=32,"",RC[21])) ->  | AE57: =RC[-28] ->  | AF57: =RC[-28] ->  | AG57: =RC[-28] ->  | AH57: =RC[-28] ->  | AI57: =RC[-28] ->  | AJ57: =RC[-28] ->  | AK57: =RC[-28] ->  | AL57: =RC[-28] -> 0 | AM57: =RC[-28] -> #VALUE! | AN57: =RC[-28] ->  | AO57: =RC[-28] ->  | AP57: - | AQ57: =RC[-29] ->  | AR57: =RC[-29] ->  | AS57: - | AT57: =RC[-30] -> 0 | AU57: =RC[-30] ->  | AV57: =RC[-30] ->  | AW57: =RC[-30] -> 
A58: =IF(RC[1]="","",DATEVALUE(RC[1])) ->  | K58: =RC[-7]-RC[-4] -> #VALUE! | T58: =(RC[-16]*RC[-15]-RC[-13]*RC[-12])/1000 -> #VALUE! | W58: =RC[-2]*RC[-10]/1000 -> #VALUE! | X58: =ABS((RC[-3]*RC[-11]-RC[-2]*RC[-9])/1000) -> #VALUE! | Y58: =(RC[-14]-RC[1])/RC[-18]*100 -> #VALUE! | AC58: =VALUE(RC[-27]) -> #VALUE! | AD58: =IF(RC[21]=42,"*",IF(RC[21]=32,"",RC[21])) ->  | AE58: =RC[-28] ->  | AF58: =RC[-28] ->  | AG58: =RC[-28] ->  | AH58: =RC[-28] ->  | AI58: =RC[-28] ->  | AJ58: =RC[-28] ->  | AK58: =RC[-28] ->  | AL58: =RC[-28] -> 0 | AM58: =RC[-28] -> #VALUE! | AN58: =RC[-28] ->  | AO58: =RC[-28] ->  | AP58: - | AQ58: =RC[-29] ->  | AR58: =RC[-29] ->  | AS58: - | AT58: =RC[-30] -> 0 | AU58: =RC[-30] ->  | AV58: =RC[-30] ->  | AW58: =RC[-30] -> 
A59: =IF(RC[1]="","",DATEVALUE(RC[1])) ->  | K59: =RC[-7]-RC[-4] -> #VALUE! | T59: =(RC[-16]*RC[-15]-RC[-13]*RC[-12])/1000 -> #VALUE! | W59: =RC[-2]*RC[-10]/1000 -> #VALUE! | X59: =ABS((RC[-3]*RC[-11]-RC[-2]*RC[-9])/1000) -> #VALUE! | Y59: =(RC[-14]-RC[1])/RC[-18]*100 -> #VALUE! | AC59: =VALUE(RC[-27]) -> #VALUE! | AD59: =IF(RC[21]=42,"*",IF(RC[21]=32,"",RC[21])) ->  | AE59: =RC[-28] ->  | AF59: =RC[-28] ->  | AG59: =RC[-28] ->  | AH59: =RC[-28] ->  | AI59: =RC[-28] ->  | AJ59: =RC[-28] ->  | AK59: =RC[-28] ->  | AL59: =RC[-28] -> 0 | AM59: =RC[-28] -> #VALUE! | AN59: =RC[-28] ->  | AO59: =RC[-28] ->  | AP59: - | AQ59: =RC[-29] ->  | AR59: =RC[-29] ->  | AS59: - | AT59: =RC[-30] -> 0 | AU59: =RC[-30] ->  | AV59: =RC[-30] ->  | AW59: =RC[-30] -> 
A60: =IF(RC[1]="","",DATEVALUE(RC[1])) ->  | K60: =RC[-7]-RC[-4] -> #VALUE! | T60: =(RC[-16]*RC[-15]-RC[-13]*RC[-12])/1000 -> #VALUE! | W60: =RC[-2]*RC[-10]/1000 -> #VALUE! | X60: =ABS((RC[-3]*RC[-11]-RC[-2]*RC[-9])/1000) -> #VALUE! | Y60: =(RC[-14]-RC[1])/RC[-18]*100 -> #VALUE! | AC60: =VALUE(RC[-27]) -> #VALUE! | AD60: =IF(RC[21]=42,"*",IF(RC[21]=32,"",RC[21])) ->  | AE60: =RC[-28] ->  | AF60: =RC[-28] ->  | AG60: =RC[-28] ->  | AH60: =RC[-28] ->  | AI60: =RC[-28] ->  | AJ60: =RC[-28] ->  | AK60: =RC[-28] ->  | AL60: =RC[-28] -> 0 | AM60: =RC[-28] -> #VALUE! | AN60: =RC[-28] ->  | AO60: =RC[-28] ->  | AP60: - | AQ60: =RC[-29] ->  | AR60: =RC[-29] ->  | AS60: - | AT60: =RC[-30] -> 0 | AU60: =RC[-30] ->  | AV60: =RC[-30] ->  | AW60: =RC[-30] -> 
A61: =IF(RC[1]="","",DATEVALUE(RC[1])) ->  | K61: =RC[-7]-RC[-4] -> #VALUE! | T61: =(RC[-16]*RC[-15]-RC[-13]*RC[-12])/1000 -> #VALUE! | W61: =RC[-2]*RC[-10]/1000 -> #VALUE! | X61: =ABS((RC[-3]*RC[-11]-RC[-2]*RC[-9])/1000) -> #VALUE! | Y61: =(RC[-14]-RC[1])/RC[-18]*100 -> #VALUE! | AC61: =VALUE(RC[-27]) -> #VALUE! | AD61: =IF(RC[21]=42,"*",IF(RC[21]=32,"",RC[21])) ->  | AE61: =RC[-28] ->  | AF61: =RC[-28] ->  | AG61: =RC[-28] ->  | AH61: =RC[-28] ->  | AI61: =RC[-28] ->  | AJ61: =RC[-28] ->  | AK61: =RC[-28] ->  | AL61: =RC[-28] -> 0 | AM61: =RC[-28] -> #VALUE! | AN61: =RC[-28] ->  | AO61: =RC[-28] ->  | AP61: - | AQ61: =RC[-29] ->  | AR61: =RC[-29] ->  | AS61: - | AT61: =RC[-30] -> 0 | AU61: =RC[-30] ->  | AV61: =RC[-30] ->  | AW61: =RC[-30] -> 
A62: =IF(RC[1]="","",DATEVALUE(RC[1])) ->  | K62: =RC[-7]-RC[-4] -> #VALUE! | T62: =(RC[-16]*RC[-15]-RC[-13]*RC[-12])/1000 -> #VALUE! | W62: =RC[-2]*RC[-10]/1000 -> #VALUE! | X62: =ABS((RC[-3]*RC[-11]-RC[-2]*RC[-9])/1000) -> #VALUE! | Y62: =(RC[-14]-RC[1])/RC[-18]*100 -> #VALUE! | AC62: =VALUE(RC[-27]) -> #VALUE! | AD62: =IF(RC[21]=42,"*",IF(RC[21]=32,"",RC[21])) ->  | AE62: =RC[-28] ->  | AF62: =RC[-28] ->  | AG62: =RC[-28] ->  | AH62: =RC[-28] ->  | AI62: =RC[-28] ->  | AJ62: =RC[-28] ->  | AK62: =RC[-28] ->  | AL62: =RC[-28] -> 0 | AM62: =RC[-28] -> #VALUE! | AN62: =RC[-28] ->  | AO62: =RC[-28] ->  | AP62: - | AQ62: =RC[-29] ->  | AR62: =RC[-29] ->  | AS62: - | AT62: =RC[-30] -> 0 | AU62: =RC[-30] ->  | AV62: =RC[-30] ->  | AW62: =RC[-30] -> 
A63: =IF(RC[1]="","",DATEVALUE(RC[1])) ->  | K63: =RC[-7]-RC[-4] -> #VALUE! | T63: =(RC[-16]*RC[-15]-RC[-13]*RC[-12])/1000 -> #VALUE! | W63: =RC[-2]*RC[-10]/1000 -> #VALUE! | X63: =ABS((RC[-3]*RC[-11]-RC[-2]*RC[-9])/1000) -> #VALUE! | Y63: =(RC[-14]-RC[1])/RC[-18]*100 -> #VALUE! | AC63: =VALUE(RC[-27]) -> #VALUE! | AD63: =IF(RC[21]=42,"*",IF(RC[21]=32,"",RC[21])) ->  | AE63: =RC[-28] ->  | AF63: =RC[-28] ->  | AG63: =RC[-28] ->  | AH63: =RC[-28] ->  | AI63: =RC[-28] ->  | AJ63: =RC[-28] ->  | AK63: =RC[-28] ->  | AL63: =RC[-28] -> 0 | AM63: =RC[-28] -> #VALUE! | AN63: =RC[-28] ->  | AO63: =RC[-28] ->  | AP63: - | AQ63: =RC[-29] ->  | AR63: =RC[-29] ->  | AS63: - | AT63: =RC[-30] -> 0 | AU63: =RC[-30] ->  | AV63: =RC[-30] ->  | AW63: =RC[-30] -> 
A64: =IF(RC[1]="","",DATEVALUE(RC[1])) ->  | K64: =RC[-7]-RC[-4] -> #VALUE! | T64: =(RC[-16]*RC[-15]-RC[-13]*RC[-12])/1000 -> #VALUE! | W64: =RC[-2]*RC[-10]/1000 -> #VALUE! | X64: =ABS((RC[-3]*RC[-11]-RC[-2]*RC[-9])/1000) -> #VALUE! | Y64: =(RC[-14]-RC[1])/RC[-18]*100 -> #VALUE! | AC64: =VALUE(RC[-27]) -> #VALUE! | AD64: =IF(RC[21]=42,"*",IF(RC[21]=32,"",RC[21])) ->  | AE64: =RC[-28] ->  | AF64: =RC[-28] ->  | AG64: =RC[-28] ->  | AH64: =RC[-28] ->  | AI64: =RC[-28] ->  | AJ64: =RC[-28] ->  | AK64: =RC[-28] ->  | AL64: =RC[-28] -> 0 | AM64: =RC[-28] -> #VALUE! | AN64: =RC[-28] ->  | AO64: =RC[-28] ->  | AP64: - | AQ64: =RC[-29] ->  | AR64: =RC[-29] ->  | AS64: - | AT64: =RC[-30] -> 0 | AU64: =RC[-30] ->  | AV64: =RC[-30] ->  | AW64: =RC[-30] -> 
A65: =IF(RC[1]="","",DATEVALUE(RC[1])) ->  | K65: =RC[-7]-RC[-4] -> #VALUE! | T65: =(RC[-16]*RC[-15]-RC[-13]*RC[-12])/1000 -> #VALUE! | W65: =RC[-2]*RC[-10]/1000 -> #VALUE! | X65: =ABS((RC[-3]*RC[-11]-RC[-2]*RC[-9])/1000) -> #VALUE! | Y65: =(RC[-14]-RC[1])/RC[-18]*100 -> #VALUE! | AC65: =VALUE(RC[-27]) -> #VALUE! | AD65: =IF(RC[21]=42,"*",IF(RC[21]=32,"",RC[21])) ->  | AE65: =RC[-28] ->  | AF65: =RC[-28] ->  | AG65: =RC[-28] ->  | AH65: =RC[-28] ->  | AI65: =RC[-28] ->  | AJ65: =RC[-28] ->  | AK65: =RC[-28] ->  | AL65: =RC[-28] -> 0 | AM65: =RC[-28] -> #VALUE! | AN65: =RC[-28] ->  | AO65: =RC[-28] ->  | AP65: - | AQ65: =RC[-29] ->  | AR65: =RC[-29] ->  | AS65: - | AT65: =RC[-30] -> 0 | AU65: =RC[-30] ->  | AV65: =RC[-30] ->  | AW65: =RC[-30] -> 
A66: =IF(RC[1]="","",DATEVALUE(RC[1])) ->  | K66: =RC[-7]-RC[-4] -> #VALUE! | T66: =(RC[-16]*RC[-15]-RC[-13]*RC[-12])/1000 -> #VALUE! | W66: =RC[-2]*RC[-10]/1000 -> #VALUE! | X66: =ABS((RC[-3]*RC[-11]-RC[-2]*RC[-9])/1000) -> #VALUE! | Y66: =(RC[-14]-RC[1])/RC[-18]*100 -> #VALUE! | AC66: =VALUE(RC[-27]) -> #VALUE! | AD66: =IF(RC[21]=42,"*",IF(RC[21]=32,"",RC[21])) ->  | AE66: =RC[-28] ->  | AF66: =RC[-28] ->  | AG66: =RC[-28] ->  | AH66: =RC[-28] ->  | AI66: =RC[-28] ->  | AJ66: =RC[-28] ->  | AK66: =RC[-28] ->  | AL66: =RC[-28] -> 0 | AM66: =RC[-28] -> #VALUE! | AN66: =RC[-28] ->  | AO66: =RC[-28] ->  | AP66: - | AQ66: =RC[-29] ->  | AR66: =RC[-29] ->  | AS66: - | AT66: =RC[-30] -> 0 | AU66: =RC[-30] ->  | AV66: =RC[-30] ->  | AW66: =RC[-30] -> 
A67: =IF(RC[1]="","",DATEVALUE(RC[1])) ->  | K67: =RC[-7]-RC[-4] -> #VALUE! | T67: =(RC[-16]*RC[-15]-RC[-13]*RC[-12])/1000 -> #VALUE! | W67: =RC[-2]*RC[-10]/1000 -> #VALUE! | X67: =ABS((RC[-3]*RC[-11]-RC[-2]*RC[-9])/1000) -> #VALUE! | Y67: =(RC[-14]-RC[1])/RC[-18]*100 -> #VALUE! | AC67: =VALUE(RC[-27]) -> #VALUE! | AD67: =IF(RC[21]=42,"*",IF(RC[21]=32,"",RC[21])) ->  | AE67: =RC[-28] ->  | AF67: =RC[-28] ->  | AG67: =RC[-28] ->  | AH67: =RC[-28] ->  | AI67: =RC[-28] ->  | AJ67: =RC[-28] ->  | AK67: =RC[-28] ->  | AL67: =RC[-28] -> 0 | AM67: =RC[-28] -> #VALUE! | AN67: =RC[-28] ->  | AO67: =RC[-28] ->  | AP67: - | AQ67: =RC[-29] ->  | AR67: =RC[-29] ->  | AS67: - | AT67: =RC[-30] -> 0 | AU67: =RC[-30] ->  | AV67: =RC[-30] ->  | AW67: =RC[-30] -> 
A68: =IF(RC[1]="","",DATEVALUE(RC[1])) ->  | K68: =RC[-7]-RC[-4] -> #VALUE! | T68: =(RC[-16]*RC[-15]-RC[-13]*RC[-12])/1000 -> #VALUE! | W68: =RC[-2]*RC[-10]/1000 -> #VALUE! | X68: =ABS((RC[-3]*RC[-11]-RC[-2]*RC[-9])/1000) -> #VALUE! | Y68: =(RC[-14]-RC[1])/RC[-18]*100 -> #VALUE! | AC68: =VALUE(RC[-27]) -> #VALUE! | AD68: =IF(RC[21]=42,"*",IF(RC[21]=32,"",RC[21])) ->  | AE68: =RC[-28] ->  | AF68: =RC[-28] ->  | AG68: =RC[-28] ->  | AH68: =RC[-28] ->  | AI68: =RC[-28] ->  | AJ68: =RC[-28] ->  | AK68: =RC[-28] ->  | AL68: =RC[-28] -> 0 | AM68: =RC[-28] -> #VALUE! | AN68: =RC[-28] ->  | AO68: =RC[-28] ->  | AP68: - | AQ68: =RC[-29] ->  | AR68: =RC[-29] ->  | AS68: - | AT68: =RC[-30] -> 0 | AU68: =RC[-30] ->  | AV68: =RC[-30] ->  | AW68: =RC[-30] -> 
A69: =IF(RC[1]="","",DATEVALUE(RC[1])) ->  | K69: =RC[-7]-RC[-4] -> #VALUE! | T69: =(RC[-16]*RC[-15]-RC[-13]*RC[-12])/1000 -> #VALUE! | W69: =RC[-2]*RC[-10]/1000 -> #VALUE! | X69: =ABS((RC[-3]*RC[-11]-RC[-2]*RC[-9])/1000) -> #VALUE! | Y69: =(RC[-14]-RC[1])/RC[-18]*100 -> #VALUE! | AC69: =VALUE(RC[-27]) -> #VALUE! | AD69: =IF(RC[21]=42,"*",IF(RC[21]=32,"",RC[21])) ->  | AE69: =RC[-28] ->  | AF69: =RC[-28] ->  | AG69: =RC[-28] ->  | AH69: =RC[-28] ->  | AI69: =RC[-28] ->  | AJ69: =RC[-28] ->  | AK69: =RC[-28] ->  | AL69: =RC[-28] -> 0 | AM69: =RC[-28] -> #VALUE! | AN69: =RC[-28] ->  | AO69: =RC[-28] ->  | AP69: - | AQ69: =RC[-29] ->  | AR69: =RC[-29] ->  | AS69: - | AT69: =RC[-30] -> 0 | AU69: =RC[-30] ->  | AV69: =RC[-30] ->  | AW69: =RC[-30] -> 
A70: =IF(RC[1]="","",DATEVALUE(RC[1])) ->  | K70: =RC[-7]-RC[-4] -> #VALUE! | T70: =(RC[-16]*RC[-15]-RC[-13]*RC[-12])/1000 -> #VALUE! | W70: =RC[-2]*RC[-10]/1000 -> #VALUE! | X70: =ABS((RC[-3]*RC[-11]-RC[-2]*RC[-9])/1000) -> #VALUE! | Y70: =(RC[-14]-RC[1])/RC[-18]*100 -> #VALUE! | AC70: =VALUE(RC[-27]) -> #VALUE! | AD70: =IF(RC[21]=42,"*",IF(RC[21]=32,"",RC[21])) ->  | AE70: =RC[-28] ->  | AF70: =RC[-28] ->  | AG70: =RC[-28] ->  | AH70: =RC[-28] ->  | AI70: =RC[-28] ->  | AJ70: =RC[-28] ->  | AK70: =RC[-28] ->  | AL70: =RC[-28] -> 0 | AM70: =RC[-28] -> #VALUE! | AN70: =RC[-28] ->  | AO70: =RC[-28] ->  | AP70: - | AQ70: =RC[-29] ->  | AR70: =RC[-29] ->  | AS70: - | AT70: =RC[-30] -> 0 | AU70: =RC[-30] ->  | AV70: =RC[-30] ->  | AW70: =RC[-30] -> 
A71: =IF(RC[1]="","",DATEVALUE(RC[1])) ->  | K71: =RC[-7]-RC[-4] -> #VALUE! | T71: =(RC[-16]*RC[-15]-RC[-13]*RC[-12])/1000 -> #VALUE! | W71: =RC[-2]*RC[-10]/1000 -> #VALUE! | X71: =ABS((RC[-3]*RC[-11]-RC[-2]*RC[-9])/1000) -> #VALUE! | Y71: =(RC[-14]-RC[1])/RC[-18]*100 -> #VALUE! | AC71: =VALUE(RC[-27]) -> #VALUE! | AD71: =IF(RC[21]=42,"*",IF(RC[21]=32,"",RC[21])) ->  | AE71: =RC[-28] ->  | AF71: =RC[-28] ->  | AG71: =RC[-28] ->  | AH71: =RC[-28] ->  | AI71: =RC[-28] ->  | AJ71: =RC[-28] ->  | AK71: =RC[-28] ->  | AL71: =RC[-28] -> 0 | AM71: =RC[-28] -> #VALUE! | AN71: =RC[-28] ->  | AO71: =RC[-28] ->  | AP71: - | AQ71: =RC[-29] ->  | AR71: =RC[-29] ->  | AS71: - | AT71: =RC[-30] -> 0 | AU71: =RC[-30] ->  | AV71: =RC[-30] ->  | AW71: =RC[-30] -> 
A72: =IF(RC[1]="","",DATEVALUE(RC[1])) ->  | K72: =RC[-7]-RC[-4] -> #VALUE! | T72: =(RC[-16]*RC[-15]-RC[-13]*RC[-12])/1000 -> #VALUE! | W72: =RC[-2]*RC[-10]/1000 -> #VALUE! | X72: =ABS((RC[-3]*RC[-11]-RC[-2]*RC[-9])/1000) -> #VALUE! | Y72: =(RC[-14]-RC[1])/RC[-18]*100 -> #VALUE! | AC72: =VALUE(RC[-27]) -> #VALUE! | AD72: =IF(RC[21]=42,"*",IF(RC[21]=32,"",RC[21])) ->  | AE72: =RC[-28] ->  | AF72: =RC[-28] ->  | AG72: =RC[-28] ->  | AH72: =RC[-28] ->  | AI72: =RC[-28] ->  | AJ72: =RC[-28] ->  | AK72: =RC[-28] ->  | AL72: =RC[-28] -> 0 | AM72: =RC[-28] -> #VALUE! | AN72: =RC[-28] ->  | AO72: =RC[-28] ->  | AP72: - | AQ72: =RC[-29] ->  | AR72: =RC[-29] ->  | AS72: - | AT72: =RC[-30] -> 0 | AU72: =RC[-30] ->  | AV72: =RC[-30] ->  | AW72: =RC[-30] -> 
A73: =IF(RC[1]="","",DATEVALUE(RC[1])) ->  | K73: =RC[-7]-RC[-4] -> #VALUE! | T73: =(RC[-16]*RC[-15]-RC[-13]*RC[-12])/1000 -> #VALUE! | W73: =RC[-2]*RC[-10]/1000 -> #VALUE! | X73: =ABS((RC[-3]*RC[-11]-RC[-2]*RC[-9])/1000) -> #VALUE! | Y73: =(RC[-14]-RC[1])/RC[-18]*100 -> #VALUE! | AC73: =VALUE(RC[-27]) -> #VALUE! | AD73: =IF(RC[21]=42,"*",IF(RC[21]=32,"",RC[21])) ->  | AE73: =RC[-28] ->  | AF73: =RC[-28] ->  | AG73: =RC[-28] ->  | AH73: =RC[-28] ->  | AI73: =RC[-28] ->  | AJ73: =RC[-28] ->  | AK73: =RC[-28] ->  | AL73: =RC[-28] -> 0 | AM73: =RC[-28] -> #VALUE! | AN73: =RC[-28] ->  | AO73: =RC[-28] ->  | AP73: - | AQ73: =RC[-29] ->  | AR73: =RC[-29] ->  | AS73: - | AT73: =RC[-30] -> 0 | AU73: =RC[-30] ->  | AV73: =RC[-30] ->  | AW73: =RC[-30] -> 
A74: =IF(RC[1]="","",DATEVALUE(RC[1])) ->  | K74: =RC[-7]-RC[-4] -> #VALUE! | T74: =(RC[-16]*RC[-15]-RC[-13]*RC[-12])/1000 -> #VALUE! | W74: =RC[-2]*RC[-10]/1000 -> #VALUE! | X74: =ABS((RC[-3]*RC[-11]-RC[-2]*RC[-9])/1000) -> #VALUE! | Y74: =(RC[-14]-RC[1])/RC[-18]*100 -> #VALUE! | AC74: =VALUE(RC[-27]) -> #VALUE! | AD74: =IF(RC[21]=42,"*",IF(RC[21]=32,"",RC[21])) ->  | AE74: =RC[-28] ->  | AF74: =RC[-28] ->  | AG74: =RC[-28] ->  | AH74: =RC[-28] ->  | AI74: =RC[-28] ->  | AJ74: =RC[-28] ->  | AK74: =RC[-28] ->  | AL74: =RC[-28] -> 0 | AM74: =RC[-28] -> #VALUE! | AN74: =RC[-28] ->  | AO74: =RC[-28] ->  | AP74: - | AQ74: =RC[-29] ->  | AR74: =RC[-29] ->  | AS74: - | AT74: =RC[-30] -> 0 | AU74: =RC[-30] ->  | AV74: =RC[-30] ->  | AW74: =RC[-30] -> 
A75: =IF(RC[1]="","",DATEVALUE(RC[1])) ->  | K75: =RC[-7]-RC[-4] -> #VALUE! | T75: =(RC[-16]*RC[-15]-RC[-13]*RC[-12])/1000 -> #VALUE! | W75: =RC[-2]*RC[-10]/1000 -> #VALUE! | X75: =ABS((RC[-3]*RC[-11]-RC[-2]*RC[-9])/1000) -> #VALUE! | Y75: =(RC[-14]-RC[1])/RC[-18]*100 -> #VALUE! | AC75: =VALUE(RC[-27]) -> #VALUE! | AD75: =IF(RC[21]=42,"*",IF(RC[21]=32,"",RC[21])) ->  | AE75: =RC[-28] ->  | AF75: =RC[-28] ->  | AG75: =RC[-28] ->  | AH75: =RC[-28] ->  | AI75: =RC[-28] ->  | AJ75: =RC[-28] ->  | AK75: =RC[-28] ->  | AL75: =RC[-28] -> 0 | AM75: =RC[-28] -> #VALUE! | AN75: =RC[-28] ->  | AO75: =RC[-28] ->  | AP75: - | AQ75: =RC[-29] ->  | AR75: =RC[-29] ->  | AS75: - | AT75: =RC[-30] -> 0 | AU75: =RC[-30] ->  | AV75: =RC[-30] ->  | AW75: =RC[-30] -> 
A76: =IF(RC[1]="","",DATEVALUE(RC[1])) ->  | K76: =RC[-7]-RC[-4] -> #VALUE! | T76: =(RC[-16]*RC[-15]-RC[-13]*RC[-12])/1000 -> #VALUE! | W76: =RC[-2]*RC[-10]/1000 -> #VALUE! | X76: =ABS((RC[-3]*RC[-11]-RC[-2]*RC[-9])/1000) -> #VALUE! | Y76: =(RC[-14]-RC[1])/RC[-18]*100 -> #VALUE! | AC76: =VALUE(RC[-27]) -> #VALUE! | AD76: =IF(RC[21]=42,"*",IF(RC[21]=32,"",RC[21])) ->  | AE76: =RC[-28] ->  | AF76: =RC[-28] ->  | AG76: =RC[-28] ->  | AH76: =RC[-28] ->  | AI76: =RC[-28] ->  | AJ76: =RC[-28] ->  | AK76: =RC[-28] ->  | AL76: =RC[-28] -> 0 | AM76: =RC[-28] -> #VALUE! | AN76: =RC[-28] ->  | AO76: =RC[-28] ->  | AP76: - | AQ76: =RC[-29] ->  | AR76: =RC[-29] ->  | AS76: - | AT76: =RC[-30] -> 0 | AU76: =RC[-30] ->  | AV76: =RC[-30] ->  | AW76: =RC[-30] -> 
A77: =IF(RC[1]="","",DATEVALUE(RC[1])) ->  | K77: =RC[-7]-RC[-4] -> #VALUE! | T77: =(RC[-16]*RC[-15]-RC[-13]*RC[-12])/1000 -> #VALUE! | W77: =RC[-2]*RC[-10]/1000 -> #VALUE! | X77: =ABS((RC[-3]*RC[-11]-RC[-2]*RC[-9])/1000) -> #VALUE! | Y77: =(RC[-14]-RC[1])/RC[-18]*100 -> #VALUE! | AC77: =VALUE(RC[-27]) -> #VALUE! | AD77: =IF(RC[21]=42,"*",IF(RC[21]=32,"",RC[21])) ->  | AE77: =RC[-28] ->  | AF77: =RC[-28] ->  | AG77: =RC[-28] ->  | AH77: =RC[-28] ->  | AI77: =RC[-28] ->  | AJ77: =RC[-28] ->  | AK77: =RC[-28] ->  | AL77: =RC[-28] -> 0 | AM77: =RC[-28] -> #VALUE! | AN77: =RC[-28] ->  | AO77: =RC[-28] ->  | AP77: - | AQ77: =RC[-29] ->  | AR77: =RC[-29] ->  | AS77: - | AT77: =RC[-30] -> 0 | AU77: =RC[-30] ->  | AV77: =RC[-30] ->  | AW77: =RC[-30] -> 
A78: =IF(RC[1]="","",DATEVALUE(RC[1])) ->  | K78: =RC[-7]-RC[-4] -> #VALUE! | T78: =(RC[-16]*RC[-15]-RC[-13]*RC[-12])/1000 -> #VALUE! | W78: =RC[-2]*RC[-10]/1000 -> #VALUE! | X78: =ABS((RC[-3]*RC[-11]-RC[-2]*RC[-9])/1000) -> #VALUE! | Y78: =(RC[-14]-RC[1])/RC[-18]*100 -> #VALUE! | AC78: =VALUE(RC[-27]) -> #VALUE! | AD78: =IF(RC[21]=42,"*",IF(RC[21]=32,"",RC[21])) ->  | AE78: =RC[-28] ->  | AF78: =RC[-28] ->  | AG78: =RC[-28] ->  | AH78: =RC[-28] ->  | AI78: =RC[-28] ->  | AJ78: =RC[-28] ->  | AK78: =RC[-28] ->  | AL78: =RC[-28] -> 0 | AM78: =RC[-28] -> #VALUE! | AN78: =RC[-28] ->  | AO78: =RC[-28] ->  | AP78: - | AQ78: =RC[-29] ->  | AR78: =RC[-29] ->  | AS78: - | AT78: =RC[-30] -> 0 | AU78: =RC[-30] ->  | AV78: =RC[-30] ->  | AW78: =RC[-30] -> 
A79: =IF(RC[1]="","",DATEVALUE(RC[1])) ->  | K79: =RC[-7]-RC[-4] -> #VALUE! | T79: =(RC[-16]*RC[-15]-RC[-13]*RC[-12])/1000 -> #VALUE! | W79: =RC[-2]*RC[-10]/1000 -> #VALUE! | X79: =ABS((RC[-3]*RC[-11]-RC[-2]*RC[-9])/1000) -> #VALUE! | Y79: =(RC[-14]-RC[1])/RC[-18]*100 -> #VALUE! | AC79: =VALUE(RC[-27]) -> #VALUE! | AD79: =IF(RC[21]=42,"*",IF(RC[21]=32,"",RC[21])) ->  | AE79: =RC[-28] ->  | AF79: =RC[-28] ->  | AG79: =RC[-28] ->  | AH79: =RC[-28] ->  | AI79: =RC[-28] ->  | AJ79: =RC[-28] ->  | AK79: =RC[-28] ->  | AL79: =RC[-28] -> 0 | AM79: =RC[-28] -> #VALUE! | AN79: =RC[-28] ->  | AO79: =RC[-28] ->  | AP79: - | AQ79: =RC[-29] ->  | AR79: =RC[-29] ->  | AS79: - | AT79: =RC[-30] -> 0 | AU79: =RC[-30] ->  | AV79: =RC[-30] ->  | AW79: =RC[-30] -> 
A80: =IF(RC[1]="","",DATEVALUE(RC[1])) ->  | K80: =RC[-7]-RC[-4] -> #VALUE! | T80: =(RC[-16]*RC[-15]-RC[-13]*RC[-12])/1000 -> #VALUE! | W80: =RC[-2]*RC[-10]/1000 -> #VALUE! | X80: =ABS((RC[-3]*RC[-11]-RC[-2]*RC[-9])/1000) -> #VALUE! | Y80: =(RC[-14]-RC[1])/RC[-18]*100 -> #VALUE! | AC80: =VALUE(RC[-27]) -> #VALUE! | AD80: =IF(RC[21]=42,"*",IF(RC[21]=32,"",RC[21])) ->  | AE80: =RC[-28] ->  | AF80: =RC[-28] ->  | AG80: =RC[-28] ->  | AH80: =RC[-28] ->  | AI80: =RC[-28] ->  | AJ80: =RC[-28] ->  | AK80: =RC[-28] ->  | AL80: =RC[-28] -> 0 | AM80: =RC[-28] -> #VALUE! | AN80: =RC[-28] ->  | AO80: =RC[-28] ->  | AP80: - | AQ80: =RC[-29] ->  | AR80: =RC[-29] ->  | AS80: - | AT80: =RC[-30] -> 0 | AU80: =RC[-30] ->  | AV80: =RC[-30] ->  | AW80: =RC[-30] -> 
A81: =IF(RC[1]="","",DATEVALUE(RC[1])) ->  | K81: =RC[-7]-RC[-4] -> #VALUE! | T81: =(RC[-16]*RC[-15]-RC[-13]*RC[-12])/1000 -> #VALUE! | W81: =RC[-2]*RC[-10]/1000 -> #VALUE! | X81: =ABS((RC[-3]*RC[-11]-RC[-2]*RC[-9])/1000) -> #VALUE! | Y81: =(RC[-14]-RC[1])/RC[-18]*100 -> #VALUE! | AC81: =VALUE(RC[-27]) -> #VALUE! | AD81: =IF(RC[21]=42,"*",IF(RC[21]=32,"",RC[21])) ->  | AE81: =RC[-28] ->  | AF81: =RC[-28] ->  | AG81: =RC[-28] ->  | AH81: =RC[-28] ->  | AI81: =RC[-28] ->  | AJ81: =RC[-28] ->  | AK81: =RC[-28] ->  | AL81: =RC[-28] -> 0 | AM81: =RC[-28] -> #VALUE! | AN81: =RC[-28] ->  | AO81: =RC[-28] ->  | AP81: - | AQ81: =RC[-29] ->  | AR81: =RC[-29] ->  | AS81: - | AT81: =RC[-30] -> 0 | AU81: =RC[-30] ->  | AV81: =RC[-30] ->  | AW81: =RC[-30] -> 
A82: =IF(RC[1]="","",DATEVALUE(RC[1])) ->  | K82: =RC[-7]-RC[-4] -> #VALUE! | T82: =(RC[-16]*RC[-15]-RC[-13]*RC[-12])/1000 -> #VALUE! | W82: =RC[-2]*RC[-10]/1000 -> #VALUE! | X82: =ABS((RC[-3]*RC[-11]-RC[-2]*RC[-9])/1000) -> #VALUE! | Y82: =(RC[-14]-RC[1])/RC[-18]*100 -> #VALUE! | AC82: =VALUE(RC[-27]) -> #VALUE! | AD82: =IF(RC[21]=42,"*",IF(RC[21]=32,"",RC[21])) ->  | AE82: =RC[-28] ->  | AF82: =RC[-28] ->  | AG82: =RC[-28] ->  | AH82: =RC[-28] ->  | AI82: =RC[-28] ->  | AJ82: =RC[-28] ->  | AK82: =RC[-28] ->  | AL82: =RC[-28] -> 0 | AM82: =RC[-28] -> #VALUE! | AN82: =RC[-28] ->  | AO82: =RC[-28] ->  | AP82: - | AQ82: =RC[-29] ->  | AR82: =RC[-29] ->  | AS82: - | AT82: =RC[-30] -> 0 | AU82: =RC[-30] ->  | AV82: =RC[-30] ->  | AW82: =RC[-30] -> 
A83: =IF(RC[1]="","",DATEVALUE(RC[1])) ->  | K83: =RC[-7]-RC[-4] -> #VALUE! | T83: =(RC[-16]*RC[-15]-RC[-13]*RC[-12])/1000 -> #VALUE! | W83: =RC[-2]*RC[-10]/1000 -> #VALUE! | X83: =ABS((RC[-3]*RC[-11]-RC[-2]*RC[-9])/1000) -> #VALUE! | Y83: =(RC[-14]-RC[1])/RC[-18]*100 -> #VALUE! | AC83: =VALUE(RC[-27]) -> #VALUE! | AD83: =IF(RC[21]=42,"*",IF(RC[21]=32,"",RC[21])) ->  | AE83: =RC[-28] ->  | AF83: =RC[-28] ->  | AG83: =RC[-28] ->  | AH83: =RC[-28] ->  | AI83: =RC[-28] ->  | AJ83: =RC[-28] ->  | AK83: =RC[-28] ->  | AL83: =RC[-28] -> 0 | AM83: =RC[-28] -> #VALUE! | AN83: =RC[-28] ->  | AO83: =RC[-28] ->  | AP83: - | AQ83: =RC[-29] ->  | AR83: =RC[-29] ->  | AS83: - | AT83: =RC[-30] -> 0 | AU83: =RC[-30] ->  | AV83: =RC[-30] ->  | AW83: =RC[-30] -> 
AC84: Среднее | AF84: =R[1]C[-28] -> 306.9734555555554 | AG84: =R[1]C[-28] -> 66.971111111111085 | AH84: =R[1]C[-28] -> 7.4954444444444448 | AI84: =R[1]C[-28] -> 271.43003333333348 | AJ84: =R[1]C[-28] -> 49.774444444444434 | AK84: =R[1]C[-28] -> 5.7725555555555577 | AL84: =R[1]C[-28] -> 17.196666666666665 | AM84: =R[1]C[-28] -> 35.543422222222233 | AN84: =R[1]C[-28] -> 27.657800000000002 | AO84: =R[1]C[-28] -> 66.833333333333329 | AP84: - | AQ84: =R[1]C[-29] ->  | AR84: =R[1]C[-29] ->  | AS84: - | AT84: =R[1]C[-30] ->  | AU84: =R[1]C[-30] -> 
B85: Среднее | D85: =AVERAGE(OFFSET(R[-74]C,3,0,R7C1,1)) -> 306.9734555555554 | E85: =AVERAGE(OFFSET(R[-74]C,3,0,R7C1,1)) -> 66.971111111111085 | F85: =AVERAGE(OFFSET(R[-74]C,3,0,R7C1,1)) -> 7.4954444444444448 | G85: =AVERAGE(OFFSET(R[-74]C,3,0,R7C1,1)) -> 271.43003333333348 | H85: =AVERAGE(OFFSET(R[-74]C,3,0,R7C1,1)) -> 49.774444444444434 | I85: =AVERAGE(OFFSET(R[-74]C,3,0,R7C1,1)) -> 5.7725555555555577 | J85: =AVERAGE(OFFSET(R[-74]C,3,0,R7C1,1)) -> 17.196666666666665 | K85: =AVERAGE(OFFSET(R[-74]C,3,0,R7C1,1)) -> 35.543422222222233 | L85: =IF(SUM(OFFSET(R[-74]C,3,0,R7C1,1))=0,"",AVERAGE(OFFSET(R[-74]C,3,0,R7C1,1))) -> 27.657800000000002 | M85: =IF(SUM(OFFSET(R[-74]C,3,0,R7C1,1))=0,"",AVERAGE(OFFSET(R[-74]C,3,0,R7C1,1))) -> 66.833333333333329 | N85: =IF(SUM(OFFSET(R[-74]C,3,0,R7C1,1))=0,"",AVERAGE(OFFSET(R[-74]C,3,0,R7C1,1))) ->  | O85: =IF(SUM(OFFSET(R[-74]C,3,0,R7C1,1))=0,"",AVERAGE(OFFSET(R[-74]C,3,0,R7C1,1))) ->  | P85: =IF(SUM(OFFSET(R[-74]C,3,0,R7C1,1))=0,"",AVERAGE(OFFSET(R[-74]C,3,0,R7C1,1))) ->  | Q85: =IF(SUM(OFFSET(R[-74]C,3,0,R7C1,1))=0,"",AVERAGE(OFFSET(R[-74]C,3,0,R7C1,1))) ->  | R85: =IF(SUM(OFFSET(R[-74]C,3,0,R7C1,1))=0,"",AVERAGE(OFFSET(R[-74]C,3,0,R7C1,1))) -> 1.8255666666666666 | S85: =AVERAGE(OFFSET(R[-74]C,3,0,R7C1,1)) -> 6.3577122074074062 | T85: =AVERAGE(OFFSET(R[-74]C,3,0,R7C1,1)) -> 6.3413133207407384 | W85: =AVERAGE(OFFSET(R[-74]C,3,0,R7C1,1)) -> 1.8093158333333332 | X85: =AVERAGE(OFFSET(R[-74]C,3,0,R7C1,1)) -> #VALUE! | AC85: Итого | AE85: =R[1]C[-28] -> 720 | AF85: =R[1]C[-28] -> 9209.2036666666627 | AI85: =R[1]C[-28] -> 8142.9010000000044 | AM85: =R[1]C[-28] -> 1066.3026666666669 | AN85: =R[1]C[-28] -> 829.73400000000004 | AQ85: =R[1]C[-29] ->  | AU85: =R[1]C[-30] ->  | AV85: =R[1]C[-30] -> 54.766999999999996 | AW85: =R[1]C[-30] -> 190.73136622222219
B86: ИТОГО: | C86: =SUM(OFFSET(R[-75]C,3,0,R7C1,1)) -> 720 | D86: =SUM(OFFSET(R[-75]C,3,0,R7C1,1)) -> 9209.2036666666627 | G86: =SUM(OFFSET(R[-75]C,3,0,R7C1,1)) -> 8142.9010000000044 | K86: =SUM(OFFSET(R[-75]C,3,0,R7C1,1)) -> 1066.3026666666669 | L86: =IF(SUM(OFFSET(R[-75]C,3,0,R7C1,1))=0,"",SUM(OFFSET(R[-75]C,3,0,R7C1,1))) -> 829.73400000000004 | N86: =IF(SUM(OFFSET(R[-75]C,3,0,R7C1,1))=0,"",SUM(OFFSET(R[-75]C,3,0,R7C1,1))) ->  | Q86: =IF(SUM(OFFSET(R[-75]C,3,0,R7C1,1))=0,"",SUM(OFFSET(R[-75]C,3,0,R7C1,1))) ->  | R86: =IF(SUM(OFFSET(R[-75]C,3,0,R7C1,1))=0,"",SUM(OFFSET(R[-75]C,3,0,R7C1,1))) -> 54.766999999999996 | S86: =SUM(OFFSET(R[-75]C,3,0,R7C1,1)) -> 190.73136622222219 | T86: =SUM(OFFSET(R[-75]C,3,0,R7C1,1)) -> 190.23939962222215 | W86: =SUM(OFFSET(R[-75]C,3,0,R7C1,1)) -> 54.279474999999998 | X86: =SUM(OFFSET(R[-75]C,3,0,R7C1,1)) -> #VALUE!
AC87: Досчёт | AF87: =R[1]C[-28] -> 0 | AI87: =R[1]C[-28] -> 0 | AM87: =R[1]C[-28] -> 0 | AN87: =R[1]C[-28] -> 0 | AQ87: =R[1]C[-29] -> 0 | AU87: =R[1]C[-30] -> 0 | AV87: =R[1]C[-30] -> 0 | AW87: =R[1]C[-30] -> 0
A88: 11дн=264ч 4дн=96ч | B88: Досчёт до конца м-ца (+) | C88: =R6C1*24 -> 216 | T88: № B11D | AC88: Снятие | AF88: =-R[1]C[-28] -> 0 | AI88: =-R[1]C[-28] -> 0 | AM88: =-R[1]C[-28] -> 0 | AN88: =-R[1]C[-28] -> 0 | AQ88: =-R[1]C[-29] -> 0 | AU88: =-R[1]C[-30] -> 0 | AV88: =-R[1]C[-30] -> 0 | AW88: =-R[1]C[-30] -> 0
A89: 9дн=216ч 7дн=168ч | B89: Вычет с предыдущего (-) | C89: =R4C1*24 -> 192 | AC89: Сумма | AF89: =R[1]C[-28] -> 9209.2036666666627 | AI89: =R[1]C[-28] -> 8142.9010000000044 | AM89: =R[1]C[-28] -> 1066.3026666666669 | AN89: =R[1]C[-28] -> 829.73400000000004 | AQ89: =R[1]C[-29] ->  | AU89: =R[1]C[-30] ->  | AV89: =R[1]C[-30] -> 54.766999999999996 | AW89: =R[1]C[-30] -> 190.73136622222219
B90: СУММА: | C90: =R[-4]C+R[-2]C-R[-1]C -> 744 | D90: =R[-4]C+R[-2]C-R[-1]C -> 9209.2036666666627 | G90: =R[-4]C+R[-2]C-R[-1]C -> 8142.9010000000044 | K90: =R[-4]C+R[-2]C-R[-1]C -> 1066.3026666666669 | L90: =IF(SUM(OFFSET(R[-79]C,3,0,R7C1,1))=0,"",(R[-4]C+R[-2]C-R[-1]C)) -> 829.73400000000004 | N90: =IF(SUM(OFFSET(R[-79]C,3,0,R7C1,1))=0,"",(R[-4]C+R[-2]C-R[-1]C)) ->  | Q90: =IF(SUM(OFFSET(R[-79]C,3,0,R7C1,1))=0,"",(R[-4]C+R[-2]C-R[-1]C)) ->  | R90: =IF(SUM(OFFSET(R[-79]C,3,0,R7C1,1))=0,"",(R[-4]C+R[-2]C-R[-1]C)) -> 54.766999999999996 | S90: =R[-4]C+R[-2]C-R[-1]C -> 190.73136622222219
AC91: Тхв на источнике | AE91: V гвс (м3) | AF91: =R[-2]C[15] ->  | AG91: W гвс (Гкал) | AH91: =RC[-2]*0.06 -> #VALUE! | AI91: W без гвс (Гкал) | AJ91: =R[-2]C[13]-RC[-2] -> #VALUE!
B92: Показания счетчиков на момент снятия данных:
B93: Дата, время | D93: М1, т | F93: М2, т | H93: М3, т | J93: М4, т | L93: Qо, Гкал | N93: Qг, Гкал | P93: время, час
B94: 30.12.99 00:00 | D94: - | F94: - | H94: - | J94: - | L94: - | N94: - | P94: -
B95: 30.12.99 00:00 | D95: - | F95: - | H95: - | J95: - | L95: - | N95: - | P95: -
AC97: =ZAYAVKA_N -> письмо с 09.10.18г по 18.10.18г некорректная работа приборов
B98: Представитель потребителя:_______________________________________________________________________ В.О. Топорков
I101: Рекомендуемые значения по параметрам теплопотребления (не являются официально утверждёнными)
I102: М, т | J102: V, м3 | K102: Qгвс, Гкал | L102: Qотоп, Гкал | M102: Qо, Гкал
I103: =R[-13]C[-3] -> 0 | J103: =RC[-1]/0.98 -> 0 | K103: =RC[-1]*0.06 -> 0 | L103: =RC[1]-RC[-1] -> 54.766999999999996 | M103: =R[-13]C[5] -> 54.766999999999996
O105: ДЛЯ САМОКОНТРОЛЯ
B106: В строке выбора дат указать период с 16.7.13 по 23.8.13 - жильё | N106: Q | O106: Qг
B107: В строке выбора дат указать период с 18.7.13 по 25.8.13 - не жилое | N107: =(R[-21]C[-10]*R[-22]C[-7]-R[-21]C[-9]*R[-22]C[-6])/1000 -> 2499.654458216789 | O107: =IF(R[-22]C[-2]="",R[-21]C[-3]*R[-22]C/1000,"") ->  | P107: Си2
O108: =IF(R[-23]C[-2]="","",((R[-22]C[-3]*R[-23]C)-(R[-22]C[-2]*R[-23]C[2]))/1000) -> #VALUE! | P108: Си3