Sheet: Лист1
G1: Отчёт о теплопотреблении за октябрь 2018 | M1: з.н д. №02/147-2783 от 04.10.18 с 03.10.18г по 17.10.18г некорректная работа приборов
A4: =EOMONTH(R[9]C,0)-R[9]C -> 8 | B4: Потребитель: ЗАО "Сити Сервис"
A5: =MAX(R[9]C:R[78]C) -> 2018-10-22T00:00:00.000 | B5: Адрес: г. СПб, Кораблестроителей ул., д.35 к.1 ИТП 4
A6: =EOMONTH(R[-1]C,0)-R[-1]C -> 9 | B6: Телефон: 8-911-021-19-79
A7: =R[-2]C-R[6]C -> 30 | B7: Договор 10023-2(.)400
A8: 7 | B8: Тепловычислитель: ВТД-УВ № B005 | L8: М2 мах= | M8: 228.96 | O8: Мгвс мах= | P8: 135.6
L9: Qотоп мах= | M9: 18.312 | O9: Qгвс мах= | P9: 8.136
B10: Расчётная формула: Q=M1*(h1-h2)+(M1-M2)*(h2-hхв)
D12: Учет | L12: Контроль
A13: =R[1]C[1]-1 -> 2018-09-22T00:00:00.000 | B13: Дата | C13: N, ч | D13: M1, т | E13: T1, С | F13: P1, кг/см2 | G13: M2, т | H13: T2, С | I13: P2, кг/см2 | J13: dT, С | K13: M1-М2, т | L13: V3, м3 | M13: T3, С | N13: V4, м3 | O13: =IF(R[-12]C[-14]="м.куб","","T4, С") -> T4, С | P13: dT, С | Q13: V3-V4, м3 | R13: Qгвс, Гкал | S13: Qобщ., Гкал | T13: Q | U13: M3 | V13: M4 | W13: си2 | X13: си3 | Y13: Разб. | Z13: dM2 | AC13: Дата | AD13: НС | AE13: n, ч | AF13: М1, т | AG13: t1, гр. С | AH13: Р1, кгс/см2 | AI13: М2, т | AJ13: t2, гр. С | AK13: Р2, кгс/см2 | AL13: t1-t2, гр. С | AM13: М1-М2, т | AN13: М1гвс, т | AO13: t1гвс, гр. С | AP13: Р1гвс, кгс/см2 | AQ13: М2гвс, т | AR13: t2гвс, гр. С | AS13: Р2гвс, кгс/см2 | AT13: t1гвс-t2гвс | AU13: М1гвс-М2гвс, т | AV13: Wгвс, Гкал | AW13: Wсумм, Гкал | AY13: NS_TV1 | AZ13: НС | BA13: NS_TV2
A14: =IF(RC[1]="","",DATEVALUE(RC[1])) -> 43366 | B14: 23.09.18 | C14: 24 | D14: 283.45837402000001 | E14: 70.92 | F14: 7.4530383344000004 | G14: 253.66247559000001 | H14: 70.88 | I14: 4.3707295236799997 | J14: =RC[-5]-RC[-2] -> 4.0000000000006253E-2 | K14: 29.795898430000001 | L14: 31.200283049999999 | M14: 70.28 | R14: 2.1576710566542499 | S14: =RC[-1] -> 2.1576710566542499 | T14: =(RC[-16]*RC[-15]-RC[-13]*RC[-12])/1000 -> 2.1232716156792013 | U14: 30.50963402 | V14: - | W14: =RC[-2]*RC[-10]/1000 -> 2.1442170789256001 | X14: =ABS((RC[-3]*RC[-11]-RC[-2]*RC[-9])/1000) -> #VALUE! | Y14: =(RC[-14]-RC[1])/RC[-18]*100 -> -0.2813721613099861 | Z14: 30.50963402 | AC14: =VALUE(RC[-27]) -> 2018-09-23T00:00:00.000 | AD14: =IF(RC[21]=42,"*",IF(RC[21]=32,"",RC[21])) -> - | AE14: =RC[-28] -> 24 | AF14: =RC[-28] -> 283.45837402000001 | AG14: =RC[-28] -> 70.92 | AH14: =RC[-28] -> 7.4530383344000004 | AI14: =RC[-28] -> 253.66247559000001 | AJ14: =RC[-28] -> 70.88 | AK14: =RC[-28] -> 4.3707295236799997 | AL14: =RC[-28] -> 4.0000000000006253E-2 | AM14: =RC[-28] -> 29.795898430000001 | AN14: =RC[-28] -> 31.200283049999999 | AO14: =RC[-28] -> 70.28 | AP14: - | AQ14: =RC[-29] -> 0 | AR14: =RC[-29] -> 0 | AS14: - | AT14: =RC[-30] -> 0 | AU14: =RC[-30] -> 0 | AV14: =RC[-30] -> 2.1576710566542499 | AW14: =RC[-30] -> 2.1576710566542499 | AY14: - | AZ14: - | BA14: -
A15: =IF(RC[1]="","",DATEVALUE(RC[1])) -> 43367 | B15: 24.09.18 | C15: 24 | D15: 260.75518799000002 | E15: 69.75 | F15: 7.5814737354800004 | G15: 234.23057556000001 | H15: 69.7 | I15: 4.9305954528799996 | J15: =RC[-5]-RC[-2] -> 4.9999999999997158E-2 | K15: 26.524612430000001 | L15: 27.824874879999999 | M15: 69 | R15: 1.88968055555556 | S15: =RC[-1] -> 1.88968055555556 | T15: =(RC[-16]*RC[-15]-RC[-13]*RC[-12])/1000 -> 1.8618032457705012 | U15: 27.22818947 | V15: - | W15: =RC[-2]*RC[-10]/1000 -> 1.87874507343 | X15: =ABS((RC[-3]*RC[-11]-RC[-2]*RC[-9])/1000) -> #VALUE! | Y15: =(RC[-14]-RC[1])/RC[-18]*100 -> -0.30037796659034899 | Z15: 27.22818947 | AC15: =VALUE(RC[-27]) -> 2018-09-24T00:00:00.000 | AD15: =IF(RC[21]=42,"*",IF(RC[21]=32,"",RC[21])) -> - | AE15: =RC[-28] -> 24 | AF15: =RC[-28] -> 260.75518799000002 | AG15: =RC[-28] -> 69.75 | AH15: =RC[-28] -> 7.5814737354800004 | AI15: =RC[-28] -> 234.23057556000001 | AJ15: =RC[-28] -> 69.7 | AK15: =RC[-28] -> 4.9305954528799996 | AL15: =RC[-28] -> 4.9999999999997158E-2 | AM15: =RC[-28] -> 26.524612430000001 | AN15: =RC[-28] -> 27.824874879999999 | AO15: =RC[-28] -> 69 | AP15: - | AQ15: =RC[-29] -> 0 | AR15: =RC[-29] -> 0 | AS15: - | AT15: =RC[-30] -> 0 | AU15: =RC[-30] -> 0 | AV15: =RC[-30] -> 1.88968055555556 | AW15: =RC[-30] -> 1.88968055555556 | AY15: - | AZ15: - | BA15: -
A16: =IF(RC[1]="","",DATEVALUE(RC[1])) -> 43368 | B16: 25.09.18 | C16: 24 | D16: 240.70814514 | E16: 68.349999999999994 | F16: 7.7128590109199999 | G16: 212.3646698 | H16: 68.28 | I16: 5.5639499778400001 | J16: =RC[-5]-RC[-2] -> 6.9999999999993179E-2 | K16: 28.343475340000001 | L16: 29.846794129999999 | M16: 67.650000000000006 | R16: 1.9864488415974 | S16: =RC[-1] -> 1.9864488415974 | T16: =(RC[-16]*RC[-15]-RC[-13]*RC[-12])/1000 -> 1.9521420663749978 | U16: 29.232248309999999 | V16: - | W16: =RC[-2]*RC[-10]/1000 -> 1.9775615981715 | X16: =ABS((RC[-3]*RC[-11]-RC[-2]*RC[-9])/1000) -> #VALUE! | Y16: =(RC[-14]-RC[1])/RC[-18]*100 -> -0.41851263246236925 | Z16: 29.232248309999999 | AC16: =VALUE(RC[-27]) -> 2018-09-25T00:00:00.000 | AD16: =IF(RC[21]=42,"*",IF(RC[21]=32,"",RC[21])) -> - | AE16: =RC[-28] -> 24 | AF16: =RC[-28] -> 240.70814514 | AG16: =RC[-28] -> 68.349999999999994 | AH16: =RC[-28] -> 7.7128590109199999 | AI16: =RC[-28] -> 212.3646698 | AJ16: =RC[-28] -> 68.28 | AK16: =RC[-28] -> 5.5639499778400001 | AL16: =RC[-28] -> 6.9999999999993179E-2 | AM16: =RC[-28] -> 28.343475340000001 | AN16: =RC[-28] -> 29.846794129999999 | AO16: =RC[-28] -> 67.650000000000006 | AP16: - | AQ16: =RC[-29] -> 0 | AR16: =RC[-29] -> 0 | AS16: - | AT16: =RC[-30] -> 0 | AU16: =RC[-30] -> 0 | AV16: =RC[-30] -> 1.9864488415974 | AW16: =RC[-30] -> 1.9864488415974 | AY16: - | AZ16: - | BA16: -
A17: =IF(RC[1]="","",DATEVALUE(RC[1])) -> 43369 | B17: 26.09.18 | C17: 24 | D17: 236.01358031999999 | E17: 67.790000000000006 | F17: 7.6128450151199996 | G17: 206.89973449999999 | H17: 67.709999999999994 | I17: 5.5722574623999996 | J17: =RC[-5]-RC[-2] -> 8.0000000000012506E-2 | K17: 29.113845820000002 | L17: 30.461669919999999 | M17: 67.05 | R17: 1.9998485263208201 | S17: =RC[-1] -> 1.9998485263208201 | T17: =(RC[-16]*RC[-15]-RC[-13]*RC[-12])/1000 -> 1.9901795868978025 | U17: 29.850360869999999 | V17: - | W17: =RC[-2]*RC[-10]/1000 -> 2.0014666963334999 | X17: =ABS((RC[-3]*RC[-11]-RC[-2]*RC[-9])/1000) -> #VALUE! | Y17: =(RC[-14]-RC[1])/RC[-18]*100 -> -0.35597679802725785 | Z17: 29.850360869999999 | AC17: =VALUE(RC[-27]) -> 2018-09-26T00:00:00.000 | AD17: =IF(RC[21]=42,"*",IF(RC[21]=32,"",RC[21])) -> - | AE17: =RC[-28] -> 24 | AF17: =RC[-28] -> 236.01358031999999 | AG17: =RC[-28] -> 67.790000000000006 | AH17: =RC[-28] -> 7.6128450151199996 | AI17: =RC[-28] -> 206.89973449999999 | AJ17: =RC[-28] -> 67.709999999999994 | AK17: =RC[-28] -> 5.5722574623999996 | AL17: =RC[-28] -> 8.0000000000012506E-2 | AM17: =RC[-28] -> 29.113845820000002 | AN17: =RC[-28] -> 30.461669919999999 | AO17: =RC[-28] -> 67.05 | AP17: - | AQ17: =RC[-29] -> 0 | AR17: =RC[-29] -> 0 | AS17: - | AT17: =RC[-30] -> 0 | AU17: =RC[-30] -> 0 | AV17: =RC[-30] -> 1.9998485263208201 | AW17: =RC[-30] -> 1.9998485263208201 | AY17: - | AZ17: - | BA17: -
A18: =IF(RC[1]="","",DATEVALUE(RC[1])) -> 43370 | B18: 27.09.18 | C18: 24 | D18: 215.98632813 | E18: 63.15 | F18: 7.2475602843600004 | G18: 185.83790587999999 | H18: 63.06 | I18: 5.6045422041200004 | J18: =RC[-5]-RC[-2] -> 8.9999999999996305E-2 | K18: 30.148422249999999 | L18: 31.655775070000001 | M18: 62.51 | R18: 1.9543505995032 | S18: =RC[-1] -> 1.9543505995032 | T18: =(RC[-16]*RC[-15]-RC[-13]*RC[-12])/1000 -> 1.9205982766166998 | U18: 31.091493610000001 | V18: - | W18: =RC[-2]*RC[-10]/1000 -> 1.9435292655610998 | X18: =ABS((RC[-3]*RC[-11]-RC[-2]*RC[-9])/1000) -> #VALUE! | Y18: =(RC[-14]-RC[1])/RC[-18]*100 -> -0.50746985957158008 | Z18: 31.091493610000001 | AC18: =VALUE(RC[-27]) -> 2018-09-27T00:00:00.000 | AD18: =IF(RC[21]=42,"*",IF(RC[21]=32,"",RC[21])) -> - | AE18: =RC[-28] -> 24 | AF18: =RC[-28] -> 215.98632813 | AG18: =RC[-28] -> 63.15 | AH18: =RC[-28] -> 7.2475602843600004 | AI18: =RC[-28] -> 185.83790587999999 | AJ18: =RC[-28] -> 63.06 | AK18: =RC[-28] -> 5.6045422041200004 | AL18: =RC[-28] -> 8.9999999999996305E-2 | AM18: =RC[-28] -> 30.148422249999999 | AN18: =RC[-28] -> 31.655775070000001 | AO18: =RC[-28] -> 62.51 | AP18: - | AQ18: =RC[-29] -> 0 | AR18: =RC[-29] -> 0 | AS18: - | AT18: =RC[-30] -> 0 | AU18: =RC[-30] -> 0 | AV18: =RC[-30] -> 1.9543505995032 | AW18: =RC[-30] -> 1.9543505995032 | AY18: - | AZ18: - | BA18: -
A19: =IF(RC[1]="","",DATEVALUE(RC[1])) -> 43371 | B19: 28.09.18 | C19: 24 | D19: 205.47073363999999 | E19: 67.73 | F19: 7.3967780701999999 | G19: 179.05175781 | H19: 62.41 | I19: 5.7587071952800004 | J19: =RC[-5]-RC[-2] -> 5.3200000000000074 | K19: 26.418975830000001 | L19: 26.973020550000001 | M19: 67.010000000000005 | R19: 1.7872696737365099 | S19: 2.8191608650998399 | T19: =(RC[-16]*RC[-15]-RC[-13]*RC[-12])/1000 -> 2.7419125845151013 | U19: 26.42232323 | V19: - | W19: =RC[-2]*RC[-10]/1000 -> 1.7705598796423001 | X19: =ABS((RC[-3]*RC[-11]-RC[-2]*RC[-9])/1000) -> #VALUE! | Y19: =(RC[-14]-RC[1])/RC[-18]*100 -> -1.8695152959912246E-3 | Z19: 26.42232323 | AC19: =VALUE(RC[-27]) -> 2018-09-28T00:00:00.000 | AD19: =IF(RC[21]=42,"*",IF(RC[21]=32,"",RC[21])) -> - | AE19: =RC[-28] -> 24 | AF19: =RC[-28] -> 205.47073363999999 | AG19: =RC[-28] -> 67.73 | AH19: =RC[-28] -> 7.3967780701999999 | AI19: =RC[-28] -> 179.05175781 | AJ19: =RC[-28] -> 62.41 | AK19: =RC[-28] -> 5.7587071952800004 | AL19: =RC[-28] -> 5.3200000000000074 | AM19: =RC[-28] -> 26.418975830000001 | AN19: =RC[-28] -> 26.973020550000001 | AO19: =RC[-28] -> 67.010000000000005 | AP19: - | AQ19: =RC[-29] -> 0 | AR19: =RC[-29] -> 0 | AS19: - | AT19: =RC[-30] -> 0 | AU19: =RC[-30] -> 0 | AV19: =RC[-30] -> 1.7872696737365099 | AW19: =RC[-30] -> 2.8191608650998399 | AY19: - | AZ19: - | BA19: -
A20: =IF(RC[1]="","",DATEVALUE(RC[1])) -> 43372 | B20: 29.09.18 | C20: 24 | D20: 228.52822875999999 | E20: 67.63 | F20: 8.2407682569999992 | G20: 191.66532898 | H20: 49.91 | I20: 6.1288089283199998 | J20: =RC[-5]-RC[-2] -> 17.72 | K20: 36.862899779999999 | L20: 31.981870650000001 | M20: 67.09 | R20: 2.1051832091334699 | S20: 5.8964329057991796 | T20: =(RC[-16]*RC[-15]-RC[-13]*RC[-12])/1000 -> 5.8893475416469991 | U20: 31.338127140000001 | V20: - | W20: =RC[-2]*RC[-10]/1000 -> 2.1024749498226001 | X20: =ABS((RC[-3]*RC[-11]-RC[-2]*RC[-9])/1000) -> #VALUE! | Y20: =(RC[-14]-RC[1])/RC[-18]*100 -> 2.8825101907588619 | Z20: 31.338127140000001 | AC20: =VALUE(RC[-27]) -> 2018-09-29T00:00:00.000 | AD20: =IF(RC[21]=42,"*",IF(RC[21]=32,"",RC[21])) -> - | AE20: =RC[-28] -> 24 | AF20: =RC[-28] -> 228.52822875999999 | AG20: =RC[-28] -> 67.63 | AH20: =RC[-28] -> 8.2407682569999992 | AI20: =RC[-28] -> 191.66532898 | AJ20: =RC[-28] -> 49.91 | AK20: =RC[-28] -> 6.1288089283199998 | AL20: =RC[-28] -> 17.72 | AM20: =RC[-28] -> 36.862899779999999 | AN20: =RC[-28] -> 31.981870650000001 | AO20: =RC[-28] -> 67.09 | AP20: - | AQ20: =RC[-29] -> 0 | AR20: =RC[-29] -> 0 | AS20: - | AT20: =RC[-30] -> 0 | AU20: =RC[-30] -> 0 | AV20: =RC[-30] -> 2.1051832091334699 | AW20: =RC[-30] -> 5.8964329057991796 | AY20: - | AZ20: - | BA20: -
A21: =IF(RC[1]="","",DATEVALUE(RC[1])) -> 43373 | B21: 30.09.18 | C21: 24 | D21: 236.9984436 | E21: 69.680000000000007 | F21: 8.3024944978799997 | G21: 205.21829224000001 | H21: 46.82 | I21: 6.0144583125200004 | J21: =RC[-5]-RC[-2] -> 22.860000000000007 | K21: 31.780151360000001 | L21: 33.004215240000001 | M21: 68.94 | R21: 2.2549320340116599 | S21: 6.9303477046909299 | T21: =(RC[-16]*RC[-15]-RC[-13]*RC[-12])/1000 -> 6.9057311073712029 | U21: 32.29055786 | V21: - | W21: =RC[-2]*RC[-10]/1000 -> 2.2261110588683999 | X21: =ABS((RC[-3]*RC[-11]-RC[-2]*RC[-9])/1000) -> #VALUE! | Y21: =(RC[-14]-RC[1])/RC[-18]*100 -> -0.24871393988752472 | Z21: 32.29055786 | AC21: =VALUE(RC[-27]) -> 2018-09-30T00:00:00.000 | AD21: =IF(RC[21]=42,"*",IF(RC[21]=32,"",RC[21])) -> - | AE21: =RC[-28] -> 24 | AF21: =RC[-28] -> 236.9984436 | AG21: =RC[-28] -> 69.680000000000007 | AH21: =RC[-28] -> 8.3024944978799997 | AI21: =RC[-28] -> 205.21829224000001 | AJ21: =RC[-28] -> 46.82 | AK21: =RC[-28] -> 6.0144583125200004 | AL21: =RC[-28] -> 22.860000000000007 | AM21: =RC[-28] -> 31.780151360000001 | AN21: =RC[-28] -> 33.004215240000001 | AO21: =RC[-28] -> 68.94 | AP21: - | AQ21: =RC[-29] -> 0 | AR21: =RC[-29] -> 0 | AS21: - | AT21: =RC[-30] -> 0 | AU21: =RC[-30] -> 0 | AV21: =RC[-30] -> 2.2549320340116599 | AW21: =RC[-30] -> 6.9303477046909299 | AY21: - | AZ21: - | BA21: -
A22: =IF(RC[1]="","",DATEVALUE(RC[1])) -> 43374 | B22: 01.10.18 | C22: 24 | D22: 224.94415283000001 | E22: 68.63 | F22: 8.2633351172800005 | G22: 198.98207092000001 | H22: 44.46 | I22: 6.1173156529200003 | J22: =RC[-5]-RC[-2] -> 24.169999999999995 | K22: 25.962081909999998 | L22: 26.74872208 | M22: 68.03 | R22: 1.78766248447502 | S22: 6.5952984188401604 | T22: =(RC[-16]*RC[-15]-RC[-13]*RC[-12])/1000 -> 6.5911743356196988 | U22: 26.194068909999999 | V22: - | W22: =RC[-2]*RC[-10]/1000 -> 1.7819825079472997 | X22: =ABS((RC[-3]*RC[-11]-RC[-2]*RC[-9])/1000) -> #VALUE! | Y22: =(RC[-14]-RC[1])/RC[-18]*100 -> -0.11658688590755982 | Z22: 26.194068909999999 | AC22: =VALUE(RC[-27]) -> 2018-10-01T00:00:00.000 | AD22: =IF(RC[21]=42,"*",IF(RC[21]=32,"",RC[21])) -> - | AE22: =RC[-28] -> 24 | AF22: =RC[-28] -> 224.94415283000001 | AG22: =RC[-28] -> 68.63 | AH22: =RC[-28] -> 8.2633351172800005 | AI22: =RC[-28] -> 198.98207092000001 | AJ22: =RC[-28] -> 44.46 | AK22: =RC[-28] -> 6.1173156529200003 | AL22: =RC[-28] -> 24.169999999999995 | AM22: =RC[-28] -> 25.962081909999998 | AN22: =RC[-28] -> 26.74872208 | AO22: =RC[-28] -> 68.03 | AP22: - | AQ22: =RC[-29] -> 0 | AR22: =RC[-29] -> 0 | AS22: - | AT22: =RC[-30] -> 0 | AU22: =RC[-30] -> 0 | AV22: =RC[-30] -> 1.78766248447502 | AW22: =RC[-30] -> 6.5952984188401604 | AY22: - | AZ22: - | BA22: -
A23: =IF(RC[1]="","",DATEVALUE(RC[1])) -> 43375 | B23: 02.10.18 | C23: 24 | D23: 223.87992858999999 | E23: 67.430000000000007 | F23: 8.1379462224400001 | G23: 196.80387877999999 | H23: 44.03 | I23: 6.0390170956400002 | J23: =RC[-5]-RC[-2] -> 23.400000000000006 | K23: 27.076049810000001 | L23: 27.931106570000001 | M23: 66.790000000000006 | R23: 1.8383903816757401 | S23: 6.43557778733161 | T23: =(RC[-16]*RC[-15]-RC[-13]*RC[-12])/1000 -> 6.4309488021403016 | U23: 27.367788310000002 | V23: - | W23: =RC[-2]*RC[-10]/1000 -> 1.8278945812249003 | X23: =ABS((RC[-3]*RC[-11]-RC[-2]*RC[-9])/1000) -> #VALUE! | Y23: =(RC[-14]-RC[1])/RC[-18]*100 -> -0.14823818606041042 | Z23: 27.367788310000002 | AC23: =VALUE(RC[-27]) -> 2018-10-02T00:00:00.000 | AD23: =IF(RC[21]=42,"*",IF(RC[21]=32,"",RC[21])) -> - | AE23: =RC[-28] -> 24 | AF23: =RC[-28] -> 223.87992858999999 | AG23: =RC[-28] -> 67.430000000000007 | AH23: =RC[-28] -> 8.1379462224400001 | AI23: =RC[-28] -> 196.80387877999999 | AJ23: =RC[-28] -> 44.03 | AK23: =RC[-28] -> 6.0390170956400002 | AL23: =RC[-28] -> 23.400000000000006 | AM23: =RC[-28] -> 27.076049810000001 | AN23: =RC[-28] -> 27.931106570000001 | AO23: =RC[-28] -> 66.790000000000006 | AP23: - | AQ23: =RC[-29] -> 0 | AR23: =RC[-29] -> 0 | AS23: - | AT23: =RC[-30] -> 0 | AU23: =RC[-30] -> 0 | AV23: =RC[-30] -> 1.8383903816757401 | AW23: =RC[-30] -> 6.43557778733161 | AY23: - | AZ23: - | BA23: -
A24: =IF(RC[1]="","",DATEVALUE(RC[1])) -> 43376 | B24: 03.10.18 | C24: 24 | D24: 227.54889933333334 | E24: 70.74666666666667 | F24: 8.0919597535999994 | G24: 200.63170369333332 | H24: 45.506666666666668 | I24: 5.8780373630799998 | J24: 25.24 | K24: 26.917195639999999 | L24: =AVERAGE(R[15]C:R[17]C) -> 27.219678243333334 | M24: 66.989999999999995 | R24: =RC[5] -> 1.8234462455209 | S24: =RC[1] -> 6.9682460687642669 | T24: =(RC[-16]*RC[-15]-RC[-13]*RC[-12])/1000 -> 6.9682460687642669 | U24: 27.219678243333334 | V24: - | W24: =RC[-2]*RC[-10]/1000 -> 1.8234462455209 | X24: =ABS((RC[-3]*RC[-11]-RC[-2]*RC[-9])/1000) -> #VALUE! | Y24: =(RC[-14]-RC[1])/RC[-18]*100 -> -0.15076510729115927 | Z24: 27.219678243333334 | AC24: =VALUE(RC[-27]) -> 2018-10-03T00:00:00.000 | AD24: =IF(RC[21]=42,"*",IF(RC[21]=32,"",RC[21])) -> - | AE24: =RC[-28] -> 24 | AF24: =RC[-28] -> 227.54889933333334 | AG24: =RC[-28] -> 70.74666666666667 | AH24: =RC[-28] -> 8.0919597535999994 | AI24: =RC[-28] -> 200.63170369333332 | AJ24: =RC[-28] -> 45.506666666666668 | AK24: =RC[-28] -> 5.8780373630799998 | AL24: =RC[-28] -> 25.24 | AM24: =RC[-28] -> 26.917195639999999 | AN24: =RC[-28] -> 27.219678243333334 | AO24: =RC[-28] -> 66.989999999999995 | AP24: - | AQ24: =RC[-29] -> 0 | AR24: =RC[-29] -> 0 | AS24: - | AT24: =RC[-30] -> 0 | AU24: =RC[-30] -> 0 | AV24: =RC[-30] -> 1.8234462455209 | AW24: =RC[-30] -> 6.9682460687642669 | AY24: - | AZ24: - | BA24: -
A25: =IF(RC[1]="","",DATEVALUE(RC[1])) -> 43377 | B25: 04.10.18 | C25: 24 | D25: 227.54889933333334 | E25: 70.74666666666667 | F25: 8.0919597535999994 | G25: 200.63170369333332 | H25: 45.506666666666668 | I25: 5.8780373630799998 | J25: 25.24 | K25: 26.917195639999999 | L25: 27.219678243333334 | M25: 66.8 | R25: =RC[5] -> 1.8182745066546666 | S25: =RC[1] -> 6.9682460687642669 | T25: =(RC[-16]*RC[-15]-RC[-13]*RC[-12])/1000 -> 6.9682460687642669 | U25: 27.219678243333334 | V25: - | W25: =RC[-2]*RC[-10]/1000 -> 1.8182745066546666 | X25: =ABS((RC[-3]*RC[-11]-RC[-2]*RC[-9])/1000) -> #VALUE! | Y25: =(RC[-14]-RC[1])/RC[-18]*100 -> -0.15076510729115927 | Z25: 27.219678243333334 | AC25: =VALUE(RC[-27]) -> 2018-10-04T00:00:00.000 | AD25: =IF(RC[21]=42,"*",IF(RC[21]=32,"",RC[21])) -> - | AE25: =RC[-28] -> 24 | AF25: =RC[-28] -> 227.54889933333334 | AG25: =RC[-28] -> 70.74666666666667 | AH25: =RC[-28] -> 8.0919597535999994 | AI25: =RC[-28] -> 200.63170369333332 | AJ25: =RC[-28] -> 45.506666666666668 | AK25: =RC[-28] -> 5.8780373630799998 | AL25: =RC[-28] -> 25.24 | AM25: =RC[-28] -> 26.917195639999999 | AN25: =RC[-28] -> 27.219678243333334 | AO25: =RC[-28] -> 66.8 | AP25: - | AQ25: =RC[-29] -> 0 | AR25: =RC[-29] -> 0 | AS25: - | AT25: =RC[-30] -> 0 | AU25: =RC[-30] -> 0 | AV25: =RC[-30] -> 1.8182745066546666 | AW25: =RC[-30] -> 6.9682460687642669 | AY25: - | AZ25: - | BA25: -
A26: =IF(RC[1]="","",DATEVALUE(RC[1])) -> 43378 | B26: 05.10.18 | C26: 24 | D26: 227.54889933333334 | E26: 70.74666666666667 | F26: 8.0919597535999994 | G26: 200.63170369333332 | H26: 45.506666666666668 | I26: 5.8780373630799998 | J26: 25.24 | K26: 26.917195639999999 | L26: 27.219678243333334 | M26: 66.2 | R26: =RC[5] -> 1.8019426997086669 | S26: =RC[1] -> 6.9682460687642669 | T26: =(RC[-16]*RC[-15]-RC[-13]*RC[-12])/1000 -> 6.9682460687642669 | U26: 27.219678243333334 | V26: - | W26: =RC[-2]*RC[-10]/1000 -> 1.8019426997086669 | X26: =ABS((RC[-3]*RC[-11]-RC[-2]*RC[-9])/1000) -> #VALUE! | Y26: =(RC[-14]-RC[1])/RC[-18]*100 -> -0.15076510729115927 | Z26: 27.219678243333334 | AC26: =VALUE(RC[-27]) -> 2018-10-05T00:00:00.000 | AD26: =IF(RC[21]=42,"*",IF(RC[21]=32,"",RC[21])) -> - | AE26: =RC[-28] -> 24 | AF26: =RC[-28] -> 227.54889933333334 | AG26: =RC[-28] -> 70.74666666666667 | AH26: =RC[-28] -> 8.0919597535999994 | AI26: =RC[-28] -> 200.63170369333332 | AJ26: =RC[-28] -> 45.506666666666668 | AK26: =RC[-28] -> 5.8780373630799998 | AL26: =RC[-28] -> 25.24 | AM26: =RC[-28] -> 26.917195639999999 | AN26: =RC[-28] -> 27.219678243333334 | AO26: =RC[-28] -> 66.2 | AP26: - | AQ26: =RC[-29] -> 0 | AR26: =RC[-29] -> 0 | AS26: - | AT26: =RC[-30] -> 0 | AU26: =RC[-30] -> 0 | AV26: =RC[-30] -> 1.8019426997086669 | AW26: =RC[-30] -> 6.9682460687642669 | AY26: - | AZ26: - | BA26: -
A27: =IF(RC[1]="","",DATEVALUE(RC[1])) -> 43379 | B27: 06.10.18 | C27: 24 | D27: 227.54889933333334 | E27: 70.74666666666667 | F27: 8.0919597535999994 | G27: 200.63170369333332 | H27: 45.506666666666668 | I27: 5.8780373630799998 | J27: 25.24 | K27: 26.917195639999999 | L27: 27.219678243333334 | M27: 66.89 | R27: =RC[5] -> 1.8207242776965669 | S27: =RC[1] -> 6.9682460687642669 | T27: =(RC[-16]*RC[-15]-RC[-13]*RC[-12])/1000 -> 6.9682460687642669 | U27: 27.219678243333334 | V27: - | W27: =RC[-2]*RC[-10]/1000 -> 1.8207242776965669 | X27: =ABS((RC[-3]*RC[-11]-RC[-2]*RC[-9])/1000) -> #VALUE! | Y27: =(RC[-14]-RC[1])/RC[-18]*100 -> -0.15076510729115927 | Z27: 27.219678243333334 | AC27: =VALUE(RC[-27]) -> 2018-10-06T00:00:00.000 | AD27: =IF(RC[21]=42,"*",IF(RC[21]=32,"",RC[21])) -> - | AE27: =RC[-28] -> 24 | AF27: =RC[-28] -> 227.54889933333334 | AG27: =RC[-28] -> 70.74666666666667 | AH27: =RC[-28] -> 8.0919597535999994 | AI27: =RC[-28] -> 200.63170369333332 | AJ27: =RC[-28] -> 45.506666666666668 | AK27: =RC[-28] -> 5.8780373630799998 | AL27: =RC[-28] -> 25.24 | AM27: =RC[-28] -> 26.917195639999999 | AN27: =RC[-28] -> 27.219678243333334 | AO27: =RC[-28] -> 66.89 | AP27: - | AQ27: =RC[-29] -> 0 | AR27: =RC[-29] -> 0 | AS27: - | AT27: =RC[-30] -> 0 | AU27: =RC[-30] -> 0 | AV27: =RC[-30] -> 1.8207242776965669 | AW27: =RC[-30] -> 6.9682460687642669 | AY27: - | AZ27: - | BA27: -
A28: =IF(RC[1]="","",DATEVALUE(RC[1])) -> 43380 | B28: 07.10.18 | C28: 24 | D28: 227.54889933333334 | E28: 70.74666666666667 | F28: 8.0919597535999994 | G28: 200.63170369333332 | H28: 45.506666666666668 | I28: 5.8780373630799998 | J28: 25.24 | K28: 26.917195639999999 | L28: 27.219678243333334 | M28: 67.180000000000007 | R28: =RC[5] -> 1.8286179843871337 | S28: =RC[1] -> 6.9682460687642669 | T28: =(RC[-16]*RC[-15]-RC[-13]*RC[-12])/1000 -> 6.9682460687642669 | U28: 27.219678243333334 | V28: - | W28: =RC[-2]*RC[-10]/1000 -> 1.8286179843871337 | X28: =ABS((RC[-3]*RC[-11]-RC[-2]*RC[-9])/1000) -> #VALUE! | Y28: =(RC[-14]-RC[1])/RC[-18]*100 -> -0.15076510729115927 | Z28: 27.219678243333334 | AC28: =VALUE(RC[-27]) -> 2018-10-07T00:00:00.000 | AD28: =IF(RC[21]=42,"*",IF(RC[21]=32,"",RC[21])) -> - | AE28: =RC[-28] -> 24 | AF28: =RC[-28] -> 227.54889933333334 | AG28: =RC[-28] -> 70.74666666666667 | AH28: =RC[-28] -> 8.0919597535999994 | AI28: =RC[-28] -> 200.63170369333332 | AJ28: =RC[-28] -> 45.506666666666668 | AK28: =RC[-28] -> 5.8780373630799998 | AL28: =RC[-28] -> 25.24 | AM28: =RC[-28] -> 26.917195639999999 | AN28: =RC[-28] -> 27.219678243333334 | AO28: =RC[-28] -> 67.180000000000007 | AP28: - | AQ28: =RC[-29] -> 0 | AR28: =RC[-29] -> 0 | AS28: - | AT28: =RC[-30] -> 0 | AU28: =RC[-30] -> 0 | AV28: =RC[-30] -> 1.8286179843871337 | AW28: =RC[-30] -> 6.9682460687642669 | AY28: - | AZ28: - | BA28: -
A29: =IF(RC[1]="","",DATEVALUE(RC[1])) -> 43381 | B29: 08.10.18 | C29: 24 | D29: 227.54889933333334 | E29: 70.74666666666667 | F29: 8.0919597535999994 | G29: 200.63170369333332 | H29: 45.506666666666668 | I29: 5.8780373630799998 | J29: 25.24 | K29: 26.917195639999999 | L29: 27.219678243333334 | M29: 67.17 | R29: =RC[5] -> 1.8283457876047 | S29: =RC[1] -> 6.9682460687642669 | T29: =(RC[-16]*RC[-15]-RC[-13]*RC[-12])/1000 -> 6.9682460687642669 | U29: 27.219678243333334 | V29: - | W29: =RC[-2]*RC[-10]/1000 -> 1.8283457876047 | X29: =ABS((RC[-3]*RC[-11]-RC[-2]*RC[-9])/1000) -> #VALUE! | Y29: =(RC[-14]-RC[1])/RC[-18]*100 -> -0.15076510729115927 | Z29: 27.219678243333334 | AC29: =VALUE(RC[-27]) -> 2018-10-08T00:00:00.000 | AD29: =IF(RC[21]=42,"*",IF(RC[21]=32,"",RC[21])) -> - | AE29: =RC[-28] -> 24 | AF29: =RC[-28] -> 227.54889933333334 | AG29: =RC[-28] -> 70.74666666666667 | AH29: =RC[-28] -> 8.0919597535999994 | AI29: =RC[-28] -> 200.63170369333332 | AJ29: =RC[-28] -> 45.506666666666668 | AK29: =RC[-28] -> 5.8780373630799998 | AL29: =RC[-28] -> 25.24 | AM29: =RC[-28] -> 26.917195639999999 | AN29: =RC[-28] -> 27.219678243333334 | AO29: =RC[-28] -> 67.17 | AP29: - | AQ29: =RC[-29] -> 0 | AR29: =RC[-29] -> 0 | AS29: - | AT29: =RC[-30] -> 0 | AU29: =RC[-30] -> 0 | AV29: =RC[-30] -> 1.8283457876047 | AW29: =RC[-30] -> 6.9682460687642669 | AY29: - | AZ29: - | BA29: -
A30: =IF(RC[1]="","",DATEVALUE(RC[1])) -> 43382 | B30: 09.10.18 | C30: 24 | D30: 227.54889933333334 | E30: 70.74666666666667 | F30: 8.0919597535999994 | G30: 200.63170369333332 | H30: 45.506666666666668 | I30: 5.8780373630799998 | J30: 25.24 | K30: 26.917195639999999 | L30: 27.219678243333334 | M30: 66.88 | R30: =RC[5] -> 1.8204520809141331 | S30: =RC[1] -> 6.9682460687642669 | T30: =(RC[-16]*RC[-15]-RC[-13]*RC[-12])/1000 -> 6.9682460687642669 | U30: 27.219678243333334 | V30: - | W30: =RC[-2]*RC[-10]/1000 -> 1.8204520809141331 | X30: =ABS((RC[-3]*RC[-11]-RC[-2]*RC[-9])/1000) -> #VALUE! | Y30: =(RC[-14]-RC[1])/RC[-18]*100 -> -0.15076510729115927 | Z30: 27.219678243333334 | AC30: =VALUE(RC[-27]) -> 2018-10-09T00:00:00.000 | AD30: =IF(RC[21]=42,"*",IF(RC[21]=32,"",RC[21])) -> - | AE30: =RC[-28] -> 24 | AF30: =RC[-28] -> 227.54889933333334 | AG30: =RC[-28] -> 70.74666666666667 | AH30: =RC[-28] -> 8.0919597535999994 | AI30: =RC[-28] -> 200.63170369333332 | AJ30: =RC[-28] -> 45.506666666666668 | AK30: =RC[-28] -> 5.8780373630799998 | AL30: =RC[-28] -> 25.24 | AM30: =RC[-28] -> 26.917195639999999 | AN30: =RC[-28] -> 27.219678243333334 | AO30: =RC[-28] -> 66.88 | AP30: - | AQ30: =RC[-29] -> 0 | AR30: =RC[-29] -> 0 | AS30: - | AT30: =RC[-30] -> 0 | AU30: =RC[-30] -> 0 | AV30: =RC[-30] -> 1.8204520809141331 | AW30: =RC[-30] -> 6.9682460687642669 | AY30: - | AZ30: - | BA30: -
A31: =IF(RC[1]="","",DATEVALUE(RC[1])) -> 43383 | B31: 10.10.18 | C31: 24 | D31: 227.54889933333334 | E31: 70.74666666666667 | F31: 8.0919597535999994 | G31: 200.63170369333332 | H31: 45.506666666666668 | I31: 5.8780373630799998 | J31: 25.24 | K31: 26.917195639999999 | L31: 30.967466349999999 | M31: 67.64 | R31: 2.0666733806248199 | S31: =RC[1] -> 6.9682460687642669 | T31: =(RC[-16]*RC[-15]-RC[-13]*RC[-12])/1000 -> 6.9682460687642669 | U31: 30.326797490000001 | V31: - | W31: =RC[-2]*RC[-10]/1000 -> 2.0513045822236 | X31: =ABS((RC[-3]*RC[-11]-RC[-2]*RC[-9])/1000) -> #VALUE! | Y31: =(RC[-14]-RC[1])/RC[-18]*100 -> -1.6994332337483395 | Z31: 30.326797490000001 | AC31: =VALUE(RC[-27]) -> 2018-10-10T00:00:00.000 | AD31: =IF(RC[21]=42,"*",IF(RC[21]=32,"",RC[21])) -> - | AE31: =RC[-28] -> 24 | AF31: =RC[-28] -> 227.54889933333334 | AG31: =RC[-28] -> 70.74666666666667 | AH31: =RC[-28] -> 8.0919597535999994 | AI31: =RC[-28] -> 200.63170369333332 | AJ31: =RC[-28] -> 45.506666666666668 | AK31: =RC[-28] -> 5.8780373630799998 | AL31: =RC[-28] -> 25.24 | AM31: =RC[-28] -> 26.917195639999999 | AN31: =RC[-28] -> 30.967466349999999 | AO31: =RC[-28] -> 67.64 | AP31: - | AQ31: =RC[-29] -> 0 | AR31: =RC[-29] -> 0 | AS31: - | AT31: =RC[-30] -> 0 | AU31: =RC[-30] -> 0 | AV31: =RC[-30] -> 2.0666733806248199 | AW31: =RC[-30] -> 6.9682460687642669 | AY31: - | AZ31: - | BA31: -
A32: =IF(RC[1]="","",DATEVALUE(RC[1])) -> 43384 | B32: 11.10.18 | C32: 24 | D32: 227.54889933333334 | E32: 70.74666666666667 | F32: 8.0919597535999994 | G32: 200.63170369333332 | H32: 45.506666666666668 | I32: 5.8780373630799998 | J32: 25.24 | K32: 26.917195639999999 | L32: 27.42756653 | M32: 68.63 | R32: 1.8543986146938001 | S32: =RC[1] -> 6.9682460687642669 | T32: =(RC[-16]*RC[-15]-RC[-13]*RC[-12])/1000 -> 6.9682460687642669 | U32: 26.845314030000001 | V32: - | W32: =RC[-2]*RC[-10]/1000 -> 1.8423939018789 | X32: =ABS((RC[-3]*RC[-11]-RC[-2]*RC[-9])/1000) -> #VALUE! | Y32: =(RC[-14]-RC[1])/RC[-18]*100 -> 3.5827642728823064E-2 | Z32: 26.845314030000001 | AC32: =VALUE(RC[-27]) -> 2018-10-11T00:00:00.000 | AD32: =IF(RC[21]=42,"*",IF(RC[21]=32,"",RC[21])) -> - | AE32: =RC[-28] -> 24 | AF32: =RC[-28] -> 227.54889933333334 | AG32: =RC[-28] -> 70.74666666666667 | AH32: =RC[-28] -> 8.0919597535999994 | AI32: =RC[-28] -> 200.63170369333332 | AJ32: =RC[-28] -> 45.506666666666668 | AK32: =RC[-28] -> 5.8780373630799998 | AL32: =RC[-28] -> 25.24 | AM32: =RC[-28] -> 26.917195639999999 | AN32: =RC[-28] -> 27.42756653 | AO32: =RC[-28] -> 68.63 | AP32: - | AQ32: =RC[-29] -> 0 | AR32: =RC[-29] -> 0 | AS32: - | AT32: =RC[-30] -> 0 | AU32: =RC[-30] -> 0 | AV32: =RC[-30] -> 1.8543986146938001 | AW32: =RC[-30] -> 6.9682460687642669 | AY32: - | AZ32: - | BA32: -
A33: =IF(RC[1]="","",DATEVALUE(RC[1])) -> 43385 | B33: 12.10.18 | C33: 24 | D33: 227.54889933333334 | E33: 70.74666666666667 | F33: 8.0919597535999994 | G33: 200.63170369333332 | H33: 45.506666666666668 | I33: 5.8780373630799998 | J33: 25.24 | K33: 26.917195639999999 | L33: 25.585933690000001 | M33: 68.52 | R33: 1.7257286615076 | S33: =RC[1] -> 6.9682460687642669 | T33: =(RC[-16]*RC[-15]-RC[-13]*RC[-12])/1000 -> 6.9682460687642669 | U33: 25.04516602 | V33: - | W33: =RC[-2]*RC[-10]/1000 -> 1.7160947756903999 | X33: =ABS((RC[-3]*RC[-11]-RC[-2]*RC[-9])/1000) -> #VALUE! | Y33: =(RC[-14]-RC[1])/RC[-18]*100 -> 0.93306769844381465 | Z33: 25.04516602 | AC33: =VALUE(RC[-27]) -> 2018-10-12T00:00:00.000 | AD33: =IF(RC[21]=42,"*",IF(RC[21]=32,"",RC[21])) -> - | AE33: =RC[-28] -> 24 | AF33: =RC[-28] -> 227.54889933333334 | AG33: =RC[-28] -> 70.74666666666667 | AH33: =RC[-28] -> 8.0919597535999994 | AI33: =RC[-28] -> 200.63170369333332 | AJ33: =RC[-28] -> 45.506666666666668 | AK33: =RC[-28] -> 5.8780373630799998 | AL33: =RC[-28] -> 25.24 | AM33: =RC[-28] -> 26.917195639999999 | AN33: =RC[-28] -> 25.585933690000001 | AO33: =RC[-28] -> 68.52 | AP33: - | AQ33: =RC[-29] -> 0 | AR33: =RC[-29] -> 0 | AS33: - | AT33: =RC[-30] -> 0 | AU33: =RC[-30] -> 0 | AV33: =RC[-30] -> 1.7257286615076 | AW33: =RC[-30] -> 6.9682460687642669 | AY33: - | AZ33: - | BA33: -
A34: =IF(RC[1]="","",DATEVALUE(RC[1])) -> 43386 | B34: 13.10.18 | C34: 24 | D34: 227.54889933333334 | E34: 70.74666666666667 | F34: 8.0919597535999994 | G34: 200.63170369333332 | H34: 45.506666666666668 | I34: 5.8780373630799998 | J34: 25.24 | K34: 26.917195639999999 | L34: 27.088582989999999 | M34: 69.510000000000005 | R34: 1.8577510986911201 | S34: =RC[1] -> 6.9682460687642669 | T34: =(RC[-16]*RC[-15]-RC[-13]*RC[-12])/1000 -> 6.9682460687642669 | U34: 26.49849129 | V34: - | W34: =RC[-2]*RC[-10]/1000 -> 1.8419101295679001 | X34: =ABS((RC[-3]*RC[-11]-RC[-2]*RC[-9])/1000) -> #VALUE! | Y34: =(RC[-14]-RC[1])/RC[-18]*100 -> 0.20869301426059295 | Z34: 26.49849129 | AC34: =VALUE(RC[-27]) -> 2018-10-13T00:00:00.000 | AD34: =IF(RC[21]=42,"*",IF(RC[21]=32,"",RC[21])) -> - | AE34: =RC[-28] -> 24 | AF34: =RC[-28] -> 227.54889933333334 | AG34: =RC[-28] -> 70.74666666666667 | AH34: =RC[-28] -> 8.0919597535999994 | AI34: =RC[-28] -> 200.63170369333332 | AJ34: =RC[-28] -> 45.506666666666668 | AK34: =RC[-28] -> 5.8780373630799998 | AL34: =RC[-28] -> 25.24 | AM34: =RC[-28] -> 26.917195639999999 | AN34: =RC[-28] -> 27.088582989999999 | AO34: =RC[-28] -> 69.510000000000005 | AP34: - | AQ34: =RC[-29] -> 0 | AR34: =RC[-29] -> 0 | AS34: - | AT34: =RC[-30] -> 0 | AU34: =RC[-30] -> 0 | AV34: =RC[-30] -> 1.8577510986911201 | AW34: =RC[-30] -> 6.9682460687642669 | AY34: - | AZ34: - | BA34: -
A35: =IF(RC[1]="","",DATEVALUE(RC[1])) -> 43387 | B35: 14.10.18 | C35: 24 | D35: 227.54889933333334 | E35: 70.74666666666667 | F35: 8.0919597535999994 | G35: 200.63170369333332 | H35: 45.506666666666668 | I35: 5.8780373630799998 | J35: 25.24 | K35: 26.917195639999999 | L35: 30.94262123 | M35: 70.319999999999993 | R35: 2.1475858173306599 | S35: =RC[1] -> 6.9682460687642669 | T35: =(RC[-16]*RC[-15]-RC[-13]*RC[-12])/1000 -> 6.9682460687642669 | U35: 30.25300026 | V35: - | W35: =RC[-2]*RC[-10]/1000 -> 2.1273909782831999 | X35: =ABS((RC[-3]*RC[-11]-RC[-2]*RC[-9])/1000) -> #VALUE! | Y35: =(RC[-14]-RC[1])/RC[-18]*100 -> -1.6626507967548325 | Z35: 30.25300026 | AC35: =VALUE(RC[-27]) -> 2018-10-14T00:00:00.000 | AD35: =IF(RC[21]=42,"*",IF(RC[21]=32,"",RC[21])) -> - | AE35: =RC[-28] -> 24 | AF35: =RC[-28] -> 227.54889933333334 | AG35: =RC[-28] -> 70.74666666666667 | AH35: =RC[-28] -> 8.0919597535999994 | AI35: =RC[-28] -> 200.63170369333332 | AJ35: =RC[-28] -> 45.506666666666668 | AK35: =RC[-28] -> 5.8780373630799998 | AL35: =RC[-28] -> 25.24 | AM35: =RC[-28] -> 26.917195639999999 | AN35: =RC[-28] -> 30.94262123 | AO35: =RC[-28] -> 70.319999999999993 | AP35: - | AQ35: =RC[-29] -> 0 | AR35: =RC[-29] -> 0 | AS35: - | AT35: =RC[-30] -> 0 | AU35: =RC[-30] -> 0 | AV35: =RC[-30] -> 2.1475858173306599 | AW35: =RC[-30] -> 6.9682460687642669 | AY35: - | AZ35: - | BA35: -
A36: =IF(RC[1]="","",DATEVALUE(RC[1])) -> 43388 | B36: 15.10.18 | C36: 24 | D36: 227.54889933333334 | E36: 70.74666666666667 | F36: 8.0919597535999994 | G36: 200.63170369333332 | H36: 45.506666666666668 | I36: 5.8780373630799998 | J36: 25.24 | K36: 26.917195639999999 | L36: 28.516057969999999 | M36: 69.849999999999994 | R36: 1.9611268629979901 | S36: =RC[1] -> 6.9682460687642669 | T36: =(RC[-16]*RC[-15]-RC[-13]*RC[-12])/1000 -> 6.9682460687642669 | U36: 27.89033508 | V36: - | W36: =RC[-2]*RC[-10]/1000 -> 1.9481399053379997 | X36: =ABS((RC[-3]*RC[-11]-RC[-2]*RC[-9])/1000) -> #VALUE! | Y36: =(RC[-14]-RC[1])/RC[-18]*100 -> -0.48503771940622586 | Z36: 27.89033508 | AC36: =VALUE(RC[-27]) -> 2018-10-15T00:00:00.000 | AD36: =IF(RC[21]=42,"*",IF(RC[21]=32,"",RC[21])) -> - | AE36: =RC[-28] -> 24 | AF36: =RC[-28] -> 227.54889933333334 | AG36: =RC[-28] -> 70.74666666666667 | AH36: =RC[-28] -> 8.0919597535999994 | AI36: =RC[-28] -> 200.63170369333332 | AJ36: =RC[-28] -> 45.506666666666668 | AK36: =RC[-28] -> 5.8780373630799998 | AL36: =RC[-28] -> 25.24 | AM36: =RC[-28] -> 26.917195639999999 | AN36: =RC[-28] -> 28.516057969999999 | AO36: =RC[-28] -> 69.849999999999994 | AP36: - | AQ36: =RC[-29] -> 0 | AR36: =RC[-29] -> 0 | AS36: - | AT36: =RC[-30] -> 0 | AU36: =RC[-30] -> 0 | AV36: =RC[-30] -> 1.9611268629979901 | AW36: =RC[-30] -> 6.9682460687642669 | AY36: - | AZ36: - | BA36: -
A37: =IF(RC[1]="","",DATEVALUE(RC[1])) -> 43389 | B37: 16.10.18 | C37: 24 | D37: 227.54889933333334 | E37: 70.74666666666667 | F37: 8.0919597535999994 | G37: 200.63170369333332 | H37: 45.506666666666668 | I37: 5.8780373630799998 | J37: 25.24 | K37: 26.917195639999999 | L37: 26.209968570000001 | M37: 69.760000000000005 | R37: 1.80189504872456 | S37: =RC[1] -> 6.9682460687642669 | T37: =(RC[-16]*RC[-15]-RC[-13]*RC[-12])/1000 -> 6.9682460687642669 | U37: 25.63552284 | V37: - | W37: =RC[-2]*RC[-10]/1000 -> 1.7883340733184001 | X37: =ABS((RC[-3]*RC[-11]-RC[-2]*RC[-9])/1000) -> #VALUE! | Y37: =(RC[-14]-RC[1])/RC[-18]*100 -> 0.63881867940424963 | Z37: 25.63552284 | AC37: =VALUE(RC[-27]) -> 2018-10-16T00:00:00.000 | AD37: =IF(RC[21]=42,"*",IF(RC[21]=32,"",RC[21])) -> - | AE37: =RC[-28] -> 24 | AF37: =RC[-28] -> 227.54889933333334 | AG37: =RC[-28] -> 70.74666666666667 | AH37: =RC[-28] -> 8.0919597535999994 | AI37: =RC[-28] -> 200.63170369333332 | AJ37: =RC[-28] -> 45.506666666666668 | AK37: =RC[-28] -> 5.8780373630799998 | AL37: =RC[-28] -> 25.24 | AM37: =RC[-28] -> 26.917195639999999 | AN37: =RC[-28] -> 26.209968570000001 | AO37: =RC[-28] -> 69.760000000000005 | AP37: - | AQ37: =RC[-29] -> 0 | AR37: =RC[-29] -> 0 | AS37: - | AT37: =RC[-30] -> 0 | AU37: =RC[-30] -> 0 | AV37: =RC[-30] -> 1.80189504872456 | AW37: =RC[-30] -> 6.9682460687642669 | AY37: - | AZ37: - | BA37: -
A38: =IF(RC[1]="","",DATEVALUE(RC[1])) -> 43390 | B38: 17.10.18 | C38: 24 | D38: =AVERAGE(R[1]C:R[3]C) -> 227.54889933333334 | E38: =AVERAGE(R[1]C:R[3]C) -> 70.74666666666667 | F38: =AVERAGE(R[1]C:R[3]C) -> 8.0919597535999994 | G38: =AVERAGE(R[1]C:R[3]C) -> 200.63170369333332 | H38: =AVERAGE(R[1]C:R[3]C) -> 45.506666666666668 | I38: =AVERAGE(R[1]C:R[3]C) -> 5.8780373630799998 | J38: =AVERAGE(R[1]C:R[3]C) -> 25.24 | K38: =AVERAGE(R[1]C:R[3]C) -> 26.917195639999999 | L38: 26.483922960000001 | M38: 70.06 | R38: 1.8277515190599001 | S38: =RC[1] -> 6.9682460687642669 | T38: =(RC[-16]*RC[-15]-RC[-13]*RC[-12])/1000 -> 6.9682460687642669 | U38: 25.89974213 | V38: - | W38: =RC[-2]*RC[-10]/1000 -> 1.8145359336278 | X38: =ABS((RC[-3]*RC[-11]-RC[-2]*RC[-9])/1000) -> #VALUE! | Y38: =(RC[-14]-RC[1])/RC[-18]*100 -> 0.50712499134991273 | Z38: 25.89974213 | AC38: =VALUE(RC[-27]) -> 2018-10-17T00:00:00.000 | AD38: =IF(RC[21]=42,"*",IF(RC[21]=32,"",RC[21])) -> - | AE38: =RC[-28] -> 24 | AF38: =RC[-28] -> 227.54889933333334 | AG38: =RC[-28] -> 70.74666666666667 | AH38: =RC[-28] -> 8.0919597535999994 | AI38: =RC[-28] -> 200.63170369333332 | AJ38: =RC[-28] -> 45.506666666666668 | AK38: =RC[-28] -> 5.8780373630799998 | AL38: =RC[-28] -> 25.24 | AM38: =RC[-28] -> 26.917195639999999 | AN38: =RC[-28] -> 26.483922960000001 | AO38: =RC[-28] -> 70.06 | AP38: - | AQ38: =RC[-29] -> 0 | AR38: =RC[-29] -> 0 | AS38: - | AT38: =RC[-30] -> 0 | AU38: =RC[-30] -> 0 | AV38: =RC[-30] -> 1.8277515190599001 | AW38: =RC[-30] -> 6.9682460687642669 | AY38: - | AZ38: - | BA38: -
A39: =IF(RC[1]="","",DATEVALUE(RC[1])) -> 43391 | B39: 18.10.18 | C39: 24 | D39: 227.93817139000001 | E39: 71.099999999999994 | F39: 8.0914124110400003 | G39: 200.87628174 | H39: 46.24 | I39: 5.8722574093200004 | J39: 24.859999999999992 | K39: 27.061889650000001 | L39: 27.37915993 | M39: 70.45 | R39: 1.9018264187446301 | S39: 6.9300356429731496 | T39: 6.9178847181713987 | U39: 26.767221450000001 | V39: - | W39: 1.8857507511525002 | X39: #VALUE! | Y39: 0.14669138508915544 | Z39: 26.767221450000001 | AC39: =VALUE(RC[-27]) -> 2018-10-18T00:00:00.000 | AD39: =IF(RC[21]=42,"*",IF(RC[21]=32,"",RC[21])) ->  | AE39: =RC[-28] -> 24 | AF39: =RC[-28] -> 227.93817139000001 | AG39: =RC[-28] -> 71.099999999999994 | AH39: =RC[-28] -> 8.0914124110400003 | AI39: =RC[-28] -> 200.87628174 | AJ39: =RC[-28] -> 46.24 | AK39: =RC[-28] -> 5.8722574093200004 | AL39: =RC[-28] -> 24.859999999999992 | AM39: =RC[-28] -> 27.061889650000001 | AN39: =RC[-28] -> 27.37915993 | AO39: =RC[-28] -> 70.45 | AP39: - | AQ39: =RC[-29] -> 0 | AR39: =RC[-29] -> 0 | AS39: - | AT39: =RC[-30] -> 0 | AU39: =RC[-30] -> 0 | AV39: =RC[-30] -> 1.9018264187446301 | AW39: =RC[-30] -> 6.9300356429731496
A40: =IF(RC[1]="","",DATEVALUE(RC[1])) -> 43392 | B40: 19.10.18 | C40: 24 | D40: 226.69308472 | E40: 70.89 | F40: 8.0973380779199999 | G40: 200.5375061 | H40: 45.57 | I40: 5.8848617982800002 | J40: 25.32 | K40: 26.15557862 | L40: 26.374864580000001 | M40: 70.239999999999995 | R40: 1.82405588277443 | S40: 6.93946532912965 | T40: 6.9317786228238001 | U40: 25.79065323 | V40: - | W40: 1.8115354828751999 | X40: #VALUE! | Y40: 0.18197363530492205 | Z40: 25.79065323 | AC40: =VALUE(RC[-27]) -> 2018-10-19T00:00:00.000 | AD40: =IF(RC[21]=42,"*",IF(RC[21]=32,"",RC[21])) ->  | AE40: =RC[-28] -> 24 | AF40: =RC[-28] -> 226.69308472 | AG40: =RC[-28] -> 70.89 | AH40: =RC[-28] -> 8.0973380779199999 | AI40: =RC[-28] -> 200.5375061 | AJ40: =RC[-28] -> 45.57 | AK40: =RC[-28] -> 5.8848617982800002 | AL40: =RC[-28] -> 25.32 | AM40: =RC[-28] -> 26.15557862 | AN40: =RC[-28] -> 26.374864580000001 | AO40: =RC[-28] -> 70.239999999999995 | AP40: - | AQ40: =RC[-29] -> 0 | AR40: =RC[-29] -> 0 | AS40: - | AT40: =RC[-30] -> 0 | AU40: =RC[-30] -> 0 | AV40: =RC[-30] -> 1.82405588277443 | AW40: =RC[-30] -> 6.93946532912965
A41: =IF(RC[1]="","",DATEVALUE(RC[1])) -> 43393 | B41: 20.10.18 | C41: 24 | D41: 228.01544189000001 | E41: 70.25 | F41: 8.0871287718399998 | G41: 200.48132323999999 | H41: 44.71 | I41: 5.8769928816399997 | J41: 25.54 | K41: 27.53411865 | L41: 27.905010220000001 | M41: 69.55 | R41: 1.91609406467947 | S41: 7.0659781957580998 | T41: 7.0545648307121009 | U41: 27.294916149999999 | V41: - | W41: 1.8983614182324997 | X41: #VALUE! | Y41: 0.11931410673783674 | Z41: 27.294916149999999 | AC41: =VALUE(RC[-27]) -> 2018-10-20T00:00:00.000 | AD41: =IF(RC[21]=42,"*",IF(RC[21]=32,"",RC[21])) ->  | AE41: =RC[-28] -> 24 | AF41: =RC[-28] -> 228.01544189000001 | AG41: =RC[-28] -> 70.25 | AH41: =RC[-28] -> 8.0871287718399998 | AI41: =RC[-28] -> 200.48132323999999 | AJ41: =RC[-28] -> 44.71 | AK41: =RC[-28] -> 5.8769928816399997 | AL41: =RC[-28] -> 25.54 | AM41: =RC[-28] -> 27.53411865 | AN41: =RC[-28] -> 27.905010220000001 | AO41: =RC[-28] -> 69.55 | AP41: - | AQ41: =RC[-29] -> 0 | AR41: =RC[-29] -> 0 | AS41: - | AT41: =RC[-30] -> 0 | AU41: =RC[-30] -> 0 | AV41: =RC[-30] -> 1.91609406467947 | AW41: =RC[-30] -> 7.0659781957580998
A42: =IF(RC[1]="","",DATEVALUE(RC[1])) -> 43394 | B42: 21.10.18 | C42: 24 | D42: 233.30654906999999 | E42: 69.349999999999994 | F42: 8.0793632217199995 | G42: 200.13143921 | H42: 44.52 | I42: 5.8738837228399996 | J42: 24.829999999999991 | K42: 33.175109859999999 | L42: 33.405830379999998 | M42: 68.680000000000007 | R42: 2.2617317593388702 | S42: 7.2798278398777096 | T42: 7.2699575043752978 | U42: 32.696239470000002 | V42: - | W42: 2.2455777267996004 | X42: #VALUE! | Y42: 0.23927794248134782 | Z42: 32.696239470000002 | AC42: =VALUE(RC[-27]) -> 2018-10-21T00:00:00.000 | AD42: =IF(RC[21]=42,"*",IF(RC[21]=32,"",RC[21])) ->  | AE42: =RC[-28] -> 24 | AF42: =RC[-28] -> 233.30654906999999 | AG42: =RC[-28] -> 69.349999999999994 | AH42: =RC[-28] -> 8.0793632217199995 | AI42: =RC[-28] -> 200.13143921 | AJ42: =RC[-28] -> 44.52 | AK42: =RC[-28] -> 5.8738837228399996 | AL42: =RC[-28] -> 24.829999999999991 | AM42: =RC[-28] -> 33.175109859999999 | AN42: =RC[-28] -> 33.405830379999998 | AO42: =RC[-28] -> 68.680000000000007 | AP42: - | AQ42: =RC[-29] -> 0 | AR42: =RC[-29] -> 0 | AS42: - | AT42: =RC[-30] -> 0 | AU42: =RC[-30] -> 0 | AV42: =RC[-30] -> 2.2617317593388702 | AW42: =RC[-30] -> 7.2798278398777096
A43: =IF(RC[1]="","",DATEVALUE(RC[1])) -> 43395 | B43: 22.10.18 | C43: 24 | D43: 228.53617858999999 | E43: 69.819999999999993 | F43: 8.0944874884800004 | G43: 200.41140747 | H43: 44.53 | I43: 5.8854122020400004 | J43: 25.289999999999992 | K43: 28.124771119999998 | L43: 28.533700939999999 | M43: 69.150000000000006 | R43: 1.95144912343556 | S43: 7.0485921133084899 | T43: 7.0320760145146979 | U43: 27.914871219999998 | V43: - | W43: 1.9303133448630001 | X43: #VALUE! | Y43: 0.10473450720684165 | Z43: 27.914871219999998 | AC43: =VALUE(RC[-27]) -> 2018-10-22T00:00:00.000 | AD43: =IF(RC[21]=42,"*",IF(RC[21]=32,"",RC[21])) ->  | AE43: =RC[-28] -> 24 | AF43: =RC[-28] -> 228.53617858999999 | AG43: =RC[-28] -> 69.819999999999993 | AH43: =RC[-28] -> 8.0944874884800004 | AI43: =RC[-28] -> 200.41140747 | AJ43: =RC[-28] -> 44.53 | AK43: =RC[-28] -> 5.8854122020400004 | AL43: =RC[-28] -> 25.289999999999992 | AM43: =RC[-28] -> 28.124771119999998 | AN43: =RC[-28] -> 28.533700939999999 | AO43: =RC[-28] -> 69.150000000000006 | AP43: - | AQ43: =RC[-29] -> 0 | AR43: =RC[-29] -> 0 | AS43: - | AT43: =RC[-30] -> 0 | AU43: =RC[-30] -> 0 | AV43: =RC[-30] -> 1.95144912343556 | AW43: =RC[-30] -> 7.0485921133084899
A44: =IF(RC[1]="","",DATEVALUE(RC[1])) ->  | C44: 24 | J44: =RC[-5]-RC[-2] -> #VALUE! | T44: =(RC[-16]*RC[-15]-RC[-13]*RC[-12])/1000 -> #VALUE! | W44: =RC[-2]*RC[-10]/1000 -> #VALUE! | X44: =ABS((RC[-3]*RC[-11]-RC[-2]*RC[-9])/1000) -> #VALUE! | Y44: =(RC[-14]-RC[1])/RC[-18]*100 -> #VALUE! | AC44: =VALUE(RC[-27]) -> #VALUE! | AD44: =IF(RC[21]=42,"*",IF(RC[21]=32,"",RC[21])) ->  | AE44: =RC[-28] -> 24 | AF44: =RC[-28] ->  | AG44: =RC[-28] ->  | AH44: =RC[-28] ->  | AI44: =RC[-28] ->  | AJ44: =RC[-28] ->  | AK44: =RC[-28] ->  | AL44: =RC[-28] -> #VALUE! | AM44: =RC[-28] ->  | AN44: =RC[-28] ->  | AO44: =RC[-28] ->  | AP44: - | AQ44: =RC[-29] -> 0 | AR44: =RC[-29] -> 0 | AS44: - | AT44: =RC[-30] -> 0 | AU44: =RC[-30] -> 0 | AV44: =RC[-30] ->  | AW44: =RC[-30] -> 
A45: =IF(RC[1]="","",DATEVALUE(RC[1])) ->  | C45: 24 | T45: =(RC[-16]*RC[-15]-RC[-13]*RC[-12])/1000 -> #VALUE! | W45: =RC[-2]*RC[-10]/1000 -> #VALUE! | X45: =ABS((RC[-3]*RC[-11]-RC[-2]*RC[-9])/1000) -> #VALUE! | Y45: =(RC[-14]-RC[1])/RC[-18]*100 -> #VALUE! | AC45: =VALUE(RC[-27]) -> #VALUE! | AD45: =IF(RC[21]=42,"*",IF(RC[21]=32,"",RC[21])) ->  | AE45: =RC[-28] -> 24 | AF45: =RC[-28] ->  | AG45: =RC[-28] ->  | AH45: =RC[-28] ->  | AI45: =RC[-28] ->  | AJ45: =RC[-28] ->  | AK45: =RC[-28] ->  | AL45: =RC[-28] -> 0 | AM45: =RC[-28] ->  | AN45: =RC[-28] ->  | AO45: =RC[-28] ->  | AP45: - | AQ45: =RC[-29] -> 0 | AR45: =RC[-29] -> 0 | AS45: - | AT45: =RC[-30] -> 0 | AU45: =RC[-30] -> 0 | AV45: =RC[-30] ->  | AW45: =RC[-30] -> 
A46: =IF(RC[1]="","",DATEVALUE(RC[1])) ->  | C46: 24 | T46: =(RC[-16]*RC[-15]-RC[-13]*RC[-12])/1000 -> #VALUE! | W46: =RC[-2]*RC[-10]/1000 -> #VALUE! | X46: =ABS((RC[-3]*RC[-11]-RC[-2]*RC[-9])/1000) -> #VALUE! | Y46: =(RC[-14]-RC[1])/RC[-18]*100 -> #VALUE! | AC46: =VALUE(RC[-27]) -> #VALUE! | AD46: =IF(RC[21]=42,"*",IF(RC[21]=32,"",RC[21])) ->  | AE46: =RC[-28] -> 24 | AF46: =RC[-28] ->  | AG46: =RC[-28] ->  | AH46: =RC[-28] ->  | AI46: =RC[-28] ->  | AJ46: =RC[-28] ->  | AK46: =RC[-28] ->  | AL46: =RC[-28] -> 0 | AM46: =RC[-28] ->  | AN46: =RC[-28] ->  | AO46: =RC[-28] ->  | AP46: - | AQ46: =RC[-29] -> 0 | AR46: =RC[-29] -> 0 | AS46: - | AT46: =RC[-30] -> 0 | AU46: =RC[-30] -> 0 | AV46: =RC[-30] ->  | AW46: =RC[-30] -> 
A47: =IF(RC[1]="","",DATEVALUE(RC[1])) ->  | C47: 24 | T47: =(RC[-16]*RC[-15]-RC[-13]*RC[-12])/1000 -> #VALUE! | W47: =RC[-2]*RC[-10]/1000 -> #VALUE! | X47: =ABS((RC[-3]*RC[-11]-RC[-2]*RC[-9])/1000) -> #VALUE! | Y47: =(RC[-14]-RC[1])/RC[-18]*100 -> #VALUE! | AC47: =VALUE(RC[-27]) -> #VALUE! | AD47: =IF(RC[21]=42,"*",IF(RC[21]=32,"",RC[21])) ->  | AE47: =RC[-28] -> 24 | AF47: =RC[-28] ->  | AG47: =RC[-28] ->  | AH47: =RC[-28] ->  | AI47: =RC[-28] ->  | AJ47: =RC[-28] ->  | AK47: =RC[-28] ->  | AL47: =RC[-28] -> 0 | AM47: =RC[-28] ->  | AN47: =RC[-28] ->  | AO47: =RC[-28] ->  | AP47: - | AQ47: =RC[-29] -> 0 | AR47: =RC[-29] -> 0 | AS47: - | AT47: =RC[-30] -> 0 | AU47: =RC[-30] -> 0 | AV47: =RC[-30] ->  | AW47: =RC[-30] -> 
A48: =IF(RC[1]="","",DATEVALUE(RC[1])) ->  | C48: 24 | T48: =(RC[-16]*RC[-15]-RC[-13]*RC[-12])/1000 -> #VALUE! | W48: =RC[-2]*RC[-10]/1000 -> #VALUE! | X48: =ABS((RC[-3]*RC[-11]-RC[-2]*RC[-9])/1000) -> #VALUE! | Y48: =(RC[-14]-RC[1])/RC[-18]*100 -> #VALUE! | AC48: =VALUE(RC[-27]) -> #VALUE! | AD48: =IF(RC[21]=42,"*",IF(RC[21]=32,"",RC[21])) ->  | AE48: =RC[-28] -> 24 | AF48: =RC[-28] ->  | AG48: =RC[-28] ->  | AH48: =RC[-28] ->  | AI48: =RC[-28] ->  | AJ48: =RC[-28] ->  | AK48: =RC[-28] ->  | AL48: =RC[-28] -> 0 | AM48: =RC[-28] ->  | AN48: =RC[-28] ->  | AO48: =RC[-28] ->  | AP48: - | AQ48: =RC[-29] -> 0 | AR48: =RC[-29] -> 0 | AS48: - | AT48: =RC[-30] -> 0 | AU48: =RC[-30] -> 0 | AV48: =RC[-30] ->  | AW48: =RC[-30] -> 
A49: =IF(RC[1]="","",DATEVALUE(RC[1])) ->  | C49: 24 | T49: =(RC[-16]*RC[-15]-RC[-13]*RC[-12])/1000 -> #VALUE! | W49: =RC[-2]*RC[-10]/1000 -> #VALUE! | X49: =ABS((RC[-3]*RC[-11]-RC[-2]*RC[-9])/1000) -> #VALUE! | Y49: =(RC[-14]-RC[1])/RC[-18]*100 -> #VALUE! | AC49: =VALUE(RC[-27]) -> #VALUE! | AD49: =IF(RC[21]=42,"*",IF(RC[21]=32,"",RC[21])) ->  | AE49: =RC[-28] -> 24 | AF49: =RC[-28] ->  | AG49: =RC[-28] ->  | AH49: =RC[-28] ->  | AI49: =RC[-28] ->  | AJ49: =RC[-28] ->  | AK49: =RC[-28] ->  | AL49: =RC[-28] -> 0 | AM49: =RC[-28] ->  | AN49: =RC[-28] ->  | AO49: =RC[-28] ->  | AP49: - | AQ49: =RC[-29] -> 0 | AR49: =RC[-29] -> 0 | AS49: - | AT49: =RC[-30] -> 0 | AU49: =RC[-30] -> 0 | AV49: =RC[-30] ->  | AW49: =RC[-30] -> 
A50: =IF(RC[1]="","",DATEVALUE(RC[1])) ->  | T50: =(RC[-16]*RC[-15]-RC[-13]*RC[-12])/1000 -> #VALUE! | W50: =RC[-2]*RC[-10]/1000 -> #VALUE! | X50: =ABS((RC[-3]*RC[-11]-RC[-2]*RC[-9])/1000) -> #VALUE! | Y50: =(RC[-14]-RC[1])/RC[-18]*100 -> #VALUE! | AC50: =VALUE(RC[-27]) -> #VALUE! | AD50: =IF(RC[21]=42,"*",IF(RC[21]=32,"",RC[21])) ->  | AE50: =RC[-28] ->  | AF50: =RC[-28] ->  | AG50: =RC[-28] ->  | AH50: =RC[-28] ->  | AI50: =RC[-28] ->  | AJ50: =RC[-28] ->  | AK50: =RC[-28] ->  | AL50: =RC[-28] -> 0 | AM50: =RC[-28] ->  | AN50: =RC[-28] ->  | AO50: =RC[-28] ->  | AP50: - | AQ50: =RC[-29] -> 0 | AR50: =RC[-29] -> 0 | AS50: - | AT50: =RC[-30] -> 0 | AU50: =RC[-30] -> 0 | AV50: =RC[-30] ->  | AW50: =RC[-30] -> 
A51: =IF(RC[1]="","",DATEVALUE(RC[1])) ->  | T51: =(RC[-16]*RC[-15]-RC[-13]*RC[-12])/1000 -> #VALUE! | W51: =RC[-2]*RC[-10]/1000 -> #VALUE! | X51: =ABS((RC[-3]*RC[-11]-RC[-2]*RC[-9])/1000) -> #VALUE! | Y51: =(RC[-14]-RC[1])/RC[-18]*100 -> #VALUE! | AC51: =VALUE(RC[-27]) -> #VALUE! | AD51: =IF(RC[21]=42,"*",IF(RC[21]=32,"",RC[21])) ->  | AE51: =RC[-28] ->  | AF51: =RC[-28] ->  | AG51: =RC[-28] ->  | AH51: =RC[-28] ->  | AI51: =RC[-28] ->  | AJ51: =RC[-28] ->  | AK51: =RC[-28] ->  | AL51: =RC[-28] -> 0 | AM51: =RC[-28] ->  | AN51: =RC[-28] ->  | AO51: =RC[-28] ->  | AP51: - | AQ51: =RC[-29] -> 0 | AR51: =RC[-29] -> 0 | AS51: - | AT51: =RC[-30] -> 0 | AU51: =RC[-30] -> 0 | AV51: =RC[-30] ->  | AW51: =RC[-30] -> 
A52: =IF(RC[1]="","",DATEVALUE(RC[1])) ->  | T52: =(RC[-16]*RC[-15]-RC[-13]*RC[-12])/1000 -> #VALUE! | W52: =RC[-2]*RC[-10]/1000 -> #VALUE! | X52: =ABS((RC[-3]*RC[-11]-RC[-2]*RC[-9])/1000) -> #VALUE! | Y52: =(RC[-14]-RC[1])/RC[-18]*100 -> #VALUE! | AC52: =VALUE(RC[-27]) -> #VALUE! | AD52: =IF(RC[21]=42,"*",IF(RC[21]=32,"",RC[21])) ->  | AE52: =RC[-28] ->  | AF52: =RC[-28] ->  | AG52: =RC[-28] ->  | AH52: =RC[-28] ->  | AI52: =RC[-28] ->  | AJ52: =RC[-28] ->  | AK52: =RC[-28] ->  | AL52: =RC[-28] -> 0 | AM52: =RC[-28] ->  | AN52: =RC[-28] ->  | AO52: =RC[-28] ->  | AP52: - | AQ52: =RC[-29] -> 0 | AR52: =RC[-29] -> 0 | AS52: - | AT52: =RC[-30] -> 0 | AU52: =RC[-30] -> 0 | AV52: =RC[-30] ->  | AW52: =RC[-30] -> 
A53: =IF(RC[1]="","",DATEVALUE(RC[1])) ->  | T53: =(RC[-16]*RC[-15]-RC[-13]*RC[-12])/1000 -> #VALUE! | W53: =RC[-2]*RC[-10]/1000 -> #VALUE! | X53: =ABS((RC[-3]*RC[-11]-RC[-2]*RC[-9])/1000) -> #VALUE! | Y53: =(RC[-14]-RC[1])/RC[-18]*100 -> #VALUE! | AC53: =VALUE(RC[-27]) -> #VALUE! | AD53: =IF(RC[21]=42,"*",IF(RC[21]=32,"",RC[21])) ->  | AE53: =RC[-28] ->  | AF53: =RC[-28] ->  | AG53: =RC[-28] ->  | AH53: =RC[-28] ->  | AI53: =RC[-28] ->  | AJ53: =RC[-28] ->  | AK53: =RC[-28] ->  | AL53: =RC[-28] -> 0 | AM53: =RC[-28] ->  | AN53: =RC[-28] ->  | AO53: =RC[-28] ->  | AP53: - | AQ53: =RC[-29] -> 0 | AR53: =RC[-29] -> 0 | AS53: - | AT53: =RC[-30] -> 0 | AU53: =RC[-30] -> 0 | AV53: =RC[-30] ->  | AW53: =RC[-30] -> 
A54: =IF(RC[1]="","",DATEVALUE(RC[1])) ->  | T54: =(RC[-16]*RC[-15]-RC[-13]*RC[-12])/1000 -> #VALUE! | W54: =RC[-2]*RC[-10]/1000 -> #VALUE! | X54: =ABS((RC[-3]*RC[-11]-RC[-2]*RC[-9])/1000) -> #VALUE! | Y54: =(RC[-14]-RC[1])/RC[-18]*100 -> #VALUE! | AC54: =VALUE(RC[-27]) -> #VALUE! | AD54: =IF(RC[21]=42,"*",IF(RC[21]=32,"",RC[21])) ->  | AE54: =RC[-28] ->  | AF54: =RC[-28] ->  | AG54: =RC[-28] ->  | AH54: =RC[-28] ->  | AI54: =RC[-28] ->  | AJ54: =RC[-28] ->  | AK54: =RC[-28] ->  | AL54: =RC[-28] -> 0 | AM54: =RC[-28] ->  | AN54: =RC[-28] ->  | AO54: =RC[-28] ->  | AP54: - | AQ54: =RC[-29] -> 0 | AR54: =RC[-29] -> 0 | AS54: - | AT54: =RC[-30] -> 0 | AU54: =RC[-30] -> 0 | AV54: =RC[-30] ->  | AW54: =RC[-30] -> 
A55: =IF(RC[1]="","",DATEVALUE(RC[1])) ->  | T55: =(RC[-16]*RC[-15]-RC[-13]*RC[-12])/1000 -> #VALUE! | W55: =RC[-2]*RC[-10]/1000 -> #VALUE! | X55: =ABS((RC[-3]*RC[-11]-RC[-2]*RC[-9])/1000) -> #VALUE! | Y55: =(RC[-14]-RC[1])/RC[-18]*100 -> #VALUE! | AC55: =VALUE(RC[-27]) -> #VALUE! | AD55: =IF(RC[21]=42,"*",IF(RC[21]=32,"",RC[21])) ->  | AE55: =RC[-28] ->  | AF55: =RC[-28] ->  | AG55: =RC[-28] ->  | AH55: =RC[-28] ->  | AI55: =RC[-28] ->  | AJ55: =RC[-28] ->  | AK55: =RC[-28] ->  | AL55: =RC[-28] -> 0 | AM55: =RC[-28] ->  | AN55: =RC[-28] ->  | AO55: =RC[-28] ->  | AP55: - | AQ55: =RC[-29] -> 0 | AR55: =RC[-29] -> 0 | AS55: - | AT55: =RC[-30] -> 0 | AU55: =RC[-30] -> 0 | AV55: =RC[-30] ->  | AW55: =RC[-30] -> 
A56: =IF(RC[1]="","",DATEVALUE(RC[1])) ->  | T56: =(RC[-16]*RC[-15]-RC[-13]*RC[-12])/1000 -> #VALUE! | W56: =RC[-2]*RC[-10]/1000 -> #VALUE! | X56: =ABS((RC[-3]*RC[-11]-RC[-2]*RC[-9])/1000) -> #VALUE! | Y56: =(RC[-14]-RC[1])/RC[-18]*100 -> #VALUE! | AC56: =VALUE(RC[-27]) -> #VALUE! | AD56: =IF(RC[21]=42,"*",IF(RC[21]=32,"",RC[21])) ->  | AE56: =RC[-28] ->  | AF56: =RC[-28] ->  | AG56: =RC[-28] ->  | AH56: =RC[-28] ->  | AI56: =RC[-28] ->  | AJ56: =RC[-28] ->  | AK56: =RC[-28] ->  | AL56: =RC[-28] -> 0 | AM56: =RC[-28] ->  | AN56: =RC[-28] ->  | AO56: =RC[-28] ->  | AP56: - | AQ56: =RC[-29] -> 0 | AR56: =RC[-29] -> 0 | AS56: - | AT56: =RC[-30] -> 0 | AU56: =RC[-30] -> 0 | AV56: =RC[-30] ->  | AW56: =RC[-30] -> 
A57: =IF(RC[1]="","",DATEVALUE(RC[1])) ->  | T57: =(RC[-16]*RC[-15]-RC[-13]*RC[-12])/1000 -> #VALUE! | W57: =RC[-2]*RC[-10]/1000 -> #VALUE! | X57: =ABS((RC[-3]*RC[-11]-RC[-2]*RC[-9])/1000) -> #VALUE! | Y57: =(RC[-14]-RC[1])/RC[-18]*100 -> #VALUE! | AC57: =VALUE(RC[-27]) -> #VALUE! | AD57: =IF(RC[21]=42,"*",IF(RC[21]=32,"",RC[21])) ->  | AE57: =RC[-28] ->  | AF57: =RC[-28] ->  | AG57: =RC[-28] ->  | AH57: =RC[-28] ->  | AI57: =RC[-28] ->  | AJ57: =RC[-28] ->  | AK57: =RC[-28] ->  | AL57: =RC[-28] -> 0 | AM57: =RC[-28] ->  | AN57: =RC[-28] ->  | AO57: =RC[-28] ->  | AP57: - | AQ57: =RC[-29] -> 0 | AR57: =RC[-29] -> 0 | AS57: - | AT57: =RC[-30] -> 0 | AU57: =RC[-30] -> 0 | AV57: =RC[-30] ->  | AW57: =RC[-30] -> 
A58: =IF(RC[1]="","",DATEVALUE(RC[1])) ->  | T58: =(RC[-16]*RC[-15]-RC[-13]*RC[-12])/1000 -> #VALUE! | W58: =RC[-2]*RC[-10]/1000 -> #VALUE! | X58: =ABS((RC[-3]*RC[-11]-RC[-2]*RC[-9])/1000) -> #VALUE! | Y58: =(RC[-14]-RC[1])/RC[-18]*100 -> #VALUE! | AC58: =VALUE(RC[-27]) -> #VALUE! | AD58: =IF(RC[21]=42,"*",IF(RC[21]=32,"",RC[21])) ->  | AE58: =RC[-28] ->  | AF58: =RC[-28] ->  | AG58: =RC[-28] ->  | AH58: =RC[-28] ->  | AI58: =RC[-28] ->  | AJ58: =RC[-28] ->  | AK58: =RC[-28] ->  | AL58: =RC[-28] -> 0 | AM58: =RC[-28] ->  | AN58: =RC[-28] ->  | AO58: =RC[-28] ->  | AP58: - | AQ58: =RC[-29] -> 0 | AR58: =RC[-29] -> 0 | AS58: - | AT58: =RC[-30] -> 0 | AU58: =RC[-30] -> 0 | AV58: =RC[-30] ->  | AW58: =RC[-30] -> 
A59: =IF(RC[1]="","",DATEVALUE(RC[1])) ->  | T59: =(RC[-16]*RC[-15]-RC[-13]*RC[-12])/1000 -> #VALUE! | W59: =RC[-2]*RC[-10]/1000 -> #VALUE! | X59: =ABS((RC[-3]*RC[-11]-RC[-2]*RC[-9])/1000) -> #VALUE! | Y59: =(RC[-14]-RC[1])/RC[-18]*100 -> #VALUE! | AC59: =VALUE(RC[-27]) -> #VALUE! | AD59: =IF(RC[21]=42,"*",IF(RC[21]=32,"",RC[21])) ->  | AE59: =RC[-28] ->  | AF59: =RC[-28] ->  | AG59: =RC[-28] ->  | AH59: =RC[-28] ->  | AI59: =RC[-28] ->  | AJ59: =RC[-28] ->  | AK59: =RC[-28] ->  | AL59: =RC[-28] -> 0 | AM59: =RC[-28] ->  | AN59: =RC[-28] ->  | AO59: =RC[-28] ->  | AP59: - | AQ59: =RC[-29] -> 0 | AR59: =RC[-29] -> 0 | AS59: - | AT59: =RC[-30] -> 0 | AU59: =RC[-30] -> 0 | AV59: =RC[-30] ->  | AW59: =RC[-30] -> 
A60: =IF(RC[1]="","",DATEVALUE(RC[1])) ->  | T60: =(RC[-16]*RC[-15]-RC[-13]*RC[-12])/1000 -> #VALUE! | W60: =RC[-2]*RC[-10]/1000 -> #VALUE! | X60: =ABS((RC[-3]*RC[-11]-RC[-2]*RC[-9])/1000) -> #VALUE! | Y60: =(RC[-14]-RC[1])/RC[-18]*100 -> #VALUE! | AC60: =VALUE(RC[-27]) -> #VALUE! | AD60: =IF(RC[21]=42,"*",IF(RC[21]=32,"",RC[21])) ->  | AE60: =RC[-28] ->  | AF60: =RC[-28] ->  | AG60: =RC[-28] ->  | AH60: =RC[-28] ->  | AI60: =RC[-28] ->  | AJ60: =RC[-28] ->  | AK60: =RC[-28] ->  | AL60: =RC[-28] -> 0 | AM60: =RC[-28] ->  | AN60: =RC[-28] ->  | AO60: =RC[-28] ->  | AP60: - | AQ60: =RC[-29] -> 0 | AR60: =RC[-29] -> 0 | AS60: - | AT60: =RC[-30] -> 0 | AU60: =RC[-30] -> 0 | AV60: =RC[-30] ->  | AW60: =RC[-30] -> 
A61: =IF(RC[1]="","",DATEVALUE(RC[1])) ->  | T61: =(RC[-16]*RC[-15]-RC[-13]*RC[-12])/1000 -> #VALUE! | W61: =RC[-2]*RC[-10]/1000 -> #VALUE! | X61: =ABS((RC[-3]*RC[-11]-RC[-2]*RC[-9])/1000) -> #VALUE! | Y61: =(RC[-14]-RC[1])/RC[-18]*100 -> #VALUE! | AC61: =VALUE(RC[-27]) -> #VALUE! | AD61: =IF(RC[21]=42,"*",IF(RC[21]=32,"",RC[21])) ->  | AE61: =RC[-28] ->  | AF61: =RC[-28] ->  | AG61: =RC[-28] ->  | AH61: =RC[-28] ->  | AI61: =RC[-28] ->  | AJ61: =RC[-28] ->  | AK61: =RC[-28] ->  | AL61: =RC[-28] -> 0 | AM61: =RC[-28] ->  | AN61: =RC[-28] ->  | AO61: =RC[-28] ->  | AP61: - | AQ61: =RC[-29] -> 0 | AR61: =RC[-29] -> 0 | AS61: - | AT61: =RC[-30] -> 0 | AU61: =RC[-30] -> 0 | AV61: =RC[-30] ->  | AW61: =RC[-30] -> 
A62: =IF(RC[1]="","",DATEVALUE(RC[1])) ->  | T62: =(RC[-16]*RC[-15]-RC[-13]*RC[-12])/1000 -> #VALUE! | W62: =RC[-2]*RC[-10]/1000 -> #VALUE! | X62: =ABS((RC[-3]*RC[-11]-RC[-2]*RC[-9])/1000) -> #VALUE! | Y62: =(RC[-14]-RC[1])/RC[-18]*100 -> #VALUE! | AC62: =VALUE(RC[-27]) -> #VALUE! | AD62: =IF(RC[21]=42,"*",IF(RC[21]=32,"",RC[21])) ->  | AE62: =RC[-28] ->  | AF62: =RC[-28] ->  | AG62: =RC[-28] ->  | AH62: =RC[-28] ->  | AI62: =RC[-28] ->  | AJ62: =RC[-28] ->  | AK62: =RC[-28] ->  | AL62: =RC[-28] -> 0 | AM62: =RC[-28] ->  | AN62: =RC[-28] ->  | AO62: =RC[-28] ->  | AP62: - | AQ62: =RC[-29] -> 0 | AR62: =RC[-29] -> 0 | AS62: - | AT62: =RC[-30] -> 0 | AU62: =RC[-30] -> 0 | AV62: =RC[-30] ->  | AW62: =RC[-30] -> 
A63: =IF(RC[1]="","",DATEVALUE(RC[1])) ->  | T63: =(RC[-16]*RC[-15]-RC[-13]*RC[-12])/1000 -> #VALUE! | W63: =RC[-2]*RC[-10]/1000 -> #VALUE! | X63: =ABS((RC[-3]*RC[-11]-RC[-2]*RC[-9])/1000) -> #VALUE! | Y63: =(RC[-14]-RC[1])/RC[-18]*100 -> #VALUE! | AC63: =VALUE(RC[-27]) -> #VALUE! | AD63: =IF(RC[21]=42,"*",IF(RC[21]=32,"",RC[21])) ->  | AE63: =RC[-28] ->  | AF63: =RC[-28] ->  | AG63: =RC[-28] ->  | AH63: =RC[-28] ->  | AI63: =RC[-28] ->  | AJ63: =RC[-28] ->  | AK63: =RC[-28] ->  | AL63: =RC[-28] -> 0 | AM63: =RC[-28] ->  | AN63: =RC[-28] ->  | AO63: =RC[-28] ->  | AP63: - | AQ63: =RC[-29] -> 0 | AR63: =RC[-29] -> 0 | AS63: - | AT63: =RC[-30] -> 0 | AU63: =RC[-30] -> 0 | AV63: =RC[-30] ->  | AW63: =RC[-30] -> 
A64: =IF(RC[1]="","",DATEVALUE(RC[1])) ->  | T64: =(RC[-16]*RC[-15]-RC[-13]*RC[-12])/1000 -> #VALUE! | W64: =RC[-2]*RC[-10]/1000 -> #VALUE! | X64: =ABS((RC[-3]*RC[-11]-RC[-2]*RC[-9])/1000) -> #VALUE! | Y64: =(RC[-14]-RC[1])/RC[-18]*100 -> #VALUE! | AC64: =VALUE(RC[-27]) -> #VALUE! | AD64: =IF(RC[21]=42,"*",IF(RC[21]=32,"",RC[21])) ->  | AE64: =RC[-28] ->  | AF64: =RC[-28] ->  | AG64: =RC[-28] ->  | AH64: =RC[-28] ->  | AI64: =RC[-28] ->  | AJ64: =RC[-28] ->  | AK64: =RC[-28] ->  | AL64: =RC[-28] -> 0 | AM64: =RC[-28] ->  | AN64: =RC[-28] ->  | AO64: =RC[-28] ->  | AP64: - | AQ64: =RC[-29] -> 0 | AR64: =RC[-29] -> 0 | AS64: - | AT64: =RC[-30] -> 0 | AU64: =RC[-30] -> 0 | AV64: =RC[-30] ->  | AW64: =RC[-30] -> 
A65: =IF(RC[1]="","",DATEVALUE(RC[1])) ->  | T65: =(RC[-16]*RC[-15]-RC[-13]*RC[-12])/1000 -> #VALUE! | W65: =RC[-2]*RC[-10]/1000 -> #VALUE! | X65: =ABS((RC[-3]*RC[-11]-RC[-2]*RC[-9])/1000) -> #VALUE! | Y65: =(RC[-14]-RC[1])/RC[-18]*100 -> #VALUE! | AC65: =VALUE(RC[-27]) -> #VALUE! | AD65: =IF(RC[21]=42,"*",IF(RC[21]=32,"",RC[21])) ->  | AE65: =RC[-28] ->  | AF65: =RC[-28] ->  | AG65: =RC[-28] ->  | AH65: =RC[-28] ->  | AI65: =RC[-28] ->  | AJ65: =RC[-28] ->  | AK65: =RC[-28] ->  | AL65: =RC[-28] -> 0 | AM65: =RC[-28] ->  | AN65: =RC[-28] ->  | AO65: =RC[-28] ->  | AP65: - | AQ65: =RC[-29] -> 0 | AR65: =RC[-29] -> 0 | AS65: - | AT65: =RC[-30] -> 0 | AU65: =RC[-30] -> 0 | AV65: =RC[-30] ->  | AW65: =RC[-30] -> 
A66: =IF(RC[1]="","",DATEVALUE(RC[1])) ->  | T66: =(RC[-16]*RC[-15]-RC[-13]*RC[-12])/1000 -> #VALUE! | W66: =RC[-2]*RC[-10]/1000 -> #VALUE! | X66: =ABS((RC[-3]*RC[-11]-RC[-2]*RC[-9])/1000) -> #VALUE! | Y66: =(RC[-14]-RC[1])/RC[-18]*100 -> #VALUE! | AC66: =VALUE(RC[-27]) -> #VALUE! | AD66: =IF(RC[21]=42,"*",IF(RC[21]=32,"",RC[21])) ->  | AE66: =RC[-28] ->  | AF66: =RC[-28] ->  | AG66: =RC[-28] ->  | AH66: =RC[-28] ->  | AI66: =RC[-28] ->  | AJ66: =RC[-28] ->  | AK66: =RC[-28] ->  | AL66: =RC[-28] -> 0 | AM66: =RC[-28] ->  | AN66: =RC[-28] ->  | AO66: =RC[-28] ->  | AP66: - | AQ66: =RC[-29] -> 0 | AR66: =RC[-29] -> 0 | AS66: - | AT66: =RC[-30] -> 0 | AU66: =RC[-30] -> 0 | AV66: =RC[-30] ->  | AW66: =RC[-30] -> 
A67: =IF(RC[1]="","",DATEVALUE(RC[1])) ->  | T67: =(RC[-16]*RC[-15]-RC[-13]*RC[-12])/1000 -> #VALUE! | W67: =RC[-2]*RC[-10]/1000 -> #VALUE! | X67: =ABS((RC[-3]*RC[-11]-RC[-2]*RC[-9])/1000) -> #VALUE! | Y67: =(RC[-14]-RC[1])/RC[-18]*100 -> #VALUE! | AC67: =VALUE(RC[-27]) -> #VALUE! | AD67: =IF(RC[21]=42,"*",IF(RC[21]=32,"",RC[21])) ->  | AE67: =RC[-28] ->  | AF67: =RC[-28] ->  | AG67: =RC[-28] ->  | AH67: =RC[-28] ->  | AI67: =RC[-28] ->  | AJ67: =RC[-28] ->  | AK67: =RC[-28] ->  | AL67: =RC[-28] -> 0 | AM67: =RC[-28] ->  | AN67: =RC[-28] ->  | AO67: =RC[-28] ->  | AP67: - | AQ67: =RC[-29] -> 0 | AR67: =RC[-29] -> 0 | AS67: - | AT67: =RC[-30] -> 0 | AU67: =RC[-30] -> 0 | AV67: =RC[-30] ->  | AW67: =RC[-30] -> 
A68: =IF(RC[1]="","",DATEVALUE(RC[1])) ->  | T68: =(RC[-16]*RC[-15]-RC[-13]*RC[-12])/1000 -> #VALUE! | W68: =RC[-2]*RC[-10]/1000 -> #VALUE! | X68: =ABS((RC[-3]*RC[-11]-RC[-2]*RC[-9])/1000) -> #VALUE! | Y68: =(RC[-14]-RC[1])/RC[-18]*100 -> #VALUE! | AC68: =VALUE(RC[-27]) -> #VALUE! | AD68: =IF(RC[21]=42,"*",IF(RC[21]=32,"",RC[21])) ->  | AE68: =RC[-28] ->  | AF68: =RC[-28] ->  | AG68: =RC[-28] ->  | AH68: =RC[-28] ->  | AI68: =RC[-28] ->  | AJ68: =RC[-28] ->  | AK68: =RC[-28] ->  | AL68: =RC[-28] -> 0 | AM68: =RC[-28] ->  | AN68: =RC[-28] ->  | AO68: =RC[-28] ->  | AP68: - | AQ68: =RC[-29] -> 0 | AR68: =RC[-29] -> 0 | AS68: - | AT68: =RC[-30] -> 0 | AU68: =RC[-30] -> 0 | AV68: =RC[-30] ->  | AW68: =RC[-30] -> 
A69: =IF(RC[1]="","",DATEVALUE(RC[1])) ->  | T69: =(RC[-16]*RC[-15]-RC[-13]*RC[-12])/1000 -> #VALUE! | W69: =RC[-2]*RC[-10]/1000 -> #VALUE! | X69: =ABS((RC[-3]*RC[-11]-RC[-2]*RC[-9])/1000) -> #VALUE! | Y69: =(RC[-14]-RC[1])/RC[-18]*100 -> #VALUE! | AC69: =VALUE(RC[-27]) -> #VALUE! | AD69: =IF(RC[21]=42,"*",IF(RC[21]=32,"",RC[21])) ->  | AE69: =RC[-28] ->  | AF69: =RC[-28] ->  | AG69: =RC[-28] ->  | AH69: =RC[-28] ->  | AI69: =RC[-28] ->  | AJ69: =RC[-28] ->  | AK69: =RC[-28] ->  | AL69: =RC[-28] -> 0 | AM69: =RC[-28] ->  | AN69: =RC[-28] ->  | AO69: =RC[-28] ->  | AP69: - | AQ69: =RC[-29] -> 0 | AR69: =RC[-29] -> 0 | AS69: - | AT69: =RC[-30] -> 0 | AU69: =RC[-30] -> 0 | AV69: =RC[-30] ->  | AW69: =RC[-30] -> 
A70: =IF(RC[1]="","",DATEVALUE(RC[1])) ->  | T70: =(RC[-16]*RC[-15]-RC[-13]*RC[-12])/1000 -> #VALUE! | W70: =RC[-2]*RC[-10]/1000 -> #VALUE! | X70: =ABS((RC[-3]*RC[-11]-RC[-2]*RC[-9])/1000) -> #VALUE! | Y70: =(RC[-14]-RC[1])/RC[-18]*100 -> #VALUE! | AC70: =VALUE(RC[-27]) -> #VALUE! | AD70: =IF(RC[21]=42,"*",IF(RC[21]=32,"",RC[21])) ->  | AE70: =RC[-28] ->  | AF70: =RC[-28] ->  | AG70: =RC[-28] ->  | AH70: =RC[-28] ->  | AI70: =RC[-28] ->  | AJ70: =RC[-28] ->  | AK70: =RC[-28] ->  | AL70: =RC[-28] -> 0 | AM70: =RC[-28] ->  | AN70: =RC[-28] ->  | AO70: =RC[-28] ->  | AP70: - | AQ70: =RC[-29] -> 0 | AR70: =RC[-29] -> 0 | AS70: - | AT70: =RC[-30] -> 0 | AU70: =RC[-30] -> 0 | AV70: =RC[-30] ->  | AW70: =RC[-30] -> 
A71: =IF(RC[1]="","",DATEVALUE(RC[1])) ->  | T71: =(RC[-16]*RC[-15]-RC[-13]*RC[-12])/1000 -> #VALUE! | W71: =RC[-2]*RC[-10]/1000 -> #VALUE! | X71: =ABS((RC[-3]*RC[-11]-RC[-2]*RC[-9])/1000) -> #VALUE! | Y71: =(RC[-14]-RC[1])/RC[-18]*100 -> #VALUE! | AC71: =VALUE(RC[-27]) -> #VALUE! | AD71: =IF(RC[21]=42,"*",IF(RC[21]=32,"",RC[21])) ->  | AE71: =RC[-28] ->  | AF71: =RC[-28] ->  | AG71: =RC[-28] ->  | AH71: =RC[-28] ->  | AI71: =RC[-28] ->  | AJ71: =RC[-28] ->  | AK71: =RC[-28] ->  | AL71: =RC[-28] -> 0 | AM71: =RC[-28] ->  | AN71: =RC[-28] ->  | AO71: =RC[-28] ->  | AP71: - | AQ71: =RC[-29] -> 0 | AR71: =RC[-29] -> 0 | AS71: - | AT71: =RC[-30] -> 0 | AU71: =RC[-30] -> 0 | AV71: =RC[-30] ->  | AW71: =RC[-30] -> 
A72: =IF(RC[1]="","",DATEVALUE(RC[1])) ->  | T72: =(RC[-16]*RC[-15]-RC[-13]*RC[-12])/1000 -> #VALUE! | W72: =RC[-2]*RC[-10]/1000 -> #VALUE! | X72: =ABS((RC[-3]*RC[-11]-RC[-2]*RC[-9])/1000) -> #VALUE! | Y72: =(RC[-14]-RC[1])/RC[-18]*100 -> #VALUE! | AC72: =VALUE(RC[-27]) -> #VALUE! | AD72: =IF(RC[21]=42,"*",IF(RC[21]=32,"",RC[21])) ->  | AE72: =RC[-28] ->  | AF72: =RC[-28] ->  | AG72: =RC[-28] ->  | AH72: =RC[-28] ->  | AI72: =RC[-28] ->  | AJ72: =RC[-28] ->  | AK72: =RC[-28] ->  | AL72: =RC[-28] -> 0 | AM72: =RC[-28] ->  | AN72: =RC[-28] ->  | AO72: =RC[-28] ->  | AP72: - | AQ72: =RC[-29] -> 0 | AR72: =RC[-29] -> 0 | AS72: - | AT72: =RC[-30] -> 0 | AU72: =RC[-30] -> 0 | AV72: =RC[-30] ->  | AW72: =RC[-30] -> 
A73: =IF(RC[1]="","",DATEVALUE(RC[1])) ->  | T73: =(RC[-16]*RC[-15]-RC[-13]*RC[-12])/1000 -> #VALUE! | W73: =RC[-2]*RC[-10]/1000 -> #VALUE! | X73: =ABS((RC[-3]*RC[-11]-RC[-2]*RC[-9])/1000) -> #VALUE! | Y73: =(RC[-14]-RC[1])/RC[-18]*100 -> #VALUE! | AC73: =VALUE(RC[-27]) -> #VALUE! | AD73: =IF(RC[21]=42,"*",IF(RC[21]=32,"",RC[21])) ->  | AE73: =RC[-28] ->  | AF73: =RC[-28] ->  | AG73: =RC[-28] ->  | AH73: =RC[-28] ->  | AI73: =RC[-28] ->  | AJ73: =RC[-28] ->  | AK73: =RC[-28] ->  | AL73: =RC[-28] -> 0 | AM73: =RC[-28] ->  | AN73: =RC[-28] ->  | AO73: =RC[-28] ->  | AP73: - | AQ73: =RC[-29] -> 0 | AR73: =RC[-29] -> 0 | AS73: - | AT73: =RC[-30] -> 0 | AU73: =RC[-30] -> 0 | AV73: =RC[-30] ->  | AW73: =RC[-30] -> 
A74: =IF(RC[1]="","",DATEVALUE(RC[1])) ->  | T74: =(RC[-16]*RC[-15]-RC[-13]*RC[-12])/1000 -> #VALUE! | W74: =RC[-2]*RC[-10]/1000 -> #VALUE! | X74: =ABS((RC[-3]*RC[-11]-RC[-2]*RC[-9])/1000) -> #VALUE! | Y74: =(RC[-14]-RC[1])/RC[-18]*100 -> #VALUE! | AC74: =VALUE(RC[-27]) -> #VALUE! | AD74: =IF(RC[21]=42,"*",IF(RC[21]=32,"",RC[21])) ->  | AE74: =RC[-28] ->  | AF74: =RC[-28] ->  | AG74: =RC[-28] ->  | AH74: =RC[-28] ->  | AI74: =RC[-28] ->  | AJ74: =RC[-28] ->  | AK74: =RC[-28] ->  | AL74: =RC[-28] -> 0 | AM74: =RC[-28] ->  | AN74: =RC[-28] ->  | AO74: =RC[-28] ->  | AP74: - | AQ74: =RC[-29] -> 0 | AR74: =RC[-29] -> 0 | AS74: - | AT74: =RC[-30] -> 0 | AU74: =RC[-30] -> 0 | AV74: =RC[-30] ->  | AW74: =RC[-30] -> 
A75: =IF(RC[1]="","",DATEVALUE(RC[1])) ->  | T75: =(RC[-16]*RC[-15]-RC[-13]*RC[-12])/1000 -> #VALUE! | W75: =RC[-2]*RC[-10]/1000 -> #VALUE! | X75: =ABS((RC[-3]*RC[-11]-RC[-2]*RC[-9])/1000) -> #VALUE! | Y75: =(RC[-14]-RC[1])/RC[-18]*100 -> #VALUE! | AC75: =VALUE(RC[-27]) -> #VALUE! | AD75: =IF(RC[21]=42,"*",IF(RC[21]=32,"",RC[21])) ->  | AE75: =RC[-28] ->  | AF75: =RC[-28] ->  | AG75: =RC[-28] ->  | AH75: =RC[-28] ->  | AI75: =RC[-28] ->  | AJ75: =RC[-28] ->  | AK75: =RC[-28] ->  | AL75: =RC[-28] -> 0 | AM75: =RC[-28] ->  | AN75: =RC[-28] ->  | AO75: =RC[-28] ->  | AP75: - | AQ75: =RC[-29] -> 0 | AR75: =RC[-29] -> 0 | AS75: - | AT75: =RC[-30] -> 0 | AU75: =RC[-30] -> 0 | AV75: =RC[-30] ->  | AW75: =RC[-30] -> 
A76: =IF(RC[1]="","",DATEVALUE(RC[1])) ->  | T76: =(RC[-16]*RC[-15]-RC[-13]*RC[-12])/1000 -> #VALUE! | W76: =RC[-2]*RC[-10]/1000 -> #VALUE! | X76: =ABS((RC[-3]*RC[-11]-RC[-2]*RC[-9])/1000) -> #VALUE! | Y76: =(RC[-14]-RC[1])/RC[-18]*100 -> #VALUE! | AC76: =VALUE(RC[-27]) -> #VALUE! | AD76: =IF(RC[21]=42,"*",IF(RC[21]=32,"",RC[21])) ->  | AE76: =RC[-28] ->  | AF76: =RC[-28] ->  | AG76: =RC[-28] ->  | AH76: =RC[-28] ->  | AI76: =RC[-28] ->  | AJ76: =RC[-28] ->  | AK76: =RC[-28] ->  | AL76: =RC[-28] -> 0 | AM76: =RC[-28] ->  | AN76: =RC[-28] ->  | AO76: =RC[-28] ->  | AP76: - | AQ76: =RC[-29] -> 0 | AR76: =RC[-29] -> 0 | AS76: - | AT76: =RC[-30] -> 0 | AU76: =RC[-30] -> 0 | AV76: =RC[-30] ->  | AW76: =RC[-30] -> 
A77: =IF(RC[1]="","",DATEVALUE(RC[1])) ->  | T77: =(RC[-16]*RC[-15]-RC[-13]*RC[-12])/1000 -> #VALUE! | W77: =RC[-2]*RC[-10]/1000 -> #VALUE! | X77: =ABS((RC[-3]*RC[-11]-RC[-2]*RC[-9])/1000) -> #VALUE! | Y77: =(RC[-14]-RC[1])/RC[-18]*100 -> #VALUE! | AC77: =VALUE(RC[-27]) -> #VALUE! | AD77: =IF(RC[21]=42,"*",IF(RC[21]=32,"",RC[21])) ->  | AE77: =RC[-28] ->  | AF77: =RC[-28] ->  | AG77: =RC[-28] ->  | AH77: =RC[-28] ->  | AI77: =RC[-28] ->  | AJ77: =RC[-28] ->  | AK77: =RC[-28] ->  | AL77: =RC[-28] -> 0 | AM77: =RC[-28] ->  | AN77: =RC[-28] ->  | AO77: =RC[-28] ->  | AP77: - | AQ77: =RC[-29] -> 0 | AR77: =RC[-29] -> 0 | AS77: - | AT77: =RC[-30] -> 0 | AU77: =RC[-30] -> 0 | AV77: =RC[-30] ->  | AW77: =RC[-30] -> 
A78: =IF(RC[1]="","",DATEVALUE(RC[1])) ->  | T78: =(RC[-16]*RC[-15]-RC[-13]*RC[-12])/1000 -> #VALUE! | W78: =RC[-2]*RC[-10]/1000 -> #VALUE! | X78: =ABS((RC[-3]*RC[-11]-RC[-2]*RC[-9])/1000) -> #VALUE! | Y78: =(RC[-14]-RC[1])/RC[-18]*100 -> #VALUE! | AC78: =VALUE(RC[-27]) -> #VALUE! | AD78: =IF(RC[21]=42,"*",IF(RC[21]=32,"",RC[21])) ->  | AE78: =RC[-28] ->  | AF78: =RC[-28] ->  | AG78: =RC[-28] ->  | AH78: =RC[-28] ->  | AI78: =RC[-28] ->  | AJ78: =RC[-28] ->  | AK78: =RC[-28] ->  | AL78: =RC[-28] -> 0 | AM78: =RC[-28] ->  | AN78: =RC[-28] ->  | AO78: =RC[-28] ->  | AP78: - | AQ78: =RC[-29] -> 0 | AR78: =RC[-29] -> 0 | AS78: - | AT78: =RC[-30] -> 0 | AU78: =RC[-30] -> 0 | AV78: =RC[-30] ->  | AW78: =RC[-30] -> 
A79: =IF(RC[1]="","",DATEVALUE(RC[1])) ->  | T79: =(RC[-16]*RC[-15]-RC[-13]*RC[-12])/1000 -> #VALUE! | W79: =RC[-2]*RC[-10]/1000 -> #VALUE! | X79: =ABS((RC[-3]*RC[-11]-RC[-2]*RC[-9])/1000) -> #VALUE! | Y79: =(RC[-14]-RC[1])/RC[-18]*100 -> #VALUE! | AC79: =VALUE(RC[-27]) -> #VALUE! | AD79: =IF(RC[21]=42,"*",IF(RC[21]=32,"",RC[21])) ->  | AE79: =RC[-28] ->  | AF79: =RC[-28] ->  | AG79: =RC[-28] ->  | AH79: =RC[-28] ->  | AI79: =RC[-28] ->  | AJ79: =RC[-28] ->  | AK79: =RC[-28] ->  | AL79: =RC[-28] -> 0 | AM79: =RC[-28] ->  | AN79: =RC[-28] ->  | AO79: =RC[-28] ->  | AP79: - | AQ79: =RC[-29] -> 0 | AR79: =RC[-29] -> 0 | AS79: - | AT79: =RC[-30] -> 0 | AU79: =RC[-30] -> 0 | AV79: =RC[-30] ->  | AW79: =RC[-30] -> 
A80: =IF(RC[1]="","",DATEVALUE(RC[1])) ->  | T80: =(RC[-16]*RC[-15]-RC[-13]*RC[-12])/1000 -> #VALUE! | W80: =RC[-2]*RC[-10]/1000 -> #VALUE! | X80: =ABS((RC[-3]*RC[-11]-RC[-2]*RC[-9])/1000) -> #VALUE! | Y80: =(RC[-14]-RC[1])/RC[-18]*100 -> #VALUE! | AC80: =VALUE(RC[-27]) -> #VALUE! | AD80: =IF(RC[21]=42,"*",IF(RC[21]=32,"",RC[21])) ->  | AE80: =RC[-28] ->  | AF80: =RC[-28] ->  | AG80: =RC[-28] ->  | AH80: =RC[-28] ->  | AI80: =RC[-28] ->  | AJ80: =RC[-28] ->  | AK80: =RC[-28] ->  | AL80: =RC[-28] -> 0 | AM80: =RC[-28] ->  | AN80: =RC[-28] ->  | AO80: =RC[-28] ->  | AP80: - | AQ80: =RC[-29] -> 0 | AR80: =RC[-29] -> 0 | AS80: - | AT80: =RC[-30] -> 0 | AU80: =RC[-30] -> 0 | AV80: =RC[-30] ->  | AW80: =RC[-30] -> 
A81: =IF(RC[1]="","",DATEVALUE(RC[1])) ->  | T81: =(RC[-16]*RC[-15]-RC[-13]*RC[-12])/1000 -> #VALUE! | W81: =RC[-2]*RC[-10]/1000 -> #VALUE! | X81: =ABS((RC[-3]*RC[-11]-RC[-2]*RC[-9])/1000) -> #VALUE! | Y81: =(RC[-14]-RC[1])/RC[-18]*100 -> #VALUE! | AC81: =VALUE(RC[-27]) -> #VALUE! | AD81: =IF(RC[21]=42,"*",IF(RC[21]=32,"",RC[21])) ->  | AE81: =RC[-28] ->  | AF81: =RC[-28] ->  | AG81: =RC[-28] ->  | AH81: =RC[-28] ->  | AI81: =RC[-28] ->  | AJ81: =RC[-28] ->  | AK81: =RC[-28] ->  | AL81: =RC[-28] -> 0 | AM81: =RC[-28] ->  | AN81: =RC[-28] ->  | AO81: =RC[-28] ->  | AP81: - | AQ81: =RC[-29] -> 0 | AR81: =RC[-29] -> 0 | AS81: - | AT81: =RC[-30] -> 0 | AU81: =RC[-30] -> 0 | AV81: =RC[-30] ->  | AW81: =RC[-30] -> 
A82: =IF(RC[1]="","",DATEVALUE(RC[1])) ->  | T82: =(RC[-16]*RC[-15]-RC[-13]*RC[-12])/1000 -> #VALUE! | W82: =RC[-2]*RC[-10]/1000 -> #VALUE! | X82: =ABS((RC[-3]*RC[-11]-RC[-2]*RC[-9])/1000) -> #VALUE! | Y82: =(RC[-14]-RC[1])/RC[-18]*100 -> #VALUE! | AC82: =VALUE(RC[-27]) -> #VALUE! | AD82: =IF(RC[21]=42,"*",IF(RC[21]=32,"",RC[21])) ->  | AE82: =RC[-28] ->  | AF82: =RC[-28] ->  | AG82: =RC[-28] ->  | AH82: =RC[-28] ->  | AI82: =RC[-28] ->  | AJ82: =RC[-28] ->  | AK82: =RC[-28] ->  | AL82: =RC[-28] -> 0 | AM82: =RC[-28] ->  | AN82: =RC[-28] ->  | AO82: =RC[-28] ->  | AP82: - | AQ82: =RC[-29] -> 0 | AR82: =RC[-29] -> 0 | AS82: - | AT82: =RC[-30] -> 0 | AU82: =RC[-30] -> 0 | AV82: =RC[-30] ->  | AW82: =RC[-30] -> 
A83: =IF(RC[1]="","",DATEVALUE(RC[1])) ->  | T83: =(RC[-16]*RC[-15]-RC[-13]*RC[-12])/1000 -> #VALUE! | W83: =RC[-2]*RC[-10]/1000 -> #VALUE! | X83: =ABS((RC[-3]*RC[-11]-RC[-2]*RC[-9])/1000) -> #VALUE! | Y83: =(RC[-14]-RC[1])/RC[-18]*100 -> #VALUE! | AC83: =VALUE(RC[-27]) -> #VALUE! | AD83: =IF(RC[21]=42,"*",IF(RC[21]=32,"",RC[21])) ->  | AE83: =RC[-28] ->  | AF83: =RC[-28] ->  | AG83: =RC[-28] ->  | AH83: =RC[-28] ->  | AI83: =RC[-28] ->  | AJ83: =RC[-28] ->  | AK83: =RC[-28] ->  | AL83: =RC[-28] -> 0 | AM83: =RC[-28] ->  | AN83: =RC[-28] ->  | AO83: =RC[-28] ->  | AP83: - | AQ83: =RC[-29] -> 0 | AR83: =RC[-29] -> 0 | AS83: - | AT83: =RC[-30] -> 0 | AU83: =RC[-30] -> 0 | AV83: =RC[-30] ->  | AW83: =RC[-30] -> 
AC84: Среднее | AF84: =R[1]C[-28] -> 230.48220062266662 | AG84: =R[1]C[-28] -> 69.789000000000001 | AH84: =R[1]C[-28] -> 7.9926074940026686 | AI84: =R[1]C[-28] -> 202.55434010733336 | AJ84: =R[1]C[-28] -> 49.847666666666662 | AK84: =R[1]C[-28] -> 5.7888116755306669 | AL84: =R[1]C[-28] -> 19.941333333333336 | AM84: =R[1]C[-28] -> 27.927860515333343 | AN84: =R[1]C[-28] -> 28.499558872777772 | AO84: =R[1]C[-28] -> 68.160666666666671 | AP84: - | AQ84: =R[1]C[-29] -> 0 | AR84: =R[1]C[-29] -> 0 | AS84: - | AT84: =R[1]C[-30] -> 0 | AU84: =R[1]C[-30] -> 0
B85: Среднее | D85: =AVERAGE(OFFSET(R[-74]C,3,0,R7C1,1)) -> 230.48220062266662 | E85: =AVERAGE(OFFSET(R[-74]C,3,0,R7C1,1)) -> 69.789000000000001 | F85: =AVERAGE(OFFSET(R[-74]C,3,0,R7C1,1)) -> 7.9926074940026686 | G85: =AVERAGE(OFFSET(R[-74]C,3,0,R7C1,1)) -> 202.55434010733336 | H85: =AVERAGE(OFFSET(R[-74]C,3,0,R7C1,1)) -> 49.847666666666662 | I85: =AVERAGE(OFFSET(R[-74]C,3,0,R7C1,1)) -> 5.7888116755306669 | J85: =AVERAGE(OFFSET(R[-74]C,3,0,R7C1,1)) -> 19.941333333333336 | K85: =AVERAGE(OFFSET(R[-74]C,3,0,R7C1,1)) -> 27.927860515333343 | L85: =IF(SUM(OFFSET(R[-74]C,3,0,R7C1,1))=0,"",AVERAGE(OFFSET(R[-74]C,3,0,R7C1,1))) -> 28.499558872777772 | M85: =IF(SUM(OFFSET(R[-74]C,3,0,R7C1,1))=0,"",AVERAGE(OFFSET(R[-74]C,3,0,R7C1,1))) -> 68.160666666666671 | R85: =IF(SUM(OFFSET(R[-74]C,3,0,R7C1,1))=0,"",AVERAGE(OFFSET(R[-74]C,3,0,R7C1,1))) -> 1.9200436399251271 | S85: =AVERAGE(OFFSET(R[-74]C,3,0,R7C1,1)) -> 5.9484135804634706 | T85: =AVERAGE(OFFSET(R[-74]C,3,0,R7C1,1)) -> 5.9379020628231292 | W85: =AVERAGE(OFFSET(R[-74]C,3,0,R7C1,1)) -> 1.9099329758754993 | X85: =AVERAGE(OFFSET(R[-74]C,3,0,R7C1,1)) -> #VALUE! | AC85: Итого | AE85: =R[1]C[-28] -> 720 | AF85: =R[1]C[-28] -> 6914.4660186799983 | AI85: =R[1]C[-28] -> 6076.630203220001 | AM85: =R[1]C[-28] -> 837.83581546000028 | AN85: =R[1]C[-28] -> 854.9867661833332 | AQ85: =R[1]C[-29] -> 0 | AU85: =R[1]C[-30] -> 0 | AV85: =R[1]C[-30] -> 57.601309197753814 | AW85: =R[1]C[-30] -> 178.45240741390413
B86: ИТОГО: | C86: =SUM(OFFSET(R[-75]C,3,0,R7C1,1)) -> 720 | D86: =SUM(OFFSET(R[-75]C,3,0,R7C1,1)) -> 6914.4660186799983 | G86: =SUM(OFFSET(R[-75]C,3,0,R7C1,1)) -> 6076.630203220001 | K86: =SUM(OFFSET(R[-75]C,3,0,R7C1,1)) -> 837.83581546000028 | L86: =IF(SUM(OFFSET(R[-75]C,3,0,R7C1,1))=0,"",SUM(OFFSET(R[-75]C,3,0,R7C1,1))) -> 854.9867661833332 | R86: =IF(SUM(OFFSET(R[-75]C,3,0,R7C1,1))=0,"",SUM(OFFSET(R[-75]C,3,0,R7C1,1))) -> 57.601309197753814 | S86: =SUM(OFFSET(R[-75]C,3,0,R7C1,1)) -> 178.45240741390413 | T86: =SUM(OFFSET(R[-75]C,3,0,R7C1,1)) -> 178.13706188469388 | W86: =SUM(OFFSET(R[-75]C,3,0,R7C1,1)) -> 57.297989276264978 | X86: =SUM(OFFSET(R[-75]C,3,0,R7C1,1)) -> #VALUE!
AC87: Досчёт | AF87: =R[1]C[-28] -> 0 | AI87: =R[1]C[-28] -> 0 | AM87: =R[1]C[-28] -> 0 | AN87: =R[1]C[-28] -> 0 | AQ87: =R[1]C[-29] -> 0 | AU87: =R[1]C[-30] -> 0 | AV87: =R[1]C[-30] -> 0 | AW87: =R[1]C[-30] -> 0
A88: 11дн=264ч 4дн=96ч | B88: Досчёт до конца м-ца (+) | C88: =R6C1*24 -> 216 | T88: № B005 | AC88: Снятие | AF88: =-R[1]C[-28] -> 0 | AI88: =-R[1]C[-28] -> 0 | AM88: =-R[1]C[-28] -> 0 | AN88: =-R[1]C[-28] -> 0 | AQ88: =-R[1]C[-29] -> 0 | AU88: =-R[1]C[-30] -> 0 | AV88: =-R[1]C[-30] -> 0 | AW88: =-R[1]C[-30] -> 0
A89: 9дн=216ч 7дн=168ч | B89: Вычет с предыдущего (-) | C89: =R4C1*24 -> 192 | AC89: Сумма | AF89: =R[1]C[-28] -> 6914.4660186799983 | AI89: =R[1]C[-28] -> 6076.630203220001 | AM89: =R[1]C[-28] -> 837.83581546000028 | AN89: =R[1]C[-28] -> 854.9867661833332 | AQ89: =R[1]C[-29] -> 0 | AU89: =R[1]C[-30] -> 0 | AV89: =R[1]C[-30] -> 57.601309197753814 | AW89: =R[1]C[-30] -> 178.45240741390413
B90: СУММА: | C90: =R[-4]C+R[-2]C-R[-1]C -> 744 | D90: =R[-4]C+R[-2]C-R[-1]C -> 6914.4660186799983 | G90: =R[-4]C+R[-2]C-R[-1]C -> 6076.630203220001 | K90: =R[-4]C+R[-2]C-R[-1]C -> 837.83581546000028 | L90: =IF(SUM(OFFSET(R[-79]C,3,0,R7C1,1))=0,"",(R[-4]C+R[-2]C-R[-1]C)) -> 854.9867661833332 | R90: =IF(SUM(OFFSET(R[-79]C,3,0,R7C1,1))=0,"",(R[-4]C+R[-2]C-R[-1]C)) -> 57.601309197753814 | S90: =R[-4]C+R[-2]C-R[-1]C -> 178.45240741390413
AC91: Тхв на источнике | AE91: V гвс (м3) | AF91: =R[-2]C[15] -> 0 | AG91: W гвс (Гкал) | AH91: =RC[-2]*0.06 -> 0 | AI91: W без гвс (Гкал) | AJ91: =R[-2]C[13]-RC[-2] -> 178.45240741390413
B92: Показания счетчиков на момент снятия данных:
B93: Дата, время | D93: М1, т | F93: М2, т | H93: М3, т | J93: М4, т | L93: Qо, Гкал | N93: Qг, Гкал | P93: время, час
B94: 23.09.18 01:50 | D94: 117728.46875 | F94: 93264.8984375 | H94: 23595.525390629999 | J94: - | L94: 4514.5811687923997 | N94: 1735.5165620975399 | P94: -
B95: 18.10.18 02:02 | D95: 124495.9921875 | F95: 99300.3125 | H95: 25439.1015625 | J95: - | L95: 4628.97109293016 | N95: 1859.91142362664 | P95: -
AC97: =ZAYAVKA_N -> з.н д. №02/147-2783 от 04.10.18 с 03.10.18г по 17.10.18г некорректная работа приборов
B98: Представитель потребителя:_______________________________________________________________________ В.О. Топорков
I101: Рекомендуемые значения по параметрам теплопотребления (не являются официально утверждёнными)
I102: М, т | J102: V, м3 | K102: Qгвс, Гкал | L102: Qотоп, Гкал | M102: Qо, Гкал
I103: =R[-13]C[-3] -> 0 | J103: =RC[-1]/0.98 -> 0 | K103: =RC[-1]*0.06 -> 0 | L103: =RC[1]-RC[-1] -> 57.601309197753814 | M103: =R[-13]C[5] -> 57.601309197753814
O105: ДЛЯ САМОКОНТРОЛЯ
B106: В строке выбора дат указать период с 16.7.13 по 23.8.13 - жильё | N106: Q | O106: Qг
B107: В строке выбора дат указать период с 18.7.13 по 25.8.13 - не жилое | N107: =(R[-21]C[-10]*R[-22]C[-7]-R[-21]C[-9]*R[-22]C[-6])/1000 -> 1400.5551016083075 | O107: =IF(R[-22]C[-2]="",R[-21]C[-3]*R[-22]C/1000,"") ->  | P107: Си2
O108: =IF(R[-23]C[-2]="","",((R[-22]C[-3]*R[-23]C)-(R[-22]C[-2]*R[-23]C[2]))/1000) -> 0 | P108: Си3