Sheet: Лист1
G1: Отчёт о теплопотреблении за октябрь 2018 | M1: з.н д. №02/147-2783 от 04.10.18
A4: =EOMONTH(R[9]C,0)-R[9]C -> 8 | B4: Потребитель: ЗАО "Сити Сервис"
A5: =MAX(R[9]C:R[78]C) -> 2018-10-22T00:00:00.000 | B5: Адрес: г. СПб, Наличная ул., д.49 ИТП 3
A6: =EOMONTH(R[-1]C,0)-R[-1]C -> 9 | B6: Телефон: 8-911-021-19-79
A7: =R[-2]C-R[6]C -> 30 | B7: Договор 10023-1 (.) 85904, 85905
A8: 7 | B8: Тепловычислитель: ВКТ-7 № 36745 | L8: М2 мах= | M8: 166.56 | O8: Мгвс мах= | P8: 46.8
L9: Qотоп мах= | M9: 13.2 | O9: Qгвс мах= | P9: 2.88
B10: Расчётная формула: Q=M1*(h1-hхв)-M2*(h2-hхв)
D12: Учет | L12: Контроль
A13: =R[1]C[1]-1 -> 2018-09-22T00:00:00.000 | B13: Дата | C13: N, ч | D13: M1, т | E13: T1, С | F13: P1, кг/см2 | G13: M2, т | H13: T2, С | I13: P2, кг/см2 | J13: dT, С | K13: M1-М2, т | L13: V3, м3 | M13: T3, С | N13: V4, м3 | O13: =IF(R[-12]C[-14]="м.куб","","T4, С") -> T4, С | P13: dT, С | Q13: V3-V4, м3 | R13: Qгвс, Гкал | S13: Qобщ., Гкал | T13: Q | U13: M3 | V13: M4 | W13: си2 | X13: си3 | Y13: Разб. | Z13: dM2 | AC13: Дата | AD13: НС | AE13: n, ч | AF13: М1, т | AG13: t1, гр. С | AH13: Р1, кгс/см2 | AI13: М2, т | AJ13: t2, гр. С | AK13: Р2, кгс/см2 | AL13: t1-t2, гр. С | AM13: М1-М2, т | AN13: М1гвс, т | AO13: t1гвс, гр. С | AP13: Р1гвс, кгс/см2 | AQ13: М2гвс, т | AR13: t2гвс, гр. С | AS13: Р2гвс, кгс/см2 | AT13: t1гвс-t2гвс | AU13: М1гвс-М2гвс, т | AV13: Wгвс, Гкал | AW13: Wсумм, Гкал | AY13: NS_TV1 | AZ13: НС | BA13: NS_TV2
A14: =IF(RC[1]="","",DATEVALUE(RC[1])) -> 43366 | B14: 23.09.18 | C14: 24 | D14: 33.21 | E14: 68.09 | F14: 5.49 | G14: 49.14 | H14: 66.239999999999995 | I14: 5.07 | J14: =RC[-5]-RC[-2] -> 1.8500000000000085 | K14: -15.93 | L14: 21.66 | M14: 62.11 | R14: 1.3220000000000001 | S14: =RC[-1] -> 1.3220000000000001 | T14: =(RC[-16]*RC[-15]-RC[-13]*RC[-12])/1000 -> -0.99376469999999972 | U14: 21.29 | V14: - | W14: =RC[-2]*RC[-10]/1000 -> 1.3223218999999999 | X14: =ABS((RC[-3]*RC[-11]-RC[-2]*RC[-9])/1000) -> #VALUE! | Y14: =(RC[-14]-RC[1])/RC[-18]*100 -> -75.742775742775734 | Z14: 21.29 | AC14: =VALUE(RC[-27]) -> 2018-09-23T00:00:00.000 | AD14: =IF(RC[21]=42,"*",IF(RC[21]=32,"",RC[21])) -> - | AE14: =RC[-28] -> 24 | AF14: =RC[-28] -> 33.21 | AG14: =RC[-28] -> 68.09 | AH14: =RC[-28] -> 5.49 | AI14: =RC[-28] -> 49.14 | AJ14: =RC[-28] -> 66.239999999999995 | AK14: =RC[-28] -> 5.07 | AL14: =RC[-28] -> 1.8500000000000085 | AM14: =RC[-28] -> -15.93 | AN14: =RC[-28] -> 21.66 | AO14: =RC[-28] -> 62.11 | AP14: - | AQ14: =RC[-29] -> 0 | AR14: =RC[-29] -> 0 | AS14: - | AT14: =RC[-30] -> 0 | AU14: =RC[-30] -> 0 | AV14: =RC[-30] -> 1.3220000000000001 | AW14: =RC[-30] -> 1.3220000000000001 | AY14: - | AZ14: - | BA14: -
A15: =IF(RC[1]="","",DATEVALUE(RC[1])) -> 43367 | B15: 24.09.18 | C15: 24 | D15: 104.57 | E15: 69.430000000000007 | F15: 6.83 | G15: 96.09 | H15: 68.83 | I15: 5.22 | J15: =RC[-5]-RC[-2] -> 0.60000000000000853 | K15: 8.48 | L15: 20.49 | M15: 65.760000000000005 | R15: 1.32 | S15: =RC[-1] -> 1.32 | T15: =(RC[-16]*RC[-15]-RC[-13]*RC[-12])/1000 -> 0.64642040000000001 | U15: 20.09 | V15: - | W15: =RC[-2]*RC[-10]/1000 -> 1.3211184 | X15: =ABS((RC[-3]*RC[-11]-RC[-2]*RC[-9])/1000) -> #VALUE! | Y15: =(RC[-14]-RC[1])/RC[-18]*100 -> -12.082422728691851 | Z15: 20.09 | AC15: =VALUE(RC[-27]) -> 2018-09-24T00:00:00.000 | AD15: =IF(RC[21]=42,"*",IF(RC[21]=32,"",RC[21])) -> - | AE15: =RC[-28] -> 24 | AF15: =RC[-28] -> 104.57 | AG15: =RC[-28] -> 69.430000000000007 | AH15: =RC[-28] -> 6.83 | AI15: =RC[-28] -> 96.09 | AJ15: =RC[-28] -> 68.83 | AK15: =RC[-28] -> 5.22 | AL15: =RC[-28] -> 0.60000000000000853 | AM15: =RC[-28] -> 8.48 | AN15: =RC[-28] -> 20.49 | AO15: =RC[-28] -> 65.760000000000005 | AP15: - | AQ15: =RC[-29] -> 0 | AR15: =RC[-29] -> 0 | AS15: - | AT15: =RC[-30] -> 0 | AU15: =RC[-30] -> 0 | AV15: =RC[-30] -> 1.32 | AW15: =RC[-30] -> 1.32 | AY15: - | AZ15: - | BA15: -
A16: =IF(RC[1]="","",DATEVALUE(RC[1])) -> 43368 | B16: 25.09.18 | C16: 24 | D16: 169.52 | E16: 68.569999999999993 | F16: 8.06 | G16: 152.66999999999999 | H16: 58.34 | I16: 5.16 | J16: =RC[-5]-RC[-2] -> 10.22999999999999 | K16: 16.850000000000001 | L16: 19.22 | M16: 68.13 | R16: 1.286 | S16: 2.7360000000000002 | T16: =(RC[-16]*RC[-15]-RC[-13]*RC[-12])/1000 -> 2.7172186000000003 | U16: 18.84 | V16: - | W16: =RC[-2]*RC[-10]/1000 -> 1.2835691999999999 | X16: =ABS((RC[-3]*RC[-11]-RC[-2]*RC[-9])/1000) -> #VALUE! | Y16: =(RC[-14]-RC[1])/RC[-18]*100 -> -1.3034649898473825 | Z16: 18.84 | AC16: =VALUE(RC[-27]) -> 2018-09-25T00:00:00.000 | AD16: =IF(RC[21]=42,"*",IF(RC[21]=32,"",RC[21])) -> - | AE16: =RC[-28] -> 24 | AF16: =RC[-28] -> 169.52 | AG16: =RC[-28] -> 68.569999999999993 | AH16: =RC[-28] -> 8.06 | AI16: =RC[-28] -> 152.66999999999999 | AJ16: =RC[-28] -> 58.34 | AK16: =RC[-28] -> 5.16 | AL16: =RC[-28] -> 10.22999999999999 | AM16: =RC[-28] -> 16.850000000000001 | AN16: =RC[-28] -> 19.22 | AO16: =RC[-28] -> 68.13 | AP16: - | AQ16: =RC[-29] -> 0 | AR16: =RC[-29] -> 0 | AS16: - | AT16: =RC[-30] -> 0 | AU16: =RC[-30] -> 0 | AV16: =RC[-30] -> 1.286 | AW16: =RC[-30] -> 2.7360000000000002 | AY16: - | AZ16: - | BA16: -
A17: =IF(RC[1]="","",DATEVALUE(RC[1])) -> 43369 | B17: 26.09.18 | C17: 24 | D17: 167.76 | E17: 67.98 | F17: 8.0299999999999994 | G17: 151.03 | H17: 49.93 | I17: 5.14 | J17: =RC[-5]-RC[-2] -> 18.050000000000004 | K17: 16.73 | L17: 17.48 | M17: 67.27 | R17: 1.1519999999999999 | S17: 3.87 | T17: =(RC[-16]*RC[-15]-RC[-13]*RC[-12])/1000 -> 3.8633969000000006 | U17: 17.13 | V17: - | W17: =RC[-2]*RC[-10]/1000 -> 1.1523350999999997 | X17: =ABS((RC[-3]*RC[-11]-RC[-2]*RC[-9])/1000) -> #VALUE! | Y17: =(RC[-14]-RC[1])/RC[-18]*100 -> -0.26484804343507817 | Z17: 17.13 | AC17: =VALUE(RC[-27]) -> 2018-09-26T00:00:00.000 | AD17: =IF(RC[21]=42,"*",IF(RC[21]=32,"",RC[21])) -> - | AE17: =RC[-28] -> 24 | AF17: =RC[-28] -> 167.76 | AG17: =RC[-28] -> 67.98 | AH17: =RC[-28] -> 8.0299999999999994 | AI17: =RC[-28] -> 151.03 | AJ17: =RC[-28] -> 49.93 | AK17: =RC[-28] -> 5.14 | AL17: =RC[-28] -> 18.050000000000004 | AM17: =RC[-28] -> 16.73 | AN17: =RC[-28] -> 17.48 | AO17: =RC[-28] -> 67.27 | AP17: - | AQ17: =RC[-29] -> 0 | AR17: =RC[-29] -> 0 | AS17: - | AT17: =RC[-30] -> 0 | AU17: =RC[-30] -> 0 | AV17: =RC[-30] -> 1.1519999999999999 | AW17: =RC[-30] -> 3.87 | AY17: - | AZ17: - | BA17: -
A18: =IF(RC[1]="","",DATEVALUE(RC[1])) -> 43370 | B18: 27.09.18 | C18: 24 | D18: 161.77000000000001 | E18: 63.48 | F18: 7.8 | G18: 132.43 | H18: 46.25 | I18: 5.2 | J18: =RC[-5]-RC[-2] -> 17.229999999999997 | K18: 29.34 | L18: 19.440000000000001 | M18: 63.3 | R18: 1.2090000000000001 | S18: 4.1500000000000004 | T18: =(RC[-16]*RC[-15]-RC[-13]*RC[-12])/1000 -> 4.1442721000000002 | U18: 19.07 | V18: - | W18: =RC[-2]*RC[-10]/1000 -> 1.207131 | X18: =ABS((RC[-3]*RC[-11]-RC[-2]*RC[-9])/1000) -> #VALUE! | Y18: =(RC[-14]-RC[1])/RC[-18]*100 -> 7.7550403987012002 | Z18: 19.07 | AC18: =VALUE(RC[-27]) -> 2018-09-27T00:00:00.000 | AD18: =IF(RC[21]=42,"*",IF(RC[21]=32,"",RC[21])) -> - | AE18: =RC[-28] -> 24 | AF18: =RC[-28] -> 161.77000000000001 | AG18: =RC[-28] -> 63.48 | AH18: =RC[-28] -> 7.8 | AI18: =RC[-28] -> 132.43 | AJ18: =RC[-28] -> 46.25 | AK18: =RC[-28] -> 5.2 | AL18: =RC[-28] -> 17.229999999999997 | AM18: =RC[-28] -> 29.34 | AN18: =RC[-28] -> 19.440000000000001 | AO18: =RC[-28] -> 63.3 | AP18: - | AQ18: =RC[-29] -> 0 | AR18: =RC[-29] -> 0 | AS18: - | AT18: =RC[-30] -> 0 | AU18: =RC[-30] -> 0 | AV18: =RC[-30] -> 1.2090000000000001 | AW18: =RC[-30] -> 4.1500000000000004 | AY18: - | AZ18: - | BA18: -
A19: =IF(RC[1]="","",DATEVALUE(RC[1])) -> 43371 | B19: 28.09.18 | C19: 24 | D19: 155.27000000000001 | E19: 68.11 | F19: 7.72 | G19: 126.83 | H19: 43.69 | I19: 5.31 | J19: =RC[-5]-RC[-2] -> 24.42 | K19: 28.44 | L19: 18.059999999999999 | M19: 68.02 | R19: 1.204 | S19: 5.0389999999999997 | T19: =(RC[-16]*RC[-15]-RC[-13]*RC[-12])/1000 -> 5.034237000000001 | U19: 17.670000000000002 | V19: - | W19: =RC[-2]*RC[-10]/1000 -> 1.2019134000000002 | X19: =ABS((RC[-3]*RC[-11]-RC[-2]*RC[-9])/1000) -> #VALUE! | Y19: =(RC[-14]-RC[1])/RC[-18]*100 -> 8.4916817787589682 | Z19: 17.670000000000002 | AC19: =VALUE(RC[-27]) -> 2018-09-28T00:00:00.000 | AD19: =IF(RC[21]=42,"*",IF(RC[21]=32,"",RC[21])) -> - | AE19: =RC[-28] -> 24 | AF19: =RC[-28] -> 155.27000000000001 | AG19: =RC[-28] -> 68.11 | AH19: =RC[-28] -> 7.72 | AI19: =RC[-28] -> 126.83 | AJ19: =RC[-28] -> 43.69 | AK19: =RC[-28] -> 5.31 | AL19: =RC[-28] -> 24.42 | AM19: =RC[-28] -> 28.44 | AN19: =RC[-28] -> 18.059999999999999 | AO19: =RC[-28] -> 68.02 | AP19: - | AQ19: =RC[-29] -> 0 | AR19: =RC[-29] -> 0 | AS19: - | AT19: =RC[-30] -> 0 | AU19: =RC[-30] -> 0 | AV19: =RC[-30] -> 1.204 | AW19: =RC[-30] -> 5.0389999999999997 | AY19: - | AZ19: - | BA19: -
A20: =IF(RC[1]="","",DATEVALUE(RC[1])) -> 43372 | B20: 29.09.18 | C20: 24 | D20: 151.93 | E20: 67.55 | F20: 7.72 | G20: 134.5 | H20: 42.52 | I20: 5.45 | J20: =RC[-5]-RC[-2] -> 25.029999999999994 | K20: 17.43 | L20: 18.260000000000002 | M20: 67.17 | R20: 1.2 | S20: 4.5460000000000003 | T20: =(RC[-16]*RC[-15]-RC[-13]*RC[-12])/1000 -> 4.5439314999999985 | U20: 17.88 | V20: - | W20: =RC[-2]*RC[-10]/1000 -> 1.2009995999999998 | X20: =ABS((RC[-3]*RC[-11]-RC[-2]*RC[-9])/1000) -> #VALUE! | Y20: =(RC[-14]-RC[1])/RC[-18]*100 -> -0.33457249070631917 | Z20: 17.88 | AC20: =VALUE(RC[-27]) -> 2018-09-29T00:00:00.000 | AD20: =IF(RC[21]=42,"*",IF(RC[21]=32,"",RC[21])) -> - | AE20: =RC[-28] -> 24 | AF20: =RC[-28] -> 151.93 | AG20: =RC[-28] -> 67.55 | AH20: =RC[-28] -> 7.72 | AI20: =RC[-28] -> 134.5 | AJ20: =RC[-28] -> 42.52 | AK20: =RC[-28] -> 5.45 | AL20: =RC[-28] -> 25.029999999999994 | AM20: =RC[-28] -> 17.43 | AN20: =RC[-28] -> 18.260000000000002 | AO20: =RC[-28] -> 67.17 | AP20: - | AQ20: =RC[-29] -> 0 | AR20: =RC[-29] -> 0 | AS20: - | AT20: =RC[-30] -> 0 | AU20: =RC[-30] -> 0 | AV20: =RC[-30] -> 1.2 | AW20: =RC[-30] -> 4.5460000000000003 | AY20: - | AZ20: - | BA20: -
A21: =IF(RC[1]="","",DATEVALUE(RC[1])) -> 43373 | B21: 30.09.18 | C21: 24 | D21: 153.56 | E21: 69.930000000000007 | F21: 7.63 | G21: 133.08000000000001 | H21: 43.48 | I21: 5.41 | J21: =RC[-5]-RC[-2] -> 26.45000000000001 | K21: 20.48 | L21: 21.31 | M21: 70.010000000000005 | R21: 1.46 | S21: 4.9580000000000002 | T21: =(RC[-16]*RC[-15]-RC[-13]*RC[-12])/1000 -> 4.9521324 | U21: 20.84 | V21: - | W21: =RC[-2]*RC[-10]/1000 -> 1.4590084000000001 | X21: =ABS((RC[-3]*RC[-11]-RC[-2]*RC[-9])/1000) -> #VALUE! | Y21: =(RC[-14]-RC[1])/RC[-18]*100 -> -0.27051397655545489 | Z21: 20.84 | AC21: =VALUE(RC[-27]) -> 2018-09-30T00:00:00.000 | AD21: =IF(RC[21]=42,"*",IF(RC[21]=32,"",RC[21])) -> - | AE21: =RC[-28] -> 24 | AF21: =RC[-28] -> 153.56 | AG21: =RC[-28] -> 69.930000000000007 | AH21: =RC[-28] -> 7.63 | AI21: =RC[-28] -> 133.08000000000001 | AJ21: =RC[-28] -> 43.48 | AK21: =RC[-28] -> 5.41 | AL21: =RC[-28] -> 26.45000000000001 | AM21: =RC[-28] -> 20.48 | AN21: =RC[-28] -> 21.31 | AO21: =RC[-28] -> 70.010000000000005 | AP21: - | AQ21: =RC[-29] -> 0 | AR21: =RC[-29] -> 0 | AS21: - | AT21: =RC[-30] -> 0 | AU21: =RC[-30] -> 0 | AV21: =RC[-30] -> 1.46 | AW21: =RC[-30] -> 4.9580000000000002 | AY21: - | AZ21: - | BA21: -
A22: =IF(RC[1]="","",DATEVALUE(RC[1])) -> 43374 | B22: 01.10.18 | C22: 24 | D22: 152.13 | E22: 68.56 | F22: 7.73 | G22: 134.15 | H22: 43.58 | I22: 5.47 | J22: =RC[-5]-RC[-2] -> 24.980000000000004 | K22: 17.98 | L22: 18.7 | M22: 68.239999999999995 | R22: 1.25 | S22: 4.585 | T22: =(RC[-16]*RC[-15]-RC[-13]*RC[-12])/1000 -> 4.5837758000000015 | U22: 18.32 | V22: - | W22: =RC[-2]*RC[-10]/1000 -> 1.2501568000000001 | X22: =ABS((RC[-3]*RC[-11]-RC[-2]*RC[-9])/1000) -> #VALUE! | Y22: =(RC[-14]-RC[1])/RC[-18]*100 -> -0.25344763324636588 | Z22: 18.32 | AC22: =VALUE(RC[-27]) -> 2018-10-01T00:00:00.000 | AD22: =IF(RC[21]=42,"*",IF(RC[21]=32,"",RC[21])) -> - | AE22: =RC[-28] -> 24 | AF22: =RC[-28] -> 152.13 | AG22: =RC[-28] -> 68.56 | AH22: =RC[-28] -> 7.73 | AI22: =RC[-28] -> 134.15 | AJ22: =RC[-28] -> 43.58 | AK22: =RC[-28] -> 5.47 | AL22: =RC[-28] -> 24.980000000000004 | AM22: =RC[-28] -> 17.98 | AN22: =RC[-28] -> 18.7 | AO22: =RC[-28] -> 68.239999999999995 | AP22: - | AQ22: =RC[-29] -> 0 | AR22: =RC[-29] -> 0 | AS22: - | AT22: =RC[-30] -> 0 | AU22: =RC[-30] -> 0 | AV22: =RC[-30] -> 1.25 | AW22: =RC[-30] -> 4.585 | AY22: - | AZ22: - | BA22: -
A23: =IF(RC[1]="","",DATEVALUE(RC[1])) -> 43375 | B23: 02.10.18 | C23: 24 | D23: 144.77000000000001 | E23: 67.31 | F23: 7.53 | G23: 129.46 | H23: 42.3 | I23: 5.47 | J23: =RC[-5]-RC[-2] -> 25.010000000000005 | K23: 15.31 | L23: 17.04 | M23: 67.08 | R23: 1.1220000000000001 | S23: 4.2720000000000002 | T23: =(RC[-16]*RC[-15]-RC[-13]*RC[-12])/1000 -> 4.2683107000000007 | U23: 16.72 | V23: - | W23: =RC[-2]*RC[-10]/1000 -> 1.1215776 | X23: =ABS((RC[-3]*RC[-11]-RC[-2]*RC[-9])/1000) -> #VALUE! | Y23: =(RC[-14]-RC[1])/RC[-18]*100 -> -1.0891395025490487 | Z23: 16.72 | AC23: =VALUE(RC[-27]) -> 2018-10-02T00:00:00.000 | AD23: =IF(RC[21]=42,"*",IF(RC[21]=32,"",RC[21])) -> - | AE23: =RC[-28] -> 24 | AF23: =RC[-28] -> 144.77000000000001 | AG23: =RC[-28] -> 67.31 | AH23: =RC[-28] -> 7.53 | AI23: =RC[-28] -> 129.46 | AJ23: =RC[-28] -> 42.3 | AK23: =RC[-28] -> 5.47 | AL23: =RC[-28] -> 25.010000000000005 | AM23: =RC[-28] -> 15.31 | AN23: =RC[-28] -> 17.04 | AO23: =RC[-28] -> 67.08 | AP23: - | AQ23: =RC[-29] -> 0 | AR23: =RC[-29] -> 0 | AS23: - | AT23: =RC[-30] -> 0 | AU23: =RC[-30] -> 0 | AV23: =RC[-30] -> 1.1220000000000001 | AW23: =RC[-30] -> 4.2720000000000002 | AY23: - | AZ23: - | BA23: -
A24: =IF(RC[1]="","",DATEVALUE(RC[1])) -> 43376 | B24: 03.10.18 | C24: 24 | D24: 143.19 | E24: 67.45 | F24: 7.52 | G24: 125.7 | H24: 41.8 | I24: 5.58 | J24: =RC[-5]-RC[-2] -> 25.650000000000006 | K24: 17.489999999999998 | L24: 19.32 | M24: 67.38 | R24: 1.2769999999999999 | S24: 4.4050000000000002 | T24: =(RC[-16]*RC[-15]-RC[-13]*RC[-12])/1000 -> 4.4039055000000014 | U24: 18.940000000000001 | V24: - | W24: =RC[-2]*RC[-10]/1000 -> 1.2761772 | X24: =ABS((RC[-3]*RC[-11]-RC[-2]*RC[-9])/1000) -> #VALUE! | Y24: =(RC[-14]-RC[1])/RC[-18]*100 -> -1.1535401750198908 | Z24: 18.940000000000001 | AC24: =VALUE(RC[-27]) -> 2018-10-03T00:00:00.000 | AD24: =IF(RC[21]=42,"*",IF(RC[21]=32,"",RC[21])) -> - | AE24: =RC[-28] -> 24 | AF24: =RC[-28] -> 143.19 | AG24: =RC[-28] -> 67.45 | AH24: =RC[-28] -> 7.52 | AI24: =RC[-28] -> 125.7 | AJ24: =RC[-28] -> 41.8 | AK24: =RC[-28] -> 5.58 | AL24: =RC[-28] -> 25.650000000000006 | AM24: =RC[-28] -> 17.489999999999998 | AN24: =RC[-28] -> 19.32 | AO24: =RC[-28] -> 67.38 | AP24: - | AQ24: =RC[-29] -> 0 | AR24: =RC[-29] -> 0 | AS24: - | AT24: =RC[-30] -> 0 | AU24: =RC[-30] -> 0 | AV24: =RC[-30] -> 1.2769999999999999 | AW24: =RC[-30] -> 4.4050000000000002 | AY24: - | AZ24: - | BA24: -
A25: =IF(RC[1]="","",DATEVALUE(RC[1])) -> 43377 | B25: 04.10.18 | C25: 24 | D25: 135.47999999999999 | E25: 66.760000000000005 | F25: 7.4 | G25: 119.51 | H25: 40.61 | I25: 5.65 | J25: =RC[-5]-RC[-2] -> 26.150000000000006 | K25: 15.97 | L25: 17.920000000000002 | M25: 66.5 | R25: 1.17 | S25: 4.1920000000000002 | T25: =(RC[-16]*RC[-15]-RC[-13]*RC[-12])/1000 -> 4.1913436999999991 | U25: 17.57 | V25: - | W25: =RC[-2]*RC[-10]/1000 -> 1.1684049999999999 | X25: =ABS((RC[-3]*RC[-11]-RC[-2]*RC[-9])/1000) -> #VALUE! | Y25: =(RC[-14]-RC[1])/RC[-18]*100 -> -1.3388001004100072 | Z25: 17.57 | AC25: =VALUE(RC[-27]) -> 2018-10-04T00:00:00.000 | AD25: =IF(RC[21]=42,"*",IF(RC[21]=32,"",RC[21])) -> - | AE25: =RC[-28] -> 24 | AF25: =RC[-28] -> 135.47999999999999 | AG25: =RC[-28] -> 66.760000000000005 | AH25: =RC[-28] -> 7.4 | AI25: =RC[-28] -> 119.51 | AJ25: =RC[-28] -> 40.61 | AK25: =RC[-28] -> 5.65 | AL25: =RC[-28] -> 26.150000000000006 | AM25: =RC[-28] -> 15.97 | AN25: =RC[-28] -> 17.920000000000002 | AO25: =RC[-28] -> 66.5 | AP25: - | AQ25: =RC[-29] -> 0 | AR25: =RC[-29] -> 0 | AS25: - | AT25: =RC[-30] -> 0 | AU25: =RC[-30] -> 0 | AV25: =RC[-30] -> 1.17 | AW25: =RC[-30] -> 4.1920000000000002 | AY25: - | AZ25: - | BA25: -
A26: =IF(RC[1]="","",DATEVALUE(RC[1])) -> 43378 | B26: 05.10.18 | C26: 24 | D26: 125.22 | E26: 66.05 | F26: 7.18 | G26: 108.82 | H26: 38.79 | I26: 5.75 | J26: =RC[-5]-RC[-2] -> 27.259999999999998 | K26: 16.399999999999999 | L26: 18.309999999999999 | M26: 65.95 | R26: 1.1850000000000001 | S26: 4.0490000000000004 | T26: =(RC[-16]*RC[-15]-RC[-13]*RC[-12])/1000 -> 4.0496531999999998 | U26: 17.96 | V26: - | W26: =RC[-2]*RC[-10]/1000 -> 1.1844620000000001 | X26: =ABS((RC[-3]*RC[-11]-RC[-2]*RC[-9])/1000) -> #VALUE! | Y26: =(RC[-14]-RC[1])/RC[-18]*100 -> -1.4335600073515919 | Z26: 17.96 | AC26: =VALUE(RC[-27]) -> 2018-10-05T00:00:00.000 | AD26: =IF(RC[21]=42,"*",IF(RC[21]=32,"",RC[21])) -> - | AE26: =RC[-28] -> 24 | AF26: =RC[-28] -> 125.22 | AG26: =RC[-28] -> 66.05 | AH26: =RC[-28] -> 7.18 | AI26: =RC[-28] -> 108.82 | AJ26: =RC[-28] -> 38.79 | AK26: =RC[-28] -> 5.75 | AL26: =RC[-28] -> 27.259999999999998 | AM26: =RC[-28] -> 16.399999999999999 | AN26: =RC[-28] -> 18.309999999999999 | AO26: =RC[-28] -> 65.95 | AP26: - | AQ26: =RC[-29] -> 0 | AR26: =RC[-29] -> 0 | AS26: - | AT26: =RC[-30] -> 0 | AU26: =RC[-30] -> 0 | AV26: =RC[-30] -> 1.1850000000000001 | AW26: =RC[-30] -> 4.0490000000000004 | AY26: - | AZ26: - | BA26: -
A27: =IF(RC[1]="","",DATEVALUE(RC[1])) -> 43379 | B27: 06.10.18 | C27: 24 | D27: 126.9 | E27: 66.760000000000005 | F27: 7.14 | G27: 109.65 | H27: 39.51 | I27: 5.69 | J27: =RC[-5]-RC[-2] -> 27.250000000000007 | K27: 17.25 | L27: 19.22 | M27: 66.819999999999993 | R27: 1.256 | S27: 4.1390000000000002 | T27: =(RC[-16]*RC[-15]-RC[-13]*RC[-12])/1000 -> 4.1395725000000008 | U27: 18.829999999999998 | V27: - | W27: =RC[-2]*RC[-10]/1000 -> 1.2582205999999996 | X27: =ABS((RC[-3]*RC[-11]-RC[-2]*RC[-9])/1000) -> #VALUE! | Y27: =(RC[-14]-RC[1])/RC[-18]*100 -> -1.440948472412219 | Z27: 18.829999999999998 | AC27: =VALUE(RC[-27]) -> 2018-10-06T00:00:00.000 | AD27: =IF(RC[21]=42,"*",IF(RC[21]=32,"",RC[21])) -> - | AE27: =RC[-28] -> 24 | AF27: =RC[-28] -> 126.9 | AG27: =RC[-28] -> 66.760000000000005 | AH27: =RC[-28] -> 7.14 | AI27: =RC[-28] -> 109.65 | AJ27: =RC[-28] -> 39.51 | AK27: =RC[-28] -> 5.69 | AL27: =RC[-28] -> 27.250000000000007 | AM27: =RC[-28] -> 17.25 | AN27: =RC[-28] -> 19.22 | AO27: =RC[-28] -> 66.819999999999993 | AP27: - | AQ27: =RC[-29] -> 0 | AR27: =RC[-29] -> 0 | AS27: - | AT27: =RC[-30] -> 0 | AU27: =RC[-30] -> 0 | AV27: =RC[-30] -> 1.256 | AW27: =RC[-30] -> 4.1390000000000002 | AY27: - | AZ27: - | BA27: -
A28: =IF(RC[1]="","",DATEVALUE(RC[1])) -> 43380 | B28: 07.10.18 | C28: 24 | D28: 128.94999999999999 | E28: 67 | F28: 7.12 | G28: 108.8 | H28: 39.53 | I28: 5.7 | J28: =RC[-5]-RC[-2] -> 27.47 | K28: 20.149999999999999 | L28: 22.13 | M28: 66.97 | R28: 1.4530000000000001 | S28: 4.3380000000000001 | T28: =(RC[-16]*RC[-15]-RC[-13]*RC[-12])/1000 -> 4.3387859999999998 | U28: 21.69 | V28: - | W28: =RC[-2]*RC[-10]/1000 -> 1.4525793 | X28: =ABS((RC[-3]*RC[-11]-RC[-2]*RC[-9])/1000) -> #VALUE! | Y28: =(RC[-14]-RC[1])/RC[-18]*100 -> -1.4154411764705908 | Z28: 21.69 | AC28: =VALUE(RC[-27]) -> 2018-10-07T00:00:00.000 | AD28: =IF(RC[21]=42,"*",IF(RC[21]=32,"",RC[21])) -> - | AE28: =RC[-28] -> 24 | AF28: =RC[-28] -> 128.94999999999999 | AG28: =RC[-28] -> 67 | AH28: =RC[-28] -> 7.12 | AI28: =RC[-28] -> 108.8 | AJ28: =RC[-28] -> 39.53 | AK28: =RC[-28] -> 5.7 | AL28: =RC[-28] -> 27.47 | AM28: =RC[-28] -> 20.149999999999999 | AN28: =RC[-28] -> 22.13 | AO28: =RC[-28] -> 66.97 | AP28: - | AQ28: =RC[-29] -> 0 | AR28: =RC[-29] -> 0 | AS28: - | AT28: =RC[-30] -> 0 | AU28: =RC[-30] -> 0 | AV28: =RC[-30] -> 1.4530000000000001 | AW28: =RC[-30] -> 4.3380000000000001 | AY28: - | AZ28: - | BA28: -
A29: =IF(RC[1]="","",DATEVALUE(RC[1])) -> 43381 | B29: 08.10.18 | C29: 24 | D29: 125.49 | E29: 66.95 | F29: 7.11 | G29: 107.95 | H29: 38.99 | I29: 5.71 | J29: =RC[-5]-RC[-2] -> 27.96 | K29: 17.54 | L29: 19.34 | M29: 66.78 | R29: 1.2669999999999999 | S29: 4.1929999999999996 | T29: =(RC[-16]*RC[-15]-RC[-13]*RC[-12])/1000 -> 4.1925850000000002 | U29: 18.96 | V29: - | W29: =RC[-2]*RC[-10]/1000 -> 1.2661488000000001 | X29: =ABS((RC[-3]*RC[-11]-RC[-2]*RC[-9])/1000) -> #VALUE! | Y29: =(RC[-14]-RC[1])/RC[-18]*100 -> -1.3154238073182045 | Z29: 18.96 | AC29: =VALUE(RC[-27]) -> 2018-10-08T00:00:00.000 | AD29: =IF(RC[21]=42,"*",IF(RC[21]=32,"",RC[21])) -> - | AE29: =RC[-28] -> 24 | AF29: =RC[-28] -> 125.49 | AG29: =RC[-28] -> 66.95 | AH29: =RC[-28] -> 7.11 | AI29: =RC[-28] -> 107.95 | AJ29: =RC[-28] -> 38.99 | AK29: =RC[-28] -> 5.71 | AL29: =RC[-28] -> 27.96 | AM29: =RC[-28] -> 17.54 | AN29: =RC[-28] -> 19.34 | AO29: =RC[-28] -> 66.78 | AP29: - | AQ29: =RC[-29] -> 0 | AR29: =RC[-29] -> 0 | AS29: - | AT29: =RC[-30] -> 0 | AU29: =RC[-30] -> 0 | AV29: =RC[-30] -> 1.2669999999999999 | AW29: =RC[-30] -> 4.1929999999999996 | AY29: - | AZ29: - | BA29: -
A30: =IF(RC[1]="","",DATEVALUE(RC[1])) -> 43382 | B30: 09.10.18 | C30: 24 | D30: 128.35 | E30: 66.86 | F30: 7.23 | G30: 112.05 | H30: 39.65 | I30: 5.73 | J30: =RC[-5]-RC[-2] -> 27.21 | K30: 16.3 | L30: 18.61 | M30: 66.84 | R30: 1.2210000000000001 | S30: 4.1360000000000001 | T30: =(RC[-16]*RC[-15]-RC[-13]*RC[-12])/1000 -> 4.1386985000000003 | U30: 18.25 | V30: - | W30: =RC[-2]*RC[-10]/1000 -> 1.2198300000000002 | X30: =ABS((RC[-3]*RC[-11]-RC[-2]*RC[-9])/1000) -> #VALUE! | Y30: =(RC[-14]-RC[1])/RC[-18]*100 -> -1.7402945113788482 | Z30: 18.25 | AC30: =VALUE(RC[-27]) -> 2018-10-09T00:00:00.000 | AD30: =IF(RC[21]=42,"*",IF(RC[21]=32,"",RC[21])) -> - | AE30: =RC[-28] -> 24 | AF30: =RC[-28] -> 128.35 | AG30: =RC[-28] -> 66.86 | AH30: =RC[-28] -> 7.23 | AI30: =RC[-28] -> 112.05 | AJ30: =RC[-28] -> 39.65 | AK30: =RC[-28] -> 5.73 | AL30: =RC[-28] -> 27.21 | AM30: =RC[-28] -> 16.3 | AN30: =RC[-28] -> 18.61 | AO30: =RC[-28] -> 66.84 | AP30: - | AQ30: =RC[-29] -> 0 | AR30: =RC[-29] -> 0 | AS30: - | AT30: =RC[-30] -> 0 | AU30: =RC[-30] -> 0 | AV30: =RC[-30] -> 1.2210000000000001 | AW30: =RC[-30] -> 4.1360000000000001 | AY30: - | AZ30: - | BA30: -
A31: =IF(RC[1]="","",DATEVALUE(RC[1])) -> 43383 | B31: 10.10.18 | C31: 24 | D31: 128.07 | E31: 67.91 | F31: 7.16 | G31: 112.39 | H31: 40.56 | I31: 5.64 | J31: =RC[-5]-RC[-2] -> 27.349999999999994 | K31: 15.68 | L31: 17.77 | M31: 67.86 | R31: 1.1879999999999999 | S31: 4.1379999999999999 | T31: =(RC[-16]*RC[-15]-RC[-13]*RC[-12])/1000 -> 4.1386952999999984 | U31: 17.440000000000001 | V31: - | W31: =RC[-2]*RC[-10]/1000 -> 1.1834784 | X31: =ABS((RC[-3]*RC[-11]-RC[-2]*RC[-9])/1000) -> #VALUE! | Y31: =(RC[-14]-RC[1])/RC[-18]*100 -> -1.5659756206068169 | Z31: 17.440000000000001 | AC31: =VALUE(RC[-27]) -> 2018-10-10T00:00:00.000 | AD31: =IF(RC[21]=42,"*",IF(RC[21]=32,"",RC[21])) -> - | AE31: =RC[-28] -> 24 | AF31: =RC[-28] -> 128.07 | AG31: =RC[-28] -> 67.91 | AH31: =RC[-28] -> 7.16 | AI31: =RC[-28] -> 112.39 | AJ31: =RC[-28] -> 40.56 | AK31: =RC[-28] -> 5.64 | AL31: =RC[-28] -> 27.349999999999994 | AM31: =RC[-28] -> 15.68 | AN31: =RC[-28] -> 17.77 | AO31: =RC[-28] -> 67.86 | AP31: - | AQ31: =RC[-29] -> 0 | AR31: =RC[-29] -> 0 | AS31: - | AT31: =RC[-30] -> 0 | AU31: =RC[-30] -> 0 | AV31: =RC[-30] -> 1.1879999999999999 | AW31: =RC[-30] -> 4.1379999999999999 | AY31: - | AZ31: - | BA31: -
A32: =IF(RC[1]="","",DATEVALUE(RC[1])) -> 43384 | B32: 11.10.18 | C32: 24 | D32: 131.69999999999999 | E32: 69.010000000000005 | F32: 7.17 | G32: 115.86 | H32: 41.4 | I32: 5.56 | J32: =RC[-5]-RC[-2] -> 27.610000000000007 | K32: 15.84 | L32: 17.93 | M32: 68.87 | R32: 1.2090000000000001 | S32: 4.2919999999999998 | T32: =(RC[-16]*RC[-15]-RC[-13]*RC[-12])/1000 -> 4.2920130000000007 | U32: 17.54 | V32: - | W32: =RC[-2]*RC[-10]/1000 -> 1.2079798000000002 | X32: =ABS((RC[-3]*RC[-11]-RC[-2]*RC[-9])/1000) -> #VALUE! | Y32: =(RC[-14]-RC[1])/RC[-18]*100 -> -1.4672881063352314 | Z32: 17.54 | AC32: =VALUE(RC[-27]) -> 2018-10-11T00:00:00.000 | AD32: =IF(RC[21]=42,"*",IF(RC[21]=32,"",RC[21])) -> - | AE32: =RC[-28] -> 24 | AF32: =RC[-28] -> 131.69999999999999 | AG32: =RC[-28] -> 69.010000000000005 | AH32: =RC[-28] -> 7.17 | AI32: =RC[-28] -> 115.86 | AJ32: =RC[-28] -> 41.4 | AK32: =RC[-28] -> 5.56 | AL32: =RC[-28] -> 27.610000000000007 | AM32: =RC[-28] -> 15.84 | AN32: =RC[-28] -> 17.93 | AO32: =RC[-28] -> 68.87 | AP32: - | AQ32: =RC[-29] -> 0 | AR32: =RC[-29] -> 0 | AS32: - | AT32: =RC[-30] -> 0 | AU32: =RC[-30] -> 0 | AV32: =RC[-30] -> 1.2090000000000001 | AW32: =RC[-30] -> 4.2919999999999998 | AY32: - | AZ32: - | BA32: -
A33: =IF(RC[1]="","",DATEVALUE(RC[1])) -> 43385 | B33: 12.10.18 | C33: 24 | D33: 130.21 | E33: 68.84 | F33: 7.17 | G33: 114.53 | H33: 41.19 | I33: 5.6 | J33: =RC[-5]-RC[-2] -> 27.650000000000006 | K33: 15.68 | L33: 17.66 | M33: 68.680000000000007 | R33: 1.1879999999999999 | S33: 4.2450000000000001 | T33: =(RC[-16]*RC[-15]-RC[-13]*RC[-12])/1000 -> 4.2461657000000024 | U33: 17.309999999999999 | V33: - | W33: =RC[-2]*RC[-10]/1000 -> 1.1888508 | X33: =ABS((RC[-3]*RC[-11]-RC[-2]*RC[-9])/1000) -> #VALUE! | Y33: =(RC[-14]-RC[1])/RC[-18]*100 -> -1.4232078931284371 | Z33: 17.309999999999999 | AC33: =VALUE(RC[-27]) -> 2018-10-12T00:00:00.000 | AD33: =IF(RC[21]=42,"*",IF(RC[21]=32,"",RC[21])) -> - | AE33: =RC[-28] -> 24 | AF33: =RC[-28] -> 130.21 | AG33: =RC[-28] -> 68.84 | AH33: =RC[-28] -> 7.17 | AI33: =RC[-28] -> 114.53 | AJ33: =RC[-28] -> 41.19 | AK33: =RC[-28] -> 5.6 | AL33: =RC[-28] -> 27.650000000000006 | AM33: =RC[-28] -> 15.68 | AN33: =RC[-28] -> 17.66 | AO33: =RC[-28] -> 68.680000000000007 | AP33: - | AQ33: =RC[-29] -> 0 | AR33: =RC[-29] -> 0 | AS33: - | AT33: =RC[-30] -> 0 | AU33: =RC[-30] -> 0 | AV33: =RC[-30] -> 1.1879999999999999 | AW33: =RC[-30] -> 4.2450000000000001 | AY33: - | AZ33: - | BA33: -
A34: =IF(RC[1]="","",DATEVALUE(RC[1])) -> 43386 | B34: 13.10.18 | C34: 24 | D34: 135.97999999999999 | E34: 70.02 | F34: 7.32 | G34: 119.9 | H34: 42.52 | I34: 5.6 | J34: =RC[-5]-RC[-2] -> 27.499999999999993 | K34: 16.079999999999998 | L34: 18.100000000000001 | M34: 69.900000000000006 | R34: 1.2370000000000001 | S34: 4.4240000000000004 | T34: =(RC[-16]*RC[-15]-RC[-13]*RC[-12])/1000 -> 4.4231715999999981 | U34: 17.68 | V34: - | W34: =RC[-2]*RC[-10]/1000 -> 1.235832 | X34: =ABS((RC[-3]*RC[-11]-RC[-2]*RC[-9])/1000) -> #VALUE! | Y34: =(RC[-14]-RC[1])/RC[-18]*100 -> -1.3344453711426201 | Z34: 17.68 | AC34: =VALUE(RC[-27]) -> 2018-10-13T00:00:00.000 | AD34: =IF(RC[21]=42,"*",IF(RC[21]=32,"",RC[21])) -> - | AE34: =RC[-28] -> 24 | AF34: =RC[-28] -> 135.97999999999999 | AG34: =RC[-28] -> 70.02 | AH34: =RC[-28] -> 7.32 | AI34: =RC[-28] -> 119.9 | AJ34: =RC[-28] -> 42.52 | AK34: =RC[-28] -> 5.6 | AL34: =RC[-28] -> 27.499999999999993 | AM34: =RC[-28] -> 16.079999999999998 | AN34: =RC[-28] -> 18.100000000000001 | AO34: =RC[-28] -> 69.900000000000006 | AP34: - | AQ34: =RC[-29] -> 0 | AR34: =RC[-29] -> 0 | AS34: - | AT34: =RC[-30] -> 0 | AU34: =RC[-30] -> 0 | AV34: =RC[-30] -> 1.2370000000000001 | AW34: =RC[-30] -> 4.4240000000000004 | AY34: - | AZ34: - | BA34: -
A35: =IF(RC[1]="","",DATEVALUE(RC[1])) -> 43387 | B35: 14.10.18 | C35: 24 | D35: 140.02000000000001 | E35: 70.819999999999993 | F35: 7.26 | G35: 120.88 | H35: 43.5 | I35: 5.51 | J35: =RC[-5]-RC[-2] -> 27.319999999999993 | K35: 19.14 | L35: 21.42 | M35: 70.89 | R35: 1.488 | S35: 4.6580000000000004 | T35: =(RC[-16]*RC[-15]-RC[-13]*RC[-12])/1000 -> 4.6579363999999996 | U35: 20.95 | V35: - | W35: =RC[-2]*RC[-10]/1000 -> 1.4851454999999998 | X35: =ABS((RC[-3]*RC[-11]-RC[-2]*RC[-9])/1000) -> #VALUE! | Y35: =(RC[-14]-RC[1])/RC[-18]*100 -> -1.4973527465254788 | Z35: 20.95 | AC35: =VALUE(RC[-27]) -> 2018-10-14T00:00:00.000 | AD35: =IF(RC[21]=42,"*",IF(RC[21]=32,"",RC[21])) -> - | AE35: =RC[-28] -> 24 | AF35: =RC[-28] -> 140.02000000000001 | AG35: =RC[-28] -> 70.819999999999993 | AH35: =RC[-28] -> 7.26 | AI35: =RC[-28] -> 120.88 | AJ35: =RC[-28] -> 43.5 | AK35: =RC[-28] -> 5.51 | AL35: =RC[-28] -> 27.319999999999993 | AM35: =RC[-28] -> 19.14 | AN35: =RC[-28] -> 21.42 | AO35: =RC[-28] -> 70.89 | AP35: - | AQ35: =RC[-29] -> 0 | AR35: =RC[-29] -> 0 | AS35: - | AT35: =RC[-30] -> 0 | AU35: =RC[-30] -> 0 | AV35: =RC[-30] -> 1.488 | AW35: =RC[-30] -> 4.6580000000000004 | AY35: - | AZ35: - | BA35: -
A36: =IF(RC[1]="","",DATEVALUE(RC[1])) -> 43388 | B36: 15.10.18 | C36: 24 | D36: 141.25 | E36: 70.27 | F36: 7.34 | G36: 124.47 | H36: 43.91 | I36: 5.49 | J36: =RC[-5]-RC[-2] -> 26.36 | K36: 16.78 | L36: 18.690000000000001 | M36: 70.05 | R36: 1.28 | S36: 4.4640000000000004 | T36: =(RC[-16]*RC[-15]-RC[-13]*RC[-12])/1000 -> 4.4601597999999996 | U36: 18.29 | V36: - | W36: =RC[-2]*RC[-10]/1000 -> 1.2812144999999999 | X36: =ABS((RC[-3]*RC[-11]-RC[-2]*RC[-9])/1000) -> #VALUE! | Y36: =(RC[-14]-RC[1])/RC[-18]*100 -> -1.2131437294127083 | Z36: 18.29 | AC36: =VALUE(RC[-27]) -> 2018-10-15T00:00:00.000 | AD36: =IF(RC[21]=42,"*",IF(RC[21]=32,"",RC[21])) -> - | AE36: =RC[-28] -> 24 | AF36: =RC[-28] -> 141.25 | AG36: =RC[-28] -> 70.27 | AH36: =RC[-28] -> 7.34 | AI36: =RC[-28] -> 124.47 | AJ36: =RC[-28] -> 43.91 | AK36: =RC[-28] -> 5.49 | AL36: =RC[-28] -> 26.36 | AM36: =RC[-28] -> 16.78 | AN36: =RC[-28] -> 18.690000000000001 | AO36: =RC[-28] -> 70.05 | AP36: - | AQ36: =RC[-29] -> 0 | AR36: =RC[-29] -> 0 | AS36: - | AT36: =RC[-30] -> 0 | AU36: =RC[-30] -> 0 | AV36: =RC[-30] -> 1.28 | AW36: =RC[-30] -> 4.4640000000000004 | AY36: - | AZ36: - | BA36: -
A37: =IF(RC[1]="","",DATEVALUE(RC[1])) -> 43389 | B37: 16.10.18 | C37: 24 | D37: 140.62 | E37: 70.28 | F37: 7.32 | G37: 125.37 | H37: 43.84 | I37: 5.44 | J37: =RC[-5]-RC[-2] -> 26.439999999999998 | K37: 15.25 | L37: 17.12 | M37: 70.11 | R37: 1.1739999999999999 | S37: 4.3890000000000002 | T37: =(RC[-16]*RC[-15]-RC[-13]*RC[-12])/1000 -> 4.3865527999999996 | U37: 16.73 | V37: - | W37: =RC[-2]*RC[-10]/1000 -> 1.1729403 | X37: =ABS((RC[-3]*RC[-11]-RC[-2]*RC[-9])/1000) -> #VALUE! | Y37: =(RC[-14]-RC[1])/RC[-18]*100 -> -1.1805057031187687 | Z37: 16.73 | AC37: =VALUE(RC[-27]) -> 2018-10-16T00:00:00.000 | AD37: =IF(RC[21]=42,"*",IF(RC[21]=32,"",RC[21])) -> - | AE37: =RC[-28] -> 24 | AF37: =RC[-28] -> 140.62 | AG37: =RC[-28] -> 70.28 | AH37: =RC[-28] -> 7.32 | AI37: =RC[-28] -> 125.37 | AJ37: =RC[-28] -> 43.84 | AK37: =RC[-28] -> 5.44 | AL37: =RC[-28] -> 26.439999999999998 | AM37: =RC[-28] -> 15.25 | AN37: =RC[-28] -> 17.12 | AO37: =RC[-28] -> 70.11 | AP37: - | AQ37: =RC[-29] -> 0 | AR37: =RC[-29] -> 0 | AS37: - | AT37: =RC[-30] -> 0 | AU37: =RC[-30] -> 0 | AV37: =RC[-30] -> 1.1739999999999999 | AW37: =RC[-30] -> 4.3890000000000002 | AY37: - | AZ37: - | BA37: -
A38: =IF(RC[1]="","",DATEVALUE(RC[1])) -> 43390 | B38: 17.10.18 | C38: 24 | D38: 143.88 | E38: 70.58 | F38: 7.37 | G38: 127.51 | H38: 44.16 | I38: 5.43 | J38: =RC[-5]-RC[-2] -> 26.42 | K38: 16.37 | L38: 18.059999999999999 | M38: 70.540000000000006 | R38: 1.2470000000000001 | S38: 4.524 | T38: =(RC[-16]*RC[-15]-RC[-13]*RC[-12])/1000 -> 4.5242088000000003 | U38: 17.670000000000002 | V38: - | W38: =RC[-2]*RC[-10]/1000 -> 1.2464418000000004 | X38: =ABS((RC[-3]*RC[-11]-RC[-2]*RC[-9])/1000) -> #VALUE! | Y38: =(RC[-14]-RC[1])/RC[-18]*100 -> -1.0195278801662619 | Z38: 17.670000000000002 | AC38: =VALUE(RC[-27]) -> 2018-10-17T00:00:00.000 | AD38: =IF(RC[21]=42,"*",IF(RC[21]=32,"",RC[21])) -> - | AE38: =RC[-28] -> 24 | AF38: =RC[-28] -> 143.88 | AG38: =RC[-28] -> 70.58 | AH38: =RC[-28] -> 7.37 | AI38: =RC[-28] -> 127.51 | AJ38: =RC[-28] -> 44.16 | AK38: =RC[-28] -> 5.43 | AL38: =RC[-28] -> 26.42 | AM38: =RC[-28] -> 16.37 | AN38: =RC[-28] -> 18.059999999999999 | AO38: =RC[-28] -> 70.540000000000006 | AP38: - | AQ38: =RC[-29] -> 0 | AR38: =RC[-29] -> 0 | AS38: - | AT38: =RC[-30] -> 0 | AU38: =RC[-30] -> 0 | AV38: =RC[-30] -> 1.2470000000000001 | AW38: =RC[-30] -> 4.524 | AY38: - | AZ38: - | BA38: -
A39: =IF(RC[1]="","",DATEVALUE(RC[1])) -> 43391 | B39: 18.10.18 | C39: 24 | D39: 142.87 | E39: 71 | F39: 7.4 | G39: 127.37 | H39: 44.32 | I39: 5.47 | J39: =RC[-5]-RC[-2] -> 26.68 | K39: 15.5 | L39: 17.579999999999998 | M39: 70.900000000000006 | R39: 1.22 | S39: 4.5 | T39: =(RC[-16]*RC[-15]-RC[-13]*RC[-12])/1000 -> 4.4987316000000002 | U39: 17.18 | V39: - | W39: =RC[-2]*RC[-10]/1000 -> 1.2180620000000002 | X39: =ABS((RC[-3]*RC[-11]-RC[-2]*RC[-9])/1000) -> #VALUE! | Y39: =(RC[-14]-RC[1])/RC[-18]*100 -> -1.3189919133233883 | Z39: 17.18 | AC39: =VALUE(RC[-27]) -> 2018-10-18T00:00:00.000 | AD39: =IF(RC[21]=42,"*",IF(RC[21]=32,"",RC[21])) -> - | AE39: =RC[-28] -> 24 | AF39: =RC[-28] -> 142.87 | AG39: =RC[-28] -> 71 | AH39: =RC[-28] -> 7.4 | AI39: =RC[-28] -> 127.37 | AJ39: =RC[-28] -> 44.32 | AK39: =RC[-28] -> 5.47 | AL39: =RC[-28] -> 26.68 | AM39: =RC[-28] -> 15.5 | AN39: =RC[-28] -> 17.579999999999998 | AO39: =RC[-28] -> 70.900000000000006 | AP39: - | AQ39: =RC[-29] -> 0 | AR39: =RC[-29] -> 0 | AS39: - | AT39: =RC[-30] -> 0 | AU39: =RC[-30] -> 0 | AV39: =RC[-30] -> 1.22 | AW39: =RC[-30] -> 4.5 | AY39: - | AZ39: - | BA39: -
A40: =IF(RC[1]="","",DATEVALUE(RC[1])) -> 43392 | B40: 19.10.18 | C40: 24 | D40: 142.97 | E40: 70.81 | F40: 7.41 | G40: 127.42 | H40: 43.99 | I40: 5.48 | J40: =RC[-5]-RC[-2] -> 26.82 | K40: 15.55 | L40: 17.48 | M40: 70.709999999999994 | R40: 1.21 | S40: 4.5170000000000003 | T40: =(RC[-16]*RC[-15]-RC[-13]*RC[-12])/1000 -> 4.5184999000000001 | U40: 17.09 | V40: - | W40: =RC[-2]*RC[-10]/1000 -> 1.2084338999999999 | X40: =ABS((RC[-3]*RC[-11]-RC[-2]*RC[-9])/1000) -> #VALUE! | Y40: =(RC[-14]-RC[1])/RC[-18]*100 -> -1.2086014754355667 | Z40: 17.09 | AC40: =VALUE(RC[-27]) -> 2018-10-19T00:00:00.000 | AD40: =IF(RC[21]=42,"*",IF(RC[21]=32,"",RC[21])) -> - | AE40: =RC[-28] -> 24 | AF40: =RC[-28] -> 142.97 | AG40: =RC[-28] -> 70.81 | AH40: =RC[-28] -> 7.41 | AI40: =RC[-28] -> 127.42 | AJ40: =RC[-28] -> 43.99 | AK40: =RC[-28] -> 5.48 | AL40: =RC[-28] -> 26.82 | AM40: =RC[-28] -> 15.55 | AN40: =RC[-28] -> 17.48 | AO40: =RC[-28] -> 70.709999999999994 | AP40: - | AQ40: =RC[-29] -> 0 | AR40: =RC[-29] -> 0 | AS40: - | AT40: =RC[-30] -> 0 | AU40: =RC[-30] -> 0 | AV40: =RC[-30] -> 1.21 | AW40: =RC[-30] -> 4.5170000000000003 | AY40: - | AZ40: - | BA40: -
A41: =IF(RC[1]="","",DATEVALUE(RC[1])) -> 43393 | B41: 20.10.18 | C41: 24 | D41: 138.77000000000001 | E41: 69.989999999999995 | F41: 7.27 | G41: 121.6 | H41: 42.66 | I41: 5.52 | J41: =RC[-5]-RC[-2] -> 27.33 | K41: 17.170000000000002 | L41: 18.97 | M41: 69.98 | R41: 1.2969999999999999 | S41: 4.5259999999999998 | T41: =(RC[-16]*RC[-15]-RC[-13]*RC[-12])/1000 -> 4.525056300000001 | U41: 18.54 | V41: - | W41: =RC[-2]*RC[-10]/1000 -> 1.2974292000000001 | X41: =ABS((RC[-3]*RC[-11]-RC[-2]*RC[-9])/1000) -> #VALUE! | Y41: =(RC[-14]-RC[1])/RC[-18]*100 -> -1.1266447368421033 | Z41: 18.54 | AC41: =VALUE(RC[-27]) -> 2018-10-20T00:00:00.000 | AD41: =IF(RC[21]=42,"*",IF(RC[21]=32,"",RC[21])) -> - | AE41: =RC[-28] -> 24 | AF41: =RC[-28] -> 138.77000000000001 | AG41: =RC[-28] -> 69.989999999999995 | AH41: =RC[-28] -> 7.27 | AI41: =RC[-28] -> 121.6 | AJ41: =RC[-28] -> 42.66 | AK41: =RC[-28] -> 5.52 | AL41: =RC[-28] -> 27.33 | AM41: =RC[-28] -> 17.170000000000002 | AN41: =RC[-28] -> 18.97 | AO41: =RC[-28] -> 69.98 | AP41: - | AQ41: =RC[-29] -> 0 | AR41: =RC[-29] -> 0 | AS41: - | AT41: =RC[-30] -> 0 | AU41: =RC[-30] -> 0 | AV41: =RC[-30] -> 1.2969999999999999 | AW41: =RC[-30] -> 4.5259999999999998 | AY41: - | AZ41: - | BA41: -
A42: =IF(RC[1]="","",DATEVALUE(RC[1])) -> 43394 | B42: 21.10.18 | C42: 24 | D42: 141.44999999999999 | E42: 69.19 | F42: 7.27 | G42: 120.35 | H42: 42.08 | I42: 5.55 | J42: =RC[-5]-RC[-2] -> 27.11 | K42: 21.1 | L42: 22.88 | M42: 69.150000000000006 | R42: 1.5509999999999999 | S42: 4.7220000000000004 | T42: =(RC[-16]*RC[-15]-RC[-13]*RC[-12])/1000 -> 4.7225975 | U42: 22.39 | V42: - | W42: =RC[-2]*RC[-10]/1000 -> 1.5482685 | X42: =ABS((RC[-3]*RC[-11]-RC[-2]*RC[-9])/1000) -> #VALUE! | Y42: =(RC[-14]-RC[1])/RC[-18]*100 -> -1.0718737017033646 | Z42: 22.39 | AC42: =VALUE(RC[-27]) -> 2018-10-21T00:00:00.000 | AD42: =IF(RC[21]=42,"*",IF(RC[21]=32,"",RC[21])) -> - | AE42: =RC[-28] -> 24 | AF42: =RC[-28] -> 141.44999999999999 | AG42: =RC[-28] -> 69.19 | AH42: =RC[-28] -> 7.27 | AI42: =RC[-28] -> 120.35 | AJ42: =RC[-28] -> 42.08 | AK42: =RC[-28] -> 5.55 | AL42: =RC[-28] -> 27.11 | AM42: =RC[-28] -> 21.1 | AN42: =RC[-28] -> 22.88 | AO42: =RC[-28] -> 69.150000000000006 | AP42: - | AQ42: =RC[-29] -> 0 | AR42: =RC[-29] -> 0 | AS42: - | AT42: =RC[-30] -> 0 | AU42: =RC[-30] -> 0 | AV42: =RC[-30] -> 1.5509999999999999 | AW42: =RC[-30] -> 4.7220000000000004 | AY42: - | AZ42: - | BA42: -
A43: =IF(RC[1]="","",DATEVALUE(RC[1])) -> 43395 | B43: 22.10.18 | C43: 24 | D43: 137.97999999999999 | E43: 69.69 | F43: 7.29 | G43: 119.92 | H43: 42.13 | I43: 5.58 | J43: =RC[-5]-RC[-2] -> 27.559999999999995 | K43: 18.059999999999999 | L43: 19.82 | M43: 69.72 | R43: 1.353 | S43: 4.5629999999999997 | T43: =(RC[-16]*RC[-15]-RC[-13]*RC[-12])/1000 -> 4.5635965999999986 | U43: 19.39 | V43: - | W43: =RC[-2]*RC[-10]/1000 -> 1.3518707999999999 | X43: =ABS((RC[-3]*RC[-11]-RC[-2]*RC[-9])/1000) -> #VALUE! | Y43: =(RC[-14]-RC[1])/RC[-18]*100 -> -1.1090727151434305 | Z43: 19.39 | AC43: =VALUE(RC[-27]) -> 2018-10-22T00:00:00.000 | AD43: =IF(RC[21]=42,"*",IF(RC[21]=32,"",RC[21])) -> - | AE43: =RC[-28] -> 24 | AF43: =RC[-28] -> 137.97999999999999 | AG43: =RC[-28] -> 69.69 | AH43: =RC[-28] -> 7.29 | AI43: =RC[-28] -> 119.92 | AJ43: =RC[-28] -> 42.13 | AK43: =RC[-28] -> 5.58 | AL43: =RC[-28] -> 27.559999999999995 | AM43: =RC[-28] -> 18.059999999999999 | AN43: =RC[-28] -> 19.82 | AO43: =RC[-28] -> 69.72 | AP43: - | AQ43: =RC[-29] -> 0 | AR43: =RC[-29] -> 0 | AS43: - | AT43: =RC[-30] -> 0 | AU43: =RC[-30] -> 0 | AV43: =RC[-30] -> 1.353 | AW43: =RC[-30] -> 4.5629999999999997 | AY43: - | AZ43: - | BA43: -
A44: =IF(RC[1]="","",DATEVALUE(RC[1])) ->  | C44: 24 | J44: =RC[-5]-RC[-2] -> #VALUE! | T44: =(RC[-16]*RC[-15]-RC[-13]*RC[-12])/1000 -> #VALUE! | W44: =RC[-2]*RC[-10]/1000 -> #VALUE! | X44: =ABS((RC[-3]*RC[-11]-RC[-2]*RC[-9])/1000) -> #VALUE! | Y44: =(RC[-14]-RC[1])/RC[-18]*100 -> #VALUE! | AC44: =VALUE(RC[-27]) -> #VALUE! | AD44: =IF(RC[21]=42,"*",IF(RC[21]=32,"",RC[21])) ->  | AE44: =RC[-28] -> 24 | AF44: =RC[-28] ->  | AG44: =RC[-28] ->  | AH44: =RC[-28] ->  | AI44: =RC[-28] ->  | AJ44: =RC[-28] ->  | AK44: =RC[-28] ->  | AL44: =RC[-28] -> #VALUE! | AM44: =RC[-28] ->  | AN44: =RC[-28] ->  | AO44: =RC[-28] ->  | AP44: - | AQ44: =RC[-29] -> 0 | AR44: =RC[-29] -> 0 | AS44: - | AT44: =RC[-30] -> 0 | AU44: =RC[-30] -> 0 | AV44: =RC[-30] ->  | AW44: =RC[-30] -> 
A45: =IF(RC[1]="","",DATEVALUE(RC[1])) ->  | C45: 24 | T45: =(RC[-16]*RC[-15]-RC[-13]*RC[-12])/1000 -> #VALUE! | W45: =RC[-2]*RC[-10]/1000 -> #VALUE! | X45: =ABS((RC[-3]*RC[-11]-RC[-2]*RC[-9])/1000) -> #VALUE! | Y45: =(RC[-14]-RC[1])/RC[-18]*100 -> #VALUE! | AC45: =VALUE(RC[-27]) -> #VALUE! | AD45: =IF(RC[21]=42,"*",IF(RC[21]=32,"",RC[21])) ->  | AE45: =RC[-28] -> 24 | AF45: =RC[-28] ->  | AG45: =RC[-28] ->  | AH45: =RC[-28] ->  | AI45: =RC[-28] ->  | AJ45: =RC[-28] ->  | AK45: =RC[-28] ->  | AL45: =RC[-28] -> 0 | AM45: =RC[-28] ->  | AN45: =RC[-28] ->  | AO45: =RC[-28] ->  | AP45: - | AQ45: =RC[-29] -> 0 | AR45: =RC[-29] -> 0 | AS45: - | AT45: =RC[-30] -> 0 | AU45: =RC[-30] -> 0 | AV45: =RC[-30] ->  | AW45: =RC[-30] -> 
A46: =IF(RC[1]="","",DATEVALUE(RC[1])) ->  | C46: 24 | T46: =(RC[-16]*RC[-15]-RC[-13]*RC[-12])/1000 -> #VALUE! | W46: =RC[-2]*RC[-10]/1000 -> #VALUE! | X46: =ABS((RC[-3]*RC[-11]-RC[-2]*RC[-9])/1000) -> #VALUE! | Y46: =(RC[-14]-RC[1])/RC[-18]*100 -> #VALUE! | AC46: =VALUE(RC[-27]) -> #VALUE! | AD46: =IF(RC[21]=42,"*",IF(RC[21]=32,"",RC[21])) ->  | AE46: =RC[-28] -> 24 | AF46: =RC[-28] ->  | AG46: =RC[-28] ->  | AH46: =RC[-28] ->  | AI46: =RC[-28] ->  | AJ46: =RC[-28] ->  | AK46: =RC[-28] ->  | AL46: =RC[-28] -> 0 | AM46: =RC[-28] ->  | AN46: =RC[-28] ->  | AO46: =RC[-28] ->  | AP46: - | AQ46: =RC[-29] -> 0 | AR46: =RC[-29] -> 0 | AS46: - | AT46: =RC[-30] -> 0 | AU46: =RC[-30] -> 0 | AV46: =RC[-30] ->  | AW46: =RC[-30] -> 
A47: =IF(RC[1]="","",DATEVALUE(RC[1])) ->  | C47: 24 | T47: =(RC[-16]*RC[-15]-RC[-13]*RC[-12])/1000 -> #VALUE! | W47: =RC[-2]*RC[-10]/1000 -> #VALUE! | X47: =ABS((RC[-3]*RC[-11]-RC[-2]*RC[-9])/1000) -> #VALUE! | Y47: =(RC[-14]-RC[1])/RC[-18]*100 -> #VALUE! | AC47: =VALUE(RC[-27]) -> #VALUE! | AD47: =IF(RC[21]=42,"*",IF(RC[21]=32,"",RC[21])) ->  | AE47: =RC[-28] -> 24 | AF47: =RC[-28] ->  | AG47: =RC[-28] ->  | AH47: =RC[-28] ->  | AI47: =RC[-28] ->  | AJ47: =RC[-28] ->  | AK47: =RC[-28] ->  | AL47: =RC[-28] -> 0 | AM47: =RC[-28] ->  | AN47: =RC[-28] ->  | AO47: =RC[-28] ->  | AP47: - | AQ47: =RC[-29] -> 0 | AR47: =RC[-29] -> 0 | AS47: - | AT47: =RC[-30] -> 0 | AU47: =RC[-30] -> 0 | AV47: =RC[-30] ->  | AW47: =RC[-30] -> 
A48: =IF(RC[1]="","",DATEVALUE(RC[1])) ->  | C48: 24 | T48: =(RC[-16]*RC[-15]-RC[-13]*RC[-12])/1000 -> #VALUE! | W48: =RC[-2]*RC[-10]/1000 -> #VALUE! | X48: =ABS((RC[-3]*RC[-11]-RC[-2]*RC[-9])/1000) -> #VALUE! | Y48: =(RC[-14]-RC[1])/RC[-18]*100 -> #VALUE! | AC48: =VALUE(RC[-27]) -> #VALUE! | AD48: =IF(RC[21]=42,"*",IF(RC[21]=32,"",RC[21])) ->  | AE48: =RC[-28] -> 24 | AF48: =RC[-28] ->  | AG48: =RC[-28] ->  | AH48: =RC[-28] ->  | AI48: =RC[-28] ->  | AJ48: =RC[-28] ->  | AK48: =RC[-28] ->  | AL48: =RC[-28] -> 0 | AM48: =RC[-28] ->  | AN48: =RC[-28] ->  | AO48: =RC[-28] ->  | AP48: - | AQ48: =RC[-29] -> 0 | AR48: =RC[-29] -> 0 | AS48: - | AT48: =RC[-30] -> 0 | AU48: =RC[-30] -> 0 | AV48: =RC[-30] ->  | AW48: =RC[-30] -> 
A49: =IF(RC[1]="","",DATEVALUE(RC[1])) ->  | C49: 24 | T49: =(RC[-16]*RC[-15]-RC[-13]*RC[-12])/1000 -> #VALUE! | W49: =RC[-2]*RC[-10]/1000 -> #VALUE! | X49: =ABS((RC[-3]*RC[-11]-RC[-2]*RC[-9])/1000) -> #VALUE! | Y49: =(RC[-14]-RC[1])/RC[-18]*100 -> #VALUE! | AC49: =VALUE(RC[-27]) -> #VALUE! | AD49: =IF(RC[21]=42,"*",IF(RC[21]=32,"",RC[21])) ->  | AE49: =RC[-28] -> 24 | AF49: =RC[-28] ->  | AG49: =RC[-28] ->  | AH49: =RC[-28] ->  | AI49: =RC[-28] ->  | AJ49: =RC[-28] ->  | AK49: =RC[-28] ->  | AL49: =RC[-28] -> 0 | AM49: =RC[-28] ->  | AN49: =RC[-28] ->  | AO49: =RC[-28] ->  | AP49: - | AQ49: =RC[-29] -> 0 | AR49: =RC[-29] -> 0 | AS49: - | AT49: =RC[-30] -> 0 | AU49: =RC[-30] -> 0 | AV49: =RC[-30] ->  | AW49: =RC[-30] -> 
A50: =IF(RC[1]="","",DATEVALUE(RC[1])) ->  | T50: =(RC[-16]*RC[-15]-RC[-13]*RC[-12])/1000 -> #VALUE! | W50: =RC[-2]*RC[-10]/1000 -> #VALUE! | X50: =ABS((RC[-3]*RC[-11]-RC[-2]*RC[-9])/1000) -> #VALUE! | Y50: =(RC[-14]-RC[1])/RC[-18]*100 -> #VALUE! | AC50: =VALUE(RC[-27]) -> #VALUE! | AD50: =IF(RC[21]=42,"*",IF(RC[21]=32,"",RC[21])) ->  | AE50: =RC[-28] ->  | AF50: =RC[-28] ->  | AG50: =RC[-28] ->  | AH50: =RC[-28] ->  | AI50: =RC[-28] ->  | AJ50: =RC[-28] ->  | AK50: =RC[-28] ->  | AL50: =RC[-28] -> 0 | AM50: =RC[-28] ->  | AN50: =RC[-28] ->  | AO50: =RC[-28] ->  | AP50: - | AQ50: =RC[-29] -> 0 | AR50: =RC[-29] -> 0 | AS50: - | AT50: =RC[-30] -> 0 | AU50: =RC[-30] -> 0 | AV50: =RC[-30] ->  | AW50: =RC[-30] -> 
A51: =IF(RC[1]="","",DATEVALUE(RC[1])) ->  | T51: =(RC[-16]*RC[-15]-RC[-13]*RC[-12])/1000 -> #VALUE! | W51: =RC[-2]*RC[-10]/1000 -> #VALUE! | X51: =ABS((RC[-3]*RC[-11]-RC[-2]*RC[-9])/1000) -> #VALUE! | Y51: =(RC[-14]-RC[1])/RC[-18]*100 -> #VALUE! | AC51: =VALUE(RC[-27]) -> #VALUE! | AD51: =IF(RC[21]=42,"*",IF(RC[21]=32,"",RC[21])) ->  | AE51: =RC[-28] ->  | AF51: =RC[-28] ->  | AG51: =RC[-28] ->  | AH51: =RC[-28] ->  | AI51: =RC[-28] ->  | AJ51: =RC[-28] ->  | AK51: =RC[-28] ->  | AL51: =RC[-28] -> 0 | AM51: =RC[-28] ->  | AN51: =RC[-28] ->  | AO51: =RC[-28] ->  | AP51: - | AQ51: =RC[-29] -> 0 | AR51: =RC[-29] -> 0 | AS51: - | AT51: =RC[-30] -> 0 | AU51: =RC[-30] -> 0 | AV51: =RC[-30] ->  | AW51: =RC[-30] -> 
A52: =IF(RC[1]="","",DATEVALUE(RC[1])) ->  | T52: =(RC[-16]*RC[-15]-RC[-13]*RC[-12])/1000 -> #VALUE! | W52: =RC[-2]*RC[-10]/1000 -> #VALUE! | X52: =ABS((RC[-3]*RC[-11]-RC[-2]*RC[-9])/1000) -> #VALUE! | Y52: =(RC[-14]-RC[1])/RC[-18]*100 -> #VALUE! | AC52: =VALUE(RC[-27]) -> #VALUE! | AD52: =IF(RC[21]=42,"*",IF(RC[21]=32,"",RC[21])) ->  | AE52: =RC[-28] ->  | AF52: =RC[-28] ->  | AG52: =RC[-28] ->  | AH52: =RC[-28] ->  | AI52: =RC[-28] ->  | AJ52: =RC[-28] ->  | AK52: =RC[-28] ->  | AL52: =RC[-28] -> 0 | AM52: =RC[-28] ->  | AN52: =RC[-28] ->  | AO52: =RC[-28] ->  | AP52: - | AQ52: =RC[-29] -> 0 | AR52: =RC[-29] -> 0 | AS52: - | AT52: =RC[-30] -> 0 | AU52: =RC[-30] -> 0 | AV52: =RC[-30] ->  | AW52: =RC[-30] -> 
A53: =IF(RC[1]="","",DATEVALUE(RC[1])) ->  | T53: =(RC[-16]*RC[-15]-RC[-13]*RC[-12])/1000 -> #VALUE! | W53: =RC[-2]*RC[-10]/1000 -> #VALUE! | X53: =ABS((RC[-3]*RC[-11]-RC[-2]*RC[-9])/1000) -> #VALUE! | Y53: =(RC[-14]-RC[1])/RC[-18]*100 -> #VALUE! | AC53: =VALUE(RC[-27]) -> #VALUE! | AD53: =IF(RC[21]=42,"*",IF(RC[21]=32,"",RC[21])) ->  | AE53: =RC[-28] ->  | AF53: =RC[-28] ->  | AG53: =RC[-28] ->  | AH53: =RC[-28] ->  | AI53: =RC[-28] ->  | AJ53: =RC[-28] ->  | AK53: =RC[-28] ->  | AL53: =RC[-28] -> 0 | AM53: =RC[-28] ->  | AN53: =RC[-28] ->  | AO53: =RC[-28] ->  | AP53: - | AQ53: =RC[-29] -> 0 | AR53: =RC[-29] -> 0 | AS53: - | AT53: =RC[-30] -> 0 | AU53: =RC[-30] -> 0 | AV53: =RC[-30] ->  | AW53: =RC[-30] -> 
A54: =IF(RC[1]="","",DATEVALUE(RC[1])) ->  | T54: =(RC[-16]*RC[-15]-RC[-13]*RC[-12])/1000 -> #VALUE! | W54: =RC[-2]*RC[-10]/1000 -> #VALUE! | X54: =ABS((RC[-3]*RC[-11]-RC[-2]*RC[-9])/1000) -> #VALUE! | Y54: =(RC[-14]-RC[1])/RC[-18]*100 -> #VALUE! | AC54: =VALUE(RC[-27]) -> #VALUE! | AD54: =IF(RC[21]=42,"*",IF(RC[21]=32,"",RC[21])) ->  | AE54: =RC[-28] ->  | AF54: =RC[-28] ->  | AG54: =RC[-28] ->  | AH54: =RC[-28] ->  | AI54: =RC[-28] ->  | AJ54: =RC[-28] ->  | AK54: =RC[-28] ->  | AL54: =RC[-28] -> 0 | AM54: =RC[-28] ->  | AN54: =RC[-28] ->  | AO54: =RC[-28] ->  | AP54: - | AQ54: =RC[-29] -> 0 | AR54: =RC[-29] -> 0 | AS54: - | AT54: =RC[-30] -> 0 | AU54: =RC[-30] -> 0 | AV54: =RC[-30] ->  | AW54: =RC[-30] -> 
A55: =IF(RC[1]="","",DATEVALUE(RC[1])) ->  | T55: =(RC[-16]*RC[-15]-RC[-13]*RC[-12])/1000 -> #VALUE! | W55: =RC[-2]*RC[-10]/1000 -> #VALUE! | X55: =ABS((RC[-3]*RC[-11]-RC[-2]*RC[-9])/1000) -> #VALUE! | Y55: =(RC[-14]-RC[1])/RC[-18]*100 -> #VALUE! | AC55: =VALUE(RC[-27]) -> #VALUE! | AD55: =IF(RC[21]=42,"*",IF(RC[21]=32,"",RC[21])) ->  | AE55: =RC[-28] ->  | AF55: =RC[-28] ->  | AG55: =RC[-28] ->  | AH55: =RC[-28] ->  | AI55: =RC[-28] ->  | AJ55: =RC[-28] ->  | AK55: =RC[-28] ->  | AL55: =RC[-28] -> 0 | AM55: =RC[-28] ->  | AN55: =RC[-28] ->  | AO55: =RC[-28] ->  | AP55: - | AQ55: =RC[-29] -> 0 | AR55: =RC[-29] -> 0 | AS55: - | AT55: =RC[-30] -> 0 | AU55: =RC[-30] -> 0 | AV55: =RC[-30] ->  | AW55: =RC[-30] -> 
A56: =IF(RC[1]="","",DATEVALUE(RC[1])) ->  | T56: =(RC[-16]*RC[-15]-RC[-13]*RC[-12])/1000 -> #VALUE! | W56: =RC[-2]*RC[-10]/1000 -> #VALUE! | X56: =ABS((RC[-3]*RC[-11]-RC[-2]*RC[-9])/1000) -> #VALUE! | Y56: =(RC[-14]-RC[1])/RC[-18]*100 -> #VALUE! | AC56: =VALUE(RC[-27]) -> #VALUE! | AD56: =IF(RC[21]=42,"*",IF(RC[21]=32,"",RC[21])) ->  | AE56: =RC[-28] ->  | AF56: =RC[-28] ->  | AG56: =RC[-28] ->  | AH56: =RC[-28] ->  | AI56: =RC[-28] ->  | AJ56: =RC[-28] ->  | AK56: =RC[-28] ->  | AL56: =RC[-28] -> 0 | AM56: =RC[-28] ->  | AN56: =RC[-28] ->  | AO56: =RC[-28] ->  | AP56: - | AQ56: =RC[-29] -> 0 | AR56: =RC[-29] -> 0 | AS56: - | AT56: =RC[-30] -> 0 | AU56: =RC[-30] -> 0 | AV56: =RC[-30] ->  | AW56: =RC[-30] -> 
A57: =IF(RC[1]="","",DATEVALUE(RC[1])) ->  | T57: =(RC[-16]*RC[-15]-RC[-13]*RC[-12])/1000 -> #VALUE! | W57: =RC[-2]*RC[-10]/1000 -> #VALUE! | X57: =ABS((RC[-3]*RC[-11]-RC[-2]*RC[-9])/1000) -> #VALUE! | Y57: =(RC[-14]-RC[1])/RC[-18]*100 -> #VALUE! | AC57: =VALUE(RC[-27]) -> #VALUE! | AD57: =IF(RC[21]=42,"*",IF(RC[21]=32,"",RC[21])) ->  | AE57: =RC[-28] ->  | AF57: =RC[-28] ->  | AG57: =RC[-28] ->  | AH57: =RC[-28] ->  | AI57: =RC[-28] ->  | AJ57: =RC[-28] ->  | AK57: =RC[-28] ->  | AL57: =RC[-28] -> 0 | AM57: =RC[-28] ->  | AN57: =RC[-28] ->  | AO57: =RC[-28] ->  | AP57: - | AQ57: =RC[-29] -> 0 | AR57: =RC[-29] -> 0 | AS57: - | AT57: =RC[-30] -> 0 | AU57: =RC[-30] -> 0 | AV57: =RC[-30] ->  | AW57: =RC[-30] -> 
A58: =IF(RC[1]="","",DATEVALUE(RC[1])) ->  | T58: =(RC[-16]*RC[-15]-RC[-13]*RC[-12])/1000 -> #VALUE! | W58: =RC[-2]*RC[-10]/1000 -> #VALUE! | X58: =ABS((RC[-3]*RC[-11]-RC[-2]*RC[-9])/1000) -> #VALUE! | Y58: =(RC[-14]-RC[1])/RC[-18]*100 -> #VALUE! | AC58: =VALUE(RC[-27]) -> #VALUE! | AD58: =IF(RC[21]=42,"*",IF(RC[21]=32,"",RC[21])) ->  | AE58: =RC[-28] ->  | AF58: =RC[-28] ->  | AG58: =RC[-28] ->  | AH58: =RC[-28] ->  | AI58: =RC[-28] ->  | AJ58: =RC[-28] ->  | AK58: =RC[-28] ->  | AL58: =RC[-28] -> 0 | AM58: =RC[-28] ->  | AN58: =RC[-28] ->  | AO58: =RC[-28] ->  | AP58: - | AQ58: =RC[-29] -> 0 | AR58: =RC[-29] -> 0 | AS58: - | AT58: =RC[-30] -> 0 | AU58: =RC[-30] -> 0 | AV58: =RC[-30] ->  | AW58: =RC[-30] -> 
A59: =IF(RC[1]="","",DATEVALUE(RC[1])) ->  | T59: =(RC[-16]*RC[-15]-RC[-13]*RC[-12])/1000 -> #VALUE! | W59: =RC[-2]*RC[-10]/1000 -> #VALUE! | X59: =ABS((RC[-3]*RC[-11]-RC[-2]*RC[-9])/1000) -> #VALUE! | Y59: =(RC[-14]-RC[1])/RC[-18]*100 -> #VALUE! | AC59: =VALUE(RC[-27]) -> #VALUE! | AD59: =IF(RC[21]=42,"*",IF(RC[21]=32,"",RC[21])) ->  | AE59: =RC[-28] ->  | AF59: =RC[-28] ->  | AG59: =RC[-28] ->  | AH59: =RC[-28] ->  | AI59: =RC[-28] ->  | AJ59: =RC[-28] ->  | AK59: =RC[-28] ->  | AL59: =RC[-28] -> 0 | AM59: =RC[-28] ->  | AN59: =RC[-28] ->  | AO59: =RC[-28] ->  | AP59: - | AQ59: =RC[-29] -> 0 | AR59: =RC[-29] -> 0 | AS59: - | AT59: =RC[-30] -> 0 | AU59: =RC[-30] -> 0 | AV59: =RC[-30] ->  | AW59: =RC[-30] -> 
A60: =IF(RC[1]="","",DATEVALUE(RC[1])) ->  | T60: =(RC[-16]*RC[-15]-RC[-13]*RC[-12])/1000 -> #VALUE! | W60: =RC[-2]*RC[-10]/1000 -> #VALUE! | X60: =ABS((RC[-3]*RC[-11]-RC[-2]*RC[-9])/1000) -> #VALUE! | Y60: =(RC[-14]-RC[1])/RC[-18]*100 -> #VALUE! | AC60: =VALUE(RC[-27]) -> #VALUE! | AD60: =IF(RC[21]=42,"*",IF(RC[21]=32,"",RC[21])) ->  | AE60: =RC[-28] ->  | AF60: =RC[-28] ->  | AG60: =RC[-28] ->  | AH60: =RC[-28] ->  | AI60: =RC[-28] ->  | AJ60: =RC[-28] ->  | AK60: =RC[-28] ->  | AL60: =RC[-28] -> 0 | AM60: =RC[-28] ->  | AN60: =RC[-28] ->  | AO60: =RC[-28] ->  | AP60: - | AQ60: =RC[-29] -> 0 | AR60: =RC[-29] -> 0 | AS60: - | AT60: =RC[-30] -> 0 | AU60: =RC[-30] -> 0 | AV60: =RC[-30] ->  | AW60: =RC[-30] -> 
A61: =IF(RC[1]="","",DATEVALUE(RC[1])) ->  | T61: =(RC[-16]*RC[-15]-RC[-13]*RC[-12])/1000 -> #VALUE! | W61: =RC[-2]*RC[-10]/1000 -> #VALUE! | X61: =ABS((RC[-3]*RC[-11]-RC[-2]*RC[-9])/1000) -> #VALUE! | Y61: =(RC[-14]-RC[1])/RC[-18]*100 -> #VALUE! | AC61: =VALUE(RC[-27]) -> #VALUE! | AD61: =IF(RC[21]=42,"*",IF(RC[21]=32,"",RC[21])) ->  | AE61: =RC[-28] ->  | AF61: =RC[-28] ->  | AG61: =RC[-28] ->  | AH61: =RC[-28] ->  | AI61: =RC[-28] ->  | AJ61: =RC[-28] ->  | AK61: =RC[-28] ->  | AL61: =RC[-28] -> 0 | AM61: =RC[-28] ->  | AN61: =RC[-28] ->  | AO61: =RC[-28] ->  | AP61: - | AQ61: =RC[-29] -> 0 | AR61: =RC[-29] -> 0 | AS61: - | AT61: =RC[-30] -> 0 | AU61: =RC[-30] -> 0 | AV61: =RC[-30] ->  | AW61: =RC[-30] -> 
A62: =IF(RC[1]="","",DATEVALUE(RC[1])) ->  | T62: =(RC[-16]*RC[-15]-RC[-13]*RC[-12])/1000 -> #VALUE! | W62: =RC[-2]*RC[-10]/1000 -> #VALUE! | X62: =ABS((RC[-3]*RC[-11]-RC[-2]*RC[-9])/1000) -> #VALUE! | Y62: =(RC[-14]-RC[1])/RC[-18]*100 -> #VALUE! | AC62: =VALUE(RC[-27]) -> #VALUE! | AD62: =IF(RC[21]=42,"*",IF(RC[21]=32,"",RC[21])) ->  | AE62: =RC[-28] ->  | AF62: =RC[-28] ->  | AG62: =RC[-28] ->  | AH62: =RC[-28] ->  | AI62: =RC[-28] ->  | AJ62: =RC[-28] ->  | AK62: =RC[-28] ->  | AL62: =RC[-28] -> 0 | AM62: =RC[-28] ->  | AN62: =RC[-28] ->  | AO62: =RC[-28] ->  | AP62: - | AQ62: =RC[-29] -> 0 | AR62: =RC[-29] -> 0 | AS62: - | AT62: =RC[-30] -> 0 | AU62: =RC[-30] -> 0 | AV62: =RC[-30] ->  | AW62: =RC[-30] -> 
A63: =IF(RC[1]="","",DATEVALUE(RC[1])) ->  | T63: =(RC[-16]*RC[-15]-RC[-13]*RC[-12])/1000 -> #VALUE! | W63: =RC[-2]*RC[-10]/1000 -> #VALUE! | X63: =ABS((RC[-3]*RC[-11]-RC[-2]*RC[-9])/1000) -> #VALUE! | Y63: =(RC[-14]-RC[1])/RC[-18]*100 -> #VALUE! | AC63: =VALUE(RC[-27]) -> #VALUE! | AD63: =IF(RC[21]=42,"*",IF(RC[21]=32,"",RC[21])) ->  | AE63: =RC[-28] ->  | AF63: =RC[-28] ->  | AG63: =RC[-28] ->  | AH63: =RC[-28] ->  | AI63: =RC[-28] ->  | AJ63: =RC[-28] ->  | AK63: =RC[-28] ->  | AL63: =RC[-28] -> 0 | AM63: =RC[-28] ->  | AN63: =RC[-28] ->  | AO63: =RC[-28] ->  | AP63: - | AQ63: =RC[-29] -> 0 | AR63: =RC[-29] -> 0 | AS63: - | AT63: =RC[-30] -> 0 | AU63: =RC[-30] -> 0 | AV63: =RC[-30] ->  | AW63: =RC[-30] -> 
A64: =IF(RC[1]="","",DATEVALUE(RC[1])) ->  | T64: =(RC[-16]*RC[-15]-RC[-13]*RC[-12])/1000 -> #VALUE! | W64: =RC[-2]*RC[-10]/1000 -> #VALUE! | X64: =ABS((RC[-3]*RC[-11]-RC[-2]*RC[-9])/1000) -> #VALUE! | Y64: =(RC[-14]-RC[1])/RC[-18]*100 -> #VALUE! | AC64: =VALUE(RC[-27]) -> #VALUE! | AD64: =IF(RC[21]=42,"*",IF(RC[21]=32,"",RC[21])) ->  | AE64: =RC[-28] ->  | AF64: =RC[-28] ->  | AG64: =RC[-28] ->  | AH64: =RC[-28] ->  | AI64: =RC[-28] ->  | AJ64: =RC[-28] ->  | AK64: =RC[-28] ->  | AL64: =RC[-28] -> 0 | AM64: =RC[-28] ->  | AN64: =RC[-28] ->  | AO64: =RC[-28] ->  | AP64: - | AQ64: =RC[-29] -> 0 | AR64: =RC[-29] -> 0 | AS64: - | AT64: =RC[-30] -> 0 | AU64: =RC[-30] -> 0 | AV64: =RC[-30] ->  | AW64: =RC[-30] -> 
A65: =IF(RC[1]="","",DATEVALUE(RC[1])) ->  | T65: =(RC[-16]*RC[-15]-RC[-13]*RC[-12])/1000 -> #VALUE! | W65: =RC[-2]*RC[-10]/1000 -> #VALUE! | X65: =ABS((RC[-3]*RC[-11]-RC[-2]*RC[-9])/1000) -> #VALUE! | Y65: =(RC[-14]-RC[1])/RC[-18]*100 -> #VALUE! | AC65: =VALUE(RC[-27]) -> #VALUE! | AD65: =IF(RC[21]=42,"*",IF(RC[21]=32,"",RC[21])) ->  | AE65: =RC[-28] ->  | AF65: =RC[-28] ->  | AG65: =RC[-28] ->  | AH65: =RC[-28] ->  | AI65: =RC[-28] ->  | AJ65: =RC[-28] ->  | AK65: =RC[-28] ->  | AL65: =RC[-28] -> 0 | AM65: =RC[-28] ->  | AN65: =RC[-28] ->  | AO65: =RC[-28] ->  | AP65: - | AQ65: =RC[-29] -> 0 | AR65: =RC[-29] -> 0 | AS65: - | AT65: =RC[-30] -> 0 | AU65: =RC[-30] -> 0 | AV65: =RC[-30] ->  | AW65: =RC[-30] -> 
A66: =IF(RC[1]="","",DATEVALUE(RC[1])) ->  | T66: =(RC[-16]*RC[-15]-RC[-13]*RC[-12])/1000 -> #VALUE! | W66: =RC[-2]*RC[-10]/1000 -> #VALUE! | X66: =ABS((RC[-3]*RC[-11]-RC[-2]*RC[-9])/1000) -> #VALUE! | Y66: =(RC[-14]-RC[1])/RC[-18]*100 -> #VALUE! | AC66: =VALUE(RC[-27]) -> #VALUE! | AD66: =IF(RC[21]=42,"*",IF(RC[21]=32,"",RC[21])) ->  | AE66: =RC[-28] ->  | AF66: =RC[-28] ->  | AG66: =RC[-28] ->  | AH66: =RC[-28] ->  | AI66: =RC[-28] ->  | AJ66: =RC[-28] ->  | AK66: =RC[-28] ->  | AL66: =RC[-28] -> 0 | AM66: =RC[-28] ->  | AN66: =RC[-28] ->  | AO66: =RC[-28] ->  | AP66: - | AQ66: =RC[-29] -> 0 | AR66: =RC[-29] -> 0 | AS66: - | AT66: =RC[-30] -> 0 | AU66: =RC[-30] -> 0 | AV66: =RC[-30] ->  | AW66: =RC[-30] -> 
A67: =IF(RC[1]="","",DATEVALUE(RC[1])) ->  | T67: =(RC[-16]*RC[-15]-RC[-13]*RC[-12])/1000 -> #VALUE! | W67: =RC[-2]*RC[-10]/1000 -> #VALUE! | X67: =ABS((RC[-3]*RC[-11]-RC[-2]*RC[-9])/1000) -> #VALUE! | Y67: =(RC[-14]-RC[1])/RC[-18]*100 -> #VALUE! | AC67: =VALUE(RC[-27]) -> #VALUE! | AD67: =IF(RC[21]=42,"*",IF(RC[21]=32,"",RC[21])) ->  | AE67: =RC[-28] ->  | AF67: =RC[-28] ->  | AG67: =RC[-28] ->  | AH67: =RC[-28] ->  | AI67: =RC[-28] ->  | AJ67: =RC[-28] ->  | AK67: =RC[-28] ->  | AL67: =RC[-28] -> 0 | AM67: =RC[-28] ->  | AN67: =RC[-28] ->  | AO67: =RC[-28] ->  | AP67: - | AQ67: =RC[-29] -> 0 | AR67: =RC[-29] -> 0 | AS67: - | AT67: =RC[-30] -> 0 | AU67: =RC[-30] -> 0 | AV67: =RC[-30] ->  | AW67: =RC[-30] -> 
A68: =IF(RC[1]="","",DATEVALUE(RC[1])) ->  | T68: =(RC[-16]*RC[-15]-RC[-13]*RC[-12])/1000 -> #VALUE! | W68: =RC[-2]*RC[-10]/1000 -> #VALUE! | X68: =ABS((RC[-3]*RC[-11]-RC[-2]*RC[-9])/1000) -> #VALUE! | Y68: =(RC[-14]-RC[1])/RC[-18]*100 -> #VALUE! | AC68: =VALUE(RC[-27]) -> #VALUE! | AD68: =IF(RC[21]=42,"*",IF(RC[21]=32,"",RC[21])) ->  | AE68: =RC[-28] ->  | AF68: =RC[-28] ->  | AG68: =RC[-28] ->  | AH68: =RC[-28] ->  | AI68: =RC[-28] ->  | AJ68: =RC[-28] ->  | AK68: =RC[-28] ->  | AL68: =RC[-28] -> 0 | AM68: =RC[-28] ->  | AN68: =RC[-28] ->  | AO68: =RC[-28] ->  | AP68: - | AQ68: =RC[-29] -> 0 | AR68: =RC[-29] -> 0 | AS68: - | AT68: =RC[-30] -> 0 | AU68: =RC[-30] -> 0 | AV68: =RC[-30] ->  | AW68: =RC[-30] -> 
A69: =IF(RC[1]="","",DATEVALUE(RC[1])) ->  | T69: =(RC[-16]*RC[-15]-RC[-13]*RC[-12])/1000 -> #VALUE! | W69: =RC[-2]*RC[-10]/1000 -> #VALUE! | X69: =ABS((RC[-3]*RC[-11]-RC[-2]*RC[-9])/1000) -> #VALUE! | Y69: =(RC[-14]-RC[1])/RC[-18]*100 -> #VALUE! | AC69: =VALUE(RC[-27]) -> #VALUE! | AD69: =IF(RC[21]=42,"*",IF(RC[21]=32,"",RC[21])) ->  | AE69: =RC[-28] ->  | AF69: =RC[-28] ->  | AG69: =RC[-28] ->  | AH69: =RC[-28] ->  | AI69: =RC[-28] ->  | AJ69: =RC[-28] ->  | AK69: =RC[-28] ->  | AL69: =RC[-28] -> 0 | AM69: =RC[-28] ->  | AN69: =RC[-28] ->  | AO69: =RC[-28] ->  | AP69: - | AQ69: =RC[-29] -> 0 | AR69: =RC[-29] -> 0 | AS69: - | AT69: =RC[-30] -> 0 | AU69: =RC[-30] -> 0 | AV69: =RC[-30] ->  | AW69: =RC[-30] -> 
A70: =IF(RC[1]="","",DATEVALUE(RC[1])) ->  | T70: =(RC[-16]*RC[-15]-RC[-13]*RC[-12])/1000 -> #VALUE! | W70: =RC[-2]*RC[-10]/1000 -> #VALUE! | X70: =ABS((RC[-3]*RC[-11]-RC[-2]*RC[-9])/1000) -> #VALUE! | Y70: =(RC[-14]-RC[1])/RC[-18]*100 -> #VALUE! | AC70: =VALUE(RC[-27]) -> #VALUE! | AD70: =IF(RC[21]=42,"*",IF(RC[21]=32,"",RC[21])) ->  | AE70: =RC[-28] ->  | AF70: =RC[-28] ->  | AG70: =RC[-28] ->  | AH70: =RC[-28] ->  | AI70: =RC[-28] ->  | AJ70: =RC[-28] ->  | AK70: =RC[-28] ->  | AL70: =RC[-28] -> 0 | AM70: =RC[-28] ->  | AN70: =RC[-28] ->  | AO70: =RC[-28] ->  | AP70: - | AQ70: =RC[-29] -> 0 | AR70: =RC[-29] -> 0 | AS70: - | AT70: =RC[-30] -> 0 | AU70: =RC[-30] -> 0 | AV70: =RC[-30] ->  | AW70: =RC[-30] -> 
A71: =IF(RC[1]="","",DATEVALUE(RC[1])) ->  | T71: =(RC[-16]*RC[-15]-RC[-13]*RC[-12])/1000 -> #VALUE! | W71: =RC[-2]*RC[-10]/1000 -> #VALUE! | X71: =ABS((RC[-3]*RC[-11]-RC[-2]*RC[-9])/1000) -> #VALUE! | Y71: =(RC[-14]-RC[1])/RC[-18]*100 -> #VALUE! | AC71: =VALUE(RC[-27]) -> #VALUE! | AD71: =IF(RC[21]=42,"*",IF(RC[21]=32,"",RC[21])) ->  | AE71: =RC[-28] ->  | AF71: =RC[-28] ->  | AG71: =RC[-28] ->  | AH71: =RC[-28] ->  | AI71: =RC[-28] ->  | AJ71: =RC[-28] ->  | AK71: =RC[-28] ->  | AL71: =RC[-28] -> 0 | AM71: =RC[-28] ->  | AN71: =RC[-28] ->  | AO71: =RC[-28] ->  | AP71: - | AQ71: =RC[-29] -> 0 | AR71: =RC[-29] -> 0 | AS71: - | AT71: =RC[-30] -> 0 | AU71: =RC[-30] -> 0 | AV71: =RC[-30] ->  | AW71: =RC[-30] -> 
A72: =IF(RC[1]="","",DATEVALUE(RC[1])) ->  | T72: =(RC[-16]*RC[-15]-RC[-13]*RC[-12])/1000 -> #VALUE! | W72: =RC[-2]*RC[-10]/1000 -> #VALUE! | X72: =ABS((RC[-3]*RC[-11]-RC[-2]*RC[-9])/1000) -> #VALUE! | Y72: =(RC[-14]-RC[1])/RC[-18]*100 -> #VALUE! | AC72: =VALUE(RC[-27]) -> #VALUE! | AD72: =IF(RC[21]=42,"*",IF(RC[21]=32,"",RC[21])) ->  | AE72: =RC[-28] ->  | AF72: =RC[-28] ->  | AG72: =RC[-28] ->  | AH72: =RC[-28] ->  | AI72: =RC[-28] ->  | AJ72: =RC[-28] ->  | AK72: =RC[-28] ->  | AL72: =RC[-28] -> 0 | AM72: =RC[-28] ->  | AN72: =RC[-28] ->  | AO72: =RC[-28] ->  | AP72: - | AQ72: =RC[-29] -> 0 | AR72: =RC[-29] -> 0 | AS72: - | AT72: =RC[-30] -> 0 | AU72: =RC[-30] -> 0 | AV72: =RC[-30] ->  | AW72: =RC[-30] -> 
A73: =IF(RC[1]="","",DATEVALUE(RC[1])) ->  | T73: =(RC[-16]*RC[-15]-RC[-13]*RC[-12])/1000 -> #VALUE! | W73: =RC[-2]*RC[-10]/1000 -> #VALUE! | X73: =ABS((RC[-3]*RC[-11]-RC[-2]*RC[-9])/1000) -> #VALUE! | Y73: =(RC[-14]-RC[1])/RC[-18]*100 -> #VALUE! | AC73: =VALUE(RC[-27]) -> #VALUE! | AD73: =IF(RC[21]=42,"*",IF(RC[21]=32,"",RC[21])) ->  | AE73: =RC[-28] ->  | AF73: =RC[-28] ->  | AG73: =RC[-28] ->  | AH73: =RC[-28] ->  | AI73: =RC[-28] ->  | AJ73: =RC[-28] ->  | AK73: =RC[-28] ->  | AL73: =RC[-28] -> 0 | AM73: =RC[-28] ->  | AN73: =RC[-28] ->  | AO73: =RC[-28] ->  | AP73: - | AQ73: =RC[-29] -> 0 | AR73: =RC[-29] -> 0 | AS73: - | AT73: =RC[-30] -> 0 | AU73: =RC[-30] -> 0 | AV73: =RC[-30] ->  | AW73: =RC[-30] -> 
A74: =IF(RC[1]="","",DATEVALUE(RC[1])) ->  | T74: =(RC[-16]*RC[-15]-RC[-13]*RC[-12])/1000 -> #VALUE! | W74: =RC[-2]*RC[-10]/1000 -> #VALUE! | X74: =ABS((RC[-3]*RC[-11]-RC[-2]*RC[-9])/1000) -> #VALUE! | Y74: =(RC[-14]-RC[1])/RC[-18]*100 -> #VALUE! | AC74: =VALUE(RC[-27]) -> #VALUE! | AD74: =IF(RC[21]=42,"*",IF(RC[21]=32,"",RC[21])) ->  | AE74: =RC[-28] ->  | AF74: =RC[-28] ->  | AG74: =RC[-28] ->  | AH74: =RC[-28] ->  | AI74: =RC[-28] ->  | AJ74: =RC[-28] ->  | AK74: =RC[-28] ->  | AL74: =RC[-28] -> 0 | AM74: =RC[-28] ->  | AN74: =RC[-28] ->  | AO74: =RC[-28] ->  | AP74: - | AQ74: =RC[-29] -> 0 | AR74: =RC[-29] -> 0 | AS74: - | AT74: =RC[-30] -> 0 | AU74: =RC[-30] -> 0 | AV74: =RC[-30] ->  | AW74: =RC[-30] -> 
A75: =IF(RC[1]="","",DATEVALUE(RC[1])) ->  | T75: =(RC[-16]*RC[-15]-RC[-13]*RC[-12])/1000 -> #VALUE! | W75: =RC[-2]*RC[-10]/1000 -> #VALUE! | X75: =ABS((RC[-3]*RC[-11]-RC[-2]*RC[-9])/1000) -> #VALUE! | Y75: =(RC[-14]-RC[1])/RC[-18]*100 -> #VALUE! | AC75: =VALUE(RC[-27]) -> #VALUE! | AD75: =IF(RC[21]=42,"*",IF(RC[21]=32,"",RC[21])) ->  | AE75: =RC[-28] ->  | AF75: =RC[-28] ->  | AG75: =RC[-28] ->  | AH75: =RC[-28] ->  | AI75: =RC[-28] ->  | AJ75: =RC[-28] ->  | AK75: =RC[-28] ->  | AL75: =RC[-28] -> 0 | AM75: =RC[-28] ->  | AN75: =RC[-28] ->  | AO75: =RC[-28] ->  | AP75: - | AQ75: =RC[-29] -> 0 | AR75: =RC[-29] -> 0 | AS75: - | AT75: =RC[-30] -> 0 | AU75: =RC[-30] -> 0 | AV75: =RC[-30] ->  | AW75: =RC[-30] -> 
A76: =IF(RC[1]="","",DATEVALUE(RC[1])) ->  | T76: =(RC[-16]*RC[-15]-RC[-13]*RC[-12])/1000 -> #VALUE! | W76: =RC[-2]*RC[-10]/1000 -> #VALUE! | X76: =ABS((RC[-3]*RC[-11]-RC[-2]*RC[-9])/1000) -> #VALUE! | Y76: =(RC[-14]-RC[1])/RC[-18]*100 -> #VALUE! | AC76: =VALUE(RC[-27]) -> #VALUE! | AD76: =IF(RC[21]=42,"*",IF(RC[21]=32,"",RC[21])) ->  | AE76: =RC[-28] ->  | AF76: =RC[-28] ->  | AG76: =RC[-28] ->  | AH76: =RC[-28] ->  | AI76: =RC[-28] ->  | AJ76: =RC[-28] ->  | AK76: =RC[-28] ->  | AL76: =RC[-28] -> 0 | AM76: =RC[-28] ->  | AN76: =RC[-28] ->  | AO76: =RC[-28] ->  | AP76: - | AQ76: =RC[-29] -> 0 | AR76: =RC[-29] -> 0 | AS76: - | AT76: =RC[-30] -> 0 | AU76: =RC[-30] -> 0 | AV76: =RC[-30] ->  | AW76: =RC[-30] -> 
A77: =IF(RC[1]="","",DATEVALUE(RC[1])) ->  | T77: =(RC[-16]*RC[-15]-RC[-13]*RC[-12])/1000 -> #VALUE! | W77: =RC[-2]*RC[-10]/1000 -> #VALUE! | X77: =ABS((RC[-3]*RC[-11]-RC[-2]*RC[-9])/1000) -> #VALUE! | Y77: =(RC[-14]-RC[1])/RC[-18]*100 -> #VALUE! | AC77: =VALUE(RC[-27]) -> #VALUE! | AD77: =IF(RC[21]=42,"*",IF(RC[21]=32,"",RC[21])) ->  | AE77: =RC[-28] ->  | AF77: =RC[-28] ->  | AG77: =RC[-28] ->  | AH77: =RC[-28] ->  | AI77: =RC[-28] ->  | AJ77: =RC[-28] ->  | AK77: =RC[-28] ->  | AL77: =RC[-28] -> 0 | AM77: =RC[-28] ->  | AN77: =RC[-28] ->  | AO77: =RC[-28] ->  | AP77: - | AQ77: =RC[-29] -> 0 | AR77: =RC[-29] -> 0 | AS77: - | AT77: =RC[-30] -> 0 | AU77: =RC[-30] -> 0 | AV77: =RC[-30] ->  | AW77: =RC[-30] -> 
A78: =IF(RC[1]="","",DATEVALUE(RC[1])) ->  | T78: =(RC[-16]*RC[-15]-RC[-13]*RC[-12])/1000 -> #VALUE! | W78: =RC[-2]*RC[-10]/1000 -> #VALUE! | X78: =ABS((RC[-3]*RC[-11]-RC[-2]*RC[-9])/1000) -> #VALUE! | Y78: =(RC[-14]-RC[1])/RC[-18]*100 -> #VALUE! | AC78: =VALUE(RC[-27]) -> #VALUE! | AD78: =IF(RC[21]=42,"*",IF(RC[21]=32,"",RC[21])) ->  | AE78: =RC[-28] ->  | AF78: =RC[-28] ->  | AG78: =RC[-28] ->  | AH78: =RC[-28] ->  | AI78: =RC[-28] ->  | AJ78: =RC[-28] ->  | AK78: =RC[-28] ->  | AL78: =RC[-28] -> 0 | AM78: =RC[-28] ->  | AN78: =RC[-28] ->  | AO78: =RC[-28] ->  | AP78: - | AQ78: =RC[-29] -> 0 | AR78: =RC[-29] -> 0 | AS78: - | AT78: =RC[-30] -> 0 | AU78: =RC[-30] -> 0 | AV78: =RC[-30] ->  | AW78: =RC[-30] -> 
A79: =IF(RC[1]="","",DATEVALUE(RC[1])) ->  | T79: =(RC[-16]*RC[-15]-RC[-13]*RC[-12])/1000 -> #VALUE! | W79: =RC[-2]*RC[-10]/1000 -> #VALUE! | X79: =ABS((RC[-3]*RC[-11]-RC[-2]*RC[-9])/1000) -> #VALUE! | Y79: =(RC[-14]-RC[1])/RC[-18]*100 -> #VALUE! | AC79: =VALUE(RC[-27]) -> #VALUE! | AD79: =IF(RC[21]=42,"*",IF(RC[21]=32,"",RC[21])) ->  | AE79: =RC[-28] ->  | AF79: =RC[-28] ->  | AG79: =RC[-28] ->  | AH79: =RC[-28] ->  | AI79: =RC[-28] ->  | AJ79: =RC[-28] ->  | AK79: =RC[-28] ->  | AL79: =RC[-28] -> 0 | AM79: =RC[-28] ->  | AN79: =RC[-28] ->  | AO79: =RC[-28] ->  | AP79: - | AQ79: =RC[-29] -> 0 | AR79: =RC[-29] -> 0 | AS79: - | AT79: =RC[-30] -> 0 | AU79: =RC[-30] -> 0 | AV79: =RC[-30] ->  | AW79: =RC[-30] -> 
A80: =IF(RC[1]="","",DATEVALUE(RC[1])) ->  | T80: =(RC[-16]*RC[-15]-RC[-13]*RC[-12])/1000 -> #VALUE! | W80: =RC[-2]*RC[-10]/1000 -> #VALUE! | X80: =ABS((RC[-3]*RC[-11]-RC[-2]*RC[-9])/1000) -> #VALUE! | Y80: =(RC[-14]-RC[1])/RC[-18]*100 -> #VALUE! | AC80: =VALUE(RC[-27]) -> #VALUE! | AD80: =IF(RC[21]=42,"*",IF(RC[21]=32,"",RC[21])) ->  | AE80: =RC[-28] ->  | AF80: =RC[-28] ->  | AG80: =RC[-28] ->  | AH80: =RC[-28] ->  | AI80: =RC[-28] ->  | AJ80: =RC[-28] ->  | AK80: =RC[-28] ->  | AL80: =RC[-28] -> 0 | AM80: =RC[-28] ->  | AN80: =RC[-28] ->  | AO80: =RC[-28] ->  | AP80: - | AQ80: =RC[-29] -> 0 | AR80: =RC[-29] -> 0 | AS80: - | AT80: =RC[-30] -> 0 | AU80: =RC[-30] -> 0 | AV80: =RC[-30] ->  | AW80: =RC[-30] -> 
A81: =IF(RC[1]="","",DATEVALUE(RC[1])) ->  | T81: =(RC[-16]*RC[-15]-RC[-13]*RC[-12])/1000 -> #VALUE! | W81: =RC[-2]*RC[-10]/1000 -> #VALUE! | X81: =ABS((RC[-3]*RC[-11]-RC[-2]*RC[-9])/1000) -> #VALUE! | Y81: =(RC[-14]-RC[1])/RC[-18]*100 -> #VALUE! | AC81: =VALUE(RC[-27]) -> #VALUE! | AD81: =IF(RC[21]=42,"*",IF(RC[21]=32,"",RC[21])) ->  | AE81: =RC[-28] ->  | AF81: =RC[-28] ->  | AG81: =RC[-28] ->  | AH81: =RC[-28] ->  | AI81: =RC[-28] ->  | AJ81: =RC[-28] ->  | AK81: =RC[-28] ->  | AL81: =RC[-28] -> 0 | AM81: =RC[-28] ->  | AN81: =RC[-28] ->  | AO81: =RC[-28] ->  | AP81: - | AQ81: =RC[-29] -> 0 | AR81: =RC[-29] -> 0 | AS81: - | AT81: =RC[-30] -> 0 | AU81: =RC[-30] -> 0 | AV81: =RC[-30] ->  | AW81: =RC[-30] -> 
A82: =IF(RC[1]="","",DATEVALUE(RC[1])) ->  | T82: =(RC[-16]*RC[-15]-RC[-13]*RC[-12])/1000 -> #VALUE! | W82: =RC[-2]*RC[-10]/1000 -> #VALUE! | X82: =ABS((RC[-3]*RC[-11]-RC[-2]*RC[-9])/1000) -> #VALUE! | Y82: =(RC[-14]-RC[1])/RC[-18]*100 -> #VALUE! | AC82: =VALUE(RC[-27]) -> #VALUE! | AD82: =IF(RC[21]=42,"*",IF(RC[21]=32,"",RC[21])) ->  | AE82: =RC[-28] ->  | AF82: =RC[-28] ->  | AG82: =RC[-28] ->  | AH82: =RC[-28] ->  | AI82: =RC[-28] ->  | AJ82: =RC[-28] ->  | AK82: =RC[-28] ->  | AL82: =RC[-28] -> 0 | AM82: =RC[-28] ->  | AN82: =RC[-28] ->  | AO82: =RC[-28] ->  | AP82: - | AQ82: =RC[-29] -> 0 | AR82: =RC[-29] -> 0 | AS82: - | AT82: =RC[-30] -> 0 | AU82: =RC[-30] -> 0 | AV82: =RC[-30] ->  | AW82: =RC[-30] -> 
A83: =IF(RC[1]="","",DATEVALUE(RC[1])) ->  | T83: =(RC[-16]*RC[-15]-RC[-13]*RC[-12])/1000 -> #VALUE! | W83: =RC[-2]*RC[-10]/1000 -> #VALUE! | X83: =ABS((RC[-3]*RC[-11]-RC[-2]*RC[-9])/1000) -> #VALUE! | Y83: =(RC[-14]-RC[1])/RC[-18]*100 -> #VALUE! | AC83: =VALUE(RC[-27]) -> #VALUE! | AD83: =IF(RC[21]=42,"*",IF(RC[21]=32,"",RC[21])) ->  | AE83: =RC[-28] ->  | AF83: =RC[-28] ->  | AG83: =RC[-28] ->  | AH83: =RC[-28] ->  | AI83: =RC[-28] ->  | AJ83: =RC[-28] ->  | AK83: =RC[-28] ->  | AL83: =RC[-28] -> 0 | AM83: =RC[-28] ->  | AN83: =RC[-28] ->  | AO83: =RC[-28] ->  | AP83: - | AQ83: =RC[-29] -> 0 | AR83: =RC[-29] -> 0 | AS83: - | AT83: =RC[-30] -> 0 | AU83: =RC[-30] -> 0 | AV83: =RC[-30] ->  | AW83: =RC[-30] -> 
AC84: Среднее | AF84: =R[1]C[-28] -> 136.79466666666664 | AG84: =R[1]C[-28] -> 68.508333333333312 | AH84: =R[1]C[-28] -> 7.3330000000000002 | AI84: =R[1]C[-28] -> 120.31433333333334 | AJ84: =R[1]C[-28] -> 44.676666666666662 | AK84: =R[1]C[-28] -> 5.4860000000000007 | AL84: =R[1]C[-28] -> 23.831666666666663 | AM84: =R[1]C[-28] -> 16.480333333333334 | AN84: =R[1]C[-28] -> 18.999666666666666 | AO84: =R[1]C[-28] -> 68.056333333333342 | AP84: - | AQ84: =R[1]C[-29] -> 0 | AR84: =R[1]C[-29] -> 0 | AS84: - | AT84: =R[1]C[-30] -> 0 | AU84: =R[1]C[-30] -> 0
B85: Среднее | D85: =AVERAGE(OFFSET(R[-74]C,3,0,R7C1,1)) -> 136.79466666666664 | E85: =AVERAGE(OFFSET(R[-74]C,3,0,R7C1,1)) -> 68.508333333333312 | F85: =AVERAGE(OFFSET(R[-74]C,3,0,R7C1,1)) -> 7.3330000000000002 | G85: =AVERAGE(OFFSET(R[-74]C,3,0,R7C1,1)) -> 120.31433333333334 | H85: =AVERAGE(OFFSET(R[-74]C,3,0,R7C1,1)) -> 44.676666666666662 | I85: =AVERAGE(OFFSET(R[-74]C,3,0,R7C1,1)) -> 5.4860000000000007 | J85: =AVERAGE(OFFSET(R[-74]C,3,0,R7C1,1)) -> 23.831666666666663 | K85: =AVERAGE(OFFSET(R[-74]C,3,0,R7C1,1)) -> 16.480333333333334 | L85: =IF(SUM(OFFSET(R[-74]C,3,0,R7C1,1))=0,"",AVERAGE(OFFSET(R[-74]C,3,0,R7C1,1))) -> 18.999666666666666 | M85: =IF(SUM(OFFSET(R[-74]C,3,0,R7C1,1))=0,"",AVERAGE(OFFSET(R[-74]C,3,0,R7C1,1))) -> 68.056333333333342 | R85: =IF(SUM(OFFSET(R[-74]C,3,0,R7C1,1))=0,"",AVERAGE(OFFSET(R[-74]C,3,0,R7C1,1))) -> 1.2665333333333331 | S85: =AVERAGE(OFFSET(R[-74]C,3,0,R7C1,1)) -> 4.1404000000000005 | T85: =AVERAGE(OFFSET(R[-74]C,3,0,R7C1,1)) -> 4.039062013333333 | W85: =AVERAGE(OFFSET(R[-74]C,3,0,R7C1,1)) -> 1.2657300600000001 | X85: =AVERAGE(OFFSET(R[-74]C,3,0,R7C1,1)) -> #VALUE! | AC85: Итого | AE85: =R[1]C[-28] -> 720 | AF85: =R[1]C[-28] -> 4103.8399999999992 | AI85: =R[1]C[-28] -> 3609.4300000000003 | AM85: =R[1]C[-28] -> 494.41 | AN85: =R[1]C[-28] -> 569.99 | AQ85: =R[1]C[-29] -> 0 | AU85: =R[1]C[-30] -> 0 | AV85: =R[1]C[-30] -> 37.995999999999995 | AW85: =R[1]C[-30] -> 124.212
B86: ИТОГО: | C86: =SUM(OFFSET(R[-75]C,3,0,R7C1,1)) -> 720 | D86: =SUM(OFFSET(R[-75]C,3,0,R7C1,1)) -> 4103.8399999999992 | G86: =SUM(OFFSET(R[-75]C,3,0,R7C1,1)) -> 3609.4300000000003 | K86: =SUM(OFFSET(R[-75]C,3,0,R7C1,1)) -> 494.41 | L86: =IF(SUM(OFFSET(R[-75]C,3,0,R7C1,1))=0,"",SUM(OFFSET(R[-75]C,3,0,R7C1,1))) -> 569.99 | R86: =IF(SUM(OFFSET(R[-75]C,3,0,R7C1,1))=0,"",SUM(OFFSET(R[-75]C,3,0,R7C1,1))) -> 37.995999999999995 | S86: =SUM(OFFSET(R[-75]C,3,0,R7C1,1)) -> 124.212 | T86: =SUM(OFFSET(R[-75]C,3,0,R7C1,1)) -> 121.1718604 | W86: =SUM(OFFSET(R[-75]C,3,0,R7C1,1)) -> 37.971901800000005 | X86: =SUM(OFFSET(R[-75]C,3,0,R7C1,1)) -> #VALUE!
AC87: Досчёт | AF87: =R[1]C[-28] -> 0 | AI87: =R[1]C[-28] -> 0 | AM87: =R[1]C[-28] -> 0 | AN87: =R[1]C[-28] -> 0 | AQ87: =R[1]C[-29] -> 0 | AU87: =R[1]C[-30] -> 0 | AV87: =R[1]C[-30] -> 0 | AW87: =R[1]C[-30] -> 0
A88: 11дн=264ч 4дн=96ч | B88: Досчёт до конца м-ца (+) | C88: =R6C1*24 -> 216 | T88: № 36745 | AC88: Снятие | AF88: =-R[1]C[-28] -> 0 | AI88: =-R[1]C[-28] -> 0 | AM88: =-R[1]C[-28] -> 0 | AN88: =-R[1]C[-28] -> 0 | AQ88: =-R[1]C[-29] -> 0 | AU88: =-R[1]C[-30] -> 0 | AV88: =-R[1]C[-30] -> 0 | AW88: =-R[1]C[-30] -> 0
A89: 9дн=216ч 7дн=168ч | B89: Вычет с предыдущего (-) | C89: =R4C1*24 -> 192 | AC89: Сумма | AF89: =R[1]C[-28] -> 4103.8399999999992 | AI89: =R[1]C[-28] -> 3609.4300000000003 | AM89: =R[1]C[-28] -> 494.41 | AN89: =R[1]C[-28] -> 569.99 | AQ89: =R[1]C[-29] -> 0 | AU89: =R[1]C[-30] -> 0 | AV89: =R[1]C[-30] -> 37.995999999999995 | AW89: =R[1]C[-30] -> 124.212
B90: СУММА: | C90: =R[-4]C+R[-2]C-R[-1]C -> 744 | D90: =R[-4]C+R[-2]C-R[-1]C -> 4103.8399999999992 | G90: =R[-4]C+R[-2]C-R[-1]C -> 3609.4300000000003 | K90: =R[-4]C+R[-2]C-R[-1]C -> 494.41 | L90: =IF(SUM(OFFSET(R[-79]C,3,0,R7C1,1))=0,"",(R[-4]C+R[-2]C-R[-1]C)) -> 569.99 | R90: =IF(SUM(OFFSET(R[-79]C,3,0,R7C1,1))=0,"",(R[-4]C+R[-2]C-R[-1]C)) -> 37.995999999999995 | S90: =R[-4]C+R[-2]C-R[-1]C -> 124.212
AC91: Тхв на источнике | AE91: V гвс (м3) | AF91: =R[-2]C[15] -> 0 | AG91: W гвс (Гкал) | AH91: =RC[-2]*0.06 -> 0 | AI91: W без гвс (Гкал) | AJ91: =R[-2]C[13]-RC[-2] -> 124.212
B92: Показания счетчиков на момент снятия данных:
B93: Дата, время | D93: М1, т | F93: М2, т | H93: М3, т | J93: М4, т | L93: Qо, Гкал | N93: Qг, Гкал | P93: время, час
B94: 23.09.18 02:00 | D94: 99902.44 | F94: 84576.15 | H94: 15610.89 | J94: - | L94: 3071.1289999999999 | N94: 1133.9380000000001 | P94: -
B95: 24.10.18 00:00 | D95: 104127.64 | F95: 88291.12 | H95: 16186.5 | J95: - | L95: 3198.0259999999998 | N95: 1173.1300000000001 | P95: -
AC97: =ZAYAVKA_N -> з.н д. №02/147-2783 от 04.10.18
B98: Представитель потребителя:_______________________________________________________________________ В.О. Топорков
I101: Рекомендуемые значения по параметрам теплопотребления (не являются официально утверждёнными)
I102: М, т | J102: V, м3 | K102: Qгвс, Гкал | L102: Qотоп, Гкал | M102: Qо, Гкал
I103: =R[-13]C[-3] -> 0 | J103: =RC[-1]/0.98 -> 0 | K103: =RC[-1]*0.06 -> 0 | L103: =RC[1]-RC[-1] -> 37.995999999999995 | M103: =R[-13]C[5] -> 37.995999999999995
O105: ДЛЯ САМОКОНТРОЛЯ
B106: В строке выбора дат указать период с 16.7.13 по 23.8.13 - жильё | N106: Q | O106: Qг
B107: В строке выбора дат указать период с 18.7.13 по 25.8.13 - не жилое | N107: =(R[-21]C[-10]*R[-22]C[-7]-R[-21]C[-9]*R[-22]C[-6])/1000 -> 493.75077370666662 | O107: =IF(R[-22]C[-2]="",R[-21]C[-3]*R[-22]C/1000,"") ->  | P107: Си2
O108: =IF(R[-23]C[-2]="","",((R[-22]C[-3]*R[-23]C)-(R[-22]C[-2]*R[-23]C[2]))/1000) -> 0 | P108: Си3