Sheet: Лист1
G1: Отчёт о теплопотреблении за октябрь 2018
A4: =EOMONTH(R[9]C,0)-R[9]C -> 8 | B4: Потребитель: ЗАО "Сити Сервис"
A5: =MAX(R[9]C:R[78]C) -> 2018-10-22T00:00:00.000 | B5: Адрес: г. СПб, Кораблестроителей ул., д.37 ИТП11
A6: =EOMONTH(R[-1]C,0)-R[-1]C -> 9 | B6: Телефон: 8-911-021-19-79
A7: =R[-2]C-R[6]C -> 30 | B7: Договор 10023-2 (.) 411
A8: 7 | B8: Тепловычислитель: ВКТ-7 № 98527 | L8: М2 мах= | M8: 177.6 | O8: Мгвс мах= | P8: 136.8
L9: Qотоп мах= | M9: 14.16 | O9: Qгвс мах= | P9: 8.16
B10: Расчётная формула: Q=M1*(h1-h2)+(M1-M2)*(h2-hхв)
D12: Учет | L12: Контроль
A13: =R[1]C[1]-1 -> 2018-09-22T00:00:00.000 | B13: Дата | C13: N, ч | D13: M1, т | E13: T1, С | F13: P1, кг/см2 | G13: M2, т | H13: T2, С | I13: P2, кг/см2 | J13: dT, С | K13: M1-М2, т | L13: V3, м3 | M13: T3, С | N13: V4, м3 | O13: =IF(R[-12]C[-14]="м.куб","","T4, С") -> T4, С | P13: dT, С | Q13: V3-V4, м3 | R13: Qгвс, Гкал | S13: Qобщ., Гкал | T13: Q | U13: M3 | V13: M4 | W13: си2 | X13: си3 | Y13: Разб. | Z13: dM2 | AC13: Дата | AD13: НС | AE13: n, ч | AF13: М1, т | AG13: t1, гр. С | AH13: Р1, кгс/см2 | AI13: М2, т | AJ13: t2, гр. С | AK13: Р2, кгс/см2 | AL13: t1-t2, гр. С | AM13: М1-М2, т | AN13: М1гвс, т | AO13: t1гвс, гр. С | AP13: Р1гвс, кгс/см2 | AQ13: М2гвс, т | AR13: t2гвс, гр. С | AS13: Р2гвс, кгс/см2 | AT13: t1гвс-t2гвс | AU13: М1гвс-М2гвс, т | AV13: Wгвс, Гкал | AW13: Wсумм, Гкал | AY13: NS_TV1 | AZ13: НС | BA13: NS_TV2
A14: =IF(RC[1]="","",DATEVALUE(RC[1])) -> 43366 | B14: 23.09.18 | C14: 24 | D14: 23.17 | E14: 69.25 | F14: 9.11 | G14: 0 | H14: 23.54 | I14: 5.0599999999999996 | J14: =RC[-5]-RC[-2] -> 45.71 | K14: 23.17 | L14: 23.88 | M14: 69.430000000000007 | R14: 1.6240000000000001 | S14: =RC[-1] -> 1.6240000000000001 | T14: =(RC[-16]*RC[-15]-RC[-13]*RC[-12])/1000 -> 1.6045225000000001 | U14: 23.36 | V14: - | W14: =RC[-2]*RC[-10]/1000 -> 1.6218848000000001 | X14: =ABS((RC[-3]*RC[-11]-RC[-2]*RC[-9])/1000) -> #VALUE! | Y14: =(RC[-14]-RC[1])/RC[-18]*100 -> #DIV/0! | Z14: 23.36 | AC14: =VALUE(RC[-27]) -> 2018-09-23T00:00:00.000 | AD14: =IF(RC[21]=42,"*",IF(RC[21]=32,"",RC[21])) -> - | AE14: =RC[-28] -> 24 | AF14: =RC[-28] -> 23.17 | AG14: =RC[-28] -> 69.25 | AH14: =RC[-28] -> 9.11 | AI14: =RC[-28] -> 0 | AJ14: =RC[-28] -> 23.54 | AK14: =RC[-28] -> 5.0599999999999996 | AL14: =RC[-28] -> 45.71 | AM14: =RC[-28] -> 23.17 | AN14: =RC[-28] -> 23.88 | AO14: =RC[-28] -> 69.430000000000007 | AP14: - | AQ14: =RC[-29] -> 0 | AR14: =RC[-29] -> 0 | AS14: - | AT14: =RC[-30] -> 0 | AU14: =RC[-30] -> 0 | AV14: =RC[-30] -> 1.6240000000000001 | AW14: =RC[-30] -> 1.6240000000000001 | AY14: - | AZ14: - | BA14: -
A15: =IF(RC[1]="","",DATEVALUE(RC[1])) -> 43367 | B15: 24.09.18 | C15: 24 | D15: 21.01 | E15: 68.23 | F15: 9.07 | G15: 0 | H15: 22.86 | I15: 5.08 | J15: =RC[-5]-RC[-2] -> 45.370000000000005 | K15: 21.01 | L15: 22.52 | M15: 68.2 | R15: 1.506 | S15: =RC[-1] -> 1.506 | T15: =(RC[-16]*RC[-15]-RC[-13]*RC[-12])/1000 -> 1.4335123000000001 | U15: 22.08 | V15: - | W15: =RC[-2]*RC[-10]/1000 -> 1.5058560000000001 | X15: =ABS((RC[-3]*RC[-11]-RC[-2]*RC[-9])/1000) -> #VALUE! | Y15: =(RC[-14]-RC[1])/RC[-18]*100 -> #DIV/0! | Z15: 22.08 | AC15: =VALUE(RC[-27]) -> 2018-09-24T00:00:00.000 | AD15: =IF(RC[21]=42,"*",IF(RC[21]=32,"",RC[21])) -> - | AE15: =RC[-28] -> 24 | AF15: =RC[-28] -> 21.01 | AG15: =RC[-28] -> 68.23 | AH15: =RC[-28] -> 9.07 | AI15: =RC[-28] -> 0 | AJ15: =RC[-28] -> 22.86 | AK15: =RC[-28] -> 5.08 | AL15: =RC[-28] -> 45.370000000000005 | AM15: =RC[-28] -> 21.01 | AN15: =RC[-28] -> 22.52 | AO15: =RC[-28] -> 68.2 | AP15: - | AQ15: =RC[-29] -> 0 | AR15: =RC[-29] -> 0 | AS15: - | AT15: =RC[-30] -> 0 | AU15: =RC[-30] -> 0 | AV15: =RC[-30] -> 1.506 | AW15: =RC[-30] -> 1.506 | AY15: - | AZ15: - | BA15: -
A16: =IF(RC[1]="","",DATEVALUE(RC[1])) -> 43368 | B16: 25.09.18 | C16: 24 | D16: 88.11 | E16: 66.91 | F16: 9.1300000000000008 | G16: 68 | H16: 49.78 | I16: 4.93 | J16: =RC[-5]-RC[-2] -> 17.129999999999995 | K16: 20.11 | L16: 23.99 | M16: 67.150000000000006 | R16: 1.579 | S16: 2.589 | T16: =(RC[-16]*RC[-15]-RC[-13]*RC[-12])/1000 -> 2.5104001 | U16: 23.51 | V16: - | W16: =RC[-2]*RC[-10]/1000 -> 1.5786965000000002 | X16: =ABS((RC[-3]*RC[-11]-RC[-2]*RC[-9])/1000) -> #VALUE! | Y16: =(RC[-14]-RC[1])/RC[-18]*100 -> -5.0000000000000027 | Z16: 23.51 | AC16: =VALUE(RC[-27]) -> 2018-09-25T00:00:00.000 | AD16: =IF(RC[21]=42,"*",IF(RC[21]=32,"",RC[21])) -> - | AE16: =RC[-28] -> 24 | AF16: =RC[-28] -> 88.11 | AG16: =RC[-28] -> 66.91 | AH16: =RC[-28] -> 9.1300000000000008 | AI16: =RC[-28] -> 68 | AJ16: =RC[-28] -> 49.78 | AK16: =RC[-28] -> 4.93 | AL16: =RC[-28] -> 17.129999999999995 | AM16: =RC[-28] -> 20.11 | AN16: =RC[-28] -> 23.99 | AO16: =RC[-28] -> 67.150000000000006 | AP16: - | AQ16: =RC[-29] -> 0 | AR16: =RC[-29] -> 0 | AS16: - | AT16: =RC[-30] -> 0 | AU16: =RC[-30] -> 0 | AV16: =RC[-30] -> 1.579 | AW16: =RC[-30] -> 2.589 | AY16: - | AZ16: - | BA16: -
A17: =IF(RC[1]="","",DATEVALUE(RC[1])) -> 43369 | B17: 26.09.18 | C17: 24 | D17: 307.27 | E17: 67.7 | F17: 8.93 | G17: 283.85000000000002 | H17: 50.63 | I17: 4.96 | J17: =RC[-5]-RC[-2] -> 17.07 | K17: 23.42 | L17: 21.17 | M17: 67.42 | R17: 1.4 | S17: 6.4459999999999997 | T17: =(RC[-16]*RC[-15]-RC[-13]*RC[-12])/1000 -> 6.4308534999999978 | U17: 20.75 | V17: - | W17: =RC[-2]*RC[-10]/1000 -> 1.3989650000000002 | X17: =ABS((RC[-3]*RC[-11]-RC[-2]*RC[-9])/1000) -> #VALUE! | Y17: =(RC[-14]-RC[1])/RC[-18]*100 -> 0.94063766073630495 | Z17: 20.75 | AC17: =VALUE(RC[-27]) -> 2018-09-26T00:00:00.000 | AD17: =IF(RC[21]=42,"*",IF(RC[21]=32,"",RC[21])) -> - | AE17: =RC[-28] -> 24 | AF17: =RC[-28] -> 307.27 | AG17: =RC[-28] -> 67.7 | AH17: =RC[-28] -> 8.93 | AI17: =RC[-28] -> 283.85000000000002 | AJ17: =RC[-28] -> 50.63 | AK17: =RC[-28] -> 4.96 | AL17: =RC[-28] -> 17.07 | AM17: =RC[-28] -> 23.42 | AN17: =RC[-28] -> 21.17 | AO17: =RC[-28] -> 67.42 | AP17: - | AQ17: =RC[-29] -> 0 | AR17: =RC[-29] -> 0 | AS17: - | AT17: =RC[-30] -> 0 | AU17: =RC[-30] -> 0 | AV17: =RC[-30] -> 1.4 | AW17: =RC[-30] -> 6.4459999999999997 | AY17: - | AZ17: - | BA17: -
A18: =IF(RC[1]="","",DATEVALUE(RC[1])) -> 43370 | B18: 27.09.18 | C18: 24 | D18: 293.51 | E18: 63.08 | F18: 8.68 | G18: 269.3 | H18: 47.76 | I18: 5.0999999999999996 | J18: =RC[-5]-RC[-2] -> 15.32 | K18: 24.21 | L18: 21.83 | M18: 62.98 | R18: 1.349 | S18: 5.665 | T18: =(RC[-16]*RC[-15]-RC[-13]*RC[-12])/1000 -> 5.6528427999999984 | U18: 21.43 | V18: - | W18: =RC[-2]*RC[-10]/1000 -> 1.3496614 | X18: =ABS((RC[-3]*RC[-11]-RC[-2]*RC[-9])/1000) -> #VALUE! | Y18: =(RC[-14]-RC[1])/RC[-18]*100 -> 1.0323059784626814 | Z18: 21.43 | AC18: =VALUE(RC[-27]) -> 2018-09-27T00:00:00.000 | AD18: =IF(RC[21]=42,"*",IF(RC[21]=32,"",RC[21])) -> - | AE18: =RC[-28] -> 24 | AF18: =RC[-28] -> 293.51 | AG18: =RC[-28] -> 63.08 | AH18: =RC[-28] -> 8.68 | AI18: =RC[-28] -> 269.3 | AJ18: =RC[-28] -> 47.76 | AK18: =RC[-28] -> 5.0999999999999996 | AL18: =RC[-28] -> 15.32 | AM18: =RC[-28] -> 24.21 | AN18: =RC[-28] -> 21.83 | AO18: =RC[-28] -> 62.98 | AP18: - | AQ18: =RC[-29] -> 0 | AR18: =RC[-29] -> 0 | AS18: - | AT18: =RC[-30] -> 0 | AU18: =RC[-30] -> 0 | AV18: =RC[-30] -> 1.349 | AW18: =RC[-30] -> 5.665 | AY18: - | AZ18: - | BA18: -
A19: =IF(RC[1]="","",DATEVALUE(RC[1])) -> 43371 | B19: 28.09.18 | C19: 24 | D19: 282.86 | E19: 67.45 | F19: 8.5500000000000007 | G19: 260.47000000000003 | H19: 49.95 | I19: 5.21 | J19: =RC[-5]-RC[-2] -> 17.5 | K19: 22.39 | L19: 20.53 | M19: 67.75 | R19: 1.363 | S19: 6.0830000000000002 | T19: =(RC[-16]*RC[-15]-RC[-13]*RC[-12])/1000 -> 6.0684305000000007 | U19: 20.12 | V19: - | W19: =RC[-2]*RC[-10]/1000 -> 1.3631300000000002 | X19: =ABS((RC[-3]*RC[-11]-RC[-2]*RC[-9])/1000) -> #VALUE! | Y19: =(RC[-14]-RC[1])/RC[-18]*100 -> 0.87150151648942265 | Z19: 20.12 | AC19: =VALUE(RC[-27]) -> 2018-09-28T00:00:00.000 | AD19: =IF(RC[21]=42,"*",IF(RC[21]=32,"",RC[21])) -> - | AE19: =RC[-28] -> 24 | AF19: =RC[-28] -> 282.86 | AG19: =RC[-28] -> 67.45 | AH19: =RC[-28] -> 8.5500000000000007 | AI19: =RC[-28] -> 260.47000000000003 | AJ19: =RC[-28] -> 49.95 | AK19: =RC[-28] -> 5.21 | AL19: =RC[-28] -> 17.5 | AM19: =RC[-28] -> 22.39 | AN19: =RC[-28] -> 20.53 | AO19: =RC[-28] -> 67.75 | AP19: - | AQ19: =RC[-29] -> 0 | AR19: =RC[-29] -> 0 | AS19: - | AT19: =RC[-30] -> 0 | AU19: =RC[-30] -> 0 | AV19: =RC[-30] -> 1.363 | AW19: =RC[-30] -> 6.0830000000000002 | AY19: - | AZ19: - | BA19: -
A20: =IF(RC[1]="","",DATEVALUE(RC[1])) -> 43372 | B20: 29.09.18 | C20: 24 | D20: 272.43 | E20: 67.36 | F20: 8.4700000000000006 | G20: 251.94 | H20: 49.46 | I20: 5.36 | J20: =RC[-5]-RC[-2] -> 17.899999999999999 | K20: 20.49 | L20: 18.739999999999998 | M20: 67.209999999999994 | R20: 1.238 | S20: 5.899 | T20: =(RC[-16]*RC[-15]-RC[-13]*RC[-12])/1000 -> 5.8899323999999993 | U20: 18.39 | V20: - | W20: =RC[-2]*RC[-10]/1000 -> 1.2359918999999999 | X20: =ABS((RC[-3]*RC[-11]-RC[-2]*RC[-9])/1000) -> #VALUE! | Y20: =(RC[-14]-RC[1])/RC[-18]*100 -> 0.83353179328411442 | Z20: 18.39 | AC20: =VALUE(RC[-27]) -> 2018-09-29T00:00:00.000 | AD20: =IF(RC[21]=42,"*",IF(RC[21]=32,"",RC[21])) -> - | AE20: =RC[-28] -> 24 | AF20: =RC[-28] -> 272.43 | AG20: =RC[-28] -> 67.36 | AH20: =RC[-28] -> 8.4700000000000006 | AI20: =RC[-28] -> 251.94 | AJ20: =RC[-28] -> 49.46 | AK20: =RC[-28] -> 5.36 | AL20: =RC[-28] -> 17.899999999999999 | AM20: =RC[-28] -> 20.49 | AN20: =RC[-28] -> 18.739999999999998 | AO20: =RC[-28] -> 67.209999999999994 | AP20: - | AQ20: =RC[-29] -> 0 | AR20: =RC[-29] -> 0 | AS20: - | AT20: =RC[-30] -> 0 | AU20: =RC[-30] -> 0 | AV20: =RC[-30] -> 1.238 | AW20: =RC[-30] -> 5.899 | AY20: - | AZ20: - | BA20: -
A21: =IF(RC[1]="","",DATEVALUE(RC[1])) -> 43373 | B21: 30.09.18 | C21: 24 | D21: 273.45 | E21: 69.48 | F21: 8.39 | G21: 249.58 | H21: 50.74 | I21: 5.33 | J21: =RC[-5]-RC[-2] -> 18.740000000000002 | K21: 23.87 | L21: 22.47 | M21: 69.94 | R21: 1.5389999999999999 | S21: 6.3479999999999999 | T21: =(RC[-16]*RC[-15]-RC[-13]*RC[-12])/1000 -> 6.3356167999999995 | U21: 21.99 | V21: - | W21: =RC[-2]*RC[-10]/1000 -> 1.5379805999999998 | X21: =ABS((RC[-3]*RC[-11]-RC[-2]*RC[-9])/1000) -> #VALUE! | Y21: =(RC[-14]-RC[1])/RC[-18]*100 -> 0.75326548601650878 | Z21: 21.99 | AC21: =VALUE(RC[-27]) -> 2018-09-30T00:00:00.000 | AD21: =IF(RC[21]=42,"*",IF(RC[21]=32,"",RC[21])) -> - | AE21: =RC[-28] -> 24 | AF21: =RC[-28] -> 273.45 | AG21: =RC[-28] -> 69.48 | AH21: =RC[-28] -> 8.39 | AI21: =RC[-28] -> 249.58 | AJ21: =RC[-28] -> 50.74 | AK21: =RC[-28] -> 5.33 | AL21: =RC[-28] -> 18.740000000000002 | AM21: =RC[-28] -> 23.87 | AN21: =RC[-28] -> 22.47 | AO21: =RC[-28] -> 69.94 | AP21: - | AQ21: =RC[-29] -> 0 | AR21: =RC[-29] -> 0 | AS21: - | AT21: =RC[-30] -> 0 | AU21: =RC[-30] -> 0 | AV21: =RC[-30] -> 1.5389999999999999 | AW21: =RC[-30] -> 6.3479999999999999 | AY21: - | AZ21: - | BA21: -
A22: =IF(RC[1]="","",DATEVALUE(RC[1])) -> 43374 | B22: 01.10.18 | C22: 24 | D22: 275.66000000000003 | E22: 68.31 | F22: 8.5 | G22: 251.91 | H22: 50.77 | I22: 5.38 | J22: =RC[-5]-RC[-2] -> 17.54 | K22: 23.75 | L22: 22.23 | M22: 68.239999999999995 | R22: 1.492 | S22: 6.0519999999999996 | T22: =(RC[-16]*RC[-15]-RC[-13]*RC[-12])/1000 -> 6.0408639000000024 | U22: 21.79 | V22: - | W22: =RC[-2]*RC[-10]/1000 -> 1.4869496 | X22: =ABS((RC[-3]*RC[-11]-RC[-2]*RC[-9])/1000) -> #VALUE! | Y22: =(RC[-14]-RC[1])/RC[-18]*100 -> 0.77805565479734862 | Z22: 21.79 | AC22: =VALUE(RC[-27]) -> 2018-10-01T00:00:00.000 | AD22: =IF(RC[21]=42,"*",IF(RC[21]=32,"",RC[21])) -> - | AE22: =RC[-28] -> 24 | AF22: =RC[-28] -> 275.66000000000003 | AG22: =RC[-28] -> 68.31 | AH22: =RC[-28] -> 8.5 | AI22: =RC[-28] -> 251.91 | AJ22: =RC[-28] -> 50.77 | AK22: =RC[-28] -> 5.38 | AL22: =RC[-28] -> 17.54 | AM22: =RC[-28] -> 23.75 | AN22: =RC[-28] -> 22.23 | AO22: =RC[-28] -> 68.239999999999995 | AP22: - | AQ22: =RC[-29] -> 0 | AR22: =RC[-29] -> 0 | AS22: - | AT22: =RC[-30] -> 0 | AU22: =RC[-30] -> 0 | AV22: =RC[-30] -> 1.492 | AW22: =RC[-30] -> 6.0519999999999996 | AY22: - | AZ22: - | BA22: -
A23: =IF(RC[1]="","",DATEVALUE(RC[1])) -> 43375 | B23: 02.10.18 | C23: 24 | D23: 263.66000000000003 | E23: 67.069999999999993 | F23: 8.25 | G23: 241.82 | H23: 49.64 | I23: 5.38 | J23: =RC[-5]-RC[-2] -> 17.429999999999993 | K23: 21.84 | L23: 20.079999999999998 | M23: 67.09 | R23: 1.319 | S23: 5.69 | T23: =(RC[-16]*RC[-15]-RC[-13]*RC[-12])/1000 -> 5.6797313999999988 | U23: 19.66 | V23: - | W23: =RC[-2]*RC[-10]/1000 -> 1.3189894000000002 | X23: =ABS((RC[-3]*RC[-11]-RC[-2]*RC[-9])/1000) -> #VALUE! | Y23: =(RC[-14]-RC[1])/RC[-18]*100 -> 0.90149698122570487 | Z23: 19.66 | AC23: =VALUE(RC[-27]) -> 2018-10-02T00:00:00.000 | AD23: =IF(RC[21]=42,"*",IF(RC[21]=32,"",RC[21])) -> - | AE23: =RC[-28] -> 24 | AF23: =RC[-28] -> 263.66000000000003 | AG23: =RC[-28] -> 67.069999999999993 | AH23: =RC[-28] -> 8.25 | AI23: =RC[-28] -> 241.82 | AJ23: =RC[-28] -> 49.64 | AK23: =RC[-28] -> 5.38 | AL23: =RC[-28] -> 17.429999999999993 | AM23: =RC[-28] -> 21.84 | AN23: =RC[-28] -> 20.079999999999998 | AO23: =RC[-28] -> 67.09 | AP23: - | AQ23: =RC[-29] -> 0 | AR23: =RC[-29] -> 0 | AS23: - | AT23: =RC[-30] -> 0 | AU23: =RC[-30] -> 0 | AV23: =RC[-30] -> 1.319 | AW23: =RC[-30] -> 5.69 | AY23: - | AZ23: - | BA23: -
A24: =IF(RC[1]="","",DATEVALUE(RC[1])) -> 43376 | B24: 03.10.18 | C24: 24 | D24: 257.14999999999998 | E24: 67.22 | F24: 8.2200000000000006 | G24: 234.58 | H24: 49.38 | I24: 5.5 | J24: =RC[-5]-RC[-2] -> 17.839999999999996 | K24: 22.57 | L24: 20.04 | M24: 67.319999999999993 | R24: 1.3220000000000001 | S24: 5.7080000000000002 | T24: =(RC[-16]*RC[-15]-RC[-13]*RC[-12])/1000 -> 5.7020625999999979 | U24: 19.64 | V24: - | W24: =RC[-2]*RC[-10]/1000 -> 1.3221647999999999 | X24: =ABS((RC[-3]*RC[-11]-RC[-2]*RC[-9])/1000) -> #VALUE! | Y24: =(RC[-14]-RC[1])/RC[-18]*100 -> 1.2490408389462015 | Z24: 19.64 | AC24: =VALUE(RC[-27]) -> 2018-10-03T00:00:00.000 | AD24: =IF(RC[21]=42,"*",IF(RC[21]=32,"",RC[21])) -> - | AE24: =RC[-28] -> 24 | AF24: =RC[-28] -> 257.14999999999998 | AG24: =RC[-28] -> 67.22 | AH24: =RC[-28] -> 8.2200000000000006 | AI24: =RC[-28] -> 234.58 | AJ24: =RC[-28] -> 49.38 | AK24: =RC[-28] -> 5.5 | AL24: =RC[-28] -> 17.839999999999996 | AM24: =RC[-28] -> 22.57 | AN24: =RC[-28] -> 20.04 | AO24: =RC[-28] -> 67.319999999999993 | AP24: - | AQ24: =RC[-29] -> 0 | AR24: =RC[-29] -> 0 | AS24: - | AT24: =RC[-30] -> 0 | AU24: =RC[-30] -> 0 | AV24: =RC[-30] -> 1.3220000000000001 | AW24: =RC[-30] -> 5.7080000000000002 | AY24: - | AZ24: - | BA24: -
A25: =IF(RC[1]="","",DATEVALUE(RC[1])) -> 43377 | B25: 04.10.18 | C25: 24 | D25: 245.6 | E25: 66.61 | F25: 8.02 | G25: 222.9 | H25: 48.17 | I25: 5.59 | J25: =RC[-5]-RC[-2] -> 18.439999999999998 | K25: 22.7 | L25: 22.18 | M25: 66.650000000000006 | R25: 1.4470000000000001 | S25: 5.633 | T25: =(RC[-16]*RC[-15]-RC[-13]*RC[-12])/1000 -> 5.6223229999999988 | U25: 21.75 | V25: - | W25: =RC[-2]*RC[-10]/1000 -> 1.4496375000000001 | X25: =ABS((RC[-3]*RC[-11]-RC[-2]*RC[-9])/1000) -> #VALUE! | Y25: =(RC[-14]-RC[1])/RC[-18]*100 -> 0.42620008972633439 | Z25: 21.75 | AC25: =VALUE(RC[-27]) -> 2018-10-04T00:00:00.000 | AD25: =IF(RC[21]=42,"*",IF(RC[21]=32,"",RC[21])) -> - | AE25: =RC[-28] -> 24 | AF25: =RC[-28] -> 245.6 | AG25: =RC[-28] -> 66.61 | AH25: =RC[-28] -> 8.02 | AI25: =RC[-28] -> 222.9 | AJ25: =RC[-28] -> 48.17 | AK25: =RC[-28] -> 5.59 | AL25: =RC[-28] -> 18.439999999999998 | AM25: =RC[-28] -> 22.7 | AN25: =RC[-28] -> 22.18 | AO25: =RC[-28] -> 66.650000000000006 | AP25: - | AQ25: =RC[-29] -> 0 | AR25: =RC[-29] -> 0 | AS25: - | AT25: =RC[-30] -> 0 | AU25: =RC[-30] -> 0 | AV25: =RC[-30] -> 1.4470000000000001 | AW25: =RC[-30] -> 5.633 | AY25: - | AZ25: - | BA25: -
A26: =IF(RC[1]="","",DATEVALUE(RC[1])) -> 43378 | B26: 05.10.18 | C26: 24 | D26: 223.42 | E26: 65.97 | F26: 7.71 | G26: 202.64 | H26: 46.37 | I26: 5.71 | J26: =RC[-5]-RC[-2] -> 19.600000000000001 | K26: 20.78 | L26: 20.3 | M26: 66.040000000000006 | R26: 1.3129999999999999 | S26: 5.343 | T26: =(RC[-16]*RC[-15]-RC[-13]*RC[-12])/1000 -> 5.3426005999999999 | U26: 19.89 | V26: - | W26: =RC[-2]*RC[-10]/1000 -> 1.3135356000000002 | X26: =ABS((RC[-3]*RC[-11]-RC[-2]*RC[-9])/1000) -> #VALUE! | Y26: =(RC[-14]-RC[1])/RC[-18]*100 -> 0.4392025266482435 | Z26: 19.89 | AC26: =VALUE(RC[-27]) -> 2018-10-05T00:00:00.000 | AD26: =IF(RC[21]=42,"*",IF(RC[21]=32,"",RC[21])) -> - | AE26: =RC[-28] -> 24 | AF26: =RC[-28] -> 223.42 | AG26: =RC[-28] -> 65.97 | AH26: =RC[-28] -> 7.71 | AI26: =RC[-28] -> 202.64 | AJ26: =RC[-28] -> 46.37 | AK26: =RC[-28] -> 5.71 | AL26: =RC[-28] -> 19.600000000000001 | AM26: =RC[-28] -> 20.78 | AN26: =RC[-28] -> 20.3 | AO26: =RC[-28] -> 66.040000000000006 | AP26: - | AQ26: =RC[-29] -> 0 | AR26: =RC[-29] -> 0 | AS26: - | AT26: =RC[-30] -> 0 | AU26: =RC[-30] -> 0 | AV26: =RC[-30] -> 1.3129999999999999 | AW26: =RC[-30] -> 5.343 | AY26: - | AZ26: - | BA26: -
A27: =IF(RC[1]="","",DATEVALUE(RC[1])) -> 43379 | B27: 06.10.18 | C27: 24 | D27: 226.18 | E27: 66.62 | F27: 7.68 | G27: 205.1 | H27: 47.07 | I27: 5.63 | J27: =RC[-5]-RC[-2] -> 19.550000000000004 | K27: 21.08 | L27: 20.84 | M27: 66.849999999999994 | R27: 1.367 | S27: 5.4180000000000001 | T27: =(RC[-16]*RC[-15]-RC[-13]*RC[-12])/1000 -> 5.4140546000000009 | U27: 20.45 | V27: - | W27: =RC[-2]*RC[-10]/1000 -> 1.3670824999999998 | X27: =ABS((RC[-3]*RC[-11]-RC[-2]*RC[-9])/1000) -> #VALUE! | Y27: =(RC[-14]-RC[1])/RC[-18]*100 -> 0.30716723549488006 | Z27: 20.45 | AC27: =VALUE(RC[-27]) -> 2018-10-06T00:00:00.000 | AD27: =IF(RC[21]=42,"*",IF(RC[21]=32,"",RC[21])) -> - | AE27: =RC[-28] -> 24 | AF27: =RC[-28] -> 226.18 | AG27: =RC[-28] -> 66.62 | AH27: =RC[-28] -> 7.68 | AI27: =RC[-28] -> 205.1 | AJ27: =RC[-28] -> 47.07 | AK27: =RC[-28] -> 5.63 | AL27: =RC[-28] -> 19.550000000000004 | AM27: =RC[-28] -> 21.08 | AN27: =RC[-28] -> 20.84 | AO27: =RC[-28] -> 66.849999999999994 | AP27: - | AQ27: =RC[-29] -> 0 | AR27: =RC[-29] -> 0 | AS27: - | AT27: =RC[-30] -> 0 | AU27: =RC[-30] -> 0 | AV27: =RC[-30] -> 1.367 | AW27: =RC[-30] -> 5.4180000000000001 | AY27: - | AZ27: - | BA27: -
A28: =IF(RC[1]="","",DATEVALUE(RC[1])) -> 43380 | B28: 07.10.18 | C28: 24 | D28: 226.4 | E28: 66.89 | F28: 7.66 | G28: 203.26 | H28: 47.15 | I28: 5.65 | J28: =RC[-5]-RC[-2] -> 19.740000000000002 | K28: 23.14 | L28: 22.86 | M28: 67.08 | R28: 1.504 | S28: 5.5659999999999998 | T28: =(RC[-16]*RC[-15]-RC[-13]*RC[-12])/1000 -> 5.5601870000000018 | U28: 22.43 | V28: - | W28: =RC[-2]*RC[-10]/1000 -> 1.5046043999999998 | X28: =ABS((RC[-3]*RC[-11]-RC[-2]*RC[-9])/1000) -> #VALUE! | Y28: =(RC[-14]-RC[1])/RC[-18]*100 -> 0.34930630719275846 | Z28: 22.43 | AC28: =VALUE(RC[-27]) -> 2018-10-07T00:00:00.000 | AD28: =IF(RC[21]=42,"*",IF(RC[21]=32,"",RC[21])) -> - | AE28: =RC[-28] -> 24 | AF28: =RC[-28] -> 226.4 | AG28: =RC[-28] -> 66.89 | AH28: =RC[-28] -> 7.66 | AI28: =RC[-28] -> 203.26 | AJ28: =RC[-28] -> 47.15 | AK28: =RC[-28] -> 5.65 | AL28: =RC[-28] -> 19.740000000000002 | AM28: =RC[-28] -> 23.14 | AN28: =RC[-28] -> 22.86 | AO28: =RC[-28] -> 67.08 | AP28: - | AQ28: =RC[-29] -> 0 | AR28: =RC[-29] -> 0 | AS28: - | AT28: =RC[-30] -> 0 | AU28: =RC[-30] -> 0 | AV28: =RC[-30] -> 1.504 | AW28: =RC[-30] -> 5.5659999999999998 | AY28: - | AZ28: - | BA28: -
A29: =IF(RC[1]="","",DATEVALUE(RC[1])) -> 43381 | B29: 08.10.18 | C29: 24 | D29: 222.6 | E29: 66.87 | F29: 7.62 | G29: 200.65 | H29: 46.53 | I29: 5.67 | J29: =RC[-5]-RC[-2] -> 20.340000000000003 | K29: 21.95 | L29: 21.7 | M29: 67 | R29: 1.421 | S29: 5.55 | T29: =(RC[-16]*RC[-15]-RC[-13]*RC[-12])/1000 -> 5.5490174999999997 | U29: 21.28 | V29: - | W29: =RC[-2]*RC[-10]/1000 -> 1.4257599999999999 | X29: =ABS((RC[-3]*RC[-11]-RC[-2]*RC[-9])/1000) -> #VALUE! | Y29: =(RC[-14]-RC[1])/RC[-18]*100 -> 0.33391477697483085 | Z29: 21.28 | AC29: =VALUE(RC[-27]) -> 2018-10-08T00:00:00.000 | AD29: =IF(RC[21]=42,"*",IF(RC[21]=32,"",RC[21])) -> - | AE29: =RC[-28] -> 24 | AF29: =RC[-28] -> 222.6 | AG29: =RC[-28] -> 66.87 | AH29: =RC[-28] -> 7.62 | AI29: =RC[-28] -> 200.65 | AJ29: =RC[-28] -> 46.53 | AK29: =RC[-28] -> 5.67 | AL29: =RC[-28] -> 20.340000000000003 | AM29: =RC[-28] -> 21.95 | AN29: =RC[-28] -> 21.7 | AO29: =RC[-28] -> 67 | AP29: - | AQ29: =RC[-29] -> 0 | AR29: =RC[-29] -> 0 | AS29: - | AT29: =RC[-30] -> 0 | AU29: =RC[-30] -> 0 | AV29: =RC[-30] -> 1.421 | AW29: =RC[-30] -> 5.55 | AY29: - | AZ29: - | BA29: -
A30: =IF(RC[1]="","",DATEVALUE(RC[1])) -> 43382 | B30: 09.10.18 | C30: 24 | D30: 228.02 | E30: 66.739999999999995 | F30: 7.78 | G30: 207.32 | H30: 47.13 | I30: 5.69 | J30: =RC[-5]-RC[-2] -> 19.609999999999992 | K30: 20.7 | L30: 20.28 | M30: 66.92 | R30: 1.3320000000000001 | S30: 5.452 | T30: =(RC[-16]*RC[-15]-RC[-13]*RC[-12])/1000 -> 5.4470632000000005 | U30: 19.88 | V30: - | W30: =RC[-2]*RC[-10]/1000 -> 1.3303696 | X30: =ABS((RC[-3]*RC[-11]-RC[-2]*RC[-9])/1000) -> #VALUE! | Y30: =(RC[-14]-RC[1])/RC[-18]*100 -> 0.39552382789890034 | Z30: 19.88 | AC30: =VALUE(RC[-27]) -> 2018-10-09T00:00:00.000 | AD30: =IF(RC[21]=42,"*",IF(RC[21]=32,"",RC[21])) -> - | AE30: =RC[-28] -> 24 | AF30: =RC[-28] -> 228.02 | AG30: =RC[-28] -> 66.739999999999995 | AH30: =RC[-28] -> 7.78 | AI30: =RC[-28] -> 207.32 | AJ30: =RC[-28] -> 47.13 | AK30: =RC[-28] -> 5.69 | AL30: =RC[-28] -> 19.609999999999992 | AM30: =RC[-28] -> 20.7 | AN30: =RC[-28] -> 20.28 | AO30: =RC[-28] -> 66.92 | AP30: - | AQ30: =RC[-29] -> 0 | AR30: =RC[-29] -> 0 | AS30: - | AT30: =RC[-30] -> 0 | AU30: =RC[-30] -> 0 | AV30: =RC[-30] -> 1.3320000000000001 | AW30: =RC[-30] -> 5.452 | AY30: - | AZ30: - | BA30: -
A31: =IF(RC[1]="","",DATEVALUE(RC[1])) -> 43383 | B31: 10.10.18 | C31: 24 | D31: 229.19 | E31: 67.739999999999995 | F31: 7.7 | G31: 208.08 | H31: 48.05 | I31: 5.59 | J31: =RC[-5]-RC[-2] -> 19.689999999999998 | K31: 21.11 | L31: 20.95 | M31: 67.97 | R31: 1.395 | S31: 5.532 | T31: =(RC[-16]*RC[-15]-RC[-13]*RC[-12])/1000 -> 5.5270865999999987 | U31: 20.54 | V31: - | W31: =RC[-2]*RC[-10]/1000 -> 1.3961037999999999 | X31: =ABS((RC[-3]*RC[-11]-RC[-2]*RC[-9])/1000) -> #VALUE! | Y31: =(RC[-14]-RC[1])/RC[-18]*100 -> 0.27393310265282594 | Z31: 20.54 | AC31: =VALUE(RC[-27]) -> 2018-10-10T00:00:00.000 | AD31: =IF(RC[21]=42,"*",IF(RC[21]=32,"",RC[21])) -> - | AE31: =RC[-28] -> 24 | AF31: =RC[-28] -> 229.19 | AG31: =RC[-28] -> 67.739999999999995 | AH31: =RC[-28] -> 7.7 | AI31: =RC[-28] -> 208.08 | AJ31: =RC[-28] -> 48.05 | AK31: =RC[-28] -> 5.59 | AL31: =RC[-28] -> 19.689999999999998 | AM31: =RC[-28] -> 21.11 | AN31: =RC[-28] -> 20.95 | AO31: =RC[-28] -> 67.97 | AP31: - | AQ31: =RC[-29] -> 0 | AR31: =RC[-29] -> 0 | AS31: - | AT31: =RC[-30] -> 0 | AU31: =RC[-30] -> 0 | AV31: =RC[-30] -> 1.395 | AW31: =RC[-30] -> 5.532 | AY31: - | AZ31: - | BA31: -
A32: =IF(RC[1]="","",DATEVALUE(RC[1])) -> 43384 | B32: 11.10.18 | C32: 24 | D32: 235.36 | E32: 68.84 | F32: 7.76 | G32: 215.41 | H32: 49.11 | I32: 5.5 | J32: =RC[-5]-RC[-2] -> 19.730000000000004 | K32: 19.95 | L32: 19.579999999999998 | M32: 68.989999999999995 | R32: 1.323 | S32: 5.6269999999999998 | T32: =(RC[-16]*RC[-15]-RC[-13]*RC[-12])/1000 -> 5.6233973000000024 | U32: 19.170000000000002 | V32: - | W32: =RC[-2]*RC[-10]/1000 -> 1.3225382999999999 | X32: =ABS((RC[-3]*RC[-11]-RC[-2]*RC[-9])/1000) -> #VALUE! | Y32: =(RC[-14]-RC[1])/RC[-18]*100 -> 0.36210018105008945 | Z32: 19.170000000000002 | AC32: =VALUE(RC[-27]) -> 2018-10-11T00:00:00.000 | AD32: =IF(RC[21]=42,"*",IF(RC[21]=32,"",RC[21])) -> - | AE32: =RC[-28] -> 24 | AF32: =RC[-28] -> 235.36 | AG32: =RC[-28] -> 68.84 | AH32: =RC[-28] -> 7.76 | AI32: =RC[-28] -> 215.41 | AJ32: =RC[-28] -> 49.11 | AK32: =RC[-28] -> 5.5 | AL32: =RC[-28] -> 19.730000000000004 | AM32: =RC[-28] -> 19.95 | AN32: =RC[-28] -> 19.579999999999998 | AO32: =RC[-28] -> 68.989999999999995 | AP32: - | AQ32: =RC[-29] -> 0 | AR32: =RC[-29] -> 0 | AS32: - | AT32: =RC[-30] -> 0 | AU32: =RC[-30] -> 0 | AV32: =RC[-30] -> 1.323 | AW32: =RC[-30] -> 5.6269999999999998 | AY32: - | AZ32: - | BA32: -
A33: =IF(RC[1]="","",DATEVALUE(RC[1])) -> 43385 | B33: 12.10.18 | C33: 24 | D33: 232.73 | E33: 68.680000000000007 | F33: 7.76 | G33: 213.33 | H33: 48.78 | I33: 5.55 | J33: =RC[-5]-RC[-2] -> 19.900000000000006 | K33: 19.399999999999999 | L33: 19.47 | M33: 68.72 | R33: 1.3129999999999999 | S33: 5.585 | T33: =(RC[-16]*RC[-15]-RC[-13]*RC[-12])/1000 -> 5.5776590000000015 | U33: 19.07 | V33: - | W33: =RC[-2]*RC[-10]/1000 -> 1.3104903999999999 | X33: =ABS((RC[-3]*RC[-11]-RC[-2]*RC[-9])/1000) -> #VALUE! | Y33: =(RC[-14]-RC[1])/RC[-18]*100 -> 0.15468991702995277 | Z33: 19.07 | AC33: =VALUE(RC[-27]) -> 2018-10-12T00:00:00.000 | AD33: =IF(RC[21]=42,"*",IF(RC[21]=32,"",RC[21])) -> - | AE33: =RC[-28] -> 24 | AF33: =RC[-28] -> 232.73 | AG33: =RC[-28] -> 68.680000000000007 | AH33: =RC[-28] -> 7.76 | AI33: =RC[-28] -> 213.33 | AJ33: =RC[-28] -> 48.78 | AK33: =RC[-28] -> 5.55 | AL33: =RC[-28] -> 19.900000000000006 | AM33: =RC[-28] -> 19.399999999999999 | AN33: =RC[-28] -> 19.47 | AO33: =RC[-28] -> 68.72 | AP33: - | AQ33: =RC[-29] -> 0 | AR33: =RC[-29] -> 0 | AS33: - | AT33: =RC[-30] -> 0 | AU33: =RC[-30] -> 0 | AV33: =RC[-30] -> 1.3129999999999999 | AW33: =RC[-30] -> 5.585 | AY33: - | AZ33: - | BA33: -
A34: =IF(RC[1]="","",DATEVALUE(RC[1])) -> 43386 | B34: 13.10.18 | C34: 24 | D34: 241.94 | E34: 69.77 | F34: 7.96 | G34: 223.55 | H34: 50.28 | I34: 5.53 | J34: =RC[-5]-RC[-2] -> 19.489999999999995 | K34: 18.39 | L34: 18.149999999999999 | M34: 69.930000000000007 | R34: 1.242 | S34: 5.6509999999999998 | T34: =(RC[-16]*RC[-15]-RC[-13]*RC[-12])/1000 -> 5.6400597999999995 | U34: 17.739999999999998 | V34: - | W34: =RC[-2]*RC[-10]/1000 -> 1.2405581999999999 | X34: =ABS((RC[-3]*RC[-11]-RC[-2]*RC[-9])/1000) -> #VALUE! | Y34: =(RC[-14]-RC[1])/RC[-18]*100 -> 0.29076269290986451 | Z34: 17.739999999999998 | AC34: =VALUE(RC[-27]) -> 2018-10-13T00:00:00.000 | AD34: =IF(RC[21]=42,"*",IF(RC[21]=32,"",RC[21])) -> - | AE34: =RC[-28] -> 24 | AF34: =RC[-28] -> 241.94 | AG34: =RC[-28] -> 69.77 | AH34: =RC[-28] -> 7.96 | AI34: =RC[-28] -> 223.55 | AJ34: =RC[-28] -> 50.28 | AK34: =RC[-28] -> 5.53 | AL34: =RC[-28] -> 19.489999999999995 | AM34: =RC[-28] -> 18.39 | AN34: =RC[-28] -> 18.149999999999999 | AO34: =RC[-28] -> 69.930000000000007 | AP34: - | AQ34: =RC[-29] -> 0 | AR34: =RC[-29] -> 0 | AS34: - | AT34: =RC[-30] -> 0 | AU34: =RC[-30] -> 0 | AV34: =RC[-30] -> 1.242 | AW34: =RC[-30] -> 5.6509999999999998 | AY34: - | AZ34: - | BA34: -
A35: =IF(RC[1]="","",DATEVALUE(RC[1])) -> 43387 | B35: 14.10.18 | C35: 24 | D35: 247.33 | E35: 70.52 | F35: 7.94 | G35: 227.65 | H35: 53.4 | I35: 5.44 | J35: =RC[-5]-RC[-2] -> 17.119999999999997 | K35: 19.68 | L35: 20.7 | M35: 70.77 | R35: 1.4330000000000001 | S35: 5.335 | T35: =(RC[-16]*RC[-15]-RC[-13]*RC[-12])/1000 -> 5.2852015999999988 | U35: 20.25 | V35: - | W35: =RC[-2]*RC[-10]/1000 -> 1.4330924999999999 | X35: =ABS((RC[-3]*RC[-11]-RC[-2]*RC[-9])/1000) -> #VALUE! | Y35: =(RC[-14]-RC[1])/RC[-18]*100 -> -0.25038436195914793 | Z35: 20.25 | AC35: =VALUE(RC[-27]) -> 2018-10-14T00:00:00.000 | AD35: =IF(RC[21]=42,"*",IF(RC[21]=32,"",RC[21])) -> - | AE35: =RC[-28] -> 24 | AF35: =RC[-28] -> 247.33 | AG35: =RC[-28] -> 70.52 | AH35: =RC[-28] -> 7.94 | AI35: =RC[-28] -> 227.65 | AJ35: =RC[-28] -> 53.4 | AK35: =RC[-28] -> 5.44 | AL35: =RC[-28] -> 17.119999999999997 | AM35: =RC[-28] -> 19.68 | AN35: =RC[-28] -> 20.7 | AO35: =RC[-28] -> 70.77 | AP35: - | AQ35: =RC[-29] -> 0 | AR35: =RC[-29] -> 0 | AS35: - | AT35: =RC[-30] -> 0 | AU35: =RC[-30] -> 0 | AV35: =RC[-30] -> 1.4330000000000001 | AW35: =RC[-30] -> 5.335 | AY35: - | AZ35: - | BA35: -
A36: =IF(RC[1]="","",DATEVALUE(RC[1])) -> 43388 | B36: 15.10.18 | C36: 24 | D36: 254.2 | E36: 70.03 | F36: 8.0399999999999991 | G36: 229.2 | H36: 51.53 | I36: 5.42 | J36: =RC[-5]-RC[-2] -> 18.5 | K36: 25 | L36: 21.83 | M36: 70.16 | R36: 1.496 | S36: 5.9980000000000002 | T36: =(RC[-16]*RC[-15]-RC[-13]*RC[-12])/1000 -> 5.9909500000000007 | U36: 21.32 | V36: - | W36: =RC[-2]*RC[-10]/1000 -> 1.4958111999999999 | X36: =ABS((RC[-3]*RC[-11]-RC[-2]*RC[-9])/1000) -> #VALUE! | Y36: =(RC[-14]-RC[1])/RC[-18]*100 -> 1.6055846422338569 | Z36: 21.32 | AC36: =VALUE(RC[-27]) -> 2018-10-15T00:00:00.000 | AD36: =IF(RC[21]=42,"*",IF(RC[21]=32,"",RC[21])) -> - | AE36: =RC[-28] -> 24 | AF36: =RC[-28] -> 254.2 | AG36: =RC[-28] -> 70.03 | AH36: =RC[-28] -> 8.0399999999999991 | AI36: =RC[-28] -> 229.2 | AJ36: =RC[-28] -> 51.53 | AK36: =RC[-28] -> 5.42 | AL36: =RC[-28] -> 18.5 | AM36: =RC[-28] -> 25 | AN36: =RC[-28] -> 21.83 | AO36: =RC[-28] -> 70.16 | AP36: - | AQ36: =RC[-29] -> 0 | AR36: =RC[-29] -> 0 | AS36: - | AT36: =RC[-30] -> 0 | AU36: =RC[-30] -> 0 | AV36: =RC[-30] -> 1.496 | AW36: =RC[-30] -> 5.9980000000000002 | AY36: - | AZ36: - | BA36: -
A37: =IF(RC[1]="","",DATEVALUE(RC[1])) -> 43389 | B37: 16.10.18 | C37: 24 | D37: 252.19 | E37: 70.05 | F37: 8 | G37: 227.47 | H37: 55.59 | I37: 5.36 | J37: =RC[-5]-RC[-2] -> 14.459999999999994 | K37: 24.72 | L37: 19.11 | M37: 70.09 | R37: 1.3120000000000001 | S37: 5.0359999999999996 | T37: =(RC[-16]*RC[-15]-RC[-13]*RC[-12])/1000 -> 5.0208521999999975 | U37: 18.71 | V37: - | W37: =RC[-2]*RC[-10]/1000 -> 1.3113839 | X37: =ABS((RC[-3]*RC[-11]-RC[-2]*RC[-9])/1000) -> #VALUE! | Y37: =(RC[-14]-RC[1])/RC[-18]*100 -> 2.6421066514265608 | Z37: 18.71 | AC37: =VALUE(RC[-27]) -> 2018-10-16T00:00:00.000 | AD37: =IF(RC[21]=42,"*",IF(RC[21]=32,"",RC[21])) -> - | AE37: =RC[-28] -> 24 | AF37: =RC[-28] -> 252.19 | AG37: =RC[-28] -> 70.05 | AH37: =RC[-28] -> 8 | AI37: =RC[-28] -> 227.47 | AJ37: =RC[-28] -> 55.59 | AK37: =RC[-28] -> 5.36 | AL37: =RC[-28] -> 14.459999999999994 | AM37: =RC[-28] -> 24.72 | AN37: =RC[-28] -> 19.11 | AO37: =RC[-28] -> 70.09 | AP37: - | AQ37: =RC[-29] -> 0 | AR37: =RC[-29] -> 0 | AS37: - | AT37: =RC[-30] -> 0 | AU37: =RC[-30] -> 0 | AV37: =RC[-30] -> 1.3120000000000001 | AW37: =RC[-30] -> 5.0359999999999996 | AY37: - | AZ37: - | BA37: -
A38: =IF(RC[1]="","",DATEVALUE(RC[1])) -> 43390 | B38: 17.10.18 | C38: 24 | D38: 258.85000000000002 | E38: 70.239999999999995 | F38: 8.08 | G38: 235.75 | H38: 52 | I38: 5.33 | J38: =RC[-5]-RC[-2] -> 18.239999999999995 | K38: 23.1 | L38: 20.73 | M38: 70.41 | R38: 1.427 | S38: 5.9320000000000004 | T38: =(RC[-16]*RC[-15]-RC[-13]*RC[-12])/1000 -> 5.9226239999999999 | U38: 20.29 | V38: - | W38: =RC[-2]*RC[-10]/1000 -> 1.4286189 | X38: =ABS((RC[-3]*RC[-11]-RC[-2]*RC[-9])/1000) -> #VALUE! | Y38: =(RC[-14]-RC[1])/RC[-18]*100 -> 1.1919406150583254 | Z38: 20.29 | AC38: =VALUE(RC[-27]) -> 2018-10-17T00:00:00.000 | AD38: =IF(RC[21]=42,"*",IF(RC[21]=32,"",RC[21])) -> - | AE38: =RC[-28] -> 24 | AF38: =RC[-28] -> 258.85000000000002 | AG38: =RC[-28] -> 70.239999999999995 | AH38: =RC[-28] -> 8.08 | AI38: =RC[-28] -> 235.75 | AJ38: =RC[-28] -> 52 | AK38: =RC[-28] -> 5.33 | AL38: =RC[-28] -> 18.239999999999995 | AM38: =RC[-28] -> 23.1 | AN38: =RC[-28] -> 20.73 | AO38: =RC[-28] -> 70.41 | AP38: - | AQ38: =RC[-29] -> 0 | AR38: =RC[-29] -> 0 | AS38: - | AT38: =RC[-30] -> 0 | AU38: =RC[-30] -> 0 | AV38: =RC[-30] -> 1.427 | AW38: =RC[-30] -> 5.9320000000000004 | AY38: - | AZ38: - | BA38: -
A39: =IF(RC[1]="","",DATEVALUE(RC[1])) -> 43391 | B39: 18.10.18 | C39: 24 | D39: 258.31 | E39: 70.709999999999994 | F39: 8.1300000000000008 | G39: 236.32 | H39: 52.38 | I39: 5.37 | J39: =RC[-5]-RC[-2] -> 18.329999999999991 | K39: 21.99 | L39: 19.649999999999999 | M39: 70.84 | R39: 1.361 | S39: 5.8979999999999997 | T39: =(RC[-16]*RC[-15]-RC[-13]*RC[-12])/1000 -> 5.8866584999999993 | U39: 19.22 | V39: - | W39: =RC[-2]*RC[-10]/1000 -> 1.3615447999999999 | X39: =ABS((RC[-3]*RC[-11]-RC[-2]*RC[-9])/1000) -> #VALUE! | Y39: =(RC[-14]-RC[1])/RC[-18]*100 -> 1.1721394719025049 | Z39: 19.22 | AC39: =VALUE(RC[-27]) -> 2018-10-18T00:00:00.000 | AD39: =IF(RC[21]=42,"*",IF(RC[21]=32,"",RC[21])) -> - | AE39: =RC[-28] -> 24 | AF39: =RC[-28] -> 258.31 | AG39: =RC[-28] -> 70.709999999999994 | AH39: =RC[-28] -> 8.1300000000000008 | AI39: =RC[-28] -> 236.32 | AJ39: =RC[-28] -> 52.38 | AK39: =RC[-28] -> 5.37 | AL39: =RC[-28] -> 18.329999999999991 | AM39: =RC[-28] -> 21.99 | AN39: =RC[-28] -> 19.649999999999999 | AO39: =RC[-28] -> 70.84 | AP39: - | AQ39: =RC[-29] -> 0 | AR39: =RC[-29] -> 0 | AS39: - | AT39: =RC[-30] -> 0 | AU39: =RC[-30] -> 0 | AV39: =RC[-30] -> 1.361 | AW39: =RC[-30] -> 5.8979999999999997 | AY39: - | AZ39: - | BA39: -
A40: =IF(RC[1]="","",DATEVALUE(RC[1])) -> 43392 | B40: 19.10.18 | C40: 24 | D40: 257.61 | E40: 70.52 | F40: 8.1199999999999992 | G40: 236.06 | H40: 51.93 | I40: 5.38 | J40: =RC[-5]-RC[-2] -> 18.589999999999996 | K40: 21.55 | L40: 19.8 | M40: 70.55 | R40: 1.367 | S40: 5.915 | T40: =(RC[-16]*RC[-15]-RC[-13]*RC[-12])/1000 -> 5.908061400000002 | U40: 19.37 | V40: - | W40: =RC[-2]*RC[-10]/1000 -> 1.3665535 | X40: =ABS((RC[-3]*RC[-11]-RC[-2]*RC[-9])/1000) -> #VALUE! | Y40: =(RC[-14]-RC[1])/RC[-18]*100 -> 0.92349402694230265 | Z40: 19.37 | AC40: =VALUE(RC[-27]) -> 2018-10-19T00:00:00.000 | AD40: =IF(RC[21]=42,"*",IF(RC[21]=32,"",RC[21])) -> - | AE40: =RC[-28] -> 24 | AF40: =RC[-28] -> 257.61 | AG40: =RC[-28] -> 70.52 | AH40: =RC[-28] -> 8.1199999999999992 | AI40: =RC[-28] -> 236.06 | AJ40: =RC[-28] -> 51.93 | AK40: =RC[-28] -> 5.38 | AL40: =RC[-28] -> 18.589999999999996 | AM40: =RC[-28] -> 21.55 | AN40: =RC[-28] -> 19.8 | AO40: =RC[-28] -> 70.55 | AP40: - | AQ40: =RC[-29] -> 0 | AR40: =RC[-29] -> 0 | AS40: - | AT40: =RC[-30] -> 0 | AU40: =RC[-30] -> 0 | AV40: =RC[-30] -> 1.367 | AW40: =RC[-30] -> 5.915 | AY40: - | AZ40: - | BA40: -
A41: =IF(RC[1]="","",DATEVALUE(RC[1])) -> 43393 | B41: 20.10.18 | C41: 24 | D41: 247.3 | E41: 69.91 | F41: 7.93 | G41: 225.23 | H41: 50.65 | I41: 5.45 | J41: =RC[-5]-RC[-2] -> 19.259999999999998 | K41: 22.07 | L41: 20.76 | M41: 70.06 | R41: 1.425 | S41: 5.8879999999999999 | T41: =(RC[-16]*RC[-15]-RC[-13]*RC[-12])/1000 -> 5.8808434999999992 | U41: 20.329999999999998 | V41: - | W41: =RC[-2]*RC[-10]/1000 -> 1.4243197999999999 | X41: =ABS((RC[-3]*RC[-11]-RC[-2]*RC[-9])/1000) -> #VALUE! | Y41: =(RC[-14]-RC[1])/RC[-18]*100 -> 0.77254362207521288 | Z41: 20.329999999999998 | AC41: =VALUE(RC[-27]) -> 2018-10-20T00:00:00.000 | AD41: =IF(RC[21]=42,"*",IF(RC[21]=32,"",RC[21])) -> - | AE41: =RC[-28] -> 24 | AF41: =RC[-28] -> 247.3 | AG41: =RC[-28] -> 69.91 | AH41: =RC[-28] -> 7.93 | AI41: =RC[-28] -> 225.23 | AJ41: =RC[-28] -> 50.65 | AK41: =RC[-28] -> 5.45 | AL41: =RC[-28] -> 19.259999999999998 | AM41: =RC[-28] -> 22.07 | AN41: =RC[-28] -> 20.76 | AO41: =RC[-28] -> 70.06 | AP41: - | AQ41: =RC[-29] -> 0 | AR41: =RC[-29] -> 0 | AS41: - | AT41: =RC[-30] -> 0 | AU41: =RC[-30] -> 0 | AV41: =RC[-30] -> 1.425 | AW41: =RC[-30] -> 5.8879999999999999 | AY41: - | AZ41: - | BA41: -
A42: =IF(RC[1]="","",DATEVALUE(RC[1])) -> 43394 | B42: 21.10.18 | C42: 24 | D42: 248.25 | E42: 69.03 | F42: 7.93 | G42: 223.81 | H42: 49.99 | I42: 5.48 | J42: =RC[-5]-RC[-2] -> 19.04 | K42: 24.44 | L42: 23.15 | M42: 69.16 | R42: 1.5669999999999999 | S42: 5.9569999999999999 | T42: =(RC[-16]*RC[-15]-RC[-13]*RC[-12])/1000 -> 5.9484356000000007 | U42: 22.67 | V42: - | W42: =RC[-2]*RC[-10]/1000 -> 1.5678572000000002 | X42: =ABS((RC[-3]*RC[-11]-RC[-2]*RC[-9])/1000) -> #VALUE! | Y42: =(RC[-14]-RC[1])/RC[-18]*100 -> 0.79084938117152925 | Z42: 22.67 | AC42: =VALUE(RC[-27]) -> 2018-10-21T00:00:00.000 | AD42: =IF(RC[21]=42,"*",IF(RC[21]=32,"",RC[21])) -> - | AE42: =RC[-28] -> 24 | AF42: =RC[-28] -> 248.25 | AG42: =RC[-28] -> 69.03 | AH42: =RC[-28] -> 7.93 | AI42: =RC[-28] -> 223.81 | AJ42: =RC[-28] -> 49.99 | AK42: =RC[-28] -> 5.48 | AL42: =RC[-28] -> 19.04 | AM42: =RC[-28] -> 24.44 | AN42: =RC[-28] -> 23.15 | AO42: =RC[-28] -> 69.16 | AP42: - | AQ42: =RC[-29] -> 0 | AR42: =RC[-29] -> 0 | AS42: - | AT42: =RC[-30] -> 0 | AU42: =RC[-30] -> 0 | AV42: =RC[-30] -> 1.5669999999999999 | AW42: =RC[-30] -> 5.9569999999999999 | AY42: - | AZ42: - | BA42: -
A43: =IF(RC[1]="","",DATEVALUE(RC[1])) -> 43395 | B43: 22.10.18 | C43: 24 | D43: 244.37 | E43: 69.48 | F43: 7.9 | G43: 221.7 | H43: 50 | I43: 5.51 | J43: =RC[-5]-RC[-2] -> 19.480000000000004 | K43: 22.67 | L43: 21.63 | M43: 69.77 | R43: 1.4750000000000001 | S43: 5.9050000000000002 | T43: =(RC[-16]*RC[-15]-RC[-13]*RC[-12])/1000 -> 5.8938276000000007 | U43: 21.17 | V43: - | W43: =RC[-2]*RC[-10]/1000 -> 1.4770308999999999 | X43: =ABS((RC[-3]*RC[-11]-RC[-2]*RC[-9])/1000) -> #VALUE! | Y43: =(RC[-14]-RC[1])/RC[-18]*100 -> 0.67658998646820023 | Z43: 21.17 | AC43: =VALUE(RC[-27]) -> 2018-10-22T00:00:00.000 | AD43: =IF(RC[21]=42,"*",IF(RC[21]=32,"",RC[21])) -> - | AE43: =RC[-28] -> 24 | AF43: =RC[-28] -> 244.37 | AG43: =RC[-28] -> 69.48 | AH43: =RC[-28] -> 7.9 | AI43: =RC[-28] -> 221.7 | AJ43: =RC[-28] -> 50 | AK43: =RC[-28] -> 5.51 | AL43: =RC[-28] -> 19.480000000000004 | AM43: =RC[-28] -> 22.67 | AN43: =RC[-28] -> 21.63 | AO43: =RC[-28] -> 69.77 | AP43: - | AQ43: =RC[-29] -> 0 | AR43: =RC[-29] -> 0 | AS43: - | AT43: =RC[-30] -> 0 | AU43: =RC[-30] -> 0 | AV43: =RC[-30] -> 1.4750000000000001 | AW43: =RC[-30] -> 5.9050000000000002 | AY43: - | AZ43: - | BA43: -
A44: =IF(RC[1]="","",DATEVALUE(RC[1])) ->  | C44: 24 | J44: =RC[-5]-RC[-2] -> #VALUE! | T44: =(RC[-16]*RC[-15]-RC[-13]*RC[-12])/1000 -> #VALUE! | W44: =RC[-2]*RC[-10]/1000 -> #VALUE! | X44: =ABS((RC[-3]*RC[-11]-RC[-2]*RC[-9])/1000) -> #VALUE! | Y44: =(RC[-14]-RC[1])/RC[-18]*100 -> #VALUE! | AC44: =VALUE(RC[-27]) -> #VALUE! | AD44: =IF(RC[21]=42,"*",IF(RC[21]=32,"",RC[21])) ->  | AE44: =RC[-28] -> 24 | AF44: =RC[-28] ->  | AG44: =RC[-28] ->  | AH44: =RC[-28] ->  | AI44: =RC[-28] ->  | AJ44: =RC[-28] ->  | AK44: =RC[-28] ->  | AL44: =RC[-28] -> #VALUE! | AM44: =RC[-28] ->  | AN44: =RC[-28] ->  | AO44: =RC[-28] ->  | AP44: - | AQ44: =RC[-29] -> 0 | AR44: =RC[-29] -> 0 | AS44: - | AT44: =RC[-30] -> 0 | AU44: =RC[-30] -> 0 | AV44: =RC[-30] ->  | AW44: =RC[-30] -> 
A45: =IF(RC[1]="","",DATEVALUE(RC[1])) ->  | C45: 24 | T45: =(RC[-16]*RC[-15]-RC[-13]*RC[-12])/1000 -> #VALUE! | W45: =RC[-2]*RC[-10]/1000 -> #VALUE! | X45: =ABS((RC[-3]*RC[-11]-RC[-2]*RC[-9])/1000) -> #VALUE! | Y45: =(RC[-14]-RC[1])/RC[-18]*100 -> #VALUE! | AC45: =VALUE(RC[-27]) -> #VALUE! | AD45: =IF(RC[21]=42,"*",IF(RC[21]=32,"",RC[21])) ->  | AE45: =RC[-28] -> 24 | AF45: =RC[-28] ->  | AG45: =RC[-28] ->  | AH45: =RC[-28] ->  | AI45: =RC[-28] ->  | AJ45: =RC[-28] ->  | AK45: =RC[-28] ->  | AL45: =RC[-28] -> 0 | AM45: =RC[-28] ->  | AN45: =RC[-28] ->  | AO45: =RC[-28] ->  | AP45: - | AQ45: =RC[-29] -> 0 | AR45: =RC[-29] -> 0 | AS45: - | AT45: =RC[-30] -> 0 | AU45: =RC[-30] -> 0 | AV45: =RC[-30] ->  | AW45: =RC[-30] -> 
A46: =IF(RC[1]="","",DATEVALUE(RC[1])) ->  | C46: 24 | T46: =(RC[-16]*RC[-15]-RC[-13]*RC[-12])/1000 -> #VALUE! | W46: =RC[-2]*RC[-10]/1000 -> #VALUE! | X46: =ABS((RC[-3]*RC[-11]-RC[-2]*RC[-9])/1000) -> #VALUE! | Y46: =(RC[-14]-RC[1])/RC[-18]*100 -> #VALUE! | AC46: =VALUE(RC[-27]) -> #VALUE! | AD46: =IF(RC[21]=42,"*",IF(RC[21]=32,"",RC[21])) ->  | AE46: =RC[-28] -> 24 | AF46: =RC[-28] ->  | AG46: =RC[-28] ->  | AH46: =RC[-28] ->  | AI46: =RC[-28] ->  | AJ46: =RC[-28] ->  | AK46: =RC[-28] ->  | AL46: =RC[-28] -> 0 | AM46: =RC[-28] ->  | AN46: =RC[-28] ->  | AO46: =RC[-28] ->  | AP46: - | AQ46: =RC[-29] -> 0 | AR46: =RC[-29] -> 0 | AS46: - | AT46: =RC[-30] -> 0 | AU46: =RC[-30] -> 0 | AV46: =RC[-30] ->  | AW46: =RC[-30] -> 
A47: =IF(RC[1]="","",DATEVALUE(RC[1])) ->  | C47: 24 | T47: =(RC[-16]*RC[-15]-RC[-13]*RC[-12])/1000 -> #VALUE! | W47: =RC[-2]*RC[-10]/1000 -> #VALUE! | X47: =ABS((RC[-3]*RC[-11]-RC[-2]*RC[-9])/1000) -> #VALUE! | Y47: =(RC[-14]-RC[1])/RC[-18]*100 -> #VALUE! | AC47: =VALUE(RC[-27]) -> #VALUE! | AD47: =IF(RC[21]=42,"*",IF(RC[21]=32,"",RC[21])) ->  | AE47: =RC[-28] -> 24 | AF47: =RC[-28] ->  | AG47: =RC[-28] ->  | AH47: =RC[-28] ->  | AI47: =RC[-28] ->  | AJ47: =RC[-28] ->  | AK47: =RC[-28] ->  | AL47: =RC[-28] -> 0 | AM47: =RC[-28] ->  | AN47: =RC[-28] ->  | AO47: =RC[-28] ->  | AP47: - | AQ47: =RC[-29] -> 0 | AR47: =RC[-29] -> 0 | AS47: - | AT47: =RC[-30] -> 0 | AU47: =RC[-30] -> 0 | AV47: =RC[-30] ->  | AW47: =RC[-30] -> 
A48: =IF(RC[1]="","",DATEVALUE(RC[1])) ->  | C48: 24 | T48: =(RC[-16]*RC[-15]-RC[-13]*RC[-12])/1000 -> #VALUE! | W48: =RC[-2]*RC[-10]/1000 -> #VALUE! | X48: =ABS((RC[-3]*RC[-11]-RC[-2]*RC[-9])/1000) -> #VALUE! | Y48: =(RC[-14]-RC[1])/RC[-18]*100 -> #VALUE! | AC48: =VALUE(RC[-27]) -> #VALUE! | AD48: =IF(RC[21]=42,"*",IF(RC[21]=32,"",RC[21])) ->  | AE48: =RC[-28] -> 24 | AF48: =RC[-28] ->  | AG48: =RC[-28] ->  | AH48: =RC[-28] ->  | AI48: =RC[-28] ->  | AJ48: =RC[-28] ->  | AK48: =RC[-28] ->  | AL48: =RC[-28] -> 0 | AM48: =RC[-28] ->  | AN48: =RC[-28] ->  | AO48: =RC[-28] ->  | AP48: - | AQ48: =RC[-29] -> 0 | AR48: =RC[-29] -> 0 | AS48: - | AT48: =RC[-30] -> 0 | AU48: =RC[-30] -> 0 | AV48: =RC[-30] ->  | AW48: =RC[-30] -> 
A49: =IF(RC[1]="","",DATEVALUE(RC[1])) ->  | C49: 24 | T49: =(RC[-16]*RC[-15]-RC[-13]*RC[-12])/1000 -> #VALUE! | W49: =RC[-2]*RC[-10]/1000 -> #VALUE! | X49: =ABS((RC[-3]*RC[-11]-RC[-2]*RC[-9])/1000) -> #VALUE! | Y49: =(RC[-14]-RC[1])/RC[-18]*100 -> #VALUE! | AC49: =VALUE(RC[-27]) -> #VALUE! | AD49: =IF(RC[21]=42,"*",IF(RC[21]=32,"",RC[21])) ->  | AE49: =RC[-28] -> 24 | AF49: =RC[-28] ->  | AG49: =RC[-28] ->  | AH49: =RC[-28] ->  | AI49: =RC[-28] ->  | AJ49: =RC[-28] ->  | AK49: =RC[-28] ->  | AL49: =RC[-28] -> 0 | AM49: =RC[-28] ->  | AN49: =RC[-28] ->  | AO49: =RC[-28] ->  | AP49: - | AQ49: =RC[-29] -> 0 | AR49: =RC[-29] -> 0 | AS49: - | AT49: =RC[-30] -> 0 | AU49: =RC[-30] -> 0 | AV49: =RC[-30] ->  | AW49: =RC[-30] -> 
A50: =IF(RC[1]="","",DATEVALUE(RC[1])) ->  | T50: =(RC[-16]*RC[-15]-RC[-13]*RC[-12])/1000 -> #VALUE! | W50: =RC[-2]*RC[-10]/1000 -> #VALUE! | X50: =ABS((RC[-3]*RC[-11]-RC[-2]*RC[-9])/1000) -> #VALUE! | Y50: =(RC[-14]-RC[1])/RC[-18]*100 -> #VALUE! | AC50: =VALUE(RC[-27]) -> #VALUE! | AD50: =IF(RC[21]=42,"*",IF(RC[21]=32,"",RC[21])) ->  | AE50: =RC[-28] ->  | AF50: =RC[-28] ->  | AG50: =RC[-28] ->  | AH50: =RC[-28] ->  | AI50: =RC[-28] ->  | AJ50: =RC[-28] ->  | AK50: =RC[-28] ->  | AL50: =RC[-28] -> 0 | AM50: =RC[-28] ->  | AN50: =RC[-28] ->  | AO50: =RC[-28] ->  | AP50: - | AQ50: =RC[-29] -> 0 | AR50: =RC[-29] -> 0 | AS50: - | AT50: =RC[-30] -> 0 | AU50: =RC[-30] -> 0 | AV50: =RC[-30] ->  | AW50: =RC[-30] -> 
A51: =IF(RC[1]="","",DATEVALUE(RC[1])) ->  | T51: =(RC[-16]*RC[-15]-RC[-13]*RC[-12])/1000 -> #VALUE! | W51: =RC[-2]*RC[-10]/1000 -> #VALUE! | X51: =ABS((RC[-3]*RC[-11]-RC[-2]*RC[-9])/1000) -> #VALUE! | Y51: =(RC[-14]-RC[1])/RC[-18]*100 -> #VALUE! | AC51: =VALUE(RC[-27]) -> #VALUE! | AD51: =IF(RC[21]=42,"*",IF(RC[21]=32,"",RC[21])) ->  | AE51: =RC[-28] ->  | AF51: =RC[-28] ->  | AG51: =RC[-28] ->  | AH51: =RC[-28] ->  | AI51: =RC[-28] ->  | AJ51: =RC[-28] ->  | AK51: =RC[-28] ->  | AL51: =RC[-28] -> 0 | AM51: =RC[-28] ->  | AN51: =RC[-28] ->  | AO51: =RC[-28] ->  | AP51: - | AQ51: =RC[-29] -> 0 | AR51: =RC[-29] -> 0 | AS51: - | AT51: =RC[-30] -> 0 | AU51: =RC[-30] -> 0 | AV51: =RC[-30] ->  | AW51: =RC[-30] -> 
A52: =IF(RC[1]="","",DATEVALUE(RC[1])) ->  | T52: =(RC[-16]*RC[-15]-RC[-13]*RC[-12])/1000 -> #VALUE! | W52: =RC[-2]*RC[-10]/1000 -> #VALUE! | X52: =ABS((RC[-3]*RC[-11]-RC[-2]*RC[-9])/1000) -> #VALUE! | Y52: =(RC[-14]-RC[1])/RC[-18]*100 -> #VALUE! | AC52: =VALUE(RC[-27]) -> #VALUE! | AD52: =IF(RC[21]=42,"*",IF(RC[21]=32,"",RC[21])) ->  | AE52: =RC[-28] ->  | AF52: =RC[-28] ->  | AG52: =RC[-28] ->  | AH52: =RC[-28] ->  | AI52: =RC[-28] ->  | AJ52: =RC[-28] ->  | AK52: =RC[-28] ->  | AL52: =RC[-28] -> 0 | AM52: =RC[-28] ->  | AN52: =RC[-28] ->  | AO52: =RC[-28] ->  | AP52: - | AQ52: =RC[-29] -> 0 | AR52: =RC[-29] -> 0 | AS52: - | AT52: =RC[-30] -> 0 | AU52: =RC[-30] -> 0 | AV52: =RC[-30] ->  | AW52: =RC[-30] -> 
A53: =IF(RC[1]="","",DATEVALUE(RC[1])) ->  | T53: =(RC[-16]*RC[-15]-RC[-13]*RC[-12])/1000 -> #VALUE! | W53: =RC[-2]*RC[-10]/1000 -> #VALUE! | X53: =ABS((RC[-3]*RC[-11]-RC[-2]*RC[-9])/1000) -> #VALUE! | Y53: =(RC[-14]-RC[1])/RC[-18]*100 -> #VALUE! | AC53: =VALUE(RC[-27]) -> #VALUE! | AD53: =IF(RC[21]=42,"*",IF(RC[21]=32,"",RC[21])) ->  | AE53: =RC[-28] ->  | AF53: =RC[-28] ->  | AG53: =RC[-28] ->  | AH53: =RC[-28] ->  | AI53: =RC[-28] ->  | AJ53: =RC[-28] ->  | AK53: =RC[-28] ->  | AL53: =RC[-28] -> 0 | AM53: =RC[-28] ->  | AN53: =RC[-28] ->  | AO53: =RC[-28] ->  | AP53: - | AQ53: =RC[-29] -> 0 | AR53: =RC[-29] -> 0 | AS53: - | AT53: =RC[-30] -> 0 | AU53: =RC[-30] -> 0 | AV53: =RC[-30] ->  | AW53: =RC[-30] -> 
A54: =IF(RC[1]="","",DATEVALUE(RC[1])) ->  | T54: =(RC[-16]*RC[-15]-RC[-13]*RC[-12])/1000 -> #VALUE! | W54: =RC[-2]*RC[-10]/1000 -> #VALUE! | X54: =ABS((RC[-3]*RC[-11]-RC[-2]*RC[-9])/1000) -> #VALUE! | Y54: =(RC[-14]-RC[1])/RC[-18]*100 -> #VALUE! | AC54: =VALUE(RC[-27]) -> #VALUE! | AD54: =IF(RC[21]=42,"*",IF(RC[21]=32,"",RC[21])) ->  | AE54: =RC[-28] ->  | AF54: =RC[-28] ->  | AG54: =RC[-28] ->  | AH54: =RC[-28] ->  | AI54: =RC[-28] ->  | AJ54: =RC[-28] ->  | AK54: =RC[-28] ->  | AL54: =RC[-28] -> 0 | AM54: =RC[-28] ->  | AN54: =RC[-28] ->  | AO54: =RC[-28] ->  | AP54: - | AQ54: =RC[-29] -> 0 | AR54: =RC[-29] -> 0 | AS54: - | AT54: =RC[-30] -> 0 | AU54: =RC[-30] -> 0 | AV54: =RC[-30] ->  | AW54: =RC[-30] -> 
A55: =IF(RC[1]="","",DATEVALUE(RC[1])) ->  | T55: =(RC[-16]*RC[-15]-RC[-13]*RC[-12])/1000 -> #VALUE! | W55: =RC[-2]*RC[-10]/1000 -> #VALUE! | X55: =ABS((RC[-3]*RC[-11]-RC[-2]*RC[-9])/1000) -> #VALUE! | Y55: =(RC[-14]-RC[1])/RC[-18]*100 -> #VALUE! | AC55: =VALUE(RC[-27]) -> #VALUE! | AD55: =IF(RC[21]=42,"*",IF(RC[21]=32,"",RC[21])) ->  | AE55: =RC[-28] ->  | AF55: =RC[-28] ->  | AG55: =RC[-28] ->  | AH55: =RC[-28] ->  | AI55: =RC[-28] ->  | AJ55: =RC[-28] ->  | AK55: =RC[-28] ->  | AL55: =RC[-28] -> 0 | AM55: =RC[-28] ->  | AN55: =RC[-28] ->  | AO55: =RC[-28] ->  | AP55: - | AQ55: =RC[-29] -> 0 | AR55: =RC[-29] -> 0 | AS55: - | AT55: =RC[-30] -> 0 | AU55: =RC[-30] -> 0 | AV55: =RC[-30] ->  | AW55: =RC[-30] -> 
A56: =IF(RC[1]="","",DATEVALUE(RC[1])) ->  | T56: =(RC[-16]*RC[-15]-RC[-13]*RC[-12])/1000 -> #VALUE! | W56: =RC[-2]*RC[-10]/1000 -> #VALUE! | X56: =ABS((RC[-3]*RC[-11]-RC[-2]*RC[-9])/1000) -> #VALUE! | Y56: =(RC[-14]-RC[1])/RC[-18]*100 -> #VALUE! | AC56: =VALUE(RC[-27]) -> #VALUE! | AD56: =IF(RC[21]=42,"*",IF(RC[21]=32,"",RC[21])) ->  | AE56: =RC[-28] ->  | AF56: =RC[-28] ->  | AG56: =RC[-28] ->  | AH56: =RC[-28] ->  | AI56: =RC[-28] ->  | AJ56: =RC[-28] ->  | AK56: =RC[-28] ->  | AL56: =RC[-28] -> 0 | AM56: =RC[-28] ->  | AN56: =RC[-28] ->  | AO56: =RC[-28] ->  | AP56: - | AQ56: =RC[-29] -> 0 | AR56: =RC[-29] -> 0 | AS56: - | AT56: =RC[-30] -> 0 | AU56: =RC[-30] -> 0 | AV56: =RC[-30] ->  | AW56: =RC[-30] -> 
A57: =IF(RC[1]="","",DATEVALUE(RC[1])) ->  | T57: =(RC[-16]*RC[-15]-RC[-13]*RC[-12])/1000 -> #VALUE! | W57: =RC[-2]*RC[-10]/1000 -> #VALUE! | X57: =ABS((RC[-3]*RC[-11]-RC[-2]*RC[-9])/1000) -> #VALUE! | Y57: =(RC[-14]-RC[1])/RC[-18]*100 -> #VALUE! | AC57: =VALUE(RC[-27]) -> #VALUE! | AD57: =IF(RC[21]=42,"*",IF(RC[21]=32,"",RC[21])) ->  | AE57: =RC[-28] ->  | AF57: =RC[-28] ->  | AG57: =RC[-28] ->  | AH57: =RC[-28] ->  | AI57: =RC[-28] ->  | AJ57: =RC[-28] ->  | AK57: =RC[-28] ->  | AL57: =RC[-28] -> 0 | AM57: =RC[-28] ->  | AN57: =RC[-28] ->  | AO57: =RC[-28] ->  | AP57: - | AQ57: =RC[-29] -> 0 | AR57: =RC[-29] -> 0 | AS57: - | AT57: =RC[-30] -> 0 | AU57: =RC[-30] -> 0 | AV57: =RC[-30] ->  | AW57: =RC[-30] -> 
A58: =IF(RC[1]="","",DATEVALUE(RC[1])) ->  | T58: =(RC[-16]*RC[-15]-RC[-13]*RC[-12])/1000 -> #VALUE! | W58: =RC[-2]*RC[-10]/1000 -> #VALUE! | X58: =ABS((RC[-3]*RC[-11]-RC[-2]*RC[-9])/1000) -> #VALUE! | Y58: =(RC[-14]-RC[1])/RC[-18]*100 -> #VALUE! | AC58: =VALUE(RC[-27]) -> #VALUE! | AD58: =IF(RC[21]=42,"*",IF(RC[21]=32,"",RC[21])) ->  | AE58: =RC[-28] ->  | AF58: =RC[-28] ->  | AG58: =RC[-28] ->  | AH58: =RC[-28] ->  | AI58: =RC[-28] ->  | AJ58: =RC[-28] ->  | AK58: =RC[-28] ->  | AL58: =RC[-28] -> 0 | AM58: =RC[-28] ->  | AN58: =RC[-28] ->  | AO58: =RC[-28] ->  | AP58: - | AQ58: =RC[-29] -> 0 | AR58: =RC[-29] -> 0 | AS58: - | AT58: =RC[-30] -> 0 | AU58: =RC[-30] -> 0 | AV58: =RC[-30] ->  | AW58: =RC[-30] -> 
A59: =IF(RC[1]="","",DATEVALUE(RC[1])) ->  | T59: =(RC[-16]*RC[-15]-RC[-13]*RC[-12])/1000 -> #VALUE! | W59: =RC[-2]*RC[-10]/1000 -> #VALUE! | X59: =ABS((RC[-3]*RC[-11]-RC[-2]*RC[-9])/1000) -> #VALUE! | Y59: =(RC[-14]-RC[1])/RC[-18]*100 -> #VALUE! | AC59: =VALUE(RC[-27]) -> #VALUE! | AD59: =IF(RC[21]=42,"*",IF(RC[21]=32,"",RC[21])) ->  | AE59: =RC[-28] ->  | AF59: =RC[-28] ->  | AG59: =RC[-28] ->  | AH59: =RC[-28] ->  | AI59: =RC[-28] ->  | AJ59: =RC[-28] ->  | AK59: =RC[-28] ->  | AL59: =RC[-28] -> 0 | AM59: =RC[-28] ->  | AN59: =RC[-28] ->  | AO59: =RC[-28] ->  | AP59: - | AQ59: =RC[-29] -> 0 | AR59: =RC[-29] -> 0 | AS59: - | AT59: =RC[-30] -> 0 | AU59: =RC[-30] -> 0 | AV59: =RC[-30] ->  | AW59: =RC[-30] -> 
A60: =IF(RC[1]="","",DATEVALUE(RC[1])) ->  | T60: =(RC[-16]*RC[-15]-RC[-13]*RC[-12])/1000 -> #VALUE! | W60: =RC[-2]*RC[-10]/1000 -> #VALUE! | X60: =ABS((RC[-3]*RC[-11]-RC[-2]*RC[-9])/1000) -> #VALUE! | Y60: =(RC[-14]-RC[1])/RC[-18]*100 -> #VALUE! | AC60: =VALUE(RC[-27]) -> #VALUE! | AD60: =IF(RC[21]=42,"*",IF(RC[21]=32,"",RC[21])) ->  | AE60: =RC[-28] ->  | AF60: =RC[-28] ->  | AG60: =RC[-28] ->  | AH60: =RC[-28] ->  | AI60: =RC[-28] ->  | AJ60: =RC[-28] ->  | AK60: =RC[-28] ->  | AL60: =RC[-28] -> 0 | AM60: =RC[-28] ->  | AN60: =RC[-28] ->  | AO60: =RC[-28] ->  | AP60: - | AQ60: =RC[-29] -> 0 | AR60: =RC[-29] -> 0 | AS60: - | AT60: =RC[-30] -> 0 | AU60: =RC[-30] -> 0 | AV60: =RC[-30] ->  | AW60: =RC[-30] -> 
A61: =IF(RC[1]="","",DATEVALUE(RC[1])) ->  | T61: =(RC[-16]*RC[-15]-RC[-13]*RC[-12])/1000 -> #VALUE! | W61: =RC[-2]*RC[-10]/1000 -> #VALUE! | X61: =ABS((RC[-3]*RC[-11]-RC[-2]*RC[-9])/1000) -> #VALUE! | Y61: =(RC[-14]-RC[1])/RC[-18]*100 -> #VALUE! | AC61: =VALUE(RC[-27]) -> #VALUE! | AD61: =IF(RC[21]=42,"*",IF(RC[21]=32,"",RC[21])) ->  | AE61: =RC[-28] ->  | AF61: =RC[-28] ->  | AG61: =RC[-28] ->  | AH61: =RC[-28] ->  | AI61: =RC[-28] ->  | AJ61: =RC[-28] ->  | AK61: =RC[-28] ->  | AL61: =RC[-28] -> 0 | AM61: =RC[-28] ->  | AN61: =RC[-28] ->  | AO61: =RC[-28] ->  | AP61: - | AQ61: =RC[-29] -> 0 | AR61: =RC[-29] -> 0 | AS61: - | AT61: =RC[-30] -> 0 | AU61: =RC[-30] -> 0 | AV61: =RC[-30] ->  | AW61: =RC[-30] -> 
A62: =IF(RC[1]="","",DATEVALUE(RC[1])) ->  | T62: =(RC[-16]*RC[-15]-RC[-13]*RC[-12])/1000 -> #VALUE! | W62: =RC[-2]*RC[-10]/1000 -> #VALUE! | X62: =ABS((RC[-3]*RC[-11]-RC[-2]*RC[-9])/1000) -> #VALUE! | Y62: =(RC[-14]-RC[1])/RC[-18]*100 -> #VALUE! | AC62: =VALUE(RC[-27]) -> #VALUE! | AD62: =IF(RC[21]=42,"*",IF(RC[21]=32,"",RC[21])) ->  | AE62: =RC[-28] ->  | AF62: =RC[-28] ->  | AG62: =RC[-28] ->  | AH62: =RC[-28] ->  | AI62: =RC[-28] ->  | AJ62: =RC[-28] ->  | AK62: =RC[-28] ->  | AL62: =RC[-28] -> 0 | AM62: =RC[-28] ->  | AN62: =RC[-28] ->  | AO62: =RC[-28] ->  | AP62: - | AQ62: =RC[-29] -> 0 | AR62: =RC[-29] -> 0 | AS62: - | AT62: =RC[-30] -> 0 | AU62: =RC[-30] -> 0 | AV62: =RC[-30] ->  | AW62: =RC[-30] -> 
A63: =IF(RC[1]="","",DATEVALUE(RC[1])) ->  | T63: =(RC[-16]*RC[-15]-RC[-13]*RC[-12])/1000 -> #VALUE! | W63: =RC[-2]*RC[-10]/1000 -> #VALUE! | X63: =ABS((RC[-3]*RC[-11]-RC[-2]*RC[-9])/1000) -> #VALUE! | Y63: =(RC[-14]-RC[1])/RC[-18]*100 -> #VALUE! | AC63: =VALUE(RC[-27]) -> #VALUE! | AD63: =IF(RC[21]=42,"*",IF(RC[21]=32,"",RC[21])) ->  | AE63: =RC[-28] ->  | AF63: =RC[-28] ->  | AG63: =RC[-28] ->  | AH63: =RC[-28] ->  | AI63: =RC[-28] ->  | AJ63: =RC[-28] ->  | AK63: =RC[-28] ->  | AL63: =RC[-28] -> 0 | AM63: =RC[-28] ->  | AN63: =RC[-28] ->  | AO63: =RC[-28] ->  | AP63: - | AQ63: =RC[-29] -> 0 | AR63: =RC[-29] -> 0 | AS63: - | AT63: =RC[-30] -> 0 | AU63: =RC[-30] -> 0 | AV63: =RC[-30] ->  | AW63: =RC[-30] -> 
A64: =IF(RC[1]="","",DATEVALUE(RC[1])) ->  | T64: =(RC[-16]*RC[-15]-RC[-13]*RC[-12])/1000 -> #VALUE! | W64: =RC[-2]*RC[-10]/1000 -> #VALUE! | X64: =ABS((RC[-3]*RC[-11]-RC[-2]*RC[-9])/1000) -> #VALUE! | Y64: =(RC[-14]-RC[1])/RC[-18]*100 -> #VALUE! | AC64: =VALUE(RC[-27]) -> #VALUE! | AD64: =IF(RC[21]=42,"*",IF(RC[21]=32,"",RC[21])) ->  | AE64: =RC[-28] ->  | AF64: =RC[-28] ->  | AG64: =RC[-28] ->  | AH64: =RC[-28] ->  | AI64: =RC[-28] ->  | AJ64: =RC[-28] ->  | AK64: =RC[-28] ->  | AL64: =RC[-28] -> 0 | AM64: =RC[-28] ->  | AN64: =RC[-28] ->  | AO64: =RC[-28] ->  | AP64: - | AQ64: =RC[-29] -> 0 | AR64: =RC[-29] -> 0 | AS64: - | AT64: =RC[-30] -> 0 | AU64: =RC[-30] -> 0 | AV64: =RC[-30] ->  | AW64: =RC[-30] -> 
A65: =IF(RC[1]="","",DATEVALUE(RC[1])) ->  | T65: =(RC[-16]*RC[-15]-RC[-13]*RC[-12])/1000 -> #VALUE! | W65: =RC[-2]*RC[-10]/1000 -> #VALUE! | X65: =ABS((RC[-3]*RC[-11]-RC[-2]*RC[-9])/1000) -> #VALUE! | Y65: =(RC[-14]-RC[1])/RC[-18]*100 -> #VALUE! | AC65: =VALUE(RC[-27]) -> #VALUE! | AD65: =IF(RC[21]=42,"*",IF(RC[21]=32,"",RC[21])) ->  | AE65: =RC[-28] ->  | AF65: =RC[-28] ->  | AG65: =RC[-28] ->  | AH65: =RC[-28] ->  | AI65: =RC[-28] ->  | AJ65: =RC[-28] ->  | AK65: =RC[-28] ->  | AL65: =RC[-28] -> 0 | AM65: =RC[-28] ->  | AN65: =RC[-28] ->  | AO65: =RC[-28] ->  | AP65: - | AQ65: =RC[-29] -> 0 | AR65: =RC[-29] -> 0 | AS65: - | AT65: =RC[-30] -> 0 | AU65: =RC[-30] -> 0 | AV65: =RC[-30] ->  | AW65: =RC[-30] -> 
A66: =IF(RC[1]="","",DATEVALUE(RC[1])) ->  | T66: =(RC[-16]*RC[-15]-RC[-13]*RC[-12])/1000 -> #VALUE! | W66: =RC[-2]*RC[-10]/1000 -> #VALUE! | X66: =ABS((RC[-3]*RC[-11]-RC[-2]*RC[-9])/1000) -> #VALUE! | Y66: =(RC[-14]-RC[1])/RC[-18]*100 -> #VALUE! | AC66: =VALUE(RC[-27]) -> #VALUE! | AD66: =IF(RC[21]=42,"*",IF(RC[21]=32,"",RC[21])) ->  | AE66: =RC[-28] ->  | AF66: =RC[-28] ->  | AG66: =RC[-28] ->  | AH66: =RC[-28] ->  | AI66: =RC[-28] ->  | AJ66: =RC[-28] ->  | AK66: =RC[-28] ->  | AL66: =RC[-28] -> 0 | AM66: =RC[-28] ->  | AN66: =RC[-28] ->  | AO66: =RC[-28] ->  | AP66: - | AQ66: =RC[-29] -> 0 | AR66: =RC[-29] -> 0 | AS66: - | AT66: =RC[-30] -> 0 | AU66: =RC[-30] -> 0 | AV66: =RC[-30] ->  | AW66: =RC[-30] -> 
A67: =IF(RC[1]="","",DATEVALUE(RC[1])) ->  | T67: =(RC[-16]*RC[-15]-RC[-13]*RC[-12])/1000 -> #VALUE! | W67: =RC[-2]*RC[-10]/1000 -> #VALUE! | X67: =ABS((RC[-3]*RC[-11]-RC[-2]*RC[-9])/1000) -> #VALUE! | Y67: =(RC[-14]-RC[1])/RC[-18]*100 -> #VALUE! | AC67: =VALUE(RC[-27]) -> #VALUE! | AD67: =IF(RC[21]=42,"*",IF(RC[21]=32,"",RC[21])) ->  | AE67: =RC[-28] ->  | AF67: =RC[-28] ->  | AG67: =RC[-28] ->  | AH67: =RC[-28] ->  | AI67: =RC[-28] ->  | AJ67: =RC[-28] ->  | AK67: =RC[-28] ->  | AL67: =RC[-28] -> 0 | AM67: =RC[-28] ->  | AN67: =RC[-28] ->  | AO67: =RC[-28] ->  | AP67: - | AQ67: =RC[-29] -> 0 | AR67: =RC[-29] -> 0 | AS67: - | AT67: =RC[-30] -> 0 | AU67: =RC[-30] -> 0 | AV67: =RC[-30] ->  | AW67: =RC[-30] -> 
A68: =IF(RC[1]="","",DATEVALUE(RC[1])) ->  | T68: =(RC[-16]*RC[-15]-RC[-13]*RC[-12])/1000 -> #VALUE! | W68: =RC[-2]*RC[-10]/1000 -> #VALUE! | X68: =ABS((RC[-3]*RC[-11]-RC[-2]*RC[-9])/1000) -> #VALUE! | Y68: =(RC[-14]-RC[1])/RC[-18]*100 -> #VALUE! | AC68: =VALUE(RC[-27]) -> #VALUE! | AD68: =IF(RC[21]=42,"*",IF(RC[21]=32,"",RC[21])) ->  | AE68: =RC[-28] ->  | AF68: =RC[-28] ->  | AG68: =RC[-28] ->  | AH68: =RC[-28] ->  | AI68: =RC[-28] ->  | AJ68: =RC[-28] ->  | AK68: =RC[-28] ->  | AL68: =RC[-28] -> 0 | AM68: =RC[-28] ->  | AN68: =RC[-28] ->  | AO68: =RC[-28] ->  | AP68: - | AQ68: =RC[-29] -> 0 | AR68: =RC[-29] -> 0 | AS68: - | AT68: =RC[-30] -> 0 | AU68: =RC[-30] -> 0 | AV68: =RC[-30] ->  | AW68: =RC[-30] -> 
A69: =IF(RC[1]="","",DATEVALUE(RC[1])) ->  | T69: =(RC[-16]*RC[-15]-RC[-13]*RC[-12])/1000 -> #VALUE! | W69: =RC[-2]*RC[-10]/1000 -> #VALUE! | X69: =ABS((RC[-3]*RC[-11]-RC[-2]*RC[-9])/1000) -> #VALUE! | Y69: =(RC[-14]-RC[1])/RC[-18]*100 -> #VALUE! | AC69: =VALUE(RC[-27]) -> #VALUE! | AD69: =IF(RC[21]=42,"*",IF(RC[21]=32,"",RC[21])) ->  | AE69: =RC[-28] ->  | AF69: =RC[-28] ->  | AG69: =RC[-28] ->  | AH69: =RC[-28] ->  | AI69: =RC[-28] ->  | AJ69: =RC[-28] ->  | AK69: =RC[-28] ->  | AL69: =RC[-28] -> 0 | AM69: =RC[-28] ->  | AN69: =RC[-28] ->  | AO69: =RC[-28] ->  | AP69: - | AQ69: =RC[-29] -> 0 | AR69: =RC[-29] -> 0 | AS69: - | AT69: =RC[-30] -> 0 | AU69: =RC[-30] -> 0 | AV69: =RC[-30] ->  | AW69: =RC[-30] -> 
A70: =IF(RC[1]="","",DATEVALUE(RC[1])) ->  | T70: =(RC[-16]*RC[-15]-RC[-13]*RC[-12])/1000 -> #VALUE! | W70: =RC[-2]*RC[-10]/1000 -> #VALUE! | X70: =ABS((RC[-3]*RC[-11]-RC[-2]*RC[-9])/1000) -> #VALUE! | Y70: =(RC[-14]-RC[1])/RC[-18]*100 -> #VALUE! | AC70: =VALUE(RC[-27]) -> #VALUE! | AD70: =IF(RC[21]=42,"*",IF(RC[21]=32,"",RC[21])) ->  | AE70: =RC[-28] ->  | AF70: =RC[-28] ->  | AG70: =RC[-28] ->  | AH70: =RC[-28] ->  | AI70: =RC[-28] ->  | AJ70: =RC[-28] ->  | AK70: =RC[-28] ->  | AL70: =RC[-28] -> 0 | AM70: =RC[-28] ->  | AN70: =RC[-28] ->  | AO70: =RC[-28] ->  | AP70: - | AQ70: =RC[-29] -> 0 | AR70: =RC[-29] -> 0 | AS70: - | AT70: =RC[-30] -> 0 | AU70: =RC[-30] -> 0 | AV70: =RC[-30] ->  | AW70: =RC[-30] -> 
A71: =IF(RC[1]="","",DATEVALUE(RC[1])) ->  | T71: =(RC[-16]*RC[-15]-RC[-13]*RC[-12])/1000 -> #VALUE! | W71: =RC[-2]*RC[-10]/1000 -> #VALUE! | X71: =ABS((RC[-3]*RC[-11]-RC[-2]*RC[-9])/1000) -> #VALUE! | Y71: =(RC[-14]-RC[1])/RC[-18]*100 -> #VALUE! | AC71: =VALUE(RC[-27]) -> #VALUE! | AD71: =IF(RC[21]=42,"*",IF(RC[21]=32,"",RC[21])) ->  | AE71: =RC[-28] ->  | AF71: =RC[-28] ->  | AG71: =RC[-28] ->  | AH71: =RC[-28] ->  | AI71: =RC[-28] ->  | AJ71: =RC[-28] ->  | AK71: =RC[-28] ->  | AL71: =RC[-28] -> 0 | AM71: =RC[-28] ->  | AN71: =RC[-28] ->  | AO71: =RC[-28] ->  | AP71: - | AQ71: =RC[-29] -> 0 | AR71: =RC[-29] -> 0 | AS71: - | AT71: =RC[-30] -> 0 | AU71: =RC[-30] -> 0 | AV71: =RC[-30] ->  | AW71: =RC[-30] -> 
A72: =IF(RC[1]="","",DATEVALUE(RC[1])) ->  | T72: =(RC[-16]*RC[-15]-RC[-13]*RC[-12])/1000 -> #VALUE! | W72: =RC[-2]*RC[-10]/1000 -> #VALUE! | X72: =ABS((RC[-3]*RC[-11]-RC[-2]*RC[-9])/1000) -> #VALUE! | Y72: =(RC[-14]-RC[1])/RC[-18]*100 -> #VALUE! | AC72: =VALUE(RC[-27]) -> #VALUE! | AD72: =IF(RC[21]=42,"*",IF(RC[21]=32,"",RC[21])) ->  | AE72: =RC[-28] ->  | AF72: =RC[-28] ->  | AG72: =RC[-28] ->  | AH72: =RC[-28] ->  | AI72: =RC[-28] ->  | AJ72: =RC[-28] ->  | AK72: =RC[-28] ->  | AL72: =RC[-28] -> 0 | AM72: =RC[-28] ->  | AN72: =RC[-28] ->  | AO72: =RC[-28] ->  | AP72: - | AQ72: =RC[-29] -> 0 | AR72: =RC[-29] -> 0 | AS72: - | AT72: =RC[-30] -> 0 | AU72: =RC[-30] -> 0 | AV72: =RC[-30] ->  | AW72: =RC[-30] -> 
A73: =IF(RC[1]="","",DATEVALUE(RC[1])) ->  | T73: =(RC[-16]*RC[-15]-RC[-13]*RC[-12])/1000 -> #VALUE! | W73: =RC[-2]*RC[-10]/1000 -> #VALUE! | X73: =ABS((RC[-3]*RC[-11]-RC[-2]*RC[-9])/1000) -> #VALUE! | Y73: =(RC[-14]-RC[1])/RC[-18]*100 -> #VALUE! | AC73: =VALUE(RC[-27]) -> #VALUE! | AD73: =IF(RC[21]=42,"*",IF(RC[21]=32,"",RC[21])) ->  | AE73: =RC[-28] ->  | AF73: =RC[-28] ->  | AG73: =RC[-28] ->  | AH73: =RC[-28] ->  | AI73: =RC[-28] ->  | AJ73: =RC[-28] ->  | AK73: =RC[-28] ->  | AL73: =RC[-28] -> 0 | AM73: =RC[-28] ->  | AN73: =RC[-28] ->  | AO73: =RC[-28] ->  | AP73: - | AQ73: =RC[-29] -> 0 | AR73: =RC[-29] -> 0 | AS73: - | AT73: =RC[-30] -> 0 | AU73: =RC[-30] -> 0 | AV73: =RC[-30] ->  | AW73: =RC[-30] -> 
A74: =IF(RC[1]="","",DATEVALUE(RC[1])) ->  | T74: =(RC[-16]*RC[-15]-RC[-13]*RC[-12])/1000 -> #VALUE! | W74: =RC[-2]*RC[-10]/1000 -> #VALUE! | X74: =ABS((RC[-3]*RC[-11]-RC[-2]*RC[-9])/1000) -> #VALUE! | Y74: =(RC[-14]-RC[1])/RC[-18]*100 -> #VALUE! | AC74: =VALUE(RC[-27]) -> #VALUE! | AD74: =IF(RC[21]=42,"*",IF(RC[21]=32,"",RC[21])) ->  | AE74: =RC[-28] ->  | AF74: =RC[-28] ->  | AG74: =RC[-28] ->  | AH74: =RC[-28] ->  | AI74: =RC[-28] ->  | AJ74: =RC[-28] ->  | AK74: =RC[-28] ->  | AL74: =RC[-28] -> 0 | AM74: =RC[-28] ->  | AN74: =RC[-28] ->  | AO74: =RC[-28] ->  | AP74: - | AQ74: =RC[-29] -> 0 | AR74: =RC[-29] -> 0 | AS74: - | AT74: =RC[-30] -> 0 | AU74: =RC[-30] -> 0 | AV74: =RC[-30] ->  | AW74: =RC[-30] -> 
A75: =IF(RC[1]="","",DATEVALUE(RC[1])) ->  | T75: =(RC[-16]*RC[-15]-RC[-13]*RC[-12])/1000 -> #VALUE! | W75: =RC[-2]*RC[-10]/1000 -> #VALUE! | X75: =ABS((RC[-3]*RC[-11]-RC[-2]*RC[-9])/1000) -> #VALUE! | Y75: =(RC[-14]-RC[1])/RC[-18]*100 -> #VALUE! | AC75: =VALUE(RC[-27]) -> #VALUE! | AD75: =IF(RC[21]=42,"*",IF(RC[21]=32,"",RC[21])) ->  | AE75: =RC[-28] ->  | AF75: =RC[-28] ->  | AG75: =RC[-28] ->  | AH75: =RC[-28] ->  | AI75: =RC[-28] ->  | AJ75: =RC[-28] ->  | AK75: =RC[-28] ->  | AL75: =RC[-28] -> 0 | AM75: =RC[-28] ->  | AN75: =RC[-28] ->  | AO75: =RC[-28] ->  | AP75: - | AQ75: =RC[-29] -> 0 | AR75: =RC[-29] -> 0 | AS75: - | AT75: =RC[-30] -> 0 | AU75: =RC[-30] -> 0 | AV75: =RC[-30] ->  | AW75: =RC[-30] -> 
A76: =IF(RC[1]="","",DATEVALUE(RC[1])) ->  | T76: =(RC[-16]*RC[-15]-RC[-13]*RC[-12])/1000 -> #VALUE! | W76: =RC[-2]*RC[-10]/1000 -> #VALUE! | X76: =ABS((RC[-3]*RC[-11]-RC[-2]*RC[-9])/1000) -> #VALUE! | Y76: =(RC[-14]-RC[1])/RC[-18]*100 -> #VALUE! | AC76: =VALUE(RC[-27]) -> #VALUE! | AD76: =IF(RC[21]=42,"*",IF(RC[21]=32,"",RC[21])) ->  | AE76: =RC[-28] ->  | AF76: =RC[-28] ->  | AG76: =RC[-28] ->  | AH76: =RC[-28] ->  | AI76: =RC[-28] ->  | AJ76: =RC[-28] ->  | AK76: =RC[-28] ->  | AL76: =RC[-28] -> 0 | AM76: =RC[-28] ->  | AN76: =RC[-28] ->  | AO76: =RC[-28] ->  | AP76: - | AQ76: =RC[-29] -> 0 | AR76: =RC[-29] -> 0 | AS76: - | AT76: =RC[-30] -> 0 | AU76: =RC[-30] -> 0 | AV76: =RC[-30] ->  | AW76: =RC[-30] -> 
A77: =IF(RC[1]="","",DATEVALUE(RC[1])) ->  | T77: =(RC[-16]*RC[-15]-RC[-13]*RC[-12])/1000 -> #VALUE! | W77: =RC[-2]*RC[-10]/1000 -> #VALUE! | X77: =ABS((RC[-3]*RC[-11]-RC[-2]*RC[-9])/1000) -> #VALUE! | Y77: =(RC[-14]-RC[1])/RC[-18]*100 -> #VALUE! | AC77: =VALUE(RC[-27]) -> #VALUE! | AD77: =IF(RC[21]=42,"*",IF(RC[21]=32,"",RC[21])) ->  | AE77: =RC[-28] ->  | AF77: =RC[-28] ->  | AG77: =RC[-28] ->  | AH77: =RC[-28] ->  | AI77: =RC[-28] ->  | AJ77: =RC[-28] ->  | AK77: =RC[-28] ->  | AL77: =RC[-28] -> 0 | AM77: =RC[-28] ->  | AN77: =RC[-28] ->  | AO77: =RC[-28] ->  | AP77: - | AQ77: =RC[-29] -> 0 | AR77: =RC[-29] -> 0 | AS77: - | AT77: =RC[-30] -> 0 | AU77: =RC[-30] -> 0 | AV77: =RC[-30] ->  | AW77: =RC[-30] -> 
A78: =IF(RC[1]="","",DATEVALUE(RC[1])) ->  | T78: =(RC[-16]*RC[-15]-RC[-13]*RC[-12])/1000 -> #VALUE! | W78: =RC[-2]*RC[-10]/1000 -> #VALUE! | X78: =ABS((RC[-3]*RC[-11]-RC[-2]*RC[-9])/1000) -> #VALUE! | Y78: =(RC[-14]-RC[1])/RC[-18]*100 -> #VALUE! | AC78: =VALUE(RC[-27]) -> #VALUE! | AD78: =IF(RC[21]=42,"*",IF(RC[21]=32,"",RC[21])) ->  | AE78: =RC[-28] ->  | AF78: =RC[-28] ->  | AG78: =RC[-28] ->  | AH78: =RC[-28] ->  | AI78: =RC[-28] ->  | AJ78: =RC[-28] ->  | AK78: =RC[-28] ->  | AL78: =RC[-28] -> 0 | AM78: =RC[-28] ->  | AN78: =RC[-28] ->  | AO78: =RC[-28] ->  | AP78: - | AQ78: =RC[-29] -> 0 | AR78: =RC[-29] -> 0 | AS78: - | AT78: =RC[-30] -> 0 | AU78: =RC[-30] -> 0 | AV78: =RC[-30] ->  | AW78: =RC[-30] -> 
A79: =IF(RC[1]="","",DATEVALUE(RC[1])) ->  | T79: =(RC[-16]*RC[-15]-RC[-13]*RC[-12])/1000 -> #VALUE! | W79: =RC[-2]*RC[-10]/1000 -> #VALUE! | X79: =ABS((RC[-3]*RC[-11]-RC[-2]*RC[-9])/1000) -> #VALUE! | Y79: =(RC[-14]-RC[1])/RC[-18]*100 -> #VALUE! | AC79: =VALUE(RC[-27]) -> #VALUE! | AD79: =IF(RC[21]=42,"*",IF(RC[21]=32,"",RC[21])) ->  | AE79: =RC[-28] ->  | AF79: =RC[-28] ->  | AG79: =RC[-28] ->  | AH79: =RC[-28] ->  | AI79: =RC[-28] ->  | AJ79: =RC[-28] ->  | AK79: =RC[-28] ->  | AL79: =RC[-28] -> 0 | AM79: =RC[-28] ->  | AN79: =RC[-28] ->  | AO79: =RC[-28] ->  | AP79: - | AQ79: =RC[-29] -> 0 | AR79: =RC[-29] -> 0 | AS79: - | AT79: =RC[-30] -> 0 | AU79: =RC[-30] -> 0 | AV79: =RC[-30] ->  | AW79: =RC[-30] -> 
A80: =IF(RC[1]="","",DATEVALUE(RC[1])) ->  | T80: =(RC[-16]*RC[-15]-RC[-13]*RC[-12])/1000 -> #VALUE! | W80: =RC[-2]*RC[-10]/1000 -> #VALUE! | X80: =ABS((RC[-3]*RC[-11]-RC[-2]*RC[-9])/1000) -> #VALUE! | Y80: =(RC[-14]-RC[1])/RC[-18]*100 -> #VALUE! | AC80: =VALUE(RC[-27]) -> #VALUE! | AD80: =IF(RC[21]=42,"*",IF(RC[21]=32,"",RC[21])) ->  | AE80: =RC[-28] ->  | AF80: =RC[-28] ->  | AG80: =RC[-28] ->  | AH80: =RC[-28] ->  | AI80: =RC[-28] ->  | AJ80: =RC[-28] ->  | AK80: =RC[-28] ->  | AL80: =RC[-28] -> 0 | AM80: =RC[-28] ->  | AN80: =RC[-28] ->  | AO80: =RC[-28] ->  | AP80: - | AQ80: =RC[-29] -> 0 | AR80: =RC[-29] -> 0 | AS80: - | AT80: =RC[-30] -> 0 | AU80: =RC[-30] -> 0 | AV80: =RC[-30] ->  | AW80: =RC[-30] -> 
A81: =IF(RC[1]="","",DATEVALUE(RC[1])) ->  | T81: =(RC[-16]*RC[-15]-RC[-13]*RC[-12])/1000 -> #VALUE! | W81: =RC[-2]*RC[-10]/1000 -> #VALUE! | X81: =ABS((RC[-3]*RC[-11]-RC[-2]*RC[-9])/1000) -> #VALUE! | Y81: =(RC[-14]-RC[1])/RC[-18]*100 -> #VALUE! | AC81: =VALUE(RC[-27]) -> #VALUE! | AD81: =IF(RC[21]=42,"*",IF(RC[21]=32,"",RC[21])) ->  | AE81: =RC[-28] ->  | AF81: =RC[-28] ->  | AG81: =RC[-28] ->  | AH81: =RC[-28] ->  | AI81: =RC[-28] ->  | AJ81: =RC[-28] ->  | AK81: =RC[-28] ->  | AL81: =RC[-28] -> 0 | AM81: =RC[-28] ->  | AN81: =RC[-28] ->  | AO81: =RC[-28] ->  | AP81: - | AQ81: =RC[-29] -> 0 | AR81: =RC[-29] -> 0 | AS81: - | AT81: =RC[-30] -> 0 | AU81: =RC[-30] -> 0 | AV81: =RC[-30] ->  | AW81: =RC[-30] -> 
A82: =IF(RC[1]="","",DATEVALUE(RC[1])) ->  | T82: =(RC[-16]*RC[-15]-RC[-13]*RC[-12])/1000 -> #VALUE! | W82: =RC[-2]*RC[-10]/1000 -> #VALUE! | X82: =ABS((RC[-3]*RC[-11]-RC[-2]*RC[-9])/1000) -> #VALUE! | Y82: =(RC[-14]-RC[1])/RC[-18]*100 -> #VALUE! | AC82: =VALUE(RC[-27]) -> #VALUE! | AD82: =IF(RC[21]=42,"*",IF(RC[21]=32,"",RC[21])) ->  | AE82: =RC[-28] ->  | AF82: =RC[-28] ->  | AG82: =RC[-28] ->  | AH82: =RC[-28] ->  | AI82: =RC[-28] ->  | AJ82: =RC[-28] ->  | AK82: =RC[-28] ->  | AL82: =RC[-28] -> 0 | AM82: =RC[-28] ->  | AN82: =RC[-28] ->  | AO82: =RC[-28] ->  | AP82: - | AQ82: =RC[-29] -> 0 | AR82: =RC[-29] -> 0 | AS82: - | AT82: =RC[-30] -> 0 | AU82: =RC[-30] -> 0 | AV82: =RC[-30] ->  | AW82: =RC[-30] -> 
A83: =IF(RC[1]="","",DATEVALUE(RC[1])) ->  | T83: =(RC[-16]*RC[-15]-RC[-13]*RC[-12])/1000 -> #VALUE! | W83: =RC[-2]*RC[-10]/1000 -> #VALUE! | X83: =ABS((RC[-3]*RC[-11]-RC[-2]*RC[-9])/1000) -> #VALUE! | Y83: =(RC[-14]-RC[1])/RC[-18]*100 -> #VALUE! | AC83: =VALUE(RC[-27]) -> #VALUE! | AD83: =IF(RC[21]=42,"*",IF(RC[21]=32,"",RC[21])) ->  | AE83: =RC[-28] ->  | AF83: =RC[-28] ->  | AG83: =RC[-28] ->  | AH83: =RC[-28] ->  | AI83: =RC[-28] ->  | AJ83: =RC[-28] ->  | AK83: =RC[-28] ->  | AL83: =RC[-28] -> 0 | AM83: =RC[-28] ->  | AN83: =RC[-28] ->  | AO83: =RC[-28] ->  | AP83: - | AQ83: =RC[-29] -> 0 | AR83: =RC[-29] -> 0 | AS83: - | AT83: =RC[-30] -> 0 | AU83: =RC[-30] -> 0 | AV83: =RC[-30] ->  | AW83: =RC[-30] -> 
AC84: Среднее | AF84: =R[1]C[-28] -> 231.27099999999999 | AG84: =R[1]C[-28] -> 68.242666666666665 | AH84: =R[1]C[-28] -> 8.1673333333333336 | AI84: =R[1]C[-28] -> 209.22933333333333 | AJ84: =R[1]C[-28] -> 48.020666666666671 | AK84: =R[1]C[-28] -> 5.4046666666666665 | AL84: =R[1]C[-28] -> 20.222000000000001 | AM84: =R[1]C[-28] -> 22.041666666666668 | AN84: =R[1]C[-28] -> 21.03833333333333 | AO84: =R[1]C[-28] -> 68.356333333333339 | AP84: - | AQ84: =R[1]C[-29] -> 0 | AR84: =R[1]C[-29] -> 0 | AS84: - | AT84: =R[1]C[-30] -> 0 | AU84: =R[1]C[-30] -> 0
B85: Среднее | D85: =AVERAGE(OFFSET(R[-74]C,3,0,R7C1,1)) -> 231.27099999999999 | E85: =AVERAGE(OFFSET(R[-74]C,3,0,R7C1,1)) -> 68.242666666666665 | F85: =AVERAGE(OFFSET(R[-74]C,3,0,R7C1,1)) -> 8.1673333333333336 | G85: =AVERAGE(OFFSET(R[-74]C,3,0,R7C1,1)) -> 209.22933333333333 | H85: =AVERAGE(OFFSET(R[-74]C,3,0,R7C1,1)) -> 48.020666666666671 | I85: =AVERAGE(OFFSET(R[-74]C,3,0,R7C1,1)) -> 5.4046666666666665 | J85: =AVERAGE(OFFSET(R[-74]C,3,0,R7C1,1)) -> 20.222000000000001 | K85: =AVERAGE(OFFSET(R[-74]C,3,0,R7C1,1)) -> 22.041666666666668 | L85: =IF(SUM(OFFSET(R[-74]C,3,0,R7C1,1))=0,"",AVERAGE(OFFSET(R[-74]C,3,0,R7C1,1))) -> 21.03833333333333 | M85: =IF(SUM(OFFSET(R[-74]C,3,0,R7C1,1))=0,"",AVERAGE(OFFSET(R[-74]C,3,0,R7C1,1))) -> 68.356333333333339 | R85: =IF(SUM(OFFSET(R[-74]C,3,0,R7C1,1))=0,"",AVERAGE(OFFSET(R[-74]C,3,0,R7C1,1))) -> 1.4083666666666663 | S85: =AVERAGE(OFFSET(R[-74]C,3,0,R7C1,1)) -> 5.3610333333333324 | T85: =AVERAGE(OFFSET(R[-74]C,3,0,R7C1,1)) -> 5.3463223933333355 | W85: =AVERAGE(OFFSET(R[-74]C,3,0,R7C1,1)) -> 1.4082387666666667 | X85: =AVERAGE(OFFSET(R[-74]C,3,0,R7C1,1)) -> #VALUE! | AC85: Итого | AE85: =R[1]C[-28] -> 720 | AF85: =R[1]C[-28] -> 6938.1299999999992 | AI85: =R[1]C[-28] -> 6276.88 | AM85: =R[1]C[-28] -> 661.25 | AN85: =R[1]C[-28] -> 631.14999999999986 | AQ85: =R[1]C[-29] -> 0 | AU85: =R[1]C[-30] -> 0 | AV85: =R[1]C[-30] -> 42.250999999999991 | AW85: =R[1]C[-30] -> 160.83099999999996
B86: ИТОГО: | C86: =SUM(OFFSET(R[-75]C,3,0,R7C1,1)) -> 720 | D86: =SUM(OFFSET(R[-75]C,3,0,R7C1,1)) -> 6938.1299999999992 | G86: =SUM(OFFSET(R[-75]C,3,0,R7C1,1)) -> 6276.88 | K86: =SUM(OFFSET(R[-75]C,3,0,R7C1,1)) -> 661.25 | L86: =IF(SUM(OFFSET(R[-75]C,3,0,R7C1,1))=0,"",SUM(OFFSET(R[-75]C,3,0,R7C1,1))) -> 631.14999999999986 | R86: =IF(SUM(OFFSET(R[-75]C,3,0,R7C1,1))=0,"",SUM(OFFSET(R[-75]C,3,0,R7C1,1))) -> 42.250999999999991 | S86: =SUM(OFFSET(R[-75]C,3,0,R7C1,1)) -> 160.83099999999996 | T86: =SUM(OFFSET(R[-75]C,3,0,R7C1,1)) -> 160.38967180000006 | W86: =SUM(OFFSET(R[-75]C,3,0,R7C1,1)) -> 42.247163 | X86: =SUM(OFFSET(R[-75]C,3,0,R7C1,1)) -> #VALUE!
AC87: Досчёт | AF87: =R[1]C[-28] -> 0 | AI87: =R[1]C[-28] -> 0 | AM87: =R[1]C[-28] -> 0 | AN87: =R[1]C[-28] -> 0 | AQ87: =R[1]C[-29] -> 0 | AU87: =R[1]C[-30] -> 0 | AV87: =R[1]C[-30] -> 0 | AW87: =R[1]C[-30] -> 0
A88: 11дн=264ч 4дн=96ч | B88: Досчёт до конца м-ца (+) | C88: =R6C1*24 -> 216 | T88: № 98527 | AC88: Снятие | AF88: =-R[1]C[-28] -> 0 | AI88: =-R[1]C[-28] -> 0 | AM88: =-R[1]C[-28] -> 0 | AN88: =-R[1]C[-28] -> 0 | AQ88: =-R[1]C[-29] -> 0 | AU88: =-R[1]C[-30] -> 0 | AV88: =-R[1]C[-30] -> 0 | AW88: =-R[1]C[-30] -> 0
A89: 9дн=216ч 7дн=168ч | B89: Вычет с предыдущего (-) | C89: =R4C1*24 -> 192 | AC89: Сумма | AF89: =R[1]C[-28] -> 6938.1299999999992 | AI89: =R[1]C[-28] -> 6276.88 | AM89: =R[1]C[-28] -> 661.25 | AN89: =R[1]C[-28] -> 631.14999999999986 | AQ89: =R[1]C[-29] -> 0 | AU89: =R[1]C[-30] -> 0 | AV89: =R[1]C[-30] -> 42.250999999999991 | AW89: =R[1]C[-30] -> 160.83099999999996
B90: СУММА: | C90: =R[-4]C+R[-2]C-R[-1]C -> 744 | D90: =R[-4]C+R[-2]C-R[-1]C -> 6938.1299999999992 | G90: =R[-4]C+R[-2]C-R[-1]C -> 6276.88 | K90: =R[-4]C+R[-2]C-R[-1]C -> 661.25 | L90: =IF(SUM(OFFSET(R[-79]C,3,0,R7C1,1))=0,"",(R[-4]C+R[-2]C-R[-1]C)) -> 631.14999999999986 | R90: =IF(SUM(OFFSET(R[-79]C,3,0,R7C1,1))=0,"",(R[-4]C+R[-2]C-R[-1]C)) -> 42.250999999999991 | S90: =R[-4]C+R[-2]C-R[-1]C -> 160.83099999999996
AC91: Тхв на источнике | AE91: V гвс (м3) | AF91: =R[-2]C[15] -> 0 | AG91: W гвс (Гкал) | AH91: =RC[-2]*0.06 -> 0 | AI91: W без гвс (Гкал) | AJ91: =R[-2]C[13]-RC[-2] -> 160.83099999999996
B92: Показания счетчиков на момент снятия данных:
B93: Дата, время | D93: М1, т | F93: М2, т | H93: М3, т | J93: М4, т | L93: Qо, Гкал | N93: Qг, Гкал | P93: время, час
B94: 23.09.18 03:00 | D94: 47821.440000000002 | F94: 40919.01 | H94: 23132.77 | J94: - | L94: 1288.731 | N94: 1769.01 | P94: -
B95: 23.10.18 02:00 | D95: 54777.88 | F95: 47214.41 | H95: 23750.959999999999 | J95: - | L95: 1449.82 | N95: 1811.259 | P95: -
AC97: =ZAYAVKA_N -> 
B98: Представитель потребителя:_______________________________________________________________________ В.О. Топорков
I101: Рекомендуемые значения по параметрам теплопотребления (не являются официально утверждёнными)
I102: М, т | J102: V, м3 | K102: Qгвс, Гкал | L102: Qотоп, Гкал | M102: Qо, Гкал
I103: =R[-13]C[-3] -> 0 | J103: =RC[-1]/0.98 -> 0 | K103: =RC[-1]*0.06 -> 0 | L103: =RC[1]-RC[-1] -> 42.250999999999991 | M103: =R[-13]C[5] -> 42.250999999999991
O105: ДЛЯ САМОКОНТРОЛЯ
B106: В строке выбора дат указать период с 16.7.13 по 23.8.13 - жильё | N106: Q | O106: Qг
B107: В строке выбора дат указать период с 18.7.13 по 25.8.13 - не жилое | N107: =(R[-21]C[-10]*R[-22]C[-7]-R[-21]C[-9]*R[-22]C[-6])/1000 -> 1451.6603144799997 | O107: =IF(R[-22]C[-2]="",R[-21]C[-3]*R[-22]C/1000,"") ->  | P107: Си2
O108: =IF(R[-23]C[-2]="","",((R[-22]C[-3]*R[-23]C)-(R[-22]C[-2]*R[-23]C[2]))/1000) -> 0 | P108: Си3