Sheet: Лист1
G1: Отчёт о теплопотреблении за октябрь 2018 | M1: з.н д. №02/147-2783 от 04.10.18
A4: =EOMONTH(R[9]C,0)-R[9]C -> 8 | B4: Потребитель: ЗАО "Сити Сервис"
A5: =MAX(R[9]C:R[78]C) -> 2018-10-22T00:00:00.000 | B5: Адрес: г. СПб, Кораблестроителей ул., д.39 к.1 ИТП11
A6: =EOMONTH(R[-1]C,0)-R[-1]C -> 9 | B6: Телефон: 8-911-021-19-79
A7: =R[-2]C-R[6]C -> 30 | B7: Договор 10023-2 (.) 87499
A8: 7 | B8: Тепловычислитель: ВКТ-7 № 49486 | L8: М2 мах= | M8: 220.32 | O8: Мгвс мах= | P8: 54.48
L9: Qотоп мах= | M9: 17.52 | O9: Qгвс мах= | P9: 3.36
B10: Расчётная формула: Q=M1*(h1-h2)+(M1-M2)*(h2-hхв)
D12: Учет | L12: Контроль
A13: =R[1]C[1]-1 -> 2018-09-22T00:00:00.000 | B13: Дата | C13: N, ч | D13: M1, т | E13: T1, С | F13: P1, кг/см2 | G13: M2, т | H13: T2, С | I13: P2, кг/см2 | J13: dT, С | K13: M1-М2, т | L13: V3, м3 | M13: T3, С | N13: V4, м3 | O13: =IF(R[-12]C[-14]="м.куб","","T4, С") -> T4, С | P13: dT, С | Q13: V3-V4, м3 | R13: Qгвс, Гкал | S13: Qобщ., Гкал | T13: Q | U13: M3 | V13: M4 | W13: си2 | X13: си3 | Y13: Разб. | Z13: dM2 | AC13: Дата | AD13: НС | AE13: n, ч | AF13: М1, т | AG13: t1, гр. С | AH13: Р1, кгс/см2 | AI13: М2, т | AJ13: t2, гр. С | AK13: Р2, кгс/см2 | AL13: t1-t2, гр. С | AM13: М1-М2, т | AN13: М1гвс, т | AO13: t1гвс, гр. С | AP13: Р1гвс, кгс/см2 | AQ13: М2гвс, т | AR13: t2гвс, гр. С | AS13: Р2гвс, кгс/см2 | AT13: t1гвс-t2гвс | AU13: М1гвс-М2гвс, т | AV13: Wгвс, Гкал | AW13: Wсумм, Гкал | AY13: NS_TV1 | AZ13: НС | BA13: NS_TV2
A14: =IF(RC[1]="","",DATEVALUE(RC[1])) -> 43366 | B14: 23.09.18 | C14: 24 | D14: 30.33 | E14: 66.19 | F14: 8.76 | G14: 0 | H14: 27 | I14: 1.4 | J14: =RC[-5]-RC[-2] -> 39.19 | K14: 30.33 | L14: 30.47 | M14: 66.06 | R14: 1.9730000000000001 | S14: =RC[-1] -> 1.9730000000000001 | T14: =(RC[-16]*RC[-15]-RC[-13]*RC[-12])/1000 -> 2.0075426999999997 | U14: 29.9 | V14: - | W14: =RC[-2]*RC[-10]/1000 -> 1.9751939999999999 | X14: =ABS((RC[-3]*RC[-11]-RC[-2]*RC[-9])/1000) -> #VALUE! | Y14: =(RC[-14]-RC[1])/RC[-18]*100 -> #DIV/0! | Z14: 29.9 | AC14: =VALUE(RC[-27]) -> 2018-09-23T00:00:00.000 | AD14: =IF(RC[21]=42,"*",IF(RC[21]=32,"",RC[21])) -> - | AE14: =RC[-28] -> 24 | AF14: =RC[-28] -> 30.33 | AG14: =RC[-28] -> 66.19 | AH14: =RC[-28] -> 8.76 | AI14: =RC[-28] -> 0 | AJ14: =RC[-28] -> 27 | AK14: =RC[-28] -> 1.4 | AL14: =RC[-28] -> 39.19 | AM14: =RC[-28] -> 30.33 | AN14: =RC[-28] -> 30.47 | AO14: =RC[-28] -> 66.06 | AP14: - | AQ14: =RC[-29] -> 0 | AR14: =RC[-29] -> 0 | AS14: - | AT14: =RC[-30] -> 0 | AU14: =RC[-30] -> 0 | AV14: =RC[-30] -> 1.9730000000000001 | AW14: =RC[-30] -> 1.9730000000000001 | AY14: - | AZ14: - | BA14: -
A15: =IF(RC[1]="","",DATEVALUE(RC[1])) -> 43367 | B15: 24.09.18 | C15: 24 | D15: 28.1 | E15: 65.52 | F15: 8.84 | G15: 0 | H15: 27.75 | I15: 1.34 | J15: =RC[-5]-RC[-2] -> 37.769999999999996 | K15: 28.1 | L15: 28.23 | M15: 65.34 | R15: 1.8129999999999999 | S15: =RC[-1] -> 1.8129999999999999 | T15: =(RC[-16]*RC[-15]-RC[-13]*RC[-12])/1000 -> 1.8411120000000001 | U15: 27.7 | V15: - | W15: =RC[-2]*RC[-10]/1000 -> 1.8099180000000001 | X15: =ABS((RC[-3]*RC[-11]-RC[-2]*RC[-9])/1000) -> #VALUE! | Y15: =(RC[-14]-RC[1])/RC[-18]*100 -> #DIV/0! | Z15: 27.7 | AC15: =VALUE(RC[-27]) -> 2018-09-24T00:00:00.000 | AD15: =IF(RC[21]=42,"*",IF(RC[21]=32,"",RC[21])) -> - | AE15: =RC[-28] -> 24 | AF15: =RC[-28] -> 28.1 | AG15: =RC[-28] -> 65.52 | AH15: =RC[-28] -> 8.84 | AI15: =RC[-28] -> 0 | AJ15: =RC[-28] -> 27.75 | AK15: =RC[-28] -> 1.34 | AL15: =RC[-28] -> 37.769999999999996 | AM15: =RC[-28] -> 28.1 | AN15: =RC[-28] -> 28.23 | AO15: =RC[-28] -> 65.34 | AP15: - | AQ15: =RC[-29] -> 0 | AR15: =RC[-29] -> 0 | AS15: - | AT15: =RC[-30] -> 0 | AU15: =RC[-30] -> 0 | AV15: =RC[-30] -> 1.8129999999999999 | AW15: =RC[-30] -> 1.8129999999999999 | AY15: - | AZ15: - | BA15: -
A16: =IF(RC[1]="","",DATEVALUE(RC[1])) -> 43368 | B16: 25.09.18 | C16: 24 | D16: 32.67 | E16: 64.14 | F16: 8.91 | G16: 0 | H16: 26.84 | I16: 1.22 | J16: =RC[-5]-RC[-2] -> 37.299999999999997 | K16: 32.67 | L16: 32.799999999999997 | M16: 64.040000000000006 | R16: 2.0640000000000001 | S16: =RC[-1] -> 2.0640000000000001 | T16: =(RC[-16]*RC[-15]-RC[-13]*RC[-12])/1000 -> 2.0954538 | U16: 32.19 | V16: - | W16: =RC[-2]*RC[-10]/1000 -> 2.0614476000000002 | X16: =ABS((RC[-3]*RC[-11]-RC[-2]*RC[-9])/1000) -> #VALUE! | Y16: =(RC[-14]-RC[1])/RC[-18]*100 -> #DIV/0! | Z16: 32.19 | AC16: =VALUE(RC[-27]) -> 2018-09-25T00:00:00.000 | AD16: =IF(RC[21]=42,"*",IF(RC[21]=32,"",RC[21])) -> - | AE16: =RC[-28] -> 24 | AF16: =RC[-28] -> 32.67 | AG16: =RC[-28] -> 64.14 | AH16: =RC[-28] -> 8.91 | AI16: =RC[-28] -> 0 | AJ16: =RC[-28] -> 26.84 | AK16: =RC[-28] -> 1.22 | AL16: =RC[-28] -> 37.299999999999997 | AM16: =RC[-28] -> 32.67 | AN16: =RC[-28] -> 32.799999999999997 | AO16: =RC[-28] -> 64.040000000000006 | AP16: - | AQ16: =RC[-29] -> 0 | AR16: =RC[-29] -> 0 | AS16: - | AT16: =RC[-30] -> 0 | AU16: =RC[-30] -> 0 | AV16: =RC[-30] -> 2.0640000000000001 | AW16: =RC[-30] -> 2.0640000000000001 | AY16: - | AZ16: - | BA16: -
A17: =IF(RC[1]="","",DATEVALUE(RC[1])) -> 43369 | B17: 26.09.18 | C17: 24 | D17: 126.3 | E17: 65.25 | F17: 8.69 | G17: 100.76 | H17: 45.04 | I17: 3.42 | J17: =RC[-5]-RC[-2] -> 20.21 | K17: 25.54 | L17: 28.99 | M17: 64.41 | R17: 1.829 | S17: 3.7040000000000002 | T17: =(RC[-16]*RC[-15]-RC[-13]*RC[-12])/1000 -> 3.7028445999999984 | U17: 28.42 | V17: - | W17: =RC[-2]*RC[-10]/1000 -> 1.8305322000000002 | X17: =ABS((RC[-3]*RC[-11]-RC[-2]*RC[-9])/1000) -> #VALUE! | Y17: =(RC[-14]-RC[1])/RC[-18]*100 -> -2.8582770940849569 | Z17: 28.42 | AC17: =VALUE(RC[-27]) -> 2018-09-26T00:00:00.000 | AD17: =IF(RC[21]=42,"*",IF(RC[21]=32,"",RC[21])) -> - | AE17: =RC[-28] -> 24 | AF17: =RC[-28] -> 126.3 | AG17: =RC[-28] -> 65.25 | AH17: =RC[-28] -> 8.69 | AI17: =RC[-28] -> 100.76 | AJ17: =RC[-28] -> 45.04 | AK17: =RC[-28] -> 3.42 | AL17: =RC[-28] -> 20.21 | AM17: =RC[-28] -> 25.54 | AN17: =RC[-28] -> 28.99 | AO17: =RC[-28] -> 64.41 | AP17: - | AQ17: =RC[-29] -> 0 | AR17: =RC[-29] -> 0 | AS17: - | AT17: =RC[-30] -> 0 | AU17: =RC[-30] -> 0 | AV17: =RC[-30] -> 1.829 | AW17: =RC[-30] -> 3.7040000000000002 | AY17: - | AZ17: - | BA17: -
A18: =IF(RC[1]="","",DATEVALUE(RC[1])) -> 43370 | B18: 27.09.18 | C18: 24 | D18: 225.92 | E18: 62.15 | F18: 7.9 | G18: 198.58 | H18: 41.34 | I18: 6.66 | J18: =RC[-5]-RC[-2] -> 20.809999999999995 | K18: 27.34 | L18: 31.63 | M18: 62.18 | R18: 1.9319999999999999 | S18: 5.83 | T18: =(RC[-16]*RC[-15]-RC[-13]*RC[-12])/1000 -> 5.8316307999999974 | U18: 31.05 | V18: - | W18: =RC[-2]*RC[-10]/1000 -> 1.9306890000000001 | X18: =ABS((RC[-3]*RC[-11]-RC[-2]*RC[-9])/1000) -> #VALUE! | Y18: =(RC[-14]-RC[1])/RC[-18]*100 -> -1.86826467922248 | Z18: 31.05 | AC18: =VALUE(RC[-27]) -> 2018-09-27T00:00:00.000 | AD18: =IF(RC[21]=42,"*",IF(RC[21]=32,"",RC[21])) -> - | AE18: =RC[-28] -> 24 | AF18: =RC[-28] -> 225.92 | AG18: =RC[-28] -> 62.15 | AH18: =RC[-28] -> 7.9 | AI18: =RC[-28] -> 198.58 | AJ18: =RC[-28] -> 41.34 | AK18: =RC[-28] -> 6.66 | AL18: =RC[-28] -> 20.809999999999995 | AM18: =RC[-28] -> 27.34 | AN18: =RC[-28] -> 31.63 | AO18: =RC[-28] -> 62.18 | AP18: - | AQ18: =RC[-29] -> 0 | AR18: =RC[-29] -> 0 | AS18: - | AT18: =RC[-30] -> 0 | AU18: =RC[-30] -> 0 | AV18: =RC[-30] -> 1.9319999999999999 | AW18: =RC[-30] -> 5.83 | AY18: - | AZ18: - | BA18: -
A19: =IF(RC[1]="","",DATEVALUE(RC[1])) -> 43371 | B19: 28.09.18 | C19: 24 | D19: 203.53 | E19: 67.099999999999994 | F19: 7.9 | G19: 178.15 | H19: 42.05 | I19: 6.93 | J19: =RC[-5]-RC[-2] -> 25.049999999999997 | K19: 25.38 | L19: 28.92 | M19: 67.260000000000005 | R19: 1.907 | S19: 6.1630000000000003 | T19: =(RC[-16]*RC[-15]-RC[-13]*RC[-12])/1000 -> 6.1656554999999997 | U19: 28.34 | V19: - | W19: =RC[-2]*RC[-10]/1000 -> 1.9061484 | X19: =ABS((RC[-3]*RC[-11]-RC[-2]*RC[-9])/1000) -> #VALUE! | Y19: =(RC[-14]-RC[1])/RC[-18]*100 -> -1.6615211900084204 | Z19: 28.34 | AC19: =VALUE(RC[-27]) -> 2018-09-28T00:00:00.000 | AD19: =IF(RC[21]=42,"*",IF(RC[21]=32,"",RC[21])) -> - | AE19: =RC[-28] -> 24 | AF19: =RC[-28] -> 203.53 | AG19: =RC[-28] -> 67.099999999999994 | AH19: =RC[-28] -> 7.9 | AI19: =RC[-28] -> 178.15 | AJ19: =RC[-28] -> 42.05 | AK19: =RC[-28] -> 6.93 | AL19: =RC[-28] -> 25.049999999999997 | AM19: =RC[-28] -> 25.38 | AN19: =RC[-28] -> 28.92 | AO19: =RC[-28] -> 67.260000000000005 | AP19: - | AQ19: =RC[-29] -> 0 | AR19: =RC[-29] -> 0 | AS19: - | AT19: =RC[-30] -> 0 | AU19: =RC[-30] -> 0 | AV19: =RC[-30] -> 1.907 | AW19: =RC[-30] -> 6.1630000000000003 | AY19: - | AZ19: - | BA19: -
A20: =IF(RC[1]="","",DATEVALUE(RC[1])) -> 43372 | B20: 29.09.18 | C20: 24 | D20: 225 | E20: 66.930000000000007 | F20: 8.5399999999999991 | G20: 199.22 | H20: 43.16 | I20: 7.32 | J20: =RC[-5]-RC[-2] -> 23.77000000000001 | K20: 25.78 | L20: 29.64 | M20: 66.739999999999995 | R20: 1.94 | S20: 6.4589999999999996 | T20: =(RC[-16]*RC[-15]-RC[-13]*RC[-12])/1000 -> 6.4609148000000021 | U20: 29.07 | V20: - | W20: =RC[-2]*RC[-10]/1000 -> 1.9401317999999999 | X20: =ABS((RC[-3]*RC[-11]-RC[-2]*RC[-9])/1000) -> #VALUE! | Y20: =(RC[-14]-RC[1])/RC[-18]*100 -> -1.6514406184118056 | Z20: 29.07 | AC20: =VALUE(RC[-27]) -> 2018-09-29T00:00:00.000 | AD20: =IF(RC[21]=42,"*",IF(RC[21]=32,"",RC[21])) -> - | AE20: =RC[-28] -> 24 | AF20: =RC[-28] -> 225 | AG20: =RC[-28] -> 66.930000000000007 | AH20: =RC[-28] -> 8.5399999999999991 | AI20: =RC[-28] -> 199.22 | AJ20: =RC[-28] -> 43.16 | AK20: =RC[-28] -> 7.32 | AL20: =RC[-28] -> 23.77000000000001 | AM20: =RC[-28] -> 25.78 | AN20: =RC[-28] -> 29.64 | AO20: =RC[-28] -> 66.739999999999995 | AP20: - | AQ20: =RC[-29] -> 0 | AR20: =RC[-29] -> 0 | AS20: - | AT20: =RC[-30] -> 0 | AU20: =RC[-30] -> 0 | AV20: =RC[-30] -> 1.94 | AW20: =RC[-30] -> 6.4589999999999996 | AY20: - | AZ20: - | BA20: -
A21: =IF(RC[1]="","",DATEVALUE(RC[1])) -> 43373 | B21: 30.09.18 | C21: 24 | D21: 228.25 | E21: 69.13 | F21: 8.5 | G21: 203.07 | H21: 44.36 | I21: 7.23 | J21: =RC[-5]-RC[-2] -> 24.769999999999996 | K21: 25.18 | L21: 29.2 | M21: 69.349999999999994 | R21: 1.984 | S21: 6.7720000000000002 | T21: =(RC[-16]*RC[-15]-RC[-13]*RC[-12])/1000 -> 6.7707372999999986 | U21: 28.58 | V21: - | W21: =RC[-2]*RC[-10]/1000 -> 1.9820229999999996 | X21: =ABS((RC[-3]*RC[-11]-RC[-2]*RC[-9])/1000) -> #VALUE! | Y21: =(RC[-14]-RC[1])/RC[-18]*100 -> -1.6742995026345588 | Z21: 28.58 | AC21: =VALUE(RC[-27]) -> 2018-09-30T00:00:00.000 | AD21: =IF(RC[21]=42,"*",IF(RC[21]=32,"",RC[21])) -> - | AE21: =RC[-28] -> 24 | AF21: =RC[-28] -> 228.25 | AG21: =RC[-28] -> 69.13 | AH21: =RC[-28] -> 8.5 | AI21: =RC[-28] -> 203.07 | AJ21: =RC[-28] -> 44.36 | AK21: =RC[-28] -> 7.23 | AL21: =RC[-28] -> 24.769999999999996 | AM21: =RC[-28] -> 25.18 | AN21: =RC[-28] -> 29.2 | AO21: =RC[-28] -> 69.349999999999994 | AP21: - | AQ21: =RC[-29] -> 0 | AR21: =RC[-29] -> 0 | AS21: - | AT21: =RC[-30] -> 0 | AU21: =RC[-30] -> 0 | AV21: =RC[-30] -> 1.984 | AW21: =RC[-30] -> 6.7720000000000002 | AY21: - | AZ21: - | BA21: -
A22: =IF(RC[1]="","",DATEVALUE(RC[1])) -> 43374 | B22: 01.10.18 | C22: 24 | D22: 224.68 | E22: 67.900000000000006 | F22: 8.56 | G22: 200.61 | H22: 43.56 | I22: 7.33 | J22: =RC[-5]-RC[-2] -> 24.340000000000003 | K22: 24.07 | L22: 27.97 | M22: 67.73 | R22: 1.859 | S22: 6.5140000000000002 | T22: =(RC[-16]*RC[-15]-RC[-13]*RC[-12])/1000 -> 6.5172004000000001 | U22: 27.42 | V22: - | W22: =RC[-2]*RC[-10]/1000 -> 1.8571566000000002 | X22: =ABS((RC[-3]*RC[-11]-RC[-2]*RC[-9])/1000) -> #VALUE! | Y22: =(RC[-14]-RC[1])/RC[-18]*100 -> -1.6699067843078614 | Z22: 27.42 | AC22: =VALUE(RC[-27]) -> 2018-10-01T00:00:00.000 | AD22: =IF(RC[21]=42,"*",IF(RC[21]=32,"",RC[21])) -> - | AE22: =RC[-28] -> 24 | AF22: =RC[-28] -> 224.68 | AG22: =RC[-28] -> 67.900000000000006 | AH22: =RC[-28] -> 8.56 | AI22: =RC[-28] -> 200.61 | AJ22: =RC[-28] -> 43.56 | AK22: =RC[-28] -> 7.33 | AL22: =RC[-28] -> 24.340000000000003 | AM22: =RC[-28] -> 24.07 | AN22: =RC[-28] -> 27.97 | AO22: =RC[-28] -> 67.73 | AP22: - | AQ22: =RC[-29] -> 0 | AR22: =RC[-29] -> 0 | AS22: - | AT22: =RC[-30] -> 0 | AU22: =RC[-30] -> 0 | AV22: =RC[-30] -> 1.859 | AW22: =RC[-30] -> 6.5140000000000002 | AY22: - | AZ22: - | BA22: -
A23: =IF(RC[1]="","",DATEVALUE(RC[1])) -> 43375 | B23: 02.10.18 | C23: 24 | D23: 232.2 | E23: 66.7 | F23: 8.5399999999999991 | G23: 208.76 | H23: 43.09 | I23: 7.2 | J23: =RC[-5]-RC[-2] -> 23.61 | K23: 23.44 | L23: 27.42 | M23: 66.66 | R23: 1.7889999999999999 | S23: 6.492 | T23: =(RC[-16]*RC[-15]-RC[-13]*RC[-12])/1000 -> 6.4922716000000005 | U23: 26.85 | V23: - | W23: =RC[-2]*RC[-10]/1000 -> 1.7898209999999999 | X23: =ABS((RC[-3]*RC[-11]-RC[-2]*RC[-9])/1000) -> #VALUE! | Y23: =(RC[-14]-RC[1])/RC[-18]*100 -> -1.6334546848055183 | Z23: 26.85 | AC23: =VALUE(RC[-27]) -> 2018-10-02T00:00:00.000 | AD23: =IF(RC[21]=42,"*",IF(RC[21]=32,"",RC[21])) -> - | AE23: =RC[-28] -> 24 | AF23: =RC[-28] -> 232.2 | AG23: =RC[-28] -> 66.7 | AH23: =RC[-28] -> 8.5399999999999991 | AI23: =RC[-28] -> 208.76 | AJ23: =RC[-28] -> 43.09 | AK23: =RC[-28] -> 7.2 | AL23: =RC[-28] -> 23.61 | AM23: =RC[-28] -> 23.44 | AN23: =RC[-28] -> 27.42 | AO23: =RC[-28] -> 66.66 | AP23: - | AQ23: =RC[-29] -> 0 | AR23: =RC[-29] -> 0 | AS23: - | AT23: =RC[-30] -> 0 | AU23: =RC[-30] -> 0 | AV23: =RC[-30] -> 1.7889999999999999 | AW23: =RC[-30] -> 6.492 | AY23: - | AZ23: - | BA23: -
A24: =IF(RC[1]="","",DATEVALUE(RC[1])) -> 43376 | B24: 03.10.18 | C24: 24 | D24: 219.88 | E24: 66.760000000000005 | F24: 8.65 | G24: 196.04 | H24: 42.18 | I24: 7.13 | J24: =RC[-5]-RC[-2] -> 24.580000000000005 | K24: 23.84 | L24: 27.69 | M24: 66.8 | R24: 1.8120000000000001 | S24: 6.4109999999999996 | T24: =(RC[-16]*RC[-15]-RC[-13]*RC[-12])/1000 -> 6.4102216000000025 | U24: 27.12 | V24: - | W24: =RC[-2]*RC[-10]/1000 -> 1.8116159999999999 | X24: =ABS((RC[-3]*RC[-11]-RC[-2]*RC[-9])/1000) -> #VALUE! | Y24: =(RC[-14]-RC[1])/RC[-18]*100 -> -1.6731279330748832 | Z24: 27.12 | AC24: =VALUE(RC[-27]) -> 2018-10-03T00:00:00.000 | AD24: =IF(RC[21]=42,"*",IF(RC[21]=32,"",RC[21])) -> - | AE24: =RC[-28] -> 24 | AF24: =RC[-28] -> 219.88 | AG24: =RC[-28] -> 66.760000000000005 | AH24: =RC[-28] -> 8.65 | AI24: =RC[-28] -> 196.04 | AJ24: =RC[-28] -> 42.18 | AK24: =RC[-28] -> 7.13 | AL24: =RC[-28] -> 24.580000000000005 | AM24: =RC[-28] -> 23.84 | AN24: =RC[-28] -> 27.69 | AO24: =RC[-28] -> 66.8 | AP24: - | AQ24: =RC[-29] -> 0 | AR24: =RC[-29] -> 0 | AS24: - | AT24: =RC[-30] -> 0 | AU24: =RC[-30] -> 0 | AV24: =RC[-30] -> 1.8120000000000001 | AW24: =RC[-30] -> 6.4109999999999996 | AY24: - | AZ24: - | BA24: -
A25: =IF(RC[1]="","",DATEVALUE(RC[1])) -> 43377 | B25: 04.10.18 | C25: 24 | D25: 197.03 | E25: 66.09 | F25: 8.73 | G25: 171.63 | H25: 39.369999999999997 | I25: 7.13 | J25: =RC[-5]-RC[-2] -> 26.720000000000006 | K25: 25.4 | L25: 28.76 | M25: 66.09 | R25: 1.8640000000000001 | S25: 6.2649999999999997 | T25: =(RC[-16]*RC[-15]-RC[-13]*RC[-12])/1000 -> 6.2646396000000006 | U25: 28.2 | V25: - | W25: =RC[-2]*RC[-10]/1000 -> 1.8637380000000001 | X25: =ABS((RC[-3]*RC[-11]-RC[-2]*RC[-9])/1000) -> #VALUE! | Y25: =(RC[-14]-RC[1])/RC[-18]*100 -> -1.6314164190409608 | Z25: 28.2 | AC25: =VALUE(RC[-27]) -> 2018-10-04T00:00:00.000 | AD25: =IF(RC[21]=42,"*",IF(RC[21]=32,"",RC[21])) -> - | AE25: =RC[-28] -> 24 | AF25: =RC[-28] -> 197.03 | AG25: =RC[-28] -> 66.09 | AH25: =RC[-28] -> 8.73 | AI25: =RC[-28] -> 171.63 | AJ25: =RC[-28] -> 39.369999999999997 | AK25: =RC[-28] -> 7.13 | AL25: =RC[-28] -> 26.720000000000006 | AM25: =RC[-28] -> 25.4 | AN25: =RC[-28] -> 28.76 | AO25: =RC[-28] -> 66.09 | AP25: - | AQ25: =RC[-29] -> 0 | AR25: =RC[-29] -> 0 | AS25: - | AT25: =RC[-30] -> 0 | AU25: =RC[-30] -> 0 | AV25: =RC[-30] -> 1.8640000000000001 | AW25: =RC[-30] -> 6.2649999999999997 | AY25: - | AZ25: - | BA25: -
A26: =IF(RC[1]="","",DATEVALUE(RC[1])) -> 43378 | B26: 05.10.18 | C26: 24 | D26: 198.46 | E26: 65.5 | F26: 8.64 | G26: 171.43 | H26: 38.78 | I26: 7.04 | J26: =RC[-5]-RC[-2] -> 26.72 | K26: 27.03 | L26: 30.24 | M26: 65.58 | R26: 1.9450000000000001 | S26: 6.3520000000000003 | T26: =(RC[-16]*RC[-15]-RC[-13]*RC[-12])/1000 -> 6.3510746000000005 | U26: 29.65 | V26: - | W26: =RC[-2]*RC[-10]/1000 -> 1.9444469999999998 | X26: =ABS((RC[-3]*RC[-11]-RC[-2]*RC[-9])/1000) -> #VALUE! | Y26: =(RC[-14]-RC[1])/RC[-18]*100 -> -1.528320597328354 | Z26: 29.65 | AC26: =VALUE(RC[-27]) -> 2018-10-05T00:00:00.000 | AD26: =IF(RC[21]=42,"*",IF(RC[21]=32,"",RC[21])) -> - | AE26: =RC[-28] -> 24 | AF26: =RC[-28] -> 198.46 | AG26: =RC[-28] -> 65.5 | AH26: =RC[-28] -> 8.64 | AI26: =RC[-28] -> 171.43 | AJ26: =RC[-28] -> 38.78 | AK26: =RC[-28] -> 7.04 | AL26: =RC[-28] -> 26.72 | AM26: =RC[-28] -> 27.03 | AN26: =RC[-28] -> 30.24 | AO26: =RC[-28] -> 65.58 | AP26: - | AQ26: =RC[-29] -> 0 | AR26: =RC[-29] -> 0 | AS26: - | AT26: =RC[-30] -> 0 | AU26: =RC[-30] -> 0 | AV26: =RC[-30] -> 1.9450000000000001 | AW26: =RC[-30] -> 6.3520000000000003 | AY26: - | AZ26: - | BA26: -
A27: =IF(RC[1]="","",DATEVALUE(RC[1])) -> 43379 | B27: 06.10.18 | C27: 24 | D27: 195.91 | E27: 66.16 | F27: 8.68 | G27: 168.2 | H27: 39.1 | I27: 7.14 | J27: =RC[-5]-RC[-2] -> 27.059999999999995 | K27: 27.71 | L27: 30.74 | M27: 66.319999999999993 | R27: 1.998 | S27: 6.3840000000000003 | T27: =(RC[-16]*RC[-15]-RC[-13]*RC[-12])/1000 -> 6.3847855999999981 | U27: 30.15 | V27: - | W27: =RC[-2]*RC[-10]/1000 -> 1.9995479999999999 | X27: =ABS((RC[-3]*RC[-11]-RC[-2]*RC[-9])/1000) -> #VALUE! | Y27: =(RC[-14]-RC[1])/RC[-18]*100 -> -1.4506539833531498 | Z27: 30.15 | AC27: =VALUE(RC[-27]) -> 2018-10-06T00:00:00.000 | AD27: =IF(RC[21]=42,"*",IF(RC[21]=32,"",RC[21])) -> - | AE27: =RC[-28] -> 24 | AF27: =RC[-28] -> 195.91 | AG27: =RC[-28] -> 66.16 | AH27: =RC[-28] -> 8.68 | AI27: =RC[-28] -> 168.2 | AJ27: =RC[-28] -> 39.1 | AK27: =RC[-28] -> 7.14 | AL27: =RC[-28] -> 27.059999999999995 | AM27: =RC[-28] -> 27.71 | AN27: =RC[-28] -> 30.74 | AO27: =RC[-28] -> 66.319999999999993 | AP27: - | AQ27: =RC[-29] -> 0 | AR27: =RC[-29] -> 0 | AS27: - | AT27: =RC[-30] -> 0 | AU27: =RC[-30] -> 0 | AV27: =RC[-30] -> 1.998 | AW27: =RC[-30] -> 6.3840000000000003 | AY27: - | AZ27: - | BA27: -
A28: =IF(RC[1]="","",DATEVALUE(RC[1])) -> 43380 | B28: 07.10.18 | C28: 24 | D28: 198.76 | E28: 66.400000000000006 | F28: 8.68 | G28: 170.72 | H28: 39.590000000000003 | I28: 7.08 | J28: =RC[-5]-RC[-2] -> 26.810000000000002 | K28: 28.04 | L28: 31.14 | M28: 66.53 | R28: 2.032 | S28: 6.4379999999999997 | T28: =(RC[-16]*RC[-15]-RC[-13]*RC[-12])/1000 -> 6.4388591999999996 | U28: 30.53 | V28: - | W28: =RC[-2]*RC[-10]/1000 -> 2.0311609000000002 | X28: =ABS((RC[-3]*RC[-11]-RC[-2]*RC[-9])/1000) -> #VALUE! | Y28: =(RC[-14]-RC[1])/RC[-18]*100 -> -1.4585285848172458 | Z28: 30.53 | AC28: =VALUE(RC[-27]) -> 2018-10-07T00:00:00.000 | AD28: =IF(RC[21]=42,"*",IF(RC[21]=32,"",RC[21])) -> - | AE28: =RC[-28] -> 24 | AF28: =RC[-28] -> 198.76 | AG28: =RC[-28] -> 66.400000000000006 | AH28: =RC[-28] -> 8.68 | AI28: =RC[-28] -> 170.72 | AJ28: =RC[-28] -> 39.590000000000003 | AK28: =RC[-28] -> 7.08 | AL28: =RC[-28] -> 26.810000000000002 | AM28: =RC[-28] -> 28.04 | AN28: =RC[-28] -> 31.14 | AO28: =RC[-28] -> 66.53 | AP28: - | AQ28: =RC[-29] -> 0 | AR28: =RC[-29] -> 0 | AS28: - | AT28: =RC[-30] -> 0 | AU28: =RC[-30] -> 0 | AV28: =RC[-30] -> 2.032 | AW28: =RC[-30] -> 6.4379999999999997 | AY28: - | AZ28: - | BA28: -
A29: =IF(RC[1]="","",DATEVALUE(RC[1])) -> 43381 | B29: 08.10.18 | C29: 24 | D29: 197.16 | E29: 66.41 | F29: 8.6199999999999992 | G29: 171.09 | H29: 39.24 | I29: 7.02 | J29: =RC[-5]-RC[-2] -> 27.169999999999995 | K29: 26.07 | L29: 29.1 | M29: 66.430000000000007 | R29: 1.897 | S29: 6.3760000000000003 | T29: =(RC[-16]*RC[-15]-RC[-13]*RC[-12])/1000 -> 6.3798239999999993 | U29: 28.53 | V29: - | W29: =RC[-2]*RC[-10]/1000 -> 1.8952479000000002 | X29: =ABS((RC[-3]*RC[-11]-RC[-2]*RC[-9])/1000) -> #VALUE! | Y29: =(RC[-14]-RC[1])/RC[-18]*100 -> -1.4378397334736108 | Z29: 28.53 | AC29: =VALUE(RC[-27]) -> 2018-10-08T00:00:00.000 | AD29: =IF(RC[21]=42,"*",IF(RC[21]=32,"",RC[21])) -> - | AE29: =RC[-28] -> 24 | AF29: =RC[-28] -> 197.16 | AG29: =RC[-28] -> 66.41 | AH29: =RC[-28] -> 8.6199999999999992 | AI29: =RC[-28] -> 171.09 | AJ29: =RC[-28] -> 39.24 | AK29: =RC[-28] -> 7.02 | AL29: =RC[-28] -> 27.169999999999995 | AM29: =RC[-28] -> 26.07 | AN29: =RC[-28] -> 29.1 | AO29: =RC[-28] -> 66.430000000000007 | AP29: - | AQ29: =RC[-29] -> 0 | AR29: =RC[-29] -> 0 | AS29: - | AT29: =RC[-30] -> 0 | AU29: =RC[-30] -> 0 | AV29: =RC[-30] -> 1.897 | AW29: =RC[-30] -> 6.3760000000000003 | AY29: - | AZ29: - | BA29: -
A30: =IF(RC[1]="","",DATEVALUE(RC[1])) -> 43382 | B30: 09.10.18 | C30: 24 | D30: 194.08 | E30: 66.3 | F30: 8.6300000000000008 | G30: 168.16 | H30: 39.369999999999997 | I30: 7.08 | J30: =RC[-5]-RC[-2] -> 26.93 | K30: 25.92 | L30: 28.85 | M30: 66.34 | R30: 1.877 | S30: 6.2450000000000001 | T30: =(RC[-16]*RC[-15]-RC[-13]*RC[-12])/1000 -> 6.2470448000000012 | U30: 28.28 | V30: - | W30: =RC[-2]*RC[-10]/1000 -> 1.8760952000000002 | X30: =ABS((RC[-3]*RC[-11]-RC[-2]*RC[-9])/1000) -> #VALUE! | Y30: =(RC[-14]-RC[1])/RC[-18]*100 -> -1.4034253092293052 | Z30: 28.28 | AC30: =VALUE(RC[-27]) -> 2018-10-09T00:00:00.000 | AD30: =IF(RC[21]=42,"*",IF(RC[21]=32,"",RC[21])) -> - | AE30: =RC[-28] -> 24 | AF30: =RC[-28] -> 194.08 | AG30: =RC[-28] -> 66.3 | AH30: =RC[-28] -> 8.6300000000000008 | AI30: =RC[-28] -> 168.16 | AJ30: =RC[-28] -> 39.369999999999997 | AK30: =RC[-28] -> 7.08 | AL30: =RC[-28] -> 26.93 | AM30: =RC[-28] -> 25.92 | AN30: =RC[-28] -> 28.85 | AO30: =RC[-28] -> 66.34 | AP30: - | AQ30: =RC[-29] -> 0 | AR30: =RC[-29] -> 0 | AS30: - | AT30: =RC[-30] -> 0 | AU30: =RC[-30] -> 0 | AV30: =RC[-30] -> 1.877 | AW30: =RC[-30] -> 6.2450000000000001 | AY30: - | AZ30: - | BA30: -
A31: =IF(RC[1]="","",DATEVALUE(RC[1])) -> 43383 | B31: 10.10.18 | C31: 24 | D31: 196.16 | E31: 67.25 | F31: 8.67 | G31: 167.54 | H31: 40.130000000000003 | I31: 7.14 | J31: =RC[-5]-RC[-2] -> 27.119999999999997 | K31: 28.62 | L31: 31.48 | M31: 67.47 | R31: 2.0819999999999999 | S31: 6.4710000000000001 | T31: =(RC[-16]*RC[-15]-RC[-13]*RC[-12])/1000 -> 6.4683798000000001 | U31: 30.85 | V31: - | W31: =RC[-2]*RC[-10]/1000 -> 2.0814495000000002 | X31: =ABS((RC[-3]*RC[-11]-RC[-2]*RC[-9])/1000) -> #VALUE! | Y31: =(RC[-14]-RC[1])/RC[-18]*100 -> -1.3310254267637582 | Z31: 30.85 | AC31: =VALUE(RC[-27]) -> 2018-10-10T00:00:00.000 | AD31: =IF(RC[21]=42,"*",IF(RC[21]=32,"",RC[21])) -> - | AE31: =RC[-28] -> 24 | AF31: =RC[-28] -> 196.16 | AG31: =RC[-28] -> 67.25 | AH31: =RC[-28] -> 8.67 | AI31: =RC[-28] -> 167.54 | AJ31: =RC[-28] -> 40.130000000000003 | AK31: =RC[-28] -> 7.14 | AL31: =RC[-28] -> 27.119999999999997 | AM31: =RC[-28] -> 28.62 | AN31: =RC[-28] -> 31.48 | AO31: =RC[-28] -> 67.47 | AP31: - | AQ31: =RC[-29] -> 0 | AR31: =RC[-29] -> 0 | AS31: - | AT31: =RC[-30] -> 0 | AU31: =RC[-30] -> 0 | AV31: =RC[-30] -> 2.0819999999999999 | AW31: =RC[-30] -> 6.4710000000000001 | AY31: - | AZ31: - | BA31: -
A32: =IF(RC[1]="","",DATEVALUE(RC[1])) -> 43384 | B32: 11.10.18 | C32: 24 | D32: 200.5 | E32: 68.36 | F32: 8.6300000000000008 | G32: 173.4 | H32: 41.06 | I32: 6.98 | J32: =RC[-5]-RC[-2] -> 27.299999999999997 | K32: 27.1 | L32: 30 | M32: 68.349999999999994 | R32: 2.0070000000000001 | S32: 6.5869999999999997 | T32: =(RC[-16]*RC[-15]-RC[-13]*RC[-12])/1000 -> 6.5863759999999996 | U32: 29.36 | V32: - | W32: =RC[-2]*RC[-10]/1000 -> 2.0067559999999998 | X32: =ABS((RC[-3]*RC[-11]-RC[-2]*RC[-9])/1000) -> #VALUE! | Y32: =(RC[-14]-RC[1])/RC[-18]*100 -> -1.3033448673587069 | Z32: 29.36 | AC32: =VALUE(RC[-27]) -> 2018-10-11T00:00:00.000 | AD32: =IF(RC[21]=42,"*",IF(RC[21]=32,"",RC[21])) -> - | AE32: =RC[-28] -> 24 | AF32: =RC[-28] -> 200.5 | AG32: =RC[-28] -> 68.36 | AH32: =RC[-28] -> 8.6300000000000008 | AI32: =RC[-28] -> 173.4 | AJ32: =RC[-28] -> 41.06 | AK32: =RC[-28] -> 6.98 | AL32: =RC[-28] -> 27.299999999999997 | AM32: =RC[-28] -> 27.1 | AN32: =RC[-28] -> 30 | AO32: =RC[-28] -> 68.349999999999994 | AP32: - | AQ32: =RC[-29] -> 0 | AR32: =RC[-29] -> 0 | AS32: - | AT32: =RC[-30] -> 0 | AU32: =RC[-30] -> 0 | AV32: =RC[-30] -> 2.0070000000000001 | AW32: =RC[-30] -> 6.5869999999999997 | AY32: - | AZ32: - | BA32: -
A33: =IF(RC[1]="","",DATEVALUE(RC[1])) -> 43385 | B33: 12.10.18 | C33: 24 | D33: 212.44 | E33: 68.23 | F33: 8.6199999999999992 | G33: 185.66 | H33: 41.89 | I33: 6.93 | J33: =RC[-5]-RC[-2] -> 26.340000000000003 | K33: 26.78 | L33: 29.44 | M33: 68.22 | R33: 1.966 | S33: 6.718 | T33: =(RC[-16]*RC[-15]-RC[-13]*RC[-12])/1000 -> 6.717483800000001 | U33: 28.82 | V33: - | W33: =RC[-2]*RC[-10]/1000 -> 1.9661004 | X33: =ABS((RC[-3]*RC[-11]-RC[-2]*RC[-9])/1000) -> #VALUE! | Y33: =(RC[-14]-RC[1])/RC[-18]*100 -> -1.0987827211030912 | Z33: 28.82 | AC33: =VALUE(RC[-27]) -> 2018-10-12T00:00:00.000 | AD33: =IF(RC[21]=42,"*",IF(RC[21]=32,"",RC[21])) -> - | AE33: =RC[-28] -> 24 | AF33: =RC[-28] -> 212.44 | AG33: =RC[-28] -> 68.23 | AH33: =RC[-28] -> 8.6199999999999992 | AI33: =RC[-28] -> 185.66 | AJ33: =RC[-28] -> 41.89 | AK33: =RC[-28] -> 6.93 | AL33: =RC[-28] -> 26.340000000000003 | AM33: =RC[-28] -> 26.78 | AN33: =RC[-28] -> 29.44 | AO33: =RC[-28] -> 68.22 | AP33: - | AQ33: =RC[-29] -> 0 | AR33: =RC[-29] -> 0 | AS33: - | AT33: =RC[-30] -> 0 | AU33: =RC[-30] -> 0 | AV33: =RC[-30] -> 1.966 | AW33: =RC[-30] -> 6.718 | AY33: - | AZ33: - | BA33: -
A34: =IF(RC[1]="","",DATEVALUE(RC[1])) -> 43386 | B34: 13.10.18 | C34: 24 | D34: 247.02 | E34: 69.319999999999993 | F34: 8.51 | G34: 223.07 | H34: 45.22 | I34: 6.98 | J34: =RC[-5]-RC[-2] -> 24.099999999999994 | K34: 23.95 | L34: 27.27 | M34: 69.39 | R34: 1.851 | S34: 7.0359999999999996 | T34: =(RC[-16]*RC[-15]-RC[-13]*RC[-12])/1000 -> 7.036201000000001 | U34: 26.66 | V34: - | W34: =RC[-2]*RC[-10]/1000 -> 1.8499374 | X34: =ABS((RC[-3]*RC[-11]-RC[-2]*RC[-9])/1000) -> #VALUE! | Y34: =(RC[-14]-RC[1])/RC[-18]*100 -> -1.21486528892276 | Z34: 26.66 | AC34: =VALUE(RC[-27]) -> 2018-10-13T00:00:00.000 | AD34: =IF(RC[21]=42,"*",IF(RC[21]=32,"",RC[21])) -> - | AE34: =RC[-28] -> 24 | AF34: =RC[-28] -> 247.02 | AG34: =RC[-28] -> 69.319999999999993 | AH34: =RC[-28] -> 8.51 | AI34: =RC[-28] -> 223.07 | AJ34: =RC[-28] -> 45.22 | AK34: =RC[-28] -> 6.98 | AL34: =RC[-28] -> 24.099999999999994 | AM34: =RC[-28] -> 23.95 | AN34: =RC[-28] -> 27.27 | AO34: =RC[-28] -> 69.39 | AP34: - | AQ34: =RC[-29] -> 0 | AR34: =RC[-29] -> 0 | AS34: - | AT34: =RC[-30] -> 0 | AU34: =RC[-30] -> 0 | AV34: =RC[-30] -> 1.851 | AW34: =RC[-30] -> 7.0359999999999996 | AY34: - | AZ34: - | BA34: -
A35: =IF(RC[1]="","",DATEVALUE(RC[1])) -> 43387 | B35: 14.10.18 | C35: 24 | D35: 251.5 | E35: 70.09 | F35: 8.48 | G35: 223.06 | H35: 46.25 | I35: 6.96 | J35: =RC[-5]-RC[-2] -> 23.840000000000003 | K35: 28.44 | L35: 32.06 | M35: 70.33 | R35: 2.2069999999999999 | S35: 7.3129999999999997 | T35: =(RC[-16]*RC[-15]-RC[-13]*RC[-12])/1000 -> 7.311110000000002 | U35: 31.37 | V35: - | W35: =RC[-2]*RC[-10]/1000 -> 2.2062520999999999 | X35: =ABS((RC[-3]*RC[-11]-RC[-2]*RC[-9])/1000) -> #VALUE! | Y35: =(RC[-14]-RC[1])/RC[-18]*100 -> -1.3135479243252934 | Z35: 31.37 | AC35: =VALUE(RC[-27]) -> 2018-10-14T00:00:00.000 | AD35: =IF(RC[21]=42,"*",IF(RC[21]=32,"",RC[21])) -> - | AE35: =RC[-28] -> 24 | AF35: =RC[-28] -> 251.5 | AG35: =RC[-28] -> 70.09 | AH35: =RC[-28] -> 8.48 | AI35: =RC[-28] -> 223.06 | AJ35: =RC[-28] -> 46.25 | AK35: =RC[-28] -> 6.96 | AL35: =RC[-28] -> 23.840000000000003 | AM35: =RC[-28] -> 28.44 | AN35: =RC[-28] -> 32.06 | AO35: =RC[-28] -> 70.33 | AP35: - | AQ35: =RC[-29] -> 0 | AR35: =RC[-29] -> 0 | AS35: - | AT35: =RC[-30] -> 0 | AU35: =RC[-30] -> 0 | AV35: =RC[-30] -> 2.2069999999999999 | AW35: =RC[-30] -> 7.3129999999999997 | AY35: - | AZ35: - | BA35: -
A36: =IF(RC[1]="","",DATEVALUE(RC[1])) -> 43388 | B36: 15.10.18 | C36: 24 | D36: 250.17 | E36: 69.569999999999993 | F36: 8.51 | G36: 225.1 | H36: 46.58 | I36: 6.95 | J36: =RC[-5]-RC[-2] -> 22.989999999999995 | K36: 25.07 | L36: 28.43 | M36: 69.58 | R36: 1.9359999999999999 | S36: 6.9180000000000001 | T36: =(RC[-16]*RC[-15]-RC[-13]*RC[-12])/1000 -> 6.9191688999999972 | U36: 27.82 | V36: - | W36: =RC[-2]*RC[-10]/1000 -> 1.9357156 | X36: =ABS((RC[-3]*RC[-11]-RC[-2]*RC[-9])/1000) -> #VALUE! | Y36: =(RC[-14]-RC[1])/RC[-18]*100 -> -1.2216792536650378 | Z36: 27.82 | AC36: =VALUE(RC[-27]) -> 2018-10-15T00:00:00.000 | AD36: =IF(RC[21]=42,"*",IF(RC[21]=32,"",RC[21])) -> - | AE36: =RC[-28] -> 24 | AF36: =RC[-28] -> 250.17 | AG36: =RC[-28] -> 69.569999999999993 | AH36: =RC[-28] -> 8.51 | AI36: =RC[-28] -> 225.1 | AJ36: =RC[-28] -> 46.58 | AK36: =RC[-28] -> 6.95 | AL36: =RC[-28] -> 22.989999999999995 | AM36: =RC[-28] -> 25.07 | AN36: =RC[-28] -> 28.43 | AO36: =RC[-28] -> 69.58 | AP36: - | AQ36: =RC[-29] -> 0 | AR36: =RC[-29] -> 0 | AS36: - | AT36: =RC[-30] -> 0 | AU36: =RC[-30] -> 0 | AV36: =RC[-30] -> 1.9359999999999999 | AW36: =RC[-30] -> 6.9180000000000001 | AY36: - | AZ36: - | BA36: -
A37: =IF(RC[1]="","",DATEVALUE(RC[1])) -> 43389 | B37: 16.10.18 | C37: 24 | D37: 252.44 | E37: 69.540000000000006 | F37: 8.5299999999999994 | G37: 227.45 | H37: 46.83 | I37: 6.93 | J37: =RC[-5]-RC[-2] -> 22.710000000000008 | K37: 24.99 | L37: 28.4 | M37: 69.53 | R37: 1.9330000000000001 | S37: 6.907 | T37: =(RC[-16]*RC[-15]-RC[-13]*RC[-12])/1000 -> 6.9031941000000039 | U37: 27.8 | V37: - | W37: =RC[-2]*RC[-10]/1000 -> 1.9329339999999999 | X37: =ABS((RC[-3]*RC[-11]-RC[-2]*RC[-9])/1000) -> #VALUE! | Y37: =(RC[-14]-RC[1])/RC[-18]*100 -> -1.2354363596394822 | Z37: 27.8 | AC37: =VALUE(RC[-27]) -> 2018-10-16T00:00:00.000 | AD37: =IF(RC[21]=42,"*",IF(RC[21]=32,"",RC[21])) -> - | AE37: =RC[-28] -> 24 | AF37: =RC[-28] -> 252.44 | AG37: =RC[-28] -> 69.540000000000006 | AH37: =RC[-28] -> 8.5299999999999994 | AI37: =RC[-28] -> 227.45 | AJ37: =RC[-28] -> 46.83 | AK37: =RC[-28] -> 6.93 | AL37: =RC[-28] -> 22.710000000000008 | AM37: =RC[-28] -> 24.99 | AN37: =RC[-28] -> 28.4 | AO37: =RC[-28] -> 69.53 | AP37: - | AQ37: =RC[-29] -> 0 | AR37: =RC[-29] -> 0 | AS37: - | AT37: =RC[-30] -> 0 | AU37: =RC[-30] -> 0 | AV37: =RC[-30] -> 1.9330000000000001 | AW37: =RC[-30] -> 6.907 | AY37: - | AZ37: - | BA37: -
A38: =IF(RC[1]="","",DATEVALUE(RC[1])) -> 43390 | B38: 17.10.18 | C38: 24 | D38: 253.17 | E38: 69.790000000000006 | F38: 8.5299999999999994 | G38: 227.72 | H38: 46.91 | I38: 6.93 | J38: =RC[-5]-RC[-2] -> 22.88000000000001 | K38: 25.45 | L38: 28.9 | M38: 69.87 | R38: 1.978 | S38: 6.9859999999999998 | T38: =(RC[-16]*RC[-15]-RC[-13]*RC[-12])/1000 -> 6.9863891000000002 | U38: 28.29 | V38: - | W38: =RC[-2]*RC[-10]/1000 -> 1.9766223000000001 | X38: =ABS((RC[-3]*RC[-11]-RC[-2]*RC[-9])/1000) -> #VALUE! | Y38: =(RC[-14]-RC[1])/RC[-18]*100 -> -1.2471456174249078 | Z38: 28.29 | AC38: =VALUE(RC[-27]) -> 2018-10-17T00:00:00.000 | AD38: =IF(RC[21]=42,"*",IF(RC[21]=32,"",RC[21])) -> - | AE38: =RC[-28] -> 24 | AF38: =RC[-28] -> 253.17 | AG38: =RC[-28] -> 69.790000000000006 | AH38: =RC[-28] -> 8.5299999999999994 | AI38: =RC[-28] -> 227.72 | AJ38: =RC[-28] -> 46.91 | AK38: =RC[-28] -> 6.93 | AL38: =RC[-28] -> 22.88000000000001 | AM38: =RC[-28] -> 25.45 | AN38: =RC[-28] -> 28.9 | AO38: =RC[-28] -> 69.87 | AP38: - | AQ38: =RC[-29] -> 0 | AR38: =RC[-29] -> 0 | AS38: - | AT38: =RC[-30] -> 0 | AU38: =RC[-30] -> 0 | AV38: =RC[-30] -> 1.978 | AW38: =RC[-30] -> 6.9859999999999998 | AY38: - | AZ38: - | BA38: -
A39: =IF(RC[1]="","",DATEVALUE(RC[1])) -> 43391 | B39: 18.10.18 | C39: 24 | D39: 256.74 | E39: 70.23 | F39: 8.56 | G39: 231.32 | H39: 47.22 | I39: 6.91 | J39: =RC[-5]-RC[-2] -> 23.010000000000005 | K39: 25.42 | L39: 29.13 | M39: 70.37 | R39: 2.0070000000000001 | S39: 7.1139999999999999 | T39: =(RC[-16]*RC[-15]-RC[-13]*RC[-12])/1000 -> 7.1079198000000012 | U39: 28.48 | V39: - | W39: =RC[-2]*RC[-10]/1000 -> 2.0041376000000004 | X39: =ABS((RC[-3]*RC[-11]-RC[-2]*RC[-9])/1000) -> #VALUE! | Y39: =(RC[-14]-RC[1])/RC[-18]*100 -> -1.3228428151478466 | Z39: 28.48 | AC39: =VALUE(RC[-27]) -> 2018-10-18T00:00:00.000 | AD39: =IF(RC[21]=42,"*",IF(RC[21]=32,"",RC[21])) -> - | AE39: =RC[-28] -> 24 | AF39: =RC[-28] -> 256.74 | AG39: =RC[-28] -> 70.23 | AH39: =RC[-28] -> 8.56 | AI39: =RC[-28] -> 231.32 | AJ39: =RC[-28] -> 47.22 | AK39: =RC[-28] -> 6.91 | AL39: =RC[-28] -> 23.010000000000005 | AM39: =RC[-28] -> 25.42 | AN39: =RC[-28] -> 29.13 | AO39: =RC[-28] -> 70.37 | AP39: - | AQ39: =RC[-29] -> 0 | AR39: =RC[-29] -> 0 | AS39: - | AT39: =RC[-30] -> 0 | AU39: =RC[-30] -> 0 | AV39: =RC[-30] -> 2.0070000000000001 | AW39: =RC[-30] -> 7.1139999999999999 | AY39: - | AZ39: - | BA39: -
A40: =IF(RC[1]="","",DATEVALUE(RC[1])) -> 43392 | B40: 19.10.18 | C40: 24 | D40: 254.44 | E40: 70.040000000000006 | F40: 8.6 | G40: 231.2 | H40: 46.68 | I40: 6.95 | J40: =RC[-5]-RC[-2] -> 23.360000000000007 | K40: 23.24 | L40: 26.98 | M40: 70.040000000000006 | R40: 1.847 | S40: 7.0330000000000004 | T40: =(RC[-16]*RC[-15]-RC[-13]*RC[-12])/1000 -> 7.0285616000000024 | U40: 26.38 | V40: - | W40: =RC[-2]*RC[-10]/1000 -> 1.8476552000000002 | X40: =ABS((RC[-3]*RC[-11]-RC[-2]*RC[-9])/1000) -> #VALUE! | Y40: =(RC[-14]-RC[1])/RC[-18]*100 -> -1.3581314878892736 | Z40: 26.38 | AC40: =VALUE(RC[-27]) -> 2018-10-19T00:00:00.000 | AD40: =IF(RC[21]=42,"*",IF(RC[21]=32,"",RC[21])) -> - | AE40: =RC[-28] -> 24 | AF40: =RC[-28] -> 254.44 | AG40: =RC[-28] -> 70.040000000000006 | AH40: =RC[-28] -> 8.6 | AI40: =RC[-28] -> 231.2 | AJ40: =RC[-28] -> 46.68 | AK40: =RC[-28] -> 6.95 | AL40: =RC[-28] -> 23.360000000000007 | AM40: =RC[-28] -> 23.24 | AN40: =RC[-28] -> 26.98 | AO40: =RC[-28] -> 70.040000000000006 | AP40: - | AQ40: =RC[-29] -> 0 | AR40: =RC[-29] -> 0 | AS40: - | AT40: =RC[-30] -> 0 | AU40: =RC[-30] -> 0 | AV40: =RC[-30] -> 1.847 | AW40: =RC[-30] -> 7.0330000000000004 | AY40: - | AZ40: - | BA40: -
A41: =IF(RC[1]="","",DATEVALUE(RC[1])) -> 43393 | B41: 20.10.18 | C41: 24 | D41: 248.13 | E41: 69.41 | F41: 8.5399999999999991 | G41: 224.75 | H41: 45.55 | I41: 6.98 | J41: =RC[-5]-RC[-2] -> 23.86 | K41: 23.38 | L41: 26.75 | M41: 69.38 | R41: 1.819 | S41: 6.984 | T41: =(RC[-16]*RC[-15]-RC[-13]*RC[-12])/1000 -> 6.9853407999999977 | U41: 26.19 | V41: - | W41: =RC[-2]*RC[-10]/1000 -> 1.8170622000000001 | X41: =ABS((RC[-3]*RC[-11]-RC[-2]*RC[-9])/1000) -> #VALUE! | Y41: =(RC[-14]-RC[1])/RC[-18]*100 -> -1.250278086763071 | Z41: 26.19 | AC41: =VALUE(RC[-27]) -> 2018-10-20T00:00:00.000 | AD41: =IF(RC[21]=42,"*",IF(RC[21]=32,"",RC[21])) -> - | AE41: =RC[-28] -> 24 | AF41: =RC[-28] -> 248.13 | AG41: =RC[-28] -> 69.41 | AH41: =RC[-28] -> 8.5399999999999991 | AI41: =RC[-28] -> 224.75 | AJ41: =RC[-28] -> 45.55 | AK41: =RC[-28] -> 6.98 | AL41: =RC[-28] -> 23.86 | AM41: =RC[-28] -> 23.38 | AN41: =RC[-28] -> 26.75 | AO41: =RC[-28] -> 69.38 | AP41: - | AQ41: =RC[-29] -> 0 | AR41: =RC[-29] -> 0 | AS41: - | AT41: =RC[-30] -> 0 | AU41: =RC[-30] -> 0 | AV41: =RC[-30] -> 1.819 | AW41: =RC[-30] -> 6.984 | AY41: - | AZ41: - | BA41: -
A42: =IF(RC[1]="","",DATEVALUE(RC[1])) -> 43394 | B42: 21.10.18 | C42: 24 | D42: 252 | E42: 68.599999999999994 | F42: 8.51 | G42: 223.1 | H42: 44.75 | I42: 6.97 | J42: =RC[-5]-RC[-2] -> 23.849999999999994 | K42: 28.9 | L42: 32.58 | M42: 68.7 | R42: 2.1920000000000002 | S42: 7.3040000000000003 | T42: =(RC[-16]*RC[-15]-RC[-13]*RC[-12])/1000 -> 7.3034749999999971 | U42: 31.89 | V42: - | W42: =RC[-2]*RC[-10]/1000 -> 2.1908430000000001 | X42: =ABS((RC[-3]*RC[-11]-RC[-2]*RC[-9])/1000) -> #VALUE! | Y42: =(RC[-14]-RC[1])/RC[-18]*100 -> -1.3402061855670113 | Z42: 31.89 | AC42: =VALUE(RC[-27]) -> 2018-10-21T00:00:00.000 | AD42: =IF(RC[21]=42,"*",IF(RC[21]=32,"",RC[21])) -> - | AE42: =RC[-28] -> 24 | AF42: =RC[-28] -> 252 | AG42: =RC[-28] -> 68.599999999999994 | AH42: =RC[-28] -> 8.51 | AI42: =RC[-28] -> 223.1 | AJ42: =RC[-28] -> 44.75 | AK42: =RC[-28] -> 6.97 | AL42: =RC[-28] -> 23.849999999999994 | AM42: =RC[-28] -> 28.9 | AN42: =RC[-28] -> 32.58 | AO42: =RC[-28] -> 68.7 | AP42: - | AQ42: =RC[-29] -> 0 | AR42: =RC[-29] -> 0 | AS42: - | AT42: =RC[-30] -> 0 | AU42: =RC[-30] -> 0 | AV42: =RC[-30] -> 2.1920000000000002 | AW42: =RC[-30] -> 7.3040000000000003 | AY42: - | AZ42: - | BA42: -
A43: =IF(RC[1]="","",DATEVALUE(RC[1])) -> 43395 | B43: 22.10.18 | C43: 24 | D43: 251.31 | E43: 69.069999999999993 | F43: 8.5399999999999991 | G43: 225.41 | H43: 45.09 | I43: 6.97 | J43: =RC[-5]-RC[-2] -> 23.97999999999999 | K43: 25.9 | L43: 29.64 | M43: 69.34 | R43: 2.0110000000000001 | S43: 7.1959999999999997 | T43: =(RC[-16]*RC[-15]-RC[-13]*RC[-12])/1000 -> 7.1942447999999963 | U43: 29.01 | V43: - | W43: =RC[-2]*RC[-10]/1000 -> 2.0115534000000004 | X43: =ABS((RC[-3]*RC[-11]-RC[-2]*RC[-9])/1000) -> #VALUE! | Y43: =(RC[-14]-RC[1])/RC[-18]*100 -> -1.3797080874850285 | Z43: 29.01 | AC43: =VALUE(RC[-27]) -> 2018-10-22T00:00:00.000 | AD43: =IF(RC[21]=42,"*",IF(RC[21]=32,"",RC[21])) -> - | AE43: =RC[-28] -> 24 | AF43: =RC[-28] -> 251.31 | AG43: =RC[-28] -> 69.069999999999993 | AH43: =RC[-28] -> 8.5399999999999991 | AI43: =RC[-28] -> 225.41 | AJ43: =RC[-28] -> 45.09 | AK43: =RC[-28] -> 6.97 | AL43: =RC[-28] -> 23.97999999999999 | AM43: =RC[-28] -> 25.9 | AN43: =RC[-28] -> 29.64 | AO43: =RC[-28] -> 69.34 | AP43: - | AQ43: =RC[-29] -> 0 | AR43: =RC[-29] -> 0 | AS43: - | AT43: =RC[-30] -> 0 | AU43: =RC[-30] -> 0 | AV43: =RC[-30] -> 2.0110000000000001 | AW43: =RC[-30] -> 7.1959999999999997 | AY43: - | AZ43: - | BA43: -
A44: =IF(RC[1]="","",DATEVALUE(RC[1])) ->  | C44: 24 | J44: =RC[-5]-RC[-2] -> #VALUE! | T44: =(RC[-16]*RC[-15]-RC[-13]*RC[-12])/1000 -> #VALUE! | W44: =RC[-2]*RC[-10]/1000 -> #VALUE! | X44: =ABS((RC[-3]*RC[-11]-RC[-2]*RC[-9])/1000) -> #VALUE! | Y44: =(RC[-14]-RC[1])/RC[-18]*100 -> #VALUE! | AC44: =VALUE(RC[-27]) -> #VALUE! | AD44: =IF(RC[21]=42,"*",IF(RC[21]=32,"",RC[21])) ->  | AE44: =RC[-28] -> 24 | AF44: =RC[-28] ->  | AG44: =RC[-28] ->  | AH44: =RC[-28] ->  | AI44: =RC[-28] ->  | AJ44: =RC[-28] ->  | AK44: =RC[-28] ->  | AL44: =RC[-28] -> #VALUE! | AM44: =RC[-28] ->  | AN44: =RC[-28] ->  | AO44: =RC[-28] ->  | AP44: - | AQ44: =RC[-29] -> 0 | AR44: =RC[-29] -> 0 | AS44: - | AT44: =RC[-30] -> 0 | AU44: =RC[-30] -> 0 | AV44: =RC[-30] ->  | AW44: =RC[-30] -> 
A45: =IF(RC[1]="","",DATEVALUE(RC[1])) ->  | C45: 24 | T45: =(RC[-16]*RC[-15]-RC[-13]*RC[-12])/1000 -> #VALUE! | W45: =RC[-2]*RC[-10]/1000 -> #VALUE! | X45: =ABS((RC[-3]*RC[-11]-RC[-2]*RC[-9])/1000) -> #VALUE! | Y45: =(RC[-14]-RC[1])/RC[-18]*100 -> #VALUE! | AC45: =VALUE(RC[-27]) -> #VALUE! | AD45: =IF(RC[21]=42,"*",IF(RC[21]=32,"",RC[21])) ->  | AE45: =RC[-28] -> 24 | AF45: =RC[-28] ->  | AG45: =RC[-28] ->  | AH45: =RC[-28] ->  | AI45: =RC[-28] ->  | AJ45: =RC[-28] ->  | AK45: =RC[-28] ->  | AL45: =RC[-28] -> 0 | AM45: =RC[-28] ->  | AN45: =RC[-28] ->  | AO45: =RC[-28] ->  | AP45: - | AQ45: =RC[-29] -> 0 | AR45: =RC[-29] -> 0 | AS45: - | AT45: =RC[-30] -> 0 | AU45: =RC[-30] -> 0 | AV45: =RC[-30] ->  | AW45: =RC[-30] -> 
A46: =IF(RC[1]="","",DATEVALUE(RC[1])) ->  | C46: 24 | T46: =(RC[-16]*RC[-15]-RC[-13]*RC[-12])/1000 -> #VALUE! | W46: =RC[-2]*RC[-10]/1000 -> #VALUE! | X46: =ABS((RC[-3]*RC[-11]-RC[-2]*RC[-9])/1000) -> #VALUE! | Y46: =(RC[-14]-RC[1])/RC[-18]*100 -> #VALUE! | AC46: =VALUE(RC[-27]) -> #VALUE! | AD46: =IF(RC[21]=42,"*",IF(RC[21]=32,"",RC[21])) ->  | AE46: =RC[-28] -> 24 | AF46: =RC[-28] ->  | AG46: =RC[-28] ->  | AH46: =RC[-28] ->  | AI46: =RC[-28] ->  | AJ46: =RC[-28] ->  | AK46: =RC[-28] ->  | AL46: =RC[-28] -> 0 | AM46: =RC[-28] ->  | AN46: =RC[-28] ->  | AO46: =RC[-28] ->  | AP46: - | AQ46: =RC[-29] -> 0 | AR46: =RC[-29] -> 0 | AS46: - | AT46: =RC[-30] -> 0 | AU46: =RC[-30] -> 0 | AV46: =RC[-30] ->  | AW46: =RC[-30] -> 
A47: =IF(RC[1]="","",DATEVALUE(RC[1])) ->  | C47: 24 | T47: =(RC[-16]*RC[-15]-RC[-13]*RC[-12])/1000 -> #VALUE! | W47: =RC[-2]*RC[-10]/1000 -> #VALUE! | X47: =ABS((RC[-3]*RC[-11]-RC[-2]*RC[-9])/1000) -> #VALUE! | Y47: =(RC[-14]-RC[1])/RC[-18]*100 -> #VALUE! | AC47: =VALUE(RC[-27]) -> #VALUE! | AD47: =IF(RC[21]=42,"*",IF(RC[21]=32,"",RC[21])) ->  | AE47: =RC[-28] -> 24 | AF47: =RC[-28] ->  | AG47: =RC[-28] ->  | AH47: =RC[-28] ->  | AI47: =RC[-28] ->  | AJ47: =RC[-28] ->  | AK47: =RC[-28] ->  | AL47: =RC[-28] -> 0 | AM47: =RC[-28] ->  | AN47: =RC[-28] ->  | AO47: =RC[-28] ->  | AP47: - | AQ47: =RC[-29] -> 0 | AR47: =RC[-29] -> 0 | AS47: - | AT47: =RC[-30] -> 0 | AU47: =RC[-30] -> 0 | AV47: =RC[-30] ->  | AW47: =RC[-30] -> 
A48: =IF(RC[1]="","",DATEVALUE(RC[1])) ->  | C48: 24 | T48: =(RC[-16]*RC[-15]-RC[-13]*RC[-12])/1000 -> #VALUE! | W48: =RC[-2]*RC[-10]/1000 -> #VALUE! | X48: =ABS((RC[-3]*RC[-11]-RC[-2]*RC[-9])/1000) -> #VALUE! | Y48: =(RC[-14]-RC[1])/RC[-18]*100 -> #VALUE! | AC48: =VALUE(RC[-27]) -> #VALUE! | AD48: =IF(RC[21]=42,"*",IF(RC[21]=32,"",RC[21])) ->  | AE48: =RC[-28] -> 24 | AF48: =RC[-28] ->  | AG48: =RC[-28] ->  | AH48: =RC[-28] ->  | AI48: =RC[-28] ->  | AJ48: =RC[-28] ->  | AK48: =RC[-28] ->  | AL48: =RC[-28] -> 0 | AM48: =RC[-28] ->  | AN48: =RC[-28] ->  | AO48: =RC[-28] ->  | AP48: - | AQ48: =RC[-29] -> 0 | AR48: =RC[-29] -> 0 | AS48: - | AT48: =RC[-30] -> 0 | AU48: =RC[-30] -> 0 | AV48: =RC[-30] ->  | AW48: =RC[-30] -> 
A49: =IF(RC[1]="","",DATEVALUE(RC[1])) ->  | C49: 24 | T49: =(RC[-16]*RC[-15]-RC[-13]*RC[-12])/1000 -> #VALUE! | W49: =RC[-2]*RC[-10]/1000 -> #VALUE! | X49: =ABS((RC[-3]*RC[-11]-RC[-2]*RC[-9])/1000) -> #VALUE! | Y49: =(RC[-14]-RC[1])/RC[-18]*100 -> #VALUE! | AC49: =VALUE(RC[-27]) -> #VALUE! | AD49: =IF(RC[21]=42,"*",IF(RC[21]=32,"",RC[21])) ->  | AE49: =RC[-28] -> 24 | AF49: =RC[-28] ->  | AG49: =RC[-28] ->  | AH49: =RC[-28] ->  | AI49: =RC[-28] ->  | AJ49: =RC[-28] ->  | AK49: =RC[-28] ->  | AL49: =RC[-28] -> 0 | AM49: =RC[-28] ->  | AN49: =RC[-28] ->  | AO49: =RC[-28] ->  | AP49: - | AQ49: =RC[-29] -> 0 | AR49: =RC[-29] -> 0 | AS49: - | AT49: =RC[-30] -> 0 | AU49: =RC[-30] -> 0 | AV49: =RC[-30] ->  | AW49: =RC[-30] -> 
A50: =IF(RC[1]="","",DATEVALUE(RC[1])) ->  | T50: =(RC[-16]*RC[-15]-RC[-13]*RC[-12])/1000 -> #VALUE! | W50: =RC[-2]*RC[-10]/1000 -> #VALUE! | X50: =ABS((RC[-3]*RC[-11]-RC[-2]*RC[-9])/1000) -> #VALUE! | Y50: =(RC[-14]-RC[1])/RC[-18]*100 -> #VALUE! | AC50: =VALUE(RC[-27]) -> #VALUE! | AD50: =IF(RC[21]=42,"*",IF(RC[21]=32,"",RC[21])) ->  | AE50: =RC[-28] ->  | AF50: =RC[-28] ->  | AG50: =RC[-28] ->  | AH50: =RC[-28] ->  | AI50: =RC[-28] ->  | AJ50: =RC[-28] ->  | AK50: =RC[-28] ->  | AL50: =RC[-28] -> 0 | AM50: =RC[-28] ->  | AN50: =RC[-28] ->  | AO50: =RC[-28] ->  | AP50: - | AQ50: =RC[-29] -> 0 | AR50: =RC[-29] -> 0 | AS50: - | AT50: =RC[-30] -> 0 | AU50: =RC[-30] -> 0 | AV50: =RC[-30] ->  | AW50: =RC[-30] -> 
A51: =IF(RC[1]="","",DATEVALUE(RC[1])) ->  | T51: =(RC[-16]*RC[-15]-RC[-13]*RC[-12])/1000 -> #VALUE! | W51: =RC[-2]*RC[-10]/1000 -> #VALUE! | X51: =ABS((RC[-3]*RC[-11]-RC[-2]*RC[-9])/1000) -> #VALUE! | Y51: =(RC[-14]-RC[1])/RC[-18]*100 -> #VALUE! | AC51: =VALUE(RC[-27]) -> #VALUE! | AD51: =IF(RC[21]=42,"*",IF(RC[21]=32,"",RC[21])) ->  | AE51: =RC[-28] ->  | AF51: =RC[-28] ->  | AG51: =RC[-28] ->  | AH51: =RC[-28] ->  | AI51: =RC[-28] ->  | AJ51: =RC[-28] ->  | AK51: =RC[-28] ->  | AL51: =RC[-28] -> 0 | AM51: =RC[-28] ->  | AN51: =RC[-28] ->  | AO51: =RC[-28] ->  | AP51: - | AQ51: =RC[-29] -> 0 | AR51: =RC[-29] -> 0 | AS51: - | AT51: =RC[-30] -> 0 | AU51: =RC[-30] -> 0 | AV51: =RC[-30] ->  | AW51: =RC[-30] -> 
A52: =IF(RC[1]="","",DATEVALUE(RC[1])) ->  | T52: =(RC[-16]*RC[-15]-RC[-13]*RC[-12])/1000 -> #VALUE! | W52: =RC[-2]*RC[-10]/1000 -> #VALUE! | X52: =ABS((RC[-3]*RC[-11]-RC[-2]*RC[-9])/1000) -> #VALUE! | Y52: =(RC[-14]-RC[1])/RC[-18]*100 -> #VALUE! | AC52: =VALUE(RC[-27]) -> #VALUE! | AD52: =IF(RC[21]=42,"*",IF(RC[21]=32,"",RC[21])) ->  | AE52: =RC[-28] ->  | AF52: =RC[-28] ->  | AG52: =RC[-28] ->  | AH52: =RC[-28] ->  | AI52: =RC[-28] ->  | AJ52: =RC[-28] ->  | AK52: =RC[-28] ->  | AL52: =RC[-28] -> 0 | AM52: =RC[-28] ->  | AN52: =RC[-28] ->  | AO52: =RC[-28] ->  | AP52: - | AQ52: =RC[-29] -> 0 | AR52: =RC[-29] -> 0 | AS52: - | AT52: =RC[-30] -> 0 | AU52: =RC[-30] -> 0 | AV52: =RC[-30] ->  | AW52: =RC[-30] -> 
A53: =IF(RC[1]="","",DATEVALUE(RC[1])) ->  | T53: =(RC[-16]*RC[-15]-RC[-13]*RC[-12])/1000 -> #VALUE! | W53: =RC[-2]*RC[-10]/1000 -> #VALUE! | X53: =ABS((RC[-3]*RC[-11]-RC[-2]*RC[-9])/1000) -> #VALUE! | Y53: =(RC[-14]-RC[1])/RC[-18]*100 -> #VALUE! | AC53: =VALUE(RC[-27]) -> #VALUE! | AD53: =IF(RC[21]=42,"*",IF(RC[21]=32,"",RC[21])) ->  | AE53: =RC[-28] ->  | AF53: =RC[-28] ->  | AG53: =RC[-28] ->  | AH53: =RC[-28] ->  | AI53: =RC[-28] ->  | AJ53: =RC[-28] ->  | AK53: =RC[-28] ->  | AL53: =RC[-28] -> 0 | AM53: =RC[-28] ->  | AN53: =RC[-28] ->  | AO53: =RC[-28] ->  | AP53: - | AQ53: =RC[-29] -> 0 | AR53: =RC[-29] -> 0 | AS53: - | AT53: =RC[-30] -> 0 | AU53: =RC[-30] -> 0 | AV53: =RC[-30] ->  | AW53: =RC[-30] -> 
A54: =IF(RC[1]="","",DATEVALUE(RC[1])) ->  | T54: =(RC[-16]*RC[-15]-RC[-13]*RC[-12])/1000 -> #VALUE! | W54: =RC[-2]*RC[-10]/1000 -> #VALUE! | X54: =ABS((RC[-3]*RC[-11]-RC[-2]*RC[-9])/1000) -> #VALUE! | Y54: =(RC[-14]-RC[1])/RC[-18]*100 -> #VALUE! | AC54: =VALUE(RC[-27]) -> #VALUE! | AD54: =IF(RC[21]=42,"*",IF(RC[21]=32,"",RC[21])) ->  | AE54: =RC[-28] ->  | AF54: =RC[-28] ->  | AG54: =RC[-28] ->  | AH54: =RC[-28] ->  | AI54: =RC[-28] ->  | AJ54: =RC[-28] ->  | AK54: =RC[-28] ->  | AL54: =RC[-28] -> 0 | AM54: =RC[-28] ->  | AN54: =RC[-28] ->  | AO54: =RC[-28] ->  | AP54: - | AQ54: =RC[-29] -> 0 | AR54: =RC[-29] -> 0 | AS54: - | AT54: =RC[-30] -> 0 | AU54: =RC[-30] -> 0 | AV54: =RC[-30] ->  | AW54: =RC[-30] -> 
A55: =IF(RC[1]="","",DATEVALUE(RC[1])) ->  | T55: =(RC[-16]*RC[-15]-RC[-13]*RC[-12])/1000 -> #VALUE! | W55: =RC[-2]*RC[-10]/1000 -> #VALUE! | X55: =ABS((RC[-3]*RC[-11]-RC[-2]*RC[-9])/1000) -> #VALUE! | Y55: =(RC[-14]-RC[1])/RC[-18]*100 -> #VALUE! | AC55: =VALUE(RC[-27]) -> #VALUE! | AD55: =IF(RC[21]=42,"*",IF(RC[21]=32,"",RC[21])) ->  | AE55: =RC[-28] ->  | AF55: =RC[-28] ->  | AG55: =RC[-28] ->  | AH55: =RC[-28] ->  | AI55: =RC[-28] ->  | AJ55: =RC[-28] ->  | AK55: =RC[-28] ->  | AL55: =RC[-28] -> 0 | AM55: =RC[-28] ->  | AN55: =RC[-28] ->  | AO55: =RC[-28] ->  | AP55: - | AQ55: =RC[-29] -> 0 | AR55: =RC[-29] -> 0 | AS55: - | AT55: =RC[-30] -> 0 | AU55: =RC[-30] -> 0 | AV55: =RC[-30] ->  | AW55: =RC[-30] -> 
A56: =IF(RC[1]="","",DATEVALUE(RC[1])) ->  | T56: =(RC[-16]*RC[-15]-RC[-13]*RC[-12])/1000 -> #VALUE! | W56: =RC[-2]*RC[-10]/1000 -> #VALUE! | X56: =ABS((RC[-3]*RC[-11]-RC[-2]*RC[-9])/1000) -> #VALUE! | Y56: =(RC[-14]-RC[1])/RC[-18]*100 -> #VALUE! | AC56: =VALUE(RC[-27]) -> #VALUE! | AD56: =IF(RC[21]=42,"*",IF(RC[21]=32,"",RC[21])) ->  | AE56: =RC[-28] ->  | AF56: =RC[-28] ->  | AG56: =RC[-28] ->  | AH56: =RC[-28] ->  | AI56: =RC[-28] ->  | AJ56: =RC[-28] ->  | AK56: =RC[-28] ->  | AL56: =RC[-28] -> 0 | AM56: =RC[-28] ->  | AN56: =RC[-28] ->  | AO56: =RC[-28] ->  | AP56: - | AQ56: =RC[-29] -> 0 | AR56: =RC[-29] -> 0 | AS56: - | AT56: =RC[-30] -> 0 | AU56: =RC[-30] -> 0 | AV56: =RC[-30] ->  | AW56: =RC[-30] -> 
A57: =IF(RC[1]="","",DATEVALUE(RC[1])) ->  | T57: =(RC[-16]*RC[-15]-RC[-13]*RC[-12])/1000 -> #VALUE! | W57: =RC[-2]*RC[-10]/1000 -> #VALUE! | X57: =ABS((RC[-3]*RC[-11]-RC[-2]*RC[-9])/1000) -> #VALUE! | Y57: =(RC[-14]-RC[1])/RC[-18]*100 -> #VALUE! | AC57: =VALUE(RC[-27]) -> #VALUE! | AD57: =IF(RC[21]=42,"*",IF(RC[21]=32,"",RC[21])) ->  | AE57: =RC[-28] ->  | AF57: =RC[-28] ->  | AG57: =RC[-28] ->  | AH57: =RC[-28] ->  | AI57: =RC[-28] ->  | AJ57: =RC[-28] ->  | AK57: =RC[-28] ->  | AL57: =RC[-28] -> 0 | AM57: =RC[-28] ->  | AN57: =RC[-28] ->  | AO57: =RC[-28] ->  | AP57: - | AQ57: =RC[-29] -> 0 | AR57: =RC[-29] -> 0 | AS57: - | AT57: =RC[-30] -> 0 | AU57: =RC[-30] -> 0 | AV57: =RC[-30] ->  | AW57: =RC[-30] -> 
A58: =IF(RC[1]="","",DATEVALUE(RC[1])) ->  | T58: =(RC[-16]*RC[-15]-RC[-13]*RC[-12])/1000 -> #VALUE! | W58: =RC[-2]*RC[-10]/1000 -> #VALUE! | X58: =ABS((RC[-3]*RC[-11]-RC[-2]*RC[-9])/1000) -> #VALUE! | Y58: =(RC[-14]-RC[1])/RC[-18]*100 -> #VALUE! | AC58: =VALUE(RC[-27]) -> #VALUE! | AD58: =IF(RC[21]=42,"*",IF(RC[21]=32,"",RC[21])) ->  | AE58: =RC[-28] ->  | AF58: =RC[-28] ->  | AG58: =RC[-28] ->  | AH58: =RC[-28] ->  | AI58: =RC[-28] ->  | AJ58: =RC[-28] ->  | AK58: =RC[-28] ->  | AL58: =RC[-28] -> 0 | AM58: =RC[-28] ->  | AN58: =RC[-28] ->  | AO58: =RC[-28] ->  | AP58: - | AQ58: =RC[-29] -> 0 | AR58: =RC[-29] -> 0 | AS58: - | AT58: =RC[-30] -> 0 | AU58: =RC[-30] -> 0 | AV58: =RC[-30] ->  | AW58: =RC[-30] -> 
A59: =IF(RC[1]="","",DATEVALUE(RC[1])) ->  | T59: =(RC[-16]*RC[-15]-RC[-13]*RC[-12])/1000 -> #VALUE! | W59: =RC[-2]*RC[-10]/1000 -> #VALUE! | X59: =ABS((RC[-3]*RC[-11]-RC[-2]*RC[-9])/1000) -> #VALUE! | Y59: =(RC[-14]-RC[1])/RC[-18]*100 -> #VALUE! | AC59: =VALUE(RC[-27]) -> #VALUE! | AD59: =IF(RC[21]=42,"*",IF(RC[21]=32,"",RC[21])) ->  | AE59: =RC[-28] ->  | AF59: =RC[-28] ->  | AG59: =RC[-28] ->  | AH59: =RC[-28] ->  | AI59: =RC[-28] ->  | AJ59: =RC[-28] ->  | AK59: =RC[-28] ->  | AL59: =RC[-28] -> 0 | AM59: =RC[-28] ->  | AN59: =RC[-28] ->  | AO59: =RC[-28] ->  | AP59: - | AQ59: =RC[-29] -> 0 | AR59: =RC[-29] -> 0 | AS59: - | AT59: =RC[-30] -> 0 | AU59: =RC[-30] -> 0 | AV59: =RC[-30] ->  | AW59: =RC[-30] -> 
A60: =IF(RC[1]="","",DATEVALUE(RC[1])) ->  | T60: =(RC[-16]*RC[-15]-RC[-13]*RC[-12])/1000 -> #VALUE! | W60: =RC[-2]*RC[-10]/1000 -> #VALUE! | X60: =ABS((RC[-3]*RC[-11]-RC[-2]*RC[-9])/1000) -> #VALUE! | Y60: =(RC[-14]-RC[1])/RC[-18]*100 -> #VALUE! | AC60: =VALUE(RC[-27]) -> #VALUE! | AD60: =IF(RC[21]=42,"*",IF(RC[21]=32,"",RC[21])) ->  | AE60: =RC[-28] ->  | AF60: =RC[-28] ->  | AG60: =RC[-28] ->  | AH60: =RC[-28] ->  | AI60: =RC[-28] ->  | AJ60: =RC[-28] ->  | AK60: =RC[-28] ->  | AL60: =RC[-28] -> 0 | AM60: =RC[-28] ->  | AN60: =RC[-28] ->  | AO60: =RC[-28] ->  | AP60: - | AQ60: =RC[-29] -> 0 | AR60: =RC[-29] -> 0 | AS60: - | AT60: =RC[-30] -> 0 | AU60: =RC[-30] -> 0 | AV60: =RC[-30] ->  | AW60: =RC[-30] -> 
A61: =IF(RC[1]="","",DATEVALUE(RC[1])) ->  | T61: =(RC[-16]*RC[-15]-RC[-13]*RC[-12])/1000 -> #VALUE! | W61: =RC[-2]*RC[-10]/1000 -> #VALUE! | X61: =ABS((RC[-3]*RC[-11]-RC[-2]*RC[-9])/1000) -> #VALUE! | Y61: =(RC[-14]-RC[1])/RC[-18]*100 -> #VALUE! | AC61: =VALUE(RC[-27]) -> #VALUE! | AD61: =IF(RC[21]=42,"*",IF(RC[21]=32,"",RC[21])) ->  | AE61: =RC[-28] ->  | AF61: =RC[-28] ->  | AG61: =RC[-28] ->  | AH61: =RC[-28] ->  | AI61: =RC[-28] ->  | AJ61: =RC[-28] ->  | AK61: =RC[-28] ->  | AL61: =RC[-28] -> 0 | AM61: =RC[-28] ->  | AN61: =RC[-28] ->  | AO61: =RC[-28] ->  | AP61: - | AQ61: =RC[-29] -> 0 | AR61: =RC[-29] -> 0 | AS61: - | AT61: =RC[-30] -> 0 | AU61: =RC[-30] -> 0 | AV61: =RC[-30] ->  | AW61: =RC[-30] -> 
A62: =IF(RC[1]="","",DATEVALUE(RC[1])) ->  | T62: =(RC[-16]*RC[-15]-RC[-13]*RC[-12])/1000 -> #VALUE! | W62: =RC[-2]*RC[-10]/1000 -> #VALUE! | X62: =ABS((RC[-3]*RC[-11]-RC[-2]*RC[-9])/1000) -> #VALUE! | Y62: =(RC[-14]-RC[1])/RC[-18]*100 -> #VALUE! | AC62: =VALUE(RC[-27]) -> #VALUE! | AD62: =IF(RC[21]=42,"*",IF(RC[21]=32,"",RC[21])) ->  | AE62: =RC[-28] ->  | AF62: =RC[-28] ->  | AG62: =RC[-28] ->  | AH62: =RC[-28] ->  | AI62: =RC[-28] ->  | AJ62: =RC[-28] ->  | AK62: =RC[-28] ->  | AL62: =RC[-28] -> 0 | AM62: =RC[-28] ->  | AN62: =RC[-28] ->  | AO62: =RC[-28] ->  | AP62: - | AQ62: =RC[-29] -> 0 | AR62: =RC[-29] -> 0 | AS62: - | AT62: =RC[-30] -> 0 | AU62: =RC[-30] -> 0 | AV62: =RC[-30] ->  | AW62: =RC[-30] -> 
A63: =IF(RC[1]="","",DATEVALUE(RC[1])) ->  | T63: =(RC[-16]*RC[-15]-RC[-13]*RC[-12])/1000 -> #VALUE! | W63: =RC[-2]*RC[-10]/1000 -> #VALUE! | X63: =ABS((RC[-3]*RC[-11]-RC[-2]*RC[-9])/1000) -> #VALUE! | Y63: =(RC[-14]-RC[1])/RC[-18]*100 -> #VALUE! | AC63: =VALUE(RC[-27]) -> #VALUE! | AD63: =IF(RC[21]=42,"*",IF(RC[21]=32,"",RC[21])) ->  | AE63: =RC[-28] ->  | AF63: =RC[-28] ->  | AG63: =RC[-28] ->  | AH63: =RC[-28] ->  | AI63: =RC[-28] ->  | AJ63: =RC[-28] ->  | AK63: =RC[-28] ->  | AL63: =RC[-28] -> 0 | AM63: =RC[-28] ->  | AN63: =RC[-28] ->  | AO63: =RC[-28] ->  | AP63: - | AQ63: =RC[-29] -> 0 | AR63: =RC[-29] -> 0 | AS63: - | AT63: =RC[-30] -> 0 | AU63: =RC[-30] -> 0 | AV63: =RC[-30] ->  | AW63: =RC[-30] -> 
A64: =IF(RC[1]="","",DATEVALUE(RC[1])) ->  | T64: =(RC[-16]*RC[-15]-RC[-13]*RC[-12])/1000 -> #VALUE! | W64: =RC[-2]*RC[-10]/1000 -> #VALUE! | X64: =ABS((RC[-3]*RC[-11]-RC[-2]*RC[-9])/1000) -> #VALUE! | Y64: =(RC[-14]-RC[1])/RC[-18]*100 -> #VALUE! | AC64: =VALUE(RC[-27]) -> #VALUE! | AD64: =IF(RC[21]=42,"*",IF(RC[21]=32,"",RC[21])) ->  | AE64: =RC[-28] ->  | AF64: =RC[-28] ->  | AG64: =RC[-28] ->  | AH64: =RC[-28] ->  | AI64: =RC[-28] ->  | AJ64: =RC[-28] ->  | AK64: =RC[-28] ->  | AL64: =RC[-28] -> 0 | AM64: =RC[-28] ->  | AN64: =RC[-28] ->  | AO64: =RC[-28] ->  | AP64: - | AQ64: =RC[-29] -> 0 | AR64: =RC[-29] -> 0 | AS64: - | AT64: =RC[-30] -> 0 | AU64: =RC[-30] -> 0 | AV64: =RC[-30] ->  | AW64: =RC[-30] -> 
A65: =IF(RC[1]="","",DATEVALUE(RC[1])) ->  | T65: =(RC[-16]*RC[-15]-RC[-13]*RC[-12])/1000 -> #VALUE! | W65: =RC[-2]*RC[-10]/1000 -> #VALUE! | X65: =ABS((RC[-3]*RC[-11]-RC[-2]*RC[-9])/1000) -> #VALUE! | Y65: =(RC[-14]-RC[1])/RC[-18]*100 -> #VALUE! | AC65: =VALUE(RC[-27]) -> #VALUE! | AD65: =IF(RC[21]=42,"*",IF(RC[21]=32,"",RC[21])) ->  | AE65: =RC[-28] ->  | AF65: =RC[-28] ->  | AG65: =RC[-28] ->  | AH65: =RC[-28] ->  | AI65: =RC[-28] ->  | AJ65: =RC[-28] ->  | AK65: =RC[-28] ->  | AL65: =RC[-28] -> 0 | AM65: =RC[-28] ->  | AN65: =RC[-28] ->  | AO65: =RC[-28] ->  | AP65: - | AQ65: =RC[-29] -> 0 | AR65: =RC[-29] -> 0 | AS65: - | AT65: =RC[-30] -> 0 | AU65: =RC[-30] -> 0 | AV65: =RC[-30] ->  | AW65: =RC[-30] -> 
A66: =IF(RC[1]="","",DATEVALUE(RC[1])) ->  | T66: =(RC[-16]*RC[-15]-RC[-13]*RC[-12])/1000 -> #VALUE! | W66: =RC[-2]*RC[-10]/1000 -> #VALUE! | X66: =ABS((RC[-3]*RC[-11]-RC[-2]*RC[-9])/1000) -> #VALUE! | Y66: =(RC[-14]-RC[1])/RC[-18]*100 -> #VALUE! | AC66: =VALUE(RC[-27]) -> #VALUE! | AD66: =IF(RC[21]=42,"*",IF(RC[21]=32,"",RC[21])) ->  | AE66: =RC[-28] ->  | AF66: =RC[-28] ->  | AG66: =RC[-28] ->  | AH66: =RC[-28] ->  | AI66: =RC[-28] ->  | AJ66: =RC[-28] ->  | AK66: =RC[-28] ->  | AL66: =RC[-28] -> 0 | AM66: =RC[-28] ->  | AN66: =RC[-28] ->  | AO66: =RC[-28] ->  | AP66: - | AQ66: =RC[-29] -> 0 | AR66: =RC[-29] -> 0 | AS66: - | AT66: =RC[-30] -> 0 | AU66: =RC[-30] -> 0 | AV66: =RC[-30] ->  | AW66: =RC[-30] -> 
A67: =IF(RC[1]="","",DATEVALUE(RC[1])) ->  | T67: =(RC[-16]*RC[-15]-RC[-13]*RC[-12])/1000 -> #VALUE! | W67: =RC[-2]*RC[-10]/1000 -> #VALUE! | X67: =ABS((RC[-3]*RC[-11]-RC[-2]*RC[-9])/1000) -> #VALUE! | Y67: =(RC[-14]-RC[1])/RC[-18]*100 -> #VALUE! | AC67: =VALUE(RC[-27]) -> #VALUE! | AD67: =IF(RC[21]=42,"*",IF(RC[21]=32,"",RC[21])) ->  | AE67: =RC[-28] ->  | AF67: =RC[-28] ->  | AG67: =RC[-28] ->  | AH67: =RC[-28] ->  | AI67: =RC[-28] ->  | AJ67: =RC[-28] ->  | AK67: =RC[-28] ->  | AL67: =RC[-28] -> 0 | AM67: =RC[-28] ->  | AN67: =RC[-28] ->  | AO67: =RC[-28] ->  | AP67: - | AQ67: =RC[-29] -> 0 | AR67: =RC[-29] -> 0 | AS67: - | AT67: =RC[-30] -> 0 | AU67: =RC[-30] -> 0 | AV67: =RC[-30] ->  | AW67: =RC[-30] -> 
A68: =IF(RC[1]="","",DATEVALUE(RC[1])) ->  | T68: =(RC[-16]*RC[-15]-RC[-13]*RC[-12])/1000 -> #VALUE! | W68: =RC[-2]*RC[-10]/1000 -> #VALUE! | X68: =ABS((RC[-3]*RC[-11]-RC[-2]*RC[-9])/1000) -> #VALUE! | Y68: =(RC[-14]-RC[1])/RC[-18]*100 -> #VALUE! | AC68: =VALUE(RC[-27]) -> #VALUE! | AD68: =IF(RC[21]=42,"*",IF(RC[21]=32,"",RC[21])) ->  | AE68: =RC[-28] ->  | AF68: =RC[-28] ->  | AG68: =RC[-28] ->  | AH68: =RC[-28] ->  | AI68: =RC[-28] ->  | AJ68: =RC[-28] ->  | AK68: =RC[-28] ->  | AL68: =RC[-28] -> 0 | AM68: =RC[-28] ->  | AN68: =RC[-28] ->  | AO68: =RC[-28] ->  | AP68: - | AQ68: =RC[-29] -> 0 | AR68: =RC[-29] -> 0 | AS68: - | AT68: =RC[-30] -> 0 | AU68: =RC[-30] -> 0 | AV68: =RC[-30] ->  | AW68: =RC[-30] -> 
A69: =IF(RC[1]="","",DATEVALUE(RC[1])) ->  | T69: =(RC[-16]*RC[-15]-RC[-13]*RC[-12])/1000 -> #VALUE! | W69: =RC[-2]*RC[-10]/1000 -> #VALUE! | X69: =ABS((RC[-3]*RC[-11]-RC[-2]*RC[-9])/1000) -> #VALUE! | Y69: =(RC[-14]-RC[1])/RC[-18]*100 -> #VALUE! | AC69: =VALUE(RC[-27]) -> #VALUE! | AD69: =IF(RC[21]=42,"*",IF(RC[21]=32,"",RC[21])) ->  | AE69: =RC[-28] ->  | AF69: =RC[-28] ->  | AG69: =RC[-28] ->  | AH69: =RC[-28] ->  | AI69: =RC[-28] ->  | AJ69: =RC[-28] ->  | AK69: =RC[-28] ->  | AL69: =RC[-28] -> 0 | AM69: =RC[-28] ->  | AN69: =RC[-28] ->  | AO69: =RC[-28] ->  | AP69: - | AQ69: =RC[-29] -> 0 | AR69: =RC[-29] -> 0 | AS69: - | AT69: =RC[-30] -> 0 | AU69: =RC[-30] -> 0 | AV69: =RC[-30] ->  | AW69: =RC[-30] -> 
A70: =IF(RC[1]="","",DATEVALUE(RC[1])) ->  | T70: =(RC[-16]*RC[-15]-RC[-13]*RC[-12])/1000 -> #VALUE! | W70: =RC[-2]*RC[-10]/1000 -> #VALUE! | X70: =ABS((RC[-3]*RC[-11]-RC[-2]*RC[-9])/1000) -> #VALUE! | Y70: =(RC[-14]-RC[1])/RC[-18]*100 -> #VALUE! | AC70: =VALUE(RC[-27]) -> #VALUE! | AD70: =IF(RC[21]=42,"*",IF(RC[21]=32,"",RC[21])) ->  | AE70: =RC[-28] ->  | AF70: =RC[-28] ->  | AG70: =RC[-28] ->  | AH70: =RC[-28] ->  | AI70: =RC[-28] ->  | AJ70: =RC[-28] ->  | AK70: =RC[-28] ->  | AL70: =RC[-28] -> 0 | AM70: =RC[-28] ->  | AN70: =RC[-28] ->  | AO70: =RC[-28] ->  | AP70: - | AQ70: =RC[-29] -> 0 | AR70: =RC[-29] -> 0 | AS70: - | AT70: =RC[-30] -> 0 | AU70: =RC[-30] -> 0 | AV70: =RC[-30] ->  | AW70: =RC[-30] -> 
A71: =IF(RC[1]="","",DATEVALUE(RC[1])) ->  | T71: =(RC[-16]*RC[-15]-RC[-13]*RC[-12])/1000 -> #VALUE! | W71: =RC[-2]*RC[-10]/1000 -> #VALUE! | X71: =ABS((RC[-3]*RC[-11]-RC[-2]*RC[-9])/1000) -> #VALUE! | Y71: =(RC[-14]-RC[1])/RC[-18]*100 -> #VALUE! | AC71: =VALUE(RC[-27]) -> #VALUE! | AD71: =IF(RC[21]=42,"*",IF(RC[21]=32,"",RC[21])) ->  | AE71: =RC[-28] ->  | AF71: =RC[-28] ->  | AG71: =RC[-28] ->  | AH71: =RC[-28] ->  | AI71: =RC[-28] ->  | AJ71: =RC[-28] ->  | AK71: =RC[-28] ->  | AL71: =RC[-28] -> 0 | AM71: =RC[-28] ->  | AN71: =RC[-28] ->  | AO71: =RC[-28] ->  | AP71: - | AQ71: =RC[-29] -> 0 | AR71: =RC[-29] -> 0 | AS71: - | AT71: =RC[-30] -> 0 | AU71: =RC[-30] -> 0 | AV71: =RC[-30] ->  | AW71: =RC[-30] -> 
A72: =IF(RC[1]="","",DATEVALUE(RC[1])) ->  | T72: =(RC[-16]*RC[-15]-RC[-13]*RC[-12])/1000 -> #VALUE! | W72: =RC[-2]*RC[-10]/1000 -> #VALUE! | X72: =ABS((RC[-3]*RC[-11]-RC[-2]*RC[-9])/1000) -> #VALUE! | Y72: =(RC[-14]-RC[1])/RC[-18]*100 -> #VALUE! | AC72: =VALUE(RC[-27]) -> #VALUE! | AD72: =IF(RC[21]=42,"*",IF(RC[21]=32,"",RC[21])) ->  | AE72: =RC[-28] ->  | AF72: =RC[-28] ->  | AG72: =RC[-28] ->  | AH72: =RC[-28] ->  | AI72: =RC[-28] ->  | AJ72: =RC[-28] ->  | AK72: =RC[-28] ->  | AL72: =RC[-28] -> 0 | AM72: =RC[-28] ->  | AN72: =RC[-28] ->  | AO72: =RC[-28] ->  | AP72: - | AQ72: =RC[-29] -> 0 | AR72: =RC[-29] -> 0 | AS72: - | AT72: =RC[-30] -> 0 | AU72: =RC[-30] -> 0 | AV72: =RC[-30] ->  | AW72: =RC[-30] -> 
A73: =IF(RC[1]="","",DATEVALUE(RC[1])) ->  | T73: =(RC[-16]*RC[-15]-RC[-13]*RC[-12])/1000 -> #VALUE! | W73: =RC[-2]*RC[-10]/1000 -> #VALUE! | X73: =ABS((RC[-3]*RC[-11]-RC[-2]*RC[-9])/1000) -> #VALUE! | Y73: =(RC[-14]-RC[1])/RC[-18]*100 -> #VALUE! | AC73: =VALUE(RC[-27]) -> #VALUE! | AD73: =IF(RC[21]=42,"*",IF(RC[21]=32,"",RC[21])) ->  | AE73: =RC[-28] ->  | AF73: =RC[-28] ->  | AG73: =RC[-28] ->  | AH73: =RC[-28] ->  | AI73: =RC[-28] ->  | AJ73: =RC[-28] ->  | AK73: =RC[-28] ->  | AL73: =RC[-28] -> 0 | AM73: =RC[-28] ->  | AN73: =RC[-28] ->  | AO73: =RC[-28] ->  | AP73: - | AQ73: =RC[-29] -> 0 | AR73: =RC[-29] -> 0 | AS73: - | AT73: =RC[-30] -> 0 | AU73: =RC[-30] -> 0 | AV73: =RC[-30] ->  | AW73: =RC[-30] -> 
A74: =IF(RC[1]="","",DATEVALUE(RC[1])) ->  | T74: =(RC[-16]*RC[-15]-RC[-13]*RC[-12])/1000 -> #VALUE! | W74: =RC[-2]*RC[-10]/1000 -> #VALUE! | X74: =ABS((RC[-3]*RC[-11]-RC[-2]*RC[-9])/1000) -> #VALUE! | Y74: =(RC[-14]-RC[1])/RC[-18]*100 -> #VALUE! | AC74: =VALUE(RC[-27]) -> #VALUE! | AD74: =IF(RC[21]=42,"*",IF(RC[21]=32,"",RC[21])) ->  | AE74: =RC[-28] ->  | AF74: =RC[-28] ->  | AG74: =RC[-28] ->  | AH74: =RC[-28] ->  | AI74: =RC[-28] ->  | AJ74: =RC[-28] ->  | AK74: =RC[-28] ->  | AL74: =RC[-28] -> 0 | AM74: =RC[-28] ->  | AN74: =RC[-28] ->  | AO74: =RC[-28] ->  | AP74: - | AQ74: =RC[-29] -> 0 | AR74: =RC[-29] -> 0 | AS74: - | AT74: =RC[-30] -> 0 | AU74: =RC[-30] -> 0 | AV74: =RC[-30] ->  | AW74: =RC[-30] -> 
A75: =IF(RC[1]="","",DATEVALUE(RC[1])) ->  | T75: =(RC[-16]*RC[-15]-RC[-13]*RC[-12])/1000 -> #VALUE! | W75: =RC[-2]*RC[-10]/1000 -> #VALUE! | X75: =ABS((RC[-3]*RC[-11]-RC[-2]*RC[-9])/1000) -> #VALUE! | Y75: =(RC[-14]-RC[1])/RC[-18]*100 -> #VALUE! | AC75: =VALUE(RC[-27]) -> #VALUE! | AD75: =IF(RC[21]=42,"*",IF(RC[21]=32,"",RC[21])) ->  | AE75: =RC[-28] ->  | AF75: =RC[-28] ->  | AG75: =RC[-28] ->  | AH75: =RC[-28] ->  | AI75: =RC[-28] ->  | AJ75: =RC[-28] ->  | AK75: =RC[-28] ->  | AL75: =RC[-28] -> 0 | AM75: =RC[-28] ->  | AN75: =RC[-28] ->  | AO75: =RC[-28] ->  | AP75: - | AQ75: =RC[-29] -> 0 | AR75: =RC[-29] -> 0 | AS75: - | AT75: =RC[-30] -> 0 | AU75: =RC[-30] -> 0 | AV75: =RC[-30] ->  | AW75: =RC[-30] -> 
A76: =IF(RC[1]="","",DATEVALUE(RC[1])) ->  | T76: =(RC[-16]*RC[-15]-RC[-13]*RC[-12])/1000 -> #VALUE! | W76: =RC[-2]*RC[-10]/1000 -> #VALUE! | X76: =ABS((RC[-3]*RC[-11]-RC[-2]*RC[-9])/1000) -> #VALUE! | Y76: =(RC[-14]-RC[1])/RC[-18]*100 -> #VALUE! | AC76: =VALUE(RC[-27]) -> #VALUE! | AD76: =IF(RC[21]=42,"*",IF(RC[21]=32,"",RC[21])) ->  | AE76: =RC[-28] ->  | AF76: =RC[-28] ->  | AG76: =RC[-28] ->  | AH76: =RC[-28] ->  | AI76: =RC[-28] ->  | AJ76: =RC[-28] ->  | AK76: =RC[-28] ->  | AL76: =RC[-28] -> 0 | AM76: =RC[-28] ->  | AN76: =RC[-28] ->  | AO76: =RC[-28] ->  | AP76: - | AQ76: =RC[-29] -> 0 | AR76: =RC[-29] -> 0 | AS76: - | AT76: =RC[-30] -> 0 | AU76: =RC[-30] -> 0 | AV76: =RC[-30] ->  | AW76: =RC[-30] -> 
A77: =IF(RC[1]="","",DATEVALUE(RC[1])) ->  | T77: =(RC[-16]*RC[-15]-RC[-13]*RC[-12])/1000 -> #VALUE! | W77: =RC[-2]*RC[-10]/1000 -> #VALUE! | X77: =ABS((RC[-3]*RC[-11]-RC[-2]*RC[-9])/1000) -> #VALUE! | Y77: =(RC[-14]-RC[1])/RC[-18]*100 -> #VALUE! | AC77: =VALUE(RC[-27]) -> #VALUE! | AD77: =IF(RC[21]=42,"*",IF(RC[21]=32,"",RC[21])) ->  | AE77: =RC[-28] ->  | AF77: =RC[-28] ->  | AG77: =RC[-28] ->  | AH77: =RC[-28] ->  | AI77: =RC[-28] ->  | AJ77: =RC[-28] ->  | AK77: =RC[-28] ->  | AL77: =RC[-28] -> 0 | AM77: =RC[-28] ->  | AN77: =RC[-28] ->  | AO77: =RC[-28] ->  | AP77: - | AQ77: =RC[-29] -> 0 | AR77: =RC[-29] -> 0 | AS77: - | AT77: =RC[-30] -> 0 | AU77: =RC[-30] -> 0 | AV77: =RC[-30] ->  | AW77: =RC[-30] -> 
A78: =IF(RC[1]="","",DATEVALUE(RC[1])) ->  | T78: =(RC[-16]*RC[-15]-RC[-13]*RC[-12])/1000 -> #VALUE! | W78: =RC[-2]*RC[-10]/1000 -> #VALUE! | X78: =ABS((RC[-3]*RC[-11]-RC[-2]*RC[-9])/1000) -> #VALUE! | Y78: =(RC[-14]-RC[1])/RC[-18]*100 -> #VALUE! | AC78: =VALUE(RC[-27]) -> #VALUE! | AD78: =IF(RC[21]=42,"*",IF(RC[21]=32,"",RC[21])) ->  | AE78: =RC[-28] ->  | AF78: =RC[-28] ->  | AG78: =RC[-28] ->  | AH78: =RC[-28] ->  | AI78: =RC[-28] ->  | AJ78: =RC[-28] ->  | AK78: =RC[-28] ->  | AL78: =RC[-28] -> 0 | AM78: =RC[-28] ->  | AN78: =RC[-28] ->  | AO78: =RC[-28] ->  | AP78: - | AQ78: =RC[-29] -> 0 | AR78: =RC[-29] -> 0 | AS78: - | AT78: =RC[-30] -> 0 | AU78: =RC[-30] -> 0 | AV78: =RC[-30] ->  | AW78: =RC[-30] -> 
A79: =IF(RC[1]="","",DATEVALUE(RC[1])) ->  | T79: =(RC[-16]*RC[-15]-RC[-13]*RC[-12])/1000 -> #VALUE! | W79: =RC[-2]*RC[-10]/1000 -> #VALUE! | X79: =ABS((RC[-3]*RC[-11]-RC[-2]*RC[-9])/1000) -> #VALUE! | Y79: =(RC[-14]-RC[1])/RC[-18]*100 -> #VALUE! | AC79: =VALUE(RC[-27]) -> #VALUE! | AD79: =IF(RC[21]=42,"*",IF(RC[21]=32,"",RC[21])) ->  | AE79: =RC[-28] ->  | AF79: =RC[-28] ->  | AG79: =RC[-28] ->  | AH79: =RC[-28] ->  | AI79: =RC[-28] ->  | AJ79: =RC[-28] ->  | AK79: =RC[-28] ->  | AL79: =RC[-28] -> 0 | AM79: =RC[-28] ->  | AN79: =RC[-28] ->  | AO79: =RC[-28] ->  | AP79: - | AQ79: =RC[-29] -> 0 | AR79: =RC[-29] -> 0 | AS79: - | AT79: =RC[-30] -> 0 | AU79: =RC[-30] -> 0 | AV79: =RC[-30] ->  | AW79: =RC[-30] -> 
A80: =IF(RC[1]="","",DATEVALUE(RC[1])) ->  | T80: =(RC[-16]*RC[-15]-RC[-13]*RC[-12])/1000 -> #VALUE! | W80: =RC[-2]*RC[-10]/1000 -> #VALUE! | X80: =ABS((RC[-3]*RC[-11]-RC[-2]*RC[-9])/1000) -> #VALUE! | Y80: =(RC[-14]-RC[1])/RC[-18]*100 -> #VALUE! | AC80: =VALUE(RC[-27]) -> #VALUE! | AD80: =IF(RC[21]=42,"*",IF(RC[21]=32,"",RC[21])) ->  | AE80: =RC[-28] ->  | AF80: =RC[-28] ->  | AG80: =RC[-28] ->  | AH80: =RC[-28] ->  | AI80: =RC[-28] ->  | AJ80: =RC[-28] ->  | AK80: =RC[-28] ->  | AL80: =RC[-28] -> 0 | AM80: =RC[-28] ->  | AN80: =RC[-28] ->  | AO80: =RC[-28] ->  | AP80: - | AQ80: =RC[-29] -> 0 | AR80: =RC[-29] -> 0 | AS80: - | AT80: =RC[-30] -> 0 | AU80: =RC[-30] -> 0 | AV80: =RC[-30] ->  | AW80: =RC[-30] -> 
A81: =IF(RC[1]="","",DATEVALUE(RC[1])) ->  | T81: =(RC[-16]*RC[-15]-RC[-13]*RC[-12])/1000 -> #VALUE! | W81: =RC[-2]*RC[-10]/1000 -> #VALUE! | X81: =ABS((RC[-3]*RC[-11]-RC[-2]*RC[-9])/1000) -> #VALUE! | Y81: =(RC[-14]-RC[1])/RC[-18]*100 -> #VALUE! | AC81: =VALUE(RC[-27]) -> #VALUE! | AD81: =IF(RC[21]=42,"*",IF(RC[21]=32,"",RC[21])) ->  | AE81: =RC[-28] ->  | AF81: =RC[-28] ->  | AG81: =RC[-28] ->  | AH81: =RC[-28] ->  | AI81: =RC[-28] ->  | AJ81: =RC[-28] ->  | AK81: =RC[-28] ->  | AL81: =RC[-28] -> 0 | AM81: =RC[-28] ->  | AN81: =RC[-28] ->  | AO81: =RC[-28] ->  | AP81: - | AQ81: =RC[-29] -> 0 | AR81: =RC[-29] -> 0 | AS81: - | AT81: =RC[-30] -> 0 | AU81: =RC[-30] -> 0 | AV81: =RC[-30] ->  | AW81: =RC[-30] -> 
A82: =IF(RC[1]="","",DATEVALUE(RC[1])) ->  | T82: =(RC[-16]*RC[-15]-RC[-13]*RC[-12])/1000 -> #VALUE! | W82: =RC[-2]*RC[-10]/1000 -> #VALUE! | X82: =ABS((RC[-3]*RC[-11]-RC[-2]*RC[-9])/1000) -> #VALUE! | Y82: =(RC[-14]-RC[1])/RC[-18]*100 -> #VALUE! | AC82: =VALUE(RC[-27]) -> #VALUE! | AD82: =IF(RC[21]=42,"*",IF(RC[21]=32,"",RC[21])) ->  | AE82: =RC[-28] ->  | AF82: =RC[-28] ->  | AG82: =RC[-28] ->  | AH82: =RC[-28] ->  | AI82: =RC[-28] ->  | AJ82: =RC[-28] ->  | AK82: =RC[-28] ->  | AL82: =RC[-28] -> 0 | AM82: =RC[-28] ->  | AN82: =RC[-28] ->  | AO82: =RC[-28] ->  | AP82: - | AQ82: =RC[-29] -> 0 | AR82: =RC[-29] -> 0 | AS82: - | AT82: =RC[-30] -> 0 | AU82: =RC[-30] -> 0 | AV82: =RC[-30] ->  | AW82: =RC[-30] -> 
A83: =IF(RC[1]="","",DATEVALUE(RC[1])) ->  | T83: =(RC[-16]*RC[-15]-RC[-13]*RC[-12])/1000 -> #VALUE! | W83: =RC[-2]*RC[-10]/1000 -> #VALUE! | X83: =ABS((RC[-3]*RC[-11]-RC[-2]*RC[-9])/1000) -> #VALUE! | Y83: =(RC[-14]-RC[1])/RC[-18]*100 -> #VALUE! | AC83: =VALUE(RC[-27]) -> #VALUE! | AD83: =IF(RC[21]=42,"*",IF(RC[21]=32,"",RC[21])) ->  | AE83: =RC[-28] ->  | AF83: =RC[-28] ->  | AG83: =RC[-28] ->  | AH83: =RC[-28] ->  | AI83: =RC[-28] ->  | AJ83: =RC[-28] ->  | AK83: =RC[-28] ->  | AL83: =RC[-28] -> 0 | AM83: =RC[-28] ->  | AN83: =RC[-28] ->  | AO83: =RC[-28] ->  | AP83: - | AQ83: =RC[-29] -> 0 | AR83: =RC[-29] -> 0 | AS83: - | AT83: =RC[-30] -> 0 | AU83: =RC[-30] -> 0 | AV83: =RC[-30] ->  | AW83: =RC[-30] -> 
AC84: Среднее | AF84: =R[1]C[-28] -> 202.80933333333329 | AG84: =R[1]C[-28] -> 67.470999999999975 | AH84: =R[1]C[-28] -> 8.5666666666666647 | AI84: =R[1]C[-28] -> 176.50666666666663 | AJ84: =R[1]C[-28] -> 41.532666666666664 | AK84: =R[1]C[-28] -> 6.3416666666666659 | AL84: =R[1]C[-28] -> 25.93833333333334 | AM84: =R[1]C[-28] -> 26.302666666666667 | AN84: =R[1]C[-28] -> 29.428333333333338 | AO84: =R[1]C[-28] -> 67.480999999999995 | AP84: - | AQ84: =R[1]C[-29] -> 0 | AR84: =R[1]C[-29] -> 0 | AS84: - | AT84: =R[1]C[-30] -> 0 | AU84: =R[1]C[-30] -> 0
B85: Среднее | D85: =AVERAGE(OFFSET(R[-74]C,3,0,R7C1,1)) -> 202.80933333333329 | E85: =AVERAGE(OFFSET(R[-74]C,3,0,R7C1,1)) -> 67.470999999999975 | F85: =AVERAGE(OFFSET(R[-74]C,3,0,R7C1,1)) -> 8.5666666666666647 | G85: =AVERAGE(OFFSET(R[-74]C,3,0,R7C1,1)) -> 176.50666666666663 | H85: =AVERAGE(OFFSET(R[-74]C,3,0,R7C1,1)) -> 41.532666666666664 | I85: =AVERAGE(OFFSET(R[-74]C,3,0,R7C1,1)) -> 6.3416666666666659 | J85: =AVERAGE(OFFSET(R[-74]C,3,0,R7C1,1)) -> 25.93833333333334 | K85: =AVERAGE(OFFSET(R[-74]C,3,0,R7C1,1)) -> 26.302666666666667 | L85: =IF(SUM(OFFSET(R[-74]C,3,0,R7C1,1))=0,"",AVERAGE(OFFSET(R[-74]C,3,0,R7C1,1))) -> 29.428333333333338 | M85: =IF(SUM(OFFSET(R[-74]C,3,0,R7C1,1))=0,"",AVERAGE(OFFSET(R[-74]C,3,0,R7C1,1))) -> 67.480999999999995 | R85: =IF(SUM(OFFSET(R[-74]C,3,0,R7C1,1))=0,"",AVERAGE(OFFSET(R[-74]C,3,0,R7C1,1))) -> 1.9450333333333336 | S85: =AVERAGE(OFFSET(R[-74]C,3,0,R7C1,1)) -> 6.0940666666666674 | T85: =AVERAGE(OFFSET(R[-74]C,3,0,R7C1,1)) -> 6.0969885866666651 | W85: =AVERAGE(OFFSET(R[-74]C,3,0,R7C1,1)) -> 1.9443977766666671 | X85: =AVERAGE(OFFSET(R[-74]C,3,0,R7C1,1)) -> #VALUE! | AC85: Итого | AE85: =R[1]C[-28] -> 720 | AF85: =R[1]C[-28] -> 6084.2799999999988 | AI85: =R[1]C[-28] -> 5295.1999999999989 | AM85: =R[1]C[-28] -> 789.08 | AN85: =R[1]C[-28] -> 882.85000000000014 | AQ85: =R[1]C[-29] -> 0 | AU85: =R[1]C[-30] -> 0 | AV85: =R[1]C[-30] -> 58.351000000000006 | AW85: =R[1]C[-30] -> 182.82200000000003
B86: ИТОГО: | C86: =SUM(OFFSET(R[-75]C,3,0,R7C1,1)) -> 720 | D86: =SUM(OFFSET(R[-75]C,3,0,R7C1,1)) -> 6084.2799999999988 | G86: =SUM(OFFSET(R[-75]C,3,0,R7C1,1)) -> 5295.1999999999989 | K86: =SUM(OFFSET(R[-75]C,3,0,R7C1,1)) -> 789.08 | L86: =IF(SUM(OFFSET(R[-75]C,3,0,R7C1,1))=0,"",SUM(OFFSET(R[-75]C,3,0,R7C1,1))) -> 882.85000000000014 | R86: =IF(SUM(OFFSET(R[-75]C,3,0,R7C1,1))=0,"",SUM(OFFSET(R[-75]C,3,0,R7C1,1))) -> 58.351000000000006 | S86: =SUM(OFFSET(R[-75]C,3,0,R7C1,1)) -> 182.82200000000003 | T86: =SUM(OFFSET(R[-75]C,3,0,R7C1,1)) -> 182.90965759999995 | W86: =SUM(OFFSET(R[-75]C,3,0,R7C1,1)) -> 58.331933300000017 | X86: =SUM(OFFSET(R[-75]C,3,0,R7C1,1)) -> #VALUE!
AC87: Досчёт | AF87: =R[1]C[-28] -> 0 | AI87: =R[1]C[-28] -> 0 | AM87: =R[1]C[-28] -> 0 | AN87: =R[1]C[-28] -> 0 | AQ87: =R[1]C[-29] -> 0 | AU87: =R[1]C[-30] -> 0 | AV87: =R[1]C[-30] -> 0 | AW87: =R[1]C[-30] -> 0
A88: 11дн=264ч 4дн=96ч | B88: Досчёт до конца м-ца (+) | C88: =R6C1*24 -> 216 | T88: № 49486 | AC88: Снятие | AF88: =-R[1]C[-28] -> 0 | AI88: =-R[1]C[-28] -> 0 | AM88: =-R[1]C[-28] -> 0 | AN88: =-R[1]C[-28] -> 0 | AQ88: =-R[1]C[-29] -> 0 | AU88: =-R[1]C[-30] -> 0 | AV88: =-R[1]C[-30] -> 0 | AW88: =-R[1]C[-30] -> 0
A89: 9дн=216ч 7дн=168ч | B89: Вычет с предыдущего (-) | C89: =R4C1*24 -> 192 | AC89: Сумма | AF89: =R[1]C[-28] -> 6084.2799999999988 | AI89: =R[1]C[-28] -> 5295.1999999999989 | AM89: =R[1]C[-28] -> 789.08 | AN89: =R[1]C[-28] -> 882.85000000000014 | AQ89: =R[1]C[-29] -> 0 | AU89: =R[1]C[-30] -> 0 | AV89: =R[1]C[-30] -> 58.351000000000006 | AW89: =R[1]C[-30] -> 182.82200000000003
B90: СУММА: | C90: =R[-4]C+R[-2]C-R[-1]C -> 744 | D90: =R[-4]C+R[-2]C-R[-1]C -> 6084.2799999999988 | G90: =R[-4]C+R[-2]C-R[-1]C -> 5295.1999999999989 | K90: =R[-4]C+R[-2]C-R[-1]C -> 789.08 | L90: =IF(SUM(OFFSET(R[-79]C,3,0,R7C1,1))=0,"",(R[-4]C+R[-2]C-R[-1]C)) -> 882.85000000000014 | R90: =IF(SUM(OFFSET(R[-79]C,3,0,R7C1,1))=0,"",(R[-4]C+R[-2]C-R[-1]C)) -> 58.351000000000006 | S90: =R[-4]C+R[-2]C-R[-1]C -> 182.82200000000003
AC91: Тхв на источнике | AE91: V гвс (м3) | AF91: =R[-2]C[15] -> 0 | AG91: W гвс (Гкал) | AH91: =RC[-2]*0.06 -> 0 | AI91: W без гвс (Гкал) | AJ91: =R[-2]C[13]-RC[-2] -> 182.82200000000003
B92: Показания счетчиков на момент снятия данных:
B93: Дата, время | D93: М1, т | F93: М2, т | H93: М3, т | J93: М4, т | L93: Qо, Гкал | N93: Qг, Гкал | P93: время, час
B94: 23.09.18 02:00 | D94: 168695.86 | F94: 133545.79999999999 | H94: 37759.93 | J94: - | L94: 6780.0640000000003 | N94: 2652.252 | P94: -
B95: 23.10.18 02:00 | D95: 174799.46 | F95: 138860.19 | H95: 38625.26 | J95: - | L95: 6963.4449999999997 | N95: 2710.6379999999999 | P95: -
AC97: =ZAYAVKA_N -> з.н д. №02/147-2783 от 04.10.18
B98: Представитель потребителя:_______________________________________________________________________ В.О. Топорков
I101: Рекомендуемые значения по параметрам теплопотребления (не являются официально утверждёнными)
I102: М, т | J102: V, м3 | K102: Qгвс, Гкал | L102: Qотоп, Гкал | M102: Qо, Гкал
I103: =R[-13]C[-3] -> 0 | J103: =RC[-1]/0.98 -> 0 | K103: =RC[-1]*0.06 -> 0 | L103: =RC[1]-RC[-1] -> 58.351000000000006 | M103: =R[-13]C[5] -> 58.351000000000006
O105: ДЛЯ САМОКОНТРОЛЯ
B106: В строке выбора дат указать период с 16.7.13 по 23.8.13 - жильё | N106: Q | O106: Qг
B107: В строке выбора дат указать период с 18.7.13 по 25.8.13 - не жилое | N107: =(R[-21]C[-10]*R[-22]C[-7]-R[-21]C[-9]*R[-22]C[-6])/1000 -> 1073.9159818666662 | O107: =IF(R[-22]C[-2]="",R[-21]C[-3]*R[-22]C/1000,"") ->  | P107: Си2
O108: =IF(R[-23]C[-2]="","",((R[-22]C[-3]*R[-23]C)-(R[-22]C[-2]*R[-23]C[2]))/1000) -> 0 | P108: Си3