Sheet: Лист1
G1: Отчёт о теплопотреблении за октябрь 2018 | M1: з.н д. №02/147-2783 от 04.10.18
A4: =EOMONTH(R[9]C,0)-R[9]C -> 8 | B4: Потребитель: ЗАО "Сити Сервис"
A5: =MAX(R[9]C:R[78]C) -> 2018-10-22T00:00:00.000 | B5: Адрес: г. СПб, Кораблестроителей ул., д.36 к.1 ИТП 4
A6: =EOMONTH(R[-1]C,0)-R[-1]C -> 9 | B6: Телефон: 8-911-021-19-79
A7: =R[-2]C-R[6]C -> 30 | B7: Договор 10023 (.) 85571
A8: 7 | B8: Тепловычислитель: ВКТ-7 № 49517 | L8: М2 мах= | M8: 180.24 | O8: Мгвс мах= | P8: 372.24
L9: Qотоп мах= | M9: 13.512 | O9: Qгвс мах= | P9: 23.52
B10: Расчётная формула: Q=M1*(h1-hхв)-M2*(h2-hхв)
D12: Учёт - ОТОПЛЕНИЕ | M12: Учёт - ГВС
A13: =R[1]C-1 -> 43365 | B13: Дата | C13: N, ч | D13: M1, т | E13: T1, С | F13: P1, кг/см2 | G13: M2, т | H13: T2, С | I13: P2, кг/см2 | J13: dT, гр.C | K13: M1-М2, т | L13: Qотоп, Гкал | M13: V3, м3 | N13: T3, С | O13: V4, м3 | P13: T4, С | Q13: dT, гр.C | R13: V3-V4, м3 | S13: Qгвс, Гкал | T13: Qобщ. | U13: Qo | V13: M3 | W13: M4 | X13: си4 | Y13: си5 | Z13: ТСО | AA13: Внутр. | AD13: Дата | AE13: НС | AF13: n, ч | AG13: М1, т | AH13: t1, гр. С | AI13: Р1, кгс/см2 | AJ13: М2, т | AK13: t2, гр. С | AL13: Р2, кгс/см2 | AM13: t1-t2, гр. С | AN13: М1-М2, т | AO13: Wотоп, Гкал | AP13: М1гвс, т | AQ13: t1гвс, гр. С | AR13: Р1гвс, кгс/см2 | AS13: М2гвс, т | AT13: t2гвс, гр. С | AU13: Р2гвс, кгс/см2 | AV13: t1гвс-t2гвс | AW13: М1гвс-М2гвс, т | AX13: Wгвс, Гкал | AY13: Wсумм, Гкал | BA13: NS_TV1 | BB13: НС | BC13: NS_TV2
A14: =IF(RC[1]="","",DATEVALUE(RC[1])) -> 43366 | B14: 23.09.18 | C14: 24 | D14: 0 | E14: 29.64 | F14: 7.53 | G14: 0 | H14: 22.1 | I14: 5.43 | J14: =RC[-5]-RC[-2] -> 7.5399999999999991 | K14: 0 | L14: 0 | M14: 234.45 | N14: 68.319999999999993 | O14: 147.36000000000001 | P14: 52.76 | Q14: =RC[-3]-RC[-1] -> 15.559999999999995 | R14: 87.09 | S14: 8.0150000000000006 | T14: =RC[-1] -> 8.0150000000000006 | U14: =(RC[-17]*RC[-16]-RC[-14]*RC[-13])/1000 -> 0 | V14: 229.56 | W14: 145.44 | X14: =RC[-2]*RC[-10]/1000 -> 15.683539199999998 | Y14: =(RC[-3]*RC[-11]-RC[-2]*RC[-9])/1000 -> 8.0101247999999998 | Z14: 2013-11-23T00:00:00.000 | AA14: 2013-11-21T00:00:00.000 | AD14: =VALUE(RC[-28]) -> 2018-09-23T00:00:00.000 | AE14: =IF(RC[22]=42,"*",IF(RC[22]=32,"",RC[22])) -> - | AF14: =RC[-29] -> 24 | AG14: =RC[-29] -> 0 | AH14: =RC[-29] -> 29.64 | AI14: =RC[-29] -> 7.53 | AJ14: =RC[-29] -> 0 | AK14: =RC[-29] -> 22.1 | AL14: =RC[-29] -> 5.43 | AM14: =RC[-29] -> 7.5399999999999991 | AN14: =RC[-29] -> 0 | AO14: =RC[-29] -> 0 | AP14: =RC[-29] -> 234.45 | AQ14: =RC[-29] -> 68.319999999999993 | AR14: - | AS14: =RC[-30] -> 147.36000000000001 | AT14: =RC[-30] -> 52.76 | AU14: - | AV14: =RC[-31] -> 15.559999999999995 | AW14: =RC[-31] -> 87.09 | AX14: =RC[-31] -> 8.0150000000000006 | AY14: =RC[-31] -> 8.0150000000000006 | BA14: - | BB14: - | BC14: -
A15: =IF(RC[1]="","",DATEVALUE(RC[1])) -> 43367 | B15: 24.09.18 | C15: 24 | D15: 0 | E15: 29.73 | F15: 7.53 | G15: 0 | H15: 22.03 | I15: 5.43 | J15: =RC[-5]-RC[-2] -> 7.6999999999999993 | K15: 0 | L15: 0 | M15: 229.64 | N15: 67.349999999999994 | O15: 145.49 | P15: 51.92 | Q15: =RC[-3]-RC[-1] -> 15.429999999999993 | R15: 84.15 | S15: 7.6920000000000002 | T15: =RC[-1] -> 7.6920000000000002 | U15: =(RC[-17]*RC[-16]-RC[-14]*RC[-13])/1000 -> 0 | V15: 224.96 | W15: 143.66 | X15: =RC[-2]*RC[-10]/1000 -> 15.151055999999999 | Y15: =(RC[-3]*RC[-11]-RC[-2]*RC[-9])/1000 -> 7.6922287999999988 | Z15: 2013-11-24T00:00:00.000 | AA15: 2013-11-22T00:00:00.000 | AD15: =VALUE(RC[-28]) -> 2018-09-24T00:00:00.000 | AE15: =IF(RC[22]=42,"*",IF(RC[22]=32,"",RC[22])) -> - | AF15: =RC[-29] -> 24 | AG15: =RC[-29] -> 0 | AH15: =RC[-29] -> 29.73 | AI15: =RC[-29] -> 7.53 | AJ15: =RC[-29] -> 0 | AK15: =RC[-29] -> 22.03 | AL15: =RC[-29] -> 5.43 | AM15: =RC[-29] -> 7.6999999999999993 | AN15: =RC[-29] -> 0 | AO15: =RC[-29] -> 0 | AP15: =RC[-29] -> 229.64 | AQ15: =RC[-29] -> 67.349999999999994 | AR15: - | AS15: =RC[-30] -> 145.49 | AT15: =RC[-30] -> 51.92 | AU15: - | AV15: =RC[-31] -> 15.429999999999993 | AW15: =RC[-31] -> 84.15 | AX15: =RC[-31] -> 7.6920000000000002 | AY15: =RC[-31] -> 7.6920000000000002 | BA15: - | BB15: - | BC15: -
A16: =IF(RC[1]="","",DATEVALUE(RC[1])) -> 43368 | B16: 25.09.18 | C16: 24 | D16: 0.02 | E16: 48.3 | F16: 7.53 | G16: 0.02 | H16: 24.11 | I16: 5.43 | J16: =RC[-5]-RC[-2] -> 24.189999999999998 | K16: 0 | L16: 0 | M16: 234.56 | N16: 65.78 | O16: 147.47 | P16: 50.89 | Q16: =RC[-3]-RC[-1] -> 14.89 | R16: 87.09 | S16: 7.7149999999999999 | T16: =RC[-1] -> 7.7149999999999999 | U16: =(RC[-17]*RC[-16]-RC[-14]*RC[-13])/1000 -> 4.8379999999999994E-4 | V16: 230 | W16: 145.71 | X16: =RC[-2]*RC[-10]/1000 -> 15.1294 | Y16: =(RC[-3]*RC[-11]-RC[-2]*RC[-9])/1000 -> 7.7142180999999992 | Z16: 2013-11-25T00:00:00.000 | AA16: 2013-11-23T00:00:00.000 | AD16: =VALUE(RC[-28]) -> 2018-09-25T00:00:00.000 | AE16: =IF(RC[22]=42,"*",IF(RC[22]=32,"",RC[22])) -> - | AF16: =RC[-29] -> 24 | AG16: =RC[-29] -> 0.02 | AH16: =RC[-29] -> 48.3 | AI16: =RC[-29] -> 7.53 | AJ16: =RC[-29] -> 0.02 | AK16: =RC[-29] -> 24.11 | AL16: =RC[-29] -> 5.43 | AM16: =RC[-29] -> 24.189999999999998 | AN16: =RC[-29] -> 0 | AO16: =RC[-29] -> 0 | AP16: =RC[-29] -> 234.56 | AQ16: =RC[-29] -> 65.78 | AR16: - | AS16: =RC[-30] -> 147.47 | AT16: =RC[-30] -> 50.89 | AU16: - | AV16: =RC[-31] -> 14.89 | AW16: =RC[-31] -> 87.09 | AX16: =RC[-31] -> 7.7149999999999999 | AY16: =RC[-31] -> 7.7149999999999999 | BA16: - | BB16: - | BC16: -
A17: =IF(RC[1]="","",DATEVALUE(RC[1])) -> 43369 | B17: 26.09.18 | C17: 24 | D17: 0 | E17: 29.52 | F17: 7.53 | G17: 0 | H17: 21.26 | I17: 5.43 | J17: =RC[-5]-RC[-2] -> 8.259999999999998 | K17: 0 | L17: 0 | M17: 229.6 | N17: 65.14 | O17: 147.16 | P17: 50.35 | Q17: =RC[-3]-RC[-1] -> 14.79 | R17: 82.44 | S17: 7.3460000000000001 | T17: =RC[-1] -> 7.3460000000000001 | U17: =(RC[-17]*RC[-16]-RC[-14]*RC[-13])/1000 -> 0 | V17: 225.21 | W17: 145.44 | X17: =RC[-2]*RC[-10]/1000 -> 14.6701794 | Y17: =(RC[-3]*RC[-11]-RC[-2]*RC[-9])/1000 -> 7.3472754 | Z17: 2013-11-26T00:00:00.000 | AA17: 2013-11-24T00:00:00.000 | AD17: =VALUE(RC[-28]) -> 2018-09-26T00:00:00.000 | AE17: =IF(RC[22]=42,"*",IF(RC[22]=32,"",RC[22])) -> - | AF17: =RC[-29] -> 24 | AG17: =RC[-29] -> 0 | AH17: =RC[-29] -> 29.52 | AI17: =RC[-29] -> 7.53 | AJ17: =RC[-29] -> 0 | AK17: =RC[-29] -> 21.26 | AL17: =RC[-29] -> 5.43 | AM17: =RC[-29] -> 8.259999999999998 | AN17: =RC[-29] -> 0 | AO17: =RC[-29] -> 0 | AP17: =RC[-29] -> 229.6 | AQ17: =RC[-29] -> 65.14 | AR17: - | AS17: =RC[-30] -> 147.16 | AT17: =RC[-30] -> 50.35 | AU17: - | AV17: =RC[-31] -> 14.79 | AW17: =RC[-31] -> 82.44 | AX17: =RC[-31] -> 7.3460000000000001 | AY17: =RC[-31] -> 7.3460000000000001 | BA17: - | BB17: - | BC17: -
A18: =IF(RC[1]="","",DATEVALUE(RC[1])) -> 43370 | B18: 27.09.18 | C18: 24 | D18: 0 | E18: 29.47 | F18: 7.53 | G18: 0 | H18: 22.4 | I18: 5.43 | J18: =RC[-5]-RC[-2] -> 7.07 | K18: 0 | L18: 0 | M18: 231.41 | N18: 61.12 | O18: 141.03 | P18: 47.8 | Q18: =RC[-3]-RC[-1] -> 13.32 | R18: 90.38 | S18: 7.2350000000000003 | T18: =RC[-1] -> 7.2350000000000003 | U18: =(RC[-17]*RC[-16]-RC[-14]*RC[-13])/1000 -> 0 | V18: 227.47 | W18: 139.52000000000001 | X18: =RC[-2]*RC[-10]/1000 -> 13.902966399999999 | Y18: =(RC[-3]*RC[-11]-RC[-2]*RC[-9])/1000 -> 7.2339103999999992 | Z18: 2013-11-27T00:00:00.000 | AA18: 2013-11-25T00:00:00.000 | AD18: =VALUE(RC[-28]) -> 2018-09-27T00:00:00.000 | AE18: =IF(RC[22]=42,"*",IF(RC[22]=32,"",RC[22])) -> - | AF18: =RC[-29] -> 24 | AG18: =RC[-29] -> 0 | AH18: =RC[-29] -> 29.47 | AI18: =RC[-29] -> 7.53 | AJ18: =RC[-29] -> 0 | AK18: =RC[-29] -> 22.4 | AL18: =RC[-29] -> 5.43 | AM18: =RC[-29] -> 7.07 | AN18: =RC[-29] -> 0 | AO18: =RC[-29] -> 0 | AP18: =RC[-29] -> 231.41 | AQ18: =RC[-29] -> 61.12 | AR18: - | AS18: =RC[-30] -> 141.03 | AT18: =RC[-30] -> 47.8 | AU18: - | AV18: =RC[-31] -> 13.32 | AW18: =RC[-31] -> 90.38 | AX18: =RC[-31] -> 7.2350000000000003 | AY18: =RC[-31] -> 7.2350000000000003 | BA18: - | BB18: - | BC18: -
A19: =IF(RC[1]="","",DATEVALUE(RC[1])) -> 43371 | B19: 28.09.18 | C19: 24 | D19: 0 | E19: 26.62 | F19: 7.53 | G19: 0 | H19: 21.57 | I19: 5.43 | J19: =RC[-5]-RC[-2] -> 5.0500000000000007 | K19: 0 | L19: 0 | M19: 231.72 | N19: 64.7 | O19: 146.18 | P19: 49.7 | Q19: =RC[-3]-RC[-1] -> 15 | R19: 85.54 | S19: 7.532 | T19: =RC[-1] -> 7.532 | U19: =(RC[-17]*RC[-16]-RC[-14]*RC[-13])/1000 -> 0 | V19: 227.34 | W19: 144.49 | X19: =RC[-2]*RC[-10]/1000 -> 14.708898000000001 | Y19: =(RC[-3]*RC[-11]-RC[-2]*RC[-9])/1000 -> 7.5277449999999995 | Z19: 2013-11-28T00:00:00.000 | AA19: 2013-11-26T00:00:00.000 | AD19: =VALUE(RC[-28]) -> 2018-09-28T00:00:00.000 | AE19: =IF(RC[22]=42,"*",IF(RC[22]=32,"",RC[22])) -> - | AF19: =RC[-29] -> 24 | AG19: =RC[-29] -> 0 | AH19: =RC[-29] -> 26.62 | AI19: =RC[-29] -> 7.53 | AJ19: =RC[-29] -> 0 | AK19: =RC[-29] -> 21.57 | AL19: =RC[-29] -> 5.43 | AM19: =RC[-29] -> 5.0500000000000007 | AN19: =RC[-29] -> 0 | AO19: =RC[-29] -> 0 | AP19: =RC[-29] -> 231.72 | AQ19: =RC[-29] -> 64.7 | AR19: - | AS19: =RC[-30] -> 146.18 | AT19: =RC[-30] -> 49.7 | AU19: - | AV19: =RC[-31] -> 15 | AW19: =RC[-31] -> 85.54 | AX19: =RC[-31] -> 7.532 | AY19: =RC[-31] -> 7.532 | BA19: - | BB19: - | BC19: -
A20: =IF(RC[1]="","",DATEVALUE(RC[1])) -> 43372 | B20: 29.09.18 | C20: 24 | D20: 0 | E20: 26.96 | F20: 7.53 | G20: 0 | H20: 20.59 | I20: 5.43 | J20: =RC[-5]-RC[-2] -> 6.370000000000001 | K20: 0 | L20: 0 | M20: 237.73 | N20: 64.66 | O20: 146 | P20: 49.93 | Q20: =RC[-3]-RC[-1] -> 14.729999999999997 | R20: 91.73 | S20: 7.8739999999999997 | T20: =RC[-1] -> 7.8739999999999997 | U20: =(RC[-17]*RC[-16]-RC[-14]*RC[-13])/1000 -> 0 | V20: 233.22 | W20: 144.31 | X20: =RC[-2]*RC[-10]/1000 -> 15.0800052 | Y20: =(RC[-3]*RC[-11]-RC[-2]*RC[-9])/1000 -> 7.8746068999999999 | Z20: 2013-11-29T00:00:00.000 | AA20: 2013-11-27T00:00:00.000 | AD20: =VALUE(RC[-28]) -> 2018-09-29T00:00:00.000 | AE20: =IF(RC[22]=42,"*",IF(RC[22]=32,"",RC[22])) -> - | AF20: =RC[-29] -> 24 | AG20: =RC[-29] -> 0 | AH20: =RC[-29] -> 26.96 | AI20: =RC[-29] -> 7.53 | AJ20: =RC[-29] -> 0 | AK20: =RC[-29] -> 20.59 | AL20: =RC[-29] -> 5.43 | AM20: =RC[-29] -> 6.370000000000001 | AN20: =RC[-29] -> 0 | AO20: =RC[-29] -> 0 | AP20: =RC[-29] -> 237.73 | AQ20: =RC[-29] -> 64.66 | AR20: - | AS20: =RC[-30] -> 146 | AT20: =RC[-30] -> 49.93 | AU20: - | AV20: =RC[-31] -> 14.729999999999997 | AW20: =RC[-31] -> 91.73 | AX20: =RC[-31] -> 7.8739999999999997 | AY20: =RC[-31] -> 7.8739999999999997 | BA20: - | BB20: - | BC20: -
A21: =IF(RC[1]="","",DATEVALUE(RC[1])) -> 43373 | B21: 30.09.18 | C21: 24 | D21: 0 | E21: 26.59 | F21: 7.53 | G21: 0 | H21: 20.3 | I21: 5.43 | J21: =RC[-5]-RC[-2] -> 6.2899999999999991 | K21: 0 | L21: 0 | M21: 242.42 | N21: 66.66 | O21: 146.5 | P21: 51.24 | Q21: =RC[-3]-RC[-1] -> 15.419999999999995 | R21: 95.92 | S21: 8.4260000000000002 | T21: =RC[-1] -> 8.4260000000000002 | U21: =(RC[-17]*RC[-16]-RC[-14]*RC[-13])/1000 -> 0 | V21: 237.56 | W21: 144.68 | X21: =RC[-2]*RC[-10]/1000 -> 15.8357496 | Y21: =(RC[-3]*RC[-11]-RC[-2]*RC[-9])/1000 -> 8.4223463999999986 | Z21: 2013-11-30T00:00:00.000 | AA21: 2013-11-28T00:00:00.000 | AD21: =VALUE(RC[-28]) -> 2018-09-30T00:00:00.000 | AE21: =IF(RC[22]=42,"*",IF(RC[22]=32,"",RC[22])) -> - | AF21: =RC[-29] -> 24 | AG21: =RC[-29] -> 0 | AH21: =RC[-29] -> 26.59 | AI21: =RC[-29] -> 7.53 | AJ21: =RC[-29] -> 0 | AK21: =RC[-29] -> 20.3 | AL21: =RC[-29] -> 5.43 | AM21: =RC[-29] -> 6.2899999999999991 | AN21: =RC[-29] -> 0 | AO21: =RC[-29] -> 0 | AP21: =RC[-29] -> 242.42 | AQ21: =RC[-29] -> 66.66 | AR21: - | AS21: =RC[-30] -> 146.5 | AT21: =RC[-30] -> 51.24 | AU21: - | AV21: =RC[-31] -> 15.419999999999995 | AW21: =RC[-31] -> 95.92 | AX21: =RC[-31] -> 8.4260000000000002 | AY21: =RC[-31] -> 8.4260000000000002 | BA21: - | BB21: - | BC21: -
A22: =IF(RC[1]="","",DATEVALUE(RC[1])) -> 43374 | B22: 01.10.18 | C22: 24 | D22: 198.51 | E22: 50.28 | F22: 7.53 | G22: 201.82 | H22: 43.23 | I22: 5.43 | J22: =RC[-5]-RC[-2] -> 7.0500000000000043 | K22: -3.31 | L22: 1.427 | M22: 236.55 | N22: 65.53 | O22: 147.63999999999999 | P22: 51.02 | Q22: =RC[-3]-RC[-1] -> 14.509999999999998 | R22: 88.91 | S22: 7.7569999999999997 | T22: =RC[-8]+RC[-1] -> 9.1839999999999993 | U22: =(RC[-17]*RC[-16]-RC[-14]*RC[-13])/1000 -> 1.2564042000000009 | V22: 231.95 | W22: 145.85 | X22: =RC[-2]*RC[-10]/1000 -> 15.199683499999999 | Y22: =(RC[-3]*RC[-11]-RC[-2]*RC[-9])/1000 -> 7.7584164999999992 | Z22: 2013-12-01T00:00:00.000 | AA22: 2013-11-29T00:00:00.000 | AD22: =VALUE(RC[-28]) -> 2018-10-01T00:00:00.000 | AE22: =IF(RC[22]=42,"*",IF(RC[22]=32,"",RC[22])) -> - | AF22: =RC[-29] -> 24 | AG22: =RC[-29] -> 198.51 | AH22: =RC[-29] -> 50.28 | AI22: =RC[-29] -> 7.53 | AJ22: =RC[-29] -> 201.82 | AK22: =RC[-29] -> 43.23 | AL22: =RC[-29] -> 5.43 | AM22: =RC[-29] -> 7.0500000000000043 | AN22: =RC[-29] -> -3.31 | AO22: =RC[-29] -> 1.427 | AP22: =RC[-29] -> 236.55 | AQ22: =RC[-29] -> 65.53 | AR22: - | AS22: =RC[-30] -> 147.63999999999999 | AT22: =RC[-30] -> 51.02 | AU22: - | AV22: =RC[-31] -> 14.509999999999998 | AW22: =RC[-31] -> 88.91 | AX22: =RC[-31] -> 7.7569999999999997 | AY22: =RC[-31] -> 9.1839999999999993 | BA22: - | BB22: - | BC22: -
A23: =IF(RC[1]="","",DATEVALUE(RC[1])) -> 43375 | B23: 02.10.18 | C23: 24 | D23: 446.26 | E23: 51.48 | F23: 7.53 | G23: 443.61 | H23: 43.97 | I23: 5.43 | J23: =RC[-5]-RC[-2] -> 7.509999999999998 | K23: 2.65 | L23: 3.4780000000000002 | M23: 238.63 | N23: 64.47 | O23: 150.6 | P23: 51.21 | Q23: =RC[-3]-RC[-1] -> 13.259999999999998 | R23: 88.03 | S23: 7.4779999999999998 | T23: =RC[-8]+RC[-1] -> 10.956 | U23: =(RC[-17]*RC[-16]-RC[-14]*RC[-13])/1000 -> 3.4679330999999984 | V23: 234.15 | W23: 148.77000000000001 | X23: =RC[-2]*RC[-10]/1000 -> 15.0956505 | Y23: =(RC[-3]*RC[-11]-RC[-2]*RC[-9])/1000 -> 7.4771387999999988 | Z23: 2013-12-02T00:00:00.000 | AA23: 2013-11-30T00:00:00.000 | AD23: =VALUE(RC[-28]) -> 2018-10-02T00:00:00.000 | AE23: =IF(RC[22]=42,"*",IF(RC[22]=32,"",RC[22])) -> - | AF23: =RC[-29] -> 24 | AG23: =RC[-29] -> 446.26 | AH23: =RC[-29] -> 51.48 | AI23: =RC[-29] -> 7.53 | AJ23: =RC[-29] -> 443.61 | AK23: =RC[-29] -> 43.97 | AL23: =RC[-29] -> 5.43 | AM23: =RC[-29] -> 7.509999999999998 | AN23: =RC[-29] -> 2.65 | AO23: =RC[-29] -> 3.4780000000000002 | AP23: =RC[-29] -> 238.63 | AQ23: =RC[-29] -> 64.47 | AR23: - | AS23: =RC[-30] -> 150.6 | AT23: =RC[-30] -> 51.21 | AU23: - | AV23: =RC[-31] -> 13.259999999999998 | AW23: =RC[-31] -> 88.03 | AX23: =RC[-31] -> 7.4779999999999998 | AY23: =RC[-31] -> 10.956 | BA23: - | BB23: - | BC23: -
A24: =IF(RC[1]="","",DATEVALUE(RC[1])) -> 43376 | B24: 03.10.18 | C24: 24 | D24: 447.02 | E24: 52.11 | F24: 7.53 | G24: 444.2 | H24: 44.11 | I24: 5.43 | J24: =RC[-5]-RC[-2] -> 8 | K24: 2.82 | L24: 3.714 | M24: 238.71 | N24: 64.61 | O24: 148.25 | P24: 51.57 | Q24: =RC[-3]-RC[-1] -> 13.04 | R24: 90.46 | S24: 7.5830000000000002 | T24: =RC[-8]+RC[-1] -> 11.297000000000001 | U24: =(RC[-17]*RC[-16]-RC[-14]*RC[-13])/1000 -> 3.7005501999999977 | V24: 234.19 | W24: 146.41 | X24: =RC[-2]*RC[-10]/1000 -> 15.1310159 | Y24: =(RC[-3]*RC[-11]-RC[-2]*RC[-9])/1000 -> 7.5806522000000003 | Z24: 2013-12-03T00:00:00.000 | AA24: 2013-12-01T00:00:00.000 | AD24: =VALUE(RC[-28]) -> 2018-10-03T00:00:00.000 | AE24: =IF(RC[22]=42,"*",IF(RC[22]=32,"",RC[22])) -> - | AF24: =RC[-29] -> 24 | AG24: =RC[-29] -> 447.02 | AH24: =RC[-29] -> 52.11 | AI24: =RC[-29] -> 7.53 | AJ24: =RC[-29] -> 444.2 | AK24: =RC[-29] -> 44.11 | AL24: =RC[-29] -> 5.43 | AM24: =RC[-29] -> 8 | AN24: =RC[-29] -> 2.82 | AO24: =RC[-29] -> 3.714 | AP24: =RC[-29] -> 238.71 | AQ24: =RC[-29] -> 64.61 | AR24: - | AS24: =RC[-30] -> 148.25 | AT24: =RC[-30] -> 51.57 | AU24: - | AV24: =RC[-31] -> 13.04 | AW24: =RC[-31] -> 90.46 | AX24: =RC[-31] -> 7.5830000000000002 | AY24: =RC[-31] -> 11.297000000000001 | BA24: - | BB24: - | BC24: -
A25: =IF(RC[1]="","",DATEVALUE(RC[1])) -> 43377 | B25: 04.10.18 | C25: 24 | D25: 443.73 | E25: 51.78 | F25: 7.53 | G25: 437.91 | H25: 43.52 | I25: 5.43 | J25: =RC[-5]-RC[-2] -> 8.259999999999998 | K25: 5.82 | L25: 3.9289999999999998 | M25: 236.1 | N25: 64.040000000000006 | O25: 145.76 | P25: 50.3 | Q25: =RC[-3]-RC[-1] -> 13.740000000000009 | R25: 90.34 | S25: 7.5960000000000001 | T25: =RC[-8]+RC[-1] -> 11.525 | U25: =(RC[-17]*RC[-16]-RC[-14]*RC[-13])/1000 -> 3.9184961999999977 | V25: 231.7 | W25: 144.03 | X25: =RC[-2]*RC[-10]/1000 -> 14.838068000000002 | Y25: =(RC[-3]*RC[-11]-RC[-2]*RC[-9])/1000 -> 7.5933590000000013 | Z25: 2013-12-04T00:00:00.000 | AA25: 2013-12-02T00:00:00.000 | AD25: =VALUE(RC[-28]) -> 2018-10-04T00:00:00.000 | AE25: =IF(RC[22]=42,"*",IF(RC[22]=32,"",RC[22])) -> - | AF25: =RC[-29] -> 24 | AG25: =RC[-29] -> 443.73 | AH25: =RC[-29] -> 51.78 | AI25: =RC[-29] -> 7.53 | AJ25: =RC[-29] -> 437.91 | AK25: =RC[-29] -> 43.52 | AL25: =RC[-29] -> 5.43 | AM25: =RC[-29] -> 8.259999999999998 | AN25: =RC[-29] -> 5.82 | AO25: =RC[-29] -> 3.9289999999999998 | AP25: =RC[-29] -> 236.1 | AQ25: =RC[-29] -> 64.040000000000006 | AR25: - | AS25: =RC[-30] -> 145.76 | AT25: =RC[-30] -> 50.3 | AU25: - | AV25: =RC[-31] -> 13.740000000000009 | AW25: =RC[-31] -> 90.34 | AX25: =RC[-31] -> 7.5960000000000001 | AY25: =RC[-31] -> 11.525 | BA25: - | BB25: - | BC25: -
A26: =IF(RC[1]="","",DATEVALUE(RC[1])) -> 43378 | B26: 05.10.18 | C26: 24 | D26: 451.59 | E26: 52.41 | F26: 7.53 | G26: 444.43 | H26: 43.83 | I26: 5.43 | J26: =RC[-5]-RC[-2] -> 8.5799999999999983 | K26: 7.16 | L26: 4.2039999999999997 | M26: 230.94 | N26: 63.42 | O26: 144.97 | P26: 49.58 | Q26: =RC[-3]-RC[-1] -> 13.840000000000003 | R26: 85.97 | S26: 7.2759999999999998 | T26: =RC[-8]+RC[-1] -> 11.48 | U26: =(RC[-17]*RC[-16]-RC[-14]*RC[-13])/1000 -> 4.1884649999999963 | V26: 226.73 | W26: 143.31 | X26: =RC[-2]*RC[-10]/1000 -> 14.379216599999999 | Y26: =(RC[-3]*RC[-11]-RC[-2]*RC[-9])/1000 -> 7.2739067999999998 | Z26: 2013-12-05T00:00:00.000 | AA26: 2013-12-03T00:00:00.000 | AD26: =VALUE(RC[-28]) -> 2018-10-05T00:00:00.000 | AE26: =IF(RC[22]=42,"*",IF(RC[22]=32,"",RC[22])) -> - | AF26: =RC[-29] -> 24 | AG26: =RC[-29] -> 451.59 | AH26: =RC[-29] -> 52.41 | AI26: =RC[-29] -> 7.53 | AJ26: =RC[-29] -> 444.43 | AK26: =RC[-29] -> 43.83 | AL26: =RC[-29] -> 5.43 | AM26: =RC[-29] -> 8.5799999999999983 | AN26: =RC[-29] -> 7.16 | AO26: =RC[-29] -> 4.2039999999999997 | AP26: =RC[-29] -> 230.94 | AQ26: =RC[-29] -> 63.42 | AR26: - | AS26: =RC[-30] -> 144.97 | AT26: =RC[-30] -> 49.58 | AU26: - | AV26: =RC[-31] -> 13.840000000000003 | AW26: =RC[-31] -> 85.97 | AX26: =RC[-31] -> 7.2759999999999998 | AY26: =RC[-31] -> 11.48 | BA26: - | BB26: - | BC26: -
A27: =IF(RC[1]="","",DATEVALUE(RC[1])) -> 43379 | B27: 06.10.18 | C27: 24 | D27: 452.99 | E27: 52.21 | F27: 7.53 | G27: 444.68 | H27: 44.11 | I27: 5.43 | J27: =RC[-5]-RC[-2] -> 8.1000000000000014 | K27: 8.31 | L27: 4.0490000000000004 | M27: 239.53 | N27: 64.040000000000006 | O27: 145.36000000000001 | P27: 50.37 | Q27: =RC[-3]-RC[-1] -> 13.670000000000009 | R27: 94.17 | S27: 7.8230000000000004 | T27: =RC[-8]+RC[-1] -> 11.872 | U27: =(RC[-17]*RC[-16]-RC[-14]*RC[-13])/1000 -> 4.0357730999999983 | V27: 235.06 | W27: 143.65 | X27: =RC[-2]*RC[-10]/1000 -> 15.0532424 | Y27: =(RC[-3]*RC[-11]-RC[-2]*RC[-9])/1000 -> 7.8175919000000009 | Z27: 2013-12-06T00:00:00.000 | AA27: 2013-12-04T00:00:00.000 | AD27: =VALUE(RC[-28]) -> 2018-10-06T00:00:00.000 | AE27: =IF(RC[22]=42,"*",IF(RC[22]=32,"",RC[22])) -> - | AF27: =RC[-29] -> 24 | AG27: =RC[-29] -> 452.99 | AH27: =RC[-29] -> 52.21 | AI27: =RC[-29] -> 7.53 | AJ27: =RC[-29] -> 444.68 | AK27: =RC[-29] -> 44.11 | AL27: =RC[-29] -> 5.43 | AM27: =RC[-29] -> 8.1000000000000014 | AN27: =RC[-29] -> 8.31 | AO27: =RC[-29] -> 4.0490000000000004 | AP27: =RC[-29] -> 239.53 | AQ27: =RC[-29] -> 64.040000000000006 | AR27: - | AS27: =RC[-30] -> 145.36000000000001 | AT27: =RC[-30] -> 50.37 | AU27: - | AV27: =RC[-31] -> 13.670000000000009 | AW27: =RC[-31] -> 94.17 | AX27: =RC[-31] -> 7.8230000000000004 | AY27: =RC[-31] -> 11.872 | BA27: - | BB27: - | BC27: -
A28: =IF(RC[1]="","",DATEVALUE(RC[1])) -> 43380 | B28: 07.10.18 | C28: 24 | D28: 453.94 | E28: 53.13 | F28: 7.53 | G28: 444.63 | H28: 44.81 | I28: 5.43 | J28: =RC[-5]-RC[-2] -> 8.32 | K28: 9.31 | L28: 4.2039999999999997 | M28: 240.47 | N28: 64.3 | O28: 144.35 | P28: 50.39 | Q28: =RC[-3]-RC[-1] -> 13.909999999999997 | R28: 96.12 | S28: 7.9850000000000003 | T28: =RC[-8]+RC[-1] -> 12.189 | U28: =(RC[-17]*RC[-16]-RC[-14]*RC[-13])/1000 -> 4.1939618999999988 | V28: 235.98 | W28: 142.66999999999999 | X28: =RC[-2]*RC[-10]/1000 -> 15.173513999999999 | Y28: =(RC[-3]*RC[-11]-RC[-2]*RC[-9])/1000 -> 7.9843726999999998 | Z28: 2013-12-07T00:00:00.000 | AA28: 2013-12-05T00:00:00.000 | AD28: =VALUE(RC[-28]) -> 2018-10-07T00:00:00.000 | AE28: =IF(RC[22]=42,"*",IF(RC[22]=32,"",RC[22])) -> - | AF28: =RC[-29] -> 24 | AG28: =RC[-29] -> 453.94 | AH28: =RC[-29] -> 53.13 | AI28: =RC[-29] -> 7.53 | AJ28: =RC[-29] -> 444.63 | AK28: =RC[-29] -> 44.81 | AL28: =RC[-29] -> 5.43 | AM28: =RC[-29] -> 8.32 | AN28: =RC[-29] -> 9.31 | AO28: =RC[-29] -> 4.2039999999999997 | AP28: =RC[-29] -> 240.47 | AQ28: =RC[-29] -> 64.3 | AR28: - | AS28: =RC[-30] -> 144.35 | AT28: =RC[-30] -> 50.39 | AU28: - | AV28: =RC[-31] -> 13.909999999999997 | AW28: =RC[-31] -> 96.12 | AX28: =RC[-31] -> 7.9850000000000003 | AY28: =RC[-31] -> 12.189 | BA28: - | BB28: - | BC28: -
A29: =IF(RC[1]="","",DATEVALUE(RC[1])) -> 43381 | B29: 08.10.18 | C29: 24 | D29: 445.88 | E29: 52.24 | F29: 7.53 | G29: 436.57 | H29: 44.21 | I29: 5.43 | J29: =RC[-5]-RC[-2] -> 8.0300000000000011 | K29: 9.31 | L29: 4.0049999999999999 | M29: 234.61 | N29: 64.17 | O29: 145.37 | P29: 50.04 | Q29: =RC[-3]-RC[-1] -> 14.130000000000003 | R29: 89.24 | S29: 7.5839999999999996 | T29: =RC[-8]+RC[-1] -> 11.588999999999999 | U29: =(RC[-17]*RC[-16]-RC[-14]*RC[-13])/1000 -> 3.9920115000000007 | V29: 230.24 | W29: 143.69 | X29: =RC[-2]*RC[-10]/1000 -> 14.774500800000002 | Y29: =(RC[-3]*RC[-11]-RC[-2]*RC[-9])/1000 -> 7.5842532000000018 | Z29: 2013-12-08T00:00:00.000 | AA29: 2013-12-06T00:00:00.000 | AD29: =VALUE(RC[-28]) -> 2018-10-08T00:00:00.000 | AE29: =IF(RC[22]=42,"*",IF(RC[22]=32,"",RC[22])) -> - | AF29: =RC[-29] -> 24 | AG29: =RC[-29] -> 445.88 | AH29: =RC[-29] -> 52.24 | AI29: =RC[-29] -> 7.53 | AJ29: =RC[-29] -> 436.57 | AK29: =RC[-29] -> 44.21 | AL29: =RC[-29] -> 5.43 | AM29: =RC[-29] -> 8.0300000000000011 | AN29: =RC[-29] -> 9.31 | AO29: =RC[-29] -> 4.0049999999999999 | AP29: =RC[-29] -> 234.61 | AQ29: =RC[-29] -> 64.17 | AR29: - | AS29: =RC[-30] -> 145.37 | AT29: =RC[-30] -> 50.04 | AU29: - | AV29: =RC[-31] -> 14.130000000000003 | AW29: =RC[-31] -> 89.24 | AX29: =RC[-31] -> 7.5839999999999996 | AY29: =RC[-31] -> 11.588999999999999 | BA29: - | BB29: - | BC29: -
A30: =IF(RC[1]="","",DATEVALUE(RC[1])) -> 43382 | B30: 09.10.18 | C30: 24 | D30: 451.98 | E30: 50.68 | F30: 7.53 | G30: 442.4 | H30: 43.19 | I30: 5.43 | J30: =RC[-5]-RC[-2] -> 7.490000000000002 | K30: 9.58 | L30: 3.81 | M30: 234.94 | N30: 64.05 | O30: 145.08000000000001 | P30: 50 | Q30: =RC[-3]-RC[-1] -> 14.049999999999997 | R30: 89.86 | S30: 7.6 | T30: =RC[-8]+RC[-1] -> 11.41 | U30: =(RC[-17]*RC[-16]-RC[-14]*RC[-13])/1000 -> 3.7990904000000048 | V30: 230.59 | W30: 143.4 | X30: =RC[-2]*RC[-10]/1000 -> 14.769289499999999 | Y30: =(RC[-3]*RC[-11]-RC[-2]*RC[-9])/1000 -> 7.5992894999999994 | Z30: 2013-12-09T00:00:00.000 | AA30: 2013-12-07T00:00:00.000 | AD30: =VALUE(RC[-28]) -> 2018-10-09T00:00:00.000 | AE30: =IF(RC[22]=42,"*",IF(RC[22]=32,"",RC[22])) -> - | AF30: =RC[-29] -> 24 | AG30: =RC[-29] -> 451.98 | AH30: =RC[-29] -> 50.68 | AI30: =RC[-29] -> 7.53 | AJ30: =RC[-29] -> 442.4 | AK30: =RC[-29] -> 43.19 | AL30: =RC[-29] -> 5.43 | AM30: =RC[-29] -> 7.490000000000002 | AN30: =RC[-29] -> 9.58 | AO30: =RC[-29] -> 3.81 | AP30: =RC[-29] -> 234.94 | AQ30: =RC[-29] -> 64.05 | AR30: - | AS30: =RC[-30] -> 145.08000000000001 | AT30: =RC[-30] -> 50 | AU30: - | AV30: =RC[-31] -> 14.049999999999997 | AW30: =RC[-31] -> 89.86 | AX30: =RC[-31] -> 7.6 | AY30: =RC[-31] -> 11.41 | BA30: - | BB30: - | BC30: -
A31: =IF(RC[1]="","",DATEVALUE(RC[1])) -> 43383 | B31: 10.10.18 | C31: 24 | D31: 452.58 | E31: 51.42 | F31: 7.53 | G31: 442.71 | H31: 43.78 | I31: 5.43 | J31: =RC[-5]-RC[-2] -> 7.6400000000000006 | K31: 9.8699999999999992 | L31: 3.9049999999999998 | M31: 237.67 | N31: 64.94 | O31: 146.80000000000001 | P31: 50.69 | Q31: =RC[-3]-RC[-1] -> 14.25 | R31: 90.87 | S31: 7.79 | T31: =RC[-8]+RC[-1] -> 11.695 | U31: =(RC[-17]*RC[-16]-RC[-14]*RC[-13])/1000 -> 3.889819800000001 | V31: 233.13 | W31: 145.03 | X31: =RC[-2]*RC[-10]/1000 -> 15.139462200000001 | Y31: =(RC[-3]*RC[-11]-RC[-2]*RC[-9])/1000 -> 7.7878915000000006 | Z31: 2013-12-10T00:00:00.000 | AA31: 2013-12-08T00:00:00.000 | AD31: =VALUE(RC[-28]) -> 2018-10-10T00:00:00.000 | AE31: =IF(RC[22]=42,"*",IF(RC[22]=32,"",RC[22])) -> - | AF31: =RC[-29] -> 24 | AG31: =RC[-29] -> 452.58 | AH31: =RC[-29] -> 51.42 | AI31: =RC[-29] -> 7.53 | AJ31: =RC[-29] -> 442.71 | AK31: =RC[-29] -> 43.78 | AL31: =RC[-29] -> 5.43 | AM31: =RC[-29] -> 7.6400000000000006 | AN31: =RC[-29] -> 9.8699999999999992 | AO31: =RC[-29] -> 3.9049999999999998 | AP31: =RC[-29] -> 237.67 | AQ31: =RC[-29] -> 64.94 | AR31: - | AS31: =RC[-30] -> 146.80000000000001 | AT31: =RC[-30] -> 50.69 | AU31: - | AV31: =RC[-31] -> 14.25 | AW31: =RC[-31] -> 90.87 | AX31: =RC[-31] -> 7.79 | AY31: =RC[-31] -> 11.695 | BA31: - | BB31: - | BC31: -
A32: =IF(RC[1]="","",DATEVALUE(RC[1])) -> 43384 | B32: 11.10.18 | C32: 24 | D32: 452.65 | E32: 51.75 | F32: 7.53 | G32: 442.95 | H32: 44.06 | I32: 5.43 | J32: =RC[-5]-RC[-2] -> 7.6899999999999977 | K32: 9.6999999999999993 | L32: 3.9239999999999999 | M32: 234.49 | N32: 65.819999999999993 | O32: 149.81 | P32: 51.14 | Q32: =RC[-3]-RC[-1] -> 14.679999999999993 | R32: 84.68 | S32: 7.569 | T32: =RC[-8]+RC[-1] -> 11.493 | U32: =(RC[-17]*RC[-16]-RC[-14]*RC[-13])/1000 -> 3.9082604999999968 | V32: 229.91 | W32: 147.97 | X32: =RC[-2]*RC[-10]/1000 -> 15.132676199999999 | Y32: =(RC[-3]*RC[-11]-RC[-2]*RC[-9])/1000 -> 7.5654903999999981 | Z32: 2013-12-11T00:00:00.000 | AA32: 2013-12-09T00:00:00.000 | AD32: =VALUE(RC[-28]) -> 2018-10-11T00:00:00.000 | AE32: =IF(RC[22]=42,"*",IF(RC[22]=32,"",RC[22])) -> - | AF32: =RC[-29] -> 24 | AG32: =RC[-29] -> 452.65 | AH32: =RC[-29] -> 51.75 | AI32: =RC[-29] -> 7.53 | AJ32: =RC[-29] -> 442.95 | AK32: =RC[-29] -> 44.06 | AL32: =RC[-29] -> 5.43 | AM32: =RC[-29] -> 7.6899999999999977 | AN32: =RC[-29] -> 9.6999999999999993 | AO32: =RC[-29] -> 3.9239999999999999 | AP32: =RC[-29] -> 234.49 | AQ32: =RC[-29] -> 65.819999999999993 | AR32: - | AS32: =RC[-30] -> 149.81 | AT32: =RC[-30] -> 51.14 | AU32: - | AV32: =RC[-31] -> 14.679999999999993 | AW32: =RC[-31] -> 84.68 | AX32: =RC[-31] -> 7.569 | AY32: =RC[-31] -> 11.493 | BA32: - | BB32: - | BC32: -
A33: =IF(RC[1]="","",DATEVALUE(RC[1])) -> 43385 | B33: 12.10.18 | C33: 24 | D33: 454.33 | E33: 50.28 | F33: 7.53 | G33: 444.63 | H33: 42.99 | I33: 5.43 | J33: =RC[-5]-RC[-2] -> 7.2899999999999991 | K33: 9.6999999999999993 | L33: 3.7429999999999999 | M33: 230.38 | N33: 65.650000000000006 | O33: 149.51 | P33: 50.96 | Q33: =RC[-3]-RC[-1] -> 14.690000000000005 | R33: 80.87 | S33: 7.3049999999999997 | T33: =RC[-8]+RC[-1] -> 11.048 | U33: =(RC[-17]*RC[-16]-RC[-14]*RC[-13])/1000 -> 3.7290687 | V33: 225.92 | W33: 147.69999999999999 | X33: =RC[-2]*RC[-10]/1000 -> 14.831648000000001 | Y33: =(RC[-3]*RC[-11]-RC[-2]*RC[-9])/1000 -> 7.3048560000000018 | Z33: 2013-12-12T00:00:00.000 | AA33: 2013-12-10T00:00:00.000 | AD33: =VALUE(RC[-28]) -> 2018-10-12T00:00:00.000 | AE33: =IF(RC[22]=42,"*",IF(RC[22]=32,"",RC[22])) -> - | AF33: =RC[-29] -> 24 | AG33: =RC[-29] -> 454.33 | AH33: =RC[-29] -> 50.28 | AI33: =RC[-29] -> 7.53 | AJ33: =RC[-29] -> 444.63 | AK33: =RC[-29] -> 42.99 | AL33: =RC[-29] -> 5.43 | AM33: =RC[-29] -> 7.2899999999999991 | AN33: =RC[-29] -> 9.6999999999999993 | AO33: =RC[-29] -> 3.7429999999999999 | AP33: =RC[-29] -> 230.38 | AQ33: =RC[-29] -> 65.650000000000006 | AR33: - | AS33: =RC[-30] -> 149.51 | AT33: =RC[-30] -> 50.96 | AU33: - | AV33: =RC[-31] -> 14.690000000000005 | AW33: =RC[-31] -> 80.87 | AX33: =RC[-31] -> 7.3049999999999997 | AY33: =RC[-31] -> 11.048 | BA33: - | BB33: - | BC33: -
A34: =IF(RC[1]="","",DATEVALUE(RC[1])) -> 43386 | B34: 13.10.18 | C34: 24 | D34: 454.94 | E34: 51.5 | F34: 7.53 | G34: 445.3 | H34: 44.05 | I34: 5.43 | J34: =RC[-5]-RC[-2] -> 7.4500000000000028 | K34: 9.64 | L34: 3.827 | M34: 233.26 | N34: 66.62 | O34: 149.4 | P34: 51.64 | Q34: =RC[-3]-RC[-1] -> 14.980000000000004 | R34: 83.86 | S34: 7.6109999999999998 | T34: =RC[-8]+RC[-1] -> 11.437999999999999 | U34: =(RC[-17]*RC[-16]-RC[-14]*RC[-13])/1000 -> 3.8139449999999999 | V34: 228.6 | W34: 147.55000000000001 | X34: =RC[-2]*RC[-10]/1000 -> 15.229332000000001 | Y34: =(RC[-3]*RC[-11]-RC[-2]*RC[-9])/1000 -> 7.6098499999999998 | Z34: 2013-12-13T00:00:00.000 | AA34: 2013-12-11T00:00:00.000 | AD34: =VALUE(RC[-28]) -> 2018-10-13T00:00:00.000 | AE34: =IF(RC[22]=42,"*",IF(RC[22]=32,"",RC[22])) -> - | AF34: =RC[-29] -> 24 | AG34: =RC[-29] -> 454.94 | AH34: =RC[-29] -> 51.5 | AI34: =RC[-29] -> 7.53 | AJ34: =RC[-29] -> 445.3 | AK34: =RC[-29] -> 44.05 | AL34: =RC[-29] -> 5.43 | AM34: =RC[-29] -> 7.4500000000000028 | AN34: =RC[-29] -> 9.64 | AO34: =RC[-29] -> 3.827 | AP34: =RC[-29] -> 233.26 | AQ34: =RC[-29] -> 66.62 | AR34: - | AS34: =RC[-30] -> 149.4 | AT34: =RC[-30] -> 51.64 | AU34: - | AV34: =RC[-31] -> 14.980000000000004 | AW34: =RC[-31] -> 83.86 | AX34: =RC[-31] -> 7.6109999999999998 | AY34: =RC[-31] -> 11.437999999999999 | BA34: - | BB34: - | BC34: -
A35: =IF(RC[1]="","",DATEVALUE(RC[1])) -> 43387 | B35: 14.10.18 | C35: 24 | D35: 455.01 | E35: 50.79 | F35: 7.53 | G35: 445.6 | H35: 43.84 | I35: 5.43 | J35: =RC[-5]-RC[-2] -> 6.9499999999999957 | K35: 9.41 | L35: 3.5880000000000001 | M35: 236.85 | N35: 67.37 | O35: 148.66 | P35: 52.31 | Q35: =RC[-3]-RC[-1] -> 15.060000000000002 | R35: 88.19 | S35: 7.9560000000000004 | T35: =RC[-8]+RC[-1] -> 11.544 | U35: =(RC[-17]*RC[-16]-RC[-14]*RC[-13])/1000 -> 3.5748538999999946 | V35: 232.02 | W35: 146.80000000000001 | X35: =RC[-2]*RC[-10]/1000 -> 15.631187400000002 | Y35: =(RC[-3]*RC[-11]-RC[-2]*RC[-9])/1000 -> 7.9520794000000015 | Z35: 2013-12-14T00:00:00.000 | AA35: 2013-12-12T00:00:00.000 | AD35: =VALUE(RC[-28]) -> 2018-10-14T00:00:00.000 | AE35: =IF(RC[22]=42,"*",IF(RC[22]=32,"",RC[22])) -> - | AF35: =RC[-29] -> 24 | AG35: =RC[-29] -> 455.01 | AH35: =RC[-29] -> 50.79 | AI35: =RC[-29] -> 7.53 | AJ35: =RC[-29] -> 445.6 | AK35: =RC[-29] -> 43.84 | AL35: =RC[-29] -> 5.43 | AM35: =RC[-29] -> 6.9499999999999957 | AN35: =RC[-29] -> 9.41 | AO35: =RC[-29] -> 3.5880000000000001 | AP35: =RC[-29] -> 236.85 | AQ35: =RC[-29] -> 67.37 | AR35: - | AS35: =RC[-30] -> 148.66 | AT35: =RC[-30] -> 52.31 | AU35: - | AV35: =RC[-31] -> 15.060000000000002 | AW35: =RC[-31] -> 88.19 | AX35: =RC[-31] -> 7.9560000000000004 | AY35: =RC[-31] -> 11.544 | BA35: - | BB35: - | BC35: -
A36: =IF(RC[1]="","",DATEVALUE(RC[1])) -> 43388 | B36: 15.10.18 | C36: 24 | D36: 455.17 | E36: 50.79 | F36: 7.53 | G36: 445.5 | H36: 44.03 | I36: 5.43 | J36: =RC[-5]-RC[-2] -> 6.759999999999998 | K36: 9.67 | L36: 3.5129999999999999 | M36: 232.71 | N36: 66.91 | O36: 150.53 | P36: 52.18 | Q36: =RC[-3]-RC[-1] -> 14.729999999999997 | R36: 82.18 | S36: 7.5019999999999998 | T36: =RC[-8]+RC[-1] -> 11.015000000000001 | U36: =(RC[-17]*RC[-16]-RC[-14]*RC[-13])/1000 -> 3.5027192999999972 | V36: 228.01 | W36: 148.63999999999999 | X36: =RC[-2]*RC[-10]/1000 -> 15.256149099999998 | Y36: =(RC[-3]*RC[-11]-RC[-2]*RC[-9])/1000 -> 7.5001138999999997 | Z36: 2013-12-15T00:00:00.000 | AA36: 2013-12-13T00:00:00.000 | AD36: =VALUE(RC[-28]) -> 2018-10-15T00:00:00.000 | AE36: =IF(RC[22]=42,"*",IF(RC[22]=32,"",RC[22])) -> - | AF36: =RC[-29] -> 24 | AG36: =RC[-29] -> 455.17 | AH36: =RC[-29] -> 50.79 | AI36: =RC[-29] -> 7.53 | AJ36: =RC[-29] -> 445.5 | AK36: =RC[-29] -> 44.03 | AL36: =RC[-29] -> 5.43 | AM36: =RC[-29] -> 6.759999999999998 | AN36: =RC[-29] -> 9.67 | AO36: =RC[-29] -> 3.5129999999999999 | AP36: =RC[-29] -> 232.71 | AQ36: =RC[-29] -> 66.91 | AR36: - | AS36: =RC[-30] -> 150.53 | AT36: =RC[-30] -> 52.18 | AU36: - | AV36: =RC[-31] -> 14.729999999999997 | AW36: =RC[-31] -> 82.18 | AX36: =RC[-31] -> 7.5019999999999998 | AY36: =RC[-31] -> 11.015000000000001 | BA36: - | BB36: - | BC36: -
A37: =IF(RC[1]="","",DATEVALUE(RC[1])) -> 43389 | B37: 16.10.18 | C37: 24 | D37: 455.53 | E37: 50.09 | F37: 7.53 | G37: 445.65 | H37: 43.53 | I37: 5.43 | J37: =RC[-5]-RC[-2] -> 6.5600000000000023 | K37: 9.8800000000000008 | L37: 3.4319999999999999 | M37: 235.83 | N37: 66.97 | O37: 153.44999999999999 | P37: 52.35 | Q37: =RC[-3]-RC[-1] -> 14.619999999999997 | R37: 82.38 | S37: 7.548 | T37: =RC[-8]+RC[-1] -> 10.98 | U37: =(RC[-17]*RC[-16]-RC[-14]*RC[-13])/1000 -> 3.4183532000000012 | V37: 231.1 | W37: 151.5 | X37: =RC[-2]*RC[-10]/1000 -> 15.476767000000001 | Y37: =(RC[-3]*RC[-11]-RC[-2]*RC[-9])/1000 -> 7.5457419999999988 | Z37: 2013-12-16T00:00:00.000 | AA37: 2013-12-14T00:00:00.000 | AD37: =VALUE(RC[-28]) -> 2018-10-16T00:00:00.000 | AE37: =IF(RC[22]=42,"*",IF(RC[22]=32,"",RC[22])) -> - | AF37: =RC[-29] -> 24 | AG37: =RC[-29] -> 455.53 | AH37: =RC[-29] -> 50.09 | AI37: =RC[-29] -> 7.53 | AJ37: =RC[-29] -> 445.65 | AK37: =RC[-29] -> 43.53 | AL37: =RC[-29] -> 5.43 | AM37: =RC[-29] -> 6.5600000000000023 | AN37: =RC[-29] -> 9.8800000000000008 | AO37: =RC[-29] -> 3.4319999999999999 | AP37: =RC[-29] -> 235.83 | AQ37: =RC[-29] -> 66.97 | AR37: - | AS37: =RC[-30] -> 153.44999999999999 | AT37: =RC[-30] -> 52.35 | AU37: - | AV37: =RC[-31] -> 14.619999999999997 | AW37: =RC[-31] -> 82.38 | AX37: =RC[-31] -> 7.548 | AY37: =RC[-31] -> 10.98 | BA37: - | BB37: - | BC37: -
A38: =IF(RC[1]="","",DATEVALUE(RC[1])) -> 43390 | B38: 17.10.18 | C38: 24 | D38: 432.95 | E38: 51.14 | F38: 7.53 | G38: 423.39 | H38: 44.21 | I38: 5.43 | J38: =RC[-5]-RC[-2] -> 6.93 | K38: 9.56 | L38: 3.4340000000000002 | M38: 240.06 | N38: 67.22 | O38: 156.66 | P38: 52.69 | Q38: =RC[-3]-RC[-1] -> 14.530000000000001 | R38: 83.4 | S38: 7.665 | T38: =RC[-8]+RC[-1] -> 11.099 | U38: =(RC[-17]*RC[-16]-RC[-14]*RC[-13])/1000 -> 3.4229910999999991 | V38: 235.19 | W38: 154.63999999999999 | X38: =RC[-2]*RC[-10]/1000 -> 15.809471799999999 | Y38: =(RC[-3]*RC[-11]-RC[-2]*RC[-9])/1000 -> 7.6614902000000003 | Z38: 2013-12-17T00:00:00.000 | AA38: 2013-12-15T00:00:00.000 | AD38: =VALUE(RC[-28]) -> 2018-10-17T00:00:00.000 | AE38: =IF(RC[22]=42,"*",IF(RC[22]=32,"",RC[22])) -> - | AF38: =RC[-29] -> 24 | AG38: =RC[-29] -> 432.95 | AH38: =RC[-29] -> 51.14 | AI38: =RC[-29] -> 7.53 | AJ38: =RC[-29] -> 423.39 | AK38: =RC[-29] -> 44.21 | AL38: =RC[-29] -> 5.43 | AM38: =RC[-29] -> 6.93 | AN38: =RC[-29] -> 9.56 | AO38: =RC[-29] -> 3.4340000000000002 | AP38: =RC[-29] -> 240.06 | AQ38: =RC[-29] -> 67.22 | AR38: - | AS38: =RC[-30] -> 156.66 | AT38: =RC[-30] -> 52.69 | AU38: - | AV38: =RC[-31] -> 14.530000000000001 | AW38: =RC[-31] -> 83.4 | AX38: =RC[-31] -> 7.665 | AY38: =RC[-31] -> 11.099 | BA38: - | BB38: - | BC38: -
A39: =IF(RC[1]="","",DATEVALUE(RC[1])) -> 43391 | B39: 18.10.18 | C39: 24 | D39: 455.29 | E39: 51.42 | F39: 7.53 | G39: 445.21 | H39: 44.5 | I39: 5.43 | J39: 6.9200000000000017 | K39: 10.08 | L39: 3.609 | M39: 241.76 | N39: 67.680000000000007 | O39: 155.24 | P39: 52.89 | Q39: 14.790000000000006 | R39: 86.52 | S39: 7.9189999999999996 | T39: 11.527999999999999 | U39: 3.5991668000000026 | V39: 236.75 | W39: 153.22 | X39: 16.023240000000001 | Y39: 7.9194342000000013 | Z39: 2013-12-18T00:00:00.000 | AA39: 2013-12-16T00:00:00.000 | AD39: =VALUE(RC[-28]) -> 2018-10-18T00:00:00.000 | AE39: =IF(RC[22]=42,"*",IF(RC[22]=32,"",RC[22])) ->  | AF39: =RC[-29] -> 24 | AG39: =RC[-29] -> 455.29 | AH39: =RC[-29] -> 51.42 | AI39: =RC[-29] -> 7.53 | AJ39: =RC[-29] -> 445.21 | AK39: =RC[-29] -> 44.5 | AL39: =RC[-29] -> 5.43 | AM39: =RC[-29] -> 6.9200000000000017 | AN39: =RC[-29] -> 10.08 | AO39: =RC[-29] -> 3.609 | AP39: =RC[-29] -> 241.76 | AQ39: =RC[-29] -> 67.680000000000007 | AR39: - | AS39: =RC[-30] -> 155.24 | AT39: =RC[-30] -> 52.89 | AU39: - | AV39: =RC[-31] -> 14.790000000000006 | AW39: =RC[-31] -> 86.52 | AX39: =RC[-31] -> 7.9189999999999996 | AY39: =RC[-31] -> 11.527999999999999
A40: =IF(RC[1]="","",DATEVALUE(RC[1])) -> 43392 | B40: 19.10.18 | C40: 24 | D40: 455.29 | E40: 51.18 | F40: 7.53 | G40: 445.7 | H40: 44.01 | I40: 5.43 | J40: 7.1700000000000017 | K40: 9.59 | L40: 3.6970000000000001 | M40: 240.11 | N40: 67.489999999999995 | O40: 154.99 | P40: 52.69 | Q40: 14.799999999999997 | R40: 85.12 | S40: 7.8120000000000003 | T40: 11.509 | U40: 3.686485200000003 | V40: 235.19 | W40: 153.03 | X40: 15.872973099999999 | Y40: 7.8098223999999989 | Z40: 2013-12-19T00:00:00.000 | AA40: 2013-12-17T00:00:00.000 | AD40: =VALUE(RC[-28]) -> 2018-10-19T00:00:00.000 | AE40: =IF(RC[22]=42,"*",IF(RC[22]=32,"",RC[22])) ->  | AF40: =RC[-29] -> 24 | AG40: =RC[-29] -> 455.29 | AH40: =RC[-29] -> 51.18 | AI40: =RC[-29] -> 7.53 | AJ40: =RC[-29] -> 445.7 | AK40: =RC[-29] -> 44.01 | AL40: =RC[-29] -> 5.43 | AM40: =RC[-29] -> 7.1700000000000017 | AN40: =RC[-29] -> 9.59 | AO40: =RC[-29] -> 3.6970000000000001 | AP40: =RC[-29] -> 240.11 | AQ40: =RC[-29] -> 67.489999999999995 | AR40: - | AS40: =RC[-30] -> 154.99 | AT40: =RC[-30] -> 52.69 | AU40: - | AV40: =RC[-31] -> 14.799999999999997 | AW40: =RC[-31] -> 85.12 | AX40: =RC[-31] -> 7.8120000000000003 | AY40: =RC[-31] -> 11.509
A41: =IF(RC[1]="","",DATEVALUE(RC[1])) -> 43393 | B41: 20.10.18 | C41: 24 | D41: 455.13 | E41: 51.51 | F41: 7.53 | G41: 445.73 | H41: 44.03 | I41: 5.43 | J41: 7.4799999999999969 | K41: 9.4 | L41: 3.827 | M41: 246.23 | N41: 67.05 | O41: 152.01 | P41: 52.5 | Q41: 14.549999999999997 | R41: 94.22 | S41: 8.3000000000000007 | T41: 12.127000000000001 | U41: 3.818254399999998 | V41: 241.24 | W41: 150.07 | X41: 16.175142000000001 | Y41: 8.2964669999999998 | Z41: 2013-12-20T00:00:00.000 | AA41: 2013-12-18T00:00:00.000 | AD41: =VALUE(RC[-28]) -> 2018-10-20T00:00:00.000 | AE41: =IF(RC[22]=42,"*",IF(RC[22]=32,"",RC[22])) ->  | AF41: =RC[-29] -> 24 | AG41: =RC[-29] -> 455.13 | AH41: =RC[-29] -> 51.51 | AI41: =RC[-29] -> 7.53 | AJ41: =RC[-29] -> 445.73 | AK41: =RC[-29] -> 44.03 | AL41: =RC[-29] -> 5.43 | AM41: =RC[-29] -> 7.4799999999999969 | AN41: =RC[-29] -> 9.4 | AO41: =RC[-29] -> 3.827 | AP41: =RC[-29] -> 246.23 | AQ41: =RC[-29] -> 67.05 | AR41: - | AS41: =RC[-30] -> 152.01 | AT41: =RC[-30] -> 52.5 | AU41: - | AV41: =RC[-31] -> 14.549999999999997 | AW41: =RC[-31] -> 94.22 | AX41: =RC[-31] -> 8.3000000000000007 | AY41: =RC[-31] -> 12.127000000000001
A42: =IF(RC[1]="","",DATEVALUE(RC[1])) -> 43394 | B42: 21.10.18 | C42: 24 | D42: 455.19 | E42: 52.18 | F42: 7.53 | G42: 445.89 | H42: 44.52 | I42: 5.43 | J42: 7.6599999999999966 | K42: 9.3000000000000007 | L42: 3.9180000000000001 | M42: 250.52 | N42: 66.39 | O42: 148.19999999999999 | P42: 52.14 | Q42: 14.25 | R42: 102.32 | S42: 8.6720000000000006 | T42: 12.59 | U42: 3.9007913999999984 | V42: 245.53 | W42: 146.34 | X42: 16.300736699999998 | Y42: 8.670569099999998 | Z42: 2013-12-21T00:00:00.000 | AA42: 2013-12-19T00:00:00.000 | AD42: =VALUE(RC[-28]) -> 2018-10-21T00:00:00.000 | AE42: =IF(RC[22]=42,"*",IF(RC[22]=32,"",RC[22])) ->  | AF42: =RC[-29] -> 24 | AG42: =RC[-29] -> 455.19 | AH42: =RC[-29] -> 52.18 | AI42: =RC[-29] -> 7.53 | AJ42: =RC[-29] -> 445.89 | AK42: =RC[-29] -> 44.52 | AL42: =RC[-29] -> 5.43 | AM42: =RC[-29] -> 7.6599999999999966 | AN42: =RC[-29] -> 9.3000000000000007 | AO42: =RC[-29] -> 3.9180000000000001 | AP42: =RC[-29] -> 250.52 | AQ42: =RC[-29] -> 66.39 | AR42: - | AS42: =RC[-30] -> 148.19999999999999 | AT42: =RC[-30] -> 52.14 | AU42: - | AV42: =RC[-31] -> 14.25 | AW42: =RC[-31] -> 102.32 | AX42: =RC[-31] -> 8.6720000000000006 | AY42: =RC[-31] -> 12.59
A43: =IF(RC[1]="","",DATEVALUE(RC[1])) -> 43395 | B43: 22.10.18 | C43: 24 | D43: 411.79 | E43: 53.42 | F43: 7.53 | G43: 403.37 | H43: 45.08 | I43: 5.43 | J43: 8.3400000000000034 | K43: 8.42 | L43: 3.8250000000000002 | M43: 240.94 | N43: 66.66 | O43: 150.30000000000001 | P43: 51.94 | Q43: 14.719999999999999 | R43: 90.64 | S43: 8.0310000000000006 | T43: 11.856000000000002 | U43: 3.8139022000000002 | V43: 236.13 | W43: 148.41999999999999 | X43: 15.740425799999999 | Y43: 8.0314910000000008 | Z43: 2013-12-22T00:00:00.000 | AA43: 2013-12-20T00:00:00.000 | AD43: =VALUE(RC[-28]) -> 2018-10-22T00:00:00.000 | AE43: =IF(RC[22]=42,"*",IF(RC[22]=32,"",RC[22])) ->  | AF43: =RC[-29] -> 24 | AG43: =RC[-29] -> 411.79 | AH43: =RC[-29] -> 53.42 | AI43: =RC[-29] -> 7.53 | AJ43: =RC[-29] -> 403.37 | AK43: =RC[-29] -> 45.08 | AL43: =RC[-29] -> 5.43 | AM43: =RC[-29] -> 8.3400000000000034 | AN43: =RC[-29] -> 8.42 | AO43: =RC[-29] -> 3.8250000000000002 | AP43: =RC[-29] -> 240.94 | AQ43: =RC[-29] -> 66.66 | AR43: - | AS43: =RC[-30] -> 150.30000000000001 | AT43: =RC[-30] -> 51.94 | AU43: - | AV43: =RC[-31] -> 14.719999999999999 | AW43: =RC[-31] -> 90.64 | AX43: =RC[-31] -> 8.0310000000000006 | AY43: =RC[-31] -> 11.856000000000002
A44: =IF(RC[1]="","",DATEVALUE(RC[1])) ->  | C44: 24 | J44: =RC[-5]-RC[-2] -> #VALUE! | Q44: =RC[-3]-RC[-1] -> #VALUE! | T44: =RC[-8]+RC[-1] -> #VALUE! | U44: =(RC[-17]*RC[-16]-RC[-14]*RC[-13])/1000 -> #VALUE! | X44: =RC[-2]*RC[-10]/1000 -> #VALUE! | Y44: =(RC[-3]*RC[-11]-RC[-2]*RC[-9])/1000 -> #VALUE! | AD44: =VALUE(RC[-28]) -> #VALUE! | AE44: =IF(RC[22]=42,"*",IF(RC[22]=32,"",RC[22])) ->  | AF44: =RC[-29] -> 24 | AG44: =RC[-29] ->  | AH44: =RC[-29] ->  | AI44: =RC[-29] ->  | AJ44: =RC[-29] ->  | AK44: =RC[-29] ->  | AL44: =RC[-29] ->  | AM44: =RC[-29] -> #VALUE! | AN44: =RC[-29] ->  | AO44: =RC[-29] ->  | AP44: =RC[-29] ->  | AQ44: =RC[-29] ->  | AR44: - | AS44: =RC[-30] ->  | AT44: =RC[-30] ->  | AU44: - | AV44: =RC[-31] -> #VALUE! | AW44: =RC[-31] ->  | AX44: =RC[-31] ->  | AY44: =RC[-31] -> #VALUE!
A45: =IF(RC[1]="","",DATEVALUE(RC[1])) ->  | C45: 24 | J45: =RC[-5]-RC[-2] -> #VALUE! | Q45: =RC[-3]-RC[-1] -> #VALUE! | T45: =RC[-8]+RC[-1] -> #VALUE! | U45: =(RC[-17]*RC[-16]-RC[-14]*RC[-13])/1000 -> #VALUE! | X45: =RC[-2]*RC[-10]/1000 -> #VALUE! | Y45: =(RC[-3]*RC[-11]-RC[-2]*RC[-9])/1000 -> #VALUE! | AD45: =VALUE(RC[-28]) -> #VALUE! | AE45: =IF(RC[22]=42,"*",IF(RC[22]=32,"",RC[22])) ->  | AF45: =RC[-29] -> 24 | AG45: =RC[-29] ->  | AH45: =RC[-29] ->  | AI45: =RC[-29] ->  | AJ45: =RC[-29] ->  | AK45: =RC[-29] ->  | AL45: =RC[-29] ->  | AM45: =RC[-29] -> #VALUE! | AN45: =RC[-29] ->  | AO45: =RC[-29] ->  | AP45: =RC[-29] ->  | AQ45: =RC[-29] ->  | AR45: - | AS45: =RC[-30] ->  | AT45: =RC[-30] ->  | AU45: - | AV45: =RC[-31] -> #VALUE! | AW45: =RC[-31] ->  | AX45: =RC[-31] ->  | AY45: =RC[-31] -> #VALUE!
A46: =IF(RC[1]="","",DATEVALUE(RC[1])) ->  | C46: 24 | J46: =RC[-5]-RC[-2] -> #VALUE! | Q46: =RC[-3]-RC[-1] -> #VALUE! | T46: =RC[-8]+RC[-1] -> #VALUE! | U46: =(RC[-17]*RC[-16]-RC[-14]*RC[-13])/1000 -> #VALUE! | X46: =RC[-2]*RC[-10]/1000 -> #VALUE! | Y46: =(RC[-3]*RC[-11]-RC[-2]*RC[-9])/1000 -> #VALUE! | AD46: =VALUE(RC[-28]) -> #VALUE! | AE46: =IF(RC[22]=42,"*",IF(RC[22]=32,"",RC[22])) ->  | AF46: =RC[-29] -> 24 | AG46: =RC[-29] ->  | AH46: =RC[-29] ->  | AI46: =RC[-29] ->  | AJ46: =RC[-29] ->  | AK46: =RC[-29] ->  | AL46: =RC[-29] ->  | AM46: =RC[-29] -> #VALUE! | AN46: =RC[-29] ->  | AO46: =RC[-29] ->  | AP46: =RC[-29] ->  | AQ46: =RC[-29] ->  | AR46: - | AS46: =RC[-30] ->  | AT46: =RC[-30] ->  | AU46: - | AV46: =RC[-31] -> #VALUE! | AW46: =RC[-31] ->  | AX46: =RC[-31] ->  | AY46: =RC[-31] -> #VALUE!
A47: =IF(RC[1]="","",DATEVALUE(RC[1])) ->  | C47: 24 | J47: =RC[-5]-RC[-2] -> #VALUE! | Q47: =RC[-3]-RC[-1] -> #VALUE! | T47: =RC[-8]+RC[-1] -> #VALUE! | U47: =(RC[-17]*RC[-16]-RC[-14]*RC[-13])/1000 -> #VALUE! | X47: =RC[-2]*RC[-10]/1000 -> #VALUE! | Y47: =(RC[-3]*RC[-11]-RC[-2]*RC[-9])/1000 -> #VALUE! | AD47: =VALUE(RC[-28]) -> #VALUE! | AE47: =IF(RC[22]=42,"*",IF(RC[22]=32,"",RC[22])) ->  | AF47: =RC[-29] -> 24 | AG47: =RC[-29] ->  | AH47: =RC[-29] ->  | AI47: =RC[-29] ->  | AJ47: =RC[-29] ->  | AK47: =RC[-29] ->  | AL47: =RC[-29] ->  | AM47: =RC[-29] -> #VALUE! | AN47: =RC[-29] ->  | AO47: =RC[-29] ->  | AP47: =RC[-29] ->  | AQ47: =RC[-29] ->  | AR47: - | AS47: =RC[-30] ->  | AT47: =RC[-30] ->  | AU47: - | AV47: =RC[-31] -> #VALUE! | AW47: =RC[-31] ->  | AX47: =RC[-31] ->  | AY47: =RC[-31] -> #VALUE!
A48: =IF(RC[1]="","",DATEVALUE(RC[1])) ->  | C48: 24 | J48: =RC[-5]-RC[-2] -> #VALUE! | Q48: =RC[-3]-RC[-1] -> #VALUE! | T48: =RC[-8]+RC[-1] -> #VALUE! | U48: =(RC[-17]*RC[-16]-RC[-14]*RC[-13])/1000 -> #VALUE! | X48: =RC[-2]*RC[-10]/1000 -> #VALUE! | Y48: =(RC[-3]*RC[-11]-RC[-2]*RC[-9])/1000 -> #VALUE! | AD48: =VALUE(RC[-28]) -> #VALUE! | AE48: =IF(RC[22]=42,"*",IF(RC[22]=32,"",RC[22])) ->  | AF48: =RC[-29] -> 24 | AG48: =RC[-29] ->  | AH48: =RC[-29] ->  | AI48: =RC[-29] ->  | AJ48: =RC[-29] ->  | AK48: =RC[-29] ->  | AL48: =RC[-29] ->  | AM48: =RC[-29] -> #VALUE! | AN48: =RC[-29] ->  | AO48: =RC[-29] ->  | AP48: =RC[-29] ->  | AQ48: =RC[-29] ->  | AR48: - | AS48: =RC[-30] ->  | AT48: =RC[-30] ->  | AU48: - | AV48: =RC[-31] -> #VALUE! | AW48: =RC[-31] ->  | AX48: =RC[-31] ->  | AY48: =RC[-31] -> #VALUE!
A49: =IF(RC[1]="","",DATEVALUE(RC[1])) ->  | C49: 24 | J49: =RC[-5]-RC[-2] -> #VALUE! | Q49: =RC[-3]-RC[-1] -> #VALUE! | T49: =RC[-8]+RC[-1] -> #VALUE! | U49: =(RC[-17]*RC[-16]-RC[-14]*RC[-13])/1000 -> #VALUE! | X49: =RC[-2]*RC[-10]/1000 -> #VALUE! | Y49: =(RC[-3]*RC[-11]-RC[-2]*RC[-9])/1000 -> #VALUE! | AD49: =VALUE(RC[-28]) -> #VALUE! | AE49: =IF(RC[22]=42,"*",IF(RC[22]=32,"",RC[22])) ->  | AF49: =RC[-29] -> 24 | AG49: =RC[-29] ->  | AH49: =RC[-29] ->  | AI49: =RC[-29] ->  | AJ49: =RC[-29] ->  | AK49: =RC[-29] ->  | AL49: =RC[-29] ->  | AM49: =RC[-29] -> #VALUE! | AN49: =RC[-29] ->  | AO49: =RC[-29] ->  | AP49: =RC[-29] ->  | AQ49: =RC[-29] ->  | AR49: - | AS49: =RC[-30] ->  | AT49: =RC[-30] ->  | AU49: - | AV49: =RC[-31] -> #VALUE! | AW49: =RC[-31] ->  | AX49: =RC[-31] ->  | AY49: =RC[-31] -> #VALUE!
A50: =IF(RC[1]="","",DATEVALUE(RC[1])) ->  | C50: 24 | J50: =RC[-5]-RC[-2] -> #VALUE! | Q50: =RC[-3]-RC[-1] -> #VALUE! | T50: =RC[-8]+RC[-1] -> #VALUE! | U50: =(RC[-17]*RC[-16]-RC[-14]*RC[-13])/1000 -> #VALUE! | X50: =RC[-2]*RC[-10]/1000 -> #VALUE! | Y50: =(RC[-3]*RC[-11]-RC[-2]*RC[-9])/1000 -> #VALUE! | AD50: =VALUE(RC[-28]) -> #VALUE! | AE50: =IF(RC[22]=42,"*",IF(RC[22]=32,"",RC[22])) ->  | AF50: =RC[-29] -> 24 | AG50: =RC[-29] ->  | AH50: =RC[-29] ->  | AI50: =RC[-29] ->  | AJ50: =RC[-29] ->  | AK50: =RC[-29] ->  | AL50: =RC[-29] ->  | AM50: =RC[-29] -> #VALUE! | AN50: =RC[-29] ->  | AO50: =RC[-29] ->  | AP50: =RC[-29] ->  | AQ50: =RC[-29] ->  | AR50: - | AS50: =RC[-30] ->  | AT50: =RC[-30] ->  | AU50: - | AV50: =RC[-31] -> #VALUE! | AW50: =RC[-31] ->  | AX50: =RC[-31] ->  | AY50: =RC[-31] -> #VALUE!
A51: =IF(RC[1]="","",DATEVALUE(RC[1])) ->  | C51: 24 | J51: =RC[-5]-RC[-2] -> #VALUE! | Q51: =RC[-3]-RC[-1] -> #VALUE! | T51: =RC[-8]+RC[-1] -> #VALUE! | U51: =(RC[-17]*RC[-16]-RC[-14]*RC[-13])/1000 -> #VALUE! | X51: =RC[-2]*RC[-10]/1000 -> #VALUE! | Y51: =(RC[-3]*RC[-11]-RC[-2]*RC[-9])/1000 -> #VALUE! | AD51: =VALUE(RC[-28]) -> #VALUE! | AE51: =IF(RC[22]=42,"*",IF(RC[22]=32,"",RC[22])) ->  | AF51: =RC[-29] -> 24 | AG51: =RC[-29] ->  | AH51: =RC[-29] ->  | AI51: =RC[-29] ->  | AJ51: =RC[-29] ->  | AK51: =RC[-29] ->  | AL51: =RC[-29] ->  | AM51: =RC[-29] -> #VALUE! | AN51: =RC[-29] ->  | AO51: =RC[-29] ->  | AP51: =RC[-29] ->  | AQ51: =RC[-29] ->  | AR51: - | AS51: =RC[-30] ->  | AT51: =RC[-30] ->  | AU51: - | AV51: =RC[-31] -> #VALUE! | AW51: =RC[-31] ->  | AX51: =RC[-31] ->  | AY51: =RC[-31] -> #VALUE!
A52: =IF(RC[1]="","",DATEVALUE(RC[1])) ->  | C52: 24 | J52: =RC[-5]-RC[-2] -> #VALUE! | Q52: =RC[-3]-RC[-1] -> #VALUE! | T52: =RC[-8]+RC[-1] -> #VALUE! | U52: =(RC[-17]*RC[-16]-RC[-14]*RC[-13])/1000 -> #VALUE! | X52: =RC[-2]*RC[-10]/1000 -> #VALUE! | Y52: =(RC[-3]*RC[-11]-RC[-2]*RC[-9])/1000 -> #VALUE! | AD52: =VALUE(RC[-28]) -> #VALUE! | AE52: =IF(RC[22]=42,"*",IF(RC[22]=32,"",RC[22])) ->  | AF52: =RC[-29] -> 24 | AG52: =RC[-29] ->  | AH52: =RC[-29] ->  | AI52: =RC[-29] ->  | AJ52: =RC[-29] ->  | AK52: =RC[-29] ->  | AL52: =RC[-29] ->  | AM52: =RC[-29] -> #VALUE! | AN52: =RC[-29] ->  | AO52: =RC[-29] ->  | AP52: =RC[-29] ->  | AQ52: =RC[-29] ->  | AR52: - | AS52: =RC[-30] ->  | AT52: =RC[-30] ->  | AU52: - | AV52: =RC[-31] -> #VALUE! | AW52: =RC[-31] ->  | AX52: =RC[-31] ->  | AY52: =RC[-31] -> #VALUE!
A53: =IF(RC[1]="","",DATEVALUE(RC[1])) ->  | C53: 24 | J53: =RC[-5]-RC[-2] -> #VALUE! | Q53: =RC[-3]-RC[-1] -> #VALUE! | T53: =RC[-8]+RC[-1] -> #VALUE! | U53: =(RC[-17]*RC[-16]-RC[-14]*RC[-13])/1000 -> #VALUE! | X53: =RC[-2]*RC[-10]/1000 -> #VALUE! | Y53: =(RC[-3]*RC[-11]-RC[-2]*RC[-9])/1000 -> #VALUE! | AD53: =VALUE(RC[-28]) -> #VALUE! | AE53: =IF(RC[22]=42,"*",IF(RC[22]=32,"",RC[22])) ->  | AF53: =RC[-29] -> 24 | AG53: =RC[-29] ->  | AH53: =RC[-29] ->  | AI53: =RC[-29] ->  | AJ53: =RC[-29] ->  | AK53: =RC[-29] ->  | AL53: =RC[-29] ->  | AM53: =RC[-29] -> #VALUE! | AN53: =RC[-29] ->  | AO53: =RC[-29] ->  | AP53: =RC[-29] ->  | AQ53: =RC[-29] ->  | AR53: - | AS53: =RC[-30] ->  | AT53: =RC[-30] ->  | AU53: - | AV53: =RC[-31] -> #VALUE! | AW53: =RC[-31] ->  | AX53: =RC[-31] ->  | AY53: =RC[-31] -> #VALUE!
A54: =IF(RC[1]="","",DATEVALUE(RC[1])) ->  | C54: 24 | J54: =RC[-5]-RC[-2] -> #VALUE! | Q54: =RC[-3]-RC[-1] -> #VALUE! | T54: =RC[-8]+RC[-1] -> #VALUE! | U54: =(RC[-17]*RC[-16]-RC[-14]*RC[-13])/1000 -> #VALUE! | X54: =RC[-2]*RC[-10]/1000 -> #VALUE! | Y54: =(RC[-3]*RC[-11]-RC[-2]*RC[-9])/1000 -> #VALUE! | AD54: =VALUE(RC[-28]) -> #VALUE! | AE54: =IF(RC[22]=42,"*",IF(RC[22]=32,"",RC[22])) ->  | AF54: =RC[-29] -> 24 | AG54: =RC[-29] ->  | AH54: =RC[-29] ->  | AI54: =RC[-29] ->  | AJ54: =RC[-29] ->  | AK54: =RC[-29] ->  | AL54: =RC[-29] ->  | AM54: =RC[-29] -> #VALUE! | AN54: =RC[-29] ->  | AO54: =RC[-29] ->  | AP54: =RC[-29] ->  | AQ54: =RC[-29] ->  | AR54: - | AS54: =RC[-30] ->  | AT54: =RC[-30] ->  | AU54: - | AV54: =RC[-31] -> #VALUE! | AW54: =RC[-31] ->  | AX54: =RC[-31] ->  | AY54: =RC[-31] -> #VALUE!
A55: =IF(RC[1]="","",DATEVALUE(RC[1])) ->  | C55: 24 | J55: =RC[-5]-RC[-2] -> #VALUE! | Q55: =RC[-3]-RC[-1] -> #VALUE! | T55: =RC[-8]+RC[-1] -> #VALUE! | U55: =(RC[-17]*RC[-16]-RC[-14]*RC[-13])/1000 -> #VALUE! | X55: =RC[-2]*RC[-10]/1000 -> #VALUE! | Y55: =(RC[-3]*RC[-11]-RC[-2]*RC[-9])/1000 -> #VALUE! | AD55: =VALUE(RC[-28]) -> #VALUE! | AE55: =IF(RC[22]=42,"*",IF(RC[22]=32,"",RC[22])) ->  | AF55: =RC[-29] -> 24 | AG55: =RC[-29] ->  | AH55: =RC[-29] ->  | AI55: =RC[-29] ->  | AJ55: =RC[-29] ->  | AK55: =RC[-29] ->  | AL55: =RC[-29] ->  | AM55: =RC[-29] -> #VALUE! | AN55: =RC[-29] ->  | AO55: =RC[-29] ->  | AP55: =RC[-29] ->  | AQ55: =RC[-29] ->  | AR55: - | AS55: =RC[-30] ->  | AT55: =RC[-30] ->  | AU55: - | AV55: =RC[-31] -> #VALUE! | AW55: =RC[-31] ->  | AX55: =RC[-31] ->  | AY55: =RC[-31] -> #VALUE!
A56: =IF(RC[1]="","",DATEVALUE(RC[1])) ->  | C56: 24 | J56: =RC[-5]-RC[-2] -> #VALUE! | Q56: =RC[-3]-RC[-1] -> #VALUE! | T56: =RC[-8]+RC[-1] -> #VALUE! | U56: =(RC[-17]*RC[-16]-RC[-14]*RC[-13])/1000 -> #VALUE! | X56: =RC[-2]*RC[-10]/1000 -> #VALUE! | Y56: =(RC[-3]*RC[-11]-RC[-2]*RC[-9])/1000 -> #VALUE! | AD56: =VALUE(RC[-28]) -> #VALUE! | AE56: =IF(RC[22]=42,"*",IF(RC[22]=32,"",RC[22])) ->  | AF56: =RC[-29] -> 24 | AG56: =RC[-29] ->  | AH56: =RC[-29] ->  | AI56: =RC[-29] ->  | AJ56: =RC[-29] ->  | AK56: =RC[-29] ->  | AL56: =RC[-29] ->  | AM56: =RC[-29] -> #VALUE! | AN56: =RC[-29] ->  | AO56: =RC[-29] ->  | AP56: =RC[-29] ->  | AQ56: =RC[-29] ->  | AR56: - | AS56: =RC[-30] ->  | AT56: =RC[-30] ->  | AU56: - | AV56: =RC[-31] -> #VALUE! | AW56: =RC[-31] ->  | AX56: =RC[-31] ->  | AY56: =RC[-31] -> #VALUE!
A57: =IF(RC[1]="","",DATEVALUE(RC[1])) ->  | C57: 24 | J57: =RC[-5]-RC[-2] -> #VALUE! | Q57: =RC[-3]-RC[-1] -> #VALUE! | T57: =RC[-8]+RC[-1] -> #VALUE! | U57: =(RC[-17]*RC[-16]-RC[-14]*RC[-13])/1000 -> #VALUE! | X57: =RC[-2]*RC[-10]/1000 -> #VALUE! | Y57: =(RC[-3]*RC[-11]-RC[-2]*RC[-9])/1000 -> #VALUE! | AD57: =VALUE(RC[-28]) -> #VALUE! | AE57: =IF(RC[22]=42,"*",IF(RC[22]=32,"",RC[22])) ->  | AF57: =RC[-29] -> 24 | AG57: =RC[-29] ->  | AH57: =RC[-29] ->  | AI57: =RC[-29] ->  | AJ57: =RC[-29] ->  | AK57: =RC[-29] ->  | AL57: =RC[-29] ->  | AM57: =RC[-29] -> #VALUE! | AN57: =RC[-29] ->  | AO57: =RC[-29] ->  | AP57: =RC[-29] ->  | AQ57: =RC[-29] ->  | AR57: - | AS57: =RC[-30] ->  | AT57: =RC[-30] ->  | AU57: - | AV57: =RC[-31] -> #VALUE! | AW57: =RC[-31] ->  | AX57: =RC[-31] ->  | AY57: =RC[-31] -> #VALUE!
A58: =IF(RC[1]="","",DATEVALUE(RC[1])) ->  | C58: 24 | J58: =RC[-5]-RC[-2] -> #VALUE! | Q58: =RC[-3]-RC[-1] -> #VALUE! | T58: =RC[-8]+RC[-1] -> #VALUE! | U58: =(RC[-17]*RC[-16]-RC[-14]*RC[-13])/1000 -> #VALUE! | X58: =RC[-2]*RC[-10]/1000 -> #VALUE! | Y58: =(RC[-3]*RC[-11]-RC[-2]*RC[-9])/1000 -> #VALUE! | AD58: =VALUE(RC[-28]) -> #VALUE! | AE58: =IF(RC[22]=42,"*",IF(RC[22]=32,"",RC[22])) ->  | AF58: =RC[-29] -> 24 | AG58: =RC[-29] ->  | AH58: =RC[-29] ->  | AI58: =RC[-29] ->  | AJ58: =RC[-29] ->  | AK58: =RC[-29] ->  | AL58: =RC[-29] ->  | AM58: =RC[-29] -> #VALUE! | AN58: =RC[-29] ->  | AO58: =RC[-29] ->  | AP58: =RC[-29] ->  | AQ58: =RC[-29] ->  | AR58: - | AS58: =RC[-30] ->  | AT58: =RC[-30] ->  | AU58: - | AV58: =RC[-31] -> #VALUE! | AW58: =RC[-31] ->  | AX58: =RC[-31] ->  | AY58: =RC[-31] -> #VALUE!
A59: =IF(RC[1]="","",DATEVALUE(RC[1])) ->  | C59: 24 | J59: =RC[-5]-RC[-2] -> #VALUE! | Q59: =RC[-3]-RC[-1] -> #VALUE! | T59: =RC[-8]+RC[-1] -> #VALUE! | U59: =(RC[-17]*RC[-16]-RC[-14]*RC[-13])/1000 -> #VALUE! | X59: =RC[-2]*RC[-10]/1000 -> #VALUE! | Y59: =(RC[-3]*RC[-11]-RC[-2]*RC[-9])/1000 -> #VALUE! | AD59: =VALUE(RC[-28]) -> #VALUE! | AE59: =IF(RC[22]=42,"*",IF(RC[22]=32,"",RC[22])) ->  | AF59: =RC[-29] -> 24 | AG59: =RC[-29] ->  | AH59: =RC[-29] ->  | AI59: =RC[-29] ->  | AJ59: =RC[-29] ->  | AK59: =RC[-29] ->  | AL59: =RC[-29] ->  | AM59: =RC[-29] -> #VALUE! | AN59: =RC[-29] ->  | AO59: =RC[-29] ->  | AP59: =RC[-29] ->  | AQ59: =RC[-29] ->  | AR59: - | AS59: =RC[-30] ->  | AT59: =RC[-30] ->  | AU59: - | AV59: =RC[-31] -> #VALUE! | AW59: =RC[-31] ->  | AX59: =RC[-31] ->  | AY59: =RC[-31] -> #VALUE!
A60: =IF(RC[1]="","",DATEVALUE(RC[1])) ->  | C60: 24 | J60: =RC[-5]-RC[-2] -> #VALUE! | Q60: =RC[-3]-RC[-1] -> #VALUE! | T60: =RC[-8]+RC[-1] -> #VALUE! | U60: =(RC[-17]*RC[-16]-RC[-14]*RC[-13])/1000 -> #VALUE! | X60: =RC[-2]*RC[-10]/1000 -> #VALUE! | Y60: =(RC[-3]*RC[-11]-RC[-2]*RC[-9])/1000 -> #VALUE! | AD60: =VALUE(RC[-28]) -> #VALUE! | AE60: =IF(RC[22]=42,"*",IF(RC[22]=32,"",RC[22])) ->  | AF60: =RC[-29] -> 24 | AG60: =RC[-29] ->  | AH60: =RC[-29] ->  | AI60: =RC[-29] ->  | AJ60: =RC[-29] ->  | AK60: =RC[-29] ->  | AL60: =RC[-29] ->  | AM60: =RC[-29] -> #VALUE! | AN60: =RC[-29] ->  | AO60: =RC[-29] ->  | AP60: =RC[-29] ->  | AQ60: =RC[-29] ->  | AR60: - | AS60: =RC[-30] ->  | AT60: =RC[-30] ->  | AU60: - | AV60: =RC[-31] -> #VALUE! | AW60: =RC[-31] ->  | AX60: =RC[-31] ->  | AY60: =RC[-31] -> #VALUE!
A61: =IF(RC[1]="","",DATEVALUE(RC[1])) ->  | C61: 24 | J61: =RC[-5]-RC[-2] -> #VALUE! | Q61: =RC[-3]-RC[-1] -> #VALUE! | T61: =RC[-8]+RC[-1] -> #VALUE! | U61: =(RC[-17]*RC[-16]-RC[-14]*RC[-13])/1000 -> #VALUE! | X61: =RC[-2]*RC[-10]/1000 -> #VALUE! | Y61: =(RC[-3]*RC[-11]-RC[-2]*RC[-9])/1000 -> #VALUE! | AD61: =VALUE(RC[-28]) -> #VALUE! | AE61: =IF(RC[22]=42,"*",IF(RC[22]=32,"",RC[22])) ->  | AF61: =RC[-29] -> 24 | AG61: =RC[-29] ->  | AH61: =RC[-29] ->  | AI61: =RC[-29] ->  | AJ61: =RC[-29] ->  | AK61: =RC[-29] ->  | AL61: =RC[-29] ->  | AM61: =RC[-29] -> #VALUE! | AN61: =RC[-29] ->  | AO61: =RC[-29] ->  | AP61: =RC[-29] ->  | AQ61: =RC[-29] ->  | AR61: - | AS61: =RC[-30] ->  | AT61: =RC[-30] ->  | AU61: - | AV61: =RC[-31] -> #VALUE! | AW61: =RC[-31] ->  | AX61: =RC[-31] ->  | AY61: =RC[-31] -> #VALUE!
A62: =IF(RC[1]="","",DATEVALUE(RC[1])) ->  | C62: 24 | J62: =RC[-5]-RC[-2] -> #VALUE! | Q62: =RC[-3]-RC[-1] -> #VALUE! | T62: =RC[-8]+RC[-1] -> #VALUE! | U62: =(RC[-17]*RC[-16]-RC[-14]*RC[-13])/1000 -> #VALUE! | X62: =RC[-2]*RC[-10]/1000 -> #VALUE! | Y62: =(RC[-3]*RC[-11]-RC[-2]*RC[-9])/1000 -> #VALUE! | AD62: =VALUE(RC[-28]) -> #VALUE! | AE62: =IF(RC[22]=42,"*",IF(RC[22]=32,"",RC[22])) ->  | AF62: =RC[-29] -> 24 | AG62: =RC[-29] ->  | AH62: =RC[-29] ->  | AI62: =RC[-29] ->  | AJ62: =RC[-29] ->  | AK62: =RC[-29] ->  | AL62: =RC[-29] ->  | AM62: =RC[-29] -> #VALUE! | AN62: =RC[-29] ->  | AO62: =RC[-29] ->  | AP62: =RC[-29] ->  | AQ62: =RC[-29] ->  | AR62: - | AS62: =RC[-30] ->  | AT62: =RC[-30] ->  | AU62: - | AV62: =RC[-31] -> #VALUE! | AW62: =RC[-31] ->  | AX62: =RC[-31] ->  | AY62: =RC[-31] -> #VALUE!
A63: =IF(RC[1]="","",DATEVALUE(RC[1])) ->  | C63: 24 | J63: =RC[-5]-RC[-2] -> #VALUE! | Q63: =RC[-3]-RC[-1] -> #VALUE! | T63: =RC[-8]+RC[-1] -> #VALUE! | U63: =(RC[-17]*RC[-16]-RC[-14]*RC[-13])/1000 -> #VALUE! | X63: =RC[-2]*RC[-10]/1000 -> #VALUE! | Y63: =(RC[-3]*RC[-11]-RC[-2]*RC[-9])/1000 -> #VALUE! | AD63: =VALUE(RC[-28]) -> #VALUE! | AE63: =IF(RC[22]=42,"*",IF(RC[22]=32,"",RC[22])) ->  | AF63: =RC[-29] -> 24 | AG63: =RC[-29] ->  | AH63: =RC[-29] ->  | AI63: =RC[-29] ->  | AJ63: =RC[-29] ->  | AK63: =RC[-29] ->  | AL63: =RC[-29] ->  | AM63: =RC[-29] -> #VALUE! | AN63: =RC[-29] ->  | AO63: =RC[-29] ->  | AP63: =RC[-29] ->  | AQ63: =RC[-29] ->  | AR63: - | AS63: =RC[-30] ->  | AT63: =RC[-30] ->  | AU63: - | AV63: =RC[-31] -> #VALUE! | AW63: =RC[-31] ->  | AX63: =RC[-31] ->  | AY63: =RC[-31] -> #VALUE!
A64: =IF(RC[1]="","",DATEVALUE(RC[1])) ->  | C64: 24 | J64: =RC[-5]-RC[-2] -> #VALUE! | Q64: =RC[-3]-RC[-1] -> #VALUE! | T64: =RC[-8]+RC[-1] -> #VALUE! | U64: =(RC[-17]*RC[-16]-RC[-14]*RC[-13])/1000 -> #VALUE! | X64: =RC[-2]*RC[-10]/1000 -> #VALUE! | Y64: =(RC[-3]*RC[-11]-RC[-2]*RC[-9])/1000 -> #VALUE! | AD64: =VALUE(RC[-28]) -> #VALUE! | AE64: =IF(RC[22]=42,"*",IF(RC[22]=32,"",RC[22])) ->  | AF64: =RC[-29] -> 24 | AG64: =RC[-29] ->  | AH64: =RC[-29] ->  | AI64: =RC[-29] ->  | AJ64: =RC[-29] ->  | AK64: =RC[-29] ->  | AL64: =RC[-29] ->  | AM64: =RC[-29] -> #VALUE! | AN64: =RC[-29] ->  | AO64: =RC[-29] ->  | AP64: =RC[-29] ->  | AQ64: =RC[-29] ->  | AR64: - | AS64: =RC[-30] ->  | AT64: =RC[-30] ->  | AU64: - | AV64: =RC[-31] -> #VALUE! | AW64: =RC[-31] ->  | AX64: =RC[-31] ->  | AY64: =RC[-31] -> #VALUE!
A65: =IF(RC[1]="","",DATEVALUE(RC[1])) ->  | C65: 24 | J65: =RC[-5]-RC[-2] -> #VALUE! | Q65: =RC[-3]-RC[-1] -> #VALUE! | T65: =RC[-8]+RC[-1] -> #VALUE! | U65: =(RC[-17]*RC[-16]-RC[-14]*RC[-13])/1000 -> #VALUE! | X65: =RC[-2]*RC[-10]/1000 -> #VALUE! | Y65: =(RC[-3]*RC[-11]-RC[-2]*RC[-9])/1000 -> #VALUE! | AD65: =VALUE(RC[-28]) -> #VALUE! | AE65: =IF(RC[22]=42,"*",IF(RC[22]=32,"",RC[22])) ->  | AF65: =RC[-29] -> 24 | AG65: =RC[-29] ->  | AH65: =RC[-29] ->  | AI65: =RC[-29] ->  | AJ65: =RC[-29] ->  | AK65: =RC[-29] ->  | AL65: =RC[-29] ->  | AM65: =RC[-29] -> #VALUE! | AN65: =RC[-29] ->  | AO65: =RC[-29] ->  | AP65: =RC[-29] ->  | AQ65: =RC[-29] ->  | AR65: - | AS65: =RC[-30] ->  | AT65: =RC[-30] ->  | AU65: - | AV65: =RC[-31] -> #VALUE! | AW65: =RC[-31] ->  | AX65: =RC[-31] ->  | AY65: =RC[-31] -> #VALUE!
A66: =IF(RC[1]="","",DATEVALUE(RC[1])) ->  | C66: 24 | J66: =RC[-5]-RC[-2] -> #VALUE! | Q66: =RC[-3]-RC[-1] -> #VALUE! | T66: =RC[-8]+RC[-1] -> #VALUE! | U66: =(RC[-17]*RC[-16]-RC[-14]*RC[-13])/1000 -> #VALUE! | X66: =RC[-2]*RC[-10]/1000 -> #VALUE! | Y66: =(RC[-3]*RC[-11]-RC[-2]*RC[-9])/1000 -> #VALUE! | AD66: =VALUE(RC[-28]) -> #VALUE! | AE66: =IF(RC[22]=42,"*",IF(RC[22]=32,"",RC[22])) ->  | AF66: =RC[-29] -> 24 | AG66: =RC[-29] ->  | AH66: =RC[-29] ->  | AI66: =RC[-29] ->  | AJ66: =RC[-29] ->  | AK66: =RC[-29] ->  | AL66: =RC[-29] ->  | AM66: =RC[-29] -> #VALUE! | AN66: =RC[-29] ->  | AO66: =RC[-29] ->  | AP66: =RC[-29] ->  | AQ66: =RC[-29] ->  | AR66: - | AS66: =RC[-30] ->  | AT66: =RC[-30] ->  | AU66: - | AV66: =RC[-31] -> #VALUE! | AW66: =RC[-31] ->  | AX66: =RC[-31] ->  | AY66: =RC[-31] -> #VALUE!
A67: =IF(RC[1]="","",DATEVALUE(RC[1])) ->  | C67: 24 | J67: =RC[-5]-RC[-2] -> #VALUE! | Q67: =RC[-3]-RC[-1] -> #VALUE! | T67: =RC[-8]+RC[-1] -> #VALUE! | U67: =(RC[-17]*RC[-16]-RC[-14]*RC[-13])/1000 -> #VALUE! | X67: =RC[-2]*RC[-10]/1000 -> #VALUE! | Y67: =(RC[-3]*RC[-11]-RC[-2]*RC[-9])/1000 -> #VALUE! | AD67: =VALUE(RC[-28]) -> #VALUE! | AE67: =IF(RC[22]=42,"*",IF(RC[22]=32,"",RC[22])) ->  | AF67: =RC[-29] -> 24 | AG67: =RC[-29] ->  | AH67: =RC[-29] ->  | AI67: =RC[-29] ->  | AJ67: =RC[-29] ->  | AK67: =RC[-29] ->  | AL67: =RC[-29] ->  | AM67: =RC[-29] -> #VALUE! | AN67: =RC[-29] ->  | AO67: =RC[-29] ->  | AP67: =RC[-29] ->  | AQ67: =RC[-29] ->  | AR67: - | AS67: =RC[-30] ->  | AT67: =RC[-30] ->  | AU67: - | AV67: =RC[-31] -> #VALUE! | AW67: =RC[-31] ->  | AX67: =RC[-31] ->  | AY67: =RC[-31] -> #VALUE!
A68: =IF(RC[1]="","",DATEVALUE(RC[1])) ->  | C68: 24 | J68: =RC[-5]-RC[-2] -> #VALUE! | Q68: =RC[-3]-RC[-1] -> #VALUE! | T68: =RC[-8]+RC[-1] -> #VALUE! | U68: =(RC[-17]*RC[-16]-RC[-14]*RC[-13])/1000 -> #VALUE! | X68: =RC[-2]*RC[-10]/1000 -> #VALUE! | Y68: =(RC[-3]*RC[-11]-RC[-2]*RC[-9])/1000 -> #VALUE! | AD68: =VALUE(RC[-28]) -> #VALUE! | AE68: =IF(RC[22]=42,"*",IF(RC[22]=32,"",RC[22])) ->  | AF68: =RC[-29] -> 24 | AG68: =RC[-29] ->  | AH68: =RC[-29] ->  | AI68: =RC[-29] ->  | AJ68: =RC[-29] ->  | AK68: =RC[-29] ->  | AL68: =RC[-29] ->  | AM68: =RC[-29] -> #VALUE! | AN68: =RC[-29] ->  | AO68: =RC[-29] ->  | AP68: =RC[-29] ->  | AQ68: =RC[-29] ->  | AR68: - | AS68: =RC[-30] ->  | AT68: =RC[-30] ->  | AU68: - | AV68: =RC[-31] -> #VALUE! | AW68: =RC[-31] ->  | AX68: =RC[-31] ->  | AY68: =RC[-31] -> #VALUE!
A69: =IF(RC[1]="","",DATEVALUE(RC[1])) ->  | C69: 24 | J69: =RC[-5]-RC[-2] -> #VALUE! | Q69: =RC[-3]-RC[-1] -> #VALUE! | T69: =RC[-8]+RC[-1] -> #VALUE! | U69: =(RC[-17]*RC[-16]-RC[-14]*RC[-13])/1000 -> #VALUE! | X69: =RC[-2]*RC[-10]/1000 -> #VALUE! | Y69: =(RC[-3]*RC[-11]-RC[-2]*RC[-9])/1000 -> #VALUE! | AD69: =VALUE(RC[-28]) -> #VALUE! | AE69: =IF(RC[22]=42,"*",IF(RC[22]=32,"",RC[22])) ->  | AF69: =RC[-29] -> 24 | AG69: =RC[-29] ->  | AH69: =RC[-29] ->  | AI69: =RC[-29] ->  | AJ69: =RC[-29] ->  | AK69: =RC[-29] ->  | AL69: =RC[-29] ->  | AM69: =RC[-29] -> #VALUE! | AN69: =RC[-29] ->  | AO69: =RC[-29] ->  | AP69: =RC[-29] ->  | AQ69: =RC[-29] ->  | AR69: - | AS69: =RC[-30] ->  | AT69: =RC[-30] ->  | AU69: - | AV69: =RC[-31] -> #VALUE! | AW69: =RC[-31] ->  | AX69: =RC[-31] ->  | AY69: =RC[-31] -> #VALUE!
A70: =IF(RC[1]="","",DATEVALUE(RC[1])) ->  | C70: 24 | J70: =RC[-5]-RC[-2] -> #VALUE! | Q70: =RC[-3]-RC[-1] -> #VALUE! | T70: =RC[-8]+RC[-1] -> #VALUE! | U70: =(RC[-17]*RC[-16]-RC[-14]*RC[-13])/1000 -> #VALUE! | X70: =RC[-2]*RC[-10]/1000 -> #VALUE! | Y70: =(RC[-3]*RC[-11]-RC[-2]*RC[-9])/1000 -> #VALUE! | AD70: =VALUE(RC[-28]) -> #VALUE! | AE70: =IF(RC[22]=42,"*",IF(RC[22]=32,"",RC[22])) ->  | AF70: =RC[-29] -> 24 | AG70: =RC[-29] ->  | AH70: =RC[-29] ->  | AI70: =RC[-29] ->  | AJ70: =RC[-29] ->  | AK70: =RC[-29] ->  | AL70: =RC[-29] ->  | AM70: =RC[-29] -> #VALUE! | AN70: =RC[-29] ->  | AO70: =RC[-29] ->  | AP70: =RC[-29] ->  | AQ70: =RC[-29] ->  | AR70: - | AS70: =RC[-30] ->  | AT70: =RC[-30] ->  | AU70: - | AV70: =RC[-31] -> #VALUE! | AW70: =RC[-31] ->  | AX70: =RC[-31] ->  | AY70: =RC[-31] -> #VALUE!
A71: =IF(RC[1]="","",DATEVALUE(RC[1])) ->  | C71: 24 | J71: =RC[-5]-RC[-2] -> #VALUE! | Q71: =RC[-3]-RC[-1] -> #VALUE! | T71: =RC[-8]+RC[-1] -> #VALUE! | U71: =(RC[-17]*RC[-16]-RC[-14]*RC[-13])/1000 -> #VALUE! | X71: =RC[-2]*RC[-10]/1000 -> #VALUE! | Y71: =(RC[-3]*RC[-11]-RC[-2]*RC[-9])/1000 -> #VALUE! | AD71: =VALUE(RC[-28]) -> #VALUE! | AE71: =IF(RC[22]=42,"*",IF(RC[22]=32,"",RC[22])) ->  | AF71: =RC[-29] -> 24 | AG71: =RC[-29] ->  | AH71: =RC[-29] ->  | AI71: =RC[-29] ->  | AJ71: =RC[-29] ->  | AK71: =RC[-29] ->  | AL71: =RC[-29] ->  | AM71: =RC[-29] -> #VALUE! | AN71: =RC[-29] ->  | AO71: =RC[-29] ->  | AP71: =RC[-29] ->  | AQ71: =RC[-29] ->  | AR71: - | AS71: =RC[-30] ->  | AT71: =RC[-30] ->  | AU71: - | AV71: =RC[-31] -> #VALUE! | AW71: =RC[-31] ->  | AX71: =RC[-31] ->  | AY71: =RC[-31] -> #VALUE!
A72: =IF(RC[1]="","",DATEVALUE(RC[1])) ->  | C72: 24 | J72: =RC[-5]-RC[-2] -> #VALUE! | Q72: =RC[-3]-RC[-1] -> #VALUE! | T72: =RC[-8]+RC[-1] -> #VALUE! | U72: =(RC[-17]*RC[-16]-RC[-14]*RC[-13])/1000 -> #VALUE! | X72: =RC[-2]*RC[-10]/1000 -> #VALUE! | Y72: =(RC[-3]*RC[-11]-RC[-2]*RC[-9])/1000 -> #VALUE! | AD72: =VALUE(RC[-28]) -> #VALUE! | AE72: =IF(RC[22]=42,"*",IF(RC[22]=32,"",RC[22])) ->  | AF72: =RC[-29] -> 24 | AG72: =RC[-29] ->  | AH72: =RC[-29] ->  | AI72: =RC[-29] ->  | AJ72: =RC[-29] ->  | AK72: =RC[-29] ->  | AL72: =RC[-29] ->  | AM72: =RC[-29] -> #VALUE! | AN72: =RC[-29] ->  | AO72: =RC[-29] ->  | AP72: =RC[-29] ->  | AQ72: =RC[-29] ->  | AR72: - | AS72: =RC[-30] ->  | AT72: =RC[-30] ->  | AU72: - | AV72: =RC[-31] -> #VALUE! | AW72: =RC[-31] ->  | AX72: =RC[-31] ->  | AY72: =RC[-31] -> #VALUE!
A73: =IF(RC[1]="","",DATEVALUE(RC[1])) ->  | C73: 24 | J73: =RC[-5]-RC[-2] -> #VALUE! | Q73: =RC[-3]-RC[-1] -> #VALUE! | T73: =RC[-8]+RC[-1] -> #VALUE! | U73: =(RC[-17]*RC[-16]-RC[-14]*RC[-13])/1000 -> #VALUE! | X73: =RC[-2]*RC[-10]/1000 -> #VALUE! | Y73: =(RC[-3]*RC[-11]-RC[-2]*RC[-9])/1000 -> #VALUE! | AD73: =VALUE(RC[-28]) -> #VALUE! | AE73: =IF(RC[22]=42,"*",IF(RC[22]=32,"",RC[22])) ->  | AF73: =RC[-29] -> 24 | AG73: =RC[-29] ->  | AH73: =RC[-29] ->  | AI73: =RC[-29] ->  | AJ73: =RC[-29] ->  | AK73: =RC[-29] ->  | AL73: =RC[-29] ->  | AM73: =RC[-29] -> #VALUE! | AN73: =RC[-29] ->  | AO73: =RC[-29] ->  | AP73: =RC[-29] ->  | AQ73: =RC[-29] ->  | AR73: - | AS73: =RC[-30] ->  | AT73: =RC[-30] ->  | AU73: - | AV73: =RC[-31] -> #VALUE! | AW73: =RC[-31] ->  | AX73: =RC[-31] ->  | AY73: =RC[-31] -> #VALUE!
A74: =IF(RC[1]="","",DATEVALUE(RC[1])) ->  | C74: 24 | J74: =RC[-5]-RC[-2] -> #VALUE! | Q74: =RC[-3]-RC[-1] -> #VALUE! | T74: =RC[-8]+RC[-1] -> #VALUE! | U74: =(RC[-17]*RC[-16]-RC[-14]*RC[-13])/1000 -> #VALUE! | X74: =RC[-2]*RC[-10]/1000 -> #VALUE! | Y74: =(RC[-3]*RC[-11]-RC[-2]*RC[-9])/1000 -> #VALUE! | AD74: =VALUE(RC[-28]) -> #VALUE! | AE74: =IF(RC[22]=42,"*",IF(RC[22]=32,"",RC[22])) ->  | AF74: =RC[-29] -> 24 | AG74: =RC[-29] ->  | AH74: =RC[-29] ->  | AI74: =RC[-29] ->  | AJ74: =RC[-29] ->  | AK74: =RC[-29] ->  | AL74: =RC[-29] ->  | AM74: =RC[-29] -> #VALUE! | AN74: =RC[-29] ->  | AO74: =RC[-29] ->  | AP74: =RC[-29] ->  | AQ74: =RC[-29] ->  | AR74: - | AS74: =RC[-30] ->  | AT74: =RC[-30] ->  | AU74: - | AV74: =RC[-31] -> #VALUE! | AW74: =RC[-31] ->  | AX74: =RC[-31] ->  | AY74: =RC[-31] -> #VALUE!
A75: =IF(RC[1]="","",DATEVALUE(RC[1])) ->  | C75: 24 | J75: =RC[-5]-RC[-2] -> #VALUE! | Q75: =RC[-3]-RC[-1] -> #VALUE! | T75: =RC[-8]+RC[-1] -> #VALUE! | U75: =(RC[-17]*RC[-16]-RC[-14]*RC[-13])/1000 -> #VALUE! | X75: =RC[-2]*RC[-10]/1000 -> #VALUE! | Y75: =(RC[-3]*RC[-11]-RC[-2]*RC[-9])/1000 -> #VALUE! | AD75: =VALUE(RC[-28]) -> #VALUE! | AE75: =IF(RC[22]=42,"*",IF(RC[22]=32,"",RC[22])) ->  | AF75: =RC[-29] -> 24 | AG75: =RC[-29] ->  | AH75: =RC[-29] ->  | AI75: =RC[-29] ->  | AJ75: =RC[-29] ->  | AK75: =RC[-29] ->  | AL75: =RC[-29] ->  | AM75: =RC[-29] -> #VALUE! | AN75: =RC[-29] ->  | AO75: =RC[-29] ->  | AP75: =RC[-29] ->  | AQ75: =RC[-29] ->  | AR75: - | AS75: =RC[-30] ->  | AT75: =RC[-30] ->  | AU75: - | AV75: =RC[-31] -> #VALUE! | AW75: =RC[-31] ->  | AX75: =RC[-31] ->  | AY75: =RC[-31] -> #VALUE!
A76: =IF(RC[1]="","",DATEVALUE(RC[1])) ->  | C76: 24 | J76: =RC[-5]-RC[-2] -> #VALUE! | Q76: =RC[-3]-RC[-1] -> #VALUE! | T76: =RC[-8]+RC[-1] -> #VALUE! | U76: =(RC[-17]*RC[-16]-RC[-14]*RC[-13])/1000 -> #VALUE! | X76: =RC[-2]*RC[-10]/1000 -> #VALUE! | Y76: =(RC[-3]*RC[-11]-RC[-2]*RC[-9])/1000 -> #VALUE! | AD76: =VALUE(RC[-28]) -> #VALUE! | AE76: =IF(RC[22]=42,"*",IF(RC[22]=32,"",RC[22])) ->  | AF76: =RC[-29] -> 24 | AG76: =RC[-29] ->  | AH76: =RC[-29] ->  | AI76: =RC[-29] ->  | AJ76: =RC[-29] ->  | AK76: =RC[-29] ->  | AL76: =RC[-29] ->  | AM76: =RC[-29] -> #VALUE! | AN76: =RC[-29] ->  | AO76: =RC[-29] ->  | AP76: =RC[-29] ->  | AQ76: =RC[-29] ->  | AR76: - | AS76: =RC[-30] ->  | AT76: =RC[-30] ->  | AU76: - | AV76: =RC[-31] -> #VALUE! | AW76: =RC[-31] ->  | AX76: =RC[-31] ->  | AY76: =RC[-31] -> #VALUE!
A77: =IF(RC[1]="","",DATEVALUE(RC[1])) ->  | C77: 24 | J77: =RC[-5]-RC[-2] -> #VALUE! | Q77: =RC[-3]-RC[-1] -> #VALUE! | T77: =RC[-8]+RC[-1] -> #VALUE! | U77: =(RC[-17]*RC[-16]-RC[-14]*RC[-13])/1000 -> #VALUE! | X77: =RC[-2]*RC[-10]/1000 -> #VALUE! | Y77: =(RC[-3]*RC[-11]-RC[-2]*RC[-9])/1000 -> #VALUE! | AD77: =VALUE(RC[-28]) -> #VALUE! | AE77: =IF(RC[22]=42,"*",IF(RC[22]=32,"",RC[22])) ->  | AF77: =RC[-29] -> 24 | AG77: =RC[-29] ->  | AH77: =RC[-29] ->  | AI77: =RC[-29] ->  | AJ77: =RC[-29] ->  | AK77: =RC[-29] ->  | AL77: =RC[-29] ->  | AM77: =RC[-29] -> #VALUE! | AN77: =RC[-29] ->  | AO77: =RC[-29] ->  | AP77: =RC[-29] ->  | AQ77: =RC[-29] ->  | AR77: - | AS77: =RC[-30] ->  | AT77: =RC[-30] ->  | AU77: - | AV77: =RC[-31] -> #VALUE! | AW77: =RC[-31] ->  | AX77: =RC[-31] ->  | AY77: =RC[-31] -> #VALUE!
A78: =IF(RC[1]="","",DATEVALUE(RC[1])) ->  | C78: 24 | J78: =RC[-5]-RC[-2] -> #VALUE! | Q78: =RC[-3]-RC[-1] -> #VALUE! | T78: =RC[-8]+RC[-1] -> #VALUE! | U78: =(RC[-17]*RC[-16]-RC[-14]*RC[-13])/1000 -> #VALUE! | X78: =RC[-2]*RC[-10]/1000 -> #VALUE! | Y78: =(RC[-3]*RC[-11]-RC[-2]*RC[-9])/1000 -> #VALUE! | AD78: =VALUE(RC[-28]) -> #VALUE! | AE78: =IF(RC[22]=42,"*",IF(RC[22]=32,"",RC[22])) ->  | AF78: =RC[-29] -> 24 | AG78: =RC[-29] ->  | AH78: =RC[-29] ->  | AI78: =RC[-29] ->  | AJ78: =RC[-29] ->  | AK78: =RC[-29] ->  | AL78: =RC[-29] ->  | AM78: =RC[-29] -> #VALUE! | AN78: =RC[-29] ->  | AO78: =RC[-29] ->  | AP78: =RC[-29] ->  | AQ78: =RC[-29] ->  | AR78: - | AS78: =RC[-30] ->  | AT78: =RC[-30] ->  | AU78: - | AV78: =RC[-31] -> #VALUE! | AW78: =RC[-31] ->  | AX78: =RC[-31] ->  | AY78: =RC[-31] -> #VALUE!
A79: =IF(RC[1]="","",DATEVALUE(RC[1])) ->  | C79: 24 | J79: =RC[-5]-RC[-2] -> #VALUE! | Q79: =RC[-3]-RC[-1] -> #VALUE! | T79: =RC[-8]+RC[-1] -> #VALUE! | U79: =(RC[-17]*RC[-16]-RC[-14]*RC[-13])/1000 -> #VALUE! | X79: =RC[-2]*RC[-10]/1000 -> #VALUE! | Y79: =(RC[-3]*RC[-11]-RC[-2]*RC[-9])/1000 -> #VALUE! | AD79: =VALUE(RC[-28]) -> #VALUE! | AE79: =IF(RC[22]=42,"*",IF(RC[22]=32,"",RC[22])) ->  | AF79: =RC[-29] -> 24 | AG79: =RC[-29] ->  | AH79: =RC[-29] ->  | AI79: =RC[-29] ->  | AJ79: =RC[-29] ->  | AK79: =RC[-29] ->  | AL79: =RC[-29] ->  | AM79: =RC[-29] -> #VALUE! | AN79: =RC[-29] ->  | AO79: =RC[-29] ->  | AP79: =RC[-29] ->  | AQ79: =RC[-29] ->  | AR79: - | AS79: =RC[-30] ->  | AT79: =RC[-30] ->  | AU79: - | AV79: =RC[-31] -> #VALUE! | AW79: =RC[-31] ->  | AX79: =RC[-31] ->  | AY79: =RC[-31] -> #VALUE!
A80: =IF(RC[1]="","",DATEVALUE(RC[1])) ->  | C80: 24 | J80: =RC[-5]-RC[-2] -> #VALUE! | Q80: =RC[-3]-RC[-1] -> #VALUE! | T80: =RC[-8]+RC[-1] -> #VALUE! | U80: =(RC[-17]*RC[-16]-RC[-14]*RC[-13])/1000 -> #VALUE! | X80: =RC[-2]*RC[-10]/1000 -> #VALUE! | Y80: =(RC[-3]*RC[-11]-RC[-2]*RC[-9])/1000 -> #VALUE! | AD80: =VALUE(RC[-28]) -> #VALUE! | AE80: =IF(RC[22]=42,"*",IF(RC[22]=32,"",RC[22])) ->  | AF80: =RC[-29] -> 24 | AG80: =RC[-29] ->  | AH80: =RC[-29] ->  | AI80: =RC[-29] ->  | AJ80: =RC[-29] ->  | AK80: =RC[-29] ->  | AL80: =RC[-29] ->  | AM80: =RC[-29] -> #VALUE! | AN80: =RC[-29] ->  | AO80: =RC[-29] ->  | AP80: =RC[-29] ->  | AQ80: =RC[-29] ->  | AR80: - | AS80: =RC[-30] ->  | AT80: =RC[-30] ->  | AU80: - | AV80: =RC[-31] -> #VALUE! | AW80: =RC[-31] ->  | AX80: =RC[-31] ->  | AY80: =RC[-31] -> #VALUE!
A81: =IF(RC[1]="","",DATEVALUE(RC[1])) ->  | C81: 24 | J81: =RC[-5]-RC[-2] -> #VALUE! | Q81: =RC[-3]-RC[-1] -> #VALUE! | T81: =RC[-8]+RC[-1] -> #VALUE! | U81: =(RC[-17]*RC[-16]-RC[-14]*RC[-13])/1000 -> #VALUE! | X81: =RC[-2]*RC[-10]/1000 -> #VALUE! | Y81: =(RC[-3]*RC[-11]-RC[-2]*RC[-9])/1000 -> #VALUE! | AD81: =VALUE(RC[-28]) -> #VALUE! | AE81: =IF(RC[22]=42,"*",IF(RC[22]=32,"",RC[22])) ->  | AF81: =RC[-29] -> 24 | AG81: =RC[-29] ->  | AH81: =RC[-29] ->  | AI81: =RC[-29] ->  | AJ81: =RC[-29] ->  | AK81: =RC[-29] ->  | AL81: =RC[-29] ->  | AM81: =RC[-29] -> #VALUE! | AN81: =RC[-29] ->  | AO81: =RC[-29] ->  | AP81: =RC[-29] ->  | AQ81: =RC[-29] ->  | AR81: - | AS81: =RC[-30] ->  | AT81: =RC[-30] ->  | AU81: - | AV81: =RC[-31] -> #VALUE! | AW81: =RC[-31] ->  | AX81: =RC[-31] ->  | AY81: =RC[-31] -> #VALUE!
A82: =IF(RC[1]="","",DATEVALUE(RC[1])) ->  | C82: 24 | J82: =RC[-5]-RC[-2] -> #VALUE! | Q82: =RC[-3]-RC[-1] -> #VALUE! | T82: =RC[-8]+RC[-1] -> #VALUE! | U82: =(RC[-17]*RC[-16]-RC[-14]*RC[-13])/1000 -> #VALUE! | X82: =RC[-2]*RC[-10]/1000 -> #VALUE! | Y82: =(RC[-3]*RC[-11]-RC[-2]*RC[-9])/1000 -> #VALUE! | AD82: =VALUE(RC[-28]) -> #VALUE! | AE82: =IF(RC[22]=42,"*",IF(RC[22]=32,"",RC[22])) ->  | AF82: =RC[-29] -> 24 | AG82: =RC[-29] ->  | AH82: =RC[-29] ->  | AI82: =RC[-29] ->  | AJ82: =RC[-29] ->  | AK82: =RC[-29] ->  | AL82: =RC[-29] ->  | AM82: =RC[-29] -> #VALUE! | AN82: =RC[-29] ->  | AO82: =RC[-29] ->  | AP82: =RC[-29] ->  | AQ82: =RC[-29] ->  | AR82: - | AS82: =RC[-30] ->  | AT82: =RC[-30] ->  | AU82: - | AV82: =RC[-31] -> #VALUE! | AW82: =RC[-31] ->  | AX82: =RC[-31] ->  | AY82: =RC[-31] -> #VALUE!
A83: =IF(RC[1]="","",DATEVALUE(RC[1])) ->  | C83: 24 | J83: =RC[-5]-RC[-2] -> #VALUE! | Q83: =RC[-3]-RC[-1] -> #VALUE! | T83: =RC[-8]+RC[-1] -> #VALUE! | U83: =(RC[-17]*RC[-16]-RC[-14]*RC[-13])/1000 -> #VALUE! | X83: =RC[-2]*RC[-10]/1000 -> #VALUE! | Y83: =(RC[-3]*RC[-11]-RC[-2]*RC[-9])/1000 -> #VALUE! | AD83: =VALUE(RC[-28]) -> #VALUE! | AE83: =IF(RC[22]=42,"*",IF(RC[22]=32,"",RC[22])) ->  | AF83: =RC[-29] -> 24 | AG83: =RC[-29] ->  | AH83: =RC[-29] ->  | AI83: =RC[-29] ->  | AJ83: =RC[-29] ->  | AK83: =RC[-29] ->  | AL83: =RC[-29] ->  | AM83: =RC[-29] -> #VALUE! | AN83: =RC[-29] ->  | AO83: =RC[-29] ->  | AP83: =RC[-29] ->  | AQ83: =RC[-29] ->  | AR83: - | AS83: =RC[-30] ->  | AT83: =RC[-30] ->  | AU83: - | AV83: =RC[-31] -> #VALUE! | AW83: =RC[-31] ->  | AX83: =RC[-31] ->  | AY83: =RC[-31] -> #VALUE!
AD84: Среднее | AG84: =R[1]C[-29] -> 321.25900000000001 | AH84: =R[1]C[-29] -> 46.020666666666671 | AI84: =R[1]C[-29] -> 7.53 | AJ84: =R[1]C[-29] -> 315.3966666666667 | AK84: =R[1]C[-29] -> 38.065666666666658 | AL84: =R[1]C[-29] -> 5.4300000000000042 | AM84: =R[1]C[-29] -> 7.9550000000000125 | AN84: =R[1]C[-29] -> 5.8623333333333338 | AP84: =R[1]C[-29] -> 236.76066666666668 | AQ84: =R[1]C[-29] -> 65.637666666666675 | AS84: =R[1]C[-30] -> 148.33766666666665 | AT84: =R[1]C[-30] -> 51.173000000000009 | AU84: - | AV84: =R[1]C[-31] -> 14.464666666666666
B85: Среднее | D85: =AVERAGE(OFFSET(R[-74]C,3,0,R7C1,1)) -> 321.25900000000001 | E85: =IF(SUM(OFFSET(R[-74]C,3,0,R7C1,1))=0,0,AVERAGE(OFFSET(R[-74]C,3,0,R7C1,1))) -> 46.020666666666671 | F85: =IF(SUM(OFFSET(R[-74]C,3,0,R7C1,1))=0,0,AVERAGE(OFFSET(R[-74]C,3,0,R7C1,1))) -> 7.53 | G85: =AVERAGE(OFFSET(R[-74]C,3,0,R7C1,1)) -> 315.3966666666667 | H85: =IF(SUM(OFFSET(R[-74]C,3,0,R7C1,1))=0,0,AVERAGE(OFFSET(R[-74]C,3,0,R7C1,1))) -> 38.065666666666658 | I85: =IF(SUM(OFFSET(R[-74]C,3,0,R7C1,1))=0,0,AVERAGE(OFFSET(R[-74]C,3,0,R7C1,1))) -> 5.4300000000000042 | J85: =RC[-5]-RC[-2] -> 7.9550000000000125 | K85: =AVERAGE(OFFSET(R[-74]C,3,0,R7C1,1)) -> 5.8623333333333338 | L85: =AVERAGE(OFFSET(R[-74]C,3,0,R7C1,1)) -> 2.7020666666666671 | M85: =AVERAGE(OFFSET(R[-74]C,3,0,R7C1,1)) -> 236.76066666666668 | N85: =IF(SUM(OFFSET(R[-74]C,3,0,R7C1,1))=0,0,AVERAGE(OFFSET(R[-74]C,3,0,R7C1,1))) -> 65.637666666666675 | O85: =AVERAGE(OFFSET(R[-74]C,3,0,R7C1,1)) -> 148.33766666666665 | P85: =IF(SUM(OFFSET(R[-74]C,3,0,R7C1,1))=0,0,AVERAGE(OFFSET(R[-74]C,3,0,R7C1,1))) -> 51.173000000000009 | Q85: =RC[-3]-RC[-1] -> 14.464666666666666 | R85: =AVERAGE(OFFSET(R[-74]C,3,0,R7C1,1)) -> 88.423000000000002 | S85: =AVERAGE(OFFSET(R[-74]C,3,0,R7C1,1)) -> 7.7399000000000004 | T85: =AVERAGE(OFFSET(R[-74]C,3,0,R7C1,1)) -> 10.441966666666666 | U85: =AVERAGE(OFFSET(R[-74]C,3,0,R7C1,1)) -> 2.6877260299999994 | X85: =AVERAGE(OFFSET(R[-74]C,3,0,R7C1,1)) -> 15.239839543333337 | Y85: =AVERAGE(OFFSET(R[-74]C,3,0,R7C1,1)) -> 7.7382244499999997 | AD85: Итого | AF85: =R[1]C[-29] -> 720 | AG85: =R[1]C[-29] -> 9637.77 | AJ85: =R[1]C[-29] -> 9461.9000000000015 | AN85: =R[1]C[-29] -> 175.87 | AO85: =R[1]C[-29] -> 81.062000000000012 | AP85: =R[1]C[-29] -> 7102.8200000000006 | AS85: =R[1]C[-30] -> 4450.1299999999992 | AW85: =R[1]C[-31] -> 2652.69 | AX85: =R[1]C[-31] -> 232.197 | AY85: =R[1]C[-31] -> 313.25899999999996
B86: ИТОГО: | C86: =SUM(OFFSET(R[-75]C,3,0,R7C1,1)) -> 720 | D86: =SUM(OFFSET(R[-75]C,3,0,R7C1,1)) -> 9637.77 | G86: =SUM(OFFSET(R[-75]C,3,0,R7C1,1)) -> 9461.9000000000015 | K86: =SUM(OFFSET(R[-75]C,3,0,R7C1,1)) -> 175.87 | L86: =SUM(OFFSET(R[-75]C,3,0,R7C1,1)) -> 81.062000000000012 | M86: =SUM(OFFSET(R[-75]C,3,0,R7C1,1)) -> 7102.8200000000006 | O86: =SUM(OFFSET(R[-75]C,3,0,R7C1,1)) -> 4450.1299999999992 | R86: =SUM(OFFSET(R[-75]C,3,0,R7C1,1)) -> 2652.69 | S86: =SUM(OFFSET(R[-75]C,3,0,R7C1,1)) -> 232.197 | T86: =SUM(OFFSET(R[-75]C,3,0,R7C1,1)) -> 313.25899999999996 | U86: =SUM(OFFSET(R[-75]C,3,0,R7C1,1)) -> 80.631780899999981 | X86: =SUM(OFFSET(R[-75]C,3,0,R7C1,1)) -> 457.1951863000001 | Y86: =SUM(OFFSET(R[-75]C,3,0,R7C1,1)) -> 232.14673349999998
AD87: Досчёт по среднему до конца месяца | AG87: =R[1]C[-29] -> 0 | AJ87: =R[1]C[-29] -> 0 | AN87: =R[1]C[-29] -> 0 | AO87: =R[1]C[-29] -> 0 | AP87: =R[1]C[-29] -> 0 | AS87: =R[1]C[-30] -> 0 | AW87: =R[1]C[-31] -> 0 | AX87: =R[1]C[-31] -> 0 | AY87: =R[1]C[-31] -> 0
A88: 11дн=264ч 4дн=96ч | B88: Досчёт до конца м-ца (+) | C88: =R[-82]C[-2]*24 -> 216 | U88: № 49517 | AD88: Снятие досчёта по среднему предыдущего отчёта | AG88: =-R[1]C[-29] -> 0 | AJ88: =-R[1]C[-29] -> 0 | AN88: =-R[1]C[-29] -> 0 | AO88: =-R[1]C[-29] -> 0 | AP88: =-R[1]C[-29] -> 0 | AS88: =-R[1]C[-30] -> 0 | AW88: =-R[1]C[-31] -> 0 | AX88: =-R[1]C[-31] -> 0 | AY88: =-R[1]C[-31] -> 0
A89: 9дн=216ч 7дн=168ч | B89: Вычет с предыдущего (-) | C89: =R[-85]C[-2]*24 -> 192 | AD89: Сумма: | AG89: =R[1]C[-29] -> 9637.77 | AJ89: =R[1]C[-29] -> 9461.9000000000015 | AN89: =R[1]C[-29] -> 175.87 | AO89: =R[1]C[-29] -> 81.062000000000012 | AP89: =R[1]C[-29] -> 7102.8200000000006 | AS89: =R[1]C[-30] -> 4450.1299999999992 | AW89: =R[1]C[-31] -> 2652.69 | AX89: =R[1]C[-31] -> 232.197 | AY89: =R[1]C[-31] -> 313.25899999999996
B90: СУММА: | C90: =R[-4]C+R[-2]C-R[-1]C -> 744 | D90: =R[-4]C+R[-2]C-R[-1]C -> 9637.77 | G90: =R[-4]C+R[-2]C-R[-1]C -> 9461.9000000000015 | K90: =R[-4]C+R[-2]C-R[-1]C -> 175.87 | L90: =R[-4]C+R[-2]C-R[-1]C -> 81.062000000000012 | M90: =R[-4]C+R[-2]C-R[-1]C -> 7102.8200000000006 | O90: =R[-4]C+R[-2]C-R[-1]C -> 4450.1299999999992 | R90: =R[-4]C+R[-2]C-R[-1]C -> 2652.69 | S90: =R[-4]C+R[-2]C-R[-1]C -> 232.197 | T90: =R[-4]C+R[-2]C-R[-1]C -> 313.25899999999996 | AD90: Тхв на источнике | AE90: 0 | AF90: V гвс (м3) | AG90: =R[-1]C[16] -> 2652.69 | AH90: W гвс (Гкал) | AI90: =RC[-2]*0.06 -> 159.16139999999999 | AJ90: W без гвс (Гкал) | AK90: =R[-1]C[4] -> 81.062000000000012
AD91: =R[-90]C[-17] -> з.н д. №02/147-2783 от 04.10.18
B93: Дата, время | D93: М1, т | F93: М2, т | H93: М3, т | J93: М4, т | L93: Qо, Гкал | N93: Qг, Гкал | P93: время, час
B94: 23.09.18 01:00 | D94: 158377.21 | F94: 156724.72 | H94: 169483.36 | J94: 169352.31 | L94: 3000.5219999999999 | N94: 2886.9140000000002 | P94: -
B95: 18.10.18 01:00 | D95: 162249.04999999999 | F95: 160417.03 | H95: 176409.48 | J95: 175379.33 | L95: 3040.989 | N95: 2941.0749999999998 | P95: -
B98: Представитель потредителя:_______________________________________________________ В.О. Топорков
I101: Рекомендуемые значения по параметрам теплопотребления (не являются официально утверждёнными)
I102: М, т | J102: V, м3 | K102: Qгвс, Гкал | L102: Qотоп, Гкал | M102: Qо, Гкал
I103: =R[-13]C[6] -> 4450.1299999999992 | J103: =RC[-1]/0.98 -> 4540.9489795918362 | K103: =R[-13]C[8] -> 232.197 | L103: =R[-13]C -> 81.062000000000012 | M103: =R[-6]C[2] -> 0
P105: ДЛЯ САМОКОНТРОЛЯ
B106: В строке выбора дат указать период с 16.7.13 по 23.8.13 - жильё | O106: Qo | Q106: Qг
B107: В строке выбора дат указать период с 18.7.13 по 25.8.13 - не жилое | O107: =((R[-21]C[-11]*R[-22]C[-8])-(R[-21]C[-10]*R[-22]C[-7]))/1000 -> 3039.7205321000006 | Q107: =IF(R[-22]C[-3]="",R[-21]C[-4]*R[-22]C[-1]/1000,"") ->  | R107: Си4
Q108: =IF(R[-23]C[-3]="","",((R[-22]C[-4]*R[-23]C[-1])-(R[-22]C[-3]*R[-23]C[1]))/1000) -> 363.4726078600001 | R108: Си5