Sheet: Лист1
G1: Отчёт о теплопотреблении за октябрь 2018 | M1: з.н д. №02/147-2783 от 04.10.18
A4: =EOMONTH(R[9]C,0)-R[9]C -> 8 | B4: Потребитель: ЗАО "Сити Сервис"
A5: =MAX(R[9]C:R[78]C) -> 2018-10-22T00:00:00.000 | B5: Адрес: г. СПб, Кораблестроителей ул., д.29 к.1 ИТП 1
A6: =EOMONTH(R[-1]C,0)-R[-1]C -> 9 | B6: Телефон: 8-911-021-19-79
A7: =R[-2]C-R[6]C -> 30 | B7: Договор 10023-2 (.) 14399
A8: 7 | B8: Тепловычислитель: ВКТ-7 № 93473 | L8: М2 мах= | M8: 184.8 | O8: Мгвс мах= | P8: 57.6
L9: Qотоп мах= | M9: 14.76 | O9: Qгвс мах= | P9: 3.456
B10: Расчётная формула: Q=M1*(h1-h2)+(M1-M2)*(h2-hхв)
D12: Учет | L12: Контроль
A13: =R[1]C[1]-1 -> 2018-09-22T00:00:00.000 | B13: Дата | C13: N, ч | D13: M1, т | E13: T1, С | F13: P1, кг/см2 | G13: M2, т | H13: T2, С | I13: P2, кг/см2 | J13: dT, С | K13: M1-М2, т | L13: V3, м3 | M13: T3, С | N13: V4, м3 | O13: =IF(R[-12]C[-14]="м.куб","","T4, С") -> T4, С | P13: dT, С | Q13: V3-V4, м3 | R13: Qгвс, Гкал | S13: Qобщ., Гкал | T13: Q | U13: M3 | V13: M4 | W13: си2 | X13: си3 | Y13: Разб. | Z13: dM2 | AC13: Дата | AD13: НС | AE13: n, ч | AF13: М1, т | AG13: t1, гр. С | AH13: Р1, кгс/см2 | AI13: М2, т | AJ13: t2, гр. С | AK13: Р2, кгс/см2 | AL13: t1-t2, гр. С | AM13: М1-М2, т | AN13: М1гвс, т | AO13: t1гвс, гр. С | AP13: Р1гвс, кгс/см2 | AQ13: М2гвс, т | AR13: t2гвс, гр. С | AS13: Р2гвс, кгс/см2 | AT13: t1гвс-t2гвс | AU13: М1гвс-М2гвс, т | AV13: Wгвс, Гкал | AW13: Wсумм, Гкал | AY13: NS_TV1 | AZ13: НС | BA13: NS_TV2
A14: =IF(RC[1]="","",DATEVALUE(RC[1])) -> 43366 | B14: 23.09.18 | C14: 24 | D14: 27.57 | E14: 67.73 | F14: 9.01 | G14: 0 | H14: 40.32 | I14: 9.0500000000000007 | J14: =RC[-5]-RC[-2] -> 27.410000000000004 | K14: 27.57 | L14: 28.91 | M14: 67.510000000000005 | R14: 1.91 | S14: =RC[-1] -> 1.91 | T14: =(RC[-16]*RC[-15]-RC[-13]*RC[-12])/1000 -> 1.8673161000000003 | U14: 28.29 | V14: - | W14: =RC[-2]*RC[-10]/1000 -> 1.9098579000000002 | X14: =ABS((RC[-3]*RC[-11]-RC[-2]*RC[-9])/1000) -> #VALUE! | Y14: =(RC[-14]-RC[1])/RC[-18]*100 -> #DIV/0! | Z14: 28.29 | AC14: =VALUE(RC[-27]) -> 2018-09-23T00:00:00.000 | AD14: =IF(RC[21]=42,"*",IF(RC[21]=32,"",RC[21])) -> - | AE14: =RC[-28] -> 24 | AF14: =RC[-28] -> 27.57 | AG14: =RC[-28] -> 67.73 | AH14: =RC[-28] -> 9.01 | AI14: =RC[-28] -> 0 | AJ14: =RC[-28] -> 40.32 | AK14: =RC[-28] -> 9.0500000000000007 | AL14: =RC[-28] -> 27.410000000000004 | AM14: =RC[-28] -> 27.57 | AN14: =RC[-28] -> 28.91 | AO14: =RC[-28] -> 67.510000000000005 | AP14: - | AQ14: =RC[-29] -> 0 | AR14: =RC[-29] -> 0 | AS14: - | AT14: =RC[-30] -> 0 | AU14: =RC[-30] -> 0 | AV14: =RC[-30] -> 1.91 | AW14: =RC[-30] -> 1.91 | AY14: - | AZ14: - | BA14: -
A15: =IF(RC[1]="","",DATEVALUE(RC[1])) -> 43367 | B15: 24.09.18 | C15: 24 | D15: 26.1 | E15: 65.319999999999993 | F15: 8.98 | G15: 0 | H15: 37.68 | I15: 9.01 | J15: =RC[-5]-RC[-2] -> 27.639999999999993 | K15: 26.1 | L15: 27.61 | M15: 65.12 | R15: 1.764 | S15: =RC[-1] -> 1.764 | T15: =(RC[-16]*RC[-15]-RC[-13]*RC[-12])/1000 -> 1.7048519999999998 | U15: 27.07 | V15: - | W15: =RC[-2]*RC[-10]/1000 -> 1.7627984000000001 | X15: =ABS((RC[-3]*RC[-11]-RC[-2]*RC[-9])/1000) -> #VALUE! | Y15: =(RC[-14]-RC[1])/RC[-18]*100 -> #DIV/0! | Z15: 27.07 | AC15: =VALUE(RC[-27]) -> 2018-09-24T00:00:00.000 | AD15: =IF(RC[21]=42,"*",IF(RC[21]=32,"",RC[21])) -> - | AE15: =RC[-28] -> 24 | AF15: =RC[-28] -> 26.1 | AG15: =RC[-28] -> 65.319999999999993 | AH15: =RC[-28] -> 8.98 | AI15: =RC[-28] -> 0 | AJ15: =RC[-28] -> 37.68 | AK15: =RC[-28] -> 9.01 | AL15: =RC[-28] -> 27.639999999999993 | AM15: =RC[-28] -> 26.1 | AN15: =RC[-28] -> 27.61 | AO15: =RC[-28] -> 65.12 | AP15: - | AQ15: =RC[-29] -> 0 | AR15: =RC[-29] -> 0 | AS15: - | AT15: =RC[-30] -> 0 | AU15: =RC[-30] -> 0 | AV15: =RC[-30] -> 1.764 | AW15: =RC[-30] -> 1.764 | AY15: - | AZ15: - | BA15: -
A16: =IF(RC[1]="","",DATEVALUE(RC[1])) -> 43368 | B16: 25.09.18 | C16: 24 | D16: 28.37 | E16: 61.07 | F16: 9.02 | G16: 0 | H16: 37.49 | I16: 9.06 | J16: =RC[-5]-RC[-2] -> 23.58 | K16: 28.37 | L16: 29.7 | M16: 60.86 | R16: 1.78 | S16: =RC[-1] -> 1.78 | T16: =(RC[-16]*RC[-15]-RC[-13]*RC[-12])/1000 -> 1.7325559000000001 | U16: 29.19 | V16: - | W16: =RC[-2]*RC[-10]/1000 -> 1.7765034 | X16: =ABS((RC[-3]*RC[-11]-RC[-2]*RC[-9])/1000) -> #VALUE! | Y16: =(RC[-14]-RC[1])/RC[-18]*100 -> #DIV/0! | Z16: 29.19 | AC16: =VALUE(RC[-27]) -> 2018-09-25T00:00:00.000 | AD16: =IF(RC[21]=42,"*",IF(RC[21]=32,"",RC[21])) -> - | AE16: =RC[-28] -> 24 | AF16: =RC[-28] -> 28.37 | AG16: =RC[-28] -> 61.07 | AH16: =RC[-28] -> 9.02 | AI16: =RC[-28] -> 0 | AJ16: =RC[-28] -> 37.49 | AK16: =RC[-28] -> 9.06 | AL16: =RC[-28] -> 23.58 | AM16: =RC[-28] -> 28.37 | AN16: =RC[-28] -> 29.7 | AO16: =RC[-28] -> 60.86 | AP16: - | AQ16: =RC[-29] -> 0 | AR16: =RC[-29] -> 0 | AS16: - | AT16: =RC[-30] -> 0 | AU16: =RC[-30] -> 0 | AV16: =RC[-30] -> 1.78 | AW16: =RC[-30] -> 1.78 | AY16: - | AZ16: - | BA16: -
A17: =IF(RC[1]="","",DATEVALUE(RC[1])) -> 43369 | B17: 26.09.18 | C17: 24 | D17: 81.33 | E17: 64.430000000000007 | F17: 8.83 | G17: 54.77 | H17: 44.19 | I17: 8.08 | J17: =RC[-5]-RC[-2] -> 20.240000000000009 | K17: 26.56 | L17: 27.94 | M17: 62.78 | R17: 1.724 | S17: 2.8239999999999998 | T17: =(RC[-16]*RC[-15]-RC[-13]*RC[-12])/1000 -> 2.8198056 | U17: 27.45 | V17: - | W17: =RC[-2]*RC[-10]/1000 -> 1.7233109999999998 | X17: =ABS((RC[-3]*RC[-11]-RC[-2]*RC[-9])/1000) -> #VALUE! | Y17: =(RC[-14]-RC[1])/RC[-18]*100 -> -1.6249771772868369 | Z17: 27.45 | AC17: =VALUE(RC[-27]) -> 2018-09-26T00:00:00.000 | AD17: =IF(RC[21]=42,"*",IF(RC[21]=32,"",RC[21])) -> - | AE17: =RC[-28] -> 24 | AF17: =RC[-28] -> 81.33 | AG17: =RC[-28] -> 64.430000000000007 | AH17: =RC[-28] -> 8.83 | AI17: =RC[-28] -> 54.77 | AJ17: =RC[-28] -> 44.19 | AK17: =RC[-28] -> 8.08 | AL17: =RC[-28] -> 20.240000000000009 | AM17: =RC[-28] -> 26.56 | AN17: =RC[-28] -> 27.94 | AO17: =RC[-28] -> 62.78 | AP17: - | AQ17: =RC[-29] -> 0 | AR17: =RC[-29] -> 0 | AS17: - | AT17: =RC[-30] -> 0 | AU17: =RC[-30] -> 0 | AV17: =RC[-30] -> 1.724 | AW17: =RC[-30] -> 2.8239999999999998 | AY17: - | AZ17: - | BA17: -
A18: =IF(RC[1]="","",DATEVALUE(RC[1])) -> 43370 | B18: 27.09.18 | C18: 24 | D18: 230.2 | E18: 62.78 | F18: 8.17 | G18: 205.58 | H18: 42.76 | I18: 5.26 | J18: =RC[-5]-RC[-2] -> 20.020000000000003 | K18: 24.62 | L18: 26.95 | M18: 62.63 | R18: 1.6579999999999999 | S18: 5.665 | T18: =(RC[-16]*RC[-15]-RC[-13]*RC[-12])/1000 -> 5.6613552 | U18: 26.49 | V18: - | W18: =RC[-2]*RC[-10]/1000 -> 1.6590687 | X18: =ABS((RC[-3]*RC[-11]-RC[-2]*RC[-9])/1000) -> #VALUE! | Y18: =(RC[-14]-RC[1])/RC[-18]*100 -> -0.90962155851736415 | Z18: 26.49 | AC18: =VALUE(RC[-27]) -> 2018-09-27T00:00:00.000 | AD18: =IF(RC[21]=42,"*",IF(RC[21]=32,"",RC[21])) -> - | AE18: =RC[-28] -> 24 | AF18: =RC[-28] -> 230.2 | AG18: =RC[-28] -> 62.78 | AH18: =RC[-28] -> 8.17 | AI18: =RC[-28] -> 205.58 | AJ18: =RC[-28] -> 42.76 | AK18: =RC[-28] -> 5.26 | AL18: =RC[-28] -> 20.020000000000003 | AM18: =RC[-28] -> 24.62 | AN18: =RC[-28] -> 26.95 | AO18: =RC[-28] -> 62.63 | AP18: - | AQ18: =RC[-29] -> 0 | AR18: =RC[-29] -> 0 | AS18: - | AT18: =RC[-30] -> 0 | AU18: =RC[-30] -> 0 | AV18: =RC[-30] -> 1.6579999999999999 | AW18: =RC[-30] -> 5.665 | AY18: - | AZ18: - | BA18: -
A19: =IF(RC[1]="","",DATEVALUE(RC[1])) -> 43371 | B19: 28.09.18 | C19: 24 | D19: 219.17 | E19: 67.02 | F19: 7.99 | G19: 194.71 | H19: 42.72 | I19: 5.38 | J19: =RC[-5]-RC[-2] -> 24.299999999999997 | K19: 24.46 | L19: 26.78 | M19: 67.150000000000006 | R19: 1.7649999999999999 | S19: 6.3710000000000004 | T19: =(RC[-16]*RC[-15]-RC[-13]*RC[-12])/1000 -> 6.370762199999997 | U19: 26.27 | V19: - | W19: =RC[-2]*RC[-10]/1000 -> 1.7640305000000001 | X19: =ABS((RC[-3]*RC[-11]-RC[-2]*RC[-9])/1000) -> #VALUE! | Y19: =(RC[-14]-RC[1])/RC[-18]*100 -> -0.92958759180319372 | Z19: 26.27 | AC19: =VALUE(RC[-27]) -> 2018-09-28T00:00:00.000 | AD19: =IF(RC[21]=42,"*",IF(RC[21]=32,"",RC[21])) -> - | AE19: =RC[-28] -> 24 | AF19: =RC[-28] -> 219.17 | AG19: =RC[-28] -> 67.02 | AH19: =RC[-28] -> 7.99 | AI19: =RC[-28] -> 194.71 | AJ19: =RC[-28] -> 42.72 | AK19: =RC[-28] -> 5.38 | AL19: =RC[-28] -> 24.299999999999997 | AM19: =RC[-28] -> 24.46 | AN19: =RC[-28] -> 26.78 | AO19: =RC[-28] -> 67.150000000000006 | AP19: - | AQ19: =RC[-29] -> 0 | AR19: =RC[-29] -> 0 | AS19: - | AT19: =RC[-30] -> 0 | AU19: =RC[-30] -> 0 | AV19: =RC[-30] -> 1.7649999999999999 | AW19: =RC[-30] -> 6.3710000000000004 | AY19: - | AZ19: - | BA19: -
A20: =IF(RC[1]="","",DATEVALUE(RC[1])) -> 43372 | B20: 29.09.18 | C20: 24 | D20: 211.63 | E20: 66.78 | F20: 7.94 | G20: 187.34 | H20: 41.81 | I20: 5.53 | J20: =RC[-5]-RC[-2] -> 24.97 | K20: 24.29 | L20: 26.7 | M20: 66.59 | R20: 1.7410000000000001 | S20: 6.3019999999999996 | T20: =(RC[-16]*RC[-15]-RC[-13]*RC[-12])/1000 -> 6.2999660000000004 | U20: 26.16 | V20: - | W20: =RC[-2]*RC[-10]/1000 -> 1.7419944000000001 | X20: =ABS((RC[-3]*RC[-11]-RC[-2]*RC[-9])/1000) -> #VALUE! | Y20: =(RC[-14]-RC[1])/RC[-18]*100 -> -0.99818511796733267 | Z20: 26.16 | AC20: =VALUE(RC[-27]) -> 2018-09-29T00:00:00.000 | AD20: =IF(RC[21]=42,"*",IF(RC[21]=32,"",RC[21])) -> - | AE20: =RC[-28] -> 24 | AF20: =RC[-28] -> 211.63 | AG20: =RC[-28] -> 66.78 | AH20: =RC[-28] -> 7.94 | AI20: =RC[-28] -> 187.34 | AJ20: =RC[-28] -> 41.81 | AK20: =RC[-28] -> 5.53 | AL20: =RC[-28] -> 24.97 | AM20: =RC[-28] -> 24.29 | AN20: =RC[-28] -> 26.7 | AO20: =RC[-28] -> 66.59 | AP20: - | AQ20: =RC[-29] -> 0 | AR20: =RC[-29] -> 0 | AS20: - | AT20: =RC[-30] -> 0 | AU20: =RC[-30] -> 0 | AV20: =RC[-30] -> 1.7410000000000001 | AW20: =RC[-30] -> 6.3019999999999996 | AY20: - | AZ20: - | BA20: -
A21: =IF(RC[1]="","",DATEVALUE(RC[1])) -> 43373 | B21: 30.09.18 | C21: 24 | D21: 211.74 | E21: 68.8 | F21: 7.86 | G21: 185.95 | H21: 42.69 | I21: 5.49 | J21: =RC[-5]-RC[-2] -> 26.11 | K21: 25.79 | L21: 28.03 | M21: 69.06 | R21: 1.893 | S21: 6.633 | T21: =(RC[-16]*RC[-15]-RC[-13]*RC[-12])/1000 -> 6.6295065000000006 | U21: 27.43 | V21: - | W21: =RC[-2]*RC[-10]/1000 -> 1.8943158 | X21: =ABS((RC[-3]*RC[-11]-RC[-2]*RC[-9])/1000) -> #VALUE! | Y21: =(RC[-14]-RC[1])/RC[-18]*100 -> -0.88195751546114587 | Z21: 27.43 | AC21: =VALUE(RC[-27]) -> 2018-09-30T00:00:00.000 | AD21: =IF(RC[21]=42,"*",IF(RC[21]=32,"",RC[21])) -> - | AE21: =RC[-28] -> 24 | AF21: =RC[-28] -> 211.74 | AG21: =RC[-28] -> 68.8 | AH21: =RC[-28] -> 7.86 | AI21: =RC[-28] -> 185.95 | AJ21: =RC[-28] -> 42.69 | AK21: =RC[-28] -> 5.49 | AL21: =RC[-28] -> 26.11 | AM21: =RC[-28] -> 25.79 | AN21: =RC[-28] -> 28.03 | AO21: =RC[-28] -> 69.06 | AP21: - | AQ21: =RC[-29] -> 0 | AR21: =RC[-29] -> 0 | AS21: - | AT21: =RC[-30] -> 0 | AU21: =RC[-30] -> 0 | AV21: =RC[-30] -> 1.893 | AW21: =RC[-30] -> 6.633 | AY21: - | AZ21: - | BA21: -
A22: =IF(RC[1]="","",DATEVALUE(RC[1])) -> 43374 | B22: 01.10.18 | C22: 24 | D22: 209.29 | E22: 67.819999999999993 | F22: 7.96 | G22: 187.19 | H22: 43.04 | I22: 5.55 | J22: =RC[-5]-RC[-2] -> 24.779999999999994 | K22: 22.1 | L22: 24.15 | M22: 67.66 | R22: 1.599 | S22: 6.14 | T22: =(RC[-16]*RC[-15]-RC[-13]*RC[-12])/1000 -> 6.1373901999999987 | U22: 23.63 | V22: - | W22: =RC[-2]*RC[-10]/1000 -> 1.5988057999999998 | X22: =ABS((RC[-3]*RC[-11]-RC[-2]*RC[-9])/1000) -> #VALUE! | Y22: =(RC[-14]-RC[1])/RC[-18]*100 -> -0.81735135423900729 | Z22: 23.63 | AC22: =VALUE(RC[-27]) -> 2018-10-01T00:00:00.000 | AD22: =IF(RC[21]=42,"*",IF(RC[21]=32,"",RC[21])) -> - | AE22: =RC[-28] -> 24 | AF22: =RC[-28] -> 209.29 | AG22: =RC[-28] -> 67.819999999999993 | AH22: =RC[-28] -> 7.96 | AI22: =RC[-28] -> 187.19 | AJ22: =RC[-28] -> 43.04 | AK22: =RC[-28] -> 5.55 | AL22: =RC[-28] -> 24.779999999999994 | AM22: =RC[-28] -> 22.1 | AN22: =RC[-28] -> 24.15 | AO22: =RC[-28] -> 67.66 | AP22: - | AQ22: =RC[-29] -> 0 | AR22: =RC[-29] -> 0 | AS22: - | AT22: =RC[-30] -> 0 | AU22: =RC[-30] -> 0 | AV22: =RC[-30] -> 1.599 | AW22: =RC[-30] -> 6.14 | AY22: - | AZ22: - | BA22: -
A23: =IF(RC[1]="","",DATEVALUE(RC[1])) -> 43375 | B23: 02.10.18 | C23: 24 | D23: 198.08 | E23: 66.489999999999995 | F23: 7.69 | G23: 176.14 | H23: 41.87 | I23: 5.56 | J23: =RC[-5]-RC[-2] -> 24.619999999999997 | K23: 21.94 | L23: 24.31 | M23: 66.41 | R23: 1.5820000000000001 | S23: 5.7969999999999997 | T23: =(RC[-16]*RC[-15]-RC[-13]*RC[-12])/1000 -> 5.7953574000000021 | U23: 23.84 | V23: - | W23: =RC[-2]*RC[-10]/1000 -> 1.5832143999999999 | X23: =ABS((RC[-3]*RC[-11]-RC[-2]*RC[-9])/1000) -> #VALUE! | Y23: =(RC[-14]-RC[1])/RC[-18]*100 -> -1.0786874077438395 | Z23: 23.84 | AC23: =VALUE(RC[-27]) -> 2018-10-02T00:00:00.000 | AD23: =IF(RC[21]=42,"*",IF(RC[21]=32,"",RC[21])) -> - | AE23: =RC[-28] -> 24 | AF23: =RC[-28] -> 198.08 | AG23: =RC[-28] -> 66.489999999999995 | AH23: =RC[-28] -> 7.69 | AI23: =RC[-28] -> 176.14 | AJ23: =RC[-28] -> 41.87 | AK23: =RC[-28] -> 5.56 | AL23: =RC[-28] -> 24.619999999999997 | AM23: =RC[-28] -> 21.94 | AN23: =RC[-28] -> 24.31 | AO23: =RC[-28] -> 66.41 | AP23: - | AQ23: =RC[-29] -> 0 | AR23: =RC[-29] -> 0 | AS23: - | AT23: =RC[-30] -> 0 | AU23: =RC[-30] -> 0 | AV23: =RC[-30] -> 1.5820000000000001 | AW23: =RC[-30] -> 5.7969999999999997 | AY23: - | AZ23: - | BA23: -
A24: =IF(RC[1]="","",DATEVALUE(RC[1])) -> 43376 | B24: 03.10.18 | C24: 24 | D24: 194.8 | E24: 66.540000000000006 | F24: 7.67 | G24: 170.33 | H24: 41.26 | I24: 5.68 | J24: =RC[-5]-RC[-2] -> 25.280000000000008 | K24: 24.47 | L24: 26.86 | M24: 66.56 | R24: 1.754 | S24: 5.9359999999999999 | T24: =(RC[-16]*RC[-15]-RC[-13]*RC[-12])/1000 -> 5.9341762000000013 | U24: 26.35 | V24: - | W24: =RC[-2]*RC[-10]/1000 -> 1.7538560000000003 | X24: =ABS((RC[-3]*RC[-11]-RC[-2]*RC[-9])/1000) -> #VALUE! | Y24: =(RC[-14]-RC[1])/RC[-18]*100 -> -1.1037397992132931 | Z24: 26.35 | AC24: =VALUE(RC[-27]) -> 2018-10-03T00:00:00.000 | AD24: =IF(RC[21]=42,"*",IF(RC[21]=32,"",RC[21])) -> - | AE24: =RC[-28] -> 24 | AF24: =RC[-28] -> 194.8 | AG24: =RC[-28] -> 66.540000000000006 | AH24: =RC[-28] -> 7.67 | AI24: =RC[-28] -> 170.33 | AJ24: =RC[-28] -> 41.26 | AK24: =RC[-28] -> 5.68 | AL24: =RC[-28] -> 25.280000000000008 | AM24: =RC[-28] -> 24.47 | AN24: =RC[-28] -> 26.86 | AO24: =RC[-28] -> 66.56 | AP24: - | AQ24: =RC[-29] -> 0 | AR24: =RC[-29] -> 0 | AS24: - | AT24: =RC[-30] -> 0 | AU24: =RC[-30] -> 0 | AV24: =RC[-30] -> 1.754 | AW24: =RC[-30] -> 5.9359999999999999 | AY24: - | AZ24: - | BA24: -
A25: =IF(RC[1]="","",DATEVALUE(RC[1])) -> 43377 | B25: 04.10.18 | C25: 24 | D25: 184.81 | E25: 65.88 | F25: 7.52 | G25: 159.66 | H25: 39.89 | I25: 5.76 | J25: =RC[-5]-RC[-2] -> 25.989999999999995 | K25: 25.15 | L25: 27.42 | M25: 65.819999999999993 | R25: 1.772 | S25: 5.8049999999999997 | T25: =(RC[-16]*RC[-15]-RC[-13]*RC[-12])/1000 -> 5.8064453999999985 | U25: 26.91 | V25: - | W25: =RC[-2]*RC[-10]/1000 -> 1.7712161999999998 | X25: =ABS((RC[-3]*RC[-11]-RC[-2]*RC[-9])/1000) -> #VALUE! | Y25: =(RC[-14]-RC[1])/RC[-18]*100 -> -1.1023424777652522 | Z25: 26.91 | AC25: =VALUE(RC[-27]) -> 2018-10-04T00:00:00.000 | AD25: =IF(RC[21]=42,"*",IF(RC[21]=32,"",RC[21])) -> - | AE25: =RC[-28] -> 24 | AF25: =RC[-28] -> 184.81 | AG25: =RC[-28] -> 65.88 | AH25: =RC[-28] -> 7.52 | AI25: =RC[-28] -> 159.66 | AJ25: =RC[-28] -> 39.89 | AK25: =RC[-28] -> 5.76 | AL25: =RC[-28] -> 25.989999999999995 | AM25: =RC[-28] -> 25.15 | AN25: =RC[-28] -> 27.42 | AO25: =RC[-28] -> 65.819999999999993 | AP25: - | AQ25: =RC[-29] -> 0 | AR25: =RC[-29] -> 0 | AS25: - | AT25: =RC[-30] -> 0 | AU25: =RC[-30] -> 0 | AV25: =RC[-30] -> 1.772 | AW25: =RC[-30] -> 5.8049999999999997 | AY25: - | AZ25: - | BA25: -
A26: =IF(RC[1]="","",DATEVALUE(RC[1])) -> 43378 | B26: 05.10.18 | C26: 24 | D26: 164.48 | E26: 65.08 | F26: 7.25 | G26: 141.4 | H26: 37.69 | I26: 5.88 | J26: =RC[-5]-RC[-2] -> 27.39 | K26: 23.08 | L26: 25.26 | M26: 65.040000000000006 | R26: 1.6120000000000001 | S26: 5.3730000000000002 | T26: =(RC[-16]*RC[-15]-RC[-13]*RC[-12])/1000 -> 5.3749923999999991 | U26: 24.78 | V26: - | W26: =RC[-2]*RC[-10]/1000 -> 1.6116912000000001 | X26: =ABS((RC[-3]*RC[-11]-RC[-2]*RC[-9])/1000) -> #VALUE! | Y26: =(RC[-14]-RC[1])/RC[-18]*100 -> -1.2022630834512043 | Z26: 24.78 | AC26: =VALUE(RC[-27]) -> 2018-10-05T00:00:00.000 | AD26: =IF(RC[21]=42,"*",IF(RC[21]=32,"",RC[21])) -> - | AE26: =RC[-28] -> 24 | AF26: =RC[-28] -> 164.48 | AG26: =RC[-28] -> 65.08 | AH26: =RC[-28] -> 7.25 | AI26: =RC[-28] -> 141.4 | AJ26: =RC[-28] -> 37.69 | AK26: =RC[-28] -> 5.88 | AL26: =RC[-28] -> 27.39 | AM26: =RC[-28] -> 23.08 | AN26: =RC[-28] -> 25.26 | AO26: =RC[-28] -> 65.040000000000006 | AP26: - | AQ26: =RC[-29] -> 0 | AR26: =RC[-29] -> 0 | AS26: - | AT26: =RC[-30] -> 0 | AU26: =RC[-30] -> 0 | AV26: =RC[-30] -> 1.6120000000000001 | AW26: =RC[-30] -> 5.3730000000000002 | AY26: - | AZ26: - | BA26: -
A27: =IF(RC[1]="","",DATEVALUE(RC[1])) -> 43379 | B27: 06.10.18 | C27: 24 | D27: 167.44 | E27: 65.69 | F27: 7.2 | G27: 142.66999999999999 | H27: 38.35 | I27: 5.81 | J27: =RC[-5]-RC[-2] -> 27.339999999999996 | K27: 24.77 | L27: 27.03 | M27: 65.83 | R27: 1.746 | S27: 5.5289999999999999 | T27: =(RC[-16]*RC[-15]-RC[-13]*RC[-12])/1000 -> 5.5277390999999998 | U27: 26.5 | V27: - | W27: =RC[-2]*RC[-10]/1000 -> 1.7444949999999999 | X27: =ABS((RC[-3]*RC[-11]-RC[-2]*RC[-9])/1000) -> #VALUE! | Y27: =(RC[-14]-RC[1])/RC[-18]*100 -> -1.2125884909231097 | Z27: 26.5 | AC27: =VALUE(RC[-27]) -> 2018-10-06T00:00:00.000 | AD27: =IF(RC[21]=42,"*",IF(RC[21]=32,"",RC[21])) -> - | AE27: =RC[-28] -> 24 | AF27: =RC[-28] -> 167.44 | AG27: =RC[-28] -> 65.69 | AH27: =RC[-28] -> 7.2 | AI27: =RC[-28] -> 142.66999999999999 | AJ27: =RC[-28] -> 38.35 | AK27: =RC[-28] -> 5.81 | AL27: =RC[-28] -> 27.339999999999996 | AM27: =RC[-28] -> 24.77 | AN27: =RC[-28] -> 27.03 | AO27: =RC[-28] -> 65.83 | AP27: - | AQ27: =RC[-29] -> 0 | AR27: =RC[-29] -> 0 | AS27: - | AT27: =RC[-30] -> 0 | AU27: =RC[-30] -> 0 | AV27: =RC[-30] -> 1.746 | AW27: =RC[-30] -> 5.5289999999999999 | AY27: - | AZ27: - | BA27: -
A28: =IF(RC[1]="","",DATEVALUE(RC[1])) -> 43380 | B28: 07.10.18 | C28: 24 | D28: 169.38 | E28: 65.97 | F28: 7.19 | G28: 141.19999999999999 | H28: 38.44 | I28: 5.83 | J28: =RC[-5]-RC[-2] -> 27.53 | K28: 28.18 | L28: 30.75 | M28: 66.05 | R28: 1.9890000000000001 | S28: 5.7450000000000001 | T28: =(RC[-16]*RC[-15]-RC[-13]*RC[-12])/1000 -> 5.7462705999999999 | U28: 30.15 | V28: - | W28: =RC[-2]*RC[-10]/1000 -> 1.9914074999999998 | X28: =ABS((RC[-3]*RC[-11]-RC[-2]*RC[-9])/1000) -> #VALUE! | Y28: =(RC[-14]-RC[1])/RC[-18]*100 -> -1.3951841359773363 | Z28: 30.15 | AC28: =VALUE(RC[-27]) -> 2018-10-07T00:00:00.000 | AD28: =IF(RC[21]=42,"*",IF(RC[21]=32,"",RC[21])) -> - | AE28: =RC[-28] -> 24 | AF28: =RC[-28] -> 169.38 | AG28: =RC[-28] -> 65.97 | AH28: =RC[-28] -> 7.19 | AI28: =RC[-28] -> 141.19999999999999 | AJ28: =RC[-28] -> 38.44 | AK28: =RC[-28] -> 5.83 | AL28: =RC[-28] -> 27.53 | AM28: =RC[-28] -> 28.18 | AN28: =RC[-28] -> 30.75 | AO28: =RC[-28] -> 66.05 | AP28: - | AQ28: =RC[-29] -> 0 | AR28: =RC[-29] -> 0 | AS28: - | AT28: =RC[-30] -> 0 | AU28: =RC[-30] -> 0 | AV28: =RC[-30] -> 1.9890000000000001 | AW28: =RC[-30] -> 5.7450000000000001 | AY28: - | AZ28: - | BA28: -
A29: =IF(RC[1]="","",DATEVALUE(RC[1])) -> 43381 | B29: 08.10.18 | C29: 24 | D29: 164.59 | E29: 65.88 | F29: 7.16 | G29: 139.02000000000001 | H29: 37.65 | I29: 5.83 | J29: =RC[-5]-RC[-2] -> 28.229999999999997 | K29: 25.57 | L29: 28.25 | M29: 65.92 | R29: 1.825 | S29: 5.6070000000000002 | T29: =(RC[-16]*RC[-15]-RC[-13]*RC[-12])/1000 -> 5.6090861999999992 | U29: 27.68 | V29: - | W29: =RC[-2]*RC[-10]/1000 -> 1.8246656000000001 | X29: =ABS((RC[-3]*RC[-11]-RC[-2]*RC[-9])/1000) -> #VALUE! | Y29: =(RC[-14]-RC[1])/RC[-18]*100 -> -1.5177672277370158 | Z29: 27.68 | AC29: =VALUE(RC[-27]) -> 2018-10-08T00:00:00.000 | AD29: =IF(RC[21]=42,"*",IF(RC[21]=32,"",RC[21])) -> - | AE29: =RC[-28] -> 24 | AF29: =RC[-28] -> 164.59 | AG29: =RC[-28] -> 65.88 | AH29: =RC[-28] -> 7.16 | AI29: =RC[-28] -> 139.02000000000001 | AJ29: =RC[-28] -> 37.65 | AK29: =RC[-28] -> 5.83 | AL29: =RC[-28] -> 28.229999999999997 | AM29: =RC[-28] -> 25.57 | AN29: =RC[-28] -> 28.25 | AO29: =RC[-28] -> 65.92 | AP29: - | AQ29: =RC[-29] -> 0 | AR29: =RC[-29] -> 0 | AS29: - | AT29: =RC[-30] -> 0 | AU29: =RC[-30] -> 0 | AV29: =RC[-30] -> 1.825 | AW29: =RC[-30] -> 5.6070000000000002 | AY29: - | AZ29: - | BA29: -
A30: =IF(RC[1]="","",DATEVALUE(RC[1])) -> 43382 | B30: 09.10.18 | C30: 24 | D30: 170.52 | E30: 65.81 | F30: 7.31 | G30: 146.49 | H30: 38.56 | I30: 5.85 | J30: =RC[-5]-RC[-2] -> 27.25 | K30: 24.03 | L30: 26.72 | M30: 65.92 | R30: 1.7270000000000001 | S30: 5.5739999999999998 | T30: =(RC[-16]*RC[-15]-RC[-13]*RC[-12])/1000 -> 5.5732668000000007 | U30: 26.19 | V30: - | W30: =RC[-2]*RC[-10]/1000 -> 1.7264448000000001 | X30: =ABS((RC[-3]*RC[-11]-RC[-2]*RC[-9])/1000) -> #VALUE! | Y30: =(RC[-14]-RC[1])/RC[-18]*100 -> -1.4745033790702438 | Z30: 26.19 | AC30: =VALUE(RC[-27]) -> 2018-10-09T00:00:00.000 | AD30: =IF(RC[21]=42,"*",IF(RC[21]=32,"",RC[21])) -> - | AE30: =RC[-28] -> 24 | AF30: =RC[-28] -> 170.52 | AG30: =RC[-28] -> 65.81 | AH30: =RC[-28] -> 7.31 | AI30: =RC[-28] -> 146.49 | AJ30: =RC[-28] -> 38.56 | AK30: =RC[-28] -> 5.85 | AL30: =RC[-28] -> 27.25 | AM30: =RC[-28] -> 24.03 | AN30: =RC[-28] -> 26.72 | AO30: =RC[-28] -> 65.92 | AP30: - | AQ30: =RC[-29] -> 0 | AR30: =RC[-29] -> 0 | AS30: - | AT30: =RC[-30] -> 0 | AU30: =RC[-30] -> 0 | AV30: =RC[-30] -> 1.7270000000000001 | AW30: =RC[-30] -> 5.5739999999999998 | AY30: - | AZ30: - | BA30: -
A31: =IF(RC[1]="","",DATEVALUE(RC[1])) -> 43383 | B31: 10.10.18 | C31: 24 | D31: 172.01 | E31: 66.81 | F31: 7.24 | G31: 147.75 | H31: 39.49 | I31: 5.75 | J31: =RC[-5]-RC[-2] -> 27.32 | K31: 24.26 | L31: 26.74 | M31: 66.97 | R31: 1.758 | S31: 5.6580000000000004 | T31: =(RC[-16]*RC[-15]-RC[-13]*RC[-12])/1000 -> 5.6573406000000004 | U31: 26.23 | V31: - | W31: =RC[-2]*RC[-10]/1000 -> 1.7566231000000001 | X31: =ABS((RC[-3]*RC[-11]-RC[-2]*RC[-9])/1000) -> #VALUE! | Y31: =(RC[-14]-RC[1])/RC[-18]*100 -> -1.3333333333333326 | Z31: 26.23 | AC31: =VALUE(RC[-27]) -> 2018-10-10T00:00:00.000 | AD31: =IF(RC[21]=42,"*",IF(RC[21]=32,"",RC[21])) -> - | AE31: =RC[-28] -> 24 | AF31: =RC[-28] -> 172.01 | AG31: =RC[-28] -> 66.81 | AH31: =RC[-28] -> 7.24 | AI31: =RC[-28] -> 147.75 | AJ31: =RC[-28] -> 39.49 | AK31: =RC[-28] -> 5.75 | AL31: =RC[-28] -> 27.32 | AM31: =RC[-28] -> 24.26 | AN31: =RC[-28] -> 26.74 | AO31: =RC[-28] -> 66.97 | AP31: - | AQ31: =RC[-29] -> 0 | AR31: =RC[-29] -> 0 | AS31: - | AT31: =RC[-30] -> 0 | AU31: =RC[-30] -> 0 | AV31: =RC[-30] -> 1.758 | AW31: =RC[-30] -> 5.6580000000000004 | AY31: - | AZ31: - | BA31: -
A32: =IF(RC[1]="","",DATEVALUE(RC[1])) -> 43384 | B32: 11.10.18 | C32: 24 | D32: 176.66 | E32: 67.900000000000006 | F32: 7.25 | G32: 151.88 | H32: 40.26 | I32: 5.67 | J32: =RC[-5]-RC[-2] -> 27.640000000000008 | K32: 24.78 | L32: 27.38 | M32: 67.98 | R32: 1.821 | S32: 5.8810000000000002 | T32: =(RC[-16]*RC[-15]-RC[-13]*RC[-12])/1000 -> 5.8805252000000001 | U32: 26.81 | V32: - | W32: =RC[-2]*RC[-10]/1000 -> 1.8225437999999998 | X32: =ABS((RC[-3]*RC[-11]-RC[-2]*RC[-9])/1000) -> #VALUE! | Y32: =(RC[-14]-RC[1])/RC[-18]*100 -> -1.3365815117197772 | Z32: 26.81 | AC32: =VALUE(RC[-27]) -> 2018-10-11T00:00:00.000 | AD32: =IF(RC[21]=42,"*",IF(RC[21]=32,"",RC[21])) -> - | AE32: =RC[-28] -> 24 | AF32: =RC[-28] -> 176.66 | AG32: =RC[-28] -> 67.900000000000006 | AH32: =RC[-28] -> 7.25 | AI32: =RC[-28] -> 151.88 | AJ32: =RC[-28] -> 40.26 | AK32: =RC[-28] -> 5.67 | AL32: =RC[-28] -> 27.640000000000008 | AM32: =RC[-28] -> 24.78 | AN32: =RC[-28] -> 27.38 | AO32: =RC[-28] -> 67.98 | AP32: - | AQ32: =RC[-29] -> 0 | AR32: =RC[-29] -> 0 | AS32: - | AT32: =RC[-30] -> 0 | AU32: =RC[-30] -> 0 | AV32: =RC[-30] -> 1.821 | AW32: =RC[-30] -> 5.8810000000000002 | AY32: - | AZ32: - | BA32: -
A33: =IF(RC[1]="","",DATEVALUE(RC[1])) -> 43385 | B33: 12.10.18 | C33: 24 | D33: 172.98 | E33: 67.760000000000005 | F33: 7.25 | G33: 149.74 | H33: 40.1 | I33: 5.72 | J33: =RC[-5]-RC[-2] -> 27.660000000000004 | K33: 23.24 | L33: 25.66 | M33: 67.7 | R33: 1.7050000000000001 | S33: 5.72 | T33: =(RC[-16]*RC[-15]-RC[-13]*RC[-12])/1000 -> 5.7165507999999994 | U33: 25.15 | V33: - | W33: =RC[-2]*RC[-10]/1000 -> 1.702655 | X33: =ABS((RC[-3]*RC[-11]-RC[-2]*RC[-9])/1000) -> #VALUE! | Y33: =(RC[-14]-RC[1])/RC[-18]*100 -> -1.2755442767463603 | Z33: 25.15 | AC33: =VALUE(RC[-27]) -> 2018-10-12T00:00:00.000 | AD33: =IF(RC[21]=42,"*",IF(RC[21]=32,"",RC[21])) -> - | AE33: =RC[-28] -> 24 | AF33: =RC[-28] -> 172.98 | AG33: =RC[-28] -> 67.760000000000005 | AH33: =RC[-28] -> 7.25 | AI33: =RC[-28] -> 149.74 | AJ33: =RC[-28] -> 40.1 | AK33: =RC[-28] -> 5.72 | AL33: =RC[-28] -> 27.660000000000004 | AM33: =RC[-28] -> 23.24 | AN33: =RC[-28] -> 25.66 | AO33: =RC[-28] -> 67.7 | AP33: - | AQ33: =RC[-29] -> 0 | AR33: =RC[-29] -> 0 | AS33: - | AT33: =RC[-30] -> 0 | AU33: =RC[-30] -> 0 | AV33: =RC[-30] -> 1.7050000000000001 | AW33: =RC[-30] -> 5.72 | AY33: - | AZ33: - | BA33: -
A34: =IF(RC[1]="","",DATEVALUE(RC[1])) -> 43386 | B34: 13.10.18 | C34: 24 | D34: 181.02 | E34: 68.87 | F34: 7.42 | G34: 157.62 | H34: 41.55 | I34: 5.72 | J34: =RC[-5]-RC[-2] -> 27.320000000000007 | K34: 23.4 | L34: 25.71 | M34: 68.989999999999995 | R34: 1.7370000000000001 | S34: 5.92 | T34: =(RC[-16]*RC[-15]-RC[-13]*RC[-12])/1000 -> 5.9177364000000026 | U34: 25.19 | V34: - | W34: =RC[-2]*RC[-10]/1000 -> 1.7378581 | X34: =ABS((RC[-3]*RC[-11]-RC[-2]*RC[-9])/1000) -> #VALUE! | Y34: =(RC[-14]-RC[1])/RC[-18]*100 -> -1.1356426849384613 | Z34: 25.19 | AC34: =VALUE(RC[-27]) -> 2018-10-13T00:00:00.000 | AD34: =IF(RC[21]=42,"*",IF(RC[21]=32,"",RC[21])) -> - | AE34: =RC[-28] -> 24 | AF34: =RC[-28] -> 181.02 | AG34: =RC[-28] -> 68.87 | AH34: =RC[-28] -> 7.42 | AI34: =RC[-28] -> 157.62 | AJ34: =RC[-28] -> 41.55 | AK34: =RC[-28] -> 5.72 | AL34: =RC[-28] -> 27.320000000000007 | AM34: =RC[-28] -> 23.4 | AN34: =RC[-28] -> 25.71 | AO34: =RC[-28] -> 68.989999999999995 | AP34: - | AQ34: =RC[-29] -> 0 | AR34: =RC[-29] -> 0 | AS34: - | AT34: =RC[-30] -> 0 | AU34: =RC[-30] -> 0 | AV34: =RC[-30] -> 1.7370000000000001 | AW34: =RC[-30] -> 5.92 | AY34: - | AZ34: - | BA34: -
A35: =IF(RC[1]="","",DATEVALUE(RC[1])) -> 43387 | B35: 14.10.18 | C35: 24 | D35: 186.14 | E35: 69.66 | F35: 7.38 | G35: 159.85 | H35: 42.69 | I35: 5.63 | J35: =RC[-5]-RC[-2] -> 26.97 | K35: 26.29 | L35: 28.65 | M35: 69.84 | R35: 1.9570000000000001 | S35: 6.1440000000000001 | T35: =(RC[-16]*RC[-15]-RC[-13]*RC[-12])/1000 -> 6.1425158999999985 | U35: 28.01 | V35: - | W35: =RC[-2]*RC[-10]/1000 -> 1.9562184000000002 | X35: =ABS((RC[-3]*RC[-11]-RC[-2]*RC[-9])/1000) -> #VALUE! | Y35: =(RC[-14]-RC[1])/RC[-18]*100 -> -1.0760087582108242 | Z35: 28.01 | AC35: =VALUE(RC[-27]) -> 2018-10-14T00:00:00.000 | AD35: =IF(RC[21]=42,"*",IF(RC[21]=32,"",RC[21])) -> - | AE35: =RC[-28] -> 24 | AF35: =RC[-28] -> 186.14 | AG35: =RC[-28] -> 69.66 | AH35: =RC[-28] -> 7.38 | AI35: =RC[-28] -> 159.85 | AJ35: =RC[-28] -> 42.69 | AK35: =RC[-28] -> 5.63 | AL35: =RC[-28] -> 26.97 | AM35: =RC[-28] -> 26.29 | AN35: =RC[-28] -> 28.65 | AO35: =RC[-28] -> 69.84 | AP35: - | AQ35: =RC[-29] -> 0 | AR35: =RC[-29] -> 0 | AS35: - | AT35: =RC[-30] -> 0 | AU35: =RC[-30] -> 0 | AV35: =RC[-30] -> 1.9570000000000001 | AW35: =RC[-30] -> 6.1440000000000001 | AY35: - | AZ35: - | BA35: -
A36: =IF(RC[1]="","",DATEVALUE(RC[1])) -> 43388 | B36: 15.10.18 | C36: 24 | D36: 188.81 | E36: 69.25 | F36: 7.48 | G36: 165.21 | H36: 43.34 | I36: 5.61 | J36: =RC[-5]-RC[-2] -> 25.909999999999997 | K36: 23.6 | L36: 25.69 | M36: 69.290000000000006 | R36: 1.742 | S36: 5.9160000000000004 | T36: =(RC[-16]*RC[-15]-RC[-13]*RC[-12])/1000 -> 5.9148911000000002 | U36: 25.13 | V36: - | W36: =RC[-2]*RC[-10]/1000 -> 1.7412577 | X36: =ABS((RC[-3]*RC[-11]-RC[-2]*RC[-9])/1000) -> #VALUE! | Y36: =(RC[-14]-RC[1])/RC[-18]*100 -> -0.92609406210277678 | Z36: 25.13 | AC36: =VALUE(RC[-27]) -> 2018-10-15T00:00:00.000 | AD36: =IF(RC[21]=42,"*",IF(RC[21]=32,"",RC[21])) -> - | AE36: =RC[-28] -> 24 | AF36: =RC[-28] -> 188.81 | AG36: =RC[-28] -> 69.25 | AH36: =RC[-28] -> 7.48 | AI36: =RC[-28] -> 165.21 | AJ36: =RC[-28] -> 43.34 | AK36: =RC[-28] -> 5.61 | AL36: =RC[-28] -> 25.909999999999997 | AM36: =RC[-28] -> 23.6 | AN36: =RC[-28] -> 25.69 | AO36: =RC[-28] -> 69.290000000000006 | AP36: - | AQ36: =RC[-29] -> 0 | AR36: =RC[-29] -> 0 | AS36: - | AT36: =RC[-30] -> 0 | AU36: =RC[-30] -> 0 | AV36: =RC[-30] -> 1.742 | AW36: =RC[-30] -> 5.9160000000000004 | AY36: - | AZ36: - | BA36: -
A37: =IF(RC[1]="","",DATEVALUE(RC[1])) -> 43389 | B37: 16.10.18 | C37: 24 | D37: 188.54 | E37: 69.290000000000006 | F37: 7.45 | G37: 167.05 | H37: 43.45 | I37: 5.54 | J37: =RC[-5]-RC[-2] -> 25.840000000000003 | K37: 21.49 | L37: 23.71 | M37: 69.290000000000006 | R37: 1.61 | S37: 5.806 | T37: =(RC[-16]*RC[-15]-RC[-13]*RC[-12])/1000 -> 5.8056140999999997 | U37: 23.22 | V37: - | W37: =RC[-2]*RC[-10]/1000 -> 1.6089138000000001 | X37: =ABS((RC[-3]*RC[-11]-RC[-2]*RC[-9])/1000) -> #VALUE! | Y37: =(RC[-14]-RC[1])/RC[-18]*100 -> -1.0356180784196349 | Z37: 23.22 | AC37: =VALUE(RC[-27]) -> 2018-10-16T00:00:00.000 | AD37: =IF(RC[21]=42,"*",IF(RC[21]=32,"",RC[21])) -> - | AE37: =RC[-28] -> 24 | AF37: =RC[-28] -> 188.54 | AG37: =RC[-28] -> 69.290000000000006 | AH37: =RC[-28] -> 7.45 | AI37: =RC[-28] -> 167.05 | AJ37: =RC[-28] -> 43.45 | AK37: =RC[-28] -> 5.54 | AL37: =RC[-28] -> 25.840000000000003 | AM37: =RC[-28] -> 21.49 | AN37: =RC[-28] -> 23.71 | AO37: =RC[-28] -> 69.290000000000006 | AP37: - | AQ37: =RC[-29] -> 0 | AR37: =RC[-29] -> 0 | AS37: - | AT37: =RC[-30] -> 0 | AU37: =RC[-30] -> 0 | AV37: =RC[-30] -> 1.61 | AW37: =RC[-30] -> 5.806 | AY37: - | AZ37: - | BA37: -
A38: =IF(RC[1]="","",DATEVALUE(RC[1])) -> 43390 | B38: 17.10.18 | C38: 24 | D38: 193.07 | E38: 69.48 | F38: 7.53 | G38: 170.91 | H38: 43.96 | I38: 5.53 | J38: =RC[-5]-RC[-2] -> 25.520000000000003 | K38: 22.16 | L38: 24.43 | M38: 69.53 | R38: 1.6659999999999999 | S38: 5.9020000000000001 | T38: =(RC[-16]*RC[-15]-RC[-13]*RC[-12])/1000 -> 5.9013 | U38: 23.92 | V38: - | W38: =RC[-2]*RC[-10]/1000 -> 1.6631576000000001 | X38: =ABS((RC[-3]*RC[-11]-RC[-2]*RC[-9])/1000) -> #VALUE! | Y38: =(RC[-14]-RC[1])/RC[-18]*100 -> -1.0297817564800198 | Z38: 23.92 | AC38: =VALUE(RC[-27]) -> 2018-10-17T00:00:00.000 | AD38: =IF(RC[21]=42,"*",IF(RC[21]=32,"",RC[21])) -> - | AE38: =RC[-28] -> 24 | AF38: =RC[-28] -> 193.07 | AG38: =RC[-28] -> 69.48 | AH38: =RC[-28] -> 7.53 | AI38: =RC[-28] -> 170.91 | AJ38: =RC[-28] -> 43.96 | AK38: =RC[-28] -> 5.53 | AL38: =RC[-28] -> 25.520000000000003 | AM38: =RC[-28] -> 22.16 | AN38: =RC[-28] -> 24.43 | AO38: =RC[-28] -> 69.53 | AP38: - | AQ38: =RC[-29] -> 0 | AR38: =RC[-29] -> 0 | AS38: - | AT38: =RC[-30] -> 0 | AU38: =RC[-30] -> 0 | AV38: =RC[-30] -> 1.6659999999999999 | AW38: =RC[-30] -> 5.9020000000000001 | AY38: - | AZ38: - | BA38: -
A39: =IF(RC[1]="","",DATEVALUE(RC[1])) -> 43391 | B39: 18.10.18 | C39: 24 | D39: 193.04 | E39: 69.930000000000007 | F39: 7.57 | G39: 170.92 | H39: 44.14 | I39: 5.56 | J39: 25.790000000000006 | K39: 22.12 | L39: 24.28 | M39: 70.02 | R39: 1.661 | S39: 5.9589999999999996 | T39: 5.954878400000001 | U39: 23.73 | V39: - | W39: 1.6615746 | X39: #VALUE! | Y39: -0.94196115141586678 | Z39: 23.73 | AC39: =VALUE(RC[-27]) -> 2018-10-18T00:00:00.000 | AD39: =IF(RC[21]=42,"*",IF(RC[21]=32,"",RC[21])) ->  | AE39: =RC[-28] -> 24 | AF39: =RC[-28] -> 193.04 | AG39: =RC[-28] -> 69.930000000000007 | AH39: =RC[-28] -> 7.57 | AI39: =RC[-28] -> 170.92 | AJ39: =RC[-28] -> 44.14 | AK39: =RC[-28] -> 5.56 | AL39: =RC[-28] -> 25.790000000000006 | AM39: =RC[-28] -> 22.12 | AN39: =RC[-28] -> 24.28 | AO39: =RC[-28] -> 70.02 | AP39: - | AQ39: =RC[-29] -> 0 | AR39: =RC[-29] -> 0 | AS39: - | AT39: =RC[-30] -> 0 | AU39: =RC[-30] -> 0 | AV39: =RC[-30] -> 1.661 | AW39: =RC[-30] -> 5.9589999999999996
A40: =IF(RC[1]="","",DATEVALUE(RC[1])) -> 43392 | B40: 19.10.18 | C40: 24 | D40: 192.72 | E40: 69.75 | F40: 7.57 | G40: 170.84 | H40: 43.68 | I40: 5.57 | J40: 26.07 | K40: 21.88 | L40: 24.11 | M40: 69.73 | R40: 1.645 | S40: 5.9829999999999997 | T40: 5.9799287999999997 | U40: 23.59 | V40: - | W40: 1.6449307000000002 | X40: #VALUE! | Y40: -1.0009365488176076 | Z40: 23.59 | AC40: =VALUE(RC[-27]) -> 2018-10-19T00:00:00.000 | AD40: =IF(RC[21]=42,"*",IF(RC[21]=32,"",RC[21])) ->  | AE40: =RC[-28] -> 24 | AF40: =RC[-28] -> 192.72 | AG40: =RC[-28] -> 69.75 | AH40: =RC[-28] -> 7.57 | AI40: =RC[-28] -> 170.84 | AJ40: =RC[-28] -> 43.68 | AK40: =RC[-28] -> 5.57 | AL40: =RC[-28] -> 26.07 | AM40: =RC[-28] -> 21.88 | AN40: =RC[-28] -> 24.11 | AO40: =RC[-28] -> 69.73 | AP40: - | AQ40: =RC[-29] -> 0 | AR40: =RC[-29] -> 0 | AS40: - | AT40: =RC[-30] -> 0 | AU40: =RC[-30] -> 0 | AV40: =RC[-30] -> 1.645 | AW40: =RC[-30] -> 5.9829999999999997
A41: =IF(RC[1]="","",DATEVALUE(RC[1])) -> 43393 | B41: 20.10.18 | C41: 24 | D41: 184.87 | E41: 69.05 | F41: 7.42 | G41: 161.71 | H41: 42.19 | I41: 5.63 | J41: 26.86 | K41: 23.16 | L41: 25.68 | M41: 69.05 | R41: 1.7350000000000001 | S41: 5.9429999999999996 | T41: 5.9427285999999997 | U41: 25.11 | V41: - | W41: 1.7338454999999999 | X41: #VALUE! | Y41: -1.2058623461752516 | Z41: 25.11 | AC41: =VALUE(RC[-27]) -> 2018-10-20T00:00:00.000 | AD41: =IF(RC[21]=42,"*",IF(RC[21]=32,"",RC[21])) ->  | AE41: =RC[-28] -> 24 | AF41: =RC[-28] -> 184.87 | AG41: =RC[-28] -> 69.05 | AH41: =RC[-28] -> 7.42 | AI41: =RC[-28] -> 161.71 | AJ41: =RC[-28] -> 42.19 | AK41: =RC[-28] -> 5.63 | AL41: =RC[-28] -> 26.86 | AM41: =RC[-28] -> 23.16 | AN41: =RC[-28] -> 25.68 | AO41: =RC[-28] -> 69.05 | AP41: - | AQ41: =RC[-29] -> 0 | AR41: =RC[-29] -> 0 | AS41: - | AT41: =RC[-30] -> 0 | AU41: =RC[-30] -> 0 | AV41: =RC[-30] -> 1.7350000000000001 | AW41: =RC[-30] -> 5.9429999999999996
A42: =IF(RC[1]="","",DATEVALUE(RC[1])) -> 43394 | B42: 21.10.18 | C42: 24 | D42: 185.49 | E42: 68.239999999999995 | F42: 7.43 | G42: 160.82 | H42: 41.72 | I42: 5.65 | J42: 26.519999999999996 | K42: 24.67 | L42: 27.25 | M42: 68.25 | R42: 1.82 | S42: 5.9470000000000001 | T42: 5.9484271999999994 | U42: 26.69 | V42: - | W42: 1.8215925000000002 | X42: #VALUE! | Y42: -1.256062678771297 | Z42: 26.69 | AC42: =VALUE(RC[-27]) -> 2018-10-21T00:00:00.000 | AD42: =IF(RC[21]=42,"*",IF(RC[21]=32,"",RC[21])) ->  | AE42: =RC[-28] -> 24 | AF42: =RC[-28] -> 185.49 | AG42: =RC[-28] -> 68.239999999999995 | AH42: =RC[-28] -> 7.43 | AI42: =RC[-28] -> 160.82 | AJ42: =RC[-28] -> 41.72 | AK42: =RC[-28] -> 5.65 | AL42: =RC[-28] -> 26.519999999999996 | AM42: =RC[-28] -> 24.67 | AN42: =RC[-28] -> 27.25 | AO42: =RC[-28] -> 68.25 | AP42: - | AQ42: =RC[-29] -> 0 | AR42: =RC[-29] -> 0 | AS42: - | AT42: =RC[-30] -> 0 | AU42: =RC[-30] -> 0 | AV42: =RC[-30] -> 1.82 | AW42: =RC[-30] -> 5.9470000000000001
A43: =IF(RC[1]="","",DATEVALUE(RC[1])) -> 43395 | B43: 22.10.18 | C43: 24 | D43: 183.21 | E43: 68.59 | F43: 7.42 | G43: 159.13 | H43: 41.5 | I43: 5.68 | J43: 27.090000000000003 | K43: 24.08 | L43: 26.34 | M43: 68.73 | R43: 1.7689999999999999 | S43: 5.9640000000000004 | T43: 5.9624789000000007 | U43: 25.77 | V43: - | W43: 1.7711721 | X43: #VALUE! | Y43: -1.0620247596304917 | Z43: 25.77 | AC43: =VALUE(RC[-27]) -> 2018-10-22T00:00:00.000 | AD43: =IF(RC[21]=42,"*",IF(RC[21]=32,"",RC[21])) ->  | AE43: =RC[-28] -> 24 | AF43: =RC[-28] -> 183.21 | AG43: =RC[-28] -> 68.59 | AH43: =RC[-28] -> 7.42 | AI43: =RC[-28] -> 159.13 | AJ43: =RC[-28] -> 41.5 | AK43: =RC[-28] -> 5.68 | AL43: =RC[-28] -> 27.090000000000003 | AM43: =RC[-28] -> 24.08 | AN43: =RC[-28] -> 26.34 | AO43: =RC[-28] -> 68.73 | AP43: - | AQ43: =RC[-29] -> 0 | AR43: =RC[-29] -> 0 | AS43: - | AT43: =RC[-30] -> 0 | AU43: =RC[-30] -> 0 | AV43: =RC[-30] -> 1.7689999999999999 | AW43: =RC[-30] -> 5.9640000000000004
A44: =IF(RC[1]="","",DATEVALUE(RC[1])) ->  | C44: 24 | J44: =RC[-5]-RC[-2] -> #VALUE! | T44: =(RC[-16]*RC[-15]-RC[-13]*RC[-12])/1000 -> #VALUE! | W44: =RC[-2]*RC[-10]/1000 -> #VALUE! | X44: =ABS((RC[-3]*RC[-11]-RC[-2]*RC[-9])/1000) -> #VALUE! | Y44: =(RC[-14]-RC[1])/RC[-18]*100 -> #VALUE! | AC44: =VALUE(RC[-27]) -> #VALUE! | AD44: =IF(RC[21]=42,"*",IF(RC[21]=32,"",RC[21])) ->  | AE44: =RC[-28] -> 24 | AF44: =RC[-28] ->  | AG44: =RC[-28] ->  | AH44: =RC[-28] ->  | AI44: =RC[-28] ->  | AJ44: =RC[-28] ->  | AK44: =RC[-28] ->  | AL44: =RC[-28] -> #VALUE! | AM44: =RC[-28] ->  | AN44: =RC[-28] ->  | AO44: =RC[-28] ->  | AP44: - | AQ44: =RC[-29] -> 0 | AR44: =RC[-29] -> 0 | AS44: - | AT44: =RC[-30] -> 0 | AU44: =RC[-30] -> 0 | AV44: =RC[-30] ->  | AW44: =RC[-30] -> 
A45: =IF(RC[1]="","",DATEVALUE(RC[1])) ->  | C45: 24 | T45: =(RC[-16]*RC[-15]-RC[-13]*RC[-12])/1000 -> #VALUE! | W45: =RC[-2]*RC[-10]/1000 -> #VALUE! | X45: =ABS((RC[-3]*RC[-11]-RC[-2]*RC[-9])/1000) -> #VALUE! | Y45: =(RC[-14]-RC[1])/RC[-18]*100 -> #VALUE! | AC45: =VALUE(RC[-27]) -> #VALUE! | AD45: =IF(RC[21]=42,"*",IF(RC[21]=32,"",RC[21])) ->  | AE45: =RC[-28] -> 24 | AF45: =RC[-28] ->  | AG45: =RC[-28] ->  | AH45: =RC[-28] ->  | AI45: =RC[-28] ->  | AJ45: =RC[-28] ->  | AK45: =RC[-28] ->  | AL45: =RC[-28] -> 0 | AM45: =RC[-28] ->  | AN45: =RC[-28] ->  | AO45: =RC[-28] ->  | AP45: - | AQ45: =RC[-29] -> 0 | AR45: =RC[-29] -> 0 | AS45: - | AT45: =RC[-30] -> 0 | AU45: =RC[-30] -> 0 | AV45: =RC[-30] ->  | AW45: =RC[-30] -> 
A46: =IF(RC[1]="","",DATEVALUE(RC[1])) ->  | C46: 24 | T46: =(RC[-16]*RC[-15]-RC[-13]*RC[-12])/1000 -> #VALUE! | W46: =RC[-2]*RC[-10]/1000 -> #VALUE! | X46: =ABS((RC[-3]*RC[-11]-RC[-2]*RC[-9])/1000) -> #VALUE! | Y46: =(RC[-14]-RC[1])/RC[-18]*100 -> #VALUE! | AC46: =VALUE(RC[-27]) -> #VALUE! | AD46: =IF(RC[21]=42,"*",IF(RC[21]=32,"",RC[21])) ->  | AE46: =RC[-28] -> 24 | AF46: =RC[-28] ->  | AG46: =RC[-28] ->  | AH46: =RC[-28] ->  | AI46: =RC[-28] ->  | AJ46: =RC[-28] ->  | AK46: =RC[-28] ->  | AL46: =RC[-28] -> 0 | AM46: =RC[-28] ->  | AN46: =RC[-28] ->  | AO46: =RC[-28] ->  | AP46: - | AQ46: =RC[-29] -> 0 | AR46: =RC[-29] -> 0 | AS46: - | AT46: =RC[-30] -> 0 | AU46: =RC[-30] -> 0 | AV46: =RC[-30] ->  | AW46: =RC[-30] -> 
A47: =IF(RC[1]="","",DATEVALUE(RC[1])) ->  | C47: 24 | T47: =(RC[-16]*RC[-15]-RC[-13]*RC[-12])/1000 -> #VALUE! | W47: =RC[-2]*RC[-10]/1000 -> #VALUE! | X47: =ABS((RC[-3]*RC[-11]-RC[-2]*RC[-9])/1000) -> #VALUE! | Y47: =(RC[-14]-RC[1])/RC[-18]*100 -> #VALUE! | AC47: =VALUE(RC[-27]) -> #VALUE! | AD47: =IF(RC[21]=42,"*",IF(RC[21]=32,"",RC[21])) ->  | AE47: =RC[-28] -> 24 | AF47: =RC[-28] ->  | AG47: =RC[-28] ->  | AH47: =RC[-28] ->  | AI47: =RC[-28] ->  | AJ47: =RC[-28] ->  | AK47: =RC[-28] ->  | AL47: =RC[-28] -> 0 | AM47: =RC[-28] ->  | AN47: =RC[-28] ->  | AO47: =RC[-28] ->  | AP47: - | AQ47: =RC[-29] -> 0 | AR47: =RC[-29] -> 0 | AS47: - | AT47: =RC[-30] -> 0 | AU47: =RC[-30] -> 0 | AV47: =RC[-30] ->  | AW47: =RC[-30] -> 
A48: =IF(RC[1]="","",DATEVALUE(RC[1])) ->  | C48: 24 | T48: =(RC[-16]*RC[-15]-RC[-13]*RC[-12])/1000 -> #VALUE! | W48: =RC[-2]*RC[-10]/1000 -> #VALUE! | X48: =ABS((RC[-3]*RC[-11]-RC[-2]*RC[-9])/1000) -> #VALUE! | Y48: =(RC[-14]-RC[1])/RC[-18]*100 -> #VALUE! | AC48: =VALUE(RC[-27]) -> #VALUE! | AD48: =IF(RC[21]=42,"*",IF(RC[21]=32,"",RC[21])) ->  | AE48: =RC[-28] -> 24 | AF48: =RC[-28] ->  | AG48: =RC[-28] ->  | AH48: =RC[-28] ->  | AI48: =RC[-28] ->  | AJ48: =RC[-28] ->  | AK48: =RC[-28] ->  | AL48: =RC[-28] -> 0 | AM48: =RC[-28] ->  | AN48: =RC[-28] ->  | AO48: =RC[-28] ->  | AP48: - | AQ48: =RC[-29] -> 0 | AR48: =RC[-29] -> 0 | AS48: - | AT48: =RC[-30] -> 0 | AU48: =RC[-30] -> 0 | AV48: =RC[-30] ->  | AW48: =RC[-30] -> 
A49: =IF(RC[1]="","",DATEVALUE(RC[1])) ->  | C49: 24 | T49: =(RC[-16]*RC[-15]-RC[-13]*RC[-12])/1000 -> #VALUE! | W49: =RC[-2]*RC[-10]/1000 -> #VALUE! | X49: =ABS((RC[-3]*RC[-11]-RC[-2]*RC[-9])/1000) -> #VALUE! | Y49: =(RC[-14]-RC[1])/RC[-18]*100 -> #VALUE! | AC49: =VALUE(RC[-27]) -> #VALUE! | AD49: =IF(RC[21]=42,"*",IF(RC[21]=32,"",RC[21])) ->  | AE49: =RC[-28] -> 24 | AF49: =RC[-28] ->  | AG49: =RC[-28] ->  | AH49: =RC[-28] ->  | AI49: =RC[-28] ->  | AJ49: =RC[-28] ->  | AK49: =RC[-28] ->  | AL49: =RC[-28] -> 0 | AM49: =RC[-28] ->  | AN49: =RC[-28] ->  | AO49: =RC[-28] ->  | AP49: - | AQ49: =RC[-29] -> 0 | AR49: =RC[-29] -> 0 | AS49: - | AT49: =RC[-30] -> 0 | AU49: =RC[-30] -> 0 | AV49: =RC[-30] ->  | AW49: =RC[-30] -> 
A50: =IF(RC[1]="","",DATEVALUE(RC[1])) ->  | T50: =(RC[-16]*RC[-15]-RC[-13]*RC[-12])/1000 -> #VALUE! | W50: =RC[-2]*RC[-10]/1000 -> #VALUE! | X50: =ABS((RC[-3]*RC[-11]-RC[-2]*RC[-9])/1000) -> #VALUE! | Y50: =(RC[-14]-RC[1])/RC[-18]*100 -> #VALUE! | AC50: =VALUE(RC[-27]) -> #VALUE! | AD50: =IF(RC[21]=42,"*",IF(RC[21]=32,"",RC[21])) ->  | AE50: =RC[-28] ->  | AF50: =RC[-28] ->  | AG50: =RC[-28] ->  | AH50: =RC[-28] ->  | AI50: =RC[-28] ->  | AJ50: =RC[-28] ->  | AK50: =RC[-28] ->  | AL50: =RC[-28] -> 0 | AM50: =RC[-28] ->  | AN50: =RC[-28] ->  | AO50: =RC[-28] ->  | AP50: - | AQ50: =RC[-29] -> 0 | AR50: =RC[-29] -> 0 | AS50: - | AT50: =RC[-30] -> 0 | AU50: =RC[-30] -> 0 | AV50: =RC[-30] ->  | AW50: =RC[-30] -> 
A51: =IF(RC[1]="","",DATEVALUE(RC[1])) ->  | T51: =(RC[-16]*RC[-15]-RC[-13]*RC[-12])/1000 -> #VALUE! | W51: =RC[-2]*RC[-10]/1000 -> #VALUE! | X51: =ABS((RC[-3]*RC[-11]-RC[-2]*RC[-9])/1000) -> #VALUE! | Y51: =(RC[-14]-RC[1])/RC[-18]*100 -> #VALUE! | AC51: =VALUE(RC[-27]) -> #VALUE! | AD51: =IF(RC[21]=42,"*",IF(RC[21]=32,"",RC[21])) ->  | AE51: =RC[-28] ->  | AF51: =RC[-28] ->  | AG51: =RC[-28] ->  | AH51: =RC[-28] ->  | AI51: =RC[-28] ->  | AJ51: =RC[-28] ->  | AK51: =RC[-28] ->  | AL51: =RC[-28] -> 0 | AM51: =RC[-28] ->  | AN51: =RC[-28] ->  | AO51: =RC[-28] ->  | AP51: - | AQ51: =RC[-29] -> 0 | AR51: =RC[-29] -> 0 | AS51: - | AT51: =RC[-30] -> 0 | AU51: =RC[-30] -> 0 | AV51: =RC[-30] ->  | AW51: =RC[-30] -> 
A52: =IF(RC[1]="","",DATEVALUE(RC[1])) ->  | T52: =(RC[-16]*RC[-15]-RC[-13]*RC[-12])/1000 -> #VALUE! | W52: =RC[-2]*RC[-10]/1000 -> #VALUE! | X52: =ABS((RC[-3]*RC[-11]-RC[-2]*RC[-9])/1000) -> #VALUE! | Y52: =(RC[-14]-RC[1])/RC[-18]*100 -> #VALUE! | AC52: =VALUE(RC[-27]) -> #VALUE! | AD52: =IF(RC[21]=42,"*",IF(RC[21]=32,"",RC[21])) ->  | AE52: =RC[-28] ->  | AF52: =RC[-28] ->  | AG52: =RC[-28] ->  | AH52: =RC[-28] ->  | AI52: =RC[-28] ->  | AJ52: =RC[-28] ->  | AK52: =RC[-28] ->  | AL52: =RC[-28] -> 0 | AM52: =RC[-28] ->  | AN52: =RC[-28] ->  | AO52: =RC[-28] ->  | AP52: - | AQ52: =RC[-29] -> 0 | AR52: =RC[-29] -> 0 | AS52: - | AT52: =RC[-30] -> 0 | AU52: =RC[-30] -> 0 | AV52: =RC[-30] ->  | AW52: =RC[-30] -> 
A53: =IF(RC[1]="","",DATEVALUE(RC[1])) ->  | T53: =(RC[-16]*RC[-15]-RC[-13]*RC[-12])/1000 -> #VALUE! | W53: =RC[-2]*RC[-10]/1000 -> #VALUE! | X53: =ABS((RC[-3]*RC[-11]-RC[-2]*RC[-9])/1000) -> #VALUE! | Y53: =(RC[-14]-RC[1])/RC[-18]*100 -> #VALUE! | AC53: =VALUE(RC[-27]) -> #VALUE! | AD53: =IF(RC[21]=42,"*",IF(RC[21]=32,"",RC[21])) ->  | AE53: =RC[-28] ->  | AF53: =RC[-28] ->  | AG53: =RC[-28] ->  | AH53: =RC[-28] ->  | AI53: =RC[-28] ->  | AJ53: =RC[-28] ->  | AK53: =RC[-28] ->  | AL53: =RC[-28] -> 0 | AM53: =RC[-28] ->  | AN53: =RC[-28] ->  | AO53: =RC[-28] ->  | AP53: - | AQ53: =RC[-29] -> 0 | AR53: =RC[-29] -> 0 | AS53: - | AT53: =RC[-30] -> 0 | AU53: =RC[-30] -> 0 | AV53: =RC[-30] ->  | AW53: =RC[-30] -> 
A54: =IF(RC[1]="","",DATEVALUE(RC[1])) ->  | T54: =(RC[-16]*RC[-15]-RC[-13]*RC[-12])/1000 -> #VALUE! | W54: =RC[-2]*RC[-10]/1000 -> #VALUE! | X54: =ABS((RC[-3]*RC[-11]-RC[-2]*RC[-9])/1000) -> #VALUE! | Y54: =(RC[-14]-RC[1])/RC[-18]*100 -> #VALUE! | AC54: =VALUE(RC[-27]) -> #VALUE! | AD54: =IF(RC[21]=42,"*",IF(RC[21]=32,"",RC[21])) ->  | AE54: =RC[-28] ->  | AF54: =RC[-28] ->  | AG54: =RC[-28] ->  | AH54: =RC[-28] ->  | AI54: =RC[-28] ->  | AJ54: =RC[-28] ->  | AK54: =RC[-28] ->  | AL54: =RC[-28] -> 0 | AM54: =RC[-28] ->  | AN54: =RC[-28] ->  | AO54: =RC[-28] ->  | AP54: - | AQ54: =RC[-29] -> 0 | AR54: =RC[-29] -> 0 | AS54: - | AT54: =RC[-30] -> 0 | AU54: =RC[-30] -> 0 | AV54: =RC[-30] ->  | AW54: =RC[-30] -> 
A55: =IF(RC[1]="","",DATEVALUE(RC[1])) ->  | T55: =(RC[-16]*RC[-15]-RC[-13]*RC[-12])/1000 -> #VALUE! | W55: =RC[-2]*RC[-10]/1000 -> #VALUE! | X55: =ABS((RC[-3]*RC[-11]-RC[-2]*RC[-9])/1000) -> #VALUE! | Y55: =(RC[-14]-RC[1])/RC[-18]*100 -> #VALUE! | AC55: =VALUE(RC[-27]) -> #VALUE! | AD55: =IF(RC[21]=42,"*",IF(RC[21]=32,"",RC[21])) ->  | AE55: =RC[-28] ->  | AF55: =RC[-28] ->  | AG55: =RC[-28] ->  | AH55: =RC[-28] ->  | AI55: =RC[-28] ->  | AJ55: =RC[-28] ->  | AK55: =RC[-28] ->  | AL55: =RC[-28] -> 0 | AM55: =RC[-28] ->  | AN55: =RC[-28] ->  | AO55: =RC[-28] ->  | AP55: - | AQ55: =RC[-29] -> 0 | AR55: =RC[-29] -> 0 | AS55: - | AT55: =RC[-30] -> 0 | AU55: =RC[-30] -> 0 | AV55: =RC[-30] ->  | AW55: =RC[-30] -> 
A56: =IF(RC[1]="","",DATEVALUE(RC[1])) ->  | T56: =(RC[-16]*RC[-15]-RC[-13]*RC[-12])/1000 -> #VALUE! | W56: =RC[-2]*RC[-10]/1000 -> #VALUE! | X56: =ABS((RC[-3]*RC[-11]-RC[-2]*RC[-9])/1000) -> #VALUE! | Y56: =(RC[-14]-RC[1])/RC[-18]*100 -> #VALUE! | AC56: =VALUE(RC[-27]) -> #VALUE! | AD56: =IF(RC[21]=42,"*",IF(RC[21]=32,"",RC[21])) ->  | AE56: =RC[-28] ->  | AF56: =RC[-28] ->  | AG56: =RC[-28] ->  | AH56: =RC[-28] ->  | AI56: =RC[-28] ->  | AJ56: =RC[-28] ->  | AK56: =RC[-28] ->  | AL56: =RC[-28] -> 0 | AM56: =RC[-28] ->  | AN56: =RC[-28] ->  | AO56: =RC[-28] ->  | AP56: - | AQ56: =RC[-29] -> 0 | AR56: =RC[-29] -> 0 | AS56: - | AT56: =RC[-30] -> 0 | AU56: =RC[-30] -> 0 | AV56: =RC[-30] ->  | AW56: =RC[-30] -> 
A57: =IF(RC[1]="","",DATEVALUE(RC[1])) ->  | T57: =(RC[-16]*RC[-15]-RC[-13]*RC[-12])/1000 -> #VALUE! | W57: =RC[-2]*RC[-10]/1000 -> #VALUE! | X57: =ABS((RC[-3]*RC[-11]-RC[-2]*RC[-9])/1000) -> #VALUE! | Y57: =(RC[-14]-RC[1])/RC[-18]*100 -> #VALUE! | AC57: =VALUE(RC[-27]) -> #VALUE! | AD57: =IF(RC[21]=42,"*",IF(RC[21]=32,"",RC[21])) ->  | AE57: =RC[-28] ->  | AF57: =RC[-28] ->  | AG57: =RC[-28] ->  | AH57: =RC[-28] ->  | AI57: =RC[-28] ->  | AJ57: =RC[-28] ->  | AK57: =RC[-28] ->  | AL57: =RC[-28] -> 0 | AM57: =RC[-28] ->  | AN57: =RC[-28] ->  | AO57: =RC[-28] ->  | AP57: - | AQ57: =RC[-29] -> 0 | AR57: =RC[-29] -> 0 | AS57: - | AT57: =RC[-30] -> 0 | AU57: =RC[-30] -> 0 | AV57: =RC[-30] ->  | AW57: =RC[-30] -> 
A58: =IF(RC[1]="","",DATEVALUE(RC[1])) ->  | T58: =(RC[-16]*RC[-15]-RC[-13]*RC[-12])/1000 -> #VALUE! | W58: =RC[-2]*RC[-10]/1000 -> #VALUE! | X58: =ABS((RC[-3]*RC[-11]-RC[-2]*RC[-9])/1000) -> #VALUE! | Y58: =(RC[-14]-RC[1])/RC[-18]*100 -> #VALUE! | AC58: =VALUE(RC[-27]) -> #VALUE! | AD58: =IF(RC[21]=42,"*",IF(RC[21]=32,"",RC[21])) ->  | AE58: =RC[-28] ->  | AF58: =RC[-28] ->  | AG58: =RC[-28] ->  | AH58: =RC[-28] ->  | AI58: =RC[-28] ->  | AJ58: =RC[-28] ->  | AK58: =RC[-28] ->  | AL58: =RC[-28] -> 0 | AM58: =RC[-28] ->  | AN58: =RC[-28] ->  | AO58: =RC[-28] ->  | AP58: - | AQ58: =RC[-29] -> 0 | AR58: =RC[-29] -> 0 | AS58: - | AT58: =RC[-30] -> 0 | AU58: =RC[-30] -> 0 | AV58: =RC[-30] ->  | AW58: =RC[-30] -> 
A59: =IF(RC[1]="","",DATEVALUE(RC[1])) ->  | T59: =(RC[-16]*RC[-15]-RC[-13]*RC[-12])/1000 -> #VALUE! | W59: =RC[-2]*RC[-10]/1000 -> #VALUE! | X59: =ABS((RC[-3]*RC[-11]-RC[-2]*RC[-9])/1000) -> #VALUE! | Y59: =(RC[-14]-RC[1])/RC[-18]*100 -> #VALUE! | AC59: =VALUE(RC[-27]) -> #VALUE! | AD59: =IF(RC[21]=42,"*",IF(RC[21]=32,"",RC[21])) ->  | AE59: =RC[-28] ->  | AF59: =RC[-28] ->  | AG59: =RC[-28] ->  | AH59: =RC[-28] ->  | AI59: =RC[-28] ->  | AJ59: =RC[-28] ->  | AK59: =RC[-28] ->  | AL59: =RC[-28] -> 0 | AM59: =RC[-28] ->  | AN59: =RC[-28] ->  | AO59: =RC[-28] ->  | AP59: - | AQ59: =RC[-29] -> 0 | AR59: =RC[-29] -> 0 | AS59: - | AT59: =RC[-30] -> 0 | AU59: =RC[-30] -> 0 | AV59: =RC[-30] ->  | AW59: =RC[-30] -> 
A60: =IF(RC[1]="","",DATEVALUE(RC[1])) ->  | T60: =(RC[-16]*RC[-15]-RC[-13]*RC[-12])/1000 -> #VALUE! | W60: =RC[-2]*RC[-10]/1000 -> #VALUE! | X60: =ABS((RC[-3]*RC[-11]-RC[-2]*RC[-9])/1000) -> #VALUE! | Y60: =(RC[-14]-RC[1])/RC[-18]*100 -> #VALUE! | AC60: =VALUE(RC[-27]) -> #VALUE! | AD60: =IF(RC[21]=42,"*",IF(RC[21]=32,"",RC[21])) ->  | AE60: =RC[-28] ->  | AF60: =RC[-28] ->  | AG60: =RC[-28] ->  | AH60: =RC[-28] ->  | AI60: =RC[-28] ->  | AJ60: =RC[-28] ->  | AK60: =RC[-28] ->  | AL60: =RC[-28] -> 0 | AM60: =RC[-28] ->  | AN60: =RC[-28] ->  | AO60: =RC[-28] ->  | AP60: - | AQ60: =RC[-29] -> 0 | AR60: =RC[-29] -> 0 | AS60: - | AT60: =RC[-30] -> 0 | AU60: =RC[-30] -> 0 | AV60: =RC[-30] ->  | AW60: =RC[-30] -> 
A61: =IF(RC[1]="","",DATEVALUE(RC[1])) ->  | T61: =(RC[-16]*RC[-15]-RC[-13]*RC[-12])/1000 -> #VALUE! | W61: =RC[-2]*RC[-10]/1000 -> #VALUE! | X61: =ABS((RC[-3]*RC[-11]-RC[-2]*RC[-9])/1000) -> #VALUE! | Y61: =(RC[-14]-RC[1])/RC[-18]*100 -> #VALUE! | AC61: =VALUE(RC[-27]) -> #VALUE! | AD61: =IF(RC[21]=42,"*",IF(RC[21]=32,"",RC[21])) ->  | AE61: =RC[-28] ->  | AF61: =RC[-28] ->  | AG61: =RC[-28] ->  | AH61: =RC[-28] ->  | AI61: =RC[-28] ->  | AJ61: =RC[-28] ->  | AK61: =RC[-28] ->  | AL61: =RC[-28] -> 0 | AM61: =RC[-28] ->  | AN61: =RC[-28] ->  | AO61: =RC[-28] ->  | AP61: - | AQ61: =RC[-29] -> 0 | AR61: =RC[-29] -> 0 | AS61: - | AT61: =RC[-30] -> 0 | AU61: =RC[-30] -> 0 | AV61: =RC[-30] ->  | AW61: =RC[-30] -> 
A62: =IF(RC[1]="","",DATEVALUE(RC[1])) ->  | T62: =(RC[-16]*RC[-15]-RC[-13]*RC[-12])/1000 -> #VALUE! | W62: =RC[-2]*RC[-10]/1000 -> #VALUE! | X62: =ABS((RC[-3]*RC[-11]-RC[-2]*RC[-9])/1000) -> #VALUE! | Y62: =(RC[-14]-RC[1])/RC[-18]*100 -> #VALUE! | AC62: =VALUE(RC[-27]) -> #VALUE! | AD62: =IF(RC[21]=42,"*",IF(RC[21]=32,"",RC[21])) ->  | AE62: =RC[-28] ->  | AF62: =RC[-28] ->  | AG62: =RC[-28] ->  | AH62: =RC[-28] ->  | AI62: =RC[-28] ->  | AJ62: =RC[-28] ->  | AK62: =RC[-28] ->  | AL62: =RC[-28] -> 0 | AM62: =RC[-28] ->  | AN62: =RC[-28] ->  | AO62: =RC[-28] ->  | AP62: - | AQ62: =RC[-29] -> 0 | AR62: =RC[-29] -> 0 | AS62: - | AT62: =RC[-30] -> 0 | AU62: =RC[-30] -> 0 | AV62: =RC[-30] ->  | AW62: =RC[-30] -> 
A63: =IF(RC[1]="","",DATEVALUE(RC[1])) ->  | T63: =(RC[-16]*RC[-15]-RC[-13]*RC[-12])/1000 -> #VALUE! | W63: =RC[-2]*RC[-10]/1000 -> #VALUE! | X63: =ABS((RC[-3]*RC[-11]-RC[-2]*RC[-9])/1000) -> #VALUE! | Y63: =(RC[-14]-RC[1])/RC[-18]*100 -> #VALUE! | AC63: =VALUE(RC[-27]) -> #VALUE! | AD63: =IF(RC[21]=42,"*",IF(RC[21]=32,"",RC[21])) ->  | AE63: =RC[-28] ->  | AF63: =RC[-28] ->  | AG63: =RC[-28] ->  | AH63: =RC[-28] ->  | AI63: =RC[-28] ->  | AJ63: =RC[-28] ->  | AK63: =RC[-28] ->  | AL63: =RC[-28] -> 0 | AM63: =RC[-28] ->  | AN63: =RC[-28] ->  | AO63: =RC[-28] ->  | AP63: - | AQ63: =RC[-29] -> 0 | AR63: =RC[-29] -> 0 | AS63: - | AT63: =RC[-30] -> 0 | AU63: =RC[-30] -> 0 | AV63: =RC[-30] ->  | AW63: =RC[-30] -> 
A64: =IF(RC[1]="","",DATEVALUE(RC[1])) ->  | T64: =(RC[-16]*RC[-15]-RC[-13]*RC[-12])/1000 -> #VALUE! | W64: =RC[-2]*RC[-10]/1000 -> #VALUE! | X64: =ABS((RC[-3]*RC[-11]-RC[-2]*RC[-9])/1000) -> #VALUE! | Y64: =(RC[-14]-RC[1])/RC[-18]*100 -> #VALUE! | AC64: =VALUE(RC[-27]) -> #VALUE! | AD64: =IF(RC[21]=42,"*",IF(RC[21]=32,"",RC[21])) ->  | AE64: =RC[-28] ->  | AF64: =RC[-28] ->  | AG64: =RC[-28] ->  | AH64: =RC[-28] ->  | AI64: =RC[-28] ->  | AJ64: =RC[-28] ->  | AK64: =RC[-28] ->  | AL64: =RC[-28] -> 0 | AM64: =RC[-28] ->  | AN64: =RC[-28] ->  | AO64: =RC[-28] ->  | AP64: - | AQ64: =RC[-29] -> 0 | AR64: =RC[-29] -> 0 | AS64: - | AT64: =RC[-30] -> 0 | AU64: =RC[-30] -> 0 | AV64: =RC[-30] ->  | AW64: =RC[-30] -> 
A65: =IF(RC[1]="","",DATEVALUE(RC[1])) ->  | T65: =(RC[-16]*RC[-15]-RC[-13]*RC[-12])/1000 -> #VALUE! | W65: =RC[-2]*RC[-10]/1000 -> #VALUE! | X65: =ABS((RC[-3]*RC[-11]-RC[-2]*RC[-9])/1000) -> #VALUE! | Y65: =(RC[-14]-RC[1])/RC[-18]*100 -> #VALUE! | AC65: =VALUE(RC[-27]) -> #VALUE! | AD65: =IF(RC[21]=42,"*",IF(RC[21]=32,"",RC[21])) ->  | AE65: =RC[-28] ->  | AF65: =RC[-28] ->  | AG65: =RC[-28] ->  | AH65: =RC[-28] ->  | AI65: =RC[-28] ->  | AJ65: =RC[-28] ->  | AK65: =RC[-28] ->  | AL65: =RC[-28] -> 0 | AM65: =RC[-28] ->  | AN65: =RC[-28] ->  | AO65: =RC[-28] ->  | AP65: - | AQ65: =RC[-29] -> 0 | AR65: =RC[-29] -> 0 | AS65: - | AT65: =RC[-30] -> 0 | AU65: =RC[-30] -> 0 | AV65: =RC[-30] ->  | AW65: =RC[-30] -> 
A66: =IF(RC[1]="","",DATEVALUE(RC[1])) ->  | T66: =(RC[-16]*RC[-15]-RC[-13]*RC[-12])/1000 -> #VALUE! | W66: =RC[-2]*RC[-10]/1000 -> #VALUE! | X66: =ABS((RC[-3]*RC[-11]-RC[-2]*RC[-9])/1000) -> #VALUE! | Y66: =(RC[-14]-RC[1])/RC[-18]*100 -> #VALUE! | AC66: =VALUE(RC[-27]) -> #VALUE! | AD66: =IF(RC[21]=42,"*",IF(RC[21]=32,"",RC[21])) ->  | AE66: =RC[-28] ->  | AF66: =RC[-28] ->  | AG66: =RC[-28] ->  | AH66: =RC[-28] ->  | AI66: =RC[-28] ->  | AJ66: =RC[-28] ->  | AK66: =RC[-28] ->  | AL66: =RC[-28] -> 0 | AM66: =RC[-28] ->  | AN66: =RC[-28] ->  | AO66: =RC[-28] ->  | AP66: - | AQ66: =RC[-29] -> 0 | AR66: =RC[-29] -> 0 | AS66: - | AT66: =RC[-30] -> 0 | AU66: =RC[-30] -> 0 | AV66: =RC[-30] ->  | AW66: =RC[-30] -> 
A67: =IF(RC[1]="","",DATEVALUE(RC[1])) ->  | T67: =(RC[-16]*RC[-15]-RC[-13]*RC[-12])/1000 -> #VALUE! | W67: =RC[-2]*RC[-10]/1000 -> #VALUE! | X67: =ABS((RC[-3]*RC[-11]-RC[-2]*RC[-9])/1000) -> #VALUE! | Y67: =(RC[-14]-RC[1])/RC[-18]*100 -> #VALUE! | AC67: =VALUE(RC[-27]) -> #VALUE! | AD67: =IF(RC[21]=42,"*",IF(RC[21]=32,"",RC[21])) ->  | AE67: =RC[-28] ->  | AF67: =RC[-28] ->  | AG67: =RC[-28] ->  | AH67: =RC[-28] ->  | AI67: =RC[-28] ->  | AJ67: =RC[-28] ->  | AK67: =RC[-28] ->  | AL67: =RC[-28] -> 0 | AM67: =RC[-28] ->  | AN67: =RC[-28] ->  | AO67: =RC[-28] ->  | AP67: - | AQ67: =RC[-29] -> 0 | AR67: =RC[-29] -> 0 | AS67: - | AT67: =RC[-30] -> 0 | AU67: =RC[-30] -> 0 | AV67: =RC[-30] ->  | AW67: =RC[-30] -> 
A68: =IF(RC[1]="","",DATEVALUE(RC[1])) ->  | T68: =(RC[-16]*RC[-15]-RC[-13]*RC[-12])/1000 -> #VALUE! | W68: =RC[-2]*RC[-10]/1000 -> #VALUE! | X68: =ABS((RC[-3]*RC[-11]-RC[-2]*RC[-9])/1000) -> #VALUE! | Y68: =(RC[-14]-RC[1])/RC[-18]*100 -> #VALUE! | AC68: =VALUE(RC[-27]) -> #VALUE! | AD68: =IF(RC[21]=42,"*",IF(RC[21]=32,"",RC[21])) ->  | AE68: =RC[-28] ->  | AF68: =RC[-28] ->  | AG68: =RC[-28] ->  | AH68: =RC[-28] ->  | AI68: =RC[-28] ->  | AJ68: =RC[-28] ->  | AK68: =RC[-28] ->  | AL68: =RC[-28] -> 0 | AM68: =RC[-28] ->  | AN68: =RC[-28] ->  | AO68: =RC[-28] ->  | AP68: - | AQ68: =RC[-29] -> 0 | AR68: =RC[-29] -> 0 | AS68: - | AT68: =RC[-30] -> 0 | AU68: =RC[-30] -> 0 | AV68: =RC[-30] ->  | AW68: =RC[-30] -> 
A69: =IF(RC[1]="","",DATEVALUE(RC[1])) ->  | T69: =(RC[-16]*RC[-15]-RC[-13]*RC[-12])/1000 -> #VALUE! | W69: =RC[-2]*RC[-10]/1000 -> #VALUE! | X69: =ABS((RC[-3]*RC[-11]-RC[-2]*RC[-9])/1000) -> #VALUE! | Y69: =(RC[-14]-RC[1])/RC[-18]*100 -> #VALUE! | AC69: =VALUE(RC[-27]) -> #VALUE! | AD69: =IF(RC[21]=42,"*",IF(RC[21]=32,"",RC[21])) ->  | AE69: =RC[-28] ->  | AF69: =RC[-28] ->  | AG69: =RC[-28] ->  | AH69: =RC[-28] ->  | AI69: =RC[-28] ->  | AJ69: =RC[-28] ->  | AK69: =RC[-28] ->  | AL69: =RC[-28] -> 0 | AM69: =RC[-28] ->  | AN69: =RC[-28] ->  | AO69: =RC[-28] ->  | AP69: - | AQ69: =RC[-29] -> 0 | AR69: =RC[-29] -> 0 | AS69: - | AT69: =RC[-30] -> 0 | AU69: =RC[-30] -> 0 | AV69: =RC[-30] ->  | AW69: =RC[-30] -> 
A70: =IF(RC[1]="","",DATEVALUE(RC[1])) ->  | T70: =(RC[-16]*RC[-15]-RC[-13]*RC[-12])/1000 -> #VALUE! | W70: =RC[-2]*RC[-10]/1000 -> #VALUE! | X70: =ABS((RC[-3]*RC[-11]-RC[-2]*RC[-9])/1000) -> #VALUE! | Y70: =(RC[-14]-RC[1])/RC[-18]*100 -> #VALUE! | AC70: =VALUE(RC[-27]) -> #VALUE! | AD70: =IF(RC[21]=42,"*",IF(RC[21]=32,"",RC[21])) ->  | AE70: =RC[-28] ->  | AF70: =RC[-28] ->  | AG70: =RC[-28] ->  | AH70: =RC[-28] ->  | AI70: =RC[-28] ->  | AJ70: =RC[-28] ->  | AK70: =RC[-28] ->  | AL70: =RC[-28] -> 0 | AM70: =RC[-28] ->  | AN70: =RC[-28] ->  | AO70: =RC[-28] ->  | AP70: - | AQ70: =RC[-29] -> 0 | AR70: =RC[-29] -> 0 | AS70: - | AT70: =RC[-30] -> 0 | AU70: =RC[-30] -> 0 | AV70: =RC[-30] ->  | AW70: =RC[-30] -> 
A71: =IF(RC[1]="","",DATEVALUE(RC[1])) ->  | T71: =(RC[-16]*RC[-15]-RC[-13]*RC[-12])/1000 -> #VALUE! | W71: =RC[-2]*RC[-10]/1000 -> #VALUE! | X71: =ABS((RC[-3]*RC[-11]-RC[-2]*RC[-9])/1000) -> #VALUE! | Y71: =(RC[-14]-RC[1])/RC[-18]*100 -> #VALUE! | AC71: =VALUE(RC[-27]) -> #VALUE! | AD71: =IF(RC[21]=42,"*",IF(RC[21]=32,"",RC[21])) ->  | AE71: =RC[-28] ->  | AF71: =RC[-28] ->  | AG71: =RC[-28] ->  | AH71: =RC[-28] ->  | AI71: =RC[-28] ->  | AJ71: =RC[-28] ->  | AK71: =RC[-28] ->  | AL71: =RC[-28] -> 0 | AM71: =RC[-28] ->  | AN71: =RC[-28] ->  | AO71: =RC[-28] ->  | AP71: - | AQ71: =RC[-29] -> 0 | AR71: =RC[-29] -> 0 | AS71: - | AT71: =RC[-30] -> 0 | AU71: =RC[-30] -> 0 | AV71: =RC[-30] ->  | AW71: =RC[-30] -> 
A72: =IF(RC[1]="","",DATEVALUE(RC[1])) ->  | T72: =(RC[-16]*RC[-15]-RC[-13]*RC[-12])/1000 -> #VALUE! | W72: =RC[-2]*RC[-10]/1000 -> #VALUE! | X72: =ABS((RC[-3]*RC[-11]-RC[-2]*RC[-9])/1000) -> #VALUE! | Y72: =(RC[-14]-RC[1])/RC[-18]*100 -> #VALUE! | AC72: =VALUE(RC[-27]) -> #VALUE! | AD72: =IF(RC[21]=42,"*",IF(RC[21]=32,"",RC[21])) ->  | AE72: =RC[-28] ->  | AF72: =RC[-28] ->  | AG72: =RC[-28] ->  | AH72: =RC[-28] ->  | AI72: =RC[-28] ->  | AJ72: =RC[-28] ->  | AK72: =RC[-28] ->  | AL72: =RC[-28] -> 0 | AM72: =RC[-28] ->  | AN72: =RC[-28] ->  | AO72: =RC[-28] ->  | AP72: - | AQ72: =RC[-29] -> 0 | AR72: =RC[-29] -> 0 | AS72: - | AT72: =RC[-30] -> 0 | AU72: =RC[-30] -> 0 | AV72: =RC[-30] ->  | AW72: =RC[-30] -> 
A73: =IF(RC[1]="","",DATEVALUE(RC[1])) ->  | T73: =(RC[-16]*RC[-15]-RC[-13]*RC[-12])/1000 -> #VALUE! | W73: =RC[-2]*RC[-10]/1000 -> #VALUE! | X73: =ABS((RC[-3]*RC[-11]-RC[-2]*RC[-9])/1000) -> #VALUE! | Y73: =(RC[-14]-RC[1])/RC[-18]*100 -> #VALUE! | AC73: =VALUE(RC[-27]) -> #VALUE! | AD73: =IF(RC[21]=42,"*",IF(RC[21]=32,"",RC[21])) ->  | AE73: =RC[-28] ->  | AF73: =RC[-28] ->  | AG73: =RC[-28] ->  | AH73: =RC[-28] ->  | AI73: =RC[-28] ->  | AJ73: =RC[-28] ->  | AK73: =RC[-28] ->  | AL73: =RC[-28] -> 0 | AM73: =RC[-28] ->  | AN73: =RC[-28] ->  | AO73: =RC[-28] ->  | AP73: - | AQ73: =RC[-29] -> 0 | AR73: =RC[-29] -> 0 | AS73: - | AT73: =RC[-30] -> 0 | AU73: =RC[-30] -> 0 | AV73: =RC[-30] ->  | AW73: =RC[-30] -> 
A74: =IF(RC[1]="","",DATEVALUE(RC[1])) ->  | T74: =(RC[-16]*RC[-15]-RC[-13]*RC[-12])/1000 -> #VALUE! | W74: =RC[-2]*RC[-10]/1000 -> #VALUE! | X74: =ABS((RC[-3]*RC[-11]-RC[-2]*RC[-9])/1000) -> #VALUE! | Y74: =(RC[-14]-RC[1])/RC[-18]*100 -> #VALUE! | AC74: =VALUE(RC[-27]) -> #VALUE! | AD74: =IF(RC[21]=42,"*",IF(RC[21]=32,"",RC[21])) ->  | AE74: =RC[-28] ->  | AF74: =RC[-28] ->  | AG74: =RC[-28] ->  | AH74: =RC[-28] ->  | AI74: =RC[-28] ->  | AJ74: =RC[-28] ->  | AK74: =RC[-28] ->  | AL74: =RC[-28] -> 0 | AM74: =RC[-28] ->  | AN74: =RC[-28] ->  | AO74: =RC[-28] ->  | AP74: - | AQ74: =RC[-29] -> 0 | AR74: =RC[-29] -> 0 | AS74: - | AT74: =RC[-30] -> 0 | AU74: =RC[-30] -> 0 | AV74: =RC[-30] ->  | AW74: =RC[-30] -> 
A75: =IF(RC[1]="","",DATEVALUE(RC[1])) ->  | T75: =(RC[-16]*RC[-15]-RC[-13]*RC[-12])/1000 -> #VALUE! | W75: =RC[-2]*RC[-10]/1000 -> #VALUE! | X75: =ABS((RC[-3]*RC[-11]-RC[-2]*RC[-9])/1000) -> #VALUE! | Y75: =(RC[-14]-RC[1])/RC[-18]*100 -> #VALUE! | AC75: =VALUE(RC[-27]) -> #VALUE! | AD75: =IF(RC[21]=42,"*",IF(RC[21]=32,"",RC[21])) ->  | AE75: =RC[-28] ->  | AF75: =RC[-28] ->  | AG75: =RC[-28] ->  | AH75: =RC[-28] ->  | AI75: =RC[-28] ->  | AJ75: =RC[-28] ->  | AK75: =RC[-28] ->  | AL75: =RC[-28] -> 0 | AM75: =RC[-28] ->  | AN75: =RC[-28] ->  | AO75: =RC[-28] ->  | AP75: - | AQ75: =RC[-29] -> 0 | AR75: =RC[-29] -> 0 | AS75: - | AT75: =RC[-30] -> 0 | AU75: =RC[-30] -> 0 | AV75: =RC[-30] ->  | AW75: =RC[-30] -> 
A76: =IF(RC[1]="","",DATEVALUE(RC[1])) ->  | T76: =(RC[-16]*RC[-15]-RC[-13]*RC[-12])/1000 -> #VALUE! | W76: =RC[-2]*RC[-10]/1000 -> #VALUE! | X76: =ABS((RC[-3]*RC[-11]-RC[-2]*RC[-9])/1000) -> #VALUE! | Y76: =(RC[-14]-RC[1])/RC[-18]*100 -> #VALUE! | AC76: =VALUE(RC[-27]) -> #VALUE! | AD76: =IF(RC[21]=42,"*",IF(RC[21]=32,"",RC[21])) ->  | AE76: =RC[-28] ->  | AF76: =RC[-28] ->  | AG76: =RC[-28] ->  | AH76: =RC[-28] ->  | AI76: =RC[-28] ->  | AJ76: =RC[-28] ->  | AK76: =RC[-28] ->  | AL76: =RC[-28] -> 0 | AM76: =RC[-28] ->  | AN76: =RC[-28] ->  | AO76: =RC[-28] ->  | AP76: - | AQ76: =RC[-29] -> 0 | AR76: =RC[-29] -> 0 | AS76: - | AT76: =RC[-30] -> 0 | AU76: =RC[-30] -> 0 | AV76: =RC[-30] ->  | AW76: =RC[-30] -> 
A77: =IF(RC[1]="","",DATEVALUE(RC[1])) ->  | T77: =(RC[-16]*RC[-15]-RC[-13]*RC[-12])/1000 -> #VALUE! | W77: =RC[-2]*RC[-10]/1000 -> #VALUE! | X77: =ABS((RC[-3]*RC[-11]-RC[-2]*RC[-9])/1000) -> #VALUE! | Y77: =(RC[-14]-RC[1])/RC[-18]*100 -> #VALUE! | AC77: =VALUE(RC[-27]) -> #VALUE! | AD77: =IF(RC[21]=42,"*",IF(RC[21]=32,"",RC[21])) ->  | AE77: =RC[-28] ->  | AF77: =RC[-28] ->  | AG77: =RC[-28] ->  | AH77: =RC[-28] ->  | AI77: =RC[-28] ->  | AJ77: =RC[-28] ->  | AK77: =RC[-28] ->  | AL77: =RC[-28] -> 0 | AM77: =RC[-28] ->  | AN77: =RC[-28] ->  | AO77: =RC[-28] ->  | AP77: - | AQ77: =RC[-29] -> 0 | AR77: =RC[-29] -> 0 | AS77: - | AT77: =RC[-30] -> 0 | AU77: =RC[-30] -> 0 | AV77: =RC[-30] ->  | AW77: =RC[-30] -> 
A78: =IF(RC[1]="","",DATEVALUE(RC[1])) ->  | T78: =(RC[-16]*RC[-15]-RC[-13]*RC[-12])/1000 -> #VALUE! | W78: =RC[-2]*RC[-10]/1000 -> #VALUE! | X78: =ABS((RC[-3]*RC[-11]-RC[-2]*RC[-9])/1000) -> #VALUE! | Y78: =(RC[-14]-RC[1])/RC[-18]*100 -> #VALUE! | AC78: =VALUE(RC[-27]) -> #VALUE! | AD78: =IF(RC[21]=42,"*",IF(RC[21]=32,"",RC[21])) ->  | AE78: =RC[-28] ->  | AF78: =RC[-28] ->  | AG78: =RC[-28] ->  | AH78: =RC[-28] ->  | AI78: =RC[-28] ->  | AJ78: =RC[-28] ->  | AK78: =RC[-28] ->  | AL78: =RC[-28] -> 0 | AM78: =RC[-28] ->  | AN78: =RC[-28] ->  | AO78: =RC[-28] ->  | AP78: - | AQ78: =RC[-29] -> 0 | AR78: =RC[-29] -> 0 | AS78: - | AT78: =RC[-30] -> 0 | AU78: =RC[-30] -> 0 | AV78: =RC[-30] ->  | AW78: =RC[-30] -> 
A79: =IF(RC[1]="","",DATEVALUE(RC[1])) ->  | T79: =(RC[-16]*RC[-15]-RC[-13]*RC[-12])/1000 -> #VALUE! | W79: =RC[-2]*RC[-10]/1000 -> #VALUE! | X79: =ABS((RC[-3]*RC[-11]-RC[-2]*RC[-9])/1000) -> #VALUE! | Y79: =(RC[-14]-RC[1])/RC[-18]*100 -> #VALUE! | AC79: =VALUE(RC[-27]) -> #VALUE! | AD79: =IF(RC[21]=42,"*",IF(RC[21]=32,"",RC[21])) ->  | AE79: =RC[-28] ->  | AF79: =RC[-28] ->  | AG79: =RC[-28] ->  | AH79: =RC[-28] ->  | AI79: =RC[-28] ->  | AJ79: =RC[-28] ->  | AK79: =RC[-28] ->  | AL79: =RC[-28] -> 0 | AM79: =RC[-28] ->  | AN79: =RC[-28] ->  | AO79: =RC[-28] ->  | AP79: - | AQ79: =RC[-29] -> 0 | AR79: =RC[-29] -> 0 | AS79: - | AT79: =RC[-30] -> 0 | AU79: =RC[-30] -> 0 | AV79: =RC[-30] ->  | AW79: =RC[-30] -> 
A80: =IF(RC[1]="","",DATEVALUE(RC[1])) ->  | T80: =(RC[-16]*RC[-15]-RC[-13]*RC[-12])/1000 -> #VALUE! | W80: =RC[-2]*RC[-10]/1000 -> #VALUE! | X80: =ABS((RC[-3]*RC[-11]-RC[-2]*RC[-9])/1000) -> #VALUE! | Y80: =(RC[-14]-RC[1])/RC[-18]*100 -> #VALUE! | AC80: =VALUE(RC[-27]) -> #VALUE! | AD80: =IF(RC[21]=42,"*",IF(RC[21]=32,"",RC[21])) ->  | AE80: =RC[-28] ->  | AF80: =RC[-28] ->  | AG80: =RC[-28] ->  | AH80: =RC[-28] ->  | AI80: =RC[-28] ->  | AJ80: =RC[-28] ->  | AK80: =RC[-28] ->  | AL80: =RC[-28] -> 0 | AM80: =RC[-28] ->  | AN80: =RC[-28] ->  | AO80: =RC[-28] ->  | AP80: - | AQ80: =RC[-29] -> 0 | AR80: =RC[-29] -> 0 | AS80: - | AT80: =RC[-30] -> 0 | AU80: =RC[-30] -> 0 | AV80: =RC[-30] ->  | AW80: =RC[-30] -> 
A81: =IF(RC[1]="","",DATEVALUE(RC[1])) ->  | T81: =(RC[-16]*RC[-15]-RC[-13]*RC[-12])/1000 -> #VALUE! | W81: =RC[-2]*RC[-10]/1000 -> #VALUE! | X81: =ABS((RC[-3]*RC[-11]-RC[-2]*RC[-9])/1000) -> #VALUE! | Y81: =(RC[-14]-RC[1])/RC[-18]*100 -> #VALUE! | AC81: =VALUE(RC[-27]) -> #VALUE! | AD81: =IF(RC[21]=42,"*",IF(RC[21]=32,"",RC[21])) ->  | AE81: =RC[-28] ->  | AF81: =RC[-28] ->  | AG81: =RC[-28] ->  | AH81: =RC[-28] ->  | AI81: =RC[-28] ->  | AJ81: =RC[-28] ->  | AK81: =RC[-28] ->  | AL81: =RC[-28] -> 0 | AM81: =RC[-28] ->  | AN81: =RC[-28] ->  | AO81: =RC[-28] ->  | AP81: - | AQ81: =RC[-29] -> 0 | AR81: =RC[-29] -> 0 | AS81: - | AT81: =RC[-30] -> 0 | AU81: =RC[-30] -> 0 | AV81: =RC[-30] ->  | AW81: =RC[-30] -> 
A82: =IF(RC[1]="","",DATEVALUE(RC[1])) ->  | T82: =(RC[-16]*RC[-15]-RC[-13]*RC[-12])/1000 -> #VALUE! | W82: =RC[-2]*RC[-10]/1000 -> #VALUE! | X82: =ABS((RC[-3]*RC[-11]-RC[-2]*RC[-9])/1000) -> #VALUE! | Y82: =(RC[-14]-RC[1])/RC[-18]*100 -> #VALUE! | AC82: =VALUE(RC[-27]) -> #VALUE! | AD82: =IF(RC[21]=42,"*",IF(RC[21]=32,"",RC[21])) ->  | AE82: =RC[-28] ->  | AF82: =RC[-28] ->  | AG82: =RC[-28] ->  | AH82: =RC[-28] ->  | AI82: =RC[-28] ->  | AJ82: =RC[-28] ->  | AK82: =RC[-28] ->  | AL82: =RC[-28] -> 0 | AM82: =RC[-28] ->  | AN82: =RC[-28] ->  | AO82: =RC[-28] ->  | AP82: - | AQ82: =RC[-29] -> 0 | AR82: =RC[-29] -> 0 | AS82: - | AT82: =RC[-30] -> 0 | AU82: =RC[-30] -> 0 | AV82: =RC[-30] ->  | AW82: =RC[-30] -> 
A83: =IF(RC[1]="","",DATEVALUE(RC[1])) ->  | T83: =(RC[-16]*RC[-15]-RC[-13]*RC[-12])/1000 -> #VALUE! | W83: =RC[-2]*RC[-10]/1000 -> #VALUE! | X83: =ABS((RC[-3]*RC[-11]-RC[-2]*RC[-9])/1000) -> #VALUE! | Y83: =(RC[-14]-RC[1])/RC[-18]*100 -> #VALUE! | AC83: =VALUE(RC[-27]) -> #VALUE! | AD83: =IF(RC[21]=42,"*",IF(RC[21]=32,"",RC[21])) ->  | AE83: =RC[-28] ->  | AF83: =RC[-28] ->  | AG83: =RC[-28] ->  | AH83: =RC[-28] ->  | AI83: =RC[-28] ->  | AJ83: =RC[-28] ->  | AK83: =RC[-28] ->  | AL83: =RC[-28] -> 0 | AM83: =RC[-28] ->  | AN83: =RC[-28] ->  | AO83: =RC[-28] ->  | AP83: - | AQ83: =RC[-29] -> 0 | AR83: =RC[-29] -> 0 | AS83: - | AT83: =RC[-30] -> 0 | AU83: =RC[-30] -> 0 | AV83: =RC[-30] ->  | AW83: =RC[-30] -> 
AC84: Среднее | AF84: =R[1]C[-28] -> 168.60199999999998 | AG84: =R[1]C[-28] -> 67.122333333333344 | AH84: =R[1]C[-28] -> 7.7053333333333311 | AI84: =R[1]C[-28] -> 144.19600000000003 | AJ84: =R[1]C[-28] -> 41.149333333333338 | AK84: =R[1]C[-28] -> 6.0623333333333331 | AL84: =R[1]C[-28] -> 25.973000000000003 | AM84: =R[1]C[-28] -> 24.405999999999995 | AN84: =R[1]C[-28] -> 26.633333333333333 | AO84: =R[1]C[-28] -> 67.075999999999993 | AP84: - | AQ84: =R[1]C[-29] -> 0 | AR84: =R[1]C[-29] -> 0 | AS84: - | AT84: =R[1]C[-30] -> 0 | AU84: =R[1]C[-30] -> 0
B85: Среднее | D85: =AVERAGE(OFFSET(R[-74]C,3,0,R7C1,1)) -> 168.60199999999998 | E85: =AVERAGE(OFFSET(R[-74]C,3,0,R7C1,1)) -> 67.122333333333344 | F85: =AVERAGE(OFFSET(R[-74]C,3,0,R7C1,1)) -> 7.7053333333333311 | G85: =AVERAGE(OFFSET(R[-74]C,3,0,R7C1,1)) -> 144.19600000000003 | H85: =AVERAGE(OFFSET(R[-74]C,3,0,R7C1,1)) -> 41.149333333333338 | I85: =AVERAGE(OFFSET(R[-74]C,3,0,R7C1,1)) -> 6.0623333333333331 | J85: =AVERAGE(OFFSET(R[-74]C,3,0,R7C1,1)) -> 25.973000000000003 | K85: =AVERAGE(OFFSET(R[-74]C,3,0,R7C1,1)) -> 24.405999999999995 | L85: =IF(SUM(OFFSET(R[-74]C,3,0,R7C1,1))=0,"",AVERAGE(OFFSET(R[-74]C,3,0,R7C1,1))) -> 26.633333333333333 | M85: =IF(SUM(OFFSET(R[-74]C,3,0,R7C1,1))=0,"",AVERAGE(OFFSET(R[-74]C,3,0,R7C1,1))) -> 67.075999999999993 | R85: =IF(SUM(OFFSET(R[-74]C,3,0,R7C1,1))=0,"",AVERAGE(OFFSET(R[-74]C,3,0,R7C1,1))) -> 1.7488999999999999 | S85: =AVERAGE(OFFSET(R[-74]C,3,0,R7C1,1)) -> 5.3832666666666675 | T85: =AVERAGE(OFFSET(R[-74]C,3,0,R7C1,1)) -> 5.3771919933333345 | W85: =AVERAGE(OFFSET(R[-74]C,3,0,R7C1,1)) -> 1.7486673166666666 | X85: =AVERAGE(OFFSET(R[-74]C,3,0,R7C1,1)) -> #VALUE! | AC85: Итого | AE85: =R[1]C[-28] -> 720 | AF85: =R[1]C[-28] -> 5058.0599999999995 | AI85: =R[1]C[-28] -> 4325.880000000001 | AM85: =R[1]C[-28] -> 732.17999999999984 | AN85: =R[1]C[-28] -> 799 | AQ85: =R[1]C[-29] -> 0 | AU85: =R[1]C[-30] -> 0 | AV85: =R[1]C[-30] -> 52.466999999999999 | AW85: =R[1]C[-30] -> 161.49800000000002
B86: ИТОГО: | C86: =SUM(OFFSET(R[-75]C,3,0,R7C1,1)) -> 720 | D86: =SUM(OFFSET(R[-75]C,3,0,R7C1,1)) -> 5058.0599999999995 | G86: =SUM(OFFSET(R[-75]C,3,0,R7C1,1)) -> 4325.880000000001 | K86: =SUM(OFFSET(R[-75]C,3,0,R7C1,1)) -> 732.17999999999984 | L86: =IF(SUM(OFFSET(R[-75]C,3,0,R7C1,1))=0,"",SUM(OFFSET(R[-75]C,3,0,R7C1,1))) -> 799 | R86: =IF(SUM(OFFSET(R[-75]C,3,0,R7C1,1))=0,"",SUM(OFFSET(R[-75]C,3,0,R7C1,1))) -> 52.466999999999999 | S86: =SUM(OFFSET(R[-75]C,3,0,R7C1,1)) -> 161.49800000000002 | T86: =SUM(OFFSET(R[-75]C,3,0,R7C1,1)) -> 161.31575980000002 | W86: =SUM(OFFSET(R[-75]C,3,0,R7C1,1)) -> 52.460019500000001 | X86: =SUM(OFFSET(R[-75]C,3,0,R7C1,1)) -> #VALUE!
AC87: Досчёт | AF87: =R[1]C[-28] -> 0 | AI87: =R[1]C[-28] -> 0 | AM87: =R[1]C[-28] -> 0 | AN87: =R[1]C[-28] -> 0 | AQ87: =R[1]C[-29] -> 0 | AU87: =R[1]C[-30] -> 0 | AV87: =R[1]C[-30] -> 0 | AW87: =R[1]C[-30] -> 0
A88: 11дн=264ч 4дн=96ч | B88: Досчёт до конца м-ца (+) | C88: =R6C1*24 -> 216 | T88: № 93473 | AC88: Снятие | AF88: =-R[1]C[-28] -> 0 | AI88: =-R[1]C[-28] -> 0 | AM88: =-R[1]C[-28] -> 0 | AN88: =-R[1]C[-28] -> 0 | AQ88: =-R[1]C[-29] -> 0 | AU88: =-R[1]C[-30] -> 0 | AV88: =-R[1]C[-30] -> 0 | AW88: =-R[1]C[-30] -> 0
A89: 9дн=216ч 7дн=168ч | B89: Вычет с предыдущего (-) | C89: =R4C1*24 -> 192 | AC89: Сумма | AF89: =R[1]C[-28] -> 5058.0599999999995 | AI89: =R[1]C[-28] -> 4325.880000000001 | AM89: =R[1]C[-28] -> 732.17999999999984 | AN89: =R[1]C[-28] -> 799 | AQ89: =R[1]C[-29] -> 0 | AU89: =R[1]C[-30] -> 0 | AV89: =R[1]C[-30] -> 52.466999999999999 | AW89: =R[1]C[-30] -> 161.49800000000002
B90: СУММА: | C90: =R[-4]C+R[-2]C-R[-1]C -> 744 | D90: =R[-4]C+R[-2]C-R[-1]C -> 5058.0599999999995 | G90: =R[-4]C+R[-2]C-R[-1]C -> 4325.880000000001 | K90: =R[-4]C+R[-2]C-R[-1]C -> 732.17999999999984 | L90: =IF(SUM(OFFSET(R[-79]C,3,0,R7C1,1))=0,"",(R[-4]C+R[-2]C-R[-1]C)) -> 799 | R90: =IF(SUM(OFFSET(R[-79]C,3,0,R7C1,1))=0,"",(R[-4]C+R[-2]C-R[-1]C)) -> 52.466999999999999 | S90: =R[-4]C+R[-2]C-R[-1]C -> 161.49800000000002
AC91: Тхв на источнике | AE91: V гвс (м3) | AF91: =R[-2]C[15] -> 0 | AG91: W гвс (Гкал) | AH91: =RC[-2]*0.06 -> 0 | AI91: W без гвс (Гкал) | AJ91: =R[-2]C[13]-RC[-2] -> 161.49800000000002
B92: Показания счетчиков на момент снятия данных:
B93: Дата, время | D93: М1, т | F93: М2, т | H93: М3, т | J93: М4, т | L93: Qо, Гкал | N93: Qг, Гкал | P93: время, час
B94: 23.09.18 00:00 | D94: 45900.57 | F94: 36826.22 | H94: 13076.62 | J94: - | L94: 1777.875 | N94: 863.46 | P94: -
B95: 17.10.18 09:00 | D95: 49896.31 | F95: 40222.199999999997 | H95: 13717.27 | J95: - | L95: 1905.549 | N95: 906.08199999999999 | P95: -
AC97: =ZAYAVKA_N -> з.н д. №02/147-2783 от 04.10.18
B98: Представитель потребителя:_______________________________________________________________________ В.О. Топорков
I101: Рекомендуемые значения по параметрам теплопотребления (не являются официально утверждёнными)
I102: М, т | J102: V, м3 | K102: Qгвс, Гкал | L102: Qотоп, Гкал | M102: Qо, Гкал
I103: =R[-13]C[-3] -> 0 | J103: =RC[-1]/0.98 -> 0 | K103: =RC[-1]*0.06 -> 0 | L103: =RC[1]-RC[-1] -> 52.466999999999999 | M103: =R[-13]C[5] -> 52.466999999999999
O105: ДЛЯ САМОКОНТРОЛЯ
B106: В строке выбора дат указать период с 16.7.13 по 23.8.13 - жильё | N106: Q | O106: Qг
B107: В строке выбора дат указать период с 18.7.13 по 25.8.13 - не жилое | N107: =(R[-21]C[-10]*R[-22]C[-7]-R[-21]C[-9]*R[-22]C[-6])/1000 -> 729.35201976000008 | O107: =IF(R[-22]C[-2]="",R[-21]C[-3]*R[-22]C/1000,"") ->  | P107: Си2
O108: =IF(R[-23]C[-2]="","",((R[-22]C[-3]*R[-23]C)-(R[-22]C[-2]*R[-23]C[2]))/1000) -> 0 | P108: Си3