Sheet: Лист1
G1: Отчёт о теплопотреблении за октябрь 2018 | M1: з.н д. №02/147-2783 от 04.10.18 с 03.10.18г по 10.10.18г некорректная работа приборов
A4: =EOMONTH(R[9]C,0)-R[9]C -> 8 | B4: Потребитель: ЗАО "Сити Сервис"
A5: =MAX(R[9]C:R[78]C) -> 2018-10-22T00:00:00.000 | B5: Адрес: г. СПб, Кораблестроителей ул., д.39 к.1 ИТП 3
A6: =EOMONTH(R[-1]C,0)-R[-1]C -> 9 | B6: Телефон: 8-911-021-19-79
A7: =R[-2]C-R[6]C -> 30 | B7: Договор 10023-2 (.) 87490
A8: 7 | B8: Тепловычислитель: ВКТ-7 № 68130 | L8: М2 мах= | M8: 175.44 | O8: Мгвс мах= | P8: 43.2
L9: Qотоп мах= | M9: 14.04 | O9: Qгвс мах= | P9: 2.88
B10: Расчётная формула: Q=M1*(h1-h2)+(M1-M2)*(h2-hхв)
D12: Учет | L12: Контроль
A13: =R[1]C[1]-1 -> 2018-09-22T00:00:00.000 | B13: Дата | C13: N, ч | D13: M1, т | E13: T1, С | F13: P1, кг/см2 | G13: M2, т | H13: T2, С | I13: P2, кг/см2 | J13: dT, С | K13: M1-М2, т | L13: V3, м3 | M13: T3, С | N13: V4, м3 | O13: =IF(R[-12]C[-14]="м.куб","","T4, С") -> T4, С | P13: dT, С | Q13: V3-V4, м3 | R13: Qгвс, Гкал | S13: Qобщ., Гкал | T13: Q | U13: M3 | V13: M4 | W13: си2 | X13: си3 | Y13: Разб. | Z13: dM2 | AC13: Дата | AD13: НС | AE13: n, ч | AF13: М1, т | AG13: t1, гр. С | AH13: Р1, кгс/см2 | AI13: М2, т | AJ13: t2, гр. С | AK13: Р2, кгс/см2 | AL13: t1-t2, гр. С | AM13: М1-М2, т | AN13: М1гвс, т | AO13: t1гвс, гр. С | AP13: Р1гвс, кгс/см2 | AQ13: М2гвс, т | AR13: t2гвс, гр. С | AS13: Р2гвс, кгс/см2 | AT13: t1гвс-t2гвс | AU13: М1гвс-М2гвс, т | AV13: Wгвс, Гкал | AW13: Wсумм, Гкал | AY13: NS_TV1 | AZ13: НС | BA13: NS_TV2
A14: =IF(RC[1]="","",DATEVALUE(RC[1])) -> 43366 | B14: 23.09.18 | C14: 24 | D14: 150.30000000000001 | E14: 70.88 | F14: 8.9600000000000009 | G14: 127.13 | H14: 70.760000000000005 | I14: 5.16 | J14: =RC[-5]-RC[-2] -> 0.11999999999999034 | K14: 23.17 | L14: 25.38 | M14: 68.459999999999994 | R14: 1.7 | S14: =RC[-1] -> 1.7 | T14: =(RC[-16]*RC[-15]-RC[-13]*RC[-12])/1000 -> 1.6575451999999986 | U14: 24.85 | V14: - | W14: =RC[-2]*RC[-10]/1000 -> 1.7012309999999999 | X14: =ABS((RC[-3]*RC[-11]-RC[-2]*RC[-9])/1000) -> #VALUE! | Y14: =(RC[-14]-RC[1])/RC[-18]*100 -> -1.3214819476126798 | Z14: 24.85 | AC14: =VALUE(RC[-27]) -> 2018-09-23T00:00:00.000 | AD14: =IF(RC[21]=42,"*",IF(RC[21]=32,"",RC[21])) -> - | AE14: =RC[-28] -> 24 | AF14: =RC[-28] -> 150.30000000000001 | AG14: =RC[-28] -> 70.88 | AH14: =RC[-28] -> 8.9600000000000009 | AI14: =RC[-28] -> 127.13 | AJ14: =RC[-28] -> 70.760000000000005 | AK14: =RC[-28] -> 5.16 | AL14: =RC[-28] -> 0.11999999999999034 | AM14: =RC[-28] -> 23.17 | AN14: =RC[-28] -> 25.38 | AO14: =RC[-28] -> 68.459999999999994 | AP14: - | AQ14: =RC[-29] -> 0 | AR14: =RC[-29] -> 0 | AS14: - | AT14: =RC[-30] -> 0 | AU14: =RC[-30] -> 0 | AV14: =RC[-30] -> 1.7 | AW14: =RC[-30] -> 1.7 | AY14: - | AZ14: - | BA14: -
A15: =IF(RC[1]="","",DATEVALUE(RC[1])) -> 43367 | B15: 24.09.18 | C15: 24 | D15: 149.13999999999999 | E15: 69.83 | F15: 8.92 | G15: 126.28 | H15: 69.72 | I15: 5.18 | J15: =RC[-5]-RC[-2] -> 0.10999999999999943 | K15: 22.86 | L15: 24.88 | M15: 67.37 | R15: 1.643 | S15: =RC[-1] -> 1.643 | T15: =(RC[-16]*RC[-15]-RC[-13]*RC[-12])/1000 -> 1.6102045999999992 | U15: 24.39 | V15: - | W15: =RC[-2]*RC[-10]/1000 -> 1.6431543000000002 | X15: =ABS((RC[-3]*RC[-11]-RC[-2]*RC[-9])/1000) -> #VALUE! | Y15: =(RC[-14]-RC[1])/RC[-18]*100 -> -1.2115932847640174 | Z15: 24.39 | AC15: =VALUE(RC[-27]) -> 2018-09-24T00:00:00.000 | AD15: =IF(RC[21]=42,"*",IF(RC[21]=32,"",RC[21])) -> - | AE15: =RC[-28] -> 24 | AF15: =RC[-28] -> 149.13999999999999 | AG15: =RC[-28] -> 69.83 | AH15: =RC[-28] -> 8.92 | AI15: =RC[-28] -> 126.28 | AJ15: =RC[-28] -> 69.72 | AK15: =RC[-28] -> 5.18 | AL15: =RC[-28] -> 0.10999999999999943 | AM15: =RC[-28] -> 22.86 | AN15: =RC[-28] -> 24.88 | AO15: =RC[-28] -> 67.37 | AP15: - | AQ15: =RC[-29] -> 0 | AR15: =RC[-29] -> 0 | AS15: - | AT15: =RC[-30] -> 0 | AU15: =RC[-30] -> 0 | AV15: =RC[-30] -> 1.643 | AW15: =RC[-30] -> 1.643 | AY15: - | AZ15: - | BA15: -
A16: =IF(RC[1]="","",DATEVALUE(RC[1])) -> 43368 | B16: 25.09.18 | C16: 24 | D16: 153.38999999999999 | E16: 68.05 | F16: 9.0399999999999991 | G16: 130.88999999999999 | H16: 67.989999999999995 | I16: 5.0199999999999996 | J16: =RC[-5]-RC[-2] -> 6.0000000000002274E-2 | K16: 22.5 | L16: 24.55 | M16: 65.400000000000006 | R16: 1.5740000000000001 | S16: =RC[-1] -> 1.5740000000000001 | T16: =(RC[-16]*RC[-15]-RC[-13]*RC[-12])/1000 -> 1.5389784 | U16: 24.07 | V16: - | W16: =RC[-2]*RC[-10]/1000 -> 1.5741780000000001 | X16: =ABS((RC[-3]*RC[-11]-RC[-2]*RC[-9])/1000) -> #VALUE! | Y16: =(RC[-14]-RC[1])/RC[-18]*100 -> -1.1994804797921923 | Z16: 24.07 | AC16: =VALUE(RC[-27]) -> 2018-09-25T00:00:00.000 | AD16: =IF(RC[21]=42,"*",IF(RC[21]=32,"",RC[21])) -> - | AE16: =RC[-28] -> 24 | AF16: =RC[-28] -> 153.38999999999999 | AG16: =RC[-28] -> 68.05 | AH16: =RC[-28] -> 9.0399999999999991 | AI16: =RC[-28] -> 130.88999999999999 | AJ16: =RC[-28] -> 67.989999999999995 | AK16: =RC[-28] -> 5.0199999999999996 | AL16: =RC[-28] -> 6.0000000000002274E-2 | AM16: =RC[-28] -> 22.5 | AN16: =RC[-28] -> 24.55 | AO16: =RC[-28] -> 65.400000000000006 | AP16: - | AQ16: =RC[-29] -> 0 | AR16: =RC[-29] -> 0 | AS16: - | AT16: =RC[-30] -> 0 | AU16: =RC[-30] -> 0 | AV16: =RC[-30] -> 1.5740000000000001 | AW16: =RC[-30] -> 1.5740000000000001 | AY16: - | AZ16: - | BA16: -
A17: =IF(RC[1]="","",DATEVALUE(RC[1])) -> 43369 | B17: 26.09.18 | C17: 24 | D17: 166.21 | E17: 67.53 | F17: 8.98 | G17: 141.93 | H17: 58.92 | I17: 5.03 | J17: =RC[-5]-RC[-2] -> 8.61 | K17: 24.28 | L17: 24.19 | M17: 64.849999999999994 | R17: 1.5389999999999999 | S17: 2.883 | T17: =(RC[-16]*RC[-15]-RC[-13]*RC[-12])/1000 -> 2.8616457000000008 | U17: 23.71 | V17: - | W17: =RC[-2]*RC[-10]/1000 -> 1.5375935000000001 | X17: =ABS((RC[-3]*RC[-11]-RC[-2]*RC[-9])/1000) -> #VALUE! | Y17: =(RC[-14]-RC[1])/RC[-18]*100 -> 0.40160642570281146 | Z17: 23.71 | AC17: =VALUE(RC[-27]) -> 2018-09-26T00:00:00.000 | AD17: =IF(RC[21]=42,"*",IF(RC[21]=32,"",RC[21])) -> - | AE17: =RC[-28] -> 24 | AF17: =RC[-28] -> 166.21 | AG17: =RC[-28] -> 67.53 | AH17: =RC[-28] -> 8.98 | AI17: =RC[-28] -> 141.93 | AJ17: =RC[-28] -> 58.92 | AK17: =RC[-28] -> 5.03 | AL17: =RC[-28] -> 8.61 | AM17: =RC[-28] -> 24.28 | AN17: =RC[-28] -> 24.19 | AO17: =RC[-28] -> 64.849999999999994 | AP17: - | AQ17: =RC[-29] -> 0 | AR17: =RC[-29] -> 0 | AS17: - | AT17: =RC[-30] -> 0 | AU17: =RC[-30] -> 0 | AV17: =RC[-30] -> 1.5389999999999999 | AW17: =RC[-30] -> 2.883 | AY17: - | AZ17: - | BA17: -
A18: =IF(RC[1]="","",DATEVALUE(RC[1])) -> 43370 | B18: 27.09.18 | C18: 24 | D18: 180.64 | E18: 63.11 | F18: 8.61 | G18: 158.82 | H18: 41.16 | I18: 5.21 | J18: =RC[-5]-RC[-2] -> 21.950000000000003 | K18: 21.82 | L18: 22.83 | M18: 60.28 | R18: 1.3520000000000001 | S18: 4.8680000000000003 | T18: =(RC[-16]*RC[-15]-RC[-13]*RC[-12])/1000 -> 4.8631592000000001 | U18: 22.44 | V18: - | W18: =RC[-2]*RC[-10]/1000 -> 1.3526832000000002 | X18: =ABS((RC[-3]*RC[-11]-RC[-2]*RC[-9])/1000) -> #VALUE! | Y18: =(RC[-14]-RC[1])/RC[-18]*100 -> -0.39037904546027014 | Z18: 22.44 | AC18: =VALUE(RC[-27]) -> 2018-09-27T00:00:00.000 | AD18: =IF(RC[21]=42,"*",IF(RC[21]=32,"",RC[21])) -> - | AE18: =RC[-28] -> 24 | AF18: =RC[-28] -> 180.64 | AG18: =RC[-28] -> 63.11 | AH18: =RC[-28] -> 8.61 | AI18: =RC[-28] -> 158.82 | AJ18: =RC[-28] -> 41.16 | AK18: =RC[-28] -> 5.21 | AL18: =RC[-28] -> 21.950000000000003 | AM18: =RC[-28] -> 21.82 | AN18: =RC[-28] -> 22.83 | AO18: =RC[-28] -> 60.28 | AP18: - | AQ18: =RC[-29] -> 0 | AR18: =RC[-29] -> 0 | AS18: - | AT18: =RC[-30] -> 0 | AU18: =RC[-30] -> 0 | AV18: =RC[-30] -> 1.3520000000000001 | AW18: =RC[-30] -> 4.8680000000000003 | AY18: - | AZ18: - | BA18: -
A19: =IF(RC[1]="","",DATEVALUE(RC[1])) -> 43371 | B19: 28.09.18 | C19: 24 | D19: 176.47 | E19: 67.510000000000005 | F19: 8.5299999999999994 | G19: 148.15 | H19: 42.58 | I19: 5.32 | J19: =RC[-5]-RC[-2] -> 24.930000000000007 | K19: 28.32 | L19: 23.76 | M19: 65.06 | R19: 1.516 | S19: 5.6109999999999998 | T19: =(RC[-16]*RC[-15]-RC[-13]*RC[-12])/1000 -> 5.6052626999999999 | U19: 23.32 | V19: - | W19: =RC[-2]*RC[-10]/1000 -> 1.5171992000000001 | X19: =ABS((RC[-3]*RC[-11]-RC[-2]*RC[-9])/1000) -> #VALUE! | Y19: =(RC[-14]-RC[1])/RC[-18]*100 -> 3.3749578130273372 | Z19: 23.32 | AC19: =VALUE(RC[-27]) -> 2018-09-28T00:00:00.000 | AD19: =IF(RC[21]=42,"*",IF(RC[21]=32,"",RC[21])) -> - | AE19: =RC[-28] -> 24 | AF19: =RC[-28] -> 176.47 | AG19: =RC[-28] -> 67.510000000000005 | AH19: =RC[-28] -> 8.5299999999999994 | AI19: =RC[-28] -> 148.15 | AJ19: =RC[-28] -> 42.58 | AK19: =RC[-28] -> 5.32 | AL19: =RC[-28] -> 24.930000000000007 | AM19: =RC[-28] -> 28.32 | AN19: =RC[-28] -> 23.76 | AO19: =RC[-28] -> 65.06 | AP19: - | AQ19: =RC[-29] -> 0 | AR19: =RC[-29] -> 0 | AS19: - | AT19: =RC[-30] -> 0 | AU19: =RC[-30] -> 0 | AV19: =RC[-30] -> 1.516 | AW19: =RC[-30] -> 5.6109999999999998 | AY19: - | AZ19: - | BA19: -
A20: =IF(RC[1]="","",DATEVALUE(RC[1])) -> 43372 | B20: 29.09.18 | C20: 24 | D20: 173.19 | E20: 67.33 | F20: 8.48 | G20: 149.34 | H20: 41.91 | I20: 5.46 | J20: =RC[-5]-RC[-2] -> 25.42 | K20: 23.85 | L20: 24.86 | M20: 64.47 | R20: 1.5760000000000001 | S20: 5.407 | T20: =(RC[-16]*RC[-15]-RC[-13]*RC[-12])/1000 -> 5.4020432999999999 | U20: 24.41 | V20: - | W20: =RC[-2]*RC[-10]/1000 -> 1.5737127 | X20: =ABS((RC[-3]*RC[-11]-RC[-2]*RC[-9])/1000) -> #VALUE! | Y20: =(RC[-14]-RC[1])/RC[-18]*100 -> -0.37498325967590646 | Z20: 24.41 | AC20: =VALUE(RC[-27]) -> 2018-09-29T00:00:00.000 | AD20: =IF(RC[21]=42,"*",IF(RC[21]=32,"",RC[21])) -> - | AE20: =RC[-28] -> 24 | AF20: =RC[-28] -> 173.19 | AG20: =RC[-28] -> 67.33 | AH20: =RC[-28] -> 8.48 | AI20: =RC[-28] -> 149.34 | AJ20: =RC[-28] -> 41.91 | AK20: =RC[-28] -> 5.46 | AL20: =RC[-28] -> 25.42 | AM20: =RC[-28] -> 23.85 | AN20: =RC[-28] -> 24.86 | AO20: =RC[-28] -> 64.47 | AP20: - | AQ20: =RC[-29] -> 0 | AR20: =RC[-29] -> 0 | AS20: - | AT20: =RC[-30] -> 0 | AU20: =RC[-30] -> 0 | AV20: =RC[-30] -> 1.5760000000000001 | AW20: =RC[-30] -> 5.407 | AY20: - | AZ20: - | BA20: -
A21: =IF(RC[1]="","",DATEVALUE(RC[1])) -> 43373 | B21: 30.09.18 | C21: 24 | D21: 173.3 | E21: 69.510000000000005 | F21: 8.4 | G21: 148.29 | H21: 42.64 | I21: 5.42 | J21: =RC[-5]-RC[-2] -> 26.870000000000005 | K21: 25.01 | L21: 25.92 | M21: 67.38 | R21: 1.7090000000000001 | S21: 5.7290000000000001 | T21: =(RC[-16]*RC[-15]-RC[-13]*RC[-12])/1000 -> 5.7229974000000032 | U21: 25.37 | V21: - | W21: =RC[-2]*RC[-10]/1000 -> 1.7094305999999999 | X21: =ABS((RC[-3]*RC[-11]-RC[-2]*RC[-9])/1000) -> #VALUE! | Y21: =(RC[-14]-RC[1])/RC[-18]*100 -> -0.2427675500708068 | Z21: 25.37 | AC21: =VALUE(RC[-27]) -> 2018-09-30T00:00:00.000 | AD21: =IF(RC[21]=42,"*",IF(RC[21]=32,"",RC[21])) -> - | AE21: =RC[-28] -> 24 | AF21: =RC[-28] -> 173.3 | AG21: =RC[-28] -> 69.510000000000005 | AH21: =RC[-28] -> 8.4 | AI21: =RC[-28] -> 148.29 | AJ21: =RC[-28] -> 42.64 | AK21: =RC[-28] -> 5.42 | AL21: =RC[-28] -> 26.870000000000005 | AM21: =RC[-28] -> 25.01 | AN21: =RC[-28] -> 25.92 | AO21: =RC[-28] -> 67.38 | AP21: - | AQ21: =RC[-29] -> 0 | AR21: =RC[-29] -> 0 | AS21: - | AT21: =RC[-30] -> 0 | AU21: =RC[-30] -> 0 | AV21: =RC[-30] -> 1.7090000000000001 | AW21: =RC[-30] -> 5.7290000000000001 | AY21: - | AZ21: - | BA21: -
A22: =IF(RC[1]="","",DATEVALUE(RC[1])) -> 43374 | B22: 01.10.18 | C22: 24 | D22: 174.98 | E22: 68.290000000000006 | F22: 8.51 | G22: 150.02000000000001 | H22: 43.04 | I22: 5.48 | J22: =RC[-5]-RC[-2] -> 25.250000000000007 | K22: 24.96 | L22: 26.07 | M22: 65.88 | R22: 1.681 | S22: 5.4960000000000004 | T22: =(RC[-16]*RC[-15]-RC[-13]*RC[-12])/1000 -> 5.4925233999999996 | U22: 25.54 | V22: - | W22: =RC[-2]*RC[-10]/1000 -> 1.6825751999999998 | X22: =ABS((RC[-3]*RC[-11]-RC[-2]*RC[-9])/1000) -> #VALUE! | Y22: =(RC[-14]-RC[1])/RC[-18]*100 -> -0.38661511798426756 | Z22: 25.54 | AC22: =VALUE(RC[-27]) -> 2018-10-01T00:00:00.000 | AD22: =IF(RC[21]=42,"*",IF(RC[21]=32,"",RC[21])) -> - | AE22: =RC[-28] -> 24 | AF22: =RC[-28] -> 174.98 | AG22: =RC[-28] -> 68.290000000000006 | AH22: =RC[-28] -> 8.51 | AI22: =RC[-28] -> 150.02000000000001 | AJ22: =RC[-28] -> 43.04 | AK22: =RC[-28] -> 5.48 | AL22: =RC[-28] -> 25.250000000000007 | AM22: =RC[-28] -> 24.96 | AN22: =RC[-28] -> 26.07 | AO22: =RC[-28] -> 65.88 | AP22: - | AQ22: =RC[-29] -> 0 | AR22: =RC[-29] -> 0 | AS22: - | AT22: =RC[-30] -> 0 | AU22: =RC[-30] -> 0 | AV22: =RC[-30] -> 1.681 | AW22: =RC[-30] -> 5.4960000000000004 | AY22: - | AZ22: - | BA22: -
A23: =IF(RC[1]="","",DATEVALUE(RC[1])) -> 43375 | B23: 02.10.18 | C23: 24 | D23: 164.83 | E23: 67.06 | F23: 8.2799999999999994 | G23: 144.22999999999999 | H23: 42.2 | I23: 5.48 | J23: =RC[-5]-RC[-2] -> 24.86 | K23: 20.6 | L23: 21.84 | M23: 64.650000000000006 | R23: 1.385 | S23: 4.968 | T23: =(RC[-16]*RC[-15]-RC[-13]*RC[-12])/1000 -> 4.9669938000000009 | U23: 21.43 | V23: - | W23: =RC[-2]*RC[-10]/1000 -> 1.3854495000000002 | X23: =ABS((RC[-3]*RC[-11]-RC[-2]*RC[-9])/1000) -> #VALUE! | Y23: =(RC[-14]-RC[1])/RC[-18]*100 -> -0.57546973583859007 | Z23: 21.43 | AC23: =VALUE(RC[-27]) -> 2018-10-02T00:00:00.000 | AD23: =IF(RC[21]=42,"*",IF(RC[21]=32,"",RC[21])) -> - | AE23: =RC[-28] -> 24 | AF23: =RC[-28] -> 164.83 | AG23: =RC[-28] -> 67.06 | AH23: =RC[-28] -> 8.2799999999999994 | AI23: =RC[-28] -> 144.22999999999999 | AJ23: =RC[-28] -> 42.2 | AK23: =RC[-28] -> 5.48 | AL23: =RC[-28] -> 24.86 | AM23: =RC[-28] -> 20.6 | AN23: =RC[-28] -> 21.84 | AO23: =RC[-28] -> 64.650000000000006 | AP23: - | AQ23: =RC[-29] -> 0 | AR23: =RC[-29] -> 0 | AS23: - | AT23: =RC[-30] -> 0 | AU23: =RC[-30] -> 0 | AV23: =RC[-30] -> 1.385 | AW23: =RC[-30] -> 4.968 | AY23: - | AZ23: - | BA23: -
A24: =IF(RC[1]="","",DATEVALUE(RC[1])) -> 43376 | B24: 03.10.18 | C24: 24 | D24: =AVERAGE(R[-3]C:R[-1]C) -> 171.03666666666666 | E24: =AVERAGE(R[-3]C:R[-1]C) -> 68.286666666666676 | F24: =AVERAGE(R[-3]C:R[-1]C) -> 8.3966666666666665 | G24: =AVERAGE(R[-3]C:R[-1]C) -> 147.51333333333332 | H24: =AVERAGE(R[-3]C:R[-1]C) -> 42.626666666666672 | I24: =AVERAGE(R[-3]C:R[-1]C) -> 5.4600000000000009 | J24: =AVERAGE(R[-3]C:R[-1]C) -> 25.660000000000007 | K24: =AVERAGE(R[-3]C:R[-1]C) -> 23.52333333333333 | L24: =AVERAGE(R[-3]C:R[-1]C) -> 24.61 | M24: =AVERAGE(R[-3]C:R[-1]C) -> 65.97 | R24: =AVERAGE(R[-3]C:R[-1]C) -> 1.5916666666666668 | S24: =AVERAGE(R[-3]C:R[-1]C) -> 5.3976666666666668 | T24: =(RC[-16]*RC[-15]-RC[-13]*RC[-12])/1000 -> 5.3915221555555561 | U24: 23.42 | V24: - | W24: =RC[-2]*RC[-10]/1000 -> 1.5450174000000001 | X24: =ABS((RC[-3]*RC[-11]-RC[-2]*RC[-9])/1000) -> #VALUE! | Y24: =(RC[-14]-RC[1])/RC[-18]*100 -> 7.0050164956836566E-2 | Z24: 23.42 | AC24: =VALUE(RC[-27]) -> 2018-10-03T00:00:00.000 | AD24: =IF(RC[21]=42,"*",IF(RC[21]=32,"",RC[21])) -> - | AE24: =RC[-28] -> 24 | AF24: =RC[-28] -> 171.03666666666666 | AG24: =RC[-28] -> 68.286666666666676 | AH24: =RC[-28] -> 8.3966666666666665 | AI24: =RC[-28] -> 147.51333333333332 | AJ24: =RC[-28] -> 42.626666666666672 | AK24: =RC[-28] -> 5.4600000000000009 | AL24: =RC[-28] -> 25.660000000000007 | AM24: =RC[-28] -> 23.52333333333333 | AN24: =RC[-28] -> 24.61 | AO24: =RC[-28] -> 65.97 | AP24: - | AQ24: =RC[-29] -> 0 | AR24: =RC[-29] -> 0 | AS24: - | AT24: =RC[-30] -> 0 | AU24: =RC[-30] -> 0 | AV24: =RC[-30] -> 1.5916666666666668 | AW24: =RC[-30] -> 5.3976666666666668 | AY24: - | AZ24: - | BA24: -
A25: =IF(RC[1]="","",DATEVALUE(RC[1])) -> 43377 | B25: 04.10.18 | C25: 24 | D25: 171.03666666666666 | E25: 68.286666666666676 | F25: 8.3966666666666665 | G25: 147.51333333333332 | H25: 42.626666666666672 | I25: 5.4600000000000009 | J25: 25.660000000000007 | K25: 23.52333333333333 | L25: 24.61 | M25: 65.97 | R25: 1.5916666666666668 | S25: 5.3976666666666668 | T25: =(RC[-16]*RC[-15]-RC[-13]*RC[-12])/1000 -> 5.3915221555555561 | W25: =RC[-2]*RC[-10]/1000 -> #VALUE! | X25: =ABS((RC[-3]*RC[-11]-RC[-2]*RC[-9])/1000) -> #VALUE! | Y25: =(RC[-14]-RC[1])/RC[-18]*100 -> #VALUE! | AC25: =VALUE(RC[-27]) -> 2018-10-04T00:00:00.000 | AD25: =IF(RC[21]=42,"*",IF(RC[21]=32,"",RC[21])) ->  | AE25: =RC[-28] -> 24 | AF25: =RC[-28] -> 171.03666666666666 | AG25: =RC[-28] -> 68.286666666666676 | AH25: =RC[-28] -> 8.3966666666666665 | AI25: =RC[-28] -> 147.51333333333332 | AJ25: =RC[-28] -> 42.626666666666672 | AK25: =RC[-28] -> 5.4600000000000009 | AL25: =RC[-28] -> 25.660000000000007 | AM25: =RC[-28] -> 23.52333333333333 | AN25: =RC[-28] -> 24.61 | AO25: =RC[-28] -> 65.97 | AP25: - | AQ25: =RC[-29] -> 0 | AR25: =RC[-29] -> 0 | AS25: - | AT25: =RC[-30] -> 0 | AU25: =RC[-30] -> 0 | AV25: =RC[-30] -> 1.5916666666666668 | AW25: =RC[-30] -> 5.3976666666666668
A26: =IF(RC[1]="","",DATEVALUE(RC[1])) -> 43378 | B26: 05.10.18 | C26: 24 | D26: 171.03666666666666 | E26: 68.286666666666676 | F26: 8.3966666666666665 | G26: 147.51333333333332 | H26: 42.626666666666672 | I26: 5.4600000000000009 | J26: 25.660000000000007 | K26: 23.52333333333333 | L26: 24.61 | M26: 65.97 | R26: 1.5916666666666668 | S26: 5.3976666666666668 | T26: =(RC[-16]*RC[-15]-RC[-13]*RC[-12])/1000 -> 5.3915221555555561 | W26: =RC[-2]*RC[-10]/1000 -> #VALUE! | X26: =ABS((RC[-3]*RC[-11]-RC[-2]*RC[-9])/1000) -> #VALUE! | Y26: =(RC[-14]-RC[1])/RC[-18]*100 -> #VALUE! | AC26: =VALUE(RC[-27]) -> 2018-10-05T00:00:00.000 | AD26: =IF(RC[21]=42,"*",IF(RC[21]=32,"",RC[21])) ->  | AE26: =RC[-28] -> 24 | AF26: =RC[-28] -> 171.03666666666666 | AG26: =RC[-28] -> 68.286666666666676 | AH26: =RC[-28] -> 8.3966666666666665 | AI26: =RC[-28] -> 147.51333333333332 | AJ26: =RC[-28] -> 42.626666666666672 | AK26: =RC[-28] -> 5.4600000000000009 | AL26: =RC[-28] -> 25.660000000000007 | AM26: =RC[-28] -> 23.52333333333333 | AN26: =RC[-28] -> 24.61 | AO26: =RC[-28] -> 65.97 | AP26: - | AQ26: =RC[-29] -> 0 | AR26: =RC[-29] -> 0 | AS26: - | AT26: =RC[-30] -> 0 | AU26: =RC[-30] -> 0 | AV26: =RC[-30] -> 1.5916666666666668 | AW26: =RC[-30] -> 5.3976666666666668
A27: =IF(RC[1]="","",DATEVALUE(RC[1])) -> 43379 | B27: 06.10.18 | C27: 24 | D27: 171.03666666666666 | E27: 68.286666666666676 | F27: 8.3966666666666665 | G27: 147.51333333333332 | H27: 42.626666666666672 | I27: 5.4600000000000009 | J27: 25.660000000000007 | K27: 23.52333333333333 | L27: 24.61 | M27: 65.97 | R27: 1.5916666666666668 | S27: 5.3976666666666668 | T27: =(RC[-16]*RC[-15]-RC[-13]*RC[-12])/1000 -> 5.3915221555555561 | W27: =RC[-2]*RC[-10]/1000 -> #VALUE! | X27: =ABS((RC[-3]*RC[-11]-RC[-2]*RC[-9])/1000) -> #VALUE! | Y27: =(RC[-14]-RC[1])/RC[-18]*100 -> #VALUE! | AC27: =VALUE(RC[-27]) -> 2018-10-06T00:00:00.000 | AD27: =IF(RC[21]=42,"*",IF(RC[21]=32,"",RC[21])) ->  | AE27: =RC[-28] -> 24 | AF27: =RC[-28] -> 171.03666666666666 | AG27: =RC[-28] -> 68.286666666666676 | AH27: =RC[-28] -> 8.3966666666666665 | AI27: =RC[-28] -> 147.51333333333332 | AJ27: =RC[-28] -> 42.626666666666672 | AK27: =RC[-28] -> 5.4600000000000009 | AL27: =RC[-28] -> 25.660000000000007 | AM27: =RC[-28] -> 23.52333333333333 | AN27: =RC[-28] -> 24.61 | AO27: =RC[-28] -> 65.97 | AP27: - | AQ27: =RC[-29] -> 0 | AR27: =RC[-29] -> 0 | AS27: - | AT27: =RC[-30] -> 0 | AU27: =RC[-30] -> 0 | AV27: =RC[-30] -> 1.5916666666666668 | AW27: =RC[-30] -> 5.3976666666666668
A28: =IF(RC[1]="","",DATEVALUE(RC[1])) -> 43380 | B28: 07.10.18 | C28: 24 | D28: 171.03666666666666 | E28: 68.286666666666676 | F28: 8.3966666666666665 | G28: 147.51333333333332 | H28: 42.626666666666672 | I28: 5.4600000000000009 | J28: 25.660000000000007 | K28: 23.52333333333333 | L28: 24.61 | M28: 65.97 | R28: 1.5916666666666668 | S28: 5.3976666666666668 | T28: =(RC[-16]*RC[-15]-RC[-13]*RC[-12])/1000 -> 5.3915221555555561 | W28: =RC[-2]*RC[-10]/1000 -> #VALUE! | X28: =ABS((RC[-3]*RC[-11]-RC[-2]*RC[-9])/1000) -> #VALUE! | Y28: =(RC[-14]-RC[1])/RC[-18]*100 -> #VALUE! | AC28: =VALUE(RC[-27]) -> 2018-10-07T00:00:00.000 | AD28: =IF(RC[21]=42,"*",IF(RC[21]=32,"",RC[21])) ->  | AE28: =RC[-28] -> 24 | AF28: =RC[-28] -> 171.03666666666666 | AG28: =RC[-28] -> 68.286666666666676 | AH28: =RC[-28] -> 8.3966666666666665 | AI28: =RC[-28] -> 147.51333333333332 | AJ28: =RC[-28] -> 42.626666666666672 | AK28: =RC[-28] -> 5.4600000000000009 | AL28: =RC[-28] -> 25.660000000000007 | AM28: =RC[-28] -> 23.52333333333333 | AN28: =RC[-28] -> 24.61 | AO28: =RC[-28] -> 65.97 | AP28: - | AQ28: =RC[-29] -> 0 | AR28: =RC[-29] -> 0 | AS28: - | AT28: =RC[-30] -> 0 | AU28: =RC[-30] -> 0 | AV28: =RC[-30] -> 1.5916666666666668 | AW28: =RC[-30] -> 5.3976666666666668
A29: =IF(RC[1]="","",DATEVALUE(RC[1])) -> 43381 | B29: 08.10.18 | C29: 24 | D29: 171.03666666666666 | E29: 68.286666666666676 | F29: 8.3966666666666665 | G29: 147.51333333333332 | H29: 42.626666666666672 | I29: 5.4600000000000009 | J29: 25.660000000000007 | K29: 23.52333333333333 | L29: 24.61 | M29: 65.97 | R29: 1.5916666666666668 | S29: 5.3976666666666668 | T29: =(RC[-16]*RC[-15]-RC[-13]*RC[-12])/1000 -> 5.3915221555555561 | W29: =RC[-2]*RC[-10]/1000 -> #VALUE! | X29: =ABS((RC[-3]*RC[-11]-RC[-2]*RC[-9])/1000) -> #VALUE! | Y29: =(RC[-14]-RC[1])/RC[-18]*100 -> #VALUE! | AC29: =VALUE(RC[-27]) -> 2018-10-08T00:00:00.000 | AD29: =IF(RC[21]=42,"*",IF(RC[21]=32,"",RC[21])) ->  | AE29: =RC[-28] -> 24 | AF29: =RC[-28] -> 171.03666666666666 | AG29: =RC[-28] -> 68.286666666666676 | AH29: =RC[-28] -> 8.3966666666666665 | AI29: =RC[-28] -> 147.51333333333332 | AJ29: =RC[-28] -> 42.626666666666672 | AK29: =RC[-28] -> 5.4600000000000009 | AL29: =RC[-28] -> 25.660000000000007 | AM29: =RC[-28] -> 23.52333333333333 | AN29: =RC[-28] -> 24.61 | AO29: =RC[-28] -> 65.97 | AP29: - | AQ29: =RC[-29] -> 0 | AR29: =RC[-29] -> 0 | AS29: - | AT29: =RC[-30] -> 0 | AU29: =RC[-30] -> 0 | AV29: =RC[-30] -> 1.5916666666666668 | AW29: =RC[-30] -> 5.3976666666666668
A30: =IF(RC[1]="","",DATEVALUE(RC[1])) -> 43382 | B30: 09.10.18 | C30: 24 | D30: 171.03666666666666 | E30: 68.286666666666676 | F30: 8.3966666666666665 | G30: 147.51333333333332 | H30: 42.626666666666672 | I30: 5.4600000000000009 | J30: 25.660000000000007 | K30: 23.52333333333333 | L30: 24.61 | M30: 65.97 | R30: 1.5916666666666668 | S30: 5.3976666666666668 | T30: =(RC[-16]*RC[-15]-RC[-13]*RC[-12])/1000 -> 5.3915221555555561 | U30: 34.92 | V30: - | W30: =RC[-2]*RC[-10]/1000 -> 2.3036724 | X30: =ABS((RC[-3]*RC[-11]-RC[-2]*RC[-9])/1000) -> #VALUE! | Y30: =(RC[-14]-RC[1])/RC[-18]*100 -> -7.7258552899172992 | Z30: 34.92 | AC30: =VALUE(RC[-27]) -> 2018-10-09T00:00:00.000 | AD30: =IF(RC[21]=42,"*",IF(RC[21]=32,"",RC[21])) -> - | AE30: =RC[-28] -> 24 | AF30: =RC[-28] -> 171.03666666666666 | AG30: =RC[-28] -> 68.286666666666676 | AH30: =RC[-28] -> 8.3966666666666665 | AI30: =RC[-28] -> 147.51333333333332 | AJ30: =RC[-28] -> 42.626666666666672 | AK30: =RC[-28] -> 5.4600000000000009 | AL30: =RC[-28] -> 25.660000000000007 | AM30: =RC[-28] -> 23.52333333333333 | AN30: =RC[-28] -> 24.61 | AO30: =RC[-28] -> 65.97 | AP30: - | AQ30: =RC[-29] -> 0 | AR30: =RC[-29] -> 0 | AS30: - | AT30: =RC[-30] -> 0 | AU30: =RC[-30] -> 0 | AV30: =RC[-30] -> 1.5916666666666668 | AW30: =RC[-30] -> 5.3976666666666668 | AY30: - | AZ30: - | BA30: -
A31: =IF(RC[1]="","",DATEVALUE(RC[1])) -> 43383 | B31: 10.10.18 | C31: 24 | D31: 144.03 | E31: 67.650000000000006 | F31: 7.73 | G31: 123.65 | H31: 39.97 | I31: 5.66 | J31: =RC[-5]-RC[-2] -> 27.680000000000007 | K31: 20.38 | L31: 20.78 | M31: 65.44 | R31: 1.3360000000000001 | S31: 4.8019999999999996 | T31: =(RC[-16]*RC[-15]-RC[-13]*RC[-12])/1000 -> 4.8013390000000005 | U31: 20.38 | V31: - | W31: =RC[-2]*RC[-10]/1000 -> 1.3336671999999998 | X31: =ABS((RC[-3]*RC[-11]-RC[-2]*RC[-9])/1000) -> #VALUE! | Y31: =(RC[-14]-RC[1])/RC[-18]*100 -> 0 | Z31: 20.38 | AC31: =VALUE(RC[-27]) -> 2018-10-10T00:00:00.000 | AD31: =IF(RC[21]=42,"*",IF(RC[21]=32,"",RC[21])) -> - | AE31: =RC[-28] -> 24 | AF31: =RC[-28] -> 144.03 | AG31: =RC[-28] -> 67.650000000000006 | AH31: =RC[-28] -> 7.73 | AI31: =RC[-28] -> 123.65 | AJ31: =RC[-28] -> 39.97 | AK31: =RC[-28] -> 5.66 | AL31: =RC[-28] -> 27.680000000000007 | AM31: =RC[-28] -> 20.38 | AN31: =RC[-28] -> 20.78 | AO31: =RC[-28] -> 65.44 | AP31: - | AQ31: =RC[-29] -> 0 | AR31: =RC[-29] -> 0 | AS31: - | AT31: =RC[-30] -> 0 | AU31: =RC[-30] -> 0 | AV31: =RC[-30] -> 1.3360000000000001 | AW31: =RC[-30] -> 4.8019999999999996 | AY31: - | AZ31: - | BA31: -
A32: =IF(RC[1]="","",DATEVALUE(RC[1])) -> 43384 | B32: 11.10.18 | C32: 24 | D32: 149.41999999999999 | E32: 68.73 | F32: 7.79 | G32: 128.19 | H32: 40.82 | I32: 5.57 | J32: =RC[-5]-RC[-2] -> 27.910000000000004 | K32: 21.23 | L32: 21.72 | M32: 66.39 | R32: 1.4119999999999999 | S32: 5.04 | T32: =(RC[-16]*RC[-15]-RC[-13]*RC[-12])/1000 -> 5.0369207999999999 | U32: 21.28 | V32: - | W32: =RC[-2]*RC[-10]/1000 -> 1.4127792000000001 | X32: =ABS((RC[-3]*RC[-11]-RC[-2]*RC[-9])/1000) -> #VALUE! | Y32: =(RC[-14]-RC[1])/RC[-18]*100 -> -3.900460254310064E-2 | Z32: 21.28 | AC32: =VALUE(RC[-27]) -> 2018-10-11T00:00:00.000 | AD32: =IF(RC[21]=42,"*",IF(RC[21]=32,"",RC[21])) -> - | AE32: =RC[-28] -> 24 | AF32: =RC[-28] -> 149.41999999999999 | AG32: =RC[-28] -> 68.73 | AH32: =RC[-28] -> 7.79 | AI32: =RC[-28] -> 128.19 | AJ32: =RC[-28] -> 40.82 | AK32: =RC[-28] -> 5.57 | AL32: =RC[-28] -> 27.910000000000004 | AM32: =RC[-28] -> 21.23 | AN32: =RC[-28] -> 21.72 | AO32: =RC[-28] -> 66.39 | AP32: - | AQ32: =RC[-29] -> 0 | AR32: =RC[-29] -> 0 | AS32: - | AT32: =RC[-30] -> 0 | AU32: =RC[-30] -> 0 | AV32: =RC[-30] -> 1.4119999999999999 | AW32: =RC[-30] -> 5.04 | AY32: - | AZ32: - | BA32: -
A33: =IF(RC[1]="","",DATEVALUE(RC[1])) -> 43385 | B33: 12.10.18 | C33: 24 | D33: 150.08000000000001 | E33: 68.58 | F33: 7.78 | G33: 126.93 | H33: 40.56 | I33: 5.62 | J33: =RC[-5]-RC[-2] -> 28.019999999999996 | K33: 23.15 | L33: 23.78 | M33: 66.290000000000006 | R33: 1.5449999999999999 | S33: 5.1449999999999996 | T33: =(RC[-16]*RC[-15]-RC[-13]*RC[-12])/1000 -> 5.1442055999999994 | U33: 23.3 | V33: - | W33: =RC[-2]*RC[-10]/1000 -> 1.5445570000000002 | X33: =ABS((RC[-3]*RC[-11]-RC[-2]*RC[-9])/1000) -> #VALUE! | Y33: =(RC[-14]-RC[1])/RC[-18]*100 -> -0.11817537225242428 | Z33: 23.3 | AC33: =VALUE(RC[-27]) -> 2018-10-12T00:00:00.000 | AD33: =IF(RC[21]=42,"*",IF(RC[21]=32,"",RC[21])) -> - | AE33: =RC[-28] -> 24 | AF33: =RC[-28] -> 150.08000000000001 | AG33: =RC[-28] -> 68.58 | AH33: =RC[-28] -> 7.78 | AI33: =RC[-28] -> 126.93 | AJ33: =RC[-28] -> 40.56 | AK33: =RC[-28] -> 5.62 | AL33: =RC[-28] -> 28.019999999999996 | AM33: =RC[-28] -> 23.15 | AN33: =RC[-28] -> 23.78 | AO33: =RC[-28] -> 66.290000000000006 | AP33: - | AQ33: =RC[-29] -> 0 | AR33: =RC[-29] -> 0 | AS33: - | AT33: =RC[-30] -> 0 | AU33: =RC[-30] -> 0 | AV33: =RC[-30] -> 1.5449999999999999 | AW33: =RC[-30] -> 5.1449999999999996 | AY33: - | AZ33: - | BA33: -
A34: =IF(RC[1]="","",DATEVALUE(RC[1])) -> 43386 | B34: 13.10.18 | C34: 24 | D34: 158.62 | E34: 69.7 | F34: 7.98 | G34: 133.11000000000001 | H34: 41.97 | I34: 5.6 | J34: =RC[-5]-RC[-2] -> 27.730000000000004 | K34: 25.51 | L34: 26.42 | M34: 67.59 | R34: 1.75 | S34: 5.47 | T34: =(RC[-16]*RC[-15]-RC[-13]*RC[-12])/1000 -> 5.4691872999999998 | U34: 25.9 | V34: - | W34: =RC[-2]*RC[-10]/1000 -> 1.7505809999999999 | X34: =ABS((RC[-3]*RC[-11]-RC[-2]*RC[-9])/1000) -> #VALUE! | Y34: =(RC[-14]-RC[1])/RC[-18]*100 -> -0.29299075952219739 | Z34: 25.9 | AC34: =VALUE(RC[-27]) -> 2018-10-13T00:00:00.000 | AD34: =IF(RC[21]=42,"*",IF(RC[21]=32,"",RC[21])) -> - | AE34: =RC[-28] -> 24 | AF34: =RC[-28] -> 158.62 | AG34: =RC[-28] -> 69.7 | AH34: =RC[-28] -> 7.98 | AI34: =RC[-28] -> 133.11000000000001 | AJ34: =RC[-28] -> 41.97 | AK34: =RC[-28] -> 5.6 | AL34: =RC[-28] -> 27.730000000000004 | AM34: =RC[-28] -> 25.51 | AN34: =RC[-28] -> 26.42 | AO34: =RC[-28] -> 67.59 | AP34: - | AQ34: =RC[-29] -> 0 | AR34: =RC[-29] -> 0 | AS34: - | AT34: =RC[-30] -> 0 | AU34: =RC[-30] -> 0 | AV34: =RC[-30] -> 1.75 | AW34: =RC[-30] -> 5.47 | AY34: - | AZ34: - | BA34: -
A35: =IF(RC[1]="","",DATEVALUE(RC[1])) -> 43387 | B35: 14.10.18 | C35: 24 | D35: 163.57 | E35: 70.430000000000007 | F35: 7.96 | G35: 135.33000000000001 | H35: 43.13 | I35: 5.51 | J35: =RC[-5]-RC[-2] -> 27.300000000000004 | K35: 28.24 | L35: 29.05 | M35: 68.33 | R35: 1.9450000000000001 | S35: 5.6849999999999996 | T35: =(RC[-16]*RC[-15]-RC[-13]*RC[-12])/1000 -> 5.6834521999999987 | U35: 28.42 | V35: - | W35: =RC[-2]*RC[-10]/1000 -> 1.9419386000000001 | X35: =ABS((RC[-3]*RC[-11]-RC[-2]*RC[-9])/1000) -> #VALUE! | Y35: =(RC[-14]-RC[1])/RC[-18]*100 -> -0.13300820217246972 | Z35: 28.42 | AC35: =VALUE(RC[-27]) -> 2018-10-14T00:00:00.000 | AD35: =IF(RC[21]=42,"*",IF(RC[21]=32,"",RC[21])) -> - | AE35: =RC[-28] -> 24 | AF35: =RC[-28] -> 163.57 | AG35: =RC[-28] -> 70.430000000000007 | AH35: =RC[-28] -> 7.96 | AI35: =RC[-28] -> 135.33000000000001 | AJ35: =RC[-28] -> 43.13 | AK35: =RC[-28] -> 5.51 | AL35: =RC[-28] -> 27.300000000000004 | AM35: =RC[-28] -> 28.24 | AN35: =RC[-28] -> 29.05 | AO35: =RC[-28] -> 68.33 | AP35: - | AQ35: =RC[-29] -> 0 | AR35: =RC[-29] -> 0 | AS35: - | AT35: =RC[-30] -> 0 | AU35: =RC[-30] -> 0 | AV35: =RC[-30] -> 1.9450000000000001 | AW35: =RC[-30] -> 5.6849999999999996 | AY35: - | AZ35: - | BA35: -
A36: =IF(RC[1]="","",DATEVALUE(RC[1])) -> 43388 | B36: 15.10.18 | C36: 24 | D36: 160.08000000000001 | E36: 69.92 | F36: 8.07 | G36: 139.19999999999999 | H36: 43.63 | I36: 5.48 | J36: =RC[-5]-RC[-2] -> 26.29 | K36: 20.88 | L36: 21.72 | M36: 67.38 | R36: 1.4319999999999999 | S36: 5.1219999999999999 | T36: =(RC[-16]*RC[-15]-RC[-13]*RC[-12])/1000 -> 5.1194976000000008 | U36: 21.29 | V36: - | W36: =RC[-2]*RC[-10]/1000 -> 1.4345201999999999 | X36: =ABS((RC[-3]*RC[-11]-RC[-2]*RC[-9])/1000) -> #VALUE! | Y36: =(RC[-14]-RC[1])/RC[-18]*100 -> -0.29454022988505757 | Z36: 21.29 | AC36: =VALUE(RC[-27]) -> 2018-10-15T00:00:00.000 | AD36: =IF(RC[21]=42,"*",IF(RC[21]=32,"",RC[21])) -> - | AE36: =RC[-28] -> 24 | AF36: =RC[-28] -> 160.08000000000001 | AG36: =RC[-28] -> 69.92 | AH36: =RC[-28] -> 8.07 | AI36: =RC[-28] -> 139.19999999999999 | AJ36: =RC[-28] -> 43.63 | AK36: =RC[-28] -> 5.48 | AL36: =RC[-28] -> 26.29 | AM36: =RC[-28] -> 20.88 | AN36: =RC[-28] -> 21.72 | AO36: =RC[-28] -> 67.38 | AP36: - | AQ36: =RC[-29] -> 0 | AR36: =RC[-29] -> 0 | AS36: - | AT36: =RC[-30] -> 0 | AU36: =RC[-30] -> 0 | AV36: =RC[-30] -> 1.4319999999999999 | AW36: =RC[-30] -> 5.1219999999999999 | AY36: - | AZ36: - | BA36: -
A37: =IF(RC[1]="","",DATEVALUE(RC[1])) -> 43389 | B37: 16.10.18 | C37: 24 | D37: 160.1 | E37: 69.95 | F37: 8.0299999999999994 | G37: 138.71 | H37: 43.53 | I37: 5.43 | J37: =RC[-5]-RC[-2] -> 26.42 | K37: 21.39 | L37: 22.3 | M37: 67.41 | R37: 1.474 | S37: 5.1639999999999997 | T37: =(RC[-16]*RC[-15]-RC[-13]*RC[-12])/1000 -> 5.1609486999999996 | U37: 21.85 | V37: - | W37: =RC[-2]*RC[-10]/1000 -> 1.4729085 | X37: =ABS((RC[-3]*RC[-11]-RC[-2]*RC[-9])/1000) -> #VALUE! | Y37: =(RC[-14]-RC[1])/RC[-18]*100 -> -0.33162713575084768 | Z37: 21.85 | AC37: =VALUE(RC[-27]) -> 2018-10-16T00:00:00.000 | AD37: =IF(RC[21]=42,"*",IF(RC[21]=32,"",RC[21])) -> - | AE37: =RC[-28] -> 24 | AF37: =RC[-28] -> 160.1 | AG37: =RC[-28] -> 69.95 | AH37: =RC[-28] -> 8.0299999999999994 | AI37: =RC[-28] -> 138.71 | AJ37: =RC[-28] -> 43.53 | AK37: =RC[-28] -> 5.43 | AL37: =RC[-28] -> 26.42 | AM37: =RC[-28] -> 21.39 | AN37: =RC[-28] -> 22.3 | AO37: =RC[-28] -> 67.41 | AP37: - | AQ37: =RC[-29] -> 0 | AR37: =RC[-29] -> 0 | AS37: - | AT37: =RC[-30] -> 0 | AU37: =RC[-30] -> 0 | AV37: =RC[-30] -> 1.474 | AW37: =RC[-30] -> 5.1639999999999997 | AY37: - | AZ37: - | BA37: -
A38: =IF(RC[1]="","",DATEVALUE(RC[1])) -> 43390 | B38: 17.10.18 | C38: 24 | D38: 161.80000000000001 | E38: 70.150000000000006 | F38: 8.1300000000000008 | G38: 139.55000000000001 | H38: 43.73 | I38: 5.41 | J38: =RC[-5]-RC[-2] -> 26.420000000000009 | K38: 22.25 | L38: 23.21 | M38: 67.87 | R38: 1.544 | S38: 5.2519999999999998 | T38: =(RC[-16]*RC[-15]-RC[-13]*RC[-12])/1000 -> 5.2477485000000028 | U38: 22.74 | V38: - | W38: =RC[-2]*RC[-10]/1000 -> 1.5433638000000001 | X38: =ABS((RC[-3]*RC[-11]-RC[-2]*RC[-9])/1000) -> #VALUE! | Y38: =(RC[-14]-RC[1])/RC[-18]*100 -> -0.35112862773199455 | Z38: 22.74 | AC38: =VALUE(RC[-27]) -> 2018-10-17T00:00:00.000 | AD38: =IF(RC[21]=42,"*",IF(RC[21]=32,"",RC[21])) -> - | AE38: =RC[-28] -> 24 | AF38: =RC[-28] -> 161.80000000000001 | AG38: =RC[-28] -> 70.150000000000006 | AH38: =RC[-28] -> 8.1300000000000008 | AI38: =RC[-28] -> 139.55000000000001 | AJ38: =RC[-28] -> 43.73 | AK38: =RC[-28] -> 5.41 | AL38: =RC[-28] -> 26.420000000000009 | AM38: =RC[-28] -> 22.25 | AN38: =RC[-28] -> 23.21 | AO38: =RC[-28] -> 67.87 | AP38: - | AQ38: =RC[-29] -> 0 | AR38: =RC[-29] -> 0 | AS38: - | AT38: =RC[-30] -> 0 | AU38: =RC[-30] -> 0 | AV38: =RC[-30] -> 1.544 | AW38: =RC[-30] -> 5.2519999999999998 | AY38: - | AZ38: - | BA38: -
A39: =IF(RC[1]="","",DATEVALUE(RC[1])) -> 43391 | B39: 18.10.18 | C39: 24 | D39: 161.62 | E39: 70.61 | F39: 8.16 | G39: 139.47 | H39: 43.94 | I39: 5.45 | J39: 26.67 | K39: 22.15 | L39: 22.96 | M39: 68.290000000000006 | R39: 1.5349999999999999 | S39: 5.2869999999999999 | T39: 5.2836764000000001 | U39: 22.48 | V39: - | W39: 1.5351592000000003 | X39: #VALUE! | Y39: -0.2366100236610037 | Z39: 22.48 | AC39: =VALUE(RC[-27]) -> 2018-10-18T00:00:00.000 | AD39: =IF(RC[21]=42,"*",IF(RC[21]=32,"",RC[21])) ->  | AE39: =RC[-28] -> 24 | AF39: =RC[-28] -> 161.62 | AG39: =RC[-28] -> 70.61 | AH39: =RC[-28] -> 8.16 | AI39: =RC[-28] -> 139.47 | AJ39: =RC[-28] -> 43.94 | AK39: =RC[-28] -> 5.45 | AL39: =RC[-28] -> 26.67 | AM39: =RC[-28] -> 22.15 | AN39: =RC[-28] -> 22.96 | AO39: =RC[-28] -> 68.290000000000006 | AP39: - | AQ39: =RC[-29] -> 0 | AR39: =RC[-29] -> 0 | AS39: - | AT39: =RC[-30] -> 0 | AU39: =RC[-30] -> 0 | AV39: =RC[-30] -> 1.5349999999999999 | AW39: =RC[-30] -> 5.2869999999999999
A40: =IF(RC[1]="","",DATEVALUE(RC[1])) -> 43392 | B40: 19.10.18 | C40: 24 | D40: 162.02000000000001 | E40: 70.41 | F40: 8.18 | G40: 139.72999999999999 | H40: 43.39 | I40: 5.46 | J40: 27.019999999999996 | K40: 22.29 | L40: 23.16 | M40: 67.92 | R40: 1.5409999999999999 | S40: 5.3479999999999999 | T40: 5.3449435000000003 | U40: 22.71 | V40: - | W40: 1.5424632 | X40: #VALUE! | Y40: -0.30057968940098884 | Z40: 22.71 | AC40: =VALUE(RC[-27]) -> 2018-10-19T00:00:00.000 | AD40: =IF(RC[21]=42,"*",IF(RC[21]=32,"",RC[21])) ->  | AE40: =RC[-28] -> 24 | AF40: =RC[-28] -> 162.02000000000001 | AG40: =RC[-28] -> 70.41 | AH40: =RC[-28] -> 8.18 | AI40: =RC[-28] -> 139.72999999999999 | AJ40: =RC[-28] -> 43.39 | AK40: =RC[-28] -> 5.46 | AL40: =RC[-28] -> 27.019999999999996 | AM40: =RC[-28] -> 22.29 | AN40: =RC[-28] -> 23.16 | AO40: =RC[-28] -> 67.92 | AP40: - | AQ40: =RC[-29] -> 0 | AR40: =RC[-29] -> 0 | AS40: - | AT40: =RC[-30] -> 0 | AU40: =RC[-30] -> 0 | AV40: =RC[-30] -> 1.5409999999999999 | AW40: =RC[-30] -> 5.3479999999999999
A41: =IF(RC[1]="","",DATEVALUE(RC[1])) -> 43393 | B41: 20.10.18 | C41: 24 | D41: 159.16 | E41: 69.81 | F41: 8.0399999999999991 | G41: 133.93 | H41: 42.16 | I41: 5.54 | J41: 27.650000000000006 | K41: 25.23 | L41: 26.04 | M41: 67.47 | R41: 1.72 | S41: 5.468 | T41: 5.4644708 | U41: 25.49 | V41: - | W41: 1.7198102999999998 | X41: #VALUE! | Y41: -0.1941312625998641 | Z41: 25.49 | AC41: =VALUE(RC[-27]) -> 2018-10-20T00:00:00.000 | AD41: =IF(RC[21]=42,"*",IF(RC[21]=32,"",RC[21])) ->  | AE41: =RC[-28] -> 24 | AF41: =RC[-28] -> 159.16 | AG41: =RC[-28] -> 69.81 | AH41: =RC[-28] -> 8.0399999999999991 | AI41: =RC[-28] -> 133.93 | AJ41: =RC[-28] -> 42.16 | AK41: =RC[-28] -> 5.54 | AL41: =RC[-28] -> 27.650000000000006 | AM41: =RC[-28] -> 25.23 | AN41: =RC[-28] -> 26.04 | AO41: =RC[-28] -> 67.47 | AP41: - | AQ41: =RC[-29] -> 0 | AR41: =RC[-29] -> 0 | AS41: - | AT41: =RC[-30] -> 0 | AU41: =RC[-30] -> 0 | AV41: =RC[-30] -> 1.72 | AW41: =RC[-30] -> 5.468
A42: =IF(RC[1]="","",DATEVALUE(RC[1])) -> 43394 | B42: 21.10.18 | C42: 24 | D42: 163.76 | E42: 68.930000000000007 | F42: 8.0299999999999994 | G42: 132.77000000000001 | H42: 41.56 | I42: 5.56 | J42: 27.370000000000005 | K42: 30.99 | L42: 31.88 | M42: 66.53 | R42: 2.08 | S42: 5.7750000000000004 | T42: 5.7700556000000001 | U42: 31.24 | V42: - | W42: 2.0783971999999999 | X42: #VALUE! | Y42: -0.18829554869322887 | Z42: 31.24 | AC42: =VALUE(RC[-27]) -> 2018-10-21T00:00:00.000 | AD42: =IF(RC[21]=42,"*",IF(RC[21]=32,"",RC[21])) ->  | AE42: =RC[-28] -> 24 | AF42: =RC[-28] -> 163.76 | AG42: =RC[-28] -> 68.930000000000007 | AH42: =RC[-28] -> 8.0299999999999994 | AI42: =RC[-28] -> 132.77000000000001 | AJ42: =RC[-28] -> 41.56 | AK42: =RC[-28] -> 5.56 | AL42: =RC[-28] -> 27.370000000000005 | AM42: =RC[-28] -> 30.99 | AN42: =RC[-28] -> 31.88 | AO42: =RC[-28] -> 66.53 | AP42: - | AQ42: =RC[-29] -> 0 | AR42: =RC[-29] -> 0 | AS42: - | AT42: =RC[-30] -> 0 | AU42: =RC[-30] -> 0 | AV42: =RC[-30] -> 2.08 | AW42: =RC[-30] -> 5.7750000000000004
A43: =IF(RC[1]="","",DATEVALUE(RC[1])) -> 43395 | B43: 22.10.18 | C43: 24 | D43: 155.01 | E43: 69.39 | F43: 8.01 | G43: 131.72999999999999 | H43: 41.55 | I43: 5.59 | J43: 27.840000000000003 | K43: 23.28 | L43: 24.18 | M43: 67.17 | R43: 1.5920000000000001 | S43: 5.2830000000000004 | T43: 5.2827623999999993 | U43: 23.68 | V43: - | W43: 1.5905856 | X43: #VALUE! | Y43: -0.30365140818340441 | Z43: 23.68 | AC43: =VALUE(RC[-27]) -> 2018-10-22T00:00:00.000 | AD43: =IF(RC[21]=42,"*",IF(RC[21]=32,"",RC[21])) ->  | AE43: =RC[-28] -> 24 | AF43: =RC[-28] -> 155.01 | AG43: =RC[-28] -> 69.39 | AH43: =RC[-28] -> 8.01 | AI43: =RC[-28] -> 131.72999999999999 | AJ43: =RC[-28] -> 41.55 | AK43: =RC[-28] -> 5.59 | AL43: =RC[-28] -> 27.840000000000003 | AM43: =RC[-28] -> 23.28 | AN43: =RC[-28] -> 24.18 | AO43: =RC[-28] -> 67.17 | AP43: - | AQ43: =RC[-29] -> 0 | AR43: =RC[-29] -> 0 | AS43: - | AT43: =RC[-30] -> 0 | AU43: =RC[-30] -> 0 | AV43: =RC[-30] -> 1.5920000000000001 | AW43: =RC[-30] -> 5.2830000000000004
A44: =IF(RC[1]="","",DATEVALUE(RC[1])) ->  | C44: 24 | J44: =RC[-5]-RC[-2] -> #VALUE! | T44: =(RC[-16]*RC[-15]-RC[-13]*RC[-12])/1000 -> #VALUE! | W44: =RC[-2]*RC[-10]/1000 -> #VALUE! | X44: =ABS((RC[-3]*RC[-11]-RC[-2]*RC[-9])/1000) -> #VALUE! | Y44: =(RC[-14]-RC[1])/RC[-18]*100 -> #VALUE! | AC44: =VALUE(RC[-27]) -> #VALUE! | AD44: =IF(RC[21]=42,"*",IF(RC[21]=32,"",RC[21])) ->  | AE44: =RC[-28] -> 24 | AF44: =RC[-28] ->  | AG44: =RC[-28] ->  | AH44: =RC[-28] ->  | AI44: =RC[-28] ->  | AJ44: =RC[-28] ->  | AK44: =RC[-28] ->  | AL44: =RC[-28] -> #VALUE! | AM44: =RC[-28] ->  | AN44: =RC[-28] ->  | AO44: =RC[-28] ->  | AP44: - | AQ44: =RC[-29] -> 0 | AR44: =RC[-29] -> 0 | AS44: - | AT44: =RC[-30] -> 0 | AU44: =RC[-30] -> 0 | AV44: =RC[-30] ->  | AW44: =RC[-30] -> 
A45: =IF(RC[1]="","",DATEVALUE(RC[1])) ->  | C45: 24 | T45: =(RC[-16]*RC[-15]-RC[-13]*RC[-12])/1000 -> #VALUE! | W45: =RC[-2]*RC[-10]/1000 -> #VALUE! | X45: =ABS((RC[-3]*RC[-11]-RC[-2]*RC[-9])/1000) -> #VALUE! | Y45: =(RC[-14]-RC[1])/RC[-18]*100 -> #VALUE! | AC45: =VALUE(RC[-27]) -> #VALUE! | AD45: =IF(RC[21]=42,"*",IF(RC[21]=32,"",RC[21])) ->  | AE45: =RC[-28] -> 24 | AF45: =RC[-28] ->  | AG45: =RC[-28] ->  | AH45: =RC[-28] ->  | AI45: =RC[-28] ->  | AJ45: =RC[-28] ->  | AK45: =RC[-28] ->  | AL45: =RC[-28] -> 0 | AM45: =RC[-28] ->  | AN45: =RC[-28] ->  | AO45: =RC[-28] ->  | AP45: - | AQ45: =RC[-29] -> 0 | AR45: =RC[-29] -> 0 | AS45: - | AT45: =RC[-30] -> 0 | AU45: =RC[-30] -> 0 | AV45: =RC[-30] ->  | AW45: =RC[-30] -> 
A46: =IF(RC[1]="","",DATEVALUE(RC[1])) ->  | C46: 24 | T46: =(RC[-16]*RC[-15]-RC[-13]*RC[-12])/1000 -> #VALUE! | W46: =RC[-2]*RC[-10]/1000 -> #VALUE! | X46: =ABS((RC[-3]*RC[-11]-RC[-2]*RC[-9])/1000) -> #VALUE! | Y46: =(RC[-14]-RC[1])/RC[-18]*100 -> #VALUE! | AC46: =VALUE(RC[-27]) -> #VALUE! | AD46: =IF(RC[21]=42,"*",IF(RC[21]=32,"",RC[21])) ->  | AE46: =RC[-28] -> 24 | AF46: =RC[-28] ->  | AG46: =RC[-28] ->  | AH46: =RC[-28] ->  | AI46: =RC[-28] ->  | AJ46: =RC[-28] ->  | AK46: =RC[-28] ->  | AL46: =RC[-28] -> 0 | AM46: =RC[-28] ->  | AN46: =RC[-28] ->  | AO46: =RC[-28] ->  | AP46: - | AQ46: =RC[-29] -> 0 | AR46: =RC[-29] -> 0 | AS46: - | AT46: =RC[-30] -> 0 | AU46: =RC[-30] -> 0 | AV46: =RC[-30] ->  | AW46: =RC[-30] -> 
A47: =IF(RC[1]="","",DATEVALUE(RC[1])) ->  | C47: 24 | T47: =(RC[-16]*RC[-15]-RC[-13]*RC[-12])/1000 -> #VALUE! | W47: =RC[-2]*RC[-10]/1000 -> #VALUE! | X47: =ABS((RC[-3]*RC[-11]-RC[-2]*RC[-9])/1000) -> #VALUE! | Y47: =(RC[-14]-RC[1])/RC[-18]*100 -> #VALUE! | AC47: =VALUE(RC[-27]) -> #VALUE! | AD47: =IF(RC[21]=42,"*",IF(RC[21]=32,"",RC[21])) ->  | AE47: =RC[-28] -> 24 | AF47: =RC[-28] ->  | AG47: =RC[-28] ->  | AH47: =RC[-28] ->  | AI47: =RC[-28] ->  | AJ47: =RC[-28] ->  | AK47: =RC[-28] ->  | AL47: =RC[-28] -> 0 | AM47: =RC[-28] ->  | AN47: =RC[-28] ->  | AO47: =RC[-28] ->  | AP47: - | AQ47: =RC[-29] -> 0 | AR47: =RC[-29] -> 0 | AS47: - | AT47: =RC[-30] -> 0 | AU47: =RC[-30] -> 0 | AV47: =RC[-30] ->  | AW47: =RC[-30] -> 
A48: =IF(RC[1]="","",DATEVALUE(RC[1])) ->  | C48: 24 | T48: =(RC[-16]*RC[-15]-RC[-13]*RC[-12])/1000 -> #VALUE! | W48: =RC[-2]*RC[-10]/1000 -> #VALUE! | X48: =ABS((RC[-3]*RC[-11]-RC[-2]*RC[-9])/1000) -> #VALUE! | Y48: =(RC[-14]-RC[1])/RC[-18]*100 -> #VALUE! | AC48: =VALUE(RC[-27]) -> #VALUE! | AD48: =IF(RC[21]=42,"*",IF(RC[21]=32,"",RC[21])) ->  | AE48: =RC[-28] -> 24 | AF48: =RC[-28] ->  | AG48: =RC[-28] ->  | AH48: =RC[-28] ->  | AI48: =RC[-28] ->  | AJ48: =RC[-28] ->  | AK48: =RC[-28] ->  | AL48: =RC[-28] -> 0 | AM48: =RC[-28] ->  | AN48: =RC[-28] ->  | AO48: =RC[-28] ->  | AP48: - | AQ48: =RC[-29] -> 0 | AR48: =RC[-29] -> 0 | AS48: - | AT48: =RC[-30] -> 0 | AU48: =RC[-30] -> 0 | AV48: =RC[-30] ->  | AW48: =RC[-30] -> 
A49: =IF(RC[1]="","",DATEVALUE(RC[1])) ->  | C49: 24 | T49: =(RC[-16]*RC[-15]-RC[-13]*RC[-12])/1000 -> #VALUE! | W49: =RC[-2]*RC[-10]/1000 -> #VALUE! | X49: =ABS((RC[-3]*RC[-11]-RC[-2]*RC[-9])/1000) -> #VALUE! | Y49: =(RC[-14]-RC[1])/RC[-18]*100 -> #VALUE! | AC49: =VALUE(RC[-27]) -> #VALUE! | AD49: =IF(RC[21]=42,"*",IF(RC[21]=32,"",RC[21])) ->  | AE49: =RC[-28] -> 24 | AF49: =RC[-28] ->  | AG49: =RC[-28] ->  | AH49: =RC[-28] ->  | AI49: =RC[-28] ->  | AJ49: =RC[-28] ->  | AK49: =RC[-28] ->  | AL49: =RC[-28] -> 0 | AM49: =RC[-28] ->  | AN49: =RC[-28] ->  | AO49: =RC[-28] ->  | AP49: - | AQ49: =RC[-29] -> 0 | AR49: =RC[-29] -> 0 | AS49: - | AT49: =RC[-30] -> 0 | AU49: =RC[-30] -> 0 | AV49: =RC[-30] ->  | AW49: =RC[-30] -> 
A50: =IF(RC[1]="","",DATEVALUE(RC[1])) ->  | T50: =(RC[-16]*RC[-15]-RC[-13]*RC[-12])/1000 -> #VALUE! | W50: =RC[-2]*RC[-10]/1000 -> #VALUE! | X50: =ABS((RC[-3]*RC[-11]-RC[-2]*RC[-9])/1000) -> #VALUE! | Y50: =(RC[-14]-RC[1])/RC[-18]*100 -> #VALUE! | AC50: =VALUE(RC[-27]) -> #VALUE! | AD50: =IF(RC[21]=42,"*",IF(RC[21]=32,"",RC[21])) ->  | AE50: =RC[-28] ->  | AF50: =RC[-28] ->  | AG50: =RC[-28] ->  | AH50: =RC[-28] ->  | AI50: =RC[-28] ->  | AJ50: =RC[-28] ->  | AK50: =RC[-28] ->  | AL50: =RC[-28] -> 0 | AM50: =RC[-28] ->  | AN50: =RC[-28] ->  | AO50: =RC[-28] ->  | AP50: - | AQ50: =RC[-29] -> 0 | AR50: =RC[-29] -> 0 | AS50: - | AT50: =RC[-30] -> 0 | AU50: =RC[-30] -> 0 | AV50: =RC[-30] ->  | AW50: =RC[-30] -> 
A51: =IF(RC[1]="","",DATEVALUE(RC[1])) ->  | T51: =(RC[-16]*RC[-15]-RC[-13]*RC[-12])/1000 -> #VALUE! | W51: =RC[-2]*RC[-10]/1000 -> #VALUE! | X51: =ABS((RC[-3]*RC[-11]-RC[-2]*RC[-9])/1000) -> #VALUE! | Y51: =(RC[-14]-RC[1])/RC[-18]*100 -> #VALUE! | AC51: =VALUE(RC[-27]) -> #VALUE! | AD51: =IF(RC[21]=42,"*",IF(RC[21]=32,"",RC[21])) ->  | AE51: =RC[-28] ->  | AF51: =RC[-28] ->  | AG51: =RC[-28] ->  | AH51: =RC[-28] ->  | AI51: =RC[-28] ->  | AJ51: =RC[-28] ->  | AK51: =RC[-28] ->  | AL51: =RC[-28] -> 0 | AM51: =RC[-28] ->  | AN51: =RC[-28] ->  | AO51: =RC[-28] ->  | AP51: - | AQ51: =RC[-29] -> 0 | AR51: =RC[-29] -> 0 | AS51: - | AT51: =RC[-30] -> 0 | AU51: =RC[-30] -> 0 | AV51: =RC[-30] ->  | AW51: =RC[-30] -> 
A52: =IF(RC[1]="","",DATEVALUE(RC[1])) ->  | T52: =(RC[-16]*RC[-15]-RC[-13]*RC[-12])/1000 -> #VALUE! | W52: =RC[-2]*RC[-10]/1000 -> #VALUE! | X52: =ABS((RC[-3]*RC[-11]-RC[-2]*RC[-9])/1000) -> #VALUE! | Y52: =(RC[-14]-RC[1])/RC[-18]*100 -> #VALUE! | AC52: =VALUE(RC[-27]) -> #VALUE! | AD52: =IF(RC[21]=42,"*",IF(RC[21]=32,"",RC[21])) ->  | AE52: =RC[-28] ->  | AF52: =RC[-28] ->  | AG52: =RC[-28] ->  | AH52: =RC[-28] ->  | AI52: =RC[-28] ->  | AJ52: =RC[-28] ->  | AK52: =RC[-28] ->  | AL52: =RC[-28] -> 0 | AM52: =RC[-28] ->  | AN52: =RC[-28] ->  | AO52: =RC[-28] ->  | AP52: - | AQ52: =RC[-29] -> 0 | AR52: =RC[-29] -> 0 | AS52: - | AT52: =RC[-30] -> 0 | AU52: =RC[-30] -> 0 | AV52: =RC[-30] ->  | AW52: =RC[-30] -> 
A53: =IF(RC[1]="","",DATEVALUE(RC[1])) ->  | T53: =(RC[-16]*RC[-15]-RC[-13]*RC[-12])/1000 -> #VALUE! | W53: =RC[-2]*RC[-10]/1000 -> #VALUE! | X53: =ABS((RC[-3]*RC[-11]-RC[-2]*RC[-9])/1000) -> #VALUE! | Y53: =(RC[-14]-RC[1])/RC[-18]*100 -> #VALUE! | AC53: =VALUE(RC[-27]) -> #VALUE! | AD53: =IF(RC[21]=42,"*",IF(RC[21]=32,"",RC[21])) ->  | AE53: =RC[-28] ->  | AF53: =RC[-28] ->  | AG53: =RC[-28] ->  | AH53: =RC[-28] ->  | AI53: =RC[-28] ->  | AJ53: =RC[-28] ->  | AK53: =RC[-28] ->  | AL53: =RC[-28] -> 0 | AM53: =RC[-28] ->  | AN53: =RC[-28] ->  | AO53: =RC[-28] ->  | AP53: - | AQ53: =RC[-29] -> 0 | AR53: =RC[-29] -> 0 | AS53: - | AT53: =RC[-30] -> 0 | AU53: =RC[-30] -> 0 | AV53: =RC[-30] ->  | AW53: =RC[-30] -> 
A54: =IF(RC[1]="","",DATEVALUE(RC[1])) ->  | T54: =(RC[-16]*RC[-15]-RC[-13]*RC[-12])/1000 -> #VALUE! | W54: =RC[-2]*RC[-10]/1000 -> #VALUE! | X54: =ABS((RC[-3]*RC[-11]-RC[-2]*RC[-9])/1000) -> #VALUE! | Y54: =(RC[-14]-RC[1])/RC[-18]*100 -> #VALUE! | AC54: =VALUE(RC[-27]) -> #VALUE! | AD54: =IF(RC[21]=42,"*",IF(RC[21]=32,"",RC[21])) ->  | AE54: =RC[-28] ->  | AF54: =RC[-28] ->  | AG54: =RC[-28] ->  | AH54: =RC[-28] ->  | AI54: =RC[-28] ->  | AJ54: =RC[-28] ->  | AK54: =RC[-28] ->  | AL54: =RC[-28] -> 0 | AM54: =RC[-28] ->  | AN54: =RC[-28] ->  | AO54: =RC[-28] ->  | AP54: - | AQ54: =RC[-29] -> 0 | AR54: =RC[-29] -> 0 | AS54: - | AT54: =RC[-30] -> 0 | AU54: =RC[-30] -> 0 | AV54: =RC[-30] ->  | AW54: =RC[-30] -> 
A55: =IF(RC[1]="","",DATEVALUE(RC[1])) ->  | T55: =(RC[-16]*RC[-15]-RC[-13]*RC[-12])/1000 -> #VALUE! | W55: =RC[-2]*RC[-10]/1000 -> #VALUE! | X55: =ABS((RC[-3]*RC[-11]-RC[-2]*RC[-9])/1000) -> #VALUE! | Y55: =(RC[-14]-RC[1])/RC[-18]*100 -> #VALUE! | AC55: =VALUE(RC[-27]) -> #VALUE! | AD55: =IF(RC[21]=42,"*",IF(RC[21]=32,"",RC[21])) ->  | AE55: =RC[-28] ->  | AF55: =RC[-28] ->  | AG55: =RC[-28] ->  | AH55: =RC[-28] ->  | AI55: =RC[-28] ->  | AJ55: =RC[-28] ->  | AK55: =RC[-28] ->  | AL55: =RC[-28] -> 0 | AM55: =RC[-28] ->  | AN55: =RC[-28] ->  | AO55: =RC[-28] ->  | AP55: - | AQ55: =RC[-29] -> 0 | AR55: =RC[-29] -> 0 | AS55: - | AT55: =RC[-30] -> 0 | AU55: =RC[-30] -> 0 | AV55: =RC[-30] ->  | AW55: =RC[-30] -> 
A56: =IF(RC[1]="","",DATEVALUE(RC[1])) ->  | T56: =(RC[-16]*RC[-15]-RC[-13]*RC[-12])/1000 -> #VALUE! | W56: =RC[-2]*RC[-10]/1000 -> #VALUE! | X56: =ABS((RC[-3]*RC[-11]-RC[-2]*RC[-9])/1000) -> #VALUE! | Y56: =(RC[-14]-RC[1])/RC[-18]*100 -> #VALUE! | AC56: =VALUE(RC[-27]) -> #VALUE! | AD56: =IF(RC[21]=42,"*",IF(RC[21]=32,"",RC[21])) ->  | AE56: =RC[-28] ->  | AF56: =RC[-28] ->  | AG56: =RC[-28] ->  | AH56: =RC[-28] ->  | AI56: =RC[-28] ->  | AJ56: =RC[-28] ->  | AK56: =RC[-28] ->  | AL56: =RC[-28] -> 0 | AM56: =RC[-28] ->  | AN56: =RC[-28] ->  | AO56: =RC[-28] ->  | AP56: - | AQ56: =RC[-29] -> 0 | AR56: =RC[-29] -> 0 | AS56: - | AT56: =RC[-30] -> 0 | AU56: =RC[-30] -> 0 | AV56: =RC[-30] ->  | AW56: =RC[-30] -> 
A57: =IF(RC[1]="","",DATEVALUE(RC[1])) ->  | T57: =(RC[-16]*RC[-15]-RC[-13]*RC[-12])/1000 -> #VALUE! | W57: =RC[-2]*RC[-10]/1000 -> #VALUE! | X57: =ABS((RC[-3]*RC[-11]-RC[-2]*RC[-9])/1000) -> #VALUE! | Y57: =(RC[-14]-RC[1])/RC[-18]*100 -> #VALUE! | AC57: =VALUE(RC[-27]) -> #VALUE! | AD57: =IF(RC[21]=42,"*",IF(RC[21]=32,"",RC[21])) ->  | AE57: =RC[-28] ->  | AF57: =RC[-28] ->  | AG57: =RC[-28] ->  | AH57: =RC[-28] ->  | AI57: =RC[-28] ->  | AJ57: =RC[-28] ->  | AK57: =RC[-28] ->  | AL57: =RC[-28] -> 0 | AM57: =RC[-28] ->  | AN57: =RC[-28] ->  | AO57: =RC[-28] ->  | AP57: - | AQ57: =RC[-29] -> 0 | AR57: =RC[-29] -> 0 | AS57: - | AT57: =RC[-30] -> 0 | AU57: =RC[-30] -> 0 | AV57: =RC[-30] ->  | AW57: =RC[-30] -> 
A58: =IF(RC[1]="","",DATEVALUE(RC[1])) ->  | T58: =(RC[-16]*RC[-15]-RC[-13]*RC[-12])/1000 -> #VALUE! | W58: =RC[-2]*RC[-10]/1000 -> #VALUE! | X58: =ABS((RC[-3]*RC[-11]-RC[-2]*RC[-9])/1000) -> #VALUE! | Y58: =(RC[-14]-RC[1])/RC[-18]*100 -> #VALUE! | AC58: =VALUE(RC[-27]) -> #VALUE! | AD58: =IF(RC[21]=42,"*",IF(RC[21]=32,"",RC[21])) ->  | AE58: =RC[-28] ->  | AF58: =RC[-28] ->  | AG58: =RC[-28] ->  | AH58: =RC[-28] ->  | AI58: =RC[-28] ->  | AJ58: =RC[-28] ->  | AK58: =RC[-28] ->  | AL58: =RC[-28] -> 0 | AM58: =RC[-28] ->  | AN58: =RC[-28] ->  | AO58: =RC[-28] ->  | AP58: - | AQ58: =RC[-29] -> 0 | AR58: =RC[-29] -> 0 | AS58: - | AT58: =RC[-30] -> 0 | AU58: =RC[-30] -> 0 | AV58: =RC[-30] ->  | AW58: =RC[-30] -> 
A59: =IF(RC[1]="","",DATEVALUE(RC[1])) ->  | T59: =(RC[-16]*RC[-15]-RC[-13]*RC[-12])/1000 -> #VALUE! | W59: =RC[-2]*RC[-10]/1000 -> #VALUE! | X59: =ABS((RC[-3]*RC[-11]-RC[-2]*RC[-9])/1000) -> #VALUE! | Y59: =(RC[-14]-RC[1])/RC[-18]*100 -> #VALUE! | AC59: =VALUE(RC[-27]) -> #VALUE! | AD59: =IF(RC[21]=42,"*",IF(RC[21]=32,"",RC[21])) ->  | AE59: =RC[-28] ->  | AF59: =RC[-28] ->  | AG59: =RC[-28] ->  | AH59: =RC[-28] ->  | AI59: =RC[-28] ->  | AJ59: =RC[-28] ->  | AK59: =RC[-28] ->  | AL59: =RC[-28] -> 0 | AM59: =RC[-28] ->  | AN59: =RC[-28] ->  | AO59: =RC[-28] ->  | AP59: - | AQ59: =RC[-29] -> 0 | AR59: =RC[-29] -> 0 | AS59: - | AT59: =RC[-30] -> 0 | AU59: =RC[-30] -> 0 | AV59: =RC[-30] ->  | AW59: =RC[-30] -> 
A60: =IF(RC[1]="","",DATEVALUE(RC[1])) ->  | T60: =(RC[-16]*RC[-15]-RC[-13]*RC[-12])/1000 -> #VALUE! | W60: =RC[-2]*RC[-10]/1000 -> #VALUE! | X60: =ABS((RC[-3]*RC[-11]-RC[-2]*RC[-9])/1000) -> #VALUE! | Y60: =(RC[-14]-RC[1])/RC[-18]*100 -> #VALUE! | AC60: =VALUE(RC[-27]) -> #VALUE! | AD60: =IF(RC[21]=42,"*",IF(RC[21]=32,"",RC[21])) ->  | AE60: =RC[-28] ->  | AF60: =RC[-28] ->  | AG60: =RC[-28] ->  | AH60: =RC[-28] ->  | AI60: =RC[-28] ->  | AJ60: =RC[-28] ->  | AK60: =RC[-28] ->  | AL60: =RC[-28] -> 0 | AM60: =RC[-28] ->  | AN60: =RC[-28] ->  | AO60: =RC[-28] ->  | AP60: - | AQ60: =RC[-29] -> 0 | AR60: =RC[-29] -> 0 | AS60: - | AT60: =RC[-30] -> 0 | AU60: =RC[-30] -> 0 | AV60: =RC[-30] ->  | AW60: =RC[-30] -> 
A61: =IF(RC[1]="","",DATEVALUE(RC[1])) ->  | T61: =(RC[-16]*RC[-15]-RC[-13]*RC[-12])/1000 -> #VALUE! | W61: =RC[-2]*RC[-10]/1000 -> #VALUE! | X61: =ABS((RC[-3]*RC[-11]-RC[-2]*RC[-9])/1000) -> #VALUE! | Y61: =(RC[-14]-RC[1])/RC[-18]*100 -> #VALUE! | AC61: =VALUE(RC[-27]) -> #VALUE! | AD61: =IF(RC[21]=42,"*",IF(RC[21]=32,"",RC[21])) ->  | AE61: =RC[-28] ->  | AF61: =RC[-28] ->  | AG61: =RC[-28] ->  | AH61: =RC[-28] ->  | AI61: =RC[-28] ->  | AJ61: =RC[-28] ->  | AK61: =RC[-28] ->  | AL61: =RC[-28] -> 0 | AM61: =RC[-28] ->  | AN61: =RC[-28] ->  | AO61: =RC[-28] ->  | AP61: - | AQ61: =RC[-29] -> 0 | AR61: =RC[-29] -> 0 | AS61: - | AT61: =RC[-30] -> 0 | AU61: =RC[-30] -> 0 | AV61: =RC[-30] ->  | AW61: =RC[-30] -> 
A62: =IF(RC[1]="","",DATEVALUE(RC[1])) ->  | T62: =(RC[-16]*RC[-15]-RC[-13]*RC[-12])/1000 -> #VALUE! | W62: =RC[-2]*RC[-10]/1000 -> #VALUE! | X62: =ABS((RC[-3]*RC[-11]-RC[-2]*RC[-9])/1000) -> #VALUE! | Y62: =(RC[-14]-RC[1])/RC[-18]*100 -> #VALUE! | AC62: =VALUE(RC[-27]) -> #VALUE! | AD62: =IF(RC[21]=42,"*",IF(RC[21]=32,"",RC[21])) ->  | AE62: =RC[-28] ->  | AF62: =RC[-28] ->  | AG62: =RC[-28] ->  | AH62: =RC[-28] ->  | AI62: =RC[-28] ->  | AJ62: =RC[-28] ->  | AK62: =RC[-28] ->  | AL62: =RC[-28] -> 0 | AM62: =RC[-28] ->  | AN62: =RC[-28] ->  | AO62: =RC[-28] ->  | AP62: - | AQ62: =RC[-29] -> 0 | AR62: =RC[-29] -> 0 | AS62: - | AT62: =RC[-30] -> 0 | AU62: =RC[-30] -> 0 | AV62: =RC[-30] ->  | AW62: =RC[-30] -> 
A63: =IF(RC[1]="","",DATEVALUE(RC[1])) ->  | T63: =(RC[-16]*RC[-15]-RC[-13]*RC[-12])/1000 -> #VALUE! | W63: =RC[-2]*RC[-10]/1000 -> #VALUE! | X63: =ABS((RC[-3]*RC[-11]-RC[-2]*RC[-9])/1000) -> #VALUE! | Y63: =(RC[-14]-RC[1])/RC[-18]*100 -> #VALUE! | AC63: =VALUE(RC[-27]) -> #VALUE! | AD63: =IF(RC[21]=42,"*",IF(RC[21]=32,"",RC[21])) ->  | AE63: =RC[-28] ->  | AF63: =RC[-28] ->  | AG63: =RC[-28] ->  | AH63: =RC[-28] ->  | AI63: =RC[-28] ->  | AJ63: =RC[-28] ->  | AK63: =RC[-28] ->  | AL63: =RC[-28] -> 0 | AM63: =RC[-28] ->  | AN63: =RC[-28] ->  | AO63: =RC[-28] ->  | AP63: - | AQ63: =RC[-29] -> 0 | AR63: =RC[-29] -> 0 | AS63: - | AT63: =RC[-30] -> 0 | AU63: =RC[-30] -> 0 | AV63: =RC[-30] ->  | AW63: =RC[-30] -> 
A64: =IF(RC[1]="","",DATEVALUE(RC[1])) ->  | T64: =(RC[-16]*RC[-15]-RC[-13]*RC[-12])/1000 -> #VALUE! | W64: =RC[-2]*RC[-10]/1000 -> #VALUE! | X64: =ABS((RC[-3]*RC[-11]-RC[-2]*RC[-9])/1000) -> #VALUE! | Y64: =(RC[-14]-RC[1])/RC[-18]*100 -> #VALUE! | AC64: =VALUE(RC[-27]) -> #VALUE! | AD64: =IF(RC[21]=42,"*",IF(RC[21]=32,"",RC[21])) ->  | AE64: =RC[-28] ->  | AF64: =RC[-28] ->  | AG64: =RC[-28] ->  | AH64: =RC[-28] ->  | AI64: =RC[-28] ->  | AJ64: =RC[-28] ->  | AK64: =RC[-28] ->  | AL64: =RC[-28] -> 0 | AM64: =RC[-28] ->  | AN64: =RC[-28] ->  | AO64: =RC[-28] ->  | AP64: - | AQ64: =RC[-29] -> 0 | AR64: =RC[-29] -> 0 | AS64: - | AT64: =RC[-30] -> 0 | AU64: =RC[-30] -> 0 | AV64: =RC[-30] ->  | AW64: =RC[-30] -> 
A65: =IF(RC[1]="","",DATEVALUE(RC[1])) ->  | T65: =(RC[-16]*RC[-15]-RC[-13]*RC[-12])/1000 -> #VALUE! | W65: =RC[-2]*RC[-10]/1000 -> #VALUE! | X65: =ABS((RC[-3]*RC[-11]-RC[-2]*RC[-9])/1000) -> #VALUE! | Y65: =(RC[-14]-RC[1])/RC[-18]*100 -> #VALUE! | AC65: =VALUE(RC[-27]) -> #VALUE! | AD65: =IF(RC[21]=42,"*",IF(RC[21]=32,"",RC[21])) ->  | AE65: =RC[-28] ->  | AF65: =RC[-28] ->  | AG65: =RC[-28] ->  | AH65: =RC[-28] ->  | AI65: =RC[-28] ->  | AJ65: =RC[-28] ->  | AK65: =RC[-28] ->  | AL65: =RC[-28] -> 0 | AM65: =RC[-28] ->  | AN65: =RC[-28] ->  | AO65: =RC[-28] ->  | AP65: - | AQ65: =RC[-29] -> 0 | AR65: =RC[-29] -> 0 | AS65: - | AT65: =RC[-30] -> 0 | AU65: =RC[-30] -> 0 | AV65: =RC[-30] ->  | AW65: =RC[-30] -> 
A66: =IF(RC[1]="","",DATEVALUE(RC[1])) ->  | T66: =(RC[-16]*RC[-15]-RC[-13]*RC[-12])/1000 -> #VALUE! | W66: =RC[-2]*RC[-10]/1000 -> #VALUE! | X66: =ABS((RC[-3]*RC[-11]-RC[-2]*RC[-9])/1000) -> #VALUE! | Y66: =(RC[-14]-RC[1])/RC[-18]*100 -> #VALUE! | AC66: =VALUE(RC[-27]) -> #VALUE! | AD66: =IF(RC[21]=42,"*",IF(RC[21]=32,"",RC[21])) ->  | AE66: =RC[-28] ->  | AF66: =RC[-28] ->  | AG66: =RC[-28] ->  | AH66: =RC[-28] ->  | AI66: =RC[-28] ->  | AJ66: =RC[-28] ->  | AK66: =RC[-28] ->  | AL66: =RC[-28] -> 0 | AM66: =RC[-28] ->  | AN66: =RC[-28] ->  | AO66: =RC[-28] ->  | AP66: - | AQ66: =RC[-29] -> 0 | AR66: =RC[-29] -> 0 | AS66: - | AT66: =RC[-30] -> 0 | AU66: =RC[-30] -> 0 | AV66: =RC[-30] ->  | AW66: =RC[-30] -> 
A67: =IF(RC[1]="","",DATEVALUE(RC[1])) ->  | T67: =(RC[-16]*RC[-15]-RC[-13]*RC[-12])/1000 -> #VALUE! | W67: =RC[-2]*RC[-10]/1000 -> #VALUE! | X67: =ABS((RC[-3]*RC[-11]-RC[-2]*RC[-9])/1000) -> #VALUE! | Y67: =(RC[-14]-RC[1])/RC[-18]*100 -> #VALUE! | AC67: =VALUE(RC[-27]) -> #VALUE! | AD67: =IF(RC[21]=42,"*",IF(RC[21]=32,"",RC[21])) ->  | AE67: =RC[-28] ->  | AF67: =RC[-28] ->  | AG67: =RC[-28] ->  | AH67: =RC[-28] ->  | AI67: =RC[-28] ->  | AJ67: =RC[-28] ->  | AK67: =RC[-28] ->  | AL67: =RC[-28] -> 0 | AM67: =RC[-28] ->  | AN67: =RC[-28] ->  | AO67: =RC[-28] ->  | AP67: - | AQ67: =RC[-29] -> 0 | AR67: =RC[-29] -> 0 | AS67: - | AT67: =RC[-30] -> 0 | AU67: =RC[-30] -> 0 | AV67: =RC[-30] ->  | AW67: =RC[-30] -> 
A68: =IF(RC[1]="","",DATEVALUE(RC[1])) ->  | T68: =(RC[-16]*RC[-15]-RC[-13]*RC[-12])/1000 -> #VALUE! | W68: =RC[-2]*RC[-10]/1000 -> #VALUE! | X68: =ABS((RC[-3]*RC[-11]-RC[-2]*RC[-9])/1000) -> #VALUE! | Y68: =(RC[-14]-RC[1])/RC[-18]*100 -> #VALUE! | AC68: =VALUE(RC[-27]) -> #VALUE! | AD68: =IF(RC[21]=42,"*",IF(RC[21]=32,"",RC[21])) ->  | AE68: =RC[-28] ->  | AF68: =RC[-28] ->  | AG68: =RC[-28] ->  | AH68: =RC[-28] ->  | AI68: =RC[-28] ->  | AJ68: =RC[-28] ->  | AK68: =RC[-28] ->  | AL68: =RC[-28] -> 0 | AM68: =RC[-28] ->  | AN68: =RC[-28] ->  | AO68: =RC[-28] ->  | AP68: - | AQ68: =RC[-29] -> 0 | AR68: =RC[-29] -> 0 | AS68: - | AT68: =RC[-30] -> 0 | AU68: =RC[-30] -> 0 | AV68: =RC[-30] ->  | AW68: =RC[-30] -> 
A69: =IF(RC[1]="","",DATEVALUE(RC[1])) ->  | T69: =(RC[-16]*RC[-15]-RC[-13]*RC[-12])/1000 -> #VALUE! | W69: =RC[-2]*RC[-10]/1000 -> #VALUE! | X69: =ABS((RC[-3]*RC[-11]-RC[-2]*RC[-9])/1000) -> #VALUE! | Y69: =(RC[-14]-RC[1])/RC[-18]*100 -> #VALUE! | AC69: =VALUE(RC[-27]) -> #VALUE! | AD69: =IF(RC[21]=42,"*",IF(RC[21]=32,"",RC[21])) ->  | AE69: =RC[-28] ->  | AF69: =RC[-28] ->  | AG69: =RC[-28] ->  | AH69: =RC[-28] ->  | AI69: =RC[-28] ->  | AJ69: =RC[-28] ->  | AK69: =RC[-28] ->  | AL69: =RC[-28] -> 0 | AM69: =RC[-28] ->  | AN69: =RC[-28] ->  | AO69: =RC[-28] ->  | AP69: - | AQ69: =RC[-29] -> 0 | AR69: =RC[-29] -> 0 | AS69: - | AT69: =RC[-30] -> 0 | AU69: =RC[-30] -> 0 | AV69: =RC[-30] ->  | AW69: =RC[-30] -> 
A70: =IF(RC[1]="","",DATEVALUE(RC[1])) ->  | T70: =(RC[-16]*RC[-15]-RC[-13]*RC[-12])/1000 -> #VALUE! | W70: =RC[-2]*RC[-10]/1000 -> #VALUE! | X70: =ABS((RC[-3]*RC[-11]-RC[-2]*RC[-9])/1000) -> #VALUE! | Y70: =(RC[-14]-RC[1])/RC[-18]*100 -> #VALUE! | AC70: =VALUE(RC[-27]) -> #VALUE! | AD70: =IF(RC[21]=42,"*",IF(RC[21]=32,"",RC[21])) ->  | AE70: =RC[-28] ->  | AF70: =RC[-28] ->  | AG70: =RC[-28] ->  | AH70: =RC[-28] ->  | AI70: =RC[-28] ->  | AJ70: =RC[-28] ->  | AK70: =RC[-28] ->  | AL70: =RC[-28] -> 0 | AM70: =RC[-28] ->  | AN70: =RC[-28] ->  | AO70: =RC[-28] ->  | AP70: - | AQ70: =RC[-29] -> 0 | AR70: =RC[-29] -> 0 | AS70: - | AT70: =RC[-30] -> 0 | AU70: =RC[-30] -> 0 | AV70: =RC[-30] ->  | AW70: =RC[-30] -> 
A71: =IF(RC[1]="","",DATEVALUE(RC[1])) ->  | T71: =(RC[-16]*RC[-15]-RC[-13]*RC[-12])/1000 -> #VALUE! | W71: =RC[-2]*RC[-10]/1000 -> #VALUE! | X71: =ABS((RC[-3]*RC[-11]-RC[-2]*RC[-9])/1000) -> #VALUE! | Y71: =(RC[-14]-RC[1])/RC[-18]*100 -> #VALUE! | AC71: =VALUE(RC[-27]) -> #VALUE! | AD71: =IF(RC[21]=42,"*",IF(RC[21]=32,"",RC[21])) ->  | AE71: =RC[-28] ->  | AF71: =RC[-28] ->  | AG71: =RC[-28] ->  | AH71: =RC[-28] ->  | AI71: =RC[-28] ->  | AJ71: =RC[-28] ->  | AK71: =RC[-28] ->  | AL71: =RC[-28] -> 0 | AM71: =RC[-28] ->  | AN71: =RC[-28] ->  | AO71: =RC[-28] ->  | AP71: - | AQ71: =RC[-29] -> 0 | AR71: =RC[-29] -> 0 | AS71: - | AT71: =RC[-30] -> 0 | AU71: =RC[-30] -> 0 | AV71: =RC[-30] ->  | AW71: =RC[-30] -> 
A72: =IF(RC[1]="","",DATEVALUE(RC[1])) ->  | T72: =(RC[-16]*RC[-15]-RC[-13]*RC[-12])/1000 -> #VALUE! | W72: =RC[-2]*RC[-10]/1000 -> #VALUE! | X72: =ABS((RC[-3]*RC[-11]-RC[-2]*RC[-9])/1000) -> #VALUE! | Y72: =(RC[-14]-RC[1])/RC[-18]*100 -> #VALUE! | AC72: =VALUE(RC[-27]) -> #VALUE! | AD72: =IF(RC[21]=42,"*",IF(RC[21]=32,"",RC[21])) ->  | AE72: =RC[-28] ->  | AF72: =RC[-28] ->  | AG72: =RC[-28] ->  | AH72: =RC[-28] ->  | AI72: =RC[-28] ->  | AJ72: =RC[-28] ->  | AK72: =RC[-28] ->  | AL72: =RC[-28] -> 0 | AM72: =RC[-28] ->  | AN72: =RC[-28] ->  | AO72: =RC[-28] ->  | AP72: - | AQ72: =RC[-29] -> 0 | AR72: =RC[-29] -> 0 | AS72: - | AT72: =RC[-30] -> 0 | AU72: =RC[-30] -> 0 | AV72: =RC[-30] ->  | AW72: =RC[-30] -> 
A73: =IF(RC[1]="","",DATEVALUE(RC[1])) ->  | T73: =(RC[-16]*RC[-15]-RC[-13]*RC[-12])/1000 -> #VALUE! | W73: =RC[-2]*RC[-10]/1000 -> #VALUE! | X73: =ABS((RC[-3]*RC[-11]-RC[-2]*RC[-9])/1000) -> #VALUE! | Y73: =(RC[-14]-RC[1])/RC[-18]*100 -> #VALUE! | AC73: =VALUE(RC[-27]) -> #VALUE! | AD73: =IF(RC[21]=42,"*",IF(RC[21]=32,"",RC[21])) ->  | AE73: =RC[-28] ->  | AF73: =RC[-28] ->  | AG73: =RC[-28] ->  | AH73: =RC[-28] ->  | AI73: =RC[-28] ->  | AJ73: =RC[-28] ->  | AK73: =RC[-28] ->  | AL73: =RC[-28] -> 0 | AM73: =RC[-28] ->  | AN73: =RC[-28] ->  | AO73: =RC[-28] ->  | AP73: - | AQ73: =RC[-29] -> 0 | AR73: =RC[-29] -> 0 | AS73: - | AT73: =RC[-30] -> 0 | AU73: =RC[-30] -> 0 | AV73: =RC[-30] ->  | AW73: =RC[-30] -> 
A74: =IF(RC[1]="","",DATEVALUE(RC[1])) ->  | T74: =(RC[-16]*RC[-15]-RC[-13]*RC[-12])/1000 -> #VALUE! | W74: =RC[-2]*RC[-10]/1000 -> #VALUE! | X74: =ABS((RC[-3]*RC[-11]-RC[-2]*RC[-9])/1000) -> #VALUE! | Y74: =(RC[-14]-RC[1])/RC[-18]*100 -> #VALUE! | AC74: =VALUE(RC[-27]) -> #VALUE! | AD74: =IF(RC[21]=42,"*",IF(RC[21]=32,"",RC[21])) ->  | AE74: =RC[-28] ->  | AF74: =RC[-28] ->  | AG74: =RC[-28] ->  | AH74: =RC[-28] ->  | AI74: =RC[-28] ->  | AJ74: =RC[-28] ->  | AK74: =RC[-28] ->  | AL74: =RC[-28] -> 0 | AM74: =RC[-28] ->  | AN74: =RC[-28] ->  | AO74: =RC[-28] ->  | AP74: - | AQ74: =RC[-29] -> 0 | AR74: =RC[-29] -> 0 | AS74: - | AT74: =RC[-30] -> 0 | AU74: =RC[-30] -> 0 | AV74: =RC[-30] ->  | AW74: =RC[-30] -> 
A75: =IF(RC[1]="","",DATEVALUE(RC[1])) ->  | T75: =(RC[-16]*RC[-15]-RC[-13]*RC[-12])/1000 -> #VALUE! | W75: =RC[-2]*RC[-10]/1000 -> #VALUE! | X75: =ABS((RC[-3]*RC[-11]-RC[-2]*RC[-9])/1000) -> #VALUE! | Y75: =(RC[-14]-RC[1])/RC[-18]*100 -> #VALUE! | AC75: =VALUE(RC[-27]) -> #VALUE! | AD75: =IF(RC[21]=42,"*",IF(RC[21]=32,"",RC[21])) ->  | AE75: =RC[-28] ->  | AF75: =RC[-28] ->  | AG75: =RC[-28] ->  | AH75: =RC[-28] ->  | AI75: =RC[-28] ->  | AJ75: =RC[-28] ->  | AK75: =RC[-28] ->  | AL75: =RC[-28] -> 0 | AM75: =RC[-28] ->  | AN75: =RC[-28] ->  | AO75: =RC[-28] ->  | AP75: - | AQ75: =RC[-29] -> 0 | AR75: =RC[-29] -> 0 | AS75: - | AT75: =RC[-30] -> 0 | AU75: =RC[-30] -> 0 | AV75: =RC[-30] ->  | AW75: =RC[-30] -> 
A76: =IF(RC[1]="","",DATEVALUE(RC[1])) ->  | T76: =(RC[-16]*RC[-15]-RC[-13]*RC[-12])/1000 -> #VALUE! | W76: =RC[-2]*RC[-10]/1000 -> #VALUE! | X76: =ABS((RC[-3]*RC[-11]-RC[-2]*RC[-9])/1000) -> #VALUE! | Y76: =(RC[-14]-RC[1])/RC[-18]*100 -> #VALUE! | AC76: =VALUE(RC[-27]) -> #VALUE! | AD76: =IF(RC[21]=42,"*",IF(RC[21]=32,"",RC[21])) ->  | AE76: =RC[-28] ->  | AF76: =RC[-28] ->  | AG76: =RC[-28] ->  | AH76: =RC[-28] ->  | AI76: =RC[-28] ->  | AJ76: =RC[-28] ->  | AK76: =RC[-28] ->  | AL76: =RC[-28] -> 0 | AM76: =RC[-28] ->  | AN76: =RC[-28] ->  | AO76: =RC[-28] ->  | AP76: - | AQ76: =RC[-29] -> 0 | AR76: =RC[-29] -> 0 | AS76: - | AT76: =RC[-30] -> 0 | AU76: =RC[-30] -> 0 | AV76: =RC[-30] ->  | AW76: =RC[-30] -> 
A77: =IF(RC[1]="","",DATEVALUE(RC[1])) ->  | T77: =(RC[-16]*RC[-15]-RC[-13]*RC[-12])/1000 -> #VALUE! | W77: =RC[-2]*RC[-10]/1000 -> #VALUE! | X77: =ABS((RC[-3]*RC[-11]-RC[-2]*RC[-9])/1000) -> #VALUE! | Y77: =(RC[-14]-RC[1])/RC[-18]*100 -> #VALUE! | AC77: =VALUE(RC[-27]) -> #VALUE! | AD77: =IF(RC[21]=42,"*",IF(RC[21]=32,"",RC[21])) ->  | AE77: =RC[-28] ->  | AF77: =RC[-28] ->  | AG77: =RC[-28] ->  | AH77: =RC[-28] ->  | AI77: =RC[-28] ->  | AJ77: =RC[-28] ->  | AK77: =RC[-28] ->  | AL77: =RC[-28] -> 0 | AM77: =RC[-28] ->  | AN77: =RC[-28] ->  | AO77: =RC[-28] ->  | AP77: - | AQ77: =RC[-29] -> 0 | AR77: =RC[-29] -> 0 | AS77: - | AT77: =RC[-30] -> 0 | AU77: =RC[-30] -> 0 | AV77: =RC[-30] ->  | AW77: =RC[-30] -> 
A78: =IF(RC[1]="","",DATEVALUE(RC[1])) ->  | T78: =(RC[-16]*RC[-15]-RC[-13]*RC[-12])/1000 -> #VALUE! | W78: =RC[-2]*RC[-10]/1000 -> #VALUE! | X78: =ABS((RC[-3]*RC[-11]-RC[-2]*RC[-9])/1000) -> #VALUE! | Y78: =(RC[-14]-RC[1])/RC[-18]*100 -> #VALUE! | AC78: =VALUE(RC[-27]) -> #VALUE! | AD78: =IF(RC[21]=42,"*",IF(RC[21]=32,"",RC[21])) ->  | AE78: =RC[-28] ->  | AF78: =RC[-28] ->  | AG78: =RC[-28] ->  | AH78: =RC[-28] ->  | AI78: =RC[-28] ->  | AJ78: =RC[-28] ->  | AK78: =RC[-28] ->  | AL78: =RC[-28] -> 0 | AM78: =RC[-28] ->  | AN78: =RC[-28] ->  | AO78: =RC[-28] ->  | AP78: - | AQ78: =RC[-29] -> 0 | AR78: =RC[-29] -> 0 | AS78: - | AT78: =RC[-30] -> 0 | AU78: =RC[-30] -> 0 | AV78: =RC[-30] ->  | AW78: =RC[-30] -> 
A79: =IF(RC[1]="","",DATEVALUE(RC[1])) ->  | T79: =(RC[-16]*RC[-15]-RC[-13]*RC[-12])/1000 -> #VALUE! | W79: =RC[-2]*RC[-10]/1000 -> #VALUE! | X79: =ABS((RC[-3]*RC[-11]-RC[-2]*RC[-9])/1000) -> #VALUE! | Y79: =(RC[-14]-RC[1])/RC[-18]*100 -> #VALUE! | AC79: =VALUE(RC[-27]) -> #VALUE! | AD79: =IF(RC[21]=42,"*",IF(RC[21]=32,"",RC[21])) ->  | AE79: =RC[-28] ->  | AF79: =RC[-28] ->  | AG79: =RC[-28] ->  | AH79: =RC[-28] ->  | AI79: =RC[-28] ->  | AJ79: =RC[-28] ->  | AK79: =RC[-28] ->  | AL79: =RC[-28] -> 0 | AM79: =RC[-28] ->  | AN79: =RC[-28] ->  | AO79: =RC[-28] ->  | AP79: - | AQ79: =RC[-29] -> 0 | AR79: =RC[-29] -> 0 | AS79: - | AT79: =RC[-30] -> 0 | AU79: =RC[-30] -> 0 | AV79: =RC[-30] ->  | AW79: =RC[-30] -> 
A80: =IF(RC[1]="","",DATEVALUE(RC[1])) ->  | T80: =(RC[-16]*RC[-15]-RC[-13]*RC[-12])/1000 -> #VALUE! | W80: =RC[-2]*RC[-10]/1000 -> #VALUE! | X80: =ABS((RC[-3]*RC[-11]-RC[-2]*RC[-9])/1000) -> #VALUE! | Y80: =(RC[-14]-RC[1])/RC[-18]*100 -> #VALUE! | AC80: =VALUE(RC[-27]) -> #VALUE! | AD80: =IF(RC[21]=42,"*",IF(RC[21]=32,"",RC[21])) ->  | AE80: =RC[-28] ->  | AF80: =RC[-28] ->  | AG80: =RC[-28] ->  | AH80: =RC[-28] ->  | AI80: =RC[-28] ->  | AJ80: =RC[-28] ->  | AK80: =RC[-28] ->  | AL80: =RC[-28] -> 0 | AM80: =RC[-28] ->  | AN80: =RC[-28] ->  | AO80: =RC[-28] ->  | AP80: - | AQ80: =RC[-29] -> 0 | AR80: =RC[-29] -> 0 | AS80: - | AT80: =RC[-30] -> 0 | AU80: =RC[-30] -> 0 | AV80: =RC[-30] ->  | AW80: =RC[-30] -> 
A81: =IF(RC[1]="","",DATEVALUE(RC[1])) ->  | T81: =(RC[-16]*RC[-15]-RC[-13]*RC[-12])/1000 -> #VALUE! | W81: =RC[-2]*RC[-10]/1000 -> #VALUE! | X81: =ABS((RC[-3]*RC[-11]-RC[-2]*RC[-9])/1000) -> #VALUE! | Y81: =(RC[-14]-RC[1])/RC[-18]*100 -> #VALUE! | AC81: =VALUE(RC[-27]) -> #VALUE! | AD81: =IF(RC[21]=42,"*",IF(RC[21]=32,"",RC[21])) ->  | AE81: =RC[-28] ->  | AF81: =RC[-28] ->  | AG81: =RC[-28] ->  | AH81: =RC[-28] ->  | AI81: =RC[-28] ->  | AJ81: =RC[-28] ->  | AK81: =RC[-28] ->  | AL81: =RC[-28] -> 0 | AM81: =RC[-28] ->  | AN81: =RC[-28] ->  | AO81: =RC[-28] ->  | AP81: - | AQ81: =RC[-29] -> 0 | AR81: =RC[-29] -> 0 | AS81: - | AT81: =RC[-30] -> 0 | AU81: =RC[-30] -> 0 | AV81: =RC[-30] ->  | AW81: =RC[-30] -> 
A82: =IF(RC[1]="","",DATEVALUE(RC[1])) ->  | T82: =(RC[-16]*RC[-15]-RC[-13]*RC[-12])/1000 -> #VALUE! | W82: =RC[-2]*RC[-10]/1000 -> #VALUE! | X82: =ABS((RC[-3]*RC[-11]-RC[-2]*RC[-9])/1000) -> #VALUE! | Y82: =(RC[-14]-RC[1])/RC[-18]*100 -> #VALUE! | AC82: =VALUE(RC[-27]) -> #VALUE! | AD82: =IF(RC[21]=42,"*",IF(RC[21]=32,"",RC[21])) ->  | AE82: =RC[-28] ->  | AF82: =RC[-28] ->  | AG82: =RC[-28] ->  | AH82: =RC[-28] ->  | AI82: =RC[-28] ->  | AJ82: =RC[-28] ->  | AK82: =RC[-28] ->  | AL82: =RC[-28] -> 0 | AM82: =RC[-28] ->  | AN82: =RC[-28] ->  | AO82: =RC[-28] ->  | AP82: - | AQ82: =RC[-29] -> 0 | AR82: =RC[-29] -> 0 | AS82: - | AT82: =RC[-30] -> 0 | AU82: =RC[-30] -> 0 | AV82: =RC[-30] ->  | AW82: =RC[-30] -> 
A83: =IF(RC[1]="","",DATEVALUE(RC[1])) ->  | T83: =(RC[-16]*RC[-15]-RC[-13]*RC[-12])/1000 -> #VALUE! | W83: =RC[-2]*RC[-10]/1000 -> #VALUE! | X83: =ABS((RC[-3]*RC[-11]-RC[-2]*RC[-9])/1000) -> #VALUE! | Y83: =(RC[-14]-RC[1])/RC[-18]*100 -> #VALUE! | AC83: =VALUE(RC[-27]) -> #VALUE! | AD83: =IF(RC[21]=42,"*",IF(RC[21]=32,"",RC[21])) ->  | AE83: =RC[-28] ->  | AF83: =RC[-28] ->  | AG83: =RC[-28] ->  | AH83: =RC[-28] ->  | AI83: =RC[-28] ->  | AJ83: =RC[-28] ->  | AK83: =RC[-28] ->  | AL83: =RC[-28] -> 0 | AM83: =RC[-28] ->  | AN83: =RC[-28] ->  | AO83: =RC[-28] ->  | AP83: - | AQ83: =RC[-29] -> 0 | AR83: =RC[-29] -> 0 | AS83: - | AT83: =RC[-30] -> 0 | AU83: =RC[-30] -> 0 | AV83: =RC[-30] ->  | AW83: =RC[-30] -> 
AC84: Среднее | AF84: =R[1]C[-28] -> 163.6325555555556 | AG84: =R[1]C[-28] -> 68.712222222222223 | AH84: =R[1]C[-28] -> 8.312555555555555 | AI84: =R[1]C[-28] -> 139.99911111111109 | AJ84: =R[1]C[-28] -> 45.64155555555557 | AK84: =R[1]C[-28] -> 5.4286666666666683 | AL84: =R[1]C[-28] -> 23.070666666666668 | AM84: =R[1]C[-28] -> 23.633444444444436 | AN84: =R[1]C[-28] -> 24.458333333333332 | AO84: =R[1]C[-28] -> 66.322333333333347 | AP84: - | AQ84: =R[1]C[-29] -> 0 | AR84: =R[1]C[-29] -> 0 | AS84: - | AT84: =R[1]C[-30] -> 0 | AU84: =R[1]C[-30] -> 0
B85: Среднее | D85: =AVERAGE(OFFSET(R[-74]C,3,0,R7C1,1)) -> 163.6325555555556 | E85: =AVERAGE(OFFSET(R[-74]C,3,0,R7C1,1)) -> 68.712222222222223 | F85: =AVERAGE(OFFSET(R[-74]C,3,0,R7C1,1)) -> 8.312555555555555 | G85: =AVERAGE(OFFSET(R[-74]C,3,0,R7C1,1)) -> 139.99911111111109 | H85: =AVERAGE(OFFSET(R[-74]C,3,0,R7C1,1)) -> 45.64155555555557 | I85: =AVERAGE(OFFSET(R[-74]C,3,0,R7C1,1)) -> 5.4286666666666683 | J85: =AVERAGE(OFFSET(R[-74]C,3,0,R7C1,1)) -> 23.070666666666668 | K85: =AVERAGE(OFFSET(R[-74]C,3,0,R7C1,1)) -> 23.633444444444436 | L85: =IF(SUM(OFFSET(R[-74]C,3,0,R7C1,1))=0,"",AVERAGE(OFFSET(R[-74]C,3,0,R7C1,1))) -> 24.458333333333332 | M85: =IF(SUM(OFFSET(R[-74]C,3,0,R7C1,1))=0,"",AVERAGE(OFFSET(R[-74]C,3,0,R7C1,1))) -> 66.322333333333347 | R85: =IF(SUM(OFFSET(R[-74]C,3,0,R7C1,1))=0,"",AVERAGE(OFFSET(R[-74]C,3,0,R7C1,1))) -> 1.5907555555555555 | S85: =AVERAGE(OFFSET(R[-74]C,3,0,R7C1,1)) -> 4.883455555555555 | T85: =AVERAGE(OFFSET(R[-74]C,3,0,R7C1,1)) -> 4.8757072396296302 | W85: =AVERAGE(OFFSET(R[-74]C,3,0,R7C1,1)) -> #VALUE! | X85: =AVERAGE(OFFSET(R[-74]C,3,0,R7C1,1)) -> #VALUE! | AC85: Итого | AE85: =R[1]C[-28] -> 720 | AF85: =R[1]C[-28] -> 4908.9766666666683 | AI85: =R[1]C[-28] -> 4199.9733333333324 | AM85: =R[1]C[-28] -> 709.0033333333331 | AN85: =R[1]C[-28] -> 733.75 | AQ85: =R[1]C[-29] -> 0 | AU85: =R[1]C[-30] -> 0 | AV85: =R[1]C[-30] -> 47.722666666666662 | AW85: =R[1]C[-30] -> 146.50366666666665
B86: ИТОГО: | C86: =SUM(OFFSET(R[-75]C,3,0,R7C1,1)) -> 720 | D86: =SUM(OFFSET(R[-75]C,3,0,R7C1,1)) -> 4908.9766666666683 | G86: =SUM(OFFSET(R[-75]C,3,0,R7C1,1)) -> 4199.9733333333324 | K86: =SUM(OFFSET(R[-75]C,3,0,R7C1,1)) -> 709.0033333333331 | L86: =IF(SUM(OFFSET(R[-75]C,3,0,R7C1,1))=0,"",SUM(OFFSET(R[-75]C,3,0,R7C1,1))) -> 733.75 | R86: =IF(SUM(OFFSET(R[-75]C,3,0,R7C1,1))=0,"",SUM(OFFSET(R[-75]C,3,0,R7C1,1))) -> 47.722666666666662 | S86: =SUM(OFFSET(R[-75]C,3,0,R7C1,1)) -> 146.50366666666665 | T86: =SUM(OFFSET(R[-75]C,3,0,R7C1,1)) -> 146.2712171888889 | W86: =SUM(OFFSET(R[-75]C,3,0,R7C1,1)) -> #VALUE! | X86: =SUM(OFFSET(R[-75]C,3,0,R7C1,1)) -> #VALUE!
AC87: Досчёт | AF87: =R[1]C[-28] -> 0 | AI87: =R[1]C[-28] -> 0 | AM87: =R[1]C[-28] -> 0 | AN87: =R[1]C[-28] -> 0 | AQ87: =R[1]C[-29] -> 0 | AU87: =R[1]C[-30] -> 0 | AV87: =R[1]C[-30] -> 0 | AW87: =R[1]C[-30] -> 0
A88: 11дн=264ч 4дн=96ч | B88: Досчёт до конца м-ца (+) | C88: =R6C1*24 -> 216 | T88: № 68130 | AC88: Снятие | AF88: =-R[1]C[-28] -> 0 | AI88: =-R[1]C[-28] -> 0 | AM88: =-R[1]C[-28] -> 0 | AN88: =-R[1]C[-28] -> 0 | AQ88: =-R[1]C[-29] -> 0 | AU88: =-R[1]C[-30] -> 0 | AV88: =-R[1]C[-30] -> 0 | AW88: =-R[1]C[-30] -> 0
A89: 9дн=216ч 7дн=168ч | B89: Вычет с предыдущего (-) | C89: =R4C1*24 -> 192 | AC89: Сумма | AF89: =R[1]C[-28] -> 4908.9766666666683 | AI89: =R[1]C[-28] -> 4199.9733333333324 | AM89: =R[1]C[-28] -> 709.0033333333331 | AN89: =R[1]C[-28] -> 733.75 | AQ89: =R[1]C[-29] -> 0 | AU89: =R[1]C[-30] -> 0 | AV89: =R[1]C[-30] -> 47.722666666666662 | AW89: =R[1]C[-30] -> 146.50366666666665
B90: СУММА: | C90: =R[-4]C+R[-2]C-R[-1]C -> 744 | D90: =R[-4]C+R[-2]C-R[-1]C -> 4908.9766666666683 | G90: =R[-4]C+R[-2]C-R[-1]C -> 4199.9733333333324 | K90: =R[-4]C+R[-2]C-R[-1]C -> 709.0033333333331 | L90: =IF(SUM(OFFSET(R[-79]C,3,0,R7C1,1))=0,"",(R[-4]C+R[-2]C-R[-1]C)) -> 733.75 | R90: =IF(SUM(OFFSET(R[-79]C,3,0,R7C1,1))=0,"",(R[-4]C+R[-2]C-R[-1]C)) -> 47.722666666666662 | S90: =R[-4]C+R[-2]C-R[-1]C -> 146.50366666666665
AC91: Тхв на источнике | AE91: V гвс (м3) | AF91: =R[-2]C[15] -> 0 | AG91: W гвс (Гкал) | AH91: =RC[-2]*0.06 -> 0 | AI91: W без гвс (Гкал) | AJ91: =R[-2]C[13]-RC[-2] -> 146.50366666666665
B92: Показания счетчиков на момент снятия данных:
B93: Дата, время | D93: М1, т | F93: М2, т | H93: М3, т | J93: М4, т | L93: Qо, Гкал | N93: Qг, Гкал | P93: время, час
B94: 23.09.18 01:00 | D94: 103250.97 | F94: 83863.3 | H94: 23990.26 | J94: - | L94: 3578.8980000000001 | N94: 1694.2829999999999 | P94: -
B95: 18.10.18 02:00 | D95: 1339.9 | F95: 1142.57 | H95: 199.35 | J95: - | L95: 44.801000000000002 | N95: 13.362 | P95: -
AC97: =ZAYAVKA_N -> з.н д. №02/147-2783 от 04.10.18 с 03.10.18г по 10.10.18г некорректная работа приборов
B98: Представитель потребителя:_______________________________________________________________________ В.О. Топорков
I101: Рекомендуемые значения по параметрам теплопотребления (не являются официально утверждёнными)
I102: М, т | J102: V, м3 | K102: Qгвс, Гкал | L102: Qотоп, Гкал | M102: Qо, Гкал
I103: =R[-13]C[-3] -> 0 | J103: =RC[-1]/0.98 -> 0 | K103: =RC[-1]*0.06 -> 0 | L103: =RC[1]-RC[-1] -> 47.722666666666662 | M103: =R[-13]C[5] -> 47.722666666666662
O105: ДЛЯ САМОКОНТРОЛЯ
B106: В строке выбора дат указать период с 16.7.13 по 23.8.13 - жильё | N106: Q | O106: Qг
B107: В строке выбора дат указать период с 18.7.13 по 25.8.13 - не жилое | N107: =(R[-21]C[-10]*R[-22]C[-7]-R[-21]C[-9]*R[-22]C[-6])/1000 -> 687.25236979851866 | O107: =IF(R[-22]C[-2]="",R[-21]C[-3]*R[-22]C/1000,"") ->  | P107: Си2
O108: =IF(R[-23]C[-2]="","",((R[-22]C[-3]*R[-23]C)-(R[-22]C[-2]*R[-23]C[2]))/1000) -> 0 | P108: Си3