Sheet: Лист1
G1: Отчёт о теплопотреблении за октябрь 2018 | M1: з.н д. №02/147-2783 от 04.10.18 с 23.09.18г по 24.09.18г некорректная работа приборов
A4: =EOMONTH(R[9]C,0)-R[9]C -> 8 | B4: Потребитель: ЗАО "Сити Сервис"
A5: =MAX(R[9]C:R[78]C) -> 2018-10-22T00:00:00.000 | B5: Адрес: г. СПб, Наличная ул., д.55 ИТП 4
A6: =EOMONTH(R[-1]C,0)-R[-1]C -> 9 | B6: Телефон: 8-911-021-19-79
A7: =R[-2]C-R[6]C -> 30 | B7: Договор 10023-3 (.) 85881, 85882
A8: 7 | B8: Тепловычислитель: ВКТ-7 № 77005 | L8: М2 мах= | M8: 108.72 | O8: Мгвс мах= | P8: 9.36
L9: Qотоп мах= | M9: 8.688 | O9: Qгвс мах= | P9: 0.624
B10: Расчётная формула: Q=M1*(h1-hхв)-M2*(h2-hхв)
D12: Учет | L12: Контроль
A13: =R[1]C[1]-1 -> 2018-09-22T00:00:00.000 | B13: Дата | C13: N, ч | D13: M1, т | E13: T1, С | F13: P1, кг/см2 | G13: M2, т | H13: T2, С | I13: P2, кг/см2 | J13: dT, С | K13: M1-М2, т | L13: V3, м3 | M13: T3, С | N13: V4, м3 | O13: =IF(R[-12]C[-14]="м.куб","","T4, С") -> T4, С | P13: dT, С | Q13: V3-V4, м3 | R13: Qгвс, Гкал | S13: Qобщ., Гкал | T13: Q | U13: M3 | V13: M4 | W13: си2 | X13: си3 | Y13: Разб. | Z13: dM2 | AC13: Дата | AD13: НС | AE13: n, ч | AF13: М1, т | AG13: t1, гр. С | AH13: Р1, кгс/см2 | AI13: М2, т | AJ13: t2, гр. С | AK13: Р2, кгс/см2 | AL13: t1-t2, гр. С | AM13: М1-М2, т | AN13: М1гвс, т | AO13: t1гвс, гр. С | AP13: Р1гвс, кгс/см2 | AQ13: М2гвс, т | AR13: t2гвс, гр. С | AS13: Р2гвс, кгс/см2 | AT13: t1гвс-t2гвс | AU13: М1гвс-М2гвс, т | AV13: Wгвс, Гкал | AW13: Wсумм, Гкал | AY13: NS_TV1 | AZ13: НС | BA13: NS_TV2
A14: =IF(RC[1]="","",DATEVALUE(RC[1])) -> 43366 | B14: 23.09.18 | C14: 24 | D14: 0 | E14: 48.46 | F14: 7.53 | G14: 14.04 | H14: 53.25 | I14: 1.05 | J14: =RC[-5]-RC[-2] -> -4.7899999999999991 | K14: -14.04 | L14: 22.849999999999998 | M14: 66.066666666666663 | N14: 8.8933333333333326 | O14: 45.656666666666666 | P14: 20.41 | Q14: 13.956666666666669 | R14: 1.08 | S14: =RC[-1] -> 1.08 | T14: =(RC[-16]*RC[-15]-RC[-13]*RC[-12])/1000 -> -0.74763000000000002 | U14: 13.03 | V14: 0.57999999999999996 | W14: =RC[-2]*RC[-10]/1000 -> 0.86084866666666648 | X14: =ABS((RC[-3]*RC[-11]-RC[-2]*RC[-9])/1000) -> 0.83436779999999988 | Y14: =(RC[-14]-RC[1])/RC[-18]*100 -> -188.67521367521368 | Z14: 12.45 | AC14: =VALUE(RC[-27]) -> 2018-09-23T00:00:00.000 | AD14: =IF(RC[21]=42,"*",IF(RC[21]=32,"",RC[21])) -> - | AE14: =RC[-28] -> 24 | AF14: =RC[-28] -> 0 | AG14: =RC[-28] -> 48.46 | AH14: =RC[-28] -> 7.53 | AI14: =RC[-28] -> 14.04 | AJ14: =RC[-28] -> 53.25 | AK14: =RC[-28] -> 1.05 | AL14: =RC[-28] -> -4.7899999999999991 | AM14: =RC[-28] -> -14.04 | AN14: =RC[-28] -> 22.849999999999998 | AO14: =RC[-28] -> 66.066666666666663 | AP14: - | AQ14: =RC[-29] -> 8.8933333333333326 | AR14: =RC[-29] -> 45.656666666666666 | AS14: - | AT14: =RC[-30] -> 20.41 | AU14: =RC[-30] -> 13.956666666666669 | AV14: =RC[-30] -> 1.08 | AW14: =RC[-30] -> 1.08 | AY14: - | AZ14: - | BA14: -
A15: =IF(RC[1]="","",DATEVALUE(RC[1])) -> 43367 | B15: 24.09.18 | C15: 24 | D15: 58.43 | E15: 69.19 | F15: 7.53 | G15: 57.99 | H15: 55.74 | I15: 1.05 | J15: =RC[-5]-RC[-2] -> 13.449999999999996 | K15: 0.44 | L15: =AVERAGE(R[1]C:R[3]C) -> 22.849999999999998 | M15: =AVERAGE(R[1]C:R[3]C) -> 66.066666666666663 | N15: =AVERAGE(R[1]C:R[3]C) -> 8.8933333333333326 | O15: =AVERAGE(R[1]C:R[3]C) -> 45.656666666666666 | P15: =AVERAGE(R[1]C:R[3]C) -> 20.41 | Q15: =AVERAGE(R[1]C:R[3]C) -> 13.956666666666669 | R15: =AVERAGE(R[1]C:R[3]C) -> 1.08 | S15: =AVERAGE(R[1]C:R[3]C) -> 3.1846666666666668 | T15: =(RC[-16]*RC[-15]-RC[-13]*RC[-12])/1000 -> 0.81040909999999944 | U15: 20.8 | V15: 5.01 | W15: =RC[-2]*RC[-10]/1000 -> 1.3741866666666667 | X15: =ABS((RC[-3]*RC[-11]-RC[-2]*RC[-9])/1000) -> 1.1454467666666668 | Y15: =(RC[-14]-RC[1])/RC[-18]*100 -> -26.470081048456628 | Z15: 15.79 | AC15: =VALUE(RC[-27]) -> 2018-09-24T00:00:00.000 | AD15: =IF(RC[21]=42,"*",IF(RC[21]=32,"",RC[21])) -> - | AE15: =RC[-28] -> 24 | AF15: =RC[-28] -> 58.43 | AG15: =RC[-28] -> 69.19 | AH15: =RC[-28] -> 7.53 | AI15: =RC[-28] -> 57.99 | AJ15: =RC[-28] -> 55.74 | AK15: =RC[-28] -> 1.05 | AL15: =RC[-28] -> 13.449999999999996 | AM15: =RC[-28] -> 0.44 | AN15: =RC[-28] -> 22.849999999999998 | AO15: =RC[-28] -> 66.066666666666663 | AP15: - | AQ15: =RC[-29] -> 8.8933333333333326 | AR15: =RC[-29] -> 45.656666666666666 | AS15: - | AT15: =RC[-30] -> 20.41 | AU15: =RC[-30] -> 13.956666666666669 | AV15: =RC[-30] -> 1.08 | AW15: =RC[-30] -> 3.1846666666666668 | AY15: - | AZ15: - | BA15: -
A16: =IF(RC[1]="","",DATEVALUE(RC[1])) -> 43368 | B16: 25.09.18 | C16: 24 | D16: 118.9 | E16: 68.17 | F16: 7.53 | G16: 104.81 | H16: 46.72 | I16: 1.06 | J16: =RC[-5]-RC[-2] -> 21.450000000000003 | K16: 14.09 | L16: 25.76 | M16: 67.97 | N16: 9.44 | O16: 48.14 | P16: =IF(AND(ISNUMBER(RC[-3]),ISNUMBER(RC[-1])),RC[-3]-RC[-1],"-") -> 19.829999999999998 | Q16: 16.32 | R16: 1.2609999999999999 | S16: 3.22 | T16: =(RC[-16]*RC[-15]-RC[-13]*RC[-12])/1000 -> 3.2086898000000001 | U16: 25.22 | V16: 9.44 | W16: =RC[-2]*RC[-10]/1000 -> 1.7142033999999999 | X16: =ABS((RC[-3]*RC[-11]-RC[-2]*RC[-9])/1000) -> 1.2597617999999997 | Y16: =(RC[-14]-RC[1])/RC[-18]*100 -> -1.6124415609197591 | Z16: 15.78 | AC16: =VALUE(RC[-27]) -> 2018-09-25T00:00:00.000 | AD16: =IF(RC[21]=42,"*",IF(RC[21]=32,"",RC[21])) -> - | AE16: =RC[-28] -> 24 | AF16: =RC[-28] -> 118.9 | AG16: =RC[-28] -> 68.17 | AH16: =RC[-28] -> 7.53 | AI16: =RC[-28] -> 104.81 | AJ16: =RC[-28] -> 46.72 | AK16: =RC[-28] -> 1.06 | AL16: =RC[-28] -> 21.450000000000003 | AM16: =RC[-28] -> 14.09 | AN16: =RC[-28] -> 25.76 | AO16: =RC[-28] -> 67.97 | AP16: - | AQ16: =RC[-29] -> 9.44 | AR16: =RC[-29] -> 48.14 | AS16: - | AT16: =RC[-30] -> 19.829999999999998 | AU16: =RC[-30] -> 16.32 | AV16: =RC[-30] -> 1.2609999999999999 | AW16: =RC[-30] -> 3.22 | AY16: - | AZ16: - | BA16: -
A17: =IF(RC[1]="","",DATEVALUE(RC[1])) -> 43369 | B17: 26.09.18 | C17: 24 | D17: 117.76 | E17: 67.72 | F17: 7.53 | G17: 104.73 | H17: 42.77 | I17: 1.06 | J17: =RC[-5]-RC[-2] -> 24.949999999999996 | K17: 13.03 | L17: 24.41 | M17: 67.41 | N17: 9 | O17: 47.43 | P17: =IF(AND(ISNUMBER(RC[-3]),ISNUMBER(RC[-1])),RC[-3]-RC[-1],"-") -> 19.979999999999997 | Q17: 15.41 | R17: 1.1859999999999999 | S17: 3.5059999999999998 | T17: =(RC[-16]*RC[-15]-RC[-13]*RC[-12])/1000 -> 3.4954050999999988 | U17: 23.9 | V17: 9 | W17: =RC[-2]*RC[-10]/1000 -> 1.6110989999999998 | X17: =ABS((RC[-3]*RC[-11]-RC[-2]*RC[-9])/1000) -> 1.1842289999999998 | Y17: =(RC[-14]-RC[1])/RC[-18]*100 -> -1.7855437792418609 | Z17: 14.9 | AC17: =VALUE(RC[-27]) -> 2018-09-26T00:00:00.000 | AD17: =IF(RC[21]=42,"*",IF(RC[21]=32,"",RC[21])) -> - | AE17: =RC[-28] -> 24 | AF17: =RC[-28] -> 117.76 | AG17: =RC[-28] -> 67.72 | AH17: =RC[-28] -> 7.53 | AI17: =RC[-28] -> 104.73 | AJ17: =RC[-28] -> 42.77 | AK17: =RC[-28] -> 1.06 | AL17: =RC[-28] -> 24.949999999999996 | AM17: =RC[-28] -> 13.03 | AN17: =RC[-28] -> 24.41 | AO17: =RC[-28] -> 67.41 | AP17: - | AQ17: =RC[-29] -> 9 | AR17: =RC[-29] -> 47.43 | AS17: - | AT17: =RC[-30] -> 19.979999999999997 | AU17: =RC[-30] -> 15.41 | AV17: =RC[-30] -> 1.1859999999999999 | AW17: =RC[-30] -> 3.5059999999999998 | AY17: - | AZ17: - | BA17: -
A18: =IF(RC[1]="","",DATEVALUE(RC[1])) -> 43370 | B18: 27.09.18 | C18: 24 | D18: 106.93 | E18: 63.07 | F18: 7.53 | G18: 99.13 | H18: 39.6 | I18: 1.05 | J18: =RC[-5]-RC[-2] -> 23.47 | K18: 7.8 | L18: 18.38 | M18: 62.82 | N18: 8.24 | O18: 41.4 | P18: =IF(AND(ISNUMBER(RC[-3]),ISNUMBER(RC[-1])),RC[-3]-RC[-1],"-") -> 21.42 | Q18: 10.14 | R18: 0.79300000000000004 | S18: 2.8279999999999998 | T18: =(RC[-16]*RC[-15]-RC[-13]*RC[-12])/1000 -> 2.8185271000000003 | U18: 18.059999999999999 | V18: 8.24 | W18: =RC[-2]*RC[-10]/1000 -> 1.1345292 | X18: =ABS((RC[-3]*RC[-11]-RC[-2]*RC[-9])/1000) -> 0.79339320000000002 | Y18: =(RC[-14]-RC[1])/RC[-18]*100 -> -2.0377282356501567 | Z18: 9.82 | AC18: =VALUE(RC[-27]) -> 2018-09-27T00:00:00.000 | AD18: =IF(RC[21]=42,"*",IF(RC[21]=32,"",RC[21])) -> - | AE18: =RC[-28] -> 24 | AF18: =RC[-28] -> 106.93 | AG18: =RC[-28] -> 63.07 | AH18: =RC[-28] -> 7.53 | AI18: =RC[-28] -> 99.13 | AJ18: =RC[-28] -> 39.6 | AK18: =RC[-28] -> 1.05 | AL18: =RC[-28] -> 23.47 | AM18: =RC[-28] -> 7.8 | AN18: =RC[-28] -> 18.38 | AO18: =RC[-28] -> 62.82 | AP18: - | AQ18: =RC[-29] -> 8.24 | AR18: =RC[-29] -> 41.4 | AS18: - | AT18: =RC[-30] -> 21.42 | AU18: =RC[-30] -> 10.14 | AV18: =RC[-30] -> 0.79300000000000004 | AW18: =RC[-30] -> 2.8279999999999998 | AY18: - | AZ18: - | BA18: -
A19: =IF(RC[1]="","",DATEVALUE(RC[1])) -> 43371 | B19: 28.09.18 | C19: 24 | D19: 107.02 | E19: 67.69 | F19: 7.53 | G19: 95.63 | H19: 40.799999999999997 | I19: 1.05 | J19: =RC[-5]-RC[-2] -> 26.89 | K19: 11.39 | L19: 21.37 | M19: 67.53 | N19: 7.73 | O19: 45.13 | P19: =IF(AND(ISNUMBER(RC[-3]),ISNUMBER(RC[-1])),RC[-3]-RC[-1],"-") -> 22.4 | Q19: 13.64 | R19: 1.0649999999999999 | S19: 3.351 | T19: =(RC[-16]*RC[-15]-RC[-13]*RC[-12])/1000 -> 3.3424798 | U19: 20.93 | V19: 7.73 | W19: =RC[-2]*RC[-10]/1000 -> 1.4134029000000001 | X19: =ABS((RC[-3]*RC[-11]-RC[-2]*RC[-9])/1000) -> 1.064548 | Y19: =(RC[-14]-RC[1])/RC[-18]*100 -> -1.8927114922095565 | Z19: 13.2 | AC19: =VALUE(RC[-27]) -> 2018-09-28T00:00:00.000 | AD19: =IF(RC[21]=42,"*",IF(RC[21]=32,"",RC[21])) -> - | AE19: =RC[-28] -> 24 | AF19: =RC[-28] -> 107.02 | AG19: =RC[-28] -> 67.69 | AH19: =RC[-28] -> 7.53 | AI19: =RC[-28] -> 95.63 | AJ19: =RC[-28] -> 40.799999999999997 | AK19: =RC[-28] -> 1.05 | AL19: =RC[-28] -> 26.89 | AM19: =RC[-28] -> 11.39 | AN19: =RC[-28] -> 21.37 | AO19: =RC[-28] -> 67.53 | AP19: - | AQ19: =RC[-29] -> 7.73 | AR19: =RC[-29] -> 45.13 | AS19: - | AT19: =RC[-30] -> 22.4 | AU19: =RC[-30] -> 13.64 | AV19: =RC[-30] -> 1.0649999999999999 | AW19: =RC[-30] -> 3.351 | AY19: - | AZ19: - | BA19: -
A20: =IF(RC[1]="","",DATEVALUE(RC[1])) -> 43372 | B20: 29.09.18 | C20: 24 | D20: 105.15 | E20: 67.239999999999995 | F20: 7.53 | G20: 93.72 | H20: 40.22 | I20: 1.04 | J20: =RC[-5]-RC[-2] -> 27.019999999999996 | K20: 11.43 | L20: 21.21 | M20: 66.930000000000007 | N20: 7.54 | O20: 45.13 | P20: =IF(AND(ISNUMBER(RC[-3]),ISNUMBER(RC[-1])),RC[-3]-RC[-1],"-") -> 21.800000000000004 | Q20: 13.67 | R20: 1.0509999999999999 | S20: 3.3090000000000002 | T20: =(RC[-16]*RC[-15]-RC[-13]*RC[-12])/1000 -> 3.3008676000000001 | U20: 20.78 | V20: 7.54 | W20: =RC[-2]*RC[-10]/1000 -> 1.3908054000000001 | X20: =ABS((RC[-3]*RC[-11]-RC[-2]*RC[-9])/1000) -> 1.0505252 | Y20: =(RC[-14]-RC[1])/RC[-18]*100 -> -1.9312846777635517 | Z20: 13.24 | AC20: =VALUE(RC[-27]) -> 2018-09-29T00:00:00.000 | AD20: =IF(RC[21]=42,"*",IF(RC[21]=32,"",RC[21])) -> - | AE20: =RC[-28] -> 24 | AF20: =RC[-28] -> 105.15 | AG20: =RC[-28] -> 67.239999999999995 | AH20: =RC[-28] -> 7.53 | AI20: =RC[-28] -> 93.72 | AJ20: =RC[-28] -> 40.22 | AK20: =RC[-28] -> 1.04 | AL20: =RC[-28] -> 27.019999999999996 | AM20: =RC[-28] -> 11.43 | AN20: =RC[-28] -> 21.21 | AO20: =RC[-28] -> 66.930000000000007 | AP20: - | AQ20: =RC[-29] -> 7.54 | AR20: =RC[-29] -> 45.13 | AS20: - | AT20: =RC[-30] -> 21.800000000000004 | AU20: =RC[-30] -> 13.67 | AV20: =RC[-30] -> 1.0509999999999999 | AW20: =RC[-30] -> 3.3090000000000002 | AY20: - | AZ20: - | BA20: -
A21: =IF(RC[1]="","",DATEVALUE(RC[1])) -> 43373 | B21: 30.09.18 | C21: 24 | D21: 106.6 | E21: 69.489999999999995 | F21: 7.53 | G21: 93.03 | H21: 40.99 | I21: 1.05 | J21: =RC[-5]-RC[-2] -> 28.499999999999993 | K21: 13.57 | L21: 23.4 | M21: 69.38 | N21: 7.47 | O21: 46.98 | P21: =IF(AND(ISNUMBER(RC[-3]),ISNUMBER(RC[-1])),RC[-3]-RC[-1],"-") -> 22.4 | Q21: 15.93 | R21: 1.2370000000000001 | S21: 3.6040000000000001 | T21: =(RC[-16]*RC[-15]-RC[-13]*RC[-12])/1000 -> 3.594334299999999 | U21: 22.91 | V21: 7.47 | W21: =RC[-2]*RC[-10]/1000 -> 1.5894957999999999 | X21: =ABS((RC[-3]*RC[-11]-RC[-2]*RC[-9])/1000) -> 1.2385552 | Y21: =(RC[-14]-RC[1])/RC[-18]*100 -> -2.0101042674406098 | Z21: 15.44 | AC21: =VALUE(RC[-27]) -> 2018-09-30T00:00:00.000 | AD21: =IF(RC[21]=42,"*",IF(RC[21]=32,"",RC[21])) -> - | AE21: =RC[-28] -> 24 | AF21: =RC[-28] -> 106.6 | AG21: =RC[-28] -> 69.489999999999995 | AH21: =RC[-28] -> 7.53 | AI21: =RC[-28] -> 93.03 | AJ21: =RC[-28] -> 40.99 | AK21: =RC[-28] -> 1.05 | AL21: =RC[-28] -> 28.499999999999993 | AM21: =RC[-28] -> 13.57 | AN21: =RC[-28] -> 23.4 | AO21: =RC[-28] -> 69.38 | AP21: - | AQ21: =RC[-29] -> 7.47 | AR21: =RC[-29] -> 46.98 | AS21: - | AT21: =RC[-30] -> 22.4 | AU21: =RC[-30] -> 15.93 | AV21: =RC[-30] -> 1.2370000000000001 | AW21: =RC[-30] -> 3.6040000000000001 | AY21: - | AZ21: - | BA21: -
A22: =IF(RC[1]="","",DATEVALUE(RC[1])) -> 43374 | B22: 01.10.18 | C22: 24 | D22: 106.04 | E22: 68.25 | F22: 7.53 | G22: 93.48 | H22: 40.98 | I22: 1.05 | J22: =RC[-5]-RC[-2] -> 27.270000000000003 | K22: 12.56 | L22: 22.33 | M22: 67.98 | N22: 7.5 | O22: 46.65 | P22: =IF(AND(ISNUMBER(RC[-3]),ISNUMBER(RC[-1])),RC[-3]-RC[-1],"-") -> 21.330000000000005 | Q22: 14.83 | R22: 1.1379999999999999 | S22: 3.415 | T22: =(RC[-16]*RC[-15]-RC[-13]*RC[-12])/1000 -> 3.4064196000000004 | U22: 21.89 | V22: 7.5 | W22: =RC[-2]*RC[-10]/1000 -> 1.4880822 | X22: =ABS((RC[-3]*RC[-11]-RC[-2]*RC[-9])/1000) -> 1.1382072000000001 | Y22: =(RC[-14]-RC[1])/RC[-18]*100 -> -1.9576379974326059 | Z22: 14.39 | AC22: =VALUE(RC[-27]) -> 2018-10-01T00:00:00.000 | AD22: =IF(RC[21]=42,"*",IF(RC[21]=32,"",RC[21])) -> - | AE22: =RC[-28] -> 24 | AF22: =RC[-28] -> 106.04 | AG22: =RC[-28] -> 68.25 | AH22: =RC[-28] -> 7.53 | AI22: =RC[-28] -> 93.48 | AJ22: =RC[-28] -> 40.98 | AK22: =RC[-28] -> 1.05 | AL22: =RC[-28] -> 27.270000000000003 | AM22: =RC[-28] -> 12.56 | AN22: =RC[-28] -> 22.33 | AO22: =RC[-28] -> 67.98 | AP22: - | AQ22: =RC[-29] -> 7.5 | AR22: =RC[-29] -> 46.65 | AS22: - | AT22: =RC[-30] -> 21.330000000000005 | AU22: =RC[-30] -> 14.83 | AV22: =RC[-30] -> 1.1379999999999999 | AW22: =RC[-30] -> 3.415 | AY22: - | AZ22: - | BA22: -
A23: =IF(RC[1]="","",DATEVALUE(RC[1])) -> 43375 | B23: 02.10.18 | C23: 24 | D23: 100.91 | E23: 66.989999999999995 | F23: 7.53 | G23: 89.14 | H23: 39.89 | I23: 1.05 | J23: =RC[-5]-RC[-2] -> 27.099999999999994 | K23: 11.77 | L23: 20.96 | M23: 66.75 | N23: 7.14 | O23: 45.2 | P23: =IF(AND(ISNUMBER(RC[-3]),ISNUMBER(RC[-1])),RC[-3]-RC[-1],"-") -> 21.549999999999997 | Q23: 13.82 | R23: 1.046 | S23: 3.2120000000000002 | T23: =(RC[-16]*RC[-15]-RC[-13]*RC[-12])/1000 -> 3.2041662999999989 | U23: 20.52 | V23: 7.14 | W23: =RC[-2]*RC[-10]/1000 -> 1.36971 | X23: =ABS((RC[-3]*RC[-11]-RC[-2]*RC[-9])/1000) -> 1.0469820000000001 | Y23: =(RC[-14]-RC[1])/RC[-18]*100 -> -1.8061476329369546 | Z23: 13.38 | AC23: =VALUE(RC[-27]) -> 2018-10-02T00:00:00.000 | AD23: =IF(RC[21]=42,"*",IF(RC[21]=32,"",RC[21])) -> - | AE23: =RC[-28] -> 24 | AF23: =RC[-28] -> 100.91 | AG23: =RC[-28] -> 66.989999999999995 | AH23: =RC[-28] -> 7.53 | AI23: =RC[-28] -> 89.14 | AJ23: =RC[-28] -> 39.89 | AK23: =RC[-28] -> 1.05 | AL23: =RC[-28] -> 27.099999999999994 | AM23: =RC[-28] -> 11.77 | AN23: =RC[-28] -> 20.96 | AO23: =RC[-28] -> 66.75 | AP23: - | AQ23: =RC[-29] -> 7.14 | AR23: =RC[-29] -> 45.2 | AS23: - | AT23: =RC[-30] -> 21.549999999999997 | AU23: =RC[-30] -> 13.82 | AV23: =RC[-30] -> 1.046 | AW23: =RC[-30] -> 3.2120000000000002 | AY23: - | AZ23: - | BA23: -
A24: =IF(RC[1]="","",DATEVALUE(RC[1])) -> 43376 | B24: 03.10.18 | C24: 24 | D24: 99.09 | E24: 67.13 | F24: 7.53 | G24: 86.62 | H24: 39.76 | I24: 1.05 | J24: =RC[-5]-RC[-2] -> 27.369999999999997 | K24: 12.47 | L24: 21.38 | M24: 66.94 | N24: 6.94 | O24: 44.95 | P24: =IF(AND(ISNUMBER(RC[-3]),ISNUMBER(RC[-1])),RC[-3]-RC[-1],"-") -> 21.989999999999995 | Q24: 14.44 | R24: 1.0900000000000001 | S24: 3.2149999999999999 | T24: =(RC[-16]*RC[-15]-RC[-13]*RC[-12])/1000 -> 3.2079004999999996 | U24: 20.95 | V24: 6.94 | W24: =RC[-2]*RC[-10]/1000 -> 1.4023929999999998 | X24: =ABS((RC[-3]*RC[-11]-RC[-2]*RC[-9])/1000) -> 1.0904399999999999 | Y24: =(RC[-14]-RC[1])/RC[-18]*100 -> -1.777880397136919 | Z24: 14.01 | AC24: =VALUE(RC[-27]) -> 2018-10-03T00:00:00.000 | AD24: =IF(RC[21]=42,"*",IF(RC[21]=32,"",RC[21])) -> - | AE24: =RC[-28] -> 24 | AF24: =RC[-28] -> 99.09 | AG24: =RC[-28] -> 67.13 | AH24: =RC[-28] -> 7.53 | AI24: =RC[-28] -> 86.62 | AJ24: =RC[-28] -> 39.76 | AK24: =RC[-28] -> 1.05 | AL24: =RC[-28] -> 27.369999999999997 | AM24: =RC[-28] -> 12.47 | AN24: =RC[-28] -> 21.38 | AO24: =RC[-28] -> 66.94 | AP24: - | AQ24: =RC[-29] -> 6.94 | AR24: =RC[-29] -> 44.95 | AS24: - | AT24: =RC[-30] -> 21.989999999999995 | AU24: =RC[-30] -> 14.44 | AV24: =RC[-30] -> 1.0900000000000001 | AW24: =RC[-30] -> 3.2149999999999999 | AY24: - | AZ24: - | BA24: -
A25: =IF(RC[1]="","",DATEVALUE(RC[1])) -> 43377 | B25: 04.10.18 | C25: 24 | D25: 94.59 | E25: 66.459999999999994 | F25: 7.53 | G25: 81.78 | H25: 38.590000000000003 | I25: 1.05 | J25: =RC[-5]-RC[-2] -> 27.86999999999999 | K25: 12.81 | L25: 21.28 | M25: 66.23 | N25: 6.54 | O25: 44.05 | P25: =IF(AND(ISNUMBER(RC[-3]),ISNUMBER(RC[-1])),RC[-3]-RC[-1],"-") -> 22.180000000000007 | Q25: 14.74 | R25: 1.095 | S25: 3.137 | T25: =(RC[-16]*RC[-15]-RC[-13]*RC[-12])/1000 -> 3.1305611999999998 | U25: 20.87 | V25: 6.54 | W25: =RC[-2]*RC[-10]/1000 -> 1.3822201000000003 | X25: =ABS((RC[-3]*RC[-11]-RC[-2]*RC[-9])/1000) -> 1.0941331000000003 | Y25: =(RC[-14]-RC[1])/RC[-18]*100 -> -1.8586451455123498 | Z25: 14.33 | AC25: =VALUE(RC[-27]) -> 2018-10-04T00:00:00.000 | AD25: =IF(RC[21]=42,"*",IF(RC[21]=32,"",RC[21])) -> - | AE25: =RC[-28] -> 24 | AF25: =RC[-28] -> 94.59 | AG25: =RC[-28] -> 66.459999999999994 | AH25: =RC[-28] -> 7.53 | AI25: =RC[-28] -> 81.78 | AJ25: =RC[-28] -> 38.590000000000003 | AK25: =RC[-28] -> 1.05 | AL25: =RC[-28] -> 27.86999999999999 | AM25: =RC[-28] -> 12.81 | AN25: =RC[-28] -> 21.28 | AO25: =RC[-28] -> 66.23 | AP25: - | AQ25: =RC[-29] -> 6.54 | AR25: =RC[-29] -> 44.05 | AS25: - | AT25: =RC[-30] -> 22.180000000000007 | AU25: =RC[-30] -> 14.74 | AV25: =RC[-30] -> 1.095 | AW25: =RC[-30] -> 3.137 | AY25: - | AZ25: - | BA25: -
A26: =IF(RC[1]="","",DATEVALUE(RC[1])) -> 43378 | B26: 05.10.18 | C26: 24 | D26: 87.95 | E26: 65.73 | F26: 7.53 | G26: 74.31 | H26: 37.01 | I26: 1.05 | J26: =RC[-5]-RC[-2] -> 28.720000000000006 | K26: 13.64 | L26: 21.5 | M26: 65.510000000000005 | N26: 5.99 | O26: 44.15 | P26: =IF(AND(ISNUMBER(RC[-3]),ISNUMBER(RC[-1])),RC[-3]-RC[-1],"-") -> 21.360000000000007 | Q26: 15.51 | R26: 1.117 | S26: 3.0390000000000001 | T26: =(RC[-16]*RC[-15]-RC[-13]*RC[-12])/1000 -> 3.0307404000000004 | U26: 21.07 | V26: 5.99 | W26: =RC[-2]*RC[-10]/1000 -> 1.3802957 | X26: =ABS((RC[-3]*RC[-11]-RC[-2]*RC[-9])/1000) -> 1.1158372000000001 | Y26: =(RC[-14]-RC[1])/RC[-18]*100 -> -1.9378280177634228 | Z26: 15.08 | AC26: =VALUE(RC[-27]) -> 2018-10-05T00:00:00.000 | AD26: =IF(RC[21]=42,"*",IF(RC[21]=32,"",RC[21])) -> - | AE26: =RC[-28] -> 24 | AF26: =RC[-28] -> 87.95 | AG26: =RC[-28] -> 65.73 | AH26: =RC[-28] -> 7.53 | AI26: =RC[-28] -> 74.31 | AJ26: =RC[-28] -> 37.01 | AK26: =RC[-28] -> 1.05 | AL26: =RC[-28] -> 28.720000000000006 | AM26: =RC[-28] -> 13.64 | AN26: =RC[-28] -> 21.5 | AO26: =RC[-28] -> 65.510000000000005 | AP26: - | AQ26: =RC[-29] -> 5.99 | AR26: =RC[-29] -> 44.15 | AS26: - | AT26: =RC[-30] -> 21.360000000000007 | AU26: =RC[-30] -> 15.51 | AV26: =RC[-30] -> 1.117 | AW26: =RC[-30] -> 3.0390000000000001 | AY26: - | AZ26: - | BA26: -
A27: =IF(RC[1]="","",DATEVALUE(RC[1])) -> 43379 | B27: 06.10.18 | C27: 24 | D27: 88.23 | E27: 66.400000000000006 | F27: 7.53 | G27: 75.209999999999994 | H27: 37.5 | I27: 1.05 | J27: =RC[-5]-RC[-2] -> 28.900000000000006 | K27: 13.02 | L27: 21.01 | M27: 66.23 | N27: 6.1 | O27: 44.78 | P27: =IF(AND(ISNUMBER(RC[-3]),ISNUMBER(RC[-1])),RC[-3]-RC[-1],"-") -> 21.450000000000003 | Q27: 14.91 | R27: 1.0900000000000001 | S27: 3.0459999999999998 | T27: =(RC[-16]*RC[-15]-RC[-13]*RC[-12])/1000 -> 3.0380970000000009 | U27: 20.58 | V27: 6.1 | W27: =RC[-2]*RC[-10]/1000 -> 1.3630134 | X27: =ABS((RC[-3]*RC[-11]-RC[-2]*RC[-9])/1000) -> 1.0898553999999998 | Y27: =(RC[-14]-RC[1])/RC[-18]*100 -> -1.9412312192527603 | Z27: 14.48 | AC27: =VALUE(RC[-27]) -> 2018-10-06T00:00:00.000 | AD27: =IF(RC[21]=42,"*",IF(RC[21]=32,"",RC[21])) -> - | AE27: =RC[-28] -> 24 | AF27: =RC[-28] -> 88.23 | AG27: =RC[-28] -> 66.400000000000006 | AH27: =RC[-28] -> 7.53 | AI27: =RC[-28] -> 75.209999999999994 | AJ27: =RC[-28] -> 37.5 | AK27: =RC[-28] -> 1.05 | AL27: =RC[-28] -> 28.900000000000006 | AM27: =RC[-28] -> 13.02 | AN27: =RC[-28] -> 21.01 | AO27: =RC[-28] -> 66.23 | AP27: - | AQ27: =RC[-29] -> 6.1 | AR27: =RC[-29] -> 44.78 | AS27: - | AT27: =RC[-30] -> 21.450000000000003 | AU27: =RC[-30] -> 14.91 | AV27: =RC[-30] -> 1.0900000000000001 | AW27: =RC[-30] -> 3.0459999999999998 | AY27: - | AZ27: - | BA27: -
A28: =IF(RC[1]="","",DATEVALUE(RC[1])) -> 43380 | B28: 07.10.18 | C28: 24 | D28: 89.37 | E28: 66.650000000000006 | F28: 7.53 | G28: 74.900000000000006 | H28: 37.450000000000003 | I28: 1.04 | J28: =RC[-5]-RC[-2] -> 29.200000000000003 | K28: 14.47 | L28: 22.47 | M28: 66.47 | N28: 6.11 | O28: 44.61 | P28: =IF(AND(ISNUMBER(RC[-3]),ISNUMBER(RC[-1])),RC[-3]-RC[-1],"-") -> 21.86 | Q28: 16.36 | R28: 1.1910000000000001 | S28: 3.1589999999999998 | T28: =(RC[-16]*RC[-15]-RC[-13]*RC[-12])/1000 -> 3.1515055000000007 | U28: 22.03 | V28: 6.11 | W28: =RC[-2]*RC[-10]/1000 -> 1.4643341000000001 | X28: =ABS((RC[-3]*RC[-11]-RC[-2]*RC[-9])/1000) -> 1.191767 | Y28: =(RC[-14]-RC[1])/RC[-18]*100 -> -1.9359145527369817 | Z28: 15.92 | AC28: =VALUE(RC[-27]) -> 2018-10-07T00:00:00.000 | AD28: =IF(RC[21]=42,"*",IF(RC[21]=32,"",RC[21])) -> - | AE28: =RC[-28] -> 24 | AF28: =RC[-28] -> 89.37 | AG28: =RC[-28] -> 66.650000000000006 | AH28: =RC[-28] -> 7.53 | AI28: =RC[-28] -> 74.900000000000006 | AJ28: =RC[-28] -> 37.450000000000003 | AK28: =RC[-28] -> 1.04 | AL28: =RC[-28] -> 29.200000000000003 | AM28: =RC[-28] -> 14.47 | AN28: =RC[-28] -> 22.47 | AO28: =RC[-28] -> 66.47 | AP28: - | AQ28: =RC[-29] -> 6.11 | AR28: =RC[-29] -> 44.61 | AS28: - | AT28: =RC[-30] -> 21.86 | AU28: =RC[-30] -> 16.36 | AV28: =RC[-30] -> 1.1910000000000001 | AW28: =RC[-30] -> 3.1589999999999998 | AY28: - | AZ28: - | BA28: -
A29: =IF(RC[1]="","",DATEVALUE(RC[1])) -> 43381 | B29: 08.10.18 | C29: 24 | D29: 89.07 | E29: 66.63 | F29: 7.53 | G29: 73.92 | H29: 37.049999999999997 | I29: 1.05 | J29: =RC[-5]-RC[-2] -> 29.58 | K29: 15.15 | L29: 23.1 | M29: 66.430000000000007 | N29: 6.05 | O29: 45.41 | P29: =IF(AND(ISNUMBER(RC[-3]),ISNUMBER(RC[-1])),RC[-3]-RC[-1],"-") -> 21.02000000000001 | Q29: 17.05 | R29: 1.2290000000000001 | S29: 3.2029999999999998 | T29: =(RC[-16]*RC[-15]-RC[-13]*RC[-12])/1000 -> 3.1959980999999988 | U29: 22.64 | V29: 6.05 | W29: =RC[-2]*RC[-10]/1000 -> 1.5039752000000002 | X29: =ABS((RC[-3]*RC[-11]-RC[-2]*RC[-9])/1000) -> 1.2292447000000002 | Y29: =(RC[-14]-RC[1])/RC[-18]*100 -> -1.9480519480519474 | Z29: 16.59 | AC29: =VALUE(RC[-27]) -> 2018-10-08T00:00:00.000 | AD29: =IF(RC[21]=42,"*",IF(RC[21]=32,"",RC[21])) -> - | AE29: =RC[-28] -> 24 | AF29: =RC[-28] -> 89.07 | AG29: =RC[-28] -> 66.63 | AH29: =RC[-28] -> 7.53 | AI29: =RC[-28] -> 73.92 | AJ29: =RC[-28] -> 37.049999999999997 | AK29: =RC[-28] -> 1.05 | AL29: =RC[-28] -> 29.58 | AM29: =RC[-28] -> 15.15 | AN29: =RC[-28] -> 23.1 | AO29: =RC[-28] -> 66.430000000000007 | AP29: - | AQ29: =RC[-29] -> 6.05 | AR29: =RC[-29] -> 45.41 | AS29: - | AT29: =RC[-30] -> 21.02000000000001 | AU29: =RC[-30] -> 17.05 | AV29: =RC[-30] -> 1.2290000000000001 | AW29: =RC[-30] -> 3.2029999999999998 | AY29: - | AZ29: - | BA29: -
A30: =IF(RC[1]="","",DATEVALUE(RC[1])) -> 43382 | B30: 09.10.18 | C30: 24 | D30: 89.69 | E30: 66.510000000000005 | F30: 7.53 | G30: 76.69 | H30: 37.47 | I30: 1.05 | J30: =RC[-5]-RC[-2] -> 29.040000000000006 | K30: 13 | L30: 21.08 | M30: 66.31 | N30: 6.28 | O30: 44.12 | P30: =IF(AND(ISNUMBER(RC[-3]),ISNUMBER(RC[-1])),RC[-3]-RC[-1],"-") -> 22.190000000000005 | Q30: 14.8 | R30: 1.093 | S30: 3.097 | T30: =(RC[-16]*RC[-15]-RC[-13]*RC[-12])/1000 -> 3.0917076000000003 | U30: 20.66 | V30: 6.28 | W30: =RC[-2]*RC[-10]/1000 -> 1.3699646000000001 | X30: =ABS((RC[-3]*RC[-11]-RC[-2]*RC[-9])/1000) -> 1.0928910000000001 | Y30: =(RC[-14]-RC[1])/RC[-18]*100 -> -1.7994523405919949 | Z30: 14.38 | AC30: =VALUE(RC[-27]) -> 2018-10-09T00:00:00.000 | AD30: =IF(RC[21]=42,"*",IF(RC[21]=32,"",RC[21])) -> - | AE30: =RC[-28] -> 24 | AF30: =RC[-28] -> 89.69 | AG30: =RC[-28] -> 66.510000000000005 | AH30: =RC[-28] -> 7.53 | AI30: =RC[-28] -> 76.69 | AJ30: =RC[-28] -> 37.47 | AK30: =RC[-28] -> 1.05 | AL30: =RC[-28] -> 29.040000000000006 | AM30: =RC[-28] -> 13 | AN30: =RC[-28] -> 21.08 | AO30: =RC[-28] -> 66.31 | AP30: - | AQ30: =RC[-29] -> 6.28 | AR30: =RC[-29] -> 44.12 | AS30: - | AT30: =RC[-30] -> 22.190000000000005 | AU30: =RC[-30] -> 14.8 | AV30: =RC[-30] -> 1.093 | AW30: =RC[-30] -> 3.097 | AY30: - | AZ30: - | BA30: -
A31: =IF(RC[1]="","",DATEVALUE(RC[1])) -> 43383 | B31: 10.10.18 | C31: 24 | D31: 90.85 | E31: 67.53 | F31: 7.53 | G31: 76.900000000000006 | H31: 38.18 | I31: 1.05 | J31: =RC[-5]-RC[-2] -> 29.35 | K31: 13.95 | L31: 22.16 | M31: 67.39 | N31: 6.3 | O31: 45.32 | P31: =IF(AND(ISNUMBER(RC[-3]),ISNUMBER(RC[-1])),RC[-3]-RC[-1],"-") -> 22.07 | Q31: 15.86 | R31: 1.1739999999999999 | S31: 3.2069999999999999 | T31: =(RC[-16]*RC[-15]-RC[-13]*RC[-12])/1000 -> 3.1990584999999991 | U31: 21.69 | V31: 6.3 | W31: =RC[-2]*RC[-10]/1000 -> 1.4616891000000001 | X31: =ABS((RC[-3]*RC[-11]-RC[-2]*RC[-9])/1000) -> 1.1761731 | Y31: =(RC[-14]-RC[1])/RC[-18]*100 -> -1.8725617685305607 | Z31: 15.39 | AC31: =VALUE(RC[-27]) -> 2018-10-10T00:00:00.000 | AD31: =IF(RC[21]=42,"*",IF(RC[21]=32,"",RC[21])) -> - | AE31: =RC[-28] -> 24 | AF31: =RC[-28] -> 90.85 | AG31: =RC[-28] -> 67.53 | AH31: =RC[-28] -> 7.53 | AI31: =RC[-28] -> 76.900000000000006 | AJ31: =RC[-28] -> 38.18 | AK31: =RC[-28] -> 1.05 | AL31: =RC[-28] -> 29.35 | AM31: =RC[-28] -> 13.95 | AN31: =RC[-28] -> 22.16 | AO31: =RC[-28] -> 67.39 | AP31: - | AQ31: =RC[-29] -> 6.3 | AR31: =RC[-29] -> 45.32 | AS31: - | AT31: =RC[-30] -> 22.07 | AU31: =RC[-30] -> 15.86 | AV31: =RC[-30] -> 1.1739999999999999 | AW31: =RC[-30] -> 3.2069999999999999 | AY31: - | AZ31: - | BA31: -
A32: =IF(RC[1]="","",DATEVALUE(RC[1])) -> 43384 | B32: 11.10.18 | C32: 24 | D32: 92.31 | E32: 68.62 | F32: 7.53 | G32: 79.19 | H32: 39.01 | I32: 1.05 | J32: =RC[-5]-RC[-2] -> 29.610000000000007 | K32: 13.12 | L32: 21.45 | M32: 68.38 | N32: 6.5 | O32: 45.56 | P32: =IF(AND(ISNUMBER(RC[-3]),ISNUMBER(RC[-1])),RC[-3]-RC[-1],"-") -> 22.819999999999993 | Q32: 14.95 | R32: 1.1399999999999999 | S32: 3.2519999999999998 | T32: =(RC[-16]*RC[-15]-RC[-13]*RC[-12])/1000 -> 3.2451103000000008 | U32: 21 | V32: 6.5 | W32: =RC[-2]*RC[-10]/1000 -> 1.43598 | X32: =ABS((RC[-3]*RC[-11]-RC[-2]*RC[-9])/1000) -> 1.1398400000000002 | Y32: =(RC[-14]-RC[1])/RC[-18]*100 -> -1.7426442732668277 | Z32: 14.5 | AC32: =VALUE(RC[-27]) -> 2018-10-11T00:00:00.000 | AD32: =IF(RC[21]=42,"*",IF(RC[21]=32,"",RC[21])) -> - | AE32: =RC[-28] -> 24 | AF32: =RC[-28] -> 92.31 | AG32: =RC[-28] -> 68.62 | AH32: =RC[-28] -> 7.53 | AI32: =RC[-28] -> 79.19 | AJ32: =RC[-28] -> 39.01 | AK32: =RC[-28] -> 1.05 | AL32: =RC[-28] -> 29.610000000000007 | AM32: =RC[-28] -> 13.12 | AN32: =RC[-28] -> 21.45 | AO32: =RC[-28] -> 68.38 | AP32: - | AQ32: =RC[-29] -> 6.5 | AR32: =RC[-29] -> 45.56 | AS32: - | AT32: =RC[-30] -> 22.819999999999993 | AU32: =RC[-30] -> 14.95 | AV32: =RC[-30] -> 1.1399999999999999 | AW32: =RC[-30] -> 3.2519999999999998 | AY32: - | AZ32: - | BA32: -
A33: =IF(RC[1]="","",DATEVALUE(RC[1])) -> 43385 | B33: 12.10.18 | C33: 24 | D33: 91.44 | E33: 68.459999999999994 | F33: 7.53 | G33: 78.260000000000005 | H33: 38.81 | I33: 1.05 | J33: =RC[-5]-RC[-2] -> 29.649999999999991 | K33: 13.18 | L33: 21.47 | M33: 68.23 | N33: 6.42 | O33: 45.6 | P33: =IF(AND(ISNUMBER(RC[-3]),ISNUMBER(RC[-1])),RC[-3]-RC[-1],"-") -> 22.630000000000003 | Q33: 15.05 | R33: 1.143 | S33: 3.2290000000000001 | T33: =(RC[-16]*RC[-15]-RC[-13]*RC[-12])/1000 -> 3.2227117999999986 | U33: 21.04 | V33: 6.42 | W33: =RC[-2]*RC[-10]/1000 -> 1.4355591999999999 | X33: =ABS((RC[-3]*RC[-11]-RC[-2]*RC[-9])/1000) -> 1.1428072 | Y33: =(RC[-14]-RC[1])/RC[-18]*100 -> -1.8400204446716066 | Z33: 14.62 | AC33: =VALUE(RC[-27]) -> 2018-10-12T00:00:00.000 | AD33: =IF(RC[21]=42,"*",IF(RC[21]=32,"",RC[21])) -> - | AE33: =RC[-28] -> 24 | AF33: =RC[-28] -> 91.44 | AG33: =RC[-28] -> 68.459999999999994 | AH33: =RC[-28] -> 7.53 | AI33: =RC[-28] -> 78.260000000000005 | AJ33: =RC[-28] -> 38.81 | AK33: =RC[-28] -> 1.05 | AL33: =RC[-28] -> 29.649999999999991 | AM33: =RC[-28] -> 13.18 | AN33: =RC[-28] -> 21.47 | AO33: =RC[-28] -> 68.23 | AP33: - | AQ33: =RC[-29] -> 6.42 | AR33: =RC[-29] -> 45.6 | AS33: - | AT33: =RC[-30] -> 22.630000000000003 | AU33: =RC[-30] -> 15.05 | AV33: =RC[-30] -> 1.143 | AW33: =RC[-30] -> 3.2290000000000001 | AY33: - | AZ33: - | BA33: -
A34: =IF(RC[1]="","",DATEVALUE(RC[1])) -> 43386 | B34: 13.10.18 | C34: 24 | D34: 94.58 | E34: 69.599999999999994 | F34: 7.53 | G34: 81.78 | H34: 40.01 | I34: 1.05 | J34: =RC[-5]-RC[-2] -> 29.589999999999996 | K34: 12.8 | L34: 21.33 | M34: 69.41 | N34: 6.74 | O34: 46.33 | P34: =IF(AND(ISNUMBER(RC[-3]),ISNUMBER(RC[-1])),RC[-3]-RC[-1],"-") -> 23.08 | Q34: 14.59 | R34: 1.135 | S34: 3.319 | T34: =(RC[-16]*RC[-15]-RC[-13]*RC[-12])/1000 -> 3.3107501999999989 | U34: 20.88 | V34: 6.74 | W34: =RC[-2]*RC[-10]/1000 -> 1.4492807999999997 | X34: =ABS((RC[-3]*RC[-11]-RC[-2]*RC[-9])/1000) -> 1.1370165999999997 | Y34: =(RC[-14]-RC[1])/RC[-18]*100 -> -1.6385424309122032 | Z34: 14.14 | AC34: =VALUE(RC[-27]) -> 2018-10-13T00:00:00.000 | AD34: =IF(RC[21]=42,"*",IF(RC[21]=32,"",RC[21])) -> - | AE34: =RC[-28] -> 24 | AF34: =RC[-28] -> 94.58 | AG34: =RC[-28] -> 69.599999999999994 | AH34: =RC[-28] -> 7.53 | AI34: =RC[-28] -> 81.78 | AJ34: =RC[-28] -> 40.01 | AK34: =RC[-28] -> 1.05 | AL34: =RC[-28] -> 29.589999999999996 | AM34: =RC[-28] -> 12.8 | AN34: =RC[-28] -> 21.33 | AO34: =RC[-28] -> 69.41 | AP34: - | AQ34: =RC[-29] -> 6.74 | AR34: =RC[-29] -> 46.33 | AS34: - | AT34: =RC[-30] -> 23.08 | AU34: =RC[-30] -> 14.59 | AV34: =RC[-30] -> 1.135 | AW34: =RC[-30] -> 3.319 | AY34: - | AZ34: - | BA34: -
A35: =IF(RC[1]="","",DATEVALUE(RC[1])) -> 43387 | B35: 14.10.18 | C35: 24 | D35: 97.13 | E35: 70.39 | F35: 7.53 | G35: 82.82 | H35: 41.01 | I35: 1.05 | J35: =RC[-5]-RC[-2] -> 29.380000000000003 | K35: 14.31 | L35: 23.01 | M35: 70.260000000000005 | N35: 6.82 | O35: 47.47 | P35: =IF(AND(ISNUMBER(RC[-3]),ISNUMBER(RC[-1])),RC[-3]-RC[-1],"-") -> 22.790000000000006 | Q35: 16.190000000000001 | R35: 1.2589999999999999 | S35: 3.45 | T35: =(RC[-16]*RC[-15]-RC[-13]*RC[-12])/1000 -> 3.4405325000000007 | U35: 22.53 | V35: 6.82 | W35: =RC[-2]*RC[-10]/1000 -> 1.5829578000000002 | X35: =ABS((RC[-3]*RC[-11]-RC[-2]*RC[-9])/1000) -> 1.2592124 | Y35: =(RC[-14]-RC[1])/RC[-18]*100 -> -1.6904129437333981 | Z35: 15.71 | AC35: =VALUE(RC[-27]) -> 2018-10-14T00:00:00.000 | AD35: =IF(RC[21]=42,"*",IF(RC[21]=32,"",RC[21])) -> - | AE35: =RC[-28] -> 24 | AF35: =RC[-28] -> 97.13 | AG35: =RC[-28] -> 70.39 | AH35: =RC[-28] -> 7.53 | AI35: =RC[-28] -> 82.82 | AJ35: =RC[-28] -> 41.01 | AK35: =RC[-28] -> 1.05 | AL35: =RC[-28] -> 29.380000000000003 | AM35: =RC[-28] -> 14.31 | AN35: =RC[-28] -> 23.01 | AO35: =RC[-28] -> 70.260000000000005 | AP35: - | AQ35: =RC[-29] -> 6.82 | AR35: =RC[-29] -> 47.47 | AS35: - | AT35: =RC[-30] -> 22.790000000000006 | AU35: =RC[-30] -> 16.190000000000001 | AV35: =RC[-30] -> 1.2589999999999999 | AW35: =RC[-30] -> 3.45 | AY35: - | AZ35: - | BA35: -
A36: =IF(RC[1]="","",DATEVALUE(RC[1])) -> 43388 | B36: 15.10.18 | C36: 24 | D36: 98.36 | E36: 69.819999999999993 | F36: 7.53 | G36: 84.99 | H36: 41.37 | I36: 1.06 | J36: =RC[-5]-RC[-2] -> 28.449999999999996 | K36: 13.37 | L36: 22.28 | M36: 69.59 | N36: 7.01 | O36: 47.18 | P36: =IF(AND(ISNUMBER(RC[-3]),ISNUMBER(RC[-1])),RC[-3]-RC[-1],"-") -> 22.410000000000004 | Q36: 15.27 | R36: 1.1850000000000001 | S36: 3.3580000000000001 | T36: =(RC[-16]*RC[-15]-RC[-13]*RC[-12])/1000 -> 3.3514588999999995 | U36: 21.81 | V36: 7.01 | W36: =RC[-2]*RC[-10]/1000 -> 1.5177579000000001 | X36: =ABS((RC[-3]*RC[-11]-RC[-2]*RC[-9])/1000) -> 1.1870261 | Y36: =(RC[-14]-RC[1])/RC[-18]*100 -> -1.6825508883398066 | Z36: 14.8 | AC36: =VALUE(RC[-27]) -> 2018-10-15T00:00:00.000 | AD36: =IF(RC[21]=42,"*",IF(RC[21]=32,"",RC[21])) -> - | AE36: =RC[-28] -> 24 | AF36: =RC[-28] -> 98.36 | AG36: =RC[-28] -> 69.819999999999993 | AH36: =RC[-28] -> 7.53 | AI36: =RC[-28] -> 84.99 | AJ36: =RC[-28] -> 41.37 | AK36: =RC[-28] -> 1.06 | AL36: =RC[-28] -> 28.449999999999996 | AM36: =RC[-28] -> 13.37 | AN36: =RC[-28] -> 22.28 | AO36: =RC[-28] -> 69.59 | AP36: - | AQ36: =RC[-29] -> 7.01 | AR36: =RC[-29] -> 47.18 | AS36: - | AT36: =RC[-30] -> 22.410000000000004 | AU36: =RC[-30] -> 15.27 | AV36: =RC[-30] -> 1.1850000000000001 | AW36: =RC[-30] -> 3.3580000000000001 | AY36: - | AZ36: - | BA36: -
A37: =IF(RC[1]="","",DATEVALUE(RC[1])) -> 43389 | B37: 16.10.18 | C37: 24 | D37: 97.76 | E37: 69.81 | F37: 7.53 | G37: 85.47 | H37: 41.51 | I37: 1.05 | J37: =RC[-5]-RC[-2] -> 28.300000000000004 | K37: 12.29 | L37: 21.2 | M37: 69.58 | N37: 7.03 | O37: 46.41 | P37: =IF(AND(ISNUMBER(RC[-3]),ISNUMBER(RC[-1])),RC[-3]-RC[-1],"-") -> 23.17 | Q37: 14.17 | R37: 1.1180000000000001 | S37: 3.2839999999999998 | T37: =(RC[-16]*RC[-15]-RC[-13]*RC[-12])/1000 -> 3.2767659000000005 | U37: 20.75 | V37: 7.03 | W37: =RC[-2]*RC[-10]/1000 -> 1.4437849999999999 | X37: =ABS((RC[-3]*RC[-11]-RC[-2]*RC[-9])/1000) -> 1.1175227000000001 | Y37: =(RC[-14]-RC[1])/RC[-18]*100 -> -1.6731016731016748 | Z37: 13.72 | AC37: =VALUE(RC[-27]) -> 2018-10-16T00:00:00.000 | AD37: =IF(RC[21]=42,"*",IF(RC[21]=32,"",RC[21])) -> - | AE37: =RC[-28] -> 24 | AF37: =RC[-28] -> 97.76 | AG37: =RC[-28] -> 69.81 | AH37: =RC[-28] -> 7.53 | AI37: =RC[-28] -> 85.47 | AJ37: =RC[-28] -> 41.51 | AK37: =RC[-28] -> 1.05 | AL37: =RC[-28] -> 28.300000000000004 | AM37: =RC[-28] -> 12.29 | AN37: =RC[-28] -> 21.2 | AO37: =RC[-28] -> 69.58 | AP37: - | AQ37: =RC[-29] -> 7.03 | AR37: =RC[-29] -> 46.41 | AS37: - | AT37: =RC[-30] -> 23.17 | AU37: =RC[-30] -> 14.17 | AV37: =RC[-30] -> 1.1180000000000001 | AW37: =RC[-30] -> 3.2839999999999998 | AY37: - | AZ37: - | BA37: -
A38: =IF(RC[1]="","",DATEVALUE(RC[1])) -> 43390 | B38: 17.10.18 | C38: 24 | D38: 100.21 | E38: 70.06 | F38: 7.53 | G38: 87.16 | H38: 42.13 | I38: 1.05 | J38: =RC[-5]-RC[-2] -> 27.93 | K38: 13.05 | L38: 22.24 | M38: 69.88 | N38: 7.16 | O38: 47.53 | P38: =IF(AND(ISNUMBER(RC[-3]),ISNUMBER(RC[-1])),RC[-3]-RC[-1],"-") -> 22.349999999999994 | Q38: 15.08 | R38: 1.179 | S38: 3.355 | T38: =(RC[-16]*RC[-15]-RC[-13]*RC[-12])/1000 -> 3.3486617999999999 | U38: 21.76 | V38: 7.16 | W38: =RC[-2]*RC[-10]/1000 -> 1.5205888000000001 | X38: =ABS((RC[-3]*RC[-11]-RC[-2]*RC[-9])/1000) -> 1.1802739999999998 | Y38: =(RC[-14]-RC[1])/RC[-18]*100 -> -1.7783386874713161 | Z38: 14.6 | AC38: =VALUE(RC[-27]) -> 2018-10-17T00:00:00.000 | AD38: =IF(RC[21]=42,"*",IF(RC[21]=32,"",RC[21])) -> - | AE38: =RC[-28] -> 24 | AF38: =RC[-28] -> 100.21 | AG38: =RC[-28] -> 70.06 | AH38: =RC[-28] -> 7.53 | AI38: =RC[-28] -> 87.16 | AJ38: =RC[-28] -> 42.13 | AK38: =RC[-28] -> 1.05 | AL38: =RC[-28] -> 27.93 | AM38: =RC[-28] -> 13.05 | AN38: =RC[-28] -> 22.24 | AO38: =RC[-28] -> 69.88 | AP38: - | AQ38: =RC[-29] -> 7.16 | AR38: =RC[-29] -> 47.53 | AS38: - | AT38: =RC[-30] -> 22.349999999999994 | AU38: =RC[-30] -> 15.08 | AV38: =RC[-30] -> 1.179 | AW38: =RC[-30] -> 3.355 | AY38: - | AZ38: - | BA38: -
A39: =IF(RC[1]="","",DATEVALUE(RC[1])) -> 43391 | B39: 18.10.18 | C39: 24 | D39: 98.43 | E39: 70.53 | F39: 7.53 | G39: 87.03 | H39: 42.22 | I39: 1.05 | J39: =RC[-5]-RC[-2] -> 28.310000000000002 | K39: 11.4 | L39: 20.52 | M39: 70.319999999999993 | N39: 7.13 | O39: 46.42 | P39: =IF(AND(ISNUMBER(RC[-3]),ISNUMBER(RC[-1])),RC[-3]-RC[-1],"-") -> 23.899999999999991 | Q39: 13.39 | R39: 1.08 | S39: 3.2749999999999999 | T39: =(RC[-16]*RC[-15]-RC[-13]*RC[-12])/1000 -> 3.2678613000000007 | U39: 20.07 | V39: 7.13 | W39: =RC[-2]*RC[-10]/1000 -> 1.4113223999999998 | X39: =ABS((RC[-3]*RC[-11]-RC[-2]*RC[-9])/1000) -> 1.0803477999999997 | Y39: =(RC[-14]-RC[1])/RC[-18]*100 -> -1.7695047684706411 | Z39: 12.94 | AC39: =VALUE(RC[-27]) -> 2018-10-18T00:00:00.000 | AD39: =IF(RC[21]=42,"*",IF(RC[21]=32,"",RC[21])) -> - | AE39: =RC[-28] -> 24 | AF39: =RC[-28] -> 98.43 | AG39: =RC[-28] -> 70.53 | AH39: =RC[-28] -> 7.53 | AI39: =RC[-28] -> 87.03 | AJ39: =RC[-28] -> 42.22 | AK39: =RC[-28] -> 1.05 | AL39: =RC[-28] -> 28.310000000000002 | AM39: =RC[-28] -> 11.4 | AN39: =RC[-28] -> 20.52 | AO39: =RC[-28] -> 70.319999999999993 | AP39: - | AQ39: =RC[-29] -> 7.13 | AR39: =RC[-29] -> 46.42 | AS39: - | AT39: =RC[-30] -> 23.899999999999991 | AU39: =RC[-30] -> 13.39 | AV39: =RC[-30] -> 1.08 | AW39: =RC[-30] -> 3.2749999999999999 | AY39: - | AZ39: - | BA39: -
A40: =IF(RC[1]="","",DATEVALUE(RC[1])) -> 43392 | B40: 19.10.18 | C40: 24 | D40: 97.65 | E40: 70.34 | F40: 7.53 | G40: 86.96 | H40: 41.89 | I40: 1.05 | J40: =RC[-5]-RC[-2] -> 28.450000000000003 | K40: 10.69 | L40: 19.66 | M40: 70.069999999999993 | N40: 7.15 | O40: 45.8 | P40: =IF(AND(ISNUMBER(RC[-3]),ISNUMBER(RC[-1])),RC[-3]-RC[-1],"-") -> 24.269999999999996 | Q40: 12.51 | R40: 1.0209999999999999 | S40: 3.234 | T40: =(RC[-16]*RC[-15]-RC[-13]*RC[-12])/1000 -> 3.2259466000000012 | U40: 19.23 | V40: 7.15 | W40: =RC[-2]*RC[-10]/1000 -> 1.3474461 | X40: =ABS((RC[-3]*RC[-11]-RC[-2]*RC[-9])/1000) -> 1.0199760999999998 | Y40: =(RC[-14]-RC[1])/RC[-18]*100 -> -1.5984360625574983 | Z40: 12.08 | AC40: =VALUE(RC[-27]) -> 2018-10-19T00:00:00.000 | AD40: =IF(RC[21]=42,"*",IF(RC[21]=32,"",RC[21])) -> - | AE40: =RC[-28] -> 24 | AF40: =RC[-28] -> 97.65 | AG40: =RC[-28] -> 70.34 | AH40: =RC[-28] -> 7.53 | AI40: =RC[-28] -> 86.96 | AJ40: =RC[-28] -> 41.89 | AK40: =RC[-28] -> 1.05 | AL40: =RC[-28] -> 28.450000000000003 | AM40: =RC[-28] -> 10.69 | AN40: =RC[-28] -> 19.66 | AO40: =RC[-28] -> 70.069999999999993 | AP40: - | AQ40: =RC[-29] -> 7.15 | AR40: =RC[-29] -> 45.8 | AS40: - | AT40: =RC[-30] -> 24.269999999999996 | AU40: =RC[-30] -> 12.51 | AV40: =RC[-30] -> 1.0209999999999999 | AW40: =RC[-30] -> 3.234 | AY40: - | AZ40: - | BA40: -
A41: =IF(RC[1]="","",DATEVALUE(RC[1])) -> 43393 | B41: 20.10.18 | C41: 24 | D41: 94.47 | E41: 69.599999999999994 | F41: 7.53 | G41: 83.18 | H41: 40.96 | I41: 1.05 | J41: =RC[-5]-RC[-2] -> 28.639999999999993 | K41: 11.29 | L41: 19.97 | M41: 69.36 | N41: 6.84 | O41: 45.34 | P41: =IF(AND(ISNUMBER(RC[-3]),ISNUMBER(RC[-1])),RC[-3]-RC[-1],"-") -> 24.019999999999996 | Q41: 13.13 | R41: 1.048 | S41: 3.1749999999999998 | T41: =(RC[-16]*RC[-15]-RC[-13]*RC[-12])/1000 -> 3.1680591999999987 | U41: 19.55 | V41: 6.84 | W41: =RC[-2]*RC[-10]/1000 -> 1.355988 | X41: =ABS((RC[-3]*RC[-11]-RC[-2]*RC[-9])/1000) -> 1.0458624000000001 | Y41: =(RC[-14]-RC[1])/RC[-18]*100 -> -1.7071411396970444 | Z41: 12.71 | AC41: =VALUE(RC[-27]) -> 2018-10-20T00:00:00.000 | AD41: =IF(RC[21]=42,"*",IF(RC[21]=32,"",RC[21])) -> - | AE41: =RC[-28] -> 24 | AF41: =RC[-28] -> 94.47 | AG41: =RC[-28] -> 69.599999999999994 | AH41: =RC[-28] -> 7.53 | AI41: =RC[-28] -> 83.18 | AJ41: =RC[-28] -> 40.96 | AK41: =RC[-28] -> 1.05 | AL41: =RC[-28] -> 28.639999999999993 | AM41: =RC[-28] -> 11.29 | AN41: =RC[-28] -> 19.97 | AO41: =RC[-28] -> 69.36 | AP41: - | AQ41: =RC[-29] -> 6.84 | AR41: =RC[-29] -> 45.34 | AS41: - | AT41: =RC[-30] -> 24.019999999999996 | AU41: =RC[-30] -> 13.13 | AV41: =RC[-30] -> 1.048 | AW41: =RC[-30] -> 3.1749999999999998 | AY41: - | AZ41: - | BA41: -
A42: =IF(RC[1]="","",DATEVALUE(RC[1])) -> 43394 | B42: 21.10.18 | C42: 24 | D42: 95.79 | E42: 68.78 | F42: 7.53 | G42: 82.84 | H42: 40.51 | I42: 1.05 | J42: =RC[-5]-RC[-2] -> 28.270000000000003 | K42: 12.95 | L42: 21.67 | M42: 68.569999999999993 | N42: 6.81 | O42: 45.36 | P42: =IF(AND(ISNUMBER(RC[-3]),ISNUMBER(RC[-1])),RC[-3]-RC[-1],"-") -> 23.209999999999994 | Q42: 14.86 | R42: 1.149 | S42: 3.2429999999999999 | T42: =(RC[-16]*RC[-15]-RC[-13]*RC[-12])/1000 -> 3.2325878000000001 | U42: 21.23 | V42: 6.81 | W42: =RC[-2]*RC[-10]/1000 -> 1.4557411 | X42: =ABS((RC[-3]*RC[-11]-RC[-2]*RC[-9])/1000) -> 1.1468395 | Y42: =(RC[-14]-RC[1])/RC[-18]*100 -> -1.7745050700144864 | Z42: 14.42 | AC42: =VALUE(RC[-27]) -> 2018-10-21T00:00:00.000 | AD42: =IF(RC[21]=42,"*",IF(RC[21]=32,"",RC[21])) -> - | AE42: =RC[-28] -> 24 | AF42: =RC[-28] -> 95.79 | AG42: =RC[-28] -> 68.78 | AH42: =RC[-28] -> 7.53 | AI42: =RC[-28] -> 82.84 | AJ42: =RC[-28] -> 40.51 | AK42: =RC[-28] -> 1.05 | AL42: =RC[-28] -> 28.270000000000003 | AM42: =RC[-28] -> 12.95 | AN42: =RC[-28] -> 21.67 | AO42: =RC[-28] -> 68.569999999999993 | AP42: - | AQ42: =RC[-29] -> 6.81 | AR42: =RC[-29] -> 45.36 | AS42: - | AT42: =RC[-30] -> 23.209999999999994 | AU42: =RC[-30] -> 14.86 | AV42: =RC[-30] -> 1.149 | AW42: =RC[-30] -> 3.2429999999999999 | AY42: - | AZ42: - | BA42: -
A43: =IF(RC[1]="","",DATEVALUE(RC[1])) -> 43395 | B43: 22.10.18 | C43: 24 | D43: 93.51 | E43: 69.260000000000005 | F43: 7.53 | G43: 82.03 | H43: 40.26 | I43: 1.05 | J43: =RC[-5]-RC[-2] -> 29.000000000000007 | K43: 11.48 | L43: 20.059999999999999 | M43: 69.08 | N43: 6.76 | O43: 44.85 | P43: =IF(AND(ISNUMBER(RC[-3]),ISNUMBER(RC[-1])),RC[-3]-RC[-1],"-") -> 24.229999999999997 | Q43: 13.3 | R43: 1.052 | S43: 3.181 | T43: =(RC[-16]*RC[-15]-RC[-13]*RC[-12])/1000 -> 3.1739748000000008 | U43: 19.62 | V43: 6.76 | W43: =RC[-2]*RC[-10]/1000 -> 1.3553496 | X43: =ABS((RC[-3]*RC[-11]-RC[-2]*RC[-9])/1000) -> 1.0521636000000001 | Y43: =(RC[-14]-RC[1])/RC[-18]*100 -> -1.6823113495062769 | Z43: 12.86 | AC43: =VALUE(RC[-27]) -> 2018-10-22T00:00:00.000 | AD43: =IF(RC[21]=42,"*",IF(RC[21]=32,"",RC[21])) -> - | AE43: =RC[-28] -> 24 | AF43: =RC[-28] -> 93.51 | AG43: =RC[-28] -> 69.260000000000005 | AH43: =RC[-28] -> 7.53 | AI43: =RC[-28] -> 82.03 | AJ43: =RC[-28] -> 40.26 | AK43: =RC[-28] -> 1.05 | AL43: =RC[-28] -> 29.000000000000007 | AM43: =RC[-28] -> 11.48 | AN43: =RC[-28] -> 20.059999999999999 | AO43: =RC[-28] -> 69.08 | AP43: - | AQ43: =RC[-29] -> 6.76 | AR43: =RC[-29] -> 44.85 | AS43: - | AT43: =RC[-30] -> 24.229999999999997 | AU43: =RC[-30] -> 13.3 | AV43: =RC[-30] -> 1.052 | AW43: =RC[-30] -> 3.181 | AY43: - | AZ43: - | BA43: -
A44: =IF(RC[1]="","",DATEVALUE(RC[1])) ->  | C44: 24 | J44: =RC[-5]-RC[-2] -> #VALUE! | P44: =IF(AND(ISNUMBER(RC[-3]),ISNUMBER(RC[-1])),RC[-3]-RC[-1],"-") -> - | T44: =(RC[-16]*RC[-15]-RC[-13]*RC[-12])/1000 -> #VALUE! | W44: =RC[-2]*RC[-10]/1000 -> #VALUE! | X44: =ABS((RC[-3]*RC[-11]-RC[-2]*RC[-9])/1000) -> #VALUE! | Y44: =(RC[-14]-RC[1])/RC[-18]*100 -> #VALUE! | AC44: =VALUE(RC[-27]) -> #VALUE! | AD44: =IF(RC[21]=42,"*",IF(RC[21]=32,"",RC[21])) ->  | AE44: =RC[-28] -> 24 | AF44: =RC[-28] ->  | AG44: =RC[-28] ->  | AH44: =RC[-28] ->  | AI44: =RC[-28] ->  | AJ44: =RC[-28] ->  | AK44: =RC[-28] ->  | AL44: =RC[-28] -> #VALUE! | AM44: =RC[-28] ->  | AN44: =RC[-28] ->  | AO44: =RC[-28] ->  | AP44: - | AQ44: =RC[-29] ->  | AR44: =RC[-29] ->  | AS44: - | AT44: =RC[-30] -> - | AU44: =RC[-30] ->  | AV44: =RC[-30] ->  | AW44: =RC[-30] -> 
A45: =IF(RC[1]="","",DATEVALUE(RC[1])) ->  | C45: 24 | P45: =IF(AND(ISNUMBER(RC[-3]),ISNUMBER(RC[-1])),RC[-3]-RC[-1],"-") -> - | T45: =(RC[-16]*RC[-15]-RC[-13]*RC[-12])/1000 -> #VALUE! | W45: =RC[-2]*RC[-10]/1000 -> #VALUE! | X45: =ABS((RC[-3]*RC[-11]-RC[-2]*RC[-9])/1000) -> #VALUE! | Y45: =(RC[-14]-RC[1])/RC[-18]*100 -> #VALUE! | AC45: =VALUE(RC[-27]) -> #VALUE! | AD45: =IF(RC[21]=42,"*",IF(RC[21]=32,"",RC[21])) ->  | AE45: =RC[-28] -> 24 | AF45: =RC[-28] ->  | AG45: =RC[-28] ->  | AH45: =RC[-28] ->  | AI45: =RC[-28] ->  | AJ45: =RC[-28] ->  | AK45: =RC[-28] ->  | AL45: =RC[-28] -> 0 | AM45: =RC[-28] ->  | AN45: =RC[-28] ->  | AO45: =RC[-28] ->  | AP45: - | AQ45: =RC[-29] ->  | AR45: =RC[-29] ->  | AS45: - | AT45: =RC[-30] -> - | AU45: =RC[-30] ->  | AV45: =RC[-30] ->  | AW45: =RC[-30] -> 
A46: =IF(RC[1]="","",DATEVALUE(RC[1])) ->  | C46: 24 | P46: =IF(AND(ISNUMBER(RC[-3]),ISNUMBER(RC[-1])),RC[-3]-RC[-1],"-") -> - | T46: =(RC[-16]*RC[-15]-RC[-13]*RC[-12])/1000 -> #VALUE! | W46: =RC[-2]*RC[-10]/1000 -> #VALUE! | X46: =ABS((RC[-3]*RC[-11]-RC[-2]*RC[-9])/1000) -> #VALUE! | Y46: =(RC[-14]-RC[1])/RC[-18]*100 -> #VALUE! | AC46: =VALUE(RC[-27]) -> #VALUE! | AD46: =IF(RC[21]=42,"*",IF(RC[21]=32,"",RC[21])) ->  | AE46: =RC[-28] -> 24 | AF46: =RC[-28] ->  | AG46: =RC[-28] ->  | AH46: =RC[-28] ->  | AI46: =RC[-28] ->  | AJ46: =RC[-28] ->  | AK46: =RC[-28] ->  | AL46: =RC[-28] -> 0 | AM46: =RC[-28] ->  | AN46: =RC[-28] ->  | AO46: =RC[-28] ->  | AP46: - | AQ46: =RC[-29] ->  | AR46: =RC[-29] ->  | AS46: - | AT46: =RC[-30] -> - | AU46: =RC[-30] ->  | AV46: =RC[-30] ->  | AW46: =RC[-30] -> 
A47: =IF(RC[1]="","",DATEVALUE(RC[1])) ->  | C47: 24 | P47: =IF(AND(ISNUMBER(RC[-3]),ISNUMBER(RC[-1])),RC[-3]-RC[-1],"-") -> - | T47: =(RC[-16]*RC[-15]-RC[-13]*RC[-12])/1000 -> #VALUE! | W47: =RC[-2]*RC[-10]/1000 -> #VALUE! | X47: =ABS((RC[-3]*RC[-11]-RC[-2]*RC[-9])/1000) -> #VALUE! | Y47: =(RC[-14]-RC[1])/RC[-18]*100 -> #VALUE! | AC47: =VALUE(RC[-27]) -> #VALUE! | AD47: =IF(RC[21]=42,"*",IF(RC[21]=32,"",RC[21])) ->  | AE47: =RC[-28] -> 24 | AF47: =RC[-28] ->  | AG47: =RC[-28] ->  | AH47: =RC[-28] ->  | AI47: =RC[-28] ->  | AJ47: =RC[-28] ->  | AK47: =RC[-28] ->  | AL47: =RC[-28] -> 0 | AM47: =RC[-28] ->  | AN47: =RC[-28] ->  | AO47: =RC[-28] ->  | AP47: - | AQ47: =RC[-29] ->  | AR47: =RC[-29] ->  | AS47: - | AT47: =RC[-30] -> - | AU47: =RC[-30] ->  | AV47: =RC[-30] ->  | AW47: =RC[-30] -> 
A48: =IF(RC[1]="","",DATEVALUE(RC[1])) ->  | C48: 24 | P48: =IF(AND(ISNUMBER(RC[-3]),ISNUMBER(RC[-1])),RC[-3]-RC[-1],"-") -> - | T48: =(RC[-16]*RC[-15]-RC[-13]*RC[-12])/1000 -> #VALUE! | W48: =RC[-2]*RC[-10]/1000 -> #VALUE! | X48: =ABS((RC[-3]*RC[-11]-RC[-2]*RC[-9])/1000) -> #VALUE! | Y48: =(RC[-14]-RC[1])/RC[-18]*100 -> #VALUE! | AC48: =VALUE(RC[-27]) -> #VALUE! | AD48: =IF(RC[21]=42,"*",IF(RC[21]=32,"",RC[21])) ->  | AE48: =RC[-28] -> 24 | AF48: =RC[-28] ->  | AG48: =RC[-28] ->  | AH48: =RC[-28] ->  | AI48: =RC[-28] ->  | AJ48: =RC[-28] ->  | AK48: =RC[-28] ->  | AL48: =RC[-28] -> 0 | AM48: =RC[-28] ->  | AN48: =RC[-28] ->  | AO48: =RC[-28] ->  | AP48: - | AQ48: =RC[-29] ->  | AR48: =RC[-29] ->  | AS48: - | AT48: =RC[-30] -> - | AU48: =RC[-30] ->  | AV48: =RC[-30] ->  | AW48: =RC[-30] -> 
A49: =IF(RC[1]="","",DATEVALUE(RC[1])) ->  | C49: 24 | P49: =IF(AND(ISNUMBER(RC[-3]),ISNUMBER(RC[-1])),RC[-3]-RC[-1],"-") -> - | T49: =(RC[-16]*RC[-15]-RC[-13]*RC[-12])/1000 -> #VALUE! | W49: =RC[-2]*RC[-10]/1000 -> #VALUE! | X49: =ABS((RC[-3]*RC[-11]-RC[-2]*RC[-9])/1000) -> #VALUE! | Y49: =(RC[-14]-RC[1])/RC[-18]*100 -> #VALUE! | AC49: =VALUE(RC[-27]) -> #VALUE! | AD49: =IF(RC[21]=42,"*",IF(RC[21]=32,"",RC[21])) ->  | AE49: =RC[-28] -> 24 | AF49: =RC[-28] ->  | AG49: =RC[-28] ->  | AH49: =RC[-28] ->  | AI49: =RC[-28] ->  | AJ49: =RC[-28] ->  | AK49: =RC[-28] ->  | AL49: =RC[-28] -> 0 | AM49: =RC[-28] ->  | AN49: =RC[-28] ->  | AO49: =RC[-28] ->  | AP49: - | AQ49: =RC[-29] ->  | AR49: =RC[-29] ->  | AS49: - | AT49: =RC[-30] -> - | AU49: =RC[-30] ->  | AV49: =RC[-30] ->  | AW49: =RC[-30] -> 
A50: =IF(RC[1]="","",DATEVALUE(RC[1])) ->  | P50: =IF(AND(ISNUMBER(RC[-3]),ISNUMBER(RC[-1])),RC[-3]-RC[-1],"-") -> - | T50: =(RC[-16]*RC[-15]-RC[-13]*RC[-12])/1000 -> #VALUE! | W50: =RC[-2]*RC[-10]/1000 -> #VALUE! | X50: =ABS((RC[-3]*RC[-11]-RC[-2]*RC[-9])/1000) -> #VALUE! | Y50: =(RC[-14]-RC[1])/RC[-18]*100 -> #VALUE! | AC50: =VALUE(RC[-27]) -> #VALUE! | AD50: =IF(RC[21]=42,"*",IF(RC[21]=32,"",RC[21])) ->  | AE50: =RC[-28] ->  | AF50: =RC[-28] ->  | AG50: =RC[-28] ->  | AH50: =RC[-28] ->  | AI50: =RC[-28] ->  | AJ50: =RC[-28] ->  | AK50: =RC[-28] ->  | AL50: =RC[-28] -> 0 | AM50: =RC[-28] ->  | AN50: =RC[-28] ->  | AO50: =RC[-28] ->  | AP50: - | AQ50: =RC[-29] ->  | AR50: =RC[-29] ->  | AS50: - | AT50: =RC[-30] -> - | AU50: =RC[-30] ->  | AV50: =RC[-30] ->  | AW50: =RC[-30] -> 
A51: =IF(RC[1]="","",DATEVALUE(RC[1])) ->  | P51: =IF(AND(ISNUMBER(RC[-3]),ISNUMBER(RC[-1])),RC[-3]-RC[-1],"-") -> - | T51: =(RC[-16]*RC[-15]-RC[-13]*RC[-12])/1000 -> #VALUE! | W51: =RC[-2]*RC[-10]/1000 -> #VALUE! | X51: =ABS((RC[-3]*RC[-11]-RC[-2]*RC[-9])/1000) -> #VALUE! | Y51: =(RC[-14]-RC[1])/RC[-18]*100 -> #VALUE! | AC51: =VALUE(RC[-27]) -> #VALUE! | AD51: =IF(RC[21]=42,"*",IF(RC[21]=32,"",RC[21])) ->  | AE51: =RC[-28] ->  | AF51: =RC[-28] ->  | AG51: =RC[-28] ->  | AH51: =RC[-28] ->  | AI51: =RC[-28] ->  | AJ51: =RC[-28] ->  | AK51: =RC[-28] ->  | AL51: =RC[-28] -> 0 | AM51: =RC[-28] ->  | AN51: =RC[-28] ->  | AO51: =RC[-28] ->  | AP51: - | AQ51: =RC[-29] ->  | AR51: =RC[-29] ->  | AS51: - | AT51: =RC[-30] -> - | AU51: =RC[-30] ->  | AV51: =RC[-30] ->  | AW51: =RC[-30] -> 
A52: =IF(RC[1]="","",DATEVALUE(RC[1])) ->  | P52: =IF(AND(ISNUMBER(RC[-3]),ISNUMBER(RC[-1])),RC[-3]-RC[-1],"-") -> - | T52: =(RC[-16]*RC[-15]-RC[-13]*RC[-12])/1000 -> #VALUE! | W52: =RC[-2]*RC[-10]/1000 -> #VALUE! | X52: =ABS((RC[-3]*RC[-11]-RC[-2]*RC[-9])/1000) -> #VALUE! | Y52: =(RC[-14]-RC[1])/RC[-18]*100 -> #VALUE! | AC52: =VALUE(RC[-27]) -> #VALUE! | AD52: =IF(RC[21]=42,"*",IF(RC[21]=32,"",RC[21])) ->  | AE52: =RC[-28] ->  | AF52: =RC[-28] ->  | AG52: =RC[-28] ->  | AH52: =RC[-28] ->  | AI52: =RC[-28] ->  | AJ52: =RC[-28] ->  | AK52: =RC[-28] ->  | AL52: =RC[-28] -> 0 | AM52: =RC[-28] ->  | AN52: =RC[-28] ->  | AO52: =RC[-28] ->  | AP52: - | AQ52: =RC[-29] ->  | AR52: =RC[-29] ->  | AS52: - | AT52: =RC[-30] -> - | AU52: =RC[-30] ->  | AV52: =RC[-30] ->  | AW52: =RC[-30] -> 
A53: =IF(RC[1]="","",DATEVALUE(RC[1])) ->  | P53: =IF(AND(ISNUMBER(RC[-3]),ISNUMBER(RC[-1])),RC[-3]-RC[-1],"-") -> - | T53: =(RC[-16]*RC[-15]-RC[-13]*RC[-12])/1000 -> #VALUE! | W53: =RC[-2]*RC[-10]/1000 -> #VALUE! | X53: =ABS((RC[-3]*RC[-11]-RC[-2]*RC[-9])/1000) -> #VALUE! | Y53: =(RC[-14]-RC[1])/RC[-18]*100 -> #VALUE! | AC53: =VALUE(RC[-27]) -> #VALUE! | AD53: =IF(RC[21]=42,"*",IF(RC[21]=32,"",RC[21])) ->  | AE53: =RC[-28] ->  | AF53: =RC[-28] ->  | AG53: =RC[-28] ->  | AH53: =RC[-28] ->  | AI53: =RC[-28] ->  | AJ53: =RC[-28] ->  | AK53: =RC[-28] ->  | AL53: =RC[-28] -> 0 | AM53: =RC[-28] ->  | AN53: =RC[-28] ->  | AO53: =RC[-28] ->  | AP53: - | AQ53: =RC[-29] ->  | AR53: =RC[-29] ->  | AS53: - | AT53: =RC[-30] -> - | AU53: =RC[-30] ->  | AV53: =RC[-30] ->  | AW53: =RC[-30] -> 
A54: =IF(RC[1]="","",DATEVALUE(RC[1])) ->  | P54: =IF(AND(ISNUMBER(RC[-3]),ISNUMBER(RC[-1])),RC[-3]-RC[-1],"-") -> - | T54: =(RC[-16]*RC[-15]-RC[-13]*RC[-12])/1000 -> #VALUE! | W54: =RC[-2]*RC[-10]/1000 -> #VALUE! | X54: =ABS((RC[-3]*RC[-11]-RC[-2]*RC[-9])/1000) -> #VALUE! | Y54: =(RC[-14]-RC[1])/RC[-18]*100 -> #VALUE! | AC54: =VALUE(RC[-27]) -> #VALUE! | AD54: =IF(RC[21]=42,"*",IF(RC[21]=32,"",RC[21])) ->  | AE54: =RC[-28] ->  | AF54: =RC[-28] ->  | AG54: =RC[-28] ->  | AH54: =RC[-28] ->  | AI54: =RC[-28] ->  | AJ54: =RC[-28] ->  | AK54: =RC[-28] ->  | AL54: =RC[-28] -> 0 | AM54: =RC[-28] ->  | AN54: =RC[-28] ->  | AO54: =RC[-28] ->  | AP54: - | AQ54: =RC[-29] ->  | AR54: =RC[-29] ->  | AS54: - | AT54: =RC[-30] -> - | AU54: =RC[-30] ->  | AV54: =RC[-30] ->  | AW54: =RC[-30] -> 
A55: =IF(RC[1]="","",DATEVALUE(RC[1])) ->  | P55: =IF(AND(ISNUMBER(RC[-3]),ISNUMBER(RC[-1])),RC[-3]-RC[-1],"-") -> - | T55: =(RC[-16]*RC[-15]-RC[-13]*RC[-12])/1000 -> #VALUE! | W55: =RC[-2]*RC[-10]/1000 -> #VALUE! | X55: =ABS((RC[-3]*RC[-11]-RC[-2]*RC[-9])/1000) -> #VALUE! | Y55: =(RC[-14]-RC[1])/RC[-18]*100 -> #VALUE! | AC55: =VALUE(RC[-27]) -> #VALUE! | AD55: =IF(RC[21]=42,"*",IF(RC[21]=32,"",RC[21])) ->  | AE55: =RC[-28] ->  | AF55: =RC[-28] ->  | AG55: =RC[-28] ->  | AH55: =RC[-28] ->  | AI55: =RC[-28] ->  | AJ55: =RC[-28] ->  | AK55: =RC[-28] ->  | AL55: =RC[-28] -> 0 | AM55: =RC[-28] ->  | AN55: =RC[-28] ->  | AO55: =RC[-28] ->  | AP55: - | AQ55: =RC[-29] ->  | AR55: =RC[-29] ->  | AS55: - | AT55: =RC[-30] -> - | AU55: =RC[-30] ->  | AV55: =RC[-30] ->  | AW55: =RC[-30] -> 
A56: =IF(RC[1]="","",DATEVALUE(RC[1])) ->  | P56: =IF(AND(ISNUMBER(RC[-3]),ISNUMBER(RC[-1])),RC[-3]-RC[-1],"-") -> - | T56: =(RC[-16]*RC[-15]-RC[-13]*RC[-12])/1000 -> #VALUE! | W56: =RC[-2]*RC[-10]/1000 -> #VALUE! | X56: =ABS((RC[-3]*RC[-11]-RC[-2]*RC[-9])/1000) -> #VALUE! | Y56: =(RC[-14]-RC[1])/RC[-18]*100 -> #VALUE! | AC56: =VALUE(RC[-27]) -> #VALUE! | AD56: =IF(RC[21]=42,"*",IF(RC[21]=32,"",RC[21])) ->  | AE56: =RC[-28] ->  | AF56: =RC[-28] ->  | AG56: =RC[-28] ->  | AH56: =RC[-28] ->  | AI56: =RC[-28] ->  | AJ56: =RC[-28] ->  | AK56: =RC[-28] ->  | AL56: =RC[-28] -> 0 | AM56: =RC[-28] ->  | AN56: =RC[-28] ->  | AO56: =RC[-28] ->  | AP56: - | AQ56: =RC[-29] ->  | AR56: =RC[-29] ->  | AS56: - | AT56: =RC[-30] -> - | AU56: =RC[-30] ->  | AV56: =RC[-30] ->  | AW56: =RC[-30] -> 
A57: =IF(RC[1]="","",DATEVALUE(RC[1])) ->  | P57: =IF(AND(ISNUMBER(RC[-3]),ISNUMBER(RC[-1])),RC[-3]-RC[-1],"-") -> - | T57: =(RC[-16]*RC[-15]-RC[-13]*RC[-12])/1000 -> #VALUE! | W57: =RC[-2]*RC[-10]/1000 -> #VALUE! | X57: =ABS((RC[-3]*RC[-11]-RC[-2]*RC[-9])/1000) -> #VALUE! | Y57: =(RC[-14]-RC[1])/RC[-18]*100 -> #VALUE! | AC57: =VALUE(RC[-27]) -> #VALUE! | AD57: =IF(RC[21]=42,"*",IF(RC[21]=32,"",RC[21])) ->  | AE57: =RC[-28] ->  | AF57: =RC[-28] ->  | AG57: =RC[-28] ->  | AH57: =RC[-28] ->  | AI57: =RC[-28] ->  | AJ57: =RC[-28] ->  | AK57: =RC[-28] ->  | AL57: =RC[-28] -> 0 | AM57: =RC[-28] ->  | AN57: =RC[-28] ->  | AO57: =RC[-28] ->  | AP57: - | AQ57: =RC[-29] ->  | AR57: =RC[-29] ->  | AS57: - | AT57: =RC[-30] -> - | AU57: =RC[-30] ->  | AV57: =RC[-30] ->  | AW57: =RC[-30] -> 
A58: =IF(RC[1]="","",DATEVALUE(RC[1])) ->  | P58: =IF(AND(ISNUMBER(RC[-3]),ISNUMBER(RC[-1])),RC[-3]-RC[-1],"-") -> - | T58: =(RC[-16]*RC[-15]-RC[-13]*RC[-12])/1000 -> #VALUE! | W58: =RC[-2]*RC[-10]/1000 -> #VALUE! | X58: =ABS((RC[-3]*RC[-11]-RC[-2]*RC[-9])/1000) -> #VALUE! | Y58: =(RC[-14]-RC[1])/RC[-18]*100 -> #VALUE! | AC58: =VALUE(RC[-27]) -> #VALUE! | AD58: =IF(RC[21]=42,"*",IF(RC[21]=32,"",RC[21])) ->  | AE58: =RC[-28] ->  | AF58: =RC[-28] ->  | AG58: =RC[-28] ->  | AH58: =RC[-28] ->  | AI58: =RC[-28] ->  | AJ58: =RC[-28] ->  | AK58: =RC[-28] ->  | AL58: =RC[-28] -> 0 | AM58: =RC[-28] ->  | AN58: =RC[-28] ->  | AO58: =RC[-28] ->  | AP58: - | AQ58: =RC[-29] ->  | AR58: =RC[-29] ->  | AS58: - | AT58: =RC[-30] -> - | AU58: =RC[-30] ->  | AV58: =RC[-30] ->  | AW58: =RC[-30] -> 
A59: =IF(RC[1]="","",DATEVALUE(RC[1])) ->  | P59: =IF(AND(ISNUMBER(RC[-3]),ISNUMBER(RC[-1])),RC[-3]-RC[-1],"-") -> - | T59: =(RC[-16]*RC[-15]-RC[-13]*RC[-12])/1000 -> #VALUE! | W59: =RC[-2]*RC[-10]/1000 -> #VALUE! | X59: =ABS((RC[-3]*RC[-11]-RC[-2]*RC[-9])/1000) -> #VALUE! | Y59: =(RC[-14]-RC[1])/RC[-18]*100 -> #VALUE! | AC59: =VALUE(RC[-27]) -> #VALUE! | AD59: =IF(RC[21]=42,"*",IF(RC[21]=32,"",RC[21])) ->  | AE59: =RC[-28] ->  | AF59: =RC[-28] ->  | AG59: =RC[-28] ->  | AH59: =RC[-28] ->  | AI59: =RC[-28] ->  | AJ59: =RC[-28] ->  | AK59: =RC[-28] ->  | AL59: =RC[-28] -> 0 | AM59: =RC[-28] ->  | AN59: =RC[-28] ->  | AO59: =RC[-28] ->  | AP59: - | AQ59: =RC[-29] ->  | AR59: =RC[-29] ->  | AS59: - | AT59: =RC[-30] -> - | AU59: =RC[-30] ->  | AV59: =RC[-30] ->  | AW59: =RC[-30] -> 
A60: =IF(RC[1]="","",DATEVALUE(RC[1])) ->  | P60: =IF(AND(ISNUMBER(RC[-3]),ISNUMBER(RC[-1])),RC[-3]-RC[-1],"-") -> - | T60: =(RC[-16]*RC[-15]-RC[-13]*RC[-12])/1000 -> #VALUE! | W60: =RC[-2]*RC[-10]/1000 -> #VALUE! | X60: =ABS((RC[-3]*RC[-11]-RC[-2]*RC[-9])/1000) -> #VALUE! | Y60: =(RC[-14]-RC[1])/RC[-18]*100 -> #VALUE! | AC60: =VALUE(RC[-27]) -> #VALUE! | AD60: =IF(RC[21]=42,"*",IF(RC[21]=32,"",RC[21])) ->  | AE60: =RC[-28] ->  | AF60: =RC[-28] ->  | AG60: =RC[-28] ->  | AH60: =RC[-28] ->  | AI60: =RC[-28] ->  | AJ60: =RC[-28] ->  | AK60: =RC[-28] ->  | AL60: =RC[-28] -> 0 | AM60: =RC[-28] ->  | AN60: =RC[-28] ->  | AO60: =RC[-28] ->  | AP60: - | AQ60: =RC[-29] ->  | AR60: =RC[-29] ->  | AS60: - | AT60: =RC[-30] -> - | AU60: =RC[-30] ->  | AV60: =RC[-30] ->  | AW60: =RC[-30] -> 
A61: =IF(RC[1]="","",DATEVALUE(RC[1])) ->  | P61: =IF(AND(ISNUMBER(RC[-3]),ISNUMBER(RC[-1])),RC[-3]-RC[-1],"-") -> - | T61: =(RC[-16]*RC[-15]-RC[-13]*RC[-12])/1000 -> #VALUE! | W61: =RC[-2]*RC[-10]/1000 -> #VALUE! | X61: =ABS((RC[-3]*RC[-11]-RC[-2]*RC[-9])/1000) -> #VALUE! | Y61: =(RC[-14]-RC[1])/RC[-18]*100 -> #VALUE! | AC61: =VALUE(RC[-27]) -> #VALUE! | AD61: =IF(RC[21]=42,"*",IF(RC[21]=32,"",RC[21])) ->  | AE61: =RC[-28] ->  | AF61: =RC[-28] ->  | AG61: =RC[-28] ->  | AH61: =RC[-28] ->  | AI61: =RC[-28] ->  | AJ61: =RC[-28] ->  | AK61: =RC[-28] ->  | AL61: =RC[-28] -> 0 | AM61: =RC[-28] ->  | AN61: =RC[-28] ->  | AO61: =RC[-28] ->  | AP61: - | AQ61: =RC[-29] ->  | AR61: =RC[-29] ->  | AS61: - | AT61: =RC[-30] -> - | AU61: =RC[-30] ->  | AV61: =RC[-30] ->  | AW61: =RC[-30] -> 
A62: =IF(RC[1]="","",DATEVALUE(RC[1])) ->  | P62: =IF(AND(ISNUMBER(RC[-3]),ISNUMBER(RC[-1])),RC[-3]-RC[-1],"-") -> - | T62: =(RC[-16]*RC[-15]-RC[-13]*RC[-12])/1000 -> #VALUE! | W62: =RC[-2]*RC[-10]/1000 -> #VALUE! | X62: =ABS((RC[-3]*RC[-11]-RC[-2]*RC[-9])/1000) -> #VALUE! | Y62: =(RC[-14]-RC[1])/RC[-18]*100 -> #VALUE! | AC62: =VALUE(RC[-27]) -> #VALUE! | AD62: =IF(RC[21]=42,"*",IF(RC[21]=32,"",RC[21])) ->  | AE62: =RC[-28] ->  | AF62: =RC[-28] ->  | AG62: =RC[-28] ->  | AH62: =RC[-28] ->  | AI62: =RC[-28] ->  | AJ62: =RC[-28] ->  | AK62: =RC[-28] ->  | AL62: =RC[-28] -> 0 | AM62: =RC[-28] ->  | AN62: =RC[-28] ->  | AO62: =RC[-28] ->  | AP62: - | AQ62: =RC[-29] ->  | AR62: =RC[-29] ->  | AS62: - | AT62: =RC[-30] -> - | AU62: =RC[-30] ->  | AV62: =RC[-30] ->  | AW62: =RC[-30] -> 
A63: =IF(RC[1]="","",DATEVALUE(RC[1])) ->  | P63: =IF(AND(ISNUMBER(RC[-3]),ISNUMBER(RC[-1])),RC[-3]-RC[-1],"-") -> - | T63: =(RC[-16]*RC[-15]-RC[-13]*RC[-12])/1000 -> #VALUE! | W63: =RC[-2]*RC[-10]/1000 -> #VALUE! | X63: =ABS((RC[-3]*RC[-11]-RC[-2]*RC[-9])/1000) -> #VALUE! | Y63: =(RC[-14]-RC[1])/RC[-18]*100 -> #VALUE! | AC63: =VALUE(RC[-27]) -> #VALUE! | AD63: =IF(RC[21]=42,"*",IF(RC[21]=32,"",RC[21])) ->  | AE63: =RC[-28] ->  | AF63: =RC[-28] ->  | AG63: =RC[-28] ->  | AH63: =RC[-28] ->  | AI63: =RC[-28] ->  | AJ63: =RC[-28] ->  | AK63: =RC[-28] ->  | AL63: =RC[-28] -> 0 | AM63: =RC[-28] ->  | AN63: =RC[-28] ->  | AO63: =RC[-28] ->  | AP63: - | AQ63: =RC[-29] ->  | AR63: =RC[-29] ->  | AS63: - | AT63: =RC[-30] -> - | AU63: =RC[-30] ->  | AV63: =RC[-30] ->  | AW63: =RC[-30] -> 
A64: =IF(RC[1]="","",DATEVALUE(RC[1])) ->  | P64: =IF(AND(ISNUMBER(RC[-3]),ISNUMBER(RC[-1])),RC[-3]-RC[-1],"-") -> - | T64: =(RC[-16]*RC[-15]-RC[-13]*RC[-12])/1000 -> #VALUE! | W64: =RC[-2]*RC[-10]/1000 -> #VALUE! | X64: =ABS((RC[-3]*RC[-11]-RC[-2]*RC[-9])/1000) -> #VALUE! | Y64: =(RC[-14]-RC[1])/RC[-18]*100 -> #VALUE! | AC64: =VALUE(RC[-27]) -> #VALUE! | AD64: =IF(RC[21]=42,"*",IF(RC[21]=32,"",RC[21])) ->  | AE64: =RC[-28] ->  | AF64: =RC[-28] ->  | AG64: =RC[-28] ->  | AH64: =RC[-28] ->  | AI64: =RC[-28] ->  | AJ64: =RC[-28] ->  | AK64: =RC[-28] ->  | AL64: =RC[-28] -> 0 | AM64: =RC[-28] ->  | AN64: =RC[-28] ->  | AO64: =RC[-28] ->  | AP64: - | AQ64: =RC[-29] ->  | AR64: =RC[-29] ->  | AS64: - | AT64: =RC[-30] -> - | AU64: =RC[-30] ->  | AV64: =RC[-30] ->  | AW64: =RC[-30] -> 
A65: =IF(RC[1]="","",DATEVALUE(RC[1])) ->  | P65: =IF(AND(ISNUMBER(RC[-3]),ISNUMBER(RC[-1])),RC[-3]-RC[-1],"-") -> - | T65: =(RC[-16]*RC[-15]-RC[-13]*RC[-12])/1000 -> #VALUE! | W65: =RC[-2]*RC[-10]/1000 -> #VALUE! | X65: =ABS((RC[-3]*RC[-11]-RC[-2]*RC[-9])/1000) -> #VALUE! | Y65: =(RC[-14]-RC[1])/RC[-18]*100 -> #VALUE! | AC65: =VALUE(RC[-27]) -> #VALUE! | AD65: =IF(RC[21]=42,"*",IF(RC[21]=32,"",RC[21])) ->  | AE65: =RC[-28] ->  | AF65: =RC[-28] ->  | AG65: =RC[-28] ->  | AH65: =RC[-28] ->  | AI65: =RC[-28] ->  | AJ65: =RC[-28] ->  | AK65: =RC[-28] ->  | AL65: =RC[-28] -> 0 | AM65: =RC[-28] ->  | AN65: =RC[-28] ->  | AO65: =RC[-28] ->  | AP65: - | AQ65: =RC[-29] ->  | AR65: =RC[-29] ->  | AS65: - | AT65: =RC[-30] -> - | AU65: =RC[-30] ->  | AV65: =RC[-30] ->  | AW65: =RC[-30] -> 
A66: =IF(RC[1]="","",DATEVALUE(RC[1])) ->  | P66: =IF(AND(ISNUMBER(RC[-3]),ISNUMBER(RC[-1])),RC[-3]-RC[-1],"-") -> - | T66: =(RC[-16]*RC[-15]-RC[-13]*RC[-12])/1000 -> #VALUE! | W66: =RC[-2]*RC[-10]/1000 -> #VALUE! | X66: =ABS((RC[-3]*RC[-11]-RC[-2]*RC[-9])/1000) -> #VALUE! | Y66: =(RC[-14]-RC[1])/RC[-18]*100 -> #VALUE! | AC66: =VALUE(RC[-27]) -> #VALUE! | AD66: =IF(RC[21]=42,"*",IF(RC[21]=32,"",RC[21])) ->  | AE66: =RC[-28] ->  | AF66: =RC[-28] ->  | AG66: =RC[-28] ->  | AH66: =RC[-28] ->  | AI66: =RC[-28] ->  | AJ66: =RC[-28] ->  | AK66: =RC[-28] ->  | AL66: =RC[-28] -> 0 | AM66: =RC[-28] ->  | AN66: =RC[-28] ->  | AO66: =RC[-28] ->  | AP66: - | AQ66: =RC[-29] ->  | AR66: =RC[-29] ->  | AS66: - | AT66: =RC[-30] -> - | AU66: =RC[-30] ->  | AV66: =RC[-30] ->  | AW66: =RC[-30] -> 
A67: =IF(RC[1]="","",DATEVALUE(RC[1])) ->  | P67: =IF(AND(ISNUMBER(RC[-3]),ISNUMBER(RC[-1])),RC[-3]-RC[-1],"-") -> - | T67: =(RC[-16]*RC[-15]-RC[-13]*RC[-12])/1000 -> #VALUE! | W67: =RC[-2]*RC[-10]/1000 -> #VALUE! | X67: =ABS((RC[-3]*RC[-11]-RC[-2]*RC[-9])/1000) -> #VALUE! | Y67: =(RC[-14]-RC[1])/RC[-18]*100 -> #VALUE! | AC67: =VALUE(RC[-27]) -> #VALUE! | AD67: =IF(RC[21]=42,"*",IF(RC[21]=32,"",RC[21])) ->  | AE67: =RC[-28] ->  | AF67: =RC[-28] ->  | AG67: =RC[-28] ->  | AH67: =RC[-28] ->  | AI67: =RC[-28] ->  | AJ67: =RC[-28] ->  | AK67: =RC[-28] ->  | AL67: =RC[-28] -> 0 | AM67: =RC[-28] ->  | AN67: =RC[-28] ->  | AO67: =RC[-28] ->  | AP67: - | AQ67: =RC[-29] ->  | AR67: =RC[-29] ->  | AS67: - | AT67: =RC[-30] -> - | AU67: =RC[-30] ->  | AV67: =RC[-30] ->  | AW67: =RC[-30] -> 
A68: =IF(RC[1]="","",DATEVALUE(RC[1])) ->  | P68: =IF(AND(ISNUMBER(RC[-3]),ISNUMBER(RC[-1])),RC[-3]-RC[-1],"-") -> - | T68: =(RC[-16]*RC[-15]-RC[-13]*RC[-12])/1000 -> #VALUE! | W68: =RC[-2]*RC[-10]/1000 -> #VALUE! | X68: =ABS((RC[-3]*RC[-11]-RC[-2]*RC[-9])/1000) -> #VALUE! | Y68: =(RC[-14]-RC[1])/RC[-18]*100 -> #VALUE! | AC68: =VALUE(RC[-27]) -> #VALUE! | AD68: =IF(RC[21]=42,"*",IF(RC[21]=32,"",RC[21])) ->  | AE68: =RC[-28] ->  | AF68: =RC[-28] ->  | AG68: =RC[-28] ->  | AH68: =RC[-28] ->  | AI68: =RC[-28] ->  | AJ68: =RC[-28] ->  | AK68: =RC[-28] ->  | AL68: =RC[-28] -> 0 | AM68: =RC[-28] ->  | AN68: =RC[-28] ->  | AO68: =RC[-28] ->  | AP68: - | AQ68: =RC[-29] ->  | AR68: =RC[-29] ->  | AS68: - | AT68: =RC[-30] -> - | AU68: =RC[-30] ->  | AV68: =RC[-30] ->  | AW68: =RC[-30] -> 
A69: =IF(RC[1]="","",DATEVALUE(RC[1])) ->  | P69: =IF(AND(ISNUMBER(RC[-3]),ISNUMBER(RC[-1])),RC[-3]-RC[-1],"-") -> - | T69: =(RC[-16]*RC[-15]-RC[-13]*RC[-12])/1000 -> #VALUE! | W69: =RC[-2]*RC[-10]/1000 -> #VALUE! | X69: =ABS((RC[-3]*RC[-11]-RC[-2]*RC[-9])/1000) -> #VALUE! | Y69: =(RC[-14]-RC[1])/RC[-18]*100 -> #VALUE! | AC69: =VALUE(RC[-27]) -> #VALUE! | AD69: =IF(RC[21]=42,"*",IF(RC[21]=32,"",RC[21])) ->  | AE69: =RC[-28] ->  | AF69: =RC[-28] ->  | AG69: =RC[-28] ->  | AH69: =RC[-28] ->  | AI69: =RC[-28] ->  | AJ69: =RC[-28] ->  | AK69: =RC[-28] ->  | AL69: =RC[-28] -> 0 | AM69: =RC[-28] ->  | AN69: =RC[-28] ->  | AO69: =RC[-28] ->  | AP69: - | AQ69: =RC[-29] ->  | AR69: =RC[-29] ->  | AS69: - | AT69: =RC[-30] -> - | AU69: =RC[-30] ->  | AV69: =RC[-30] ->  | AW69: =RC[-30] -> 
A70: =IF(RC[1]="","",DATEVALUE(RC[1])) ->  | P70: =IF(AND(ISNUMBER(RC[-3]),ISNUMBER(RC[-1])),RC[-3]-RC[-1],"-") -> - | T70: =(RC[-16]*RC[-15]-RC[-13]*RC[-12])/1000 -> #VALUE! | W70: =RC[-2]*RC[-10]/1000 -> #VALUE! | X70: =ABS((RC[-3]*RC[-11]-RC[-2]*RC[-9])/1000) -> #VALUE! | Y70: =(RC[-14]-RC[1])/RC[-18]*100 -> #VALUE! | AC70: =VALUE(RC[-27]) -> #VALUE! | AD70: =IF(RC[21]=42,"*",IF(RC[21]=32,"",RC[21])) ->  | AE70: =RC[-28] ->  | AF70: =RC[-28] ->  | AG70: =RC[-28] ->  | AH70: =RC[-28] ->  | AI70: =RC[-28] ->  | AJ70: =RC[-28] ->  | AK70: =RC[-28] ->  | AL70: =RC[-28] -> 0 | AM70: =RC[-28] ->  | AN70: =RC[-28] ->  | AO70: =RC[-28] ->  | AP70: - | AQ70: =RC[-29] ->  | AR70: =RC[-29] ->  | AS70: - | AT70: =RC[-30] -> - | AU70: =RC[-30] ->  | AV70: =RC[-30] ->  | AW70: =RC[-30] -> 
A71: =IF(RC[1]="","",DATEVALUE(RC[1])) ->  | P71: =IF(AND(ISNUMBER(RC[-3]),ISNUMBER(RC[-1])),RC[-3]-RC[-1],"-") -> - | T71: =(RC[-16]*RC[-15]-RC[-13]*RC[-12])/1000 -> #VALUE! | W71: =RC[-2]*RC[-10]/1000 -> #VALUE! | X71: =ABS((RC[-3]*RC[-11]-RC[-2]*RC[-9])/1000) -> #VALUE! | Y71: =(RC[-14]-RC[1])/RC[-18]*100 -> #VALUE! | AC71: =VALUE(RC[-27]) -> #VALUE! | AD71: =IF(RC[21]=42,"*",IF(RC[21]=32,"",RC[21])) ->  | AE71: =RC[-28] ->  | AF71: =RC[-28] ->  | AG71: =RC[-28] ->  | AH71: =RC[-28] ->  | AI71: =RC[-28] ->  | AJ71: =RC[-28] ->  | AK71: =RC[-28] ->  | AL71: =RC[-28] -> 0 | AM71: =RC[-28] ->  | AN71: =RC[-28] ->  | AO71: =RC[-28] ->  | AP71: - | AQ71: =RC[-29] ->  | AR71: =RC[-29] ->  | AS71: - | AT71: =RC[-30] -> - | AU71: =RC[-30] ->  | AV71: =RC[-30] ->  | AW71: =RC[-30] -> 
A72: =IF(RC[1]="","",DATEVALUE(RC[1])) ->  | P72: =IF(AND(ISNUMBER(RC[-3]),ISNUMBER(RC[-1])),RC[-3]-RC[-1],"-") -> - | T72: =(RC[-16]*RC[-15]-RC[-13]*RC[-12])/1000 -> #VALUE! | W72: =RC[-2]*RC[-10]/1000 -> #VALUE! | X72: =ABS((RC[-3]*RC[-11]-RC[-2]*RC[-9])/1000) -> #VALUE! | Y72: =(RC[-14]-RC[1])/RC[-18]*100 -> #VALUE! | AC72: =VALUE(RC[-27]) -> #VALUE! | AD72: =IF(RC[21]=42,"*",IF(RC[21]=32,"",RC[21])) ->  | AE72: =RC[-28] ->  | AF72: =RC[-28] ->  | AG72: =RC[-28] ->  | AH72: =RC[-28] ->  | AI72: =RC[-28] ->  | AJ72: =RC[-28] ->  | AK72: =RC[-28] ->  | AL72: =RC[-28] -> 0 | AM72: =RC[-28] ->  | AN72: =RC[-28] ->  | AO72: =RC[-28] ->  | AP72: - | AQ72: =RC[-29] ->  | AR72: =RC[-29] ->  | AS72: - | AT72: =RC[-30] -> - | AU72: =RC[-30] ->  | AV72: =RC[-30] ->  | AW72: =RC[-30] -> 
A73: =IF(RC[1]="","",DATEVALUE(RC[1])) ->  | P73: =IF(AND(ISNUMBER(RC[-3]),ISNUMBER(RC[-1])),RC[-3]-RC[-1],"-") -> - | T73: =(RC[-16]*RC[-15]-RC[-13]*RC[-12])/1000 -> #VALUE! | W73: =RC[-2]*RC[-10]/1000 -> #VALUE! | X73: =ABS((RC[-3]*RC[-11]-RC[-2]*RC[-9])/1000) -> #VALUE! | Y73: =(RC[-14]-RC[1])/RC[-18]*100 -> #VALUE! | AC73: =VALUE(RC[-27]) -> #VALUE! | AD73: =IF(RC[21]=42,"*",IF(RC[21]=32,"",RC[21])) ->  | AE73: =RC[-28] ->  | AF73: =RC[-28] ->  | AG73: =RC[-28] ->  | AH73: =RC[-28] ->  | AI73: =RC[-28] ->  | AJ73: =RC[-28] ->  | AK73: =RC[-28] ->  | AL73: =RC[-28] -> 0 | AM73: =RC[-28] ->  | AN73: =RC[-28] ->  | AO73: =RC[-28] ->  | AP73: - | AQ73: =RC[-29] ->  | AR73: =RC[-29] ->  | AS73: - | AT73: =RC[-30] -> - | AU73: =RC[-30] ->  | AV73: =RC[-30] ->  | AW73: =RC[-30] -> 
A74: =IF(RC[1]="","",DATEVALUE(RC[1])) ->  | P74: =IF(AND(ISNUMBER(RC[-3]),ISNUMBER(RC[-1])),RC[-3]-RC[-1],"-") -> - | T74: =(RC[-16]*RC[-15]-RC[-13]*RC[-12])/1000 -> #VALUE! | W74: =RC[-2]*RC[-10]/1000 -> #VALUE! | X74: =ABS((RC[-3]*RC[-11]-RC[-2]*RC[-9])/1000) -> #VALUE! | Y74: =(RC[-14]-RC[1])/RC[-18]*100 -> #VALUE! | AC74: =VALUE(RC[-27]) -> #VALUE! | AD74: =IF(RC[21]=42,"*",IF(RC[21]=32,"",RC[21])) ->  | AE74: =RC[-28] ->  | AF74: =RC[-28] ->  | AG74: =RC[-28] ->  | AH74: =RC[-28] ->  | AI74: =RC[-28] ->  | AJ74: =RC[-28] ->  | AK74: =RC[-28] ->  | AL74: =RC[-28] -> 0 | AM74: =RC[-28] ->  | AN74: =RC[-28] ->  | AO74: =RC[-28] ->  | AP74: - | AQ74: =RC[-29] ->  | AR74: =RC[-29] ->  | AS74: - | AT74: =RC[-30] -> - | AU74: =RC[-30] ->  | AV74: =RC[-30] ->  | AW74: =RC[-30] -> 
A75: =IF(RC[1]="","",DATEVALUE(RC[1])) ->  | P75: =IF(AND(ISNUMBER(RC[-3]),ISNUMBER(RC[-1])),RC[-3]-RC[-1],"-") -> - | T75: =(RC[-16]*RC[-15]-RC[-13]*RC[-12])/1000 -> #VALUE! | W75: =RC[-2]*RC[-10]/1000 -> #VALUE! | X75: =ABS((RC[-3]*RC[-11]-RC[-2]*RC[-9])/1000) -> #VALUE! | Y75: =(RC[-14]-RC[1])/RC[-18]*100 -> #VALUE! | AC75: =VALUE(RC[-27]) -> #VALUE! | AD75: =IF(RC[21]=42,"*",IF(RC[21]=32,"",RC[21])) ->  | AE75: =RC[-28] ->  | AF75: =RC[-28] ->  | AG75: =RC[-28] ->  | AH75: =RC[-28] ->  | AI75: =RC[-28] ->  | AJ75: =RC[-28] ->  | AK75: =RC[-28] ->  | AL75: =RC[-28] -> 0 | AM75: =RC[-28] ->  | AN75: =RC[-28] ->  | AO75: =RC[-28] ->  | AP75: - | AQ75: =RC[-29] ->  | AR75: =RC[-29] ->  | AS75: - | AT75: =RC[-30] -> - | AU75: =RC[-30] ->  | AV75: =RC[-30] ->  | AW75: =RC[-30] -> 
A76: =IF(RC[1]="","",DATEVALUE(RC[1])) ->  | P76: =IF(AND(ISNUMBER(RC[-3]),ISNUMBER(RC[-1])),RC[-3]-RC[-1],"-") -> - | T76: =(RC[-16]*RC[-15]-RC[-13]*RC[-12])/1000 -> #VALUE! | W76: =RC[-2]*RC[-10]/1000 -> #VALUE! | X76: =ABS((RC[-3]*RC[-11]-RC[-2]*RC[-9])/1000) -> #VALUE! | Y76: =(RC[-14]-RC[1])/RC[-18]*100 -> #VALUE! | AC76: =VALUE(RC[-27]) -> #VALUE! | AD76: =IF(RC[21]=42,"*",IF(RC[21]=32,"",RC[21])) ->  | AE76: =RC[-28] ->  | AF76: =RC[-28] ->  | AG76: =RC[-28] ->  | AH76: =RC[-28] ->  | AI76: =RC[-28] ->  | AJ76: =RC[-28] ->  | AK76: =RC[-28] ->  | AL76: =RC[-28] -> 0 | AM76: =RC[-28] ->  | AN76: =RC[-28] ->  | AO76: =RC[-28] ->  | AP76: - | AQ76: =RC[-29] ->  | AR76: =RC[-29] ->  | AS76: - | AT76: =RC[-30] -> - | AU76: =RC[-30] ->  | AV76: =RC[-30] ->  | AW76: =RC[-30] -> 
A77: =IF(RC[1]="","",DATEVALUE(RC[1])) ->  | P77: =IF(AND(ISNUMBER(RC[-3]),ISNUMBER(RC[-1])),RC[-3]-RC[-1],"-") -> - | T77: =(RC[-16]*RC[-15]-RC[-13]*RC[-12])/1000 -> #VALUE! | W77: =RC[-2]*RC[-10]/1000 -> #VALUE! | X77: =ABS((RC[-3]*RC[-11]-RC[-2]*RC[-9])/1000) -> #VALUE! | Y77: =(RC[-14]-RC[1])/RC[-18]*100 -> #VALUE! | AC77: =VALUE(RC[-27]) -> #VALUE! | AD77: =IF(RC[21]=42,"*",IF(RC[21]=32,"",RC[21])) ->  | AE77: =RC[-28] ->  | AF77: =RC[-28] ->  | AG77: =RC[-28] ->  | AH77: =RC[-28] ->  | AI77: =RC[-28] ->  | AJ77: =RC[-28] ->  | AK77: =RC[-28] ->  | AL77: =RC[-28] -> 0 | AM77: =RC[-28] ->  | AN77: =RC[-28] ->  | AO77: =RC[-28] ->  | AP77: - | AQ77: =RC[-29] ->  | AR77: =RC[-29] ->  | AS77: - | AT77: =RC[-30] -> - | AU77: =RC[-30] ->  | AV77: =RC[-30] ->  | AW77: =RC[-30] -> 
A78: =IF(RC[1]="","",DATEVALUE(RC[1])) ->  | P78: =IF(AND(ISNUMBER(RC[-3]),ISNUMBER(RC[-1])),RC[-3]-RC[-1],"-") -> - | T78: =(RC[-16]*RC[-15]-RC[-13]*RC[-12])/1000 -> #VALUE! | W78: =RC[-2]*RC[-10]/1000 -> #VALUE! | X78: =ABS((RC[-3]*RC[-11]-RC[-2]*RC[-9])/1000) -> #VALUE! | Y78: =(RC[-14]-RC[1])/RC[-18]*100 -> #VALUE! | AC78: =VALUE(RC[-27]) -> #VALUE! | AD78: =IF(RC[21]=42,"*",IF(RC[21]=32,"",RC[21])) ->  | AE78: =RC[-28] ->  | AF78: =RC[-28] ->  | AG78: =RC[-28] ->  | AH78: =RC[-28] ->  | AI78: =RC[-28] ->  | AJ78: =RC[-28] ->  | AK78: =RC[-28] ->  | AL78: =RC[-28] -> 0 | AM78: =RC[-28] ->  | AN78: =RC[-28] ->  | AO78: =RC[-28] ->  | AP78: - | AQ78: =RC[-29] ->  | AR78: =RC[-29] ->  | AS78: - | AT78: =RC[-30] -> - | AU78: =RC[-30] ->  | AV78: =RC[-30] ->  | AW78: =RC[-30] -> 
A79: =IF(RC[1]="","",DATEVALUE(RC[1])) ->  | P79: =IF(AND(ISNUMBER(RC[-3]),ISNUMBER(RC[-1])),RC[-3]-RC[-1],"-") -> - | T79: =(RC[-16]*RC[-15]-RC[-13]*RC[-12])/1000 -> #VALUE! | W79: =RC[-2]*RC[-10]/1000 -> #VALUE! | X79: =ABS((RC[-3]*RC[-11]-RC[-2]*RC[-9])/1000) -> #VALUE! | Y79: =(RC[-14]-RC[1])/RC[-18]*100 -> #VALUE! | AC79: =VALUE(RC[-27]) -> #VALUE! | AD79: =IF(RC[21]=42,"*",IF(RC[21]=32,"",RC[21])) ->  | AE79: =RC[-28] ->  | AF79: =RC[-28] ->  | AG79: =RC[-28] ->  | AH79: =RC[-28] ->  | AI79: =RC[-28] ->  | AJ79: =RC[-28] ->  | AK79: =RC[-28] ->  | AL79: =RC[-28] -> 0 | AM79: =RC[-28] ->  | AN79: =RC[-28] ->  | AO79: =RC[-28] ->  | AP79: - | AQ79: =RC[-29] ->  | AR79: =RC[-29] ->  | AS79: - | AT79: =RC[-30] -> - | AU79: =RC[-30] ->  | AV79: =RC[-30] ->  | AW79: =RC[-30] -> 
A80: =IF(RC[1]="","",DATEVALUE(RC[1])) ->  | P80: =IF(AND(ISNUMBER(RC[-3]),ISNUMBER(RC[-1])),RC[-3]-RC[-1],"-") -> - | T80: =(RC[-16]*RC[-15]-RC[-13]*RC[-12])/1000 -> #VALUE! | W80: =RC[-2]*RC[-10]/1000 -> #VALUE! | X80: =ABS((RC[-3]*RC[-11]-RC[-2]*RC[-9])/1000) -> #VALUE! | Y80: =(RC[-14]-RC[1])/RC[-18]*100 -> #VALUE! | AC80: =VALUE(RC[-27]) -> #VALUE! | AD80: =IF(RC[21]=42,"*",IF(RC[21]=32,"",RC[21])) ->  | AE80: =RC[-28] ->  | AF80: =RC[-28] ->  | AG80: =RC[-28] ->  | AH80: =RC[-28] ->  | AI80: =RC[-28] ->  | AJ80: =RC[-28] ->  | AK80: =RC[-28] ->  | AL80: =RC[-28] -> 0 | AM80: =RC[-28] ->  | AN80: =RC[-28] ->  | AO80: =RC[-28] ->  | AP80: - | AQ80: =RC[-29] ->  | AR80: =RC[-29] ->  | AS80: - | AT80: =RC[-30] -> - | AU80: =RC[-30] ->  | AV80: =RC[-30] ->  | AW80: =RC[-30] -> 
A81: =IF(RC[1]="","",DATEVALUE(RC[1])) ->  | P81: =IF(AND(ISNUMBER(RC[-3]),ISNUMBER(RC[-1])),RC[-3]-RC[-1],"-") -> - | T81: =(RC[-16]*RC[-15]-RC[-13]*RC[-12])/1000 -> #VALUE! | W81: =RC[-2]*RC[-10]/1000 -> #VALUE! | X81: =ABS((RC[-3]*RC[-11]-RC[-2]*RC[-9])/1000) -> #VALUE! | Y81: =(RC[-14]-RC[1])/RC[-18]*100 -> #VALUE! | AC81: =VALUE(RC[-27]) -> #VALUE! | AD81: =IF(RC[21]=42,"*",IF(RC[21]=32,"",RC[21])) ->  | AE81: =RC[-28] ->  | AF81: =RC[-28] ->  | AG81: =RC[-28] ->  | AH81: =RC[-28] ->  | AI81: =RC[-28] ->  | AJ81: =RC[-28] ->  | AK81: =RC[-28] ->  | AL81: =RC[-28] -> 0 | AM81: =RC[-28] ->  | AN81: =RC[-28] ->  | AO81: =RC[-28] ->  | AP81: - | AQ81: =RC[-29] ->  | AR81: =RC[-29] ->  | AS81: - | AT81: =RC[-30] -> - | AU81: =RC[-30] ->  | AV81: =RC[-30] ->  | AW81: =RC[-30] -> 
A82: =IF(RC[1]="","",DATEVALUE(RC[1])) ->  | P82: =IF(AND(ISNUMBER(RC[-3]),ISNUMBER(RC[-1])),RC[-3]-RC[-1],"-") -> - | T82: =(RC[-16]*RC[-15]-RC[-13]*RC[-12])/1000 -> #VALUE! | W82: =RC[-2]*RC[-10]/1000 -> #VALUE! | X82: =ABS((RC[-3]*RC[-11]-RC[-2]*RC[-9])/1000) -> #VALUE! | Y82: =(RC[-14]-RC[1])/RC[-18]*100 -> #VALUE! | AC82: =VALUE(RC[-27]) -> #VALUE! | AD82: =IF(RC[21]=42,"*",IF(RC[21]=32,"",RC[21])) ->  | AE82: =RC[-28] ->  | AF82: =RC[-28] ->  | AG82: =RC[-28] ->  | AH82: =RC[-28] ->  | AI82: =RC[-28] ->  | AJ82: =RC[-28] ->  | AK82: =RC[-28] ->  | AL82: =RC[-28] -> 0 | AM82: =RC[-28] ->  | AN82: =RC[-28] ->  | AO82: =RC[-28] ->  | AP82: - | AQ82: =RC[-29] ->  | AR82: =RC[-29] ->  | AS82: - | AT82: =RC[-30] -> - | AU82: =RC[-30] ->  | AV82: =RC[-30] ->  | AW82: =RC[-30] -> 
A83: =IF(RC[1]="","",DATEVALUE(RC[1])) ->  | P83: =IF(AND(ISNUMBER(RC[-3]),ISNUMBER(RC[-1])),RC[-3]-RC[-1],"-") -> - | T83: =(RC[-16]*RC[-15]-RC[-13]*RC[-12])/1000 -> #VALUE! | W83: =RC[-2]*RC[-10]/1000 -> #VALUE! | X83: =ABS((RC[-3]*RC[-11]-RC[-2]*RC[-9])/1000) -> #VALUE! | Y83: =(RC[-14]-RC[1])/RC[-18]*100 -> #VALUE! | AC83: =VALUE(RC[-27]) -> #VALUE! | AD83: =IF(RC[21]=42,"*",IF(RC[21]=32,"",RC[21])) ->  | AE83: =RC[-28] ->  | AF83: =RC[-28] ->  | AG83: =RC[-28] ->  | AH83: =RC[-28] ->  | AI83: =RC[-28] ->  | AJ83: =RC[-28] ->  | AK83: =RC[-28] ->  | AL83: =RC[-28] -> 0 | AM83: =RC[-28] ->  | AN83: =RC[-28] ->  | AO83: =RC[-28] ->  | AP83: - | AQ83: =RC[-29] ->  | AR83: =RC[-29] ->  | AS83: - | AT83: =RC[-30] -> - | AU83: =RC[-30] ->  | AV83: =RC[-30] ->  | AW83: =RC[-30] -> 
AC84: Среднее | AF84: =R[1]C[-28] -> 93.60733333333333 | AG84: =R[1]C[-28] -> 67.485999999999976 | AH84: =R[1]C[-28] -> 7.53 | AI84: =R[1]C[-28] -> 82.258000000000024 | AJ84: =R[1]C[-28] -> 41.122 | AK84: =R[1]C[-28] -> 1.0503333333333338 | AL84: =R[1]C[-28] -> 26.363999999999997 | AM84: =R[1]C[-28] -> 11.349333333333334 | AN84: =R[1]C[-28] -> 21.745333333333331 | AO84: =R[1]C[-28] -> 67.771444444444427 | AP84: - | AQ84: =R[1]C[-29] -> 7.150888888888888 | AR84: =R[1]C[-29] -> 45.620444444444438 | AS84: - | AT84: =R[1]C[-30] -> 22.151000000000003 | AU84: =R[1]C[-30] -> 14.594444444444443
B85: Среднее | D85: =AVERAGE(OFFSET(R[-74]C,3,0,R7C1,1)) -> 93.60733333333333 | E85: =AVERAGE(OFFSET(R[-74]C,3,0,R7C1,1)) -> 67.485999999999976 | F85: =AVERAGE(OFFSET(R[-74]C,3,0,R7C1,1)) -> 7.53 | G85: =AVERAGE(OFFSET(R[-74]C,3,0,R7C1,1)) -> 82.258000000000024 | H85: =AVERAGE(OFFSET(R[-74]C,3,0,R7C1,1)) -> 41.122 | I85: =AVERAGE(OFFSET(R[-74]C,3,0,R7C1,1)) -> 1.0503333333333338 | J85: =AVERAGE(OFFSET(R[-74]C,3,0,R7C1,1)) -> 26.363999999999997 | K85: =AVERAGE(OFFSET(R[-74]C,3,0,R7C1,1)) -> 11.349333333333334 | L85: =IF(SUM(OFFSET(R[-74]C,3,0,R7C1,1))=0,"",AVERAGE(OFFSET(R[-74]C,3,0,R7C1,1))) -> 21.745333333333331 | M85: =IF(SUM(OFFSET(R[-74]C,3,0,R7C1,1))=0,"",AVERAGE(OFFSET(R[-74]C,3,0,R7C1,1))) -> 67.771444444444427 | N85: =IF(SUM(OFFSET(R[-74]C,3,0,R7C1,1))=0,"",AVERAGE(OFFSET(R[-74]C,3,0,R7C1,1))) -> 7.150888888888888 | O85: =IF(SUM(OFFSET(R[-74]C,3,0,R7C1,1))=0,"",AVERAGE(OFFSET(R[-74]C,3,0,R7C1,1))) -> 45.620444444444438 | P85: =IF(SUM(OFFSET(R[-74]C,3,0,R7C1,1))=0,"",AVERAGE(OFFSET(R[-74]C,3,0,R7C1,1))) -> 22.151000000000003 | Q85: =IF(SUM(OFFSET(R[-74]C,3,0,R7C1,1))=0,"",AVERAGE(OFFSET(R[-74]C,3,0,R7C1,1))) -> 14.594444444444443 | R85: =IF(SUM(OFFSET(R[-74]C,3,0,R7C1,1))=0,"",AVERAGE(OFFSET(R[-74]C,3,0,R7C1,1))) -> 1.1174999999999999 | S85: =AVERAGE(OFFSET(R[-74]C,3,0,R7C1,1)) -> 3.1722555555555561 | T85: =AVERAGE(OFFSET(R[-74]C,3,0,R7C1,1)) -> 3.0247886200000003 | W85: =AVERAGE(OFFSET(R[-74]C,3,0,R7C1,1)) -> 1.4195335044444444 | X85: =AVERAGE(OFFSET(R[-74]C,3,0,R7C1,1)) -> 1.111508202222222 | AC85: Итого | AE85: =R[1]C[-28] -> 720 | AF85: =R[1]C[-28] -> 2808.22 | AI85: =R[1]C[-28] -> 2467.7400000000007 | AM85: =R[1]C[-28] -> 340.48 | AN85: =R[1]C[-28] -> 652.3599999999999 | AQ85: =R[1]C[-29] -> 214.52666666666664 | AU85: =R[1]C[-30] -> 437.83333333333331 | AV85: =R[1]C[-30] -> 33.524999999999999 | AW85: =R[1]C[-30] -> 95.167666666666676
B86: ИТОГО: | C86: =SUM(OFFSET(R[-75]C,3,0,R7C1,1)) -> 720 | D86: =SUM(OFFSET(R[-75]C,3,0,R7C1,1)) -> 2808.22 | G86: =SUM(OFFSET(R[-75]C,3,0,R7C1,1)) -> 2467.7400000000007 | K86: =SUM(OFFSET(R[-75]C,3,0,R7C1,1)) -> 340.48 | L86: =IF(SUM(OFFSET(R[-75]C,3,0,R7C1,1))=0,"",SUM(OFFSET(R[-75]C,3,0,R7C1,1))) -> 652.3599999999999 | N86: =IF(SUM(OFFSET(R[-75]C,3,0,R7C1,1))=0,"",SUM(OFFSET(R[-75]C,3,0,R7C1,1))) -> 214.52666666666664 | Q86: =IF(SUM(OFFSET(R[-75]C,3,0,R7C1,1))=0,"",SUM(OFFSET(R[-75]C,3,0,R7C1,1))) -> 437.83333333333331 | R86: =IF(SUM(OFFSET(R[-75]C,3,0,R7C1,1))=0,"",SUM(OFFSET(R[-75]C,3,0,R7C1,1))) -> 33.524999999999999 | S86: =SUM(OFFSET(R[-75]C,3,0,R7C1,1)) -> 95.167666666666676 | T86: =SUM(OFFSET(R[-75]C,3,0,R7C1,1)) -> 90.743658600000003 | W86: =SUM(OFFSET(R[-75]C,3,0,R7C1,1)) -> 42.58600513333333 | X86: =SUM(OFFSET(R[-75]C,3,0,R7C1,1)) -> 33.345246066666661
AC87: Досчёт | AF87: =R[1]C[-28] -> 0 | AI87: =R[1]C[-28] -> 0 | AM87: =R[1]C[-28] -> 0 | AN87: =R[1]C[-28] -> 0 | AQ87: =R[1]C[-29] -> 0 | AU87: =R[1]C[-30] -> 0 | AV87: =R[1]C[-30] -> 0 | AW87: =R[1]C[-30] -> 0
A88: 11дн=264ч 4дн=96ч | B88: Досчёт до конца м-ца (+) | C88: =R6C1*24 -> 216 | T88: № 77005 | AC88: Снятие | AF88: =-R[1]C[-28] -> 0 | AI88: =-R[1]C[-28] -> 0 | AM88: =-R[1]C[-28] -> 0 | AN88: =-R[1]C[-28] -> 0 | AQ88: =-R[1]C[-29] -> 0 | AU88: =-R[1]C[-30] -> 0 | AV88: =-R[1]C[-30] -> 0 | AW88: =-R[1]C[-30] -> 0
A89: 9дн=216ч 7дн=168ч | B89: Вычет с предыдущего (-) | C89: =R4C1*24 -> 192 | AC89: Сумма | AF89: =R[1]C[-28] -> 2808.22 | AI89: =R[1]C[-28] -> 2467.7400000000007 | AM89: =R[1]C[-28] -> 340.48 | AN89: =R[1]C[-28] -> 652.3599999999999 | AQ89: =R[1]C[-29] -> 214.52666666666664 | AU89: =R[1]C[-30] -> 437.83333333333331 | AV89: =R[1]C[-30] -> 33.524999999999999 | AW89: =R[1]C[-30] -> 95.167666666666676
B90: СУММА: | C90: =R[-4]C+R[-2]C-R[-1]C -> 744 | D90: =R[-4]C+R[-2]C-R[-1]C -> 2808.22 | G90: =R[-4]C+R[-2]C-R[-1]C -> 2467.7400000000007 | K90: =R[-4]C+R[-2]C-R[-1]C -> 340.48 | L90: =IF(SUM(OFFSET(R[-79]C,3,0,R7C1,1))=0,"",(R[-4]C+R[-2]C-R[-1]C)) -> 652.3599999999999 | N90: =IF(SUM(OFFSET(R[-79]C,3,0,R7C1,1))=0,"",(R[-4]C+R[-2]C-R[-1]C)) -> 214.52666666666664 | Q90: =IF(SUM(OFFSET(R[-79]C,3,0,R7C1,1))=0,"",(R[-4]C+R[-2]C-R[-1]C)) -> 437.83333333333331 | R90: =IF(SUM(OFFSET(R[-79]C,3,0,R7C1,1))=0,"",(R[-4]C+R[-2]C-R[-1]C)) -> 33.524999999999999 | S90: =R[-4]C+R[-2]C-R[-1]C -> 95.167666666666676
AC91: Тхв на источнике | AE91: V гвс (м3) | AF91: =R[-2]C[15] -> 437.83333333333331 | AG91: W гвс (Гкал) | AH91: =RC[-2]*0.06 -> 26.27 | AI91: W без гвс (Гкал) | AJ91: =R[-2]C[13]-RC[-2] -> 68.89766666666668
B92: Показания счетчиков на момент снятия данных:
B93: Дата, время | D93: М1, т | F93: М2, т | H93: М3, т | J93: М4, т | L93: Qо, Гкал | N93: Qг, Гкал | P93: время, час
B94: 23.09.18 02:00 | D94: 48598.97 | F94: 43949.17 | H94: 10831.04 | J94: 4978.04 | L94: 1521.43 | N94: 547.173 | P94: -
B95: 23.10.18 00:00 | D95: 51407.19 | F95: 46416.11 | H95: 11458.31 | J95: 5180.3500000000004 | L95: 1613.529 | N95: 580.20100000000002 | P95: -
AC97: =ZAYAVKA_N -> з.н д. №02/147-2783 от 04.10.18 с 23.09.18г по 24.09.18г некорректная работа приборов
B98: Представитель потребителя:_______________________________________________________________________ В.О. Топорков
I101: Рекомендуемые значения по параметрам теплопотребления (не являются официально утверждёнными)
I102: М, т | J102: V, м3 | K102: Qгвс, Гкал | L102: Qотоп, Гкал | M102: Qо, Гкал
I103: =R[-13]C[-3] -> 0 | J103: =RC[-1]/0.98 -> 0 | K103: =RC[-1]*0.06 -> 0 | L103: =RC[1]-RC[-1] -> 33.524999999999999 | M103: =R[-13]C[5] -> 33.524999999999999
O105: ДЛЯ САМОКОНТРОЛЯ
B106: В строке выбора дат указать период с 16.7.13 по 23.8.13 - жильё | N106: Q | O106: Qг
B107: В строке выбора дат указать период с 18.7.13 по 25.8.13 - не жилое | N107: =(R[-21]C[-10]*R[-22]C[-7]-R[-21]C[-9]*R[-22]C[-6])/1000 -> 230.99856076000006 | O107: =IF(R[-22]C[-2]="",R[-21]C[-3]*R[-22]C/1000,"") ->  | P107: Си2
O108: =IF(R[-23]C[-2]="","",((R[-22]C[-3]*R[-23]C)-(R[-22]C[-2]*R[-23]C[2]))/1000) -> 29.760953137777769 | P108: Си3