Sheet: Лист1
G1: Отчёт о теплопотреблении за октябрь 2018 | M1: з.н д. №02/147-2783 от 04.10.18 03.10.18г некорректная работа приборов
A4: =EOMONTH(R[9]C,0)-R[9]C -> 8 | B4: Потребитель: ЗАО "Сити Сервис"
A5: =MAX(R[9]C:R[78]C) -> 2018-10-22T00:00:00.000 | B5: Адрес: г. СПб, Кораблестроителей ул., д.35 к.1 ИТП 8
A6: =EOMONTH(R[-1]C,0)-R[-1]C -> 9 | B6: Телефон: 8-911-021-19-79
A7: =R[-2]C-R[6]C -> 30 | B7: Договор 10023-2(.)400
A8: 7 | B8: Тепловычислитель: ВТД-УВ № B018 | L8: М2 мах= | M8: 208.56 | O8: Мгвс мах= | P8: 124.08
L9: Qотоп мах= | M9: 16.68 | O9: Qгвс мах= | P9: 7.44
B10: Расчётная формула: Q=M1*(h1-h2)+(M1-M2)*(h2-hхв)
D12: Учет | L12: Контроль
A13: =R[1]C[1]-1 -> 2018-09-22T00:00:00.000 | B13: Дата | C13: N, ч | D13: M1, т | E13: T1, С | F13: P1, кг/см2 | G13: M2, т | H13: T2, С | I13: P2, кг/см2 | J13: dT, С | K13: M1-М2, т | L13: V3, м3 | M13: T3, С | N13: V4, м3 | O13: =IF(R[-12]C[-14]="м.куб","","T4, С") -> T4, С | P13: dT, С | Q13: V3-V4, м3 | R13: Qгвс, Гкал | S13: Qобщ., Гкал | T13: Q | U13: M3 | V13: M4 | W13: си2 | X13: си3 | Y13: Разб. | Z13: dM2 | AC13: Дата | AD13: НС | AE13: n, ч | AF13: М1, т | AG13: t1, гр. С | AH13: Р1, кгс/см2 | AI13: М2, т | AJ13: t2, гр. С | AK13: Р2, кгс/см2 | AL13: t1-t2, гр. С | AM13: М1-М2, т | AN13: М1гвс, т | AO13: t1гвс, гр. С | AP13: Р1гвс, кгс/см2 | AQ13: М2гвс, т | AR13: t2гвс, гр. С | AS13: Р2гвс, кгс/см2 | AT13: t1гвс-t2гвс | AU13: М1гвс-М2гвс, т | AV13: Wгвс, Гкал | AW13: Wсумм, Гкал | AY13: NS_TV1 | AZ13: НС | BA13: NS_TV2
A14: =IF(RC[1]="","",DATEVALUE(RC[1])) -> 43366 | B14: 23.09.18 | C14: 24 | D14: 340.27136230000002 | E14: 70.52 | F14: 6.5802988877999997 | G14: 339.45019531000003 | H14: 67.09 | I14: 4.3915223165199997 | J14: =RC[-5]-RC[-2] -> 3.4299999999999926 | K14: 0.82116698999999505 | L14: 28.673223499999999 | M14: 70.09 | R14: 1.97693783796694 | S14: =RC[-1] -> 1.97693783796694 | T14: =(RC[-16]*RC[-15]-RC[-13]*RC[-12])/1000 -> 1.2222228660480978 | U14: 28.042793270000001 | V14: - | W14: =RC[-2]*RC[-10]/1000 -> 1.9655193802943001 | X14: =ABS((RC[-3]*RC[-11]-RC[-2]*RC[-9])/1000) -> #VALUE! | Y14: =(RC[-14]-RC[1])/RC[-18]*100 -> -8.0193285071290319 | Z14: 28.042793270000001 | AC14: =VALUE(RC[-27]) -> 2018-09-23T00:00:00.000 | AD14: =IF(RC[21]=42,"*",IF(RC[21]=32,"",RC[21])) -> - | AE14: =RC[-28] -> 24 | AF14: =RC[-28] -> 340.27136230000002 | AG14: =RC[-28] -> 70.52 | AH14: =RC[-28] -> 6.5802988877999997 | AI14: =RC[-28] -> 339.45019531000003 | AJ14: =RC[-28] -> 67.09 | AK14: =RC[-28] -> 4.3915223165199997 | AL14: =RC[-28] -> 3.4299999999999926 | AM14: =RC[-28] -> 0.82116698999999505 | AN14: =RC[-28] -> 28.673223499999999 | AO14: =RC[-28] -> 70.09 | AP14: - | AQ14: =RC[-29] -> 0 | AR14: =RC[-29] -> 0 | AS14: - | AT14: =RC[-30] -> 0 | AU14: =RC[-30] -> 0 | AV14: =RC[-30] -> 1.97693783796694 | AW14: =RC[-30] -> 1.97693783796694 | AY14: - | AZ14: - | BA14: -
A15: =IF(RC[1]="","",DATEVALUE(RC[1])) -> 43367 | B15: 24.09.18 | C15: 24 | D15: 308.46252441000001 | E15: 69.34 | F15: 6.7331057265599998 | G15: 300.54632568 | H15: 67.459999999999994 | I15: 4.9084917521599998 | J15: =RC[-5]-RC[-2] -> 1.8800000000000097 | K15: 7.9161987300000201 | L15: 25.52071381 | M15: 68.94 | R15: 1.7275710709850001 | S15: =RC[-1] -> 1.7275710709850001 | T15: =(RC[-16]*RC[-15]-RC[-13]*RC[-12])/1000 -> 1.1139363122166033 | U15: 24.977710720000001 | V15: - | W15: =RC[-2]*RC[-10]/1000 -> 1.7219633770367999 | X15: =ABS((RC[-3]*RC[-11]-RC[-2]*RC[-9])/1000) -> #VALUE! | Y15: =(RC[-14]-RC[1])/RC[-18]*100 -> -5.6768326651132801 | Z15: 24.977710720000001 | AC15: =VALUE(RC[-27]) -> 2018-09-24T00:00:00.000 | AD15: =IF(RC[21]=42,"*",IF(RC[21]=32,"",RC[21])) -> - | AE15: =RC[-28] -> 24 | AF15: =RC[-28] -> 308.46252441000001 | AG15: =RC[-28] -> 69.34 | AH15: =RC[-28] -> 6.7331057265599998 | AI15: =RC[-28] -> 300.54632568 | AJ15: =RC[-28] -> 67.459999999999994 | AK15: =RC[-28] -> 4.9084917521599998 | AL15: =RC[-28] -> 1.8800000000000097 | AM15: =RC[-28] -> 7.9161987300000201 | AN15: =RC[-28] -> 25.52071381 | AO15: =RC[-28] -> 68.94 | AP15: - | AQ15: =RC[-29] -> 0 | AR15: =RC[-29] -> 0 | AS15: - | AT15: =RC[-30] -> 0 | AU15: =RC[-30] -> 0 | AV15: =RC[-30] -> 1.7275710709850001 | AW15: =RC[-30] -> 1.7275710709850001 | AY15: - | AZ15: - | BA15: -
A16: =IF(RC[1]="","",DATEVALUE(RC[1])) -> 43368 | B16: 25.09.18 | C16: 24 | D16: 262.94854736000002 | E16: 67.900000000000006 | F16: 6.7477044873200001 | G16: 240.41743468999999 | H16: 67.739999999999995 | I16: 5.5276686354400004 | J16: =RC[-5]-RC[-2] -> 0.1600000000000108 | K16: 22.531112669999999 | L16: 26.93049049 | M16: 67.44 | R16: 1.7841802784943199 | S16: =RC[-1] -> 1.7841802784943199 | T16: =(RC[-16]*RC[-15]-RC[-13]*RC[-12])/1000 -> 1.5683293398434035 | U16: 26.381376270000001 | V16: - | W16: =RC[-2]*RC[-10]/1000 -> 1.7791600156488001 | X16: =ABS((RC[-3]*RC[-11]-RC[-2]*RC[-9])/1000) -> #VALUE! | Y16: =(RC[-14]-RC[1])/RC[-18]*100 -> -1.6014910087384568 | Z16: 26.381376270000001 | AC16: =VALUE(RC[-27]) -> 2018-09-25T00:00:00.000 | AD16: =IF(RC[21]=42,"*",IF(RC[21]=32,"",RC[21])) -> - | AE16: =RC[-28] -> 24 | AF16: =RC[-28] -> 262.94854736000002 | AG16: =RC[-28] -> 67.900000000000006 | AH16: =RC[-28] -> 6.7477044873200001 | AI16: =RC[-28] -> 240.41743468999999 | AJ16: =RC[-28] -> 67.739999999999995 | AK16: =RC[-28] -> 5.5276686354400004 | AL16: =RC[-28] -> 0.1600000000000108 | AM16: =RC[-28] -> 22.531112669999999 | AN16: =RC[-28] -> 26.93049049 | AO16: =RC[-28] -> 67.44 | AP16: - | AQ16: =RC[-29] -> 0 | AR16: =RC[-29] -> 0 | AS16: - | AT16: =RC[-30] -> 0 | AU16: =RC[-30] -> 0 | AV16: =RC[-30] -> 1.7841802784943199 | AW16: =RC[-30] -> 1.7841802784943199 | AY16: - | AZ16: - | BA16: -
A17: =IF(RC[1]="","",DATEVALUE(RC[1])) -> 43369 | B17: 26.09.18 | C17: 24 | D17: 244.53225707999999 | E17: 67.319999999999993 | F17: 6.5580708003200003 | G17: 220.81175232000001 | H17: 67.17 | I17: 5.5384521205999997 | J17: =RC[-5]-RC[-2] -> 0.14999999999999147 | K17: 23.720504760000001 | L17: 27.574697489999998 | M17: 66.94 | R17: 1.80660909525174 | S17: =RC[-1] -> 1.80660909525174 | T17: =(RC[-16]*RC[-15]-RC[-13]*RC[-12])/1000 -> 1.6299861432911966 | U17: 27.023860930000001 | V17: - | W17: =RC[-2]*RC[-10]/1000 -> 1.8089772506542001 | X17: =ABS((RC[-3]*RC[-11]-RC[-2]*RC[-9])/1000) -> #VALUE! | Y17: =(RC[-14]-RC[1])/RC[-18]*100 -> -1.496005595396382 | Z17: 27.023860930000001 | AC17: =VALUE(RC[-27]) -> 2018-09-26T00:00:00.000 | AD17: =IF(RC[21]=42,"*",IF(RC[21]=32,"",RC[21])) -> - | AE17: =RC[-28] -> 24 | AF17: =RC[-28] -> 244.53225707999999 | AG17: =RC[-28] -> 67.319999999999993 | AH17: =RC[-28] -> 6.5580708003200003 | AI17: =RC[-28] -> 220.81175232000001 | AJ17: =RC[-28] -> 67.17 | AK17: =RC[-28] -> 5.5384521205999997 | AL17: =RC[-28] -> 0.14999999999999147 | AM17: =RC[-28] -> 23.720504760000001 | AN17: =RC[-28] -> 27.574697489999998 | AO17: =RC[-28] -> 66.94 | AP17: - | AQ17: =RC[-29] -> 0 | AR17: =RC[-29] -> 0 | AS17: - | AT17: =RC[-30] -> 0 | AU17: =RC[-30] -> 0 | AV17: =RC[-30] -> 1.80660909525174 | AW17: =RC[-30] -> 1.80660909525174 | AY17: - | AZ17: - | BA17: -
A18: =IF(RC[1]="","",DATEVALUE(RC[1])) -> 43370 | B18: 27.09.18 | C18: 24 | D18: 209.76704407 | E18: 62.73 | F18: 6.2764252984000004 | G18: 184.13647460999999 | H18: 62.54 | I18: 5.5759967181999999 | J18: =RC[-5]-RC[-2] -> 0.18999999999999773 | K18: 25.63056946 | L18: 29.511993409999999 | M18: 62.37 | R18: 1.8076158880290401 | S18: =RC[-1] -> 1.8076158880290401 | T18: =(RC[-16]*RC[-15]-RC[-13]*RC[-12])/1000 -> 1.6427915524016989 | U18: 28.993513109999999 | V18: - | W18: =RC[-2]*RC[-10]/1000 -> 1.8083254126706998 | X18: =ABS((RC[-3]*RC[-11]-RC[-2]*RC[-9])/1000) -> #VALUE! | Y18: =(RC[-14]-RC[1])/RC[-18]*100 -> -1.8263321577773735 | Z18: 28.993513109999999 | AC18: =VALUE(RC[-27]) -> 2018-09-27T00:00:00.000 | AD18: =IF(RC[21]=42,"*",IF(RC[21]=32,"",RC[21])) -> - | AE18: =RC[-28] -> 24 | AF18: =RC[-28] -> 209.76704407 | AG18: =RC[-28] -> 62.73 | AH18: =RC[-28] -> 6.2764252984000004 | AI18: =RC[-28] -> 184.13647460999999 | AJ18: =RC[-28] -> 62.54 | AK18: =RC[-28] -> 5.5759967181999999 | AL18: =RC[-28] -> 0.18999999999999773 | AM18: =RC[-28] -> 25.63056946 | AN18: =RC[-28] -> 29.511993409999999 | AO18: =RC[-28] -> 62.37 | AP18: - | AQ18: =RC[-29] -> 0 | AR18: =RC[-29] -> 0 | AS18: - | AT18: =RC[-30] -> 0 | AU18: =RC[-30] -> 0 | AV18: =RC[-30] -> 1.8076158880290401 | AW18: =RC[-30] -> 1.8076158880290401 | AY18: - | AZ18: - | BA18: -
A19: =IF(RC[1]="","",DATEVALUE(RC[1])) -> 43371 | B19: 28.09.18 | C19: 24 | D19: 197.01943969999999 | E19: 67.23 | F19: 6.37366829596 | G19: 174.86608887 | H19: 67.05 | I19: 5.7505577706800004 | J19: =RC[-5]-RC[-2] -> 0.18000000000000682 | K19: 22.153350830000001 | L19: 25.97657585 | M19: 66.78 | R19: 1.7107950988822 | S19: =RC[-1] -> 1.7107950988822 | T19: =(RC[-16]*RC[-15]-RC[-13]*RC[-12])/1000 -> 1.5208456722975006 | U19: 25.45280266 | V19: - | W19: =RC[-2]*RC[-10]/1000 -> 1.6997381616348 | X19: =ABS((RC[-3]*RC[-11]-RC[-2]*RC[-9])/1000) -> #VALUE! | Y19: =(RC[-14]-RC[1])/RC[-18]*100 -> -1.8868448715936552 | Z19: 25.45280266 | AC19: =VALUE(RC[-27]) -> 2018-09-28T00:00:00.000 | AD19: =IF(RC[21]=42,"*",IF(RC[21]=32,"",RC[21])) -> - | AE19: =RC[-28] -> 24 | AF19: =RC[-28] -> 197.01943969999999 | AG19: =RC[-28] -> 67.23 | AH19: =RC[-28] -> 6.37366829596 | AI19: =RC[-28] -> 174.86608887 | AJ19: =RC[-28] -> 67.05 | AK19: =RC[-28] -> 5.7505577706800004 | AL19: =RC[-28] -> 0.18000000000000682 | AM19: =RC[-28] -> 22.153350830000001 | AN19: =RC[-28] -> 25.97657585 | AO19: =RC[-28] -> 66.78 | AP19: - | AQ19: =RC[-29] -> 0 | AR19: =RC[-29] -> 0 | AS19: - | AT19: =RC[-30] -> 0 | AU19: =RC[-30] -> 0 | AV19: =RC[-30] -> 1.7107950988822 | AW19: =RC[-30] -> 1.7107950988822 | AY19: - | AZ19: - | BA19: -
A20: =IF(RC[1]="","",DATEVALUE(RC[1])) -> 43372 | B20: 29.09.18 | C20: 24 | D20: 226.51283264 | E20: 67.319999999999993 | F20: 6.9957259725199998 | G20: 201.92112732000001 | H20: 67.180000000000007 | I20: 6.1548279038400002 | J20: =RC[-5]-RC[-2] -> 0.13999999999998636 | K20: 24.591705319999999 | L20: 29.474489210000002 | M20: 66.91 | R20: 1.93375826884494 | S20: =RC[-1] -> 1.93375826884494 | T20: =(RC[-16]*RC[-15]-RC[-13]*RC[-12])/1000 -> 1.6837825599671961 | U20: 28.884220119999998 | V20: - | W20: =RC[-2]*RC[-10]/1000 -> 1.9326431682291998 | X20: =ABS((RC[-3]*RC[-11]-RC[-2]*RC[-9])/1000) -> #VALUE! | Y20: =(RC[-14]-RC[1])/RC[-18]*100 -> -2.125837378669801 | Z20: 28.884220119999998 | AC20: =VALUE(RC[-27]) -> 2018-09-29T00:00:00.000 | AD20: =IF(RC[21]=42,"*",IF(RC[21]=32,"",RC[21])) -> - | AE20: =RC[-28] -> 24 | AF20: =RC[-28] -> 226.51283264 | AG20: =RC[-28] -> 67.319999999999993 | AH20: =RC[-28] -> 6.9957259725199998 | AI20: =RC[-28] -> 201.92112732000001 | AJ20: =RC[-28] -> 67.180000000000007 | AK20: =RC[-28] -> 6.1548279038400002 | AL20: =RC[-28] -> 0.13999999999998636 | AM20: =RC[-28] -> 24.591705319999999 | AN20: =RC[-28] -> 29.474489210000002 | AO20: =RC[-28] -> 66.91 | AP20: - | AQ20: =RC[-29] -> 0 | AR20: =RC[-29] -> 0 | AS20: - | AT20: =RC[-30] -> 0 | AU20: =RC[-30] -> 0 | AV20: =RC[-30] -> 1.93375826884494 | AW20: =RC[-30] -> 1.93375826884494 | AY20: - | AZ20: - | BA20: -
A21: =IF(RC[1]="","",DATEVALUE(RC[1])) -> 43373 | B21: 30.09.18 | C21: 24 | D21: 247.21969604 | E21: 69.19 | F21: 7.0619249327200002 | G21: 223.32569885000001 | H21: 69.06 | I21: 6.02214906732 | J21: =RC[-5]-RC[-2] -> 0.12999999999999545 | K21: 23.89399719 | L21: 28.651756290000002 | M21: 68.680000000000007 | R21: 1.9448751289767801 | S21: =RC[-1] -> 1.9448751289767801 | T21: =(RC[-16]*RC[-15]-RC[-13]*RC[-12])/1000 -> 1.6822580064265986 | U21: 28.040031429999999 | V21: - | W21: =RC[-2]*RC[-10]/1000 -> 1.9257893586124 | X21: =ABS((RC[-3]*RC[-11]-RC[-2]*RC[-9])/1000) -> #VALUE! | Y21: =(RC[-14]-RC[1])/RC[-18]*100 -> -1.8564967047454508 | Z21: 28.040031429999999 | AC21: =VALUE(RC[-27]) -> 2018-09-30T00:00:00.000 | AD21: =IF(RC[21]=42,"*",IF(RC[21]=32,"",RC[21])) -> - | AE21: =RC[-28] -> 24 | AF21: =RC[-28] -> 247.21969604 | AG21: =RC[-28] -> 69.19 | AH21: =RC[-28] -> 7.0619249327200002 | AI21: =RC[-28] -> 223.32569885000001 | AJ21: =RC[-28] -> 69.06 | AK21: =RC[-28] -> 6.02214906732 | AL21: =RC[-28] -> 0.12999999999999545 | AM21: =RC[-28] -> 23.89399719 | AN21: =RC[-28] -> 28.651756290000002 | AO21: =RC[-28] -> 68.680000000000007 | AP21: - | AQ21: =RC[-29] -> 0 | AR21: =RC[-29] -> 0 | AS21: - | AT21: =RC[-30] -> 0 | AU21: =RC[-30] -> 0 | AV21: =RC[-30] -> 1.9448751289767801 | AW21: =RC[-30] -> 1.9448751289767801 | AY21: - | AZ21: - | BA21: -
A22: =IF(RC[1]="","",DATEVALUE(RC[1])) -> 43374 | B22: 01.10.18 | C22: 24 | D22: 250.54548645 | E22: 68.28 | F22: 7.1475207785599997 | G22: 174.68690491000001 | H22: 58.76 | I22: 6.0942962452399998 | J22: =RC[-5]-RC[-2] -> 9.5200000000000031 | K22: 75.858581540000003 | L22: 29.839920039999999 | M22: 67.88 | R22: 1.9875084814177899 | S22: 7.9782259458297498 | T22: =(RC[-16]*RC[-15]-RC[-13]*RC[-12])/1000 -> 6.8426432822943992 | U22: 29.22460938 | V22: - | W22: =RC[-2]*RC[-10]/1000 -> 1.9837664847143999 | X22: =ABS((RC[-3]*RC[-11]-RC[-2]*RC[-9])/1000) -> #VALUE! | Y22: =(RC[-14]-RC[1])/RC[-18]*100 -> 26.695745845417644 | Z22: 29.22460938 | AC22: =VALUE(RC[-27]) -> 2018-10-01T00:00:00.000 | AD22: =IF(RC[21]=42,"*",IF(RC[21]=32,"",RC[21])) -> - | AE22: =RC[-28] -> 24 | AF22: =RC[-28] -> 250.54548645 | AG22: =RC[-28] -> 68.28 | AH22: =RC[-28] -> 7.1475207785599997 | AI22: =RC[-28] -> 174.68690491000001 | AJ22: =RC[-28] -> 58.76 | AK22: =RC[-28] -> 6.0942962452399998 | AL22: =RC[-28] -> 9.5200000000000031 | AM22: =RC[-28] -> 75.858581540000003 | AN22: =RC[-28] -> 29.839920039999999 | AO22: =RC[-28] -> 67.88 | AP22: - | AQ22: =RC[-29] -> 0 | AR22: =RC[-29] -> 0 | AS22: - | AT22: =RC[-30] -> 0 | AU22: =RC[-30] -> 0 | AV22: =RC[-30] -> 1.9875084814177899 | AW22: =RC[-30] -> 7.9782259458297498 | AY22: - | AZ22: - | BA22: -
A23: =IF(RC[1]="","",DATEVALUE(RC[1])) -> 43375 | B23: 02.10.18 | C23: 24 | D23: 243.67697143999999 | E23: 67.14 | F23: 7.03995408808 | G23: 210.30735779 | H23: 42.63 | I23: 6.0526998433200001 | J23: =RC[-5]-RC[-2] -> 24.509999999999998 | K23: 33.369613649999998 | L23: 28.520675659999998 | M23: 66.77 | R23: 1.87353462787809 | S23: 7.3856759386643702 | T23: =(RC[-16]*RC[-15]-RC[-13]*RC[-12])/1000 -> 7.3950691998939 | U23: 27.94856644 | V23: - | W23: =RC[-2]*RC[-10]/1000 -> 1.8661257811987999 | X23: =ABS((RC[-3]*RC[-11]-RC[-2]*RC[-9])/1000) -> #VALUE! | Y23: =(RC[-14]-RC[1])/RC[-18]*100 -> 2.577678340390317 | Z23: 27.94856644 | AC23: =VALUE(RC[-27]) -> 2018-10-02T00:00:00.000 | AD23: =IF(RC[21]=42,"*",IF(RC[21]=32,"",RC[21])) -> - | AE23: =RC[-28] -> 24 | AF23: =RC[-28] -> 243.67697143999999 | AG23: =RC[-28] -> 67.14 | AH23: =RC[-28] -> 7.03995408808 | AI23: =RC[-28] -> 210.30735779 | AJ23: =RC[-28] -> 42.63 | AK23: =RC[-28] -> 6.0526998433200001 | AL23: =RC[-28] -> 24.509999999999998 | AM23: =RC[-28] -> 33.369613649999998 | AN23: =RC[-28] -> 28.520675659999998 | AO23: =RC[-28] -> 66.77 | AP23: - | AQ23: =RC[-29] -> 0 | AR23: =RC[-29] -> 0 | AS23: - | AT23: =RC[-30] -> 0 | AU23: =RC[-30] -> 0 | AV23: =RC[-30] -> 1.87353462787809 | AW23: =RC[-30] -> 7.3856759386643702 | AY23: - | AZ23: - | BA23: -
A24: =IF(RC[1]="","",DATEVALUE(RC[1])) -> 43376 | B24: 03.10.18 | C24: 24 | D24: =AVERAGE(R[1]C:R[3]C) -> 227.14178467000002 | E24: =AVERAGE(R[1]C:R[3]C) -> 66.443333333333328 | F24: =AVERAGE(R[1]C:R[3]C) -> 6.9148798165733334 | G24: =AVERAGE(R[1]C:R[3]C) -> 200.86030070000001 | H24: =AVERAGE(R[1]C:R[3]C) -> 40.613333333333337 | I24: =AVERAGE(R[1]C:R[3]C) -> 6.0857817895466662 | J24: =AVERAGE(R[1]C:R[3]C) -> 25.83 | K24: =AVERAGE(R[1]C:R[3]C) -> 26.28148397 | L24: 27.418014530000001 | M24: 66.900000000000006 | R24: 1.8052768032865201 | S24: =RC[1] -> 6.9344509669943655 | T24: =(RC[-16]*RC[-15]-RC[-13]*RC[-12])/1000 -> 6.9344509669943655 | U24: 26.864643099999999 | V24: - | W24: =RC[-2]*RC[-10]/1000 -> 1.7972446233899999 | X24: =ABS((RC[-3]*RC[-11]-RC[-2]*RC[-9])/1000) -> #VALUE! | Y24: =(RC[-14]-RC[1])/RC[-18]*100 -> -0.29033070645004694 | Z24: 26.864643099999999 | AC24: =VALUE(RC[-27]) -> 2018-10-03T00:00:00.000 | AD24: =IF(RC[21]=42,"*",IF(RC[21]=32,"",RC[21])) -> - | AE24: =RC[-28] -> 24 | AF24: =RC[-28] -> 227.14178467000002 | AG24: =RC[-28] -> 66.443333333333328 | AH24: =RC[-28] -> 6.9148798165733334 | AI24: =RC[-28] -> 200.86030070000001 | AJ24: =RC[-28] -> 40.613333333333337 | AK24: =RC[-28] -> 6.0857817895466662 | AL24: =RC[-28] -> 25.83 | AM24: =RC[-28] -> 26.28148397 | AN24: =RC[-28] -> 27.418014530000001 | AO24: =RC[-28] -> 66.900000000000006 | AP24: - | AQ24: =RC[-29] -> 0 | AR24: =RC[-29] -> 0 | AS24: - | AT24: =RC[-30] -> 0 | AU24: =RC[-30] -> 0 | AV24: =RC[-30] -> 1.8052768032865201 | AW24: =RC[-30] -> 6.9344509669943655 | AY24: - | AZ24: - | BA24: -
A25: =IF(RC[1]="","",DATEVALUE(RC[1])) -> 43377 | B25: 04.10.18 | C25: 24 | D25: 230.43287659000001 | E25: 66.66 | F25: 6.9764975549199999 | G25: 205.81832886000001 | H25: 40.880000000000003 | I25: 6.1092380644800004 | J25: =RC[-5]-RC[-2] -> 25.779999999999994 | K25: 24.614547730000002 | L25: 27.96803474 | M25: 66.290000000000006 | R25: 1.82426874462597 | S25: 6.9439307514091899 | T25: =(RC[-16]*RC[-15]-RC[-13]*RC[-12])/1000 -> 6.946802269692598 | U25: 27.414535520000001 | V25: - | W25: =RC[-2]*RC[-10]/1000 -> 1.8173095596208002 | X25: =ABS((RC[-3]*RC[-11]-RC[-2]*RC[-9])/1000) -> #VALUE! | Y25: =(RC[-14]-RC[1])/RC[-18]*100 -> -1.3604171239309708 | Z25: 27.414535520000001 | AC25: =VALUE(RC[-27]) -> 2018-10-04T00:00:00.000 | AD25: =IF(RC[21]=42,"*",IF(RC[21]=32,"",RC[21])) -> - | AE25: =RC[-28] -> 24 | AF25: =RC[-28] -> 230.43287659000001 | AG25: =RC[-28] -> 66.66 | AH25: =RC[-28] -> 6.9764975549199999 | AI25: =RC[-28] -> 205.81832886000001 | AJ25: =RC[-28] -> 40.880000000000003 | AK25: =RC[-28] -> 6.1092380644800004 | AL25: =RC[-28] -> 25.779999999999994 | AM25: =RC[-28] -> 24.614547730000002 | AN25: =RC[-28] -> 27.96803474 | AO25: =RC[-28] -> 66.290000000000006 | AP25: - | AQ25: =RC[-29] -> 0 | AR25: =RC[-29] -> 0 | AS25: - | AT25: =RC[-30] -> 0 | AU25: =RC[-30] -> 0 | AV25: =RC[-30] -> 1.82426874462597 | AW25: =RC[-30] -> 6.9439307514091899 | AY25: - | AZ25: - | BA25: -
A26: =IF(RC[1]="","",DATEVALUE(RC[1])) -> 43378 | B26: 05.10.18 | C26: 24 | D26: 229.12197875999999 | E26: 66.040000000000006 | F26: 6.8657992568399999 | G26: 202.79814148 | H26: 40.380000000000003 | I26: 6.0171331890799999 | J26: =RC[-5]-RC[-2] -> 25.660000000000004 | K26: 26.323837279999999 | L26: 28.100002289999999 | M26: 65.73 | R26: 1.81700013136524 | S26: 6.9372171300277099 | T26: =(RC[-16]*RC[-15]-RC[-13]*RC[-12])/1000 -> 6.9422265243480004 | U26: 27.550756450000002 | V26: - | W26: =RC[-2]*RC[-10]/1000 -> 1.8109112214585001 | X26: =ABS((RC[-3]*RC[-11]-RC[-2]*RC[-9])/1000) -> #VALUE! | Y26: =(RC[-14]-RC[1])/RC[-18]*100 -> -0.60499527315490775 | Z26: 27.550756450000002 | AC26: =VALUE(RC[-27]) -> 2018-10-05T00:00:00.000 | AD26: =IF(RC[21]=42,"*",IF(RC[21]=32,"",RC[21])) -> - | AE26: =RC[-28] -> 24 | AF26: =RC[-28] -> 229.12197875999999 | AG26: =RC[-28] -> 66.040000000000006 | AH26: =RC[-28] -> 6.8657992568399999 | AI26: =RC[-28] -> 202.79814148 | AJ26: =RC[-28] -> 40.380000000000003 | AK26: =RC[-28] -> 6.0171331890799999 | AL26: =RC[-28] -> 25.660000000000004 | AM26: =RC[-28] -> 26.323837279999999 | AN26: =RC[-28] -> 28.100002289999999 | AO26: =RC[-28] -> 65.73 | AP26: - | AQ26: =RC[-29] -> 0 | AR26: =RC[-29] -> 0 | AS26: - | AT26: =RC[-30] -> 0 | AU26: =RC[-30] -> 0 | AV26: =RC[-30] -> 1.81700013136524 | AW26: =RC[-30] -> 6.9372171300277099 | AY26: - | AZ26: - | BA26: -
A27: =IF(RC[1]="","",DATEVALUE(RC[1])) -> 43379 | B27: 06.10.18 | C27: 24 | D27: 221.87049866000001 | E27: 66.63 | F27: 6.9023426379600004 | G27: 193.96443176 | H27: 40.58 | I27: 6.1309741150799999 | J27: =RC[-5]-RC[-2] -> 26.049999999999997 | K27: 27.906066899999999 | L27: 29.19981194 | M27: 66.27 | R27: 1.91068403315181 | S27: 6.9153751910767198 | T27: =(RC[-16]*RC[-15]-RC[-13]*RC[-12])/1000 -> 6.9121546848950013 | U27: 28.617662429999999 | V27: - | W27: =RC[-2]*RC[-10]/1000 -> 1.8964924892360997 | X27: =ABS((RC[-3]*RC[-11]-RC[-2]*RC[-9])/1000) -> #VALUE! | Y27: =(RC[-14]-RC[1])/RC[-18]*100 -> -0.36686908189460532 | Z27: 28.617662429999999 | AC27: =VALUE(RC[-27]) -> 2018-10-06T00:00:00.000 | AD27: =IF(RC[21]=42,"*",IF(RC[21]=32,"",RC[21])) -> - | AE27: =RC[-28] -> 24 | AF27: =RC[-28] -> 221.87049866000001 | AG27: =RC[-28] -> 66.63 | AH27: =RC[-28] -> 6.9023426379600004 | AI27: =RC[-28] -> 193.96443176 | AJ27: =RC[-28] -> 40.58 | AK27: =RC[-28] -> 6.1309741150799999 | AL27: =RC[-28] -> 26.049999999999997 | AM27: =RC[-28] -> 27.906066899999999 | AN27: =RC[-28] -> 29.19981194 | AO27: =RC[-28] -> 66.27 | AP27: - | AQ27: =RC[-29] -> 0 | AR27: =RC[-29] -> 0 | AS27: - | AT27: =RC[-30] -> 0 | AU27: =RC[-30] -> 0 | AV27: =RC[-30] -> 1.91068403315181 | AW27: =RC[-30] -> 6.9153751910767198 | AY27: - | AZ27: - | BA27: -
A28: =IF(RC[1]="","",DATEVALUE(RC[1])) -> 43380 | B28: 07.10.18 | C28: 24 | D28: 225.83732605 | E28: 66.930000000000007 | F28: 6.8600863433599999 | G28: 195.26240540000001 | H28: 41.02 | I28: 6.0770427097999997 | J28: =RC[-5]-RC[-2] -> 25.910000000000004 | K28: 30.574920649999999 | L28: 31.959426879999999 | M28: 66.62 | R28: 2.0964657948791401 | S28: 7.1057082473488098 | T28: =(RC[-16]*RC[-15]-RC[-13]*RC[-12])/1000 -> 7.1056283630185 | U28: 31.320011139999998 | V28: - | W28: =RC[-2]*RC[-10]/1000 -> 2.0865391421467998 | X28: =ABS((RC[-3]*RC[-11]-RC[-2]*RC[-9])/1000) -> #VALUE! | Y28: =(RC[-14]-RC[1])/RC[-18]*100 -> -0.38158420125659226 | Z28: 31.320011139999998 | AC28: =VALUE(RC[-27]) -> 2018-10-07T00:00:00.000 | AD28: =IF(RC[21]=42,"*",IF(RC[21]=32,"",RC[21])) -> - | AE28: =RC[-28] -> 24 | AF28: =RC[-28] -> 225.83732605 | AG28: =RC[-28] -> 66.930000000000007 | AH28: =RC[-28] -> 6.8600863433599999 | AI28: =RC[-28] -> 195.26240540000001 | AJ28: =RC[-28] -> 41.02 | AK28: =RC[-28] -> 6.0770427097999997 | AL28: =RC[-28] -> 25.910000000000004 | AM28: =RC[-28] -> 30.574920649999999 | AN28: =RC[-28] -> 31.959426879999999 | AO28: =RC[-28] -> 66.62 | AP28: - | AQ28: =RC[-29] -> 0 | AR28: =RC[-29] -> 0 | AS28: - | AT28: =RC[-30] -> 0 | AU28: =RC[-30] -> 0 | AV28: =RC[-30] -> 2.0964657948791401 | AW28: =RC[-30] -> 7.1057082473488098 | AY28: - | AZ28: - | BA28: -
A29: =IF(RC[1]="","",DATEVALUE(RC[1])) -> 43381 | B29: 08.10.18 | C29: 24 | D29: 222.87672423999999 | E29: 66.92 | F29: 6.8229712321199996 | G29: 197.66566467000001 | H29: 40.82 | I29: 6.0216679487200002 | J29: =RC[-5]-RC[-2] -> 26.1 | K29: 25.21105957 | L29: 27.506618499999998 | M29: 66.510000000000005 | R29: 1.80203035253654 | S29: 6.8419171204738696 | T29: =(RC[-16]*RC[-15]-RC[-13]*RC[-12])/1000 -> 6.8461979543113998 | U29: 26.95819092 | V29: - | W29: =RC[-2]*RC[-10]/1000 -> 1.7929892780892001 | X29: =ABS((RC[-3]*RC[-11]-RC[-2]*RC[-9])/1000) -> #VALUE! | Y29: =(RC[-14]-RC[1])/RC[-18]*100 -> -0.883882060608154 | Z29: 26.95819092 | AC29: =VALUE(RC[-27]) -> 2018-10-08T00:00:00.000 | AD29: =IF(RC[21]=42,"*",IF(RC[21]=32,"",RC[21])) -> - | AE29: =RC[-28] -> 24 | AF29: =RC[-28] -> 222.87672423999999 | AG29: =RC[-28] -> 66.92 | AH29: =RC[-28] -> 6.8229712321199996 | AI29: =RC[-28] -> 197.66566467000001 | AJ29: =RC[-28] -> 40.82 | AK29: =RC[-28] -> 6.0216679487200002 | AL29: =RC[-28] -> 26.1 | AM29: =RC[-28] -> 25.21105957 | AN29: =RC[-28] -> 27.506618499999998 | AO29: =RC[-28] -> 66.510000000000005 | AP29: - | AQ29: =RC[-29] -> 0 | AR29: =RC[-29] -> 0 | AS29: - | AT29: =RC[-30] -> 0 | AU29: =RC[-30] -> 0 | AV29: =RC[-30] -> 1.80203035253654 | AW29: =RC[-30] -> 6.8419171204738696 | AY29: - | AZ29: - | BA29: -
A30: =IF(RC[1]="","",DATEVALUE(RC[1])) -> 43382 | B30: 09.10.18 | C30: 24 | D30: 212.70088196 | E30: 66.77 | F30: 6.7991259126800001 | G30: 187.82533264 | H30: 40.43 | I30: 6.0804832945199996 | J30: =RC[-5]-RC[-2] -> 26.339999999999996 | K30: 24.875549320000001 | L30: 26.811639790000001 | M30: 66.42 | R30: 1.7562344869590101 | S30: 6.6040707270469099 | T30: =(RC[-16]*RC[-15]-RC[-13]*RC[-12])/1000 -> 6.608259689834 | U30: 26.276897429999998 | V30: - | W30: =RC[-2]*RC[-10]/1000 -> 1.7453115273005999 | X30: =ABS((RC[-3]*RC[-11]-RC[-2]*RC[-9])/1000) -> #VALUE! | Y30: =(RC[-14]-RC[1])/RC[-18]*100 -> -0.7460911104499014 | Z30: 26.276897429999998 | AC30: =VALUE(RC[-27]) -> 2018-10-09T00:00:00.000 | AD30: =IF(RC[21]=42,"*",IF(RC[21]=32,"",RC[21])) -> - | AE30: =RC[-28] -> 24 | AF30: =RC[-28] -> 212.70088196 | AG30: =RC[-28] -> 66.77 | AH30: =RC[-28] -> 6.7991259126800001 | AI30: =RC[-28] -> 187.82533264 | AJ30: =RC[-28] -> 40.43 | AK30: =RC[-28] -> 6.0804832945199996 | AL30: =RC[-28] -> 26.339999999999996 | AM30: =RC[-28] -> 24.875549320000001 | AN30: =RC[-28] -> 26.811639790000001 | AO30: =RC[-28] -> 66.42 | AP30: - | AQ30: =RC[-29] -> 0 | AR30: =RC[-29] -> 0 | AS30: - | AT30: =RC[-30] -> 0 | AU30: =RC[-30] -> 0 | AV30: =RC[-30] -> 1.7562344869590101 | AW30: =RC[-30] -> 6.6040707270469099 | AY30: - | AZ30: - | BA30: -
A31: =IF(RC[1]="","",DATEVALUE(RC[1])) -> 43383 | B31: 10.10.18 | C31: 24 | D31: 207.84858704000001 | E31: 67.8 | F31: 6.8253401927599997 | G31: 182.58850097999999 | H31: 40.93 | I31: 6.1487361158400002 | J31: =RC[-5]-RC[-2] -> 26.869999999999997 | K31: 25.260086059999999 | L31: 27.0586071 | M31: 67.44 | R31: 1.80030285898538 | S31: 6.6222148681570596 | T31: =(RC[-16]*RC[-15]-RC[-13]*RC[-12])/1000 -> 6.6187868562006011 | U31: 26.501779559999999 | V31: - | W31: =RC[-2]*RC[-10]/1000 -> 1.7872800135264 | X31: =ABS((RC[-3]*RC[-11]-RC[-2]*RC[-9])/1000) -> #VALUE! | Y31: =(RC[-14]-RC[1])/RC[-18]*100 -> -0.68005021857099879 | Z31: 26.501779559999999 | AC31: =VALUE(RC[-27]) -> 2018-10-10T00:00:00.000 | AD31: =IF(RC[21]=42,"*",IF(RC[21]=32,"",RC[21])) -> - | AE31: =RC[-28] -> 24 | AF31: =RC[-28] -> 207.84858704000001 | AG31: =RC[-28] -> 67.8 | AH31: =RC[-28] -> 6.8253401927599997 | AI31: =RC[-28] -> 182.58850097999999 | AJ31: =RC[-28] -> 40.93 | AK31: =RC[-28] -> 6.1487361158400002 | AL31: =RC[-28] -> 26.869999999999997 | AM31: =RC[-28] -> 25.260086059999999 | AN31: =RC[-28] -> 27.0586071 | AO31: =RC[-28] -> 67.44 | AP31: - | AQ31: =RC[-29] -> 0 | AR31: =RC[-29] -> 0 | AS31: - | AT31: =RC[-30] -> 0 | AU31: =RC[-30] -> 0 | AV31: =RC[-30] -> 1.80030285898538 | AW31: =RC[-30] -> 6.6222148681570596 | AY31: - | AZ31: - | BA31: -
A32: =IF(RC[1]="","",DATEVALUE(RC[1])) -> 43384 | B32: 11.10.18 | C32: 24 | D32: 211.07998656999999 | E32: 68.94 | F32: 6.7086072490799999 | G32: 184.98428344999999 | H32: 41.72 | I32: 6.0100214092400002 | J32: =RC[-5]-RC[-2] -> 27.22 | K32: 26.09570312 | L32: 27.585752490000001 | M32: 68.63 | R32: 1.8607252388458999 | S32: 6.8337625537403301 | T32: =(RC[-16]*RC[-15]-RC[-13]*RC[-12])/1000 -> 6.834309968601799 | U32: 27.001920699999999 | V32: - | W32: =RC[-2]*RC[-10]/1000 -> 1.8531418176409997 | X32: =ABS((RC[-3]*RC[-11]-RC[-2]*RC[-9])/1000) -> #VALUE! | Y32: =(RC[-14]-RC[1])/RC[-18]*100 -> -0.489888958726023 | Z32: 27.001920699999999 | AC32: =VALUE(RC[-27]) -> 2018-10-11T00:00:00.000 | AD32: =IF(RC[21]=42,"*",IF(RC[21]=32,"",RC[21])) -> - | AE32: =RC[-28] -> 24 | AF32: =RC[-28] -> 211.07998656999999 | AG32: =RC[-28] -> 68.94 | AH32: =RC[-28] -> 6.7086072490799999 | AI32: =RC[-28] -> 184.98428344999999 | AJ32: =RC[-28] -> 41.72 | AK32: =RC[-28] -> 6.0100214092400002 | AL32: =RC[-28] -> 27.22 | AM32: =RC[-28] -> 26.09570312 | AN32: =RC[-28] -> 27.585752490000001 | AO32: =RC[-28] -> 68.63 | AP32: - | AQ32: =RC[-29] -> 0 | AR32: =RC[-29] -> 0 | AS32: - | AT32: =RC[-30] -> 0 | AU32: =RC[-30] -> 0 | AV32: =RC[-30] -> 1.8607252388458999 | AW32: =RC[-30] -> 6.8337625537403301 | AY32: - | AZ32: - | BA32: -
A33: =IF(RC[1]="","",DATEVALUE(RC[1])) -> 43385 | B33: 12.10.18 | C33: 24 | D33: 211.24014281999999 | E33: 68.83 | F33: 6.72453671348 | G33: 186.58563232 | H33: 41.57 | I33: 6.0129359777599998 | J33: =RC[-5]-RC[-2] -> 27.259999999999998 | K33: 24.654510500000001 | L33: 26.218873980000001 | M33: 68.459999999999994 | R33: 1.7636987627782601 | S33: 6.7815031694850498 | T33: =(RC[-16]*RC[-15]-RC[-13]*RC[-12])/1000 -> 6.7832942947581998 | U33: 25.667476650000001 | V33: - | W33: =RC[-2]*RC[-10]/1000 -> 1.757195451459 | X33: =ABS((RC[-3]*RC[-11]-RC[-2]*RC[-9])/1000) -> #VALUE! | Y33: =(RC[-14]-RC[1])/RC[-18]*100 -> -0.54289611552873107 | Z33: 25.667476650000001 | AC33: =VALUE(RC[-27]) -> 2018-10-12T00:00:00.000 | AD33: =IF(RC[21]=42,"*",IF(RC[21]=32,"",RC[21])) -> - | AE33: =RC[-28] -> 24 | AF33: =RC[-28] -> 211.24014281999999 | AG33: =RC[-28] -> 68.83 | AH33: =RC[-28] -> 6.72453671348 | AI33: =RC[-28] -> 186.58563232 | AJ33: =RC[-28] -> 41.57 | AK33: =RC[-28] -> 6.0129359777599998 | AL33: =RC[-28] -> 27.259999999999998 | AM33: =RC[-28] -> 24.654510500000001 | AN33: =RC[-28] -> 26.218873980000001 | AO33: =RC[-28] -> 68.459999999999994 | AP33: - | AQ33: =RC[-29] -> 0 | AR33: =RC[-29] -> 0 | AS33: - | AT33: =RC[-30] -> 0 | AU33: =RC[-30] -> 0 | AV33: =RC[-30] -> 1.7636987627782601 | AW33: =RC[-30] -> 6.7815031694850498 | AY33: - | AZ33: - | BA33: -
A34: =IF(RC[1]="","",DATEVALUE(RC[1])) -> 43386 | B34: 13.10.18 | C34: 24 | D34: 210.94575499999999 | E34: 69.87 | F34: 6.7154581126400004 | G34: 186.51219176999999 | H34: 42.37 | I34: 6.0044041072400001 | J34: =RC[-5]-RC[-2] -> 27.500000000000007 | K34: 24.433563230000001 | L34: 25.99663353 | M34: 69.459999999999994 | R34: 1.77770491544855 | S34: 6.8373081971911702 | T34: =(RC[-16]*RC[-15]-RC[-13]*RC[-12])/1000 -> 6.836258336555102 | U34: 25.434188840000001 | V34: - | W34: =RC[-2]*RC[-10]/1000 -> 1.7666587568263998 | X34: =ABS((RC[-3]*RC[-11]-RC[-2]*RC[-9])/1000) -> #VALUE! | Y34: =(RC[-14]-RC[1])/RC[-18]*100 -> -0.53649340587554462 | Z34: 25.434188840000001 | AC34: =VALUE(RC[-27]) -> 2018-10-13T00:00:00.000 | AD34: =IF(RC[21]=42,"*",IF(RC[21]=32,"",RC[21])) -> - | AE34: =RC[-28] -> 24 | AF34: =RC[-28] -> 210.94575499999999 | AG34: =RC[-28] -> 69.87 | AH34: =RC[-28] -> 6.7154581126400004 | AI34: =RC[-28] -> 186.51219176999999 | AJ34: =RC[-28] -> 42.37 | AK34: =RC[-28] -> 6.0044041072400001 | AL34: =RC[-28] -> 27.500000000000007 | AM34: =RC[-28] -> 24.433563230000001 | AN34: =RC[-28] -> 25.99663353 | AO34: =RC[-28] -> 69.459999999999994 | AP34: - | AQ34: =RC[-29] -> 0 | AR34: =RC[-29] -> 0 | AS34: - | AT34: =RC[-30] -> 0 | AU34: =RC[-30] -> 0 | AV34: =RC[-30] -> 1.77770491544855 | AW34: =RC[-30] -> 6.8373081971911702 | AY34: - | AZ34: - | BA34: -
A35: =IF(RC[1]="","",DATEVALUE(RC[1])) -> 43387 | B35: 14.10.18 | C35: 24 | D35: 214.77580261 | E35: 70.66 | F35: 6.7056458442000002 | G35: 187.43348693999999 | H35: 43.28 | I35: 5.9863305783599996 | J35: =RC[-5]-RC[-2] -> 27.379999999999995 | K35: 27.342315670000001 | L35: 29.037427900000001 | M35: 70.3 | R35: 2.0103237293398299 | S35: 7.0648547793063896 | T35: =(RC[-16]*RC[-15]-RC[-13]*RC[-12])/1000 -> 7.0639368976593984 | U35: 28.392839429999999 | V35: - | W35: =RC[-2]*RC[-10]/1000 -> 1.9960166119289997 | X35: =ABS((RC[-3]*RC[-11]-RC[-2]*RC[-9])/1000) -> #VALUE! | Y35: =(RC[-14]-RC[1])/RC[-18]*100 -> -0.56047816062680633 | Z35: 28.392839429999999 | AC35: =VALUE(RC[-27]) -> 2018-10-14T00:00:00.000 | AD35: =IF(RC[21]=42,"*",IF(RC[21]=32,"",RC[21])) -> - | AE35: =RC[-28] -> 24 | AF35: =RC[-28] -> 214.77580261 | AG35: =RC[-28] -> 70.66 | AH35: =RC[-28] -> 6.7056458442000002 | AI35: =RC[-28] -> 187.43348693999999 | AJ35: =RC[-28] -> 43.28 | AK35: =RC[-28] -> 5.9863305783599996 | AL35: =RC[-28] -> 27.379999999999995 | AM35: =RC[-28] -> 27.342315670000001 | AN35: =RC[-28] -> 29.037427900000001 | AO35: =RC[-28] -> 70.3 | AP35: - | AQ35: =RC[-29] -> 0 | AR35: =RC[-29] -> 0 | AS35: - | AT35: =RC[-30] -> 0 | AU35: =RC[-30] -> 0 | AV35: =RC[-30] -> 2.0103237293398299 | AW35: =RC[-30] -> 7.0648547793063896 | AY35: - | AZ35: - | BA35: -
A36: =IF(RC[1]="","",DATEVALUE(RC[1])) -> 43388 | B36: 15.10.18 | C36: 24 | D36: 213.7975769 | E36: 70.16 | F36: 6.7260396606399997 | G36: 189.95288085999999 | H36: 43.43 | I36: 5.9876005682000004 | J36: =RC[-5]-RC[-2] -> 26.729999999999997 | K36: 23.844696039999999 | L36: 25.607378010000001 | M36: 69.83 | R36: 1.7576856811885 | S36: 6.7499126516671399 | T36: =(RC[-16]*RC[-15]-RC[-13]*RC[-12])/1000 -> 6.7503843795542 | U36: 25.048744200000002 | V36: - | W36: =RC[-2]*RC[-10]/1000 -> 1.749153807486 | X36: =ABS((RC[-3]*RC[-11]-RC[-2]*RC[-9])/1000) -> #VALUE! | Y36: =(RC[-14]-RC[1])/RC[-18]*100 -> -0.6338667539806444 | Z36: 25.048744200000002 | AC36: =VALUE(RC[-27]) -> 2018-10-15T00:00:00.000 | AD36: =IF(RC[21]=42,"*",IF(RC[21]=32,"",RC[21])) -> - | AE36: =RC[-28] -> 24 | AF36: =RC[-28] -> 213.7975769 | AG36: =RC[-28] -> 70.16 | AH36: =RC[-28] -> 6.7260396606399997 | AI36: =RC[-28] -> 189.95288085999999 | AJ36: =RC[-28] -> 43.43 | AK36: =RC[-28] -> 5.9876005682000004 | AL36: =RC[-28] -> 26.729999999999997 | AM36: =RC[-28] -> 23.844696039999999 | AN36: =RC[-28] -> 25.607378010000001 | AO36: =RC[-28] -> 69.83 | AP36: - | AQ36: =RC[-29] -> 0 | AR36: =RC[-29] -> 0 | AS36: - | AT36: =RC[-30] -> 0 | AU36: =RC[-30] -> 0 | AV36: =RC[-30] -> 1.7576856811885 | AW36: =RC[-30] -> 6.7499126516671399 | AY36: - | AZ36: - | BA36: -
A37: =IF(RC[1]="","",DATEVALUE(RC[1])) -> 43389 | B37: 16.10.18 | C37: 24 | D37: 214.03250122 | E37: 70.209999999999994 | F37: 6.7254429307199999 | G37: 188.1665802 | H37: 43.35 | I37: 5.9873129174399997 | J37: =RC[-5]-RC[-2] -> 26.859999999999992 | K37: 25.865921019999998 | L37: 25.74402809 | M37: 69.83 | R37: 1.7666834933600799 | S37: 6.8684941745485801 | T37: =(RC[-16]*RC[-15]-RC[-13]*RC[-12])/1000 -> 6.8702006589861986 | U37: 25.181695940000001 | V37: - | W37: =RC[-2]*RC[-10]/1000 -> 1.7584378274902002 | X37: =ABS((RC[-3]*RC[-11]-RC[-2]*RC[-9])/1000) -> #VALUE! | Y37: =(RC[-14]-RC[1])/RC[-18]*100 -> 0.36362731324167274 | Z37: 25.181695940000001 | AC37: =VALUE(RC[-27]) -> 2018-10-16T00:00:00.000 | AD37: =IF(RC[21]=42,"*",IF(RC[21]=32,"",RC[21])) -> - | AE37: =RC[-28] -> 24 | AF37: =RC[-28] -> 214.03250122 | AG37: =RC[-28] -> 70.209999999999994 | AH37: =RC[-28] -> 6.7254429307199999 | AI37: =RC[-28] -> 188.1665802 | AJ37: =RC[-28] -> 43.35 | AK37: =RC[-28] -> 5.9873129174399997 | AL37: =RC[-28] -> 26.859999999999992 | AM37: =RC[-28] -> 25.865921019999998 | AN37: =RC[-28] -> 25.74402809 | AO37: =RC[-28] -> 69.83 | AP37: - | AQ37: =RC[-29] -> 0 | AR37: =RC[-29] -> 0 | AS37: - | AT37: =RC[-30] -> 0 | AU37: =RC[-30] -> 0 | AV37: =RC[-30] -> 1.7666834933600799 | AW37: =RC[-30] -> 6.8684941745485801 | AY37: - | AZ37: - | BA37: -
A38: =IF(RC[1]="","",DATEVALUE(RC[1])) -> 43390 | B38: 17.10.18 | C38: 24 | D38: 220.23194885000001 | E38: 70.34 | F38: 6.7412034168800004 | G38: 194.52168273999999 | H38: 43.75 | I38: 5.96039792868 | J38: =RC[-5]-RC[-2] -> 26.590000000000003 | K38: 25.710266109999999 | L38: 27.410699839999999 | M38: 70.010000000000005 | R38: 1.88602945208751 | S38: 6.9796113093532099 | T38: =(RC[-16]*RC[-15]-RC[-13]*RC[-12])/1000 -> 6.9807916622340018 | U38: 26.8102169 | V38: - | W38: =RC[-2]*RC[-10]/1000 -> 1.876983285169 | X38: =ABS((RC[-3]*RC[-11]-RC[-2]*RC[-9])/1000) -> #VALUE! | Y38: =(RC[-14]-RC[1])/RC[-18]*100 -> -0.56546436083951046 | Z38: 26.8102169 | AC38: =VALUE(RC[-27]) -> 2018-10-17T00:00:00.000 | AD38: =IF(RC[21]=42,"*",IF(RC[21]=32,"",RC[21])) -> - | AE38: =RC[-28] -> 24 | AF38: =RC[-28] -> 220.23194885000001 | AG38: =RC[-28] -> 70.34 | AH38: =RC[-28] -> 6.7412034168800004 | AI38: =RC[-28] -> 194.52168273999999 | AJ38: =RC[-28] -> 43.75 | AK38: =RC[-28] -> 5.96039792868 | AL38: =RC[-28] -> 26.590000000000003 | AM38: =RC[-28] -> 25.710266109999999 | AN38: =RC[-28] -> 27.410699839999999 | AO38: =RC[-28] -> 70.010000000000005 | AP38: - | AQ38: =RC[-29] -> 0 | AR38: =RC[-29] -> 0 | AS38: - | AT38: =RC[-30] -> 0 | AU38: =RC[-30] -> 0 | AV38: =RC[-30] -> 1.88602945208751 | AW38: =RC[-30] -> 6.9796113093532099 | AY38: - | AZ38: - | BA38: -
A39: =IF(RC[1]="","",DATEVALUE(RC[1])) -> 43391 | B39: 18.10.18 | C39: 24 | D39: 229.50445557 | E39: 70.81 | F39: 6.7861510164799999 | G39: 204.57626343000001 | H39: 44.69 | I39: 5.9185247942799997 | J39: =RC[-5]-RC[-2] -> 26.120000000000005 | K39: 24.92819214 | L39: 27.07896233 | M39: 70.459999999999994 | R39: 1.8752667908665299 | S39: 7.1100342672207901 | T39: =(RC[-16]*RC[-15]-RC[-13]*RC[-12])/1000 -> 7.1086972862250022 | U39: 26.477733610000001 | V39: - | W39: =RC[-2]*RC[-10]/1000 -> 1.8656211101605999 | X39: =ABS((RC[-3]*RC[-11]-RC[-2]*RC[-9])/1000) -> #VALUE! | Y39: =(RC[-14]-RC[1])/RC[-18]*100 -> -0.7574395210958621 | Z39: 26.477733610000001 | AC39: =VALUE(RC[-27]) -> 2018-10-18T00:00:00.000 | AD39: =IF(RC[21]=42,"*",IF(RC[21]=32,"",RC[21])) -> - | AE39: =RC[-28] -> 24 | AF39: =RC[-28] -> 229.50445557 | AG39: =RC[-28] -> 70.81 | AH39: =RC[-28] -> 6.7861510164799999 | AI39: =RC[-28] -> 204.57626343000001 | AJ39: =RC[-28] -> 44.69 | AK39: =RC[-28] -> 5.9185247942799997 | AL39: =RC[-28] -> 26.120000000000005 | AM39: =RC[-28] -> 24.92819214 | AN39: =RC[-28] -> 27.07896233 | AO39: =RC[-28] -> 70.459999999999994 | AP39: - | AQ39: =RC[-29] -> 0 | AR39: =RC[-29] -> 0 | AS39: - | AT39: =RC[-30] -> 0 | AU39: =RC[-30] -> 0 | AV39: =RC[-30] -> 1.8752667908665299 | AW39: =RC[-30] -> 7.1100342672207901 | AY39: - | AZ39: - | BA39: -
A40: =IF(RC[1]="","",DATEVALUE(RC[1])) -> 43392 | B40: 19.10.18 | C40: 24 | D40: 228.51556396000001 | E40: 70.64 | F40: 6.81835371804 | G40: 206.12983704000001 | H40: 44.46 | I40: 5.9365776090400004 | J40: =RC[-5]-RC[-2] -> 26.18 | K40: 22.38572692 | L40: 24.48400307 | M40: 70.260000000000005 | R40: 1.6879746106811899 | S40: 6.9765471983376299 | T40: =(RC[-16]*RC[-15]-RC[-13]*RC[-12])/1000 -> 6.9778068833359992 | U40: 23.944490429999998 | V40: - | W40: =RC[-2]*RC[-10]/1000 -> 1.6823398976118 | X40: =ABS((RC[-3]*RC[-11]-RC[-2]*RC[-9])/1000) -> #VALUE! | Y40: =(RC[-14]-RC[1])/RC[-18]*100 -> -0.75620469718681083 | Z40: 23.944490429999998 | AC40: =VALUE(RC[-27]) -> 2018-10-19T00:00:00.000 | AD40: =IF(RC[21]=42,"*",IF(RC[21]=32,"",RC[21])) -> - | AE40: =RC[-28] -> 24 | AF40: =RC[-28] -> 228.51556396000001 | AG40: =RC[-28] -> 70.64 | AH40: =RC[-28] -> 6.81835371804 | AI40: =RC[-28] -> 206.12983704000001 | AJ40: =RC[-28] -> 44.46 | AK40: =RC[-28] -> 5.9365776090400004 | AL40: =RC[-28] -> 26.18 | AM40: =RC[-28] -> 22.38572692 | AN40: =RC[-28] -> 24.48400307 | AO40: =RC[-28] -> 70.260000000000005 | AP40: - | AQ40: =RC[-29] -> 0 | AR40: =RC[-29] -> 0 | AS40: - | AT40: =RC[-30] -> 0 | AU40: =RC[-30] -> 0 | AV40: =RC[-30] -> 1.6879746106811899 | AW40: =RC[-30] -> 6.9765471983376299 | AY40: - | AZ40: - | BA40: -
A41: =IF(RC[1]="","",DATEVALUE(RC[1])) -> 43393 | B41: 20.10.18 | C41: 24 | D41: 229.60464478 | E41: 69.989999999999995 | F41: 6.7975950065599999 | G41: 204.76396179 | H41: 43.64 | I41: 5.9277640060800003 | J41: =RC[-5]-RC[-2] -> 26.349999999999994 | K41: 24.840682990000001 | L41: 27.099969860000002 | M41: 69.59 | R41: 1.85945649660839 | S41: 7.1358195543135601 | T41: =(RC[-16]*RC[-15]-RC[-13]*RC[-12])/1000 -> 7.1341297956365999 | U41: 26.507888789999999 | V41: - | W41: =RC[-2]*RC[-10]/1000 -> 1.8446839808961002 | X41: =ABS((RC[-3]*RC[-11]-RC[-2]*RC[-9])/1000) -> #VALUE! | Y41: =(RC[-14]-RC[1])/RC[-18]*100 -> -0.81420860654661287 | Z41: 26.507888789999999 | AC41: =VALUE(RC[-27]) -> 2018-10-20T00:00:00.000 | AD41: =IF(RC[21]=42,"*",IF(RC[21]=32,"",RC[21])) -> - | AE41: =RC[-28] -> 24 | AF41: =RC[-28] -> 229.60464478 | AG41: =RC[-28] -> 69.989999999999995 | AH41: =RC[-28] -> 6.7975950065599999 | AI41: =RC[-28] -> 204.76396179 | AJ41: =RC[-28] -> 43.64 | AK41: =RC[-28] -> 5.9277640060800003 | AL41: =RC[-28] -> 26.349999999999994 | AM41: =RC[-28] -> 24.840682990000001 | AN41: =RC[-28] -> 27.099969860000002 | AO41: =RC[-28] -> 69.59 | AP41: - | AQ41: =RC[-29] -> 0 | AR41: =RC[-29] -> 0 | AS41: - | AT41: =RC[-30] -> 0 | AU41: =RC[-30] -> 0 | AV41: =RC[-30] -> 1.85945649660839 | AW41: =RC[-30] -> 7.1358195543135601 | AY41: - | AZ41: - | BA41: -
A42: =IF(RC[1]="","",DATEVALUE(RC[1])) -> 43394 | B42: 21.10.18 | C42: 24 | D42: 232.50492858999999 | E42: 69.099999999999994 | F42: 6.7824610459999999 | G42: 203.09294127999999 | H42: 43.14 | I42: 5.9202673313599998 | J42: =RC[-5]-RC[-2] -> 25.959999999999994 | K42: 29.411987310000001 | L42: 30.861257550000001 | M42: 68.739999999999995 | R42: 2.0882718209611202 | S42: 7.3013536185153303 | T42: =(RC[-16]*RC[-15]-RC[-13]*RC[-12])/1000 -> 7.304661078749799 | U42: 30.206165309999999 | V42: - | W42: =RC[-2]*RC[-10]/1000 -> 2.0763718034093999 | X42: =ABS((RC[-3]*RC[-11]-RC[-2]*RC[-9])/1000) -> #VALUE! | Y42: =(RC[-14]-RC[1])/RC[-18]*100 -> -0.39104165560588444 | Z42: 30.206165309999999 | AC42: =VALUE(RC[-27]) -> 2018-10-21T00:00:00.000 | AD42: =IF(RC[21]=42,"*",IF(RC[21]=32,"",RC[21])) -> - | AE42: =RC[-28] -> 24 | AF42: =RC[-28] -> 232.50492858999999 | AG42: =RC[-28] -> 69.099999999999994 | AH42: =RC[-28] -> 6.7824610459999999 | AI42: =RC[-28] -> 203.09294127999999 | AJ42: =RC[-28] -> 43.14 | AK42: =RC[-28] -> 5.9202673313599998 | AL42: =RC[-28] -> 25.959999999999994 | AM42: =RC[-28] -> 29.411987310000001 | AN42: =RC[-28] -> 30.861257550000001 | AO42: =RC[-28] -> 68.739999999999995 | AP42: - | AQ42: =RC[-29] -> 0 | AR42: =RC[-29] -> 0 | AS42: - | AT42: =RC[-30] -> 0 | AU42: =RC[-30] -> 0 | AV42: =RC[-30] -> 2.0882718209611202 | AW42: =RC[-30] -> 7.3013536185153303 | AY42: - | AZ42: - | BA42: -
A43: =IF(RC[1]="","",DATEVALUE(RC[1])) -> 43395 | B43: 22.10.18 | C43: 24 | D43: 230.46923828000001 | E43: 69.5 | F43: 6.8203175798800002 | G43: 206.37704468000001 | H43: 43.37 | I43: 5.9355399642800002 | J43: =RC[-5]-RC[-2] -> 26.130000000000003 | K43: 24.092193600000002 | L43: 26.150735860000001 | M43: 69.16 | R43: 1.78124679707653 | S43: 7.0705866652335896 | T43: =(RC[-16]*RC[-15]-RC[-13]*RC[-12])/1000 -> 7.0670396326883997 | U43: 25.588102339999999 | V43: - | W43: =RC[-2]*RC[-10]/1000 -> 1.7696731578344 | X43: =ABS((RC[-3]*RC[-11]-RC[-2]*RC[-9])/1000) -> #VALUE! | Y43: =(RC[-14]-RC[1])/RC[-18]*100 -> -0.72484260171449477 | Z43: 25.588102339999999 | AC43: =VALUE(RC[-27]) -> 2018-10-22T00:00:00.000 | AD43: =IF(RC[21]=42,"*",IF(RC[21]=32,"",RC[21])) -> - | AE43: =RC[-28] -> 24 | AF43: =RC[-28] -> 230.46923828000001 | AG43: =RC[-28] -> 69.5 | AH43: =RC[-28] -> 6.8203175798800002 | AI43: =RC[-28] -> 206.37704468000001 | AJ43: =RC[-28] -> 43.37 | AK43: =RC[-28] -> 5.9355399642800002 | AL43: =RC[-28] -> 26.130000000000003 | AM43: =RC[-28] -> 24.092193600000002 | AN43: =RC[-28] -> 26.150735860000001 | AO43: =RC[-28] -> 69.16 | AP43: - | AQ43: =RC[-29] -> 0 | AR43: =RC[-29] -> 0 | AS43: - | AT43: =RC[-30] -> 0 | AU43: =RC[-30] -> 0 | AV43: =RC[-30] -> 1.78124679707653 | AW43: =RC[-30] -> 7.0705866652335896 | AY43: - | AZ43: - | BA43: -
A44: =IF(RC[1]="","",DATEVALUE(RC[1])) ->  | C44: 24 | J44: =RC[-5]-RC[-2] -> #VALUE! | T44: =(RC[-16]*RC[-15]-RC[-13]*RC[-12])/1000 -> #VALUE! | W44: =RC[-2]*RC[-10]/1000 -> #VALUE! | X44: =ABS((RC[-3]*RC[-11]-RC[-2]*RC[-9])/1000) -> #VALUE! | Y44: =(RC[-14]-RC[1])/RC[-18]*100 -> #VALUE! | AC44: =VALUE(RC[-27]) -> #VALUE! | AD44: =IF(RC[21]=42,"*",IF(RC[21]=32,"",RC[21])) ->  | AE44: =RC[-28] -> 24 | AF44: =RC[-28] ->  | AG44: =RC[-28] ->  | AH44: =RC[-28] ->  | AI44: =RC[-28] ->  | AJ44: =RC[-28] ->  | AK44: =RC[-28] ->  | AL44: =RC[-28] -> #VALUE! | AM44: =RC[-28] ->  | AN44: =RC[-28] ->  | AO44: =RC[-28] ->  | AP44: - | AQ44: =RC[-29] -> 0 | AR44: =RC[-29] -> 0 | AS44: - | AT44: =RC[-30] -> 0 | AU44: =RC[-30] -> 0 | AV44: =RC[-30] ->  | AW44: =RC[-30] -> 
A45: =IF(RC[1]="","",DATEVALUE(RC[1])) ->  | C45: 24 | T45: =(RC[-16]*RC[-15]-RC[-13]*RC[-12])/1000 -> #VALUE! | W45: =RC[-2]*RC[-10]/1000 -> #VALUE! | X45: =ABS((RC[-3]*RC[-11]-RC[-2]*RC[-9])/1000) -> #VALUE! | Y45: =(RC[-14]-RC[1])/RC[-18]*100 -> #VALUE! | AC45: =VALUE(RC[-27]) -> #VALUE! | AD45: =IF(RC[21]=42,"*",IF(RC[21]=32,"",RC[21])) ->  | AE45: =RC[-28] -> 24 | AF45: =RC[-28] ->  | AG45: =RC[-28] ->  | AH45: =RC[-28] ->  | AI45: =RC[-28] ->  | AJ45: =RC[-28] ->  | AK45: =RC[-28] ->  | AL45: =RC[-28] -> 0 | AM45: =RC[-28] ->  | AN45: =RC[-28] ->  | AO45: =RC[-28] ->  | AP45: - | AQ45: =RC[-29] -> 0 | AR45: =RC[-29] -> 0 | AS45: - | AT45: =RC[-30] -> 0 | AU45: =RC[-30] -> 0 | AV45: =RC[-30] ->  | AW45: =RC[-30] -> 
A46: =IF(RC[1]="","",DATEVALUE(RC[1])) ->  | C46: 24 | T46: =(RC[-16]*RC[-15]-RC[-13]*RC[-12])/1000 -> #VALUE! | W46: =RC[-2]*RC[-10]/1000 -> #VALUE! | X46: =ABS((RC[-3]*RC[-11]-RC[-2]*RC[-9])/1000) -> #VALUE! | Y46: =(RC[-14]-RC[1])/RC[-18]*100 -> #VALUE! | AC46: =VALUE(RC[-27]) -> #VALUE! | AD46: =IF(RC[21]=42,"*",IF(RC[21]=32,"",RC[21])) ->  | AE46: =RC[-28] -> 24 | AF46: =RC[-28] ->  | AG46: =RC[-28] ->  | AH46: =RC[-28] ->  | AI46: =RC[-28] ->  | AJ46: =RC[-28] ->  | AK46: =RC[-28] ->  | AL46: =RC[-28] -> 0 | AM46: =RC[-28] ->  | AN46: =RC[-28] ->  | AO46: =RC[-28] ->  | AP46: - | AQ46: =RC[-29] -> 0 | AR46: =RC[-29] -> 0 | AS46: - | AT46: =RC[-30] -> 0 | AU46: =RC[-30] -> 0 | AV46: =RC[-30] ->  | AW46: =RC[-30] -> 
A47: =IF(RC[1]="","",DATEVALUE(RC[1])) ->  | C47: 24 | T47: =(RC[-16]*RC[-15]-RC[-13]*RC[-12])/1000 -> #VALUE! | W47: =RC[-2]*RC[-10]/1000 -> #VALUE! | X47: =ABS((RC[-3]*RC[-11]-RC[-2]*RC[-9])/1000) -> #VALUE! | Y47: =(RC[-14]-RC[1])/RC[-18]*100 -> #VALUE! | AC47: =VALUE(RC[-27]) -> #VALUE! | AD47: =IF(RC[21]=42,"*",IF(RC[21]=32,"",RC[21])) ->  | AE47: =RC[-28] -> 24 | AF47: =RC[-28] ->  | AG47: =RC[-28] ->  | AH47: =RC[-28] ->  | AI47: =RC[-28] ->  | AJ47: =RC[-28] ->  | AK47: =RC[-28] ->  | AL47: =RC[-28] -> 0 | AM47: =RC[-28] ->  | AN47: =RC[-28] ->  | AO47: =RC[-28] ->  | AP47: - | AQ47: =RC[-29] -> 0 | AR47: =RC[-29] -> 0 | AS47: - | AT47: =RC[-30] -> 0 | AU47: =RC[-30] -> 0 | AV47: =RC[-30] ->  | AW47: =RC[-30] -> 
A48: =IF(RC[1]="","",DATEVALUE(RC[1])) ->  | C48: 24 | T48: =(RC[-16]*RC[-15]-RC[-13]*RC[-12])/1000 -> #VALUE! | W48: =RC[-2]*RC[-10]/1000 -> #VALUE! | X48: =ABS((RC[-3]*RC[-11]-RC[-2]*RC[-9])/1000) -> #VALUE! | Y48: =(RC[-14]-RC[1])/RC[-18]*100 -> #VALUE! | AC48: =VALUE(RC[-27]) -> #VALUE! | AD48: =IF(RC[21]=42,"*",IF(RC[21]=32,"",RC[21])) ->  | AE48: =RC[-28] -> 24 | AF48: =RC[-28] ->  | AG48: =RC[-28] ->  | AH48: =RC[-28] ->  | AI48: =RC[-28] ->  | AJ48: =RC[-28] ->  | AK48: =RC[-28] ->  | AL48: =RC[-28] -> 0 | AM48: =RC[-28] ->  | AN48: =RC[-28] ->  | AO48: =RC[-28] ->  | AP48: - | AQ48: =RC[-29] -> 0 | AR48: =RC[-29] -> 0 | AS48: - | AT48: =RC[-30] -> 0 | AU48: =RC[-30] -> 0 | AV48: =RC[-30] ->  | AW48: =RC[-30] -> 
A49: =IF(RC[1]="","",DATEVALUE(RC[1])) ->  | C49: 24 | T49: =(RC[-16]*RC[-15]-RC[-13]*RC[-12])/1000 -> #VALUE! | W49: =RC[-2]*RC[-10]/1000 -> #VALUE! | X49: =ABS((RC[-3]*RC[-11]-RC[-2]*RC[-9])/1000) -> #VALUE! | Y49: =(RC[-14]-RC[1])/RC[-18]*100 -> #VALUE! | AC49: =VALUE(RC[-27]) -> #VALUE! | AD49: =IF(RC[21]=42,"*",IF(RC[21]=32,"",RC[21])) ->  | AE49: =RC[-28] -> 24 | AF49: =RC[-28] ->  | AG49: =RC[-28] ->  | AH49: =RC[-28] ->  | AI49: =RC[-28] ->  | AJ49: =RC[-28] ->  | AK49: =RC[-28] ->  | AL49: =RC[-28] -> 0 | AM49: =RC[-28] ->  | AN49: =RC[-28] ->  | AO49: =RC[-28] ->  | AP49: - | AQ49: =RC[-29] -> 0 | AR49: =RC[-29] -> 0 | AS49: - | AT49: =RC[-30] -> 0 | AU49: =RC[-30] -> 0 | AV49: =RC[-30] ->  | AW49: =RC[-30] -> 
A50: =IF(RC[1]="","",DATEVALUE(RC[1])) ->  | T50: =(RC[-16]*RC[-15]-RC[-13]*RC[-12])/1000 -> #VALUE! | W50: =RC[-2]*RC[-10]/1000 -> #VALUE! | X50: =ABS((RC[-3]*RC[-11]-RC[-2]*RC[-9])/1000) -> #VALUE! | Y50: =(RC[-14]-RC[1])/RC[-18]*100 -> #VALUE! | AC50: =VALUE(RC[-27]) -> #VALUE! | AD50: =IF(RC[21]=42,"*",IF(RC[21]=32,"",RC[21])) ->  | AE50: =RC[-28] ->  | AF50: =RC[-28] ->  | AG50: =RC[-28] ->  | AH50: =RC[-28] ->  | AI50: =RC[-28] ->  | AJ50: =RC[-28] ->  | AK50: =RC[-28] ->  | AL50: =RC[-28] -> 0 | AM50: =RC[-28] ->  | AN50: =RC[-28] ->  | AO50: =RC[-28] ->  | AP50: - | AQ50: =RC[-29] -> 0 | AR50: =RC[-29] -> 0 | AS50: - | AT50: =RC[-30] -> 0 | AU50: =RC[-30] -> 0 | AV50: =RC[-30] ->  | AW50: =RC[-30] -> 
A51: =IF(RC[1]="","",DATEVALUE(RC[1])) ->  | T51: =(RC[-16]*RC[-15]-RC[-13]*RC[-12])/1000 -> #VALUE! | W51: =RC[-2]*RC[-10]/1000 -> #VALUE! | X51: =ABS((RC[-3]*RC[-11]-RC[-2]*RC[-9])/1000) -> #VALUE! | Y51: =(RC[-14]-RC[1])/RC[-18]*100 -> #VALUE! | AC51: =VALUE(RC[-27]) -> #VALUE! | AD51: =IF(RC[21]=42,"*",IF(RC[21]=32,"",RC[21])) ->  | AE51: =RC[-28] ->  | AF51: =RC[-28] ->  | AG51: =RC[-28] ->  | AH51: =RC[-28] ->  | AI51: =RC[-28] ->  | AJ51: =RC[-28] ->  | AK51: =RC[-28] ->  | AL51: =RC[-28] -> 0 | AM51: =RC[-28] ->  | AN51: =RC[-28] ->  | AO51: =RC[-28] ->  | AP51: - | AQ51: =RC[-29] -> 0 | AR51: =RC[-29] -> 0 | AS51: - | AT51: =RC[-30] -> 0 | AU51: =RC[-30] -> 0 | AV51: =RC[-30] ->  | AW51: =RC[-30] -> 
A52: =IF(RC[1]="","",DATEVALUE(RC[1])) ->  | T52: =(RC[-16]*RC[-15]-RC[-13]*RC[-12])/1000 -> #VALUE! | W52: =RC[-2]*RC[-10]/1000 -> #VALUE! | X52: =ABS((RC[-3]*RC[-11]-RC[-2]*RC[-9])/1000) -> #VALUE! | Y52: =(RC[-14]-RC[1])/RC[-18]*100 -> #VALUE! | AC52: =VALUE(RC[-27]) -> #VALUE! | AD52: =IF(RC[21]=42,"*",IF(RC[21]=32,"",RC[21])) ->  | AE52: =RC[-28] ->  | AF52: =RC[-28] ->  | AG52: =RC[-28] ->  | AH52: =RC[-28] ->  | AI52: =RC[-28] ->  | AJ52: =RC[-28] ->  | AK52: =RC[-28] ->  | AL52: =RC[-28] -> 0 | AM52: =RC[-28] ->  | AN52: =RC[-28] ->  | AO52: =RC[-28] ->  | AP52: - | AQ52: =RC[-29] -> 0 | AR52: =RC[-29] -> 0 | AS52: - | AT52: =RC[-30] -> 0 | AU52: =RC[-30] -> 0 | AV52: =RC[-30] ->  | AW52: =RC[-30] -> 
A53: =IF(RC[1]="","",DATEVALUE(RC[1])) ->  | T53: =(RC[-16]*RC[-15]-RC[-13]*RC[-12])/1000 -> #VALUE! | W53: =RC[-2]*RC[-10]/1000 -> #VALUE! | X53: =ABS((RC[-3]*RC[-11]-RC[-2]*RC[-9])/1000) -> #VALUE! | Y53: =(RC[-14]-RC[1])/RC[-18]*100 -> #VALUE! | AC53: =VALUE(RC[-27]) -> #VALUE! | AD53: =IF(RC[21]=42,"*",IF(RC[21]=32,"",RC[21])) ->  | AE53: =RC[-28] ->  | AF53: =RC[-28] ->  | AG53: =RC[-28] ->  | AH53: =RC[-28] ->  | AI53: =RC[-28] ->  | AJ53: =RC[-28] ->  | AK53: =RC[-28] ->  | AL53: =RC[-28] -> 0 | AM53: =RC[-28] ->  | AN53: =RC[-28] ->  | AO53: =RC[-28] ->  | AP53: - | AQ53: =RC[-29] -> 0 | AR53: =RC[-29] -> 0 | AS53: - | AT53: =RC[-30] -> 0 | AU53: =RC[-30] -> 0 | AV53: =RC[-30] ->  | AW53: =RC[-30] -> 
A54: =IF(RC[1]="","",DATEVALUE(RC[1])) ->  | T54: =(RC[-16]*RC[-15]-RC[-13]*RC[-12])/1000 -> #VALUE! | W54: =RC[-2]*RC[-10]/1000 -> #VALUE! | X54: =ABS((RC[-3]*RC[-11]-RC[-2]*RC[-9])/1000) -> #VALUE! | Y54: =(RC[-14]-RC[1])/RC[-18]*100 -> #VALUE! | AC54: =VALUE(RC[-27]) -> #VALUE! | AD54: =IF(RC[21]=42,"*",IF(RC[21]=32,"",RC[21])) ->  | AE54: =RC[-28] ->  | AF54: =RC[-28] ->  | AG54: =RC[-28] ->  | AH54: =RC[-28] ->  | AI54: =RC[-28] ->  | AJ54: =RC[-28] ->  | AK54: =RC[-28] ->  | AL54: =RC[-28] -> 0 | AM54: =RC[-28] ->  | AN54: =RC[-28] ->  | AO54: =RC[-28] ->  | AP54: - | AQ54: =RC[-29] -> 0 | AR54: =RC[-29] -> 0 | AS54: - | AT54: =RC[-30] -> 0 | AU54: =RC[-30] -> 0 | AV54: =RC[-30] ->  | AW54: =RC[-30] -> 
A55: =IF(RC[1]="","",DATEVALUE(RC[1])) ->  | T55: =(RC[-16]*RC[-15]-RC[-13]*RC[-12])/1000 -> #VALUE! | W55: =RC[-2]*RC[-10]/1000 -> #VALUE! | X55: =ABS((RC[-3]*RC[-11]-RC[-2]*RC[-9])/1000) -> #VALUE! | Y55: =(RC[-14]-RC[1])/RC[-18]*100 -> #VALUE! | AC55: =VALUE(RC[-27]) -> #VALUE! | AD55: =IF(RC[21]=42,"*",IF(RC[21]=32,"",RC[21])) ->  | AE55: =RC[-28] ->  | AF55: =RC[-28] ->  | AG55: =RC[-28] ->  | AH55: =RC[-28] ->  | AI55: =RC[-28] ->  | AJ55: =RC[-28] ->  | AK55: =RC[-28] ->  | AL55: =RC[-28] -> 0 | AM55: =RC[-28] ->  | AN55: =RC[-28] ->  | AO55: =RC[-28] ->  | AP55: - | AQ55: =RC[-29] -> 0 | AR55: =RC[-29] -> 0 | AS55: - | AT55: =RC[-30] -> 0 | AU55: =RC[-30] -> 0 | AV55: =RC[-30] ->  | AW55: =RC[-30] -> 
A56: =IF(RC[1]="","",DATEVALUE(RC[1])) ->  | T56: =(RC[-16]*RC[-15]-RC[-13]*RC[-12])/1000 -> #VALUE! | W56: =RC[-2]*RC[-10]/1000 -> #VALUE! | X56: =ABS((RC[-3]*RC[-11]-RC[-2]*RC[-9])/1000) -> #VALUE! | Y56: =(RC[-14]-RC[1])/RC[-18]*100 -> #VALUE! | AC56: =VALUE(RC[-27]) -> #VALUE! | AD56: =IF(RC[21]=42,"*",IF(RC[21]=32,"",RC[21])) ->  | AE56: =RC[-28] ->  | AF56: =RC[-28] ->  | AG56: =RC[-28] ->  | AH56: =RC[-28] ->  | AI56: =RC[-28] ->  | AJ56: =RC[-28] ->  | AK56: =RC[-28] ->  | AL56: =RC[-28] -> 0 | AM56: =RC[-28] ->  | AN56: =RC[-28] ->  | AO56: =RC[-28] ->  | AP56: - | AQ56: =RC[-29] -> 0 | AR56: =RC[-29] -> 0 | AS56: - | AT56: =RC[-30] -> 0 | AU56: =RC[-30] -> 0 | AV56: =RC[-30] ->  | AW56: =RC[-30] -> 
A57: =IF(RC[1]="","",DATEVALUE(RC[1])) ->  | T57: =(RC[-16]*RC[-15]-RC[-13]*RC[-12])/1000 -> #VALUE! | W57: =RC[-2]*RC[-10]/1000 -> #VALUE! | X57: =ABS((RC[-3]*RC[-11]-RC[-2]*RC[-9])/1000) -> #VALUE! | Y57: =(RC[-14]-RC[1])/RC[-18]*100 -> #VALUE! | AC57: =VALUE(RC[-27]) -> #VALUE! | AD57: =IF(RC[21]=42,"*",IF(RC[21]=32,"",RC[21])) ->  | AE57: =RC[-28] ->  | AF57: =RC[-28] ->  | AG57: =RC[-28] ->  | AH57: =RC[-28] ->  | AI57: =RC[-28] ->  | AJ57: =RC[-28] ->  | AK57: =RC[-28] ->  | AL57: =RC[-28] -> 0 | AM57: =RC[-28] ->  | AN57: =RC[-28] ->  | AO57: =RC[-28] ->  | AP57: - | AQ57: =RC[-29] -> 0 | AR57: =RC[-29] -> 0 | AS57: - | AT57: =RC[-30] -> 0 | AU57: =RC[-30] -> 0 | AV57: =RC[-30] ->  | AW57: =RC[-30] -> 
A58: =IF(RC[1]="","",DATEVALUE(RC[1])) ->  | T58: =(RC[-16]*RC[-15]-RC[-13]*RC[-12])/1000 -> #VALUE! | W58: =RC[-2]*RC[-10]/1000 -> #VALUE! | X58: =ABS((RC[-3]*RC[-11]-RC[-2]*RC[-9])/1000) -> #VALUE! | Y58: =(RC[-14]-RC[1])/RC[-18]*100 -> #VALUE! | AC58: =VALUE(RC[-27]) -> #VALUE! | AD58: =IF(RC[21]=42,"*",IF(RC[21]=32,"",RC[21])) ->  | AE58: =RC[-28] ->  | AF58: =RC[-28] ->  | AG58: =RC[-28] ->  | AH58: =RC[-28] ->  | AI58: =RC[-28] ->  | AJ58: =RC[-28] ->  | AK58: =RC[-28] ->  | AL58: =RC[-28] -> 0 | AM58: =RC[-28] ->  | AN58: =RC[-28] ->  | AO58: =RC[-28] ->  | AP58: - | AQ58: =RC[-29] -> 0 | AR58: =RC[-29] -> 0 | AS58: - | AT58: =RC[-30] -> 0 | AU58: =RC[-30] -> 0 | AV58: =RC[-30] ->  | AW58: =RC[-30] -> 
A59: =IF(RC[1]="","",DATEVALUE(RC[1])) ->  | T59: =(RC[-16]*RC[-15]-RC[-13]*RC[-12])/1000 -> #VALUE! | W59: =RC[-2]*RC[-10]/1000 -> #VALUE! | X59: =ABS((RC[-3]*RC[-11]-RC[-2]*RC[-9])/1000) -> #VALUE! | Y59: =(RC[-14]-RC[1])/RC[-18]*100 -> #VALUE! | AC59: =VALUE(RC[-27]) -> #VALUE! | AD59: =IF(RC[21]=42,"*",IF(RC[21]=32,"",RC[21])) ->  | AE59: =RC[-28] ->  | AF59: =RC[-28] ->  | AG59: =RC[-28] ->  | AH59: =RC[-28] ->  | AI59: =RC[-28] ->  | AJ59: =RC[-28] ->  | AK59: =RC[-28] ->  | AL59: =RC[-28] -> 0 | AM59: =RC[-28] ->  | AN59: =RC[-28] ->  | AO59: =RC[-28] ->  | AP59: - | AQ59: =RC[-29] -> 0 | AR59: =RC[-29] -> 0 | AS59: - | AT59: =RC[-30] -> 0 | AU59: =RC[-30] -> 0 | AV59: =RC[-30] ->  | AW59: =RC[-30] -> 
A60: =IF(RC[1]="","",DATEVALUE(RC[1])) ->  | T60: =(RC[-16]*RC[-15]-RC[-13]*RC[-12])/1000 -> #VALUE! | W60: =RC[-2]*RC[-10]/1000 -> #VALUE! | X60: =ABS((RC[-3]*RC[-11]-RC[-2]*RC[-9])/1000) -> #VALUE! | Y60: =(RC[-14]-RC[1])/RC[-18]*100 -> #VALUE! | AC60: =VALUE(RC[-27]) -> #VALUE! | AD60: =IF(RC[21]=42,"*",IF(RC[21]=32,"",RC[21])) ->  | AE60: =RC[-28] ->  | AF60: =RC[-28] ->  | AG60: =RC[-28] ->  | AH60: =RC[-28] ->  | AI60: =RC[-28] ->  | AJ60: =RC[-28] ->  | AK60: =RC[-28] ->  | AL60: =RC[-28] -> 0 | AM60: =RC[-28] ->  | AN60: =RC[-28] ->  | AO60: =RC[-28] ->  | AP60: - | AQ60: =RC[-29] -> 0 | AR60: =RC[-29] -> 0 | AS60: - | AT60: =RC[-30] -> 0 | AU60: =RC[-30] -> 0 | AV60: =RC[-30] ->  | AW60: =RC[-30] -> 
A61: =IF(RC[1]="","",DATEVALUE(RC[1])) ->  | T61: =(RC[-16]*RC[-15]-RC[-13]*RC[-12])/1000 -> #VALUE! | W61: =RC[-2]*RC[-10]/1000 -> #VALUE! | X61: =ABS((RC[-3]*RC[-11]-RC[-2]*RC[-9])/1000) -> #VALUE! | Y61: =(RC[-14]-RC[1])/RC[-18]*100 -> #VALUE! | AC61: =VALUE(RC[-27]) -> #VALUE! | AD61: =IF(RC[21]=42,"*",IF(RC[21]=32,"",RC[21])) ->  | AE61: =RC[-28] ->  | AF61: =RC[-28] ->  | AG61: =RC[-28] ->  | AH61: =RC[-28] ->  | AI61: =RC[-28] ->  | AJ61: =RC[-28] ->  | AK61: =RC[-28] ->  | AL61: =RC[-28] -> 0 | AM61: =RC[-28] ->  | AN61: =RC[-28] ->  | AO61: =RC[-28] ->  | AP61: - | AQ61: =RC[-29] -> 0 | AR61: =RC[-29] -> 0 | AS61: - | AT61: =RC[-30] -> 0 | AU61: =RC[-30] -> 0 | AV61: =RC[-30] ->  | AW61: =RC[-30] -> 
A62: =IF(RC[1]="","",DATEVALUE(RC[1])) ->  | T62: =(RC[-16]*RC[-15]-RC[-13]*RC[-12])/1000 -> #VALUE! | W62: =RC[-2]*RC[-10]/1000 -> #VALUE! | X62: =ABS((RC[-3]*RC[-11]-RC[-2]*RC[-9])/1000) -> #VALUE! | Y62: =(RC[-14]-RC[1])/RC[-18]*100 -> #VALUE! | AC62: =VALUE(RC[-27]) -> #VALUE! | AD62: =IF(RC[21]=42,"*",IF(RC[21]=32,"",RC[21])) ->  | AE62: =RC[-28] ->  | AF62: =RC[-28] ->  | AG62: =RC[-28] ->  | AH62: =RC[-28] ->  | AI62: =RC[-28] ->  | AJ62: =RC[-28] ->  | AK62: =RC[-28] ->  | AL62: =RC[-28] -> 0 | AM62: =RC[-28] ->  | AN62: =RC[-28] ->  | AO62: =RC[-28] ->  | AP62: - | AQ62: =RC[-29] -> 0 | AR62: =RC[-29] -> 0 | AS62: - | AT62: =RC[-30] -> 0 | AU62: =RC[-30] -> 0 | AV62: =RC[-30] ->  | AW62: =RC[-30] -> 
A63: =IF(RC[1]="","",DATEVALUE(RC[1])) ->  | T63: =(RC[-16]*RC[-15]-RC[-13]*RC[-12])/1000 -> #VALUE! | W63: =RC[-2]*RC[-10]/1000 -> #VALUE! | X63: =ABS((RC[-3]*RC[-11]-RC[-2]*RC[-9])/1000) -> #VALUE! | Y63: =(RC[-14]-RC[1])/RC[-18]*100 -> #VALUE! | AC63: =VALUE(RC[-27]) -> #VALUE! | AD63: =IF(RC[21]=42,"*",IF(RC[21]=32,"",RC[21])) ->  | AE63: =RC[-28] ->  | AF63: =RC[-28] ->  | AG63: =RC[-28] ->  | AH63: =RC[-28] ->  | AI63: =RC[-28] ->  | AJ63: =RC[-28] ->  | AK63: =RC[-28] ->  | AL63: =RC[-28] -> 0 | AM63: =RC[-28] ->  | AN63: =RC[-28] ->  | AO63: =RC[-28] ->  | AP63: - | AQ63: =RC[-29] -> 0 | AR63: =RC[-29] -> 0 | AS63: - | AT63: =RC[-30] -> 0 | AU63: =RC[-30] -> 0 | AV63: =RC[-30] ->  | AW63: =RC[-30] -> 
A64: =IF(RC[1]="","",DATEVALUE(RC[1])) ->  | T64: =(RC[-16]*RC[-15]-RC[-13]*RC[-12])/1000 -> #VALUE! | W64: =RC[-2]*RC[-10]/1000 -> #VALUE! | X64: =ABS((RC[-3]*RC[-11]-RC[-2]*RC[-9])/1000) -> #VALUE! | Y64: =(RC[-14]-RC[1])/RC[-18]*100 -> #VALUE! | AC64: =VALUE(RC[-27]) -> #VALUE! | AD64: =IF(RC[21]=42,"*",IF(RC[21]=32,"",RC[21])) ->  | AE64: =RC[-28] ->  | AF64: =RC[-28] ->  | AG64: =RC[-28] ->  | AH64: =RC[-28] ->  | AI64: =RC[-28] ->  | AJ64: =RC[-28] ->  | AK64: =RC[-28] ->  | AL64: =RC[-28] -> 0 | AM64: =RC[-28] ->  | AN64: =RC[-28] ->  | AO64: =RC[-28] ->  | AP64: - | AQ64: =RC[-29] -> 0 | AR64: =RC[-29] -> 0 | AS64: - | AT64: =RC[-30] -> 0 | AU64: =RC[-30] -> 0 | AV64: =RC[-30] ->  | AW64: =RC[-30] -> 
A65: =IF(RC[1]="","",DATEVALUE(RC[1])) ->  | T65: =(RC[-16]*RC[-15]-RC[-13]*RC[-12])/1000 -> #VALUE! | W65: =RC[-2]*RC[-10]/1000 -> #VALUE! | X65: =ABS((RC[-3]*RC[-11]-RC[-2]*RC[-9])/1000) -> #VALUE! | Y65: =(RC[-14]-RC[1])/RC[-18]*100 -> #VALUE! | AC65: =VALUE(RC[-27]) -> #VALUE! | AD65: =IF(RC[21]=42,"*",IF(RC[21]=32,"",RC[21])) ->  | AE65: =RC[-28] ->  | AF65: =RC[-28] ->  | AG65: =RC[-28] ->  | AH65: =RC[-28] ->  | AI65: =RC[-28] ->  | AJ65: =RC[-28] ->  | AK65: =RC[-28] ->  | AL65: =RC[-28] -> 0 | AM65: =RC[-28] ->  | AN65: =RC[-28] ->  | AO65: =RC[-28] ->  | AP65: - | AQ65: =RC[-29] -> 0 | AR65: =RC[-29] -> 0 | AS65: - | AT65: =RC[-30] -> 0 | AU65: =RC[-30] -> 0 | AV65: =RC[-30] ->  | AW65: =RC[-30] -> 
A66: =IF(RC[1]="","",DATEVALUE(RC[1])) ->  | T66: =(RC[-16]*RC[-15]-RC[-13]*RC[-12])/1000 -> #VALUE! | W66: =RC[-2]*RC[-10]/1000 -> #VALUE! | X66: =ABS((RC[-3]*RC[-11]-RC[-2]*RC[-9])/1000) -> #VALUE! | Y66: =(RC[-14]-RC[1])/RC[-18]*100 -> #VALUE! | AC66: =VALUE(RC[-27]) -> #VALUE! | AD66: =IF(RC[21]=42,"*",IF(RC[21]=32,"",RC[21])) ->  | AE66: =RC[-28] ->  | AF66: =RC[-28] ->  | AG66: =RC[-28] ->  | AH66: =RC[-28] ->  | AI66: =RC[-28] ->  | AJ66: =RC[-28] ->  | AK66: =RC[-28] ->  | AL66: =RC[-28] -> 0 | AM66: =RC[-28] ->  | AN66: =RC[-28] ->  | AO66: =RC[-28] ->  | AP66: - | AQ66: =RC[-29] -> 0 | AR66: =RC[-29] -> 0 | AS66: - | AT66: =RC[-30] -> 0 | AU66: =RC[-30] -> 0 | AV66: =RC[-30] ->  | AW66: =RC[-30] -> 
A67: =IF(RC[1]="","",DATEVALUE(RC[1])) ->  | T67: =(RC[-16]*RC[-15]-RC[-13]*RC[-12])/1000 -> #VALUE! | W67: =RC[-2]*RC[-10]/1000 -> #VALUE! | X67: =ABS((RC[-3]*RC[-11]-RC[-2]*RC[-9])/1000) -> #VALUE! | Y67: =(RC[-14]-RC[1])/RC[-18]*100 -> #VALUE! | AC67: =VALUE(RC[-27]) -> #VALUE! | AD67: =IF(RC[21]=42,"*",IF(RC[21]=32,"",RC[21])) ->  | AE67: =RC[-28] ->  | AF67: =RC[-28] ->  | AG67: =RC[-28] ->  | AH67: =RC[-28] ->  | AI67: =RC[-28] ->  | AJ67: =RC[-28] ->  | AK67: =RC[-28] ->  | AL67: =RC[-28] -> 0 | AM67: =RC[-28] ->  | AN67: =RC[-28] ->  | AO67: =RC[-28] ->  | AP67: - | AQ67: =RC[-29] -> 0 | AR67: =RC[-29] -> 0 | AS67: - | AT67: =RC[-30] -> 0 | AU67: =RC[-30] -> 0 | AV67: =RC[-30] ->  | AW67: =RC[-30] -> 
A68: =IF(RC[1]="","",DATEVALUE(RC[1])) ->  | T68: =(RC[-16]*RC[-15]-RC[-13]*RC[-12])/1000 -> #VALUE! | W68: =RC[-2]*RC[-10]/1000 -> #VALUE! | X68: =ABS((RC[-3]*RC[-11]-RC[-2]*RC[-9])/1000) -> #VALUE! | Y68: =(RC[-14]-RC[1])/RC[-18]*100 -> #VALUE! | AC68: =VALUE(RC[-27]) -> #VALUE! | AD68: =IF(RC[21]=42,"*",IF(RC[21]=32,"",RC[21])) ->  | AE68: =RC[-28] ->  | AF68: =RC[-28] ->  | AG68: =RC[-28] ->  | AH68: =RC[-28] ->  | AI68: =RC[-28] ->  | AJ68: =RC[-28] ->  | AK68: =RC[-28] ->  | AL68: =RC[-28] -> 0 | AM68: =RC[-28] ->  | AN68: =RC[-28] ->  | AO68: =RC[-28] ->  | AP68: - | AQ68: =RC[-29] -> 0 | AR68: =RC[-29] -> 0 | AS68: - | AT68: =RC[-30] -> 0 | AU68: =RC[-30] -> 0 | AV68: =RC[-30] ->  | AW68: =RC[-30] -> 
A69: =IF(RC[1]="","",DATEVALUE(RC[1])) ->  | T69: =(RC[-16]*RC[-15]-RC[-13]*RC[-12])/1000 -> #VALUE! | W69: =RC[-2]*RC[-10]/1000 -> #VALUE! | X69: =ABS((RC[-3]*RC[-11]-RC[-2]*RC[-9])/1000) -> #VALUE! | Y69: =(RC[-14]-RC[1])/RC[-18]*100 -> #VALUE! | AC69: =VALUE(RC[-27]) -> #VALUE! | AD69: =IF(RC[21]=42,"*",IF(RC[21]=32,"",RC[21])) ->  | AE69: =RC[-28] ->  | AF69: =RC[-28] ->  | AG69: =RC[-28] ->  | AH69: =RC[-28] ->  | AI69: =RC[-28] ->  | AJ69: =RC[-28] ->  | AK69: =RC[-28] ->  | AL69: =RC[-28] -> 0 | AM69: =RC[-28] ->  | AN69: =RC[-28] ->  | AO69: =RC[-28] ->  | AP69: - | AQ69: =RC[-29] -> 0 | AR69: =RC[-29] -> 0 | AS69: - | AT69: =RC[-30] -> 0 | AU69: =RC[-30] -> 0 | AV69: =RC[-30] ->  | AW69: =RC[-30] -> 
A70: =IF(RC[1]="","",DATEVALUE(RC[1])) ->  | T70: =(RC[-16]*RC[-15]-RC[-13]*RC[-12])/1000 -> #VALUE! | W70: =RC[-2]*RC[-10]/1000 -> #VALUE! | X70: =ABS((RC[-3]*RC[-11]-RC[-2]*RC[-9])/1000) -> #VALUE! | Y70: =(RC[-14]-RC[1])/RC[-18]*100 -> #VALUE! | AC70: =VALUE(RC[-27]) -> #VALUE! | AD70: =IF(RC[21]=42,"*",IF(RC[21]=32,"",RC[21])) ->  | AE70: =RC[-28] ->  | AF70: =RC[-28] ->  | AG70: =RC[-28] ->  | AH70: =RC[-28] ->  | AI70: =RC[-28] ->  | AJ70: =RC[-28] ->  | AK70: =RC[-28] ->  | AL70: =RC[-28] -> 0 | AM70: =RC[-28] ->  | AN70: =RC[-28] ->  | AO70: =RC[-28] ->  | AP70: - | AQ70: =RC[-29] -> 0 | AR70: =RC[-29] -> 0 | AS70: - | AT70: =RC[-30] -> 0 | AU70: =RC[-30] -> 0 | AV70: =RC[-30] ->  | AW70: =RC[-30] -> 
A71: =IF(RC[1]="","",DATEVALUE(RC[1])) ->  | T71: =(RC[-16]*RC[-15]-RC[-13]*RC[-12])/1000 -> #VALUE! | W71: =RC[-2]*RC[-10]/1000 -> #VALUE! | X71: =ABS((RC[-3]*RC[-11]-RC[-2]*RC[-9])/1000) -> #VALUE! | Y71: =(RC[-14]-RC[1])/RC[-18]*100 -> #VALUE! | AC71: =VALUE(RC[-27]) -> #VALUE! | AD71: =IF(RC[21]=42,"*",IF(RC[21]=32,"",RC[21])) ->  | AE71: =RC[-28] ->  | AF71: =RC[-28] ->  | AG71: =RC[-28] ->  | AH71: =RC[-28] ->  | AI71: =RC[-28] ->  | AJ71: =RC[-28] ->  | AK71: =RC[-28] ->  | AL71: =RC[-28] -> 0 | AM71: =RC[-28] ->  | AN71: =RC[-28] ->  | AO71: =RC[-28] ->  | AP71: - | AQ71: =RC[-29] -> 0 | AR71: =RC[-29] -> 0 | AS71: - | AT71: =RC[-30] -> 0 | AU71: =RC[-30] -> 0 | AV71: =RC[-30] ->  | AW71: =RC[-30] -> 
A72: =IF(RC[1]="","",DATEVALUE(RC[1])) ->  | T72: =(RC[-16]*RC[-15]-RC[-13]*RC[-12])/1000 -> #VALUE! | W72: =RC[-2]*RC[-10]/1000 -> #VALUE! | X72: =ABS((RC[-3]*RC[-11]-RC[-2]*RC[-9])/1000) -> #VALUE! | Y72: =(RC[-14]-RC[1])/RC[-18]*100 -> #VALUE! | AC72: =VALUE(RC[-27]) -> #VALUE! | AD72: =IF(RC[21]=42,"*",IF(RC[21]=32,"",RC[21])) ->  | AE72: =RC[-28] ->  | AF72: =RC[-28] ->  | AG72: =RC[-28] ->  | AH72: =RC[-28] ->  | AI72: =RC[-28] ->  | AJ72: =RC[-28] ->  | AK72: =RC[-28] ->  | AL72: =RC[-28] -> 0 | AM72: =RC[-28] ->  | AN72: =RC[-28] ->  | AO72: =RC[-28] ->  | AP72: - | AQ72: =RC[-29] -> 0 | AR72: =RC[-29] -> 0 | AS72: - | AT72: =RC[-30] -> 0 | AU72: =RC[-30] -> 0 | AV72: =RC[-30] ->  | AW72: =RC[-30] -> 
A73: =IF(RC[1]="","",DATEVALUE(RC[1])) ->  | T73: =(RC[-16]*RC[-15]-RC[-13]*RC[-12])/1000 -> #VALUE! | W73: =RC[-2]*RC[-10]/1000 -> #VALUE! | X73: =ABS((RC[-3]*RC[-11]-RC[-2]*RC[-9])/1000) -> #VALUE! | Y73: =(RC[-14]-RC[1])/RC[-18]*100 -> #VALUE! | AC73: =VALUE(RC[-27]) -> #VALUE! | AD73: =IF(RC[21]=42,"*",IF(RC[21]=32,"",RC[21])) ->  | AE73: =RC[-28] ->  | AF73: =RC[-28] ->  | AG73: =RC[-28] ->  | AH73: =RC[-28] ->  | AI73: =RC[-28] ->  | AJ73: =RC[-28] ->  | AK73: =RC[-28] ->  | AL73: =RC[-28] -> 0 | AM73: =RC[-28] ->  | AN73: =RC[-28] ->  | AO73: =RC[-28] ->  | AP73: - | AQ73: =RC[-29] -> 0 | AR73: =RC[-29] -> 0 | AS73: - | AT73: =RC[-30] -> 0 | AU73: =RC[-30] -> 0 | AV73: =RC[-30] ->  | AW73: =RC[-30] -> 
A74: =IF(RC[1]="","",DATEVALUE(RC[1])) ->  | T74: =(RC[-16]*RC[-15]-RC[-13]*RC[-12])/1000 -> #VALUE! | W74: =RC[-2]*RC[-10]/1000 -> #VALUE! | X74: =ABS((RC[-3]*RC[-11]-RC[-2]*RC[-9])/1000) -> #VALUE! | Y74: =(RC[-14]-RC[1])/RC[-18]*100 -> #VALUE! | AC74: =VALUE(RC[-27]) -> #VALUE! | AD74: =IF(RC[21]=42,"*",IF(RC[21]=32,"",RC[21])) ->  | AE74: =RC[-28] ->  | AF74: =RC[-28] ->  | AG74: =RC[-28] ->  | AH74: =RC[-28] ->  | AI74: =RC[-28] ->  | AJ74: =RC[-28] ->  | AK74: =RC[-28] ->  | AL74: =RC[-28] -> 0 | AM74: =RC[-28] ->  | AN74: =RC[-28] ->  | AO74: =RC[-28] ->  | AP74: - | AQ74: =RC[-29] -> 0 | AR74: =RC[-29] -> 0 | AS74: - | AT74: =RC[-30] -> 0 | AU74: =RC[-30] -> 0 | AV74: =RC[-30] ->  | AW74: =RC[-30] -> 
A75: =IF(RC[1]="","",DATEVALUE(RC[1])) ->  | T75: =(RC[-16]*RC[-15]-RC[-13]*RC[-12])/1000 -> #VALUE! | W75: =RC[-2]*RC[-10]/1000 -> #VALUE! | X75: =ABS((RC[-3]*RC[-11]-RC[-2]*RC[-9])/1000) -> #VALUE! | Y75: =(RC[-14]-RC[1])/RC[-18]*100 -> #VALUE! | AC75: =VALUE(RC[-27]) -> #VALUE! | AD75: =IF(RC[21]=42,"*",IF(RC[21]=32,"",RC[21])) ->  | AE75: =RC[-28] ->  | AF75: =RC[-28] ->  | AG75: =RC[-28] ->  | AH75: =RC[-28] ->  | AI75: =RC[-28] ->  | AJ75: =RC[-28] ->  | AK75: =RC[-28] ->  | AL75: =RC[-28] -> 0 | AM75: =RC[-28] ->  | AN75: =RC[-28] ->  | AO75: =RC[-28] ->  | AP75: - | AQ75: =RC[-29] -> 0 | AR75: =RC[-29] -> 0 | AS75: - | AT75: =RC[-30] -> 0 | AU75: =RC[-30] -> 0 | AV75: =RC[-30] ->  | AW75: =RC[-30] -> 
A76: =IF(RC[1]="","",DATEVALUE(RC[1])) ->  | T76: =(RC[-16]*RC[-15]-RC[-13]*RC[-12])/1000 -> #VALUE! | W76: =RC[-2]*RC[-10]/1000 -> #VALUE! | X76: =ABS((RC[-3]*RC[-11]-RC[-2]*RC[-9])/1000) -> #VALUE! | Y76: =(RC[-14]-RC[1])/RC[-18]*100 -> #VALUE! | AC76: =VALUE(RC[-27]) -> #VALUE! | AD76: =IF(RC[21]=42,"*",IF(RC[21]=32,"",RC[21])) ->  | AE76: =RC[-28] ->  | AF76: =RC[-28] ->  | AG76: =RC[-28] ->  | AH76: =RC[-28] ->  | AI76: =RC[-28] ->  | AJ76: =RC[-28] ->  | AK76: =RC[-28] ->  | AL76: =RC[-28] -> 0 | AM76: =RC[-28] ->  | AN76: =RC[-28] ->  | AO76: =RC[-28] ->  | AP76: - | AQ76: =RC[-29] -> 0 | AR76: =RC[-29] -> 0 | AS76: - | AT76: =RC[-30] -> 0 | AU76: =RC[-30] -> 0 | AV76: =RC[-30] ->  | AW76: =RC[-30] -> 
A77: =IF(RC[1]="","",DATEVALUE(RC[1])) ->  | T77: =(RC[-16]*RC[-15]-RC[-13]*RC[-12])/1000 -> #VALUE! | W77: =RC[-2]*RC[-10]/1000 -> #VALUE! | X77: =ABS((RC[-3]*RC[-11]-RC[-2]*RC[-9])/1000) -> #VALUE! | Y77: =(RC[-14]-RC[1])/RC[-18]*100 -> #VALUE! | AC77: =VALUE(RC[-27]) -> #VALUE! | AD77: =IF(RC[21]=42,"*",IF(RC[21]=32,"",RC[21])) ->  | AE77: =RC[-28] ->  | AF77: =RC[-28] ->  | AG77: =RC[-28] ->  | AH77: =RC[-28] ->  | AI77: =RC[-28] ->  | AJ77: =RC[-28] ->  | AK77: =RC[-28] ->  | AL77: =RC[-28] -> 0 | AM77: =RC[-28] ->  | AN77: =RC[-28] ->  | AO77: =RC[-28] ->  | AP77: - | AQ77: =RC[-29] -> 0 | AR77: =RC[-29] -> 0 | AS77: - | AT77: =RC[-30] -> 0 | AU77: =RC[-30] -> 0 | AV77: =RC[-30] ->  | AW77: =RC[-30] -> 
A78: =IF(RC[1]="","",DATEVALUE(RC[1])) ->  | T78: =(RC[-16]*RC[-15]-RC[-13]*RC[-12])/1000 -> #VALUE! | W78: =RC[-2]*RC[-10]/1000 -> #VALUE! | X78: =ABS((RC[-3]*RC[-11]-RC[-2]*RC[-9])/1000) -> #VALUE! | Y78: =(RC[-14]-RC[1])/RC[-18]*100 -> #VALUE! | AC78: =VALUE(RC[-27]) -> #VALUE! | AD78: =IF(RC[21]=42,"*",IF(RC[21]=32,"",RC[21])) ->  | AE78: =RC[-28] ->  | AF78: =RC[-28] ->  | AG78: =RC[-28] ->  | AH78: =RC[-28] ->  | AI78: =RC[-28] ->  | AJ78: =RC[-28] ->  | AK78: =RC[-28] ->  | AL78: =RC[-28] -> 0 | AM78: =RC[-28] ->  | AN78: =RC[-28] ->  | AO78: =RC[-28] ->  | AP78: - | AQ78: =RC[-29] -> 0 | AR78: =RC[-29] -> 0 | AS78: - | AT78: =RC[-30] -> 0 | AU78: =RC[-30] -> 0 | AV78: =RC[-30] ->  | AW78: =RC[-30] -> 
A79: =IF(RC[1]="","",DATEVALUE(RC[1])) ->  | T79: =(RC[-16]*RC[-15]-RC[-13]*RC[-12])/1000 -> #VALUE! | W79: =RC[-2]*RC[-10]/1000 -> #VALUE! | X79: =ABS((RC[-3]*RC[-11]-RC[-2]*RC[-9])/1000) -> #VALUE! | Y79: =(RC[-14]-RC[1])/RC[-18]*100 -> #VALUE! | AC79: =VALUE(RC[-27]) -> #VALUE! | AD79: =IF(RC[21]=42,"*",IF(RC[21]=32,"",RC[21])) ->  | AE79: =RC[-28] ->  | AF79: =RC[-28] ->  | AG79: =RC[-28] ->  | AH79: =RC[-28] ->  | AI79: =RC[-28] ->  | AJ79: =RC[-28] ->  | AK79: =RC[-28] ->  | AL79: =RC[-28] -> 0 | AM79: =RC[-28] ->  | AN79: =RC[-28] ->  | AO79: =RC[-28] ->  | AP79: - | AQ79: =RC[-29] -> 0 | AR79: =RC[-29] -> 0 | AS79: - | AT79: =RC[-30] -> 0 | AU79: =RC[-30] -> 0 | AV79: =RC[-30] ->  | AW79: =RC[-30] -> 
A80: =IF(RC[1]="","",DATEVALUE(RC[1])) ->  | T80: =(RC[-16]*RC[-15]-RC[-13]*RC[-12])/1000 -> #VALUE! | W80: =RC[-2]*RC[-10]/1000 -> #VALUE! | X80: =ABS((RC[-3]*RC[-11]-RC[-2]*RC[-9])/1000) -> #VALUE! | Y80: =(RC[-14]-RC[1])/RC[-18]*100 -> #VALUE! | AC80: =VALUE(RC[-27]) -> #VALUE! | AD80: =IF(RC[21]=42,"*",IF(RC[21]=32,"",RC[21])) ->  | AE80: =RC[-28] ->  | AF80: =RC[-28] ->  | AG80: =RC[-28] ->  | AH80: =RC[-28] ->  | AI80: =RC[-28] ->  | AJ80: =RC[-28] ->  | AK80: =RC[-28] ->  | AL80: =RC[-28] -> 0 | AM80: =RC[-28] ->  | AN80: =RC[-28] ->  | AO80: =RC[-28] ->  | AP80: - | AQ80: =RC[-29] -> 0 | AR80: =RC[-29] -> 0 | AS80: - | AT80: =RC[-30] -> 0 | AU80: =RC[-30] -> 0 | AV80: =RC[-30] ->  | AW80: =RC[-30] -> 
A81: =IF(RC[1]="","",DATEVALUE(RC[1])) ->  | T81: =(RC[-16]*RC[-15]-RC[-13]*RC[-12])/1000 -> #VALUE! | W81: =RC[-2]*RC[-10]/1000 -> #VALUE! | X81: =ABS((RC[-3]*RC[-11]-RC[-2]*RC[-9])/1000) -> #VALUE! | Y81: =(RC[-14]-RC[1])/RC[-18]*100 -> #VALUE! | AC81: =VALUE(RC[-27]) -> #VALUE! | AD81: =IF(RC[21]=42,"*",IF(RC[21]=32,"",RC[21])) ->  | AE81: =RC[-28] ->  | AF81: =RC[-28] ->  | AG81: =RC[-28] ->  | AH81: =RC[-28] ->  | AI81: =RC[-28] ->  | AJ81: =RC[-28] ->  | AK81: =RC[-28] ->  | AL81: =RC[-28] -> 0 | AM81: =RC[-28] ->  | AN81: =RC[-28] ->  | AO81: =RC[-28] ->  | AP81: - | AQ81: =RC[-29] -> 0 | AR81: =RC[-29] -> 0 | AS81: - | AT81: =RC[-30] -> 0 | AU81: =RC[-30] -> 0 | AV81: =RC[-30] ->  | AW81: =RC[-30] -> 
A82: =IF(RC[1]="","",DATEVALUE(RC[1])) ->  | T82: =(RC[-16]*RC[-15]-RC[-13]*RC[-12])/1000 -> #VALUE! | W82: =RC[-2]*RC[-10]/1000 -> #VALUE! | X82: =ABS((RC[-3]*RC[-11]-RC[-2]*RC[-9])/1000) -> #VALUE! | Y82: =(RC[-14]-RC[1])/RC[-18]*100 -> #VALUE! | AC82: =VALUE(RC[-27]) -> #VALUE! | AD82: =IF(RC[21]=42,"*",IF(RC[21]=32,"",RC[21])) ->  | AE82: =RC[-28] ->  | AF82: =RC[-28] ->  | AG82: =RC[-28] ->  | AH82: =RC[-28] ->  | AI82: =RC[-28] ->  | AJ82: =RC[-28] ->  | AK82: =RC[-28] ->  | AL82: =RC[-28] -> 0 | AM82: =RC[-28] ->  | AN82: =RC[-28] ->  | AO82: =RC[-28] ->  | AP82: - | AQ82: =RC[-29] -> 0 | AR82: =RC[-29] -> 0 | AS82: - | AT82: =RC[-30] -> 0 | AU82: =RC[-30] -> 0 | AV82: =RC[-30] ->  | AW82: =RC[-30] -> 
A83: =IF(RC[1]="","",DATEVALUE(RC[1])) ->  | T83: =(RC[-16]*RC[-15]-RC[-13]*RC[-12])/1000 -> #VALUE! | W83: =RC[-2]*RC[-10]/1000 -> #VALUE! | X83: =ABS((RC[-3]*RC[-11]-RC[-2]*RC[-9])/1000) -> #VALUE! | Y83: =(RC[-14]-RC[1])/RC[-18]*100 -> #VALUE! | AC83: =VALUE(RC[-27]) -> #VALUE! | AD83: =IF(RC[21]=42,"*",IF(RC[21]=32,"",RC[21])) ->  | AE83: =RC[-28] ->  | AF83: =RC[-28] ->  | AG83: =RC[-28] ->  | AH83: =RC[-28] ->  | AI83: =RC[-28] ->  | AJ83: =RC[-28] ->  | AK83: =RC[-28] ->  | AL83: =RC[-28] -> 0 | AM83: =RC[-28] ->  | AN83: =RC[-28] ->  | AO83: =RC[-28] ->  | AP83: - | AQ83: =RC[-29] -> 0 | AR83: =RC[-29] -> 0 | AS83: - | AT83: =RC[-30] -> 0 | AU83: =RC[-30] -> 0 | AV83: =RC[-30] ->  | AW83: =RC[-30] -> 
AC84: Среднее | AF84: =R[1]C[-28] -> 231.84964548699998 | AG84: =R[1]C[-28] -> 68.340444444444444 | AH84: =R[1]C[-28] -> 6.7844418170017775 | AI84: =R[1]C[-28] -> 206.01164177799998 | AJ84: =R[1]C[-28] -> 49.370111111111115 | AK84: =R[1]C[-28] -> 5.8758465597448879 | AL84: =R[1]C[-28] -> 18.970333333333333 | AM84: =R[1]C[-28] -> 25.838003709000002 | AN84: =R[1]C[-28] -> 27.665747134333341 | AO84: =R[1]C[-28] -> 67.990333333333339 | AP84: - | AQ84: =R[1]C[-29] -> 0 | AR84: =R[1]C[-29] -> 0 | AS84: - | AT84: =R[1]C[-30] -> 0 | AU84: =R[1]C[-30] -> 0
B85: Среднее | D85: =AVERAGE(OFFSET(R[-74]C,3,0,R7C1,1)) -> 231.84964548699998 | E85: =AVERAGE(OFFSET(R[-74]C,3,0,R7C1,1)) -> 68.340444444444444 | F85: =AVERAGE(OFFSET(R[-74]C,3,0,R7C1,1)) -> 6.7844418170017775 | G85: =AVERAGE(OFFSET(R[-74]C,3,0,R7C1,1)) -> 206.01164177799998 | H85: =AVERAGE(OFFSET(R[-74]C,3,0,R7C1,1)) -> 49.370111111111115 | I85: =AVERAGE(OFFSET(R[-74]C,3,0,R7C1,1)) -> 5.8758465597448879 | J85: =AVERAGE(OFFSET(R[-74]C,3,0,R7C1,1)) -> 18.970333333333333 | K85: =AVERAGE(OFFSET(R[-74]C,3,0,R7C1,1)) -> 25.838003709000002 | L85: =IF(SUM(OFFSET(R[-74]C,3,0,R7C1,1))=0,"",AVERAGE(OFFSET(R[-74]C,3,0,R7C1,1))) -> 27.665747134333341 | M85: =IF(SUM(OFFSET(R[-74]C,3,0,R7C1,1))=0,"",AVERAGE(OFFSET(R[-74]C,3,0,R7C1,1))) -> 67.990333333333339 | R85: =IF(SUM(OFFSET(R[-74]C,3,0,R7C1,1))=0,"",AVERAGE(OFFSET(R[-74]C,3,0,R7C1,1))) -> 1.8493572257252948 | S85: =AVERAGE(OFFSET(R[-74]C,3,0,R7C1,1)) -> 5.6223639231124158 | T85: =AVERAGE(OFFSET(R[-74]C,3,0,R7C1,1)) -> 5.4975961039653249 | W85: =AVERAGE(OFFSET(R[-74]C,3,0,R7C1,1)) -> 1.8407454584458567 | X85: =AVERAGE(OFFSET(R[-74]C,3,0,R7C1,1)) -> #VALUE! | AC85: Итого | AE85: =R[1]C[-28] -> 720 | AF85: =R[1]C[-28] -> 6955.489364609999 | AI85: =R[1]C[-28] -> 6180.3492533399994 | AM85: =R[1]C[-28] -> 775.14011127000003 | AN85: =R[1]C[-28] -> 829.97241403000021 | AQ85: =R[1]C[-29] -> 0 | AU85: =R[1]C[-30] -> 0 | AV85: =R[1]C[-30] -> 55.480716771758843 | AW85: =R[1]C[-30] -> 168.67091769337247
B86: ИТОГО: | C86: =SUM(OFFSET(R[-75]C,3,0,R7C1,1)) -> 720 | D86: =SUM(OFFSET(R[-75]C,3,0,R7C1,1)) -> 6955.489364609999 | G86: =SUM(OFFSET(R[-75]C,3,0,R7C1,1)) -> 6180.3492533399994 | K86: =SUM(OFFSET(R[-75]C,3,0,R7C1,1)) -> 775.14011127000003 | L86: =IF(SUM(OFFSET(R[-75]C,3,0,R7C1,1))=0,"",SUM(OFFSET(R[-75]C,3,0,R7C1,1))) -> 829.97241403000021 | R86: =IF(SUM(OFFSET(R[-75]C,3,0,R7C1,1))=0,"",SUM(OFFSET(R[-75]C,3,0,R7C1,1))) -> 55.480716771758843 | S86: =SUM(OFFSET(R[-75]C,3,0,R7C1,1)) -> 168.67091769337247 | T86: =SUM(OFFSET(R[-75]C,3,0,R7C1,1)) -> 164.92788311895976 | W86: =SUM(OFFSET(R[-75]C,3,0,R7C1,1)) -> 55.222363753375703 | X86: =SUM(OFFSET(R[-75]C,3,0,R7C1,1)) -> #VALUE!
AC87: Досчёт | AF87: =R[1]C[-28] -> 0 | AI87: =R[1]C[-28] -> 0 | AM87: =R[1]C[-28] -> 0 | AN87: =R[1]C[-28] -> 0 | AQ87: =R[1]C[-29] -> 0 | AU87: =R[1]C[-30] -> 0 | AV87: =R[1]C[-30] -> 0 | AW87: =R[1]C[-30] -> 0
A88: 11дн=264ч 4дн=96ч | B88: Досчёт до конца м-ца (+) | C88: =R6C1*24 -> 216 | T88: № B018 | AC88: Снятие | AF88: =-R[1]C[-28] -> 0 | AI88: =-R[1]C[-28] -> 0 | AM88: =-R[1]C[-28] -> 0 | AN88: =-R[1]C[-28] -> 0 | AQ88: =-R[1]C[-29] -> 0 | AU88: =-R[1]C[-30] -> 0 | AV88: =-R[1]C[-30] -> 0 | AW88: =-R[1]C[-30] -> 0
A89: 9дн=216ч 7дн=168ч | B89: Вычет с предыдущего (-) | C89: =R4C1*24 -> 192 | AC89: Сумма | AF89: =R[1]C[-28] -> 6955.489364609999 | AI89: =R[1]C[-28] -> 6180.3492533399994 | AM89: =R[1]C[-28] -> 775.14011127000003 | AN89: =R[1]C[-28] -> 829.97241403000021 | AQ89: =R[1]C[-29] -> 0 | AU89: =R[1]C[-30] -> 0 | AV89: =R[1]C[-30] -> 55.480716771758843 | AW89: =R[1]C[-30] -> 168.67091769337247
B90: СУММА: | C90: =R[-4]C+R[-2]C-R[-1]C -> 744 | D90: =R[-4]C+R[-2]C-R[-1]C -> 6955.489364609999 | G90: =R[-4]C+R[-2]C-R[-1]C -> 6180.3492533399994 | K90: =R[-4]C+R[-2]C-R[-1]C -> 775.14011127000003 | L90: =IF(SUM(OFFSET(R[-79]C,3,0,R7C1,1))=0,"",(R[-4]C+R[-2]C-R[-1]C)) -> 829.97241403000021 | R90: =IF(SUM(OFFSET(R[-79]C,3,0,R7C1,1))=0,"",(R[-4]C+R[-2]C-R[-1]C)) -> 55.480716771758843 | S90: =R[-4]C+R[-2]C-R[-1]C -> 168.67091769337247
AC91: Тхв на источнике | AE91: V гвс (м3) | AF91: =R[-2]C[15] -> 0 | AG91: W гвс (Гкал) | AH91: =RC[-2]*0.06 -> 0 | AI91: W без гвс (Гкал) | AJ91: =R[-2]C[13]-RC[-2] -> 168.67091769337247
B92: Показания счетчиков на момент снятия данных:
B93: Дата, время | D93: М1, т | F93: М2, т | H93: М3, т | J93: М4, т | L93: Qо, Гкал | N93: Qг, Гкал | P93: время, час
B94: 23.09.18 00:09 | D94: 121643 | F94: 97270.6875 | H94: 25146.18359375 | J94: - | L94: 4852.9763557490196 | N94: 1843.6414464053701 | P94: -
B95: 23.10.18 02:59 | D95: 128636.8203125 | F95: 103471.828125 | H95: 25961.826171879999 | J95: - | L95: 5038.8110587154897 | N95: 1899.32507840833 | P95: -
AC97: =ZAYAVKA_N -> з.н д. №02/147-2783 от 04.10.18 03.10.18г некорректная работа приборов
B98: Представитель потребителя:_______________________________________________________________________ В.О. Топорков
I101: Рекомендуемые значения по параметрам теплопотребления (не являются официально утверждёнными)
I102: М, т | J102: V, м3 | K102: Qгвс, Гкал | L102: Qотоп, Гкал | M102: Qо, Гкал
I103: =R[-13]C[-3] -> 0 | J103: =RC[-1]/0.98 -> 0 | K103: =RC[-1]*0.06 -> 0 | L103: =RC[1]-RC[-1] -> 55.480716771758843 | M103: =R[-13]C[5] -> 55.480716771758843
O105: ДЛЯ САМОКОНТРОЛЯ
B106: В строке выбора дат указать период с 16.7.13 по 23.8.13 - жильё | N106: Q | O106: Qг
B107: В строке выбора дат указать период с 18.7.13 по 25.8.13 - не жилое | N107: =(R[-21]C[-10]*R[-22]C[-7]-R[-21]C[-9]*R[-22]C[-6])/1000 -> 1432.9117833727237 | O107: =IF(R[-22]C[-2]="",R[-21]C[-3]*R[-22]C/1000,"") ->  | P107: Си2
O108: =IF(R[-23]C[-2]="","",((R[-22]C[-3]*R[-23]C)-(R[-22]C[-2]*R[-23]C[2]))/1000) -> 0 | P108: Си3