Sheet: Лист1
G1: Отчёт о теплопотреблении за октябрь 2018 | M1: з.н д. №02/147-2783 от 04.10.18 с 23.09.18г по 24.09.18г некорректная работа приборов
A4: =EOMONTH(R[9]C,0)-R[9]C -> 8 | B4: Потребитель: ЗАО "Сити Сервис"
A5: =MAX(R[9]C:R[78]C) -> 2018-10-22T00:00:00.000 | B5: Адрес: г. СПб, Наличная ул., д.55 ИТП 3
A6: =EOMONTH(R[-1]C,0)-R[-1]C -> 9 | B6: Телефон: 8-911-021-19-79
A7: =R[-2]C-R[6]C -> 30 | B7: Договор 10023-3 (.) 85877, 85878, 85880
A8: 7 | B8: Тепловычислитель: ВКТ-7 № 50019 | L8: М2 мах= | M8: 108.48 | O8: Мгвс мах= | P8: 11.04
L9: Qотоп мах= | M9: 8.683 | O9: Qгвс мах= | P9: 0.72
B10: Расчётная формула: Q=M1*(h1-hхв)-M2*(h2-hхв)
D12: Учет | L12: Контроль
A13: =R[1]C[1]-1 -> 2018-09-22T00:00:00.000 | B13: Дата | C13: N, ч | D13: M1, т | E13: T1, С | F13: P1, кг/см2 | G13: M2, т | H13: T2, С | I13: P2, кг/см2 | J13: dT, С | K13: M1-М2, т | L13: V3, м3 | M13: T3, С | N13: V4, м3 | O13: =IF(R[-12]C[-14]="м.куб","","T4, С") -> T4, С | P13: dT, С | Q13: V3-V4, м3 | R13: Qгвс, Гкал | S13: Qобщ., Гкал | T13: Q | U13: M3 | V13: M4 | W13: си2 | X13: си3 | Y13: Разб. | Z13: dM2 | AC13: Дата | AD13: НС | AE13: n, ч | AF13: М1, т | AG13: t1, гр. С | AH13: Р1, кгс/см2 | AI13: М2, т | AJ13: t2, гр. С | AK13: Р2, кгс/см2 | AL13: t1-t2, гр. С | AM13: М1-М2, т | AN13: М1гвс, т | AO13: t1гвс, гр. С | AP13: Р1гвс, кгс/см2 | AQ13: М2гвс, т | AR13: t2гвс, гр. С | AS13: Р2гвс, кгс/см2 | AT13: t1гвс-t2гвс | AU13: М1гвс-М2гвс, т | AV13: Wгвс, Гкал | AW13: Wсумм, Гкал | AY13: NS_TV1 | AZ13: НС | BA13: NS_TV2
A14: =IF(RC[1]="","",DATEVALUE(RC[1])) -> 43366 | B14: 23.09.18 | C14: 24 | D14: 0 | E14: 45.57 | F14: 4.88 | G14: 8.34 | H14: 55.8 | I14: 4.9800000000000004 | J14: =RC[-5]-RC[-2] -> -10.229999999999997 | K14: -8.34 | L14: 16.720000000000002 | M14: 66.173333333333332 | N14: 8.0033333333333321 | O14: 43.68 | P14: 22.493333333333336 | Q14: 8.7166666666666668 | R14: 0.7363333333333334 | S14: =RC[-1] -> 0.7363333333333334 | T14: =(RC[-16]*RC[-15]-RC[-13]*RC[-12])/1000 -> -0.46537199999999995 | U14: 7.71 | V14: 0.92 | W14: =RC[-2]*RC[-10]/1000 -> 0.51019639999999999 | X14: =ABS((RC[-3]*RC[-11]-RC[-2]*RC[-9])/1000) -> 0.47001079999999995 | Y14: =(RC[-14]-RC[1])/RC[-18]*100 -> -181.41486810551558 | Z14: 6.79 | AC14: =VALUE(RC[-27]) -> 2018-09-23T00:00:00.000 | AD14: =IF(RC[21]=42,"*",IF(RC[21]=32,"",RC[21])) -> - | AE14: =RC[-28] -> 24 | AF14: =RC[-28] -> 0 | AG14: =RC[-28] -> 45.57 | AH14: =RC[-28] -> 4.88 | AI14: =RC[-28] -> 8.34 | AJ14: =RC[-28] -> 55.8 | AK14: =RC[-28] -> 4.9800000000000004 | AL14: =RC[-28] -> -10.229999999999997 | AM14: =RC[-28] -> -8.34 | AN14: =RC[-28] -> 16.720000000000002 | AO14: =RC[-28] -> 66.173333333333332 | AP14: - | AQ14: =RC[-29] -> 8.0033333333333321 | AR14: =RC[-29] -> 43.68 | AS14: - | AT14: =RC[-30] -> 22.493333333333336 | AU14: =RC[-30] -> 8.7166666666666668 | AV14: =RC[-30] -> 0.7363333333333334 | AW14: =RC[-30] -> 0.7363333333333334 | AY14: - | AZ14: - | BA14: -
A15: =IF(RC[1]="","",DATEVALUE(RC[1])) -> 43367 | B15: 24.09.18 | C15: 24 | D15: 54.74 | E15: 69.53 | F15: 6.9 | G15: 53.51 | H15: 47.39 | I15: 5 | J15: =RC[-5]-RC[-2] -> 22.14 | K15: 1.23 | L15: =AVERAGE(R[1]C:R[3]C) -> 16.720000000000002 | M15: =AVERAGE(R[1]C:R[3]C) -> 66.173333333333332 | N15: =AVERAGE(R[1]C:R[3]C) -> 8.0033333333333321 | O15: =AVERAGE(R[1]C:R[3]C) -> 43.68 | P15: =AVERAGE(R[1]C:R[3]C) -> 22.493333333333336 | Q15: =AVERAGE(R[1]C:R[3]C) -> 8.7166666666666668 | R15: =AVERAGE(R[1]C:R[3]C) -> 0.7363333333333334 | S15: =AVERAGE(R[1]C:R[3]C) -> 2.6750000000000003 | T15: =(RC[-16]*RC[-15]-RC[-13]*RC[-12])/1000 -> 1.2702333000000003 | U15: 12.57 | V15: 4.32 | W15: =RC[-2]*RC[-10]/1000 -> 0.83179880000000006 | X15: =ABS((RC[-3]*RC[-11]-RC[-2]*RC[-9])/1000) -> 0.64310120000000004 | Y15: =(RC[-14]-RC[1])/RC[-18]*100 -> -13.119043169501026 | Z15: 8.25 | AC15: =VALUE(RC[-27]) -> 2018-09-24T00:00:00.000 | AD15: =IF(RC[21]=42,"*",IF(RC[21]=32,"",RC[21])) -> - | AE15: =RC[-28] -> 24 | AF15: =RC[-28] -> 54.74 | AG15: =RC[-28] -> 69.53 | AH15: =RC[-28] -> 6.9 | AI15: =RC[-28] -> 53.51 | AJ15: =RC[-28] -> 47.39 | AK15: =RC[-28] -> 5 | AL15: =RC[-28] -> 22.14 | AM15: =RC[-28] -> 1.23 | AN15: =RC[-28] -> 16.720000000000002 | AO15: =RC[-28] -> 66.173333333333332 | AP15: - | AQ15: =RC[-29] -> 8.0033333333333321 | AR15: =RC[-29] -> 43.68 | AS15: - | AT15: =RC[-30] -> 22.493333333333336 | AU15: =RC[-30] -> 8.7166666666666668 | AV15: =RC[-30] -> 0.7363333333333334 | AW15: =RC[-30] -> 2.6750000000000003 | AY15: - | AZ15: - | BA15: -
A16: =IF(RC[1]="","",DATEVALUE(RC[1])) -> 43368 | B16: 25.09.18 | C16: 24 | D16: 110.41 | E16: 68.47 | F16: 9.01 | G16: 104.11 | H16: 46.09 | I16: 4.87 | J16: =RC[-5]-RC[-2] -> 22.379999999999995 | K16: 6.3 | L16: 17.420000000000002 | M16: 68.040000000000006 | N16: 8.27 | O16: 44.73 | P16: =IF(AND(ISNUMBER(RC[-3]),ISNUMBER(RC[-1])),RC[-3]-RC[-1],"-") -> 23.310000000000009 | Q16: 9.15 | R16: 0.78900000000000003 | S16: 2.77 | T16: =(RC[-16]*RC[-15]-RC[-13]*RC[-12])/1000 -> 2.7613427999999995 | U16: 17.04 | V16: 8.27 | W16: =RC[-2]*RC[-10]/1000 -> 1.1594016000000003 | X16: =ABS((RC[-3]*RC[-11]-RC[-2]*RC[-9])/1000) -> 0.78948450000000026 | Y16: =(RC[-14]-RC[1])/RC[-18]*100 -> -2.3724906349053883 | Z16: 8.77 | AC16: =VALUE(RC[-27]) -> 2018-09-25T00:00:00.000 | AD16: =IF(RC[21]=42,"*",IF(RC[21]=32,"",RC[21])) -> - | AE16: =RC[-28] -> 24 | AF16: =RC[-28] -> 110.41 | AG16: =RC[-28] -> 68.47 | AH16: =RC[-28] -> 9.01 | AI16: =RC[-28] -> 104.11 | AJ16: =RC[-28] -> 46.09 | AK16: =RC[-28] -> 4.87 | AL16: =RC[-28] -> 22.379999999999995 | AM16: =RC[-28] -> 6.3 | AN16: =RC[-28] -> 17.420000000000002 | AO16: =RC[-28] -> 68.040000000000006 | AP16: - | AQ16: =RC[-29] -> 8.27 | AR16: =RC[-29] -> 44.73 | AS16: - | AT16: =RC[-30] -> 23.310000000000009 | AU16: =RC[-30] -> 9.15 | AV16: =RC[-30] -> 0.78900000000000003 | AW16: =RC[-30] -> 2.77 | AY16: - | AZ16: - | BA16: -
A17: =IF(RC[1]="","",DATEVALUE(RC[1])) -> 43369 | B17: 26.09.18 | C17: 24 | D17: 108.75 | E17: 67.95 | F17: 9.01 | G17: 102.8 | H17: 44.76 | I17: 4.8600000000000003 | J17: =RC[-5]-RC[-2] -> 23.190000000000005 | K17: 5.95 | L17: 16.98 | M17: 67.349999999999994 | N17: 8.1300000000000008 | O17: 44.72 | P17: =IF(AND(ISNUMBER(RC[-3]),ISNUMBER(RC[-1])),RC[-3]-RC[-1],"-") -> 22.629999999999995 | Q17: 8.85 | R17: 0.75900000000000001 | S17: 2.794 | T17: =(RC[-16]*RC[-15]-RC[-13]*RC[-12])/1000 -> 2.7882345000000006 | U17: 16.66 | V17: 8.1300000000000008 | W17: =RC[-2]*RC[-10]/1000 -> 1.1220509999999999 | X17: =ABS((RC[-3]*RC[-11]-RC[-2]*RC[-9])/1000) -> 0.75847739999999997 | Y17: =(RC[-14]-RC[1])/RC[-18]*100 -> -2.5097276264591435 | Z17: 8.5299999999999994 | AC17: =VALUE(RC[-27]) -> 2018-09-26T00:00:00.000 | AD17: =IF(RC[21]=42,"*",IF(RC[21]=32,"",RC[21])) -> - | AE17: =RC[-28] -> 24 | AF17: =RC[-28] -> 108.75 | AG17: =RC[-28] -> 67.95 | AH17: =RC[-28] -> 9.01 | AI17: =RC[-28] -> 102.8 | AJ17: =RC[-28] -> 44.76 | AK17: =RC[-28] -> 4.8600000000000003 | AL17: =RC[-28] -> 23.190000000000005 | AM17: =RC[-28] -> 5.95 | AN17: =RC[-28] -> 16.98 | AO17: =RC[-28] -> 67.349999999999994 | AP17: - | AQ17: =RC[-29] -> 8.1300000000000008 | AR17: =RC[-29] -> 44.72 | AS17: - | AT17: =RC[-30] -> 22.629999999999995 | AU17: =RC[-30] -> 8.85 | AV17: =RC[-30] -> 0.75900000000000001 | AW17: =RC[-30] -> 2.794 | AY17: - | AZ17: - | BA17: -
A18: =IF(RC[1]="","",DATEVALUE(RC[1])) -> 43370 | B18: 27.09.18 | C18: 24 | D18: 102.01 | E18: 63.38 | F18: 8.7100000000000009 | G18: 96.47 | H18: 41.56 | I18: 4.99 | J18: =RC[-5]-RC[-2] -> 21.82 | K18: 5.54 | L18: 15.76 | M18: 63.13 | N18: 7.61 | O18: 41.59 | P18: =IF(AND(ISNUMBER(RC[-3]),ISNUMBER(RC[-1])),RC[-3]-RC[-1],"-") -> 21.54 | Q18: 8.15 | R18: 0.66100000000000003 | S18: 2.4609999999999999 | T18: =(RC[-16]*RC[-15]-RC[-13]*RC[-12])/1000 -> 2.4561006000000005 | U18: 15.47 | V18: 7.61 | W18: =RC[-2]*RC[-10]/1000 -> 0.97662110000000002 | X18: =ABS((RC[-3]*RC[-11]-RC[-2]*RC[-9])/1000) -> 0.66012120000000007 | Y18: =(RC[-14]-RC[1])/RC[-18]*100 -> -2.4048927127604438 | Z18: 7.86 | AC18: =VALUE(RC[-27]) -> 2018-09-27T00:00:00.000 | AD18: =IF(RC[21]=42,"*",IF(RC[21]=32,"",RC[21])) -> - | AE18: =RC[-28] -> 24 | AF18: =RC[-28] -> 102.01 | AG18: =RC[-28] -> 63.38 | AH18: =RC[-28] -> 8.7100000000000009 | AI18: =RC[-28] -> 96.47 | AJ18: =RC[-28] -> 41.56 | AK18: =RC[-28] -> 4.99 | AL18: =RC[-28] -> 21.82 | AM18: =RC[-28] -> 5.54 | AN18: =RC[-28] -> 15.76 | AO18: =RC[-28] -> 63.13 | AP18: - | AQ18: =RC[-29] -> 7.61 | AR18: =RC[-29] -> 41.59 | AS18: - | AT18: =RC[-30] -> 21.54 | AU18: =RC[-30] -> 8.15 | AV18: =RC[-30] -> 0.66100000000000003 | AW18: =RC[-30] -> 2.4609999999999999 | AY18: - | AZ18: - | BA18: -
A19: =IF(RC[1]="","",DATEVALUE(RC[1])) -> 43371 | B19: 28.09.18 | C19: 24 | D19: 97.75 | E19: 68.02 | F19: 8.56 | G19: 92.88 | H19: 42.9 | I19: 5.09 | J19: =RC[-5]-RC[-2] -> 25.119999999999997 | K19: 4.87 | L19: 14.68 | M19: 67.66 | N19: 7.25 | O19: 42.07 | P19: =IF(AND(ISNUMBER(RC[-3]),ISNUMBER(RC[-1])),RC[-3]-RC[-1],"-") -> 25.589999999999996 | Q19: 7.43 | R19: 0.66900000000000004 | S19: 2.6680000000000001 | T19: =(RC[-16]*RC[-15]-RC[-13]*RC[-12])/1000 -> 2.6644030000000001 | U19: 14.38 | V19: 7.25 | W19: =RC[-2]*RC[-10]/1000 -> 0.9729508 | X19: =ABS((RC[-3]*RC[-11]-RC[-2]*RC[-9])/1000) -> 0.66794329999999991 | Y19: =(RC[-14]-RC[1])/RC[-18]*100 -> -2.4332472006890611 | Z19: 7.13 | AC19: =VALUE(RC[-27]) -> 2018-09-28T00:00:00.000 | AD19: =IF(RC[21]=42,"*",IF(RC[21]=32,"",RC[21])) -> - | AE19: =RC[-28] -> 24 | AF19: =RC[-28] -> 97.75 | AG19: =RC[-28] -> 68.02 | AH19: =RC[-28] -> 8.56 | AI19: =RC[-28] -> 92.88 | AJ19: =RC[-28] -> 42.9 | AK19: =RC[-28] -> 5.09 | AL19: =RC[-28] -> 25.119999999999997 | AM19: =RC[-28] -> 4.87 | AN19: =RC[-28] -> 14.68 | AO19: =RC[-28] -> 67.66 | AP19: - | AQ19: =RC[-29] -> 7.25 | AR19: =RC[-29] -> 42.07 | AS19: - | AT19: =RC[-30] -> 25.589999999999996 | AU19: =RC[-30] -> 7.43 | AV19: =RC[-30] -> 0.66900000000000004 | AW19: =RC[-30] -> 2.6680000000000001 | AY19: - | AZ19: - | BA19: -
A20: =IF(RC[1]="","",DATEVALUE(RC[1])) -> 43372 | B20: 29.09.18 | C20: 24 | D20: 96.44 | E20: 67.55 | F20: 8.5500000000000007 | G20: 90.79 | H20: 42.29 | I20: 5.21 | J20: =RC[-5]-RC[-2] -> 25.259999999999998 | K20: 5.65 | L20: 15.3 | M20: 67.11 | N20: 7.07 | O20: 42.78 | P20: =IF(AND(ISNUMBER(RC[-3]),ISNUMBER(RC[-1])),RC[-3]-RC[-1],"-") -> 24.33 | Q20: 8.23 | R20: 0.70199999999999996 | S20: 2.677 | T20: =(RC[-16]*RC[-15]-RC[-13]*RC[-12])/1000 -> 2.6750128999999996 | U20: 14.99 | V20: 7.07 | W20: =RC[-2]*RC[-10]/1000 -> 1.0059788999999999 | X20: =ABS((RC[-3]*RC[-11]-RC[-2]*RC[-9])/1000) -> 0.70352429999999988 | Y20: =(RC[-14]-RC[1])/RC[-18]*100 -> -2.5002753607225459 | Z20: 7.92 | AC20: =VALUE(RC[-27]) -> 2018-09-29T00:00:00.000 | AD20: =IF(RC[21]=42,"*",IF(RC[21]=32,"",RC[21])) -> - | AE20: =RC[-28] -> 24 | AF20: =RC[-28] -> 96.44 | AG20: =RC[-28] -> 67.55 | AH20: =RC[-28] -> 8.5500000000000007 | AI20: =RC[-28] -> 90.79 | AJ20: =RC[-28] -> 42.29 | AK20: =RC[-28] -> 5.21 | AL20: =RC[-28] -> 25.259999999999998 | AM20: =RC[-28] -> 5.65 | AN20: =RC[-28] -> 15.3 | AO20: =RC[-28] -> 67.11 | AP20: - | AQ20: =RC[-29] -> 7.07 | AR20: =RC[-29] -> 42.78 | AS20: - | AT20: =RC[-30] -> 24.33 | AU20: =RC[-30] -> 8.23 | AV20: =RC[-30] -> 0.70199999999999996 | AW20: =RC[-30] -> 2.677 | AY20: - | AZ20: - | BA20: -
A21: =IF(RC[1]="","",DATEVALUE(RC[1])) -> 43373 | B21: 30.09.18 | C21: 24 | D21: 96.89 | E21: 69.849999999999994 | F21: 8.4700000000000006 | G21: 90.16 | H21: 43.2 | I21: 5.17 | J21: =RC[-5]-RC[-2] -> 26.649999999999991 | K21: 6.73 | L21: 16.440000000000001 | M21: 69.680000000000007 | N21: 7.14 | O21: 43.6 | P21: =IF(AND(ISNUMBER(RC[-3]),ISNUMBER(RC[-1])),RC[-3]-RC[-1],"-") -> 26.080000000000005 | Q21: 9.3000000000000007 | R21: 0.80800000000000005 | S21: 2.8740000000000001 | T21: =(RC[-16]*RC[-15]-RC[-13]*RC[-12])/1000 -> 2.8728544999999994 | U21: 16.04 | V21: 7.14 | W21: =RC[-2]*RC[-10]/1000 -> 1.1176672000000001 | X21: =ABS((RC[-3]*RC[-11]-RC[-2]*RC[-9])/1000) -> 0.80636320000000017 | Y21: =(RC[-14]-RC[1])/RC[-18]*100 -> -2.4068322981366461 | Z21: 8.9 | AC21: =VALUE(RC[-27]) -> 2018-09-30T00:00:00.000 | AD21: =IF(RC[21]=42,"*",IF(RC[21]=32,"",RC[21])) -> - | AE21: =RC[-28] -> 24 | AF21: =RC[-28] -> 96.89 | AG21: =RC[-28] -> 69.849999999999994 | AH21: =RC[-28] -> 8.4700000000000006 | AI21: =RC[-28] -> 90.16 | AJ21: =RC[-28] -> 43.2 | AK21: =RC[-28] -> 5.17 | AL21: =RC[-28] -> 26.649999999999991 | AM21: =RC[-28] -> 6.73 | AN21: =RC[-28] -> 16.440000000000001 | AO21: =RC[-28] -> 69.680000000000007 | AP21: - | AQ21: =RC[-29] -> 7.14 | AR21: =RC[-29] -> 43.6 | AS21: - | AT21: =RC[-30] -> 26.080000000000005 | AU21: =RC[-30] -> 9.3000000000000007 | AV21: =RC[-30] -> 0.80800000000000005 | AW21: =RC[-30] -> 2.8740000000000001 | AY21: - | AZ21: - | BA21: -
A22: =IF(RC[1]="","",DATEVALUE(RC[1])) -> 43374 | B22: 01.10.18 | C22: 24 | D22: 96.93 | E22: 68.55 | F22: 8.5500000000000007 | G22: 90.8 | H22: 43.3 | I22: 5.23 | J22: =RC[-5]-RC[-2] -> 25.25 | K22: 6.13 | L22: 16.149999999999999 | M22: 68.14 | N22: 7.43 | O22: 44.26 | P22: =IF(AND(ISNUMBER(RC[-3]),ISNUMBER(RC[-1])),RC[-3]-RC[-1],"-") -> 23.880000000000003 | Q22: 8.7200000000000006 | R22: 0.747 | S22: 2.7170000000000001 | T22: =(RC[-16]*RC[-15]-RC[-13]*RC[-12])/1000 -> 2.712911500000001 | U22: 15.81 | V22: 7.43 | W22: =RC[-2]*RC[-10]/1000 -> 1.0772934000000001 | X22: =ABS((RC[-3]*RC[-11]-RC[-2]*RC[-9])/1000) -> 0.74844160000000015 | Y22: =(RC[-14]-RC[1])/RC[-18]*100 -> -2.4779735682819397 | Z22: 8.3800000000000008 | AC22: =VALUE(RC[-27]) -> 2018-10-01T00:00:00.000 | AD22: =IF(RC[21]=42,"*",IF(RC[21]=32,"",RC[21])) -> - | AE22: =RC[-28] -> 24 | AF22: =RC[-28] -> 96.93 | AG22: =RC[-28] -> 68.55 | AH22: =RC[-28] -> 8.5500000000000007 | AI22: =RC[-28] -> 90.8 | AJ22: =RC[-28] -> 43.3 | AK22: =RC[-28] -> 5.23 | AL22: =RC[-28] -> 25.25 | AM22: =RC[-28] -> 6.13 | AN22: =RC[-28] -> 16.149999999999999 | AO22: =RC[-28] -> 68.14 | AP22: - | AQ22: =RC[-29] -> 7.43 | AR22: =RC[-29] -> 44.26 | AS22: - | AT22: =RC[-30] -> 23.880000000000003 | AU22: =RC[-30] -> 8.7200000000000006 | AV22: =RC[-30] -> 0.747 | AW22: =RC[-30] -> 2.7170000000000001 | AY22: - | AZ22: - | BA22: -
A23: =IF(RC[1]="","",DATEVALUE(RC[1])) -> 43375 | B23: 02.10.18 | C23: 24 | D23: 93.11 | E23: 67.31 | F23: 8.26 | G23: 86.74 | H23: 42.28 | I23: 5.23 | J23: =RC[-5]-RC[-2] -> 25.03 | K23: 6.37 | L23: 16.14 | M23: 66.94 | N23: 7.21 | O23: 43.09 | P23: =IF(AND(ISNUMBER(RC[-3]),ISNUMBER(RC[-1])),RC[-3]-RC[-1],"-") -> 23.849999999999994 | Q23: 8.93 | R23: 0.747 | S23: 2.6019999999999999 | T23: =(RC[-16]*RC[-15]-RC[-13]*RC[-12])/1000 -> 2.5998669000000008 | U23: 15.81 | V23: 7.21 | W23: =RC[-2]*RC[-10]/1000 -> 1.0583214000000001 | X23: =ABS((RC[-3]*RC[-11]-RC[-2]*RC[-9])/1000) -> 0.74764249999999999 | Y23: =(RC[-14]-RC[1])/RC[-18]*100 -> -2.5709015448466679 | Z23: 8.6 | AC23: =VALUE(RC[-27]) -> 2018-10-02T00:00:00.000 | AD23: =IF(RC[21]=42,"*",IF(RC[21]=32,"",RC[21])) -> - | AE23: =RC[-28] -> 24 | AF23: =RC[-28] -> 93.11 | AG23: =RC[-28] -> 67.31 | AH23: =RC[-28] -> 8.26 | AI23: =RC[-28] -> 86.74 | AJ23: =RC[-28] -> 42.28 | AK23: =RC[-28] -> 5.23 | AL23: =RC[-28] -> 25.03 | AM23: =RC[-28] -> 6.37 | AN23: =RC[-28] -> 16.14 | AO23: =RC[-28] -> 66.94 | AP23: - | AQ23: =RC[-29] -> 7.21 | AR23: =RC[-29] -> 43.09 | AS23: - | AT23: =RC[-30] -> 23.849999999999994 | AU23: =RC[-30] -> 8.93 | AV23: =RC[-30] -> 0.747 | AW23: =RC[-30] -> 2.6019999999999999 | AY23: - | AZ23: - | BA23: -
A24: =IF(RC[1]="","",DATEVALUE(RC[1])) -> 43376 | B24: 03.10.18 | C24: 24 | D24: 90.67 | E24: 67.459999999999994 | F24: 8.23 | G24: 84.41 | H24: 41.94 | I24: 5.36 | J24: =RC[-5]-RC[-2] -> 25.519999999999996 | K24: 6.26 | L24: 15.79 | M24: 67.17 | N24: 7.12 | O24: 42.69 | P24: =IF(AND(ISNUMBER(RC[-3]),ISNUMBER(RC[-1])),RC[-3]-RC[-1],"-") -> 24.480000000000004 | Q24: 8.67 | R24: 0.73399999999999999 | S24: 2.5779999999999998 | T24: =(RC[-16]*RC[-15]-RC[-13]*RC[-12])/1000 -> 2.5764427999999997 | U24: 15.45 | V24: 7.12 | W24: =RC[-2]*RC[-10]/1000 -> 1.0377764999999999 | X24: =ABS((RC[-3]*RC[-11]-RC[-2]*RC[-9])/1000) -> 0.73382369999999997 | Y24: =(RC[-14]-RC[1])/RC[-18]*100 -> -2.4523160762942786 | Z24: 8.33 | AC24: =VALUE(RC[-27]) -> 2018-10-03T00:00:00.000 | AD24: =IF(RC[21]=42,"*",IF(RC[21]=32,"",RC[21])) -> - | AE24: =RC[-28] -> 24 | AF24: =RC[-28] -> 90.67 | AG24: =RC[-28] -> 67.459999999999994 | AH24: =RC[-28] -> 8.23 | AI24: =RC[-28] -> 84.41 | AJ24: =RC[-28] -> 41.94 | AK24: =RC[-28] -> 5.36 | AL24: =RC[-28] -> 25.519999999999996 | AM24: =RC[-28] -> 6.26 | AN24: =RC[-28] -> 15.79 | AO24: =RC[-28] -> 67.17 | AP24: - | AQ24: =RC[-29] -> 7.12 | AR24: =RC[-29] -> 42.69 | AS24: - | AT24: =RC[-30] -> 24.480000000000004 | AU24: =RC[-30] -> 8.67 | AV24: =RC[-30] -> 0.73399999999999999 | AW24: =RC[-30] -> 2.5779999999999998 | AY24: - | AZ24: - | BA24: -
A25: =IF(RC[1]="","",DATEVALUE(RC[1])) -> 43377 | B25: 04.10.18 | C25: 24 | D25: 86.35 | E25: 66.8 | F25: 8.0299999999999994 | G25: 79.44 | H25: 40.69 | I25: 5.47 | J25: =RC[-5]-RC[-2] -> 26.11 | K25: 6.91 | L25: 16.13 | M25: 66.44 | N25: 6.88 | O25: 42.2 | P25: =IF(AND(ISNUMBER(RC[-3]),ISNUMBER(RC[-1])),RC[-3]-RC[-1],"-") -> 24.239999999999995 | Q25: 9.25 | R25: 0.76200000000000001 | S25: 2.5379999999999998 | T25: =(RC[-16]*RC[-15]-RC[-13]*RC[-12])/1000 -> 2.5357663999999995 | U25: 15.81 | V25: 6.88 | W25: =RC[-2]*RC[-10]/1000 -> 1.0504164 | X25: =ABS((RC[-3]*RC[-11]-RC[-2]*RC[-9])/1000) -> 0.7600804000000001 | Y25: =(RC[-14]-RC[1])/RC[-18]*100 -> -2.5427995971802613 | Z25: 8.93 | AC25: =VALUE(RC[-27]) -> 2018-10-04T00:00:00.000 | AD25: =IF(RC[21]=42,"*",IF(RC[21]=32,"",RC[21])) -> - | AE25: =RC[-28] -> 24 | AF25: =RC[-28] -> 86.35 | AG25: =RC[-28] -> 66.8 | AH25: =RC[-28] -> 8.0299999999999994 | AI25: =RC[-28] -> 79.44 | AJ25: =RC[-28] -> 40.69 | AK25: =RC[-28] -> 5.47 | AL25: =RC[-28] -> 26.11 | AM25: =RC[-28] -> 6.91 | AN25: =RC[-28] -> 16.13 | AO25: =RC[-28] -> 66.44 | AP25: - | AQ25: =RC[-29] -> 6.88 | AR25: =RC[-29] -> 42.2 | AS25: - | AT25: =RC[-30] -> 24.239999999999995 | AU25: =RC[-30] -> 9.25 | AV25: =RC[-30] -> 0.76200000000000001 | AW25: =RC[-30] -> 2.5379999999999998 | AY25: - | AZ25: - | BA25: -
A26: =IF(RC[1]="","",DATEVALUE(RC[1])) -> 43378 | B26: 05.10.18 | C26: 24 | D26: 78.319999999999993 | E26: 66.09 | F26: 7.72 | G26: 72.48 | H26: 38.950000000000003 | I26: 5.59 | J26: =RC[-5]-RC[-2] -> 27.14 | K26: 5.84 | L26: 14.42 | M26: 65.72 | N26: 6.42 | O26: 40.49 | P26: =IF(AND(ISNUMBER(RC[-3]),ISNUMBER(RC[-1])),RC[-3]-RC[-1],"-") -> 25.229999999999997 | Q26: 8 | R26: 0.66900000000000004 | S26: 2.3519999999999999 | T26: =(RC[-16]*RC[-15]-RC[-13]*RC[-12])/1000 -> 2.3530727999999992 | U26: 14.15 | V26: 6.42 | W26: =RC[-2]*RC[-10]/1000 -> 0.92993800000000004 | X26: =ABS((RC[-3]*RC[-11]-RC[-2]*RC[-9])/1000) -> 0.66999219999999993 | Y26: =(RC[-14]-RC[1])/RC[-18]*100 -> -2.6076158940397356 | Z26: 7.73 | AC26: =VALUE(RC[-27]) -> 2018-10-05T00:00:00.000 | AD26: =IF(RC[21]=42,"*",IF(RC[21]=32,"",RC[21])) -> - | AE26: =RC[-28] -> 24 | AF26: =RC[-28] -> 78.319999999999993 | AG26: =RC[-28] -> 66.09 | AH26: =RC[-28] -> 7.72 | AI26: =RC[-28] -> 72.48 | AJ26: =RC[-28] -> 38.950000000000003 | AK26: =RC[-28] -> 5.59 | AL26: =RC[-28] -> 27.14 | AM26: =RC[-28] -> 5.84 | AN26: =RC[-28] -> 14.42 | AO26: =RC[-28] -> 65.72 | AP26: - | AQ26: =RC[-29] -> 6.42 | AR26: =RC[-29] -> 40.49 | AS26: - | AT26: =RC[-30] -> 25.229999999999997 | AU26: =RC[-30] -> 8 | AV26: =RC[-30] -> 0.66900000000000004 | AW26: =RC[-30] -> 2.3519999999999999 | AY26: - | AZ26: - | BA26: -
A27: =IF(RC[1]="","",DATEVALUE(RC[1])) -> 43379 | B27: 06.10.18 | C27: 24 | D27: 78.319999999999993 | E27: 66.77 | F27: 7.68 | G27: 73.23 | H27: 39.42 | I27: 5.52 | J27: =RC[-5]-RC[-2] -> 27.349999999999994 | K27: 5.09 | L27: 13.79 | M27: 66.45 | N27: 6.51 | O27: 40.54 | P27: =IF(AND(ISNUMBER(RC[-3]),ISNUMBER(RC[-1])),RC[-3]-RC[-1],"-") -> 25.910000000000004 | Q27: 7.28 | R27: 0.63200000000000001 | S27: 2.3420000000000001 | T27: =(RC[-16]*RC[-15]-RC[-13]*RC[-12])/1000 -> 2.3426997999999988 | U27: 13.5 | V27: 6.51 | W27: =RC[-2]*RC[-10]/1000 -> 0.89707500000000007 | X27: =ABS((RC[-3]*RC[-11]-RC[-2]*RC[-9])/1000) -> 0.63315960000000004 | Y27: =(RC[-14]-RC[1])/RC[-18]*100 -> -2.5945650689608089 | Z27: 6.99 | AC27: =VALUE(RC[-27]) -> 2018-10-06T00:00:00.000 | AD27: =IF(RC[21]=42,"*",IF(RC[21]=32,"",RC[21])) -> - | AE27: =RC[-28] -> 24 | AF27: =RC[-28] -> 78.319999999999993 | AG27: =RC[-28] -> 66.77 | AH27: =RC[-28] -> 7.68 | AI27: =RC[-28] -> 73.23 | AJ27: =RC[-28] -> 39.42 | AK27: =RC[-28] -> 5.52 | AL27: =RC[-28] -> 27.349999999999994 | AM27: =RC[-28] -> 5.09 | AN27: =RC[-28] -> 13.79 | AO27: =RC[-28] -> 66.45 | AP27: - | AQ27: =RC[-29] -> 6.51 | AR27: =RC[-29] -> 40.54 | AS27: - | AT27: =RC[-30] -> 25.910000000000004 | AU27: =RC[-30] -> 7.28 | AV27: =RC[-30] -> 0.63200000000000001 | AW27: =RC[-30] -> 2.3420000000000001 | AY27: - | AZ27: - | BA27: -
A28: =IF(RC[1]="","",DATEVALUE(RC[1])) -> 43380 | B28: 07.10.18 | C28: 24 | D28: 81.040000000000006 | E28: 67.02 | F28: 7.68 | G28: 73.11 | H28: 39.590000000000003 | I28: 5.54 | J28: =RC[-5]-RC[-2] -> 27.429999999999993 | K28: 7.93 | L28: 16.75 | M28: 66.72 | N28: 6.51 | O28: 41.83 | P28: =IF(AND(ISNUMBER(RC[-3]),ISNUMBER(RC[-1])),RC[-3]-RC[-1],"-") -> 24.89 | Q28: 10.24 | R28: 0.81799999999999995 | S28: 2.536 | T28: =(RC[-16]*RC[-15]-RC[-13]*RC[-12])/1000 -> 2.5368758999999996 | U28: 16.38 | V28: 6.51 | W28: =RC[-2]*RC[-10]/1000 -> 1.0928735999999999 | X28: =ABS((RC[-3]*RC[-11]-RC[-2]*RC[-9])/1000) -> 0.82056029999999991 | Y28: =(RC[-14]-RC[1])/RC[-18]*100 -> -2.6535357680207898 | Z28: 9.8699999999999992 | AC28: =VALUE(RC[-27]) -> 2018-10-07T00:00:00.000 | AD28: =IF(RC[21]=42,"*",IF(RC[21]=32,"",RC[21])) -> - | AE28: =RC[-28] -> 24 | AF28: =RC[-28] -> 81.040000000000006 | AG28: =RC[-28] -> 67.02 | AH28: =RC[-28] -> 7.68 | AI28: =RC[-28] -> 73.11 | AJ28: =RC[-28] -> 39.590000000000003 | AK28: =RC[-28] -> 5.54 | AL28: =RC[-28] -> 27.429999999999993 | AM28: =RC[-28] -> 7.93 | AN28: =RC[-28] -> 16.75 | AO28: =RC[-28] -> 66.72 | AP28: - | AQ28: =RC[-29] -> 6.51 | AR28: =RC[-29] -> 41.83 | AS28: - | AT28: =RC[-30] -> 24.89 | AU28: =RC[-30] -> 10.24 | AV28: =RC[-30] -> 0.81799999999999995 | AW28: =RC[-30] -> 2.536 | AY28: - | AZ28: - | BA28: -
A29: =IF(RC[1]="","",DATEVALUE(RC[1])) -> 43381 | B29: 08.10.18 | C29: 24 | D29: 80.209999999999994 | E29: 67.010000000000005 | F29: 7.64 | G29: 72.22 | H29: 39.06 | I29: 5.54 | J29: =RC[-5]-RC[-2] -> 27.950000000000003 | K29: 7.99 | L29: 16.72 | M29: 66.709999999999994 | N29: 6.44 | O29: 42.37 | P29: =IF(AND(ISNUMBER(RC[-3]),ISNUMBER(RC[-1])),RC[-3]-RC[-1],"-") -> 24.339999999999996 | Q29: 10.28 | R29: 0.82099999999999995 | S29: 2.556 | T29: =(RC[-16]*RC[-15]-RC[-13]*RC[-12])/1000 -> 2.5539588999999996 | U29: 16.38 | V29: 6.44 | W29: =RC[-2]*RC[-10]/1000 -> 1.0927098 | X29: =ABS((RC[-3]*RC[-11]-RC[-2]*RC[-9])/1000) -> 0.81984699999999988 | Y29: =(RC[-14]-RC[1])/RC[-18]*100 -> -2.7000830794793673 | Z29: 9.94 | AC29: =VALUE(RC[-27]) -> 2018-10-08T00:00:00.000 | AD29: =IF(RC[21]=42,"*",IF(RC[21]=32,"",RC[21])) -> - | AE29: =RC[-28] -> 24 | AF29: =RC[-28] -> 80.209999999999994 | AG29: =RC[-28] -> 67.010000000000005 | AH29: =RC[-28] -> 7.64 | AI29: =RC[-28] -> 72.22 | AJ29: =RC[-28] -> 39.06 | AK29: =RC[-28] -> 5.54 | AL29: =RC[-28] -> 27.950000000000003 | AM29: =RC[-28] -> 7.99 | AN29: =RC[-28] -> 16.72 | AO29: =RC[-28] -> 66.709999999999994 | AP29: - | AQ29: =RC[-29] -> 6.44 | AR29: =RC[-29] -> 42.37 | AS29: - | AT29: =RC[-30] -> 24.339999999999996 | AU29: =RC[-30] -> 10.28 | AV29: =RC[-30] -> 0.82099999999999995 | AW29: =RC[-30] -> 2.556 | AY29: - | AZ29: - | BA29: -
A30: =IF(RC[1]="","",DATEVALUE(RC[1])) -> 43382 | B30: 09.10.18 | C30: 24 | D30: 82.78 | E30: 66.89 | F30: 7.8 | G30: 74.87 | H30: 39.479999999999997 | I30: 5.55 | J30: =RC[-5]-RC[-2] -> 27.410000000000004 | K30: 7.91 | L30: 16.98 | M30: 66.66 | N30: 6.63 | O30: 42.89 | P30: =IF(AND(ISNUMBER(RC[-3]),ISNUMBER(RC[-1])),RC[-3]-RC[-1],"-") -> 23.769999999999996 | Q30: 10.35 | R30: 0.82499999999999996 | S30: 2.5819999999999999 | T30: =(RC[-16]*RC[-15]-RC[-13]*RC[-12])/1000 -> 2.5812865999999999 | U30: 16.64 | V30: 6.63 | W30: =RC[-2]*RC[-10]/1000 -> 1.1092223999999999 | X30: =ABS((RC[-3]*RC[-11]-RC[-2]*RC[-9])/1000) -> 0.82486169999999992 | Y30: =(RC[-14]-RC[1])/RC[-18]*100 -> -2.8048617603846662 | Z30: 10.01 | AC30: =VALUE(RC[-27]) -> 2018-10-09T00:00:00.000 | AD30: =IF(RC[21]=42,"*",IF(RC[21]=32,"",RC[21])) -> - | AE30: =RC[-28] -> 24 | AF30: =RC[-28] -> 82.78 | AG30: =RC[-28] -> 66.89 | AH30: =RC[-28] -> 7.8 | AI30: =RC[-28] -> 74.87 | AJ30: =RC[-28] -> 39.479999999999997 | AK30: =RC[-28] -> 5.55 | AL30: =RC[-28] -> 27.410000000000004 | AM30: =RC[-28] -> 7.91 | AN30: =RC[-28] -> 16.98 | AO30: =RC[-28] -> 66.66 | AP30: - | AQ30: =RC[-29] -> 6.63 | AR30: =RC[-29] -> 42.89 | AS30: - | AT30: =RC[-30] -> 23.769999999999996 | AU30: =RC[-30] -> 10.35 | AV30: =RC[-30] -> 0.82499999999999996 | AW30: =RC[-30] -> 2.5819999999999999 | AY30: - | AZ30: - | BA30: -
A31: =IF(RC[1]="","",DATEVALUE(RC[1])) -> 43383 | B31: 10.10.18 | C31: 24 | D31: 82.54 | E31: 67.91 | F31: 7.72 | G31: 75.12 | H31: 40.130000000000003 | I31: 5.46 | J31: =RC[-5]-RC[-2] -> 27.779999999999994 | K31: 7.42 | L31: 16.52 | M31: 67.66 | N31: 6.64 | O31: 43.2 | P31: =IF(AND(ISNUMBER(RC[-3]),ISNUMBER(RC[-1])),RC[-3]-RC[-1],"-") -> 24.459999999999994 | Q31: 9.8800000000000008 | R31: 0.80700000000000005 | S31: 2.59 | T31: =(RC[-16]*RC[-15]-RC[-13]*RC[-12])/1000 -> 2.5907257999999995 | U31: 16.170000000000002 | V31: 6.64 | W31: =RC[-2]*RC[-10]/1000 -> 1.0940622 | X31: =ABS((RC[-3]*RC[-11]-RC[-2]*RC[-9])/1000) -> 0.8072142000000001 | Y31: =(RC[-14]-RC[1])/RC[-18]*100 -> -2.8088391906283272 | Z31: 9.5299999999999994 | AC31: =VALUE(RC[-27]) -> 2018-10-10T00:00:00.000 | AD31: =IF(RC[21]=42,"*",IF(RC[21]=32,"",RC[21])) -> - | AE31: =RC[-28] -> 24 | AF31: =RC[-28] -> 82.54 | AG31: =RC[-28] -> 67.91 | AH31: =RC[-28] -> 7.72 | AI31: =RC[-28] -> 75.12 | AJ31: =RC[-28] -> 40.130000000000003 | AK31: =RC[-28] -> 5.46 | AL31: =RC[-28] -> 27.779999999999994 | AM31: =RC[-28] -> 7.42 | AN31: =RC[-28] -> 16.52 | AO31: =RC[-28] -> 67.66 | AP31: - | AQ31: =RC[-29] -> 6.64 | AR31: =RC[-29] -> 43.2 | AS31: - | AT31: =RC[-30] -> 24.459999999999994 | AU31: =RC[-30] -> 9.8800000000000008 | AV31: =RC[-30] -> 0.80700000000000005 | AW31: =RC[-30] -> 2.59 | AY31: - | AZ31: - | BA31: -
A32: =IF(RC[1]="","",DATEVALUE(RC[1])) -> 43384 | B32: 11.10.18 | C32: 24 | D32: 83.37 | E32: 69 | F32: 7.77 | G32: 77.14 | H32: 40.909999999999997 | I32: 5.37 | J32: =RC[-5]-RC[-2] -> 28.090000000000003 | K32: 6.23 | L32: 15.35 | M32: 68.650000000000006 | N32: 6.79 | O32: 42.64 | P32: =IF(AND(ISNUMBER(RC[-3]),ISNUMBER(RC[-1])),RC[-3]-RC[-1],"-") -> 26.010000000000005 | Q32: 8.56 | R32: 0.74 | S32: 2.597 | T32: =(RC[-16]*RC[-15]-RC[-13]*RC[-12])/1000 -> 2.5967326000000006 | U32: 15.02 | V32: 6.79 | W32: =RC[-2]*RC[-10]/1000 -> 1.031123 | X32: =ABS((RC[-3]*RC[-11]-RC[-2]*RC[-9])/1000) -> 0.74159740000000007 | Y32: =(RC[-14]-RC[1])/RC[-18]*100 -> -2.5926886180969664 | Z32: 8.23 | AC32: =VALUE(RC[-27]) -> 2018-10-11T00:00:00.000 | AD32: =IF(RC[21]=42,"*",IF(RC[21]=32,"",RC[21])) -> - | AE32: =RC[-28] -> 24 | AF32: =RC[-28] -> 83.37 | AG32: =RC[-28] -> 69 | AH32: =RC[-28] -> 7.77 | AI32: =RC[-28] -> 77.14 | AJ32: =RC[-28] -> 40.909999999999997 | AK32: =RC[-28] -> 5.37 | AL32: =RC[-28] -> 28.090000000000003 | AM32: =RC[-28] -> 6.23 | AN32: =RC[-28] -> 15.35 | AO32: =RC[-28] -> 68.650000000000006 | AP32: - | AQ32: =RC[-29] -> 6.79 | AR32: =RC[-29] -> 42.64 | AS32: - | AT32: =RC[-30] -> 26.010000000000005 | AU32: =RC[-30] -> 8.56 | AV32: =RC[-30] -> 0.74 | AW32: =RC[-30] -> 2.597 | AY32: - | AZ32: - | BA32: -
A33: =IF(RC[1]="","",DATEVALUE(RC[1])) -> 43385 | B33: 12.10.18 | C33: 24 | D33: 82.36 | E33: 68.83 | F33: 7.75 | G33: 76.12 | H33: 40.67 | I33: 5.42 | J33: =RC[-5]-RC[-2] -> 28.159999999999997 | K33: 6.24 | L33: 15.2 | M33: 68.45 | N33: 6.68 | O33: 42.39 | P33: =IF(AND(ISNUMBER(RC[-3]),ISNUMBER(RC[-1])),RC[-3]-RC[-1],"-") -> 26.060000000000002 | Q33: 8.52 | R33: 0.73299999999999998 | S33: 2.5739999999999998 | T33: =(RC[-16]*RC[-15]-RC[-13]*RC[-12])/1000 -> 2.5730383999999988 | U33: 14.86 | V33: 6.68 | W33: =RC[-2]*RC[-10]/1000 -> 1.0171669999999999 | X33: =ABS((RC[-3]*RC[-11]-RC[-2]*RC[-9])/1000) -> 0.73400180000000004 | Y33: =(RC[-14]-RC[1])/RC[-18]*100 -> -2.5486074619022587 | Z33: 8.18 | AC33: =VALUE(RC[-27]) -> 2018-10-12T00:00:00.000 | AD33: =IF(RC[21]=42,"*",IF(RC[21]=32,"",RC[21])) -> - | AE33: =RC[-28] -> 24 | AF33: =RC[-28] -> 82.36 | AG33: =RC[-28] -> 68.83 | AH33: =RC[-28] -> 7.75 | AI33: =RC[-28] -> 76.12 | AJ33: =RC[-28] -> 40.67 | AK33: =RC[-28] -> 5.42 | AL33: =RC[-28] -> 28.159999999999997 | AM33: =RC[-28] -> 6.24 | AN33: =RC[-28] -> 15.2 | AO33: =RC[-28] -> 68.45 | AP33: - | AQ33: =RC[-29] -> 6.68 | AR33: =RC[-29] -> 42.39 | AS33: - | AT33: =RC[-30] -> 26.060000000000002 | AU33: =RC[-30] -> 8.52 | AV33: =RC[-30] -> 0.73299999999999998 | AW33: =RC[-30] -> 2.5739999999999998 | AY33: - | AZ33: - | BA33: -
A34: =IF(RC[1]="","",DATEVALUE(RC[1])) -> 43386 | B34: 13.10.18 | C34: 24 | D34: 85.78 | E34: 70 | F34: 7.95 | G34: 79.680000000000007 | H34: 42.04 | I34: 5.39 | J34: =RC[-5]-RC[-2] -> 27.96 | K34: 6.1 | L34: 15.46 | M34: 69.680000000000007 | N34: 6.96 | O34: 43.39 | P34: =IF(AND(ISNUMBER(RC[-3]),ISNUMBER(RC[-1])),RC[-3]-RC[-1],"-") -> 26.290000000000006 | Q34: 8.5 | R34: 0.75 | S34: 2.6560000000000001 | T34: =(RC[-16]*RC[-15]-RC[-13]*RC[-12])/1000 -> 2.6548528 | U34: 15.11 | V34: 6.96 | W34: =RC[-2]*RC[-10]/1000 -> 1.0528648 | X34: =ABS((RC[-3]*RC[-11]-RC[-2]*RC[-9])/1000) -> 0.75087040000000005 | Y34: =(RC[-14]-RC[1])/RC[-18]*100 -> -2.5727911646586352 | Z34: 8.15 | AC34: =VALUE(RC[-27]) -> 2018-10-13T00:00:00.000 | AD34: =IF(RC[21]=42,"*",IF(RC[21]=32,"",RC[21])) -> - | AE34: =RC[-28] -> 24 | AF34: =RC[-28] -> 85.78 | AG34: =RC[-28] -> 70 | AH34: =RC[-28] -> 7.95 | AI34: =RC[-28] -> 79.680000000000007 | AJ34: =RC[-28] -> 42.04 | AK34: =RC[-28] -> 5.39 | AL34: =RC[-28] -> 27.96 | AM34: =RC[-28] -> 6.1 | AN34: =RC[-28] -> 15.46 | AO34: =RC[-28] -> 69.680000000000007 | AP34: - | AQ34: =RC[-29] -> 6.96 | AR34: =RC[-29] -> 43.39 | AS34: - | AT34: =RC[-30] -> 26.290000000000006 | AU34: =RC[-30] -> 8.5 | AV34: =RC[-30] -> 0.75 | AW34: =RC[-30] -> 2.6560000000000001 | AY34: - | AZ34: - | BA34: -
A35: =IF(RC[1]="","",DATEVALUE(RC[1])) -> 43387 | B35: 14.10.18 | C35: 24 | D35: 88.82 | E35: 70.78 | F35: 7.92 | G35: 80.66 | H35: 43.08 | I35: 5.3 | J35: =RC[-5]-RC[-2] -> 27.700000000000003 | K35: 8.16 | L35: 17.78 | M35: 70.55 | N35: 7.03 | O35: 45.14 | P35: =IF(AND(ISNUMBER(RC[-3]),ISNUMBER(RC[-1])),RC[-3]-RC[-1],"-") -> 25.409999999999997 | Q35: 10.75 | R35: 0.90500000000000003 | S35: 2.8130000000000002 | T35: =(RC[-16]*RC[-15]-RC[-13]*RC[-12])/1000 -> 2.8118467999999996 | U35: 17.38 | V35: 7.03 | W35: =RC[-2]*RC[-10]/1000 -> 1.2261589999999998 | X35: =ABS((RC[-3]*RC[-11]-RC[-2]*RC[-9])/1000) -> 0.90882479999999988 | Y35: =(RC[-14]-RC[1])/RC[-18]*100 -> -2.7151004215224392 | Z35: 10.35 | AC35: =VALUE(RC[-27]) -> 2018-10-14T00:00:00.000 | AD35: =IF(RC[21]=42,"*",IF(RC[21]=32,"",RC[21])) -> - | AE35: =RC[-28] -> 24 | AF35: =RC[-28] -> 88.82 | AG35: =RC[-28] -> 70.78 | AH35: =RC[-28] -> 7.92 | AI35: =RC[-28] -> 80.66 | AJ35: =RC[-28] -> 43.08 | AK35: =RC[-28] -> 5.3 | AL35: =RC[-28] -> 27.700000000000003 | AM35: =RC[-28] -> 8.16 | AN35: =RC[-28] -> 17.78 | AO35: =RC[-28] -> 70.55 | AP35: - | AQ35: =RC[-29] -> 7.03 | AR35: =RC[-29] -> 45.14 | AS35: - | AT35: =RC[-30] -> 25.409999999999997 | AU35: =RC[-30] -> 10.75 | AV35: =RC[-30] -> 0.90500000000000003 | AW35: =RC[-30] -> 2.8130000000000002 | AY35: - | AZ35: - | BA35: -
A36: =IF(RC[1]="","",DATEVALUE(RC[1])) -> 43388 | B36: 15.10.18 | C36: 24 | D36: 89.7 | E36: 70.209999999999994 | F36: 8.0399999999999991 | G36: 82.75 | H36: 43.52 | I36: 5.29 | J36: =RC[-5]-RC[-2] -> 26.689999999999991 | K36: 6.95 | L36: 16.75 | M36: 69.88 | N36: 7.17 | O36: 45.24 | P36: =IF(AND(ISNUMBER(RC[-3]),ISNUMBER(RC[-1])),RC[-3]-RC[-1],"-") -> 24.639999999999993 | Q36: 9.58 | R36: 0.82099999999999995 | S36: 2.698 | T36: =(RC[-16]*RC[-15]-RC[-13]*RC[-12])/1000 -> 2.6965569999999994 | U36: 16.38 | V36: 7.17 | W36: =RC[-2]*RC[-10]/1000 -> 1.1446343999999999 | X36: =ABS((RC[-3]*RC[-11]-RC[-2]*RC[-9])/1000) -> 0.82026359999999987 | Y36: =(RC[-14]-RC[1])/RC[-18]*100 -> -2.7311178247734147 | Z36: 9.2100000000000009 | AC36: =VALUE(RC[-27]) -> 2018-10-15T00:00:00.000 | AD36: =IF(RC[21]=42,"*",IF(RC[21]=32,"",RC[21])) -> - | AE36: =RC[-28] -> 24 | AF36: =RC[-28] -> 89.7 | AG36: =RC[-28] -> 70.209999999999994 | AH36: =RC[-28] -> 8.0399999999999991 | AI36: =RC[-28] -> 82.75 | AJ36: =RC[-28] -> 43.52 | AK36: =RC[-28] -> 5.29 | AL36: =RC[-28] -> 26.689999999999991 | AM36: =RC[-28] -> 6.95 | AN36: =RC[-28] -> 16.75 | AO36: =RC[-28] -> 69.88 | AP36: - | AQ36: =RC[-29] -> 7.17 | AR36: =RC[-29] -> 45.24 | AS36: - | AT36: =RC[-30] -> 24.639999999999993 | AU36: =RC[-30] -> 9.58 | AV36: =RC[-30] -> 0.82099999999999995 | AW36: =RC[-30] -> 2.698 | AY36: - | AZ36: - | BA36: -
A37: =IF(RC[1]="","",DATEVALUE(RC[1])) -> 43389 | B37: 16.10.18 | C37: 24 | D37: 89.23 | E37: 70.19 | F37: 7.99 | G37: 83.15 | H37: 43.69 | I37: 5.21 | J37: =RC[-5]-RC[-2] -> 26.5 | K37: 6.08 | L37: 15.93 | M37: 69.86 | N37: 7.2 | O37: 44.78 | P37: =IF(AND(ISNUMBER(RC[-3]),ISNUMBER(RC[-1])),RC[-3]-RC[-1],"-") -> 25.08 | Q37: 8.73 | R37: 0.76700000000000002 | S37: 2.6320000000000001 | T37: =(RC[-16]*RC[-15]-RC[-13]*RC[-12])/1000 -> 2.6302302000000006 | U37: 15.57 | V37: 7.2 | W37: =RC[-2]*RC[-10]/1000 -> 1.0877201999999999 | X37: =ABS((RC[-3]*RC[-11]-RC[-2]*RC[-9])/1000) -> 0.76530419999999999 | Y37: =(RC[-14]-RC[1])/RC[-18]*100 -> -2.7540589296452183 | Z37: 8.3699999999999992 | AC37: =VALUE(RC[-27]) -> 2018-10-16T00:00:00.000 | AD37: =IF(RC[21]=42,"*",IF(RC[21]=32,"",RC[21])) -> - | AE37: =RC[-28] -> 24 | AF37: =RC[-28] -> 89.23 | AG37: =RC[-28] -> 70.19 | AH37: =RC[-28] -> 7.99 | AI37: =RC[-28] -> 83.15 | AJ37: =RC[-28] -> 43.69 | AK37: =RC[-28] -> 5.21 | AL37: =RC[-28] -> 26.5 | AM37: =RC[-28] -> 6.08 | AN37: =RC[-28] -> 15.93 | AO37: =RC[-28] -> 69.86 | AP37: - | AQ37: =RC[-29] -> 7.2 | AR37: =RC[-29] -> 44.78 | AS37: - | AT37: =RC[-30] -> 25.08 | AU37: =RC[-30] -> 8.73 | AV37: =RC[-30] -> 0.76700000000000002 | AW37: =RC[-30] -> 2.6320000000000001 | AY37: - | AZ37: - | BA37: -
A38: =IF(RC[1]="","",DATEVALUE(RC[1])) -> 43390 | B38: 17.10.18 | C38: 24 | D38: 91.63 | E38: 70.45 | F38: 8.09 | G38: 84.66 | H38: 44.15 | I38: 5.21 | J38: =RC[-5]-RC[-2] -> 26.300000000000004 | K38: 6.97 | L38: 17.04 | M38: 70.180000000000007 | N38: 7.32 | O38: 45.06 | P38: =IF(AND(ISNUMBER(RC[-3]),ISNUMBER(RC[-1])),RC[-3]-RC[-1],"-") -> 25.120000000000005 | Q38: 9.7200000000000006 | R38: 0.83899999999999997 | S38: 2.7189999999999999 | T38: =(RC[-16]*RC[-15]-RC[-13]*RC[-12])/1000 -> 2.7175945000000001 | U38: 16.68 | V38: 7.32 | W38: =RC[-2]*RC[-10]/1000 -> 1.1706023999999999 | X38: =ABS((RC[-3]*RC[-11]-RC[-2]*RC[-9])/1000) -> 0.84076319999999993 | Y38: =(RC[-14]-RC[1])/RC[-18]*100 -> -2.8230569336168196 | Z38: 9.36 | AC38: =VALUE(RC[-27]) -> 2018-10-17T00:00:00.000 | AD38: =IF(RC[21]=42,"*",IF(RC[21]=32,"",RC[21])) -> - | AE38: =RC[-28] -> 24 | AF38: =RC[-28] -> 91.63 | AG38: =RC[-28] -> 70.45 | AH38: =RC[-28] -> 8.09 | AI38: =RC[-28] -> 84.66 | AJ38: =RC[-28] -> 44.15 | AK38: =RC[-28] -> 5.21 | AL38: =RC[-28] -> 26.300000000000004 | AM38: =RC[-28] -> 6.97 | AN38: =RC[-28] -> 17.04 | AO38: =RC[-28] -> 70.180000000000007 | AP38: - | AQ38: =RC[-29] -> 7.32 | AR38: =RC[-29] -> 45.06 | AS38: - | AT38: =RC[-30] -> 25.120000000000005 | AU38: =RC[-30] -> 9.7200000000000006 | AV38: =RC[-30] -> 0.83899999999999997 | AW38: =RC[-30] -> 2.7189999999999999 | AY38: - | AZ38: - | BA38: -
A39: =IF(RC[1]="","",DATEVALUE(RC[1])) -> 43391 | B39: 18.10.18 | C39: 24 | D39: 90.5 | E39: 70.91 | F39: 8.1300000000000008 | G39: 84.35 | H39: 44.31 | I39: 5.26 | J39: =RC[-5]-RC[-2] -> 26.599999999999994 | K39: 6.15 | L39: 16.07 | M39: 70.599999999999994 | N39: 7.19 | O39: 44.19 | P39: =IF(AND(ISNUMBER(RC[-3]),ISNUMBER(RC[-1])),RC[-3]-RC[-1],"-") -> 26.409999999999997 | Q39: 8.8800000000000008 | R39: 0.79 | S39: 2.6859999999999999 | T39: =(RC[-16]*RC[-15]-RC[-13]*RC[-12])/1000 -> 2.6798064999999998 | U39: 15.71 | V39: 7.19 | W39: =RC[-2]*RC[-10]/1000 -> 1.1091260000000001 | X39: =ABS((RC[-3]*RC[-11]-RC[-2]*RC[-9])/1000) -> 0.79139990000000004 | Y39: =(RC[-14]-RC[1])/RC[-18]*100 -> -2.8097213989330165 | Z39: 8.52 | AC39: =VALUE(RC[-27]) -> 2018-10-18T00:00:00.000 | AD39: =IF(RC[21]=42,"*",IF(RC[21]=32,"",RC[21])) -> - | AE39: =RC[-28] -> 24 | AF39: =RC[-28] -> 90.5 | AG39: =RC[-28] -> 70.91 | AH39: =RC[-28] -> 8.1300000000000008 | AI39: =RC[-28] -> 84.35 | AJ39: =RC[-28] -> 44.31 | AK39: =RC[-28] -> 5.26 | AL39: =RC[-28] -> 26.599999999999994 | AM39: =RC[-28] -> 6.15 | AN39: =RC[-28] -> 16.07 | AO39: =RC[-28] -> 70.599999999999994 | AP39: - | AQ39: =RC[-29] -> 7.19 | AR39: =RC[-29] -> 44.19 | AS39: - | AT39: =RC[-30] -> 26.409999999999997 | AU39: =RC[-30] -> 8.8800000000000008 | AV39: =RC[-30] -> 0.79 | AW39: =RC[-30] -> 2.6859999999999999 | AY39: - | AZ39: - | BA39: -
A40: =IF(RC[1]="","",DATEVALUE(RC[1])) -> 43392 | B40: 19.10.18 | C40: 24 | D40: 89.47 | E40: 70.73 | F40: 8.1199999999999992 | G40: 83.91 | H40: 43.93 | I40: 5.26 | J40: =RC[-5]-RC[-2] -> 26.800000000000004 | K40: 5.56 | L40: 15.03 | M40: 70.31 | N40: 6.8 | O40: 43.15 | P40: =IF(AND(ISNUMBER(RC[-3]),ISNUMBER(RC[-1])),RC[-3]-RC[-1],"-") -> 27.160000000000004 | Q40: 8.23 | R40: 0.74199999999999999 | S40: 2.6459999999999999 | T40: =(RC[-16]*RC[-15]-RC[-13]*RC[-12])/1000 -> 2.6420468000000001 | U40: 14.72 | V40: 6.8 | W40: =RC[-2]*RC[-10]/1000 -> 1.0349632000000002 | X40: =ABS((RC[-3]*RC[-11]-RC[-2]*RC[-9])/1000) -> 0.74154320000000018 | Y40: =(RC[-14]-RC[1])/RC[-18]*100 -> -2.8125372422833994 | Z40: 7.92 | AC40: =VALUE(RC[-27]) -> 2018-10-19T00:00:00.000 | AD40: =IF(RC[21]=42,"*",IF(RC[21]=32,"",RC[21])) -> - | AE40: =RC[-28] -> 24 | AF40: =RC[-28] -> 89.47 | AG40: =RC[-28] -> 70.73 | AH40: =RC[-28] -> 8.1199999999999992 | AI40: =RC[-28] -> 83.91 | AJ40: =RC[-28] -> 43.93 | AK40: =RC[-28] -> 5.26 | AL40: =RC[-28] -> 26.800000000000004 | AM40: =RC[-28] -> 5.56 | AN40: =RC[-28] -> 15.03 | AO40: =RC[-28] -> 70.31 | AP40: - | AQ40: =RC[-29] -> 6.8 | AR40: =RC[-29] -> 43.15 | AS40: - | AT40: =RC[-30] -> 27.160000000000004 | AU40: =RC[-30] -> 8.23 | AV40: =RC[-30] -> 0.74199999999999999 | AW40: =RC[-30] -> 2.6459999999999999 | AY40: - | AZ40: - | BA40: -
A41: =IF(RC[1]="","",DATEVALUE(RC[1])) -> 43393 | B41: 20.10.18 | C41: 24 | D41: 86.76 | E41: 69.959999999999994 | F41: 7.96 | G41: 80.23 | H41: 42.86 | I41: 5.34 | J41: =RC[-5]-RC[-2] -> 27.099999999999994 | K41: 6.53 | L41: 15.64 | M41: 69.69 | N41: 6.51 | O41: 43.49 | P41: =IF(AND(ISNUMBER(RC[-3]),ISNUMBER(RC[-1])),RC[-3]-RC[-1],"-") -> 26.199999999999996 | Q41: 9.1300000000000008 | R41: 0.78400000000000003 | S41: 2.633 | T41: =(RC[-16]*RC[-15]-RC[-13]*RC[-12])/1000 -> 2.6310717999999995 | U41: 15.3 | V41: 6.51 | W41: =RC[-2]*RC[-10]/1000 -> 1.066257 | X41: =ABS((RC[-3]*RC[-11]-RC[-2]*RC[-9])/1000) -> 0.78313710000000003 | Y41: =(RC[-14]-RC[1])/RC[-18]*100 -> -2.8169014084507027 | Z41: 8.7899999999999991 | AC41: =VALUE(RC[-27]) -> 2018-10-20T00:00:00.000 | AD41: =IF(RC[21]=42,"*",IF(RC[21]=32,"",RC[21])) -> - | AE41: =RC[-28] -> 24 | AF41: =RC[-28] -> 86.76 | AG41: =RC[-28] -> 69.959999999999994 | AH41: =RC[-28] -> 7.96 | AI41: =RC[-28] -> 80.23 | AJ41: =RC[-28] -> 42.86 | AK41: =RC[-28] -> 5.34 | AL41: =RC[-28] -> 27.099999999999994 | AM41: =RC[-28] -> 6.53 | AN41: =RC[-28] -> 15.64 | AO41: =RC[-28] -> 69.69 | AP41: - | AQ41: =RC[-29] -> 6.51 | AR41: =RC[-29] -> 43.49 | AS41: - | AT41: =RC[-30] -> 26.199999999999996 | AU41: =RC[-30] -> 9.1300000000000008 | AV41: =RC[-30] -> 0.78400000000000003 | AW41: =RC[-30] -> 2.633 | AY41: - | AZ41: - | BA41: -
A42: =IF(RC[1]="","",DATEVALUE(RC[1])) -> 43394 | B42: 21.10.18 | C42: 24 | D42: 88.03 | E42: 69.16 | F42: 7.97 | G42: 79.98 | H42: 42.49 | I42: 5.36 | J42: =RC[-5]-RC[-2] -> 26.669999999999995 | K42: 8.0500000000000007 | L42: 17.23 | M42: 68.89 | N42: 6.5 | O42: 43.77 | P42: =IF(AND(ISNUMBER(RC[-3]),ISNUMBER(RC[-1])),RC[-3]-RC[-1],"-") -> 25.119999999999997 | Q42: 10.73 | R42: 0.875 | S42: 2.6909999999999998 | T42: =(RC[-16]*RC[-15]-RC[-13]*RC[-12])/1000 -> 2.6898045999999991 | U42: 16.84 | V42: 6.5 | W42: =RC[-2]*RC[-10]/1000 -> 1.1601076000000001 | X42: =ABS((RC[-3]*RC[-11]-RC[-2]*RC[-9])/1000) -> 0.87560260000000001 | Y42: =(RC[-14]-RC[1])/RC[-18]*100 -> -2.8632158039509865 | Z42: 10.34 | AC42: =VALUE(RC[-27]) -> 2018-10-21T00:00:00.000 | AD42: =IF(RC[21]=42,"*",IF(RC[21]=32,"",RC[21])) -> - | AE42: =RC[-28] -> 24 | AF42: =RC[-28] -> 88.03 | AG42: =RC[-28] -> 69.16 | AH42: =RC[-28] -> 7.97 | AI42: =RC[-28] -> 79.98 | AJ42: =RC[-28] -> 42.49 | AK42: =RC[-28] -> 5.36 | AL42: =RC[-28] -> 26.669999999999995 | AM42: =RC[-28] -> 8.0500000000000007 | AN42: =RC[-28] -> 17.23 | AO42: =RC[-28] -> 68.89 | AP42: - | AQ42: =RC[-29] -> 6.5 | AR42: =RC[-29] -> 43.77 | AS42: - | AT42: =RC[-30] -> 25.119999999999997 | AU42: =RC[-30] -> 10.73 | AV42: =RC[-30] -> 0.875 | AW42: =RC[-30] -> 2.6909999999999998 | AY42: - | AZ42: - | BA42: -
A43: =IF(RC[1]="","",DATEVALUE(RC[1])) -> 43395 | B43: 22.10.18 | C43: 24 | D43: 85.05 | E43: 69.650000000000006 | F43: 7.95 | G43: 79.06 | H43: 42.15 | I43: 5.39 | J43: =RC[-5]-RC[-2] -> 27.500000000000007 | K43: 5.99 | L43: 14.96 | M43: 69.37 | N43: 6.45 | O43: 42.87 | P43: =IF(AND(ISNUMBER(RC[-3]),ISNUMBER(RC[-1])),RC[-3]-RC[-1],"-") -> 26.500000000000007 | Q43: 8.51 | R43: 0.74099999999999999 | S43: 2.5910000000000002 | T43: =(RC[-16]*RC[-15]-RC[-13]*RC[-12])/1000 -> 2.5913535000000003 | U43: 14.64 | V43: 6.45 | W43: =RC[-2]*RC[-10]/1000 -> 1.0155768000000001 | X43: =ABS((RC[-3]*RC[-11]-RC[-2]*RC[-9])/1000) -> 0.73906530000000026 | Y43: =(RC[-14]-RC[1])/RC[-18]*100 -> -2.7826966860612186 | Z43: 8.19 | AC43: =VALUE(RC[-27]) -> 2018-10-22T00:00:00.000 | AD43: =IF(RC[21]=42,"*",IF(RC[21]=32,"",RC[21])) -> - | AE43: =RC[-28] -> 24 | AF43: =RC[-28] -> 85.05 | AG43: =RC[-28] -> 69.650000000000006 | AH43: =RC[-28] -> 7.95 | AI43: =RC[-28] -> 79.06 | AJ43: =RC[-28] -> 42.15 | AK43: =RC[-28] -> 5.39 | AL43: =RC[-28] -> 27.500000000000007 | AM43: =RC[-28] -> 5.99 | AN43: =RC[-28] -> 14.96 | AO43: =RC[-28] -> 69.37 | AP43: - | AQ43: =RC[-29] -> 6.45 | AR43: =RC[-29] -> 42.87 | AS43: - | AT43: =RC[-30] -> 26.500000000000007 | AU43: =RC[-30] -> 8.51 | AV43: =RC[-30] -> 0.74099999999999999 | AW43: =RC[-30] -> 2.5910000000000002 | AY43: - | AZ43: - | BA43: -
A44: =IF(RC[1]="","",DATEVALUE(RC[1])) ->  | C44: 24 | J44: =RC[-5]-RC[-2] -> #VALUE! | P44: =IF(AND(ISNUMBER(RC[-3]),ISNUMBER(RC[-1])),RC[-3]-RC[-1],"-") -> - | T44: =(RC[-16]*RC[-15]-RC[-13]*RC[-12])/1000 -> #VALUE! | W44: =RC[-2]*RC[-10]/1000 -> #VALUE! | X44: =ABS((RC[-3]*RC[-11]-RC[-2]*RC[-9])/1000) -> #VALUE! | Y44: =(RC[-14]-RC[1])/RC[-18]*100 -> #VALUE! | AC44: =VALUE(RC[-27]) -> #VALUE! | AD44: =IF(RC[21]=42,"*",IF(RC[21]=32,"",RC[21])) ->  | AE44: =RC[-28] -> 24 | AF44: =RC[-28] ->  | AG44: =RC[-28] ->  | AH44: =RC[-28] ->  | AI44: =RC[-28] ->  | AJ44: =RC[-28] ->  | AK44: =RC[-28] ->  | AL44: =RC[-28] -> #VALUE! | AM44: =RC[-28] ->  | AN44: =RC[-28] ->  | AO44: =RC[-28] ->  | AP44: - | AQ44: =RC[-29] ->  | AR44: =RC[-29] ->  | AS44: - | AT44: =RC[-30] -> - | AU44: =RC[-30] ->  | AV44: =RC[-30] ->  | AW44: =RC[-30] -> 
A45: =IF(RC[1]="","",DATEVALUE(RC[1])) ->  | C45: 24 | P45: =IF(AND(ISNUMBER(RC[-3]),ISNUMBER(RC[-1])),RC[-3]-RC[-1],"-") -> - | T45: =(RC[-16]*RC[-15]-RC[-13]*RC[-12])/1000 -> #VALUE! | W45: =RC[-2]*RC[-10]/1000 -> #VALUE! | X45: =ABS((RC[-3]*RC[-11]-RC[-2]*RC[-9])/1000) -> #VALUE! | Y45: =(RC[-14]-RC[1])/RC[-18]*100 -> #VALUE! | AC45: =VALUE(RC[-27]) -> #VALUE! | AD45: =IF(RC[21]=42,"*",IF(RC[21]=32,"",RC[21])) ->  | AE45: =RC[-28] -> 24 | AF45: =RC[-28] ->  | AG45: =RC[-28] ->  | AH45: =RC[-28] ->  | AI45: =RC[-28] ->  | AJ45: =RC[-28] ->  | AK45: =RC[-28] ->  | AL45: =RC[-28] -> 0 | AM45: =RC[-28] ->  | AN45: =RC[-28] ->  | AO45: =RC[-28] ->  | AP45: - | AQ45: =RC[-29] ->  | AR45: =RC[-29] ->  | AS45: - | AT45: =RC[-30] -> - | AU45: =RC[-30] ->  | AV45: =RC[-30] ->  | AW45: =RC[-30] -> 
A46: =IF(RC[1]="","",DATEVALUE(RC[1])) ->  | C46: 24 | P46: =IF(AND(ISNUMBER(RC[-3]),ISNUMBER(RC[-1])),RC[-3]-RC[-1],"-") -> - | T46: =(RC[-16]*RC[-15]-RC[-13]*RC[-12])/1000 -> #VALUE! | W46: =RC[-2]*RC[-10]/1000 -> #VALUE! | X46: =ABS((RC[-3]*RC[-11]-RC[-2]*RC[-9])/1000) -> #VALUE! | Y46: =(RC[-14]-RC[1])/RC[-18]*100 -> #VALUE! | AC46: =VALUE(RC[-27]) -> #VALUE! | AD46: =IF(RC[21]=42,"*",IF(RC[21]=32,"",RC[21])) ->  | AE46: =RC[-28] -> 24 | AF46: =RC[-28] ->  | AG46: =RC[-28] ->  | AH46: =RC[-28] ->  | AI46: =RC[-28] ->  | AJ46: =RC[-28] ->  | AK46: =RC[-28] ->  | AL46: =RC[-28] -> 0 | AM46: =RC[-28] ->  | AN46: =RC[-28] ->  | AO46: =RC[-28] ->  | AP46: - | AQ46: =RC[-29] ->  | AR46: =RC[-29] ->  | AS46: - | AT46: =RC[-30] -> - | AU46: =RC[-30] ->  | AV46: =RC[-30] ->  | AW46: =RC[-30] -> 
A47: =IF(RC[1]="","",DATEVALUE(RC[1])) ->  | C47: 24 | P47: =IF(AND(ISNUMBER(RC[-3]),ISNUMBER(RC[-1])),RC[-3]-RC[-1],"-") -> - | T47: =(RC[-16]*RC[-15]-RC[-13]*RC[-12])/1000 -> #VALUE! | W47: =RC[-2]*RC[-10]/1000 -> #VALUE! | X47: =ABS((RC[-3]*RC[-11]-RC[-2]*RC[-9])/1000) -> #VALUE! | Y47: =(RC[-14]-RC[1])/RC[-18]*100 -> #VALUE! | AC47: =VALUE(RC[-27]) -> #VALUE! | AD47: =IF(RC[21]=42,"*",IF(RC[21]=32,"",RC[21])) ->  | AE47: =RC[-28] -> 24 | AF47: =RC[-28] ->  | AG47: =RC[-28] ->  | AH47: =RC[-28] ->  | AI47: =RC[-28] ->  | AJ47: =RC[-28] ->  | AK47: =RC[-28] ->  | AL47: =RC[-28] -> 0 | AM47: =RC[-28] ->  | AN47: =RC[-28] ->  | AO47: =RC[-28] ->  | AP47: - | AQ47: =RC[-29] ->  | AR47: =RC[-29] ->  | AS47: - | AT47: =RC[-30] -> - | AU47: =RC[-30] ->  | AV47: =RC[-30] ->  | AW47: =RC[-30] -> 
A48: =IF(RC[1]="","",DATEVALUE(RC[1])) ->  | C48: 24 | P48: =IF(AND(ISNUMBER(RC[-3]),ISNUMBER(RC[-1])),RC[-3]-RC[-1],"-") -> - | T48: =(RC[-16]*RC[-15]-RC[-13]*RC[-12])/1000 -> #VALUE! | W48: =RC[-2]*RC[-10]/1000 -> #VALUE! | X48: =ABS((RC[-3]*RC[-11]-RC[-2]*RC[-9])/1000) -> #VALUE! | Y48: =(RC[-14]-RC[1])/RC[-18]*100 -> #VALUE! | AC48: =VALUE(RC[-27]) -> #VALUE! | AD48: =IF(RC[21]=42,"*",IF(RC[21]=32,"",RC[21])) ->  | AE48: =RC[-28] -> 24 | AF48: =RC[-28] ->  | AG48: =RC[-28] ->  | AH48: =RC[-28] ->  | AI48: =RC[-28] ->  | AJ48: =RC[-28] ->  | AK48: =RC[-28] ->  | AL48: =RC[-28] -> 0 | AM48: =RC[-28] ->  | AN48: =RC[-28] ->  | AO48: =RC[-28] ->  | AP48: - | AQ48: =RC[-29] ->  | AR48: =RC[-29] ->  | AS48: - | AT48: =RC[-30] -> - | AU48: =RC[-30] ->  | AV48: =RC[-30] ->  | AW48: =RC[-30] -> 
A49: =IF(RC[1]="","",DATEVALUE(RC[1])) ->  | C49: 24 | P49: =IF(AND(ISNUMBER(RC[-3]),ISNUMBER(RC[-1])),RC[-3]-RC[-1],"-") -> - | T49: =(RC[-16]*RC[-15]-RC[-13]*RC[-12])/1000 -> #VALUE! | W49: =RC[-2]*RC[-10]/1000 -> #VALUE! | X49: =ABS((RC[-3]*RC[-11]-RC[-2]*RC[-9])/1000) -> #VALUE! | Y49: =(RC[-14]-RC[1])/RC[-18]*100 -> #VALUE! | AC49: =VALUE(RC[-27]) -> #VALUE! | AD49: =IF(RC[21]=42,"*",IF(RC[21]=32,"",RC[21])) ->  | AE49: =RC[-28] -> 24 | AF49: =RC[-28] ->  | AG49: =RC[-28] ->  | AH49: =RC[-28] ->  | AI49: =RC[-28] ->  | AJ49: =RC[-28] ->  | AK49: =RC[-28] ->  | AL49: =RC[-28] -> 0 | AM49: =RC[-28] ->  | AN49: =RC[-28] ->  | AO49: =RC[-28] ->  | AP49: - | AQ49: =RC[-29] ->  | AR49: =RC[-29] ->  | AS49: - | AT49: =RC[-30] -> - | AU49: =RC[-30] ->  | AV49: =RC[-30] ->  | AW49: =RC[-30] -> 
A50: =IF(RC[1]="","",DATEVALUE(RC[1])) ->  | P50: =IF(AND(ISNUMBER(RC[-3]),ISNUMBER(RC[-1])),RC[-3]-RC[-1],"-") -> - | T50: =(RC[-16]*RC[-15]-RC[-13]*RC[-12])/1000 -> #VALUE! | W50: =RC[-2]*RC[-10]/1000 -> #VALUE! | X50: =ABS((RC[-3]*RC[-11]-RC[-2]*RC[-9])/1000) -> #VALUE! | Y50: =(RC[-14]-RC[1])/RC[-18]*100 -> #VALUE! | AC50: =VALUE(RC[-27]) -> #VALUE! | AD50: =IF(RC[21]=42,"*",IF(RC[21]=32,"",RC[21])) ->  | AE50: =RC[-28] ->  | AF50: =RC[-28] ->  | AG50: =RC[-28] ->  | AH50: =RC[-28] ->  | AI50: =RC[-28] ->  | AJ50: =RC[-28] ->  | AK50: =RC[-28] ->  | AL50: =RC[-28] -> 0 | AM50: =RC[-28] ->  | AN50: =RC[-28] ->  | AO50: =RC[-28] ->  | AP50: - | AQ50: =RC[-29] ->  | AR50: =RC[-29] ->  | AS50: - | AT50: =RC[-30] -> - | AU50: =RC[-30] ->  | AV50: =RC[-30] ->  | AW50: =RC[-30] -> 
A51: =IF(RC[1]="","",DATEVALUE(RC[1])) ->  | P51: =IF(AND(ISNUMBER(RC[-3]),ISNUMBER(RC[-1])),RC[-3]-RC[-1],"-") -> - | T51: =(RC[-16]*RC[-15]-RC[-13]*RC[-12])/1000 -> #VALUE! | W51: =RC[-2]*RC[-10]/1000 -> #VALUE! | X51: =ABS((RC[-3]*RC[-11]-RC[-2]*RC[-9])/1000) -> #VALUE! | Y51: =(RC[-14]-RC[1])/RC[-18]*100 -> #VALUE! | AC51: =VALUE(RC[-27]) -> #VALUE! | AD51: =IF(RC[21]=42,"*",IF(RC[21]=32,"",RC[21])) ->  | AE51: =RC[-28] ->  | AF51: =RC[-28] ->  | AG51: =RC[-28] ->  | AH51: =RC[-28] ->  | AI51: =RC[-28] ->  | AJ51: =RC[-28] ->  | AK51: =RC[-28] ->  | AL51: =RC[-28] -> 0 | AM51: =RC[-28] ->  | AN51: =RC[-28] ->  | AO51: =RC[-28] ->  | AP51: - | AQ51: =RC[-29] ->  | AR51: =RC[-29] ->  | AS51: - | AT51: =RC[-30] -> - | AU51: =RC[-30] ->  | AV51: =RC[-30] ->  | AW51: =RC[-30] -> 
A52: =IF(RC[1]="","",DATEVALUE(RC[1])) ->  | P52: =IF(AND(ISNUMBER(RC[-3]),ISNUMBER(RC[-1])),RC[-3]-RC[-1],"-") -> - | T52: =(RC[-16]*RC[-15]-RC[-13]*RC[-12])/1000 -> #VALUE! | W52: =RC[-2]*RC[-10]/1000 -> #VALUE! | X52: =ABS((RC[-3]*RC[-11]-RC[-2]*RC[-9])/1000) -> #VALUE! | Y52: =(RC[-14]-RC[1])/RC[-18]*100 -> #VALUE! | AC52: =VALUE(RC[-27]) -> #VALUE! | AD52: =IF(RC[21]=42,"*",IF(RC[21]=32,"",RC[21])) ->  | AE52: =RC[-28] ->  | AF52: =RC[-28] ->  | AG52: =RC[-28] ->  | AH52: =RC[-28] ->  | AI52: =RC[-28] ->  | AJ52: =RC[-28] ->  | AK52: =RC[-28] ->  | AL52: =RC[-28] -> 0 | AM52: =RC[-28] ->  | AN52: =RC[-28] ->  | AO52: =RC[-28] ->  | AP52: - | AQ52: =RC[-29] ->  | AR52: =RC[-29] ->  | AS52: - | AT52: =RC[-30] -> - | AU52: =RC[-30] ->  | AV52: =RC[-30] ->  | AW52: =RC[-30] -> 
A53: =IF(RC[1]="","",DATEVALUE(RC[1])) ->  | P53: =IF(AND(ISNUMBER(RC[-3]),ISNUMBER(RC[-1])),RC[-3]-RC[-1],"-") -> - | T53: =(RC[-16]*RC[-15]-RC[-13]*RC[-12])/1000 -> #VALUE! | W53: =RC[-2]*RC[-10]/1000 -> #VALUE! | X53: =ABS((RC[-3]*RC[-11]-RC[-2]*RC[-9])/1000) -> #VALUE! | Y53: =(RC[-14]-RC[1])/RC[-18]*100 -> #VALUE! | AC53: =VALUE(RC[-27]) -> #VALUE! | AD53: =IF(RC[21]=42,"*",IF(RC[21]=32,"",RC[21])) ->  | AE53: =RC[-28] ->  | AF53: =RC[-28] ->  | AG53: =RC[-28] ->  | AH53: =RC[-28] ->  | AI53: =RC[-28] ->  | AJ53: =RC[-28] ->  | AK53: =RC[-28] ->  | AL53: =RC[-28] -> 0 | AM53: =RC[-28] ->  | AN53: =RC[-28] ->  | AO53: =RC[-28] ->  | AP53: - | AQ53: =RC[-29] ->  | AR53: =RC[-29] ->  | AS53: - | AT53: =RC[-30] -> - | AU53: =RC[-30] ->  | AV53: =RC[-30] ->  | AW53: =RC[-30] -> 
A54: =IF(RC[1]="","",DATEVALUE(RC[1])) ->  | P54: =IF(AND(ISNUMBER(RC[-3]),ISNUMBER(RC[-1])),RC[-3]-RC[-1],"-") -> - | T54: =(RC[-16]*RC[-15]-RC[-13]*RC[-12])/1000 -> #VALUE! | W54: =RC[-2]*RC[-10]/1000 -> #VALUE! | X54: =ABS((RC[-3]*RC[-11]-RC[-2]*RC[-9])/1000) -> #VALUE! | Y54: =(RC[-14]-RC[1])/RC[-18]*100 -> #VALUE! | AC54: =VALUE(RC[-27]) -> #VALUE! | AD54: =IF(RC[21]=42,"*",IF(RC[21]=32,"",RC[21])) ->  | AE54: =RC[-28] ->  | AF54: =RC[-28] ->  | AG54: =RC[-28] ->  | AH54: =RC[-28] ->  | AI54: =RC[-28] ->  | AJ54: =RC[-28] ->  | AK54: =RC[-28] ->  | AL54: =RC[-28] -> 0 | AM54: =RC[-28] ->  | AN54: =RC[-28] ->  | AO54: =RC[-28] ->  | AP54: - | AQ54: =RC[-29] ->  | AR54: =RC[-29] ->  | AS54: - | AT54: =RC[-30] -> - | AU54: =RC[-30] ->  | AV54: =RC[-30] ->  | AW54: =RC[-30] -> 
A55: =IF(RC[1]="","",DATEVALUE(RC[1])) ->  | P55: =IF(AND(ISNUMBER(RC[-3]),ISNUMBER(RC[-1])),RC[-3]-RC[-1],"-") -> - | T55: =(RC[-16]*RC[-15]-RC[-13]*RC[-12])/1000 -> #VALUE! | W55: =RC[-2]*RC[-10]/1000 -> #VALUE! | X55: =ABS((RC[-3]*RC[-11]-RC[-2]*RC[-9])/1000) -> #VALUE! | Y55: =(RC[-14]-RC[1])/RC[-18]*100 -> #VALUE! | AC55: =VALUE(RC[-27]) -> #VALUE! | AD55: =IF(RC[21]=42,"*",IF(RC[21]=32,"",RC[21])) ->  | AE55: =RC[-28] ->  | AF55: =RC[-28] ->  | AG55: =RC[-28] ->  | AH55: =RC[-28] ->  | AI55: =RC[-28] ->  | AJ55: =RC[-28] ->  | AK55: =RC[-28] ->  | AL55: =RC[-28] -> 0 | AM55: =RC[-28] ->  | AN55: =RC[-28] ->  | AO55: =RC[-28] ->  | AP55: - | AQ55: =RC[-29] ->  | AR55: =RC[-29] ->  | AS55: - | AT55: =RC[-30] -> - | AU55: =RC[-30] ->  | AV55: =RC[-30] ->  | AW55: =RC[-30] -> 
A56: =IF(RC[1]="","",DATEVALUE(RC[1])) ->  | P56: =IF(AND(ISNUMBER(RC[-3]),ISNUMBER(RC[-1])),RC[-3]-RC[-1],"-") -> - | T56: =(RC[-16]*RC[-15]-RC[-13]*RC[-12])/1000 -> #VALUE! | W56: =RC[-2]*RC[-10]/1000 -> #VALUE! | X56: =ABS((RC[-3]*RC[-11]-RC[-2]*RC[-9])/1000) -> #VALUE! | Y56: =(RC[-14]-RC[1])/RC[-18]*100 -> #VALUE! | AC56: =VALUE(RC[-27]) -> #VALUE! | AD56: =IF(RC[21]=42,"*",IF(RC[21]=32,"",RC[21])) ->  | AE56: =RC[-28] ->  | AF56: =RC[-28] ->  | AG56: =RC[-28] ->  | AH56: =RC[-28] ->  | AI56: =RC[-28] ->  | AJ56: =RC[-28] ->  | AK56: =RC[-28] ->  | AL56: =RC[-28] -> 0 | AM56: =RC[-28] ->  | AN56: =RC[-28] ->  | AO56: =RC[-28] ->  | AP56: - | AQ56: =RC[-29] ->  | AR56: =RC[-29] ->  | AS56: - | AT56: =RC[-30] -> - | AU56: =RC[-30] ->  | AV56: =RC[-30] ->  | AW56: =RC[-30] -> 
A57: =IF(RC[1]="","",DATEVALUE(RC[1])) ->  | P57: =IF(AND(ISNUMBER(RC[-3]),ISNUMBER(RC[-1])),RC[-3]-RC[-1],"-") -> - | T57: =(RC[-16]*RC[-15]-RC[-13]*RC[-12])/1000 -> #VALUE! | W57: =RC[-2]*RC[-10]/1000 -> #VALUE! | X57: =ABS((RC[-3]*RC[-11]-RC[-2]*RC[-9])/1000) -> #VALUE! | Y57: =(RC[-14]-RC[1])/RC[-18]*100 -> #VALUE! | AC57: =VALUE(RC[-27]) -> #VALUE! | AD57: =IF(RC[21]=42,"*",IF(RC[21]=32,"",RC[21])) ->  | AE57: =RC[-28] ->  | AF57: =RC[-28] ->  | AG57: =RC[-28] ->  | AH57: =RC[-28] ->  | AI57: =RC[-28] ->  | AJ57: =RC[-28] ->  | AK57: =RC[-28] ->  | AL57: =RC[-28] -> 0 | AM57: =RC[-28] ->  | AN57: =RC[-28] ->  | AO57: =RC[-28] ->  | AP57: - | AQ57: =RC[-29] ->  | AR57: =RC[-29] ->  | AS57: - | AT57: =RC[-30] -> - | AU57: =RC[-30] ->  | AV57: =RC[-30] ->  | AW57: =RC[-30] -> 
A58: =IF(RC[1]="","",DATEVALUE(RC[1])) ->  | P58: =IF(AND(ISNUMBER(RC[-3]),ISNUMBER(RC[-1])),RC[-3]-RC[-1],"-") -> - | T58: =(RC[-16]*RC[-15]-RC[-13]*RC[-12])/1000 -> #VALUE! | W58: =RC[-2]*RC[-10]/1000 -> #VALUE! | X58: =ABS((RC[-3]*RC[-11]-RC[-2]*RC[-9])/1000) -> #VALUE! | Y58: =(RC[-14]-RC[1])/RC[-18]*100 -> #VALUE! | AC58: =VALUE(RC[-27]) -> #VALUE! | AD58: =IF(RC[21]=42,"*",IF(RC[21]=32,"",RC[21])) ->  | AE58: =RC[-28] ->  | AF58: =RC[-28] ->  | AG58: =RC[-28] ->  | AH58: =RC[-28] ->  | AI58: =RC[-28] ->  | AJ58: =RC[-28] ->  | AK58: =RC[-28] ->  | AL58: =RC[-28] -> 0 | AM58: =RC[-28] ->  | AN58: =RC[-28] ->  | AO58: =RC[-28] ->  | AP58: - | AQ58: =RC[-29] ->  | AR58: =RC[-29] ->  | AS58: - | AT58: =RC[-30] -> - | AU58: =RC[-30] ->  | AV58: =RC[-30] ->  | AW58: =RC[-30] -> 
A59: =IF(RC[1]="","",DATEVALUE(RC[1])) ->  | P59: =IF(AND(ISNUMBER(RC[-3]),ISNUMBER(RC[-1])),RC[-3]-RC[-1],"-") -> - | T59: =(RC[-16]*RC[-15]-RC[-13]*RC[-12])/1000 -> #VALUE! | W59: =RC[-2]*RC[-10]/1000 -> #VALUE! | X59: =ABS((RC[-3]*RC[-11]-RC[-2]*RC[-9])/1000) -> #VALUE! | Y59: =(RC[-14]-RC[1])/RC[-18]*100 -> #VALUE! | AC59: =VALUE(RC[-27]) -> #VALUE! | AD59: =IF(RC[21]=42,"*",IF(RC[21]=32,"",RC[21])) ->  | AE59: =RC[-28] ->  | AF59: =RC[-28] ->  | AG59: =RC[-28] ->  | AH59: =RC[-28] ->  | AI59: =RC[-28] ->  | AJ59: =RC[-28] ->  | AK59: =RC[-28] ->  | AL59: =RC[-28] -> 0 | AM59: =RC[-28] ->  | AN59: =RC[-28] ->  | AO59: =RC[-28] ->  | AP59: - | AQ59: =RC[-29] ->  | AR59: =RC[-29] ->  | AS59: - | AT59: =RC[-30] -> - | AU59: =RC[-30] ->  | AV59: =RC[-30] ->  | AW59: =RC[-30] -> 
A60: =IF(RC[1]="","",DATEVALUE(RC[1])) ->  | P60: =IF(AND(ISNUMBER(RC[-3]),ISNUMBER(RC[-1])),RC[-3]-RC[-1],"-") -> - | T60: =(RC[-16]*RC[-15]-RC[-13]*RC[-12])/1000 -> #VALUE! | W60: =RC[-2]*RC[-10]/1000 -> #VALUE! | X60: =ABS((RC[-3]*RC[-11]-RC[-2]*RC[-9])/1000) -> #VALUE! | Y60: =(RC[-14]-RC[1])/RC[-18]*100 -> #VALUE! | AC60: =VALUE(RC[-27]) -> #VALUE! | AD60: =IF(RC[21]=42,"*",IF(RC[21]=32,"",RC[21])) ->  | AE60: =RC[-28] ->  | AF60: =RC[-28] ->  | AG60: =RC[-28] ->  | AH60: =RC[-28] ->  | AI60: =RC[-28] ->  | AJ60: =RC[-28] ->  | AK60: =RC[-28] ->  | AL60: =RC[-28] -> 0 | AM60: =RC[-28] ->  | AN60: =RC[-28] ->  | AO60: =RC[-28] ->  | AP60: - | AQ60: =RC[-29] ->  | AR60: =RC[-29] ->  | AS60: - | AT60: =RC[-30] -> - | AU60: =RC[-30] ->  | AV60: =RC[-30] ->  | AW60: =RC[-30] -> 
A61: =IF(RC[1]="","",DATEVALUE(RC[1])) ->  | P61: =IF(AND(ISNUMBER(RC[-3]),ISNUMBER(RC[-1])),RC[-3]-RC[-1],"-") -> - | T61: =(RC[-16]*RC[-15]-RC[-13]*RC[-12])/1000 -> #VALUE! | W61: =RC[-2]*RC[-10]/1000 -> #VALUE! | X61: =ABS((RC[-3]*RC[-11]-RC[-2]*RC[-9])/1000) -> #VALUE! | Y61: =(RC[-14]-RC[1])/RC[-18]*100 -> #VALUE! | AC61: =VALUE(RC[-27]) -> #VALUE! | AD61: =IF(RC[21]=42,"*",IF(RC[21]=32,"",RC[21])) ->  | AE61: =RC[-28] ->  | AF61: =RC[-28] ->  | AG61: =RC[-28] ->  | AH61: =RC[-28] ->  | AI61: =RC[-28] ->  | AJ61: =RC[-28] ->  | AK61: =RC[-28] ->  | AL61: =RC[-28] -> 0 | AM61: =RC[-28] ->  | AN61: =RC[-28] ->  | AO61: =RC[-28] ->  | AP61: - | AQ61: =RC[-29] ->  | AR61: =RC[-29] ->  | AS61: - | AT61: =RC[-30] -> - | AU61: =RC[-30] ->  | AV61: =RC[-30] ->  | AW61: =RC[-30] -> 
A62: =IF(RC[1]="","",DATEVALUE(RC[1])) ->  | P62: =IF(AND(ISNUMBER(RC[-3]),ISNUMBER(RC[-1])),RC[-3]-RC[-1],"-") -> - | T62: =(RC[-16]*RC[-15]-RC[-13]*RC[-12])/1000 -> #VALUE! | W62: =RC[-2]*RC[-10]/1000 -> #VALUE! | X62: =ABS((RC[-3]*RC[-11]-RC[-2]*RC[-9])/1000) -> #VALUE! | Y62: =(RC[-14]-RC[1])/RC[-18]*100 -> #VALUE! | AC62: =VALUE(RC[-27]) -> #VALUE! | AD62: =IF(RC[21]=42,"*",IF(RC[21]=32,"",RC[21])) ->  | AE62: =RC[-28] ->  | AF62: =RC[-28] ->  | AG62: =RC[-28] ->  | AH62: =RC[-28] ->  | AI62: =RC[-28] ->  | AJ62: =RC[-28] ->  | AK62: =RC[-28] ->  | AL62: =RC[-28] -> 0 | AM62: =RC[-28] ->  | AN62: =RC[-28] ->  | AO62: =RC[-28] ->  | AP62: - | AQ62: =RC[-29] ->  | AR62: =RC[-29] ->  | AS62: - | AT62: =RC[-30] -> - | AU62: =RC[-30] ->  | AV62: =RC[-30] ->  | AW62: =RC[-30] -> 
A63: =IF(RC[1]="","",DATEVALUE(RC[1])) ->  | P63: =IF(AND(ISNUMBER(RC[-3]),ISNUMBER(RC[-1])),RC[-3]-RC[-1],"-") -> - | T63: =(RC[-16]*RC[-15]-RC[-13]*RC[-12])/1000 -> #VALUE! | W63: =RC[-2]*RC[-10]/1000 -> #VALUE! | X63: =ABS((RC[-3]*RC[-11]-RC[-2]*RC[-9])/1000) -> #VALUE! | Y63: =(RC[-14]-RC[1])/RC[-18]*100 -> #VALUE! | AC63: =VALUE(RC[-27]) -> #VALUE! | AD63: =IF(RC[21]=42,"*",IF(RC[21]=32,"",RC[21])) ->  | AE63: =RC[-28] ->  | AF63: =RC[-28] ->  | AG63: =RC[-28] ->  | AH63: =RC[-28] ->  | AI63: =RC[-28] ->  | AJ63: =RC[-28] ->  | AK63: =RC[-28] ->  | AL63: =RC[-28] -> 0 | AM63: =RC[-28] ->  | AN63: =RC[-28] ->  | AO63: =RC[-28] ->  | AP63: - | AQ63: =RC[-29] ->  | AR63: =RC[-29] ->  | AS63: - | AT63: =RC[-30] -> - | AU63: =RC[-30] ->  | AV63: =RC[-30] ->  | AW63: =RC[-30] -> 
A64: =IF(RC[1]="","",DATEVALUE(RC[1])) ->  | P64: =IF(AND(ISNUMBER(RC[-3]),ISNUMBER(RC[-1])),RC[-3]-RC[-1],"-") -> - | T64: =(RC[-16]*RC[-15]-RC[-13]*RC[-12])/1000 -> #VALUE! | W64: =RC[-2]*RC[-10]/1000 -> #VALUE! | X64: =ABS((RC[-3]*RC[-11]-RC[-2]*RC[-9])/1000) -> #VALUE! | Y64: =(RC[-14]-RC[1])/RC[-18]*100 -> #VALUE! | AC64: =VALUE(RC[-27]) -> #VALUE! | AD64: =IF(RC[21]=42,"*",IF(RC[21]=32,"",RC[21])) ->  | AE64: =RC[-28] ->  | AF64: =RC[-28] ->  | AG64: =RC[-28] ->  | AH64: =RC[-28] ->  | AI64: =RC[-28] ->  | AJ64: =RC[-28] ->  | AK64: =RC[-28] ->  | AL64: =RC[-28] -> 0 | AM64: =RC[-28] ->  | AN64: =RC[-28] ->  | AO64: =RC[-28] ->  | AP64: - | AQ64: =RC[-29] ->  | AR64: =RC[-29] ->  | AS64: - | AT64: =RC[-30] -> - | AU64: =RC[-30] ->  | AV64: =RC[-30] ->  | AW64: =RC[-30] -> 
A65: =IF(RC[1]="","",DATEVALUE(RC[1])) ->  | P65: =IF(AND(ISNUMBER(RC[-3]),ISNUMBER(RC[-1])),RC[-3]-RC[-1],"-") -> - | T65: =(RC[-16]*RC[-15]-RC[-13]*RC[-12])/1000 -> #VALUE! | W65: =RC[-2]*RC[-10]/1000 -> #VALUE! | X65: =ABS((RC[-3]*RC[-11]-RC[-2]*RC[-9])/1000) -> #VALUE! | Y65: =(RC[-14]-RC[1])/RC[-18]*100 -> #VALUE! | AC65: =VALUE(RC[-27]) -> #VALUE! | AD65: =IF(RC[21]=42,"*",IF(RC[21]=32,"",RC[21])) ->  | AE65: =RC[-28] ->  | AF65: =RC[-28] ->  | AG65: =RC[-28] ->  | AH65: =RC[-28] ->  | AI65: =RC[-28] ->  | AJ65: =RC[-28] ->  | AK65: =RC[-28] ->  | AL65: =RC[-28] -> 0 | AM65: =RC[-28] ->  | AN65: =RC[-28] ->  | AO65: =RC[-28] ->  | AP65: - | AQ65: =RC[-29] ->  | AR65: =RC[-29] ->  | AS65: - | AT65: =RC[-30] -> - | AU65: =RC[-30] ->  | AV65: =RC[-30] ->  | AW65: =RC[-30] -> 
A66: =IF(RC[1]="","",DATEVALUE(RC[1])) ->  | P66: =IF(AND(ISNUMBER(RC[-3]),ISNUMBER(RC[-1])),RC[-3]-RC[-1],"-") -> - | T66: =(RC[-16]*RC[-15]-RC[-13]*RC[-12])/1000 -> #VALUE! | W66: =RC[-2]*RC[-10]/1000 -> #VALUE! | X66: =ABS((RC[-3]*RC[-11]-RC[-2]*RC[-9])/1000) -> #VALUE! | Y66: =(RC[-14]-RC[1])/RC[-18]*100 -> #VALUE! | AC66: =VALUE(RC[-27]) -> #VALUE! | AD66: =IF(RC[21]=42,"*",IF(RC[21]=32,"",RC[21])) ->  | AE66: =RC[-28] ->  | AF66: =RC[-28] ->  | AG66: =RC[-28] ->  | AH66: =RC[-28] ->  | AI66: =RC[-28] ->  | AJ66: =RC[-28] ->  | AK66: =RC[-28] ->  | AL66: =RC[-28] -> 0 | AM66: =RC[-28] ->  | AN66: =RC[-28] ->  | AO66: =RC[-28] ->  | AP66: - | AQ66: =RC[-29] ->  | AR66: =RC[-29] ->  | AS66: - | AT66: =RC[-30] -> - | AU66: =RC[-30] ->  | AV66: =RC[-30] ->  | AW66: =RC[-30] -> 
A67: =IF(RC[1]="","",DATEVALUE(RC[1])) ->  | P67: =IF(AND(ISNUMBER(RC[-3]),ISNUMBER(RC[-1])),RC[-3]-RC[-1],"-") -> - | T67: =(RC[-16]*RC[-15]-RC[-13]*RC[-12])/1000 -> #VALUE! | W67: =RC[-2]*RC[-10]/1000 -> #VALUE! | X67: =ABS((RC[-3]*RC[-11]-RC[-2]*RC[-9])/1000) -> #VALUE! | Y67: =(RC[-14]-RC[1])/RC[-18]*100 -> #VALUE! | AC67: =VALUE(RC[-27]) -> #VALUE! | AD67: =IF(RC[21]=42,"*",IF(RC[21]=32,"",RC[21])) ->  | AE67: =RC[-28] ->  | AF67: =RC[-28] ->  | AG67: =RC[-28] ->  | AH67: =RC[-28] ->  | AI67: =RC[-28] ->  | AJ67: =RC[-28] ->  | AK67: =RC[-28] ->  | AL67: =RC[-28] -> 0 | AM67: =RC[-28] ->  | AN67: =RC[-28] ->  | AO67: =RC[-28] ->  | AP67: - | AQ67: =RC[-29] ->  | AR67: =RC[-29] ->  | AS67: - | AT67: =RC[-30] -> - | AU67: =RC[-30] ->  | AV67: =RC[-30] ->  | AW67: =RC[-30] -> 
A68: =IF(RC[1]="","",DATEVALUE(RC[1])) ->  | P68: =IF(AND(ISNUMBER(RC[-3]),ISNUMBER(RC[-1])),RC[-3]-RC[-1],"-") -> - | T68: =(RC[-16]*RC[-15]-RC[-13]*RC[-12])/1000 -> #VALUE! | W68: =RC[-2]*RC[-10]/1000 -> #VALUE! | X68: =ABS((RC[-3]*RC[-11]-RC[-2]*RC[-9])/1000) -> #VALUE! | Y68: =(RC[-14]-RC[1])/RC[-18]*100 -> #VALUE! | AC68: =VALUE(RC[-27]) -> #VALUE! | AD68: =IF(RC[21]=42,"*",IF(RC[21]=32,"",RC[21])) ->  | AE68: =RC[-28] ->  | AF68: =RC[-28] ->  | AG68: =RC[-28] ->  | AH68: =RC[-28] ->  | AI68: =RC[-28] ->  | AJ68: =RC[-28] ->  | AK68: =RC[-28] ->  | AL68: =RC[-28] -> 0 | AM68: =RC[-28] ->  | AN68: =RC[-28] ->  | AO68: =RC[-28] ->  | AP68: - | AQ68: =RC[-29] ->  | AR68: =RC[-29] ->  | AS68: - | AT68: =RC[-30] -> - | AU68: =RC[-30] ->  | AV68: =RC[-30] ->  | AW68: =RC[-30] -> 
A69: =IF(RC[1]="","",DATEVALUE(RC[1])) ->  | P69: =IF(AND(ISNUMBER(RC[-3]),ISNUMBER(RC[-1])),RC[-3]-RC[-1],"-") -> - | T69: =(RC[-16]*RC[-15]-RC[-13]*RC[-12])/1000 -> #VALUE! | W69: =RC[-2]*RC[-10]/1000 -> #VALUE! | X69: =ABS((RC[-3]*RC[-11]-RC[-2]*RC[-9])/1000) -> #VALUE! | Y69: =(RC[-14]-RC[1])/RC[-18]*100 -> #VALUE! | AC69: =VALUE(RC[-27]) -> #VALUE! | AD69: =IF(RC[21]=42,"*",IF(RC[21]=32,"",RC[21])) ->  | AE69: =RC[-28] ->  | AF69: =RC[-28] ->  | AG69: =RC[-28] ->  | AH69: =RC[-28] ->  | AI69: =RC[-28] ->  | AJ69: =RC[-28] ->  | AK69: =RC[-28] ->  | AL69: =RC[-28] -> 0 | AM69: =RC[-28] ->  | AN69: =RC[-28] ->  | AO69: =RC[-28] ->  | AP69: - | AQ69: =RC[-29] ->  | AR69: =RC[-29] ->  | AS69: - | AT69: =RC[-30] -> - | AU69: =RC[-30] ->  | AV69: =RC[-30] ->  | AW69: =RC[-30] -> 
A70: =IF(RC[1]="","",DATEVALUE(RC[1])) ->  | P70: =IF(AND(ISNUMBER(RC[-3]),ISNUMBER(RC[-1])),RC[-3]-RC[-1],"-") -> - | T70: =(RC[-16]*RC[-15]-RC[-13]*RC[-12])/1000 -> #VALUE! | W70: =RC[-2]*RC[-10]/1000 -> #VALUE! | X70: =ABS((RC[-3]*RC[-11]-RC[-2]*RC[-9])/1000) -> #VALUE! | Y70: =(RC[-14]-RC[1])/RC[-18]*100 -> #VALUE! | AC70: =VALUE(RC[-27]) -> #VALUE! | AD70: =IF(RC[21]=42,"*",IF(RC[21]=32,"",RC[21])) ->  | AE70: =RC[-28] ->  | AF70: =RC[-28] ->  | AG70: =RC[-28] ->  | AH70: =RC[-28] ->  | AI70: =RC[-28] ->  | AJ70: =RC[-28] ->  | AK70: =RC[-28] ->  | AL70: =RC[-28] -> 0 | AM70: =RC[-28] ->  | AN70: =RC[-28] ->  | AO70: =RC[-28] ->  | AP70: - | AQ70: =RC[-29] ->  | AR70: =RC[-29] ->  | AS70: - | AT70: =RC[-30] -> - | AU70: =RC[-30] ->  | AV70: =RC[-30] ->  | AW70: =RC[-30] -> 
A71: =IF(RC[1]="","",DATEVALUE(RC[1])) ->  | P71: =IF(AND(ISNUMBER(RC[-3]),ISNUMBER(RC[-1])),RC[-3]-RC[-1],"-") -> - | T71: =(RC[-16]*RC[-15]-RC[-13]*RC[-12])/1000 -> #VALUE! | W71: =RC[-2]*RC[-10]/1000 -> #VALUE! | X71: =ABS((RC[-3]*RC[-11]-RC[-2]*RC[-9])/1000) -> #VALUE! | Y71: =(RC[-14]-RC[1])/RC[-18]*100 -> #VALUE! | AC71: =VALUE(RC[-27]) -> #VALUE! | AD71: =IF(RC[21]=42,"*",IF(RC[21]=32,"",RC[21])) ->  | AE71: =RC[-28] ->  | AF71: =RC[-28] ->  | AG71: =RC[-28] ->  | AH71: =RC[-28] ->  | AI71: =RC[-28] ->  | AJ71: =RC[-28] ->  | AK71: =RC[-28] ->  | AL71: =RC[-28] -> 0 | AM71: =RC[-28] ->  | AN71: =RC[-28] ->  | AO71: =RC[-28] ->  | AP71: - | AQ71: =RC[-29] ->  | AR71: =RC[-29] ->  | AS71: - | AT71: =RC[-30] -> - | AU71: =RC[-30] ->  | AV71: =RC[-30] ->  | AW71: =RC[-30] -> 
A72: =IF(RC[1]="","",DATEVALUE(RC[1])) ->  | P72: =IF(AND(ISNUMBER(RC[-3]),ISNUMBER(RC[-1])),RC[-3]-RC[-1],"-") -> - | T72: =(RC[-16]*RC[-15]-RC[-13]*RC[-12])/1000 -> #VALUE! | W72: =RC[-2]*RC[-10]/1000 -> #VALUE! | X72: =ABS((RC[-3]*RC[-11]-RC[-2]*RC[-9])/1000) -> #VALUE! | Y72: =(RC[-14]-RC[1])/RC[-18]*100 -> #VALUE! | AC72: =VALUE(RC[-27]) -> #VALUE! | AD72: =IF(RC[21]=42,"*",IF(RC[21]=32,"",RC[21])) ->  | AE72: =RC[-28] ->  | AF72: =RC[-28] ->  | AG72: =RC[-28] ->  | AH72: =RC[-28] ->  | AI72: =RC[-28] ->  | AJ72: =RC[-28] ->  | AK72: =RC[-28] ->  | AL72: =RC[-28] -> 0 | AM72: =RC[-28] ->  | AN72: =RC[-28] ->  | AO72: =RC[-28] ->  | AP72: - | AQ72: =RC[-29] ->  | AR72: =RC[-29] ->  | AS72: - | AT72: =RC[-30] -> - | AU72: =RC[-30] ->  | AV72: =RC[-30] ->  | AW72: =RC[-30] -> 
A73: =IF(RC[1]="","",DATEVALUE(RC[1])) ->  | P73: =IF(AND(ISNUMBER(RC[-3]),ISNUMBER(RC[-1])),RC[-3]-RC[-1],"-") -> - | T73: =(RC[-16]*RC[-15]-RC[-13]*RC[-12])/1000 -> #VALUE! | W73: =RC[-2]*RC[-10]/1000 -> #VALUE! | X73: =ABS((RC[-3]*RC[-11]-RC[-2]*RC[-9])/1000) -> #VALUE! | Y73: =(RC[-14]-RC[1])/RC[-18]*100 -> #VALUE! | AC73: =VALUE(RC[-27]) -> #VALUE! | AD73: =IF(RC[21]=42,"*",IF(RC[21]=32,"",RC[21])) ->  | AE73: =RC[-28] ->  | AF73: =RC[-28] ->  | AG73: =RC[-28] ->  | AH73: =RC[-28] ->  | AI73: =RC[-28] ->  | AJ73: =RC[-28] ->  | AK73: =RC[-28] ->  | AL73: =RC[-28] -> 0 | AM73: =RC[-28] ->  | AN73: =RC[-28] ->  | AO73: =RC[-28] ->  | AP73: - | AQ73: =RC[-29] ->  | AR73: =RC[-29] ->  | AS73: - | AT73: =RC[-30] -> - | AU73: =RC[-30] ->  | AV73: =RC[-30] ->  | AW73: =RC[-30] -> 
A74: =IF(RC[1]="","",DATEVALUE(RC[1])) ->  | P74: =IF(AND(ISNUMBER(RC[-3]),ISNUMBER(RC[-1])),RC[-3]-RC[-1],"-") -> - | T74: =(RC[-16]*RC[-15]-RC[-13]*RC[-12])/1000 -> #VALUE! | W74: =RC[-2]*RC[-10]/1000 -> #VALUE! | X74: =ABS((RC[-3]*RC[-11]-RC[-2]*RC[-9])/1000) -> #VALUE! | Y74: =(RC[-14]-RC[1])/RC[-18]*100 -> #VALUE! | AC74: =VALUE(RC[-27]) -> #VALUE! | AD74: =IF(RC[21]=42,"*",IF(RC[21]=32,"",RC[21])) ->  | AE74: =RC[-28] ->  | AF74: =RC[-28] ->  | AG74: =RC[-28] ->  | AH74: =RC[-28] ->  | AI74: =RC[-28] ->  | AJ74: =RC[-28] ->  | AK74: =RC[-28] ->  | AL74: =RC[-28] -> 0 | AM74: =RC[-28] ->  | AN74: =RC[-28] ->  | AO74: =RC[-28] ->  | AP74: - | AQ74: =RC[-29] ->  | AR74: =RC[-29] ->  | AS74: - | AT74: =RC[-30] -> - | AU74: =RC[-30] ->  | AV74: =RC[-30] ->  | AW74: =RC[-30] -> 
A75: =IF(RC[1]="","",DATEVALUE(RC[1])) ->  | P75: =IF(AND(ISNUMBER(RC[-3]),ISNUMBER(RC[-1])),RC[-3]-RC[-1],"-") -> - | T75: =(RC[-16]*RC[-15]-RC[-13]*RC[-12])/1000 -> #VALUE! | W75: =RC[-2]*RC[-10]/1000 -> #VALUE! | X75: =ABS((RC[-3]*RC[-11]-RC[-2]*RC[-9])/1000) -> #VALUE! | Y75: =(RC[-14]-RC[1])/RC[-18]*100 -> #VALUE! | AC75: =VALUE(RC[-27]) -> #VALUE! | AD75: =IF(RC[21]=42,"*",IF(RC[21]=32,"",RC[21])) ->  | AE75: =RC[-28] ->  | AF75: =RC[-28] ->  | AG75: =RC[-28] ->  | AH75: =RC[-28] ->  | AI75: =RC[-28] ->  | AJ75: =RC[-28] ->  | AK75: =RC[-28] ->  | AL75: =RC[-28] -> 0 | AM75: =RC[-28] ->  | AN75: =RC[-28] ->  | AO75: =RC[-28] ->  | AP75: - | AQ75: =RC[-29] ->  | AR75: =RC[-29] ->  | AS75: - | AT75: =RC[-30] -> - | AU75: =RC[-30] ->  | AV75: =RC[-30] ->  | AW75: =RC[-30] -> 
A76: =IF(RC[1]="","",DATEVALUE(RC[1])) ->  | P76: =IF(AND(ISNUMBER(RC[-3]),ISNUMBER(RC[-1])),RC[-3]-RC[-1],"-") -> - | T76: =(RC[-16]*RC[-15]-RC[-13]*RC[-12])/1000 -> #VALUE! | W76: =RC[-2]*RC[-10]/1000 -> #VALUE! | X76: =ABS((RC[-3]*RC[-11]-RC[-2]*RC[-9])/1000) -> #VALUE! | Y76: =(RC[-14]-RC[1])/RC[-18]*100 -> #VALUE! | AC76: =VALUE(RC[-27]) -> #VALUE! | AD76: =IF(RC[21]=42,"*",IF(RC[21]=32,"",RC[21])) ->  | AE76: =RC[-28] ->  | AF76: =RC[-28] ->  | AG76: =RC[-28] ->  | AH76: =RC[-28] ->  | AI76: =RC[-28] ->  | AJ76: =RC[-28] ->  | AK76: =RC[-28] ->  | AL76: =RC[-28] -> 0 | AM76: =RC[-28] ->  | AN76: =RC[-28] ->  | AO76: =RC[-28] ->  | AP76: - | AQ76: =RC[-29] ->  | AR76: =RC[-29] ->  | AS76: - | AT76: =RC[-30] -> - | AU76: =RC[-30] ->  | AV76: =RC[-30] ->  | AW76: =RC[-30] -> 
A77: =IF(RC[1]="","",DATEVALUE(RC[1])) ->  | P77: =IF(AND(ISNUMBER(RC[-3]),ISNUMBER(RC[-1])),RC[-3]-RC[-1],"-") -> - | T77: =(RC[-16]*RC[-15]-RC[-13]*RC[-12])/1000 -> #VALUE! | W77: =RC[-2]*RC[-10]/1000 -> #VALUE! | X77: =ABS((RC[-3]*RC[-11]-RC[-2]*RC[-9])/1000) -> #VALUE! | Y77: =(RC[-14]-RC[1])/RC[-18]*100 -> #VALUE! | AC77: =VALUE(RC[-27]) -> #VALUE! | AD77: =IF(RC[21]=42,"*",IF(RC[21]=32,"",RC[21])) ->  | AE77: =RC[-28] ->  | AF77: =RC[-28] ->  | AG77: =RC[-28] ->  | AH77: =RC[-28] ->  | AI77: =RC[-28] ->  | AJ77: =RC[-28] ->  | AK77: =RC[-28] ->  | AL77: =RC[-28] -> 0 | AM77: =RC[-28] ->  | AN77: =RC[-28] ->  | AO77: =RC[-28] ->  | AP77: - | AQ77: =RC[-29] ->  | AR77: =RC[-29] ->  | AS77: - | AT77: =RC[-30] -> - | AU77: =RC[-30] ->  | AV77: =RC[-30] ->  | AW77: =RC[-30] -> 
A78: =IF(RC[1]="","",DATEVALUE(RC[1])) ->  | P78: =IF(AND(ISNUMBER(RC[-3]),ISNUMBER(RC[-1])),RC[-3]-RC[-1],"-") -> - | T78: =(RC[-16]*RC[-15]-RC[-13]*RC[-12])/1000 -> #VALUE! | W78: =RC[-2]*RC[-10]/1000 -> #VALUE! | X78: =ABS((RC[-3]*RC[-11]-RC[-2]*RC[-9])/1000) -> #VALUE! | Y78: =(RC[-14]-RC[1])/RC[-18]*100 -> #VALUE! | AC78: =VALUE(RC[-27]) -> #VALUE! | AD78: =IF(RC[21]=42,"*",IF(RC[21]=32,"",RC[21])) ->  | AE78: =RC[-28] ->  | AF78: =RC[-28] ->  | AG78: =RC[-28] ->  | AH78: =RC[-28] ->  | AI78: =RC[-28] ->  | AJ78: =RC[-28] ->  | AK78: =RC[-28] ->  | AL78: =RC[-28] -> 0 | AM78: =RC[-28] ->  | AN78: =RC[-28] ->  | AO78: =RC[-28] ->  | AP78: - | AQ78: =RC[-29] ->  | AR78: =RC[-29] ->  | AS78: - | AT78: =RC[-30] -> - | AU78: =RC[-30] ->  | AV78: =RC[-30] ->  | AW78: =RC[-30] -> 
A79: =IF(RC[1]="","",DATEVALUE(RC[1])) ->  | P79: =IF(AND(ISNUMBER(RC[-3]),ISNUMBER(RC[-1])),RC[-3]-RC[-1],"-") -> - | T79: =(RC[-16]*RC[-15]-RC[-13]*RC[-12])/1000 -> #VALUE! | W79: =RC[-2]*RC[-10]/1000 -> #VALUE! | X79: =ABS((RC[-3]*RC[-11]-RC[-2]*RC[-9])/1000) -> #VALUE! | Y79: =(RC[-14]-RC[1])/RC[-18]*100 -> #VALUE! | AC79: =VALUE(RC[-27]) -> #VALUE! | AD79: =IF(RC[21]=42,"*",IF(RC[21]=32,"",RC[21])) ->  | AE79: =RC[-28] ->  | AF79: =RC[-28] ->  | AG79: =RC[-28] ->  | AH79: =RC[-28] ->  | AI79: =RC[-28] ->  | AJ79: =RC[-28] ->  | AK79: =RC[-28] ->  | AL79: =RC[-28] -> 0 | AM79: =RC[-28] ->  | AN79: =RC[-28] ->  | AO79: =RC[-28] ->  | AP79: - | AQ79: =RC[-29] ->  | AR79: =RC[-29] ->  | AS79: - | AT79: =RC[-30] -> - | AU79: =RC[-30] ->  | AV79: =RC[-30] ->  | AW79: =RC[-30] -> 
A80: =IF(RC[1]="","",DATEVALUE(RC[1])) ->  | P80: =IF(AND(ISNUMBER(RC[-3]),ISNUMBER(RC[-1])),RC[-3]-RC[-1],"-") -> - | T80: =(RC[-16]*RC[-15]-RC[-13]*RC[-12])/1000 -> #VALUE! | W80: =RC[-2]*RC[-10]/1000 -> #VALUE! | X80: =ABS((RC[-3]*RC[-11]-RC[-2]*RC[-9])/1000) -> #VALUE! | Y80: =(RC[-14]-RC[1])/RC[-18]*100 -> #VALUE! | AC80: =VALUE(RC[-27]) -> #VALUE! | AD80: =IF(RC[21]=42,"*",IF(RC[21]=32,"",RC[21])) ->  | AE80: =RC[-28] ->  | AF80: =RC[-28] ->  | AG80: =RC[-28] ->  | AH80: =RC[-28] ->  | AI80: =RC[-28] ->  | AJ80: =RC[-28] ->  | AK80: =RC[-28] ->  | AL80: =RC[-28] -> 0 | AM80: =RC[-28] ->  | AN80: =RC[-28] ->  | AO80: =RC[-28] ->  | AP80: - | AQ80: =RC[-29] ->  | AR80: =RC[-29] ->  | AS80: - | AT80: =RC[-30] -> - | AU80: =RC[-30] ->  | AV80: =RC[-30] ->  | AW80: =RC[-30] -> 
A81: =IF(RC[1]="","",DATEVALUE(RC[1])) ->  | P81: =IF(AND(ISNUMBER(RC[-3]),ISNUMBER(RC[-1])),RC[-3]-RC[-1],"-") -> - | T81: =(RC[-16]*RC[-15]-RC[-13]*RC[-12])/1000 -> #VALUE! | W81: =RC[-2]*RC[-10]/1000 -> #VALUE! | X81: =ABS((RC[-3]*RC[-11]-RC[-2]*RC[-9])/1000) -> #VALUE! | Y81: =(RC[-14]-RC[1])/RC[-18]*100 -> #VALUE! | AC81: =VALUE(RC[-27]) -> #VALUE! | AD81: =IF(RC[21]=42,"*",IF(RC[21]=32,"",RC[21])) ->  | AE81: =RC[-28] ->  | AF81: =RC[-28] ->  | AG81: =RC[-28] ->  | AH81: =RC[-28] ->  | AI81: =RC[-28] ->  | AJ81: =RC[-28] ->  | AK81: =RC[-28] ->  | AL81: =RC[-28] -> 0 | AM81: =RC[-28] ->  | AN81: =RC[-28] ->  | AO81: =RC[-28] ->  | AP81: - | AQ81: =RC[-29] ->  | AR81: =RC[-29] ->  | AS81: - | AT81: =RC[-30] -> - | AU81: =RC[-30] ->  | AV81: =RC[-30] ->  | AW81: =RC[-30] -> 
A82: =IF(RC[1]="","",DATEVALUE(RC[1])) ->  | P82: =IF(AND(ISNUMBER(RC[-3]),ISNUMBER(RC[-1])),RC[-3]-RC[-1],"-") -> - | T82: =(RC[-16]*RC[-15]-RC[-13]*RC[-12])/1000 -> #VALUE! | W82: =RC[-2]*RC[-10]/1000 -> #VALUE! | X82: =ABS((RC[-3]*RC[-11]-RC[-2]*RC[-9])/1000) -> #VALUE! | Y82: =(RC[-14]-RC[1])/RC[-18]*100 -> #VALUE! | AC82: =VALUE(RC[-27]) -> #VALUE! | AD82: =IF(RC[21]=42,"*",IF(RC[21]=32,"",RC[21])) ->  | AE82: =RC[-28] ->  | AF82: =RC[-28] ->  | AG82: =RC[-28] ->  | AH82: =RC[-28] ->  | AI82: =RC[-28] ->  | AJ82: =RC[-28] ->  | AK82: =RC[-28] ->  | AL82: =RC[-28] -> 0 | AM82: =RC[-28] ->  | AN82: =RC[-28] ->  | AO82: =RC[-28] ->  | AP82: - | AQ82: =RC[-29] ->  | AR82: =RC[-29] ->  | AS82: - | AT82: =RC[-30] -> - | AU82: =RC[-30] ->  | AV82: =RC[-30] ->  | AW82: =RC[-30] -> 
A83: =IF(RC[1]="","",DATEVALUE(RC[1])) ->  | P83: =IF(AND(ISNUMBER(RC[-3]),ISNUMBER(RC[-1])),RC[-3]-RC[-1],"-") -> - | T83: =(RC[-16]*RC[-15]-RC[-13]*RC[-12])/1000 -> #VALUE! | W83: =RC[-2]*RC[-10]/1000 -> #VALUE! | X83: =ABS((RC[-3]*RC[-11]-RC[-2]*RC[-9])/1000) -> #VALUE! | Y83: =(RC[-14]-RC[1])/RC[-18]*100 -> #VALUE! | AC83: =VALUE(RC[-27]) -> #VALUE! | AD83: =IF(RC[21]=42,"*",IF(RC[21]=32,"",RC[21])) ->  | AE83: =RC[-28] ->  | AF83: =RC[-28] ->  | AG83: =RC[-28] ->  | AH83: =RC[-28] ->  | AI83: =RC[-28] ->  | AJ83: =RC[-28] ->  | AK83: =RC[-28] ->  | AL83: =RC[-28] -> 0 | AM83: =RC[-28] ->  | AN83: =RC[-28] ->  | AO83: =RC[-28] ->  | AP83: - | AQ83: =RC[-29] ->  | AR83: =RC[-29] ->  | AS83: - | AT83: =RC[-30] -> - | AU83: =RC[-30] ->  | AV83: =RC[-30] ->  | AW83: =RC[-30] -> 
AC84: Среднее | AF84: =R[1]C[-28] -> 85.598666666666674 | AG84: =R[1]C[-28] -> 67.733333333333348 | AH84: =R[1]C[-28] -> 7.968 | AI84: =R[1]C[-28] -> 79.772333333333336 | AJ84: =R[1]C[-28] -> 42.754333333333335 | AK84: =R[1]C[-28] -> 5.282 | AL84: =R[1]C[-28] -> 24.978999999999992 | AM84: =R[1]C[-28] -> 5.8263333333333343 | AN84: =R[1]C[-28] -> 16.061666666666664 | AO84: =R[1]C[-28] -> 68.001222222222225 | AP84: - | AQ84: =R[1]C[-29] -> 7.0622222222222204 | AR84: =R[1]C[-29] -> 43.217333333333336 | AS84: - | AT84: =R[1]C[-30] -> 24.783888888888889 | AU84: =R[1]C[-30] -> 8.9994444444444426
B85: Среднее | D85: =AVERAGE(OFFSET(R[-74]C,3,0,R7C1,1)) -> 85.598666666666674 | E85: =AVERAGE(OFFSET(R[-74]C,3,0,R7C1,1)) -> 67.733333333333348 | F85: =AVERAGE(OFFSET(R[-74]C,3,0,R7C1,1)) -> 7.968 | G85: =AVERAGE(OFFSET(R[-74]C,3,0,R7C1,1)) -> 79.772333333333336 | H85: =AVERAGE(OFFSET(R[-74]C,3,0,R7C1,1)) -> 42.754333333333335 | I85: =AVERAGE(OFFSET(R[-74]C,3,0,R7C1,1)) -> 5.282 | J85: =AVERAGE(OFFSET(R[-74]C,3,0,R7C1,1)) -> 24.978999999999992 | K85: =AVERAGE(OFFSET(R[-74]C,3,0,R7C1,1)) -> 5.8263333333333343 | L85: =IF(SUM(OFFSET(R[-74]C,3,0,R7C1,1))=0,"",AVERAGE(OFFSET(R[-74]C,3,0,R7C1,1))) -> 16.061666666666664 | M85: =IF(SUM(OFFSET(R[-74]C,3,0,R7C1,1))=0,"",AVERAGE(OFFSET(R[-74]C,3,0,R7C1,1))) -> 68.001222222222225 | N85: =IF(SUM(OFFSET(R[-74]C,3,0,R7C1,1))=0,"",AVERAGE(OFFSET(R[-74]C,3,0,R7C1,1))) -> 7.0622222222222204 | O85: =IF(SUM(OFFSET(R[-74]C,3,0,R7C1,1))=0,"",AVERAGE(OFFSET(R[-74]C,3,0,R7C1,1))) -> 43.217333333333336 | P85: =IF(SUM(OFFSET(R[-74]C,3,0,R7C1,1))=0,"",AVERAGE(OFFSET(R[-74]C,3,0,R7C1,1))) -> 24.783888888888889 | Q85: =IF(SUM(OFFSET(R[-74]C,3,0,R7C1,1))=0,"",AVERAGE(OFFSET(R[-74]C,3,0,R7C1,1))) -> 8.9994444444444426 | R85: =IF(SUM(OFFSET(R[-74]C,3,0,R7C1,1))=0,"",AVERAGE(OFFSET(R[-74]C,3,0,R7C1,1))) -> 0.76365555555555553 | S85: =AVERAGE(OFFSET(R[-74]C,3,0,R7C1,1)) -> 2.5661444444444443 | T85: =AVERAGE(OFFSET(R[-74]C,3,0,R7C1,1)) -> 2.4773784166666664 | W85: =AVERAGE(OFFSET(R[-74]C,3,0,R7C1,1)) -> 1.0417551966666667 | X85: =AVERAGE(OFFSET(R[-74]C,3,0,R7C1,1)) -> 0.75190075333333339 | AC85: Итого | AE85: =R[1]C[-28] -> 720 | AF85: =R[1]C[-28] -> 2567.96 | AI85: =R[1]C[-28] -> 2393.17 | AM85: =R[1]C[-28] -> 174.79000000000002 | AN85: =R[1]C[-28] -> 481.84999999999991 | AQ85: =R[1]C[-29] -> 211.86666666666662 | AU85: =R[1]C[-30] -> 269.98333333333329 | AV85: =R[1]C[-30] -> 22.909666666666666 | AW85: =R[1]C[-30] -> 76.984333333333325
B86: ИТОГО: | C86: =SUM(OFFSET(R[-75]C,3,0,R7C1,1)) -> 720 | D86: =SUM(OFFSET(R[-75]C,3,0,R7C1,1)) -> 2567.96 | G86: =SUM(OFFSET(R[-75]C,3,0,R7C1,1)) -> 2393.17 | K86: =SUM(OFFSET(R[-75]C,3,0,R7C1,1)) -> 174.79000000000002 | L86: =IF(SUM(OFFSET(R[-75]C,3,0,R7C1,1))=0,"",SUM(OFFSET(R[-75]C,3,0,R7C1,1))) -> 481.84999999999991 | N86: =IF(SUM(OFFSET(R[-75]C,3,0,R7C1,1))=0,"",SUM(OFFSET(R[-75]C,3,0,R7C1,1))) -> 211.86666666666662 | Q86: =IF(SUM(OFFSET(R[-75]C,3,0,R7C1,1))=0,"",SUM(OFFSET(R[-75]C,3,0,R7C1,1))) -> 269.98333333333329 | R86: =IF(SUM(OFFSET(R[-75]C,3,0,R7C1,1))=0,"",SUM(OFFSET(R[-75]C,3,0,R7C1,1))) -> 22.909666666666666 | S86: =SUM(OFFSET(R[-75]C,3,0,R7C1,1)) -> 76.984333333333325 | T86: =SUM(OFFSET(R[-75]C,3,0,R7C1,1)) -> 74.321352499999989 | W86: =SUM(OFFSET(R[-75]C,3,0,R7C1,1)) -> 31.252655900000001 | X86: =SUM(OFFSET(R[-75]C,3,0,R7C1,1)) -> 22.557022600000003
AC87: Досчёт | AF87: =R[1]C[-28] -> 0 | AI87: =R[1]C[-28] -> 0 | AM87: =R[1]C[-28] -> 0 | AN87: =R[1]C[-28] -> 0 | AQ87: =R[1]C[-29] -> 0 | AU87: =R[1]C[-30] -> 0 | AV87: =R[1]C[-30] -> 0 | AW87: =R[1]C[-30] -> 0
A88: 11дн=264ч 4дн=96ч | B88: Досчёт до конца м-ца (+) | C88: =R6C1*24 -> 216 | T88: № 50019 | AC88: Снятие | AF88: =-R[1]C[-28] -> 0 | AI88: =-R[1]C[-28] -> 0 | AM88: =-R[1]C[-28] -> 0 | AN88: =-R[1]C[-28] -> 0 | AQ88: =-R[1]C[-29] -> 0 | AU88: =-R[1]C[-30] -> 0 | AV88: =-R[1]C[-30] -> 0 | AW88: =-R[1]C[-30] -> 0
A89: 9дн=216ч 7дн=168ч | B89: Вычет с предыдущего (-) | C89: =R4C1*24 -> 192 | AC89: Сумма | AF89: =R[1]C[-28] -> 2567.96 | AI89: =R[1]C[-28] -> 2393.17 | AM89: =R[1]C[-28] -> 174.79000000000002 | AN89: =R[1]C[-28] -> 481.84999999999991 | AQ89: =R[1]C[-29] -> 211.86666666666662 | AU89: =R[1]C[-30] -> 269.98333333333329 | AV89: =R[1]C[-30] -> 22.909666666666666 | AW89: =R[1]C[-30] -> 76.984333333333325
B90: СУММА: | C90: =R[-4]C+R[-2]C-R[-1]C -> 744 | D90: =R[-4]C+R[-2]C-R[-1]C -> 2567.96 | G90: =R[-4]C+R[-2]C-R[-1]C -> 2393.17 | K90: =R[-4]C+R[-2]C-R[-1]C -> 174.79000000000002 | L90: =IF(SUM(OFFSET(R[-79]C,3,0,R7C1,1))=0,"",(R[-4]C+R[-2]C-R[-1]C)) -> 481.84999999999991 | N90: =IF(SUM(OFFSET(R[-79]C,3,0,R7C1,1))=0,"",(R[-4]C+R[-2]C-R[-1]C)) -> 211.86666666666662 | Q90: =IF(SUM(OFFSET(R[-79]C,3,0,R7C1,1))=0,"",(R[-4]C+R[-2]C-R[-1]C)) -> 269.98333333333329 | R90: =IF(SUM(OFFSET(R[-79]C,3,0,R7C1,1))=0,"",(R[-4]C+R[-2]C-R[-1]C)) -> 22.909666666666666 | S90: =R[-4]C+R[-2]C-R[-1]C -> 76.984333333333325
AC91: Тхв на источнике | AE91: V гвс (м3) | AF91: =R[-2]C[15] -> 269.98333333333329 | AG91: W гвс (Гкал) | AH91: =RC[-2]*0.06 -> 16.198999999999998 | AI91: W без гвс (Гкал) | AJ91: =R[-2]C[13]-RC[-2] -> 60.785333333333327
B92: Показания счетчиков на момент снятия данных:
B93: Дата, время | D93: М1, т | F93: М2, т | H93: М3, т | J93: М4, т | L93: Qо, Гкал | N93: Qг, Гкал | P93: время, час
B94: 24.09.18 00:00 | D94: 29691.99 | F94: 28223.39 | H94: 7687.97 | J94: 2751.13 | L94: 806.82500000000005 | N94: 427.43700000000001 | P94: -
B95: 23.10.18 00:00 | D95: 32259.95 | F95: 30608.22 | H95: 8139.43 | J95: 2951.31 | L95: 881.81 | N95: 449.476 | P95: -
AC97: =ZAYAVKA_N -> з.н д. №02/147-2783 от 04.10.18 с 23.09.18г по 24.09.18г некорректная работа приборов
B98: Представитель потребителя:_______________________________________________________________________ В.О. Топорков
I101: Рекомендуемые значения по параметрам теплопотребления (не являются официально утверждёнными)
I102: М, т | J102: V, м3 | K102: Qгвс, Гкал | L102: Qотоп, Гкал | M102: Qо, Гкал
I103: =R[-13]C[-3] -> 0 | J103: =RC[-1]/0.98 -> 0 | K103: =RC[-1]*0.06 -> 0 | L103: =RC[1]-RC[-1] -> 22.909666666666666 | M103: =R[-13]C[5] -> 22.909666666666666
O105: ДЛЯ САМОКОНТРОЛЯ
B106: В строке выбора дат указать период с 16.7.13 по 23.8.13 - жильё | N106: Q | O106: Qг
B107: В строке выбора дат указать период с 18.7.13 по 25.8.13 - не жилое | N107: =(R[-21]C[-10]*R[-22]C[-7]-R[-21]C[-9]*R[-22]C[-6])/1000 -> 204.85216110666667 | O107: =IF(R[-22]C[-2]="",R[-21]C[-3]*R[-22]C/1000,"") ->  | P107: Си2
O108: =IF(R[-23]C[-2]="","",((R[-22]C[-3]*R[-23]C)-(R[-22]C[-2]*R[-23]C[2]))/1000) -> 20.824272066666666 | P108: Си3