Sheet: Лист1
G1: Отчёт о теплопотреблении за сентябрь 2018 | M1: письмо
A4: =EOMONTH(R[9]C,0)-R[9]C -> 9 | B4: Потребитель: ЗАО "Сити Сервис"
A5: =MAX(R[9]C:R[78]C) -> 2018-09-22T00:00:00.000 | B5: Адрес: г. СПб, Морская наб., д.25 ИТП 2
A6: =EOMONTH(R[-1]C,0)-R[-1]C -> 8 | B6: Телефон: 8-911-021-19-79
A7: =R[-2]C-R[6]C -> 31 | B7: Договор 10023 (.) 365, 87483, 87484
A8: 7 | B8: Тепловычислитель: СПТ-943 № 13671 | L8: М2 мах= | M8: 155.76 | O8: Мгвс мах= | P8: 78.24
L9: Qотоп мах= | M9: 12 | O9: Qгвс мах= | P9: 4.56
B10: Расчётная формула: Q=M1*(h1-hхв)-M2*(h2-hхв)
D12: Учёт - ОТОПЛЕНИЕ | M12: Учёт - ГВС
A13: =R[1]C-1 -> 43334 | B13: Дата | C13: N, ч | D13: M1, т | E13: T1, С | F13: P1, кг/см2 | G13: M2, т | H13: T2, С | I13: P2, кг/см2 | J13: dT, гр.C | K13: M1-М2, т | L13: Qотоп, Гкал | M13: V3, м3 | N13: T3, С | O13: V4, м3 | P13: T4, С | Q13: dT, гр.C | R13: V3-V4, м3 | S13: Qгвс, Гкал | T13: Qобщ. | U13: Qo | V13: M3 | W13: M4 | X13: си4 | Y13: си5 | Z13: ТСО | AA13: Внутр. | AD13: Дата | AE13: НС | AF13: n, ч | AG13: М1, т | AH13: t1, гр. С | AI13: Р1, кгс/см2 | AJ13: М2, т | AK13: t2, гр. С | AL13: Р2, кгс/см2 | AM13: t1-t2, гр. С | AN13: М1-М2, т | AO13: Wотоп, Гкал | AP13: М1гвс, т | AQ13: t1гвс, гр. С | AR13: Р1гвс, кгс/см2 | AS13: М2гвс, т | AT13: t2гвс, гр. С | AU13: Р2гвс, кгс/см2 | AV13: t1гвс-t2гвс | AW13: М1гвс-М2гвс, т | AX13: Wгвс, Гкал | AY13: Wсумм, Гкал | BA13: NS_TV1 | BB13: НС | BC13: NS_TV2
A14: =IF(RC[1]="","",DATEVALUE(RC[1])) -> 43335 | B14: 23.08.18 | C14: 24 | M14: 0 | N14: 25.576342 | O14: 5.9340999999999998E-2 | P14: 46.861324000000003 | Q14: =RC[-3]-RC[-1] -> -21.284982000000003 | R14: 0.29072599999999998 | S14: =RC[6] -> 6.175951297355999E-3 | T14: =RC[-1] -> 6.175951297355999E-3 | U14: =(RC[-17]*RC[-16]-RC[-14]*RC[-13])/1000 -> 0 | V14: 0.34906799999999999 | W14: 5.8724999999999999E-2 | X14: =RC[-2]*RC[-10]/1000 -> 8.9278825492559999E-3 | Y14: =(RC[-3]*RC[-11]-RC[-2]*RC[-9])/1000 -> 6.175951297355999E-3 | Z14: 2013-11-23T00:00:00.000 | AA14: 2013-11-21T00:00:00.000 | AD14: =VALUE(RC[-28]) -> 2018-08-23T00:00:00.000 | AE14: =IF(RC[22]=42,"*",IF(RC[22]=32,"",RC[22])) -> - | AF14: =RC[-29] -> 24 | AG14: =RC[-29] -> 0 | AH14: =RC[-29] -> 0 | AI14: =RC[-29] -> 0 | AJ14: =RC[-29] -> 0 | AK14: =RC[-29] -> 0 | AL14: =RC[-29] -> 0 | AM14: =RC[-29] -> 0 | AN14: =RC[-29] -> 0 | AO14: =RC[-29] -> 0 | AP14: =RC[-29] -> 0 | AQ14: =RC[-29] -> 25.576342 | AR14: - | AS14: =RC[-30] -> 5.9340999999999998E-2 | AT14: =RC[-30] -> 46.861324000000003 | AU14: - | AV14: =RC[-31] -> -21.284982000000003 | AW14: =RC[-31] -> 0.29072599999999998 | AX14: =RC[-31] -> 6.175951297355999E-3 | AY14: =RC[-31] -> 6.175951297355999E-3 | BA14: - | BB14: * | BC14: -
A15: =IF(RC[1]="","",DATEVALUE(RC[1])) -> 43336 | B15: 24.08.18 | C15: 24 | M15: 0 | N15: 24.728172000000001 | O15: 4.1474999999999998E-2 | P15: 42.478115000000003 | Q15: =RC[-3]-RC[-1] -> -17.749943000000002 | R15: 0.149392 | S15: =RC[6] -> 2.9606961239230004E-3 | T15: =RC[-1] -> 2.9606961239230004E-3 | U15: =(RC[-17]*RC[-16]-RC[-14]*RC[-13])/1000 -> 0 | V15: 0.19036400000000001 | W15: 4.1119000000000003E-2 | X15: =RC[-2]*RC[-10]/1000 -> 4.7073537346080004E-3 | Y15: =(RC[-3]*RC[-11]-RC[-2]*RC[-9])/1000 -> 2.9606961239230004E-3 | Z15: 2013-11-24T00:00:00.000 | AA15: 2013-11-22T00:00:00.000 | AD15: =VALUE(RC[-28]) -> 2018-08-24T00:00:00.000 | AE15: =IF(RC[22]=42,"*",IF(RC[22]=32,"",RC[22])) -> - | AF15: =RC[-29] -> 24 | AG15: =RC[-29] -> 0 | AH15: =RC[-29] -> 0 | AI15: =RC[-29] -> 0 | AJ15: =RC[-29] -> 0 | AK15: =RC[-29] -> 0 | AL15: =RC[-29] -> 0 | AM15: =RC[-29] -> 0 | AN15: =RC[-29] -> 0 | AO15: =RC[-29] -> 0 | AP15: =RC[-29] -> 0 | AQ15: =RC[-29] -> 24.728172000000001 | AR15: - | AS15: =RC[-30] -> 4.1474999999999998E-2 | AT15: =RC[-30] -> 42.478115000000003 | AU15: - | AV15: =RC[-31] -> -17.749943000000002 | AW15: =RC[-31] -> 0.149392 | AX15: =RC[-31] -> 2.9606961239230004E-3 | AY15: =RC[-31] -> 2.9606961239230004E-3 | BA15: - | BB15: * | BC15: -
A16: =IF(RC[1]="","",DATEVALUE(RC[1])) -> 43337 | B16: 25.08.18 | C16: 24 | M16: 0 | N16: 24.435392 | O16: 5.2183E-2 | P16: 38.664326000000003 | Q16: =RC[-3]-RC[-1] -> -14.228934000000002 | R16: 0.212284 | S16: =RC[6] -> 4.4424973326420009E-3 | T16: =RC[-1] -> 4.4424973326420009E-3 | U16: =(RC[-17]*RC[-16]-RC[-14]*RC[-13])/1000 -> 0 | V16: 0.26379000000000002 | W16: 5.1812999999999998E-2 | X16: =RC[-2]*RC[-10]/1000 -> 6.4458120556800001E-3 | Y16: =(RC[-3]*RC[-11]-RC[-2]*RC[-9])/1000 -> 4.4424973326420009E-3 | Z16: 2013-11-25T00:00:00.000 | AA16: 2013-11-23T00:00:00.000 | AD16: =VALUE(RC[-28]) -> 2018-08-25T00:00:00.000 | AE16: =IF(RC[22]=42,"*",IF(RC[22]=32,"",RC[22])) -> - | AF16: =RC[-29] -> 24 | AG16: =RC[-29] -> 0 | AH16: =RC[-29] -> 0 | AI16: =RC[-29] -> 0 | AJ16: =RC[-29] -> 0 | AK16: =RC[-29] -> 0 | AL16: =RC[-29] -> 0 | AM16: =RC[-29] -> 0 | AN16: =RC[-29] -> 0 | AO16: =RC[-29] -> 0 | AP16: =RC[-29] -> 0 | AQ16: =RC[-29] -> 24.435392 | AR16: - | AS16: =RC[-30] -> 5.2183E-2 | AT16: =RC[-30] -> 38.664326000000003 | AU16: - | AV16: =RC[-31] -> -14.228934000000002 | AW16: =RC[-31] -> 0.212284 | AX16: =RC[-31] -> 4.4424973326420009E-3 | AY16: =RC[-31] -> 4.4424973326420009E-3 | BA16: - | BB16: * | BC16: -
A17: =IF(RC[1]="","",DATEVALUE(RC[1])) -> 43338 | B17: 26.08.18 | C17: 24 | M17: 0 | N17: 24.028955 | O17: 5.9863E-2 | P17: 37.775573999999999 | Q17: =RC[-3]-RC[-1] -> -13.746618999999999 | R17: 0.23011499999999999 | S17: =RC[6] -> 4.7047133647569999E-3 | T17: =RC[-1] -> 4.7047133647569999E-3 | U17: =(RC[-17]*RC[-16]-RC[-14]*RC[-13])/1000 -> 0 | V17: 0.28926499999999999 | W17: 5.9457000000000003E-2 | X17: =RC[-2]*RC[-10]/1000 -> 6.9507356680749994E-3 | Y17: =(RC[-3]*RC[-11]-RC[-2]*RC[-9])/1000 -> 4.7047133647569999E-3 | Z17: 2013-11-26T00:00:00.000 | AA17: 2013-11-24T00:00:00.000 | AD17: =VALUE(RC[-28]) -> 2018-08-26T00:00:00.000 | AE17: =IF(RC[22]=42,"*",IF(RC[22]=32,"",RC[22])) -> - | AF17: =RC[-29] -> 24 | AG17: =RC[-29] -> 0 | AH17: =RC[-29] -> 0 | AI17: =RC[-29] -> 0 | AJ17: =RC[-29] -> 0 | AK17: =RC[-29] -> 0 | AL17: =RC[-29] -> 0 | AM17: =RC[-29] -> 0 | AN17: =RC[-29] -> 0 | AO17: =RC[-29] -> 0 | AP17: =RC[-29] -> 0 | AQ17: =RC[-29] -> 24.028955 | AR17: - | AS17: =RC[-30] -> 5.9863E-2 | AT17: =RC[-30] -> 37.775573999999999 | AU17: - | AV17: =RC[-31] -> -13.746618999999999 | AW17: =RC[-31] -> 0.23011499999999999 | AX17: =RC[-31] -> 4.7047133647569999E-3 | AY17: =RC[-31] -> 4.7047133647569999E-3 | BA17: - | BB17: * | BC17: -
A18: =IF(RC[1]="","",DATEVALUE(RC[1])) -> 43339 | B18: 27.08.18 | C18: 24 | M18: 13.959498999999999 | N18: 63.755496999999998 | O18: 9.0257939999999994 | P18: 47.119446000000003 | Q18: =RC[-3]-RC[-1] -> 16.636050999999995 | R18: 4.9337049999999998 | S18: 1.65351 | T18: =RC[-1] -> 1.65351 | U18: =(RC[-17]*RC[-16]-RC[-14]*RC[-13])/1000 -> 0 | V18: 13.699786 | W18: 8.9302779999999995 | X18: =RC[-2]*RC[-10]/1000 -> 0.87343666522364194 | Y18: =(RC[-3]*RC[-11]-RC[-2]*RC[-9])/1000 -> 0.45264691323765394 | Z18: 2013-11-27T00:00:00.000 | AA18: 2013-11-25T00:00:00.000 | AD18: =VALUE(RC[-28]) -> 2018-08-27T00:00:00.000 | AE18: =IF(RC[22]=42,"*",IF(RC[22]=32,"",RC[22])) -> - | AF18: =RC[-29] -> 24 | AG18: =RC[-29] -> 0 | AH18: =RC[-29] -> 0 | AI18: =RC[-29] -> 0 | AJ18: =RC[-29] -> 0 | AK18: =RC[-29] -> 0 | AL18: =RC[-29] -> 0 | AM18: =RC[-29] -> 0 | AN18: =RC[-29] -> 0 | AO18: =RC[-29] -> 0 | AP18: =RC[-29] -> 13.959498999999999 | AQ18: =RC[-29] -> 63.755496999999998 | AR18: - | AS18: =RC[-30] -> 9.0257939999999994 | AT18: =RC[-30] -> 47.119446000000003 | AU18: - | AV18: =RC[-31] -> 16.636050999999995 | AW18: =RC[-31] -> 4.9337049999999998 | AX18: =RC[-31] -> 1.65351 | AY18: =RC[-31] -> 1.65351 | BA18: - | BB18: * | BC18: -
A19: =IF(RC[1]="","",DATEVALUE(RC[1])) -> 43340 | B19: 28.08.18 | C19: 24 | M19: 53.295498000000002 | N19: 65.098076000000006 | O19: 41.000796999999999 | P19: 50.066657999999997 | Q19: =RC[-3]-RC[-1] -> 15.031418000000009 | R19: 12.294701 | S19: 1.3754919999999999 | T19: =RC[-1] -> 1.3754919999999999 | U19: =(RC[-17]*RC[-16]-RC[-14]*RC[-13])/1000 -> 0 | V19: 52.270007999999997 | W19: 40.518101000000001 | X19: =RC[-2]*RC[-10]/1000 -> 3.4026769533046082 | Y19: =(RC[-3]*RC[-11]-RC[-2]*RC[-9])/1000 -> 1.3740710477281501 | Z19: 2013-11-28T00:00:00.000 | AA19: 2013-11-26T00:00:00.000 | AD19: =VALUE(RC[-28]) -> 2018-08-28T00:00:00.000 | AE19: =IF(RC[22]=42,"*",IF(RC[22]=32,"",RC[22])) -> - | AF19: =RC[-29] -> 24 | AG19: =RC[-29] -> 0 | AH19: =RC[-29] -> 0 | AI19: =RC[-29] -> 0 | AJ19: =RC[-29] -> 0 | AK19: =RC[-29] -> 0 | AL19: =RC[-29] -> 0 | AM19: =RC[-29] -> 0 | AN19: =RC[-29] -> 0 | AO19: =RC[-29] -> 0 | AP19: =RC[-29] -> 53.295498000000002 | AQ19: =RC[-29] -> 65.098076000000006 | AR19: - | AS19: =RC[-30] -> 41.000796999999999 | AT19: =RC[-30] -> 50.066657999999997 | AU19: - | AV19: =RC[-31] -> 15.031418000000009 | AW19: =RC[-31] -> 12.294701 | AX19: =RC[-31] -> 1.3754919999999999 | AY19: =RC[-31] -> 1.3754919999999999 | BA19: - | BB19: * | BC19: -
A20: =IF(RC[1]="","",DATEVALUE(RC[1])) -> 43341 | B20: 29.08.18 | C20: 24 | M20: 55.530498999999999 | N20: 64.555915999999996 | O20: 42.511901999999999 | P20: 49.888984999999998 | Q20: =RC[-3]-RC[-1] -> 14.666930999999998 | R20: 13.018597 | S20: 1.4222790000000001 | T20: =RC[-1] -> 1.4222790000000001 | U20: =(RC[-17]*RC[-16]-RC[-14]*RC[-13])/1000 -> 0 | V20: 54.478306000000003 | W20: 42.014828000000001 | X20: =RC[-2]*RC[-10]/1000 -> 3.5168969459582957 | Y20: =(RC[-3]*RC[-11]-RC[-2]*RC[-9])/1000 -> 1.4208198220887156 | Z20: 2013-11-29T00:00:00.000 | AA20: 2013-11-27T00:00:00.000 | AD20: =VALUE(RC[-28]) -> 2018-08-29T00:00:00.000 | AE20: =IF(RC[22]=42,"*",IF(RC[22]=32,"",RC[22])) -> - | AF20: =RC[-29] -> 24 | AG20: =RC[-29] -> 0 | AH20: =RC[-29] -> 0 | AI20: =RC[-29] -> 0 | AJ20: =RC[-29] -> 0 | AK20: =RC[-29] -> 0 | AL20: =RC[-29] -> 0 | AM20: =RC[-29] -> 0 | AN20: =RC[-29] -> 0 | AO20: =RC[-29] -> 0 | AP20: =RC[-29] -> 55.530498999999999 | AQ20: =RC[-29] -> 64.555915999999996 | AR20: - | AS20: =RC[-30] -> 42.511901999999999 | AT20: =RC[-30] -> 49.888984999999998 | AU20: - | AV20: =RC[-31] -> 14.666930999999998 | AW20: =RC[-31] -> 13.018597 | AX20: =RC[-31] -> 1.4222790000000001 | AY20: =RC[-31] -> 1.4222790000000001 | BA20: - | BB20: * | BC20: -
A21: =IF(RC[1]="","",DATEVALUE(RC[1])) -> 43342 | B21: 30.08.18 | C21: 24 | M21: 58.305999999999997 | N21: 63.051346000000002 | O21: 46.329796000000002 | P21: 49.818221999999999 | Q21: =RC[-3]-RC[-1] -> 13.233124000000004 | R21: 11.976203999999999 | S21: 1.3298779999999999 | T21: =RC[-1] -> 1.3298779999999999 | U21: =(RC[-17]*RC[-16]-RC[-14]*RC[-13])/1000 -> 0 | V21: 57.248309999999996 | W21: 45.789546999999999 | X21: =RC[-2]*RC[-10]/1000 -> 3.6095830017252597 | Y21: =(RC[-3]*RC[-11]-RC[-2]*RC[-9])/1000 -> 1.3284291839998259 | Z21: 2013-11-30T00:00:00.000 | AA21: 2013-11-28T00:00:00.000 | AD21: =VALUE(RC[-28]) -> 2018-08-30T00:00:00.000 | AE21: =IF(RC[22]=42,"*",IF(RC[22]=32,"",RC[22])) -> - | AF21: =RC[-29] -> 24 | AG21: =RC[-29] -> 0 | AH21: =RC[-29] -> 0 | AI21: =RC[-29] -> 0 | AJ21: =RC[-29] -> 0 | AK21: =RC[-29] -> 0 | AL21: =RC[-29] -> 0 | AM21: =RC[-29] -> 0 | AN21: =RC[-29] -> 0 | AO21: =RC[-29] -> 0 | AP21: =RC[-29] -> 58.305999999999997 | AQ21: =RC[-29] -> 63.051346000000002 | AR21: - | AS21: =RC[-30] -> 46.329796000000002 | AT21: =RC[-30] -> 49.818221999999999 | AU21: - | AV21: =RC[-31] -> 13.233124000000004 | AW21: =RC[-31] -> 11.976203999999999 | AX21: =RC[-31] -> 1.3298779999999999 | AY21: =RC[-31] -> 1.3298779999999999 | BA21: - | BB21: * | BC21: -
A22: =IF(RC[1]="","",DATEVALUE(RC[1])) -> 43343 | B22: 31.08.18 | C22: 24 | M22: 39.786498999999999 | N22: 63.045054999999998 | O22: 23.428642 | P22: 50.159160999999997 | Q22: =RC[-3]-RC[-1] -> 12.885894 | R22: 16.357856999999999 | S22: 1.302786 | T22: =RC[-1] -> 1.302786 | U22: =(RC[-17]*RC[-16]-RC[-14]*RC[-13])/1000 -> 0 | V22: 39.064781000000004 | W22: 23.151789000000001 | X22: =RC[-2]*RC[-10]/1000 -> 2.4628412667079553 | Y22: =(RC[-3]*RC[-11]-RC[-2]*RC[-9])/1000 -> 1.3015669548189261 | Z22: 2013-12-01T00:00:00.000 | AA22: 2013-11-29T00:00:00.000 | AD22: =VALUE(RC[-28]) -> 2018-08-31T00:00:00.000 | AE22: =IF(RC[22]=42,"*",IF(RC[22]=32,"",RC[22])) -> - | AF22: =RC[-29] -> 24 | AG22: =RC[-29] -> 0 | AH22: =RC[-29] -> 0 | AI22: =RC[-29] -> 0 | AJ22: =RC[-29] -> 0 | AK22: =RC[-29] -> 0 | AL22: =RC[-29] -> 0 | AM22: =RC[-29] -> 0 | AN22: =RC[-29] -> 0 | AO22: =RC[-29] -> 0 | AP22: =RC[-29] -> 39.786498999999999 | AQ22: =RC[-29] -> 63.045054999999998 | AR22: - | AS22: =RC[-30] -> 23.428642 | AT22: =RC[-30] -> 50.159160999999997 | AU22: - | AV22: =RC[-31] -> 12.885894 | AW22: =RC[-31] -> 16.357856999999999 | AX22: =RC[-31] -> 1.302786 | AY22: =RC[-31] -> 1.302786 | BA22: - | BB22: * | BC22: -
A23: =IF(RC[1]="","",DATEVALUE(RC[1])) -> 43344 | B23: 01.09.18 | C23: 24 | M23: 16.562998 | N23: 62.336849000000001 | O23: 0.128971 | P23: 25.716196 | Q23: =RC[-3]-RC[-1] -> 36.620653000000004 | R23: 16.434027 | S23: 1.011595 | T23: =RC[-1] -> 1.011595 | U23: =(RC[-17]*RC[-16]-RC[-14]*RC[-13])/1000 -> 0 | V23: 16.268667000000001 | W23: 0.12859300000000001 | X23: =RC[-2]*RC[-10]/1000 -> 1.014137438210283 | Y23: =(RC[-3]*RC[-11]-RC[-2]*RC[-9])/1000 -> 1.0108305154180552 | Z23: 2013-12-02T00:00:00.000 | AA23: 2013-11-30T00:00:00.000 | AD23: =VALUE(RC[-28]) -> 2018-09-01T00:00:00.000 | AE23: =IF(RC[22]=42,"*",IF(RC[22]=32,"",RC[22])) -> - | AF23: =RC[-29] -> 24 | AG23: =RC[-29] -> 0 | AH23: =RC[-29] -> 0 | AI23: =RC[-29] -> 0 | AJ23: =RC[-29] -> 0 | AK23: =RC[-29] -> 0 | AL23: =RC[-29] -> 0 | AM23: =RC[-29] -> 0 | AN23: =RC[-29] -> 0 | AO23: =RC[-29] -> 0 | AP23: =RC[-29] -> 16.562998 | AQ23: =RC[-29] -> 62.336849000000001 | AR23: - | AS23: =RC[-30] -> 0.128971 | AT23: =RC[-30] -> 25.716196 | AU23: - | AV23: =RC[-31] -> 36.620653000000004 | AW23: =RC[-31] -> 16.434027 | AX23: =RC[-31] -> 1.011595 | AY23: =RC[-31] -> 1.011595 | BA23: - | BB23: * | BC23: -
A24: =IF(RC[1]="","",DATEVALUE(RC[1])) -> 43345 | B24: 02.09.18 | C24: 24 | M24: 17.166964 | N24: 62.822280999999997 | O24: 0.137409 | P24: 25.394278 | Q24: =RC[-3]-RC[-1] -> 37.428002999999997 | R24: 17.029554999999998 | S24: 1.056284 | T24: =RC[-1] -> 1.056284 | U24: =(RC[-17]*RC[-16]-RC[-14]*RC[-13])/1000 -> 0 | V24: 16.857230999999999 | W24: 0.137018 | X24: =RC[-2]*RC[-10]/1000 -> 1.0590097027639107 | Y24: =(RC[-3]*RC[-11]-RC[-2]*RC[-9])/1000 -> 1.0555302295809068 | Z24: 2013-12-03T00:00:00.000 | AA24: 2013-12-01T00:00:00.000 | AD24: =VALUE(RC[-28]) -> 2018-09-02T00:00:00.000 | AE24: =IF(RC[22]=42,"*",IF(RC[22]=32,"",RC[22])) -> - | AF24: =RC[-29] -> 24 | AG24: =RC[-29] -> 0 | AH24: =RC[-29] -> 0 | AI24: =RC[-29] -> 0 | AJ24: =RC[-29] -> 0 | AK24: =RC[-29] -> 0 | AL24: =RC[-29] -> 0 | AM24: =RC[-29] -> 0 | AN24: =RC[-29] -> 0 | AO24: =RC[-29] -> 0 | AP24: =RC[-29] -> 17.166964 | AQ24: =RC[-29] -> 62.822280999999997 | AR24: - | AS24: =RC[-30] -> 0.137409 | AT24: =RC[-30] -> 25.394278 | AU24: - | AV24: =RC[-31] -> 37.428002999999997 | AW24: =RC[-31] -> 17.029554999999998 | AX24: =RC[-31] -> 1.056284 | AY24: =RC[-31] -> 1.056284 | BA24: - | BB24: * | BC24: -
A25: =IF(RC[1]="","",DATEVALUE(RC[1])) -> 43346 | B25: 03.09.18 | C25: 24 | M25: 25.937495999999999 | N25: 63.781773000000001 | O25: 9.3855900000000005 | P25: 51.651874999999997 | Q25: =RC[-3]-RC[-1] -> 12.129898000000004 | R25: 16.551905999999999 | S25: 1.1459429999999999 | T25: =RC[-1] -> 1.1459429999999999 | U25: =(RC[-17]*RC[-16]-RC[-14]*RC[-13])/1000 -> 0 | V25: 25.45656 | W25: 9.2678890000000003 | X25: =RC[-2]*RC[-10]/1000 -> 1.62366453128088 | Y25: =(RC[-3]*RC[-11]-RC[-2]*RC[-9])/1000 -> 1.1449606871390052 | Z25: 2013-12-04T00:00:00.000 | AA25: 2013-12-02T00:00:00.000 | AD25: =VALUE(RC[-28]) -> 2018-09-03T00:00:00.000 | AE25: =IF(RC[22]=42,"*",IF(RC[22]=32,"",RC[22])) -> - | AF25: =RC[-29] -> 24 | AG25: =RC[-29] -> 0 | AH25: =RC[-29] -> 0 | AI25: =RC[-29] -> 0 | AJ25: =RC[-29] -> 0 | AK25: =RC[-29] -> 0 | AL25: =RC[-29] -> 0 | AM25: =RC[-29] -> 0 | AN25: =RC[-29] -> 0 | AO25: =RC[-29] -> 0 | AP25: =RC[-29] -> 25.937495999999999 | AQ25: =RC[-29] -> 63.781773000000001 | AR25: - | AS25: =RC[-30] -> 9.3855900000000005 | AT25: =RC[-30] -> 51.651874999999997 | AU25: - | AV25: =RC[-31] -> 12.129898000000004 | AW25: =RC[-31] -> 16.551905999999999 | AX25: =RC[-31] -> 1.1459429999999999 | AY25: =RC[-31] -> 1.1459429999999999 | BA25: - | BB25: * | BC25: -
A26: =IF(RC[1]="","",DATEVALUE(RC[1])) -> 43347 | B26: 04.09.18 | C26: 24 | M26: 56.042492000000003 | N26: 65.144112000000007 | O26: 43.719200000000001 | P26: 52.654648000000002 | Q26: =RC[-3]-RC[-1] -> 12.489464000000005 | R26: 12.323292 | S26: 1.309847 | T26: =RC[-1] -> 1.309847 | U26: =(RC[-17]*RC[-16]-RC[-14]*RC[-13])/1000 -> 0 | V26: 54.962741999999999 | W26: 43.152282999999997 | X26: =RC[-2]*RC[-10]/1000 -> 3.5804990206751044 | Y26: =(RC[-3]*RC[-11]-RC[-2]*RC[-9])/1000 -> 1.3083307489137206 | Z26: 2013-12-05T00:00:00.000 | AA26: 2013-12-03T00:00:00.000 | AD26: =VALUE(RC[-28]) -> 2018-09-04T00:00:00.000 | AE26: =IF(RC[22]=42,"*",IF(RC[22]=32,"",RC[22])) -> - | AF26: =RC[-29] -> 24 | AG26: =RC[-29] -> 0 | AH26: =RC[-29] -> 0 | AI26: =RC[-29] -> 0 | AJ26: =RC[-29] -> 0 | AK26: =RC[-29] -> 0 | AL26: =RC[-29] -> 0 | AM26: =RC[-29] -> 0 | AN26: =RC[-29] -> 0 | AO26: =RC[-29] -> 0 | AP26: =RC[-29] -> 56.042492000000003 | AQ26: =RC[-29] -> 65.144112000000007 | AR26: - | AS26: =RC[-30] -> 43.719200000000001 | AT26: =RC[-30] -> 52.654648000000002 | AU26: - | AV26: =RC[-31] -> 12.489464000000005 | AW26: =RC[-31] -> 12.323292 | AX26: =RC[-31] -> 1.309847 | AY26: =RC[-31] -> 1.309847 | BA26: - | BB26: * | BC26: -
A27: =IF(RC[1]="","",DATEVALUE(RC[1])) -> 43348 | B27: 05.09.18 | C27: 24 | M27: 55.874496000000001 | N27: 65.377457000000007 | O27: 43.141098 | P27: 52.948245999999997 | Q27: =RC[-3]-RC[-1] -> 12.429211000000009 | R27: 12.733397999999999 | S27: 1.329313 | T27: =RC[-1] -> 1.329313 | U27: =(RC[-17]*RC[-16]-RC[-14]*RC[-13])/1000 -> 0 | V27: 54.790858999999998 | W27: 42.575729000000003 | X27: =RC[-2]*RC[-10]/1000 -> 3.5820870282655632 | Y27: =(RC[-3]*RC[-11]-RC[-2]*RC[-9])/1000 -> 1.3277768555442295 | Z27: 2013-12-06T00:00:00.000 | AA27: 2013-12-04T00:00:00.000 | AD27: =VALUE(RC[-28]) -> 2018-09-05T00:00:00.000 | AE27: =IF(RC[22]=42,"*",IF(RC[22]=32,"",RC[22])) -> - | AF27: =RC[-29] -> 24 | AG27: =RC[-29] -> 0 | AH27: =RC[-29] -> 0 | AI27: =RC[-29] -> 0 | AJ27: =RC[-29] -> 0 | AK27: =RC[-29] -> 0 | AL27: =RC[-29] -> 0 | AM27: =RC[-29] -> 0 | AN27: =RC[-29] -> 0 | AO27: =RC[-29] -> 0 | AP27: =RC[-29] -> 55.874496000000001 | AQ27: =RC[-29] -> 65.377457000000007 | AR27: - | AS27: =RC[-30] -> 43.141098 | AT27: =RC[-30] -> 52.948245999999997 | AU27: - | AV27: =RC[-31] -> 12.429211000000009 | AW27: =RC[-31] -> 12.733397999999999 | AX27: =RC[-31] -> 1.329313 | AY27: =RC[-31] -> 1.329313 | BA27: - | BB27: * | BC27: -
A28: =IF(RC[1]="","",DATEVALUE(RC[1])) -> 43349 | B28: 06.09.18 | C28: 24 | M28: 55.786991 | N28: 65.456337000000005 | O28: 43.145797999999999 | P28: 53.046436 | Q28: =RC[-3]-RC[-1] -> 12.409901000000005 | R28: 12.641192999999999 | S28: 1.3235440000000001 | T28: =RC[-1] -> 1.3235440000000001 | U28: =(RC[-17]*RC[-16]-RC[-14]*RC[-13])/1000 -> 0 | V28: 54.702660000000002 | W28: 42.578358000000001 | X28: =RC[-2]*RC[-10]/1000 -> 3.5806357477564204 | Y28: =(RC[-3]*RC[-11]-RC[-2]*RC[-9])/1000 -> 1.3220056051243323 | Z28: 2013-12-07T00:00:00.000 | AA28: 2013-12-05T00:00:00.000 | AD28: =VALUE(RC[-28]) -> 2018-09-06T00:00:00.000 | AE28: =IF(RC[22]=42,"*",IF(RC[22]=32,"",RC[22])) -> - | AF28: =RC[-29] -> 24 | AG28: =RC[-29] -> 0 | AH28: =RC[-29] -> 0 | AI28: =RC[-29] -> 0 | AJ28: =RC[-29] -> 0 | AK28: =RC[-29] -> 0 | AL28: =RC[-29] -> 0 | AM28: =RC[-29] -> 0 | AN28: =RC[-29] -> 0 | AO28: =RC[-29] -> 0 | AP28: =RC[-29] -> 55.786991 | AQ28: =RC[-29] -> 65.456337000000005 | AR28: - | AS28: =RC[-30] -> 43.145797999999999 | AT28: =RC[-30] -> 53.046436 | AU28: - | AV28: =RC[-31] -> 12.409901000000005 | AW28: =RC[-31] -> 12.641192999999999 | AX28: =RC[-31] -> 1.3235440000000001 | AY28: =RC[-31] -> 1.3235440000000001 | BA28: - | BB28: * | BC28: -
A29: =IF(RC[1]="","",DATEVALUE(RC[1])) -> 43350 | B29: 07.09.18 | C29: 24 | M29: 55.426490999999999 | N29: 65.533935999999997 | O29: 43.540503999999999 | P29: 53.126643999999999 | Q29: =RC[-3]-RC[-1] -> 12.407291999999998 | R29: 11.885987 | S29: 1.280416 | T29: =RC[-1] -> 1.280416 | U29: =(RC[-17]*RC[-16]-RC[-14]*RC[-13])/1000 -> 0 | V29: 54.346817000000001 | W29: 42.966244000000003 | X29: =RC[-2]*RC[-10]/1000 -> 3.5615608270817121 | Y29: =(RC[-3]*RC[-11]-RC[-2]*RC[-9])/1000 -> 1.2789084780765756 | Z29: 2013-12-08T00:00:00.000 | AA29: 2013-12-06T00:00:00.000 | AD29: =VALUE(RC[-28]) -> 2018-09-07T00:00:00.000 | AE29: =IF(RC[22]=42,"*",IF(RC[22]=32,"",RC[22])) -> - | AF29: =RC[-29] -> 24 | AG29: =RC[-29] -> 0 | AH29: =RC[-29] -> 0 | AI29: =RC[-29] -> 0 | AJ29: =RC[-29] -> 0 | AK29: =RC[-29] -> 0 | AL29: =RC[-29] -> 0 | AM29: =RC[-29] -> 0 | AN29: =RC[-29] -> 0 | AO29: =RC[-29] -> 0 | AP29: =RC[-29] -> 55.426490999999999 | AQ29: =RC[-29] -> 65.533935999999997 | AR29: - | AS29: =RC[-30] -> 43.540503999999999 | AT29: =RC[-30] -> 53.126643999999999 | AU29: - | AV29: =RC[-31] -> 12.407291999999998 | AW29: =RC[-31] -> 11.885987 | AX29: =RC[-31] -> 1.280416 | AY29: =RC[-31] -> 1.280416 | BA29: - | BB29: * | BC29: -
A30: =IF(RC[1]="","",DATEVALUE(RC[1])) -> 43351 | B30: 08.09.18 | C30: 24 | M30: 54.126995000000001 | N30: 64.954078999999993 | O30: 43.480395999999999 | P30: 52.609817999999997 | Q30: =RC[-3]-RC[-1] -> 12.344260999999996 | R30: 10.646599 | S30: 1.1919379999999999 | T30: =RC[-1] -> 1.1919379999999999 | U30: =(RC[-17]*RC[-16]-RC[-14]*RC[-13])/1000 -> 0 | V30: 53.089745000000001 | W30: 42.917518999999999 | X30: =RC[-2]*RC[-10]/1000 -> 3.4483954908198546 | Y30: =(RC[-3]*RC[-11]-RC[-2]*RC[-9])/1000 -> 1.1905126272183129 | Z30: 2013-12-09T00:00:00.000 | AA30: 2013-12-07T00:00:00.000 | AD30: =VALUE(RC[-28]) -> 2018-09-08T00:00:00.000 | AE30: =IF(RC[22]=42,"*",IF(RC[22]=32,"",RC[22])) -> - | AF30: =RC[-29] -> 24 | AG30: =RC[-29] -> 0 | AH30: =RC[-29] -> 0 | AI30: =RC[-29] -> 0 | AJ30: =RC[-29] -> 0 | AK30: =RC[-29] -> 0 | AL30: =RC[-29] -> 0 | AM30: =RC[-29] -> 0 | AN30: =RC[-29] -> 0 | AO30: =RC[-29] -> 0 | AP30: =RC[-29] -> 54.126995000000001 | AQ30: =RC[-29] -> 64.954078999999993 | AR30: - | AS30: =RC[-30] -> 43.480395999999999 | AT30: =RC[-30] -> 52.609817999999997 | AU30: - | AV30: =RC[-31] -> 12.344260999999996 | AW30: =RC[-31] -> 10.646599 | AX30: =RC[-31] -> 1.1919379999999999 | AY30: =RC[-31] -> 1.1919379999999999 | BA30: - | BB30: * | BC30: -
A31: =IF(RC[1]="","",DATEVALUE(RC[1])) -> 43352 | B31: 09.09.18 | C31: 24 | M31: 53.194991999999999 | N31: 64.833243999999993 | O31: 41.908295000000003 | P31: 52.228569 | Q31: =RC[-3]-RC[-1] -> 12.604674999999993 | R31: 11.286697 | S31: 1.223489 | T31: =RC[-1] -> 1.223489 | U31: =(RC[-17]*RC[-16]-RC[-14]*RC[-13])/1000 -> 0 | V31: 52.179088999999998 | W31: 41.373244999999997 | X31: =RC[-2]*RC[-10]/1000 -> 3.3829396088347159 | Y31: =(RC[-3]*RC[-11]-RC[-2]*RC[-9])/1000 -> 1.2220742275983107 | Z31: 2013-12-10T00:00:00.000 | AA31: 2013-12-08T00:00:00.000 | AD31: =VALUE(RC[-28]) -> 2018-09-09T00:00:00.000 | AE31: =IF(RC[22]=42,"*",IF(RC[22]=32,"",RC[22])) -> - | AF31: =RC[-29] -> 24 | AG31: =RC[-29] -> 0 | AH31: =RC[-29] -> 0 | AI31: =RC[-29] -> 0 | AJ31: =RC[-29] -> 0 | AK31: =RC[-29] -> 0 | AL31: =RC[-29] -> 0 | AM31: =RC[-29] -> 0 | AN31: =RC[-29] -> 0 | AO31: =RC[-29] -> 0 | AP31: =RC[-29] -> 53.194991999999999 | AQ31: =RC[-29] -> 64.833243999999993 | AR31: - | AS31: =RC[-30] -> 41.908295000000003 | AT31: =RC[-30] -> 52.228569 | AU31: - | AV31: =RC[-31] -> 12.604674999999993 | AW31: =RC[-31] -> 11.286697 | AX31: =RC[-31] -> 1.223489 | AY31: =RC[-31] -> 1.223489 | BA31: - | BB31: * | BC31: -
A32: =IF(RC[1]="","",DATEVALUE(RC[1])) -> 43353 | B32: 10.09.18 | C32: 24 | M32: 33.202849999999998 | N32: 65.709129000000004 | O32: 24.967663000000002 | P32: 52.263030999999998 | Q32: =RC[-3]-RC[-1] -> 13.446098000000006 | R32: 8.2351869999999998 | S32: =RC[6] -> 0.85082648477774414 | T32: =RC[-1] -> 0.85082648477774414 | U32: =(RC[-17]*RC[-16]-RC[-14]*RC[-13])/1000 -> 0 | V32: 32.552363999999997 | W32: 24.647652000000001 | X32: =RC[-2]*RC[-10]/1000 -> 2.1389874853309561 | Y32: =(RC[-3]*RC[-11]-RC[-2]*RC[-9])/1000 -> 0.85082648477774414 | Z32: 2013-12-11T00:00:00.000 | AA32: 2013-12-09T00:00:00.000 | AD32: =VALUE(RC[-28]) -> 2018-09-10T00:00:00.000 | AE32: =IF(RC[22]=42,"*",IF(RC[22]=32,"",RC[22])) -> - | AF32: =RC[-29] -> 24 | AG32: =RC[-29] -> 0 | AH32: =RC[-29] -> 0 | AI32: =RC[-29] -> 0 | AJ32: =RC[-29] -> 0 | AK32: =RC[-29] -> 0 | AL32: =RC[-29] -> 0 | AM32: =RC[-29] -> 0 | AN32: =RC[-29] -> 0 | AO32: =RC[-29] -> 0 | AP32: =RC[-29] -> 33.202849999999998 | AQ32: =RC[-29] -> 65.709129000000004 | AR32: - | AS32: =RC[-30] -> 24.967663000000002 | AT32: =RC[-30] -> 52.263030999999998 | AU32: - | AV32: =RC[-31] -> 13.446098000000006 | AW32: =RC[-31] -> 8.2351869999999998 | AX32: =RC[-31] -> 0.85082648477774414 | AY32: =RC[-31] -> 0.85082648477774414 | BA32: - | BB32: * | BC32: -
A33: =IF(RC[1]="","",DATEVALUE(RC[1])) -> 43354 | B33: 11.09.18 | C33: 24 | M33: 30.078709 | N33: 63.326076999999998 | O33: 17.551067 | P33: 52.115569999999998 | Q33: =RC[-3]-RC[-1] -> 11.210507 | R33: 12.527642 | S33: 0.967557 | T33: =RC[-1] -> 0.967557 | U33: =(RC[-17]*RC[-16]-RC[-14]*RC[-13])/1000 -> 0 | V33: 29.527180000000001 | W33: 17.327696 | X33: =RC[-2]*RC[-10]/1000 -> 1.86984047427286 | Y33: =(RC[-3]*RC[-11]-RC[-2]*RC[-9])/1000 -> 0.9667977204461401 | Z33: 2013-12-12T00:00:00.000 | AA33: 2013-12-10T00:00:00.000 | AD33: =VALUE(RC[-28]) -> 2018-09-11T00:00:00.000 | AE33: =IF(RC[22]=42,"*",IF(RC[22]=32,"",RC[22])) -> - | AF33: =RC[-29] -> 24 | AG33: =RC[-29] -> 0 | AH33: =RC[-29] -> 0 | AI33: =RC[-29] -> 0 | AJ33: =RC[-29] -> 0 | AK33: =RC[-29] -> 0 | AL33: =RC[-29] -> 0 | AM33: =RC[-29] -> 0 | AN33: =RC[-29] -> 0 | AO33: =RC[-29] -> 0 | AP33: =RC[-29] -> 30.078709 | AQ33: =RC[-29] -> 63.326076999999998 | AR33: - | AS33: =RC[-30] -> 17.551067 | AT33: =RC[-30] -> 52.115569999999998 | AU33: - | AV33: =RC[-31] -> 11.210507 | AW33: =RC[-31] -> 12.527642 | AX33: =RC[-31] -> 0.967557 | AY33: =RC[-31] -> 0.967557 | BA33: - | BB33: * | BC33: -
A34: =IF(RC[1]="","",DATEVALUE(RC[1])) -> 43355 | B34: 12.09.18 | C34: 24 | M34: 17.078001 | N34: 59.889206000000001 | O34: 0.150644 | P34: 26.521796999999999 | Q34: =RC[-3]-RC[-1] -> 33.367409000000002 | R34: 16.927357000000001 | S34: 1.0026539999999999 | T34: =RC[-1] -> 1.0026539999999999 | U34: =(RC[-17]*RC[-16]-RC[-14]*RC[-13])/1000 -> 0 | V34: 16.796019000000001 | W34: 0.15017 | X34: =RC[-2]*RC[-10]/1000 -> 1.0059002418709142 | Y34: =(RC[-3]*RC[-11]-RC[-2]*RC[-9])/1000 -> 1.0019174636154242 | Z34: 2013-12-13T00:00:00.000 | AA34: 2013-12-11T00:00:00.000 | AD34: =VALUE(RC[-28]) -> 2018-09-12T00:00:00.000 | AE34: =IF(RC[22]=42,"*",IF(RC[22]=32,"",RC[22])) -> - | AF34: =RC[-29] -> 24 | AG34: =RC[-29] -> 0 | AH34: =RC[-29] -> 0 | AI34: =RC[-29] -> 0 | AJ34: =RC[-29] -> 0 | AK34: =RC[-29] -> 0 | AL34: =RC[-29] -> 0 | AM34: =RC[-29] -> 0 | AN34: =RC[-29] -> 0 | AO34: =RC[-29] -> 0 | AP34: =RC[-29] -> 17.078001 | AQ34: =RC[-29] -> 59.889206000000001 | AR34: - | AS34: =RC[-30] -> 0.150644 | AT34: =RC[-30] -> 26.521796999999999 | AU34: - | AV34: =RC[-31] -> 33.367409000000002 | AW34: =RC[-31] -> 16.927357000000001 | AX34: =RC[-31] -> 1.0026539999999999 | AY34: =RC[-31] -> 1.0026539999999999 | BA34: - | BB34: * | BC34: -
A35: =IF(RC[1]="","",DATEVALUE(RC[1])) -> 43356 | B35: 13.09.18 | C35: 24 | M35: 17.331499000000001 | N35: 59.688084000000003 | O35: 0.14665500000000001 | P35: 27.130236 | Q35: =RC[-3]-RC[-1] -> 32.557848000000007 | R35: 17.184843999999998 | S35: 1.0142910000000001 | T35: =RC[-1] -> 1.0142910000000001 | U35: =(RC[-17]*RC[-16]-RC[-14]*RC[-13])/1000 -> 0 | V35: 17.047118999999999 | W35: 0.14616899999999999 | X35: =RC[-2]*RC[-10]/1000 -> 1.0175098708299959 | Y35: =(RC[-3]*RC[-11]-RC[-2]*RC[-9])/1000 -> 1.0135442713641121 | Z35: 2013-12-14T00:00:00.000 | AA35: 2013-12-12T00:00:00.000 | AD35: =VALUE(RC[-28]) -> 2018-09-13T00:00:00.000 | AE35: =IF(RC[22]=42,"*",IF(RC[22]=32,"",RC[22])) -> - | AF35: =RC[-29] -> 24 | AG35: =RC[-29] -> 0 | AH35: =RC[-29] -> 0 | AI35: =RC[-29] -> 0 | AJ35: =RC[-29] -> 0 | AK35: =RC[-29] -> 0 | AL35: =RC[-29] -> 0 | AM35: =RC[-29] -> 0 | AN35: =RC[-29] -> 0 | AO35: =RC[-29] -> 0 | AP35: =RC[-29] -> 17.331499000000001 | AQ35: =RC[-29] -> 59.688084000000003 | AR35: - | AS35: =RC[-30] -> 0.14665500000000001 | AT35: =RC[-30] -> 27.130236 | AU35: - | AV35: =RC[-31] -> 32.557848000000007 | AW35: =RC[-31] -> 17.184843999999998 | AX35: =RC[-31] -> 1.0142910000000001 | AY35: =RC[-31] -> 1.0142910000000001 | BA35: - | BB35: * | BC35: -
A36: =IF(RC[1]="","",DATEVALUE(RC[1])) -> 43357 | B36: 14.09.18 | C36: 24 | M36: 17.674499999999998 | N36: 59.318226000000003 | O36: 0.14510600000000001 | P36: 27.156212 | Q36: =RC[-3]-RC[-1] -> 32.162013999999999 | R36: 17.529394 | S36: 1.0282750000000001 | T36: =RC[-1] -> 1.0282750000000001 | U36: =(RC[-17]*RC[-16]-RC[-14]*RC[-13])/1000 -> 0 | V36: 17.387965999999999 | W36: 0.144624 | X36: =RC[-2]*RC[-10]/1000 -> 1.0314232968683159 | Y36: =(RC[-3]*RC[-11]-RC[-2]*RC[-9])/1000 -> 1.027495856864028 | Z36: 2013-12-15T00:00:00.000 | AA36: 2013-12-13T00:00:00.000 | AD36: =VALUE(RC[-28]) -> 2018-09-14T00:00:00.000 | AE36: =IF(RC[22]=42,"*",IF(RC[22]=32,"",RC[22])) -> - | AF36: =RC[-29] -> 24 | AG36: =RC[-29] -> 0 | AH36: =RC[-29] -> 0 | AI36: =RC[-29] -> 0 | AJ36: =RC[-29] -> 0 | AK36: =RC[-29] -> 0 | AL36: =RC[-29] -> 0 | AM36: =RC[-29] -> 0 | AN36: =RC[-29] -> 0 | AO36: =RC[-29] -> 0 | AP36: =RC[-29] -> 17.674499999999998 | AQ36: =RC[-29] -> 59.318226000000003 | AR36: - | AS36: =RC[-30] -> 0.14510600000000001 | AT36: =RC[-30] -> 27.156212 | AU36: - | AV36: =RC[-31] -> 32.162013999999999 | AW36: =RC[-31] -> 17.529394 | AX36: =RC[-31] -> 1.0282750000000001 | AY36: =RC[-31] -> 1.0282750000000001 | BA36: - | BB36: * | BC36: -
A37: =IF(RC[1]="","",DATEVALUE(RC[1])) -> 43358 | B37: 15.09.18 | C37: 24 | M37: 17.444500000000001 | N37: 58.813564 | O37: 0.1512 | P37: 27.518393 | Q37: =RC[-3]-RC[-1] -> 31.295171 | R37: 17.293299999999999 | S37: 1.006227 | T37: =RC[-1] -> 1.006227 | U37: =(RC[-17]*RC[-16]-RC[-14]*RC[-13])/1000 -> 0 | V37: 17.166183 | W37: 0.15068300000000001 | X37: =RC[-2]*RC[-10]/1000 -> 1.0096044025062119 | Y37: =(RC[-3]*RC[-11]-RC[-2]*RC[-9])/1000 -> 1.005457848493793 | Z37: 2013-12-16T00:00:00.000 | AA37: 2013-12-14T00:00:00.000 | AD37: =VALUE(RC[-28]) -> 2018-09-15T00:00:00.000 | AE37: =IF(RC[22]=42,"*",IF(RC[22]=32,"",RC[22])) -> - | AF37: =RC[-29] -> 24 | AG37: =RC[-29] -> 0 | AH37: =RC[-29] -> 0 | AI37: =RC[-29] -> 0 | AJ37: =RC[-29] -> 0 | AK37: =RC[-29] -> 0 | AL37: =RC[-29] -> 0 | AM37: =RC[-29] -> 0 | AN37: =RC[-29] -> 0 | AO37: =RC[-29] -> 0 | AP37: =RC[-29] -> 17.444500000000001 | AQ37: =RC[-29] -> 58.813564 | AR37: - | AS37: =RC[-30] -> 0.1512 | AT37: =RC[-30] -> 27.518393 | AU37: - | AV37: =RC[-31] -> 31.295171 | AW37: =RC[-31] -> 17.293299999999999 | AX37: =RC[-31] -> 1.006227 | AY37: =RC[-31] -> 1.006227 | BA37: - | BB37: * | BC37: -
A38: =IF(RC[1]="","",DATEVALUE(RC[1])) -> 43359 | B38: 16.09.18 | C38: 24 | M38: 18.651499000000001 | N38: 59.601391 | O38: 0.14335400000000001 | P38: 26.805703999999999 | Q38: =RC[-3]-RC[-1] -> 32.795687000000001 | R38: 18.508144999999999 | S38: 1.0904750000000001 | T38: =RC[-1] -> 1.0904750000000001 | U38: =(RC[-17]*RC[-16]-RC[-14]*RC[-13])/1000 -> 0 | V38: 18.346464000000001 | W38: 0.14289199999999999 | X38: =RC[-2]*RC[-10]/1000 -> 1.0934747743314239 | Y38: =(RC[-3]*RC[-11]-RC[-2]*RC[-9])/1000 -> 1.0896444536754559 | Z38: 2013-12-17T00:00:00.000 | AA38: 2013-12-15T00:00:00.000 | AD38: =VALUE(RC[-28]) -> 2018-09-16T00:00:00.000 | AE38: =IF(RC[22]=42,"*",IF(RC[22]=32,"",RC[22])) -> - | AF38: =RC[-29] -> 24 | AG38: =RC[-29] -> 0 | AH38: =RC[-29] -> 0 | AI38: =RC[-29] -> 0 | AJ38: =RC[-29] -> 0 | AK38: =RC[-29] -> 0 | AL38: =RC[-29] -> 0 | AM38: =RC[-29] -> 0 | AN38: =RC[-29] -> 0 | AO38: =RC[-29] -> 0 | AP38: =RC[-29] -> 18.651499000000001 | AQ38: =RC[-29] -> 59.601391 | AR38: - | AS38: =RC[-30] -> 0.14335400000000001 | AT38: =RC[-30] -> 26.805703999999999 | AU38: - | AV38: =RC[-31] -> 32.795687000000001 | AW38: =RC[-31] -> 18.508144999999999 | AX38: =RC[-31] -> 1.0904750000000001 | AY38: =RC[-31] -> 1.0904750000000001 | BA38: - | BB38: * | BC38: -
A39: =IF(RC[1]="","",DATEVALUE(RC[1])) -> 43360 | B39: 17.09.18 | C39: 24 | M39: 33.223998999999999 | N39: 62.433033000000002 | O39: 15.563447999999999 | P39: 51.116233999999999 | Q39: =RC[-3]-RC[-1] -> 11.316799000000003 | R39: 17.660551000000002 | S39: 1.2525569999999999 | T39: =RC[-1] -> 1.2525569999999999 | U39: =(RC[-17]*RC[-16]-RC[-14]*RC[-13])/1000 -> 0 | V39: 32.631416000000002 | W39: 15.372394999999999 | X39: =RC[-2]*RC[-10]/1000 -> 2.0372782719647282 | Y39: =(RC[-3]*RC[-11]-RC[-2]*RC[-9])/1000 -> 1.2514993320042982 | Z39: 2013-12-18T00:00:00.000 | AA39: 2013-12-16T00:00:00.000 | AD39: =VALUE(RC[-28]) -> 2018-09-17T00:00:00.000 | AE39: =IF(RC[22]=42,"*",IF(RC[22]=32,"",RC[22])) -> - | AF39: =RC[-29] -> 24 | AG39: =RC[-29] -> 0 | AH39: =RC[-29] -> 0 | AI39: =RC[-29] -> 0 | AJ39: =RC[-29] -> 0 | AK39: =RC[-29] -> 0 | AL39: =RC[-29] -> 0 | AM39: =RC[-29] -> 0 | AN39: =RC[-29] -> 0 | AO39: =RC[-29] -> 0 | AP39: =RC[-29] -> 33.223998999999999 | AQ39: =RC[-29] -> 62.433033000000002 | AR39: - | AS39: =RC[-30] -> 15.563447999999999 | AT39: =RC[-30] -> 51.116233999999999 | AU39: - | AV39: =RC[-31] -> 11.316799000000003 | AW39: =RC[-31] -> 17.660551000000002 | AX39: =RC[-31] -> 1.2525569999999999 | AY39: =RC[-31] -> 1.2525569999999999 | BA39: - | BB39: * | BC39: -
A40: =IF(RC[1]="","",DATEVALUE(RC[1])) -> 43361 | B40: 18.09.18 | C40: 24 | M40: 56.198996999999999 | N40: 64.821251000000004 | O40: 42.425499000000002 | P40: 51.832172 | Q40: =RC[-3]-RC[-1] -> 12.989079000000004 | R40: 13.773498 | S40: 1.4035420000000001 | T40: =RC[-1] -> 1.4035420000000001 | U40: =(RC[-17]*RC[-16]-RC[-14]*RC[-13])/1000 -> 0 | V40: 55.126060000000003 | W40: 41.891651000000003 | X40: =RC[-2]*RC[-10]/1000 -> 3.5733401719010605 | Y40: =(RC[-3]*RC[-11]-RC[-2]*RC[-9])/1000 -> 1.4020049119050881 | Z40: 2013-12-19T00:00:00.000 | AA40: 2013-12-17T00:00:00.000 | AD40: =VALUE(RC[-28]) -> 2018-09-18T00:00:00.000 | AE40: =IF(RC[22]=42,"*",IF(RC[22]=32,"",RC[22])) -> - | AF40: =RC[-29] -> 24 | AG40: =RC[-29] -> 0 | AH40: =RC[-29] -> 0 | AI40: =RC[-29] -> 0 | AJ40: =RC[-29] -> 0 | AK40: =RC[-29] -> 0 | AL40: =RC[-29] -> 0 | AM40: =RC[-29] -> 0 | AN40: =RC[-29] -> 0 | AO40: =RC[-29] -> 0 | AP40: =RC[-29] -> 56.198996999999999 | AQ40: =RC[-29] -> 64.821251000000004 | AR40: - | AS40: =RC[-30] -> 42.425499000000002 | AT40: =RC[-30] -> 51.832172 | AU40: - | AV40: =RC[-31] -> 12.989079000000004 | AW40: =RC[-31] -> 13.773498 | AX40: =RC[-31] -> 1.4035420000000001 | AY40: =RC[-31] -> 1.4035420000000001 | BA40: - | BB40: * | BC40: -
A41: =IF(RC[1]="","",DATEVALUE(RC[1])) -> 43362 | B41: 19.09.18 | C41: 24 | M41: 55.52449 | N41: 64.674599000000001 | O41: 41.129398000000002 | P41: 51.612243999999997 | Q41: 13.062355000000004 | R41: 14.395092 | S41: 1.4279820000000001 | T41: =RC[-1] -> 1.4279820000000001 | U41: =(RC[-17]*RC[-16]-RC[-14]*RC[-13])/1000 -> 0 | X41: =RC[-2]*RC[-10]/1000 -> #VALUE! | Z41: 2013-12-20T00:00:00.000 | AA41: 2013-12-18T00:00:00.000 | AD41: =VALUE(RC[-28]) -> 2018-09-19T00:00:00.000 | AE41: =IF(RC[22]=42,"*",IF(RC[22]=32,"",RC[22])) ->  | AF41: =RC[-29] -> 24 | AG41: =RC[-29] -> 0 | AH41: =RC[-29] -> 0 | AI41: =RC[-29] -> 0 | AJ41: =RC[-29] -> 0 | AK41: =RC[-29] -> 0 | AL41: =RC[-29] -> 0 | AM41: =RC[-29] -> 0 | AN41: =RC[-29] -> 0 | AO41: =RC[-29] -> 0 | AP41: =RC[-29] -> 55.52449 | AQ41: =RC[-29] -> 64.674599000000001 | AR41: - | AS41: =RC[-30] -> 41.129398000000002 | AT41: =RC[-30] -> 51.612243999999997 | AU41: - | AV41: =RC[-31] -> 13.062355000000004 | AW41: =RC[-31] -> 14.395092 | AX41: =RC[-31] -> 1.4279820000000001 | AY41: =RC[-31] -> 1.4279820000000001
A42: =IF(RC[1]="","",DATEVALUE(RC[1])) -> 43363 | B42: 20.09.18 | C42: 24 | M42: 55.521492000000002 | N42: 65.676910000000007 | O42: 42.637196000000003 | P42: 52.436230000000002 | Q42: 13.240680000000005 | R42: 12.884296000000001 | S42: 1.3697319999999999 | T42: =RC[-1] -> 1.3697319999999999 | U42: =(RC[-17]*RC[-16]-RC[-14]*RC[-13])/1000 -> 0 | X42: =RC[-2]*RC[-10]/1000 -> #VALUE! | Z42: 2013-12-21T00:00:00.000 | AA42: 2013-12-19T00:00:00.000 | AD42: =VALUE(RC[-28]) -> 2018-09-20T00:00:00.000 | AE42: =IF(RC[22]=42,"*",IF(RC[22]=32,"",RC[22])) ->  | AF42: =RC[-29] -> 24 | AG42: =RC[-29] -> 0 | AH42: =RC[-29] -> 0 | AI42: =RC[-29] -> 0 | AJ42: =RC[-29] -> 0 | AK42: =RC[-29] -> 0 | AL42: =RC[-29] -> 0 | AM42: =RC[-29] -> 0 | AN42: =RC[-29] -> 0 | AO42: =RC[-29] -> 0 | AP42: =RC[-29] -> 55.521492000000002 | AQ42: =RC[-29] -> 65.676910000000007 | AR42: - | AS42: =RC[-30] -> 42.637196000000003 | AT42: =RC[-30] -> 52.436230000000002 | AU42: - | AV42: =RC[-31] -> 13.240680000000005 | AW42: =RC[-31] -> 12.884296000000001 | AX42: =RC[-31] -> 1.3697319999999999 | AY42: =RC[-31] -> 1.3697319999999999
A43: =IF(RC[1]="","",DATEVALUE(RC[1])) -> 43364 | B43: 21.09.18 | C43: 24 | M43: 52.139000000000003 | N43: 65.927764999999994 | O43: 39.373795000000001 | P43: 52.012279999999997 | Q43: 13.915484999999997 | R43: 12.765205 | S43: 1.349186 | T43: =RC[-1] -> 1.349186 | U43: =(RC[-17]*RC[-16]-RC[-14]*RC[-13])/1000 -> 0 | X43: =RC[-2]*RC[-10]/1000 -> #VALUE! | Z43: 2013-12-22T00:00:00.000 | AA43: 2013-12-20T00:00:00.000 | AD43: =VALUE(RC[-28]) -> 2018-09-21T00:00:00.000 | AE43: =IF(RC[22]=42,"*",IF(RC[22]=32,"",RC[22])) ->  | AF43: =RC[-29] -> 24 | AG43: =RC[-29] -> 0 | AH43: =RC[-29] -> 0 | AI43: =RC[-29] -> 0 | AJ43: =RC[-29] -> 0 | AK43: =RC[-29] -> 0 | AL43: =RC[-29] -> 0 | AM43: =RC[-29] -> 0 | AN43: =RC[-29] -> 0 | AO43: =RC[-29] -> 0 | AP43: =RC[-29] -> 52.139000000000003 | AQ43: =RC[-29] -> 65.927764999999994 | AR43: - | AS43: =RC[-30] -> 39.373795000000001 | AT43: =RC[-30] -> 52.012279999999997 | AU43: - | AV43: =RC[-31] -> 13.915484999999997 | AW43: =RC[-31] -> 12.765205 | AX43: =RC[-31] -> 1.349186 | AY43: =RC[-31] -> 1.349186
A44: =IF(RC[1]="","",DATEVALUE(RC[1])) -> 43365 | B44: 22.09.18 | C44: 24 | M44: 50.269996999999996 | N44: 66.108108999999999 | O44: 39.024303000000003 | P44: 51.867443000000002 | Q44: 14.240665999999997 | R44: 11.245694 | S44: 1.2602720000000001 | T44: =RC[-1] -> 1.2602720000000001 | U44: =(RC[-17]*RC[-16]-RC[-14]*RC[-13])/1000 -> 0 | X44: =RC[-2]*RC[-10]/1000 -> #VALUE! | AD44: =VALUE(RC[-28]) -> 2018-09-22T00:00:00.000 | AE44: =IF(RC[22]=42,"*",IF(RC[22]=32,"",RC[22])) ->  | AF44: =RC[-29] -> 24 | AG44: =RC[-29] -> 0 | AH44: =RC[-29] -> 0 | AI44: =RC[-29] -> 0 | AJ44: =RC[-29] -> 0 | AK44: =RC[-29] -> 0 | AL44: =RC[-29] -> 0 | AM44: =RC[-29] -> 0 | AN44: =RC[-29] -> 0 | AO44: =RC[-29] -> 0 | AP44: =RC[-29] -> 50.269996999999996 | AQ44: =RC[-29] -> 66.108108999999999 | AR44: - | AS44: =RC[-30] -> 39.024303000000003 | AT44: =RC[-30] -> 51.867443000000002 | AU44: - | AV44: =RC[-31] -> 14.240665999999997 | AW44: =RC[-31] -> 11.245694 | AX44: =RC[-31] -> 1.2602720000000001 | AY44: =RC[-31] -> 1.2602720000000001
A45: =IF(RC[1]="","",DATEVALUE(RC[1])) ->  | C45: 24 | Q45: =RC[-3]-RC[-1] -> #VALUE! | T45: =RC[-1] ->  | U45: =(RC[-17]*RC[-16]-RC[-14]*RC[-13])/1000 -> 0 | X45: =RC[-2]*RC[-10]/1000 -> #VALUE! | Y45: =(RC[-3]*RC[-11]-RC[-2]*RC[-9])/1000 -> #VALUE! | AD45: =VALUE(RC[-28]) -> #VALUE! | AE45: =IF(RC[22]=42,"*",IF(RC[22]=32,"",RC[22])) ->  | AF45: =RC[-29] -> 24 | AG45: =RC[-29] -> 0 | AH45: =RC[-29] -> 0 | AI45: =RC[-29] -> 0 | AJ45: =RC[-29] -> 0 | AK45: =RC[-29] -> 0 | AL45: =RC[-29] -> 0 | AM45: =RC[-29] -> 0 | AN45: =RC[-29] -> 0 | AO45: =RC[-29] -> 0 | AP45: =RC[-29] ->  | AQ45: =RC[-29] ->  | AR45: - | AS45: =RC[-30] ->  | AT45: =RC[-30] ->  | AU45: - | AV45: =RC[-31] -> #VALUE! | AW45: =RC[-31] ->  | AX45: =RC[-31] ->  | AY45: =RC[-31] -> 
A46: =IF(RC[1]="","",DATEVALUE(RC[1])) ->  | C46: 24 | Q46: =RC[-3]-RC[-1] -> #VALUE! | T46: =RC[-1] ->  | U46: =(RC[-17]*RC[-16]-RC[-14]*RC[-13])/1000 -> 0 | X46: =RC[-2]*RC[-10]/1000 -> #VALUE! | Y46: =(RC[-3]*RC[-11]-RC[-2]*RC[-9])/1000 -> #VALUE! | AD46: =VALUE(RC[-28]) -> #VALUE! | AE46: =IF(RC[22]=42,"*",IF(RC[22]=32,"",RC[22])) ->  | AF46: =RC[-29] -> 24 | AG46: =RC[-29] -> 0 | AH46: =RC[-29] -> 0 | AI46: =RC[-29] -> 0 | AJ46: =RC[-29] -> 0 | AK46: =RC[-29] -> 0 | AL46: =RC[-29] -> 0 | AM46: =RC[-29] -> 0 | AN46: =RC[-29] -> 0 | AO46: =RC[-29] -> 0 | AP46: =RC[-29] ->  | AQ46: =RC[-29] ->  | AR46: - | AS46: =RC[-30] ->  | AT46: =RC[-30] ->  | AU46: - | AV46: =RC[-31] -> #VALUE! | AW46: =RC[-31] ->  | AX46: =RC[-31] ->  | AY46: =RC[-31] -> 
A47: =IF(RC[1]="","",DATEVALUE(RC[1])) ->  | C47: 24 | Q47: =RC[-3]-RC[-1] -> #VALUE! | T47: =RC[-1] ->  | U47: =(RC[-17]*RC[-16]-RC[-14]*RC[-13])/1000 -> 0 | X47: =RC[-2]*RC[-10]/1000 -> #VALUE! | Y47: =(RC[-3]*RC[-11]-RC[-2]*RC[-9])/1000 -> #VALUE! | AD47: =VALUE(RC[-28]) -> #VALUE! | AE47: =IF(RC[22]=42,"*",IF(RC[22]=32,"",RC[22])) ->  | AF47: =RC[-29] -> 24 | AG47: =RC[-29] -> 0 | AH47: =RC[-29] -> 0 | AI47: =RC[-29] -> 0 | AJ47: =RC[-29] -> 0 | AK47: =RC[-29] -> 0 | AL47: =RC[-29] -> 0 | AM47: =RC[-29] -> 0 | AN47: =RC[-29] -> 0 | AO47: =RC[-29] -> 0 | AP47: =RC[-29] ->  | AQ47: =RC[-29] ->  | AR47: - | AS47: =RC[-30] ->  | AT47: =RC[-30] ->  | AU47: - | AV47: =RC[-31] -> #VALUE! | AW47: =RC[-31] ->  | AX47: =RC[-31] ->  | AY47: =RC[-31] -> 
A48: =IF(RC[1]="","",DATEVALUE(RC[1])) ->  | C48: 24 | Q48: =RC[-3]-RC[-1] -> #VALUE! | T48: =RC[-1] ->  | U48: =(RC[-17]*RC[-16]-RC[-14]*RC[-13])/1000 -> 0 | X48: =RC[-2]*RC[-10]/1000 -> #VALUE! | Y48: =(RC[-3]*RC[-11]-RC[-2]*RC[-9])/1000 -> #VALUE! | AD48: =VALUE(RC[-28]) -> #VALUE! | AE48: =IF(RC[22]=42,"*",IF(RC[22]=32,"",RC[22])) ->  | AF48: =RC[-29] -> 24 | AG48: =RC[-29] -> 0 | AH48: =RC[-29] -> 0 | AI48: =RC[-29] -> 0 | AJ48: =RC[-29] -> 0 | AK48: =RC[-29] -> 0 | AL48: =RC[-29] -> 0 | AM48: =RC[-29] -> 0 | AN48: =RC[-29] -> 0 | AO48: =RC[-29] -> 0 | AP48: =RC[-29] ->  | AQ48: =RC[-29] ->  | AR48: - | AS48: =RC[-30] ->  | AT48: =RC[-30] ->  | AU48: - | AV48: =RC[-31] -> #VALUE! | AW48: =RC[-31] ->  | AX48: =RC[-31] ->  | AY48: =RC[-31] -> 
A49: =IF(RC[1]="","",DATEVALUE(RC[1])) ->  | C49: 24 | Q49: =RC[-3]-RC[-1] -> #VALUE! | T49: =RC[-1] ->  | U49: =(RC[-17]*RC[-16]-RC[-14]*RC[-13])/1000 -> 0 | X49: =RC[-2]*RC[-10]/1000 -> #VALUE! | Y49: =(RC[-3]*RC[-11]-RC[-2]*RC[-9])/1000 -> #VALUE! | AD49: =VALUE(RC[-28]) -> #VALUE! | AE49: =IF(RC[22]=42,"*",IF(RC[22]=32,"",RC[22])) ->  | AF49: =RC[-29] -> 24 | AG49: =RC[-29] -> 0 | AH49: =RC[-29] -> 0 | AI49: =RC[-29] -> 0 | AJ49: =RC[-29] -> 0 | AK49: =RC[-29] -> 0 | AL49: =RC[-29] -> 0 | AM49: =RC[-29] -> 0 | AN49: =RC[-29] -> 0 | AO49: =RC[-29] -> 0 | AP49: =RC[-29] ->  | AQ49: =RC[-29] ->  | AR49: - | AS49: =RC[-30] ->  | AT49: =RC[-30] ->  | AU49: - | AV49: =RC[-31] -> #VALUE! | AW49: =RC[-31] ->  | AX49: =RC[-31] ->  | AY49: =RC[-31] -> 
A50: =IF(RC[1]="","",DATEVALUE(RC[1])) ->  | C50: 24 | Q50: =RC[-3]-RC[-1] -> #VALUE! | T50: =RC[-1] ->  | U50: =(RC[-17]*RC[-16]-RC[-14]*RC[-13])/1000 -> 0 | X50: =RC[-2]*RC[-10]/1000 -> #VALUE! | Y50: =(RC[-3]*RC[-11]-RC[-2]*RC[-9])/1000 -> #VALUE! | AD50: =VALUE(RC[-28]) -> #VALUE! | AE50: =IF(RC[22]=42,"*",IF(RC[22]=32,"",RC[22])) ->  | AF50: =RC[-29] -> 24 | AG50: =RC[-29] -> 0 | AH50: =RC[-29] -> 0 | AI50: =RC[-29] -> 0 | AJ50: =RC[-29] -> 0 | AK50: =RC[-29] -> 0 | AL50: =RC[-29] -> 0 | AM50: =RC[-29] -> 0 | AN50: =RC[-29] -> 0 | AO50: =RC[-29] -> 0 | AP50: =RC[-29] ->  | AQ50: =RC[-29] ->  | AR50: - | AS50: =RC[-30] ->  | AT50: =RC[-30] ->  | AU50: - | AV50: =RC[-31] -> #VALUE! | AW50: =RC[-31] ->  | AX50: =RC[-31] ->  | AY50: =RC[-31] -> 
A51: =IF(RC[1]="","",DATEVALUE(RC[1])) ->  | C51: 24 | Q51: =RC[-3]-RC[-1] -> #VALUE! | T51: =RC[-1] ->  | U51: =(RC[-17]*RC[-16]-RC[-14]*RC[-13])/1000 -> 0 | X51: =RC[-2]*RC[-10]/1000 -> #VALUE! | Y51: =(RC[-3]*RC[-11]-RC[-2]*RC[-9])/1000 -> #VALUE! | AD51: =VALUE(RC[-28]) -> #VALUE! | AE51: =IF(RC[22]=42,"*",IF(RC[22]=32,"",RC[22])) ->  | AF51: =RC[-29] -> 24 | AG51: =RC[-29] -> 0 | AH51: =RC[-29] -> 0 | AI51: =RC[-29] -> 0 | AJ51: =RC[-29] -> 0 | AK51: =RC[-29] -> 0 | AL51: =RC[-29] -> 0 | AM51: =RC[-29] -> 0 | AN51: =RC[-29] -> 0 | AO51: =RC[-29] -> 0 | AP51: =RC[-29] ->  | AQ51: =RC[-29] ->  | AR51: - | AS51: =RC[-30] ->  | AT51: =RC[-30] ->  | AU51: - | AV51: =RC[-31] -> #VALUE! | AW51: =RC[-31] ->  | AX51: =RC[-31] ->  | AY51: =RC[-31] -> 
A52: =IF(RC[1]="","",DATEVALUE(RC[1])) ->  | C52: 24 | Q52: =RC[-3]-RC[-1] -> #VALUE! | T52: =RC[-1] ->  | U52: =(RC[-17]*RC[-16]-RC[-14]*RC[-13])/1000 -> 0 | X52: =RC[-2]*RC[-10]/1000 -> #VALUE! | Y52: =(RC[-3]*RC[-11]-RC[-2]*RC[-9])/1000 -> #VALUE! | AD52: =VALUE(RC[-28]) -> #VALUE! | AE52: =IF(RC[22]=42,"*",IF(RC[22]=32,"",RC[22])) ->  | AF52: =RC[-29] -> 24 | AG52: =RC[-29] -> 0 | AH52: =RC[-29] -> 0 | AI52: =RC[-29] -> 0 | AJ52: =RC[-29] -> 0 | AK52: =RC[-29] -> 0 | AL52: =RC[-29] -> 0 | AM52: =RC[-29] -> 0 | AN52: =RC[-29] -> 0 | AO52: =RC[-29] -> 0 | AP52: =RC[-29] ->  | AQ52: =RC[-29] ->  | AR52: - | AS52: =RC[-30] ->  | AT52: =RC[-30] ->  | AU52: - | AV52: =RC[-31] -> #VALUE! | AW52: =RC[-31] ->  | AX52: =RC[-31] ->  | AY52: =RC[-31] -> 
A53: =IF(RC[1]="","",DATEVALUE(RC[1])) ->  | C53: 24 | Q53: =RC[-3]-RC[-1] -> #VALUE! | T53: =RC[-1] ->  | U53: =(RC[-17]*RC[-16]-RC[-14]*RC[-13])/1000 -> 0 | X53: =RC[-2]*RC[-10]/1000 -> #VALUE! | Y53: =(RC[-3]*RC[-11]-RC[-2]*RC[-9])/1000 -> #VALUE! | AD53: =VALUE(RC[-28]) -> #VALUE! | AE53: =IF(RC[22]=42,"*",IF(RC[22]=32,"",RC[22])) ->  | AF53: =RC[-29] -> 24 | AG53: =RC[-29] -> 0 | AH53: =RC[-29] -> 0 | AI53: =RC[-29] -> 0 | AJ53: =RC[-29] -> 0 | AK53: =RC[-29] -> 0 | AL53: =RC[-29] -> 0 | AM53: =RC[-29] -> 0 | AN53: =RC[-29] -> 0 | AO53: =RC[-29] -> 0 | AP53: =RC[-29] ->  | AQ53: =RC[-29] ->  | AR53: - | AS53: =RC[-30] ->  | AT53: =RC[-30] ->  | AU53: - | AV53: =RC[-31] -> #VALUE! | AW53: =RC[-31] ->  | AX53: =RC[-31] ->  | AY53: =RC[-31] -> 
A54: =IF(RC[1]="","",DATEVALUE(RC[1])) ->  | C54: 24 | Q54: =RC[-3]-RC[-1] -> #VALUE! | T54: =RC[-1] ->  | U54: =(RC[-17]*RC[-16]-RC[-14]*RC[-13])/1000 -> 0 | X54: =RC[-2]*RC[-10]/1000 -> #VALUE! | Y54: =(RC[-3]*RC[-11]-RC[-2]*RC[-9])/1000 -> #VALUE! | AD54: =VALUE(RC[-28]) -> #VALUE! | AE54: =IF(RC[22]=42,"*",IF(RC[22]=32,"",RC[22])) ->  | AF54: =RC[-29] -> 24 | AG54: =RC[-29] -> 0 | AH54: =RC[-29] -> 0 | AI54: =RC[-29] -> 0 | AJ54: =RC[-29] -> 0 | AK54: =RC[-29] -> 0 | AL54: =RC[-29] -> 0 | AM54: =RC[-29] -> 0 | AN54: =RC[-29] -> 0 | AO54: =RC[-29] -> 0 | AP54: =RC[-29] ->  | AQ54: =RC[-29] ->  | AR54: - | AS54: =RC[-30] ->  | AT54: =RC[-30] ->  | AU54: - | AV54: =RC[-31] -> #VALUE! | AW54: =RC[-31] ->  | AX54: =RC[-31] ->  | AY54: =RC[-31] -> 
A55: =IF(RC[1]="","",DATEVALUE(RC[1])) ->  | C55: 24 | Q55: =RC[-3]-RC[-1] -> #VALUE! | T55: =RC[-1] ->  | U55: =(RC[-17]*RC[-16]-RC[-14]*RC[-13])/1000 -> 0 | X55: =RC[-2]*RC[-10]/1000 -> #VALUE! | Y55: =(RC[-3]*RC[-11]-RC[-2]*RC[-9])/1000 -> #VALUE! | AD55: =VALUE(RC[-28]) -> #VALUE! | AE55: =IF(RC[22]=42,"*",IF(RC[22]=32,"",RC[22])) ->  | AF55: =RC[-29] -> 24 | AG55: =RC[-29] -> 0 | AH55: =RC[-29] -> 0 | AI55: =RC[-29] -> 0 | AJ55: =RC[-29] -> 0 | AK55: =RC[-29] -> 0 | AL55: =RC[-29] -> 0 | AM55: =RC[-29] -> 0 | AN55: =RC[-29] -> 0 | AO55: =RC[-29] -> 0 | AP55: =RC[-29] ->  | AQ55: =RC[-29] ->  | AR55: - | AS55: =RC[-30] ->  | AT55: =RC[-30] ->  | AU55: - | AV55: =RC[-31] -> #VALUE! | AW55: =RC[-31] ->  | AX55: =RC[-31] ->  | AY55: =RC[-31] -> 
A56: =IF(RC[1]="","",DATEVALUE(RC[1])) ->  | C56: 24 | Q56: =RC[-3]-RC[-1] -> #VALUE! | T56: =RC[-1] ->  | U56: =(RC[-17]*RC[-16]-RC[-14]*RC[-13])/1000 -> 0 | X56: =RC[-2]*RC[-10]/1000 -> #VALUE! | Y56: =(RC[-3]*RC[-11]-RC[-2]*RC[-9])/1000 -> #VALUE! | AD56: =VALUE(RC[-28]) -> #VALUE! | AE56: =IF(RC[22]=42,"*",IF(RC[22]=32,"",RC[22])) ->  | AF56: =RC[-29] -> 24 | AG56: =RC[-29] -> 0 | AH56: =RC[-29] -> 0 | AI56: =RC[-29] -> 0 | AJ56: =RC[-29] -> 0 | AK56: =RC[-29] -> 0 | AL56: =RC[-29] -> 0 | AM56: =RC[-29] -> 0 | AN56: =RC[-29] -> 0 | AO56: =RC[-29] -> 0 | AP56: =RC[-29] ->  | AQ56: =RC[-29] ->  | AR56: - | AS56: =RC[-30] ->  | AT56: =RC[-30] ->  | AU56: - | AV56: =RC[-31] -> #VALUE! | AW56: =RC[-31] ->  | AX56: =RC[-31] ->  | AY56: =RC[-31] -> 
A57: =IF(RC[1]="","",DATEVALUE(RC[1])) ->  | C57: 24 | Q57: =RC[-3]-RC[-1] -> #VALUE! | T57: =RC[-1] ->  | U57: =(RC[-17]*RC[-16]-RC[-14]*RC[-13])/1000 -> 0 | X57: =RC[-2]*RC[-10]/1000 -> #VALUE! | Y57: =(RC[-3]*RC[-11]-RC[-2]*RC[-9])/1000 -> #VALUE! | AD57: =VALUE(RC[-28]) -> #VALUE! | AE57: =IF(RC[22]=42,"*",IF(RC[22]=32,"",RC[22])) ->  | AF57: =RC[-29] -> 24 | AG57: =RC[-29] -> 0 | AH57: =RC[-29] -> 0 | AI57: =RC[-29] -> 0 | AJ57: =RC[-29] -> 0 | AK57: =RC[-29] -> 0 | AL57: =RC[-29] -> 0 | AM57: =RC[-29] -> 0 | AN57: =RC[-29] -> 0 | AO57: =RC[-29] -> 0 | AP57: =RC[-29] ->  | AQ57: =RC[-29] ->  | AR57: - | AS57: =RC[-30] ->  | AT57: =RC[-30] ->  | AU57: - | AV57: =RC[-31] -> #VALUE! | AW57: =RC[-31] ->  | AX57: =RC[-31] ->  | AY57: =RC[-31] -> 
A58: =IF(RC[1]="","",DATEVALUE(RC[1])) ->  | C58: 24 | Q58: =RC[-3]-RC[-1] -> #VALUE! | T58: =RC[-1] ->  | U58: =(RC[-17]*RC[-16]-RC[-14]*RC[-13])/1000 -> 0 | X58: =RC[-2]*RC[-10]/1000 -> #VALUE! | Y58: =(RC[-3]*RC[-11]-RC[-2]*RC[-9])/1000 -> #VALUE! | AD58: =VALUE(RC[-28]) -> #VALUE! | AE58: =IF(RC[22]=42,"*",IF(RC[22]=32,"",RC[22])) ->  | AF58: =RC[-29] -> 24 | AG58: =RC[-29] -> 0 | AH58: =RC[-29] -> 0 | AI58: =RC[-29] -> 0 | AJ58: =RC[-29] -> 0 | AK58: =RC[-29] -> 0 | AL58: =RC[-29] -> 0 | AM58: =RC[-29] -> 0 | AN58: =RC[-29] -> 0 | AO58: =RC[-29] -> 0 | AP58: =RC[-29] ->  | AQ58: =RC[-29] ->  | AR58: - | AS58: =RC[-30] ->  | AT58: =RC[-30] ->  | AU58: - | AV58: =RC[-31] -> #VALUE! | AW58: =RC[-31] ->  | AX58: =RC[-31] ->  | AY58: =RC[-31] -> 
A59: =IF(RC[1]="","",DATEVALUE(RC[1])) ->  | C59: 24 | Q59: =RC[-3]-RC[-1] -> #VALUE! | T59: =RC[-1] ->  | U59: =(RC[-17]*RC[-16]-RC[-14]*RC[-13])/1000 -> 0 | X59: =RC[-2]*RC[-10]/1000 -> #VALUE! | Y59: =(RC[-3]*RC[-11]-RC[-2]*RC[-9])/1000 -> #VALUE! | AD59: =VALUE(RC[-28]) -> #VALUE! | AE59: =IF(RC[22]=42,"*",IF(RC[22]=32,"",RC[22])) ->  | AF59: =RC[-29] -> 24 | AG59: =RC[-29] -> 0 | AH59: =RC[-29] -> 0 | AI59: =RC[-29] -> 0 | AJ59: =RC[-29] -> 0 | AK59: =RC[-29] -> 0 | AL59: =RC[-29] -> 0 | AM59: =RC[-29] -> 0 | AN59: =RC[-29] -> 0 | AO59: =RC[-29] -> 0 | AP59: =RC[-29] ->  | AQ59: =RC[-29] ->  | AR59: - | AS59: =RC[-30] ->  | AT59: =RC[-30] ->  | AU59: - | AV59: =RC[-31] -> #VALUE! | AW59: =RC[-31] ->  | AX59: =RC[-31] ->  | AY59: =RC[-31] -> 
A60: =IF(RC[1]="","",DATEVALUE(RC[1])) ->  | C60: 24 | Q60: =RC[-3]-RC[-1] -> #VALUE! | T60: =RC[-1] ->  | U60: =(RC[-17]*RC[-16]-RC[-14]*RC[-13])/1000 -> 0 | X60: =RC[-2]*RC[-10]/1000 -> #VALUE! | Y60: =(RC[-3]*RC[-11]-RC[-2]*RC[-9])/1000 -> #VALUE! | AD60: =VALUE(RC[-28]) -> #VALUE! | AE60: =IF(RC[22]=42,"*",IF(RC[22]=32,"",RC[22])) ->  | AF60: =RC[-29] -> 24 | AG60: =RC[-29] -> 0 | AH60: =RC[-29] -> 0 | AI60: =RC[-29] -> 0 | AJ60: =RC[-29] -> 0 | AK60: =RC[-29] -> 0 | AL60: =RC[-29] -> 0 | AM60: =RC[-29] -> 0 | AN60: =RC[-29] -> 0 | AO60: =RC[-29] -> 0 | AP60: =RC[-29] ->  | AQ60: =RC[-29] ->  | AR60: - | AS60: =RC[-30] ->  | AT60: =RC[-30] ->  | AU60: - | AV60: =RC[-31] -> #VALUE! | AW60: =RC[-31] ->  | AX60: =RC[-31] ->  | AY60: =RC[-31] -> 
A61: =IF(RC[1]="","",DATEVALUE(RC[1])) ->  | C61: 24 | Q61: =RC[-3]-RC[-1] -> #VALUE! | T61: =RC[-1] ->  | U61: =(RC[-17]*RC[-16]-RC[-14]*RC[-13])/1000 -> 0 | X61: =RC[-2]*RC[-10]/1000 -> #VALUE! | Y61: =(RC[-3]*RC[-11]-RC[-2]*RC[-9])/1000 -> #VALUE! | AD61: =VALUE(RC[-28]) -> #VALUE! | AE61: =IF(RC[22]=42,"*",IF(RC[22]=32,"",RC[22])) ->  | AF61: =RC[-29] -> 24 | AG61: =RC[-29] -> 0 | AH61: =RC[-29] -> 0 | AI61: =RC[-29] -> 0 | AJ61: =RC[-29] -> 0 | AK61: =RC[-29] -> 0 | AL61: =RC[-29] -> 0 | AM61: =RC[-29] -> 0 | AN61: =RC[-29] -> 0 | AO61: =RC[-29] -> 0 | AP61: =RC[-29] ->  | AQ61: =RC[-29] ->  | AR61: - | AS61: =RC[-30] ->  | AT61: =RC[-30] ->  | AU61: - | AV61: =RC[-31] -> #VALUE! | AW61: =RC[-31] ->  | AX61: =RC[-31] ->  | AY61: =RC[-31] -> 
A62: =IF(RC[1]="","",DATEVALUE(RC[1])) ->  | C62: 24 | Q62: =RC[-3]-RC[-1] -> #VALUE! | T62: =RC[-1] ->  | U62: =(RC[-17]*RC[-16]-RC[-14]*RC[-13])/1000 -> 0 | X62: =RC[-2]*RC[-10]/1000 -> #VALUE! | Y62: =(RC[-3]*RC[-11]-RC[-2]*RC[-9])/1000 -> #VALUE! | AD62: =VALUE(RC[-28]) -> #VALUE! | AE62: =IF(RC[22]=42,"*",IF(RC[22]=32,"",RC[22])) ->  | AF62: =RC[-29] -> 24 | AG62: =RC[-29] -> 0 | AH62: =RC[-29] -> 0 | AI62: =RC[-29] -> 0 | AJ62: =RC[-29] -> 0 | AK62: =RC[-29] -> 0 | AL62: =RC[-29] -> 0 | AM62: =RC[-29] -> 0 | AN62: =RC[-29] -> 0 | AO62: =RC[-29] -> 0 | AP62: =RC[-29] ->  | AQ62: =RC[-29] ->  | AR62: - | AS62: =RC[-30] ->  | AT62: =RC[-30] ->  | AU62: - | AV62: =RC[-31] -> #VALUE! | AW62: =RC[-31] ->  | AX62: =RC[-31] ->  | AY62: =RC[-31] -> 
A63: =IF(RC[1]="","",DATEVALUE(RC[1])) ->  | C63: 24 | Q63: =RC[-3]-RC[-1] -> #VALUE! | T63: =RC[-1] ->  | U63: =(RC[-17]*RC[-16]-RC[-14]*RC[-13])/1000 -> 0 | X63: =RC[-2]*RC[-10]/1000 -> #VALUE! | Y63: =(RC[-3]*RC[-11]-RC[-2]*RC[-9])/1000 -> #VALUE! | AD63: =VALUE(RC[-28]) -> #VALUE! | AE63: =IF(RC[22]=42,"*",IF(RC[22]=32,"",RC[22])) ->  | AF63: =RC[-29] -> 24 | AG63: =RC[-29] -> 0 | AH63: =RC[-29] -> 0 | AI63: =RC[-29] -> 0 | AJ63: =RC[-29] -> 0 | AK63: =RC[-29] -> 0 | AL63: =RC[-29] -> 0 | AM63: =RC[-29] -> 0 | AN63: =RC[-29] -> 0 | AO63: =RC[-29] -> 0 | AP63: =RC[-29] ->  | AQ63: =RC[-29] ->  | AR63: - | AS63: =RC[-30] ->  | AT63: =RC[-30] ->  | AU63: - | AV63: =RC[-31] -> #VALUE! | AW63: =RC[-31] ->  | AX63: =RC[-31] ->  | AY63: =RC[-31] -> 
A64: =IF(RC[1]="","",DATEVALUE(RC[1])) ->  | C64: 24 | Q64: =RC[-3]-RC[-1] -> #VALUE! | T64: =RC[-1] ->  | U64: =(RC[-17]*RC[-16]-RC[-14]*RC[-13])/1000 -> 0 | X64: =RC[-2]*RC[-10]/1000 -> #VALUE! | Y64: =(RC[-3]*RC[-11]-RC[-2]*RC[-9])/1000 -> #VALUE! | AD64: =VALUE(RC[-28]) -> #VALUE! | AE64: =IF(RC[22]=42,"*",IF(RC[22]=32,"",RC[22])) ->  | AF64: =RC[-29] -> 24 | AG64: =RC[-29] -> 0 | AH64: =RC[-29] -> 0 | AI64: =RC[-29] -> 0 | AJ64: =RC[-29] -> 0 | AK64: =RC[-29] -> 0 | AL64: =RC[-29] -> 0 | AM64: =RC[-29] -> 0 | AN64: =RC[-29] -> 0 | AO64: =RC[-29] -> 0 | AP64: =RC[-29] ->  | AQ64: =RC[-29] ->  | AR64: - | AS64: =RC[-30] ->  | AT64: =RC[-30] ->  | AU64: - | AV64: =RC[-31] -> #VALUE! | AW64: =RC[-31] ->  | AX64: =RC[-31] ->  | AY64: =RC[-31] -> 
A65: =IF(RC[1]="","",DATEVALUE(RC[1])) ->  | C65: 24 | Q65: =RC[-3]-RC[-1] -> #VALUE! | T65: =RC[-1] ->  | U65: =(RC[-17]*RC[-16]-RC[-14]*RC[-13])/1000 -> 0 | X65: =RC[-2]*RC[-10]/1000 -> #VALUE! | Y65: =(RC[-3]*RC[-11]-RC[-2]*RC[-9])/1000 -> #VALUE! | AD65: =VALUE(RC[-28]) -> #VALUE! | AE65: =IF(RC[22]=42,"*",IF(RC[22]=32,"",RC[22])) ->  | AF65: =RC[-29] -> 24 | AG65: =RC[-29] -> 0 | AH65: =RC[-29] -> 0 | AI65: =RC[-29] -> 0 | AJ65: =RC[-29] -> 0 | AK65: =RC[-29] -> 0 | AL65: =RC[-29] -> 0 | AM65: =RC[-29] -> 0 | AN65: =RC[-29] -> 0 | AO65: =RC[-29] -> 0 | AP65: =RC[-29] ->  | AQ65: =RC[-29] ->  | AR65: - | AS65: =RC[-30] ->  | AT65: =RC[-30] ->  | AU65: - | AV65: =RC[-31] -> #VALUE! | AW65: =RC[-31] ->  | AX65: =RC[-31] ->  | AY65: =RC[-31] -> 
A66: =IF(RC[1]="","",DATEVALUE(RC[1])) ->  | C66: 24 | Q66: =RC[-3]-RC[-1] -> #VALUE! | T66: =RC[-1] ->  | U66: =(RC[-17]*RC[-16]-RC[-14]*RC[-13])/1000 -> 0 | X66: =RC[-2]*RC[-10]/1000 -> #VALUE! | Y66: =(RC[-3]*RC[-11]-RC[-2]*RC[-9])/1000 -> #VALUE! | AD66: =VALUE(RC[-28]) -> #VALUE! | AE66: =IF(RC[22]=42,"*",IF(RC[22]=32,"",RC[22])) ->  | AF66: =RC[-29] -> 24 | AG66: =RC[-29] -> 0 | AH66: =RC[-29] -> 0 | AI66: =RC[-29] -> 0 | AJ66: =RC[-29] -> 0 | AK66: =RC[-29] -> 0 | AL66: =RC[-29] -> 0 | AM66: =RC[-29] -> 0 | AN66: =RC[-29] -> 0 | AO66: =RC[-29] -> 0 | AP66: =RC[-29] ->  | AQ66: =RC[-29] ->  | AR66: - | AS66: =RC[-30] ->  | AT66: =RC[-30] ->  | AU66: - | AV66: =RC[-31] -> #VALUE! | AW66: =RC[-31] ->  | AX66: =RC[-31] ->  | AY66: =RC[-31] -> 
A67: =IF(RC[1]="","",DATEVALUE(RC[1])) ->  | C67: 24 | Q67: =RC[-3]-RC[-1] -> #VALUE! | T67: =RC[-1] ->  | U67: =(RC[-17]*RC[-16]-RC[-14]*RC[-13])/1000 -> 0 | X67: =RC[-2]*RC[-10]/1000 -> #VALUE! | Y67: =(RC[-3]*RC[-11]-RC[-2]*RC[-9])/1000 -> #VALUE! | AD67: =VALUE(RC[-28]) -> #VALUE! | AE67: =IF(RC[22]=42,"*",IF(RC[22]=32,"",RC[22])) ->  | AF67: =RC[-29] -> 24 | AG67: =RC[-29] -> 0 | AH67: =RC[-29] -> 0 | AI67: =RC[-29] -> 0 | AJ67: =RC[-29] -> 0 | AK67: =RC[-29] -> 0 | AL67: =RC[-29] -> 0 | AM67: =RC[-29] -> 0 | AN67: =RC[-29] -> 0 | AO67: =RC[-29] -> 0 | AP67: =RC[-29] ->  | AQ67: =RC[-29] ->  | AR67: - | AS67: =RC[-30] ->  | AT67: =RC[-30] ->  | AU67: - | AV67: =RC[-31] -> #VALUE! | AW67: =RC[-31] ->  | AX67: =RC[-31] ->  | AY67: =RC[-31] -> 
A68: =IF(RC[1]="","",DATEVALUE(RC[1])) ->  | C68: 24 | Q68: =RC[-3]-RC[-1] -> #VALUE! | T68: =RC[-1] ->  | U68: =(RC[-17]*RC[-16]-RC[-14]*RC[-13])/1000 -> 0 | X68: =RC[-2]*RC[-10]/1000 -> #VALUE! | Y68: =(RC[-3]*RC[-11]-RC[-2]*RC[-9])/1000 -> #VALUE! | AD68: =VALUE(RC[-28]) -> #VALUE! | AE68: =IF(RC[22]=42,"*",IF(RC[22]=32,"",RC[22])) ->  | AF68: =RC[-29] -> 24 | AG68: =RC[-29] -> 0 | AH68: =RC[-29] -> 0 | AI68: =RC[-29] -> 0 | AJ68: =RC[-29] -> 0 | AK68: =RC[-29] -> 0 | AL68: =RC[-29] -> 0 | AM68: =RC[-29] -> 0 | AN68: =RC[-29] -> 0 | AO68: =RC[-29] -> 0 | AP68: =RC[-29] ->  | AQ68: =RC[-29] ->  | AR68: - | AS68: =RC[-30] ->  | AT68: =RC[-30] ->  | AU68: - | AV68: =RC[-31] -> #VALUE! | AW68: =RC[-31] ->  | AX68: =RC[-31] ->  | AY68: =RC[-31] -> 
A69: =IF(RC[1]="","",DATEVALUE(RC[1])) ->  | C69: 24 | Q69: =RC[-3]-RC[-1] -> #VALUE! | T69: =RC[-1] ->  | U69: =(RC[-17]*RC[-16]-RC[-14]*RC[-13])/1000 -> 0 | X69: =RC[-2]*RC[-10]/1000 -> #VALUE! | Y69: =(RC[-3]*RC[-11]-RC[-2]*RC[-9])/1000 -> #VALUE! | AD69: =VALUE(RC[-28]) -> #VALUE! | AE69: =IF(RC[22]=42,"*",IF(RC[22]=32,"",RC[22])) ->  | AF69: =RC[-29] -> 24 | AG69: =RC[-29] -> 0 | AH69: =RC[-29] -> 0 | AI69: =RC[-29] -> 0 | AJ69: =RC[-29] -> 0 | AK69: =RC[-29] -> 0 | AL69: =RC[-29] -> 0 | AM69: =RC[-29] -> 0 | AN69: =RC[-29] -> 0 | AO69: =RC[-29] -> 0 | AP69: =RC[-29] ->  | AQ69: =RC[-29] ->  | AR69: - | AS69: =RC[-30] ->  | AT69: =RC[-30] ->  | AU69: - | AV69: =RC[-31] -> #VALUE! | AW69: =RC[-31] ->  | AX69: =RC[-31] ->  | AY69: =RC[-31] -> 
A70: =IF(RC[1]="","",DATEVALUE(RC[1])) ->  | C70: 24 | Q70: =RC[-3]-RC[-1] -> #VALUE! | T70: =RC[-1] ->  | U70: =(RC[-17]*RC[-16]-RC[-14]*RC[-13])/1000 -> 0 | X70: =RC[-2]*RC[-10]/1000 -> #VALUE! | Y70: =(RC[-3]*RC[-11]-RC[-2]*RC[-9])/1000 -> #VALUE! | AD70: =VALUE(RC[-28]) -> #VALUE! | AE70: =IF(RC[22]=42,"*",IF(RC[22]=32,"",RC[22])) ->  | AF70: =RC[-29] -> 24 | AG70: =RC[-29] -> 0 | AH70: =RC[-29] -> 0 | AI70: =RC[-29] -> 0 | AJ70: =RC[-29] -> 0 | AK70: =RC[-29] -> 0 | AL70: =RC[-29] -> 0 | AM70: =RC[-29] -> 0 | AN70: =RC[-29] -> 0 | AO70: =RC[-29] -> 0 | AP70: =RC[-29] ->  | AQ70: =RC[-29] ->  | AR70: - | AS70: =RC[-30] ->  | AT70: =RC[-30] ->  | AU70: - | AV70: =RC[-31] -> #VALUE! | AW70: =RC[-31] ->  | AX70: =RC[-31] ->  | AY70: =RC[-31] -> 
A71: =IF(RC[1]="","",DATEVALUE(RC[1])) ->  | C71: 24 | Q71: =RC[-3]-RC[-1] -> #VALUE! | T71: =RC[-1] ->  | U71: =(RC[-17]*RC[-16]-RC[-14]*RC[-13])/1000 -> 0 | X71: =RC[-2]*RC[-10]/1000 -> #VALUE! | Y71: =(RC[-3]*RC[-11]-RC[-2]*RC[-9])/1000 -> #VALUE! | AD71: =VALUE(RC[-28]) -> #VALUE! | AE71: =IF(RC[22]=42,"*",IF(RC[22]=32,"",RC[22])) ->  | AF71: =RC[-29] -> 24 | AG71: =RC[-29] -> 0 | AH71: =RC[-29] -> 0 | AI71: =RC[-29] -> 0 | AJ71: =RC[-29] -> 0 | AK71: =RC[-29] -> 0 | AL71: =RC[-29] -> 0 | AM71: =RC[-29] -> 0 | AN71: =RC[-29] -> 0 | AO71: =RC[-29] -> 0 | AP71: =RC[-29] ->  | AQ71: =RC[-29] ->  | AR71: - | AS71: =RC[-30] ->  | AT71: =RC[-30] ->  | AU71: - | AV71: =RC[-31] -> #VALUE! | AW71: =RC[-31] ->  | AX71: =RC[-31] ->  | AY71: =RC[-31] -> 
A72: =IF(RC[1]="","",DATEVALUE(RC[1])) ->  | C72: 24 | Q72: =RC[-3]-RC[-1] -> #VALUE! | T72: =RC[-1] ->  | U72: =(RC[-17]*RC[-16]-RC[-14]*RC[-13])/1000 -> 0 | X72: =RC[-2]*RC[-10]/1000 -> #VALUE! | Y72: =(RC[-3]*RC[-11]-RC[-2]*RC[-9])/1000 -> #VALUE! | AD72: =VALUE(RC[-28]) -> #VALUE! | AE72: =IF(RC[22]=42,"*",IF(RC[22]=32,"",RC[22])) ->  | AF72: =RC[-29] -> 24 | AG72: =RC[-29] -> 0 | AH72: =RC[-29] -> 0 | AI72: =RC[-29] -> 0 | AJ72: =RC[-29] -> 0 | AK72: =RC[-29] -> 0 | AL72: =RC[-29] -> 0 | AM72: =RC[-29] -> 0 | AN72: =RC[-29] -> 0 | AO72: =RC[-29] -> 0 | AP72: =RC[-29] ->  | AQ72: =RC[-29] ->  | AR72: - | AS72: =RC[-30] ->  | AT72: =RC[-30] ->  | AU72: - | AV72: =RC[-31] -> #VALUE! | AW72: =RC[-31] ->  | AX72: =RC[-31] ->  | AY72: =RC[-31] -> 
A73: =IF(RC[1]="","",DATEVALUE(RC[1])) ->  | C73: 24 | Q73: =RC[-3]-RC[-1] -> #VALUE! | T73: =RC[-1] ->  | U73: =(RC[-17]*RC[-16]-RC[-14]*RC[-13])/1000 -> 0 | X73: =RC[-2]*RC[-10]/1000 -> #VALUE! | Y73: =(RC[-3]*RC[-11]-RC[-2]*RC[-9])/1000 -> #VALUE! | AD73: =VALUE(RC[-28]) -> #VALUE! | AE73: =IF(RC[22]=42,"*",IF(RC[22]=32,"",RC[22])) ->  | AF73: =RC[-29] -> 24 | AG73: =RC[-29] -> 0 | AH73: =RC[-29] -> 0 | AI73: =RC[-29] -> 0 | AJ73: =RC[-29] -> 0 | AK73: =RC[-29] -> 0 | AL73: =RC[-29] -> 0 | AM73: =RC[-29] -> 0 | AN73: =RC[-29] -> 0 | AO73: =RC[-29] -> 0 | AP73: =RC[-29] ->  | AQ73: =RC[-29] ->  | AR73: - | AS73: =RC[-30] ->  | AT73: =RC[-30] ->  | AU73: - | AV73: =RC[-31] -> #VALUE! | AW73: =RC[-31] ->  | AX73: =RC[-31] ->  | AY73: =RC[-31] -> 
A74: =IF(RC[1]="","",DATEVALUE(RC[1])) ->  | C74: 24 | Q74: =RC[-3]-RC[-1] -> #VALUE! | T74: =RC[-1] ->  | U74: =(RC[-17]*RC[-16]-RC[-14]*RC[-13])/1000 -> 0 | X74: =RC[-2]*RC[-10]/1000 -> #VALUE! | Y74: =(RC[-3]*RC[-11]-RC[-2]*RC[-9])/1000 -> #VALUE! | AD74: =VALUE(RC[-28]) -> #VALUE! | AE74: =IF(RC[22]=42,"*",IF(RC[22]=32,"",RC[22])) ->  | AF74: =RC[-29] -> 24 | AG74: =RC[-29] -> 0 | AH74: =RC[-29] -> 0 | AI74: =RC[-29] -> 0 | AJ74: =RC[-29] -> 0 | AK74: =RC[-29] -> 0 | AL74: =RC[-29] -> 0 | AM74: =RC[-29] -> 0 | AN74: =RC[-29] -> 0 | AO74: =RC[-29] -> 0 | AP74: =RC[-29] ->  | AQ74: =RC[-29] ->  | AR74: - | AS74: =RC[-30] ->  | AT74: =RC[-30] ->  | AU74: - | AV74: =RC[-31] -> #VALUE! | AW74: =RC[-31] ->  | AX74: =RC[-31] ->  | AY74: =RC[-31] -> 
A75: =IF(RC[1]="","",DATEVALUE(RC[1])) ->  | C75: 24 | Q75: =RC[-3]-RC[-1] -> #VALUE! | T75: =RC[-1] ->  | U75: =(RC[-17]*RC[-16]-RC[-14]*RC[-13])/1000 -> 0 | X75: =RC[-2]*RC[-10]/1000 -> #VALUE! | Y75: =(RC[-3]*RC[-11]-RC[-2]*RC[-9])/1000 -> #VALUE! | AD75: =VALUE(RC[-28]) -> #VALUE! | AE75: =IF(RC[22]=42,"*",IF(RC[22]=32,"",RC[22])) ->  | AF75: =RC[-29] -> 24 | AG75: =RC[-29] -> 0 | AH75: =RC[-29] -> 0 | AI75: =RC[-29] -> 0 | AJ75: =RC[-29] -> 0 | AK75: =RC[-29] -> 0 | AL75: =RC[-29] -> 0 | AM75: =RC[-29] -> 0 | AN75: =RC[-29] -> 0 | AO75: =RC[-29] -> 0 | AP75: =RC[-29] ->  | AQ75: =RC[-29] ->  | AR75: - | AS75: =RC[-30] ->  | AT75: =RC[-30] ->  | AU75: - | AV75: =RC[-31] -> #VALUE! | AW75: =RC[-31] ->  | AX75: =RC[-31] ->  | AY75: =RC[-31] -> 
A76: =IF(RC[1]="","",DATEVALUE(RC[1])) ->  | C76: 24 | Q76: =RC[-3]-RC[-1] -> #VALUE! | T76: =RC[-1] ->  | U76: =(RC[-17]*RC[-16]-RC[-14]*RC[-13])/1000 -> 0 | X76: =RC[-2]*RC[-10]/1000 -> #VALUE! | Y76: =(RC[-3]*RC[-11]-RC[-2]*RC[-9])/1000 -> #VALUE! | AD76: =VALUE(RC[-28]) -> #VALUE! | AE76: =IF(RC[22]=42,"*",IF(RC[22]=32,"",RC[22])) ->  | AF76: =RC[-29] -> 24 | AG76: =RC[-29] -> 0 | AH76: =RC[-29] -> 0 | AI76: =RC[-29] -> 0 | AJ76: =RC[-29] -> 0 | AK76: =RC[-29] -> 0 | AL76: =RC[-29] -> 0 | AM76: =RC[-29] -> 0 | AN76: =RC[-29] -> 0 | AO76: =RC[-29] -> 0 | AP76: =RC[-29] ->  | AQ76: =RC[-29] ->  | AR76: - | AS76: =RC[-30] ->  | AT76: =RC[-30] ->  | AU76: - | AV76: =RC[-31] -> #VALUE! | AW76: =RC[-31] ->  | AX76: =RC[-31] ->  | AY76: =RC[-31] -> 
A77: =IF(RC[1]="","",DATEVALUE(RC[1])) ->  | C77: 24 | Q77: =RC[-3]-RC[-1] -> #VALUE! | T77: =RC[-1] ->  | U77: =(RC[-17]*RC[-16]-RC[-14]*RC[-13])/1000 -> 0 | X77: =RC[-2]*RC[-10]/1000 -> #VALUE! | Y77: =(RC[-3]*RC[-11]-RC[-2]*RC[-9])/1000 -> #VALUE! | AD77: =VALUE(RC[-28]) -> #VALUE! | AE77: =IF(RC[22]=42,"*",IF(RC[22]=32,"",RC[22])) ->  | AF77: =RC[-29] -> 24 | AG77: =RC[-29] -> 0 | AH77: =RC[-29] -> 0 | AI77: =RC[-29] -> 0 | AJ77: =RC[-29] -> 0 | AK77: =RC[-29] -> 0 | AL77: =RC[-29] -> 0 | AM77: =RC[-29] -> 0 | AN77: =RC[-29] -> 0 | AO77: =RC[-29] -> 0 | AP77: =RC[-29] ->  | AQ77: =RC[-29] ->  | AR77: - | AS77: =RC[-30] ->  | AT77: =RC[-30] ->  | AU77: - | AV77: =RC[-31] -> #VALUE! | AW77: =RC[-31] ->  | AX77: =RC[-31] ->  | AY77: =RC[-31] -> 
A78: =IF(RC[1]="","",DATEVALUE(RC[1])) ->  | C78: 24 | Q78: =RC[-3]-RC[-1] -> #VALUE! | T78: =RC[-1] ->  | U78: =(RC[-17]*RC[-16]-RC[-14]*RC[-13])/1000 -> 0 | X78: =RC[-2]*RC[-10]/1000 -> #VALUE! | Y78: =(RC[-3]*RC[-11]-RC[-2]*RC[-9])/1000 -> #VALUE! | AD78: =VALUE(RC[-28]) -> #VALUE! | AE78: =IF(RC[22]=42,"*",IF(RC[22]=32,"",RC[22])) ->  | AF78: =RC[-29] -> 24 | AG78: =RC[-29] -> 0 | AH78: =RC[-29] -> 0 | AI78: =RC[-29] -> 0 | AJ78: =RC[-29] -> 0 | AK78: =RC[-29] -> 0 | AL78: =RC[-29] -> 0 | AM78: =RC[-29] -> 0 | AN78: =RC[-29] -> 0 | AO78: =RC[-29] -> 0 | AP78: =RC[-29] ->  | AQ78: =RC[-29] ->  | AR78: - | AS78: =RC[-30] ->  | AT78: =RC[-30] ->  | AU78: - | AV78: =RC[-31] -> #VALUE! | AW78: =RC[-31] ->  | AX78: =RC[-31] ->  | AY78: =RC[-31] -> 
A79: =IF(RC[1]="","",DATEVALUE(RC[1])) ->  | C79: 24 | Q79: =RC[-3]-RC[-1] -> #VALUE! | T79: =RC[-1] ->  | U79: =(RC[-17]*RC[-16]-RC[-14]*RC[-13])/1000 -> 0 | X79: =RC[-2]*RC[-10]/1000 -> #VALUE! | Y79: =(RC[-3]*RC[-11]-RC[-2]*RC[-9])/1000 -> #VALUE! | AD79: =VALUE(RC[-28]) -> #VALUE! | AE79: =IF(RC[22]=42,"*",IF(RC[22]=32,"",RC[22])) ->  | AF79: =RC[-29] -> 24 | AG79: =RC[-29] -> 0 | AH79: =RC[-29] -> 0 | AI79: =RC[-29] -> 0 | AJ79: =RC[-29] -> 0 | AK79: =RC[-29] -> 0 | AL79: =RC[-29] -> 0 | AM79: =RC[-29] -> 0 | AN79: =RC[-29] -> 0 | AO79: =RC[-29] -> 0 | AP79: =RC[-29] ->  | AQ79: =RC[-29] ->  | AR79: - | AS79: =RC[-30] ->  | AT79: =RC[-30] ->  | AU79: - | AV79: =RC[-31] -> #VALUE! | AW79: =RC[-31] ->  | AX79: =RC[-31] ->  | AY79: =RC[-31] -> 
A80: =IF(RC[1]="","",DATEVALUE(RC[1])) ->  | C80: 24 | Q80: =RC[-3]-RC[-1] -> #VALUE! | T80: =RC[-1] ->  | U80: =(RC[-17]*RC[-16]-RC[-14]*RC[-13])/1000 -> 0 | X80: =RC[-2]*RC[-10]/1000 -> #VALUE! | Y80: =(RC[-3]*RC[-11]-RC[-2]*RC[-9])/1000 -> #VALUE! | AD80: =VALUE(RC[-28]) -> #VALUE! | AE80: =IF(RC[22]=42,"*",IF(RC[22]=32,"",RC[22])) ->  | AF80: =RC[-29] -> 24 | AG80: =RC[-29] -> 0 | AH80: =RC[-29] -> 0 | AI80: =RC[-29] -> 0 | AJ80: =RC[-29] -> 0 | AK80: =RC[-29] -> 0 | AL80: =RC[-29] -> 0 | AM80: =RC[-29] -> 0 | AN80: =RC[-29] -> 0 | AO80: =RC[-29] -> 0 | AP80: =RC[-29] ->  | AQ80: =RC[-29] ->  | AR80: - | AS80: =RC[-30] ->  | AT80: =RC[-30] ->  | AU80: - | AV80: =RC[-31] -> #VALUE! | AW80: =RC[-31] ->  | AX80: =RC[-31] ->  | AY80: =RC[-31] -> 
A81: =IF(RC[1]="","",DATEVALUE(RC[1])) ->  | C81: 24 | Q81: =RC[-3]-RC[-1] -> #VALUE! | T81: =RC[-1] ->  | U81: =(RC[-17]*RC[-16]-RC[-14]*RC[-13])/1000 -> 0 | X81: =RC[-2]*RC[-10]/1000 -> #VALUE! | Y81: =(RC[-3]*RC[-11]-RC[-2]*RC[-9])/1000 -> #VALUE! | AD81: =VALUE(RC[-28]) -> #VALUE! | AE81: =IF(RC[22]=42,"*",IF(RC[22]=32,"",RC[22])) ->  | AF81: =RC[-29] -> 24 | AG81: =RC[-29] -> 0 | AH81: =RC[-29] -> 0 | AI81: =RC[-29] -> 0 | AJ81: =RC[-29] -> 0 | AK81: =RC[-29] -> 0 | AL81: =RC[-29] -> 0 | AM81: =RC[-29] -> 0 | AN81: =RC[-29] -> 0 | AO81: =RC[-29] -> 0 | AP81: =RC[-29] ->  | AQ81: =RC[-29] ->  | AR81: - | AS81: =RC[-30] ->  | AT81: =RC[-30] ->  | AU81: - | AV81: =RC[-31] -> #VALUE! | AW81: =RC[-31] ->  | AX81: =RC[-31] ->  | AY81: =RC[-31] -> 
A82: =IF(RC[1]="","",DATEVALUE(RC[1])) ->  | C82: 24 | Q82: =RC[-3]-RC[-1] -> #VALUE! | T82: =RC[-1] ->  | U82: =(RC[-17]*RC[-16]-RC[-14]*RC[-13])/1000 -> 0 | X82: =RC[-2]*RC[-10]/1000 -> #VALUE! | Y82: =(RC[-3]*RC[-11]-RC[-2]*RC[-9])/1000 -> #VALUE! | AD82: =VALUE(RC[-28]) -> #VALUE! | AE82: =IF(RC[22]=42,"*",IF(RC[22]=32,"",RC[22])) ->  | AF82: =RC[-29] -> 24 | AG82: =RC[-29] -> 0 | AH82: =RC[-29] -> 0 | AI82: =RC[-29] -> 0 | AJ82: =RC[-29] -> 0 | AK82: =RC[-29] -> 0 | AL82: =RC[-29] -> 0 | AM82: =RC[-29] -> 0 | AN82: =RC[-29] -> 0 | AO82: =RC[-29] -> 0 | AP82: =RC[-29] ->  | AQ82: =RC[-29] ->  | AR82: - | AS82: =RC[-30] ->  | AT82: =RC[-30] ->  | AU82: - | AV82: =RC[-31] -> #VALUE! | AW82: =RC[-31] ->  | AX82: =RC[-31] ->  | AY82: =RC[-31] -> 
A83: =IF(RC[1]="","",DATEVALUE(RC[1])) ->  | C83: 24 | Q83: =RC[-3]-RC[-1] -> #VALUE! | T83: =RC[-1] ->  | U83: =(RC[-17]*RC[-16]-RC[-14]*RC[-13])/1000 -> 0 | X83: =RC[-2]*RC[-10]/1000 -> #VALUE! | Y83: =(RC[-3]*RC[-11]-RC[-2]*RC[-9])/1000 -> #VALUE! | AD83: =VALUE(RC[-28]) -> #VALUE! | AE83: =IF(RC[22]=42,"*",IF(RC[22]=32,"",RC[22])) ->  | AF83: =RC[-29] -> 24 | AG83: =RC[-29] -> 0 | AH83: =RC[-29] -> 0 | AI83: =RC[-29] -> 0 | AJ83: =RC[-29] -> 0 | AK83: =RC[-29] -> 0 | AL83: =RC[-29] -> 0 | AM83: =RC[-29] -> 0 | AN83: =RC[-29] -> 0 | AO83: =RC[-29] -> 0 | AP83: =RC[-29] ->  | AQ83: =RC[-29] ->  | AR83: - | AS83: =RC[-30] ->  | AT83: =RC[-30] ->  | AU83: - | AV83: =RC[-31] -> #VALUE! | AW83: =RC[-31] ->  | AX83: =RC[-31] ->  | AY83: =RC[-31] -> 
AD84: Среднее | AG84: =R[1]C[-29] -> 0 | AH84: =R[1]C[-29] -> 0 | AI84: =R[1]C[-29] -> 0 | AJ84: =R[1]C[-29] -> 0 | AK84: =R[1]C[-29] -> 0 | AL84: =R[1]C[-29] -> 0 | AM84: =R[1]C[-29] -> 0 | AN84: =R[1]C[-29] -> 0 | AP84: =R[1]C[-29] -> 34.365723967741935 | AQ84: =R[1]C[-29] -> 58.532327838709683 | AS84: =R[1]C[-30] -> 22.403431677419356 | AT84: =R[1]C[-30] -> 44.599873129032254 | AU84: - | AV84: =R[1]C[-31] -> 13.93245470967743
B85: Среднее | M85: =AVERAGE(OFFSET(R[-74]C,3,0,R7C1,1)) -> 34.365723967741935 | N85: =IF(SUM(OFFSET(R[-74]C,3,0,R7C1,1))=0,0,AVERAGE(OFFSET(R[-74]C,3,0,R7C1,1))) -> 58.532327838709683 | O85: =AVERAGE(OFFSET(R[-74]C,3,0,R7C1,1)) -> 22.403431677419356 | P85: =IF(SUM(OFFSET(R[-74]C,3,0,R7C1,1))=0,0,AVERAGE(OFFSET(R[-74]C,3,0,R7C1,1))) -> 44.599873129032254 | Q85: =RC[-3]-RC[-1] -> 13.93245470967743 | R85: =AVERAGE(OFFSET(R[-74]C,3,0,R7C1,1)) -> 11.997627096774192 | S85: =AVERAGE(OFFSET(R[-74]C,3,0,R7C1,1)) -> 1.0644572368676266 | T85: =AVERAGE(OFFSET(R[-74]C,3,0,R7C1,1)) -> 1.0644572368676266 | U85: =AVERAGE(OFFSET(R[-74]C,3,0,R7C1,1)) -> 0 | X85: =AVERAGE(OFFSET(R[-74]C,3,0,R7C1,1)) -> #VALUE! | Y85: =AVERAGE(OFFSET(R[-74]C,3,0,R7C1,1)) -> 0.97651615176857332 | AD85: Итого | AF85: =R[1]C[-29] -> 744 | AG85: =R[1]C[-29] -> 0 | AJ85: =R[1]C[-29] -> 0 | AN85: =R[1]C[-29] -> 0 | AO85: =R[1]C[-29] -> 0 | AP85: =R[1]C[-29] -> 1065.3374429999999 | AS85: =R[1]C[-30] -> 694.50638200000003 | AW85: =R[1]C[-31] -> 371.92643999999996 | AX85: =R[1]C[-31] -> 32.998174342896426 | AY85: =R[1]C[-31] -> 32.998174342896426
B86: ИТОГО: | C86: =SUM(OFFSET(R[-75]C,3,0,R7C1,1)) -> 744 | M86: =SUM(OFFSET(R[-75]C,3,0,R7C1,1)) -> 1065.3374429999999 | O86: =SUM(OFFSET(R[-75]C,3,0,R7C1,1)) -> 694.50638200000003 | R86: =SUM(OFFSET(R[-75]C,3,0,R7C1,1)) -> 371.92643999999996 | S86: =SUM(OFFSET(R[-75]C,3,0,R7C1,1)) -> 32.998174342896426 | T86: =SUM(OFFSET(R[-75]C,3,0,R7C1,1)) -> 32.998174342896426 | U86: =SUM(OFFSET(R[-75]C,3,0,R7C1,1)) -> 0 | X86: =SUM(OFFSET(R[-75]C,3,0,R7C1,1)) -> #VALUE! | Y86: =SUM(OFFSET(R[-75]C,3,0,R7C1,1)) -> 26.365936097751479
AD87: Досчёт по среднему до конца месяца | AG87: =R[1]C[-29] -> 0 | AJ87: =R[1]C[-29] -> 0 | AN87: =R[1]C[-29] -> 0 | AO87: =R[1]C[-29] -> 0 | AP87: =R[1]C[-29] -> 0 | AS87: =R[1]C[-30] -> 0 | AW87: =R[1]C[-31] -> 0 | AX87: =R[1]C[-31] -> 0 | AY87: =R[1]C[-31] -> 0
A88: 11дн=264ч 4дн=96ч | B88: Досчёт до конца м-ца (+) | C88: =R[-82]C[-2]*24 -> 192 | M88: 0 | O88: 0 | R88: 0 | S88: 0 | T88: 0 | U88: № 13671 | AD88: Снятие досчёта по среднему предыдущего отчёта | AG88: =-R[1]C[-29] -> 0 | AJ88: =-R[1]C[-29] -> 0 | AN88: =-R[1]C[-29] -> 0 | AO88: =-R[1]C[-29] -> 0 | AP88: =-R[1]C[-29] -> 0 | AS88: =-R[1]C[-30] -> 0 | AW88: =-R[1]C[-31] -> 0 | AX88: =-R[1]C[-31] -> 0 | AY88: =-R[1]C[-31] -> 0
A89: 9дн=216ч 7дн=168ч | B89: Вычет с предыдущего (-) | C89: =R[-85]C[-2]*24 -> 216 | AD89: Сумма: | AG89: =R[1]C[-29] -> 0 | AJ89: =R[1]C[-29] -> 0 | AN89: =R[1]C[-29] -> 0 | AO89: =R[1]C[-29] -> 0 | AP89: =R[1]C[-29] -> 1065.3374429999999 | AS89: =R[1]C[-30] -> 694.50638200000003 | AW89: =R[1]C[-31] -> 371.92643999999996 | AX89: =R[1]C[-31] -> 32.998174342896426 | AY89: =R[1]C[-31] -> 32.998174342896426
B90: СУММА: | C90: =R[-4]C+R[-2]C-R[-1]C -> 720 | M90: =R[-4]C+R[-2]C-R[-1]C -> 1065.3374429999999 | O90: =R[-4]C+R[-2]C-R[-1]C -> 694.50638200000003 | R90: =R[-4]C+R[-2]C-R[-1]C -> 371.92643999999996 | S90: =R[-4]C+R[-2]C-R[-1]C -> 32.998174342896426 | T90: =R[-4]C+R[-2]C-R[-1]C -> 32.998174342896426 | AD90: Тхв на источнике | AE90: 0 | AF90: V гвс (м3) | AG90: =R[-1]C[16] -> 371.92643999999996 | AH90: W гвс (Гкал) | AI90: =RC[-2]*0.06 -> 22.315586399999997 | AJ90: W без гвс (Гкал) | AK90: =R[-1]C[4] -> 0
AD91: =R[-90]C[-17] -> письмо
B93: Дата, время | D93: М1, т | F93: М2, т | H93: М3, т | J93: М4, т | L93: Qо, Гкал | N93: Qг, Гкал | P93: время, час
B94: 23.08.18 20:00 | D94: 158377.21 | F94: 156724.72 | H94: 169483.36 | J94: 169352.31 | L94: 3000.5219999999999 | N94: 2886.9140000000002 | P94: -
B95: 19.09.18 13:00 | D95: 162249.04999999999 | F95: 160417.03 | H95: 176409.48 | J95: 175379.33 | L95: 3040.989 | N95: 2941.0749999999998 | P95: -
B98: Представитель потредителя:_______________________________________________________ В.О. Топорков
I101: Рекомендуемые значения по параметрам теплопотребления (не являются официально утверждёнными)
I102: М, т | J102: V, м3 | K102: Qгвс, Гкал | L102: Qотоп, Гкал | M102: Qо, Гкал
I103: =R[-13]C[6] -> 694.50638200000003 | J103: =RC[-1]/0.98 -> 708.67998163265315 | K103: =R[-13]C[8] -> 32.998174342896426 | L103: =R[-13]C -> 0 | M103: =R[-6]C[2] -> 0
P105: ДЛЯ САМОКОНТРОЛЯ
B106: В строке выбора дат указать период с 16.7.13 по 23.8.13 - жильё | O106: Qo | Q106: Qг
B107: В строке выбора дат указать период с 18.7.13 по 25.8.13 - не жилое | O107: =((R[-21]C[-11]*R[-22]C[-8])-(R[-21]C[-10]*R[-22]C[-7]))/1000 -> 0 | Q107: =IF(R[-22]C[-3]="",R[-21]C[-4]*R[-22]C[-1]/1000,"") ->  | R107: Си4
Q108: =IF(R[-23]C[-3]="","",((R[-22]C[-4]*R[-23]C[-1])-(R[-22]C[-3]*R[-23]C[1]))/1000) -> 47.513914797407622 | R108: Си5