Sheet: Лист1
G1: Отчёт о теплопотреблении за октябрь 2018 | M1: з.н д. №02/147-2783 от 04.10.18
A4: =EOMONTH(R[9]C,0)-R[9]C -> 8 | B4: Потребитель: ЗАО "Сити Сервис"
A5: =MAX(R[9]C:R[78]C) -> 2018-10-22T00:00:00.000 | B5: Адрес: г. СПб, 19 линия д.2 , к.5Е ИТП 2
A6: =EOMONTH(R[-1]C,0)-R[-1]C -> 9 | B6: Телефон: 8-911-021-19-79
A7: =R[-2]C-R[6]C -> 30 | B7: Договор 10023-8
A8: 7 | B8: Тепловычислитель: СПТ-941 № 65140 | L8: М2 мах= | M8: 108 | O8: Мгвс мах= | P8: 0
L9: Qотоп мах= | M9: 8.64 | O9: Qгвс мах= | P9: 0
B10: Расчётная формула: Q=M1*(h1-hхв)-M2*(h2-hхв)
D12: Учет | L12: Контроль
A13: =R[1]C[1]-1 -> 2018-09-22T00:00:00.000 | B13: Дата | C13: N, ч | D13: M1, т | E13: T1, С | F13: P1, кг/см2 | G13: M2, т | H13: T2, С | I13: P2, кг/см2 | J13: dT, С | K13: M1-М2, т | L13: V3, м3 | M13: T3, С | N13: V4, м3 | O13: =IF(R[-12]C[-14]="м.куб","","T4, С") -> T4, С | P13: dT, С | Q13: V3-V4, м3 | R13: Qгвс, Гкал | S13: Qобщ., Гкал | T13: Q | U13: M3 | V13: M4 | W13: си2 | X13: си3 | Y13: Разб. | Z13: dM2 | AC13: Дата | AD13: НС | AE13: n, ч | AF13: М1, т | AG13: t1, гр. С | AH13: Р1, кгс/см2 | AI13: М2, т | AJ13: t2, гр. С | AK13: Р2, кгс/см2 | AL13: t1-t2, гр. С | AM13: М1-М2, т | AN13: М1гвс, т | AO13: t1гвс, гр. С | AP13: Р1гвс, кгс/см2 | AQ13: М2гвс, т | AR13: t2гвс, гр. С | AS13: Р2гвс, кгс/см2 | AT13: t1гвс-t2гвс | AU13: М1гвс-М2гвс, т | AV13: Wгвс, Гкал | AW13: Wсумм, Гкал | AY13: NS_TV1 | AZ13: НС | BA13: NS_TV2
A14: =IF(RC[1]="","",DATEVALUE(RC[1])) -> 43366 | B14: 23.09.18 | C14: 24 | D14: 222.54505900000001 | E14: 71.388084000000006 | G14: 219.680679 | H14: 71.354331999999999 | J14: =RC[-5]-RC[-2] -> 3.3752000000006888E-2 | K14: 2.8643519999999998 | S14: 0 | T14: =(RC[-16]*RC[-15]-RC[-13]*RC[-12])/1000 -> 0.21189726232553038 | U14: - | V14: - | W14: =RC[-2]*RC[-10]/1000 -> #VALUE! | X14: =ABS((RC[-3]*RC[-11]-RC[-2]*RC[-9])/1000) -> #VALUE! | Y14: =RC[-14]/RC[-18]*100 -> 1.303870696794414 | Z14: - | AC14: =VALUE(RC[-27]) -> 2018-09-23T00:00:00.000 | AD14: =IF(RC[21]=42,"*",IF(RC[21]=32,"",RC[21])) -> - | AE14: =RC[-28] -> 24 | AF14: =RC[-28] -> 222.54505900000001 | AG14: =RC[-28] -> 71.388084000000006 | AH14: =RC[-28] -> 0 | AI14: =RC[-28] -> 219.680679 | AJ14: =RC[-28] -> 71.354331999999999 | AK14: =RC[-28] -> 0 | AL14: =RC[-28] -> 3.3752000000006888E-2 | AM14: =RC[-28] -> 2.8643519999999998 | AN14: =RC[-28] -> 0 | AO14: =RC[-28] -> 0 | AP14: - | AQ14: =RC[-29] -> 0 | AR14: =RC[-29] -> 0 | AS14: - | AT14: =RC[-30] -> 0 | AU14: =RC[-30] -> 0 | AV14: =RC[-30] -> 0 | AW14: =RC[-30] -> 0 | AY14: - | AZ14: * | BA14: -
A15: =IF(RC[1]="","",DATEVALUE(RC[1])) -> 43367 | B15: 24.09.18 | C15: 24 | D15: 219.793015 | E15: 70.307106000000005 | G15: 217.02929700000001 | H15: 70.269501000000005 | J15: =RC[-5]-RC[-2] -> 3.7604999999999222E-2 | K15: 2.7636750000000001 | S15: 0 | T15: =(RC[-16]*RC[-15]-RC[-13]*RC[-12])/1000 -> 0.20247040109379122 | U15: - | V15: - | W15: =RC[-2]*RC[-10]/1000 -> #VALUE! | X15: =ABS((RC[-3]*RC[-11]-RC[-2]*RC[-9])/1000) -> #VALUE! | Y15: =RC[-14]/RC[-18]*100 -> 1.2734110270835923 | Z15: - | AC15: =VALUE(RC[-27]) -> 2018-09-24T00:00:00.000 | AD15: =IF(RC[21]=42,"*",IF(RC[21]=32,"",RC[21])) -> - | AE15: =RC[-28] -> 24 | AF15: =RC[-28] -> 219.793015 | AG15: =RC[-28] -> 70.307106000000005 | AH15: =RC[-28] -> 0 | AI15: =RC[-28] -> 217.02929700000001 | AJ15: =RC[-28] -> 70.269501000000005 | AK15: =RC[-28] -> 0 | AL15: =RC[-28] -> 3.7604999999999222E-2 | AM15: =RC[-28] -> 2.7636750000000001 | AN15: =RC[-28] -> 0 | AO15: =RC[-28] -> 0 | AP15: - | AQ15: =RC[-29] -> 0 | AR15: =RC[-29] -> 0 | AS15: - | AT15: =RC[-30] -> 0 | AU15: =RC[-30] -> 0 | AV15: =RC[-30] -> 0 | AW15: =RC[-30] -> 0 | AY15: - | AZ15: * | BA15: -
A16: =IF(RC[1]="","",DATEVALUE(RC[1])) -> 43368 | B16: 25.09.18 | C16: 24 | D16: 229.911575 | E16: 68.528976 | G16: 227.22389200000001 | H16: 68.493324000000001 | J16: =RC[-5]-RC[-2] -> 3.5651999999998907E-2 | K16: 2.6876959999999999 | S16: 0 | T16: =(RC[-16]*RC[-15]-RC[-13]*RC[-12])/1000 -> 0.1922851500001907 | U16: - | V16: - | W16: =RC[-2]*RC[-10]/1000 -> #VALUE! | X16: =ABS((RC[-3]*RC[-11]-RC[-2]*RC[-9])/1000) -> #VALUE! | Y16: =RC[-14]/RC[-18]*100 -> 1.1828404030681772 | Z16: - | AC16: =VALUE(RC[-27]) -> 2018-09-25T00:00:00.000 | AD16: =IF(RC[21]=42,"*",IF(RC[21]=32,"",RC[21])) -> - | AE16: =RC[-28] -> 24 | AF16: =RC[-28] -> 229.911575 | AG16: =RC[-28] -> 68.528976 | AH16: =RC[-28] -> 0 | AI16: =RC[-28] -> 227.22389200000001 | AJ16: =RC[-28] -> 68.493324000000001 | AK16: =RC[-28] -> 0 | AL16: =RC[-28] -> 3.5651999999998907E-2 | AM16: =RC[-28] -> 2.6876959999999999 | AN16: =RC[-28] -> 0 | AO16: =RC[-28] -> 0 | AP16: - | AQ16: =RC[-29] -> 0 | AR16: =RC[-29] -> 0 | AS16: - | AT16: =RC[-30] -> 0 | AU16: =RC[-30] -> 0 | AV16: =RC[-30] -> 0 | AW16: =RC[-30] -> 0 | AY16: - | AZ16: * | BA16: -
A17: =IF(RC[1]="","",DATEVALUE(RC[1])) -> 43369 | B17: 26.09.18 | C17: 24 | D17: 241.17948899999999 | E17: 67.977553999999998 | G17: 238.77868699999999 | H17: 67.954536000000004 | J17: =RC[-5]-RC[-2] -> 2.3017999999993322E-2 | K17: 2.4008180000000001 | S17: 0 | T17: =(RC[-16]*RC[-15]-RC[-13]*RC[-12])/1000 -> 0.16869685541567378 | U17: - | V17: - | W17: =RC[-2]*RC[-10]/1000 -> #VALUE! | X17: =ABS((RC[-3]*RC[-11]-RC[-2]*RC[-9])/1000) -> #VALUE! | Y17: =RC[-14]/RC[-18]*100 -> 1.005457409186608 | Z17: - | AC17: =VALUE(RC[-27]) -> 2018-09-26T00:00:00.000 | AD17: =IF(RC[21]=42,"*",IF(RC[21]=32,"",RC[21])) -> - | AE17: =RC[-28] -> 24 | AF17: =RC[-28] -> 241.17948899999999 | AG17: =RC[-28] -> 67.977553999999998 | AH17: =RC[-28] -> 0 | AI17: =RC[-28] -> 238.77868699999999 | AJ17: =RC[-28] -> 67.954536000000004 | AK17: =RC[-28] -> 0 | AL17: =RC[-28] -> 2.3017999999993322E-2 | AM17: =RC[-28] -> 2.4008180000000001 | AN17: =RC[-28] -> 0 | AO17: =RC[-28] -> 0 | AP17: - | AQ17: =RC[-29] -> 0 | AR17: =RC[-29] -> 0 | AS17: - | AT17: =RC[-30] -> 0 | AU17: =RC[-30] -> 0 | AV17: =RC[-30] -> 0 | AW17: =RC[-30] -> 0 | AY17: - | AZ17: * | BA17: -
A18: =IF(RC[1]="","",DATEVALUE(RC[1])) -> 43370 | B18: 27.09.18 | C18: 24 | D18: 237.772141 | E18: 63.345581000000003 | G18: 235.37777700000001 | H18: 63.471187999999998 | J18: =RC[-5]-RC[-2] -> -0.12560699999999514 | K18: 2.394333 | S18: 0 | T18: =(RC[-16]*RC[-15]-RC[-13]*RC[-12])/1000 -> 0.12210728226984612 | U18: - | V18: - | W18: =RC[-2]*RC[-10]/1000 -> #VALUE! | X18: =ABS((RC[-3]*RC[-11]-RC[-2]*RC[-9])/1000) -> #VALUE! | Y18: =RC[-14]/RC[-18]*100 -> 1.0172298466392604 | Z18: - | AC18: =VALUE(RC[-27]) -> 2018-09-27T00:00:00.000 | AD18: =IF(RC[21]=42,"*",IF(RC[21]=32,"",RC[21])) -> - | AE18: =RC[-28] -> 24 | AF18: =RC[-28] -> 237.772141 | AG18: =RC[-28] -> 63.345581000000003 | AH18: =RC[-28] -> 0 | AI18: =RC[-28] -> 235.37777700000001 | AJ18: =RC[-28] -> 63.471187999999998 | AK18: =RC[-28] -> 0 | AL18: =RC[-28] -> -0.12560699999999514 | AM18: =RC[-28] -> 2.394333 | AN18: =RC[-28] -> 0 | AO18: =RC[-28] -> 0 | AP18: - | AQ18: =RC[-29] -> 0 | AR18: =RC[-29] -> 0 | AS18: - | AT18: =RC[-30] -> 0 | AU18: =RC[-30] -> 0 | AV18: =RC[-30] -> 0 | AW18: =RC[-30] -> 0 | AY18: - | AZ18: * | BA18: -
A19: =IF(RC[1]="","",DATEVALUE(RC[1])) -> 43371 | B19: 28.09.18 | C19: 24 | D19: 234.677368 | E19: 67.990264999999994 | G19: 232.20223999999999 | H19: 63.911971999999999 | J19: =RC[-5]-RC[-2] -> 4.0782929999999951 | K19: 2.47512 | S19: 1.1344380000000001 | T19: =(RC[-16]*RC[-15]-RC[-13]*RC[-12])/1000 -> 1.1152733786052396 | U19: - | V19: - | W19: =RC[-2]*RC[-10]/1000 -> #VALUE! | X19: =ABS((RC[-3]*RC[-11]-RC[-2]*RC[-9])/1000) -> #VALUE! | Y19: =RC[-14]/RC[-18]*100 -> 1.0659328695537131 | Z19: - | AC19: =VALUE(RC[-27]) -> 2018-09-28T00:00:00.000 | AD19: =IF(RC[21]=42,"*",IF(RC[21]=32,"",RC[21])) -> - | AE19: =RC[-28] -> 24 | AF19: =RC[-28] -> 234.677368 | AG19: =RC[-28] -> 67.990264999999994 | AH19: =RC[-28] -> 0 | AI19: =RC[-28] -> 232.20223999999999 | AJ19: =RC[-28] -> 63.911971999999999 | AK19: =RC[-28] -> 0 | AL19: =RC[-28] -> 4.0782929999999951 | AM19: =RC[-28] -> 2.47512 | AN19: =RC[-28] -> 0 | AO19: =RC[-28] -> 0 | AP19: - | AQ19: =RC[-29] -> 0 | AR19: =RC[-29] -> 0 | AS19: - | AT19: =RC[-30] -> 0 | AU19: =RC[-30] -> 0 | AV19: =RC[-30] -> 0 | AW19: =RC[-30] -> 1.1344380000000001 | AY19: - | AZ19: * | BA19: -
A20: =IF(RC[1]="","",DATEVALUE(RC[1])) -> 43372 | B20: 29.09.18 | C20: 24 | D20: 253.35652200000001 | E20: 67.459000000000003 | G20: 252.83303799999999 | H20: 51.241669000000002 | J20: =RC[-5]-RC[-2] -> 16.217331000000001 | K20: 0.59507600000000005 | S20: 4.5721590000000001 | T20: =(RC[-16]*RC[-15]-RC[-13]*RC[-12])/1000 -> 4.1355907721375784 | U20: - | V20: - | W20: =RC[-2]*RC[-10]/1000 -> #VALUE! | X20: =ABS((RC[-3]*RC[-11]-RC[-2]*RC[-9])/1000) -> #VALUE! | Y20: =RC[-14]/RC[-18]*100 -> 0.2353632281236917 | Z20: - | AC20: =VALUE(RC[-27]) -> 2018-09-29T00:00:00.000 | AD20: =IF(RC[21]=42,"*",IF(RC[21]=32,"",RC[21])) -> - | AE20: =RC[-28] -> 24 | AF20: =RC[-28] -> 253.35652200000001 | AG20: =RC[-28] -> 67.459000000000003 | AH20: =RC[-28] -> 0 | AI20: =RC[-28] -> 252.83303799999999 | AJ20: =RC[-28] -> 51.241669000000002 | AK20: =RC[-28] -> 0 | AL20: =RC[-28] -> 16.217331000000001 | AM20: =RC[-28] -> 0.59507600000000005 | AN20: =RC[-28] -> 0 | AO20: =RC[-28] -> 0 | AP20: - | AQ20: =RC[-29] -> 0 | AR20: =RC[-29] -> 0 | AS20: - | AT20: =RC[-30] -> 0 | AU20: =RC[-30] -> 0 | AV20: =RC[-30] -> 0 | AW20: =RC[-30] -> 4.5721590000000001 | AY20: - | AZ20: * | BA20: -
A21: =IF(RC[1]="","",DATEVALUE(RC[1])) -> 43373 | B21: 30.09.18 | C21: 24 | D21: 277.77844199999998 | E21: 69.849166999999994 | G21: 273.60238600000002 | H21: 46.361243999999999 | J21: =RC[-5]-RC[-2] -> 23.487922999999995 | K21: 4.176094 | S21: 6.7356759999999998 | T21: =(RC[-16]*RC[-15]-RC[-13]*RC[-12])/1000 -> 6.7180458079296281 | U21: - | V21: - | W21: =RC[-2]*RC[-10]/1000 -> #VALUE! | X21: =ABS((RC[-3]*RC[-11]-RC[-2]*RC[-9])/1000) -> #VALUE! | Y21: =RC[-14]/RC[-18]*100 -> 1.5263368353812528 | Z21: - | AC21: =VALUE(RC[-27]) -> 2018-09-30T00:00:00.000 | AD21: =IF(RC[21]=42,"*",IF(RC[21]=32,"",RC[21])) -> - | AE21: =RC[-28] -> 24 | AF21: =RC[-28] -> 277.77844199999998 | AG21: =RC[-28] -> 69.849166999999994 | AH21: =RC[-28] -> 0 | AI21: =RC[-28] -> 273.60238600000002 | AJ21: =RC[-28] -> 46.361243999999999 | AK21: =RC[-28] -> 0 | AL21: =RC[-28] -> 23.487922999999995 | AM21: =RC[-28] -> 4.176094 | AN21: =RC[-28] -> 0 | AO21: =RC[-28] -> 0 | AP21: - | AQ21: =RC[-29] -> 0 | AR21: =RC[-29] -> 0 | AS21: - | AT21: =RC[-30] -> 0 | AU21: =RC[-30] -> 0 | AV21: =RC[-30] -> 0 | AW21: =RC[-30] -> 6.7356759999999998 | AY21: - | AZ21: * | BA21: -
A22: =IF(RC[1]="","",DATEVALUE(RC[1])) -> 43374 | B22: 01.10.18 | C22: 24 | D22: 274.71545400000002 | E22: 68.491470000000007 | G22: 271.475098 | H22: 44.683211999999997 | J22: =RC[-5]-RC[-2] -> 23.808258000000009 | K22: 3.2403909999999998 | S22: 6.7019060000000001 | T22: =(RC[-16]*RC[-15]-RC[-13]*RC[-12])/1000 -> 6.6852859195226086 | U22: - | V22: - | W22: =RC[-2]*RC[-10]/1000 -> #VALUE! | X22: =ABS((RC[-3]*RC[-11]-RC[-2]*RC[-9])/1000) -> #VALUE! | Y22: =RC[-14]/RC[-18]*100 -> 1.1936236597288197 | Z22: - | AC22: =VALUE(RC[-27]) -> 2018-10-01T00:00:00.000 | AD22: =IF(RC[21]=42,"*",IF(RC[21]=32,"",RC[21])) -> - | AE22: =RC[-28] -> 24 | AF22: =RC[-28] -> 274.71545400000002 | AG22: =RC[-28] -> 68.491470000000007 | AH22: =RC[-28] -> 0 | AI22: =RC[-28] -> 271.475098 | AJ22: =RC[-28] -> 44.683211999999997 | AK22: =RC[-28] -> 0 | AL22: =RC[-28] -> 23.808258000000009 | AM22: =RC[-28] -> 3.2403909999999998 | AN22: =RC[-28] -> 0 | AO22: =RC[-28] -> 0 | AP22: - | AQ22: =RC[-29] -> 0 | AR22: =RC[-29] -> 0 | AS22: - | AT22: =RC[-30] -> 0 | AU22: =RC[-30] -> 0 | AV22: =RC[-30] -> 0 | AW22: =RC[-30] -> 6.7019060000000001 | AY22: - | BA22: -
A23: =IF(RC[1]="","",DATEVALUE(RC[1])) -> 43375 | B23: 02.10.18 | C23: 24 | D23: 264.73684700000001 | E23: 67.254859999999994 | G23: 261.67843599999998 | H23: 43.451884999999997 | J23: =RC[-5]-RC[-2] -> 23.802974999999996 | K23: 3.0583999999999998 | S23: 6.4499820000000003 | T23: =(RC[-16]*RC[-15]-RC[-13]*RC[-12])/1000 -> 6.4344182737745594 | U23: - | V23: - | W23: =RC[-2]*RC[-10]/1000 -> #VALUE! | X23: =ABS((RC[-3]*RC[-11]-RC[-2]*RC[-9])/1000) -> #VALUE! | Y23: =RC[-14]/RC[-18]*100 -> 1.1687627176126962 | Z23: - | AC23: =VALUE(RC[-27]) -> 2018-10-02T00:00:00.000 | AD23: =IF(RC[21]=42,"*",IF(RC[21]=32,"",RC[21])) -> - | AE23: =RC[-28] -> 24 | AF23: =RC[-28] -> 264.73684700000001 | AG23: =RC[-28] -> 67.254859999999994 | AH23: =RC[-28] -> 0 | AI23: =RC[-28] -> 261.67843599999998 | AJ23: =RC[-28] -> 43.451884999999997 | AK23: =RC[-28] -> 0 | AL23: =RC[-28] -> 23.802974999999996 | AM23: =RC[-28] -> 3.0583999999999998 | AN23: =RC[-28] -> 0 | AO23: =RC[-28] -> 0 | AP23: - | AQ23: =RC[-29] -> 0 | AR23: =RC[-29] -> 0 | AS23: - | AT23: =RC[-30] -> 0 | AU23: =RC[-30] -> 0 | AV23: =RC[-30] -> 0 | AW23: =RC[-30] -> 6.4499820000000003 | AY23: - | BA23: -
A24: =IF(RC[1]="","",DATEVALUE(RC[1])) -> 43376 | B24: 03.10.18 | C24: 24 | D24: 261.44457999999997 | E24: 67.374802000000003 | G24: 258.42568999999997 | H24: 43.192055000000003 | J24: =RC[-5]-RC[-2] -> 24.182746999999999 | K24: 3.0189089999999998 | S24: 6.4681569999999997 | T24: =(RC[-16]*RC[-15]-RC[-13]*RC[-12])/1000 -> 6.452840195580209 | U24: - | V24: - | W24: =RC[-2]*RC[-10]/1000 -> #VALUE! | X24: =ABS((RC[-3]*RC[-11]-RC[-2]*RC[-9])/1000) -> #VALUE! | Y24: =RC[-14]/RC[-18]*100 -> 1.1681922954331669 | Z24: - | AC24: =VALUE(RC[-27]) -> 2018-10-03T00:00:00.000 | AD24: =IF(RC[21]=42,"*",IF(RC[21]=32,"",RC[21])) -> - | AE24: =RC[-28] -> 24 | AF24: =RC[-28] -> 261.44457999999997 | AG24: =RC[-28] -> 67.374802000000003 | AH24: =RC[-28] -> 0 | AI24: =RC[-28] -> 258.42568999999997 | AJ24: =RC[-28] -> 43.192055000000003 | AK24: =RC[-28] -> 0 | AL24: =RC[-28] -> 24.182746999999999 | AM24: =RC[-28] -> 3.0189089999999998 | AN24: =RC[-28] -> 0 | AO24: =RC[-28] -> 0 | AP24: - | AQ24: =RC[-29] -> 0 | AR24: =RC[-29] -> 0 | AS24: - | AT24: =RC[-30] -> 0 | AU24: =RC[-30] -> 0 | AV24: =RC[-30] -> 0 | AW24: =RC[-30] -> 6.4681569999999997 | AY24: - | BA24: -
A25: =IF(RC[1]="","",DATEVALUE(RC[1])) -> 43377 | B25: 04.10.18 | C25: 24 | D25: 260.74917599999998 | E25: 66.748176999999998 | G25: 257.72265599999997 | H25: 42.460940999999998 | J25: =RC[-5]-RC[-2] -> 24.287236 | K25: 3.0264989999999998 | S25: 6.4763909999999996 | T25: =(RC[-16]*RC[-15]-RC[-13]*RC[-12])/1000 -> 6.4613856614728578 | U25: - | V25: - | W25: =RC[-2]*RC[-10]/1000 -> #VALUE! | X25: =ABS((RC[-3]*RC[-11]-RC[-2]*RC[-9])/1000) -> #VALUE! | Y25: =RC[-14]/RC[-18]*100 -> 1.1743239988959295 | Z25: - | AC25: =VALUE(RC[-27]) -> 2018-10-04T00:00:00.000 | AD25: =IF(RC[21]=42,"*",IF(RC[21]=32,"",RC[21])) -> - | AE25: =RC[-28] -> 24 | AF25: =RC[-28] -> 260.74917599999998 | AG25: =RC[-28] -> 66.748176999999998 | AH25: =RC[-28] -> 0 | AI25: =RC[-28] -> 257.72265599999997 | AJ25: =RC[-28] -> 42.460940999999998 | AK25: =RC[-28] -> 0 | AL25: =RC[-28] -> 24.287236 | AM25: =RC[-28] -> 3.0264989999999998 | AN25: =RC[-28] -> 0 | AO25: =RC[-28] -> 0 | AP25: - | AQ25: =RC[-29] -> 0 | AR25: =RC[-29] -> 0 | AS25: - | AT25: =RC[-30] -> 0 | AU25: =RC[-30] -> 0 | AV25: =RC[-30] -> 0 | AW25: =RC[-30] -> 6.4763909999999996 | AY25: - | AZ25: * | BA25: -
A26: =IF(RC[1]="","",DATEVALUE(RC[1])) -> 43378 | B26: 05.10.18 | C26: 24 | D26: 273.32775900000001 | E26: 66.102844000000005 | G26: 270.19332900000001 | H26: 42.105595000000001 | J26: =RC[-5]-RC[-2] -> 23.997249000000004 | K26: 3.1344430000000001 | S26: 6.7065890000000001 | T26: =(RC[-16]*RC[-15]-RC[-13]*RC[-12])/1000 -> 6.6910913314708411 | U26: - | V26: - | W26: =RC[-2]*RC[-10]/1000 -> #VALUE! | X26: =ABS((RC[-3]*RC[-11]-RC[-2]*RC[-9])/1000) -> #VALUE! | Y26: =RC[-14]/RC[-18]*100 -> 1.1600741630449358 | Z26: - | AC26: =VALUE(RC[-27]) -> 2018-10-05T00:00:00.000 | AD26: =IF(RC[21]=42,"*",IF(RC[21]=32,"",RC[21])) -> - | AE26: =RC[-28] -> 24 | AF26: =RC[-28] -> 273.32775900000001 | AG26: =RC[-28] -> 66.102844000000005 | AH26: =RC[-28] -> 0 | AI26: =RC[-28] -> 270.19332900000001 | AJ26: =RC[-28] -> 42.105595000000001 | AK26: =RC[-28] -> 0 | AL26: =RC[-28] -> 23.997249000000004 | AM26: =RC[-28] -> 3.1344430000000001 | AN26: =RC[-28] -> 0 | AO26: =RC[-28] -> 0 | AP26: - | AQ26: =RC[-29] -> 0 | AR26: =RC[-29] -> 0 | AS26: - | AT26: =RC[-30] -> 0 | AU26: =RC[-30] -> 0 | AV26: =RC[-30] -> 0 | AW26: =RC[-30] -> 6.7065890000000001 | AY26: - | BA26: -
A27: =IF(RC[1]="","",DATEVALUE(RC[1])) -> 43379 | B27: 06.10.18 | C27: 24 | D27: 271.02810699999998 | E27: 66.750832000000003 | G27: 268.04794299999998 | H27: 42.561680000000003 | J27: =RC[-5]-RC[-2] -> 24.189152 | K27: 2.9801669999999998 | S27: 6.6983309999999996 | T27: =(RC[-16]*RC[-15]-RC[-13]*RC[-12])/1000 -> 6.6827808630107848 | U27: - | V27: - | W27: =RC[-2]*RC[-10]/1000 -> #VALUE! | X27: =ABS((RC[-3]*RC[-11]-RC[-2]*RC[-9])/1000) -> #VALUE! | Y27: =RC[-14]/RC[-18]*100 -> 1.1118037193816481 | Z27: - | AC27: =VALUE(RC[-27]) -> 2018-10-06T00:00:00.000 | AD27: =IF(RC[21]=42,"*",IF(RC[21]=32,"",RC[21])) -> - | AE27: =RC[-28] -> 24 | AF27: =RC[-28] -> 271.02810699999998 | AG27: =RC[-28] -> 66.750832000000003 | AH27: =RC[-28] -> 0 | AI27: =RC[-28] -> 268.04794299999998 | AJ27: =RC[-28] -> 42.561680000000003 | AK27: =RC[-28] -> 0 | AL27: =RC[-28] -> 24.189152 | AM27: =RC[-28] -> 2.9801669999999998 | AN27: =RC[-28] -> 0 | AO27: =RC[-28] -> 0 | AP27: - | AQ27: =RC[-29] -> 0 | AR27: =RC[-29] -> 0 | AS27: - | AT27: =RC[-30] -> 0 | AU27: =RC[-30] -> 0 | AV27: =RC[-30] -> 0 | AW27: =RC[-30] -> 6.6983309999999996 | AY27: - | BA27: -
A28: =IF(RC[1]="","",DATEVALUE(RC[1])) -> 43380 | B28: 07.10.18 | C28: 24 | D28: 272.91699199999999 | E28: 67.008560000000003 | G28: 269.90417500000001 | H28: 42.803458999999997 | J28: =RC[-5]-RC[-2] -> 24.205101000000006 | K28: 3.012794 | S28: 6.7507229999999998 | T28: =(RC[-16]*RC[-15]-RC[-13]*RC[-12])/1000 -> 6.7349423449101975 | U28: - | V28: - | W28: =RC[-2]*RC[-10]/1000 -> #VALUE! | X28: =ABS((RC[-3]*RC[-11]-RC[-2]*RC[-9])/1000) -> #VALUE! | Y28: =RC[-14]/RC[-18]*100 -> 1.116245793530241 | Z28: - | AC28: =VALUE(RC[-27]) -> 2018-10-07T00:00:00.000 | AD28: =IF(RC[21]=42,"*",IF(RC[21]=32,"",RC[21])) -> - | AE28: =RC[-28] -> 24 | AF28: =RC[-28] -> 272.91699199999999 | AG28: =RC[-28] -> 67.008560000000003 | AH28: =RC[-28] -> 0 | AI28: =RC[-28] -> 269.90417500000001 | AJ28: =RC[-28] -> 42.803458999999997 | AK28: =RC[-28] -> 0 | AL28: =RC[-28] -> 24.205101000000006 | AM28: =RC[-28] -> 3.012794 | AN28: =RC[-28] -> 0 | AO28: =RC[-28] -> 0 | AP28: - | AQ28: =RC[-29] -> 0 | AR28: =RC[-29] -> 0 | AS28: - | AT28: =RC[-30] -> 0 | AU28: =RC[-30] -> 0 | AV28: =RC[-30] -> 0 | AW28: =RC[-30] -> 6.7507229999999998 | AY28: - | BA28: -
A29: =IF(RC[1]="","",DATEVALUE(RC[1])) -> 43381 | B29: 08.10.18 | C29: 24 | D29: 272.91241500000001 | E29: 66.993865999999997 | G29: 269.89321899999999 | H29: 42.335048999999998 | J29: =RC[-5]-RC[-2] -> 24.658816999999999 | K29: 3.019209 | S29: 6.8732280000000001 | T29: =(RC[-16]*RC[-15]-RC[-13]*RC[-12])/1000 -> 6.8575151091136615 | U29: - | V29: - | W29: =RC[-2]*RC[-10]/1000 -> #VALUE! | X29: =ABS((RC[-3]*RC[-11]-RC[-2]*RC[-9])/1000) -> #VALUE! | Y29: =RC[-14]/RC[-18]*100 -> 1.1186679721656883 | Z29: - | AC29: =VALUE(RC[-27]) -> 2018-10-08T00:00:00.000 | AD29: =IF(RC[21]=42,"*",IF(RC[21]=32,"",RC[21])) -> - | AE29: =RC[-28] -> 24 | AF29: =RC[-28] -> 272.91241500000001 | AG29: =RC[-28] -> 66.993865999999997 | AH29: =RC[-28] -> 0 | AI29: =RC[-28] -> 269.89321899999999 | AJ29: =RC[-28] -> 42.335048999999998 | AK29: =RC[-28] -> 0 | AL29: =RC[-28] -> 24.658816999999999 | AM29: =RC[-28] -> 3.019209 | AN29: =RC[-28] -> 0 | AO29: =RC[-28] -> 0 | AP29: - | AQ29: =RC[-29] -> 0 | AR29: =RC[-29] -> 0 | AS29: - | AT29: =RC[-30] -> 0 | AU29: =RC[-30] -> 0 | AV29: =RC[-30] -> 0 | AW29: =RC[-30] -> 6.8732280000000001 | AY29: - | BA29: -
A30: =IF(RC[1]="","",DATEVALUE(RC[1])) -> 43382 | B30: 09.10.18 | C30: 24 | D30: 275.95043900000002 | E30: 66.903892999999997 | G30: 272.84158300000001 | H30: 42.626286 | J30: =RC[-5]-RC[-2] -> 24.277606999999996 | K30: 3.1088529999999999 | S30: 6.8477829999999997 | T30: =(RC[-16]*RC[-15]-RC[-13]*RC[-12])/1000 -> 6.8319352945082885 | U30: - | V30: - | W30: =RC[-2]*RC[-10]/1000 -> #VALUE! | X30: =ABS((RC[-3]*RC[-11]-RC[-2]*RC[-9])/1000) -> #VALUE! | Y30: =RC[-14]/RC[-18]*100 -> 1.1394351864612953 | Z30: - | AC30: =VALUE(RC[-27]) -> 2018-10-09T00:00:00.000 | AD30: =IF(RC[21]=42,"*",IF(RC[21]=32,"",RC[21])) -> - | AE30: =RC[-28] -> 24 | AF30: =RC[-28] -> 275.95043900000002 | AG30: =RC[-28] -> 66.903892999999997 | AH30: =RC[-28] -> 0 | AI30: =RC[-28] -> 272.84158300000001 | AJ30: =RC[-28] -> 42.626286 | AK30: =RC[-28] -> 0 | AL30: =RC[-28] -> 24.277606999999996 | AM30: =RC[-28] -> 3.1088529999999999 | AN30: =RC[-28] -> 0 | AO30: =RC[-28] -> 0 | AP30: - | AQ30: =RC[-29] -> 0 | AR30: =RC[-29] -> 0 | AS30: - | AT30: =RC[-30] -> 0 | AU30: =RC[-30] -> 0 | AV30: =RC[-30] -> 0 | AW30: =RC[-30] -> 6.8477829999999997 | AY30: - | BA30: -
A31: =IF(RC[1]="","",DATEVALUE(RC[1])) -> 43383 | B31: 10.10.18 | C31: 24 | D31: 273.10986300000002 | E31: 67.930289999999999 | G31: 269.97421300000002 | H31: 42.928158000000003 | J31: =RC[-5]-RC[-2] -> 25.002131999999996 | K31: 3.13565 | S31: 6.978885 | T31: =(RC[-16]*RC[-15]-RC[-13]*RC[-12])/1000 -> 6.9629365238606153 | U31: - | V31: - | W31: =RC[-2]*RC[-10]/1000 -> #VALUE! | X31: =ABS((RC[-3]*RC[-11]-RC[-2]*RC[-9])/1000) -> #VALUE! | Y31: =RC[-14]/RC[-18]*100 -> 1.1614627801507842 | Z31: - | AC31: =VALUE(RC[-27]) -> 2018-10-10T00:00:00.000 | AD31: =IF(RC[21]=42,"*",IF(RC[21]=32,"",RC[21])) -> - | AE31: =RC[-28] -> 24 | AF31: =RC[-28] -> 273.10986300000002 | AG31: =RC[-28] -> 67.930289999999999 | AH31: =RC[-28] -> 0 | AI31: =RC[-28] -> 269.97421300000002 | AJ31: =RC[-28] -> 42.928158000000003 | AK31: =RC[-28] -> 0 | AL31: =RC[-28] -> 25.002131999999996 | AM31: =RC[-28] -> 3.13565 | AN31: =RC[-28] -> 0 | AO31: =RC[-28] -> 0 | AP31: - | AQ31: =RC[-29] -> 0 | AR31: =RC[-29] -> 0 | AS31: - | AT31: =RC[-30] -> 0 | AU31: =RC[-30] -> 0 | AV31: =RC[-30] -> 0 | AW31: =RC[-30] -> 6.978885 | AY31: - | BA31: -
A32: =IF(RC[1]="","",DATEVALUE(RC[1])) -> 43384 | B32: 11.10.18 | C32: 24 | D32: 279.92346199999997 | E32: 69.024451999999997 | G32: 276.26312300000001 | H32: 43.539470999999999 | J32: =RC[-5]-RC[-2] -> 25.484980999999998 | K32: 3.6603469999999998 | S32: 7.3100670000000001 | T32: =(RC[-16]*RC[-15]-RC[-13]*RC[-12])/1000 -> 7.2932133342648866 | U32: - | V32: - | W32: =RC[-2]*RC[-10]/1000 -> #VALUE! | X32: =ABS((RC[-3]*RC[-11]-RC[-2]*RC[-9])/1000) -> #VALUE! | Y32: =RC[-14]/RC[-18]*100 -> 1.3249495481885216 | Z32: - | AC32: =VALUE(RC[-27]) -> 2018-10-11T00:00:00.000 | AD32: =IF(RC[21]=42,"*",IF(RC[21]=32,"",RC[21])) -> - | AE32: =RC[-28] -> 24 | AF32: =RC[-28] -> 279.92346199999997 | AG32: =RC[-28] -> 69.024451999999997 | AH32: =RC[-28] -> 0 | AI32: =RC[-28] -> 276.26312300000001 | AJ32: =RC[-28] -> 43.539470999999999 | AK32: =RC[-28] -> 0 | AL32: =RC[-28] -> 25.484980999999998 | AM32: =RC[-28] -> 3.6603469999999998 | AN32: =RC[-28] -> 0 | AO32: =RC[-28] -> 0 | AP32: - | AQ32: =RC[-29] -> 0 | AR32: =RC[-29] -> 0 | AS32: - | AT32: =RC[-30] -> 0 | AU32: =RC[-30] -> 0 | AV32: =RC[-30] -> 0 | AW32: =RC[-30] -> 7.3100670000000001 | AY32: - | BA32: -
A33: =IF(RC[1]="","",DATEVALUE(RC[1])) -> 43385 | B33: 12.10.18 | C33: 24 | D33: 278.15490699999998 | E33: 68.867125999999999 | G33: 274.92163099999999 | H33: 43.262408999999998 | J33: =RC[-5]-RC[-2] -> 25.604717000000001 | K33: 3.2332800000000002 | S33: 7.2785719999999996 | T33: =(RC[-16]*RC[-15]-RC[-13]*RC[-12])/1000 -> 7.2619569846181999 | U33: - | V33: - | W33: =RC[-2]*RC[-10]/1000 -> #VALUE! | X33: =ABS((RC[-3]*RC[-11]-RC[-2]*RC[-9])/1000) -> #VALUE! | Y33: =RC[-14]/RC[-18]*100 -> 1.176073337059462 | Z33: - | AC33: =VALUE(RC[-27]) -> 2018-10-12T00:00:00.000 | AD33: =IF(RC[21]=42,"*",IF(RC[21]=32,"",RC[21])) -> - | AE33: =RC[-28] -> 24 | AF33: =RC[-28] -> 278.15490699999998 | AG33: =RC[-28] -> 68.867125999999999 | AH33: =RC[-28] -> 0 | AI33: =RC[-28] -> 274.92163099999999 | AJ33: =RC[-28] -> 43.262408999999998 | AK33: =RC[-28] -> 0 | AL33: =RC[-28] -> 25.604717000000001 | AM33: =RC[-28] -> 3.2332800000000002 | AN33: =RC[-28] -> 0 | AO33: =RC[-28] -> 0 | AP33: - | AQ33: =RC[-29] -> 0 | AR33: =RC[-29] -> 0 | AS33: - | AT33: =RC[-30] -> 0 | AU33: =RC[-30] -> 0 | AV33: =RC[-30] -> 0 | AW33: =RC[-30] -> 7.2785719999999996 | AY33: - | BA33: -
A34: =IF(RC[1]="","",DATEVALUE(RC[1])) -> 43386 | B34: 13.10.18 | C34: 24 | D34: 230.02783199999999 | E34: 69.664092999999994 | G34: 227.38288900000001 | H34: 43.087955000000001 | J34: =RC[-5]-RC[-2] -> 26.576137999999993 | K34: 2.644949 | S34: 6.6040390000000002 | T34: =(RC[-16]*RC[-15]-RC[-13]*RC[-12])/1000 -> 6.2272165920343774 | U34: - | V34: - | W34: =RC[-2]*RC[-10]/1000 -> #VALUE! | X34: =ABS((RC[-3]*RC[-11]-RC[-2]*RC[-9])/1000) -> #VALUE! | Y34: =RC[-14]/RC[-18]*100 -> 1.1632137368084894 | Z34: - | AC34: =VALUE(RC[-27]) -> 2018-10-13T00:00:00.000 | AD34: =IF(RC[21]=42,"*",IF(RC[21]=32,"",RC[21])) -> - | AE34: =RC[-28] -> 24 | AF34: =RC[-28] -> 230.02783199999999 | AG34: =RC[-28] -> 69.664092999999994 | AH34: =RC[-28] -> 0 | AI34: =RC[-28] -> 227.38288900000001 | AJ34: =RC[-28] -> 43.087955000000001 | AK34: =RC[-28] -> 0 | AL34: =RC[-28] -> 26.576137999999993 | AM34: =RC[-28] -> 2.644949 | AN34: =RC[-28] -> 0 | AO34: =RC[-28] -> 0 | AP34: - | AQ34: =RC[-29] -> 0 | AR34: =RC[-29] -> 0 | AS34: - | AT34: =RC[-30] -> 0 | AU34: =RC[-30] -> 0 | AV34: =RC[-30] -> 0 | AW34: =RC[-30] -> 6.6040390000000002 | AY34: - | AZ34: * | BA34: -
A35: =IF(RC[1]="","",DATEVALUE(RC[1])) -> 43387 | B35: 14.10.18 | C35: 24 | D35: 284.535797 | E35: 70.747467 | G35: 280.99731400000002 | H35: 44.985064999999999 | J35: =RC[-5]-RC[-2] -> 25.762402000000002 | K35: 3.5385059999999999 | S35: 7.5073689999999997 | T35: =(RC[-16]*RC[-15]-RC[-13]*RC[-12])/1000 -> 7.4895044734607907 | U35: - | V35: - | W35: =RC[-2]*RC[-10]/1000 -> #VALUE! | X35: =ABS((RC[-3]*RC[-11]-RC[-2]*RC[-9])/1000) -> #VALUE! | Y35: =RC[-14]/RC[-18]*100 -> 1.2592668412481693 | Z35: - | AC35: =VALUE(RC[-27]) -> 2018-10-14T00:00:00.000 | AD35: =IF(RC[21]=42,"*",IF(RC[21]=32,"",RC[21])) -> - | AE35: =RC[-28] -> 24 | AF35: =RC[-28] -> 284.535797 | AG35: =RC[-28] -> 70.747467 | AH35: =RC[-28] -> 0 | AI35: =RC[-28] -> 280.99731400000002 | AJ35: =RC[-28] -> 44.985064999999999 | AK35: =RC[-28] -> 0 | AL35: =RC[-28] -> 25.762402000000002 | AM35: =RC[-28] -> 3.5385059999999999 | AN35: =RC[-28] -> 0 | AO35: =RC[-28] -> 0 | AP35: - | AQ35: =RC[-29] -> 0 | AR35: =RC[-29] -> 0 | AS35: - | AT35: =RC[-30] -> 0 | AU35: =RC[-30] -> 0 | AV35: =RC[-30] -> 0 | AW35: =RC[-30] -> 7.5073689999999997 | AY35: - | BA35: -
A36: =IF(RC[1]="","",DATEVALUE(RC[1])) -> 43388 | B36: 15.10.18 | C36: 24 | D36: 289.07064800000001 | E36: 70.245033000000006 | G36: 285.436218 | H36: 45.472270999999999 | J36: =RC[-5]-RC[-2] -> 24.772762000000007 | K36: 3.6344560000000001 | S36: 7.3444459999999996 | T36: =(RC[-16]*RC[-15]-RC[-13]*RC[-12])/1000 -> 7.3263441499803088 | U36: - | V36: - | W36: =RC[-2]*RC[-10]/1000 -> #VALUE! | X36: =ABS((RC[-3]*RC[-11]-RC[-2]*RC[-9])/1000) -> #VALUE! | Y36: =RC[-14]/RC[-18]*100 -> 1.2732988215251646 | Z36: - | AC36: =VALUE(RC[-27]) -> 2018-10-15T00:00:00.000 | AD36: =IF(RC[21]=42,"*",IF(RC[21]=32,"",RC[21])) -> - | AE36: =RC[-28] -> 24 | AF36: =RC[-28] -> 289.07064800000001 | AG36: =RC[-28] -> 70.245033000000006 | AH36: =RC[-28] -> 0 | AI36: =RC[-28] -> 285.436218 | AJ36: =RC[-28] -> 45.472270999999999 | AK36: =RC[-28] -> 0 | AL36: =RC[-28] -> 24.772762000000007 | AM36: =RC[-28] -> 3.6344560000000001 | AN36: =RC[-28] -> 0 | AO36: =RC[-28] -> 0 | AP36: - | AQ36: =RC[-29] -> 0 | AR36: =RC[-29] -> 0 | AS36: - | AT36: =RC[-30] -> 0 | AU36: =RC[-30] -> 0 | AV36: =RC[-30] -> 0 | AW36: =RC[-30] -> 7.3444459999999996 | AY36: - | BA36: -
A37: =IF(RC[1]="","",DATEVALUE(RC[1])) -> 43389 | B37: 16.10.18 | C37: 24 | D37: 288.43472300000002 | E37: 70.253715999999997 | G37: 284.79342700000001 | H37: 45.478240999999997 | J37: =RC[-5]-RC[-2] -> 24.775475 | K37: 3.641267 | S37: 7.3297639999999999 | T37: =(RC[-16]*RC[-15]-RC[-13]*RC[-12])/1000 -> 7.3117070058587617 | U37: - | V37: - | W37: =RC[-2]*RC[-10]/1000 -> #VALUE! | X37: =ABS((RC[-3]*RC[-11]-RC[-2]*RC[-9])/1000) -> #VALUE! | Y37: =RC[-14]/RC[-18]*100 -> 1.2785642696732604 | Z37: - | AC37: =VALUE(RC[-27]) -> 2018-10-16T00:00:00.000 | AD37: =IF(RC[21]=42,"*",IF(RC[21]=32,"",RC[21])) -> - | AE37: =RC[-28] -> 24 | AF37: =RC[-28] -> 288.43472300000002 | AG37: =RC[-28] -> 70.253715999999997 | AH37: =RC[-28] -> 0 | AI37: =RC[-28] -> 284.79342700000001 | AJ37: =RC[-28] -> 45.478240999999997 | AK37: =RC[-28] -> 0 | AL37: =RC[-28] -> 24.775475 | AM37: =RC[-28] -> 3.641267 | AN37: =RC[-28] -> 0 | AO37: =RC[-28] -> 0 | AP37: - | AQ37: =RC[-29] -> 0 | AR37: =RC[-29] -> 0 | AS37: - | AT37: =RC[-30] -> 0 | AU37: =RC[-30] -> 0 | AV37: =RC[-30] -> 0 | AW37: =RC[-30] -> 7.3297639999999999 | AY37: - | BA37: -
A38: =IF(RC[1]="","",DATEVALUE(RC[1])) -> 43390 | B38: 17.10.18 | C38: 24 | D38: 292.149384 | E38: 70.518173000000004 | G38: 288.40225199999998 | H38: 45.879649999999998 | J38: =RC[-5]-RC[-2] -> 24.638523000000006 | K38: 3.7471269999999999 | S38: 7.38849 | T38: =(RC[-16]*RC[-15]-RC[-13]*RC[-12])/1000 -> 7.3700464217836341 | U38: - | V38: - | W38: =RC[-2]*RC[-10]/1000 -> #VALUE! | X38: =ABS((RC[-3]*RC[-11]-RC[-2]*RC[-9])/1000) -> #VALUE! | Y38: =RC[-14]/RC[-18]*100 -> 1.2992710611704932 | Z38: - | AC38: =VALUE(RC[-27]) -> 2018-10-17T00:00:00.000 | AD38: =IF(RC[21]=42,"*",IF(RC[21]=32,"",RC[21])) -> - | AE38: =RC[-28] -> 24 | AF38: =RC[-28] -> 292.149384 | AG38: =RC[-28] -> 70.518173000000004 | AH38: =RC[-28] -> 0 | AI38: =RC[-28] -> 288.40225199999998 | AJ38: =RC[-28] -> 45.879649999999998 | AK38: =RC[-28] -> 0 | AL38: =RC[-28] -> 24.638523000000006 | AM38: =RC[-28] -> 3.7471269999999999 | AN38: =RC[-28] -> 0 | AO38: =RC[-28] -> 0 | AP38: - | AQ38: =RC[-29] -> 0 | AR38: =RC[-29] -> 0 | AS38: - | AT38: =RC[-30] -> 0 | AU38: =RC[-30] -> 0 | AV38: =RC[-30] -> 0 | AW38: =RC[-30] -> 7.38849 | AY38: - | BA38: -
A39: =IF(RC[1]="","",DATEVALUE(RC[1])) -> 43391 | B39: 18.10.18 | C39: 24 | D39: 289.20657299999999 | E39: 70.948959000000002 | G39: 285.45788599999997 | H39: 46.000281999999999 | J39: =RC[-5]-RC[-2] -> 24.948677000000004 | K39: 3.7486790000000001 | S39: 7.4061089999999998 | T39: =(RC[-16]*RC[-15]-RC[-13]*RC[-12])/1000 -> 7.3877620351836555 | U39: - | V39: - | W39: =RC[-2]*RC[-10]/1000 -> #VALUE! | X39: =ABS((RC[-3]*RC[-11]-RC[-2]*RC[-9])/1000) -> #VALUE! | Y39: =RC[-14]/RC[-18]*100 -> 1.3132161288408057 | Z39: - | AC39: =VALUE(RC[-27]) -> 2018-10-18T00:00:00.000 | AD39: =IF(RC[21]=42,"*",IF(RC[21]=32,"",RC[21])) -> - | AE39: =RC[-28] -> 24 | AF39: =RC[-28] -> 289.20657299999999 | AG39: =RC[-28] -> 70.948959000000002 | AH39: =RC[-28] -> 0 | AI39: =RC[-28] -> 285.45788599999997 | AJ39: =RC[-28] -> 46.000281999999999 | AK39: =RC[-28] -> 0 | AL39: =RC[-28] -> 24.948677000000004 | AM39: =RC[-28] -> 3.7486790000000001 | AN39: =RC[-28] -> 0 | AO39: =RC[-28] -> 0 | AP39: - | AQ39: =RC[-29] -> 0 | AR39: =RC[-29] -> 0 | AS39: - | AT39: =RC[-30] -> 0 | AU39: =RC[-30] -> 0 | AV39: =RC[-30] -> 0 | AW39: =RC[-30] -> 7.4061089999999998 | AY39: - | BA39: -
A40: =IF(RC[1]="","",DATEVALUE(RC[1])) -> 43392 | B40: 19.10.18 | C40: 24 | D40: 288.55413800000002 | E40: 70.723618000000002 | G40: 284.81826799999999 | H40: 45.493343000000003 | J40: =RC[-5]-RC[-2] -> 25.230274999999999 | K40: 3.7358989999999999 | S40: 7.4683919999999997 | T40: =(RC[-16]*RC[-15]-RC[-13]*RC[-12])/1000 -> 7.4502574694413619 | U40: - | V40: - | W40: =RC[-2]*RC[-10]/1000 -> #VALUE! | X40: =ABS((RC[-3]*RC[-11]-RC[-2]*RC[-9])/1000) -> #VALUE! | Y40: =RC[-14]/RC[-18]*100 -> 1.3116781540150366 | Z40: - | AC40: =VALUE(RC[-27]) -> 2018-10-19T00:00:00.000 | AD40: =IF(RC[21]=42,"*",IF(RC[21]=32,"",RC[21])) -> - | AE40: =RC[-28] -> 24 | AF40: =RC[-28] -> 288.55413800000002 | AG40: =RC[-28] -> 70.723618000000002 | AH40: =RC[-28] -> 0 | AI40: =RC[-28] -> 284.81826799999999 | AJ40: =RC[-28] -> 45.493343000000003 | AK40: =RC[-28] -> 0 | AL40: =RC[-28] -> 25.230274999999999 | AM40: =RC[-28] -> 3.7358989999999999 | AN40: =RC[-28] -> 0 | AO40: =RC[-28] -> 0 | AP40: - | AQ40: =RC[-29] -> 0 | AR40: =RC[-29] -> 0 | AS40: - | AT40: =RC[-30] -> 0 | AU40: =RC[-30] -> 0 | AV40: =RC[-30] -> 0 | AW40: =RC[-30] -> 7.4683919999999997 | AY40: - | BA40: -
A41: =IF(RC[1]="","",DATEVALUE(RC[1])) -> 43393 | B41: 20.10.18 | C41: 24 | D41: 278.796021 | E41: 69.909522999999993 | G41: 275.10925300000002 | H41: 44.549210000000002 | J41: =RC[-5]-RC[-2] -> 25.360312999999991 | K41: 3.6867899999999998 | S41: 7.2517139999999998 | T41: =(RC[-16]*RC[-15]-RC[-13]*RC[-12])/1000 -> 7.2345969575678497 | U41: - | V41: - | W41: =RC[-2]*RC[-10]/1000 -> #VALUE! | X41: =ABS((RC[-3]*RC[-11]-RC[-2]*RC[-9])/1000) -> #VALUE! | Y41: =RC[-14]/RC[-18]*100 -> 1.3401185019393003 | Z41: - | AC41: =VALUE(RC[-27]) -> 2018-10-20T00:00:00.000 | AD41: =IF(RC[21]=42,"*",IF(RC[21]=32,"",RC[21])) -> - | AE41: =RC[-28] -> 24 | AF41: =RC[-28] -> 278.796021 | AG41: =RC[-28] -> 69.909522999999993 | AH41: =RC[-28] -> 0 | AI41: =RC[-28] -> 275.10925300000002 | AJ41: =RC[-28] -> 44.549210000000002 | AK41: =RC[-28] -> 0 | AL41: =RC[-28] -> 25.360312999999991 | AM41: =RC[-28] -> 3.6867899999999998 | AN41: =RC[-28] -> 0 | AO41: =RC[-28] -> 0 | AP41: - | AQ41: =RC[-29] -> 0 | AR41: =RC[-29] -> 0 | AS41: - | AT41: =RC[-30] -> 0 | AU41: =RC[-30] -> 0 | AV41: =RC[-30] -> 0 | AW41: =RC[-30] -> 7.2517139999999998 | AY41: - | BA41: -
A42: =IF(RC[1]="","",DATEVALUE(RC[1])) -> 43394 | B42: 21.10.18 | C42: 24 | D42: 280.589111 | E42: 69.100998000000004 | G42: 276.873199 | H42: 44.223457000000003 | J42: =RC[-5]-RC[-2] -> 24.877541000000001 | K42: 3.7159140000000002 | S42: 7.1617199999999999 | T42: =(RC[-16]*RC[-15]-RC[-13]*RC[-12])/1000 -> 7.1446975876038339 | U42: - | V42: - | W42: =RC[-2]*RC[-10]/1000 -> #VALUE! | X42: =ABS((RC[-3]*RC[-11]-RC[-2]*RC[-9])/1000) -> #VALUE! | Y42: =RC[-14]/RC[-18]*100 -> 1.3420995652237182 | Z42: - | AC42: =VALUE(RC[-27]) -> 2018-10-21T00:00:00.000 | AD42: =IF(RC[21]=42,"*",IF(RC[21]=32,"",RC[21])) -> - | AE42: =RC[-28] -> 24 | AF42: =RC[-28] -> 280.589111 | AG42: =RC[-28] -> 69.100998000000004 | AH42: =RC[-28] -> 0 | AI42: =RC[-28] -> 276.873199 | AJ42: =RC[-28] -> 44.223457000000003 | AK42: =RC[-28] -> 0 | AL42: =RC[-28] -> 24.877541000000001 | AM42: =RC[-28] -> 3.7159140000000002 | AN42: =RC[-28] -> 0 | AO42: =RC[-28] -> 0 | AP42: - | AQ42: =RC[-29] -> 0 | AR42: =RC[-29] -> 0 | AS42: - | AT42: =RC[-30] -> 0 | AU42: =RC[-30] -> 0 | AV42: =RC[-30] -> 0 | AW42: =RC[-30] -> 7.1617199999999999 | AY42: - | BA42: -
A43: =IF(RC[1]="","",DATEVALUE(RC[1])) -> 43395 | B43: 22.10.18 | C43: 24 | D43: 278.40386999999998 | E43: 69.625977000000006 | G43: 274.72167999999999 | H43: 44.107052000000003 | J43: =RC[-5]-RC[-2] -> 25.518925000000003 | K43: 3.682153 | S43: 7.2837820000000004 | T43: =(RC[-16]*RC[-15]-RC[-13]*RC[-12])/1000 -> 7.2669780240436284 | U43: - | V43: - | W43: =RC[-2]*RC[-10]/1000 -> #VALUE! | X43: =ABS((RC[-3]*RC[-11]-RC[-2]*RC[-9])/1000) -> #VALUE! | Y43: =RC[-14]/RC[-18]*100 -> 1.3403212298352281 | Z43: - | AC43: =VALUE(RC[-27]) -> 2018-10-22T00:00:00.000 | AD43: =IF(RC[21]=42,"*",IF(RC[21]=32,"",RC[21])) -> - | AE43: =RC[-28] -> 24 | AF43: =RC[-28] -> 278.40386999999998 | AG43: =RC[-28] -> 69.625977000000006 | AH43: =RC[-28] -> 0 | AI43: =RC[-28] -> 274.72167999999999 | AJ43: =RC[-28] -> 44.107052000000003 | AK43: =RC[-28] -> 0 | AL43: =RC[-28] -> 25.518925000000003 | AM43: =RC[-28] -> 3.682153 | AN43: =RC[-28] -> 0 | AO43: =RC[-28] -> 0 | AP43: - | AQ43: =RC[-29] -> 0 | AR43: =RC[-29] -> 0 | AS43: - | AT43: =RC[-30] -> 0 | AU43: =RC[-30] -> 0 | AV43: =RC[-30] -> 0 | AW43: =RC[-30] -> 7.2837820000000004 | AY43: - | BA43: -
A44: =IF(RC[1]="","",DATEVALUE(RC[1])) ->  | C44: 24 | J44: =RC[-5]-RC[-2] -> #VALUE! | T44: =(RC[-16]*RC[-15]-RC[-13]*RC[-12])/1000 -> #VALUE! | W44: =RC[-2]*RC[-10]/1000 -> #VALUE! | X44: =ABS((RC[-3]*RC[-11]-RC[-2]*RC[-9])/1000) -> #VALUE! | Y44: =RC[-14]/RC[-18]*100 -> #VALUE! | AC44: =VALUE(RC[-27]) -> #VALUE! | AD44: =IF(RC[21]=42,"*",IF(RC[21]=32,"",RC[21])) ->  | AE44: =RC[-28] -> 24 | AF44: =RC[-28] ->  | AG44: =RC[-28] ->  | AH44: =RC[-28] -> 0 | AI44: =RC[-28] ->  | AJ44: =RC[-28] ->  | AK44: =RC[-28] -> 0 | AL44: =RC[-28] -> #VALUE! | AM44: =RC[-28] ->  | AN44: =RC[-28] -> 0 | AO44: =RC[-28] -> 0 | AP44: - | AQ44: =RC[-29] -> 0 | AR44: =RC[-29] -> 0 | AS44: - | AT44: =RC[-30] -> 0 | AU44: =RC[-30] -> 0 | AV44: =RC[-30] -> 0 | AW44: =RC[-30] -> 
A45: =IF(RC[1]="","",DATEVALUE(RC[1])) ->  | C45: 24 | T45: =(RC[-16]*RC[-15]-RC[-13]*RC[-12])/1000 -> #VALUE! | W45: =RC[-2]*RC[-10]/1000 -> #VALUE! | X45: =ABS((RC[-3]*RC[-11]-RC[-2]*RC[-9])/1000) -> #VALUE! | Y45: =RC[-14]/RC[-18]*100 -> #VALUE! | AC45: =VALUE(RC[-27]) -> #VALUE! | AD45: =IF(RC[21]=42,"*",IF(RC[21]=32,"",RC[21])) ->  | AE45: =RC[-28] -> 24 | AF45: =RC[-28] ->  | AG45: =RC[-28] ->  | AH45: =RC[-28] -> 0 | AI45: =RC[-28] ->  | AJ45: =RC[-28] ->  | AK45: =RC[-28] -> 0 | AL45: =RC[-28] -> 0 | AM45: =RC[-28] ->  | AN45: =RC[-28] -> 0 | AO45: =RC[-28] -> 0 | AP45: - | AQ45: =RC[-29] -> 0 | AR45: =RC[-29] -> 0 | AS45: - | AT45: =RC[-30] -> 0 | AU45: =RC[-30] -> 0 | AV45: =RC[-30] -> 0 | AW45: =RC[-30] -> 
A46: =IF(RC[1]="","",DATEVALUE(RC[1])) ->  | C46: 24 | T46: =(RC[-16]*RC[-15]-RC[-13]*RC[-12])/1000 -> #VALUE! | W46: =RC[-2]*RC[-10]/1000 -> #VALUE! | X46: =ABS((RC[-3]*RC[-11]-RC[-2]*RC[-9])/1000) -> #VALUE! | Y46: =RC[-14]/RC[-18]*100 -> #VALUE! | AC46: =VALUE(RC[-27]) -> #VALUE! | AD46: =IF(RC[21]=42,"*",IF(RC[21]=32,"",RC[21])) ->  | AE46: =RC[-28] -> 24 | AF46: =RC[-28] ->  | AG46: =RC[-28] ->  | AH46: =RC[-28] -> 0 | AI46: =RC[-28] ->  | AJ46: =RC[-28] ->  | AK46: =RC[-28] -> 0 | AL46: =RC[-28] -> 0 | AM46: =RC[-28] ->  | AN46: =RC[-28] -> 0 | AO46: =RC[-28] -> 0 | AP46: - | AQ46: =RC[-29] -> 0 | AR46: =RC[-29] -> 0 | AS46: - | AT46: =RC[-30] -> 0 | AU46: =RC[-30] -> 0 | AV46: =RC[-30] -> 0 | AW46: =RC[-30] -> 
A47: =IF(RC[1]="","",DATEVALUE(RC[1])) ->  | C47: 24 | T47: =(RC[-16]*RC[-15]-RC[-13]*RC[-12])/1000 -> #VALUE! | W47: =RC[-2]*RC[-10]/1000 -> #VALUE! | X47: =ABS((RC[-3]*RC[-11]-RC[-2]*RC[-9])/1000) -> #VALUE! | Y47: =RC[-14]/RC[-18]*100 -> #VALUE! | AC47: =VALUE(RC[-27]) -> #VALUE! | AD47: =IF(RC[21]=42,"*",IF(RC[21]=32,"",RC[21])) ->  | AE47: =RC[-28] -> 24 | AF47: =RC[-28] ->  | AG47: =RC[-28] ->  | AH47: =RC[-28] -> 0 | AI47: =RC[-28] ->  | AJ47: =RC[-28] ->  | AK47: =RC[-28] -> 0 | AL47: =RC[-28] -> 0 | AM47: =RC[-28] ->  | AN47: =RC[-28] -> 0 | AO47: =RC[-28] -> 0 | AP47: - | AQ47: =RC[-29] -> 0 | AR47: =RC[-29] -> 0 | AS47: - | AT47: =RC[-30] -> 0 | AU47: =RC[-30] -> 0 | AV47: =RC[-30] -> 0 | AW47: =RC[-30] -> 
A48: =IF(RC[1]="","",DATEVALUE(RC[1])) ->  | C48: 24 | T48: =(RC[-16]*RC[-15]-RC[-13]*RC[-12])/1000 -> #VALUE! | W48: =RC[-2]*RC[-10]/1000 -> #VALUE! | X48: =ABS((RC[-3]*RC[-11]-RC[-2]*RC[-9])/1000) -> #VALUE! | Y48: =RC[-14]/RC[-18]*100 -> #VALUE! | AC48: =VALUE(RC[-27]) -> #VALUE! | AD48: =IF(RC[21]=42,"*",IF(RC[21]=32,"",RC[21])) ->  | AE48: =RC[-28] -> 24 | AF48: =RC[-28] ->  | AG48: =RC[-28] ->  | AH48: =RC[-28] -> 0 | AI48: =RC[-28] ->  | AJ48: =RC[-28] ->  | AK48: =RC[-28] -> 0 | AL48: =RC[-28] -> 0 | AM48: =RC[-28] ->  | AN48: =RC[-28] -> 0 | AO48: =RC[-28] -> 0 | AP48: - | AQ48: =RC[-29] -> 0 | AR48: =RC[-29] -> 0 | AS48: - | AT48: =RC[-30] -> 0 | AU48: =RC[-30] -> 0 | AV48: =RC[-30] -> 0 | AW48: =RC[-30] -> 
A49: =IF(RC[1]="","",DATEVALUE(RC[1])) ->  | C49: 24 | T49: =(RC[-16]*RC[-15]-RC[-13]*RC[-12])/1000 -> #VALUE! | W49: =RC[-2]*RC[-10]/1000 -> #VALUE! | X49: =ABS((RC[-3]*RC[-11]-RC[-2]*RC[-9])/1000) -> #VALUE! | Y49: =RC[-14]/RC[-18]*100 -> #VALUE! | AC49: =VALUE(RC[-27]) -> #VALUE! | AD49: =IF(RC[21]=42,"*",IF(RC[21]=32,"",RC[21])) ->  | AE49: =RC[-28] -> 24 | AF49: =RC[-28] ->  | AG49: =RC[-28] ->  | AH49: =RC[-28] -> 0 | AI49: =RC[-28] ->  | AJ49: =RC[-28] ->  | AK49: =RC[-28] -> 0 | AL49: =RC[-28] -> 0 | AM49: =RC[-28] ->  | AN49: =RC[-28] -> 0 | AO49: =RC[-28] -> 0 | AP49: - | AQ49: =RC[-29] -> 0 | AR49: =RC[-29] -> 0 | AS49: - | AT49: =RC[-30] -> 0 | AU49: =RC[-30] -> 0 | AV49: =RC[-30] -> 0 | AW49: =RC[-30] -> 
A50: =IF(RC[1]="","",DATEVALUE(RC[1])) ->  | T50: =(RC[-16]*RC[-15]-RC[-13]*RC[-12])/1000 -> #VALUE! | W50: =RC[-2]*RC[-10]/1000 -> #VALUE! | X50: =ABS((RC[-3]*RC[-11]-RC[-2]*RC[-9])/1000) -> #VALUE! | Y50: =RC[-14]/RC[-18]*100 -> #VALUE! | AC50: =VALUE(RC[-27]) -> #VALUE! | AD50: =IF(RC[21]=42,"*",IF(RC[21]=32,"",RC[21])) ->  | AE50: =RC[-28] ->  | AF50: =RC[-28] ->  | AG50: =RC[-28] ->  | AH50: =RC[-28] -> 0 | AI50: =RC[-28] ->  | AJ50: =RC[-28] ->  | AK50: =RC[-28] -> 0 | AL50: =RC[-28] -> 0 | AM50: =RC[-28] ->  | AN50: =RC[-28] -> 0 | AO50: =RC[-28] -> 0 | AP50: - | AQ50: =RC[-29] -> 0 | AR50: =RC[-29] -> 0 | AS50: - | AT50: =RC[-30] -> 0 | AU50: =RC[-30] -> 0 | AV50: =RC[-30] -> 0 | AW50: =RC[-30] -> 
A51: =IF(RC[1]="","",DATEVALUE(RC[1])) ->  | T51: =(RC[-16]*RC[-15]-RC[-13]*RC[-12])/1000 -> #VALUE! | W51: =RC[-2]*RC[-10]/1000 -> #VALUE! | X51: =ABS((RC[-3]*RC[-11]-RC[-2]*RC[-9])/1000) -> #VALUE! | Y51: =RC[-14]/RC[-18]*100 -> #VALUE! | AC51: =VALUE(RC[-27]) -> #VALUE! | AD51: =IF(RC[21]=42,"*",IF(RC[21]=32,"",RC[21])) ->  | AE51: =RC[-28] ->  | AF51: =RC[-28] ->  | AG51: =RC[-28] ->  | AH51: =RC[-28] -> 0 | AI51: =RC[-28] ->  | AJ51: =RC[-28] ->  | AK51: =RC[-28] -> 0 | AL51: =RC[-28] -> 0 | AM51: =RC[-28] ->  | AN51: =RC[-28] -> 0 | AO51: =RC[-28] -> 0 | AP51: - | AQ51: =RC[-29] -> 0 | AR51: =RC[-29] -> 0 | AS51: - | AT51: =RC[-30] -> 0 | AU51: =RC[-30] -> 0 | AV51: =RC[-30] -> 0 | AW51: =RC[-30] -> 
A52: =IF(RC[1]="","",DATEVALUE(RC[1])) ->  | T52: =(RC[-16]*RC[-15]-RC[-13]*RC[-12])/1000 -> #VALUE! | W52: =RC[-2]*RC[-10]/1000 -> #VALUE! | X52: =ABS((RC[-3]*RC[-11]-RC[-2]*RC[-9])/1000) -> #VALUE! | Y52: =RC[-14]/RC[-18]*100 -> #VALUE! | AC52: =VALUE(RC[-27]) -> #VALUE! | AD52: =IF(RC[21]=42,"*",IF(RC[21]=32,"",RC[21])) ->  | AE52: =RC[-28] ->  | AF52: =RC[-28] ->  | AG52: =RC[-28] ->  | AH52: =RC[-28] -> 0 | AI52: =RC[-28] ->  | AJ52: =RC[-28] ->  | AK52: =RC[-28] -> 0 | AL52: =RC[-28] -> 0 | AM52: =RC[-28] ->  | AN52: =RC[-28] -> 0 | AO52: =RC[-28] -> 0 | AP52: - | AQ52: =RC[-29] -> 0 | AR52: =RC[-29] -> 0 | AS52: - | AT52: =RC[-30] -> 0 | AU52: =RC[-30] -> 0 | AV52: =RC[-30] -> 0 | AW52: =RC[-30] -> 
A53: =IF(RC[1]="","",DATEVALUE(RC[1])) ->  | T53: =(RC[-16]*RC[-15]-RC[-13]*RC[-12])/1000 -> #VALUE! | W53: =RC[-2]*RC[-10]/1000 -> #VALUE! | X53: =ABS((RC[-3]*RC[-11]-RC[-2]*RC[-9])/1000) -> #VALUE! | Y53: =RC[-14]/RC[-18]*100 -> #VALUE! | AC53: =VALUE(RC[-27]) -> #VALUE! | AD53: =IF(RC[21]=42,"*",IF(RC[21]=32,"",RC[21])) ->  | AE53: =RC[-28] ->  | AF53: =RC[-28] ->  | AG53: =RC[-28] ->  | AH53: =RC[-28] -> 0 | AI53: =RC[-28] ->  | AJ53: =RC[-28] ->  | AK53: =RC[-28] -> 0 | AL53: =RC[-28] -> 0 | AM53: =RC[-28] ->  | AN53: =RC[-28] -> 0 | AO53: =RC[-28] -> 0 | AP53: - | AQ53: =RC[-29] -> 0 | AR53: =RC[-29] -> 0 | AS53: - | AT53: =RC[-30] -> 0 | AU53: =RC[-30] -> 0 | AV53: =RC[-30] -> 0 | AW53: =RC[-30] -> 
A54: =IF(RC[1]="","",DATEVALUE(RC[1])) ->  | T54: =(RC[-16]*RC[-15]-RC[-13]*RC[-12])/1000 -> #VALUE! | W54: =RC[-2]*RC[-10]/1000 -> #VALUE! | X54: =ABS((RC[-3]*RC[-11]-RC[-2]*RC[-9])/1000) -> #VALUE! | Y54: =RC[-14]/RC[-18]*100 -> #VALUE! | AC54: =VALUE(RC[-27]) -> #VALUE! | AD54: =IF(RC[21]=42,"*",IF(RC[21]=32,"",RC[21])) ->  | AE54: =RC[-28] ->  | AF54: =RC[-28] ->  | AG54: =RC[-28] ->  | AH54: =RC[-28] -> 0 | AI54: =RC[-28] ->  | AJ54: =RC[-28] ->  | AK54: =RC[-28] -> 0 | AL54: =RC[-28] -> 0 | AM54: =RC[-28] ->  | AN54: =RC[-28] -> 0 | AO54: =RC[-28] -> 0 | AP54: - | AQ54: =RC[-29] -> 0 | AR54: =RC[-29] -> 0 | AS54: - | AT54: =RC[-30] -> 0 | AU54: =RC[-30] -> 0 | AV54: =RC[-30] -> 0 | AW54: =RC[-30] -> 
A55: =IF(RC[1]="","",DATEVALUE(RC[1])) ->  | T55: =(RC[-16]*RC[-15]-RC[-13]*RC[-12])/1000 -> #VALUE! | W55: =RC[-2]*RC[-10]/1000 -> #VALUE! | X55: =ABS((RC[-3]*RC[-11]-RC[-2]*RC[-9])/1000) -> #VALUE! | Y55: =RC[-14]/RC[-18]*100 -> #VALUE! | AC55: =VALUE(RC[-27]) -> #VALUE! | AD55: =IF(RC[21]=42,"*",IF(RC[21]=32,"",RC[21])) ->  | AE55: =RC[-28] ->  | AF55: =RC[-28] ->  | AG55: =RC[-28] ->  | AH55: =RC[-28] -> 0 | AI55: =RC[-28] ->  | AJ55: =RC[-28] ->  | AK55: =RC[-28] -> 0 | AL55: =RC[-28] -> 0 | AM55: =RC[-28] ->  | AN55: =RC[-28] -> 0 | AO55: =RC[-28] -> 0 | AP55: - | AQ55: =RC[-29] -> 0 | AR55: =RC[-29] -> 0 | AS55: - | AT55: =RC[-30] -> 0 | AU55: =RC[-30] -> 0 | AV55: =RC[-30] -> 0 | AW55: =RC[-30] -> 
A56: =IF(RC[1]="","",DATEVALUE(RC[1])) ->  | T56: =(RC[-16]*RC[-15]-RC[-13]*RC[-12])/1000 -> #VALUE! | W56: =RC[-2]*RC[-10]/1000 -> #VALUE! | X56: =ABS((RC[-3]*RC[-11]-RC[-2]*RC[-9])/1000) -> #VALUE! | Y56: =RC[-14]/RC[-18]*100 -> #VALUE! | AC56: =VALUE(RC[-27]) -> #VALUE! | AD56: =IF(RC[21]=42,"*",IF(RC[21]=32,"",RC[21])) ->  | AE56: =RC[-28] ->  | AF56: =RC[-28] ->  | AG56: =RC[-28] ->  | AH56: =RC[-28] -> 0 | AI56: =RC[-28] ->  | AJ56: =RC[-28] ->  | AK56: =RC[-28] -> 0 | AL56: =RC[-28] -> 0 | AM56: =RC[-28] ->  | AN56: =RC[-28] -> 0 | AO56: =RC[-28] -> 0 | AP56: - | AQ56: =RC[-29] -> 0 | AR56: =RC[-29] -> 0 | AS56: - | AT56: =RC[-30] -> 0 | AU56: =RC[-30] -> 0 | AV56: =RC[-30] -> 0 | AW56: =RC[-30] -> 
A57: =IF(RC[1]="","",DATEVALUE(RC[1])) ->  | T57: =(RC[-16]*RC[-15]-RC[-13]*RC[-12])/1000 -> #VALUE! | W57: =RC[-2]*RC[-10]/1000 -> #VALUE! | X57: =ABS((RC[-3]*RC[-11]-RC[-2]*RC[-9])/1000) -> #VALUE! | Y57: =RC[-14]/RC[-18]*100 -> #VALUE! | AC57: =VALUE(RC[-27]) -> #VALUE! | AD57: =IF(RC[21]=42,"*",IF(RC[21]=32,"",RC[21])) ->  | AE57: =RC[-28] ->  | AF57: =RC[-28] ->  | AG57: =RC[-28] ->  | AH57: =RC[-28] -> 0 | AI57: =RC[-28] ->  | AJ57: =RC[-28] ->  | AK57: =RC[-28] -> 0 | AL57: =RC[-28] -> 0 | AM57: =RC[-28] ->  | AN57: =RC[-28] -> 0 | AO57: =RC[-28] -> 0 | AP57: - | AQ57: =RC[-29] -> 0 | AR57: =RC[-29] -> 0 | AS57: - | AT57: =RC[-30] -> 0 | AU57: =RC[-30] -> 0 | AV57: =RC[-30] -> 0 | AW57: =RC[-30] -> 
A58: =IF(RC[1]="","",DATEVALUE(RC[1])) ->  | T58: =(RC[-16]*RC[-15]-RC[-13]*RC[-12])/1000 -> #VALUE! | W58: =RC[-2]*RC[-10]/1000 -> #VALUE! | X58: =ABS((RC[-3]*RC[-11]-RC[-2]*RC[-9])/1000) -> #VALUE! | Y58: =RC[-14]/RC[-18]*100 -> #VALUE! | AC58: =VALUE(RC[-27]) -> #VALUE! | AD58: =IF(RC[21]=42,"*",IF(RC[21]=32,"",RC[21])) ->  | AE58: =RC[-28] ->  | AF58: =RC[-28] ->  | AG58: =RC[-28] ->  | AH58: =RC[-28] -> 0 | AI58: =RC[-28] ->  | AJ58: =RC[-28] ->  | AK58: =RC[-28] -> 0 | AL58: =RC[-28] -> 0 | AM58: =RC[-28] ->  | AN58: =RC[-28] -> 0 | AO58: =RC[-28] -> 0 | AP58: - | AQ58: =RC[-29] -> 0 | AR58: =RC[-29] -> 0 | AS58: - | AT58: =RC[-30] -> 0 | AU58: =RC[-30] -> 0 | AV58: =RC[-30] -> 0 | AW58: =RC[-30] -> 
A59: =IF(RC[1]="","",DATEVALUE(RC[1])) ->  | T59: =(RC[-16]*RC[-15]-RC[-13]*RC[-12])/1000 -> #VALUE! | W59: =RC[-2]*RC[-10]/1000 -> #VALUE! | X59: =ABS((RC[-3]*RC[-11]-RC[-2]*RC[-9])/1000) -> #VALUE! | Y59: =RC[-14]/RC[-18]*100 -> #VALUE! | AC59: =VALUE(RC[-27]) -> #VALUE! | AD59: =IF(RC[21]=42,"*",IF(RC[21]=32,"",RC[21])) ->  | AE59: =RC[-28] ->  | AF59: =RC[-28] ->  | AG59: =RC[-28] ->  | AH59: =RC[-28] -> 0 | AI59: =RC[-28] ->  | AJ59: =RC[-28] ->  | AK59: =RC[-28] -> 0 | AL59: =RC[-28] -> 0 | AM59: =RC[-28] ->  | AN59: =RC[-28] -> 0 | AO59: =RC[-28] -> 0 | AP59: - | AQ59: =RC[-29] -> 0 | AR59: =RC[-29] -> 0 | AS59: - | AT59: =RC[-30] -> 0 | AU59: =RC[-30] -> 0 | AV59: =RC[-30] -> 0 | AW59: =RC[-30] -> 
A60: =IF(RC[1]="","",DATEVALUE(RC[1])) ->  | T60: =(RC[-16]*RC[-15]-RC[-13]*RC[-12])/1000 -> #VALUE! | W60: =RC[-2]*RC[-10]/1000 -> #VALUE! | X60: =ABS((RC[-3]*RC[-11]-RC[-2]*RC[-9])/1000) -> #VALUE! | Y60: =RC[-14]/RC[-18]*100 -> #VALUE! | AC60: =VALUE(RC[-27]) -> #VALUE! | AD60: =IF(RC[21]=42,"*",IF(RC[21]=32,"",RC[21])) ->  | AE60: =RC[-28] ->  | AF60: =RC[-28] ->  | AG60: =RC[-28] ->  | AH60: =RC[-28] -> 0 | AI60: =RC[-28] ->  | AJ60: =RC[-28] ->  | AK60: =RC[-28] -> 0 | AL60: =RC[-28] -> 0 | AM60: =RC[-28] ->  | AN60: =RC[-28] -> 0 | AO60: =RC[-28] -> 0 | AP60: - | AQ60: =RC[-29] -> 0 | AR60: =RC[-29] -> 0 | AS60: - | AT60: =RC[-30] -> 0 | AU60: =RC[-30] -> 0 | AV60: =RC[-30] -> 0 | AW60: =RC[-30] -> 
A61: =IF(RC[1]="","",DATEVALUE(RC[1])) ->  | T61: =(RC[-16]*RC[-15]-RC[-13]*RC[-12])/1000 -> #VALUE! | W61: =RC[-2]*RC[-10]/1000 -> #VALUE! | X61: =ABS((RC[-3]*RC[-11]-RC[-2]*RC[-9])/1000) -> #VALUE! | Y61: =RC[-14]/RC[-18]*100 -> #VALUE! | AC61: =VALUE(RC[-27]) -> #VALUE! | AD61: =IF(RC[21]=42,"*",IF(RC[21]=32,"",RC[21])) ->  | AE61: =RC[-28] ->  | AF61: =RC[-28] ->  | AG61: =RC[-28] ->  | AH61: =RC[-28] -> 0 | AI61: =RC[-28] ->  | AJ61: =RC[-28] ->  | AK61: =RC[-28] -> 0 | AL61: =RC[-28] -> 0 | AM61: =RC[-28] ->  | AN61: =RC[-28] -> 0 | AO61: =RC[-28] -> 0 | AP61: - | AQ61: =RC[-29] -> 0 | AR61: =RC[-29] -> 0 | AS61: - | AT61: =RC[-30] -> 0 | AU61: =RC[-30] -> 0 | AV61: =RC[-30] -> 0 | AW61: =RC[-30] -> 
A62: =IF(RC[1]="","",DATEVALUE(RC[1])) ->  | T62: =(RC[-16]*RC[-15]-RC[-13]*RC[-12])/1000 -> #VALUE! | W62: =RC[-2]*RC[-10]/1000 -> #VALUE! | X62: =ABS((RC[-3]*RC[-11]-RC[-2]*RC[-9])/1000) -> #VALUE! | Y62: =RC[-14]/RC[-18]*100 -> #VALUE! | AC62: =VALUE(RC[-27]) -> #VALUE! | AD62: =IF(RC[21]=42,"*",IF(RC[21]=32,"",RC[21])) ->  | AE62: =RC[-28] ->  | AF62: =RC[-28] ->  | AG62: =RC[-28] ->  | AH62: =RC[-28] -> 0 | AI62: =RC[-28] ->  | AJ62: =RC[-28] ->  | AK62: =RC[-28] -> 0 | AL62: =RC[-28] -> 0 | AM62: =RC[-28] ->  | AN62: =RC[-28] -> 0 | AO62: =RC[-28] -> 0 | AP62: - | AQ62: =RC[-29] -> 0 | AR62: =RC[-29] -> 0 | AS62: - | AT62: =RC[-30] -> 0 | AU62: =RC[-30] -> 0 | AV62: =RC[-30] -> 0 | AW62: =RC[-30] -> 
A63: =IF(RC[1]="","",DATEVALUE(RC[1])) ->  | T63: =(RC[-16]*RC[-15]-RC[-13]*RC[-12])/1000 -> #VALUE! | W63: =RC[-2]*RC[-10]/1000 -> #VALUE! | X63: =ABS((RC[-3]*RC[-11]-RC[-2]*RC[-9])/1000) -> #VALUE! | Y63: =RC[-14]/RC[-18]*100 -> #VALUE! | AC63: =VALUE(RC[-27]) -> #VALUE! | AD63: =IF(RC[21]=42,"*",IF(RC[21]=32,"",RC[21])) ->  | AE63: =RC[-28] ->  | AF63: =RC[-28] ->  | AG63: =RC[-28] ->  | AH63: =RC[-28] -> 0 | AI63: =RC[-28] ->  | AJ63: =RC[-28] ->  | AK63: =RC[-28] -> 0 | AL63: =RC[-28] -> 0 | AM63: =RC[-28] ->  | AN63: =RC[-28] -> 0 | AO63: =RC[-28] -> 0 | AP63: - | AQ63: =RC[-29] -> 0 | AR63: =RC[-29] -> 0 | AS63: - | AT63: =RC[-30] -> 0 | AU63: =RC[-30] -> 0 | AV63: =RC[-30] -> 0 | AW63: =RC[-30] -> 
A64: =IF(RC[1]="","",DATEVALUE(RC[1])) ->  | T64: =(RC[-16]*RC[-15]-RC[-13]*RC[-12])/1000 -> #VALUE! | W64: =RC[-2]*RC[-10]/1000 -> #VALUE! | X64: =ABS((RC[-3]*RC[-11]-RC[-2]*RC[-9])/1000) -> #VALUE! | Y64: =RC[-14]/RC[-18]*100 -> #VALUE! | AC64: =VALUE(RC[-27]) -> #VALUE! | AD64: =IF(RC[21]=42,"*",IF(RC[21]=32,"",RC[21])) ->  | AE64: =RC[-28] ->  | AF64: =RC[-28] ->  | AG64: =RC[-28] ->  | AH64: =RC[-28] -> 0 | AI64: =RC[-28] ->  | AJ64: =RC[-28] ->  | AK64: =RC[-28] -> 0 | AL64: =RC[-28] -> 0 | AM64: =RC[-28] ->  | AN64: =RC[-28] -> 0 | AO64: =RC[-28] -> 0 | AP64: - | AQ64: =RC[-29] -> 0 | AR64: =RC[-29] -> 0 | AS64: - | AT64: =RC[-30] -> 0 | AU64: =RC[-30] -> 0 | AV64: =RC[-30] -> 0 | AW64: =RC[-30] -> 
A65: =IF(RC[1]="","",DATEVALUE(RC[1])) ->  | T65: =(RC[-16]*RC[-15]-RC[-13]*RC[-12])/1000 -> #VALUE! | W65: =RC[-2]*RC[-10]/1000 -> #VALUE! | X65: =ABS((RC[-3]*RC[-11]-RC[-2]*RC[-9])/1000) -> #VALUE! | Y65: =RC[-14]/RC[-18]*100 -> #VALUE! | AC65: =VALUE(RC[-27]) -> #VALUE! | AD65: =IF(RC[21]=42,"*",IF(RC[21]=32,"",RC[21])) ->  | AE65: =RC[-28] ->  | AF65: =RC[-28] ->  | AG65: =RC[-28] ->  | AH65: =RC[-28] -> 0 | AI65: =RC[-28] ->  | AJ65: =RC[-28] ->  | AK65: =RC[-28] -> 0 | AL65: =RC[-28] -> 0 | AM65: =RC[-28] ->  | AN65: =RC[-28] -> 0 | AO65: =RC[-28] -> 0 | AP65: - | AQ65: =RC[-29] -> 0 | AR65: =RC[-29] -> 0 | AS65: - | AT65: =RC[-30] -> 0 | AU65: =RC[-30] -> 0 | AV65: =RC[-30] -> 0 | AW65: =RC[-30] -> 
A66: =IF(RC[1]="","",DATEVALUE(RC[1])) ->  | T66: =(RC[-16]*RC[-15]-RC[-13]*RC[-12])/1000 -> #VALUE! | W66: =RC[-2]*RC[-10]/1000 -> #VALUE! | X66: =ABS((RC[-3]*RC[-11]-RC[-2]*RC[-9])/1000) -> #VALUE! | Y66: =RC[-14]/RC[-18]*100 -> #VALUE! | AC66: =VALUE(RC[-27]) -> #VALUE! | AD66: =IF(RC[21]=42,"*",IF(RC[21]=32,"",RC[21])) ->  | AE66: =RC[-28] ->  | AF66: =RC[-28] ->  | AG66: =RC[-28] ->  | AH66: =RC[-28] -> 0 | AI66: =RC[-28] ->  | AJ66: =RC[-28] ->  | AK66: =RC[-28] -> 0 | AL66: =RC[-28] -> 0 | AM66: =RC[-28] ->  | AN66: =RC[-28] -> 0 | AO66: =RC[-28] -> 0 | AP66: - | AQ66: =RC[-29] -> 0 | AR66: =RC[-29] -> 0 | AS66: - | AT66: =RC[-30] -> 0 | AU66: =RC[-30] -> 0 | AV66: =RC[-30] -> 0 | AW66: =RC[-30] -> 
A67: =IF(RC[1]="","",DATEVALUE(RC[1])) ->  | T67: =(RC[-16]*RC[-15]-RC[-13]*RC[-12])/1000 -> #VALUE! | W67: =RC[-2]*RC[-10]/1000 -> #VALUE! | X67: =ABS((RC[-3]*RC[-11]-RC[-2]*RC[-9])/1000) -> #VALUE! | Y67: =RC[-14]/RC[-18]*100 -> #VALUE! | AC67: =VALUE(RC[-27]) -> #VALUE! | AD67: =IF(RC[21]=42,"*",IF(RC[21]=32,"",RC[21])) ->  | AE67: =RC[-28] ->  | AF67: =RC[-28] ->  | AG67: =RC[-28] ->  | AH67: =RC[-28] -> 0 | AI67: =RC[-28] ->  | AJ67: =RC[-28] ->  | AK67: =RC[-28] -> 0 | AL67: =RC[-28] -> 0 | AM67: =RC[-28] ->  | AN67: =RC[-28] -> 0 | AO67: =RC[-28] -> 0 | AP67: - | AQ67: =RC[-29] -> 0 | AR67: =RC[-29] -> 0 | AS67: - | AT67: =RC[-30] -> 0 | AU67: =RC[-30] -> 0 | AV67: =RC[-30] -> 0 | AW67: =RC[-30] -> 
A68: =IF(RC[1]="","",DATEVALUE(RC[1])) ->  | T68: =(RC[-16]*RC[-15]-RC[-13]*RC[-12])/1000 -> #VALUE! | W68: =RC[-2]*RC[-10]/1000 -> #VALUE! | X68: =ABS((RC[-3]*RC[-11]-RC[-2]*RC[-9])/1000) -> #VALUE! | Y68: =RC[-14]/RC[-18]*100 -> #VALUE! | AC68: =VALUE(RC[-27]) -> #VALUE! | AD68: =IF(RC[21]=42,"*",IF(RC[21]=32,"",RC[21])) ->  | AE68: =RC[-28] ->  | AF68: =RC[-28] ->  | AG68: =RC[-28] ->  | AH68: =RC[-28] -> 0 | AI68: =RC[-28] ->  | AJ68: =RC[-28] ->  | AK68: =RC[-28] -> 0 | AL68: =RC[-28] -> 0 | AM68: =RC[-28] ->  | AN68: =RC[-28] -> 0 | AO68: =RC[-28] -> 0 | AP68: - | AQ68: =RC[-29] -> 0 | AR68: =RC[-29] -> 0 | AS68: - | AT68: =RC[-30] -> 0 | AU68: =RC[-30] -> 0 | AV68: =RC[-30] -> 0 | AW68: =RC[-30] -> 
A69: =IF(RC[1]="","",DATEVALUE(RC[1])) ->  | T69: =(RC[-16]*RC[-15]-RC[-13]*RC[-12])/1000 -> #VALUE! | W69: =RC[-2]*RC[-10]/1000 -> #VALUE! | X69: =ABS((RC[-3]*RC[-11]-RC[-2]*RC[-9])/1000) -> #VALUE! | Y69: =RC[-14]/RC[-18]*100 -> #VALUE! | AC69: =VALUE(RC[-27]) -> #VALUE! | AD69: =IF(RC[21]=42,"*",IF(RC[21]=32,"",RC[21])) ->  | AE69: =RC[-28] ->  | AF69: =RC[-28] ->  | AG69: =RC[-28] ->  | AH69: =RC[-28] -> 0 | AI69: =RC[-28] ->  | AJ69: =RC[-28] ->  | AK69: =RC[-28] -> 0 | AL69: =RC[-28] -> 0 | AM69: =RC[-28] ->  | AN69: =RC[-28] -> 0 | AO69: =RC[-28] -> 0 | AP69: - | AQ69: =RC[-29] -> 0 | AR69: =RC[-29] -> 0 | AS69: - | AT69: =RC[-30] -> 0 | AU69: =RC[-30] -> 0 | AV69: =RC[-30] -> 0 | AW69: =RC[-30] -> 
A70: =IF(RC[1]="","",DATEVALUE(RC[1])) ->  | T70: =(RC[-16]*RC[-15]-RC[-13]*RC[-12])/1000 -> #VALUE! | W70: =RC[-2]*RC[-10]/1000 -> #VALUE! | X70: =ABS((RC[-3]*RC[-11]-RC[-2]*RC[-9])/1000) -> #VALUE! | Y70: =RC[-14]/RC[-18]*100 -> #VALUE! | AC70: =VALUE(RC[-27]) -> #VALUE! | AD70: =IF(RC[21]=42,"*",IF(RC[21]=32,"",RC[21])) ->  | AE70: =RC[-28] ->  | AF70: =RC[-28] ->  | AG70: =RC[-28] ->  | AH70: =RC[-28] -> 0 | AI70: =RC[-28] ->  | AJ70: =RC[-28] ->  | AK70: =RC[-28] -> 0 | AL70: =RC[-28] -> 0 | AM70: =RC[-28] ->  | AN70: =RC[-28] -> 0 | AO70: =RC[-28] -> 0 | AP70: - | AQ70: =RC[-29] -> 0 | AR70: =RC[-29] -> 0 | AS70: - | AT70: =RC[-30] -> 0 | AU70: =RC[-30] -> 0 | AV70: =RC[-30] -> 0 | AW70: =RC[-30] -> 
A71: =IF(RC[1]="","",DATEVALUE(RC[1])) ->  | T71: =(RC[-16]*RC[-15]-RC[-13]*RC[-12])/1000 -> #VALUE! | W71: =RC[-2]*RC[-10]/1000 -> #VALUE! | X71: =ABS((RC[-3]*RC[-11]-RC[-2]*RC[-9])/1000) -> #VALUE! | Y71: =RC[-14]/RC[-18]*100 -> #VALUE! | AC71: =VALUE(RC[-27]) -> #VALUE! | AD71: =IF(RC[21]=42,"*",IF(RC[21]=32,"",RC[21])) ->  | AE71: =RC[-28] ->  | AF71: =RC[-28] ->  | AG71: =RC[-28] ->  | AH71: =RC[-28] -> 0 | AI71: =RC[-28] ->  | AJ71: =RC[-28] ->  | AK71: =RC[-28] -> 0 | AL71: =RC[-28] -> 0 | AM71: =RC[-28] ->  | AN71: =RC[-28] -> 0 | AO71: =RC[-28] -> 0 | AP71: - | AQ71: =RC[-29] -> 0 | AR71: =RC[-29] -> 0 | AS71: - | AT71: =RC[-30] -> 0 | AU71: =RC[-30] -> 0 | AV71: =RC[-30] -> 0 | AW71: =RC[-30] -> 
A72: =IF(RC[1]="","",DATEVALUE(RC[1])) ->  | T72: =(RC[-16]*RC[-15]-RC[-13]*RC[-12])/1000 -> #VALUE! | W72: =RC[-2]*RC[-10]/1000 -> #VALUE! | X72: =ABS((RC[-3]*RC[-11]-RC[-2]*RC[-9])/1000) -> #VALUE! | Y72: =RC[-14]/RC[-18]*100 -> #VALUE! | AC72: =VALUE(RC[-27]) -> #VALUE! | AD72: =IF(RC[21]=42,"*",IF(RC[21]=32,"",RC[21])) ->  | AE72: =RC[-28] ->  | AF72: =RC[-28] ->  | AG72: =RC[-28] ->  | AH72: =RC[-28] -> 0 | AI72: =RC[-28] ->  | AJ72: =RC[-28] ->  | AK72: =RC[-28] -> 0 | AL72: =RC[-28] -> 0 | AM72: =RC[-28] ->  | AN72: =RC[-28] -> 0 | AO72: =RC[-28] -> 0 | AP72: - | AQ72: =RC[-29] -> 0 | AR72: =RC[-29] -> 0 | AS72: - | AT72: =RC[-30] -> 0 | AU72: =RC[-30] -> 0 | AV72: =RC[-30] -> 0 | AW72: =RC[-30] -> 
A73: =IF(RC[1]="","",DATEVALUE(RC[1])) ->  | T73: =(RC[-16]*RC[-15]-RC[-13]*RC[-12])/1000 -> #VALUE! | W73: =RC[-2]*RC[-10]/1000 -> #VALUE! | X73: =ABS((RC[-3]*RC[-11]-RC[-2]*RC[-9])/1000) -> #VALUE! | Y73: =RC[-14]/RC[-18]*100 -> #VALUE! | AC73: =VALUE(RC[-27]) -> #VALUE! | AD73: =IF(RC[21]=42,"*",IF(RC[21]=32,"",RC[21])) ->  | AE73: =RC[-28] ->  | AF73: =RC[-28] ->  | AG73: =RC[-28] ->  | AH73: =RC[-28] -> 0 | AI73: =RC[-28] ->  | AJ73: =RC[-28] ->  | AK73: =RC[-28] -> 0 | AL73: =RC[-28] -> 0 | AM73: =RC[-28] ->  | AN73: =RC[-28] -> 0 | AO73: =RC[-28] -> 0 | AP73: - | AQ73: =RC[-29] -> 0 | AR73: =RC[-29] -> 0 | AS73: - | AT73: =RC[-30] -> 0 | AU73: =RC[-30] -> 0 | AV73: =RC[-30] -> 0 | AW73: =RC[-30] -> 
A74: =IF(RC[1]="","",DATEVALUE(RC[1])) ->  | T74: =(RC[-16]*RC[-15]-RC[-13]*RC[-12])/1000 -> #VALUE! | W74: =RC[-2]*RC[-10]/1000 -> #VALUE! | X74: =ABS((RC[-3]*RC[-11]-RC[-2]*RC[-9])/1000) -> #VALUE! | Y74: =RC[-14]/RC[-18]*100 -> #VALUE! | AC74: =VALUE(RC[-27]) -> #VALUE! | AD74: =IF(RC[21]=42,"*",IF(RC[21]=32,"",RC[21])) ->  | AE74: =RC[-28] ->  | AF74: =RC[-28] ->  | AG74: =RC[-28] ->  | AH74: =RC[-28] -> 0 | AI74: =RC[-28] ->  | AJ74: =RC[-28] ->  | AK74: =RC[-28] -> 0 | AL74: =RC[-28] -> 0 | AM74: =RC[-28] ->  | AN74: =RC[-28] -> 0 | AO74: =RC[-28] -> 0 | AP74: - | AQ74: =RC[-29] -> 0 | AR74: =RC[-29] -> 0 | AS74: - | AT74: =RC[-30] -> 0 | AU74: =RC[-30] -> 0 | AV74: =RC[-30] -> 0 | AW74: =RC[-30] -> 
A75: =IF(RC[1]="","",DATEVALUE(RC[1])) ->  | T75: =(RC[-16]*RC[-15]-RC[-13]*RC[-12])/1000 -> #VALUE! | W75: =RC[-2]*RC[-10]/1000 -> #VALUE! | X75: =ABS((RC[-3]*RC[-11]-RC[-2]*RC[-9])/1000) -> #VALUE! | Y75: =RC[-14]/RC[-18]*100 -> #VALUE! | AC75: =VALUE(RC[-27]) -> #VALUE! | AD75: =IF(RC[21]=42,"*",IF(RC[21]=32,"",RC[21])) ->  | AE75: =RC[-28] ->  | AF75: =RC[-28] ->  | AG75: =RC[-28] ->  | AH75: =RC[-28] -> 0 | AI75: =RC[-28] ->  | AJ75: =RC[-28] ->  | AK75: =RC[-28] -> 0 | AL75: =RC[-28] -> 0 | AM75: =RC[-28] ->  | AN75: =RC[-28] -> 0 | AO75: =RC[-28] -> 0 | AP75: - | AQ75: =RC[-29] -> 0 | AR75: =RC[-29] -> 0 | AS75: - | AT75: =RC[-30] -> 0 | AU75: =RC[-30] -> 0 | AV75: =RC[-30] -> 0 | AW75: =RC[-30] -> 
A76: =IF(RC[1]="","",DATEVALUE(RC[1])) ->  | T76: =(RC[-16]*RC[-15]-RC[-13]*RC[-12])/1000 -> #VALUE! | W76: =RC[-2]*RC[-10]/1000 -> #VALUE! | X76: =ABS((RC[-3]*RC[-11]-RC[-2]*RC[-9])/1000) -> #VALUE! | Y76: =RC[-14]/RC[-18]*100 -> #VALUE! | AC76: =VALUE(RC[-27]) -> #VALUE! | AD76: =IF(RC[21]=42,"*",IF(RC[21]=32,"",RC[21])) ->  | AE76: =RC[-28] ->  | AF76: =RC[-28] ->  | AG76: =RC[-28] ->  | AH76: =RC[-28] -> 0 | AI76: =RC[-28] ->  | AJ76: =RC[-28] ->  | AK76: =RC[-28] -> 0 | AL76: =RC[-28] -> 0 | AM76: =RC[-28] ->  | AN76: =RC[-28] -> 0 | AO76: =RC[-28] -> 0 | AP76: - | AQ76: =RC[-29] -> 0 | AR76: =RC[-29] -> 0 | AS76: - | AT76: =RC[-30] -> 0 | AU76: =RC[-30] -> 0 | AV76: =RC[-30] -> 0 | AW76: =RC[-30] -> 
A77: =IF(RC[1]="","",DATEVALUE(RC[1])) ->  | T77: =(RC[-16]*RC[-15]-RC[-13]*RC[-12])/1000 -> #VALUE! | W77: =RC[-2]*RC[-10]/1000 -> #VALUE! | X77: =ABS((RC[-3]*RC[-11]-RC[-2]*RC[-9])/1000) -> #VALUE! | Y77: =RC[-14]/RC[-18]*100 -> #VALUE! | AC77: =VALUE(RC[-27]) -> #VALUE! | AD77: =IF(RC[21]=42,"*",IF(RC[21]=32,"",RC[21])) ->  | AE77: =RC[-28] ->  | AF77: =RC[-28] ->  | AG77: =RC[-28] ->  | AH77: =RC[-28] -> 0 | AI77: =RC[-28] ->  | AJ77: =RC[-28] ->  | AK77: =RC[-28] -> 0 | AL77: =RC[-28] -> 0 | AM77: =RC[-28] ->  | AN77: =RC[-28] -> 0 | AO77: =RC[-28] -> 0 | AP77: - | AQ77: =RC[-29] -> 0 | AR77: =RC[-29] -> 0 | AS77: - | AT77: =RC[-30] -> 0 | AU77: =RC[-30] -> 0 | AV77: =RC[-30] -> 0 | AW77: =RC[-30] -> 
A78: =IF(RC[1]="","",DATEVALUE(RC[1])) ->  | T78: =(RC[-16]*RC[-15]-RC[-13]*RC[-12])/1000 -> #VALUE! | W78: =RC[-2]*RC[-10]/1000 -> #VALUE! | X78: =ABS((RC[-3]*RC[-11]-RC[-2]*RC[-9])/1000) -> #VALUE! | Y78: =RC[-14]/RC[-18]*100 -> #VALUE! | AC78: =VALUE(RC[-27]) -> #VALUE! | AD78: =IF(RC[21]=42,"*",IF(RC[21]=32,"",RC[21])) ->  | AE78: =RC[-28] ->  | AF78: =RC[-28] ->  | AG78: =RC[-28] ->  | AH78: =RC[-28] -> 0 | AI78: =RC[-28] ->  | AJ78: =RC[-28] ->  | AK78: =RC[-28] -> 0 | AL78: =RC[-28] -> 0 | AM78: =RC[-28] ->  | AN78: =RC[-28] -> 0 | AO78: =RC[-28] -> 0 | AP78: - | AQ78: =RC[-29] -> 0 | AR78: =RC[-29] -> 0 | AS78: - | AT78: =RC[-30] -> 0 | AU78: =RC[-30] -> 0 | AV78: =RC[-30] -> 0 | AW78: =RC[-30] -> 
A79: =IF(RC[1]="","",DATEVALUE(RC[1])) ->  | T79: =(RC[-16]*RC[-15]-RC[-13]*RC[-12])/1000 -> #VALUE! | W79: =RC[-2]*RC[-10]/1000 -> #VALUE! | X79: =ABS((RC[-3]*RC[-11]-RC[-2]*RC[-9])/1000) -> #VALUE! | Y79: =RC[-14]/RC[-18]*100 -> #VALUE! | AC79: =VALUE(RC[-27]) -> #VALUE! | AD79: =IF(RC[21]=42,"*",IF(RC[21]=32,"",RC[21])) ->  | AE79: =RC[-28] ->  | AF79: =RC[-28] ->  | AG79: =RC[-28] ->  | AH79: =RC[-28] -> 0 | AI79: =RC[-28] ->  | AJ79: =RC[-28] ->  | AK79: =RC[-28] -> 0 | AL79: =RC[-28] -> 0 | AM79: =RC[-28] ->  | AN79: =RC[-28] -> 0 | AO79: =RC[-28] -> 0 | AP79: - | AQ79: =RC[-29] -> 0 | AR79: =RC[-29] -> 0 | AS79: - | AT79: =RC[-30] -> 0 | AU79: =RC[-30] -> 0 | AV79: =RC[-30] -> 0 | AW79: =RC[-30] -> 
A80: =IF(RC[1]="","",DATEVALUE(RC[1])) ->  | T80: =(RC[-16]*RC[-15]-RC[-13]*RC[-12])/1000 -> #VALUE! | W80: =RC[-2]*RC[-10]/1000 -> #VALUE! | X80: =ABS((RC[-3]*RC[-11]-RC[-2]*RC[-9])/1000) -> #VALUE! | Y80: =RC[-14]/RC[-18]*100 -> #VALUE! | AC80: =VALUE(RC[-27]) -> #VALUE! | AD80: =IF(RC[21]=42,"*",IF(RC[21]=32,"",RC[21])) ->  | AE80: =RC[-28] ->  | AF80: =RC[-28] ->  | AG80: =RC[-28] ->  | AH80: =RC[-28] -> 0 | AI80: =RC[-28] ->  | AJ80: =RC[-28] ->  | AK80: =RC[-28] -> 0 | AL80: =RC[-28] -> 0 | AM80: =RC[-28] ->  | AN80: =RC[-28] -> 0 | AO80: =RC[-28] -> 0 | AP80: - | AQ80: =RC[-29] -> 0 | AR80: =RC[-29] -> 0 | AS80: - | AT80: =RC[-30] -> 0 | AU80: =RC[-30] -> 0 | AV80: =RC[-30] -> 0 | AW80: =RC[-30] -> 
A81: =IF(RC[1]="","",DATEVALUE(RC[1])) ->  | T81: =(RC[-16]*RC[-15]-RC[-13]*RC[-12])/1000 -> #VALUE! | W81: =RC[-2]*RC[-10]/1000 -> #VALUE! | X81: =ABS((RC[-3]*RC[-11]-RC[-2]*RC[-9])/1000) -> #VALUE! | Y81: =RC[-14]/RC[-18]*100 -> #VALUE! | AC81: =VALUE(RC[-27]) -> #VALUE! | AD81: =IF(RC[21]=42,"*",IF(RC[21]=32,"",RC[21])) ->  | AE81: =RC[-28] ->  | AF81: =RC[-28] ->  | AG81: =RC[-28] ->  | AH81: =RC[-28] -> 0 | AI81: =RC[-28] ->  | AJ81: =RC[-28] ->  | AK81: =RC[-28] -> 0 | AL81: =RC[-28] -> 0 | AM81: =RC[-28] ->  | AN81: =RC[-28] -> 0 | AO81: =RC[-28] -> 0 | AP81: - | AQ81: =RC[-29] -> 0 | AR81: =RC[-29] -> 0 | AS81: - | AT81: =RC[-30] -> 0 | AU81: =RC[-30] -> 0 | AV81: =RC[-30] -> 0 | AW81: =RC[-30] -> 
A82: =IF(RC[1]="","",DATEVALUE(RC[1])) ->  | T82: =(RC[-16]*RC[-15]-RC[-13]*RC[-12])/1000 -> #VALUE! | W82: =RC[-2]*RC[-10]/1000 -> #VALUE! | X82: =ABS((RC[-3]*RC[-11]-RC[-2]*RC[-9])/1000) -> #VALUE! | Y82: =RC[-14]/RC[-18]*100 -> #VALUE! | AC82: =VALUE(RC[-27]) -> #VALUE! | AD82: =IF(RC[21]=42,"*",IF(RC[21]=32,"",RC[21])) ->  | AE82: =RC[-28] ->  | AF82: =RC[-28] ->  | AG82: =RC[-28] ->  | AH82: =RC[-28] -> 0 | AI82: =RC[-28] ->  | AJ82: =RC[-28] ->  | AK82: =RC[-28] -> 0 | AL82: =RC[-28] -> 0 | AM82: =RC[-28] ->  | AN82: =RC[-28] -> 0 | AO82: =RC[-28] -> 0 | AP82: - | AQ82: =RC[-29] -> 0 | AR82: =RC[-29] -> 0 | AS82: - | AT82: =RC[-30] -> 0 | AU82: =RC[-30] -> 0 | AV82: =RC[-30] -> 0 | AW82: =RC[-30] -> 
A83: =IF(RC[1]="","",DATEVALUE(RC[1])) ->  | T83: =(RC[-16]*RC[-15]-RC[-13]*RC[-12])/1000 -> #VALUE! | W83: =RC[-2]*RC[-10]/1000 -> #VALUE! | X83: =ABS((RC[-3]*RC[-11]-RC[-2]*RC[-9])/1000) -> #VALUE! | Y83: =RC[-14]/RC[-18]*100 -> #VALUE! | AC83: =VALUE(RC[-27]) -> #VALUE! | AD83: =IF(RC[21]=42,"*",IF(RC[21]=32,"",RC[21])) ->  | AE83: =RC[-28] ->  | AF83: =RC[-28] ->  | AG83: =RC[-28] ->  | AH83: =RC[-28] -> 0 | AI83: =RC[-28] ->  | AJ83: =RC[-28] ->  | AK83: =RC[-28] -> 0 | AL83: =RC[-28] -> 0 | AM83: =RC[-28] ->  | AN83: =RC[-28] -> 0 | AO83: =RC[-28] -> 0 | AP83: - | AQ83: =RC[-29] -> 0 | AR83: =RC[-29] -> 0 | AS83: - | AT83: =RC[-30] -> 0 | AU83: =RC[-30] -> 0 | AV83: =RC[-30] -> 0 | AW83: =RC[-30] -> 
AC84: Среднее | AF84: =R[1]C[-28] -> 265.85839030000005 | AG84: =R[1]C[-28] -> 68.601148733333332 | AH84: =R[1]C[-28] -> 0 | AI84: =R[1]C[-28] -> 262.73538259999998 | AJ84: =R[1]C[-28] -> 48.942816400000012 | AK84: =R[1]C[-28] -> 0 | AL84: =R[1]C[-28] -> 19.658332333333338 | AM84: =R[1]C[-28] -> 3.1253948666666664 | AN84: =R[1]C[-28] -> 0 | AO84: =R[1]C[-28] -> 0 | AP84: - | AQ84: =R[1]C[-29] -> 0 | AR84: =R[1]C[-29] -> 0 | AS84: - | AT84: =R[1]C[-30] -> 0 | AU84: =R[1]C[-30] -> 0
B85: Среднее | D85: =AVERAGE(OFFSET(R[-74]C,3,0,R7C1,1)) -> 265.85839030000005 | E85: =AVERAGE(OFFSET(R[-74]C,3,0,R7C1,1)) -> 68.601148733333332 | G85: =AVERAGE(OFFSET(R[-74]C,3,0,R7C1,1)) -> 262.73538259999998 | H85: =AVERAGE(OFFSET(R[-74]C,3,0,R7C1,1)) -> 48.942816400000012 | J85: =AVERAGE(OFFSET(R[-74]C,3,0,R7C1,1)) -> 19.658332333333338 | K85: =AVERAGE(OFFSET(R[-74]C,3,0,R7C1,1)) -> 3.1253948666666664 | S85: =AVERAGE(OFFSET(R[-74]C,3,0,R7C1,1)) -> 5.5576237333333331 | T85: =AVERAGE(OFFSET(R[-74]C,3,0,R7C1,1)) -> 5.5475259820947809 | W85: =AVERAGE(OFFSET(R[-74]C,3,0,R7C1,1)) -> #VALUE! | X85: =AVERAGE(OFFSET(R[-74]C,3,0,R7C1,1)) -> #VALUE! | AC85: Итого | AE85: =R[1]C[-28] -> 720 | AF85: =R[1]C[-28] -> 7975.7517090000019 | AI85: =R[1]C[-28] -> 7882.0614779999996 | AM85: =R[1]C[-28] -> 93.761845999999991 | AN85: =R[1]C[-28] -> 0 | AQ85: =R[1]C[-29] -> 0 | AU85: =R[1]C[-30] -> 0 | AV85: =R[1]C[-30] -> 0 | AW85: =R[1]C[-30] -> 166.728712
B86: ИТОГО: | C86: =SUM(OFFSET(R[-75]C,3,0,R7C1,1)) -> 720 | D86: =SUM(OFFSET(R[-75]C,3,0,R7C1,1)) -> 7975.7517090000019 | G86: =SUM(OFFSET(R[-75]C,3,0,R7C1,1)) -> 7882.0614779999996 | K86: =SUM(OFFSET(R[-75]C,3,0,R7C1,1)) -> 93.761845999999991 | S86: =SUM(OFFSET(R[-75]C,3,0,R7C1,1)) -> 166.728712 | T86: =SUM(OFFSET(R[-75]C,3,0,R7C1,1)) -> 166.42577946284342 | W86: =SUM(OFFSET(R[-75]C,3,0,R7C1,1)) -> #VALUE! | X86: =SUM(OFFSET(R[-75]C,3,0,R7C1,1)) -> #VALUE!
AC87: Досчёт | AF87: =R[1]C[-28] -> 0 | AI87: =R[1]C[-28] -> 0 | AM87: =R[1]C[-28] -> 0 | AN87: =R[1]C[-28] -> 0 | AQ87: =R[1]C[-29] -> 0 | AU87: =R[1]C[-30] -> 0 | AV87: =R[1]C[-30] -> 0 | AW87: =R[1]C[-30] -> 0
A88: 11дн=264ч 4дн=96ч | B88: Досчёт до конца м-ца (+) | C88: =R6C1*24 -> 216 | T88: № 65140 | AC88: Снятие | AF88: =-R[1]C[-28] -> 0 | AI88: =-R[1]C[-28] -> 0 | AM88: =-R[1]C[-28] -> 0 | AN88: =-R[1]C[-28] -> 0 | AQ88: =-R[1]C[-29] -> 0 | AU88: =-R[1]C[-30] -> 0 | AV88: =-R[1]C[-30] -> 0 | AW88: =-R[1]C[-30] -> 0
A89: 9дн=216ч 7дн=168ч | B89: Вычет с предыдущего (-) | C89: =R4C1*24 -> 192 | AC89: Сумма | AF89: =R[1]C[-28] -> 7975.7517090000019 | AI89: =R[1]C[-28] -> 7882.0614779999996 | AM89: =R[1]C[-28] -> 93.761845999999991 | AN89: =R[1]C[-28] -> 0 | AQ89: =R[1]C[-29] -> 0 | AU89: =R[1]C[-30] -> 0 | AV89: =R[1]C[-30] -> 0 | AW89: =R[1]C[-30] -> 166.728712
B90: СУММА: | C90: =R[-4]C+R[-2]C-R[-1]C -> 744 | D90: =R[-4]C+R[-2]C-R[-1]C -> 7975.7517090000019 | G90: =R[-4]C+R[-2]C-R[-1]C -> 7882.0614779999996 | K90: =R[-4]C+R[-2]C-R[-1]C -> 93.761845999999991 | S90: =R[-4]C+R[-2]C-R[-1]C -> 166.728712
AC91: Тхв на источнике | AE91: V гвс (м3) | AF91: =R[-2]C[15] -> 0 | AG91: W гвс (Гкал) | AH91: =RC[-2]*0.06 -> 0 | AI91: W без гвс (Гкал) | AJ91: =R[-2]C[13]-RC[-2] -> 166.728712
B92: Показания счетчиков на момент снятия данных:
B93: Дата, время | D93: М1, т | F93: М2, т | H93: М3, т | J93: М4, т | L93: Qо, Гкал | N93: Qг, Гкал | P93: время, час
B94: 23.09.18 00:00 | D94: 67587.125589999996 | F94: 66693.527549999999 | H94: - | J94: - | L94: 2075.9659900000001 | N94: - | P94: 10451.766670000001
B95: 23.10.18 00:00 | D95: 75565.186010000005 | F95: 74577.862970000002 | H95: - | J95: - | L95: 2244.3153400000001 | N95: - | P95: 11171.766670000001
AC97: =ZAYAVKA_N -> з.н д. №02/147-2783 от 04.10.18
B98: Представитель потребителя:_______________________________________________________________________ В.О. Топорков
I101: Рекомендуемые значения по параметрам теплопотребления (не являются официально утверждёнными)
I102: М, т | J102: V, м3 | K102: Qгвс, Гкал | L102: Qотоп, Гкал | M102: Qо, Гкал
I103: =R[-13]C[-3] -> 0 | J103: =RC[-1]/0.98 -> 0 | K103: =RC[-1]*0.06 -> 0 | L103: =RC[1]-RC[-1] -> 0 | M103: =R[-13]C[5] -> 0
O105: ДЛЯ САМОКОНТРОЛЯ
B106: В строке выбора дат указать период с 16.7.13 по 23.8.13 - жильё | N106: Q | O106: Qг
B107: В строке выбора дат указать период с 18.7.13 по 25.8.13 - не жилое | N107: =(R[-21]C[-10]*R[-22]C[-7]-R[-21]C[-9]*R[-22]C[-6])/1000 -> 2095.512176786719 | O107: =IF(R[-22]C[-2]="",R[-21]C[-3]*R[-22]C/1000,"") -> 0 | P107: Си2
O108: =IF(R[-23]C[-2]="","",((R[-22]C[-3]*R[-23]C)-(R[-22]C[-2]*R[-23]C[2]))/1000) ->  | P108: Си3