Sheet: Лист1
G1: Отчёт о теплопотреблении за октябрь 2018 | M1: з.н д. №02/147-2783 от 04.10.18 В данном отчете ГВС суммируется
A4: =EOMONTH(R[9]C,0)-R[9]C -> 8 | B4: Потребитель: ЗАО "Сити Сервис"
A5: =MAX(R[9]C:R[78]C) -> 2018-10-22T00:00:00.000 | B5: Адрес: г. СПб, Наличная ул., д.40 к.5 ИТП 1
A6: =EOMONTH(R[-1]C,0)-R[-1]C -> 9 | B6: Телефон: 8-911-021-19-79
A7: =R[-2]C-R[6]C -> 30 | B7: Договор 10023-2 (.) 22963
A8: 7 | B8: Тепловычислитель: СПТ-943 № 5514 | L8: М2 мах= | M8: 112.56 | O8: Мгвс мах= | P8: 39.84
L9: Qотоп мах= | M9: 9 | O9: Qгвс мах= | P9: 2.4
B10: Расчётная формула: Q=M1*(h1-h2)+(M1-M2)*(h2-hхв)
D12: Учет | L12: Контроль
A13: =R[1]C[1]-1 -> 2018-09-22T00:00:00.000 | B13: Дата | C13: N, ч | D13: M1, т | E13: T1, С | F13: P1, кг/см2 | G13: M2, т | H13: T2, С | I13: P2, кг/см2 | J13: dT, С | K13: M1-М2, т | L13: V3, м3 | M13: T3, С | N13: V4, м3 | O13: =IF(R[-12]C[-14]="м.куб","","T4, С") -> T4, С | P13: dT, С | Q13: V3-V4, м3 | R13: Qгвс, Гкал | S13: Qобщ., Гкал | T13: Q | U13: M3 | V13: M4 | W13: си2 | X13: си3 | Y13: Разб. | Z13: dM2 | AC13: Дата | AD13: НС | AE13: n, ч | AF13: М1, т | AG13: t1, гр. С | AH13: Р1, кгс/см2 | AI13: М2, т | AJ13: t2, гр. С | AK13: Р2, кгс/см2 | AL13: t1-t2, гр. С | AM13: М1-М2, т | AN13: М1гвс, т | AO13: t1гвс, гр. С | AP13: Р1гвс, кгс/см2 | AQ13: М2гвс, т | AR13: t2гвс, гр. С | AS13: Р2гвс, кгс/см2 | AT13: t1гвс-t2гвс | AU13: М1гвс-М2гвс, т | AV13: Wгвс, Гкал | AW13: Wсумм, Гкал | AY13: NS_TV1 | AZ13: НС | BA13: NS_TV2
A14: =IF(RC[1]="","",DATEVALUE(RC[1])) -> 43366 | B14: 23.09.18 | C14: 24 | D14: 12.25943 | E14: 68.254929000000004 | F14: 7.5779420000000002 | G14: 0 | H14: 20.959351000000002 | I14: 4.4000000000000004 | J14: =RC[-5]-RC[-2] -> 47.295578000000006 | K14: 12.25943 | L14: 3.2513109999999998 | M14: 66.963654000000005 | N14: 9.2491869999999992 | O14: 67.180854999999994 | P14: =IF(AND(ISNUMBER(RC[-3]),ISNUMBER(RC[-1])),RC[-3]-RC[-1],"-") -> -0.21720099999998865 | Q14: 12.500498 | R14: 0.82258100000000001 | S14: =RC[-1] -> 0.82258100000000001 | T14: =(RC[-16]*RC[-15]-RC[-13]*RC[-12])/1000 -> 0.83676652423047004 | U14: 3.185333 | V14: 9.0604569999999995 | W14: =RC[-2]*RC[-10]/1000 -> 0.21330153688678199 | X14: =ABS((RC[-3]*RC[-11]-RC[-2]*RC[-9])/1000) -> 0.39538771106395298 | Y14: =(RC[-14]-RC[1])/RC[-18]*100 -> #DIV/0! | Z14: =RC[-5]+RC[-4] -> 12.24579 | AC14: =VALUE(RC[-27]) -> 2018-09-23T00:00:00.000 | AD14: =IF(RC[21]=42,"*",IF(RC[21]=32,"",RC[21])) -> - | AE14: =RC[-28] -> 24 | AF14: =RC[-28] -> 12.25943 | AG14: =RC[-28] -> 68.254929000000004 | AH14: =RC[-28] -> 7.5779420000000002 | AI14: =RC[-28] -> 0 | AJ14: =RC[-28] -> 20.959351000000002 | AK14: =RC[-28] -> 4.4000000000000004 | AL14: =RC[-28] -> 47.295578000000006 | AM14: =RC[-28] -> 12.25943 | AN14: =RC[-28] -> 3.2513109999999998 | AO14: =RC[-28] -> 66.963654000000005 | AP14: - | AQ14: =RC[-29] -> 9.2491869999999992 | AR14: =RC[-29] -> 67.180854999999994 | AS14: - | AT14: =RC[-30] -> -0.21720099999998865 | AU14: =RC[-30] -> 12.500498 | AV14: =RC[-30] -> 0.82258100000000001 | AW14: =RC[-30] -> 0.82258100000000001 | AY14: - | AZ14: - | BA14: -
A15: =IF(RC[1]="","",DATEVALUE(RC[1])) -> 43367 | B15: 24.09.18 | C15: 24 | D15: 11.199318 | E15: 66.915572999999995 | F15: 7.6971619999999996 | G15: 0 | H15: 19.67276 | I15: 4.4000000000000004 | J15: =RC[-5]-RC[-2] -> 47.242812999999998 | K15: 11.199318 | L15: 3.6784889999999999 | M15: 65.727965999999995 | N15: 7.6722219999999997 | O15: 65.650108000000003 | P15: =IF(AND(ISNUMBER(RC[-3]),ISNUMBER(RC[-1])),RC[-3]-RC[-1],"-") -> 7.7857999999991989E-2 | Q15: 11.350711 | R15: 0.73139900000000002 | S15: =RC[-1] -> 0.73139900000000002 | T15: =(RC[-16]*RC[-15]-RC[-13]*RC[-12])/1000 -> 0.74940878117921395 | U15: 3.6063999999999998 | V15: 7.522125 | W15: =RC[-2]*RC[-10]/1000 -> 0.23704133658239995 | X15: =ABS((RC[-3]*RC[-11]-RC[-2]*RC[-9])/1000) -> 0.2567869820571001 | Y15: =(RC[-14]-RC[1])/RC[-18]*100 -> #DIV/0! | Z15: =RC[-5]+RC[-4] -> 11.128525 | AC15: =VALUE(RC[-27]) -> 2018-09-24T00:00:00.000 | AD15: =IF(RC[21]=42,"*",IF(RC[21]=32,"",RC[21])) -> - | AE15: =RC[-28] -> 24 | AF15: =RC[-28] -> 11.199318 | AG15: =RC[-28] -> 66.915572999999995 | AH15: =RC[-28] -> 7.6971619999999996 | AI15: =RC[-28] -> 0 | AJ15: =RC[-28] -> 19.67276 | AK15: =RC[-28] -> 4.4000000000000004 | AL15: =RC[-28] -> 47.242812999999998 | AM15: =RC[-28] -> 11.199318 | AN15: =RC[-28] -> 3.6784889999999999 | AO15: =RC[-28] -> 65.727965999999995 | AP15: - | AQ15: =RC[-29] -> 7.6722219999999997 | AR15: =RC[-29] -> 65.650108000000003 | AS15: - | AT15: =RC[-30] -> 7.7857999999991989E-2 | AU15: =RC[-30] -> 11.350711 | AV15: =RC[-30] -> 0.73139900000000002 | AW15: =RC[-30] -> 0.73139900000000002 | AY15: - | AZ15: - | BA15: -
A16: =IF(RC[1]="","",DATEVALUE(RC[1])) -> 43368 | B16: 25.09.18 | C16: 24 | D16: 27.599019999999999 | E16: 66.573348999999993 | F16: 7.7796279999999998 | G16: 15.654813000000001 | H16: 34.537959999999998 | I16: 5.5354939999999999 | J16: =RC[-5]-RC[-2] -> 32.035388999999995 | K16: 11.944208 | L16: 3.5934330000000001 | M16: 65.343970999999996 | N16: 8.6966769999999993 | O16: 65.278557000000006 | P16: =IF(AND(ISNUMBER(RC[-3]),ISNUMBER(RC[-1])),RC[-3]-RC[-1],"-") -> 6.5413999999989869E-2 | Q16: 12.29011 | R16: 0.78755399999999998 | S16: 1.298108 | T16: =(RC[-16]*RC[-15]-RC[-13]*RC[-12])/1000 -> 1.2966738853164999 | U16: 3.5237579999999999 | V16: 8.5283549999999995 | W16: =RC[-2]*RC[-10]/1000 -> 0.23025634056301797 | X16: =ABS((RC[-3]*RC[-11]-RC[-2]*RC[-9])/1000) -> 0.3264623674207171 | Y16: =(RC[-14]-RC[1])/RC[-18]*100 -> -0.68927683773673187 | Z16: =RC[-5]+RC[-4] -> 12.052112999999999 | AC16: =VALUE(RC[-27]) -> 2018-09-25T00:00:00.000 | AD16: =IF(RC[21]=42,"*",IF(RC[21]=32,"",RC[21])) -> - | AE16: =RC[-28] -> 24 | AF16: =RC[-28] -> 27.599019999999999 | AG16: =RC[-28] -> 66.573348999999993 | AH16: =RC[-28] -> 7.7796279999999998 | AI16: =RC[-28] -> 15.654813000000001 | AJ16: =RC[-28] -> 34.537959999999998 | AK16: =RC[-28] -> 5.5354939999999999 | AL16: =RC[-28] -> 32.035388999999995 | AM16: =RC[-28] -> 11.944208 | AN16: =RC[-28] -> 3.5934330000000001 | AO16: =RC[-28] -> 65.343970999999996 | AP16: - | AQ16: =RC[-29] -> 8.6966769999999993 | AR16: =RC[-29] -> 65.278557000000006 | AS16: - | AT16: =RC[-30] -> 6.5413999999989869E-2 | AU16: =RC[-30] -> 12.29011 | AV16: =RC[-30] -> 0.78755399999999998 | AW16: =RC[-30] -> 1.298108 | AY16: - | AZ16: - | BA16: -
A17: =IF(RC[1]="","",DATEVALUE(RC[1])) -> 43369 | B17: 26.09.18 | C17: 24 | D17: 54.549500000000002 | E17: 67.074814000000003 | F17: 7.6913080000000003 | G17: 42.239902000000001 | H17: 33.979084 | I17: 5.5489050000000004 | J17: =RC[-5]-RC[-2] -> 33.095730000000003 | K17: 12.309599 | L17: 3.4710559999999999 | M17: 65.679848000000007 | N17: 9.2155210000000007 | O17: 65.946678000000006 | P17: =IF(AND(ISNUMBER(RC[-3]),ISNUMBER(RC[-1])),RC[-3]-RC[-1],"-") -> -0.26682999999999879 | Q17: 12.686577 | R17: 0.819886 | S17: 2.2256809999999998 | T17: =(RC[-16]*RC[-15]-RC[-13]*RC[-12])/1000 -> 2.2236243880832323 | U17: 3.4031370000000001 | V17: 9.0338650000000005 | W17: =RC[-2]*RC[-10]/1000 -> 0.22351752088317603 | X17: =ABS((RC[-3]*RC[-11]-RC[-2]*RC[-9])/1000) -> 0.37223586536729403 | Y17: =(RC[-14]-RC[1])/RC[-18]*100 -> -0.30161765053337308 | Z17: =RC[-5]+RC[-4] -> 12.437002 | AC17: =VALUE(RC[-27]) -> 2018-09-26T00:00:00.000 | AD17: =IF(RC[21]=42,"*",IF(RC[21]=32,"",RC[21])) -> - | AE17: =RC[-28] -> 24 | AF17: =RC[-28] -> 54.549500000000002 | AG17: =RC[-28] -> 67.074814000000003 | AH17: =RC[-28] -> 7.6913080000000003 | AI17: =RC[-28] -> 42.239902000000001 | AJ17: =RC[-28] -> 33.979084 | AK17: =RC[-28] -> 5.5489050000000004 | AL17: =RC[-28] -> 33.095730000000003 | AM17: =RC[-28] -> 12.309599 | AN17: =RC[-28] -> 3.4710559999999999 | AO17: =RC[-28] -> 65.679848000000007 | AP17: - | AQ17: =RC[-29] -> 9.2155210000000007 | AR17: =RC[-29] -> 65.946678000000006 | AS17: - | AT17: =RC[-30] -> -0.26682999999999879 | AU17: =RC[-30] -> 12.686577 | AV17: =RC[-30] -> 0.819886 | AW17: =RC[-30] -> 2.2256809999999998 | AY17: - | AZ17: - | BA17: -
A18: =IF(RC[1]="","",DATEVALUE(RC[1])) -> 43370 | B18: 27.09.18 | C18: 24 | D18: 52.394241000000001 | E18: 62.423533999999997 | F18: 7.3503090000000002 | G18: 38.814354000000002 | H18: 30.546468999999998 | I18: 5.5866259999999999 | J18: =RC[-5]-RC[-2] -> 31.877064999999998 | K18: 13.579893 | L18: 4.0355999999999996 | M18: 61.88335 | N18: 9.926755 | O18: 61.787975000000003 | P18: =IF(AND(ISNUMBER(RC[-3]),ISNUMBER(RC[-1])),RC[-3]-RC[-1],"-") -> 9.5374999999997101E-2 | Q18: 13.962355000000001 | R18: 0.84864600000000001 | S18: 2.0863179999999999 | T18: =(RC[-16]*RC[-15]-RC[-13]*RC[-12])/1000 -> 2.084992223251668 | U18: 3.9648569999999999 | V18: 9.7532519999999998 | W18: =RC[-2]*RC[-10]/1000 -> 0.24535863343094999 | X18: =ABS((RC[-3]*RC[-11]-RC[-2]*RC[-9])/1000) -> 0.35727505731375003 | Y18: =(RC[-14]-RC[1])/RC[-18]*100 -> -0.3560950673042243 | Z18: =RC[-5]+RC[-4] -> 13.718109 | AC18: =VALUE(RC[-27]) -> 2018-09-27T00:00:00.000 | AD18: =IF(RC[21]=42,"*",IF(RC[21]=32,"",RC[21])) -> - | AE18: =RC[-28] -> 24 | AF18: =RC[-28] -> 52.394241000000001 | AG18: =RC[-28] -> 62.423533999999997 | AH18: =RC[-28] -> 7.3503090000000002 | AI18: =RC[-28] -> 38.814354000000002 | AJ18: =RC[-28] -> 30.546468999999998 | AK18: =RC[-28] -> 5.5866259999999999 | AL18: =RC[-28] -> 31.877064999999998 | AM18: =RC[-28] -> 13.579893 | AN18: =RC[-28] -> 4.0355999999999996 | AO18: =RC[-28] -> 61.88335 | AP18: - | AQ18: =RC[-29] -> 9.926755 | AR18: =RC[-29] -> 61.787975000000003 | AS18: - | AT18: =RC[-30] -> 9.5374999999997101E-2 | AU18: =RC[-30] -> 13.962355000000001 | AV18: =RC[-30] -> 0.84864600000000001 | AW18: =RC[-30] -> 2.0863179999999999 | AY18: - | AZ18: - | BA18: -
A19: =IF(RC[1]="","",DATEVALUE(RC[1])) -> 43371 | B19: 28.09.18 | C19: 24 | D19: 50.237282 | E19: 66.594291999999996 | F19: 7.5187780000000002 | G19: 38.658923999999999 | H19: 30.961407000000001 | I19: 5.7078239999999996 | J19: =RC[-5]-RC[-2] -> 35.632884999999995 | K19: 11.57836 | L19: 3.5717780000000001 | M19: 65.640433999999999 | N19: 8.2997560000000004 | O19: 65.924460999999994 | P19: =IF(AND(ISNUMBER(RC[-3]),ISNUMBER(RC[-1])),RC[-3]-RC[-1],"-") -> -0.2840269999999947 | Q19: 11.871534 | R19: 0.76682899999999998 | S19: 2.149969 | T19: =(RC[-16]*RC[-15]-RC[-13]*RC[-12])/1000 -> 2.1485815466482756 | U19: 3.50197 | V19: 8.1362629999999996 | W19: =RC[-2]*RC[-10]/1000 -> 0.22987083065498001 | X19: =ABS((RC[-3]*RC[-11]-RC[-2]*RC[-9])/1000) -> 0.30650792217426287 | Y19: =(RC[-14]-RC[1])/RC[-18]*100 -> -0.15487497789643503 | Z19: =RC[-5]+RC[-4] -> 11.638233 | AC19: =VALUE(RC[-27]) -> 2018-09-28T00:00:00.000 | AD19: =IF(RC[21]=42,"*",IF(RC[21]=32,"",RC[21])) -> - | AE19: =RC[-28] -> 24 | AF19: =RC[-28] -> 50.237282 | AG19: =RC[-28] -> 66.594291999999996 | AH19: =RC[-28] -> 7.5187780000000002 | AI19: =RC[-28] -> 38.658923999999999 | AJ19: =RC[-28] -> 30.961407000000001 | AK19: =RC[-28] -> 5.7078239999999996 | AL19: =RC[-28] -> 35.632884999999995 | AM19: =RC[-28] -> 11.57836 | AN19: =RC[-28] -> 3.5717780000000001 | AO19: =RC[-28] -> 65.640433999999999 | AP19: - | AQ19: =RC[-29] -> 8.2997560000000004 | AR19: =RC[-29] -> 65.924460999999994 | AS19: - | AT19: =RC[-30] -> -0.2840269999999947 | AU19: =RC[-30] -> 11.871534 | AV19: =RC[-30] -> 0.76682899999999998 | AW19: =RC[-30] -> 2.149969 | AY19: - | AZ19: - | BA19: -
A20: =IF(RC[1]="","",DATEVALUE(RC[1])) -> 43372 | B20: 29.09.18 | C20: 24 | D20: 59.345256999999997 | E20: 66.780510000000007 | F20: 8.4784649999999999 | G20: 45.302776000000001 | H20: 32.440337999999997 | I20: 6.0218059999999998 | J20: =RC[-5]-RC[-2] -> 34.34017200000001 | K20: 14.042486 | L20: 4.6408779999999998 | M20: 65.996489999999994 | N20: 9.8548770000000001 | O20: 65.949439999999996 | P20: =IF(AND(ISNUMBER(RC[-3]),ISNUMBER(RC[-1])),RC[-3]-RC[-1],"-") -> 4.7049999999998704E-2 | Q20: 14.495755000000001 | R20: 0.93806699999999998 | S20: 2.4960650000000002 | T20: =(RC[-16]*RC[-15]-RC[-13]*RC[-12])/1000 -> 2.4934691627627821 | U20: 4.5492900000000001 | V20: 9.6606389999999998 | W20: =RC[-2]*RC[-10]/1000 -> 0.30023717199209998 | X20: =ABS((RC[-3]*RC[-11]-RC[-2]*RC[-9])/1000) -> 0.3368765601000599 | Y20: =(RC[-14]-RC[1])/RC[-18]*100 -> -0.36960869682687586 | Z20: =RC[-5]+RC[-4] -> 14.209928999999999 | AC20: =VALUE(RC[-27]) -> 2018-09-29T00:00:00.000 | AD20: =IF(RC[21]=42,"*",IF(RC[21]=32,"",RC[21])) -> - | AE20: =RC[-28] -> 24 | AF20: =RC[-28] -> 59.345256999999997 | AG20: =RC[-28] -> 66.780510000000007 | AH20: =RC[-28] -> 8.4784649999999999 | AI20: =RC[-28] -> 45.302776000000001 | AJ20: =RC[-28] -> 32.440337999999997 | AK20: =RC[-28] -> 6.0218059999999998 | AL20: =RC[-28] -> 34.34017200000001 | AM20: =RC[-28] -> 14.042486 | AN20: =RC[-28] -> 4.6408779999999998 | AO20: =RC[-28] -> 65.996489999999994 | AP20: - | AQ20: =RC[-29] -> 9.8548770000000001 | AR20: =RC[-29] -> 65.949439999999996 | AS20: - | AT20: =RC[-30] -> 4.7049999999998704E-2 | AU20: =RC[-30] -> 14.495755000000001 | AV20: =RC[-30] -> 0.93806699999999998 | AW20: =RC[-30] -> 2.4960650000000002 | AY20: - | AZ20: - | BA20: -
A21: =IF(RC[1]="","",DATEVALUE(RC[1])) -> 43373 | B21: 30.09.18 | C21: 24 | D21: 59.512642 | E21: 68.772307999999995 | F21: 8.4860609999999994 | G21: 45.852576999999997 | H21: 33.259300000000003 | I21: 5.9596559999999998 | J21: =RC[-5]-RC[-2] -> 35.513007999999992 | K21: 13.660064 | L21: 3.808789 | M21: 68.137383 | N21: 10.322588 | O21: 68.349022000000005 | P21: =IF(AND(ISNUMBER(RC[-3]),ISNUMBER(RC[-1])),RC[-3]-RC[-1],"-") -> -0.21163900000000524 | Q21: 14.131377000000001 | R21: 0.94548200000000004 | S21: 2.57056 | T21: =(RC[-16]*RC[-15]-RC[-13]*RC[-12])/1000 -> 2.5677971313016354 | U21: 3.7290760000000001 | V21: 10.105309 | W21: =RC[-2]*RC[-10]/1000 -> 0.25408947964810802 | X21: =ABS((RC[-3]*RC[-11]-RC[-2]*RC[-9])/1000) -> 0.43659850750969004 | Y21: =(RC[-14]-RC[1])/RC[-18]*100 -> -0.38017710542201555 | Z21: =RC[-5]+RC[-4] -> 13.834385000000001 | AC21: =VALUE(RC[-27]) -> 2018-09-30T00:00:00.000 | AD21: =IF(RC[21]=42,"*",IF(RC[21]=32,"",RC[21])) -> - | AE21: =RC[-28] -> 24 | AF21: =RC[-28] -> 59.512642 | AG21: =RC[-28] -> 68.772307999999995 | AH21: =RC[-28] -> 8.4860609999999994 | AI21: =RC[-28] -> 45.852576999999997 | AJ21: =RC[-28] -> 33.259300000000003 | AK21: =RC[-28] -> 5.9596559999999998 | AL21: =RC[-28] -> 35.513007999999992 | AM21: =RC[-28] -> 13.660064 | AN21: =RC[-28] -> 3.808789 | AO21: =RC[-28] -> 68.137383 | AP21: - | AQ21: =RC[-29] -> 10.322588 | AR21: =RC[-29] -> 68.349022000000005 | AS21: - | AT21: =RC[-30] -> -0.21163900000000524 | AU21: =RC[-30] -> 14.131377000000001 | AV21: =RC[-30] -> 0.94548200000000004 | AW21: =RC[-30] -> 2.57056 | AY21: - | AZ21: - | BA21: -
A22: =IF(RC[1]="","",DATEVALUE(RC[1])) -> 43374 | B22: 01.10.18 | C22: 24 | D22: 57.460631999999997 | E22: 67.887703000000002 | F22: 8.4795949999999998 | G22: 44.897511000000002 | H22: 33.441986 | I22: 6.0652030000000003 | J22: =RC[-5]-RC[-2] -> 34.445717000000002 | K22: 12.563117999999999 | L22: 3.9465219999999999 | M22: 67.069359000000006 | N22: 9.0120109999999993 | O22: 67.035469000000006 | P22: =IF(AND(ISNUMBER(RC[-3]),ISNUMBER(RC[-1])),RC[-3]-RC[-1],"-") -> 3.3889999999999532E-2 | Q22: 12.958532999999999 | R22: 0.85180800000000001 | S22: 2.401913 | T22: =(RC[-16]*RC[-15]-RC[-13]*RC[-12])/1000 -> 2.39940838511145 | U22: 3.8662899999999998 | V22: 8.8289729999999995 | W22: =RC[-2]*RC[-10]/1000 -> 0.25930959200811005 | X22: =ABS((RC[-3]*RC[-11]-RC[-2]*RC[-9])/1000) -> 0.33254475383522697 | Y22: =(RC[-14]-RC[1])/RC[-18]*100 -> -0.29432589258678399 | Z22: =RC[-5]+RC[-4] -> 12.695262999999999 | AC22: =VALUE(RC[-27]) -> 2018-10-01T00:00:00.000 | AD22: =IF(RC[21]=42,"*",IF(RC[21]=32,"",RC[21])) -> - | AE22: =RC[-28] -> 24 | AF22: =RC[-28] -> 57.460631999999997 | AG22: =RC[-28] -> 67.887703000000002 | AH22: =RC[-28] -> 8.4795949999999998 | AI22: =RC[-28] -> 44.897511000000002 | AJ22: =RC[-28] -> 33.441986 | AK22: =RC[-28] -> 6.0652030000000003 | AL22: =RC[-28] -> 34.445717000000002 | AM22: =RC[-28] -> 12.563117999999999 | AN22: =RC[-28] -> 3.9465219999999999 | AO22: =RC[-28] -> 67.069359000000006 | AP22: - | AQ22: =RC[-29] -> 9.0120109999999993 | AR22: =RC[-29] -> 67.035469000000006 | AS22: - | AT22: =RC[-30] -> 3.3889999999999532E-2 | AU22: =RC[-30] -> 12.958532999999999 | AV22: =RC[-30] -> 0.85180800000000001 | AW22: =RC[-30] -> 2.401913 | AY22: - | AZ22: - | BA22: -
A23: =IF(RC[1]="","",DATEVALUE(RC[1])) -> 43375 | B23: 02.10.18 | C23: 24 | D23: 58.679980999999998 | E23: 66.562636999999995 | F23: 8.450291 | G23: 45.346412999999998 | H23: 33.26173 | I23: 5.9482939999999997 | J23: =RC[-5]-RC[-2] -> 33.300906999999995 | K23: 13.333569000000001 | L23: 3.8133219999999999 | M23: 65.825385999999995 | N23: 9.8068329999999992 | O23: 65.830132000000006 | P23: =IF(AND(ISNUMBER(RC[-3]),ISNUMBER(RC[-1])),RC[-3]-RC[-1],"-") -> -4.7460000000114633E-3 | Q23: 13.620155 | R23: 0.87966200000000005 | S23: 2.4002379999999999 | T23: =(RC[-16]*RC[-15]-RC[-13]*RC[-12])/1000 -> 2.3975941287954066 | U23: 3.7384240000000002 | V23: 9.6142029999999998 | W23: =RC[-2]*RC[-10]/1000 -> 0.24608320283166399 | X23: =ABS((RC[-3]*RC[-11]-RC[-2]*RC[-9])/1000) -> 0.38682104973313203 | Y23: =(RC[-14]-RC[1])/RC[-18]*100 -> -4.2027579998442997E-2 | Z23: =RC[-5]+RC[-4] -> 13.352627 | AC23: =VALUE(RC[-27]) -> 2018-10-02T00:00:00.000 | AD23: =IF(RC[21]=42,"*",IF(RC[21]=32,"",RC[21])) -> - | AE23: =RC[-28] -> 24 | AF23: =RC[-28] -> 58.679980999999998 | AG23: =RC[-28] -> 66.562636999999995 | AH23: =RC[-28] -> 8.450291 | AI23: =RC[-28] -> 45.346412999999998 | AJ23: =RC[-28] -> 33.26173 | AK23: =RC[-28] -> 5.9482939999999997 | AL23: =RC[-28] -> 33.300906999999995 | AM23: =RC[-28] -> 13.333569000000001 | AN23: =RC[-28] -> 3.8133219999999999 | AO23: =RC[-28] -> 65.825385999999995 | AP23: - | AQ23: =RC[-29] -> 9.8068329999999992 | AR23: =RC[-29] -> 65.830132000000006 | AS23: - | AT23: =RC[-30] -> -4.7460000000114633E-3 | AU23: =RC[-30] -> 13.620155 | AV23: =RC[-30] -> 0.87966200000000005 | AW23: =RC[-30] -> 2.4002379999999999 | AY23: - | AZ23: - | BA23: -
A24: =IF(RC[1]="","",DATEVALUE(RC[1])) -> 43376 | B24: 03.10.18 | C24: 24 | D24: 58.809254000000003 | E24: 66.653655999999998 | F24: 8.4419930000000001 | G24: 45.816600999999999 | H24: 33.330745999999998 | I24: 5.9045189999999996 | J24: =RC[-5]-RC[-2] -> 33.32291 | K24: 12.992645 | L24: 3.7464219999999999 | M24: 65.980002999999996 | N24: 9.4614440000000002 | O24: 65.921402 | P24: =IF(AND(ISNUMBER(RC[-3]),ISNUMBER(RC[-1])),RC[-3]-RC[-1],"-") -> 5.8600999999995906E-2 | Q24: 13.207865999999999 | R24: 0.85439699999999996 | S24: 2.3954110000000002 | T24: =(RC[-16]*RC[-15]-RC[-13]*RC[-12])/1000 -> 2.3927502952182786 | U24: 3.6725189999999999 | V24: 9.2751230000000007 | W24: =RC[-2]*RC[-10]/1000 -> 0.24231281463755699 | X24: =ABS((RC[-3]*RC[-11]-RC[-2]*RC[-9])/1000) -> 0.36911629724488904 | Y24: =(RC[-14]-RC[1])/RC[-18]*100 -> 9.8224222263889591E-2 | Z24: =RC[-5]+RC[-4] -> 12.947642 | AC24: =VALUE(RC[-27]) -> 2018-10-03T00:00:00.000 | AD24: =IF(RC[21]=42,"*",IF(RC[21]=32,"",RC[21])) -> - | AE24: =RC[-28] -> 24 | AF24: =RC[-28] -> 58.809254000000003 | AG24: =RC[-28] -> 66.653655999999998 | AH24: =RC[-28] -> 8.4419930000000001 | AI24: =RC[-28] -> 45.816600999999999 | AJ24: =RC[-28] -> 33.330745999999998 | AK24: =RC[-28] -> 5.9045189999999996 | AL24: =RC[-28] -> 33.32291 | AM24: =RC[-28] -> 12.992645 | AN24: =RC[-28] -> 3.7464219999999999 | AO24: =RC[-28] -> 65.980002999999996 | AP24: - | AQ24: =RC[-29] -> 9.4614440000000002 | AR24: =RC[-29] -> 65.921402 | AS24: - | AT24: =RC[-30] -> 5.8600999999995906E-2 | AU24: =RC[-30] -> 13.207865999999999 | AV24: =RC[-30] -> 0.85439699999999996 | AW24: =RC[-30] -> 2.3954110000000002 | AY24: - | AZ24: - | BA24: -
A25: =IF(RC[1]="","",DATEVALUE(RC[1])) -> 43377 | B25: 04.10.18 | C25: 24 | D25: 58.976398000000003 | E25: 66.120232000000001 | F25: 8.4449249999999996 | G25: 45.890335 | H25: 32.811497000000003 | I25: 5.9075879999999996 | J25: =RC[-5]-RC[-2] -> 33.308734999999999 | K25: 13.08606 | L25: 3.9340329999999999 | M25: 65.502540999999994 | N25: 9.3912220000000008 | O25: 65.438132999999993 | P25: =IF(AND(ISNUMBER(RC[-3]),ISNUMBER(RC[-1])),RC[-3]-RC[-1],"-") -> 6.4408000000000243E-2 | Q25: 13.325255 | R25: 0.85593200000000003 | S25: 2.3964189999999999 | T25: =(RC[-16]*RC[-15]-RC[-13]*RC[-12])/1000 -> 2.3938025291028415 | U25: 3.8574549999999999 | V25: 9.2087599999999998 | W25: =RC[-2]*RC[-10]/1000 -> 0.25267310429315498 | X25: =ABS((RC[-3]*RC[-11]-RC[-2]*RC[-9])/1000) -> 0.34993095735192492 | Y25: =(RC[-14]-RC[1])/RC[-18]*100 -> 4.3244399937372682E-2 | Z25: =RC[-5]+RC[-4] -> 13.066215 | AC25: =VALUE(RC[-27]) -> 2018-10-04T00:00:00.000 | AD25: =IF(RC[21]=42,"*",IF(RC[21]=32,"",RC[21])) -> - | AE25: =RC[-28] -> 24 | AF25: =RC[-28] -> 58.976398000000003 | AG25: =RC[-28] -> 66.120232000000001 | AH25: =RC[-28] -> 8.4449249999999996 | AI25: =RC[-28] -> 45.890335 | AJ25: =RC[-28] -> 32.811497000000003 | AK25: =RC[-28] -> 5.9075879999999996 | AL25: =RC[-28] -> 33.308734999999999 | AM25: =RC[-28] -> 13.08606 | AN25: =RC[-28] -> 3.9340329999999999 | AO25: =RC[-28] -> 65.502540999999994 | AP25: - | AQ25: =RC[-29] -> 9.3912220000000008 | AR25: =RC[-29] -> 65.438132999999993 | AS25: - | AT25: =RC[-30] -> 6.4408000000000243E-2 | AU25: =RC[-30] -> 13.325255 | AV25: =RC[-30] -> 0.85593200000000003 | AW25: =RC[-30] -> 2.3964189999999999 | AY25: - | AZ25: - | BA25: -
A26: =IF(RC[1]="","",DATEVALUE(RC[1])) -> 43378 | B26: 05.10.18 | C26: 24 | D26: 61.196353999999999 | E26: 65.485313000000005 | F26: 8.4184380000000001 | G26: 46.827388999999997 | H26: 32.438782000000003 | I26: 5.7943340000000001 | J26: =RC[-5]-RC[-2] -> 33.046531000000002 | K26: 14.368967 | L26: 4.3288440000000001 | M26: 64.864806999999999 | N26: 10.359120000000001 | O26: 64.836478999999997 | P26: =IF(AND(ISNUMBER(RC[-3]),ISNUMBER(RC[-1])),RC[-3]-RC[-1],"-") -> 2.8328000000001907E-2 | Q26: 14.687963999999999 | R26: 0.93496100000000004 | S26: 2.4912299999999998 | T26: =(RC[-16]*RC[-15]-RC[-13]*RC[-12])/1000 -> 2.4884389327486041 | U26: 4.2460880000000003 | V26: 10.161256 | W26: =RC[-2]*RC[-10]/1000 -> 0.27542167862501599 | X26: =ABS((RC[-3]*RC[-11]-RC[-2]*RC[-9])/1000) -> 0.38339838263260795 | Y26: =(RC[-14]-RC[1])/RC[-18]*100 -> -8.1954174297440646E-2 | Z26: =RC[-5]+RC[-4] -> 14.407344 | AC26: =VALUE(RC[-27]) -> 2018-10-05T00:00:00.000 | AD26: =IF(RC[21]=42,"*",IF(RC[21]=32,"",RC[21])) -> - | AE26: =RC[-28] -> 24 | AF26: =RC[-28] -> 61.196353999999999 | AG26: =RC[-28] -> 65.485313000000005 | AH26: =RC[-28] -> 8.4184380000000001 | AI26: =RC[-28] -> 46.827388999999997 | AJ26: =RC[-28] -> 32.438782000000003 | AK26: =RC[-28] -> 5.7943340000000001 | AL26: =RC[-28] -> 33.046531000000002 | AM26: =RC[-28] -> 14.368967 | AN26: =RC[-28] -> 4.3288440000000001 | AO26: =RC[-28] -> 64.864806999999999 | AP26: - | AQ26: =RC[-29] -> 10.359120000000001 | AR26: =RC[-29] -> 64.836478999999997 | AS26: - | AT26: =RC[-30] -> 2.8328000000001907E-2 | AU26: =RC[-30] -> 14.687963999999999 | AV26: =RC[-30] -> 0.93496100000000004 | AW26: =RC[-30] -> 2.4912299999999998 | AY26: - | AZ26: - | BA26: -
A27: =IF(RC[1]="","",DATEVALUE(RC[1])) -> 43379 | B27: 06.10.18 | C27: 24 | D27: 58.093829999999997 | E27: 66.012626999999995 | F27: 8.4167380000000005 | G27: 45.519919999999999 | H27: 32.630333 | I27: 5.9305500000000002 | J27: =RC[-5]-RC[-2] -> 33.382293999999995 | K27: 12.573912 | L27: 3.2572990000000002 | M27: 65.291732999999994 | N27: 9.5619110000000003 | O27: 65.419556 | P27: =IF(AND(ISNUMBER(RC[-3]),ISNUMBER(RC[-1])),RC[-3]-RC[-1],"-") -> -0.12782300000000646 | Q27: 12.81921 | R27: 0.82257400000000003 | S27: 2.3520729999999999 | T27: =(RC[-16]*RC[-15]-RC[-13]*RC[-12])/1000 -> 2.3495961830580492 | U27: 3.1942629999999999 | V27: 9.3762190000000007 | W27: =RC[-2]*RC[-10]/1000 -> 0.20855896692777898 | X27: =ABS((RC[-3]*RC[-11]-RC[-2]*RC[-9])/1000) -> 0.40482911701098501 | Y27: =(RC[-14]-RC[1])/RC[-18]*100 -> 7.5351626277019423E-3 | Z27: =RC[-5]+RC[-4] -> 12.570482 | AC27: =VALUE(RC[-27]) -> 2018-10-06T00:00:00.000 | AD27: =IF(RC[21]=42,"*",IF(RC[21]=32,"",RC[21])) -> - | AE27: =RC[-28] -> 24 | AF27: =RC[-28] -> 58.093829999999997 | AG27: =RC[-28] -> 66.012626999999995 | AH27: =RC[-28] -> 8.4167380000000005 | AI27: =RC[-28] -> 45.519919999999999 | AJ27: =RC[-28] -> 32.630333 | AK27: =RC[-28] -> 5.9305500000000002 | AL27: =RC[-28] -> 33.382293999999995 | AM27: =RC[-28] -> 12.573912 | AN27: =RC[-28] -> 3.2572990000000002 | AO27: =RC[-28] -> 65.291732999999994 | AP27: - | AQ27: =RC[-29] -> 9.5619110000000003 | AR27: =RC[-29] -> 65.419556 | AS27: - | AT27: =RC[-30] -> -0.12782300000000646 | AU27: =RC[-30] -> 12.81921 | AV27: =RC[-30] -> 0.82257400000000003 | AW27: =RC[-30] -> 2.3520729999999999 | AY27: - | AZ27: - | BA27: -
A28: =IF(RC[1]="","",DATEVALUE(RC[1])) -> 43380 | B28: 07.10.18 | C28: 24 | D28: 60.638309 | E28: 66.360168000000002 | F28: 8.4066030000000005 | G28: 45.938560000000003 | H28: 32.991726 | I28: 5.8679399999999999 | J28: =RC[-5]-RC[-2] -> 33.368442000000002 | K28: 14.699743 | L28: 3.230966 | M28: 65.685066000000006 | N28: 11.858521 | O28: 65.824661000000006 | P28: =IF(AND(ISNUMBER(RC[-3]),ISNUMBER(RC[-1])),RC[-3]-RC[-1],"-") -> -0.13959499999999991 | Q28: 15.089487 | R28: 0.97406999999999999 | S28: 2.5111620000000001 | T28: =(RC[-16]*RC[-15]-RC[-13]*RC[-12])/1000 -> 2.5083759881213519 | U28: 3.1677490000000001 | V28: 11.625613 | W28: =RC[-2]*RC[-10]/1000 -> 0.20807380213643403 | X28: =ABS((RC[-3]*RC[-11]-RC[-2]*RC[-9])/1000) -> 0.55717823250575904 | Y28: =(RC[-14]-RC[1])/RC[-18]*100 -> -0.2037917601248283 | Z28: =RC[-5]+RC[-4] -> 14.793362 | AC28: =VALUE(RC[-27]) -> 2018-10-07T00:00:00.000 | AD28: =IF(RC[21]=42,"*",IF(RC[21]=32,"",RC[21])) -> - | AE28: =RC[-28] -> 24 | AF28: =RC[-28] -> 60.638309 | AG28: =RC[-28] -> 66.360168000000002 | AH28: =RC[-28] -> 8.4066030000000005 | AI28: =RC[-28] -> 45.938560000000003 | AJ28: =RC[-28] -> 32.991726 | AK28: =RC[-28] -> 5.8679399999999999 | AL28: =RC[-28] -> 33.368442000000002 | AM28: =RC[-28] -> 14.699743 | AN28: =RC[-28] -> 3.230966 | AO28: =RC[-28] -> 65.685066000000006 | AP28: - | AQ28: =RC[-29] -> 11.858521 | AR28: =RC[-29] -> 65.824661000000006 | AS28: - | AT28: =RC[-30] -> -0.13959499999999991 | AU28: =RC[-30] -> 15.089487 | AV28: =RC[-30] -> 0.97406999999999999 | AW28: =RC[-30] -> 2.5111620000000001 | AY28: - | AZ28: - | BA28: -
A29: =IF(RC[1]="","",DATEVALUE(RC[1])) -> 43381 | B29: 08.10.18 | C29: 24 | D29: 60.605080000000001 | E29: 66.293578999999994 | F29: 8.4084079999999997 | G29: 46.850104999999999 | H29: 32.742531 | I29: 5.7781859999999998 | J29: =RC[-5]-RC[-2] -> 33.551047999999994 | K29: 13.754973 | L29: 4.0916220000000001 | M29: 65.544105999999999 | N29: 10.004810000000001 | O29: 65.586601000000002 | P29: =IF(AND(ISNUMBER(RC[-3]),ISNUMBER(RC[-1])),RC[-3]-RC[-1],"-") -> -4.2495000000002392E-2 | Q29: 14.096432 | R29: 0.90703199999999995 | S29: 2.4865309999999998 | T29: =(RC[-16]*RC[-15]-RC[-13]*RC[-12])/1000 -> 2.4837366434655652 | U29: 4.0118850000000004 | V29: 9.8096309999999995 | W29: =RC[-2]*RC[-10]/1000 -> 0.26295541569981001 | X29: =ABS((RC[-3]*RC[-11]-RC[-2]*RC[-9])/1000) -> 0.38042493865442101 | Y29: =(RC[-14]-RC[1])/RC[-18]*100 -> -0.14203383322193056 | Z29: =RC[-5]+RC[-4] -> 13.821515999999999 | AC29: =VALUE(RC[-27]) -> 2018-10-08T00:00:00.000 | AD29: =IF(RC[21]=42,"*",IF(RC[21]=32,"",RC[21])) -> - | AE29: =RC[-28] -> 24 | AF29: =RC[-28] -> 60.605080000000001 | AG29: =RC[-28] -> 66.293578999999994 | AH29: =RC[-28] -> 8.4084079999999997 | AI29: =RC[-28] -> 46.850104999999999 | AJ29: =RC[-28] -> 32.742531 | AK29: =RC[-28] -> 5.7781859999999998 | AL29: =RC[-28] -> 33.551047999999994 | AM29: =RC[-28] -> 13.754973 | AN29: =RC[-28] -> 4.0916220000000001 | AO29: =RC[-28] -> 65.544105999999999 | AP29: - | AQ29: =RC[-29] -> 10.004810000000001 | AR29: =RC[-29] -> 65.586601000000002 | AS29: - | AT29: =RC[-30] -> -4.2495000000002392E-2 | AU29: =RC[-30] -> 14.096432 | AV29: =RC[-30] -> 0.90703199999999995 | AW29: =RC[-30] -> 2.4865309999999998 | AY29: - | AZ29: - | BA29: -
A30: =IF(RC[1]="","",DATEVALUE(RC[1])) -> 43382 | B30: 09.10.18 | C30: 24 | D30: 60.168339000000003 | E30: 66.127448999999999 | F30: 8.4371340000000004 | G30: 46.693558000000003 | H30: 32.979472999999999 | I30: 5.8143419999999999 | J30: =RC[-5]-RC[-2] -> 33.147976 | K30: 13.474776 | L30: 3.4790329999999998 | M30: 65.283051 | N30: 10.359242999999999 | O30: 65.593047999999996 | P30: =IF(AND(ISNUMBER(RC[-3]),ISNUMBER(RC[-1])),RC[-3]-RC[-1],"-") -> -0.30999699999999564 | Q30: 13.838276 | R30: 0.88963599999999998 | S30: 2.4416090000000001 | T30: =(RC[-16]*RC[-15]-RC[-13]*RC[-12])/1000 -> 2.4388498333022772 | U30: 3.4117090000000001 | V30: 10.157083999999999 | W30: =RC[-2]*RC[-10]/1000 -> 0.22272677264415902 | X30: =ABS((RC[-3]*RC[-11]-RC[-2]*RC[-9])/1000) -> 0.44350732570787282 | Y30: =(RC[-14]-RC[1])/RC[-18]*100 -> -0.20134897409188465 | Z30: =RC[-5]+RC[-4] -> 13.568792999999999 | AC30: =VALUE(RC[-27]) -> 2018-10-09T00:00:00.000 | AD30: =IF(RC[21]=42,"*",IF(RC[21]=32,"",RC[21])) -> - | AE30: =RC[-28] -> 24 | AF30: =RC[-28] -> 60.168339000000003 | AG30: =RC[-28] -> 66.127448999999999 | AH30: =RC[-28] -> 8.4371340000000004 | AI30: =RC[-28] -> 46.693558000000003 | AJ30: =RC[-28] -> 32.979472999999999 | AK30: =RC[-28] -> 5.8143419999999999 | AL30: =RC[-28] -> 33.147976 | AM30: =RC[-28] -> 13.474776 | AN30: =RC[-28] -> 3.4790329999999998 | AO30: =RC[-28] -> 65.283051 | AP30: - | AQ30: =RC[-29] -> 10.359242999999999 | AR30: =RC[-29] -> 65.593047999999996 | AS30: - | AT30: =RC[-30] -> -0.30999699999999564 | AU30: =RC[-30] -> 13.838276 | AV30: =RC[-30] -> 0.88963599999999998 | AW30: =RC[-30] -> 2.4416090000000001 | AY30: - | AZ30: - | BA30: -
A31: =IF(RC[1]="","",DATEVALUE(RC[1])) -> 43383 | B31: 10.10.18 | C31: 24 | D31: 58.464756000000001 | E31: 67.214995999999999 | F31: 8.4572649999999996 | G31: 45.881720999999999 | H31: 33.463329000000002 | I31: 5.8995889999999997 | J31: =RC[-5]-RC[-2] -> 33.751666999999998 | K31: 12.583034 | L31: 3.6707890000000001 | M31: 66.595687999999996 | N31: 9.15761 | O31: 66.677718999999996 | P31: =IF(AND(ISNUMBER(RC[-3]),ISNUMBER(RC[-1])),RC[-3]-RC[-1],"-") -> -8.2031000000000631E-2 | Q31: 12.828398999999999 | R31: 0.83851600000000004 | S31: 2.3970050000000001 | T31: =(RC[-16]*RC[-15]-RC[-13]*RC[-12])/1000 -> 2.3943532157717673 | U31: 3.597121 | V31: 8.9734339999999992 | W31: =RC[-2]*RC[-10]/1000 -> 0.23955274781424798 | X31: =ABS((RC[-3]*RC[-11]-RC[-2]*RC[-9])/1000) -> 0.35877536290279788 | Y31: =(RC[-14]-RC[1])/RC[-18]*100 -> 2.719819511565574E-2 | Z31: =RC[-5]+RC[-4] -> 12.570554999999999 | AC31: =VALUE(RC[-27]) -> 2018-10-10T00:00:00.000 | AD31: =IF(RC[21]=42,"*",IF(RC[21]=32,"",RC[21])) -> - | AE31: =RC[-28] -> 24 | AF31: =RC[-28] -> 58.464756000000001 | AG31: =RC[-28] -> 67.214995999999999 | AH31: =RC[-28] -> 8.4572649999999996 | AI31: =RC[-28] -> 45.881720999999999 | AJ31: =RC[-28] -> 33.463329000000002 | AK31: =RC[-28] -> 5.8995889999999997 | AL31: =RC[-28] -> 33.751666999999998 | AM31: =RC[-28] -> 12.583034 | AN31: =RC[-28] -> 3.6707890000000001 | AO31: =RC[-28] -> 66.595687999999996 | AP31: - | AQ31: =RC[-29] -> 9.15761 | AR31: =RC[-29] -> 66.677718999999996 | AS31: - | AT31: =RC[-30] -> -8.2031000000000631E-2 | AU31: =RC[-30] -> 12.828398999999999 | AV31: =RC[-30] -> 0.83851600000000004 | AW31: =RC[-30] -> 2.3970050000000001 | AY31: - | AZ31: - | BA31: -
A32: =IF(RC[1]="","",DATEVALUE(RC[1])) -> 43384 | B32: 11.10.18 | C32: 24 | D32: 59.785263 | E32: 68.247687999999997 | F32: 8.4454619999999991 | G32: 47.265132999999999 | H32: 34.186439999999997 | I32: 5.7152370000000001 | J32: =RC[-5]-RC[-2] -> 34.061247999999999 | K32: 12.520125999999999 | L32: 3.5515219999999998 | M32: 67.486716999999999 | N32: 9.2767210000000002 | O32: 67.559166000000005 | P32: =IF(AND(ISNUMBER(RC[-3]),ISNUMBER(RC[-1])),RC[-3]-RC[-1],"-") -> -7.2449000000005981E-2 | Q32: 12.828243000000001 | R32: 0.84921599999999997 | S32: 2.4673600000000002 | T32: =(RC[-16]*RC[-15]-RC[-13]*RC[-12])/1000 -> 2.4643793428254237 | U32: 3.4784999999999999 | V32: 9.0856239999999993 | W32: =RC[-2]*RC[-10]/1000 -> 0.2347525450845 | X32: =ABS((RC[-3]*RC[-11]-RC[-2]*RC[-9])/1000) -> 0.37906463494508397 | Y32: =(RC[-14]-RC[1])/RC[-18]*100 -> -9.3087646659113815E-2 | Z32: =RC[-5]+RC[-4] -> 12.564124 | AC32: =VALUE(RC[-27]) -> 2018-10-11T00:00:00.000 | AD32: =IF(RC[21]=42,"*",IF(RC[21]=32,"",RC[21])) -> - | AE32: =RC[-28] -> 24 | AF32: =RC[-28] -> 59.785263 | AG32: =RC[-28] -> 68.247687999999997 | AH32: =RC[-28] -> 8.4454619999999991 | AI32: =RC[-28] -> 47.265132999999999 | AJ32: =RC[-28] -> 34.186439999999997 | AK32: =RC[-28] -> 5.7152370000000001 | AL32: =RC[-28] -> 34.061247999999999 | AM32: =RC[-28] -> 12.520125999999999 | AN32: =RC[-28] -> 3.5515219999999998 | AO32: =RC[-28] -> 67.486716999999999 | AP32: - | AQ32: =RC[-29] -> 9.2767210000000002 | AR32: =RC[-29] -> 67.559166000000005 | AS32: - | AT32: =RC[-30] -> -7.2449000000005981E-2 | AU32: =RC[-30] -> 12.828243000000001 | AV32: =RC[-30] -> 0.84921599999999997 | AW32: =RC[-30] -> 2.4673600000000002 | AY32: - | AZ32: - | BA32: -
A33: =IF(RC[1]="","",DATEVALUE(RC[1])) -> 43385 | B33: 12.10.18 | C33: 24 | D33: 60.106555999999998 | E33: 68.157927999999998 | F33: 8.4440639999999991 | G33: 47.309258 | H33: 34.070498999999998 | I33: 5.7163830000000004 | J33: =RC[-5]-RC[-2] -> 34.087429 | K33: 12.797298 | L33: 3.4776889999999998 | M33: 67.441010000000006 | N33: 9.6333219999999997 | O33: 67.441665999999998 | P33: =IF(AND(ISNUMBER(RC[-3]),ISNUMBER(RC[-1])),RC[-3]-RC[-1],"-") -> -6.5599999999221836E-4 | Q33: 13.111011 | R33: 0.86673100000000003 | S33: 2.4878800000000001 | T33: =(RC[-16]*RC[-15]-RC[-13]*RC[-12])/1000 -> 2.4848882887962263 | U33: 3.4062739999999998 | V33: 9.4355180000000001 | W33: =RC[-2]*RC[-10]/1000 -> 0.22972255889674001 | X33: =ABS((RC[-3]*RC[-11]-RC[-2]*RC[-9])/1000) -> 0.40662449459624805 | Y33: =(RC[-14]-RC[1])/RC[-18]*100 -> -9.4049245075879778E-2 | Z33: =RC[-5]+RC[-4] -> 12.841792 | AC33: =VALUE(RC[-27]) -> 2018-10-12T00:00:00.000 | AD33: =IF(RC[21]=42,"*",IF(RC[21]=32,"",RC[21])) -> - | AE33: =RC[-28] -> 24 | AF33: =RC[-28] -> 60.106555999999998 | AG33: =RC[-28] -> 68.157927999999998 | AH33: =RC[-28] -> 8.4440639999999991 | AI33: =RC[-28] -> 47.309258 | AJ33: =RC[-28] -> 34.070498999999998 | AK33: =RC[-28] -> 5.7163830000000004 | AL33: =RC[-28] -> 34.087429 | AM33: =RC[-28] -> 12.797298 | AN33: =RC[-28] -> 3.4776889999999998 | AO33: =RC[-28] -> 67.441010000000006 | AP33: - | AQ33: =RC[-29] -> 9.6333219999999997 | AR33: =RC[-29] -> 67.441665999999998 | AS33: - | AT33: =RC[-30] -> -6.5599999999221836E-4 | AU33: =RC[-30] -> 13.111011 | AV33: =RC[-30] -> 0.86673100000000003 | AW33: =RC[-30] -> 2.4878800000000001 | AY33: - | AZ33: - | BA33: -
A34: =IF(RC[1]="","",DATEVALUE(RC[1])) -> 43386 | B34: 13.10.18 | C34: 24 | D34: 59.563129000000004 | E34: 69.121109000000004 | F34: 8.4470829999999992 | G34: 47.363166999999997 | H34: 34.658630000000002 | I34: 5.7042099999999998 | J34: =RC[-5]-RC[-2] -> 34.462479000000002 | K34: 12.199966 | L34: 3.358222 | M34: 68.310135000000002 | N34: 9.2024880000000007 | O34: 68.310822000000002 | P34: =IF(AND(ISNUMBER(RC[-3]),ISNUMBER(RC[-1])),RC[-3]-RC[-1],"-") -> -6.8699999999921602E-4 | Q34: 12.56071 | R34: 0.84063600000000005 | S34: 2.4785699999999999 | T34: =(RC[-16]*RC[-15]-RC[-13]*RC[-12])/1000 -> 2.4755270513088519 | U34: 3.2876259999999999 | V34: 9.0090599999999998 | W34: =RC[-2]*RC[-10]/1000 -> 0.22457817588950998 | X34: =ABS((RC[-3]*RC[-11]-RC[-2]*RC[-9])/1000) -> 0.39083811815780994 | Y34: =(RC[-14]-RC[1])/RC[-18]*100 -> -0.20420931733724534 | Z34: =RC[-5]+RC[-4] -> 12.296685999999999 | AC34: =VALUE(RC[-27]) -> 2018-10-13T00:00:00.000 | AD34: =IF(RC[21]=42,"*",IF(RC[21]=32,"",RC[21])) -> - | AE34: =RC[-28] -> 24 | AF34: =RC[-28] -> 59.563129000000004 | AG34: =RC[-28] -> 69.121109000000004 | AH34: =RC[-28] -> 8.4470829999999992 | AI34: =RC[-28] -> 47.363166999999997 | AJ34: =RC[-28] -> 34.658630000000002 | AK34: =RC[-28] -> 5.7042099999999998 | AL34: =RC[-28] -> 34.462479000000002 | AM34: =RC[-28] -> 12.199966 | AN34: =RC[-28] -> 3.358222 | AO34: =RC[-28] -> 68.310135000000002 | AP34: - | AQ34: =RC[-29] -> 9.2024880000000007 | AR34: =RC[-29] -> 68.310822000000002 | AS34: - | AT34: =RC[-30] -> -6.8699999999921602E-4 | AU34: =RC[-30] -> 12.56071 | AV34: =RC[-30] -> 0.84063600000000005 | AW34: =RC[-30] -> 2.4785699999999999 | AY34: - | AZ34: - | BA34: -
A35: =IF(RC[1]="","",DATEVALUE(RC[1])) -> 43387 | B35: 14.10.18 | C35: 24 | D35: 60.964516000000003 | E35: 69.996955999999997 | F35: 8.4458020000000005 | G35: 47.394817000000003 | H35: 35.455947999999999 | I35: 5.6864910000000002 | J35: =RC[-5]-RC[-2] -> 34.541007999999998 | K35: 13.569694999999999 | L35: 3.5606550000000001 | M35: 69.455544000000003 | N35: 10.389167 | O35: 69.474379999999996 | P35: =IF(AND(ISNUMBER(RC[-3]),ISNUMBER(RC[-1])),RC[-3]-RC[-1],"-") -> -1.8835999999993192E-2 | Q35: 13.949821999999999 | R35: 0.94880399999999998 | S35: 2.5901900000000002 | T35: =(RC[-16]*RC[-15]-RC[-13]*RC[-12])/1000 -> 2.5869023769917803 | U35: 3.4835020000000001 | V35: 10.163938999999999 | W35: =RC[-2]*RC[-10]/1000 -> 0.24194852643508802 | X35: =ABS((RC[-3]*RC[-11]-RC[-2]*RC[-9])/1000) -> 0.46418483394773186 | Y35: =(RC[-14]-RC[1])/RC[-18]*100 -> -0.16403903405724601 | Z35: =RC[-5]+RC[-4] -> 13.647440999999999 | AC35: =VALUE(RC[-27]) -> 2018-10-14T00:00:00.000 | AD35: =IF(RC[21]=42,"*",IF(RC[21]=32,"",RC[21])) -> - | AE35: =RC[-28] -> 24 | AF35: =RC[-28] -> 60.964516000000003 | AG35: =RC[-28] -> 69.996955999999997 | AH35: =RC[-28] -> 8.4458020000000005 | AI35: =RC[-28] -> 47.394817000000003 | AJ35: =RC[-28] -> 35.455947999999999 | AK35: =RC[-28] -> 5.6864910000000002 | AL35: =RC[-28] -> 34.541007999999998 | AM35: =RC[-28] -> 13.569694999999999 | AN35: =RC[-28] -> 3.5606550000000001 | AO35: =RC[-28] -> 69.455544000000003 | AP35: - | AQ35: =RC[-29] -> 10.389167 | AR35: =RC[-29] -> 69.474379999999996 | AS35: - | AT35: =RC[-30] -> -1.8835999999993192E-2 | AU35: =RC[-30] -> 13.949821999999999 | AV35: =RC[-30] -> 0.94880399999999998 | AW35: =RC[-30] -> 2.5901900000000002 | AY35: - | AZ35: - | BA35: -
A36: =IF(RC[1]="","",DATEVALUE(RC[1])) -> 43388 | B36: 15.10.18 | C36: 24 | D36: 59.304279000000001 | E36: 69.497208000000001 | F36: 8.4464159999999993 | G36: 47.500736000000003 | H36: 35.886791000000002 | I36: 5.6862170000000001 | J36: =RC[-5]-RC[-2] -> 33.610416999999998 | K36: 11.803533 | L36: 3.4286660000000002 | M36: 68.618781999999996 | N36: 8.7544540000000008 | O36: 68.829102000000006 | P36: =IF(AND(ISNUMBER(RC[-3]),ISNUMBER(RC[-1])),RC[-3]-RC[-1],"-") -> -0.21032000000001005 | Q36: 12.183120000000001 | R36: 0.82062500000000005 | S36: 2.4199609999999998 | T36: =(RC[-16]*RC[-15]-RC[-13]*RC[-12])/1000 -> 2.4168328277748561 | U36: 3.3559860000000001 | V36: 8.5678699999999992 | W36: =RC[-2]*RC[-10]/1000 -> 0.23028367172905201 | X36: =ABS((RC[-3]*RC[-11]-RC[-2]*RC[-9])/1000) -> 0.35943512642368797 | Y36: =(RC[-14]-RC[1])/RC[-18]*100 -> -0.25330765401192745 | Z36: =RC[-5]+RC[-4] -> 11.923855999999999 | AC36: =VALUE(RC[-27]) -> 2018-10-15T00:00:00.000 | AD36: =IF(RC[21]=42,"*",IF(RC[21]=32,"",RC[21])) -> - | AE36: =RC[-28] -> 24 | AF36: =RC[-28] -> 59.304279000000001 | AG36: =RC[-28] -> 69.497208000000001 | AH36: =RC[-28] -> 8.4464159999999993 | AI36: =RC[-28] -> 47.500736000000003 | AJ36: =RC[-28] -> 35.886791000000002 | AK36: =RC[-28] -> 5.6862170000000001 | AL36: =RC[-28] -> 33.610416999999998 | AM36: =RC[-28] -> 11.803533 | AN36: =RC[-28] -> 3.4286660000000002 | AO36: =RC[-28] -> 68.618781999999996 | AP36: - | AQ36: =RC[-29] -> 8.7544540000000008 | AR36: =RC[-29] -> 68.829102000000006 | AS36: - | AT36: =RC[-30] -> -0.21032000000001005 | AU36: =RC[-30] -> 12.183120000000001 | AV36: =RC[-30] -> 0.82062500000000005 | AW36: =RC[-30] -> 2.4199609999999998 | AY36: - | AZ36: - | BA36: -
A37: =IF(RC[1]="","",DATEVALUE(RC[1])) -> 43389 | B37: 16.10.18 | C37: 24 | D37: 59.889899999999997 | E37: 69.573577999999998 | F37: 8.4451739999999997 | G37: 47.492905 | H37: 35.909981000000002 | I37: 5.6864270000000001 | J37: =RC[-5]-RC[-2] -> 33.663596999999996 | K37: 12.397003 | L37: 3.936099 | M37: 69.020629999999997 | N37: 8.8328330000000008 | O37: 68.8386 | P37: =IF(AND(ISNUMBER(RC[-3]),ISNUMBER(RC[-1])),RC[-3]-RC[-1],"-") -> 0.18202999999999747 | Q37: 12.768932 | R37: 0.86158699999999999 | S37: 2.4644759999999999 | T37: =(RC[-16]*RC[-15]-RC[-13]*RC[-12])/1000 -> 2.4612853128773939 | U37: 3.8517800000000002 | V37: 8.6445369999999997 | W37: =RC[-2]*RC[-10]/1000 -> 0.2658522822214 | X37: =ABS((RC[-3]*RC[-11]-RC[-2]*RC[-9])/1000) -> 0.32922554250679997 | Y37: =(RC[-14]-RC[1])/RC[-18]*100 -> -0.20911334019260283 | Z37: =RC[-5]+RC[-4] -> 12.496316999999999 | AC37: =VALUE(RC[-27]) -> 2018-10-16T00:00:00.000 | AD37: =IF(RC[21]=42,"*",IF(RC[21]=32,"",RC[21])) -> - | AE37: =RC[-28] -> 24 | AF37: =RC[-28] -> 59.889899999999997 | AG37: =RC[-28] -> 69.573577999999998 | AH37: =RC[-28] -> 8.4451739999999997 | AI37: =RC[-28] -> 47.492905 | AJ37: =RC[-28] -> 35.909981000000002 | AK37: =RC[-28] -> 5.6864270000000001 | AL37: =RC[-28] -> 33.663596999999996 | AM37: =RC[-28] -> 12.397003 | AN37: =RC[-28] -> 3.936099 | AO37: =RC[-28] -> 69.020629999999997 | AP37: - | AQ37: =RC[-29] -> 8.8328330000000008 | AR37: =RC[-29] -> 68.8386 | AS37: - | AT37: =RC[-30] -> 0.18202999999999747 | AU37: =RC[-30] -> 12.768932 | AV37: =RC[-30] -> 0.86158699999999999 | AW37: =RC[-30] -> 2.4644759999999999 | AY37: - | AZ37: - | BA37: -
A38: =IF(RC[1]="","",DATEVALUE(RC[1])) -> 43390 | B38: 17.10.18 | C38: 24 | D38: 59.395389999999999 | E38: 69.692993000000001 | F38: 8.4490979999999993 | G38: 47.615467000000002 | H38: 35.937145000000001 | I38: 5.6932280000000004 | J38: =RC[-5]-RC[-2] -> 33.755848 | K38: 11.779919 | L38: 3.3290109999999999 | M38: 68.791054000000003 | N38: 8.8421649999999996 | O38: 69.049346999999997 | P38: =IF(AND(ISNUMBER(RC[-3]),ISNUMBER(RC[-1])),RC[-3]-RC[-1],"-") -> -0.25829299999999478 | Q38: 12.171176000000001 | R38: 0.82221100000000003 | S38: 2.431419 | T38: =(RC[-16]*RC[-15]-RC[-13]*RC[-12])/1000 -> 2.4282785576805548 | U38: 3.2581199999999999 | V38: 8.6526139999999998 | W38: =RC[-2]*RC[-10]/1000 -> 0.22412950885847999 | X38: =ABS((RC[-3]*RC[-11]-RC[-2]*RC[-9])/1000) -> 0.37332783768457795 | Y38: =(RC[-14]-RC[1])/RC[-18]*100 -> -0.27473215793515188 | Z38: =RC[-5]+RC[-4] -> 11.910734 | AC38: =VALUE(RC[-27]) -> 2018-10-17T00:00:00.000 | AD38: =IF(RC[21]=42,"*",IF(RC[21]=32,"",RC[21])) -> - | AE38: =RC[-28] -> 24 | AF38: =RC[-28] -> 59.395389999999999 | AG38: =RC[-28] -> 69.692993000000001 | AH38: =RC[-28] -> 8.4490979999999993 | AI38: =RC[-28] -> 47.615467000000002 | AJ38: =RC[-28] -> 35.937145000000001 | AK38: =RC[-28] -> 5.6932280000000004 | AL38: =RC[-28] -> 33.755848 | AM38: =RC[-28] -> 11.779919 | AN38: =RC[-28] -> 3.3290109999999999 | AO38: =RC[-28] -> 68.791054000000003 | AP38: - | AQ38: =RC[-29] -> 8.8421649999999996 | AR38: =RC[-29] -> 69.049346999999997 | AS38: - | AT38: =RC[-30] -> -0.25829299999999478 | AU38: =RC[-30] -> 12.171176000000001 | AV38: =RC[-30] -> 0.82221100000000003 | AW38: =RC[-30] -> 2.431419 | AY38: - | AZ38: - | BA38: -
A39: =IF(RC[1]="","",DATEVALUE(RC[1])) -> 43391 | B39: 18.10.18 | C39: 24 | D39: 59.192970000000003 | E39: 70.170081999999994 | F39: 8.4548539999999992 | G39: 47.790675999999998 | H39: 36.081074000000001 | I39: 5.6825140000000003 | J39: =RC[-5]-RC[-2] -> 34.089007999999993 | K39: 11.402303 | L39: 3.3630879999999999 | M39: 69.360191 | N39: 8.4805340000000005 | O39: 69.395294000000007 | P39: =IF(AND(ISNUMBER(RC[-3]),ISNUMBER(RC[-1])),RC[-3]-RC[-1],"-") -> -3.5103000000006546E-2 | Q39: 11.843622 | R39: 0.80461000000000005 | S39: 2.4323860000000002 | T39: =(RC[-16]*RC[-15]-RC[-13]*RC[-12])/1000 -> 2.4292366414575159 | U39: 3.2903889999999998 | V39: 8.2970670000000002 | W39: =RC[-2]*RC[-10]/1000 -> 0.22822200950429899 | X39: =ABS((RC[-3]*RC[-11]-RC[-2]*RC[-9])/1000) -> 0.34755539429839905 | Y39: =(RC[-14]-RC[1])/RC[-18]*100 -> -0.38742494456449977 | Z39: =RC[-5]+RC[-4] -> 11.587456 | AC39: =VALUE(RC[-27]) -> 2018-10-18T00:00:00.000 | AD39: =IF(RC[21]=42,"*",IF(RC[21]=32,"",RC[21])) -> - | AE39: =RC[-28] -> 24 | AF39: =RC[-28] -> 59.192970000000003 | AG39: =RC[-28] -> 70.170081999999994 | AH39: =RC[-28] -> 8.4548539999999992 | AI39: =RC[-28] -> 47.790675999999998 | AJ39: =RC[-28] -> 36.081074000000001 | AK39: =RC[-28] -> 5.6825140000000003 | AL39: =RC[-28] -> 34.089007999999993 | AM39: =RC[-28] -> 11.402303 | AN39: =RC[-28] -> 3.3630879999999999 | AO39: =RC[-28] -> 69.360191 | AP39: - | AQ39: =RC[-29] -> 8.4805340000000005 | AR39: =RC[-29] -> 69.395294000000007 | AS39: - | AT39: =RC[-30] -> -3.5103000000006546E-2 | AU39: =RC[-30] -> 11.843622 | AV39: =RC[-30] -> 0.80461000000000005 | AW39: =RC[-30] -> 2.4323860000000002 | AY39: - | AZ39: - | BA39: -
A40: =IF(RC[1]="","",DATEVALUE(RC[1])) -> 43392 | B40: 19.10.18 | C40: 24 | D40: 59.280093999999998 | E40: 70.053528 | F40: 8.4536350000000002 | G40: 47.677672999999999 | H40: 35.633965000000003 | I40: 5.694534 | J40: =RC[-5]-RC[-2] -> 34.419562999999997 | K40: 11.602418999999999 | L40: 3.4874999999999998 | M40: 69.294708 | N40: 8.5247989999999998 | O40: 69.292869999999994 | P40: =IF(AND(ISNUMBER(RC[-3]),ISNUMBER(RC[-1])),RC[-3]-RC[-1],"-") -> 1.8380000000064456E-3 | Q40: 12.012299000000001 | R40: 0.815029 | S40: 2.4569359999999998 | T40: =(RC[-16]*RC[-15]-RC[-13]*RC[-12])/1000 -> 2.4538351939081866 | U40: 3.4122400000000002 | V40: 8.3408580000000008 | W40: =RC[-2]*RC[-10]/1000 -> 0.23645017442592001 | X40: =ABS((RC[-3]*RC[-11]-RC[-2]*RC[-9])/1000) -> 0.34151181465654001 | Y40: =(RC[-14]-RC[1])/RC[-18]*100 -> -0.31603681664581662 | Z40: =RC[-5]+RC[-4] -> 11.753098000000001 | AC40: =VALUE(RC[-27]) -> 2018-10-19T00:00:00.000 | AD40: =IF(RC[21]=42,"*",IF(RC[21]=32,"",RC[21])) -> - | AE40: =RC[-28] -> 24 | AF40: =RC[-28] -> 59.280093999999998 | AG40: =RC[-28] -> 70.053528 | AH40: =RC[-28] -> 8.4536350000000002 | AI40: =RC[-28] -> 47.677672999999999 | AJ40: =RC[-28] -> 35.633965000000003 | AK40: =RC[-28] -> 5.694534 | AL40: =RC[-28] -> 34.419562999999997 | AM40: =RC[-28] -> 11.602418999999999 | AN40: =RC[-28] -> 3.4874999999999998 | AO40: =RC[-28] -> 69.294708 | AP40: - | AQ40: =RC[-29] -> 8.5247989999999998 | AR40: =RC[-29] -> 69.292869999999994 | AS40: - | AT40: =RC[-30] -> 1.8380000000064456E-3 | AU40: =RC[-30] -> 12.012299000000001 | AV40: =RC[-30] -> 0.815029 | AW40: =RC[-30] -> 2.4569359999999998 | AY40: - | AZ40: - | BA40: -
A41: =IF(RC[1]="","",DATEVALUE(RC[1])) -> 43393 | B41: 20.10.18 | C41: 24 | D41: 61.483528 | E41: 69.361107000000004 | F41: 8.4463200000000001 | G41: 47.704841999999999 | H41: 34.969360000000002 | I41: 5.6914049999999996 | J41: =RC[-5]-RC[-2] -> 34.391747000000002 | K41: 13.778687 | L41: 4.013611 | M41: 68.656372000000005 | N41: 10.355786999999999 | O41: 68.857414000000006 | P41: =IF(AND(ISNUMBER(RC[-3]),ISNUMBER(RC[-1])),RC[-3]-RC[-1],"-") -> -0.20104200000000105 | Q41: 14.369398 | R41: 0.968302 | S41: 2.59958 | T41: =(RC[-16]*RC[-15]-RC[-13]*RC[-12])/1000 -> 2.5963577707043766 | U41: 3.9284379999999999 | V41: 10.134881 | W41: =RC[-2]*RC[-10]/1000 -> 0.26971230070693597 | X41: =ABS((RC[-3]*RC[-11]-RC[-2]*RC[-9])/1000) -> 0.42814939615079806 | Y41: =(RC[-14]-RC[1])/RC[-18]*100 -> -0.59665222243058724 | Z41: =RC[-5]+RC[-4] -> 14.063319 | AC41: =VALUE(RC[-27]) -> 2018-10-20T00:00:00.000 | AD41: =IF(RC[21]=42,"*",IF(RC[21]=32,"",RC[21])) -> - | AE41: =RC[-28] -> 24 | AF41: =RC[-28] -> 61.483528 | AG41: =RC[-28] -> 69.361107000000004 | AH41: =RC[-28] -> 8.4463200000000001 | AI41: =RC[-28] -> 47.704841999999999 | AJ41: =RC[-28] -> 34.969360000000002 | AK41: =RC[-28] -> 5.6914049999999996 | AL41: =RC[-28] -> 34.391747000000002 | AM41: =RC[-28] -> 13.778687 | AN41: =RC[-28] -> 4.013611 | AO41: =RC[-28] -> 68.656372000000005 | AP41: - | AQ41: =RC[-29] -> 10.355786999999999 | AR41: =RC[-29] -> 68.857414000000006 | AS41: - | AT41: =RC[-30] -> -0.20104200000000105 | AU41: =RC[-30] -> 14.369398 | AV41: =RC[-30] -> 0.968302 | AW41: =RC[-30] -> 2.59958 | AY41: - | AZ41: - | BA41: -
A42: =IF(RC[1]="","",DATEVALUE(RC[1])) -> 43394 | B42: 21.10.18 | C42: 24 | D42: 61.893687999999997 | E42: 68.564941000000005 | F42: 8.4408209999999997 | G42: 47.632914999999997 | H42: 34.656120000000001 | I42: 5.6963650000000001 | J42: =RC[-5]-RC[-2] -> 33.908821000000003 | K42: 14.260764999999999 | L42: 4.1215219999999997 | M42: 67.939162999999994 | N42: 10.699133 | O42: 67.980468999999999 | P42: =IF(AND(ISNUMBER(RC[-3]),ISNUMBER(RC[-1])),RC[-3]-RC[-1],"-") -> -4.1306000000005838E-2 | Q42: 14.820655 | R42: 0.98709999999999998 | S42: 2.5961789999999998 | T42: =(RC[-16]*RC[-15]-RC[-13]*RC[-12])/1000 -> 2.5929650478026081 | U42: 4.0357149999999997 | V42: 10.476181 | W42: =RC[-2]*RC[-10]/1000 -> 0.27418309920654499 | X42: =ABS((RC[-3]*RC[-11]-RC[-2]*RC[-9])/1000) -> 0.43799259850234412 | Y42: =(RC[-14]-RC[1])/RC[-18]*100 -> -0.52722156517190033 | Z42: =RC[-5]+RC[-4] -> 14.511896 | AC42: =VALUE(RC[-27]) -> 2018-10-21T00:00:00.000 | AD42: =IF(RC[21]=42,"*",IF(RC[21]=32,"",RC[21])) -> - | AE42: =RC[-28] -> 24 | AF42: =RC[-28] -> 61.893687999999997 | AG42: =RC[-28] -> 68.564941000000005 | AH42: =RC[-28] -> 8.4408209999999997 | AI42: =RC[-28] -> 47.632914999999997 | AJ42: =RC[-28] -> 34.656120000000001 | AK42: =RC[-28] -> 5.6963650000000001 | AL42: =RC[-28] -> 33.908821000000003 | AM42: =RC[-28] -> 14.260764999999999 | AN42: =RC[-28] -> 4.1215219999999997 | AO42: =RC[-28] -> 67.939162999999994 | AP42: - | AQ42: =RC[-29] -> 10.699133 | AR42: =RC[-29] -> 67.980468999999999 | AS42: - | AT42: =RC[-30] -> -4.1306000000005838E-2 | AU42: =RC[-30] -> 14.820655 | AV42: =RC[-30] -> 0.98709999999999998 | AW42: =RC[-30] -> 2.5961789999999998 | AY42: - | AZ42: - | BA42: -
A43: =IF(RC[1]="","",DATEVALUE(RC[1])) -> 43395 | B43: 22.10.18 | C43: 24 | D43: 60.814304 | E43: 68.878876000000005 | F43: 8.4429259999999999 | G43: 47.708571999999997 | H43: 34.592941000000003 | I43: 5.7135660000000001 | J43: =RC[-5]-RC[-2] -> 34.285935000000002 | K43: 13.105727999999999 | L43: 3.1748440000000002 | M43: 67.861618000000007 | N43: 10.414410999999999 | O43: 68.410285999999999 | P43: =IF(AND(ISNUMBER(RC[-3]),ISNUMBER(RC[-1])),RC[-3]-RC[-1],"-") -> -0.54866799999999216 | Q43: 13.589255 | R43: 0.90909600000000002 | S43: 2.541512 | T43: =(RC[-16]*RC[-15]-RC[-13]*RC[-12])/1000 -> 2.538441087852052 | U43: 3.108895 | V43: 10.194889 | W43: =RC[-2]*RC[-10]/1000 -> 0.21097464489211001 | X43: =ABS((RC[-3]*RC[-11]-RC[-2]*RC[-9])/1000) -> 0.48646062733614398 | Y43: =(RC[-14]-RC[1])/RC[-18]*100 -> -0.41513713720041989 | Z43: =RC[-5]+RC[-4] -> 13.303784 | AC43: =VALUE(RC[-27]) -> 2018-10-22T00:00:00.000 | AD43: =IF(RC[21]=42,"*",IF(RC[21]=32,"",RC[21])) -> - | AE43: =RC[-28] -> 24 | AF43: =RC[-28] -> 60.814304 | AG43: =RC[-28] -> 68.878876000000005 | AH43: =RC[-28] -> 8.4429259999999999 | AI43: =RC[-28] -> 47.708571999999997 | AJ43: =RC[-28] -> 34.592941000000003 | AK43: =RC[-28] -> 5.7135660000000001 | AL43: =RC[-28] -> 34.285935000000002 | AM43: =RC[-28] -> 13.105727999999999 | AN43: =RC[-28] -> 3.1748440000000002 | AO43: =RC[-28] -> 67.861618000000007 | AP43: - | AQ43: =RC[-29] -> 10.414410999999999 | AR43: =RC[-29] -> 68.410285999999999 | AS43: - | AT43: =RC[-30] -> -0.54866799999999216 | AU43: =RC[-30] -> 13.589255 | AV43: =RC[-30] -> 0.90909600000000002 | AW43: =RC[-30] -> 2.541512 | AY43: - | AZ43: - | BA43: -
A44: =IF(RC[1]="","",DATEVALUE(RC[1])) ->  | C44: 24 | J44: =RC[-5]-RC[-2] -> #VALUE! | P44: =IF(AND(ISNUMBER(RC[-3]),ISNUMBER(RC[-1])),RC[-3]-RC[-1],"-") -> - | T44: =(RC[-16]*RC[-15]-RC[-13]*RC[-12])/1000 -> #VALUE! | W44: =RC[-2]*RC[-10]/1000 -> #VALUE! | X44: =ABS((RC[-3]*RC[-11]-RC[-2]*RC[-9])/1000) -> #VALUE! | Y44: =(RC[-14]-RC[1])/RC[-18]*100 -> #VALUE! | Z44: =RC[-5]+RC[-4] -> #VALUE! | AC44: =VALUE(RC[-27]) -> #VALUE! | AD44: =IF(RC[21]=42,"*",IF(RC[21]=32,"",RC[21])) ->  | AE44: =RC[-28] -> 24 | AF44: =RC[-28] ->  | AG44: =RC[-28] ->  | AH44: =RC[-28] ->  | AI44: =RC[-28] ->  | AJ44: =RC[-28] ->  | AK44: =RC[-28] ->  | AL44: =RC[-28] -> #VALUE! | AM44: =RC[-28] ->  | AN44: =RC[-28] ->  | AO44: =RC[-28] ->  | AP44: - | AQ44: =RC[-29] ->  | AR44: =RC[-29] ->  | AS44: - | AT44: =RC[-30] -> - | AU44: =RC[-30] ->  | AV44: =RC[-30] ->  | AW44: =RC[-30] -> 
A45: =IF(RC[1]="","",DATEVALUE(RC[1])) ->  | C45: 24 | P45: =IF(AND(ISNUMBER(RC[-3]),ISNUMBER(RC[-1])),RC[-3]-RC[-1],"-") -> - | T45: =(RC[-16]*RC[-15]-RC[-13]*RC[-12])/1000 -> #VALUE! | W45: =RC[-2]*RC[-10]/1000 -> #VALUE! | X45: =ABS((RC[-3]*RC[-11]-RC[-2]*RC[-9])/1000) -> #VALUE! | Y45: =(RC[-14]-RC[1])/RC[-18]*100 -> #VALUE! | Z45: =RC[-5]+RC[-4] -> #VALUE! | AC45: =VALUE(RC[-27]) -> #VALUE! | AD45: =IF(RC[21]=42,"*",IF(RC[21]=32,"",RC[21])) ->  | AE45: =RC[-28] -> 24 | AF45: =RC[-28] ->  | AG45: =RC[-28] ->  | AH45: =RC[-28] ->  | AI45: =RC[-28] ->  | AJ45: =RC[-28] ->  | AK45: =RC[-28] ->  | AL45: =RC[-28] -> 0 | AM45: =RC[-28] ->  | AN45: =RC[-28] ->  | AO45: =RC[-28] ->  | AP45: - | AQ45: =RC[-29] ->  | AR45: =RC[-29] ->  | AS45: - | AT45: =RC[-30] -> - | AU45: =RC[-30] ->  | AV45: =RC[-30] ->  | AW45: =RC[-30] -> 
A46: =IF(RC[1]="","",DATEVALUE(RC[1])) ->  | C46: 24 | P46: =IF(AND(ISNUMBER(RC[-3]),ISNUMBER(RC[-1])),RC[-3]-RC[-1],"-") -> - | T46: =(RC[-16]*RC[-15]-RC[-13]*RC[-12])/1000 -> #VALUE! | W46: =RC[-2]*RC[-10]/1000 -> #VALUE! | X46: =ABS((RC[-3]*RC[-11]-RC[-2]*RC[-9])/1000) -> #VALUE! | Y46: =(RC[-14]-RC[1])/RC[-18]*100 -> #VALUE! | Z46: =RC[-5]+RC[-4] -> #VALUE! | AC46: =VALUE(RC[-27]) -> #VALUE! | AD46: =IF(RC[21]=42,"*",IF(RC[21]=32,"",RC[21])) ->  | AE46: =RC[-28] -> 24 | AF46: =RC[-28] ->  | AG46: =RC[-28] ->  | AH46: =RC[-28] ->  | AI46: =RC[-28] ->  | AJ46: =RC[-28] ->  | AK46: =RC[-28] ->  | AL46: =RC[-28] -> 0 | AM46: =RC[-28] ->  | AN46: =RC[-28] ->  | AO46: =RC[-28] ->  | AP46: - | AQ46: =RC[-29] ->  | AR46: =RC[-29] ->  | AS46: - | AT46: =RC[-30] -> - | AU46: =RC[-30] ->  | AV46: =RC[-30] ->  | AW46: =RC[-30] -> 
A47: =IF(RC[1]="","",DATEVALUE(RC[1])) ->  | C47: 24 | P47: =IF(AND(ISNUMBER(RC[-3]),ISNUMBER(RC[-1])),RC[-3]-RC[-1],"-") -> - | T47: =(RC[-16]*RC[-15]-RC[-13]*RC[-12])/1000 -> #VALUE! | W47: =RC[-2]*RC[-10]/1000 -> #VALUE! | X47: =ABS((RC[-3]*RC[-11]-RC[-2]*RC[-9])/1000) -> #VALUE! | Y47: =(RC[-14]-RC[1])/RC[-18]*100 -> #VALUE! | Z47: =RC[-5]+RC[-4] -> #VALUE! | AC47: =VALUE(RC[-27]) -> #VALUE! | AD47: =IF(RC[21]=42,"*",IF(RC[21]=32,"",RC[21])) ->  | AE47: =RC[-28] -> 24 | AF47: =RC[-28] ->  | AG47: =RC[-28] ->  | AH47: =RC[-28] ->  | AI47: =RC[-28] ->  | AJ47: =RC[-28] ->  | AK47: =RC[-28] ->  | AL47: =RC[-28] -> 0 | AM47: =RC[-28] ->  | AN47: =RC[-28] ->  | AO47: =RC[-28] ->  | AP47: - | AQ47: =RC[-29] ->  | AR47: =RC[-29] ->  | AS47: - | AT47: =RC[-30] -> - | AU47: =RC[-30] ->  | AV47: =RC[-30] ->  | AW47: =RC[-30] -> 
A48: =IF(RC[1]="","",DATEVALUE(RC[1])) ->  | C48: 24 | P48: =IF(AND(ISNUMBER(RC[-3]),ISNUMBER(RC[-1])),RC[-3]-RC[-1],"-") -> - | T48: =(RC[-16]*RC[-15]-RC[-13]*RC[-12])/1000 -> #VALUE! | W48: =RC[-2]*RC[-10]/1000 -> #VALUE! | X48: =ABS((RC[-3]*RC[-11]-RC[-2]*RC[-9])/1000) -> #VALUE! | Y48: =(RC[-14]-RC[1])/RC[-18]*100 -> #VALUE! | Z48: =RC[-5]+RC[-4] -> #VALUE! | AC48: =VALUE(RC[-27]) -> #VALUE! | AD48: =IF(RC[21]=42,"*",IF(RC[21]=32,"",RC[21])) ->  | AE48: =RC[-28] -> 24 | AF48: =RC[-28] ->  | AG48: =RC[-28] ->  | AH48: =RC[-28] ->  | AI48: =RC[-28] ->  | AJ48: =RC[-28] ->  | AK48: =RC[-28] ->  | AL48: =RC[-28] -> 0 | AM48: =RC[-28] ->  | AN48: =RC[-28] ->  | AO48: =RC[-28] ->  | AP48: - | AQ48: =RC[-29] ->  | AR48: =RC[-29] ->  | AS48: - | AT48: =RC[-30] -> - | AU48: =RC[-30] ->  | AV48: =RC[-30] ->  | AW48: =RC[-30] -> 
A49: =IF(RC[1]="","",DATEVALUE(RC[1])) ->  | C49: 24 | P49: =IF(AND(ISNUMBER(RC[-3]),ISNUMBER(RC[-1])),RC[-3]-RC[-1],"-") -> - | T49: =(RC[-16]*RC[-15]-RC[-13]*RC[-12])/1000 -> #VALUE! | W49: =RC[-2]*RC[-10]/1000 -> #VALUE! | X49: =ABS((RC[-3]*RC[-11]-RC[-2]*RC[-9])/1000) -> #VALUE! | Y49: =(RC[-14]-RC[1])/RC[-18]*100 -> #VALUE! | Z49: =RC[-5]+RC[-4] -> #VALUE! | AC49: =VALUE(RC[-27]) -> #VALUE! | AD49: =IF(RC[21]=42,"*",IF(RC[21]=32,"",RC[21])) ->  | AE49: =RC[-28] -> 24 | AF49: =RC[-28] ->  | AG49: =RC[-28] ->  | AH49: =RC[-28] ->  | AI49: =RC[-28] ->  | AJ49: =RC[-28] ->  | AK49: =RC[-28] ->  | AL49: =RC[-28] -> 0 | AM49: =RC[-28] ->  | AN49: =RC[-28] ->  | AO49: =RC[-28] ->  | AP49: - | AQ49: =RC[-29] ->  | AR49: =RC[-29] ->  | AS49: - | AT49: =RC[-30] -> - | AU49: =RC[-30] ->  | AV49: =RC[-30] ->  | AW49: =RC[-30] -> 
A50: =IF(RC[1]="","",DATEVALUE(RC[1])) ->  | P50: =IF(AND(ISNUMBER(RC[-3]),ISNUMBER(RC[-1])),RC[-3]-RC[-1],"-") -> - | T50: =(RC[-16]*RC[-15]-RC[-13]*RC[-12])/1000 -> #VALUE! | W50: =RC[-2]*RC[-10]/1000 -> #VALUE! | X50: =ABS((RC[-3]*RC[-11]-RC[-2]*RC[-9])/1000) -> #VALUE! | Y50: =(RC[-14]-RC[1])/RC[-18]*100 -> #VALUE! | Z50: =RC[-5]+RC[-4] -> #VALUE! | AC50: =VALUE(RC[-27]) -> #VALUE! | AD50: =IF(RC[21]=42,"*",IF(RC[21]=32,"",RC[21])) ->  | AE50: =RC[-28] ->  | AF50: =RC[-28] ->  | AG50: =RC[-28] ->  | AH50: =RC[-28] ->  | AI50: =RC[-28] ->  | AJ50: =RC[-28] ->  | AK50: =RC[-28] ->  | AL50: =RC[-28] -> 0 | AM50: =RC[-28] ->  | AN50: =RC[-28] ->  | AO50: =RC[-28] ->  | AP50: - | AQ50: =RC[-29] ->  | AR50: =RC[-29] ->  | AS50: - | AT50: =RC[-30] -> - | AU50: =RC[-30] ->  | AV50: =RC[-30] ->  | AW50: =RC[-30] -> 
A51: =IF(RC[1]="","",DATEVALUE(RC[1])) ->  | P51: =IF(AND(ISNUMBER(RC[-3]),ISNUMBER(RC[-1])),RC[-3]-RC[-1],"-") -> - | T51: =(RC[-16]*RC[-15]-RC[-13]*RC[-12])/1000 -> #VALUE! | W51: =RC[-2]*RC[-10]/1000 -> #VALUE! | X51: =ABS((RC[-3]*RC[-11]-RC[-2]*RC[-9])/1000) -> #VALUE! | Y51: =(RC[-14]-RC[1])/RC[-18]*100 -> #VALUE! | Z51: =RC[-5]+RC[-4] -> #VALUE! | AC51: =VALUE(RC[-27]) -> #VALUE! | AD51: =IF(RC[21]=42,"*",IF(RC[21]=32,"",RC[21])) ->  | AE51: =RC[-28] ->  | AF51: =RC[-28] ->  | AG51: =RC[-28] ->  | AH51: =RC[-28] ->  | AI51: =RC[-28] ->  | AJ51: =RC[-28] ->  | AK51: =RC[-28] ->  | AL51: =RC[-28] -> 0 | AM51: =RC[-28] ->  | AN51: =RC[-28] ->  | AO51: =RC[-28] ->  | AP51: - | AQ51: =RC[-29] ->  | AR51: =RC[-29] ->  | AS51: - | AT51: =RC[-30] -> - | AU51: =RC[-30] ->  | AV51: =RC[-30] ->  | AW51: =RC[-30] -> 
A52: =IF(RC[1]="","",DATEVALUE(RC[1])) ->  | P52: =IF(AND(ISNUMBER(RC[-3]),ISNUMBER(RC[-1])),RC[-3]-RC[-1],"-") -> - | T52: =(RC[-16]*RC[-15]-RC[-13]*RC[-12])/1000 -> #VALUE! | W52: =RC[-2]*RC[-10]/1000 -> #VALUE! | X52: =ABS((RC[-3]*RC[-11]-RC[-2]*RC[-9])/1000) -> #VALUE! | Y52: =(RC[-14]-RC[1])/RC[-18]*100 -> #VALUE! | Z52: =RC[-5]+RC[-4] -> #VALUE! | AC52: =VALUE(RC[-27]) -> #VALUE! | AD52: =IF(RC[21]=42,"*",IF(RC[21]=32,"",RC[21])) ->  | AE52: =RC[-28] ->  | AF52: =RC[-28] ->  | AG52: =RC[-28] ->  | AH52: =RC[-28] ->  | AI52: =RC[-28] ->  | AJ52: =RC[-28] ->  | AK52: =RC[-28] ->  | AL52: =RC[-28] -> 0 | AM52: =RC[-28] ->  | AN52: =RC[-28] ->  | AO52: =RC[-28] ->  | AP52: - | AQ52: =RC[-29] ->  | AR52: =RC[-29] ->  | AS52: - | AT52: =RC[-30] -> - | AU52: =RC[-30] ->  | AV52: =RC[-30] ->  | AW52: =RC[-30] -> 
A53: =IF(RC[1]="","",DATEVALUE(RC[1])) ->  | P53: =IF(AND(ISNUMBER(RC[-3]),ISNUMBER(RC[-1])),RC[-3]-RC[-1],"-") -> - | T53: =(RC[-16]*RC[-15]-RC[-13]*RC[-12])/1000 -> #VALUE! | W53: =RC[-2]*RC[-10]/1000 -> #VALUE! | X53: =ABS((RC[-3]*RC[-11]-RC[-2]*RC[-9])/1000) -> #VALUE! | Y53: =(RC[-14]-RC[1])/RC[-18]*100 -> #VALUE! | Z53: =RC[-5]+RC[-4] -> #VALUE! | AC53: =VALUE(RC[-27]) -> #VALUE! | AD53: =IF(RC[21]=42,"*",IF(RC[21]=32,"",RC[21])) ->  | AE53: =RC[-28] ->  | AF53: =RC[-28] ->  | AG53: =RC[-28] ->  | AH53: =RC[-28] ->  | AI53: =RC[-28] ->  | AJ53: =RC[-28] ->  | AK53: =RC[-28] ->  | AL53: =RC[-28] -> 0 | AM53: =RC[-28] ->  | AN53: =RC[-28] ->  | AO53: =RC[-28] ->  | AP53: - | AQ53: =RC[-29] ->  | AR53: =RC[-29] ->  | AS53: - | AT53: =RC[-30] -> - | AU53: =RC[-30] ->  | AV53: =RC[-30] ->  | AW53: =RC[-30] -> 
A54: =IF(RC[1]="","",DATEVALUE(RC[1])) ->  | P54: =IF(AND(ISNUMBER(RC[-3]),ISNUMBER(RC[-1])),RC[-3]-RC[-1],"-") -> - | T54: =(RC[-16]*RC[-15]-RC[-13]*RC[-12])/1000 -> #VALUE! | W54: =RC[-2]*RC[-10]/1000 -> #VALUE! | X54: =ABS((RC[-3]*RC[-11]-RC[-2]*RC[-9])/1000) -> #VALUE! | Y54: =(RC[-14]-RC[1])/RC[-18]*100 -> #VALUE! | Z54: =RC[-5]+RC[-4] -> #VALUE! | AC54: =VALUE(RC[-27]) -> #VALUE! | AD54: =IF(RC[21]=42,"*",IF(RC[21]=32,"",RC[21])) ->  | AE54: =RC[-28] ->  | AF54: =RC[-28] ->  | AG54: =RC[-28] ->  | AH54: =RC[-28] ->  | AI54: =RC[-28] ->  | AJ54: =RC[-28] ->  | AK54: =RC[-28] ->  | AL54: =RC[-28] -> 0 | AM54: =RC[-28] ->  | AN54: =RC[-28] ->  | AO54: =RC[-28] ->  | AP54: - | AQ54: =RC[-29] ->  | AR54: =RC[-29] ->  | AS54: - | AT54: =RC[-30] -> - | AU54: =RC[-30] ->  | AV54: =RC[-30] ->  | AW54: =RC[-30] -> 
A55: =IF(RC[1]="","",DATEVALUE(RC[1])) ->  | P55: =IF(AND(ISNUMBER(RC[-3]),ISNUMBER(RC[-1])),RC[-3]-RC[-1],"-") -> - | T55: =(RC[-16]*RC[-15]-RC[-13]*RC[-12])/1000 -> #VALUE! | W55: =RC[-2]*RC[-10]/1000 -> #VALUE! | X55: =ABS((RC[-3]*RC[-11]-RC[-2]*RC[-9])/1000) -> #VALUE! | Y55: =(RC[-14]-RC[1])/RC[-18]*100 -> #VALUE! | Z55: =RC[-5]+RC[-4] -> #VALUE! | AC55: =VALUE(RC[-27]) -> #VALUE! | AD55: =IF(RC[21]=42,"*",IF(RC[21]=32,"",RC[21])) ->  | AE55: =RC[-28] ->  | AF55: =RC[-28] ->  | AG55: =RC[-28] ->  | AH55: =RC[-28] ->  | AI55: =RC[-28] ->  | AJ55: =RC[-28] ->  | AK55: =RC[-28] ->  | AL55: =RC[-28] -> 0 | AM55: =RC[-28] ->  | AN55: =RC[-28] ->  | AO55: =RC[-28] ->  | AP55: - | AQ55: =RC[-29] ->  | AR55: =RC[-29] ->  | AS55: - | AT55: =RC[-30] -> - | AU55: =RC[-30] ->  | AV55: =RC[-30] ->  | AW55: =RC[-30] -> 
A56: =IF(RC[1]="","",DATEVALUE(RC[1])) ->  | P56: =IF(AND(ISNUMBER(RC[-3]),ISNUMBER(RC[-1])),RC[-3]-RC[-1],"-") -> - | T56: =(RC[-16]*RC[-15]-RC[-13]*RC[-12])/1000 -> #VALUE! | W56: =RC[-2]*RC[-10]/1000 -> #VALUE! | X56: =ABS((RC[-3]*RC[-11]-RC[-2]*RC[-9])/1000) -> #VALUE! | Y56: =(RC[-14]-RC[1])/RC[-18]*100 -> #VALUE! | Z56: =RC[-5]+RC[-4] -> #VALUE! | AC56: =VALUE(RC[-27]) -> #VALUE! | AD56: =IF(RC[21]=42,"*",IF(RC[21]=32,"",RC[21])) ->  | AE56: =RC[-28] ->  | AF56: =RC[-28] ->  | AG56: =RC[-28] ->  | AH56: =RC[-28] ->  | AI56: =RC[-28] ->  | AJ56: =RC[-28] ->  | AK56: =RC[-28] ->  | AL56: =RC[-28] -> 0 | AM56: =RC[-28] ->  | AN56: =RC[-28] ->  | AO56: =RC[-28] ->  | AP56: - | AQ56: =RC[-29] ->  | AR56: =RC[-29] ->  | AS56: - | AT56: =RC[-30] -> - | AU56: =RC[-30] ->  | AV56: =RC[-30] ->  | AW56: =RC[-30] -> 
A57: =IF(RC[1]="","",DATEVALUE(RC[1])) ->  | P57: =IF(AND(ISNUMBER(RC[-3]),ISNUMBER(RC[-1])),RC[-3]-RC[-1],"-") -> - | T57: =(RC[-16]*RC[-15]-RC[-13]*RC[-12])/1000 -> #VALUE! | W57: =RC[-2]*RC[-10]/1000 -> #VALUE! | X57: =ABS((RC[-3]*RC[-11]-RC[-2]*RC[-9])/1000) -> #VALUE! | Y57: =(RC[-14]-RC[1])/RC[-18]*100 -> #VALUE! | Z57: =RC[-5]+RC[-4] -> #VALUE! | AC57: =VALUE(RC[-27]) -> #VALUE! | AD57: =IF(RC[21]=42,"*",IF(RC[21]=32,"",RC[21])) ->  | AE57: =RC[-28] ->  | AF57: =RC[-28] ->  | AG57: =RC[-28] ->  | AH57: =RC[-28] ->  | AI57: =RC[-28] ->  | AJ57: =RC[-28] ->  | AK57: =RC[-28] ->  | AL57: =RC[-28] -> 0 | AM57: =RC[-28] ->  | AN57: =RC[-28] ->  | AO57: =RC[-28] ->  | AP57: - | AQ57: =RC[-29] ->  | AR57: =RC[-29] ->  | AS57: - | AT57: =RC[-30] -> - | AU57: =RC[-30] ->  | AV57: =RC[-30] ->  | AW57: =RC[-30] -> 
A58: =IF(RC[1]="","",DATEVALUE(RC[1])) ->  | P58: =IF(AND(ISNUMBER(RC[-3]),ISNUMBER(RC[-1])),RC[-3]-RC[-1],"-") -> - | T58: =(RC[-16]*RC[-15]-RC[-13]*RC[-12])/1000 -> #VALUE! | W58: =RC[-2]*RC[-10]/1000 -> #VALUE! | X58: =ABS((RC[-3]*RC[-11]-RC[-2]*RC[-9])/1000) -> #VALUE! | Y58: =(RC[-14]-RC[1])/RC[-18]*100 -> #VALUE! | Z58: =RC[-5]+RC[-4] -> #VALUE! | AC58: =VALUE(RC[-27]) -> #VALUE! | AD58: =IF(RC[21]=42,"*",IF(RC[21]=32,"",RC[21])) ->  | AE58: =RC[-28] ->  | AF58: =RC[-28] ->  | AG58: =RC[-28] ->  | AH58: =RC[-28] ->  | AI58: =RC[-28] ->  | AJ58: =RC[-28] ->  | AK58: =RC[-28] ->  | AL58: =RC[-28] -> 0 | AM58: =RC[-28] ->  | AN58: =RC[-28] ->  | AO58: =RC[-28] ->  | AP58: - | AQ58: =RC[-29] ->  | AR58: =RC[-29] ->  | AS58: - | AT58: =RC[-30] -> - | AU58: =RC[-30] ->  | AV58: =RC[-30] ->  | AW58: =RC[-30] -> 
A59: =IF(RC[1]="","",DATEVALUE(RC[1])) ->  | P59: =IF(AND(ISNUMBER(RC[-3]),ISNUMBER(RC[-1])),RC[-3]-RC[-1],"-") -> - | T59: =(RC[-16]*RC[-15]-RC[-13]*RC[-12])/1000 -> #VALUE! | W59: =RC[-2]*RC[-10]/1000 -> #VALUE! | X59: =ABS((RC[-3]*RC[-11]-RC[-2]*RC[-9])/1000) -> #VALUE! | Y59: =(RC[-14]-RC[1])/RC[-18]*100 -> #VALUE! | Z59: =RC[-5]+RC[-4] -> #VALUE! | AC59: =VALUE(RC[-27]) -> #VALUE! | AD59: =IF(RC[21]=42,"*",IF(RC[21]=32,"",RC[21])) ->  | AE59: =RC[-28] ->  | AF59: =RC[-28] ->  | AG59: =RC[-28] ->  | AH59: =RC[-28] ->  | AI59: =RC[-28] ->  | AJ59: =RC[-28] ->  | AK59: =RC[-28] ->  | AL59: =RC[-28] -> 0 | AM59: =RC[-28] ->  | AN59: =RC[-28] ->  | AO59: =RC[-28] ->  | AP59: - | AQ59: =RC[-29] ->  | AR59: =RC[-29] ->  | AS59: - | AT59: =RC[-30] -> - | AU59: =RC[-30] ->  | AV59: =RC[-30] ->  | AW59: =RC[-30] -> 
A60: =IF(RC[1]="","",DATEVALUE(RC[1])) ->  | P60: =IF(AND(ISNUMBER(RC[-3]),ISNUMBER(RC[-1])),RC[-3]-RC[-1],"-") -> - | T60: =(RC[-16]*RC[-15]-RC[-13]*RC[-12])/1000 -> #VALUE! | W60: =RC[-2]*RC[-10]/1000 -> #VALUE! | X60: =ABS((RC[-3]*RC[-11]-RC[-2]*RC[-9])/1000) -> #VALUE! | Y60: =(RC[-14]-RC[1])/RC[-18]*100 -> #VALUE! | Z60: =RC[-5]+RC[-4] -> #VALUE! | AC60: =VALUE(RC[-27]) -> #VALUE! | AD60: =IF(RC[21]=42,"*",IF(RC[21]=32,"",RC[21])) ->  | AE60: =RC[-28] ->  | AF60: =RC[-28] ->  | AG60: =RC[-28] ->  | AH60: =RC[-28] ->  | AI60: =RC[-28] ->  | AJ60: =RC[-28] ->  | AK60: =RC[-28] ->  | AL60: =RC[-28] -> 0 | AM60: =RC[-28] ->  | AN60: =RC[-28] ->  | AO60: =RC[-28] ->  | AP60: - | AQ60: =RC[-29] ->  | AR60: =RC[-29] ->  | AS60: - | AT60: =RC[-30] -> - | AU60: =RC[-30] ->  | AV60: =RC[-30] ->  | AW60: =RC[-30] -> 
A61: =IF(RC[1]="","",DATEVALUE(RC[1])) ->  | P61: =IF(AND(ISNUMBER(RC[-3]),ISNUMBER(RC[-1])),RC[-3]-RC[-1],"-") -> - | T61: =(RC[-16]*RC[-15]-RC[-13]*RC[-12])/1000 -> #VALUE! | W61: =RC[-2]*RC[-10]/1000 -> #VALUE! | X61: =ABS((RC[-3]*RC[-11]-RC[-2]*RC[-9])/1000) -> #VALUE! | Y61: =(RC[-14]-RC[1])/RC[-18]*100 -> #VALUE! | Z61: =RC[-5]+RC[-4] -> #VALUE! | AC61: =VALUE(RC[-27]) -> #VALUE! | AD61: =IF(RC[21]=42,"*",IF(RC[21]=32,"",RC[21])) ->  | AE61: =RC[-28] ->  | AF61: =RC[-28] ->  | AG61: =RC[-28] ->  | AH61: =RC[-28] ->  | AI61: =RC[-28] ->  | AJ61: =RC[-28] ->  | AK61: =RC[-28] ->  | AL61: =RC[-28] -> 0 | AM61: =RC[-28] ->  | AN61: =RC[-28] ->  | AO61: =RC[-28] ->  | AP61: - | AQ61: =RC[-29] ->  | AR61: =RC[-29] ->  | AS61: - | AT61: =RC[-30] -> - | AU61: =RC[-30] ->  | AV61: =RC[-30] ->  | AW61: =RC[-30] -> 
A62: =IF(RC[1]="","",DATEVALUE(RC[1])) ->  | P62: =IF(AND(ISNUMBER(RC[-3]),ISNUMBER(RC[-1])),RC[-3]-RC[-1],"-") -> - | T62: =(RC[-16]*RC[-15]-RC[-13]*RC[-12])/1000 -> #VALUE! | W62: =RC[-2]*RC[-10]/1000 -> #VALUE! | X62: =ABS((RC[-3]*RC[-11]-RC[-2]*RC[-9])/1000) -> #VALUE! | Y62: =(RC[-14]-RC[1])/RC[-18]*100 -> #VALUE! | Z62: =RC[-5]+RC[-4] -> #VALUE! | AC62: =VALUE(RC[-27]) -> #VALUE! | AD62: =IF(RC[21]=42,"*",IF(RC[21]=32,"",RC[21])) ->  | AE62: =RC[-28] ->  | AF62: =RC[-28] ->  | AG62: =RC[-28] ->  | AH62: =RC[-28] ->  | AI62: =RC[-28] ->  | AJ62: =RC[-28] ->  | AK62: =RC[-28] ->  | AL62: =RC[-28] -> 0 | AM62: =RC[-28] ->  | AN62: =RC[-28] ->  | AO62: =RC[-28] ->  | AP62: - | AQ62: =RC[-29] ->  | AR62: =RC[-29] ->  | AS62: - | AT62: =RC[-30] -> - | AU62: =RC[-30] ->  | AV62: =RC[-30] ->  | AW62: =RC[-30] -> 
A63: =IF(RC[1]="","",DATEVALUE(RC[1])) ->  | P63: =IF(AND(ISNUMBER(RC[-3]),ISNUMBER(RC[-1])),RC[-3]-RC[-1],"-") -> - | T63: =(RC[-16]*RC[-15]-RC[-13]*RC[-12])/1000 -> #VALUE! | W63: =RC[-2]*RC[-10]/1000 -> #VALUE! | X63: =ABS((RC[-3]*RC[-11]-RC[-2]*RC[-9])/1000) -> #VALUE! | Y63: =(RC[-14]-RC[1])/RC[-18]*100 -> #VALUE! | Z63: =RC[-5]+RC[-4] -> #VALUE! | AC63: =VALUE(RC[-27]) -> #VALUE! | AD63: =IF(RC[21]=42,"*",IF(RC[21]=32,"",RC[21])) ->  | AE63: =RC[-28] ->  | AF63: =RC[-28] ->  | AG63: =RC[-28] ->  | AH63: =RC[-28] ->  | AI63: =RC[-28] ->  | AJ63: =RC[-28] ->  | AK63: =RC[-28] ->  | AL63: =RC[-28] -> 0 | AM63: =RC[-28] ->  | AN63: =RC[-28] ->  | AO63: =RC[-28] ->  | AP63: - | AQ63: =RC[-29] ->  | AR63: =RC[-29] ->  | AS63: - | AT63: =RC[-30] -> - | AU63: =RC[-30] ->  | AV63: =RC[-30] ->  | AW63: =RC[-30] -> 
A64: =IF(RC[1]="","",DATEVALUE(RC[1])) ->  | P64: =IF(AND(ISNUMBER(RC[-3]),ISNUMBER(RC[-1])),RC[-3]-RC[-1],"-") -> - | T64: =(RC[-16]*RC[-15]-RC[-13]*RC[-12])/1000 -> #VALUE! | W64: =RC[-2]*RC[-10]/1000 -> #VALUE! | X64: =ABS((RC[-3]*RC[-11]-RC[-2]*RC[-9])/1000) -> #VALUE! | Y64: =(RC[-14]-RC[1])/RC[-18]*100 -> #VALUE! | Z64: =RC[-5]+RC[-4] -> #VALUE! | AC64: =VALUE(RC[-27]) -> #VALUE! | AD64: =IF(RC[21]=42,"*",IF(RC[21]=32,"",RC[21])) ->  | AE64: =RC[-28] ->  | AF64: =RC[-28] ->  | AG64: =RC[-28] ->  | AH64: =RC[-28] ->  | AI64: =RC[-28] ->  | AJ64: =RC[-28] ->  | AK64: =RC[-28] ->  | AL64: =RC[-28] -> 0 | AM64: =RC[-28] ->  | AN64: =RC[-28] ->  | AO64: =RC[-28] ->  | AP64: - | AQ64: =RC[-29] ->  | AR64: =RC[-29] ->  | AS64: - | AT64: =RC[-30] -> - | AU64: =RC[-30] ->  | AV64: =RC[-30] ->  | AW64: =RC[-30] -> 
A65: =IF(RC[1]="","",DATEVALUE(RC[1])) ->  | P65: =IF(AND(ISNUMBER(RC[-3]),ISNUMBER(RC[-1])),RC[-3]-RC[-1],"-") -> - | T65: =(RC[-16]*RC[-15]-RC[-13]*RC[-12])/1000 -> #VALUE! | W65: =RC[-2]*RC[-10]/1000 -> #VALUE! | X65: =ABS((RC[-3]*RC[-11]-RC[-2]*RC[-9])/1000) -> #VALUE! | Y65: =(RC[-14]-RC[1])/RC[-18]*100 -> #VALUE! | Z65: =RC[-5]+RC[-4] -> #VALUE! | AC65: =VALUE(RC[-27]) -> #VALUE! | AD65: =IF(RC[21]=42,"*",IF(RC[21]=32,"",RC[21])) ->  | AE65: =RC[-28] ->  | AF65: =RC[-28] ->  | AG65: =RC[-28] ->  | AH65: =RC[-28] ->  | AI65: =RC[-28] ->  | AJ65: =RC[-28] ->  | AK65: =RC[-28] ->  | AL65: =RC[-28] -> 0 | AM65: =RC[-28] ->  | AN65: =RC[-28] ->  | AO65: =RC[-28] ->  | AP65: - | AQ65: =RC[-29] ->  | AR65: =RC[-29] ->  | AS65: - | AT65: =RC[-30] -> - | AU65: =RC[-30] ->  | AV65: =RC[-30] ->  | AW65: =RC[-30] -> 
A66: =IF(RC[1]="","",DATEVALUE(RC[1])) ->  | P66: =IF(AND(ISNUMBER(RC[-3]),ISNUMBER(RC[-1])),RC[-3]-RC[-1],"-") -> - | T66: =(RC[-16]*RC[-15]-RC[-13]*RC[-12])/1000 -> #VALUE! | W66: =RC[-2]*RC[-10]/1000 -> #VALUE! | X66: =ABS((RC[-3]*RC[-11]-RC[-2]*RC[-9])/1000) -> #VALUE! | Y66: =(RC[-14]-RC[1])/RC[-18]*100 -> #VALUE! | Z66: =RC[-5]+RC[-4] -> #VALUE! | AC66: =VALUE(RC[-27]) -> #VALUE! | AD66: =IF(RC[21]=42,"*",IF(RC[21]=32,"",RC[21])) ->  | AE66: =RC[-28] ->  | AF66: =RC[-28] ->  | AG66: =RC[-28] ->  | AH66: =RC[-28] ->  | AI66: =RC[-28] ->  | AJ66: =RC[-28] ->  | AK66: =RC[-28] ->  | AL66: =RC[-28] -> 0 | AM66: =RC[-28] ->  | AN66: =RC[-28] ->  | AO66: =RC[-28] ->  | AP66: - | AQ66: =RC[-29] ->  | AR66: =RC[-29] ->  | AS66: - | AT66: =RC[-30] -> - | AU66: =RC[-30] ->  | AV66: =RC[-30] ->  | AW66: =RC[-30] -> 
A67: =IF(RC[1]="","",DATEVALUE(RC[1])) ->  | P67: =IF(AND(ISNUMBER(RC[-3]),ISNUMBER(RC[-1])),RC[-3]-RC[-1],"-") -> - | T67: =(RC[-16]*RC[-15]-RC[-13]*RC[-12])/1000 -> #VALUE! | W67: =RC[-2]*RC[-10]/1000 -> #VALUE! | X67: =ABS((RC[-3]*RC[-11]-RC[-2]*RC[-9])/1000) -> #VALUE! | Y67: =(RC[-14]-RC[1])/RC[-18]*100 -> #VALUE! | Z67: =RC[-5]+RC[-4] -> #VALUE! | AC67: =VALUE(RC[-27]) -> #VALUE! | AD67: =IF(RC[21]=42,"*",IF(RC[21]=32,"",RC[21])) ->  | AE67: =RC[-28] ->  | AF67: =RC[-28] ->  | AG67: =RC[-28] ->  | AH67: =RC[-28] ->  | AI67: =RC[-28] ->  | AJ67: =RC[-28] ->  | AK67: =RC[-28] ->  | AL67: =RC[-28] -> 0 | AM67: =RC[-28] ->  | AN67: =RC[-28] ->  | AO67: =RC[-28] ->  | AP67: - | AQ67: =RC[-29] ->  | AR67: =RC[-29] ->  | AS67: - | AT67: =RC[-30] -> - | AU67: =RC[-30] ->  | AV67: =RC[-30] ->  | AW67: =RC[-30] -> 
A68: =IF(RC[1]="","",DATEVALUE(RC[1])) ->  | P68: =IF(AND(ISNUMBER(RC[-3]),ISNUMBER(RC[-1])),RC[-3]-RC[-1],"-") -> - | T68: =(RC[-16]*RC[-15]-RC[-13]*RC[-12])/1000 -> #VALUE! | W68: =RC[-2]*RC[-10]/1000 -> #VALUE! | X68: =ABS((RC[-3]*RC[-11]-RC[-2]*RC[-9])/1000) -> #VALUE! | Y68: =(RC[-14]-RC[1])/RC[-18]*100 -> #VALUE! | Z68: =RC[-5]+RC[-4] -> #VALUE! | AC68: =VALUE(RC[-27]) -> #VALUE! | AD68: =IF(RC[21]=42,"*",IF(RC[21]=32,"",RC[21])) ->  | AE68: =RC[-28] ->  | AF68: =RC[-28] ->  | AG68: =RC[-28] ->  | AH68: =RC[-28] ->  | AI68: =RC[-28] ->  | AJ68: =RC[-28] ->  | AK68: =RC[-28] ->  | AL68: =RC[-28] -> 0 | AM68: =RC[-28] ->  | AN68: =RC[-28] ->  | AO68: =RC[-28] ->  | AP68: - | AQ68: =RC[-29] ->  | AR68: =RC[-29] ->  | AS68: - | AT68: =RC[-30] -> - | AU68: =RC[-30] ->  | AV68: =RC[-30] ->  | AW68: =RC[-30] -> 
A69: =IF(RC[1]="","",DATEVALUE(RC[1])) ->  | P69: =IF(AND(ISNUMBER(RC[-3]),ISNUMBER(RC[-1])),RC[-3]-RC[-1],"-") -> - | T69: =(RC[-16]*RC[-15]-RC[-13]*RC[-12])/1000 -> #VALUE! | W69: =RC[-2]*RC[-10]/1000 -> #VALUE! | X69: =ABS((RC[-3]*RC[-11]-RC[-2]*RC[-9])/1000) -> #VALUE! | Y69: =(RC[-14]-RC[1])/RC[-18]*100 -> #VALUE! | Z69: =RC[-5]+RC[-4] -> #VALUE! | AC69: =VALUE(RC[-27]) -> #VALUE! | AD69: =IF(RC[21]=42,"*",IF(RC[21]=32,"",RC[21])) ->  | AE69: =RC[-28] ->  | AF69: =RC[-28] ->  | AG69: =RC[-28] ->  | AH69: =RC[-28] ->  | AI69: =RC[-28] ->  | AJ69: =RC[-28] ->  | AK69: =RC[-28] ->  | AL69: =RC[-28] -> 0 | AM69: =RC[-28] ->  | AN69: =RC[-28] ->  | AO69: =RC[-28] ->  | AP69: - | AQ69: =RC[-29] ->  | AR69: =RC[-29] ->  | AS69: - | AT69: =RC[-30] -> - | AU69: =RC[-30] ->  | AV69: =RC[-30] ->  | AW69: =RC[-30] -> 
A70: =IF(RC[1]="","",DATEVALUE(RC[1])) ->  | P70: =IF(AND(ISNUMBER(RC[-3]),ISNUMBER(RC[-1])),RC[-3]-RC[-1],"-") -> - | T70: =(RC[-16]*RC[-15]-RC[-13]*RC[-12])/1000 -> #VALUE! | W70: =RC[-2]*RC[-10]/1000 -> #VALUE! | X70: =ABS((RC[-3]*RC[-11]-RC[-2]*RC[-9])/1000) -> #VALUE! | Y70: =(RC[-14]-RC[1])/RC[-18]*100 -> #VALUE! | Z70: =RC[-5]+RC[-4] -> #VALUE! | AC70: =VALUE(RC[-27]) -> #VALUE! | AD70: =IF(RC[21]=42,"*",IF(RC[21]=32,"",RC[21])) ->  | AE70: =RC[-28] ->  | AF70: =RC[-28] ->  | AG70: =RC[-28] ->  | AH70: =RC[-28] ->  | AI70: =RC[-28] ->  | AJ70: =RC[-28] ->  | AK70: =RC[-28] ->  | AL70: =RC[-28] -> 0 | AM70: =RC[-28] ->  | AN70: =RC[-28] ->  | AO70: =RC[-28] ->  | AP70: - | AQ70: =RC[-29] ->  | AR70: =RC[-29] ->  | AS70: - | AT70: =RC[-30] -> - | AU70: =RC[-30] ->  | AV70: =RC[-30] ->  | AW70: =RC[-30] -> 
A71: =IF(RC[1]="","",DATEVALUE(RC[1])) ->  | P71: =IF(AND(ISNUMBER(RC[-3]),ISNUMBER(RC[-1])),RC[-3]-RC[-1],"-") -> - | T71: =(RC[-16]*RC[-15]-RC[-13]*RC[-12])/1000 -> #VALUE! | W71: =RC[-2]*RC[-10]/1000 -> #VALUE! | X71: =ABS((RC[-3]*RC[-11]-RC[-2]*RC[-9])/1000) -> #VALUE! | Y71: =(RC[-14]-RC[1])/RC[-18]*100 -> #VALUE! | Z71: =RC[-5]+RC[-4] -> #VALUE! | AC71: =VALUE(RC[-27]) -> #VALUE! | AD71: =IF(RC[21]=42,"*",IF(RC[21]=32,"",RC[21])) ->  | AE71: =RC[-28] ->  | AF71: =RC[-28] ->  | AG71: =RC[-28] ->  | AH71: =RC[-28] ->  | AI71: =RC[-28] ->  | AJ71: =RC[-28] ->  | AK71: =RC[-28] ->  | AL71: =RC[-28] -> 0 | AM71: =RC[-28] ->  | AN71: =RC[-28] ->  | AO71: =RC[-28] ->  | AP71: - | AQ71: =RC[-29] ->  | AR71: =RC[-29] ->  | AS71: - | AT71: =RC[-30] -> - | AU71: =RC[-30] ->  | AV71: =RC[-30] ->  | AW71: =RC[-30] -> 
A72: =IF(RC[1]="","",DATEVALUE(RC[1])) ->  | P72: =IF(AND(ISNUMBER(RC[-3]),ISNUMBER(RC[-1])),RC[-3]-RC[-1],"-") -> - | T72: =(RC[-16]*RC[-15]-RC[-13]*RC[-12])/1000 -> #VALUE! | W72: =RC[-2]*RC[-10]/1000 -> #VALUE! | X72: =ABS((RC[-3]*RC[-11]-RC[-2]*RC[-9])/1000) -> #VALUE! | Y72: =(RC[-14]-RC[1])/RC[-18]*100 -> #VALUE! | Z72: =RC[-5]+RC[-4] -> #VALUE! | AC72: =VALUE(RC[-27]) -> #VALUE! | AD72: =IF(RC[21]=42,"*",IF(RC[21]=32,"",RC[21])) ->  | AE72: =RC[-28] ->  | AF72: =RC[-28] ->  | AG72: =RC[-28] ->  | AH72: =RC[-28] ->  | AI72: =RC[-28] ->  | AJ72: =RC[-28] ->  | AK72: =RC[-28] ->  | AL72: =RC[-28] -> 0 | AM72: =RC[-28] ->  | AN72: =RC[-28] ->  | AO72: =RC[-28] ->  | AP72: - | AQ72: =RC[-29] ->  | AR72: =RC[-29] ->  | AS72: - | AT72: =RC[-30] -> - | AU72: =RC[-30] ->  | AV72: =RC[-30] ->  | AW72: =RC[-30] -> 
A73: =IF(RC[1]="","",DATEVALUE(RC[1])) ->  | P73: =IF(AND(ISNUMBER(RC[-3]),ISNUMBER(RC[-1])),RC[-3]-RC[-1],"-") -> - | T73: =(RC[-16]*RC[-15]-RC[-13]*RC[-12])/1000 -> #VALUE! | W73: =RC[-2]*RC[-10]/1000 -> #VALUE! | X73: =ABS((RC[-3]*RC[-11]-RC[-2]*RC[-9])/1000) -> #VALUE! | Y73: =(RC[-14]-RC[1])/RC[-18]*100 -> #VALUE! | Z73: =RC[-5]+RC[-4] -> #VALUE! | AC73: =VALUE(RC[-27]) -> #VALUE! | AD73: =IF(RC[21]=42,"*",IF(RC[21]=32,"",RC[21])) ->  | AE73: =RC[-28] ->  | AF73: =RC[-28] ->  | AG73: =RC[-28] ->  | AH73: =RC[-28] ->  | AI73: =RC[-28] ->  | AJ73: =RC[-28] ->  | AK73: =RC[-28] ->  | AL73: =RC[-28] -> 0 | AM73: =RC[-28] ->  | AN73: =RC[-28] ->  | AO73: =RC[-28] ->  | AP73: - | AQ73: =RC[-29] ->  | AR73: =RC[-29] ->  | AS73: - | AT73: =RC[-30] -> - | AU73: =RC[-30] ->  | AV73: =RC[-30] ->  | AW73: =RC[-30] -> 
A74: =IF(RC[1]="","",DATEVALUE(RC[1])) ->  | P74: =IF(AND(ISNUMBER(RC[-3]),ISNUMBER(RC[-1])),RC[-3]-RC[-1],"-") -> - | T74: =(RC[-16]*RC[-15]-RC[-13]*RC[-12])/1000 -> #VALUE! | W74: =RC[-2]*RC[-10]/1000 -> #VALUE! | X74: =ABS((RC[-3]*RC[-11]-RC[-2]*RC[-9])/1000) -> #VALUE! | Y74: =(RC[-14]-RC[1])/RC[-18]*100 -> #VALUE! | Z74: =RC[-5]+RC[-4] -> #VALUE! | AC74: =VALUE(RC[-27]) -> #VALUE! | AD74: =IF(RC[21]=42,"*",IF(RC[21]=32,"",RC[21])) ->  | AE74: =RC[-28] ->  | AF74: =RC[-28] ->  | AG74: =RC[-28] ->  | AH74: =RC[-28] ->  | AI74: =RC[-28] ->  | AJ74: =RC[-28] ->  | AK74: =RC[-28] ->  | AL74: =RC[-28] -> 0 | AM74: =RC[-28] ->  | AN74: =RC[-28] ->  | AO74: =RC[-28] ->  | AP74: - | AQ74: =RC[-29] ->  | AR74: =RC[-29] ->  | AS74: - | AT74: =RC[-30] -> - | AU74: =RC[-30] ->  | AV74: =RC[-30] ->  | AW74: =RC[-30] -> 
A75: =IF(RC[1]="","",DATEVALUE(RC[1])) ->  | P75: =IF(AND(ISNUMBER(RC[-3]),ISNUMBER(RC[-1])),RC[-3]-RC[-1],"-") -> - | T75: =(RC[-16]*RC[-15]-RC[-13]*RC[-12])/1000 -> #VALUE! | W75: =RC[-2]*RC[-10]/1000 -> #VALUE! | X75: =ABS((RC[-3]*RC[-11]-RC[-2]*RC[-9])/1000) -> #VALUE! | Y75: =(RC[-14]-RC[1])/RC[-18]*100 -> #VALUE! | Z75: =RC[-5]+RC[-4] -> #VALUE! | AC75: =VALUE(RC[-27]) -> #VALUE! | AD75: =IF(RC[21]=42,"*",IF(RC[21]=32,"",RC[21])) ->  | AE75: =RC[-28] ->  | AF75: =RC[-28] ->  | AG75: =RC[-28] ->  | AH75: =RC[-28] ->  | AI75: =RC[-28] ->  | AJ75: =RC[-28] ->  | AK75: =RC[-28] ->  | AL75: =RC[-28] -> 0 | AM75: =RC[-28] ->  | AN75: =RC[-28] ->  | AO75: =RC[-28] ->  | AP75: - | AQ75: =RC[-29] ->  | AR75: =RC[-29] ->  | AS75: - | AT75: =RC[-30] -> - | AU75: =RC[-30] ->  | AV75: =RC[-30] ->  | AW75: =RC[-30] -> 
A76: =IF(RC[1]="","",DATEVALUE(RC[1])) ->  | P76: =IF(AND(ISNUMBER(RC[-3]),ISNUMBER(RC[-1])),RC[-3]-RC[-1],"-") -> - | T76: =(RC[-16]*RC[-15]-RC[-13]*RC[-12])/1000 -> #VALUE! | W76: =RC[-2]*RC[-10]/1000 -> #VALUE! | X76: =ABS((RC[-3]*RC[-11]-RC[-2]*RC[-9])/1000) -> #VALUE! | Y76: =(RC[-14]-RC[1])/RC[-18]*100 -> #VALUE! | Z76: =RC[-5]+RC[-4] -> #VALUE! | AC76: =VALUE(RC[-27]) -> #VALUE! | AD76: =IF(RC[21]=42,"*",IF(RC[21]=32,"",RC[21])) ->  | AE76: =RC[-28] ->  | AF76: =RC[-28] ->  | AG76: =RC[-28] ->  | AH76: =RC[-28] ->  | AI76: =RC[-28] ->  | AJ76: =RC[-28] ->  | AK76: =RC[-28] ->  | AL76: =RC[-28] -> 0 | AM76: =RC[-28] ->  | AN76: =RC[-28] ->  | AO76: =RC[-28] ->  | AP76: - | AQ76: =RC[-29] ->  | AR76: =RC[-29] ->  | AS76: - | AT76: =RC[-30] -> - | AU76: =RC[-30] ->  | AV76: =RC[-30] ->  | AW76: =RC[-30] -> 
A77: =IF(RC[1]="","",DATEVALUE(RC[1])) ->  | P77: =IF(AND(ISNUMBER(RC[-3]),ISNUMBER(RC[-1])),RC[-3]-RC[-1],"-") -> - | T77: =(RC[-16]*RC[-15]-RC[-13]*RC[-12])/1000 -> #VALUE! | W77: =RC[-2]*RC[-10]/1000 -> #VALUE! | X77: =ABS((RC[-3]*RC[-11]-RC[-2]*RC[-9])/1000) -> #VALUE! | Y77: =(RC[-14]-RC[1])/RC[-18]*100 -> #VALUE! | Z77: =RC[-5]+RC[-4] -> #VALUE! | AC77: =VALUE(RC[-27]) -> #VALUE! | AD77: =IF(RC[21]=42,"*",IF(RC[21]=32,"",RC[21])) ->  | AE77: =RC[-28] ->  | AF77: =RC[-28] ->  | AG77: =RC[-28] ->  | AH77: =RC[-28] ->  | AI77: =RC[-28] ->  | AJ77: =RC[-28] ->  | AK77: =RC[-28] ->  | AL77: =RC[-28] -> 0 | AM77: =RC[-28] ->  | AN77: =RC[-28] ->  | AO77: =RC[-28] ->  | AP77: - | AQ77: =RC[-29] ->  | AR77: =RC[-29] ->  | AS77: - | AT77: =RC[-30] -> - | AU77: =RC[-30] ->  | AV77: =RC[-30] ->  | AW77: =RC[-30] -> 
A78: =IF(RC[1]="","",DATEVALUE(RC[1])) ->  | P78: =IF(AND(ISNUMBER(RC[-3]),ISNUMBER(RC[-1])),RC[-3]-RC[-1],"-") -> - | T78: =(RC[-16]*RC[-15]-RC[-13]*RC[-12])/1000 -> #VALUE! | W78: =RC[-2]*RC[-10]/1000 -> #VALUE! | X78: =ABS((RC[-3]*RC[-11]-RC[-2]*RC[-9])/1000) -> #VALUE! | Y78: =(RC[-14]-RC[1])/RC[-18]*100 -> #VALUE! | Z78: =RC[-5]+RC[-4] -> #VALUE! | AC78: =VALUE(RC[-27]) -> #VALUE! | AD78: =IF(RC[21]=42,"*",IF(RC[21]=32,"",RC[21])) ->  | AE78: =RC[-28] ->  | AF78: =RC[-28] ->  | AG78: =RC[-28] ->  | AH78: =RC[-28] ->  | AI78: =RC[-28] ->  | AJ78: =RC[-28] ->  | AK78: =RC[-28] ->  | AL78: =RC[-28] -> 0 | AM78: =RC[-28] ->  | AN78: =RC[-28] ->  | AO78: =RC[-28] ->  | AP78: - | AQ78: =RC[-29] ->  | AR78: =RC[-29] ->  | AS78: - | AT78: =RC[-30] -> - | AU78: =RC[-30] ->  | AV78: =RC[-30] ->  | AW78: =RC[-30] -> 
A79: =IF(RC[1]="","",DATEVALUE(RC[1])) ->  | P79: =IF(AND(ISNUMBER(RC[-3]),ISNUMBER(RC[-1])),RC[-3]-RC[-1],"-") -> - | T79: =(RC[-16]*RC[-15]-RC[-13]*RC[-12])/1000 -> #VALUE! | W79: =RC[-2]*RC[-10]/1000 -> #VALUE! | X79: =ABS((RC[-3]*RC[-11]-RC[-2]*RC[-9])/1000) -> #VALUE! | Y79: =(RC[-14]-RC[1])/RC[-18]*100 -> #VALUE! | Z79: =RC[-5]+RC[-4] -> #VALUE! | AC79: =VALUE(RC[-27]) -> #VALUE! | AD79: =IF(RC[21]=42,"*",IF(RC[21]=32,"",RC[21])) ->  | AE79: =RC[-28] ->  | AF79: =RC[-28] ->  | AG79: =RC[-28] ->  | AH79: =RC[-28] ->  | AI79: =RC[-28] ->  | AJ79: =RC[-28] ->  | AK79: =RC[-28] ->  | AL79: =RC[-28] -> 0 | AM79: =RC[-28] ->  | AN79: =RC[-28] ->  | AO79: =RC[-28] ->  | AP79: - | AQ79: =RC[-29] ->  | AR79: =RC[-29] ->  | AS79: - | AT79: =RC[-30] -> - | AU79: =RC[-30] ->  | AV79: =RC[-30] ->  | AW79: =RC[-30] -> 
A80: =IF(RC[1]="","",DATEVALUE(RC[1])) ->  | P80: =IF(AND(ISNUMBER(RC[-3]),ISNUMBER(RC[-1])),RC[-3]-RC[-1],"-") -> - | T80: =(RC[-16]*RC[-15]-RC[-13]*RC[-12])/1000 -> #VALUE! | W80: =RC[-2]*RC[-10]/1000 -> #VALUE! | X80: =ABS((RC[-3]*RC[-11]-RC[-2]*RC[-9])/1000) -> #VALUE! | Y80: =(RC[-14]-RC[1])/RC[-18]*100 -> #VALUE! | Z80: =RC[-5]+RC[-4] -> #VALUE! | AC80: =VALUE(RC[-27]) -> #VALUE! | AD80: =IF(RC[21]=42,"*",IF(RC[21]=32,"",RC[21])) ->  | AE80: =RC[-28] ->  | AF80: =RC[-28] ->  | AG80: =RC[-28] ->  | AH80: =RC[-28] ->  | AI80: =RC[-28] ->  | AJ80: =RC[-28] ->  | AK80: =RC[-28] ->  | AL80: =RC[-28] -> 0 | AM80: =RC[-28] ->  | AN80: =RC[-28] ->  | AO80: =RC[-28] ->  | AP80: - | AQ80: =RC[-29] ->  | AR80: =RC[-29] ->  | AS80: - | AT80: =RC[-30] -> - | AU80: =RC[-30] ->  | AV80: =RC[-30] ->  | AW80: =RC[-30] -> 
A81: =IF(RC[1]="","",DATEVALUE(RC[1])) ->  | P81: =IF(AND(ISNUMBER(RC[-3]),ISNUMBER(RC[-1])),RC[-3]-RC[-1],"-") -> - | T81: =(RC[-16]*RC[-15]-RC[-13]*RC[-12])/1000 -> #VALUE! | W81: =RC[-2]*RC[-10]/1000 -> #VALUE! | X81: =ABS((RC[-3]*RC[-11]-RC[-2]*RC[-9])/1000) -> #VALUE! | Y81: =(RC[-14]-RC[1])/RC[-18]*100 -> #VALUE! | Z81: =RC[-5]+RC[-4] -> #VALUE! | AC81: =VALUE(RC[-27]) -> #VALUE! | AD81: =IF(RC[21]=42,"*",IF(RC[21]=32,"",RC[21])) ->  | AE81: =RC[-28] ->  | AF81: =RC[-28] ->  | AG81: =RC[-28] ->  | AH81: =RC[-28] ->  | AI81: =RC[-28] ->  | AJ81: =RC[-28] ->  | AK81: =RC[-28] ->  | AL81: =RC[-28] -> 0 | AM81: =RC[-28] ->  | AN81: =RC[-28] ->  | AO81: =RC[-28] ->  | AP81: - | AQ81: =RC[-29] ->  | AR81: =RC[-29] ->  | AS81: - | AT81: =RC[-30] -> - | AU81: =RC[-30] ->  | AV81: =RC[-30] ->  | AW81: =RC[-30] -> 
A82: =IF(RC[1]="","",DATEVALUE(RC[1])) ->  | P82: =IF(AND(ISNUMBER(RC[-3]),ISNUMBER(RC[-1])),RC[-3]-RC[-1],"-") -> - | T82: =(RC[-16]*RC[-15]-RC[-13]*RC[-12])/1000 -> #VALUE! | W82: =RC[-2]*RC[-10]/1000 -> #VALUE! | X82: =ABS((RC[-3]*RC[-11]-RC[-2]*RC[-9])/1000) -> #VALUE! | Y82: =(RC[-14]-RC[1])/RC[-18]*100 -> #VALUE! | Z82: =RC[-5]+RC[-4] -> #VALUE! | AC82: =VALUE(RC[-27]) -> #VALUE! | AD82: =IF(RC[21]=42,"*",IF(RC[21]=32,"",RC[21])) ->  | AE82: =RC[-28] ->  | AF82: =RC[-28] ->  | AG82: =RC[-28] ->  | AH82: =RC[-28] ->  | AI82: =RC[-28] ->  | AJ82: =RC[-28] ->  | AK82: =RC[-28] ->  | AL82: =RC[-28] -> 0 | AM82: =RC[-28] ->  | AN82: =RC[-28] ->  | AO82: =RC[-28] ->  | AP82: - | AQ82: =RC[-29] ->  | AR82: =RC[-29] ->  | AS82: - | AT82: =RC[-30] -> - | AU82: =RC[-30] ->  | AV82: =RC[-30] ->  | AW82: =RC[-30] -> 
A83: =IF(RC[1]="","",DATEVALUE(RC[1])) ->  | P83: =IF(AND(ISNUMBER(RC[-3]),ISNUMBER(RC[-1])),RC[-3]-RC[-1],"-") -> - | T83: =(RC[-16]*RC[-15]-RC[-13]*RC[-12])/1000 -> #VALUE! | W83: =RC[-2]*RC[-10]/1000 -> #VALUE! | X83: =ABS((RC[-3]*RC[-11]-RC[-2]*RC[-9])/1000) -> #VALUE! | Y83: =(RC[-14]-RC[1])/RC[-18]*100 -> #VALUE! | Z83: =RC[-5]+RC[-4] -> #VALUE! | AC83: =VALUE(RC[-27]) -> #VALUE! | AD83: =IF(RC[21]=42,"*",IF(RC[21]=32,"",RC[21])) ->  | AE83: =RC[-28] ->  | AF83: =RC[-28] ->  | AG83: =RC[-28] ->  | AH83: =RC[-28] ->  | AI83: =RC[-28] ->  | AJ83: =RC[-28] ->  | AK83: =RC[-28] ->  | AL83: =RC[-28] -> 0 | AM83: =RC[-28] ->  | AN83: =RC[-28] ->  | AO83: =RC[-28] ->  | AP83: - | AQ83: =RC[-29] ->  | AR83: =RC[-29] ->  | AS83: - | AT83: =RC[-30] -> - | AU83: =RC[-30] ->  | AV83: =RC[-30] ->  | AW83: =RC[-30] -> 
AC84: Среднее | AF84: =R[1]C[-28] -> 54.728774666666673 | AG84: =R[1]C[-28] -> 67.647455433333334 | AH84: =R[1]C[-28] -> 8.276756599999997 | AI84: =R[1]C[-28] -> 41.888053999999997 | AJ84: =R[1]C[-28] -> 32.94958986666667 | AK84: =R[1]C[-28] -> 5.6812477666666688 | AL84: =R[1]C[-28] -> 34.697865566666671 | AM84: =R[1]C[-28] -> 12.840719900000003 | AN84: =R[1]C[-28] -> 3.6784205000000005 | AO84: =R[1]C[-28] -> 66.841691999999981 | AP84: - | AQ84: =R[1]C[-29] -> 9.5205373999999985 | AR84: =R[1]C[-29] -> 66.922323733333329 | AS84: - | AT84: =R[1]C[-30] -> -8.0631733333334191E-2 | AU84: =R[1]C[-30] -> 13.198957899999995
B85: Среднее | D85: =AVERAGE(OFFSET(R[-74]C,3,0,R7C1,1)) -> 54.728774666666673 | E85: =AVERAGE(OFFSET(R[-74]C,3,0,R7C1,1)) -> 67.647455433333334 | F85: =AVERAGE(OFFSET(R[-74]C,3,0,R7C1,1)) -> 8.276756599999997 | G85: =AVERAGE(OFFSET(R[-74]C,3,0,R7C1,1)) -> 41.888053999999997 | H85: =AVERAGE(OFFSET(R[-74]C,3,0,R7C1,1)) -> 32.94958986666667 | I85: =AVERAGE(OFFSET(R[-74]C,3,0,R7C1,1)) -> 5.6812477666666688 | J85: =AVERAGE(OFFSET(R[-74]C,3,0,R7C1,1)) -> 34.697865566666671 | K85: =AVERAGE(OFFSET(R[-74]C,3,0,R7C1,1)) -> 12.840719900000003 | L85: =IF(SUM(OFFSET(R[-74]C,3,0,R7C1,1))=0,"",AVERAGE(OFFSET(R[-74]C,3,0,R7C1,1))) -> 3.6784205000000005 | M85: =IF(SUM(OFFSET(R[-74]C,3,0,R7C1,1))=0,"",AVERAGE(OFFSET(R[-74]C,3,0,R7C1,1))) -> 66.841691999999981 | N85: =IF(SUM(OFFSET(R[-74]C,3,0,R7C1,1))=0,"",AVERAGE(OFFSET(R[-74]C,3,0,R7C1,1))) -> 9.5205373999999985 | O85: =IF(SUM(OFFSET(R[-74]C,3,0,R7C1,1))=0,"",AVERAGE(OFFSET(R[-74]C,3,0,R7C1,1))) -> 66.922323733333329 | P85: =IF(SUM(OFFSET(R[-74]C,3,0,R7C1,1))=0,"",AVERAGE(OFFSET(R[-74]C,3,0,R7C1,1))) -> -8.0631733333334191E-2 | Q85: =IF(SUM(OFFSET(R[-74]C,3,0,R7C1,1))=0,"",AVERAGE(OFFSET(R[-74]C,3,0,R7C1,1))) -> 13.198957899999995 | R85: =IF(SUM(OFFSET(R[-74]C,3,0,R7C1,1))=0,"",AVERAGE(OFFSET(R[-74]C,3,0,R7C1,1))) -> 0.86543263333333331 | S85: =AVERAGE(OFFSET(R[-74]C,3,0,R7C1,1)) -> 2.2873573666666664 | T85: =AVERAGE(OFFSET(R[-74]C,3,0,R7C1,1)) -> 2.2859049759149732 | W85: =AVERAGE(OFFSET(R[-74]C,3,0,R7C1,1)) -> 0.24073834820366755 | X85: =AVERAGE(OFFSET(R[-74]C,3,0,R7C1,1)) -> 0.38330092699308699 | AC85: Итого | AE85: =R[1]C[-28] -> 720 | AF85: =R[1]C[-28] -> 1641.8632400000001 | AI85: =R[1]C[-28] -> 1256.6416199999999 | AM85: =R[1]C[-28] -> 385.22159700000009 | AN85: =R[1]C[-28] -> 110.35261500000001 | AQ85: =R[1]C[-29] -> 285.61612199999996 | AU85: =R[1]C[-30] -> 395.96873699999986 | AV85: =R[1]C[-30] -> 25.962979000000001 | AW85: =R[1]C[-30] -> 68.620720999999989
B86: ИТОГО: | C86: =SUM(OFFSET(R[-75]C,3,0,R7C1,1)) -> 720 | D86: =SUM(OFFSET(R[-75]C,3,0,R7C1,1)) -> 1641.8632400000001 | G86: =SUM(OFFSET(R[-75]C,3,0,R7C1,1)) -> 1256.6416199999999 | K86: =SUM(OFFSET(R[-75]C,3,0,R7C1,1)) -> 385.22159700000009 | L86: =IF(SUM(OFFSET(R[-75]C,3,0,R7C1,1))=0,"",SUM(OFFSET(R[-75]C,3,0,R7C1,1))) -> 110.35261500000001 | N86: =IF(SUM(OFFSET(R[-75]C,3,0,R7C1,1))=0,"",SUM(OFFSET(R[-75]C,3,0,R7C1,1))) -> 285.61612199999996 | Q86: =IF(SUM(OFFSET(R[-75]C,3,0,R7C1,1))=0,"",SUM(OFFSET(R[-75]C,3,0,R7C1,1))) -> 395.96873699999986 | R86: =IF(SUM(OFFSET(R[-75]C,3,0,R7C1,1))=0,"",SUM(OFFSET(R[-75]C,3,0,R7C1,1))) -> 25.962979000000001 | S86: =SUM(OFFSET(R[-75]C,3,0,R7C1,1)) -> 68.620720999999989 | T86: =SUM(OFFSET(R[-75]C,3,0,R7C1,1)) -> 68.577149277449195 | W86: =SUM(OFFSET(R[-75]C,3,0,R7C1,1)) -> 7.2221504461100263 | X86: =SUM(OFFSET(R[-75]C,3,0,R7C1,1)) -> 11.49902780979261
AC87: Досчёт | AF87: =R[1]C[-28] -> 0 | AI87: =R[1]C[-28] -> 0 | AM87: =R[1]C[-28] -> 0 | AN87: =R[1]C[-28] -> 0 | AQ87: =R[1]C[-29] -> 0 | AU87: =R[1]C[-30] -> 0 | AV87: =R[1]C[-30] -> 0 | AW87: =R[1]C[-30] -> 0
A88: 11дн=264ч 4дн=96ч | B88: Досчёт до конца м-ца (+) | C88: =R6C1*24 -> 216 | T88: № 5514 | AC88: Снятие | AF88: =-R[1]C[-28] -> 0 | AI88: =-R[1]C[-28] -> 0 | AM88: =-R[1]C[-28] -> 0 | AN88: =-R[1]C[-28] -> 0 | AQ88: =-R[1]C[-29] -> 0 | AU88: =-R[1]C[-30] -> 0 | AV88: =-R[1]C[-30] -> 0 | AW88: =-R[1]C[-30] -> 0
A89: 9дн=216ч 7дн=168ч | B89: Вычет с предыдущего (-) | C89: =R4C1*24 -> 192 | AC89: Сумма | AF89: =R[1]C[-28] -> 1641.8632400000001 | AI89: =R[1]C[-28] -> 1256.6416199999999 | AM89: =R[1]C[-28] -> 385.22159700000009 | AN89: =R[1]C[-28] -> 110.35261500000001 | AQ89: =R[1]C[-29] -> 285.61612199999996 | AU89: =R[1]C[-30] -> 395.96873699999986 | AV89: =R[1]C[-30] -> 25.962979000000001 | AW89: =R[1]C[-30] -> 68.620720999999989
B90: СУММА: | C90: =R[-4]C+R[-2]C-R[-1]C -> 744 | D90: =R[-4]C+R[-2]C-R[-1]C -> 1641.8632400000001 | G90: =R[-4]C+R[-2]C-R[-1]C -> 1256.6416199999999 | K90: =R[-4]C+R[-2]C-R[-1]C -> 385.22159700000009 | L90: =IF(SUM(OFFSET(R[-79]C,3,0,R7C1,1))=0,"",(R[-4]C+R[-2]C-R[-1]C)) -> 110.35261500000001 | N90: =IF(SUM(OFFSET(R[-79]C,3,0,R7C1,1))=0,"",(R[-4]C+R[-2]C-R[-1]C)) -> 285.61612199999996 | Q90: =IF(SUM(OFFSET(R[-79]C,3,0,R7C1,1))=0,"",(R[-4]C+R[-2]C-R[-1]C)) -> 395.96873699999986 | R90: =IF(SUM(OFFSET(R[-79]C,3,0,R7C1,1))=0,"",(R[-4]C+R[-2]C-R[-1]C)) -> 25.962979000000001 | S90: =R[-4]C+R[-2]C-R[-1]C -> 68.620720999999989
AC91: Тхв на источнике | AE91: V гвс (м3) | AF91: =R[-2]C[15] -> 395.96873699999986 | AG91: W гвс (Гкал) | AH91: =RC[-2]*0.06 -> 23.758124219999992 | AI91: W без гвс (Гкал) | AJ91: =R[-2]C[13]-RC[-2] -> 44.862596779999997
B92: Показания счетчиков на момент снятия данных:
B93: Дата, время | D93: М1, т | F93: М2, т | H93: М3, т | J93: М4, т | L93: Qо, Гкал | N93: Qг, Гкал | P93: время, час
B94: 23.09.18 04:00 | D94: 17802.48012 | F94: 15302.819879999999 | H94: 662.59743000000003 | J94: 1888.5916999999999 | L94: 551.94942000000003 | N94: 189.64588000000001 | P94: -
B95: 23.10.18 03:00 | D95: 19453.777610000001 | F95: 16567.404180000001 | H95: 770.99928 | J95: 2169.7076900000002 | L95: 620.98631999999998 | N95: 215.72120000000001 | P95: -
AC97: =ZAYAVKA_N -> з.н д. №02/147-2783 от 04.10.18 В данном отчете ГВС суммируется
B98: Представитель потребителя:_______________________________________________________________________ В.О. Топорков
I101: Рекомендуемые значения по параметрам теплопотребления (не являются официально утверждёнными)
I102: М, т | J102: V, м3 | K102: Qгвс, Гкал | L102: Qотоп, Гкал | M102: Qо, Гкал
I103: =R[-13]C[-3] -> 0 | J103: =RC[-1]/0.98 -> 0 | K103: =RC[-1]*0.06 -> 0 | L103: =RC[1]-RC[-1] -> 25.962979000000001 | M103: =R[-13]C[5] -> 25.962979000000001
O105: ДЛЯ САМОКОНТРОЛЯ
B106: В строке выбора дат указать период с 16.7.13 по 23.8.13 - жильё | N106: Q | O106: Qг
B107: В строке выбора дат указать период с 18.7.13 по 25.8.13 - не жилое | N107: =(R[-21]C[-10]*R[-22]C[-7]-R[-21]C[-9]*R[-22]C[-6])/1000 -> 68.774456057734966 | O107: =IF(R[-22]C[-2]="",R[-21]C[-3]*R[-22]C/1000,"") ->  | P107: Си2
O108: =IF(R[-23]C[-2]="","",((R[-22]C[-3]*R[-23]C)-(R[-22]C[-2]*R[-23]C[2]))/1000) -> 7.3850534258498968 | P108: Си3