Sheet: Лист1
G1: Отчёт о теплопотреблении за октябрь 2018 | M1: 02/147-3648 от 25.10.18
A4: =EOMONTH(R[9]C,0)-R[9]C -> 8 | B4: Потребитель: ЗАО "Сити Сервис"
A5: =MAX(R[9]C:R[78]C) -> 2018-10-22T00:00:00.000 | B5: Адрес: г. СПб, Наличная ул., д.30 Отопление ввод 1
A6: =EOMONTH(R[-1]C,0)-R[-1]C -> 9 | B6: Телефон: 8-911-021-19-79
A7: =R[-2]C-R[6]C -> 30 | B7: Договор 10023-10
A8: 7 | B8: Тепловычислитель: ВКТ-7 № 7554 | L8: М2 мах= | M8: 180 | O8: Мгвс мах= | P8: 0
L9: Qотоп мах= | M9: 13.56 | O9: Qгвс мах= | P9: 0
B10: Расчётная формула: Q=M1*(h1-hхв)-M2*(h2-hхв)
D12: Учёт - ОТОПЛЕНИЕ | M12: Учёт - ГВС
A13: =R[1]C-1 -> 43365 | B13: Дата | C13: N, ч | D13: M1, т | E13: T1, С | F13: P1, кг/см2 | G13: M2, т | H13: T2, С | I13: P2, кг/см2 | J13: dT, гр.C | K13: M1-М2, т | L13: Qотоп, Гкал | M13: V3, м3 | N13: T3, С | O13: V4, м3 | P13: T4, С | Q13: dT, гр.C | R13: V3-V4, м3 | S13: Qгвс, Гкал | T13: Qобщ. | U13: Qo | V13: M3 | W13: M4 | X13: си4 | Y13: си5 | Z13: ТСО | AA13: Внутр. | AD13: Дата | AE13: НС | AF13: n, ч | AG13: М1, т | AH13: t1, гр. С | AI13: Р1, кгс/см2 | AJ13: М2, т | AK13: t2, гр. С | AL13: Р2, кгс/см2 | AM13: t1-t2, гр. С | AN13: М1-М2, т | AO13: Wотоп, Гкал | AP13: М1гвс, т | AQ13: t1гвс, гр. С | AR13: Р1гвс, кгс/см2 | AS13: М2гвс, т | AT13: t2гвс, гр. С | AU13: Р2гвс, кгс/см2 | AV13: t1гвс-t2гвс | AW13: М1гвс-М2гвс, т | AX13: Wгвс, Гкал | AY13: Wсумм, Гкал | BA13: NS_TV1 | BB13: НС | BC13: NS_TV2
A14: =IF(RC[1]="","",DATEVALUE(RC[1])) -> 43366 | B14: 23.09.18 | C14: 24 | D14: 0 | E14: 22.07 | F14: 7.8 | G14: 0 | H14: 21.87 | I14: 4.8 | J14: =RC[-5]-RC[-2] -> 0.19999999999999929 | K14: 0 | L14: 0 | T14: =RC[-8]+RC[-1] -> 0 | U14: =(RC[-17]*RC[-16]-RC[-14]*RC[-13])/1000 -> 0 | V14: - | W14: - | X14: =RC[-2]*RC[-10]/1000 -> #VALUE! | Y14: =(RC[-3]*RC[-11]-RC[-2]*RC[-9])/1000 -> #VALUE! | Z14: 2013-11-23T00:00:00.000 | AA14: 2013-11-21T00:00:00.000 | AD14: =VALUE(RC[-28]) -> 2018-09-23T00:00:00.000 | AE14: =IF(RC[22]=42,"*",IF(RC[22]=32,"",RC[22])) -> - | AF14: =RC[-29] -> 24 | AG14: =RC[-29] -> 0 | AH14: =RC[-29] -> 22.07 | AI14: =RC[-29] -> 7.8 | AJ14: =RC[-29] -> 0 | AK14: =RC[-29] -> 21.87 | AL14: =RC[-29] -> 4.8 | AM14: =RC[-29] -> 0.19999999999999929 | AN14: =RC[-29] -> 0 | AO14: =RC[-29] -> 0 | AP14: =RC[-29] -> 0 | AQ14: =RC[-29] -> 0 | AR14: - | AS14: =RC[-30] -> 0 | AT14: =RC[-30] -> 0 | AU14: - | AV14: =RC[-31] -> 0 | AW14: =RC[-31] -> 0 | AX14: =RC[-31] -> 0 | AY14: =RC[-31] -> 0 | BA14: - | BB14: - | BC14: -
A15: =IF(RC[1]="","",DATEVALUE(RC[1])) -> 43367 | B15: 24.09.18 | C15: 24 | D15: 0 | E15: 21.37 | F15: 7.8 | G15: 0 | H15: 21.2 | I15: 4.8 | J15: =RC[-5]-RC[-2] -> 0.17000000000000171 | K15: 0 | L15: 0 | T15: =RC[-8]+RC[-1] -> 0 | U15: =(RC[-17]*RC[-16]-RC[-14]*RC[-13])/1000 -> 0 | V15: - | W15: - | X15: =RC[-2]*RC[-10]/1000 -> #VALUE! | Y15: =(RC[-3]*RC[-11]-RC[-2]*RC[-9])/1000 -> #VALUE! | Z15: 2013-11-24T00:00:00.000 | AA15: 2013-11-22T00:00:00.000 | AD15: =VALUE(RC[-28]) -> 2018-09-24T00:00:00.000 | AE15: =IF(RC[22]=42,"*",IF(RC[22]=32,"",RC[22])) -> - | AF15: =RC[-29] -> 24 | AG15: =RC[-29] -> 0 | AH15: =RC[-29] -> 21.37 | AI15: =RC[-29] -> 7.8 | AJ15: =RC[-29] -> 0 | AK15: =RC[-29] -> 21.2 | AL15: =RC[-29] -> 4.8 | AM15: =RC[-29] -> 0.17000000000000171 | AN15: =RC[-29] -> 0 | AO15: =RC[-29] -> 0 | AP15: =RC[-29] -> 0 | AQ15: =RC[-29] -> 0 | AR15: - | AS15: =RC[-30] -> 0 | AT15: =RC[-30] -> 0 | AU15: - | AV15: =RC[-31] -> 0 | AW15: =RC[-31] -> 0 | AX15: =RC[-31] -> 0 | AY15: =RC[-31] -> 0 | BA15: - | BB15: - | BC15: -
A16: =IF(RC[1]="","",DATEVALUE(RC[1])) -> 43368 | B16: 25.09.18 | C16: 24 | D16: 0 | E16: 20.51 | F16: 7.8 | G16: 0 | H16: 20.38 | I16: 4.8 | J16: =RC[-5]-RC[-2] -> 0.13000000000000256 | K16: 0 | L16: 0 | T16: =RC[-8]+RC[-1] -> 0 | U16: =(RC[-17]*RC[-16]-RC[-14]*RC[-13])/1000 -> 0 | V16: - | W16: - | X16: =RC[-2]*RC[-10]/1000 -> #VALUE! | Y16: =(RC[-3]*RC[-11]-RC[-2]*RC[-9])/1000 -> #VALUE! | Z16: 2013-11-25T00:00:00.000 | AA16: 2013-11-23T00:00:00.000 | AD16: =VALUE(RC[-28]) -> 2018-09-25T00:00:00.000 | AE16: =IF(RC[22]=42,"*",IF(RC[22]=32,"",RC[22])) -> - | AF16: =RC[-29] -> 24 | AG16: =RC[-29] -> 0 | AH16: =RC[-29] -> 20.51 | AI16: =RC[-29] -> 7.8 | AJ16: =RC[-29] -> 0 | AK16: =RC[-29] -> 20.38 | AL16: =RC[-29] -> 4.8 | AM16: =RC[-29] -> 0.13000000000000256 | AN16: =RC[-29] -> 0 | AO16: =RC[-29] -> 0 | AP16: =RC[-29] -> 0 | AQ16: =RC[-29] -> 0 | AR16: - | AS16: =RC[-30] -> 0 | AT16: =RC[-30] -> 0 | AU16: - | AV16: =RC[-31] -> 0 | AW16: =RC[-31] -> 0 | AX16: =RC[-31] -> 0 | AY16: =RC[-31] -> 0 | BA16: - | BB16: - | BC16: -
A17: =IF(RC[1]="","",DATEVALUE(RC[1])) -> 43369 | B17: 26.09.18 | C17: 24 | D17: 63.53 | E17: 64.900000000000006 | F17: 7.8 | G17: 62.93 | H17: 48.52 | I17: 4.8 | J17: =RC[-5]-RC[-2] -> 16.380000000000003 | K17: 0.6 | L17: 1.081 | T17: =RC[-8]+RC[-1] -> 1.081 | U17: =(RC[-17]*RC[-16]-RC[-14]*RC[-13])/1000 -> 1.0697334000000005 | V17: - | W17: - | X17: =RC[-2]*RC[-10]/1000 -> #VALUE! | Y17: =(RC[-3]*RC[-11]-RC[-2]*RC[-9])/1000 -> #VALUE! | Z17: 2013-11-26T00:00:00.000 | AA17: 2013-11-24T00:00:00.000 | AD17: =VALUE(RC[-28]) -> 2018-09-26T00:00:00.000 | AE17: =IF(RC[22]=42,"*",IF(RC[22]=32,"",RC[22])) -> - | AF17: =RC[-29] -> 24 | AG17: =RC[-29] -> 63.53 | AH17: =RC[-29] -> 64.900000000000006 | AI17: =RC[-29] -> 7.8 | AJ17: =RC[-29] -> 62.93 | AK17: =RC[-29] -> 48.52 | AL17: =RC[-29] -> 4.8 | AM17: =RC[-29] -> 16.380000000000003 | AN17: =RC[-29] -> 0.6 | AO17: =RC[-29] -> 1.081 | AP17: =RC[-29] -> 0 | AQ17: =RC[-29] -> 0 | AR17: - | AS17: =RC[-30] -> 0 | AT17: =RC[-30] -> 0 | AU17: - | AV17: =RC[-31] -> 0 | AW17: =RC[-31] -> 0 | AX17: =RC[-31] -> 0 | AY17: =RC[-31] -> 1.081 | BA17: - | BB17: - | BC17: -
A18: =IF(RC[1]="","",DATEVALUE(RC[1])) -> 43370 | B18: 27.09.18 | C18: 24 | D18: 171.62 | E18: 56.19 | F18: 7.8 | G18: 171.62 | H18: 42.4 | I18: 4.8 | J18: =RC[-5]-RC[-2] -> 13.79 | K18: 0 | L18: 2.3620000000000001 | T18: =RC[-8]+RC[-1] -> 2.3620000000000001 | U18: =(RC[-17]*RC[-16]-RC[-14]*RC[-13])/1000 -> 2.3666397999999988 | V18: - | W18: - | X18: =RC[-2]*RC[-10]/1000 -> #VALUE! | Y18: =(RC[-3]*RC[-11]-RC[-2]*RC[-9])/1000 -> #VALUE! | Z18: 2013-11-27T00:00:00.000 | AA18: 2013-11-25T00:00:00.000 | AD18: =VALUE(RC[-28]) -> 2018-09-27T00:00:00.000 | AE18: =IF(RC[22]=42,"*",IF(RC[22]=32,"",RC[22])) -> - | AF18: =RC[-29] -> 24 | AG18: =RC[-29] -> 171.62 | AH18: =RC[-29] -> 56.19 | AI18: =RC[-29] -> 7.8 | AJ18: =RC[-29] -> 171.62 | AK18: =RC[-29] -> 42.4 | AL18: =RC[-29] -> 4.8 | AM18: =RC[-29] -> 13.79 | AN18: =RC[-29] -> 0 | AO18: =RC[-29] -> 2.3620000000000001 | AP18: =RC[-29] -> 0 | AQ18: =RC[-29] -> 0 | AR18: - | AS18: =RC[-30] -> 0 | AT18: =RC[-30] -> 0 | AU18: - | AV18: =RC[-31] -> 0 | AW18: =RC[-31] -> 0 | AX18: =RC[-31] -> 0 | AY18: =RC[-31] -> 2.3620000000000001 | BA18: - | BB18: - | BC18: -
A19: =IF(RC[1]="","",DATEVALUE(RC[1])) -> 43371 | B19: 28.09.18 | C19: 24 | D19: 210.13 | E19: 51.66 | F19: 7.8 | G19: 210.13 | H19: 40.89 | I19: 4.8 | J19: =RC[-5]-RC[-2] -> 10.769999999999996 | K19: 0 | L19: 2.2709999999999999 | T19: =RC[-8]+RC[-1] -> 2.2709999999999999 | U19: =(RC[-17]*RC[-16]-RC[-14]*RC[-13])/1000 -> 2.2631000999999977 | V19: - | W19: - | X19: =RC[-2]*RC[-10]/1000 -> #VALUE! | Y19: =(RC[-3]*RC[-11]-RC[-2]*RC[-9])/1000 -> #VALUE! | Z19: 2013-11-28T00:00:00.000 | AA19: 2013-11-26T00:00:00.000 | AD19: =VALUE(RC[-28]) -> 2018-09-28T00:00:00.000 | AE19: =IF(RC[22]=42,"*",IF(RC[22]=32,"",RC[22])) -> - | AF19: =RC[-29] -> 24 | AG19: =RC[-29] -> 210.13 | AH19: =RC[-29] -> 51.66 | AI19: =RC[-29] -> 7.8 | AJ19: =RC[-29] -> 210.13 | AK19: =RC[-29] -> 40.89 | AL19: =RC[-29] -> 4.8 | AM19: =RC[-29] -> 10.769999999999996 | AN19: =RC[-29] -> 0 | AO19: =RC[-29] -> 2.2709999999999999 | AP19: =RC[-29] -> 0 | AQ19: =RC[-29] -> 0 | AR19: - | AS19: =RC[-30] -> 0 | AT19: =RC[-30] -> 0 | AU19: - | AV19: =RC[-31] -> 0 | AW19: =RC[-31] -> 0 | AX19: =RC[-31] -> 0 | AY19: =RC[-31] -> 2.2709999999999999 | BA19: - | BB19: - | BC19: -
A20: =IF(RC[1]="","",DATEVALUE(RC[1])) -> 43372 | B20: 29.09.18 | C20: 24 | D20: 230.28 | E20: 58.45 | F20: 7.8 | G20: 230.28 | H20: 45.83 | I20: 4.8 | J20: =RC[-5]-RC[-2] -> 12.620000000000005 | K20: 0 | L20: 2.9140000000000001 | T20: =RC[-8]+RC[-1] -> 2.9140000000000001 | U20: =(RC[-17]*RC[-16]-RC[-14]*RC[-13])/1000 -> 2.9061336000000009 | V20: - | W20: - | X20: =RC[-2]*RC[-10]/1000 -> #VALUE! | Y20: =(RC[-3]*RC[-11]-RC[-2]*RC[-9])/1000 -> #VALUE! | Z20: 2013-11-29T00:00:00.000 | AA20: 2013-11-27T00:00:00.000 | AD20: =VALUE(RC[-28]) -> 2018-09-29T00:00:00.000 | AE20: =IF(RC[22]=42,"*",IF(RC[22]=32,"",RC[22])) -> - | AF20: =RC[-29] -> 24 | AG20: =RC[-29] -> 230.28 | AH20: =RC[-29] -> 58.45 | AI20: =RC[-29] -> 7.8 | AJ20: =RC[-29] -> 230.28 | AK20: =RC[-29] -> 45.83 | AL20: =RC[-29] -> 4.8 | AM20: =RC[-29] -> 12.620000000000005 | AN20: =RC[-29] -> 0 | AO20: =RC[-29] -> 2.9140000000000001 | AP20: =RC[-29] -> 0 | AQ20: =RC[-29] -> 0 | AR20: - | AS20: =RC[-30] -> 0 | AT20: =RC[-30] -> 0 | AU20: - | AV20: =RC[-31] -> 0 | AW20: =RC[-31] -> 0 | AX20: =RC[-31] -> 0 | AY20: =RC[-31] -> 2.9140000000000001 | BA20: - | BB20: - | BC20: -
A21: =IF(RC[1]="","",DATEVALUE(RC[1])) -> 43373 | B21: 30.09.18 | C21: 24 | D21: 229.98 | E21: 55.35 | F21: 7.8 | G21: 229.98 | H21: 44.29 | I21: 4.8 | J21: =RC[-5]-RC[-2] -> 11.060000000000002 | K21: 0 | L21: 2.556 | T21: =RC[-8]+RC[-1] -> 2.556 | U21: =(RC[-17]*RC[-16]-RC[-14]*RC[-13])/1000 -> 2.543578800000001 | V21: - | W21: - | X21: =RC[-2]*RC[-10]/1000 -> #VALUE! | Y21: =(RC[-3]*RC[-11]-RC[-2]*RC[-9])/1000 -> #VALUE! | Z21: 2013-11-30T00:00:00.000 | AA21: 2013-11-28T00:00:00.000 | AD21: =VALUE(RC[-28]) -> 2018-09-30T00:00:00.000 | AE21: =IF(RC[22]=42,"*",IF(RC[22]=32,"",RC[22])) -> - | AF21: =RC[-29] -> 24 | AG21: =RC[-29] -> 229.98 | AH21: =RC[-29] -> 55.35 | AI21: =RC[-29] -> 7.8 | AJ21: =RC[-29] -> 229.98 | AK21: =RC[-29] -> 44.29 | AL21: =RC[-29] -> 4.8 | AM21: =RC[-29] -> 11.060000000000002 | AN21: =RC[-29] -> 0 | AO21: =RC[-29] -> 2.556 | AP21: =RC[-29] -> 0 | AQ21: =RC[-29] -> 0 | AR21: - | AS21: =RC[-30] -> 0 | AT21: =RC[-30] -> 0 | AU21: - | AV21: =RC[-31] -> 0 | AW21: =RC[-31] -> 0 | AX21: =RC[-31] -> 0 | AY21: =RC[-31] -> 2.556 | BA21: - | BB21: - | BC21: -
A22: =IF(RC[1]="","",DATEVALUE(RC[1])) -> 43374 | B22: 01.10.18 | C22: 24 | D22: 229.95 | E22: 52.09 | F22: 7.8 | G22: 229.95 | H22: 42.51 | I22: 4.8 | J22: =RC[-5]-RC[-2] -> 9.5800000000000054 | K22: 0 | L22: 2.2109999999999999 | T22: =RC[-8]+RC[-1] -> 2.2109999999999999 | U22: =(RC[-17]*RC[-16]-RC[-14]*RC[-13])/1000 -> 2.2029210000000004 | V22: - | W22: - | X22: =RC[-2]*RC[-10]/1000 -> #VALUE! | Y22: =(RC[-3]*RC[-11]-RC[-2]*RC[-9])/1000 -> #VALUE! | Z22: 2013-12-01T00:00:00.000 | AA22: 2013-11-29T00:00:00.000 | AD22: =VALUE(RC[-28]) -> 2018-10-01T00:00:00.000 | AE22: =IF(RC[22]=42,"*",IF(RC[22]=32,"",RC[22])) -> - | AF22: =RC[-29] -> 24 | AG22: =RC[-29] -> 229.95 | AH22: =RC[-29] -> 52.09 | AI22: =RC[-29] -> 7.8 | AJ22: =RC[-29] -> 229.95 | AK22: =RC[-29] -> 42.51 | AL22: =RC[-29] -> 4.8 | AM22: =RC[-29] -> 9.5800000000000054 | AN22: =RC[-29] -> 0 | AO22: =RC[-29] -> 2.2109999999999999 | AP22: =RC[-29] -> 0 | AQ22: =RC[-29] -> 0 | AR22: - | AS22: =RC[-30] -> 0 | AT22: =RC[-30] -> 0 | AU22: - | AV22: =RC[-31] -> 0 | AW22: =RC[-31] -> 0 | AX22: =RC[-31] -> 0 | AY22: =RC[-31] -> 2.2109999999999999 | BA22: - | BB22: - | BC22: -
A23: =IF(RC[1]="","",DATEVALUE(RC[1])) -> 43375 | B23: 02.10.18 | C23: 24 | D23: 229.73 | E23: 49.6 | F23: 7.8 | G23: 229.73 | H23: 40.85 | I23: 4.8 | J23: =RC[-5]-RC[-2] -> 8.75 | K23: 0 | L23: 2.0179999999999998 | T23: =RC[-8]+RC[-1] -> 2.0179999999999998 | U23: =(RC[-17]*RC[-16]-RC[-14]*RC[-13])/1000 -> 2.0101375000000008 | V23: - | W23: - | X23: =RC[-2]*RC[-10]/1000 -> #VALUE! | Y23: =(RC[-3]*RC[-11]-RC[-2]*RC[-9])/1000 -> #VALUE! | Z23: 2013-12-02T00:00:00.000 | AA23: 2013-11-30T00:00:00.000 | AD23: =VALUE(RC[-28]) -> 2018-10-02T00:00:00.000 | AE23: =IF(RC[22]=42,"*",IF(RC[22]=32,"",RC[22])) -> - | AF23: =RC[-29] -> 24 | AG23: =RC[-29] -> 229.73 | AH23: =RC[-29] -> 49.6 | AI23: =RC[-29] -> 7.8 | AJ23: =RC[-29] -> 229.73 | AK23: =RC[-29] -> 40.85 | AL23: =RC[-29] -> 4.8 | AM23: =RC[-29] -> 8.75 | AN23: =RC[-29] -> 0 | AO23: =RC[-29] -> 2.0179999999999998 | AP23: =RC[-29] -> 0 | AQ23: =RC[-29] -> 0 | AR23: - | AS23: =RC[-30] -> 0 | AT23: =RC[-30] -> 0 | AU23: - | AV23: =RC[-31] -> 0 | AW23: =RC[-31] -> 0 | AX23: =RC[-31] -> 0 | AY23: =RC[-31] -> 2.0179999999999998 | BA23: - | BB23: - | BC23: -
A24: =IF(RC[1]="","",DATEVALUE(RC[1])) -> 43376 | B24: 03.10.18 | C24: 24 | D24: 228.11 | E24: 49.65 | F24: 7.8 | G24: 228.11 | H24: 40.69 | I24: 4.8 | J24: =RC[-5]-RC[-2] -> 8.9600000000000009 | K24: 0 | L24: 2.0550000000000002 | T24: =RC[-8]+RC[-1] -> 2.0550000000000002 | U24: =(RC[-17]*RC[-16]-RC[-14]*RC[-13])/1000 -> 2.0438656000000011 | V24: - | W24: - | X24: =RC[-2]*RC[-10]/1000 -> #VALUE! | Y24: =(RC[-3]*RC[-11]-RC[-2]*RC[-9])/1000 -> #VALUE! | Z24: 2013-12-03T00:00:00.000 | AA24: 2013-12-01T00:00:00.000 | AD24: =VALUE(RC[-28]) -> 2018-10-03T00:00:00.000 | AE24: =IF(RC[22]=42,"*",IF(RC[22]=32,"",RC[22])) -> - | AF24: =RC[-29] -> 24 | AG24: =RC[-29] -> 228.11 | AH24: =RC[-29] -> 49.65 | AI24: =RC[-29] -> 7.8 | AJ24: =RC[-29] -> 228.11 | AK24: =RC[-29] -> 40.69 | AL24: =RC[-29] -> 4.8 | AM24: =RC[-29] -> 8.9600000000000009 | AN24: =RC[-29] -> 0 | AO24: =RC[-29] -> 2.0550000000000002 | AP24: =RC[-29] -> 0 | AQ24: =RC[-29] -> 0 | AR24: - | AS24: =RC[-30] -> 0 | AT24: =RC[-30] -> 0 | AU24: - | AV24: =RC[-31] -> 0 | AW24: =RC[-31] -> 0 | AX24: =RC[-31] -> 0 | AY24: =RC[-31] -> 2.0550000000000002 | BA24: - | BB24: - | BC24: -
A25: =IF(RC[1]="","",DATEVALUE(RC[1])) -> 43377 | B25: 04.10.18 | C25: 24 | D25: 228.35 | E25: 50.88 | F25: 7.8 | G25: 228.35 | H25: 41.14 | I25: 4.8 | J25: =RC[-5]-RC[-2] -> 9.740000000000002 | K25: 0 | L25: 2.234 | T25: =RC[-8]+RC[-1] -> 2.234 | U25: =(RC[-17]*RC[-16]-RC[-14]*RC[-13])/1000 -> 2.2241290000000009 | V25: - | W25: - | X25: =RC[-2]*RC[-10]/1000 -> #VALUE! | Y25: =(RC[-3]*RC[-11]-RC[-2]*RC[-9])/1000 -> #VALUE! | Z25: 2013-12-04T00:00:00.000 | AA25: 2013-12-02T00:00:00.000 | AD25: =VALUE(RC[-28]) -> 2018-10-04T00:00:00.000 | AE25: =IF(RC[22]=42,"*",IF(RC[22]=32,"",RC[22])) -> - | AF25: =RC[-29] -> 24 | AG25: =RC[-29] -> 228.35 | AH25: =RC[-29] -> 50.88 | AI25: =RC[-29] -> 7.8 | AJ25: =RC[-29] -> 228.35 | AK25: =RC[-29] -> 41.14 | AL25: =RC[-29] -> 4.8 | AM25: =RC[-29] -> 9.740000000000002 | AN25: =RC[-29] -> 0 | AO25: =RC[-29] -> 2.234 | AP25: =RC[-29] -> 0 | AQ25: =RC[-29] -> 0 | AR25: - | AS25: =RC[-30] -> 0 | AT25: =RC[-30] -> 0 | AU25: - | AV25: =RC[-31] -> 0 | AW25: =RC[-31] -> 0 | AX25: =RC[-31] -> 0 | AY25: =RC[-31] -> 2.234 | BA25: - | BB25: - | BC25: -
A26: =IF(RC[1]="","",DATEVALUE(RC[1])) -> 43378 | B26: 05.10.18 | C26: 24 | D26: 229.4 | E26: 51.6 | F26: 7.8 | G26: 229.4 | H26: 41.5 | I26: 4.8 | J26: =RC[-5]-RC[-2] -> 10.100000000000001 | K26: 0 | L26: 2.3260000000000001 | T26: =RC[-8]+RC[-1] -> 2.3260000000000001 | U26: =(RC[-17]*RC[-16]-RC[-14]*RC[-13])/1000 -> 2.3169400000000007 | V26: - | W26: - | X26: =RC[-2]*RC[-10]/1000 -> #VALUE! | Y26: =(RC[-3]*RC[-11]-RC[-2]*RC[-9])/1000 -> #VALUE! | Z26: 2013-12-05T00:00:00.000 | AA26: 2013-12-03T00:00:00.000 | AD26: =VALUE(RC[-28]) -> 2018-10-05T00:00:00.000 | AE26: =IF(RC[22]=42,"*",IF(RC[22]=32,"",RC[22])) -> - | AF26: =RC[-29] -> 24 | AG26: =RC[-29] -> 229.4 | AH26: =RC[-29] -> 51.6 | AI26: =RC[-29] -> 7.8 | AJ26: =RC[-29] -> 229.4 | AK26: =RC[-29] -> 41.5 | AL26: =RC[-29] -> 4.8 | AM26: =RC[-29] -> 10.100000000000001 | AN26: =RC[-29] -> 0 | AO26: =RC[-29] -> 2.3260000000000001 | AP26: =RC[-29] -> 0 | AQ26: =RC[-29] -> 0 | AR26: - | AS26: =RC[-30] -> 0 | AT26: =RC[-30] -> 0 | AU26: - | AV26: =RC[-31] -> 0 | AW26: =RC[-31] -> 0 | AX26: =RC[-31] -> 0 | AY26: =RC[-31] -> 2.3260000000000001 | BA26: - | BB26: - | BC26: -
A27: =IF(RC[1]="","",DATEVALUE(RC[1])) -> 43379 | B27: 06.10.18 | C27: 24 | D27: 229.5 | E27: 50.48 | F27: 7.8 | G27: 229.5 | H27: 41.12 | I27: 4.8 | J27: =RC[-5]-RC[-2] -> 9.36 | K27: 0 | L27: 2.157 | T27: =RC[-8]+RC[-1] -> 2.157 | U27: =(RC[-17]*RC[-16]-RC[-14]*RC[-13])/1000 -> 2.1481200000000009 | V27: - | W27: - | X27: =RC[-2]*RC[-10]/1000 -> #VALUE! | Y27: =(RC[-3]*RC[-11]-RC[-2]*RC[-9])/1000 -> #VALUE! | Z27: 2013-12-06T00:00:00.000 | AA27: 2013-12-04T00:00:00.000 | AD27: =VALUE(RC[-28]) -> 2018-10-06T00:00:00.000 | AE27: =IF(RC[22]=42,"*",IF(RC[22]=32,"",RC[22])) -> - | AF27: =RC[-29] -> 24 | AG27: =RC[-29] -> 229.5 | AH27: =RC[-29] -> 50.48 | AI27: =RC[-29] -> 7.8 | AJ27: =RC[-29] -> 229.5 | AK27: =RC[-29] -> 41.12 | AL27: =RC[-29] -> 4.8 | AM27: =RC[-29] -> 9.36 | AN27: =RC[-29] -> 0 | AO27: =RC[-29] -> 2.157 | AP27: =RC[-29] -> 0 | AQ27: =RC[-29] -> 0 | AR27: - | AS27: =RC[-30] -> 0 | AT27: =RC[-30] -> 0 | AU27: - | AV27: =RC[-31] -> 0 | AW27: =RC[-31] -> 0 | AX27: =RC[-31] -> 0 | AY27: =RC[-31] -> 2.157 | BA27: - | BB27: - | BC27: -
A28: =IF(RC[1]="","",DATEVALUE(RC[1])) -> 43380 | B28: 07.10.18 | C28: 24 | D28: 229.13 | E28: 52.7 | F28: 7.8 | G28: 229.13 | H28: 42.41 | I28: 4.8 | J28: =RC[-5]-RC[-2] -> 10.290000000000006 | K28: 0 | L28: 2.3660000000000001 | T28: =RC[-8]+RC[-1] -> 2.3660000000000001 | U28: =(RC[-17]*RC[-16]-RC[-14]*RC[-13])/1000 -> 2.3577477000000018 | V28: - | W28: - | X28: =RC[-2]*RC[-10]/1000 -> #VALUE! | Y28: =(RC[-3]*RC[-11]-RC[-2]*RC[-9])/1000 -> #VALUE! | Z28: 2013-12-07T00:00:00.000 | AA28: 2013-12-05T00:00:00.000 | AD28: =VALUE(RC[-28]) -> 2018-10-07T00:00:00.000 | AE28: =IF(RC[22]=42,"*",IF(RC[22]=32,"",RC[22])) -> - | AF28: =RC[-29] -> 24 | AG28: =RC[-29] -> 229.13 | AH28: =RC[-29] -> 52.7 | AI28: =RC[-29] -> 7.8 | AJ28: =RC[-29] -> 229.13 | AK28: =RC[-29] -> 42.41 | AL28: =RC[-29] -> 4.8 | AM28: =RC[-29] -> 10.290000000000006 | AN28: =RC[-29] -> 0 | AO28: =RC[-29] -> 2.3660000000000001 | AP28: =RC[-29] -> 0 | AQ28: =RC[-29] -> 0 | AR28: - | AS28: =RC[-30] -> 0 | AT28: =RC[-30] -> 0 | AU28: - | AV28: =RC[-31] -> 0 | AW28: =RC[-31] -> 0 | AX28: =RC[-31] -> 0 | AY28: =RC[-31] -> 2.3660000000000001 | BA28: - | BB28: - | BC28: -
A29: =IF(RC[1]="","",DATEVALUE(RC[1])) -> 43381 | B29: 08.10.18 | C29: 24 | D29: 228.89 | E29: 51.67 | F29: 7.8 | G29: 228.89 | H29: 41.68 | I29: 4.8 | J29: =RC[-5]-RC[-2] -> 9.990000000000002 | K29: 0 | L29: 2.2949999999999999 | T29: =RC[-8]+RC[-1] -> 2.2949999999999999 | U29: =(RC[-17]*RC[-16]-RC[-14]*RC[-13])/1000 -> 2.2866111 | V29: - | W29: - | X29: =RC[-2]*RC[-10]/1000 -> #VALUE! | Y29: =(RC[-3]*RC[-11]-RC[-2]*RC[-9])/1000 -> #VALUE! | Z29: 2013-12-08T00:00:00.000 | AA29: 2013-12-06T00:00:00.000 | AD29: =VALUE(RC[-28]) -> 2018-10-08T00:00:00.000 | AE29: =IF(RC[22]=42,"*",IF(RC[22]=32,"",RC[22])) -> - | AF29: =RC[-29] -> 24 | AG29: =RC[-29] -> 228.89 | AH29: =RC[-29] -> 51.67 | AI29: =RC[-29] -> 7.8 | AJ29: =RC[-29] -> 228.89 | AK29: =RC[-29] -> 41.68 | AL29: =RC[-29] -> 4.8 | AM29: =RC[-29] -> 9.990000000000002 | AN29: =RC[-29] -> 0 | AO29: =RC[-29] -> 2.2949999999999999 | AP29: =RC[-29] -> 0 | AQ29: =RC[-29] -> 0 | AR29: - | AS29: =RC[-30] -> 0 | AT29: =RC[-30] -> 0 | AU29: - | AV29: =RC[-31] -> 0 | AW29: =RC[-31] -> 0 | AX29: =RC[-31] -> 0 | AY29: =RC[-31] -> 2.2949999999999999 | BA29: - | BB29: - | BC29: -
A30: =IF(RC[1]="","",DATEVALUE(RC[1])) -> 43382 | B30: 09.10.18 | C30: 24 | D30: 228.9 | E30: 49.63 | F30: 7.8 | G30: 228.9 | H30: 40.54 | I30: 4.8 | J30: =RC[-5]-RC[-2] -> 9.0900000000000034 | K30: 0 | L30: 2.0880000000000001 | T30: =RC[-8]+RC[-1] -> 2.0880000000000001 | U30: =(RC[-17]*RC[-16]-RC[-14]*RC[-13])/1000 -> 2.0807010000000008 | V30: - | W30: - | X30: =RC[-2]*RC[-10]/1000 -> #VALUE! | Y30: =(RC[-3]*RC[-11]-RC[-2]*RC[-9])/1000 -> #VALUE! | Z30: 2013-12-09T00:00:00.000 | AA30: 2013-12-07T00:00:00.000 | AD30: =VALUE(RC[-28]) -> 2018-10-09T00:00:00.000 | AE30: =IF(RC[22]=42,"*",IF(RC[22]=32,"",RC[22])) -> - | AF30: =RC[-29] -> 24 | AG30: =RC[-29] -> 228.9 | AH30: =RC[-29] -> 49.63 | AI30: =RC[-29] -> 7.8 | AJ30: =RC[-29] -> 228.9 | AK30: =RC[-29] -> 40.54 | AL30: =RC[-29] -> 4.8 | AM30: =RC[-29] -> 9.0900000000000034 | AN30: =RC[-29] -> 0 | AO30: =RC[-29] -> 2.0880000000000001 | AP30: =RC[-29] -> 0 | AQ30: =RC[-29] -> 0 | AR30: - | AS30: =RC[-30] -> 0 | AT30: =RC[-30] -> 0 | AU30: - | AV30: =RC[-31] -> 0 | AW30: =RC[-31] -> 0 | AX30: =RC[-31] -> 0 | AY30: =RC[-31] -> 2.0880000000000001 | BA30: - | BB30: - | BC30: -
A31: =IF(RC[1]="","",DATEVALUE(RC[1])) -> 43383 | B31: 10.10.18 | C31: 24 | D31: 229.23 | E31: 49.64 | F31: 7.8 | G31: 229.23 | H31: 40.74 | I31: 4.8 | J31: =RC[-5]-RC[-2] -> 8.8999999999999986 | K31: 0 | L31: 2.0499999999999998 | T31: =RC[-8]+RC[-1] -> 2.0499999999999998 | U31: =(RC[-17]*RC[-16]-RC[-14]*RC[-13])/1000 -> 2.0401469999999988 | V31: - | W31: - | X31: =RC[-2]*RC[-10]/1000 -> #VALUE! | Y31: =(RC[-3]*RC[-11]-RC[-2]*RC[-9])/1000 -> #VALUE! | Z31: 2013-12-10T00:00:00.000 | AA31: 2013-12-08T00:00:00.000 | AD31: =VALUE(RC[-28]) -> 2018-10-10T00:00:00.000 | AE31: =IF(RC[22]=42,"*",IF(RC[22]=32,"",RC[22])) -> - | AF31: =RC[-29] -> 24 | AG31: =RC[-29] -> 229.23 | AH31: =RC[-29] -> 49.64 | AI31: =RC[-29] -> 7.8 | AJ31: =RC[-29] -> 229.23 | AK31: =RC[-29] -> 40.74 | AL31: =RC[-29] -> 4.8 | AM31: =RC[-29] -> 8.8999999999999986 | AN31: =RC[-29] -> 0 | AO31: =RC[-29] -> 2.0499999999999998 | AP31: =RC[-29] -> 0 | AQ31: =RC[-29] -> 0 | AR31: - | AS31: =RC[-30] -> 0 | AT31: =RC[-30] -> 0 | AU31: - | AV31: =RC[-31] -> 0 | AW31: =RC[-31] -> 0 | AX31: =RC[-31] -> 0 | AY31: =RC[-31] -> 2.0499999999999998 | BA31: - | BB31: - | BC31: -
A32: =IF(RC[1]="","",DATEVALUE(RC[1])) -> 43384 | B32: 11.10.18 | C32: 24 | D32: 229.04 | E32: 49.64 | F32: 7.8 | G32: 229.04 | H32: 40.880000000000003 | I32: 4.8 | J32: =RC[-5]-RC[-2] -> 8.759999999999998 | K32: 0 | L32: 2.0129999999999999 | T32: =RC[-8]+RC[-1] -> 2.0129999999999999 | U32: =(RC[-17]*RC[-16]-RC[-14]*RC[-13])/1000 -> 2.0063903999999986 | V32: - | W32: - | X32: =RC[-2]*RC[-10]/1000 -> #VALUE! | Y32: =(RC[-3]*RC[-11]-RC[-2]*RC[-9])/1000 -> #VALUE! | Z32: 2013-12-11T00:00:00.000 | AA32: 2013-12-09T00:00:00.000 | AD32: =VALUE(RC[-28]) -> 2018-10-11T00:00:00.000 | AE32: =IF(RC[22]=42,"*",IF(RC[22]=32,"",RC[22])) -> - | AF32: =RC[-29] -> 24 | AG32: =RC[-29] -> 229.04 | AH32: =RC[-29] -> 49.64 | AI32: =RC[-29] -> 7.8 | AJ32: =RC[-29] -> 229.04 | AK32: =RC[-29] -> 40.880000000000003 | AL32: =RC[-29] -> 4.8 | AM32: =RC[-29] -> 8.759999999999998 | AN32: =RC[-29] -> 0 | AO32: =RC[-29] -> 2.0129999999999999 | AP32: =RC[-29] -> 0 | AQ32: =RC[-29] -> 0 | AR32: - | AS32: =RC[-30] -> 0 | AT32: =RC[-30] -> 0 | AU32: - | AV32: =RC[-31] -> 0 | AW32: =RC[-31] -> 0 | AX32: =RC[-31] -> 0 | AY32: =RC[-31] -> 2.0129999999999999 | BA32: - | BB32: - | BC32: -
A33: =IF(RC[1]="","",DATEVALUE(RC[1])) -> 43385 | B33: 12.10.18 | C33: 24 | D33: 228.02 | E33: 49.47 | F33: 7.8 | G33: 228.02 | H33: 40.56 | I33: 4.8 | J33: =RC[-5]-RC[-2] -> 8.9099999999999966 | K33: 0 | L33: 2.0419999999999998 | T33: =RC[-8]+RC[-1] -> 2.0419999999999998 | U33: =(RC[-17]*RC[-16]-RC[-14]*RC[-13])/1000 -> 2.0316581999999999 | V33: - | W33: - | X33: =RC[-2]*RC[-10]/1000 -> #VALUE! | Y33: =(RC[-3]*RC[-11]-RC[-2]*RC[-9])/1000 -> #VALUE! | Z33: 2013-12-12T00:00:00.000 | AA33: 2013-12-10T00:00:00.000 | AD33: =VALUE(RC[-28]) -> 2018-10-12T00:00:00.000 | AE33: =IF(RC[22]=42,"*",IF(RC[22]=32,"",RC[22])) -> - | AF33: =RC[-29] -> 24 | AG33: =RC[-29] -> 228.02 | AH33: =RC[-29] -> 49.47 | AI33: =RC[-29] -> 7.8 | AJ33: =RC[-29] -> 228.02 | AK33: =RC[-29] -> 40.56 | AL33: =RC[-29] -> 4.8 | AM33: =RC[-29] -> 8.9099999999999966 | AN33: =RC[-29] -> 0 | AO33: =RC[-29] -> 2.0419999999999998 | AP33: =RC[-29] -> 0 | AQ33: =RC[-29] -> 0 | AR33: - | AS33: =RC[-30] -> 0 | AT33: =RC[-30] -> 0 | AU33: - | AV33: =RC[-31] -> 0 | AW33: =RC[-31] -> 0 | AX33: =RC[-31] -> 0 | AY33: =RC[-31] -> 2.0419999999999998 | BA33: - | BB33: - | BC33: -
A34: =IF(RC[1]="","",DATEVALUE(RC[1])) -> 43386 | B34: 13.10.18 | C34: 24 | D34: 225.46 | E34: 49.65 | F34: 7.8 | G34: 225.46 | H34: 40.99 | I34: 4.8 | J34: =RC[-5]-RC[-2] -> 8.6599999999999966 | K34: 0 | L34: 1.96 | T34: =RC[-8]+RC[-1] -> 1.96 | U34: =(RC[-17]*RC[-16]-RC[-14]*RC[-13])/1000 -> 1.9524835999999997 | V34: - | W34: - | X34: =RC[-2]*RC[-10]/1000 -> #VALUE! | Y34: =(RC[-3]*RC[-11]-RC[-2]*RC[-9])/1000 -> #VALUE! | Z34: 2013-12-13T00:00:00.000 | AA34: 2013-12-11T00:00:00.000 | AD34: =VALUE(RC[-28]) -> 2018-10-13T00:00:00.000 | AE34: =IF(RC[22]=42,"*",IF(RC[22]=32,"",RC[22])) -> - | AF34: =RC[-29] -> 24 | AG34: =RC[-29] -> 225.46 | AH34: =RC[-29] -> 49.65 | AI34: =RC[-29] -> 7.8 | AJ34: =RC[-29] -> 225.46 | AK34: =RC[-29] -> 40.99 | AL34: =RC[-29] -> 4.8 | AM34: =RC[-29] -> 8.6599999999999966 | AN34: =RC[-29] -> 0 | AO34: =RC[-29] -> 1.96 | AP34: =RC[-29] -> 0 | AQ34: =RC[-29] -> 0 | AR34: - | AS34: =RC[-30] -> 0 | AT34: =RC[-30] -> 0 | AU34: - | AV34: =RC[-31] -> 0 | AW34: =RC[-31] -> 0 | AX34: =RC[-31] -> 0 | AY34: =RC[-31] -> 1.96 | BA34: - | BB34: - | BC34: -
A35: =IF(RC[1]="","",DATEVALUE(RC[1])) -> 43387 | B35: 14.10.18 | C35: 24 | D35: 226.08 | E35: 49.65 | F35: 7.8 | G35: 226.08 | H35: 41.3 | I35: 4.8 | J35: =RC[-5]-RC[-2] -> 8.3500000000000014 | K35: 0 | L35: 1.899 | T35: =RC[-8]+RC[-1] -> 1.899 | U35: =(RC[-17]*RC[-16]-RC[-14]*RC[-13])/1000 -> 1.8877680000000019 | V35: - | W35: - | X35: =RC[-2]*RC[-10]/1000 -> #VALUE! | Y35: =(RC[-3]*RC[-11]-RC[-2]*RC[-9])/1000 -> #VALUE! | Z35: 2013-12-14T00:00:00.000 | AA35: 2013-12-12T00:00:00.000 | AD35: =VALUE(RC[-28]) -> 2018-10-14T00:00:00.000 | AE35: =IF(RC[22]=42,"*",IF(RC[22]=32,"",RC[22])) -> - | AF35: =RC[-29] -> 24 | AG35: =RC[-29] -> 226.08 | AH35: =RC[-29] -> 49.65 | AI35: =RC[-29] -> 7.8 | AJ35: =RC[-29] -> 226.08 | AK35: =RC[-29] -> 41.3 | AL35: =RC[-29] -> 4.8 | AM35: =RC[-29] -> 8.3500000000000014 | AN35: =RC[-29] -> 0 | AO35: =RC[-29] -> 1.899 | AP35: =RC[-29] -> 0 | AQ35: =RC[-29] -> 0 | AR35: - | AS35: =RC[-30] -> 0 | AT35: =RC[-30] -> 0 | AU35: - | AV35: =RC[-31] -> 0 | AW35: =RC[-31] -> 0 | AX35: =RC[-31] -> 0 | AY35: =RC[-31] -> 1.899 | BA35: - | BB35: - | BC35: -
A36: =IF(RC[1]="","",DATEVALUE(RC[1])) -> 43388 | B36: 15.10.18 | C36: 24 | D36: 226.58 | E36: 49.66 | F36: 7.8 | G36: 226.58 | H36: 41.47 | I36: 4.8 | J36: =RC[-5]-RC[-2] -> 8.1899999999999977 | K36: 0 | L36: 1.8640000000000001 | T36: =RC[-8]+RC[-1] -> 1.8640000000000001 | U36: =(RC[-17]*RC[-16]-RC[-14]*RC[-13])/1000 -> 1.8556901999999991 | V36: - | W36: - | X36: =RC[-2]*RC[-10]/1000 -> #VALUE! | Y36: =(RC[-3]*RC[-11]-RC[-2]*RC[-9])/1000 -> #VALUE! | Z36: 2013-12-15T00:00:00.000 | AA36: 2013-12-13T00:00:00.000 | AD36: =VALUE(RC[-28]) -> 2018-10-15T00:00:00.000 | AE36: =IF(RC[22]=42,"*",IF(RC[22]=32,"",RC[22])) -> - | AF36: =RC[-29] -> 24 | AG36: =RC[-29] -> 226.58 | AH36: =RC[-29] -> 49.66 | AI36: =RC[-29] -> 7.8 | AJ36: =RC[-29] -> 226.58 | AK36: =RC[-29] -> 41.47 | AL36: =RC[-29] -> 4.8 | AM36: =RC[-29] -> 8.1899999999999977 | AN36: =RC[-29] -> 0 | AO36: =RC[-29] -> 1.8640000000000001 | AP36: =RC[-29] -> 0 | AQ36: =RC[-29] -> 0 | AR36: - | AS36: =RC[-30] -> 0 | AT36: =RC[-30] -> 0 | AU36: - | AV36: =RC[-31] -> 0 | AW36: =RC[-31] -> 0 | AX36: =RC[-31] -> 0 | AY36: =RC[-31] -> 1.8640000000000001 | BA36: - | BB36: - | BC36: -
A37: =IF(RC[1]="","",DATEVALUE(RC[1])) -> 43389 | B37: 16.10.18 | C37: 24 | D37: 225.81 | E37: 49.65 | F37: 7.8 | G37: 225.81 | H37: 41.34 | I37: 4.8 | J37: =RC[-5]-RC[-2] -> 8.3099999999999952 | K37: 0 | L37: 1.883 | T37: =RC[-8]+RC[-1] -> 1.883 | U37: =(RC[-17]*RC[-16]-RC[-14]*RC[-13])/1000 -> 1.876481099999999 | V37: - | W37: - | X37: =RC[-2]*RC[-10]/1000 -> #VALUE! | Y37: =(RC[-3]*RC[-11]-RC[-2]*RC[-9])/1000 -> #VALUE! | Z37: 2013-12-16T00:00:00.000 | AA37: 2013-12-14T00:00:00.000 | AD37: =VALUE(RC[-28]) -> 2018-10-16T00:00:00.000 | AE37: =IF(RC[22]=42,"*",IF(RC[22]=32,"",RC[22])) -> - | AF37: =RC[-29] -> 24 | AG37: =RC[-29] -> 225.81 | AH37: =RC[-29] -> 49.65 | AI37: =RC[-29] -> 7.8 | AJ37: =RC[-29] -> 225.81 | AK37: =RC[-29] -> 41.34 | AL37: =RC[-29] -> 4.8 | AM37: =RC[-29] -> 8.3099999999999952 | AN37: =RC[-29] -> 0 | AO37: =RC[-29] -> 1.883 | AP37: =RC[-29] -> 0 | AQ37: =RC[-29] -> 0 | AR37: - | AS37: =RC[-30] -> 0 | AT37: =RC[-30] -> 0 | AU37: - | AV37: =RC[-31] -> 0 | AW37: =RC[-31] -> 0 | AX37: =RC[-31] -> 0 | AY37: =RC[-31] -> 1.883 | BA37: - | BB37: - | BC37: -
A38: =IF(RC[1]="","",DATEVALUE(RC[1])) -> 43390 | B38: 17.10.18 | C38: 24 | D38: 224.87 | E38: 49.66 | F38: 7.8 | G38: 224.87 | H38: 41.38 | I38: 4.8 | J38: =RC[-5]-RC[-2] -> 8.279999999999994 | K38: 0 | L38: 1.8720000000000001 | T38: =RC[-8]+RC[-1] -> 1.8720000000000001 | U38: =(RC[-17]*RC[-16]-RC[-14]*RC[-13])/1000 -> 1.8619236000000001 | V38: - | W38: - | X38: =RC[-2]*RC[-10]/1000 -> #VALUE! | Y38: =(RC[-3]*RC[-11]-RC[-2]*RC[-9])/1000 -> #VALUE! | Z38: 2013-12-17T00:00:00.000 | AA38: 2013-12-15T00:00:00.000 | AD38: =VALUE(RC[-28]) -> 2018-10-17T00:00:00.000 | AE38: =IF(RC[22]=42,"*",IF(RC[22]=32,"",RC[22])) -> - | AF38: =RC[-29] -> 24 | AG38: =RC[-29] -> 224.87 | AH38: =RC[-29] -> 49.66 | AI38: =RC[-29] -> 7.8 | AJ38: =RC[-29] -> 224.87 | AK38: =RC[-29] -> 41.38 | AL38: =RC[-29] -> 4.8 | AM38: =RC[-29] -> 8.279999999999994 | AN38: =RC[-29] -> 0 | AO38: =RC[-29] -> 1.8720000000000001 | AP38: =RC[-29] -> 0 | AQ38: =RC[-29] -> 0 | AR38: - | AS38: =RC[-30] -> 0 | AT38: =RC[-30] -> 0 | AU38: - | AV38: =RC[-31] -> 0 | AW38: =RC[-31] -> 0 | AX38: =RC[-31] -> 0 | AY38: =RC[-31] -> 1.8720000000000001 | BA38: - | BB38: - | BC38: -
A39: =IF(RC[1]="","",DATEVALUE(RC[1])) -> 43391 | B39: 18.10.18 | C39: 24 | D39: 225.94 | E39: 49.4 | F39: 7.8 | G39: 225.94 | H39: 41.19 | I39: 4.8 | J39: =RC[-5]-RC[-2] -> 8.2100000000000009 | K39: 0 | L39: 1.8660000000000001 | T39: =RC[-8]+RC[-1] -> 1.8660000000000001 | U39: =(RC[-17]*RC[-16]-RC[-14]*RC[-13])/1000 -> 1.8549673999999996 | V39: - | W39: - | X39: =RC[-2]*RC[-10]/1000 -> #VALUE! | Y39: =(RC[-3]*RC[-11]-RC[-2]*RC[-9])/1000 -> #VALUE! | Z39: 2013-12-18T00:00:00.000 | AA39: 2013-12-16T00:00:00.000 | AD39: =VALUE(RC[-28]) -> 2018-10-18T00:00:00.000 | AE39: =IF(RC[22]=42,"*",IF(RC[22]=32,"",RC[22])) -> - | AF39: =RC[-29] -> 24 | AG39: =RC[-29] -> 225.94 | AH39: =RC[-29] -> 49.4 | AI39: =RC[-29] -> 7.8 | AJ39: =RC[-29] -> 225.94 | AK39: =RC[-29] -> 41.19 | AL39: =RC[-29] -> 4.8 | AM39: =RC[-29] -> 8.2100000000000009 | AN39: =RC[-29] -> 0 | AO39: =RC[-29] -> 1.8660000000000001 | AP39: =RC[-29] -> 0 | AQ39: =RC[-29] -> 0 | AR39: - | AS39: =RC[-30] -> 0 | AT39: =RC[-30] -> 0 | AU39: - | AV39: =RC[-31] -> 0 | AW39: =RC[-31] -> 0 | AX39: =RC[-31] -> 0 | AY39: =RC[-31] -> 1.8660000000000001 | BA39: - | BB39: - | BC39: -
A40: =IF(RC[1]="","",DATEVALUE(RC[1])) -> 43392 | B40: 19.10.18 | C40: 24 | D40: 227.44 | E40: 49.64 | F40: 7.8 | G40: 212.59 | H40: 40.99 | I40: 4.8 | J40: =RC[-5]-RC[-2] -> 8.6499999999999986 | K40: 14.85 | L40: 2.5830000000000002 | T40: =RC[-8]+RC[-1] -> 2.5830000000000002 | U40: =(RC[-17]*RC[-16]-RC[-14]*RC[-13])/1000 -> 2.5760574999999988 | V40: - | W40: - | X40: =RC[-2]*RC[-10]/1000 -> #VALUE! | Y40: =(RC[-3]*RC[-11]-RC[-2]*RC[-9])/1000 -> #VALUE! | Z40: 2013-12-19T00:00:00.000 | AA40: 2013-12-17T00:00:00.000 | AD40: =VALUE(RC[-28]) -> 2018-10-19T00:00:00.000 | AE40: =IF(RC[22]=42,"*",IF(RC[22]=32,"",RC[22])) -> - | AF40: =RC[-29] -> 24 | AG40: =RC[-29] -> 227.44 | AH40: =RC[-29] -> 49.64 | AI40: =RC[-29] -> 7.8 | AJ40: =RC[-29] -> 212.59 | AK40: =RC[-29] -> 40.99 | AL40: =RC[-29] -> 4.8 | AM40: =RC[-29] -> 8.6499999999999986 | AN40: =RC[-29] -> 14.85 | AO40: =RC[-29] -> 2.5830000000000002 | AP40: =RC[-29] -> 0 | AQ40: =RC[-29] -> 0 | AR40: - | AS40: =RC[-30] -> 0 | AT40: =RC[-30] -> 0 | AU40: - | AV40: =RC[-31] -> 0 | AW40: =RC[-31] -> 0 | AX40: =RC[-31] -> 0 | AY40: =RC[-31] -> 2.5830000000000002 | BA40: - | BB40: - | BC40: -
A41: =IF(RC[1]="","",DATEVALUE(RC[1])) -> 43393 | B41: 20.10.18 | C41: 24 | D41: 228.45 | E41: 49.65 | F41: 7.8 | G41: 195.27 | H41: 40.68 | I41: 4.8 | J41: =RC[-5]-RC[-2] -> 8.9699999999999989 | K41: 33.18 | L41: 3.41 | T41: =RC[-8]+RC[-1] -> 3.41 | U41: =(RC[-17]*RC[-16]-RC[-14]*RC[-13])/1000 -> 3.3989588999999998 | V41: - | W41: - | X41: =RC[-2]*RC[-10]/1000 -> #VALUE! | Y41: =(RC[-3]*RC[-11]-RC[-2]*RC[-9])/1000 -> #VALUE! | Z41: 2013-12-20T00:00:00.000 | AA41: 2013-12-18T00:00:00.000 | AD41: =VALUE(RC[-28]) -> 2018-10-20T00:00:00.000 | AE41: =IF(RC[22]=42,"*",IF(RC[22]=32,"",RC[22])) -> - | AF41: =RC[-29] -> 24 | AG41: =RC[-29] -> 228.45 | AH41: =RC[-29] -> 49.65 | AI41: =RC[-29] -> 7.8 | AJ41: =RC[-29] -> 195.27 | AK41: =RC[-29] -> 40.68 | AL41: =RC[-29] -> 4.8 | AM41: =RC[-29] -> 8.9699999999999989 | AN41: =RC[-29] -> 33.18 | AO41: =RC[-29] -> 3.41 | AP41: =RC[-29] -> 0 | AQ41: =RC[-29] -> 0 | AR41: - | AS41: =RC[-30] -> 0 | AT41: =RC[-30] -> 0 | AU41: - | AV41: =RC[-31] -> 0 | AW41: =RC[-31] -> 0 | AX41: =RC[-31] -> 0 | AY41: =RC[-31] -> 3.41 | BA41: - | BB41: - | BC41: -
A42: =IF(RC[1]="","",DATEVALUE(RC[1])) -> 43394 | B42: 21.10.18 | C42: 24 | D42: 226.9 | E42: 50.37 | F42: 7.8 | G42: 209.83 | H42: 41.17 | I42: 4.8 | J42: =RC[-5]-RC[-2] -> 9.1999999999999957 | K42: 17.07 | L42: 2.8029999999999999 | T42: =RC[-8]+RC[-1] -> 2.8029999999999999 | U42: =(RC[-17]*RC[-16]-RC[-14]*RC[-13])/1000 -> 2.7902518999999995 | V42: - | W42: - | X42: =RC[-2]*RC[-10]/1000 -> #VALUE! | Y42: =(RC[-3]*RC[-11]-RC[-2]*RC[-9])/1000 -> #VALUE! | Z42: 2013-12-21T00:00:00.000 | AA42: 2013-12-19T00:00:00.000 | AD42: =VALUE(RC[-28]) -> 2018-10-21T00:00:00.000 | AE42: =IF(RC[22]=42,"*",IF(RC[22]=32,"",RC[22])) -> - | AF42: =RC[-29] -> 24 | AG42: =RC[-29] -> 226.9 | AH42: =RC[-29] -> 50.37 | AI42: =RC[-29] -> 7.8 | AJ42: =RC[-29] -> 209.83 | AK42: =RC[-29] -> 41.17 | AL42: =RC[-29] -> 4.8 | AM42: =RC[-29] -> 9.1999999999999957 | AN42: =RC[-29] -> 17.07 | AO42: =RC[-29] -> 2.8029999999999999 | AP42: =RC[-29] -> 0 | AQ42: =RC[-29] -> 0 | AR42: - | AS42: =RC[-30] -> 0 | AT42: =RC[-30] -> 0 | AU42: - | AV42: =RC[-31] -> 0 | AW42: =RC[-31] -> 0 | AX42: =RC[-31] -> 0 | AY42: =RC[-31] -> 2.8029999999999999 | BA42: - | BB42: - | BC42: -
A43: =IF(RC[1]="","",DATEVALUE(RC[1])) -> 43395 | B43: 22.10.18 | C43: 24 | D43: 226.07 | E43: 50.98 | F43: 7.8 | G43: 226.07 | H43: 41.59 | I43: 4.8 | J43: =RC[-5]-RC[-2] -> 9.3899999999999935 | K43: 0 | L43: 2.1320000000000001 | T43: =RC[-8]+RC[-1] -> 2.1320000000000001 | U43: =(RC[-17]*RC[-16]-RC[-14]*RC[-13])/1000 -> 2.1227972999999984 | V43: - | W43: - | X43: =RC[-2]*RC[-10]/1000 -> #VALUE! | Y43: =(RC[-3]*RC[-11]-RC[-2]*RC[-9])/1000 -> #VALUE! | Z43: 2013-12-22T00:00:00.000 | AA43: 2013-12-20T00:00:00.000 | AD43: =VALUE(RC[-28]) -> 2018-10-22T00:00:00.000 | AE43: =IF(RC[22]=42,"*",IF(RC[22]=32,"",RC[22])) -> - | AF43: =RC[-29] -> 24 | AG43: =RC[-29] -> 226.07 | AH43: =RC[-29] -> 50.98 | AI43: =RC[-29] -> 7.8 | AJ43: =RC[-29] -> 226.07 | AK43: =RC[-29] -> 41.59 | AL43: =RC[-29] -> 4.8 | AM43: =RC[-29] -> 9.3899999999999935 | AN43: =RC[-29] -> 0 | AO43: =RC[-29] -> 2.1320000000000001 | AP43: =RC[-29] -> 0 | AQ43: =RC[-29] -> 0 | AR43: - | AS43: =RC[-30] -> 0 | AT43: =RC[-30] -> 0 | AU43: - | AV43: =RC[-31] -> 0 | AW43: =RC[-31] -> 0 | AX43: =RC[-31] -> 0 | AY43: =RC[-31] -> 2.1320000000000001 | BA43: - | BB43: - | BC43: -
A44: =IF(RC[1]="","",DATEVALUE(RC[1])) ->  | C44: 24 | J44: =RC[-5]-RC[-2] -> #VALUE! | T44: =RC[-8]+RC[-1] -> #VALUE! | U44: =(RC[-17]*RC[-16]-RC[-14]*RC[-13])/1000 -> #VALUE! | X44: =RC[-2]*RC[-10]/1000 -> #VALUE! | Y44: =(RC[-3]*RC[-11]-RC[-2]*RC[-9])/1000 -> #VALUE! | AD44: =VALUE(RC[-28]) -> #VALUE! | AE44: =IF(RC[22]=42,"*",IF(RC[22]=32,"",RC[22])) ->  | AF44: =RC[-29] -> 24 | AG44: =RC[-29] ->  | AH44: =RC[-29] ->  | AI44: =RC[-29] ->  | AJ44: =RC[-29] ->  | AK44: =RC[-29] ->  | AL44: =RC[-29] ->  | AM44: =RC[-29] -> #VALUE! | AN44: =RC[-29] ->  | AO44: =RC[-29] ->  | AP44: =RC[-29] -> 0 | AQ44: =RC[-29] -> 0 | AR44: - | AS44: =RC[-30] -> 0 | AT44: =RC[-30] -> 0 | AU44: - | AV44: =RC[-31] -> 0 | AW44: =RC[-31] -> 0 | AX44: =RC[-31] -> 0 | AY44: =RC[-31] -> #VALUE!
A45: =IF(RC[1]="","",DATEVALUE(RC[1])) ->  | C45: 24 | J45: =RC[-5]-RC[-2] -> #VALUE! | T45: =RC[-8]+RC[-1] -> #VALUE! | U45: =(RC[-17]*RC[-16]-RC[-14]*RC[-13])/1000 -> #VALUE! | X45: =RC[-2]*RC[-10]/1000 -> #VALUE! | Y45: =(RC[-3]*RC[-11]-RC[-2]*RC[-9])/1000 -> #VALUE! | AD45: =VALUE(RC[-28]) -> #VALUE! | AE45: =IF(RC[22]=42,"*",IF(RC[22]=32,"",RC[22])) ->  | AF45: =RC[-29] -> 24 | AG45: =RC[-29] ->  | AH45: =RC[-29] ->  | AI45: =RC[-29] ->  | AJ45: =RC[-29] ->  | AK45: =RC[-29] ->  | AL45: =RC[-29] ->  | AM45: =RC[-29] -> #VALUE! | AN45: =RC[-29] ->  | AO45: =RC[-29] ->  | AP45: =RC[-29] -> 0 | AQ45: =RC[-29] -> 0 | AR45: - | AS45: =RC[-30] -> 0 | AT45: =RC[-30] -> 0 | AU45: - | AV45: =RC[-31] -> 0 | AW45: =RC[-31] -> 0 | AX45: =RC[-31] -> 0 | AY45: =RC[-31] -> #VALUE!
A46: =IF(RC[1]="","",DATEVALUE(RC[1])) ->  | C46: 24 | J46: =RC[-5]-RC[-2] -> #VALUE! | T46: =RC[-8]+RC[-1] -> #VALUE! | U46: =(RC[-17]*RC[-16]-RC[-14]*RC[-13])/1000 -> #VALUE! | X46: =RC[-2]*RC[-10]/1000 -> #VALUE! | Y46: =(RC[-3]*RC[-11]-RC[-2]*RC[-9])/1000 -> #VALUE! | AD46: =VALUE(RC[-28]) -> #VALUE! | AE46: =IF(RC[22]=42,"*",IF(RC[22]=32,"",RC[22])) ->  | AF46: =RC[-29] -> 24 | AG46: =RC[-29] ->  | AH46: =RC[-29] ->  | AI46: =RC[-29] ->  | AJ46: =RC[-29] ->  | AK46: =RC[-29] ->  | AL46: =RC[-29] ->  | AM46: =RC[-29] -> #VALUE! | AN46: =RC[-29] ->  | AO46: =RC[-29] ->  | AP46: =RC[-29] -> 0 | AQ46: =RC[-29] -> 0 | AR46: - | AS46: =RC[-30] -> 0 | AT46: =RC[-30] -> 0 | AU46: - | AV46: =RC[-31] -> 0 | AW46: =RC[-31] -> 0 | AX46: =RC[-31] -> 0 | AY46: =RC[-31] -> #VALUE!
A47: =IF(RC[1]="","",DATEVALUE(RC[1])) ->  | C47: 24 | J47: =RC[-5]-RC[-2] -> #VALUE! | T47: =RC[-8]+RC[-1] -> #VALUE! | U47: =(RC[-17]*RC[-16]-RC[-14]*RC[-13])/1000 -> #VALUE! | X47: =RC[-2]*RC[-10]/1000 -> #VALUE! | Y47: =(RC[-3]*RC[-11]-RC[-2]*RC[-9])/1000 -> #VALUE! | AD47: =VALUE(RC[-28]) -> #VALUE! | AE47: =IF(RC[22]=42,"*",IF(RC[22]=32,"",RC[22])) ->  | AF47: =RC[-29] -> 24 | AG47: =RC[-29] ->  | AH47: =RC[-29] ->  | AI47: =RC[-29] ->  | AJ47: =RC[-29] ->  | AK47: =RC[-29] ->  | AL47: =RC[-29] ->  | AM47: =RC[-29] -> #VALUE! | AN47: =RC[-29] ->  | AO47: =RC[-29] ->  | AP47: =RC[-29] -> 0 | AQ47: =RC[-29] -> 0 | AR47: - | AS47: =RC[-30] -> 0 | AT47: =RC[-30] -> 0 | AU47: - | AV47: =RC[-31] -> 0 | AW47: =RC[-31] -> 0 | AX47: =RC[-31] -> 0 | AY47: =RC[-31] -> #VALUE!
A48: =IF(RC[1]="","",DATEVALUE(RC[1])) ->  | C48: 24 | J48: =RC[-5]-RC[-2] -> #VALUE! | T48: =RC[-8]+RC[-1] -> #VALUE! | U48: =(RC[-17]*RC[-16]-RC[-14]*RC[-13])/1000 -> #VALUE! | X48: =RC[-2]*RC[-10]/1000 -> #VALUE! | Y48: =(RC[-3]*RC[-11]-RC[-2]*RC[-9])/1000 -> #VALUE! | AD48: =VALUE(RC[-28]) -> #VALUE! | AE48: =IF(RC[22]=42,"*",IF(RC[22]=32,"",RC[22])) ->  | AF48: =RC[-29] -> 24 | AG48: =RC[-29] ->  | AH48: =RC[-29] ->  | AI48: =RC[-29] ->  | AJ48: =RC[-29] ->  | AK48: =RC[-29] ->  | AL48: =RC[-29] ->  | AM48: =RC[-29] -> #VALUE! | AN48: =RC[-29] ->  | AO48: =RC[-29] ->  | AP48: =RC[-29] -> 0 | AQ48: =RC[-29] -> 0 | AR48: - | AS48: =RC[-30] -> 0 | AT48: =RC[-30] -> 0 | AU48: - | AV48: =RC[-31] -> 0 | AW48: =RC[-31] -> 0 | AX48: =RC[-31] -> 0 | AY48: =RC[-31] -> #VALUE!
A49: =IF(RC[1]="","",DATEVALUE(RC[1])) ->  | C49: 24 | J49: =RC[-5]-RC[-2] -> #VALUE! | T49: =RC[-8]+RC[-1] -> #VALUE! | U49: =(RC[-17]*RC[-16]-RC[-14]*RC[-13])/1000 -> #VALUE! | X49: =RC[-2]*RC[-10]/1000 -> #VALUE! | Y49: =(RC[-3]*RC[-11]-RC[-2]*RC[-9])/1000 -> #VALUE! | AD49: =VALUE(RC[-28]) -> #VALUE! | AE49: =IF(RC[22]=42,"*",IF(RC[22]=32,"",RC[22])) ->  | AF49: =RC[-29] -> 24 | AG49: =RC[-29] ->  | AH49: =RC[-29] ->  | AI49: =RC[-29] ->  | AJ49: =RC[-29] ->  | AK49: =RC[-29] ->  | AL49: =RC[-29] ->  | AM49: =RC[-29] -> #VALUE! | AN49: =RC[-29] ->  | AO49: =RC[-29] ->  | AP49: =RC[-29] -> 0 | AQ49: =RC[-29] -> 0 | AR49: - | AS49: =RC[-30] -> 0 | AT49: =RC[-30] -> 0 | AU49: - | AV49: =RC[-31] -> 0 | AW49: =RC[-31] -> 0 | AX49: =RC[-31] -> 0 | AY49: =RC[-31] -> #VALUE!
A50: =IF(RC[1]="","",DATEVALUE(RC[1])) ->  | C50: 24 | J50: =RC[-5]-RC[-2] -> #VALUE! | T50: =RC[-8]+RC[-1] -> #VALUE! | U50: =(RC[-17]*RC[-16]-RC[-14]*RC[-13])/1000 -> #VALUE! | X50: =RC[-2]*RC[-10]/1000 -> #VALUE! | Y50: =(RC[-3]*RC[-11]-RC[-2]*RC[-9])/1000 -> #VALUE! | AD50: =VALUE(RC[-28]) -> #VALUE! | AE50: =IF(RC[22]=42,"*",IF(RC[22]=32,"",RC[22])) ->  | AF50: =RC[-29] -> 24 | AG50: =RC[-29] ->  | AH50: =RC[-29] ->  | AI50: =RC[-29] ->  | AJ50: =RC[-29] ->  | AK50: =RC[-29] ->  | AL50: =RC[-29] ->  | AM50: =RC[-29] -> #VALUE! | AN50: =RC[-29] ->  | AO50: =RC[-29] ->  | AP50: =RC[-29] -> 0 | AQ50: =RC[-29] -> 0 | AR50: - | AS50: =RC[-30] -> 0 | AT50: =RC[-30] -> 0 | AU50: - | AV50: =RC[-31] -> 0 | AW50: =RC[-31] -> 0 | AX50: =RC[-31] -> 0 | AY50: =RC[-31] -> #VALUE!
A51: =IF(RC[1]="","",DATEVALUE(RC[1])) ->  | C51: 24 | J51: =RC[-5]-RC[-2] -> #VALUE! | T51: =RC[-8]+RC[-1] -> #VALUE! | U51: =(RC[-17]*RC[-16]-RC[-14]*RC[-13])/1000 -> #VALUE! | X51: =RC[-2]*RC[-10]/1000 -> #VALUE! | Y51: =(RC[-3]*RC[-11]-RC[-2]*RC[-9])/1000 -> #VALUE! | AD51: =VALUE(RC[-28]) -> #VALUE! | AE51: =IF(RC[22]=42,"*",IF(RC[22]=32,"",RC[22])) ->  | AF51: =RC[-29] -> 24 | AG51: =RC[-29] ->  | AH51: =RC[-29] ->  | AI51: =RC[-29] ->  | AJ51: =RC[-29] ->  | AK51: =RC[-29] ->  | AL51: =RC[-29] ->  | AM51: =RC[-29] -> #VALUE! | AN51: =RC[-29] ->  | AO51: =RC[-29] ->  | AP51: =RC[-29] -> 0 | AQ51: =RC[-29] -> 0 | AR51: - | AS51: =RC[-30] -> 0 | AT51: =RC[-30] -> 0 | AU51: - | AV51: =RC[-31] -> 0 | AW51: =RC[-31] -> 0 | AX51: =RC[-31] -> 0 | AY51: =RC[-31] -> #VALUE!
A52: =IF(RC[1]="","",DATEVALUE(RC[1])) ->  | C52: 24 | J52: =RC[-5]-RC[-2] -> #VALUE! | T52: =RC[-8]+RC[-1] -> #VALUE! | U52: =(RC[-17]*RC[-16]-RC[-14]*RC[-13])/1000 -> #VALUE! | X52: =RC[-2]*RC[-10]/1000 -> #VALUE! | Y52: =(RC[-3]*RC[-11]-RC[-2]*RC[-9])/1000 -> #VALUE! | AD52: =VALUE(RC[-28]) -> #VALUE! | AE52: =IF(RC[22]=42,"*",IF(RC[22]=32,"",RC[22])) ->  | AF52: =RC[-29] -> 24 | AG52: =RC[-29] ->  | AH52: =RC[-29] ->  | AI52: =RC[-29] ->  | AJ52: =RC[-29] ->  | AK52: =RC[-29] ->  | AL52: =RC[-29] ->  | AM52: =RC[-29] -> #VALUE! | AN52: =RC[-29] ->  | AO52: =RC[-29] ->  | AP52: =RC[-29] -> 0 | AQ52: =RC[-29] -> 0 | AR52: - | AS52: =RC[-30] -> 0 | AT52: =RC[-30] -> 0 | AU52: - | AV52: =RC[-31] -> 0 | AW52: =RC[-31] -> 0 | AX52: =RC[-31] -> 0 | AY52: =RC[-31] -> #VALUE!
A53: =IF(RC[1]="","",DATEVALUE(RC[1])) ->  | C53: 24 | J53: =RC[-5]-RC[-2] -> #VALUE! | T53: =RC[-8]+RC[-1] -> #VALUE! | U53: =(RC[-17]*RC[-16]-RC[-14]*RC[-13])/1000 -> #VALUE! | X53: =RC[-2]*RC[-10]/1000 -> #VALUE! | Y53: =(RC[-3]*RC[-11]-RC[-2]*RC[-9])/1000 -> #VALUE! | AD53: =VALUE(RC[-28]) -> #VALUE! | AE53: =IF(RC[22]=42,"*",IF(RC[22]=32,"",RC[22])) ->  | AF53: =RC[-29] -> 24 | AG53: =RC[-29] ->  | AH53: =RC[-29] ->  | AI53: =RC[-29] ->  | AJ53: =RC[-29] ->  | AK53: =RC[-29] ->  | AL53: =RC[-29] ->  | AM53: =RC[-29] -> #VALUE! | AN53: =RC[-29] ->  | AO53: =RC[-29] ->  | AP53: =RC[-29] -> 0 | AQ53: =RC[-29] -> 0 | AR53: - | AS53: =RC[-30] -> 0 | AT53: =RC[-30] -> 0 | AU53: - | AV53: =RC[-31] -> 0 | AW53: =RC[-31] -> 0 | AX53: =RC[-31] -> 0 | AY53: =RC[-31] -> #VALUE!
A54: =IF(RC[1]="","",DATEVALUE(RC[1])) ->  | C54: 24 | J54: =RC[-5]-RC[-2] -> #VALUE! | T54: =RC[-8]+RC[-1] -> #VALUE! | U54: =(RC[-17]*RC[-16]-RC[-14]*RC[-13])/1000 -> #VALUE! | X54: =RC[-2]*RC[-10]/1000 -> #VALUE! | Y54: =(RC[-3]*RC[-11]-RC[-2]*RC[-9])/1000 -> #VALUE! | AD54: =VALUE(RC[-28]) -> #VALUE! | AE54: =IF(RC[22]=42,"*",IF(RC[22]=32,"",RC[22])) ->  | AF54: =RC[-29] -> 24 | AG54: =RC[-29] ->  | AH54: =RC[-29] ->  | AI54: =RC[-29] ->  | AJ54: =RC[-29] ->  | AK54: =RC[-29] ->  | AL54: =RC[-29] ->  | AM54: =RC[-29] -> #VALUE! | AN54: =RC[-29] ->  | AO54: =RC[-29] ->  | AP54: =RC[-29] -> 0 | AQ54: =RC[-29] -> 0 | AR54: - | AS54: =RC[-30] -> 0 | AT54: =RC[-30] -> 0 | AU54: - | AV54: =RC[-31] -> 0 | AW54: =RC[-31] -> 0 | AX54: =RC[-31] -> 0 | AY54: =RC[-31] -> #VALUE!
A55: =IF(RC[1]="","",DATEVALUE(RC[1])) ->  | C55: 24 | J55: =RC[-5]-RC[-2] -> #VALUE! | T55: =RC[-8]+RC[-1] -> #VALUE! | U55: =(RC[-17]*RC[-16]-RC[-14]*RC[-13])/1000 -> #VALUE! | X55: =RC[-2]*RC[-10]/1000 -> #VALUE! | Y55: =(RC[-3]*RC[-11]-RC[-2]*RC[-9])/1000 -> #VALUE! | AD55: =VALUE(RC[-28]) -> #VALUE! | AE55: =IF(RC[22]=42,"*",IF(RC[22]=32,"",RC[22])) ->  | AF55: =RC[-29] -> 24 | AG55: =RC[-29] ->  | AH55: =RC[-29] ->  | AI55: =RC[-29] ->  | AJ55: =RC[-29] ->  | AK55: =RC[-29] ->  | AL55: =RC[-29] ->  | AM55: =RC[-29] -> #VALUE! | AN55: =RC[-29] ->  | AO55: =RC[-29] ->  | AP55: =RC[-29] -> 0 | AQ55: =RC[-29] -> 0 | AR55: - | AS55: =RC[-30] -> 0 | AT55: =RC[-30] -> 0 | AU55: - | AV55: =RC[-31] -> 0 | AW55: =RC[-31] -> 0 | AX55: =RC[-31] -> 0 | AY55: =RC[-31] -> #VALUE!
A56: =IF(RC[1]="","",DATEVALUE(RC[1])) ->  | C56: 24 | J56: =RC[-5]-RC[-2] -> #VALUE! | T56: =RC[-8]+RC[-1] -> #VALUE! | U56: =(RC[-17]*RC[-16]-RC[-14]*RC[-13])/1000 -> #VALUE! | X56: =RC[-2]*RC[-10]/1000 -> #VALUE! | Y56: =(RC[-3]*RC[-11]-RC[-2]*RC[-9])/1000 -> #VALUE! | AD56: =VALUE(RC[-28]) -> #VALUE! | AE56: =IF(RC[22]=42,"*",IF(RC[22]=32,"",RC[22])) ->  | AF56: =RC[-29] -> 24 | AG56: =RC[-29] ->  | AH56: =RC[-29] ->  | AI56: =RC[-29] ->  | AJ56: =RC[-29] ->  | AK56: =RC[-29] ->  | AL56: =RC[-29] ->  | AM56: =RC[-29] -> #VALUE! | AN56: =RC[-29] ->  | AO56: =RC[-29] ->  | AP56: =RC[-29] -> 0 | AQ56: =RC[-29] -> 0 | AR56: - | AS56: =RC[-30] -> 0 | AT56: =RC[-30] -> 0 | AU56: - | AV56: =RC[-31] -> 0 | AW56: =RC[-31] -> 0 | AX56: =RC[-31] -> 0 | AY56: =RC[-31] -> #VALUE!
A57: =IF(RC[1]="","",DATEVALUE(RC[1])) ->  | C57: 24 | J57: =RC[-5]-RC[-2] -> #VALUE! | T57: =RC[-8]+RC[-1] -> #VALUE! | U57: =(RC[-17]*RC[-16]-RC[-14]*RC[-13])/1000 -> #VALUE! | X57: =RC[-2]*RC[-10]/1000 -> #VALUE! | Y57: =(RC[-3]*RC[-11]-RC[-2]*RC[-9])/1000 -> #VALUE! | AD57: =VALUE(RC[-28]) -> #VALUE! | AE57: =IF(RC[22]=42,"*",IF(RC[22]=32,"",RC[22])) ->  | AF57: =RC[-29] -> 24 | AG57: =RC[-29] ->  | AH57: =RC[-29] ->  | AI57: =RC[-29] ->  | AJ57: =RC[-29] ->  | AK57: =RC[-29] ->  | AL57: =RC[-29] ->  | AM57: =RC[-29] -> #VALUE! | AN57: =RC[-29] ->  | AO57: =RC[-29] ->  | AP57: =RC[-29] -> 0 | AQ57: =RC[-29] -> 0 | AR57: - | AS57: =RC[-30] -> 0 | AT57: =RC[-30] -> 0 | AU57: - | AV57: =RC[-31] -> 0 | AW57: =RC[-31] -> 0 | AX57: =RC[-31] -> 0 | AY57: =RC[-31] -> #VALUE!
A58: =IF(RC[1]="","",DATEVALUE(RC[1])) ->  | C58: 24 | J58: =RC[-5]-RC[-2] -> #VALUE! | T58: =RC[-8]+RC[-1] -> #VALUE! | U58: =(RC[-17]*RC[-16]-RC[-14]*RC[-13])/1000 -> #VALUE! | X58: =RC[-2]*RC[-10]/1000 -> #VALUE! | Y58: =(RC[-3]*RC[-11]-RC[-2]*RC[-9])/1000 -> #VALUE! | AD58: =VALUE(RC[-28]) -> #VALUE! | AE58: =IF(RC[22]=42,"*",IF(RC[22]=32,"",RC[22])) ->  | AF58: =RC[-29] -> 24 | AG58: =RC[-29] ->  | AH58: =RC[-29] ->  | AI58: =RC[-29] ->  | AJ58: =RC[-29] ->  | AK58: =RC[-29] ->  | AL58: =RC[-29] ->  | AM58: =RC[-29] -> #VALUE! | AN58: =RC[-29] ->  | AO58: =RC[-29] ->  | AP58: =RC[-29] -> 0 | AQ58: =RC[-29] -> 0 | AR58: - | AS58: =RC[-30] -> 0 | AT58: =RC[-30] -> 0 | AU58: - | AV58: =RC[-31] -> 0 | AW58: =RC[-31] -> 0 | AX58: =RC[-31] -> 0 | AY58: =RC[-31] -> #VALUE!
A59: =IF(RC[1]="","",DATEVALUE(RC[1])) ->  | C59: 24 | J59: =RC[-5]-RC[-2] -> #VALUE! | T59: =RC[-8]+RC[-1] -> #VALUE! | U59: =(RC[-17]*RC[-16]-RC[-14]*RC[-13])/1000 -> #VALUE! | X59: =RC[-2]*RC[-10]/1000 -> #VALUE! | Y59: =(RC[-3]*RC[-11]-RC[-2]*RC[-9])/1000 -> #VALUE! | AD59: =VALUE(RC[-28]) -> #VALUE! | AE59: =IF(RC[22]=42,"*",IF(RC[22]=32,"",RC[22])) ->  | AF59: =RC[-29] -> 24 | AG59: =RC[-29] ->  | AH59: =RC[-29] ->  | AI59: =RC[-29] ->  | AJ59: =RC[-29] ->  | AK59: =RC[-29] ->  | AL59: =RC[-29] ->  | AM59: =RC[-29] -> #VALUE! | AN59: =RC[-29] ->  | AO59: =RC[-29] ->  | AP59: =RC[-29] -> 0 | AQ59: =RC[-29] -> 0 | AR59: - | AS59: =RC[-30] -> 0 | AT59: =RC[-30] -> 0 | AU59: - | AV59: =RC[-31] -> 0 | AW59: =RC[-31] -> 0 | AX59: =RC[-31] -> 0 | AY59: =RC[-31] -> #VALUE!
A60: =IF(RC[1]="","",DATEVALUE(RC[1])) ->  | C60: 24 | J60: =RC[-5]-RC[-2] -> #VALUE! | T60: =RC[-8]+RC[-1] -> #VALUE! | U60: =(RC[-17]*RC[-16]-RC[-14]*RC[-13])/1000 -> #VALUE! | X60: =RC[-2]*RC[-10]/1000 -> #VALUE! | Y60: =(RC[-3]*RC[-11]-RC[-2]*RC[-9])/1000 -> #VALUE! | AD60: =VALUE(RC[-28]) -> #VALUE! | AE60: =IF(RC[22]=42,"*",IF(RC[22]=32,"",RC[22])) ->  | AF60: =RC[-29] -> 24 | AG60: =RC[-29] ->  | AH60: =RC[-29] ->  | AI60: =RC[-29] ->  | AJ60: =RC[-29] ->  | AK60: =RC[-29] ->  | AL60: =RC[-29] ->  | AM60: =RC[-29] -> #VALUE! | AN60: =RC[-29] ->  | AO60: =RC[-29] ->  | AP60: =RC[-29] -> 0 | AQ60: =RC[-29] -> 0 | AR60: - | AS60: =RC[-30] -> 0 | AT60: =RC[-30] -> 0 | AU60: - | AV60: =RC[-31] -> 0 | AW60: =RC[-31] -> 0 | AX60: =RC[-31] -> 0 | AY60: =RC[-31] -> #VALUE!
A61: =IF(RC[1]="","",DATEVALUE(RC[1])) ->  | C61: 24 | J61: =RC[-5]-RC[-2] -> #VALUE! | T61: =RC[-8]+RC[-1] -> #VALUE! | U61: =(RC[-17]*RC[-16]-RC[-14]*RC[-13])/1000 -> #VALUE! | X61: =RC[-2]*RC[-10]/1000 -> #VALUE! | Y61: =(RC[-3]*RC[-11]-RC[-2]*RC[-9])/1000 -> #VALUE! | AD61: =VALUE(RC[-28]) -> #VALUE! | AE61: =IF(RC[22]=42,"*",IF(RC[22]=32,"",RC[22])) ->  | AF61: =RC[-29] -> 24 | AG61: =RC[-29] ->  | AH61: =RC[-29] ->  | AI61: =RC[-29] ->  | AJ61: =RC[-29] ->  | AK61: =RC[-29] ->  | AL61: =RC[-29] ->  | AM61: =RC[-29] -> #VALUE! | AN61: =RC[-29] ->  | AO61: =RC[-29] ->  | AP61: =RC[-29] -> 0 | AQ61: =RC[-29] -> 0 | AR61: - | AS61: =RC[-30] -> 0 | AT61: =RC[-30] -> 0 | AU61: - | AV61: =RC[-31] -> 0 | AW61: =RC[-31] -> 0 | AX61: =RC[-31] -> 0 | AY61: =RC[-31] -> #VALUE!
A62: =IF(RC[1]="","",DATEVALUE(RC[1])) ->  | C62: 24 | J62: =RC[-5]-RC[-2] -> #VALUE! | T62: =RC[-8]+RC[-1] -> #VALUE! | U62: =(RC[-17]*RC[-16]-RC[-14]*RC[-13])/1000 -> #VALUE! | X62: =RC[-2]*RC[-10]/1000 -> #VALUE! | Y62: =(RC[-3]*RC[-11]-RC[-2]*RC[-9])/1000 -> #VALUE! | AD62: =VALUE(RC[-28]) -> #VALUE! | AE62: =IF(RC[22]=42,"*",IF(RC[22]=32,"",RC[22])) ->  | AF62: =RC[-29] -> 24 | AG62: =RC[-29] ->  | AH62: =RC[-29] ->  | AI62: =RC[-29] ->  | AJ62: =RC[-29] ->  | AK62: =RC[-29] ->  | AL62: =RC[-29] ->  | AM62: =RC[-29] -> #VALUE! | AN62: =RC[-29] ->  | AO62: =RC[-29] ->  | AP62: =RC[-29] -> 0 | AQ62: =RC[-29] -> 0 | AR62: - | AS62: =RC[-30] -> 0 | AT62: =RC[-30] -> 0 | AU62: - | AV62: =RC[-31] -> 0 | AW62: =RC[-31] -> 0 | AX62: =RC[-31] -> 0 | AY62: =RC[-31] -> #VALUE!
A63: =IF(RC[1]="","",DATEVALUE(RC[1])) ->  | C63: 24 | J63: =RC[-5]-RC[-2] -> #VALUE! | T63: =RC[-8]+RC[-1] -> #VALUE! | U63: =(RC[-17]*RC[-16]-RC[-14]*RC[-13])/1000 -> #VALUE! | X63: =RC[-2]*RC[-10]/1000 -> #VALUE! | Y63: =(RC[-3]*RC[-11]-RC[-2]*RC[-9])/1000 -> #VALUE! | AD63: =VALUE(RC[-28]) -> #VALUE! | AE63: =IF(RC[22]=42,"*",IF(RC[22]=32,"",RC[22])) ->  | AF63: =RC[-29] -> 24 | AG63: =RC[-29] ->  | AH63: =RC[-29] ->  | AI63: =RC[-29] ->  | AJ63: =RC[-29] ->  | AK63: =RC[-29] ->  | AL63: =RC[-29] ->  | AM63: =RC[-29] -> #VALUE! | AN63: =RC[-29] ->  | AO63: =RC[-29] ->  | AP63: =RC[-29] -> 0 | AQ63: =RC[-29] -> 0 | AR63: - | AS63: =RC[-30] -> 0 | AT63: =RC[-30] -> 0 | AU63: - | AV63: =RC[-31] -> 0 | AW63: =RC[-31] -> 0 | AX63: =RC[-31] -> 0 | AY63: =RC[-31] -> #VALUE!
A64: =IF(RC[1]="","",DATEVALUE(RC[1])) ->  | C64: 24 | J64: =RC[-5]-RC[-2] -> #VALUE! | T64: =RC[-8]+RC[-1] -> #VALUE! | U64: =(RC[-17]*RC[-16]-RC[-14]*RC[-13])/1000 -> #VALUE! | X64: =RC[-2]*RC[-10]/1000 -> #VALUE! | Y64: =(RC[-3]*RC[-11]-RC[-2]*RC[-9])/1000 -> #VALUE! | AD64: =VALUE(RC[-28]) -> #VALUE! | AE64: =IF(RC[22]=42,"*",IF(RC[22]=32,"",RC[22])) ->  | AF64: =RC[-29] -> 24 | AG64: =RC[-29] ->  | AH64: =RC[-29] ->  | AI64: =RC[-29] ->  | AJ64: =RC[-29] ->  | AK64: =RC[-29] ->  | AL64: =RC[-29] ->  | AM64: =RC[-29] -> #VALUE! | AN64: =RC[-29] ->  | AO64: =RC[-29] ->  | AP64: =RC[-29] -> 0 | AQ64: =RC[-29] -> 0 | AR64: - | AS64: =RC[-30] -> 0 | AT64: =RC[-30] -> 0 | AU64: - | AV64: =RC[-31] -> 0 | AW64: =RC[-31] -> 0 | AX64: =RC[-31] -> 0 | AY64: =RC[-31] -> #VALUE!
A65: =IF(RC[1]="","",DATEVALUE(RC[1])) ->  | C65: 24 | J65: =RC[-5]-RC[-2] -> #VALUE! | T65: =RC[-8]+RC[-1] -> #VALUE! | U65: =(RC[-17]*RC[-16]-RC[-14]*RC[-13])/1000 -> #VALUE! | X65: =RC[-2]*RC[-10]/1000 -> #VALUE! | Y65: =(RC[-3]*RC[-11]-RC[-2]*RC[-9])/1000 -> #VALUE! | AD65: =VALUE(RC[-28]) -> #VALUE! | AE65: =IF(RC[22]=42,"*",IF(RC[22]=32,"",RC[22])) ->  | AF65: =RC[-29] -> 24 | AG65: =RC[-29] ->  | AH65: =RC[-29] ->  | AI65: =RC[-29] ->  | AJ65: =RC[-29] ->  | AK65: =RC[-29] ->  | AL65: =RC[-29] ->  | AM65: =RC[-29] -> #VALUE! | AN65: =RC[-29] ->  | AO65: =RC[-29] ->  | AP65: =RC[-29] -> 0 | AQ65: =RC[-29] -> 0 | AR65: - | AS65: =RC[-30] -> 0 | AT65: =RC[-30] -> 0 | AU65: - | AV65: =RC[-31] -> 0 | AW65: =RC[-31] -> 0 | AX65: =RC[-31] -> 0 | AY65: =RC[-31] -> #VALUE!
A66: =IF(RC[1]="","",DATEVALUE(RC[1])) ->  | C66: 24 | J66: =RC[-5]-RC[-2] -> #VALUE! | T66: =RC[-8]+RC[-1] -> #VALUE! | U66: =(RC[-17]*RC[-16]-RC[-14]*RC[-13])/1000 -> #VALUE! | X66: =RC[-2]*RC[-10]/1000 -> #VALUE! | Y66: =(RC[-3]*RC[-11]-RC[-2]*RC[-9])/1000 -> #VALUE! | AD66: =VALUE(RC[-28]) -> #VALUE! | AE66: =IF(RC[22]=42,"*",IF(RC[22]=32,"",RC[22])) ->  | AF66: =RC[-29] -> 24 | AG66: =RC[-29] ->  | AH66: =RC[-29] ->  | AI66: =RC[-29] ->  | AJ66: =RC[-29] ->  | AK66: =RC[-29] ->  | AL66: =RC[-29] ->  | AM66: =RC[-29] -> #VALUE! | AN66: =RC[-29] ->  | AO66: =RC[-29] ->  | AP66: =RC[-29] -> 0 | AQ66: =RC[-29] -> 0 | AR66: - | AS66: =RC[-30] -> 0 | AT66: =RC[-30] -> 0 | AU66: - | AV66: =RC[-31] -> 0 | AW66: =RC[-31] -> 0 | AX66: =RC[-31] -> 0 | AY66: =RC[-31] -> #VALUE!
A67: =IF(RC[1]="","",DATEVALUE(RC[1])) ->  | C67: 24 | J67: =RC[-5]-RC[-2] -> #VALUE! | T67: =RC[-8]+RC[-1] -> #VALUE! | U67: =(RC[-17]*RC[-16]-RC[-14]*RC[-13])/1000 -> #VALUE! | X67: =RC[-2]*RC[-10]/1000 -> #VALUE! | Y67: =(RC[-3]*RC[-11]-RC[-2]*RC[-9])/1000 -> #VALUE! | AD67: =VALUE(RC[-28]) -> #VALUE! | AE67: =IF(RC[22]=42,"*",IF(RC[22]=32,"",RC[22])) ->  | AF67: =RC[-29] -> 24 | AG67: =RC[-29] ->  | AH67: =RC[-29] ->  | AI67: =RC[-29] ->  | AJ67: =RC[-29] ->  | AK67: =RC[-29] ->  | AL67: =RC[-29] ->  | AM67: =RC[-29] -> #VALUE! | AN67: =RC[-29] ->  | AO67: =RC[-29] ->  | AP67: =RC[-29] -> 0 | AQ67: =RC[-29] -> 0 | AR67: - | AS67: =RC[-30] -> 0 | AT67: =RC[-30] -> 0 | AU67: - | AV67: =RC[-31] -> 0 | AW67: =RC[-31] -> 0 | AX67: =RC[-31] -> 0 | AY67: =RC[-31] -> #VALUE!
A68: =IF(RC[1]="","",DATEVALUE(RC[1])) ->  | C68: 24 | J68: =RC[-5]-RC[-2] -> #VALUE! | T68: =RC[-8]+RC[-1] -> #VALUE! | U68: =(RC[-17]*RC[-16]-RC[-14]*RC[-13])/1000 -> #VALUE! | X68: =RC[-2]*RC[-10]/1000 -> #VALUE! | Y68: =(RC[-3]*RC[-11]-RC[-2]*RC[-9])/1000 -> #VALUE! | AD68: =VALUE(RC[-28]) -> #VALUE! | AE68: =IF(RC[22]=42,"*",IF(RC[22]=32,"",RC[22])) ->  | AF68: =RC[-29] -> 24 | AG68: =RC[-29] ->  | AH68: =RC[-29] ->  | AI68: =RC[-29] ->  | AJ68: =RC[-29] ->  | AK68: =RC[-29] ->  | AL68: =RC[-29] ->  | AM68: =RC[-29] -> #VALUE! | AN68: =RC[-29] ->  | AO68: =RC[-29] ->  | AP68: =RC[-29] -> 0 | AQ68: =RC[-29] -> 0 | AR68: - | AS68: =RC[-30] -> 0 | AT68: =RC[-30] -> 0 | AU68: - | AV68: =RC[-31] -> 0 | AW68: =RC[-31] -> 0 | AX68: =RC[-31] -> 0 | AY68: =RC[-31] -> #VALUE!
A69: =IF(RC[1]="","",DATEVALUE(RC[1])) ->  | C69: 24 | J69: =RC[-5]-RC[-2] -> #VALUE! | T69: =RC[-8]+RC[-1] -> #VALUE! | U69: =(RC[-17]*RC[-16]-RC[-14]*RC[-13])/1000 -> #VALUE! | X69: =RC[-2]*RC[-10]/1000 -> #VALUE! | Y69: =(RC[-3]*RC[-11]-RC[-2]*RC[-9])/1000 -> #VALUE! | AD69: =VALUE(RC[-28]) -> #VALUE! | AE69: =IF(RC[22]=42,"*",IF(RC[22]=32,"",RC[22])) ->  | AF69: =RC[-29] -> 24 | AG69: =RC[-29] ->  | AH69: =RC[-29] ->  | AI69: =RC[-29] ->  | AJ69: =RC[-29] ->  | AK69: =RC[-29] ->  | AL69: =RC[-29] ->  | AM69: =RC[-29] -> #VALUE! | AN69: =RC[-29] ->  | AO69: =RC[-29] ->  | AP69: =RC[-29] -> 0 | AQ69: =RC[-29] -> 0 | AR69: - | AS69: =RC[-30] -> 0 | AT69: =RC[-30] -> 0 | AU69: - | AV69: =RC[-31] -> 0 | AW69: =RC[-31] -> 0 | AX69: =RC[-31] -> 0 | AY69: =RC[-31] -> #VALUE!
A70: =IF(RC[1]="","",DATEVALUE(RC[1])) ->  | C70: 24 | J70: =RC[-5]-RC[-2] -> #VALUE! | T70: =RC[-8]+RC[-1] -> #VALUE! | U70: =(RC[-17]*RC[-16]-RC[-14]*RC[-13])/1000 -> #VALUE! | X70: =RC[-2]*RC[-10]/1000 -> #VALUE! | Y70: =(RC[-3]*RC[-11]-RC[-2]*RC[-9])/1000 -> #VALUE! | AD70: =VALUE(RC[-28]) -> #VALUE! | AE70: =IF(RC[22]=42,"*",IF(RC[22]=32,"",RC[22])) ->  | AF70: =RC[-29] -> 24 | AG70: =RC[-29] ->  | AH70: =RC[-29] ->  | AI70: =RC[-29] ->  | AJ70: =RC[-29] ->  | AK70: =RC[-29] ->  | AL70: =RC[-29] ->  | AM70: =RC[-29] -> #VALUE! | AN70: =RC[-29] ->  | AO70: =RC[-29] ->  | AP70: =RC[-29] -> 0 | AQ70: =RC[-29] -> 0 | AR70: - | AS70: =RC[-30] -> 0 | AT70: =RC[-30] -> 0 | AU70: - | AV70: =RC[-31] -> 0 | AW70: =RC[-31] -> 0 | AX70: =RC[-31] -> 0 | AY70: =RC[-31] -> #VALUE!
A71: =IF(RC[1]="","",DATEVALUE(RC[1])) ->  | C71: 24 | J71: =RC[-5]-RC[-2] -> #VALUE! | T71: =RC[-8]+RC[-1] -> #VALUE! | U71: =(RC[-17]*RC[-16]-RC[-14]*RC[-13])/1000 -> #VALUE! | X71: =RC[-2]*RC[-10]/1000 -> #VALUE! | Y71: =(RC[-3]*RC[-11]-RC[-2]*RC[-9])/1000 -> #VALUE! | AD71: =VALUE(RC[-28]) -> #VALUE! | AE71: =IF(RC[22]=42,"*",IF(RC[22]=32,"",RC[22])) ->  | AF71: =RC[-29] -> 24 | AG71: =RC[-29] ->  | AH71: =RC[-29] ->  | AI71: =RC[-29] ->  | AJ71: =RC[-29] ->  | AK71: =RC[-29] ->  | AL71: =RC[-29] ->  | AM71: =RC[-29] -> #VALUE! | AN71: =RC[-29] ->  | AO71: =RC[-29] ->  | AP71: =RC[-29] -> 0 | AQ71: =RC[-29] -> 0 | AR71: - | AS71: =RC[-30] -> 0 | AT71: =RC[-30] -> 0 | AU71: - | AV71: =RC[-31] -> 0 | AW71: =RC[-31] -> 0 | AX71: =RC[-31] -> 0 | AY71: =RC[-31] -> #VALUE!
A72: =IF(RC[1]="","",DATEVALUE(RC[1])) ->  | C72: 24 | J72: =RC[-5]-RC[-2] -> #VALUE! | T72: =RC[-8]+RC[-1] -> #VALUE! | U72: =(RC[-17]*RC[-16]-RC[-14]*RC[-13])/1000 -> #VALUE! | X72: =RC[-2]*RC[-10]/1000 -> #VALUE! | Y72: =(RC[-3]*RC[-11]-RC[-2]*RC[-9])/1000 -> #VALUE! | AD72: =VALUE(RC[-28]) -> #VALUE! | AE72: =IF(RC[22]=42,"*",IF(RC[22]=32,"",RC[22])) ->  | AF72: =RC[-29] -> 24 | AG72: =RC[-29] ->  | AH72: =RC[-29] ->  | AI72: =RC[-29] ->  | AJ72: =RC[-29] ->  | AK72: =RC[-29] ->  | AL72: =RC[-29] ->  | AM72: =RC[-29] -> #VALUE! | AN72: =RC[-29] ->  | AO72: =RC[-29] ->  | AP72: =RC[-29] -> 0 | AQ72: =RC[-29] -> 0 | AR72: - | AS72: =RC[-30] -> 0 | AT72: =RC[-30] -> 0 | AU72: - | AV72: =RC[-31] -> 0 | AW72: =RC[-31] -> 0 | AX72: =RC[-31] -> 0 | AY72: =RC[-31] -> #VALUE!
A73: =IF(RC[1]="","",DATEVALUE(RC[1])) ->  | C73: 24 | J73: =RC[-5]-RC[-2] -> #VALUE! | T73: =RC[-8]+RC[-1] -> #VALUE! | U73: =(RC[-17]*RC[-16]-RC[-14]*RC[-13])/1000 -> #VALUE! | X73: =RC[-2]*RC[-10]/1000 -> #VALUE! | Y73: =(RC[-3]*RC[-11]-RC[-2]*RC[-9])/1000 -> #VALUE! | AD73: =VALUE(RC[-28]) -> #VALUE! | AE73: =IF(RC[22]=42,"*",IF(RC[22]=32,"",RC[22])) ->  | AF73: =RC[-29] -> 24 | AG73: =RC[-29] ->  | AH73: =RC[-29] ->  | AI73: =RC[-29] ->  | AJ73: =RC[-29] ->  | AK73: =RC[-29] ->  | AL73: =RC[-29] ->  | AM73: =RC[-29] -> #VALUE! | AN73: =RC[-29] ->  | AO73: =RC[-29] ->  | AP73: =RC[-29] -> 0 | AQ73: =RC[-29] -> 0 | AR73: - | AS73: =RC[-30] -> 0 | AT73: =RC[-30] -> 0 | AU73: - | AV73: =RC[-31] -> 0 | AW73: =RC[-31] -> 0 | AX73: =RC[-31] -> 0 | AY73: =RC[-31] -> #VALUE!
A74: =IF(RC[1]="","",DATEVALUE(RC[1])) ->  | C74: 24 | J74: =RC[-5]-RC[-2] -> #VALUE! | T74: =RC[-8]+RC[-1] -> #VALUE! | U74: =(RC[-17]*RC[-16]-RC[-14]*RC[-13])/1000 -> #VALUE! | X74: =RC[-2]*RC[-10]/1000 -> #VALUE! | Y74: =(RC[-3]*RC[-11]-RC[-2]*RC[-9])/1000 -> #VALUE! | AD74: =VALUE(RC[-28]) -> #VALUE! | AE74: =IF(RC[22]=42,"*",IF(RC[22]=32,"",RC[22])) ->  | AF74: =RC[-29] -> 24 | AG74: =RC[-29] ->  | AH74: =RC[-29] ->  | AI74: =RC[-29] ->  | AJ74: =RC[-29] ->  | AK74: =RC[-29] ->  | AL74: =RC[-29] ->  | AM74: =RC[-29] -> #VALUE! | AN74: =RC[-29] ->  | AO74: =RC[-29] ->  | AP74: =RC[-29] -> 0 | AQ74: =RC[-29] -> 0 | AR74: - | AS74: =RC[-30] -> 0 | AT74: =RC[-30] -> 0 | AU74: - | AV74: =RC[-31] -> 0 | AW74: =RC[-31] -> 0 | AX74: =RC[-31] -> 0 | AY74: =RC[-31] -> #VALUE!
A75: =IF(RC[1]="","",DATEVALUE(RC[1])) ->  | C75: 24 | J75: =RC[-5]-RC[-2] -> #VALUE! | T75: =RC[-8]+RC[-1] -> #VALUE! | U75: =(RC[-17]*RC[-16]-RC[-14]*RC[-13])/1000 -> #VALUE! | X75: =RC[-2]*RC[-10]/1000 -> #VALUE! | Y75: =(RC[-3]*RC[-11]-RC[-2]*RC[-9])/1000 -> #VALUE! | AD75: =VALUE(RC[-28]) -> #VALUE! | AE75: =IF(RC[22]=42,"*",IF(RC[22]=32,"",RC[22])) ->  | AF75: =RC[-29] -> 24 | AG75: =RC[-29] ->  | AH75: =RC[-29] ->  | AI75: =RC[-29] ->  | AJ75: =RC[-29] ->  | AK75: =RC[-29] ->  | AL75: =RC[-29] ->  | AM75: =RC[-29] -> #VALUE! | AN75: =RC[-29] ->  | AO75: =RC[-29] ->  | AP75: =RC[-29] -> 0 | AQ75: =RC[-29] -> 0 | AR75: - | AS75: =RC[-30] -> 0 | AT75: =RC[-30] -> 0 | AU75: - | AV75: =RC[-31] -> 0 | AW75: =RC[-31] -> 0 | AX75: =RC[-31] -> 0 | AY75: =RC[-31] -> #VALUE!
A76: =IF(RC[1]="","",DATEVALUE(RC[1])) ->  | C76: 24 | J76: =RC[-5]-RC[-2] -> #VALUE! | T76: =RC[-8]+RC[-1] -> #VALUE! | U76: =(RC[-17]*RC[-16]-RC[-14]*RC[-13])/1000 -> #VALUE! | X76: =RC[-2]*RC[-10]/1000 -> #VALUE! | Y76: =(RC[-3]*RC[-11]-RC[-2]*RC[-9])/1000 -> #VALUE! | AD76: =VALUE(RC[-28]) -> #VALUE! | AE76: =IF(RC[22]=42,"*",IF(RC[22]=32,"",RC[22])) ->  | AF76: =RC[-29] -> 24 | AG76: =RC[-29] ->  | AH76: =RC[-29] ->  | AI76: =RC[-29] ->  | AJ76: =RC[-29] ->  | AK76: =RC[-29] ->  | AL76: =RC[-29] ->  | AM76: =RC[-29] -> #VALUE! | AN76: =RC[-29] ->  | AO76: =RC[-29] ->  | AP76: =RC[-29] -> 0 | AQ76: =RC[-29] -> 0 | AR76: - | AS76: =RC[-30] -> 0 | AT76: =RC[-30] -> 0 | AU76: - | AV76: =RC[-31] -> 0 | AW76: =RC[-31] -> 0 | AX76: =RC[-31] -> 0 | AY76: =RC[-31] -> #VALUE!
A77: =IF(RC[1]="","",DATEVALUE(RC[1])) ->  | C77: 24 | J77: =RC[-5]-RC[-2] -> #VALUE! | T77: =RC[-8]+RC[-1] -> #VALUE! | U77: =(RC[-17]*RC[-16]-RC[-14]*RC[-13])/1000 -> #VALUE! | X77: =RC[-2]*RC[-10]/1000 -> #VALUE! | Y77: =(RC[-3]*RC[-11]-RC[-2]*RC[-9])/1000 -> #VALUE! | AD77: =VALUE(RC[-28]) -> #VALUE! | AE77: =IF(RC[22]=42,"*",IF(RC[22]=32,"",RC[22])) ->  | AF77: =RC[-29] -> 24 | AG77: =RC[-29] ->  | AH77: =RC[-29] ->  | AI77: =RC[-29] ->  | AJ77: =RC[-29] ->  | AK77: =RC[-29] ->  | AL77: =RC[-29] ->  | AM77: =RC[-29] -> #VALUE! | AN77: =RC[-29] ->  | AO77: =RC[-29] ->  | AP77: =RC[-29] -> 0 | AQ77: =RC[-29] -> 0 | AR77: - | AS77: =RC[-30] -> 0 | AT77: =RC[-30] -> 0 | AU77: - | AV77: =RC[-31] -> 0 | AW77: =RC[-31] -> 0 | AX77: =RC[-31] -> 0 | AY77: =RC[-31] -> #VALUE!
A78: =IF(RC[1]="","",DATEVALUE(RC[1])) ->  | C78: 24 | J78: =RC[-5]-RC[-2] -> #VALUE! | T78: =RC[-8]+RC[-1] -> #VALUE! | U78: =(RC[-17]*RC[-16]-RC[-14]*RC[-13])/1000 -> #VALUE! | X78: =RC[-2]*RC[-10]/1000 -> #VALUE! | Y78: =(RC[-3]*RC[-11]-RC[-2]*RC[-9])/1000 -> #VALUE! | AD78: =VALUE(RC[-28]) -> #VALUE! | AE78: =IF(RC[22]=42,"*",IF(RC[22]=32,"",RC[22])) ->  | AF78: =RC[-29] -> 24 | AG78: =RC[-29] ->  | AH78: =RC[-29] ->  | AI78: =RC[-29] ->  | AJ78: =RC[-29] ->  | AK78: =RC[-29] ->  | AL78: =RC[-29] ->  | AM78: =RC[-29] -> #VALUE! | AN78: =RC[-29] ->  | AO78: =RC[-29] ->  | AP78: =RC[-29] -> 0 | AQ78: =RC[-29] -> 0 | AR78: - | AS78: =RC[-30] -> 0 | AT78: =RC[-30] -> 0 | AU78: - | AV78: =RC[-31] -> 0 | AW78: =RC[-31] -> 0 | AX78: =RC[-31] -> 0 | AY78: =RC[-31] -> #VALUE!
A79: =IF(RC[1]="","",DATEVALUE(RC[1])) ->  | C79: 24 | J79: =RC[-5]-RC[-2] -> #VALUE! | T79: =RC[-8]+RC[-1] -> #VALUE! | U79: =(RC[-17]*RC[-16]-RC[-14]*RC[-13])/1000 -> #VALUE! | X79: =RC[-2]*RC[-10]/1000 -> #VALUE! | Y79: =(RC[-3]*RC[-11]-RC[-2]*RC[-9])/1000 -> #VALUE! | AD79: =VALUE(RC[-28]) -> #VALUE! | AE79: =IF(RC[22]=42,"*",IF(RC[22]=32,"",RC[22])) ->  | AF79: =RC[-29] -> 24 | AG79: =RC[-29] ->  | AH79: =RC[-29] ->  | AI79: =RC[-29] ->  | AJ79: =RC[-29] ->  | AK79: =RC[-29] ->  | AL79: =RC[-29] ->  | AM79: =RC[-29] -> #VALUE! | AN79: =RC[-29] ->  | AO79: =RC[-29] ->  | AP79: =RC[-29] -> 0 | AQ79: =RC[-29] -> 0 | AR79: - | AS79: =RC[-30] -> 0 | AT79: =RC[-30] -> 0 | AU79: - | AV79: =RC[-31] -> 0 | AW79: =RC[-31] -> 0 | AX79: =RC[-31] -> 0 | AY79: =RC[-31] -> #VALUE!
A80: =IF(RC[1]="","",DATEVALUE(RC[1])) ->  | C80: 24 | J80: =RC[-5]-RC[-2] -> #VALUE! | T80: =RC[-8]+RC[-1] -> #VALUE! | U80: =(RC[-17]*RC[-16]-RC[-14]*RC[-13])/1000 -> #VALUE! | X80: =RC[-2]*RC[-10]/1000 -> #VALUE! | Y80: =(RC[-3]*RC[-11]-RC[-2]*RC[-9])/1000 -> #VALUE! | AD80: =VALUE(RC[-28]) -> #VALUE! | AE80: =IF(RC[22]=42,"*",IF(RC[22]=32,"",RC[22])) ->  | AF80: =RC[-29] -> 24 | AG80: =RC[-29] ->  | AH80: =RC[-29] ->  | AI80: =RC[-29] ->  | AJ80: =RC[-29] ->  | AK80: =RC[-29] ->  | AL80: =RC[-29] ->  | AM80: =RC[-29] -> #VALUE! | AN80: =RC[-29] ->  | AO80: =RC[-29] ->  | AP80: =RC[-29] -> 0 | AQ80: =RC[-29] -> 0 | AR80: - | AS80: =RC[-30] -> 0 | AT80: =RC[-30] -> 0 | AU80: - | AV80: =RC[-31] -> 0 | AW80: =RC[-31] -> 0 | AX80: =RC[-31] -> 0 | AY80: =RC[-31] -> #VALUE!
A81: =IF(RC[1]="","",DATEVALUE(RC[1])) ->  | C81: 24 | J81: =RC[-5]-RC[-2] -> #VALUE! | T81: =RC[-8]+RC[-1] -> #VALUE! | U81: =(RC[-17]*RC[-16]-RC[-14]*RC[-13])/1000 -> #VALUE! | X81: =RC[-2]*RC[-10]/1000 -> #VALUE! | Y81: =(RC[-3]*RC[-11]-RC[-2]*RC[-9])/1000 -> #VALUE! | AD81: =VALUE(RC[-28]) -> #VALUE! | AE81: =IF(RC[22]=42,"*",IF(RC[22]=32,"",RC[22])) ->  | AF81: =RC[-29] -> 24 | AG81: =RC[-29] ->  | AH81: =RC[-29] ->  | AI81: =RC[-29] ->  | AJ81: =RC[-29] ->  | AK81: =RC[-29] ->  | AL81: =RC[-29] ->  | AM81: =RC[-29] -> #VALUE! | AN81: =RC[-29] ->  | AO81: =RC[-29] ->  | AP81: =RC[-29] -> 0 | AQ81: =RC[-29] -> 0 | AR81: - | AS81: =RC[-30] -> 0 | AT81: =RC[-30] -> 0 | AU81: - | AV81: =RC[-31] -> 0 | AW81: =RC[-31] -> 0 | AX81: =RC[-31] -> 0 | AY81: =RC[-31] -> #VALUE!
A82: =IF(RC[1]="","",DATEVALUE(RC[1])) ->  | C82: 24 | J82: =RC[-5]-RC[-2] -> #VALUE! | T82: =RC[-8]+RC[-1] -> #VALUE! | U82: =(RC[-17]*RC[-16]-RC[-14]*RC[-13])/1000 -> #VALUE! | X82: =RC[-2]*RC[-10]/1000 -> #VALUE! | Y82: =(RC[-3]*RC[-11]-RC[-2]*RC[-9])/1000 -> #VALUE! | AD82: =VALUE(RC[-28]) -> #VALUE! | AE82: =IF(RC[22]=42,"*",IF(RC[22]=32,"",RC[22])) ->  | AF82: =RC[-29] -> 24 | AG82: =RC[-29] ->  | AH82: =RC[-29] ->  | AI82: =RC[-29] ->  | AJ82: =RC[-29] ->  | AK82: =RC[-29] ->  | AL82: =RC[-29] ->  | AM82: =RC[-29] -> #VALUE! | AN82: =RC[-29] ->  | AO82: =RC[-29] ->  | AP82: =RC[-29] -> 0 | AQ82: =RC[-29] -> 0 | AR82: - | AS82: =RC[-30] -> 0 | AT82: =RC[-30] -> 0 | AU82: - | AV82: =RC[-31] -> 0 | AW82: =RC[-31] -> 0 | AX82: =RC[-31] -> 0 | AY82: =RC[-31] -> #VALUE!
A83: =IF(RC[1]="","",DATEVALUE(RC[1])) ->  | C83: 24 | J83: =RC[-5]-RC[-2] -> #VALUE! | T83: =RC[-8]+RC[-1] -> #VALUE! | U83: =(RC[-17]*RC[-16]-RC[-14]*RC[-13])/1000 -> #VALUE! | X83: =RC[-2]*RC[-10]/1000 -> #VALUE! | Y83: =(RC[-3]*RC[-11]-RC[-2]*RC[-9])/1000 -> #VALUE! | AD83: =VALUE(RC[-28]) -> #VALUE! | AE83: =IF(RC[22]=42,"*",IF(RC[22]=32,"",RC[22])) ->  | AF83: =RC[-29] -> 24 | AG83: =RC[-29] ->  | AH83: =RC[-29] ->  | AI83: =RC[-29] ->  | AJ83: =RC[-29] ->  | AK83: =RC[-29] ->  | AL83: =RC[-29] ->  | AM83: =RC[-29] -> #VALUE! | AN83: =RC[-29] ->  | AO83: =RC[-29] ->  | AP83: =RC[-29] -> 0 | AQ83: =RC[-29] -> 0 | AR83: - | AS83: =RC[-30] -> 0 | AT83: =RC[-30] -> 0 | AU83: - | AV83: =RC[-31] -> 0 | AW83: =RC[-31] -> 0 | AX83: =RC[-31] -> 0 | AY83: =RC[-31] -> #VALUE!
AD84: Среднее | AG84: =R[1]C[-29] -> 197.2463333333333 | AH84: =R[1]C[-29] -> 48.528666666666687 | AI84: =R[1]C[-29] -> 7.8000000000000034 | AJ84: =R[1]C[-29] -> 195.05633333333336 | AK84: =R[1]C[-29] -> 39.736666666666665 | AL84: =R[1]C[-29] -> 4.8 | AM84: =R[1]C[-29] -> 8.7920000000000229 | AN84: =R[1]C[-29] -> 2.1899999999999995 | AP84: =R[1]C[-29] -> 0 | AQ84: =R[1]C[-29] -> 0 | AS84: =R[1]C[-30] -> 0 | AT84: =R[1]C[-30] -> 0 | AU84: - | AV84: =R[1]C[-31] -> 0
B85: Среднее | D85: =AVERAGE(OFFSET(R[-74]C,3,0,R7C1,1)) -> 197.2463333333333 | E85: =IF(SUM(OFFSET(R[-74]C,3,0,R7C1,1))=0,0,AVERAGE(OFFSET(R[-74]C,3,0,R7C1,1))) -> 48.528666666666687 | F85: =IF(SUM(OFFSET(R[-74]C,3,0,R7C1,1))=0,0,AVERAGE(OFFSET(R[-74]C,3,0,R7C1,1))) -> 7.8000000000000034 | G85: =AVERAGE(OFFSET(R[-74]C,3,0,R7C1,1)) -> 195.05633333333336 | H85: =IF(SUM(OFFSET(R[-74]C,3,0,R7C1,1))=0,0,AVERAGE(OFFSET(R[-74]C,3,0,R7C1,1))) -> 39.736666666666665 | I85: =IF(SUM(OFFSET(R[-74]C,3,0,R7C1,1))=0,0,AVERAGE(OFFSET(R[-74]C,3,0,R7C1,1))) -> 4.8 | J85: =RC[-5]-RC[-2] -> 8.7920000000000229 | K85: =AVERAGE(OFFSET(R[-74]C,3,0,R7C1,1)) -> 2.1899999999999995 | L85: =AVERAGE(OFFSET(R[-74]C,3,0,R7C1,1)) -> 1.9770333333333328 | T85: =AVERAGE(OFFSET(R[-74]C,3,0,R7C1,1)) -> 1.9770333333333328 | U85: =AVERAGE(OFFSET(R[-74]C,3,0,R7C1,1)) -> 1.9691977900000002 | X85: =AVERAGE(OFFSET(R[-74]C,3,0,R7C1,1)) -> #VALUE! | Y85: =AVERAGE(OFFSET(R[-74]C,3,0,R7C1,1)) -> #VALUE! | AD85: Итого | AF85: =R[1]C[-29] -> 720 | AG85: =R[1]C[-29] -> 5917.3899999999985 | AJ85: =R[1]C[-29] -> 5851.6900000000005 | AN85: =R[1]C[-29] -> 65.699999999999989 | AO85: =R[1]C[-29] -> 59.310999999999986 | AP85: =R[1]C[-29] -> 0 | AS85: =R[1]C[-30] -> 0 | AW85: =R[1]C[-31] -> 0 | AX85: =R[1]C[-31] -> 0 | AY85: =R[1]C[-31] -> 59.310999999999986
B86: ИТОГО: | C86: =SUM(OFFSET(R[-75]C,3,0,R7C1,1)) -> 720 | D86: =SUM(OFFSET(R[-75]C,3,0,R7C1,1)) -> 5917.3899999999985 | G86: =SUM(OFFSET(R[-75]C,3,0,R7C1,1)) -> 5851.6900000000005 | K86: =SUM(OFFSET(R[-75]C,3,0,R7C1,1)) -> 65.699999999999989 | L86: =SUM(OFFSET(R[-75]C,3,0,R7C1,1)) -> 59.310999999999986 | T86: =SUM(OFFSET(R[-75]C,3,0,R7C1,1)) -> 59.310999999999986 | U86: =SUM(OFFSET(R[-75]C,3,0,R7C1,1)) -> 59.075933700000007 | X86: =SUM(OFFSET(R[-75]C,3,0,R7C1,1)) -> #VALUE! | Y86: =SUM(OFFSET(R[-75]C,3,0,R7C1,1)) -> #VALUE!
AD87: Досчёт по среднему до конца месяца | AG87: =R[1]C[-29] -> 0 | AJ87: =R[1]C[-29] -> 0 | AN87: =R[1]C[-29] -> 0 | AO87: =R[1]C[-29] -> 0 | AP87: =R[1]C[-29] -> 0 | AS87: =R[1]C[-30] -> 0 | AW87: =R[1]C[-31] -> 0 | AX87: =R[1]C[-31] -> 0 | AY87: =R[1]C[-31] -> 0
A88: 11дн=264ч 4дн=96ч | B88: Досчёт до конца м-ца (+) | C88: =R[-82]C[-2]*24 -> 216 | U88: № 7554 | AD88: Снятие досчёта по среднему предыдущего отчёта | AG88: =-R[1]C[-29] -> 0 | AJ88: =-R[1]C[-29] -> 0 | AN88: =-R[1]C[-29] -> 0 | AO88: =-R[1]C[-29] -> 0 | AP88: =-R[1]C[-29] -> 0 | AS88: =-R[1]C[-30] -> 0 | AW88: =-R[1]C[-31] -> 0 | AX88: =-R[1]C[-31] -> 0 | AY88: =-R[1]C[-31] -> 0
A89: 9дн=216ч 7дн=168ч | B89: Вычет с предыдущего (-) | C89: =R[-85]C[-2]*24 -> 192 | AD89: Сумма: | AG89: =R[1]C[-29] -> 5917.3899999999985 | AJ89: =R[1]C[-29] -> 5851.6900000000005 | AN89: =R[1]C[-29] -> 65.699999999999989 | AO89: =R[1]C[-29] -> 59.310999999999986 | AP89: =R[1]C[-29] -> 0 | AS89: =R[1]C[-30] -> 0 | AW89: =R[1]C[-31] -> 0 | AX89: =R[1]C[-31] -> 0 | AY89: =R[1]C[-31] -> 59.310999999999986
B90: СУММА: | C90: =R[-4]C+R[-2]C-R[-1]C -> 744 | D90: =R[-4]C+R[-2]C-R[-1]C -> 5917.3899999999985 | G90: =R[-4]C+R[-2]C-R[-1]C -> 5851.6900000000005 | K90: =R[-4]C+R[-2]C-R[-1]C -> 65.699999999999989 | L90: =R[-4]C+R[-2]C-R[-1]C -> 59.310999999999986 | T90: =R[-4]C+R[-2]C-R[-1]C -> 59.310999999999986 | AD90: Тхв на источнике | AE90: 0 | AF90: V гвс (м3) | AG90: =R[-1]C[16] -> 0 | AH90: W гвс (Гкал) | AI90: =RC[-2]*0.06 -> 0 | AJ90: W без гвс (Гкал) | AK90: =R[-1]C[4] -> 59.310999999999986
AD91: =R[-90]C[-17] -> 02/147-3648 от 25.10.18
B93: Дата, время | D93: М1, т | F93: М2, т | H93: М3, т | J93: М4, т | L93: Qо, Гкал | N93: Qг, Гкал | P93: время, час
B94: 23.09.18 02:00 | D94: 158377.21 | F94: 156724.72 | H94: 169483.36 | J94: 169352.31 | L94: 3000.5219999999999 | N94: 2886.9140000000002 | P94: -
B95: 23.10.18 02:00 | D95: 162249.04999999999 | F95: 160417.03 | H95: 176409.48 | J95: 175379.33 | L95: 3040.989 | N95: 2941.0749999999998 | P95: -
B98: Представитель потредителя:_______________________________________________________ В.О. Топорков
I101: Рекомендуемые значения по параметрам теплопотребления (не являются официально утверждёнными)
I102: М, т | J102: V, м3 | K102: Qгвс, Гкал | L102: Qотоп, Гкал | M102: Qо, Гкал
I103: =R[-13]C[6] -> 0 | J103: =RC[-1]/0.98 -> 0 | K103: =R[-13]C[8] -> 0 | L103: =R[-13]C -> 59.310999999999986 | M103: =R[-6]C[2] -> 0
P105: ДЛЯ САМОКОНТРОЛЯ
B106: В строке выбора дат указать период с 16.7.13 по 23.8.13 - жильё | O106: Qo | Q106: Qг
B107: В строке выбора дат указать период с 18.7.13 по 25.8.13 - не жилое | O107: =((R[-21]C[-11]*R[-22]C[-8])-(R[-21]C[-10]*R[-22]C[-7]))/1000 -> 1154.2243963033332 | Q107: =IF(R[-22]C[-3]="",R[-21]C[-4]*R[-22]C[-1]/1000,"") -> 0 | R107: Си4
Q108: =IF(R[-23]C[-3]="","",((R[-22]C[-4]*R[-23]C[-1])-(R[-22]C[-3]*R[-23]C[1]))/1000) ->  | R108: Си5