Sheet: Лист1
G1: Отчёт о теплопотреблении за сентябрь 2018 | M1: отчет сдается по письму с 15.09.18г по 17.09.18г некорректная работа приборов
A4: =EOMONTH(R[9]C,0)-R[9]C -> 9 | B4: Потребитель: ЗАО "Сити Сервис"
A5: =MAX(R[9]C:R[78]C) -> 2018-09-22T00:00:00.000 | B5: Адрес: г. СПб, Морская наб., д.27 к.1 ГВС
A6: =EOMONTH(R[-1]C,0)-R[-1]C -> 8 | B6: Телефон: 8-911-021-19-79
A7: =R[-2]C-R[6]C -> 31 | B7: Договор 10023 (.) 405, 406
A8: 7 | B8: Тепловычислитель: ВКТ-7 № 42569 | L8: М2 мах= | M8: 0 | O8: Мгвс мах= | P8: 79.92
L9: Qотоп мах= | M9: 0 | O9: Qгвс мах= | P9: 4.8
B10: Расчётная формула: Q=M1*(h1-hхв)-M2*(h2-hхв)
D12: Учёт - ОТОПЛЕНИЕ | M12: Учёт - ГВС
A13: =R[1]C-1 -> 43334 | B13: Дата | C13: N, ч | D13: M1, т | E13: T1, С | F13: P1, кг/см2 | G13: M2, т | H13: T2, С | I13: P2, кг/см2 | J13: dT, гр.C | K13: M1-М2, т | L13: Qотоп, Гкал | M13: V3, м3 | N13: T3, С | O13: V4, м3 | P13: T4, С | Q13: dT, гр.C | R13: V3-V4, м3 | S13: Qгвс, Гкал | T13: Qобщ. | U13: Qo | V13: M3 | W13: M4 | X13: си4 | Y13: си5 | Z13: ТСО | AA13: Внутр. | AD13: Дата | AE13: НС | AF13: n, ч | AG13: М1, т | AH13: t1, гр. С | AI13: Р1, кгс/см2 | AJ13: М2, т | AK13: t2, гр. С | AL13: Р2, кгс/см2 | AM13: t1-t2, гр. С | AN13: М1-М2, т | AO13: Wотоп, Гкал | AP13: М1гвс, т | AQ13: t1гвс, гр. С | AR13: Р1гвс, кгс/см2 | AS13: М2гвс, т | AT13: t2гвс, гр. С | AU13: Р2гвс, кгс/см2 | AV13: t1гвс-t2гвс | AW13: М1гвс-М2гвс, т | AX13: Wгвс, Гкал | AY13: Wсумм, Гкал | BA13: NS_TV1 | BB13: НС | BC13: NS_TV2
A14: =IF(RC[1]="","",DATEVALUE(RC[1])) -> 43335 | B14: 23.08.18 | C14: 24 | M14: 58.31 | N14: 63.32 | O14: 45.39 | P14: 52.68 | Q14: =RC[-3]-RC[-1] -> 10.64 | R14: 12.92 | S14: 1.264 | T14: =RC[-1] -> 1.264 | U14: =(RC[-17]*RC[-16]-RC[-14]*RC[-13])/1000 -> 0 | V14: 57.26 | W14: 44.86 | X14: =RC[-2]*RC[-10]/1000 -> 3.6257031999999998 | Y14: =(RC[-3]*RC[-11]-RC[-2]*RC[-9])/1000 -> 1.2624784 | Z14: 2013-11-23T00:00:00.000 | AA14: 2013-11-21T00:00:00.000 | AD14: =VALUE(RC[-28]) -> 2018-08-23T00:00:00.000 | AE14: =IF(RC[22]=42,"*",IF(RC[22]=32,"",RC[22])) -> - | AF14: =RC[-29] -> 24 | AG14: =RC[-29] -> 0 | AH14: =RC[-29] -> 0 | AI14: =RC[-29] -> 0 | AJ14: =RC[-29] -> 0 | AK14: =RC[-29] -> 0 | AL14: =RC[-29] -> 0 | AM14: =RC[-29] -> 0 | AN14: =RC[-29] -> 0 | AO14: =RC[-29] -> 0 | AP14: =RC[-29] -> 58.31 | AQ14: =RC[-29] -> 63.32 | AR14: - | AS14: =RC[-30] -> 45.39 | AT14: =RC[-30] -> 52.68 | AU14: - | AV14: =RC[-31] -> 10.64 | AW14: =RC[-31] -> 12.92 | AX14: =RC[-31] -> 1.264 | AY14: =RC[-31] -> 1.264 | BA14: - | BB14: - | BC14: -
A15: =IF(RC[1]="","",DATEVALUE(RC[1])) -> 43336 | B15: 24.08.18 | C15: 24 | M15: 56.08 | N15: 64.12 | O15: 44.11 | P15: 53.02 | Q15: =RC[-3]-RC[-1] -> 11.100000000000001 | R15: 11.97 | S15: 1.2190000000000001 | T15: =RC[-1] -> 1.2190000000000001 | U15: =(RC[-17]*RC[-16]-RC[-14]*RC[-13])/1000 -> 0 | V15: 55.05 | W15: 43.57 | X15: =RC[-2]*RC[-10]/1000 -> 3.5298060000000002 | Y15: =(RC[-3]*RC[-11]-RC[-2]*RC[-9])/1000 -> 1.2197245999999999 | Z15: 2013-11-24T00:00:00.000 | AA15: 2013-11-22T00:00:00.000 | AD15: =VALUE(RC[-28]) -> 2018-08-24T00:00:00.000 | AE15: =IF(RC[22]=42,"*",IF(RC[22]=32,"",RC[22])) -> - | AF15: =RC[-29] -> 24 | AG15: =RC[-29] -> 0 | AH15: =RC[-29] -> 0 | AI15: =RC[-29] -> 0 | AJ15: =RC[-29] -> 0 | AK15: =RC[-29] -> 0 | AL15: =RC[-29] -> 0 | AM15: =RC[-29] -> 0 | AN15: =RC[-29] -> 0 | AO15: =RC[-29] -> 0 | AP15: =RC[-29] -> 56.08 | AQ15: =RC[-29] -> 64.12 | AR15: - | AS15: =RC[-30] -> 44.11 | AT15: =RC[-30] -> 53.02 | AU15: - | AV15: =RC[-31] -> 11.100000000000001 | AW15: =RC[-31] -> 11.97 | AX15: =RC[-31] -> 1.2190000000000001 | AY15: =RC[-31] -> 1.2190000000000001 | BA15: - | BB15: - | BC15: -
A16: =IF(RC[1]="","",DATEVALUE(RC[1])) -> 43337 | B16: 25.08.18 | C16: 24 | M16: 55.9 | N16: 64.77 | O16: 42.51 | P16: 54.7 | Q16: =RC[-3]-RC[-1] -> 10.069999999999993 | R16: 13.39 | S16: 1.258 | T16: =RC[-1] -> 1.258 | U16: =(RC[-17]*RC[-16]-RC[-14]*RC[-13])/1000 -> 0 | V16: 54.83 | W16: 41.96 | X16: =RC[-2]*RC[-10]/1000 -> 3.5513390999999999 | Y16: =(RC[-3]*RC[-11]-RC[-2]*RC[-9])/1000 -> 1.2561270999999996 | Z16: 2013-11-25T00:00:00.000 | AA16: 2013-11-23T00:00:00.000 | AD16: =VALUE(RC[-28]) -> 2018-08-25T00:00:00.000 | AE16: =IF(RC[22]=42,"*",IF(RC[22]=32,"",RC[22])) -> - | AF16: =RC[-29] -> 24 | AG16: =RC[-29] -> 0 | AH16: =RC[-29] -> 0 | AI16: =RC[-29] -> 0 | AJ16: =RC[-29] -> 0 | AK16: =RC[-29] -> 0 | AL16: =RC[-29] -> 0 | AM16: =RC[-29] -> 0 | AN16: =RC[-29] -> 0 | AO16: =RC[-29] -> 0 | AP16: =RC[-29] -> 55.9 | AQ16: =RC[-29] -> 64.77 | AR16: - | AS16: =RC[-30] -> 42.51 | AT16: =RC[-30] -> 54.7 | AU16: - | AV16: =RC[-31] -> 10.069999999999993 | AW16: =RC[-31] -> 13.39 | AX16: =RC[-31] -> 1.258 | AY16: =RC[-31] -> 1.258 | BA16: - | BB16: - | BC16: -
A17: =IF(RC[1]="","",DATEVALUE(RC[1])) -> 43338 | B17: 26.08.18 | C17: 24 | M17: 58.11 | N17: 64.959999999999994 | O17: 43.28 | P17: 54.94 | Q17: =RC[-3]-RC[-1] -> 10.019999999999996 | R17: 14.83 | S17: 1.3620000000000001 | T17: =RC[-1] -> 1.3620000000000001 | U17: =(RC[-17]*RC[-16]-RC[-14]*RC[-13])/1000 -> 0 | V17: 56.99 | W17: 42.61 | X17: =RC[-2]*RC[-10]/1000 -> 3.7020703999999998 | Y17: =(RC[-3]*RC[-11]-RC[-2]*RC[-9])/1000 -> 1.3610769999999999 | Z17: 2013-11-26T00:00:00.000 | AA17: 2013-11-24T00:00:00.000 | AD17: =VALUE(RC[-28]) -> 2018-08-26T00:00:00.000 | AE17: =IF(RC[22]=42,"*",IF(RC[22]=32,"",RC[22])) -> - | AF17: =RC[-29] -> 24 | AG17: =RC[-29] -> 0 | AH17: =RC[-29] -> 0 | AI17: =RC[-29] -> 0 | AJ17: =RC[-29] -> 0 | AK17: =RC[-29] -> 0 | AL17: =RC[-29] -> 0 | AM17: =RC[-29] -> 0 | AN17: =RC[-29] -> 0 | AO17: =RC[-29] -> 0 | AP17: =RC[-29] -> 58.11 | AQ17: =RC[-29] -> 64.959999999999994 | AR17: - | AS17: =RC[-30] -> 43.28 | AT17: =RC[-30] -> 54.94 | AU17: - | AV17: =RC[-31] -> 10.019999999999996 | AW17: =RC[-31] -> 14.83 | AX17: =RC[-31] -> 1.3620000000000001 | AY17: =RC[-31] -> 1.3620000000000001 | BA17: - | BB17: - | BC17: -
A18: =IF(RC[1]="","",DATEVALUE(RC[1])) -> 43339 | B18: 27.08.18 | C18: 24 | M18: 56.1 | N18: 65.2 | O18: 41.82 | P18: 55.02 | Q18: =RC[-3]-RC[-1] -> 10.18 | R18: 14.28 | S18: 1.319 | T18: =RC[-1] -> 1.319 | U18: =(RC[-17]*RC[-16]-RC[-14]*RC[-13])/1000 -> 0 | V18: 54.99 | W18: 41.21 | X18: =RC[-2]*RC[-10]/1000 -> 3.5853480000000002 | Y18: =(RC[-3]*RC[-11]-RC[-2]*RC[-9])/1000 -> 1.3179738000000003 | Z18: 2013-11-27T00:00:00.000 | AA18: 2013-11-25T00:00:00.000 | AD18: =VALUE(RC[-28]) -> 2018-08-27T00:00:00.000 | AE18: =IF(RC[22]=42,"*",IF(RC[22]=32,"",RC[22])) -> - | AF18: =RC[-29] -> 24 | AG18: =RC[-29] -> 0 | AH18: =RC[-29] -> 0 | AI18: =RC[-29] -> 0 | AJ18: =RC[-29] -> 0 | AK18: =RC[-29] -> 0 | AL18: =RC[-29] -> 0 | AM18: =RC[-29] -> 0 | AN18: =RC[-29] -> 0 | AO18: =RC[-29] -> 0 | AP18: =RC[-29] -> 56.1 | AQ18: =RC[-29] -> 65.2 | AR18: - | AS18: =RC[-30] -> 41.82 | AT18: =RC[-30] -> 55.02 | AU18: - | AV18: =RC[-31] -> 10.18 | AW18: =RC[-31] -> 14.28 | AX18: =RC[-31] -> 1.319 | AY18: =RC[-31] -> 1.319 | BA18: - | BB18: - | BC18: -
A19: =IF(RC[1]="","",DATEVALUE(RC[1])) -> 43340 | B19: 28.08.18 | C19: 24 | M19: 51.44 | N19: 65.72 | O19: 35.99 | P19: 54.46 | Q19: =RC[-3]-RC[-1] -> 11.259999999999998 | R19: 15.45 | S19: 1.3819999999999999 | T19: =RC[-1] -> 1.3819999999999999 | U19: =(RC[-17]*RC[-16]-RC[-14]*RC[-13])/1000 -> 0 | V19: 50.42 | W19: 35.51 | X19: =RC[-2]*RC[-10]/1000 -> 3.3136024000000002 | Y19: =(RC[-3]*RC[-11]-RC[-2]*RC[-9])/1000 -> 1.3797278000000004 | Z19: 2013-11-28T00:00:00.000 | AA19: 2013-11-26T00:00:00.000 | AD19: =VALUE(RC[-28]) -> 2018-08-28T00:00:00.000 | AE19: =IF(RC[22]=42,"*",IF(RC[22]=32,"",RC[22])) -> - | AF19: =RC[-29] -> 24 | AG19: =RC[-29] -> 0 | AH19: =RC[-29] -> 0 | AI19: =RC[-29] -> 0 | AJ19: =RC[-29] -> 0 | AK19: =RC[-29] -> 0 | AL19: =RC[-29] -> 0 | AM19: =RC[-29] -> 0 | AN19: =RC[-29] -> 0 | AO19: =RC[-29] -> 0 | AP19: =RC[-29] -> 51.44 | AQ19: =RC[-29] -> 65.72 | AR19: - | AS19: =RC[-30] -> 35.99 | AT19: =RC[-30] -> 54.46 | AU19: - | AV19: =RC[-31] -> 11.259999999999998 | AW19: =RC[-31] -> 15.45 | AX19: =RC[-31] -> 1.3819999999999999 | AY19: =RC[-31] -> 1.3819999999999999 | BA19: - | BB19: - | BC19: -
A20: =IF(RC[1]="","",DATEVALUE(RC[1])) -> 43341 | B20: 29.08.18 | C20: 24 | M20: 53.81 | N20: 64.91 | O20: 37.25 | P20: 54.16 | Q20: =RC[-3]-RC[-1] -> 10.75 | R20: 16.559999999999999 | S20: 1.4359999999999999 | T20: =RC[-1] -> 1.4359999999999999 | U20: =(RC[-17]*RC[-16]-RC[-14]*RC[-13])/1000 -> 0 | V20: 52.8 | W20: 36.770000000000003 | X20: =RC[-2]*RC[-10]/1000 -> 3.4272479999999996 | Y20: =(RC[-3]*RC[-11]-RC[-2]*RC[-9])/1000 -> 1.4357847999999995 | Z20: 2013-11-29T00:00:00.000 | AA20: 2013-11-27T00:00:00.000 | AD20: =VALUE(RC[-28]) -> 2018-08-29T00:00:00.000 | AE20: =IF(RC[22]=42,"*",IF(RC[22]=32,"",RC[22])) -> - | AF20: =RC[-29] -> 24 | AG20: =RC[-29] -> 0 | AH20: =RC[-29] -> 0 | AI20: =RC[-29] -> 0 | AJ20: =RC[-29] -> 0 | AK20: =RC[-29] -> 0 | AL20: =RC[-29] -> 0 | AM20: =RC[-29] -> 0 | AN20: =RC[-29] -> 0 | AO20: =RC[-29] -> 0 | AP20: =RC[-29] -> 53.81 | AQ20: =RC[-29] -> 64.91 | AR20: - | AS20: =RC[-30] -> 37.25 | AT20: =RC[-30] -> 54.16 | AU20: - | AV20: =RC[-31] -> 10.75 | AW20: =RC[-31] -> 16.559999999999999 | AX20: =RC[-31] -> 1.4359999999999999 | AY20: =RC[-31] -> 1.4359999999999999 | BA20: - | BB20: - | BC20: -
A21: =IF(RC[1]="","",DATEVALUE(RC[1])) -> 43342 | B21: 30.08.18 | C21: 24 | M21: 56.56 | N21: 63.58 | O21: 40.369999999999997 | P21: 53.63 | Q21: =RC[-3]-RC[-1] -> 9.9499999999999957 | R21: 16.190000000000001 | S21: 1.393 | T21: =RC[-1] -> 1.393 | U21: =(RC[-17]*RC[-16]-RC[-14]*RC[-13])/1000 -> 0 | V21: 55.53 | W21: 39.89 | X21: =RC[-2]*RC[-10]/1000 -> 3.5305974 | Y21: =(RC[-3]*RC[-11]-RC[-2]*RC[-9])/1000 -> 1.3912966999999998 | Z21: 2013-11-30T00:00:00.000 | AA21: 2013-11-28T00:00:00.000 | AD21: =VALUE(RC[-28]) -> 2018-08-30T00:00:00.000 | AE21: =IF(RC[22]=42,"*",IF(RC[22]=32,"",RC[22])) -> - | AF21: =RC[-29] -> 24 | AG21: =RC[-29] -> 0 | AH21: =RC[-29] -> 0 | AI21: =RC[-29] -> 0 | AJ21: =RC[-29] -> 0 | AK21: =RC[-29] -> 0 | AL21: =RC[-29] -> 0 | AM21: =RC[-29] -> 0 | AN21: =RC[-29] -> 0 | AO21: =RC[-29] -> 0 | AP21: =RC[-29] -> 56.56 | AQ21: =RC[-29] -> 63.58 | AR21: - | AS21: =RC[-30] -> 40.369999999999997 | AT21: =RC[-30] -> 53.63 | AU21: - | AV21: =RC[-31] -> 9.9499999999999957 | AW21: =RC[-31] -> 16.190000000000001 | AX21: =RC[-31] -> 1.393 | AY21: =RC[-31] -> 1.393 | BA21: - | BB21: - | BC21: -
A22: =IF(RC[1]="","",DATEVALUE(RC[1])) -> 43343 | B22: 31.08.18 | C22: 24 | M22: 57.96 | N22: 64.400000000000006 | O22: 43.38 | P22: 53.74 | Q22: =RC[-3]-RC[-1] -> 10.660000000000004 | R22: 14.58 | S22: 1.359 | T22: =RC[-1] -> 1.359 | U22: =(RC[-17]*RC[-16]-RC[-14]*RC[-13])/1000 -> 0 | V22: 56.88 | W22: 42.85 | X22: =RC[-2]*RC[-10]/1000 -> 3.6630720000000005 | Y22: =(RC[-3]*RC[-11]-RC[-2]*RC[-9])/1000 -> 1.3603130000000005 | Z22: 2013-12-01T00:00:00.000 | AA22: 2013-11-29T00:00:00.000 | AD22: =VALUE(RC[-28]) -> 2018-08-31T00:00:00.000 | AE22: =IF(RC[22]=42,"*",IF(RC[22]=32,"",RC[22])) -> - | AF22: =RC[-29] -> 24 | AG22: =RC[-29] -> 0 | AH22: =RC[-29] -> 0 | AI22: =RC[-29] -> 0 | AJ22: =RC[-29] -> 0 | AK22: =RC[-29] -> 0 | AL22: =RC[-29] -> 0 | AM22: =RC[-29] -> 0 | AN22: =RC[-29] -> 0 | AO22: =RC[-29] -> 0 | AP22: =RC[-29] -> 57.96 | AQ22: =RC[-29] -> 64.400000000000006 | AR22: - | AS22: =RC[-30] -> 43.38 | AT22: =RC[-30] -> 53.74 | AU22: - | AV22: =RC[-31] -> 10.660000000000004 | AW22: =RC[-31] -> 14.58 | AX22: =RC[-31] -> 1.359 | AY22: =RC[-31] -> 1.359 | BA22: - | BB22: - | BC22: -
A23: =IF(RC[1]="","",DATEVALUE(RC[1])) -> 43344 | B23: 01.09.18 | C23: 24 | M23: 58.51 | N23: 65.37 | O23: 44.01 | P23: 53.03 | Q23: =RC[-3]-RC[-1] -> 12.340000000000003 | R23: 14.5 | S23: 1.4410000000000001 | T23: =RC[-1] -> 1.4410000000000001 | U23: =(RC[-17]*RC[-16]-RC[-14]*RC[-13])/1000 -> 0 | V23: 57.38 | W23: 43.52 | X23: =RC[-2]*RC[-10]/1000 -> 3.7509306000000007 | Y23: =(RC[-3]*RC[-11]-RC[-2]*RC[-9])/1000 -> 1.4430650000000005 | Z23: 2013-12-02T00:00:00.000 | AA23: 2013-11-30T00:00:00.000 | AD23: =VALUE(RC[-28]) -> 2018-09-01T00:00:00.000 | AE23: =IF(RC[22]=42,"*",IF(RC[22]=32,"",RC[22])) -> - | AF23: =RC[-29] -> 24 | AG23: =RC[-29] -> 0 | AH23: =RC[-29] -> 0 | AI23: =RC[-29] -> 0 | AJ23: =RC[-29] -> 0 | AK23: =RC[-29] -> 0 | AL23: =RC[-29] -> 0 | AM23: =RC[-29] -> 0 | AN23: =RC[-29] -> 0 | AO23: =RC[-29] -> 0 | AP23: =RC[-29] -> 58.51 | AQ23: =RC[-29] -> 65.37 | AR23: - | AS23: =RC[-30] -> 44.01 | AT23: =RC[-30] -> 53.03 | AU23: - | AV23: =RC[-31] -> 12.340000000000003 | AW23: =RC[-31] -> 14.5 | AX23: =RC[-31] -> 1.4410000000000001 | AY23: =RC[-31] -> 1.4410000000000001 | BA23: - | BB23: - | BC23: -
A24: =IF(RC[1]="","",DATEVALUE(RC[1])) -> 43345 | B24: 02.09.18 | C24: 24 | M24: 57.52 | N24: 65.540000000000006 | O24: 43.21 | P24: 52.52 | Q24: =RC[-3]-RC[-1] -> 13.020000000000003 | R24: 14.31 | S24: 1.4510000000000001 | T24: =RC[-1] -> 1.4510000000000001 | U24: =(RC[-17]*RC[-16]-RC[-14]*RC[-13])/1000 -> 0 | V24: 56.4 | W24: 42.73 | X24: =RC[-2]*RC[-10]/1000 -> 3.696456 | Y24: =(RC[-3]*RC[-11]-RC[-2]*RC[-9])/1000 -> 1.4522764000000001 | Z24: 2013-12-03T00:00:00.000 | AA24: 2013-12-01T00:00:00.000 | AD24: =VALUE(RC[-28]) -> 2018-09-02T00:00:00.000 | AE24: =IF(RC[22]=42,"*",IF(RC[22]=32,"",RC[22])) -> - | AF24: =RC[-29] -> 24 | AG24: =RC[-29] -> 0 | AH24: =RC[-29] -> 0 | AI24: =RC[-29] -> 0 | AJ24: =RC[-29] -> 0 | AK24: =RC[-29] -> 0 | AL24: =RC[-29] -> 0 | AM24: =RC[-29] -> 0 | AN24: =RC[-29] -> 0 | AO24: =RC[-29] -> 0 | AP24: =RC[-29] -> 57.52 | AQ24: =RC[-29] -> 65.540000000000006 | AR24: - | AS24: =RC[-30] -> 43.21 | AT24: =RC[-30] -> 52.52 | AU24: - | AV24: =RC[-31] -> 13.020000000000003 | AW24: =RC[-31] -> 14.31 | AX24: =RC[-31] -> 1.4510000000000001 | AY24: =RC[-31] -> 1.4510000000000001 | BA24: - | BB24: - | BC24: -
A25: =IF(RC[1]="","",DATEVALUE(RC[1])) -> 43346 | B25: 03.09.18 | C25: 24 | M25: 56.84 | N25: 65.47 | O25: 41.67 | P25: 52.69 | Q25: =RC[-3]-RC[-1] -> 12.780000000000001 | R25: 15.17 | S25: 1.4810000000000001 | T25: =RC[-1] -> 1.4810000000000001 | U25: =(RC[-17]*RC[-16]-RC[-14]*RC[-13])/1000 -> 0 | V25: 55.73 | W25: 41.19 | X25: =RC[-2]*RC[-10]/1000 -> 3.6486430999999997 | Y25: =(RC[-3]*RC[-11]-RC[-2]*RC[-9])/1000 -> 1.478342 | Z25: 2013-12-04T00:00:00.000 | AA25: 2013-12-02T00:00:00.000 | AD25: =VALUE(RC[-28]) -> 2018-09-03T00:00:00.000 | AE25: =IF(RC[22]=42,"*",IF(RC[22]=32,"",RC[22])) -> - | AF25: =RC[-29] -> 24 | AG25: =RC[-29] -> 0 | AH25: =RC[-29] -> 0 | AI25: =RC[-29] -> 0 | AJ25: =RC[-29] -> 0 | AK25: =RC[-29] -> 0 | AL25: =RC[-29] -> 0 | AM25: =RC[-29] -> 0 | AN25: =RC[-29] -> 0 | AO25: =RC[-29] -> 0 | AP25: =RC[-29] -> 56.84 | AQ25: =RC[-29] -> 65.47 | AR25: - | AS25: =RC[-30] -> 41.67 | AT25: =RC[-30] -> 52.69 | AU25: - | AV25: =RC[-31] -> 12.780000000000001 | AW25: =RC[-31] -> 15.17 | AX25: =RC[-31] -> 1.4810000000000001 | AY25: =RC[-31] -> 1.4810000000000001 | BA25: - | BB25: - | BC25: -
A26: =IF(RC[1]="","",DATEVALUE(RC[1])) -> 43347 | B26: 04.09.18 | C26: 24 | M26: 51.97 | N26: 65.599999999999994 | O26: 38.43 | P26: 51.49 | Q26: =RC[-3]-RC[-1] -> 14.109999999999992 | R26: 13.54 | S26: 1.39 | T26: =RC[-1] -> 1.39 | U26: =(RC[-17]*RC[-16]-RC[-14]*RC[-13])/1000 -> 0 | V26: 50.97 | W26: 37.950000000000003 | X26: =RC[-2]*RC[-10]/1000 -> 3.3436319999999995 | Y26: =(RC[-3]*RC[-11]-RC[-2]*RC[-9])/1000 -> 1.3895864999999994 | Z26: 2013-12-05T00:00:00.000 | AA26: 2013-12-03T00:00:00.000 | AD26: =VALUE(RC[-28]) -> 2018-09-04T00:00:00.000 | AE26: =IF(RC[22]=42,"*",IF(RC[22]=32,"",RC[22])) -> - | AF26: =RC[-29] -> 24 | AG26: =RC[-29] -> 0 | AH26: =RC[-29] -> 0 | AI26: =RC[-29] -> 0 | AJ26: =RC[-29] -> 0 | AK26: =RC[-29] -> 0 | AL26: =RC[-29] -> 0 | AM26: =RC[-29] -> 0 | AN26: =RC[-29] -> 0 | AO26: =RC[-29] -> 0 | AP26: =RC[-29] -> 51.97 | AQ26: =RC[-29] -> 65.599999999999994 | AR26: - | AS26: =RC[-30] -> 38.43 | AT26: =RC[-30] -> 51.49 | AU26: - | AV26: =RC[-31] -> 14.109999999999992 | AW26: =RC[-31] -> 13.54 | AX26: =RC[-31] -> 1.39 | AY26: =RC[-31] -> 1.39 | BA26: - | BB26: - | BC26: -
A27: =IF(RC[1]="","",DATEVALUE(RC[1])) -> 43348 | B27: 05.09.18 | C27: 24 | M27: 53.26 | N27: 65.86 | O27: 37.46 | P27: 52.04 | Q27: =RC[-3]-RC[-1] -> 13.82 | R27: 15.8 | S27: 1.512 | T27: =RC[-1] -> 1.512 | U27: =(RC[-17]*RC[-16]-RC[-14]*RC[-13])/1000 -> 0 | V27: 52.19 | W27: 36.979999999999997 | X27: =RC[-2]*RC[-10]/1000 -> 3.4372333999999998 | Y27: =(RC[-3]*RC[-11]-RC[-2]*RC[-9])/1000 -> 1.5127941999999999 | Z27: 2013-12-06T00:00:00.000 | AA27: 2013-12-04T00:00:00.000 | AD27: =VALUE(RC[-28]) -> 2018-09-05T00:00:00.000 | AE27: =IF(RC[22]=42,"*",IF(RC[22]=32,"",RC[22])) -> - | AF27: =RC[-29] -> 24 | AG27: =RC[-29] -> 0 | AH27: =RC[-29] -> 0 | AI27: =RC[-29] -> 0 | AJ27: =RC[-29] -> 0 | AK27: =RC[-29] -> 0 | AL27: =RC[-29] -> 0 | AM27: =RC[-29] -> 0 | AN27: =RC[-29] -> 0 | AO27: =RC[-29] -> 0 | AP27: =RC[-29] -> 53.26 | AQ27: =RC[-29] -> 65.86 | AR27: - | AS27: =RC[-30] -> 37.46 | AT27: =RC[-30] -> 52.04 | AU27: - | AV27: =RC[-31] -> 13.82 | AW27: =RC[-31] -> 15.8 | AX27: =RC[-31] -> 1.512 | AY27: =RC[-31] -> 1.512 | BA27: - | BB27: - | BC27: -
A28: =IF(RC[1]="","",DATEVALUE(RC[1])) -> 43349 | B28: 06.09.18 | C28: 24 | M28: 53.39 | N28: 65.89 | O28: 37.29 | P28: 52.33 | Q28: =RC[-3]-RC[-1] -> 13.560000000000002 | R28: 16.100000000000001 | S28: 1.5249999999999999 | T28: =RC[-1] -> 1.5249999999999999 | U28: =(RC[-17]*RC[-16]-RC[-14]*RC[-13])/1000 -> 0 | V28: 52.35 | W28: 36.81 | X28: =RC[-2]*RC[-10]/1000 -> 3.4493415000000001 | Y28: =(RC[-3]*RC[-11]-RC[-2]*RC[-9])/1000 -> 1.5230741999999999 | Z28: 2013-12-07T00:00:00.000 | AA28: 2013-12-05T00:00:00.000 | AD28: =VALUE(RC[-28]) -> 2018-09-06T00:00:00.000 | AE28: =IF(RC[22]=42,"*",IF(RC[22]=32,"",RC[22])) -> - | AF28: =RC[-29] -> 24 | AG28: =RC[-29] -> 0 | AH28: =RC[-29] -> 0 | AI28: =RC[-29] -> 0 | AJ28: =RC[-29] -> 0 | AK28: =RC[-29] -> 0 | AL28: =RC[-29] -> 0 | AM28: =RC[-29] -> 0 | AN28: =RC[-29] -> 0 | AO28: =RC[-29] -> 0 | AP28: =RC[-29] -> 53.39 | AQ28: =RC[-29] -> 65.89 | AR28: - | AS28: =RC[-30] -> 37.29 | AT28: =RC[-30] -> 52.33 | AU28: - | AV28: =RC[-31] -> 13.560000000000002 | AW28: =RC[-31] -> 16.100000000000001 | AX28: =RC[-31] -> 1.5249999999999999 | AY28: =RC[-31] -> 1.5249999999999999 | BA28: - | BB28: - | BC28: -
A29: =IF(RC[1]="","",DATEVALUE(RC[1])) -> 43350 | B29: 07.09.18 | C29: 24 | M29: 53.36 | N29: 66.069999999999993 | O29: 36.93 | P29: 52.52 | Q29: =RC[-3]-RC[-1] -> 13.54999999999999 | R29: 16.43 | S29: 1.542 | T29: =RC[-1] -> 1.542 | U29: =(RC[-17]*RC[-16]-RC[-14]*RC[-13])/1000 -> 0 | V29: 52.31 | W29: 36.450000000000003 | X29: =RC[-2]*RC[-10]/1000 -> 3.4561216999999997 | Y29: =(RC[-3]*RC[-11]-RC[-2]*RC[-9])/1000 -> 1.5417676999999994 | Z29: 2013-12-08T00:00:00.000 | AA29: 2013-12-06T00:00:00.000 | AD29: =VALUE(RC[-28]) -> 2018-09-07T00:00:00.000 | AE29: =IF(RC[22]=42,"*",IF(RC[22]=32,"",RC[22])) -> - | AF29: =RC[-29] -> 24 | AG29: =RC[-29] -> 0 | AH29: =RC[-29] -> 0 | AI29: =RC[-29] -> 0 | AJ29: =RC[-29] -> 0 | AK29: =RC[-29] -> 0 | AL29: =RC[-29] -> 0 | AM29: =RC[-29] -> 0 | AN29: =RC[-29] -> 0 | AO29: =RC[-29] -> 0 | AP29: =RC[-29] -> 53.36 | AQ29: =RC[-29] -> 66.069999999999993 | AR29: - | AS29: =RC[-30] -> 36.93 | AT29: =RC[-30] -> 52.52 | AU29: - | AV29: =RC[-31] -> 13.54999999999999 | AW29: =RC[-31] -> 16.43 | AX29: =RC[-31] -> 1.542 | AY29: =RC[-31] -> 1.542 | BA29: - | BB29: - | BC29: -
A30: =IF(RC[1]="","",DATEVALUE(RC[1])) -> 43351 | B30: 08.09.18 | C30: 24 | M30: 52.49 | N30: 65.33 | O30: 37.380000000000003 | P30: 51.44 | Q30: =RC[-3]-RC[-1] -> 13.89 | R30: 15.11 | S30: 1.4650000000000001 | T30: =RC[-1] -> 1.4650000000000001 | U30: =(RC[-17]*RC[-16]-RC[-14]*RC[-13])/1000 -> 0 | V30: 51.46 | W30: 36.9 | X30: =RC[-2]*RC[-10]/1000 -> 3.3618817999999999 | Y30: =(RC[-3]*RC[-11]-RC[-2]*RC[-9])/1000 -> 1.4637458000000003 | Z30: 2013-12-09T00:00:00.000 | AA30: 2013-12-07T00:00:00.000 | AD30: =VALUE(RC[-28]) -> 2018-09-08T00:00:00.000 | AE30: =IF(RC[22]=42,"*",IF(RC[22]=32,"",RC[22])) -> - | AF30: =RC[-29] -> 24 | AG30: =RC[-29] -> 0 | AH30: =RC[-29] -> 0 | AI30: =RC[-29] -> 0 | AJ30: =RC[-29] -> 0 | AK30: =RC[-29] -> 0 | AL30: =RC[-29] -> 0 | AM30: =RC[-29] -> 0 | AN30: =RC[-29] -> 0 | AO30: =RC[-29] -> 0 | AP30: =RC[-29] -> 52.49 | AQ30: =RC[-29] -> 65.33 | AR30: - | AS30: =RC[-30] -> 37.380000000000003 | AT30: =RC[-30] -> 51.44 | AU30: - | AV30: =RC[-31] -> 13.89 | AW30: =RC[-31] -> 15.11 | AX30: =RC[-31] -> 1.4650000000000001 | AY30: =RC[-31] -> 1.4650000000000001 | BA30: - | BB30: - | BC30: -
A31: =IF(RC[1]="","",DATEVALUE(RC[1])) -> 43352 | B31: 09.09.18 | C31: 24 | M31: 51.35 | N31: 65.27 | O31: 36.200000000000003 | P31: 50.99 | Q31: =RC[-3]-RC[-1] -> 14.279999999999994 | R31: 15.15 | S31: 1.4710000000000001 | T31: =RC[-1] -> 1.4710000000000001 | U31: =(RC[-17]*RC[-16]-RC[-14]*RC[-13])/1000 -> 0 | V31: 50.39 | W31: 35.72 | X31: =RC[-2]*RC[-10]/1000 -> 3.2889552999999996 | Y31: =(RC[-3]*RC[-11]-RC[-2]*RC[-9])/1000 -> 1.4675924999999994 | Z31: 2013-12-10T00:00:00.000 | AA31: 2013-12-08T00:00:00.000 | AD31: =VALUE(RC[-28]) -> 2018-09-09T00:00:00.000 | AE31: =IF(RC[22]=42,"*",IF(RC[22]=32,"",RC[22])) -> - | AF31: =RC[-29] -> 24 | AG31: =RC[-29] -> 0 | AH31: =RC[-29] -> 0 | AI31: =RC[-29] -> 0 | AJ31: =RC[-29] -> 0 | AK31: =RC[-29] -> 0 | AL31: =RC[-29] -> 0 | AM31: =RC[-29] -> 0 | AN31: =RC[-29] -> 0 | AO31: =RC[-29] -> 0 | AP31: =RC[-29] -> 51.35 | AQ31: =RC[-29] -> 65.27 | AR31: - | AS31: =RC[-30] -> 36.200000000000003 | AT31: =RC[-30] -> 50.99 | AU31: - | AV31: =RC[-31] -> 14.279999999999994 | AW31: =RC[-31] -> 15.15 | AX31: =RC[-31] -> 1.4710000000000001 | AY31: =RC[-31] -> 1.4710000000000001 | BA31: - | BB31: - | BC31: -
A32: =IF(RC[1]="","",DATEVALUE(RC[1])) -> 43353 | B32: 10.09.18 | C32: 24 | M32: 32.119999999999997 | N32: 66.31 | O32: 20.13 | P32: 51.62 | Q32: =RC[-3]-RC[-1] -> 14.690000000000005 | R32: 11.99 | S32: 1.0629999999999999 | T32: =RC[-1] -> 1.0629999999999999 | U32: =(RC[-17]*RC[-16]-RC[-14]*RC[-13])/1000 -> 0 | V32: 31.5 | W32: 19.86 | X32: =RC[-2]*RC[-10]/1000 -> 2.088765 | Y32: =(RC[-3]*RC[-11]-RC[-2]*RC[-9])/1000 -> 1.0635918 | Z32: 2013-12-11T00:00:00.000 | AA32: 2013-12-09T00:00:00.000 | AD32: =VALUE(RC[-28]) -> 2018-09-10T00:00:00.000 | AE32: =IF(RC[22]=42,"*",IF(RC[22]=32,"",RC[22])) -> - | AF32: =RC[-29] -> 24 | AG32: =RC[-29] -> 0 | AH32: =RC[-29] -> 0 | AI32: =RC[-29] -> 0 | AJ32: =RC[-29] -> 0 | AK32: =RC[-29] -> 0 | AL32: =RC[-29] -> 0 | AM32: =RC[-29] -> 0 | AN32: =RC[-29] -> 0 | AO32: =RC[-29] -> 0 | AP32: =RC[-29] -> 32.119999999999997 | AQ32: =RC[-29] -> 66.31 | AR32: - | AS32: =RC[-30] -> 20.13 | AT32: =RC[-30] -> 51.62 | AU32: - | AV32: =RC[-31] -> 14.690000000000005 | AW32: =RC[-31] -> 11.99 | AX32: =RC[-31] -> 1.0629999999999999 | AY32: =RC[-31] -> 1.0629999999999999 | BA32: - | BB32: - | BC32: -
A33: =IF(RC[1]="","",DATEVALUE(RC[1])) -> 43354 | B33: 11.09.18 | C33: 24 | M33: 32.65 | N33: 63.15 | O33: 12.92 | P33: 52.06 | Q33: =RC[-3]-RC[-1] -> 11.089999999999996 | R33: 19.73 | S33: 1.3580000000000001 | T33: =RC[-1] -> 1.3580000000000001 | U33: =(RC[-17]*RC[-16]-RC[-14]*RC[-13])/1000 -> 0 | V33: 32.049999999999997 | W33: 12.73 | X33: =RC[-2]*RC[-10]/1000 -> 2.0239574999999999 | Y33: =(RC[-3]*RC[-11]-RC[-2]*RC[-9])/1000 -> 1.3612336999999999 | Z33: 2013-12-12T00:00:00.000 | AA33: 2013-12-10T00:00:00.000 | AD33: =VALUE(RC[-28]) -> 2018-09-11T00:00:00.000 | AE33: =IF(RC[22]=42,"*",IF(RC[22]=32,"",RC[22])) -> - | AF33: =RC[-29] -> 24 | AG33: =RC[-29] -> 0 | AH33: =RC[-29] -> 0 | AI33: =RC[-29] -> 0 | AJ33: =RC[-29] -> 0 | AK33: =RC[-29] -> 0 | AL33: =RC[-29] -> 0 | AM33: =RC[-29] -> 0 | AN33: =RC[-29] -> 0 | AO33: =RC[-29] -> 0 | AP33: =RC[-29] -> 32.65 | AQ33: =RC[-29] -> 63.15 | AR33: - | AS33: =RC[-30] -> 12.92 | AT33: =RC[-30] -> 52.06 | AU33: - | AV33: =RC[-31] -> 11.089999999999996 | AW33: =RC[-31] -> 19.73 | AX33: =RC[-31] -> 1.3580000000000001 | AY33: =RC[-31] -> 1.3580000000000001 | BA33: - | BB33: - | BC33: -
A34: =IF(RC[1]="","",DATEVALUE(RC[1])) -> 43355 | B34: 12.09.18 | C34: 24 | M34: 20.41 | N34: 62.91 | O34: 0 | P34: 24.79 | Q34: =RC[-3]-RC[-1] -> 38.119999999999997 | R34: 20.41 | S34: 1.2589999999999999 | T34: =RC[-1] -> 1.2589999999999999 | U34: =(RC[-17]*RC[-16]-RC[-14]*RC[-13])/1000 -> 0 | V34: 20.05 | W34: 0 | X34: =RC[-2]*RC[-10]/1000 -> 1.2613455 | Y34: =(RC[-3]*RC[-11]-RC[-2]*RC[-9])/1000 -> 1.2613455 | Z34: 2013-12-13T00:00:00.000 | AA34: 2013-12-11T00:00:00.000 | AD34: =VALUE(RC[-28]) -> 2018-09-12T00:00:00.000 | AE34: =IF(RC[22]=42,"*",IF(RC[22]=32,"",RC[22])) -> - | AF34: =RC[-29] -> 24 | AG34: =RC[-29] -> 0 | AH34: =RC[-29] -> 0 | AI34: =RC[-29] -> 0 | AJ34: =RC[-29] -> 0 | AK34: =RC[-29] -> 0 | AL34: =RC[-29] -> 0 | AM34: =RC[-29] -> 0 | AN34: =RC[-29] -> 0 | AO34: =RC[-29] -> 0 | AP34: =RC[-29] -> 20.41 | AQ34: =RC[-29] -> 62.91 | AR34: - | AS34: =RC[-30] -> 0 | AT34: =RC[-30] -> 24.79 | AU34: - | AV34: =RC[-31] -> 38.119999999999997 | AW34: =RC[-31] -> 20.41 | AX34: =RC[-31] -> 1.2589999999999999 | AY34: =RC[-31] -> 1.2589999999999999 | BA34: - | BB34: - | BC34: -
A35: =IF(RC[1]="","",DATEVALUE(RC[1])) -> 43356 | B35: 13.09.18 | C35: 24 | M35: 21.32 | N35: 62.76 | O35: 0 | P35: 24.49 | Q35: =RC[-3]-RC[-1] -> 38.269999999999996 | R35: 21.32 | S35: 1.3180000000000001 | T35: =RC[-1] -> 1.3180000000000001 | U35: =(RC[-17]*RC[-16]-RC[-14]*RC[-13])/1000 -> 0 | V35: 20.97 | W35: 0 | X35: =RC[-2]*RC[-10]/1000 -> 1.3160772000000001 | Y35: =(RC[-3]*RC[-11]-RC[-2]*RC[-9])/1000 -> 1.3160772000000001 | Z35: 2013-12-14T00:00:00.000 | AA35: 2013-12-12T00:00:00.000 | AD35: =VALUE(RC[-28]) -> 2018-09-13T00:00:00.000 | AE35: =IF(RC[22]=42,"*",IF(RC[22]=32,"",RC[22])) -> - | AF35: =RC[-29] -> 24 | AG35: =RC[-29] -> 0 | AH35: =RC[-29] -> 0 | AI35: =RC[-29] -> 0 | AJ35: =RC[-29] -> 0 | AK35: =RC[-29] -> 0 | AL35: =RC[-29] -> 0 | AM35: =RC[-29] -> 0 | AN35: =RC[-29] -> 0 | AO35: =RC[-29] -> 0 | AP35: =RC[-29] -> 21.32 | AQ35: =RC[-29] -> 62.76 | AR35: - | AS35: =RC[-30] -> 0 | AT35: =RC[-30] -> 24.49 | AU35: - | AV35: =RC[-31] -> 38.269999999999996 | AW35: =RC[-31] -> 21.32 | AX35: =RC[-31] -> 1.3180000000000001 | AY35: =RC[-31] -> 1.3180000000000001 | BA35: - | BB35: - | BC35: -
A36: =IF(RC[1]="","",DATEVALUE(RC[1])) -> 43357 | B36: 14.09.18 | C36: 24 | M36: 21.93 | N36: 62.27 | O36: 0 | P36: 24.08 | Q36: =RC[-3]-RC[-1] -> 38.190000000000005 | R36: 21.93 | S36: 1.341 | T36: =RC[-1] -> 1.341 | U36: =(RC[-17]*RC[-16]-RC[-14]*RC[-13])/1000 -> 0 | V36: 21.55 | W36: 0 | X36: =RC[-2]*RC[-10]/1000 -> 1.3419185000000002 | Y36: =(RC[-3]*RC[-11]-RC[-2]*RC[-9])/1000 -> 1.3419185000000002 | Z36: 2013-12-15T00:00:00.000 | AA36: 2013-12-13T00:00:00.000 | AD36: =VALUE(RC[-28]) -> 2018-09-14T00:00:00.000 | AE36: =IF(RC[22]=42,"*",IF(RC[22]=32,"",RC[22])) -> - | AF36: =RC[-29] -> 24 | AG36: =RC[-29] -> 0 | AH36: =RC[-29] -> 0 | AI36: =RC[-29] -> 0 | AJ36: =RC[-29] -> 0 | AK36: =RC[-29] -> 0 | AL36: =RC[-29] -> 0 | AM36: =RC[-29] -> 0 | AN36: =RC[-29] -> 0 | AO36: =RC[-29] -> 0 | AP36: =RC[-29] -> 21.93 | AQ36: =RC[-29] -> 62.27 | AR36: - | AS36: =RC[-30] -> 0 | AT36: =RC[-30] -> 24.08 | AU36: - | AV36: =RC[-31] -> 38.190000000000005 | AW36: =RC[-31] -> 21.93 | AX36: =RC[-31] -> 1.341 | AY36: =RC[-31] -> 1.341 | BA36: - | BB36: - | BC36: -
A37: =IF(RC[1]="","",DATEVALUE(RC[1])) -> 43358 | B37: 15.09.18 | C37: 24 | M37: =AVERAGE(R[-3]C:R[-1]C) -> 21.220000000000002 | N37: =AVERAGE(R[-3]C:R[-1]C) -> 62.646666666666668 | O37: =AVERAGE(R[-3]C:R[-1]C) -> 0 | P37: =AVERAGE(R[-3]C:R[-1]C) -> 24.453333333333333 | Q37: =AVERAGE(R[-3]C:R[-1]C) -> 38.193333333333328 | R37: =AVERAGE(R[-3]C:R[-1]C) -> 21.220000000000002 | S37: =AVERAGE(R[-3]C:R[-1]C) -> 1.306 | T37: =RC[-1] -> 1.306 | U37: =(RC[-17]*RC[-16]-RC[-14]*RC[-13])/1000 -> 0 | V37: 92.55 | W37: 0 | X37: =RC[-2]*RC[-10]/1000 -> 5.797949 | Y37: =(RC[-3]*RC[-11]-RC[-2]*RC[-9])/1000 -> 5.797949 | Z37: 2013-12-16T00:00:00.000 | AA37: 2013-12-14T00:00:00.000 | AD37: =VALUE(RC[-28]) -> 2018-09-15T00:00:00.000 | AE37: =IF(RC[22]=42,"*",IF(RC[22]=32,"",RC[22])) -> - | AF37: =RC[-29] -> 24 | AG37: =RC[-29] -> 0 | AH37: =RC[-29] -> 0 | AI37: =RC[-29] -> 0 | AJ37: =RC[-29] -> 0 | AK37: =RC[-29] -> 0 | AL37: =RC[-29] -> 0 | AM37: =RC[-29] -> 0 | AN37: =RC[-29] -> 0 | AO37: =RC[-29] -> 0 | AP37: =RC[-29] -> 21.220000000000002 | AQ37: =RC[-29] -> 62.646666666666668 | AR37: - | AS37: =RC[-30] -> 0 | AT37: =RC[-30] -> 24.453333333333333 | AU37: - | AV37: =RC[-31] -> 38.193333333333328 | AW37: =RC[-31] -> 21.220000000000002 | AX37: =RC[-31] -> 1.306 | AY37: =RC[-31] -> 1.306 | BA37: - | BB37: - | BC37: -
A38: =IF(RC[1]="","",DATEVALUE(RC[1])) -> 43359 | B38: 16.09.18 | C38: 24 | M38: 21.220000000000002 | N38: 62.646666666666668 | O38: 0 | P38: 24.453333333333333 | Q38: 38.193333333333328 | R38: 21.220000000000002 | S38: 1.306 | T38: =RC[-1] -> 1.306 | U38: =(RC[-17]*RC[-16]-RC[-14]*RC[-13])/1000 -> 0 | V38: 270.12 | W38: 0 | X38: =RC[-2]*RC[-10]/1000 -> 16.9221176 | Y38: =(RC[-3]*RC[-11]-RC[-2]*RC[-9])/1000 -> 16.9221176 | Z38: 2013-12-17T00:00:00.000 | AA38: 2013-12-15T00:00:00.000 | AD38: =VALUE(RC[-28]) -> 2018-09-16T00:00:00.000 | AE38: =IF(RC[22]=42,"*",IF(RC[22]=32,"",RC[22])) -> - | AF38: =RC[-29] -> 24 | AG38: =RC[-29] -> 0 | AH38: =RC[-29] -> 0 | AI38: =RC[-29] -> 0 | AJ38: =RC[-29] -> 0 | AK38: =RC[-29] -> 0 | AL38: =RC[-29] -> 0 | AM38: =RC[-29] -> 0 | AN38: =RC[-29] -> 0 | AO38: =RC[-29] -> 0 | AP38: =RC[-29] -> 21.220000000000002 | AQ38: =RC[-29] -> 62.646666666666668 | AR38: - | AS38: =RC[-30] -> 0 | AT38: =RC[-30] -> 24.453333333333333 | AU38: - | AV38: =RC[-31] -> 38.193333333333328 | AW38: =RC[-31] -> 21.220000000000002 | AX38: =RC[-31] -> 1.306 | AY38: =RC[-31] -> 1.306 | BA38: - | BB38: - | BC38: -
A39: =IF(RC[1]="","",DATEVALUE(RC[1])) -> 43360 | B39: 17.09.18 | C39: 24 | M39: 21.220000000000002 | N39: 62.646666666666668 | O39: 0 | P39: 24.453333333333333 | Q39: 38.193333333333328 | R39: 21.220000000000002 | S39: 1.306 | T39: =RC[-1] -> 1.306 | U39: =(RC[-17]*RC[-16]-RC[-14]*RC[-13])/1000 -> 0 | V39: 198.57 | W39: 11.82 | X39: =RC[-2]*RC[-10]/1000 -> 12.4397486 | Y39: =(RC[-3]*RC[-11]-RC[-2]*RC[-9])/1000 -> 12.150710199999999 | Z39: 2013-12-18T00:00:00.000 | AA39: 2013-12-16T00:00:00.000 | AD39: =VALUE(RC[-28]) -> 2018-09-17T00:00:00.000 | AE39: =IF(RC[22]=42,"*",IF(RC[22]=32,"",RC[22])) -> - | AF39: =RC[-29] -> 24 | AG39: =RC[-29] -> 0 | AH39: =RC[-29] -> 0 | AI39: =RC[-29] -> 0 | AJ39: =RC[-29] -> 0 | AK39: =RC[-29] -> 0 | AL39: =RC[-29] -> 0 | AM39: =RC[-29] -> 0 | AN39: =RC[-29] -> 0 | AO39: =RC[-29] -> 0 | AP39: =RC[-29] -> 21.220000000000002 | AQ39: =RC[-29] -> 62.646666666666668 | AR39: - | AS39: =RC[-30] -> 0 | AT39: =RC[-30] -> 24.453333333333333 | AU39: - | AV39: =RC[-31] -> 38.193333333333328 | AW39: =RC[-31] -> 21.220000000000002 | AX39: =RC[-31] -> 1.306 | AY39: =RC[-31] -> 1.306 | BA39: - | BB39: - | BC39: -
A40: =IF(RC[1]="","",DATEVALUE(RC[1])) -> 43361 | B40: 18.09.18 | C40: 24 | M40: 49.74 | N40: 65.31 | O40: 31.54 | P40: 50.77 | Q40: =RC[-3]-RC[-1] -> 14.54 | R40: 18.2 | S40: 1.607 | T40: =RC[-1] -> 1.607 | U40: =(RC[-17]*RC[-16]-RC[-14]*RC[-13])/1000 -> 0 | V40: 48.78 | W40: 31.1 | X40: =RC[-2]*RC[-10]/1000 -> 3.1858218000000003 | Y40: =(RC[-3]*RC[-11]-RC[-2]*RC[-9])/1000 -> 1.6068748000000002 | Z40: 2013-12-19T00:00:00.000 | AA40: 2013-12-17T00:00:00.000 | AD40: =VALUE(RC[-28]) -> 2018-09-18T00:00:00.000 | AE40: =IF(RC[22]=42,"*",IF(RC[22]=32,"",RC[22])) -> - | AF40: =RC[-29] -> 24 | AG40: =RC[-29] -> 0 | AH40: =RC[-29] -> 0 | AI40: =RC[-29] -> 0 | AJ40: =RC[-29] -> 0 | AK40: =RC[-29] -> 0 | AL40: =RC[-29] -> 0 | AM40: =RC[-29] -> 0 | AN40: =RC[-29] -> 0 | AO40: =RC[-29] -> 0 | AP40: =RC[-29] -> 49.74 | AQ40: =RC[-29] -> 65.31 | AR40: - | AS40: =RC[-30] -> 31.54 | AT40: =RC[-30] -> 50.77 | AU40: - | AV40: =RC[-31] -> 14.54 | AW40: =RC[-31] -> 18.2 | AX40: =RC[-31] -> 1.607 | AY40: =RC[-31] -> 1.607 | BA40: - | BB40: - | BC40: -
A41: =IF(RC[1]="","",DATEVALUE(RC[1])) -> 43362 | B41: 19.09.18 | C41: 24 | M41: 48.81 | N41: 65.12 | O41: 30.77 | P41: 50.72 | Q41: 14.400000000000006 | R41: 18.04 | S41: 1.5780000000000001 | T41: =RC[-1] -> 1.5780000000000001 | U41: =(RC[-17]*RC[-16]-RC[-14]*RC[-13])/1000 -> 0 | X41: =RC[-2]*RC[-10]/1000 -> #VALUE! | Y41: =(RC[-3]*RC[-11]-RC[-2]*RC[-9])/1000 -> #VALUE! | Z41: 2013-12-20T00:00:00.000 | AA41: 2013-12-18T00:00:00.000 | AD41: =VALUE(RC[-28]) -> 2018-09-19T00:00:00.000 | AE41: =IF(RC[22]=42,"*",IF(RC[22]=32,"",RC[22])) ->  | AF41: =RC[-29] -> 24 | AG41: =RC[-29] -> 0 | AH41: =RC[-29] -> 0 | AI41: =RC[-29] -> 0 | AJ41: =RC[-29] -> 0 | AK41: =RC[-29] -> 0 | AL41: =RC[-29] -> 0 | AM41: =RC[-29] -> 0 | AN41: =RC[-29] -> 0 | AO41: =RC[-29] -> 0 | AP41: =RC[-29] -> 48.81 | AQ41: =RC[-29] -> 65.12 | AR41: - | AS41: =RC[-30] -> 30.77 | AT41: =RC[-30] -> 50.72 | AU41: - | AV41: =RC[-31] -> 14.400000000000006 | AW41: =RC[-31] -> 18.04 | AX41: =RC[-31] -> 1.5780000000000001 | AY41: =RC[-31] -> 1.5780000000000001
A42: =IF(RC[1]="","",DATEVALUE(RC[1])) -> 43363 | B42: 20.09.18 | C42: 24 | M42: 34.32 | N42: 66.05 | O42: 20.03 | P42: 51.96 | Q42: 14.089999999999996 | R42: 14.29 | S42: 1.1970000000000001 | T42: =RC[-1] -> 1.1970000000000001 | U42: =(RC[-17]*RC[-16]-RC[-14]*RC[-13])/1000 -> 0 | X42: =RC[-2]*RC[-10]/1000 -> #VALUE! | Y42: =(RC[-3]*RC[-11]-RC[-2]*RC[-9])/1000 -> #VALUE! | Z42: 2013-12-21T00:00:00.000 | AA42: 2013-12-19T00:00:00.000 | AD42: =VALUE(RC[-28]) -> 2018-09-20T00:00:00.000 | AE42: =IF(RC[22]=42,"*",IF(RC[22]=32,"",RC[22])) ->  | AF42: =RC[-29] -> 24 | AG42: =RC[-29] -> 0 | AH42: =RC[-29] -> 0 | AI42: =RC[-29] -> 0 | AJ42: =RC[-29] -> 0 | AK42: =RC[-29] -> 0 | AL42: =RC[-29] -> 0 | AM42: =RC[-29] -> 0 | AN42: =RC[-29] -> 0 | AO42: =RC[-29] -> 0 | AP42: =RC[-29] -> 34.32 | AQ42: =RC[-29] -> 66.05 | AR42: - | AS42: =RC[-30] -> 20.03 | AT42: =RC[-30] -> 51.96 | AU42: - | AV42: =RC[-31] -> 14.089999999999996 | AW42: =RC[-31] -> 14.29 | AX42: =RC[-31] -> 1.1970000000000001 | AY42: =RC[-31] -> 1.1970000000000001
A43: =IF(RC[1]="","",DATEVALUE(RC[1])) -> 43364 | B43: 21.09.18 | C43: 24 | M43: 49.24 | N43: 66.400000000000006 | O43: 32.51 | P43: 53.63 | Q43: 12.770000000000003 | R43: 16.73 | S43: 1.4870000000000001 | T43: =RC[-1] -> 1.4870000000000001 | U43: =(RC[-17]*RC[-16]-RC[-14]*RC[-13])/1000 -> 0 | X43: =RC[-2]*RC[-10]/1000 -> #VALUE! | Y43: =(RC[-3]*RC[-11]-RC[-2]*RC[-9])/1000 -> #VALUE! | Z43: 2013-12-22T00:00:00.000 | AA43: 2013-12-20T00:00:00.000 | AD43: =VALUE(RC[-28]) -> 2018-09-21T00:00:00.000 | AE43: =IF(RC[22]=42,"*",IF(RC[22]=32,"",RC[22])) ->  | AF43: =RC[-29] -> 24 | AG43: =RC[-29] -> 0 | AH43: =RC[-29] -> 0 | AI43: =RC[-29] -> 0 | AJ43: =RC[-29] -> 0 | AK43: =RC[-29] -> 0 | AL43: =RC[-29] -> 0 | AM43: =RC[-29] -> 0 | AN43: =RC[-29] -> 0 | AO43: =RC[-29] -> 0 | AP43: =RC[-29] -> 49.24 | AQ43: =RC[-29] -> 66.400000000000006 | AR43: - | AS43: =RC[-30] -> 32.51 | AT43: =RC[-30] -> 53.63 | AU43: - | AV43: =RC[-31] -> 12.770000000000003 | AW43: =RC[-31] -> 16.73 | AX43: =RC[-31] -> 1.4870000000000001 | AY43: =RC[-31] -> 1.4870000000000001
A44: =IF(RC[1]="","",DATEVALUE(RC[1])) -> 43365 | B44: 22.09.18 | C44: 24 | M44: 50.17 | N44: 66.59 | O44: 32.89 | P44: 52.76 | Q44: 13.830000000000005 | R44: 17.28 | S44: 1.5680000000000001 | T44: =RC[-1] -> 1.5680000000000001 | U44: =(RC[-17]*RC[-16]-RC[-14]*RC[-13])/1000 -> 0 | X44: =RC[-2]*RC[-10]/1000 -> #VALUE! | Y44: =(RC[-3]*RC[-11]-RC[-2]*RC[-9])/1000 -> #VALUE! | AD44: =VALUE(RC[-28]) -> 2018-09-22T00:00:00.000 | AE44: =IF(RC[22]=42,"*",IF(RC[22]=32,"",RC[22])) ->  | AF44: =RC[-29] -> 24 | AG44: =RC[-29] -> 0 | AH44: =RC[-29] -> 0 | AI44: =RC[-29] -> 0 | AJ44: =RC[-29] -> 0 | AK44: =RC[-29] -> 0 | AL44: =RC[-29] -> 0 | AM44: =RC[-29] -> 0 | AN44: =RC[-29] -> 0 | AO44: =RC[-29] -> 0 | AP44: =RC[-29] -> 50.17 | AQ44: =RC[-29] -> 66.59 | AR44: - | AS44: =RC[-30] -> 32.89 | AT44: =RC[-30] -> 52.76 | AU44: - | AV44: =RC[-31] -> 13.830000000000005 | AW44: =RC[-31] -> 17.28 | AX44: =RC[-31] -> 1.5680000000000001 | AY44: =RC[-31] -> 1.5680000000000001
A45: =IF(RC[1]="","",DATEVALUE(RC[1])) ->  | C45: 24 | Q45: =RC[-3]-RC[-1] -> #VALUE! | T45: =RC[-1] ->  | U45: =(RC[-17]*RC[-16]-RC[-14]*RC[-13])/1000 -> 0 | X45: =RC[-2]*RC[-10]/1000 -> #VALUE! | Y45: =(RC[-3]*RC[-11]-RC[-2]*RC[-9])/1000 -> #VALUE! | AD45: =VALUE(RC[-28]) -> #VALUE! | AE45: =IF(RC[22]=42,"*",IF(RC[22]=32,"",RC[22])) ->  | AF45: =RC[-29] -> 24 | AG45: =RC[-29] -> 0 | AH45: =RC[-29] -> 0 | AI45: =RC[-29] -> 0 | AJ45: =RC[-29] -> 0 | AK45: =RC[-29] -> 0 | AL45: =RC[-29] -> 0 | AM45: =RC[-29] -> 0 | AN45: =RC[-29] -> 0 | AO45: =RC[-29] -> 0 | AP45: =RC[-29] ->  | AQ45: =RC[-29] ->  | AR45: - | AS45: =RC[-30] ->  | AT45: =RC[-30] ->  | AU45: - | AV45: =RC[-31] -> #VALUE! | AW45: =RC[-31] ->  | AX45: =RC[-31] ->  | AY45: =RC[-31] -> 
A46: =IF(RC[1]="","",DATEVALUE(RC[1])) ->  | C46: 24 | Q46: =RC[-3]-RC[-1] -> #VALUE! | T46: =RC[-1] ->  | U46: =(RC[-17]*RC[-16]-RC[-14]*RC[-13])/1000 -> 0 | X46: =RC[-2]*RC[-10]/1000 -> #VALUE! | Y46: =(RC[-3]*RC[-11]-RC[-2]*RC[-9])/1000 -> #VALUE! | AD46: =VALUE(RC[-28]) -> #VALUE! | AE46: =IF(RC[22]=42,"*",IF(RC[22]=32,"",RC[22])) ->  | AF46: =RC[-29] -> 24 | AG46: =RC[-29] -> 0 | AH46: =RC[-29] -> 0 | AI46: =RC[-29] -> 0 | AJ46: =RC[-29] -> 0 | AK46: =RC[-29] -> 0 | AL46: =RC[-29] -> 0 | AM46: =RC[-29] -> 0 | AN46: =RC[-29] -> 0 | AO46: =RC[-29] -> 0 | AP46: =RC[-29] ->  | AQ46: =RC[-29] ->  | AR46: - | AS46: =RC[-30] ->  | AT46: =RC[-30] ->  | AU46: - | AV46: =RC[-31] -> #VALUE! | AW46: =RC[-31] ->  | AX46: =RC[-31] ->  | AY46: =RC[-31] -> 
A47: =IF(RC[1]="","",DATEVALUE(RC[1])) ->  | C47: 24 | Q47: =RC[-3]-RC[-1] -> #VALUE! | T47: =RC[-1] ->  | U47: =(RC[-17]*RC[-16]-RC[-14]*RC[-13])/1000 -> 0 | X47: =RC[-2]*RC[-10]/1000 -> #VALUE! | Y47: =(RC[-3]*RC[-11]-RC[-2]*RC[-9])/1000 -> #VALUE! | AD47: =VALUE(RC[-28]) -> #VALUE! | AE47: =IF(RC[22]=42,"*",IF(RC[22]=32,"",RC[22])) ->  | AF47: =RC[-29] -> 24 | AG47: =RC[-29] -> 0 | AH47: =RC[-29] -> 0 | AI47: =RC[-29] -> 0 | AJ47: =RC[-29] -> 0 | AK47: =RC[-29] -> 0 | AL47: =RC[-29] -> 0 | AM47: =RC[-29] -> 0 | AN47: =RC[-29] -> 0 | AO47: =RC[-29] -> 0 | AP47: =RC[-29] ->  | AQ47: =RC[-29] ->  | AR47: - | AS47: =RC[-30] ->  | AT47: =RC[-30] ->  | AU47: - | AV47: =RC[-31] -> #VALUE! | AW47: =RC[-31] ->  | AX47: =RC[-31] ->  | AY47: =RC[-31] -> 
A48: =IF(RC[1]="","",DATEVALUE(RC[1])) ->  | C48: 24 | Q48: =RC[-3]-RC[-1] -> #VALUE! | T48: =RC[-1] ->  | U48: =(RC[-17]*RC[-16]-RC[-14]*RC[-13])/1000 -> 0 | X48: =RC[-2]*RC[-10]/1000 -> #VALUE! | Y48: =(RC[-3]*RC[-11]-RC[-2]*RC[-9])/1000 -> #VALUE! | AD48: =VALUE(RC[-28]) -> #VALUE! | AE48: =IF(RC[22]=42,"*",IF(RC[22]=32,"",RC[22])) ->  | AF48: =RC[-29] -> 24 | AG48: =RC[-29] -> 0 | AH48: =RC[-29] -> 0 | AI48: =RC[-29] -> 0 | AJ48: =RC[-29] -> 0 | AK48: =RC[-29] -> 0 | AL48: =RC[-29] -> 0 | AM48: =RC[-29] -> 0 | AN48: =RC[-29] -> 0 | AO48: =RC[-29] -> 0 | AP48: =RC[-29] ->  | AQ48: =RC[-29] ->  | AR48: - | AS48: =RC[-30] ->  | AT48: =RC[-30] ->  | AU48: - | AV48: =RC[-31] -> #VALUE! | AW48: =RC[-31] ->  | AX48: =RC[-31] ->  | AY48: =RC[-31] -> 
A49: =IF(RC[1]="","",DATEVALUE(RC[1])) ->  | C49: 24 | Q49: =RC[-3]-RC[-1] -> #VALUE! | T49: =RC[-1] ->  | U49: =(RC[-17]*RC[-16]-RC[-14]*RC[-13])/1000 -> 0 | X49: =RC[-2]*RC[-10]/1000 -> #VALUE! | Y49: =(RC[-3]*RC[-11]-RC[-2]*RC[-9])/1000 -> #VALUE! | AD49: =VALUE(RC[-28]) -> #VALUE! | AE49: =IF(RC[22]=42,"*",IF(RC[22]=32,"",RC[22])) ->  | AF49: =RC[-29] -> 24 | AG49: =RC[-29] -> 0 | AH49: =RC[-29] -> 0 | AI49: =RC[-29] -> 0 | AJ49: =RC[-29] -> 0 | AK49: =RC[-29] -> 0 | AL49: =RC[-29] -> 0 | AM49: =RC[-29] -> 0 | AN49: =RC[-29] -> 0 | AO49: =RC[-29] -> 0 | AP49: =RC[-29] ->  | AQ49: =RC[-29] ->  | AR49: - | AS49: =RC[-30] ->  | AT49: =RC[-30] ->  | AU49: - | AV49: =RC[-31] -> #VALUE! | AW49: =RC[-31] ->  | AX49: =RC[-31] ->  | AY49: =RC[-31] -> 
A50: =IF(RC[1]="","",DATEVALUE(RC[1])) ->  | C50: 24 | Q50: =RC[-3]-RC[-1] -> #VALUE! | T50: =RC[-1] ->  | U50: =(RC[-17]*RC[-16]-RC[-14]*RC[-13])/1000 -> 0 | X50: =RC[-2]*RC[-10]/1000 -> #VALUE! | Y50: =(RC[-3]*RC[-11]-RC[-2]*RC[-9])/1000 -> #VALUE! | AD50: =VALUE(RC[-28]) -> #VALUE! | AE50: =IF(RC[22]=42,"*",IF(RC[22]=32,"",RC[22])) ->  | AF50: =RC[-29] -> 24 | AG50: =RC[-29] -> 0 | AH50: =RC[-29] -> 0 | AI50: =RC[-29] -> 0 | AJ50: =RC[-29] -> 0 | AK50: =RC[-29] -> 0 | AL50: =RC[-29] -> 0 | AM50: =RC[-29] -> 0 | AN50: =RC[-29] -> 0 | AO50: =RC[-29] -> 0 | AP50: =RC[-29] ->  | AQ50: =RC[-29] ->  | AR50: - | AS50: =RC[-30] ->  | AT50: =RC[-30] ->  | AU50: - | AV50: =RC[-31] -> #VALUE! | AW50: =RC[-31] ->  | AX50: =RC[-31] ->  | AY50: =RC[-31] -> 
A51: =IF(RC[1]="","",DATEVALUE(RC[1])) ->  | C51: 24 | Q51: =RC[-3]-RC[-1] -> #VALUE! | T51: =RC[-1] ->  | U51: =(RC[-17]*RC[-16]-RC[-14]*RC[-13])/1000 -> 0 | X51: =RC[-2]*RC[-10]/1000 -> #VALUE! | Y51: =(RC[-3]*RC[-11]-RC[-2]*RC[-9])/1000 -> #VALUE! | AD51: =VALUE(RC[-28]) -> #VALUE! | AE51: =IF(RC[22]=42,"*",IF(RC[22]=32,"",RC[22])) ->  | AF51: =RC[-29] -> 24 | AG51: =RC[-29] -> 0 | AH51: =RC[-29] -> 0 | AI51: =RC[-29] -> 0 | AJ51: =RC[-29] -> 0 | AK51: =RC[-29] -> 0 | AL51: =RC[-29] -> 0 | AM51: =RC[-29] -> 0 | AN51: =RC[-29] -> 0 | AO51: =RC[-29] -> 0 | AP51: =RC[-29] ->  | AQ51: =RC[-29] ->  | AR51: - | AS51: =RC[-30] ->  | AT51: =RC[-30] ->  | AU51: - | AV51: =RC[-31] -> #VALUE! | AW51: =RC[-31] ->  | AX51: =RC[-31] ->  | AY51: =RC[-31] -> 
A52: =IF(RC[1]="","",DATEVALUE(RC[1])) ->  | C52: 24 | Q52: =RC[-3]-RC[-1] -> #VALUE! | T52: =RC[-1] ->  | U52: =(RC[-17]*RC[-16]-RC[-14]*RC[-13])/1000 -> 0 | X52: =RC[-2]*RC[-10]/1000 -> #VALUE! | Y52: =(RC[-3]*RC[-11]-RC[-2]*RC[-9])/1000 -> #VALUE! | AD52: =VALUE(RC[-28]) -> #VALUE! | AE52: =IF(RC[22]=42,"*",IF(RC[22]=32,"",RC[22])) ->  | AF52: =RC[-29] -> 24 | AG52: =RC[-29] -> 0 | AH52: =RC[-29] -> 0 | AI52: =RC[-29] -> 0 | AJ52: =RC[-29] -> 0 | AK52: =RC[-29] -> 0 | AL52: =RC[-29] -> 0 | AM52: =RC[-29] -> 0 | AN52: =RC[-29] -> 0 | AO52: =RC[-29] -> 0 | AP52: =RC[-29] ->  | AQ52: =RC[-29] ->  | AR52: - | AS52: =RC[-30] ->  | AT52: =RC[-30] ->  | AU52: - | AV52: =RC[-31] -> #VALUE! | AW52: =RC[-31] ->  | AX52: =RC[-31] ->  | AY52: =RC[-31] -> 
A53: =IF(RC[1]="","",DATEVALUE(RC[1])) ->  | C53: 24 | Q53: =RC[-3]-RC[-1] -> #VALUE! | T53: =RC[-1] ->  | U53: =(RC[-17]*RC[-16]-RC[-14]*RC[-13])/1000 -> 0 | X53: =RC[-2]*RC[-10]/1000 -> #VALUE! | Y53: =(RC[-3]*RC[-11]-RC[-2]*RC[-9])/1000 -> #VALUE! | AD53: =VALUE(RC[-28]) -> #VALUE! | AE53: =IF(RC[22]=42,"*",IF(RC[22]=32,"",RC[22])) ->  | AF53: =RC[-29] -> 24 | AG53: =RC[-29] -> 0 | AH53: =RC[-29] -> 0 | AI53: =RC[-29] -> 0 | AJ53: =RC[-29] -> 0 | AK53: =RC[-29] -> 0 | AL53: =RC[-29] -> 0 | AM53: =RC[-29] -> 0 | AN53: =RC[-29] -> 0 | AO53: =RC[-29] -> 0 | AP53: =RC[-29] ->  | AQ53: =RC[-29] ->  | AR53: - | AS53: =RC[-30] ->  | AT53: =RC[-30] ->  | AU53: - | AV53: =RC[-31] -> #VALUE! | AW53: =RC[-31] ->  | AX53: =RC[-31] ->  | AY53: =RC[-31] -> 
A54: =IF(RC[1]="","",DATEVALUE(RC[1])) ->  | C54: 24 | Q54: =RC[-3]-RC[-1] -> #VALUE! | T54: =RC[-1] ->  | U54: =(RC[-17]*RC[-16]-RC[-14]*RC[-13])/1000 -> 0 | X54: =RC[-2]*RC[-10]/1000 -> #VALUE! | Y54: =(RC[-3]*RC[-11]-RC[-2]*RC[-9])/1000 -> #VALUE! | AD54: =VALUE(RC[-28]) -> #VALUE! | AE54: =IF(RC[22]=42,"*",IF(RC[22]=32,"",RC[22])) ->  | AF54: =RC[-29] -> 24 | AG54: =RC[-29] -> 0 | AH54: =RC[-29] -> 0 | AI54: =RC[-29] -> 0 | AJ54: =RC[-29] -> 0 | AK54: =RC[-29] -> 0 | AL54: =RC[-29] -> 0 | AM54: =RC[-29] -> 0 | AN54: =RC[-29] -> 0 | AO54: =RC[-29] -> 0 | AP54: =RC[-29] ->  | AQ54: =RC[-29] ->  | AR54: - | AS54: =RC[-30] ->  | AT54: =RC[-30] ->  | AU54: - | AV54: =RC[-31] -> #VALUE! | AW54: =RC[-31] ->  | AX54: =RC[-31] ->  | AY54: =RC[-31] -> 
A55: =IF(RC[1]="","",DATEVALUE(RC[1])) ->  | C55: 24 | Q55: =RC[-3]-RC[-1] -> #VALUE! | T55: =RC[-1] ->  | U55: =(RC[-17]*RC[-16]-RC[-14]*RC[-13])/1000 -> 0 | X55: =RC[-2]*RC[-10]/1000 -> #VALUE! | Y55: =(RC[-3]*RC[-11]-RC[-2]*RC[-9])/1000 -> #VALUE! | AD55: =VALUE(RC[-28]) -> #VALUE! | AE55: =IF(RC[22]=42,"*",IF(RC[22]=32,"",RC[22])) ->  | AF55: =RC[-29] -> 24 | AG55: =RC[-29] -> 0 | AH55: =RC[-29] -> 0 | AI55: =RC[-29] -> 0 | AJ55: =RC[-29] -> 0 | AK55: =RC[-29] -> 0 | AL55: =RC[-29] -> 0 | AM55: =RC[-29] -> 0 | AN55: =RC[-29] -> 0 | AO55: =RC[-29] -> 0 | AP55: =RC[-29] ->  | AQ55: =RC[-29] ->  | AR55: - | AS55: =RC[-30] ->  | AT55: =RC[-30] ->  | AU55: - | AV55: =RC[-31] -> #VALUE! | AW55: =RC[-31] ->  | AX55: =RC[-31] ->  | AY55: =RC[-31] -> 
A56: =IF(RC[1]="","",DATEVALUE(RC[1])) ->  | C56: 24 | Q56: =RC[-3]-RC[-1] -> #VALUE! | T56: =RC[-1] ->  | U56: =(RC[-17]*RC[-16]-RC[-14]*RC[-13])/1000 -> 0 | X56: =RC[-2]*RC[-10]/1000 -> #VALUE! | Y56: =(RC[-3]*RC[-11]-RC[-2]*RC[-9])/1000 -> #VALUE! | AD56: =VALUE(RC[-28]) -> #VALUE! | AE56: =IF(RC[22]=42,"*",IF(RC[22]=32,"",RC[22])) ->  | AF56: =RC[-29] -> 24 | AG56: =RC[-29] -> 0 | AH56: =RC[-29] -> 0 | AI56: =RC[-29] -> 0 | AJ56: =RC[-29] -> 0 | AK56: =RC[-29] -> 0 | AL56: =RC[-29] -> 0 | AM56: =RC[-29] -> 0 | AN56: =RC[-29] -> 0 | AO56: =RC[-29] -> 0 | AP56: =RC[-29] ->  | AQ56: =RC[-29] ->  | AR56: - | AS56: =RC[-30] ->  | AT56: =RC[-30] ->  | AU56: - | AV56: =RC[-31] -> #VALUE! | AW56: =RC[-31] ->  | AX56: =RC[-31] ->  | AY56: =RC[-31] -> 
A57: =IF(RC[1]="","",DATEVALUE(RC[1])) ->  | C57: 24 | Q57: =RC[-3]-RC[-1] -> #VALUE! | T57: =RC[-1] ->  | U57: =(RC[-17]*RC[-16]-RC[-14]*RC[-13])/1000 -> 0 | X57: =RC[-2]*RC[-10]/1000 -> #VALUE! | Y57: =(RC[-3]*RC[-11]-RC[-2]*RC[-9])/1000 -> #VALUE! | AD57: =VALUE(RC[-28]) -> #VALUE! | AE57: =IF(RC[22]=42,"*",IF(RC[22]=32,"",RC[22])) ->  | AF57: =RC[-29] -> 24 | AG57: =RC[-29] -> 0 | AH57: =RC[-29] -> 0 | AI57: =RC[-29] -> 0 | AJ57: =RC[-29] -> 0 | AK57: =RC[-29] -> 0 | AL57: =RC[-29] -> 0 | AM57: =RC[-29] -> 0 | AN57: =RC[-29] -> 0 | AO57: =RC[-29] -> 0 | AP57: =RC[-29] ->  | AQ57: =RC[-29] ->  | AR57: - | AS57: =RC[-30] ->  | AT57: =RC[-30] ->  | AU57: - | AV57: =RC[-31] -> #VALUE! | AW57: =RC[-31] ->  | AX57: =RC[-31] ->  | AY57: =RC[-31] -> 
A58: =IF(RC[1]="","",DATEVALUE(RC[1])) ->  | C58: 24 | Q58: =RC[-3]-RC[-1] -> #VALUE! | T58: =RC[-1] ->  | U58: =(RC[-17]*RC[-16]-RC[-14]*RC[-13])/1000 -> 0 | X58: =RC[-2]*RC[-10]/1000 -> #VALUE! | Y58: =(RC[-3]*RC[-11]-RC[-2]*RC[-9])/1000 -> #VALUE! | AD58: =VALUE(RC[-28]) -> #VALUE! | AE58: =IF(RC[22]=42,"*",IF(RC[22]=32,"",RC[22])) ->  | AF58: =RC[-29] -> 24 | AG58: =RC[-29] -> 0 | AH58: =RC[-29] -> 0 | AI58: =RC[-29] -> 0 | AJ58: =RC[-29] -> 0 | AK58: =RC[-29] -> 0 | AL58: =RC[-29] -> 0 | AM58: =RC[-29] -> 0 | AN58: =RC[-29] -> 0 | AO58: =RC[-29] -> 0 | AP58: =RC[-29] ->  | AQ58: =RC[-29] ->  | AR58: - | AS58: =RC[-30] ->  | AT58: =RC[-30] ->  | AU58: - | AV58: =RC[-31] -> #VALUE! | AW58: =RC[-31] ->  | AX58: =RC[-31] ->  | AY58: =RC[-31] -> 
A59: =IF(RC[1]="","",DATEVALUE(RC[1])) ->  | C59: 24 | Q59: =RC[-3]-RC[-1] -> #VALUE! | T59: =RC[-1] ->  | U59: =(RC[-17]*RC[-16]-RC[-14]*RC[-13])/1000 -> 0 | X59: =RC[-2]*RC[-10]/1000 -> #VALUE! | Y59: =(RC[-3]*RC[-11]-RC[-2]*RC[-9])/1000 -> #VALUE! | AD59: =VALUE(RC[-28]) -> #VALUE! | AE59: =IF(RC[22]=42,"*",IF(RC[22]=32,"",RC[22])) ->  | AF59: =RC[-29] -> 24 | AG59: =RC[-29] -> 0 | AH59: =RC[-29] -> 0 | AI59: =RC[-29] -> 0 | AJ59: =RC[-29] -> 0 | AK59: =RC[-29] -> 0 | AL59: =RC[-29] -> 0 | AM59: =RC[-29] -> 0 | AN59: =RC[-29] -> 0 | AO59: =RC[-29] -> 0 | AP59: =RC[-29] ->  | AQ59: =RC[-29] ->  | AR59: - | AS59: =RC[-30] ->  | AT59: =RC[-30] ->  | AU59: - | AV59: =RC[-31] -> #VALUE! | AW59: =RC[-31] ->  | AX59: =RC[-31] ->  | AY59: =RC[-31] -> 
A60: =IF(RC[1]="","",DATEVALUE(RC[1])) ->  | C60: 24 | Q60: =RC[-3]-RC[-1] -> #VALUE! | T60: =RC[-1] ->  | U60: =(RC[-17]*RC[-16]-RC[-14]*RC[-13])/1000 -> 0 | X60: =RC[-2]*RC[-10]/1000 -> #VALUE! | Y60: =(RC[-3]*RC[-11]-RC[-2]*RC[-9])/1000 -> #VALUE! | AD60: =VALUE(RC[-28]) -> #VALUE! | AE60: =IF(RC[22]=42,"*",IF(RC[22]=32,"",RC[22])) ->  | AF60: =RC[-29] -> 24 | AG60: =RC[-29] -> 0 | AH60: =RC[-29] -> 0 | AI60: =RC[-29] -> 0 | AJ60: =RC[-29] -> 0 | AK60: =RC[-29] -> 0 | AL60: =RC[-29] -> 0 | AM60: =RC[-29] -> 0 | AN60: =RC[-29] -> 0 | AO60: =RC[-29] -> 0 | AP60: =RC[-29] ->  | AQ60: =RC[-29] ->  | AR60: - | AS60: =RC[-30] ->  | AT60: =RC[-30] ->  | AU60: - | AV60: =RC[-31] -> #VALUE! | AW60: =RC[-31] ->  | AX60: =RC[-31] ->  | AY60: =RC[-31] -> 
A61: =IF(RC[1]="","",DATEVALUE(RC[1])) ->  | C61: 24 | Q61: =RC[-3]-RC[-1] -> #VALUE! | T61: =RC[-1] ->  | U61: =(RC[-17]*RC[-16]-RC[-14]*RC[-13])/1000 -> 0 | X61: =RC[-2]*RC[-10]/1000 -> #VALUE! | Y61: =(RC[-3]*RC[-11]-RC[-2]*RC[-9])/1000 -> #VALUE! | AD61: =VALUE(RC[-28]) -> #VALUE! | AE61: =IF(RC[22]=42,"*",IF(RC[22]=32,"",RC[22])) ->  | AF61: =RC[-29] -> 24 | AG61: =RC[-29] -> 0 | AH61: =RC[-29] -> 0 | AI61: =RC[-29] -> 0 | AJ61: =RC[-29] -> 0 | AK61: =RC[-29] -> 0 | AL61: =RC[-29] -> 0 | AM61: =RC[-29] -> 0 | AN61: =RC[-29] -> 0 | AO61: =RC[-29] -> 0 | AP61: =RC[-29] ->  | AQ61: =RC[-29] ->  | AR61: - | AS61: =RC[-30] ->  | AT61: =RC[-30] ->  | AU61: - | AV61: =RC[-31] -> #VALUE! | AW61: =RC[-31] ->  | AX61: =RC[-31] ->  | AY61: =RC[-31] -> 
A62: =IF(RC[1]="","",DATEVALUE(RC[1])) ->  | C62: 24 | Q62: =RC[-3]-RC[-1] -> #VALUE! | T62: =RC[-1] ->  | U62: =(RC[-17]*RC[-16]-RC[-14]*RC[-13])/1000 -> 0 | X62: =RC[-2]*RC[-10]/1000 -> #VALUE! | Y62: =(RC[-3]*RC[-11]-RC[-2]*RC[-9])/1000 -> #VALUE! | AD62: =VALUE(RC[-28]) -> #VALUE! | AE62: =IF(RC[22]=42,"*",IF(RC[22]=32,"",RC[22])) ->  | AF62: =RC[-29] -> 24 | AG62: =RC[-29] -> 0 | AH62: =RC[-29] -> 0 | AI62: =RC[-29] -> 0 | AJ62: =RC[-29] -> 0 | AK62: =RC[-29] -> 0 | AL62: =RC[-29] -> 0 | AM62: =RC[-29] -> 0 | AN62: =RC[-29] -> 0 | AO62: =RC[-29] -> 0 | AP62: =RC[-29] ->  | AQ62: =RC[-29] ->  | AR62: - | AS62: =RC[-30] ->  | AT62: =RC[-30] ->  | AU62: - | AV62: =RC[-31] -> #VALUE! | AW62: =RC[-31] ->  | AX62: =RC[-31] ->  | AY62: =RC[-31] -> 
A63: =IF(RC[1]="","",DATEVALUE(RC[1])) ->  | C63: 24 | Q63: =RC[-3]-RC[-1] -> #VALUE! | T63: =RC[-1] ->  | U63: =(RC[-17]*RC[-16]-RC[-14]*RC[-13])/1000 -> 0 | X63: =RC[-2]*RC[-10]/1000 -> #VALUE! | Y63: =(RC[-3]*RC[-11]-RC[-2]*RC[-9])/1000 -> #VALUE! | AD63: =VALUE(RC[-28]) -> #VALUE! | AE63: =IF(RC[22]=42,"*",IF(RC[22]=32,"",RC[22])) ->  | AF63: =RC[-29] -> 24 | AG63: =RC[-29] -> 0 | AH63: =RC[-29] -> 0 | AI63: =RC[-29] -> 0 | AJ63: =RC[-29] -> 0 | AK63: =RC[-29] -> 0 | AL63: =RC[-29] -> 0 | AM63: =RC[-29] -> 0 | AN63: =RC[-29] -> 0 | AO63: =RC[-29] -> 0 | AP63: =RC[-29] ->  | AQ63: =RC[-29] ->  | AR63: - | AS63: =RC[-30] ->  | AT63: =RC[-30] ->  | AU63: - | AV63: =RC[-31] -> #VALUE! | AW63: =RC[-31] ->  | AX63: =RC[-31] ->  | AY63: =RC[-31] -> 
A64: =IF(RC[1]="","",DATEVALUE(RC[1])) ->  | C64: 24 | Q64: =RC[-3]-RC[-1] -> #VALUE! | T64: =RC[-1] ->  | U64: =(RC[-17]*RC[-16]-RC[-14]*RC[-13])/1000 -> 0 | X64: =RC[-2]*RC[-10]/1000 -> #VALUE! | Y64: =(RC[-3]*RC[-11]-RC[-2]*RC[-9])/1000 -> #VALUE! | AD64: =VALUE(RC[-28]) -> #VALUE! | AE64: =IF(RC[22]=42,"*",IF(RC[22]=32,"",RC[22])) ->  | AF64: =RC[-29] -> 24 | AG64: =RC[-29] -> 0 | AH64: =RC[-29] -> 0 | AI64: =RC[-29] -> 0 | AJ64: =RC[-29] -> 0 | AK64: =RC[-29] -> 0 | AL64: =RC[-29] -> 0 | AM64: =RC[-29] -> 0 | AN64: =RC[-29] -> 0 | AO64: =RC[-29] -> 0 | AP64: =RC[-29] ->  | AQ64: =RC[-29] ->  | AR64: - | AS64: =RC[-30] ->  | AT64: =RC[-30] ->  | AU64: - | AV64: =RC[-31] -> #VALUE! | AW64: =RC[-31] ->  | AX64: =RC[-31] ->  | AY64: =RC[-31] -> 
A65: =IF(RC[1]="","",DATEVALUE(RC[1])) ->  | C65: 24 | Q65: =RC[-3]-RC[-1] -> #VALUE! | T65: =RC[-1] ->  | U65: =(RC[-17]*RC[-16]-RC[-14]*RC[-13])/1000 -> 0 | X65: =RC[-2]*RC[-10]/1000 -> #VALUE! | Y65: =(RC[-3]*RC[-11]-RC[-2]*RC[-9])/1000 -> #VALUE! | AD65: =VALUE(RC[-28]) -> #VALUE! | AE65: =IF(RC[22]=42,"*",IF(RC[22]=32,"",RC[22])) ->  | AF65: =RC[-29] -> 24 | AG65: =RC[-29] -> 0 | AH65: =RC[-29] -> 0 | AI65: =RC[-29] -> 0 | AJ65: =RC[-29] -> 0 | AK65: =RC[-29] -> 0 | AL65: =RC[-29] -> 0 | AM65: =RC[-29] -> 0 | AN65: =RC[-29] -> 0 | AO65: =RC[-29] -> 0 | AP65: =RC[-29] ->  | AQ65: =RC[-29] ->  | AR65: - | AS65: =RC[-30] ->  | AT65: =RC[-30] ->  | AU65: - | AV65: =RC[-31] -> #VALUE! | AW65: =RC[-31] ->  | AX65: =RC[-31] ->  | AY65: =RC[-31] -> 
A66: =IF(RC[1]="","",DATEVALUE(RC[1])) ->  | C66: 24 | Q66: =RC[-3]-RC[-1] -> #VALUE! | T66: =RC[-1] ->  | U66: =(RC[-17]*RC[-16]-RC[-14]*RC[-13])/1000 -> 0 | X66: =RC[-2]*RC[-10]/1000 -> #VALUE! | Y66: =(RC[-3]*RC[-11]-RC[-2]*RC[-9])/1000 -> #VALUE! | AD66: =VALUE(RC[-28]) -> #VALUE! | AE66: =IF(RC[22]=42,"*",IF(RC[22]=32,"",RC[22])) ->  | AF66: =RC[-29] -> 24 | AG66: =RC[-29] -> 0 | AH66: =RC[-29] -> 0 | AI66: =RC[-29] -> 0 | AJ66: =RC[-29] -> 0 | AK66: =RC[-29] -> 0 | AL66: =RC[-29] -> 0 | AM66: =RC[-29] -> 0 | AN66: =RC[-29] -> 0 | AO66: =RC[-29] -> 0 | AP66: =RC[-29] ->  | AQ66: =RC[-29] ->  | AR66: - | AS66: =RC[-30] ->  | AT66: =RC[-30] ->  | AU66: - | AV66: =RC[-31] -> #VALUE! | AW66: =RC[-31] ->  | AX66: =RC[-31] ->  | AY66: =RC[-31] -> 
A67: =IF(RC[1]="","",DATEVALUE(RC[1])) ->  | C67: 24 | Q67: =RC[-3]-RC[-1] -> #VALUE! | T67: =RC[-1] ->  | U67: =(RC[-17]*RC[-16]-RC[-14]*RC[-13])/1000 -> 0 | X67: =RC[-2]*RC[-10]/1000 -> #VALUE! | Y67: =(RC[-3]*RC[-11]-RC[-2]*RC[-9])/1000 -> #VALUE! | AD67: =VALUE(RC[-28]) -> #VALUE! | AE67: =IF(RC[22]=42,"*",IF(RC[22]=32,"",RC[22])) ->  | AF67: =RC[-29] -> 24 | AG67: =RC[-29] -> 0 | AH67: =RC[-29] -> 0 | AI67: =RC[-29] -> 0 | AJ67: =RC[-29] -> 0 | AK67: =RC[-29] -> 0 | AL67: =RC[-29] -> 0 | AM67: =RC[-29] -> 0 | AN67: =RC[-29] -> 0 | AO67: =RC[-29] -> 0 | AP67: =RC[-29] ->  | AQ67: =RC[-29] ->  | AR67: - | AS67: =RC[-30] ->  | AT67: =RC[-30] ->  | AU67: - | AV67: =RC[-31] -> #VALUE! | AW67: =RC[-31] ->  | AX67: =RC[-31] ->  | AY67: =RC[-31] -> 
A68: =IF(RC[1]="","",DATEVALUE(RC[1])) ->  | C68: 24 | Q68: =RC[-3]-RC[-1] -> #VALUE! | T68: =RC[-1] ->  | U68: =(RC[-17]*RC[-16]-RC[-14]*RC[-13])/1000 -> 0 | X68: =RC[-2]*RC[-10]/1000 -> #VALUE! | Y68: =(RC[-3]*RC[-11]-RC[-2]*RC[-9])/1000 -> #VALUE! | AD68: =VALUE(RC[-28]) -> #VALUE! | AE68: =IF(RC[22]=42,"*",IF(RC[22]=32,"",RC[22])) ->  | AF68: =RC[-29] -> 24 | AG68: =RC[-29] -> 0 | AH68: =RC[-29] -> 0 | AI68: =RC[-29] -> 0 | AJ68: =RC[-29] -> 0 | AK68: =RC[-29] -> 0 | AL68: =RC[-29] -> 0 | AM68: =RC[-29] -> 0 | AN68: =RC[-29] -> 0 | AO68: =RC[-29] -> 0 | AP68: =RC[-29] ->  | AQ68: =RC[-29] ->  | AR68: - | AS68: =RC[-30] ->  | AT68: =RC[-30] ->  | AU68: - | AV68: =RC[-31] -> #VALUE! | AW68: =RC[-31] ->  | AX68: =RC[-31] ->  | AY68: =RC[-31] -> 
A69: =IF(RC[1]="","",DATEVALUE(RC[1])) ->  | C69: 24 | Q69: =RC[-3]-RC[-1] -> #VALUE! | T69: =RC[-1] ->  | U69: =(RC[-17]*RC[-16]-RC[-14]*RC[-13])/1000 -> 0 | X69: =RC[-2]*RC[-10]/1000 -> #VALUE! | Y69: =(RC[-3]*RC[-11]-RC[-2]*RC[-9])/1000 -> #VALUE! | AD69: =VALUE(RC[-28]) -> #VALUE! | AE69: =IF(RC[22]=42,"*",IF(RC[22]=32,"",RC[22])) ->  | AF69: =RC[-29] -> 24 | AG69: =RC[-29] -> 0 | AH69: =RC[-29] -> 0 | AI69: =RC[-29] -> 0 | AJ69: =RC[-29] -> 0 | AK69: =RC[-29] -> 0 | AL69: =RC[-29] -> 0 | AM69: =RC[-29] -> 0 | AN69: =RC[-29] -> 0 | AO69: =RC[-29] -> 0 | AP69: =RC[-29] ->  | AQ69: =RC[-29] ->  | AR69: - | AS69: =RC[-30] ->  | AT69: =RC[-30] ->  | AU69: - | AV69: =RC[-31] -> #VALUE! | AW69: =RC[-31] ->  | AX69: =RC[-31] ->  | AY69: =RC[-31] -> 
A70: =IF(RC[1]="","",DATEVALUE(RC[1])) ->  | C70: 24 | Q70: =RC[-3]-RC[-1] -> #VALUE! | T70: =RC[-1] ->  | U70: =(RC[-17]*RC[-16]-RC[-14]*RC[-13])/1000 -> 0 | X70: =RC[-2]*RC[-10]/1000 -> #VALUE! | Y70: =(RC[-3]*RC[-11]-RC[-2]*RC[-9])/1000 -> #VALUE! | AD70: =VALUE(RC[-28]) -> #VALUE! | AE70: =IF(RC[22]=42,"*",IF(RC[22]=32,"",RC[22])) ->  | AF70: =RC[-29] -> 24 | AG70: =RC[-29] -> 0 | AH70: =RC[-29] -> 0 | AI70: =RC[-29] -> 0 | AJ70: =RC[-29] -> 0 | AK70: =RC[-29] -> 0 | AL70: =RC[-29] -> 0 | AM70: =RC[-29] -> 0 | AN70: =RC[-29] -> 0 | AO70: =RC[-29] -> 0 | AP70: =RC[-29] ->  | AQ70: =RC[-29] ->  | AR70: - | AS70: =RC[-30] ->  | AT70: =RC[-30] ->  | AU70: - | AV70: =RC[-31] -> #VALUE! | AW70: =RC[-31] ->  | AX70: =RC[-31] ->  | AY70: =RC[-31] -> 
A71: =IF(RC[1]="","",DATEVALUE(RC[1])) ->  | C71: 24 | Q71: =RC[-3]-RC[-1] -> #VALUE! | T71: =RC[-1] ->  | U71: =(RC[-17]*RC[-16]-RC[-14]*RC[-13])/1000 -> 0 | X71: =RC[-2]*RC[-10]/1000 -> #VALUE! | Y71: =(RC[-3]*RC[-11]-RC[-2]*RC[-9])/1000 -> #VALUE! | AD71: =VALUE(RC[-28]) -> #VALUE! | AE71: =IF(RC[22]=42,"*",IF(RC[22]=32,"",RC[22])) ->  | AF71: =RC[-29] -> 24 | AG71: =RC[-29] -> 0 | AH71: =RC[-29] -> 0 | AI71: =RC[-29] -> 0 | AJ71: =RC[-29] -> 0 | AK71: =RC[-29] -> 0 | AL71: =RC[-29] -> 0 | AM71: =RC[-29] -> 0 | AN71: =RC[-29] -> 0 | AO71: =RC[-29] -> 0 | AP71: =RC[-29] ->  | AQ71: =RC[-29] ->  | AR71: - | AS71: =RC[-30] ->  | AT71: =RC[-30] ->  | AU71: - | AV71: =RC[-31] -> #VALUE! | AW71: =RC[-31] ->  | AX71: =RC[-31] ->  | AY71: =RC[-31] -> 
A72: =IF(RC[1]="","",DATEVALUE(RC[1])) ->  | C72: 24 | Q72: =RC[-3]-RC[-1] -> #VALUE! | T72: =RC[-1] ->  | U72: =(RC[-17]*RC[-16]-RC[-14]*RC[-13])/1000 -> 0 | X72: =RC[-2]*RC[-10]/1000 -> #VALUE! | Y72: =(RC[-3]*RC[-11]-RC[-2]*RC[-9])/1000 -> #VALUE! | AD72: =VALUE(RC[-28]) -> #VALUE! | AE72: =IF(RC[22]=42,"*",IF(RC[22]=32,"",RC[22])) ->  | AF72: =RC[-29] -> 24 | AG72: =RC[-29] -> 0 | AH72: =RC[-29] -> 0 | AI72: =RC[-29] -> 0 | AJ72: =RC[-29] -> 0 | AK72: =RC[-29] -> 0 | AL72: =RC[-29] -> 0 | AM72: =RC[-29] -> 0 | AN72: =RC[-29] -> 0 | AO72: =RC[-29] -> 0 | AP72: =RC[-29] ->  | AQ72: =RC[-29] ->  | AR72: - | AS72: =RC[-30] ->  | AT72: =RC[-30] ->  | AU72: - | AV72: =RC[-31] -> #VALUE! | AW72: =RC[-31] ->  | AX72: =RC[-31] ->  | AY72: =RC[-31] -> 
A73: =IF(RC[1]="","",DATEVALUE(RC[1])) ->  | C73: 24 | Q73: =RC[-3]-RC[-1] -> #VALUE! | T73: =RC[-1] ->  | U73: =(RC[-17]*RC[-16]-RC[-14]*RC[-13])/1000 -> 0 | X73: =RC[-2]*RC[-10]/1000 -> #VALUE! | Y73: =(RC[-3]*RC[-11]-RC[-2]*RC[-9])/1000 -> #VALUE! | AD73: =VALUE(RC[-28]) -> #VALUE! | AE73: =IF(RC[22]=42,"*",IF(RC[22]=32,"",RC[22])) ->  | AF73: =RC[-29] -> 24 | AG73: =RC[-29] -> 0 | AH73: =RC[-29] -> 0 | AI73: =RC[-29] -> 0 | AJ73: =RC[-29] -> 0 | AK73: =RC[-29] -> 0 | AL73: =RC[-29] -> 0 | AM73: =RC[-29] -> 0 | AN73: =RC[-29] -> 0 | AO73: =RC[-29] -> 0 | AP73: =RC[-29] ->  | AQ73: =RC[-29] ->  | AR73: - | AS73: =RC[-30] ->  | AT73: =RC[-30] ->  | AU73: - | AV73: =RC[-31] -> #VALUE! | AW73: =RC[-31] ->  | AX73: =RC[-31] ->  | AY73: =RC[-31] -> 
A74: =IF(RC[1]="","",DATEVALUE(RC[1])) ->  | C74: 24 | Q74: =RC[-3]-RC[-1] -> #VALUE! | T74: =RC[-1] ->  | U74: =(RC[-17]*RC[-16]-RC[-14]*RC[-13])/1000 -> 0 | X74: =RC[-2]*RC[-10]/1000 -> #VALUE! | Y74: =(RC[-3]*RC[-11]-RC[-2]*RC[-9])/1000 -> #VALUE! | AD74: =VALUE(RC[-28]) -> #VALUE! | AE74: =IF(RC[22]=42,"*",IF(RC[22]=32,"",RC[22])) ->  | AF74: =RC[-29] -> 24 | AG74: =RC[-29] -> 0 | AH74: =RC[-29] -> 0 | AI74: =RC[-29] -> 0 | AJ74: =RC[-29] -> 0 | AK74: =RC[-29] -> 0 | AL74: =RC[-29] -> 0 | AM74: =RC[-29] -> 0 | AN74: =RC[-29] -> 0 | AO74: =RC[-29] -> 0 | AP74: =RC[-29] ->  | AQ74: =RC[-29] ->  | AR74: - | AS74: =RC[-30] ->  | AT74: =RC[-30] ->  | AU74: - | AV74: =RC[-31] -> #VALUE! | AW74: =RC[-31] ->  | AX74: =RC[-31] ->  | AY74: =RC[-31] -> 
A75: =IF(RC[1]="","",DATEVALUE(RC[1])) ->  | C75: 24 | Q75: =RC[-3]-RC[-1] -> #VALUE! | T75: =RC[-1] ->  | U75: =(RC[-17]*RC[-16]-RC[-14]*RC[-13])/1000 -> 0 | X75: =RC[-2]*RC[-10]/1000 -> #VALUE! | Y75: =(RC[-3]*RC[-11]-RC[-2]*RC[-9])/1000 -> #VALUE! | AD75: =VALUE(RC[-28]) -> #VALUE! | AE75: =IF(RC[22]=42,"*",IF(RC[22]=32,"",RC[22])) ->  | AF75: =RC[-29] -> 24 | AG75: =RC[-29] -> 0 | AH75: =RC[-29] -> 0 | AI75: =RC[-29] -> 0 | AJ75: =RC[-29] -> 0 | AK75: =RC[-29] -> 0 | AL75: =RC[-29] -> 0 | AM75: =RC[-29] -> 0 | AN75: =RC[-29] -> 0 | AO75: =RC[-29] -> 0 | AP75: =RC[-29] ->  | AQ75: =RC[-29] ->  | AR75: - | AS75: =RC[-30] ->  | AT75: =RC[-30] ->  | AU75: - | AV75: =RC[-31] -> #VALUE! | AW75: =RC[-31] ->  | AX75: =RC[-31] ->  | AY75: =RC[-31] -> 
A76: =IF(RC[1]="","",DATEVALUE(RC[1])) ->  | C76: 24 | Q76: =RC[-3]-RC[-1] -> #VALUE! | T76: =RC[-1] ->  | U76: =(RC[-17]*RC[-16]-RC[-14]*RC[-13])/1000 -> 0 | X76: =RC[-2]*RC[-10]/1000 -> #VALUE! | Y76: =(RC[-3]*RC[-11]-RC[-2]*RC[-9])/1000 -> #VALUE! | AD76: =VALUE(RC[-28]) -> #VALUE! | AE76: =IF(RC[22]=42,"*",IF(RC[22]=32,"",RC[22])) ->  | AF76: =RC[-29] -> 24 | AG76: =RC[-29] -> 0 | AH76: =RC[-29] -> 0 | AI76: =RC[-29] -> 0 | AJ76: =RC[-29] -> 0 | AK76: =RC[-29] -> 0 | AL76: =RC[-29] -> 0 | AM76: =RC[-29] -> 0 | AN76: =RC[-29] -> 0 | AO76: =RC[-29] -> 0 | AP76: =RC[-29] ->  | AQ76: =RC[-29] ->  | AR76: - | AS76: =RC[-30] ->  | AT76: =RC[-30] ->  | AU76: - | AV76: =RC[-31] -> #VALUE! | AW76: =RC[-31] ->  | AX76: =RC[-31] ->  | AY76: =RC[-31] -> 
A77: =IF(RC[1]="","",DATEVALUE(RC[1])) ->  | C77: 24 | Q77: =RC[-3]-RC[-1] -> #VALUE! | T77: =RC[-1] ->  | U77: =(RC[-17]*RC[-16]-RC[-14]*RC[-13])/1000 -> 0 | X77: =RC[-2]*RC[-10]/1000 -> #VALUE! | Y77: =(RC[-3]*RC[-11]-RC[-2]*RC[-9])/1000 -> #VALUE! | AD77: =VALUE(RC[-28]) -> #VALUE! | AE77: =IF(RC[22]=42,"*",IF(RC[22]=32,"",RC[22])) ->  | AF77: =RC[-29] -> 24 | AG77: =RC[-29] -> 0 | AH77: =RC[-29] -> 0 | AI77: =RC[-29] -> 0 | AJ77: =RC[-29] -> 0 | AK77: =RC[-29] -> 0 | AL77: =RC[-29] -> 0 | AM77: =RC[-29] -> 0 | AN77: =RC[-29] -> 0 | AO77: =RC[-29] -> 0 | AP77: =RC[-29] ->  | AQ77: =RC[-29] ->  | AR77: - | AS77: =RC[-30] ->  | AT77: =RC[-30] ->  | AU77: - | AV77: =RC[-31] -> #VALUE! | AW77: =RC[-31] ->  | AX77: =RC[-31] ->  | AY77: =RC[-31] -> 
A78: =IF(RC[1]="","",DATEVALUE(RC[1])) ->  | C78: 24 | Q78: =RC[-3]-RC[-1] -> #VALUE! | T78: =RC[-1] ->  | U78: =(RC[-17]*RC[-16]-RC[-14]*RC[-13])/1000 -> 0 | X78: =RC[-2]*RC[-10]/1000 -> #VALUE! | Y78: =(RC[-3]*RC[-11]-RC[-2]*RC[-9])/1000 -> #VALUE! | AD78: =VALUE(RC[-28]) -> #VALUE! | AE78: =IF(RC[22]=42,"*",IF(RC[22]=32,"",RC[22])) ->  | AF78: =RC[-29] -> 24 | AG78: =RC[-29] -> 0 | AH78: =RC[-29] -> 0 | AI78: =RC[-29] -> 0 | AJ78: =RC[-29] -> 0 | AK78: =RC[-29] -> 0 | AL78: =RC[-29] -> 0 | AM78: =RC[-29] -> 0 | AN78: =RC[-29] -> 0 | AO78: =RC[-29] -> 0 | AP78: =RC[-29] ->  | AQ78: =RC[-29] ->  | AR78: - | AS78: =RC[-30] ->  | AT78: =RC[-30] ->  | AU78: - | AV78: =RC[-31] -> #VALUE! | AW78: =RC[-31] ->  | AX78: =RC[-31] ->  | AY78: =RC[-31] -> 
A79: =IF(RC[1]="","",DATEVALUE(RC[1])) ->  | C79: 24 | Q79: =RC[-3]-RC[-1] -> #VALUE! | T79: =RC[-1] ->  | U79: =(RC[-17]*RC[-16]-RC[-14]*RC[-13])/1000 -> 0 | X79: =RC[-2]*RC[-10]/1000 -> #VALUE! | Y79: =(RC[-3]*RC[-11]-RC[-2]*RC[-9])/1000 -> #VALUE! | AD79: =VALUE(RC[-28]) -> #VALUE! | AE79: =IF(RC[22]=42,"*",IF(RC[22]=32,"",RC[22])) ->  | AF79: =RC[-29] -> 24 | AG79: =RC[-29] -> 0 | AH79: =RC[-29] -> 0 | AI79: =RC[-29] -> 0 | AJ79: =RC[-29] -> 0 | AK79: =RC[-29] -> 0 | AL79: =RC[-29] -> 0 | AM79: =RC[-29] -> 0 | AN79: =RC[-29] -> 0 | AO79: =RC[-29] -> 0 | AP79: =RC[-29] ->  | AQ79: =RC[-29] ->  | AR79: - | AS79: =RC[-30] ->  | AT79: =RC[-30] ->  | AU79: - | AV79: =RC[-31] -> #VALUE! | AW79: =RC[-31] ->  | AX79: =RC[-31] ->  | AY79: =RC[-31] -> 
A80: =IF(RC[1]="","",DATEVALUE(RC[1])) ->  | C80: 24 | Q80: =RC[-3]-RC[-1] -> #VALUE! | T80: =RC[-1] ->  | U80: =(RC[-17]*RC[-16]-RC[-14]*RC[-13])/1000 -> 0 | X80: =RC[-2]*RC[-10]/1000 -> #VALUE! | Y80: =(RC[-3]*RC[-11]-RC[-2]*RC[-9])/1000 -> #VALUE! | AD80: =VALUE(RC[-28]) -> #VALUE! | AE80: =IF(RC[22]=42,"*",IF(RC[22]=32,"",RC[22])) ->  | AF80: =RC[-29] -> 24 | AG80: =RC[-29] -> 0 | AH80: =RC[-29] -> 0 | AI80: =RC[-29] -> 0 | AJ80: =RC[-29] -> 0 | AK80: =RC[-29] -> 0 | AL80: =RC[-29] -> 0 | AM80: =RC[-29] -> 0 | AN80: =RC[-29] -> 0 | AO80: =RC[-29] -> 0 | AP80: =RC[-29] ->  | AQ80: =RC[-29] ->  | AR80: - | AS80: =RC[-30] ->  | AT80: =RC[-30] ->  | AU80: - | AV80: =RC[-31] -> #VALUE! | AW80: =RC[-31] ->  | AX80: =RC[-31] ->  | AY80: =RC[-31] -> 
A81: =IF(RC[1]="","",DATEVALUE(RC[1])) ->  | C81: 24 | Q81: =RC[-3]-RC[-1] -> #VALUE! | T81: =RC[-1] ->  | U81: =(RC[-17]*RC[-16]-RC[-14]*RC[-13])/1000 -> 0 | X81: =RC[-2]*RC[-10]/1000 -> #VALUE! | Y81: =(RC[-3]*RC[-11]-RC[-2]*RC[-9])/1000 -> #VALUE! | AD81: =VALUE(RC[-28]) -> #VALUE! | AE81: =IF(RC[22]=42,"*",IF(RC[22]=32,"",RC[22])) ->  | AF81: =RC[-29] -> 24 | AG81: =RC[-29] -> 0 | AH81: =RC[-29] -> 0 | AI81: =RC[-29] -> 0 | AJ81: =RC[-29] -> 0 | AK81: =RC[-29] -> 0 | AL81: =RC[-29] -> 0 | AM81: =RC[-29] -> 0 | AN81: =RC[-29] -> 0 | AO81: =RC[-29] -> 0 | AP81: =RC[-29] ->  | AQ81: =RC[-29] ->  | AR81: - | AS81: =RC[-30] ->  | AT81: =RC[-30] ->  | AU81: - | AV81: =RC[-31] -> #VALUE! | AW81: =RC[-31] ->  | AX81: =RC[-31] ->  | AY81: =RC[-31] -> 
A82: =IF(RC[1]="","",DATEVALUE(RC[1])) ->  | C82: 24 | Q82: =RC[-3]-RC[-1] -> #VALUE! | T82: =RC[-1] ->  | U82: =(RC[-17]*RC[-16]-RC[-14]*RC[-13])/1000 -> 0 | X82: =RC[-2]*RC[-10]/1000 -> #VALUE! | Y82: =(RC[-3]*RC[-11]-RC[-2]*RC[-9])/1000 -> #VALUE! | AD82: =VALUE(RC[-28]) -> #VALUE! | AE82: =IF(RC[22]=42,"*",IF(RC[22]=32,"",RC[22])) ->  | AF82: =RC[-29] -> 24 | AG82: =RC[-29] -> 0 | AH82: =RC[-29] -> 0 | AI82: =RC[-29] -> 0 | AJ82: =RC[-29] -> 0 | AK82: =RC[-29] -> 0 | AL82: =RC[-29] -> 0 | AM82: =RC[-29] -> 0 | AN82: =RC[-29] -> 0 | AO82: =RC[-29] -> 0 | AP82: =RC[-29] ->  | AQ82: =RC[-29] ->  | AR82: - | AS82: =RC[-30] ->  | AT82: =RC[-30] ->  | AU82: - | AV82: =RC[-31] -> #VALUE! | AW82: =RC[-31] ->  | AX82: =RC[-31] ->  | AY82: =RC[-31] -> 
A83: =IF(RC[1]="","",DATEVALUE(RC[1])) ->  | C83: 24 | Q83: =RC[-3]-RC[-1] -> #VALUE! | T83: =RC[-1] ->  | U83: =(RC[-17]*RC[-16]-RC[-14]*RC[-13])/1000 -> 0 | X83: =RC[-2]*RC[-10]/1000 -> #VALUE! | Y83: =(RC[-3]*RC[-11]-RC[-2]*RC[-9])/1000 -> #VALUE! | AD83: =VALUE(RC[-28]) -> #VALUE! | AE83: =IF(RC[22]=42,"*",IF(RC[22]=32,"",RC[22])) ->  | AF83: =RC[-29] -> 24 | AG83: =RC[-29] -> 0 | AH83: =RC[-29] -> 0 | AI83: =RC[-29] -> 0 | AJ83: =RC[-29] -> 0 | AK83: =RC[-29] -> 0 | AL83: =RC[-29] -> 0 | AM83: =RC[-29] -> 0 | AN83: =RC[-29] -> 0 | AO83: =RC[-29] -> 0 | AP83: =RC[-29] ->  | AQ83: =RC[-29] ->  | AR83: - | AS83: =RC[-30] ->  | AT83: =RC[-30] ->  | AU83: - | AV83: =RC[-31] -> #VALUE! | AW83: =RC[-31] ->  | AX83: =RC[-31] ->  | AY83: =RC[-31] -> 
AD84: Среднее | AG84: =R[1]C[-29] -> 0 | AH84: =R[1]C[-29] -> 0 | AI84: =R[1]C[-29] -> 0 | AJ84: =R[1]C[-29] -> 0 | AK84: =R[1]C[-29] -> 0 | AL84: =R[1]C[-29] -> 0 | AM84: =R[1]C[-29] -> 0 | AN84: =R[1]C[-29] -> 0 | AP84: =R[1]C[-29] -> 45.720322580645167 | AQ84: =R[1]C[-29] -> 64.715806451612906 | AS84: =R[1]C[-30] -> 29.273225806451606 | AT84: =R[1]C[-30] -> 47.278709677419357 | AU84: - | AV84: =R[1]C[-31] -> 17.437096774193549
B85: Среднее | M85: =AVERAGE(OFFSET(R[-74]C,3,0,R7C1,1)) -> 45.720322580645167 | N85: =IF(SUM(OFFSET(R[-74]C,3,0,R7C1,1))=0,0,AVERAGE(OFFSET(R[-74]C,3,0,R7C1,1))) -> 64.715806451612906 | O85: =AVERAGE(OFFSET(R[-74]C,3,0,R7C1,1)) -> 29.273225806451606 | P85: =IF(SUM(OFFSET(R[-74]C,3,0,R7C1,1))=0,0,AVERAGE(OFFSET(R[-74]C,3,0,R7C1,1))) -> 47.278709677419357 | Q85: =RC[-3]-RC[-1] -> 17.437096774193549 | R85: =AVERAGE(OFFSET(R[-74]C,3,0,R7C1,1)) -> 16.447096774193554 | S85: =AVERAGE(OFFSET(R[-74]C,3,0,R7C1,1)) -> 1.3859354838709679 | T85: =AVERAGE(OFFSET(R[-74]C,3,0,R7C1,1)) -> 1.3859354838709679 | U85: =AVERAGE(OFFSET(R[-74]C,3,0,R7C1,1)) -> 0 | X85: =AVERAGE(OFFSET(R[-74]C,3,0,R7C1,1)) -> #VALUE! | Y85: =AVERAGE(OFFSET(R[-74]C,3,0,R7C1,1)) -> #VALUE! | AD85: Итого | AF85: =R[1]C[-29] -> 744 | AG85: =R[1]C[-29] -> 0 | AJ85: =R[1]C[-29] -> 0 | AN85: =R[1]C[-29] -> 0 | AO85: =R[1]C[-29] -> 0 | AP85: =R[1]C[-29] -> 1417.3300000000002 | AS85: =R[1]C[-30] -> 907.4699999999998 | AW85: =R[1]C[-31] -> 509.86000000000013 | AX85: =R[1]C[-31] -> 42.964000000000006 | AY85: =R[1]C[-31] -> 42.964000000000006
B86: ИТОГО: | C86: =SUM(OFFSET(R[-75]C,3,0,R7C1,1)) -> 744 | M86: =SUM(OFFSET(R[-75]C,3,0,R7C1,1)) -> 1417.3300000000002 | O86: =SUM(OFFSET(R[-75]C,3,0,R7C1,1)) -> 907.4699999999998 | R86: =SUM(OFFSET(R[-75]C,3,0,R7C1,1)) -> 509.86000000000013 | S86: =SUM(OFFSET(R[-75]C,3,0,R7C1,1)) -> 42.964000000000006 | T86: =SUM(OFFSET(R[-75]C,3,0,R7C1,1)) -> 42.964000000000006 | U86: =SUM(OFFSET(R[-75]C,3,0,R7C1,1)) -> 0 | X86: =SUM(OFFSET(R[-75]C,3,0,R7C1,1)) -> #VALUE! | Y86: =SUM(OFFSET(R[-75]C,3,0,R7C1,1)) -> #VALUE!
AD87: Досчёт по среднему до конца месяца | AG87: =R[1]C[-29] -> 0 | AJ87: =R[1]C[-29] -> 0 | AN87: =R[1]C[-29] -> 0 | AO87: =R[1]C[-29] -> 0 | AP87: =R[1]C[-29] -> 0 | AS87: =R[1]C[-30] -> 0 | AW87: =R[1]C[-31] -> 0 | AX87: =R[1]C[-31] -> 0 | AY87: =R[1]C[-31] -> 0
A88: 11дн=264ч 4дн=96ч | B88: Досчёт до конца м-ца (+) | C88: =R[-82]C[-2]*24 -> 192 | M88: 0 | O88: 0 | R88: 0 | S88: 0 | T88: 0 | U88: № 42569 | AD88: Снятие досчёта по среднему предыдущего отчёта | AG88: =-R[1]C[-29] -> 0 | AJ88: =-R[1]C[-29] -> 0 | AN88: =-R[1]C[-29] -> 0 | AO88: =-R[1]C[-29] -> 0 | AP88: =-R[1]C[-29] -> 0 | AS88: =-R[1]C[-30] -> 0 | AW88: =-R[1]C[-31] -> 0 | AX88: =-R[1]C[-31] -> 0 | AY88: =-R[1]C[-31] -> 0
A89: 9дн=216ч 7дн=168ч | B89: Вычет с предыдущего (-) | C89: =R[-85]C[-2]*24 -> 216 | AD89: Сумма: | AG89: =R[1]C[-29] -> 0 | AJ89: =R[1]C[-29] -> 0 | AN89: =R[1]C[-29] -> 0 | AO89: =R[1]C[-29] -> 0 | AP89: =R[1]C[-29] -> 1417.3300000000002 | AS89: =R[1]C[-30] -> 907.4699999999998 | AW89: =R[1]C[-31] -> 509.86000000000013 | AX89: =R[1]C[-31] -> 42.964000000000006 | AY89: =R[1]C[-31] -> 42.964000000000006
B90: СУММА: | C90: =R[-4]C+R[-2]C-R[-1]C -> 720 | M90: =R[-4]C+R[-2]C-R[-1]C -> 1417.3300000000002 | O90: =R[-4]C+R[-2]C-R[-1]C -> 907.4699999999998 | R90: =R[-4]C+R[-2]C-R[-1]C -> 509.86000000000013 | S90: =R[-4]C+R[-2]C-R[-1]C -> 42.964000000000006 | T90: =R[-4]C+R[-2]C-R[-1]C -> 42.964000000000006 | AD90: Тхв на источнике | AE90: 0 | AF90: V гвс (м3) | AG90: =R[-1]C[16] -> 509.86000000000013 | AH90: W гвс (Гкал) | AI90: =RC[-2]*0.06 -> 30.591600000000007 | AJ90: W без гвс (Гкал) | AK90: =R[-1]C[4] -> 0
AD91: =R[-90]C[-17] -> отчет сдается по письму с 15.09.18г по 17.09.18г некорректная работа приборов
B93: Дата, время | D93: М1, т | F93: М2, т | H93: М3, т | J93: М4, т | L93: Qо, Гкал | N93: Qг, Гкал | P93: время, час
B94: 24.08.18 02:00 | D94: 158377.21 | F94: 156724.72 | H94: 169483.36 | J94: 169352.31 | L94: 3000.5219999999999 | N94: 2886.9140000000002 | P94: -
B95: 18.09.18 06:00 | D95: 162249.04999999999 | F95: 160417.03 | H95: 176409.48 | J95: 175379.33 | L95: 3040.989 | N95: 2941.0749999999998 | P95: -
B98: Представитель потредителя:_______________________________________________________ В.О. Топорков
I101: Рекомендуемые значения по параметрам теплопотребления (не являются официально утверждёнными)
I102: М, т | J102: V, м3 | K102: Qгвс, Гкал | L102: Qотоп, Гкал | M102: Qо, Гкал
I103: =R[-13]C[6] -> 907.4699999999998 | J103: =RC[-1]/0.98 -> 925.98979591836712 | K103: =R[-13]C[8] -> 42.964000000000006 | L103: =R[-13]C -> 0 | M103: =R[-6]C[2] -> 0
P105: ДЛЯ САМОКОНТРОЛЯ
B106: В строке выбора дат указать период с 16.7.13 по 23.8.13 - жильё | O106: Qo | Q106: Qг
B107: В строке выбора дат указать период с 18.7.13 по 25.8.13 - не жилое | O107: =((R[-21]C[-11]*R[-22]C[-8])-(R[-21]C[-10]*R[-22]C[-7]))/1000 -> 0 | Q107: =IF(R[-22]C[-3]="",R[-21]C[-4]*R[-22]C[-1]/1000,"") ->  | R107: Си4
Q108: =IF(R[-23]C[-3]="","",((R[-22]C[-4]*R[-23]C[-1])-(R[-22]C[-3]*R[-23]C[1]))/1000) -> 67.009533587096783 | R108: Си5