Sheet: Лист1
G1: Отчёт о теплопотреблении за октябрь 2018 | M1: с 28.09.18г по 03.10.18г, с 20.10.18г по 21.10.18г некорректная работа приборов
A4: =EOMONTH(R[9]C,0)-R[9]C -> 8 | B4: Потребитель: ЗАО "Сити Сервис"
A5: =MAX(R[9]C:R[78]C) -> 2018-10-22T00:00:00.000 | B5: Адрес: г. СПб, Кораблестроителей ул., д.37 ИТП 6
A6: =EOMONTH(R[-1]C,0)-R[-1]C -> 9 | B6: Телефон: 8-911-021-19-79
A7: =R[-2]C-R[6]C -> 30 | B7: Договор 10023-2 (.) 399
A8: 7 | B8: Тепловычислитель: ВКТ-7 № 27633 | L8: М2 мах= | M8: 98.4 | O8: Мгвс мах= | P8: 54
L9: Qотоп мах= | M9: 7.872 | O9: Qгвс мах= | P9: 3.288
B10: Расчётная формула: Q=M1*(h1-hхв)-M2*(h2-hхв)
D12: Учет | L12: Контроль
A13: =R[1]C[1]-1 -> 2018-09-22T00:00:00.000 | B13: Дата | C13: N, ч | D13: M1, т | E13: T1, С | F13: P1, кг/см2 | G13: M2, т | H13: T2, С | I13: P2, кг/см2 | J13: dT, С | K13: M1-М2, т | L13: V3, м3 | M13: T3, С | N13: V4, м3 | O13: =IF(R[-12]C[-14]="м.куб","","T4, С") -> T4, С | P13: dT, С | Q13: V3-V4, м3 | R13: Qгвс, Гкал | S13: Qобщ., Гкал | T13: Q | U13: M3 | V13: M4 | W13: си2 | X13: си3 | Y13: Разб. | Z13: dM2 | AC13: Дата | AD13: НС | AE13: n, ч | AF13: М1, т | AG13: t1, гр. С | AH13: Р1, кгс/см2 | AI13: М2, т | AJ13: t2, гр. С | AK13: Р2, кгс/см2 | AL13: t1-t2, гр. С | AM13: М1-М2, т | AN13: М1гвс, т | AO13: t1гвс, гр. С | AP13: Р1гвс, кгс/см2 | AQ13: М2гвс, т | AR13: t2гвс, гр. С | AS13: Р2гвс, кгс/см2 | AT13: t1гвс-t2гвс | AU13: М1гвс-М2гвс, т | AV13: Wгвс, Гкал | AW13: Wсумм, Гкал | AY13: NS_TV1 | AZ13: НС | BA13: NS_TV2
A14: =IF(RC[1]="","",DATEVALUE(RC[1])) -> 43366 | B14: 23.09.18 | C14: 24 | D14: 14.9 | E14: 68.8 | F14: 7.4 | G14: 0 | H14: 23.86 | I14: 5.5 | J14: =RC[-5]-RC[-2] -> 44.94 | K14: 14.9 | L14: 12.8 | M14: 68.09 | R14: 0.85499999999999998 | S14: =RC[-1] -> 0.85499999999999998 | T14: =(RC[-16]*RC[-15]-RC[-13]*RC[-12])/1000 -> 1.0251199999999998 | U14: 12.54 | V14: - | W14: =RC[-2]*RC[-10]/1000 -> 0.85384860000000007 | X14: =ABS((RC[-3]*RC[-11]-RC[-2]*RC[-9])/1000) -> #VALUE! | Y14: =(RC[-14]-RC[1])/RC[-18]*100 -> #DIV/0! | Z14: 12.54 | AC14: =VALUE(RC[-27]) -> 2018-09-23T00:00:00.000 | AD14: =IF(RC[21]=42,"*",IF(RC[21]=32,"",RC[21])) -> - | AE14: =RC[-28] -> 24 | AF14: =RC[-28] -> 14.9 | AG14: =RC[-28] -> 68.8 | AH14: =RC[-28] -> 7.4 | AI14: =RC[-28] -> 0 | AJ14: =RC[-28] -> 23.86 | AK14: =RC[-28] -> 5.5 | AL14: =RC[-28] -> 44.94 | AM14: =RC[-28] -> 14.9 | AN14: =RC[-28] -> 12.8 | AO14: =RC[-28] -> 68.09 | AP14: - | AQ14: =RC[-29] -> 0 | AR14: =RC[-29] -> 0 | AS14: - | AT14: =RC[-30] -> 0 | AU14: =RC[-30] -> 0 | AV14: =RC[-30] -> 0.85499999999999998 | AW14: =RC[-30] -> 0.85499999999999998 | AY14: - | AZ14: - | BA14: -
A15: =IF(RC[1]="","",DATEVALUE(RC[1])) -> 43367 | B15: 24.09.18 | C15: 24 | D15: 13.54 | E15: 66.5 | F15: 7.4 | G15: 0 | H15: 22.44 | I15: 5.5 | J15: =RC[-5]-RC[-2] -> 44.06 | K15: 13.54 | L15: 11.22 | M15: 65.8 | R15: 0.72399999999999998 | S15: =RC[-1] -> 0.72399999999999998 | T15: =(RC[-16]*RC[-15]-RC[-13]*RC[-12])/1000 -> 0.90040999999999993 | U15: 11.02 | V15: - | W15: =RC[-2]*RC[-10]/1000 -> 0.72511599999999998 | X15: =ABS((RC[-3]*RC[-11]-RC[-2]*RC[-9])/1000) -> #VALUE! | Y15: =(RC[-14]-RC[1])/RC[-18]*100 -> #DIV/0! | Z15: 11.02 | AC15: =VALUE(RC[-27]) -> 2018-09-24T00:00:00.000 | AD15: =IF(RC[21]=42,"*",IF(RC[21]=32,"",RC[21])) -> - | AE15: =RC[-28] -> 24 | AF15: =RC[-28] -> 13.54 | AG15: =RC[-28] -> 66.5 | AH15: =RC[-28] -> 7.4 | AI15: =RC[-28] -> 0 | AJ15: =RC[-28] -> 22.44 | AK15: =RC[-28] -> 5.5 | AL15: =RC[-28] -> 44.06 | AM15: =RC[-28] -> 13.54 | AN15: =RC[-28] -> 11.22 | AO15: =RC[-28] -> 65.8 | AP15: - | AQ15: =RC[-29] -> 0 | AR15: =RC[-29] -> 0 | AS15: - | AT15: =RC[-30] -> 0 | AU15: =RC[-30] -> 0 | AV15: =RC[-30] -> 0.72399999999999998 | AW15: =RC[-30] -> 0.72399999999999998 | AY15: - | AZ15: - | BA15: -
A16: =IF(RC[1]="","",DATEVALUE(RC[1])) -> 43368 | B16: 25.09.18 | C16: 24 | D16: 13.33 | E16: 65.28 | F16: 7.4 | G16: 0 | H16: 21.41 | I16: 5.5 | J16: =RC[-5]-RC[-2] -> 43.870000000000005 | K16: 13.33 | L16: 10.89 | M16: 64.63 | R16: 0.69099999999999995 | S16: =RC[-1] -> 0.69099999999999995 | T16: =(RC[-16]*RC[-15]-RC[-13]*RC[-12])/1000 -> 0.87018240000000002 | U16: 10.67 | V16: - | W16: =RC[-2]*RC[-10]/1000 -> 0.6896021 | X16: =ABS((RC[-3]*RC[-11]-RC[-2]*RC[-9])/1000) -> #VALUE! | Y16: =(RC[-14]-RC[1])/RC[-18]*100 -> #DIV/0! | Z16: 10.67 | AC16: =VALUE(RC[-27]) -> 2018-09-25T00:00:00.000 | AD16: =IF(RC[21]=42,"*",IF(RC[21]=32,"",RC[21])) -> - | AE16: =RC[-28] -> 24 | AF16: =RC[-28] -> 13.33 | AG16: =RC[-28] -> 65.28 | AH16: =RC[-28] -> 7.4 | AI16: =RC[-28] -> 0 | AJ16: =RC[-28] -> 21.41 | AK16: =RC[-28] -> 5.5 | AL16: =RC[-28] -> 43.870000000000005 | AM16: =RC[-28] -> 13.33 | AN16: =RC[-28] -> 10.89 | AO16: =RC[-28] -> 64.63 | AP16: - | AQ16: =RC[-29] -> 0 | AR16: =RC[-29] -> 0 | AS16: - | AT16: =RC[-30] -> 0 | AU16: =RC[-30] -> 0 | AV16: =RC[-30] -> 0.69099999999999995 | AW16: =RC[-30] -> 0.69099999999999995 | AY16: - | AZ16: - | BA16: -
A17: =IF(RC[1]="","",DATEVALUE(RC[1])) -> 43369 | B17: 26.09.18 | C17: 24 | D17: 13.95 | E17: 64.5 | F17: 7.4 | G17: 0 | H17: 20.77 | I17: 5.5 | J17: =RC[-5]-RC[-2] -> 43.730000000000004 | K17: 13.95 | L17: 11.84 | M17: 63.91 | R17: 0.74099999999999999 | S17: =RC[-1] -> 0.74099999999999999 | T17: =(RC[-16]*RC[-15]-RC[-13]*RC[-12])/1000 -> 0.89977499999999999 | U17: 11.61 | V17: - | W17: =RC[-2]*RC[-10]/1000 -> 0.74199510000000002 | X17: =ABS((RC[-3]*RC[-11]-RC[-2]*RC[-9])/1000) -> #VALUE! | Y17: =(RC[-14]-RC[1])/RC[-18]*100 -> #DIV/0! | Z17: 11.61 | AC17: =VALUE(RC[-27]) -> 2018-09-26T00:00:00.000 | AD17: =IF(RC[21]=42,"*",IF(RC[21]=32,"",RC[21])) -> - | AE17: =RC[-28] -> 24 | AF17: =RC[-28] -> 13.95 | AG17: =RC[-28] -> 64.5 | AH17: =RC[-28] -> 7.4 | AI17: =RC[-28] -> 0 | AJ17: =RC[-28] -> 20.77 | AK17: =RC[-28] -> 5.5 | AL17: =RC[-28] -> 43.730000000000004 | AM17: =RC[-28] -> 13.95 | AN17: =RC[-28] -> 11.84 | AO17: =RC[-28] -> 63.91 | AP17: - | AQ17: =RC[-29] -> 0 | AR17: =RC[-29] -> 0 | AS17: - | AT17: =RC[-30] -> 0 | AU17: =RC[-30] -> 0 | AV17: =RC[-30] -> 0.74099999999999999 | AW17: =RC[-30] -> 0.74099999999999999 | AY17: - | AZ17: - | BA17: -
A18: =IF(RC[1]="","",DATEVALUE(RC[1])) -> 43370 | B18: 27.09.18 | C18: 24 | D18: 67.69 | E18: 62.18 | F18: 7.4 | G18: 44.92 | H18: 38.729999999999997 | I18: 5.5 | J18: =RC[-5]-RC[-2] -> 23.450000000000003 | K18: 22.77 | L18: 12.45 | M18: 60.74 | R18: 0.74299999999999999 | S18: 2.4689999999999999 | T18: =(RC[-16]*RC[-15]-RC[-13]*RC[-12])/1000 -> 2.4692125999999996 | U18: 12.24 | V18: - | W18: =RC[-2]*RC[-10]/1000 -> 0.74345760000000005 | X18: =ABS((RC[-3]*RC[-11]-RC[-2]*RC[-9])/1000) -> #VALUE! | Y18: =(RC[-14]-RC[1])/RC[-18]*100 -> 23.441674087266247 | Z18: 12.24 | AC18: =VALUE(RC[-27]) -> 2018-09-27T00:00:00.000 | AD18: =IF(RC[21]=42,"*",IF(RC[21]=32,"",RC[21])) -> - | AE18: =RC[-28] -> 24 | AF18: =RC[-28] -> 67.69 | AG18: =RC[-28] -> 62.18 | AH18: =RC[-28] -> 7.4 | AI18: =RC[-28] -> 44.92 | AJ18: =RC[-28] -> 38.729999999999997 | AK18: =RC[-28] -> 5.5 | AL18: =RC[-28] -> 23.450000000000003 | AM18: =RC[-28] -> 22.77 | AN18: =RC[-28] -> 12.45 | AO18: =RC[-28] -> 60.74 | AP18: - | AQ18: =RC[-29] -> 0 | AR18: =RC[-29] -> 0 | AS18: - | AT18: =RC[-30] -> 0 | AU18: =RC[-30] -> 0 | AV18: =RC[-30] -> 0.74299999999999999 | AW18: =RC[-30] -> 2.4689999999999999 | AY18: - | AZ18: - | BA18: -
A19: =IF(RC[1]="","",DATEVALUE(RC[1])) -> 43371 | B19: 28.09.18 | C19: 24 | D19: 112.21999999999998 | E19: 66.030000000000015 | F19: 7.4000000000000012 | G19: 100.99666666666667 | H19: 42.043333333333329 | I19: 5.5 | J19: 23.986666666666668 | K19: 11.223333333333334 | L19: 11.49 | M19: 66.59 | R19: 0.752 | S19: =RC[1] -> 3.1636500777777794 | T19: =(RC[-16]*RC[-15]-RC[-13]*RC[-12])/1000 -> 3.1636500777777794 | U19: 11.28 | V19: - | W19: =RC[-2]*RC[-10]/1000 -> 0.75113519999999989 | X19: =ABS((RC[-3]*RC[-11]-RC[-2]*RC[-9])/1000) -> #VALUE! | Y19: =(RC[-14]-RC[1])/RC[-18]*100 -> -5.6107462292483111E-2 | Z19: 11.28 | AC19: =VALUE(RC[-27]) -> 2018-09-28T00:00:00.000 | AD19: =IF(RC[21]=42,"*",IF(RC[21]=32,"",RC[21])) -> - | AE19: =RC[-28] -> 24 | AF19: =RC[-28] -> 112.21999999999998 | AG19: =RC[-28] -> 66.030000000000015 | AH19: =RC[-28] -> 7.4000000000000012 | AI19: =RC[-28] -> 100.99666666666667 | AJ19: =RC[-28] -> 42.043333333333329 | AK19: =RC[-28] -> 5.5 | AL19: =RC[-28] -> 23.986666666666668 | AM19: =RC[-28] -> 11.223333333333334 | AN19: =RC[-28] -> 11.49 | AO19: =RC[-28] -> 66.59 | AP19: - | AQ19: =RC[-29] -> 0 | AR19: =RC[-29] -> 0 | AS19: - | AT19: =RC[-30] -> 0 | AU19: =RC[-30] -> 0 | AV19: =RC[-30] -> 0.752 | AW19: =RC[-30] -> 3.1636500777777794 | AY19: - | AZ19: - | BA19: -
A20: =IF(RC[1]="","",DATEVALUE(RC[1])) -> 43372 | B20: 29.09.18 | C20: 24 | D20: 112.21999999999998 | E20: 66.030000000000015 | F20: 7.4000000000000012 | G20: 100.99666666666667 | H20: 42.043333333333329 | I20: 5.5 | J20: 23.986666666666668 | K20: 11.223333333333334 | L20: 11.56 | M20: 65.989999999999995 | R20: 0.747 | S20: =RC[1] -> 3.1636500777777794 | T20: =(RC[-16]*RC[-15]-RC[-13]*RC[-12])/1000 -> 3.1636500777777794 | U20: 11.33 | V20: - | W20: =RC[-2]*RC[-10]/1000 -> 0.74766670000000002 | X20: =ABS((RC[-3]*RC[-11]-RC[-2]*RC[-9])/1000) -> #VALUE! | Y20: =(RC[-14]-RC[1])/RC[-18]*100 -> -0.10561404666820579 | Z20: 11.33 | AC20: =VALUE(RC[-27]) -> 2018-09-29T00:00:00.000 | AD20: =IF(RC[21]=42,"*",IF(RC[21]=32,"",RC[21])) -> - | AE20: =RC[-28] -> 24 | AF20: =RC[-28] -> 112.21999999999998 | AG20: =RC[-28] -> 66.030000000000015 | AH20: =RC[-28] -> 7.4000000000000012 | AI20: =RC[-28] -> 100.99666666666667 | AJ20: =RC[-28] -> 42.043333333333329 | AK20: =RC[-28] -> 5.5 | AL20: =RC[-28] -> 23.986666666666668 | AM20: =RC[-28] -> 11.223333333333334 | AN20: =RC[-28] -> 11.56 | AO20: =RC[-28] -> 65.989999999999995 | AP20: - | AQ20: =RC[-29] -> 0 | AR20: =RC[-29] -> 0 | AS20: - | AT20: =RC[-30] -> 0 | AU20: =RC[-30] -> 0 | AV20: =RC[-30] -> 0.747 | AW20: =RC[-30] -> 3.1636500777777794 | AY20: - | AZ20: - | BA20: -
A21: =IF(RC[1]="","",DATEVALUE(RC[1])) -> 43373 | B21: 30.09.18 | C21: 24 | D21: 112.21999999999998 | E21: 66.030000000000015 | F21: 7.4000000000000012 | G21: 100.99666666666667 | H21: 42.043333333333329 | I21: 5.5 | J21: 23.986666666666668 | K21: 11.223333333333334 | L21: 12.77 | M21: 68.87 | R21: 0.86299999999999999 | S21: =RC[1] -> 3.1636500777777794 | T21: =(RC[-16]*RC[-15]-RC[-13]*RC[-12])/1000 -> 3.1636500777777794 | U21: 12.53 | V21: - | W21: =RC[-2]*RC[-10]/1000 -> 0.86294110000000002 | X21: =ABS((RC[-3]*RC[-11]-RC[-2]*RC[-9])/1000) -> #VALUE! | Y21: =(RC[-14]-RC[1])/RC[-18]*100 -> -1.2937720716855323 | Z21: 12.53 | AC21: =VALUE(RC[-27]) -> 2018-09-30T00:00:00.000 | AD21: =IF(RC[21]=42,"*",IF(RC[21]=32,"",RC[21])) -> - | AE21: =RC[-28] -> 24 | AF21: =RC[-28] -> 112.21999999999998 | AG21: =RC[-28] -> 66.030000000000015 | AH21: =RC[-28] -> 7.4000000000000012 | AI21: =RC[-28] -> 100.99666666666667 | AJ21: =RC[-28] -> 42.043333333333329 | AK21: =RC[-28] -> 5.5 | AL21: =RC[-28] -> 23.986666666666668 | AM21: =RC[-28] -> 11.223333333333334 | AN21: =RC[-28] -> 12.77 | AO21: =RC[-28] -> 68.87 | AP21: - | AQ21: =RC[-29] -> 0 | AR21: =RC[-29] -> 0 | AS21: - | AT21: =RC[-30] -> 0 | AU21: =RC[-30] -> 0 | AV21: =RC[-30] -> 0.86299999999999999 | AW21: =RC[-30] -> 3.1636500777777794 | AY21: - | AZ21: - | BA21: -
A22: =IF(RC[1]="","",DATEVALUE(RC[1])) -> 43374 | B22: 01.10.18 | C22: 24 | D22: 112.21999999999998 | E22: 66.030000000000015 | F22: 7.4000000000000012 | G22: 100.99666666666667 | H22: 42.043333333333329 | I22: 5.5 | J22: 23.986666666666668 | K22: 11.223333333333334 | L22: 11.54 | M22: 67.150000000000006 | R22: 0.75800000000000001 | S22: =RC[1] -> 3.1636500777777794 | T22: =(RC[-16]*RC[-15]-RC[-13]*RC[-12])/1000 -> 3.1636500777777794 | U22: 11.31 | V22: - | W22: =RC[-2]*RC[-10]/1000 -> 0.75946650000000016 | X22: =ABS((RC[-3]*RC[-11]-RC[-2]*RC[-9])/1000) -> #VALUE! | Y22: =(RC[-14]-RC[1])/RC[-18]*100 -> -8.5811412917917426E-2 | Z22: 11.31 | AC22: =VALUE(RC[-27]) -> 2018-10-01T00:00:00.000 | AD22: =IF(RC[21]=42,"*",IF(RC[21]=32,"",RC[21])) -> - | AE22: =RC[-28] -> 24 | AF22: =RC[-28] -> 112.21999999999998 | AG22: =RC[-28] -> 66.030000000000015 | AH22: =RC[-28] -> 7.4000000000000012 | AI22: =RC[-28] -> 100.99666666666667 | AJ22: =RC[-28] -> 42.043333333333329 | AK22: =RC[-28] -> 5.5 | AL22: =RC[-28] -> 23.986666666666668 | AM22: =RC[-28] -> 11.223333333333334 | AN22: =RC[-28] -> 11.54 | AO22: =RC[-28] -> 67.150000000000006 | AP22: - | AQ22: =RC[-29] -> 0 | AR22: =RC[-29] -> 0 | AS22: - | AT22: =RC[-30] -> 0 | AU22: =RC[-30] -> 0 | AV22: =RC[-30] -> 0.75800000000000001 | AW22: =RC[-30] -> 3.1636500777777794 | AY22: - | AZ22: - | BA22: -
A23: =IF(RC[1]="","",DATEVALUE(RC[1])) -> 43375 | B23: 02.10.18 | C23: 24 | D23: 112.21999999999998 | E23: 66.030000000000015 | F23: 7.4000000000000012 | G23: 100.99666666666667 | H23: 42.043333333333329 | I23: 5.5 | J23: 23.986666666666668 | K23: 11.223333333333334 | L23: 11.47 | M23: 66.290000000000006 | R23: 0.746 | S23: =RC[1] -> 3.1636500777777794 | T23: =(RC[-16]*RC[-15]-RC[-13]*RC[-12])/1000 -> 3.1636500777777794 | U23: 11.24 | V23: - | W23: =RC[-2]*RC[-10]/1000 -> 0.74509960000000008 | X23: =ABS((RC[-3]*RC[-11]-RC[-2]*RC[-9])/1000) -> #VALUE! | Y23: =(RC[-14]-RC[1])/RC[-18]*100 -> -1.6502194791906385E-2 | Z23: 11.24 | AC23: =VALUE(RC[-27]) -> 2018-10-02T00:00:00.000 | AD23: =IF(RC[21]=42,"*",IF(RC[21]=32,"",RC[21])) -> - | AE23: =RC[-28] -> 24 | AF23: =RC[-28] -> 112.21999999999998 | AG23: =RC[-28] -> 66.030000000000015 | AH23: =RC[-28] -> 7.4000000000000012 | AI23: =RC[-28] -> 100.99666666666667 | AJ23: =RC[-28] -> 42.043333333333329 | AK23: =RC[-28] -> 5.5 | AL23: =RC[-28] -> 23.986666666666668 | AM23: =RC[-28] -> 11.223333333333334 | AN23: =RC[-28] -> 11.47 | AO23: =RC[-28] -> 66.290000000000006 | AP23: - | AQ23: =RC[-29] -> 0 | AR23: =RC[-29] -> 0 | AS23: - | AT23: =RC[-30] -> 0 | AU23: =RC[-30] -> 0 | AV23: =RC[-30] -> 0.746 | AW23: =RC[-30] -> 3.1636500777777794 | AY23: - | AZ23: - | BA23: -
A24: =IF(RC[1]="","",DATEVALUE(RC[1])) -> 43376 | B24: 03.10.18 | C24: 24 | D24: =AVERAGE(R[1]C:R[3]C) -> 112.21999999999998 | E24: =AVERAGE(R[1]C:R[3]C) -> 66.030000000000015 | F24: =AVERAGE(R[1]C:R[3]C) -> 7.4000000000000012 | G24: =AVERAGE(R[1]C:R[3]C) -> 100.99666666666667 | H24: =AVERAGE(R[1]C:R[3]C) -> 42.043333333333329 | I24: =AVERAGE(R[1]C:R[3]C) -> 5.5 | J24: =AVERAGE(R[1]C:R[3]C) -> 23.986666666666668 | K24: =AVERAGE(R[1]C:R[3]C) -> 11.223333333333334 | L24: 12.35 | M24: 66.23 | R24: 0.80100000000000005 | S24: =RC[1] -> 3.1636500777777794 | T24: =(RC[-16]*RC[-15]-RC[-13]*RC[-12])/1000 -> 3.1636500777777794 | U24: 12.12 | V24: - | W24: =RC[-2]*RC[-10]/1000 -> 0.80270759999999997 | X24: =ABS((RC[-3]*RC[-11]-RC[-2]*RC[-9])/1000) -> #VALUE! | Y24: =(RC[-14]-RC[1])/RC[-18]*100 -> -0.88781807980461203 | Z24: 12.12 | AC24: =VALUE(RC[-27]) -> 2018-10-03T00:00:00.000 | AD24: =IF(RC[21]=42,"*",IF(RC[21]=32,"",RC[21])) -> - | AE24: =RC[-28] -> 24 | AF24: =RC[-28] -> 112.21999999999998 | AG24: =RC[-28] -> 66.030000000000015 | AH24: =RC[-28] -> 7.4000000000000012 | AI24: =RC[-28] -> 100.99666666666667 | AJ24: =RC[-28] -> 42.043333333333329 | AK24: =RC[-28] -> 5.5 | AL24: =RC[-28] -> 23.986666666666668 | AM24: =RC[-28] -> 11.223333333333334 | AN24: =RC[-28] -> 12.35 | AO24: =RC[-28] -> 66.23 | AP24: - | AQ24: =RC[-29] -> 0 | AR24: =RC[-29] -> 0 | AS24: - | AT24: =RC[-30] -> 0 | AU24: =RC[-30] -> 0 | AV24: =RC[-30] -> 0.80100000000000005 | AW24: =RC[-30] -> 3.1636500777777794 | AY24: - | AZ24: - | BA24: -
A25: =IF(RC[1]="","",DATEVALUE(RC[1])) -> 43377 | B25: 04.10.18 | C25: 24 | D25: 114.42 | E25: 66.209999999999994 | F25: 7.4 | G25: 103.59 | H25: 42.51 | I25: 5.5 | J25: =RC[-5]-RC[-2] -> 23.699999999999996 | K25: 10.83 | L25: 12.46 | M25: 65.489999999999995 | R25: 0.8 | S25: 3.1739999999999999 | T25: =(RC[-16]*RC[-15]-RC[-13]*RC[-12])/1000 -> 3.1721372999999993 | U25: 12.23 | V25: - | W25: =RC[-2]*RC[-10]/1000 -> 0.8009426999999999 | X25: =ABS((RC[-3]*RC[-11]-RC[-2]*RC[-9])/1000) -> #VALUE! | Y25: =(RC[-14]-RC[1])/RC[-18]*100 -> -1.3514818032628635 | Z25: 12.23 | AC25: =VALUE(RC[-27]) -> 2018-10-04T00:00:00.000 | AD25: =IF(RC[21]=42,"*",IF(RC[21]=32,"",RC[21])) -> - | AE25: =RC[-28] -> 24 | AF25: =RC[-28] -> 114.42 | AG25: =RC[-28] -> 66.209999999999994 | AH25: =RC[-28] -> 7.4 | AI25: =RC[-28] -> 103.59 | AJ25: =RC[-28] -> 42.51 | AK25: =RC[-28] -> 5.5 | AL25: =RC[-28] -> 23.699999999999996 | AM25: =RC[-28] -> 10.83 | AN25: =RC[-28] -> 12.46 | AO25: =RC[-28] -> 65.489999999999995 | AP25: - | AQ25: =RC[-29] -> 0 | AR25: =RC[-29] -> 0 | AS25: - | AT25: =RC[-30] -> 0 | AU25: =RC[-30] -> 0 | AV25: =RC[-30] -> 0.8 | AW25: =RC[-30] -> 3.1739999999999999 | AY25: - | AZ25: - | BA25: -
A26: =IF(RC[1]="","",DATEVALUE(RC[1])) -> 43378 | B26: 05.10.18 | C26: 24 | D26: 112.96 | E26: 65.59 | F26: 7.4 | G26: 101.65 | H26: 41.76 | I26: 5.5 | J26: =RC[-5]-RC[-2] -> 23.830000000000005 | K26: 11.31 | L26: 13.16 | M26: 64.8 | R26: 0.83799999999999997 | S26: 3.1640000000000001 | T26: =(RC[-16]*RC[-15]-RC[-13]*RC[-12])/1000 -> 3.1641423999999998 | U26: 12.92 | V26: - | W26: =RC[-2]*RC[-10]/1000 -> 0.83721599999999996 | X26: =ABS((RC[-3]*RC[-11]-RC[-2]*RC[-9])/1000) -> #VALUE! | Y26: =(RC[-14]-RC[1])/RC[-18]*100 -> -1.5838662075750118 | Z26: 12.92 | AC26: =VALUE(RC[-27]) -> 2018-10-05T00:00:00.000 | AD26: =IF(RC[21]=42,"*",IF(RC[21]=32,"",RC[21])) -> - | AE26: =RC[-28] -> 24 | AF26: =RC[-28] -> 112.96 | AG26: =RC[-28] -> 65.59 | AH26: =RC[-28] -> 7.4 | AI26: =RC[-28] -> 101.65 | AJ26: =RC[-28] -> 41.76 | AK26: =RC[-28] -> 5.5 | AL26: =RC[-28] -> 23.830000000000005 | AM26: =RC[-28] -> 11.31 | AN26: =RC[-28] -> 13.16 | AO26: =RC[-28] -> 64.8 | AP26: - | AQ26: =RC[-29] -> 0 | AR26: =RC[-29] -> 0 | AS26: - | AT26: =RC[-30] -> 0 | AU26: =RC[-30] -> 0 | AV26: =RC[-30] -> 0.83799999999999997 | AW26: =RC[-30] -> 3.1640000000000001 | AY26: - | AZ26: - | BA26: -
A27: =IF(RC[1]="","",DATEVALUE(RC[1])) -> 43379 | B27: 06.10.18 | C27: 24 | D27: 109.28 | E27: 66.290000000000006 | F27: 7.4 | G27: 97.75 | H27: 41.86 | I27: 5.5 | J27: =RC[-5]-RC[-2] -> 24.430000000000007 | K27: 11.53 | L27: 13.06 | M27: 65.739999999999995 | R27: 0.84199999999999997 | S27: 3.153 | T27: =(RC[-16]*RC[-15]-RC[-13]*RC[-12])/1000 -> 3.1523562000000007 | U27: 12.81 | V27: - | W27: =RC[-2]*RC[-10]/1000 -> 0.84212939999999992 | X27: =ABS((RC[-3]*RC[-11]-RC[-2]*RC[-9])/1000) -> #VALUE! | Y27: =(RC[-14]-RC[1])/RC[-18]*100 -> -1.309462915601024 | Z27: 12.81 | AC27: =VALUE(RC[-27]) -> 2018-10-06T00:00:00.000 | AD27: =IF(RC[21]=42,"*",IF(RC[21]=32,"",RC[21])) -> - | AE27: =RC[-28] -> 24 | AF27: =RC[-28] -> 109.28 | AG27: =RC[-28] -> 66.290000000000006 | AH27: =RC[-28] -> 7.4 | AI27: =RC[-28] -> 97.75 | AJ27: =RC[-28] -> 41.86 | AK27: =RC[-28] -> 5.5 | AL27: =RC[-28] -> 24.430000000000007 | AM27: =RC[-28] -> 11.53 | AN27: =RC[-28] -> 13.06 | AO27: =RC[-28] -> 65.739999999999995 | AP27: - | AQ27: =RC[-29] -> 0 | AR27: =RC[-29] -> 0 | AS27: - | AT27: =RC[-30] -> 0 | AU27: =RC[-30] -> 0 | AV27: =RC[-30] -> 0.84199999999999997 | AW27: =RC[-30] -> 3.153 | AY27: - | AZ27: - | BA27: -
A28: =IF(RC[1]="","",DATEVALUE(RC[1])) -> 43380 | B28: 07.10.18 | C28: 24 | D28: 110.22 | E28: 66.55 | F28: 7.4 | G28: 98.15 | H28: 42.01 | I28: 5.5 | J28: =RC[-5]-RC[-2] -> 24.54 | K28: 12.07 | L28: 13.63 | M28: 66 | R28: 0.88100000000000001 | S28: 3.2130000000000001 | T28: =(RC[-16]*RC[-15]-RC[-13]*RC[-12])/1000 -> 3.2118594999999996 | U28: 13.39 | V28: - | W28: =RC[-2]*RC[-10]/1000 -> 0.88373999999999997 | X28: =ABS((RC[-3]*RC[-11]-RC[-2]*RC[-9])/1000) -> #VALUE! | Y28: =(RC[-14]-RC[1])/RC[-18]*100 -> -1.3448802852776365 | Z28: 13.39 | AC28: =VALUE(RC[-27]) -> 2018-10-07T00:00:00.000 | AD28: =IF(RC[21]=42,"*",IF(RC[21]=32,"",RC[21])) -> - | AE28: =RC[-28] -> 24 | AF28: =RC[-28] -> 110.22 | AG28: =RC[-28] -> 66.55 | AH28: =RC[-28] -> 7.4 | AI28: =RC[-28] -> 98.15 | AJ28: =RC[-28] -> 42.01 | AK28: =RC[-28] -> 5.5 | AL28: =RC[-28] -> 24.54 | AM28: =RC[-28] -> 12.07 | AN28: =RC[-28] -> 13.63 | AO28: =RC[-28] -> 66 | AP28: - | AQ28: =RC[-29] -> 0 | AR28: =RC[-29] -> 0 | AS28: - | AT28: =RC[-30] -> 0 | AU28: =RC[-30] -> 0 | AV28: =RC[-30] -> 0.88100000000000001 | AW28: =RC[-30] -> 3.2130000000000001 | AY28: - | AZ28: - | BA28: -
A29: =IF(RC[1]="","",DATEVALUE(RC[1])) -> 43381 | B29: 08.10.18 | C29: 24 | D29: 124.24 | E29: 66.569999999999993 | F29: 7.4 | G29: 110.29 | H29: 42.84 | I29: 5.5 | J29: =RC[-5]-RC[-2] -> 23.72999999999999 | K29: 13.95 | L29: 15.37 | M29: 65.989999999999995 | R29: 0.99399999999999999 | S29: 3.5489999999999999 | T29: =(RC[-16]*RC[-15]-RC[-13]*RC[-12])/1000 -> 3.5458331999999984 | U29: 15.06 | V29: - | W29: =RC[-2]*RC[-10]/1000 -> 0.99380939999999995 | X29: =ABS((RC[-3]*RC[-11]-RC[-2]*RC[-9])/1000) -> #VALUE! | Y29: =(RC[-14]-RC[1])/RC[-18]*100 -> -1.006437573669418 | Z29: 15.06 | AC29: =VALUE(RC[-27]) -> 2018-10-08T00:00:00.000 | AD29: =IF(RC[21]=42,"*",IF(RC[21]=32,"",RC[21])) -> - | AE29: =RC[-28] -> 24 | AF29: =RC[-28] -> 124.24 | AG29: =RC[-28] -> 66.569999999999993 | AH29: =RC[-28] -> 7.4 | AI29: =RC[-28] -> 110.29 | AJ29: =RC[-28] -> 42.84 | AK29: =RC[-28] -> 5.5 | AL29: =RC[-28] -> 23.72999999999999 | AM29: =RC[-28] -> 13.95 | AN29: =RC[-28] -> 15.37 | AO29: =RC[-28] -> 65.989999999999995 | AP29: - | AQ29: =RC[-29] -> 0 | AR29: =RC[-29] -> 0 | AS29: - | AT29: =RC[-30] -> 0 | AU29: =RC[-30] -> 0 | AV29: =RC[-30] -> 0.99399999999999999 | AW29: =RC[-30] -> 3.5489999999999999 | AY29: - | AZ29: - | BA29: -
A30: =IF(RC[1]="","",DATEVALUE(RC[1])) -> 43382 | B30: 09.10.18 | C30: 24 | D30: 123.75 | E30: 66.5 | F30: 7.4 | G30: 112.85 | H30: 43.22 | I30: 5.5 | J30: =RC[-5]-RC[-2] -> 23.28 | K30: 10.9 | L30: 12.06 | M30: 65.930000000000007 | R30: 0.78100000000000003 | S30: 3.3530000000000002 | T30: =(RC[-16]*RC[-15]-RC[-13]*RC[-12])/1000 -> 3.3519980000000005 | U30: 11.84 | V30: - | W30: =RC[-2]*RC[-10]/1000 -> 0.78061120000000006 | X30: =ABS((RC[-3]*RC[-11]-RC[-2]*RC[-9])/1000) -> #VALUE! | Y30: =(RC[-14]-RC[1])/RC[-18]*100 -> -0.83296411165263584 | Z30: 11.84 | AC30: =VALUE(RC[-27]) -> 2018-10-09T00:00:00.000 | AD30: =IF(RC[21]=42,"*",IF(RC[21]=32,"",RC[21])) -> - | AE30: =RC[-28] -> 24 | AF30: =RC[-28] -> 123.75 | AG30: =RC[-28] -> 66.5 | AH30: =RC[-28] -> 7.4 | AI30: =RC[-28] -> 112.85 | AJ30: =RC[-28] -> 43.22 | AK30: =RC[-28] -> 5.5 | AL30: =RC[-28] -> 23.28 | AM30: =RC[-28] -> 10.9 | AN30: =RC[-28] -> 12.06 | AO30: =RC[-28] -> 65.930000000000007 | AP30: - | AQ30: =RC[-29] -> 0 | AR30: =RC[-29] -> 0 | AS30: - | AT30: =RC[-30] -> 0 | AU30: =RC[-30] -> 0 | AV30: =RC[-30] -> 0.78100000000000003 | AW30: =RC[-30] -> 3.3530000000000002 | AY30: - | AZ30: - | BA30: -
A31: =IF(RC[1]="","",DATEVALUE(RC[1])) -> 43383 | B31: 10.10.18 | C31: 24 | D31: 119.03 | E31: 67.540000000000006 | F31: 7.4 | G31: 107.92 | H31: 43.42 | I31: 5.5 | J31: =RC[-5]-RC[-2] -> 24.120000000000005 | K31: 11.11 | L31: 12.18 | M31: 67.08 | R31: 0.8 | S31: 3.3570000000000002 | T31: =(RC[-16]*RC[-15]-RC[-13]*RC[-12])/1000 -> 3.3533998 | U31: 11.94 | V31: - | W31: =RC[-2]*RC[-10]/1000 -> 0.80093519999999985 | X31: =ABS((RC[-3]*RC[-11]-RC[-2]*RC[-9])/1000) -> #VALUE! | Y31: =(RC[-14]-RC[1])/RC[-18]*100 -> -0.76908821349147527 | Z31: 11.94 | AC31: =VALUE(RC[-27]) -> 2018-10-10T00:00:00.000 | AD31: =IF(RC[21]=42,"*",IF(RC[21]=32,"",RC[21])) -> - | AE31: =RC[-28] -> 24 | AF31: =RC[-28] -> 119.03 | AG31: =RC[-28] -> 67.540000000000006 | AH31: =RC[-28] -> 7.4 | AI31: =RC[-28] -> 107.92 | AJ31: =RC[-28] -> 43.42 | AK31: =RC[-28] -> 5.5 | AL31: =RC[-28] -> 24.120000000000005 | AM31: =RC[-28] -> 11.11 | AN31: =RC[-28] -> 12.18 | AO31: =RC[-28] -> 67.08 | AP31: - | AQ31: =RC[-29] -> 0 | AR31: =RC[-29] -> 0 | AS31: - | AT31: =RC[-30] -> 0 | AU31: =RC[-30] -> 0 | AV31: =RC[-30] -> 0.8 | AW31: =RC[-30] -> 3.3570000000000002 | AY31: - | AZ31: - | BA31: -
A32: =IF(RC[1]="","",DATEVALUE(RC[1])) -> 43384 | B32: 11.10.18 | C32: 24 | D32: 120.03 | E32: 68.69 | F32: 7.4 | G32: 108.95 | H32: 44.02 | I32: 5.5 | J32: =RC[-5]-RC[-2] -> 24.669999999999995 | K32: 11.08 | L32: 12.16 | M32: 67.73 | R32: 0.80600000000000005 | S32: 3.4510000000000001 | T32: =(RC[-16]*RC[-15]-RC[-13]*RC[-12])/1000 -> 3.4488816999999989 | U32: 11.91 | V32: - | W32: =RC[-2]*RC[-10]/1000 -> 0.8066643 | X32: =ABS((RC[-3]*RC[-11]-RC[-2]*RC[-9])/1000) -> #VALUE! | Y32: =(RC[-14]-RC[1])/RC[-18]*100 -> -0.76181734740706752 | Z32: 11.91 | AC32: =VALUE(RC[-27]) -> 2018-10-11T00:00:00.000 | AD32: =IF(RC[21]=42,"*",IF(RC[21]=32,"",RC[21])) -> - | AE32: =RC[-28] -> 24 | AF32: =RC[-28] -> 120.03 | AG32: =RC[-28] -> 68.69 | AH32: =RC[-28] -> 7.4 | AI32: =RC[-28] -> 108.95 | AJ32: =RC[-28] -> 44.02 | AK32: =RC[-28] -> 5.5 | AL32: =RC[-28] -> 24.669999999999995 | AM32: =RC[-28] -> 11.08 | AN32: =RC[-28] -> 12.16 | AO32: =RC[-28] -> 67.73 | AP32: - | AQ32: =RC[-29] -> 0 | AR32: =RC[-29] -> 0 | AS32: - | AT32: =RC[-30] -> 0 | AU32: =RC[-30] -> 0 | AV32: =RC[-30] -> 0.80600000000000005 | AW32: =RC[-30] -> 3.4510000000000001 | AY32: - | AZ32: - | BA32: -
A33: =IF(RC[1]="","",DATEVALUE(RC[1])) -> 43385 | B33: 12.10.18 | C33: 24 | D33: 119.73 | E33: 68.540000000000006 | F33: 7.4 | G33: 108.46 | H33: 43.79 | I33: 5.5 | J33: =RC[-5]-RC[-2] -> 24.750000000000007 | K33: 11.27 | L33: 12.6 | M33: 68.03 | R33: 0.83799999999999997 | S33: 3.4569999999999999 | T33: =(RC[-16]*RC[-15]-RC[-13]*RC[-12])/1000 -> 3.4568308000000005 | U33: 12.35 | V33: - | W33: =RC[-2]*RC[-10]/1000 -> 0.84017049999999993 | X33: =ABS((RC[-3]*RC[-11]-RC[-2]*RC[-9])/1000) -> #VALUE! | Y33: =(RC[-14]-RC[1])/RC[-18]*100 -> -0.99575880508943404 | Z33: 12.35 | AC33: =VALUE(RC[-27]) -> 2018-10-12T00:00:00.000 | AD33: =IF(RC[21]=42,"*",IF(RC[21]=32,"",RC[21])) -> - | AE33: =RC[-28] -> 24 | AF33: =RC[-28] -> 119.73 | AG33: =RC[-28] -> 68.540000000000006 | AH33: =RC[-28] -> 7.4 | AI33: =RC[-28] -> 108.46 | AJ33: =RC[-28] -> 43.79 | AK33: =RC[-28] -> 5.5 | AL33: =RC[-28] -> 24.750000000000007 | AM33: =RC[-28] -> 11.27 | AN33: =RC[-28] -> 12.6 | AO33: =RC[-28] -> 68.03 | AP33: - | AQ33: =RC[-29] -> 0 | AR33: =RC[-29] -> 0 | AS33: - | AT33: =RC[-30] -> 0 | AU33: =RC[-30] -> 0 | AV33: =RC[-30] -> 0.83799999999999997 | AW33: =RC[-30] -> 3.4569999999999999 | AY33: - | AZ33: - | BA33: -
A34: =IF(RC[1]="","",DATEVALUE(RC[1])) -> 43386 | B34: 13.10.18 | C34: 24 | D34: 118.71 | E34: 69.64 | F34: 7.4 | G34: 108.1 | H34: 44.64 | I34: 5.5 | J34: =RC[-5]-RC[-2] -> 25 | K34: 10.61 | L34: 11.95 | M34: 68.849999999999994 | R34: 0.80500000000000005 | S34: 3.4430000000000001 | T34: =(RC[-16]*RC[-15]-RC[-13]*RC[-12])/1000 -> 3.441380399999999 | U34: 11.71 | V34: - | W34: =RC[-2]*RC[-10]/1000 -> 0.80623349999999994 | X34: =ABS((RC[-3]*RC[-11]-RC[-2]*RC[-9])/1000) -> #VALUE! | Y34: =(RC[-14]-RC[1])/RC[-18]*100 -> -1.0175763182238682 | Z34: 11.71 | AC34: =VALUE(RC[-27]) -> 2018-10-13T00:00:00.000 | AD34: =IF(RC[21]=42,"*",IF(RC[21]=32,"",RC[21])) -> - | AE34: =RC[-28] -> 24 | AF34: =RC[-28] -> 118.71 | AG34: =RC[-28] -> 69.64 | AH34: =RC[-28] -> 7.4 | AI34: =RC[-28] -> 108.1 | AJ34: =RC[-28] -> 44.64 | AK34: =RC[-28] -> 5.5 | AL34: =RC[-28] -> 25 | AM34: =RC[-28] -> 10.61 | AN34: =RC[-28] -> 11.95 | AO34: =RC[-28] -> 68.849999999999994 | AP34: - | AQ34: =RC[-29] -> 0 | AR34: =RC[-29] -> 0 | AS34: - | AT34: =RC[-30] -> 0 | AU34: =RC[-30] -> 0 | AV34: =RC[-30] -> 0.80500000000000005 | AW34: =RC[-30] -> 3.4430000000000001 | AY34: - | AZ34: - | BA34: -
A35: =IF(RC[1]="","",DATEVALUE(RC[1])) -> 43387 | B35: 14.10.18 | C35: 24 | D35: 119.81 | E35: 70.42 | F35: 7.4 | G35: 108.4 | H35: 45.42 | I35: 5.5 | J35: =RC[-5]-RC[-2] -> 25 | K35: 11.41 | L35: 12.75 | M35: 69.91 | R35: 0.872 | S35: 3.516 | T35: =(RC[-16]*RC[-15]-RC[-13]*RC[-12])/1000 -> 3.5134922000000004 | U35: 12.48 | V35: - | W35: =RC[-2]*RC[-10]/1000 -> 0.87247680000000005 | X35: =ABS((RC[-3]*RC[-11]-RC[-2]*RC[-9])/1000) -> #VALUE! | Y35: =(RC[-14]-RC[1])/RC[-18]*100 -> -0.98708487084870866 | Z35: 12.48 | AC35: =VALUE(RC[-27]) -> 2018-10-14T00:00:00.000 | AD35: =IF(RC[21]=42,"*",IF(RC[21]=32,"",RC[21])) -> - | AE35: =RC[-28] -> 24 | AF35: =RC[-28] -> 119.81 | AG35: =RC[-28] -> 70.42 | AH35: =RC[-28] -> 7.4 | AI35: =RC[-28] -> 108.4 | AJ35: =RC[-28] -> 45.42 | AK35: =RC[-28] -> 5.5 | AL35: =RC[-28] -> 25 | AM35: =RC[-28] -> 11.41 | AN35: =RC[-28] -> 12.75 | AO35: =RC[-28] -> 69.91 | AP35: - | AQ35: =RC[-29] -> 0 | AR35: =RC[-29] -> 0 | AS35: - | AT35: =RC[-30] -> 0 | AU35: =RC[-30] -> 0 | AV35: =RC[-30] -> 0.872 | AW35: =RC[-30] -> 3.516 | AY35: - | AZ35: - | BA35: -
A36: =IF(RC[1]="","",DATEVALUE(RC[1])) -> 43388 | B36: 15.10.18 | C36: 24 | D36: 120.31 | E36: 69.89 | F36: 7.4 | G36: 109.34 | H36: 45.75 | I36: 5.5 | J36: =RC[-5]-RC[-2] -> 24.14 | K36: 10.97 | L36: 12.26 | M36: 69.319999999999993 | R36: 0.83199999999999996 | S36: 3.4089999999999998 | T36: =(RC[-16]*RC[-15]-RC[-13]*RC[-12])/1000 -> 3.4061609000000006 | U36: 12.01 | V36: - | W36: =RC[-2]*RC[-10]/1000 -> 0.83253319999999986 | X36: =ABS((RC[-3]*RC[-11]-RC[-2]*RC[-9])/1000) -> #VALUE! | Y36: =(RC[-14]-RC[1])/RC[-18]*100 -> -0.95116151454179543 | Z36: 12.01 | AC36: =VALUE(RC[-27]) -> 2018-10-15T00:00:00.000 | AD36: =IF(RC[21]=42,"*",IF(RC[21]=32,"",RC[21])) -> - | AE36: =RC[-28] -> 24 | AF36: =RC[-28] -> 120.31 | AG36: =RC[-28] -> 69.89 | AH36: =RC[-28] -> 7.4 | AI36: =RC[-28] -> 109.34 | AJ36: =RC[-28] -> 45.75 | AK36: =RC[-28] -> 5.5 | AL36: =RC[-28] -> 24.14 | AM36: =RC[-28] -> 10.97 | AN36: =RC[-28] -> 12.26 | AO36: =RC[-28] -> 69.319999999999993 | AP36: - | AQ36: =RC[-29] -> 0 | AR36: =RC[-29] -> 0 | AS36: - | AT36: =RC[-30] -> 0 | AU36: =RC[-30] -> 0 | AV36: =RC[-30] -> 0.83199999999999996 | AW36: =RC[-30] -> 3.4089999999999998 | AY36: - | AZ36: - | BA36: -
A37: =IF(RC[1]="","",DATEVALUE(RC[1])) -> 43389 | B37: 16.10.18 | C37: 24 | D37: 119.2 | E37: 69.900000000000006 | F37: 7.4 | G37: 109.57 | H37: 45.93 | I37: 5.5 | J37: =RC[-5]-RC[-2] -> 23.970000000000006 | K37: 9.6300000000000008 | L37: 10.85 | M37: 69.31 | R37: 0.73199999999999998 | S37: 3.302 | T37: =(RC[-16]*RC[-15]-RC[-13]*RC[-12])/1000 -> 3.2995299000000022 | U37: 10.61 | V37: - | W37: =RC[-2]*RC[-10]/1000 -> 0.73537909999999995 | X37: =ABS((RC[-3]*RC[-11]-RC[-2]*RC[-9])/1000) -> #VALUE! | Y37: =(RC[-14]-RC[1])/RC[-18]*100 -> -0.89440540293875948 | Z37: 10.61 | AC37: =VALUE(RC[-27]) -> 2018-10-16T00:00:00.000 | AD37: =IF(RC[21]=42,"*",IF(RC[21]=32,"",RC[21])) -> - | AE37: =RC[-28] -> 24 | AF37: =RC[-28] -> 119.2 | AG37: =RC[-28] -> 69.900000000000006 | AH37: =RC[-28] -> 7.4 | AI37: =RC[-28] -> 109.57 | AJ37: =RC[-28] -> 45.93 | AK37: =RC[-28] -> 5.5 | AL37: =RC[-28] -> 23.970000000000006 | AM37: =RC[-28] -> 9.6300000000000008 | AN37: =RC[-28] -> 10.85 | AO37: =RC[-28] -> 69.31 | AP37: - | AQ37: =RC[-29] -> 0 | AR37: =RC[-29] -> 0 | AS37: - | AT37: =RC[-30] -> 0 | AU37: =RC[-30] -> 0 | AV37: =RC[-30] -> 0.73199999999999998 | AW37: =RC[-30] -> 3.302 | AY37: - | AZ37: - | BA37: -
A38: =IF(RC[1]="","",DATEVALUE(RC[1])) -> 43390 | B38: 17.10.18 | C38: 24 | D38: 97.53 | E38: 70 | F38: 7.4 | G38: 87.07 | H38: 43.4 | I38: 5.5 | J38: =RC[-5]-RC[-2] -> 26.6 | K38: 10.46 | L38: 11.42 | M38: 69.52 | R38: 0.77600000000000002 | S38: 3.05 | T38: =(RC[-16]*RC[-15]-RC[-13]*RC[-12])/1000 -> 3.0482620000000007 | U38: 11.17 | V38: - | W38: =RC[-2]*RC[-10]/1000 -> 0.77653839999999996 | X38: =ABS((RC[-3]*RC[-11]-RC[-2]*RC[-9])/1000) -> #VALUE! | Y38: =(RC[-14]-RC[1])/RC[-18]*100 -> -0.81543585620764791 | Z38: 11.17 | AC38: =VALUE(RC[-27]) -> 2018-10-17T00:00:00.000 | AD38: =IF(RC[21]=42,"*",IF(RC[21]=32,"",RC[21])) -> - | AE38: =RC[-28] -> 24 | AF38: =RC[-28] -> 97.53 | AG38: =RC[-28] -> 70 | AH38: =RC[-28] -> 7.4 | AI38: =RC[-28] -> 87.07 | AJ38: =RC[-28] -> 43.4 | AK38: =RC[-28] -> 5.5 | AL38: =RC[-28] -> 26.6 | AM38: =RC[-28] -> 10.46 | AN38: =RC[-28] -> 11.42 | AO38: =RC[-28] -> 69.52 | AP38: - | AQ38: =RC[-29] -> 0 | AR38: =RC[-29] -> 0 | AS38: - | AT38: =RC[-30] -> 0 | AU38: =RC[-30] -> 0 | AV38: =RC[-30] -> 0.77600000000000002 | AW38: =RC[-30] -> 3.05 | AY38: - | AZ38: - | BA38: -
A39: =IF(RC[1]="","",DATEVALUE(RC[1])) -> 43391 | B39: 18.10.18 | C39: 24 | D39: 76.010000000000005 | E39: 70.5 | F39: 7.4 | G39: 64.739999999999995 | H39: 38.96 | I39: 5.5 | J39: =RC[-5]-RC[-2] -> 31.54 | K39: 11.27 | L39: 12.19 | M39: 69.989999999999995 | R39: 0.83499999999999996 | S39: 2.8370000000000002 | T39: =(RC[-16]*RC[-15]-RC[-13]*RC[-12])/1000 -> 2.8364346 | U39: 11.94 | V39: - | W39: =RC[-2]*RC[-10]/1000 -> 0.83568059999999988 | X39: =ABS((RC[-3]*RC[-11]-RC[-2]*RC[-9])/1000) -> #VALUE! | Y39: =(RC[-14]-RC[1])/RC[-18]*100 -> -1.0349088662341674 | Z39: 11.94 | AC39: =VALUE(RC[-27]) -> 2018-10-18T00:00:00.000 | AD39: =IF(RC[21]=42,"*",IF(RC[21]=32,"",RC[21])) -> - | AE39: =RC[-28] -> 24 | AF39: =RC[-28] -> 76.010000000000005 | AG39: =RC[-28] -> 70.5 | AH39: =RC[-28] -> 7.4 | AI39: =RC[-28] -> 64.739999999999995 | AJ39: =RC[-28] -> 38.96 | AK39: =RC[-28] -> 5.5 | AL39: =RC[-28] -> 31.54 | AM39: =RC[-28] -> 11.27 | AN39: =RC[-28] -> 12.19 | AO39: =RC[-28] -> 69.989999999999995 | AP39: - | AQ39: =RC[-29] -> 0 | AR39: =RC[-29] -> 0 | AS39: - | AT39: =RC[-30] -> 0 | AU39: =RC[-30] -> 0 | AV39: =RC[-30] -> 0.83499999999999996 | AW39: =RC[-30] -> 2.8370000000000002 | AY39: - | AZ39: - | BA39: -
A40: =IF(RC[1]="","",DATEVALUE(RC[1])) -> 43392 | B40: 19.10.18 | C40: 24 | D40: 75.39 | E40: 70.28 | F40: 7.4 | G40: 64.319999999999993 | H40: 38.130000000000003 | I40: 5.5 | J40: =RC[-5]-RC[-2] -> 32.15 | K40: 11.07 | L40: 11.84 | M40: 69.52 | R40: 0.80700000000000005 | S40: 2.8450000000000002 | T40: =(RC[-16]*RC[-15]-RC[-13]*RC[-12])/1000 -> 2.8458876000000002 | U40: 11.61 | V40: - | W40: =RC[-2]*RC[-10]/1000 -> 0.80712719999999993 | X40: =ABS((RC[-3]*RC[-11]-RC[-2]*RC[-9])/1000) -> #VALUE! | Y40: =(RC[-14]-RC[1])/RC[-18]*100 -> -0.83955223880596896 | Z40: 11.61 | AC40: =VALUE(RC[-27]) -> 2018-10-19T00:00:00.000 | AD40: =IF(RC[21]=42,"*",IF(RC[21]=32,"",RC[21])) -> - | AE40: =RC[-28] -> 24 | AF40: =RC[-28] -> 75.39 | AG40: =RC[-28] -> 70.28 | AH40: =RC[-28] -> 7.4 | AI40: =RC[-28] -> 64.319999999999993 | AJ40: =RC[-28] -> 38.130000000000003 | AK40: =RC[-28] -> 5.5 | AL40: =RC[-28] -> 32.15 | AM40: =RC[-28] -> 11.07 | AN40: =RC[-28] -> 11.84 | AO40: =RC[-28] -> 69.52 | AP40: - | AQ40: =RC[-29] -> 0 | AR40: =RC[-29] -> 0 | AS40: - | AT40: =RC[-30] -> 0 | AU40: =RC[-30] -> 0 | AV40: =RC[-30] -> 0.80700000000000005 | AW40: =RC[-30] -> 2.8450000000000002 | AY40: - | AZ40: - | BA40: -
A41: =IF(RC[1]="","",DATEVALUE(RC[1])) -> 43393 | B41: 20.10.18 | C41: 24 | D41: =AVERAGE(R[-3]C:R[-1]C) -> 82.976666666666674 | E41: =AVERAGE(R[-3]C:R[-1]C) -> 70.260000000000005 | F41: =AVERAGE(R[-3]C:R[-1]C) -> 7.4000000000000012 | G41: =AVERAGE(R[-3]C:R[-1]C) -> 72.043333333333337 | H41: =AVERAGE(R[-3]C:R[-1]C) -> 40.163333333333334 | I41: =AVERAGE(R[-3]C:R[-1]C) -> 5.5 | J41: =AVERAGE(R[-3]C:R[-1]C) -> 30.096666666666664 | K41: =AVERAGE(R[-3]C:R[-1]C) -> 10.933333333333332 | L41: 11.14 | M41: 68.88 | R41: 0.752 | S41: =RC[1] -> 2.9364401888888896 | T41: =(RC[-16]*RC[-15]-RC[-13]*RC[-12])/1000 -> 2.9364401888888896 | U41: 10.91 | V41: - | W41: =RC[-2]*RC[-10]/1000 -> 0.75148079999999995 | X41: =ABS((RC[-3]*RC[-11]-RC[-2]*RC[-9])/1000) -> #VALUE! | Y41: =(RC[-14]-RC[1])/RC[-18]*100 -> 3.2387914680976702E-2 | Z41: 10.91 | AC41: =VALUE(RC[-27]) -> 2018-10-20T00:00:00.000 | AD41: =IF(RC[21]=42,"*",IF(RC[21]=32,"",RC[21])) -> - | AE41: =RC[-28] -> 24 | AF41: =RC[-28] -> 82.976666666666674 | AG41: =RC[-28] -> 70.260000000000005 | AH41: =RC[-28] -> 7.4000000000000012 | AI41: =RC[-28] -> 72.043333333333337 | AJ41: =RC[-28] -> 40.163333333333334 | AK41: =RC[-28] -> 5.5 | AL41: =RC[-28] -> 30.096666666666664 | AM41: =RC[-28] -> 10.933333333333332 | AN41: =RC[-28] -> 11.14 | AO41: =RC[-28] -> 68.88 | AP41: - | AQ41: =RC[-29] -> 0 | AR41: =RC[-29] -> 0 | AS41: - | AT41: =RC[-30] -> 0 | AU41: =RC[-30] -> 0 | AV41: =RC[-30] -> 0.752 | AW41: =RC[-30] -> 2.9364401888888896 | AY41: - | AZ41: - | BA41: -
A42: =IF(RC[1]="","",DATEVALUE(RC[1])) -> 43394 | B42: 21.10.18 | C42: 24 | D42: 82.976666666666674 | E42: 70.260000000000005 | F42: 7.4000000000000012 | G42: 72.043333333333337 | H42: 40.163333333333334 | I42: 5.5 | J42: 30.096666666666664 | K42: 10.933333333333332 | L42: 13.49 | M42: 67.73 | R42: 0.89400000000000002 | S42: =RC[1] -> 2.9364401888888896 | T42: =(RC[-16]*RC[-15]-RC[-13]*RC[-12])/1000 -> 2.9364401888888896 | U42: 13.22 | V42: - | W42: =RC[-2]*RC[-10]/1000 -> 0.89539060000000004 | X42: =ABS((RC[-3]*RC[-11]-RC[-2]*RC[-9])/1000) -> #VALUE! | Y42: =(RC[-14]-RC[1])/RC[-18]*100 -> -3.1740156387359488 | Z42: 13.22 | AC42: =VALUE(RC[-27]) -> 2018-10-21T00:00:00.000 | AD42: =IF(RC[21]=42,"*",IF(RC[21]=32,"",RC[21])) -> - | AE42: =RC[-28] -> 24 | AF42: =RC[-28] -> 82.976666666666674 | AG42: =RC[-28] -> 70.260000000000005 | AH42: =RC[-28] -> 7.4000000000000012 | AI42: =RC[-28] -> 72.043333333333337 | AJ42: =RC[-28] -> 40.163333333333334 | AK42: =RC[-28] -> 5.5 | AL42: =RC[-28] -> 30.096666666666664 | AM42: =RC[-28] -> 10.933333333333332 | AN42: =RC[-28] -> 13.49 | AO42: =RC[-28] -> 67.73 | AP42: - | AQ42: =RC[-29] -> 0 | AR42: =RC[-29] -> 0 | AS42: - | AT42: =RC[-30] -> 0 | AU42: =RC[-30] -> 0 | AV42: =RC[-30] -> 0.89400000000000002 | AW42: =RC[-30] -> 2.9364401888888896 | AY42: - | AZ42: - | BA42: -
A43: =IF(RC[1]="","",DATEVALUE(RC[1])) -> 43395 | B43: 22.10.18 | C43: 24 | D43: 76.22 | E43: 69.25 | F43: 7.4 | G43: 64.69 | H43: 37.020000000000003 | I43: 5.5 | J43: =RC[-5]-RC[-2] -> 32.229999999999997 | K43: 11.53 | L43: 12.23 | M43: 68.760000000000005 | R43: 0.82399999999999995 | S43: 2.883 | T43: =(RC[-16]*RC[-15]-RC[-13]*RC[-12])/1000 -> 2.8834111999999994 | U43: 11.97 | V43: - | W43: =RC[-2]*RC[-10]/1000 -> 0.82305720000000004 | X43: =ABS((RC[-3]*RC[-11]-RC[-2]*RC[-9])/1000) -> #VALUE! | Y43: =(RC[-14]-RC[1])/RC[-18]*100 -> -0.68016695006956451 | Z43: 11.97 | AC43: =VALUE(RC[-27]) -> 2018-10-22T00:00:00.000 | AD43: =IF(RC[21]=42,"*",IF(RC[21]=32,"",RC[21])) -> - | AE43: =RC[-28] -> 24 | AF43: =RC[-28] -> 76.22 | AG43: =RC[-28] -> 69.25 | AH43: =RC[-28] -> 7.4 | AI43: =RC[-28] -> 64.69 | AJ43: =RC[-28] -> 37.020000000000003 | AK43: =RC[-28] -> 5.5 | AL43: =RC[-28] -> 32.229999999999997 | AM43: =RC[-28] -> 11.53 | AN43: =RC[-28] -> 12.23 | AO43: =RC[-28] -> 68.760000000000005 | AP43: - | AQ43: =RC[-29] -> 0 | AR43: =RC[-29] -> 0 | AS43: - | AT43: =RC[-30] -> 0 | AU43: =RC[-30] -> 0 | AV43: =RC[-30] -> 0.82399999999999995 | AW43: =RC[-30] -> 2.883 | AY43: - | AZ43: - | BA43: -
A44: =IF(RC[1]="","",DATEVALUE(RC[1])) ->  | C44: 24 | J44: =RC[-5]-RC[-2] -> #VALUE! | T44: =(RC[-16]*RC[-15]-RC[-13]*RC[-12])/1000 -> #VALUE! | W44: =RC[-2]*RC[-10]/1000 -> #VALUE! | X44: =ABS((RC[-3]*RC[-11]-RC[-2]*RC[-9])/1000) -> #VALUE! | Y44: =(RC[-14]-RC[1])/RC[-18]*100 -> #VALUE! | AC44: =VALUE(RC[-27]) -> #VALUE! | AD44: =IF(RC[21]=42,"*",IF(RC[21]=32,"",RC[21])) ->  | AE44: =RC[-28] -> 24 | AF44: =RC[-28] ->  | AG44: =RC[-28] ->  | AH44: =RC[-28] ->  | AI44: =RC[-28] ->  | AJ44: =RC[-28] ->  | AK44: =RC[-28] ->  | AL44: =RC[-28] -> #VALUE! | AM44: =RC[-28] ->  | AN44: =RC[-28] ->  | AO44: =RC[-28] ->  | AP44: - | AQ44: =RC[-29] -> 0 | AR44: =RC[-29] -> 0 | AS44: - | AT44: =RC[-30] -> 0 | AU44: =RC[-30] -> 0 | AV44: =RC[-30] ->  | AW44: =RC[-30] -> 
A45: =IF(RC[1]="","",DATEVALUE(RC[1])) ->  | C45: 24 | T45: =(RC[-16]*RC[-15]-RC[-13]*RC[-12])/1000 -> #VALUE! | W45: =RC[-2]*RC[-10]/1000 -> #VALUE! | X45: =ABS((RC[-3]*RC[-11]-RC[-2]*RC[-9])/1000) -> #VALUE! | Y45: =(RC[-14]-RC[1])/RC[-18]*100 -> #VALUE! | AC45: =VALUE(RC[-27]) -> #VALUE! | AD45: =IF(RC[21]=42,"*",IF(RC[21]=32,"",RC[21])) ->  | AE45: =RC[-28] -> 24 | AF45: =RC[-28] ->  | AG45: =RC[-28] ->  | AH45: =RC[-28] ->  | AI45: =RC[-28] ->  | AJ45: =RC[-28] ->  | AK45: =RC[-28] ->  | AL45: =RC[-28] -> 0 | AM45: =RC[-28] ->  | AN45: =RC[-28] ->  | AO45: =RC[-28] ->  | AP45: - | AQ45: =RC[-29] -> 0 | AR45: =RC[-29] -> 0 | AS45: - | AT45: =RC[-30] -> 0 | AU45: =RC[-30] -> 0 | AV45: =RC[-30] ->  | AW45: =RC[-30] -> 
A46: =IF(RC[1]="","",DATEVALUE(RC[1])) ->  | C46: 24 | T46: =(RC[-16]*RC[-15]-RC[-13]*RC[-12])/1000 -> #VALUE! | W46: =RC[-2]*RC[-10]/1000 -> #VALUE! | X46: =ABS((RC[-3]*RC[-11]-RC[-2]*RC[-9])/1000) -> #VALUE! | Y46: =(RC[-14]-RC[1])/RC[-18]*100 -> #VALUE! | AC46: =VALUE(RC[-27]) -> #VALUE! | AD46: =IF(RC[21]=42,"*",IF(RC[21]=32,"",RC[21])) ->  | AE46: =RC[-28] -> 24 | AF46: =RC[-28] ->  | AG46: =RC[-28] ->  | AH46: =RC[-28] ->  | AI46: =RC[-28] ->  | AJ46: =RC[-28] ->  | AK46: =RC[-28] ->  | AL46: =RC[-28] -> 0 | AM46: =RC[-28] ->  | AN46: =RC[-28] ->  | AO46: =RC[-28] ->  | AP46: - | AQ46: =RC[-29] -> 0 | AR46: =RC[-29] -> 0 | AS46: - | AT46: =RC[-30] -> 0 | AU46: =RC[-30] -> 0 | AV46: =RC[-30] ->  | AW46: =RC[-30] -> 
A47: =IF(RC[1]="","",DATEVALUE(RC[1])) ->  | C47: 24 | T47: =(RC[-16]*RC[-15]-RC[-13]*RC[-12])/1000 -> #VALUE! | W47: =RC[-2]*RC[-10]/1000 -> #VALUE! | X47: =ABS((RC[-3]*RC[-11]-RC[-2]*RC[-9])/1000) -> #VALUE! | Y47: =(RC[-14]-RC[1])/RC[-18]*100 -> #VALUE! | AC47: =VALUE(RC[-27]) -> #VALUE! | AD47: =IF(RC[21]=42,"*",IF(RC[21]=32,"",RC[21])) ->  | AE47: =RC[-28] -> 24 | AF47: =RC[-28] ->  | AG47: =RC[-28] ->  | AH47: =RC[-28] ->  | AI47: =RC[-28] ->  | AJ47: =RC[-28] ->  | AK47: =RC[-28] ->  | AL47: =RC[-28] -> 0 | AM47: =RC[-28] ->  | AN47: =RC[-28] ->  | AO47: =RC[-28] ->  | AP47: - | AQ47: =RC[-29] -> 0 | AR47: =RC[-29] -> 0 | AS47: - | AT47: =RC[-30] -> 0 | AU47: =RC[-30] -> 0 | AV47: =RC[-30] ->  | AW47: =RC[-30] -> 
A48: =IF(RC[1]="","",DATEVALUE(RC[1])) ->  | C48: 24 | T48: =(RC[-16]*RC[-15]-RC[-13]*RC[-12])/1000 -> #VALUE! | W48: =RC[-2]*RC[-10]/1000 -> #VALUE! | X48: =ABS((RC[-3]*RC[-11]-RC[-2]*RC[-9])/1000) -> #VALUE! | Y48: =(RC[-14]-RC[1])/RC[-18]*100 -> #VALUE! | AC48: =VALUE(RC[-27]) -> #VALUE! | AD48: =IF(RC[21]=42,"*",IF(RC[21]=32,"",RC[21])) ->  | AE48: =RC[-28] -> 24 | AF48: =RC[-28] ->  | AG48: =RC[-28] ->  | AH48: =RC[-28] ->  | AI48: =RC[-28] ->  | AJ48: =RC[-28] ->  | AK48: =RC[-28] ->  | AL48: =RC[-28] -> 0 | AM48: =RC[-28] ->  | AN48: =RC[-28] ->  | AO48: =RC[-28] ->  | AP48: - | AQ48: =RC[-29] -> 0 | AR48: =RC[-29] -> 0 | AS48: - | AT48: =RC[-30] -> 0 | AU48: =RC[-30] -> 0 | AV48: =RC[-30] ->  | AW48: =RC[-30] -> 
A49: =IF(RC[1]="","",DATEVALUE(RC[1])) ->  | C49: 24 | T49: =(RC[-16]*RC[-15]-RC[-13]*RC[-12])/1000 -> #VALUE! | W49: =RC[-2]*RC[-10]/1000 -> #VALUE! | X49: =ABS((RC[-3]*RC[-11]-RC[-2]*RC[-9])/1000) -> #VALUE! | Y49: =(RC[-14]-RC[1])/RC[-18]*100 -> #VALUE! | AC49: =VALUE(RC[-27]) -> #VALUE! | AD49: =IF(RC[21]=42,"*",IF(RC[21]=32,"",RC[21])) ->  | AE49: =RC[-28] -> 24 | AF49: =RC[-28] ->  | AG49: =RC[-28] ->  | AH49: =RC[-28] ->  | AI49: =RC[-28] ->  | AJ49: =RC[-28] ->  | AK49: =RC[-28] ->  | AL49: =RC[-28] -> 0 | AM49: =RC[-28] ->  | AN49: =RC[-28] ->  | AO49: =RC[-28] ->  | AP49: - | AQ49: =RC[-29] -> 0 | AR49: =RC[-29] -> 0 | AS49: - | AT49: =RC[-30] -> 0 | AU49: =RC[-30] -> 0 | AV49: =RC[-30] ->  | AW49: =RC[-30] -> 
A50: =IF(RC[1]="","",DATEVALUE(RC[1])) ->  | T50: =(RC[-16]*RC[-15]-RC[-13]*RC[-12])/1000 -> #VALUE! | W50: =RC[-2]*RC[-10]/1000 -> #VALUE! | X50: =ABS((RC[-3]*RC[-11]-RC[-2]*RC[-9])/1000) -> #VALUE! | Y50: =(RC[-14]-RC[1])/RC[-18]*100 -> #VALUE! | AC50: =VALUE(RC[-27]) -> #VALUE! | AD50: =IF(RC[21]=42,"*",IF(RC[21]=32,"",RC[21])) ->  | AE50: =RC[-28] ->  | AF50: =RC[-28] ->  | AG50: =RC[-28] ->  | AH50: =RC[-28] ->  | AI50: =RC[-28] ->  | AJ50: =RC[-28] ->  | AK50: =RC[-28] ->  | AL50: =RC[-28] -> 0 | AM50: =RC[-28] ->  | AN50: =RC[-28] ->  | AO50: =RC[-28] ->  | AP50: - | AQ50: =RC[-29] -> 0 | AR50: =RC[-29] -> 0 | AS50: - | AT50: =RC[-30] -> 0 | AU50: =RC[-30] -> 0 | AV50: =RC[-30] ->  | AW50: =RC[-30] -> 
A51: =IF(RC[1]="","",DATEVALUE(RC[1])) ->  | T51: =(RC[-16]*RC[-15]-RC[-13]*RC[-12])/1000 -> #VALUE! | W51: =RC[-2]*RC[-10]/1000 -> #VALUE! | X51: =ABS((RC[-3]*RC[-11]-RC[-2]*RC[-9])/1000) -> #VALUE! | Y51: =(RC[-14]-RC[1])/RC[-18]*100 -> #VALUE! | AC51: =VALUE(RC[-27]) -> #VALUE! | AD51: =IF(RC[21]=42,"*",IF(RC[21]=32,"",RC[21])) ->  | AE51: =RC[-28] ->  | AF51: =RC[-28] ->  | AG51: =RC[-28] ->  | AH51: =RC[-28] ->  | AI51: =RC[-28] ->  | AJ51: =RC[-28] ->  | AK51: =RC[-28] ->  | AL51: =RC[-28] -> 0 | AM51: =RC[-28] ->  | AN51: =RC[-28] ->  | AO51: =RC[-28] ->  | AP51: - | AQ51: =RC[-29] -> 0 | AR51: =RC[-29] -> 0 | AS51: - | AT51: =RC[-30] -> 0 | AU51: =RC[-30] -> 0 | AV51: =RC[-30] ->  | AW51: =RC[-30] -> 
A52: =IF(RC[1]="","",DATEVALUE(RC[1])) ->  | T52: =(RC[-16]*RC[-15]-RC[-13]*RC[-12])/1000 -> #VALUE! | W52: =RC[-2]*RC[-10]/1000 -> #VALUE! | X52: =ABS((RC[-3]*RC[-11]-RC[-2]*RC[-9])/1000) -> #VALUE! | Y52: =(RC[-14]-RC[1])/RC[-18]*100 -> #VALUE! | AC52: =VALUE(RC[-27]) -> #VALUE! | AD52: =IF(RC[21]=42,"*",IF(RC[21]=32,"",RC[21])) ->  | AE52: =RC[-28] ->  | AF52: =RC[-28] ->  | AG52: =RC[-28] ->  | AH52: =RC[-28] ->  | AI52: =RC[-28] ->  | AJ52: =RC[-28] ->  | AK52: =RC[-28] ->  | AL52: =RC[-28] -> 0 | AM52: =RC[-28] ->  | AN52: =RC[-28] ->  | AO52: =RC[-28] ->  | AP52: - | AQ52: =RC[-29] -> 0 | AR52: =RC[-29] -> 0 | AS52: - | AT52: =RC[-30] -> 0 | AU52: =RC[-30] -> 0 | AV52: =RC[-30] ->  | AW52: =RC[-30] -> 
A53: =IF(RC[1]="","",DATEVALUE(RC[1])) ->  | T53: =(RC[-16]*RC[-15]-RC[-13]*RC[-12])/1000 -> #VALUE! | W53: =RC[-2]*RC[-10]/1000 -> #VALUE! | X53: =ABS((RC[-3]*RC[-11]-RC[-2]*RC[-9])/1000) -> #VALUE! | Y53: =(RC[-14]-RC[1])/RC[-18]*100 -> #VALUE! | AC53: =VALUE(RC[-27]) -> #VALUE! | AD53: =IF(RC[21]=42,"*",IF(RC[21]=32,"",RC[21])) ->  | AE53: =RC[-28] ->  | AF53: =RC[-28] ->  | AG53: =RC[-28] ->  | AH53: =RC[-28] ->  | AI53: =RC[-28] ->  | AJ53: =RC[-28] ->  | AK53: =RC[-28] ->  | AL53: =RC[-28] -> 0 | AM53: =RC[-28] ->  | AN53: =RC[-28] ->  | AO53: =RC[-28] ->  | AP53: - | AQ53: =RC[-29] -> 0 | AR53: =RC[-29] -> 0 | AS53: - | AT53: =RC[-30] -> 0 | AU53: =RC[-30] -> 0 | AV53: =RC[-30] ->  | AW53: =RC[-30] -> 
A54: =IF(RC[1]="","",DATEVALUE(RC[1])) ->  | T54: =(RC[-16]*RC[-15]-RC[-13]*RC[-12])/1000 -> #VALUE! | W54: =RC[-2]*RC[-10]/1000 -> #VALUE! | X54: =ABS((RC[-3]*RC[-11]-RC[-2]*RC[-9])/1000) -> #VALUE! | Y54: =(RC[-14]-RC[1])/RC[-18]*100 -> #VALUE! | AC54: =VALUE(RC[-27]) -> #VALUE! | AD54: =IF(RC[21]=42,"*",IF(RC[21]=32,"",RC[21])) ->  | AE54: =RC[-28] ->  | AF54: =RC[-28] ->  | AG54: =RC[-28] ->  | AH54: =RC[-28] ->  | AI54: =RC[-28] ->  | AJ54: =RC[-28] ->  | AK54: =RC[-28] ->  | AL54: =RC[-28] -> 0 | AM54: =RC[-28] ->  | AN54: =RC[-28] ->  | AO54: =RC[-28] ->  | AP54: - | AQ54: =RC[-29] -> 0 | AR54: =RC[-29] -> 0 | AS54: - | AT54: =RC[-30] -> 0 | AU54: =RC[-30] -> 0 | AV54: =RC[-30] ->  | AW54: =RC[-30] -> 
A55: =IF(RC[1]="","",DATEVALUE(RC[1])) ->  | T55: =(RC[-16]*RC[-15]-RC[-13]*RC[-12])/1000 -> #VALUE! | W55: =RC[-2]*RC[-10]/1000 -> #VALUE! | X55: =ABS((RC[-3]*RC[-11]-RC[-2]*RC[-9])/1000) -> #VALUE! | Y55: =(RC[-14]-RC[1])/RC[-18]*100 -> #VALUE! | AC55: =VALUE(RC[-27]) -> #VALUE! | AD55: =IF(RC[21]=42,"*",IF(RC[21]=32,"",RC[21])) ->  | AE55: =RC[-28] ->  | AF55: =RC[-28] ->  | AG55: =RC[-28] ->  | AH55: =RC[-28] ->  | AI55: =RC[-28] ->  | AJ55: =RC[-28] ->  | AK55: =RC[-28] ->  | AL55: =RC[-28] -> 0 | AM55: =RC[-28] ->  | AN55: =RC[-28] ->  | AO55: =RC[-28] ->  | AP55: - | AQ55: =RC[-29] -> 0 | AR55: =RC[-29] -> 0 | AS55: - | AT55: =RC[-30] -> 0 | AU55: =RC[-30] -> 0 | AV55: =RC[-30] ->  | AW55: =RC[-30] -> 
A56: =IF(RC[1]="","",DATEVALUE(RC[1])) ->  | T56: =(RC[-16]*RC[-15]-RC[-13]*RC[-12])/1000 -> #VALUE! | W56: =RC[-2]*RC[-10]/1000 -> #VALUE! | X56: =ABS((RC[-3]*RC[-11]-RC[-2]*RC[-9])/1000) -> #VALUE! | Y56: =(RC[-14]-RC[1])/RC[-18]*100 -> #VALUE! | AC56: =VALUE(RC[-27]) -> #VALUE! | AD56: =IF(RC[21]=42,"*",IF(RC[21]=32,"",RC[21])) ->  | AE56: =RC[-28] ->  | AF56: =RC[-28] ->  | AG56: =RC[-28] ->  | AH56: =RC[-28] ->  | AI56: =RC[-28] ->  | AJ56: =RC[-28] ->  | AK56: =RC[-28] ->  | AL56: =RC[-28] -> 0 | AM56: =RC[-28] ->  | AN56: =RC[-28] ->  | AO56: =RC[-28] ->  | AP56: - | AQ56: =RC[-29] -> 0 | AR56: =RC[-29] -> 0 | AS56: - | AT56: =RC[-30] -> 0 | AU56: =RC[-30] -> 0 | AV56: =RC[-30] ->  | AW56: =RC[-30] -> 
A57: =IF(RC[1]="","",DATEVALUE(RC[1])) ->  | T57: =(RC[-16]*RC[-15]-RC[-13]*RC[-12])/1000 -> #VALUE! | W57: =RC[-2]*RC[-10]/1000 -> #VALUE! | X57: =ABS((RC[-3]*RC[-11]-RC[-2]*RC[-9])/1000) -> #VALUE! | Y57: =(RC[-14]-RC[1])/RC[-18]*100 -> #VALUE! | AC57: =VALUE(RC[-27]) -> #VALUE! | AD57: =IF(RC[21]=42,"*",IF(RC[21]=32,"",RC[21])) ->  | AE57: =RC[-28] ->  | AF57: =RC[-28] ->  | AG57: =RC[-28] ->  | AH57: =RC[-28] ->  | AI57: =RC[-28] ->  | AJ57: =RC[-28] ->  | AK57: =RC[-28] ->  | AL57: =RC[-28] -> 0 | AM57: =RC[-28] ->  | AN57: =RC[-28] ->  | AO57: =RC[-28] ->  | AP57: - | AQ57: =RC[-29] -> 0 | AR57: =RC[-29] -> 0 | AS57: - | AT57: =RC[-30] -> 0 | AU57: =RC[-30] -> 0 | AV57: =RC[-30] ->  | AW57: =RC[-30] -> 
A58: =IF(RC[1]="","",DATEVALUE(RC[1])) ->  | T58: =(RC[-16]*RC[-15]-RC[-13]*RC[-12])/1000 -> #VALUE! | W58: =RC[-2]*RC[-10]/1000 -> #VALUE! | X58: =ABS((RC[-3]*RC[-11]-RC[-2]*RC[-9])/1000) -> #VALUE! | Y58: =(RC[-14]-RC[1])/RC[-18]*100 -> #VALUE! | AC58: =VALUE(RC[-27]) -> #VALUE! | AD58: =IF(RC[21]=42,"*",IF(RC[21]=32,"",RC[21])) ->  | AE58: =RC[-28] ->  | AF58: =RC[-28] ->  | AG58: =RC[-28] ->  | AH58: =RC[-28] ->  | AI58: =RC[-28] ->  | AJ58: =RC[-28] ->  | AK58: =RC[-28] ->  | AL58: =RC[-28] -> 0 | AM58: =RC[-28] ->  | AN58: =RC[-28] ->  | AO58: =RC[-28] ->  | AP58: - | AQ58: =RC[-29] -> 0 | AR58: =RC[-29] -> 0 | AS58: - | AT58: =RC[-30] -> 0 | AU58: =RC[-30] -> 0 | AV58: =RC[-30] ->  | AW58: =RC[-30] -> 
A59: =IF(RC[1]="","",DATEVALUE(RC[1])) ->  | T59: =(RC[-16]*RC[-15]-RC[-13]*RC[-12])/1000 -> #VALUE! | W59: =RC[-2]*RC[-10]/1000 -> #VALUE! | X59: =ABS((RC[-3]*RC[-11]-RC[-2]*RC[-9])/1000) -> #VALUE! | Y59: =(RC[-14]-RC[1])/RC[-18]*100 -> #VALUE! | AC59: =VALUE(RC[-27]) -> #VALUE! | AD59: =IF(RC[21]=42,"*",IF(RC[21]=32,"",RC[21])) ->  | AE59: =RC[-28] ->  | AF59: =RC[-28] ->  | AG59: =RC[-28] ->  | AH59: =RC[-28] ->  | AI59: =RC[-28] ->  | AJ59: =RC[-28] ->  | AK59: =RC[-28] ->  | AL59: =RC[-28] -> 0 | AM59: =RC[-28] ->  | AN59: =RC[-28] ->  | AO59: =RC[-28] ->  | AP59: - | AQ59: =RC[-29] -> 0 | AR59: =RC[-29] -> 0 | AS59: - | AT59: =RC[-30] -> 0 | AU59: =RC[-30] -> 0 | AV59: =RC[-30] ->  | AW59: =RC[-30] -> 
A60: =IF(RC[1]="","",DATEVALUE(RC[1])) ->  | T60: =(RC[-16]*RC[-15]-RC[-13]*RC[-12])/1000 -> #VALUE! | W60: =RC[-2]*RC[-10]/1000 -> #VALUE! | X60: =ABS((RC[-3]*RC[-11]-RC[-2]*RC[-9])/1000) -> #VALUE! | Y60: =(RC[-14]-RC[1])/RC[-18]*100 -> #VALUE! | AC60: =VALUE(RC[-27]) -> #VALUE! | AD60: =IF(RC[21]=42,"*",IF(RC[21]=32,"",RC[21])) ->  | AE60: =RC[-28] ->  | AF60: =RC[-28] ->  | AG60: =RC[-28] ->  | AH60: =RC[-28] ->  | AI60: =RC[-28] ->  | AJ60: =RC[-28] ->  | AK60: =RC[-28] ->  | AL60: =RC[-28] -> 0 | AM60: =RC[-28] ->  | AN60: =RC[-28] ->  | AO60: =RC[-28] ->  | AP60: - | AQ60: =RC[-29] -> 0 | AR60: =RC[-29] -> 0 | AS60: - | AT60: =RC[-30] -> 0 | AU60: =RC[-30] -> 0 | AV60: =RC[-30] ->  | AW60: =RC[-30] -> 
A61: =IF(RC[1]="","",DATEVALUE(RC[1])) ->  | T61: =(RC[-16]*RC[-15]-RC[-13]*RC[-12])/1000 -> #VALUE! | W61: =RC[-2]*RC[-10]/1000 -> #VALUE! | X61: =ABS((RC[-3]*RC[-11]-RC[-2]*RC[-9])/1000) -> #VALUE! | Y61: =(RC[-14]-RC[1])/RC[-18]*100 -> #VALUE! | AC61: =VALUE(RC[-27]) -> #VALUE! | AD61: =IF(RC[21]=42,"*",IF(RC[21]=32,"",RC[21])) ->  | AE61: =RC[-28] ->  | AF61: =RC[-28] ->  | AG61: =RC[-28] ->  | AH61: =RC[-28] ->  | AI61: =RC[-28] ->  | AJ61: =RC[-28] ->  | AK61: =RC[-28] ->  | AL61: =RC[-28] -> 0 | AM61: =RC[-28] ->  | AN61: =RC[-28] ->  | AO61: =RC[-28] ->  | AP61: - | AQ61: =RC[-29] -> 0 | AR61: =RC[-29] -> 0 | AS61: - | AT61: =RC[-30] -> 0 | AU61: =RC[-30] -> 0 | AV61: =RC[-30] ->  | AW61: =RC[-30] -> 
A62: =IF(RC[1]="","",DATEVALUE(RC[1])) ->  | T62: =(RC[-16]*RC[-15]-RC[-13]*RC[-12])/1000 -> #VALUE! | W62: =RC[-2]*RC[-10]/1000 -> #VALUE! | X62: =ABS((RC[-3]*RC[-11]-RC[-2]*RC[-9])/1000) -> #VALUE! | Y62: =(RC[-14]-RC[1])/RC[-18]*100 -> #VALUE! | AC62: =VALUE(RC[-27]) -> #VALUE! | AD62: =IF(RC[21]=42,"*",IF(RC[21]=32,"",RC[21])) ->  | AE62: =RC[-28] ->  | AF62: =RC[-28] ->  | AG62: =RC[-28] ->  | AH62: =RC[-28] ->  | AI62: =RC[-28] ->  | AJ62: =RC[-28] ->  | AK62: =RC[-28] ->  | AL62: =RC[-28] -> 0 | AM62: =RC[-28] ->  | AN62: =RC[-28] ->  | AO62: =RC[-28] ->  | AP62: - | AQ62: =RC[-29] -> 0 | AR62: =RC[-29] -> 0 | AS62: - | AT62: =RC[-30] -> 0 | AU62: =RC[-30] -> 0 | AV62: =RC[-30] ->  | AW62: =RC[-30] -> 
A63: =IF(RC[1]="","",DATEVALUE(RC[1])) ->  | T63: =(RC[-16]*RC[-15]-RC[-13]*RC[-12])/1000 -> #VALUE! | W63: =RC[-2]*RC[-10]/1000 -> #VALUE! | X63: =ABS((RC[-3]*RC[-11]-RC[-2]*RC[-9])/1000) -> #VALUE! | Y63: =(RC[-14]-RC[1])/RC[-18]*100 -> #VALUE! | AC63: =VALUE(RC[-27]) -> #VALUE! | AD63: =IF(RC[21]=42,"*",IF(RC[21]=32,"",RC[21])) ->  | AE63: =RC[-28] ->  | AF63: =RC[-28] ->  | AG63: =RC[-28] ->  | AH63: =RC[-28] ->  | AI63: =RC[-28] ->  | AJ63: =RC[-28] ->  | AK63: =RC[-28] ->  | AL63: =RC[-28] -> 0 | AM63: =RC[-28] ->  | AN63: =RC[-28] ->  | AO63: =RC[-28] ->  | AP63: - | AQ63: =RC[-29] -> 0 | AR63: =RC[-29] -> 0 | AS63: - | AT63: =RC[-30] -> 0 | AU63: =RC[-30] -> 0 | AV63: =RC[-30] ->  | AW63: =RC[-30] -> 
A64: =IF(RC[1]="","",DATEVALUE(RC[1])) ->  | T64: =(RC[-16]*RC[-15]-RC[-13]*RC[-12])/1000 -> #VALUE! | W64: =RC[-2]*RC[-10]/1000 -> #VALUE! | X64: =ABS((RC[-3]*RC[-11]-RC[-2]*RC[-9])/1000) -> #VALUE! | Y64: =(RC[-14]-RC[1])/RC[-18]*100 -> #VALUE! | AC64: =VALUE(RC[-27]) -> #VALUE! | AD64: =IF(RC[21]=42,"*",IF(RC[21]=32,"",RC[21])) ->  | AE64: =RC[-28] ->  | AF64: =RC[-28] ->  | AG64: =RC[-28] ->  | AH64: =RC[-28] ->  | AI64: =RC[-28] ->  | AJ64: =RC[-28] ->  | AK64: =RC[-28] ->  | AL64: =RC[-28] -> 0 | AM64: =RC[-28] ->  | AN64: =RC[-28] ->  | AO64: =RC[-28] ->  | AP64: - | AQ64: =RC[-29] -> 0 | AR64: =RC[-29] -> 0 | AS64: - | AT64: =RC[-30] -> 0 | AU64: =RC[-30] -> 0 | AV64: =RC[-30] ->  | AW64: =RC[-30] -> 
A65: =IF(RC[1]="","",DATEVALUE(RC[1])) ->  | T65: =(RC[-16]*RC[-15]-RC[-13]*RC[-12])/1000 -> #VALUE! | W65: =RC[-2]*RC[-10]/1000 -> #VALUE! | X65: =ABS((RC[-3]*RC[-11]-RC[-2]*RC[-9])/1000) -> #VALUE! | Y65: =(RC[-14]-RC[1])/RC[-18]*100 -> #VALUE! | AC65: =VALUE(RC[-27]) -> #VALUE! | AD65: =IF(RC[21]=42,"*",IF(RC[21]=32,"",RC[21])) ->  | AE65: =RC[-28] ->  | AF65: =RC[-28] ->  | AG65: =RC[-28] ->  | AH65: =RC[-28] ->  | AI65: =RC[-28] ->  | AJ65: =RC[-28] ->  | AK65: =RC[-28] ->  | AL65: =RC[-28] -> 0 | AM65: =RC[-28] ->  | AN65: =RC[-28] ->  | AO65: =RC[-28] ->  | AP65: - | AQ65: =RC[-29] -> 0 | AR65: =RC[-29] -> 0 | AS65: - | AT65: =RC[-30] -> 0 | AU65: =RC[-30] -> 0 | AV65: =RC[-30] ->  | AW65: =RC[-30] -> 
A66: =IF(RC[1]="","",DATEVALUE(RC[1])) ->  | T66: =(RC[-16]*RC[-15]-RC[-13]*RC[-12])/1000 -> #VALUE! | W66: =RC[-2]*RC[-10]/1000 -> #VALUE! | X66: =ABS((RC[-3]*RC[-11]-RC[-2]*RC[-9])/1000) -> #VALUE! | Y66: =(RC[-14]-RC[1])/RC[-18]*100 -> #VALUE! | AC66: =VALUE(RC[-27]) -> #VALUE! | AD66: =IF(RC[21]=42,"*",IF(RC[21]=32,"",RC[21])) ->  | AE66: =RC[-28] ->  | AF66: =RC[-28] ->  | AG66: =RC[-28] ->  | AH66: =RC[-28] ->  | AI66: =RC[-28] ->  | AJ66: =RC[-28] ->  | AK66: =RC[-28] ->  | AL66: =RC[-28] -> 0 | AM66: =RC[-28] ->  | AN66: =RC[-28] ->  | AO66: =RC[-28] ->  | AP66: - | AQ66: =RC[-29] -> 0 | AR66: =RC[-29] -> 0 | AS66: - | AT66: =RC[-30] -> 0 | AU66: =RC[-30] -> 0 | AV66: =RC[-30] ->  | AW66: =RC[-30] -> 
A67: =IF(RC[1]="","",DATEVALUE(RC[1])) ->  | T67: =(RC[-16]*RC[-15]-RC[-13]*RC[-12])/1000 -> #VALUE! | W67: =RC[-2]*RC[-10]/1000 -> #VALUE! | X67: =ABS((RC[-3]*RC[-11]-RC[-2]*RC[-9])/1000) -> #VALUE! | Y67: =(RC[-14]-RC[1])/RC[-18]*100 -> #VALUE! | AC67: =VALUE(RC[-27]) -> #VALUE! | AD67: =IF(RC[21]=42,"*",IF(RC[21]=32,"",RC[21])) ->  | AE67: =RC[-28] ->  | AF67: =RC[-28] ->  | AG67: =RC[-28] ->  | AH67: =RC[-28] ->  | AI67: =RC[-28] ->  | AJ67: =RC[-28] ->  | AK67: =RC[-28] ->  | AL67: =RC[-28] -> 0 | AM67: =RC[-28] ->  | AN67: =RC[-28] ->  | AO67: =RC[-28] ->  | AP67: - | AQ67: =RC[-29] -> 0 | AR67: =RC[-29] -> 0 | AS67: - | AT67: =RC[-30] -> 0 | AU67: =RC[-30] -> 0 | AV67: =RC[-30] ->  | AW67: =RC[-30] -> 
A68: =IF(RC[1]="","",DATEVALUE(RC[1])) ->  | T68: =(RC[-16]*RC[-15]-RC[-13]*RC[-12])/1000 -> #VALUE! | W68: =RC[-2]*RC[-10]/1000 -> #VALUE! | X68: =ABS((RC[-3]*RC[-11]-RC[-2]*RC[-9])/1000) -> #VALUE! | Y68: =(RC[-14]-RC[1])/RC[-18]*100 -> #VALUE! | AC68: =VALUE(RC[-27]) -> #VALUE! | AD68: =IF(RC[21]=42,"*",IF(RC[21]=32,"",RC[21])) ->  | AE68: =RC[-28] ->  | AF68: =RC[-28] ->  | AG68: =RC[-28] ->  | AH68: =RC[-28] ->  | AI68: =RC[-28] ->  | AJ68: =RC[-28] ->  | AK68: =RC[-28] ->  | AL68: =RC[-28] -> 0 | AM68: =RC[-28] ->  | AN68: =RC[-28] ->  | AO68: =RC[-28] ->  | AP68: - | AQ68: =RC[-29] -> 0 | AR68: =RC[-29] -> 0 | AS68: - | AT68: =RC[-30] -> 0 | AU68: =RC[-30] -> 0 | AV68: =RC[-30] ->  | AW68: =RC[-30] -> 
A69: =IF(RC[1]="","",DATEVALUE(RC[1])) ->  | T69: =(RC[-16]*RC[-15]-RC[-13]*RC[-12])/1000 -> #VALUE! | W69: =RC[-2]*RC[-10]/1000 -> #VALUE! | X69: =ABS((RC[-3]*RC[-11]-RC[-2]*RC[-9])/1000) -> #VALUE! | Y69: =(RC[-14]-RC[1])/RC[-18]*100 -> #VALUE! | AC69: =VALUE(RC[-27]) -> #VALUE! | AD69: =IF(RC[21]=42,"*",IF(RC[21]=32,"",RC[21])) ->  | AE69: =RC[-28] ->  | AF69: =RC[-28] ->  | AG69: =RC[-28] ->  | AH69: =RC[-28] ->  | AI69: =RC[-28] ->  | AJ69: =RC[-28] ->  | AK69: =RC[-28] ->  | AL69: =RC[-28] -> 0 | AM69: =RC[-28] ->  | AN69: =RC[-28] ->  | AO69: =RC[-28] ->  | AP69: - | AQ69: =RC[-29] -> 0 | AR69: =RC[-29] -> 0 | AS69: - | AT69: =RC[-30] -> 0 | AU69: =RC[-30] -> 0 | AV69: =RC[-30] ->  | AW69: =RC[-30] -> 
A70: =IF(RC[1]="","",DATEVALUE(RC[1])) ->  | T70: =(RC[-16]*RC[-15]-RC[-13]*RC[-12])/1000 -> #VALUE! | W70: =RC[-2]*RC[-10]/1000 -> #VALUE! | X70: =ABS((RC[-3]*RC[-11]-RC[-2]*RC[-9])/1000) -> #VALUE! | Y70: =(RC[-14]-RC[1])/RC[-18]*100 -> #VALUE! | AC70: =VALUE(RC[-27]) -> #VALUE! | AD70: =IF(RC[21]=42,"*",IF(RC[21]=32,"",RC[21])) ->  | AE70: =RC[-28] ->  | AF70: =RC[-28] ->  | AG70: =RC[-28] ->  | AH70: =RC[-28] ->  | AI70: =RC[-28] ->  | AJ70: =RC[-28] ->  | AK70: =RC[-28] ->  | AL70: =RC[-28] -> 0 | AM70: =RC[-28] ->  | AN70: =RC[-28] ->  | AO70: =RC[-28] ->  | AP70: - | AQ70: =RC[-29] -> 0 | AR70: =RC[-29] -> 0 | AS70: - | AT70: =RC[-30] -> 0 | AU70: =RC[-30] -> 0 | AV70: =RC[-30] ->  | AW70: =RC[-30] -> 
A71: =IF(RC[1]="","",DATEVALUE(RC[1])) ->  | T71: =(RC[-16]*RC[-15]-RC[-13]*RC[-12])/1000 -> #VALUE! | W71: =RC[-2]*RC[-10]/1000 -> #VALUE! | X71: =ABS((RC[-3]*RC[-11]-RC[-2]*RC[-9])/1000) -> #VALUE! | Y71: =(RC[-14]-RC[1])/RC[-18]*100 -> #VALUE! | AC71: =VALUE(RC[-27]) -> #VALUE! | AD71: =IF(RC[21]=42,"*",IF(RC[21]=32,"",RC[21])) ->  | AE71: =RC[-28] ->  | AF71: =RC[-28] ->  | AG71: =RC[-28] ->  | AH71: =RC[-28] ->  | AI71: =RC[-28] ->  | AJ71: =RC[-28] ->  | AK71: =RC[-28] ->  | AL71: =RC[-28] -> 0 | AM71: =RC[-28] ->  | AN71: =RC[-28] ->  | AO71: =RC[-28] ->  | AP71: - | AQ71: =RC[-29] -> 0 | AR71: =RC[-29] -> 0 | AS71: - | AT71: =RC[-30] -> 0 | AU71: =RC[-30] -> 0 | AV71: =RC[-30] ->  | AW71: =RC[-30] -> 
A72: =IF(RC[1]="","",DATEVALUE(RC[1])) ->  | T72: =(RC[-16]*RC[-15]-RC[-13]*RC[-12])/1000 -> #VALUE! | W72: =RC[-2]*RC[-10]/1000 -> #VALUE! | X72: =ABS((RC[-3]*RC[-11]-RC[-2]*RC[-9])/1000) -> #VALUE! | Y72: =(RC[-14]-RC[1])/RC[-18]*100 -> #VALUE! | AC72: =VALUE(RC[-27]) -> #VALUE! | AD72: =IF(RC[21]=42,"*",IF(RC[21]=32,"",RC[21])) ->  | AE72: =RC[-28] ->  | AF72: =RC[-28] ->  | AG72: =RC[-28] ->  | AH72: =RC[-28] ->  | AI72: =RC[-28] ->  | AJ72: =RC[-28] ->  | AK72: =RC[-28] ->  | AL72: =RC[-28] -> 0 | AM72: =RC[-28] ->  | AN72: =RC[-28] ->  | AO72: =RC[-28] ->  | AP72: - | AQ72: =RC[-29] -> 0 | AR72: =RC[-29] -> 0 | AS72: - | AT72: =RC[-30] -> 0 | AU72: =RC[-30] -> 0 | AV72: =RC[-30] ->  | AW72: =RC[-30] -> 
A73: =IF(RC[1]="","",DATEVALUE(RC[1])) ->  | T73: =(RC[-16]*RC[-15]-RC[-13]*RC[-12])/1000 -> #VALUE! | W73: =RC[-2]*RC[-10]/1000 -> #VALUE! | X73: =ABS((RC[-3]*RC[-11]-RC[-2]*RC[-9])/1000) -> #VALUE! | Y73: =(RC[-14]-RC[1])/RC[-18]*100 -> #VALUE! | AC73: =VALUE(RC[-27]) -> #VALUE! | AD73: =IF(RC[21]=42,"*",IF(RC[21]=32,"",RC[21])) ->  | AE73: =RC[-28] ->  | AF73: =RC[-28] ->  | AG73: =RC[-28] ->  | AH73: =RC[-28] ->  | AI73: =RC[-28] ->  | AJ73: =RC[-28] ->  | AK73: =RC[-28] ->  | AL73: =RC[-28] -> 0 | AM73: =RC[-28] ->  | AN73: =RC[-28] ->  | AO73: =RC[-28] ->  | AP73: - | AQ73: =RC[-29] -> 0 | AR73: =RC[-29] -> 0 | AS73: - | AT73: =RC[-30] -> 0 | AU73: =RC[-30] -> 0 | AV73: =RC[-30] ->  | AW73: =RC[-30] -> 
A74: =IF(RC[1]="","",DATEVALUE(RC[1])) ->  | T74: =(RC[-16]*RC[-15]-RC[-13]*RC[-12])/1000 -> #VALUE! | W74: =RC[-2]*RC[-10]/1000 -> #VALUE! | X74: =ABS((RC[-3]*RC[-11]-RC[-2]*RC[-9])/1000) -> #VALUE! | Y74: =(RC[-14]-RC[1])/RC[-18]*100 -> #VALUE! | AC74: =VALUE(RC[-27]) -> #VALUE! | AD74: =IF(RC[21]=42,"*",IF(RC[21]=32,"",RC[21])) ->  | AE74: =RC[-28] ->  | AF74: =RC[-28] ->  | AG74: =RC[-28] ->  | AH74: =RC[-28] ->  | AI74: =RC[-28] ->  | AJ74: =RC[-28] ->  | AK74: =RC[-28] ->  | AL74: =RC[-28] -> 0 | AM74: =RC[-28] ->  | AN74: =RC[-28] ->  | AO74: =RC[-28] ->  | AP74: - | AQ74: =RC[-29] -> 0 | AR74: =RC[-29] -> 0 | AS74: - | AT74: =RC[-30] -> 0 | AU74: =RC[-30] -> 0 | AV74: =RC[-30] ->  | AW74: =RC[-30] -> 
A75: =IF(RC[1]="","",DATEVALUE(RC[1])) ->  | T75: =(RC[-16]*RC[-15]-RC[-13]*RC[-12])/1000 -> #VALUE! | W75: =RC[-2]*RC[-10]/1000 -> #VALUE! | X75: =ABS((RC[-3]*RC[-11]-RC[-2]*RC[-9])/1000) -> #VALUE! | Y75: =(RC[-14]-RC[1])/RC[-18]*100 -> #VALUE! | AC75: =VALUE(RC[-27]) -> #VALUE! | AD75: =IF(RC[21]=42,"*",IF(RC[21]=32,"",RC[21])) ->  | AE75: =RC[-28] ->  | AF75: =RC[-28] ->  | AG75: =RC[-28] ->  | AH75: =RC[-28] ->  | AI75: =RC[-28] ->  | AJ75: =RC[-28] ->  | AK75: =RC[-28] ->  | AL75: =RC[-28] -> 0 | AM75: =RC[-28] ->  | AN75: =RC[-28] ->  | AO75: =RC[-28] ->  | AP75: - | AQ75: =RC[-29] -> 0 | AR75: =RC[-29] -> 0 | AS75: - | AT75: =RC[-30] -> 0 | AU75: =RC[-30] -> 0 | AV75: =RC[-30] ->  | AW75: =RC[-30] -> 
A76: =IF(RC[1]="","",DATEVALUE(RC[1])) ->  | T76: =(RC[-16]*RC[-15]-RC[-13]*RC[-12])/1000 -> #VALUE! | W76: =RC[-2]*RC[-10]/1000 -> #VALUE! | X76: =ABS((RC[-3]*RC[-11]-RC[-2]*RC[-9])/1000) -> #VALUE! | Y76: =(RC[-14]-RC[1])/RC[-18]*100 -> #VALUE! | AC76: =VALUE(RC[-27]) -> #VALUE! | AD76: =IF(RC[21]=42,"*",IF(RC[21]=32,"",RC[21])) ->  | AE76: =RC[-28] ->  | AF76: =RC[-28] ->  | AG76: =RC[-28] ->  | AH76: =RC[-28] ->  | AI76: =RC[-28] ->  | AJ76: =RC[-28] ->  | AK76: =RC[-28] ->  | AL76: =RC[-28] -> 0 | AM76: =RC[-28] ->  | AN76: =RC[-28] ->  | AO76: =RC[-28] ->  | AP76: - | AQ76: =RC[-29] -> 0 | AR76: =RC[-29] -> 0 | AS76: - | AT76: =RC[-30] -> 0 | AU76: =RC[-30] -> 0 | AV76: =RC[-30] ->  | AW76: =RC[-30] -> 
A77: =IF(RC[1]="","",DATEVALUE(RC[1])) ->  | T77: =(RC[-16]*RC[-15]-RC[-13]*RC[-12])/1000 -> #VALUE! | W77: =RC[-2]*RC[-10]/1000 -> #VALUE! | X77: =ABS((RC[-3]*RC[-11]-RC[-2]*RC[-9])/1000) -> #VALUE! | Y77: =(RC[-14]-RC[1])/RC[-18]*100 -> #VALUE! | AC77: =VALUE(RC[-27]) -> #VALUE! | AD77: =IF(RC[21]=42,"*",IF(RC[21]=32,"",RC[21])) ->  | AE77: =RC[-28] ->  | AF77: =RC[-28] ->  | AG77: =RC[-28] ->  | AH77: =RC[-28] ->  | AI77: =RC[-28] ->  | AJ77: =RC[-28] ->  | AK77: =RC[-28] ->  | AL77: =RC[-28] -> 0 | AM77: =RC[-28] ->  | AN77: =RC[-28] ->  | AO77: =RC[-28] ->  | AP77: - | AQ77: =RC[-29] -> 0 | AR77: =RC[-29] -> 0 | AS77: - | AT77: =RC[-30] -> 0 | AU77: =RC[-30] -> 0 | AV77: =RC[-30] ->  | AW77: =RC[-30] -> 
A78: =IF(RC[1]="","",DATEVALUE(RC[1])) ->  | T78: =(RC[-16]*RC[-15]-RC[-13]*RC[-12])/1000 -> #VALUE! | W78: =RC[-2]*RC[-10]/1000 -> #VALUE! | X78: =ABS((RC[-3]*RC[-11]-RC[-2]*RC[-9])/1000) -> #VALUE! | Y78: =(RC[-14]-RC[1])/RC[-18]*100 -> #VALUE! | AC78: =VALUE(RC[-27]) -> #VALUE! | AD78: =IF(RC[21]=42,"*",IF(RC[21]=32,"",RC[21])) ->  | AE78: =RC[-28] ->  | AF78: =RC[-28] ->  | AG78: =RC[-28] ->  | AH78: =RC[-28] ->  | AI78: =RC[-28] ->  | AJ78: =RC[-28] ->  | AK78: =RC[-28] ->  | AL78: =RC[-28] -> 0 | AM78: =RC[-28] ->  | AN78: =RC[-28] ->  | AO78: =RC[-28] ->  | AP78: - | AQ78: =RC[-29] -> 0 | AR78: =RC[-29] -> 0 | AS78: - | AT78: =RC[-30] -> 0 | AU78: =RC[-30] -> 0 | AV78: =RC[-30] ->  | AW78: =RC[-30] -> 
A79: =IF(RC[1]="","",DATEVALUE(RC[1])) ->  | T79: =(RC[-16]*RC[-15]-RC[-13]*RC[-12])/1000 -> #VALUE! | W79: =RC[-2]*RC[-10]/1000 -> #VALUE! | X79: =ABS((RC[-3]*RC[-11]-RC[-2]*RC[-9])/1000) -> #VALUE! | Y79: =(RC[-14]-RC[1])/RC[-18]*100 -> #VALUE! | AC79: =VALUE(RC[-27]) -> #VALUE! | AD79: =IF(RC[21]=42,"*",IF(RC[21]=32,"",RC[21])) ->  | AE79: =RC[-28] ->  | AF79: =RC[-28] ->  | AG79: =RC[-28] ->  | AH79: =RC[-28] ->  | AI79: =RC[-28] ->  | AJ79: =RC[-28] ->  | AK79: =RC[-28] ->  | AL79: =RC[-28] -> 0 | AM79: =RC[-28] ->  | AN79: =RC[-28] ->  | AO79: =RC[-28] ->  | AP79: - | AQ79: =RC[-29] -> 0 | AR79: =RC[-29] -> 0 | AS79: - | AT79: =RC[-30] -> 0 | AU79: =RC[-30] -> 0 | AV79: =RC[-30] ->  | AW79: =RC[-30] -> 
A80: =IF(RC[1]="","",DATEVALUE(RC[1])) ->  | T80: =(RC[-16]*RC[-15]-RC[-13]*RC[-12])/1000 -> #VALUE! | W80: =RC[-2]*RC[-10]/1000 -> #VALUE! | X80: =ABS((RC[-3]*RC[-11]-RC[-2]*RC[-9])/1000) -> #VALUE! | Y80: =(RC[-14]-RC[1])/RC[-18]*100 -> #VALUE! | AC80: =VALUE(RC[-27]) -> #VALUE! | AD80: =IF(RC[21]=42,"*",IF(RC[21]=32,"",RC[21])) ->  | AE80: =RC[-28] ->  | AF80: =RC[-28] ->  | AG80: =RC[-28] ->  | AH80: =RC[-28] ->  | AI80: =RC[-28] ->  | AJ80: =RC[-28] ->  | AK80: =RC[-28] ->  | AL80: =RC[-28] -> 0 | AM80: =RC[-28] ->  | AN80: =RC[-28] ->  | AO80: =RC[-28] ->  | AP80: - | AQ80: =RC[-29] -> 0 | AR80: =RC[-29] -> 0 | AS80: - | AT80: =RC[-30] -> 0 | AU80: =RC[-30] -> 0 | AV80: =RC[-30] ->  | AW80: =RC[-30] -> 
A81: =IF(RC[1]="","",DATEVALUE(RC[1])) ->  | T81: =(RC[-16]*RC[-15]-RC[-13]*RC[-12])/1000 -> #VALUE! | W81: =RC[-2]*RC[-10]/1000 -> #VALUE! | X81: =ABS((RC[-3]*RC[-11]-RC[-2]*RC[-9])/1000) -> #VALUE! | Y81: =(RC[-14]-RC[1])/RC[-18]*100 -> #VALUE! | AC81: =VALUE(RC[-27]) -> #VALUE! | AD81: =IF(RC[21]=42,"*",IF(RC[21]=32,"",RC[21])) ->  | AE81: =RC[-28] ->  | AF81: =RC[-28] ->  | AG81: =RC[-28] ->  | AH81: =RC[-28] ->  | AI81: =RC[-28] ->  | AJ81: =RC[-28] ->  | AK81: =RC[-28] ->  | AL81: =RC[-28] -> 0 | AM81: =RC[-28] ->  | AN81: =RC[-28] ->  | AO81: =RC[-28] ->  | AP81: - | AQ81: =RC[-29] -> 0 | AR81: =RC[-29] -> 0 | AS81: - | AT81: =RC[-30] -> 0 | AU81: =RC[-30] -> 0 | AV81: =RC[-30] ->  | AW81: =RC[-30] -> 
A82: =IF(RC[1]="","",DATEVALUE(RC[1])) ->  | T82: =(RC[-16]*RC[-15]-RC[-13]*RC[-12])/1000 -> #VALUE! | W82: =RC[-2]*RC[-10]/1000 -> #VALUE! | X82: =ABS((RC[-3]*RC[-11]-RC[-2]*RC[-9])/1000) -> #VALUE! | Y82: =(RC[-14]-RC[1])/RC[-18]*100 -> #VALUE! | AC82: =VALUE(RC[-27]) -> #VALUE! | AD82: =IF(RC[21]=42,"*",IF(RC[21]=32,"",RC[21])) ->  | AE82: =RC[-28] ->  | AF82: =RC[-28] ->  | AG82: =RC[-28] ->  | AH82: =RC[-28] ->  | AI82: =RC[-28] ->  | AJ82: =RC[-28] ->  | AK82: =RC[-28] ->  | AL82: =RC[-28] -> 0 | AM82: =RC[-28] ->  | AN82: =RC[-28] ->  | AO82: =RC[-28] ->  | AP82: - | AQ82: =RC[-29] -> 0 | AR82: =RC[-29] -> 0 | AS82: - | AT82: =RC[-30] -> 0 | AU82: =RC[-30] -> 0 | AV82: =RC[-30] ->  | AW82: =RC[-30] -> 
A83: =IF(RC[1]="","",DATEVALUE(RC[1])) ->  | T83: =(RC[-16]*RC[-15]-RC[-13]*RC[-12])/1000 -> #VALUE! | W83: =RC[-2]*RC[-10]/1000 -> #VALUE! | X83: =ABS((RC[-3]*RC[-11]-RC[-2]*RC[-9])/1000) -> #VALUE! | Y83: =(RC[-14]-RC[1])/RC[-18]*100 -> #VALUE! | AC83: =VALUE(RC[-27]) -> #VALUE! | AD83: =IF(RC[21]=42,"*",IF(RC[21]=32,"",RC[21])) ->  | AE83: =RC[-28] ->  | AF83: =RC[-28] ->  | AG83: =RC[-28] ->  | AH83: =RC[-28] ->  | AI83: =RC[-28] ->  | AJ83: =RC[-28] ->  | AK83: =RC[-28] ->  | AL83: =RC[-28] -> 0 | AM83: =RC[-28] ->  | AN83: =RC[-28] ->  | AO83: =RC[-28] ->  | AP83: - | AQ83: =RC[-29] -> 0 | AR83: =RC[-29] -> 0 | AS83: - | AT83: =RC[-30] -> 0 | AU83: =RC[-30] -> 0 | AV83: =RC[-30] ->  | AW83: =RC[-30] -> 
AC84: Среднее | AF84: =R[1]C[-28] -> 93.984111111111091 | AG84: =R[1]C[-28] -> 67.544000000000011 | AH84: =R[1]C[-28] -> 7.4000000000000039 | AI84: =R[1]C[-28] -> 82.02755555555558 | AJ84: =R[1]C[-28] -> 39.482555555555557 | AK84: =R[1]C[-28] -> 5.5 | AL84: =R[1]C[-28] -> 28.061444444444444 | AM84: =R[1]C[-28] -> 11.956555555555555 | AN84: =R[1]C[-28] -> 12.239333333333333 | AO84: =R[1]C[-28] -> 67.095666666666659 | AP84: - | AQ84: =R[1]C[-29] -> 0 | AR84: =R[1]C[-29] -> 0 | AS84: - | AT84: =R[1]C[-30] -> 0 | AU84: =R[1]C[-30] -> 0
B85: Среднее | D85: =AVERAGE(OFFSET(R[-74]C,3,0,R7C1,1)) -> 93.984111111111091 | E85: =AVERAGE(OFFSET(R[-74]C,3,0,R7C1,1)) -> 67.544000000000011 | F85: =AVERAGE(OFFSET(R[-74]C,3,0,R7C1,1)) -> 7.4000000000000039 | G85: =AVERAGE(OFFSET(R[-74]C,3,0,R7C1,1)) -> 82.02755555555558 | H85: =AVERAGE(OFFSET(R[-74]C,3,0,R7C1,1)) -> 39.482555555555557 | I85: =AVERAGE(OFFSET(R[-74]C,3,0,R7C1,1)) -> 5.5 | J85: =AVERAGE(OFFSET(R[-74]C,3,0,R7C1,1)) -> 28.061444444444444 | K85: =AVERAGE(OFFSET(R[-74]C,3,0,R7C1,1)) -> 11.956555555555555 | L85: =IF(SUM(OFFSET(R[-74]C,3,0,R7C1,1))=0,"",AVERAGE(OFFSET(R[-74]C,3,0,R7C1,1))) -> 12.239333333333333 | M85: =IF(SUM(OFFSET(R[-74]C,3,0,R7C1,1))=0,"",AVERAGE(OFFSET(R[-74]C,3,0,R7C1,1))) -> 67.095666666666659 | R85: =IF(SUM(OFFSET(R[-74]C,3,0,R7C1,1))=0,"",AVERAGE(OFFSET(R[-74]C,3,0,R7C1,1))) -> 0.80433333333333334 | S85: =AVERAGE(OFFSET(R[-74]C,3,0,R7C1,1)) -> 2.8496926948148156 | T85: =AVERAGE(OFFSET(R[-74]C,3,0,R7C1,1)) -> 2.8717159514814821 | W85: =AVERAGE(OFFSET(R[-74]C,3,0,R7C1,1)) -> 0.80483840666666662 | X85: =AVERAGE(OFFSET(R[-74]C,3,0,R7C1,1)) -> #VALUE! | AC85: Итого | AE85: =R[1]C[-28] -> 720 | AF85: =R[1]C[-28] -> 2819.5233333333326 | AI85: =R[1]C[-28] -> 2460.8266666666673 | AM85: =R[1]C[-28] -> 358.69666666666666 | AN85: =R[1]C[-28] -> 367.18 | AQ85: =R[1]C[-29] -> 0 | AU85: =R[1]C[-30] -> 0 | AV85: =R[1]C[-30] -> 24.13 | AW85: =R[1]C[-30] -> 85.490780844444473
B86: ИТОГО: | C86: =SUM(OFFSET(R[-75]C,3,0,R7C1,1)) -> 720 | D86: =SUM(OFFSET(R[-75]C,3,0,R7C1,1)) -> 2819.5233333333326 | G86: =SUM(OFFSET(R[-75]C,3,0,R7C1,1)) -> 2460.8266666666673 | K86: =SUM(OFFSET(R[-75]C,3,0,R7C1,1)) -> 358.69666666666666 | L86: =IF(SUM(OFFSET(R[-75]C,3,0,R7C1,1))=0,"",SUM(OFFSET(R[-75]C,3,0,R7C1,1))) -> 367.18 | R86: =IF(SUM(OFFSET(R[-75]C,3,0,R7C1,1))=0,"",SUM(OFFSET(R[-75]C,3,0,R7C1,1))) -> 24.13 | S86: =SUM(OFFSET(R[-75]C,3,0,R7C1,1)) -> 85.490780844444473 | T86: =SUM(OFFSET(R[-75]C,3,0,R7C1,1)) -> 86.151478544444458 | W86: =SUM(OFFSET(R[-75]C,3,0,R7C1,1)) -> 24.145152199999998 | X86: =SUM(OFFSET(R[-75]C,3,0,R7C1,1)) -> #VALUE!
AC87: Досчёт | AF87: =R[1]C[-28] -> 0 | AI87: =R[1]C[-28] -> 0 | AM87: =R[1]C[-28] -> 0 | AN87: =R[1]C[-28] -> 0 | AQ87: =R[1]C[-29] -> 0 | AU87: =R[1]C[-30] -> 0 | AV87: =R[1]C[-30] -> 0 | AW87: =R[1]C[-30] -> 0
A88: 11дн=264ч 4дн=96ч | B88: Досчёт до конца м-ца (+) | C88: =R6C1*24 -> 216 | T88: № 27633 | AC88: Снятие | AF88: =-R[1]C[-28] -> 0 | AI88: =-R[1]C[-28] -> 0 | AM88: =-R[1]C[-28] -> 0 | AN88: =-R[1]C[-28] -> 0 | AQ88: =-R[1]C[-29] -> 0 | AU88: =-R[1]C[-30] -> 0 | AV88: =-R[1]C[-30] -> 0 | AW88: =-R[1]C[-30] -> 0
A89: 9дн=216ч 7дн=168ч | B89: Вычет с предыдущего (-) | C89: =R4C1*24 -> 192 | AC89: Сумма | AF89: =R[1]C[-28] -> 2819.5233333333326 | AI89: =R[1]C[-28] -> 2460.8266666666673 | AM89: =R[1]C[-28] -> 358.69666666666666 | AN89: =R[1]C[-28] -> 367.18 | AQ89: =R[1]C[-29] -> 0 | AU89: =R[1]C[-30] -> 0 | AV89: =R[1]C[-30] -> 24.13 | AW89: =R[1]C[-30] -> 85.490780844444473
B90: СУММА: | C90: =R[-4]C+R[-2]C-R[-1]C -> 744 | D90: =R[-4]C+R[-2]C-R[-1]C -> 2819.5233333333326 | G90: =R[-4]C+R[-2]C-R[-1]C -> 2460.8266666666673 | K90: =R[-4]C+R[-2]C-R[-1]C -> 358.69666666666666 | L90: =IF(SUM(OFFSET(R[-79]C,3,0,R7C1,1))=0,"",(R[-4]C+R[-2]C-R[-1]C)) -> 367.18 | R90: =IF(SUM(OFFSET(R[-79]C,3,0,R7C1,1))=0,"",(R[-4]C+R[-2]C-R[-1]C)) -> 24.13 | S90: =R[-4]C+R[-2]C-R[-1]C -> 85.490780844444473
AC91: Тхв на источнике | AE91: V гвс (м3) | AF91: =R[-2]C[15] -> 0 | AG91: W гвс (Гкал) | AH91: =RC[-2]*0.06 -> 0 | AI91: W без гвс (Гкал) | AJ91: =R[-2]C[13]-RC[-2] -> 85.490780844444473
B92: Показания счетчиков на момент снятия данных:
B93: Дата, время | D93: М1, т | F93: М2, т | H93: М3, т | J93: М4, т | L93: Qо, Гкал | N93: Qг, Гкал | P93: время, час
B94: 23.09.18 05:00 | D94: 55545.86 | F94: 47850.93 | H94: 11373.93 | J94: - | L94: 1979.78 | N94: 795.18 | P94: -
B95: 23.10.18 04:00 | D95: 58422.95 | F95: 50268.42 | H95: 11733.75 | J95: - | L95: 2072.2649999999999 | N95: 819.30100000000004 | P95: -
AC97: =ZAYAVKA_N -> с 28.09.18г по 03.10.18г, с 20.10.18г по 21.10.18г некорректная работа приборов
B98: Представитель потребителя:_______________________________________________________________________ В.О. Топорков
I101: Рекомендуемые значения по параметрам теплопотребления (не являются официально утверждёнными)
I102: М, т | J102: V, м3 | K102: Qгвс, Гкал | L102: Qотоп, Гкал | M102: Qо, Гкал
I103: =R[-13]C[-3] -> 0 | J103: =RC[-1]/0.98 -> 0 | K103: =RC[-1]*0.06 -> 0 | L103: =RC[1]-RC[-1] -> 24.13 | M103: =R[-13]C[5] -> 24.13
O105: ДЛЯ САМОКОНТРОЛЯ
B106: В строке выбора дат указать период с 16.7.13 по 23.8.13 - жильё | N106: Q | O106: Qг
B107: В строке выбора дат указать период с 18.7.13 по 25.8.13 - не жилое | N107: =(R[-21]C[-10]*R[-22]C[-7]-R[-21]C[-9]*R[-22]C[-6])/1000 -> 231.2786068651852 | O107: =IF(R[-22]C[-2]="",R[-21]C[-3]*R[-22]C/1000,"") ->  | P107: Си2
O108: =IF(R[-23]C[-2]="","",((R[-22]C[-3]*R[-23]C)-(R[-22]C[-2]*R[-23]C[2]))/1000) -> 0 | P108: Си3